drop table if exists t1;
CREATE TABLE t1 (c1 BIGINT PRIMARY KEY AUTO_INCREMENT, c2 VARCHAR(10)) ENGINE=InnoDB;
INSERT INTO t1 VALUES (9223372036854775807, null);
INSERT INTO t1 (c2) VALUES ('innodb');
Got one of the listed errors
SELECT * FROM t1;
c1	c2
9223372036854775807	NULL
DROP TABLE t1;
CREATE TABLE t1 (c1 TINYINT PRIMARY KEY AUTO_INCREMENT, c2 VARCHAR(10)) ENGINE=InnoDB;
INSERT INTO t1 VALUES (127, null);
INSERT INTO t1 (c2) VALUES ('innodb');
Got one of the listed errors
SELECT * FROM t1;
c1	c2
127	NULL
DROP TABLE t1;
CREATE TABLE t1 (c1 TINYINT UNSIGNED PRIMARY KEY AUTO_INCREMENT, c2 VARCHAR(10)) ENGINE=InnoDB;
INSERT INTO t1 VALUES (255, null);
INSERT INTO t1 (c2) VALUES ('innodb');
Got one of the listed errors
SELECT * FROM t1;
c1	c2
255	NULL
DROP TABLE t1;
CREATE TABLE t1 (c1 SMALLINT PRIMARY KEY AUTO_INCREMENT, c2 VARCHAR(10)) ENGINE=InnoDB;
INSERT INTO t1 VALUES (32767, null);
INSERT INTO t1 (c2) VALUES ('innodb');
Got one of the listed errors
SELECT * FROM t1;
c1	c2
32767	NULL
DROP TABLE t1;
CREATE TABLE t1 (c1 SMALLINT UNSIGNED PRIMARY KEY AUTO_INCREMENT, c2 VARCHAR(10)) ENGINE=InnoDB;
INSERT INTO t1 VALUES (65535, null);
INSERT INTO t1 (c2) VALUES ('innodb');
Got one of the listed errors
SELECT * FROM t1;
c1	c2
65535	NULL
DROP TABLE t1;
CREATE TABLE t1 (c1 MEDIUMINT PRIMARY KEY AUTO_INCREMENT, c2 VARCHAR(10)) ENGINE=InnoDB;
INSERT INTO t1 VALUES (8388607, null);
INSERT INTO t1 (c2) VALUES ('innodb');
Got one of the listed errors
SELECT * FROM t1;
c1	c2
8388607	NULL
DROP TABLE t1;
CREATE TABLE t1 (c1 MEDIUMINT UNSIGNED PRIMARY KEY AUTO_INCREMENT, c2 VARCHAR(10)) ENGINE=InnoDB;
INSERT INTO t1 VALUES (16777215, null);
INSERT INTO t1 (c2) VALUES ('innodb');
Got one of the listed errors
SELECT * FROM t1;
c1	c2
16777215	NULL
DROP TABLE t1;
CREATE TABLE t1 (c1 INT PRIMARY KEY AUTO_INCREMENT, c2 VARCHAR(10)) ENGINE=InnoDB;
INSERT INTO t1 VALUES (2147483647, null);
INSERT INTO t1 (c2) VALUES ('innodb');
Got one of the listed errors
SELECT * FROM t1;
c1	c2
2147483647	NULL
DROP TABLE t1;
CREATE TABLE t1 (c1 INT UNSIGNED PRIMARY KEY AUTO_INCREMENT, c2 VARCHAR(10)) ENGINE=InnoDB;
INSERT INTO t1 VALUES (4294967295, null);
INSERT INTO t1 (c2) VALUES ('innodb');
Got one of the listed errors
SELECT * FROM t1;
c1	c2
4294967295	NULL
DROP TABLE t1;
CREATE TABLE t1 (c1 BIGINT PRIMARY KEY AUTO_INCREMENT, c2 VARCHAR(10)) ENGINE=InnoDB;
INSERT INTO t1 VALUES (9223372036854775807, null);
INSERT INTO t1 (c2) VALUES ('innodb');
Got one of the listed errors
SELECT * FROM t1;
c1	c2
9223372036854775807	NULL
DROP TABLE t1;
CREATE TABLE t1 (c1 BIGINT UNSIGNED PRIMARY KEY AUTO_INCREMENT, c2 VARCHAR(10)) ENGINE=InnoDB;
INSERT INTO t1 VALUES (18446744073709551615, null);
INSERT INTO t1 (c2) VALUES ('innodb');
Got one of the listed errors
SELECT * FROM t1;
c1	c2
18446744073709551615	NULL
DROP TABLE t1;
CREATE TABLE t1(c1 INT PRIMARY KEY AUTO_INCREMENT) ENGINE=InnoDB;
INSERT INTO t1 VALUES (1), (2), (3);
INSERT INTO t1 VALUES (NULL), (NULL), (NULL);
SELECT c1 FROM t1;
c1
1
2
3
4
5
6
SHOW CREATE TABLE t1;
Table	Create Table
t1	CREATE TABLE `t1` (
  `c1` int(11) NOT NULL AUTO_INCREMENT,
  PRIMARY KEY (`c1`)
) ENGINE=InnoDB AUTO_INCREMENT=7 DEFAULT CHARSET=latin1
TRUNCATE TABLE t1;
SHOW CREATE TABLE t1;
Table	Create Table
t1	CREATE TABLE `t1` (
  `c1` int(11) NOT NULL AUTO_INCREMENT,
  PRIMARY KEY (`c1`)
) ENGINE=InnoDB DEFAULT CHARSET=latin1
INSERT INTO t1 VALUES (1), (2), (3);
INSERT INTO t1 VALUES (NULL), (NULL), (NULL);
SELECT c1 FROM t1;
c1
1
2
3
4
5
6
SHOW CREATE TABLE t1;
Table	Create Table
t1	CREATE TABLE `t1` (
  `c1` int(11) NOT NULL AUTO_INCREMENT,
  PRIMARY KEY (`c1`)
) ENGINE=InnoDB AUTO_INCREMENT=7 DEFAULT CHARSET=latin1
DROP TABLE t1;
CREATE TABLE t1(c1 INT PRIMARY KEY AUTO_INCREMENT) ENGINE=InnoDB;
INSERT INTO t1 VALUES (1), (2), (3);
INSERT INTO t1 VALUES (NULL), (NULL), (NULL);
SELECT c1 FROM t1;
c1
1
2
3
4
5
6
SHOW CREATE TABLE t1;
Table	Create Table
t1	CREATE TABLE `t1` (
  `c1` int(11) NOT NULL AUTO_INCREMENT,
  PRIMARY KEY (`c1`)
) ENGINE=InnoDB AUTO_INCREMENT=7 DEFAULT CHARSET=latin1
DELETE FROM t1;
SHOW CREATE TABLE t1;
Table	Create Table
t1	CREATE TABLE `t1` (
  `c1` int(11) NOT NULL AUTO_INCREMENT,
  PRIMARY KEY (`c1`)
) ENGINE=InnoDB AUTO_INCREMENT=7 DEFAULT CHARSET=latin1
INSERT INTO t1 VALUES (1), (2), (3);
INSERT INTO t1 VALUES (NULL), (NULL), (NULL);
SELECT c1 FROM t1;
c1
1
2
3
7
8
9
SHOW CREATE TABLE t1;
Table	Create Table
t1	CREATE TABLE `t1` (
  `c1` int(11) NOT NULL AUTO_INCREMENT,
  PRIMARY KEY (`c1`)
) ENGINE=InnoDB AUTO_INCREMENT=10 DEFAULT CHARSET=latin1
DROP TABLE t1;
DROP TABLE IF EXISTS t1;
Warnings:
Note	1051	Unknown table 't1'
CREATE TABLE t1 (c1 INT AUTO_INCREMENT, c2 INT, PRIMARY KEY(c1)) ENGINE=InnoDB;
INSERT INTO t1 VALUES (NULL, 1);
DELETE FROM t1 WHERE c1 = 1;
INSERT INTO t1 VALUES (2,1);
INSERT INTO t1 VALUES (NULL,8);
SELECT * FROM t1;
c1	c2
2	1
3	8
DROP TABLE t1;
DROP TABLE IF EXISTS t1;
Warnings:
Note	1051	Unknown table 't1'
CREATE TABLE t1 (c1 INT AUTO_INCREMENT, c2 INT, PRIMARY KEY(c1)) ENGINE=InnoDB;
INSERT INTO t1 VALUES (NULL, 1);
DELETE FROM t1 WHERE c1 = 1;
INSERT INTO t1 VALUES (2,1), (NULL, 8);
INSERT INTO t1 VALUES (NULL,9);
SELECT * FROM t1;
c1	c2
2	1
3	8
5	9
DROP TABLE t1;
SET @@SESSION.AUTO_INCREMENT_INCREMENT=100, @@SESSION.AUTO_INCREMENT_OFFSET=10;
SHOW VARIABLES LIKE "%auto_inc%";
Variable_name	Value
auto_increment_increment	100
auto_increment_offset	10
DROP TABLE IF EXISTS t1;
Warnings:
Note	1051	Unknown table 't1'
CREATE TABLE t1 (c1 INT AUTO_INCREMENT, PRIMARY KEY(c1)) ENGINE=InnoDB;
INSERT INTO t1 VALUES (NULL),(5),(NULL);
INSERT INTO t1 VALUES (250),(NULL);
SELECT * FROM t1;
c1
5
10
110
250
310
INSERT INTO t1 VALUES (1000);
SET @@INSERT_ID=400;
INSERT INTO t1 VALUES(NULL),(NULL);
SELECT * FROM t1;
c1
5
10
110
250
310
400
410
1000
DROP TABLE t1;
SET @@SESSION.AUTO_INCREMENT_INCREMENT=1, @@SESSION.AUTO_INCREMENT_OFFSET=1;
SET @@INSERT_ID=1;
SHOW VARIABLES LIKE "%auto_inc%";
Variable_name	Value
auto_increment_increment	1
auto_increment_offset	1
DROP TABLE IF EXISTS t1;
Warnings:
Note	1051	Unknown table 't1'
CREATE TABLE t1 (c1 INT AUTO_INCREMENT, PRIMARY KEY(c1)) ENGINE=InnoDB;
INSERT INTO t1 VALUES(0);
SELECT * FROM t1;
c1
1
SET @@SESSION.AUTO_INCREMENT_INCREMENT=100, @@SESSION.AUTO_INCREMENT_OFFSET=10;
INSERT INTO t1 VALUES (-1), (NULL),(2),(NULL);
INSERT INTO t1 VALUES (250),(NULL);
SELECT * FROM t1;
c1
-1
1
2
10
110
250
410
SET @@INSERT_ID=400;
INSERT INTO t1 VALUES(NULL),(NULL);
Got one of the listed errors
SELECT * FROM t1;
c1
-1
1
2
10
110
250
410
DROP TABLE t1;
SET @@SESSION.AUTO_INCREMENT_INCREMENT=1, @@SESSION.AUTO_INCREMENT_OFFSET=1;
SET @@INSERT_ID=1;
SHOW VARIABLES LIKE "%auto_inc%";
Variable_name	Value
auto_increment_increment	1
auto_increment_offset	1
DROP TABLE IF EXISTS t1;
Warnings:
Note	1051	Unknown table 't1'
CREATE TABLE t1 (c1 INT AUTO_INCREMENT, PRIMARY KEY(c1)) ENGINE=InnoDB;
INSERT INTO t1 VALUES(-1);
SELECT * FROM t1;
c1
-1
SET @@SESSION.AUTO_INCREMENT_INCREMENT=100, @@SESSION.AUTO_INCREMENT_OFFSET=10;
SHOW VARIABLES LIKE "%auto_inc%";
Variable_name	Value
auto_increment_increment	100
auto_increment_offset	10
INSERT INTO t1 VALUES (-2), (NULL),(2),(NULL);
INSERT INTO t1 VALUES (250),(NULL);
SELECT * FROM t1;
c1
-2
-1
1
2
10
250
310
INSERT INTO t1 VALUES (1000);
SET @@INSERT_ID=400;
INSERT INTO t1 VALUES(NULL),(NULL);
SELECT * FROM t1;
c1
-2
-1
1
2
10
250
310
400
410
1000
DROP TABLE t1;
SET @@SESSION.AUTO_INCREMENT_INCREMENT=1, @@SESSION.AUTO_INCREMENT_OFFSET=1;
SET @@INSERT_ID=1;
SHOW VARIABLES LIKE "%auto_inc%";
Variable_name	Value
auto_increment_increment	1
auto_increment_offset	1
DROP TABLE IF EXISTS t1;
Warnings:
Note	1051	Unknown table 't1'
CREATE TABLE t1 (c1 INT UNSIGNED AUTO_INCREMENT, PRIMARY KEY(c1)) ENGINE=InnoDB;
INSERT INTO t1 VALUES(-1);
Warnings:
Warning	1264	Out of range value for column 'c1' at row 1
SELECT * FROM t1;
c1
1
SET @@SESSION.AUTO_INCREMENT_INCREMENT=100, @@SESSION.AUTO_INCREMENT_OFFSET=10;
SHOW VARIABLES LIKE "%auto_inc%";
Variable_name	Value
auto_increment_increment	100
auto_increment_offset	10
INSERT INTO t1 VALUES (-2);
Warnings:
Warning	1264	Out of range value for column 'c1' at row 1
INSERT INTO t1 VALUES (NULL);
INSERT INTO t1 VALUES (2);
INSERT INTO t1 VALUES (NULL);
INSERT INTO t1 VALUES (250);
INSERT INTO t1 VALUES (NULL);
SELECT * FROM t1;
c1
1
2
10
110
210
250
310
INSERT INTO t1 VALUES (1000);
SET @@INSERT_ID=400;
INSERT INTO t1 VALUES(NULL);
INSERT INTO t1 VALUES(NULL);
SELECT * FROM t1;
c1
1
2
10
110
210
250
310
400
1000
1010
DROP TABLE t1;
SET @@SESSION.AUTO_INCREMENT_INCREMENT=1, @@SESSION.AUTO_INCREMENT_OFFSET=1;
SET @@INSERT_ID=1;
SHOW VARIABLES LIKE "%auto_inc%";
Variable_name	Value
auto_increment_increment	1
auto_increment_offset	1
DROP TABLE IF EXISTS t1;
Warnings:
Note	1051	Unknown table 't1'
CREATE TABLE t1 (c1 INT UNSIGNED AUTO_INCREMENT, PRIMARY KEY(c1)) ENGINE=InnoDB;
INSERT INTO t1 VALUES(-1);
Warnings:
Warning	1264	Out of range value for column 'c1' at row 1
SELECT * FROM t1;
c1
1
SET @@SESSION.AUTO_INCREMENT_INCREMENT=100, @@SESSION.AUTO_INCREMENT_OFFSET=10;
SHOW VARIABLES LIKE "%auto_inc%";
Variable_name	Value
auto_increment_increment	100
auto_increment_offset	10
INSERT INTO t1 VALUES (-2),(NULL),(2),(NULL);
Warnings:
Warning	1264	Out of range value for column 'c1' at row 1
INSERT INTO t1 VALUES (250),(NULL);
SELECT * FROM t1;
c1
1
2
10
110
210
250
410
INSERT INTO t1 VALUES (1000);
SET @@INSERT_ID=400;
INSERT INTO t1 VALUES(NULL),(NULL);
Got one of the listed errors
SELECT * FROM t1;
c1
1
2
10
110
210
250
410
1000
DROP TABLE t1;
SET @@SESSION.AUTO_INCREMENT_INCREMENT=1, @@SESSION.AUTO_INCREMENT_OFFSET=1;
SET @@INSERT_ID=1;
SHOW VARIABLES LIKE "%auto_inc%";
Variable_name	Value
auto_increment_increment	1
auto_increment_offset	1
DROP TABLE IF EXISTS t1;
Warnings:
Note	1051	Unknown table 't1'
CREATE TABLE t1 (c1 BIGINT AUTO_INCREMENT, PRIMARY KEY(c1)) ENGINE=InnoDB;
INSERT INTO t1 VALUES(NULL);
INSERT INTO t1 VALUES (9223372036854775794);
SELECT * FROM t1;
c1
1
9223372036854775794
SET @@SESSION.AUTO_INCREMENT_INCREMENT=2, @@SESSION.AUTO_INCREMENT_OFFSET=10;
SHOW VARIABLES LIKE "%auto_inc%";
Variable_name	Value
auto_increment_increment	2
auto_increment_offset	10
INSERT INTO t1 VALUES (NULL),(NULL),(NULL),(NULL),(NULL),(NULL);
SELECT * FROM t1;
c1
1
9223372036854775794
9223372036854775796
9223372036854775798
9223372036854775800
9223372036854775802
9223372036854775804
9223372036854775806
DROP TABLE t1;
SET @@SESSION.AUTO_INCREMENT_INCREMENT=1, @@SESSION.AUTO_INCREMENT_OFFSET=1;
SET @@INSERT_ID=1;
SHOW VARIABLES LIKE "%auto_inc%";
Variable_name	Value
auto_increment_increment	1
auto_increment_offset	1
DROP TABLE IF EXISTS t1;
Warnings:
Note	1051	Unknown table 't1'
CREATE TABLE t1 (c1 BIGINT UNSIGNED AUTO_INCREMENT, PRIMARY KEY(c1)) ENGINE=InnoDB;
INSERT INTO t1 VALUES(NULL);
INSERT INTO t1 VALUES (18446744073709551603);
SELECT * FROM t1;
c1
1
18446744073709551603
SET @@SESSION.AUTO_INCREMENT_INCREMENT=2, @@SESSION.AUTO_INCREMENT_OFFSET=10;
SHOW VARIABLES LIKE "%auto_inc%";
Variable_name	Value
auto_increment_increment	2
auto_increment_offset	10
INSERT INTO t1 VALUES (NULL),(NULL),(NULL),(NULL),(NULL),(NULL),(NULL);
SELECT * FROM t1;
c1
0
1
18446744073709551603
18446744073709551604
18446744073709551606
18446744073709551608
18446744073709551610
18446744073709551612
18446744073709551614
DROP TABLE t1;
SET @@SESSION.AUTO_INCREMENT_INCREMENT=1, @@SESSION.AUTO_INCREMENT_OFFSET=1;
SET @@INSERT_ID=1;
SHOW VARIABLES LIKE "%auto_inc%";
Variable_name	Value
auto_increment_increment	1
auto_increment_offset	1
DROP TABLE IF EXISTS t1;
Warnings:
Note	1051	Unknown table 't1'
CREATE TABLE t1 (c1 BIGINT UNSIGNED AUTO_INCREMENT, PRIMARY KEY(c1)) ENGINE=InnoDB;
INSERT INTO t1 VALUES(NULL);
INSERT INTO t1 VALUES (18446744073709551603);
SELECT * FROM t1;
c1
1
18446744073709551603
SET @@SESSION.AUTO_INCREMENT_INCREMENT=5, @@SESSION.AUTO_INCREMENT_OFFSET=7;
SHOW VARIABLES LIKE "%auto_inc%";
Variable_name	Value
auto_increment_increment	5
auto_increment_offset	7
INSERT INTO t1 VALUES (NULL),(NULL), (NULL);
Got one of the listed errors
SELECT * FROM t1;
c1
1
18446744073709551603
DROP TABLE t1;
SET @@SESSION.AUTO_INCREMENT_INCREMENT=1, @@SESSION.AUTO_INCREMENT_OFFSET=1;
SET @@INSERT_ID=1;
SHOW VARIABLES LIKE "%auto_inc%";
Variable_name	Value
auto_increment_increment	1
auto_increment_offset	1
DROP TABLE IF EXISTS t1;
Warnings:
Note	1051	Unknown table 't1'
CREATE TABLE t1 (c1 BIGINT AUTO_INCREMENT, PRIMARY KEY(c1)) ENGINE=InnoDB;
INSERT INTO t1 VALUES(NULL);
INSERT INTO t1 VALUES(-9223372036854775806);
INSERT INTO t1 VALUES(-9223372036854775807);
INSERT INTO t1 VALUES(-9223372036854775808);
SELECT * FROM t1;
c1
-9223372036854775808
-9223372036854775807
-9223372036854775806
1
SET @@SESSION.AUTO_INCREMENT_INCREMENT=3, @@SESSION.AUTO_INCREMENT_OFFSET=3;
SHOW VARIABLES LIKE "%auto_inc%";
Variable_name	Value
auto_increment_increment	3
auto_increment_offset	3
INSERT INTO t1 VALUES (NULL),(NULL), (NULL);
SELECT * FROM t1;
c1
-9223372036854775808
-9223372036854775807
-9223372036854775806
1
3
6
9
DROP TABLE t1;
SET @@SESSION.AUTO_INCREMENT_INCREMENT=1, @@SESSION.AUTO_INCREMENT_OFFSET=1;
SET @@INSERT_ID=1;
SHOW VARIABLES LIKE "%auto_inc%";
Variable_name	Value
auto_increment_increment	1
auto_increment_offset	1
DROP TABLE IF EXISTS t1;
Warnings:
Note	1051	Unknown table 't1'
CREATE TABLE t1 (c1 BIGINT UNSIGNED AUTO_INCREMENT, PRIMARY KEY(c1)) ENGINE=InnoDB;
INSERT INTO t1 VALUES(NULL);
INSERT INTO t1 VALUES (18446744073709551610);
SELECT * FROM t1;
c1
1
18446744073709551610
SET @@SESSION.AUTO_INCREMENT_INCREMENT=1152921504606846976, @@SESSION.AUTO_INCREMENT_OFFSET=1152921504606846976;
Warnings:
Warning	1292	Truncated incorrect auto_increment_increment value: '1152921504606846976'
Warning	1292	Truncated incorrect auto_increment_offset value: '1152921504606846976'
SHOW VARIABLES LIKE "%auto_inc%";
Variable_name	Value
auto_increment_increment	65535
auto_increment_offset	65535
INSERT INTO t1 VALUES (NULL),(NULL), (NULL);
SELECT * FROM t1;
c1
1
65534
65535
18446744073709551610
18446744073709551615
DROP TABLE t1;
