drop table if exists t1, t2;
== Connected to server1 ==
set GLOBAL query_cache_type=on;
Warnings:
Warning	1287	'@@query_cache_type' is deprecated and will be removed in a future release.
set GLOBAL query_cache_size=1355776;
Warnings:
Warning	1287	'@@query_cache_size' is deprecated and will be removed in a future release.
set GLOBAL ndb_cache_check_time=1;
Warnings:
Warning	1681	'@@ndb_cache_check_time' is deprecated and will be removed in a future release.
reset query cache;
Warnings:
Warning	1681	'RESET QUERY CACHE' is deprecated and will be removed in a future release.
flush status;
== Connected to server2 ==
set GLOBAL query_cache_type=on;
Warnings:
Warning	1287	'@@query_cache_type' is deprecated and will be removed in a future release.
set GLOBAL query_cache_size=1355776;
Warnings:
Warning	1287	'@@query_cache_size' is deprecated and will be removed in a future release.
set GLOBAL ndb_cache_check_time=1;
Warnings:
Warning	1681	'@@ndb_cache_check_time' is deprecated and will be removed in a future release.
reset query cache;
Warnings:
Warning	1681	'RESET QUERY CACHE' is deprecated and will be removed in a future release.
flush status;
== Connected to server1 ==
create table t1 (a int) engine=ndbcluster;
create table t2 (a int) engine=ndbcluster;
insert into t1 value (2);
insert into t2 value (3);
select * from t1;
a
2
select a != 3 from t1;
a != 3
1
select * from t2;
a
3
show status like "Qcache_queries_in_cache";
Variable_name	Value
Qcache_queries_in_cache	3
show status like "Qcache_inserts";
Variable_name	Value
Qcache_inserts	3
show status like "Qcache_hits";
Variable_name	Value
Qcache_hits	0
== Connected to server2 ==
show status like "Qcache_queries_in_cache";
Variable_name	Value
Qcache_queries_in_cache	0
show status like "Qcache_inserts";
Variable_name	Value
Qcache_inserts	0
show status like "Qcache_hits";
Variable_name	Value
Qcache_hits	0
select * from t1;
a
2
show status like "Qcache_queries_in_cache";
Variable_name	Value
Qcache_queries_in_cache	1
show status like "Qcache_inserts";
Variable_name	Value
Qcache_inserts	1
show status like "Qcache_hits";
Variable_name	Value
Qcache_hits	0
update t1 set a=3 where a=2;
== Connected to server1 ==
select * from t1;
a
3
show status like "Qcache_queries_in_cache";
Variable_name	Value
Qcache_queries_in_cache	3
drop table t1, t2;
set GLOBAL query_cache_size=0;
Warnings:
Warning	1287	'@@query_cache_size' is deprecated and will be removed in a future release.
set GLOBAL ndb_cache_check_time=0;
Warnings:
Warning	1681	'@@ndb_cache_check_time' is deprecated and will be removed in a future release.
reset query cache;
Warnings:
Warning	1681	'RESET QUERY CACHE' is deprecated and will be removed in a future release.
flush status;
set GLOBAL query_cache_size=0;
Warnings:
Warning	1287	'@@query_cache_size' is deprecated and will be removed in a future release.
set GLOBAL ndb_cache_check_time=0;
Warnings:
Warning	1681	'@@ndb_cache_check_time' is deprecated and will be removed in a future release.
reset query cache;
Warnings:
Warning	1681	'RESET QUERY CACHE' is deprecated and will be removed in a future release.
flush status;
