DROP TABLE IF EXISTS t1;
set @val = "0123456789ABCDEF0123456789ABCDEF0123456789ABCDEF0123456789ABCDEF0123456789ABCDEF0123456789ABCDEF0123456789ABCDEF0123456789ABCDEF0123456789ABCDEF0123456789ABCDEF";
set @val2 = 0x0123456789ABCDEF0123456789ABCDEF0123456789ABCDEF0123456789ABCDEF0123456789ABCDEF0123456789ABCDEF0123456789ABCDEF0123456789ABCDEF0123456789ABCDEF0123456789ABCDEF;
CREATE TABLE t1 (
pk INT NOT NULL PRIMARY KEY AUTO_INCREMENT,
attr1 VARCHAR(1024),
attr2 VARBINARY(1024),
attr3 TEXT
) ROW_FORMAT=DYNAMIC ENGINE=ndbcluster;
CREATE UNIQUE INDEX ui on t1(pk,attr1,attr2);
select count(*) from t1;
count(*)
10000
delete from t1 where pk < 1000 order by pk;
delete from t1 where pk < 2000 order by pk;
delete from t1 where pk < 3000 order by pk;
delete from t1 where pk < 4000 order by pk;
delete from t1 where pk < 5000 order by pk;
delete from t1 where pk < 6000 order by pk;
delete from t1 where pk < 7000 order by pk;
delete from t1 where pk < 7500 order by pk;
select data_length from information_schema.tables where table_name like 't1' into @data_length;
set ndb_optimization_delay = 0;
optimize table t1;
Table	Op	Msg_type	Msg_text
test.t1	optimize	status	OK
select data_length from information_schema.tables where table_name like 't1' into @data_length2;
select 100*(@data_length-@data_length2)/@data_length into @opt_level;
select @opt_level > 30;
@opt_level > 30
1
drop table t1;
