INSTALL COMPONENT "file://component_udf_reg_only_3_func";
INSTALL COMPONENT "file://component_udf_reg_int_func";
ERROR HY000: Initialization method provided by component 'mysql:test_udf_registration' failed.
SELECT * FROM performance_schema.user_defined_functions
WHERE (udf_name LIKE 'myfunc%') or (udf_name LIKE 'avgcost%')
ORDER BY udf_name;
UDF_NAME	UDF_RETURN_TYPE	UDF_TYPE	UDF_LIBRARY	UDF_USAGE_COUNT
avgcost	double	aggregate	NULL	1
myfunc_double	double	function	NULL	1
myfunc_int	integer	function	NULL	1
select myfunc_double();
ERROR HY000: Can't initialize function 'myfunc_double'; myfunc_double must have at least one argument
select myfunc_double(1);
myfunc_double(1)
49.00
select myfunc_double(78654);
myfunc_double(78654)
54.00
select myfunc_int();
myfunc_int()
0
select myfunc_int(5);
myfunc_int(5)
5
select myfunc_int('MySQL V8.0');
myfunc_int('MySQL V8.0')
10
SELECT udf_name,udf_usage_count FROM performance_schema.user_defined_functions
WHERE udf_name= 'myfunc_int'
  ORDER BY udf_name;
udf_name	udf_usage_count
myfunc_int	1
CREATE TABLE t1(a INT, b INT);
INSERT INTO t1 values (1,1),(2,2);
SELECT myfunc_int(a AS attr_name) FROM t1;
myfunc_int(a AS attr_name)
1
2
drop table t1;
create table t1(sum int, price float(24));
insert into t1 values(100, 50.00), (100, 100.00);
select avgcost(price) from t1;
ERROR HY000: Can't initialize function 'avgcost'; wrong number of arguments: AVGCOST() requires two arguments
select avgcost(sum, price) from t1;
avgcost(sum, price)
75.0000
delete from t1;
insert into t1 values(100, 54.33), (200, 199.99);
select avgcost(sum, price) from t1;
avgcost(sum, price)
151.4367
drop table t1;
# remove the plugin
INSTALL COMPONENT "file://component_udf_unreg_3_func";
select myfunc_double(1);
ERROR 42000: FUNCTION test.myfunc_double does not exist
select myfunc_int(5);
ERROR 42000: FUNCTION test.myfunc_int does not exist
INSTALL COMPONENT "file://component_udf_reg_int_func";
SELECT * FROM performance_schema.user_defined_functions
WHERE (udf_name LIKE 'myfunc%') or (udf_name LIKE 'avgcost%')
ORDER BY udf_name;
UDF_NAME	UDF_RETURN_TYPE	UDF_TYPE	UDF_LIBRARY	UDF_USAGE_COUNT
myfunc_int	integer	function	NULL	1
SELECT * FROM mysql.func;
name	ret	dl	type
SELECT component_urn FROM mysql.component;
component_urn
file://component_udf_reg_only_3_func
file://component_udf_unreg_3_func
file://component_udf_reg_int_func
select myfunc_double(1);
ERROR 42000: FUNCTION test.myfunc_double does not exist
select myfunc_int(5);
myfunc_int(5)
5
INSTALL COMPONENT "file://component_udf_reg_real_func";
SELECT * FROM performance_schema.user_defined_functions
WHERE (udf_name LIKE 'myfunc%') or (udf_name LIKE 'avgcost%')
ORDER BY udf_name;
UDF_NAME	UDF_RETURN_TYPE	UDF_TYPE	UDF_LIBRARY	UDF_USAGE_COUNT
myfunc_double	double	function	NULL	1
myfunc_int	integer	function	NULL	1
SELECT * FROM mysql.func;
name	ret	dl	type
select myfunc_double(1);
myfunc_double(1)
49.00
select myfunc_int(5);
myfunc_int(5)
5
UNINSTALL COMPONENT "file://component_udf_reg_real_func";
SELECT * FROM performance_schema.user_defined_functions
WHERE (udf_name LIKE 'myfunc%') or (udf_name LIKE 'avgcost%')
ORDER BY udf_name;
UDF_NAME	UDF_RETURN_TYPE	UDF_TYPE	UDF_LIBRARY	UDF_USAGE_COUNT
myfunc_int	integer	function	NULL	1
SELECT component_urn FROM mysql.component;
component_urn
file://component_udf_reg_only_3_func
file://component_udf_unreg_3_func
file://component_udf_reg_int_func
UNINSTALL COMPONENT "file://component_udf_reg_only_3_func";
SELECT * FROM performance_schema.user_defined_functions
WHERE (udf_name LIKE 'myfunc%') or (udf_name LIKE 'avgcost%')
ORDER BY udf_name;
UDF_NAME	UDF_RETURN_TYPE	UDF_TYPE	UDF_LIBRARY	UDF_USAGE_COUNT
myfunc_int	integer	function	NULL	1
SELECT component_urn FROM mysql.component;
component_urn
file://component_udf_unreg_3_func
file://component_udf_reg_int_func
UNINSTALL COMPONENT "file://component_udf_unreg_3_func";
SELECT * FROM performance_schema.user_defined_functions
WHERE (udf_name LIKE 'myfunc%') or (udf_name LIKE 'avgcost%')
ORDER BY udf_name;
UDF_NAME	UDF_RETURN_TYPE	UDF_TYPE	UDF_LIBRARY	UDF_USAGE_COUNT
myfunc_int	integer	function	NULL	1
SELECT component_urn FROM mysql.component;
component_urn
file://component_udf_reg_int_func
UNINSTALL COMPONENT "file://component_udf_reg_int_func";
SELECT * FROM performance_schema.user_defined_functions
WHERE (udf_name LIKE 'myfunc%') or (udf_name LIKE 'avgcost%')
ORDER BY udf_name;
UDF_NAME	UDF_RETURN_TYPE	UDF_TYPE	UDF_LIBRARY	UDF_USAGE_COUNT
SELECT component_urn FROM mysql.component;
component_urn
