set binlog_format=statement;
RESET MASTER;
select count(*) > 0 from performance_schema.SETUP_INSTRUMENTS;
count(*) > 0
1
update performance_schema.SETUP_INSTRUMENTS set enabled='NO'
  where name like "wait/synch/rwlock/%";
Warnings:
Note	1592	Statement may not be safe to log in statement format.
select count(*) > 0 from performance_schema.EVENTS_WAITS_CURRENT;
count(*) > 0
1
drop table if exists test.t1;
drop table if exists test.t2;
create table test.t1 (thread_id integer);
create table test.t2 (name varchar(128));
insert into test.t1
select thread_id from performance_schema.EVENTS_WAITS_CURRENT;
Warnings:
Note	1592	Statement may not be safe to log in statement format.
insert into test.t2
select name from performance_schema.SETUP_INSTRUMENTS
where name like "wait/synch/rwlock/%";
Warnings:
Note	1592	Statement may not be safe to log in statement format.
drop table test.t1;
drop table test.t2;
update performance_schema.SETUP_INSTRUMENTS set enabled='YES'
  where name like "wait/synch/rwlock/%";
Warnings:
Note	1592	Statement may not be safe to log in statement format.
show binlog events from <binlog_start>;
Log_name	Pos	Event_type	Server_id	End_log_pos	Info
master-bin.000001	#	Query	#	#	use `test`; update performance_schema.SETUP_INSTRUMENTS set enabled='NO'
  where name like "wait/synch/rwlock/%"
master-bin.000001	#	Query	#	#	use `test`; drop table if exists test.t1
master-bin.000001	#	Query	#	#	use `test`; drop table if exists test.t2
master-bin.000001	#	Query	#	#	use `test`; create table test.t1 (thread_id integer)
master-bin.000001	#	Query	#	#	use `test`; create table test.t2 (name varchar(128))
master-bin.000001	#	Query	#	#	use `test`; insert into test.t1
select thread_id from performance_schema.EVENTS_WAITS_CURRENT
master-bin.000001	#	Query	#	#	use `test`; insert into test.t2
select name from performance_schema.SETUP_INSTRUMENTS
where name like "wait/synch/rwlock/%"
master-bin.000001	#	Query	#	#	use `test`; drop table test.t1
master-bin.000001	#	Query	#	#	use `test`; drop table test.t2
master-bin.000001	#	Query	#	#	use `test`; update performance_schema.SETUP_INSTRUMENTS set enabled='YES'
  where name like "wait/synch/rwlock/%"
