include/master-slave.inc
Warnings:
Note	####	Sending passwords in plain text without SSL/TLS is extremely insecure.
Note	####	Storing MySQL user name or password information in the master.info repository is not secure and is therefore not recommended. Please see the MySQL Manual for more about this issue and possible alternatives.
[connection master]
select * from performance_schema.replication_connection_status
limit 1;
select * from performance_schema.replication_connection_status
where received_transaction_set='FOO' or last_error_message='BAR';
insert into performance_schema.replication_connection_status
set received_transaction_set='FOO', last_error_message='BAR',
thread_id=1, last_error_number=2;
ERROR 42000: INSERT command denied to user 'root'@'localhost' for table 'replication_connection_status'
update performance_schema.replication_connection_status
set last_error_number=12;
ERROR 42000: UPDATE command denied to user 'root'@'localhost' for table 'replication_connection_status'
update performance_schema.replication_connection_status
set thread_id=12 where received_transaction_set like "FOO";
ERROR 42000: UPDATE command denied to user 'root'@'localhost' for table 'replication_connection_status'
delete from performance_schema.replication_connection_status
where last_error_number=1;
ERROR 42000: DELETE command denied to user 'root'@'localhost' for table 'replication_connection_status'
delete from performance_schema.replication_connection_status;
ERROR 42000: DELETE command denied to user 'root'@'localhost' for table 'replication_connection_status'
LOCK TABLES performance_schema.replication_connection_status READ;
ERROR 42000: SELECT, LOCK TABLES command denied to user 'root'@'localhost' for table 'replication_connection_status'
UNLOCK TABLES;
LOCK TABLES performance_schema.replication_connection_status WRITE;
ERROR 42000: SELECT, LOCK TABLES command denied to user 'root'@'localhost' for table 'replication_connection_status'
UNLOCK TABLES;
select * from performance_schema.replication_connection_status
limit 1;
select * from performance_schema.replication_connection_status
where received_transaction_set='FOO' or last_error_message='BAR';
insert into performance_schema.replication_connection_status
set received_transaction_set='FOO', last_error_message='BAR',
thread_id=1, last_error_number=2;
ERROR 42000: INSERT command denied to user 'root'@'localhost' for table 'replication_connection_status'
update performance_schema.replication_connection_status
set last_error_number=12;
ERROR 42000: UPDATE command denied to user 'root'@'localhost' for table 'replication_connection_status'
update performance_schema.replication_connection_status
set thread_id=12 where received_transaction_set like "FOO";
ERROR 42000: UPDATE command denied to user 'root'@'localhost' for table 'replication_connection_status'
delete from performance_schema.replication_connection_status
where last_error_number=1;
ERROR 42000: DELETE command denied to user 'root'@'localhost' for table 'replication_connection_status'
delete from performance_schema.replication_connection_status;
ERROR 42000: DELETE command denied to user 'root'@'localhost' for table 'replication_connection_status'
LOCK TABLES performance_schema.replication_connection_status READ;
ERROR 42000: SELECT, LOCK TABLES command denied to user 'root'@'localhost' for table 'replication_connection_status'
UNLOCK TABLES;
LOCK TABLES performance_schema.replication_connection_status WRITE;
ERROR 42000: SELECT, LOCK TABLES command denied to user 'root'@'localhost' for table 'replication_connection_status'
UNLOCK TABLES;
include/rpl_end.inc
