drop table if exists test.setup_actors;
create table test.setup_actors as
select * from performance_schema.setup_actors;
insert into performance_schema.setup_actors
values ('%','%','%','YES');
ERROR 23000: Can't write; duplicate key in table 'setup_actors'
insert into performance_schema.setup_actors
values ('%','%','%','NO');
ERROR 23000: Can't write; duplicate key in table 'setup_actors'
truncate table performance_schema.setup_actors;
select * from performance_schema.setup_actors;
HOST	USER	ROLE	ENABLED
select * from performance_schema.setup_actors
where user = '%';
HOST	USER	ROLE	ENABLED
insert into performance_schema.setup_actors
set user='Joe', host='localhost';
insert into performance_schema.setup_actors
set user='Joe', host='%';
insert into performance_schema.setup_actors
set user='%', host='server1';
insert into performance_schema.setup_actors
set user='%', host='%';
insert into performance_schema.setup_actors
values ('localhost', 'user1', '%', 'NO%');
ERROR 01000: Data truncated for column 'ENABLED' at row 1
select * from performance_schema.setup_actors
order by USER, HOST;
HOST	USER	ROLE	ENABLED
%	%	%	YES
server1	%	%	YES
%	Joe	%	YES
localhost	Joe	%	YES
update performance_schema.setup_actors
set user='ILLEGAL';
ERROR HY000: Invalid performance_schema usage.
update performance_schema.setup_actors
set host='ILLEGAL';
ERROR HY000: Invalid performance_schema usage.
update performance_schema.setup_actors
set role='ILLEGAL';
ERROR HY000: Invalid performance_schema usage.
update performance_schema.setup_actors
set ENABLED='YES';
update performance_schema.setup_actors
set ENABLED='';
ERROR 01000: Data truncated for column 'ENABLED' at row 1
update performance_schema.setup_actors
set ENABLED='YESS';
ERROR 01000: Data truncated for column 'ENABLED' at row 1
update performance_schema.setup_actors
set ENABLED='NO%';
ERROR 01000: Data truncated for column 'ENABLED' at row 1
update performance_schema.setup_actors
set ENABLED=NULL;
ERROR 23000: Column 'ENABLED' cannot be null
select * from performance_schema.setup_actors
order by USER, HOST;
HOST	USER	ROLE	ENABLED
%	%	%	YES
server1	%	%	YES
%	Joe	%	YES
localhost	Joe	%	YES
delete from performance_schema.setup_actors
where user = 'Joe' and host = 'localhost';
select * from performance_schema.setup_actors
order by USER, HOST;
HOST	USER	ROLE	ENABLED
%	%	%	YES
server1	%	%	YES
%	Joe	%	YES
delete from performance_schema.setup_actors;
select * from performance_schema.setup_actors
order by USER, HOST;
HOST	USER	ROLE	ENABLED
LOCK TABLES performance_schema.setup_actors READ;
UNLOCK TABLES;
LOCK TABLES performance_schema.setup_actors WRITE;
UNLOCK TABLES;
truncate table performance_schema.setup_actors;
insert into performance_schema.setup_actors
select * from test.setup_actors;
drop table test.setup_actors;
