include/master-slave.inc
Warnings:
Note	####	Sending passwords in plain text without SSL/TLS is extremely insecure.
Note	####	Storing MySQL user name or password information in the master.info repository is not secure and is therefore not recommended. Please see the MySQL Manual for more about this issue and possible alternatives.
[connection master]
select * from performance_schema.replication_execute_status_by_worker
limit 1;
select * from performance_schema.replication_execute_status_by_worker
where service_state='YES' or last_error_message='ERROR';
insert into performance_schema.replication_execute_status_by_worker
set service_state='YES', last_error_message='ERROR',
worker_id=1, thread_id=2, last_error_number=1234;
ERROR 42000: INSERT command denied to user 'root'@'localhost' for table 'replication_execute_status_by_worker'
update performance_schema.replication_execute_status_by_worker
set worker_id=12;
ERROR 42000: UPDATE command denied to user 'root'@'localhost' for table 'replication_execute_status_by_worker'
update performance_schema.replication_execute_status_by_worker
set worker_d=12 where service_state like "YES";
ERROR 42000: UPDATE command denied to user 'root'@'localhost' for table 'replication_execute_status_by_worker'
delete from performance_schema.replication_execute_status_by_worker
where worker_id=1;
ERROR 42000: DELETE command denied to user 'root'@'localhost' for table 'replication_execute_status_by_worker'
delete from performance_schema.replication_execute_status_by_worker;
ERROR 42000: DELETE command denied to user 'root'@'localhost' for table 'replication_execute_status_by_worker'
LOCK TABLES performance_schema.replication_execute_status_by_worker READ;
ERROR 42000: SELECT, LOCK TABLES command denied to user 'root'@'localhost' for table 'replication_execute_status_by_worker'
UNLOCK TABLES;
LOCK TABLES performance_schema.replication_execute_status_by_worker WRITE;
ERROR 42000: SELECT, LOCK TABLES command denied to user 'root'@'localhost' for table 'replication_execute_status_by_worker'
UNLOCK TABLES;
include/stop_slave.inc
SET @save.slave_parallel_workers=@@global.slave_parallel_workers;
SET @@global.slave_parallel_workers=1;
include/start_slave.inc
Warnings:
Note	1753	slave_transaction_retries is not supported in multi-threaded slave mode. In the event of a transient failure, the slave will not retry the transaction and will stop.
select * from performance_schema.replication_execute_status_by_worker
limit 1;
select * from performance_schema.replication_execute_status_by_worker
where service_state='YES' or last_error_message='ERROR';
insert into performance_schema.replication_execute_status_by_worker
set service_state='YES', last_error_message='ERROR',
worker_id=1, thread_id=2, last_error_number=1234;
ERROR 42000: INSERT command denied to user 'root'@'localhost' for table 'replication_execute_status_by_worker'
update performance_schema.replication_execute_status_by_worker
set worker_id=12;
ERROR 42000: UPDATE command denied to user 'root'@'localhost' for table 'replication_execute_status_by_worker'
update performance_schema.replication_execute_status_by_worker
set worker_d=12 where service_state like "YES";
ERROR 42000: UPDATE command denied to user 'root'@'localhost' for table 'replication_execute_status_by_worker'
delete from performance_schema.replication_execute_status_by_worker
where worker_id=1;
ERROR 42000: DELETE command denied to user 'root'@'localhost' for table 'replication_execute_status_by_worker'
delete from performance_schema.replication_execute_status_by_worker;
ERROR 42000: DELETE command denied to user 'root'@'localhost' for table 'replication_execute_status_by_worker'
LOCK TABLES performance_schema.replication_execute_status_by_worker READ;
ERROR 42000: SELECT, LOCK TABLES command denied to user 'root'@'localhost' for table 'replication_execute_status_by_worker'
UNLOCK TABLES;
LOCK TABLES performance_schema.replication_execute_status_by_worker WRITE;
ERROR 42000: SELECT, LOCK TABLES command denied to user 'root'@'localhost' for table 'replication_execute_status_by_worker'
UNLOCK TABLES;
include/stop_slave.inc
SET @save.slave_parallel_workers=@@global.slave_parallel_workers;
SET @@global.slave_parallel_workers=0;
include/start_slave.inc
include/rpl_end.inc
