include/master-slave.inc
Warnings:
Note	####	Sending passwords in plain text without SSL/TLS is extremely insecure.
Note	####	Storing MySQL user name or password information in the master info repository is not secure and is therefore not recommended. Please consider using the USER and PASSWORD connection options for START SLAVE; see the 'START SLAVE Syntax' in the MySQL Manual for more information.
[connection master]
select * from performance_schema.replication_execute_status_by_worker
limit 1;
select * from performance_schema.replication_execute_status_by_worker
where service_state='YES' or last_error_message='ERROR';
insert into performance_schema.replication_execute_status_by_worker
set service_state='YES', last_error_message='ERROR',
worker_id=1, thread_id=2, last_error_number=1234;
ERROR 42000: INSERT command denied to user 'root'@'localhost' for table 'replication_execute_status_by_worker'
update performance_schema.replication_execute_status_by_worker
set worker_id=12;
ERROR 42000: UPDATE command denied to user 'root'@'localhost' for table 'replication_execute_status_by_worker'
update performance_schema.replication_execute_status_by_worker
set worker_d=12 where service_state like "YES";
ERROR 42000: UPDATE command denied to user 'root'@'localhost' for table 'replication_execute_status_by_worker'
delete from performance_schema.replication_execute_status_by_worker
where worker_id=1;
ERROR 42000: DELETE command denied to user 'root'@'localhost' for table 'replication_execute_status_by_worker'
delete from performance_schema.replication_execute_status_by_worker;
ERROR 42000: DELETE command denied to user 'root'@'localhost' for table 'replication_execute_status_by_worker'
LOCK TABLES performance_schema.replication_execute_status_by_worker READ;
ERROR 42000: SELECT, LOCK TABLES command denied to user 'root'@'localhost' for table 'replication_execute_status_by_worker'
UNLOCK TABLES;
LOCK TABLES performance_schema.replication_execute_status_by_worker WRITE;
ERROR 42000: SELECT, LOCK TABLES command denied to user 'root'@'localhost' for table 'replication_execute_status_by_worker'
UNLOCK TABLES;
include/stop_slave.inc
SET @save.slave_parallel_workers=@@global.slave_parallel_workers;
SET @@global.slave_parallel_workers=1;
set @save.slave_transaction_retries= @@global.slave_transaction_retries;
include/start_slave.inc
select * from performance_schema.replication_execute_status_by_worker
limit 1;
select * from performance_schema.replication_execute_status_by_worker
where service_state='YES' or last_error_message='ERROR';
insert into performance_schema.replication_execute_status_by_worker
set service_state='YES', last_error_message='ERROR',
worker_id=1, thread_id=2, last_error_number=1234;
ERROR 42000: INSERT command denied to user 'root'@'localhost' for table 'replication_execute_status_by_worker'
update performance_schema.replication_execute_status_by_worker
set worker_id=12;
ERROR 42000: UPDATE command denied to user 'root'@'localhost' for table 'replication_execute_status_by_worker'
update performance_schema.replication_execute_status_by_worker
set worker_d=12 where service_state like "YES";
ERROR 42000: UPDATE command denied to user 'root'@'localhost' for table 'replication_execute_status_by_worker'
delete from performance_schema.replication_execute_status_by_worker
where worker_id=1;
ERROR 42000: DELETE command denied to user 'root'@'localhost' for table 'replication_execute_status_by_worker'
delete from performance_schema.replication_execute_status_by_worker;
ERROR 42000: DELETE command denied to user 'root'@'localhost' for table 'replication_execute_status_by_worker'
LOCK TABLES performance_schema.replication_execute_status_by_worker READ;
ERROR 42000: SELECT, LOCK TABLES command denied to user 'root'@'localhost' for table 'replication_execute_status_by_worker'
UNLOCK TABLES;
LOCK TABLES performance_schema.replication_execute_status_by_worker WRITE;
ERROR 42000: SELECT, LOCK TABLES command denied to user 'root'@'localhost' for table 'replication_execute_status_by_worker'
UNLOCK TABLES;
include/stop_slave.inc
set @@global.slave_parallel_workers= @save.slave_parallel_workers;
set @@global.slave_transaction_retries= @save.slave_transaction_retries;
include/start_slave.inc
include/rpl_end.inc
