drop table if exists test.user_table;
drop procedure if exists test.user_proc;
drop function if exists test.user_func;
drop event if exists test.user_event;
"Testing mysql_upgrade with TABLE performance_schema.user_table"
create table test.user_table(a int);
use performance_schema;
show tables like "user_table";
Tables_in_performance_schema (user_table)
user_table
Warning: Using a password on the command line interface can be insecure.
Warning: Using a password on the command line interface can be insecure.
Warning: Using a password on the command line interface can be insecure.
ERROR 1050 (42S01) at line 159: Table 'cond_instances' already exists
ERROR 1050 (42S01) at line 184: Table 'events_waits_current' already exists
ERROR 1050 (42S01) at line 209: Table 'events_waits_history' already exists
ERROR 1050 (42S01) at line 234: Table 'events_waits_history_long' already exists
ERROR 1050 (42S01) at line 247: Table 'events_waits_summary_by_instance' already exists
ERROR 1050 (42S01) at line 260: Table 'events_waits_summary_by_host_by_event_name' already exists
ERROR 1050 (42S01) at line 273: Table 'events_waits_summary_by_user_by_event_name' already exists
ERROR 1050 (42S01) at line 287: Table 'events_waits_summary_by_account_by_event_name' already exists
ERROR 1050 (42S01) at line 300: Table 'events_waits_summary_by_thread_by_event_name' already exists
ERROR 1050 (42S01) at line 312: Table 'events_waits_summary_global_by_event_name' already exists
ERROR 1050 (42S01) at line 321: Table 'file_instances' already exists
ERROR 1050 (42S01) at line 350: Table 'file_summary_by_event_name' already exists
ERROR 1050 (42S01) at line 381: Table 'file_summary_by_instance' already exists
ERROR 1050 (42S01) at line 394: Table 'socket_instances' already exists
ERROR 1050 (42S01) at line 424: Table 'socket_summary_by_instance' already exists
ERROR 1050 (42S01) at line 453: Table 'socket_summary_by_event_name' already exists
ERROR 1050 (42S01) at line 488: Table 'host_cache' already exists
ERROR 1050 (42S01) at line 497: Table 'mutex_instances' already exists
ERROR 1050 (42S01) at line 511: Table 'objects_summary_global_by_type' already exists
ERROR 1050 (42S01) at line 521: Table 'performance_timers' already exists
ERROR 1050 (42S01) at line 531: Table 'rwlock_instances' already exists
ERROR 1050 (42S01) at line 540: Table 'setup_actors' already exists
ERROR 1050 (42S01) at line 548: Table 'setup_consumers' already exists
ERROR 1050 (42S01) at line 557: Table 'setup_instruments' already exists
ERROR 1050 (42S01) at line 568: Table 'setup_objects' already exists
ERROR 1050 (42S01) at line 576: Table 'setup_timers' already exists
ERROR 1050 (42S01) at line 621: Table 'table_io_waits_summary_by_index_usage' already exists
ERROR 1050 (42S01) at line 665: Table 'table_io_waits_summary_by_table' already exists
ERROR 1050 (42S01) at line 744: Table 'table_lock_waits_summary_by_table' already exists
ERROR 1050 (42S01) at line 764: Table 'threads' already exists
ERROR 1050 (42S01) at line 780: Table 'events_stages_current' already exists
ERROR 1050 (42S01) at line 796: Table 'events_stages_history' already exists
ERROR 1050 (42S01) at line 812: Table 'events_stages_history_long' already exists
ERROR 1050 (42S01) at line 825: Table 'events_stages_summary_by_thread_by_event_name' already exists
ERROR 1050 (42S01) at line 838: Table 'events_stages_summary_by_host_by_event_name' already exists
ERROR 1050 (42S01) at line 851: Table 'events_stages_summary_by_user_by_event_name' already exists
ERROR 1050 (42S01) at line 865: Table 'events_stages_summary_by_account_by_event_name' already exists
ERROR 1050 (42S01) at line 877: Table 'events_stages_summary_global_by_event_name' already exists
ERROR 1050 (42S01) at line 923: Table 'events_statements_current' already exists
ERROR 1050 (42S01) at line 969: Table 'events_statements_history' already exists
ERROR 1050 (42S01) at line 1015: Table 'events_statements_history_long' already exists
ERROR 1050 (42S01) at line 1047: Table 'events_statements_summary_by_thread_by_event_name' already exists
ERROR 1050 (42S01) at line 1079: Table 'events_statements_summary_by_host_by_event_name' already exists
ERROR 1050 (42S01) at line 1111: Table 'events_statements_summary_by_user_by_event_name' already exists
ERROR 1050 (42S01) at line 1144: Table 'events_statements_summary_by_account_by_event_name' already exists
ERROR 1050 (42S01) at line 1175: Table 'events_statements_summary_global_by_event_name' already exists
ERROR 1050 (42S01) at line 1184: Table 'hosts' already exists
ERROR 1050 (42S01) at line 1193: Table 'users' already exists
ERROR 1050 (42S01) at line 1203: Table 'accounts' already exists
ERROR 1050 (42S01) at line 1237: Table 'events_statements_summary_by_digest' already exists
ERROR 1050 (42S01) at line 1247: Table 'session_connect_attrs' already exists
ERROR 1050 (42S01) at line 1253: Table 'session_account_connect_attrs' already exists
ERROR 1644 (HY000) at line 1878: Unexpected content found in the performance_schema database.
FATAL ERROR: Upgrade failed
show tables like "user_table";
Tables_in_performance_schema (user_table)
user_table
use test;
drop table test.user_table;
"Testing mysql_upgrade with VIEW performance_schema.user_view"
create view test.user_view as select "Not supposed to be here";
use performance_schema;
show tables like "user_view";
Tables_in_performance_schema (user_view)
user_view
Warning: Using a password on the command line interface can be insecure.
Warning: Using a password on the command line interface can be insecure.
Warning: Using a password on the command line interface can be insecure.
ERROR 1050 (42S01) at line 159: Table 'cond_instances' already exists
ERROR 1050 (42S01) at line 184: Table 'events_waits_current' already exists
ERROR 1050 (42S01) at line 209: Table 'events_waits_history' already exists
ERROR 1050 (42S01) at line 234: Table 'events_waits_history_long' already exists
ERROR 1050 (42S01) at line 247: Table 'events_waits_summary_by_instance' already exists
ERROR 1050 (42S01) at line 260: Table 'events_waits_summary_by_host_by_event_name' already exists
ERROR 1050 (42S01) at line 273: Table 'events_waits_summary_by_user_by_event_name' already exists
ERROR 1050 (42S01) at line 287: Table 'events_waits_summary_by_account_by_event_name' already exists
ERROR 1050 (42S01) at line 300: Table 'events_waits_summary_by_thread_by_event_name' already exists
ERROR 1050 (42S01) at line 312: Table 'events_waits_summary_global_by_event_name' already exists
ERROR 1050 (42S01) at line 321: Table 'file_instances' already exists
ERROR 1050 (42S01) at line 350: Table 'file_summary_by_event_name' already exists
ERROR 1050 (42S01) at line 381: Table 'file_summary_by_instance' already exists
ERROR 1050 (42S01) at line 394: Table 'socket_instances' already exists
ERROR 1050 (42S01) at line 424: Table 'socket_summary_by_instance' already exists
ERROR 1050 (42S01) at line 453: Table 'socket_summary_by_event_name' already exists
ERROR 1050 (42S01) at line 488: Table 'host_cache' already exists
ERROR 1050 (42S01) at line 497: Table 'mutex_instances' already exists
ERROR 1050 (42S01) at line 511: Table 'objects_summary_global_by_type' already exists
ERROR 1050 (42S01) at line 521: Table 'performance_timers' already exists
ERROR 1050 (42S01) at line 531: Table 'rwlock_instances' already exists
ERROR 1050 (42S01) at line 540: Table 'setup_actors' already exists
ERROR 1050 (42S01) at line 548: Table 'setup_consumers' already exists
ERROR 1050 (42S01) at line 557: Table 'setup_instruments' already exists
ERROR 1050 (42S01) at line 568: Table 'setup_objects' already exists
ERROR 1050 (42S01) at line 576: Table 'setup_timers' already exists
ERROR 1050 (42S01) at line 621: Table 'table_io_waits_summary_by_index_usage' already exists
ERROR 1050 (42S01) at line 665: Table 'table_io_waits_summary_by_table' already exists
ERROR 1050 (42S01) at line 744: Table 'table_lock_waits_summary_by_table' already exists
ERROR 1050 (42S01) at line 764: Table 'threads' already exists
ERROR 1050 (42S01) at line 780: Table 'events_stages_current' already exists
ERROR 1050 (42S01) at line 796: Table 'events_stages_history' already exists
ERROR 1050 (42S01) at line 812: Table 'events_stages_history_long' already exists
ERROR 1050 (42S01) at line 825: Table 'events_stages_summary_by_thread_by_event_name' already exists
ERROR 1050 (42S01) at line 838: Table 'events_stages_summary_by_host_by_event_name' already exists
ERROR 1050 (42S01) at line 851: Table 'events_stages_summary_by_user_by_event_name' already exists
ERROR 1050 (42S01) at line 865: Table 'events_stages_summary_by_account_by_event_name' already exists
ERROR 1050 (42S01) at line 877: Table 'events_stages_summary_global_by_event_name' already exists
ERROR 1050 (42S01) at line 923: Table 'events_statements_current' already exists
ERROR 1050 (42S01) at line 969: Table 'events_statements_history' already exists
ERROR 1050 (42S01) at line 1015: Table 'events_statements_history_long' already exists
ERROR 1050 (42S01) at line 1047: Table 'events_statements_summary_by_thread_by_event_name' already exists
ERROR 1050 (42S01) at line 1079: Table 'events_statements_summary_by_host_by_event_name' already exists
ERROR 1050 (42S01) at line 1111: Table 'events_statements_summary_by_user_by_event_name' already exists
ERROR 1050 (42S01) at line 1144: Table 'events_statements_summary_by_account_by_event_name' already exists
ERROR 1050 (42S01) at line 1175: Table 'events_statements_summary_global_by_event_name' already exists
ERROR 1050 (42S01) at line 1184: Table 'hosts' already exists
ERROR 1050 (42S01) at line 1193: Table 'users' already exists
ERROR 1050 (42S01) at line 1203: Table 'accounts' already exists
ERROR 1050 (42S01) at line 1237: Table 'events_statements_summary_by_digest' already exists
ERROR 1050 (42S01) at line 1247: Table 'session_connect_attrs' already exists
ERROR 1050 (42S01) at line 1253: Table 'session_account_connect_attrs' already exists
ERROR 1644 (HY000) at line 1878: Unexpected content found in the performance_schema database.
FATAL ERROR: Upgrade failed
show tables like "user_view";
Tables_in_performance_schema (user_view)
user_view
use test;
drop view test.user_view;
"Testing mysql_upgrade with PROCEDURE performance_schema.user_proc"
create procedure test.user_proc()
select "Not supposed to be here";
update mysql.proc set db='performance_schema' where name='user_proc';
Warning: Using a password on the command line interface can be insecure.
Warning: Using a password on the command line interface can be insecure.
Warning: Using a password on the command line interface can be insecure.
ERROR 1050 (42S01) at line 159: Table 'cond_instances' already exists
ERROR 1050 (42S01) at line 184: Table 'events_waits_current' already exists
ERROR 1050 (42S01) at line 209: Table 'events_waits_history' already exists
ERROR 1050 (42S01) at line 234: Table 'events_waits_history_long' already exists
ERROR 1050 (42S01) at line 247: Table 'events_waits_summary_by_instance' already exists
ERROR 1050 (42S01) at line 260: Table 'events_waits_summary_by_host_by_event_name' already exists
ERROR 1050 (42S01) at line 273: Table 'events_waits_summary_by_user_by_event_name' already exists
ERROR 1050 (42S01) at line 287: Table 'events_waits_summary_by_account_by_event_name' already exists
ERROR 1050 (42S01) at line 300: Table 'events_waits_summary_by_thread_by_event_name' already exists
ERROR 1050 (42S01) at line 312: Table 'events_waits_summary_global_by_event_name' already exists
ERROR 1050 (42S01) at line 321: Table 'file_instances' already exists
ERROR 1050 (42S01) at line 350: Table 'file_summary_by_event_name' already exists
ERROR 1050 (42S01) at line 381: Table 'file_summary_by_instance' already exists
ERROR 1050 (42S01) at line 394: Table 'socket_instances' already exists
ERROR 1050 (42S01) at line 424: Table 'socket_summary_by_instance' already exists
ERROR 1050 (42S01) at line 453: Table 'socket_summary_by_event_name' already exists
ERROR 1050 (42S01) at line 488: Table 'host_cache' already exists
ERROR 1050 (42S01) at line 497: Table 'mutex_instances' already exists
ERROR 1050 (42S01) at line 511: Table 'objects_summary_global_by_type' already exists
ERROR 1050 (42S01) at line 521: Table 'performance_timers' already exists
ERROR 1050 (42S01) at line 531: Table 'rwlock_instances' already exists
ERROR 1050 (42S01) at line 540: Table 'setup_actors' already exists
ERROR 1050 (42S01) at line 548: Table 'setup_consumers' already exists
ERROR 1050 (42S01) at line 557: Table 'setup_instruments' already exists
ERROR 1050 (42S01) at line 568: Table 'setup_objects' already exists
ERROR 1050 (42S01) at line 576: Table 'setup_timers' already exists
ERROR 1050 (42S01) at line 621: Table 'table_io_waits_summary_by_index_usage' already exists
ERROR 1050 (42S01) at line 665: Table 'table_io_waits_summary_by_table' already exists
ERROR 1050 (42S01) at line 744: Table 'table_lock_waits_summary_by_table' already exists
ERROR 1050 (42S01) at line 764: Table 'threads' already exists
ERROR 1050 (42S01) at line 780: Table 'events_stages_current' already exists
ERROR 1050 (42S01) at line 796: Table 'events_stages_history' already exists
ERROR 1050 (42S01) at line 812: Table 'events_stages_history_long' already exists
ERROR 1050 (42S01) at line 825: Table 'events_stages_summary_by_thread_by_event_name' already exists
ERROR 1050 (42S01) at line 838: Table 'events_stages_summary_by_host_by_event_name' already exists
ERROR 1050 (42S01) at line 851: Table 'events_stages_summary_by_user_by_event_name' already exists
ERROR 1050 (42S01) at line 865: Table 'events_stages_summary_by_account_by_event_name' already exists
ERROR 1050 (42S01) at line 877: Table 'events_stages_summary_global_by_event_name' already exists
ERROR 1050 (42S01) at line 923: Table 'events_statements_current' already exists
ERROR 1050 (42S01) at line 969: Table 'events_statements_history' already exists
ERROR 1050 (42S01) at line 1015: Table 'events_statements_history_long' already exists
ERROR 1050 (42S01) at line 1047: Table 'events_statements_summary_by_thread_by_event_name' already exists
ERROR 1050 (42S01) at line 1079: Table 'events_statements_summary_by_host_by_event_name' already exists
ERROR 1050 (42S01) at line 1111: Table 'events_statements_summary_by_user_by_event_name' already exists
ERROR 1050 (42S01) at line 1144: Table 'events_statements_summary_by_account_by_event_name' already exists
ERROR 1050 (42S01) at line 1175: Table 'events_statements_summary_global_by_event_name' already exists
ERROR 1050 (42S01) at line 1184: Table 'hosts' already exists
ERROR 1050 (42S01) at line 1193: Table 'users' already exists
ERROR 1050 (42S01) at line 1203: Table 'accounts' already exists
ERROR 1050 (42S01) at line 1237: Table 'events_statements_summary_by_digest' already exists
ERROR 1050 (42S01) at line 1247: Table 'session_connect_attrs' already exists
ERROR 1050 (42S01) at line 1253: Table 'session_account_connect_attrs' already exists
ERROR 1644 (HY000) at line 1878: Unexpected content found in the performance_schema database.
FATAL ERROR: Upgrade failed
select name from mysql.proc where db='performance_schema';
name
user_proc
update mysql.proc set db='test' where name='user_proc';
drop procedure test.user_proc;
"Testing mysql_upgrade with FUNCTION performance_schema.user_func"
create function test.user_func() returns integer
return 0;
update mysql.proc set db='performance_schema' where name='user_func';
Warning: Using a password on the command line interface can be insecure.
Warning: Using a password on the command line interface can be insecure.
Warning: Using a password on the command line interface can be insecure.
ERROR 1050 (42S01) at line 159: Table 'cond_instances' already exists
ERROR 1050 (42S01) at line 184: Table 'events_waits_current' already exists
ERROR 1050 (42S01) at line 209: Table 'events_waits_history' already exists
ERROR 1050 (42S01) at line 234: Table 'events_waits_history_long' already exists
ERROR 1050 (42S01) at line 247: Table 'events_waits_summary_by_instance' already exists
ERROR 1050 (42S01) at line 260: Table 'events_waits_summary_by_host_by_event_name' already exists
ERROR 1050 (42S01) at line 273: Table 'events_waits_summary_by_user_by_event_name' already exists
ERROR 1050 (42S01) at line 287: Table 'events_waits_summary_by_account_by_event_name' already exists
ERROR 1050 (42S01) at line 300: Table 'events_waits_summary_by_thread_by_event_name' already exists
ERROR 1050 (42S01) at line 312: Table 'events_waits_summary_global_by_event_name' already exists
ERROR 1050 (42S01) at line 321: Table 'file_instances' already exists
ERROR 1050 (42S01) at line 350: Table 'file_summary_by_event_name' already exists
ERROR 1050 (42S01) at line 381: Table 'file_summary_by_instance' already exists
ERROR 1050 (42S01) at line 394: Table 'socket_instances' already exists
ERROR 1050 (42S01) at line 424: Table 'socket_summary_by_instance' already exists
ERROR 1050 (42S01) at line 453: Table 'socket_summary_by_event_name' already exists
ERROR 1050 (42S01) at line 488: Table 'host_cache' already exists
ERROR 1050 (42S01) at line 497: Table 'mutex_instances' already exists
ERROR 1050 (42S01) at line 511: Table 'objects_summary_global_by_type' already exists
ERROR 1050 (42S01) at line 521: Table 'performance_timers' already exists
ERROR 1050 (42S01) at line 531: Table 'rwlock_instances' already exists
ERROR 1050 (42S01) at line 540: Table 'setup_actors' already exists
ERROR 1050 (42S01) at line 548: Table 'setup_consumers' already exists
ERROR 1050 (42S01) at line 557: Table 'setup_instruments' already exists
ERROR 1050 (42S01) at line 568: Table 'setup_objects' already exists
ERROR 1050 (42S01) at line 576: Table 'setup_timers' already exists
ERROR 1050 (42S01) at line 621: Table 'table_io_waits_summary_by_index_usage' already exists
ERROR 1050 (42S01) at line 665: Table 'table_io_waits_summary_by_table' already exists
ERROR 1050 (42S01) at line 744: Table 'table_lock_waits_summary_by_table' already exists
ERROR 1050 (42S01) at line 764: Table 'threads' already exists
ERROR 1050 (42S01) at line 780: Table 'events_stages_current' already exists
ERROR 1050 (42S01) at line 796: Table 'events_stages_history' already exists
ERROR 1050 (42S01) at line 812: Table 'events_stages_history_long' already exists
ERROR 1050 (42S01) at line 825: Table 'events_stages_summary_by_thread_by_event_name' already exists
ERROR 1050 (42S01) at line 838: Table 'events_stages_summary_by_host_by_event_name' already exists
ERROR 1050 (42S01) at line 851: Table 'events_stages_summary_by_user_by_event_name' already exists
ERROR 1050 (42S01) at line 865: Table 'events_stages_summary_by_account_by_event_name' already exists
ERROR 1050 (42S01) at line 877: Table 'events_stages_summary_global_by_event_name' already exists
ERROR 1050 (42S01) at line 923: Table 'events_statements_current' already exists
ERROR 1050 (42S01) at line 969: Table 'events_statements_history' already exists
ERROR 1050 (42S01) at line 1015: Table 'events_statements_history_long' already exists
ERROR 1050 (42S01) at line 1047: Table 'events_statements_summary_by_thread_by_event_name' already exists
ERROR 1050 (42S01) at line 1079: Table 'events_statements_summary_by_host_by_event_name' already exists
ERROR 1050 (42S01) at line 1111: Table 'events_statements_summary_by_user_by_event_name' already exists
ERROR 1050 (42S01) at line 1144: Table 'events_statements_summary_by_account_by_event_name' already exists
ERROR 1050 (42S01) at line 1175: Table 'events_statements_summary_global_by_event_name' already exists
ERROR 1050 (42S01) at line 1184: Table 'hosts' already exists
ERROR 1050 (42S01) at line 1193: Table 'users' already exists
ERROR 1050 (42S01) at line 1203: Table 'accounts' already exists
ERROR 1050 (42S01) at line 1237: Table 'events_statements_summary_by_digest' already exists
ERROR 1050 (42S01) at line 1247: Table 'session_connect_attrs' already exists
ERROR 1050 (42S01) at line 1253: Table 'session_account_connect_attrs' already exists
ERROR 1644 (HY000) at line 1878: Unexpected content found in the performance_schema database.
FATAL ERROR: Upgrade failed
select name from mysql.proc where db='performance_schema';
name
user_func
update mysql.proc set db='test' where name='user_func';
drop function test.user_func;
"Testing mysql_upgrade with EVENT performance_schema.user_event"
create event test.user_event on schedule every 1 day do
select "not supposed to be here";
update mysql.event set db='performance_schema' where name='user_event';
Warning: Using a password on the command line interface can be insecure.
Warning: Using a password on the command line interface can be insecure.
Warning: Using a password on the command line interface can be insecure.
ERROR 1050 (42S01) at line 159: Table 'cond_instances' already exists
ERROR 1050 (42S01) at line 184: Table 'events_waits_current' already exists
ERROR 1050 (42S01) at line 209: Table 'events_waits_history' already exists
ERROR 1050 (42S01) at line 234: Table 'events_waits_history_long' already exists
ERROR 1050 (42S01) at line 247: Table 'events_waits_summary_by_instance' already exists
ERROR 1050 (42S01) at line 260: Table 'events_waits_summary_by_host_by_event_name' already exists
ERROR 1050 (42S01) at line 273: Table 'events_waits_summary_by_user_by_event_name' already exists
ERROR 1050 (42S01) at line 287: Table 'events_waits_summary_by_account_by_event_name' already exists
ERROR 1050 (42S01) at line 300: Table 'events_waits_summary_by_thread_by_event_name' already exists
ERROR 1050 (42S01) at line 312: Table 'events_waits_summary_global_by_event_name' already exists
ERROR 1050 (42S01) at line 321: Table 'file_instances' already exists
ERROR 1050 (42S01) at line 350: Table 'file_summary_by_event_name' already exists
ERROR 1050 (42S01) at line 381: Table 'file_summary_by_instance' already exists
ERROR 1050 (42S01) at line 394: Table 'socket_instances' already exists
ERROR 1050 (42S01) at line 424: Table 'socket_summary_by_instance' already exists
ERROR 1050 (42S01) at line 453: Table 'socket_summary_by_event_name' already exists
ERROR 1050 (42S01) at line 488: Table 'host_cache' already exists
ERROR 1050 (42S01) at line 497: Table 'mutex_instances' already exists
ERROR 1050 (42S01) at line 511: Table 'objects_summary_global_by_type' already exists
ERROR 1050 (42S01) at line 521: Table 'performance_timers' already exists
ERROR 1050 (42S01) at line 531: Table 'rwlock_instances' already exists
ERROR 1050 (42S01) at line 540: Table 'setup_actors' already exists
ERROR 1050 (42S01) at line 548: Table 'setup_consumers' already exists
ERROR 1050 (42S01) at line 557: Table 'setup_instruments' already exists
ERROR 1050 (42S01) at line 568: Table 'setup_objects' already exists
ERROR 1050 (42S01) at line 576: Table 'setup_timers' already exists
ERROR 1050 (42S01) at line 621: Table 'table_io_waits_summary_by_index_usage' already exists
ERROR 1050 (42S01) at line 665: Table 'table_io_waits_summary_by_table' already exists
ERROR 1050 (42S01) at line 744: Table 'table_lock_waits_summary_by_table' already exists
ERROR 1050 (42S01) at line 764: Table 'threads' already exists
ERROR 1050 (42S01) at line 780: Table 'events_stages_current' already exists
ERROR 1050 (42S01) at line 796: Table 'events_stages_history' already exists
ERROR 1050 (42S01) at line 812: Table 'events_stages_history_long' already exists
ERROR 1050 (42S01) at line 825: Table 'events_stages_summary_by_thread_by_event_name' already exists
ERROR 1050 (42S01) at line 838: Table 'events_stages_summary_by_host_by_event_name' already exists
ERROR 1050 (42S01) at line 851: Table 'events_stages_summary_by_user_by_event_name' already exists
ERROR 1050 (42S01) at line 865: Table 'events_stages_summary_by_account_by_event_name' already exists
ERROR 1050 (42S01) at line 877: Table 'events_stages_summary_global_by_event_name' already exists
ERROR 1050 (42S01) at line 923: Table 'events_statements_current' already exists
ERROR 1050 (42S01) at line 969: Table 'events_statements_history' already exists
ERROR 1050 (42S01) at line 1015: Table 'events_statements_history_long' already exists
ERROR 1050 (42S01) at line 1047: Table 'events_statements_summary_by_thread_by_event_name' already exists
ERROR 1050 (42S01) at line 1079: Table 'events_statements_summary_by_host_by_event_name' already exists
ERROR 1050 (42S01) at line 1111: Table 'events_statements_summary_by_user_by_event_name' already exists
ERROR 1050 (42S01) at line 1144: Table 'events_statements_summary_by_account_by_event_name' already exists
ERROR 1050 (42S01) at line 1175: Table 'events_statements_summary_global_by_event_name' already exists
ERROR 1050 (42S01) at line 1184: Table 'hosts' already exists
ERROR 1050 (42S01) at line 1193: Table 'users' already exists
ERROR 1050 (42S01) at line 1203: Table 'accounts' already exists
ERROR 1050 (42S01) at line 1237: Table 'events_statements_summary_by_digest' already exists
ERROR 1050 (42S01) at line 1247: Table 'session_connect_attrs' already exists
ERROR 1050 (42S01) at line 1253: Table 'session_account_connect_attrs' already exists
ERROR 1644 (HY000) at line 1878: Unexpected content found in the performance_schema database.
FATAL ERROR: Upgrade failed
select name from mysql.event where db='performance_schema';
name
user_event
update mysql.event set db='test' where name='user_event';
drop event test.user_event;
