drop table if exists test.user_table;
drop procedure if exists test.user_proc;
drop function if exists test.user_func;
drop event if exists test.user_event;
"Testing mysql_upgrade with TABLE performance_schema.user_table"
create table test.user_table(a int);
use performance_schema;
show tables like "user_table";
Tables_in_performance_schema (user_table)
user_table
ERROR 1050 (42S01) at line 100: Table 'cond_instances' already exists
ERROR 1050 (42S01) at line 124: Table 'events_waits_current' already exists
ERROR 1050 (42S01) at line 148: Table 'events_waits_history' already exists
ERROR 1050 (42S01) at line 172: Table 'events_waits_history_long' already exists
ERROR 1050 (42S01) at line 185: Table 'events_waits_summary_by_instance' already exists
ERROR 1050 (42S01) at line 198: Table 'events_waits_summary_by_host_by_event_name' already exists
ERROR 1050 (42S01) at line 211: Table 'events_waits_summary_by_user_by_event_name' already exists
ERROR 1050 (42S01) at line 225: Table 'events_waits_summary_by_account_by_event_name' already exists
ERROR 1050 (42S01) at line 238: Table 'events_waits_summary_by_thread_by_event_name' already exists
ERROR 1050 (42S01) at line 250: Table 'events_waits_summary_global_by_event_name' already exists
ERROR 1050 (42S01) at line 259: Table 'file_instances' already exists
ERROR 1050 (42S01) at line 270: Table 'file_summary_by_event_name' already exists
ERROR 1050 (42S01) at line 282: Table 'file_summary_by_instance' already exists
ERROR 1050 (42S01) at line 295: Table 'socket_instances' already exists
ERROR 1050 (42S01) at line 325: Table 'socket_summary_by_instance' already exists
ERROR 1050 (42S01) at line 354: Table 'socket_summary_by_event_name' already exists
ERROR 1050 (42S01) at line 363: Table 'mutex_instances' already exists
ERROR 1050 (42S01) at line 377: Table 'objects_summary_global_by_type' already exists
ERROR 1050 (42S01) at line 387: Table 'performance_timers' already exists
ERROR 1050 (42S01) at line 397: Table 'rwlock_instances' already exists
ERROR 1050 (42S01) at line 406: Table 'setup_actors' already exists
ERROR 1050 (42S01) at line 414: Table 'setup_consumers' already exists
ERROR 1050 (42S01) at line 423: Table 'setup_instruments' already exists
ERROR 1050 (42S01) at line 434: Table 'setup_objects' already exists
ERROR 1050 (42S01) at line 442: Table 'setup_timers' already exists
ERROR 1050 (42S01) at line 487: Table 'table_io_waits_summary_by_index_usage' already exists
ERROR 1050 (42S01) at line 531: Table 'table_io_waits_summary_by_table' already exists
ERROR 1050 (42S01) at line 610: Table 'table_lock_waits_summary_by_table' already exists
ERROR 1050 (42S01) at line 630: Table 'threads' already exists
ERROR 1050 (42S01) at line 645: Table 'events_stages_current' already exists
ERROR 1050 (42S01) at line 660: Table 'events_stages_history' already exists
ERROR 1050 (42S01) at line 675: Table 'events_stages_history_long' already exists
ERROR 1050 (42S01) at line 688: Table 'events_stages_summary_by_thread_by_event_name' already exists
ERROR 1050 (42S01) at line 701: Table 'events_stages_summary_by_host_by_event_name' already exists
ERROR 1050 (42S01) at line 714: Table 'events_stages_summary_by_user_by_event_name' already exists
ERROR 1050 (42S01) at line 728: Table 'events_stages_summary_by_account_by_event_name' already exists
ERROR 1050 (42S01) at line 740: Table 'events_stages_summary_global_by_event_name' already exists
ERROR 1050 (42S01) at line 783: Table 'events_statements_current' already exists
ERROR 1050 (42S01) at line 826: Table 'events_statements_history' already exists
ERROR 1050 (42S01) at line 869: Table 'events_statements_history_long' already exists
ERROR 1050 (42S01) at line 901: Table 'events_statements_summary_by_thread_by_event_name' already exists
ERROR 1050 (42S01) at line 933: Table 'events_statements_summary_by_host_by_event_name' already exists
ERROR 1050 (42S01) at line 965: Table 'events_statements_summary_by_user_by_event_name' already exists
ERROR 1050 (42S01) at line 998: Table 'events_statements_summary_by_account_by_event_name' already exists
ERROR 1050 (42S01) at line 1029: Table 'events_statements_summary_global_by_event_name' already exists
ERROR 1050 (42S01) at line 1038: Table 'hosts' already exists
ERROR 1050 (42S01) at line 1047: Table 'users' already exists
ERROR 1050 (42S01) at line 1057: Table 'accounts' already exists
ERROR 1644 (HY000) at line 1682: Unexpected content found in the performance_schema database.
FATAL ERROR: Upgrade failed
show tables like "user_table";
Tables_in_performance_schema (user_table)
user_table
use test;
drop table test.user_table;
"Testing mysql_upgrade with VIEW performance_schema.user_view"
create view test.user_view as select "Not supposed to be here";
use performance_schema;
show tables like "user_view";
Tables_in_performance_schema (user_view)
user_view
ERROR 1050 (42S01) at line 100: Table 'cond_instances' already exists
ERROR 1050 (42S01) at line 124: Table 'events_waits_current' already exists
ERROR 1050 (42S01) at line 148: Table 'events_waits_history' already exists
ERROR 1050 (42S01) at line 172: Table 'events_waits_history_long' already exists
ERROR 1050 (42S01) at line 185: Table 'events_waits_summary_by_instance' already exists
ERROR 1050 (42S01) at line 198: Table 'events_waits_summary_by_host_by_event_name' already exists
ERROR 1050 (42S01) at line 211: Table 'events_waits_summary_by_user_by_event_name' already exists
ERROR 1050 (42S01) at line 225: Table 'events_waits_summary_by_account_by_event_name' already exists
ERROR 1050 (42S01) at line 238: Table 'events_waits_summary_by_thread_by_event_name' already exists
ERROR 1050 (42S01) at line 250: Table 'events_waits_summary_global_by_event_name' already exists
ERROR 1050 (42S01) at line 259: Table 'file_instances' already exists
ERROR 1050 (42S01) at line 270: Table 'file_summary_by_event_name' already exists
ERROR 1050 (42S01) at line 282: Table 'file_summary_by_instance' already exists
ERROR 1050 (42S01) at line 295: Table 'socket_instances' already exists
ERROR 1050 (42S01) at line 325: Table 'socket_summary_by_instance' already exists
ERROR 1050 (42S01) at line 354: Table 'socket_summary_by_event_name' already exists
ERROR 1050 (42S01) at line 363: Table 'mutex_instances' already exists
ERROR 1050 (42S01) at line 377: Table 'objects_summary_global_by_type' already exists
ERROR 1050 (42S01) at line 387: Table 'performance_timers' already exists
ERROR 1050 (42S01) at line 397: Table 'rwlock_instances' already exists
ERROR 1050 (42S01) at line 406: Table 'setup_actors' already exists
ERROR 1050 (42S01) at line 414: Table 'setup_consumers' already exists
ERROR 1050 (42S01) at line 423: Table 'setup_instruments' already exists
ERROR 1050 (42S01) at line 434: Table 'setup_objects' already exists
ERROR 1050 (42S01) at line 442: Table 'setup_timers' already exists
ERROR 1050 (42S01) at line 487: Table 'table_io_waits_summary_by_index_usage' already exists
ERROR 1050 (42S01) at line 531: Table 'table_io_waits_summary_by_table' already exists
ERROR 1050 (42S01) at line 610: Table 'table_lock_waits_summary_by_table' already exists
ERROR 1050 (42S01) at line 630: Table 'threads' already exists
ERROR 1050 (42S01) at line 645: Table 'events_stages_current' already exists
ERROR 1050 (42S01) at line 660: Table 'events_stages_history' already exists
ERROR 1050 (42S01) at line 675: Table 'events_stages_history_long' already exists
ERROR 1050 (42S01) at line 688: Table 'events_stages_summary_by_thread_by_event_name' already exists
ERROR 1050 (42S01) at line 701: Table 'events_stages_summary_by_host_by_event_name' already exists
ERROR 1050 (42S01) at line 714: Table 'events_stages_summary_by_user_by_event_name' already exists
ERROR 1050 (42S01) at line 728: Table 'events_stages_summary_by_account_by_event_name' already exists
ERROR 1050 (42S01) at line 740: Table 'events_stages_summary_global_by_event_name' already exists
ERROR 1050 (42S01) at line 783: Table 'events_statements_current' already exists
ERROR 1050 (42S01) at line 826: Table 'events_statements_history' already exists
ERROR 1050 (42S01) at line 869: Table 'events_statements_history_long' already exists
ERROR 1050 (42S01) at line 901: Table 'events_statements_summary_by_thread_by_event_name' already exists
ERROR 1050 (42S01) at line 933: Table 'events_statements_summary_by_host_by_event_name' already exists
ERROR 1050 (42S01) at line 965: Table 'events_statements_summary_by_user_by_event_name' already exists
ERROR 1050 (42S01) at line 998: Table 'events_statements_summary_by_account_by_event_name' already exists
ERROR 1050 (42S01) at line 1029: Table 'events_statements_summary_global_by_event_name' already exists
ERROR 1050 (42S01) at line 1038: Table 'hosts' already exists
ERROR 1050 (42S01) at line 1047: Table 'users' already exists
ERROR 1050 (42S01) at line 1057: Table 'accounts' already exists
ERROR 1644 (HY000) at line 1682: Unexpected content found in the performance_schema database.
FATAL ERROR: Upgrade failed
show tables like "user_view";
Tables_in_performance_schema (user_view)
user_view
use test;
drop view test.user_view;
"Testing mysql_upgrade with PROCEDURE performance_schema.user_proc"
create procedure test.user_proc()
select "Not supposed to be here";
update mysql.proc set db='performance_schema' where name='user_proc';
ERROR 1050 (42S01) at line 100: Table 'cond_instances' already exists
ERROR 1050 (42S01) at line 124: Table 'events_waits_current' already exists
ERROR 1050 (42S01) at line 148: Table 'events_waits_history' already exists
ERROR 1050 (42S01) at line 172: Table 'events_waits_history_long' already exists
ERROR 1050 (42S01) at line 185: Table 'events_waits_summary_by_instance' already exists
ERROR 1050 (42S01) at line 198: Table 'events_waits_summary_by_host_by_event_name' already exists
ERROR 1050 (42S01) at line 211: Table 'events_waits_summary_by_user_by_event_name' already exists
ERROR 1050 (42S01) at line 225: Table 'events_waits_summary_by_account_by_event_name' already exists
ERROR 1050 (42S01) at line 238: Table 'events_waits_summary_by_thread_by_event_name' already exists
ERROR 1050 (42S01) at line 250: Table 'events_waits_summary_global_by_event_name' already exists
ERROR 1050 (42S01) at line 259: Table 'file_instances' already exists
ERROR 1050 (42S01) at line 270: Table 'file_summary_by_event_name' already exists
ERROR 1050 (42S01) at line 282: Table 'file_summary_by_instance' already exists
ERROR 1050 (42S01) at line 295: Table 'socket_instances' already exists
ERROR 1050 (42S01) at line 325: Table 'socket_summary_by_instance' already exists
ERROR 1050 (42S01) at line 354: Table 'socket_summary_by_event_name' already exists
ERROR 1050 (42S01) at line 363: Table 'mutex_instances' already exists
ERROR 1050 (42S01) at line 377: Table 'objects_summary_global_by_type' already exists
ERROR 1050 (42S01) at line 387: Table 'performance_timers' already exists
ERROR 1050 (42S01) at line 397: Table 'rwlock_instances' already exists
ERROR 1050 (42S01) at line 406: Table 'setup_actors' already exists
ERROR 1050 (42S01) at line 414: Table 'setup_consumers' already exists
ERROR 1050 (42S01) at line 423: Table 'setup_instruments' already exists
ERROR 1050 (42S01) at line 434: Table 'setup_objects' already exists
ERROR 1050 (42S01) at line 442: Table 'setup_timers' already exists
ERROR 1050 (42S01) at line 487: Table 'table_io_waits_summary_by_index_usage' already exists
ERROR 1050 (42S01) at line 531: Table 'table_io_waits_summary_by_table' already exists
ERROR 1050 (42S01) at line 610: Table 'table_lock_waits_summary_by_table' already exists
ERROR 1050 (42S01) at line 630: Table 'threads' already exists
ERROR 1050 (42S01) at line 645: Table 'events_stages_current' already exists
ERROR 1050 (42S01) at line 660: Table 'events_stages_history' already exists
ERROR 1050 (42S01) at line 675: Table 'events_stages_history_long' already exists
ERROR 1050 (42S01) at line 688: Table 'events_stages_summary_by_thread_by_event_name' already exists
ERROR 1050 (42S01) at line 701: Table 'events_stages_summary_by_host_by_event_name' already exists
ERROR 1050 (42S01) at line 714: Table 'events_stages_summary_by_user_by_event_name' already exists
ERROR 1050 (42S01) at line 728: Table 'events_stages_summary_by_account_by_event_name' already exists
ERROR 1050 (42S01) at line 740: Table 'events_stages_summary_global_by_event_name' already exists
ERROR 1050 (42S01) at line 783: Table 'events_statements_current' already exists
ERROR 1050 (42S01) at line 826: Table 'events_statements_history' already exists
ERROR 1050 (42S01) at line 869: Table 'events_statements_history_long' already exists
ERROR 1050 (42S01) at line 901: Table 'events_statements_summary_by_thread_by_event_name' already exists
ERROR 1050 (42S01) at line 933: Table 'events_statements_summary_by_host_by_event_name' already exists
ERROR 1050 (42S01) at line 965: Table 'events_statements_summary_by_user_by_event_name' already exists
ERROR 1050 (42S01) at line 998: Table 'events_statements_summary_by_account_by_event_name' already exists
ERROR 1050 (42S01) at line 1029: Table 'events_statements_summary_global_by_event_name' already exists
ERROR 1050 (42S01) at line 1038: Table 'hosts' already exists
ERROR 1050 (42S01) at line 1047: Table 'users' already exists
ERROR 1050 (42S01) at line 1057: Table 'accounts' already exists
ERROR 1644 (HY000) at line 1682: Unexpected content found in the performance_schema database.
FATAL ERROR: Upgrade failed
select name from mysql.proc where db='performance_schema';
name
user_proc
update mysql.proc set db='test' where name='user_proc';
drop procedure test.user_proc;
"Testing mysql_upgrade with FUNCTION performance_schema.user_func"
create function test.user_func() returns integer
return 0;
update mysql.proc set db='performance_schema' where name='user_func';
ERROR 1050 (42S01) at line 100: Table 'cond_instances' already exists
ERROR 1050 (42S01) at line 124: Table 'events_waits_current' already exists
ERROR 1050 (42S01) at line 148: Table 'events_waits_history' already exists
ERROR 1050 (42S01) at line 172: Table 'events_waits_history_long' already exists
ERROR 1050 (42S01) at line 185: Table 'events_waits_summary_by_instance' already exists
ERROR 1050 (42S01) at line 198: Table 'events_waits_summary_by_host_by_event_name' already exists
ERROR 1050 (42S01) at line 211: Table 'events_waits_summary_by_user_by_event_name' already exists
ERROR 1050 (42S01) at line 225: Table 'events_waits_summary_by_account_by_event_name' already exists
ERROR 1050 (42S01) at line 238: Table 'events_waits_summary_by_thread_by_event_name' already exists
ERROR 1050 (42S01) at line 250: Table 'events_waits_summary_global_by_event_name' already exists
ERROR 1050 (42S01) at line 259: Table 'file_instances' already exists
ERROR 1050 (42S01) at line 270: Table 'file_summary_by_event_name' already exists
ERROR 1050 (42S01) at line 282: Table 'file_summary_by_instance' already exists
ERROR 1050 (42S01) at line 295: Table 'socket_instances' already exists
ERROR 1050 (42S01) at line 325: Table 'socket_summary_by_instance' already exists
ERROR 1050 (42S01) at line 354: Table 'socket_summary_by_event_name' already exists
ERROR 1050 (42S01) at line 363: Table 'mutex_instances' already exists
ERROR 1050 (42S01) at line 377: Table 'objects_summary_global_by_type' already exists
ERROR 1050 (42S01) at line 387: Table 'performance_timers' already exists
ERROR 1050 (42S01) at line 397: Table 'rwlock_instances' already exists
ERROR 1050 (42S01) at line 406: Table 'setup_actors' already exists
ERROR 1050 (42S01) at line 414: Table 'setup_consumers' already exists
ERROR 1050 (42S01) at line 423: Table 'setup_instruments' already exists
ERROR 1050 (42S01) at line 434: Table 'setup_objects' already exists
ERROR 1050 (42S01) at line 442: Table 'setup_timers' already exists
ERROR 1050 (42S01) at line 487: Table 'table_io_waits_summary_by_index_usage' already exists
ERROR 1050 (42S01) at line 531: Table 'table_io_waits_summary_by_table' already exists
ERROR 1050 (42S01) at line 610: Table 'table_lock_waits_summary_by_table' already exists
ERROR 1050 (42S01) at line 630: Table 'threads' already exists
ERROR 1050 (42S01) at line 645: Table 'events_stages_current' already exists
ERROR 1050 (42S01) at line 660: Table 'events_stages_history' already exists
ERROR 1050 (42S01) at line 675: Table 'events_stages_history_long' already exists
ERROR 1050 (42S01) at line 688: Table 'events_stages_summary_by_thread_by_event_name' already exists
ERROR 1050 (42S01) at line 701: Table 'events_stages_summary_by_host_by_event_name' already exists
ERROR 1050 (42S01) at line 714: Table 'events_stages_summary_by_user_by_event_name' already exists
ERROR 1050 (42S01) at line 728: Table 'events_stages_summary_by_account_by_event_name' already exists
ERROR 1050 (42S01) at line 740: Table 'events_stages_summary_global_by_event_name' already exists
ERROR 1050 (42S01) at line 783: Table 'events_statements_current' already exists
ERROR 1050 (42S01) at line 826: Table 'events_statements_history' already exists
ERROR 1050 (42S01) at line 869: Table 'events_statements_history_long' already exists
ERROR 1050 (42S01) at line 901: Table 'events_statements_summary_by_thread_by_event_name' already exists
ERROR 1050 (42S01) at line 933: Table 'events_statements_summary_by_host_by_event_name' already exists
ERROR 1050 (42S01) at line 965: Table 'events_statements_summary_by_user_by_event_name' already exists
ERROR 1050 (42S01) at line 998: Table 'events_statements_summary_by_account_by_event_name' already exists
ERROR 1050 (42S01) at line 1029: Table 'events_statements_summary_global_by_event_name' already exists
ERROR 1050 (42S01) at line 1038: Table 'hosts' already exists
ERROR 1050 (42S01) at line 1047: Table 'users' already exists
ERROR 1050 (42S01) at line 1057: Table 'accounts' already exists
ERROR 1644 (HY000) at line 1682: Unexpected content found in the performance_schema database.
FATAL ERROR: Upgrade failed
select name from mysql.proc where db='performance_schema';
name
user_func
update mysql.proc set db='test' where name='user_func';
drop function test.user_func;
"Testing mysql_upgrade with EVENT performance_schema.user_event"
create event test.user_event on schedule every 1 day do
select "not supposed to be here";
update mysql.event set db='performance_schema' where name='user_event';
ERROR 1050 (42S01) at line 100: Table 'cond_instances' already exists
ERROR 1050 (42S01) at line 124: Table 'events_waits_current' already exists
ERROR 1050 (42S01) at line 148: Table 'events_waits_history' already exists
ERROR 1050 (42S01) at line 172: Table 'events_waits_history_long' already exists
ERROR 1050 (42S01) at line 185: Table 'events_waits_summary_by_instance' already exists
ERROR 1050 (42S01) at line 198: Table 'events_waits_summary_by_host_by_event_name' already exists
ERROR 1050 (42S01) at line 211: Table 'events_waits_summary_by_user_by_event_name' already exists
ERROR 1050 (42S01) at line 225: Table 'events_waits_summary_by_account_by_event_name' already exists
ERROR 1050 (42S01) at line 238: Table 'events_waits_summary_by_thread_by_event_name' already exists
ERROR 1050 (42S01) at line 250: Table 'events_waits_summary_global_by_event_name' already exists
ERROR 1050 (42S01) at line 259: Table 'file_instances' already exists
ERROR 1050 (42S01) at line 270: Table 'file_summary_by_event_name' already exists
ERROR 1050 (42S01) at line 282: Table 'file_summary_by_instance' already exists
ERROR 1050 (42S01) at line 295: Table 'socket_instances' already exists
ERROR 1050 (42S01) at line 325: Table 'socket_summary_by_instance' already exists
ERROR 1050 (42S01) at line 354: Table 'socket_summary_by_event_name' already exists
ERROR 1050 (42S01) at line 363: Table 'mutex_instances' already exists
ERROR 1050 (42S01) at line 377: Table 'objects_summary_global_by_type' already exists
ERROR 1050 (42S01) at line 387: Table 'performance_timers' already exists
ERROR 1050 (42S01) at line 397: Table 'rwlock_instances' already exists
ERROR 1050 (42S01) at line 406: Table 'setup_actors' already exists
ERROR 1050 (42S01) at line 414: Table 'setup_consumers' already exists
ERROR 1050 (42S01) at line 423: Table 'setup_instruments' already exists
ERROR 1050 (42S01) at line 434: Table 'setup_objects' already exists
ERROR 1050 (42S01) at line 442: Table 'setup_timers' already exists
ERROR 1050 (42S01) at line 487: Table 'table_io_waits_summary_by_index_usage' already exists
ERROR 1050 (42S01) at line 531: Table 'table_io_waits_summary_by_table' already exists
ERROR 1050 (42S01) at line 610: Table 'table_lock_waits_summary_by_table' already exists
ERROR 1050 (42S01) at line 630: Table 'threads' already exists
ERROR 1050 (42S01) at line 645: Table 'events_stages_current' already exists
ERROR 1050 (42S01) at line 660: Table 'events_stages_history' already exists
ERROR 1050 (42S01) at line 675: Table 'events_stages_history_long' already exists
ERROR 1050 (42S01) at line 688: Table 'events_stages_summary_by_thread_by_event_name' already exists
ERROR 1050 (42S01) at line 701: Table 'events_stages_summary_by_host_by_event_name' already exists
ERROR 1050 (42S01) at line 714: Table 'events_stages_summary_by_user_by_event_name' already exists
ERROR 1050 (42S01) at line 728: Table 'events_stages_summary_by_account_by_event_name' already exists
ERROR 1050 (42S01) at line 740: Table 'events_stages_summary_global_by_event_name' already exists
ERROR 1050 (42S01) at line 783: Table 'events_statements_current' already exists
ERROR 1050 (42S01) at line 826: Table 'events_statements_history' already exists
ERROR 1050 (42S01) at line 869: Table 'events_statements_history_long' already exists
ERROR 1050 (42S01) at line 901: Table 'events_statements_summary_by_thread_by_event_name' already exists
ERROR 1050 (42S01) at line 933: Table 'events_statements_summary_by_host_by_event_name' already exists
ERROR 1050 (42S01) at line 965: Table 'events_statements_summary_by_user_by_event_name' already exists
ERROR 1050 (42S01) at line 998: Table 'events_statements_summary_by_account_by_event_name' already exists
ERROR 1050 (42S01) at line 1029: Table 'events_statements_summary_global_by_event_name' already exists
ERROR 1050 (42S01) at line 1038: Table 'hosts' already exists
ERROR 1050 (42S01) at line 1047: Table 'users' already exists
ERROR 1050 (42S01) at line 1057: Table 'accounts' already exists
ERROR 1644 (HY000) at line 1682: Unexpected content found in the performance_schema database.
FATAL ERROR: Upgrade failed
select name from mysql.event where db='performance_schema';
name
user_event
update mysql.event set db='test' where name='user_event';
drop event test.user_event;
