CREATE TABLE t1 (
a VARCHAR(255) NOT NULL,
b VARCHAR(255) NOT NULL,
c VARCHAR(255) NOT NULL,
d VARCHAR(175) NOT NULL,
g GEOMETRY NOT NULL SRID 4326,
PRIMARY KEY (a, b, c, d),
SPATIAL KEY idx_g (g)
) ENGINE=InnoDB ROW_FORMAT=COMPRESSED KEY_BLOCK_SIZE=2 CHARSET=latin1;
INSERT INTO t1 (a,b,c,d,g)
VALUES ('a', 'b', 'c', 'd', ST_GeomFromText('POINT(0 0)', 4326));
INSERT INTO t1 (a,b,c,d,g) VALUES (
REPEAT('a',255),
REPEAT('b',255),
REPEAT('c',255),
REPEAT('d',175),
ST_GeomFromText('POINT(1 1)', 4326)
);
CREATE TABLE nums(id INT PRIMARY KEY);
INSERT INTO nums VALUES (1);
INSERT INTO nums SELECT id + (SELECT MAX(id) FROM nums) FROM nums;
INSERT INTO nums SELECT id + (SELECT MAX(id) FROM nums) FROM nums;
INSERT INTO nums SELECT id + (SELECT MAX(id) FROM nums) FROM nums;
INSERT INTO nums SELECT id + (SELECT MAX(id) FROM nums) FROM nums;
INSERT INTO nums SELECT id + (SELECT MAX(id) FROM nums) FROM nums;
INSERT INTO nums SELECT id + (SELECT MAX(id) FROM nums) FROM nums;
INSERT INTO nums SELECT id + (SELECT MAX(id) FROM nums) FROM nums;
INSERT INTO nums SELECT id + (SELECT MAX(id) FROM nums) FROM nums;
INSERT INTO nums SELECT id + (SELECT MAX(id) FROM nums) FROM nums;
INSERT INTO nums SELECT id + (SELECT MAX(id) FROM nums) FROM nums;
INSERT INTO t1 (a,b,c,d,g)
SELECT REPEAT(id,50), REPEAT('b',255), REPEAT('c',255), 'd2', ST_GeomFromText(
CONCAT('POINT(', MOD(id,90), ' -122.4194)'),
4326
) FROM nums;
DROP TABLE nums;
# Before DELETE:
SELECT a,b,c,d,ST_AsText(g) FROM t1 WHERE g=ST_GeomFromText('POINT(40 -122.4194)', 4326);
a	b	c	d	ST_AsText(g)
130130130130130130130130130130130130130130130130130130130130130130130130130130130130130130130130130130130130130130130130130130130130130130130130130130	bbbbbbbbbbbbbbbbbbbbbbbbbbbbbbbbbbbbbbbbbbbbbbbbbbbbbbbbbbbbbbbbbbbbbbbbbbbbbbbbbbbbbbbbbbbbbbbbbbbbbbbbbbbbbbbbbbbbbbbbbbbbbbbbbbbbbbbbbbbbbbbbbbbbbbbbbbbbbbbbbbbbbbbbbbbbbbbbbbbbbbbbbbbbbbbbbbbbbbbbbbbbbbbbbbbbbbbbbbbbbbbbbbbbbbbbbbbbbbbbbbbbbbbbbbbbbbb	ccccccccccccccccccccccccccccccccccccccccccccccccccccccccccccccccccccccccccccccccccccccccccccccccccccccccccccccccccccccccccccccccccccccccccccccccccccccccccccccccccccccccccccccccccccccccccccccccccccccccccccccccccccccccccccccccccccccccccccccccccccccccccccccc	d2	POINT(40 -122.4194)
220220220220220220220220220220220220220220220220220220220220220220220220220220220220220220220220220220220220220220220220220220220220220220220220220220	bbbbbbbbbbbbbbbbbbbbbbbbbbbbbbbbbbbbbbbbbbbbbbbbbbbbbbbbbbbbbbbbbbbbbbbbbbbbbbbbbbbbbbbbbbbbbbbbbbbbbbbbbbbbbbbbbbbbbbbbbbbbbbbbbbbbbbbbbbbbbbbbbbbbbbbbbbbbbbbbbbbbbbbbbbbbbbbbbbbbbbbbbbbbbbbbbbbbbbbbbbbbbbbbbbbbbbbbbbbbbbbbbbbbbbbbbbbbbbbbbbbbbbbbbbbbbbb	ccccccccccccccccccccccccccccccccccccccccccccccccccccccccccccccccccccccccccccccccccccccccccccccccccccccccccccccccccccccccccccccccccccccccccccccccccccccccccccccccccccccccccccccccccccccccccccccccccccccccccccccccccccccccccccccccccccccccccccccccccccccccccccccc	d2	POINT(40 -122.4194)
310310310310310310310310310310310310310310310310310310310310310310310310310310310310310310310310310310310310310310310310310310310310310310310310310310	bbbbbbbbbbbbbbbbbbbbbbbbbbbbbbbbbbbbbbbbbbbbbbbbbbbbbbbbbbbbbbbbbbbbbbbbbbbbbbbbbbbbbbbbbbbbbbbbbbbbbbbbbbbbbbbbbbbbbbbbbbbbbbbbbbbbbbbbbbbbbbbbbbbbbbbbbbbbbbbbbbbbbbbbbbbbbbbbbbbbbbbbbbbbbbbbbbbbbbbbbbbbbbbbbbbbbbbbbbbbbbbbbbbbbbbbbbbbbbbbbbbbbbbbbbbbbbb	ccccccccccccccccccccccccccccccccccccccccccccccccccccccccccccccccccccccccccccccccccccccccccccccccccccccccccccccccccccccccccccccccccccccccccccccccccccccccccccccccccccccccccccccccccccccccccccccccccccccccccccccccccccccccccccccccccccccccccccccccccccccccccccccc	d2	POINT(40 -122.4194)
400400400400400400400400400400400400400400400400400400400400400400400400400400400400400400400400400400400400400400400400400400400400400400400400400400	bbbbbbbbbbbbbbbbbbbbbbbbbbbbbbbbbbbbbbbbbbbbbbbbbbbbbbbbbbbbbbbbbbbbbbbbbbbbbbbbbbbbbbbbbbbbbbbbbbbbbbbbbbbbbbbbbbbbbbbbbbbbbbbbbbbbbbbbbbbbbbbbbbbbbbbbbbbbbbbbbbbbbbbbbbbbbbbbbbbbbbbbbbbbbbbbbbbbbbbbbbbbbbbbbbbbbbbbbbbbbbbbbbbbbbbbbbbbbbbbbbbbbbbbbbbbbbb	ccccccccccccccccccccccccccccccccccccccccccccccccccccccccccccccccccccccccccccccccccccccccccccccccccccccccccccccccccccccccccccccccccccccccccccccccccccccccccccccccccccccccccccccccccccccccccccccccccccccccccccccccccccccccccccccccccccccccccccccccccccccccccccccc	d2	POINT(40 -122.4194)
4040404040404040404040404040404040404040404040404040404040404040404040404040404040404040404040404040	bbbbbbbbbbbbbbbbbbbbbbbbbbbbbbbbbbbbbbbbbbbbbbbbbbbbbbbbbbbbbbbbbbbbbbbbbbbbbbbbbbbbbbbbbbbbbbbbbbbbbbbbbbbbbbbbbbbbbbbbbbbbbbbbbbbbbbbbbbbbbbbbbbbbbbbbbbbbbbbbbbbbbbbbbbbbbbbbbbbbbbbbbbbbbbbbbbbbbbbbbbbbbbbbbbbbbbbbbbbbbbbbbbbbbbbbbbbbbbbbbbbbbbbbbbbbbbb	ccccccccccccccccccccccccccccccccccccccccccccccccccccccccccccccccccccccccccccccccccccccccccccccccccccccccccccccccccccccccccccccccccccccccccccccccccccccccccccccccccccccccccccccccccccccccccccccccccccccccccccccccccccccccccccccccccccccccccccccccccccccccccccccc	d2	POINT(40 -122.4194)
490490490490490490490490490490490490490490490490490490490490490490490490490490490490490490490490490490490490490490490490490490490490490490490490490490	bbbbbbbbbbbbbbbbbbbbbbbbbbbbbbbbbbbbbbbbbbbbbbbbbbbbbbbbbbbbbbbbbbbbbbbbbbbbbbbbbbbbbbbbbbbbbbbbbbbbbbbbbbbbbbbbbbbbbbbbbbbbbbbbbbbbbbbbbbbbbbbbbbbbbbbbbbbbbbbbbbbbbbbbbbbbbbbbbbbbbbbbbbbbbbbbbbbbbbbbbbbbbbbbbbbbbbbbbbbbbbbbbbbbbbbbbbbbbbbbbbbbbbbbbbbbbbb	ccccccccccccccccccccccccccccccccccccccccccccccccccccccccccccccccccccccccccccccccccccccccccccccccccccccccccccccccccccccccccccccccccccccccccccccccccccccccccccccccccccccccccccccccccccccccccccccccccccccccccccccccccccccccccccccccccccccccccccccccccccccccccccccc	d2	POINT(40 -122.4194)
580580580580580580580580580580580580580580580580580580580580580580580580580580580580580580580580580580580580580580580580580580580580580580580580580580	bbbbbbbbbbbbbbbbbbbbbbbbbbbbbbbbbbbbbbbbbbbbbbbbbbbbbbbbbbbbbbbbbbbbbbbbbbbbbbbbbbbbbbbbbbbbbbbbbbbbbbbbbbbbbbbbbbbbbbbbbbbbbbbbbbbbbbbbbbbbbbbbbbbbbbbbbbbbbbbbbbbbbbbbbbbbbbbbbbbbbbbbbbbbbbbbbbbbbbbbbbbbbbbbbbbbbbbbbbbbbbbbbbbbbbbbbbbbbbbbbbbbbbbbbbbbbbb	ccccccccccccccccccccccccccccccccccccccccccccccccccccccccccccccccccccccccccccccccccccccccccccccccccccccccccccccccccccccccccccccccccccccccccccccccccccccccccccccccccccccccccccccccccccccccccccccccccccccccccccccccccccccccccccccccccccccccccccccccccccccccccccccc	d2	POINT(40 -122.4194)
670670670670670670670670670670670670670670670670670670670670670670670670670670670670670670670670670670670670670670670670670670670670670670670670670670	bbbbbbbbbbbbbbbbbbbbbbbbbbbbbbbbbbbbbbbbbbbbbbbbbbbbbbbbbbbbbbbbbbbbbbbbbbbbbbbbbbbbbbbbbbbbbbbbbbbbbbbbbbbbbbbbbbbbbbbbbbbbbbbbbbbbbbbbbbbbbbbbbbbbbbbbbbbbbbbbbbbbbbbbbbbbbbbbbbbbbbbbbbbbbbbbbbbbbbbbbbbbbbbbbbbbbbbbbbbbbbbbbbbbbbbbbbbbbbbbbbbbbbbbbbbbbbb	ccccccccccccccccccccccccccccccccccccccccccccccccccccccccccccccccccccccccccccccccccccccccccccccccccccccccccccccccccccccccccccccccccccccccccccccccccccccccccccccccccccccccccccccccccccccccccccccccccccccccccccccccccccccccccccccccccccccccccccccccccccccccccccccc	d2	POINT(40 -122.4194)
760760760760760760760760760760760760760760760760760760760760760760760760760760760760760760760760760760760760760760760760760760760760760760760760760760	bbbbbbbbbbbbbbbbbbbbbbbbbbbbbbbbbbbbbbbbbbbbbbbbbbbbbbbbbbbbbbbbbbbbbbbbbbbbbbbbbbbbbbbbbbbbbbbbbbbbbbbbbbbbbbbbbbbbbbbbbbbbbbbbbbbbbbbbbbbbbbbbbbbbbbbbbbbbbbbbbbbbbbbbbbbbbbbbbbbbbbbbbbbbbbbbbbbbbbbbbbbbbbbbbbbbbbbbbbbbbbbbbbbbbbbbbbbbbbbbbbbbbbbbbbbbbbb	ccccccccccccccccccccccccccccccccccccccccccccccccccccccccccccccccccccccccccccccccccccccccccccccccccccccccccccccccccccccccccccccccccccccccccccccccccccccccccccccccccccccccccccccccccccccccccccccccccccccccccccccccccccccccccccccccccccccccccccccccccccccccccccccc	d2	POINT(40 -122.4194)
850850850850850850850850850850850850850850850850850850850850850850850850850850850850850850850850850850850850850850850850850850850850850850850850850850	bbbbbbbbbbbbbbbbbbbbbbbbbbbbbbbbbbbbbbbbbbbbbbbbbbbbbbbbbbbbbbbbbbbbbbbbbbbbbbbbbbbbbbbbbbbbbbbbbbbbbbbbbbbbbbbbbbbbbbbbbbbbbbbbbbbbbbbbbbbbbbbbbbbbbbbbbbbbbbbbbbbbbbbbbbbbbbbbbbbbbbbbbbbbbbbbbbbbbbbbbbbbbbbbbbbbbbbbbbbbbbbbbbbbbbbbbbbbbbbbbbbbbbbbbbbbbbb	ccccccccccccccccccccccccccccccccccccccccccccccccccccccccccccccccccccccccccccccccccccccccccccccccccccccccccccccccccccccccccccccccccccccccccccccccccccccccccccccccccccccccccccccccccccccccccccccccccccccccccccccccccccccccccccccccccccccccccccccccccccccccccccccc	d2	POINT(40 -122.4194)
940940940940940940940940940940940940940940940940940940940940940940940940940940940940940940940940940940940940940940940940940940940940940940940940940940	bbbbbbbbbbbbbbbbbbbbbbbbbbbbbbbbbbbbbbbbbbbbbbbbbbbbbbbbbbbbbbbbbbbbbbbbbbbbbbbbbbbbbbbbbbbbbbbbbbbbbbbbbbbbbbbbbbbbbbbbbbbbbbbbbbbbbbbbbbbbbbbbbbbbbbbbbbbbbbbbbbbbbbbbbbbbbbbbbbbbbbbbbbbbbbbbbbbbbbbbbbbbbbbbbbbbbbbbbbbbbbbbbbbbbbbbbbbbbbbbbbbbbbbbbbbbbbb	ccccccccccccccccccccccccccccccccccccccccccccccccccccccccccccccccccccccccccccccccccccccccccccccccccccccccccccccccccccccccccccccccccccccccccccccccccccccccccccccccccccccccccccccccccccccccccccccccccccccccccccccccccccccccccccccccccccccccccccccccccccccccccccccc	d2	POINT(40 -122.4194)
SELECT COUNT(*) FROM t1;
COUNT(*)
1026
DELETE FROM t1 WHERE g=ST_GeomFromText('POINT(40 -122.4194)', 4326);
# After DELETE
SELECT a,b,c,d,ST_AsText(g) FROM t1 WHERE g=ST_GeomFromText('POINT(40 -122.4194)', 4326);
a	b	c	d	ST_AsText(g)
SELECT COUNT(*) FROM t1;
COUNT(*)
1015
DROP TABLE t1;
