SET NAMES armscii8;
CREATE TABLE test.t1 (a VARCHAR(3) CHARACTER SET armscii8 COLLATE armscii8_bin) ENGINE=MyISAM CHARACTER SET armscii8 COLLATE armscii8_bin;
SHOW TABLE STATUS LIKE 't1';
Name	Engine	Version	Row_format	Rows	Avg_row_length	Data_length	Max_data_length	Index_length	Data_free	Auto_increment	Create_time	Update_time	Check_time	Collation	Checksum	Create_options	Comment
t1	MyISAM	#	#	#	#	#	#	#	#	#	#	#	#	armscii8_bin	#	#	#
SELECT HEX(ASCII(a)) AS a_ascii, CHAR_LENGTH(a) AS a_len FROM test.t1 ORDER BY a, ORD(a);
a_ascii	a_len
21	1
22	1
23	1
24	1
25	1
26	1
27	1
28	1
29	1
2A	1
2B	1
2C	1
2D	1
2E	1
2F	1
30	1
31	1
32	1
33	1
34	1
35	1
36	1
37	1
38	1
39	1
3A	1
3B	1
3C	1
3D	1
3E	1
3F	1
40	1
41	1
42	1
43	1
44	1
45	1
46	1
47	1
48	1
49	1
4A	1
4B	1
4C	1
4D	1
4E	1
4F	1
50	1
51	1
52	1
53	1
54	1
55	1
56	1
57	1
58	1
59	1
5A	1
5B	1
5C	1
5D	1
5E	1
5F	1
60	1
61	1
62	1
63	1
64	1
65	1
66	1
67	1
68	1
69	1
6A	1
6B	1
6C	1
6D	1
6E	1
6F	1
70	1
71	1
72	1
73	1
74	1
75	1
76	1
77	1
78	1
79	1
7A	1
7B	1
7C	1
7D	1
7E	1
7F	1
80	1
81	1
82	1
83	1
84	1
85	1
86	1
87	1
88	1
89	1
8A	1
8B	1
8C	1
8D	1
8E	1
8F	1
90	1
91	1
92	1
93	1
94	1
95	1
96	1
97	1
98	1
99	1
9A	1
9B	1
9C	1
9D	1
9E	1
9F	1
A0	1
A1	1
A2	1
A3	1
A4	1
A5	1
A6	1
A7	1
A8	1
A9	1
AA	1
AB	1
AC	1
AD	1
AE	1
AF	1
B0	1
B1	1
B2	1
B3	1
B4	1
B5	1
B6	1
B7	1
B8	1
B9	1
BA	1
BB	1
BC	1
BD	1
BE	1
BF	1
C0	1
C1	1
C2	1
C3	1
C4	1
C5	1
C6	1
C7	1
C8	1
C9	1
CA	1
CB	1
CC	1
CD	1
CE	1
CF	1
D0	1
D1	1
D2	1
D3	1
D4	1
D5	1
D6	1
D7	1
D8	1
D9	1
DA	1
DB	1
DC	1
DD	1
DE	1
DF	1
E0	1
E1	1
E2	1
E3	1
E4	1
E5	1
E6	1
E7	1
E8	1
E9	1
EA	1
EB	1
EC	1
ED	1
EE	1
EF	1
F0	1
F1	1
F2	1
F3	1
F4	1
F5	1
F6	1
F7	1
F8	1
F9	1
FA	1
FB	1
FC	1
FD	1
DROP TABLE test.t1;
SET NAMES armscii8;
CREATE TABLE test.t1 (a VARCHAR(3) CHARACTER SET armscii8 COLLATE armscii8_general_ci) ENGINE=MyISAM CHARACTER SET armscii8 COLLATE armscii8_general_ci;
SHOW TABLE STATUS LIKE 't1';
Name	Engine	Version	Row_format	Rows	Avg_row_length	Data_length	Max_data_length	Index_length	Data_free	Auto_increment	Create_time	Update_time	Check_time	Collation	Checksum	Create_options	Comment
t1	MyISAM	#	#	#	#	#	#	#	#	#	#	#	#	armscii8_general_ci	#	#	#
SELECT HEX(ASCII(a)) AS a_ascii, CHAR_LENGTH(a) AS a_len FROM test.t1 ORDER BY a, ORD(a);
a_ascii	a_len
21	1
22	1
23	1
24	1
25	1
26	1
27	1
28	1
29	1
2A	1
2B	1
2C	1
2D	1
2E	1
2F	1
30	1
31	1
32	1
33	1
34	1
35	1
36	1
37	1
38	1
39	1
3A	1
3B	1
3C	1
3D	1
3E	1
3F	1
40	1
41	1
61	1
42	1
62	1
43	1
63	1
44	1
64	1
45	1
65	1
46	1
66	1
47	1
67	1
48	1
68	1
49	1
69	1
4A	1
6A	1
4B	1
6B	1
4C	1
6C	1
4D	1
6D	1
4E	1
6E	1
4F	1
6F	1
50	1
70	1
51	1
71	1
52	1
72	1
53	1
73	1
54	1
74	1
55	1
75	1
56	1
76	1
57	1
77	1
58	1
78	1
59	1
79	1
5A	1
7A	1
5B	1
5C	1
5D	1
5E	1
5F	1
60	1
7B	1
7C	1
7D	1
7E	1
7F	1
80	1
81	1
82	1
83	1
84	1
85	1
86	1
87	1
88	1
89	1
8A	1
8B	1
8C	1
8D	1
8E	1
8F	1
90	1
91	1
92	1
93	1
94	1
95	1
96	1
97	1
98	1
99	1
9A	1
9B	1
9C	1
9D	1
9E	1
9F	1
A0	1
A1	1
A2	1
A3	1
A4	1
A5	1
A6	1
A7	1
A8	1
A9	1
AA	1
AB	1
AC	1
AD	1
AE	1
AF	1
B0	1
B1	1
B2	1
B3	1
B4	1
B5	1
B6	1
B7	1
B8	1
B9	1
BA	1
BB	1
BC	1
BD	1
BE	1
BF	1
C0	1
C1	1
C2	1
C3	1
C4	1
C5	1
C6	1
C7	1
C8	1
C9	1
CA	1
CB	1
CC	1
CD	1
CE	1
CF	1
D0	1
D1	1
D2	1
D3	1
D4	1
D5	1
D6	1
D7	1
D8	1
D9	1
DA	1
DB	1
DC	1
DD	1
DE	1
DF	1
E0	1
E1	1
E2	1
E3	1
E4	1
E5	1
E6	1
E7	1
E8	1
E9	1
EA	1
EB	1
EC	1
ED	1
EE	1
EF	1
F0	1
F1	1
F2	1
F3	1
F4	1
F5	1
F6	1
F7	1
F8	1
F9	1
FA	1
FB	1
FC	1
FD	1
DROP TABLE test.t1;
SET NAMES ascii;
CREATE TABLE test.t1 (a VARCHAR(3) CHARACTER SET ascii COLLATE ascii_bin) ENGINE=MyISAM CHARACTER SET ascii COLLATE ascii_bin;
SHOW TABLE STATUS LIKE 't1';
Name	Engine	Version	Row_format	Rows	Avg_row_length	Data_length	Max_data_length	Index_length	Data_free	Auto_increment	Create_time	Update_time	Check_time	Collation	Checksum	Create_options	Comment
t1	MyISAM	#	#	#	#	#	#	#	#	#	#	#	#	ascii_bin	#	#	#
SELECT HEX(ASCII(a)) AS a_ascii, CHAR_LENGTH(a) AS a_len FROM test.t1 ORDER BY a, ORD(a);
a_ascii	a_len
21	1
22	1
23	1
24	1
25	1
26	1
27	1
28	1
29	1
2A	1
2B	1
2C	1
2D	1
2E	1
2F	1
30	1
31	1
32	1
33	1
34	1
35	1
36	1
37	1
38	1
39	1
3A	1
3B	1
3C	1
3D	1
3E	1
3F	1
40	1
41	1
42	1
43	1
44	1
45	1
46	1
47	1
48	1
49	1
4A	1
4B	1
4C	1
4D	1
4E	1
4F	1
50	1
51	1
52	1
53	1
54	1
55	1
56	1
57	1
58	1
59	1
5A	1
5B	1
5C	1
5D	1
5E	1
5F	1
60	1
61	1
62	1
63	1
64	1
65	1
66	1
67	1
68	1
69	1
6A	1
6B	1
6C	1
6D	1
6E	1
6F	1
70	1
71	1
72	1
73	1
74	1
75	1
76	1
77	1
78	1
79	1
7A	1
7B	1
7C	1
7D	1
7E	1
7F	1
DROP TABLE test.t1;
SET NAMES ascii;
CREATE TABLE test.t1 (a VARCHAR(3) CHARACTER SET ascii COLLATE ascii_general_ci) ENGINE=MyISAM CHARACTER SET ascii COLLATE ascii_general_ci;
SHOW TABLE STATUS LIKE 't1';
Name	Engine	Version	Row_format	Rows	Avg_row_length	Data_length	Max_data_length	Index_length	Data_free	Auto_increment	Create_time	Update_time	Check_time	Collation	Checksum	Create_options	Comment
t1	MyISAM	#	#	#	#	#	#	#	#	#	#	#	#	ascii_general_ci	#	#	#
SELECT HEX(ASCII(a)) AS a_ascii, CHAR_LENGTH(a) AS a_len FROM test.t1 ORDER BY a, ORD(a);
a_ascii	a_len
21	1
22	1
23	1
24	1
25	1
26	1
27	1
28	1
29	1
2A	1
2B	1
2C	1
2D	1
2E	1
2F	1
30	1
31	1
32	1
33	1
34	1
35	1
36	1
37	1
38	1
39	1
3A	1
3B	1
3C	1
3D	1
3E	1
3F	1
40	1
41	1
61	1
42	1
62	1
43	1
63	1
44	1
64	1
45	1
65	1
46	1
66	1
47	1
67	1
48	1
68	1
49	1
69	1
4A	1
6A	1
4B	1
6B	1
4C	1
6C	1
4D	1
6D	1
4E	1
6E	1
4F	1
6F	1
50	1
70	1
51	1
71	1
52	1
72	1
53	1
73	1
54	1
74	1
55	1
75	1
56	1
76	1
57	1
77	1
58	1
78	1
59	1
79	1
5A	1
7A	1
5B	1
5C	1
5D	1
5E	1
5F	1
60	1
7B	1
7C	1
7D	1
7E	1
7F	1
DROP TABLE test.t1;
SET NAMES big5;
CREATE TABLE test.t1 (a VARCHAR(3) CHARACTER SET big5 COLLATE big5_bin) ENGINE=MyISAM CHARACTER SET big5 COLLATE big5_bin;
SHOW TABLE STATUS LIKE 't1';
Name	Engine	Version	Row_format	Rows	Avg_row_length	Data_length	Max_data_length	Index_length	Data_free	Auto_increment	Create_time	Update_time	Check_time	Collation	Checksum	Create_options	Comment
t1	MyISAM	#	#	#	#	#	#	#	#	#	#	#	#	big5_bin	#	#	#
SELECT HEX(ASCII(a)) AS a_ascii, CHAR_LENGTH(a) AS a_len FROM test.t1 ORDER BY a, ORD(a);
a_ascii	a_len
21	1
22	1
23	1
24	1
25	1
26	1
27	1
28	1
29	1
2A	1
2B	1
2C	1
2D	1
2E	1
2F	1
30	1
31	1
32	1
33	1
34	1
35	1
36	1
37	1
38	1
39	1
3A	1
3B	1
3C	1
3D	1
3E	1
3F	1
40	1
41	1
42	1
43	1
44	1
45	1
46	1
47	1
48	1
49	1
4A	1
4B	1
4C	1
4D	1
4E	1
4F	1
50	1
51	1
52	1
53	1
54	1
55	1
56	1
57	1
58	1
59	1
5A	1
5B	1
5C	1
5D	1
5E	1
5F	1
60	1
61	1
62	1
63	1
64	1
65	1
66	1
67	1
68	1
69	1
6A	1
6B	1
6C	1
6D	1
6E	1
6F	1
70	1
71	1
72	1
73	1
74	1
75	1
76	1
77	1
78	1
79	1
7A	1
7B	1
7C	1
7D	1
7E	1
7F	1
DROP TABLE test.t1;
SET NAMES big5;
CREATE TABLE test.t1 (a VARCHAR(3) CHARACTER SET big5 COLLATE big5_chinese_ci) ENGINE=MyISAM CHARACTER SET big5 COLLATE big5_chinese_ci;
SHOW TABLE STATUS LIKE 't1';
Name	Engine	Version	Row_format	Rows	Avg_row_length	Data_length	Max_data_length	Index_length	Data_free	Auto_increment	Create_time	Update_time	Check_time	Collation	Checksum	Create_options	Comment
t1	MyISAM	#	#	#	#	#	#	#	#	#	#	#	#	big5_chinese_ci	#	#	#
SELECT HEX(ASCII(a)) AS a_ascii, CHAR_LENGTH(a) AS a_len FROM test.t1 ORDER BY a, ORD(a);
a_ascii	a_len
21	1
22	1
23	1
24	1
25	1
26	1
27	1
28	1
29	1
2A	1
2B	1
2C	1
2D	1
2E	1
2F	1
30	1
31	1
32	1
33	1
34	1
35	1
36	1
37	1
38	1
39	1
3A	1
3B	1
3C	1
3D	1
3E	1
3F	1
40	1
41	1
61	1
42	1
62	1
43	1
63	1
44	1
64	1
45	1
60	1
65	1
46	1
66	1
47	1
67	1
48	1
68	1
49	1
69	1
4A	1
6A	1
4B	1
6B	1
4C	1
6C	1
4D	1
6D	1
4E	1
6E	1
4F	1
6F	1
50	1
70	1
51	1
71	1
52	1
72	1
53	1
73	1
54	1
74	1
55	1
75	1
56	1
76	1
57	1
77	1
58	1
78	1
59	1
79	1
7E	1
5A	1
7A	1
5D	1
5B	1
5C	1
5E	1
5F	1
7B	1
7C	1
7D	1
7F	1
DROP TABLE test.t1;
SET NAMES binary;
CREATE TABLE test.t1 (a VARCHAR(3) CHARACTER SET binary) ENGINE=MyISAM CHARACTER SET binary;
SHOW TABLE STATUS LIKE 't1';
Name	Engine	Version	Row_format	Rows	Avg_row_length	Data_length	Max_data_length	Index_length	Data_free	Auto_increment	Create_time	Update_time	Check_time	Collation	Checksum	Create_options	Comment
t1	MyISAM	#	#	#	#	#	#	#	#	#	#	#	#	binary	#	#	#
SELECT HEX(ASCII(a)) AS a_ascii, CHAR_LENGTH(a) AS a_len FROM test.t1 ORDER BY a, ORD(a);
a_ascii	a_len
21	1
22	1
23	1
24	1
25	1
26	1
27	1
28	1
29	1
2A	1
2B	1
2C	1
2D	1
2E	1
2F	1
30	1
31	1
32	1
33	1
34	1
35	1
36	1
37	1
38	1
39	1
3A	1
3B	1
3C	1
3D	1
3E	1
3F	1
40	1
41	1
42	1
43	1
44	1
45	1
46	1
47	1
48	1
49	1
4A	1
4B	1
4C	1
4D	1
4E	1
4F	1
50	1
51	1
52	1
53	1
54	1
55	1
56	1
57	1
58	1
59	1
5A	1
5B	1
5C	1
5D	1
5E	1
5F	1
60	1
61	1
62	1
63	1
64	1
65	1
66	1
67	1
68	1
69	1
6A	1
6B	1
6C	1
6D	1
6E	1
6F	1
70	1
71	1
72	1
73	1
74	1
75	1
76	1
77	1
78	1
79	1
7A	1
7B	1
7C	1
7D	1
7E	1
7F	1
80	1
81	1
82	1
83	1
84	1
85	1
86	1
87	1
88	1
89	1
8A	1
8B	1
8C	1
8D	1
8E	1
8F	1
90	1
91	1
92	1
93	1
94	1
95	1
96	1
97	1
98	1
99	1
9A	1
9B	1
9C	1
9D	1
9E	1
9F	1
A0	1
A1	1
A2	1
A3	1
A4	1
A5	1
A6	1
A7	1
A8	1
A9	1
AA	1
AB	1
AC	1
AD	1
AE	1
AF	1
B0	1
B1	1
B2	1
B3	1
B4	1
B5	1
B6	1
B7	1
B8	1
B9	1
BA	1
BB	1
BC	1
BD	1
BE	1
BF	1
C0	1
C1	1
C2	1
C3	1
C4	1
C5	1
C6	1
C7	1
C8	1
C9	1
CA	1
CB	1
CC	1
CD	1
CE	1
CF	1
D0	1
D1	1
D2	1
D3	1
D4	1
D5	1
D6	1
D7	1
D8	1
D9	1
DA	1
DB	1
DC	1
DD	1
DE	1
DF	1
E0	1
E1	1
E2	1
E3	1
E4	1
E5	1
E6	1
E7	1
E8	1
E9	1
EA	1
EB	1
EC	1
ED	1
EE	1
EF	1
F0	1
F1	1
F2	1
F3	1
F4	1
F5	1
F6	1
F7	1
F8	1
F9	1
FA	1
FB	1
FC	1
FD	1
DROP TABLE test.t1;
SET NAMES cp1250;
CREATE TABLE test.t1 (a VARCHAR(3) CHARACTER SET cp1250 COLLATE cp1250_bin) ENGINE=MyISAM CHARACTER SET cp1250 COLLATE cp1250_bin;
SHOW TABLE STATUS LIKE 't1';
Name	Engine	Version	Row_format	Rows	Avg_row_length	Data_length	Max_data_length	Index_length	Data_free	Auto_increment	Create_time	Update_time	Check_time	Collation	Checksum	Create_options	Comment
t1	MyISAM	#	#	#	#	#	#	#	#	#	#	#	#	cp1250_bin	#	#	#
SELECT HEX(ASCII(a)) AS a_ascii, CHAR_LENGTH(a) AS a_len FROM test.t1 ORDER BY a, ORD(a);
a_ascii	a_len
21	1
22	1
23	1
24	1
25	1
26	1
27	1
28	1
29	1
2A	1
2B	1
2C	1
2D	1
2E	1
2F	1
30	1
31	1
32	1
33	1
34	1
35	1
36	1
37	1
38	1
39	1
3A	1
3B	1
3C	1
3D	1
3E	1
3F	1
40	1
41	1
42	1
43	1
44	1
45	1
46	1
47	1
48	1
49	1
4A	1
4B	1
4C	1
4D	1
4E	1
4F	1
50	1
51	1
52	1
53	1
54	1
55	1
56	1
57	1
58	1
59	1
5A	1
5B	1
5C	1
5D	1
5E	1
5F	1
60	1
61	1
62	1
63	1
64	1
65	1
66	1
67	1
68	1
69	1
6A	1
6B	1
6C	1
6D	1
6E	1
6F	1
70	1
71	1
72	1
73	1
74	1
75	1
76	1
77	1
78	1
79	1
7A	1
7B	1
7C	1
7D	1
7E	1
7F	1
80	1
81	1
82	1
83	1
84	1
85	1
86	1
87	1
88	1
89	1
8A	1
8B	1
8C	1
8D	1
8E	1
8F	1
90	1
91	1
92	1
93	1
94	1
95	1
96	1
97	1
98	1
99	1
9A	1
9B	1
9C	1
9D	1
9E	1
9F	1
A0	1
A1	1
A2	1
A3	1
A4	1
A5	1
A6	1
A7	1
A8	1
A9	1
AA	1
AB	1
AC	1
AD	1
AE	1
AF	1
B0	1
B1	1
B2	1
B3	1
B4	1
B5	1
B6	1
B7	1
B8	1
B9	1
BA	1
BB	1
BC	1
BD	1
BE	1
BF	1
C0	1
C1	1
C2	1
C3	1
C4	1
C5	1
C6	1
C7	1
C8	1
C9	1
CA	1
CB	1
CC	1
CD	1
CE	1
CF	1
D0	1
D1	1
D2	1
D3	1
D4	1
D5	1
D6	1
D7	1
D8	1
D9	1
DA	1
DB	1
DC	1
DD	1
DE	1
DF	1
E0	1
E1	1
E2	1
E3	1
E4	1
E5	1
E6	1
E7	1
E8	1
E9	1
EA	1
EB	1
EC	1
ED	1
EE	1
EF	1
F0	1
F1	1
F2	1
F3	1
F4	1
F5	1
F6	1
F7	1
F8	1
F9	1
FA	1
FB	1
FC	1
FD	1
DROP TABLE test.t1;
SET NAMES cp1250;
CREATE TABLE test.t1 (a VARCHAR(3) CHARACTER SET cp1250 COLLATE cp1250_croatian_ci) ENGINE=MyISAM CHARACTER SET cp1250 COLLATE cp1250_croatian_ci;
SHOW TABLE STATUS LIKE 't1';
Name	Engine	Version	Row_format	Rows	Avg_row_length	Data_length	Max_data_length	Index_length	Data_free	Auto_increment	Create_time	Update_time	Check_time	Collation	Checksum	Create_options	Comment
t1	MyISAM	#	#	#	#	#	#	#	#	#	#	#	#	cp1250_croatian_ci	#	#	#
SELECT HEX(ASCII(a)) AS a_ascii, CHAR_LENGTH(a) AS a_len FROM test.t1 ORDER BY a, ORD(a);
a_ascii	a_len
21	1
22	1
23	1
24	1
25	1
26	1
27	1
28	1
29	1
2A	1
2B	1
2C	1
2D	1
2E	1
2F	1
30	1
31	1
32	1
33	1
34	1
35	1
36	1
37	1
38	1
39	1
3A	1
3B	1
3C	1
3D	1
3E	1
3F	1
40	1
41	1
61	1
A5	1
B9	1
C1	1
C2	1
C3	1
C4	1
E1	1
E2	1
E3	1
E4	1
42	1
62	1
43	1
63	1
C7	1
E7	1
C8	1
E8	1
C6	1
E6	1
44	1
64	1
CF	1
EF	1
D0	1
F0	1
45	1
65	1
C9	1
CA	1
CB	1
CC	1
E9	1
EA	1
EB	1
EC	1
46	1
66	1
47	1
67	1
48	1
68	1
49	1
69	1
CD	1
CE	1
ED	1
EE	1
4A	1
6A	1
4B	1
6B	1
4C	1
6C	1
A3	1
B3	1
BC	1
BE	1
C5	1
E5	1
4D	1
6D	1
4E	1
6E	1
D1	1
D2	1
F1	1
F2	1
4F	1
6F	1
D3	1
D4	1
D5	1
D6	1
F3	1
F4	1
F5	1
F6	1
50	1
70	1
51	1
71	1
52	1
72	1
C0	1
D8	1
E0	1
F8	1
53	1
73	1
8C	1
9C	1
AA	1
BA	1
DF	1
8A	1
9A	1
54	1
74	1
8D	1
9D	1
DE	1
55	1
75	1
D9	1
DA	1
DB	1
DC	1
F9	1
FA	1
FB	1
FC	1
56	1
76	1
57	1
77	1
58	1
78	1
59	1
79	1
DD	1
FD	1
5A	1
7A	1
8F	1
9F	1
AF	1
BF	1
8E	1
9E	1
5B	1
5C	1
5D	1
5E	1
5F	1
60	1
7B	1
7C	1
7D	1
7E	1
7F	1
80	1
81	1
82	1
83	1
84	1
85	1
86	1
87	1
88	1
89	1
8B	1
90	1
91	1
92	1
93	1
94	1
95	1
96	1
97	1
98	1
99	1
9B	1
A0	1
A1	1
A2	1
A4	1
A6	1
A7	1
A8	1
A9	1
AB	1
AC	1
AD	1
AE	1
B0	1
B1	1
B2	1
B4	1
B5	1
B6	1
B7	1
B8	1
BB	1
BD	1
D7	1
F7	1
DROP TABLE test.t1;
SET NAMES cp1250;
CREATE TABLE test.t1 (a VARCHAR(3) CHARACTER SET cp1250 COLLATE cp1250_czech_cs) ENGINE=MyISAM CHARACTER SET cp1250 COLLATE cp1250_czech_cs;
SHOW TABLE STATUS LIKE 't1';
Name	Engine	Version	Row_format	Rows	Avg_row_length	Data_length	Max_data_length	Index_length	Data_free	Auto_increment	Create_time	Update_time	Check_time	Collation	Checksum	Create_options	Comment
t1	MyISAM	#	#	#	#	#	#	#	#	#	#	#	#	cp1250_czech_cs	#	#	#
SELECT HEX(ASCII(a)) AS a_ascii, CHAR_LENGTH(a) AS a_len FROM test.t1 ORDER BY a, ORD(a);
a_ascii	a_len
7F	1
80	1
81	1
83	1
88	1
90	1
98	1
B6	1
A0	1
21	1
22	1
23	1
24	1
25	1
26	1
27	1
28	1
29	1
2A	1
2B	1
2C	1
2D	1
2E	1
2F	1
30	1
31	1
32	1
33	1
34	1
35	1
36	1
37	1
38	1
39	1
3A	1
3B	1
3C	1
3D	1
3E	1
3F	1
40	1
41	1
61	1
C1	1
E1	1
C2	1
E2	1
C3	1
E3	1
C4	1
E4	1
A5	1
B9	1
42	1
62	1
43	1
63	1
C6	1
E6	1
C7	1
E7	1
C8	1
E8	1
44	1
64	1
CF	1
EF	1
D0	1
F0	1
45	1
65	1
C9	1
E9	1
CC	1
EC	1
CB	1
EB	1
CA	1
EA	1
46	1
66	1
47	1
67	1
48	1
68	1
49	1
69	1
CD	1
ED	1
CE	1
EE	1
4A	1
6A	1
4B	1
6B	1
4C	1
6C	1
C5	1
E5	1
BC	1
BE	1
A3	1
B3	1
4D	1
6D	1
4E	1
6E	1
D1	1
F1	1
D2	1
F2	1
4F	1
6F	1
D3	1
F3	1
D4	1
F4	1
D6	1
F6	1
D5	1
F5	1
50	1
70	1
51	1
71	1
52	1
72	1
C0	1
E0	1
D8	1
F8	1
53	1
73	1
8C	1
9C	1
AA	1
BA	1
8A	1
9A	1
DF	1
54	1
74	1
8D	1
9D	1
DE	1
55	1
75	1
DA	1
FA	1
D9	1
F9	1
DC	1
FC	1
DB	1
FB	1
56	1
76	1
57	1
77	1
58	1
78	1
59	1
79	1
DD	1
FD	1
5A	1
7A	1
AF	1
BF	1
8F	1
9F	1
8E	1
9E	1
5B	1
5C	1
5D	1
5E	1
5F	1
60	1
7B	1
7C	1
7D	1
7E	1
82	1
84	1
85	1
86	1
87	1
89	1
8B	1
91	1
92	1
93	1
94	1
95	1
96	1
97	1
99	1
9B	1
A1	1
A2	1
A4	1
A6	1
A7	1
A8	1
A9	1
AB	1
AC	1
AD	1
AE	1
B0	1
B1	1
B2	1
B4	1
B5	1
B7	1
B8	1
BB	1
BD	1
D7	1
F7	1
DROP TABLE test.t1;
SET NAMES cp1250;
CREATE TABLE test.t1 (a VARCHAR(3) CHARACTER SET cp1250 COLLATE cp1250_general_ci) ENGINE=MyISAM CHARACTER SET cp1250 COLLATE cp1250_general_ci;
SHOW TABLE STATUS LIKE 't1';
Name	Engine	Version	Row_format	Rows	Avg_row_length	Data_length	Max_data_length	Index_length	Data_free	Auto_increment	Create_time	Update_time	Check_time	Collation	Checksum	Create_options	Comment
t1	MyISAM	#	#	#	#	#	#	#	#	#	#	#	#	cp1250_general_ci	#	#	#
SELECT HEX(ASCII(a)) AS a_ascii, CHAR_LENGTH(a) AS a_len FROM test.t1 ORDER BY a, ORD(a);
a_ascii	a_len
A0	1
21	1
22	1
23	1
24	1
25	1
26	1
27	1
28	1
29	1
2A	1
2B	1
2C	1
2D	1
2E	1
2F	1
30	1
31	1
32	1
33	1
34	1
35	1
36	1
37	1
38	1
39	1
3A	1
3B	1
3C	1
3D	1
3E	1
3F	1
40	1
41	1
61	1
A5	1
B9	1
C1	1
C2	1
C3	1
C4	1
E1	1
E2	1
E3	1
E4	1
42	1
62	1
43	1
63	1
C7	1
E7	1
C8	1
E8	1
C6	1
E6	1
44	1
64	1
CF	1
EF	1
D0	1
F0	1
45	1
65	1
C9	1
CA	1
CB	1
CC	1
E9	1
EA	1
EB	1
EC	1
46	1
66	1
47	1
67	1
48	1
68	1
49	1
69	1
CD	1
CE	1
ED	1
EE	1
4A	1
6A	1
4B	1
6B	1
4C	1
6C	1
A3	1
B3	1
BC	1
BE	1
C5	1
E5	1
4D	1
6D	1
4E	1
6E	1
D1	1
D2	1
F1	1
F2	1
4F	1
6F	1
D3	1
D4	1
D5	1
D6	1
F3	1
F4	1
F5	1
F6	1
50	1
70	1
51	1
71	1
52	1
72	1
C0	1
D8	1
E0	1
F8	1
53	1
73	1
A7	1
AA	1
BA	1
DF	1
8A	1
8C	1
9A	1
9C	1
54	1
74	1
8D	1
9D	1
DE	1
55	1
75	1
D9	1
DA	1
DB	1
DC	1
F9	1
FA	1
FB	1
FC	1
56	1
76	1
57	1
77	1
58	1
78	1
59	1
79	1
DD	1
FD	1
5A	1
7A	1
8E	1
8F	1
9E	1
9F	1
AF	1
BF	1
5B	1
5C	1
5D	1
5E	1
5F	1
60	1
7B	1
7C	1
7D	1
7E	1
7F	1
80	1
81	1
82	1
83	1
84	1
85	1
86	1
87	1
88	1
89	1
8B	1
90	1
91	1
92	1
93	1
94	1
95	1
96	1
97	1
98	1
99	1
9B	1
A1	1
A2	1
A4	1
A6	1
A8	1
A9	1
AB	1
AC	1
AD	1
AE	1
B0	1
B1	1
B2	1
B4	1
B5	1
B6	1
B7	1
B8	1
BB	1
BD	1
D7	1
F7	1
DROP TABLE test.t1;
SET NAMES cp1251;
CREATE TABLE test.t1 (a VARCHAR(3) CHARACTER SET cp1251 COLLATE cp1251_bin) ENGINE=MyISAM CHARACTER SET cp1251 COLLATE cp1251_bin;
SHOW TABLE STATUS LIKE 't1';
Name	Engine	Version	Row_format	Rows	Avg_row_length	Data_length	Max_data_length	Index_length	Data_free	Auto_increment	Create_time	Update_time	Check_time	Collation	Checksum	Create_options	Comment
t1	MyISAM	#	#	#	#	#	#	#	#	#	#	#	#	cp1251_bin	#	#	#
SELECT HEX(ASCII(a)) AS a_ascii, CHAR_LENGTH(a) AS a_len FROM test.t1 ORDER BY a, ORD(a);
a_ascii	a_len
21	1
22	1
23	1
24	1
25	1
26	1
27	1
28	1
29	1
2A	1
2B	1
2C	1
2D	1
2E	1
2F	1
30	1
31	1
32	1
33	1
34	1
35	1
36	1
37	1
38	1
39	1
3A	1
3B	1
3C	1
3D	1
3E	1
3F	1
40	1
41	1
42	1
43	1
44	1
45	1
46	1
47	1
48	1
49	1
4A	1
4B	1
4C	1
4D	1
4E	1
4F	1
50	1
51	1
52	1
53	1
54	1
55	1
56	1
57	1
58	1
59	1
5A	1
5B	1
5C	1
5D	1
5E	1
5F	1
60	1
61	1
62	1
63	1
64	1
65	1
66	1
67	1
68	1
69	1
6A	1
6B	1
6C	1
6D	1
6E	1
6F	1
70	1
71	1
72	1
73	1
74	1
75	1
76	1
77	1
78	1
79	1
7A	1
7B	1
7C	1
7D	1
7E	1
7F	1
80	1
81	1
82	1
83	1
84	1
85	1
86	1
87	1
88	1
89	1
8A	1
8B	1
8C	1
8D	1
8E	1
8F	1
90	1
91	1
92	1
93	1
94	1
95	1
96	1
97	1
98	1
99	1
9A	1
9B	1
9C	1
9D	1
9E	1
9F	1
A0	1
A1	1
A2	1
A3	1
A4	1
A5	1
A6	1
A7	1
A8	1
A9	1
AA	1
AB	1
AC	1
AD	1
AE	1
AF	1
B0	1
B1	1
B2	1
B3	1
B4	1
B5	1
B6	1
B7	1
B8	1
B9	1
BA	1
BB	1
BC	1
BD	1
BE	1
BF	1
C0	1
C1	1
C2	1
C3	1
C4	1
C5	1
C6	1
C7	1
C8	1
C9	1
CA	1
CB	1
CC	1
CD	1
CE	1
CF	1
D0	1
D1	1
D2	1
D3	1
D4	1
D5	1
D6	1
D7	1
D8	1
D9	1
DA	1
DB	1
DC	1
DD	1
DE	1
DF	1
E0	1
E1	1
E2	1
E3	1
E4	1
E5	1
E6	1
E7	1
E8	1
E9	1
EA	1
EB	1
EC	1
ED	1
EE	1
EF	1
F0	1
F1	1
F2	1
F3	1
F4	1
F5	1
F6	1
F7	1
F8	1
F9	1
FA	1
FB	1
FC	1
FD	1
DROP TABLE test.t1;
SET NAMES cp1251;
CREATE TABLE test.t1 (a VARCHAR(3) CHARACTER SET cp1251 COLLATE cp1251_bulgarian_ci) ENGINE=MyISAM CHARACTER SET cp1251 COLLATE cp1251_bulgarian_ci;
SHOW TABLE STATUS LIKE 't1';
Name	Engine	Version	Row_format	Rows	Avg_row_length	Data_length	Max_data_length	Index_length	Data_free	Auto_increment	Create_time	Update_time	Check_time	Collation	Checksum	Create_options	Comment
t1	MyISAM	#	#	#	#	#	#	#	#	#	#	#	#	cp1251_bulgarian_ci	#	#	#
SELECT HEX(ASCII(a)) AS a_ascii, CHAR_LENGTH(a) AS a_len FROM test.t1 ORDER BY a, ORD(a);
a_ascii	a_len
21	1
22	1
23	1
24	1
25	1
26	1
27	1
28	1
29	1
2A	1
2B	1
2C	1
2D	1
2E	1
2F	1
30	1
31	1
32	1
33	1
34	1
35	1
36	1
37	1
38	1
39	1
3A	1
3B	1
3C	1
3D	1
3E	1
3F	1
40	1
41	1
61	1
42	1
62	1
43	1
63	1
44	1
64	1
45	1
65	1
46	1
66	1
47	1
67	1
48	1
68	1
49	1
69	1
4A	1
6A	1
4B	1
6B	1
4C	1
6C	1
4D	1
6D	1
4E	1
6E	1
4F	1
6F	1
50	1
70	1
51	1
71	1
52	1
72	1
53	1
73	1
54	1
74	1
55	1
75	1
56	1
76	1
57	1
77	1
58	1
78	1
59	1
79	1
5A	1
7A	1
C0	1
E0	1
C1	1
E1	1
C2	1
E2	1
C3	1
E3	1
C4	1
E4	1
C5	1
E5	1
A8	1
B8	1
C6	1
E6	1
C7	1
E7	1
C8	1
E8	1
C9	1
E9	1
CA	1
EA	1
CB	1
EB	1
CC	1
EC	1
CD	1
ED	1
CE	1
EE	1
CF	1
EF	1
D0	1
F0	1
D1	1
F1	1
D2	1
F2	1
D3	1
F3	1
D4	1
F4	1
D5	1
F5	1
D6	1
F6	1
D7	1
F7	1
D8	1
F8	1
D9	1
F9	1
DA	1
FA	1
DB	1
FB	1
DC	1
FC	1
DD	1
FD	1
DE	1
DF	1
5B	1
5C	1
5D	1
5E	1
5F	1
60	1
7B	1
7C	1
7D	1
7E	1
7F	1
80	1
81	1
82	1
83	1
84	1
85	1
86	1
87	1
88	1
89	1
8A	1
8B	1
8C	1
8D	1
8E	1
8F	1
90	1
91	1
92	1
93	1
94	1
95	1
96	1
97	1
98	1
99	1
9A	1
9B	1
9C	1
9D	1
9E	1
9F	1
A0	1
A1	1
A2	1
A3	1
A4	1
A5	1
A6	1
A7	1
A9	1
AA	1
AB	1
AC	1
AD	1
AE	1
AF	1
B0	1
B1	1
B2	1
B3	1
B4	1
B5	1
B6	1
B7	1
B9	1
BA	1
BB	1
BC	1
BD	1
BE	1
BF	1
DROP TABLE test.t1;
SET NAMES cp1251;
CREATE TABLE test.t1 (a VARCHAR(3) CHARACTER SET cp1251 COLLATE cp1251_general_ci) ENGINE=MyISAM CHARACTER SET cp1251 COLLATE cp1251_general_ci;
SHOW TABLE STATUS LIKE 't1';
Name	Engine	Version	Row_format	Rows	Avg_row_length	Data_length	Max_data_length	Index_length	Data_free	Auto_increment	Create_time	Update_time	Check_time	Collation	Checksum	Create_options	Comment
t1	MyISAM	#	#	#	#	#	#	#	#	#	#	#	#	cp1251_general_ci	#	#	#
SELECT HEX(ASCII(a)) AS a_ascii, CHAR_LENGTH(a) AS a_len FROM test.t1 ORDER BY a, ORD(a);
a_ascii	a_len
21	1
22	1
23	1
24	1
25	1
26	1
27	1
28	1
29	1
2A	1
2B	1
2C	1
2D	1
2E	1
2F	1
30	1
31	1
32	1
33	1
34	1
35	1
36	1
37	1
38	1
39	1
3A	1
3B	1
3C	1
3D	1
3E	1
3F	1
40	1
41	1
61	1
42	1
62	1
43	1
63	1
44	1
64	1
45	1
65	1
46	1
66	1
47	1
67	1
48	1
68	1
49	1
69	1
4A	1
6A	1
4B	1
6B	1
4C	1
6C	1
4D	1
6D	1
4E	1
6E	1
4F	1
6F	1
50	1
70	1
51	1
71	1
52	1
72	1
53	1
73	1
54	1
74	1
55	1
75	1
56	1
76	1
57	1
77	1
58	1
78	1
59	1
79	1
5A	1
7A	1
C0	1
E0	1
C1	1
E1	1
C2	1
E2	1
C3	1
E3	1
A5	1
B4	1
C4	1
E4	1
80	1
90	1
81	1
83	1
C5	1
E5	1
A8	1
B8	1
AA	1
BA	1
C6	1
E6	1
C7	1
E7	1
BD	1
BE	1
C8	1
E8	1
B2	1
B3	1
AF	1
BF	1
C9	1
E9	1
A3	1
BC	1
CA	1
EA	1
8D	1
9D	1
CB	1
EB	1
8A	1
9A	1
CC	1
EC	1
CD	1
ED	1
8C	1
9C	1
CE	1
EE	1
CF	1
EF	1
D0	1
F0	1
D1	1
F1	1
D2	1
F2	1
8E	1
9E	1
D3	1
F3	1
A1	1
A2	1
D4	1
F4	1
D5	1
F5	1
D6	1
F6	1
D7	1
F7	1
8F	1
9F	1
D8	1
F8	1
D9	1
F9	1
DA	1
FA	1
DB	1
FB	1
DC	1
FC	1
DD	1
FD	1
DE	1
DF	1
5B	1
5C	1
5D	1
5E	1
5F	1
60	1
7B	1
7C	1
7D	1
7E	1
7F	1
82	1
84	1
85	1
86	1
87	1
88	1
89	1
8B	1
91	1
92	1
93	1
94	1
95	1
96	1
97	1
98	1
99	1
9B	1
A0	1
A4	1
A6	1
A7	1
A9	1
AB	1
AC	1
AD	1
AE	1
B0	1
B1	1
B5	1
B6	1
B7	1
B9	1
BB	1
DROP TABLE test.t1;
SET NAMES cp1251;
CREATE TABLE test.t1 (a VARCHAR(3) CHARACTER SET cp1251 COLLATE cp1251_general_cs) ENGINE=MyISAM CHARACTER SET cp1251 COLLATE cp1251_general_cs;
SHOW TABLE STATUS LIKE 't1';
Name	Engine	Version	Row_format	Rows	Avg_row_length	Data_length	Max_data_length	Index_length	Data_free	Auto_increment	Create_time	Update_time	Check_time	Collation	Checksum	Create_options	Comment
t1	MyISAM	#	#	#	#	#	#	#	#	#	#	#	#	cp1251_general_cs	#	#	#
SELECT HEX(ASCII(a)) AS a_ascii, CHAR_LENGTH(a) AS a_len FROM test.t1 ORDER BY a, ORD(a);
a_ascii	a_len
21	1
22	1
23	1
24	1
25	1
26	1
27	1
28	1
29	1
2A	1
2B	1
2C	1
2D	1
2E	1
2F	1
30	1
31	1
32	1
33	1
34	1
35	1
36	1
37	1
38	1
39	1
3A	1
3B	1
3C	1
3D	1
3E	1
3F	1
40	1
41	1
61	1
42	1
62	1
43	1
63	1
44	1
64	1
45	1
65	1
46	1
66	1
47	1
67	1
48	1
68	1
49	1
69	1
4A	1
6A	1
4B	1
6B	1
4C	1
6C	1
4D	1
6D	1
4E	1
6E	1
4F	1
6F	1
50	1
70	1
51	1
71	1
52	1
72	1
53	1
73	1
54	1
74	1
55	1
75	1
56	1
76	1
57	1
77	1
58	1
78	1
59	1
79	1
5A	1
7A	1
C0	1
E0	1
C1	1
E1	1
C2	1
E2	1
C3	1
E3	1
A5	1
B4	1
C4	1
E4	1
80	1
90	1
81	1
83	1
C5	1
E5	1
A8	1
B8	1
AA	1
BA	1
C6	1
E6	1
C7	1
E7	1
BD	1
BE	1
C8	1
E8	1
B2	1
B3	1
AF	1
BF	1
C9	1
E9	1
A3	1
BC	1
CA	1
EA	1
8D	1
9D	1
CB	1
EB	1
8A	1
9A	1
CC	1
EC	1
CD	1
ED	1
8C	1
9C	1
CE	1
EE	1
CF	1
EF	1
D0	1
F0	1
D1	1
F1	1
D2	1
F2	1
8E	1
9E	1
D3	1
F3	1
A1	1
A2	1
D4	1
F4	1
D5	1
F5	1
D6	1
F6	1
D7	1
F7	1
8F	1
9F	1
D8	1
F8	1
D9	1
F9	1
DA	1
FA	1
DB	1
FB	1
DC	1
FC	1
DD	1
FD	1
DE	1
DF	1
5B	1
5C	1
5D	1
5E	1
5F	1
60	1
7B	1
7C	1
7D	1
7E	1
7F	1
82	1
84	1
85	1
86	1
87	1
88	1
89	1
8B	1
91	1
92	1
93	1
94	1
95	1
96	1
97	1
98	1
99	1
9B	1
A0	1
A4	1
A6	1
A7	1
A9	1
AB	1
AC	1
AD	1
AE	1
B0	1
B1	1
B5	1
B6	1
B7	1
B9	1
BB	1
DROP TABLE test.t1;
SET NAMES cp1251;
CREATE TABLE test.t1 (a VARCHAR(3) CHARACTER SET cp1251 COLLATE cp1251_ukrainian_ci) ENGINE=MyISAM CHARACTER SET cp1251 COLLATE cp1251_ukrainian_ci;
SHOW TABLE STATUS LIKE 't1';
Name	Engine	Version	Row_format	Rows	Avg_row_length	Data_length	Max_data_length	Index_length	Data_free	Auto_increment	Create_time	Update_time	Check_time	Collation	Checksum	Create_options	Comment
t1	MyISAM	#	#	#	#	#	#	#	#	#	#	#	#	cp1251_ukrainian_ci	#	#	#
SELECT HEX(ASCII(a)) AS a_ascii, CHAR_LENGTH(a) AS a_len FROM test.t1 ORDER BY a, ORD(a);
a_ascii	a_len
60	1
21	1
22	1
23	1
24	1
25	1
26	1
27	1
28	1
29	1
2A	1
2B	1
2C	1
2D	1
2E	1
2F	1
30	1
31	1
32	1
33	1
34	1
35	1
36	1
37	1
38	1
39	1
3A	1
3B	1
3C	1
3D	1
3E	1
3F	1
40	1
41	1
61	1
42	1
62	1
43	1
63	1
44	1
64	1
45	1
65	1
46	1
66	1
47	1
67	1
48	1
68	1
49	1
69	1
4A	1
6A	1
4B	1
6B	1
4C	1
6C	1
4D	1
6D	1
4E	1
6E	1
4F	1
6F	1
50	1
70	1
51	1
71	1
52	1
72	1
53	1
73	1
54	1
74	1
55	1
75	1
56	1
76	1
57	1
77	1
58	1
78	1
59	1
79	1
5A	1
7A	1
5B	1
5C	1
5D	1
5E	1
5F	1
7B	1
7C	1
7D	1
7E	1
7F	1
C0	1
E0	1
C1	1
E1	1
C2	1
E2	1
C3	1
E3	1
A5	1
B4	1
C4	1
E4	1
C5	1
E5	1
AA	1
BA	1
A8	1
B8	1
C6	1
E6	1
C7	1
E7	1
C8	1
E8	1
B2	1
B3	1
AF	1
BF	1
C9	1
E9	1
CA	1
EA	1
CB	1
EB	1
CC	1
EC	1
CD	1
ED	1
CE	1
EE	1
CF	1
EF	1
D0	1
F0	1
D1	1
F1	1
D2	1
F2	1
D3	1
F3	1
D4	1
F4	1
D5	1
F5	1
D6	1
F6	1
D7	1
F7	1
D8	1
F8	1
D9	1
F9	1
DA	1
FA	1
DB	1
FB	1
DC	1
FC	1
DD	1
FD	1
DE	1
DF	1
80	1
81	1
82	1
83	1
84	1
85	1
86	1
87	1
88	1
89	1
8A	1
8B	1
8C	1
8D	1
8E	1
8F	1
90	1
91	1
92	1
93	1
94	1
95	1
96	1
97	1
98	1
99	1
9A	1
9B	1
9C	1
9D	1
9E	1
9F	1
A0	1
A1	1
A2	1
A3	1
A4	1
A6	1
A7	1
A9	1
AB	1
AC	1
AD	1
AE	1
B0	1
B1	1
B5	1
B6	1
B7	1
B9	1
BB	1
BC	1
BD	1
BE	1
DROP TABLE test.t1;
SET NAMES cp1256;
CREATE TABLE test.t1 (a VARCHAR(3) CHARACTER SET cp1256 COLLATE cp1256_bin) ENGINE=MyISAM CHARACTER SET cp1256 COLLATE cp1256_bin;
SHOW TABLE STATUS LIKE 't1';
Name	Engine	Version	Row_format	Rows	Avg_row_length	Data_length	Max_data_length	Index_length	Data_free	Auto_increment	Create_time	Update_time	Check_time	Collation	Checksum	Create_options	Comment
t1	MyISAM	#	#	#	#	#	#	#	#	#	#	#	#	cp1256_bin	#	#	#
SELECT HEX(ASCII(a)) AS a_ascii, CHAR_LENGTH(a) AS a_len FROM test.t1 ORDER BY a, ORD(a);
a_ascii	a_len
21	1
22	1
23	1
24	1
25	1
26	1
27	1
28	1
29	1
2A	1
2B	1
2C	1
2D	1
2E	1
2F	1
30	1
31	1
32	1
33	1
34	1
35	1
36	1
37	1
38	1
39	1
3A	1
3B	1
3C	1
3D	1
3E	1
3F	1
40	1
41	1
42	1
43	1
44	1
45	1
46	1
47	1
48	1
49	1
4A	1
4B	1
4C	1
4D	1
4E	1
4F	1
50	1
51	1
52	1
53	1
54	1
55	1
56	1
57	1
58	1
59	1
5A	1
5B	1
5C	1
5D	1
5E	1
5F	1
60	1
61	1
62	1
63	1
64	1
65	1
66	1
67	1
68	1
69	1
6A	1
6B	1
6C	1
6D	1
6E	1
6F	1
70	1
71	1
72	1
73	1
74	1
75	1
76	1
77	1
78	1
79	1
7A	1
7B	1
7C	1
7D	1
7E	1
7F	1
80	1
81	1
82	1
83	1
84	1
85	1
86	1
87	1
88	1
89	1
8A	1
8B	1
8C	1
8D	1
8E	1
8F	1
90	1
91	1
92	1
93	1
94	1
95	1
96	1
97	1
98	1
99	1
9A	1
9B	1
9C	1
9D	1
9E	1
9F	1
A0	1
A1	1
A2	1
A3	1
A4	1
A5	1
A6	1
A7	1
A8	1
A9	1
AA	1
AB	1
AC	1
AD	1
AE	1
AF	1
B0	1
B1	1
B2	1
B3	1
B4	1
B5	1
B6	1
B7	1
B8	1
B9	1
BA	1
BB	1
BC	1
BD	1
BE	1
BF	1
C0	1
C1	1
C2	1
C3	1
C4	1
C5	1
C6	1
C7	1
C8	1
C9	1
CA	1
CB	1
CC	1
CD	1
CE	1
CF	1
D0	1
D1	1
D2	1
D3	1
D4	1
D5	1
D6	1
D7	1
D8	1
D9	1
DA	1
DB	1
DC	1
DD	1
DE	1
DF	1
E0	1
E1	1
E2	1
E3	1
E4	1
E5	1
E6	1
E7	1
E8	1
E9	1
EA	1
EB	1
EC	1
ED	1
EE	1
EF	1
F0	1
F1	1
F2	1
F3	1
F4	1
F5	1
F6	1
F7	1
F8	1
F9	1
FA	1
FB	1
FC	1
FD	1
DROP TABLE test.t1;
SET NAMES cp1256;
CREATE TABLE test.t1 (a VARCHAR(3) CHARACTER SET cp1256 COLLATE cp1256_general_ci) ENGINE=MyISAM CHARACTER SET cp1256 COLLATE cp1256_general_ci;
SHOW TABLE STATUS LIKE 't1';
Name	Engine	Version	Row_format	Rows	Avg_row_length	Data_length	Max_data_length	Index_length	Data_free	Auto_increment	Create_time	Update_time	Check_time	Collation	Checksum	Create_options	Comment
t1	MyISAM	#	#	#	#	#	#	#	#	#	#	#	#	cp1256_general_ci	#	#	#
SELECT HEX(ASCII(a)) AS a_ascii, CHAR_LENGTH(a) AS a_len FROM test.t1 ORDER BY a, ORD(a);
a_ascii	a_len
21	1
22	1
23	1
24	1
25	1
26	1
27	1
28	1
29	1
2A	1
2B	1
2C	1
2D	1
2E	1
2F	1
30	1
31	1
32	1
33	1
34	1
35	1
36	1
37	1
38	1
39	1
3A	1
3B	1
3C	1
3D	1
3E	1
3F	1
40	1
41	1
61	1
E0	1
E2	1
42	1
62	1
43	1
63	1
E7	1
44	1
64	1
45	1
65	1
E8	1
E9	1
EA	1
EB	1
46	1
66	1
83	1
47	1
67	1
48	1
68	1
49	1
69	1
EE	1
EF	1
4A	1
6A	1
4B	1
6B	1
4C	1
6C	1
4D	1
6D	1
4E	1
6E	1
4F	1
6F	1
F4	1
8C	1
9C	1
50	1
70	1
51	1
71	1
52	1
72	1
53	1
73	1
54	1
74	1
55	1
75	1
F9	1
FB	1
FC	1
56	1
76	1
57	1
77	1
58	1
78	1
59	1
79	1
5A	1
7A	1
C1	1
C2	1
C3	1
C4	1
C5	1
C6	1
C7	1
C8	1
C9	1
81	1
CB	1
CC	1
8D	1
CD	1
CE	1
CF	1
D0	1
D1	1
D2	1
8E	1
D3	1
D4	1
D5	1
D6	1
D8	1
CA	1
D9	1
DA	1
DB	1
DD	1
DE	1
DF	1
90	1
E1	1
E3	1
E4	1
E5	1
E6	1
EC	1
ED	1
DC	1
F0	1
F1	1
F2	1
F3	1
F5	1
F6	1
F8	1
FA	1
A1	1
BA	1
BF	1
5B	1
5C	1
5D	1
5E	1
5F	1
60	1
7B	1
7C	1
7D	1
7E	1
7F	1
80	1
82	1
84	1
85	1
86	1
87	1
88	1
89	1
8A	1
8B	1
8F	1
91	1
92	1
93	1
94	1
95	1
96	1
97	1
98	1
99	1
9A	1
9B	1
9D	1
9E	1
9F	1
A0	1
A2	1
A3	1
A4	1
A5	1
A6	1
A7	1
A8	1
A9	1
AA	1
AB	1
AC	1
AD	1
AE	1
AF	1
B0	1
B1	1
B2	1
B3	1
B4	1
B5	1
B6	1
B7	1
B8	1
B9	1
BB	1
BC	1
BD	1
BE	1
C0	1
D7	1
F7	1
FD	1
DROP TABLE test.t1;
SET NAMES cp1257;
CREATE TABLE test.t1 (a VARCHAR(3) CHARACTER SET cp1257 COLLATE cp1257_bin) ENGINE=MyISAM CHARACTER SET cp1257 COLLATE cp1257_bin;
SHOW TABLE STATUS LIKE 't1';
Name	Engine	Version	Row_format	Rows	Avg_row_length	Data_length	Max_data_length	Index_length	Data_free	Auto_increment	Create_time	Update_time	Check_time	Collation	Checksum	Create_options	Comment
t1	MyISAM	#	#	#	#	#	#	#	#	#	#	#	#	cp1257_bin	#	#	#
SELECT HEX(ASCII(a)) AS a_ascii, CHAR_LENGTH(a) AS a_len FROM test.t1 ORDER BY a, ORD(a);
a_ascii	a_len
21	1
22	1
23	1
24	1
25	1
26	1
27	1
28	1
29	1
2A	1
2B	1
2C	1
2D	1
2E	1
2F	1
30	1
31	1
32	1
33	1
34	1
35	1
36	1
37	1
38	1
39	1
3A	1
3B	1
3C	1
3D	1
3E	1
3F	1
40	1
41	1
42	1
43	1
44	1
45	1
46	1
47	1
48	1
49	1
4A	1
4B	1
4C	1
4D	1
4E	1
4F	1
50	1
51	1
52	1
53	1
54	1
55	1
56	1
57	1
58	1
59	1
5A	1
5B	1
5C	1
5D	1
5E	1
5F	1
60	1
61	1
62	1
63	1
64	1
65	1
66	1
67	1
68	1
69	1
6A	1
6B	1
6C	1
6D	1
6E	1
6F	1
70	1
71	1
72	1
73	1
74	1
75	1
76	1
77	1
78	1
79	1
7A	1
7B	1
7C	1
7D	1
7E	1
7F	1
80	1
81	1
82	1
83	1
84	1
85	1
86	1
87	1
88	1
89	1
8A	1
8B	1
8C	1
8D	1
8E	1
8F	1
90	1
91	1
92	1
93	1
94	1
95	1
96	1
97	1
98	1
99	1
9A	1
9B	1
9C	1
9D	1
9E	1
9F	1
A0	1
A1	1
A2	1
A3	1
A4	1
A5	1
A6	1
A7	1
A8	1
A9	1
AA	1
AB	1
AC	1
AD	1
AE	1
AF	1
B0	1
B1	1
B2	1
B3	1
B4	1
B5	1
B6	1
B7	1
B8	1
B9	1
BA	1
BB	1
BC	1
BD	1
BE	1
BF	1
C0	1
C1	1
C2	1
C3	1
C4	1
C5	1
C6	1
C7	1
C8	1
C9	1
CA	1
CB	1
CC	1
CD	1
CE	1
CF	1
D0	1
D1	1
D2	1
D3	1
D4	1
D5	1
D6	1
D7	1
D8	1
D9	1
DA	1
DB	1
DC	1
DD	1
DE	1
DF	1
E0	1
E1	1
E2	1
E3	1
E4	1
E5	1
E6	1
E7	1
E8	1
E9	1
EA	1
EB	1
EC	1
ED	1
EE	1
EF	1
F0	1
F1	1
F2	1
F3	1
F4	1
F5	1
F6	1
F7	1
F8	1
F9	1
FA	1
FB	1
FC	1
FD	1
DROP TABLE test.t1;
SET NAMES cp1257;
CREATE TABLE test.t1 (a VARCHAR(3) CHARACTER SET cp1257 COLLATE cp1257_general_ci) ENGINE=MyISAM CHARACTER SET cp1257 COLLATE cp1257_general_ci;
SHOW TABLE STATUS LIKE 't1';
Name	Engine	Version	Row_format	Rows	Avg_row_length	Data_length	Max_data_length	Index_length	Data_free	Auto_increment	Create_time	Update_time	Check_time	Collation	Checksum	Create_options	Comment
t1	MyISAM	#	#	#	#	#	#	#	#	#	#	#	#	cp1257_general_ci	#	#	#
SELECT HEX(ASCII(a)) AS a_ascii, CHAR_LENGTH(a) AS a_len FROM test.t1 ORDER BY a, ORD(a);
a_ascii	a_len
21	1
22	1
23	1
24	1
25	1
26	1
27	1
28	1
29	1
2A	1
2B	1
2C	1
2D	1
2E	1
2F	1
30	1
31	1
32	1
33	1
34	1
35	1
36	1
37	1
38	1
39	1
3A	1
3B	1
3C	1
3D	1
3E	1
3F	1
40	1
41	1
61	1
AF	1
BF	1
C0	1
C2	1
C4	1
C5	1
E0	1
E2	1
E4	1
E5	1
42	1
62	1
43	1
63	1
C3	1
C8	1
E3	1
E8	1
44	1
64	1
45	1
65	1
C6	1
C7	1
C9	1
CB	1
E6	1
E7	1
E9	1
EB	1
46	1
66	1
47	1
67	1
CC	1
EC	1
48	1
68	1
49	1
69	1
C1	1
CE	1
E1	1
EE	1
4A	1
6A	1
4B	1
6B	1
CD	1
ED	1
4C	1
6C	1
CF	1
D9	1
EF	1
F9	1
4D	1
6D	1
4E	1
6E	1
D1	1
D2	1
F1	1
F2	1
4F	1
6F	1
A8	1
B8	1
D3	1
D4	1
D5	1
D6	1
F3	1
F4	1
F5	1
F6	1
50	1
70	1
51	1
71	1
52	1
72	1
AA	1
BA	1
53	1
73	1
D0	1
DA	1
DF	1
F0	1
FA	1
54	1
74	1
55	1
75	1
D8	1
DB	1
DC	1
F8	1
FB	1
FC	1
56	1
76	1
57	1
77	1
58	1
78	1
59	1
79	1
5A	1
7A	1
CA	1
DD	1
DE	1
EA	1
FD	1
5B	1
5C	1
5D	1
5E	1
5F	1
60	1
7B	1
7C	1
7D	1
7E	1
D7	1
F7	1
7F	1
80	1
81	1
82	1
83	1
84	1
85	1
86	1
87	1
88	1
89	1
8A	1
8B	1
8C	1
8D	1
8E	1
8F	1
90	1
91	1
92	1
93	1
94	1
95	1
96	1
97	1
98	1
99	1
9A	1
9B	1
9C	1
9D	1
9E	1
9F	1
A0	1
A1	1
A2	1
A3	1
A4	1
A5	1
A6	1
A7	1
A9	1
AB	1
AC	1
AD	1
AE	1
B0	1
B1	1
B2	1
B3	1
B4	1
B5	1
B6	1
B7	1
B9	1
BB	1
BC	1
BD	1
BE	1
DROP TABLE test.t1;
SET NAMES cp1257;
CREATE TABLE test.t1 (a VARCHAR(3) CHARACTER SET cp1257 COLLATE cp1257_lithuanian_ci) ENGINE=MyISAM CHARACTER SET cp1257 COLLATE cp1257_lithuanian_ci;
SHOW TABLE STATUS LIKE 't1';
Name	Engine	Version	Row_format	Rows	Avg_row_length	Data_length	Max_data_length	Index_length	Data_free	Auto_increment	Create_time	Update_time	Check_time	Collation	Checksum	Create_options	Comment
t1	MyISAM	#	#	#	#	#	#	#	#	#	#	#	#	cp1257_lithuanian_ci	#	#	#
SELECT HEX(ASCII(a)) AS a_ascii, CHAR_LENGTH(a) AS a_len FROM test.t1 ORDER BY a, ORD(a);
a_ascii	a_len
21	1
22	1
23	1
24	1
25	1
26	1
27	1
28	1
29	1
2A	1
2B	1
2C	1
2D	1
2E	1
2F	1
30	1
31	1
32	1
33	1
34	1
35	1
36	1
37	1
38	1
39	1
3A	1
3B	1
3C	1
3D	1
3E	1
3F	1
40	1
41	1
61	1
C0	1
42	1
62	1
43	1
63	1
C8	1
E8	1
44	1
64	1
45	1
65	1
C6	1
E6	1
CB	1
EB	1
46	1
66	1
47	1
67	1
48	1
68	1
49	1
69	1
59	1
79	1
C1	1
E1	1
4A	1
6A	1
4B	1
6B	1
4C	1
6C	1
4D	1
6D	1
4E	1
6E	1
4F	1
6F	1
50	1
70	1
51	1
71	1
52	1
72	1
53	1
73	1
D0	1
F0	1
54	1
74	1
55	1
75	1
DB	1
FB	1
D8	1
F8	1
56	1
76	1
57	1
77	1
58	1
78	1
5B	1
5C	1
5D	1
5E	1
5F	1
60	1
7B	1
7C	1
7D	1
7E	1
5A	1
7A	1
7F	1
80	1
81	1
82	1
83	1
84	1
85	1
86	1
87	1
88	1
89	1
8A	1
8B	1
8C	1
8D	1
8E	1
8F	1
90	1
91	1
92	1
93	1
94	1
95	1
96	1
97	1
98	1
99	1
9A	1
9B	1
9C	1
9D	1
9E	1
9F	1
A0	1
A1	1
A2	1
A3	1
A4	1
A5	1
A6	1
A7	1
A8	1
A9	1
AA	1
AB	1
AC	1
AD	1
AE	1
AF	1
B0	1
B1	1
B2	1
B3	1
B4	1
B5	1
B6	1
B7	1
B8	1
B9	1
BA	1
BB	1
BC	1
BD	1
BE	1
BF	1
C2	1
C3	1
C4	1
C5	1
C7	1
C9	1
CA	1
CC	1
CD	1
CE	1
CF	1
D1	1
D2	1
D3	1
D4	1
D5	1
D6	1
D7	1
D9	1
DA	1
DC	1
DD	1
DE	1
DF	1
E0	1
E2	1
E3	1
E4	1
E5	1
E7	1
E9	1
EA	1
EC	1
ED	1
EE	1
EF	1
F1	1
F2	1
F3	1
F4	1
F5	1
F6	1
F7	1
F9	1
FA	1
FC	1
FD	1
DROP TABLE test.t1;
SET NAMES cp850;
CREATE TABLE test.t1 (a VARCHAR(3) CHARACTER SET cp850 COLLATE cp850_bin) ENGINE=MyISAM CHARACTER SET cp850 COLLATE cp850_bin;
SHOW TABLE STATUS LIKE 't1';
Name	Engine	Version	Row_format	Rows	Avg_row_length	Data_length	Max_data_length	Index_length	Data_free	Auto_increment	Create_time	Update_time	Check_time	Collation	Checksum	Create_options	Comment
t1	MyISAM	#	#	#	#	#	#	#	#	#	#	#	#	cp850_bin	#	#	#
SELECT HEX(ASCII(a)) AS a_ascii, CHAR_LENGTH(a) AS a_len FROM test.t1 ORDER BY a, ORD(a);
a_ascii	a_len
21	1
22	1
23	1
24	1
25	1
26	1
27	1
28	1
29	1
2A	1
2B	1
2C	1
2D	1
2E	1
2F	1
30	1
31	1
32	1
33	1
34	1
35	1
36	1
37	1
38	1
39	1
3A	1
3B	1
3C	1
3D	1
3E	1
3F	1
40	1
41	1
42	1
43	1
44	1
45	1
46	1
47	1
48	1
49	1
4A	1
4B	1
4C	1
4D	1
4E	1
4F	1
50	1
51	1
52	1
53	1
54	1
55	1
56	1
57	1
58	1
59	1
5A	1
5B	1
5C	1
5D	1
5E	1
5F	1
60	1
61	1
62	1
63	1
64	1
65	1
66	1
67	1
68	1
69	1
6A	1
6B	1
6C	1
6D	1
6E	1
6F	1
70	1
71	1
72	1
73	1
74	1
75	1
76	1
77	1
78	1
79	1
7A	1
7B	1
7C	1
7D	1
7E	1
7F	1
80	1
81	1
82	1
83	1
84	1
85	1
86	1
87	1
88	1
89	1
8A	1
8B	1
8C	1
8D	1
8E	1
8F	1
90	1
91	1
92	1
93	1
94	1
95	1
96	1
97	1
98	1
99	1
9A	1
9B	1
9C	1
9D	1
9E	1
9F	1
A0	1
A1	1
A2	1
A3	1
A4	1
A5	1
A6	1
A7	1
A8	1
A9	1
AA	1
AB	1
AC	1
AD	1
AE	1
AF	1
B0	1
B1	1
B2	1
B3	1
B4	1
B5	1
B6	1
B7	1
B8	1
B9	1
BA	1
BB	1
BC	1
BD	1
BE	1
BF	1
C0	1
C1	1
C2	1
C3	1
C4	1
C5	1
C6	1
C7	1
C8	1
C9	1
CA	1
CB	1
CC	1
CD	1
CE	1
CF	1
D0	1
D1	1
D2	1
D3	1
D4	1
D5	1
D6	1
D7	1
D8	1
D9	1
DA	1
DB	1
DC	1
DD	1
DE	1
DF	1
E0	1
E1	1
E2	1
E3	1
E4	1
E5	1
E6	1
E7	1
E8	1
E9	1
EA	1
EB	1
EC	1
ED	1
EE	1
EF	1
F0	1
F1	1
F2	1
F3	1
F4	1
F5	1
F6	1
F7	1
F8	1
F9	1
FA	1
FB	1
FC	1
FD	1
DROP TABLE test.t1;
SET NAMES cp850;
CREATE TABLE test.t1 (a VARCHAR(3) CHARACTER SET cp850 COLLATE cp850_general_ci) ENGINE=MyISAM CHARACTER SET cp850 COLLATE cp850_general_ci;
SHOW TABLE STATUS LIKE 't1';
Name	Engine	Version	Row_format	Rows	Avg_row_length	Data_length	Max_data_length	Index_length	Data_free	Auto_increment	Create_time	Update_time	Check_time	Collation	Checksum	Create_options	Comment
t1	MyISAM	#	#	#	#	#	#	#	#	#	#	#	#	cp850_general_ci	#	#	#
SELECT HEX(ASCII(a)) AS a_ascii, CHAR_LENGTH(a) AS a_len FROM test.t1 ORDER BY a, ORD(a);
a_ascii	a_len
21	1
22	1
23	1
24	1
25	1
26	1
27	1
28	1
29	1
2A	1
2B	1
2C	1
2D	1
2E	1
2F	1
30	1
31	1
32	1
33	1
34	1
35	1
36	1
37	1
38	1
39	1
3A	1
3B	1
3C	1
3D	1
3E	1
3F	1
40	1
41	1
61	1
85	1
B7	1
A0	1
B5	1
83	1
B6	1
C6	1
C7	1
84	1
8E	1
86	1
8F	1
91	1
92	1
42	1
62	1
43	1
63	1
80	1
87	1
44	1
64	1
D0	1
D1	1
45	1
65	1
8A	1
D4	1
82	1
90	1
88	1
D2	1
89	1
D3	1
46	1
66	1
47	1
67	1
48	1
68	1
49	1
69	1
8D	1
DE	1
A1	1
D6	1
8C	1
D7	1
8B	1
D8	1
D5	1
4A	1
6A	1
4B	1
6B	1
4C	1
6C	1
4D	1
6D	1
4E	1
6E	1
A4	1
A5	1
4F	1
6F	1
95	1
E3	1
A2	1
E0	1
93	1
E2	1
E4	1
E5	1
94	1
99	1
9B	1
9D	1
50	1
70	1
51	1
71	1
52	1
72	1
53	1
73	1
E1	1
54	1
74	1
55	1
75	1
97	1
EB	1
A3	1
E9	1
96	1
EA	1
81	1
9A	1
56	1
76	1
57	1
77	1
58	1
78	1
59	1
79	1
EC	1
ED	1
98	1
5A	1
7A	1
E7	1
E8	1
5B	1
5C	1
5D	1
5E	1
5F	1
60	1
7B	1
7C	1
7D	1
7E	1
7F	1
F7	1
9E	1
9F	1
F6	1
F2	1
C4	1
B3	1
DA	1
BF	1
C0	1
D9	1
C3	1
B4	1
C2	1
C1	1
C5	1
CD	1
AD	1
BA	1
C9	1
BB	1
C8	1
BC	1
CC	1
B9	1
CB	1
CA	1
CE	1
DF	1
DC	1
DB	1
B0	1
B1	1
B2	1
BD	1
9C	1
CF	1
BE	1
DD	1
F5	1
F9	1
B8	1
A6	1
AE	1
AA	1
F0	1
A9	1
EE	1
F8	1
F1	1
FD	1
FC	1
EF	1
E6	1
F4	1
FA	1
FB	1
A7	1
AF	1
AC	1
AB	1
F3	1
A8	1
DROP TABLE test.t1;
SET NAMES cp852;
CREATE TABLE test.t1 (a VARCHAR(3) CHARACTER SET cp852 COLLATE cp852_bin) ENGINE=MyISAM CHARACTER SET cp852 COLLATE cp852_bin;
SHOW TABLE STATUS LIKE 't1';
Name	Engine	Version	Row_format	Rows	Avg_row_length	Data_length	Max_data_length	Index_length	Data_free	Auto_increment	Create_time	Update_time	Check_time	Collation	Checksum	Create_options	Comment
t1	MyISAM	#	#	#	#	#	#	#	#	#	#	#	#	cp852_bin	#	#	#
SELECT HEX(ASCII(a)) AS a_ascii, CHAR_LENGTH(a) AS a_len FROM test.t1 ORDER BY a, ORD(a);
a_ascii	a_len
21	1
22	1
23	1
24	1
25	1
26	1
27	1
28	1
29	1
2A	1
2B	1
2C	1
2D	1
2E	1
2F	1
30	1
31	1
32	1
33	1
34	1
35	1
36	1
37	1
38	1
39	1
3A	1
3B	1
3C	1
3D	1
3E	1
3F	1
40	1
41	1
42	1
43	1
44	1
45	1
46	1
47	1
48	1
49	1
4A	1
4B	1
4C	1
4D	1
4E	1
4F	1
50	1
51	1
52	1
53	1
54	1
55	1
56	1
57	1
58	1
59	1
5A	1
5B	1
5C	1
5D	1
5E	1
5F	1
60	1
61	1
62	1
63	1
64	1
65	1
66	1
67	1
68	1
69	1
6A	1
6B	1
6C	1
6D	1
6E	1
6F	1
70	1
71	1
72	1
73	1
74	1
75	1
76	1
77	1
78	1
79	1
7A	1
7B	1
7C	1
7D	1
7E	1
7F	1
80	1
81	1
82	1
83	1
84	1
85	1
86	1
87	1
88	1
89	1
8A	1
8B	1
8C	1
8D	1
8E	1
8F	1
90	1
91	1
92	1
93	1
94	1
95	1
96	1
97	1
98	1
99	1
9A	1
9B	1
9C	1
9D	1
9E	1
9F	1
A0	1
A1	1
A2	1
A3	1
A4	1
A5	1
A6	1
A7	1
A8	1
A9	1
AA	1
AB	1
AC	1
AD	1
AE	1
AF	1
B0	1
B1	1
B2	1
B3	1
B4	1
B5	1
B6	1
B7	1
B8	1
B9	1
BA	1
BB	1
BC	1
BD	1
BE	1
BF	1
C0	1
C1	1
C2	1
C3	1
C4	1
C5	1
C6	1
C7	1
C8	1
C9	1
CA	1
CB	1
CC	1
CD	1
CE	1
CF	1
D0	1
D1	1
D2	1
D3	1
D4	1
D5	1
D6	1
D7	1
D8	1
D9	1
DA	1
DB	1
DC	1
DD	1
DE	1
DF	1
E0	1
E1	1
E2	1
E3	1
E4	1
E5	1
E6	1
E7	1
E8	1
E9	1
EA	1
EB	1
EC	1
ED	1
EE	1
EF	1
F0	1
F1	1
F2	1
F3	1
F4	1
F5	1
F6	1
F7	1
F8	1
F9	1
FA	1
FB	1
FC	1
FD	1
DROP TABLE test.t1;
SET NAMES cp852;
CREATE TABLE test.t1 (a VARCHAR(3) CHARACTER SET cp852 COLLATE cp852_general_ci) ENGINE=MyISAM CHARACTER SET cp852 COLLATE cp852_general_ci;
SHOW TABLE STATUS LIKE 't1';
Name	Engine	Version	Row_format	Rows	Avg_row_length	Data_length	Max_data_length	Index_length	Data_free	Auto_increment	Create_time	Update_time	Check_time	Collation	Checksum	Create_options	Comment
t1	MyISAM	#	#	#	#	#	#	#	#	#	#	#	#	cp852_general_ci	#	#	#
SELECT HEX(ASCII(a)) AS a_ascii, CHAR_LENGTH(a) AS a_len FROM test.t1 ORDER BY a, ORD(a);
a_ascii	a_len
21	1
22	1
23	1
24	1
25	1
26	1
27	1
28	1
29	1
2A	1
2B	1
2C	1
2D	1
2E	1
2F	1
30	1
31	1
32	1
33	1
34	1
35	1
36	1
37	1
38	1
39	1
3A	1
3B	1
3C	1
3D	1
3E	1
3F	1
40	1
41	1
61	1
83	1
84	1
8E	1
A0	1
A4	1
A5	1
B5	1
B6	1
C6	1
C7	1
42	1
62	1
43	1
63	1
80	1
86	1
87	1
8F	1
9F	1
AC	1
44	1
64	1
D0	1
D1	1
D2	1
D4	1
45	1
65	1
82	1
89	1
90	1
A8	1
A9	1
B7	1
D3	1
D8	1
46	1
66	1
47	1
67	1
48	1
68	1
49	1
69	1
8C	1
A1	1
D6	1
D7	1
4A	1
6A	1
4B	1
6B	1
4C	1
6C	1
88	1
91	1
92	1
95	1
96	1
9D	1
4D	1
6D	1
4E	1
6E	1
D5	1
E3	1
E4	1
E5	1
4F	1
6F	1
8A	1
8B	1
93	1
94	1
99	1
A2	1
E0	1
E2	1
50	1
70	1
51	1
71	1
52	1
72	1
E8	1
EA	1
FC	1
FD	1
53	1
73	1
97	1
98	1
AD	1
B8	1
E6	1
E7	1
E1	1
54	1
74	1
9B	1
9C	1
DD	1
EE	1
55	1
75	1
81	1
85	1
9A	1
A3	1
DE	1
E9	1
EB	1
FB	1
56	1
76	1
57	1
77	1
58	1
78	1
59	1
79	1
EC	1
ED	1
5A	1
7A	1
8D	1
A6	1
A7	1
AB	1
BD	1
BE	1
5B	1
5C	1
5D	1
5E	1
5F	1
60	1
7B	1
7C	1
7D	1
7E	1
7F	1
9E	1
AA	1
AE	1
AF	1
B0	1
B1	1
B2	1
B3	1
B4	1
B9	1
BA	1
BB	1
BC	1
BF	1
C0	1
C1	1
C2	1
C3	1
C4	1
C5	1
C8	1
C9	1
CA	1
CB	1
CC	1
CD	1
CE	1
CF	1
D9	1
DA	1
DB	1
DC	1
DF	1
EF	1
F0	1
F1	1
F2	1
F3	1
F4	1
F5	1
F6	1
F7	1
F8	1
F9	1
FA	1
DROP TABLE test.t1;
SET NAMES cp866;
CREATE TABLE test.t1 (a VARCHAR(3) CHARACTER SET cp866 COLLATE cp866_bin) ENGINE=MyISAM CHARACTER SET cp866 COLLATE cp866_bin;
SHOW TABLE STATUS LIKE 't1';
Name	Engine	Version	Row_format	Rows	Avg_row_length	Data_length	Max_data_length	Index_length	Data_free	Auto_increment	Create_time	Update_time	Check_time	Collation	Checksum	Create_options	Comment
t1	MyISAM	#	#	#	#	#	#	#	#	#	#	#	#	cp866_bin	#	#	#
SELECT HEX(ASCII(a)) AS a_ascii, CHAR_LENGTH(a) AS a_len FROM test.t1 ORDER BY a, ORD(a);
a_ascii	a_len
21	1
22	1
23	1
24	1
25	1
26	1
27	1
28	1
29	1
2A	1
2B	1
2C	1
2D	1
2E	1
2F	1
30	1
31	1
32	1
33	1
34	1
35	1
36	1
37	1
38	1
39	1
3A	1
3B	1
3C	1
3D	1
3E	1
3F	1
40	1
41	1
42	1
43	1
44	1
45	1
46	1
47	1
48	1
49	1
4A	1
4B	1
4C	1
4D	1
4E	1
4F	1
50	1
51	1
52	1
53	1
54	1
55	1
56	1
57	1
58	1
59	1
5A	1
5B	1
5C	1
5D	1
5E	1
5F	1
60	1
61	1
62	1
63	1
64	1
65	1
66	1
67	1
68	1
69	1
6A	1
6B	1
6C	1
6D	1
6E	1
6F	1
70	1
71	1
72	1
73	1
74	1
75	1
76	1
77	1
78	1
79	1
7A	1
7B	1
7C	1
7D	1
7E	1
7F	1
80	1
81	1
82	1
83	1
84	1
85	1
86	1
87	1
88	1
89	1
8A	1
8B	1
8C	1
8D	1
8E	1
8F	1
90	1
91	1
92	1
93	1
94	1
95	1
96	1
97	1
98	1
99	1
9A	1
9B	1
9C	1
9D	1
9E	1
9F	1
A0	1
A1	1
A2	1
A3	1
A4	1
A5	1
A6	1
A7	1
A8	1
A9	1
AA	1
AB	1
AC	1
AD	1
AE	1
AF	1
B0	1
B1	1
B2	1
B3	1
B4	1
B5	1
B6	1
B7	1
B8	1
B9	1
BA	1
BB	1
BC	1
BD	1
BE	1
BF	1
C0	1
C1	1
C2	1
C3	1
C4	1
C5	1
C6	1
C7	1
C8	1
C9	1
CA	1
CB	1
CC	1
CD	1
CE	1
CF	1
D0	1
D1	1
D2	1
D3	1
D4	1
D5	1
D6	1
D7	1
D8	1
D9	1
DA	1
DB	1
DC	1
DD	1
DE	1
DF	1
E0	1
E1	1
E2	1
E3	1
E4	1
E5	1
E6	1
E7	1
E8	1
E9	1
EA	1
EB	1
EC	1
ED	1
EE	1
EF	1
F0	1
F1	1
F2	1
F3	1
F4	1
F5	1
F6	1
F7	1
F8	1
F9	1
FA	1
FB	1
FC	1
FD	1
DROP TABLE test.t1;
SET NAMES cp866;
CREATE TABLE test.t1 (a VARCHAR(3) CHARACTER SET cp866 COLLATE cp866_general_ci) ENGINE=MyISAM CHARACTER SET cp866 COLLATE cp866_general_ci;
SHOW TABLE STATUS LIKE 't1';
Name	Engine	Version	Row_format	Rows	Avg_row_length	Data_length	Max_data_length	Index_length	Data_free	Auto_increment	Create_time	Update_time	Check_time	Collation	Checksum	Create_options	Comment
t1	MyISAM	#	#	#	#	#	#	#	#	#	#	#	#	cp866_general_ci	#	#	#
SELECT HEX(ASCII(a)) AS a_ascii, CHAR_LENGTH(a) AS a_len FROM test.t1 ORDER BY a, ORD(a);
a_ascii	a_len
21	1
22	1
23	1
24	1
25	1
26	1
27	1
28	1
29	1
2A	1
2B	1
2C	1
2D	1
2E	1
2F	1
30	1
31	1
32	1
33	1
34	1
35	1
36	1
37	1
38	1
39	1
3A	1
3B	1
3C	1
3D	1
3E	1
3F	1
40	1
41	1
61	1
42	1
62	1
43	1
63	1
44	1
64	1
45	1
65	1
46	1
66	1
47	1
67	1
48	1
68	1
49	1
69	1
4A	1
6A	1
4B	1
6B	1
4C	1
6C	1
4D	1
6D	1
4E	1
6E	1
4F	1
6F	1
50	1
70	1
51	1
71	1
52	1
72	1
53	1
73	1
54	1
74	1
55	1
75	1
56	1
76	1
57	1
77	1
58	1
78	1
59	1
79	1
5A	1
7A	1
80	1
A0	1
81	1
A1	1
82	1
A2	1
83	1
A3	1
84	1
A4	1
85	1
A5	1
F0	1
F1	1
F2	1
F3	1
86	1
A6	1
87	1
A7	1
88	1
A8	1
F4	1
F5	1
89	1
A9	1
8A	1
AA	1
8B	1
AB	1
8C	1
AC	1
8D	1
AD	1
8E	1
AE	1
8F	1
AF	1
90	1
E0	1
91	1
E1	1
92	1
E2	1
93	1
E3	1
F6	1
F7	1
94	1
E4	1
95	1
E5	1
96	1
E6	1
97	1
E7	1
98	1
E8	1
99	1
E9	1
9A	1
EA	1
9B	1
EB	1
9C	1
EC	1
9D	1
ED	1
9E	1
EE	1
9F	1
EF	1
5B	1
5C	1
5D	1
5E	1
5F	1
60	1
7B	1
7C	1
7D	1
7E	1
7F	1
B0	1
B1	1
B2	1
F8	1
F9	1
FA	1
FB	1
FC	1
FD	1
B3	1
B4	1
B5	1
B6	1
B7	1
B8	1
B9	1
BA	1
BB	1
BC	1
BD	1
BE	1
BF	1
C0	1
C1	1
C2	1
C3	1
C4	1
C5	1
C6	1
C7	1
C8	1
C9	1
CA	1
CB	1
CC	1
CD	1
CE	1
CF	1
D0	1
D1	1
D2	1
D3	1
D4	1
D5	1
D6	1
D7	1
D8	1
D9	1
DA	1
DB	1
DC	1
DD	1
DE	1
DF	1
DROP TABLE test.t1;
SET NAMES cp932;
CREATE TABLE test.t1 (a VARCHAR(3) CHARACTER SET cp932 COLLATE cp932_bin) ENGINE=MyISAM CHARACTER SET cp932 COLLATE cp932_bin;
SHOW TABLE STATUS LIKE 't1';
Name	Engine	Version	Row_format	Rows	Avg_row_length	Data_length	Max_data_length	Index_length	Data_free	Auto_increment	Create_time	Update_time	Check_time	Collation	Checksum	Create_options	Comment
t1	MyISAM	#	#	#	#	#	#	#	#	#	#	#	#	cp932_bin	#	#	#
SELECT HEX(ASCII(a)) AS a_ascii, CHAR_LENGTH(a) AS a_len FROM test.t1 ORDER BY a, ORD(a);
a_ascii	a_len
21	1
22	1
23	1
24	1
25	1
26	1
27	1
28	1
29	1
2A	1
2B	1
2C	1
2D	1
2E	1
2F	1
30	1
31	1
32	1
33	1
34	1
35	1
36	1
37	1
38	1
39	1
3A	1
3B	1
3C	1
3D	1
3E	1
3F	1
40	1
41	1
42	1
43	1
44	1
45	1
46	1
47	1
48	1
49	1
4A	1
4B	1
4C	1
4D	1
4E	1
4F	1
50	1
51	1
52	1
53	1
54	1
55	1
56	1
57	1
58	1
59	1
5A	1
5B	1
5C	1
5D	1
5E	1
5F	1
60	1
61	1
62	1
63	1
64	1
65	1
66	1
67	1
68	1
69	1
6A	1
6B	1
6C	1
6D	1
6E	1
6F	1
70	1
71	1
72	1
73	1
74	1
75	1
76	1
77	1
78	1
79	1
7A	1
7B	1
7C	1
7D	1
7E	1
7F	1
A1	1
A2	1
A3	1
A4	1
A5	1
A6	1
A7	1
A8	1
A9	1
AA	1
AB	1
AC	1
AD	1
AE	1
AF	1
B0	1
B1	1
B2	1
B3	1
B4	1
B5	1
B6	1
B7	1
B8	1
B9	1
BA	1
BB	1
BC	1
BD	1
BE	1
BF	1
C0	1
C1	1
C2	1
C3	1
C4	1
C5	1
C6	1
C7	1
C8	1
C9	1
CA	1
CB	1
CC	1
CD	1
CE	1
CF	1
D0	1
D1	1
D2	1
D3	1
D4	1
D5	1
D6	1
D7	1
D8	1
D9	1
DA	1
DB	1
DC	1
DD	1
DE	1
DF	1
DROP TABLE test.t1;
SET NAMES cp932;
CREATE TABLE test.t1 (a VARCHAR(3) CHARACTER SET cp932 COLLATE cp932_japanese_ci) ENGINE=MyISAM CHARACTER SET cp932 COLLATE cp932_japanese_ci;
SHOW TABLE STATUS LIKE 't1';
Name	Engine	Version	Row_format	Rows	Avg_row_length	Data_length	Max_data_length	Index_length	Data_free	Auto_increment	Create_time	Update_time	Check_time	Collation	Checksum	Create_options	Comment
t1	MyISAM	#	#	#	#	#	#	#	#	#	#	#	#	cp932_japanese_ci	#	#	#
SELECT HEX(ASCII(a)) AS a_ascii, CHAR_LENGTH(a) AS a_len FROM test.t1 ORDER BY a, ORD(a);
a_ascii	a_len
21	1
22	1
23	1
24	1
25	1
26	1
27	1
28	1
29	1
2A	1
2B	1
2C	1
2D	1
2E	1
2F	1
30	1
31	1
32	1
33	1
34	1
35	1
36	1
37	1
38	1
39	1
3A	1
3B	1
3C	1
3D	1
3E	1
3F	1
40	1
41	1
61	1
42	1
62	1
43	1
63	1
44	1
64	1
45	1
65	1
46	1
66	1
47	1
67	1
48	1
68	1
49	1
69	1
4A	1
6A	1
4B	1
6B	1
4C	1
6C	1
4D	1
6D	1
4E	1
6E	1
4F	1
6F	1
50	1
70	1
51	1
71	1
52	1
72	1
53	1
73	1
54	1
74	1
55	1
75	1
56	1
76	1
57	1
77	1
58	1
78	1
59	1
79	1
5A	1
7A	1
5B	1
5C	1
5D	1
5E	1
5F	1
60	1
7B	1
7C	1
7D	1
7E	1
7F	1
A1	1
A2	1
A3	1
A4	1
A5	1
A6	1
A7	1
A8	1
A9	1
AA	1
AB	1
AC	1
AD	1
AE	1
AF	1
B0	1
B1	1
B2	1
B3	1
B4	1
B5	1
B6	1
B7	1
B8	1
B9	1
BA	1
BB	1
BC	1
BD	1
BE	1
BF	1
C0	1
C1	1
C2	1
C3	1
C4	1
C5	1
C6	1
C7	1
C8	1
C9	1
CA	1
CB	1
CC	1
CD	1
CE	1
CF	1
D0	1
D1	1
D2	1
D3	1
D4	1
D5	1
D6	1
D7	1
D8	1
D9	1
DA	1
DB	1
DC	1
DD	1
DE	1
DF	1
DROP TABLE test.t1;
SET NAMES dec8;
Warnings:
Warning	1287	'dec8' is deprecated and will be removed in a future release. Please use utf8mb4 instead
CREATE TABLE test.t1 (a VARCHAR(3) CHARACTER SET dec8 COLLATE dec8_bin) ENGINE=MyISAM CHARACTER SET dec8 COLLATE dec8_bin;
Warnings:
Warning	1287	'dec8' is deprecated and will be removed in a future release. Please use utf8mb4 instead
Warning	4079	'dec8_bin' is a collation of the deprecated character set dec8. Please consider using utf8mb4 with an appropriate collation instead.
Warning	1287	'dec8' is deprecated and will be removed in a future release. Please use utf8mb4 instead
Warning	4079	'dec8_bin' is a collation of the deprecated character set dec8. Please consider using utf8mb4 with an appropriate collation instead.
SHOW TABLE STATUS LIKE 't1';
Name	Engine	Version	Row_format	Rows	Avg_row_length	Data_length	Max_data_length	Index_length	Data_free	Auto_increment	Create_time	Update_time	Check_time	Collation	Checksum	Create_options	Comment
t1	MyISAM	#	#	#	#	#	#	#	#	#	#	#	#	dec8_bin	#	#	#
SELECT HEX(ASCII(a)) AS a_ascii, CHAR_LENGTH(a) AS a_len FROM test.t1 ORDER BY a, ORD(a);
a_ascii	a_len
21	1
22	1
23	1
24	1
25	1
26	1
27	1
28	1
29	1
2A	1
2B	1
2C	1
2D	1
2E	1
2F	1
30	1
31	1
32	1
33	1
34	1
35	1
36	1
37	1
38	1
39	1
3A	1
3B	1
3C	1
3D	1
3E	1
3F	1
40	1
41	1
42	1
43	1
44	1
45	1
46	1
47	1
48	1
49	1
4A	1
4B	1
4C	1
4D	1
4E	1
4F	1
50	1
51	1
52	1
53	1
54	1
55	1
56	1
57	1
58	1
59	1
5A	1
5B	1
5C	1
5D	1
5E	1
5F	1
60	1
61	1
62	1
63	1
64	1
65	1
66	1
67	1
68	1
69	1
6A	1
6B	1
6C	1
6D	1
6E	1
6F	1
70	1
71	1
72	1
73	1
74	1
75	1
76	1
77	1
78	1
79	1
7A	1
7B	1
7C	1
7D	1
7E	1
7F	1
80	1
81	1
82	1
83	1
84	1
85	1
86	1
87	1
88	1
89	1
8A	1
8B	1
8C	1
8D	1
8E	1
8F	1
90	1
91	1
92	1
93	1
94	1
95	1
96	1
97	1
98	1
99	1
9A	1
9B	1
9C	1
9D	1
9E	1
9F	1
A0	1
A1	1
A2	1
A3	1
A4	1
A5	1
A6	1
A7	1
A8	1
A9	1
AA	1
AB	1
AC	1
AD	1
AE	1
AF	1
B0	1
B1	1
B2	1
B3	1
B4	1
B5	1
B6	1
B7	1
B8	1
B9	1
BA	1
BB	1
BC	1
BD	1
BE	1
BF	1
C0	1
C1	1
C2	1
C3	1
C4	1
C5	1
C6	1
C7	1
C8	1
C9	1
CA	1
CB	1
CC	1
CD	1
CE	1
CF	1
D0	1
D1	1
D2	1
D3	1
D4	1
D5	1
D6	1
D7	1
D8	1
D9	1
DA	1
DB	1
DC	1
DD	1
DE	1
DF	1
E0	1
E1	1
E2	1
E3	1
E4	1
E5	1
E6	1
E7	1
E8	1
E9	1
EA	1
EB	1
EC	1
ED	1
EE	1
EF	1
F0	1
F1	1
F2	1
F3	1
F4	1
F5	1
F6	1
F7	1
F8	1
F9	1
FA	1
FB	1
FC	1
FD	1
DROP TABLE test.t1;
SET NAMES dec8;
Warnings:
Warning	1287	'dec8' is deprecated and will be removed in a future release. Please use utf8mb4 instead
CREATE TABLE test.t1 (a VARCHAR(3) CHARACTER SET dec8 COLLATE dec8_swedish_ci) ENGINE=MyISAM CHARACTER SET dec8 COLLATE dec8_swedish_ci;
Warnings:
Warning	1287	'dec8' is deprecated and will be removed in a future release. Please use utf8mb4 instead
Warning	4079	'dec8_swedish_ci' is a collation of the deprecated character set dec8. Please consider using utf8mb4 with an appropriate collation instead.
Warning	1287	'dec8' is deprecated and will be removed in a future release. Please use utf8mb4 instead
Warning	4079	'dec8_swedish_ci' is a collation of the deprecated character set dec8. Please consider using utf8mb4 with an appropriate collation instead.
SHOW TABLE STATUS LIKE 't1';
Name	Engine	Version	Row_format	Rows	Avg_row_length	Data_length	Max_data_length	Index_length	Data_free	Auto_increment	Create_time	Update_time	Check_time	Collation	Checksum	Create_options	Comment
t1	MyISAM	#	#	#	#	#	#	#	#	#	#	#	#	dec8_swedish_ci	#	#	#
SELECT HEX(ASCII(a)) AS a_ascii, CHAR_LENGTH(a) AS a_len FROM test.t1 ORDER BY a, ORD(a);
a_ascii	a_len
21	1
22	1
23	1
24	1
25	1
26	1
27	1
28	1
29	1
2A	1
2B	1
2C	1
2D	1
2E	1
2F	1
30	1
31	1
32	1
33	1
34	1
35	1
36	1
37	1
38	1
39	1
3A	1
3B	1
3C	1
3D	1
3E	1
3F	1
40	1
41	1
61	1
C0	1
C1	1
C2	1
C3	1
E0	1
E1	1
E2	1
E3	1
42	1
62	1
43	1
63	1
C7	1
E7	1
44	1
64	1
D0	1
F0	1
45	1
65	1
C8	1
C9	1
CA	1
CB	1
E8	1
E9	1
EA	1
EB	1
46	1
66	1
47	1
67	1
48	1
68	1
49	1
69	1
CC	1
CD	1
CE	1
CF	1
EC	1
ED	1
EE	1
EF	1
4A	1
6A	1
4B	1
6B	1
4C	1
6C	1
4D	1
6D	1
4E	1
6E	1
D1	1
F1	1
4F	1
6F	1
D2	1
D3	1
D4	1
D5	1
F2	1
F3	1
F4	1
F5	1
50	1
70	1
51	1
71	1
52	1
72	1
53	1
73	1
54	1
74	1
55	1
75	1
D9	1
DA	1
DB	1
F9	1
FA	1
FB	1
56	1
76	1
57	1
77	1
58	1
78	1
59	1
79	1
DC	1
DD	1
FC	1
FD	1
5A	1
7A	1
5B	1
C5	1
E5	1
5C	1
C4	1
C6	1
E4	1
E6	1
5D	1
D6	1
F6	1
5E	1
5F	1
60	1
7B	1
7C	1
7D	1
7E	1
7F	1
80	1
81	1
82	1
83	1
84	1
85	1
86	1
87	1
88	1
89	1
8A	1
8B	1
8C	1
8D	1
8E	1
8F	1
90	1
91	1
92	1
93	1
94	1
95	1
96	1
97	1
98	1
99	1
9A	1
9B	1
9C	1
9D	1
9E	1
9F	1
A0	1
A1	1
A2	1
A3	1
A4	1
A5	1
A6	1
A7	1
A8	1
A9	1
AA	1
AB	1
AC	1
AD	1
AE	1
AF	1
B0	1
B1	1
B2	1
B3	1
B4	1
B5	1
B6	1
B7	1
B8	1
B9	1
BA	1
BB	1
BC	1
BD	1
BE	1
BF	1
D7	1
D8	1
F8	1
DE	1
DF	1
F7	1
DROP TABLE test.t1;
SET NAMES eucjpms;
CREATE TABLE test.t1 (a VARCHAR(3) CHARACTER SET eucjpms COLLATE eucjpms_bin) ENGINE=MyISAM CHARACTER SET eucjpms COLLATE eucjpms_bin;
SHOW TABLE STATUS LIKE 't1';
Name	Engine	Version	Row_format	Rows	Avg_row_length	Data_length	Max_data_length	Index_length	Data_free	Auto_increment	Create_time	Update_time	Check_time	Collation	Checksum	Create_options	Comment
t1	MyISAM	#	#	#	#	#	#	#	#	#	#	#	#	eucjpms_bin	#	#	#
SELECT HEX(ASCII(a)) AS a_ascii, CHAR_LENGTH(a) AS a_len FROM test.t1 ORDER BY a, ORD(a);
a_ascii	a_len
21	1
22	1
23	1
24	1
25	1
26	1
27	1
28	1
29	1
2A	1
2B	1
2C	1
2D	1
2E	1
2F	1
30	1
31	1
32	1
33	1
34	1
35	1
36	1
37	1
38	1
39	1
3A	1
3B	1
3C	1
3D	1
3E	1
3F	1
40	1
41	1
42	1
43	1
44	1
45	1
46	1
47	1
48	1
49	1
4A	1
4B	1
4C	1
4D	1
4E	1
4F	1
50	1
51	1
52	1
53	1
54	1
55	1
56	1
57	1
58	1
59	1
5A	1
5B	1
5C	1
5D	1
5E	1
5F	1
60	1
61	1
62	1
63	1
64	1
65	1
66	1
67	1
68	1
69	1
6A	1
6B	1
6C	1
6D	1
6E	1
6F	1
70	1
71	1
72	1
73	1
74	1
75	1
76	1
77	1
78	1
79	1
7A	1
7B	1
7C	1
7D	1
7E	1
7F	1
DROP TABLE test.t1;
SET NAMES eucjpms;
CREATE TABLE test.t1 (a VARCHAR(3) CHARACTER SET eucjpms COLLATE eucjpms_japanese_ci) ENGINE=MyISAM CHARACTER SET eucjpms COLLATE eucjpms_japanese_ci;
SHOW TABLE STATUS LIKE 't1';
Name	Engine	Version	Row_format	Rows	Avg_row_length	Data_length	Max_data_length	Index_length	Data_free	Auto_increment	Create_time	Update_time	Check_time	Collation	Checksum	Create_options	Comment
t1	MyISAM	#	#	#	#	#	#	#	#	#	#	#	#	eucjpms_japanese_ci	#	#	#
SELECT HEX(ASCII(a)) AS a_ascii, CHAR_LENGTH(a) AS a_len FROM test.t1 ORDER BY a, ORD(a);
a_ascii	a_len
21	1
22	1
23	1
24	1
25	1
26	1
27	1
28	1
29	1
2A	1
2B	1
2C	1
2D	1
2E	1
2F	1
30	1
31	1
32	1
33	1
34	1
35	1
36	1
37	1
38	1
39	1
3A	1
3B	1
3C	1
3D	1
3E	1
3F	1
40	1
41	1
61	1
42	1
62	1
43	1
63	1
44	1
64	1
45	1
65	1
46	1
66	1
47	1
67	1
48	1
68	1
49	1
69	1
4A	1
6A	1
4B	1
6B	1
4C	1
6C	1
4D	1
6D	1
4E	1
6E	1
4F	1
6F	1
50	1
70	1
51	1
71	1
52	1
72	1
53	1
73	1
54	1
74	1
55	1
75	1
56	1
76	1
57	1
77	1
58	1
78	1
59	1
79	1
5A	1
7A	1
5B	1
5C	1
5D	1
5E	1
5F	1
60	1
7B	1
7C	1
7D	1
7E	1
7F	1
DROP TABLE test.t1;
SET NAMES euckr;
CREATE TABLE test.t1 (a VARCHAR(3) CHARACTER SET euckr COLLATE euckr_bin) ENGINE=MyISAM CHARACTER SET euckr COLLATE euckr_bin;
SHOW TABLE STATUS LIKE 't1';
Name	Engine	Version	Row_format	Rows	Avg_row_length	Data_length	Max_data_length	Index_length	Data_free	Auto_increment	Create_time	Update_time	Check_time	Collation	Checksum	Create_options	Comment
t1	MyISAM	#	#	#	#	#	#	#	#	#	#	#	#	euckr_bin	#	#	#
SELECT HEX(ASCII(a)) AS a_ascii, CHAR_LENGTH(a) AS a_len FROM test.t1 ORDER BY a, ORD(a);
a_ascii	a_len
21	1
22	1
23	1
24	1
25	1
26	1
27	1
28	1
29	1
2A	1
2B	1
2C	1
2D	1
2E	1
2F	1
30	1
31	1
32	1
33	1
34	1
35	1
36	1
37	1
38	1
39	1
3A	1
3B	1
3C	1
3D	1
3E	1
3F	1
40	1
41	1
42	1
43	1
44	1
45	1
46	1
47	1
48	1
49	1
4A	1
4B	1
4C	1
4D	1
4E	1
4F	1
50	1
51	1
52	1
53	1
54	1
55	1
56	1
57	1
58	1
59	1
5A	1
5B	1
5C	1
5D	1
5E	1
5F	1
60	1
61	1
62	1
63	1
64	1
65	1
66	1
67	1
68	1
69	1
6A	1
6B	1
6C	1
6D	1
6E	1
6F	1
70	1
71	1
72	1
73	1
74	1
75	1
76	1
77	1
78	1
79	1
7A	1
7B	1
7C	1
7D	1
7E	1
7F	1
DROP TABLE test.t1;
SET NAMES euckr;
CREATE TABLE test.t1 (a VARCHAR(3) CHARACTER SET euckr COLLATE euckr_korean_ci) ENGINE=MyISAM CHARACTER SET euckr COLLATE euckr_korean_ci;
SHOW TABLE STATUS LIKE 't1';
Name	Engine	Version	Row_format	Rows	Avg_row_length	Data_length	Max_data_length	Index_length	Data_free	Auto_increment	Create_time	Update_time	Check_time	Collation	Checksum	Create_options	Comment
t1	MyISAM	#	#	#	#	#	#	#	#	#	#	#	#	euckr_korean_ci	#	#	#
SELECT HEX(ASCII(a)) AS a_ascii, CHAR_LENGTH(a) AS a_len FROM test.t1 ORDER BY a, ORD(a);
a_ascii	a_len
21	1
22	1
23	1
24	1
25	1
26	1
27	1
28	1
29	1
2A	1
2B	1
2C	1
2D	1
2E	1
2F	1
30	1
31	1
32	1
33	1
34	1
35	1
36	1
37	1
38	1
39	1
3A	1
3B	1
3C	1
3D	1
3E	1
3F	1
40	1
41	1
61	1
42	1
62	1
43	1
63	1
44	1
64	1
45	1
65	1
46	1
66	1
47	1
67	1
48	1
68	1
49	1
69	1
4A	1
6A	1
4B	1
6B	1
4C	1
6C	1
4D	1
6D	1
4E	1
6E	1
4F	1
6F	1
50	1
70	1
51	1
71	1
52	1
72	1
53	1
73	1
54	1
74	1
55	1
75	1
56	1
76	1
57	1
77	1
58	1
78	1
59	1
79	1
5A	1
7A	1
5B	1
5C	1
5D	1
5E	1
5F	1
60	1
7B	1
7C	1
7D	1
7E	1
7F	1
DROP TABLE test.t1;
SET NAMES gb2312;
CREATE TABLE test.t1 (a VARCHAR(3) CHARACTER SET gb2312 COLLATE gb2312_bin) ENGINE=MyISAM CHARACTER SET gb2312 COLLATE gb2312_bin;
SHOW TABLE STATUS LIKE 't1';
Name	Engine	Version	Row_format	Rows	Avg_row_length	Data_length	Max_data_length	Index_length	Data_free	Auto_increment	Create_time	Update_time	Check_time	Collation	Checksum	Create_options	Comment
t1	MyISAM	#	#	#	#	#	#	#	#	#	#	#	#	gb2312_bin	#	#	#
SELECT HEX(ASCII(a)) AS a_ascii, CHAR_LENGTH(a) AS a_len FROM test.t1 ORDER BY a, ORD(a);
a_ascii	a_len
21	1
22	1
23	1
24	1
25	1
26	1
27	1
28	1
29	1
2A	1
2B	1
2C	1
2D	1
2E	1
2F	1
30	1
31	1
32	1
33	1
34	1
35	1
36	1
37	1
38	1
39	1
3A	1
3B	1
3C	1
3D	1
3E	1
3F	1
40	1
41	1
42	1
43	1
44	1
45	1
46	1
47	1
48	1
49	1
4A	1
4B	1
4C	1
4D	1
4E	1
4F	1
50	1
51	1
52	1
53	1
54	1
55	1
56	1
57	1
58	1
59	1
5A	1
5B	1
5C	1
5D	1
5E	1
5F	1
60	1
61	1
62	1
63	1
64	1
65	1
66	1
67	1
68	1
69	1
6A	1
6B	1
6C	1
6D	1
6E	1
6F	1
70	1
71	1
72	1
73	1
74	1
75	1
76	1
77	1
78	1
79	1
7A	1
7B	1
7C	1
7D	1
7E	1
7F	1
DROP TABLE test.t1;
SET NAMES gb2312;
CREATE TABLE test.t1 (a VARCHAR(3) CHARACTER SET gb2312 COLLATE gb2312_chinese_ci) ENGINE=MyISAM CHARACTER SET gb2312 COLLATE gb2312_chinese_ci;
SHOW TABLE STATUS LIKE 't1';
Name	Engine	Version	Row_format	Rows	Avg_row_length	Data_length	Max_data_length	Index_length	Data_free	Auto_increment	Create_time	Update_time	Check_time	Collation	Checksum	Create_options	Comment
t1	MyISAM	#	#	#	#	#	#	#	#	#	#	#	#	gb2312_chinese_ci	#	#	#
SELECT HEX(ASCII(a)) AS a_ascii, CHAR_LENGTH(a) AS a_len FROM test.t1 ORDER BY a, ORD(a);
a_ascii	a_len
21	1
22	1
23	1
24	1
25	1
26	1
27	1
28	1
29	1
2A	1
2B	1
2C	1
2D	1
2E	1
2F	1
30	1
31	1
32	1
33	1
34	1
35	1
36	1
37	1
38	1
39	1
3A	1
3B	1
3C	1
3D	1
3E	1
3F	1
40	1
41	1
61	1
42	1
62	1
43	1
63	1
44	1
64	1
45	1
65	1
46	1
66	1
47	1
67	1
48	1
68	1
49	1
69	1
4A	1
6A	1
4B	1
6B	1
4C	1
6C	1
4D	1
6D	1
4E	1
6E	1
4F	1
6F	1
50	1
70	1
51	1
71	1
52	1
72	1
53	1
73	1
54	1
74	1
55	1
75	1
56	1
76	1
57	1
77	1
58	1
78	1
59	1
79	1
7E	1
5A	1
7A	1
5D	1
5B	1
5C	1
5E	1
5F	1
60	1
7B	1
7C	1
7D	1
7F	1
DROP TABLE test.t1;
SET NAMES gbk;
CREATE TABLE test.t1 (a VARCHAR(3) CHARACTER SET gbk COLLATE gbk_bin) ENGINE=MyISAM CHARACTER SET gbk COLLATE gbk_bin;
SHOW TABLE STATUS LIKE 't1';
Name	Engine	Version	Row_format	Rows	Avg_row_length	Data_length	Max_data_length	Index_length	Data_free	Auto_increment	Create_time	Update_time	Check_time	Collation	Checksum	Create_options	Comment
t1	MyISAM	#	#	#	#	#	#	#	#	#	#	#	#	gbk_bin	#	#	#
SELECT HEX(ASCII(a)) AS a_ascii, CHAR_LENGTH(a) AS a_len FROM test.t1 ORDER BY a, ORD(a);
a_ascii	a_len
21	1
22	1
23	1
24	1
25	1
26	1
27	1
28	1
29	1
2A	1
2B	1
2C	1
2D	1
2E	1
2F	1
30	1
31	1
32	1
33	1
34	1
35	1
36	1
37	1
38	1
39	1
3A	1
3B	1
3C	1
3D	1
3E	1
3F	1
40	1
41	1
42	1
43	1
44	1
45	1
46	1
47	1
48	1
49	1
4A	1
4B	1
4C	1
4D	1
4E	1
4F	1
50	1
51	1
52	1
53	1
54	1
55	1
56	1
57	1
58	1
59	1
5A	1
5B	1
5C	1
5D	1
5E	1
5F	1
60	1
61	1
62	1
63	1
64	1
65	1
66	1
67	1
68	1
69	1
6A	1
6B	1
6C	1
6D	1
6E	1
6F	1
70	1
71	1
72	1
73	1
74	1
75	1
76	1
77	1
78	1
79	1
7A	1
7B	1
7C	1
7D	1
7E	1
7F	1
DROP TABLE test.t1;
SET NAMES gbk;
CREATE TABLE test.t1 (a VARCHAR(3) CHARACTER SET gbk COLLATE gbk_chinese_ci) ENGINE=MyISAM CHARACTER SET gbk COLLATE gbk_chinese_ci;
SHOW TABLE STATUS LIKE 't1';
Name	Engine	Version	Row_format	Rows	Avg_row_length	Data_length	Max_data_length	Index_length	Data_free	Auto_increment	Create_time	Update_time	Check_time	Collation	Checksum	Create_options	Comment
t1	MyISAM	#	#	#	#	#	#	#	#	#	#	#	#	gbk_chinese_ci	#	#	#
SELECT HEX(ASCII(a)) AS a_ascii, CHAR_LENGTH(a) AS a_len FROM test.t1 ORDER BY a, ORD(a);
a_ascii	a_len
21	1
22	1
23	1
24	1
25	1
26	1
27	1
28	1
29	1
2A	1
2B	1
2C	1
2D	1
2E	1
2F	1
30	1
31	1
32	1
33	1
34	1
35	1
36	1
37	1
38	1
39	1
3A	1
3B	1
3C	1
3D	1
3E	1
3F	1
40	1
41	1
61	1
42	1
62	1
43	1
63	1
44	1
64	1
45	1
65	1
46	1
66	1
47	1
67	1
48	1
68	1
49	1
69	1
4A	1
6A	1
4B	1
6B	1
4C	1
6C	1
4D	1
6D	1
4E	1
6E	1
4F	1
6F	1
50	1
70	1
51	1
71	1
52	1
72	1
53	1
73	1
54	1
74	1
55	1
75	1
56	1
76	1
57	1
77	1
58	1
78	1
59	1
79	1
7E	1
5A	1
7A	1
5D	1
5B	1
5C	1
5E	1
5F	1
60	1
7B	1
7C	1
7D	1
7F	1
DROP TABLE test.t1;
SET NAMES gb18030;
CREATE TABLE test.t1 (a VARCHAR(3) CHARACTER SET gb18030 COLLATE gb18030_bin) ENGINE=MyISAM CHARACTER SET gb18030 COLLATE gb18030_bin;
SHOW TABLE STATUS LIKE 't1';
Name	Engine	Version	Row_format	Rows	Avg_row_length	Data_length	Max_data_length	Index_length	Data_free	Auto_increment	Create_time	Update_time	Check_time	Collation	Checksum	Create_options	Comment
t1	MyISAM	#	#	#	#	#	#	#	#	#	#	#	#	gb18030_bin	#	#	#
SELECT HEX(ASCII(a)) AS a_ascii, CHAR_LENGTH(a) AS a_len FROM test.t1 ORDER BY a, ORD(a);
a_ascii	a_len
21	1
22	1
23	1
24	1
25	1
26	1
27	1
28	1
29	1
2A	1
2B	1
2C	1
2D	1
2E	1
2F	1
30	1
31	1
32	1
33	1
34	1
35	1
36	1
37	1
38	1
39	1
3A	1
3B	1
3C	1
3D	1
3E	1
3F	1
40	1
41	1
42	1
43	1
44	1
45	1
46	1
47	1
48	1
49	1
4A	1
4B	1
4C	1
4D	1
4E	1
4F	1
50	1
51	1
52	1
53	1
54	1
55	1
56	1
57	1
58	1
59	1
5A	1
5B	1
5C	1
5D	1
5E	1
5F	1
60	1
61	1
62	1
63	1
64	1
65	1
66	1
67	1
68	1
69	1
6A	1
6B	1
6C	1
6D	1
6E	1
6F	1
70	1
71	1
72	1
73	1
74	1
75	1
76	1
77	1
78	1
79	1
7A	1
7B	1
7C	1
7D	1
7E	1
7F	1
DROP TABLE test.t1;
SET NAMES gb18030;
CREATE TABLE test.t1 (a VARCHAR(3) CHARACTER SET gb18030 COLLATE gb18030_chinese_ci) ENGINE=MyISAM CHARACTER SET gb18030 COLLATE gb18030_chinese_ci;
SHOW TABLE STATUS LIKE 't1';
Name	Engine	Version	Row_format	Rows	Avg_row_length	Data_length	Max_data_length	Index_length	Data_free	Auto_increment	Create_time	Update_time	Check_time	Collation	Checksum	Create_options	Comment
t1	MyISAM	#	#	#	#	#	#	#	#	#	#	#	#	gb18030_chinese_ci	#	#	#
SELECT HEX(ASCII(a)) AS a_ascii, CHAR_LENGTH(a) AS a_len FROM test.t1 ORDER BY a, ORD(a);
a_ascii	a_len
21	1
22	1
23	1
24	1
25	1
26	1
27	1
28	1
29	1
2A	1
2B	1
2C	1
2D	1
2E	1
2F	1
30	1
31	1
32	1
33	1
34	1
35	1
36	1
37	1
38	1
39	1
3A	1
3B	1
3C	1
3D	1
3E	1
3F	1
40	1
41	1
61	1
42	1
62	1
43	1
63	1
44	1
64	1
45	1
65	1
46	1
66	1
47	1
67	1
48	1
68	1
49	1
69	1
4A	1
6A	1
4B	1
6B	1
4C	1
6C	1
4D	1
6D	1
4E	1
6E	1
4F	1
6F	1
50	1
70	1
51	1
71	1
52	1
72	1
53	1
73	1
54	1
74	1
55	1
75	1
56	1
76	1
57	1
77	1
58	1
78	1
59	1
79	1
5A	1
7A	1
5B	1
5C	1
5D	1
5E	1
5F	1
60	1
7B	1
7C	1
7D	1
7E	1
7F	1
DROP TABLE test.t1;
SET NAMES geostd8;
CREATE TABLE test.t1 (a VARCHAR(3) CHARACTER SET geostd8 COLLATE geostd8_bin) ENGINE=MyISAM CHARACTER SET geostd8 COLLATE geostd8_bin;
SHOW TABLE STATUS LIKE 't1';
Name	Engine	Version	Row_format	Rows	Avg_row_length	Data_length	Max_data_length	Index_length	Data_free	Auto_increment	Create_time	Update_time	Check_time	Collation	Checksum	Create_options	Comment
t1	MyISAM	#	#	#	#	#	#	#	#	#	#	#	#	geostd8_bin	#	#	#
SELECT HEX(ASCII(a)) AS a_ascii, CHAR_LENGTH(a) AS a_len FROM test.t1 ORDER BY a, ORD(a);
a_ascii	a_len
21	1
22	1
23	1
24	1
25	1
26	1
27	1
28	1
29	1
2A	1
2B	1
2C	1
2D	1
2E	1
2F	1
30	1
31	1
32	1
33	1
34	1
35	1
36	1
37	1
38	1
39	1
3A	1
3B	1
3C	1
3D	1
3E	1
3F	1
40	1
41	1
42	1
43	1
44	1
45	1
46	1
47	1
48	1
49	1
4A	1
4B	1
4C	1
4D	1
4E	1
4F	1
50	1
51	1
52	1
53	1
54	1
55	1
56	1
57	1
58	1
59	1
5A	1
5B	1
5C	1
5D	1
5E	1
5F	1
60	1
61	1
62	1
63	1
64	1
65	1
66	1
67	1
68	1
69	1
6A	1
6B	1
6C	1
6D	1
6E	1
6F	1
70	1
71	1
72	1
73	1
74	1
75	1
76	1
77	1
78	1
79	1
7A	1
7B	1
7C	1
7D	1
7E	1
7F	1
80	1
81	1
82	1
83	1
84	1
85	1
86	1
87	1
88	1
89	1
8A	1
8B	1
8C	1
8D	1
8E	1
8F	1
90	1
91	1
92	1
93	1
94	1
95	1
96	1
97	1
98	1
99	1
9A	1
9B	1
9C	1
9D	1
9E	1
9F	1
A0	1
A1	1
A2	1
A3	1
A4	1
A5	1
A6	1
A7	1
A8	1
A9	1
AA	1
AB	1
AC	1
AD	1
AE	1
AF	1
B0	1
B1	1
B2	1
B3	1
B4	1
B5	1
B6	1
B7	1
B8	1
B9	1
BA	1
BB	1
BC	1
BD	1
BE	1
BF	1
C0	1
C1	1
C2	1
C3	1
C4	1
C5	1
C6	1
C7	1
C8	1
C9	1
CA	1
CB	1
CC	1
CD	1
CE	1
CF	1
D0	1
D1	1
D2	1
D3	1
D4	1
D5	1
D6	1
D7	1
D8	1
D9	1
DA	1
DB	1
DC	1
DD	1
DE	1
DF	1
E0	1
E1	1
E2	1
E3	1
E4	1
E5	1
E6	1
E7	1
E8	1
E9	1
EA	1
EB	1
EC	1
ED	1
EE	1
EF	1
F0	1
F1	1
F2	1
F3	1
F4	1
F5	1
F6	1
F7	1
F8	1
F9	1
FA	1
FB	1
FC	1
FD	1
DROP TABLE test.t1;
SET NAMES geostd8;
CREATE TABLE test.t1 (a VARCHAR(3) CHARACTER SET geostd8 COLLATE geostd8_general_ci) ENGINE=MyISAM CHARACTER SET geostd8 COLLATE geostd8_general_ci;
SHOW TABLE STATUS LIKE 't1';
Name	Engine	Version	Row_format	Rows	Avg_row_length	Data_length	Max_data_length	Index_length	Data_free	Auto_increment	Create_time	Update_time	Check_time	Collation	Checksum	Create_options	Comment
t1	MyISAM	#	#	#	#	#	#	#	#	#	#	#	#	geostd8_general_ci	#	#	#
SELECT HEX(ASCII(a)) AS a_ascii, CHAR_LENGTH(a) AS a_len FROM test.t1 ORDER BY a, ORD(a);
a_ascii	a_len
21	1
22	1
23	1
24	1
25	1
26	1
27	1
28	1
29	1
2A	1
2B	1
2C	1
2D	1
2E	1
2F	1
30	1
31	1
32	1
33	1
34	1
35	1
36	1
37	1
38	1
39	1
3A	1
3B	1
3C	1
3D	1
3E	1
3F	1
40	1
60	1
41	1
61	1
42	1
62	1
43	1
63	1
44	1
64	1
45	1
65	1
46	1
66	1
47	1
67	1
48	1
68	1
49	1
69	1
4A	1
6A	1
4B	1
6B	1
4C	1
6C	1
4D	1
6D	1
4E	1
6E	1
4F	1
6F	1
50	1
70	1
51	1
71	1
52	1
72	1
53	1
73	1
54	1
74	1
55	1
75	1
56	1
76	1
57	1
77	1
58	1
78	1
59	1
79	1
5A	1
7A	1
5B	1
5C	1
5D	1
5E	1
5F	1
7B	1
7C	1
7D	1
7E	1
7F	1
80	1
81	1
82	1
83	1
84	1
85	1
86	1
87	1
88	1
89	1
8A	1
8B	1
8C	1
8D	1
8E	1
8F	1
90	1
91	1
92	1
93	1
94	1
95	1
96	1
97	1
98	1
99	1
9A	1
9B	1
9C	1
9D	1
9E	1
9F	1
A0	1
A1	1
A2	1
A3	1
A4	1
A5	1
A6	1
A7	1
A8	1
A9	1
AA	1
AB	1
AC	1
AD	1
AE	1
AF	1
B0	1
B1	1
B2	1
B3	1
B4	1
B5	1
B6	1
B7	1
B8	1
B9	1
BA	1
BB	1
BC	1
BD	1
BE	1
BF	1
C0	1
C1	1
C2	1
C3	1
C4	1
C5	1
C6	1
C7	1
C8	1
C9	1
CA	1
CB	1
CC	1
CD	1
CE	1
CF	1
D0	1
D1	1
D2	1
D3	1
D4	1
D5	1
D6	1
D7	1
D8	1
D9	1
DA	1
DB	1
DC	1
DD	1
DE	1
DF	1
E0	1
E1	1
E2	1
E3	1
E4	1
E5	1
E6	1
E7	1
E8	1
E9	1
EA	1
EB	1
EC	1
ED	1
EE	1
EF	1
F0	1
F1	1
F2	1
F3	1
F4	1
F5	1
F6	1
F7	1
F8	1
F9	1
FA	1
FB	1
FC	1
FD	1
DROP TABLE test.t1;
SET NAMES greek;
CREATE TABLE test.t1 (a VARCHAR(3) CHARACTER SET greek COLLATE greek_bin) ENGINE=MyISAM CHARACTER SET greek COLLATE greek_bin;
SHOW TABLE STATUS LIKE 't1';
Name	Engine	Version	Row_format	Rows	Avg_row_length	Data_length	Max_data_length	Index_length	Data_free	Auto_increment	Create_time	Update_time	Check_time	Collation	Checksum	Create_options	Comment
t1	MyISAM	#	#	#	#	#	#	#	#	#	#	#	#	greek_bin	#	#	#
SELECT HEX(ASCII(a)) AS a_ascii, CHAR_LENGTH(a) AS a_len FROM test.t1 ORDER BY a, ORD(a);
a_ascii	a_len
21	1
22	1
23	1
24	1
25	1
26	1
27	1
28	1
29	1
2A	1
2B	1
2C	1
2D	1
2E	1
2F	1
30	1
31	1
32	1
33	1
34	1
35	1
36	1
37	1
38	1
39	1
3A	1
3B	1
3C	1
3D	1
3E	1
3F	1
40	1
41	1
42	1
43	1
44	1
45	1
46	1
47	1
48	1
49	1
4A	1
4B	1
4C	1
4D	1
4E	1
4F	1
50	1
51	1
52	1
53	1
54	1
55	1
56	1
57	1
58	1
59	1
5A	1
5B	1
5C	1
5D	1
5E	1
5F	1
60	1
61	1
62	1
63	1
64	1
65	1
66	1
67	1
68	1
69	1
6A	1
6B	1
6C	1
6D	1
6E	1
6F	1
70	1
71	1
72	1
73	1
74	1
75	1
76	1
77	1
78	1
79	1
7A	1
7B	1
7C	1
7D	1
7E	1
7F	1
80	1
81	1
82	1
83	1
84	1
85	1
86	1
87	1
88	1
89	1
8A	1
8B	1
8C	1
8D	1
8E	1
8F	1
90	1
91	1
92	1
93	1
94	1
95	1
96	1
97	1
98	1
99	1
9A	1
9B	1
9C	1
9D	1
9E	1
9F	1
A0	1
A1	1
A2	1
A3	1
A4	1
A5	1
A6	1
A7	1
A8	1
A9	1
AA	1
AB	1
AC	1
AD	1
AE	1
AF	1
B0	1
B1	1
B2	1
B3	1
B4	1
B5	1
B6	1
B7	1
B8	1
B9	1
BA	1
BB	1
BC	1
BD	1
BE	1
BF	1
C0	1
C1	1
C2	1
C3	1
C4	1
C5	1
C6	1
C7	1
C8	1
C9	1
CA	1
CB	1
CC	1
CD	1
CE	1
CF	1
D0	1
D1	1
D2	1
D3	1
D4	1
D5	1
D6	1
D7	1
D8	1
D9	1
DA	1
DB	1
DC	1
DD	1
DE	1
DF	1
E0	1
E1	1
E2	1
E3	1
E4	1
E5	1
E6	1
E7	1
E8	1
E9	1
EA	1
EB	1
EC	1
ED	1
EE	1
EF	1
F0	1
F1	1
F2	1
F3	1
F4	1
F5	1
F6	1
F7	1
F8	1
F9	1
FA	1
FB	1
FC	1
FD	1
DROP TABLE test.t1;
SET NAMES greek;
CREATE TABLE test.t1 (a VARCHAR(3) CHARACTER SET greek COLLATE greek_general_ci) ENGINE=MyISAM CHARACTER SET greek COLLATE greek_general_ci;
SHOW TABLE STATUS LIKE 't1';
Name	Engine	Version	Row_format	Rows	Avg_row_length	Data_length	Max_data_length	Index_length	Data_free	Auto_increment	Create_time	Update_time	Check_time	Collation	Checksum	Create_options	Comment
t1	MyISAM	#	#	#	#	#	#	#	#	#	#	#	#	greek_general_ci	#	#	#
SELECT HEX(ASCII(a)) AS a_ascii, CHAR_LENGTH(a) AS a_len FROM test.t1 ORDER BY a, ORD(a);
a_ascii	a_len
21	1
22	1
23	1
24	1
25	1
26	1
27	1
28	1
29	1
2A	1
2B	1
2C	1
2D	1
2E	1
2F	1
30	1
31	1
32	1
33	1
34	1
35	1
36	1
37	1
38	1
39	1
3A	1
3B	1
3C	1
3D	1
3E	1
3F	1
40	1
41	1
61	1
42	1
62	1
43	1
63	1
44	1
64	1
45	1
65	1
46	1
66	1
47	1
67	1
48	1
68	1
49	1
69	1
4A	1
6A	1
4B	1
6B	1
4C	1
6C	1
4D	1
6D	1
4E	1
6E	1
4F	1
6F	1
50	1
70	1
51	1
71	1
52	1
72	1
53	1
73	1
54	1
74	1
55	1
75	1
56	1
76	1
57	1
77	1
58	1
78	1
59	1
79	1
5A	1
7A	1
5B	1
5C	1
5D	1
5E	1
5F	1
60	1
7B	1
7C	1
7D	1
7E	1
7F	1
80	1
81	1
82	1
83	1
84	1
85	1
86	1
87	1
88	1
89	1
8A	1
8B	1
8C	1
8D	1
8E	1
8F	1
90	1
91	1
92	1
93	1
94	1
95	1
96	1
97	1
98	1
99	1
9A	1
9B	1
9C	1
9D	1
9E	1
9F	1
A0	1
A1	1
A2	1
A3	1
A4	1
A5	1
A6	1
A7	1
A8	1
A9	1
AA	1
AB	1
AC	1
AD	1
AE	1
AF	1
B0	1
B1	1
B2	1
B3	1
B4	1
B5	1
B7	1
BB	1
BD	1
B6	1
C1	1
DC	1
E1	1
C2	1
E2	1
C3	1
E3	1
C4	1
E4	1
B8	1
C5	1
DD	1
E5	1
C6	1
E6	1
B9	1
C7	1
DE	1
E7	1
C8	1
E8	1
BA	1
C0	1
C9	1
DA	1
DF	1
E9	1
FA	1
CA	1
EA	1
CB	1
EB	1
CC	1
EC	1
CD	1
ED	1
CE	1
EE	1
BC	1
CF	1
EF	1
FC	1
D0	1
F0	1
D1	1
F1	1
D2	1
D3	1
F2	1
F3	1
D4	1
F4	1
BE	1
D5	1
DB	1
E0	1
F5	1
FB	1
FD	1
D6	1
F6	1
D7	1
F7	1
D8	1
F8	1
BF	1
D9	1
F9	1
DROP TABLE test.t1;
SET NAMES hebrew;
CREATE TABLE test.t1 (a VARCHAR(3) CHARACTER SET hebrew COLLATE hebrew_bin) ENGINE=MyISAM CHARACTER SET hebrew COLLATE hebrew_bin;
SHOW TABLE STATUS LIKE 't1';
Name	Engine	Version	Row_format	Rows	Avg_row_length	Data_length	Max_data_length	Index_length	Data_free	Auto_increment	Create_time	Update_time	Check_time	Collation	Checksum	Create_options	Comment
t1	MyISAM	#	#	#	#	#	#	#	#	#	#	#	#	hebrew_bin	#	#	#
SELECT HEX(ASCII(a)) AS a_ascii, CHAR_LENGTH(a) AS a_len FROM test.t1 ORDER BY a, ORD(a);
a_ascii	a_len
21	1
22	1
23	1
24	1
25	1
26	1
27	1
28	1
29	1
2A	1
2B	1
2C	1
2D	1
2E	1
2F	1
30	1
31	1
32	1
33	1
34	1
35	1
36	1
37	1
38	1
39	1
3A	1
3B	1
3C	1
3D	1
3E	1
3F	1
40	1
41	1
42	1
43	1
44	1
45	1
46	1
47	1
48	1
49	1
4A	1
4B	1
4C	1
4D	1
4E	1
4F	1
50	1
51	1
52	1
53	1
54	1
55	1
56	1
57	1
58	1
59	1
5A	1
5B	1
5C	1
5D	1
5E	1
5F	1
60	1
61	1
62	1
63	1
64	1
65	1
66	1
67	1
68	1
69	1
6A	1
6B	1
6C	1
6D	1
6E	1
6F	1
70	1
71	1
72	1
73	1
74	1
75	1
76	1
77	1
78	1
79	1
7A	1
7B	1
7C	1
7D	1
7E	1
7F	1
80	1
81	1
82	1
83	1
84	1
85	1
86	1
87	1
88	1
89	1
8A	1
8B	1
8C	1
8D	1
8E	1
8F	1
90	1
91	1
92	1
93	1
94	1
95	1
96	1
97	1
98	1
99	1
9A	1
9B	1
9C	1
9D	1
9E	1
9F	1
A0	1
A1	1
A2	1
A3	1
A4	1
A5	1
A6	1
A7	1
A8	1
A9	1
AA	1
AB	1
AC	1
AD	1
AE	1
AF	1
B0	1
B1	1
B2	1
B3	1
B4	1
B5	1
B6	1
B7	1
B8	1
B9	1
BA	1
BB	1
BC	1
BD	1
BE	1
BF	1
C0	1
C1	1
C2	1
C3	1
C4	1
C5	1
C6	1
C7	1
C8	1
C9	1
CA	1
CB	1
CC	1
CD	1
CE	1
CF	1
D0	1
D1	1
D2	1
D3	1
D4	1
D5	1
D6	1
D7	1
D8	1
D9	1
DA	1
DB	1
DC	1
DD	1
DE	1
DF	1
E0	1
E1	1
E2	1
E3	1
E4	1
E5	1
E6	1
E7	1
E8	1
E9	1
EA	1
EB	1
EC	1
ED	1
EE	1
EF	1
F0	1
F1	1
F2	1
F3	1
F4	1
F5	1
F6	1
F7	1
F8	1
F9	1
FA	1
FB	1
FC	1
FD	1
DROP TABLE test.t1;
SET NAMES hebrew;
CREATE TABLE test.t1 (a VARCHAR(3) CHARACTER SET hebrew COLLATE hebrew_general_ci) ENGINE=MyISAM CHARACTER SET hebrew COLLATE hebrew_general_ci;
SHOW TABLE STATUS LIKE 't1';
Name	Engine	Version	Row_format	Rows	Avg_row_length	Data_length	Max_data_length	Index_length	Data_free	Auto_increment	Create_time	Update_time	Check_time	Collation	Checksum	Create_options	Comment
t1	MyISAM	#	#	#	#	#	#	#	#	#	#	#	#	hebrew_general_ci	#	#	#
SELECT HEX(ASCII(a)) AS a_ascii, CHAR_LENGTH(a) AS a_len FROM test.t1 ORDER BY a, ORD(a);
a_ascii	a_len
21	1
22	1
23	1
24	1
25	1
26	1
27	1
28	1
29	1
2A	1
2B	1
2C	1
2D	1
2E	1
2F	1
30	1
31	1
32	1
33	1
34	1
35	1
36	1
37	1
38	1
39	1
3A	1
3B	1
3C	1
3D	1
3E	1
3F	1
40	1
41	1
61	1
42	1
62	1
43	1
63	1
44	1
64	1
45	1
65	1
46	1
66	1
47	1
67	1
48	1
68	1
49	1
69	1
4A	1
6A	1
4B	1
6B	1
4C	1
6C	1
4D	1
6D	1
4E	1
6E	1
4F	1
6F	1
50	1
70	1
51	1
71	1
52	1
72	1
53	1
73	1
54	1
74	1
55	1
75	1
56	1
76	1
57	1
77	1
58	1
78	1
59	1
79	1
5A	1
7A	1
5B	1
5C	1
5D	1
5E	1
5F	1
60	1
7B	1
7C	1
7D	1
7E	1
7F	1
80	1
81	1
82	1
83	1
84	1
85	1
86	1
87	1
88	1
89	1
8A	1
8B	1
8C	1
8D	1
8E	1
8F	1
90	1
91	1
92	1
93	1
94	1
95	1
96	1
97	1
98	1
99	1
9A	1
9B	1
9C	1
9D	1
9E	1
9F	1
A0	1
A1	1
A2	1
A3	1
A4	1
A5	1
A6	1
A7	1
A8	1
A9	1
AA	1
AB	1
AC	1
AD	1
AE	1
AF	1
B0	1
B1	1
B2	1
B3	1
B4	1
B5	1
B6	1
B7	1
B8	1
B9	1
BA	1
BB	1
BC	1
BD	1
BE	1
BF	1
C0	1
C1	1
C2	1
C3	1
C4	1
C5	1
C6	1
C7	1
C8	1
C9	1
CA	1
CB	1
CC	1
CD	1
CE	1
CF	1
D0	1
D1	1
D2	1
D3	1
D4	1
D5	1
D6	1
D8	1
D9	1
DA	1
DB	1
DC	1
DD	1
DE	1
E0	1
E1	1
E2	1
E3	1
E4	1
E5	1
E6	1
E7	1
E8	1
E9	1
EA	1
EB	1
EC	1
ED	1
EE	1
EF	1
F0	1
F1	1
F2	1
F3	1
F4	1
F5	1
F6	1
D7	1
F7	1
F8	1
F9	1
FA	1
FB	1
FC	1
FD	1
DF	1
DROP TABLE test.t1;
SET NAMES hp8;
Warnings:
Warning	1287	'hp8' is deprecated and will be removed in a future release. Please use utf8mb4 instead
CREATE TABLE test.t1 (a VARCHAR(3) CHARACTER SET hp8 COLLATE hp8_bin) ENGINE=MyISAM CHARACTER SET hp8 COLLATE hp8_bin;
Warnings:
Warning	1287	'hp8' is deprecated and will be removed in a future release. Please use utf8mb4 instead
Warning	4079	'hp8_bin' is a collation of the deprecated character set hp8. Please consider using utf8mb4 with an appropriate collation instead.
Warning	1287	'hp8' is deprecated and will be removed in a future release. Please use utf8mb4 instead
Warning	4079	'hp8_bin' is a collation of the deprecated character set hp8. Please consider using utf8mb4 with an appropriate collation instead.
SHOW TABLE STATUS LIKE 't1';
Name	Engine	Version	Row_format	Rows	Avg_row_length	Data_length	Max_data_length	Index_length	Data_free	Auto_increment	Create_time	Update_time	Check_time	Collation	Checksum	Create_options	Comment
t1	MyISAM	#	#	#	#	#	#	#	#	#	#	#	#	hp8_bin	#	#	#
SELECT HEX(ASCII(a)) AS a_ascii, CHAR_LENGTH(a) AS a_len FROM test.t1 ORDER BY a, ORD(a);
a_ascii	a_len
21	1
22	1
23	1
24	1
25	1
26	1
27	1
28	1
29	1
2A	1
2B	1
2C	1
2D	1
2E	1
2F	1
30	1
31	1
32	1
33	1
34	1
35	1
36	1
37	1
38	1
39	1
3A	1
3B	1
3C	1
3D	1
3E	1
3F	1
40	1
41	1
42	1
43	1
44	1
45	1
46	1
47	1
48	1
49	1
4A	1
4B	1
4C	1
4D	1
4E	1
4F	1
50	1
51	1
52	1
53	1
54	1
55	1
56	1
57	1
58	1
59	1
5A	1
5B	1
5C	1
5D	1
5E	1
5F	1
60	1
61	1
62	1
63	1
64	1
65	1
66	1
67	1
68	1
69	1
6A	1
6B	1
6C	1
6D	1
6E	1
6F	1
70	1
71	1
72	1
73	1
74	1
75	1
76	1
77	1
78	1
79	1
7A	1
7B	1
7C	1
7D	1
7E	1
7F	1
80	1
81	1
82	1
83	1
84	1
85	1
86	1
87	1
88	1
89	1
8A	1
8B	1
8C	1
8D	1
8E	1
8F	1
90	1
91	1
92	1
93	1
94	1
95	1
96	1
97	1
98	1
99	1
9A	1
9B	1
9C	1
9D	1
9E	1
9F	1
A0	1
A1	1
A2	1
A3	1
A4	1
A5	1
A6	1
A7	1
A8	1
A9	1
AA	1
AB	1
AC	1
AD	1
AE	1
AF	1
B0	1
B1	1
B2	1
B3	1
B4	1
B5	1
B6	1
B7	1
B8	1
B9	1
BA	1
BB	1
BC	1
BD	1
BE	1
BF	1
C0	1
C1	1
C2	1
C3	1
C4	1
C5	1
C6	1
C7	1
C8	1
C9	1
CA	1
CB	1
CC	1
CD	1
CE	1
CF	1
D0	1
D1	1
D2	1
D3	1
D4	1
D5	1
D6	1
D7	1
D8	1
D9	1
DA	1
DB	1
DC	1
DD	1
DE	1
DF	1
E0	1
E1	1
E2	1
E3	1
E4	1
E5	1
E6	1
E7	1
E8	1
E9	1
EA	1
EB	1
EC	1
ED	1
EE	1
EF	1
F0	1
F1	1
F2	1
F3	1
F4	1
F5	1
F6	1
F7	1
F8	1
F9	1
FA	1
FB	1
FC	1
FD	1
DROP TABLE test.t1;
SET NAMES hp8;
Warnings:
Warning	1287	'hp8' is deprecated and will be removed in a future release. Please use utf8mb4 instead
CREATE TABLE test.t1 (a VARCHAR(3) CHARACTER SET hp8 COLLATE hp8_english_ci) ENGINE=MyISAM CHARACTER SET hp8 COLLATE hp8_english_ci;
Warnings:
Warning	1287	'hp8' is deprecated and will be removed in a future release. Please use utf8mb4 instead
Warning	4079	'hp8_english_ci' is a collation of the deprecated character set hp8. Please consider using utf8mb4 with an appropriate collation instead.
Warning	1287	'hp8' is deprecated and will be removed in a future release. Please use utf8mb4 instead
Warning	4079	'hp8_english_ci' is a collation of the deprecated character set hp8. Please consider using utf8mb4 with an appropriate collation instead.
SHOW TABLE STATUS LIKE 't1';
Name	Engine	Version	Row_format	Rows	Avg_row_length	Data_length	Max_data_length	Index_length	Data_free	Auto_increment	Create_time	Update_time	Check_time	Collation	Checksum	Create_options	Comment
t1	MyISAM	#	#	#	#	#	#	#	#	#	#	#	#	hp8_english_ci	#	#	#
SELECT HEX(ASCII(a)) AS a_ascii, CHAR_LENGTH(a) AS a_len FROM test.t1 ORDER BY a, ORD(a);
a_ascii	a_len
21	1
22	1
23	1
24	1
25	1
26	1
27	1
28	1
29	1
2A	1
2B	1
2C	1
2D	1
2E	1
2F	1
30	1
31	1
32	1
33	1
34	1
35	1
36	1
37	1
38	1
39	1
3A	1
3B	1
3C	1
3D	1
3E	1
3F	1
40	1
41	1
61	1
42	1
62	1
43	1
63	1
44	1
64	1
45	1
65	1
46	1
66	1
47	1
67	1
48	1
68	1
49	1
69	1
4A	1
6A	1
4B	1
6B	1
4C	1
6C	1
4D	1
6D	1
4E	1
6E	1
4F	1
6F	1
50	1
70	1
51	1
71	1
52	1
72	1
53	1
73	1
54	1
74	1
55	1
75	1
56	1
76	1
57	1
77	1
58	1
78	1
59	1
79	1
5A	1
7A	1
5D	1
5B	1
5C	1
5E	1
5F	1
60	1
7B	1
7C	1
7D	1
7E	1
7F	1
80	1
81	1
82	1
83	1
84	1
85	1
86	1
87	1
88	1
89	1
8A	1
8B	1
8C	1
8D	1
8E	1
8F	1
90	1
91	1
92	1
93	1
94	1
95	1
96	1
97	1
98	1
99	1
9A	1
9B	1
9C	1
9D	1
9E	1
9F	1
A0	1
A1	1
A2	1
A3	1
A4	1
A5	1
A6	1
A7	1
A8	1
A9	1
AA	1
AB	1
AC	1
AD	1
AE	1
AF	1
B0	1
B1	1
B2	1
B3	1
B4	1
B5	1
B6	1
B7	1
B8	1
B9	1
BA	1
BB	1
BC	1
BD	1
BE	1
BF	1
C0	1
C1	1
C2	1
C3	1
C4	1
C5	1
C6	1
C7	1
C8	1
C9	1
CA	1
CB	1
CC	1
CD	1
CE	1
CF	1
D0	1
D1	1
D2	1
D3	1
D4	1
D5	1
D6	1
D7	1
D8	1
D9	1
DA	1
DB	1
DC	1
DD	1
DE	1
DF	1
E0	1
E1	1
E2	1
E3	1
E4	1
E5	1
E6	1
E7	1
E8	1
E9	1
EA	1
EB	1
EC	1
ED	1
EE	1
EF	1
F0	1
F1	1
F2	1
F3	1
F4	1
F5	1
F6	1
F7	1
F8	1
F9	1
FA	1
FB	1
FC	1
FD	1
DROP TABLE test.t1;
SET NAMES keybcs2;
CREATE TABLE test.t1 (a VARCHAR(3) CHARACTER SET keybcs2 COLLATE keybcs2_bin) ENGINE=MyISAM CHARACTER SET keybcs2 COLLATE keybcs2_bin;
SHOW TABLE STATUS LIKE 't1';
Name	Engine	Version	Row_format	Rows	Avg_row_length	Data_length	Max_data_length	Index_length	Data_free	Auto_increment	Create_time	Update_time	Check_time	Collation	Checksum	Create_options	Comment
t1	MyISAM	#	#	#	#	#	#	#	#	#	#	#	#	keybcs2_bin	#	#	#
SELECT HEX(ASCII(a)) AS a_ascii, CHAR_LENGTH(a) AS a_len FROM test.t1 ORDER BY a, ORD(a);
a_ascii	a_len
21	1
22	1
23	1
24	1
25	1
26	1
27	1
28	1
29	1
2A	1
2B	1
2C	1
2D	1
2E	1
2F	1
30	1
31	1
32	1
33	1
34	1
35	1
36	1
37	1
38	1
39	1
3A	1
3B	1
3C	1
3D	1
3E	1
3F	1
40	1
41	1
42	1
43	1
44	1
45	1
46	1
47	1
48	1
49	1
4A	1
4B	1
4C	1
4D	1
4E	1
4F	1
50	1
51	1
52	1
53	1
54	1
55	1
56	1
57	1
58	1
59	1
5A	1
5B	1
5C	1
5D	1
5E	1
5F	1
60	1
61	1
62	1
63	1
64	1
65	1
66	1
67	1
68	1
69	1
6A	1
6B	1
6C	1
6D	1
6E	1
6F	1
70	1
71	1
72	1
73	1
74	1
75	1
76	1
77	1
78	1
79	1
7A	1
7B	1
7C	1
7D	1
7E	1
7F	1
80	1
81	1
82	1
83	1
84	1
85	1
86	1
87	1
88	1
89	1
8A	1
8B	1
8C	1
8D	1
8E	1
8F	1
90	1
91	1
92	1
93	1
94	1
95	1
96	1
97	1
98	1
99	1
9A	1
9B	1
9C	1
9D	1
9E	1
9F	1
A0	1
A1	1
A2	1
A3	1
A4	1
A5	1
A6	1
A7	1
A8	1
A9	1
AA	1
AB	1
AC	1
AD	1
AE	1
AF	1
B0	1
B1	1
B2	1
B3	1
B4	1
B5	1
B6	1
B7	1
B8	1
B9	1
BA	1
BB	1
BC	1
BD	1
BE	1
BF	1
C0	1
C1	1
C2	1
C3	1
C4	1
C5	1
C6	1
C7	1
C8	1
C9	1
CA	1
CB	1
CC	1
CD	1
CE	1
CF	1
D0	1
D1	1
D2	1
D3	1
D4	1
D5	1
D6	1
D7	1
D8	1
D9	1
DA	1
DB	1
DC	1
DD	1
DE	1
DF	1
E0	1
E1	1
E2	1
E3	1
E4	1
E5	1
E6	1
E7	1
E8	1
E9	1
EA	1
EB	1
EC	1
ED	1
EE	1
EF	1
F0	1
F1	1
F2	1
F3	1
F4	1
F5	1
F6	1
F7	1
F8	1
F9	1
FA	1
FB	1
FC	1
FD	1
DROP TABLE test.t1;
SET NAMES keybcs2;
CREATE TABLE test.t1 (a VARCHAR(3) CHARACTER SET keybcs2 COLLATE keybcs2_general_ci) ENGINE=MyISAM CHARACTER SET keybcs2 COLLATE keybcs2_general_ci;
SHOW TABLE STATUS LIKE 't1';
Name	Engine	Version	Row_format	Rows	Avg_row_length	Data_length	Max_data_length	Index_length	Data_free	Auto_increment	Create_time	Update_time	Check_time	Collation	Checksum	Create_options	Comment
t1	MyISAM	#	#	#	#	#	#	#	#	#	#	#	#	keybcs2_general_ci	#	#	#
SELECT HEX(ASCII(a)) AS a_ascii, CHAR_LENGTH(a) AS a_len FROM test.t1 ORDER BY a, ORD(a);
a_ascii	a_len
21	1
22	1
23	1
24	1
25	1
26	1
27	1
28	1
29	1
2A	1
2B	1
2C	1
2D	1
2E	1
2F	1
30	1
31	1
32	1
33	1
34	1
35	1
36	1
37	1
38	1
39	1
3A	1
3B	1
3C	1
3D	1
3E	1
3F	1
40	1
41	1
61	1
84	1
8E	1
8F	1
A0	1
42	1
62	1
43	1
63	1
80	1
87	1
44	1
64	1
83	1
85	1
45	1
65	1
82	1
88	1
89	1
90	1
46	1
66	1
47	1
67	1
48	1
68	1
49	1
69	1
8B	1
A1	1
4A	1
6A	1
4B	1
6B	1
4C	1
6C	1
8A	1
8C	1
8D	1
9C	1
4D	1
6D	1
4E	1
6E	1
A4	1
A5	1
4F	1
6F	1
93	1
94	1
95	1
99	1
A2	1
A7	1
50	1
70	1
51	1
71	1
52	1
72	1
9E	1
A9	1
AA	1
AB	1
53	1
73	1
9B	1
A8	1
E1	1
54	1
74	1
86	1
9F	1
55	1
75	1
81	1
96	1
97	1
9A	1
A3	1
A6	1
56	1
76	1
57	1
77	1
58	1
78	1
59	1
79	1
98	1
9D	1
5A	1
7A	1
91	1
92	1
E0	1
EB	1
EE	1
E2	1
EA	1
E8	1
ED	1
E3	1
E4	1
E5	1
E7	1
E9	1
5B	1
5C	1
5D	1
5E	1
5F	1
60	1
7B	1
7C	1
7D	1
7E	1
7F	1
AC	1
AD	1
AE	1
AF	1
B0	1
B1	1
B2	1
B3	1
B4	1
B5	1
B6	1
B7	1
B8	1
B9	1
BA	1
BB	1
BC	1
BD	1
BE	1
BF	1
C0	1
C1	1
C2	1
C3	1
C4	1
C5	1
C6	1
C7	1
C8	1
C9	1
CA	1
CB	1
CC	1
CD	1
CE	1
CF	1
D0	1
D1	1
D2	1
D3	1
D4	1
D5	1
D6	1
D7	1
D8	1
D9	1
DA	1
DB	1
DC	1
DD	1
DE	1
DF	1
E6	1
EC	1
EF	1
F0	1
F1	1
F2	1
F3	1
F4	1
F5	1
F6	1
F7	1
F8	1
F9	1
FA	1
FB	1
FC	1
FD	1
DROP TABLE test.t1;
SET NAMES koi8r;
CREATE TABLE test.t1 (a VARCHAR(3) CHARACTER SET koi8r COLLATE koi8r_bin) ENGINE=MyISAM CHARACTER SET koi8r COLLATE koi8r_bin;
SHOW TABLE STATUS LIKE 't1';
Name	Engine	Version	Row_format	Rows	Avg_row_length	Data_length	Max_data_length	Index_length	Data_free	Auto_increment	Create_time	Update_time	Check_time	Collation	Checksum	Create_options	Comment
t1	MyISAM	#	#	#	#	#	#	#	#	#	#	#	#	koi8r_bin	#	#	#
SELECT HEX(ASCII(a)) AS a_ascii, CHAR_LENGTH(a) AS a_len FROM test.t1 ORDER BY a, ORD(a);
a_ascii	a_len
21	1
22	1
23	1
24	1
25	1
26	1
27	1
28	1
29	1
2A	1
2B	1
2C	1
2D	1
2E	1
2F	1
30	1
31	1
32	1
33	1
34	1
35	1
36	1
37	1
38	1
39	1
3A	1
3B	1
3C	1
3D	1
3E	1
3F	1
40	1
41	1
42	1
43	1
44	1
45	1
46	1
47	1
48	1
49	1
4A	1
4B	1
4C	1
4D	1
4E	1
4F	1
50	1
51	1
52	1
53	1
54	1
55	1
56	1
57	1
58	1
59	1
5A	1
5B	1
5C	1
5D	1
5E	1
5F	1
60	1
61	1
62	1
63	1
64	1
65	1
66	1
67	1
68	1
69	1
6A	1
6B	1
6C	1
6D	1
6E	1
6F	1
70	1
71	1
72	1
73	1
74	1
75	1
76	1
77	1
78	1
79	1
7A	1
7B	1
7C	1
7D	1
7E	1
7F	1
80	1
81	1
82	1
83	1
84	1
85	1
86	1
87	1
88	1
89	1
8A	1
8B	1
8C	1
8D	1
8E	1
8F	1
90	1
91	1
92	1
93	1
94	1
95	1
96	1
97	1
98	1
99	1
9A	1
9B	1
9C	1
9D	1
9E	1
9F	1
A0	1
A1	1
A2	1
A3	1
A4	1
A5	1
A6	1
A7	1
A8	1
A9	1
AA	1
AB	1
AC	1
AD	1
AE	1
AF	1
B0	1
B1	1
B2	1
B3	1
B4	1
B5	1
B6	1
B7	1
B8	1
B9	1
BA	1
BB	1
BC	1
BD	1
BE	1
BF	1
C0	1
C1	1
C2	1
C3	1
C4	1
C5	1
C6	1
C7	1
C8	1
C9	1
CA	1
CB	1
CC	1
CD	1
CE	1
CF	1
D0	1
D1	1
D2	1
D3	1
D4	1
D5	1
D6	1
D7	1
D8	1
D9	1
DA	1
DB	1
DC	1
DD	1
DE	1
DF	1
E0	1
E1	1
E2	1
E3	1
E4	1
E5	1
E6	1
E7	1
E8	1
E9	1
EA	1
EB	1
EC	1
ED	1
EE	1
EF	1
F0	1
F1	1
F2	1
F3	1
F4	1
F5	1
F6	1
F7	1
F8	1
F9	1
FA	1
FB	1
FC	1
FD	1
DROP TABLE test.t1;
SET NAMES koi8r;
CREATE TABLE test.t1 (a VARCHAR(3) CHARACTER SET koi8r COLLATE koi8r_general_ci) ENGINE=MyISAM CHARACTER SET koi8r COLLATE koi8r_general_ci;
SHOW TABLE STATUS LIKE 't1';
Name	Engine	Version	Row_format	Rows	Avg_row_length	Data_length	Max_data_length	Index_length	Data_free	Auto_increment	Create_time	Update_time	Check_time	Collation	Checksum	Create_options	Comment
t1	MyISAM	#	#	#	#	#	#	#	#	#	#	#	#	koi8r_general_ci	#	#	#
SELECT HEX(ASCII(a)) AS a_ascii, CHAR_LENGTH(a) AS a_len FROM test.t1 ORDER BY a, ORD(a);
a_ascii	a_len
21	1
22	1
23	1
24	1
25	1
26	1
27	1
28	1
29	1
2A	1
2B	1
2C	1
2D	1
2E	1
2F	1
30	1
31	1
32	1
33	1
34	1
35	1
36	1
37	1
38	1
39	1
3A	1
3B	1
3C	1
3D	1
3E	1
3F	1
40	1
41	1
61	1
42	1
62	1
43	1
63	1
44	1
64	1
45	1
65	1
46	1
66	1
47	1
67	1
48	1
68	1
49	1
69	1
4A	1
6A	1
4B	1
6B	1
4C	1
6C	1
4D	1
6D	1
4E	1
6E	1
4F	1
6F	1
50	1
70	1
51	1
71	1
52	1
72	1
53	1
73	1
54	1
74	1
55	1
75	1
56	1
76	1
57	1
77	1
58	1
78	1
59	1
79	1
5A	1
7A	1
5B	1
5C	1
5D	1
5E	1
5F	1
60	1
7B	1
7C	1
7D	1
7E	1
7F	1
80	1
81	1
82	1
83	1
84	1
85	1
86	1
87	1
88	1
89	1
8A	1
8B	1
8C	1
8D	1
8E	1
8F	1
90	1
91	1
92	1
93	1
94	1
95	1
96	1
97	1
98	1
99	1
9A	1
9B	1
9C	1
9D	1
9E	1
9F	1
A0	1
A1	1
A2	1
A4	1
A5	1
A6	1
A7	1
A8	1
A9	1
AA	1
AB	1
AC	1
AD	1
AE	1
AF	1
B0	1
B1	1
B2	1
B4	1
B5	1
B6	1
B7	1
B8	1
B9	1
BA	1
BB	1
BC	1
BD	1
BE	1
BF	1
C1	1
E1	1
C2	1
E2	1
D7	1
F7	1
C7	1
E7	1
C4	1
E4	1
C5	1
E5	1
A3	1
B3	1
D6	1
F6	1
DA	1
FA	1
C9	1
E9	1
CA	1
EA	1
CB	1
EB	1
CC	1
EC	1
CD	1
ED	1
CE	1
EE	1
CF	1
EF	1
D0	1
F0	1
D2	1
F2	1
D3	1
F3	1
D4	1
F4	1
D5	1
F5	1
C6	1
E6	1
C8	1
E8	1
C3	1
E3	1
DE	1
DB	1
FB	1
DD	1
FD	1
DF	1
D9	1
F9	1
D8	1
F8	1
DC	1
FC	1
C0	1
E0	1
D1	1
F1	1
DROP TABLE test.t1;
SET NAMES koi8u;
CREATE TABLE test.t1 (a VARCHAR(3) CHARACTER SET koi8u COLLATE koi8u_bin) ENGINE=MyISAM CHARACTER SET koi8u COLLATE koi8u_bin;
SHOW TABLE STATUS LIKE 't1';
Name	Engine	Version	Row_format	Rows	Avg_row_length	Data_length	Max_data_length	Index_length	Data_free	Auto_increment	Create_time	Update_time	Check_time	Collation	Checksum	Create_options	Comment
t1	MyISAM	#	#	#	#	#	#	#	#	#	#	#	#	koi8u_bin	#	#	#
SELECT HEX(ASCII(a)) AS a_ascii, CHAR_LENGTH(a) AS a_len FROM test.t1 ORDER BY a, ORD(a);
a_ascii	a_len
21	1
22	1
23	1
24	1
25	1
26	1
27	1
28	1
29	1
2A	1
2B	1
2C	1
2D	1
2E	1
2F	1
30	1
31	1
32	1
33	1
34	1
35	1
36	1
37	1
38	1
39	1
3A	1
3B	1
3C	1
3D	1
3E	1
3F	1
40	1
41	1
42	1
43	1
44	1
45	1
46	1
47	1
48	1
49	1
4A	1
4B	1
4C	1
4D	1
4E	1
4F	1
50	1
51	1
52	1
53	1
54	1
55	1
56	1
57	1
58	1
59	1
5A	1
5B	1
5C	1
5D	1
5E	1
5F	1
60	1
61	1
62	1
63	1
64	1
65	1
66	1
67	1
68	1
69	1
6A	1
6B	1
6C	1
6D	1
6E	1
6F	1
70	1
71	1
72	1
73	1
74	1
75	1
76	1
77	1
78	1
79	1
7A	1
7B	1
7C	1
7D	1
7E	1
7F	1
80	1
81	1
82	1
83	1
84	1
85	1
86	1
87	1
88	1
89	1
8A	1
8B	1
8C	1
8D	1
8E	1
8F	1
90	1
91	1
92	1
93	1
94	1
95	1
96	1
97	1
98	1
99	1
9A	1
9B	1
9C	1
9D	1
9E	1
9F	1
A0	1
A1	1
A2	1
A3	1
A4	1
A5	1
A6	1
A7	1
A8	1
A9	1
AA	1
AB	1
AC	1
AD	1
AE	1
AF	1
B0	1
B1	1
B2	1
B3	1
B4	1
B5	1
B6	1
B7	1
B8	1
B9	1
BA	1
BB	1
BC	1
BD	1
BE	1
BF	1
C0	1
C1	1
C2	1
C3	1
C4	1
C5	1
C6	1
C7	1
C8	1
C9	1
CA	1
CB	1
CC	1
CD	1
CE	1
CF	1
D0	1
D1	1
D2	1
D3	1
D4	1
D5	1
D6	1
D7	1
D8	1
D9	1
DA	1
DB	1
DC	1
DD	1
DE	1
DF	1
E0	1
E1	1
E2	1
E3	1
E4	1
E5	1
E6	1
E7	1
E8	1
E9	1
EA	1
EB	1
EC	1
ED	1
EE	1
EF	1
F0	1
F1	1
F2	1
F3	1
F4	1
F5	1
F6	1
F7	1
F8	1
F9	1
FA	1
FB	1
FC	1
FD	1
DROP TABLE test.t1;
SET NAMES koi8u;
CREATE TABLE test.t1 (a VARCHAR(3) CHARACTER SET koi8u COLLATE koi8u_general_ci) ENGINE=MyISAM CHARACTER SET koi8u COLLATE koi8u_general_ci;
SHOW TABLE STATUS LIKE 't1';
Name	Engine	Version	Row_format	Rows	Avg_row_length	Data_length	Max_data_length	Index_length	Data_free	Auto_increment	Create_time	Update_time	Check_time	Collation	Checksum	Create_options	Comment
t1	MyISAM	#	#	#	#	#	#	#	#	#	#	#	#	koi8u_general_ci	#	#	#
SELECT HEX(ASCII(a)) AS a_ascii, CHAR_LENGTH(a) AS a_len FROM test.t1 ORDER BY a, ORD(a);
a_ascii	a_len
60	1
21	1
22	1
23	1
24	1
25	1
26	1
27	1
28	1
29	1
2A	1
2B	1
2C	1
2D	1
2E	1
2F	1
30	1
31	1
32	1
33	1
34	1
35	1
36	1
37	1
38	1
39	1
3A	1
3B	1
3C	1
3D	1
3E	1
3F	1
40	1
41	1
61	1
42	1
62	1
43	1
63	1
44	1
64	1
45	1
65	1
46	1
66	1
47	1
67	1
48	1
68	1
49	1
69	1
4A	1
6A	1
4B	1
6B	1
4C	1
6C	1
4D	1
6D	1
4E	1
6E	1
4F	1
6F	1
50	1
70	1
51	1
71	1
52	1
72	1
53	1
73	1
54	1
74	1
55	1
75	1
56	1
76	1
57	1
77	1
58	1
78	1
59	1
79	1
5A	1
7A	1
5B	1
5C	1
5D	1
5E	1
5F	1
7B	1
7C	1
7D	1
7E	1
7F	1
C1	1
E1	1
C2	1
E2	1
D7	1
F7	1
C7	1
E7	1
AD	1
BD	1
C4	1
E4	1
C5	1
E5	1
A4	1
B4	1
A3	1
B3	1
D6	1
F6	1
DA	1
FA	1
C9	1
E9	1
A6	1
B6	1
A7	1
B7	1
CA	1
EA	1
CB	1
EB	1
CC	1
EC	1
CD	1
ED	1
CE	1
EE	1
CF	1
EF	1
D0	1
F0	1
D2	1
F2	1
D3	1
F3	1
D4	1
F4	1
D5	1
F5	1
C6	1
E6	1
C8	1
E8	1
C3	1
E3	1
DE	1
DB	1
FB	1
DD	1
FD	1
DF	1
D9	1
F9	1
D8	1
F8	1
DC	1
FC	1
C0	1
E0	1
D1	1
F1	1
80	1
81	1
82	1
83	1
84	1
85	1
86	1
87	1
88	1
89	1
8A	1
8B	1
8C	1
8D	1
8E	1
8F	1
90	1
91	1
92	1
93	1
94	1
95	1
96	1
97	1
98	1
99	1
9A	1
9B	1
9C	1
9D	1
9E	1
9F	1
A0	1
A1	1
A2	1
A5	1
A8	1
A9	1
AA	1
AB	1
AC	1
AE	1
AF	1
B0	1
B1	1
B2	1
B5	1
B8	1
B9	1
BA	1
BB	1
BC	1
BE	1
BF	1
DROP TABLE test.t1;
SET NAMES latin1;
CREATE TABLE test.t1 (a VARCHAR(3) CHARACTER SET latin1 COLLATE latin1_bin) ENGINE=MyISAM CHARACTER SET latin1 COLLATE latin1_bin;
SHOW TABLE STATUS LIKE 't1';
Name	Engine	Version	Row_format	Rows	Avg_row_length	Data_length	Max_data_length	Index_length	Data_free	Auto_increment	Create_time	Update_time	Check_time	Collation	Checksum	Create_options	Comment
t1	MyISAM	#	#	#	#	#	#	#	#	#	#	#	#	latin1_bin	#	#	#
SELECT HEX(ASCII(a)) AS a_ascii, CHAR_LENGTH(a) AS a_len FROM test.t1 ORDER BY a, ORD(a);
a_ascii	a_len
21	1
22	1
23	1
24	1
25	1
26	1
27	1
28	1
29	1
2A	1
2B	1
2C	1
2D	1
2E	1
2F	1
30	1
31	1
32	1
33	1
34	1
35	1
36	1
37	1
38	1
39	1
3A	1
3B	1
3C	1
3D	1
3E	1
3F	1
40	1
41	1
42	1
43	1
44	1
45	1
46	1
47	1
48	1
49	1
4A	1
4B	1
4C	1
4D	1
4E	1
4F	1
50	1
51	1
52	1
53	1
54	1
55	1
56	1
57	1
58	1
59	1
5A	1
5B	1
5C	1
5D	1
5E	1
5F	1
60	1
61	1
62	1
63	1
64	1
65	1
66	1
67	1
68	1
69	1
6A	1
6B	1
6C	1
6D	1
6E	1
6F	1
70	1
71	1
72	1
73	1
74	1
75	1
76	1
77	1
78	1
79	1
7A	1
7B	1
7C	1
7D	1
7E	1
7F	1
80	1
81	1
82	1
83	1
84	1
85	1
86	1
87	1
88	1
89	1
8A	1
8B	1
8C	1
8D	1
8E	1
8F	1
90	1
91	1
92	1
93	1
94	1
95	1
96	1
97	1
98	1
99	1
9A	1
9B	1
9C	1
9D	1
9E	1
9F	1
A0	1
A1	1
A2	1
A3	1
A4	1
A5	1
A6	1
A7	1
A8	1
A9	1
AA	1
AB	1
AC	1
AD	1
AE	1
AF	1
B0	1
B1	1
B2	1
B3	1
B4	1
B5	1
B6	1
B7	1
B8	1
B9	1
BA	1
BB	1
BC	1
BD	1
BE	1
BF	1
C0	1
C1	1
C2	1
C3	1
C4	1
C5	1
C6	1
C7	1
C8	1
C9	1
CA	1
CB	1
CC	1
CD	1
CE	1
CF	1
D0	1
D1	1
D2	1
D3	1
D4	1
D5	1
D6	1
D7	1
D8	1
D9	1
DA	1
DB	1
DC	1
DD	1
DE	1
DF	1
E0	1
E1	1
E2	1
E3	1
E4	1
E5	1
E6	1
E7	1
E8	1
E9	1
EA	1
EB	1
EC	1
ED	1
EE	1
EF	1
F0	1
F1	1
F2	1
F3	1
F4	1
F5	1
F6	1
F7	1
F8	1
F9	1
FA	1
FB	1
FC	1
FD	1
DROP TABLE test.t1;
SET NAMES latin1;
CREATE TABLE test.t1 (a VARCHAR(3) CHARACTER SET latin1 COLLATE latin1_danish_ci) ENGINE=MyISAM CHARACTER SET latin1 COLLATE latin1_danish_ci;
SHOW TABLE STATUS LIKE 't1';
Name	Engine	Version	Row_format	Rows	Avg_row_length	Data_length	Max_data_length	Index_length	Data_free	Auto_increment	Create_time	Update_time	Check_time	Collation	Checksum	Create_options	Comment
t1	MyISAM	#	#	#	#	#	#	#	#	#	#	#	#	latin1_danish_ci	#	#	#
SELECT HEX(ASCII(a)) AS a_ascii, CHAR_LENGTH(a) AS a_len FROM test.t1 ORDER BY a, ORD(a);
a_ascii	a_len
21	1
22	1
23	1
24	1
25	1
26	1
27	1
28	1
29	1
2A	1
2B	1
2C	1
2D	1
2E	1
2F	1
30	1
31	1
32	1
33	1
34	1
35	1
36	1
37	1
38	1
39	1
3A	1
3B	1
3C	1
3D	1
3E	1
3F	1
40	1
41	1
61	1
C0	1
C1	1
C2	1
C3	1
E0	1
E1	1
E2	1
E3	1
42	1
62	1
43	1
63	1
C7	1
E7	1
44	1
64	1
D0	1
F0	1
45	1
65	1
C8	1
C9	1
CA	1
CB	1
E8	1
E9	1
EA	1
EB	1
46	1
66	1
47	1
67	1
48	1
68	1
49	1
69	1
CC	1
CD	1
CE	1
CF	1
EC	1
ED	1
EE	1
EF	1
4A	1
6A	1
4B	1
6B	1
4C	1
6C	1
4D	1
6D	1
4E	1
6E	1
D1	1
F1	1
4F	1
6F	1
D2	1
D3	1
D4	1
D5	1
F2	1
F3	1
F4	1
F5	1
50	1
70	1
51	1
71	1
52	1
72	1
53	1
73	1
54	1
74	1
55	1
75	1
D9	1
DA	1
DB	1
F9	1
FA	1
FB	1
56	1
76	1
57	1
77	1
58	1
78	1
59	1
79	1
DC	1
DD	1
FC	1
FD	1
5A	1
7A	1
5B	1
C4	1
C6	1
E4	1
E6	1
5C	1
D6	1
D8	1
F6	1
F8	1
5D	1
C5	1
E5	1
5E	1
5F	1
60	1
7B	1
7C	1
7D	1
7E	1
7F	1
80	1
81	1
82	1
83	1
84	1
85	1
86	1
87	1
88	1
89	1
8A	1
8B	1
8C	1
8D	1
8E	1
8F	1
90	1
91	1
92	1
93	1
94	1
95	1
96	1
97	1
98	1
99	1
9A	1
9B	1
9C	1
9D	1
9E	1
9F	1
A0	1
A1	1
A2	1
A3	1
A4	1
A5	1
A6	1
A7	1
A8	1
A9	1
AA	1
AB	1
AC	1
AD	1
AE	1
AF	1
B0	1
B1	1
B2	1
B3	1
B4	1
B5	1
B6	1
B7	1
B8	1
B9	1
BA	1
BB	1
BC	1
BD	1
BE	1
BF	1
D7	1
DE	1
DF	1
F7	1
DROP TABLE test.t1;
SET NAMES latin1;
CREATE TABLE test.t1 (a VARCHAR(3) CHARACTER SET latin1 COLLATE latin1_general_ci) ENGINE=MyISAM CHARACTER SET latin1 COLLATE latin1_general_ci;
SHOW TABLE STATUS LIKE 't1';
Name	Engine	Version	Row_format	Rows	Avg_row_length	Data_length	Max_data_length	Index_length	Data_free	Auto_increment	Create_time	Update_time	Check_time	Collation	Checksum	Create_options	Comment
t1	MyISAM	#	#	#	#	#	#	#	#	#	#	#	#	latin1_general_ci	#	#	#
SELECT HEX(ASCII(a)) AS a_ascii, CHAR_LENGTH(a) AS a_len FROM test.t1 ORDER BY a, ORD(a);
a_ascii	a_len
21	1
22	1
23	1
24	1
25	1
26	1
27	1
28	1
29	1
2A	1
2B	1
2C	1
2D	1
2E	1
2F	1
30	1
31	1
32	1
33	1
34	1
35	1
36	1
37	1
38	1
39	1
3A	1
3B	1
3C	1
3D	1
3E	1
3F	1
40	1
41	1
61	1
C0	1
E0	1
C1	1
E1	1
C2	1
E2	1
C3	1
E3	1
C4	1
E4	1
C5	1
E5	1
C6	1
E6	1
42	1
62	1
43	1
63	1
C7	1
E7	1
44	1
64	1
D0	1
F0	1
45	1
65	1
C8	1
E8	1
C9	1
E9	1
CA	1
EA	1
CB	1
EB	1
46	1
66	1
47	1
67	1
48	1
68	1
49	1
69	1
CC	1
EC	1
CD	1
ED	1
CE	1
EE	1
CF	1
EF	1
4A	1
6A	1
4B	1
6B	1
4C	1
6C	1
4D	1
6D	1
4E	1
6E	1
D1	1
F1	1
4F	1
6F	1
D2	1
F2	1
D3	1
F3	1
D4	1
F4	1
D5	1
F5	1
D6	1
F6	1
D8	1
F8	1
50	1
70	1
51	1
71	1
52	1
72	1
53	1
73	1
DF	1
54	1
74	1
55	1
75	1
D9	1
F9	1
DA	1
FA	1
DB	1
FB	1
DC	1
FC	1
56	1
76	1
57	1
77	1
58	1
78	1
59	1
79	1
DD	1
FD	1
5A	1
7A	1
DE	1
5B	1
5C	1
5D	1
5E	1
5F	1
60	1
7B	1
7C	1
7D	1
7E	1
D7	1
F7	1
7F	1
80	1
81	1
82	1
83	1
84	1
85	1
86	1
87	1
88	1
89	1
8A	1
8B	1
8C	1
8D	1
8E	1
8F	1
90	1
91	1
92	1
93	1
94	1
95	1
96	1
97	1
98	1
99	1
9A	1
9B	1
9C	1
9D	1
9E	1
9F	1
A0	1
A1	1
A2	1
A3	1
A4	1
A5	1
A6	1
A7	1
A8	1
A9	1
AA	1
AB	1
AC	1
AD	1
AE	1
AF	1
B0	1
B1	1
B2	1
B3	1
B4	1
B5	1
B6	1
B7	1
B8	1
B9	1
BA	1
BB	1
BC	1
BD	1
BE	1
BF	1
DROP TABLE test.t1;
SET NAMES latin1;
CREATE TABLE test.t1 (a VARCHAR(3) CHARACTER SET latin1 COLLATE latin1_general_cs) ENGINE=MyISAM CHARACTER SET latin1 COLLATE latin1_general_cs;
SHOW TABLE STATUS LIKE 't1';
Name	Engine	Version	Row_format	Rows	Avg_row_length	Data_length	Max_data_length	Index_length	Data_free	Auto_increment	Create_time	Update_time	Check_time	Collation	Checksum	Create_options	Comment
t1	MyISAM	#	#	#	#	#	#	#	#	#	#	#	#	latin1_general_cs	#	#	#
SELECT HEX(ASCII(a)) AS a_ascii, CHAR_LENGTH(a) AS a_len FROM test.t1 ORDER BY a, ORD(a);
a_ascii	a_len
21	1
22	1
23	1
24	1
25	1
26	1
27	1
28	1
29	1
2A	1
2B	1
2C	1
2D	1
2E	1
2F	1
30	1
31	1
32	1
33	1
34	1
35	1
36	1
37	1
38	1
39	1
3A	1
3B	1
3C	1
3D	1
3E	1
3F	1
40	1
41	1
61	1
C0	1
E0	1
C1	1
E1	1
C2	1
E2	1
C3	1
E3	1
C4	1
E4	1
C5	1
E5	1
C6	1
E6	1
42	1
62	1
43	1
63	1
C7	1
E7	1
44	1
64	1
D0	1
F0	1
45	1
65	1
C8	1
E8	1
C9	1
E9	1
CA	1
EA	1
CB	1
EB	1
46	1
66	1
47	1
67	1
48	1
68	1
49	1
69	1
CC	1
EC	1
CD	1
ED	1
CE	1
EE	1
CF	1
EF	1
4A	1
6A	1
4B	1
6B	1
4C	1
6C	1
4D	1
6D	1
4E	1
6E	1
D1	1
F1	1
4F	1
6F	1
D2	1
F2	1
D3	1
F3	1
D4	1
F4	1
D5	1
F5	1
D6	1
F6	1
D8	1
F8	1
50	1
70	1
51	1
71	1
52	1
72	1
53	1
73	1
DF	1
54	1
74	1
55	1
75	1
D9	1
F9	1
DA	1
FA	1
DB	1
FB	1
DC	1
FC	1
56	1
76	1
57	1
77	1
58	1
78	1
59	1
79	1
DD	1
FD	1
5A	1
7A	1
DE	1
5B	1
5C	1
5D	1
5E	1
5F	1
60	1
7B	1
7C	1
7D	1
7E	1
D7	1
F7	1
7F	1
80	1
81	1
82	1
83	1
84	1
85	1
86	1
87	1
88	1
89	1
8A	1
8B	1
8C	1
8D	1
8E	1
8F	1
90	1
91	1
92	1
93	1
94	1
95	1
96	1
97	1
98	1
99	1
9A	1
9B	1
9C	1
9D	1
9E	1
9F	1
A0	1
A1	1
A2	1
A3	1
A4	1
A5	1
A6	1
A7	1
A8	1
A9	1
AA	1
AB	1
AC	1
AD	1
AE	1
AF	1
B0	1
B1	1
B2	1
B3	1
B4	1
B5	1
B6	1
B7	1
B8	1
B9	1
BA	1
BB	1
BC	1
BD	1
BE	1
BF	1
DROP TABLE test.t1;
SET NAMES latin1;
CREATE TABLE test.t1 (a VARCHAR(3) CHARACTER SET latin1 COLLATE latin1_german1_ci) ENGINE=MyISAM CHARACTER SET latin1 COLLATE latin1_german1_ci;
SHOW TABLE STATUS LIKE 't1';
Name	Engine	Version	Row_format	Rows	Avg_row_length	Data_length	Max_data_length	Index_length	Data_free	Auto_increment	Create_time	Update_time	Check_time	Collation	Checksum	Create_options	Comment
t1	MyISAM	#	#	#	#	#	#	#	#	#	#	#	#	latin1_german1_ci	#	#	#
SELECT HEX(ASCII(a)) AS a_ascii, CHAR_LENGTH(a) AS a_len FROM test.t1 ORDER BY a, ORD(a);
a_ascii	a_len
21	1
22	1
23	1
24	1
25	1
26	1
27	1
28	1
29	1
2A	1
2B	1
2C	1
2D	1
2E	1
2F	1
30	1
31	1
32	1
33	1
34	1
35	1
36	1
37	1
38	1
39	1
3A	1
3B	1
3C	1
3D	1
3E	1
3F	1
40	1
41	1
61	1
C0	1
C1	1
C2	1
C3	1
C4	1
C5	1
C6	1
E0	1
E1	1
E2	1
E3	1
E4	1
E5	1
E6	1
42	1
62	1
43	1
63	1
C7	1
E7	1
44	1
64	1
45	1
65	1
C8	1
C9	1
CA	1
CB	1
E8	1
E9	1
EA	1
EB	1
46	1
66	1
47	1
67	1
48	1
68	1
49	1
69	1
CC	1
CD	1
CE	1
CF	1
EC	1
ED	1
EE	1
EF	1
4A	1
6A	1
4B	1
6B	1
4C	1
6C	1
4D	1
6D	1
4E	1
6E	1
D1	1
F1	1
4F	1
6F	1
D2	1
D3	1
D4	1
D5	1
D6	1
D8	1
F2	1
F3	1
F4	1
F5	1
F6	1
F8	1
50	1
70	1
51	1
71	1
52	1
72	1
53	1
73	1
DF	1
54	1
74	1
55	1
75	1
D9	1
DA	1
DB	1
DC	1
F9	1
FA	1
FB	1
FC	1
56	1
76	1
57	1
77	1
58	1
78	1
59	1
79	1
DD	1
FD	1
5A	1
7A	1
5B	1
5C	1
5D	1
5E	1
5F	1
60	1
7B	1
7C	1
7D	1
7E	1
7F	1
80	1
81	1
82	1
83	1
84	1
85	1
86	1
87	1
88	1
89	1
8A	1
8B	1
8C	1
8D	1
8E	1
8F	1
90	1
91	1
92	1
93	1
94	1
95	1
96	1
97	1
98	1
99	1
9A	1
9B	1
9C	1
9D	1
9E	1
9F	1
A0	1
A1	1
A2	1
A3	1
A4	1
A5	1
A6	1
A7	1
A8	1
A9	1
AA	1
AB	1
AC	1
AD	1
AE	1
AF	1
B0	1
B1	1
B2	1
B3	1
B4	1
B5	1
B6	1
B7	1
B8	1
B9	1
BA	1
BB	1
BC	1
BD	1
BE	1
BF	1
D0	1
F0	1
D7	1
DE	1
F7	1
DROP TABLE test.t1;
SET NAMES latin1;
CREATE TABLE test.t1 (a VARCHAR(3) CHARACTER SET latin1 COLLATE latin1_german2_ci) ENGINE=MyISAM CHARACTER SET latin1 COLLATE latin1_german2_ci;
SHOW TABLE STATUS LIKE 't1';
Name	Engine	Version	Row_format	Rows	Avg_row_length	Data_length	Max_data_length	Index_length	Data_free	Auto_increment	Create_time	Update_time	Check_time	Collation	Checksum	Create_options	Comment
t1	MyISAM	#	#	#	#	#	#	#	#	#	#	#	#	latin1_german2_ci	#	#	#
SELECT HEX(ASCII(a)) AS a_ascii, CHAR_LENGTH(a) AS a_len FROM test.t1 ORDER BY a, ORD(a);
a_ascii	a_len
21	1
22	1
23	1
24	1
25	1
26	1
27	1
28	1
29	1
2A	1
2B	1
2C	1
2D	1
2E	1
2F	1
30	1
31	1
32	1
33	1
34	1
35	1
36	1
37	1
38	1
39	1
3A	1
3B	1
3C	1
3D	1
3E	1
3F	1
40	1
41	1
61	1
C0	1
C1	1
C2	1
C3	1
C5	1
E0	1
E1	1
E2	1
E3	1
E5	1
C4	1
E4	1
42	1
62	1
43	1
63	1
C7	1
E7	1
44	1
64	1
D0	1
F0	1
45	1
65	1
C8	1
C9	1
CA	1
CB	1
E8	1
E9	1
EA	1
EB	1
46	1
66	1
47	1
67	1
48	1
68	1
49	1
69	1
CC	1
CD	1
CE	1
CF	1
EC	1
ED	1
EE	1
EF	1
4A	1
6A	1
4B	1
6B	1
4C	1
6C	1
4D	1
6D	1
4E	1
6E	1
D1	1
F1	1
4F	1
6F	1
D2	1
D3	1
D4	1
D5	1
F2	1
F3	1
F4	1
F5	1
D6	1
F6	1
50	1
70	1
51	1
71	1
52	1
72	1
53	1
73	1
DF	1
54	1
74	1
55	1
75	1
D9	1
DA	1
DB	1
F9	1
FA	1
FB	1
DC	1
FC	1
56	1
76	1
57	1
77	1
58	1
78	1
59	1
79	1
DD	1
FD	1
5A	1
7A	1
5B	1
5C	1
C6	1
E6	1
5D	1
5E	1
5F	1
60	1
7B	1
7C	1
7D	1
7E	1
7F	1
80	1
81	1
82	1
83	1
84	1
85	1
86	1
87	1
88	1
89	1
8A	1
8B	1
8C	1
8D	1
8E	1
8F	1
90	1
91	1
92	1
93	1
94	1
95	1
96	1
97	1
98	1
99	1
9A	1
9B	1
9C	1
9D	1
9E	1
9F	1
A0	1
A1	1
A2	1
A3	1
A4	1
A5	1
A6	1
A7	1
A8	1
A9	1
AA	1
AB	1
AC	1
AD	1
AE	1
AF	1
B0	1
B1	1
B2	1
B3	1
B4	1
B5	1
B6	1
B7	1
B8	1
B9	1
BA	1
BB	1
BC	1
BD	1
BE	1
BF	1
D7	1
D8	1
F8	1
DE	1
F7	1
DROP TABLE test.t1;
SET NAMES latin1;
CREATE TABLE test.t1 (a VARCHAR(3) CHARACTER SET latin1 COLLATE latin1_spanish_ci) ENGINE=MyISAM CHARACTER SET latin1 COLLATE latin1_spanish_ci;
SHOW TABLE STATUS LIKE 't1';
Name	Engine	Version	Row_format	Rows	Avg_row_length	Data_length	Max_data_length	Index_length	Data_free	Auto_increment	Create_time	Update_time	Check_time	Collation	Checksum	Create_options	Comment
t1	MyISAM	#	#	#	#	#	#	#	#	#	#	#	#	latin1_spanish_ci	#	#	#
SELECT HEX(ASCII(a)) AS a_ascii, CHAR_LENGTH(a) AS a_len FROM test.t1 ORDER BY a, ORD(a);
a_ascii	a_len
21	1
22	1
23	1
24	1
25	1
26	1
27	1
28	1
29	1
2A	1
2B	1
2C	1
2D	1
2E	1
2F	1
30	1
31	1
32	1
33	1
34	1
35	1
36	1
37	1
38	1
39	1
3A	1
3B	1
3C	1
3D	1
3E	1
3F	1
40	1
41	1
61	1
C0	1
C1	1
C2	1
C3	1
C4	1
C5	1
C6	1
E0	1
E1	1
E2	1
E3	1
E4	1
E5	1
E6	1
42	1
62	1
43	1
63	1
C7	1
E7	1
44	1
64	1
D0	1
F0	1
45	1
65	1
C8	1
C9	1
CA	1
CB	1
E8	1
E9	1
EA	1
EB	1
46	1
66	1
47	1
67	1
48	1
68	1
49	1
69	1
CC	1
CD	1
CE	1
CF	1
EC	1
ED	1
EE	1
EF	1
4A	1
6A	1
4B	1
6B	1
4C	1
6C	1
4D	1
6D	1
4E	1
6E	1
D1	1
F1	1
4F	1
6F	1
D2	1
D3	1
D4	1
D5	1
D6	1
D8	1
F2	1
F3	1
F4	1
F5	1
F6	1
F8	1
50	1
70	1
51	1
71	1
52	1
72	1
53	1
73	1
DF	1
54	1
74	1
55	1
75	1
D9	1
DA	1
DB	1
DC	1
F9	1
FA	1
FB	1
FC	1
56	1
76	1
57	1
77	1
58	1
78	1
59	1
79	1
DD	1
FD	1
5A	1
7A	1
DE	1
5B	1
5C	1
5D	1
5E	1
5F	1
60	1
7B	1
7C	1
7D	1
7E	1
D7	1
F7	1
7F	1
80	1
81	1
82	1
83	1
84	1
85	1
86	1
87	1
88	1
89	1
8A	1
8B	1
8C	1
8D	1
8E	1
8F	1
90	1
91	1
92	1
93	1
94	1
95	1
96	1
97	1
98	1
99	1
9A	1
9B	1
9C	1
9D	1
9E	1
9F	1
A0	1
A1	1
A2	1
A3	1
A4	1
A5	1
A6	1
A7	1
A8	1
A9	1
AA	1
AB	1
AC	1
AD	1
AE	1
AF	1
B0	1
B1	1
B2	1
B3	1
B4	1
B5	1
B6	1
B7	1
B8	1
B9	1
BA	1
BB	1
BC	1
BD	1
BE	1
BF	1
DROP TABLE test.t1;
SET NAMES latin1;
CREATE TABLE test.t1 (a VARCHAR(3) CHARACTER SET latin1 COLLATE latin1_swedish_ci) ENGINE=MyISAM CHARACTER SET latin1 COLLATE latin1_swedish_ci;
SHOW TABLE STATUS LIKE 't1';
Name	Engine	Version	Row_format	Rows	Avg_row_length	Data_length	Max_data_length	Index_length	Data_free	Auto_increment	Create_time	Update_time	Check_time	Collation	Checksum	Create_options	Comment
t1	MyISAM	#	#	#	#	#	#	#	#	#	#	#	#	latin1_swedish_ci	#	#	#
SELECT HEX(ASCII(a)) AS a_ascii, CHAR_LENGTH(a) AS a_len FROM test.t1 ORDER BY a, ORD(a);
a_ascii	a_len
21	1
22	1
23	1
24	1
25	1
26	1
27	1
28	1
29	1
2A	1
2B	1
2C	1
2D	1
2E	1
2F	1
30	1
31	1
32	1
33	1
34	1
35	1
36	1
37	1
38	1
39	1
3A	1
3B	1
3C	1
3D	1
3E	1
3F	1
40	1
41	1
61	1
C0	1
C1	1
C2	1
C3	1
E0	1
E1	1
E2	1
E3	1
42	1
62	1
43	1
63	1
C7	1
E7	1
44	1
64	1
D0	1
F0	1
45	1
65	1
C8	1
C9	1
CA	1
CB	1
E8	1
E9	1
EA	1
EB	1
46	1
66	1
47	1
67	1
48	1
68	1
49	1
69	1
CC	1
CD	1
CE	1
CF	1
EC	1
ED	1
EE	1
EF	1
4A	1
6A	1
4B	1
6B	1
4C	1
6C	1
4D	1
6D	1
4E	1
6E	1
D1	1
F1	1
4F	1
6F	1
D2	1
D3	1
D4	1
D5	1
F2	1
F3	1
F4	1
F5	1
50	1
70	1
51	1
71	1
52	1
72	1
53	1
73	1
54	1
74	1
55	1
75	1
D9	1
DA	1
DB	1
F9	1
FA	1
FB	1
56	1
76	1
57	1
77	1
58	1
78	1
59	1
79	1
DC	1
DD	1
FC	1
FD	1
5A	1
7A	1
5B	1
C5	1
E5	1
5C	1
C4	1
C6	1
E4	1
E6	1
5D	1
D6	1
F6	1
5E	1
5F	1
60	1
7B	1
7C	1
7D	1
7E	1
7F	1
80	1
81	1
82	1
83	1
84	1
85	1
86	1
87	1
88	1
89	1
8A	1
8B	1
8C	1
8D	1
8E	1
8F	1
90	1
91	1
92	1
93	1
94	1
95	1
96	1
97	1
98	1
99	1
9A	1
9B	1
9C	1
9D	1
9E	1
9F	1
A0	1
A1	1
A2	1
A3	1
A4	1
A5	1
A6	1
A7	1
A8	1
A9	1
AA	1
AB	1
AC	1
AD	1
AE	1
AF	1
B0	1
B1	1
B2	1
B3	1
B4	1
B5	1
B6	1
B7	1
B8	1
B9	1
BA	1
BB	1
BC	1
BD	1
BE	1
BF	1
D7	1
D8	1
F8	1
DE	1
DF	1
F7	1
DROP TABLE test.t1;
SET NAMES latin2;
CREATE TABLE test.t1 (a VARCHAR(3) CHARACTER SET latin2 COLLATE latin2_bin) ENGINE=MyISAM CHARACTER SET latin2 COLLATE latin2_bin;
SHOW TABLE STATUS LIKE 't1';
Name	Engine	Version	Row_format	Rows	Avg_row_length	Data_length	Max_data_length	Index_length	Data_free	Auto_increment	Create_time	Update_time	Check_time	Collation	Checksum	Create_options	Comment
t1	MyISAM	#	#	#	#	#	#	#	#	#	#	#	#	latin2_bin	#	#	#
SELECT HEX(ASCII(a)) AS a_ascii, CHAR_LENGTH(a) AS a_len FROM test.t1 ORDER BY a, ORD(a);
a_ascii	a_len
21	1
22	1
23	1
24	1
25	1
26	1
27	1
28	1
29	1
2A	1
2B	1
2C	1
2D	1
2E	1
2F	1
30	1
31	1
32	1
33	1
34	1
35	1
36	1
37	1
38	1
39	1
3A	1
3B	1
3C	1
3D	1
3E	1
3F	1
40	1
41	1
42	1
43	1
44	1
45	1
46	1
47	1
48	1
49	1
4A	1
4B	1
4C	1
4D	1
4E	1
4F	1
50	1
51	1
52	1
53	1
54	1
55	1
56	1
57	1
58	1
59	1
5A	1
5B	1
5C	1
5D	1
5E	1
5F	1
60	1
61	1
62	1
63	1
64	1
65	1
66	1
67	1
68	1
69	1
6A	1
6B	1
6C	1
6D	1
6E	1
6F	1
70	1
71	1
72	1
73	1
74	1
75	1
76	1
77	1
78	1
79	1
7A	1
7B	1
7C	1
7D	1
7E	1
7F	1
80	1
81	1
82	1
83	1
84	1
85	1
86	1
87	1
88	1
89	1
8A	1
8B	1
8C	1
8D	1
8E	1
8F	1
90	1
91	1
92	1
93	1
94	1
95	1
96	1
97	1
98	1
99	1
9A	1
9B	1
9C	1
9D	1
9E	1
9F	1
A0	1
A1	1
A2	1
A3	1
A4	1
A5	1
A6	1
A7	1
A8	1
A9	1
AA	1
AB	1
AC	1
AD	1
AE	1
AF	1
B0	1
B1	1
B2	1
B3	1
B4	1
B5	1
B6	1
B7	1
B8	1
B9	1
BA	1
BB	1
BC	1
BD	1
BE	1
BF	1
C0	1
C1	1
C2	1
C3	1
C4	1
C5	1
C6	1
C7	1
C8	1
C9	1
CA	1
CB	1
CC	1
CD	1
CE	1
CF	1
D0	1
D1	1
D2	1
D3	1
D4	1
D5	1
D6	1
D7	1
D8	1
D9	1
DA	1
DB	1
DC	1
DD	1
DE	1
DF	1
E0	1
E1	1
E2	1
E3	1
E4	1
E5	1
E6	1
E7	1
E8	1
E9	1
EA	1
EB	1
EC	1
ED	1
EE	1
EF	1
F0	1
F1	1
F2	1
F3	1
F4	1
F5	1
F6	1
F7	1
F8	1
F9	1
FA	1
FB	1
FC	1
FD	1
DROP TABLE test.t1;
SET NAMES latin2;
CREATE TABLE test.t1 (a VARCHAR(3) CHARACTER SET latin2 COLLATE latin2_croatian_ci) ENGINE=MyISAM CHARACTER SET latin2 COLLATE latin2_croatian_ci;
SHOW TABLE STATUS LIKE 't1';
Name	Engine	Version	Row_format	Rows	Avg_row_length	Data_length	Max_data_length	Index_length	Data_free	Auto_increment	Create_time	Update_time	Check_time	Collation	Checksum	Create_options	Comment
t1	MyISAM	#	#	#	#	#	#	#	#	#	#	#	#	latin2_croatian_ci	#	#	#
SELECT HEX(ASCII(a)) AS a_ascii, CHAR_LENGTH(a) AS a_len FROM test.t1 ORDER BY a, ORD(a);
a_ascii	a_len
21	1
22	1
23	1
24	1
25	1
26	1
27	1
28	1
29	1
2A	1
2B	1
2C	1
2D	1
2E	1
2F	1
30	1
31	1
32	1
33	1
34	1
35	1
36	1
37	1
38	1
39	1
3A	1
3B	1
3C	1
3D	1
3E	1
3F	1
40	1
41	1
61	1
A1	1
B1	1
C1	1
C2	1
C3	1
C4	1
E1	1
E2	1
E3	1
E4	1
42	1
62	1
43	1
63	1
C7	1
E7	1
C8	1
E8	1
C6	1
E6	1
44	1
64	1
CF	1
EF	1
D0	1
F0	1
45	1
65	1
C9	1
CA	1
CB	1
CC	1
E9	1
EA	1
EB	1
EC	1
46	1
66	1
47	1
67	1
48	1
68	1
49	1
69	1
CD	1
CE	1
ED	1
EE	1
4A	1
6A	1
4B	1
6B	1
4C	1
6C	1
A3	1
A5	1
B3	1
B5	1
C5	1
E5	1
4D	1
6D	1
4E	1
6E	1
D1	1
D2	1
F1	1
F2	1
4F	1
6F	1
D3	1
D4	1
D5	1
D6	1
F3	1
F4	1
F5	1
F6	1
50	1
70	1
51	1
71	1
52	1
72	1
C0	1
D8	1
E0	1
F8	1
53	1
73	1
A6	1
AA	1
B6	1
BA	1
DF	1
A9	1
B9	1
54	1
74	1
AB	1
BB	1
DE	1
55	1
75	1
D9	1
DA	1
DB	1
DC	1
F9	1
FA	1
FB	1
FC	1
56	1
76	1
57	1
77	1
58	1
78	1
59	1
79	1
DD	1
FD	1
5A	1
7A	1
AC	1
AF	1
BC	1
BF	1
AE	1
BE	1
5B	1
5C	1
5D	1
5E	1
5F	1
60	1
7B	1
7C	1
7D	1
7E	1
7F	1
80	1
81	1
82	1
83	1
84	1
85	1
86	1
87	1
88	1
89	1
8A	1
8B	1
8C	1
8D	1
8E	1
8F	1
90	1
91	1
92	1
93	1
94	1
95	1
96	1
97	1
98	1
99	1
9A	1
9B	1
9C	1
9D	1
9E	1
9F	1
A0	1
A2	1
A4	1
A7	1
A8	1
AD	1
B0	1
B2	1
B4	1
B7	1
B8	1
BD	1
D7	1
F7	1
DROP TABLE test.t1;
SET NAMES latin2;
CREATE TABLE test.t1 (a VARCHAR(3) CHARACTER SET latin2 COLLATE latin2_czech_cs) ENGINE=MyISAM CHARACTER SET latin2 COLLATE latin2_czech_cs;
SHOW TABLE STATUS LIKE 't1';
Name	Engine	Version	Row_format	Rows	Avg_row_length	Data_length	Max_data_length	Index_length	Data_free	Auto_increment	Create_time	Update_time	Check_time	Collation	Checksum	Create_options	Comment
t1	MyISAM	#	#	#	#	#	#	#	#	#	#	#	#	latin2_czech_cs	#	#	#
SELECT HEX(ASCII(a)) AS a_ascii, CHAR_LENGTH(a) AS a_len FROM test.t1 ORDER BY a, ORD(a);
a_ascii	a_len
2E	1
2C	1
3B	1
3F	1
21	1
3A	1
22	1
60	1
27	1
2F	1
7C	1
5C	1
28	1
29	1
5B	1
5D	1
3C	1
3E	1
7B	1
7D	1
40	1
26	1
25	1
23	1
5E	1
5F	1
7E	1
3D	1
2B	1
2A	1
2D	1
D7	1
80	1
81	1
82	1
83	1
84	1
85	1
86	1
87	1
88	1
89	1
8A	1
8B	1
8C	1
8D	1
8E	1
8F	1
90	1
91	1
92	1
93	1
94	1
95	1
96	1
97	1
98	1
99	1
9A	1
9B	1
9C	1
9D	1
9E	1
9F	1
24	1
7F	1
A0	1
A2	1
A4	1
A7	1
A8	1
AD	1
B0	1
B2	1
B4	1
B7	1
B8	1
BD	1
DF	1
F7	1
61	1
41	1
E1	1
C1	1
E2	1
C2	1
E4	1
C4	1
E3	1
C3	1
B1	1
A1	1
62	1
42	1
63	1
43	1
E8	1
C8	1
E6	1
C6	1
E7	1
C7	1
64	1
44	1
EF	1
CF	1
F0	1
D0	1
65	1
45	1
E9	1
C9	1
EC	1
CC	1
EB	1
CB	1
EA	1
CA	1
66	1
46	1
67	1
47	1
68	1
48	1
69	1
49	1
ED	1
CD	1
EE	1
CE	1
6A	1
4A	1
6B	1
4B	1
6C	1
4C	1
E5	1
C5	1
B5	1
A5	1
B3	1
A3	1
6D	1
4D	1
6E	1
4E	1
F2	1
D2	1
F1	1
D1	1
6F	1
4F	1
F3	1
D3	1
F4	1
D4	1
F6	1
D6	1
F5	1
D5	1
70	1
50	1
71	1
51	1
72	1
52	1
E0	1
C0	1
F8	1
D8	1
73	1
53	1
B9	1
A9	1
B6	1
A6	1
BA	1
AA	1
74	1
54	1
BB	1
AB	1
DE	1
75	1
55	1
FA	1
DA	1
F9	1
D9	1
FC	1
DC	1
FB	1
DB	1
76	1
56	1
77	1
57	1
78	1
58	1
79	1
59	1
FD	1
DD	1
7A	1
5A	1
BE	1
AE	1
BC	1
AC	1
BF	1
AF	1
30	1
31	1
32	1
33	1
34	1
35	1
36	1
37	1
38	1
39	1
DROP TABLE test.t1;
SET NAMES latin2;
CREATE TABLE test.t1 (a VARCHAR(3) CHARACTER SET latin2 COLLATE latin2_general_ci) ENGINE=MyISAM CHARACTER SET latin2 COLLATE latin2_general_ci;
SHOW TABLE STATUS LIKE 't1';
Name	Engine	Version	Row_format	Rows	Avg_row_length	Data_length	Max_data_length	Index_length	Data_free	Auto_increment	Create_time	Update_time	Check_time	Collation	Checksum	Create_options	Comment
t1	MyISAM	#	#	#	#	#	#	#	#	#	#	#	#	latin2_general_ci	#	#	#
SELECT HEX(ASCII(a)) AS a_ascii, CHAR_LENGTH(a) AS a_len FROM test.t1 ORDER BY a, ORD(a);
a_ascii	a_len
21	1
22	1
23	1
24	1
25	1
26	1
27	1
28	1
29	1
2A	1
2B	1
2C	1
2D	1
2E	1
2F	1
30	1
31	1
32	1
33	1
34	1
35	1
36	1
37	1
38	1
39	1
3A	1
3B	1
3C	1
3D	1
3E	1
3F	1
40	1
41	1
61	1
A1	1
B1	1
C1	1
C2	1
C3	1
C4	1
E1	1
E2	1
E3	1
E4	1
42	1
62	1
43	1
63	1
C7	1
E7	1
C6	1
E6	1
C8	1
E8	1
44	1
64	1
CF	1
EF	1
45	1
65	1
C9	1
CB	1
CC	1
E9	1
EB	1
EC	1
CA	1
EA	1
46	1
66	1
47	1
67	1
48	1
68	1
49	1
69	1
CD	1
CE	1
ED	1
EE	1
4A	1
6A	1
4B	1
6B	1
4C	1
6C	1
A5	1
B5	1
C5	1
E5	1
A3	1
B3	1
4D	1
6D	1
4E	1
6E	1
D2	1
F2	1
D1	1
F1	1
4F	1
6F	1
D4	1
D5	1
D6	1
F4	1
F5	1
F6	1
D3	1
F3	1
50	1
70	1
51	1
71	1
52	1
72	1
C0	1
D8	1
E0	1
F8	1
53	1
73	1
AA	1
BA	1
A6	1
B6	1
A9	1
B9	1
54	1
74	1
AB	1
BB	1
DE	1
55	1
75	1
D9	1
DA	1
DB	1
DC	1
F9	1
FA	1
FB	1
FC	1
56	1
76	1
57	1
77	1
58	1
78	1
59	1
79	1
DD	1
FD	1
5A	1
7A	1
AC	1
BC	1
AF	1
BF	1
AE	1
BE	1
5B	1
5C	1
5D	1
5E	1
5F	1
60	1
7B	1
7C	1
7D	1
7E	1
7F	1
80	1
81	1
82	1
83	1
84	1
85	1
86	1
87	1
88	1
89	1
8A	1
8B	1
8C	1
8D	1
8E	1
8F	1
90	1
91	1
92	1
93	1
94	1
95	1
96	1
97	1
98	1
99	1
9A	1
9B	1
9C	1
9D	1
9E	1
9F	1
A0	1
A2	1
A4	1
A7	1
A8	1
AD	1
B0	1
B2	1
B4	1
B7	1
B8	1
BD	1
D0	1
D7	1
DF	1
F0	1
F7	1
DROP TABLE test.t1;
SET NAMES latin2;
CREATE TABLE test.t1 (a VARCHAR(3) CHARACTER SET latin2 COLLATE latin2_hungarian_ci) ENGINE=MyISAM CHARACTER SET latin2 COLLATE latin2_hungarian_ci;
SHOW TABLE STATUS LIKE 't1';
Name	Engine	Version	Row_format	Rows	Avg_row_length	Data_length	Max_data_length	Index_length	Data_free	Auto_increment	Create_time	Update_time	Check_time	Collation	Checksum	Create_options	Comment
t1	MyISAM	#	#	#	#	#	#	#	#	#	#	#	#	latin2_hungarian_ci	#	#	#
SELECT HEX(ASCII(a)) AS a_ascii, CHAR_LENGTH(a) AS a_len FROM test.t1 ORDER BY a, ORD(a);
a_ascii	a_len
7F	1
80	1
83	1
84	1
85	1
86	1
87	1
88	1
89	1
8E	1
91	1
92	1
9B	1
9C	1
9D	1
9E	1
21	1
22	1
23	1
24	1
25	1
26	1
27	1
28	1
29	1
2A	1
2B	1
2C	1
2D	1
2E	1
2F	1
30	1
31	1
32	1
33	1
34	1
35	1
36	1
37	1
38	1
39	1
3A	1
3B	1
3C	1
3D	1
3E	1
3F	1
40	1
41	1
61	1
8F	1
A0	1
B5	1
C1	1
E1	1
B1	1
C2	1
E2	1
C3	1
E3	1
C4	1
E4	1
42	1
62	1
43	1
63	1
C6	1
E6	1
C8	1
E8	1
C7	1
E7	1
44	1
64	1
CF	1
EF	1
45	1
65	1
82	1
90	1
C9	1
E9	1
CC	1
EC	1
CA	1
EA	1
CB	1
46	1
66	1
47	1
67	1
48	1
68	1
49	1
69	1
8C	1
8D	1
A1	1
CD	1
ED	1
CE	1
EE	1
4A	1
6A	1
4B	1
6B	1
4C	1
6C	1
B3	1
A4	1
C5	1
E5	1
4D	1
6D	1
4E	1
6E	1
D1	1
F1	1
D2	1
F2	1
4F	1
6F	1
95	1
A2	1
D3	1
E0	1
F3	1
D4	1
F4	1
8A	1
8B	1
93	1
94	1
99	1
A7	1
D5	1
D6	1
F5	1
F6	1
50	1
70	1
51	1
71	1
52	1
72	1
C0	1
D8	1
F8	1
53	1
73	1
A5	1
B6	1
A9	1
B9	1
AA	1
BA	1
54	1
74	1
AB	1
BB	1
DE	1
55	1
75	1
97	1
A3	1
DA	1
FA	1
D9	1
F9	1
81	1
96	1
98	1
9A	1
DB	1
DC	1
EB	1
FB	1
FC	1
56	1
76	1
57	1
77	1
58	1
78	1
59	1
79	1
DD	1
FD	1
5A	1
7A	1
AC	1
BC	1
AE	1
BE	1
AF	1
BF	1
5B	1
5C	1
5D	1
5E	1
5F	1
60	1
7B	1
7C	1
7D	1
7E	1
9F	1
A6	1
A8	1
AD	1
B0	1
B2	1
B4	1
B7	1
B8	1
BD	1
D0	1
D7	1
DF	1
F0	1
F7	1
DROP TABLE test.t1;
SET NAMES latin5;
CREATE TABLE test.t1 (a VARCHAR(3) CHARACTER SET latin5 COLLATE latin5_bin) ENGINE=MyISAM CHARACTER SET latin5 COLLATE latin5_bin;
SHOW TABLE STATUS LIKE 't1';
Name	Engine	Version	Row_format	Rows	Avg_row_length	Data_length	Max_data_length	Index_length	Data_free	Auto_increment	Create_time	Update_time	Check_time	Collation	Checksum	Create_options	Comment
t1	MyISAM	#	#	#	#	#	#	#	#	#	#	#	#	latin5_bin	#	#	#
SELECT HEX(ASCII(a)) AS a_ascii, CHAR_LENGTH(a) AS a_len FROM test.t1 ORDER BY a, ORD(a);
a_ascii	a_len
21	1
22	1
23	1
24	1
25	1
26	1
27	1
28	1
29	1
2A	1
2B	1
2C	1
2D	1
2E	1
2F	1
30	1
31	1
32	1
33	1
34	1
35	1
36	1
37	1
38	1
39	1
3A	1
3B	1
3C	1
3D	1
3E	1
3F	1
40	1
41	1
42	1
43	1
44	1
45	1
46	1
47	1
48	1
49	1
4A	1
4B	1
4C	1
4D	1
4E	1
4F	1
50	1
51	1
52	1
53	1
54	1
55	1
56	1
57	1
58	1
59	1
5A	1
5B	1
5C	1
5D	1
5E	1
5F	1
60	1
61	1
62	1
63	1
64	1
65	1
66	1
67	1
68	1
69	1
6A	1
6B	1
6C	1
6D	1
6E	1
6F	1
70	1
71	1
72	1
73	1
74	1
75	1
76	1
77	1
78	1
79	1
7A	1
7B	1
7C	1
7D	1
7E	1
7F	1
80	1
81	1
82	1
83	1
84	1
85	1
86	1
87	1
88	1
89	1
8A	1
8B	1
8C	1
8D	1
8E	1
8F	1
90	1
91	1
92	1
93	1
94	1
95	1
96	1
97	1
98	1
99	1
9A	1
9B	1
9C	1
9D	1
9E	1
9F	1
A0	1
A1	1
A2	1
A3	1
A4	1
A5	1
A6	1
A7	1
A8	1
A9	1
AA	1
AB	1
AC	1
AD	1
AE	1
AF	1
B0	1
B1	1
B2	1
B3	1
B4	1
B5	1
B6	1
B7	1
B8	1
B9	1
BA	1
BB	1
BC	1
BD	1
BE	1
BF	1
C0	1
C1	1
C2	1
C3	1
C4	1
C5	1
C6	1
C7	1
C8	1
C9	1
CA	1
CB	1
CC	1
CD	1
CE	1
CF	1
D0	1
D1	1
D2	1
D3	1
D4	1
D5	1
D6	1
D7	1
D8	1
D9	1
DA	1
DB	1
DC	1
DD	1
DE	1
DF	1
E0	1
E1	1
E2	1
E3	1
E4	1
E5	1
E6	1
E7	1
E8	1
E9	1
EA	1
EB	1
EC	1
ED	1
EE	1
EF	1
F0	1
F1	1
F2	1
F3	1
F4	1
F5	1
F6	1
F7	1
F8	1
F9	1
FA	1
FB	1
FC	1
FD	1
DROP TABLE test.t1;
SET NAMES latin5;
CREATE TABLE test.t1 (a VARCHAR(3) CHARACTER SET latin5 COLLATE latin5_turkish_ci) ENGINE=MyISAM CHARACTER SET latin5 COLLATE latin5_turkish_ci;
SHOW TABLE STATUS LIKE 't1';
Name	Engine	Version	Row_format	Rows	Avg_row_length	Data_length	Max_data_length	Index_length	Data_free	Auto_increment	Create_time	Update_time	Check_time	Collation	Checksum	Create_options	Comment
t1	MyISAM	#	#	#	#	#	#	#	#	#	#	#	#	latin5_turkish_ci	#	#	#
SELECT HEX(ASCII(a)) AS a_ascii, CHAR_LENGTH(a) AS a_len FROM test.t1 ORDER BY a, ORD(a);
a_ascii	a_len
21	1
22	1
23	1
24	1
25	1
26	1
27	1
28	1
29	1
2A	1
2B	1
2C	1
2D	1
2E	1
2F	1
30	1
31	1
32	1
33	1
34	1
35	1
36	1
37	1
38	1
39	1
3A	1
3B	1
3C	1
3D	1
3E	1
3F	1
40	1
41	1
61	1
C0	1
C1	1
C2	1
C3	1
C4	1
C5	1
C6	1
E0	1
E1	1
E2	1
E3	1
E4	1
E5	1
E6	1
42	1
62	1
43	1
63	1
C7	1
E7	1
44	1
64	1
45	1
65	1
C8	1
C9	1
CA	1
CB	1
E8	1
E9	1
EA	1
EB	1
46	1
66	1
47	1
67	1
D0	1
F0	1
48	1
68	1
49	1
FD	1
69	1
CC	1
CD	1
CE	1
CF	1
DD	1
EC	1
ED	1
EE	1
EF	1
4A	1
6A	1
4B	1
6B	1
4C	1
6C	1
4D	1
6D	1
4E	1
6E	1
D1	1
F1	1
4F	1
6F	1
D2	1
D3	1
D4	1
D5	1
D8	1
F2	1
F3	1
F4	1
F5	1
F8	1
D6	1
F6	1
50	1
70	1
51	1
71	1
52	1
72	1
53	1
73	1
DF	1
DE	1
54	1
74	1
55	1
75	1
D9	1
DA	1
DB	1
F9	1
FA	1
FB	1
DC	1
FC	1
56	1
76	1
57	1
77	1
58	1
78	1
59	1
79	1
5A	1
7A	1
5B	1
5C	1
5D	1
5E	1
5F	1
60	1
7B	1
7C	1
7D	1
7E	1
7F	1
80	1
81	1
82	1
83	1
84	1
85	1
86	1
87	1
88	1
89	1
8A	1
8B	1
8C	1
8D	1
8E	1
8F	1
90	1
91	1
92	1
93	1
94	1
95	1
96	1
97	1
98	1
99	1
9A	1
9B	1
9C	1
9D	1
9E	1
9F	1
A0	1
A1	1
A2	1
A3	1
A4	1
A5	1
A6	1
A7	1
A8	1
A9	1
AA	1
AB	1
AC	1
AD	1
AE	1
AF	1
B0	1
B1	1
B2	1
B3	1
B4	1
B5	1
B6	1
B7	1
B8	1
B9	1
BA	1
BB	1
BC	1
BD	1
BE	1
BF	1
D7	1
F7	1
DROP TABLE test.t1;
SET NAMES latin7;
CREATE TABLE test.t1 (a VARCHAR(3) CHARACTER SET latin7 COLLATE latin7_bin) ENGINE=MyISAM CHARACTER SET latin7 COLLATE latin7_bin;
SHOW TABLE STATUS LIKE 't1';
Name	Engine	Version	Row_format	Rows	Avg_row_length	Data_length	Max_data_length	Index_length	Data_free	Auto_increment	Create_time	Update_time	Check_time	Collation	Checksum	Create_options	Comment
t1	MyISAM	#	#	#	#	#	#	#	#	#	#	#	#	latin7_bin	#	#	#
SELECT HEX(ASCII(a)) AS a_ascii, CHAR_LENGTH(a) AS a_len FROM test.t1 ORDER BY a, ORD(a);
a_ascii	a_len
21	1
22	1
23	1
24	1
25	1
26	1
27	1
28	1
29	1
2A	1
2B	1
2C	1
2D	1
2E	1
2F	1
30	1
31	1
32	1
33	1
34	1
35	1
36	1
37	1
38	1
39	1
3A	1
3B	1
3C	1
3D	1
3E	1
3F	1
40	1
41	1
42	1
43	1
44	1
45	1
46	1
47	1
48	1
49	1
4A	1
4B	1
4C	1
4D	1
4E	1
4F	1
50	1
51	1
52	1
53	1
54	1
55	1
56	1
57	1
58	1
59	1
5A	1
5B	1
5C	1
5D	1
5E	1
5F	1
60	1
61	1
62	1
63	1
64	1
65	1
66	1
67	1
68	1
69	1
6A	1
6B	1
6C	1
6D	1
6E	1
6F	1
70	1
71	1
72	1
73	1
74	1
75	1
76	1
77	1
78	1
79	1
7A	1
7B	1
7C	1
7D	1
7E	1
7F	1
80	1
81	1
82	1
83	1
84	1
85	1
86	1
87	1
88	1
89	1
8A	1
8B	1
8C	1
8D	1
8E	1
8F	1
90	1
91	1
92	1
93	1
94	1
95	1
96	1
97	1
98	1
99	1
9A	1
9B	1
9C	1
9D	1
9E	1
9F	1
A0	1
A1	1
A2	1
A3	1
A4	1
A5	1
A6	1
A7	1
A8	1
A9	1
AA	1
AB	1
AC	1
AD	1
AE	1
AF	1
B0	1
B1	1
B2	1
B3	1
B4	1
B5	1
B6	1
B7	1
B8	1
B9	1
BA	1
BB	1
BC	1
BD	1
BE	1
BF	1
C0	1
C1	1
C2	1
C3	1
C4	1
C5	1
C6	1
C7	1
C8	1
C9	1
CA	1
CB	1
CC	1
CD	1
CE	1
CF	1
D0	1
D1	1
D2	1
D3	1
D4	1
D5	1
D6	1
D7	1
D8	1
D9	1
DA	1
DB	1
DC	1
DD	1
DE	1
DF	1
E0	1
E1	1
E2	1
E3	1
E4	1
E5	1
E6	1
E7	1
E8	1
E9	1
EA	1
EB	1
EC	1
ED	1
EE	1
EF	1
F0	1
F1	1
F2	1
F3	1
F4	1
F5	1
F6	1
F7	1
F8	1
F9	1
FA	1
FB	1
FC	1
FD	1
DROP TABLE test.t1;
SET NAMES latin7;
CREATE TABLE test.t1 (a VARCHAR(3) CHARACTER SET latin7 COLLATE latin7_estonian_cs) ENGINE=MyISAM CHARACTER SET latin7 COLLATE latin7_estonian_cs;
SHOW TABLE STATUS LIKE 't1';
Name	Engine	Version	Row_format	Rows	Avg_row_length	Data_length	Max_data_length	Index_length	Data_free	Auto_increment	Create_time	Update_time	Check_time	Collation	Checksum	Create_options	Comment
t1	MyISAM	#	#	#	#	#	#	#	#	#	#	#	#	latin7_estonian_cs	#	#	#
SELECT HEX(ASCII(a)) AS a_ascii, CHAR_LENGTH(a) AS a_len FROM test.t1 ORDER BY a, ORD(a);
a_ascii	a_len
80	1
7F	1
81	1
83	1
88	1
8A	1
8C	1
90	1
98	1
9A	1
9C	1
9F	1
27	1
2D	1
AD	1
96	1
97	1
A0	1
21	1
22	1
23	1
24	1
25	1
26	1
28	1
29	1
2A	1
2C	1
2E	1
2F	1
3A	1
3B	1
3F	1
40	1
5B	1
5C	1
5D	1
5E	1
5F	1
60	1
7B	1
7C	1
7D	1
7E	1
A6	1
8D	1
9D	1
B4	1
8F	1
8E	1
9E	1
91	1
92	1
82	1
93	1
94	1
84	1
8B	1
9B	1
2B	1
3C	1
3D	1
3E	1
B1	1
AB	1
BB	1
D7	1
F7	1
A2	1
A3	1
A4	1
A7	1
A9	1
AC	1
AE	1
B0	1
B5	1
B6	1
B7	1
86	1
87	1
95	1
85	1
89	1
30	1
BC	1
BD	1
BE	1
31	1
B9	1
32	1
B2	1
33	1
B3	1
34	1
35	1
36	1
37	1
38	1
39	1
41	1
61	1
C2	1
E2	1
C5	1
E5	1
C0	1
E0	1
AF	1
BF	1
42	1
62	1
43	1
63	1
C3	1
E3	1
C8	1
E8	1
44	1
64	1
45	1
65	1
C9	1
E9	1
CB	1
EB	1
C7	1
E7	1
C6	1
E6	1
46	1
66	1
47	1
67	1
CC	1
EC	1
48	1
68	1
49	1
69	1
CE	1
EE	1
C1	1
E1	1
4A	1
6A	1
4B	1
6B	1
CD	1
ED	1
4C	1
6C	1
CF	1
EF	1
D9	1
F9	1
4D	1
6D	1
4E	1
6E	1
D1	1
F1	1
D2	1
F2	1
4F	1
6F	1
D3	1
F3	1
D4	1
F4	1
A8	1
B8	1
50	1
70	1
51	1
71	1
52	1
72	1
AA	1
BA	1
53	1
73	1
DA	1
FA	1
DF	1
D0	1
F0	1
5A	1
7A	1
CA	1
EA	1
DD	1
FD	1
DE	1
54	1
74	1
99	1
55	1
75	1
DB	1
FB	1
D8	1
F8	1
56	1
76	1
57	1
77	1
D5	1
F5	1
C4	1
E4	1
D6	1
F6	1
DC	1
FC	1
58	1
78	1
59	1
79	1
A1	1
A5	1
DROP TABLE test.t1;
SET NAMES latin7;
CREATE TABLE test.t1 (a VARCHAR(3) CHARACTER SET latin7 COLLATE latin7_general_ci) ENGINE=MyISAM CHARACTER SET latin7 COLLATE latin7_general_ci;
SHOW TABLE STATUS LIKE 't1';
Name	Engine	Version	Row_format	Rows	Avg_row_length	Data_length	Max_data_length	Index_length	Data_free	Auto_increment	Create_time	Update_time	Check_time	Collation	Checksum	Create_options	Comment
t1	MyISAM	#	#	#	#	#	#	#	#	#	#	#	#	latin7_general_ci	#	#	#
SELECT HEX(ASCII(a)) AS a_ascii, CHAR_LENGTH(a) AS a_len FROM test.t1 ORDER BY a, ORD(a);
a_ascii	a_len
7F	1
81	1
83	1
88	1
8A	1
8C	1
90	1
98	1
9A	1
9C	1
9F	1
27	1
2D	1
A8	1
AD	1
96	1
97	1
A0	1
21	1
22	1
23	1
24	1
25	1
26	1
28	1
29	1
2A	1
2C	1
2E	1
2F	1
3A	1
3B	1
3F	1
40	1
5B	1
5C	1
5D	1
5E	1
5F	1
60	1
7B	1
7C	1
7D	1
7E	1
A6	1
8D	1
9D	1
B4	1
8F	1
8E	1
9E	1
91	1
92	1
82	1
93	1
94	1
84	1
8B	1
9B	1
2B	1
3C	1
3D	1
3E	1
B1	1
AB	1
BB	1
D7	1
F7	1
A2	1
A3	1
A4	1
A7	1
A9	1
AC	1
AE	1
B0	1
B5	1
B6	1
B7	1
86	1
87	1
95	1
85	1
89	1
80	1
30	1
BC	1
BD	1
BE	1
31	1
B9	1
32	1
B2	1
33	1
B3	1
34	1
35	1
36	1
37	1
38	1
39	1
41	1
61	1
C4	1
E4	1
C2	1
E2	1
C5	1
E5	1
C0	1
E0	1
AF	1
BF	1
42	1
62	1
43	1
63	1
C3	1
E3	1
C8	1
E8	1
44	1
64	1
45	1
65	1
C9	1
E9	1
CB	1
EB	1
C7	1
E7	1
C6	1
E6	1
46	1
66	1
47	1
67	1
CC	1
EC	1
48	1
68	1
49	1
69	1
CE	1
EE	1
C1	1
E1	1
4A	1
6A	1
4B	1
6B	1
CD	1
ED	1
4C	1
6C	1
D9	1
F9	1
CF	1
EF	1
4D	1
6D	1
4E	1
6E	1
D1	1
F1	1
D2	1
F2	1
4F	1
6F	1
D3	1
F3	1
D6	1
F6	1
D4	1
F4	1
D5	1
F5	1
B8	1
50	1
70	1
51	1
71	1
52	1
72	1
AA	1
BA	1
53	1
73	1
DA	1
FA	1
DF	1
D0	1
F0	1
74	1
54	1
99	1
55	1
75	1
DC	1
FC	1
DB	1
FB	1
D8	1
F8	1
56	1
76	1
57	1
77	1
58	1
78	1
59	1
79	1
5A	1
7A	1
CA	1
EA	1
DD	1
FD	1
DE	1
A1	1
A5	1
DROP TABLE test.t1;
SET NAMES latin7;
CREATE TABLE test.t1 (a VARCHAR(3) CHARACTER SET latin7 COLLATE latin7_general_cs) ENGINE=MyISAM CHARACTER SET latin7 COLLATE latin7_general_cs;
SHOW TABLE STATUS LIKE 't1';
Name	Engine	Version	Row_format	Rows	Avg_row_length	Data_length	Max_data_length	Index_length	Data_free	Auto_increment	Create_time	Update_time	Check_time	Collation	Checksum	Create_options	Comment
t1	MyISAM	#	#	#	#	#	#	#	#	#	#	#	#	latin7_general_cs	#	#	#
SELECT HEX(ASCII(a)) AS a_ascii, CHAR_LENGTH(a) AS a_len FROM test.t1 ORDER BY a, ORD(a);
a_ascii	a_len
7F	1
81	1
83	1
88	1
8A	1
8C	1
90	1
98	1
9A	1
9C	1
9F	1
27	1
2D	1
AD	1
96	1
97	1
A0	1
21	1
22	1
23	1
24	1
25	1
26	1
28	1
29	1
2A	1
2C	1
2E	1
2F	1
3A	1
3B	1
3F	1
40	1
5B	1
5C	1
5D	1
5E	1
5F	1
60	1
7B	1
7C	1
7D	1
7E	1
A6	1
8D	1
9D	1
B4	1
8F	1
8E	1
9E	1
91	1
92	1
82	1
93	1
94	1
84	1
8B	1
9B	1
2B	1
3C	1
3D	1
3E	1
B1	1
AB	1
BB	1
D7	1
F7	1
A2	1
A3	1
A4	1
A7	1
A9	1
AC	1
AE	1
B0	1
B5	1
B6	1
B7	1
86	1
87	1
95	1
85	1
89	1
80	1
30	1
BC	1
BD	1
BE	1
31	1
B9	1
32	1
B2	1
33	1
B3	1
34	1
35	1
36	1
37	1
38	1
39	1
41	1
61	1
C4	1
E4	1
C2	1
E2	1
C5	1
E5	1
C0	1
E0	1
AF	1
BF	1
42	1
62	1
43	1
63	1
C3	1
E3	1
C8	1
E8	1
44	1
64	1
45	1
65	1
C9	1
E9	1
CB	1
EB	1
C7	1
E7	1
C6	1
E6	1
46	1
66	1
47	1
67	1
CC	1
EC	1
48	1
68	1
49	1
69	1
CE	1
EE	1
C1	1
E1	1
4A	1
6A	1
4B	1
6B	1
CD	1
ED	1
4C	1
6C	1
D9	1
F9	1
CF	1
EF	1
4D	1
6D	1
4E	1
6E	1
D1	1
F1	1
D2	1
F2	1
4F	1
6F	1
D3	1
F3	1
D6	1
F6	1
D4	1
F4	1
D5	1
F5	1
B8	1
A8	1
50	1
70	1
51	1
71	1
52	1
72	1
AA	1
BA	1
53	1
73	1
DA	1
FA	1
DF	1
D0	1
F0	1
54	1
74	1
99	1
55	1
75	1
DC	1
FC	1
DB	1
FB	1
D8	1
F8	1
56	1
76	1
57	1
77	1
58	1
78	1
59	1
79	1
5A	1
7A	1
CA	1
EA	1
DD	1
FD	1
DE	1
A1	1
A5	1
DROP TABLE test.t1;
SET NAMES macce;
Warnings:
Warning	1287	'macce' is deprecated and will be removed in a future release. Please use utf8mb4 instead
CREATE TABLE test.t1 (a VARCHAR(3) CHARACTER SET macce COLLATE macce_bin) ENGINE=MyISAM CHARACTER SET macce COLLATE macce_bin;
Warnings:
Warning	1287	'macce' is deprecated and will be removed in a future release. Please use utf8mb4 instead
Warning	4079	'macce_bin' is a collation of the deprecated character set macce. Please consider using utf8mb4 with an appropriate collation instead.
Warning	1287	'macce' is deprecated and will be removed in a future release. Please use utf8mb4 instead
Warning	4079	'macce_bin' is a collation of the deprecated character set macce. Please consider using utf8mb4 with an appropriate collation instead.
SHOW TABLE STATUS LIKE 't1';
Name	Engine	Version	Row_format	Rows	Avg_row_length	Data_length	Max_data_length	Index_length	Data_free	Auto_increment	Create_time	Update_time	Check_time	Collation	Checksum	Create_options	Comment
t1	MyISAM	#	#	#	#	#	#	#	#	#	#	#	#	macce_bin	#	#	#
SELECT HEX(ASCII(a)) AS a_ascii, CHAR_LENGTH(a) AS a_len FROM test.t1 ORDER BY a, ORD(a);
a_ascii	a_len
21	1
22	1
23	1
24	1
25	1
26	1
27	1
28	1
29	1
2A	1
2B	1
2C	1
2D	1
2E	1
2F	1
30	1
31	1
32	1
33	1
34	1
35	1
36	1
37	1
38	1
39	1
3A	1
3B	1
3C	1
3D	1
3E	1
3F	1
40	1
41	1
42	1
43	1
44	1
45	1
46	1
47	1
48	1
49	1
4A	1
4B	1
4C	1
4D	1
4E	1
4F	1
50	1
51	1
52	1
53	1
54	1
55	1
56	1
57	1
58	1
59	1
5A	1
5B	1
5C	1
5D	1
5E	1
5F	1
60	1
61	1
62	1
63	1
64	1
65	1
66	1
67	1
68	1
69	1
6A	1
6B	1
6C	1
6D	1
6E	1
6F	1
70	1
71	1
72	1
73	1
74	1
75	1
76	1
77	1
78	1
79	1
7A	1
7B	1
7C	1
7D	1
7E	1
7F	1
80	1
81	1
82	1
83	1
84	1
85	1
86	1
87	1
88	1
89	1
8A	1
8B	1
8C	1
8D	1
8E	1
8F	1
90	1
91	1
92	1
93	1
94	1
95	1
96	1
97	1
98	1
99	1
9A	1
9B	1
9C	1
9D	1
9E	1
9F	1
A0	1
A1	1
A2	1
A3	1
A4	1
A5	1
A6	1
A7	1
A8	1
A9	1
AA	1
AB	1
AC	1
AD	1
AE	1
AF	1
B0	1
B1	1
B2	1
B3	1
B4	1
B5	1
B6	1
B7	1
B8	1
B9	1
BA	1
BB	1
BC	1
BD	1
BE	1
BF	1
C0	1
C1	1
C2	1
C3	1
C4	1
C5	1
C6	1
C7	1
C8	1
C9	1
CA	1
CB	1
CC	1
CD	1
CE	1
CF	1
D0	1
D1	1
D2	1
D3	1
D4	1
D5	1
D6	1
D7	1
D8	1
D9	1
DA	1
DB	1
DC	1
DD	1
DE	1
DF	1
E0	1
E1	1
E2	1
E3	1
E4	1
E5	1
E6	1
E7	1
E8	1
E9	1
EA	1
EB	1
EC	1
ED	1
EE	1
EF	1
F0	1
F1	1
F2	1
F3	1
F4	1
F5	1
F6	1
F7	1
F8	1
F9	1
FA	1
FB	1
FC	1
FD	1
DROP TABLE test.t1;
SET NAMES macce;
Warnings:
Warning	1287	'macce' is deprecated and will be removed in a future release. Please use utf8mb4 instead
CREATE TABLE test.t1 (a VARCHAR(3) CHARACTER SET macce COLLATE macce_general_ci) ENGINE=MyISAM CHARACTER SET macce COLLATE macce_general_ci;
Warnings:
Warning	1287	'macce' is deprecated and will be removed in a future release. Please use utf8mb4 instead
Warning	4079	'macce_general_ci' is a collation of the deprecated character set macce. Please consider using utf8mb4 with an appropriate collation instead.
Warning	1287	'macce' is deprecated and will be removed in a future release. Please use utf8mb4 instead
Warning	4079	'macce_general_ci' is a collation of the deprecated character set macce. Please consider using utf8mb4 with an appropriate collation instead.
SHOW TABLE STATUS LIKE 't1';
Name	Engine	Version	Row_format	Rows	Avg_row_length	Data_length	Max_data_length	Index_length	Data_free	Auto_increment	Create_time	Update_time	Check_time	Collation	Checksum	Create_options	Comment
t1	MyISAM	#	#	#	#	#	#	#	#	#	#	#	#	macce_general_ci	#	#	#
SELECT HEX(ASCII(a)) AS a_ascii, CHAR_LENGTH(a) AS a_len FROM test.t1 ORDER BY a, ORD(a);
a_ascii	a_len
21	1
22	1
23	1
24	1
25	1
26	1
27	1
28	1
29	1
2A	1
2B	1
2C	1
2D	1
2E	1
2F	1
30	1
31	1
32	1
33	1
34	1
35	1
36	1
37	1
38	1
39	1
3A	1
3B	1
3C	1
3D	1
3E	1
3F	1
40	1
41	1
61	1
80	1
81	1
82	1
84	1
87	1
88	1
8A	1
E7	1
42	1
62	1
43	1
63	1
89	1
8B	1
8C	1
8D	1
44	1
64	1
91	1
93	1
45	1
65	1
83	1
8E	1
94	1
95	1
96	1
98	1
9D	1
9E	1
A2	1
AB	1
46	1
66	1
47	1
67	1
AE	1
48	1
68	1
49	1
69	1
92	1
AF	1
B0	1
B1	1
B4	1
EA	1
4A	1
6A	1
4B	1
6B	1
B5	1
FA	1
4C	1
6C	1
B8	1
B9	1
BA	1
BB	1
BC	1
BD	1
BE	1
FC	1
4D	1
4E	1
6D	1
6E	1
BF	1
C0	1
C1	1
C4	1
C5	1
CB	1
4F	1
6F	1
85	1
97	1
99	1
9A	1
9B	1
CC	1
CD	1
CE	1
CF	1
D8	1
EE	1
EF	1
50	1
70	1
51	1
71	1
52	1
72	1
D9	1
DA	1
DB	1
DE	1
DF	1
E0	1
53	1
73	1
A7	1
E1	1
E4	1
E5	1
E6	1
54	1
74	1
E8	1
E9	1
55	1
75	1
86	1
9C	1
9F	1
ED	1
F0	1
F1	1
F2	1
F3	1
F4	1
F5	1
F6	1
F7	1
56	1
76	1
57	1
77	1
58	1
78	1
59	1
79	1
F8	1
F9	1
5A	1
7A	1
8F	1
90	1
EB	1
EC	1
FB	1
FD	1
5B	1
5C	1
5D	1
5E	1
5F	1
60	1
7B	1
7C	1
7D	1
7E	1
7F	1
A0	1
A1	1
A3	1
A4	1
A5	1
A6	1
A8	1
A9	1
AA	1
AC	1
AD	1
B2	1
B3	1
B6	1
B7	1
C2	1
C3	1
C6	1
C7	1
C8	1
C9	1
CA	1
D0	1
D1	1
D2	1
D3	1
D4	1
D5	1
D6	1
D7	1
DC	1
DD	1
E2	1
E3	1
DROP TABLE test.t1;
SET NAMES macroman;
Warnings:
Warning	1287	'macroman' is deprecated and will be removed in a future release. Please use utf8mb4 instead
CREATE TABLE test.t1 (a VARCHAR(3) CHARACTER SET macroman COLLATE macroman_bin) ENGINE=MyISAM CHARACTER SET macroman COLLATE macroman_bin;
Warnings:
Warning	1287	'macroman' is deprecated and will be removed in a future release. Please use utf8mb4 instead
Warning	4079	'macroman_bin' is a collation of the deprecated character set macroman. Please consider using utf8mb4 with an appropriate collation instead.
Warning	1287	'macroman' is deprecated and will be removed in a future release. Please use utf8mb4 instead
Warning	4079	'macroman_bin' is a collation of the deprecated character set macroman. Please consider using utf8mb4 with an appropriate collation instead.
SHOW TABLE STATUS LIKE 't1';
Name	Engine	Version	Row_format	Rows	Avg_row_length	Data_length	Max_data_length	Index_length	Data_free	Auto_increment	Create_time	Update_time	Check_time	Collation	Checksum	Create_options	Comment
t1	MyISAM	#	#	#	#	#	#	#	#	#	#	#	#	macroman_bin	#	#	#
SELECT HEX(ASCII(a)) AS a_ascii, CHAR_LENGTH(a) AS a_len FROM test.t1 ORDER BY a, ORD(a);
a_ascii	a_len
21	1
22	1
23	1
24	1
25	1
26	1
27	1
28	1
29	1
2A	1
2B	1
2C	1
2D	1
2E	1
2F	1
30	1
31	1
32	1
33	1
34	1
35	1
36	1
37	1
38	1
39	1
3A	1
3B	1
3C	1
3D	1
3E	1
3F	1
40	1
41	1
42	1
43	1
44	1
45	1
46	1
47	1
48	1
49	1
4A	1
4B	1
4C	1
4D	1
4E	1
4F	1
50	1
51	1
52	1
53	1
54	1
55	1
56	1
57	1
58	1
59	1
5A	1
5B	1
5C	1
5D	1
5E	1
5F	1
60	1
61	1
62	1
63	1
64	1
65	1
66	1
67	1
68	1
69	1
6A	1
6B	1
6C	1
6D	1
6E	1
6F	1
70	1
71	1
72	1
73	1
74	1
75	1
76	1
77	1
78	1
79	1
7A	1
7B	1
7C	1
7D	1
7E	1
7F	1
80	1
81	1
82	1
83	1
84	1
85	1
86	1
87	1
88	1
89	1
8A	1
8B	1
8C	1
8D	1
8E	1
8F	1
90	1
91	1
92	1
93	1
94	1
95	1
96	1
97	1
98	1
99	1
9A	1
9B	1
9C	1
9D	1
9E	1
9F	1
A0	1
A1	1
A2	1
A3	1
A4	1
A5	1
A6	1
A7	1
A8	1
A9	1
AA	1
AB	1
AC	1
AD	1
AE	1
AF	1
B0	1
B1	1
B2	1
B3	1
B4	1
B5	1
B6	1
B7	1
B8	1
B9	1
BA	1
BB	1
BC	1
BD	1
BE	1
BF	1
C0	1
C1	1
C2	1
C3	1
C4	1
C5	1
C6	1
C7	1
C8	1
C9	1
CA	1
CB	1
CC	1
CD	1
CE	1
CF	1
D0	1
D1	1
D2	1
D3	1
D4	1
D5	1
D6	1
D7	1
D8	1
D9	1
DA	1
DB	1
DC	1
DD	1
DE	1
DF	1
E0	1
E1	1
E2	1
E3	1
E4	1
E5	1
E6	1
E7	1
E8	1
E9	1
EA	1
EB	1
EC	1
ED	1
EE	1
EF	1
F0	1
F1	1
F2	1
F3	1
F4	1
F5	1
F6	1
F7	1
F8	1
F9	1
FA	1
FB	1
FC	1
FD	1
DROP TABLE test.t1;
SET NAMES macroman;
Warnings:
Warning	1287	'macroman' is deprecated and will be removed in a future release. Please use utf8mb4 instead
CREATE TABLE test.t1 (a VARCHAR(3) CHARACTER SET macroman COLLATE macroman_general_ci) ENGINE=MyISAM CHARACTER SET macroman COLLATE macroman_general_ci;
Warnings:
Warning	1287	'macroman' is deprecated and will be removed in a future release. Please use utf8mb4 instead
Warning	4079	'macroman_general_ci' is a collation of the deprecated character set macroman. Please consider using utf8mb4 with an appropriate collation instead.
Warning	1287	'macroman' is deprecated and will be removed in a future release. Please use utf8mb4 instead
Warning	4079	'macroman_general_ci' is a collation of the deprecated character set macroman. Please consider using utf8mb4 with an appropriate collation instead.
SHOW TABLE STATUS LIKE 't1';
Name	Engine	Version	Row_format	Rows	Avg_row_length	Data_length	Max_data_length	Index_length	Data_free	Auto_increment	Create_time	Update_time	Check_time	Collation	Checksum	Create_options	Comment
t1	MyISAM	#	#	#	#	#	#	#	#	#	#	#	#	macroman_general_ci	#	#	#
SELECT HEX(ASCII(a)) AS a_ascii, CHAR_LENGTH(a) AS a_len FROM test.t1 ORDER BY a, ORD(a);
a_ascii	a_len
21	1
22	1
23	1
24	1
25	1
26	1
27	1
28	1
29	1
2A	1
2B	1
2C	1
2D	1
2E	1
2F	1
30	1
31	1
32	1
33	1
34	1
35	1
36	1
37	1
38	1
39	1
3A	1
3B	1
3C	1
3D	1
3E	1
3F	1
40	1
41	1
61	1
80	1
81	1
87	1
88	1
89	1
8A	1
8B	1
8C	1
CB	1
CC	1
E5	1
E7	1
AE	1
BE	1
42	1
62	1
43	1
63	1
82	1
8D	1
44	1
64	1
45	1
65	1
83	1
8E	1
8F	1
90	1
91	1
E6	1
E8	1
E9	1
46	1
66	1
C4	1
47	1
67	1
48	1
68	1
49	1
69	1
92	1
93	1
94	1
95	1
EA	1
EB	1
EC	1
ED	1
F5	1
4A	1
6A	1
4B	1
6B	1
4C	1
6C	1
4D	1
6D	1
4E	1
6E	1
84	1
96	1
4F	1
6F	1
85	1
97	1
98	1
99	1
9A	1
9B	1
AF	1
BF	1
CD	1
EE	1
EF	1
F1	1
50	1
70	1
51	1
71	1
52	1
72	1
53	1
73	1
A7	1
54	1
74	1
55	1
75	1
86	1
9C	1
9D	1
9E	1
9F	1
F2	1
F3	1
F4	1
56	1
76	1
57	1
77	1
58	1
78	1
59	1
79	1
D8	1
D9	1
5A	1
7A	1
5B	1
5C	1
5D	1
5E	1
5F	1
60	1
7B	1
7C	1
7D	1
7E	1
7F	1
A0	1
A1	1
A2	1
A3	1
A4	1
A5	1
A6	1
A8	1
A9	1
AA	1
AB	1
AC	1
AD	1
B0	1
B1	1
B2	1
B3	1
B4	1
B5	1
B6	1
B7	1
B8	1
B9	1
BA	1
BB	1
BC	1
BD	1
C0	1
C1	1
C2	1
C3	1
C5	1
C6	1
C7	1
C8	1
C9	1
CA	1
CE	1
CF	1
D0	1
D1	1
D2	1
D3	1
D4	1
D5	1
D6	1
D7	1
DA	1
DB	1
DC	1
DD	1
DE	1
DF	1
E0	1
E1	1
E2	1
E3	1
E4	1
F0	1
F6	1
F7	1
F8	1
F9	1
FA	1
FB	1
FC	1
FD	1
DROP TABLE test.t1;
SET NAMES sjis;
CREATE TABLE test.t1 (a VARCHAR(3) CHARACTER SET sjis COLLATE sjis_bin) ENGINE=MyISAM CHARACTER SET sjis COLLATE sjis_bin;
SHOW TABLE STATUS LIKE 't1';
Name	Engine	Version	Row_format	Rows	Avg_row_length	Data_length	Max_data_length	Index_length	Data_free	Auto_increment	Create_time	Update_time	Check_time	Collation	Checksum	Create_options	Comment
t1	MyISAM	#	#	#	#	#	#	#	#	#	#	#	#	sjis_bin	#	#	#
SELECT HEX(ASCII(a)) AS a_ascii, CHAR_LENGTH(a) AS a_len FROM test.t1 ORDER BY a, ORD(a);
a_ascii	a_len
21	1
22	1
23	1
24	1
25	1
26	1
27	1
28	1
29	1
2A	1
2B	1
2C	1
2D	1
2E	1
2F	1
30	1
31	1
32	1
33	1
34	1
35	1
36	1
37	1
38	1
39	1
3A	1
3B	1
3C	1
3D	1
3E	1
3F	1
40	1
41	1
42	1
43	1
44	1
45	1
46	1
47	1
48	1
49	1
4A	1
4B	1
4C	1
4D	1
4E	1
4F	1
50	1
51	1
52	1
53	1
54	1
55	1
56	1
57	1
58	1
59	1
5A	1
5B	1
5C	1
5D	1
5E	1
5F	1
60	1
61	1
62	1
63	1
64	1
65	1
66	1
67	1
68	1
69	1
6A	1
6B	1
6C	1
6D	1
6E	1
6F	1
70	1
71	1
72	1
73	1
74	1
75	1
76	1
77	1
78	1
79	1
7A	1
7B	1
7C	1
7D	1
7E	1
7F	1
A1	1
A2	1
A3	1
A4	1
A5	1
A6	1
A7	1
A8	1
A9	1
AA	1
AB	1
AC	1
AD	1
AE	1
AF	1
B0	1
B1	1
B2	1
B3	1
B4	1
B5	1
B6	1
B7	1
B8	1
B9	1
BA	1
BB	1
BC	1
BD	1
BE	1
BF	1
C0	1
C1	1
C2	1
C3	1
C4	1
C5	1
C6	1
C7	1
C8	1
C9	1
CA	1
CB	1
CC	1
CD	1
CE	1
CF	1
D0	1
D1	1
D2	1
D3	1
D4	1
D5	1
D6	1
D7	1
D8	1
D9	1
DA	1
DB	1
DC	1
DD	1
DE	1
DF	1
DROP TABLE test.t1;
SET NAMES sjis;
CREATE TABLE test.t1 (a VARCHAR(3) CHARACTER SET sjis COLLATE sjis_japanese_ci) ENGINE=MyISAM CHARACTER SET sjis COLLATE sjis_japanese_ci;
SHOW TABLE STATUS LIKE 't1';
Name	Engine	Version	Row_format	Rows	Avg_row_length	Data_length	Max_data_length	Index_length	Data_free	Auto_increment	Create_time	Update_time	Check_time	Collation	Checksum	Create_options	Comment
t1	MyISAM	#	#	#	#	#	#	#	#	#	#	#	#	sjis_japanese_ci	#	#	#
SELECT HEX(ASCII(a)) AS a_ascii, CHAR_LENGTH(a) AS a_len FROM test.t1 ORDER BY a, ORD(a);
a_ascii	a_len
21	1
22	1
23	1
24	1
25	1
26	1
27	1
28	1
29	1
2A	1
2B	1
2C	1
2D	1
2E	1
2F	1
30	1
31	1
32	1
33	1
34	1
35	1
36	1
37	1
38	1
39	1
3A	1
3B	1
3C	1
3D	1
3E	1
3F	1
40	1
41	1
61	1
42	1
62	1
43	1
63	1
44	1
64	1
45	1
65	1
46	1
66	1
47	1
67	1
48	1
68	1
49	1
69	1
4A	1
6A	1
4B	1
6B	1
4C	1
6C	1
4D	1
6D	1
4E	1
6E	1
4F	1
6F	1
50	1
70	1
51	1
71	1
52	1
72	1
53	1
73	1
54	1
74	1
55	1
75	1
56	1
76	1
57	1
77	1
58	1
78	1
59	1
79	1
5A	1
7A	1
5B	1
5C	1
5D	1
5E	1
5F	1
60	1
7B	1
7C	1
7D	1
7E	1
7F	1
A1	1
A2	1
A3	1
A4	1
A5	1
A6	1
A7	1
A8	1
A9	1
AA	1
AB	1
AC	1
AD	1
AE	1
AF	1
B0	1
B1	1
B2	1
B3	1
B4	1
B5	1
B6	1
B7	1
B8	1
B9	1
BA	1
BB	1
BC	1
BD	1
BE	1
BF	1
C0	1
C1	1
C2	1
C3	1
C4	1
C5	1
C6	1
C7	1
C8	1
C9	1
CA	1
CB	1
CC	1
CD	1
CE	1
CF	1
D0	1
D1	1
D2	1
D3	1
D4	1
D5	1
D6	1
D7	1
D8	1
D9	1
DA	1
DB	1
DC	1
DD	1
DE	1
DF	1
DROP TABLE test.t1;
SET NAMES swe7;
CREATE TABLE test.t1 (a VARCHAR(3) CHARACTER SET swe7 COLLATE swe7_bin) ENGINE=MyISAM CHARACTER SET swe7 COLLATE swe7_bin;
SHOW TABLE STATUS LIKE 't1';
Name	Engine	Version	Row_format	Rows	Avg_row_length	Data_length	Max_data_length	Index_length	Data_free	Auto_increment	Create_time	Update_time	Check_time	Collation	Checksum	Create_options	Comment
t1	MyISAM	#	#	#	#	#	#	#	#	#	#	#	#	swe7_bin	#	#	#
SELECT HEX(ASCII(a)) AS a_ascii, CHAR_LENGTH(a) AS a_len FROM test.t1 ORDER BY a, ORD(a);
a_ascii	a_len
21	1
22	1
23	1
24	1
25	1
26	1
27	1
28	1
29	1
2A	1
2B	1
2C	1
2D	1
2E	1
2F	1
30	1
31	1
32	1
33	1
34	1
35	1
36	1
37	1
38	1
39	1
3A	1
3B	1
3C	1
3D	1
3E	1
3F	1
40	1
41	1
42	1
43	1
44	1
45	1
46	1
47	1
48	1
49	1
4A	1
4B	1
4C	1
4D	1
4E	1
4F	1
50	1
51	1
52	1
53	1
54	1
55	1
56	1
57	1
58	1
59	1
5A	1
5B	1
5C	1
5D	1
5E	1
5F	1
60	1
61	1
62	1
63	1
64	1
65	1
66	1
67	1
68	1
69	1
6A	1
6B	1
6C	1
6D	1
6E	1
6F	1
70	1
71	1
72	1
73	1
74	1
75	1
76	1
77	1
78	1
79	1
7A	1
7B	1
7C	1
7D	1
7E	1
7F	1
80	1
81	1
82	1
83	1
84	1
85	1
86	1
87	1
88	1
89	1
8A	1
8B	1
8C	1
8D	1
8E	1
8F	1
90	1
91	1
92	1
93	1
94	1
95	1
96	1
97	1
98	1
99	1
9A	1
9B	1
9C	1
9D	1
9E	1
9F	1
A0	1
A1	1
A2	1
A3	1
A4	1
A5	1
A6	1
A7	1
A8	1
A9	1
AA	1
AB	1
AC	1
AD	1
AE	1
AF	1
B0	1
B1	1
B2	1
B3	1
B4	1
B5	1
B6	1
B7	1
B8	1
B9	1
BA	1
BB	1
BC	1
BD	1
BE	1
BF	1
C0	1
C1	1
C2	1
C3	1
C4	1
C5	1
C6	1
C7	1
C8	1
C9	1
CA	1
CB	1
CC	1
CD	1
CE	1
CF	1
D0	1
D1	1
D2	1
D3	1
D4	1
D5	1
D6	1
D7	1
D8	1
D9	1
DA	1
DB	1
DC	1
DD	1
DE	1
DF	1
E0	1
E1	1
E2	1
E3	1
E4	1
E5	1
E6	1
E7	1
E8	1
E9	1
EA	1
EB	1
EC	1
ED	1
EE	1
EF	1
F0	1
F1	1
F2	1
F3	1
F4	1
F5	1
F6	1
F7	1
F8	1
F9	1
FA	1
FB	1
FC	1
FD	1
DROP TABLE test.t1;
SET NAMES swe7;
CREATE TABLE test.t1 (a VARCHAR(3) CHARACTER SET swe7 COLLATE swe7_swedish_ci) ENGINE=MyISAM CHARACTER SET swe7 COLLATE swe7_swedish_ci;
SHOW TABLE STATUS LIKE 't1';
Name	Engine	Version	Row_format	Rows	Avg_row_length	Data_length	Max_data_length	Index_length	Data_free	Auto_increment	Create_time	Update_time	Check_time	Collation	Checksum	Create_options	Comment
t1	MyISAM	#	#	#	#	#	#	#	#	#	#	#	#	swe7_swedish_ci	#	#	#
SELECT HEX(ASCII(a)) AS a_ascii, CHAR_LENGTH(a) AS a_len FROM test.t1 ORDER BY a, ORD(a);
a_ascii	a_len
21	1
22	1
23	1
24	1
25	1
26	1
27	1
28	1
29	1
2A	1
2B	1
2C	1
2D	1
2E	1
2F	1
30	1
31	1
32	1
33	1
34	1
35	1
36	1
37	1
38	1
39	1
3A	1
3B	1
3C	1
3D	1
3E	1
3F	1
41	1
61	1
42	1
62	1
43	1
63	1
44	1
64	1
40	1
45	1
60	1
65	1
46	1
66	1
47	1
67	1
48	1
68	1
49	1
69	1
4A	1
6A	1
4B	1
6B	1
4C	1
6C	1
4D	1
6D	1
4E	1
6E	1
4F	1
6F	1
50	1
70	1
51	1
71	1
52	1
72	1
53	1
73	1
54	1
74	1
55	1
75	1
56	1
76	1
57	1
77	1
58	1
78	1
59	1
5E	1
79	1
7E	1
5A	1
7A	1
5D	1
7D	1
5B	1
7B	1
5C	1
7C	1
5F	1
7F	1
80	1
81	1
82	1
83	1
84	1
85	1
86	1
87	1
88	1
89	1
8A	1
8B	1
8C	1
8D	1
8E	1
8F	1
90	1
91	1
92	1
93	1
94	1
95	1
96	1
97	1
98	1
99	1
9A	1
9B	1
9C	1
9D	1
9E	1
9F	1
A0	1
A1	1
A2	1
A3	1
A4	1
A5	1
A6	1
A7	1
A8	1
A9	1
AA	1
AB	1
AC	1
AD	1
AE	1
AF	1
B0	1
B1	1
B2	1
B3	1
B4	1
B5	1
B6	1
B7	1
B8	1
B9	1
BA	1
BB	1
BC	1
BD	1
BE	1
BF	1
C0	1
C1	1
C2	1
C3	1
C4	1
C5	1
C6	1
C7	1
C8	1
C9	1
CA	1
CB	1
CC	1
CD	1
CE	1
CF	1
D0	1
D1	1
D2	1
D3	1
D4	1
D5	1
D6	1
D7	1
D8	1
D9	1
DA	1
DB	1
DC	1
DD	1
DE	1
DF	1
E0	1
E1	1
E2	1
E3	1
E4	1
E5	1
E6	1
E7	1
E8	1
E9	1
EA	1
EB	1
EC	1
ED	1
EE	1
EF	1
F0	1
F1	1
F2	1
F3	1
F4	1
F5	1
F6	1
F7	1
F8	1
F9	1
FA	1
FB	1
FC	1
FD	1
DROP TABLE test.t1;
SET NAMES tis620;
CREATE TABLE test.t1 (a VARCHAR(3) CHARACTER SET tis620 COLLATE tis620_bin) ENGINE=MyISAM CHARACTER SET tis620 COLLATE tis620_bin;
SHOW TABLE STATUS LIKE 't1';
Name	Engine	Version	Row_format	Rows	Avg_row_length	Data_length	Max_data_length	Index_length	Data_free	Auto_increment	Create_time	Update_time	Check_time	Collation	Checksum	Create_options	Comment
t1	MyISAM	#	#	#	#	#	#	#	#	#	#	#	#	tis620_bin	#	#	#
SELECT HEX(ASCII(a)) AS a_ascii, CHAR_LENGTH(a) AS a_len FROM test.t1 ORDER BY a, ORD(a);
a_ascii	a_len
21	1
22	1
23	1
24	1
25	1
26	1
27	1
28	1
29	1
2A	1
2B	1
2C	1
2D	1
2E	1
2F	1
30	1
31	1
32	1
33	1
34	1
35	1
36	1
37	1
38	1
39	1
3A	1
3B	1
3C	1
3D	1
3E	1
3F	1
40	1
41	1
42	1
43	1
44	1
45	1
46	1
47	1
48	1
49	1
4A	1
4B	1
4C	1
4D	1
4E	1
4F	1
50	1
51	1
52	1
53	1
54	1
55	1
56	1
57	1
58	1
59	1
5A	1
5B	1
5C	1
5D	1
5E	1
5F	1
60	1
61	1
62	1
63	1
64	1
65	1
66	1
67	1
68	1
69	1
6A	1
6B	1
6C	1
6D	1
6E	1
6F	1
70	1
71	1
72	1
73	1
74	1
75	1
76	1
77	1
78	1
79	1
7A	1
7B	1
7C	1
7D	1
7E	1
7F	1
80	1
81	1
82	1
83	1
84	1
85	1
86	1
87	1
88	1
89	1
8A	1
8B	1
8C	1
8D	1
8E	1
8F	1
90	1
91	1
92	1
93	1
94	1
95	1
96	1
97	1
98	1
99	1
9A	1
9B	1
9C	1
9D	1
9E	1
9F	1
A0	1
A1	1
A2	1
A3	1
A4	1
A5	1
A6	1
A7	1
A8	1
A9	1
AA	1
AB	1
AC	1
AD	1
AE	1
AF	1
B0	1
B1	1
B2	1
B3	1
B4	1
B5	1
B6	1
B7	1
B8	1
B9	1
BA	1
BB	1
BC	1
BD	1
BE	1
BF	1
C0	1
C1	1
C2	1
C3	1
C4	1
C5	1
C6	1
C7	1
C8	1
C9	1
CA	1
CB	1
CC	1
CD	1
CE	1
CF	1
D0	1
D1	1
D2	1
D3	1
D4	1
D5	1
D6	1
D7	1
D8	1
D9	1
DA	1
DB	1
DC	1
DD	1
DE	1
DF	1
E0	1
E1	1
E2	1
E3	1
E4	1
E5	1
E6	1
E7	1
E8	1
E9	1
EA	1
EB	1
EC	1
ED	1
EE	1
EF	1
F0	1
F1	1
F2	1
F3	1
F4	1
F5	1
F6	1
F7	1
F8	1
F9	1
FA	1
FB	1
FC	1
FD	1
DROP TABLE test.t1;
SET NAMES tis620;
CREATE TABLE test.t1 (a VARCHAR(3) CHARACTER SET tis620 COLLATE tis620_thai_ci) ENGINE=MyISAM CHARACTER SET tis620 COLLATE tis620_thai_ci;
SHOW TABLE STATUS LIKE 't1';
Name	Engine	Version	Row_format	Rows	Avg_row_length	Data_length	Max_data_length	Index_length	Data_free	Auto_increment	Create_time	Update_time	Check_time	Collation	Checksum	Create_options	Comment
t1	MyISAM	#	#	#	#	#	#	#	#	#	#	#	#	tis620_thai_ci	#	#	#
SELECT HEX(ASCII(a)) AS a_ascii, CHAR_LENGTH(a) AS a_len FROM test.t1 ORDER BY a, ORD(a);
a_ascii	a_len
21	1
22	1
23	1
24	1
25	1
26	1
27	1
28	1
29	1
2A	1
2B	1
2C	1
2D	1
2E	1
2F	1
30	1
31	1
32	1
33	1
34	1
35	1
36	1
37	1
38	1
39	1
3A	1
3B	1
3C	1
3D	1
3E	1
3F	1
40	1
5B	1
5C	1
5D	1
5E	1
5F	1
60	1
41	1
61	1
42	1
62	1
43	1
63	1
44	1
64	1
45	1
65	1
46	1
66	1
47	1
67	1
48	1
68	1
49	1
69	1
4A	1
6A	1
4B	1
6B	1
4C	1
6C	1
4D	1
6D	1
4E	1
6E	1
4F	1
6F	1
50	1
70	1
51	1
71	1
52	1
72	1
53	1
73	1
54	1
74	1
55	1
75	1
56	1
76	1
57	1
77	1
58	1
78	1
59	1
79	1
5A	1
7A	1
7B	1
7C	1
7D	1
7E	1
7F	1
80	1
81	1
82	1
83	1
84	1
85	1
86	1
87	1
88	1
89	1
8A	1
8B	1
8C	1
8D	1
8E	1
8F	1
90	1
91	1
92	1
93	1
94	1
95	1
96	1
97	1
98	1
99	1
9A	1
9B	1
9C	1
9D	1
9E	1
9F	1
A0	1
A1	1
A2	1
A3	1
A4	1
A5	1
A6	1
A7	1
A8	1
A9	1
AA	1
AB	1
AC	1
AD	1
AE	1
AF	1
B0	1
B1	1
B2	1
B3	1
B4	1
B5	1
B6	1
B7	1
B8	1
B9	1
BA	1
BB	1
BC	1
BD	1
BE	1
BF	1
C0	1
C1	1
C2	1
C3	1
C4	1
C5	1
C6	1
C7	1
C8	1
C9	1
CA	1
CB	1
CC	1
CD	1
CE	1
CF	1
D0	1
D1	1
D2	1
D3	1
D4	1
D5	1
D6	1
D7	1
D8	1
D9	1
DA	1
DB	1
DC	1
DD	1
DE	1
DF	1
E0	1
E1	1
E2	1
E3	1
E4	1
E5	1
E6	1
ED	1
EE	1
EF	1
F0	1
F1	1
F2	1
F3	1
F4	1
F5	1
F6	1
F7	1
F8	1
EC	1
F9	1
E7	1
FA	1
E8	1
FB	1
E9	1
FC	1
EA	1
FD	1
EB	1
DROP TABLE test.t1;
SET NAMES ujis;
CREATE TABLE test.t1 (a VARCHAR(3) CHARACTER SET ujis COLLATE ujis_bin) ENGINE=MyISAM CHARACTER SET ujis COLLATE ujis_bin;
SHOW TABLE STATUS LIKE 't1';
Name	Engine	Version	Row_format	Rows	Avg_row_length	Data_length	Max_data_length	Index_length	Data_free	Auto_increment	Create_time	Update_time	Check_time	Collation	Checksum	Create_options	Comment
t1	MyISAM	#	#	#	#	#	#	#	#	#	#	#	#	ujis_bin	#	#	#
SELECT HEX(ASCII(a)) AS a_ascii, CHAR_LENGTH(a) AS a_len FROM test.t1 ORDER BY a, ORD(a);
a_ascii	a_len
21	1
22	1
23	1
24	1
25	1
26	1
27	1
28	1
29	1
2A	1
2B	1
2C	1
2D	1
2E	1
2F	1
30	1
31	1
32	1
33	1
34	1
35	1
36	1
37	1
38	1
39	1
3A	1
3B	1
3C	1
3D	1
3E	1
3F	1
40	1
41	1
42	1
43	1
44	1
45	1
46	1
47	1
48	1
49	1
4A	1
4B	1
4C	1
4D	1
4E	1
4F	1
50	1
51	1
52	1
53	1
54	1
55	1
56	1
57	1
58	1
59	1
5A	1
5B	1
5C	1
5D	1
5E	1
5F	1
60	1
61	1
62	1
63	1
64	1
65	1
66	1
67	1
68	1
69	1
6A	1
6B	1
6C	1
6D	1
6E	1
6F	1
70	1
71	1
72	1
73	1
74	1
75	1
76	1
77	1
78	1
79	1
7A	1
7B	1
7C	1
7D	1
7E	1
7F	1
DROP TABLE test.t1;
SET NAMES ujis;
CREATE TABLE test.t1 (a VARCHAR(3) CHARACTER SET ujis COLLATE ujis_japanese_ci) ENGINE=MyISAM CHARACTER SET ujis COLLATE ujis_japanese_ci;
SHOW TABLE STATUS LIKE 't1';
Name	Engine	Version	Row_format	Rows	Avg_row_length	Data_length	Max_data_length	Index_length	Data_free	Auto_increment	Create_time	Update_time	Check_time	Collation	Checksum	Create_options	Comment
t1	MyISAM	#	#	#	#	#	#	#	#	#	#	#	#	ujis_japanese_ci	#	#	#
SELECT HEX(ASCII(a)) AS a_ascii, CHAR_LENGTH(a) AS a_len FROM test.t1 ORDER BY a, ORD(a);
a_ascii	a_len
21	1
22	1
23	1
24	1
25	1
26	1
27	1
28	1
29	1
2A	1
2B	1
2C	1
2D	1
2E	1
2F	1
30	1
31	1
32	1
33	1
34	1
35	1
36	1
37	1
38	1
39	1
3A	1
3B	1
3C	1
3D	1
3E	1
3F	1
40	1
41	1
61	1
42	1
62	1
43	1
63	1
44	1
64	1
45	1
65	1
46	1
66	1
47	1
67	1
48	1
68	1
49	1
69	1
4A	1
6A	1
4B	1
6B	1
4C	1
6C	1
4D	1
6D	1
4E	1
6E	1
4F	1
6F	1
50	1
70	1
51	1
71	1
52	1
72	1
53	1
73	1
54	1
74	1
55	1
75	1
56	1
76	1
57	1
77	1
58	1
78	1
59	1
79	1
5A	1
7A	1
5B	1
5C	1
5D	1
5E	1
5F	1
60	1
7B	1
7C	1
7D	1
7E	1
7F	1
DROP TABLE test.t1;
DROP TABLE IF EXISTS test.t1;
DROP DATABASE test;
CREATE DATABASE test CHARACTER SET utf8mb3;
USE test;
SET NAMES utf8mb3;
Warnings:
Warning	1287	'utf8mb3' is deprecated and will be removed in a future release. Please use utf8mb4 instead
CREATE TABLE test.t1 (a CHAR(4) CHARACTER SET utf8mb3) ENGINE=MyISAM CHARACTER SET utf8mb3;
Warnings:
Warning	1287	'utf8mb3' is deprecated and will be removed in a future release. Please use utf8mb4 instead
Warning	1287	'utf8mb3' is deprecated and will be removed in a future release. Please use utf8mb4 instead
SHOW TABLE STATUS LIKE 't1';
Name	Engine	Version	Row_format	Rows	Avg_row_length	Data_length	Max_data_length	Index_length	Data_free	Auto_increment	Create_time	Update_time	Check_time	Collation	Checksum	Create_options	Comment
t1	MyISAM	#	#	#	#	#	#	#	#	#	#	#	#	utf8mb3_general_ci	#	#	#
LOAD DATA INFILE 
'MYSQL_TEST_DIR/suite/funcs_2/data/charset_utf8.txt' INTO TABLE test.t1;
ALTER TABLE test.t1 CHANGE a a CHAR(4) CHARACTER SET ucs2 COLLATE ucs2_bin;
Warnings:
Warning	1287	'ucs2' is deprecated and will be removed in a future release. Please use utf8mb4 instead
Warning	4079	'ucs2_bin' is a collation of the deprecated character set ucs2. Please consider using utf8mb4 with an appropriate collation instead.
DELETE FROM test.t1 WHERE CHAR_LENGTH(a) <> 1;
SELECT HEX(ORD(a)) AS a_ord, CHAR_LENGTH(a) AS a_len FROM test.t1 ORDER BY a, ORD(a);
a_ord	a_len
21	1
22	1
23	1
24	1
25	1
26	1
27	1
28	1
29	1
2A	1
2B	1
2C	1
2D	1
2E	1
2F	1
30	1
31	1
32	1
33	1
34	1
35	1
36	1
37	1
38	1
39	1
3A	1
3B	1
3C	1
3D	1
3E	1
3F	1
40	1
41	1
42	1
43	1
44	1
45	1
46	1
47	1
48	1
49	1
4A	1
4B	1
4C	1
4D	1
4E	1
4F	1
50	1
51	1
52	1
53	1
54	1
55	1
56	1
57	1
58	1
59	1
5A	1
5B	1
5E	1
5F	1
60	1
61	1
62	1
63	1
64	1
65	1
66	1
67	1
68	1
69	1
6A	1
6B	1
6C	1
6D	1
6E	1
6F	1
70	1
71	1
72	1
73	1
74	1
75	1
76	1
77	1
78	1
79	1
7A	1
7B	1
7C	1
7D	1
7E	1
7F	1
80	1
81	1
82	1
83	1
84	1
85	1
86	1
87	1
88	1
89	1
8A	1
8B	1
8C	1
8D	1
8E	1
8F	1
90	1
91	1
92	1
93	1
94	1
95	1
96	1
97	1
98	1
99	1
9A	1
9B	1
9C	1
9D	1
9E	1
9F	1
A0	1
A1	1
A2	1
A3	1
A4	1
A5	1
A6	1
A7	1
A8	1
A9	1
AA	1
AB	1
AC	1
AD	1
AE	1
AF	1
B0	1
B1	1
B2	1
B3	1
B4	1
B5	1
B6	1
B7	1
B8	1
B9	1
BA	1
BB	1
BC	1
BD	1
BE	1
BF	1
C0	1
C1	1
C2	1
C3	1
C4	1
C5	1
C6	1
C7	1
C8	1
C9	1
CA	1
CB	1
CC	1
CD	1
CE	1
CF	1
D0	1
D1	1
D2	1
D3	1
D4	1
D5	1
D6	1
D7	1
D8	1
D9	1
DA	1
DB	1
DC	1
DD	1
DE	1
DF	1
E0	1
E1	1
E2	1
E3	1
E4	1
E5	1
E6	1
E7	1
E8	1
E9	1
EA	1
EB	1
EC	1
ED	1
EE	1
EF	1
F0	1
F1	1
F2	1
F3	1
F4	1
F5	1
F6	1
F7	1
F8	1
F9	1
FA	1
FB	1
FC	1
FD	1
FE	1
FF	1
100	1
101	1
102	1
103	1
104	1
105	1
106	1
107	1
108	1
109	1
10A	1
10B	1
10C	1
10D	1
10E	1
10F	1
110	1
111	1
112	1
113	1
114	1
115	1
116	1
117	1
118	1
119	1
11A	1
11B	1
11C	1
11D	1
11E	1
11F	1
120	1
121	1
122	1
123	1
124	1
125	1
126	1
127	1
128	1
129	1
12A	1
12B	1
12C	1
12D	1
12E	1
12F	1
130	1
131	1
132	1
133	1
134	1
135	1
136	1
137	1
138	1
139	1
13A	1
13B	1
13C	1
13D	1
13E	1
13F	1
140	1
141	1
142	1
143	1
144	1
145	1
146	1
147	1
148	1
149	1
14A	1
14B	1
14C	1
14D	1
14E	1
14F	1
150	1
151	1
152	1
153	1
154	1
155	1
156	1
157	1
158	1
159	1
15A	1
15B	1
15C	1
15D	1
15E	1
15F	1
160	1
161	1
162	1
163	1
164	1
165	1
166	1
167	1
168	1
169	1
16A	1
16B	1
16C	1
16D	1
16E	1
16F	1
170	1
171	1
172	1
173	1
174	1
175	1
176	1
177	1
178	1
179	1
17A	1
17B	1
17C	1
17D	1
17E	1
17F	1
180	1
181	1
182	1
183	1
184	1
185	1
186	1
187	1
188	1
189	1
18A	1
18B	1
18C	1
18D	1
18E	1
18F	1
190	1
191	1
192	1
193	1
194	1
195	1
196	1
197	1
198	1
199	1
19A	1
19B	1
19C	1
19D	1
19E	1
19F	1
1A0	1
1A1	1
1A2	1
1A3	1
1A4	1
1A5	1
1A6	1
1A7	1
1A8	1
1A9	1
1AA	1
1AB	1
1AC	1
1AD	1
1AE	1
1AF	1
1B0	1
1B1	1
1B2	1
1B3	1
1B4	1
1B5	1
1B6	1
1B7	1
1B8	1
1B9	1
1BA	1
1BB	1
1BC	1
1BD	1
1BE	1
1BF	1
1C0	1
1C1	1
1C2	1
1C3	1
1C4	1
1C5	1
1C6	1
1C7	1
1C8	1
1C9	1
1CA	1
1CB	1
1CC	1
1CD	1
1CE	1
1CF	1
1D0	1
1D1	1
1D2	1
1D3	1
1D4	1
1D5	1
1D6	1
1D7	1
1D8	1
1D9	1
1DA	1
1DB	1
1DC	1
1DD	1
1DE	1
1DF	1
1E0	1
1E1	1
1E2	1
1E3	1
1E4	1
1E5	1
1E6	1
1E7	1
1E8	1
1E9	1
1EA	1
1EB	1
1EC	1
1ED	1
1EE	1
1EF	1
1F0	1
1F1	1
1F2	1
1F3	1
1F4	1
1F5	1
1F6	1
1F7	1
1F8	1
1F9	1
1FA	1
1FB	1
1FC	1
1FD	1
1FE	1
1FF	1
200	1
201	1
202	1
203	1
204	1
205	1
206	1
207	1
208	1
209	1
20A	1
20B	1
20C	1
20D	1
20E	1
20F	1
210	1
211	1
212	1
213	1
214	1
215	1
216	1
217	1
218	1
219	1
21A	1
21B	1
21C	1
21D	1
21E	1
21F	1
220	1
221	1
222	1
223	1
224	1
225	1
226	1
227	1
228	1
229	1
22A	1
22B	1
22C	1
22D	1
22E	1
22F	1
230	1
231	1
232	1
233	1
234	1
235	1
236	1
237	1
238	1
239	1
23A	1
23B	1
23C	1
23D	1
23E	1
23F	1
240	1
241	1
242	1
243	1
244	1
245	1
246	1
247	1
248	1
249	1
24A	1
24B	1
24C	1
24D	1
24E	1
24F	1
250	1
251	1
252	1
253	1
254	1
255	1
256	1
257	1
258	1
259	1
25A	1
25B	1
25C	1
25D	1
25E	1
25F	1
260	1
261	1
262	1
263	1
264	1
265	1
266	1
267	1
268	1
269	1
26A	1
26B	1
26C	1
26D	1
26E	1
26F	1
270	1
271	1
272	1
273	1
274	1
275	1
276	1
277	1
278	1
279	1
27A	1
27B	1
27C	1
27D	1
27E	1
27F	1
280	1
281	1
282	1
283	1
284	1
285	1
286	1
287	1
288	1
289	1
28A	1
28B	1
28C	1
28D	1
28E	1
28F	1
290	1
291	1
292	1
293	1
294	1
295	1
296	1
297	1
298	1
299	1
29A	1
29B	1
29C	1
29D	1
29E	1
29F	1
2A0	1
2A1	1
2A2	1
2A3	1
2A4	1
2A5	1
2A6	1
2A7	1
2A8	1
2A9	1
2AA	1
2AB	1
2AC	1
2AD	1
2AE	1
2AF	1
2B0	1
2B1	1
2B2	1
2B3	1
2B4	1
2B5	1
2B6	1
2B7	1
2B8	1
2B9	1
2BA	1
2BB	1
2BC	1
2BD	1
2BE	1
2BF	1
2C0	1
2C1	1
2C2	1
2C3	1
2C4	1
2C5	1
2C6	1
2C7	1
2C8	1
2C9	1
2CA	1
2CB	1
2CC	1
2CD	1
2CE	1
2CF	1
2D0	1
2D1	1
2D2	1
2D3	1
2D4	1
2D5	1
2D6	1
2D7	1
2D8	1
2D9	1
2DA	1
2DB	1
2DC	1
2DD	1
2DE	1
2DF	1
2E0	1
2E1	1
2E2	1
2E3	1
2E4	1
2E5	1
2E6	1
2E7	1
2E8	1
2E9	1
2EA	1
2EB	1
2EC	1
2ED	1
2EE	1
2EF	1
2F0	1
2F1	1
2F2	1
2F3	1
2F4	1
2F5	1
2F6	1
2F7	1
2F8	1
2F9	1
2FA	1
2FB	1
2FC	1
2FD	1
2FE	1
2FF	1
300	1
301	1
302	1
303	1
304	1
305	1
306	1
307	1
308	1
309	1
30A	1
30B	1
30C	1
30D	1
30E	1
30F	1
310	1
311	1
312	1
313	1
314	1
315	1
316	1
317	1
318	1
319	1
31A	1
31B	1
31C	1
31D	1
31E	1
31F	1
320	1
321	1
322	1
323	1
324	1
325	1
326	1
327	1
328	1
329	1
32A	1
32B	1
32C	1
32D	1
32E	1
32F	1
330	1
331	1
332	1
333	1
334	1
335	1
336	1
337	1
338	1
339	1
33A	1
33B	1
33C	1
33D	1
33E	1
33F	1
340	1
341	1
342	1
343	1
344	1
345	1
346	1
347	1
348	1
349	1
34A	1
34B	1
34C	1
34D	1
34E	1
34F	1
350	1
351	1
352	1
353	1
354	1
355	1
356	1
357	1
358	1
359	1
35A	1
35B	1
35C	1
35D	1
35E	1
35F	1
360	1
361	1
362	1
363	1
364	1
365	1
366	1
367	1
368	1
369	1
36A	1
36B	1
36C	1
36D	1
36E	1
36F	1
370	1
371	1
372	1
373	1
374	1
375	1
376	1
377	1
378	1
379	1
37A	1
37B	1
37C	1
37D	1
37E	1
37F	1
380	1
381	1
382	1
383	1
384	1
385	1
386	1
387	1
388	1
389	1
38A	1
38B	1
38C	1
38D	1
38E	1
38F	1
390	1
391	1
392	1
393	1
394	1
395	1
396	1
397	1
398	1
399	1
39A	1
39B	1
39C	1
39D	1
39E	1
39F	1
3A0	1
3A1	1
3A2	1
3A3	1
3A4	1
3A5	1
3A6	1
3A7	1
3A8	1
3A9	1
3AA	1
3AB	1
3AC	1
3AD	1
3AE	1
3AF	1
3B0	1
3B1	1
3B2	1
3B3	1
3B4	1
3B5	1
3B6	1
3B7	1
3B8	1
3B9	1
3BA	1
3BB	1
3BC	1
3BD	1
3BE	1
3BF	1
3C0	1
3C1	1
3C2	1
3C3	1
3C4	1
3C5	1
3C6	1
3C7	1
3C8	1
3C9	1
3CA	1
3CB	1
3CC	1
3CD	1
3CE	1
3CF	1
3D0	1
3D1	1
3D2	1
3D3	1
3D4	1
3D5	1
3D6	1
3D7	1
3D8	1
3D9	1
3DA	1
3DB	1
3DC	1
3DD	1
3DE	1
3DF	1
3E0	1
3E1	1
3E2	1
3E3	1
3E4	1
3E5	1
3E6	1
3E7	1
3E8	1
3E9	1
3EA	1
3EB	1
3EC	1
3ED	1
3EE	1
3EF	1
3F0	1
3F1	1
3F2	1
3F3	1
3F4	1
3F5	1
3F6	1
3F7	1
3F8	1
3F9	1
3FA	1
3FB	1
3FC	1
3FD	1
3FE	1
3FF	1
400	1
401	1
402	1
403	1
404	1
405	1
406	1
407	1
408	1
409	1
40A	1
40B	1
40C	1
40D	1
40E	1
40F	1
410	1
411	1
412	1
413	1
414	1
415	1
416	1
417	1
418	1
419	1
41A	1
41B	1
41C	1
41D	1
41E	1
41F	1
420	1
421	1
422	1
423	1
424	1
425	1
426	1
427	1
428	1
429	1
42A	1
42B	1
42C	1
42D	1
42E	1
42F	1
430	1
431	1
432	1
433	1
434	1
435	1
436	1
437	1
438	1
439	1
43A	1
43B	1
43C	1
43D	1
43E	1
43F	1
440	1
441	1
442	1
443	1
444	1
445	1
446	1
447	1
448	1
449	1
44A	1
44B	1
44C	1
44D	1
44E	1
44F	1
450	1
451	1
452	1
453	1
454	1
455	1
456	1
457	1
458	1
459	1
45A	1
45B	1
45C	1
45D	1
45E	1
45F	1
460	1
461	1
462	1
463	1
464	1
465	1
466	1
467	1
468	1
469	1
46A	1
46B	1
46C	1
46D	1
46E	1
46F	1
470	1
471	1
472	1
473	1
474	1
475	1
476	1
477	1
478	1
479	1
47A	1
47B	1
47C	1
47D	1
47E	1
47F	1
480	1
481	1
482	1
483	1
484	1
485	1
486	1
487	1
488	1
489	1
48A	1
48B	1
48C	1
48D	1
48E	1
48F	1
490	1
491	1
492	1
493	1
494	1
495	1
496	1
497	1
498	1
499	1
49A	1
49B	1
49C	1
49D	1
49E	1
49F	1
4A0	1
4A1	1
4A2	1
4A3	1
4A4	1
4A5	1
4A6	1
4A7	1
4A8	1
4A9	1
4AA	1
4AB	1
4AC	1
4AD	1
4AE	1
4AF	1
4B0	1
4B1	1
4B2	1
4B3	1
4B4	1
4B5	1
4B6	1
4B7	1
4B8	1
4B9	1
4BA	1
4BB	1
4BC	1
4BD	1
4BE	1
4BF	1
4C0	1
4C1	1
4C2	1
4C3	1
4C4	1
4C5	1
4C6	1
4C7	1
4C8	1
4C9	1
4CA	1
4CB	1
4CC	1
4CD	1
4CE	1
4CF	1
4D0	1
4D1	1
4D2	1
4D3	1
4D4	1
4D5	1
4D6	1
4D7	1
4D8	1
4D9	1
4DA	1
4DB	1
4DC	1
4DD	1
4DE	1
4DF	1
4E0	1
4E1	1
4E2	1
4E3	1
4E4	1
4E5	1
4E6	1
4E7	1
4E8	1
4E9	1
4EA	1
4EB	1
4EC	1
4ED	1
4EE	1
4EF	1
4F0	1
4F1	1
4F2	1
4F3	1
4F4	1
4F5	1
4F6	1
4F7	1
4F8	1
4F9	1
4FA	1
4FB	1
4FC	1
4FD	1
4FE	1
4FF	1
500	1
501	1
502	1
503	1
504	1
505	1
506	1
507	1
508	1
509	1
50A	1
50B	1
50C	1
50D	1
50E	1
50F	1
510	1
511	1
512	1
513	1
514	1
515	1
516	1
517	1
518	1
519	1
51A	1
51B	1
51C	1
51D	1
51E	1
51F	1
520	1
521	1
522	1
523	1
524	1
525	1
526	1
527	1
528	1
529	1
52A	1
52B	1
52C	1
52D	1
52E	1
52F	1
530	1
531	1
532	1
533	1
534	1
535	1
536	1
537	1
538	1
539	1
53A	1
53B	1
53C	1
53D	1
53E	1
53F	1
540	1
541	1
542	1
543	1
544	1
545	1
546	1
547	1
548	1
549	1
54A	1
54B	1
54C	1
54D	1
54E	1
54F	1
550	1
551	1
552	1
553	1
554	1
555	1
556	1
557	1
558	1
559	1
55A	1
55B	1
55C	1
55D	1
55E	1
55F	1
560	1
561	1
562	1
563	1
564	1
565	1
566	1
567	1
568	1
569	1
56A	1
56B	1
56C	1
56D	1
56E	1
56F	1
570	1
571	1
572	1
573	1
574	1
575	1
576	1
577	1
578	1
579	1
57A	1
57B	1
57C	1
57D	1
57E	1
57F	1
580	1
581	1
582	1
583	1
584	1
585	1
586	1
587	1
588	1
589	1
58A	1
58B	1
58C	1
58D	1
58E	1
58F	1
590	1
591	1
592	1
593	1
594	1
595	1
596	1
597	1
598	1
599	1
59A	1
59B	1
59C	1
59D	1
59E	1
59F	1
5A0	1
5A1	1
5A2	1
5A3	1
5A4	1
5A5	1
5A6	1
5A7	1
5A8	1
5A9	1
5AA	1
5AB	1
5AC	1
5AD	1
5AE	1
5AF	1
5B0	1
5B1	1
5B2	1
5B3	1
5B4	1
5B5	1
5B6	1
5B7	1
5B8	1
5B9	1
5BA	1
5BB	1
5BC	1
5BD	1
5BE	1
5BF	1
5C0	1
5C1	1
5C2	1
5C3	1
5C4	1
5C5	1
5C6	1
5C7	1
5C8	1
5C9	1
5CA	1
5CB	1
5CC	1
5CD	1
5CE	1
5CF	1
5D0	1
5D1	1
5D2	1
5D3	1
5D4	1
5D5	1
5D6	1
5D7	1
5D8	1
5D9	1
5DA	1
5DB	1
5DC	1
5DD	1
5DE	1
5DF	1
5E0	1
5E1	1
5E2	1
5E3	1
5E4	1
5E5	1
5E6	1
5E7	1
5E8	1
5E9	1
5EA	1
5EB	1
5EC	1
5ED	1
5EE	1
5EF	1
5F0	1
5F1	1
5F2	1
5F3	1
5F4	1
5F5	1
5F6	1
5F7	1
5F8	1
5F9	1
5FA	1
5FB	1
5FC	1
5FD	1
5FE	1
5FF	1
600	1
601	1
602	1
603	1
604	1
605	1
606	1
607	1
608	1
609	1
60A	1
60B	1
60C	1
60D	1
60E	1
60F	1
610	1
611	1
612	1
613	1
614	1
615	1
616	1
617	1
618	1
619	1
61A	1
61B	1
61C	1
61D	1
61E	1
61F	1
620	1
621	1
622	1
623	1
624	1
625	1
626	1
627	1
628	1
629	1
62A	1
62B	1
62C	1
62D	1
62E	1
62F	1
630	1
631	1
632	1
633	1
634	1
635	1
636	1
637	1
638	1
639	1
63A	1
63B	1
63C	1
63D	1
63E	1
63F	1
640	1
641	1
642	1
643	1
644	1
645	1
646	1
647	1
648	1
649	1
64A	1
64B	1
64C	1
64D	1
64E	1
64F	1
650	1
651	1
652	1
653	1
654	1
655	1
656	1
657	1
658	1
659	1
65A	1
65B	1
65C	1
65D	1
65E	1
65F	1
660	1
661	1
662	1
663	1
664	1
665	1
666	1
667	1
668	1
669	1
66A	1
66B	1
66C	1
66D	1
66E	1
66F	1
670	1
671	1
672	1
673	1
674	1
675	1
676	1
677	1
678	1
679	1
67A	1
67B	1
67C	1
67D	1
67E	1
67F	1
680	1
681	1
682	1
683	1
684	1
685	1
686	1
687	1
688	1
689	1
68A	1
68B	1
68C	1
68D	1
68E	1
68F	1
690	1
691	1
692	1
693	1
694	1
695	1
696	1
697	1
698	1
699	1
69A	1
69B	1
69C	1
69D	1
69E	1
69F	1
6A0	1
6A1	1
6A2	1
6A3	1
6A4	1
6A5	1
6A6	1
6A7	1
6A8	1
6A9	1
6AA	1
6AB	1
6AC	1
6AD	1
6AE	1
6AF	1
6B0	1
6B1	1
6B2	1
6B3	1
6B4	1
6B5	1
6B6	1
6B7	1
6B8	1
6B9	1
6BA	1
6BB	1
6BC	1
6BD	1
6BE	1
6BF	1
6C0	1
6C1	1
6C2	1
6C3	1
6C4	1
6C5	1
6C6	1
6C7	1
6C8	1
6C9	1
6CA	1
6CB	1
6CC	1
6CD	1
6CE	1
6CF	1
6D0	1
6D1	1
6D2	1
6D3	1
6D4	1
6D5	1
6D6	1
6D7	1
6D8	1
6D9	1
6DA	1
6DB	1
6DC	1
6DD	1
6DE	1
6DF	1
6E0	1
6E1	1
6E2	1
6E3	1
6E4	1
6E5	1
6E6	1
6E7	1
6E8	1
6E9	1
6EA	1
6EB	1
6EC	1
6ED	1
6EE	1
6EF	1
6F0	1
6F1	1
6F2	1
6F3	1
6F4	1
6F5	1
6F6	1
6F7	1
6F8	1
6F9	1
6FA	1
6FB	1
6FC	1
6FD	1
6FE	1
6FF	1
700	1
701	1
702	1
703	1
704	1
705	1
706	1
707	1
708	1
709	1
70A	1
70B	1
70C	1
70D	1
70E	1
70F	1
710	1
711	1
712	1
713	1
714	1
715	1
716	1
717	1
718	1
719	1
71A	1
71B	1
71C	1
71D	1
71E	1
71F	1
720	1
721	1
722	1
723	1
724	1
725	1
726	1
727	1
728	1
729	1
72A	1
72B	1
72C	1
72D	1
72E	1
72F	1
730	1
731	1
732	1
733	1
734	1
735	1
736	1
737	1
738	1
739	1
73A	1
73B	1
73C	1
73D	1
73E	1
73F	1
740	1
741	1
742	1
743	1
744	1
745	1
746	1
747	1
748	1
749	1
74A	1
74B	1
74C	1
74D	1
74E	1
74F	1
750	1
751	1
752	1
753	1
754	1
755	1
756	1
757	1
758	1
759	1
75A	1
75B	1
75C	1
75D	1
75E	1
75F	1
760	1
761	1
762	1
763	1
764	1
765	1
766	1
767	1
768	1
769	1
76A	1
76B	1
76C	1
76D	1
76E	1
76F	1
770	1
771	1
772	1
773	1
774	1
775	1
776	1
777	1
778	1
779	1
77A	1
77B	1
77C	1
77D	1
77E	1
77F	1
780	1
781	1
782	1
783	1
784	1
785	1
786	1
787	1
788	1
789	1
78A	1
78B	1
78C	1
78D	1
78E	1
78F	1
790	1
791	1
792	1
793	1
794	1
795	1
796	1
797	1
798	1
799	1
79A	1
79B	1
79C	1
79D	1
79E	1
79F	1
7A0	1
7A1	1
7A2	1
7A3	1
7A4	1
7A5	1
7A6	1
7A7	1
7A8	1
7A9	1
7AA	1
7AB	1
7AC	1
7AD	1
7AE	1
7AF	1
7B0	1
7B1	1
7B2	1
7B3	1
7B4	1
7B5	1
7B6	1
7B7	1
7B8	1
7B9	1
7BA	1
7BB	1
7BC	1
7BD	1
7BE	1
7BF	1
7C0	1
7C1	1
7C2	1
7C3	1
7C4	1
7C5	1
7C6	1
7C7	1
7C8	1
7C9	1
7CA	1
7CB	1
7CC	1
7CD	1
7CE	1
7CF	1
7D0	1
7D1	1
7D2	1
7D3	1
7D4	1
7D5	1
7D6	1
7D7	1
7D8	1
7D9	1
7DA	1
7DB	1
7DC	1
7DD	1
7DE	1
7DF	1
7E0	1
7E1	1
7E2	1
7E3	1
7E4	1
7E5	1
7E6	1
7E7	1
7E8	1
7E9	1
7EA	1
7EB	1
7EC	1
7ED	1
7EE	1
7EF	1
7F0	1
7F1	1
7F2	1
7F3	1
7F4	1
7F5	1
7F6	1
7F7	1
7F8	1
7F9	1
7FA	1
7FB	1
7FC	1
7FD	1
7FE	1
7FF	1
4E00	1
4E01	1
4E02	1
4E03	1
4E04	1
4E05	1
4E06	1
4E07	1
4E08	1
4E09	1
4E0A	1
4E0B	1
4E0C	1
4E0D	1
4E0E	1
4E0F	1
4E10	1
4E11	1
4E12	1
4E13	1
4E14	1
4E15	1
4E16	1
4E17	1
4E18	1
4E19	1
4E1A	1
4E1B	1
4E1C	1
4E1D	1
4E1E	1
4E1F	1
4E20	1
4E21	1
4E22	1
4E23	1
4E24	1
4E25	1
4E26	1
4E27	1
4E28	1
4E29	1
4E2A	1
4E2B	1
4E2C	1
4E2D	1
4E2E	1
4E2F	1
4E30	1
4E31	1
4E32	1
4E33	1
4E34	1
4E35	1
4E36	1
4E37	1
4E38	1
4E39	1
4E3A	1
4E3B	1
4E3C	1
4E3D	1
4E3E	1
4E3F	1
4E40	1
4E41	1
4E42	1
4E43	1
4E44	1
4E45	1
4E46	1
4E47	1
4E48	1
4E49	1
4E4A	1
4E4B	1
4E4C	1
4E4D	1
4E4E	1
4E4F	1
4E50	1
4E51	1
4E52	1
4E53	1
4E54	1
4E55	1
4E56	1
4E57	1
4E58	1
4E59	1
4E5A	1
4E5B	1
4E5C	1
4E5D	1
4E5E	1
4E5F	1
4E60	1
4E61	1
4E62	1
4E63	1
4E64	1
4E65	1
4E66	1
4E67	1
4E68	1
4E69	1
4E6A	1
4E6B	1
4E6C	1
4E6D	1
4E6E	1
4E6F	1
4E70	1
4E71	1
4E72	1
4E73	1
4E74	1
4E75	1
4E76	1
4E77	1
4E78	1
4E79	1
4E7A	1
4E7B	1
4E7C	1
4E7D	1
4E7E	1
4E7F	1
4E80	1
4E81	1
4E82	1
4E83	1
4E84	1
4E85	1
4E86	1
4E87	1
4E88	1
4E89	1
4E8A	1
4E8B	1
4E8C	1
4E8D	1
4E8E	1
4E8F	1
4E90	1
4E91	1
4E92	1
4E93	1
4E94	1
4E95	1
4E96	1
4E97	1
4E98	1
4E99	1
4E9A	1
4E9B	1
4E9C	1
4E9D	1
4E9E	1
4E9F	1
4EA0	1
4EA1	1
4EA2	1
4EA3	1
4EA4	1
4EA5	1
4EA6	1
4EA7	1
4EA8	1
4EA9	1
4EAA	1
4EAB	1
4EAC	1
4EAD	1
4EAE	1
4EAF	1
4EB0	1
4EB1	1
4EB2	1
4EB3	1
4EB4	1
4EB5	1
4EB6	1
4EB7	1
4EB8	1
4EB9	1
4EBA	1
4EBB	1
4EBC	1
4EBD	1
4EBE	1
4EBF	1
4EC0	1
4EC1	1
4EC2	1
4EC3	1
4EC4	1
4EC5	1
4EC6	1
4EC7	1
4EC8	1
4EC9	1
4ECA	1
4ECB	1
4ECC	1
4ECD	1
4ECE	1
4ECF	1
4ED0	1
4ED1	1
4ED2	1
4ED3	1
4ED4	1
4ED5	1
4ED6	1
4ED7	1
4ED8	1
4ED9	1
4EDA	1
4EDB	1
4EDC	1
4EDD	1
4EDE	1
4EDF	1
4EE0	1
4EE1	1
4EE2	1
4EE3	1
4EE4	1
4EE5	1
4EE6	1
4EE7	1
4EE8	1
4EE9	1
4EEA	1
4EEB	1
4EEC	1
4EED	1
4EEE	1
4EEF	1
4EF0	1
4EF1	1
4EF2	1
4EF3	1
4EF4	1
4EF5	1
4EF6	1
4EF7	1
4EF8	1
4EF9	1
4EFA	1
4EFB	1
4EFC	1
4EFD	1
4EFE	1
4EFF	1
4F00	1
4F01	1
4F02	1
4F03	1
4F04	1
4F05	1
4F06	1
4F07	1
4F08	1
4F09	1
4F0A	1
4F0B	1
4F0C	1
4F0D	1
4F0E	1
4F0F	1
4F10	1
4F11	1
4F12	1
4F13	1
4F14	1
4F15	1
4F16	1
4F17	1
4F18	1
4F19	1
4F1A	1
4F1B	1
4F1C	1
4F1D	1
4F1E	1
4F1F	1
4F20	1
4F21	1
4F22	1
4F23	1
4F24	1
4F25	1
4F26	1
4F27	1
4F28	1
4F29	1
4F2A	1
4F2B	1
4F2C	1
4F2D	1
4F2E	1
4F2F	1
4F30	1
4F31	1
4F32	1
4F33	1
4F34	1
4F35	1
4F36	1
4F37	1
4F38	1
4F39	1
4F3A	1
4F3B	1
4F3C	1
4F3D	1
4F3E	1
4F3F	1
4F40	1
4F41	1
4F42	1
4F43	1
4F44	1
4F45	1
4F46	1
4F47	1
4F48	1
4F49	1
4F4A	1
4F4B	1
4F4C	1
4F4D	1
4F4E	1
4F4F	1
4F50	1
4F51	1
4F52	1
4F53	1
4F54	1
4F55	1
4F56	1
4F57	1
4F58	1
4F59	1
4F5A	1
4F5B	1
4F5C	1
4F5D	1
4F5E	1
4F5F	1
4F60	1
4F61	1
4F62	1
4F63	1
4F64	1
4F65	1
4F66	1
4F67	1
4F68	1
4F69	1
4F6A	1
4F6B	1
4F6C	1
4F6D	1
4F6E	1
4F6F	1
4F70	1
4F71	1
4F72	1
4F73	1
4F74	1
4F75	1
4F76	1
4F77	1
4F78	1
4F79	1
4F7A	1
4F7B	1
4F7C	1
4F7D	1
4F7E	1
4F7F	1
4F80	1
4F81	1
4F82	1
4F83	1
4F84	1
4F85	1
4F86	1
4F87	1
4F88	1
4F89	1
4F8A	1
4F8B	1
4F8C	1
4F8D	1
4F8E	1
4F8F	1
4F90	1
4F91	1
4F92	1
4F93	1
4F94	1
4F95	1
4F96	1
4F97	1
4F98	1
4F99	1
4F9A	1
4F9B	1
4F9C	1
4F9D	1
4F9E	1
4F9F	1
4FA0	1
4FA1	1
4FA2	1
4FA3	1
4FA4	1
4FA5	1
4FA6	1
4FA7	1
4FA8	1
4FA9	1
4FAA	1
4FAB	1
4FAC	1
4FAD	1
4FAE	1
4FAF	1
4FB0	1
4FB1	1
4FB2	1
4FB3	1
4FB4	1
4FB5	1
4FB6	1
4FB7	1
4FB8	1
4FB9	1
4FBA	1
4FBB	1
4FBC	1
4FBD	1
4FBE	1
4FBF	1
4FC0	1
4FC1	1
4FC2	1
4FC3	1
4FC4	1
4FC5	1
4FC6	1
4FC7	1
4FC8	1
4FC9	1
4FCA	1
4FCB	1
4FCC	1
4FCD	1
4FCE	1
4FCF	1
4FD0	1
4FD1	1
4FD2	1
4FD3	1
4FD4	1
4FD5	1
4FD6	1
4FD7	1
4FD8	1
4FD9	1
4FDA	1
4FDB	1
4FDC	1
4FDD	1
4FDE	1
4FDF	1
4FE0	1
4FE1	1
4FE2	1
4FE3	1
4FE4	1
4FE5	1
4FE6	1
4FE7	1
4FE8	1
4FE9	1
4FEA	1
4FEB	1
4FEC	1
4FED	1
4FEE	1
4FEF	1
4FF0	1
4FF1	1
4FF2	1
4FF3	1
4FF4	1
4FF5	1
4FF6	1
4FF7	1
4FF8	1
4FF9	1
4FFA	1
4FFB	1
4FFC	1
4FFD	1
4FFE	1
4FFF	1
DROP TABLE IF EXISTS test.t1;
DROP TABLE IF EXISTS test.t1;
DROP DATABASE test;
CREATE DATABASE test CHARACTER SET utf8mb3;
USE test;
SET NAMES utf8mb3;
Warnings:
Warning	1287	'utf8mb3' is deprecated and will be removed in a future release. Please use utf8mb4 instead
CREATE TABLE test.t1 (a CHAR(4) CHARACTER SET utf8mb3) ENGINE=MyISAM CHARACTER SET utf8mb3;
Warnings:
Warning	1287	'utf8mb3' is deprecated and will be removed in a future release. Please use utf8mb4 instead
Warning	1287	'utf8mb3' is deprecated and will be removed in a future release. Please use utf8mb4 instead
SHOW TABLE STATUS LIKE 't1';
Name	Engine	Version	Row_format	Rows	Avg_row_length	Data_length	Max_data_length	Index_length	Data_free	Auto_increment	Create_time	Update_time	Check_time	Collation	Checksum	Create_options	Comment
t1	MyISAM	#	#	#	#	#	#	#	#	#	#	#	#	utf8mb3_general_ci	#	#	#
LOAD DATA INFILE 
'MYSQL_TEST_DIR/suite/funcs_2/data/charset_utf8.txt' INTO TABLE test.t1;
ALTER TABLE test.t1 CHANGE a a CHAR(4) CHARACTER SET ucs2 COLLATE ucs2_czech_ci;
Warnings:
Warning	1287	'ucs2' is deprecated and will be removed in a future release. Please use utf8mb4 instead
Warning	4079	'ucs2_czech_ci' is a collation of the deprecated character set ucs2. Please consider using utf8mb4 with an appropriate collation instead.
DELETE FROM test.t1 WHERE CHAR_LENGTH(a) <> 1;
SELECT HEX(ORD(a)) AS a_ord, CHAR_LENGTH(a) AS a_len FROM test.t1 ORDER BY a, ORD(a);
a_ord	a_len
85	1
7F	1
80	1
81	1
82	1
83	1
84	1
86	1
87	1
88	1
89	1
8A	1
8B	1
8C	1
8D	1
8E	1
8F	1
90	1
91	1
92	1
93	1
94	1
95	1
96	1
97	1
98	1
99	1
9A	1
9B	1
9C	1
9D	1
9E	1
9F	1
A0	1
300	1
301	1
302	1
303	1
304	1
305	1
306	1
307	1
308	1
309	1
30A	1
30B	1
30C	1
30D	1
30E	1
30F	1
310	1
311	1
312	1
313	1
314	1
315	1
316	1
317	1
318	1
319	1
31A	1
31B	1
31C	1
31D	1
31E	1
31F	1
320	1
321	1
322	1
323	1
324	1
325	1
326	1
327	1
328	1
329	1
32A	1
32B	1
32C	1
32D	1
32E	1
32F	1
330	1
331	1
332	1
333	1
334	1
335	1
336	1
337	1
338	1
339	1
33A	1
33B	1
33C	1
33D	1
33E	1
33F	1
340	1
341	1
342	1
343	1
344	1
345	1
346	1
347	1
348	1
349	1
34A	1
34B	1
34C	1
34D	1
34E	1
34F	1
350	1
351	1
352	1
353	1
354	1
355	1
356	1
357	1
35D	1
35E	1
35F	1
360	1
361	1
362	1
483	1
484	1
485	1
486	1
488	1
489	1
591	1
592	1
593	1
594	1
595	1
596	1
597	1
598	1
599	1
59A	1
59B	1
59C	1
59D	1
59E	1
59F	1
5A0	1
5A1	1
5A3	1
5A4	1
5A5	1
5A6	1
5A7	1
5A8	1
5A9	1
5AA	1
5AB	1
5AC	1
5AD	1
5AE	1
5AF	1
5B0	1
5B1	1
5B2	1
5B3	1
5B4	1
5B5	1
5B6	1
5B7	1
5B8	1
5B9	1
5BB	1
5BC	1
5BD	1
5BF	1
5C1	1
5C2	1
5C4	1
600	1
601	1
602	1
603	1
610	1
611	1
612	1
613	1
614	1
615	1
64B	1
64C	1
64D	1
64E	1
64F	1
650	1
651	1
652	1
653	1
654	1
655	1
656	1
657	1
658	1
670	1
6D6	1
6D7	1
6D8	1
6D9	1
6DA	1
6DB	1
6DC	1
6DD	1
6DE	1
6DF	1
6E0	1
6E1	1
6E2	1
6E3	1
6E4	1
6E7	1
6E8	1
6EA	1
6EB	1
6EC	1
6ED	1
70F	1
711	1
730	1
731	1
732	1
733	1
734	1
735	1
736	1
737	1
738	1
739	1
73A	1
73B	1
73C	1
73D	1
73E	1
73F	1
740	1
741	1
742	1
743	1
744	1
745	1
746	1
747	1
748	1
749	1
74A	1
640	1
60	1
B4	1
384	1
2DC	1
5E	1
AF	1
2D8	1
2D9	1
A8	1
385	1
2DA	1
2DD	1
B8	1
2DB	1
5F	1
AD	1
2D	1
58A	1
2C	1
55D	1
60C	1
60D	1
66B	1
66C	1
3B	1
37E	1
61B	1
3A	1
589	1
703	1
704	1
705	1
706	1
707	1
708	1
21	1
A1	1
55C	1
3F	1
BF	1
55E	1
61F	1
709	1
2E	1
6D4	1
701	1
702	1
B7	1
387	1
700	1
27	1
22	1
AB	1
BB	1
28	1
29	1
5B	1
7B	1
7D	1
A7	1
B6	1
A9	1
AE	1
40	1
2A	1
66D	1
2F	1
26	1
23	1
25	1
66A	1
55A	1
55B	1
55F	1
5BE	1
5C0	1
5C3	1
5F3	1
5F4	1
70A	1
70B	1
70C	1
70D	1
2B9	1
374	1
375	1
2BA	1
2C2	1
2C3	1
2C4	1
2C5	1
2C6	1
2C7	1
2C8	1
2C9	1
2CA	1
2CB	1
2CC	1
2CD	1
2CE	1
2CF	1
2D2	1
2D3	1
2D4	1
2D5	1
2D6	1
2D7	1
2DE	1
2DF	1
2E5	1
2E6	1
2E7	1
2E8	1
2E9	1
2EA	1
2EB	1
2EC	1
2ED	1
2EF	1
2F0	1
2F1	1
2F2	1
2F3	1
2F4	1
2F5	1
2F6	1
2F7	1
2F8	1
2F9	1
2FA	1
2FB	1
2FC	1
2FD	1
2FE	1
2FF	1
B0	1
482	1
60E	1
60F	1
6E9	1
3F6	1
2B	1
B1	1
F7	1
D7	1
3C	1
3D	1
3E	1
AC	1
7C	1
A6	1
7E	1
2D0	1
2D1	1
A4	1
A2	1
24	1
A3	1
A5	1
30	1
660	1
6F0	1
31	1
B9	1
661	1
6F1	1
BD	1
BC	1
32	1
B2	1
662	1
6F2	1
33	1
B3	1
663	1
6F3	1
BE	1
34	1
664	1
6F4	1
35	1
665	1
6F5	1
36	1
666	1
6F6	1
37	1
667	1
6F7	1
38	1
668	1
6F8	1
39	1
669	1
6F9	1
41	1
61	1
AA	1
C0	1
C1	1
C2	1
C3	1
C4	1
C5	1
E0	1
E1	1
E2	1
E3	1
E4	1
E5	1
100	1
101	1
102	1
103	1
104	1
105	1
1CD	1
1CE	1
1DE	1
1DF	1
1E0	1
1E1	1
1FA	1
1FB	1
200	1
201	1
202	1
203	1
226	1
227	1
363	1
C6	1
E6	1
1E2	1
1E3	1
1FC	1
1FD	1
250	1
251	1
252	1
42	1
62	1
299	1
180	1
181	1
253	1
182	1
183	1
43	1
63	1
C7	1
E7	1
106	1
107	1
108	1
109	1
10A	1
10B	1
368	1
10C	1
10D	1
187	1
188	1
255	1
44	1
64	1
10E	1
10F	1
369	1
1C4	1
1C5	1
1C6	1
1F1	1
1F2	1
1F3	1
2A3	1
2A5	1
2A4	1
110	1
111	1
189	1
256	1
18A	1
257	1
18B	1
18C	1
221	1
D0	1
F0	1
45	1
65	1
C8	1
C9	1
CA	1
CB	1
E8	1
E9	1
EA	1
EB	1
112	1
113	1
114	1
115	1
116	1
117	1
118	1
119	1
11A	1
11B	1
204	1
205	1
206	1
207	1
228	1
229	1
364	1
18E	1
1DD	1
18F	1
259	1
190	1
25B	1
258	1
25A	1
25C	1
25D	1
25E	1
29A	1
264	1
46	1
66	1
2A9	1
191	1
192	1
47	1
67	1
11C	1
11D	1
11E	1
11F	1
120	1
121	1
122	1
123	1
1E6	1
1E7	1
1F4	1
1F5	1
261	1
262	1
1E4	1
1E5	1
193	1
260	1
29B	1
194	1
263	1
2E0	1
1A2	1
1A3	1
48	1
68	1
124	1
125	1
21E	1
21F	1
2B0	1
36A	1
29C	1
195	1
1F6	1
126	1
127	1
266	1
2B1	1
267	1
2BB	1
2BD	1
49	1
69	1
CC	1
CD	1
CE	1
CF	1
EC	1
ED	1
EE	1
EF	1
128	1
129	1
12A	1
12B	1
12C	1
12D	1
12E	1
12F	1
130	1
1CF	1
1D0	1
208	1
209	1
20A	1
20B	1
365	1
132	1
133	1
131	1
26A	1
197	1
268	1
196	1
269	1
4A	1
6A	1
134	1
135	1
1F0	1
2B2	1
29D	1
25F	1
284	1
4B	1
6B	1
136	1
137	1
1E8	1
1E9	1
198	1
199	1
29E	1
4C	1
6C	1
139	1
13A	1
13B	1
13C	1
13D	1
13E	1
2E1	1
13F	1
140	1
1C7	1
1C8	1
1C9	1
2AA	1
2AB	1
29F	1
141	1
142	1
19A	1
26B	1
26C	1
26D	1
234	1
26E	1
19B	1
28E	1
4D	1
6D	1
36B	1
271	1
4E	1
6E	1
D1	1
F1	1
143	1
144	1
145	1
146	1
147	1
148	1
1F8	1
1F9	1
1CA	1
1CB	1
1CC	1
274	1
19D	1
272	1
19E	1
220	1
273	1
235	1
14A	1
14B	1
4F	1
6F	1
BA	1
D2	1
D3	1
D4	1
D5	1
D6	1
F2	1
F3	1
F4	1
F5	1
F6	1
14C	1
14D	1
14E	1
14F	1
150	1
151	1
1A0	1
1A1	1
1D1	1
1D2	1
1EA	1
1EB	1
1EC	1
1ED	1
20C	1
20D	1
20E	1
20F	1
22A	1
22B	1
22C	1
22D	1
22E	1
22F	1
230	1
231	1
366	1
152	1
153	1
276	1
D8	1
F8	1
1FE	1
1FF	1
186	1
254	1
19F	1
275	1
277	1
222	1
223	1
50	1
70	1
1A4	1
1A5	1
278	1
51	1
71	1
2A0	1
138	1
52	1
72	1
154	1
155	1
156	1
157	1
210	1
211	1
212	1
213	1
2B3	1
36C	1
158	1
159	1
1A6	1
280	1
279	1
2B4	1
27A	1
27B	1
2B5	1
27C	1
27D	1
27E	1
27F	1
281	1
2B6	1
53	1
73	1
15A	1
15B	1
15C	1
15D	1
15E	1
15F	1
17F	1
218	1
219	1
2E2	1
DF	1
160	1
161	1
282	1
1A9	1
283	1
1AA	1
285	1
286	1
54	1
74	1
162	1
163	1
164	1
165	1
21A	1
21B	1
36D	1
2A8	1
1BE	1
2A6	1
2A7	1
166	1
167	1
1AB	1
1AC	1
1AD	1
1AE	1
288	1
236	1
287	1
55	1
75	1
D9	1
DA	1
DB	1
DC	1
F9	1
FA	1
FB	1
FC	1
168	1
169	1
16A	1
16B	1
16C	1
16D	1
16E	1
16F	1
170	1
171	1
172	1
173	1
1AF	1
1B0	1
1D3	1
1D4	1
1D5	1
1D6	1
1D7	1
1D8	1
1D9	1
1DA	1
1DB	1
1DC	1
214	1
215	1
216	1
217	1
367	1
289	1
265	1
2AE	1
2AF	1
19C	1
26F	1
270	1
1B1	1
28A	1
56	1
76	1
36E	1
1B2	1
28B	1
28C	1
57	1
77	1
174	1
175	1
2B7	1
28D	1
58	1
78	1
2E3	1
36F	1
59	1
79	1
DD	1
FD	1
FF	1
176	1
177	1
178	1
232	1
233	1
2B8	1
28F	1
1B3	1
1B4	1
5A	1
7A	1
179	1
17A	1
17B	1
17C	1
18D	1
17D	1
17E	1
1B5	1
1B6	1
224	1
225	1
290	1
291	1
1B7	1
1EE	1
1EF	1
292	1
1B8	1
1B9	1
1BA	1
293	1
21C	1
21D	1
DE	1
FE	1
1BF	1
1F7	1
1BB	1
1A7	1
1A8	1
1BC	1
1BD	1
184	1
185	1
294	1
2C0	1
2BC	1
149	1
2EE	1
2BE	1
295	1
2E4	1
2BF	1
2C1	1
2A1	1
2A2	1
296	1
1C0	1
1C1	1
1C2	1
1C3	1
297	1
298	1
2AC	1
2AD	1
386	1
391	1
3AC	1
3B1	1
392	1
3B2	1
3D0	1
393	1
3B3	1
394	1
3B4	1
388	1
395	1
3AD	1
3B5	1
3F5	1
3DC	1
3DD	1
3DA	1
3DB	1
396	1
3B6	1
389	1
397	1
3AE	1
3B7	1
398	1
3B8	1
3D1	1
3F4	1
37A	1
38A	1
390	1
399	1
3AA	1
3AF	1
3B9	1
3CA	1
3F3	1
39A	1
3BA	1
3F0	1
3D7	1
39B	1
3BB	1
B5	1
39C	1
3BC	1
39D	1
3BD	1
39E	1
3BE	1
38C	1
39F	1
3BF	1
3CC	1
3A0	1
3C0	1
3D6	1
3DE	1
3DF	1
3D8	1
3D9	1
3A1	1
3C1	1
3F1	1
3A3	1
3C2	1
3C3	1
3F2	1
3F9	1
3A4	1
3C4	1
38E	1
3A5	1
3AB	1
3B0	1
3C5	1
3CB	1
3CD	1
3D2	1
3D3	1
3D4	1
3A6	1
3C6	1
3D5	1
3A7	1
3C7	1
3A8	1
3C8	1
38F	1
3A9	1
3C9	1
3CE	1
3E0	1
3E1	1
3F7	1
3F8	1
3FA	1
3FB	1
3E2	1
3E3	1
3E4	1
3E5	1
3E6	1
3E7	1
3E8	1
3E9	1
3EA	1
3EB	1
3EC	1
3ED	1
3EE	1
3EF	1
410	1
430	1
4D0	1
4D1	1
4D2	1
4D3	1
4D8	1
4D9	1
4DA	1
4DB	1
4D4	1
4D5	1
411	1
431	1
412	1
432	1
413	1
433	1
490	1
491	1
492	1
493	1
494	1
495	1
414	1
434	1
500	1
501	1
402	1
452	1
502	1
503	1
403	1
453	1
498	1
499	1
400	1
401	1
415	1
435	1
450	1
451	1
4D6	1
4D7	1
404	1
454	1
416	1
436	1
4C1	1
4C2	1
4DC	1
4DD	1
496	1
497	1
417	1
437	1
504	1
505	1
4DE	1
4DF	1
405	1
455	1
4E0	1
4E1	1
506	1
507	1
40D	1
418	1
438	1
45D	1
4E2	1
4E3	1
48A	1
48B	1
4E4	1
4E5	1
406	1
456	1
407	1
457	1
419	1
439	1
408	1
458	1
41A	1
43A	1
49A	1
49B	1
4C3	1
4C4	1
4A0	1
4A1	1
49E	1
49F	1
49C	1
49D	1
41B	1
43B	1
4C5	1
4C6	1
409	1
459	1
508	1
509	1
41C	1
43C	1
4CD	1
4CE	1
41D	1
43D	1
4C9	1
4CA	1
4A2	1
4A3	1
4C7	1
4C8	1
4A4	1
4A5	1
40A	1
45A	1
50A	1
50B	1
41E	1
43E	1
4E6	1
4E7	1
4E8	1
4E9	1
4EA	1
4EB	1
41F	1
43F	1
4A6	1
4A7	1
480	1
481	1
420	1
440	1
48E	1
48F	1
421	1
441	1
50C	1
50D	1
4AA	1
4AB	1
422	1
442	1
50E	1
50F	1
4AC	1
4AD	1
40B	1
45B	1
40C	1
45C	1
423	1
443	1
4EE	1
4EF	1
40E	1
45E	1
4F0	1
4F1	1
4F2	1
4F3	1
4AE	1
4AF	1
4B0	1
4B1	1
478	1
479	1
424	1
444	1
425	1
445	1
4B2	1
4B3	1
4BA	1
4BB	1
460	1
461	1
47E	1
47F	1
47C	1
47D	1
47A	1
47B	1
426	1
446	1
4B4	1
4B5	1
427	1
447	1
4F4	1
4F5	1
4B6	1
4B7	1
4CB	1
4CC	1
4B8	1
4B9	1
4BC	1
4BD	1
4BE	1
4BF	1
40F	1
45F	1
428	1
448	1
429	1
449	1
42A	1
44A	1
42B	1
44B	1
4F8	1
4F9	1
42C	1
44C	1
48C	1
48D	1
462	1
463	1
42D	1
44D	1
4EC	1
4ED	1
42E	1
44E	1
42F	1
44F	1
464	1
465	1
466	1
467	1
46A	1
46B	1
468	1
469	1
46C	1
46D	1
46E	1
46F	1
470	1
471	1
472	1
473	1
474	1
475	1
476	1
477	1
4A8	1
4A9	1
4C0	1
531	1
561	1
532	1
562	1
533	1
563	1
534	1
564	1
535	1
565	1
587	1
536	1
566	1
537	1
567	1
538	1
568	1
539	1
569	1
53A	1
56A	1
53B	1
56B	1
53C	1
56C	1
53D	1
56D	1
53E	1
56E	1
53F	1
56F	1
540	1
570	1
541	1
571	1
542	1
572	1
543	1
573	1
544	1
574	1
545	1
575	1
546	1
576	1
547	1
577	1
548	1
578	1
549	1
579	1
54A	1
57A	1
54B	1
57B	1
54C	1
57C	1
54D	1
57D	1
54E	1
57E	1
54F	1
57F	1
550	1
580	1
551	1
581	1
552	1
582	1
553	1
583	1
554	1
584	1
555	1
585	1
556	1
586	1
559	1
5D0	1
5D1	1
5D2	1
5D3	1
5D4	1
5D5	1
5F0	1
5F1	1
5D6	1
5D7	1
5D8	1
5D9	1
5F2	1
5DA	1
5DB	1
5DC	1
5DD	1
5DE	1
5DF	1
5E0	1
5E1	1
5E2	1
5E3	1
5E4	1
5E5	1
5E6	1
5E7	1
5E8	1
5E9	1
5EA	1
621	1
674	1
6FD	1
622	1
623	1
672	1
671	1
624	1
625	1
673	1
626	1
627	1
675	1
66E	1
628	1
67B	1
67E	1
680	1
629	1
62A	1
62B	1
679	1
67A	1
67C	1
67D	1
67F	1
62C	1
683	1
684	1
686	1
6BF	1
687	1
62D	1
62E	1
681	1
682	1
685	1
62F	1
630	1
688	1
689	1
68A	1
68B	1
68C	1
68D	1
68E	1
68F	1
690	1
6EE	1
631	1
632	1
691	1
692	1
693	1
694	1
695	1
696	1
697	1
698	1
699	1
6EF	1
633	1
634	1
69A	1
69B	1
69C	1
6FA	1
635	1
636	1
69D	1
69E	1
6FB	1
637	1
638	1
69F	1
639	1
63A	1
6A0	1
6FC	1
641	1
6A1	1
6A2	1
6A3	1
6A4	1
6A5	1
6A6	1
66F	1
642	1
6A7	1
6A8	1
643	1
6A9	1
6AA	1
6AB	1
6AC	1
6AD	1
6AE	1
6AF	1
6B0	1
6B1	1
6B2	1
6B3	1
6B4	1
644	1
6B5	1
6B6	1
6B7	1
6B8	1
645	1
6FE	1
646	1
6BA	1
6BB	1
6BC	1
6BD	1
6B9	1
647	1
6BE	1
6C1	1
6C2	1
6C3	1
6FF	1
6C0	1
6D5	1
648	1
6E5	1
676	1
6C4	1
6C5	1
6C6	1
6C7	1
677	1
6C8	1
6C9	1
6CA	1
6CB	1
6CF	1
649	1
64A	1
6E6	1
678	1
6CC	1
6CD	1
6CE	1
6D0	1
6D1	1
6D2	1
6D3	1
710	1
712	1
72D	1
713	1
714	1
72E	1
716	1
715	1
72F	1
717	1
718	1
719	1
74D	1
71A	1
71B	1
71C	1
71D	1
71E	1
71F	1
74E	1
720	1
721	1
722	1
723	1
724	1
725	1
726	1
727	1
74F	1
728	1
729	1
72A	1
72B	1
72C	1
780	1
799	1
79A	1
781	1
782	1
783	1
79C	1
784	1
785	1
786	1
787	1
7A2	1
7A3	1
788	1
7A5	1
789	1
78A	1
78B	1
79B	1
78C	1
798	1
7A0	1
7A1	1
78D	1
78E	1
7A4	1
78F	1
790	1
79D	1
79E	1
79F	1
791	1
792	1
793	1
794	1
795	1
796	1
797	1
7B1	1
7A6	1
7A7	1
7A8	1
7A9	1
7AA	1
7AB	1
7AC	1
7AD	1
7AE	1
7AF	1
7B0	1
4E00	1
4E01	1
4E02	1
4E03	1
4E04	1
4E05	1
4E06	1
4E07	1
4E08	1
4E09	1
4E0A	1
4E0B	1
4E0C	1
4E0D	1
4E0E	1
4E0F	1
4E10	1
4E11	1
4E12	1
4E13	1
4E14	1
4E15	1
4E16	1
4E17	1
4E18	1
4E19	1
4E1A	1
4E1B	1
4E1C	1
4E1D	1
4E1E	1
4E1F	1
4E20	1
4E21	1
4E22	1
4E23	1
4E24	1
4E25	1
4E26	1
4E27	1
4E28	1
4E29	1
4E2A	1
4E2B	1
4E2C	1
4E2D	1
4E2E	1
4E2F	1
4E30	1
4E31	1
4E32	1
4E33	1
4E34	1
4E35	1
4E36	1
4E37	1
4E38	1
4E39	1
4E3A	1
4E3B	1
4E3C	1
4E3D	1
4E3E	1
4E3F	1
4E40	1
4E41	1
4E42	1
4E43	1
4E44	1
4E45	1
4E46	1
4E47	1
4E48	1
4E49	1
4E4A	1
4E4B	1
4E4C	1
4E4D	1
4E4E	1
4E4F	1
4E50	1
4E51	1
4E52	1
4E53	1
4E54	1
4E55	1
4E56	1
4E57	1
4E58	1
4E59	1
4E5A	1
4E5B	1
4E5C	1
4E5D	1
4E5E	1
4E5F	1
4E60	1
4E61	1
4E62	1
4E63	1
4E64	1
4E65	1
4E66	1
4E67	1
4E68	1
4E69	1
4E6A	1
4E6B	1
4E6C	1
4E6D	1
4E6E	1
4E6F	1
4E70	1
4E71	1
4E72	1
4E73	1
4E74	1
4E75	1
4E76	1
4E77	1
4E78	1
4E79	1
4E7A	1
4E7B	1
4E7C	1
4E7D	1
4E7E	1
4E7F	1
4E80	1
4E81	1
4E82	1
4E83	1
4E84	1
4E85	1
4E86	1
4E87	1
4E88	1
4E89	1
4E8A	1
4E8B	1
4E8C	1
4E8D	1
4E8E	1
4E8F	1
4E90	1
4E91	1
4E92	1
4E93	1
4E94	1
4E95	1
4E96	1
4E97	1
4E98	1
4E99	1
4E9A	1
4E9B	1
4E9C	1
4E9D	1
4E9E	1
4E9F	1
4EA0	1
4EA1	1
4EA2	1
4EA3	1
4EA4	1
4EA5	1
4EA6	1
4EA7	1
4EA8	1
4EA9	1
4EAA	1
4EAB	1
4EAC	1
4EAD	1
4EAE	1
4EAF	1
4EB0	1
4EB1	1
4EB2	1
4EB3	1
4EB4	1
4EB5	1
4EB6	1
4EB7	1
4EB8	1
4EB9	1
4EBA	1
4EBB	1
4EBC	1
4EBD	1
4EBE	1
4EBF	1
4EC0	1
4EC1	1
4EC2	1
4EC3	1
4EC4	1
4EC5	1
4EC6	1
4EC7	1
4EC8	1
4EC9	1
4ECA	1
4ECB	1
4ECC	1
4ECD	1
4ECE	1
4ECF	1
4ED0	1
4ED1	1
4ED2	1
4ED3	1
4ED4	1
4ED5	1
4ED6	1
4ED7	1
4ED8	1
4ED9	1
4EDA	1
4EDB	1
4EDC	1
4EDD	1
4EDE	1
4EDF	1
4EE0	1
4EE1	1
4EE2	1
4EE3	1
4EE4	1
4EE5	1
4EE6	1
4EE7	1
4EE8	1
4EE9	1
4EEA	1
4EEB	1
4EEC	1
4EED	1
4EEE	1
4EEF	1
4EF0	1
4EF1	1
4EF2	1
4EF3	1
4EF4	1
4EF5	1
4EF6	1
4EF7	1
4EF8	1
4EF9	1
4EFA	1
4EFB	1
4EFC	1
4EFD	1
4EFE	1
4EFF	1
4F00	1
4F01	1
4F02	1
4F03	1
4F04	1
4F05	1
4F06	1
4F07	1
4F08	1
4F09	1
4F0A	1
4F0B	1
4F0C	1
4F0D	1
4F0E	1
4F0F	1
4F10	1
4F11	1
4F12	1
4F13	1
4F14	1
4F15	1
4F16	1
4F17	1
4F18	1
4F19	1
4F1A	1
4F1B	1
4F1C	1
4F1D	1
4F1E	1
4F1F	1
4F20	1
4F21	1
4F22	1
4F23	1
4F24	1
4F25	1
4F26	1
4F27	1
4F28	1
4F29	1
4F2A	1
4F2B	1
4F2C	1
4F2D	1
4F2E	1
4F2F	1
4F30	1
4F31	1
4F32	1
4F33	1
4F34	1
4F35	1
4F36	1
4F37	1
4F38	1
4F39	1
4F3A	1
4F3B	1
4F3C	1
4F3D	1
4F3E	1
4F3F	1
4F40	1
4F41	1
4F42	1
4F43	1
4F44	1
4F45	1
4F46	1
4F47	1
4F48	1
4F49	1
4F4A	1
4F4B	1
4F4C	1
4F4D	1
4F4E	1
4F4F	1
4F50	1
4F51	1
4F52	1
4F53	1
4F54	1
4F55	1
4F56	1
4F57	1
4F58	1
4F59	1
4F5A	1
4F5B	1
4F5C	1
4F5D	1
4F5E	1
4F5F	1
4F60	1
4F61	1
4F62	1
4F63	1
4F64	1
4F65	1
4F66	1
4F67	1
4F68	1
4F69	1
4F6A	1
4F6B	1
4F6C	1
4F6D	1
4F6E	1
4F6F	1
4F70	1
4F71	1
4F72	1
4F73	1
4F74	1
4F75	1
4F76	1
4F77	1
4F78	1
4F79	1
4F7A	1
4F7B	1
4F7C	1
4F7D	1
4F7E	1
4F7F	1
4F80	1
4F81	1
4F82	1
4F83	1
4F84	1
4F85	1
4F86	1
4F87	1
4F88	1
4F89	1
4F8A	1
4F8B	1
4F8C	1
4F8D	1
4F8E	1
4F8F	1
4F90	1
4F91	1
4F92	1
4F93	1
4F94	1
4F95	1
4F96	1
4F97	1
4F98	1
4F99	1
4F9A	1
4F9B	1
4F9C	1
4F9D	1
4F9E	1
4F9F	1
4FA0	1
4FA1	1
4FA2	1
4FA3	1
4FA4	1
4FA5	1
4FA6	1
4FA7	1
4FA8	1
4FA9	1
4FAA	1
4FAB	1
4FAC	1
4FAD	1
4FAE	1
4FAF	1
4FB0	1
4FB1	1
4FB2	1
4FB3	1
4FB4	1
4FB5	1
4FB6	1
4FB7	1
4FB8	1
4FB9	1
4FBA	1
4FBB	1
4FBC	1
4FBD	1
4FBE	1
4FBF	1
4FC0	1
4FC1	1
4FC2	1
4FC3	1
4FC4	1
4FC5	1
4FC6	1
4FC7	1
4FC8	1
4FC9	1
4FCA	1
4FCB	1
4FCC	1
4FCD	1
4FCE	1
4FCF	1
4FD0	1
4FD1	1
4FD2	1
4FD3	1
4FD4	1
4FD5	1
4FD6	1
4FD7	1
4FD8	1
4FD9	1
4FDA	1
4FDB	1
4FDC	1
4FDD	1
4FDE	1
4FDF	1
4FE0	1
4FE1	1
4FE2	1
4FE3	1
4FE4	1
4FE5	1
4FE6	1
4FE7	1
4FE8	1
4FE9	1
4FEA	1
4FEB	1
4FEC	1
4FED	1
4FEE	1
4FEF	1
4FF0	1
4FF1	1
4FF2	1
4FF3	1
4FF4	1
4FF5	1
4FF6	1
4FF7	1
4FF8	1
4FF9	1
4FFA	1
4FFB	1
4FFC	1
4FFD	1
4FFE	1
4FFF	1
237	1
238	1
239	1
23A	1
23B	1
23C	1
23D	1
23E	1
23F	1
240	1
241	1
242	1
243	1
244	1
245	1
246	1
247	1
248	1
249	1
24A	1
24B	1
24C	1
24D	1
24E	1
24F	1
358	1
359	1
35A	1
35B	1
35C	1
370	1
371	1
372	1
373	1
376	1
377	1
378	1
379	1
37B	1
37C	1
37D	1
37F	1
380	1
381	1
382	1
383	1
38B	1
38D	1
3A2	1
3CF	1
3FC	1
3FD	1
3FE	1
3FF	1
487	1
4CF	1
4F6	1
4F7	1
4FA	1
4FB	1
4FC	1
4FD	1
4FE	1
4FF	1
510	1
511	1
512	1
513	1
514	1
515	1
516	1
517	1
518	1
519	1
51A	1
51B	1
51C	1
51D	1
51E	1
51F	1
520	1
521	1
522	1
523	1
524	1
525	1
526	1
527	1
528	1
529	1
52A	1
52B	1
52C	1
52D	1
52E	1
52F	1
530	1
557	1
558	1
560	1
588	1
58B	1
58C	1
58D	1
58E	1
58F	1
590	1
5A2	1
5BA	1
5C5	1
5C6	1
5C7	1
5C8	1
5C9	1
5CA	1
5CB	1
5CC	1
5CD	1
5CE	1
5CF	1
5EB	1
5EC	1
5ED	1
5EE	1
5EF	1
5F5	1
5F6	1
5F7	1
5F8	1
5F9	1
5FA	1
5FB	1
5FC	1
5FD	1
5FE	1
5FF	1
604	1
605	1
606	1
607	1
608	1
609	1
60A	1
60B	1
616	1
617	1
618	1
619	1
61A	1
61C	1
61D	1
61E	1
620	1
63B	1
63C	1
63D	1
63E	1
63F	1
659	1
65A	1
65B	1
65C	1
65D	1
65E	1
65F	1
70E	1
74B	1
74C	1
750	1
751	1
752	1
753	1
754	1
755	1
756	1
757	1
758	1
759	1
75A	1
75B	1
75C	1
75D	1
75E	1
75F	1
760	1
761	1
762	1
763	1
764	1
765	1
766	1
767	1
768	1
769	1
76A	1
76B	1
76C	1
76D	1
76E	1
76F	1
770	1
771	1
772	1
773	1
774	1
775	1
776	1
777	1
778	1
779	1
77A	1
77B	1
77C	1
77D	1
77E	1
77F	1
7B2	1
7B3	1
7B4	1
7B5	1
7B6	1
7B7	1
7B8	1
7B9	1
7BA	1
7BB	1
7BC	1
7BD	1
7BE	1
7BF	1
7C0	1
7C1	1
7C2	1
7C3	1
7C4	1
7C5	1
7C6	1
7C7	1
7C8	1
7C9	1
7CA	1
7CB	1
7CC	1
7CD	1
7CE	1
7CF	1
7D0	1
7D1	1
7D2	1
7D3	1
7D4	1
7D5	1
7D6	1
7D7	1
7D8	1
7D9	1
7DA	1
7DB	1
7DC	1
7DD	1
7DE	1
7DF	1
7E0	1
7E1	1
7E2	1
7E3	1
7E4	1
7E5	1
7E6	1
7E7	1
7E8	1
7E9	1
7EA	1
7EB	1
7EC	1
7ED	1
7EE	1
7EF	1
7F0	1
7F1	1
7F2	1
7F3	1
7F4	1
7F5	1
7F6	1
7F7	1
7F8	1
7F9	1
7FA	1
7FB	1
7FC	1
7FD	1
7FE	1
7FF	1
DROP TABLE IF EXISTS test.t1;
DROP TABLE IF EXISTS test.t1;
DROP DATABASE test;
CREATE DATABASE test CHARACTER SET utf8mb3;
USE test;
SET NAMES utf8mb3;
Warnings:
Warning	1287	'utf8mb3' is deprecated and will be removed in a future release. Please use utf8mb4 instead
CREATE TABLE test.t1 (a CHAR(4) CHARACTER SET utf8mb3) ENGINE=MyISAM CHARACTER SET utf8mb3;
Warnings:
Warning	1287	'utf8mb3' is deprecated and will be removed in a future release. Please use utf8mb4 instead
Warning	1287	'utf8mb3' is deprecated and will be removed in a future release. Please use utf8mb4 instead
SHOW TABLE STATUS LIKE 't1';
Name	Engine	Version	Row_format	Rows	Avg_row_length	Data_length	Max_data_length	Index_length	Data_free	Auto_increment	Create_time	Update_time	Check_time	Collation	Checksum	Create_options	Comment
t1	MyISAM	#	#	#	#	#	#	#	#	#	#	#	#	utf8mb3_general_ci	#	#	#
LOAD DATA INFILE 
'MYSQL_TEST_DIR/suite/funcs_2/data/charset_utf8.txt' INTO TABLE test.t1;
ALTER TABLE test.t1 CHANGE a a CHAR(4) CHARACTER SET ucs2 COLLATE ucs2_danish_ci;
Warnings:
Warning	1287	'ucs2' is deprecated and will be removed in a future release. Please use utf8mb4 instead
Warning	4079	'ucs2_danish_ci' is a collation of the deprecated character set ucs2. Please consider using utf8mb4 with an appropriate collation instead.
DELETE FROM test.t1 WHERE CHAR_LENGTH(a) <> 1;
SELECT HEX(ORD(a)) AS a_ord, CHAR_LENGTH(a) AS a_len FROM test.t1 ORDER BY a, ORD(a);
a_ord	a_len
85	1
7F	1
80	1
81	1
82	1
83	1
84	1
86	1
87	1
88	1
89	1
8A	1
8B	1
8C	1
8D	1
8E	1
8F	1
90	1
91	1
92	1
93	1
94	1
95	1
96	1
97	1
98	1
99	1
9A	1
9B	1
9C	1
9D	1
9E	1
9F	1
A0	1
300	1
301	1
302	1
303	1
304	1
305	1
306	1
307	1
308	1
309	1
30A	1
30B	1
30C	1
30D	1
30E	1
30F	1
310	1
311	1
312	1
313	1
314	1
315	1
316	1
317	1
318	1
319	1
31A	1
31B	1
31C	1
31D	1
31E	1
31F	1
320	1
321	1
322	1
323	1
324	1
325	1
326	1
327	1
328	1
329	1
32A	1
32B	1
32C	1
32D	1
32E	1
32F	1
330	1
331	1
332	1
333	1
334	1
335	1
336	1
337	1
338	1
339	1
33A	1
33B	1
33C	1
33D	1
33E	1
33F	1
340	1
341	1
342	1
343	1
344	1
345	1
346	1
347	1
348	1
349	1
34A	1
34B	1
34C	1
34D	1
34E	1
34F	1
350	1
351	1
352	1
353	1
354	1
355	1
356	1
357	1
35D	1
35E	1
35F	1
360	1
361	1
362	1
483	1
484	1
485	1
486	1
488	1
489	1
591	1
592	1
593	1
594	1
595	1
596	1
597	1
598	1
599	1
59A	1
59B	1
59C	1
59D	1
59E	1
59F	1
5A0	1
5A1	1
5A3	1
5A4	1
5A5	1
5A6	1
5A7	1
5A8	1
5A9	1
5AA	1
5AB	1
5AC	1
5AD	1
5AE	1
5AF	1
5B0	1
5B1	1
5B2	1
5B3	1
5B4	1
5B5	1
5B6	1
5B7	1
5B8	1
5B9	1
5BB	1
5BC	1
5BD	1
5BF	1
5C1	1
5C2	1
5C4	1
600	1
601	1
602	1
603	1
610	1
611	1
612	1
613	1
614	1
615	1
64B	1
64C	1
64D	1
64E	1
64F	1
650	1
651	1
652	1
653	1
654	1
655	1
656	1
657	1
658	1
670	1
6D6	1
6D7	1
6D8	1
6D9	1
6DA	1
6DB	1
6DC	1
6DD	1
6DE	1
6DF	1
6E0	1
6E1	1
6E2	1
6E3	1
6E4	1
6E7	1
6E8	1
6EA	1
6EB	1
6EC	1
6ED	1
70F	1
711	1
730	1
731	1
732	1
733	1
734	1
735	1
736	1
737	1
738	1
739	1
73A	1
73B	1
73C	1
73D	1
73E	1
73F	1
740	1
741	1
742	1
743	1
744	1
745	1
746	1
747	1
748	1
749	1
74A	1
640	1
60	1
B4	1
384	1
2DC	1
5E	1
AF	1
2D8	1
2D9	1
A8	1
385	1
2DA	1
2DD	1
B8	1
2DB	1
5F	1
AD	1
2D	1
58A	1
2C	1
55D	1
60C	1
60D	1
66B	1
66C	1
3B	1
37E	1
61B	1
3A	1
589	1
703	1
704	1
705	1
706	1
707	1
708	1
21	1
A1	1
55C	1
3F	1
BF	1
55E	1
61F	1
709	1
2E	1
6D4	1
701	1
702	1
B7	1
387	1
700	1
27	1
22	1
AB	1
BB	1
28	1
29	1
5B	1
7B	1
7D	1
A7	1
B6	1
A9	1
AE	1
40	1
2A	1
66D	1
2F	1
26	1
23	1
25	1
66A	1
55A	1
55B	1
55F	1
5BE	1
5C0	1
5C3	1
5F3	1
5F4	1
70A	1
70B	1
70C	1
70D	1
2B9	1
374	1
375	1
2BA	1
2C2	1
2C3	1
2C4	1
2C5	1
2C6	1
2C7	1
2C8	1
2C9	1
2CA	1
2CB	1
2CC	1
2CD	1
2CE	1
2CF	1
2D2	1
2D3	1
2D4	1
2D5	1
2D6	1
2D7	1
2DE	1
2DF	1
2E5	1
2E6	1
2E7	1
2E8	1
2E9	1
2EA	1
2EB	1
2EC	1
2ED	1
2EF	1
2F0	1
2F1	1
2F2	1
2F3	1
2F4	1
2F5	1
2F6	1
2F7	1
2F8	1
2F9	1
2FA	1
2FB	1
2FC	1
2FD	1
2FE	1
2FF	1
B0	1
482	1
60E	1
60F	1
6E9	1
3F6	1
2B	1
B1	1
F7	1
D7	1
3C	1
3D	1
3E	1
AC	1
7C	1
A6	1
7E	1
2D0	1
2D1	1
A4	1
A2	1
24	1
A3	1
A5	1
30	1
660	1
6F0	1
31	1
B9	1
661	1
6F1	1
BD	1
BC	1
32	1
B2	1
662	1
6F2	1
33	1
B3	1
663	1
6F3	1
BE	1
34	1
664	1
6F4	1
35	1
665	1
6F5	1
36	1
666	1
6F6	1
37	1
667	1
6F7	1
38	1
668	1
6F8	1
39	1
669	1
6F9	1
41	1
61	1
AA	1
C0	1
C1	1
C2	1
C3	1
E0	1
E1	1
E2	1
E3	1
100	1
101	1
102	1
103	1
104	1
105	1
1CD	1
1CE	1
1DE	1
1DF	1
1E0	1
1E1	1
1FA	1
1FB	1
200	1
201	1
202	1
203	1
226	1
227	1
363	1
1E2	1
1E3	1
1FC	1
1FD	1
250	1
251	1
252	1
42	1
62	1
299	1
180	1
181	1
253	1
182	1
183	1
43	1
63	1
C7	1
E7	1
106	1
107	1
108	1
109	1
10A	1
10B	1
10C	1
10D	1
368	1
187	1
188	1
255	1
44	1
64	1
10E	1
10F	1
369	1
1C4	1
1C5	1
1C6	1
1F1	1
1F2	1
1F3	1
2A3	1
2A5	1
2A4	1
110	1
111	1
189	1
256	1
18A	1
257	1
18B	1
18C	1
221	1
D0	1
F0	1
45	1
65	1
C8	1
C9	1
CA	1
CB	1
E8	1
E9	1
EA	1
EB	1
112	1
113	1
114	1
115	1
116	1
117	1
118	1
119	1
11A	1
11B	1
204	1
205	1
206	1
207	1
228	1
229	1
364	1
18E	1
1DD	1
18F	1
259	1
190	1
25B	1
258	1
25A	1
25C	1
25D	1
25E	1
29A	1
264	1
46	1
66	1
2A9	1
191	1
192	1
47	1
67	1
11C	1
11D	1
11E	1
11F	1
120	1
121	1
122	1
123	1
1E6	1
1E7	1
1F4	1
1F5	1
261	1
262	1
1E4	1
1E5	1
193	1
260	1
29B	1
194	1
263	1
2E0	1
1A2	1
1A3	1
48	1
68	1
124	1
125	1
21E	1
21F	1
2B0	1
36A	1
29C	1
195	1
1F6	1
126	1
127	1
266	1
2B1	1
267	1
2BB	1
2BD	1
49	1
69	1
CC	1
CD	1
CE	1
CF	1
EC	1
ED	1
EE	1
EF	1
128	1
129	1
12A	1
12B	1
12C	1
12D	1
12E	1
12F	1
130	1
1CF	1
1D0	1
208	1
209	1
20A	1
20B	1
365	1
132	1
133	1
131	1
26A	1
197	1
268	1
196	1
269	1
4A	1
6A	1
134	1
135	1
1F0	1
2B2	1
29D	1
25F	1
284	1
4B	1
6B	1
136	1
137	1
1E8	1
1E9	1
198	1
199	1
29E	1
4C	1
6C	1
139	1
13A	1
13B	1
13C	1
13D	1
13E	1
2E1	1
13F	1
140	1
1C7	1
1C8	1
1C9	1
2AA	1
2AB	1
29F	1
141	1
142	1
19A	1
26B	1
26C	1
26D	1
234	1
26E	1
19B	1
28E	1
4D	1
6D	1
36B	1
271	1
4E	1
6E	1
D1	1
F1	1
143	1
144	1
145	1
146	1
147	1
148	1
1F8	1
1F9	1
1CA	1
1CB	1
1CC	1
274	1
19D	1
272	1
19E	1
220	1
273	1
235	1
14A	1
14B	1
4F	1
6F	1
BA	1
D2	1
D3	1
D4	1
D5	1
F2	1
F3	1
F4	1
F5	1
14C	1
14D	1
14E	1
14F	1
1A0	1
1A1	1
1D1	1
1D2	1
1EA	1
1EB	1
1EC	1
1ED	1
20C	1
20D	1
20E	1
20F	1
22A	1
22B	1
22C	1
22D	1
22E	1
22F	1
230	1
231	1
366	1
152	1
153	1
276	1
1FE	1
1FF	1
186	1
254	1
19F	1
275	1
277	1
222	1
223	1
50	1
70	1
1A4	1
1A5	1
278	1
51	1
71	1
2A0	1
138	1
52	1
72	1
154	1
155	1
156	1
157	1
158	1
159	1
210	1
211	1
212	1
213	1
2B3	1
36C	1
1A6	1
280	1
279	1
2B4	1
27A	1
27B	1
2B5	1
27C	1
27D	1
27E	1
27F	1
281	1
2B6	1
53	1
73	1
15A	1
15B	1
15C	1
15D	1
15E	1
15F	1
160	1
161	1
17F	1
218	1
219	1
2E2	1
DF	1
282	1
1A9	1
283	1
1AA	1
285	1
286	1
54	1
74	1
162	1
163	1
164	1
165	1
21A	1
21B	1
36D	1
2A8	1
1BE	1
2A6	1
2A7	1
166	1
167	1
1AB	1
1AC	1
1AD	1
1AE	1
288	1
236	1
287	1
55	1
75	1
D9	1
DA	1
DB	1
F9	1
FA	1
FB	1
168	1
169	1
16A	1
16B	1
16C	1
16D	1
16E	1
16F	1
172	1
173	1
1AF	1
1B0	1
1D3	1
1D4	1
1D5	1
1D6	1
1D7	1
1D8	1
1D9	1
1DA	1
1DB	1
1DC	1
214	1
215	1
216	1
217	1
367	1
289	1
265	1
2AE	1
2AF	1
19C	1
26F	1
270	1
1B1	1
28A	1
56	1
76	1
36E	1
1B2	1
28B	1
28C	1
57	1
77	1
174	1
175	1
2B7	1
28D	1
58	1
78	1
2E3	1
36F	1
59	1
79	1
DC	1
DD	1
FC	1
FD	1
FF	1
170	1
171	1
176	1
177	1
178	1
232	1
233	1
2B8	1
28F	1
1B3	1
1B4	1
5A	1
7A	1
179	1
17A	1
17B	1
17C	1
17D	1
17E	1
18D	1
C4	1
C6	1
E4	1
E6	1
D6	1
D8	1
F6	1
F8	1
150	1
151	1
C5	1
E5	1
1B5	1
1B6	1
224	1
225	1
290	1
291	1
1B7	1
1EE	1
1EF	1
292	1
1B8	1
1B9	1
1BA	1
293	1
21C	1
21D	1
DE	1
FE	1
1BF	1
1F7	1
1BB	1
1A7	1
1A8	1
1BC	1
1BD	1
184	1
185	1
294	1
2C0	1
2BC	1
149	1
2EE	1
2BE	1
295	1
2E4	1
2BF	1
2C1	1
2A1	1
2A2	1
296	1
1C0	1
1C1	1
1C2	1
1C3	1
297	1
298	1
2AC	1
2AD	1
386	1
391	1
3AC	1
3B1	1
392	1
3B2	1
3D0	1
393	1
3B3	1
394	1
3B4	1
388	1
395	1
3AD	1
3B5	1
3F5	1
3DC	1
3DD	1
3DA	1
3DB	1
396	1
3B6	1
389	1
397	1
3AE	1
3B7	1
398	1
3B8	1
3D1	1
3F4	1
37A	1
38A	1
390	1
399	1
3AA	1
3AF	1
3B9	1
3CA	1
3F3	1
39A	1
3BA	1
3F0	1
3D7	1
39B	1
3BB	1
B5	1
39C	1
3BC	1
39D	1
3BD	1
39E	1
3BE	1
38C	1
39F	1
3BF	1
3CC	1
3A0	1
3C0	1
3D6	1
3DE	1
3DF	1
3D8	1
3D9	1
3A1	1
3C1	1
3F1	1
3A3	1
3C2	1
3C3	1
3F2	1
3F9	1
3A4	1
3C4	1
38E	1
3A5	1
3AB	1
3B0	1
3C5	1
3CB	1
3CD	1
3D2	1
3D3	1
3D4	1
3A6	1
3C6	1
3D5	1
3A7	1
3C7	1
3A8	1
3C8	1
38F	1
3A9	1
3C9	1
3CE	1
3E0	1
3E1	1
3F7	1
3F8	1
3FA	1
3FB	1
3E2	1
3E3	1
3E4	1
3E5	1
3E6	1
3E7	1
3E8	1
3E9	1
3EA	1
3EB	1
3EC	1
3ED	1
3EE	1
3EF	1
410	1
430	1
4D0	1
4D1	1
4D2	1
4D3	1
4D8	1
4D9	1
4DA	1
4DB	1
4D4	1
4D5	1
411	1
431	1
412	1
432	1
413	1
433	1
490	1
491	1
492	1
493	1
494	1
495	1
414	1
434	1
500	1
501	1
402	1
452	1
502	1
503	1
403	1
453	1
498	1
499	1
400	1
401	1
415	1
435	1
450	1
451	1
4D6	1
4D7	1
404	1
454	1
416	1
436	1
4C1	1
4C2	1
4DC	1
4DD	1
496	1
497	1
417	1
437	1
504	1
505	1
4DE	1
4DF	1
405	1
455	1
4E0	1
4E1	1
506	1
507	1
40D	1
418	1
438	1
45D	1
4E2	1
4E3	1
48A	1
48B	1
4E4	1
4E5	1
406	1
456	1
407	1
457	1
419	1
439	1
408	1
458	1
41A	1
43A	1
49A	1
49B	1
4C3	1
4C4	1
4A0	1
4A1	1
49E	1
49F	1
49C	1
49D	1
41B	1
43B	1
4C5	1
4C6	1
409	1
459	1
508	1
509	1
41C	1
43C	1
4CD	1
4CE	1
41D	1
43D	1
4C9	1
4CA	1
4A2	1
4A3	1
4C7	1
4C8	1
4A4	1
4A5	1
40A	1
45A	1
50A	1
50B	1
41E	1
43E	1
4E6	1
4E7	1
4E8	1
4E9	1
4EA	1
4EB	1
41F	1
43F	1
4A6	1
4A7	1
480	1
481	1
420	1
440	1
48E	1
48F	1
421	1
441	1
50C	1
50D	1
4AA	1
4AB	1
422	1
442	1
50E	1
50F	1
4AC	1
4AD	1
40B	1
45B	1
40C	1
45C	1
423	1
443	1
4EE	1
4EF	1
40E	1
45E	1
4F0	1
4F1	1
4F2	1
4F3	1
4AE	1
4AF	1
4B0	1
4B1	1
478	1
479	1
424	1
444	1
425	1
445	1
4B2	1
4B3	1
4BA	1
4BB	1
460	1
461	1
47E	1
47F	1
47C	1
47D	1
47A	1
47B	1
426	1
446	1
4B4	1
4B5	1
427	1
447	1
4F4	1
4F5	1
4B6	1
4B7	1
4CB	1
4CC	1
4B8	1
4B9	1
4BC	1
4BD	1
4BE	1
4BF	1
40F	1
45F	1
428	1
448	1
429	1
449	1
42A	1
44A	1
42B	1
44B	1
4F8	1
4F9	1
42C	1
44C	1
48C	1
48D	1
462	1
463	1
42D	1
44D	1
4EC	1
4ED	1
42E	1
44E	1
42F	1
44F	1
464	1
465	1
466	1
467	1
46A	1
46B	1
468	1
469	1
46C	1
46D	1
46E	1
46F	1
470	1
471	1
472	1
473	1
474	1
475	1
476	1
477	1
4A8	1
4A9	1
4C0	1
531	1
561	1
532	1
562	1
533	1
563	1
534	1
564	1
535	1
565	1
587	1
536	1
566	1
537	1
567	1
538	1
568	1
539	1
569	1
53A	1
56A	1
53B	1
56B	1
53C	1
56C	1
53D	1
56D	1
53E	1
56E	1
53F	1
56F	1
540	1
570	1
541	1
571	1
542	1
572	1
543	1
573	1
544	1
574	1
545	1
575	1
546	1
576	1
547	1
577	1
548	1
578	1
549	1
579	1
54A	1
57A	1
54B	1
57B	1
54C	1
57C	1
54D	1
57D	1
54E	1
57E	1
54F	1
57F	1
550	1
580	1
551	1
581	1
552	1
582	1
553	1
583	1
554	1
584	1
555	1
585	1
556	1
586	1
559	1
5D0	1
5D1	1
5D2	1
5D3	1
5D4	1
5D5	1
5F0	1
5F1	1
5D6	1
5D7	1
5D8	1
5D9	1
5F2	1
5DA	1
5DB	1
5DC	1
5DD	1
5DE	1
5DF	1
5E0	1
5E1	1
5E2	1
5E3	1
5E4	1
5E5	1
5E6	1
5E7	1
5E8	1
5E9	1
5EA	1
621	1
674	1
6FD	1
622	1
623	1
672	1
671	1
624	1
625	1
673	1
626	1
627	1
675	1
66E	1
628	1
67B	1
67E	1
680	1
629	1
62A	1
62B	1
679	1
67A	1
67C	1
67D	1
67F	1
62C	1
683	1
684	1
686	1
6BF	1
687	1
62D	1
62E	1
681	1
682	1
685	1
62F	1
630	1
688	1
689	1
68A	1
68B	1
68C	1
68D	1
68E	1
68F	1
690	1
6EE	1
631	1
632	1
691	1
692	1
693	1
694	1
695	1
696	1
697	1
698	1
699	1
6EF	1
633	1
634	1
69A	1
69B	1
69C	1
6FA	1
635	1
636	1
69D	1
69E	1
6FB	1
637	1
638	1
69F	1
639	1
63A	1
6A0	1
6FC	1
641	1
6A1	1
6A2	1
6A3	1
6A4	1
6A5	1
6A6	1
66F	1
642	1
6A7	1
6A8	1
643	1
6A9	1
6AA	1
6AB	1
6AC	1
6AD	1
6AE	1
6AF	1
6B0	1
6B1	1
6B2	1
6B3	1
6B4	1
644	1
6B5	1
6B6	1
6B7	1
6B8	1
645	1
6FE	1
646	1
6BA	1
6BB	1
6BC	1
6BD	1
6B9	1
647	1
6BE	1
6C1	1
6C2	1
6C3	1
6FF	1
6C0	1
6D5	1
648	1
6E5	1
676	1
6C4	1
6C5	1
6C6	1
6C7	1
677	1
6C8	1
6C9	1
6CA	1
6CB	1
6CF	1
649	1
64A	1
6E6	1
678	1
6CC	1
6CD	1
6CE	1
6D0	1
6D1	1
6D2	1
6D3	1
710	1
712	1
72D	1
713	1
714	1
72E	1
716	1
715	1
72F	1
717	1
718	1
719	1
74D	1
71A	1
71B	1
71C	1
71D	1
71E	1
71F	1
74E	1
720	1
721	1
722	1
723	1
724	1
725	1
726	1
727	1
74F	1
728	1
729	1
72A	1
72B	1
72C	1
780	1
799	1
79A	1
781	1
782	1
783	1
79C	1
784	1
785	1
786	1
787	1
7A2	1
7A3	1
788	1
7A5	1
789	1
78A	1
78B	1
79B	1
78C	1
798	1
7A0	1
7A1	1
78D	1
78E	1
7A4	1
78F	1
790	1
79D	1
79E	1
79F	1
791	1
792	1
793	1
794	1
795	1
796	1
797	1
7B1	1
7A6	1
7A7	1
7A8	1
7A9	1
7AA	1
7AB	1
7AC	1
7AD	1
7AE	1
7AF	1
7B0	1
4E00	1
4E01	1
4E02	1
4E03	1
4E04	1
4E05	1
4E06	1
4E07	1
4E08	1
4E09	1
4E0A	1
4E0B	1
4E0C	1
4E0D	1
4E0E	1
4E0F	1
4E10	1
4E11	1
4E12	1
4E13	1
4E14	1
4E15	1
4E16	1
4E17	1
4E18	1
4E19	1
4E1A	1
4E1B	1
4E1C	1
4E1D	1
4E1E	1
4E1F	1
4E20	1
4E21	1
4E22	1
4E23	1
4E24	1
4E25	1
4E26	1
4E27	1
4E28	1
4E29	1
4E2A	1
4E2B	1
4E2C	1
4E2D	1
4E2E	1
4E2F	1
4E30	1
4E31	1
4E32	1
4E33	1
4E34	1
4E35	1
4E36	1
4E37	1
4E38	1
4E39	1
4E3A	1
4E3B	1
4E3C	1
4E3D	1
4E3E	1
4E3F	1
4E40	1
4E41	1
4E42	1
4E43	1
4E44	1
4E45	1
4E46	1
4E47	1
4E48	1
4E49	1
4E4A	1
4E4B	1
4E4C	1
4E4D	1
4E4E	1
4E4F	1
4E50	1
4E51	1
4E52	1
4E53	1
4E54	1
4E55	1
4E56	1
4E57	1
4E58	1
4E59	1
4E5A	1
4E5B	1
4E5C	1
4E5D	1
4E5E	1
4E5F	1
4E60	1
4E61	1
4E62	1
4E63	1
4E64	1
4E65	1
4E66	1
4E67	1
4E68	1
4E69	1
4E6A	1
4E6B	1
4E6C	1
4E6D	1
4E6E	1
4E6F	1
4E70	1
4E71	1
4E72	1
4E73	1
4E74	1
4E75	1
4E76	1
4E77	1
4E78	1
4E79	1
4E7A	1
4E7B	1
4E7C	1
4E7D	1
4E7E	1
4E7F	1
4E80	1
4E81	1
4E82	1
4E83	1
4E84	1
4E85	1
4E86	1
4E87	1
4E88	1
4E89	1
4E8A	1
4E8B	1
4E8C	1
4E8D	1
4E8E	1
4E8F	1
4E90	1
4E91	1
4E92	1
4E93	1
4E94	1
4E95	1
4E96	1
4E97	1
4E98	1
4E99	1
4E9A	1
4E9B	1
4E9C	1
4E9D	1
4E9E	1
4E9F	1
4EA0	1
4EA1	1
4EA2	1
4EA3	1
4EA4	1
4EA5	1
4EA6	1
4EA7	1
4EA8	1
4EA9	1
4EAA	1
4EAB	1
4EAC	1
4EAD	1
4EAE	1
4EAF	1
4EB0	1
4EB1	1
4EB2	1
4EB3	1
4EB4	1
4EB5	1
4EB6	1
4EB7	1
4EB8	1
4EB9	1
4EBA	1
4EBB	1
4EBC	1
4EBD	1
4EBE	1
4EBF	1
4EC0	1
4EC1	1
4EC2	1
4EC3	1
4EC4	1
4EC5	1
4EC6	1
4EC7	1
4EC8	1
4EC9	1
4ECA	1
4ECB	1
4ECC	1
4ECD	1
4ECE	1
4ECF	1
4ED0	1
4ED1	1
4ED2	1
4ED3	1
4ED4	1
4ED5	1
4ED6	1
4ED7	1
4ED8	1
4ED9	1
4EDA	1
4EDB	1
4EDC	1
4EDD	1
4EDE	1
4EDF	1
4EE0	1
4EE1	1
4EE2	1
4EE3	1
4EE4	1
4EE5	1
4EE6	1
4EE7	1
4EE8	1
4EE9	1
4EEA	1
4EEB	1
4EEC	1
4EED	1
4EEE	1
4EEF	1
4EF0	1
4EF1	1
4EF2	1
4EF3	1
4EF4	1
4EF5	1
4EF6	1
4EF7	1
4EF8	1
4EF9	1
4EFA	1
4EFB	1
4EFC	1
4EFD	1
4EFE	1
4EFF	1
4F00	1
4F01	1
4F02	1
4F03	1
4F04	1
4F05	1
4F06	1
4F07	1
4F08	1
4F09	1
4F0A	1
4F0B	1
4F0C	1
4F0D	1
4F0E	1
4F0F	1
4F10	1
4F11	1
4F12	1
4F13	1
4F14	1
4F15	1
4F16	1
4F17	1
4F18	1
4F19	1
4F1A	1
4F1B	1
4F1C	1
4F1D	1
4F1E	1
4F1F	1
4F20	1
4F21	1
4F22	1
4F23	1
4F24	1
4F25	1
4F26	1
4F27	1
4F28	1
4F29	1
4F2A	1
4F2B	1
4F2C	1
4F2D	1
4F2E	1
4F2F	1
4F30	1
4F31	1
4F32	1
4F33	1
4F34	1
4F35	1
4F36	1
4F37	1
4F38	1
4F39	1
4F3A	1
4F3B	1
4F3C	1
4F3D	1
4F3E	1
4F3F	1
4F40	1
4F41	1
4F42	1
4F43	1
4F44	1
4F45	1
4F46	1
4F47	1
4F48	1
4F49	1
4F4A	1
4F4B	1
4F4C	1
4F4D	1
4F4E	1
4F4F	1
4F50	1
4F51	1
4F52	1
4F53	1
4F54	1
4F55	1
4F56	1
4F57	1
4F58	1
4F59	1
4F5A	1
4F5B	1
4F5C	1
4F5D	1
4F5E	1
4F5F	1
4F60	1
4F61	1
4F62	1
4F63	1
4F64	1
4F65	1
4F66	1
4F67	1
4F68	1
4F69	1
4F6A	1
4F6B	1
4F6C	1
4F6D	1
4F6E	1
4F6F	1
4F70	1
4F71	1
4F72	1
4F73	1
4F74	1
4F75	1
4F76	1
4F77	1
4F78	1
4F79	1
4F7A	1
4F7B	1
4F7C	1
4F7D	1
4F7E	1
4F7F	1
4F80	1
4F81	1
4F82	1
4F83	1
4F84	1
4F85	1
4F86	1
4F87	1
4F88	1
4F89	1
4F8A	1
4F8B	1
4F8C	1
4F8D	1
4F8E	1
4F8F	1
4F90	1
4F91	1
4F92	1
4F93	1
4F94	1
4F95	1
4F96	1
4F97	1
4F98	1
4F99	1
4F9A	1
4F9B	1
4F9C	1
4F9D	1
4F9E	1
4F9F	1
4FA0	1
4FA1	1
4FA2	1
4FA3	1
4FA4	1
4FA5	1
4FA6	1
4FA7	1
4FA8	1
4FA9	1
4FAA	1
4FAB	1
4FAC	1
4FAD	1
4FAE	1
4FAF	1
4FB0	1
4FB1	1
4FB2	1
4FB3	1
4FB4	1
4FB5	1
4FB6	1
4FB7	1
4FB8	1
4FB9	1
4FBA	1
4FBB	1
4FBC	1
4FBD	1
4FBE	1
4FBF	1
4FC0	1
4FC1	1
4FC2	1
4FC3	1
4FC4	1
4FC5	1
4FC6	1
4FC7	1
4FC8	1
4FC9	1
4FCA	1
4FCB	1
4FCC	1
4FCD	1
4FCE	1
4FCF	1
4FD0	1
4FD1	1
4FD2	1
4FD3	1
4FD4	1
4FD5	1
4FD6	1
4FD7	1
4FD8	1
4FD9	1
4FDA	1
4FDB	1
4FDC	1
4FDD	1
4FDE	1
4FDF	1
4FE0	1
4FE1	1
4FE2	1
4FE3	1
4FE4	1
4FE5	1
4FE6	1
4FE7	1
4FE8	1
4FE9	1
4FEA	1
4FEB	1
4FEC	1
4FED	1
4FEE	1
4FEF	1
4FF0	1
4FF1	1
4FF2	1
4FF3	1
4FF4	1
4FF5	1
4FF6	1
4FF7	1
4FF8	1
4FF9	1
4FFA	1
4FFB	1
4FFC	1
4FFD	1
4FFE	1
4FFF	1
237	1
238	1
239	1
23A	1
23B	1
23C	1
23D	1
23E	1
23F	1
240	1
241	1
242	1
243	1
244	1
245	1
246	1
247	1
248	1
249	1
24A	1
24B	1
24C	1
24D	1
24E	1
24F	1
358	1
359	1
35A	1
35B	1
35C	1
370	1
371	1
372	1
373	1
376	1
377	1
378	1
379	1
37B	1
37C	1
37D	1
37F	1
380	1
381	1
382	1
383	1
38B	1
38D	1
3A2	1
3CF	1
3FC	1
3FD	1
3FE	1
3FF	1
487	1
4CF	1
4F6	1
4F7	1
4FA	1
4FB	1
4FC	1
4FD	1
4FE	1
4FF	1
510	1
511	1
512	1
513	1
514	1
515	1
516	1
517	1
518	1
519	1
51A	1
51B	1
51C	1
51D	1
51E	1
51F	1
520	1
521	1
522	1
523	1
524	1
525	1
526	1
527	1
528	1
529	1
52A	1
52B	1
52C	1
52D	1
52E	1
52F	1
530	1
557	1
558	1
560	1
588	1
58B	1
58C	1
58D	1
58E	1
58F	1
590	1
5A2	1
5BA	1
5C5	1
5C6	1
5C7	1
5C8	1
5C9	1
5CA	1
5CB	1
5CC	1
5CD	1
5CE	1
5CF	1
5EB	1
5EC	1
5ED	1
5EE	1
5EF	1
5F5	1
5F6	1
5F7	1
5F8	1
5F9	1
5FA	1
5FB	1
5FC	1
5FD	1
5FE	1
5FF	1
604	1
605	1
606	1
607	1
608	1
609	1
60A	1
60B	1
616	1
617	1
618	1
619	1
61A	1
61C	1
61D	1
61E	1
620	1
63B	1
63C	1
63D	1
63E	1
63F	1
659	1
65A	1
65B	1
65C	1
65D	1
65E	1
65F	1
70E	1
74B	1
74C	1
750	1
751	1
752	1
753	1
754	1
755	1
756	1
757	1
758	1
759	1
75A	1
75B	1
75C	1
75D	1
75E	1
75F	1
760	1
761	1
762	1
763	1
764	1
765	1
766	1
767	1
768	1
769	1
76A	1
76B	1
76C	1
76D	1
76E	1
76F	1
770	1
771	1
772	1
773	1
774	1
775	1
776	1
777	1
778	1
779	1
77A	1
77B	1
77C	1
77D	1
77E	1
77F	1
7B2	1
7B3	1
7B4	1
7B5	1
7B6	1
7B7	1
7B8	1
7B9	1
7BA	1
7BB	1
7BC	1
7BD	1
7BE	1
7BF	1
7C0	1
7C1	1
7C2	1
7C3	1
7C4	1
7C5	1
7C6	1
7C7	1
7C8	1
7C9	1
7CA	1
7CB	1
7CC	1
7CD	1
7CE	1
7CF	1
7D0	1
7D1	1
7D2	1
7D3	1
7D4	1
7D5	1
7D6	1
7D7	1
7D8	1
7D9	1
7DA	1
7DB	1
7DC	1
7DD	1
7DE	1
7DF	1
7E0	1
7E1	1
7E2	1
7E3	1
7E4	1
7E5	1
7E6	1
7E7	1
7E8	1
7E9	1
7EA	1
7EB	1
7EC	1
7ED	1
7EE	1
7EF	1
7F0	1
7F1	1
7F2	1
7F3	1
7F4	1
7F5	1
7F6	1
7F7	1
7F8	1
7F9	1
7FA	1
7FB	1
7FC	1
7FD	1
7FE	1
7FF	1
DROP TABLE IF EXISTS test.t1;
DROP TABLE IF EXISTS test.t1;
DROP DATABASE test;
CREATE DATABASE test CHARACTER SET utf8mb3;
USE test;
SET NAMES utf8mb3;
Warnings:
Warning	1287	'utf8mb3' is deprecated and will be removed in a future release. Please use utf8mb4 instead
CREATE TABLE test.t1 (a CHAR(4) CHARACTER SET utf8mb3) ENGINE=MyISAM CHARACTER SET utf8mb3;
Warnings:
Warning	1287	'utf8mb3' is deprecated and will be removed in a future release. Please use utf8mb4 instead
Warning	1287	'utf8mb3' is deprecated and will be removed in a future release. Please use utf8mb4 instead
SHOW TABLE STATUS LIKE 't1';
Name	Engine	Version	Row_format	Rows	Avg_row_length	Data_length	Max_data_length	Index_length	Data_free	Auto_increment	Create_time	Update_time	Check_time	Collation	Checksum	Create_options	Comment
t1	MyISAM	#	#	#	#	#	#	#	#	#	#	#	#	utf8mb3_general_ci	#	#	#
LOAD DATA INFILE 
'MYSQL_TEST_DIR/suite/funcs_2/data/charset_utf8.txt' INTO TABLE test.t1;
ALTER TABLE test.t1 CHANGE a a CHAR(4) CHARACTER SET ucs2 COLLATE ucs2_estonian_ci;
Warnings:
Warning	1287	'ucs2' is deprecated and will be removed in a future release. Please use utf8mb4 instead
Warning	4079	'ucs2_estonian_ci' is a collation of the deprecated character set ucs2. Please consider using utf8mb4 with an appropriate collation instead.
DELETE FROM test.t1 WHERE CHAR_LENGTH(a) <> 1;
SELECT HEX(ORD(a)) AS a_ord, CHAR_LENGTH(a) AS a_len FROM test.t1 ORDER BY a, ORD(a);
a_ord	a_len
85	1
7F	1
80	1
81	1
82	1
83	1
84	1
86	1
87	1
88	1
89	1
8A	1
8B	1
8C	1
8D	1
8E	1
8F	1
90	1
91	1
92	1
93	1
94	1
95	1
96	1
97	1
98	1
99	1
9A	1
9B	1
9C	1
9D	1
9E	1
9F	1
A0	1
300	1
301	1
302	1
303	1
304	1
305	1
306	1
307	1
308	1
309	1
30A	1
30B	1
30C	1
30D	1
30E	1
30F	1
310	1
311	1
312	1
313	1
314	1
315	1
316	1
317	1
318	1
319	1
31A	1
31B	1
31C	1
31D	1
31E	1
31F	1
320	1
321	1
322	1
323	1
324	1
325	1
326	1
327	1
328	1
329	1
32A	1
32B	1
32C	1
32D	1
32E	1
32F	1
330	1
331	1
332	1
333	1
334	1
335	1
336	1
337	1
338	1
339	1
33A	1
33B	1
33C	1
33D	1
33E	1
33F	1
340	1
341	1
342	1
343	1
344	1
345	1
346	1
347	1
348	1
349	1
34A	1
34B	1
34C	1
34D	1
34E	1
34F	1
350	1
351	1
352	1
353	1
354	1
355	1
356	1
357	1
35D	1
35E	1
35F	1
360	1
361	1
362	1
483	1
484	1
485	1
486	1
488	1
489	1
591	1
592	1
593	1
594	1
595	1
596	1
597	1
598	1
599	1
59A	1
59B	1
59C	1
59D	1
59E	1
59F	1
5A0	1
5A1	1
5A3	1
5A4	1
5A5	1
5A6	1
5A7	1
5A8	1
5A9	1
5AA	1
5AB	1
5AC	1
5AD	1
5AE	1
5AF	1
5B0	1
5B1	1
5B2	1
5B3	1
5B4	1
5B5	1
5B6	1
5B7	1
5B8	1
5B9	1
5BB	1
5BC	1
5BD	1
5BF	1
5C1	1
5C2	1
5C4	1
600	1
601	1
602	1
603	1
610	1
611	1
612	1
613	1
614	1
615	1
64B	1
64C	1
64D	1
64E	1
64F	1
650	1
651	1
652	1
653	1
654	1
655	1
656	1
657	1
658	1
670	1
6D6	1
6D7	1
6D8	1
6D9	1
6DA	1
6DB	1
6DC	1
6DD	1
6DE	1
6DF	1
6E0	1
6E1	1
6E2	1
6E3	1
6E4	1
6E7	1
6E8	1
6EA	1
6EB	1
6EC	1
6ED	1
70F	1
711	1
730	1
731	1
732	1
733	1
734	1
735	1
736	1
737	1
738	1
739	1
73A	1
73B	1
73C	1
73D	1
73E	1
73F	1
740	1
741	1
742	1
743	1
744	1
745	1
746	1
747	1
748	1
749	1
74A	1
640	1
60	1
B4	1
384	1
2DC	1
5E	1
AF	1
2D8	1
2D9	1
A8	1
385	1
2DA	1
2DD	1
B8	1
2DB	1
5F	1
AD	1
2D	1
58A	1
2C	1
55D	1
60C	1
60D	1
66B	1
66C	1
3B	1
37E	1
61B	1
3A	1
589	1
703	1
704	1
705	1
706	1
707	1
708	1
21	1
A1	1
55C	1
3F	1
BF	1
55E	1
61F	1
709	1
2E	1
6D4	1
701	1
702	1
B7	1
387	1
700	1
27	1
22	1
AB	1
BB	1
28	1
29	1
5B	1
7B	1
7D	1
A7	1
B6	1
A9	1
AE	1
40	1
2A	1
66D	1
2F	1
26	1
23	1
25	1
66A	1
55A	1
55B	1
55F	1
5BE	1
5C0	1
5C3	1
5F3	1
5F4	1
70A	1
70B	1
70C	1
70D	1
2B9	1
374	1
375	1
2BA	1
2C2	1
2C3	1
2C4	1
2C5	1
2C6	1
2C7	1
2C8	1
2C9	1
2CA	1
2CB	1
2CC	1
2CD	1
2CE	1
2CF	1
2D2	1
2D3	1
2D4	1
2D5	1
2D6	1
2D7	1
2DE	1
2DF	1
2E5	1
2E6	1
2E7	1
2E8	1
2E9	1
2EA	1
2EB	1
2EC	1
2ED	1
2EF	1
2F0	1
2F1	1
2F2	1
2F3	1
2F4	1
2F5	1
2F6	1
2F7	1
2F8	1
2F9	1
2FA	1
2FB	1
2FC	1
2FD	1
2FE	1
2FF	1
B0	1
482	1
60E	1
60F	1
6E9	1
3F6	1
2B	1
B1	1
F7	1
D7	1
3C	1
3D	1
3E	1
AC	1
7C	1
A6	1
7E	1
2D0	1
2D1	1
A4	1
A2	1
24	1
A3	1
A5	1
30	1
660	1
6F0	1
31	1
B9	1
661	1
6F1	1
BD	1
BC	1
32	1
B2	1
662	1
6F2	1
33	1
B3	1
663	1
6F3	1
BE	1
34	1
664	1
6F4	1
35	1
665	1
6F5	1
36	1
666	1
6F6	1
37	1
667	1
6F7	1
38	1
668	1
6F8	1
39	1
669	1
6F9	1
41	1
61	1
AA	1
C0	1
C1	1
C2	1
C3	1
C5	1
E0	1
E1	1
E2	1
E3	1
E5	1
100	1
101	1
102	1
103	1
104	1
105	1
1CD	1
1CE	1
1DE	1
1DF	1
1E0	1
1E1	1
1FA	1
1FB	1
200	1
201	1
202	1
203	1
226	1
227	1
363	1
C6	1
E6	1
1E2	1
1E3	1
1FC	1
1FD	1
250	1
251	1
252	1
42	1
62	1
299	1
180	1
181	1
253	1
182	1
183	1
43	1
63	1
C7	1
E7	1
106	1
107	1
108	1
109	1
10A	1
10B	1
10C	1
10D	1
368	1
187	1
188	1
255	1
44	1
64	1
10E	1
10F	1
369	1
1C4	1
1C5	1
1C6	1
1F1	1
1F2	1
1F3	1
2A3	1
2A5	1
2A4	1
110	1
111	1
189	1
256	1
18A	1
257	1
18B	1
18C	1
221	1
D0	1
F0	1
45	1
65	1
C8	1
C9	1
CA	1
CB	1
E8	1
E9	1
EA	1
EB	1
112	1
113	1
114	1
115	1
116	1
117	1
118	1
119	1
11A	1
11B	1
204	1
205	1
206	1
207	1
228	1
229	1
364	1
18E	1
1DD	1
18F	1
259	1
190	1
25B	1
258	1
25A	1
25C	1
25D	1
25E	1
29A	1
264	1
46	1
66	1
2A9	1
191	1
192	1
47	1
67	1
11C	1
11D	1
11E	1
11F	1
120	1
121	1
122	1
123	1
1E6	1
1E7	1
1F4	1
1F5	1
261	1
262	1
1E4	1
1E5	1
193	1
260	1
29B	1
194	1
263	1
2E0	1
1A2	1
1A3	1
48	1
68	1
124	1
125	1
21E	1
21F	1
2B0	1
36A	1
29C	1
195	1
1F6	1
126	1
127	1
266	1
2B1	1
267	1
2BB	1
2BD	1
49	1
69	1
CC	1
CD	1
CE	1
CF	1
EC	1
ED	1
EE	1
EF	1
128	1
129	1
12A	1
12B	1
12C	1
12D	1
12E	1
12F	1
130	1
1CF	1
1D0	1
208	1
209	1
20A	1
20B	1
365	1
132	1
133	1
131	1
26A	1
197	1
268	1
196	1
269	1
4A	1
6A	1
134	1
135	1
1F0	1
2B2	1
29D	1
25F	1
284	1
4B	1
6B	1
136	1
137	1
1E8	1
1E9	1
198	1
199	1
29E	1
4C	1
6C	1
139	1
13A	1
13B	1
13C	1
13D	1
13E	1
2E1	1
13F	1
140	1
1C7	1
1C8	1
1C9	1
2AA	1
2AB	1
29F	1
141	1
142	1
19A	1
26B	1
26C	1
26D	1
234	1
26E	1
19B	1
28E	1
4D	1
6D	1
36B	1
271	1
4E	1
6E	1
D1	1
F1	1
143	1
144	1
145	1
146	1
147	1
148	1
1F8	1
1F9	1
1CA	1
1CB	1
1CC	1
274	1
19D	1
272	1
19E	1
220	1
273	1
235	1
14A	1
14B	1
4F	1
6F	1
BA	1
D2	1
D3	1
D4	1
F2	1
F3	1
F4	1
14C	1
14D	1
14E	1
14F	1
150	1
151	1
1A0	1
1A1	1
1D1	1
1D2	1
1EA	1
1EB	1
1EC	1
1ED	1
20C	1
20D	1
20E	1
20F	1
22A	1
22B	1
22C	1
22D	1
22E	1
22F	1
230	1
231	1
366	1
152	1
153	1
276	1
D8	1
F8	1
1FE	1
1FF	1
186	1
254	1
19F	1
275	1
277	1
222	1
223	1
50	1
70	1
1A4	1
1A5	1
278	1
51	1
71	1
2A0	1
138	1
52	1
72	1
154	1
155	1
156	1
157	1
158	1
159	1
210	1
211	1
212	1
213	1
2B3	1
36C	1
1A6	1
280	1
279	1
2B4	1
27A	1
27B	1
2B5	1
27C	1
27D	1
27E	1
27F	1
281	1
2B6	1
53	1
73	1
15A	1
15B	1
15C	1
15D	1
15E	1
15F	1
17F	1
218	1
219	1
2E2	1
DF	1
160	1
161	1
5A	1
7A	1
17D	1
17E	1
282	1
1A9	1
283	1
1AA	1
285	1
286	1
54	1
74	1
162	1
163	1
164	1
165	1
21A	1
21B	1
36D	1
2A8	1
1BE	1
2A6	1
2A7	1
166	1
167	1
1AB	1
1AC	1
1AD	1
1AE	1
288	1
236	1
287	1
55	1
75	1
D9	1
DA	1
DB	1
F9	1
FA	1
FB	1
168	1
169	1
16A	1
16B	1
16C	1
16D	1
16E	1
16F	1
170	1
171	1
172	1
173	1
1AF	1
1B0	1
1D3	1
1D4	1
1D5	1
1D6	1
1D7	1
1D8	1
1D9	1
1DA	1
1DB	1
1DC	1
214	1
215	1
216	1
217	1
367	1
289	1
265	1
2AE	1
2AF	1
19C	1
26F	1
270	1
1B1	1
28A	1
56	1
76	1
36E	1
1B2	1
28B	1
28C	1
57	1
77	1
174	1
175	1
2B7	1
D5	1
F5	1
C4	1
E4	1
D6	1
F6	1
DC	1
FC	1
28D	1
58	1
78	1
2E3	1
36F	1
59	1
79	1
DD	1
FD	1
FF	1
176	1
177	1
178	1
232	1
233	1
2B8	1
28F	1
1B3	1
1B4	1
179	1
17A	1
17B	1
17C	1
18D	1
1B5	1
1B6	1
224	1
225	1
290	1
291	1
1B7	1
1EE	1
1EF	1
292	1
1B8	1
1B9	1
1BA	1
293	1
21C	1
21D	1
DE	1
FE	1
1BF	1
1F7	1
1BB	1
1A7	1
1A8	1
1BC	1
1BD	1
184	1
185	1
294	1
2C0	1
2BC	1
149	1
2EE	1
2BE	1
295	1
2E4	1
2BF	1
2C1	1
2A1	1
2A2	1
296	1
1C0	1
1C1	1
1C2	1
1C3	1
297	1
298	1
2AC	1
2AD	1
386	1
391	1
3AC	1
3B1	1
392	1
3B2	1
3D0	1
393	1
3B3	1
394	1
3B4	1
388	1
395	1
3AD	1
3B5	1
3F5	1
3DC	1
3DD	1
3DA	1
3DB	1
396	1
3B6	1
389	1
397	1
3AE	1
3B7	1
398	1
3B8	1
3D1	1
3F4	1
37A	1
38A	1
390	1
399	1
3AA	1
3AF	1
3B9	1
3CA	1
3F3	1
39A	1
3BA	1
3F0	1
3D7	1
39B	1
3BB	1
B5	1
39C	1
3BC	1
39D	1
3BD	1
39E	1
3BE	1
38C	1
39F	1
3BF	1
3CC	1
3A0	1
3C0	1
3D6	1
3DE	1
3DF	1
3D8	1
3D9	1
3A1	1
3C1	1
3F1	1
3A3	1
3C2	1
3C3	1
3F2	1
3F9	1
3A4	1
3C4	1
38E	1
3A5	1
3AB	1
3B0	1
3C5	1
3CB	1
3CD	1
3D2	1
3D3	1
3D4	1
3A6	1
3C6	1
3D5	1
3A7	1
3C7	1
3A8	1
3C8	1
38F	1
3A9	1
3C9	1
3CE	1
3E0	1
3E1	1
3F7	1
3F8	1
3FA	1
3FB	1
3E2	1
3E3	1
3E4	1
3E5	1
3E6	1
3E7	1
3E8	1
3E9	1
3EA	1
3EB	1
3EC	1
3ED	1
3EE	1
3EF	1
410	1
430	1
4D0	1
4D1	1
4D2	1
4D3	1
4D8	1
4D9	1
4DA	1
4DB	1
4D4	1
4D5	1
411	1
431	1
412	1
432	1
413	1
433	1
490	1
491	1
492	1
493	1
494	1
495	1
414	1
434	1
500	1
501	1
402	1
452	1
502	1
503	1
403	1
453	1
498	1
499	1
400	1
401	1
415	1
435	1
450	1
451	1
4D6	1
4D7	1
404	1
454	1
416	1
436	1
4C1	1
4C2	1
4DC	1
4DD	1
496	1
497	1
417	1
437	1
504	1
505	1
4DE	1
4DF	1
405	1
455	1
4E0	1
4E1	1
506	1
507	1
40D	1
418	1
438	1
45D	1
4E2	1
4E3	1
48A	1
48B	1
4E4	1
4E5	1
406	1
456	1
407	1
457	1
419	1
439	1
408	1
458	1
41A	1
43A	1
49A	1
49B	1
4C3	1
4C4	1
4A0	1
4A1	1
49E	1
49F	1
49C	1
49D	1
41B	1
43B	1
4C5	1
4C6	1
409	1
459	1
508	1
509	1
41C	1
43C	1
4CD	1
4CE	1
41D	1
43D	1
4C9	1
4CA	1
4A2	1
4A3	1
4C7	1
4C8	1
4A4	1
4A5	1
40A	1
45A	1
50A	1
50B	1
41E	1
43E	1
4E6	1
4E7	1
4E8	1
4E9	1
4EA	1
4EB	1
41F	1
43F	1
4A6	1
4A7	1
480	1
481	1
420	1
440	1
48E	1
48F	1
421	1
441	1
50C	1
50D	1
4AA	1
4AB	1
422	1
442	1
50E	1
50F	1
4AC	1
4AD	1
40B	1
45B	1
40C	1
45C	1
423	1
443	1
4EE	1
4EF	1
40E	1
45E	1
4F0	1
4F1	1
4F2	1
4F3	1
4AE	1
4AF	1
4B0	1
4B1	1
478	1
479	1
424	1
444	1
425	1
445	1
4B2	1
4B3	1
4BA	1
4BB	1
460	1
461	1
47E	1
47F	1
47C	1
47D	1
47A	1
47B	1
426	1
446	1
4B4	1
4B5	1
427	1
447	1
4F4	1
4F5	1
4B6	1
4B7	1
4CB	1
4CC	1
4B8	1
4B9	1
4BC	1
4BD	1
4BE	1
4BF	1
40F	1
45F	1
428	1
448	1
429	1
449	1
42A	1
44A	1
42B	1
44B	1
4F8	1
4F9	1
42C	1
44C	1
48C	1
48D	1
462	1
463	1
42D	1
44D	1
4EC	1
4ED	1
42E	1
44E	1
42F	1
44F	1
464	1
465	1
466	1
467	1
46A	1
46B	1
468	1
469	1
46C	1
46D	1
46E	1
46F	1
470	1
471	1
472	1
473	1
474	1
475	1
476	1
477	1
4A8	1
4A9	1
4C0	1
531	1
561	1
532	1
562	1
533	1
563	1
534	1
564	1
535	1
565	1
587	1
536	1
566	1
537	1
567	1
538	1
568	1
539	1
569	1
53A	1
56A	1
53B	1
56B	1
53C	1
56C	1
53D	1
56D	1
53E	1
56E	1
53F	1
56F	1
540	1
570	1
541	1
571	1
542	1
572	1
543	1
573	1
544	1
574	1
545	1
575	1
546	1
576	1
547	1
577	1
548	1
578	1
549	1
579	1
54A	1
57A	1
54B	1
57B	1
54C	1
57C	1
54D	1
57D	1
54E	1
57E	1
54F	1
57F	1
550	1
580	1
551	1
581	1
552	1
582	1
553	1
583	1
554	1
584	1
555	1
585	1
556	1
586	1
559	1
5D0	1
5D1	1
5D2	1
5D3	1
5D4	1
5D5	1
5F0	1
5F1	1
5D6	1
5D7	1
5D8	1
5D9	1
5F2	1
5DA	1
5DB	1
5DC	1
5DD	1
5DE	1
5DF	1
5E0	1
5E1	1
5E2	1
5E3	1
5E4	1
5E5	1
5E6	1
5E7	1
5E8	1
5E9	1
5EA	1
621	1
674	1
6FD	1
622	1
623	1
672	1
671	1
624	1
625	1
673	1
626	1
627	1
675	1
66E	1
628	1
67B	1
67E	1
680	1
629	1
62A	1
62B	1
679	1
67A	1
67C	1
67D	1
67F	1
62C	1
683	1
684	1
686	1
6BF	1
687	1
62D	1
62E	1
681	1
682	1
685	1
62F	1
630	1
688	1
689	1
68A	1
68B	1
68C	1
68D	1
68E	1
68F	1
690	1
6EE	1
631	1
632	1
691	1
692	1
693	1
694	1
695	1
696	1
697	1
698	1
699	1
6EF	1
633	1
634	1
69A	1
69B	1
69C	1
6FA	1
635	1
636	1
69D	1
69E	1
6FB	1
637	1
638	1
69F	1
639	1
63A	1
6A0	1
6FC	1
641	1
6A1	1
6A2	1
6A3	1
6A4	1
6A5	1
6A6	1
66F	1
642	1
6A7	1
6A8	1
643	1
6A9	1
6AA	1
6AB	1
6AC	1
6AD	1
6AE	1
6AF	1
6B0	1
6B1	1
6B2	1
6B3	1
6B4	1
644	1
6B5	1
6B6	1
6B7	1
6B8	1
645	1
6FE	1
646	1
6BA	1
6BB	1
6BC	1
6BD	1
6B9	1
647	1
6BE	1
6C1	1
6C2	1
6C3	1
6FF	1
6C0	1
6D5	1
648	1
6E5	1
676	1
6C4	1
6C5	1
6C6	1
6C7	1
677	1
6C8	1
6C9	1
6CA	1
6CB	1
6CF	1
649	1
64A	1
6E6	1
678	1
6CC	1
6CD	1
6CE	1
6D0	1
6D1	1
6D2	1
6D3	1
710	1
712	1
72D	1
713	1
714	1
72E	1
716	1
715	1
72F	1
717	1
718	1
719	1
74D	1
71A	1
71B	1
71C	1
71D	1
71E	1
71F	1
74E	1
720	1
721	1
722	1
723	1
724	1
725	1
726	1
727	1
74F	1
728	1
729	1
72A	1
72B	1
72C	1
780	1
799	1
79A	1
781	1
782	1
783	1
79C	1
784	1
785	1
786	1
787	1
7A2	1
7A3	1
788	1
7A5	1
789	1
78A	1
78B	1
79B	1
78C	1
798	1
7A0	1
7A1	1
78D	1
78E	1
7A4	1
78F	1
790	1
79D	1
79E	1
79F	1
791	1
792	1
793	1
794	1
795	1
796	1
797	1
7B1	1
7A6	1
7A7	1
7A8	1
7A9	1
7AA	1
7AB	1
7AC	1
7AD	1
7AE	1
7AF	1
7B0	1
4E00	1
4E01	1
4E02	1
4E03	1
4E04	1
4E05	1
4E06	1
4E07	1
4E08	1
4E09	1
4E0A	1
4E0B	1
4E0C	1
4E0D	1
4E0E	1
4E0F	1
4E10	1
4E11	1
4E12	1
4E13	1
4E14	1
4E15	1
4E16	1
4E17	1
4E18	1
4E19	1
4E1A	1
4E1B	1
4E1C	1
4E1D	1
4E1E	1
4E1F	1
4E20	1
4E21	1
4E22	1
4E23	1
4E24	1
4E25	1
4E26	1
4E27	1
4E28	1
4E29	1
4E2A	1
4E2B	1
4E2C	1
4E2D	1
4E2E	1
4E2F	1
4E30	1
4E31	1
4E32	1
4E33	1
4E34	1
4E35	1
4E36	1
4E37	1
4E38	1
4E39	1
4E3A	1
4E3B	1
4E3C	1
4E3D	1
4E3E	1
4E3F	1
4E40	1
4E41	1
4E42	1
4E43	1
4E44	1
4E45	1
4E46	1
4E47	1
4E48	1
4E49	1
4E4A	1
4E4B	1
4E4C	1
4E4D	1
4E4E	1
4E4F	1
4E50	1
4E51	1
4E52	1
4E53	1
4E54	1
4E55	1
4E56	1
4E57	1
4E58	1
4E59	1
4E5A	1
4E5B	1
4E5C	1
4E5D	1
4E5E	1
4E5F	1
4E60	1
4E61	1
4E62	1
4E63	1
4E64	1
4E65	1
4E66	1
4E67	1
4E68	1
4E69	1
4E6A	1
4E6B	1
4E6C	1
4E6D	1
4E6E	1
4E6F	1
4E70	1
4E71	1
4E72	1
4E73	1
4E74	1
4E75	1
4E76	1
4E77	1
4E78	1
4E79	1
4E7A	1
4E7B	1
4E7C	1
4E7D	1
4E7E	1
4E7F	1
4E80	1
4E81	1
4E82	1
4E83	1
4E84	1
4E85	1
4E86	1
4E87	1
4E88	1
4E89	1
4E8A	1
4E8B	1
4E8C	1
4E8D	1
4E8E	1
4E8F	1
4E90	1
4E91	1
4E92	1
4E93	1
4E94	1
4E95	1
4E96	1
4E97	1
4E98	1
4E99	1
4E9A	1
4E9B	1
4E9C	1
4E9D	1
4E9E	1
4E9F	1
4EA0	1
4EA1	1
4EA2	1
4EA3	1
4EA4	1
4EA5	1
4EA6	1
4EA7	1
4EA8	1
4EA9	1
4EAA	1
4EAB	1
4EAC	1
4EAD	1
4EAE	1
4EAF	1
4EB0	1
4EB1	1
4EB2	1
4EB3	1
4EB4	1
4EB5	1
4EB6	1
4EB7	1
4EB8	1
4EB9	1
4EBA	1
4EBB	1
4EBC	1
4EBD	1
4EBE	1
4EBF	1
4EC0	1
4EC1	1
4EC2	1
4EC3	1
4EC4	1
4EC5	1
4EC6	1
4EC7	1
4EC8	1
4EC9	1
4ECA	1
4ECB	1
4ECC	1
4ECD	1
4ECE	1
4ECF	1
4ED0	1
4ED1	1
4ED2	1
4ED3	1
4ED4	1
4ED5	1
4ED6	1
4ED7	1
4ED8	1
4ED9	1
4EDA	1
4EDB	1
4EDC	1
4EDD	1
4EDE	1
4EDF	1
4EE0	1
4EE1	1
4EE2	1
4EE3	1
4EE4	1
4EE5	1
4EE6	1
4EE7	1
4EE8	1
4EE9	1
4EEA	1
4EEB	1
4EEC	1
4EED	1
4EEE	1
4EEF	1
4EF0	1
4EF1	1
4EF2	1
4EF3	1
4EF4	1
4EF5	1
4EF6	1
4EF7	1
4EF8	1
4EF9	1
4EFA	1
4EFB	1
4EFC	1
4EFD	1
4EFE	1
4EFF	1
4F00	1
4F01	1
4F02	1
4F03	1
4F04	1
4F05	1
4F06	1
4F07	1
4F08	1
4F09	1
4F0A	1
4F0B	1
4F0C	1
4F0D	1
4F0E	1
4F0F	1
4F10	1
4F11	1
4F12	1
4F13	1
4F14	1
4F15	1
4F16	1
4F17	1
4F18	1
4F19	1
4F1A	1
4F1B	1
4F1C	1
4F1D	1
4F1E	1
4F1F	1
4F20	1
4F21	1
4F22	1
4F23	1
4F24	1
4F25	1
4F26	1
4F27	1
4F28	1
4F29	1
4F2A	1
4F2B	1
4F2C	1
4F2D	1
4F2E	1
4F2F	1
4F30	1
4F31	1
4F32	1
4F33	1
4F34	1
4F35	1
4F36	1
4F37	1
4F38	1
4F39	1
4F3A	1
4F3B	1
4F3C	1
4F3D	1
4F3E	1
4F3F	1
4F40	1
4F41	1
4F42	1
4F43	1
4F44	1
4F45	1
4F46	1
4F47	1
4F48	1
4F49	1
4F4A	1
4F4B	1
4F4C	1
4F4D	1
4F4E	1
4F4F	1
4F50	1
4F51	1
4F52	1
4F53	1
4F54	1
4F55	1
4F56	1
4F57	1
4F58	1
4F59	1
4F5A	1
4F5B	1
4F5C	1
4F5D	1
4F5E	1
4F5F	1
4F60	1
4F61	1
4F62	1
4F63	1
4F64	1
4F65	1
4F66	1
4F67	1
4F68	1
4F69	1
4F6A	1
4F6B	1
4F6C	1
4F6D	1
4F6E	1
4F6F	1
4F70	1
4F71	1
4F72	1
4F73	1
4F74	1
4F75	1
4F76	1
4F77	1
4F78	1
4F79	1
4F7A	1
4F7B	1
4F7C	1
4F7D	1
4F7E	1
4F7F	1
4F80	1
4F81	1
4F82	1
4F83	1
4F84	1
4F85	1
4F86	1
4F87	1
4F88	1
4F89	1
4F8A	1
4F8B	1
4F8C	1
4F8D	1
4F8E	1
4F8F	1
4F90	1
4F91	1
4F92	1
4F93	1
4F94	1
4F95	1
4F96	1
4F97	1
4F98	1
4F99	1
4F9A	1
4F9B	1
4F9C	1
4F9D	1
4F9E	1
4F9F	1
4FA0	1
4FA1	1
4FA2	1
4FA3	1
4FA4	1
4FA5	1
4FA6	1
4FA7	1
4FA8	1
4FA9	1
4FAA	1
4FAB	1
4FAC	1
4FAD	1
4FAE	1
4FAF	1
4FB0	1
4FB1	1
4FB2	1
4FB3	1
4FB4	1
4FB5	1
4FB6	1
4FB7	1
4FB8	1
4FB9	1
4FBA	1
4FBB	1
4FBC	1
4FBD	1
4FBE	1
4FBF	1
4FC0	1
4FC1	1
4FC2	1
4FC3	1
4FC4	1
4FC5	1
4FC6	1
4FC7	1
4FC8	1
4FC9	1
4FCA	1
4FCB	1
4FCC	1
4FCD	1
4FCE	1
4FCF	1
4FD0	1
4FD1	1
4FD2	1
4FD3	1
4FD4	1
4FD5	1
4FD6	1
4FD7	1
4FD8	1
4FD9	1
4FDA	1
4FDB	1
4FDC	1
4FDD	1
4FDE	1
4FDF	1
4FE0	1
4FE1	1
4FE2	1
4FE3	1
4FE4	1
4FE5	1
4FE6	1
4FE7	1
4FE8	1
4FE9	1
4FEA	1
4FEB	1
4FEC	1
4FED	1
4FEE	1
4FEF	1
4FF0	1
4FF1	1
4FF2	1
4FF3	1
4FF4	1
4FF5	1
4FF6	1
4FF7	1
4FF8	1
4FF9	1
4FFA	1
4FFB	1
4FFC	1
4FFD	1
4FFE	1
4FFF	1
237	1
238	1
239	1
23A	1
23B	1
23C	1
23D	1
23E	1
23F	1
240	1
241	1
242	1
243	1
244	1
245	1
246	1
247	1
248	1
249	1
24A	1
24B	1
24C	1
24D	1
24E	1
24F	1
358	1
359	1
35A	1
35B	1
35C	1
370	1
371	1
372	1
373	1
376	1
377	1
378	1
379	1
37B	1
37C	1
37D	1
37F	1
380	1
381	1
382	1
383	1
38B	1
38D	1
3A2	1
3CF	1
3FC	1
3FD	1
3FE	1
3FF	1
487	1
4CF	1
4F6	1
4F7	1
4FA	1
4FB	1
4FC	1
4FD	1
4FE	1
4FF	1
510	1
511	1
512	1
513	1
514	1
515	1
516	1
517	1
518	1
519	1
51A	1
51B	1
51C	1
51D	1
51E	1
51F	1
520	1
521	1
522	1
523	1
524	1
525	1
526	1
527	1
528	1
529	1
52A	1
52B	1
52C	1
52D	1
52E	1
52F	1
530	1
557	1
558	1
560	1
588	1
58B	1
58C	1
58D	1
58E	1
58F	1
590	1
5A2	1
5BA	1
5C5	1
5C6	1
5C7	1
5C8	1
5C9	1
5CA	1
5CB	1
5CC	1
5CD	1
5CE	1
5CF	1
5EB	1
5EC	1
5ED	1
5EE	1
5EF	1
5F5	1
5F6	1
5F7	1
5F8	1
5F9	1
5FA	1
5FB	1
5FC	1
5FD	1
5FE	1
5FF	1
604	1
605	1
606	1
607	1
608	1
609	1
60A	1
60B	1
616	1
617	1
618	1
619	1
61A	1
61C	1
61D	1
61E	1
620	1
63B	1
63C	1
63D	1
63E	1
63F	1
659	1
65A	1
65B	1
65C	1
65D	1
65E	1
65F	1
70E	1
74B	1
74C	1
750	1
751	1
752	1
753	1
754	1
755	1
756	1
757	1
758	1
759	1
75A	1
75B	1
75C	1
75D	1
75E	1
75F	1
760	1
761	1
762	1
763	1
764	1
765	1
766	1
767	1
768	1
769	1
76A	1
76B	1
76C	1
76D	1
76E	1
76F	1
770	1
771	1
772	1
773	1
774	1
775	1
776	1
777	1
778	1
779	1
77A	1
77B	1
77C	1
77D	1
77E	1
77F	1
7B2	1
7B3	1
7B4	1
7B5	1
7B6	1
7B7	1
7B8	1
7B9	1
7BA	1
7BB	1
7BC	1
7BD	1
7BE	1
7BF	1
7C0	1
7C1	1
7C2	1
7C3	1
7C4	1
7C5	1
7C6	1
7C7	1
7C8	1
7C9	1
7CA	1
7CB	1
7CC	1
7CD	1
7CE	1
7CF	1
7D0	1
7D1	1
7D2	1
7D3	1
7D4	1
7D5	1
7D6	1
7D7	1
7D8	1
7D9	1
7DA	1
7DB	1
7DC	1
7DD	1
7DE	1
7DF	1
7E0	1
7E1	1
7E2	1
7E3	1
7E4	1
7E5	1
7E6	1
7E7	1
7E8	1
7E9	1
7EA	1
7EB	1
7EC	1
7ED	1
7EE	1
7EF	1
7F0	1
7F1	1
7F2	1
7F3	1
7F4	1
7F5	1
7F6	1
7F7	1
7F8	1
7F9	1
7FA	1
7FB	1
7FC	1
7FD	1
7FE	1
7FF	1
DROP TABLE IF EXISTS test.t1;
DROP TABLE IF EXISTS test.t1;
DROP DATABASE test;
CREATE DATABASE test CHARACTER SET utf8mb3;
USE test;
SET NAMES utf8mb3;
Warnings:
Warning	1287	'utf8mb3' is deprecated and will be removed in a future release. Please use utf8mb4 instead
CREATE TABLE test.t1 (a CHAR(4) CHARACTER SET utf8mb3) ENGINE=MyISAM CHARACTER SET utf8mb3;
Warnings:
Warning	1287	'utf8mb3' is deprecated and will be removed in a future release. Please use utf8mb4 instead
Warning	1287	'utf8mb3' is deprecated and will be removed in a future release. Please use utf8mb4 instead
SHOW TABLE STATUS LIKE 't1';
Name	Engine	Version	Row_format	Rows	Avg_row_length	Data_length	Max_data_length	Index_length	Data_free	Auto_increment	Create_time	Update_time	Check_time	Collation	Checksum	Create_options	Comment
t1	MyISAM	#	#	#	#	#	#	#	#	#	#	#	#	utf8mb3_general_ci	#	#	#
LOAD DATA INFILE 
'MYSQL_TEST_DIR/suite/funcs_2/data/charset_utf8.txt' INTO TABLE test.t1;
ALTER TABLE test.t1 CHANGE a a CHAR(4) CHARACTER SET ucs2 COLLATE ucs2_general_ci;
Warnings:
Warning	1287	'ucs2' is deprecated and will be removed in a future release. Please use utf8mb4 instead
Warning	4079	'ucs2_general_ci' is a collation of the deprecated character set ucs2. Please consider using utf8mb4 with an appropriate collation instead.
DELETE FROM test.t1 WHERE CHAR_LENGTH(a) <> 1;
SELECT HEX(ORD(a)) AS a_ord, CHAR_LENGTH(a) AS a_len FROM test.t1 ORDER BY a, ORD(a);
a_ord	a_len
21	1
22	1
23	1
24	1
25	1
26	1
27	1
28	1
29	1
2A	1
2B	1
2C	1
2D	1
2E	1
2F	1
30	1
31	1
32	1
33	1
34	1
35	1
36	1
37	1
38	1
39	1
3A	1
3B	1
3C	1
3D	1
3E	1
3F	1
40	1
41	1
61	1
C0	1
C1	1
C2	1
C3	1
C4	1
C5	1
E0	1
E1	1
E2	1
E3	1
E4	1
E5	1
100	1
101	1
102	1
103	1
104	1
105	1
1CD	1
1CE	1
1DE	1
1DF	1
1E0	1
1E1	1
1FA	1
1FB	1
200	1
201	1
202	1
203	1
226	1
227	1
42	1
62	1
43	1
63	1
C7	1
E7	1
106	1
107	1
108	1
109	1
10A	1
10B	1
10C	1
10D	1
44	1
64	1
10E	1
10F	1
45	1
65	1
C8	1
C9	1
CA	1
CB	1
E8	1
E9	1
EA	1
EB	1
112	1
113	1
114	1
115	1
116	1
117	1
118	1
119	1
11A	1
11B	1
204	1
205	1
206	1
207	1
228	1
229	1
46	1
66	1
47	1
67	1
11C	1
11D	1
11E	1
11F	1
120	1
121	1
122	1
123	1
1E6	1
1E7	1
1F4	1
1F5	1
48	1
68	1
124	1
125	1
21E	1
21F	1
49	1
69	1
CC	1
CD	1
CE	1
CF	1
EC	1
ED	1
EE	1
EF	1
128	1
129	1
12A	1
12B	1
12C	1
12D	1
12E	1
12F	1
130	1
131	1
1CF	1
1D0	1
208	1
209	1
20A	1
20B	1
4A	1
6A	1
134	1
135	1
1F0	1
4B	1
6B	1
136	1
137	1
1E8	1
1E9	1
4C	1
6C	1
139	1
13A	1
13B	1
13C	1
13D	1
13E	1
4D	1
6D	1
4E	1
6E	1
D1	1
F1	1
143	1
144	1
145	1
146	1
147	1
148	1
1F8	1
1F9	1
4F	1
6F	1
D2	1
D3	1
D4	1
D5	1
D6	1
F2	1
F3	1
F4	1
F5	1
F6	1
14C	1
14D	1
14E	1
14F	1
150	1
151	1
1A0	1
1A1	1
1D1	1
1D2	1
1EA	1
1EB	1
1EC	1
1ED	1
20C	1
20D	1
20E	1
20F	1
22A	1
22B	1
22C	1
22D	1
22E	1
22F	1
230	1
231	1
50	1
70	1
51	1
71	1
52	1
72	1
154	1
155	1
156	1
157	1
158	1
159	1
210	1
211	1
212	1
213	1
53	1
73	1
DF	1
15A	1
15B	1
15C	1
15D	1
15E	1
15F	1
160	1
161	1
17F	1
218	1
219	1
54	1
74	1
162	1
163	1
164	1
165	1
21A	1
21B	1
55	1
75	1
D9	1
DA	1
DB	1
DC	1
F9	1
FA	1
FB	1
FC	1
168	1
169	1
16A	1
16B	1
16C	1
16D	1
16E	1
16F	1
170	1
171	1
172	1
173	1
1AF	1
1B0	1
1D3	1
1D4	1
1D5	1
1D6	1
1D7	1
1D8	1
1D9	1
1DA	1
1DB	1
1DC	1
214	1
215	1
216	1
217	1
56	1
76	1
57	1
77	1
174	1
175	1
58	1
78	1
59	1
79	1
DD	1
FD	1
FF	1
176	1
177	1
178	1
232	1
233	1
5A	1
7A	1
179	1
17A	1
17B	1
17C	1
17D	1
17E	1
5B	1
5E	1
5F	1
60	1
7B	1
7C	1
7D	1
7E	1
7F	1
80	1
81	1
82	1
83	1
84	1
85	1
86	1
87	1
88	1
89	1
8A	1
8B	1
8C	1
8D	1
8E	1
8F	1
90	1
91	1
92	1
93	1
94	1
95	1
96	1
97	1
98	1
99	1
9A	1
9B	1
9C	1
9D	1
9E	1
9F	1
A0	1
A1	1
A2	1
A3	1
A4	1
A5	1
A6	1
A7	1
A8	1
A9	1
AA	1
AB	1
AC	1
AD	1
AE	1
AF	1
B0	1
B1	1
B2	1
B3	1
B4	1
B6	1
B7	1
B8	1
B9	1
BA	1
BB	1
BC	1
BD	1
BE	1
BF	1
C6	1
E6	1
1E2	1
1E3	1
1FC	1
1FD	1
D0	1
F0	1
D7	1
D8	1
F8	1
1FE	1
1FF	1
DE	1
FE	1
F7	1
110	1
111	1
126	1
127	1
132	1
133	1
138	1
13F	1
140	1
141	1
142	1
149	1
14A	1
14B	1
152	1
153	1
166	1
167	1
180	1
181	1
253	1
182	1
183	1
184	1
185	1
186	1
254	1
187	1
188	1
189	1
256	1
18A	1
257	1
18B	1
18C	1
18D	1
18E	1
1DD	1
18F	1
259	1
190	1
25B	1
191	1
192	1
193	1
260	1
194	1
263	1
196	1
269	1
197	1
268	1
198	1
199	1
19A	1
19B	1
19C	1
26F	1
19D	1
272	1
19E	1
19F	1
275	1
1A2	1
1A3	1
1A4	1
1A5	1
1A6	1
280	1
1A7	1
1A8	1
1A9	1
283	1
1AA	1
1AB	1
1AC	1
1AD	1
1AE	1
288	1
1B1	1
28A	1
1B2	1
28B	1
1B3	1
1B4	1
1B5	1
1B6	1
1B7	1
1EE	1
1EF	1
292	1
1B8	1
1B9	1
1BA	1
1BB	1
1BC	1
1BD	1
1BE	1
1C0	1
1C1	1
1C2	1
1C3	1
1C4	1
1C5	1
1C6	1
1C7	1
1C8	1
1C9	1
1CA	1
1CB	1
1CC	1
1E4	1
1E5	1
1F1	1
1F2	1
1F3	1
195	1
1F6	1
1BF	1
1F7	1
21C	1
21D	1
220	1
221	1
222	1
223	1
224	1
225	1
234	1
235	1
236	1
237	1
238	1
239	1
23A	1
23B	1
23C	1
23D	1
23E	1
23F	1
240	1
241	1
242	1
243	1
244	1
245	1
246	1
247	1
248	1
249	1
24A	1
24B	1
24C	1
24D	1
24E	1
24F	1
250	1
251	1
252	1
255	1
258	1
25A	1
25C	1
25D	1
25E	1
25F	1
261	1
262	1
264	1
265	1
266	1
267	1
26A	1
26B	1
26C	1
26D	1
26E	1
270	1
271	1
273	1
274	1
276	1
277	1
278	1
279	1
27A	1
27B	1
27C	1
27D	1
27E	1
27F	1
281	1
282	1
284	1
285	1
286	1
287	1
289	1
28C	1
28D	1
28E	1
28F	1
290	1
291	1
293	1
294	1
295	1
296	1
297	1
298	1
299	1
29A	1
29B	1
29C	1
29D	1
29E	1
29F	1
2A0	1
2A1	1
2A2	1
2A3	1
2A4	1
2A5	1
2A6	1
2A7	1
2A8	1
2A9	1
2AA	1
2AB	1
2AC	1
2AD	1
2AE	1
2AF	1
2B0	1
2B1	1
2B2	1
2B3	1
2B4	1
2B5	1
2B6	1
2B7	1
2B8	1
2B9	1
2BA	1
2BB	1
2BC	1
2BD	1
2BE	1
2BF	1
2C0	1
2C1	1
2C2	1
2C3	1
2C4	1
2C5	1
2C6	1
2C7	1
2C8	1
2C9	1
2CA	1
2CB	1
2CC	1
2CD	1
2CE	1
2CF	1
2D0	1
2D1	1
2D2	1
2D3	1
2D4	1
2D5	1
2D6	1
2D7	1
2D8	1
2D9	1
2DA	1
2DB	1
2DC	1
2DD	1
2DE	1
2DF	1
2E0	1
2E1	1
2E2	1
2E3	1
2E4	1
2E5	1
2E6	1
2E7	1
2E8	1
2E9	1
2EA	1
2EB	1
2EC	1
2ED	1
2EE	1
2EF	1
2F0	1
2F1	1
2F2	1
2F3	1
2F4	1
2F5	1
2F6	1
2F7	1
2F8	1
2F9	1
2FA	1
2FB	1
2FC	1
2FD	1
2FE	1
2FF	1
300	1
301	1
302	1
303	1
304	1
305	1
306	1
307	1
308	1
309	1
30A	1
30B	1
30C	1
30D	1
30E	1
30F	1
310	1
311	1
312	1
313	1
314	1
315	1
316	1
317	1
318	1
319	1
31A	1
31B	1
31C	1
31D	1
31E	1
31F	1
320	1
321	1
322	1
323	1
324	1
325	1
326	1
327	1
328	1
329	1
32A	1
32B	1
32C	1
32D	1
32E	1
32F	1
330	1
331	1
332	1
333	1
334	1
335	1
336	1
337	1
338	1
339	1
33A	1
33B	1
33C	1
33D	1
33E	1
33F	1
340	1
341	1
342	1
343	1
344	1
346	1
347	1
348	1
349	1
34A	1
34B	1
34C	1
34D	1
34E	1
34F	1
350	1
351	1
352	1
353	1
354	1
355	1
356	1
357	1
358	1
359	1
35A	1
35B	1
35C	1
35D	1
35E	1
35F	1
360	1
361	1
362	1
363	1
364	1
365	1
366	1
367	1
368	1
369	1
36A	1
36B	1
36C	1
36D	1
36E	1
36F	1
370	1
371	1
372	1
373	1
374	1
375	1
376	1
377	1
378	1
379	1
37A	1
37B	1
37C	1
37D	1
37E	1
37F	1
380	1
381	1
382	1
383	1
384	1
385	1
387	1
38B	1
38D	1
386	1
391	1
3AC	1
3B1	1
392	1
3B2	1
3D0	1
393	1
3B3	1
394	1
3B4	1
388	1
395	1
3AD	1
3B5	1
396	1
3B6	1
389	1
397	1
3AE	1
3B7	1
398	1
3B8	1
3D1	1
345	1
38A	1
390	1
399	1
3AA	1
3AF	1
3B9	1
3CA	1
39A	1
3BA	1
3F0	1
39B	1
3BB	1
B5	1
39C	1
3BC	1
39D	1
3BD	1
39E	1
3BE	1
38C	1
39F	1
3BF	1
3CC	1
3A0	1
3C0	1
3D6	1
3A1	1
3C1	1
3F1	1
3A2	1
3A3	1
3C2	1
3C3	1
3F2	1
3A4	1
3C4	1
38E	1
3A5	1
3AB	1
3B0	1
3C5	1
3CB	1
3CD	1
3A6	1
3C6	1
3D5	1
3A7	1
3C7	1
3A8	1
3C8	1
38F	1
3A9	1
3C9	1
3CE	1
3CF	1
3D2	1
3D3	1
3D4	1
3D7	1
3D8	1
3D9	1
3DA	1
3DB	1
3DC	1
3DD	1
3DE	1
3DF	1
3E0	1
3E1	1
3E2	1
3E3	1
3E4	1
3E5	1
3E6	1
3E7	1
3E8	1
3E9	1
3EA	1
3EB	1
3EC	1
3ED	1
3EE	1
3EF	1
3F3	1
3F4	1
3F5	1
3F6	1
3F7	1
3F8	1
3F9	1
3FA	1
3FB	1
3FC	1
3FD	1
3FE	1
3FF	1
402	1
452	1
404	1
454	1
405	1
455	1
406	1
407	1
456	1
457	1
408	1
458	1
409	1
459	1
40A	1
45A	1
40B	1
45B	1
40F	1
45F	1
410	1
430	1
4D0	1
4D1	1
4D2	1
4D3	1
411	1
431	1
412	1
432	1
403	1
413	1
433	1
453	1
414	1
434	1
400	1
401	1
415	1
435	1
450	1
451	1
4D6	1
4D7	1
416	1
436	1
4C1	1
4C2	1
4DC	1
4DD	1
417	1
437	1
4DE	1
4DF	1
40D	1
418	1
438	1
45D	1
4E2	1
4E3	1
4E4	1
4E5	1
419	1
439	1
40C	1
41A	1
43A	1
45C	1
41B	1
43B	1
41C	1
43C	1
41D	1
43D	1
41E	1
43E	1
4E6	1
4E7	1
41F	1
43F	1
420	1
440	1
421	1
441	1
422	1
442	1
40E	1
423	1
443	1
45E	1
4EE	1
4EF	1
4F0	1
4F1	1
4F2	1
4F3	1
424	1
444	1
425	1
445	1
426	1
446	1
427	1
447	1
4F4	1
4F5	1
428	1
448	1
429	1
449	1
42A	1
44A	1
42B	1
44B	1
4F8	1
4F9	1
42C	1
44C	1
42D	1
44D	1
4EC	1
4ED	1
42E	1
44E	1
42F	1
44F	1
460	1
461	1
462	1
463	1
464	1
465	1
466	1
467	1
468	1
469	1
46A	1
46B	1
46C	1
46D	1
46E	1
46F	1
470	1
471	1
472	1
473	1
474	1
475	1
476	1
477	1
478	1
479	1
47A	1
47B	1
47C	1
47D	1
47E	1
47F	1
480	1
481	1
482	1
483	1
484	1
485	1
486	1
487	1
488	1
489	1
48A	1
48B	1
48C	1
48D	1
48E	1
48F	1
490	1
491	1
492	1
493	1
494	1
495	1
496	1
497	1
498	1
499	1
49A	1
49B	1
49C	1
49D	1
49E	1
49F	1
4A0	1
4A1	1
4A2	1
4A3	1
4A4	1
4A5	1
4A6	1
4A7	1
4A8	1
4A9	1
4AA	1
4AB	1
4AC	1
4AD	1
4AE	1
4AF	1
4B0	1
4B1	1
4B2	1
4B3	1
4B4	1
4B5	1
4B6	1
4B7	1
4B8	1
4B9	1
4BA	1
4BB	1
4BC	1
4BD	1
4BE	1
4BF	1
4C0	1
4C3	1
4C4	1
4C5	1
4C6	1
4C7	1
4C8	1
4C9	1
4CA	1
4CB	1
4CC	1
4CD	1
4CE	1
4CF	1
4D4	1
4D5	1
4D8	1
4D9	1
4DA	1
4DB	1
4E0	1
4E1	1
4E8	1
4E9	1
4EA	1
4EB	1
4F6	1
4F7	1
4FA	1
4FB	1
4FC	1
4FD	1
4FE	1
4FF	1
500	1
501	1
502	1
503	1
504	1
505	1
506	1
507	1
508	1
509	1
50A	1
50B	1
50C	1
50D	1
50E	1
50F	1
510	1
511	1
512	1
513	1
514	1
515	1
516	1
517	1
518	1
519	1
51A	1
51B	1
51C	1
51D	1
51E	1
51F	1
520	1
521	1
522	1
523	1
524	1
525	1
526	1
527	1
528	1
529	1
52A	1
52B	1
52C	1
52D	1
52E	1
52F	1
530	1
531	1
561	1
532	1
562	1
533	1
563	1
534	1
564	1
535	1
565	1
536	1
566	1
537	1
567	1
538	1
568	1
539	1
569	1
53A	1
56A	1
53B	1
56B	1
53C	1
56C	1
53D	1
56D	1
53E	1
56E	1
53F	1
56F	1
540	1
570	1
541	1
571	1
542	1
572	1
543	1
573	1
544	1
574	1
545	1
575	1
546	1
576	1
547	1
577	1
548	1
578	1
549	1
579	1
54A	1
57A	1
54B	1
57B	1
54C	1
57C	1
54D	1
57D	1
54E	1
57E	1
54F	1
57F	1
550	1
580	1
551	1
581	1
552	1
582	1
553	1
583	1
554	1
584	1
555	1
585	1
556	1
586	1
557	1
558	1
559	1
55A	1
55B	1
55C	1
55D	1
55E	1
55F	1
560	1
587	1
588	1
589	1
58A	1
58B	1
58C	1
58D	1
58E	1
58F	1
590	1
591	1
592	1
593	1
594	1
595	1
596	1
597	1
598	1
599	1
59A	1
59B	1
59C	1
59D	1
59E	1
59F	1
5A0	1
5A1	1
5A2	1
5A3	1
5A4	1
5A5	1
5A6	1
5A7	1
5A8	1
5A9	1
5AA	1
5AB	1
5AC	1
5AD	1
5AE	1
5AF	1
5B0	1
5B1	1
5B2	1
5B3	1
5B4	1
5B5	1
5B6	1
5B7	1
5B8	1
5B9	1
5BA	1
5BB	1
5BC	1
5BD	1
5BE	1
5BF	1
5C0	1
5C1	1
5C2	1
5C3	1
5C4	1
5C5	1
5C6	1
5C7	1
5C8	1
5C9	1
5CA	1
5CB	1
5CC	1
5CD	1
5CE	1
5CF	1
5D0	1
5D1	1
5D2	1
5D3	1
5D4	1
5D5	1
5D6	1
5D7	1
5D8	1
5D9	1
5DA	1
5DB	1
5DC	1
5DD	1
5DE	1
5DF	1
5E0	1
5E1	1
5E2	1
5E3	1
5E4	1
5E5	1
5E6	1
5E7	1
5E8	1
5E9	1
5EA	1
5EB	1
5EC	1
5ED	1
5EE	1
5EF	1
5F0	1
5F1	1
5F2	1
5F3	1
5F4	1
5F5	1
5F6	1
5F7	1
5F8	1
5F9	1
5FA	1
5FB	1
5FC	1
5FD	1
5FE	1
5FF	1
600	1
601	1
602	1
603	1
604	1
605	1
606	1
607	1
608	1
609	1
60A	1
60B	1
60C	1
60D	1
60E	1
60F	1
610	1
611	1
612	1
613	1
614	1
615	1
616	1
617	1
618	1
619	1
61A	1
61B	1
61C	1
61D	1
61E	1
61F	1
620	1
621	1
622	1
623	1
624	1
625	1
626	1
627	1
628	1
629	1
62A	1
62B	1
62C	1
62D	1
62E	1
62F	1
630	1
631	1
632	1
633	1
634	1
635	1
636	1
637	1
638	1
639	1
63A	1
63B	1
63C	1
63D	1
63E	1
63F	1
640	1
641	1
642	1
643	1
644	1
645	1
646	1
647	1
648	1
649	1
64A	1
64B	1
64C	1
64D	1
64E	1
64F	1
650	1
651	1
652	1
653	1
654	1
655	1
656	1
657	1
658	1
659	1
65A	1
65B	1
65C	1
65D	1
65E	1
65F	1
660	1
661	1
662	1
663	1
664	1
665	1
666	1
667	1
668	1
669	1
66A	1
66B	1
66C	1
66D	1
66E	1
66F	1
670	1
671	1
672	1
673	1
674	1
675	1
676	1
677	1
678	1
679	1
67A	1
67B	1
67C	1
67D	1
67E	1
67F	1
680	1
681	1
682	1
683	1
684	1
685	1
686	1
687	1
688	1
689	1
68A	1
68B	1
68C	1
68D	1
68E	1
68F	1
690	1
691	1
692	1
693	1
694	1
695	1
696	1
697	1
698	1
699	1
69A	1
69B	1
69C	1
69D	1
69E	1
69F	1
6A0	1
6A1	1
6A2	1
6A3	1
6A4	1
6A5	1
6A6	1
6A7	1
6A8	1
6A9	1
6AA	1
6AB	1
6AC	1
6AD	1
6AE	1
6AF	1
6B0	1
6B1	1
6B2	1
6B3	1
6B4	1
6B5	1
6B6	1
6B7	1
6B8	1
6B9	1
6BA	1
6BB	1
6BC	1
6BD	1
6BE	1
6BF	1
6C0	1
6C1	1
6C2	1
6C3	1
6C4	1
6C5	1
6C6	1
6C7	1
6C8	1
6C9	1
6CA	1
6CB	1
6CC	1
6CD	1
6CE	1
6CF	1
6D0	1
6D1	1
6D2	1
6D3	1
6D4	1
6D5	1
6D6	1
6D7	1
6D8	1
6D9	1
6DA	1
6DB	1
6DC	1
6DD	1
6DE	1
6DF	1
6E0	1
6E1	1
6E2	1
6E3	1
6E4	1
6E5	1
6E6	1
6E7	1
6E8	1
6E9	1
6EA	1
6EB	1
6EC	1
6ED	1
6EE	1
6EF	1
6F0	1
6F1	1
6F2	1
6F3	1
6F4	1
6F5	1
6F6	1
6F7	1
6F8	1
6F9	1
6FA	1
6FB	1
6FC	1
6FD	1
6FE	1
6FF	1
700	1
701	1
702	1
703	1
704	1
705	1
706	1
707	1
708	1
709	1
70A	1
70B	1
70C	1
70D	1
70E	1
70F	1
710	1
711	1
712	1
713	1
714	1
715	1
716	1
717	1
718	1
719	1
71A	1
71B	1
71C	1
71D	1
71E	1
71F	1
720	1
721	1
722	1
723	1
724	1
725	1
726	1
727	1
728	1
729	1
72A	1
72B	1
72C	1
72D	1
72E	1
72F	1
730	1
731	1
732	1
733	1
734	1
735	1
736	1
737	1
738	1
739	1
73A	1
73B	1
73C	1
73D	1
73E	1
73F	1
740	1
741	1
742	1
743	1
744	1
745	1
746	1
747	1
748	1
749	1
74A	1
74B	1
74C	1
74D	1
74E	1
74F	1
750	1
751	1
752	1
753	1
754	1
755	1
756	1
757	1
758	1
759	1
75A	1
75B	1
75C	1
75D	1
75E	1
75F	1
760	1
761	1
762	1
763	1
764	1
765	1
766	1
767	1
768	1
769	1
76A	1
76B	1
76C	1
76D	1
76E	1
76F	1
770	1
771	1
772	1
773	1
774	1
775	1
776	1
777	1
778	1
779	1
77A	1
77B	1
77C	1
77D	1
77E	1
77F	1
780	1
781	1
782	1
783	1
784	1
785	1
786	1
787	1
788	1
789	1
78A	1
78B	1
78C	1
78D	1
78E	1
78F	1
790	1
791	1
792	1
793	1
794	1
795	1
796	1
797	1
798	1
799	1
79A	1
79B	1
79C	1
79D	1
79E	1
79F	1
7A0	1
7A1	1
7A2	1
7A3	1
7A4	1
7A5	1
7A6	1
7A7	1
7A8	1
7A9	1
7AA	1
7AB	1
7AC	1
7AD	1
7AE	1
7AF	1
7B0	1
7B1	1
7B2	1
7B3	1
7B4	1
7B5	1
7B6	1
7B7	1
7B8	1
7B9	1
7BA	1
7BB	1
7BC	1
7BD	1
7BE	1
7BF	1
7C0	1
7C1	1
7C2	1
7C3	1
7C4	1
7C5	1
7C6	1
7C7	1
7C8	1
7C9	1
7CA	1
7CB	1
7CC	1
7CD	1
7CE	1
7CF	1
7D0	1
7D1	1
7D2	1
7D3	1
7D4	1
7D5	1
7D6	1
7D7	1
7D8	1
7D9	1
7DA	1
7DB	1
7DC	1
7DD	1
7DE	1
7DF	1
7E0	1
7E1	1
7E2	1
7E3	1
7E4	1
7E5	1
7E6	1
7E7	1
7E8	1
7E9	1
7EA	1
7EB	1
7EC	1
7ED	1
7EE	1
7EF	1
7F0	1
7F1	1
7F2	1
7F3	1
7F4	1
7F5	1
7F6	1
7F7	1
7F8	1
7F9	1
7FA	1
7FB	1
7FC	1
7FD	1
7FE	1
7FF	1
4E00	1
4E01	1
4E02	1
4E03	1
4E04	1
4E05	1
4E06	1
4E07	1
4E08	1
4E09	1
4E0A	1
4E0B	1
4E0C	1
4E0D	1
4E0E	1
4E0F	1
4E10	1
4E11	1
4E12	1
4E13	1
4E14	1
4E15	1
4E16	1
4E17	1
4E18	1
4E19	1
4E1A	1
4E1B	1
4E1C	1
4E1D	1
4E1E	1
4E1F	1
4E20	1
4E21	1
4E22	1
4E23	1
4E24	1
4E25	1
4E26	1
4E27	1
4E28	1
4E29	1
4E2A	1
4E2B	1
4E2C	1
4E2D	1
4E2E	1
4E2F	1
4E30	1
4E31	1
4E32	1
4E33	1
4E34	1
4E35	1
4E36	1
4E37	1
4E38	1
4E39	1
4E3A	1
4E3B	1
4E3C	1
4E3D	1
4E3E	1
4E3F	1
4E40	1
4E41	1
4E42	1
4E43	1
4E44	1
4E45	1
4E46	1
4E47	1
4E48	1
4E49	1
4E4A	1
4E4B	1
4E4C	1
4E4D	1
4E4E	1
4E4F	1
4E50	1
4E51	1
4E52	1
4E53	1
4E54	1
4E55	1
4E56	1
4E57	1
4E58	1
4E59	1
4E5A	1
4E5B	1
4E5C	1
4E5D	1
4E5E	1
4E5F	1
4E60	1
4E61	1
4E62	1
4E63	1
4E64	1
4E65	1
4E66	1
4E67	1
4E68	1
4E69	1
4E6A	1
4E6B	1
4E6C	1
4E6D	1
4E6E	1
4E6F	1
4E70	1
4E71	1
4E72	1
4E73	1
4E74	1
4E75	1
4E76	1
4E77	1
4E78	1
4E79	1
4E7A	1
4E7B	1
4E7C	1
4E7D	1
4E7E	1
4E7F	1
4E80	1
4E81	1
4E82	1
4E83	1
4E84	1
4E85	1
4E86	1
4E87	1
4E88	1
4E89	1
4E8A	1
4E8B	1
4E8C	1
4E8D	1
4E8E	1
4E8F	1
4E90	1
4E91	1
4E92	1
4E93	1
4E94	1
4E95	1
4E96	1
4E97	1
4E98	1
4E99	1
4E9A	1
4E9B	1
4E9C	1
4E9D	1
4E9E	1
4E9F	1
4EA0	1
4EA1	1
4EA2	1
4EA3	1
4EA4	1
4EA5	1
4EA6	1
4EA7	1
4EA8	1
4EA9	1
4EAA	1
4EAB	1
4EAC	1
4EAD	1
4EAE	1
4EAF	1
4EB0	1
4EB1	1
4EB2	1
4EB3	1
4EB4	1
4EB5	1
4EB6	1
4EB7	1
4EB8	1
4EB9	1
4EBA	1
4EBB	1
4EBC	1
4EBD	1
4EBE	1
4EBF	1
4EC0	1
4EC1	1
4EC2	1
4EC3	1
4EC4	1
4EC5	1
4EC6	1
4EC7	1
4EC8	1
4EC9	1
4ECA	1
4ECB	1
4ECC	1
4ECD	1
4ECE	1
4ECF	1
4ED0	1
4ED1	1
4ED2	1
4ED3	1
4ED4	1
4ED5	1
4ED6	1
4ED7	1
4ED8	1
4ED9	1
4EDA	1
4EDB	1
4EDC	1
4EDD	1
4EDE	1
4EDF	1
4EE0	1
4EE1	1
4EE2	1
4EE3	1
4EE4	1
4EE5	1
4EE6	1
4EE7	1
4EE8	1
4EE9	1
4EEA	1
4EEB	1
4EEC	1
4EED	1
4EEE	1
4EEF	1
4EF0	1
4EF1	1
4EF2	1
4EF3	1
4EF4	1
4EF5	1
4EF6	1
4EF7	1
4EF8	1
4EF9	1
4EFA	1
4EFB	1
4EFC	1
4EFD	1
4EFE	1
4EFF	1
4F00	1
4F01	1
4F02	1
4F03	1
4F04	1
4F05	1
4F06	1
4F07	1
4F08	1
4F09	1
4F0A	1
4F0B	1
4F0C	1
4F0D	1
4F0E	1
4F0F	1
4F10	1
4F11	1
4F12	1
4F13	1
4F14	1
4F15	1
4F16	1
4F17	1
4F18	1
4F19	1
4F1A	1
4F1B	1
4F1C	1
4F1D	1
4F1E	1
4F1F	1
4F20	1
4F21	1
4F22	1
4F23	1
4F24	1
4F25	1
4F26	1
4F27	1
4F28	1
4F29	1
4F2A	1
4F2B	1
4F2C	1
4F2D	1
4F2E	1
4F2F	1
4F30	1
4F31	1
4F32	1
4F33	1
4F34	1
4F35	1
4F36	1
4F37	1
4F38	1
4F39	1
4F3A	1
4F3B	1
4F3C	1
4F3D	1
4F3E	1
4F3F	1
4F40	1
4F41	1
4F42	1
4F43	1
4F44	1
4F45	1
4F46	1
4F47	1
4F48	1
4F49	1
4F4A	1
4F4B	1
4F4C	1
4F4D	1
4F4E	1
4F4F	1
4F50	1
4F51	1
4F52	1
4F53	1
4F54	1
4F55	1
4F56	1
4F57	1
4F58	1
4F59	1
4F5A	1
4F5B	1
4F5C	1
4F5D	1
4F5E	1
4F5F	1
4F60	1
4F61	1
4F62	1
4F63	1
4F64	1
4F65	1
4F66	1
4F67	1
4F68	1
4F69	1
4F6A	1
4F6B	1
4F6C	1
4F6D	1
4F6E	1
4F6F	1
4F70	1
4F71	1
4F72	1
4F73	1
4F74	1
4F75	1
4F76	1
4F77	1
4F78	1
4F79	1
4F7A	1
4F7B	1
4F7C	1
4F7D	1
4F7E	1
4F7F	1
4F80	1
4F81	1
4F82	1
4F83	1
4F84	1
4F85	1
4F86	1
4F87	1
4F88	1
4F89	1
4F8A	1
4F8B	1
4F8C	1
4F8D	1
4F8E	1
4F8F	1
4F90	1
4F91	1
4F92	1
4F93	1
4F94	1
4F95	1
4F96	1
4F97	1
4F98	1
4F99	1
4F9A	1
4F9B	1
4F9C	1
4F9D	1
4F9E	1
4F9F	1
4FA0	1
4FA1	1
4FA2	1
4FA3	1
4FA4	1
4FA5	1
4FA6	1
4FA7	1
4FA8	1
4FA9	1
4FAA	1
4FAB	1
4FAC	1
4FAD	1
4FAE	1
4FAF	1
4FB0	1
4FB1	1
4FB2	1
4FB3	1
4FB4	1
4FB5	1
4FB6	1
4FB7	1
4FB8	1
4FB9	1
4FBA	1
4FBB	1
4FBC	1
4FBD	1
4FBE	1
4FBF	1
4FC0	1
4FC1	1
4FC2	1
4FC3	1
4FC4	1
4FC5	1
4FC6	1
4FC7	1
4FC8	1
4FC9	1
4FCA	1
4FCB	1
4FCC	1
4FCD	1
4FCE	1
4FCF	1
4FD0	1
4FD1	1
4FD2	1
4FD3	1
4FD4	1
4FD5	1
4FD6	1
4FD7	1
4FD8	1
4FD9	1
4FDA	1
4FDB	1
4FDC	1
4FDD	1
4FDE	1
4FDF	1
4FE0	1
4FE1	1
4FE2	1
4FE3	1
4FE4	1
4FE5	1
4FE6	1
4FE7	1
4FE8	1
4FE9	1
4FEA	1
4FEB	1
4FEC	1
4FED	1
4FEE	1
4FEF	1
4FF0	1
4FF1	1
4FF2	1
4FF3	1
4FF4	1
4FF5	1
4FF6	1
4FF7	1
4FF8	1
4FF9	1
4FFA	1
4FFB	1
4FFC	1
4FFD	1
4FFE	1
4FFF	1
DROP TABLE IF EXISTS test.t1;
DROP TABLE IF EXISTS test.t1;
DROP DATABASE test;
CREATE DATABASE test CHARACTER SET utf8mb3;
USE test;
SET NAMES utf8mb3;
Warnings:
Warning	1287	'utf8mb3' is deprecated and will be removed in a future release. Please use utf8mb4 instead
CREATE TABLE test.t1 (a CHAR(4) CHARACTER SET utf8mb3) ENGINE=MyISAM CHARACTER SET utf8mb3;
Warnings:
Warning	1287	'utf8mb3' is deprecated and will be removed in a future release. Please use utf8mb4 instead
Warning	1287	'utf8mb3' is deprecated and will be removed in a future release. Please use utf8mb4 instead
SHOW TABLE STATUS LIKE 't1';
Name	Engine	Version	Row_format	Rows	Avg_row_length	Data_length	Max_data_length	Index_length	Data_free	Auto_increment	Create_time	Update_time	Check_time	Collation	Checksum	Create_options	Comment
t1	MyISAM	#	#	#	#	#	#	#	#	#	#	#	#	utf8mb3_general_ci	#	#	#
LOAD DATA INFILE 
'MYSQL_TEST_DIR/suite/funcs_2/data/charset_utf8.txt' INTO TABLE test.t1;
ALTER TABLE test.t1 CHANGE a a CHAR(4) CHARACTER SET ucs2 COLLATE ucs2_hungarian_ci;
Warnings:
Warning	1287	'ucs2' is deprecated and will be removed in a future release. Please use utf8mb4 instead
Warning	4079	'ucs2_hungarian_ci' is a collation of the deprecated character set ucs2. Please consider using utf8mb4 with an appropriate collation instead.
DELETE FROM test.t1 WHERE CHAR_LENGTH(a) <> 1;
SELECT HEX(ORD(a)) AS a_ord, CHAR_LENGTH(a) AS a_len FROM test.t1 ORDER BY a, ORD(a);
a_ord	a_len
85	1
7F	1
80	1
81	1
82	1
83	1
84	1
86	1
87	1
88	1
89	1
8A	1
8B	1
8C	1
8D	1
8E	1
8F	1
90	1
91	1
92	1
93	1
94	1
95	1
96	1
97	1
98	1
99	1
9A	1
9B	1
9C	1
9D	1
9E	1
9F	1
A0	1
300	1
301	1
302	1
303	1
304	1
305	1
306	1
307	1
308	1
309	1
30A	1
30B	1
30C	1
30D	1
30E	1
30F	1
310	1
311	1
312	1
313	1
314	1
315	1
316	1
317	1
318	1
319	1
31A	1
31B	1
31C	1
31D	1
31E	1
31F	1
320	1
321	1
322	1
323	1
324	1
325	1
326	1
327	1
328	1
329	1
32A	1
32B	1
32C	1
32D	1
32E	1
32F	1
330	1
331	1
332	1
333	1
334	1
335	1
336	1
337	1
338	1
339	1
33A	1
33B	1
33C	1
33D	1
33E	1
33F	1
340	1
341	1
342	1
343	1
344	1
345	1
346	1
347	1
348	1
349	1
34A	1
34B	1
34C	1
34D	1
34E	1
34F	1
350	1
351	1
352	1
353	1
354	1
355	1
356	1
357	1
35D	1
35E	1
35F	1
360	1
361	1
362	1
483	1
484	1
485	1
486	1
488	1
489	1
591	1
592	1
593	1
594	1
595	1
596	1
597	1
598	1
599	1
59A	1
59B	1
59C	1
59D	1
59E	1
59F	1
5A0	1
5A1	1
5A3	1
5A4	1
5A5	1
5A6	1
5A7	1
5A8	1
5A9	1
5AA	1
5AB	1
5AC	1
5AD	1
5AE	1
5AF	1
5B0	1
5B1	1
5B2	1
5B3	1
5B4	1
5B5	1
5B6	1
5B7	1
5B8	1
5B9	1
5BB	1
5BC	1
5BD	1
5BF	1
5C1	1
5C2	1
5C4	1
600	1
601	1
602	1
603	1
610	1
611	1
612	1
613	1
614	1
615	1
64B	1
64C	1
64D	1
64E	1
64F	1
650	1
651	1
652	1
653	1
654	1
655	1
656	1
657	1
658	1
670	1
6D6	1
6D7	1
6D8	1
6D9	1
6DA	1
6DB	1
6DC	1
6DD	1
6DE	1
6DF	1
6E0	1
6E1	1
6E2	1
6E3	1
6E4	1
6E7	1
6E8	1
6EA	1
6EB	1
6EC	1
6ED	1
70F	1
711	1
730	1
731	1
732	1
733	1
734	1
735	1
736	1
737	1
738	1
739	1
73A	1
73B	1
73C	1
73D	1
73E	1
73F	1
740	1
741	1
742	1
743	1
744	1
745	1
746	1
747	1
748	1
749	1
74A	1
640	1
60	1
B4	1
384	1
2DC	1
5E	1
AF	1
2D8	1
2D9	1
A8	1
385	1
2DA	1
2DD	1
B8	1
2DB	1
5F	1
AD	1
2D	1
58A	1
2C	1
55D	1
60C	1
60D	1
66B	1
66C	1
3B	1
37E	1
61B	1
3A	1
589	1
703	1
704	1
705	1
706	1
707	1
708	1
21	1
A1	1
55C	1
3F	1
BF	1
55E	1
61F	1
709	1
2E	1
6D4	1
701	1
702	1
B7	1
387	1
700	1
27	1
22	1
AB	1
BB	1
28	1
29	1
5B	1
7B	1
7D	1
A7	1
B6	1
A9	1
AE	1
40	1
2A	1
66D	1
2F	1
26	1
23	1
25	1
66A	1
55A	1
55B	1
55F	1
5BE	1
5C0	1
5C3	1
5F3	1
5F4	1
70A	1
70B	1
70C	1
70D	1
2B9	1
374	1
375	1
2BA	1
2C2	1
2C3	1
2C4	1
2C5	1
2C6	1
2C7	1
2C8	1
2C9	1
2CA	1
2CB	1
2CC	1
2CD	1
2CE	1
2CF	1
2D2	1
2D3	1
2D4	1
2D5	1
2D6	1
2D7	1
2DE	1
2DF	1
2E5	1
2E6	1
2E7	1
2E8	1
2E9	1
2EA	1
2EB	1
2EC	1
2ED	1
2EF	1
2F0	1
2F1	1
2F2	1
2F3	1
2F4	1
2F5	1
2F6	1
2F7	1
2F8	1
2F9	1
2FA	1
2FB	1
2FC	1
2FD	1
2FE	1
2FF	1
B0	1
482	1
60E	1
60F	1
6E9	1
3F6	1
2B	1
B1	1
F7	1
D7	1
3C	1
3D	1
3E	1
AC	1
7C	1
A6	1
7E	1
2D0	1
2D1	1
A4	1
A2	1
24	1
A3	1
A5	1
30	1
660	1
6F0	1
31	1
B9	1
661	1
6F1	1
BD	1
BC	1
32	1
B2	1
662	1
6F2	1
33	1
B3	1
663	1
6F3	1
BE	1
34	1
664	1
6F4	1
35	1
665	1
6F5	1
36	1
666	1
6F6	1
37	1
667	1
6F7	1
38	1
668	1
6F8	1
39	1
669	1
6F9	1
41	1
61	1
AA	1
C0	1
C1	1
C2	1
C3	1
C4	1
C5	1
E0	1
E1	1
E2	1
E3	1
E4	1
E5	1
100	1
101	1
102	1
103	1
104	1
105	1
1CD	1
1CE	1
1DE	1
1DF	1
1E0	1
1E1	1
1FA	1
1FB	1
200	1
201	1
202	1
203	1
226	1
227	1
363	1
C6	1
E6	1
1E2	1
1E3	1
1FC	1
1FD	1
250	1
251	1
252	1
42	1
62	1
299	1
180	1
181	1
253	1
182	1
183	1
43	1
63	1
C7	1
E7	1
106	1
107	1
108	1
109	1
10A	1
10B	1
10C	1
10D	1
368	1
187	1
188	1
255	1
44	1
64	1
10E	1
10F	1
369	1
1C4	1
1C5	1
1C6	1
1F1	1
1F2	1
1F3	1
2A3	1
2A5	1
2A4	1
110	1
111	1
189	1
256	1
18A	1
257	1
18B	1
18C	1
221	1
D0	1
F0	1
45	1
65	1
C8	1
C9	1
CA	1
CB	1
E8	1
E9	1
EA	1
EB	1
112	1
113	1
114	1
115	1
116	1
117	1
118	1
119	1
11A	1
11B	1
204	1
205	1
206	1
207	1
228	1
229	1
364	1
18E	1
1DD	1
18F	1
259	1
190	1
25B	1
258	1
25A	1
25C	1
25D	1
25E	1
29A	1
264	1
46	1
66	1
2A9	1
191	1
192	1
47	1
67	1
11C	1
11D	1
11E	1
11F	1
120	1
121	1
122	1
123	1
1E6	1
1E7	1
1F4	1
1F5	1
261	1
262	1
1E4	1
1E5	1
193	1
260	1
29B	1
194	1
263	1
2E0	1
1A2	1
1A3	1
48	1
68	1
124	1
125	1
21E	1
21F	1
2B0	1
36A	1
29C	1
195	1
1F6	1
126	1
127	1
266	1
2B1	1
267	1
2BB	1
2BD	1
49	1
69	1
CC	1
CD	1
CE	1
CF	1
EC	1
ED	1
EE	1
EF	1
128	1
129	1
12A	1
12B	1
12C	1
12D	1
12E	1
12F	1
130	1
1CF	1
1D0	1
208	1
209	1
20A	1
20B	1
365	1
132	1
133	1
131	1
26A	1
197	1
268	1
196	1
269	1
4A	1
6A	1
134	1
135	1
1F0	1
2B2	1
29D	1
25F	1
284	1
4B	1
6B	1
136	1
137	1
1E8	1
1E9	1
198	1
199	1
29E	1
4C	1
6C	1
139	1
13A	1
13B	1
13C	1
13D	1
13E	1
2E1	1
13F	1
140	1
1C7	1
1C8	1
1C9	1
2AA	1
2AB	1
29F	1
141	1
142	1
19A	1
26B	1
26C	1
26D	1
234	1
26E	1
19B	1
28E	1
4D	1
6D	1
36B	1
271	1
4E	1
6E	1
D1	1
F1	1
143	1
144	1
145	1
146	1
147	1
148	1
1F8	1
1F9	1
1CA	1
1CB	1
1CC	1
274	1
19D	1
272	1
19E	1
220	1
273	1
235	1
14A	1
14B	1
4F	1
6F	1
BA	1
D2	1
D3	1
D4	1
D5	1
F2	1
F3	1
F4	1
F5	1
14C	1
14D	1
14E	1
14F	1
1A0	1
1A1	1
1D1	1
1D2	1
1EA	1
1EB	1
1EC	1
1ED	1
20C	1
20D	1
20E	1
20F	1
22A	1
22B	1
22C	1
22D	1
22E	1
22F	1
230	1
231	1
366	1
152	1
153	1
D6	1
F6	1
150	1
151	1
276	1
D8	1
F8	1
1FE	1
1FF	1
186	1
254	1
19F	1
275	1
277	1
222	1
223	1
50	1
70	1
1A4	1
1A5	1
278	1
51	1
71	1
2A0	1
138	1
52	1
72	1
154	1
155	1
156	1
157	1
158	1
159	1
210	1
211	1
212	1
213	1
2B3	1
36C	1
1A6	1
280	1
279	1
2B4	1
27A	1
27B	1
2B5	1
27C	1
27D	1
27E	1
27F	1
281	1
2B6	1
53	1
73	1
15A	1
15B	1
15C	1
15D	1
15E	1
15F	1
160	1
161	1
17F	1
218	1
219	1
2E2	1
DF	1
282	1
1A9	1
283	1
1AA	1
285	1
286	1
54	1
74	1
162	1
163	1
164	1
165	1
21A	1
21B	1
36D	1
2A8	1
1BE	1
2A6	1
2A7	1
166	1
167	1
1AB	1
1AC	1
1AD	1
1AE	1
288	1
236	1
287	1
55	1
75	1
D9	1
DA	1
DB	1
F9	1
FA	1
FB	1
168	1
169	1
16A	1
16B	1
16C	1
16D	1
16E	1
16F	1
172	1
173	1
1AF	1
1B0	1
1D3	1
1D4	1
1D5	1
1D6	1
1D7	1
1D8	1
1D9	1
1DA	1
1DB	1
1DC	1
214	1
215	1
216	1
217	1
367	1
DC	1
FC	1
170	1
171	1
289	1
265	1
2AE	1
2AF	1
19C	1
26F	1
270	1
1B1	1
28A	1
56	1
76	1
36E	1
1B2	1
28B	1
28C	1
57	1
77	1
174	1
175	1
2B7	1
28D	1
58	1
78	1
2E3	1
36F	1
59	1
79	1
DD	1
FD	1
FF	1
176	1
177	1
178	1
232	1
233	1
2B8	1
28F	1
1B3	1
1B4	1
5A	1
7A	1
179	1
17A	1
17B	1
17C	1
17D	1
17E	1
18D	1
1B5	1
1B6	1
224	1
225	1
290	1
291	1
1B7	1
1EE	1
1EF	1
292	1
1B8	1
1B9	1
1BA	1
293	1
21C	1
21D	1
DE	1
FE	1
1BF	1
1F7	1
1BB	1
1A7	1
1A8	1
1BC	1
1BD	1
184	1
185	1
294	1
2C0	1
2BC	1
149	1
2EE	1
2BE	1
295	1
2E4	1
2BF	1
2C1	1
2A1	1
2A2	1
296	1
1C0	1
1C1	1
1C2	1
1C3	1
297	1
298	1
2AC	1
2AD	1
386	1
391	1
3AC	1
3B1	1
392	1
3B2	1
3D0	1
393	1
3B3	1
394	1
3B4	1
388	1
395	1
3AD	1
3B5	1
3F5	1
3DC	1
3DD	1
3DA	1
3DB	1
396	1
3B6	1
389	1
397	1
3AE	1
3B7	1
398	1
3B8	1
3D1	1
3F4	1
37A	1
38A	1
390	1
399	1
3AA	1
3AF	1
3B9	1
3CA	1
3F3	1
39A	1
3BA	1
3F0	1
3D7	1
39B	1
3BB	1
B5	1
39C	1
3BC	1
39D	1
3BD	1
39E	1
3BE	1
38C	1
39F	1
3BF	1
3CC	1
3A0	1
3C0	1
3D6	1
3DE	1
3DF	1
3D8	1
3D9	1
3A1	1
3C1	1
3F1	1
3A3	1
3C2	1
3C3	1
3F2	1
3F9	1
3A4	1
3C4	1
38E	1
3A5	1
3AB	1
3B0	1
3C5	1
3CB	1
3CD	1
3D2	1
3D3	1
3D4	1
3A6	1
3C6	1
3D5	1
3A7	1
3C7	1
3A8	1
3C8	1
38F	1
3A9	1
3C9	1
3CE	1
3E0	1
3E1	1
3F7	1
3F8	1
3FA	1
3FB	1
3E2	1
3E3	1
3E4	1
3E5	1
3E6	1
3E7	1
3E8	1
3E9	1
3EA	1
3EB	1
3EC	1
3ED	1
3EE	1
3EF	1
410	1
430	1
4D0	1
4D1	1
4D2	1
4D3	1
4D8	1
4D9	1
4DA	1
4DB	1
4D4	1
4D5	1
411	1
431	1
412	1
432	1
413	1
433	1
490	1
491	1
492	1
493	1
494	1
495	1
414	1
434	1
500	1
501	1
402	1
452	1
502	1
503	1
403	1
453	1
498	1
499	1
400	1
401	1
415	1
435	1
450	1
451	1
4D6	1
4D7	1
404	1
454	1
416	1
436	1
4C1	1
4C2	1
4DC	1
4DD	1
496	1
497	1
417	1
437	1
504	1
505	1
4DE	1
4DF	1
405	1
455	1
4E0	1
4E1	1
506	1
507	1
40D	1
418	1
438	1
45D	1
4E2	1
4E3	1
48A	1
48B	1
4E4	1
4E5	1
406	1
456	1
407	1
457	1
419	1
439	1
408	1
458	1
41A	1
43A	1
49A	1
49B	1
4C3	1
4C4	1
4A0	1
4A1	1
49E	1
49F	1
49C	1
49D	1
41B	1
43B	1
4C5	1
4C6	1
409	1
459	1
508	1
509	1
41C	1
43C	1
4CD	1
4CE	1
41D	1
43D	1
4C9	1
4CA	1
4A2	1
4A3	1
4C7	1
4C8	1
4A4	1
4A5	1
40A	1
45A	1
50A	1
50B	1
41E	1
43E	1
4E6	1
4E7	1
4E8	1
4E9	1
4EA	1
4EB	1
41F	1
43F	1
4A6	1
4A7	1
480	1
481	1
420	1
440	1
48E	1
48F	1
421	1
441	1
50C	1
50D	1
4AA	1
4AB	1
422	1
442	1
50E	1
50F	1
4AC	1
4AD	1
40B	1
45B	1
40C	1
45C	1
423	1
443	1
4EE	1
4EF	1
40E	1
45E	1
4F0	1
4F1	1
4F2	1
4F3	1
4AE	1
4AF	1
4B0	1
4B1	1
478	1
479	1
424	1
444	1
425	1
445	1
4B2	1
4B3	1
4BA	1
4BB	1
460	1
461	1
47E	1
47F	1
47C	1
47D	1
47A	1
47B	1
426	1
446	1
4B4	1
4B5	1
427	1
447	1
4F4	1
4F5	1
4B6	1
4B7	1
4CB	1
4CC	1
4B8	1
4B9	1
4BC	1
4BD	1
4BE	1
4BF	1
40F	1
45F	1
428	1
448	1
429	1
449	1
42A	1
44A	1
42B	1
44B	1
4F8	1
4F9	1
42C	1
44C	1
48C	1
48D	1
462	1
463	1
42D	1
44D	1
4EC	1
4ED	1
42E	1
44E	1
42F	1
44F	1
464	1
465	1
466	1
467	1
46A	1
46B	1
468	1
469	1
46C	1
46D	1
46E	1
46F	1
470	1
471	1
472	1
473	1
474	1
475	1
476	1
477	1
4A8	1
4A9	1
4C0	1
531	1
561	1
532	1
562	1
533	1
563	1
534	1
564	1
535	1
565	1
587	1
536	1
566	1
537	1
567	1
538	1
568	1
539	1
569	1
53A	1
56A	1
53B	1
56B	1
53C	1
56C	1
53D	1
56D	1
53E	1
56E	1
53F	1
56F	1
540	1
570	1
541	1
571	1
542	1
572	1
543	1
573	1
544	1
574	1
545	1
575	1
546	1
576	1
547	1
577	1
548	1
578	1
549	1
579	1
54A	1
57A	1
54B	1
57B	1
54C	1
57C	1
54D	1
57D	1
54E	1
57E	1
54F	1
57F	1
550	1
580	1
551	1
581	1
552	1
582	1
553	1
583	1
554	1
584	1
555	1
585	1
556	1
586	1
559	1
5D0	1
5D1	1
5D2	1
5D3	1
5D4	1
5D5	1
5F0	1
5F1	1
5D6	1
5D7	1
5D8	1
5D9	1
5F2	1
5DA	1
5DB	1
5DC	1
5DD	1
5DE	1
5DF	1
5E0	1
5E1	1
5E2	1
5E3	1
5E4	1
5E5	1
5E6	1
5E7	1
5E8	1
5E9	1
5EA	1
621	1
674	1
6FD	1
622	1
623	1
672	1
671	1
624	1
625	1
673	1
626	1
627	1
675	1
66E	1
628	1
67B	1
67E	1
680	1
629	1
62A	1
62B	1
679	1
67A	1
67C	1
67D	1
67F	1
62C	1
683	1
684	1
686	1
6BF	1
687	1
62D	1
62E	1
681	1
682	1
685	1
62F	1
630	1
688	1
689	1
68A	1
68B	1
68C	1
68D	1
68E	1
68F	1
690	1
6EE	1
631	1
632	1
691	1
692	1
693	1
694	1
695	1
696	1
697	1
698	1
699	1
6EF	1
633	1
634	1
69A	1
69B	1
69C	1
6FA	1
635	1
636	1
69D	1
69E	1
6FB	1
637	1
638	1
69F	1
639	1
63A	1
6A0	1
6FC	1
641	1
6A1	1
6A2	1
6A3	1
6A4	1
6A5	1
6A6	1
66F	1
642	1
6A7	1
6A8	1
643	1
6A9	1
6AA	1
6AB	1
6AC	1
6AD	1
6AE	1
6AF	1
6B0	1
6B1	1
6B2	1
6B3	1
6B4	1
644	1
6B5	1
6B6	1
6B7	1
6B8	1
645	1
6FE	1
646	1
6BA	1
6BB	1
6BC	1
6BD	1
6B9	1
647	1
6BE	1
6C1	1
6C2	1
6C3	1
6FF	1
6C0	1
6D5	1
648	1
6E5	1
676	1
6C4	1
6C5	1
6C6	1
6C7	1
677	1
6C8	1
6C9	1
6CA	1
6CB	1
6CF	1
649	1
64A	1
6E6	1
678	1
6CC	1
6CD	1
6CE	1
6D0	1
6D1	1
6D2	1
6D3	1
710	1
712	1
72D	1
713	1
714	1
72E	1
716	1
715	1
72F	1
717	1
718	1
719	1
74D	1
71A	1
71B	1
71C	1
71D	1
71E	1
71F	1
74E	1
720	1
721	1
722	1
723	1
724	1
725	1
726	1
727	1
74F	1
728	1
729	1
72A	1
72B	1
72C	1
780	1
799	1
79A	1
781	1
782	1
783	1
79C	1
784	1
785	1
786	1
787	1
7A2	1
7A3	1
788	1
7A5	1
789	1
78A	1
78B	1
79B	1
78C	1
798	1
7A0	1
7A1	1
78D	1
78E	1
7A4	1
78F	1
790	1
79D	1
79E	1
79F	1
791	1
792	1
793	1
794	1
795	1
796	1
797	1
7B1	1
7A6	1
7A7	1
7A8	1
7A9	1
7AA	1
7AB	1
7AC	1
7AD	1
7AE	1
7AF	1
7B0	1
4E00	1
4E01	1
4E02	1
4E03	1
4E04	1
4E05	1
4E06	1
4E07	1
4E08	1
4E09	1
4E0A	1
4E0B	1
4E0C	1
4E0D	1
4E0E	1
4E0F	1
4E10	1
4E11	1
4E12	1
4E13	1
4E14	1
4E15	1
4E16	1
4E17	1
4E18	1
4E19	1
4E1A	1
4E1B	1
4E1C	1
4E1D	1
4E1E	1
4E1F	1
4E20	1
4E21	1
4E22	1
4E23	1
4E24	1
4E25	1
4E26	1
4E27	1
4E28	1
4E29	1
4E2A	1
4E2B	1
4E2C	1
4E2D	1
4E2E	1
4E2F	1
4E30	1
4E31	1
4E32	1
4E33	1
4E34	1
4E35	1
4E36	1
4E37	1
4E38	1
4E39	1
4E3A	1
4E3B	1
4E3C	1
4E3D	1
4E3E	1
4E3F	1
4E40	1
4E41	1
4E42	1
4E43	1
4E44	1
4E45	1
4E46	1
4E47	1
4E48	1
4E49	1
4E4A	1
4E4B	1
4E4C	1
4E4D	1
4E4E	1
4E4F	1
4E50	1
4E51	1
4E52	1
4E53	1
4E54	1
4E55	1
4E56	1
4E57	1
4E58	1
4E59	1
4E5A	1
4E5B	1
4E5C	1
4E5D	1
4E5E	1
4E5F	1
4E60	1
4E61	1
4E62	1
4E63	1
4E64	1
4E65	1
4E66	1
4E67	1
4E68	1
4E69	1
4E6A	1
4E6B	1
4E6C	1
4E6D	1
4E6E	1
4E6F	1
4E70	1
4E71	1
4E72	1
4E73	1
4E74	1
4E75	1
4E76	1
4E77	1
4E78	1
4E79	1
4E7A	1
4E7B	1
4E7C	1
4E7D	1
4E7E	1
4E7F	1
4E80	1
4E81	1
4E82	1
4E83	1
4E84	1
4E85	1
4E86	1
4E87	1
4E88	1
4E89	1
4E8A	1
4E8B	1
4E8C	1
4E8D	1
4E8E	1
4E8F	1
4E90	1
4E91	1
4E92	1
4E93	1
4E94	1
4E95	1
4E96	1
4E97	1
4E98	1
4E99	1
4E9A	1
4E9B	1
4E9C	1
4E9D	1
4E9E	1
4E9F	1
4EA0	1
4EA1	1
4EA2	1
4EA3	1
4EA4	1
4EA5	1
4EA6	1
4EA7	1
4EA8	1
4EA9	1
4EAA	1
4EAB	1
4EAC	1
4EAD	1
4EAE	1
4EAF	1
4EB0	1
4EB1	1
4EB2	1
4EB3	1
4EB4	1
4EB5	1
4EB6	1
4EB7	1
4EB8	1
4EB9	1
4EBA	1
4EBB	1
4EBC	1
4EBD	1
4EBE	1
4EBF	1
4EC0	1
4EC1	1
4EC2	1
4EC3	1
4EC4	1
4EC5	1
4EC6	1
4EC7	1
4EC8	1
4EC9	1
4ECA	1
4ECB	1
4ECC	1
4ECD	1
4ECE	1
4ECF	1
4ED0	1
4ED1	1
4ED2	1
4ED3	1
4ED4	1
4ED5	1
4ED6	1
4ED7	1
4ED8	1
4ED9	1
4EDA	1
4EDB	1
4EDC	1
4EDD	1
4EDE	1
4EDF	1
4EE0	1
4EE1	1
4EE2	1
4EE3	1
4EE4	1
4EE5	1
4EE6	1
4EE7	1
4EE8	1
4EE9	1
4EEA	1
4EEB	1
4EEC	1
4EED	1
4EEE	1
4EEF	1
4EF0	1
4EF1	1
4EF2	1
4EF3	1
4EF4	1
4EF5	1
4EF6	1
4EF7	1
4EF8	1
4EF9	1
4EFA	1
4EFB	1
4EFC	1
4EFD	1
4EFE	1
4EFF	1
4F00	1
4F01	1
4F02	1
4F03	1
4F04	1
4F05	1
4F06	1
4F07	1
4F08	1
4F09	1
4F0A	1
4F0B	1
4F0C	1
4F0D	1
4F0E	1
4F0F	1
4F10	1
4F11	1
4F12	1
4F13	1
4F14	1
4F15	1
4F16	1
4F17	1
4F18	1
4F19	1
4F1A	1
4F1B	1
4F1C	1
4F1D	1
4F1E	1
4F1F	1
4F20	1
4F21	1
4F22	1
4F23	1
4F24	1
4F25	1
4F26	1
4F27	1
4F28	1
4F29	1
4F2A	1
4F2B	1
4F2C	1
4F2D	1
4F2E	1
4F2F	1
4F30	1
4F31	1
4F32	1
4F33	1
4F34	1
4F35	1
4F36	1
4F37	1
4F38	1
4F39	1
4F3A	1
4F3B	1
4F3C	1
4F3D	1
4F3E	1
4F3F	1
4F40	1
4F41	1
4F42	1
4F43	1
4F44	1
4F45	1
4F46	1
4F47	1
4F48	1
4F49	1
4F4A	1
4F4B	1
4F4C	1
4F4D	1
4F4E	1
4F4F	1
4F50	1
4F51	1
4F52	1
4F53	1
4F54	1
4F55	1
4F56	1
4F57	1
4F58	1
4F59	1
4F5A	1
4F5B	1
4F5C	1
4F5D	1
4F5E	1
4F5F	1
4F60	1
4F61	1
4F62	1
4F63	1
4F64	1
4F65	1
4F66	1
4F67	1
4F68	1
4F69	1
4F6A	1
4F6B	1
4F6C	1
4F6D	1
4F6E	1
4F6F	1
4F70	1
4F71	1
4F72	1
4F73	1
4F74	1
4F75	1
4F76	1
4F77	1
4F78	1
4F79	1
4F7A	1
4F7B	1
4F7C	1
4F7D	1
4F7E	1
4F7F	1
4F80	1
4F81	1
4F82	1
4F83	1
4F84	1
4F85	1
4F86	1
4F87	1
4F88	1
4F89	1
4F8A	1
4F8B	1
4F8C	1
4F8D	1
4F8E	1
4F8F	1
4F90	1
4F91	1
4F92	1
4F93	1
4F94	1
4F95	1
4F96	1
4F97	1
4F98	1
4F99	1
4F9A	1
4F9B	1
4F9C	1
4F9D	1
4F9E	1
4F9F	1
4FA0	1
4FA1	1
4FA2	1
4FA3	1
4FA4	1
4FA5	1
4FA6	1
4FA7	1
4FA8	1
4FA9	1
4FAA	1
4FAB	1
4FAC	1
4FAD	1
4FAE	1
4FAF	1
4FB0	1
4FB1	1
4FB2	1
4FB3	1
4FB4	1
4FB5	1
4FB6	1
4FB7	1
4FB8	1
4FB9	1
4FBA	1
4FBB	1
4FBC	1
4FBD	1
4FBE	1
4FBF	1
4FC0	1
4FC1	1
4FC2	1
4FC3	1
4FC4	1
4FC5	1
4FC6	1
4FC7	1
4FC8	1
4FC9	1
4FCA	1
4FCB	1
4FCC	1
4FCD	1
4FCE	1
4FCF	1
4FD0	1
4FD1	1
4FD2	1
4FD3	1
4FD4	1
4FD5	1
4FD6	1
4FD7	1
4FD8	1
4FD9	1
4FDA	1
4FDB	1
4FDC	1
4FDD	1
4FDE	1
4FDF	1
4FE0	1
4FE1	1
4FE2	1
4FE3	1
4FE4	1
4FE5	1
4FE6	1
4FE7	1
4FE8	1
4FE9	1
4FEA	1
4FEB	1
4FEC	1
4FED	1
4FEE	1
4FEF	1
4FF0	1
4FF1	1
4FF2	1
4FF3	1
4FF4	1
4FF5	1
4FF6	1
4FF7	1
4FF8	1
4FF9	1
4FFA	1
4FFB	1
4FFC	1
4FFD	1
4FFE	1
4FFF	1
237	1
238	1
239	1
23A	1
23B	1
23C	1
23D	1
23E	1
23F	1
240	1
241	1
242	1
243	1
244	1
245	1
246	1
247	1
248	1
249	1
24A	1
24B	1
24C	1
24D	1
24E	1
24F	1
358	1
359	1
35A	1
35B	1
35C	1
370	1
371	1
372	1
373	1
376	1
377	1
378	1
379	1
37B	1
37C	1
37D	1
37F	1
380	1
381	1
382	1
383	1
38B	1
38D	1
3A2	1
3CF	1
3FC	1
3FD	1
3FE	1
3FF	1
487	1
4CF	1
4F6	1
4F7	1
4FA	1
4FB	1
4FC	1
4FD	1
4FE	1
4FF	1
510	1
511	1
512	1
513	1
514	1
515	1
516	1
517	1
518	1
519	1
51A	1
51B	1
51C	1
51D	1
51E	1
51F	1
520	1
521	1
522	1
523	1
524	1
525	1
526	1
527	1
528	1
529	1
52A	1
52B	1
52C	1
52D	1
52E	1
52F	1
530	1
557	1
558	1
560	1
588	1
58B	1
58C	1
58D	1
58E	1
58F	1
590	1
5A2	1
5BA	1
5C5	1
5C6	1
5C7	1
5C8	1
5C9	1
5CA	1
5CB	1
5CC	1
5CD	1
5CE	1
5CF	1
5EB	1
5EC	1
5ED	1
5EE	1
5EF	1
5F5	1
5F6	1
5F7	1
5F8	1
5F9	1
5FA	1
5FB	1
5FC	1
5FD	1
5FE	1
5FF	1
604	1
605	1
606	1
607	1
608	1
609	1
60A	1
60B	1
616	1
617	1
618	1
619	1
61A	1
61C	1
61D	1
61E	1
620	1
63B	1
63C	1
63D	1
63E	1
63F	1
659	1
65A	1
65B	1
65C	1
65D	1
65E	1
65F	1
70E	1
74B	1
74C	1
750	1
751	1
752	1
753	1
754	1
755	1
756	1
757	1
758	1
759	1
75A	1
75B	1
75C	1
75D	1
75E	1
75F	1
760	1
761	1
762	1
763	1
764	1
765	1
766	1
767	1
768	1
769	1
76A	1
76B	1
76C	1
76D	1
76E	1
76F	1
770	1
771	1
772	1
773	1
774	1
775	1
776	1
777	1
778	1
779	1
77A	1
77B	1
77C	1
77D	1
77E	1
77F	1
7B2	1
7B3	1
7B4	1
7B5	1
7B6	1
7B7	1
7B8	1
7B9	1
7BA	1
7BB	1
7BC	1
7BD	1
7BE	1
7BF	1
7C0	1
7C1	1
7C2	1
7C3	1
7C4	1
7C5	1
7C6	1
7C7	1
7C8	1
7C9	1
7CA	1
7CB	1
7CC	1
7CD	1
7CE	1
7CF	1
7D0	1
7D1	1
7D2	1
7D3	1
7D4	1
7D5	1
7D6	1
7D7	1
7D8	1
7D9	1
7DA	1
7DB	1
7DC	1
7DD	1
7DE	1
7DF	1
7E0	1
7E1	1
7E2	1
7E3	1
7E4	1
7E5	1
7E6	1
7E7	1
7E8	1
7E9	1
7EA	1
7EB	1
7EC	1
7ED	1
7EE	1
7EF	1
7F0	1
7F1	1
7F2	1
7F3	1
7F4	1
7F5	1
7F6	1
7F7	1
7F8	1
7F9	1
7FA	1
7FB	1
7FC	1
7FD	1
7FE	1
7FF	1
DROP TABLE IF EXISTS test.t1;
DROP TABLE IF EXISTS test.t1;
DROP DATABASE test;
CREATE DATABASE test CHARACTER SET utf8mb3;
USE test;
SET NAMES utf8mb3;
Warnings:
Warning	1287	'utf8mb3' is deprecated and will be removed in a future release. Please use utf8mb4 instead
CREATE TABLE test.t1 (a CHAR(4) CHARACTER SET utf8mb3) ENGINE=MyISAM CHARACTER SET utf8mb3;
Warnings:
Warning	1287	'utf8mb3' is deprecated and will be removed in a future release. Please use utf8mb4 instead
Warning	1287	'utf8mb3' is deprecated and will be removed in a future release. Please use utf8mb4 instead
SHOW TABLE STATUS LIKE 't1';
Name	Engine	Version	Row_format	Rows	Avg_row_length	Data_length	Max_data_length	Index_length	Data_free	Auto_increment	Create_time	Update_time	Check_time	Collation	Checksum	Create_options	Comment
t1	MyISAM	#	#	#	#	#	#	#	#	#	#	#	#	utf8mb3_general_ci	#	#	#
LOAD DATA INFILE 
'MYSQL_TEST_DIR/suite/funcs_2/data/charset_utf8.txt' INTO TABLE test.t1;
ALTER TABLE test.t1 CHANGE a a CHAR(4) CHARACTER SET ucs2 COLLATE ucs2_icelandic_ci;
Warnings:
Warning	1287	'ucs2' is deprecated and will be removed in a future release. Please use utf8mb4 instead
Warning	4079	'ucs2_icelandic_ci' is a collation of the deprecated character set ucs2. Please consider using utf8mb4 with an appropriate collation instead.
DELETE FROM test.t1 WHERE CHAR_LENGTH(a) <> 1;
SELECT HEX(ORD(a)) AS a_ord, CHAR_LENGTH(a) AS a_len FROM test.t1 ORDER BY a, ORD(a);
a_ord	a_len
85	1
7F	1
80	1
81	1
82	1
83	1
84	1
86	1
87	1
88	1
89	1
8A	1
8B	1
8C	1
8D	1
8E	1
8F	1
90	1
91	1
92	1
93	1
94	1
95	1
96	1
97	1
98	1
99	1
9A	1
9B	1
9C	1
9D	1
9E	1
9F	1
A0	1
300	1
301	1
302	1
303	1
304	1
305	1
306	1
307	1
308	1
309	1
30A	1
30B	1
30C	1
30D	1
30E	1
30F	1
310	1
311	1
312	1
313	1
314	1
315	1
316	1
317	1
318	1
319	1
31A	1
31B	1
31C	1
31D	1
31E	1
31F	1
320	1
321	1
322	1
323	1
324	1
325	1
326	1
327	1
328	1
329	1
32A	1
32B	1
32C	1
32D	1
32E	1
32F	1
330	1
331	1
332	1
333	1
334	1
335	1
336	1
337	1
338	1
339	1
33A	1
33B	1
33C	1
33D	1
33E	1
33F	1
340	1
341	1
342	1
343	1
344	1
345	1
346	1
347	1
348	1
349	1
34A	1
34B	1
34C	1
34D	1
34E	1
34F	1
350	1
351	1
352	1
353	1
354	1
355	1
356	1
357	1
35D	1
35E	1
35F	1
360	1
361	1
362	1
483	1
484	1
485	1
486	1
488	1
489	1
591	1
592	1
593	1
594	1
595	1
596	1
597	1
598	1
599	1
59A	1
59B	1
59C	1
59D	1
59E	1
59F	1
5A0	1
5A1	1
5A3	1
5A4	1
5A5	1
5A6	1
5A7	1
5A8	1
5A9	1
5AA	1
5AB	1
5AC	1
5AD	1
5AE	1
5AF	1
5B0	1
5B1	1
5B2	1
5B3	1
5B4	1
5B5	1
5B6	1
5B7	1
5B8	1
5B9	1
5BB	1
5BC	1
5BD	1
5BF	1
5C1	1
5C2	1
5C4	1
600	1
601	1
602	1
603	1
610	1
611	1
612	1
613	1
614	1
615	1
64B	1
64C	1
64D	1
64E	1
64F	1
650	1
651	1
652	1
653	1
654	1
655	1
656	1
657	1
658	1
670	1
6D6	1
6D7	1
6D8	1
6D9	1
6DA	1
6DB	1
6DC	1
6DD	1
6DE	1
6DF	1
6E0	1
6E1	1
6E2	1
6E3	1
6E4	1
6E7	1
6E8	1
6EA	1
6EB	1
6EC	1
6ED	1
70F	1
711	1
730	1
731	1
732	1
733	1
734	1
735	1
736	1
737	1
738	1
739	1
73A	1
73B	1
73C	1
73D	1
73E	1
73F	1
740	1
741	1
742	1
743	1
744	1
745	1
746	1
747	1
748	1
749	1
74A	1
640	1
60	1
B4	1
384	1
2DC	1
5E	1
AF	1
2D8	1
2D9	1
A8	1
385	1
2DA	1
2DD	1
B8	1
2DB	1
5F	1
AD	1
2D	1
58A	1
2C	1
55D	1
60C	1
60D	1
66B	1
66C	1
3B	1
37E	1
61B	1
3A	1
589	1
703	1
704	1
705	1
706	1
707	1
708	1
21	1
A1	1
55C	1
3F	1
BF	1
55E	1
61F	1
709	1
2E	1
6D4	1
701	1
702	1
B7	1
387	1
700	1
27	1
22	1
AB	1
BB	1
28	1
29	1
5B	1
7B	1
7D	1
A7	1
B6	1
A9	1
AE	1
40	1
2A	1
66D	1
2F	1
26	1
23	1
25	1
66A	1
55A	1
55B	1
55F	1
5BE	1
5C0	1
5C3	1
5F3	1
5F4	1
70A	1
70B	1
70C	1
70D	1
2B9	1
374	1
375	1
2BA	1
2C2	1
2C3	1
2C4	1
2C5	1
2C6	1
2C7	1
2C8	1
2C9	1
2CA	1
2CB	1
2CC	1
2CD	1
2CE	1
2CF	1
2D2	1
2D3	1
2D4	1
2D5	1
2D6	1
2D7	1
2DE	1
2DF	1
2E5	1
2E6	1
2E7	1
2E8	1
2E9	1
2EA	1
2EB	1
2EC	1
2ED	1
2EF	1
2F0	1
2F1	1
2F2	1
2F3	1
2F4	1
2F5	1
2F6	1
2F7	1
2F8	1
2F9	1
2FA	1
2FB	1
2FC	1
2FD	1
2FE	1
2FF	1
B0	1
482	1
60E	1
60F	1
6E9	1
3F6	1
2B	1
B1	1
F7	1
D7	1
3C	1
3D	1
3E	1
AC	1
7C	1
A6	1
7E	1
2D0	1
2D1	1
A4	1
A2	1
24	1
A3	1
A5	1
30	1
660	1
6F0	1
31	1
B9	1
661	1
6F1	1
BD	1
BC	1
32	1
B2	1
662	1
6F2	1
33	1
B3	1
663	1
6F3	1
BE	1
34	1
664	1
6F4	1
35	1
665	1
6F5	1
36	1
666	1
6F6	1
37	1
667	1
6F7	1
38	1
668	1
6F8	1
39	1
669	1
6F9	1
41	1
61	1
AA	1
C0	1
C2	1
C3	1
E0	1
E2	1
E3	1
100	1
101	1
102	1
103	1
104	1
105	1
1CD	1
1CE	1
1DE	1
1DF	1
1E0	1
1E1	1
1FA	1
1FB	1
200	1
201	1
202	1
203	1
226	1
227	1
363	1
C1	1
E1	1
1E2	1
1E3	1
1FC	1
1FD	1
250	1
251	1
252	1
42	1
62	1
299	1
180	1
181	1
253	1
182	1
183	1
43	1
63	1
C7	1
E7	1
106	1
107	1
108	1
109	1
10A	1
10B	1
10C	1
10D	1
368	1
187	1
188	1
255	1
44	1
64	1
10E	1
10F	1
369	1
1C4	1
1C5	1
1C6	1
1F1	1
1F2	1
1F3	1
2A3	1
2A5	1
2A4	1
D0	1
F0	1
110	1
111	1
189	1
256	1
18A	1
257	1
18B	1
18C	1
221	1
45	1
65	1
C8	1
CA	1
CB	1
E8	1
EA	1
EB	1
112	1
113	1
114	1
115	1
116	1
117	1
118	1
119	1
11A	1
11B	1
204	1
205	1
206	1
207	1
228	1
229	1
364	1
C9	1
E9	1
18E	1
1DD	1
18F	1
259	1
190	1
25B	1
258	1
25A	1
25C	1
25D	1
25E	1
29A	1
264	1
46	1
66	1
2A9	1
191	1
192	1
47	1
67	1
11C	1
11D	1
11E	1
11F	1
120	1
121	1
122	1
123	1
1E6	1
1E7	1
1F4	1
1F5	1
261	1
262	1
1E4	1
1E5	1
193	1
260	1
29B	1
194	1
263	1
2E0	1
1A2	1
1A3	1
48	1
68	1
124	1
125	1
21E	1
21F	1
2B0	1
36A	1
29C	1
195	1
1F6	1
126	1
127	1
266	1
2B1	1
267	1
2BB	1
2BD	1
49	1
69	1
CC	1
CE	1
CF	1
EC	1
EE	1
EF	1
128	1
129	1
12A	1
12B	1
12C	1
12D	1
12E	1
12F	1
130	1
1CF	1
1D0	1
208	1
209	1
20A	1
20B	1
365	1
132	1
133	1
CD	1
ED	1
131	1
26A	1
197	1
268	1
196	1
269	1
4A	1
6A	1
134	1
135	1
1F0	1
2B2	1
29D	1
25F	1
284	1
4B	1
6B	1
136	1
137	1
1E8	1
1E9	1
198	1
199	1
29E	1
4C	1
6C	1
139	1
13A	1
13B	1
13C	1
13D	1
13E	1
2E1	1
13F	1
140	1
1C7	1
1C8	1
1C9	1
2AA	1
2AB	1
29F	1
141	1
142	1
19A	1
26B	1
26C	1
26D	1
234	1
26E	1
19B	1
28E	1
4D	1
6D	1
36B	1
271	1
4E	1
6E	1
D1	1
F1	1
143	1
144	1
145	1
146	1
147	1
148	1
1F8	1
1F9	1
1CA	1
1CB	1
1CC	1
274	1
19D	1
272	1
19E	1
220	1
273	1
235	1
14A	1
14B	1
4F	1
6F	1
BA	1
D2	1
D4	1
D5	1
F2	1
F4	1
F5	1
14C	1
14D	1
14E	1
14F	1
150	1
151	1
1A0	1
1A1	1
1D1	1
1D2	1
1EA	1
1EB	1
1EC	1
1ED	1
20C	1
20D	1
20E	1
20F	1
22A	1
22B	1
22C	1
22D	1
22E	1
22F	1
230	1
231	1
366	1
152	1
153	1
D3	1
F3	1
276	1
1FE	1
1FF	1
186	1
254	1
19F	1
275	1
277	1
222	1
223	1
50	1
70	1
1A4	1
1A5	1
278	1
51	1
71	1
2A0	1
138	1
52	1
72	1
154	1
155	1
156	1
157	1
158	1
159	1
210	1
211	1
212	1
213	1
2B3	1
36C	1
1A6	1
280	1
279	1
2B4	1
27A	1
27B	1
2B5	1
27C	1
27D	1
27E	1
27F	1
281	1
2B6	1
53	1
73	1
15A	1
15B	1
15C	1
15D	1
15E	1
15F	1
160	1
161	1
17F	1
218	1
219	1
2E2	1
DF	1
282	1
1A9	1
283	1
1AA	1
285	1
286	1
54	1
74	1
162	1
163	1
164	1
165	1
21A	1
21B	1
36D	1
2A8	1
1BE	1
2A6	1
2A7	1
166	1
167	1
1AB	1
1AC	1
1AD	1
1AE	1
288	1
236	1
287	1
55	1
75	1
D9	1
DB	1
DC	1
F9	1
FB	1
FC	1
168	1
169	1
16A	1
16B	1
16C	1
16D	1
16E	1
16F	1
170	1
171	1
172	1
173	1
1AF	1
1B0	1
1D3	1
1D4	1
1D5	1
1D6	1
1D7	1
1D8	1
1D9	1
1DA	1
1DB	1
1DC	1
214	1
215	1
216	1
217	1
367	1
DA	1
FA	1
289	1
265	1
2AE	1
2AF	1
19C	1
26F	1
270	1
1B1	1
28A	1
56	1
76	1
36E	1
1B2	1
28B	1
28C	1
57	1
77	1
174	1
175	1
2B7	1
28D	1
58	1
78	1
2E3	1
36F	1
59	1
79	1
FF	1
176	1
177	1
178	1
232	1
233	1
2B8	1
DD	1
FD	1
28F	1
1B3	1
1B4	1
5A	1
7A	1
179	1
17A	1
17B	1
17C	1
17D	1
17E	1
18D	1
DE	1
FE	1
C4	1
C6	1
E4	1
E6	1
D6	1
D8	1
F6	1
F8	1
C5	1
E5	1
1B5	1
1B6	1
224	1
225	1
290	1
291	1
1B7	1
1EE	1
1EF	1
292	1
1B8	1
1B9	1
1BA	1
293	1
21C	1
21D	1
1BF	1
1F7	1
1BB	1
1A7	1
1A8	1
1BC	1
1BD	1
184	1
185	1
294	1
2C0	1
2BC	1
149	1
2EE	1
2BE	1
295	1
2E4	1
2BF	1
2C1	1
2A1	1
2A2	1
296	1
1C0	1
1C1	1
1C2	1
1C3	1
297	1
298	1
2AC	1
2AD	1
386	1
391	1
3AC	1
3B1	1
392	1
3B2	1
3D0	1
393	1
3B3	1
394	1
3B4	1
388	1
395	1
3AD	1
3B5	1
3F5	1
3DC	1
3DD	1
3DA	1
3DB	1
396	1
3B6	1
389	1
397	1
3AE	1
3B7	1
398	1
3B8	1
3D1	1
3F4	1
37A	1
38A	1
390	1
399	1
3AA	1
3AF	1
3B9	1
3CA	1
3F3	1
39A	1
3BA	1
3F0	1
3D7	1
39B	1
3BB	1
B5	1
39C	1
3BC	1
39D	1
3BD	1
39E	1
3BE	1
38C	1
39F	1
3BF	1
3CC	1
3A0	1
3C0	1
3D6	1
3DE	1
3DF	1
3D8	1
3D9	1
3A1	1
3C1	1
3F1	1
3A3	1
3C2	1
3C3	1
3F2	1
3F9	1
3A4	1
3C4	1
38E	1
3A5	1
3AB	1
3B0	1
3C5	1
3CB	1
3CD	1
3D2	1
3D3	1
3D4	1
3A6	1
3C6	1
3D5	1
3A7	1
3C7	1
3A8	1
3C8	1
38F	1
3A9	1
3C9	1
3CE	1
3E0	1
3E1	1
3F7	1
3F8	1
3FA	1
3FB	1
3E2	1
3E3	1
3E4	1
3E5	1
3E6	1
3E7	1
3E8	1
3E9	1
3EA	1
3EB	1
3EC	1
3ED	1
3EE	1
3EF	1
410	1
430	1
4D0	1
4D1	1
4D2	1
4D3	1
4D8	1
4D9	1
4DA	1
4DB	1
4D4	1
4D5	1
411	1
431	1
412	1
432	1
413	1
433	1
490	1
491	1
492	1
493	1
494	1
495	1
414	1
434	1
500	1
501	1
402	1
452	1
502	1
503	1
403	1
453	1
498	1
499	1
400	1
401	1
415	1
435	1
450	1
451	1
4D6	1
4D7	1
404	1
454	1
416	1
436	1
4C1	1
4C2	1
4DC	1
4DD	1
496	1
497	1
417	1
437	1
504	1
505	1
4DE	1
4DF	1
405	1
455	1
4E0	1
4E1	1
506	1
507	1
40D	1
418	1
438	1
45D	1
4E2	1
4E3	1
48A	1
48B	1
4E4	1
4E5	1
406	1
456	1
407	1
457	1
419	1
439	1
408	1
458	1
41A	1
43A	1
49A	1
49B	1
4C3	1
4C4	1
4A0	1
4A1	1
49E	1
49F	1
49C	1
49D	1
41B	1
43B	1
4C5	1
4C6	1
409	1
459	1
508	1
509	1
41C	1
43C	1
4CD	1
4CE	1
41D	1
43D	1
4C9	1
4CA	1
4A2	1
4A3	1
4C7	1
4C8	1
4A4	1
4A5	1
40A	1
45A	1
50A	1
50B	1
41E	1
43E	1
4E6	1
4E7	1
4E8	1
4E9	1
4EA	1
4EB	1
41F	1
43F	1
4A6	1
4A7	1
480	1
481	1
420	1
440	1
48E	1
48F	1
421	1
441	1
50C	1
50D	1
4AA	1
4AB	1
422	1
442	1
50E	1
50F	1
4AC	1
4AD	1
40B	1
45B	1
40C	1
45C	1
423	1
443	1
4EE	1
4EF	1
40E	1
45E	1
4F0	1
4F1	1
4F2	1
4F3	1
4AE	1
4AF	1
4B0	1
4B1	1
478	1
479	1
424	1
444	1
425	1
445	1
4B2	1
4B3	1
4BA	1
4BB	1
460	1
461	1
47E	1
47F	1
47C	1
47D	1
47A	1
47B	1
426	1
446	1
4B4	1
4B5	1
427	1
447	1
4F4	1
4F5	1
4B6	1
4B7	1
4CB	1
4CC	1
4B8	1
4B9	1
4BC	1
4BD	1
4BE	1
4BF	1
40F	1
45F	1
428	1
448	1
429	1
449	1
42A	1
44A	1
42B	1
44B	1
4F8	1
4F9	1
42C	1
44C	1
48C	1
48D	1
462	1
463	1
42D	1
44D	1
4EC	1
4ED	1
42E	1
44E	1
42F	1
44F	1
464	1
465	1
466	1
467	1
46A	1
46B	1
468	1
469	1
46C	1
46D	1
46E	1
46F	1
470	1
471	1
472	1
473	1
474	1
475	1
476	1
477	1
4A8	1
4A9	1
4C0	1
531	1
561	1
532	1
562	1
533	1
563	1
534	1
564	1
535	1
565	1
587	1
536	1
566	1
537	1
567	1
538	1
568	1
539	1
569	1
53A	1
56A	1
53B	1
56B	1
53C	1
56C	1
53D	1
56D	1
53E	1
56E	1
53F	1
56F	1
540	1
570	1
541	1
571	1
542	1
572	1
543	1
573	1
544	1
574	1
545	1
575	1
546	1
576	1
547	1
577	1
548	1
578	1
549	1
579	1
54A	1
57A	1
54B	1
57B	1
54C	1
57C	1
54D	1
57D	1
54E	1
57E	1
54F	1
57F	1
550	1
580	1
551	1
581	1
552	1
582	1
553	1
583	1
554	1
584	1
555	1
585	1
556	1
586	1
559	1
5D0	1
5D1	1
5D2	1
5D3	1
5D4	1
5D5	1
5F0	1
5F1	1
5D6	1
5D7	1
5D8	1
5D9	1
5F2	1
5DA	1
5DB	1
5DC	1
5DD	1
5DE	1
5DF	1
5E0	1
5E1	1
5E2	1
5E3	1
5E4	1
5E5	1
5E6	1
5E7	1
5E8	1
5E9	1
5EA	1
621	1
674	1
6FD	1
622	1
623	1
672	1
671	1
624	1
625	1
673	1
626	1
627	1
675	1
66E	1
628	1
67B	1
67E	1
680	1
629	1
62A	1
62B	1
679	1
67A	1
67C	1
67D	1
67F	1
62C	1
683	1
684	1
686	1
6BF	1
687	1
62D	1
62E	1
681	1
682	1
685	1
62F	1
630	1
688	1
689	1
68A	1
68B	1
68C	1
68D	1
68E	1
68F	1
690	1
6EE	1
631	1
632	1
691	1
692	1
693	1
694	1
695	1
696	1
697	1
698	1
699	1
6EF	1
633	1
634	1
69A	1
69B	1
69C	1
6FA	1
635	1
636	1
69D	1
69E	1
6FB	1
637	1
638	1
69F	1
639	1
63A	1
6A0	1
6FC	1
641	1
6A1	1
6A2	1
6A3	1
6A4	1
6A5	1
6A6	1
66F	1
642	1
6A7	1
6A8	1
643	1
6A9	1
6AA	1
6AB	1
6AC	1
6AD	1
6AE	1
6AF	1
6B0	1
6B1	1
6B2	1
6B3	1
6B4	1
644	1
6B5	1
6B6	1
6B7	1
6B8	1
645	1
6FE	1
646	1
6BA	1
6BB	1
6BC	1
6BD	1
6B9	1
647	1
6BE	1
6C1	1
6C2	1
6C3	1
6FF	1
6C0	1
6D5	1
648	1
6E5	1
676	1
6C4	1
6C5	1
6C6	1
6C7	1
677	1
6C8	1
6C9	1
6CA	1
6CB	1
6CF	1
649	1
64A	1
6E6	1
678	1
6CC	1
6CD	1
6CE	1
6D0	1
6D1	1
6D2	1
6D3	1
710	1
712	1
72D	1
713	1
714	1
72E	1
716	1
715	1
72F	1
717	1
718	1
719	1
74D	1
71A	1
71B	1
71C	1
71D	1
71E	1
71F	1
74E	1
720	1
721	1
722	1
723	1
724	1
725	1
726	1
727	1
74F	1
728	1
729	1
72A	1
72B	1
72C	1
780	1
799	1
79A	1
781	1
782	1
783	1
79C	1
784	1
785	1
786	1
787	1
7A2	1
7A3	1
788	1
7A5	1
789	1
78A	1
78B	1
79B	1
78C	1
798	1
7A0	1
7A1	1
78D	1
78E	1
7A4	1
78F	1
790	1
79D	1
79E	1
79F	1
791	1
792	1
793	1
794	1
795	1
796	1
797	1
7B1	1
7A6	1
7A7	1
7A8	1
7A9	1
7AA	1
7AB	1
7AC	1
7AD	1
7AE	1
7AF	1
7B0	1
4E00	1
4E01	1
4E02	1
4E03	1
4E04	1
4E05	1
4E06	1
4E07	1
4E08	1
4E09	1
4E0A	1
4E0B	1
4E0C	1
4E0D	1
4E0E	1
4E0F	1
4E10	1
4E11	1
4E12	1
4E13	1
4E14	1
4E15	1
4E16	1
4E17	1
4E18	1
4E19	1
4E1A	1
4E1B	1
4E1C	1
4E1D	1
4E1E	1
4E1F	1
4E20	1
4E21	1
4E22	1
4E23	1
4E24	1
4E25	1
4E26	1
4E27	1
4E28	1
4E29	1
4E2A	1
4E2B	1
4E2C	1
4E2D	1
4E2E	1
4E2F	1
4E30	1
4E31	1
4E32	1
4E33	1
4E34	1
4E35	1
4E36	1
4E37	1
4E38	1
4E39	1
4E3A	1
4E3B	1
4E3C	1
4E3D	1
4E3E	1
4E3F	1
4E40	1
4E41	1
4E42	1
4E43	1
4E44	1
4E45	1
4E46	1
4E47	1
4E48	1
4E49	1
4E4A	1
4E4B	1
4E4C	1
4E4D	1
4E4E	1
4E4F	1
4E50	1
4E51	1
4E52	1
4E53	1
4E54	1
4E55	1
4E56	1
4E57	1
4E58	1
4E59	1
4E5A	1
4E5B	1
4E5C	1
4E5D	1
4E5E	1
4E5F	1
4E60	1
4E61	1
4E62	1
4E63	1
4E64	1
4E65	1
4E66	1
4E67	1
4E68	1
4E69	1
4E6A	1
4E6B	1
4E6C	1
4E6D	1
4E6E	1
4E6F	1
4E70	1
4E71	1
4E72	1
4E73	1
4E74	1
4E75	1
4E76	1
4E77	1
4E78	1
4E79	1
4E7A	1
4E7B	1
4E7C	1
4E7D	1
4E7E	1
4E7F	1
4E80	1
4E81	1
4E82	1
4E83	1
4E84	1
4E85	1
4E86	1
4E87	1
4E88	1
4E89	1
4E8A	1
4E8B	1
4E8C	1
4E8D	1
4E8E	1
4E8F	1
4E90	1
4E91	1
4E92	1
4E93	1
4E94	1
4E95	1
4E96	1
4E97	1
4E98	1
4E99	1
4E9A	1
4E9B	1
4E9C	1
4E9D	1
4E9E	1
4E9F	1
4EA0	1
4EA1	1
4EA2	1
4EA3	1
4EA4	1
4EA5	1
4EA6	1
4EA7	1
4EA8	1
4EA9	1
4EAA	1
4EAB	1
4EAC	1
4EAD	1
4EAE	1
4EAF	1
4EB0	1
4EB1	1
4EB2	1
4EB3	1
4EB4	1
4EB5	1
4EB6	1
4EB7	1
4EB8	1
4EB9	1
4EBA	1
4EBB	1
4EBC	1
4EBD	1
4EBE	1
4EBF	1
4EC0	1
4EC1	1
4EC2	1
4EC3	1
4EC4	1
4EC5	1
4EC6	1
4EC7	1
4EC8	1
4EC9	1
4ECA	1
4ECB	1
4ECC	1
4ECD	1
4ECE	1
4ECF	1
4ED0	1
4ED1	1
4ED2	1
4ED3	1
4ED4	1
4ED5	1
4ED6	1
4ED7	1
4ED8	1
4ED9	1
4EDA	1
4EDB	1
4EDC	1
4EDD	1
4EDE	1
4EDF	1
4EE0	1
4EE1	1
4EE2	1
4EE3	1
4EE4	1
4EE5	1
4EE6	1
4EE7	1
4EE8	1
4EE9	1
4EEA	1
4EEB	1
4EEC	1
4EED	1
4EEE	1
4EEF	1
4EF0	1
4EF1	1
4EF2	1
4EF3	1
4EF4	1
4EF5	1
4EF6	1
4EF7	1
4EF8	1
4EF9	1
4EFA	1
4EFB	1
4EFC	1
4EFD	1
4EFE	1
4EFF	1
4F00	1
4F01	1
4F02	1
4F03	1
4F04	1
4F05	1
4F06	1
4F07	1
4F08	1
4F09	1
4F0A	1
4F0B	1
4F0C	1
4F0D	1
4F0E	1
4F0F	1
4F10	1
4F11	1
4F12	1
4F13	1
4F14	1
4F15	1
4F16	1
4F17	1
4F18	1
4F19	1
4F1A	1
4F1B	1
4F1C	1
4F1D	1
4F1E	1
4F1F	1
4F20	1
4F21	1
4F22	1
4F23	1
4F24	1
4F25	1
4F26	1
4F27	1
4F28	1
4F29	1
4F2A	1
4F2B	1
4F2C	1
4F2D	1
4F2E	1
4F2F	1
4F30	1
4F31	1
4F32	1
4F33	1
4F34	1
4F35	1
4F36	1
4F37	1
4F38	1
4F39	1
4F3A	1
4F3B	1
4F3C	1
4F3D	1
4F3E	1
4F3F	1
4F40	1
4F41	1
4F42	1
4F43	1
4F44	1
4F45	1
4F46	1
4F47	1
4F48	1
4F49	1
4F4A	1
4F4B	1
4F4C	1
4F4D	1
4F4E	1
4F4F	1
4F50	1
4F51	1
4F52	1
4F53	1
4F54	1
4F55	1
4F56	1
4F57	1
4F58	1
4F59	1
4F5A	1
4F5B	1
4F5C	1
4F5D	1
4F5E	1
4F5F	1
4F60	1
4F61	1
4F62	1
4F63	1
4F64	1
4F65	1
4F66	1
4F67	1
4F68	1
4F69	1
4F6A	1
4F6B	1
4F6C	1
4F6D	1
4F6E	1
4F6F	1
4F70	1
4F71	1
4F72	1
4F73	1
4F74	1
4F75	1
4F76	1
4F77	1
4F78	1
4F79	1
4F7A	1
4F7B	1
4F7C	1
4F7D	1
4F7E	1
4F7F	1
4F80	1
4F81	1
4F82	1
4F83	1
4F84	1
4F85	1
4F86	1
4F87	1
4F88	1
4F89	1
4F8A	1
4F8B	1
4F8C	1
4F8D	1
4F8E	1
4F8F	1
4F90	1
4F91	1
4F92	1
4F93	1
4F94	1
4F95	1
4F96	1
4F97	1
4F98	1
4F99	1
4F9A	1
4F9B	1
4F9C	1
4F9D	1
4F9E	1
4F9F	1
4FA0	1
4FA1	1
4FA2	1
4FA3	1
4FA4	1
4FA5	1
4FA6	1
4FA7	1
4FA8	1
4FA9	1
4FAA	1
4FAB	1
4FAC	1
4FAD	1
4FAE	1
4FAF	1
4FB0	1
4FB1	1
4FB2	1
4FB3	1
4FB4	1
4FB5	1
4FB6	1
4FB7	1
4FB8	1
4FB9	1
4FBA	1
4FBB	1
4FBC	1
4FBD	1
4FBE	1
4FBF	1
4FC0	1
4FC1	1
4FC2	1
4FC3	1
4FC4	1
4FC5	1
4FC6	1
4FC7	1
4FC8	1
4FC9	1
4FCA	1
4FCB	1
4FCC	1
4FCD	1
4FCE	1
4FCF	1
4FD0	1
4FD1	1
4FD2	1
4FD3	1
4FD4	1
4FD5	1
4FD6	1
4FD7	1
4FD8	1
4FD9	1
4FDA	1
4FDB	1
4FDC	1
4FDD	1
4FDE	1
4FDF	1
4FE0	1
4FE1	1
4FE2	1
4FE3	1
4FE4	1
4FE5	1
4FE6	1
4FE7	1
4FE8	1
4FE9	1
4FEA	1
4FEB	1
4FEC	1
4FED	1
4FEE	1
4FEF	1
4FF0	1
4FF1	1
4FF2	1
4FF3	1
4FF4	1
4FF5	1
4FF6	1
4FF7	1
4FF8	1
4FF9	1
4FFA	1
4FFB	1
4FFC	1
4FFD	1
4FFE	1
4FFF	1
237	1
238	1
239	1
23A	1
23B	1
23C	1
23D	1
23E	1
23F	1
240	1
241	1
242	1
243	1
244	1
245	1
246	1
247	1
248	1
249	1
24A	1
24B	1
24C	1
24D	1
24E	1
24F	1
358	1
359	1
35A	1
35B	1
35C	1
370	1
371	1
372	1
373	1
376	1
377	1
378	1
379	1
37B	1
37C	1
37D	1
37F	1
380	1
381	1
382	1
383	1
38B	1
38D	1
3A2	1
3CF	1
3FC	1
3FD	1
3FE	1
3FF	1
487	1
4CF	1
4F6	1
4F7	1
4FA	1
4FB	1
4FC	1
4FD	1
4FE	1
4FF	1
510	1
511	1
512	1
513	1
514	1
515	1
516	1
517	1
518	1
519	1
51A	1
51B	1
51C	1
51D	1
51E	1
51F	1
520	1
521	1
522	1
523	1
524	1
525	1
526	1
527	1
528	1
529	1
52A	1
52B	1
52C	1
52D	1
52E	1
52F	1
530	1
557	1
558	1
560	1
588	1
58B	1
58C	1
58D	1
58E	1
58F	1
590	1
5A2	1
5BA	1
5C5	1
5C6	1
5C7	1
5C8	1
5C9	1
5CA	1
5CB	1
5CC	1
5CD	1
5CE	1
5CF	1
5EB	1
5EC	1
5ED	1
5EE	1
5EF	1
5F5	1
5F6	1
5F7	1
5F8	1
5F9	1
5FA	1
5FB	1
5FC	1
5FD	1
5FE	1
5FF	1
604	1
605	1
606	1
607	1
608	1
609	1
60A	1
60B	1
616	1
617	1
618	1
619	1
61A	1
61C	1
61D	1
61E	1
620	1
63B	1
63C	1
63D	1
63E	1
63F	1
659	1
65A	1
65B	1
65C	1
65D	1
65E	1
65F	1
70E	1
74B	1
74C	1
750	1
751	1
752	1
753	1
754	1
755	1
756	1
757	1
758	1
759	1
75A	1
75B	1
75C	1
75D	1
75E	1
75F	1
760	1
761	1
762	1
763	1
764	1
765	1
766	1
767	1
768	1
769	1
76A	1
76B	1
76C	1
76D	1
76E	1
76F	1
770	1
771	1
772	1
773	1
774	1
775	1
776	1
777	1
778	1
779	1
77A	1
77B	1
77C	1
77D	1
77E	1
77F	1
7B2	1
7B3	1
7B4	1
7B5	1
7B6	1
7B7	1
7B8	1
7B9	1
7BA	1
7BB	1
7BC	1
7BD	1
7BE	1
7BF	1
7C0	1
7C1	1
7C2	1
7C3	1
7C4	1
7C5	1
7C6	1
7C7	1
7C8	1
7C9	1
7CA	1
7CB	1
7CC	1
7CD	1
7CE	1
7CF	1
7D0	1
7D1	1
7D2	1
7D3	1
7D4	1
7D5	1
7D6	1
7D7	1
7D8	1
7D9	1
7DA	1
7DB	1
7DC	1
7DD	1
7DE	1
7DF	1
7E0	1
7E1	1
7E2	1
7E3	1
7E4	1
7E5	1
7E6	1
7E7	1
7E8	1
7E9	1
7EA	1
7EB	1
7EC	1
7ED	1
7EE	1
7EF	1
7F0	1
7F1	1
7F2	1
7F3	1
7F4	1
7F5	1
7F6	1
7F7	1
7F8	1
7F9	1
7FA	1
7FB	1
7FC	1
7FD	1
7FE	1
7FF	1
DROP TABLE IF EXISTS test.t1;
DROP TABLE IF EXISTS test.t1;
DROP DATABASE test;
CREATE DATABASE test CHARACTER SET utf8mb3;
USE test;
SET NAMES utf8mb3;
Warnings:
Warning	1287	'utf8mb3' is deprecated and will be removed in a future release. Please use utf8mb4 instead
CREATE TABLE test.t1 (a CHAR(4) CHARACTER SET utf8mb3) ENGINE=MyISAM CHARACTER SET utf8mb3;
Warnings:
Warning	1287	'utf8mb3' is deprecated and will be removed in a future release. Please use utf8mb4 instead
Warning	1287	'utf8mb3' is deprecated and will be removed in a future release. Please use utf8mb4 instead
SHOW TABLE STATUS LIKE 't1';
Name	Engine	Version	Row_format	Rows	Avg_row_length	Data_length	Max_data_length	Index_length	Data_free	Auto_increment	Create_time	Update_time	Check_time	Collation	Checksum	Create_options	Comment
t1	MyISAM	#	#	#	#	#	#	#	#	#	#	#	#	utf8mb3_general_ci	#	#	#
LOAD DATA INFILE 
'MYSQL_TEST_DIR/suite/funcs_2/data/charset_utf8.txt' INTO TABLE test.t1;
ALTER TABLE test.t1 CHANGE a a CHAR(4) CHARACTER SET ucs2 COLLATE ucs2_latvian_ci;
Warnings:
Warning	1287	'ucs2' is deprecated and will be removed in a future release. Please use utf8mb4 instead
Warning	4079	'ucs2_latvian_ci' is a collation of the deprecated character set ucs2. Please consider using utf8mb4 with an appropriate collation instead.
DELETE FROM test.t1 WHERE CHAR_LENGTH(a) <> 1;
SELECT HEX(ORD(a)) AS a_ord, CHAR_LENGTH(a) AS a_len FROM test.t1 ORDER BY a, ORD(a);
a_ord	a_len
85	1
7F	1
80	1
81	1
82	1
83	1
84	1
86	1
87	1
88	1
89	1
8A	1
8B	1
8C	1
8D	1
8E	1
8F	1
90	1
91	1
92	1
93	1
94	1
95	1
96	1
97	1
98	1
99	1
9A	1
9B	1
9C	1
9D	1
9E	1
9F	1
A0	1
300	1
301	1
302	1
303	1
304	1
305	1
306	1
307	1
308	1
309	1
30A	1
30B	1
30C	1
30D	1
30E	1
30F	1
310	1
311	1
312	1
313	1
314	1
315	1
316	1
317	1
318	1
319	1
31A	1
31B	1
31C	1
31D	1
31E	1
31F	1
320	1
321	1
322	1
323	1
324	1
325	1
326	1
327	1
328	1
329	1
32A	1
32B	1
32C	1
32D	1
32E	1
32F	1
330	1
331	1
332	1
333	1
334	1
335	1
336	1
337	1
338	1
339	1
33A	1
33B	1
33C	1
33D	1
33E	1
33F	1
340	1
341	1
342	1
343	1
344	1
345	1
346	1
347	1
348	1
349	1
34A	1
34B	1
34C	1
34D	1
34E	1
34F	1
350	1
351	1
352	1
353	1
354	1
355	1
356	1
357	1
35D	1
35E	1
35F	1
360	1
361	1
362	1
483	1
484	1
485	1
486	1
488	1
489	1
591	1
592	1
593	1
594	1
595	1
596	1
597	1
598	1
599	1
59A	1
59B	1
59C	1
59D	1
59E	1
59F	1
5A0	1
5A1	1
5A3	1
5A4	1
5A5	1
5A6	1
5A7	1
5A8	1
5A9	1
5AA	1
5AB	1
5AC	1
5AD	1
5AE	1
5AF	1
5B0	1
5B1	1
5B2	1
5B3	1
5B4	1
5B5	1
5B6	1
5B7	1
5B8	1
5B9	1
5BB	1
5BC	1
5BD	1
5BF	1
5C1	1
5C2	1
5C4	1
600	1
601	1
602	1
603	1
610	1
611	1
612	1
613	1
614	1
615	1
64B	1
64C	1
64D	1
64E	1
64F	1
650	1
651	1
652	1
653	1
654	1
655	1
656	1
657	1
658	1
670	1
6D6	1
6D7	1
6D8	1
6D9	1
6DA	1
6DB	1
6DC	1
6DD	1
6DE	1
6DF	1
6E0	1
6E1	1
6E2	1
6E3	1
6E4	1
6E7	1
6E8	1
6EA	1
6EB	1
6EC	1
6ED	1
70F	1
711	1
730	1
731	1
732	1
733	1
734	1
735	1
736	1
737	1
738	1
739	1
73A	1
73B	1
73C	1
73D	1
73E	1
73F	1
740	1
741	1
742	1
743	1
744	1
745	1
746	1
747	1
748	1
749	1
74A	1
640	1
60	1
B4	1
384	1
2DC	1
5E	1
AF	1
2D8	1
2D9	1
A8	1
385	1
2DA	1
2DD	1
B8	1
2DB	1
5F	1
AD	1
2D	1
58A	1
2C	1
55D	1
60C	1
60D	1
66B	1
66C	1
3B	1
37E	1
61B	1
3A	1
589	1
703	1
704	1
705	1
706	1
707	1
708	1
21	1
A1	1
55C	1
3F	1
BF	1
55E	1
61F	1
709	1
2E	1
6D4	1
701	1
702	1
B7	1
387	1
700	1
27	1
22	1
AB	1
BB	1
28	1
29	1
5B	1
7B	1
7D	1
A7	1
B6	1
A9	1
AE	1
40	1
2A	1
66D	1
2F	1
26	1
23	1
25	1
66A	1
55A	1
55B	1
55F	1
5BE	1
5C0	1
5C3	1
5F3	1
5F4	1
70A	1
70B	1
70C	1
70D	1
2B9	1
374	1
375	1
2BA	1
2C2	1
2C3	1
2C4	1
2C5	1
2C6	1
2C7	1
2C8	1
2C9	1
2CA	1
2CB	1
2CC	1
2CD	1
2CE	1
2CF	1
2D2	1
2D3	1
2D4	1
2D5	1
2D6	1
2D7	1
2DE	1
2DF	1
2E5	1
2E6	1
2E7	1
2E8	1
2E9	1
2EA	1
2EB	1
2EC	1
2ED	1
2EF	1
2F0	1
2F1	1
2F2	1
2F3	1
2F4	1
2F5	1
2F6	1
2F7	1
2F8	1
2F9	1
2FA	1
2FB	1
2FC	1
2FD	1
2FE	1
2FF	1
B0	1
482	1
60E	1
60F	1
6E9	1
3F6	1
2B	1
B1	1
F7	1
D7	1
3C	1
3D	1
3E	1
AC	1
7C	1
A6	1
7E	1
2D0	1
2D1	1
A4	1
A2	1
24	1
A3	1
A5	1
30	1
660	1
6F0	1
31	1
B9	1
661	1
6F1	1
BD	1
BC	1
32	1
B2	1
662	1
6F2	1
33	1
B3	1
663	1
6F3	1
BE	1
34	1
664	1
6F4	1
35	1
665	1
6F5	1
36	1
666	1
6F6	1
37	1
667	1
6F7	1
38	1
668	1
6F8	1
39	1
669	1
6F9	1
41	1
61	1
AA	1
C0	1
C1	1
C2	1
C3	1
C4	1
C5	1
E0	1
E1	1
E2	1
E3	1
E4	1
E5	1
100	1
101	1
102	1
103	1
104	1
105	1
1CD	1
1CE	1
1DE	1
1DF	1
1E0	1
1E1	1
1FA	1
1FB	1
200	1
201	1
202	1
203	1
226	1
227	1
363	1
C6	1
E6	1
1E2	1
1E3	1
1FC	1
1FD	1
250	1
251	1
252	1
42	1
62	1
299	1
180	1
181	1
253	1
182	1
183	1
43	1
63	1
C7	1
E7	1
106	1
107	1
108	1
109	1
10A	1
10B	1
368	1
10C	1
10D	1
187	1
188	1
255	1
44	1
64	1
10E	1
10F	1
369	1
1C4	1
1C5	1
1C6	1
1F1	1
1F2	1
1F3	1
2A3	1
2A5	1
2A4	1
110	1
111	1
189	1
256	1
18A	1
257	1
18B	1
18C	1
221	1
D0	1
F0	1
45	1
65	1
C8	1
C9	1
CA	1
CB	1
E8	1
E9	1
EA	1
EB	1
112	1
113	1
114	1
115	1
116	1
117	1
118	1
119	1
11A	1
11B	1
204	1
205	1
206	1
207	1
228	1
229	1
364	1
18E	1
1DD	1
18F	1
259	1
190	1
25B	1
258	1
25A	1
25C	1
25D	1
25E	1
29A	1
264	1
46	1
66	1
2A9	1
191	1
192	1
47	1
67	1
11C	1
11D	1
11E	1
11F	1
120	1
121	1
1E6	1
1E7	1
1F4	1
1F5	1
122	1
123	1
261	1
262	1
1E4	1
1E5	1
193	1
260	1
29B	1
194	1
263	1
2E0	1
1A2	1
1A3	1
48	1
68	1
124	1
125	1
21E	1
21F	1
2B0	1
36A	1
29C	1
195	1
1F6	1
126	1
127	1
266	1
2B1	1
267	1
2BB	1
2BD	1
49	1
69	1
CC	1
CD	1
CE	1
CF	1
EC	1
ED	1
EE	1
EF	1
128	1
129	1
12A	1
12B	1
12C	1
12D	1
12E	1
12F	1
130	1
1CF	1
1D0	1
208	1
209	1
20A	1
20B	1
365	1
132	1
133	1
59	1
79	1
131	1
26A	1
197	1
268	1
196	1
269	1
4A	1
6A	1
134	1
135	1
1F0	1
2B2	1
29D	1
25F	1
284	1
4B	1
6B	1
1E8	1
1E9	1
136	1
137	1
198	1
199	1
29E	1
4C	1
6C	1
139	1
13A	1
13D	1
13E	1
2E1	1
13F	1
140	1
1C7	1
1C8	1
1C9	1
2AA	1
2AB	1
13B	1
13C	1
29F	1
141	1
142	1
19A	1
26B	1
26C	1
26D	1
234	1
26E	1
19B	1
28E	1
4D	1
6D	1
36B	1
271	1
4E	1
6E	1
D1	1
F1	1
143	1
144	1
147	1
148	1
1F8	1
1F9	1
1CA	1
1CB	1
1CC	1
145	1
146	1
274	1
19D	1
272	1
19E	1
220	1
273	1
235	1
14A	1
14B	1
4F	1
6F	1
BA	1
D2	1
D3	1
D4	1
D5	1
D6	1
F2	1
F3	1
F4	1
F5	1
F6	1
14C	1
14D	1
14E	1
14F	1
150	1
151	1
1A0	1
1A1	1
1D1	1
1D2	1
1EA	1
1EB	1
1EC	1
1ED	1
20C	1
20D	1
20E	1
20F	1
22A	1
22B	1
22C	1
22D	1
22E	1
22F	1
230	1
231	1
366	1
152	1
153	1
276	1
D8	1
F8	1
1FE	1
1FF	1
186	1
254	1
19F	1
275	1
277	1
222	1
223	1
50	1
70	1
1A4	1
1A5	1
278	1
51	1
71	1
2A0	1
138	1
52	1
72	1
154	1
155	1
158	1
159	1
210	1
211	1
212	1
213	1
2B3	1
36C	1
156	1
157	1
1A6	1
280	1
279	1
2B4	1
27A	1
27B	1
2B5	1
27C	1
27D	1
27E	1
27F	1
281	1
2B6	1
53	1
73	1
15A	1
15B	1
15C	1
15D	1
15E	1
15F	1
17F	1
218	1
219	1
2E2	1
DF	1
160	1
161	1
282	1
1A9	1
283	1
1AA	1
285	1
286	1
54	1
74	1
162	1
163	1
164	1
165	1
21A	1
21B	1
36D	1
2A8	1
1BE	1
2A6	1
2A7	1
166	1
167	1
1AB	1
1AC	1
1AD	1
1AE	1
288	1
236	1
287	1
55	1
75	1
D9	1
DA	1
DB	1
DC	1
F9	1
FA	1
FB	1
FC	1
168	1
169	1
16A	1
16B	1
16C	1
16D	1
16E	1
16F	1
170	1
171	1
172	1
173	1
1AF	1
1B0	1
1D3	1
1D4	1
1D5	1
1D6	1
1D7	1
1D8	1
1D9	1
1DA	1
1DB	1
1DC	1
214	1
215	1
216	1
217	1
367	1
289	1
265	1
2AE	1
2AF	1
19C	1
26F	1
270	1
1B1	1
28A	1
56	1
76	1
36E	1
1B2	1
28B	1
28C	1
57	1
77	1
174	1
175	1
2B7	1
28D	1
58	1
78	1
2E3	1
36F	1
DD	1
FD	1
FF	1
176	1
177	1
178	1
232	1
233	1
2B8	1
28F	1
1B3	1
1B4	1
5A	1
7A	1
179	1
17A	1
17B	1
17C	1
18D	1
17D	1
17E	1
1B5	1
1B6	1
224	1
225	1
290	1
291	1
1B7	1
1EE	1
1EF	1
292	1
1B8	1
1B9	1
1BA	1
293	1
21C	1
21D	1
DE	1
FE	1
1BF	1
1F7	1
1BB	1
1A7	1
1A8	1
1BC	1
1BD	1
184	1
185	1
294	1
2C0	1
2BC	1
149	1
2EE	1
2BE	1
295	1
2E4	1
2BF	1
2C1	1
2A1	1
2A2	1
296	1
1C0	1
1C1	1
1C2	1
1C3	1
297	1
298	1
2AC	1
2AD	1
386	1
391	1
3AC	1
3B1	1
392	1
3B2	1
3D0	1
393	1
3B3	1
394	1
3B4	1
388	1
395	1
3AD	1
3B5	1
3F5	1
3DC	1
3DD	1
3DA	1
3DB	1
396	1
3B6	1
389	1
397	1
3AE	1
3B7	1
398	1
3B8	1
3D1	1
3F4	1
37A	1
38A	1
390	1
399	1
3AA	1
3AF	1
3B9	1
3CA	1
3F3	1
39A	1
3BA	1
3F0	1
3D7	1
39B	1
3BB	1
B5	1
39C	1
3BC	1
39D	1
3BD	1
39E	1
3BE	1
38C	1
39F	1
3BF	1
3CC	1
3A0	1
3C0	1
3D6	1
3DE	1
3DF	1
3D8	1
3D9	1
3A1	1
3C1	1
3F1	1
3A3	1
3C2	1
3C3	1
3F2	1
3F9	1
3A4	1
3C4	1
38E	1
3A5	1
3AB	1
3B0	1
3C5	1
3CB	1
3CD	1
3D2	1
3D3	1
3D4	1
3A6	1
3C6	1
3D5	1
3A7	1
3C7	1
3A8	1
3C8	1
38F	1
3A9	1
3C9	1
3CE	1
3E0	1
3E1	1
3F7	1
3F8	1
3FA	1
3FB	1
3E2	1
3E3	1
3E4	1
3E5	1
3E6	1
3E7	1
3E8	1
3E9	1
3EA	1
3EB	1
3EC	1
3ED	1
3EE	1
3EF	1
410	1
430	1
4D0	1
4D1	1
4D2	1
4D3	1
4D8	1
4D9	1
4DA	1
4DB	1
4D4	1
4D5	1
411	1
431	1
412	1
432	1
413	1
433	1
490	1
491	1
492	1
493	1
494	1
495	1
414	1
434	1
500	1
501	1
402	1
452	1
502	1
503	1
403	1
453	1
498	1
499	1
400	1
401	1
415	1
435	1
450	1
451	1
4D6	1
4D7	1
404	1
454	1
416	1
436	1
4C1	1
4C2	1
4DC	1
4DD	1
496	1
497	1
417	1
437	1
504	1
505	1
4DE	1
4DF	1
405	1
455	1
4E0	1
4E1	1
506	1
507	1
40D	1
418	1
438	1
45D	1
4E2	1
4E3	1
48A	1
48B	1
4E4	1
4E5	1
406	1
456	1
407	1
457	1
419	1
439	1
408	1
458	1
41A	1
43A	1
49A	1
49B	1
4C3	1
4C4	1
4A0	1
4A1	1
49E	1
49F	1
49C	1
49D	1
41B	1
43B	1
4C5	1
4C6	1
409	1
459	1
508	1
509	1
41C	1
43C	1
4CD	1
4CE	1
41D	1
43D	1
4C9	1
4CA	1
4A2	1
4A3	1
4C7	1
4C8	1
4A4	1
4A5	1
40A	1
45A	1
50A	1
50B	1
41E	1
43E	1
4E6	1
4E7	1
4E8	1
4E9	1
4EA	1
4EB	1
41F	1
43F	1
4A6	1
4A7	1
480	1
481	1
420	1
440	1
48E	1
48F	1
421	1
441	1
50C	1
50D	1
4AA	1
4AB	1
422	1
442	1
50E	1
50F	1
4AC	1
4AD	1
40B	1
45B	1
40C	1
45C	1
423	1
443	1
4EE	1
4EF	1
40E	1
45E	1
4F0	1
4F1	1
4F2	1
4F3	1
4AE	1
4AF	1
4B0	1
4B1	1
478	1
479	1
424	1
444	1
425	1
445	1
4B2	1
4B3	1
4BA	1
4BB	1
460	1
461	1
47E	1
47F	1
47C	1
47D	1
47A	1
47B	1
426	1
446	1
4B4	1
4B5	1
427	1
447	1
4F4	1
4F5	1
4B6	1
4B7	1
4CB	1
4CC	1
4B8	1
4B9	1
4BC	1
4BD	1
4BE	1
4BF	1
40F	1
45F	1
428	1
448	1
429	1
449	1
42A	1
44A	1
42B	1
44B	1
4F8	1
4F9	1
42C	1
44C	1
48C	1
48D	1
462	1
463	1
42D	1
44D	1
4EC	1
4ED	1
42E	1
44E	1
42F	1
44F	1
464	1
465	1
466	1
467	1
46A	1
46B	1
468	1
469	1
46C	1
46D	1
46E	1
46F	1
470	1
471	1
472	1
473	1
474	1
475	1
476	1
477	1
4A8	1
4A9	1
4C0	1
531	1
561	1
532	1
562	1
533	1
563	1
534	1
564	1
535	1
565	1
587	1
536	1
566	1
537	1
567	1
538	1
568	1
539	1
569	1
53A	1
56A	1
53B	1
56B	1
53C	1
56C	1
53D	1
56D	1
53E	1
56E	1
53F	1
56F	1
540	1
570	1
541	1
571	1
542	1
572	1
543	1
573	1
544	1
574	1
545	1
575	1
546	1
576	1
547	1
577	1
548	1
578	1
549	1
579	1
54A	1
57A	1
54B	1
57B	1
54C	1
57C	1
54D	1
57D	1
54E	1
57E	1
54F	1
57F	1
550	1
580	1
551	1
581	1
552	1
582	1
553	1
583	1
554	1
584	1
555	1
585	1
556	1
586	1
559	1
5D0	1
5D1	1
5D2	1
5D3	1
5D4	1
5D5	1
5F0	1
5F1	1
5D6	1
5D7	1
5D8	1
5D9	1
5F2	1
5DA	1
5DB	1
5DC	1
5DD	1
5DE	1
5DF	1
5E0	1
5E1	1
5E2	1
5E3	1
5E4	1
5E5	1
5E6	1
5E7	1
5E8	1
5E9	1
5EA	1
621	1
674	1
6FD	1
622	1
623	1
672	1
671	1
624	1
625	1
673	1
626	1
627	1
675	1
66E	1
628	1
67B	1
67E	1
680	1
629	1
62A	1
62B	1
679	1
67A	1
67C	1
67D	1
67F	1
62C	1
683	1
684	1
686	1
6BF	1
687	1
62D	1
62E	1
681	1
682	1
685	1
62F	1
630	1
688	1
689	1
68A	1
68B	1
68C	1
68D	1
68E	1
68F	1
690	1
6EE	1
631	1
632	1
691	1
692	1
693	1
694	1
695	1
696	1
697	1
698	1
699	1
6EF	1
633	1
634	1
69A	1
69B	1
69C	1
6FA	1
635	1
636	1
69D	1
69E	1
6FB	1
637	1
638	1
69F	1
639	1
63A	1
6A0	1
6FC	1
641	1
6A1	1
6A2	1
6A3	1
6A4	1
6A5	1
6A6	1
66F	1
642	1
6A7	1
6A8	1
643	1
6A9	1
6AA	1
6AB	1
6AC	1
6AD	1
6AE	1
6AF	1
6B0	1
6B1	1
6B2	1
6B3	1
6B4	1
644	1
6B5	1
6B6	1
6B7	1
6B8	1
645	1
6FE	1
646	1
6BA	1
6BB	1
6BC	1
6BD	1
6B9	1
647	1
6BE	1
6C1	1
6C2	1
6C3	1
6FF	1
6C0	1
6D5	1
648	1
6E5	1
676	1
6C4	1
6C5	1
6C6	1
6C7	1
677	1
6C8	1
6C9	1
6CA	1
6CB	1
6CF	1
649	1
64A	1
6E6	1
678	1
6CC	1
6CD	1
6CE	1
6D0	1
6D1	1
6D2	1
6D3	1
710	1
712	1
72D	1
713	1
714	1
72E	1
716	1
715	1
72F	1
717	1
718	1
719	1
74D	1
71A	1
71B	1
71C	1
71D	1
71E	1
71F	1
74E	1
720	1
721	1
722	1
723	1
724	1
725	1
726	1
727	1
74F	1
728	1
729	1
72A	1
72B	1
72C	1
780	1
799	1
79A	1
781	1
782	1
783	1
79C	1
784	1
785	1
786	1
787	1
7A2	1
7A3	1
788	1
7A5	1
789	1
78A	1
78B	1
79B	1
78C	1
798	1
7A0	1
7A1	1
78D	1
78E	1
7A4	1
78F	1
790	1
79D	1
79E	1
79F	1
791	1
792	1
793	1
794	1
795	1
796	1
797	1
7B1	1
7A6	1
7A7	1
7A8	1
7A9	1
7AA	1
7AB	1
7AC	1
7AD	1
7AE	1
7AF	1
7B0	1
4E00	1
4E01	1
4E02	1
4E03	1
4E04	1
4E05	1
4E06	1
4E07	1
4E08	1
4E09	1
4E0A	1
4E0B	1
4E0C	1
4E0D	1
4E0E	1
4E0F	1
4E10	1
4E11	1
4E12	1
4E13	1
4E14	1
4E15	1
4E16	1
4E17	1
4E18	1
4E19	1
4E1A	1
4E1B	1
4E1C	1
4E1D	1
4E1E	1
4E1F	1
4E20	1
4E21	1
4E22	1
4E23	1
4E24	1
4E25	1
4E26	1
4E27	1
4E28	1
4E29	1
4E2A	1
4E2B	1
4E2C	1
4E2D	1
4E2E	1
4E2F	1
4E30	1
4E31	1
4E32	1
4E33	1
4E34	1
4E35	1
4E36	1
4E37	1
4E38	1
4E39	1
4E3A	1
4E3B	1
4E3C	1
4E3D	1
4E3E	1
4E3F	1
4E40	1
4E41	1
4E42	1
4E43	1
4E44	1
4E45	1
4E46	1
4E47	1
4E48	1
4E49	1
4E4A	1
4E4B	1
4E4C	1
4E4D	1
4E4E	1
4E4F	1
4E50	1
4E51	1
4E52	1
4E53	1
4E54	1
4E55	1
4E56	1
4E57	1
4E58	1
4E59	1
4E5A	1
4E5B	1
4E5C	1
4E5D	1
4E5E	1
4E5F	1
4E60	1
4E61	1
4E62	1
4E63	1
4E64	1
4E65	1
4E66	1
4E67	1
4E68	1
4E69	1
4E6A	1
4E6B	1
4E6C	1
4E6D	1
4E6E	1
4E6F	1
4E70	1
4E71	1
4E72	1
4E73	1
4E74	1
4E75	1
4E76	1
4E77	1
4E78	1
4E79	1
4E7A	1
4E7B	1
4E7C	1
4E7D	1
4E7E	1
4E7F	1
4E80	1
4E81	1
4E82	1
4E83	1
4E84	1
4E85	1
4E86	1
4E87	1
4E88	1
4E89	1
4E8A	1
4E8B	1
4E8C	1
4E8D	1
4E8E	1
4E8F	1
4E90	1
4E91	1
4E92	1
4E93	1
4E94	1
4E95	1
4E96	1
4E97	1
4E98	1
4E99	1
4E9A	1
4E9B	1
4E9C	1
4E9D	1
4E9E	1
4E9F	1
4EA0	1
4EA1	1
4EA2	1
4EA3	1
4EA4	1
4EA5	1
4EA6	1
4EA7	1
4EA8	1
4EA9	1
4EAA	1
4EAB	1
4EAC	1
4EAD	1
4EAE	1
4EAF	1
4EB0	1
4EB1	1
4EB2	1
4EB3	1
4EB4	1
4EB5	1
4EB6	1
4EB7	1
4EB8	1
4EB9	1
4EBA	1
4EBB	1
4EBC	1
4EBD	1
4EBE	1
4EBF	1
4EC0	1
4EC1	1
4EC2	1
4EC3	1
4EC4	1
4EC5	1
4EC6	1
4EC7	1
4EC8	1
4EC9	1
4ECA	1
4ECB	1
4ECC	1
4ECD	1
4ECE	1
4ECF	1
4ED0	1
4ED1	1
4ED2	1
4ED3	1
4ED4	1
4ED5	1
4ED6	1
4ED7	1
4ED8	1
4ED9	1
4EDA	1
4EDB	1
4EDC	1
4EDD	1
4EDE	1
4EDF	1
4EE0	1
4EE1	1
4EE2	1
4EE3	1
4EE4	1
4EE5	1
4EE6	1
4EE7	1
4EE8	1
4EE9	1
4EEA	1
4EEB	1
4EEC	1
4EED	1
4EEE	1
4EEF	1
4EF0	1
4EF1	1
4EF2	1
4EF3	1
4EF4	1
4EF5	1
4EF6	1
4EF7	1
4EF8	1
4EF9	1
4EFA	1
4EFB	1
4EFC	1
4EFD	1
4EFE	1
4EFF	1
4F00	1
4F01	1
4F02	1
4F03	1
4F04	1
4F05	1
4F06	1
4F07	1
4F08	1
4F09	1
4F0A	1
4F0B	1
4F0C	1
4F0D	1
4F0E	1
4F0F	1
4F10	1
4F11	1
4F12	1
4F13	1
4F14	1
4F15	1
4F16	1
4F17	1
4F18	1
4F19	1
4F1A	1
4F1B	1
4F1C	1
4F1D	1
4F1E	1
4F1F	1
4F20	1
4F21	1
4F22	1
4F23	1
4F24	1
4F25	1
4F26	1
4F27	1
4F28	1
4F29	1
4F2A	1
4F2B	1
4F2C	1
4F2D	1
4F2E	1
4F2F	1
4F30	1
4F31	1
4F32	1
4F33	1
4F34	1
4F35	1
4F36	1
4F37	1
4F38	1
4F39	1
4F3A	1
4F3B	1
4F3C	1
4F3D	1
4F3E	1
4F3F	1
4F40	1
4F41	1
4F42	1
4F43	1
4F44	1
4F45	1
4F46	1
4F47	1
4F48	1
4F49	1
4F4A	1
4F4B	1
4F4C	1
4F4D	1
4F4E	1
4F4F	1
4F50	1
4F51	1
4F52	1
4F53	1
4F54	1
4F55	1
4F56	1
4F57	1
4F58	1
4F59	1
4F5A	1
4F5B	1
4F5C	1
4F5D	1
4F5E	1
4F5F	1
4F60	1
4F61	1
4F62	1
4F63	1
4F64	1
4F65	1
4F66	1
4F67	1
4F68	1
4F69	1
4F6A	1
4F6B	1
4F6C	1
4F6D	1
4F6E	1
4F6F	1
4F70	1
4F71	1
4F72	1
4F73	1
4F74	1
4F75	1
4F76	1
4F77	1
4F78	1
4F79	1
4F7A	1
4F7B	1
4F7C	1
4F7D	1
4F7E	1
4F7F	1
4F80	1
4F81	1
4F82	1
4F83	1
4F84	1
4F85	1
4F86	1
4F87	1
4F88	1
4F89	1
4F8A	1
4F8B	1
4F8C	1
4F8D	1
4F8E	1
4F8F	1
4F90	1
4F91	1
4F92	1
4F93	1
4F94	1
4F95	1
4F96	1
4F97	1
4F98	1
4F99	1
4F9A	1
4F9B	1
4F9C	1
4F9D	1
4F9E	1
4F9F	1
4FA0	1
4FA1	1
4FA2	1
4FA3	1
4FA4	1
4FA5	1
4FA6	1
4FA7	1
4FA8	1
4FA9	1
4FAA	1
4FAB	1
4FAC	1
4FAD	1
4FAE	1
4FAF	1
4FB0	1
4FB1	1
4FB2	1
4FB3	1
4FB4	1
4FB5	1
4FB6	1
4FB7	1
4FB8	1
4FB9	1
4FBA	1
4FBB	1
4FBC	1
4FBD	1
4FBE	1
4FBF	1
4FC0	1
4FC1	1
4FC2	1
4FC3	1
4FC4	1
4FC5	1
4FC6	1
4FC7	1
4FC8	1
4FC9	1
4FCA	1
4FCB	1
4FCC	1
4FCD	1
4FCE	1
4FCF	1
4FD0	1
4FD1	1
4FD2	1
4FD3	1
4FD4	1
4FD5	1
4FD6	1
4FD7	1
4FD8	1
4FD9	1
4FDA	1
4FDB	1
4FDC	1
4FDD	1
4FDE	1
4FDF	1
4FE0	1
4FE1	1
4FE2	1
4FE3	1
4FE4	1
4FE5	1
4FE6	1
4FE7	1
4FE8	1
4FE9	1
4FEA	1
4FEB	1
4FEC	1
4FED	1
4FEE	1
4FEF	1
4FF0	1
4FF1	1
4FF2	1
4FF3	1
4FF4	1
4FF5	1
4FF6	1
4FF7	1
4FF8	1
4FF9	1
4FFA	1
4FFB	1
4FFC	1
4FFD	1
4FFE	1
4FFF	1
237	1
238	1
239	1
23A	1
23B	1
23C	1
23D	1
23E	1
23F	1
240	1
241	1
242	1
243	1
244	1
245	1
246	1
247	1
248	1
249	1
24A	1
24B	1
24C	1
24D	1
24E	1
24F	1
358	1
359	1
35A	1
35B	1
35C	1
370	1
371	1
372	1
373	1
376	1
377	1
378	1
379	1
37B	1
37C	1
37D	1
37F	1
380	1
381	1
382	1
383	1
38B	1
38D	1
3A2	1
3CF	1
3FC	1
3FD	1
3FE	1
3FF	1
487	1
4CF	1
4F6	1
4F7	1
4FA	1
4FB	1
4FC	1
4FD	1
4FE	1
4FF	1
510	1
511	1
512	1
513	1
514	1
515	1
516	1
517	1
518	1
519	1
51A	1
51B	1
51C	1
51D	1
51E	1
51F	1
520	1
521	1
522	1
523	1
524	1
525	1
526	1
527	1
528	1
529	1
52A	1
52B	1
52C	1
52D	1
52E	1
52F	1
530	1
557	1
558	1
560	1
588	1
58B	1
58C	1
58D	1
58E	1
58F	1
590	1
5A2	1
5BA	1
5C5	1
5C6	1
5C7	1
5C8	1
5C9	1
5CA	1
5CB	1
5CC	1
5CD	1
5CE	1
5CF	1
5EB	1
5EC	1
5ED	1
5EE	1
5EF	1
5F5	1
5F6	1
5F7	1
5F8	1
5F9	1
5FA	1
5FB	1
5FC	1
5FD	1
5FE	1
5FF	1
604	1
605	1
606	1
607	1
608	1
609	1
60A	1
60B	1
616	1
617	1
618	1
619	1
61A	1
61C	1
61D	1
61E	1
620	1
63B	1
63C	1
63D	1
63E	1
63F	1
659	1
65A	1
65B	1
65C	1
65D	1
65E	1
65F	1
70E	1
74B	1
74C	1
750	1
751	1
752	1
753	1
754	1
755	1
756	1
757	1
758	1
759	1
75A	1
75B	1
75C	1
75D	1
75E	1
75F	1
760	1
761	1
762	1
763	1
764	1
765	1
766	1
767	1
768	1
769	1
76A	1
76B	1
76C	1
76D	1
76E	1
76F	1
770	1
771	1
772	1
773	1
774	1
775	1
776	1
777	1
778	1
779	1
77A	1
77B	1
77C	1
77D	1
77E	1
77F	1
7B2	1
7B3	1
7B4	1
7B5	1
7B6	1
7B7	1
7B8	1
7B9	1
7BA	1
7BB	1
7BC	1
7BD	1
7BE	1
7BF	1
7C0	1
7C1	1
7C2	1
7C3	1
7C4	1
7C5	1
7C6	1
7C7	1
7C8	1
7C9	1
7CA	1
7CB	1
7CC	1
7CD	1
7CE	1
7CF	1
7D0	1
7D1	1
7D2	1
7D3	1
7D4	1
7D5	1
7D6	1
7D7	1
7D8	1
7D9	1
7DA	1
7DB	1
7DC	1
7DD	1
7DE	1
7DF	1
7E0	1
7E1	1
7E2	1
7E3	1
7E4	1
7E5	1
7E6	1
7E7	1
7E8	1
7E9	1
7EA	1
7EB	1
7EC	1
7ED	1
7EE	1
7EF	1
7F0	1
7F1	1
7F2	1
7F3	1
7F4	1
7F5	1
7F6	1
7F7	1
7F8	1
7F9	1
7FA	1
7FB	1
7FC	1
7FD	1
7FE	1
7FF	1
DROP TABLE IF EXISTS test.t1;
DROP TABLE IF EXISTS test.t1;
DROP DATABASE test;
CREATE DATABASE test CHARACTER SET utf8mb3;
USE test;
SET NAMES utf8mb3;
Warnings:
Warning	1287	'utf8mb3' is deprecated and will be removed in a future release. Please use utf8mb4 instead
CREATE TABLE test.t1 (a CHAR(4) CHARACTER SET utf8mb3) ENGINE=MyISAM CHARACTER SET utf8mb3;
Warnings:
Warning	1287	'utf8mb3' is deprecated and will be removed in a future release. Please use utf8mb4 instead
Warning	1287	'utf8mb3' is deprecated and will be removed in a future release. Please use utf8mb4 instead
SHOW TABLE STATUS LIKE 't1';
Name	Engine	Version	Row_format	Rows	Avg_row_length	Data_length	Max_data_length	Index_length	Data_free	Auto_increment	Create_time	Update_time	Check_time	Collation	Checksum	Create_options	Comment
t1	MyISAM	#	#	#	#	#	#	#	#	#	#	#	#	utf8mb3_general_ci	#	#	#
LOAD DATA INFILE 
'MYSQL_TEST_DIR/suite/funcs_2/data/charset_utf8.txt' INTO TABLE test.t1;
ALTER TABLE test.t1 CHANGE a a CHAR(4) CHARACTER SET ucs2 COLLATE ucs2_lithuanian_ci;
Warnings:
Warning	1287	'ucs2' is deprecated and will be removed in a future release. Please use utf8mb4 instead
Warning	4079	'ucs2_lithuanian_ci' is a collation of the deprecated character set ucs2. Please consider using utf8mb4 with an appropriate collation instead.
DELETE FROM test.t1 WHERE CHAR_LENGTH(a) <> 1;
SELECT HEX(ORD(a)) AS a_ord, CHAR_LENGTH(a) AS a_len FROM test.t1 ORDER BY a, ORD(a);
a_ord	a_len
85	1
7F	1
80	1
81	1
82	1
83	1
84	1
86	1
87	1
88	1
89	1
8A	1
8B	1
8C	1
8D	1
8E	1
8F	1
90	1
91	1
92	1
93	1
94	1
95	1
96	1
97	1
98	1
99	1
9A	1
9B	1
9C	1
9D	1
9E	1
9F	1
A0	1
300	1
301	1
302	1
303	1
304	1
305	1
306	1
307	1
308	1
309	1
30A	1
30B	1
30C	1
30D	1
30E	1
30F	1
310	1
311	1
312	1
313	1
314	1
315	1
316	1
317	1
318	1
319	1
31A	1
31B	1
31C	1
31D	1
31E	1
31F	1
320	1
321	1
322	1
323	1
324	1
325	1
326	1
327	1
328	1
329	1
32A	1
32B	1
32C	1
32D	1
32E	1
32F	1
330	1
331	1
332	1
333	1
334	1
335	1
336	1
337	1
338	1
339	1
33A	1
33B	1
33C	1
33D	1
33E	1
33F	1
340	1
341	1
342	1
343	1
344	1
345	1
346	1
347	1
348	1
349	1
34A	1
34B	1
34C	1
34D	1
34E	1
34F	1
350	1
351	1
352	1
353	1
354	1
355	1
356	1
357	1
35D	1
35E	1
35F	1
360	1
361	1
362	1
483	1
484	1
485	1
486	1
488	1
489	1
591	1
592	1
593	1
594	1
595	1
596	1
597	1
598	1
599	1
59A	1
59B	1
59C	1
59D	1
59E	1
59F	1
5A0	1
5A1	1
5A3	1
5A4	1
5A5	1
5A6	1
5A7	1
5A8	1
5A9	1
5AA	1
5AB	1
5AC	1
5AD	1
5AE	1
5AF	1
5B0	1
5B1	1
5B2	1
5B3	1
5B4	1
5B5	1
5B6	1
5B7	1
5B8	1
5B9	1
5BB	1
5BC	1
5BD	1
5BF	1
5C1	1
5C2	1
5C4	1
600	1
601	1
602	1
603	1
610	1
611	1
612	1
613	1
614	1
615	1
64B	1
64C	1
64D	1
64E	1
64F	1
650	1
651	1
652	1
653	1
654	1
655	1
656	1
657	1
658	1
670	1
6D6	1
6D7	1
6D8	1
6D9	1
6DA	1
6DB	1
6DC	1
6DD	1
6DE	1
6DF	1
6E0	1
6E1	1
6E2	1
6E3	1
6E4	1
6E7	1
6E8	1
6EA	1
6EB	1
6EC	1
6ED	1
70F	1
711	1
730	1
731	1
732	1
733	1
734	1
735	1
736	1
737	1
738	1
739	1
73A	1
73B	1
73C	1
73D	1
73E	1
73F	1
740	1
741	1
742	1
743	1
744	1
745	1
746	1
747	1
748	1
749	1
74A	1
640	1
60	1
B4	1
384	1
2DC	1
5E	1
AF	1
2D8	1
2D9	1
A8	1
385	1
2DA	1
2DD	1
B8	1
2DB	1
5F	1
AD	1
2D	1
58A	1
2C	1
55D	1
60C	1
60D	1
66B	1
66C	1
3B	1
37E	1
61B	1
3A	1
589	1
703	1
704	1
705	1
706	1
707	1
708	1
21	1
A1	1
55C	1
3F	1
BF	1
55E	1
61F	1
709	1
2E	1
6D4	1
701	1
702	1
B7	1
387	1
700	1
27	1
22	1
AB	1
BB	1
28	1
29	1
5B	1
7B	1
7D	1
A7	1
B6	1
A9	1
AE	1
40	1
2A	1
66D	1
2F	1
26	1
23	1
25	1
66A	1
55A	1
55B	1
55F	1
5BE	1
5C0	1
5C3	1
5F3	1
5F4	1
70A	1
70B	1
70C	1
70D	1
2B9	1
374	1
375	1
2BA	1
2C2	1
2C3	1
2C4	1
2C5	1
2C6	1
2C7	1
2C8	1
2C9	1
2CA	1
2CB	1
2CC	1
2CD	1
2CE	1
2CF	1
2D2	1
2D3	1
2D4	1
2D5	1
2D6	1
2D7	1
2DE	1
2DF	1
2E5	1
2E6	1
2E7	1
2E8	1
2E9	1
2EA	1
2EB	1
2EC	1
2ED	1
2EF	1
2F0	1
2F1	1
2F2	1
2F3	1
2F4	1
2F5	1
2F6	1
2F7	1
2F8	1
2F9	1
2FA	1
2FB	1
2FC	1
2FD	1
2FE	1
2FF	1
B0	1
482	1
60E	1
60F	1
6E9	1
3F6	1
2B	1
B1	1
F7	1
D7	1
3C	1
3D	1
3E	1
AC	1
7C	1
A6	1
7E	1
2D0	1
2D1	1
A4	1
A2	1
24	1
A3	1
A5	1
30	1
660	1
6F0	1
31	1
B9	1
661	1
6F1	1
BD	1
BC	1
32	1
B2	1
662	1
6F2	1
33	1
B3	1
663	1
6F3	1
BE	1
34	1
664	1
6F4	1
35	1
665	1
6F5	1
36	1
666	1
6F6	1
37	1
667	1
6F7	1
38	1
668	1
6F8	1
39	1
669	1
6F9	1
41	1
61	1
AA	1
C0	1
C1	1
C2	1
C3	1
C4	1
C5	1
E0	1
E1	1
E2	1
E3	1
E4	1
E5	1
100	1
101	1
102	1
103	1
104	1
105	1
1CD	1
1CE	1
1DE	1
1DF	1
1E0	1
1E1	1
1FA	1
1FB	1
200	1
201	1
202	1
203	1
226	1
227	1
363	1
C6	1
E6	1
1E2	1
1E3	1
1FC	1
1FD	1
250	1
251	1
252	1
42	1
62	1
299	1
180	1
181	1
253	1
182	1
183	1
43	1
63	1
C7	1
E7	1
106	1
107	1
108	1
109	1
10A	1
10B	1
368	1
10C	1
10D	1
187	1
188	1
255	1
44	1
64	1
10E	1
10F	1
369	1
1C4	1
1C5	1
1C6	1
1F1	1
1F2	1
1F3	1
2A3	1
2A5	1
2A4	1
110	1
111	1
189	1
256	1
18A	1
257	1
18B	1
18C	1
221	1
D0	1
F0	1
45	1
65	1
C8	1
C9	1
CA	1
CB	1
E8	1
E9	1
EA	1
EB	1
112	1
113	1
114	1
115	1
116	1
117	1
118	1
119	1
11A	1
11B	1
204	1
205	1
206	1
207	1
228	1
229	1
364	1
18E	1
1DD	1
18F	1
259	1
190	1
25B	1
258	1
25A	1
25C	1
25D	1
25E	1
29A	1
264	1
46	1
66	1
2A9	1
191	1
192	1
47	1
67	1
11C	1
11D	1
11E	1
11F	1
120	1
121	1
122	1
123	1
1E6	1
1E7	1
1F4	1
1F5	1
261	1
262	1
1E4	1
1E5	1
193	1
260	1
29B	1
194	1
263	1
2E0	1
1A2	1
1A3	1
48	1
68	1
124	1
125	1
21E	1
21F	1
2B0	1
36A	1
29C	1
195	1
1F6	1
126	1
127	1
266	1
2B1	1
267	1
2BB	1
2BD	1
49	1
59	1
69	1
79	1
CC	1
CD	1
CE	1
CF	1
EC	1
ED	1
EE	1
EF	1
128	1
129	1
12A	1
12B	1
12C	1
12D	1
12E	1
12F	1
130	1
1CF	1
1D0	1
208	1
209	1
20A	1
20B	1
365	1
132	1
133	1
131	1
26A	1
197	1
268	1
196	1
269	1
4A	1
6A	1
134	1
135	1
1F0	1
2B2	1
29D	1
25F	1
284	1
4B	1
6B	1
136	1
137	1
1E8	1
1E9	1
198	1
199	1
29E	1
4C	1
6C	1
139	1
13A	1
13B	1
13C	1
13D	1
13E	1
2E1	1
13F	1
140	1
1C7	1
1C8	1
1C9	1
2AA	1
2AB	1
29F	1
141	1
142	1
19A	1
26B	1
26C	1
26D	1
234	1
26E	1
19B	1
28E	1
4D	1
6D	1
36B	1
271	1
4E	1
6E	1
D1	1
F1	1
143	1
144	1
145	1
146	1
147	1
148	1
1F8	1
1F9	1
1CA	1
1CB	1
1CC	1
274	1
19D	1
272	1
19E	1
220	1
273	1
235	1
14A	1
14B	1
4F	1
6F	1
BA	1
D2	1
D3	1
D4	1
D5	1
D6	1
F2	1
F3	1
F4	1
F5	1
F6	1
14C	1
14D	1
14E	1
14F	1
150	1
151	1
1A0	1
1A1	1
1D1	1
1D2	1
1EA	1
1EB	1
1EC	1
1ED	1
20C	1
20D	1
20E	1
20F	1
22A	1
22B	1
22C	1
22D	1
22E	1
22F	1
230	1
231	1
366	1
152	1
153	1
276	1
D8	1
F8	1
1FE	1
1FF	1
186	1
254	1
19F	1
275	1
277	1
222	1
223	1
50	1
70	1
1A4	1
1A5	1
278	1
51	1
71	1
2A0	1
138	1
52	1
72	1
154	1
155	1
156	1
157	1
158	1
159	1
210	1
211	1
212	1
213	1
2B3	1
36C	1
1A6	1
280	1
279	1
2B4	1
27A	1
27B	1
2B5	1
27C	1
27D	1
27E	1
27F	1
281	1
2B6	1
53	1
73	1
15A	1
15B	1
15C	1
15D	1
15E	1
15F	1
17F	1
218	1
219	1
2E2	1
DF	1
160	1
161	1
282	1
1A9	1
283	1
1AA	1
285	1
286	1
54	1
74	1
162	1
163	1
164	1
165	1
21A	1
21B	1
36D	1
2A8	1
1BE	1
2A6	1
2A7	1
166	1
167	1
1AB	1
1AC	1
1AD	1
1AE	1
288	1
236	1
287	1
55	1
75	1
D9	1
DA	1
DB	1
DC	1
F9	1
FA	1
FB	1
FC	1
168	1
169	1
16A	1
16B	1
16C	1
16D	1
16E	1
16F	1
170	1
171	1
172	1
173	1
1AF	1
1B0	1
1D3	1
1D4	1
1D5	1
1D6	1
1D7	1
1D8	1
1D9	1
1DA	1
1DB	1
1DC	1
214	1
215	1
216	1
217	1
367	1
289	1
265	1
2AE	1
2AF	1
19C	1
26F	1
270	1
1B1	1
28A	1
56	1
76	1
36E	1
1B2	1
28B	1
28C	1
57	1
77	1
174	1
175	1
2B7	1
28D	1
58	1
78	1
2E3	1
36F	1
DD	1
FD	1
FF	1
176	1
177	1
178	1
232	1
233	1
2B8	1
28F	1
1B3	1
1B4	1
5A	1
7A	1
179	1
17A	1
17B	1
17C	1
18D	1
17D	1
17E	1
1B5	1
1B6	1
224	1
225	1
290	1
291	1
1B7	1
1EE	1
1EF	1
292	1
1B8	1
1B9	1
1BA	1
293	1
21C	1
21D	1
DE	1
FE	1
1BF	1
1F7	1
1BB	1
1A7	1
1A8	1
1BC	1
1BD	1
184	1
185	1
294	1
2C0	1
2BC	1
149	1
2EE	1
2BE	1
295	1
2E4	1
2BF	1
2C1	1
2A1	1
2A2	1
296	1
1C0	1
1C1	1
1C2	1
1C3	1
297	1
298	1
2AC	1
2AD	1
386	1
391	1
3AC	1
3B1	1
392	1
3B2	1
3D0	1
393	1
3B3	1
394	1
3B4	1
388	1
395	1
3AD	1
3B5	1
3F5	1
3DC	1
3DD	1
3DA	1
3DB	1
396	1
3B6	1
389	1
397	1
3AE	1
3B7	1
398	1
3B8	1
3D1	1
3F4	1
37A	1
38A	1
390	1
399	1
3AA	1
3AF	1
3B9	1
3CA	1
3F3	1
39A	1
3BA	1
3F0	1
3D7	1
39B	1
3BB	1
B5	1
39C	1
3BC	1
39D	1
3BD	1
39E	1
3BE	1
38C	1
39F	1
3BF	1
3CC	1
3A0	1
3C0	1
3D6	1
3DE	1
3DF	1
3D8	1
3D9	1
3A1	1
3C1	1
3F1	1
3A3	1
3C2	1
3C3	1
3F2	1
3F9	1
3A4	1
3C4	1
38E	1
3A5	1
3AB	1
3B0	1
3C5	1
3CB	1
3CD	1
3D2	1
3D3	1
3D4	1
3A6	1
3C6	1
3D5	1
3A7	1
3C7	1
3A8	1
3C8	1
38F	1
3A9	1
3C9	1
3CE	1
3E0	1
3E1	1
3F7	1
3F8	1
3FA	1
3FB	1
3E2	1
3E3	1
3E4	1
3E5	1
3E6	1
3E7	1
3E8	1
3E9	1
3EA	1
3EB	1
3EC	1
3ED	1
3EE	1
3EF	1
410	1
430	1
4D0	1
4D1	1
4D2	1
4D3	1
4D8	1
4D9	1
4DA	1
4DB	1
4D4	1
4D5	1
411	1
431	1
412	1
432	1
413	1
433	1
490	1
491	1
492	1
493	1
494	1
495	1
414	1
434	1
500	1
501	1
402	1
452	1
502	1
503	1
403	1
453	1
498	1
499	1
400	1
401	1
415	1
435	1
450	1
451	1
4D6	1
4D7	1
404	1
454	1
416	1
436	1
4C1	1
4C2	1
4DC	1
4DD	1
496	1
497	1
417	1
437	1
504	1
505	1
4DE	1
4DF	1
405	1
455	1
4E0	1
4E1	1
506	1
507	1
40D	1
418	1
438	1
45D	1
4E2	1
4E3	1
48A	1
48B	1
4E4	1
4E5	1
406	1
456	1
407	1
457	1
419	1
439	1
408	1
458	1
41A	1
43A	1
49A	1
49B	1
4C3	1
4C4	1
4A0	1
4A1	1
49E	1
49F	1
49C	1
49D	1
41B	1
43B	1
4C5	1
4C6	1
409	1
459	1
508	1
509	1
41C	1
43C	1
4CD	1
4CE	1
41D	1
43D	1
4C9	1
4CA	1
4A2	1
4A3	1
4C7	1
4C8	1
4A4	1
4A5	1
40A	1
45A	1
50A	1
50B	1
41E	1
43E	1
4E6	1
4E7	1
4E8	1
4E9	1
4EA	1
4EB	1
41F	1
43F	1
4A6	1
4A7	1
480	1
481	1
420	1
440	1
48E	1
48F	1
421	1
441	1
50C	1
50D	1
4AA	1
4AB	1
422	1
442	1
50E	1
50F	1
4AC	1
4AD	1
40B	1
45B	1
40C	1
45C	1
423	1
443	1
4EE	1
4EF	1
40E	1
45E	1
4F0	1
4F1	1
4F2	1
4F3	1
4AE	1
4AF	1
4B0	1
4B1	1
478	1
479	1
424	1
444	1
425	1
445	1
4B2	1
4B3	1
4BA	1
4BB	1
460	1
461	1
47E	1
47F	1
47C	1
47D	1
47A	1
47B	1
426	1
446	1
4B4	1
4B5	1
427	1
447	1
4F4	1
4F5	1
4B6	1
4B7	1
4CB	1
4CC	1
4B8	1
4B9	1
4BC	1
4BD	1
4BE	1
4BF	1
40F	1
45F	1
428	1
448	1
429	1
449	1
42A	1
44A	1
42B	1
44B	1
4F8	1
4F9	1
42C	1
44C	1
48C	1
48D	1
462	1
463	1
42D	1
44D	1
4EC	1
4ED	1
42E	1
44E	1
42F	1
44F	1
464	1
465	1
466	1
467	1
46A	1
46B	1
468	1
469	1
46C	1
46D	1
46E	1
46F	1
470	1
471	1
472	1
473	1
474	1
475	1
476	1
477	1
4A8	1
4A9	1
4C0	1
531	1
561	1
532	1
562	1
533	1
563	1
534	1
564	1
535	1
565	1
587	1
536	1
566	1
537	1
567	1
538	1
568	1
539	1
569	1
53A	1
56A	1
53B	1
56B	1
53C	1
56C	1
53D	1
56D	1
53E	1
56E	1
53F	1
56F	1
540	1
570	1
541	1
571	1
542	1
572	1
543	1
573	1
544	1
574	1
545	1
575	1
546	1
576	1
547	1
577	1
548	1
578	1
549	1
579	1
54A	1
57A	1
54B	1
57B	1
54C	1
57C	1
54D	1
57D	1
54E	1
57E	1
54F	1
57F	1
550	1
580	1
551	1
581	1
552	1
582	1
553	1
583	1
554	1
584	1
555	1
585	1
556	1
586	1
559	1
5D0	1
5D1	1
5D2	1
5D3	1
5D4	1
5D5	1
5F0	1
5F1	1
5D6	1
5D7	1
5D8	1
5D9	1
5F2	1
5DA	1
5DB	1
5DC	1
5DD	1
5DE	1
5DF	1
5E0	1
5E1	1
5E2	1
5E3	1
5E4	1
5E5	1
5E6	1
5E7	1
5E8	1
5E9	1
5EA	1
621	1
674	1
6FD	1
622	1
623	1
672	1
671	1
624	1
625	1
673	1
626	1
627	1
675	1
66E	1
628	1
67B	1
67E	1
680	1
629	1
62A	1
62B	1
679	1
67A	1
67C	1
67D	1
67F	1
62C	1
683	1
684	1
686	1
6BF	1
687	1
62D	1
62E	1
681	1
682	1
685	1
62F	1
630	1
688	1
689	1
68A	1
68B	1
68C	1
68D	1
68E	1
68F	1
690	1
6EE	1
631	1
632	1
691	1
692	1
693	1
694	1
695	1
696	1
697	1
698	1
699	1
6EF	1
633	1
634	1
69A	1
69B	1
69C	1
6FA	1
635	1
636	1
69D	1
69E	1
6FB	1
637	1
638	1
69F	1
639	1
63A	1
6A0	1
6FC	1
641	1
6A1	1
6A2	1
6A3	1
6A4	1
6A5	1
6A6	1
66F	1
642	1
6A7	1
6A8	1
643	1
6A9	1
6AA	1
6AB	1
6AC	1
6AD	1
6AE	1
6AF	1
6B0	1
6B1	1
6B2	1
6B3	1
6B4	1
644	1
6B5	1
6B6	1
6B7	1
6B8	1
645	1
6FE	1
646	1
6BA	1
6BB	1
6BC	1
6BD	1
6B9	1
647	1
6BE	1
6C1	1
6C2	1
6C3	1
6FF	1
6C0	1
6D5	1
648	1
6E5	1
676	1
6C4	1
6C5	1
6C6	1
6C7	1
677	1
6C8	1
6C9	1
6CA	1
6CB	1
6CF	1
649	1
64A	1
6E6	1
678	1
6CC	1
6CD	1
6CE	1
6D0	1
6D1	1
6D2	1
6D3	1
710	1
712	1
72D	1
713	1
714	1
72E	1
716	1
715	1
72F	1
717	1
718	1
719	1
74D	1
71A	1
71B	1
71C	1
71D	1
71E	1
71F	1
74E	1
720	1
721	1
722	1
723	1
724	1
725	1
726	1
727	1
74F	1
728	1
729	1
72A	1
72B	1
72C	1
780	1
799	1
79A	1
781	1
782	1
783	1
79C	1
784	1
785	1
786	1
787	1
7A2	1
7A3	1
788	1
7A5	1
789	1
78A	1
78B	1
79B	1
78C	1
798	1
7A0	1
7A1	1
78D	1
78E	1
7A4	1
78F	1
790	1
79D	1
79E	1
79F	1
791	1
792	1
793	1
794	1
795	1
796	1
797	1
7B1	1
7A6	1
7A7	1
7A8	1
7A9	1
7AA	1
7AB	1
7AC	1
7AD	1
7AE	1
7AF	1
7B0	1
4E00	1
4E01	1
4E02	1
4E03	1
4E04	1
4E05	1
4E06	1
4E07	1
4E08	1
4E09	1
4E0A	1
4E0B	1
4E0C	1
4E0D	1
4E0E	1
4E0F	1
4E10	1
4E11	1
4E12	1
4E13	1
4E14	1
4E15	1
4E16	1
4E17	1
4E18	1
4E19	1
4E1A	1
4E1B	1
4E1C	1
4E1D	1
4E1E	1
4E1F	1
4E20	1
4E21	1
4E22	1
4E23	1
4E24	1
4E25	1
4E26	1
4E27	1
4E28	1
4E29	1
4E2A	1
4E2B	1
4E2C	1
4E2D	1
4E2E	1
4E2F	1
4E30	1
4E31	1
4E32	1
4E33	1
4E34	1
4E35	1
4E36	1
4E37	1
4E38	1
4E39	1
4E3A	1
4E3B	1
4E3C	1
4E3D	1
4E3E	1
4E3F	1
4E40	1
4E41	1
4E42	1
4E43	1
4E44	1
4E45	1
4E46	1
4E47	1
4E48	1
4E49	1
4E4A	1
4E4B	1
4E4C	1
4E4D	1
4E4E	1
4E4F	1
4E50	1
4E51	1
4E52	1
4E53	1
4E54	1
4E55	1
4E56	1
4E57	1
4E58	1
4E59	1
4E5A	1
4E5B	1
4E5C	1
4E5D	1
4E5E	1
4E5F	1
4E60	1
4E61	1
4E62	1
4E63	1
4E64	1
4E65	1
4E66	1
4E67	1
4E68	1
4E69	1
4E6A	1
4E6B	1
4E6C	1
4E6D	1
4E6E	1
4E6F	1
4E70	1
4E71	1
4E72	1
4E73	1
4E74	1
4E75	1
4E76	1
4E77	1
4E78	1
4E79	1
4E7A	1
4E7B	1
4E7C	1
4E7D	1
4E7E	1
4E7F	1
4E80	1
4E81	1
4E82	1
4E83	1
4E84	1
4E85	1
4E86	1
4E87	1
4E88	1
4E89	1
4E8A	1
4E8B	1
4E8C	1
4E8D	1
4E8E	1
4E8F	1
4E90	1
4E91	1
4E92	1
4E93	1
4E94	1
4E95	1
4E96	1
4E97	1
4E98	1
4E99	1
4E9A	1
4E9B	1
4E9C	1
4E9D	1
4E9E	1
4E9F	1
4EA0	1
4EA1	1
4EA2	1
4EA3	1
4EA4	1
4EA5	1
4EA6	1
4EA7	1
4EA8	1
4EA9	1
4EAA	1
4EAB	1
4EAC	1
4EAD	1
4EAE	1
4EAF	1
4EB0	1
4EB1	1
4EB2	1
4EB3	1
4EB4	1
4EB5	1
4EB6	1
4EB7	1
4EB8	1
4EB9	1
4EBA	1
4EBB	1
4EBC	1
4EBD	1
4EBE	1
4EBF	1
4EC0	1
4EC1	1
4EC2	1
4EC3	1
4EC4	1
4EC5	1
4EC6	1
4EC7	1
4EC8	1
4EC9	1
4ECA	1
4ECB	1
4ECC	1
4ECD	1
4ECE	1
4ECF	1
4ED0	1
4ED1	1
4ED2	1
4ED3	1
4ED4	1
4ED5	1
4ED6	1
4ED7	1
4ED8	1
4ED9	1
4EDA	1
4EDB	1
4EDC	1
4EDD	1
4EDE	1
4EDF	1
4EE0	1
4EE1	1
4EE2	1
4EE3	1
4EE4	1
4EE5	1
4EE6	1
4EE7	1
4EE8	1
4EE9	1
4EEA	1
4EEB	1
4EEC	1
4EED	1
4EEE	1
4EEF	1
4EF0	1
4EF1	1
4EF2	1
4EF3	1
4EF4	1
4EF5	1
4EF6	1
4EF7	1
4EF8	1
4EF9	1
4EFA	1
4EFB	1
4EFC	1
4EFD	1
4EFE	1
4EFF	1
4F00	1
4F01	1
4F02	1
4F03	1
4F04	1
4F05	1
4F06	1
4F07	1
4F08	1
4F09	1
4F0A	1
4F0B	1
4F0C	1
4F0D	1
4F0E	1
4F0F	1
4F10	1
4F11	1
4F12	1
4F13	1
4F14	1
4F15	1
4F16	1
4F17	1
4F18	1
4F19	1
4F1A	1
4F1B	1
4F1C	1
4F1D	1
4F1E	1
4F1F	1
4F20	1
4F21	1
4F22	1
4F23	1
4F24	1
4F25	1
4F26	1
4F27	1
4F28	1
4F29	1
4F2A	1
4F2B	1
4F2C	1
4F2D	1
4F2E	1
4F2F	1
4F30	1
4F31	1
4F32	1
4F33	1
4F34	1
4F35	1
4F36	1
4F37	1
4F38	1
4F39	1
4F3A	1
4F3B	1
4F3C	1
4F3D	1
4F3E	1
4F3F	1
4F40	1
4F41	1
4F42	1
4F43	1
4F44	1
4F45	1
4F46	1
4F47	1
4F48	1
4F49	1
4F4A	1
4F4B	1
4F4C	1
4F4D	1
4F4E	1
4F4F	1
4F50	1
4F51	1
4F52	1
4F53	1
4F54	1
4F55	1
4F56	1
4F57	1
4F58	1
4F59	1
4F5A	1
4F5B	1
4F5C	1
4F5D	1
4F5E	1
4F5F	1
4F60	1
4F61	1
4F62	1
4F63	1
4F64	1
4F65	1
4F66	1
4F67	1
4F68	1
4F69	1
4F6A	1
4F6B	1
4F6C	1
4F6D	1
4F6E	1
4F6F	1
4F70	1
4F71	1
4F72	1
4F73	1
4F74	1
4F75	1
4F76	1
4F77	1
4F78	1
4F79	1
4F7A	1
4F7B	1
4F7C	1
4F7D	1
4F7E	1
4F7F	1
4F80	1
4F81	1
4F82	1
4F83	1
4F84	1
4F85	1
4F86	1
4F87	1
4F88	1
4F89	1
4F8A	1
4F8B	1
4F8C	1
4F8D	1
4F8E	1
4F8F	1
4F90	1
4F91	1
4F92	1
4F93	1
4F94	1
4F95	1
4F96	1
4F97	1
4F98	1
4F99	1
4F9A	1
4F9B	1
4F9C	1
4F9D	1
4F9E	1
4F9F	1
4FA0	1
4FA1	1
4FA2	1
4FA3	1
4FA4	1
4FA5	1
4FA6	1
4FA7	1
4FA8	1
4FA9	1
4FAA	1
4FAB	1
4FAC	1
4FAD	1
4FAE	1
4FAF	1
4FB0	1
4FB1	1
4FB2	1
4FB3	1
4FB4	1
4FB5	1
4FB6	1
4FB7	1
4FB8	1
4FB9	1
4FBA	1
4FBB	1
4FBC	1
4FBD	1
4FBE	1
4FBF	1
4FC0	1
4FC1	1
4FC2	1
4FC3	1
4FC4	1
4FC5	1
4FC6	1
4FC7	1
4FC8	1
4FC9	1
4FCA	1
4FCB	1
4FCC	1
4FCD	1
4FCE	1
4FCF	1
4FD0	1
4FD1	1
4FD2	1
4FD3	1
4FD4	1
4FD5	1
4FD6	1
4FD7	1
4FD8	1
4FD9	1
4FDA	1
4FDB	1
4FDC	1
4FDD	1
4FDE	1
4FDF	1
4FE0	1
4FE1	1
4FE2	1
4FE3	1
4FE4	1
4FE5	1
4FE6	1
4FE7	1
4FE8	1
4FE9	1
4FEA	1
4FEB	1
4FEC	1
4FED	1
4FEE	1
4FEF	1
4FF0	1
4FF1	1
4FF2	1
4FF3	1
4FF4	1
4FF5	1
4FF6	1
4FF7	1
4FF8	1
4FF9	1
4FFA	1
4FFB	1
4FFC	1
4FFD	1
4FFE	1
4FFF	1
237	1
238	1
239	1
23A	1
23B	1
23C	1
23D	1
23E	1
23F	1
240	1
241	1
242	1
243	1
244	1
245	1
246	1
247	1
248	1
249	1
24A	1
24B	1
24C	1
24D	1
24E	1
24F	1
358	1
359	1
35A	1
35B	1
35C	1
370	1
371	1
372	1
373	1
376	1
377	1
378	1
379	1
37B	1
37C	1
37D	1
37F	1
380	1
381	1
382	1
383	1
38B	1
38D	1
3A2	1
3CF	1
3FC	1
3FD	1
3FE	1
3FF	1
487	1
4CF	1
4F6	1
4F7	1
4FA	1
4FB	1
4FC	1
4FD	1
4FE	1
4FF	1
510	1
511	1
512	1
513	1
514	1
515	1
516	1
517	1
518	1
519	1
51A	1
51B	1
51C	1
51D	1
51E	1
51F	1
520	1
521	1
522	1
523	1
524	1
525	1
526	1
527	1
528	1
529	1
52A	1
52B	1
52C	1
52D	1
52E	1
52F	1
530	1
557	1
558	1
560	1
588	1
58B	1
58C	1
58D	1
58E	1
58F	1
590	1
5A2	1
5BA	1
5C5	1
5C6	1
5C7	1
5C8	1
5C9	1
5CA	1
5CB	1
5CC	1
5CD	1
5CE	1
5CF	1
5EB	1
5EC	1
5ED	1
5EE	1
5EF	1
5F5	1
5F6	1
5F7	1
5F8	1
5F9	1
5FA	1
5FB	1
5FC	1
5FD	1
5FE	1
5FF	1
604	1
605	1
606	1
607	1
608	1
609	1
60A	1
60B	1
616	1
617	1
618	1
619	1
61A	1
61C	1
61D	1
61E	1
620	1
63B	1
63C	1
63D	1
63E	1
63F	1
659	1
65A	1
65B	1
65C	1
65D	1
65E	1
65F	1
70E	1
74B	1
74C	1
750	1
751	1
752	1
753	1
754	1
755	1
756	1
757	1
758	1
759	1
75A	1
75B	1
75C	1
75D	1
75E	1
75F	1
760	1
761	1
762	1
763	1
764	1
765	1
766	1
767	1
768	1
769	1
76A	1
76B	1
76C	1
76D	1
76E	1
76F	1
770	1
771	1
772	1
773	1
774	1
775	1
776	1
777	1
778	1
779	1
77A	1
77B	1
77C	1
77D	1
77E	1
77F	1
7B2	1
7B3	1
7B4	1
7B5	1
7B6	1
7B7	1
7B8	1
7B9	1
7BA	1
7BB	1
7BC	1
7BD	1
7BE	1
7BF	1
7C0	1
7C1	1
7C2	1
7C3	1
7C4	1
7C5	1
7C6	1
7C7	1
7C8	1
7C9	1
7CA	1
7CB	1
7CC	1
7CD	1
7CE	1
7CF	1
7D0	1
7D1	1
7D2	1
7D3	1
7D4	1
7D5	1
7D6	1
7D7	1
7D8	1
7D9	1
7DA	1
7DB	1
7DC	1
7DD	1
7DE	1
7DF	1
7E0	1
7E1	1
7E2	1
7E3	1
7E4	1
7E5	1
7E6	1
7E7	1
7E8	1
7E9	1
7EA	1
7EB	1
7EC	1
7ED	1
7EE	1
7EF	1
7F0	1
7F1	1
7F2	1
7F3	1
7F4	1
7F5	1
7F6	1
7F7	1
7F8	1
7F9	1
7FA	1
7FB	1
7FC	1
7FD	1
7FE	1
7FF	1
DROP TABLE IF EXISTS test.t1;
DROP TABLE IF EXISTS test.t1;
DROP DATABASE test;
CREATE DATABASE test CHARACTER SET utf8mb3;
USE test;
SET NAMES utf8mb3;
Warnings:
Warning	1287	'utf8mb3' is deprecated and will be removed in a future release. Please use utf8mb4 instead
CREATE TABLE test.t1 (a CHAR(4) CHARACTER SET utf8mb3) ENGINE=MyISAM CHARACTER SET utf8mb3;
Warnings:
Warning	1287	'utf8mb3' is deprecated and will be removed in a future release. Please use utf8mb4 instead
Warning	1287	'utf8mb3' is deprecated and will be removed in a future release. Please use utf8mb4 instead
SHOW TABLE STATUS LIKE 't1';
Name	Engine	Version	Row_format	Rows	Avg_row_length	Data_length	Max_data_length	Index_length	Data_free	Auto_increment	Create_time	Update_time	Check_time	Collation	Checksum	Create_options	Comment
t1	MyISAM	#	#	#	#	#	#	#	#	#	#	#	#	utf8mb3_general_ci	#	#	#
LOAD DATA INFILE 
'MYSQL_TEST_DIR/suite/funcs_2/data/charset_utf8.txt' INTO TABLE test.t1;
ALTER TABLE test.t1 CHANGE a a CHAR(4) CHARACTER SET ucs2 COLLATE ucs2_persian_ci;
Warnings:
Warning	1287	'ucs2' is deprecated and will be removed in a future release. Please use utf8mb4 instead
Warning	4079	'ucs2_persian_ci' is a collation of the deprecated character set ucs2. Please consider using utf8mb4 with an appropriate collation instead.
DELETE FROM test.t1 WHERE CHAR_LENGTH(a) <> 1;
SELECT HEX(ORD(a)) AS a_ord, CHAR_LENGTH(a) AS a_len FROM test.t1 ORDER BY a, ORD(a);
a_ord	a_len
653	1
654	1
655	1
670	1
85	1
7F	1
80	1
81	1
82	1
83	1
84	1
86	1
87	1
88	1
89	1
8A	1
8B	1
8C	1
8D	1
8E	1
8F	1
90	1
91	1
92	1
93	1
94	1
95	1
96	1
97	1
98	1
99	1
9A	1
9B	1
9C	1
9D	1
9E	1
9F	1
A0	1
300	1
301	1
302	1
303	1
304	1
305	1
306	1
307	1
308	1
309	1
30A	1
30B	1
30C	1
30D	1
30E	1
30F	1
310	1
311	1
312	1
313	1
314	1
315	1
316	1
317	1
318	1
319	1
31A	1
31B	1
31C	1
31D	1
31E	1
31F	1
320	1
321	1
322	1
323	1
324	1
325	1
326	1
327	1
328	1
329	1
32A	1
32B	1
32C	1
32D	1
32E	1
32F	1
330	1
331	1
332	1
333	1
334	1
335	1
336	1
337	1
338	1
339	1
33A	1
33B	1
33C	1
33D	1
33E	1
33F	1
340	1
341	1
342	1
343	1
344	1
345	1
346	1
347	1
348	1
349	1
34A	1
34B	1
34C	1
34D	1
34E	1
34F	1
350	1
351	1
352	1
353	1
354	1
355	1
356	1
357	1
35D	1
35E	1
35F	1
360	1
361	1
362	1
483	1
484	1
485	1
486	1
488	1
489	1
591	1
592	1
593	1
594	1
595	1
596	1
597	1
598	1
599	1
59A	1
59B	1
59C	1
59D	1
59E	1
59F	1
5A0	1
5A1	1
5A3	1
5A4	1
5A5	1
5A6	1
5A7	1
5A8	1
5A9	1
5AA	1
5AB	1
5AC	1
5AD	1
5AE	1
5AF	1
5B0	1
5B1	1
5B2	1
5B3	1
5B4	1
5B5	1
5B6	1
5B7	1
5B8	1
5B9	1
5BB	1
5BC	1
5BD	1
5BF	1
5C1	1
5C2	1
5C4	1
600	1
601	1
602	1
603	1
610	1
611	1
612	1
613	1
614	1
615	1
651	1
652	1
656	1
657	1
658	1
6D6	1
6D7	1
6D8	1
6D9	1
6DA	1
6DB	1
6DC	1
6DD	1
6DE	1
6DF	1
6E0	1
6E1	1
6E2	1
6E3	1
6E4	1
6E7	1
6E8	1
6EA	1
6EB	1
6EC	1
6ED	1
70F	1
711	1
730	1
731	1
732	1
733	1
734	1
735	1
736	1
737	1
738	1
739	1
73A	1
73B	1
73C	1
73D	1
73E	1
73F	1
740	1
741	1
742	1
743	1
744	1
745	1
746	1
747	1
748	1
749	1
74A	1
640	1
60	1
B4	1
384	1
2DC	1
5E	1
AF	1
2D8	1
2D9	1
A8	1
385	1
2DA	1
2DD	1
B8	1
2DB	1
5F	1
AD	1
2D	1
58A	1
2C	1
55D	1
60C	1
60D	1
66B	1
66C	1
3B	1
37E	1
61B	1
3A	1
589	1
703	1
704	1
705	1
706	1
707	1
708	1
21	1
A1	1
55C	1
3F	1
BF	1
55E	1
61F	1
709	1
2E	1
6D4	1
701	1
702	1
B7	1
387	1
700	1
27	1
22	1
AB	1
BB	1
28	1
29	1
5B	1
7B	1
7D	1
A7	1
B6	1
A9	1
AE	1
40	1
2A	1
66D	1
2F	1
64E	1
26	1
650	1
23	1
64F	1
25	1
66A	1
64B	1
64D	1
64C	1
55A	1
55B	1
55F	1
5BE	1
5C0	1
5C3	1
5F3	1
5F4	1
70A	1
70B	1
70C	1
70D	1
2B9	1
374	1
375	1
2BA	1
2C2	1
2C3	1
2C4	1
2C5	1
2C6	1
2C7	1
2C8	1
2C9	1
2CA	1
2CB	1
2CC	1
2CD	1
2CE	1
2CF	1
2D2	1
2D3	1
2D4	1
2D5	1
2D6	1
2D7	1
2DE	1
2DF	1
2E5	1
2E6	1
2E7	1
2E8	1
2E9	1
2EA	1
2EB	1
2EC	1
2ED	1
2EF	1
2F0	1
2F1	1
2F2	1
2F3	1
2F4	1
2F5	1
2F6	1
2F7	1
2F8	1
2F9	1
2FA	1
2FB	1
2FC	1
2FD	1
2FE	1
2FF	1
B0	1
482	1
60E	1
60F	1
6E9	1
3F6	1
2B	1
B1	1
F7	1
D7	1
3C	1
3D	1
3E	1
AC	1
7C	1
A6	1
7E	1
2D0	1
2D1	1
A4	1
A2	1
24	1
A3	1
A5	1
30	1
660	1
6F0	1
31	1
B9	1
661	1
6F1	1
BD	1
BC	1
32	1
B2	1
662	1
6F2	1
33	1
B3	1
663	1
6F3	1
BE	1
34	1
664	1
6F4	1
35	1
665	1
6F5	1
36	1
666	1
6F6	1
37	1
667	1
6F7	1
38	1
668	1
6F8	1
39	1
669	1
6F9	1
41	1
61	1
AA	1
C0	1
C1	1
C2	1
C3	1
C4	1
C5	1
E0	1
E1	1
E2	1
E3	1
E4	1
E5	1
100	1
101	1
102	1
103	1
104	1
105	1
1CD	1
1CE	1
1DE	1
1DF	1
1E0	1
1E1	1
1FA	1
1FB	1
200	1
201	1
202	1
203	1
226	1
227	1
363	1
622	1
627	1
671	1
621	1
623	1
C6	1
E6	1
1E2	1
1E3	1
1FC	1
1FD	1
625	1
624	1
626	1
250	1
251	1
252	1
42	1
62	1
299	1
180	1
181	1
253	1
182	1
183	1
43	1
63	1
C7	1
E7	1
106	1
107	1
108	1
109	1
10A	1
10B	1
10C	1
10D	1
368	1
187	1
188	1
255	1
44	1
64	1
10E	1
10F	1
369	1
1C4	1
1C5	1
1C6	1
1F1	1
1F2	1
1F3	1
2A3	1
2A5	1
2A4	1
110	1
111	1
189	1
256	1
18A	1
257	1
18B	1
18C	1
221	1
D0	1
F0	1
45	1
65	1
C8	1
C9	1
CA	1
CB	1
E8	1
E9	1
EA	1
EB	1
112	1
113	1
114	1
115	1
116	1
117	1
118	1
119	1
11A	1
11B	1
204	1
205	1
206	1
207	1
228	1
229	1
364	1
18E	1
1DD	1
18F	1
259	1
190	1
25B	1
258	1
25A	1
25C	1
25D	1
25E	1
29A	1
264	1
46	1
66	1
2A9	1
191	1
192	1
47	1
67	1
11C	1
11D	1
11E	1
11F	1
120	1
121	1
122	1
123	1
1E6	1
1E7	1
1F4	1
1F5	1
261	1
262	1
1E4	1
1E5	1
193	1
260	1
29B	1
194	1
263	1
2E0	1
1A2	1
1A3	1
48	1
68	1
124	1
125	1
21E	1
21F	1
2B0	1
36A	1
29C	1
195	1
1F6	1
126	1
127	1
266	1
2B1	1
267	1
2BB	1
2BD	1
49	1
69	1
CC	1
CD	1
CE	1
CF	1
EC	1
ED	1
EE	1
EF	1
128	1
129	1
12A	1
12B	1
12C	1
12D	1
12E	1
12F	1
130	1
1CF	1
1D0	1
208	1
209	1
20A	1
20B	1
365	1
132	1
133	1
131	1
26A	1
197	1
268	1
196	1
269	1
4A	1
6A	1
134	1
135	1
1F0	1
2B2	1
29D	1
25F	1
284	1
4B	1
6B	1
136	1
137	1
1E8	1
1E9	1
198	1
199	1
29E	1
4C	1
6C	1
139	1
13A	1
13B	1
13C	1
13D	1
13E	1
2E1	1
13F	1
140	1
1C7	1
1C8	1
1C9	1
2AA	1
2AB	1
29F	1
141	1
142	1
19A	1
26B	1
26C	1
26D	1
234	1
26E	1
19B	1
28E	1
4D	1
6D	1
36B	1
271	1
4E	1
6E	1
D1	1
F1	1
143	1
144	1
145	1
146	1
147	1
148	1
1F8	1
1F9	1
1CA	1
1CB	1
1CC	1
274	1
19D	1
272	1
19E	1
220	1
273	1
235	1
14A	1
14B	1
4F	1
6F	1
BA	1
D2	1
D3	1
D4	1
D5	1
D6	1
F2	1
F3	1
F4	1
F5	1
F6	1
14C	1
14D	1
14E	1
14F	1
150	1
151	1
1A0	1
1A1	1
1D1	1
1D2	1
1EA	1
1EB	1
1EC	1
1ED	1
20C	1
20D	1
20E	1
20F	1
22A	1
22B	1
22C	1
22D	1
22E	1
22F	1
230	1
231	1
366	1
152	1
153	1
276	1
D8	1
F8	1
1FE	1
1FF	1
186	1
254	1
19F	1
275	1
277	1
222	1
223	1
50	1
70	1
1A4	1
1A5	1
278	1
51	1
71	1
2A0	1
138	1
52	1
72	1
154	1
155	1
156	1
157	1
158	1
159	1
210	1
211	1
212	1
213	1
2B3	1
36C	1
1A6	1
280	1
279	1
2B4	1
27A	1
27B	1
2B5	1
27C	1
27D	1
27E	1
27F	1
281	1
2B6	1
53	1
73	1
15A	1
15B	1
15C	1
15D	1
15E	1
15F	1
160	1
161	1
17F	1
218	1
219	1
2E2	1
DF	1
282	1
1A9	1
283	1
1AA	1
285	1
286	1
54	1
74	1
162	1
163	1
164	1
165	1
21A	1
21B	1
36D	1
2A8	1
1BE	1
2A6	1
2A7	1
166	1
167	1
1AB	1
1AC	1
1AD	1
1AE	1
288	1
236	1
287	1
55	1
75	1
D9	1
DA	1
DB	1
DC	1
F9	1
FA	1
FB	1
FC	1
168	1
169	1
16A	1
16B	1
16C	1
16D	1
16E	1
16F	1
170	1
171	1
172	1
173	1
1AF	1
1B0	1
1D3	1
1D4	1
1D5	1
1D6	1
1D7	1
1D8	1
1D9	1
1DA	1
1DB	1
1DC	1
214	1
215	1
216	1
217	1
367	1
289	1
265	1
2AE	1
2AF	1
19C	1
26F	1
270	1
1B1	1
28A	1
56	1
76	1
36E	1
1B2	1
28B	1
28C	1
57	1
77	1
174	1
175	1
2B7	1
28D	1
58	1
78	1
2E3	1
36F	1
59	1
79	1
DD	1
FD	1
FF	1
176	1
177	1
178	1
232	1
233	1
2B8	1
28F	1
1B3	1
1B4	1
5A	1
7A	1
179	1
17A	1
17B	1
17C	1
17D	1
17E	1
18D	1
1B5	1
1B6	1
224	1
225	1
290	1
291	1
1B7	1
1EE	1
1EF	1
292	1
1B8	1
1B9	1
1BA	1
293	1
21C	1
21D	1
DE	1
FE	1
1BF	1
1F7	1
1BB	1
1A7	1
1A8	1
1BC	1
1BD	1
184	1
185	1
294	1
2C0	1
2BC	1
149	1
2EE	1
2BE	1
295	1
2E4	1
2BF	1
2C1	1
2A1	1
2A2	1
296	1
1C0	1
1C1	1
1C2	1
1C3	1
297	1
298	1
2AC	1
2AD	1
386	1
391	1
3AC	1
3B1	1
392	1
3B2	1
3D0	1
393	1
3B3	1
394	1
3B4	1
388	1
395	1
3AD	1
3B5	1
3F5	1
3DC	1
3DD	1
3DA	1
3DB	1
396	1
3B6	1
389	1
397	1
3AE	1
3B7	1
398	1
3B8	1
3D1	1
3F4	1
37A	1
38A	1
390	1
399	1
3AA	1
3AF	1
3B9	1
3CA	1
3F3	1
39A	1
3BA	1
3F0	1
3D7	1
39B	1
3BB	1
B5	1
39C	1
3BC	1
39D	1
3BD	1
39E	1
3BE	1
38C	1
39F	1
3BF	1
3CC	1
3A0	1
3C0	1
3D6	1
3DE	1
3DF	1
3D8	1
3D9	1
3A1	1
3C1	1
3F1	1
3A3	1
3C2	1
3C3	1
3F2	1
3F9	1
3A4	1
3C4	1
38E	1
3A5	1
3AB	1
3B0	1
3C5	1
3CB	1
3CD	1
3D2	1
3D3	1
3D4	1
3A6	1
3C6	1
3D5	1
3A7	1
3C7	1
3A8	1
3C8	1
38F	1
3A9	1
3C9	1
3CE	1
3E0	1
3E1	1
3F7	1
3F8	1
3FA	1
3FB	1
3E2	1
3E3	1
3E4	1
3E5	1
3E6	1
3E7	1
3E8	1
3E9	1
3EA	1
3EB	1
3EC	1
3ED	1
3EE	1
3EF	1
410	1
430	1
4D0	1
4D1	1
4D2	1
4D3	1
4D8	1
4D9	1
4DA	1
4DB	1
4D4	1
4D5	1
411	1
431	1
412	1
432	1
413	1
433	1
490	1
491	1
492	1
493	1
494	1
495	1
414	1
434	1
500	1
501	1
402	1
452	1
502	1
503	1
403	1
453	1
498	1
499	1
400	1
401	1
415	1
435	1
450	1
451	1
4D6	1
4D7	1
404	1
454	1
416	1
436	1
4C1	1
4C2	1
4DC	1
4DD	1
496	1
497	1
417	1
437	1
504	1
505	1
4DE	1
4DF	1
405	1
455	1
4E0	1
4E1	1
506	1
507	1
40D	1
418	1
438	1
45D	1
4E2	1
4E3	1
48A	1
48B	1
4E4	1
4E5	1
406	1
456	1
407	1
457	1
419	1
439	1
408	1
458	1
41A	1
43A	1
49A	1
49B	1
4C3	1
4C4	1
4A0	1
4A1	1
49E	1
49F	1
49C	1
49D	1
41B	1
43B	1
4C5	1
4C6	1
409	1
459	1
508	1
509	1
41C	1
43C	1
4CD	1
4CE	1
41D	1
43D	1
4C9	1
4CA	1
4A2	1
4A3	1
4C7	1
4C8	1
4A4	1
4A5	1
40A	1
45A	1
50A	1
50B	1
41E	1
43E	1
4E6	1
4E7	1
4E8	1
4E9	1
4EA	1
4EB	1
41F	1
43F	1
4A6	1
4A7	1
480	1
481	1
420	1
440	1
48E	1
48F	1
421	1
441	1
50C	1
50D	1
4AA	1
4AB	1
422	1
442	1
50E	1
50F	1
4AC	1
4AD	1
40B	1
45B	1
40C	1
45C	1
423	1
443	1
4EE	1
4EF	1
40E	1
45E	1
4F0	1
4F1	1
4F2	1
4F3	1
4AE	1
4AF	1
4B0	1
4B1	1
478	1
479	1
424	1
444	1
425	1
445	1
4B2	1
4B3	1
4BA	1
4BB	1
460	1
461	1
47E	1
47F	1
47C	1
47D	1
47A	1
47B	1
426	1
446	1
4B4	1
4B5	1
427	1
447	1
4F4	1
4F5	1
4B6	1
4B7	1
4CB	1
4CC	1
4B8	1
4B9	1
4BC	1
4BD	1
4BE	1
4BF	1
40F	1
45F	1
428	1
448	1
429	1
449	1
42A	1
44A	1
42B	1
44B	1
4F8	1
4F9	1
42C	1
44C	1
48C	1
48D	1
462	1
463	1
42D	1
44D	1
4EC	1
4ED	1
42E	1
44E	1
42F	1
44F	1
464	1
465	1
466	1
467	1
46A	1
46B	1
468	1
469	1
46C	1
46D	1
46E	1
46F	1
470	1
471	1
472	1
473	1
474	1
475	1
476	1
477	1
4A8	1
4A9	1
4C0	1
531	1
561	1
532	1
562	1
533	1
563	1
534	1
564	1
535	1
565	1
587	1
536	1
566	1
537	1
567	1
538	1
568	1
539	1
569	1
53A	1
56A	1
53B	1
56B	1
53C	1
56C	1
53D	1
56D	1
53E	1
56E	1
53F	1
56F	1
540	1
570	1
541	1
571	1
542	1
572	1
543	1
573	1
544	1
574	1
545	1
575	1
546	1
576	1
547	1
577	1
548	1
578	1
549	1
579	1
54A	1
57A	1
54B	1
57B	1
54C	1
57C	1
54D	1
57D	1
54E	1
57E	1
54F	1
57F	1
550	1
580	1
551	1
581	1
552	1
582	1
553	1
583	1
554	1
584	1
555	1
585	1
556	1
586	1
559	1
5D0	1
5D1	1
5D2	1
5D3	1
5D4	1
5D5	1
5F0	1
5F1	1
5D6	1
5D7	1
5D8	1
5D9	1
5F2	1
5DA	1
5DB	1
5DC	1
5DD	1
5DE	1
5DF	1
5E0	1
5E1	1
5E2	1
5E3	1
5E4	1
5E5	1
5E6	1
5E7	1
5E8	1
5E9	1
5EA	1
674	1
6FD	1
672	1
673	1
675	1
66E	1
628	1
67B	1
67E	1
680	1
689	1
68A	1
62A	1
62B	1
679	1
67A	1
67C	1
67D	1
67F	1
62C	1
683	1
684	1
686	1
6BF	1
687	1
62D	1
62E	1
681	1
682	1
685	1
62F	1
630	1
688	1
68B	1
68C	1
68D	1
68E	1
68F	1
690	1
6EE	1
631	1
632	1
691	1
692	1
693	1
694	1
695	1
696	1
697	1
698	1
699	1
6EF	1
633	1
634	1
69A	1
69B	1
69C	1
6FA	1
635	1
636	1
69D	1
69E	1
6FB	1
637	1
638	1
69F	1
639	1
63A	1
6A0	1
6FC	1
641	1
6A1	1
6A2	1
6A3	1
6A4	1
6A5	1
6A6	1
66F	1
642	1
6A7	1
6A9	1
643	1
6A8	1
6AA	1
6AB	1
6AC	1
6AD	1
6AE	1
6AF	1
6B0	1
6B1	1
6B2	1
6B3	1
6B4	1
644	1
6B5	1
6B6	1
6B7	1
6B8	1
645	1
6FE	1
646	1
6BA	1
6BB	1
6BC	1
6BD	1
6B9	1
6BE	1
6C1	1
6C2	1
6C3	1
6FF	1
6D5	1
648	1
6E5	1
676	1
647	1
6C4	1
629	1
6C5	1
6C0	1
6C6	1
6C7	1
6CC	1
677	1
649	1
6C8	1
64A	1
6C9	1
6CA	1
6CB	1
6CF	1
6E6	1
678	1
6CD	1
6CE	1
6D0	1
6D1	1
6D2	1
6D3	1
710	1
712	1
72D	1
713	1
714	1
72E	1
716	1
715	1
72F	1
717	1
718	1
719	1
74D	1
71A	1
71B	1
71C	1
71D	1
71E	1
71F	1
74E	1
720	1
721	1
722	1
723	1
724	1
725	1
726	1
727	1
74F	1
728	1
729	1
72A	1
72B	1
72C	1
780	1
799	1
79A	1
781	1
782	1
783	1
79C	1
784	1
785	1
786	1
787	1
7A2	1
7A3	1
788	1
7A5	1
789	1
78A	1
78B	1
79B	1
78C	1
798	1
7A0	1
7A1	1
78D	1
78E	1
7A4	1
78F	1
790	1
79D	1
79E	1
79F	1
791	1
792	1
793	1
794	1
795	1
796	1
797	1
7B1	1
7A6	1
7A7	1
7A8	1
7A9	1
7AA	1
7AB	1
7AC	1
7AD	1
7AE	1
7AF	1
7B0	1
4E00	1
4E01	1
4E02	1
4E03	1
4E04	1
4E05	1
4E06	1
4E07	1
4E08	1
4E09	1
4E0A	1
4E0B	1
4E0C	1
4E0D	1
4E0E	1
4E0F	1
4E10	1
4E11	1
4E12	1
4E13	1
4E14	1
4E15	1
4E16	1
4E17	1
4E18	1
4E19	1
4E1A	1
4E1B	1
4E1C	1
4E1D	1
4E1E	1
4E1F	1
4E20	1
4E21	1
4E22	1
4E23	1
4E24	1
4E25	1
4E26	1
4E27	1
4E28	1
4E29	1
4E2A	1
4E2B	1
4E2C	1
4E2D	1
4E2E	1
4E2F	1
4E30	1
4E31	1
4E32	1
4E33	1
4E34	1
4E35	1
4E36	1
4E37	1
4E38	1
4E39	1
4E3A	1
4E3B	1
4E3C	1
4E3D	1
4E3E	1
4E3F	1
4E40	1
4E41	1
4E42	1
4E43	1
4E44	1
4E45	1
4E46	1
4E47	1
4E48	1
4E49	1
4E4A	1
4E4B	1
4E4C	1
4E4D	1
4E4E	1
4E4F	1
4E50	1
4E51	1
4E52	1
4E53	1
4E54	1
4E55	1
4E56	1
4E57	1
4E58	1
4E59	1
4E5A	1
4E5B	1
4E5C	1
4E5D	1
4E5E	1
4E5F	1
4E60	1
4E61	1
4E62	1
4E63	1
4E64	1
4E65	1
4E66	1
4E67	1
4E68	1
4E69	1
4E6A	1
4E6B	1
4E6C	1
4E6D	1
4E6E	1
4E6F	1
4E70	1
4E71	1
4E72	1
4E73	1
4E74	1
4E75	1
4E76	1
4E77	1
4E78	1
4E79	1
4E7A	1
4E7B	1
4E7C	1
4E7D	1
4E7E	1
4E7F	1
4E80	1
4E81	1
4E82	1
4E83	1
4E84	1
4E85	1
4E86	1
4E87	1
4E88	1
4E89	1
4E8A	1
4E8B	1
4E8C	1
4E8D	1
4E8E	1
4E8F	1
4E90	1
4E91	1
4E92	1
4E93	1
4E94	1
4E95	1
4E96	1
4E97	1
4E98	1
4E99	1
4E9A	1
4E9B	1
4E9C	1
4E9D	1
4E9E	1
4E9F	1
4EA0	1
4EA1	1
4EA2	1
4EA3	1
4EA4	1
4EA5	1
4EA6	1
4EA7	1
4EA8	1
4EA9	1
4EAA	1
4EAB	1
4EAC	1
4EAD	1
4EAE	1
4EAF	1
4EB0	1
4EB1	1
4EB2	1
4EB3	1
4EB4	1
4EB5	1
4EB6	1
4EB7	1
4EB8	1
4EB9	1
4EBA	1
4EBB	1
4EBC	1
4EBD	1
4EBE	1
4EBF	1
4EC0	1
4EC1	1
4EC2	1
4EC3	1
4EC4	1
4EC5	1
4EC6	1
4EC7	1
4EC8	1
4EC9	1
4ECA	1
4ECB	1
4ECC	1
4ECD	1
4ECE	1
4ECF	1
4ED0	1
4ED1	1
4ED2	1
4ED3	1
4ED4	1
4ED5	1
4ED6	1
4ED7	1
4ED8	1
4ED9	1
4EDA	1
4EDB	1
4EDC	1
4EDD	1
4EDE	1
4EDF	1
4EE0	1
4EE1	1
4EE2	1
4EE3	1
4EE4	1
4EE5	1
4EE6	1
4EE7	1
4EE8	1
4EE9	1
4EEA	1
4EEB	1
4EEC	1
4EED	1
4EEE	1
4EEF	1
4EF0	1
4EF1	1
4EF2	1
4EF3	1
4EF4	1
4EF5	1
4EF6	1
4EF7	1
4EF8	1
4EF9	1
4EFA	1
4EFB	1
4EFC	1
4EFD	1
4EFE	1
4EFF	1
4F00	1
4F01	1
4F02	1
4F03	1
4F04	1
4F05	1
4F06	1
4F07	1
4F08	1
4F09	1
4F0A	1
4F0B	1
4F0C	1
4F0D	1
4F0E	1
4F0F	1
4F10	1
4F11	1
4F12	1
4F13	1
4F14	1
4F15	1
4F16	1
4F17	1
4F18	1
4F19	1
4F1A	1
4F1B	1
4F1C	1
4F1D	1
4F1E	1
4F1F	1
4F20	1
4F21	1
4F22	1
4F23	1
4F24	1
4F25	1
4F26	1
4F27	1
4F28	1
4F29	1
4F2A	1
4F2B	1
4F2C	1
4F2D	1
4F2E	1
4F2F	1
4F30	1
4F31	1
4F32	1
4F33	1
4F34	1
4F35	1
4F36	1
4F37	1
4F38	1
4F39	1
4F3A	1
4F3B	1
4F3C	1
4F3D	1
4F3E	1
4F3F	1
4F40	1
4F41	1
4F42	1
4F43	1
4F44	1
4F45	1
4F46	1
4F47	1
4F48	1
4F49	1
4F4A	1
4F4B	1
4F4C	1
4F4D	1
4F4E	1
4F4F	1
4F50	1
4F51	1
4F52	1
4F53	1
4F54	1
4F55	1
4F56	1
4F57	1
4F58	1
4F59	1
4F5A	1
4F5B	1
4F5C	1
4F5D	1
4F5E	1
4F5F	1
4F60	1
4F61	1
4F62	1
4F63	1
4F64	1
4F65	1
4F66	1
4F67	1
4F68	1
4F69	1
4F6A	1
4F6B	1
4F6C	1
4F6D	1
4F6E	1
4F6F	1
4F70	1
4F71	1
4F72	1
4F73	1
4F74	1
4F75	1
4F76	1
4F77	1
4F78	1
4F79	1
4F7A	1
4F7B	1
4F7C	1
4F7D	1
4F7E	1
4F7F	1
4F80	1
4F81	1
4F82	1
4F83	1
4F84	1
4F85	1
4F86	1
4F87	1
4F88	1
4F89	1
4F8A	1
4F8B	1
4F8C	1
4F8D	1
4F8E	1
4F8F	1
4F90	1
4F91	1
4F92	1
4F93	1
4F94	1
4F95	1
4F96	1
4F97	1
4F98	1
4F99	1
4F9A	1
4F9B	1
4F9C	1
4F9D	1
4F9E	1
4F9F	1
4FA0	1
4FA1	1
4FA2	1
4FA3	1
4FA4	1
4FA5	1
4FA6	1
4FA7	1
4FA8	1
4FA9	1
4FAA	1
4FAB	1
4FAC	1
4FAD	1
4FAE	1
4FAF	1
4FB0	1
4FB1	1
4FB2	1
4FB3	1
4FB4	1
4FB5	1
4FB6	1
4FB7	1
4FB8	1
4FB9	1
4FBA	1
4FBB	1
4FBC	1
4FBD	1
4FBE	1
4FBF	1
4FC0	1
4FC1	1
4FC2	1
4FC3	1
4FC4	1
4FC5	1
4FC6	1
4FC7	1
4FC8	1
4FC9	1
4FCA	1
4FCB	1
4FCC	1
4FCD	1
4FCE	1
4FCF	1
4FD0	1
4FD1	1
4FD2	1
4FD3	1
4FD4	1
4FD5	1
4FD6	1
4FD7	1
4FD8	1
4FD9	1
4FDA	1
4FDB	1
4FDC	1
4FDD	1
4FDE	1
4FDF	1
4FE0	1
4FE1	1
4FE2	1
4FE3	1
4FE4	1
4FE5	1
4FE6	1
4FE7	1
4FE8	1
4FE9	1
4FEA	1
4FEB	1
4FEC	1
4FED	1
4FEE	1
4FEF	1
4FF0	1
4FF1	1
4FF2	1
4FF3	1
4FF4	1
4FF5	1
4FF6	1
4FF7	1
4FF8	1
4FF9	1
4FFA	1
4FFB	1
4FFC	1
4FFD	1
4FFE	1
4FFF	1
237	1
238	1
239	1
23A	1
23B	1
23C	1
23D	1
23E	1
23F	1
240	1
241	1
242	1
243	1
244	1
245	1
246	1
247	1
248	1
249	1
24A	1
24B	1
24C	1
24D	1
24E	1
24F	1
358	1
359	1
35A	1
35B	1
35C	1
370	1
371	1
372	1
373	1
376	1
377	1
378	1
379	1
37B	1
37C	1
37D	1
37F	1
380	1
381	1
382	1
383	1
38B	1
38D	1
3A2	1
3CF	1
3FC	1
3FD	1
3FE	1
3FF	1
487	1
4CF	1
4F6	1
4F7	1
4FA	1
4FB	1
4FC	1
4FD	1
4FE	1
4FF	1
510	1
511	1
512	1
513	1
514	1
515	1
516	1
517	1
518	1
519	1
51A	1
51B	1
51C	1
51D	1
51E	1
51F	1
520	1
521	1
522	1
523	1
524	1
525	1
526	1
527	1
528	1
529	1
52A	1
52B	1
52C	1
52D	1
52E	1
52F	1
530	1
557	1
558	1
560	1
588	1
58B	1
58C	1
58D	1
58E	1
58F	1
590	1
5A2	1
5BA	1
5C5	1
5C6	1
5C7	1
5C8	1
5C9	1
5CA	1
5CB	1
5CC	1
5CD	1
5CE	1
5CF	1
5EB	1
5EC	1
5ED	1
5EE	1
5EF	1
5F5	1
5F6	1
5F7	1
5F8	1
5F9	1
5FA	1
5FB	1
5FC	1
5FD	1
5FE	1
5FF	1
604	1
605	1
606	1
607	1
608	1
609	1
60A	1
60B	1
616	1
617	1
618	1
619	1
61A	1
61C	1
61D	1
61E	1
620	1
63B	1
63C	1
63D	1
63E	1
63F	1
659	1
65A	1
65B	1
65C	1
65D	1
65E	1
65F	1
70E	1
74B	1
74C	1
750	1
751	1
752	1
753	1
754	1
755	1
756	1
757	1
758	1
759	1
75A	1
75B	1
75C	1
75D	1
75E	1
75F	1
760	1
761	1
762	1
763	1
764	1
765	1
766	1
767	1
768	1
769	1
76A	1
76B	1
76C	1
76D	1
76E	1
76F	1
770	1
771	1
772	1
773	1
774	1
775	1
776	1
777	1
778	1
779	1
77A	1
77B	1
77C	1
77D	1
77E	1
77F	1
7B2	1
7B3	1
7B4	1
7B5	1
7B6	1
7B7	1
7B8	1
7B9	1
7BA	1
7BB	1
7BC	1
7BD	1
7BE	1
7BF	1
7C0	1
7C1	1
7C2	1
7C3	1
7C4	1
7C5	1
7C6	1
7C7	1
7C8	1
7C9	1
7CA	1
7CB	1
7CC	1
7CD	1
7CE	1
7CF	1
7D0	1
7D1	1
7D2	1
7D3	1
7D4	1
7D5	1
7D6	1
7D7	1
7D8	1
7D9	1
7DA	1
7DB	1
7DC	1
7DD	1
7DE	1
7DF	1
7E0	1
7E1	1
7E2	1
7E3	1
7E4	1
7E5	1
7E6	1
7E7	1
7E8	1
7E9	1
7EA	1
7EB	1
7EC	1
7ED	1
7EE	1
7EF	1
7F0	1
7F1	1
7F2	1
7F3	1
7F4	1
7F5	1
7F6	1
7F7	1
7F8	1
7F9	1
7FA	1
7FB	1
7FC	1
7FD	1
7FE	1
7FF	1
DROP TABLE IF EXISTS test.t1;
DROP TABLE IF EXISTS test.t1;
DROP DATABASE test;
CREATE DATABASE test CHARACTER SET utf8mb3;
USE test;
SET NAMES utf8mb3;
Warnings:
Warning	1287	'utf8mb3' is deprecated and will be removed in a future release. Please use utf8mb4 instead
CREATE TABLE test.t1 (a CHAR(4) CHARACTER SET utf8mb3) ENGINE=MyISAM CHARACTER SET utf8mb3;
Warnings:
Warning	1287	'utf8mb3' is deprecated and will be removed in a future release. Please use utf8mb4 instead
Warning	1287	'utf8mb3' is deprecated and will be removed in a future release. Please use utf8mb4 instead
SHOW TABLE STATUS LIKE 't1';
Name	Engine	Version	Row_format	Rows	Avg_row_length	Data_length	Max_data_length	Index_length	Data_free	Auto_increment	Create_time	Update_time	Check_time	Collation	Checksum	Create_options	Comment
t1	MyISAM	#	#	#	#	#	#	#	#	#	#	#	#	utf8mb3_general_ci	#	#	#
LOAD DATA INFILE 
'MYSQL_TEST_DIR/suite/funcs_2/data/charset_utf8.txt' INTO TABLE test.t1;
ALTER TABLE test.t1 CHANGE a a CHAR(4) CHARACTER SET ucs2 COLLATE ucs2_polish_ci;
Warnings:
Warning	1287	'ucs2' is deprecated and will be removed in a future release. Please use utf8mb4 instead
Warning	4079	'ucs2_polish_ci' is a collation of the deprecated character set ucs2. Please consider using utf8mb4 with an appropriate collation instead.
DELETE FROM test.t1 WHERE CHAR_LENGTH(a) <> 1;
SELECT HEX(ORD(a)) AS a_ord, CHAR_LENGTH(a) AS a_len FROM test.t1 ORDER BY a, ORD(a);
a_ord	a_len
85	1
7F	1
80	1
81	1
82	1
83	1
84	1
86	1
87	1
88	1
89	1
8A	1
8B	1
8C	1
8D	1
8E	1
8F	1
90	1
91	1
92	1
93	1
94	1
95	1
96	1
97	1
98	1
99	1
9A	1
9B	1
9C	1
9D	1
9E	1
9F	1
A0	1
300	1
301	1
302	1
303	1
304	1
305	1
306	1
307	1
308	1
309	1
30A	1
30B	1
30C	1
30D	1
30E	1
30F	1
310	1
311	1
312	1
313	1
314	1
315	1
316	1
317	1
318	1
319	1
31A	1
31B	1
31C	1
31D	1
31E	1
31F	1
320	1
321	1
322	1
323	1
324	1
325	1
326	1
327	1
328	1
329	1
32A	1
32B	1
32C	1
32D	1
32E	1
32F	1
330	1
331	1
332	1
333	1
334	1
335	1
336	1
337	1
338	1
339	1
33A	1
33B	1
33C	1
33D	1
33E	1
33F	1
340	1
341	1
342	1
343	1
344	1
345	1
346	1
347	1
348	1
349	1
34A	1
34B	1
34C	1
34D	1
34E	1
34F	1
350	1
351	1
352	1
353	1
354	1
355	1
356	1
357	1
35D	1
35E	1
35F	1
360	1
361	1
362	1
483	1
484	1
485	1
486	1
488	1
489	1
591	1
592	1
593	1
594	1
595	1
596	1
597	1
598	1
599	1
59A	1
59B	1
59C	1
59D	1
59E	1
59F	1
5A0	1
5A1	1
5A3	1
5A4	1
5A5	1
5A6	1
5A7	1
5A8	1
5A9	1
5AA	1
5AB	1
5AC	1
5AD	1
5AE	1
5AF	1
5B0	1
5B1	1
5B2	1
5B3	1
5B4	1
5B5	1
5B6	1
5B7	1
5B8	1
5B9	1
5BB	1
5BC	1
5BD	1
5BF	1
5C1	1
5C2	1
5C4	1
600	1
601	1
602	1
603	1
610	1
611	1
612	1
613	1
614	1
615	1
64B	1
64C	1
64D	1
64E	1
64F	1
650	1
651	1
652	1
653	1
654	1
655	1
656	1
657	1
658	1
670	1
6D6	1
6D7	1
6D8	1
6D9	1
6DA	1
6DB	1
6DC	1
6DD	1
6DE	1
6DF	1
6E0	1
6E1	1
6E2	1
6E3	1
6E4	1
6E7	1
6E8	1
6EA	1
6EB	1
6EC	1
6ED	1
70F	1
711	1
730	1
731	1
732	1
733	1
734	1
735	1
736	1
737	1
738	1
739	1
73A	1
73B	1
73C	1
73D	1
73E	1
73F	1
740	1
741	1
742	1
743	1
744	1
745	1
746	1
747	1
748	1
749	1
74A	1
640	1
60	1
B4	1
384	1
2DC	1
5E	1
AF	1
2D8	1
2D9	1
A8	1
385	1
2DA	1
2DD	1
B8	1
2DB	1
5F	1
AD	1
2D	1
58A	1
2C	1
55D	1
60C	1
60D	1
66B	1
66C	1
3B	1
37E	1
61B	1
3A	1
589	1
703	1
704	1
705	1
706	1
707	1
708	1
21	1
A1	1
55C	1
3F	1
BF	1
55E	1
61F	1
709	1
2E	1
6D4	1
701	1
702	1
B7	1
387	1
700	1
27	1
22	1
AB	1
BB	1
28	1
29	1
5B	1
7B	1
7D	1
A7	1
B6	1
A9	1
AE	1
40	1
2A	1
66D	1
2F	1
26	1
23	1
25	1
66A	1
55A	1
55B	1
55F	1
5BE	1
5C0	1
5C3	1
5F3	1
5F4	1
70A	1
70B	1
70C	1
70D	1
2B9	1
374	1
375	1
2BA	1
2C2	1
2C3	1
2C4	1
2C5	1
2C6	1
2C7	1
2C8	1
2C9	1
2CA	1
2CB	1
2CC	1
2CD	1
2CE	1
2CF	1
2D2	1
2D3	1
2D4	1
2D5	1
2D6	1
2D7	1
2DE	1
2DF	1
2E5	1
2E6	1
2E7	1
2E8	1
2E9	1
2EA	1
2EB	1
2EC	1
2ED	1
2EF	1
2F0	1
2F1	1
2F2	1
2F3	1
2F4	1
2F5	1
2F6	1
2F7	1
2F8	1
2F9	1
2FA	1
2FB	1
2FC	1
2FD	1
2FE	1
2FF	1
B0	1
482	1
60E	1
60F	1
6E9	1
3F6	1
2B	1
B1	1
F7	1
D7	1
3C	1
3D	1
3E	1
AC	1
7C	1
A6	1
7E	1
2D0	1
2D1	1
A4	1
A2	1
24	1
A3	1
A5	1
30	1
660	1
6F0	1
31	1
B9	1
661	1
6F1	1
BD	1
BC	1
32	1
B2	1
662	1
6F2	1
33	1
B3	1
663	1
6F3	1
BE	1
34	1
664	1
6F4	1
35	1
665	1
6F5	1
36	1
666	1
6F6	1
37	1
667	1
6F7	1
38	1
668	1
6F8	1
39	1
669	1
6F9	1
41	1
61	1
AA	1
C0	1
C1	1
C2	1
C3	1
C4	1
C5	1
E0	1
E1	1
E2	1
E3	1
E4	1
E5	1
100	1
101	1
102	1
103	1
1CD	1
1CE	1
1DE	1
1DF	1
1E0	1
1E1	1
1FA	1
1FB	1
200	1
201	1
202	1
203	1
226	1
227	1
363	1
104	1
105	1
C6	1
E6	1
1E2	1
1E3	1
1FC	1
1FD	1
250	1
251	1
252	1
42	1
62	1
299	1
180	1
181	1
253	1
182	1
183	1
43	1
63	1
C7	1
E7	1
108	1
109	1
10A	1
10B	1
10C	1
10D	1
368	1
106	1
107	1
187	1
188	1
255	1
44	1
64	1
10E	1
10F	1
369	1
1C4	1
1C5	1
1C6	1
1F1	1
1F2	1
1F3	1
2A3	1
2A5	1
2A4	1
110	1
111	1
189	1
256	1
18A	1
257	1
18B	1
18C	1
221	1
D0	1
F0	1
45	1
65	1
C8	1
C9	1
CA	1
CB	1
E8	1
E9	1
EA	1
EB	1
112	1
113	1
114	1
115	1
116	1
117	1
11A	1
11B	1
204	1
205	1
206	1
207	1
228	1
229	1
364	1
118	1
119	1
18E	1
1DD	1
18F	1
259	1
190	1
25B	1
258	1
25A	1
25C	1
25D	1
25E	1
29A	1
264	1
46	1
66	1
2A9	1
191	1
192	1
47	1
67	1
11C	1
11D	1
11E	1
11F	1
120	1
121	1
122	1
123	1
1E6	1
1E7	1
1F4	1
1F5	1
261	1
262	1
1E4	1
1E5	1
193	1
260	1
29B	1
194	1
263	1
2E0	1
1A2	1
1A3	1
48	1
68	1
124	1
125	1
21E	1
21F	1
2B0	1
36A	1
29C	1
195	1
1F6	1
126	1
127	1
266	1
2B1	1
267	1
2BB	1
2BD	1
49	1
69	1
CC	1
CD	1
CE	1
CF	1
EC	1
ED	1
EE	1
EF	1
128	1
129	1
12A	1
12B	1
12C	1
12D	1
12E	1
12F	1
130	1
1CF	1
1D0	1
208	1
209	1
20A	1
20B	1
365	1
132	1
133	1
131	1
26A	1
197	1
268	1
196	1
269	1
4A	1
6A	1
134	1
135	1
1F0	1
2B2	1
29D	1
25F	1
284	1
4B	1
6B	1
136	1
137	1
1E8	1
1E9	1
198	1
199	1
29E	1
4C	1
6C	1
139	1
13A	1
13B	1
13C	1
13D	1
13E	1
2E1	1
13F	1
140	1
1C7	1
1C8	1
1C9	1
2AA	1
2AB	1
141	1
142	1
29F	1
19A	1
26B	1
26C	1
26D	1
234	1
26E	1
19B	1
28E	1
4D	1
6D	1
36B	1
271	1
4E	1
6E	1
D1	1
F1	1
145	1
146	1
147	1
148	1
1F8	1
1F9	1
1CA	1
1CB	1
1CC	1
143	1
144	1
274	1
19D	1
272	1
19E	1
220	1
273	1
235	1
14A	1
14B	1
4F	1
6F	1
BA	1
D2	1
D4	1
D5	1
D6	1
F2	1
F4	1
F5	1
F6	1
14C	1
14D	1
14E	1
14F	1
150	1
151	1
1A0	1
1A1	1
1D1	1
1D2	1
1EA	1
1EB	1
1EC	1
1ED	1
20C	1
20D	1
20E	1
20F	1
22A	1
22B	1
22C	1
22D	1
22E	1
22F	1
230	1
231	1
366	1
152	1
153	1
D3	1
F3	1
276	1
D8	1
F8	1
1FE	1
1FF	1
186	1
254	1
19F	1
275	1
277	1
222	1
223	1
50	1
70	1
1A4	1
1A5	1
278	1
51	1
71	1
2A0	1
138	1
52	1
72	1
154	1
155	1
156	1
157	1
158	1
159	1
210	1
211	1
212	1
213	1
2B3	1
36C	1
1A6	1
280	1
279	1
2B4	1
27A	1
27B	1
2B5	1
27C	1
27D	1
27E	1
27F	1
281	1
2B6	1
53	1
73	1
15C	1
15D	1
15E	1
15F	1
160	1
161	1
17F	1
218	1
219	1
2E2	1
DF	1
15A	1
15B	1
282	1
1A9	1
283	1
1AA	1
285	1
286	1
54	1
74	1
162	1
163	1
164	1
165	1
21A	1
21B	1
36D	1
2A8	1
1BE	1
2A6	1
2A7	1
166	1
167	1
1AB	1
1AC	1
1AD	1
1AE	1
288	1
236	1
287	1
55	1
75	1
D9	1
DA	1
DB	1
DC	1
F9	1
FA	1
FB	1
FC	1
168	1
169	1
16A	1
16B	1
16C	1
16D	1
16E	1
16F	1
170	1
171	1
172	1
173	1
1AF	1
1B0	1
1D3	1
1D4	1
1D5	1
1D6	1
1D7	1
1D8	1
1D9	1
1DA	1
1DB	1
1DC	1
214	1
215	1
216	1
217	1
367	1
289	1
265	1
2AE	1
2AF	1
19C	1
26F	1
270	1
1B1	1
28A	1
56	1
76	1
36E	1
1B2	1
28B	1
28C	1
57	1
77	1
174	1
175	1
2B7	1
28D	1
58	1
78	1
2E3	1
36F	1
59	1
79	1
DD	1
FD	1
FF	1
176	1
177	1
178	1
232	1
233	1
2B8	1
28F	1
1B3	1
1B4	1
5A	1
7A	1
17D	1
17E	1
18D	1
179	1
17A	1
17B	1
17C	1
1B5	1
1B6	1
224	1
225	1
290	1
291	1
1B7	1
1EE	1
1EF	1
292	1
1B8	1
1B9	1
1BA	1
293	1
21C	1
21D	1
DE	1
FE	1
1BF	1
1F7	1
1BB	1
1A7	1
1A8	1
1BC	1
1BD	1
184	1
185	1
294	1
2C0	1
2BC	1
149	1
2EE	1
2BE	1
295	1
2E4	1
2BF	1
2C1	1
2A1	1
2A2	1
296	1
1C0	1
1C1	1
1C2	1
1C3	1
297	1
298	1
2AC	1
2AD	1
386	1
391	1
3AC	1
3B1	1
392	1
3B2	1
3D0	1
393	1
3B3	1
394	1
3B4	1
388	1
395	1
3AD	1
3B5	1
3F5	1
3DC	1
3DD	1
3DA	1
3DB	1
396	1
3B6	1
389	1
397	1
3AE	1
3B7	1
398	1
3B8	1
3D1	1
3F4	1
37A	1
38A	1
390	1
399	1
3AA	1
3AF	1
3B9	1
3CA	1
3F3	1
39A	1
3BA	1
3F0	1
3D7	1
39B	1
3BB	1
B5	1
39C	1
3BC	1
39D	1
3BD	1
39E	1
3BE	1
38C	1
39F	1
3BF	1
3CC	1
3A0	1
3C0	1
3D6	1
3DE	1
3DF	1
3D8	1
3D9	1
3A1	1
3C1	1
3F1	1
3A3	1
3C2	1
3C3	1
3F2	1
3F9	1
3A4	1
3C4	1
38E	1
3A5	1
3AB	1
3B0	1
3C5	1
3CB	1
3CD	1
3D2	1
3D3	1
3D4	1
3A6	1
3C6	1
3D5	1
3A7	1
3C7	1
3A8	1
3C8	1
38F	1
3A9	1
3C9	1
3CE	1
3E0	1
3E1	1
3F7	1
3F8	1
3FA	1
3FB	1
3E2	1
3E3	1
3E4	1
3E5	1
3E6	1
3E7	1
3E8	1
3E9	1
3EA	1
3EB	1
3EC	1
3ED	1
3EE	1
3EF	1
410	1
430	1
4D0	1
4D1	1
4D2	1
4D3	1
4D8	1
4D9	1
4DA	1
4DB	1
4D4	1
4D5	1
411	1
431	1
412	1
432	1
413	1
433	1
490	1
491	1
492	1
493	1
494	1
495	1
414	1
434	1
500	1
501	1
402	1
452	1
502	1
503	1
403	1
453	1
498	1
499	1
400	1
401	1
415	1
435	1
450	1
451	1
4D6	1
4D7	1
404	1
454	1
416	1
436	1
4C1	1
4C2	1
4DC	1
4DD	1
496	1
497	1
417	1
437	1
504	1
505	1
4DE	1
4DF	1
405	1
455	1
4E0	1
4E1	1
506	1
507	1
40D	1
418	1
438	1
45D	1
4E2	1
4E3	1
48A	1
48B	1
4E4	1
4E5	1
406	1
456	1
407	1
457	1
419	1
439	1
408	1
458	1
41A	1
43A	1
49A	1
49B	1
4C3	1
4C4	1
4A0	1
4A1	1
49E	1
49F	1
49C	1
49D	1
41B	1
43B	1
4C5	1
4C6	1
409	1
459	1
508	1
509	1
41C	1
43C	1
4CD	1
4CE	1
41D	1
43D	1
4C9	1
4CA	1
4A2	1
4A3	1
4C7	1
4C8	1
4A4	1
4A5	1
40A	1
45A	1
50A	1
50B	1
41E	1
43E	1
4E6	1
4E7	1
4E8	1
4E9	1
4EA	1
4EB	1
41F	1
43F	1
4A6	1
4A7	1
480	1
481	1
420	1
440	1
48E	1
48F	1
421	1
441	1
50C	1
50D	1
4AA	1
4AB	1
422	1
442	1
50E	1
50F	1
4AC	1
4AD	1
40B	1
45B	1
40C	1
45C	1
423	1
443	1
4EE	1
4EF	1
40E	1
45E	1
4F0	1
4F1	1
4F2	1
4F3	1
4AE	1
4AF	1
4B0	1
4B1	1
478	1
479	1
424	1
444	1
425	1
445	1
4B2	1
4B3	1
4BA	1
4BB	1
460	1
461	1
47E	1
47F	1
47C	1
47D	1
47A	1
47B	1
426	1
446	1
4B4	1
4B5	1
427	1
447	1
4F4	1
4F5	1
4B6	1
4B7	1
4CB	1
4CC	1
4B8	1
4B9	1
4BC	1
4BD	1
4BE	1
4BF	1
40F	1
45F	1
428	1
448	1
429	1
449	1
42A	1
44A	1
42B	1
44B	1
4F8	1
4F9	1
42C	1
44C	1
48C	1
48D	1
462	1
463	1
42D	1
44D	1
4EC	1
4ED	1
42E	1
44E	1
42F	1
44F	1
464	1
465	1
466	1
467	1
46A	1
46B	1
468	1
469	1
46C	1
46D	1
46E	1
46F	1
470	1
471	1
472	1
473	1
474	1
475	1
476	1
477	1
4A8	1
4A9	1
4C0	1
531	1
561	1
532	1
562	1
533	1
563	1
534	1
564	1
535	1
565	1
587	1
536	1
566	1
537	1
567	1
538	1
568	1
539	1
569	1
53A	1
56A	1
53B	1
56B	1
53C	1
56C	1
53D	1
56D	1
53E	1
56E	1
53F	1
56F	1
540	1
570	1
541	1
571	1
542	1
572	1
543	1
573	1
544	1
574	1
545	1
575	1
546	1
576	1
547	1
577	1
548	1
578	1
549	1
579	1
54A	1
57A	1
54B	1
57B	1
54C	1
57C	1
54D	1
57D	1
54E	1
57E	1
54F	1
57F	1
550	1
580	1
551	1
581	1
552	1
582	1
553	1
583	1
554	1
584	1
555	1
585	1
556	1
586	1
559	1
5D0	1
5D1	1
5D2	1
5D3	1
5D4	1
5D5	1
5F0	1
5F1	1
5D6	1
5D7	1
5D8	1
5D9	1
5F2	1
5DA	1
5DB	1
5DC	1
5DD	1
5DE	1
5DF	1
5E0	1
5E1	1
5E2	1
5E3	1
5E4	1
5E5	1
5E6	1
5E7	1
5E8	1
5E9	1
5EA	1
621	1
674	1
6FD	1
622	1
623	1
672	1
671	1
624	1
625	1
673	1
626	1
627	1
675	1
66E	1
628	1
67B	1
67E	1
680	1
629	1
62A	1
62B	1
679	1
67A	1
67C	1
67D	1
67F	1
62C	1
683	1
684	1
686	1
6BF	1
687	1
62D	1
62E	1
681	1
682	1
685	1
62F	1
630	1
688	1
689	1
68A	1
68B	1
68C	1
68D	1
68E	1
68F	1
690	1
6EE	1
631	1
632	1
691	1
692	1
693	1
694	1
695	1
696	1
697	1
698	1
699	1
6EF	1
633	1
634	1
69A	1
69B	1
69C	1
6FA	1
635	1
636	1
69D	1
69E	1
6FB	1
637	1
638	1
69F	1
639	1
63A	1
6A0	1
6FC	1
641	1
6A1	1
6A2	1
6A3	1
6A4	1
6A5	1
6A6	1
66F	1
642	1
6A7	1
6A8	1
643	1
6A9	1
6AA	1
6AB	1
6AC	1
6AD	1
6AE	1
6AF	1
6B0	1
6B1	1
6B2	1
6B3	1
6B4	1
644	1
6B5	1
6B6	1
6B7	1
6B8	1
645	1
6FE	1
646	1
6BA	1
6BB	1
6BC	1
6BD	1
6B9	1
647	1
6BE	1
6C1	1
6C2	1
6C3	1
6FF	1
6C0	1
6D5	1
648	1
6E5	1
676	1
6C4	1
6C5	1
6C6	1
6C7	1
677	1
6C8	1
6C9	1
6CA	1
6CB	1
6CF	1
649	1
64A	1
6E6	1
678	1
6CC	1
6CD	1
6CE	1
6D0	1
6D1	1
6D2	1
6D3	1
710	1
712	1
72D	1
713	1
714	1
72E	1
716	1
715	1
72F	1
717	1
718	1
719	1
74D	1
71A	1
71B	1
71C	1
71D	1
71E	1
71F	1
74E	1
720	1
721	1
722	1
723	1
724	1
725	1
726	1
727	1
74F	1
728	1
729	1
72A	1
72B	1
72C	1
780	1
799	1
79A	1
781	1
782	1
783	1
79C	1
784	1
785	1
786	1
787	1
7A2	1
7A3	1
788	1
7A5	1
789	1
78A	1
78B	1
79B	1
78C	1
798	1
7A0	1
7A1	1
78D	1
78E	1
7A4	1
78F	1
790	1
79D	1
79E	1
79F	1
791	1
792	1
793	1
794	1
795	1
796	1
797	1
7B1	1
7A6	1
7A7	1
7A8	1
7A9	1
7AA	1
7AB	1
7AC	1
7AD	1
7AE	1
7AF	1
7B0	1
4E00	1
4E01	1
4E02	1
4E03	1
4E04	1
4E05	1
4E06	1
4E07	1
4E08	1
4E09	1
4E0A	1
4E0B	1
4E0C	1
4E0D	1
4E0E	1
4E0F	1
4E10	1
4E11	1
4E12	1
4E13	1
4E14	1
4E15	1
4E16	1
4E17	1
4E18	1
4E19	1
4E1A	1
4E1B	1
4E1C	1
4E1D	1
4E1E	1
4E1F	1
4E20	1
4E21	1
4E22	1
4E23	1
4E24	1
4E25	1
4E26	1
4E27	1
4E28	1
4E29	1
4E2A	1
4E2B	1
4E2C	1
4E2D	1
4E2E	1
4E2F	1
4E30	1
4E31	1
4E32	1
4E33	1
4E34	1
4E35	1
4E36	1
4E37	1
4E38	1
4E39	1
4E3A	1
4E3B	1
4E3C	1
4E3D	1
4E3E	1
4E3F	1
4E40	1
4E41	1
4E42	1
4E43	1
4E44	1
4E45	1
4E46	1
4E47	1
4E48	1
4E49	1
4E4A	1
4E4B	1
4E4C	1
4E4D	1
4E4E	1
4E4F	1
4E50	1
4E51	1
4E52	1
4E53	1
4E54	1
4E55	1
4E56	1
4E57	1
4E58	1
4E59	1
4E5A	1
4E5B	1
4E5C	1
4E5D	1
4E5E	1
4E5F	1
4E60	1
4E61	1
4E62	1
4E63	1
4E64	1
4E65	1
4E66	1
4E67	1
4E68	1
4E69	1
4E6A	1
4E6B	1
4E6C	1
4E6D	1
4E6E	1
4E6F	1
4E70	1
4E71	1
4E72	1
4E73	1
4E74	1
4E75	1
4E76	1
4E77	1
4E78	1
4E79	1
4E7A	1
4E7B	1
4E7C	1
4E7D	1
4E7E	1
4E7F	1
4E80	1
4E81	1
4E82	1
4E83	1
4E84	1
4E85	1
4E86	1
4E87	1
4E88	1
4E89	1
4E8A	1
4E8B	1
4E8C	1
4E8D	1
4E8E	1
4E8F	1
4E90	1
4E91	1
4E92	1
4E93	1
4E94	1
4E95	1
4E96	1
4E97	1
4E98	1
4E99	1
4E9A	1
4E9B	1
4E9C	1
4E9D	1
4E9E	1
4E9F	1
4EA0	1
4EA1	1
4EA2	1
4EA3	1
4EA4	1
4EA5	1
4EA6	1
4EA7	1
4EA8	1
4EA9	1
4EAA	1
4EAB	1
4EAC	1
4EAD	1
4EAE	1
4EAF	1
4EB0	1
4EB1	1
4EB2	1
4EB3	1
4EB4	1
4EB5	1
4EB6	1
4EB7	1
4EB8	1
4EB9	1
4EBA	1
4EBB	1
4EBC	1
4EBD	1
4EBE	1
4EBF	1
4EC0	1
4EC1	1
4EC2	1
4EC3	1
4EC4	1
4EC5	1
4EC6	1
4EC7	1
4EC8	1
4EC9	1
4ECA	1
4ECB	1
4ECC	1
4ECD	1
4ECE	1
4ECF	1
4ED0	1
4ED1	1
4ED2	1
4ED3	1
4ED4	1
4ED5	1
4ED6	1
4ED7	1
4ED8	1
4ED9	1
4EDA	1
4EDB	1
4EDC	1
4EDD	1
4EDE	1
4EDF	1
4EE0	1
4EE1	1
4EE2	1
4EE3	1
4EE4	1
4EE5	1
4EE6	1
4EE7	1
4EE8	1
4EE9	1
4EEA	1
4EEB	1
4EEC	1
4EED	1
4EEE	1
4EEF	1
4EF0	1
4EF1	1
4EF2	1
4EF3	1
4EF4	1
4EF5	1
4EF6	1
4EF7	1
4EF8	1
4EF9	1
4EFA	1
4EFB	1
4EFC	1
4EFD	1
4EFE	1
4EFF	1
4F00	1
4F01	1
4F02	1
4F03	1
4F04	1
4F05	1
4F06	1
4F07	1
4F08	1
4F09	1
4F0A	1
4F0B	1
4F0C	1
4F0D	1
4F0E	1
4F0F	1
4F10	1
4F11	1
4F12	1
4F13	1
4F14	1
4F15	1
4F16	1
4F17	1
4F18	1
4F19	1
4F1A	1
4F1B	1
4F1C	1
4F1D	1
4F1E	1
4F1F	1
4F20	1
4F21	1
4F22	1
4F23	1
4F24	1
4F25	1
4F26	1
4F27	1
4F28	1
4F29	1
4F2A	1
4F2B	1
4F2C	1
4F2D	1
4F2E	1
4F2F	1
4F30	1
4F31	1
4F32	1
4F33	1
4F34	1
4F35	1
4F36	1
4F37	1
4F38	1
4F39	1
4F3A	1
4F3B	1
4F3C	1
4F3D	1
4F3E	1
4F3F	1
4F40	1
4F41	1
4F42	1
4F43	1
4F44	1
4F45	1
4F46	1
4F47	1
4F48	1
4F49	1
4F4A	1
4F4B	1
4F4C	1
4F4D	1
4F4E	1
4F4F	1
4F50	1
4F51	1
4F52	1
4F53	1
4F54	1
4F55	1
4F56	1
4F57	1
4F58	1
4F59	1
4F5A	1
4F5B	1
4F5C	1
4F5D	1
4F5E	1
4F5F	1
4F60	1
4F61	1
4F62	1
4F63	1
4F64	1
4F65	1
4F66	1
4F67	1
4F68	1
4F69	1
4F6A	1
4F6B	1
4F6C	1
4F6D	1
4F6E	1
4F6F	1
4F70	1
4F71	1
4F72	1
4F73	1
4F74	1
4F75	1
4F76	1
4F77	1
4F78	1
4F79	1
4F7A	1
4F7B	1
4F7C	1
4F7D	1
4F7E	1
4F7F	1
4F80	1
4F81	1
4F82	1
4F83	1
4F84	1
4F85	1
4F86	1
4F87	1
4F88	1
4F89	1
4F8A	1
4F8B	1
4F8C	1
4F8D	1
4F8E	1
4F8F	1
4F90	1
4F91	1
4F92	1
4F93	1
4F94	1
4F95	1
4F96	1
4F97	1
4F98	1
4F99	1
4F9A	1
4F9B	1
4F9C	1
4F9D	1
4F9E	1
4F9F	1
4FA0	1
4FA1	1
4FA2	1
4FA3	1
4FA4	1
4FA5	1
4FA6	1
4FA7	1
4FA8	1
4FA9	1
4FAA	1
4FAB	1
4FAC	1
4FAD	1
4FAE	1
4FAF	1
4FB0	1
4FB1	1
4FB2	1
4FB3	1
4FB4	1
4FB5	1
4FB6	1
4FB7	1
4FB8	1
4FB9	1
4FBA	1
4FBB	1
4FBC	1
4FBD	1
4FBE	1
4FBF	1
4FC0	1
4FC1	1
4FC2	1
4FC3	1
4FC4	1
4FC5	1
4FC6	1
4FC7	1
4FC8	1
4FC9	1
4FCA	1
4FCB	1
4FCC	1
4FCD	1
4FCE	1
4FCF	1
4FD0	1
4FD1	1
4FD2	1
4FD3	1
4FD4	1
4FD5	1
4FD6	1
4FD7	1
4FD8	1
4FD9	1
4FDA	1
4FDB	1
4FDC	1
4FDD	1
4FDE	1
4FDF	1
4FE0	1
4FE1	1
4FE2	1
4FE3	1
4FE4	1
4FE5	1
4FE6	1
4FE7	1
4FE8	1
4FE9	1
4FEA	1
4FEB	1
4FEC	1
4FED	1
4FEE	1
4FEF	1
4FF0	1
4FF1	1
4FF2	1
4FF3	1
4FF4	1
4FF5	1
4FF6	1
4FF7	1
4FF8	1
4FF9	1
4FFA	1
4FFB	1
4FFC	1
4FFD	1
4FFE	1
4FFF	1
237	1
238	1
239	1
23A	1
23B	1
23C	1
23D	1
23E	1
23F	1
240	1
241	1
242	1
243	1
244	1
245	1
246	1
247	1
248	1
249	1
24A	1
24B	1
24C	1
24D	1
24E	1
24F	1
358	1
359	1
35A	1
35B	1
35C	1
370	1
371	1
372	1
373	1
376	1
377	1
378	1
379	1
37B	1
37C	1
37D	1
37F	1
380	1
381	1
382	1
383	1
38B	1
38D	1
3A2	1
3CF	1
3FC	1
3FD	1
3FE	1
3FF	1
487	1
4CF	1
4F6	1
4F7	1
4FA	1
4FB	1
4FC	1
4FD	1
4FE	1
4FF	1
510	1
511	1
512	1
513	1
514	1
515	1
516	1
517	1
518	1
519	1
51A	1
51B	1
51C	1
51D	1
51E	1
51F	1
520	1
521	1
522	1
523	1
524	1
525	1
526	1
527	1
528	1
529	1
52A	1
52B	1
52C	1
52D	1
52E	1
52F	1
530	1
557	1
558	1
560	1
588	1
58B	1
58C	1
58D	1
58E	1
58F	1
590	1
5A2	1
5BA	1
5C5	1
5C6	1
5C7	1
5C8	1
5C9	1
5CA	1
5CB	1
5CC	1
5CD	1
5CE	1
5CF	1
5EB	1
5EC	1
5ED	1
5EE	1
5EF	1
5F5	1
5F6	1
5F7	1
5F8	1
5F9	1
5FA	1
5FB	1
5FC	1
5FD	1
5FE	1
5FF	1
604	1
605	1
606	1
607	1
608	1
609	1
60A	1
60B	1
616	1
617	1
618	1
619	1
61A	1
61C	1
61D	1
61E	1
620	1
63B	1
63C	1
63D	1
63E	1
63F	1
659	1
65A	1
65B	1
65C	1
65D	1
65E	1
65F	1
70E	1
74B	1
74C	1
750	1
751	1
752	1
753	1
754	1
755	1
756	1
757	1
758	1
759	1
75A	1
75B	1
75C	1
75D	1
75E	1
75F	1
760	1
761	1
762	1
763	1
764	1
765	1
766	1
767	1
768	1
769	1
76A	1
76B	1
76C	1
76D	1
76E	1
76F	1
770	1
771	1
772	1
773	1
774	1
775	1
776	1
777	1
778	1
779	1
77A	1
77B	1
77C	1
77D	1
77E	1
77F	1
7B2	1
7B3	1
7B4	1
7B5	1
7B6	1
7B7	1
7B8	1
7B9	1
7BA	1
7BB	1
7BC	1
7BD	1
7BE	1
7BF	1
7C0	1
7C1	1
7C2	1
7C3	1
7C4	1
7C5	1
7C6	1
7C7	1
7C8	1
7C9	1
7CA	1
7CB	1
7CC	1
7CD	1
7CE	1
7CF	1
7D0	1
7D1	1
7D2	1
7D3	1
7D4	1
7D5	1
7D6	1
7D7	1
7D8	1
7D9	1
7DA	1
7DB	1
7DC	1
7DD	1
7DE	1
7DF	1
7E0	1
7E1	1
7E2	1
7E3	1
7E4	1
7E5	1
7E6	1
7E7	1
7E8	1
7E9	1
7EA	1
7EB	1
7EC	1
7ED	1
7EE	1
7EF	1
7F0	1
7F1	1
7F2	1
7F3	1
7F4	1
7F5	1
7F6	1
7F7	1
7F8	1
7F9	1
7FA	1
7FB	1
7FC	1
7FD	1
7FE	1
7FF	1
DROP TABLE IF EXISTS test.t1;
DROP TABLE IF EXISTS test.t1;
DROP DATABASE test;
CREATE DATABASE test CHARACTER SET utf8mb3;
USE test;
SET NAMES utf8mb3;
Warnings:
Warning	1287	'utf8mb3' is deprecated and will be removed in a future release. Please use utf8mb4 instead
CREATE TABLE test.t1 (a CHAR(4) CHARACTER SET utf8mb3) ENGINE=MyISAM CHARACTER SET utf8mb3;
Warnings:
Warning	1287	'utf8mb3' is deprecated and will be removed in a future release. Please use utf8mb4 instead
Warning	1287	'utf8mb3' is deprecated and will be removed in a future release. Please use utf8mb4 instead
SHOW TABLE STATUS LIKE 't1';
Name	Engine	Version	Row_format	Rows	Avg_row_length	Data_length	Max_data_length	Index_length	Data_free	Auto_increment	Create_time	Update_time	Check_time	Collation	Checksum	Create_options	Comment
t1	MyISAM	#	#	#	#	#	#	#	#	#	#	#	#	utf8mb3_general_ci	#	#	#
LOAD DATA INFILE 
'MYSQL_TEST_DIR/suite/funcs_2/data/charset_utf8.txt' INTO TABLE test.t1;
ALTER TABLE test.t1 CHANGE a a CHAR(4) CHARACTER SET ucs2 COLLATE ucs2_roman_ci;
Warnings:
Warning	1287	'ucs2' is deprecated and will be removed in a future release. Please use utf8mb4 instead
Warning	4079	'ucs2_roman_ci' is a collation of the deprecated character set ucs2. Please consider using utf8mb4 with an appropriate collation instead.
DELETE FROM test.t1 WHERE CHAR_LENGTH(a) <> 1;
SELECT HEX(ORD(a)) AS a_ord, CHAR_LENGTH(a) AS a_len FROM test.t1 ORDER BY a, ORD(a);
a_ord	a_len
85	1
7F	1
80	1
81	1
82	1
83	1
84	1
86	1
87	1
88	1
89	1
8A	1
8B	1
8C	1
8D	1
8E	1
8F	1
90	1
91	1
92	1
93	1
94	1
95	1
96	1
97	1
98	1
99	1
9A	1
9B	1
9C	1
9D	1
9E	1
9F	1
A0	1
300	1
301	1
302	1
303	1
304	1
305	1
306	1
307	1
308	1
309	1
30A	1
30B	1
30C	1
30D	1
30E	1
30F	1
310	1
311	1
312	1
313	1
314	1
315	1
316	1
317	1
318	1
319	1
31A	1
31B	1
31C	1
31D	1
31E	1
31F	1
320	1
321	1
322	1
323	1
324	1
325	1
326	1
327	1
328	1
329	1
32A	1
32B	1
32C	1
32D	1
32E	1
32F	1
330	1
331	1
332	1
333	1
334	1
335	1
336	1
337	1
338	1
339	1
33A	1
33B	1
33C	1
33D	1
33E	1
33F	1
340	1
341	1
342	1
343	1
344	1
345	1
346	1
347	1
348	1
349	1
34A	1
34B	1
34C	1
34D	1
34E	1
34F	1
350	1
351	1
352	1
353	1
354	1
355	1
356	1
357	1
35D	1
35E	1
35F	1
360	1
361	1
362	1
483	1
484	1
485	1
486	1
488	1
489	1
591	1
592	1
593	1
594	1
595	1
596	1
597	1
598	1
599	1
59A	1
59B	1
59C	1
59D	1
59E	1
59F	1
5A0	1
5A1	1
5A3	1
5A4	1
5A5	1
5A6	1
5A7	1
5A8	1
5A9	1
5AA	1
5AB	1
5AC	1
5AD	1
5AE	1
5AF	1
5B0	1
5B1	1
5B2	1
5B3	1
5B4	1
5B5	1
5B6	1
5B7	1
5B8	1
5B9	1
5BB	1
5BC	1
5BD	1
5BF	1
5C1	1
5C2	1
5C4	1
600	1
601	1
602	1
603	1
610	1
611	1
612	1
613	1
614	1
615	1
64B	1
64C	1
64D	1
64E	1
64F	1
650	1
651	1
652	1
653	1
654	1
655	1
656	1
657	1
658	1
670	1
6D6	1
6D7	1
6D8	1
6D9	1
6DA	1
6DB	1
6DC	1
6DD	1
6DE	1
6DF	1
6E0	1
6E1	1
6E2	1
6E3	1
6E4	1
6E7	1
6E8	1
6EA	1
6EB	1
6EC	1
6ED	1
70F	1
711	1
730	1
731	1
732	1
733	1
734	1
735	1
736	1
737	1
738	1
739	1
73A	1
73B	1
73C	1
73D	1
73E	1
73F	1
740	1
741	1
742	1
743	1
744	1
745	1
746	1
747	1
748	1
749	1
74A	1
640	1
60	1
B4	1
384	1
2DC	1
5E	1
AF	1
2D8	1
2D9	1
A8	1
385	1
2DA	1
2DD	1
B8	1
2DB	1
5F	1
AD	1
2D	1
58A	1
2C	1
55D	1
60C	1
60D	1
66B	1
66C	1
3B	1
37E	1
61B	1
3A	1
589	1
703	1
704	1
705	1
706	1
707	1
708	1
21	1
A1	1
55C	1
3F	1
BF	1
55E	1
61F	1
709	1
2E	1
6D4	1
701	1
702	1
B7	1
387	1
700	1
27	1
22	1
AB	1
BB	1
28	1
29	1
5B	1
7B	1
7D	1
A7	1
B6	1
A9	1
AE	1
40	1
2A	1
66D	1
2F	1
26	1
23	1
25	1
66A	1
55A	1
55B	1
55F	1
5BE	1
5C0	1
5C3	1
5F3	1
5F4	1
70A	1
70B	1
70C	1
70D	1
2B9	1
374	1
375	1
2BA	1
2C2	1
2C3	1
2C4	1
2C5	1
2C6	1
2C7	1
2C8	1
2C9	1
2CA	1
2CB	1
2CC	1
2CD	1
2CE	1
2CF	1
2D2	1
2D3	1
2D4	1
2D5	1
2D6	1
2D7	1
2DE	1
2DF	1
2E5	1
2E6	1
2E7	1
2E8	1
2E9	1
2EA	1
2EB	1
2EC	1
2ED	1
2EF	1
2F0	1
2F1	1
2F2	1
2F3	1
2F4	1
2F5	1
2F6	1
2F7	1
2F8	1
2F9	1
2FA	1
2FB	1
2FC	1
2FD	1
2FE	1
2FF	1
B0	1
482	1
60E	1
60F	1
6E9	1
3F6	1
2B	1
B1	1
F7	1
D7	1
3C	1
3D	1
3E	1
AC	1
7C	1
A6	1
7E	1
2D0	1
2D1	1
A4	1
A2	1
24	1
A3	1
A5	1
30	1
660	1
6F0	1
31	1
B9	1
661	1
6F1	1
BD	1
BC	1
32	1
B2	1
662	1
6F2	1
33	1
B3	1
663	1
6F3	1
BE	1
34	1
664	1
6F4	1
35	1
665	1
6F5	1
36	1
666	1
6F6	1
37	1
667	1
6F7	1
38	1
668	1
6F8	1
39	1
669	1
6F9	1
41	1
61	1
AA	1
C0	1
C1	1
C2	1
C3	1
C4	1
C5	1
E0	1
E1	1
E2	1
E3	1
E4	1
E5	1
100	1
101	1
102	1
103	1
104	1
105	1
1CD	1
1CE	1
1DE	1
1DF	1
1E0	1
1E1	1
1FA	1
1FB	1
200	1
201	1
202	1
203	1
226	1
227	1
363	1
C6	1
E6	1
1E2	1
1E3	1
1FC	1
1FD	1
250	1
251	1
252	1
42	1
62	1
299	1
180	1
181	1
253	1
182	1
183	1
43	1
63	1
C7	1
E7	1
106	1
107	1
108	1
109	1
10A	1
10B	1
10C	1
10D	1
368	1
187	1
188	1
255	1
44	1
64	1
10E	1
10F	1
369	1
1C4	1
1C5	1
1C6	1
1F1	1
1F2	1
1F3	1
2A3	1
2A5	1
2A4	1
110	1
111	1
189	1
256	1
18A	1
257	1
18B	1
18C	1
221	1
D0	1
F0	1
45	1
65	1
C8	1
C9	1
CA	1
CB	1
E8	1
E9	1
EA	1
EB	1
112	1
113	1
114	1
115	1
116	1
117	1
118	1
119	1
11A	1
11B	1
204	1
205	1
206	1
207	1
228	1
229	1
364	1
18E	1
1DD	1
18F	1
259	1
190	1
25B	1
258	1
25A	1
25C	1
25D	1
25E	1
29A	1
264	1
46	1
66	1
2A9	1
191	1
192	1
47	1
67	1
11C	1
11D	1
11E	1
11F	1
120	1
121	1
122	1
123	1
1E6	1
1E7	1
1F4	1
1F5	1
261	1
262	1
1E4	1
1E5	1
193	1
260	1
29B	1
194	1
263	1
2E0	1
1A2	1
1A3	1
48	1
68	1
124	1
125	1
21E	1
21F	1
2B0	1
36A	1
29C	1
195	1
1F6	1
126	1
127	1
266	1
2B1	1
267	1
2BB	1
2BD	1
49	1
4A	1
69	1
6A	1
CC	1
CD	1
CE	1
CF	1
EC	1
ED	1
EE	1
EF	1
128	1
129	1
12A	1
12B	1
12C	1
12D	1
12E	1
12F	1
130	1
1CF	1
1D0	1
208	1
209	1
20A	1
20B	1
365	1
132	1
133	1
131	1
26A	1
197	1
268	1
196	1
269	1
134	1
135	1
1F0	1
2B2	1
29D	1
25F	1
284	1
4B	1
6B	1
136	1
137	1
1E8	1
1E9	1
198	1
199	1
29E	1
4C	1
6C	1
139	1
13A	1
13B	1
13C	1
13D	1
13E	1
2E1	1
13F	1
140	1
1C7	1
1C8	1
1C9	1
2AA	1
2AB	1
29F	1
141	1
142	1
19A	1
26B	1
26C	1
26D	1
234	1
26E	1
19B	1
28E	1
4D	1
6D	1
36B	1
271	1
4E	1
6E	1
D1	1
F1	1
143	1
144	1
145	1
146	1
147	1
148	1
1F8	1
1F9	1
1CA	1
1CB	1
1CC	1
274	1
19D	1
272	1
19E	1
220	1
273	1
235	1
14A	1
14B	1
4F	1
6F	1
BA	1
D2	1
D3	1
D4	1
D5	1
D6	1
F2	1
F3	1
F4	1
F5	1
F6	1
14C	1
14D	1
14E	1
14F	1
150	1
151	1
1A0	1
1A1	1
1D1	1
1D2	1
1EA	1
1EB	1
1EC	1
1ED	1
20C	1
20D	1
20E	1
20F	1
22A	1
22B	1
22C	1
22D	1
22E	1
22F	1
230	1
231	1
366	1
152	1
153	1
276	1
D8	1
F8	1
1FE	1
1FF	1
186	1
254	1
19F	1
275	1
277	1
222	1
223	1
50	1
70	1
1A4	1
1A5	1
278	1
51	1
71	1
2A0	1
138	1
52	1
72	1
154	1
155	1
156	1
157	1
158	1
159	1
210	1
211	1
212	1
213	1
2B3	1
36C	1
1A6	1
280	1
279	1
2B4	1
27A	1
27B	1
2B5	1
27C	1
27D	1
27E	1
27F	1
281	1
2B6	1
53	1
73	1
15A	1
15B	1
15C	1
15D	1
15E	1
15F	1
160	1
161	1
17F	1
218	1
219	1
2E2	1
DF	1
282	1
1A9	1
283	1
1AA	1
285	1
286	1
54	1
74	1
162	1
163	1
164	1
165	1
21A	1
21B	1
36D	1
2A8	1
1BE	1
2A6	1
2A7	1
166	1
167	1
1AB	1
1AC	1
1AD	1
1AE	1
288	1
236	1
287	1
D9	1
DA	1
DB	1
DC	1
F9	1
FA	1
FB	1
FC	1
168	1
169	1
16A	1
16B	1
16C	1
16D	1
16E	1
16F	1
170	1
171	1
172	1
173	1
1AF	1
1B0	1
1D3	1
1D4	1
1D5	1
1D6	1
1D7	1
1D8	1
1D9	1
1DA	1
1DB	1
1DC	1
214	1
215	1
216	1
217	1
367	1
289	1
265	1
2AE	1
2AF	1
19C	1
26F	1
270	1
1B1	1
28A	1
55	1
56	1
75	1
76	1
36E	1
1B2	1
28B	1
28C	1
57	1
77	1
174	1
175	1
2B7	1
28D	1
58	1
78	1
2E3	1
36F	1
59	1
79	1
DD	1
FD	1
FF	1
176	1
177	1
178	1
232	1
233	1
2B8	1
28F	1
1B3	1
1B4	1
5A	1
7A	1
179	1
17A	1
17B	1
17C	1
17D	1
17E	1
18D	1
1B5	1
1B6	1
224	1
225	1
290	1
291	1
1B7	1
1EE	1
1EF	1
292	1
1B8	1
1B9	1
1BA	1
293	1
21C	1
21D	1
DE	1
FE	1
1BF	1
1F7	1
1BB	1
1A7	1
1A8	1
1BC	1
1BD	1
184	1
185	1
294	1
2C0	1
2BC	1
149	1
2EE	1
2BE	1
295	1
2E4	1
2BF	1
2C1	1
2A1	1
2A2	1
296	1
1C0	1
1C1	1
1C2	1
1C3	1
297	1
298	1
2AC	1
2AD	1
386	1
391	1
3AC	1
3B1	1
392	1
3B2	1
3D0	1
393	1
3B3	1
394	1
3B4	1
388	1
395	1
3AD	1
3B5	1
3F5	1
3DC	1
3DD	1
3DA	1
3DB	1
396	1
3B6	1
389	1
397	1
3AE	1
3B7	1
398	1
3B8	1
3D1	1
3F4	1
37A	1
38A	1
390	1
399	1
3AA	1
3AF	1
3B9	1
3CA	1
3F3	1
39A	1
3BA	1
3F0	1
3D7	1
39B	1
3BB	1
B5	1
39C	1
3BC	1
39D	1
3BD	1
39E	1
3BE	1
38C	1
39F	1
3BF	1
3CC	1
3A0	1
3C0	1
3D6	1
3DE	1
3DF	1
3D8	1
3D9	1
3A1	1
3C1	1
3F1	1
3A3	1
3C2	1
3C3	1
3F2	1
3F9	1
3A4	1
3C4	1
38E	1
3A5	1
3AB	1
3B0	1
3C5	1
3CB	1
3CD	1
3D2	1
3D3	1
3D4	1
3A6	1
3C6	1
3D5	1
3A7	1
3C7	1
3A8	1
3C8	1
38F	1
3A9	1
3C9	1
3CE	1
3E0	1
3E1	1
3F7	1
3F8	1
3FA	1
3FB	1
3E2	1
3E3	1
3E4	1
3E5	1
3E6	1
3E7	1
3E8	1
3E9	1
3EA	1
3EB	1
3EC	1
3ED	1
3EE	1
3EF	1
410	1
430	1
4D0	1
4D1	1
4D2	1
4D3	1
4D8	1
4D9	1
4DA	1
4DB	1
4D4	1
4D5	1
411	1
431	1
412	1
432	1
413	1
433	1
490	1
491	1
492	1
493	1
494	1
495	1
414	1
434	1
500	1
501	1
402	1
452	1
502	1
503	1
403	1
453	1
498	1
499	1
400	1
401	1
415	1
435	1
450	1
451	1
4D6	1
4D7	1
404	1
454	1
416	1
436	1
4C1	1
4C2	1
4DC	1
4DD	1
496	1
497	1
417	1
437	1
504	1
505	1
4DE	1
4DF	1
405	1
455	1
4E0	1
4E1	1
506	1
507	1
40D	1
418	1
438	1
45D	1
4E2	1
4E3	1
48A	1
48B	1
4E4	1
4E5	1
406	1
456	1
407	1
457	1
419	1
439	1
408	1
458	1
41A	1
43A	1
49A	1
49B	1
4C3	1
4C4	1
4A0	1
4A1	1
49E	1
49F	1
49C	1
49D	1
41B	1
43B	1
4C5	1
4C6	1
409	1
459	1
508	1
509	1
41C	1
43C	1
4CD	1
4CE	1
41D	1
43D	1
4C9	1
4CA	1
4A2	1
4A3	1
4C7	1
4C8	1
4A4	1
4A5	1
40A	1
45A	1
50A	1
50B	1
41E	1
43E	1
4E6	1
4E7	1
4E8	1
4E9	1
4EA	1
4EB	1
41F	1
43F	1
4A6	1
4A7	1
480	1
481	1
420	1
440	1
48E	1
48F	1
421	1
441	1
50C	1
50D	1
4AA	1
4AB	1
422	1
442	1
50E	1
50F	1
4AC	1
4AD	1
40B	1
45B	1
40C	1
45C	1
423	1
443	1
4EE	1
4EF	1
40E	1
45E	1
4F0	1
4F1	1
4F2	1
4F3	1
4AE	1
4AF	1
4B0	1
4B1	1
478	1
479	1
424	1
444	1
425	1
445	1
4B2	1
4B3	1
4BA	1
4BB	1
460	1
461	1
47E	1
47F	1
47C	1
47D	1
47A	1
47B	1
426	1
446	1
4B4	1
4B5	1
427	1
447	1
4F4	1
4F5	1
4B6	1
4B7	1
4CB	1
4CC	1
4B8	1
4B9	1
4BC	1
4BD	1
4BE	1
4BF	1
40F	1
45F	1
428	1
448	1
429	1
449	1
42A	1
44A	1
42B	1
44B	1
4F8	1
4F9	1
42C	1
44C	1
48C	1
48D	1
462	1
463	1
42D	1
44D	1
4EC	1
4ED	1
42E	1
44E	1
42F	1
44F	1
464	1
465	1
466	1
467	1
46A	1
46B	1
468	1
469	1
46C	1
46D	1
46E	1
46F	1
470	1
471	1
472	1
473	1
474	1
475	1
476	1
477	1
4A8	1
4A9	1
4C0	1
531	1
561	1
532	1
562	1
533	1
563	1
534	1
564	1
535	1
565	1
587	1
536	1
566	1
537	1
567	1
538	1
568	1
539	1
569	1
53A	1
56A	1
53B	1
56B	1
53C	1
56C	1
53D	1
56D	1
53E	1
56E	1
53F	1
56F	1
540	1
570	1
541	1
571	1
542	1
572	1
543	1
573	1
544	1
574	1
545	1
575	1
546	1
576	1
547	1
577	1
548	1
578	1
549	1
579	1
54A	1
57A	1
54B	1
57B	1
54C	1
57C	1
54D	1
57D	1
54E	1
57E	1
54F	1
57F	1
550	1
580	1
551	1
581	1
552	1
582	1
553	1
583	1
554	1
584	1
555	1
585	1
556	1
586	1
559	1
5D0	1
5D1	1
5D2	1
5D3	1
5D4	1
5D5	1
5F0	1
5F1	1
5D6	1
5D7	1
5D8	1
5D9	1
5F2	1
5DA	1
5DB	1
5DC	1
5DD	1
5DE	1
5DF	1
5E0	1
5E1	1
5E2	1
5E3	1
5E4	1
5E5	1
5E6	1
5E7	1
5E8	1
5E9	1
5EA	1
621	1
674	1
6FD	1
622	1
623	1
672	1
671	1
624	1
625	1
673	1
626	1
627	1
675	1
66E	1
628	1
67B	1
67E	1
680	1
629	1
62A	1
62B	1
679	1
67A	1
67C	1
67D	1
67F	1
62C	1
683	1
684	1
686	1
6BF	1
687	1
62D	1
62E	1
681	1
682	1
685	1
62F	1
630	1
688	1
689	1
68A	1
68B	1
68C	1
68D	1
68E	1
68F	1
690	1
6EE	1
631	1
632	1
691	1
692	1
693	1
694	1
695	1
696	1
697	1
698	1
699	1
6EF	1
633	1
634	1
69A	1
69B	1
69C	1
6FA	1
635	1
636	1
69D	1
69E	1
6FB	1
637	1
638	1
69F	1
639	1
63A	1
6A0	1
6FC	1
641	1
6A1	1
6A2	1
6A3	1
6A4	1
6A5	1
6A6	1
66F	1
642	1
6A7	1
6A8	1
643	1
6A9	1
6AA	1
6AB	1
6AC	1
6AD	1
6AE	1
6AF	1
6B0	1
6B1	1
6B2	1
6B3	1
6B4	1
644	1
6B5	1
6B6	1
6B7	1
6B8	1
645	1
6FE	1
646	1
6BA	1
6BB	1
6BC	1
6BD	1
6B9	1
647	1
6BE	1
6C1	1
6C2	1
6C3	1
6FF	1
6C0	1
6D5	1
648	1
6E5	1
676	1
6C4	1
6C5	1
6C6	1
6C7	1
677	1
6C8	1
6C9	1
6CA	1
6CB	1
6CF	1
649	1
64A	1
6E6	1
678	1
6CC	1
6CD	1
6CE	1
6D0	1
6D1	1
6D2	1
6D3	1
710	1
712	1
72D	1
713	1
714	1
72E	1
716	1
715	1
72F	1
717	1
718	1
719	1
74D	1
71A	1
71B	1
71C	1
71D	1
71E	1
71F	1
74E	1
720	1
721	1
722	1
723	1
724	1
725	1
726	1
727	1
74F	1
728	1
729	1
72A	1
72B	1
72C	1
780	1
799	1
79A	1
781	1
782	1
783	1
79C	1
784	1
785	1
786	1
787	1
7A2	1
7A3	1
788	1
7A5	1
789	1
78A	1
78B	1
79B	1
78C	1
798	1
7A0	1
7A1	1
78D	1
78E	1
7A4	1
78F	1
790	1
79D	1
79E	1
79F	1
791	1
792	1
793	1
794	1
795	1
796	1
797	1
7B1	1
7A6	1
7A7	1
7A8	1
7A9	1
7AA	1
7AB	1
7AC	1
7AD	1
7AE	1
7AF	1
7B0	1
4E00	1
4E01	1
4E02	1
4E03	1
4E04	1
4E05	1
4E06	1
4E07	1
4E08	1
4E09	1
4E0A	1
4E0B	1
4E0C	1
4E0D	1
4E0E	1
4E0F	1
4E10	1
4E11	1
4E12	1
4E13	1
4E14	1
4E15	1
4E16	1
4E17	1
4E18	1
4E19	1
4E1A	1
4E1B	1
4E1C	1
4E1D	1
4E1E	1
4E1F	1
4E20	1
4E21	1
4E22	1
4E23	1
4E24	1
4E25	1
4E26	1
4E27	1
4E28	1
4E29	1
4E2A	1
4E2B	1
4E2C	1
4E2D	1
4E2E	1
4E2F	1
4E30	1
4E31	1
4E32	1
4E33	1
4E34	1
4E35	1
4E36	1
4E37	1
4E38	1
4E39	1
4E3A	1
4E3B	1
4E3C	1
4E3D	1
4E3E	1
4E3F	1
4E40	1
4E41	1
4E42	1
4E43	1
4E44	1
4E45	1
4E46	1
4E47	1
4E48	1
4E49	1
4E4A	1
4E4B	1
4E4C	1
4E4D	1
4E4E	1
4E4F	1
4E50	1
4E51	1
4E52	1
4E53	1
4E54	1
4E55	1
4E56	1
4E57	1
4E58	1
4E59	1
4E5A	1
4E5B	1
4E5C	1
4E5D	1
4E5E	1
4E5F	1
4E60	1
4E61	1
4E62	1
4E63	1
4E64	1
4E65	1
4E66	1
4E67	1
4E68	1
4E69	1
4E6A	1
4E6B	1
4E6C	1
4E6D	1
4E6E	1
4E6F	1
4E70	1
4E71	1
4E72	1
4E73	1
4E74	1
4E75	1
4E76	1
4E77	1
4E78	1
4E79	1
4E7A	1
4E7B	1
4E7C	1
4E7D	1
4E7E	1
4E7F	1
4E80	1
4E81	1
4E82	1
4E83	1
4E84	1
4E85	1
4E86	1
4E87	1
4E88	1
4E89	1
4E8A	1
4E8B	1
4E8C	1
4E8D	1
4E8E	1
4E8F	1
4E90	1
4E91	1
4E92	1
4E93	1
4E94	1
4E95	1
4E96	1
4E97	1
4E98	1
4E99	1
4E9A	1
4E9B	1
4E9C	1
4E9D	1
4E9E	1
4E9F	1
4EA0	1
4EA1	1
4EA2	1
4EA3	1
4EA4	1
4EA5	1
4EA6	1
4EA7	1
4EA8	1
4EA9	1
4EAA	1
4EAB	1
4EAC	1
4EAD	1
4EAE	1
4EAF	1
4EB0	1
4EB1	1
4EB2	1
4EB3	1
4EB4	1
4EB5	1
4EB6	1
4EB7	1
4EB8	1
4EB9	1
4EBA	1
4EBB	1
4EBC	1
4EBD	1
4EBE	1
4EBF	1
4EC0	1
4EC1	1
4EC2	1
4EC3	1
4EC4	1
4EC5	1
4EC6	1
4EC7	1
4EC8	1
4EC9	1
4ECA	1
4ECB	1
4ECC	1
4ECD	1
4ECE	1
4ECF	1
4ED0	1
4ED1	1
4ED2	1
4ED3	1
4ED4	1
4ED5	1
4ED6	1
4ED7	1
4ED8	1
4ED9	1
4EDA	1
4EDB	1
4EDC	1
4EDD	1
4EDE	1
4EDF	1
4EE0	1
4EE1	1
4EE2	1
4EE3	1
4EE4	1
4EE5	1
4EE6	1
4EE7	1
4EE8	1
4EE9	1
4EEA	1
4EEB	1
4EEC	1
4EED	1
4EEE	1
4EEF	1
4EF0	1
4EF1	1
4EF2	1
4EF3	1
4EF4	1
4EF5	1
4EF6	1
4EF7	1
4EF8	1
4EF9	1
4EFA	1
4EFB	1
4EFC	1
4EFD	1
4EFE	1
4EFF	1
4F00	1
4F01	1
4F02	1
4F03	1
4F04	1
4F05	1
4F06	1
4F07	1
4F08	1
4F09	1
4F0A	1
4F0B	1
4F0C	1
4F0D	1
4F0E	1
4F0F	1
4F10	1
4F11	1
4F12	1
4F13	1
4F14	1
4F15	1
4F16	1
4F17	1
4F18	1
4F19	1
4F1A	1
4F1B	1
4F1C	1
4F1D	1
4F1E	1
4F1F	1
4F20	1
4F21	1
4F22	1
4F23	1
4F24	1
4F25	1
4F26	1
4F27	1
4F28	1
4F29	1
4F2A	1
4F2B	1
4F2C	1
4F2D	1
4F2E	1
4F2F	1
4F30	1
4F31	1
4F32	1
4F33	1
4F34	1
4F35	1
4F36	1
4F37	1
4F38	1
4F39	1
4F3A	1
4F3B	1
4F3C	1
4F3D	1
4F3E	1
4F3F	1
4F40	1
4F41	1
4F42	1
4F43	1
4F44	1
4F45	1
4F46	1
4F47	1
4F48	1
4F49	1
4F4A	1
4F4B	1
4F4C	1
4F4D	1
4F4E	1
4F4F	1
4F50	1
4F51	1
4F52	1
4F53	1
4F54	1
4F55	1
4F56	1
4F57	1
4F58	1
4F59	1
4F5A	1
4F5B	1
4F5C	1
4F5D	1
4F5E	1
4F5F	1
4F60	1
4F61	1
4F62	1
4F63	1
4F64	1
4F65	1
4F66	1
4F67	1
4F68	1
4F69	1
4F6A	1
4F6B	1
4F6C	1
4F6D	1
4F6E	1
4F6F	1
4F70	1
4F71	1
4F72	1
4F73	1
4F74	1
4F75	1
4F76	1
4F77	1
4F78	1
4F79	1
4F7A	1
4F7B	1
4F7C	1
4F7D	1
4F7E	1
4F7F	1
4F80	1
4F81	1
4F82	1
4F83	1
4F84	1
4F85	1
4F86	1
4F87	1
4F88	1
4F89	1
4F8A	1
4F8B	1
4F8C	1
4F8D	1
4F8E	1
4F8F	1
4F90	1
4F91	1
4F92	1
4F93	1
4F94	1
4F95	1
4F96	1
4F97	1
4F98	1
4F99	1
4F9A	1
4F9B	1
4F9C	1
4F9D	1
4F9E	1
4F9F	1
4FA0	1
4FA1	1
4FA2	1
4FA3	1
4FA4	1
4FA5	1
4FA6	1
4FA7	1
4FA8	1
4FA9	1
4FAA	1
4FAB	1
4FAC	1
4FAD	1
4FAE	1
4FAF	1
4FB0	1
4FB1	1
4FB2	1
4FB3	1
4FB4	1
4FB5	1
4FB6	1
4FB7	1
4FB8	1
4FB9	1
4FBA	1
4FBB	1
4FBC	1
4FBD	1
4FBE	1
4FBF	1
4FC0	1
4FC1	1
4FC2	1
4FC3	1
4FC4	1
4FC5	1
4FC6	1
4FC7	1
4FC8	1
4FC9	1
4FCA	1
4FCB	1
4FCC	1
4FCD	1
4FCE	1
4FCF	1
4FD0	1
4FD1	1
4FD2	1
4FD3	1
4FD4	1
4FD5	1
4FD6	1
4FD7	1
4FD8	1
4FD9	1
4FDA	1
4FDB	1
4FDC	1
4FDD	1
4FDE	1
4FDF	1
4FE0	1
4FE1	1
4FE2	1
4FE3	1
4FE4	1
4FE5	1
4FE6	1
4FE7	1
4FE8	1
4FE9	1
4FEA	1
4FEB	1
4FEC	1
4FED	1
4FEE	1
4FEF	1
4FF0	1
4FF1	1
4FF2	1
4FF3	1
4FF4	1
4FF5	1
4FF6	1
4FF7	1
4FF8	1
4FF9	1
4FFA	1
4FFB	1
4FFC	1
4FFD	1
4FFE	1
4FFF	1
237	1
238	1
239	1
23A	1
23B	1
23C	1
23D	1
23E	1
23F	1
240	1
241	1
242	1
243	1
244	1
245	1
246	1
247	1
248	1
249	1
24A	1
24B	1
24C	1
24D	1
24E	1
24F	1
358	1
359	1
35A	1
35B	1
35C	1
370	1
371	1
372	1
373	1
376	1
377	1
378	1
379	1
37B	1
37C	1
37D	1
37F	1
380	1
381	1
382	1
383	1
38B	1
38D	1
3A2	1
3CF	1
3FC	1
3FD	1
3FE	1
3FF	1
487	1
4CF	1
4F6	1
4F7	1
4FA	1
4FB	1
4FC	1
4FD	1
4FE	1
4FF	1
510	1
511	1
512	1
513	1
514	1
515	1
516	1
517	1
518	1
519	1
51A	1
51B	1
51C	1
51D	1
51E	1
51F	1
520	1
521	1
522	1
523	1
524	1
525	1
526	1
527	1
528	1
529	1
52A	1
52B	1
52C	1
52D	1
52E	1
52F	1
530	1
557	1
558	1
560	1
588	1
58B	1
58C	1
58D	1
58E	1
58F	1
590	1
5A2	1
5BA	1
5C5	1
5C6	1
5C7	1
5C8	1
5C9	1
5CA	1
5CB	1
5CC	1
5CD	1
5CE	1
5CF	1
5EB	1
5EC	1
5ED	1
5EE	1
5EF	1
5F5	1
5F6	1
5F7	1
5F8	1
5F9	1
5FA	1
5FB	1
5FC	1
5FD	1
5FE	1
5FF	1
604	1
605	1
606	1
607	1
608	1
609	1
60A	1
60B	1
616	1
617	1
618	1
619	1
61A	1
61C	1
61D	1
61E	1
620	1
63B	1
63C	1
63D	1
63E	1
63F	1
659	1
65A	1
65B	1
65C	1
65D	1
65E	1
65F	1
70E	1
74B	1
74C	1
750	1
751	1
752	1
753	1
754	1
755	1
756	1
757	1
758	1
759	1
75A	1
75B	1
75C	1
75D	1
75E	1
75F	1
760	1
761	1
762	1
763	1
764	1
765	1
766	1
767	1
768	1
769	1
76A	1
76B	1
76C	1
76D	1
76E	1
76F	1
770	1
771	1
772	1
773	1
774	1
775	1
776	1
777	1
778	1
779	1
77A	1
77B	1
77C	1
77D	1
77E	1
77F	1
7B2	1
7B3	1
7B4	1
7B5	1
7B6	1
7B7	1
7B8	1
7B9	1
7BA	1
7BB	1
7BC	1
7BD	1
7BE	1
7BF	1
7C0	1
7C1	1
7C2	1
7C3	1
7C4	1
7C5	1
7C6	1
7C7	1
7C8	1
7C9	1
7CA	1
7CB	1
7CC	1
7CD	1
7CE	1
7CF	1
7D0	1
7D1	1
7D2	1
7D3	1
7D4	1
7D5	1
7D6	1
7D7	1
7D8	1
7D9	1
7DA	1
7DB	1
7DC	1
7DD	1
7DE	1
7DF	1
7E0	1
7E1	1
7E2	1
7E3	1
7E4	1
7E5	1
7E6	1
7E7	1
7E8	1
7E9	1
7EA	1
7EB	1
7EC	1
7ED	1
7EE	1
7EF	1
7F0	1
7F1	1
7F2	1
7F3	1
7F4	1
7F5	1
7F6	1
7F7	1
7F8	1
7F9	1
7FA	1
7FB	1
7FC	1
7FD	1
7FE	1
7FF	1
DROP TABLE IF EXISTS test.t1;
DROP TABLE IF EXISTS test.t1;
DROP DATABASE test;
CREATE DATABASE test CHARACTER SET utf8mb3;
USE test;
SET NAMES utf8mb3;
Warnings:
Warning	1287	'utf8mb3' is deprecated and will be removed in a future release. Please use utf8mb4 instead
CREATE TABLE test.t1 (a CHAR(4) CHARACTER SET utf8mb3) ENGINE=MyISAM CHARACTER SET utf8mb3;
Warnings:
Warning	1287	'utf8mb3' is deprecated and will be removed in a future release. Please use utf8mb4 instead
Warning	1287	'utf8mb3' is deprecated and will be removed in a future release. Please use utf8mb4 instead
SHOW TABLE STATUS LIKE 't1';
Name	Engine	Version	Row_format	Rows	Avg_row_length	Data_length	Max_data_length	Index_length	Data_free	Auto_increment	Create_time	Update_time	Check_time	Collation	Checksum	Create_options	Comment
t1	MyISAM	#	#	#	#	#	#	#	#	#	#	#	#	utf8mb3_general_ci	#	#	#
LOAD DATA INFILE 
'MYSQL_TEST_DIR/suite/funcs_2/data/charset_utf8.txt' INTO TABLE test.t1;
ALTER TABLE test.t1 CHANGE a a CHAR(4) CHARACTER SET ucs2 COLLATE ucs2_romanian_ci;
Warnings:
Warning	1287	'ucs2' is deprecated and will be removed in a future release. Please use utf8mb4 instead
Warning	4079	'ucs2_romanian_ci' is a collation of the deprecated character set ucs2. Please consider using utf8mb4 with an appropriate collation instead.
DELETE FROM test.t1 WHERE CHAR_LENGTH(a) <> 1;
SELECT HEX(ORD(a)) AS a_ord, CHAR_LENGTH(a) AS a_len FROM test.t1 ORDER BY a, ORD(a);
a_ord	a_len
85	1
7F	1
80	1
81	1
82	1
83	1
84	1
86	1
87	1
88	1
89	1
8A	1
8B	1
8C	1
8D	1
8E	1
8F	1
90	1
91	1
92	1
93	1
94	1
95	1
96	1
97	1
98	1
99	1
9A	1
9B	1
9C	1
9D	1
9E	1
9F	1
A0	1
300	1
301	1
302	1
303	1
304	1
305	1
306	1
307	1
308	1
309	1
30A	1
30B	1
30C	1
30D	1
30E	1
30F	1
310	1
311	1
312	1
313	1
314	1
315	1
316	1
317	1
318	1
319	1
31A	1
31B	1
31C	1
31D	1
31E	1
31F	1
320	1
321	1
322	1
323	1
324	1
325	1
326	1
327	1
328	1
329	1
32A	1
32B	1
32C	1
32D	1
32E	1
32F	1
330	1
331	1
332	1
333	1
334	1
335	1
336	1
337	1
338	1
339	1
33A	1
33B	1
33C	1
33D	1
33E	1
33F	1
340	1
341	1
342	1
343	1
344	1
345	1
346	1
347	1
348	1
349	1
34A	1
34B	1
34C	1
34D	1
34E	1
34F	1
350	1
351	1
352	1
353	1
354	1
355	1
356	1
357	1
35D	1
35E	1
35F	1
360	1
361	1
362	1
483	1
484	1
485	1
486	1
488	1
489	1
591	1
592	1
593	1
594	1
595	1
596	1
597	1
598	1
599	1
59A	1
59B	1
59C	1
59D	1
59E	1
59F	1
5A0	1
5A1	1
5A3	1
5A4	1
5A5	1
5A6	1
5A7	1
5A8	1
5A9	1
5AA	1
5AB	1
5AC	1
5AD	1
5AE	1
5AF	1
5B0	1
5B1	1
5B2	1
5B3	1
5B4	1
5B5	1
5B6	1
5B7	1
5B8	1
5B9	1
5BB	1
5BC	1
5BD	1
5BF	1
5C1	1
5C2	1
5C4	1
600	1
601	1
602	1
603	1
610	1
611	1
612	1
613	1
614	1
615	1
64B	1
64C	1
64D	1
64E	1
64F	1
650	1
651	1
652	1
653	1
654	1
655	1
656	1
657	1
658	1
670	1
6D6	1
6D7	1
6D8	1
6D9	1
6DA	1
6DB	1
6DC	1
6DD	1
6DE	1
6DF	1
6E0	1
6E1	1
6E2	1
6E3	1
6E4	1
6E7	1
6E8	1
6EA	1
6EB	1
6EC	1
6ED	1
70F	1
711	1
730	1
731	1
732	1
733	1
734	1
735	1
736	1
737	1
738	1
739	1
73A	1
73B	1
73C	1
73D	1
73E	1
73F	1
740	1
741	1
742	1
743	1
744	1
745	1
746	1
747	1
748	1
749	1
74A	1
640	1
60	1
B4	1
384	1
2DC	1
5E	1
AF	1
2D8	1
2D9	1
A8	1
385	1
2DA	1
2DD	1
B8	1
2DB	1
5F	1
AD	1
2D	1
58A	1
2C	1
55D	1
60C	1
60D	1
66B	1
66C	1
3B	1
37E	1
61B	1
3A	1
589	1
703	1
704	1
705	1
706	1
707	1
708	1
21	1
A1	1
55C	1
3F	1
BF	1
55E	1
61F	1
709	1
2E	1
6D4	1
701	1
702	1
B7	1
387	1
700	1
27	1
22	1
AB	1
BB	1
28	1
29	1
5B	1
7B	1
7D	1
A7	1
B6	1
A9	1
AE	1
40	1
2A	1
66D	1
2F	1
26	1
23	1
25	1
66A	1
55A	1
55B	1
55F	1
5BE	1
5C0	1
5C3	1
5F3	1
5F4	1
70A	1
70B	1
70C	1
70D	1
2B9	1
374	1
375	1
2BA	1
2C2	1
2C3	1
2C4	1
2C5	1
2C6	1
2C7	1
2C8	1
2C9	1
2CA	1
2CB	1
2CC	1
2CD	1
2CE	1
2CF	1
2D2	1
2D3	1
2D4	1
2D5	1
2D6	1
2D7	1
2DE	1
2DF	1
2E5	1
2E6	1
2E7	1
2E8	1
2E9	1
2EA	1
2EB	1
2EC	1
2ED	1
2EF	1
2F0	1
2F1	1
2F2	1
2F3	1
2F4	1
2F5	1
2F6	1
2F7	1
2F8	1
2F9	1
2FA	1
2FB	1
2FC	1
2FD	1
2FE	1
2FF	1
B0	1
482	1
60E	1
60F	1
6E9	1
3F6	1
2B	1
B1	1
F7	1
D7	1
3C	1
3D	1
3E	1
AC	1
7C	1
A6	1
7E	1
2D0	1
2D1	1
A4	1
A2	1
24	1
A3	1
A5	1
30	1
660	1
6F0	1
31	1
B9	1
661	1
6F1	1
BD	1
BC	1
32	1
B2	1
662	1
6F2	1
33	1
B3	1
663	1
6F3	1
BE	1
34	1
664	1
6F4	1
35	1
665	1
6F5	1
36	1
666	1
6F6	1
37	1
667	1
6F7	1
38	1
668	1
6F8	1
39	1
669	1
6F9	1
41	1
61	1
AA	1
C0	1
C1	1
C3	1
C4	1
C5	1
E0	1
E1	1
E3	1
E4	1
E5	1
100	1
101	1
104	1
105	1
1CD	1
1CE	1
1DE	1
1DF	1
1E0	1
1E1	1
1FA	1
1FB	1
200	1
201	1
202	1
203	1
226	1
227	1
363	1
102	1
103	1
C2	1
E2	1
C6	1
E6	1
1E2	1
1E3	1
1FC	1
1FD	1
250	1
251	1
252	1
42	1
62	1
299	1
180	1
181	1
253	1
182	1
183	1
43	1
63	1
C7	1
E7	1
106	1
107	1
108	1
109	1
10A	1
10B	1
10C	1
10D	1
368	1
187	1
188	1
255	1
44	1
64	1
10E	1
10F	1
369	1
1C4	1
1C5	1
1C6	1
1F1	1
1F2	1
1F3	1
2A3	1
2A5	1
2A4	1
110	1
111	1
189	1
256	1
18A	1
257	1
18B	1
18C	1
221	1
D0	1
F0	1
45	1
65	1
C8	1
C9	1
CA	1
CB	1
E8	1
E9	1
EA	1
EB	1
112	1
113	1
114	1
115	1
116	1
117	1
118	1
119	1
11A	1
11B	1
204	1
205	1
206	1
207	1
228	1
229	1
364	1
18E	1
1DD	1
18F	1
259	1
190	1
25B	1
258	1
25A	1
25C	1
25D	1
25E	1
29A	1
264	1
46	1
66	1
2A9	1
191	1
192	1
47	1
67	1
11C	1
11D	1
11E	1
11F	1
120	1
121	1
122	1
123	1
1E6	1
1E7	1
1F4	1
1F5	1
261	1
262	1
1E4	1
1E5	1
193	1
260	1
29B	1
194	1
263	1
2E0	1
1A2	1
1A3	1
48	1
68	1
124	1
125	1
21E	1
21F	1
2B0	1
36A	1
29C	1
195	1
1F6	1
126	1
127	1
266	1
2B1	1
267	1
2BB	1
2BD	1
49	1
69	1
CC	1
CD	1
CF	1
EC	1
ED	1
EF	1
128	1
129	1
12A	1
12B	1
12C	1
12D	1
12E	1
12F	1
130	1
1CF	1
1D0	1
208	1
209	1
20A	1
20B	1
365	1
132	1
133	1
CE	1
EE	1
131	1
26A	1
197	1
268	1
196	1
269	1
4A	1
6A	1
134	1
135	1
1F0	1
2B2	1
29D	1
25F	1
284	1
4B	1
6B	1
136	1
137	1
1E8	1
1E9	1
198	1
199	1
29E	1
4C	1
6C	1
139	1
13A	1
13B	1
13C	1
13D	1
13E	1
2E1	1
13F	1
140	1
1C7	1
1C8	1
1C9	1
2AA	1
2AB	1
29F	1
141	1
142	1
19A	1
26B	1
26C	1
26D	1
234	1
26E	1
19B	1
28E	1
4D	1
6D	1
36B	1
271	1
4E	1
6E	1
D1	1
F1	1
143	1
144	1
145	1
146	1
147	1
148	1
1F8	1
1F9	1
1CA	1
1CB	1
1CC	1
274	1
19D	1
272	1
19E	1
220	1
273	1
235	1
14A	1
14B	1
4F	1
6F	1
BA	1
D2	1
D3	1
D4	1
D5	1
D6	1
F2	1
F3	1
F4	1
F5	1
F6	1
14C	1
14D	1
14E	1
14F	1
150	1
151	1
1A0	1
1A1	1
1D1	1
1D2	1
1EA	1
1EB	1
1EC	1
1ED	1
20C	1
20D	1
20E	1
20F	1
22A	1
22B	1
22C	1
22D	1
22E	1
22F	1
230	1
231	1
366	1
152	1
153	1
276	1
D8	1
F8	1
1FE	1
1FF	1
186	1
254	1
19F	1
275	1
277	1
222	1
223	1
50	1
70	1
1A4	1
1A5	1
278	1
51	1
71	1
2A0	1
138	1
52	1
72	1
154	1
155	1
156	1
157	1
158	1
159	1
210	1
211	1
212	1
213	1
2B3	1
36C	1
1A6	1
280	1
279	1
2B4	1
27A	1
27B	1
2B5	1
27C	1
27D	1
27E	1
27F	1
281	1
2B6	1
53	1
73	1
15A	1
15B	1
15C	1
15D	1
160	1
161	1
17F	1
2E2	1
DF	1
15E	1
15F	1
218	1
219	1
282	1
1A9	1
283	1
1AA	1
285	1
286	1
54	1
74	1
164	1
165	1
36D	1
2A8	1
1BE	1
2A6	1
2A7	1
162	1
163	1
21A	1
21B	1
166	1
167	1
1AB	1
1AC	1
1AD	1
1AE	1
288	1
236	1
287	1
55	1
75	1
D9	1
DA	1
DB	1
DC	1
F9	1
FA	1
FB	1
FC	1
168	1
169	1
16A	1
16B	1
16C	1
16D	1
16E	1
16F	1
170	1
171	1
172	1
173	1
1AF	1
1B0	1
1D3	1
1D4	1
1D5	1
1D6	1
1D7	1
1D8	1
1D9	1
1DA	1
1DB	1
1DC	1
214	1
215	1
216	1
217	1
367	1
289	1
265	1
2AE	1
2AF	1
19C	1
26F	1
270	1
1B1	1
28A	1
56	1
76	1
36E	1
1B2	1
28B	1
28C	1
57	1
77	1
174	1
175	1
2B7	1
28D	1
58	1
78	1
2E3	1
36F	1
59	1
79	1
DD	1
FD	1
FF	1
176	1
177	1
178	1
232	1
233	1
2B8	1
28F	1
1B3	1
1B4	1
5A	1
7A	1
179	1
17A	1
17B	1
17C	1
17D	1
17E	1
18D	1
1B5	1
1B6	1
224	1
225	1
290	1
291	1
1B7	1
1EE	1
1EF	1
292	1
1B8	1
1B9	1
1BA	1
293	1
21C	1
21D	1
DE	1
FE	1
1BF	1
1F7	1
1BB	1
1A7	1
1A8	1
1BC	1
1BD	1
184	1
185	1
294	1
2C0	1
2BC	1
149	1
2EE	1
2BE	1
295	1
2E4	1
2BF	1
2C1	1
2A1	1
2A2	1
296	1
1C0	1
1C1	1
1C2	1
1C3	1
297	1
298	1
2AC	1
2AD	1
386	1
391	1
3AC	1
3B1	1
392	1
3B2	1
3D0	1
393	1
3B3	1
394	1
3B4	1
388	1
395	1
3AD	1
3B5	1
3F5	1
3DC	1
3DD	1
3DA	1
3DB	1
396	1
3B6	1
389	1
397	1
3AE	1
3B7	1
398	1
3B8	1
3D1	1
3F4	1
37A	1
38A	1
390	1
399	1
3AA	1
3AF	1
3B9	1
3CA	1
3F3	1
39A	1
3BA	1
3F0	1
3D7	1
39B	1
3BB	1
B5	1
39C	1
3BC	1
39D	1
3BD	1
39E	1
3BE	1
38C	1
39F	1
3BF	1
3CC	1
3A0	1
3C0	1
3D6	1
3DE	1
3DF	1
3D8	1
3D9	1
3A1	1
3C1	1
3F1	1
3A3	1
3C2	1
3C3	1
3F2	1
3F9	1
3A4	1
3C4	1
38E	1
3A5	1
3AB	1
3B0	1
3C5	1
3CB	1
3CD	1
3D2	1
3D3	1
3D4	1
3A6	1
3C6	1
3D5	1
3A7	1
3C7	1
3A8	1
3C8	1
38F	1
3A9	1
3C9	1
3CE	1
3E0	1
3E1	1
3F7	1
3F8	1
3FA	1
3FB	1
3E2	1
3E3	1
3E4	1
3E5	1
3E6	1
3E7	1
3E8	1
3E9	1
3EA	1
3EB	1
3EC	1
3ED	1
3EE	1
3EF	1
410	1
430	1
4D0	1
4D1	1
4D2	1
4D3	1
4D8	1
4D9	1
4DA	1
4DB	1
4D4	1
4D5	1
411	1
431	1
412	1
432	1
413	1
433	1
490	1
491	1
492	1
493	1
494	1
495	1
414	1
434	1
500	1
501	1
402	1
452	1
502	1
503	1
403	1
453	1
498	1
499	1
400	1
401	1
415	1
435	1
450	1
451	1
4D6	1
4D7	1
404	1
454	1
416	1
436	1
4C1	1
4C2	1
4DC	1
4DD	1
496	1
497	1
417	1
437	1
504	1
505	1
4DE	1
4DF	1
405	1
455	1
4E0	1
4E1	1
506	1
507	1
40D	1
418	1
438	1
45D	1
4E2	1
4E3	1
48A	1
48B	1
4E4	1
4E5	1
406	1
456	1
407	1
457	1
419	1
439	1
408	1
458	1
41A	1
43A	1
49A	1
49B	1
4C3	1
4C4	1
4A0	1
4A1	1
49E	1
49F	1
49C	1
49D	1
41B	1
43B	1
4C5	1
4C6	1
409	1
459	1
508	1
509	1
41C	1
43C	1
4CD	1
4CE	1
41D	1
43D	1
4C9	1
4CA	1
4A2	1
4A3	1
4C7	1
4C8	1
4A4	1
4A5	1
40A	1
45A	1
50A	1
50B	1
41E	1
43E	1
4E6	1
4E7	1
4E8	1
4E9	1
4EA	1
4EB	1
41F	1
43F	1
4A6	1
4A7	1
480	1
481	1
420	1
440	1
48E	1
48F	1
421	1
441	1
50C	1
50D	1
4AA	1
4AB	1
422	1
442	1
50E	1
50F	1
4AC	1
4AD	1
40B	1
45B	1
40C	1
45C	1
423	1
443	1
4EE	1
4EF	1
40E	1
45E	1
4F0	1
4F1	1
4F2	1
4F3	1
4AE	1
4AF	1
4B0	1
4B1	1
478	1
479	1
424	1
444	1
425	1
445	1
4B2	1
4B3	1
4BA	1
4BB	1
460	1
461	1
47E	1
47F	1
47C	1
47D	1
47A	1
47B	1
426	1
446	1
4B4	1
4B5	1
427	1
447	1
4F4	1
4F5	1
4B6	1
4B7	1
4CB	1
4CC	1
4B8	1
4B9	1
4BC	1
4BD	1
4BE	1
4BF	1
40F	1
45F	1
428	1
448	1
429	1
449	1
42A	1
44A	1
42B	1
44B	1
4F8	1
4F9	1
42C	1
44C	1
48C	1
48D	1
462	1
463	1
42D	1
44D	1
4EC	1
4ED	1
42E	1
44E	1
42F	1
44F	1
464	1
465	1
466	1
467	1
46A	1
46B	1
468	1
469	1
46C	1
46D	1
46E	1
46F	1
470	1
471	1
472	1
473	1
474	1
475	1
476	1
477	1
4A8	1
4A9	1
4C0	1
531	1
561	1
532	1
562	1
533	1
563	1
534	1
564	1
535	1
565	1
587	1
536	1
566	1
537	1
567	1
538	1
568	1
539	1
569	1
53A	1
56A	1
53B	1
56B	1
53C	1
56C	1
53D	1
56D	1
53E	1
56E	1
53F	1
56F	1
540	1
570	1
541	1
571	1
542	1
572	1
543	1
573	1
544	1
574	1
545	1
575	1
546	1
576	1
547	1
577	1
548	1
578	1
549	1
579	1
54A	1
57A	1
54B	1
57B	1
54C	1
57C	1
54D	1
57D	1
54E	1
57E	1
54F	1
57F	1
550	1
580	1
551	1
581	1
552	1
582	1
553	1
583	1
554	1
584	1
555	1
585	1
556	1
586	1
559	1
5D0	1
5D1	1
5D2	1
5D3	1
5D4	1
5D5	1
5F0	1
5F1	1
5D6	1
5D7	1
5D8	1
5D9	1
5F2	1
5DA	1
5DB	1
5DC	1
5DD	1
5DE	1
5DF	1
5E0	1
5E1	1
5E2	1
5E3	1
5E4	1
5E5	1
5E6	1
5E7	1
5E8	1
5E9	1
5EA	1
621	1
674	1
6FD	1
622	1
623	1
672	1
671	1
624	1
625	1
673	1
626	1
627	1
675	1
66E	1
628	1
67B	1
67E	1
680	1
629	1
62A	1
62B	1
679	1
67A	1
67C	1
67D	1
67F	1
62C	1
683	1
684	1
686	1
6BF	1
687	1
62D	1
62E	1
681	1
682	1
685	1
62F	1
630	1
688	1
689	1
68A	1
68B	1
68C	1
68D	1
68E	1
68F	1
690	1
6EE	1
631	1
632	1
691	1
692	1
693	1
694	1
695	1
696	1
697	1
698	1
699	1
6EF	1
633	1
634	1
69A	1
69B	1
69C	1
6FA	1
635	1
636	1
69D	1
69E	1
6FB	1
637	1
638	1
69F	1
639	1
63A	1
6A0	1
6FC	1
641	1
6A1	1
6A2	1
6A3	1
6A4	1
6A5	1
6A6	1
66F	1
642	1
6A7	1
6A8	1
643	1
6A9	1
6AA	1
6AB	1
6AC	1
6AD	1
6AE	1
6AF	1
6B0	1
6B1	1
6B2	1
6B3	1
6B4	1
644	1
6B5	1
6B6	1
6B7	1
6B8	1
645	1
6FE	1
646	1
6BA	1
6BB	1
6BC	1
6BD	1
6B9	1
647	1
6BE	1
6C1	1
6C2	1
6C3	1
6FF	1
6C0	1
6D5	1
648	1
6E5	1
676	1
6C4	1
6C5	1
6C6	1
6C7	1
677	1
6C8	1
6C9	1
6CA	1
6CB	1
6CF	1
649	1
64A	1
6E6	1
678	1
6CC	1
6CD	1
6CE	1
6D0	1
6D1	1
6D2	1
6D3	1
710	1
712	1
72D	1
713	1
714	1
72E	1
716	1
715	1
72F	1
717	1
718	1
719	1
74D	1
71A	1
71B	1
71C	1
71D	1
71E	1
71F	1
74E	1
720	1
721	1
722	1
723	1
724	1
725	1
726	1
727	1
74F	1
728	1
729	1
72A	1
72B	1
72C	1
780	1
799	1
79A	1
781	1
782	1
783	1
79C	1
784	1
785	1
786	1
787	1
7A2	1
7A3	1
788	1
7A5	1
789	1
78A	1
78B	1
79B	1
78C	1
798	1
7A0	1
7A1	1
78D	1
78E	1
7A4	1
78F	1
790	1
79D	1
79E	1
79F	1
791	1
792	1
793	1
794	1
795	1
796	1
797	1
7B1	1
7A6	1
7A7	1
7A8	1
7A9	1
7AA	1
7AB	1
7AC	1
7AD	1
7AE	1
7AF	1
7B0	1
4E00	1
4E01	1
4E02	1
4E03	1
4E04	1
4E05	1
4E06	1
4E07	1
4E08	1
4E09	1
4E0A	1
4E0B	1
4E0C	1
4E0D	1
4E0E	1
4E0F	1
4E10	1
4E11	1
4E12	1
4E13	1
4E14	1
4E15	1
4E16	1
4E17	1
4E18	1
4E19	1
4E1A	1
4E1B	1
4E1C	1
4E1D	1
4E1E	1
4E1F	1
4E20	1
4E21	1
4E22	1
4E23	1
4E24	1
4E25	1
4E26	1
4E27	1
4E28	1
4E29	1
4E2A	1
4E2B	1
4E2C	1
4E2D	1
4E2E	1
4E2F	1
4E30	1
4E31	1
4E32	1
4E33	1
4E34	1
4E35	1
4E36	1
4E37	1
4E38	1
4E39	1
4E3A	1
4E3B	1
4E3C	1
4E3D	1
4E3E	1
4E3F	1
4E40	1
4E41	1
4E42	1
4E43	1
4E44	1
4E45	1
4E46	1
4E47	1
4E48	1
4E49	1
4E4A	1
4E4B	1
4E4C	1
4E4D	1
4E4E	1
4E4F	1
4E50	1
4E51	1
4E52	1
4E53	1
4E54	1
4E55	1
4E56	1
4E57	1
4E58	1
4E59	1
4E5A	1
4E5B	1
4E5C	1
4E5D	1
4E5E	1
4E5F	1
4E60	1
4E61	1
4E62	1
4E63	1
4E64	1
4E65	1
4E66	1
4E67	1
4E68	1
4E69	1
4E6A	1
4E6B	1
4E6C	1
4E6D	1
4E6E	1
4E6F	1
4E70	1
4E71	1
4E72	1
4E73	1
4E74	1
4E75	1
4E76	1
4E77	1
4E78	1
4E79	1
4E7A	1
4E7B	1
4E7C	1
4E7D	1
4E7E	1
4E7F	1
4E80	1
4E81	1
4E82	1
4E83	1
4E84	1
4E85	1
4E86	1
4E87	1
4E88	1
4E89	1
4E8A	1
4E8B	1
4E8C	1
4E8D	1
4E8E	1
4E8F	1
4E90	1
4E91	1
4E92	1
4E93	1
4E94	1
4E95	1
4E96	1
4E97	1
4E98	1
4E99	1
4E9A	1
4E9B	1
4E9C	1
4E9D	1
4E9E	1
4E9F	1
4EA0	1
4EA1	1
4EA2	1
4EA3	1
4EA4	1
4EA5	1
4EA6	1
4EA7	1
4EA8	1
4EA9	1
4EAA	1
4EAB	1
4EAC	1
4EAD	1
4EAE	1
4EAF	1
4EB0	1
4EB1	1
4EB2	1
4EB3	1
4EB4	1
4EB5	1
4EB6	1
4EB7	1
4EB8	1
4EB9	1
4EBA	1
4EBB	1
4EBC	1
4EBD	1
4EBE	1
4EBF	1
4EC0	1
4EC1	1
4EC2	1
4EC3	1
4EC4	1
4EC5	1
4EC6	1
4EC7	1
4EC8	1
4EC9	1
4ECA	1
4ECB	1
4ECC	1
4ECD	1
4ECE	1
4ECF	1
4ED0	1
4ED1	1
4ED2	1
4ED3	1
4ED4	1
4ED5	1
4ED6	1
4ED7	1
4ED8	1
4ED9	1
4EDA	1
4EDB	1
4EDC	1
4EDD	1
4EDE	1
4EDF	1
4EE0	1
4EE1	1
4EE2	1
4EE3	1
4EE4	1
4EE5	1
4EE6	1
4EE7	1
4EE8	1
4EE9	1
4EEA	1
4EEB	1
4EEC	1
4EED	1
4EEE	1
4EEF	1
4EF0	1
4EF1	1
4EF2	1
4EF3	1
4EF4	1
4EF5	1
4EF6	1
4EF7	1
4EF8	1
4EF9	1
4EFA	1
4EFB	1
4EFC	1
4EFD	1
4EFE	1
4EFF	1
4F00	1
4F01	1
4F02	1
4F03	1
4F04	1
4F05	1
4F06	1
4F07	1
4F08	1
4F09	1
4F0A	1
4F0B	1
4F0C	1
4F0D	1
4F0E	1
4F0F	1
4F10	1
4F11	1
4F12	1
4F13	1
4F14	1
4F15	1
4F16	1
4F17	1
4F18	1
4F19	1
4F1A	1
4F1B	1
4F1C	1
4F1D	1
4F1E	1
4F1F	1
4F20	1
4F21	1
4F22	1
4F23	1
4F24	1
4F25	1
4F26	1
4F27	1
4F28	1
4F29	1
4F2A	1
4F2B	1
4F2C	1
4F2D	1
4F2E	1
4F2F	1
4F30	1
4F31	1
4F32	1
4F33	1
4F34	1
4F35	1
4F36	1
4F37	1
4F38	1
4F39	1
4F3A	1
4F3B	1
4F3C	1
4F3D	1
4F3E	1
4F3F	1
4F40	1
4F41	1
4F42	1
4F43	1
4F44	1
4F45	1
4F46	1
4F47	1
4F48	1
4F49	1
4F4A	1
4F4B	1
4F4C	1
4F4D	1
4F4E	1
4F4F	1
4F50	1
4F51	1
4F52	1
4F53	1
4F54	1
4F55	1
4F56	1
4F57	1
4F58	1
4F59	1
4F5A	1
4F5B	1
4F5C	1
4F5D	1
4F5E	1
4F5F	1
4F60	1
4F61	1
4F62	1
4F63	1
4F64	1
4F65	1
4F66	1
4F67	1
4F68	1
4F69	1
4F6A	1
4F6B	1
4F6C	1
4F6D	1
4F6E	1
4F6F	1
4F70	1
4F71	1
4F72	1
4F73	1
4F74	1
4F75	1
4F76	1
4F77	1
4F78	1
4F79	1
4F7A	1
4F7B	1
4F7C	1
4F7D	1
4F7E	1
4F7F	1
4F80	1
4F81	1
4F82	1
4F83	1
4F84	1
4F85	1
4F86	1
4F87	1
4F88	1
4F89	1
4F8A	1
4F8B	1
4F8C	1
4F8D	1
4F8E	1
4F8F	1
4F90	1
4F91	1
4F92	1
4F93	1
4F94	1
4F95	1
4F96	1
4F97	1
4F98	1
4F99	1
4F9A	1
4F9B	1
4F9C	1
4F9D	1
4F9E	1
4F9F	1
4FA0	1
4FA1	1
4FA2	1
4FA3	1
4FA4	1
4FA5	1
4FA6	1
4FA7	1
4FA8	1
4FA9	1
4FAA	1
4FAB	1
4FAC	1
4FAD	1
4FAE	1
4FAF	1
4FB0	1
4FB1	1
4FB2	1
4FB3	1
4FB4	1
4FB5	1
4FB6	1
4FB7	1
4FB8	1
4FB9	1
4FBA	1
4FBB	1
4FBC	1
4FBD	1
4FBE	1
4FBF	1
4FC0	1
4FC1	1
4FC2	1
4FC3	1
4FC4	1
4FC5	1
4FC6	1
4FC7	1
4FC8	1
4FC9	1
4FCA	1
4FCB	1
4FCC	1
4FCD	1
4FCE	1
4FCF	1
4FD0	1
4FD1	1
4FD2	1
4FD3	1
4FD4	1
4FD5	1
4FD6	1
4FD7	1
4FD8	1
4FD9	1
4FDA	1
4FDB	1
4FDC	1
4FDD	1
4FDE	1
4FDF	1
4FE0	1
4FE1	1
4FE2	1
4FE3	1
4FE4	1
4FE5	1
4FE6	1
4FE7	1
4FE8	1
4FE9	1
4FEA	1
4FEB	1
4FEC	1
4FED	1
4FEE	1
4FEF	1
4FF0	1
4FF1	1
4FF2	1
4FF3	1
4FF4	1
4FF5	1
4FF6	1
4FF7	1
4FF8	1
4FF9	1
4FFA	1
4FFB	1
4FFC	1
4FFD	1
4FFE	1
4FFF	1
237	1
238	1
239	1
23A	1
23B	1
23C	1
23D	1
23E	1
23F	1
240	1
241	1
242	1
243	1
244	1
245	1
246	1
247	1
248	1
249	1
24A	1
24B	1
24C	1
24D	1
24E	1
24F	1
358	1
359	1
35A	1
35B	1
35C	1
370	1
371	1
372	1
373	1
376	1
377	1
378	1
379	1
37B	1
37C	1
37D	1
37F	1
380	1
381	1
382	1
383	1
38B	1
38D	1
3A2	1
3CF	1
3FC	1
3FD	1
3FE	1
3FF	1
487	1
4CF	1
4F6	1
4F7	1
4FA	1
4FB	1
4FC	1
4FD	1
4FE	1
4FF	1
510	1
511	1
512	1
513	1
514	1
515	1
516	1
517	1
518	1
519	1
51A	1
51B	1
51C	1
51D	1
51E	1
51F	1
520	1
521	1
522	1
523	1
524	1
525	1
526	1
527	1
528	1
529	1
52A	1
52B	1
52C	1
52D	1
52E	1
52F	1
530	1
557	1
558	1
560	1
588	1
58B	1
58C	1
58D	1
58E	1
58F	1
590	1
5A2	1
5BA	1
5C5	1
5C6	1
5C7	1
5C8	1
5C9	1
5CA	1
5CB	1
5CC	1
5CD	1
5CE	1
5CF	1
5EB	1
5EC	1
5ED	1
5EE	1
5EF	1
5F5	1
5F6	1
5F7	1
5F8	1
5F9	1
5FA	1
5FB	1
5FC	1
5FD	1
5FE	1
5FF	1
604	1
605	1
606	1
607	1
608	1
609	1
60A	1
60B	1
616	1
617	1
618	1
619	1
61A	1
61C	1
61D	1
61E	1
620	1
63B	1
63C	1
63D	1
63E	1
63F	1
659	1
65A	1
65B	1
65C	1
65D	1
65E	1
65F	1
70E	1
74B	1
74C	1
750	1
751	1
752	1
753	1
754	1
755	1
756	1
757	1
758	1
759	1
75A	1
75B	1
75C	1
75D	1
75E	1
75F	1
760	1
761	1
762	1
763	1
764	1
765	1
766	1
767	1
768	1
769	1
76A	1
76B	1
76C	1
76D	1
76E	1
76F	1
770	1
771	1
772	1
773	1
774	1
775	1
776	1
777	1
778	1
779	1
77A	1
77B	1
77C	1
77D	1
77E	1
77F	1
7B2	1
7B3	1
7B4	1
7B5	1
7B6	1
7B7	1
7B8	1
7B9	1
7BA	1
7BB	1
7BC	1
7BD	1
7BE	1
7BF	1
7C0	1
7C1	1
7C2	1
7C3	1
7C4	1
7C5	1
7C6	1
7C7	1
7C8	1
7C9	1
7CA	1
7CB	1
7CC	1
7CD	1
7CE	1
7CF	1
7D0	1
7D1	1
7D2	1
7D3	1
7D4	1
7D5	1
7D6	1
7D7	1
7D8	1
7D9	1
7DA	1
7DB	1
7DC	1
7DD	1
7DE	1
7DF	1
7E0	1
7E1	1
7E2	1
7E3	1
7E4	1
7E5	1
7E6	1
7E7	1
7E8	1
7E9	1
7EA	1
7EB	1
7EC	1
7ED	1
7EE	1
7EF	1
7F0	1
7F1	1
7F2	1
7F3	1
7F4	1
7F5	1
7F6	1
7F7	1
7F8	1
7F9	1
7FA	1
7FB	1
7FC	1
7FD	1
7FE	1
7FF	1
DROP TABLE IF EXISTS test.t1;
DROP TABLE IF EXISTS test.t1;
DROP DATABASE test;
CREATE DATABASE test CHARACTER SET utf8mb3;
USE test;
SET NAMES utf8mb3;
Warnings:
Warning	1287	'utf8mb3' is deprecated and will be removed in a future release. Please use utf8mb4 instead
CREATE TABLE test.t1 (a CHAR(4) CHARACTER SET utf8mb3) ENGINE=MyISAM CHARACTER SET utf8mb3;
Warnings:
Warning	1287	'utf8mb3' is deprecated and will be removed in a future release. Please use utf8mb4 instead
Warning	1287	'utf8mb3' is deprecated and will be removed in a future release. Please use utf8mb4 instead
SHOW TABLE STATUS LIKE 't1';
Name	Engine	Version	Row_format	Rows	Avg_row_length	Data_length	Max_data_length	Index_length	Data_free	Auto_increment	Create_time	Update_time	Check_time	Collation	Checksum	Create_options	Comment
t1	MyISAM	#	#	#	#	#	#	#	#	#	#	#	#	utf8mb3_general_ci	#	#	#
LOAD DATA INFILE 
'MYSQL_TEST_DIR/suite/funcs_2/data/charset_utf8.txt' INTO TABLE test.t1;
ALTER TABLE test.t1 CHANGE a a CHAR(4) CHARACTER SET ucs2 COLLATE ucs2_slovak_ci;
Warnings:
Warning	1287	'ucs2' is deprecated and will be removed in a future release. Please use utf8mb4 instead
Warning	4079	'ucs2_slovak_ci' is a collation of the deprecated character set ucs2. Please consider using utf8mb4 with an appropriate collation instead.
DELETE FROM test.t1 WHERE CHAR_LENGTH(a) <> 1;
SELECT HEX(ORD(a)) AS a_ord, CHAR_LENGTH(a) AS a_len FROM test.t1 ORDER BY a, ORD(a);
a_ord	a_len
85	1
7F	1
80	1
81	1
82	1
83	1
84	1
86	1
87	1
88	1
89	1
8A	1
8B	1
8C	1
8D	1
8E	1
8F	1
90	1
91	1
92	1
93	1
94	1
95	1
96	1
97	1
98	1
99	1
9A	1
9B	1
9C	1
9D	1
9E	1
9F	1
A0	1
300	1
301	1
302	1
303	1
304	1
305	1
306	1
307	1
308	1
309	1
30A	1
30B	1
30C	1
30D	1
30E	1
30F	1
310	1
311	1
312	1
313	1
314	1
315	1
316	1
317	1
318	1
319	1
31A	1
31B	1
31C	1
31D	1
31E	1
31F	1
320	1
321	1
322	1
323	1
324	1
325	1
326	1
327	1
328	1
329	1
32A	1
32B	1
32C	1
32D	1
32E	1
32F	1
330	1
331	1
332	1
333	1
334	1
335	1
336	1
337	1
338	1
339	1
33A	1
33B	1
33C	1
33D	1
33E	1
33F	1
340	1
341	1
342	1
343	1
344	1
345	1
346	1
347	1
348	1
349	1
34A	1
34B	1
34C	1
34D	1
34E	1
34F	1
350	1
351	1
352	1
353	1
354	1
355	1
356	1
357	1
35D	1
35E	1
35F	1
360	1
361	1
362	1
483	1
484	1
485	1
486	1
488	1
489	1
591	1
592	1
593	1
594	1
595	1
596	1
597	1
598	1
599	1
59A	1
59B	1
59C	1
59D	1
59E	1
59F	1
5A0	1
5A1	1
5A3	1
5A4	1
5A5	1
5A6	1
5A7	1
5A8	1
5A9	1
5AA	1
5AB	1
5AC	1
5AD	1
5AE	1
5AF	1
5B0	1
5B1	1
5B2	1
5B3	1
5B4	1
5B5	1
5B6	1
5B7	1
5B8	1
5B9	1
5BB	1
5BC	1
5BD	1
5BF	1
5C1	1
5C2	1
5C4	1
600	1
601	1
602	1
603	1
610	1
611	1
612	1
613	1
614	1
615	1
64B	1
64C	1
64D	1
64E	1
64F	1
650	1
651	1
652	1
653	1
654	1
655	1
656	1
657	1
658	1
670	1
6D6	1
6D7	1
6D8	1
6D9	1
6DA	1
6DB	1
6DC	1
6DD	1
6DE	1
6DF	1
6E0	1
6E1	1
6E2	1
6E3	1
6E4	1
6E7	1
6E8	1
6EA	1
6EB	1
6EC	1
6ED	1
70F	1
711	1
730	1
731	1
732	1
733	1
734	1
735	1
736	1
737	1
738	1
739	1
73A	1
73B	1
73C	1
73D	1
73E	1
73F	1
740	1
741	1
742	1
743	1
744	1
745	1
746	1
747	1
748	1
749	1
74A	1
640	1
60	1
B4	1
384	1
2DC	1
5E	1
AF	1
2D8	1
2D9	1
A8	1
385	1
2DA	1
2DD	1
B8	1
2DB	1
5F	1
AD	1
2D	1
58A	1
2C	1
55D	1
60C	1
60D	1
66B	1
66C	1
3B	1
37E	1
61B	1
3A	1
589	1
703	1
704	1
705	1
706	1
707	1
708	1
21	1
A1	1
55C	1
3F	1
BF	1
55E	1
61F	1
709	1
2E	1
6D4	1
701	1
702	1
B7	1
387	1
700	1
27	1
22	1
AB	1
BB	1
28	1
29	1
5B	1
7B	1
7D	1
A7	1
B6	1
A9	1
AE	1
40	1
2A	1
66D	1
2F	1
26	1
23	1
25	1
66A	1
55A	1
55B	1
55F	1
5BE	1
5C0	1
5C3	1
5F3	1
5F4	1
70A	1
70B	1
70C	1
70D	1
2B9	1
374	1
375	1
2BA	1
2C2	1
2C3	1
2C4	1
2C5	1
2C6	1
2C7	1
2C8	1
2C9	1
2CA	1
2CB	1
2CC	1
2CD	1
2CE	1
2CF	1
2D2	1
2D3	1
2D4	1
2D5	1
2D6	1
2D7	1
2DE	1
2DF	1
2E5	1
2E6	1
2E7	1
2E8	1
2E9	1
2EA	1
2EB	1
2EC	1
2ED	1
2EF	1
2F0	1
2F1	1
2F2	1
2F3	1
2F4	1
2F5	1
2F6	1
2F7	1
2F8	1
2F9	1
2FA	1
2FB	1
2FC	1
2FD	1
2FE	1
2FF	1
B0	1
482	1
60E	1
60F	1
6E9	1
3F6	1
2B	1
B1	1
F7	1
D7	1
3C	1
3D	1
3E	1
AC	1
7C	1
A6	1
7E	1
2D0	1
2D1	1
A4	1
A2	1
24	1
A3	1
A5	1
30	1
660	1
6F0	1
31	1
B9	1
661	1
6F1	1
BD	1
BC	1
32	1
B2	1
662	1
6F2	1
33	1
B3	1
663	1
6F3	1
BE	1
34	1
664	1
6F4	1
35	1
665	1
6F5	1
36	1
666	1
6F6	1
37	1
667	1
6F7	1
38	1
668	1
6F8	1
39	1
669	1
6F9	1
41	1
61	1
AA	1
C0	1
C1	1
C2	1
C3	1
C5	1
E0	1
E1	1
E2	1
E3	1
E5	1
100	1
101	1
102	1
103	1
104	1
105	1
1CD	1
1CE	1
1DE	1
1DF	1
1E0	1
1E1	1
1FA	1
1FB	1
200	1
201	1
202	1
203	1
226	1
227	1
363	1
C4	1
E4	1
C6	1
E6	1
1E2	1
1E3	1
1FC	1
1FD	1
250	1
251	1
252	1
42	1
62	1
299	1
180	1
181	1
253	1
182	1
183	1
43	1
63	1
C7	1
E7	1
106	1
107	1
108	1
109	1
10A	1
10B	1
368	1
10C	1
10D	1
187	1
188	1
255	1
44	1
64	1
10E	1
10F	1
369	1
1C4	1
1C5	1
1C6	1
1F1	1
1F2	1
1F3	1
2A3	1
2A5	1
2A4	1
110	1
111	1
189	1
256	1
18A	1
257	1
18B	1
18C	1
221	1
D0	1
F0	1
45	1
65	1
C8	1
C9	1
CA	1
CB	1
E8	1
E9	1
EA	1
EB	1
112	1
113	1
114	1
115	1
116	1
117	1
118	1
119	1
11A	1
11B	1
204	1
205	1
206	1
207	1
228	1
229	1
364	1
18E	1
1DD	1
18F	1
259	1
190	1
25B	1
258	1
25A	1
25C	1
25D	1
25E	1
29A	1
264	1
46	1
66	1
2A9	1
191	1
192	1
47	1
67	1
11C	1
11D	1
11E	1
11F	1
120	1
121	1
122	1
123	1
1E6	1
1E7	1
1F4	1
1F5	1
261	1
262	1
1E4	1
1E5	1
193	1
260	1
29B	1
194	1
263	1
2E0	1
1A2	1
1A3	1
48	1
68	1
124	1
125	1
21E	1
21F	1
2B0	1
36A	1
29C	1
195	1
1F6	1
126	1
127	1
266	1
2B1	1
267	1
2BB	1
2BD	1
49	1
69	1
CC	1
CD	1
CE	1
CF	1
EC	1
ED	1
EE	1
EF	1
128	1
129	1
12A	1
12B	1
12C	1
12D	1
12E	1
12F	1
130	1
1CF	1
1D0	1
208	1
209	1
20A	1
20B	1
365	1
132	1
133	1
131	1
26A	1
197	1
268	1
196	1
269	1
4A	1
6A	1
134	1
135	1
1F0	1
2B2	1
29D	1
25F	1
284	1
4B	1
6B	1
136	1
137	1
1E8	1
1E9	1
198	1
199	1
29E	1
4C	1
6C	1
139	1
13A	1
13B	1
13C	1
13D	1
13E	1
2E1	1
13F	1
140	1
1C7	1
1C8	1
1C9	1
2AA	1
2AB	1
29F	1
141	1
142	1
19A	1
26B	1
26C	1
26D	1
234	1
26E	1
19B	1
28E	1
4D	1
6D	1
36B	1
271	1
4E	1
6E	1
D1	1
F1	1
143	1
144	1
145	1
146	1
147	1
148	1
1F8	1
1F9	1
1CA	1
1CB	1
1CC	1
274	1
19D	1
272	1
19E	1
220	1
273	1
235	1
14A	1
14B	1
4F	1
6F	1
BA	1
D2	1
D3	1
D5	1
D6	1
F2	1
F3	1
F5	1
F6	1
14C	1
14D	1
14E	1
14F	1
150	1
151	1
1A0	1
1A1	1
1D1	1
1D2	1
1EA	1
1EB	1
1EC	1
1ED	1
20C	1
20D	1
20E	1
20F	1
22A	1
22B	1
22C	1
22D	1
22E	1
22F	1
230	1
231	1
366	1
152	1
153	1
D4	1
F4	1
276	1
D8	1
F8	1
1FE	1
1FF	1
186	1
254	1
19F	1
275	1
277	1
222	1
223	1
50	1
70	1
1A4	1
1A5	1
278	1
51	1
71	1
2A0	1
138	1
52	1
72	1
154	1
155	1
156	1
157	1
158	1
159	1
210	1
211	1
212	1
213	1
2B3	1
36C	1
1A6	1
280	1
279	1
2B4	1
27A	1
27B	1
2B5	1
27C	1
27D	1
27E	1
27F	1
281	1
2B6	1
53	1
73	1
15A	1
15B	1
15C	1
15D	1
15E	1
15F	1
17F	1
218	1
219	1
2E2	1
DF	1
160	1
161	1
282	1
1A9	1
283	1
1AA	1
285	1
286	1
54	1
74	1
162	1
163	1
164	1
165	1
21A	1
21B	1
36D	1
2A8	1
1BE	1
2A6	1
2A7	1
166	1
167	1
1AB	1
1AC	1
1AD	1
1AE	1
288	1
236	1
287	1
55	1
75	1
D9	1
DA	1
DB	1
DC	1
F9	1
FA	1
FB	1
FC	1
168	1
169	1
16A	1
16B	1
16C	1
16D	1
16E	1
16F	1
170	1
171	1
172	1
173	1
1AF	1
1B0	1
1D3	1
1D4	1
1D5	1
1D6	1
1D7	1
1D8	1
1D9	1
1DA	1
1DB	1
1DC	1
214	1
215	1
216	1
217	1
367	1
289	1
265	1
2AE	1
2AF	1
19C	1
26F	1
270	1
1B1	1
28A	1
56	1
76	1
36E	1
1B2	1
28B	1
28C	1
57	1
77	1
174	1
175	1
2B7	1
28D	1
58	1
78	1
2E3	1
36F	1
59	1
79	1
DD	1
FD	1
FF	1
176	1
177	1
178	1
232	1
233	1
2B8	1
28F	1
1B3	1
1B4	1
5A	1
7A	1
179	1
17A	1
17B	1
17C	1
18D	1
17D	1
17E	1
1B5	1
1B6	1
224	1
225	1
290	1
291	1
1B7	1
1EE	1
1EF	1
292	1
1B8	1
1B9	1
1BA	1
293	1
21C	1
21D	1
DE	1
FE	1
1BF	1
1F7	1
1BB	1
1A7	1
1A8	1
1BC	1
1BD	1
184	1
185	1
294	1
2C0	1
2BC	1
149	1
2EE	1
2BE	1
295	1
2E4	1
2BF	1
2C1	1
2A1	1
2A2	1
296	1
1C0	1
1C1	1
1C2	1
1C3	1
297	1
298	1
2AC	1
2AD	1
386	1
391	1
3AC	1
3B1	1
392	1
3B2	1
3D0	1
393	1
3B3	1
394	1
3B4	1
388	1
395	1
3AD	1
3B5	1
3F5	1
3DC	1
3DD	1
3DA	1
3DB	1
396	1
3B6	1
389	1
397	1
3AE	1
3B7	1
398	1
3B8	1
3D1	1
3F4	1
37A	1
38A	1
390	1
399	1
3AA	1
3AF	1
3B9	1
3CA	1
3F3	1
39A	1
3BA	1
3F0	1
3D7	1
39B	1
3BB	1
B5	1
39C	1
3BC	1
39D	1
3BD	1
39E	1
3BE	1
38C	1
39F	1
3BF	1
3CC	1
3A0	1
3C0	1
3D6	1
3DE	1
3DF	1
3D8	1
3D9	1
3A1	1
3C1	1
3F1	1
3A3	1
3C2	1
3C3	1
3F2	1
3F9	1
3A4	1
3C4	1
38E	1
3A5	1
3AB	1
3B0	1
3C5	1
3CB	1
3CD	1
3D2	1
3D3	1
3D4	1
3A6	1
3C6	1
3D5	1
3A7	1
3C7	1
3A8	1
3C8	1
38F	1
3A9	1
3C9	1
3CE	1
3E0	1
3E1	1
3F7	1
3F8	1
3FA	1
3FB	1
3E2	1
3E3	1
3E4	1
3E5	1
3E6	1
3E7	1
3E8	1
3E9	1
3EA	1
3EB	1
3EC	1
3ED	1
3EE	1
3EF	1
410	1
430	1
4D0	1
4D1	1
4D2	1
4D3	1
4D8	1
4D9	1
4DA	1
4DB	1
4D4	1
4D5	1
411	1
431	1
412	1
432	1
413	1
433	1
490	1
491	1
492	1
493	1
494	1
495	1
414	1
434	1
500	1
501	1
402	1
452	1
502	1
503	1
403	1
453	1
498	1
499	1
400	1
401	1
415	1
435	1
450	1
451	1
4D6	1
4D7	1
404	1
454	1
416	1
436	1
4C1	1
4C2	1
4DC	1
4DD	1
496	1
497	1
417	1
437	1
504	1
505	1
4DE	1
4DF	1
405	1
455	1
4E0	1
4E1	1
506	1
507	1
40D	1
418	1
438	1
45D	1
4E2	1
4E3	1
48A	1
48B	1
4E4	1
4E5	1
406	1
456	1
407	1
457	1
419	1
439	1
408	1
458	1
41A	1
43A	1
49A	1
49B	1
4C3	1
4C4	1
4A0	1
4A1	1
49E	1
49F	1
49C	1
49D	1
41B	1
43B	1
4C5	1
4C6	1
409	1
459	1
508	1
509	1
41C	1
43C	1
4CD	1
4CE	1
41D	1
43D	1
4C9	1
4CA	1
4A2	1
4A3	1
4C7	1
4C8	1
4A4	1
4A5	1
40A	1
45A	1
50A	1
50B	1
41E	1
43E	1
4E6	1
4E7	1
4E8	1
4E9	1
4EA	1
4EB	1
41F	1
43F	1
4A6	1
4A7	1
480	1
481	1
420	1
440	1
48E	1
48F	1
421	1
441	1
50C	1
50D	1
4AA	1
4AB	1
422	1
442	1
50E	1
50F	1
4AC	1
4AD	1
40B	1
45B	1
40C	1
45C	1
423	1
443	1
4EE	1
4EF	1
40E	1
45E	1
4F0	1
4F1	1
4F2	1
4F3	1
4AE	1
4AF	1
4B0	1
4B1	1
478	1
479	1
424	1
444	1
425	1
445	1
4B2	1
4B3	1
4BA	1
4BB	1
460	1
461	1
47E	1
47F	1
47C	1
47D	1
47A	1
47B	1
426	1
446	1
4B4	1
4B5	1
427	1
447	1
4F4	1
4F5	1
4B6	1
4B7	1
4CB	1
4CC	1
4B8	1
4B9	1
4BC	1
4BD	1
4BE	1
4BF	1
40F	1
45F	1
428	1
448	1
429	1
449	1
42A	1
44A	1
42B	1
44B	1
4F8	1
4F9	1
42C	1
44C	1
48C	1
48D	1
462	1
463	1
42D	1
44D	1
4EC	1
4ED	1
42E	1
44E	1
42F	1
44F	1
464	1
465	1
466	1
467	1
46A	1
46B	1
468	1
469	1
46C	1
46D	1
46E	1
46F	1
470	1
471	1
472	1
473	1
474	1
475	1
476	1
477	1
4A8	1
4A9	1
4C0	1
531	1
561	1
532	1
562	1
533	1
563	1
534	1
564	1
535	1
565	1
587	1
536	1
566	1
537	1
567	1
538	1
568	1
539	1
569	1
53A	1
56A	1
53B	1
56B	1
53C	1
56C	1
53D	1
56D	1
53E	1
56E	1
53F	1
56F	1
540	1
570	1
541	1
571	1
542	1
572	1
543	1
573	1
544	1
574	1
545	1
575	1
546	1
576	1
547	1
577	1
548	1
578	1
549	1
579	1
54A	1
57A	1
54B	1
57B	1
54C	1
57C	1
54D	1
57D	1
54E	1
57E	1
54F	1
57F	1
550	1
580	1
551	1
581	1
552	1
582	1
553	1
583	1
554	1
584	1
555	1
585	1
556	1
586	1
559	1
5D0	1
5D1	1
5D2	1
5D3	1
5D4	1
5D5	1
5F0	1
5F1	1
5D6	1
5D7	1
5D8	1
5D9	1
5F2	1
5DA	1
5DB	1
5DC	1
5DD	1
5DE	1
5DF	1
5E0	1
5E1	1
5E2	1
5E3	1
5E4	1
5E5	1
5E6	1
5E7	1
5E8	1
5E9	1
5EA	1
621	1
674	1
6FD	1
622	1
623	1
672	1
671	1
624	1
625	1
673	1
626	1
627	1
675	1
66E	1
628	1
67B	1
67E	1
680	1
629	1
62A	1
62B	1
679	1
67A	1
67C	1
67D	1
67F	1
62C	1
683	1
684	1
686	1
6BF	1
687	1
62D	1
62E	1
681	1
682	1
685	1
62F	1
630	1
688	1
689	1
68A	1
68B	1
68C	1
68D	1
68E	1
68F	1
690	1
6EE	1
631	1
632	1
691	1
692	1
693	1
694	1
695	1
696	1
697	1
698	1
699	1
6EF	1
633	1
634	1
69A	1
69B	1
69C	1
6FA	1
635	1
636	1
69D	1
69E	1
6FB	1
637	1
638	1
69F	1
639	1
63A	1
6A0	1
6FC	1
641	1
6A1	1
6A2	1
6A3	1
6A4	1
6A5	1
6A6	1
66F	1
642	1
6A7	1
6A8	1
643	1
6A9	1
6AA	1
6AB	1
6AC	1
6AD	1
6AE	1
6AF	1
6B0	1
6B1	1
6B2	1
6B3	1
6B4	1
644	1
6B5	1
6B6	1
6B7	1
6B8	1
645	1
6FE	1
646	1
6BA	1
6BB	1
6BC	1
6BD	1
6B9	1
647	1
6BE	1
6C1	1
6C2	1
6C3	1
6FF	1
6C0	1
6D5	1
648	1
6E5	1
676	1
6C4	1
6C5	1
6C6	1
6C7	1
677	1
6C8	1
6C9	1
6CA	1
6CB	1
6CF	1
649	1
64A	1
6E6	1
678	1
6CC	1
6CD	1
6CE	1
6D0	1
6D1	1
6D2	1
6D3	1
710	1
712	1
72D	1
713	1
714	1
72E	1
716	1
715	1
72F	1
717	1
718	1
719	1
74D	1
71A	1
71B	1
71C	1
71D	1
71E	1
71F	1
74E	1
720	1
721	1
722	1
723	1
724	1
725	1
726	1
727	1
74F	1
728	1
729	1
72A	1
72B	1
72C	1
780	1
799	1
79A	1
781	1
782	1
783	1
79C	1
784	1
785	1
786	1
787	1
7A2	1
7A3	1
788	1
7A5	1
789	1
78A	1
78B	1
79B	1
78C	1
798	1
7A0	1
7A1	1
78D	1
78E	1
7A4	1
78F	1
790	1
79D	1
79E	1
79F	1
791	1
792	1
793	1
794	1
795	1
796	1
797	1
7B1	1
7A6	1
7A7	1
7A8	1
7A9	1
7AA	1
7AB	1
7AC	1
7AD	1
7AE	1
7AF	1
7B0	1
4E00	1
4E01	1
4E02	1
4E03	1
4E04	1
4E05	1
4E06	1
4E07	1
4E08	1
4E09	1
4E0A	1
4E0B	1
4E0C	1
4E0D	1
4E0E	1
4E0F	1
4E10	1
4E11	1
4E12	1
4E13	1
4E14	1
4E15	1
4E16	1
4E17	1
4E18	1
4E19	1
4E1A	1
4E1B	1
4E1C	1
4E1D	1
4E1E	1
4E1F	1
4E20	1
4E21	1
4E22	1
4E23	1
4E24	1
4E25	1
4E26	1
4E27	1
4E28	1
4E29	1
4E2A	1
4E2B	1
4E2C	1
4E2D	1
4E2E	1
4E2F	1
4E30	1
4E31	1
4E32	1
4E33	1
4E34	1
4E35	1
4E36	1
4E37	1
4E38	1
4E39	1
4E3A	1
4E3B	1
4E3C	1
4E3D	1
4E3E	1
4E3F	1
4E40	1
4E41	1
4E42	1
4E43	1
4E44	1
4E45	1
4E46	1
4E47	1
4E48	1
4E49	1
4E4A	1
4E4B	1
4E4C	1
4E4D	1
4E4E	1
4E4F	1
4E50	1
4E51	1
4E52	1
4E53	1
4E54	1
4E55	1
4E56	1
4E57	1
4E58	1
4E59	1
4E5A	1
4E5B	1
4E5C	1
4E5D	1
4E5E	1
4E5F	1
4E60	1
4E61	1
4E62	1
4E63	1
4E64	1
4E65	1
4E66	1
4E67	1
4E68	1
4E69	1
4E6A	1
4E6B	1
4E6C	1
4E6D	1
4E6E	1
4E6F	1
4E70	1
4E71	1
4E72	1
4E73	1
4E74	1
4E75	1
4E76	1
4E77	1
4E78	1
4E79	1
4E7A	1
4E7B	1
4E7C	1
4E7D	1
4E7E	1
4E7F	1
4E80	1
4E81	1
4E82	1
4E83	1
4E84	1
4E85	1
4E86	1
4E87	1
4E88	1
4E89	1
4E8A	1
4E8B	1
4E8C	1
4E8D	1
4E8E	1
4E8F	1
4E90	1
4E91	1
4E92	1
4E93	1
4E94	1
4E95	1
4E96	1
4E97	1
4E98	1
4E99	1
4E9A	1
4E9B	1
4E9C	1
4E9D	1
4E9E	1
4E9F	1
4EA0	1
4EA1	1
4EA2	1
4EA3	1
4EA4	1
4EA5	1
4EA6	1
4EA7	1
4EA8	1
4EA9	1
4EAA	1
4EAB	1
4EAC	1
4EAD	1
4EAE	1
4EAF	1
4EB0	1
4EB1	1
4EB2	1
4EB3	1
4EB4	1
4EB5	1
4EB6	1
4EB7	1
4EB8	1
4EB9	1
4EBA	1
4EBB	1
4EBC	1
4EBD	1
4EBE	1
4EBF	1
4EC0	1
4EC1	1
4EC2	1
4EC3	1
4EC4	1
4EC5	1
4EC6	1
4EC7	1
4EC8	1
4EC9	1
4ECA	1
4ECB	1
4ECC	1
4ECD	1
4ECE	1
4ECF	1
4ED0	1
4ED1	1
4ED2	1
4ED3	1
4ED4	1
4ED5	1
4ED6	1
4ED7	1
4ED8	1
4ED9	1
4EDA	1
4EDB	1
4EDC	1
4EDD	1
4EDE	1
4EDF	1
4EE0	1
4EE1	1
4EE2	1
4EE3	1
4EE4	1
4EE5	1
4EE6	1
4EE7	1
4EE8	1
4EE9	1
4EEA	1
4EEB	1
4EEC	1
4EED	1
4EEE	1
4EEF	1
4EF0	1
4EF1	1
4EF2	1
4EF3	1
4EF4	1
4EF5	1
4EF6	1
4EF7	1
4EF8	1
4EF9	1
4EFA	1
4EFB	1
4EFC	1
4EFD	1
4EFE	1
4EFF	1
4F00	1
4F01	1
4F02	1
4F03	1
4F04	1
4F05	1
4F06	1
4F07	1
4F08	1
4F09	1
4F0A	1
4F0B	1
4F0C	1
4F0D	1
4F0E	1
4F0F	1
4F10	1
4F11	1
4F12	1
4F13	1
4F14	1
4F15	1
4F16	1
4F17	1
4F18	1
4F19	1
4F1A	1
4F1B	1
4F1C	1
4F1D	1
4F1E	1
4F1F	1
4F20	1
4F21	1
4F22	1
4F23	1
4F24	1
4F25	1
4F26	1
4F27	1
4F28	1
4F29	1
4F2A	1
4F2B	1
4F2C	1
4F2D	1
4F2E	1
4F2F	1
4F30	1
4F31	1
4F32	1
4F33	1
4F34	1
4F35	1
4F36	1
4F37	1
4F38	1
4F39	1
4F3A	1
4F3B	1
4F3C	1
4F3D	1
4F3E	1
4F3F	1
4F40	1
4F41	1
4F42	1
4F43	1
4F44	1
4F45	1
4F46	1
4F47	1
4F48	1
4F49	1
4F4A	1
4F4B	1
4F4C	1
4F4D	1
4F4E	1
4F4F	1
4F50	1
4F51	1
4F52	1
4F53	1
4F54	1
4F55	1
4F56	1
4F57	1
4F58	1
4F59	1
4F5A	1
4F5B	1
4F5C	1
4F5D	1
4F5E	1
4F5F	1
4F60	1
4F61	1
4F62	1
4F63	1
4F64	1
4F65	1
4F66	1
4F67	1
4F68	1
4F69	1
4F6A	1
4F6B	1
4F6C	1
4F6D	1
4F6E	1
4F6F	1
4F70	1
4F71	1
4F72	1
4F73	1
4F74	1
4F75	1
4F76	1
4F77	1
4F78	1
4F79	1
4F7A	1
4F7B	1
4F7C	1
4F7D	1
4F7E	1
4F7F	1
4F80	1
4F81	1
4F82	1
4F83	1
4F84	1
4F85	1
4F86	1
4F87	1
4F88	1
4F89	1
4F8A	1
4F8B	1
4F8C	1
4F8D	1
4F8E	1
4F8F	1
4F90	1
4F91	1
4F92	1
4F93	1
4F94	1
4F95	1
4F96	1
4F97	1
4F98	1
4F99	1
4F9A	1
4F9B	1
4F9C	1
4F9D	1
4F9E	1
4F9F	1
4FA0	1
4FA1	1
4FA2	1
4FA3	1
4FA4	1
4FA5	1
4FA6	1
4FA7	1
4FA8	1
4FA9	1
4FAA	1
4FAB	1
4FAC	1
4FAD	1
4FAE	1
4FAF	1
4FB0	1
4FB1	1
4FB2	1
4FB3	1
4FB4	1
4FB5	1
4FB6	1
4FB7	1
4FB8	1
4FB9	1
4FBA	1
4FBB	1
4FBC	1
4FBD	1
4FBE	1
4FBF	1
4FC0	1
4FC1	1
4FC2	1
4FC3	1
4FC4	1
4FC5	1
4FC6	1
4FC7	1
4FC8	1
4FC9	1
4FCA	1
4FCB	1
4FCC	1
4FCD	1
4FCE	1
4FCF	1
4FD0	1
4FD1	1
4FD2	1
4FD3	1
4FD4	1
4FD5	1
4FD6	1
4FD7	1
4FD8	1
4FD9	1
4FDA	1
4FDB	1
4FDC	1
4FDD	1
4FDE	1
4FDF	1
4FE0	1
4FE1	1
4FE2	1
4FE3	1
4FE4	1
4FE5	1
4FE6	1
4FE7	1
4FE8	1
4FE9	1
4FEA	1
4FEB	1
4FEC	1
4FED	1
4FEE	1
4FEF	1
4FF0	1
4FF1	1
4FF2	1
4FF3	1
4FF4	1
4FF5	1
4FF6	1
4FF7	1
4FF8	1
4FF9	1
4FFA	1
4FFB	1
4FFC	1
4FFD	1
4FFE	1
4FFF	1
237	1
238	1
239	1
23A	1
23B	1
23C	1
23D	1
23E	1
23F	1
240	1
241	1
242	1
243	1
244	1
245	1
246	1
247	1
248	1
249	1
24A	1
24B	1
24C	1
24D	1
24E	1
24F	1
358	1
359	1
35A	1
35B	1
35C	1
370	1
371	1
372	1
373	1
376	1
377	1
378	1
379	1
37B	1
37C	1
37D	1
37F	1
380	1
381	1
382	1
383	1
38B	1
38D	1
3A2	1
3CF	1
3FC	1
3FD	1
3FE	1
3FF	1
487	1
4CF	1
4F6	1
4F7	1
4FA	1
4FB	1
4FC	1
4FD	1
4FE	1
4FF	1
510	1
511	1
512	1
513	1
514	1
515	1
516	1
517	1
518	1
519	1
51A	1
51B	1
51C	1
51D	1
51E	1
51F	1
520	1
521	1
522	1
523	1
524	1
525	1
526	1
527	1
528	1
529	1
52A	1
52B	1
52C	1
52D	1
52E	1
52F	1
530	1
557	1
558	1
560	1
588	1
58B	1
58C	1
58D	1
58E	1
58F	1
590	1
5A2	1
5BA	1
5C5	1
5C6	1
5C7	1
5C8	1
5C9	1
5CA	1
5CB	1
5CC	1
5CD	1
5CE	1
5CF	1
5EB	1
5EC	1
5ED	1
5EE	1
5EF	1
5F5	1
5F6	1
5F7	1
5F8	1
5F9	1
5FA	1
5FB	1
5FC	1
5FD	1
5FE	1
5FF	1
604	1
605	1
606	1
607	1
608	1
609	1
60A	1
60B	1
616	1
617	1
618	1
619	1
61A	1
61C	1
61D	1
61E	1
620	1
63B	1
63C	1
63D	1
63E	1
63F	1
659	1
65A	1
65B	1
65C	1
65D	1
65E	1
65F	1
70E	1
74B	1
74C	1
750	1
751	1
752	1
753	1
754	1
755	1
756	1
757	1
758	1
759	1
75A	1
75B	1
75C	1
75D	1
75E	1
75F	1
760	1
761	1
762	1
763	1
764	1
765	1
766	1
767	1
768	1
769	1
76A	1
76B	1
76C	1
76D	1
76E	1
76F	1
770	1
771	1
772	1
773	1
774	1
775	1
776	1
777	1
778	1
779	1
77A	1
77B	1
77C	1
77D	1
77E	1
77F	1
7B2	1
7B3	1
7B4	1
7B5	1
7B6	1
7B7	1
7B8	1
7B9	1
7BA	1
7BB	1
7BC	1
7BD	1
7BE	1
7BF	1
7C0	1
7C1	1
7C2	1
7C3	1
7C4	1
7C5	1
7C6	1
7C7	1
7C8	1
7C9	1
7CA	1
7CB	1
7CC	1
7CD	1
7CE	1
7CF	1
7D0	1
7D1	1
7D2	1
7D3	1
7D4	1
7D5	1
7D6	1
7D7	1
7D8	1
7D9	1
7DA	1
7DB	1
7DC	1
7DD	1
7DE	1
7DF	1
7E0	1
7E1	1
7E2	1
7E3	1
7E4	1
7E5	1
7E6	1
7E7	1
7E8	1
7E9	1
7EA	1
7EB	1
7EC	1
7ED	1
7EE	1
7EF	1
7F0	1
7F1	1
7F2	1
7F3	1
7F4	1
7F5	1
7F6	1
7F7	1
7F8	1
7F9	1
7FA	1
7FB	1
7FC	1
7FD	1
7FE	1
7FF	1
DROP TABLE IF EXISTS test.t1;
DROP TABLE IF EXISTS test.t1;
DROP DATABASE test;
CREATE DATABASE test CHARACTER SET utf8mb3;
USE test;
SET NAMES utf8mb3;
Warnings:
Warning	1287	'utf8mb3' is deprecated and will be removed in a future release. Please use utf8mb4 instead
CREATE TABLE test.t1 (a CHAR(4) CHARACTER SET utf8mb3) ENGINE=MyISAM CHARACTER SET utf8mb3;
Warnings:
Warning	1287	'utf8mb3' is deprecated and will be removed in a future release. Please use utf8mb4 instead
Warning	1287	'utf8mb3' is deprecated and will be removed in a future release. Please use utf8mb4 instead
SHOW TABLE STATUS LIKE 't1';
Name	Engine	Version	Row_format	Rows	Avg_row_length	Data_length	Max_data_length	Index_length	Data_free	Auto_increment	Create_time	Update_time	Check_time	Collation	Checksum	Create_options	Comment
t1	MyISAM	#	#	#	#	#	#	#	#	#	#	#	#	utf8mb3_general_ci	#	#	#
LOAD DATA INFILE 
'MYSQL_TEST_DIR/suite/funcs_2/data/charset_utf8.txt' INTO TABLE test.t1;
ALTER TABLE test.t1 CHANGE a a CHAR(4) CHARACTER SET ucs2 COLLATE ucs2_slovenian_ci;
Warnings:
Warning	1287	'ucs2' is deprecated and will be removed in a future release. Please use utf8mb4 instead
Warning	4079	'ucs2_slovenian_ci' is a collation of the deprecated character set ucs2. Please consider using utf8mb4 with an appropriate collation instead.
DELETE FROM test.t1 WHERE CHAR_LENGTH(a) <> 1;
SELECT HEX(ORD(a)) AS a_ord, CHAR_LENGTH(a) AS a_len FROM test.t1 ORDER BY a, ORD(a);
a_ord	a_len
85	1
7F	1
80	1
81	1
82	1
83	1
84	1
86	1
87	1
88	1
89	1
8A	1
8B	1
8C	1
8D	1
8E	1
8F	1
90	1
91	1
92	1
93	1
94	1
95	1
96	1
97	1
98	1
99	1
9A	1
9B	1
9C	1
9D	1
9E	1
9F	1
A0	1
300	1
301	1
302	1
303	1
304	1
305	1
306	1
307	1
308	1
309	1
30A	1
30B	1
30C	1
30D	1
30E	1
30F	1
310	1
311	1
312	1
313	1
314	1
315	1
316	1
317	1
318	1
319	1
31A	1
31B	1
31C	1
31D	1
31E	1
31F	1
320	1
321	1
322	1
323	1
324	1
325	1
326	1
327	1
328	1
329	1
32A	1
32B	1
32C	1
32D	1
32E	1
32F	1
330	1
331	1
332	1
333	1
334	1
335	1
336	1
337	1
338	1
339	1
33A	1
33B	1
33C	1
33D	1
33E	1
33F	1
340	1
341	1
342	1
343	1
344	1
345	1
346	1
347	1
348	1
349	1
34A	1
34B	1
34C	1
34D	1
34E	1
34F	1
350	1
351	1
352	1
353	1
354	1
355	1
356	1
357	1
35D	1
35E	1
35F	1
360	1
361	1
362	1
483	1
484	1
485	1
486	1
488	1
489	1
591	1
592	1
593	1
594	1
595	1
596	1
597	1
598	1
599	1
59A	1
59B	1
59C	1
59D	1
59E	1
59F	1
5A0	1
5A1	1
5A3	1
5A4	1
5A5	1
5A6	1
5A7	1
5A8	1
5A9	1
5AA	1
5AB	1
5AC	1
5AD	1
5AE	1
5AF	1
5B0	1
5B1	1
5B2	1
5B3	1
5B4	1
5B5	1
5B6	1
5B7	1
5B8	1
5B9	1
5BB	1
5BC	1
5BD	1
5BF	1
5C1	1
5C2	1
5C4	1
600	1
601	1
602	1
603	1
610	1
611	1
612	1
613	1
614	1
615	1
64B	1
64C	1
64D	1
64E	1
64F	1
650	1
651	1
652	1
653	1
654	1
655	1
656	1
657	1
658	1
670	1
6D6	1
6D7	1
6D8	1
6D9	1
6DA	1
6DB	1
6DC	1
6DD	1
6DE	1
6DF	1
6E0	1
6E1	1
6E2	1
6E3	1
6E4	1
6E7	1
6E8	1
6EA	1
6EB	1
6EC	1
6ED	1
70F	1
711	1
730	1
731	1
732	1
733	1
734	1
735	1
736	1
737	1
738	1
739	1
73A	1
73B	1
73C	1
73D	1
73E	1
73F	1
740	1
741	1
742	1
743	1
744	1
745	1
746	1
747	1
748	1
749	1
74A	1
640	1
60	1
B4	1
384	1
2DC	1
5E	1
AF	1
2D8	1
2D9	1
A8	1
385	1
2DA	1
2DD	1
B8	1
2DB	1
5F	1
AD	1
2D	1
58A	1
2C	1
55D	1
60C	1
60D	1
66B	1
66C	1
3B	1
37E	1
61B	1
3A	1
589	1
703	1
704	1
705	1
706	1
707	1
708	1
21	1
A1	1
55C	1
3F	1
BF	1
55E	1
61F	1
709	1
2E	1
6D4	1
701	1
702	1
B7	1
387	1
700	1
27	1
22	1
AB	1
BB	1
28	1
29	1
5B	1
7B	1
7D	1
A7	1
B6	1
A9	1
AE	1
40	1
2A	1
66D	1
2F	1
26	1
23	1
25	1
66A	1
55A	1
55B	1
55F	1
5BE	1
5C0	1
5C3	1
5F3	1
5F4	1
70A	1
70B	1
70C	1
70D	1
2B9	1
374	1
375	1
2BA	1
2C2	1
2C3	1
2C4	1
2C5	1
2C6	1
2C7	1
2C8	1
2C9	1
2CA	1
2CB	1
2CC	1
2CD	1
2CE	1
2CF	1
2D2	1
2D3	1
2D4	1
2D5	1
2D6	1
2D7	1
2DE	1
2DF	1
2E5	1
2E6	1
2E7	1
2E8	1
2E9	1
2EA	1
2EB	1
2EC	1
2ED	1
2EF	1
2F0	1
2F1	1
2F2	1
2F3	1
2F4	1
2F5	1
2F6	1
2F7	1
2F8	1
2F9	1
2FA	1
2FB	1
2FC	1
2FD	1
2FE	1
2FF	1
B0	1
482	1
60E	1
60F	1
6E9	1
3F6	1
2B	1
B1	1
F7	1
D7	1
3C	1
3D	1
3E	1
AC	1
7C	1
A6	1
7E	1
2D0	1
2D1	1
A4	1
A2	1
24	1
A3	1
A5	1
30	1
660	1
6F0	1
31	1
B9	1
661	1
6F1	1
BD	1
BC	1
32	1
B2	1
662	1
6F2	1
33	1
B3	1
663	1
6F3	1
BE	1
34	1
664	1
6F4	1
35	1
665	1
6F5	1
36	1
666	1
6F6	1
37	1
667	1
6F7	1
38	1
668	1
6F8	1
39	1
669	1
6F9	1
41	1
61	1
AA	1
C0	1
C1	1
C2	1
C3	1
C4	1
C5	1
E0	1
E1	1
E2	1
E3	1
E4	1
E5	1
100	1
101	1
102	1
103	1
104	1
105	1
1CD	1
1CE	1
1DE	1
1DF	1
1E0	1
1E1	1
1FA	1
1FB	1
200	1
201	1
202	1
203	1
226	1
227	1
363	1
C6	1
E6	1
1E2	1
1E3	1
1FC	1
1FD	1
250	1
251	1
252	1
42	1
62	1
299	1
180	1
181	1
253	1
182	1
183	1
43	1
63	1
C7	1
E7	1
106	1
107	1
108	1
109	1
10A	1
10B	1
368	1
10C	1
10D	1
187	1
188	1
255	1
44	1
64	1
10E	1
10F	1
369	1
1C4	1
1C5	1
1C6	1
1F1	1
1F2	1
1F3	1
2A3	1
2A5	1
2A4	1
110	1
111	1
189	1
256	1
18A	1
257	1
18B	1
18C	1
221	1
D0	1
F0	1
45	1
65	1
C8	1
C9	1
CA	1
CB	1
E8	1
E9	1
EA	1
EB	1
112	1
113	1
114	1
115	1
116	1
117	1
118	1
119	1
11A	1
11B	1
204	1
205	1
206	1
207	1
228	1
229	1
364	1
18E	1
1DD	1
18F	1
259	1
190	1
25B	1
258	1
25A	1
25C	1
25D	1
25E	1
29A	1
264	1
46	1
66	1
2A9	1
191	1
192	1
47	1
67	1
11C	1
11D	1
11E	1
11F	1
120	1
121	1
122	1
123	1
1E6	1
1E7	1
1F4	1
1F5	1
261	1
262	1
1E4	1
1E5	1
193	1
260	1
29B	1
194	1
263	1
2E0	1
1A2	1
1A3	1
48	1
68	1
124	1
125	1
21E	1
21F	1
2B0	1
36A	1
29C	1
195	1
1F6	1
126	1
127	1
266	1
2B1	1
267	1
2BB	1
2BD	1
49	1
69	1
CC	1
CD	1
CE	1
CF	1
EC	1
ED	1
EE	1
EF	1
128	1
129	1
12A	1
12B	1
12C	1
12D	1
12E	1
12F	1
130	1
1CF	1
1D0	1
208	1
209	1
20A	1
20B	1
365	1
132	1
133	1
131	1
26A	1
197	1
268	1
196	1
269	1
4A	1
6A	1
134	1
135	1
1F0	1
2B2	1
29D	1
25F	1
284	1
4B	1
6B	1
136	1
137	1
1E8	1
1E9	1
198	1
199	1
29E	1
4C	1
6C	1
139	1
13A	1
13B	1
13C	1
13D	1
13E	1
2E1	1
13F	1
140	1
1C7	1
1C8	1
1C9	1
2AA	1
2AB	1
29F	1
141	1
142	1
19A	1
26B	1
26C	1
26D	1
234	1
26E	1
19B	1
28E	1
4D	1
6D	1
36B	1
271	1
4E	1
6E	1
D1	1
F1	1
143	1
144	1
145	1
146	1
147	1
148	1
1F8	1
1F9	1
1CA	1
1CB	1
1CC	1
274	1
19D	1
272	1
19E	1
220	1
273	1
235	1
14A	1
14B	1
4F	1
6F	1
BA	1
D2	1
D3	1
D4	1
D5	1
D6	1
F2	1
F3	1
F4	1
F5	1
F6	1
14C	1
14D	1
14E	1
14F	1
150	1
151	1
1A0	1
1A1	1
1D1	1
1D2	1
1EA	1
1EB	1
1EC	1
1ED	1
20C	1
20D	1
20E	1
20F	1
22A	1
22B	1
22C	1
22D	1
22E	1
22F	1
230	1
231	1
366	1
152	1
153	1
276	1
D8	1
F8	1
1FE	1
1FF	1
186	1
254	1
19F	1
275	1
277	1
222	1
223	1
50	1
70	1
1A4	1
1A5	1
278	1
51	1
71	1
2A0	1
138	1
52	1
72	1
154	1
155	1
156	1
157	1
158	1
159	1
210	1
211	1
212	1
213	1
2B3	1
36C	1
1A6	1
280	1
279	1
2B4	1
27A	1
27B	1
2B5	1
27C	1
27D	1
27E	1
27F	1
281	1
2B6	1
53	1
73	1
15A	1
15B	1
15C	1
15D	1
15E	1
15F	1
17F	1
218	1
219	1
2E2	1
DF	1
160	1
161	1
282	1
1A9	1
283	1
1AA	1
285	1
286	1
54	1
74	1
162	1
163	1
164	1
165	1
21A	1
21B	1
36D	1
2A8	1
1BE	1
2A6	1
2A7	1
166	1
167	1
1AB	1
1AC	1
1AD	1
1AE	1
288	1
236	1
287	1
55	1
75	1
D9	1
DA	1
DB	1
DC	1
F9	1
FA	1
FB	1
FC	1
168	1
169	1
16A	1
16B	1
16C	1
16D	1
16E	1
16F	1
170	1
171	1
172	1
173	1
1AF	1
1B0	1
1D3	1
1D4	1
1D5	1
1D6	1
1D7	1
1D8	1
1D9	1
1DA	1
1DB	1
1DC	1
214	1
215	1
216	1
217	1
367	1
289	1
265	1
2AE	1
2AF	1
19C	1
26F	1
270	1
1B1	1
28A	1
56	1
76	1
36E	1
1B2	1
28B	1
28C	1
57	1
77	1
174	1
175	1
2B7	1
28D	1
58	1
78	1
2E3	1
36F	1
59	1
79	1
DD	1
FD	1
FF	1
176	1
177	1
178	1
232	1
233	1
2B8	1
28F	1
1B3	1
1B4	1
5A	1
7A	1
179	1
17A	1
17B	1
17C	1
18D	1
17D	1
17E	1
1B5	1
1B6	1
224	1
225	1
290	1
291	1
1B7	1
1EE	1
1EF	1
292	1
1B8	1
1B9	1
1BA	1
293	1
21C	1
21D	1
DE	1
FE	1
1BF	1
1F7	1
1BB	1
1A7	1
1A8	1
1BC	1
1BD	1
184	1
185	1
294	1
2C0	1
2BC	1
149	1
2EE	1
2BE	1
295	1
2E4	1
2BF	1
2C1	1
2A1	1
2A2	1
296	1
1C0	1
1C1	1
1C2	1
1C3	1
297	1
298	1
2AC	1
2AD	1
386	1
391	1
3AC	1
3B1	1
392	1
3B2	1
3D0	1
393	1
3B3	1
394	1
3B4	1
388	1
395	1
3AD	1
3B5	1
3F5	1
3DC	1
3DD	1
3DA	1
3DB	1
396	1
3B6	1
389	1
397	1
3AE	1
3B7	1
398	1
3B8	1
3D1	1
3F4	1
37A	1
38A	1
390	1
399	1
3AA	1
3AF	1
3B9	1
3CA	1
3F3	1
39A	1
3BA	1
3F0	1
3D7	1
39B	1
3BB	1
B5	1
39C	1
3BC	1
39D	1
3BD	1
39E	1
3BE	1
38C	1
39F	1
3BF	1
3CC	1
3A0	1
3C0	1
3D6	1
3DE	1
3DF	1
3D8	1
3D9	1
3A1	1
3C1	1
3F1	1
3A3	1
3C2	1
3C3	1
3F2	1
3F9	1
3A4	1
3C4	1
38E	1
3A5	1
3AB	1
3B0	1
3C5	1
3CB	1
3CD	1
3D2	1
3D3	1
3D4	1
3A6	1
3C6	1
3D5	1
3A7	1
3C7	1
3A8	1
3C8	1
38F	1
3A9	1
3C9	1
3CE	1
3E0	1
3E1	1
3F7	1
3F8	1
3FA	1
3FB	1
3E2	1
3E3	1
3E4	1
3E5	1
3E6	1
3E7	1
3E8	1
3E9	1
3EA	1
3EB	1
3EC	1
3ED	1
3EE	1
3EF	1
410	1
430	1
4D0	1
4D1	1
4D2	1
4D3	1
4D8	1
4D9	1
4DA	1
4DB	1
4D4	1
4D5	1
411	1
431	1
412	1
432	1
413	1
433	1
490	1
491	1
492	1
493	1
494	1
495	1
414	1
434	1
500	1
501	1
402	1
452	1
502	1
503	1
403	1
453	1
498	1
499	1
400	1
401	1
415	1
435	1
450	1
451	1
4D6	1
4D7	1
404	1
454	1
416	1
436	1
4C1	1
4C2	1
4DC	1
4DD	1
496	1
497	1
417	1
437	1
504	1
505	1
4DE	1
4DF	1
405	1
455	1
4E0	1
4E1	1
506	1
507	1
40D	1
418	1
438	1
45D	1
4E2	1
4E3	1
48A	1
48B	1
4E4	1
4E5	1
406	1
456	1
407	1
457	1
419	1
439	1
408	1
458	1
41A	1
43A	1
49A	1
49B	1
4C3	1
4C4	1
4A0	1
4A1	1
49E	1
49F	1
49C	1
49D	1
41B	1
43B	1
4C5	1
4C6	1
409	1
459	1
508	1
509	1
41C	1
43C	1
4CD	1
4CE	1
41D	1
43D	1
4C9	1
4CA	1
4A2	1
4A3	1
4C7	1
4C8	1
4A4	1
4A5	1
40A	1
45A	1
50A	1
50B	1
41E	1
43E	1
4E6	1
4E7	1
4E8	1
4E9	1
4EA	1
4EB	1
41F	1
43F	1
4A6	1
4A7	1
480	1
481	1
420	1
440	1
48E	1
48F	1
421	1
441	1
50C	1
50D	1
4AA	1
4AB	1
422	1
442	1
50E	1
50F	1
4AC	1
4AD	1
40B	1
45B	1
40C	1
45C	1
423	1
443	1
4EE	1
4EF	1
40E	1
45E	1
4F0	1
4F1	1
4F2	1
4F3	1
4AE	1
4AF	1
4B0	1
4B1	1
478	1
479	1
424	1
444	1
425	1
445	1
4B2	1
4B3	1
4BA	1
4BB	1
460	1
461	1
47E	1
47F	1
47C	1
47D	1
47A	1
47B	1
426	1
446	1
4B4	1
4B5	1
427	1
447	1
4F4	1
4F5	1
4B6	1
4B7	1
4CB	1
4CC	1
4B8	1
4B9	1
4BC	1
4BD	1
4BE	1
4BF	1
40F	1
45F	1
428	1
448	1
429	1
449	1
42A	1
44A	1
42B	1
44B	1
4F8	1
4F9	1
42C	1
44C	1
48C	1
48D	1
462	1
463	1
42D	1
44D	1
4EC	1
4ED	1
42E	1
44E	1
42F	1
44F	1
464	1
465	1
466	1
467	1
46A	1
46B	1
468	1
469	1
46C	1
46D	1
46E	1
46F	1
470	1
471	1
472	1
473	1
474	1
475	1
476	1
477	1
4A8	1
4A9	1
4C0	1
531	1
561	1
532	1
562	1
533	1
563	1
534	1
564	1
535	1
565	1
587	1
536	1
566	1
537	1
567	1
538	1
568	1
539	1
569	1
53A	1
56A	1
53B	1
56B	1
53C	1
56C	1
53D	1
56D	1
53E	1
56E	1
53F	1
56F	1
540	1
570	1
541	1
571	1
542	1
572	1
543	1
573	1
544	1
574	1
545	1
575	1
546	1
576	1
547	1
577	1
548	1
578	1
549	1
579	1
54A	1
57A	1
54B	1
57B	1
54C	1
57C	1
54D	1
57D	1
54E	1
57E	1
54F	1
57F	1
550	1
580	1
551	1
581	1
552	1
582	1
553	1
583	1
554	1
584	1
555	1
585	1
556	1
586	1
559	1
5D0	1
5D1	1
5D2	1
5D3	1
5D4	1
5D5	1
5F0	1
5F1	1
5D6	1
5D7	1
5D8	1
5D9	1
5F2	1
5DA	1
5DB	1
5DC	1
5DD	1
5DE	1
5DF	1
5E0	1
5E1	1
5E2	1
5E3	1
5E4	1
5E5	1
5E6	1
5E7	1
5E8	1
5E9	1
5EA	1
621	1
674	1
6FD	1
622	1
623	1
672	1
671	1
624	1
625	1
673	1
626	1
627	1
675	1
66E	1
628	1
67B	1
67E	1
680	1
629	1
62A	1
62B	1
679	1
67A	1
67C	1
67D	1
67F	1
62C	1
683	1
684	1
686	1
6BF	1
687	1
62D	1
62E	1
681	1
682	1
685	1
62F	1
630	1
688	1
689	1
68A	1
68B	1
68C	1
68D	1
68E	1
68F	1
690	1
6EE	1
631	1
632	1
691	1
692	1
693	1
694	1
695	1
696	1
697	1
698	1
699	1
6EF	1
633	1
634	1
69A	1
69B	1
69C	1
6FA	1
635	1
636	1
69D	1
69E	1
6FB	1
637	1
638	1
69F	1
639	1
63A	1
6A0	1
6FC	1
641	1
6A1	1
6A2	1
6A3	1
6A4	1
6A5	1
6A6	1
66F	1
642	1
6A7	1
6A8	1
643	1
6A9	1
6AA	1
6AB	1
6AC	1
6AD	1
6AE	1
6AF	1
6B0	1
6B1	1
6B2	1
6B3	1
6B4	1
644	1
6B5	1
6B6	1
6B7	1
6B8	1
645	1
6FE	1
646	1
6BA	1
6BB	1
6BC	1
6BD	1
6B9	1
647	1
6BE	1
6C1	1
6C2	1
6C3	1
6FF	1
6C0	1
6D5	1
648	1
6E5	1
676	1
6C4	1
6C5	1
6C6	1
6C7	1
677	1
6C8	1
6C9	1
6CA	1
6CB	1
6CF	1
649	1
64A	1
6E6	1
678	1
6CC	1
6CD	1
6CE	1
6D0	1
6D1	1
6D2	1
6D3	1
710	1
712	1
72D	1
713	1
714	1
72E	1
716	1
715	1
72F	1
717	1
718	1
719	1
74D	1
71A	1
71B	1
71C	1
71D	1
71E	1
71F	1
74E	1
720	1
721	1
722	1
723	1
724	1
725	1
726	1
727	1
74F	1
728	1
729	1
72A	1
72B	1
72C	1
780	1
799	1
79A	1
781	1
782	1
783	1
79C	1
784	1
785	1
786	1
787	1
7A2	1
7A3	1
788	1
7A5	1
789	1
78A	1
78B	1
79B	1
78C	1
798	1
7A0	1
7A1	1
78D	1
78E	1
7A4	1
78F	1
790	1
79D	1
79E	1
79F	1
791	1
792	1
793	1
794	1
795	1
796	1
797	1
7B1	1
7A6	1
7A7	1
7A8	1
7A9	1
7AA	1
7AB	1
7AC	1
7AD	1
7AE	1
7AF	1
7B0	1
4E00	1
4E01	1
4E02	1
4E03	1
4E04	1
4E05	1
4E06	1
4E07	1
4E08	1
4E09	1
4E0A	1
4E0B	1
4E0C	1
4E0D	1
4E0E	1
4E0F	1
4E10	1
4E11	1
4E12	1
4E13	1
4E14	1
4E15	1
4E16	1
4E17	1
4E18	1
4E19	1
4E1A	1
4E1B	1
4E1C	1
4E1D	1
4E1E	1
4E1F	1
4E20	1
4E21	1
4E22	1
4E23	1
4E24	1
4E25	1
4E26	1
4E27	1
4E28	1
4E29	1
4E2A	1
4E2B	1
4E2C	1
4E2D	1
4E2E	1
4E2F	1
4E30	1
4E31	1
4E32	1
4E33	1
4E34	1
4E35	1
4E36	1
4E37	1
4E38	1
4E39	1
4E3A	1
4E3B	1
4E3C	1
4E3D	1
4E3E	1
4E3F	1
4E40	1
4E41	1
4E42	1
4E43	1
4E44	1
4E45	1
4E46	1
4E47	1
4E48	1
4E49	1
4E4A	1
4E4B	1
4E4C	1
4E4D	1
4E4E	1
4E4F	1
4E50	1
4E51	1
4E52	1
4E53	1
4E54	1
4E55	1
4E56	1
4E57	1
4E58	1
4E59	1
4E5A	1
4E5B	1
4E5C	1
4E5D	1
4E5E	1
4E5F	1
4E60	1
4E61	1
4E62	1
4E63	1
4E64	1
4E65	1
4E66	1
4E67	1
4E68	1
4E69	1
4E6A	1
4E6B	1
4E6C	1
4E6D	1
4E6E	1
4E6F	1
4E70	1
4E71	1
4E72	1
4E73	1
4E74	1
4E75	1
4E76	1
4E77	1
4E78	1
4E79	1
4E7A	1
4E7B	1
4E7C	1
4E7D	1
4E7E	1
4E7F	1
4E80	1
4E81	1
4E82	1
4E83	1
4E84	1
4E85	1
4E86	1
4E87	1
4E88	1
4E89	1
4E8A	1
4E8B	1
4E8C	1
4E8D	1
4E8E	1
4E8F	1
4E90	1
4E91	1
4E92	1
4E93	1
4E94	1
4E95	1
4E96	1
4E97	1
4E98	1
4E99	1
4E9A	1
4E9B	1
4E9C	1
4E9D	1
4E9E	1
4E9F	1
4EA0	1
4EA1	1
4EA2	1
4EA3	1
4EA4	1
4EA5	1
4EA6	1
4EA7	1
4EA8	1
4EA9	1
4EAA	1
4EAB	1
4EAC	1
4EAD	1
4EAE	1
4EAF	1
4EB0	1
4EB1	1
4EB2	1
4EB3	1
4EB4	1
4EB5	1
4EB6	1
4EB7	1
4EB8	1
4EB9	1
4EBA	1
4EBB	1
4EBC	1
4EBD	1
4EBE	1
4EBF	1
4EC0	1
4EC1	1
4EC2	1
4EC3	1
4EC4	1
4EC5	1
4EC6	1
4EC7	1
4EC8	1
4EC9	1
4ECA	1
4ECB	1
4ECC	1
4ECD	1
4ECE	1
4ECF	1
4ED0	1
4ED1	1
4ED2	1
4ED3	1
4ED4	1
4ED5	1
4ED6	1
4ED7	1
4ED8	1
4ED9	1
4EDA	1
4EDB	1
4EDC	1
4EDD	1
4EDE	1
4EDF	1
4EE0	1
4EE1	1
4EE2	1
4EE3	1
4EE4	1
4EE5	1
4EE6	1
4EE7	1
4EE8	1
4EE9	1
4EEA	1
4EEB	1
4EEC	1
4EED	1
4EEE	1
4EEF	1
4EF0	1
4EF1	1
4EF2	1
4EF3	1
4EF4	1
4EF5	1
4EF6	1
4EF7	1
4EF8	1
4EF9	1
4EFA	1
4EFB	1
4EFC	1
4EFD	1
4EFE	1
4EFF	1
4F00	1
4F01	1
4F02	1
4F03	1
4F04	1
4F05	1
4F06	1
4F07	1
4F08	1
4F09	1
4F0A	1
4F0B	1
4F0C	1
4F0D	1
4F0E	1
4F0F	1
4F10	1
4F11	1
4F12	1
4F13	1
4F14	1
4F15	1
4F16	1
4F17	1
4F18	1
4F19	1
4F1A	1
4F1B	1
4F1C	1
4F1D	1
4F1E	1
4F1F	1
4F20	1
4F21	1
4F22	1
4F23	1
4F24	1
4F25	1
4F26	1
4F27	1
4F28	1
4F29	1
4F2A	1
4F2B	1
4F2C	1
4F2D	1
4F2E	1
4F2F	1
4F30	1
4F31	1
4F32	1
4F33	1
4F34	1
4F35	1
4F36	1
4F37	1
4F38	1
4F39	1
4F3A	1
4F3B	1
4F3C	1
4F3D	1
4F3E	1
4F3F	1
4F40	1
4F41	1
4F42	1
4F43	1
4F44	1
4F45	1
4F46	1
4F47	1
4F48	1
4F49	1
4F4A	1
4F4B	1
4F4C	1
4F4D	1
4F4E	1
4F4F	1
4F50	1
4F51	1
4F52	1
4F53	1
4F54	1
4F55	1
4F56	1
4F57	1
4F58	1
4F59	1
4F5A	1
4F5B	1
4F5C	1
4F5D	1
4F5E	1
4F5F	1
4F60	1
4F61	1
4F62	1
4F63	1
4F64	1
4F65	1
4F66	1
4F67	1
4F68	1
4F69	1
4F6A	1
4F6B	1
4F6C	1
4F6D	1
4F6E	1
4F6F	1
4F70	1
4F71	1
4F72	1
4F73	1
4F74	1
4F75	1
4F76	1
4F77	1
4F78	1
4F79	1
4F7A	1
4F7B	1
4F7C	1
4F7D	1
4F7E	1
4F7F	1
4F80	1
4F81	1
4F82	1
4F83	1
4F84	1
4F85	1
4F86	1
4F87	1
4F88	1
4F89	1
4F8A	1
4F8B	1
4F8C	1
4F8D	1
4F8E	1
4F8F	1
4F90	1
4F91	1
4F92	1
4F93	1
4F94	1
4F95	1
4F96	1
4F97	1
4F98	1
4F99	1
4F9A	1
4F9B	1
4F9C	1
4F9D	1
4F9E	1
4F9F	1
4FA0	1
4FA1	1
4FA2	1
4FA3	1
4FA4	1
4FA5	1
4FA6	1
4FA7	1
4FA8	1
4FA9	1
4FAA	1
4FAB	1
4FAC	1
4FAD	1
4FAE	1
4FAF	1
4FB0	1
4FB1	1
4FB2	1
4FB3	1
4FB4	1
4FB5	1
4FB6	1
4FB7	1
4FB8	1
4FB9	1
4FBA	1
4FBB	1
4FBC	1
4FBD	1
4FBE	1
4FBF	1
4FC0	1
4FC1	1
4FC2	1
4FC3	1
4FC4	1
4FC5	1
4FC6	1
4FC7	1
4FC8	1
4FC9	1
4FCA	1
4FCB	1
4FCC	1
4FCD	1
4FCE	1
4FCF	1
4FD0	1
4FD1	1
4FD2	1
4FD3	1
4FD4	1
4FD5	1
4FD6	1
4FD7	1
4FD8	1
4FD9	1
4FDA	1
4FDB	1
4FDC	1
4FDD	1
4FDE	1
4FDF	1
4FE0	1
4FE1	1
4FE2	1
4FE3	1
4FE4	1
4FE5	1
4FE6	1
4FE7	1
4FE8	1
4FE9	1
4FEA	1
4FEB	1
4FEC	1
4FED	1
4FEE	1
4FEF	1
4FF0	1
4FF1	1
4FF2	1
4FF3	1
4FF4	1
4FF5	1
4FF6	1
4FF7	1
4FF8	1
4FF9	1
4FFA	1
4FFB	1
4FFC	1
4FFD	1
4FFE	1
4FFF	1
237	1
238	1
239	1
23A	1
23B	1
23C	1
23D	1
23E	1
23F	1
240	1
241	1
242	1
243	1
244	1
245	1
246	1
247	1
248	1
249	1
24A	1
24B	1
24C	1
24D	1
24E	1
24F	1
358	1
359	1
35A	1
35B	1
35C	1
370	1
371	1
372	1
373	1
376	1
377	1
378	1
379	1
37B	1
37C	1
37D	1
37F	1
380	1
381	1
382	1
383	1
38B	1
38D	1
3A2	1
3CF	1
3FC	1
3FD	1
3FE	1
3FF	1
487	1
4CF	1
4F6	1
4F7	1
4FA	1
4FB	1
4FC	1
4FD	1
4FE	1
4FF	1
510	1
511	1
512	1
513	1
514	1
515	1
516	1
517	1
518	1
519	1
51A	1
51B	1
51C	1
51D	1
51E	1
51F	1
520	1
521	1
522	1
523	1
524	1
525	1
526	1
527	1
528	1
529	1
52A	1
52B	1
52C	1
52D	1
52E	1
52F	1
530	1
557	1
558	1
560	1
588	1
58B	1
58C	1
58D	1
58E	1
58F	1
590	1
5A2	1
5BA	1
5C5	1
5C6	1
5C7	1
5C8	1
5C9	1
5CA	1
5CB	1
5CC	1
5CD	1
5CE	1
5CF	1
5EB	1
5EC	1
5ED	1
5EE	1
5EF	1
5F5	1
5F6	1
5F7	1
5F8	1
5F9	1
5FA	1
5FB	1
5FC	1
5FD	1
5FE	1
5FF	1
604	1
605	1
606	1
607	1
608	1
609	1
60A	1
60B	1
616	1
617	1
618	1
619	1
61A	1
61C	1
61D	1
61E	1
620	1
63B	1
63C	1
63D	1
63E	1
63F	1
659	1
65A	1
65B	1
65C	1
65D	1
65E	1
65F	1
70E	1
74B	1
74C	1
750	1
751	1
752	1
753	1
754	1
755	1
756	1
757	1
758	1
759	1
75A	1
75B	1
75C	1
75D	1
75E	1
75F	1
760	1
761	1
762	1
763	1
764	1
765	1
766	1
767	1
768	1
769	1
76A	1
76B	1
76C	1
76D	1
76E	1
76F	1
770	1
771	1
772	1
773	1
774	1
775	1
776	1
777	1
778	1
779	1
77A	1
77B	1
77C	1
77D	1
77E	1
77F	1
7B2	1
7B3	1
7B4	1
7B5	1
7B6	1
7B7	1
7B8	1
7B9	1
7BA	1
7BB	1
7BC	1
7BD	1
7BE	1
7BF	1
7C0	1
7C1	1
7C2	1
7C3	1
7C4	1
7C5	1
7C6	1
7C7	1
7C8	1
7C9	1
7CA	1
7CB	1
7CC	1
7CD	1
7CE	1
7CF	1
7D0	1
7D1	1
7D2	1
7D3	1
7D4	1
7D5	1
7D6	1
7D7	1
7D8	1
7D9	1
7DA	1
7DB	1
7DC	1
7DD	1
7DE	1
7DF	1
7E0	1
7E1	1
7E2	1
7E3	1
7E4	1
7E5	1
7E6	1
7E7	1
7E8	1
7E9	1
7EA	1
7EB	1
7EC	1
7ED	1
7EE	1
7EF	1
7F0	1
7F1	1
7F2	1
7F3	1
7F4	1
7F5	1
7F6	1
7F7	1
7F8	1
7F9	1
7FA	1
7FB	1
7FC	1
7FD	1
7FE	1
7FF	1
DROP TABLE IF EXISTS test.t1;
DROP TABLE IF EXISTS test.t1;
DROP DATABASE test;
CREATE DATABASE test CHARACTER SET utf8mb3;
USE test;
SET NAMES utf8mb3;
Warnings:
Warning	1287	'utf8mb3' is deprecated and will be removed in a future release. Please use utf8mb4 instead
CREATE TABLE test.t1 (a CHAR(4) CHARACTER SET utf8mb3) ENGINE=MyISAM CHARACTER SET utf8mb3;
Warnings:
Warning	1287	'utf8mb3' is deprecated and will be removed in a future release. Please use utf8mb4 instead
Warning	1287	'utf8mb3' is deprecated and will be removed in a future release. Please use utf8mb4 instead
SHOW TABLE STATUS LIKE 't1';
Name	Engine	Version	Row_format	Rows	Avg_row_length	Data_length	Max_data_length	Index_length	Data_free	Auto_increment	Create_time	Update_time	Check_time	Collation	Checksum	Create_options	Comment
t1	MyISAM	#	#	#	#	#	#	#	#	#	#	#	#	utf8mb3_general_ci	#	#	#
LOAD DATA INFILE 
'MYSQL_TEST_DIR/suite/funcs_2/data/charset_utf8.txt' INTO TABLE test.t1;
ALTER TABLE test.t1 CHANGE a a CHAR(4) CHARACTER SET ucs2 COLLATE ucs2_spanish2_ci;
Warnings:
Warning	1287	'ucs2' is deprecated and will be removed in a future release. Please use utf8mb4 instead
Warning	4079	'ucs2_spanish2_ci' is a collation of the deprecated character set ucs2. Please consider using utf8mb4 with an appropriate collation instead.
DELETE FROM test.t1 WHERE CHAR_LENGTH(a) <> 1;
SELECT HEX(ORD(a)) AS a_ord, CHAR_LENGTH(a) AS a_len FROM test.t1 ORDER BY a, ORD(a);
a_ord	a_len
85	1
7F	1
80	1
81	1
82	1
83	1
84	1
86	1
87	1
88	1
89	1
8A	1
8B	1
8C	1
8D	1
8E	1
8F	1
90	1
91	1
92	1
93	1
94	1
95	1
96	1
97	1
98	1
99	1
9A	1
9B	1
9C	1
9D	1
9E	1
9F	1
A0	1
300	1
301	1
302	1
303	1
304	1
305	1
306	1
307	1
308	1
309	1
30A	1
30B	1
30C	1
30D	1
30E	1
30F	1
310	1
311	1
312	1
313	1
314	1
315	1
316	1
317	1
318	1
319	1
31A	1
31B	1
31C	1
31D	1
31E	1
31F	1
320	1
321	1
322	1
323	1
324	1
325	1
326	1
327	1
328	1
329	1
32A	1
32B	1
32C	1
32D	1
32E	1
32F	1
330	1
331	1
332	1
333	1
334	1
335	1
336	1
337	1
338	1
339	1
33A	1
33B	1
33C	1
33D	1
33E	1
33F	1
340	1
341	1
342	1
343	1
344	1
345	1
346	1
347	1
348	1
349	1
34A	1
34B	1
34C	1
34D	1
34E	1
34F	1
350	1
351	1
352	1
353	1
354	1
355	1
356	1
357	1
35D	1
35E	1
35F	1
360	1
361	1
362	1
483	1
484	1
485	1
486	1
488	1
489	1
591	1
592	1
593	1
594	1
595	1
596	1
597	1
598	1
599	1
59A	1
59B	1
59C	1
59D	1
59E	1
59F	1
5A0	1
5A1	1
5A3	1
5A4	1
5A5	1
5A6	1
5A7	1
5A8	1
5A9	1
5AA	1
5AB	1
5AC	1
5AD	1
5AE	1
5AF	1
5B0	1
5B1	1
5B2	1
5B3	1
5B4	1
5B5	1
5B6	1
5B7	1
5B8	1
5B9	1
5BB	1
5BC	1
5BD	1
5BF	1
5C1	1
5C2	1
5C4	1
600	1
601	1
602	1
603	1
610	1
611	1
612	1
613	1
614	1
615	1
64B	1
64C	1
64D	1
64E	1
64F	1
650	1
651	1
652	1
653	1
654	1
655	1
656	1
657	1
658	1
670	1
6D6	1
6D7	1
6D8	1
6D9	1
6DA	1
6DB	1
6DC	1
6DD	1
6DE	1
6DF	1
6E0	1
6E1	1
6E2	1
6E3	1
6E4	1
6E7	1
6E8	1
6EA	1
6EB	1
6EC	1
6ED	1
70F	1
711	1
730	1
731	1
732	1
733	1
734	1
735	1
736	1
737	1
738	1
739	1
73A	1
73B	1
73C	1
73D	1
73E	1
73F	1
740	1
741	1
742	1
743	1
744	1
745	1
746	1
747	1
748	1
749	1
74A	1
640	1
60	1
B4	1
384	1
2DC	1
5E	1
AF	1
2D8	1
2D9	1
A8	1
385	1
2DA	1
2DD	1
B8	1
2DB	1
5F	1
AD	1
2D	1
58A	1
2C	1
55D	1
60C	1
60D	1
66B	1
66C	1
3B	1
37E	1
61B	1
3A	1
589	1
703	1
704	1
705	1
706	1
707	1
708	1
21	1
A1	1
55C	1
3F	1
BF	1
55E	1
61F	1
709	1
2E	1
6D4	1
701	1
702	1
B7	1
387	1
700	1
27	1
22	1
AB	1
BB	1
28	1
29	1
5B	1
7B	1
7D	1
A7	1
B6	1
A9	1
AE	1
40	1
2A	1
66D	1
2F	1
26	1
23	1
25	1
66A	1
55A	1
55B	1
55F	1
5BE	1
5C0	1
5C3	1
5F3	1
5F4	1
70A	1
70B	1
70C	1
70D	1
2B9	1
374	1
375	1
2BA	1
2C2	1
2C3	1
2C4	1
2C5	1
2C6	1
2C7	1
2C8	1
2C9	1
2CA	1
2CB	1
2CC	1
2CD	1
2CE	1
2CF	1
2D2	1
2D3	1
2D4	1
2D5	1
2D6	1
2D7	1
2DE	1
2DF	1
2E5	1
2E6	1
2E7	1
2E8	1
2E9	1
2EA	1
2EB	1
2EC	1
2ED	1
2EF	1
2F0	1
2F1	1
2F2	1
2F3	1
2F4	1
2F5	1
2F6	1
2F7	1
2F8	1
2F9	1
2FA	1
2FB	1
2FC	1
2FD	1
2FE	1
2FF	1
B0	1
482	1
60E	1
60F	1
6E9	1
3F6	1
2B	1
B1	1
F7	1
D7	1
3C	1
3D	1
3E	1
AC	1
7C	1
A6	1
7E	1
2D0	1
2D1	1
A4	1
A2	1
24	1
A3	1
A5	1
30	1
660	1
6F0	1
31	1
B9	1
661	1
6F1	1
BD	1
BC	1
32	1
B2	1
662	1
6F2	1
33	1
B3	1
663	1
6F3	1
BE	1
34	1
664	1
6F4	1
35	1
665	1
6F5	1
36	1
666	1
6F6	1
37	1
667	1
6F7	1
38	1
668	1
6F8	1
39	1
669	1
6F9	1
41	1
61	1
AA	1
C0	1
C1	1
C2	1
C3	1
C4	1
C5	1
E0	1
E1	1
E2	1
E3	1
E4	1
E5	1
100	1
101	1
102	1
103	1
104	1
105	1
1CD	1
1CE	1
1DE	1
1DF	1
1E0	1
1E1	1
1FA	1
1FB	1
200	1
201	1
202	1
203	1
226	1
227	1
363	1
C6	1
E6	1
1E2	1
1E3	1
1FC	1
1FD	1
250	1
251	1
252	1
42	1
62	1
299	1
180	1
181	1
253	1
182	1
183	1
43	1
63	1
C7	1
E7	1
106	1
107	1
108	1
109	1
10A	1
10B	1
10C	1
10D	1
368	1
187	1
188	1
255	1
44	1
64	1
10E	1
10F	1
369	1
1C4	1
1C5	1
1C6	1
1F1	1
1F2	1
1F3	1
2A3	1
2A5	1
2A4	1
110	1
111	1
189	1
256	1
18A	1
257	1
18B	1
18C	1
221	1
D0	1
F0	1
45	1
65	1
C8	1
C9	1
CA	1
CB	1
E8	1
E9	1
EA	1
EB	1
112	1
113	1
114	1
115	1
116	1
117	1
118	1
119	1
11A	1
11B	1
204	1
205	1
206	1
207	1
228	1
229	1
364	1
18E	1
1DD	1
18F	1
259	1
190	1
25B	1
258	1
25A	1
25C	1
25D	1
25E	1
29A	1
264	1
46	1
66	1
2A9	1
191	1
192	1
47	1
67	1
11C	1
11D	1
11E	1
11F	1
120	1
121	1
122	1
123	1
1E6	1
1E7	1
1F4	1
1F5	1
261	1
262	1
1E4	1
1E5	1
193	1
260	1
29B	1
194	1
263	1
2E0	1
1A2	1
1A3	1
48	1
68	1
124	1
125	1
21E	1
21F	1
2B0	1
36A	1
29C	1
195	1
1F6	1
126	1
127	1
266	1
2B1	1
267	1
2BB	1
2BD	1
49	1
69	1
CC	1
CD	1
CE	1
CF	1
EC	1
ED	1
EE	1
EF	1
128	1
129	1
12A	1
12B	1
12C	1
12D	1
12E	1
12F	1
130	1
1CF	1
1D0	1
208	1
209	1
20A	1
20B	1
365	1
132	1
133	1
131	1
26A	1
197	1
268	1
196	1
269	1
4A	1
6A	1
134	1
135	1
1F0	1
2B2	1
29D	1
25F	1
284	1
4B	1
6B	1
136	1
137	1
1E8	1
1E9	1
198	1
199	1
29E	1
4C	1
6C	1
139	1
13A	1
13B	1
13C	1
13D	1
13E	1
2E1	1
13F	1
140	1
1C7	1
1C8	1
1C9	1
2AA	1
2AB	1
29F	1
141	1
142	1
19A	1
26B	1
26C	1
26D	1
234	1
26E	1
19B	1
28E	1
4D	1
6D	1
36B	1
271	1
4E	1
6E	1
143	1
144	1
145	1
146	1
147	1
148	1
1F8	1
1F9	1
1CA	1
1CB	1
1CC	1
D1	1
F1	1
274	1
19D	1
272	1
19E	1
220	1
273	1
235	1
14A	1
14B	1
4F	1
6F	1
BA	1
D2	1
D3	1
D4	1
D5	1
D6	1
F2	1
F3	1
F4	1
F5	1
F6	1
14C	1
14D	1
14E	1
14F	1
150	1
151	1
1A0	1
1A1	1
1D1	1
1D2	1
1EA	1
1EB	1
1EC	1
1ED	1
20C	1
20D	1
20E	1
20F	1
22A	1
22B	1
22C	1
22D	1
22E	1
22F	1
230	1
231	1
366	1
152	1
153	1
276	1
D8	1
F8	1
1FE	1
1FF	1
186	1
254	1
19F	1
275	1
277	1
222	1
223	1
50	1
70	1
1A4	1
1A5	1
278	1
51	1
71	1
2A0	1
138	1
52	1
72	1
154	1
155	1
156	1
157	1
158	1
159	1
210	1
211	1
212	1
213	1
2B3	1
36C	1
1A6	1
280	1
279	1
2B4	1
27A	1
27B	1
2B5	1
27C	1
27D	1
27E	1
27F	1
281	1
2B6	1
53	1
73	1
15A	1
15B	1
15C	1
15D	1
15E	1
15F	1
160	1
161	1
17F	1
218	1
219	1
2E2	1
DF	1
282	1
1A9	1
283	1
1AA	1
285	1
286	1
54	1
74	1
162	1
163	1
164	1
165	1
21A	1
21B	1
36D	1
2A8	1
1BE	1
2A6	1
2A7	1
166	1
167	1
1AB	1
1AC	1
1AD	1
1AE	1
288	1
236	1
287	1
55	1
75	1
D9	1
DA	1
DB	1
DC	1
F9	1
FA	1
FB	1
FC	1
168	1
169	1
16A	1
16B	1
16C	1
16D	1
16E	1
16F	1
170	1
171	1
172	1
173	1
1AF	1
1B0	1
1D3	1
1D4	1
1D5	1
1D6	1
1D7	1
1D8	1
1D9	1
1DA	1
1DB	1
1DC	1
214	1
215	1
216	1
217	1
367	1
289	1
265	1
2AE	1
2AF	1
19C	1
26F	1
270	1
1B1	1
28A	1
56	1
76	1
36E	1
1B2	1
28B	1
28C	1
57	1
77	1
174	1
175	1
2B7	1
28D	1
58	1
78	1
2E3	1
36F	1
59	1
79	1
DD	1
FD	1
FF	1
176	1
177	1
178	1
232	1
233	1
2B8	1
28F	1
1B3	1
1B4	1
5A	1
7A	1
179	1
17A	1
17B	1
17C	1
17D	1
17E	1
18D	1
1B5	1
1B6	1
224	1
225	1
290	1
291	1
1B7	1
1EE	1
1EF	1
292	1
1B8	1
1B9	1
1BA	1
293	1
21C	1
21D	1
DE	1
FE	1
1BF	1
1F7	1
1BB	1
1A7	1
1A8	1
1BC	1
1BD	1
184	1
185	1
294	1
2C0	1
2BC	1
149	1
2EE	1
2BE	1
295	1
2E4	1
2BF	1
2C1	1
2A1	1
2A2	1
296	1
1C0	1
1C1	1
1C2	1
1C3	1
297	1
298	1
2AC	1
2AD	1
386	1
391	1
3AC	1
3B1	1
392	1
3B2	1
3D0	1
393	1
3B3	1
394	1
3B4	1
388	1
395	1
3AD	1
3B5	1
3F5	1
3DC	1
3DD	1
3DA	1
3DB	1
396	1
3B6	1
389	1
397	1
3AE	1
3B7	1
398	1
3B8	1
3D1	1
3F4	1
37A	1
38A	1
390	1
399	1
3AA	1
3AF	1
3B9	1
3CA	1
3F3	1
39A	1
3BA	1
3F0	1
3D7	1
39B	1
3BB	1
B5	1
39C	1
3BC	1
39D	1
3BD	1
39E	1
3BE	1
38C	1
39F	1
3BF	1
3CC	1
3A0	1
3C0	1
3D6	1
3DE	1
3DF	1
3D8	1
3D9	1
3A1	1
3C1	1
3F1	1
3A3	1
3C2	1
3C3	1
3F2	1
3F9	1
3A4	1
3C4	1
38E	1
3A5	1
3AB	1
3B0	1
3C5	1
3CB	1
3CD	1
3D2	1
3D3	1
3D4	1
3A6	1
3C6	1
3D5	1
3A7	1
3C7	1
3A8	1
3C8	1
38F	1
3A9	1
3C9	1
3CE	1
3E0	1
3E1	1
3F7	1
3F8	1
3FA	1
3FB	1
3E2	1
3E3	1
3E4	1
3E5	1
3E6	1
3E7	1
3E8	1
3E9	1
3EA	1
3EB	1
3EC	1
3ED	1
3EE	1
3EF	1
410	1
430	1
4D0	1
4D1	1
4D2	1
4D3	1
4D8	1
4D9	1
4DA	1
4DB	1
4D4	1
4D5	1
411	1
431	1
412	1
432	1
413	1
433	1
490	1
491	1
492	1
493	1
494	1
495	1
414	1
434	1
500	1
501	1
402	1
452	1
502	1
503	1
403	1
453	1
498	1
499	1
400	1
401	1
415	1
435	1
450	1
451	1
4D6	1
4D7	1
404	1
454	1
416	1
436	1
4C1	1
4C2	1
4DC	1
4DD	1
496	1
497	1
417	1
437	1
504	1
505	1
4DE	1
4DF	1
405	1
455	1
4E0	1
4E1	1
506	1
507	1
40D	1
418	1
438	1
45D	1
4E2	1
4E3	1
48A	1
48B	1
4E4	1
4E5	1
406	1
456	1
407	1
457	1
419	1
439	1
408	1
458	1
41A	1
43A	1
49A	1
49B	1
4C3	1
4C4	1
4A0	1
4A1	1
49E	1
49F	1
49C	1
49D	1
41B	1
43B	1
4C5	1
4C6	1
409	1
459	1
508	1
509	1
41C	1
43C	1
4CD	1
4CE	1
41D	1
43D	1
4C9	1
4CA	1
4A2	1
4A3	1
4C7	1
4C8	1
4A4	1
4A5	1
40A	1
45A	1
50A	1
50B	1
41E	1
43E	1
4E6	1
4E7	1
4E8	1
4E9	1
4EA	1
4EB	1
41F	1
43F	1
4A6	1
4A7	1
480	1
481	1
420	1
440	1
48E	1
48F	1
421	1
441	1
50C	1
50D	1
4AA	1
4AB	1
422	1
442	1
50E	1
50F	1
4AC	1
4AD	1
40B	1
45B	1
40C	1
45C	1
423	1
443	1
4EE	1
4EF	1
40E	1
45E	1
4F0	1
4F1	1
4F2	1
4F3	1
4AE	1
4AF	1
4B0	1
4B1	1
478	1
479	1
424	1
444	1
425	1
445	1
4B2	1
4B3	1
4BA	1
4BB	1
460	1
461	1
47E	1
47F	1
47C	1
47D	1
47A	1
47B	1
426	1
446	1
4B4	1
4B5	1
427	1
447	1
4F4	1
4F5	1
4B6	1
4B7	1
4CB	1
4CC	1
4B8	1
4B9	1
4BC	1
4BD	1
4BE	1
4BF	1
40F	1
45F	1
428	1
448	1
429	1
449	1
42A	1
44A	1
42B	1
44B	1
4F8	1
4F9	1
42C	1
44C	1
48C	1
48D	1
462	1
463	1
42D	1
44D	1
4EC	1
4ED	1
42E	1
44E	1
42F	1
44F	1
464	1
465	1
466	1
467	1
46A	1
46B	1
468	1
469	1
46C	1
46D	1
46E	1
46F	1
470	1
471	1
472	1
473	1
474	1
475	1
476	1
477	1
4A8	1
4A9	1
4C0	1
531	1
561	1
532	1
562	1
533	1
563	1
534	1
564	1
535	1
565	1
587	1
536	1
566	1
537	1
567	1
538	1
568	1
539	1
569	1
53A	1
56A	1
53B	1
56B	1
53C	1
56C	1
53D	1
56D	1
53E	1
56E	1
53F	1
56F	1
540	1
570	1
541	1
571	1
542	1
572	1
543	1
573	1
544	1
574	1
545	1
575	1
546	1
576	1
547	1
577	1
548	1
578	1
549	1
579	1
54A	1
57A	1
54B	1
57B	1
54C	1
57C	1
54D	1
57D	1
54E	1
57E	1
54F	1
57F	1
550	1
580	1
551	1
581	1
552	1
582	1
553	1
583	1
554	1
584	1
555	1
585	1
556	1
586	1
559	1
5D0	1
5D1	1
5D2	1
5D3	1
5D4	1
5D5	1
5F0	1
5F1	1
5D6	1
5D7	1
5D8	1
5D9	1
5F2	1
5DA	1
5DB	1
5DC	1
5DD	1
5DE	1
5DF	1
5E0	1
5E1	1
5E2	1
5E3	1
5E4	1
5E5	1
5E6	1
5E7	1
5E8	1
5E9	1
5EA	1
621	1
674	1
6FD	1
622	1
623	1
672	1
671	1
624	1
625	1
673	1
626	1
627	1
675	1
66E	1
628	1
67B	1
67E	1
680	1
629	1
62A	1
62B	1
679	1
67A	1
67C	1
67D	1
67F	1
62C	1
683	1
684	1
686	1
6BF	1
687	1
62D	1
62E	1
681	1
682	1
685	1
62F	1
630	1
688	1
689	1
68A	1
68B	1
68C	1
68D	1
68E	1
68F	1
690	1
6EE	1
631	1
632	1
691	1
692	1
693	1
694	1
695	1
696	1
697	1
698	1
699	1
6EF	1
633	1
634	1
69A	1
69B	1
69C	1
6FA	1
635	1
636	1
69D	1
69E	1
6FB	1
637	1
638	1
69F	1
639	1
63A	1
6A0	1
6FC	1
641	1
6A1	1
6A2	1
6A3	1
6A4	1
6A5	1
6A6	1
66F	1
642	1
6A7	1
6A8	1
643	1
6A9	1
6AA	1
6AB	1
6AC	1
6AD	1
6AE	1
6AF	1
6B0	1
6B1	1
6B2	1
6B3	1
6B4	1
644	1
6B5	1
6B6	1
6B7	1
6B8	1
645	1
6FE	1
646	1
6BA	1
6BB	1
6BC	1
6BD	1
6B9	1
647	1
6BE	1
6C1	1
6C2	1
6C3	1
6FF	1
6C0	1
6D5	1
648	1
6E5	1
676	1
6C4	1
6C5	1
6C6	1
6C7	1
677	1
6C8	1
6C9	1
6CA	1
6CB	1
6CF	1
649	1
64A	1
6E6	1
678	1
6CC	1
6CD	1
6CE	1
6D0	1
6D1	1
6D2	1
6D3	1
710	1
712	1
72D	1
713	1
714	1
72E	1
716	1
715	1
72F	1
717	1
718	1
719	1
74D	1
71A	1
71B	1
71C	1
71D	1
71E	1
71F	1
74E	1
720	1
721	1
722	1
723	1
724	1
725	1
726	1
727	1
74F	1
728	1
729	1
72A	1
72B	1
72C	1
780	1
799	1
79A	1
781	1
782	1
783	1
79C	1
784	1
785	1
786	1
787	1
7A2	1
7A3	1
788	1
7A5	1
789	1
78A	1
78B	1
79B	1
78C	1
798	1
7A0	1
7A1	1
78D	1
78E	1
7A4	1
78F	1
790	1
79D	1
79E	1
79F	1
791	1
792	1
793	1
794	1
795	1
796	1
797	1
7B1	1
7A6	1
7A7	1
7A8	1
7A9	1
7AA	1
7AB	1
7AC	1
7AD	1
7AE	1
7AF	1
7B0	1
4E00	1
4E01	1
4E02	1
4E03	1
4E04	1
4E05	1
4E06	1
4E07	1
4E08	1
4E09	1
4E0A	1
4E0B	1
4E0C	1
4E0D	1
4E0E	1
4E0F	1
4E10	1
4E11	1
4E12	1
4E13	1
4E14	1
4E15	1
4E16	1
4E17	1
4E18	1
4E19	1
4E1A	1
4E1B	1
4E1C	1
4E1D	1
4E1E	1
4E1F	1
4E20	1
4E21	1
4E22	1
4E23	1
4E24	1
4E25	1
4E26	1
4E27	1
4E28	1
4E29	1
4E2A	1
4E2B	1
4E2C	1
4E2D	1
4E2E	1
4E2F	1
4E30	1
4E31	1
4E32	1
4E33	1
4E34	1
4E35	1
4E36	1
4E37	1
4E38	1
4E39	1
4E3A	1
4E3B	1
4E3C	1
4E3D	1
4E3E	1
4E3F	1
4E40	1
4E41	1
4E42	1
4E43	1
4E44	1
4E45	1
4E46	1
4E47	1
4E48	1
4E49	1
4E4A	1
4E4B	1
4E4C	1
4E4D	1
4E4E	1
4E4F	1
4E50	1
4E51	1
4E52	1
4E53	1
4E54	1
4E55	1
4E56	1
4E57	1
4E58	1
4E59	1
4E5A	1
4E5B	1
4E5C	1
4E5D	1
4E5E	1
4E5F	1
4E60	1
4E61	1
4E62	1
4E63	1
4E64	1
4E65	1
4E66	1
4E67	1
4E68	1
4E69	1
4E6A	1
4E6B	1
4E6C	1
4E6D	1
4E6E	1
4E6F	1
4E70	1
4E71	1
4E72	1
4E73	1
4E74	1
4E75	1
4E76	1
4E77	1
4E78	1
4E79	1
4E7A	1
4E7B	1
4E7C	1
4E7D	1
4E7E	1
4E7F	1
4E80	1
4E81	1
4E82	1
4E83	1
4E84	1
4E85	1
4E86	1
4E87	1
4E88	1
4E89	1
4E8A	1
4E8B	1
4E8C	1
4E8D	1
4E8E	1
4E8F	1
4E90	1
4E91	1
4E92	1
4E93	1
4E94	1
4E95	1
4E96	1
4E97	1
4E98	1
4E99	1
4E9A	1
4E9B	1
4E9C	1
4E9D	1
4E9E	1
4E9F	1
4EA0	1
4EA1	1
4EA2	1
4EA3	1
4EA4	1
4EA5	1
4EA6	1
4EA7	1
4EA8	1
4EA9	1
4EAA	1
4EAB	1
4EAC	1
4EAD	1
4EAE	1
4EAF	1
4EB0	1
4EB1	1
4EB2	1
4EB3	1
4EB4	1
4EB5	1
4EB6	1
4EB7	1
4EB8	1
4EB9	1
4EBA	1
4EBB	1
4EBC	1
4EBD	1
4EBE	1
4EBF	1
4EC0	1
4EC1	1
4EC2	1
4EC3	1
4EC4	1
4EC5	1
4EC6	1
4EC7	1
4EC8	1
4EC9	1
4ECA	1
4ECB	1
4ECC	1
4ECD	1
4ECE	1
4ECF	1
4ED0	1
4ED1	1
4ED2	1
4ED3	1
4ED4	1
4ED5	1
4ED6	1
4ED7	1
4ED8	1
4ED9	1
4EDA	1
4EDB	1
4EDC	1
4EDD	1
4EDE	1
4EDF	1
4EE0	1
4EE1	1
4EE2	1
4EE3	1
4EE4	1
4EE5	1
4EE6	1
4EE7	1
4EE8	1
4EE9	1
4EEA	1
4EEB	1
4EEC	1
4EED	1
4EEE	1
4EEF	1
4EF0	1
4EF1	1
4EF2	1
4EF3	1
4EF4	1
4EF5	1
4EF6	1
4EF7	1
4EF8	1
4EF9	1
4EFA	1
4EFB	1
4EFC	1
4EFD	1
4EFE	1
4EFF	1
4F00	1
4F01	1
4F02	1
4F03	1
4F04	1
4F05	1
4F06	1
4F07	1
4F08	1
4F09	1
4F0A	1
4F0B	1
4F0C	1
4F0D	1
4F0E	1
4F0F	1
4F10	1
4F11	1
4F12	1
4F13	1
4F14	1
4F15	1
4F16	1
4F17	1
4F18	1
4F19	1
4F1A	1
4F1B	1
4F1C	1
4F1D	1
4F1E	1
4F1F	1
4F20	1
4F21	1
4F22	1
4F23	1
4F24	1
4F25	1
4F26	1
4F27	1
4F28	1
4F29	1
4F2A	1
4F2B	1
4F2C	1
4F2D	1
4F2E	1
4F2F	1
4F30	1
4F31	1
4F32	1
4F33	1
4F34	1
4F35	1
4F36	1
4F37	1
4F38	1
4F39	1
4F3A	1
4F3B	1
4F3C	1
4F3D	1
4F3E	1
4F3F	1
4F40	1
4F41	1
4F42	1
4F43	1
4F44	1
4F45	1
4F46	1
4F47	1
4F48	1
4F49	1
4F4A	1
4F4B	1
4F4C	1
4F4D	1
4F4E	1
4F4F	1
4F50	1
4F51	1
4F52	1
4F53	1
4F54	1
4F55	1
4F56	1
4F57	1
4F58	1
4F59	1
4F5A	1
4F5B	1
4F5C	1
4F5D	1
4F5E	1
4F5F	1
4F60	1
4F61	1
4F62	1
4F63	1
4F64	1
4F65	1
4F66	1
4F67	1
4F68	1
4F69	1
4F6A	1
4F6B	1
4F6C	1
4F6D	1
4F6E	1
4F6F	1
4F70	1
4F71	1
4F72	1
4F73	1
4F74	1
4F75	1
4F76	1
4F77	1
4F78	1
4F79	1
4F7A	1
4F7B	1
4F7C	1
4F7D	1
4F7E	1
4F7F	1
4F80	1
4F81	1
4F82	1
4F83	1
4F84	1
4F85	1
4F86	1
4F87	1
4F88	1
4F89	1
4F8A	1
4F8B	1
4F8C	1
4F8D	1
4F8E	1
4F8F	1
4F90	1
4F91	1
4F92	1
4F93	1
4F94	1
4F95	1
4F96	1
4F97	1
4F98	1
4F99	1
4F9A	1
4F9B	1
4F9C	1
4F9D	1
4F9E	1
4F9F	1
4FA0	1
4FA1	1
4FA2	1
4FA3	1
4FA4	1
4FA5	1
4FA6	1
4FA7	1
4FA8	1
4FA9	1
4FAA	1
4FAB	1
4FAC	1
4FAD	1
4FAE	1
4FAF	1
4FB0	1
4FB1	1
4FB2	1
4FB3	1
4FB4	1
4FB5	1
4FB6	1
4FB7	1
4FB8	1
4FB9	1
4FBA	1
4FBB	1
4FBC	1
4FBD	1
4FBE	1
4FBF	1
4FC0	1
4FC1	1
4FC2	1
4FC3	1
4FC4	1
4FC5	1
4FC6	1
4FC7	1
4FC8	1
4FC9	1
4FCA	1
4FCB	1
4FCC	1
4FCD	1
4FCE	1
4FCF	1
4FD0	1
4FD1	1
4FD2	1
4FD3	1
4FD4	1
4FD5	1
4FD6	1
4FD7	1
4FD8	1
4FD9	1
4FDA	1
4FDB	1
4FDC	1
4FDD	1
4FDE	1
4FDF	1
4FE0	1
4FE1	1
4FE2	1
4FE3	1
4FE4	1
4FE5	1
4FE6	1
4FE7	1
4FE8	1
4FE9	1
4FEA	1
4FEB	1
4FEC	1
4FED	1
4FEE	1
4FEF	1
4FF0	1
4FF1	1
4FF2	1
4FF3	1
4FF4	1
4FF5	1
4FF6	1
4FF7	1
4FF8	1
4FF9	1
4FFA	1
4FFB	1
4FFC	1
4FFD	1
4FFE	1
4FFF	1
237	1
238	1
239	1
23A	1
23B	1
23C	1
23D	1
23E	1
23F	1
240	1
241	1
242	1
243	1
244	1
245	1
246	1
247	1
248	1
249	1
24A	1
24B	1
24C	1
24D	1
24E	1
24F	1
358	1
359	1
35A	1
35B	1
35C	1
370	1
371	1
372	1
373	1
376	1
377	1
378	1
379	1
37B	1
37C	1
37D	1
37F	1
380	1
381	1
382	1
383	1
38B	1
38D	1
3A2	1
3CF	1
3FC	1
3FD	1
3FE	1
3FF	1
487	1
4CF	1
4F6	1
4F7	1
4FA	1
4FB	1
4FC	1
4FD	1
4FE	1
4FF	1
510	1
511	1
512	1
513	1
514	1
515	1
516	1
517	1
518	1
519	1
51A	1
51B	1
51C	1
51D	1
51E	1
51F	1
520	1
521	1
522	1
523	1
524	1
525	1
526	1
527	1
528	1
529	1
52A	1
52B	1
52C	1
52D	1
52E	1
52F	1
530	1
557	1
558	1
560	1
588	1
58B	1
58C	1
58D	1
58E	1
58F	1
590	1
5A2	1
5BA	1
5C5	1
5C6	1
5C7	1
5C8	1
5C9	1
5CA	1
5CB	1
5CC	1
5CD	1
5CE	1
5CF	1
5EB	1
5EC	1
5ED	1
5EE	1
5EF	1
5F5	1
5F6	1
5F7	1
5F8	1
5F9	1
5FA	1
5FB	1
5FC	1
5FD	1
5FE	1
5FF	1
604	1
605	1
606	1
607	1
608	1
609	1
60A	1
60B	1
616	1
617	1
618	1
619	1
61A	1
61C	1
61D	1
61E	1
620	1
63B	1
63C	1
63D	1
63E	1
63F	1
659	1
65A	1
65B	1
65C	1
65D	1
65E	1
65F	1
70E	1
74B	1
74C	1
750	1
751	1
752	1
753	1
754	1
755	1
756	1
757	1
758	1
759	1
75A	1
75B	1
75C	1
75D	1
75E	1
75F	1
760	1
761	1
762	1
763	1
764	1
765	1
766	1
767	1
768	1
769	1
76A	1
76B	1
76C	1
76D	1
76E	1
76F	1
770	1
771	1
772	1
773	1
774	1
775	1
776	1
777	1
778	1
779	1
77A	1
77B	1
77C	1
77D	1
77E	1
77F	1
7B2	1
7B3	1
7B4	1
7B5	1
7B6	1
7B7	1
7B8	1
7B9	1
7BA	1
7BB	1
7BC	1
7BD	1
7BE	1
7BF	1
7C0	1
7C1	1
7C2	1
7C3	1
7C4	1
7C5	1
7C6	1
7C7	1
7C8	1
7C9	1
7CA	1
7CB	1
7CC	1
7CD	1
7CE	1
7CF	1
7D0	1
7D1	1
7D2	1
7D3	1
7D4	1
7D5	1
7D6	1
7D7	1
7D8	1
7D9	1
7DA	1
7DB	1
7DC	1
7DD	1
7DE	1
7DF	1
7E0	1
7E1	1
7E2	1
7E3	1
7E4	1
7E5	1
7E6	1
7E7	1
7E8	1
7E9	1
7EA	1
7EB	1
7EC	1
7ED	1
7EE	1
7EF	1
7F0	1
7F1	1
7F2	1
7F3	1
7F4	1
7F5	1
7F6	1
7F7	1
7F8	1
7F9	1
7FA	1
7FB	1
7FC	1
7FD	1
7FE	1
7FF	1
DROP TABLE IF EXISTS test.t1;
DROP TABLE IF EXISTS test.t1;
DROP DATABASE test;
CREATE DATABASE test CHARACTER SET utf8mb3;
USE test;
SET NAMES utf8mb3;
Warnings:
Warning	1287	'utf8mb3' is deprecated and will be removed in a future release. Please use utf8mb4 instead
CREATE TABLE test.t1 (a CHAR(4) CHARACTER SET utf8mb3) ENGINE=MyISAM CHARACTER SET utf8mb3;
Warnings:
Warning	1287	'utf8mb3' is deprecated and will be removed in a future release. Please use utf8mb4 instead
Warning	1287	'utf8mb3' is deprecated and will be removed in a future release. Please use utf8mb4 instead
SHOW TABLE STATUS LIKE 't1';
Name	Engine	Version	Row_format	Rows	Avg_row_length	Data_length	Max_data_length	Index_length	Data_free	Auto_increment	Create_time	Update_time	Check_time	Collation	Checksum	Create_options	Comment
t1	MyISAM	#	#	#	#	#	#	#	#	#	#	#	#	utf8mb3_general_ci	#	#	#
LOAD DATA INFILE 
'MYSQL_TEST_DIR/suite/funcs_2/data/charset_utf8.txt' INTO TABLE test.t1;
ALTER TABLE test.t1 CHANGE a a CHAR(4) CHARACTER SET ucs2 COLLATE ucs2_spanish_ci;
Warnings:
Warning	1287	'ucs2' is deprecated and will be removed in a future release. Please use utf8mb4 instead
Warning	4079	'ucs2_spanish_ci' is a collation of the deprecated character set ucs2. Please consider using utf8mb4 with an appropriate collation instead.
DELETE FROM test.t1 WHERE CHAR_LENGTH(a) <> 1;
SELECT HEX(ORD(a)) AS a_ord, CHAR_LENGTH(a) AS a_len FROM test.t1 ORDER BY a, ORD(a);
a_ord	a_len
85	1
7F	1
80	1
81	1
82	1
83	1
84	1
86	1
87	1
88	1
89	1
8A	1
8B	1
8C	1
8D	1
8E	1
8F	1
90	1
91	1
92	1
93	1
94	1
95	1
96	1
97	1
98	1
99	1
9A	1
9B	1
9C	1
9D	1
9E	1
9F	1
A0	1
300	1
301	1
302	1
303	1
304	1
305	1
306	1
307	1
308	1
309	1
30A	1
30B	1
30C	1
30D	1
30E	1
30F	1
310	1
311	1
312	1
313	1
314	1
315	1
316	1
317	1
318	1
319	1
31A	1
31B	1
31C	1
31D	1
31E	1
31F	1
320	1
321	1
322	1
323	1
324	1
325	1
326	1
327	1
328	1
329	1
32A	1
32B	1
32C	1
32D	1
32E	1
32F	1
330	1
331	1
332	1
333	1
334	1
335	1
336	1
337	1
338	1
339	1
33A	1
33B	1
33C	1
33D	1
33E	1
33F	1
340	1
341	1
342	1
343	1
344	1
345	1
346	1
347	1
348	1
349	1
34A	1
34B	1
34C	1
34D	1
34E	1
34F	1
350	1
351	1
352	1
353	1
354	1
355	1
356	1
357	1
35D	1
35E	1
35F	1
360	1
361	1
362	1
483	1
484	1
485	1
486	1
488	1
489	1
591	1
592	1
593	1
594	1
595	1
596	1
597	1
598	1
599	1
59A	1
59B	1
59C	1
59D	1
59E	1
59F	1
5A0	1
5A1	1
5A3	1
5A4	1
5A5	1
5A6	1
5A7	1
5A8	1
5A9	1
5AA	1
5AB	1
5AC	1
5AD	1
5AE	1
5AF	1
5B0	1
5B1	1
5B2	1
5B3	1
5B4	1
5B5	1
5B6	1
5B7	1
5B8	1
5B9	1
5BB	1
5BC	1
5BD	1
5BF	1
5C1	1
5C2	1
5C4	1
600	1
601	1
602	1
603	1
610	1
611	1
612	1
613	1
614	1
615	1
64B	1
64C	1
64D	1
64E	1
64F	1
650	1
651	1
652	1
653	1
654	1
655	1
656	1
657	1
658	1
670	1
6D6	1
6D7	1
6D8	1
6D9	1
6DA	1
6DB	1
6DC	1
6DD	1
6DE	1
6DF	1
6E0	1
6E1	1
6E2	1
6E3	1
6E4	1
6E7	1
6E8	1
6EA	1
6EB	1
6EC	1
6ED	1
70F	1
711	1
730	1
731	1
732	1
733	1
734	1
735	1
736	1
737	1
738	1
739	1
73A	1
73B	1
73C	1
73D	1
73E	1
73F	1
740	1
741	1
742	1
743	1
744	1
745	1
746	1
747	1
748	1
749	1
74A	1
640	1
60	1
B4	1
384	1
2DC	1
5E	1
AF	1
2D8	1
2D9	1
A8	1
385	1
2DA	1
2DD	1
B8	1
2DB	1
5F	1
AD	1
2D	1
58A	1
2C	1
55D	1
60C	1
60D	1
66B	1
66C	1
3B	1
37E	1
61B	1
3A	1
589	1
703	1
704	1
705	1
706	1
707	1
708	1
21	1
A1	1
55C	1
3F	1
BF	1
55E	1
61F	1
709	1
2E	1
6D4	1
701	1
702	1
B7	1
387	1
700	1
27	1
22	1
AB	1
BB	1
28	1
29	1
5B	1
7B	1
7D	1
A7	1
B6	1
A9	1
AE	1
40	1
2A	1
66D	1
2F	1
26	1
23	1
25	1
66A	1
55A	1
55B	1
55F	1
5BE	1
5C0	1
5C3	1
5F3	1
5F4	1
70A	1
70B	1
70C	1
70D	1
2B9	1
374	1
375	1
2BA	1
2C2	1
2C3	1
2C4	1
2C5	1
2C6	1
2C7	1
2C8	1
2C9	1
2CA	1
2CB	1
2CC	1
2CD	1
2CE	1
2CF	1
2D2	1
2D3	1
2D4	1
2D5	1
2D6	1
2D7	1
2DE	1
2DF	1
2E5	1
2E6	1
2E7	1
2E8	1
2E9	1
2EA	1
2EB	1
2EC	1
2ED	1
2EF	1
2F0	1
2F1	1
2F2	1
2F3	1
2F4	1
2F5	1
2F6	1
2F7	1
2F8	1
2F9	1
2FA	1
2FB	1
2FC	1
2FD	1
2FE	1
2FF	1
B0	1
482	1
60E	1
60F	1
6E9	1
3F6	1
2B	1
B1	1
F7	1
D7	1
3C	1
3D	1
3E	1
AC	1
7C	1
A6	1
7E	1
2D0	1
2D1	1
A4	1
A2	1
24	1
A3	1
A5	1
30	1
660	1
6F0	1
31	1
B9	1
661	1
6F1	1
BD	1
BC	1
32	1
B2	1
662	1
6F2	1
33	1
B3	1
663	1
6F3	1
BE	1
34	1
664	1
6F4	1
35	1
665	1
6F5	1
36	1
666	1
6F6	1
37	1
667	1
6F7	1
38	1
668	1
6F8	1
39	1
669	1
6F9	1
41	1
61	1
AA	1
C0	1
C1	1
C2	1
C3	1
C4	1
C5	1
E0	1
E1	1
E2	1
E3	1
E4	1
E5	1
100	1
101	1
102	1
103	1
104	1
105	1
1CD	1
1CE	1
1DE	1
1DF	1
1E0	1
1E1	1
1FA	1
1FB	1
200	1
201	1
202	1
203	1
226	1
227	1
363	1
C6	1
E6	1
1E2	1
1E3	1
1FC	1
1FD	1
250	1
251	1
252	1
42	1
62	1
299	1
180	1
181	1
253	1
182	1
183	1
43	1
63	1
C7	1
E7	1
106	1
107	1
108	1
109	1
10A	1
10B	1
10C	1
10D	1
368	1
187	1
188	1
255	1
44	1
64	1
10E	1
10F	1
369	1
1C4	1
1C5	1
1C6	1
1F1	1
1F2	1
1F3	1
2A3	1
2A5	1
2A4	1
110	1
111	1
189	1
256	1
18A	1
257	1
18B	1
18C	1
221	1
D0	1
F0	1
45	1
65	1
C8	1
C9	1
CA	1
CB	1
E8	1
E9	1
EA	1
EB	1
112	1
113	1
114	1
115	1
116	1
117	1
118	1
119	1
11A	1
11B	1
204	1
205	1
206	1
207	1
228	1
229	1
364	1
18E	1
1DD	1
18F	1
259	1
190	1
25B	1
258	1
25A	1
25C	1
25D	1
25E	1
29A	1
264	1
46	1
66	1
2A9	1
191	1
192	1
47	1
67	1
11C	1
11D	1
11E	1
11F	1
120	1
121	1
122	1
123	1
1E6	1
1E7	1
1F4	1
1F5	1
261	1
262	1
1E4	1
1E5	1
193	1
260	1
29B	1
194	1
263	1
2E0	1
1A2	1
1A3	1
48	1
68	1
124	1
125	1
21E	1
21F	1
2B0	1
36A	1
29C	1
195	1
1F6	1
126	1
127	1
266	1
2B1	1
267	1
2BB	1
2BD	1
49	1
69	1
CC	1
CD	1
CE	1
CF	1
EC	1
ED	1
EE	1
EF	1
128	1
129	1
12A	1
12B	1
12C	1
12D	1
12E	1
12F	1
130	1
1CF	1
1D0	1
208	1
209	1
20A	1
20B	1
365	1
132	1
133	1
131	1
26A	1
197	1
268	1
196	1
269	1
4A	1
6A	1
134	1
135	1
1F0	1
2B2	1
29D	1
25F	1
284	1
4B	1
6B	1
136	1
137	1
1E8	1
1E9	1
198	1
199	1
29E	1
4C	1
6C	1
139	1
13A	1
13B	1
13C	1
13D	1
13E	1
2E1	1
13F	1
140	1
1C7	1
1C8	1
1C9	1
2AA	1
2AB	1
29F	1
141	1
142	1
19A	1
26B	1
26C	1
26D	1
234	1
26E	1
19B	1
28E	1
4D	1
6D	1
36B	1
271	1
4E	1
6E	1
143	1
144	1
145	1
146	1
147	1
148	1
1F8	1
1F9	1
1CA	1
1CB	1
1CC	1
D1	1
F1	1
274	1
19D	1
272	1
19E	1
220	1
273	1
235	1
14A	1
14B	1
4F	1
6F	1
BA	1
D2	1
D3	1
D4	1
D5	1
D6	1
F2	1
F3	1
F4	1
F5	1
F6	1
14C	1
14D	1
14E	1
14F	1
150	1
151	1
1A0	1
1A1	1
1D1	1
1D2	1
1EA	1
1EB	1
1EC	1
1ED	1
20C	1
20D	1
20E	1
20F	1
22A	1
22B	1
22C	1
22D	1
22E	1
22F	1
230	1
231	1
366	1
152	1
153	1
276	1
D8	1
F8	1
1FE	1
1FF	1
186	1
254	1
19F	1
275	1
277	1
222	1
223	1
50	1
70	1
1A4	1
1A5	1
278	1
51	1
71	1
2A0	1
138	1
52	1
72	1
154	1
155	1
156	1
157	1
158	1
159	1
210	1
211	1
212	1
213	1
2B3	1
36C	1
1A6	1
280	1
279	1
2B4	1
27A	1
27B	1
2B5	1
27C	1
27D	1
27E	1
27F	1
281	1
2B6	1
53	1
73	1
15A	1
15B	1
15C	1
15D	1
15E	1
15F	1
160	1
161	1
17F	1
218	1
219	1
2E2	1
DF	1
282	1
1A9	1
283	1
1AA	1
285	1
286	1
54	1
74	1
162	1
163	1
164	1
165	1
21A	1
21B	1
36D	1
2A8	1
1BE	1
2A6	1
2A7	1
166	1
167	1
1AB	1
1AC	1
1AD	1
1AE	1
288	1
236	1
287	1
55	1
75	1
D9	1
DA	1
DB	1
DC	1
F9	1
FA	1
FB	1
FC	1
168	1
169	1
16A	1
16B	1
16C	1
16D	1
16E	1
16F	1
170	1
171	1
172	1
173	1
1AF	1
1B0	1
1D3	1
1D4	1
1D5	1
1D6	1
1D7	1
1D8	1
1D9	1
1DA	1
1DB	1
1DC	1
214	1
215	1
216	1
217	1
367	1
289	1
265	1
2AE	1
2AF	1
19C	1
26F	1
270	1
1B1	1
28A	1
56	1
76	1
36E	1
1B2	1
28B	1
28C	1
57	1
77	1
174	1
175	1
2B7	1
28D	1
58	1
78	1
2E3	1
36F	1
59	1
79	1
DD	1
FD	1
FF	1
176	1
177	1
178	1
232	1
233	1
2B8	1
28F	1
1B3	1
1B4	1
5A	1
7A	1
179	1
17A	1
17B	1
17C	1
17D	1
17E	1
18D	1
1B5	1
1B6	1
224	1
225	1
290	1
291	1
1B7	1
1EE	1
1EF	1
292	1
1B8	1
1B9	1
1BA	1
293	1
21C	1
21D	1
DE	1
FE	1
1BF	1
1F7	1
1BB	1
1A7	1
1A8	1
1BC	1
1BD	1
184	1
185	1
294	1
2C0	1
2BC	1
149	1
2EE	1
2BE	1
295	1
2E4	1
2BF	1
2C1	1
2A1	1
2A2	1
296	1
1C0	1
1C1	1
1C2	1
1C3	1
297	1
298	1
2AC	1
2AD	1
386	1
391	1
3AC	1
3B1	1
392	1
3B2	1
3D0	1
393	1
3B3	1
394	1
3B4	1
388	1
395	1
3AD	1
3B5	1
3F5	1
3DC	1
3DD	1
3DA	1
3DB	1
396	1
3B6	1
389	1
397	1
3AE	1
3B7	1
398	1
3B8	1
3D1	1
3F4	1
37A	1
38A	1
390	1
399	1
3AA	1
3AF	1
3B9	1
3CA	1
3F3	1
39A	1
3BA	1
3F0	1
3D7	1
39B	1
3BB	1
B5	1
39C	1
3BC	1
39D	1
3BD	1
39E	1
3BE	1
38C	1
39F	1
3BF	1
3CC	1
3A0	1
3C0	1
3D6	1
3DE	1
3DF	1
3D8	1
3D9	1
3A1	1
3C1	1
3F1	1
3A3	1
3C2	1
3C3	1
3F2	1
3F9	1
3A4	1
3C4	1
38E	1
3A5	1
3AB	1
3B0	1
3C5	1
3CB	1
3CD	1
3D2	1
3D3	1
3D4	1
3A6	1
3C6	1
3D5	1
3A7	1
3C7	1
3A8	1
3C8	1
38F	1
3A9	1
3C9	1
3CE	1
3E0	1
3E1	1
3F7	1
3F8	1
3FA	1
3FB	1
3E2	1
3E3	1
3E4	1
3E5	1
3E6	1
3E7	1
3E8	1
3E9	1
3EA	1
3EB	1
3EC	1
3ED	1
3EE	1
3EF	1
410	1
430	1
4D0	1
4D1	1
4D2	1
4D3	1
4D8	1
4D9	1
4DA	1
4DB	1
4D4	1
4D5	1
411	1
431	1
412	1
432	1
413	1
433	1
490	1
491	1
492	1
493	1
494	1
495	1
414	1
434	1
500	1
501	1
402	1
452	1
502	1
503	1
403	1
453	1
498	1
499	1
400	1
401	1
415	1
435	1
450	1
451	1
4D6	1
4D7	1
404	1
454	1
416	1
436	1
4C1	1
4C2	1
4DC	1
4DD	1
496	1
497	1
417	1
437	1
504	1
505	1
4DE	1
4DF	1
405	1
455	1
4E0	1
4E1	1
506	1
507	1
40D	1
418	1
438	1
45D	1
4E2	1
4E3	1
48A	1
48B	1
4E4	1
4E5	1
406	1
456	1
407	1
457	1
419	1
439	1
408	1
458	1
41A	1
43A	1
49A	1
49B	1
4C3	1
4C4	1
4A0	1
4A1	1
49E	1
49F	1
49C	1
49D	1
41B	1
43B	1
4C5	1
4C6	1
409	1
459	1
508	1
509	1
41C	1
43C	1
4CD	1
4CE	1
41D	1
43D	1
4C9	1
4CA	1
4A2	1
4A3	1
4C7	1
4C8	1
4A4	1
4A5	1
40A	1
45A	1
50A	1
50B	1
41E	1
43E	1
4E6	1
4E7	1
4E8	1
4E9	1
4EA	1
4EB	1
41F	1
43F	1
4A6	1
4A7	1
480	1
481	1
420	1
440	1
48E	1
48F	1
421	1
441	1
50C	1
50D	1
4AA	1
4AB	1
422	1
442	1
50E	1
50F	1
4AC	1
4AD	1
40B	1
45B	1
40C	1
45C	1
423	1
443	1
4EE	1
4EF	1
40E	1
45E	1
4F0	1
4F1	1
4F2	1
4F3	1
4AE	1
4AF	1
4B0	1
4B1	1
478	1
479	1
424	1
444	1
425	1
445	1
4B2	1
4B3	1
4BA	1
4BB	1
460	1
461	1
47E	1
47F	1
47C	1
47D	1
47A	1
47B	1
426	1
446	1
4B4	1
4B5	1
427	1
447	1
4F4	1
4F5	1
4B6	1
4B7	1
4CB	1
4CC	1
4B8	1
4B9	1
4BC	1
4BD	1
4BE	1
4BF	1
40F	1
45F	1
428	1
448	1
429	1
449	1
42A	1
44A	1
42B	1
44B	1
4F8	1
4F9	1
42C	1
44C	1
48C	1
48D	1
462	1
463	1
42D	1
44D	1
4EC	1
4ED	1
42E	1
44E	1
42F	1
44F	1
464	1
465	1
466	1
467	1
46A	1
46B	1
468	1
469	1
46C	1
46D	1
46E	1
46F	1
470	1
471	1
472	1
473	1
474	1
475	1
476	1
477	1
4A8	1
4A9	1
4C0	1
531	1
561	1
532	1
562	1
533	1
563	1
534	1
564	1
535	1
565	1
587	1
536	1
566	1
537	1
567	1
538	1
568	1
539	1
569	1
53A	1
56A	1
53B	1
56B	1
53C	1
56C	1
53D	1
56D	1
53E	1
56E	1
53F	1
56F	1
540	1
570	1
541	1
571	1
542	1
572	1
543	1
573	1
544	1
574	1
545	1
575	1
546	1
576	1
547	1
577	1
548	1
578	1
549	1
579	1
54A	1
57A	1
54B	1
57B	1
54C	1
57C	1
54D	1
57D	1
54E	1
57E	1
54F	1
57F	1
550	1
580	1
551	1
581	1
552	1
582	1
553	1
583	1
554	1
584	1
555	1
585	1
556	1
586	1
559	1
5D0	1
5D1	1
5D2	1
5D3	1
5D4	1
5D5	1
5F0	1
5F1	1
5D6	1
5D7	1
5D8	1
5D9	1
5F2	1
5DA	1
5DB	1
5DC	1
5DD	1
5DE	1
5DF	1
5E0	1
5E1	1
5E2	1
5E3	1
5E4	1
5E5	1
5E6	1
5E7	1
5E8	1
5E9	1
5EA	1
621	1
674	1
6FD	1
622	1
623	1
672	1
671	1
624	1
625	1
673	1
626	1
627	1
675	1
66E	1
628	1
67B	1
67E	1
680	1
629	1
62A	1
62B	1
679	1
67A	1
67C	1
67D	1
67F	1
62C	1
683	1
684	1
686	1
6BF	1
687	1
62D	1
62E	1
681	1
682	1
685	1
62F	1
630	1
688	1
689	1
68A	1
68B	1
68C	1
68D	1
68E	1
68F	1
690	1
6EE	1
631	1
632	1
691	1
692	1
693	1
694	1
695	1
696	1
697	1
698	1
699	1
6EF	1
633	1
634	1
69A	1
69B	1
69C	1
6FA	1
635	1
636	1
69D	1
69E	1
6FB	1
637	1
638	1
69F	1
639	1
63A	1
6A0	1
6FC	1
641	1
6A1	1
6A2	1
6A3	1
6A4	1
6A5	1
6A6	1
66F	1
642	1
6A7	1
6A8	1
643	1
6A9	1
6AA	1
6AB	1
6AC	1
6AD	1
6AE	1
6AF	1
6B0	1
6B1	1
6B2	1
6B3	1
6B4	1
644	1
6B5	1
6B6	1
6B7	1
6B8	1
645	1
6FE	1
646	1
6BA	1
6BB	1
6BC	1
6BD	1
6B9	1
647	1
6BE	1
6C1	1
6C2	1
6C3	1
6FF	1
6C0	1
6D5	1
648	1
6E5	1
676	1
6C4	1
6C5	1
6C6	1
6C7	1
677	1
6C8	1
6C9	1
6CA	1
6CB	1
6CF	1
649	1
64A	1
6E6	1
678	1
6CC	1
6CD	1
6CE	1
6D0	1
6D1	1
6D2	1
6D3	1
710	1
712	1
72D	1
713	1
714	1
72E	1
716	1
715	1
72F	1
717	1
718	1
719	1
74D	1
71A	1
71B	1
71C	1
71D	1
71E	1
71F	1
74E	1
720	1
721	1
722	1
723	1
724	1
725	1
726	1
727	1
74F	1
728	1
729	1
72A	1
72B	1
72C	1
780	1
799	1
79A	1
781	1
782	1
783	1
79C	1
784	1
785	1
786	1
787	1
7A2	1
7A3	1
788	1
7A5	1
789	1
78A	1
78B	1
79B	1
78C	1
798	1
7A0	1
7A1	1
78D	1
78E	1
7A4	1
78F	1
790	1
79D	1
79E	1
79F	1
791	1
792	1
793	1
794	1
795	1
796	1
797	1
7B1	1
7A6	1
7A7	1
7A8	1
7A9	1
7AA	1
7AB	1
7AC	1
7AD	1
7AE	1
7AF	1
7B0	1
4E00	1
4E01	1
4E02	1
4E03	1
4E04	1
4E05	1
4E06	1
4E07	1
4E08	1
4E09	1
4E0A	1
4E0B	1
4E0C	1
4E0D	1
4E0E	1
4E0F	1
4E10	1
4E11	1
4E12	1
4E13	1
4E14	1
4E15	1
4E16	1
4E17	1
4E18	1
4E19	1
4E1A	1
4E1B	1
4E1C	1
4E1D	1
4E1E	1
4E1F	1
4E20	1
4E21	1
4E22	1
4E23	1
4E24	1
4E25	1
4E26	1
4E27	1
4E28	1
4E29	1
4E2A	1
4E2B	1
4E2C	1
4E2D	1
4E2E	1
4E2F	1
4E30	1
4E31	1
4E32	1
4E33	1
4E34	1
4E35	1
4E36	1
4E37	1
4E38	1
4E39	1
4E3A	1
4E3B	1
4E3C	1
4E3D	1
4E3E	1
4E3F	1
4E40	1
4E41	1
4E42	1
4E43	1
4E44	1
4E45	1
4E46	1
4E47	1
4E48	1
4E49	1
4E4A	1
4E4B	1
4E4C	1
4E4D	1
4E4E	1
4E4F	1
4E50	1
4E51	1
4E52	1
4E53	1
4E54	1
4E55	1
4E56	1
4E57	1
4E58	1
4E59	1
4E5A	1
4E5B	1
4E5C	1
4E5D	1
4E5E	1
4E5F	1
4E60	1
4E61	1
4E62	1
4E63	1
4E64	1
4E65	1
4E66	1
4E67	1
4E68	1
4E69	1
4E6A	1
4E6B	1
4E6C	1
4E6D	1
4E6E	1
4E6F	1
4E70	1
4E71	1
4E72	1
4E73	1
4E74	1
4E75	1
4E76	1
4E77	1
4E78	1
4E79	1
4E7A	1
4E7B	1
4E7C	1
4E7D	1
4E7E	1
4E7F	1
4E80	1
4E81	1
4E82	1
4E83	1
4E84	1
4E85	1
4E86	1
4E87	1
4E88	1
4E89	1
4E8A	1
4E8B	1
4E8C	1
4E8D	1
4E8E	1
4E8F	1
4E90	1
4E91	1
4E92	1
4E93	1
4E94	1
4E95	1
4E96	1
4E97	1
4E98	1
4E99	1
4E9A	1
4E9B	1
4E9C	1
4E9D	1
4E9E	1
4E9F	1
4EA0	1
4EA1	1
4EA2	1
4EA3	1
4EA4	1
4EA5	1
4EA6	1
4EA7	1
4EA8	1
4EA9	1
4EAA	1
4EAB	1
4EAC	1
4EAD	1
4EAE	1
4EAF	1
4EB0	1
4EB1	1
4EB2	1
4EB3	1
4EB4	1
4EB5	1
4EB6	1
4EB7	1
4EB8	1
4EB9	1
4EBA	1
4EBB	1
4EBC	1
4EBD	1
4EBE	1
4EBF	1
4EC0	1
4EC1	1
4EC2	1
4EC3	1
4EC4	1
4EC5	1
4EC6	1
4EC7	1
4EC8	1
4EC9	1
4ECA	1
4ECB	1
4ECC	1
4ECD	1
4ECE	1
4ECF	1
4ED0	1
4ED1	1
4ED2	1
4ED3	1
4ED4	1
4ED5	1
4ED6	1
4ED7	1
4ED8	1
4ED9	1
4EDA	1
4EDB	1
4EDC	1
4EDD	1
4EDE	1
4EDF	1
4EE0	1
4EE1	1
4EE2	1
4EE3	1
4EE4	1
4EE5	1
4EE6	1
4EE7	1
4EE8	1
4EE9	1
4EEA	1
4EEB	1
4EEC	1
4EED	1
4EEE	1
4EEF	1
4EF0	1
4EF1	1
4EF2	1
4EF3	1
4EF4	1
4EF5	1
4EF6	1
4EF7	1
4EF8	1
4EF9	1
4EFA	1
4EFB	1
4EFC	1
4EFD	1
4EFE	1
4EFF	1
4F00	1
4F01	1
4F02	1
4F03	1
4F04	1
4F05	1
4F06	1
4F07	1
4F08	1
4F09	1
4F0A	1
4F0B	1
4F0C	1
4F0D	1
4F0E	1
4F0F	1
4F10	1
4F11	1
4F12	1
4F13	1
4F14	1
4F15	1
4F16	1
4F17	1
4F18	1
4F19	1
4F1A	1
4F1B	1
4F1C	1
4F1D	1
4F1E	1
4F1F	1
4F20	1
4F21	1
4F22	1
4F23	1
4F24	1
4F25	1
4F26	1
4F27	1
4F28	1
4F29	1
4F2A	1
4F2B	1
4F2C	1
4F2D	1
4F2E	1
4F2F	1
4F30	1
4F31	1
4F32	1
4F33	1
4F34	1
4F35	1
4F36	1
4F37	1
4F38	1
4F39	1
4F3A	1
4F3B	1
4F3C	1
4F3D	1
4F3E	1
4F3F	1
4F40	1
4F41	1
4F42	1
4F43	1
4F44	1
4F45	1
4F46	1
4F47	1
4F48	1
4F49	1
4F4A	1
4F4B	1
4F4C	1
4F4D	1
4F4E	1
4F4F	1
4F50	1
4F51	1
4F52	1
4F53	1
4F54	1
4F55	1
4F56	1
4F57	1
4F58	1
4F59	1
4F5A	1
4F5B	1
4F5C	1
4F5D	1
4F5E	1
4F5F	1
4F60	1
4F61	1
4F62	1
4F63	1
4F64	1
4F65	1
4F66	1
4F67	1
4F68	1
4F69	1
4F6A	1
4F6B	1
4F6C	1
4F6D	1
4F6E	1
4F6F	1
4F70	1
4F71	1
4F72	1
4F73	1
4F74	1
4F75	1
4F76	1
4F77	1
4F78	1
4F79	1
4F7A	1
4F7B	1
4F7C	1
4F7D	1
4F7E	1
4F7F	1
4F80	1
4F81	1
4F82	1
4F83	1
4F84	1
4F85	1
4F86	1
4F87	1
4F88	1
4F89	1
4F8A	1
4F8B	1
4F8C	1
4F8D	1
4F8E	1
4F8F	1
4F90	1
4F91	1
4F92	1
4F93	1
4F94	1
4F95	1
4F96	1
4F97	1
4F98	1
4F99	1
4F9A	1
4F9B	1
4F9C	1
4F9D	1
4F9E	1
4F9F	1
4FA0	1
4FA1	1
4FA2	1
4FA3	1
4FA4	1
4FA5	1
4FA6	1
4FA7	1
4FA8	1
4FA9	1
4FAA	1
4FAB	1
4FAC	1
4FAD	1
4FAE	1
4FAF	1
4FB0	1
4FB1	1
4FB2	1
4FB3	1
4FB4	1
4FB5	1
4FB6	1
4FB7	1
4FB8	1
4FB9	1
4FBA	1
4FBB	1
4FBC	1
4FBD	1
4FBE	1
4FBF	1
4FC0	1
4FC1	1
4FC2	1
4FC3	1
4FC4	1
4FC5	1
4FC6	1
4FC7	1
4FC8	1
4FC9	1
4FCA	1
4FCB	1
4FCC	1
4FCD	1
4FCE	1
4FCF	1
4FD0	1
4FD1	1
4FD2	1
4FD3	1
4FD4	1
4FD5	1
4FD6	1
4FD7	1
4FD8	1
4FD9	1
4FDA	1
4FDB	1
4FDC	1
4FDD	1
4FDE	1
4FDF	1
4FE0	1
4FE1	1
4FE2	1
4FE3	1
4FE4	1
4FE5	1
4FE6	1
4FE7	1
4FE8	1
4FE9	1
4FEA	1
4FEB	1
4FEC	1
4FED	1
4FEE	1
4FEF	1
4FF0	1
4FF1	1
4FF2	1
4FF3	1
4FF4	1
4FF5	1
4FF6	1
4FF7	1
4FF8	1
4FF9	1
4FFA	1
4FFB	1
4FFC	1
4FFD	1
4FFE	1
4FFF	1
237	1
238	1
239	1
23A	1
23B	1
23C	1
23D	1
23E	1
23F	1
240	1
241	1
242	1
243	1
244	1
245	1
246	1
247	1
248	1
249	1
24A	1
24B	1
24C	1
24D	1
24E	1
24F	1
358	1
359	1
35A	1
35B	1
35C	1
370	1
371	1
372	1
373	1
376	1
377	1
378	1
379	1
37B	1
37C	1
37D	1
37F	1
380	1
381	1
382	1
383	1
38B	1
38D	1
3A2	1
3CF	1
3FC	1
3FD	1
3FE	1
3FF	1
487	1
4CF	1
4F6	1
4F7	1
4FA	1
4FB	1
4FC	1
4FD	1
4FE	1
4FF	1
510	1
511	1
512	1
513	1
514	1
515	1
516	1
517	1
518	1
519	1
51A	1
51B	1
51C	1
51D	1
51E	1
51F	1
520	1
521	1
522	1
523	1
524	1
525	1
526	1
527	1
528	1
529	1
52A	1
52B	1
52C	1
52D	1
52E	1
52F	1
530	1
557	1
558	1
560	1
588	1
58B	1
58C	1
58D	1
58E	1
58F	1
590	1
5A2	1
5BA	1
5C5	1
5C6	1
5C7	1
5C8	1
5C9	1
5CA	1
5CB	1
5CC	1
5CD	1
5CE	1
5CF	1
5EB	1
5EC	1
5ED	1
5EE	1
5EF	1
5F5	1
5F6	1
5F7	1
5F8	1
5F9	1
5FA	1
5FB	1
5FC	1
5FD	1
5FE	1
5FF	1
604	1
605	1
606	1
607	1
608	1
609	1
60A	1
60B	1
616	1
617	1
618	1
619	1
61A	1
61C	1
61D	1
61E	1
620	1
63B	1
63C	1
63D	1
63E	1
63F	1
659	1
65A	1
65B	1
65C	1
65D	1
65E	1
65F	1
70E	1
74B	1
74C	1
750	1
751	1
752	1
753	1
754	1
755	1
756	1
757	1
758	1
759	1
75A	1
75B	1
75C	1
75D	1
75E	1
75F	1
760	1
761	1
762	1
763	1
764	1
765	1
766	1
767	1
768	1
769	1
76A	1
76B	1
76C	1
76D	1
76E	1
76F	1
770	1
771	1
772	1
773	1
774	1
775	1
776	1
777	1
778	1
779	1
77A	1
77B	1
77C	1
77D	1
77E	1
77F	1
7B2	1
7B3	1
7B4	1
7B5	1
7B6	1
7B7	1
7B8	1
7B9	1
7BA	1
7BB	1
7BC	1
7BD	1
7BE	1
7BF	1
7C0	1
7C1	1
7C2	1
7C3	1
7C4	1
7C5	1
7C6	1
7C7	1
7C8	1
7C9	1
7CA	1
7CB	1
7CC	1
7CD	1
7CE	1
7CF	1
7D0	1
7D1	1
7D2	1
7D3	1
7D4	1
7D5	1
7D6	1
7D7	1
7D8	1
7D9	1
7DA	1
7DB	1
7DC	1
7DD	1
7DE	1
7DF	1
7E0	1
7E1	1
7E2	1
7E3	1
7E4	1
7E5	1
7E6	1
7E7	1
7E8	1
7E9	1
7EA	1
7EB	1
7EC	1
7ED	1
7EE	1
7EF	1
7F0	1
7F1	1
7F2	1
7F3	1
7F4	1
7F5	1
7F6	1
7F7	1
7F8	1
7F9	1
7FA	1
7FB	1
7FC	1
7FD	1
7FE	1
7FF	1
DROP TABLE IF EXISTS test.t1;
DROP TABLE IF EXISTS test.t1;
DROP DATABASE test;
CREATE DATABASE test CHARACTER SET utf8mb3;
USE test;
SET NAMES utf8mb3;
Warnings:
Warning	1287	'utf8mb3' is deprecated and will be removed in a future release. Please use utf8mb4 instead
CREATE TABLE test.t1 (a CHAR(4) CHARACTER SET utf8mb3) ENGINE=MyISAM CHARACTER SET utf8mb3;
Warnings:
Warning	1287	'utf8mb3' is deprecated and will be removed in a future release. Please use utf8mb4 instead
Warning	1287	'utf8mb3' is deprecated and will be removed in a future release. Please use utf8mb4 instead
SHOW TABLE STATUS LIKE 't1';
Name	Engine	Version	Row_format	Rows	Avg_row_length	Data_length	Max_data_length	Index_length	Data_free	Auto_increment	Create_time	Update_time	Check_time	Collation	Checksum	Create_options	Comment
t1	MyISAM	#	#	#	#	#	#	#	#	#	#	#	#	utf8mb3_general_ci	#	#	#
LOAD DATA INFILE 
'MYSQL_TEST_DIR/suite/funcs_2/data/charset_utf8.txt' INTO TABLE test.t1;
ALTER TABLE test.t1 CHANGE a a CHAR(4) CHARACTER SET ucs2 COLLATE ucs2_swedish_ci;
Warnings:
Warning	1287	'ucs2' is deprecated and will be removed in a future release. Please use utf8mb4 instead
Warning	4079	'ucs2_swedish_ci' is a collation of the deprecated character set ucs2. Please consider using utf8mb4 with an appropriate collation instead.
DELETE FROM test.t1 WHERE CHAR_LENGTH(a) <> 1;
SELECT HEX(ORD(a)) AS a_ord, CHAR_LENGTH(a) AS a_len FROM test.t1 ORDER BY a, ORD(a);
a_ord	a_len
85	1
7F	1
80	1
81	1
82	1
83	1
84	1
86	1
87	1
88	1
89	1
8A	1
8B	1
8C	1
8D	1
8E	1
8F	1
90	1
91	1
92	1
93	1
94	1
95	1
96	1
97	1
98	1
99	1
9A	1
9B	1
9C	1
9D	1
9E	1
9F	1
A0	1
300	1
301	1
302	1
303	1
304	1
305	1
306	1
307	1
308	1
309	1
30A	1
30B	1
30C	1
30D	1
30E	1
30F	1
310	1
311	1
312	1
313	1
314	1
315	1
316	1
317	1
318	1
319	1
31A	1
31B	1
31C	1
31D	1
31E	1
31F	1
320	1
321	1
322	1
323	1
324	1
325	1
326	1
327	1
328	1
329	1
32A	1
32B	1
32C	1
32D	1
32E	1
32F	1
330	1
331	1
332	1
333	1
334	1
335	1
336	1
337	1
338	1
339	1
33A	1
33B	1
33C	1
33D	1
33E	1
33F	1
340	1
341	1
342	1
343	1
344	1
345	1
346	1
347	1
348	1
349	1
34A	1
34B	1
34C	1
34D	1
34E	1
34F	1
350	1
351	1
352	1
353	1
354	1
355	1
356	1
357	1
35D	1
35E	1
35F	1
360	1
361	1
362	1
483	1
484	1
485	1
486	1
488	1
489	1
591	1
592	1
593	1
594	1
595	1
596	1
597	1
598	1
599	1
59A	1
59B	1
59C	1
59D	1
59E	1
59F	1
5A0	1
5A1	1
5A3	1
5A4	1
5A5	1
5A6	1
5A7	1
5A8	1
5A9	1
5AA	1
5AB	1
5AC	1
5AD	1
5AE	1
5AF	1
5B0	1
5B1	1
5B2	1
5B3	1
5B4	1
5B5	1
5B6	1
5B7	1
5B8	1
5B9	1
5BB	1
5BC	1
5BD	1
5BF	1
5C1	1
5C2	1
5C4	1
600	1
601	1
602	1
603	1
610	1
611	1
612	1
613	1
614	1
615	1
64B	1
64C	1
64D	1
64E	1
64F	1
650	1
651	1
652	1
653	1
654	1
655	1
656	1
657	1
658	1
670	1
6D6	1
6D7	1
6D8	1
6D9	1
6DA	1
6DB	1
6DC	1
6DD	1
6DE	1
6DF	1
6E0	1
6E1	1
6E2	1
6E3	1
6E4	1
6E7	1
6E8	1
6EA	1
6EB	1
6EC	1
6ED	1
70F	1
711	1
730	1
731	1
732	1
733	1
734	1
735	1
736	1
737	1
738	1
739	1
73A	1
73B	1
73C	1
73D	1
73E	1
73F	1
740	1
741	1
742	1
743	1
744	1
745	1
746	1
747	1
748	1
749	1
74A	1
640	1
60	1
B4	1
384	1
2DC	1
5E	1
AF	1
2D8	1
2D9	1
A8	1
385	1
2DA	1
2DD	1
B8	1
2DB	1
5F	1
AD	1
2D	1
58A	1
2C	1
55D	1
60C	1
60D	1
66B	1
66C	1
3B	1
37E	1
61B	1
3A	1
589	1
703	1
704	1
705	1
706	1
707	1
708	1
21	1
A1	1
55C	1
3F	1
BF	1
55E	1
61F	1
709	1
2E	1
6D4	1
701	1
702	1
B7	1
387	1
700	1
27	1
22	1
AB	1
BB	1
28	1
29	1
5B	1
7B	1
7D	1
A7	1
B6	1
A9	1
AE	1
40	1
2A	1
66D	1
2F	1
26	1
23	1
25	1
66A	1
55A	1
55B	1
55F	1
5BE	1
5C0	1
5C3	1
5F3	1
5F4	1
70A	1
70B	1
70C	1
70D	1
2B9	1
374	1
375	1
2BA	1
2C2	1
2C3	1
2C4	1
2C5	1
2C6	1
2C7	1
2C8	1
2C9	1
2CA	1
2CB	1
2CC	1
2CD	1
2CE	1
2CF	1
2D2	1
2D3	1
2D4	1
2D5	1
2D6	1
2D7	1
2DE	1
2DF	1
2E5	1
2E6	1
2E7	1
2E8	1
2E9	1
2EA	1
2EB	1
2EC	1
2ED	1
2EF	1
2F0	1
2F1	1
2F2	1
2F3	1
2F4	1
2F5	1
2F6	1
2F7	1
2F8	1
2F9	1
2FA	1
2FB	1
2FC	1
2FD	1
2FE	1
2FF	1
B0	1
482	1
60E	1
60F	1
6E9	1
3F6	1
2B	1
B1	1
F7	1
D7	1
3C	1
3D	1
3E	1
AC	1
7C	1
A6	1
7E	1
2D0	1
2D1	1
A4	1
A2	1
24	1
A3	1
A5	1
30	1
660	1
6F0	1
31	1
B9	1
661	1
6F1	1
BD	1
BC	1
32	1
B2	1
662	1
6F2	1
33	1
B3	1
663	1
6F3	1
BE	1
34	1
664	1
6F4	1
35	1
665	1
6F5	1
36	1
666	1
6F6	1
37	1
667	1
6F7	1
38	1
668	1
6F8	1
39	1
669	1
6F9	1
41	1
61	1
AA	1
C0	1
C1	1
C2	1
C3	1
E0	1
E1	1
E2	1
E3	1
100	1
101	1
102	1
103	1
104	1
105	1
1CD	1
1CE	1
1DE	1
1DF	1
1E0	1
1E1	1
1FA	1
1FB	1
200	1
201	1
202	1
203	1
226	1
227	1
363	1
1E2	1
1E3	1
1FC	1
1FD	1
250	1
251	1
252	1
42	1
62	1
299	1
180	1
181	1
253	1
182	1
183	1
43	1
63	1
C7	1
E7	1
106	1
107	1
108	1
109	1
10A	1
10B	1
10C	1
10D	1
368	1
187	1
188	1
255	1
44	1
64	1
10E	1
10F	1
369	1
1C4	1
1C5	1
1C6	1
1F1	1
1F2	1
1F3	1
2A3	1
2A5	1
2A4	1
110	1
111	1
189	1
256	1
18A	1
257	1
18B	1
18C	1
221	1
D0	1
F0	1
45	1
65	1
C8	1
C9	1
CA	1
CB	1
E8	1
E9	1
EA	1
EB	1
112	1
113	1
114	1
115	1
116	1
117	1
118	1
119	1
11A	1
11B	1
204	1
205	1
206	1
207	1
228	1
229	1
364	1
18E	1
1DD	1
18F	1
259	1
190	1
25B	1
258	1
25A	1
25C	1
25D	1
25E	1
29A	1
264	1
46	1
66	1
2A9	1
191	1
192	1
47	1
67	1
11C	1
11D	1
11E	1
11F	1
120	1
121	1
122	1
123	1
1E6	1
1E7	1
1F4	1
1F5	1
261	1
262	1
1E4	1
1E5	1
193	1
260	1
29B	1
194	1
263	1
2E0	1
1A2	1
1A3	1
48	1
68	1
124	1
125	1
21E	1
21F	1
2B0	1
36A	1
29C	1
195	1
1F6	1
126	1
127	1
266	1
2B1	1
267	1
2BB	1
2BD	1
49	1
69	1
CC	1
CD	1
CE	1
CF	1
EC	1
ED	1
EE	1
EF	1
128	1
129	1
12A	1
12B	1
12C	1
12D	1
12E	1
12F	1
130	1
1CF	1
1D0	1
208	1
209	1
20A	1
20B	1
365	1
132	1
133	1
131	1
26A	1
197	1
268	1
196	1
269	1
4A	1
6A	1
134	1
135	1
1F0	1
2B2	1
29D	1
25F	1
284	1
4B	1
6B	1
136	1
137	1
1E8	1
1E9	1
198	1
199	1
29E	1
4C	1
6C	1
139	1
13A	1
13B	1
13C	1
13D	1
13E	1
2E1	1
13F	1
140	1
1C7	1
1C8	1
1C9	1
2AA	1
2AB	1
29F	1
141	1
142	1
19A	1
26B	1
26C	1
26D	1
234	1
26E	1
19B	1
28E	1
4D	1
6D	1
36B	1
271	1
4E	1
6E	1
D1	1
F1	1
143	1
144	1
145	1
146	1
147	1
148	1
1F8	1
1F9	1
1CA	1
1CB	1
1CC	1
274	1
19D	1
272	1
19E	1
220	1
273	1
235	1
14A	1
14B	1
4F	1
6F	1
BA	1
D2	1
D3	1
D4	1
D5	1
F2	1
F3	1
F4	1
F5	1
14C	1
14D	1
14E	1
14F	1
150	1
151	1
1A0	1
1A1	1
1D1	1
1D2	1
1EA	1
1EB	1
1EC	1
1ED	1
20C	1
20D	1
20E	1
20F	1
22A	1
22B	1
22C	1
22D	1
22E	1
22F	1
230	1
231	1
366	1
152	1
153	1
276	1
1FE	1
1FF	1
186	1
254	1
19F	1
275	1
277	1
222	1
223	1
50	1
70	1
1A4	1
1A5	1
278	1
51	1
71	1
2A0	1
138	1
52	1
72	1
154	1
155	1
156	1
157	1
158	1
159	1
210	1
211	1
212	1
213	1
2B3	1
36C	1
1A6	1
280	1
279	1
2B4	1
27A	1
27B	1
2B5	1
27C	1
27D	1
27E	1
27F	1
281	1
2B6	1
53	1
73	1
15A	1
15B	1
15C	1
15D	1
15E	1
15F	1
160	1
161	1
17F	1
218	1
219	1
2E2	1
DF	1
282	1
1A9	1
283	1
1AA	1
285	1
286	1
54	1
74	1
162	1
163	1
164	1
165	1
21A	1
21B	1
36D	1
2A8	1
1BE	1
2A6	1
2A7	1
166	1
167	1
1AB	1
1AC	1
1AD	1
1AE	1
288	1
236	1
287	1
55	1
75	1
D9	1
DA	1
DB	1
F9	1
FA	1
FB	1
168	1
169	1
16A	1
16B	1
16C	1
16D	1
16E	1
16F	1
170	1
171	1
172	1
173	1
1AF	1
1B0	1
1D3	1
1D4	1
1D5	1
1D6	1
1D7	1
1D8	1
1D9	1
1DA	1
1DB	1
1DC	1
214	1
215	1
216	1
217	1
367	1
289	1
265	1
2AE	1
2AF	1
19C	1
26F	1
270	1
1B1	1
28A	1
56	1
76	1
36E	1
1B2	1
28B	1
28C	1
57	1
77	1
174	1
175	1
2B7	1
28D	1
58	1
78	1
2E3	1
36F	1
59	1
79	1
DC	1
DD	1
FC	1
FD	1
FF	1
176	1
177	1
178	1
232	1
233	1
2B8	1
28F	1
1B3	1
1B4	1
5A	1
7A	1
179	1
17A	1
17B	1
17C	1
17D	1
17E	1
18D	1
C5	1
E5	1
C4	1
C6	1
E4	1
E6	1
D6	1
D8	1
F6	1
F8	1
1B5	1
1B6	1
224	1
225	1
290	1
291	1
1B7	1
1EE	1
1EF	1
292	1
1B8	1
1B9	1
1BA	1
293	1
21C	1
21D	1
DE	1
FE	1
1BF	1
1F7	1
1BB	1
1A7	1
1A8	1
1BC	1
1BD	1
184	1
185	1
294	1
2C0	1
2BC	1
149	1
2EE	1
2BE	1
295	1
2E4	1
2BF	1
2C1	1
2A1	1
2A2	1
296	1
1C0	1
1C1	1
1C2	1
1C3	1
297	1
298	1
2AC	1
2AD	1
386	1
391	1
3AC	1
3B1	1
392	1
3B2	1
3D0	1
393	1
3B3	1
394	1
3B4	1
388	1
395	1
3AD	1
3B5	1
3F5	1
3DC	1
3DD	1
3DA	1
3DB	1
396	1
3B6	1
389	1
397	1
3AE	1
3B7	1
398	1
3B8	1
3D1	1
3F4	1
37A	1
38A	1
390	1
399	1
3AA	1
3AF	1
3B9	1
3CA	1
3F3	1
39A	1
3BA	1
3F0	1
3D7	1
39B	1
3BB	1
B5	1
39C	1
3BC	1
39D	1
3BD	1
39E	1
3BE	1
38C	1
39F	1
3BF	1
3CC	1
3A0	1
3C0	1
3D6	1
3DE	1
3DF	1
3D8	1
3D9	1
3A1	1
3C1	1
3F1	1
3A3	1
3C2	1
3C3	1
3F2	1
3F9	1
3A4	1
3C4	1
38E	1
3A5	1
3AB	1
3B0	1
3C5	1
3CB	1
3CD	1
3D2	1
3D3	1
3D4	1
3A6	1
3C6	1
3D5	1
3A7	1
3C7	1
3A8	1
3C8	1
38F	1
3A9	1
3C9	1
3CE	1
3E0	1
3E1	1
3F7	1
3F8	1
3FA	1
3FB	1
3E2	1
3E3	1
3E4	1
3E5	1
3E6	1
3E7	1
3E8	1
3E9	1
3EA	1
3EB	1
3EC	1
3ED	1
3EE	1
3EF	1
410	1
430	1
4D0	1
4D1	1
4D2	1
4D3	1
4D8	1
4D9	1
4DA	1
4DB	1
4D4	1
4D5	1
411	1
431	1
412	1
432	1
413	1
433	1
490	1
491	1
492	1
493	1
494	1
495	1
414	1
434	1
500	1
501	1
402	1
452	1
502	1
503	1
403	1
453	1
498	1
499	1
400	1
401	1
415	1
435	1
450	1
451	1
4D6	1
4D7	1
404	1
454	1
416	1
436	1
4C1	1
4C2	1
4DC	1
4DD	1
496	1
497	1
417	1
437	1
504	1
505	1
4DE	1
4DF	1
405	1
455	1
4E0	1
4E1	1
506	1
507	1
40D	1
418	1
438	1
45D	1
4E2	1
4E3	1
48A	1
48B	1
4E4	1
4E5	1
406	1
456	1
407	1
457	1
419	1
439	1
408	1
458	1
41A	1
43A	1
49A	1
49B	1
4C3	1
4C4	1
4A0	1
4A1	1
49E	1
49F	1
49C	1
49D	1
41B	1
43B	1
4C5	1
4C6	1
409	1
459	1
508	1
509	1
41C	1
43C	1
4CD	1
4CE	1
41D	1
43D	1
4C9	1
4CA	1
4A2	1
4A3	1
4C7	1
4C8	1
4A4	1
4A5	1
40A	1
45A	1
50A	1
50B	1
41E	1
43E	1
4E6	1
4E7	1
4E8	1
4E9	1
4EA	1
4EB	1
41F	1
43F	1
4A6	1
4A7	1
480	1
481	1
420	1
440	1
48E	1
48F	1
421	1
441	1
50C	1
50D	1
4AA	1
4AB	1
422	1
442	1
50E	1
50F	1
4AC	1
4AD	1
40B	1
45B	1
40C	1
45C	1
423	1
443	1
4EE	1
4EF	1
40E	1
45E	1
4F0	1
4F1	1
4F2	1
4F3	1
4AE	1
4AF	1
4B0	1
4B1	1
478	1
479	1
424	1
444	1
425	1
445	1
4B2	1
4B3	1
4BA	1
4BB	1
460	1
461	1
47E	1
47F	1
47C	1
47D	1
47A	1
47B	1
426	1
446	1
4B4	1
4B5	1
427	1
447	1
4F4	1
4F5	1
4B6	1
4B7	1
4CB	1
4CC	1
4B8	1
4B9	1
4BC	1
4BD	1
4BE	1
4BF	1
40F	1
45F	1
428	1
448	1
429	1
449	1
42A	1
44A	1
42B	1
44B	1
4F8	1
4F9	1
42C	1
44C	1
48C	1
48D	1
462	1
463	1
42D	1
44D	1
4EC	1
4ED	1
42E	1
44E	1
42F	1
44F	1
464	1
465	1
466	1
467	1
46A	1
46B	1
468	1
469	1
46C	1
46D	1
46E	1
46F	1
470	1
471	1
472	1
473	1
474	1
475	1
476	1
477	1
4A8	1
4A9	1
4C0	1
531	1
561	1
532	1
562	1
533	1
563	1
534	1
564	1
535	1
565	1
587	1
536	1
566	1
537	1
567	1
538	1
568	1
539	1
569	1
53A	1
56A	1
53B	1
56B	1
53C	1
56C	1
53D	1
56D	1
53E	1
56E	1
53F	1
56F	1
540	1
570	1
541	1
571	1
542	1
572	1
543	1
573	1
544	1
574	1
545	1
575	1
546	1
576	1
547	1
577	1
548	1
578	1
549	1
579	1
54A	1
57A	1
54B	1
57B	1
54C	1
57C	1
54D	1
57D	1
54E	1
57E	1
54F	1
57F	1
550	1
580	1
551	1
581	1
552	1
582	1
553	1
583	1
554	1
584	1
555	1
585	1
556	1
586	1
559	1
5D0	1
5D1	1
5D2	1
5D3	1
5D4	1
5D5	1
5F0	1
5F1	1
5D6	1
5D7	1
5D8	1
5D9	1
5F2	1
5DA	1
5DB	1
5DC	1
5DD	1
5DE	1
5DF	1
5E0	1
5E1	1
5E2	1
5E3	1
5E4	1
5E5	1
5E6	1
5E7	1
5E8	1
5E9	1
5EA	1
621	1
674	1
6FD	1
622	1
623	1
672	1
671	1
624	1
625	1
673	1
626	1
627	1
675	1
66E	1
628	1
67B	1
67E	1
680	1
629	1
62A	1
62B	1
679	1
67A	1
67C	1
67D	1
67F	1
62C	1
683	1
684	1
686	1
6BF	1
687	1
62D	1
62E	1
681	1
682	1
685	1
62F	1
630	1
688	1
689	1
68A	1
68B	1
68C	1
68D	1
68E	1
68F	1
690	1
6EE	1
631	1
632	1
691	1
692	1
693	1
694	1
695	1
696	1
697	1
698	1
699	1
6EF	1
633	1
634	1
69A	1
69B	1
69C	1
6FA	1
635	1
636	1
69D	1
69E	1
6FB	1
637	1
638	1
69F	1
639	1
63A	1
6A0	1
6FC	1
641	1
6A1	1
6A2	1
6A3	1
6A4	1
6A5	1
6A6	1
66F	1
642	1
6A7	1
6A8	1
643	1
6A9	1
6AA	1
6AB	1
6AC	1
6AD	1
6AE	1
6AF	1
6B0	1
6B1	1
6B2	1
6B3	1
6B4	1
644	1
6B5	1
6B6	1
6B7	1
6B8	1
645	1
6FE	1
646	1
6BA	1
6BB	1
6BC	1
6BD	1
6B9	1
647	1
6BE	1
6C1	1
6C2	1
6C3	1
6FF	1
6C0	1
6D5	1
648	1
6E5	1
676	1
6C4	1
6C5	1
6C6	1
6C7	1
677	1
6C8	1
6C9	1
6CA	1
6CB	1
6CF	1
649	1
64A	1
6E6	1
678	1
6CC	1
6CD	1
6CE	1
6D0	1
6D1	1
6D2	1
6D3	1
710	1
712	1
72D	1
713	1
714	1
72E	1
716	1
715	1
72F	1
717	1
718	1
719	1
74D	1
71A	1
71B	1
71C	1
71D	1
71E	1
71F	1
74E	1
720	1
721	1
722	1
723	1
724	1
725	1
726	1
727	1
74F	1
728	1
729	1
72A	1
72B	1
72C	1
780	1
799	1
79A	1
781	1
782	1
783	1
79C	1
784	1
785	1
786	1
787	1
7A2	1
7A3	1
788	1
7A5	1
789	1
78A	1
78B	1
79B	1
78C	1
798	1
7A0	1
7A1	1
78D	1
78E	1
7A4	1
78F	1
790	1
79D	1
79E	1
79F	1
791	1
792	1
793	1
794	1
795	1
796	1
797	1
7B1	1
7A6	1
7A7	1
7A8	1
7A9	1
7AA	1
7AB	1
7AC	1
7AD	1
7AE	1
7AF	1
7B0	1
4E00	1
4E01	1
4E02	1
4E03	1
4E04	1
4E05	1
4E06	1
4E07	1
4E08	1
4E09	1
4E0A	1
4E0B	1
4E0C	1
4E0D	1
4E0E	1
4E0F	1
4E10	1
4E11	1
4E12	1
4E13	1
4E14	1
4E15	1
4E16	1
4E17	1
4E18	1
4E19	1
4E1A	1
4E1B	1
4E1C	1
4E1D	1
4E1E	1
4E1F	1
4E20	1
4E21	1
4E22	1
4E23	1
4E24	1
4E25	1
4E26	1
4E27	1
4E28	1
4E29	1
4E2A	1
4E2B	1
4E2C	1
4E2D	1
4E2E	1
4E2F	1
4E30	1
4E31	1
4E32	1
4E33	1
4E34	1
4E35	1
4E36	1
4E37	1
4E38	1
4E39	1
4E3A	1
4E3B	1
4E3C	1
4E3D	1
4E3E	1
4E3F	1
4E40	1
4E41	1
4E42	1
4E43	1
4E44	1
4E45	1
4E46	1
4E47	1
4E48	1
4E49	1
4E4A	1
4E4B	1
4E4C	1
4E4D	1
4E4E	1
4E4F	1
4E50	1
4E51	1
4E52	1
4E53	1
4E54	1
4E55	1
4E56	1
4E57	1
4E58	1
4E59	1
4E5A	1
4E5B	1
4E5C	1
4E5D	1
4E5E	1
4E5F	1
4E60	1
4E61	1
4E62	1
4E63	1
4E64	1
4E65	1
4E66	1
4E67	1
4E68	1
4E69	1
4E6A	1
4E6B	1
4E6C	1
4E6D	1
4E6E	1
4E6F	1
4E70	1
4E71	1
4E72	1
4E73	1
4E74	1
4E75	1
4E76	1
4E77	1
4E78	1
4E79	1
4E7A	1
4E7B	1
4E7C	1
4E7D	1
4E7E	1
4E7F	1
4E80	1
4E81	1
4E82	1
4E83	1
4E84	1
4E85	1
4E86	1
4E87	1
4E88	1
4E89	1
4E8A	1
4E8B	1
4E8C	1
4E8D	1
4E8E	1
4E8F	1
4E90	1
4E91	1
4E92	1
4E93	1
4E94	1
4E95	1
4E96	1
4E97	1
4E98	1
4E99	1
4E9A	1
4E9B	1
4E9C	1
4E9D	1
4E9E	1
4E9F	1
4EA0	1
4EA1	1
4EA2	1
4EA3	1
4EA4	1
4EA5	1
4EA6	1
4EA7	1
4EA8	1
4EA9	1
4EAA	1
4EAB	1
4EAC	1
4EAD	1
4EAE	1
4EAF	1
4EB0	1
4EB1	1
4EB2	1
4EB3	1
4EB4	1
4EB5	1
4EB6	1
4EB7	1
4EB8	1
4EB9	1
4EBA	1
4EBB	1
4EBC	1
4EBD	1
4EBE	1
4EBF	1
4EC0	1
4EC1	1
4EC2	1
4EC3	1
4EC4	1
4EC5	1
4EC6	1
4EC7	1
4EC8	1
4EC9	1
4ECA	1
4ECB	1
4ECC	1
4ECD	1
4ECE	1
4ECF	1
4ED0	1
4ED1	1
4ED2	1
4ED3	1
4ED4	1
4ED5	1
4ED6	1
4ED7	1
4ED8	1
4ED9	1
4EDA	1
4EDB	1
4EDC	1
4EDD	1
4EDE	1
4EDF	1
4EE0	1
4EE1	1
4EE2	1
4EE3	1
4EE4	1
4EE5	1
4EE6	1
4EE7	1
4EE8	1
4EE9	1
4EEA	1
4EEB	1
4EEC	1
4EED	1
4EEE	1
4EEF	1
4EF0	1
4EF1	1
4EF2	1
4EF3	1
4EF4	1
4EF5	1
4EF6	1
4EF7	1
4EF8	1
4EF9	1
4EFA	1
4EFB	1
4EFC	1
4EFD	1
4EFE	1
4EFF	1
4F00	1
4F01	1
4F02	1
4F03	1
4F04	1
4F05	1
4F06	1
4F07	1
4F08	1
4F09	1
4F0A	1
4F0B	1
4F0C	1
4F0D	1
4F0E	1
4F0F	1
4F10	1
4F11	1
4F12	1
4F13	1
4F14	1
4F15	1
4F16	1
4F17	1
4F18	1
4F19	1
4F1A	1
4F1B	1
4F1C	1
4F1D	1
4F1E	1
4F1F	1
4F20	1
4F21	1
4F22	1
4F23	1
4F24	1
4F25	1
4F26	1
4F27	1
4F28	1
4F29	1
4F2A	1
4F2B	1
4F2C	1
4F2D	1
4F2E	1
4F2F	1
4F30	1
4F31	1
4F32	1
4F33	1
4F34	1
4F35	1
4F36	1
4F37	1
4F38	1
4F39	1
4F3A	1
4F3B	1
4F3C	1
4F3D	1
4F3E	1
4F3F	1
4F40	1
4F41	1
4F42	1
4F43	1
4F44	1
4F45	1
4F46	1
4F47	1
4F48	1
4F49	1
4F4A	1
4F4B	1
4F4C	1
4F4D	1
4F4E	1
4F4F	1
4F50	1
4F51	1
4F52	1
4F53	1
4F54	1
4F55	1
4F56	1
4F57	1
4F58	1
4F59	1
4F5A	1
4F5B	1
4F5C	1
4F5D	1
4F5E	1
4F5F	1
4F60	1
4F61	1
4F62	1
4F63	1
4F64	1
4F65	1
4F66	1
4F67	1
4F68	1
4F69	1
4F6A	1
4F6B	1
4F6C	1
4F6D	1
4F6E	1
4F6F	1
4F70	1
4F71	1
4F72	1
4F73	1
4F74	1
4F75	1
4F76	1
4F77	1
4F78	1
4F79	1
4F7A	1
4F7B	1
4F7C	1
4F7D	1
4F7E	1
4F7F	1
4F80	1
4F81	1
4F82	1
4F83	1
4F84	1
4F85	1
4F86	1
4F87	1
4F88	1
4F89	1
4F8A	1
4F8B	1
4F8C	1
4F8D	1
4F8E	1
4F8F	1
4F90	1
4F91	1
4F92	1
4F93	1
4F94	1
4F95	1
4F96	1
4F97	1
4F98	1
4F99	1
4F9A	1
4F9B	1
4F9C	1
4F9D	1
4F9E	1
4F9F	1
4FA0	1
4FA1	1
4FA2	1
4FA3	1
4FA4	1
4FA5	1
4FA6	1
4FA7	1
4FA8	1
4FA9	1
4FAA	1
4FAB	1
4FAC	1
4FAD	1
4FAE	1
4FAF	1
4FB0	1
4FB1	1
4FB2	1
4FB3	1
4FB4	1
4FB5	1
4FB6	1
4FB7	1
4FB8	1
4FB9	1
4FBA	1
4FBB	1
4FBC	1
4FBD	1
4FBE	1
4FBF	1
4FC0	1
4FC1	1
4FC2	1
4FC3	1
4FC4	1
4FC5	1
4FC6	1
4FC7	1
4FC8	1
4FC9	1
4FCA	1
4FCB	1
4FCC	1
4FCD	1
4FCE	1
4FCF	1
4FD0	1
4FD1	1
4FD2	1
4FD3	1
4FD4	1
4FD5	1
4FD6	1
4FD7	1
4FD8	1
4FD9	1
4FDA	1
4FDB	1
4FDC	1
4FDD	1
4FDE	1
4FDF	1
4FE0	1
4FE1	1
4FE2	1
4FE3	1
4FE4	1
4FE5	1
4FE6	1
4FE7	1
4FE8	1
4FE9	1
4FEA	1
4FEB	1
4FEC	1
4FED	1
4FEE	1
4FEF	1
4FF0	1
4FF1	1
4FF2	1
4FF3	1
4FF4	1
4FF5	1
4FF6	1
4FF7	1
4FF8	1
4FF9	1
4FFA	1
4FFB	1
4FFC	1
4FFD	1
4FFE	1
4FFF	1
237	1
238	1
239	1
23A	1
23B	1
23C	1
23D	1
23E	1
23F	1
240	1
241	1
242	1
243	1
244	1
245	1
246	1
247	1
248	1
249	1
24A	1
24B	1
24C	1
24D	1
24E	1
24F	1
358	1
359	1
35A	1
35B	1
35C	1
370	1
371	1
372	1
373	1
376	1
377	1
378	1
379	1
37B	1
37C	1
37D	1
37F	1
380	1
381	1
382	1
383	1
38B	1
38D	1
3A2	1
3CF	1
3FC	1
3FD	1
3FE	1
3FF	1
487	1
4CF	1
4F6	1
4F7	1
4FA	1
4FB	1
4FC	1
4FD	1
4FE	1
4FF	1
510	1
511	1
512	1
513	1
514	1
515	1
516	1
517	1
518	1
519	1
51A	1
51B	1
51C	1
51D	1
51E	1
51F	1
520	1
521	1
522	1
523	1
524	1
525	1
526	1
527	1
528	1
529	1
52A	1
52B	1
52C	1
52D	1
52E	1
52F	1
530	1
557	1
558	1
560	1
588	1
58B	1
58C	1
58D	1
58E	1
58F	1
590	1
5A2	1
5BA	1
5C5	1
5C6	1
5C7	1
5C8	1
5C9	1
5CA	1
5CB	1
5CC	1
5CD	1
5CE	1
5CF	1
5EB	1
5EC	1
5ED	1
5EE	1
5EF	1
5F5	1
5F6	1
5F7	1
5F8	1
5F9	1
5FA	1
5FB	1
5FC	1
5FD	1
5FE	1
5FF	1
604	1
605	1
606	1
607	1
608	1
609	1
60A	1
60B	1
616	1
617	1
618	1
619	1
61A	1
61C	1
61D	1
61E	1
620	1
63B	1
63C	1
63D	1
63E	1
63F	1
659	1
65A	1
65B	1
65C	1
65D	1
65E	1
65F	1
70E	1
74B	1
74C	1
750	1
751	1
752	1
753	1
754	1
755	1
756	1
757	1
758	1
759	1
75A	1
75B	1
75C	1
75D	1
75E	1
75F	1
760	1
761	1
762	1
763	1
764	1
765	1
766	1
767	1
768	1
769	1
76A	1
76B	1
76C	1
76D	1
76E	1
76F	1
770	1
771	1
772	1
773	1
774	1
775	1
776	1
777	1
778	1
779	1
77A	1
77B	1
77C	1
77D	1
77E	1
77F	1
7B2	1
7B3	1
7B4	1
7B5	1
7B6	1
7B7	1
7B8	1
7B9	1
7BA	1
7BB	1
7BC	1
7BD	1
7BE	1
7BF	1
7C0	1
7C1	1
7C2	1
7C3	1
7C4	1
7C5	1
7C6	1
7C7	1
7C8	1
7C9	1
7CA	1
7CB	1
7CC	1
7CD	1
7CE	1
7CF	1
7D0	1
7D1	1
7D2	1
7D3	1
7D4	1
7D5	1
7D6	1
7D7	1
7D8	1
7D9	1
7DA	1
7DB	1
7DC	1
7DD	1
7DE	1
7DF	1
7E0	1
7E1	1
7E2	1
7E3	1
7E4	1
7E5	1
7E6	1
7E7	1
7E8	1
7E9	1
7EA	1
7EB	1
7EC	1
7ED	1
7EE	1
7EF	1
7F0	1
7F1	1
7F2	1
7F3	1
7F4	1
7F5	1
7F6	1
7F7	1
7F8	1
7F9	1
7FA	1
7FB	1
7FC	1
7FD	1
7FE	1
7FF	1
DROP TABLE IF EXISTS test.t1;
DROP TABLE IF EXISTS test.t1;
DROP DATABASE test;
CREATE DATABASE test CHARACTER SET utf8mb3;
USE test;
SET NAMES utf8mb3;
Warnings:
Warning	1287	'utf8mb3' is deprecated and will be removed in a future release. Please use utf8mb4 instead
CREATE TABLE test.t1 (a CHAR(4) CHARACTER SET utf8mb3) ENGINE=MyISAM CHARACTER SET utf8mb3;
Warnings:
Warning	1287	'utf8mb3' is deprecated and will be removed in a future release. Please use utf8mb4 instead
Warning	1287	'utf8mb3' is deprecated and will be removed in a future release. Please use utf8mb4 instead
SHOW TABLE STATUS LIKE 't1';
Name	Engine	Version	Row_format	Rows	Avg_row_length	Data_length	Max_data_length	Index_length	Data_free	Auto_increment	Create_time	Update_time	Check_time	Collation	Checksum	Create_options	Comment
t1	MyISAM	#	#	#	#	#	#	#	#	#	#	#	#	utf8mb3_general_ci	#	#	#
LOAD DATA INFILE 
'MYSQL_TEST_DIR/suite/funcs_2/data/charset_utf8.txt' INTO TABLE test.t1;
ALTER TABLE test.t1 CHANGE a a CHAR(4) CHARACTER SET ucs2 COLLATE ucs2_turkish_ci;
Warnings:
Warning	1287	'ucs2' is deprecated and will be removed in a future release. Please use utf8mb4 instead
Warning	4079	'ucs2_turkish_ci' is a collation of the deprecated character set ucs2. Please consider using utf8mb4 with an appropriate collation instead.
DELETE FROM test.t1 WHERE CHAR_LENGTH(a) <> 1;
SELECT HEX(ORD(a)) AS a_ord, CHAR_LENGTH(a) AS a_len FROM test.t1 ORDER BY a, ORD(a);
a_ord	a_len
85	1
7F	1
80	1
81	1
82	1
83	1
84	1
86	1
87	1
88	1
89	1
8A	1
8B	1
8C	1
8D	1
8E	1
8F	1
90	1
91	1
92	1
93	1
94	1
95	1
96	1
97	1
98	1
99	1
9A	1
9B	1
9C	1
9D	1
9E	1
9F	1
A0	1
300	1
301	1
302	1
303	1
304	1
305	1
306	1
307	1
308	1
309	1
30A	1
30B	1
30C	1
30D	1
30E	1
30F	1
310	1
311	1
312	1
313	1
314	1
315	1
316	1
317	1
318	1
319	1
31A	1
31B	1
31C	1
31D	1
31E	1
31F	1
320	1
321	1
322	1
323	1
324	1
325	1
326	1
327	1
328	1
329	1
32A	1
32B	1
32C	1
32D	1
32E	1
32F	1
330	1
331	1
332	1
333	1
334	1
335	1
336	1
337	1
338	1
339	1
33A	1
33B	1
33C	1
33D	1
33E	1
33F	1
340	1
341	1
342	1
343	1
344	1
345	1
346	1
347	1
348	1
349	1
34A	1
34B	1
34C	1
34D	1
34E	1
34F	1
350	1
351	1
352	1
353	1
354	1
355	1
356	1
357	1
35D	1
35E	1
35F	1
360	1
361	1
362	1
483	1
484	1
485	1
486	1
488	1
489	1
591	1
592	1
593	1
594	1
595	1
596	1
597	1
598	1
599	1
59A	1
59B	1
59C	1
59D	1
59E	1
59F	1
5A0	1
5A1	1
5A3	1
5A4	1
5A5	1
5A6	1
5A7	1
5A8	1
5A9	1
5AA	1
5AB	1
5AC	1
5AD	1
5AE	1
5AF	1
5B0	1
5B1	1
5B2	1
5B3	1
5B4	1
5B5	1
5B6	1
5B7	1
5B8	1
5B9	1
5BB	1
5BC	1
5BD	1
5BF	1
5C1	1
5C2	1
5C4	1
600	1
601	1
602	1
603	1
610	1
611	1
612	1
613	1
614	1
615	1
64B	1
64C	1
64D	1
64E	1
64F	1
650	1
651	1
652	1
653	1
654	1
655	1
656	1
657	1
658	1
670	1
6D6	1
6D7	1
6D8	1
6D9	1
6DA	1
6DB	1
6DC	1
6DD	1
6DE	1
6DF	1
6E0	1
6E1	1
6E2	1
6E3	1
6E4	1
6E7	1
6E8	1
6EA	1
6EB	1
6EC	1
6ED	1
70F	1
711	1
730	1
731	1
732	1
733	1
734	1
735	1
736	1
737	1
738	1
739	1
73A	1
73B	1
73C	1
73D	1
73E	1
73F	1
740	1
741	1
742	1
743	1
744	1
745	1
746	1
747	1
748	1
749	1
74A	1
640	1
60	1
B4	1
384	1
2DC	1
5E	1
AF	1
2D8	1
2D9	1
A8	1
385	1
2DA	1
2DD	1
B8	1
2DB	1
5F	1
AD	1
2D	1
58A	1
2C	1
55D	1
60C	1
60D	1
66B	1
66C	1
3B	1
37E	1
61B	1
3A	1
589	1
703	1
704	1
705	1
706	1
707	1
708	1
21	1
A1	1
55C	1
3F	1
BF	1
55E	1
61F	1
709	1
2E	1
6D4	1
701	1
702	1
B7	1
387	1
700	1
27	1
22	1
AB	1
BB	1
28	1
29	1
5B	1
7B	1
7D	1
A7	1
B6	1
A9	1
AE	1
40	1
2A	1
66D	1
2F	1
26	1
23	1
25	1
66A	1
55A	1
55B	1
55F	1
5BE	1
5C0	1
5C3	1
5F3	1
5F4	1
70A	1
70B	1
70C	1
70D	1
2B9	1
374	1
375	1
2BA	1
2C2	1
2C3	1
2C4	1
2C5	1
2C6	1
2C7	1
2C8	1
2C9	1
2CA	1
2CB	1
2CC	1
2CD	1
2CE	1
2CF	1
2D2	1
2D3	1
2D4	1
2D5	1
2D6	1
2D7	1
2DE	1
2DF	1
2E5	1
2E6	1
2E7	1
2E8	1
2E9	1
2EA	1
2EB	1
2EC	1
2ED	1
2EF	1
2F0	1
2F1	1
2F2	1
2F3	1
2F4	1
2F5	1
2F6	1
2F7	1
2F8	1
2F9	1
2FA	1
2FB	1
2FC	1
2FD	1
2FE	1
2FF	1
B0	1
482	1
60E	1
60F	1
6E9	1
3F6	1
2B	1
B1	1
F7	1
D7	1
3C	1
3D	1
3E	1
AC	1
7C	1
A6	1
7E	1
2D0	1
2D1	1
A4	1
A2	1
24	1
A3	1
A5	1
30	1
660	1
6F0	1
31	1
B9	1
661	1
6F1	1
BD	1
BC	1
32	1
B2	1
662	1
6F2	1
33	1
B3	1
663	1
6F3	1
BE	1
34	1
664	1
6F4	1
35	1
665	1
6F5	1
36	1
666	1
6F6	1
37	1
667	1
6F7	1
38	1
668	1
6F8	1
39	1
669	1
6F9	1
41	1
61	1
AA	1
C0	1
C1	1
C2	1
C3	1
C4	1
C5	1
E0	1
E1	1
E2	1
E3	1
E4	1
E5	1
100	1
101	1
102	1
103	1
104	1
105	1
1CD	1
1CE	1
1DE	1
1DF	1
1E0	1
1E1	1
1FA	1
1FB	1
200	1
201	1
202	1
203	1
226	1
227	1
363	1
C6	1
E6	1
1E2	1
1E3	1
1FC	1
1FD	1
250	1
251	1
252	1
42	1
62	1
299	1
180	1
181	1
253	1
182	1
183	1
43	1
63	1
106	1
107	1
108	1
109	1
10A	1
10B	1
10C	1
10D	1
368	1
C7	1
E7	1
187	1
188	1
255	1
44	1
64	1
10E	1
10F	1
369	1
1C4	1
1C5	1
1C6	1
1F1	1
1F2	1
1F3	1
2A3	1
2A5	1
2A4	1
110	1
111	1
189	1
256	1
18A	1
257	1
18B	1
18C	1
221	1
D0	1
F0	1
45	1
65	1
C8	1
C9	1
CA	1
CB	1
E8	1
E9	1
EA	1
EB	1
112	1
113	1
114	1
115	1
116	1
117	1
118	1
119	1
11A	1
11B	1
204	1
205	1
206	1
207	1
228	1
229	1
364	1
18E	1
1DD	1
18F	1
259	1
190	1
25B	1
258	1
25A	1
25C	1
25D	1
25E	1
29A	1
264	1
46	1
66	1
2A9	1
191	1
192	1
47	1
67	1
11C	1
11D	1
120	1
121	1
122	1
123	1
1E6	1
1E7	1
1F4	1
1F5	1
11E	1
11F	1
261	1
262	1
1E4	1
1E5	1
193	1
260	1
29B	1
194	1
263	1
2E0	1
1A2	1
1A3	1
48	1
68	1
124	1
125	1
21E	1
21F	1
2B0	1
36A	1
49	1
131	1
29C	1
195	1
1F6	1
126	1
127	1
266	1
2B1	1
267	1
2BB	1
2BD	1
69	1
CC	1
CD	1
CE	1
CF	1
EC	1
ED	1
EE	1
EF	1
128	1
129	1
12A	1
12B	1
12C	1
12D	1
12E	1
12F	1
130	1
1CF	1
1D0	1
208	1
209	1
20A	1
20B	1
365	1
132	1
133	1
26A	1
197	1
268	1
196	1
269	1
4A	1
6A	1
134	1
135	1
1F0	1
2B2	1
29D	1
25F	1
284	1
4B	1
6B	1
136	1
137	1
1E8	1
1E9	1
198	1
199	1
29E	1
4C	1
6C	1
139	1
13A	1
13B	1
13C	1
13D	1
13E	1
2E1	1
13F	1
140	1
1C7	1
1C8	1
1C9	1
2AA	1
2AB	1
29F	1
141	1
142	1
19A	1
26B	1
26C	1
26D	1
234	1
26E	1
19B	1
28E	1
4D	1
6D	1
36B	1
271	1
4E	1
6E	1
D1	1
F1	1
143	1
144	1
145	1
146	1
147	1
148	1
1F8	1
1F9	1
1CA	1
1CB	1
1CC	1
274	1
19D	1
272	1
19E	1
220	1
273	1
235	1
14A	1
14B	1
4F	1
6F	1
BA	1
D2	1
D3	1
D4	1
D5	1
F2	1
F3	1
F4	1
F5	1
14C	1
14D	1
14E	1
14F	1
150	1
151	1
1A0	1
1A1	1
1D1	1
1D2	1
1EA	1
1EB	1
1EC	1
1ED	1
20C	1
20D	1
20E	1
20F	1
22A	1
22B	1
22C	1
22D	1
22E	1
22F	1
230	1
231	1
366	1
152	1
153	1
D6	1
F6	1
276	1
D8	1
F8	1
1FE	1
1FF	1
186	1
254	1
19F	1
275	1
277	1
222	1
223	1
50	1
70	1
1A4	1
1A5	1
278	1
51	1
71	1
2A0	1
138	1
52	1
72	1
154	1
155	1
156	1
157	1
158	1
159	1
210	1
211	1
212	1
213	1
2B3	1
36C	1
1A6	1
280	1
279	1
2B4	1
27A	1
27B	1
2B5	1
27C	1
27D	1
27E	1
27F	1
281	1
2B6	1
53	1
73	1
15A	1
15B	1
15C	1
15D	1
160	1
161	1
17F	1
218	1
219	1
2E2	1
DF	1
15E	1
15F	1
282	1
1A9	1
283	1
1AA	1
285	1
286	1
54	1
74	1
162	1
163	1
164	1
165	1
21A	1
21B	1
36D	1
2A8	1
1BE	1
2A6	1
2A7	1
166	1
167	1
1AB	1
1AC	1
1AD	1
1AE	1
288	1
236	1
287	1
55	1
75	1
D9	1
DA	1
DB	1
F9	1
FA	1
FB	1
168	1
169	1
16A	1
16B	1
16C	1
16D	1
16E	1
16F	1
170	1
171	1
172	1
173	1
1AF	1
1B0	1
1D3	1
1D4	1
1D5	1
1D6	1
1D7	1
1D8	1
1D9	1
1DA	1
1DB	1
1DC	1
214	1
215	1
216	1
217	1
367	1
DC	1
FC	1
289	1
265	1
2AE	1
2AF	1
19C	1
26F	1
270	1
1B1	1
28A	1
56	1
76	1
36E	1
1B2	1
28B	1
28C	1
57	1
77	1
174	1
175	1
2B7	1
28D	1
58	1
78	1
2E3	1
36F	1
59	1
79	1
DD	1
FD	1
FF	1
176	1
177	1
178	1
232	1
233	1
2B8	1
28F	1
1B3	1
1B4	1
5A	1
7A	1
179	1
17A	1
17B	1
17C	1
17D	1
17E	1
18D	1
1B5	1
1B6	1
224	1
225	1
290	1
291	1
1B7	1
1EE	1
1EF	1
292	1
1B8	1
1B9	1
1BA	1
293	1
21C	1
21D	1
DE	1
FE	1
1BF	1
1F7	1
1BB	1
1A7	1
1A8	1
1BC	1
1BD	1
184	1
185	1
294	1
2C0	1
2BC	1
149	1
2EE	1
2BE	1
295	1
2E4	1
2BF	1
2C1	1
2A1	1
2A2	1
296	1
1C0	1
1C1	1
1C2	1
1C3	1
297	1
298	1
2AC	1
2AD	1
386	1
391	1
3AC	1
3B1	1
392	1
3B2	1
3D0	1
393	1
3B3	1
394	1
3B4	1
388	1
395	1
3AD	1
3B5	1
3F5	1
3DC	1
3DD	1
3DA	1
3DB	1
396	1
3B6	1
389	1
397	1
3AE	1
3B7	1
398	1
3B8	1
3D1	1
3F4	1
37A	1
38A	1
390	1
399	1
3AA	1
3AF	1
3B9	1
3CA	1
3F3	1
39A	1
3BA	1
3F0	1
3D7	1
39B	1
3BB	1
B5	1
39C	1
3BC	1
39D	1
3BD	1
39E	1
3BE	1
38C	1
39F	1
3BF	1
3CC	1
3A0	1
3C0	1
3D6	1
3DE	1
3DF	1
3D8	1
3D9	1
3A1	1
3C1	1
3F1	1
3A3	1
3C2	1
3C3	1
3F2	1
3F9	1
3A4	1
3C4	1
38E	1
3A5	1
3AB	1
3B0	1
3C5	1
3CB	1
3CD	1
3D2	1
3D3	1
3D4	1
3A6	1
3C6	1
3D5	1
3A7	1
3C7	1
3A8	1
3C8	1
38F	1
3A9	1
3C9	1
3CE	1
3E0	1
3E1	1
3F7	1
3F8	1
3FA	1
3FB	1
3E2	1
3E3	1
3E4	1
3E5	1
3E6	1
3E7	1
3E8	1
3E9	1
3EA	1
3EB	1
3EC	1
3ED	1
3EE	1
3EF	1
410	1
430	1
4D0	1
4D1	1
4D2	1
4D3	1
4D8	1
4D9	1
4DA	1
4DB	1
4D4	1
4D5	1
411	1
431	1
412	1
432	1
413	1
433	1
490	1
491	1
492	1
493	1
494	1
495	1
414	1
434	1
500	1
501	1
402	1
452	1
502	1
503	1
403	1
453	1
498	1
499	1
400	1
401	1
415	1
435	1
450	1
451	1
4D6	1
4D7	1
404	1
454	1
416	1
436	1
4C1	1
4C2	1
4DC	1
4DD	1
496	1
497	1
417	1
437	1
504	1
505	1
4DE	1
4DF	1
405	1
455	1
4E0	1
4E1	1
506	1
507	1
40D	1
418	1
438	1
45D	1
4E2	1
4E3	1
48A	1
48B	1
4E4	1
4E5	1
406	1
456	1
407	1
457	1
419	1
439	1
408	1
458	1
41A	1
43A	1
49A	1
49B	1
4C3	1
4C4	1
4A0	1
4A1	1
49E	1
49F	1
49C	1
49D	1
41B	1
43B	1
4C5	1
4C6	1
409	1
459	1
508	1
509	1
41C	1
43C	1
4CD	1
4CE	1
41D	1
43D	1
4C9	1
4CA	1
4A2	1
4A3	1
4C7	1
4C8	1
4A4	1
4A5	1
40A	1
45A	1
50A	1
50B	1
41E	1
43E	1
4E6	1
4E7	1
4E8	1
4E9	1
4EA	1
4EB	1
41F	1
43F	1
4A6	1
4A7	1
480	1
481	1
420	1
440	1
48E	1
48F	1
421	1
441	1
50C	1
50D	1
4AA	1
4AB	1
422	1
442	1
50E	1
50F	1
4AC	1
4AD	1
40B	1
45B	1
40C	1
45C	1
423	1
443	1
4EE	1
4EF	1
40E	1
45E	1
4F0	1
4F1	1
4F2	1
4F3	1
4AE	1
4AF	1
4B0	1
4B1	1
478	1
479	1
424	1
444	1
425	1
445	1
4B2	1
4B3	1
4BA	1
4BB	1
460	1
461	1
47E	1
47F	1
47C	1
47D	1
47A	1
47B	1
426	1
446	1
4B4	1
4B5	1
427	1
447	1
4F4	1
4F5	1
4B6	1
4B7	1
4CB	1
4CC	1
4B8	1
4B9	1
4BC	1
4BD	1
4BE	1
4BF	1
40F	1
45F	1
428	1
448	1
429	1
449	1
42A	1
44A	1
42B	1
44B	1
4F8	1
4F9	1
42C	1
44C	1
48C	1
48D	1
462	1
463	1
42D	1
44D	1
4EC	1
4ED	1
42E	1
44E	1
42F	1
44F	1
464	1
465	1
466	1
467	1
46A	1
46B	1
468	1
469	1
46C	1
46D	1
46E	1
46F	1
470	1
471	1
472	1
473	1
474	1
475	1
476	1
477	1
4A8	1
4A9	1
4C0	1
531	1
561	1
532	1
562	1
533	1
563	1
534	1
564	1
535	1
565	1
587	1
536	1
566	1
537	1
567	1
538	1
568	1
539	1
569	1
53A	1
56A	1
53B	1
56B	1
53C	1
56C	1
53D	1
56D	1
53E	1
56E	1
53F	1
56F	1
540	1
570	1
541	1
571	1
542	1
572	1
543	1
573	1
544	1
574	1
545	1
575	1
546	1
576	1
547	1
577	1
548	1
578	1
549	1
579	1
54A	1
57A	1
54B	1
57B	1
54C	1
57C	1
54D	1
57D	1
54E	1
57E	1
54F	1
57F	1
550	1
580	1
551	1
581	1
552	1
582	1
553	1
583	1
554	1
584	1
555	1
585	1
556	1
586	1
559	1
5D0	1
5D1	1
5D2	1
5D3	1
5D4	1
5D5	1
5F0	1
5F1	1
5D6	1
5D7	1
5D8	1
5D9	1
5F2	1
5DA	1
5DB	1
5DC	1
5DD	1
5DE	1
5DF	1
5E0	1
5E1	1
5E2	1
5E3	1
5E4	1
5E5	1
5E6	1
5E7	1
5E8	1
5E9	1
5EA	1
621	1
674	1
6FD	1
622	1
623	1
672	1
671	1
624	1
625	1
673	1
626	1
627	1
675	1
66E	1
628	1
67B	1
67E	1
680	1
629	1
62A	1
62B	1
679	1
67A	1
67C	1
67D	1
67F	1
62C	1
683	1
684	1
686	1
6BF	1
687	1
62D	1
62E	1
681	1
682	1
685	1
62F	1
630	1
688	1
689	1
68A	1
68B	1
68C	1
68D	1
68E	1
68F	1
690	1
6EE	1
631	1
632	1
691	1
692	1
693	1
694	1
695	1
696	1
697	1
698	1
699	1
6EF	1
633	1
634	1
69A	1
69B	1
69C	1
6FA	1
635	1
636	1
69D	1
69E	1
6FB	1
637	1
638	1
69F	1
639	1
63A	1
6A0	1
6FC	1
641	1
6A1	1
6A2	1
6A3	1
6A4	1
6A5	1
6A6	1
66F	1
642	1
6A7	1
6A8	1
643	1
6A9	1
6AA	1
6AB	1
6AC	1
6AD	1
6AE	1
6AF	1
6B0	1
6B1	1
6B2	1
6B3	1
6B4	1
644	1
6B5	1
6B6	1
6B7	1
6B8	1
645	1
6FE	1
646	1
6BA	1
6BB	1
6BC	1
6BD	1
6B9	1
647	1
6BE	1
6C1	1
6C2	1
6C3	1
6FF	1
6C0	1
6D5	1
648	1
6E5	1
676	1
6C4	1
6C5	1
6C6	1
6C7	1
677	1
6C8	1
6C9	1
6CA	1
6CB	1
6CF	1
649	1
64A	1
6E6	1
678	1
6CC	1
6CD	1
6CE	1
6D0	1
6D1	1
6D2	1
6D3	1
710	1
712	1
72D	1
713	1
714	1
72E	1
716	1
715	1
72F	1
717	1
718	1
719	1
74D	1
71A	1
71B	1
71C	1
71D	1
71E	1
71F	1
74E	1
720	1
721	1
722	1
723	1
724	1
725	1
726	1
727	1
74F	1
728	1
729	1
72A	1
72B	1
72C	1
780	1
799	1
79A	1
781	1
782	1
783	1
79C	1
784	1
785	1
786	1
787	1
7A2	1
7A3	1
788	1
7A5	1
789	1
78A	1
78B	1
79B	1
78C	1
798	1
7A0	1
7A1	1
78D	1
78E	1
7A4	1
78F	1
790	1
79D	1
79E	1
79F	1
791	1
792	1
793	1
794	1
795	1
796	1
797	1
7B1	1
7A6	1
7A7	1
7A8	1
7A9	1
7AA	1
7AB	1
7AC	1
7AD	1
7AE	1
7AF	1
7B0	1
4E00	1
4E01	1
4E02	1
4E03	1
4E04	1
4E05	1
4E06	1
4E07	1
4E08	1
4E09	1
4E0A	1
4E0B	1
4E0C	1
4E0D	1
4E0E	1
4E0F	1
4E10	1
4E11	1
4E12	1
4E13	1
4E14	1
4E15	1
4E16	1
4E17	1
4E18	1
4E19	1
4E1A	1
4E1B	1
4E1C	1
4E1D	1
4E1E	1
4E1F	1
4E20	1
4E21	1
4E22	1
4E23	1
4E24	1
4E25	1
4E26	1
4E27	1
4E28	1
4E29	1
4E2A	1
4E2B	1
4E2C	1
4E2D	1
4E2E	1
4E2F	1
4E30	1
4E31	1
4E32	1
4E33	1
4E34	1
4E35	1
4E36	1
4E37	1
4E38	1
4E39	1
4E3A	1
4E3B	1
4E3C	1
4E3D	1
4E3E	1
4E3F	1
4E40	1
4E41	1
4E42	1
4E43	1
4E44	1
4E45	1
4E46	1
4E47	1
4E48	1
4E49	1
4E4A	1
4E4B	1
4E4C	1
4E4D	1
4E4E	1
4E4F	1
4E50	1
4E51	1
4E52	1
4E53	1
4E54	1
4E55	1
4E56	1
4E57	1
4E58	1
4E59	1
4E5A	1
4E5B	1
4E5C	1
4E5D	1
4E5E	1
4E5F	1
4E60	1
4E61	1
4E62	1
4E63	1
4E64	1
4E65	1
4E66	1
4E67	1
4E68	1
4E69	1
4E6A	1
4E6B	1
4E6C	1
4E6D	1
4E6E	1
4E6F	1
4E70	1
4E71	1
4E72	1
4E73	1
4E74	1
4E75	1
4E76	1
4E77	1
4E78	1
4E79	1
4E7A	1
4E7B	1
4E7C	1
4E7D	1
4E7E	1
4E7F	1
4E80	1
4E81	1
4E82	1
4E83	1
4E84	1
4E85	1
4E86	1
4E87	1
4E88	1
4E89	1
4E8A	1
4E8B	1
4E8C	1
4E8D	1
4E8E	1
4E8F	1
4E90	1
4E91	1
4E92	1
4E93	1
4E94	1
4E95	1
4E96	1
4E97	1
4E98	1
4E99	1
4E9A	1
4E9B	1
4E9C	1
4E9D	1
4E9E	1
4E9F	1
4EA0	1
4EA1	1
4EA2	1
4EA3	1
4EA4	1
4EA5	1
4EA6	1
4EA7	1
4EA8	1
4EA9	1
4EAA	1
4EAB	1
4EAC	1
4EAD	1
4EAE	1
4EAF	1
4EB0	1
4EB1	1
4EB2	1
4EB3	1
4EB4	1
4EB5	1
4EB6	1
4EB7	1
4EB8	1
4EB9	1
4EBA	1
4EBB	1
4EBC	1
4EBD	1
4EBE	1
4EBF	1
4EC0	1
4EC1	1
4EC2	1
4EC3	1
4EC4	1
4EC5	1
4EC6	1
4EC7	1
4EC8	1
4EC9	1
4ECA	1
4ECB	1
4ECC	1
4ECD	1
4ECE	1
4ECF	1
4ED0	1
4ED1	1
4ED2	1
4ED3	1
4ED4	1
4ED5	1
4ED6	1
4ED7	1
4ED8	1
4ED9	1
4EDA	1
4EDB	1
4EDC	1
4EDD	1
4EDE	1
4EDF	1
4EE0	1
4EE1	1
4EE2	1
4EE3	1
4EE4	1
4EE5	1
4EE6	1
4EE7	1
4EE8	1
4EE9	1
4EEA	1
4EEB	1
4EEC	1
4EED	1
4EEE	1
4EEF	1
4EF0	1
4EF1	1
4EF2	1
4EF3	1
4EF4	1
4EF5	1
4EF6	1
4EF7	1
4EF8	1
4EF9	1
4EFA	1
4EFB	1
4EFC	1
4EFD	1
4EFE	1
4EFF	1
4F00	1
4F01	1
4F02	1
4F03	1
4F04	1
4F05	1
4F06	1
4F07	1
4F08	1
4F09	1
4F0A	1
4F0B	1
4F0C	1
4F0D	1
4F0E	1
4F0F	1
4F10	1
4F11	1
4F12	1
4F13	1
4F14	1
4F15	1
4F16	1
4F17	1
4F18	1
4F19	1
4F1A	1
4F1B	1
4F1C	1
4F1D	1
4F1E	1
4F1F	1
4F20	1
4F21	1
4F22	1
4F23	1
4F24	1
4F25	1
4F26	1
4F27	1
4F28	1
4F29	1
4F2A	1
4F2B	1
4F2C	1
4F2D	1
4F2E	1
4F2F	1
4F30	1
4F31	1
4F32	1
4F33	1
4F34	1
4F35	1
4F36	1
4F37	1
4F38	1
4F39	1
4F3A	1
4F3B	1
4F3C	1
4F3D	1
4F3E	1
4F3F	1
4F40	1
4F41	1
4F42	1
4F43	1
4F44	1
4F45	1
4F46	1
4F47	1
4F48	1
4F49	1
4F4A	1
4F4B	1
4F4C	1
4F4D	1
4F4E	1
4F4F	1
4F50	1
4F51	1
4F52	1
4F53	1
4F54	1
4F55	1
4F56	1
4F57	1
4F58	1
4F59	1
4F5A	1
4F5B	1
4F5C	1
4F5D	1
4F5E	1
4F5F	1
4F60	1
4F61	1
4F62	1
4F63	1
4F64	1
4F65	1
4F66	1
4F67	1
4F68	1
4F69	1
4F6A	1
4F6B	1
4F6C	1
4F6D	1
4F6E	1
4F6F	1
4F70	1
4F71	1
4F72	1
4F73	1
4F74	1
4F75	1
4F76	1
4F77	1
4F78	1
4F79	1
4F7A	1
4F7B	1
4F7C	1
4F7D	1
4F7E	1
4F7F	1
4F80	1
4F81	1
4F82	1
4F83	1
4F84	1
4F85	1
4F86	1
4F87	1
4F88	1
4F89	1
4F8A	1
4F8B	1
4F8C	1
4F8D	1
4F8E	1
4F8F	1
4F90	1
4F91	1
4F92	1
4F93	1
4F94	1
4F95	1
4F96	1
4F97	1
4F98	1
4F99	1
4F9A	1
4F9B	1
4F9C	1
4F9D	1
4F9E	1
4F9F	1
4FA0	1
4FA1	1
4FA2	1
4FA3	1
4FA4	1
4FA5	1
4FA6	1
4FA7	1
4FA8	1
4FA9	1
4FAA	1
4FAB	1
4FAC	1
4FAD	1
4FAE	1
4FAF	1
4FB0	1
4FB1	1
4FB2	1
4FB3	1
4FB4	1
4FB5	1
4FB6	1
4FB7	1
4FB8	1
4FB9	1
4FBA	1
4FBB	1
4FBC	1
4FBD	1
4FBE	1
4FBF	1
4FC0	1
4FC1	1
4FC2	1
4FC3	1
4FC4	1
4FC5	1
4FC6	1
4FC7	1
4FC8	1
4FC9	1
4FCA	1
4FCB	1
4FCC	1
4FCD	1
4FCE	1
4FCF	1
4FD0	1
4FD1	1
4FD2	1
4FD3	1
4FD4	1
4FD5	1
4FD6	1
4FD7	1
4FD8	1
4FD9	1
4FDA	1
4FDB	1
4FDC	1
4FDD	1
4FDE	1
4FDF	1
4FE0	1
4FE1	1
4FE2	1
4FE3	1
4FE4	1
4FE5	1
4FE6	1
4FE7	1
4FE8	1
4FE9	1
4FEA	1
4FEB	1
4FEC	1
4FED	1
4FEE	1
4FEF	1
4FF0	1
4FF1	1
4FF2	1
4FF3	1
4FF4	1
4FF5	1
4FF6	1
4FF7	1
4FF8	1
4FF9	1
4FFA	1
4FFB	1
4FFC	1
4FFD	1
4FFE	1
4FFF	1
237	1
238	1
239	1
23A	1
23B	1
23C	1
23D	1
23E	1
23F	1
240	1
241	1
242	1
243	1
244	1
245	1
246	1
247	1
248	1
249	1
24A	1
24B	1
24C	1
24D	1
24E	1
24F	1
358	1
359	1
35A	1
35B	1
35C	1
370	1
371	1
372	1
373	1
376	1
377	1
378	1
379	1
37B	1
37C	1
37D	1
37F	1
380	1
381	1
382	1
383	1
38B	1
38D	1
3A2	1
3CF	1
3FC	1
3FD	1
3FE	1
3FF	1
487	1
4CF	1
4F6	1
4F7	1
4FA	1
4FB	1
4FC	1
4FD	1
4FE	1
4FF	1
510	1
511	1
512	1
513	1
514	1
515	1
516	1
517	1
518	1
519	1
51A	1
51B	1
51C	1
51D	1
51E	1
51F	1
520	1
521	1
522	1
523	1
524	1
525	1
526	1
527	1
528	1
529	1
52A	1
52B	1
52C	1
52D	1
52E	1
52F	1
530	1
557	1
558	1
560	1
588	1
58B	1
58C	1
58D	1
58E	1
58F	1
590	1
5A2	1
5BA	1
5C5	1
5C6	1
5C7	1
5C8	1
5C9	1
5CA	1
5CB	1
5CC	1
5CD	1
5CE	1
5CF	1
5EB	1
5EC	1
5ED	1
5EE	1
5EF	1
5F5	1
5F6	1
5F7	1
5F8	1
5F9	1
5FA	1
5FB	1
5FC	1
5FD	1
5FE	1
5FF	1
604	1
605	1
606	1
607	1
608	1
609	1
60A	1
60B	1
616	1
617	1
618	1
619	1
61A	1
61C	1
61D	1
61E	1
620	1
63B	1
63C	1
63D	1
63E	1
63F	1
659	1
65A	1
65B	1
65C	1
65D	1
65E	1
65F	1
70E	1
74B	1
74C	1
750	1
751	1
752	1
753	1
754	1
755	1
756	1
757	1
758	1
759	1
75A	1
75B	1
75C	1
75D	1
75E	1
75F	1
760	1
761	1
762	1
763	1
764	1
765	1
766	1
767	1
768	1
769	1
76A	1
76B	1
76C	1
76D	1
76E	1
76F	1
770	1
771	1
772	1
773	1
774	1
775	1
776	1
777	1
778	1
779	1
77A	1
77B	1
77C	1
77D	1
77E	1
77F	1
7B2	1
7B3	1
7B4	1
7B5	1
7B6	1
7B7	1
7B8	1
7B9	1
7BA	1
7BB	1
7BC	1
7BD	1
7BE	1
7BF	1
7C0	1
7C1	1
7C2	1
7C3	1
7C4	1
7C5	1
7C6	1
7C7	1
7C8	1
7C9	1
7CA	1
7CB	1
7CC	1
7CD	1
7CE	1
7CF	1
7D0	1
7D1	1
7D2	1
7D3	1
7D4	1
7D5	1
7D6	1
7D7	1
7D8	1
7D9	1
7DA	1
7DB	1
7DC	1
7DD	1
7DE	1
7DF	1
7E0	1
7E1	1
7E2	1
7E3	1
7E4	1
7E5	1
7E6	1
7E7	1
7E8	1
7E9	1
7EA	1
7EB	1
7EC	1
7ED	1
7EE	1
7EF	1
7F0	1
7F1	1
7F2	1
7F3	1
7F4	1
7F5	1
7F6	1
7F7	1
7F8	1
7F9	1
7FA	1
7FB	1
7FC	1
7FD	1
7FE	1
7FF	1
DROP TABLE IF EXISTS test.t1;
DROP TABLE IF EXISTS test.t1;
DROP DATABASE test;
CREATE DATABASE test CHARACTER SET utf8mb3;
USE test;
SET NAMES utf8mb3;
Warnings:
Warning	1287	'utf8mb3' is deprecated and will be removed in a future release. Please use utf8mb4 instead
CREATE TABLE test.t1 (a CHAR(4) CHARACTER SET utf8mb3) ENGINE=MyISAM CHARACTER SET utf8mb3;
Warnings:
Warning	1287	'utf8mb3' is deprecated and will be removed in a future release. Please use utf8mb4 instead
Warning	1287	'utf8mb3' is deprecated and will be removed in a future release. Please use utf8mb4 instead
SHOW TABLE STATUS LIKE 't1';
Name	Engine	Version	Row_format	Rows	Avg_row_length	Data_length	Max_data_length	Index_length	Data_free	Auto_increment	Create_time	Update_time	Check_time	Collation	Checksum	Create_options	Comment
t1	MyISAM	#	#	#	#	#	#	#	#	#	#	#	#	utf8mb3_general_ci	#	#	#
LOAD DATA INFILE 
'MYSQL_TEST_DIR/suite/funcs_2/data/charset_utf8.txt' INTO TABLE test.t1;
ALTER TABLE test.t1 CHANGE a a CHAR(4) CHARACTER SET ucs2 COLLATE ucs2_unicode_ci;
Warnings:
Warning	1287	'ucs2' is deprecated and will be removed in a future release. Please use utf8mb4 instead
Warning	4079	'ucs2_unicode_ci' is a collation of the deprecated character set ucs2. Please consider using utf8mb4 with an appropriate collation instead.
DELETE FROM test.t1 WHERE CHAR_LENGTH(a) <> 1;
SELECT HEX(ORD(a)) AS a_ord, CHAR_LENGTH(a) AS a_len FROM test.t1 ORDER BY a, ORD(a);
a_ord	a_len
85	1
7F	1
80	1
81	1
82	1
83	1
84	1
86	1
87	1
88	1
89	1
8A	1
8B	1
8C	1
8D	1
8E	1
8F	1
90	1
91	1
92	1
93	1
94	1
95	1
96	1
97	1
98	1
99	1
9A	1
9B	1
9C	1
9D	1
9E	1
9F	1
A0	1
300	1
301	1
302	1
303	1
304	1
305	1
306	1
307	1
308	1
309	1
30A	1
30B	1
30C	1
30D	1
30E	1
30F	1
310	1
311	1
312	1
313	1
314	1
315	1
316	1
317	1
318	1
319	1
31A	1
31B	1
31C	1
31D	1
31E	1
31F	1
320	1
321	1
322	1
323	1
324	1
325	1
326	1
327	1
328	1
329	1
32A	1
32B	1
32C	1
32D	1
32E	1
32F	1
330	1
331	1
332	1
333	1
334	1
335	1
336	1
337	1
338	1
339	1
33A	1
33B	1
33C	1
33D	1
33E	1
33F	1
340	1
341	1
342	1
343	1
344	1
345	1
346	1
347	1
348	1
349	1
34A	1
34B	1
34C	1
34D	1
34E	1
34F	1
350	1
351	1
352	1
353	1
354	1
355	1
356	1
357	1
35D	1
35E	1
35F	1
360	1
361	1
362	1
483	1
484	1
485	1
486	1
488	1
489	1
591	1
592	1
593	1
594	1
595	1
596	1
597	1
598	1
599	1
59A	1
59B	1
59C	1
59D	1
59E	1
59F	1
5A0	1
5A1	1
5A3	1
5A4	1
5A5	1
5A6	1
5A7	1
5A8	1
5A9	1
5AA	1
5AB	1
5AC	1
5AD	1
5AE	1
5AF	1
5B0	1
5B1	1
5B2	1
5B3	1
5B4	1
5B5	1
5B6	1
5B7	1
5B8	1
5B9	1
5BB	1
5BC	1
5BD	1
5BF	1
5C1	1
5C2	1
5C4	1
600	1
601	1
602	1
603	1
610	1
611	1
612	1
613	1
614	1
615	1
64B	1
64C	1
64D	1
64E	1
64F	1
650	1
651	1
652	1
653	1
654	1
655	1
656	1
657	1
658	1
670	1
6D6	1
6D7	1
6D8	1
6D9	1
6DA	1
6DB	1
6DC	1
6DD	1
6DE	1
6DF	1
6E0	1
6E1	1
6E2	1
6E3	1
6E4	1
6E7	1
6E8	1
6EA	1
6EB	1
6EC	1
6ED	1
70F	1
711	1
730	1
731	1
732	1
733	1
734	1
735	1
736	1
737	1
738	1
739	1
73A	1
73B	1
73C	1
73D	1
73E	1
73F	1
740	1
741	1
742	1
743	1
744	1
745	1
746	1
747	1
748	1
749	1
74A	1
640	1
60	1
B4	1
384	1
2DC	1
5E	1
AF	1
2D8	1
2D9	1
A8	1
385	1
2DA	1
2DD	1
B8	1
2DB	1
5F	1
AD	1
2D	1
58A	1
2C	1
55D	1
60C	1
60D	1
66B	1
66C	1
3B	1
37E	1
61B	1
3A	1
589	1
703	1
704	1
705	1
706	1
707	1
708	1
21	1
A1	1
55C	1
3F	1
BF	1
55E	1
61F	1
709	1
2E	1
6D4	1
701	1
702	1
B7	1
387	1
700	1
27	1
22	1
AB	1
BB	1
28	1
29	1
5B	1
7B	1
7D	1
A7	1
B6	1
A9	1
AE	1
40	1
2A	1
66D	1
2F	1
26	1
23	1
25	1
66A	1
55A	1
55B	1
55F	1
5BE	1
5C0	1
5C3	1
5F3	1
5F4	1
70A	1
70B	1
70C	1
70D	1
2B9	1
374	1
375	1
2BA	1
2C2	1
2C3	1
2C4	1
2C5	1
2C6	1
2C7	1
2C8	1
2C9	1
2CA	1
2CB	1
2CC	1
2CD	1
2CE	1
2CF	1
2D2	1
2D3	1
2D4	1
2D5	1
2D6	1
2D7	1
2DE	1
2DF	1
2E5	1
2E6	1
2E7	1
2E8	1
2E9	1
2EA	1
2EB	1
2EC	1
2ED	1
2EF	1
2F0	1
2F1	1
2F2	1
2F3	1
2F4	1
2F5	1
2F6	1
2F7	1
2F8	1
2F9	1
2FA	1
2FB	1
2FC	1
2FD	1
2FE	1
2FF	1
B0	1
482	1
60E	1
60F	1
6E9	1
3F6	1
2B	1
B1	1
F7	1
D7	1
3C	1
3D	1
3E	1
AC	1
7C	1
A6	1
7E	1
2D0	1
2D1	1
A4	1
A2	1
24	1
A3	1
A5	1
30	1
660	1
6F0	1
31	1
B9	1
661	1
6F1	1
BD	1
BC	1
32	1
B2	1
662	1
6F2	1
33	1
B3	1
663	1
6F3	1
BE	1
34	1
664	1
6F4	1
35	1
665	1
6F5	1
36	1
666	1
6F6	1
37	1
667	1
6F7	1
38	1
668	1
6F8	1
39	1
669	1
6F9	1
41	1
61	1
AA	1
C0	1
C1	1
C2	1
C3	1
C4	1
C5	1
E0	1
E1	1
E2	1
E3	1
E4	1
E5	1
100	1
101	1
102	1
103	1
104	1
105	1
1CD	1
1CE	1
1DE	1
1DF	1
1E0	1
1E1	1
1FA	1
1FB	1
200	1
201	1
202	1
203	1
226	1
227	1
363	1
C6	1
E6	1
1E2	1
1E3	1
1FC	1
1FD	1
250	1
251	1
252	1
42	1
62	1
299	1
180	1
181	1
253	1
182	1
183	1
43	1
63	1
C7	1
E7	1
106	1
107	1
108	1
109	1
10A	1
10B	1
10C	1
10D	1
368	1
187	1
188	1
255	1
44	1
64	1
10E	1
10F	1
369	1
1C4	1
1C5	1
1C6	1
1F1	1
1F2	1
1F3	1
2A3	1
2A5	1
2A4	1
110	1
111	1
189	1
256	1
18A	1
257	1
18B	1
18C	1
221	1
D0	1
F0	1
45	1
65	1
C8	1
C9	1
CA	1
CB	1
E8	1
E9	1
EA	1
EB	1
112	1
113	1
114	1
115	1
116	1
117	1
118	1
119	1
11A	1
11B	1
204	1
205	1
206	1
207	1
228	1
229	1
364	1
18E	1
1DD	1
18F	1
259	1
190	1
25B	1
258	1
25A	1
25C	1
25D	1
25E	1
29A	1
264	1
46	1
66	1
2A9	1
191	1
192	1
47	1
67	1
11C	1
11D	1
11E	1
11F	1
120	1
121	1
122	1
123	1
1E6	1
1E7	1
1F4	1
1F5	1
261	1
262	1
1E4	1
1E5	1
193	1
260	1
29B	1
194	1
263	1
2E0	1
1A2	1
1A3	1
48	1
68	1
124	1
125	1
21E	1
21F	1
2B0	1
36A	1
29C	1
195	1
1F6	1
126	1
127	1
266	1
2B1	1
267	1
2BB	1
2BD	1
49	1
69	1
CC	1
CD	1
CE	1
CF	1
EC	1
ED	1
EE	1
EF	1
128	1
129	1
12A	1
12B	1
12C	1
12D	1
12E	1
12F	1
130	1
1CF	1
1D0	1
208	1
209	1
20A	1
20B	1
365	1
132	1
133	1
131	1
26A	1
197	1
268	1
196	1
269	1
4A	1
6A	1
134	1
135	1
1F0	1
2B2	1
29D	1
25F	1
284	1
4B	1
6B	1
136	1
137	1
1E8	1
1E9	1
198	1
199	1
29E	1
4C	1
6C	1
139	1
13A	1
13B	1
13C	1
13D	1
13E	1
2E1	1
13F	1
140	1
1C7	1
1C8	1
1C9	1
2AA	1
2AB	1
29F	1
141	1
142	1
19A	1
26B	1
26C	1
26D	1
234	1
26E	1
19B	1
28E	1
4D	1
6D	1
36B	1
271	1
4E	1
6E	1
D1	1
F1	1
143	1
144	1
145	1
146	1
147	1
148	1
1F8	1
1F9	1
1CA	1
1CB	1
1CC	1
274	1
19D	1
272	1
19E	1
220	1
273	1
235	1
14A	1
14B	1
4F	1
6F	1
BA	1
D2	1
D3	1
D4	1
D5	1
D6	1
F2	1
F3	1
F4	1
F5	1
F6	1
14C	1
14D	1
14E	1
14F	1
150	1
151	1
1A0	1
1A1	1
1D1	1
1D2	1
1EA	1
1EB	1
1EC	1
1ED	1
20C	1
20D	1
20E	1
20F	1
22A	1
22B	1
22C	1
22D	1
22E	1
22F	1
230	1
231	1
366	1
152	1
153	1
276	1
D8	1
F8	1
1FE	1
1FF	1
186	1
254	1
19F	1
275	1
277	1
222	1
223	1
50	1
70	1
1A4	1
1A5	1
278	1
51	1
71	1
2A0	1
138	1
52	1
72	1
154	1
155	1
156	1
157	1
158	1
159	1
210	1
211	1
212	1
213	1
2B3	1
36C	1
1A6	1
280	1
279	1
2B4	1
27A	1
27B	1
2B5	1
27C	1
27D	1
27E	1
27F	1
281	1
2B6	1
53	1
73	1
15A	1
15B	1
15C	1
15D	1
15E	1
15F	1
160	1
161	1
17F	1
218	1
219	1
2E2	1
DF	1
282	1
1A9	1
283	1
1AA	1
285	1
286	1
54	1
74	1
162	1
163	1
164	1
165	1
21A	1
21B	1
36D	1
2A8	1
1BE	1
2A6	1
2A7	1
166	1
167	1
1AB	1
1AC	1
1AD	1
1AE	1
288	1
236	1
287	1
55	1
75	1
D9	1
DA	1
DB	1
DC	1
F9	1
FA	1
FB	1
FC	1
168	1
169	1
16A	1
16B	1
16C	1
16D	1
16E	1
16F	1
170	1
171	1
172	1
173	1
1AF	1
1B0	1
1D3	1
1D4	1
1D5	1
1D6	1
1D7	1
1D8	1
1D9	1
1DA	1
1DB	1
1DC	1
214	1
215	1
216	1
217	1
367	1
289	1
265	1
2AE	1
2AF	1
19C	1
26F	1
270	1
1B1	1
28A	1
56	1
76	1
36E	1
1B2	1
28B	1
28C	1
57	1
77	1
174	1
175	1
2B7	1
28D	1
58	1
78	1
2E3	1
36F	1
59	1
79	1
DD	1
FD	1
FF	1
176	1
177	1
178	1
232	1
233	1
2B8	1
28F	1
1B3	1
1B4	1
5A	1
7A	1
179	1
17A	1
17B	1
17C	1
17D	1
17E	1
18D	1
1B5	1
1B6	1
224	1
225	1
290	1
291	1
1B7	1
1EE	1
1EF	1
292	1
1B8	1
1B9	1
1BA	1
293	1
21C	1
21D	1
DE	1
FE	1
1BF	1
1F7	1
1BB	1
1A7	1
1A8	1
1BC	1
1BD	1
184	1
185	1
294	1
2C0	1
2BC	1
149	1
2EE	1
2BE	1
295	1
2E4	1
2BF	1
2C1	1
2A1	1
2A2	1
296	1
1C0	1
1C1	1
1C2	1
1C3	1
297	1
298	1
2AC	1
2AD	1
386	1
391	1
3AC	1
3B1	1
392	1
3B2	1
3D0	1
393	1
3B3	1
394	1
3B4	1
388	1
395	1
3AD	1
3B5	1
3F5	1
3DC	1
3DD	1
3DA	1
3DB	1
396	1
3B6	1
389	1
397	1
3AE	1
3B7	1
398	1
3B8	1
3D1	1
3F4	1
37A	1
38A	1
390	1
399	1
3AA	1
3AF	1
3B9	1
3CA	1
3F3	1
39A	1
3BA	1
3F0	1
3D7	1
39B	1
3BB	1
B5	1
39C	1
3BC	1
39D	1
3BD	1
39E	1
3BE	1
38C	1
39F	1
3BF	1
3CC	1
3A0	1
3C0	1
3D6	1
3DE	1
3DF	1
3D8	1
3D9	1
3A1	1
3C1	1
3F1	1
3A3	1
3C2	1
3C3	1
3F2	1
3F9	1
3A4	1
3C4	1
38E	1
3A5	1
3AB	1
3B0	1
3C5	1
3CB	1
3CD	1
3D2	1
3D3	1
3D4	1
3A6	1
3C6	1
3D5	1
3A7	1
3C7	1
3A8	1
3C8	1
38F	1
3A9	1
3C9	1
3CE	1
3E0	1
3E1	1
3F7	1
3F8	1
3FA	1
3FB	1
3E2	1
3E3	1
3E4	1
3E5	1
3E6	1
3E7	1
3E8	1
3E9	1
3EA	1
3EB	1
3EC	1
3ED	1
3EE	1
3EF	1
410	1
430	1
4D0	1
4D1	1
4D2	1
4D3	1
4D8	1
4D9	1
4DA	1
4DB	1
4D4	1
4D5	1
411	1
431	1
412	1
432	1
413	1
433	1
490	1
491	1
492	1
493	1
494	1
495	1
414	1
434	1
500	1
501	1
402	1
452	1
502	1
503	1
403	1
453	1
498	1
499	1
400	1
401	1
415	1
435	1
450	1
451	1
4D6	1
4D7	1
404	1
454	1
416	1
436	1
4C1	1
4C2	1
4DC	1
4DD	1
496	1
497	1
417	1
437	1
504	1
505	1
4DE	1
4DF	1
405	1
455	1
4E0	1
4E1	1
506	1
507	1
40D	1
418	1
438	1
45D	1
4E2	1
4E3	1
48A	1
48B	1
4E4	1
4E5	1
406	1
456	1
407	1
457	1
419	1
439	1
408	1
458	1
41A	1
43A	1
49A	1
49B	1
4C3	1
4C4	1
4A0	1
4A1	1
49E	1
49F	1
49C	1
49D	1
41B	1
43B	1
4C5	1
4C6	1
409	1
459	1
508	1
509	1
41C	1
43C	1
4CD	1
4CE	1
41D	1
43D	1
4C9	1
4CA	1
4A2	1
4A3	1
4C7	1
4C8	1
4A4	1
4A5	1
40A	1
45A	1
50A	1
50B	1
41E	1
43E	1
4E6	1
4E7	1
4E8	1
4E9	1
4EA	1
4EB	1
41F	1
43F	1
4A6	1
4A7	1
480	1
481	1
420	1
440	1
48E	1
48F	1
421	1
441	1
50C	1
50D	1
4AA	1
4AB	1
422	1
442	1
50E	1
50F	1
4AC	1
4AD	1
40B	1
45B	1
40C	1
45C	1
423	1
443	1
4EE	1
4EF	1
40E	1
45E	1
4F0	1
4F1	1
4F2	1
4F3	1
4AE	1
4AF	1
4B0	1
4B1	1
478	1
479	1
424	1
444	1
425	1
445	1
4B2	1
4B3	1
4BA	1
4BB	1
460	1
461	1
47E	1
47F	1
47C	1
47D	1
47A	1
47B	1
426	1
446	1
4B4	1
4B5	1
427	1
447	1
4F4	1
4F5	1
4B6	1
4B7	1
4CB	1
4CC	1
4B8	1
4B9	1
4BC	1
4BD	1
4BE	1
4BF	1
40F	1
45F	1
428	1
448	1
429	1
449	1
42A	1
44A	1
42B	1
44B	1
4F8	1
4F9	1
42C	1
44C	1
48C	1
48D	1
462	1
463	1
42D	1
44D	1
4EC	1
4ED	1
42E	1
44E	1
42F	1
44F	1
464	1
465	1
466	1
467	1
46A	1
46B	1
468	1
469	1
46C	1
46D	1
46E	1
46F	1
470	1
471	1
472	1
473	1
474	1
475	1
476	1
477	1
4A8	1
4A9	1
4C0	1
531	1
561	1
532	1
562	1
533	1
563	1
534	1
564	1
535	1
565	1
587	1
536	1
566	1
537	1
567	1
538	1
568	1
539	1
569	1
53A	1
56A	1
53B	1
56B	1
53C	1
56C	1
53D	1
56D	1
53E	1
56E	1
53F	1
56F	1
540	1
570	1
541	1
571	1
542	1
572	1
543	1
573	1
544	1
574	1
545	1
575	1
546	1
576	1
547	1
577	1
548	1
578	1
549	1
579	1
54A	1
57A	1
54B	1
57B	1
54C	1
57C	1
54D	1
57D	1
54E	1
57E	1
54F	1
57F	1
550	1
580	1
551	1
581	1
552	1
582	1
553	1
583	1
554	1
584	1
555	1
585	1
556	1
586	1
559	1
5D0	1
5D1	1
5D2	1
5D3	1
5D4	1
5D5	1
5F0	1
5F1	1
5D6	1
5D7	1
5D8	1
5D9	1
5F2	1
5DA	1
5DB	1
5DC	1
5DD	1
5DE	1
5DF	1
5E0	1
5E1	1
5E2	1
5E3	1
5E4	1
5E5	1
5E6	1
5E7	1
5E8	1
5E9	1
5EA	1
621	1
674	1
6FD	1
622	1
623	1
672	1
671	1
624	1
625	1
673	1
626	1
627	1
675	1
66E	1
628	1
67B	1
67E	1
680	1
629	1
62A	1
62B	1
679	1
67A	1
67C	1
67D	1
67F	1
62C	1
683	1
684	1
686	1
6BF	1
687	1
62D	1
62E	1
681	1
682	1
685	1
62F	1
630	1
688	1
689	1
68A	1
68B	1
68C	1
68D	1
68E	1
68F	1
690	1
6EE	1
631	1
632	1
691	1
692	1
693	1
694	1
695	1
696	1
697	1
698	1
699	1
6EF	1
633	1
634	1
69A	1
69B	1
69C	1
6FA	1
635	1
636	1
69D	1
69E	1
6FB	1
637	1
638	1
69F	1
639	1
63A	1
6A0	1
6FC	1
641	1
6A1	1
6A2	1
6A3	1
6A4	1
6A5	1
6A6	1
66F	1
642	1
6A7	1
6A8	1
643	1
6A9	1
6AA	1
6AB	1
6AC	1
6AD	1
6AE	1
6AF	1
6B0	1
6B1	1
6B2	1
6B3	1
6B4	1
644	1
6B5	1
6B6	1
6B7	1
6B8	1
645	1
6FE	1
646	1
6BA	1
6BB	1
6BC	1
6BD	1
6B9	1
647	1
6BE	1
6C1	1
6C2	1
6C3	1
6FF	1
6C0	1
6D5	1
648	1
6E5	1
676	1
6C4	1
6C5	1
6C6	1
6C7	1
677	1
6C8	1
6C9	1
6CA	1
6CB	1
6CF	1
649	1
64A	1
6E6	1
678	1
6CC	1
6CD	1
6CE	1
6D0	1
6D1	1
6D2	1
6D3	1
710	1
712	1
72D	1
713	1
714	1
72E	1
716	1
715	1
72F	1
717	1
718	1
719	1
74D	1
71A	1
71B	1
71C	1
71D	1
71E	1
71F	1
74E	1
720	1
721	1
722	1
723	1
724	1
725	1
726	1
727	1
74F	1
728	1
729	1
72A	1
72B	1
72C	1
780	1
799	1
79A	1
781	1
782	1
783	1
79C	1
784	1
785	1
786	1
787	1
7A2	1
7A3	1
788	1
7A5	1
789	1
78A	1
78B	1
79B	1
78C	1
798	1
7A0	1
7A1	1
78D	1
78E	1
7A4	1
78F	1
790	1
79D	1
79E	1
79F	1
791	1
792	1
793	1
794	1
795	1
796	1
797	1
7B1	1
7A6	1
7A7	1
7A8	1
7A9	1
7AA	1
7AB	1
7AC	1
7AD	1
7AE	1
7AF	1
7B0	1
4E00	1
4E01	1
4E02	1
4E03	1
4E04	1
4E05	1
4E06	1
4E07	1
4E08	1
4E09	1
4E0A	1
4E0B	1
4E0C	1
4E0D	1
4E0E	1
4E0F	1
4E10	1
4E11	1
4E12	1
4E13	1
4E14	1
4E15	1
4E16	1
4E17	1
4E18	1
4E19	1
4E1A	1
4E1B	1
4E1C	1
4E1D	1
4E1E	1
4E1F	1
4E20	1
4E21	1
4E22	1
4E23	1
4E24	1
4E25	1
4E26	1
4E27	1
4E28	1
4E29	1
4E2A	1
4E2B	1
4E2C	1
4E2D	1
4E2E	1
4E2F	1
4E30	1
4E31	1
4E32	1
4E33	1
4E34	1
4E35	1
4E36	1
4E37	1
4E38	1
4E39	1
4E3A	1
4E3B	1
4E3C	1
4E3D	1
4E3E	1
4E3F	1
4E40	1
4E41	1
4E42	1
4E43	1
4E44	1
4E45	1
4E46	1
4E47	1
4E48	1
4E49	1
4E4A	1
4E4B	1
4E4C	1
4E4D	1
4E4E	1
4E4F	1
4E50	1
4E51	1
4E52	1
4E53	1
4E54	1
4E55	1
4E56	1
4E57	1
4E58	1
4E59	1
4E5A	1
4E5B	1
4E5C	1
4E5D	1
4E5E	1
4E5F	1
4E60	1
4E61	1
4E62	1
4E63	1
4E64	1
4E65	1
4E66	1
4E67	1
4E68	1
4E69	1
4E6A	1
4E6B	1
4E6C	1
4E6D	1
4E6E	1
4E6F	1
4E70	1
4E71	1
4E72	1
4E73	1
4E74	1
4E75	1
4E76	1
4E77	1
4E78	1
4E79	1
4E7A	1
4E7B	1
4E7C	1
4E7D	1
4E7E	1
4E7F	1
4E80	1
4E81	1
4E82	1
4E83	1
4E84	1
4E85	1
4E86	1
4E87	1
4E88	1
4E89	1
4E8A	1
4E8B	1
4E8C	1
4E8D	1
4E8E	1
4E8F	1
4E90	1
4E91	1
4E92	1
4E93	1
4E94	1
4E95	1
4E96	1
4E97	1
4E98	1
4E99	1
4E9A	1
4E9B	1
4E9C	1
4E9D	1
4E9E	1
4E9F	1
4EA0	1
4EA1	1
4EA2	1
4EA3	1
4EA4	1
4EA5	1
4EA6	1
4EA7	1
4EA8	1
4EA9	1
4EAA	1
4EAB	1
4EAC	1
4EAD	1
4EAE	1
4EAF	1
4EB0	1
4EB1	1
4EB2	1
4EB3	1
4EB4	1
4EB5	1
4EB6	1
4EB7	1
4EB8	1
4EB9	1
4EBA	1
4EBB	1
4EBC	1
4EBD	1
4EBE	1
4EBF	1
4EC0	1
4EC1	1
4EC2	1
4EC3	1
4EC4	1
4EC5	1
4EC6	1
4EC7	1
4EC8	1
4EC9	1
4ECA	1
4ECB	1
4ECC	1
4ECD	1
4ECE	1
4ECF	1
4ED0	1
4ED1	1
4ED2	1
4ED3	1
4ED4	1
4ED5	1
4ED6	1
4ED7	1
4ED8	1
4ED9	1
4EDA	1
4EDB	1
4EDC	1
4EDD	1
4EDE	1
4EDF	1
4EE0	1
4EE1	1
4EE2	1
4EE3	1
4EE4	1
4EE5	1
4EE6	1
4EE7	1
4EE8	1
4EE9	1
4EEA	1
4EEB	1
4EEC	1
4EED	1
4EEE	1
4EEF	1
4EF0	1
4EF1	1
4EF2	1
4EF3	1
4EF4	1
4EF5	1
4EF6	1
4EF7	1
4EF8	1
4EF9	1
4EFA	1
4EFB	1
4EFC	1
4EFD	1
4EFE	1
4EFF	1
4F00	1
4F01	1
4F02	1
4F03	1
4F04	1
4F05	1
4F06	1
4F07	1
4F08	1
4F09	1
4F0A	1
4F0B	1
4F0C	1
4F0D	1
4F0E	1
4F0F	1
4F10	1
4F11	1
4F12	1
4F13	1
4F14	1
4F15	1
4F16	1
4F17	1
4F18	1
4F19	1
4F1A	1
4F1B	1
4F1C	1
4F1D	1
4F1E	1
4F1F	1
4F20	1
4F21	1
4F22	1
4F23	1
4F24	1
4F25	1
4F26	1
4F27	1
4F28	1
4F29	1
4F2A	1
4F2B	1
4F2C	1
4F2D	1
4F2E	1
4F2F	1
4F30	1
4F31	1
4F32	1
4F33	1
4F34	1
4F35	1
4F36	1
4F37	1
4F38	1
4F39	1
4F3A	1
4F3B	1
4F3C	1
4F3D	1
4F3E	1
4F3F	1
4F40	1
4F41	1
4F42	1
4F43	1
4F44	1
4F45	1
4F46	1
4F47	1
4F48	1
4F49	1
4F4A	1
4F4B	1
4F4C	1
4F4D	1
4F4E	1
4F4F	1
4F50	1
4F51	1
4F52	1
4F53	1
4F54	1
4F55	1
4F56	1
4F57	1
4F58	1
4F59	1
4F5A	1
4F5B	1
4F5C	1
4F5D	1
4F5E	1
4F5F	1
4F60	1
4F61	1
4F62	1
4F63	1
4F64	1
4F65	1
4F66	1
4F67	1
4F68	1
4F69	1
4F6A	1
4F6B	1
4F6C	1
4F6D	1
4F6E	1
4F6F	1
4F70	1
4F71	1
4F72	1
4F73	1
4F74	1
4F75	1
4F76	1
4F77	1
4F78	1
4F79	1
4F7A	1
4F7B	1
4F7C	1
4F7D	1
4F7E	1
4F7F	1
4F80	1
4F81	1
4F82	1
4F83	1
4F84	1
4F85	1
4F86	1
4F87	1
4F88	1
4F89	1
4F8A	1
4F8B	1
4F8C	1
4F8D	1
4F8E	1
4F8F	1
4F90	1
4F91	1
4F92	1
4F93	1
4F94	1
4F95	1
4F96	1
4F97	1
4F98	1
4F99	1
4F9A	1
4F9B	1
4F9C	1
4F9D	1
4F9E	1
4F9F	1
4FA0	1
4FA1	1
4FA2	1
4FA3	1
4FA4	1
4FA5	1
4FA6	1
4FA7	1
4FA8	1
4FA9	1
4FAA	1
4FAB	1
4FAC	1
4FAD	1
4FAE	1
4FAF	1
4FB0	1
4FB1	1
4FB2	1
4FB3	1
4FB4	1
4FB5	1
4FB6	1
4FB7	1
4FB8	1
4FB9	1
4FBA	1
4FBB	1
4FBC	1
4FBD	1
4FBE	1
4FBF	1
4FC0	1
4FC1	1
4FC2	1
4FC3	1
4FC4	1
4FC5	1
4FC6	1
4FC7	1
4FC8	1
4FC9	1
4FCA	1
4FCB	1
4FCC	1
4FCD	1
4FCE	1
4FCF	1
4FD0	1
4FD1	1
4FD2	1
4FD3	1
4FD4	1
4FD5	1
4FD6	1
4FD7	1
4FD8	1
4FD9	1
4FDA	1
4FDB	1
4FDC	1
4FDD	1
4FDE	1
4FDF	1
4FE0	1
4FE1	1
4FE2	1
4FE3	1
4FE4	1
4FE5	1
4FE6	1
4FE7	1
4FE8	1
4FE9	1
4FEA	1
4FEB	1
4FEC	1
4FED	1
4FEE	1
4FEF	1
4FF0	1
4FF1	1
4FF2	1
4FF3	1
4FF4	1
4FF5	1
4FF6	1
4FF7	1
4FF8	1
4FF9	1
4FFA	1
4FFB	1
4FFC	1
4FFD	1
4FFE	1
4FFF	1
237	1
238	1
239	1
23A	1
23B	1
23C	1
23D	1
23E	1
23F	1
240	1
241	1
242	1
243	1
244	1
245	1
246	1
247	1
248	1
249	1
24A	1
24B	1
24C	1
24D	1
24E	1
24F	1
358	1
359	1
35A	1
35B	1
35C	1
370	1
371	1
372	1
373	1
376	1
377	1
378	1
379	1
37B	1
37C	1
37D	1
37F	1
380	1
381	1
382	1
383	1
38B	1
38D	1
3A2	1
3CF	1
3FC	1
3FD	1
3FE	1
3FF	1
487	1
4CF	1
4F6	1
4F7	1
4FA	1
4FB	1
4FC	1
4FD	1
4FE	1
4FF	1
510	1
511	1
512	1
513	1
514	1
515	1
516	1
517	1
518	1
519	1
51A	1
51B	1
51C	1
51D	1
51E	1
51F	1
520	1
521	1
522	1
523	1
524	1
525	1
526	1
527	1
528	1
529	1
52A	1
52B	1
52C	1
52D	1
52E	1
52F	1
530	1
557	1
558	1
560	1
588	1
58B	1
58C	1
58D	1
58E	1
58F	1
590	1
5A2	1
5BA	1
5C5	1
5C6	1
5C7	1
5C8	1
5C9	1
5CA	1
5CB	1
5CC	1
5CD	1
5CE	1
5CF	1
5EB	1
5EC	1
5ED	1
5EE	1
5EF	1
5F5	1
5F6	1
5F7	1
5F8	1
5F9	1
5FA	1
5FB	1
5FC	1
5FD	1
5FE	1
5FF	1
604	1
605	1
606	1
607	1
608	1
609	1
60A	1
60B	1
616	1
617	1
618	1
619	1
61A	1
61C	1
61D	1
61E	1
620	1
63B	1
63C	1
63D	1
63E	1
63F	1
659	1
65A	1
65B	1
65C	1
65D	1
65E	1
65F	1
70E	1
74B	1
74C	1
750	1
751	1
752	1
753	1
754	1
755	1
756	1
757	1
758	1
759	1
75A	1
75B	1
75C	1
75D	1
75E	1
75F	1
760	1
761	1
762	1
763	1
764	1
765	1
766	1
767	1
768	1
769	1
76A	1
76B	1
76C	1
76D	1
76E	1
76F	1
770	1
771	1
772	1
773	1
774	1
775	1
776	1
777	1
778	1
779	1
77A	1
77B	1
77C	1
77D	1
77E	1
77F	1
7B2	1
7B3	1
7B4	1
7B5	1
7B6	1
7B7	1
7B8	1
7B9	1
7BA	1
7BB	1
7BC	1
7BD	1
7BE	1
7BF	1
7C0	1
7C1	1
7C2	1
7C3	1
7C4	1
7C5	1
7C6	1
7C7	1
7C8	1
7C9	1
7CA	1
7CB	1
7CC	1
7CD	1
7CE	1
7CF	1
7D0	1
7D1	1
7D2	1
7D3	1
7D4	1
7D5	1
7D6	1
7D7	1
7D8	1
7D9	1
7DA	1
7DB	1
7DC	1
7DD	1
7DE	1
7DF	1
7E0	1
7E1	1
7E2	1
7E3	1
7E4	1
7E5	1
7E6	1
7E7	1
7E8	1
7E9	1
7EA	1
7EB	1
7EC	1
7ED	1
7EE	1
7EF	1
7F0	1
7F1	1
7F2	1
7F3	1
7F4	1
7F5	1
7F6	1
7F7	1
7F8	1
7F9	1
7FA	1
7FB	1
7FC	1
7FD	1
7FE	1
7FF	1
DROP TABLE IF EXISTS test.t1;
DROP TABLE IF EXISTS test.t1;
DROP DATABASE test;
CREATE DATABASE test CHARACTER SET utf8mb3;
USE test;
CREATE TABLE test.t1 (a CHAR(4) CHARACTER SET utf8mb3 COLLATE utf8mb3_bin) ENGINE=MyISAM CHARACTER SET utf8mb3 COLLATE utf8mb3_bin;
Warnings:
Warning	1287	'utf8mb3' is deprecated and will be removed in a future release. Please use utf8mb4 instead
Warning	3778	'utf8mb3_bin' is a collation of the deprecated character set UTF8MB3. Please consider using UTF8MB4 with an appropriate collation instead.
Warning	1287	'utf8mb3' is deprecated and will be removed in a future release. Please use utf8mb4 instead
Warning	3778	'utf8mb3_bin' is a collation of the deprecated character set UTF8MB3. Please consider using UTF8MB4 with an appropriate collation instead.
SHOW TABLE STATUS LIKE 't1';
Name	Engine	Version	Row_format	Rows	Avg_row_length	Data_length	Max_data_length	Index_length	Data_free	Auto_increment	Create_time	Update_time	Check_time	Collation	Checksum	Create_options	Comment
t1	MyISAM	#	#	#	#	#	#	#	#	#	#	#	#	utf8mb3_bin	#	#	#
LOAD DATA INFILE 
'MYSQL_TEST_DIR/suite/funcs_2/data/charset_utf8.txt' INTO TABLE test.t1;
DELETE FROM test.t1 WHERE CHAR_LENGTH(a) <> 1;
SELECT HEX(ORD(a)) AS a_ord, CHAR_LENGTH(a) AS a_len FROM test.t1 ORDER BY a, ORD(a);
a_ord	a_len
21	1
22	1
23	1
24	1
25	1
26	1
27	1
28	1
29	1
2A	1
2B	1
2C	1
2D	1
2E	1
2F	1
30	1
31	1
32	1
33	1
34	1
35	1
36	1
37	1
38	1
39	1
3A	1
3B	1
3C	1
3D	1
3E	1
3F	1
40	1
41	1
42	1
43	1
44	1
45	1
46	1
47	1
48	1
49	1
4A	1
4B	1
4C	1
4D	1
4E	1
4F	1
50	1
51	1
52	1
53	1
54	1
55	1
56	1
57	1
58	1
59	1
5A	1
5B	1
5E	1
5F	1
60	1
61	1
62	1
63	1
64	1
65	1
66	1
67	1
68	1
69	1
6A	1
6B	1
6C	1
6D	1
6E	1
6F	1
70	1
71	1
72	1
73	1
74	1
75	1
76	1
77	1
78	1
79	1
7A	1
7B	1
7C	1
7D	1
7E	1
7F	1
C280	1
C281	1
C282	1
C283	1
C284	1
C285	1
C286	1
C287	1
C288	1
C289	1
C28A	1
C28B	1
C28C	1
C28D	1
C28E	1
C28F	1
C290	1
C291	1
C292	1
C293	1
C294	1
C295	1
C296	1
C297	1
C298	1
C299	1
C29A	1
C29B	1
C29C	1
C29D	1
C29E	1
C29F	1
C2A0	1
C2A1	1
C2A2	1
C2A3	1
C2A4	1
C2A5	1
C2A6	1
C2A7	1
C2A8	1
C2A9	1
C2AA	1
C2AB	1
C2AC	1
C2AD	1
C2AE	1
C2AF	1
C2B0	1
C2B1	1
C2B2	1
C2B3	1
C2B4	1
C2B5	1
C2B6	1
C2B7	1
C2B8	1
C2B9	1
C2BA	1
C2BB	1
C2BC	1
C2BD	1
C2BE	1
C2BF	1
C380	1
C381	1
C382	1
C383	1
C384	1
C385	1
C386	1
C387	1
C388	1
C389	1
C38A	1
C38B	1
C38C	1
C38D	1
C38E	1
C38F	1
C390	1
C391	1
C392	1
C393	1
C394	1
C395	1
C396	1
C397	1
C398	1
C399	1
C39A	1
C39B	1
C39C	1
C39D	1
C39E	1
C39F	1
C3A0	1
C3A1	1
C3A2	1
C3A3	1
C3A4	1
C3A5	1
C3A6	1
C3A7	1
C3A8	1
C3A9	1
C3AA	1
C3AB	1
C3AC	1
C3AD	1
C3AE	1
C3AF	1
C3B0	1
C3B1	1
C3B2	1
C3B3	1
C3B4	1
C3B5	1
C3B6	1
C3B7	1
C3B8	1
C3B9	1
C3BA	1
C3BB	1
C3BC	1
C3BD	1
C3BE	1
C3BF	1
C480	1
C481	1
C482	1
C483	1
C484	1
C485	1
C486	1
C487	1
C488	1
C489	1
C48A	1
C48B	1
C48C	1
C48D	1
C48E	1
C48F	1
C490	1
C491	1
C492	1
C493	1
C494	1
C495	1
C496	1
C497	1
C498	1
C499	1
C49A	1
C49B	1
C49C	1
C49D	1
C49E	1
C49F	1
C4A0	1
C4A1	1
C4A2	1
C4A3	1
C4A4	1
C4A5	1
C4A6	1
C4A7	1
C4A8	1
C4A9	1
C4AA	1
C4AB	1
C4AC	1
C4AD	1
C4AE	1
C4AF	1
C4B0	1
C4B1	1
C4B2	1
C4B3	1
C4B4	1
C4B5	1
C4B6	1
C4B7	1
C4B8	1
C4B9	1
C4BA	1
C4BB	1
C4BC	1
C4BD	1
C4BE	1
C4BF	1
C580	1
C581	1
C582	1
C583	1
C584	1
C585	1
C586	1
C587	1
C588	1
C589	1
C58A	1
C58B	1
C58C	1
C58D	1
C58E	1
C58F	1
C590	1
C591	1
C592	1
C593	1
C594	1
C595	1
C596	1
C597	1
C598	1
C599	1
C59A	1
C59B	1
C59C	1
C59D	1
C59E	1
C59F	1
C5A0	1
C5A1	1
C5A2	1
C5A3	1
C5A4	1
C5A5	1
C5A6	1
C5A7	1
C5A8	1
C5A9	1
C5AA	1
C5AB	1
C5AC	1
C5AD	1
C5AE	1
C5AF	1
C5B0	1
C5B1	1
C5B2	1
C5B3	1
C5B4	1
C5B5	1
C5B6	1
C5B7	1
C5B8	1
C5B9	1
C5BA	1
C5BB	1
C5BC	1
C5BD	1
C5BE	1
C5BF	1
C680	1
C681	1
C682	1
C683	1
C684	1
C685	1
C686	1
C687	1
C688	1
C689	1
C68A	1
C68B	1
C68C	1
C68D	1
C68E	1
C68F	1
C690	1
C691	1
C692	1
C693	1
C694	1
C695	1
C696	1
C697	1
C698	1
C699	1
C69A	1
C69B	1
C69C	1
C69D	1
C69E	1
C69F	1
C6A0	1
C6A1	1
C6A2	1
C6A3	1
C6A4	1
C6A5	1
C6A6	1
C6A7	1
C6A8	1
C6A9	1
C6AA	1
C6AB	1
C6AC	1
C6AD	1
C6AE	1
C6AF	1
C6B0	1
C6B1	1
C6B2	1
C6B3	1
C6B4	1
C6B5	1
C6B6	1
C6B7	1
C6B8	1
C6B9	1
C6BA	1
C6BB	1
C6BC	1
C6BD	1
C6BE	1
C6BF	1
C780	1
C781	1
C782	1
C783	1
C784	1
C785	1
C786	1
C787	1
C788	1
C789	1
C78A	1
C78B	1
C78C	1
C78D	1
C78E	1
C78F	1
C790	1
C791	1
C792	1
C793	1
C794	1
C795	1
C796	1
C797	1
C798	1
C799	1
C79A	1
C79B	1
C79C	1
C79D	1
C79E	1
C79F	1
C7A0	1
C7A1	1
C7A2	1
C7A3	1
C7A4	1
C7A5	1
C7A6	1
C7A7	1
C7A8	1
C7A9	1
C7AA	1
C7AB	1
C7AC	1
C7AD	1
C7AE	1
C7AF	1
C7B0	1
C7B1	1
C7B2	1
C7B3	1
C7B4	1
C7B5	1
C7B6	1
C7B7	1
C7B8	1
C7B9	1
C7BA	1
C7BB	1
C7BC	1
C7BD	1
C7BE	1
C7BF	1
C880	1
C881	1
C882	1
C883	1
C884	1
C885	1
C886	1
C887	1
C888	1
C889	1
C88A	1
C88B	1
C88C	1
C88D	1
C88E	1
C88F	1
C890	1
C891	1
C892	1
C893	1
C894	1
C895	1
C896	1
C897	1
C898	1
C899	1
C89A	1
C89B	1
C89C	1
C89D	1
C89E	1
C89F	1
C8A0	1
C8A1	1
C8A2	1
C8A3	1
C8A4	1
C8A5	1
C8A6	1
C8A7	1
C8A8	1
C8A9	1
C8AA	1
C8AB	1
C8AC	1
C8AD	1
C8AE	1
C8AF	1
C8B0	1
C8B1	1
C8B2	1
C8B3	1
C8B4	1
C8B5	1
C8B6	1
C8B7	1
C8B8	1
C8B9	1
C8BA	1
C8BB	1
C8BC	1
C8BD	1
C8BE	1
C8BF	1
C980	1
C981	1
C982	1
C983	1
C984	1
C985	1
C986	1
C987	1
C988	1
C989	1
C98A	1
C98B	1
C98C	1
C98D	1
C98E	1
C98F	1
C990	1
C991	1
C992	1
C993	1
C994	1
C995	1
C996	1
C997	1
C998	1
C999	1
C99A	1
C99B	1
C99C	1
C99D	1
C99E	1
C99F	1
C9A0	1
C9A1	1
C9A2	1
C9A3	1
C9A4	1
C9A5	1
C9A6	1
C9A7	1
C9A8	1
C9A9	1
C9AA	1
C9AB	1
C9AC	1
C9AD	1
C9AE	1
C9AF	1
C9B0	1
C9B1	1
C9B2	1
C9B3	1
C9B4	1
C9B5	1
C9B6	1
C9B7	1
C9B8	1
C9B9	1
C9BA	1
C9BB	1
C9BC	1
C9BD	1
C9BE	1
C9BF	1
CA80	1
CA81	1
CA82	1
CA83	1
CA84	1
CA85	1
CA86	1
CA87	1
CA88	1
CA89	1
CA8A	1
CA8B	1
CA8C	1
CA8D	1
CA8E	1
CA8F	1
CA90	1
CA91	1
CA92	1
CA93	1
CA94	1
CA95	1
CA96	1
CA97	1
CA98	1
CA99	1
CA9A	1
CA9B	1
CA9C	1
CA9D	1
CA9E	1
CA9F	1
CAA0	1
CAA1	1
CAA2	1
CAA3	1
CAA4	1
CAA5	1
CAA6	1
CAA7	1
CAA8	1
CAA9	1
CAAA	1
CAAB	1
CAAC	1
CAAD	1
CAAE	1
CAAF	1
CAB0	1
CAB1	1
CAB2	1
CAB3	1
CAB4	1
CAB5	1
CAB6	1
CAB7	1
CAB8	1
CAB9	1
CABA	1
CABB	1
CABC	1
CABD	1
CABE	1
CABF	1
CB80	1
CB81	1
CB82	1
CB83	1
CB84	1
CB85	1
CB86	1
CB87	1
CB88	1
CB89	1
CB8A	1
CB8B	1
CB8C	1
CB8D	1
CB8E	1
CB8F	1
CB90	1
CB91	1
CB92	1
CB93	1
CB94	1
CB95	1
CB96	1
CB97	1
CB98	1
CB99	1
CB9A	1
CB9B	1
CB9C	1
CB9D	1
CB9E	1
CB9F	1
CBA0	1
CBA1	1
CBA2	1
CBA3	1
CBA4	1
CBA5	1
CBA6	1
CBA7	1
CBA8	1
CBA9	1
CBAA	1
CBAB	1
CBAC	1
CBAD	1
CBAE	1
CBAF	1
CBB0	1
CBB1	1
CBB2	1
CBB3	1
CBB4	1
CBB5	1
CBB6	1
CBB7	1
CBB8	1
CBB9	1
CBBA	1
CBBB	1
CBBC	1
CBBD	1
CBBE	1
CBBF	1
CC80	1
CC81	1
CC82	1
CC83	1
CC84	1
CC85	1
CC86	1
CC87	1
CC88	1
CC89	1
CC8A	1
CC8B	1
CC8C	1
CC8D	1
CC8E	1
CC8F	1
CC90	1
CC91	1
CC92	1
CC93	1
CC94	1
CC95	1
CC96	1
CC97	1
CC98	1
CC99	1
CC9A	1
CC9B	1
CC9C	1
CC9D	1
CC9E	1
CC9F	1
CCA0	1
CCA1	1
CCA2	1
CCA3	1
CCA4	1
CCA5	1
CCA6	1
CCA7	1
CCA8	1
CCA9	1
CCAA	1
CCAB	1
CCAC	1
CCAD	1
CCAE	1
CCAF	1
CCB0	1
CCB1	1
CCB2	1
CCB3	1
CCB4	1
CCB5	1
CCB6	1
CCB7	1
CCB8	1
CCB9	1
CCBA	1
CCBB	1
CCBC	1
CCBD	1
CCBE	1
CCBF	1
CD80	1
CD81	1
CD82	1
CD83	1
CD84	1
CD85	1
CD86	1
CD87	1
CD88	1
CD89	1
CD8A	1
CD8B	1
CD8C	1
CD8D	1
CD8E	1
CD8F	1
CD90	1
CD91	1
CD92	1
CD93	1
CD94	1
CD95	1
CD96	1
CD97	1
CD98	1
CD99	1
CD9A	1
CD9B	1
CD9C	1
CD9D	1
CD9E	1
CD9F	1
CDA0	1
CDA1	1
CDA2	1
CDA3	1
CDA4	1
CDA5	1
CDA6	1
CDA7	1
CDA8	1
CDA9	1
CDAA	1
CDAB	1
CDAC	1
CDAD	1
CDAE	1
CDAF	1
CDB0	1
CDB1	1
CDB2	1
CDB3	1
CDB4	1
CDB5	1
CDB6	1
CDB7	1
CDB8	1
CDB9	1
CDBA	1
CDBB	1
CDBC	1
CDBD	1
CDBE	1
CDBF	1
CE80	1
CE81	1
CE82	1
CE83	1
CE84	1
CE85	1
CE86	1
CE87	1
CE88	1
CE89	1
CE8A	1
CE8B	1
CE8C	1
CE8D	1
CE8E	1
CE8F	1
CE90	1
CE91	1
CE92	1
CE93	1
CE94	1
CE95	1
CE96	1
CE97	1
CE98	1
CE99	1
CE9A	1
CE9B	1
CE9C	1
CE9D	1
CE9E	1
CE9F	1
CEA0	1
CEA1	1
CEA2	1
CEA3	1
CEA4	1
CEA5	1
CEA6	1
CEA7	1
CEA8	1
CEA9	1
CEAA	1
CEAB	1
CEAC	1
CEAD	1
CEAE	1
CEAF	1
CEB0	1
CEB1	1
CEB2	1
CEB3	1
CEB4	1
CEB5	1
CEB6	1
CEB7	1
CEB8	1
CEB9	1
CEBA	1
CEBB	1
CEBC	1
CEBD	1
CEBE	1
CEBF	1
CF80	1
CF81	1
CF82	1
CF83	1
CF84	1
CF85	1
CF86	1
CF87	1
CF88	1
CF89	1
CF8A	1
CF8B	1
CF8C	1
CF8D	1
CF8E	1
CF8F	1
CF90	1
CF91	1
CF92	1
CF93	1
CF94	1
CF95	1
CF96	1
CF97	1
CF98	1
CF99	1
CF9A	1
CF9B	1
CF9C	1
CF9D	1
CF9E	1
CF9F	1
CFA0	1
CFA1	1
CFA2	1
CFA3	1
CFA4	1
CFA5	1
CFA6	1
CFA7	1
CFA8	1
CFA9	1
CFAA	1
CFAB	1
CFAC	1
CFAD	1
CFAE	1
CFAF	1
CFB0	1
CFB1	1
CFB2	1
CFB3	1
CFB4	1
CFB5	1
CFB6	1
CFB7	1
CFB8	1
CFB9	1
CFBA	1
CFBB	1
CFBC	1
CFBD	1
CFBE	1
CFBF	1
D080	1
D081	1
D082	1
D083	1
D084	1
D085	1
D086	1
D087	1
D088	1
D089	1
D08A	1
D08B	1
D08C	1
D08D	1
D08E	1
D08F	1
D090	1
D091	1
D092	1
D093	1
D094	1
D095	1
D096	1
D097	1
D098	1
D099	1
D09A	1
D09B	1
D09C	1
D09D	1
D09E	1
D09F	1
D0A0	1
D0A1	1
D0A2	1
D0A3	1
D0A4	1
D0A5	1
D0A6	1
D0A7	1
D0A8	1
D0A9	1
D0AA	1
D0AB	1
D0AC	1
D0AD	1
D0AE	1
D0AF	1
D0B0	1
D0B1	1
D0B2	1
D0B3	1
D0B4	1
D0B5	1
D0B6	1
D0B7	1
D0B8	1
D0B9	1
D0BA	1
D0BB	1
D0BC	1
D0BD	1
D0BE	1
D0BF	1
D180	1
D181	1
D182	1
D183	1
D184	1
D185	1
D186	1
D187	1
D188	1
D189	1
D18A	1
D18B	1
D18C	1
D18D	1
D18E	1
D18F	1
D190	1
D191	1
D192	1
D193	1
D194	1
D195	1
D196	1
D197	1
D198	1
D199	1
D19A	1
D19B	1
D19C	1
D19D	1
D19E	1
D19F	1
D1A0	1
D1A1	1
D1A2	1
D1A3	1
D1A4	1
D1A5	1
D1A6	1
D1A7	1
D1A8	1
D1A9	1
D1AA	1
D1AB	1
D1AC	1
D1AD	1
D1AE	1
D1AF	1
D1B0	1
D1B1	1
D1B2	1
D1B3	1
D1B4	1
D1B5	1
D1B6	1
D1B7	1
D1B8	1
D1B9	1
D1BA	1
D1BB	1
D1BC	1
D1BD	1
D1BE	1
D1BF	1
D280	1
D281	1
D282	1
D283	1
D284	1
D285	1
D286	1
D287	1
D288	1
D289	1
D28A	1
D28B	1
D28C	1
D28D	1
D28E	1
D28F	1
D290	1
D291	1
D292	1
D293	1
D294	1
D295	1
D296	1
D297	1
D298	1
D299	1
D29A	1
D29B	1
D29C	1
D29D	1
D29E	1
D29F	1
D2A0	1
D2A1	1
D2A2	1
D2A3	1
D2A4	1
D2A5	1
D2A6	1
D2A7	1
D2A8	1
D2A9	1
D2AA	1
D2AB	1
D2AC	1
D2AD	1
D2AE	1
D2AF	1
D2B0	1
D2B1	1
D2B2	1
D2B3	1
D2B4	1
D2B5	1
D2B6	1
D2B7	1
D2B8	1
D2B9	1
D2BA	1
D2BB	1
D2BC	1
D2BD	1
D2BE	1
D2BF	1
D380	1
D381	1
D382	1
D383	1
D384	1
D385	1
D386	1
D387	1
D388	1
D389	1
D38A	1
D38B	1
D38C	1
D38D	1
D38E	1
D38F	1
D390	1
D391	1
D392	1
D393	1
D394	1
D395	1
D396	1
D397	1
D398	1
D399	1
D39A	1
D39B	1
D39C	1
D39D	1
D39E	1
D39F	1
D3A0	1
D3A1	1
D3A2	1
D3A3	1
D3A4	1
D3A5	1
D3A6	1
D3A7	1
D3A8	1
D3A9	1
D3AA	1
D3AB	1
D3AC	1
D3AD	1
D3AE	1
D3AF	1
D3B0	1
D3B1	1
D3B2	1
D3B3	1
D3B4	1
D3B5	1
D3B6	1
D3B7	1
D3B8	1
D3B9	1
D3BA	1
D3BB	1
D3BC	1
D3BD	1
D3BE	1
D3BF	1
D480	1
D481	1
D482	1
D483	1
D484	1
D485	1
D486	1
D487	1
D488	1
D489	1
D48A	1
D48B	1
D48C	1
D48D	1
D48E	1
D48F	1
D490	1
D491	1
D492	1
D493	1
D494	1
D495	1
D496	1
D497	1
D498	1
D499	1
D49A	1
D49B	1
D49C	1
D49D	1
D49E	1
D49F	1
D4A0	1
D4A1	1
D4A2	1
D4A3	1
D4A4	1
D4A5	1
D4A6	1
D4A7	1
D4A8	1
D4A9	1
D4AA	1
D4AB	1
D4AC	1
D4AD	1
D4AE	1
D4AF	1
D4B0	1
D4B1	1
D4B2	1
D4B3	1
D4B4	1
D4B5	1
D4B6	1
D4B7	1
D4B8	1
D4B9	1
D4BA	1
D4BB	1
D4BC	1
D4BD	1
D4BE	1
D4BF	1
D580	1
D581	1
D582	1
D583	1
D584	1
D585	1
D586	1
D587	1
D588	1
D589	1
D58A	1
D58B	1
D58C	1
D58D	1
D58E	1
D58F	1
D590	1
D591	1
D592	1
D593	1
D594	1
D595	1
D596	1
D597	1
D598	1
D599	1
D59A	1
D59B	1
D59C	1
D59D	1
D59E	1
D59F	1
D5A0	1
D5A1	1
D5A2	1
D5A3	1
D5A4	1
D5A5	1
D5A6	1
D5A7	1
D5A8	1
D5A9	1
D5AA	1
D5AB	1
D5AC	1
D5AD	1
D5AE	1
D5AF	1
D5B0	1
D5B1	1
D5B2	1
D5B3	1
D5B4	1
D5B5	1
D5B6	1
D5B7	1
D5B8	1
D5B9	1
D5BA	1
D5BB	1
D5BC	1
D5BD	1
D5BE	1
D5BF	1
D680	1
D681	1
D682	1
D683	1
D684	1
D685	1
D686	1
D687	1
D688	1
D689	1
D68A	1
D68B	1
D68C	1
D68D	1
D68E	1
D68F	1
D690	1
D691	1
D692	1
D693	1
D694	1
D695	1
D696	1
D697	1
D698	1
D699	1
D69A	1
D69B	1
D69C	1
D69D	1
D69E	1
D69F	1
D6A0	1
D6A1	1
D6A2	1
D6A3	1
D6A4	1
D6A5	1
D6A6	1
D6A7	1
D6A8	1
D6A9	1
D6AA	1
D6AB	1
D6AC	1
D6AD	1
D6AE	1
D6AF	1
D6B0	1
D6B1	1
D6B2	1
D6B3	1
D6B4	1
D6B5	1
D6B6	1
D6B7	1
D6B8	1
D6B9	1
D6BA	1
D6BB	1
D6BC	1
D6BD	1
D6BE	1
D6BF	1
D780	1
D781	1
D782	1
D783	1
D784	1
D785	1
D786	1
D787	1
D788	1
D789	1
D78A	1
D78B	1
D78C	1
D78D	1
D78E	1
D78F	1
D790	1
D791	1
D792	1
D793	1
D794	1
D795	1
D796	1
D797	1
D798	1
D799	1
D79A	1
D79B	1
D79C	1
D79D	1
D79E	1
D79F	1
D7A0	1
D7A1	1
D7A2	1
D7A3	1
D7A4	1
D7A5	1
D7A6	1
D7A7	1
D7A8	1
D7A9	1
D7AA	1
D7AB	1
D7AC	1
D7AD	1
D7AE	1
D7AF	1
D7B0	1
D7B1	1
D7B2	1
D7B3	1
D7B4	1
D7B5	1
D7B6	1
D7B7	1
D7B8	1
D7B9	1
D7BA	1
D7BB	1
D7BC	1
D7BD	1
D7BE	1
D7BF	1
D880	1
D881	1
D882	1
D883	1
D884	1
D885	1
D886	1
D887	1
D888	1
D889	1
D88A	1
D88B	1
D88C	1
D88D	1
D88E	1
D88F	1
D890	1
D891	1
D892	1
D893	1
D894	1
D895	1
D896	1
D897	1
D898	1
D899	1
D89A	1
D89B	1
D89C	1
D89D	1
D89E	1
D89F	1
D8A0	1
D8A1	1
D8A2	1
D8A3	1
D8A4	1
D8A5	1
D8A6	1
D8A7	1
D8A8	1
D8A9	1
D8AA	1
D8AB	1
D8AC	1
D8AD	1
D8AE	1
D8AF	1
D8B0	1
D8B1	1
D8B2	1
D8B3	1
D8B4	1
D8B5	1
D8B6	1
D8B7	1
D8B8	1
D8B9	1
D8BA	1
D8BB	1
D8BC	1
D8BD	1
D8BE	1
D8BF	1
D980	1
D981	1
D982	1
D983	1
D984	1
D985	1
D986	1
D987	1
D988	1
D989	1
D98A	1
D98B	1
D98C	1
D98D	1
D98E	1
D98F	1
D990	1
D991	1
D992	1
D993	1
D994	1
D995	1
D996	1
D997	1
D998	1
D999	1
D99A	1
D99B	1
D99C	1
D99D	1
D99E	1
D99F	1
D9A0	1
D9A1	1
D9A2	1
D9A3	1
D9A4	1
D9A5	1
D9A6	1
D9A7	1
D9A8	1
D9A9	1
D9AA	1
D9AB	1
D9AC	1
D9AD	1
D9AE	1
D9AF	1
D9B0	1
D9B1	1
D9B2	1
D9B3	1
D9B4	1
D9B5	1
D9B6	1
D9B7	1
D9B8	1
D9B9	1
D9BA	1
D9BB	1
D9BC	1
D9BD	1
D9BE	1
D9BF	1
DA80	1
DA81	1
DA82	1
DA83	1
DA84	1
DA85	1
DA86	1
DA87	1
DA88	1
DA89	1
DA8A	1
DA8B	1
DA8C	1
DA8D	1
DA8E	1
DA8F	1
DA90	1
DA91	1
DA92	1
DA93	1
DA94	1
DA95	1
DA96	1
DA97	1
DA98	1
DA99	1
DA9A	1
DA9B	1
DA9C	1
DA9D	1
DA9E	1
DA9F	1
DAA0	1
DAA1	1
DAA2	1
DAA3	1
DAA4	1
DAA5	1
DAA6	1
DAA7	1
DAA8	1
DAA9	1
DAAA	1
DAAB	1
DAAC	1
DAAD	1
DAAE	1
DAAF	1
DAB0	1
DAB1	1
DAB2	1
DAB3	1
DAB4	1
DAB5	1
DAB6	1
DAB7	1
DAB8	1
DAB9	1
DABA	1
DABB	1
DABC	1
DABD	1
DABE	1
DABF	1
DB80	1
DB81	1
DB82	1
DB83	1
DB84	1
DB85	1
DB86	1
DB87	1
DB88	1
DB89	1
DB8A	1
DB8B	1
DB8C	1
DB8D	1
DB8E	1
DB8F	1
DB90	1
DB91	1
DB92	1
DB93	1
DB94	1
DB95	1
DB96	1
DB97	1
DB98	1
DB99	1
DB9A	1
DB9B	1
DB9C	1
DB9D	1
DB9E	1
DB9F	1
DBA0	1
DBA1	1
DBA2	1
DBA3	1
DBA4	1
DBA5	1
DBA6	1
DBA7	1
DBA8	1
DBA9	1
DBAA	1
DBAB	1
DBAC	1
DBAD	1
DBAE	1
DBAF	1
DBB0	1
DBB1	1
DBB2	1
DBB3	1
DBB4	1
DBB5	1
DBB6	1
DBB7	1
DBB8	1
DBB9	1
DBBA	1
DBBB	1
DBBC	1
DBBD	1
DBBE	1
DBBF	1
DC80	1
DC81	1
DC82	1
DC83	1
DC84	1
DC85	1
DC86	1
DC87	1
DC88	1
DC89	1
DC8A	1
DC8B	1
DC8C	1
DC8D	1
DC8E	1
DC8F	1
DC90	1
DC91	1
DC92	1
DC93	1
DC94	1
DC95	1
DC96	1
DC97	1
DC98	1
DC99	1
DC9A	1
DC9B	1
DC9C	1
DC9D	1
DC9E	1
DC9F	1
DCA0	1
DCA1	1
DCA2	1
DCA3	1
DCA4	1
DCA5	1
DCA6	1
DCA7	1
DCA8	1
DCA9	1
DCAA	1
DCAB	1
DCAC	1
DCAD	1
DCAE	1
DCAF	1
DCB0	1
DCB1	1
DCB2	1
DCB3	1
DCB4	1
DCB5	1
DCB6	1
DCB7	1
DCB8	1
DCB9	1
DCBA	1
DCBB	1
DCBC	1
DCBD	1
DCBE	1
DCBF	1
DD80	1
DD81	1
DD82	1
DD83	1
DD84	1
DD85	1
DD86	1
DD87	1
DD88	1
DD89	1
DD8A	1
DD8B	1
DD8C	1
DD8D	1
DD8E	1
DD8F	1
DD90	1
DD91	1
DD92	1
DD93	1
DD94	1
DD95	1
DD96	1
DD97	1
DD98	1
DD99	1
DD9A	1
DD9B	1
DD9C	1
DD9D	1
DD9E	1
DD9F	1
DDA0	1
DDA1	1
DDA2	1
DDA3	1
DDA4	1
DDA5	1
DDA6	1
DDA7	1
DDA8	1
DDA9	1
DDAA	1
DDAB	1
DDAC	1
DDAD	1
DDAE	1
DDAF	1
DDB0	1
DDB1	1
DDB2	1
DDB3	1
DDB4	1
DDB5	1
DDB6	1
DDB7	1
DDB8	1
DDB9	1
DDBA	1
DDBB	1
DDBC	1
DDBD	1
DDBE	1
DDBF	1
DE80	1
DE81	1
DE82	1
DE83	1
DE84	1
DE85	1
DE86	1
DE87	1
DE88	1
DE89	1
DE8A	1
DE8B	1
DE8C	1
DE8D	1
DE8E	1
DE8F	1
DE90	1
DE91	1
DE92	1
DE93	1
DE94	1
DE95	1
DE96	1
DE97	1
DE98	1
DE99	1
DE9A	1
DE9B	1
DE9C	1
DE9D	1
DE9E	1
DE9F	1
DEA0	1
DEA1	1
DEA2	1
DEA3	1
DEA4	1
DEA5	1
DEA6	1
DEA7	1
DEA8	1
DEA9	1
DEAA	1
DEAB	1
DEAC	1
DEAD	1
DEAE	1
DEAF	1
DEB0	1
DEB1	1
DEB2	1
DEB3	1
DEB4	1
DEB5	1
DEB6	1
DEB7	1
DEB8	1
DEB9	1
DEBA	1
DEBB	1
DEBC	1
DEBD	1
DEBE	1
DEBF	1
DF80	1
DF81	1
DF82	1
DF83	1
DF84	1
DF85	1
DF86	1
DF87	1
DF88	1
DF89	1
DF8A	1
DF8B	1
DF8C	1
DF8D	1
DF8E	1
DF8F	1
DF90	1
DF91	1
DF92	1
DF93	1
DF94	1
DF95	1
DF96	1
DF97	1
DF98	1
DF99	1
DF9A	1
DF9B	1
DF9C	1
DF9D	1
DF9E	1
DF9F	1
DFA0	1
DFA1	1
DFA2	1
DFA3	1
DFA4	1
DFA5	1
DFA6	1
DFA7	1
DFA8	1
DFA9	1
DFAA	1
DFAB	1
DFAC	1
DFAD	1
DFAE	1
DFAF	1
DFB0	1
DFB1	1
DFB2	1
DFB3	1
DFB4	1
DFB5	1
DFB6	1
DFB7	1
DFB8	1
DFB9	1
DFBA	1
DFBB	1
DFBC	1
DFBD	1
DFBE	1
DFBF	1
E4B880	1
E4B881	1
E4B882	1
E4B883	1
E4B884	1
E4B885	1
E4B886	1
E4B887	1
E4B888	1
E4B889	1
E4B88A	1
E4B88B	1
E4B88C	1
E4B88D	1
E4B88E	1
E4B88F	1
E4B890	1
E4B891	1
E4B892	1
E4B893	1
E4B894	1
E4B895	1
E4B896	1
E4B897	1
E4B898	1
E4B899	1
E4B89A	1
E4B89B	1
E4B89C	1
E4B89D	1
E4B89E	1
E4B89F	1
E4B8A0	1
E4B8A1	1
E4B8A2	1
E4B8A3	1
E4B8A4	1
E4B8A5	1
E4B8A6	1
E4B8A7	1
E4B8A8	1
E4B8A9	1
E4B8AA	1
E4B8AB	1
E4B8AC	1
E4B8AD	1
E4B8AE	1
E4B8AF	1
E4B8B0	1
E4B8B1	1
E4B8B2	1
E4B8B3	1
E4B8B4	1
E4B8B5	1
E4B8B6	1
E4B8B7	1
E4B8B8	1
E4B8B9	1
E4B8BA	1
E4B8BB	1
E4B8BC	1
E4B8BD	1
E4B8BE	1
E4B8BF	1
E4B980	1
E4B981	1
E4B982	1
E4B983	1
E4B984	1
E4B985	1
E4B986	1
E4B987	1
E4B988	1
E4B989	1
E4B98A	1
E4B98B	1
E4B98C	1
E4B98D	1
E4B98E	1
E4B98F	1
E4B990	1
E4B991	1
E4B992	1
E4B993	1
E4B994	1
E4B995	1
E4B996	1
E4B997	1
E4B998	1
E4B999	1
E4B99A	1
E4B99B	1
E4B99C	1
E4B99D	1
E4B99E	1
E4B99F	1
E4B9A0	1
E4B9A1	1
E4B9A2	1
E4B9A3	1
E4B9A4	1
E4B9A5	1
E4B9A6	1
E4B9A7	1
E4B9A8	1
E4B9A9	1
E4B9AA	1
E4B9AB	1
E4B9AC	1
E4B9AD	1
E4B9AE	1
E4B9AF	1
E4B9B0	1
E4B9B1	1
E4B9B2	1
E4B9B3	1
E4B9B4	1
E4B9B5	1
E4B9B6	1
E4B9B7	1
E4B9B8	1
E4B9B9	1
E4B9BA	1
E4B9BB	1
E4B9BC	1
E4B9BD	1
E4B9BE	1
E4B9BF	1
E4BA80	1
E4BA81	1
E4BA82	1
E4BA83	1
E4BA84	1
E4BA85	1
E4BA86	1
E4BA87	1
E4BA88	1
E4BA89	1
E4BA8A	1
E4BA8B	1
E4BA8C	1
E4BA8D	1
E4BA8E	1
E4BA8F	1
E4BA90	1
E4BA91	1
E4BA92	1
E4BA93	1
E4BA94	1
E4BA95	1
E4BA96	1
E4BA97	1
E4BA98	1
E4BA99	1
E4BA9A	1
E4BA9B	1
E4BA9C	1
E4BA9D	1
E4BA9E	1
E4BA9F	1
E4BAA0	1
E4BAA1	1
E4BAA2	1
E4BAA3	1
E4BAA4	1
E4BAA5	1
E4BAA6	1
E4BAA7	1
E4BAA8	1
E4BAA9	1
E4BAAA	1
E4BAAB	1
E4BAAC	1
E4BAAD	1
E4BAAE	1
E4BAAF	1
E4BAB0	1
E4BAB1	1
E4BAB2	1
E4BAB3	1
E4BAB4	1
E4BAB5	1
E4BAB6	1
E4BAB7	1
E4BAB8	1
E4BAB9	1
E4BABA	1
E4BABB	1
E4BABC	1
E4BABD	1
E4BABE	1
E4BABF	1
E4BB80	1
E4BB81	1
E4BB82	1
E4BB83	1
E4BB84	1
E4BB85	1
E4BB86	1
E4BB87	1
E4BB88	1
E4BB89	1
E4BB8A	1
E4BB8B	1
E4BB8C	1
E4BB8D	1
E4BB8E	1
E4BB8F	1
E4BB90	1
E4BB91	1
E4BB92	1
E4BB93	1
E4BB94	1
E4BB95	1
E4BB96	1
E4BB97	1
E4BB98	1
E4BB99	1
E4BB9A	1
E4BB9B	1
E4BB9C	1
E4BB9D	1
E4BB9E	1
E4BB9F	1
E4BBA0	1
E4BBA1	1
E4BBA2	1
E4BBA3	1
E4BBA4	1
E4BBA5	1
E4BBA6	1
E4BBA7	1
E4BBA8	1
E4BBA9	1
E4BBAA	1
E4BBAB	1
E4BBAC	1
E4BBAD	1
E4BBAE	1
E4BBAF	1
E4BBB0	1
E4BBB1	1
E4BBB2	1
E4BBB3	1
E4BBB4	1
E4BBB5	1
E4BBB6	1
E4BBB7	1
E4BBB8	1
E4BBB9	1
E4BBBA	1
E4BBBB	1
E4BBBC	1
E4BBBD	1
E4BBBE	1
E4BBBF	1
E4BC80	1
E4BC81	1
E4BC82	1
E4BC83	1
E4BC84	1
E4BC85	1
E4BC86	1
E4BC87	1
E4BC88	1
E4BC89	1
E4BC8A	1
E4BC8B	1
E4BC8C	1
E4BC8D	1
E4BC8E	1
E4BC8F	1
E4BC90	1
E4BC91	1
E4BC92	1
E4BC93	1
E4BC94	1
E4BC95	1
E4BC96	1
E4BC97	1
E4BC98	1
E4BC99	1
E4BC9A	1
E4BC9B	1
E4BC9C	1
E4BC9D	1
E4BC9E	1
E4BC9F	1
E4BCA0	1
E4BCA1	1
E4BCA2	1
E4BCA3	1
E4BCA4	1
E4BCA5	1
E4BCA6	1
E4BCA7	1
E4BCA8	1
E4BCA9	1
E4BCAA	1
E4BCAB	1
E4BCAC	1
E4BCAD	1
E4BCAE	1
E4BCAF	1
E4BCB0	1
E4BCB1	1
E4BCB2	1
E4BCB3	1
E4BCB4	1
E4BCB5	1
E4BCB6	1
E4BCB7	1
E4BCB8	1
E4BCB9	1
E4BCBA	1
E4BCBB	1
E4BCBC	1
E4BCBD	1
E4BCBE	1
E4BCBF	1
E4BD80	1
E4BD81	1
E4BD82	1
E4BD83	1
E4BD84	1
E4BD85	1
E4BD86	1
E4BD87	1
E4BD88	1
E4BD89	1
E4BD8A	1
E4BD8B	1
E4BD8C	1
E4BD8D	1
E4BD8E	1
E4BD8F	1
E4BD90	1
E4BD91	1
E4BD92	1
E4BD93	1
E4BD94	1
E4BD95	1
E4BD96	1
E4BD97	1
E4BD98	1
E4BD99	1
E4BD9A	1
E4BD9B	1
E4BD9C	1
E4BD9D	1
E4BD9E	1
E4BD9F	1
E4BDA0	1
E4BDA1	1
E4BDA2	1
E4BDA3	1
E4BDA4	1
E4BDA5	1
E4BDA6	1
E4BDA7	1
E4BDA8	1
E4BDA9	1
E4BDAA	1
E4BDAB	1
E4BDAC	1
E4BDAD	1
E4BDAE	1
E4BDAF	1
E4BDB0	1
E4BDB1	1
E4BDB2	1
E4BDB3	1
E4BDB4	1
E4BDB5	1
E4BDB6	1
E4BDB7	1
E4BDB8	1
E4BDB9	1
E4BDBA	1
E4BDBB	1
E4BDBC	1
E4BDBD	1
E4BDBE	1
E4BDBF	1
E4BE80	1
E4BE81	1
E4BE82	1
E4BE83	1
E4BE84	1
E4BE85	1
E4BE86	1
E4BE87	1
E4BE88	1
E4BE89	1
E4BE8A	1
E4BE8B	1
E4BE8C	1
E4BE8D	1
E4BE8E	1
E4BE8F	1
E4BE90	1
E4BE91	1
E4BE92	1
E4BE93	1
E4BE94	1
E4BE95	1
E4BE96	1
E4BE97	1
E4BE98	1
E4BE99	1
E4BE9A	1
E4BE9B	1
E4BE9C	1
E4BE9D	1
E4BE9E	1
E4BE9F	1
E4BEA0	1
E4BEA1	1
E4BEA2	1
E4BEA3	1
E4BEA4	1
E4BEA5	1
E4BEA6	1
E4BEA7	1
E4BEA8	1
E4BEA9	1
E4BEAA	1
E4BEAB	1
E4BEAC	1
E4BEAD	1
E4BEAE	1
E4BEAF	1
E4BEB0	1
E4BEB1	1
E4BEB2	1
E4BEB3	1
E4BEB4	1
E4BEB5	1
E4BEB6	1
E4BEB7	1
E4BEB8	1
E4BEB9	1
E4BEBA	1
E4BEBB	1
E4BEBC	1
E4BEBD	1
E4BEBE	1
E4BEBF	1
E4BF80	1
E4BF81	1
E4BF82	1
E4BF83	1
E4BF84	1
E4BF85	1
E4BF86	1
E4BF87	1
E4BF88	1
E4BF89	1
E4BF8A	1
E4BF8B	1
E4BF8C	1
E4BF8D	1
E4BF8E	1
E4BF8F	1
E4BF90	1
E4BF91	1
E4BF92	1
E4BF93	1
E4BF94	1
E4BF95	1
E4BF96	1
E4BF97	1
E4BF98	1
E4BF99	1
E4BF9A	1
E4BF9B	1
E4BF9C	1
E4BF9D	1
E4BF9E	1
E4BF9F	1
E4BFA0	1
E4BFA1	1
E4BFA2	1
E4BFA3	1
E4BFA4	1
E4BFA5	1
E4BFA6	1
E4BFA7	1
E4BFA8	1
E4BFA9	1
E4BFAA	1
E4BFAB	1
E4BFAC	1
E4BFAD	1
E4BFAE	1
E4BFAF	1
E4BFB0	1
E4BFB1	1
E4BFB2	1
E4BFB3	1
E4BFB4	1
E4BFB5	1
E4BFB6	1
E4BFB7	1
E4BFB8	1
E4BFB9	1
E4BFBA	1
E4BFBB	1
E4BFBC	1
E4BFBD	1
E4BFBE	1
E4BFBF	1
DROP TABLE IF EXISTS test.t1;
DROP TABLE IF EXISTS test.t1;
DROP DATABASE test;
CREATE DATABASE test CHARACTER SET utf8mb3;
USE test;
CREATE TABLE test.t1 (a CHAR(4) CHARACTER SET utf8mb3 COLLATE utf8mb3_czech_ci) ENGINE=MyISAM CHARACTER SET utf8mb3 COLLATE utf8mb3_czech_ci;
Warnings:
Warning	1287	'utf8mb3' is deprecated and will be removed in a future release. Please use utf8mb4 instead
Warning	3778	'utf8mb3_czech_ci' is a collation of the deprecated character set UTF8MB3. Please consider using UTF8MB4 with an appropriate collation instead.
Warning	1287	'utf8mb3' is deprecated and will be removed in a future release. Please use utf8mb4 instead
Warning	3778	'utf8mb3_czech_ci' is a collation of the deprecated character set UTF8MB3. Please consider using UTF8MB4 with an appropriate collation instead.
SHOW TABLE STATUS LIKE 't1';
Name	Engine	Version	Row_format	Rows	Avg_row_length	Data_length	Max_data_length	Index_length	Data_free	Auto_increment	Create_time	Update_time	Check_time	Collation	Checksum	Create_options	Comment
t1	MyISAM	#	#	#	#	#	#	#	#	#	#	#	#	utf8mb3_czech_ci	#	#	#
LOAD DATA INFILE 
'MYSQL_TEST_DIR/suite/funcs_2/data/charset_utf8.txt' INTO TABLE test.t1;
DELETE FROM test.t1 WHERE CHAR_LENGTH(a) <> 1;
SELECT HEX(ORD(a)) AS a_ord, CHAR_LENGTH(a) AS a_len FROM test.t1 ORDER BY a, ORD(a);
a_ord	a_len
C285	1
7F	1
C280	1
C281	1
C282	1
C283	1
C284	1
C286	1
C287	1
C288	1
C289	1
C28A	1
C28B	1
C28C	1
C28D	1
C28E	1
C28F	1
C290	1
C291	1
C292	1
C293	1
C294	1
C295	1
C296	1
C297	1
C298	1
C299	1
C29A	1
C29B	1
C29C	1
C29D	1
C29E	1
C29F	1
C2A0	1
CC80	1
CC81	1
CC82	1
CC83	1
CC84	1
CC85	1
CC86	1
CC87	1
CC88	1
CC89	1
CC8A	1
CC8B	1
CC8C	1
CC8D	1
CC8E	1
CC8F	1
CC90	1
CC91	1
CC92	1
CC93	1
CC94	1
CC95	1
CC96	1
CC97	1
CC98	1
CC99	1
CC9A	1
CC9B	1
CC9C	1
CC9D	1
CC9E	1
CC9F	1
CCA0	1
CCA1	1
CCA2	1
CCA3	1
CCA4	1
CCA5	1
CCA6	1
CCA7	1
CCA8	1
CCA9	1
CCAA	1
CCAB	1
CCAC	1
CCAD	1
CCAE	1
CCAF	1
CCB0	1
CCB1	1
CCB2	1
CCB3	1
CCB4	1
CCB5	1
CCB6	1
CCB7	1
CCB8	1
CCB9	1
CCBA	1
CCBB	1
CCBC	1
CCBD	1
CCBE	1
CCBF	1
CD80	1
CD81	1
CD82	1
CD83	1
CD84	1
CD85	1
CD86	1
CD87	1
CD88	1
CD89	1
CD8A	1
CD8B	1
CD8C	1
CD8D	1
CD8E	1
CD8F	1
CD90	1
CD91	1
CD92	1
CD93	1
CD94	1
CD95	1
CD96	1
CD97	1
CD9D	1
CD9E	1
CD9F	1
CDA0	1
CDA1	1
CDA2	1
D283	1
D284	1
D285	1
D286	1
D288	1
D289	1
D691	1
D692	1
D693	1
D694	1
D695	1
D696	1
D697	1
D698	1
D699	1
D69A	1
D69B	1
D69C	1
D69D	1
D69E	1
D69F	1
D6A0	1
D6A1	1
D6A3	1
D6A4	1
D6A5	1
D6A6	1
D6A7	1
D6A8	1
D6A9	1
D6AA	1
D6AB	1
D6AC	1
D6AD	1
D6AE	1
D6AF	1
D6B0	1
D6B1	1
D6B2	1
D6B3	1
D6B4	1
D6B5	1
D6B6	1
D6B7	1
D6B8	1
D6B9	1
D6BB	1
D6BC	1
D6BD	1
D6BF	1
D781	1
D782	1
D784	1
D880	1
D881	1
D882	1
D883	1
D890	1
D891	1
D892	1
D893	1
D894	1
D895	1
D98B	1
D98C	1
D98D	1
D98E	1
D98F	1
D990	1
D991	1
D992	1
D993	1
D994	1
D995	1
D996	1
D997	1
D998	1
D9B0	1
DB96	1
DB97	1
DB98	1
DB99	1
DB9A	1
DB9B	1
DB9C	1
DB9D	1
DB9E	1
DB9F	1
DBA0	1
DBA1	1
DBA2	1
DBA3	1
DBA4	1
DBA7	1
DBA8	1
DBAA	1
DBAB	1
DBAC	1
DBAD	1
DC8F	1
DC91	1
DCB0	1
DCB1	1
DCB2	1
DCB3	1
DCB4	1
DCB5	1
DCB6	1
DCB7	1
DCB8	1
DCB9	1
DCBA	1
DCBB	1
DCBC	1
DCBD	1
DCBE	1
DCBF	1
DD80	1
DD81	1
DD82	1
DD83	1
DD84	1
DD85	1
DD86	1
DD87	1
DD88	1
DD89	1
DD8A	1
D980	1
60	1
C2B4	1
CE84	1
CB9C	1
5E	1
C2AF	1
CB98	1
CB99	1
C2A8	1
CE85	1
CB9A	1
CB9D	1
C2B8	1
CB9B	1
5F	1
C2AD	1
2D	1
D68A	1
2C	1
D59D	1
D88C	1
D88D	1
D9AB	1
D9AC	1
3B	1
CDBE	1
D89B	1
3A	1
D689	1
DC83	1
DC84	1
DC85	1
DC86	1
DC87	1
DC88	1
21	1
C2A1	1
D59C	1
3F	1
C2BF	1
D59E	1
D89F	1
DC89	1
2E	1
DB94	1
DC81	1
DC82	1
C2B7	1
CE87	1
DC80	1
27	1
22	1
C2AB	1
C2BB	1
28	1
29	1
5B	1
7B	1
7D	1
C2A7	1
C2B6	1
C2A9	1
C2AE	1
40	1
2A	1
D9AD	1
2F	1
26	1
23	1
25	1
D9AA	1
D59A	1
D59B	1
D59F	1
D6BE	1
D780	1
D783	1
D7B3	1
D7B4	1
DC8A	1
DC8B	1
DC8C	1
DC8D	1
CAB9	1
CDB4	1
CDB5	1
CABA	1
CB82	1
CB83	1
CB84	1
CB85	1
CB86	1
CB87	1
CB88	1
CB89	1
CB8A	1
CB8B	1
CB8C	1
CB8D	1
CB8E	1
CB8F	1
CB92	1
CB93	1
CB94	1
CB95	1
CB96	1
CB97	1
CB9E	1
CB9F	1
CBA5	1
CBA6	1
CBA7	1
CBA8	1
CBA9	1
CBAA	1
CBAB	1
CBAC	1
CBAD	1
CBAF	1
CBB0	1
CBB1	1
CBB2	1
CBB3	1
CBB4	1
CBB5	1
CBB6	1
CBB7	1
CBB8	1
CBB9	1
CBBA	1
CBBB	1
CBBC	1
CBBD	1
CBBE	1
CBBF	1
C2B0	1
D282	1
D88E	1
D88F	1
DBA9	1
CFB6	1
2B	1
C2B1	1
C3B7	1
C397	1
3C	1
3D	1
3E	1
C2AC	1
7C	1
C2A6	1
7E	1
CB90	1
CB91	1
C2A4	1
C2A2	1
24	1
C2A3	1
C2A5	1
30	1
D9A0	1
DBB0	1
31	1
C2B9	1
D9A1	1
DBB1	1
C2BD	1
C2BC	1
32	1
C2B2	1
D9A2	1
DBB2	1
33	1
C2B3	1
D9A3	1
DBB3	1
C2BE	1
34	1
D9A4	1
DBB4	1
35	1
D9A5	1
DBB5	1
36	1
D9A6	1
DBB6	1
37	1
D9A7	1
DBB7	1
38	1
D9A8	1
DBB8	1
39	1
D9A9	1
DBB9	1
41	1
61	1
C2AA	1
C380	1
C381	1
C382	1
C383	1
C384	1
C385	1
C3A0	1
C3A1	1
C3A2	1
C3A3	1
C3A4	1
C3A5	1
C480	1
C481	1
C482	1
C483	1
C484	1
C485	1
C78D	1
C78E	1
C79E	1
C79F	1
C7A0	1
C7A1	1
C7BA	1
C7BB	1
C880	1
C881	1
C882	1
C883	1
C8A6	1
C8A7	1
CDA3	1
C386	1
C3A6	1
C7A2	1
C7A3	1
C7BC	1
C7BD	1
C990	1
C991	1
C992	1
42	1
62	1
CA99	1
C680	1
C681	1
C993	1
C682	1
C683	1
43	1
63	1
C387	1
C3A7	1
C486	1
C487	1
C488	1
C489	1
C48A	1
C48B	1
CDA8	1
C48C	1
C48D	1
C687	1
C688	1
C995	1
44	1
64	1
C48E	1
C48F	1
CDA9	1
C784	1
C785	1
C786	1
C7B1	1
C7B2	1
C7B3	1
CAA3	1
CAA5	1
CAA4	1
C490	1
C491	1
C689	1
C996	1
C68A	1
C997	1
C68B	1
C68C	1
C8A1	1
C390	1
C3B0	1
45	1
65	1
C388	1
C389	1
C38A	1
C38B	1
C3A8	1
C3A9	1
C3AA	1
C3AB	1
C492	1
C493	1
C494	1
C495	1
C496	1
C497	1
C498	1
C499	1
C49A	1
C49B	1
C884	1
C885	1
C886	1
C887	1
C8A8	1
C8A9	1
CDA4	1
C68E	1
C79D	1
C68F	1
C999	1
C690	1
C99B	1
C998	1
C99A	1
C99C	1
C99D	1
C99E	1
CA9A	1
C9A4	1
46	1
66	1
CAA9	1
C691	1
C692	1
47	1
67	1
C49C	1
C49D	1
C49E	1
C49F	1
C4A0	1
C4A1	1
C4A2	1
C4A3	1
C7A6	1
C7A7	1
C7B4	1
C7B5	1
C9A1	1
C9A2	1
C7A4	1
C7A5	1
C693	1
C9A0	1
CA9B	1
C694	1
C9A3	1
CBA0	1
C6A2	1
C6A3	1
48	1
68	1
C4A4	1
C4A5	1
C89E	1
C89F	1
CAB0	1
CDAA	1
CA9C	1
C695	1
C7B6	1
C4A6	1
C4A7	1
C9A6	1
CAB1	1
C9A7	1
CABB	1
CABD	1
49	1
69	1
C38C	1
C38D	1
C38E	1
C38F	1
C3AC	1
C3AD	1
C3AE	1
C3AF	1
C4A8	1
C4A9	1
C4AA	1
C4AB	1
C4AC	1
C4AD	1
C4AE	1
C4AF	1
C4B0	1
C78F	1
C790	1
C888	1
C889	1
C88A	1
C88B	1
CDA5	1
C4B2	1
C4B3	1
C4B1	1
C9AA	1
C697	1
C9A8	1
C696	1
C9A9	1
4A	1
6A	1
C4B4	1
C4B5	1
C7B0	1
CAB2	1
CA9D	1
C99F	1
CA84	1
4B	1
6B	1
C4B6	1
C4B7	1
C7A8	1
C7A9	1
C698	1
C699	1
CA9E	1
4C	1
6C	1
C4B9	1
C4BA	1
C4BB	1
C4BC	1
C4BD	1
C4BE	1
CBA1	1
C4BF	1
C580	1
C787	1
C788	1
C789	1
CAAA	1
CAAB	1
CA9F	1
C581	1
C582	1
C69A	1
C9AB	1
C9AC	1
C9AD	1
C8B4	1
C9AE	1
C69B	1
CA8E	1
4D	1
6D	1
CDAB	1
C9B1	1
4E	1
6E	1
C391	1
C3B1	1
C583	1
C584	1
C585	1
C586	1
C587	1
C588	1
C7B8	1
C7B9	1
C78A	1
C78B	1
C78C	1
C9B4	1
C69D	1
C9B2	1
C69E	1
C8A0	1
C9B3	1
C8B5	1
C58A	1
C58B	1
4F	1
6F	1
C2BA	1
C392	1
C393	1
C394	1
C395	1
C396	1
C3B2	1
C3B3	1
C3B4	1
C3B5	1
C3B6	1
C58C	1
C58D	1
C58E	1
C58F	1
C590	1
C591	1
C6A0	1
C6A1	1
C791	1
C792	1
C7AA	1
C7AB	1
C7AC	1
C7AD	1
C88C	1
C88D	1
C88E	1
C88F	1
C8AA	1
C8AB	1
C8AC	1
C8AD	1
C8AE	1
C8AF	1
C8B0	1
C8B1	1
CDA6	1
C592	1
C593	1
C9B6	1
C398	1
C3B8	1
C7BE	1
C7BF	1
C686	1
C994	1
C69F	1
C9B5	1
C9B7	1
C8A2	1
C8A3	1
50	1
70	1
C6A4	1
C6A5	1
C9B8	1
51	1
71	1
CAA0	1
C4B8	1
52	1
72	1
C594	1
C595	1
C596	1
C597	1
C890	1
C891	1
C892	1
C893	1
CAB3	1
CDAC	1
C598	1
C599	1
C6A6	1
CA80	1
C9B9	1
CAB4	1
C9BA	1
C9BB	1
CAB5	1
C9BC	1
C9BD	1
C9BE	1
C9BF	1
CA81	1
CAB6	1
53	1
73	1
C59A	1
C59B	1
C59C	1
C59D	1
C59E	1
C59F	1
C5BF	1
C898	1
C899	1
CBA2	1
C39F	1
C5A0	1
C5A1	1
CA82	1
C6A9	1
CA83	1
C6AA	1
CA85	1
CA86	1
54	1
74	1
C5A2	1
C5A3	1
C5A4	1
C5A5	1
C89A	1
C89B	1
CDAD	1
CAA8	1
C6BE	1
CAA6	1
CAA7	1
C5A6	1
C5A7	1
C6AB	1
C6AC	1
C6AD	1
C6AE	1
CA88	1
C8B6	1
CA87	1
55	1
75	1
C399	1
C39A	1
C39B	1
C39C	1
C3B9	1
C3BA	1
C3BB	1
C3BC	1
C5A8	1
C5A9	1
C5AA	1
C5AB	1
C5AC	1
C5AD	1
C5AE	1
C5AF	1
C5B0	1
C5B1	1
C5B2	1
C5B3	1
C6AF	1
C6B0	1
C793	1
C794	1
C795	1
C796	1
C797	1
C798	1
C799	1
C79A	1
C79B	1
C79C	1
C894	1
C895	1
C896	1
C897	1
CDA7	1
CA89	1
C9A5	1
CAAE	1
CAAF	1
C69C	1
C9AF	1
C9B0	1
C6B1	1
CA8A	1
56	1
76	1
CDAE	1
C6B2	1
CA8B	1
CA8C	1
57	1
77	1
C5B4	1
C5B5	1
CAB7	1
CA8D	1
58	1
78	1
CBA3	1
CDAF	1
59	1
79	1
C39D	1
C3BD	1
C3BF	1
C5B6	1
C5B7	1
C5B8	1
C8B2	1
C8B3	1
CAB8	1
CA8F	1
C6B3	1
C6B4	1
5A	1
7A	1
C5B9	1
C5BA	1
C5BB	1
C5BC	1
C68D	1
C5BD	1
C5BE	1
C6B5	1
C6B6	1
C8A4	1
C8A5	1
CA90	1
CA91	1
C6B7	1
C7AE	1
C7AF	1
CA92	1
C6B8	1
C6B9	1
C6BA	1
CA93	1
C89C	1
C89D	1
C39E	1
C3BE	1
C6BF	1
C7B7	1
C6BB	1
C6A7	1
C6A8	1
C6BC	1
C6BD	1
C684	1
C685	1
CA94	1
CB80	1
CABC	1
C589	1
CBAE	1
CABE	1
CA95	1
CBA4	1
CABF	1
CB81	1
CAA1	1
CAA2	1
CA96	1
C780	1
C781	1
C782	1
C783	1
CA97	1
CA98	1
CAAC	1
CAAD	1
CE86	1
CE91	1
CEAC	1
CEB1	1
CE92	1
CEB2	1
CF90	1
CE93	1
CEB3	1
CE94	1
CEB4	1
CE88	1
CE95	1
CEAD	1
CEB5	1
CFB5	1
CF9C	1
CF9D	1
CF9A	1
CF9B	1
CE96	1
CEB6	1
CE89	1
CE97	1
CEAE	1
CEB7	1
CE98	1
CEB8	1
CF91	1
CFB4	1
CDBA	1
CE8A	1
CE90	1
CE99	1
CEAA	1
CEAF	1
CEB9	1
CF8A	1
CFB3	1
CE9A	1
CEBA	1
CFB0	1
CF97	1
CE9B	1
CEBB	1
C2B5	1
CE9C	1
CEBC	1
CE9D	1
CEBD	1
CE9E	1
CEBE	1
CE8C	1
CE9F	1
CEBF	1
CF8C	1
CEA0	1
CF80	1
CF96	1
CF9E	1
CF9F	1
CF98	1
CF99	1
CEA1	1
CF81	1
CFB1	1
CEA3	1
CF82	1
CF83	1
CFB2	1
CFB9	1
CEA4	1
CF84	1
CE8E	1
CEA5	1
CEAB	1
CEB0	1
CF85	1
CF8B	1
CF8D	1
CF92	1
CF93	1
CF94	1
CEA6	1
CF86	1
CF95	1
CEA7	1
CF87	1
CEA8	1
CF88	1
CE8F	1
CEA9	1
CF89	1
CF8E	1
CFA0	1
CFA1	1
CFB7	1
CFB8	1
CFBA	1
CFBB	1
CFA2	1
CFA3	1
CFA4	1
CFA5	1
CFA6	1
CFA7	1
CFA8	1
CFA9	1
CFAA	1
CFAB	1
CFAC	1
CFAD	1
CFAE	1
CFAF	1
D090	1
D0B0	1
D390	1
D391	1
D392	1
D393	1
D398	1
D399	1
D39A	1
D39B	1
D394	1
D395	1
D091	1
D0B1	1
D092	1
D0B2	1
D093	1
D0B3	1
D290	1
D291	1
D292	1
D293	1
D294	1
D295	1
D094	1
D0B4	1
D480	1
D481	1
D082	1
D192	1
D482	1
D483	1
D083	1
D193	1
D298	1
D299	1
D080	1
D081	1
D095	1
D0B5	1
D190	1
D191	1
D396	1
D397	1
D084	1
D194	1
D096	1
D0B6	1
D381	1
D382	1
D39C	1
D39D	1
D296	1
D297	1
D097	1
D0B7	1
D484	1
D485	1
D39E	1
D39F	1
D085	1
D195	1
D3A0	1
D3A1	1
D486	1
D487	1
D08D	1
D098	1
D0B8	1
D19D	1
D3A2	1
D3A3	1
D28A	1
D28B	1
D3A4	1
D3A5	1
D086	1
D196	1
D087	1
D197	1
D099	1
D0B9	1
D088	1
D198	1
D09A	1
D0BA	1
D29A	1
D29B	1
D383	1
D384	1
D2A0	1
D2A1	1
D29E	1
D29F	1
D29C	1
D29D	1
D09B	1
D0BB	1
D385	1
D386	1
D089	1
D199	1
D488	1
D489	1
D09C	1
D0BC	1
D38D	1
D38E	1
D09D	1
D0BD	1
D389	1
D38A	1
D2A2	1
D2A3	1
D387	1
D388	1
D2A4	1
D2A5	1
D08A	1
D19A	1
D48A	1
D48B	1
D09E	1
D0BE	1
D3A6	1
D3A7	1
D3A8	1
D3A9	1
D3AA	1
D3AB	1
D09F	1
D0BF	1
D2A6	1
D2A7	1
D280	1
D281	1
D0A0	1
D180	1
D28E	1
D28F	1
D0A1	1
D181	1
D48C	1
D48D	1
D2AA	1
D2AB	1
D0A2	1
D182	1
D48E	1
D48F	1
D2AC	1
D2AD	1
D08B	1
D19B	1
D08C	1
D19C	1
D0A3	1
D183	1
D3AE	1
D3AF	1
D08E	1
D19E	1
D3B0	1
D3B1	1
D3B2	1
D3B3	1
D2AE	1
D2AF	1
D2B0	1
D2B1	1
D1B8	1
D1B9	1
D0A4	1
D184	1
D0A5	1
D185	1
D2B2	1
D2B3	1
D2BA	1
D2BB	1
D1A0	1
D1A1	1
D1BE	1
D1BF	1
D1BC	1
D1BD	1
D1BA	1
D1BB	1
D0A6	1
D186	1
D2B4	1
D2B5	1
D0A7	1
D187	1
D3B4	1
D3B5	1
D2B6	1
D2B7	1
D38B	1
D38C	1
D2B8	1
D2B9	1
D2BC	1
D2BD	1
D2BE	1
D2BF	1
D08F	1
D19F	1
D0A8	1
D188	1
D0A9	1
D189	1
D0AA	1
D18A	1
D0AB	1
D18B	1
D3B8	1
D3B9	1
D0AC	1
D18C	1
D28C	1
D28D	1
D1A2	1
D1A3	1
D0AD	1
D18D	1
D3AC	1
D3AD	1
D0AE	1
D18E	1
D0AF	1
D18F	1
D1A4	1
D1A5	1
D1A6	1
D1A7	1
D1AA	1
D1AB	1
D1A8	1
D1A9	1
D1AC	1
D1AD	1
D1AE	1
D1AF	1
D1B0	1
D1B1	1
D1B2	1
D1B3	1
D1B4	1
D1B5	1
D1B6	1
D1B7	1
D2A8	1
D2A9	1
D380	1
D4B1	1
D5A1	1
D4B2	1
D5A2	1
D4B3	1
D5A3	1
D4B4	1
D5A4	1
D4B5	1
D5A5	1
D687	1
D4B6	1
D5A6	1
D4B7	1
D5A7	1
D4B8	1
D5A8	1
D4B9	1
D5A9	1
D4BA	1
D5AA	1
D4BB	1
D5AB	1
D4BC	1
D5AC	1
D4BD	1
D5AD	1
D4BE	1
D5AE	1
D4BF	1
D5AF	1
D580	1
D5B0	1
D581	1
D5B1	1
D582	1
D5B2	1
D583	1
D5B3	1
D584	1
D5B4	1
D585	1
D5B5	1
D586	1
D5B6	1
D587	1
D5B7	1
D588	1
D5B8	1
D589	1
D5B9	1
D58A	1
D5BA	1
D58B	1
D5BB	1
D58C	1
D5BC	1
D58D	1
D5BD	1
D58E	1
D5BE	1
D58F	1
D5BF	1
D590	1
D680	1
D591	1
D681	1
D592	1
D682	1
D593	1
D683	1
D594	1
D684	1
D595	1
D685	1
D596	1
D686	1
D599	1
D790	1
D791	1
D792	1
D793	1
D794	1
D795	1
D7B0	1
D7B1	1
D796	1
D797	1
D798	1
D799	1
D7B2	1
D79A	1
D79B	1
D79C	1
D79D	1
D79E	1
D79F	1
D7A0	1
D7A1	1
D7A2	1
D7A3	1
D7A4	1
D7A5	1
D7A6	1
D7A7	1
D7A8	1
D7A9	1
D7AA	1
D8A1	1
D9B4	1
DBBD	1
D8A2	1
D8A3	1
D9B2	1
D9B1	1
D8A4	1
D8A5	1
D9B3	1
D8A6	1
D8A7	1
D9B5	1
D9AE	1
D8A8	1
D9BB	1
D9BE	1
DA80	1
D8A9	1
D8AA	1
D8AB	1
D9B9	1
D9BA	1
D9BC	1
D9BD	1
D9BF	1
D8AC	1
DA83	1
DA84	1
DA86	1
DABF	1
DA87	1
D8AD	1
D8AE	1
DA81	1
DA82	1
DA85	1
D8AF	1
D8B0	1
DA88	1
DA89	1
DA8A	1
DA8B	1
DA8C	1
DA8D	1
DA8E	1
DA8F	1
DA90	1
DBAE	1
D8B1	1
D8B2	1
DA91	1
DA92	1
DA93	1
DA94	1
DA95	1
DA96	1
DA97	1
DA98	1
DA99	1
DBAF	1
D8B3	1
D8B4	1
DA9A	1
DA9B	1
DA9C	1
DBBA	1
D8B5	1
D8B6	1
DA9D	1
DA9E	1
DBBB	1
D8B7	1
D8B8	1
DA9F	1
D8B9	1
D8BA	1
DAA0	1
DBBC	1
D981	1
DAA1	1
DAA2	1
DAA3	1
DAA4	1
DAA5	1
DAA6	1
D9AF	1
D982	1
DAA7	1
DAA8	1
D983	1
DAA9	1
DAAA	1
DAAB	1
DAAC	1
DAAD	1
DAAE	1
DAAF	1
DAB0	1
DAB1	1
DAB2	1
DAB3	1
DAB4	1
D984	1
DAB5	1
DAB6	1
DAB7	1
DAB8	1
D985	1
DBBE	1
D986	1
DABA	1
DABB	1
DABC	1
DABD	1
DAB9	1
D987	1
DABE	1
DB81	1
DB82	1
DB83	1
DBBF	1
DB80	1
DB95	1
D988	1
DBA5	1
D9B6	1
DB84	1
DB85	1
DB86	1
DB87	1
D9B7	1
DB88	1
DB89	1
DB8A	1
DB8B	1
DB8F	1
D989	1
D98A	1
DBA6	1
D9B8	1
DB8C	1
DB8D	1
DB8E	1
DB90	1
DB91	1
DB92	1
DB93	1
DC90	1
DC92	1
DCAD	1
DC93	1
DC94	1
DCAE	1
DC96	1
DC95	1
DCAF	1
DC97	1
DC98	1
DC99	1
DD8D	1
DC9A	1
DC9B	1
DC9C	1
DC9D	1
DC9E	1
DC9F	1
DD8E	1
DCA0	1
DCA1	1
DCA2	1
DCA3	1
DCA4	1
DCA5	1
DCA6	1
DCA7	1
DD8F	1
DCA8	1
DCA9	1
DCAA	1
DCAB	1
DCAC	1
DE80	1
DE99	1
DE9A	1
DE81	1
DE82	1
DE83	1
DE9C	1
DE84	1
DE85	1
DE86	1
DE87	1
DEA2	1
DEA3	1
DE88	1
DEA5	1
DE89	1
DE8A	1
DE8B	1
DE9B	1
DE8C	1
DE98	1
DEA0	1
DEA1	1
DE8D	1
DE8E	1
DEA4	1
DE8F	1
DE90	1
DE9D	1
DE9E	1
DE9F	1
DE91	1
DE92	1
DE93	1
DE94	1
DE95	1
DE96	1
DE97	1
DEB1	1
DEA6	1
DEA7	1
DEA8	1
DEA9	1
DEAA	1
DEAB	1
DEAC	1
DEAD	1
DEAE	1
DEAF	1
DEB0	1
E4B880	1
E4B881	1
E4B882	1
E4B883	1
E4B884	1
E4B885	1
E4B886	1
E4B887	1
E4B888	1
E4B889	1
E4B88A	1
E4B88B	1
E4B88C	1
E4B88D	1
E4B88E	1
E4B88F	1
E4B890	1
E4B891	1
E4B892	1
E4B893	1
E4B894	1
E4B895	1
E4B896	1
E4B897	1
E4B898	1
E4B899	1
E4B89A	1
E4B89B	1
E4B89C	1
E4B89D	1
E4B89E	1
E4B89F	1
E4B8A0	1
E4B8A1	1
E4B8A2	1
E4B8A3	1
E4B8A4	1
E4B8A5	1
E4B8A6	1
E4B8A7	1
E4B8A8	1
E4B8A9	1
E4B8AA	1
E4B8AB	1
E4B8AC	1
E4B8AD	1
E4B8AE	1
E4B8AF	1
E4B8B0	1
E4B8B1	1
E4B8B2	1
E4B8B3	1
E4B8B4	1
E4B8B5	1
E4B8B6	1
E4B8B7	1
E4B8B8	1
E4B8B9	1
E4B8BA	1
E4B8BB	1
E4B8BC	1
E4B8BD	1
E4B8BE	1
E4B8BF	1
E4B980	1
E4B981	1
E4B982	1
E4B983	1
E4B984	1
E4B985	1
E4B986	1
E4B987	1
E4B988	1
E4B989	1
E4B98A	1
E4B98B	1
E4B98C	1
E4B98D	1
E4B98E	1
E4B98F	1
E4B990	1
E4B991	1
E4B992	1
E4B993	1
E4B994	1
E4B995	1
E4B996	1
E4B997	1
E4B998	1
E4B999	1
E4B99A	1
E4B99B	1
E4B99C	1
E4B99D	1
E4B99E	1
E4B99F	1
E4B9A0	1
E4B9A1	1
E4B9A2	1
E4B9A3	1
E4B9A4	1
E4B9A5	1
E4B9A6	1
E4B9A7	1
E4B9A8	1
E4B9A9	1
E4B9AA	1
E4B9AB	1
E4B9AC	1
E4B9AD	1
E4B9AE	1
E4B9AF	1
E4B9B0	1
E4B9B1	1
E4B9B2	1
E4B9B3	1
E4B9B4	1
E4B9B5	1
E4B9B6	1
E4B9B7	1
E4B9B8	1
E4B9B9	1
E4B9BA	1
E4B9BB	1
E4B9BC	1
E4B9BD	1
E4B9BE	1
E4B9BF	1
E4BA80	1
E4BA81	1
E4BA82	1
E4BA83	1
E4BA84	1
E4BA85	1
E4BA86	1
E4BA87	1
E4BA88	1
E4BA89	1
E4BA8A	1
E4BA8B	1
E4BA8C	1
E4BA8D	1
E4BA8E	1
E4BA8F	1
E4BA90	1
E4BA91	1
E4BA92	1
E4BA93	1
E4BA94	1
E4BA95	1
E4BA96	1
E4BA97	1
E4BA98	1
E4BA99	1
E4BA9A	1
E4BA9B	1
E4BA9C	1
E4BA9D	1
E4BA9E	1
E4BA9F	1
E4BAA0	1
E4BAA1	1
E4BAA2	1
E4BAA3	1
E4BAA4	1
E4BAA5	1
E4BAA6	1
E4BAA7	1
E4BAA8	1
E4BAA9	1
E4BAAA	1
E4BAAB	1
E4BAAC	1
E4BAAD	1
E4BAAE	1
E4BAAF	1
E4BAB0	1
E4BAB1	1
E4BAB2	1
E4BAB3	1
E4BAB4	1
E4BAB5	1
E4BAB6	1
E4BAB7	1
E4BAB8	1
E4BAB9	1
E4BABA	1
E4BABB	1
E4BABC	1
E4BABD	1
E4BABE	1
E4BABF	1
E4BB80	1
E4BB81	1
E4BB82	1
E4BB83	1
E4BB84	1
E4BB85	1
E4BB86	1
E4BB87	1
E4BB88	1
E4BB89	1
E4BB8A	1
E4BB8B	1
E4BB8C	1
E4BB8D	1
E4BB8E	1
E4BB8F	1
E4BB90	1
E4BB91	1
E4BB92	1
E4BB93	1
E4BB94	1
E4BB95	1
E4BB96	1
E4BB97	1
E4BB98	1
E4BB99	1
E4BB9A	1
E4BB9B	1
E4BB9C	1
E4BB9D	1
E4BB9E	1
E4BB9F	1
E4BBA0	1
E4BBA1	1
E4BBA2	1
E4BBA3	1
E4BBA4	1
E4BBA5	1
E4BBA6	1
E4BBA7	1
E4BBA8	1
E4BBA9	1
E4BBAA	1
E4BBAB	1
E4BBAC	1
E4BBAD	1
E4BBAE	1
E4BBAF	1
E4BBB0	1
E4BBB1	1
E4BBB2	1
E4BBB3	1
E4BBB4	1
E4BBB5	1
E4BBB6	1
E4BBB7	1
E4BBB8	1
E4BBB9	1
E4BBBA	1
E4BBBB	1
E4BBBC	1
E4BBBD	1
E4BBBE	1
E4BBBF	1
E4BC80	1
E4BC81	1
E4BC82	1
E4BC83	1
E4BC84	1
E4BC85	1
E4BC86	1
E4BC87	1
E4BC88	1
E4BC89	1
E4BC8A	1
E4BC8B	1
E4BC8C	1
E4BC8D	1
E4BC8E	1
E4BC8F	1
E4BC90	1
E4BC91	1
E4BC92	1
E4BC93	1
E4BC94	1
E4BC95	1
E4BC96	1
E4BC97	1
E4BC98	1
E4BC99	1
E4BC9A	1
E4BC9B	1
E4BC9C	1
E4BC9D	1
E4BC9E	1
E4BC9F	1
E4BCA0	1
E4BCA1	1
E4BCA2	1
E4BCA3	1
E4BCA4	1
E4BCA5	1
E4BCA6	1
E4BCA7	1
E4BCA8	1
E4BCA9	1
E4BCAA	1
E4BCAB	1
E4BCAC	1
E4BCAD	1
E4BCAE	1
E4BCAF	1
E4BCB0	1
E4BCB1	1
E4BCB2	1
E4BCB3	1
E4BCB4	1
E4BCB5	1
E4BCB6	1
E4BCB7	1
E4BCB8	1
E4BCB9	1
E4BCBA	1
E4BCBB	1
E4BCBC	1
E4BCBD	1
E4BCBE	1
E4BCBF	1
E4BD80	1
E4BD81	1
E4BD82	1
E4BD83	1
E4BD84	1
E4BD85	1
E4BD86	1
E4BD87	1
E4BD88	1
E4BD89	1
E4BD8A	1
E4BD8B	1
E4BD8C	1
E4BD8D	1
E4BD8E	1
E4BD8F	1
E4BD90	1
E4BD91	1
E4BD92	1
E4BD93	1
E4BD94	1
E4BD95	1
E4BD96	1
E4BD97	1
E4BD98	1
E4BD99	1
E4BD9A	1
E4BD9B	1
E4BD9C	1
E4BD9D	1
E4BD9E	1
E4BD9F	1
E4BDA0	1
E4BDA1	1
E4BDA2	1
E4BDA3	1
E4BDA4	1
E4BDA5	1
E4BDA6	1
E4BDA7	1
E4BDA8	1
E4BDA9	1
E4BDAA	1
E4BDAB	1
E4BDAC	1
E4BDAD	1
E4BDAE	1
E4BDAF	1
E4BDB0	1
E4BDB1	1
E4BDB2	1
E4BDB3	1
E4BDB4	1
E4BDB5	1
E4BDB6	1
E4BDB7	1
E4BDB8	1
E4BDB9	1
E4BDBA	1
E4BDBB	1
E4BDBC	1
E4BDBD	1
E4BDBE	1
E4BDBF	1
E4BE80	1
E4BE81	1
E4BE82	1
E4BE83	1
E4BE84	1
E4BE85	1
E4BE86	1
E4BE87	1
E4BE88	1
E4BE89	1
E4BE8A	1
E4BE8B	1
E4BE8C	1
E4BE8D	1
E4BE8E	1
E4BE8F	1
E4BE90	1
E4BE91	1
E4BE92	1
E4BE93	1
E4BE94	1
E4BE95	1
E4BE96	1
E4BE97	1
E4BE98	1
E4BE99	1
E4BE9A	1
E4BE9B	1
E4BE9C	1
E4BE9D	1
E4BE9E	1
E4BE9F	1
E4BEA0	1
E4BEA1	1
E4BEA2	1
E4BEA3	1
E4BEA4	1
E4BEA5	1
E4BEA6	1
E4BEA7	1
E4BEA8	1
E4BEA9	1
E4BEAA	1
E4BEAB	1
E4BEAC	1
E4BEAD	1
E4BEAE	1
E4BEAF	1
E4BEB0	1
E4BEB1	1
E4BEB2	1
E4BEB3	1
E4BEB4	1
E4BEB5	1
E4BEB6	1
E4BEB7	1
E4BEB8	1
E4BEB9	1
E4BEBA	1
E4BEBB	1
E4BEBC	1
E4BEBD	1
E4BEBE	1
E4BEBF	1
E4BF80	1
E4BF81	1
E4BF82	1
E4BF83	1
E4BF84	1
E4BF85	1
E4BF86	1
E4BF87	1
E4BF88	1
E4BF89	1
E4BF8A	1
E4BF8B	1
E4BF8C	1
E4BF8D	1
E4BF8E	1
E4BF8F	1
E4BF90	1
E4BF91	1
E4BF92	1
E4BF93	1
E4BF94	1
E4BF95	1
E4BF96	1
E4BF97	1
E4BF98	1
E4BF99	1
E4BF9A	1
E4BF9B	1
E4BF9C	1
E4BF9D	1
E4BF9E	1
E4BF9F	1
E4BFA0	1
E4BFA1	1
E4BFA2	1
E4BFA3	1
E4BFA4	1
E4BFA5	1
E4BFA6	1
E4BFA7	1
E4BFA8	1
E4BFA9	1
E4BFAA	1
E4BFAB	1
E4BFAC	1
E4BFAD	1
E4BFAE	1
E4BFAF	1
E4BFB0	1
E4BFB1	1
E4BFB2	1
E4BFB3	1
E4BFB4	1
E4BFB5	1
E4BFB6	1
E4BFB7	1
E4BFB8	1
E4BFB9	1
E4BFBA	1
E4BFBB	1
E4BFBC	1
E4BFBD	1
E4BFBE	1
E4BFBF	1
C8B7	1
C8B8	1
C8B9	1
C8BA	1
C8BB	1
C8BC	1
C8BD	1
C8BE	1
C8BF	1
C980	1
C981	1
C982	1
C983	1
C984	1
C985	1
C986	1
C987	1
C988	1
C989	1
C98A	1
C98B	1
C98C	1
C98D	1
C98E	1
C98F	1
CD98	1
CD99	1
CD9A	1
CD9B	1
CD9C	1
CDB0	1
CDB1	1
CDB2	1
CDB3	1
CDB6	1
CDB7	1
CDB8	1
CDB9	1
CDBB	1
CDBC	1
CDBD	1
CDBF	1
CE80	1
CE81	1
CE82	1
CE83	1
CE8B	1
CE8D	1
CEA2	1
CF8F	1
CFBC	1
CFBD	1
CFBE	1
CFBF	1
D287	1
D38F	1
D3B6	1
D3B7	1
D3BA	1
D3BB	1
D3BC	1
D3BD	1
D3BE	1
D3BF	1
D490	1
D491	1
D492	1
D493	1
D494	1
D495	1
D496	1
D497	1
D498	1
D499	1
D49A	1
D49B	1
D49C	1
D49D	1
D49E	1
D49F	1
D4A0	1
D4A1	1
D4A2	1
D4A3	1
D4A4	1
D4A5	1
D4A6	1
D4A7	1
D4A8	1
D4A9	1
D4AA	1
D4AB	1
D4AC	1
D4AD	1
D4AE	1
D4AF	1
D4B0	1
D597	1
D598	1
D5A0	1
D688	1
D68B	1
D68C	1
D68D	1
D68E	1
D68F	1
D690	1
D6A2	1
D6BA	1
D785	1
D786	1
D787	1
D788	1
D789	1
D78A	1
D78B	1
D78C	1
D78D	1
D78E	1
D78F	1
D7AB	1
D7AC	1
D7AD	1
D7AE	1
D7AF	1
D7B5	1
D7B6	1
D7B7	1
D7B8	1
D7B9	1
D7BA	1
D7BB	1
D7BC	1
D7BD	1
D7BE	1
D7BF	1
D884	1
D885	1
D886	1
D887	1
D888	1
D889	1
D88A	1
D88B	1
D896	1
D897	1
D898	1
D899	1
D89A	1
D89C	1
D89D	1
D89E	1
D8A0	1
D8BB	1
D8BC	1
D8BD	1
D8BE	1
D8BF	1
D999	1
D99A	1
D99B	1
D99C	1
D99D	1
D99E	1
D99F	1
DC8E	1
DD8B	1
DD8C	1
DD90	1
DD91	1
DD92	1
DD93	1
DD94	1
DD95	1
DD96	1
DD97	1
DD98	1
DD99	1
DD9A	1
DD9B	1
DD9C	1
DD9D	1
DD9E	1
DD9F	1
DDA0	1
DDA1	1
DDA2	1
DDA3	1
DDA4	1
DDA5	1
DDA6	1
DDA7	1
DDA8	1
DDA9	1
DDAA	1
DDAB	1
DDAC	1
DDAD	1
DDAE	1
DDAF	1
DDB0	1
DDB1	1
DDB2	1
DDB3	1
DDB4	1
DDB5	1
DDB6	1
DDB7	1
DDB8	1
DDB9	1
DDBA	1
DDBB	1
DDBC	1
DDBD	1
DDBE	1
DDBF	1
DEB2	1
DEB3	1
DEB4	1
DEB5	1
DEB6	1
DEB7	1
DEB8	1
DEB9	1
DEBA	1
DEBB	1
DEBC	1
DEBD	1
DEBE	1
DEBF	1
DF80	1
DF81	1
DF82	1
DF83	1
DF84	1
DF85	1
DF86	1
DF87	1
DF88	1
DF89	1
DF8A	1
DF8B	1
DF8C	1
DF8D	1
DF8E	1
DF8F	1
DF90	1
DF91	1
DF92	1
DF93	1
DF94	1
DF95	1
DF96	1
DF97	1
DF98	1
DF99	1
DF9A	1
DF9B	1
DF9C	1
DF9D	1
DF9E	1
DF9F	1
DFA0	1
DFA1	1
DFA2	1
DFA3	1
DFA4	1
DFA5	1
DFA6	1
DFA7	1
DFA8	1
DFA9	1
DFAA	1
DFAB	1
DFAC	1
DFAD	1
DFAE	1
DFAF	1
DFB0	1
DFB1	1
DFB2	1
DFB3	1
DFB4	1
DFB5	1
DFB6	1
DFB7	1
DFB8	1
DFB9	1
DFBA	1
DFBB	1
DFBC	1
DFBD	1
DFBE	1
DFBF	1
DROP TABLE IF EXISTS test.t1;
DROP TABLE IF EXISTS test.t1;
DROP DATABASE test;
CREATE DATABASE test CHARACTER SET utf8mb3;
USE test;
CREATE TABLE test.t1 (a CHAR(4) CHARACTER SET utf8mb3 COLLATE utf8mb3_danish_ci) ENGINE=MyISAM CHARACTER SET utf8mb3 COLLATE utf8mb3_danish_ci;
Warnings:
Warning	1287	'utf8mb3' is deprecated and will be removed in a future release. Please use utf8mb4 instead
Warning	3778	'utf8mb3_danish_ci' is a collation of the deprecated character set UTF8MB3. Please consider using UTF8MB4 with an appropriate collation instead.
Warning	1287	'utf8mb3' is deprecated and will be removed in a future release. Please use utf8mb4 instead
Warning	3778	'utf8mb3_danish_ci' is a collation of the deprecated character set UTF8MB3. Please consider using UTF8MB4 with an appropriate collation instead.
SHOW TABLE STATUS LIKE 't1';
Name	Engine	Version	Row_format	Rows	Avg_row_length	Data_length	Max_data_length	Index_length	Data_free	Auto_increment	Create_time	Update_time	Check_time	Collation	Checksum	Create_options	Comment
t1	MyISAM	#	#	#	#	#	#	#	#	#	#	#	#	utf8mb3_danish_ci	#	#	#
LOAD DATA INFILE 
'MYSQL_TEST_DIR/suite/funcs_2/data/charset_utf8.txt' INTO TABLE test.t1;
DELETE FROM test.t1 WHERE CHAR_LENGTH(a) <> 1;
SELECT HEX(ORD(a)) AS a_ord, CHAR_LENGTH(a) AS a_len FROM test.t1 ORDER BY a, ORD(a);
a_ord	a_len
C285	1
7F	1
C280	1
C281	1
C282	1
C283	1
C284	1
C286	1
C287	1
C288	1
C289	1
C28A	1
C28B	1
C28C	1
C28D	1
C28E	1
C28F	1
C290	1
C291	1
C292	1
C293	1
C294	1
C295	1
C296	1
C297	1
C298	1
C299	1
C29A	1
C29B	1
C29C	1
C29D	1
C29E	1
C29F	1
C2A0	1
CC80	1
CC81	1
CC82	1
CC83	1
CC84	1
CC85	1
CC86	1
CC87	1
CC88	1
CC89	1
CC8A	1
CC8B	1
CC8C	1
CC8D	1
CC8E	1
CC8F	1
CC90	1
CC91	1
CC92	1
CC93	1
CC94	1
CC95	1
CC96	1
CC97	1
CC98	1
CC99	1
CC9A	1
CC9B	1
CC9C	1
CC9D	1
CC9E	1
CC9F	1
CCA0	1
CCA1	1
CCA2	1
CCA3	1
CCA4	1
CCA5	1
CCA6	1
CCA7	1
CCA8	1
CCA9	1
CCAA	1
CCAB	1
CCAC	1
CCAD	1
CCAE	1
CCAF	1
CCB0	1
CCB1	1
CCB2	1
CCB3	1
CCB4	1
CCB5	1
CCB6	1
CCB7	1
CCB8	1
CCB9	1
CCBA	1
CCBB	1
CCBC	1
CCBD	1
CCBE	1
CCBF	1
CD80	1
CD81	1
CD82	1
CD83	1
CD84	1
CD85	1
CD86	1
CD87	1
CD88	1
CD89	1
CD8A	1
CD8B	1
CD8C	1
CD8D	1
CD8E	1
CD8F	1
CD90	1
CD91	1
CD92	1
CD93	1
CD94	1
CD95	1
CD96	1
CD97	1
CD9D	1
CD9E	1
CD9F	1
CDA0	1
CDA1	1
CDA2	1
D283	1
D284	1
D285	1
D286	1
D288	1
D289	1
D691	1
D692	1
D693	1
D694	1
D695	1
D696	1
D697	1
D698	1
D699	1
D69A	1
D69B	1
D69C	1
D69D	1
D69E	1
D69F	1
D6A0	1
D6A1	1
D6A3	1
D6A4	1
D6A5	1
D6A6	1
D6A7	1
D6A8	1
D6A9	1
D6AA	1
D6AB	1
D6AC	1
D6AD	1
D6AE	1
D6AF	1
D6B0	1
D6B1	1
D6B2	1
D6B3	1
D6B4	1
D6B5	1
D6B6	1
D6B7	1
D6B8	1
D6B9	1
D6BB	1
D6BC	1
D6BD	1
D6BF	1
D781	1
D782	1
D784	1
D880	1
D881	1
D882	1
D883	1
D890	1
D891	1
D892	1
D893	1
D894	1
D895	1
D98B	1
D98C	1
D98D	1
D98E	1
D98F	1
D990	1
D991	1
D992	1
D993	1
D994	1
D995	1
D996	1
D997	1
D998	1
D9B0	1
DB96	1
DB97	1
DB98	1
DB99	1
DB9A	1
DB9B	1
DB9C	1
DB9D	1
DB9E	1
DB9F	1
DBA0	1
DBA1	1
DBA2	1
DBA3	1
DBA4	1
DBA7	1
DBA8	1
DBAA	1
DBAB	1
DBAC	1
DBAD	1
DC8F	1
DC91	1
DCB0	1
DCB1	1
DCB2	1
DCB3	1
DCB4	1
DCB5	1
DCB6	1
DCB7	1
DCB8	1
DCB9	1
DCBA	1
DCBB	1
DCBC	1
DCBD	1
DCBE	1
DCBF	1
DD80	1
DD81	1
DD82	1
DD83	1
DD84	1
DD85	1
DD86	1
DD87	1
DD88	1
DD89	1
DD8A	1
D980	1
60	1
C2B4	1
CE84	1
CB9C	1
5E	1
C2AF	1
CB98	1
CB99	1
C2A8	1
CE85	1
CB9A	1
CB9D	1
C2B8	1
CB9B	1
5F	1
C2AD	1
2D	1
D68A	1
2C	1
D59D	1
D88C	1
D88D	1
D9AB	1
D9AC	1
3B	1
CDBE	1
D89B	1
3A	1
D689	1
DC83	1
DC84	1
DC85	1
DC86	1
DC87	1
DC88	1
21	1
C2A1	1
D59C	1
3F	1
C2BF	1
D59E	1
D89F	1
DC89	1
2E	1
DB94	1
DC81	1
DC82	1
C2B7	1
CE87	1
DC80	1
27	1
22	1
C2AB	1
C2BB	1
28	1
29	1
5B	1
7B	1
7D	1
C2A7	1
C2B6	1
C2A9	1
C2AE	1
40	1
2A	1
D9AD	1
2F	1
26	1
23	1
25	1
D9AA	1
D59A	1
D59B	1
D59F	1
D6BE	1
D780	1
D783	1
D7B3	1
D7B4	1
DC8A	1
DC8B	1
DC8C	1
DC8D	1
CAB9	1
CDB4	1
CDB5	1
CABA	1
CB82	1
CB83	1
CB84	1
CB85	1
CB86	1
CB87	1
CB88	1
CB89	1
CB8A	1
CB8B	1
CB8C	1
CB8D	1
CB8E	1
CB8F	1
CB92	1
CB93	1
CB94	1
CB95	1
CB96	1
CB97	1
CB9E	1
CB9F	1
CBA5	1
CBA6	1
CBA7	1
CBA8	1
CBA9	1
CBAA	1
CBAB	1
CBAC	1
CBAD	1
CBAF	1
CBB0	1
CBB1	1
CBB2	1
CBB3	1
CBB4	1
CBB5	1
CBB6	1
CBB7	1
CBB8	1
CBB9	1
CBBA	1
CBBB	1
CBBC	1
CBBD	1
CBBE	1
CBBF	1
C2B0	1
D282	1
D88E	1
D88F	1
DBA9	1
CFB6	1
2B	1
C2B1	1
C3B7	1
C397	1
3C	1
3D	1
3E	1
C2AC	1
7C	1
C2A6	1
7E	1
CB90	1
CB91	1
C2A4	1
C2A2	1
24	1
C2A3	1
C2A5	1
30	1
D9A0	1
DBB0	1
31	1
C2B9	1
D9A1	1
DBB1	1
C2BD	1
C2BC	1
32	1
C2B2	1
D9A2	1
DBB2	1
33	1
C2B3	1
D9A3	1
DBB3	1
C2BE	1
34	1
D9A4	1
DBB4	1
35	1
D9A5	1
DBB5	1
36	1
D9A6	1
DBB6	1
37	1
D9A7	1
DBB7	1
38	1
D9A8	1
DBB8	1
39	1
D9A9	1
DBB9	1
41	1
61	1
C2AA	1
C380	1
C381	1
C382	1
C383	1
C3A0	1
C3A1	1
C3A2	1
C3A3	1
C480	1
C481	1
C482	1
C483	1
C484	1
C485	1
C78D	1
C78E	1
C79E	1
C79F	1
C7A0	1
C7A1	1
C7BA	1
C7BB	1
C880	1
C881	1
C882	1
C883	1
C8A6	1
C8A7	1
CDA3	1
C7A2	1
C7A3	1
C7BC	1
C7BD	1
C990	1
C991	1
C992	1
42	1
62	1
CA99	1
C680	1
C681	1
C993	1
C682	1
C683	1
43	1
63	1
C387	1
C3A7	1
C486	1
C487	1
C488	1
C489	1
C48A	1
C48B	1
C48C	1
C48D	1
CDA8	1
C687	1
C688	1
C995	1
44	1
64	1
C48E	1
C48F	1
CDA9	1
C784	1
C785	1
C786	1
C7B1	1
C7B2	1
C7B3	1
CAA3	1
CAA5	1
CAA4	1
C490	1
C491	1
C689	1
C996	1
C68A	1
C997	1
C68B	1
C68C	1
C8A1	1
C390	1
C3B0	1
45	1
65	1
C388	1
C389	1
C38A	1
C38B	1
C3A8	1
C3A9	1
C3AA	1
C3AB	1
C492	1
C493	1
C494	1
C495	1
C496	1
C497	1
C498	1
C499	1
C49A	1
C49B	1
C884	1
C885	1
C886	1
C887	1
C8A8	1
C8A9	1
CDA4	1
C68E	1
C79D	1
C68F	1
C999	1
C690	1
C99B	1
C998	1
C99A	1
C99C	1
C99D	1
C99E	1
CA9A	1
C9A4	1
46	1
66	1
CAA9	1
C691	1
C692	1
47	1
67	1
C49C	1
C49D	1
C49E	1
C49F	1
C4A0	1
C4A1	1
C4A2	1
C4A3	1
C7A6	1
C7A7	1
C7B4	1
C7B5	1
C9A1	1
C9A2	1
C7A4	1
C7A5	1
C693	1
C9A0	1
CA9B	1
C694	1
C9A3	1
CBA0	1
C6A2	1
C6A3	1
48	1
68	1
C4A4	1
C4A5	1
C89E	1
C89F	1
CAB0	1
CDAA	1
CA9C	1
C695	1
C7B6	1
C4A6	1
C4A7	1
C9A6	1
CAB1	1
C9A7	1
CABB	1
CABD	1
49	1
69	1
C38C	1
C38D	1
C38E	1
C38F	1
C3AC	1
C3AD	1
C3AE	1
C3AF	1
C4A8	1
C4A9	1
C4AA	1
C4AB	1
C4AC	1
C4AD	1
C4AE	1
C4AF	1
C4B0	1
C78F	1
C790	1
C888	1
C889	1
C88A	1
C88B	1
CDA5	1
C4B2	1
C4B3	1
C4B1	1
C9AA	1
C697	1
C9A8	1
C696	1
C9A9	1
4A	1
6A	1
C4B4	1
C4B5	1
C7B0	1
CAB2	1
CA9D	1
C99F	1
CA84	1
4B	1
6B	1
C4B6	1
C4B7	1
C7A8	1
C7A9	1
C698	1
C699	1
CA9E	1
4C	1
6C	1
C4B9	1
C4BA	1
C4BB	1
C4BC	1
C4BD	1
C4BE	1
CBA1	1
C4BF	1
C580	1
C787	1
C788	1
C789	1
CAAA	1
CAAB	1
CA9F	1
C581	1
C582	1
C69A	1
C9AB	1
C9AC	1
C9AD	1
C8B4	1
C9AE	1
C69B	1
CA8E	1
4D	1
6D	1
CDAB	1
C9B1	1
4E	1
6E	1
C391	1
C3B1	1
C583	1
C584	1
C585	1
C586	1
C587	1
C588	1
C7B8	1
C7B9	1
C78A	1
C78B	1
C78C	1
C9B4	1
C69D	1
C9B2	1
C69E	1
C8A0	1
C9B3	1
C8B5	1
C58A	1
C58B	1
4F	1
6F	1
C2BA	1
C392	1
C393	1
C394	1
C395	1
C3B2	1
C3B3	1
C3B4	1
C3B5	1
C58C	1
C58D	1
C58E	1
C58F	1
C6A0	1
C6A1	1
C791	1
C792	1
C7AA	1
C7AB	1
C7AC	1
C7AD	1
C88C	1
C88D	1
C88E	1
C88F	1
C8AA	1
C8AB	1
C8AC	1
C8AD	1
C8AE	1
C8AF	1
C8B0	1
C8B1	1
CDA6	1
C592	1
C593	1
C9B6	1
C7BE	1
C7BF	1
C686	1
C994	1
C69F	1
C9B5	1
C9B7	1
C8A2	1
C8A3	1
50	1
70	1
C6A4	1
C6A5	1
C9B8	1
51	1
71	1
CAA0	1
C4B8	1
52	1
72	1
C594	1
C595	1
C596	1
C597	1
C598	1
C599	1
C890	1
C891	1
C892	1
C893	1
CAB3	1
CDAC	1
C6A6	1
CA80	1
C9B9	1
CAB4	1
C9BA	1
C9BB	1
CAB5	1
C9BC	1
C9BD	1
C9BE	1
C9BF	1
CA81	1
CAB6	1
53	1
73	1
C59A	1
C59B	1
C59C	1
C59D	1
C59E	1
C59F	1
C5A0	1
C5A1	1
C5BF	1
C898	1
C899	1
CBA2	1
C39F	1
CA82	1
C6A9	1
CA83	1
C6AA	1
CA85	1
CA86	1
54	1
74	1
C5A2	1
C5A3	1
C5A4	1
C5A5	1
C89A	1
C89B	1
CDAD	1
CAA8	1
C6BE	1
CAA6	1
CAA7	1
C5A6	1
C5A7	1
C6AB	1
C6AC	1
C6AD	1
C6AE	1
CA88	1
C8B6	1
CA87	1
55	1
75	1
C399	1
C39A	1
C39B	1
C3B9	1
C3BA	1
C3BB	1
C5A8	1
C5A9	1
C5AA	1
C5AB	1
C5AC	1
C5AD	1
C5AE	1
C5AF	1
C5B2	1
C5B3	1
C6AF	1
C6B0	1
C793	1
C794	1
C795	1
C796	1
C797	1
C798	1
C799	1
C79A	1
C79B	1
C79C	1
C894	1
C895	1
C896	1
C897	1
CDA7	1
CA89	1
C9A5	1
CAAE	1
CAAF	1
C69C	1
C9AF	1
C9B0	1
C6B1	1
CA8A	1
56	1
76	1
CDAE	1
C6B2	1
CA8B	1
CA8C	1
57	1
77	1
C5B4	1
C5B5	1
CAB7	1
CA8D	1
58	1
78	1
CBA3	1
CDAF	1
59	1
79	1
C39C	1
C39D	1
C3BC	1
C3BD	1
C3BF	1
C5B0	1
C5B1	1
C5B6	1
C5B7	1
C5B8	1
C8B2	1
C8B3	1
CAB8	1
CA8F	1
C6B3	1
C6B4	1
5A	1
7A	1
C5B9	1
C5BA	1
C5BB	1
C5BC	1
C5BD	1
C5BE	1
C68D	1
C384	1
C386	1
C3A4	1
C3A6	1
C396	1
C398	1
C3B6	1
C3B8	1
C590	1
C591	1
C385	1
C3A5	1
C6B5	1
C6B6	1
C8A4	1
C8A5	1
CA90	1
CA91	1
C6B7	1
C7AE	1
C7AF	1
CA92	1
C6B8	1
C6B9	1
C6BA	1
CA93	1
C89C	1
C89D	1
C39E	1
C3BE	1
C6BF	1
C7B7	1
C6BB	1
C6A7	1
C6A8	1
C6BC	1
C6BD	1
C684	1
C685	1
CA94	1
CB80	1
CABC	1
C589	1
CBAE	1
CABE	1
CA95	1
CBA4	1
CABF	1
CB81	1
CAA1	1
CAA2	1
CA96	1
C780	1
C781	1
C782	1
C783	1
CA97	1
CA98	1
CAAC	1
CAAD	1
CE86	1
CE91	1
CEAC	1
CEB1	1
CE92	1
CEB2	1
CF90	1
CE93	1
CEB3	1
CE94	1
CEB4	1
CE88	1
CE95	1
CEAD	1
CEB5	1
CFB5	1
CF9C	1
CF9D	1
CF9A	1
CF9B	1
CE96	1
CEB6	1
CE89	1
CE97	1
CEAE	1
CEB7	1
CE98	1
CEB8	1
CF91	1
CFB4	1
CDBA	1
CE8A	1
CE90	1
CE99	1
CEAA	1
CEAF	1
CEB9	1
CF8A	1
CFB3	1
CE9A	1
CEBA	1
CFB0	1
CF97	1
CE9B	1
CEBB	1
C2B5	1
CE9C	1
CEBC	1
CE9D	1
CEBD	1
CE9E	1
CEBE	1
CE8C	1
CE9F	1
CEBF	1
CF8C	1
CEA0	1
CF80	1
CF96	1
CF9E	1
CF9F	1
CF98	1
CF99	1
CEA1	1
CF81	1
CFB1	1
CEA3	1
CF82	1
CF83	1
CFB2	1
CFB9	1
CEA4	1
CF84	1
CE8E	1
CEA5	1
CEAB	1
CEB0	1
CF85	1
CF8B	1
CF8D	1
CF92	1
CF93	1
CF94	1
CEA6	1
CF86	1
CF95	1
CEA7	1
CF87	1
CEA8	1
CF88	1
CE8F	1
CEA9	1
CF89	1
CF8E	1
CFA0	1
CFA1	1
CFB7	1
CFB8	1
CFBA	1
CFBB	1
CFA2	1
CFA3	1
CFA4	1
CFA5	1
CFA6	1
CFA7	1
CFA8	1
CFA9	1
CFAA	1
CFAB	1
CFAC	1
CFAD	1
CFAE	1
CFAF	1
D090	1
D0B0	1
D390	1
D391	1
D392	1
D393	1
D398	1
D399	1
D39A	1
D39B	1
D394	1
D395	1
D091	1
D0B1	1
D092	1
D0B2	1
D093	1
D0B3	1
D290	1
D291	1
D292	1
D293	1
D294	1
D295	1
D094	1
D0B4	1
D480	1
D481	1
D082	1
D192	1
D482	1
D483	1
D083	1
D193	1
D298	1
D299	1
D080	1
D081	1
D095	1
D0B5	1
D190	1
D191	1
D396	1
D397	1
D084	1
D194	1
D096	1
D0B6	1
D381	1
D382	1
D39C	1
D39D	1
D296	1
D297	1
D097	1
D0B7	1
D484	1
D485	1
D39E	1
D39F	1
D085	1
D195	1
D3A0	1
D3A1	1
D486	1
D487	1
D08D	1
D098	1
D0B8	1
D19D	1
D3A2	1
D3A3	1
D28A	1
D28B	1
D3A4	1
D3A5	1
D086	1
D196	1
D087	1
D197	1
D099	1
D0B9	1
D088	1
D198	1
D09A	1
D0BA	1
D29A	1
D29B	1
D383	1
D384	1
D2A0	1
D2A1	1
D29E	1
D29F	1
D29C	1
D29D	1
D09B	1
D0BB	1
D385	1
D386	1
D089	1
D199	1
D488	1
D489	1
D09C	1
D0BC	1
D38D	1
D38E	1
D09D	1
D0BD	1
D389	1
D38A	1
D2A2	1
D2A3	1
D387	1
D388	1
D2A4	1
D2A5	1
D08A	1
D19A	1
D48A	1
D48B	1
D09E	1
D0BE	1
D3A6	1
D3A7	1
D3A8	1
D3A9	1
D3AA	1
D3AB	1
D09F	1
D0BF	1
D2A6	1
D2A7	1
D280	1
D281	1
D0A0	1
D180	1
D28E	1
D28F	1
D0A1	1
D181	1
D48C	1
D48D	1
D2AA	1
D2AB	1
D0A2	1
D182	1
D48E	1
D48F	1
D2AC	1
D2AD	1
D08B	1
D19B	1
D08C	1
D19C	1
D0A3	1
D183	1
D3AE	1
D3AF	1
D08E	1
D19E	1
D3B0	1
D3B1	1
D3B2	1
D3B3	1
D2AE	1
D2AF	1
D2B0	1
D2B1	1
D1B8	1
D1B9	1
D0A4	1
D184	1
D0A5	1
D185	1
D2B2	1
D2B3	1
D2BA	1
D2BB	1
D1A0	1
D1A1	1
D1BE	1
D1BF	1
D1BC	1
D1BD	1
D1BA	1
D1BB	1
D0A6	1
D186	1
D2B4	1
D2B5	1
D0A7	1
D187	1
D3B4	1
D3B5	1
D2B6	1
D2B7	1
D38B	1
D38C	1
D2B8	1
D2B9	1
D2BC	1
D2BD	1
D2BE	1
D2BF	1
D08F	1
D19F	1
D0A8	1
D188	1
D0A9	1
D189	1
D0AA	1
D18A	1
D0AB	1
D18B	1
D3B8	1
D3B9	1
D0AC	1
D18C	1
D28C	1
D28D	1
D1A2	1
D1A3	1
D0AD	1
D18D	1
D3AC	1
D3AD	1
D0AE	1
D18E	1
D0AF	1
D18F	1
D1A4	1
D1A5	1
D1A6	1
D1A7	1
D1AA	1
D1AB	1
D1A8	1
D1A9	1
D1AC	1
D1AD	1
D1AE	1
D1AF	1
D1B0	1
D1B1	1
D1B2	1
D1B3	1
D1B4	1
D1B5	1
D1B6	1
D1B7	1
D2A8	1
D2A9	1
D380	1
D4B1	1
D5A1	1
D4B2	1
D5A2	1
D4B3	1
D5A3	1
D4B4	1
D5A4	1
D4B5	1
D5A5	1
D687	1
D4B6	1
D5A6	1
D4B7	1
D5A7	1
D4B8	1
D5A8	1
D4B9	1
D5A9	1
D4BA	1
D5AA	1
D4BB	1
D5AB	1
D4BC	1
D5AC	1
D4BD	1
D5AD	1
D4BE	1
D5AE	1
D4BF	1
D5AF	1
D580	1
D5B0	1
D581	1
D5B1	1
D582	1
D5B2	1
D583	1
D5B3	1
D584	1
D5B4	1
D585	1
D5B5	1
D586	1
D5B6	1
D587	1
D5B7	1
D588	1
D5B8	1
D589	1
D5B9	1
D58A	1
D5BA	1
D58B	1
D5BB	1
D58C	1
D5BC	1
D58D	1
D5BD	1
D58E	1
D5BE	1
D58F	1
D5BF	1
D590	1
D680	1
D591	1
D681	1
D592	1
D682	1
D593	1
D683	1
D594	1
D684	1
D595	1
D685	1
D596	1
D686	1
D599	1
D790	1
D791	1
D792	1
D793	1
D794	1
D795	1
D7B0	1
D7B1	1
D796	1
D797	1
D798	1
D799	1
D7B2	1
D79A	1
D79B	1
D79C	1
D79D	1
D79E	1
D79F	1
D7A0	1
D7A1	1
D7A2	1
D7A3	1
D7A4	1
D7A5	1
D7A6	1
D7A7	1
D7A8	1
D7A9	1
D7AA	1
D8A1	1
D9B4	1
DBBD	1
D8A2	1
D8A3	1
D9B2	1
D9B1	1
D8A4	1
D8A5	1
D9B3	1
D8A6	1
D8A7	1
D9B5	1
D9AE	1
D8A8	1
D9BB	1
D9BE	1
DA80	1
D8A9	1
D8AA	1
D8AB	1
D9B9	1
D9BA	1
D9BC	1
D9BD	1
D9BF	1
D8AC	1
DA83	1
DA84	1
DA86	1
DABF	1
DA87	1
D8AD	1
D8AE	1
DA81	1
DA82	1
DA85	1
D8AF	1
D8B0	1
DA88	1
DA89	1
DA8A	1
DA8B	1
DA8C	1
DA8D	1
DA8E	1
DA8F	1
DA90	1
DBAE	1
D8B1	1
D8B2	1
DA91	1
DA92	1
DA93	1
DA94	1
DA95	1
DA96	1
DA97	1
DA98	1
DA99	1
DBAF	1
D8B3	1
D8B4	1
DA9A	1
DA9B	1
DA9C	1
DBBA	1
D8B5	1
D8B6	1
DA9D	1
DA9E	1
DBBB	1
D8B7	1
D8B8	1
DA9F	1
D8B9	1
D8BA	1
DAA0	1
DBBC	1
D981	1
DAA1	1
DAA2	1
DAA3	1
DAA4	1
DAA5	1
DAA6	1
D9AF	1
D982	1
DAA7	1
DAA8	1
D983	1
DAA9	1
DAAA	1
DAAB	1
DAAC	1
DAAD	1
DAAE	1
DAAF	1
DAB0	1
DAB1	1
DAB2	1
DAB3	1
DAB4	1
D984	1
DAB5	1
DAB6	1
DAB7	1
DAB8	1
D985	1
DBBE	1
D986	1
DABA	1
DABB	1
DABC	1
DABD	1
DAB9	1
D987	1
DABE	1
DB81	1
DB82	1
DB83	1
DBBF	1
DB80	1
DB95	1
D988	1
DBA5	1
D9B6	1
DB84	1
DB85	1
DB86	1
DB87	1
D9B7	1
DB88	1
DB89	1
DB8A	1
DB8B	1
DB8F	1
D989	1
D98A	1
DBA6	1
D9B8	1
DB8C	1
DB8D	1
DB8E	1
DB90	1
DB91	1
DB92	1
DB93	1
DC90	1
DC92	1
DCAD	1
DC93	1
DC94	1
DCAE	1
DC96	1
DC95	1
DCAF	1
DC97	1
DC98	1
DC99	1
DD8D	1
DC9A	1
DC9B	1
DC9C	1
DC9D	1
DC9E	1
DC9F	1
DD8E	1
DCA0	1
DCA1	1
DCA2	1
DCA3	1
DCA4	1
DCA5	1
DCA6	1
DCA7	1
DD8F	1
DCA8	1
DCA9	1
DCAA	1
DCAB	1
DCAC	1
DE80	1
DE99	1
DE9A	1
DE81	1
DE82	1
DE83	1
DE9C	1
DE84	1
DE85	1
DE86	1
DE87	1
DEA2	1
DEA3	1
DE88	1
DEA5	1
DE89	1
DE8A	1
DE8B	1
DE9B	1
DE8C	1
DE98	1
DEA0	1
DEA1	1
DE8D	1
DE8E	1
DEA4	1
DE8F	1
DE90	1
DE9D	1
DE9E	1
DE9F	1
DE91	1
DE92	1
DE93	1
DE94	1
DE95	1
DE96	1
DE97	1
DEB1	1
DEA6	1
DEA7	1
DEA8	1
DEA9	1
DEAA	1
DEAB	1
DEAC	1
DEAD	1
DEAE	1
DEAF	1
DEB0	1
E4B880	1
E4B881	1
E4B882	1
E4B883	1
E4B884	1
E4B885	1
E4B886	1
E4B887	1
E4B888	1
E4B889	1
E4B88A	1
E4B88B	1
E4B88C	1
E4B88D	1
E4B88E	1
E4B88F	1
E4B890	1
E4B891	1
E4B892	1
E4B893	1
E4B894	1
E4B895	1
E4B896	1
E4B897	1
E4B898	1
E4B899	1
E4B89A	1
E4B89B	1
E4B89C	1
E4B89D	1
E4B89E	1
E4B89F	1
E4B8A0	1
E4B8A1	1
E4B8A2	1
E4B8A3	1
E4B8A4	1
E4B8A5	1
E4B8A6	1
E4B8A7	1
E4B8A8	1
E4B8A9	1
E4B8AA	1
E4B8AB	1
E4B8AC	1
E4B8AD	1
E4B8AE	1
E4B8AF	1
E4B8B0	1
E4B8B1	1
E4B8B2	1
E4B8B3	1
E4B8B4	1
E4B8B5	1
E4B8B6	1
E4B8B7	1
E4B8B8	1
E4B8B9	1
E4B8BA	1
E4B8BB	1
E4B8BC	1
E4B8BD	1
E4B8BE	1
E4B8BF	1
E4B980	1
E4B981	1
E4B982	1
E4B983	1
E4B984	1
E4B985	1
E4B986	1
E4B987	1
E4B988	1
E4B989	1
E4B98A	1
E4B98B	1
E4B98C	1
E4B98D	1
E4B98E	1
E4B98F	1
E4B990	1
E4B991	1
E4B992	1
E4B993	1
E4B994	1
E4B995	1
E4B996	1
E4B997	1
E4B998	1
E4B999	1
E4B99A	1
E4B99B	1
E4B99C	1
E4B99D	1
E4B99E	1
E4B99F	1
E4B9A0	1
E4B9A1	1
E4B9A2	1
E4B9A3	1
E4B9A4	1
E4B9A5	1
E4B9A6	1
E4B9A7	1
E4B9A8	1
E4B9A9	1
E4B9AA	1
E4B9AB	1
E4B9AC	1
E4B9AD	1
E4B9AE	1
E4B9AF	1
E4B9B0	1
E4B9B1	1
E4B9B2	1
E4B9B3	1
E4B9B4	1
E4B9B5	1
E4B9B6	1
E4B9B7	1
E4B9B8	1
E4B9B9	1
E4B9BA	1
E4B9BB	1
E4B9BC	1
E4B9BD	1
E4B9BE	1
E4B9BF	1
E4BA80	1
E4BA81	1
E4BA82	1
E4BA83	1
E4BA84	1
E4BA85	1
E4BA86	1
E4BA87	1
E4BA88	1
E4BA89	1
E4BA8A	1
E4BA8B	1
E4BA8C	1
E4BA8D	1
E4BA8E	1
E4BA8F	1
E4BA90	1
E4BA91	1
E4BA92	1
E4BA93	1
E4BA94	1
E4BA95	1
E4BA96	1
E4BA97	1
E4BA98	1
E4BA99	1
E4BA9A	1
E4BA9B	1
E4BA9C	1
E4BA9D	1
E4BA9E	1
E4BA9F	1
E4BAA0	1
E4BAA1	1
E4BAA2	1
E4BAA3	1
E4BAA4	1
E4BAA5	1
E4BAA6	1
E4BAA7	1
E4BAA8	1
E4BAA9	1
E4BAAA	1
E4BAAB	1
E4BAAC	1
E4BAAD	1
E4BAAE	1
E4BAAF	1
E4BAB0	1
E4BAB1	1
E4BAB2	1
E4BAB3	1
E4BAB4	1
E4BAB5	1
E4BAB6	1
E4BAB7	1
E4BAB8	1
E4BAB9	1
E4BABA	1
E4BABB	1
E4BABC	1
E4BABD	1
E4BABE	1
E4BABF	1
E4BB80	1
E4BB81	1
E4BB82	1
E4BB83	1
E4BB84	1
E4BB85	1
E4BB86	1
E4BB87	1
E4BB88	1
E4BB89	1
E4BB8A	1
E4BB8B	1
E4BB8C	1
E4BB8D	1
E4BB8E	1
E4BB8F	1
E4BB90	1
E4BB91	1
E4BB92	1
E4BB93	1
E4BB94	1
E4BB95	1
E4BB96	1
E4BB97	1
E4BB98	1
E4BB99	1
E4BB9A	1
E4BB9B	1
E4BB9C	1
E4BB9D	1
E4BB9E	1
E4BB9F	1
E4BBA0	1
E4BBA1	1
E4BBA2	1
E4BBA3	1
E4BBA4	1
E4BBA5	1
E4BBA6	1
E4BBA7	1
E4BBA8	1
E4BBA9	1
E4BBAA	1
E4BBAB	1
E4BBAC	1
E4BBAD	1
E4BBAE	1
E4BBAF	1
E4BBB0	1
E4BBB1	1
E4BBB2	1
E4BBB3	1
E4BBB4	1
E4BBB5	1
E4BBB6	1
E4BBB7	1
E4BBB8	1
E4BBB9	1
E4BBBA	1
E4BBBB	1
E4BBBC	1
E4BBBD	1
E4BBBE	1
E4BBBF	1
E4BC80	1
E4BC81	1
E4BC82	1
E4BC83	1
E4BC84	1
E4BC85	1
E4BC86	1
E4BC87	1
E4BC88	1
E4BC89	1
E4BC8A	1
E4BC8B	1
E4BC8C	1
E4BC8D	1
E4BC8E	1
E4BC8F	1
E4BC90	1
E4BC91	1
E4BC92	1
E4BC93	1
E4BC94	1
E4BC95	1
E4BC96	1
E4BC97	1
E4BC98	1
E4BC99	1
E4BC9A	1
E4BC9B	1
E4BC9C	1
E4BC9D	1
E4BC9E	1
E4BC9F	1
E4BCA0	1
E4BCA1	1
E4BCA2	1
E4BCA3	1
E4BCA4	1
E4BCA5	1
E4BCA6	1
E4BCA7	1
E4BCA8	1
E4BCA9	1
E4BCAA	1
E4BCAB	1
E4BCAC	1
E4BCAD	1
E4BCAE	1
E4BCAF	1
E4BCB0	1
E4BCB1	1
E4BCB2	1
E4BCB3	1
E4BCB4	1
E4BCB5	1
E4BCB6	1
E4BCB7	1
E4BCB8	1
E4BCB9	1
E4BCBA	1
E4BCBB	1
E4BCBC	1
E4BCBD	1
E4BCBE	1
E4BCBF	1
E4BD80	1
E4BD81	1
E4BD82	1
E4BD83	1
E4BD84	1
E4BD85	1
E4BD86	1
E4BD87	1
E4BD88	1
E4BD89	1
E4BD8A	1
E4BD8B	1
E4BD8C	1
E4BD8D	1
E4BD8E	1
E4BD8F	1
E4BD90	1
E4BD91	1
E4BD92	1
E4BD93	1
E4BD94	1
E4BD95	1
E4BD96	1
E4BD97	1
E4BD98	1
E4BD99	1
E4BD9A	1
E4BD9B	1
E4BD9C	1
E4BD9D	1
E4BD9E	1
E4BD9F	1
E4BDA0	1
E4BDA1	1
E4BDA2	1
E4BDA3	1
E4BDA4	1
E4BDA5	1
E4BDA6	1
E4BDA7	1
E4BDA8	1
E4BDA9	1
E4BDAA	1
E4BDAB	1
E4BDAC	1
E4BDAD	1
E4BDAE	1
E4BDAF	1
E4BDB0	1
E4BDB1	1
E4BDB2	1
E4BDB3	1
E4BDB4	1
E4BDB5	1
E4BDB6	1
E4BDB7	1
E4BDB8	1
E4BDB9	1
E4BDBA	1
E4BDBB	1
E4BDBC	1
E4BDBD	1
E4BDBE	1
E4BDBF	1
E4BE80	1
E4BE81	1
E4BE82	1
E4BE83	1
E4BE84	1
E4BE85	1
E4BE86	1
E4BE87	1
E4BE88	1
E4BE89	1
E4BE8A	1
E4BE8B	1
E4BE8C	1
E4BE8D	1
E4BE8E	1
E4BE8F	1
E4BE90	1
E4BE91	1
E4BE92	1
E4BE93	1
E4BE94	1
E4BE95	1
E4BE96	1
E4BE97	1
E4BE98	1
E4BE99	1
E4BE9A	1
E4BE9B	1
E4BE9C	1
E4BE9D	1
E4BE9E	1
E4BE9F	1
E4BEA0	1
E4BEA1	1
E4BEA2	1
E4BEA3	1
E4BEA4	1
E4BEA5	1
E4BEA6	1
E4BEA7	1
E4BEA8	1
E4BEA9	1
E4BEAA	1
E4BEAB	1
E4BEAC	1
E4BEAD	1
E4BEAE	1
E4BEAF	1
E4BEB0	1
E4BEB1	1
E4BEB2	1
E4BEB3	1
E4BEB4	1
E4BEB5	1
E4BEB6	1
E4BEB7	1
E4BEB8	1
E4BEB9	1
E4BEBA	1
E4BEBB	1
E4BEBC	1
E4BEBD	1
E4BEBE	1
E4BEBF	1
E4BF80	1
E4BF81	1
E4BF82	1
E4BF83	1
E4BF84	1
E4BF85	1
E4BF86	1
E4BF87	1
E4BF88	1
E4BF89	1
E4BF8A	1
E4BF8B	1
E4BF8C	1
E4BF8D	1
E4BF8E	1
E4BF8F	1
E4BF90	1
E4BF91	1
E4BF92	1
E4BF93	1
E4BF94	1
E4BF95	1
E4BF96	1
E4BF97	1
E4BF98	1
E4BF99	1
E4BF9A	1
E4BF9B	1
E4BF9C	1
E4BF9D	1
E4BF9E	1
E4BF9F	1
E4BFA0	1
E4BFA1	1
E4BFA2	1
E4BFA3	1
E4BFA4	1
E4BFA5	1
E4BFA6	1
E4BFA7	1
E4BFA8	1
E4BFA9	1
E4BFAA	1
E4BFAB	1
E4BFAC	1
E4BFAD	1
E4BFAE	1
E4BFAF	1
E4BFB0	1
E4BFB1	1
E4BFB2	1
E4BFB3	1
E4BFB4	1
E4BFB5	1
E4BFB6	1
E4BFB7	1
E4BFB8	1
E4BFB9	1
E4BFBA	1
E4BFBB	1
E4BFBC	1
E4BFBD	1
E4BFBE	1
E4BFBF	1
C8B7	1
C8B8	1
C8B9	1
C8BA	1
C8BB	1
C8BC	1
C8BD	1
C8BE	1
C8BF	1
C980	1
C981	1
C982	1
C983	1
C984	1
C985	1
C986	1
C987	1
C988	1
C989	1
C98A	1
C98B	1
C98C	1
C98D	1
C98E	1
C98F	1
CD98	1
CD99	1
CD9A	1
CD9B	1
CD9C	1
CDB0	1
CDB1	1
CDB2	1
CDB3	1
CDB6	1
CDB7	1
CDB8	1
CDB9	1
CDBB	1
CDBC	1
CDBD	1
CDBF	1
CE80	1
CE81	1
CE82	1
CE83	1
CE8B	1
CE8D	1
CEA2	1
CF8F	1
CFBC	1
CFBD	1
CFBE	1
CFBF	1
D287	1
D38F	1
D3B6	1
D3B7	1
D3BA	1
D3BB	1
D3BC	1
D3BD	1
D3BE	1
D3BF	1
D490	1
D491	1
D492	1
D493	1
D494	1
D495	1
D496	1
D497	1
D498	1
D499	1
D49A	1
D49B	1
D49C	1
D49D	1
D49E	1
D49F	1
D4A0	1
D4A1	1
D4A2	1
D4A3	1
D4A4	1
D4A5	1
D4A6	1
D4A7	1
D4A8	1
D4A9	1
D4AA	1
D4AB	1
D4AC	1
D4AD	1
D4AE	1
D4AF	1
D4B0	1
D597	1
D598	1
D5A0	1
D688	1
D68B	1
D68C	1
D68D	1
D68E	1
D68F	1
D690	1
D6A2	1
D6BA	1
D785	1
D786	1
D787	1
D788	1
D789	1
D78A	1
D78B	1
D78C	1
D78D	1
D78E	1
D78F	1
D7AB	1
D7AC	1
D7AD	1
D7AE	1
D7AF	1
D7B5	1
D7B6	1
D7B7	1
D7B8	1
D7B9	1
D7BA	1
D7BB	1
D7BC	1
D7BD	1
D7BE	1
D7BF	1
D884	1
D885	1
D886	1
D887	1
D888	1
D889	1
D88A	1
D88B	1
D896	1
D897	1
D898	1
D899	1
D89A	1
D89C	1
D89D	1
D89E	1
D8A0	1
D8BB	1
D8BC	1
D8BD	1
D8BE	1
D8BF	1
D999	1
D99A	1
D99B	1
D99C	1
D99D	1
D99E	1
D99F	1
DC8E	1
DD8B	1
DD8C	1
DD90	1
DD91	1
DD92	1
DD93	1
DD94	1
DD95	1
DD96	1
DD97	1
DD98	1
DD99	1
DD9A	1
DD9B	1
DD9C	1
DD9D	1
DD9E	1
DD9F	1
DDA0	1
DDA1	1
DDA2	1
DDA3	1
DDA4	1
DDA5	1
DDA6	1
DDA7	1
DDA8	1
DDA9	1
DDAA	1
DDAB	1
DDAC	1
DDAD	1
DDAE	1
DDAF	1
DDB0	1
DDB1	1
DDB2	1
DDB3	1
DDB4	1
DDB5	1
DDB6	1
DDB7	1
DDB8	1
DDB9	1
DDBA	1
DDBB	1
DDBC	1
DDBD	1
DDBE	1
DDBF	1
DEB2	1
DEB3	1
DEB4	1
DEB5	1
DEB6	1
DEB7	1
DEB8	1
DEB9	1
DEBA	1
DEBB	1
DEBC	1
DEBD	1
DEBE	1
DEBF	1
DF80	1
DF81	1
DF82	1
DF83	1
DF84	1
DF85	1
DF86	1
DF87	1
DF88	1
DF89	1
DF8A	1
DF8B	1
DF8C	1
DF8D	1
DF8E	1
DF8F	1
DF90	1
DF91	1
DF92	1
DF93	1
DF94	1
DF95	1
DF96	1
DF97	1
DF98	1
DF99	1
DF9A	1
DF9B	1
DF9C	1
DF9D	1
DF9E	1
DF9F	1
DFA0	1
DFA1	1
DFA2	1
DFA3	1
DFA4	1
DFA5	1
DFA6	1
DFA7	1
DFA8	1
DFA9	1
DFAA	1
DFAB	1
DFAC	1
DFAD	1
DFAE	1
DFAF	1
DFB0	1
DFB1	1
DFB2	1
DFB3	1
DFB4	1
DFB5	1
DFB6	1
DFB7	1
DFB8	1
DFB9	1
DFBA	1
DFBB	1
DFBC	1
DFBD	1
DFBE	1
DFBF	1
DROP TABLE IF EXISTS test.t1;
DROP TABLE IF EXISTS test.t1;
DROP DATABASE test;
CREATE DATABASE test CHARACTER SET utf8mb3;
USE test;
CREATE TABLE test.t1 (a CHAR(4) CHARACTER SET utf8mb3 COLLATE utf8mb3_estonian_ci) ENGINE=MyISAM CHARACTER SET utf8mb3 COLLATE utf8mb3_estonian_ci;
Warnings:
Warning	1287	'utf8mb3' is deprecated and will be removed in a future release. Please use utf8mb4 instead
Warning	3778	'utf8mb3_estonian_ci' is a collation of the deprecated character set UTF8MB3. Please consider using UTF8MB4 with an appropriate collation instead.
Warning	1287	'utf8mb3' is deprecated and will be removed in a future release. Please use utf8mb4 instead
Warning	3778	'utf8mb3_estonian_ci' is a collation of the deprecated character set UTF8MB3. Please consider using UTF8MB4 with an appropriate collation instead.
SHOW TABLE STATUS LIKE 't1';
Name	Engine	Version	Row_format	Rows	Avg_row_length	Data_length	Max_data_length	Index_length	Data_free	Auto_increment	Create_time	Update_time	Check_time	Collation	Checksum	Create_options	Comment
t1	MyISAM	#	#	#	#	#	#	#	#	#	#	#	#	utf8mb3_estonian_ci	#	#	#
LOAD DATA INFILE 
'MYSQL_TEST_DIR/suite/funcs_2/data/charset_utf8.txt' INTO TABLE test.t1;
DELETE FROM test.t1 WHERE CHAR_LENGTH(a) <> 1;
SELECT HEX(ORD(a)) AS a_ord, CHAR_LENGTH(a) AS a_len FROM test.t1 ORDER BY a, ORD(a);
a_ord	a_len
C285	1
7F	1
C280	1
C281	1
C282	1
C283	1
C284	1
C286	1
C287	1
C288	1
C289	1
C28A	1
C28B	1
C28C	1
C28D	1
C28E	1
C28F	1
C290	1
C291	1
C292	1
C293	1
C294	1
C295	1
C296	1
C297	1
C298	1
C299	1
C29A	1
C29B	1
C29C	1
C29D	1
C29E	1
C29F	1
C2A0	1
CC80	1
CC81	1
CC82	1
CC83	1
CC84	1
CC85	1
CC86	1
CC87	1
CC88	1
CC89	1
CC8A	1
CC8B	1
CC8C	1
CC8D	1
CC8E	1
CC8F	1
CC90	1
CC91	1
CC92	1
CC93	1
CC94	1
CC95	1
CC96	1
CC97	1
CC98	1
CC99	1
CC9A	1
CC9B	1
CC9C	1
CC9D	1
CC9E	1
CC9F	1
CCA0	1
CCA1	1
CCA2	1
CCA3	1
CCA4	1
CCA5	1
CCA6	1
CCA7	1
CCA8	1
CCA9	1
CCAA	1
CCAB	1
CCAC	1
CCAD	1
CCAE	1
CCAF	1
CCB0	1
CCB1	1
CCB2	1
CCB3	1
CCB4	1
CCB5	1
CCB6	1
CCB7	1
CCB8	1
CCB9	1
CCBA	1
CCBB	1
CCBC	1
CCBD	1
CCBE	1
CCBF	1
CD80	1
CD81	1
CD82	1
CD83	1
CD84	1
CD85	1
CD86	1
CD87	1
CD88	1
CD89	1
CD8A	1
CD8B	1
CD8C	1
CD8D	1
CD8E	1
CD8F	1
CD90	1
CD91	1
CD92	1
CD93	1
CD94	1
CD95	1
CD96	1
CD97	1
CD9D	1
CD9E	1
CD9F	1
CDA0	1
CDA1	1
CDA2	1
D283	1
D284	1
D285	1
D286	1
D288	1
D289	1
D691	1
D692	1
D693	1
D694	1
D695	1
D696	1
D697	1
D698	1
D699	1
D69A	1
D69B	1
D69C	1
D69D	1
D69E	1
D69F	1
D6A0	1
D6A1	1
D6A3	1
D6A4	1
D6A5	1
D6A6	1
D6A7	1
D6A8	1
D6A9	1
D6AA	1
D6AB	1
D6AC	1
D6AD	1
D6AE	1
D6AF	1
D6B0	1
D6B1	1
D6B2	1
D6B3	1
D6B4	1
D6B5	1
D6B6	1
D6B7	1
D6B8	1
D6B9	1
D6BB	1
D6BC	1
D6BD	1
D6BF	1
D781	1
D782	1
D784	1
D880	1
D881	1
D882	1
D883	1
D890	1
D891	1
D892	1
D893	1
D894	1
D895	1
D98B	1
D98C	1
D98D	1
D98E	1
D98F	1
D990	1
D991	1
D992	1
D993	1
D994	1
D995	1
D996	1
D997	1
D998	1
D9B0	1
DB96	1
DB97	1
DB98	1
DB99	1
DB9A	1
DB9B	1
DB9C	1
DB9D	1
DB9E	1
DB9F	1
DBA0	1
DBA1	1
DBA2	1
DBA3	1
DBA4	1
DBA7	1
DBA8	1
DBAA	1
DBAB	1
DBAC	1
DBAD	1
DC8F	1
DC91	1
DCB0	1
DCB1	1
DCB2	1
DCB3	1
DCB4	1
DCB5	1
DCB6	1
DCB7	1
DCB8	1
DCB9	1
DCBA	1
DCBB	1
DCBC	1
DCBD	1
DCBE	1
DCBF	1
DD80	1
DD81	1
DD82	1
DD83	1
DD84	1
DD85	1
DD86	1
DD87	1
DD88	1
DD89	1
DD8A	1
D980	1
60	1
C2B4	1
CE84	1
CB9C	1
5E	1
C2AF	1
CB98	1
CB99	1
C2A8	1
CE85	1
CB9A	1
CB9D	1
C2B8	1
CB9B	1
5F	1
C2AD	1
2D	1
D68A	1
2C	1
D59D	1
D88C	1
D88D	1
D9AB	1
D9AC	1
3B	1
CDBE	1
D89B	1
3A	1
D689	1
DC83	1
DC84	1
DC85	1
DC86	1
DC87	1
DC88	1
21	1
C2A1	1
D59C	1
3F	1
C2BF	1
D59E	1
D89F	1
DC89	1
2E	1
DB94	1
DC81	1
DC82	1
C2B7	1
CE87	1
DC80	1
27	1
22	1
C2AB	1
C2BB	1
28	1
29	1
5B	1
7B	1
7D	1
C2A7	1
C2B6	1
C2A9	1
C2AE	1
40	1
2A	1
D9AD	1
2F	1
26	1
23	1
25	1
D9AA	1
D59A	1
D59B	1
D59F	1
D6BE	1
D780	1
D783	1
D7B3	1
D7B4	1
DC8A	1
DC8B	1
DC8C	1
DC8D	1
CAB9	1
CDB4	1
CDB5	1
CABA	1
CB82	1
CB83	1
CB84	1
CB85	1
CB86	1
CB87	1
CB88	1
CB89	1
CB8A	1
CB8B	1
CB8C	1
CB8D	1
CB8E	1
CB8F	1
CB92	1
CB93	1
CB94	1
CB95	1
CB96	1
CB97	1
CB9E	1
CB9F	1
CBA5	1
CBA6	1
CBA7	1
CBA8	1
CBA9	1
CBAA	1
CBAB	1
CBAC	1
CBAD	1
CBAF	1
CBB0	1
CBB1	1
CBB2	1
CBB3	1
CBB4	1
CBB5	1
CBB6	1
CBB7	1
CBB8	1
CBB9	1
CBBA	1
CBBB	1
CBBC	1
CBBD	1
CBBE	1
CBBF	1
C2B0	1
D282	1
D88E	1
D88F	1
DBA9	1
CFB6	1
2B	1
C2B1	1
C3B7	1
C397	1
3C	1
3D	1
3E	1
C2AC	1
7C	1
C2A6	1
7E	1
CB90	1
CB91	1
C2A4	1
C2A2	1
24	1
C2A3	1
C2A5	1
30	1
D9A0	1
DBB0	1
31	1
C2B9	1
D9A1	1
DBB1	1
C2BD	1
C2BC	1
32	1
C2B2	1
D9A2	1
DBB2	1
33	1
C2B3	1
D9A3	1
DBB3	1
C2BE	1
34	1
D9A4	1
DBB4	1
35	1
D9A5	1
DBB5	1
36	1
D9A6	1
DBB6	1
37	1
D9A7	1
DBB7	1
38	1
D9A8	1
DBB8	1
39	1
D9A9	1
DBB9	1
41	1
61	1
C2AA	1
C380	1
C381	1
C382	1
C383	1
C385	1
C3A0	1
C3A1	1
C3A2	1
C3A3	1
C3A5	1
C480	1
C481	1
C482	1
C483	1
C484	1
C485	1
C78D	1
C78E	1
C79E	1
C79F	1
C7A0	1
C7A1	1
C7BA	1
C7BB	1
C880	1
C881	1
C882	1
C883	1
C8A6	1
C8A7	1
CDA3	1
C386	1
C3A6	1
C7A2	1
C7A3	1
C7BC	1
C7BD	1
C990	1
C991	1
C992	1
42	1
62	1
CA99	1
C680	1
C681	1
C993	1
C682	1
C683	1
43	1
63	1
C387	1
C3A7	1
C486	1
C487	1
C488	1
C489	1
C48A	1
C48B	1
C48C	1
C48D	1
CDA8	1
C687	1
C688	1
C995	1
44	1
64	1
C48E	1
C48F	1
CDA9	1
C784	1
C785	1
C786	1
C7B1	1
C7B2	1
C7B3	1
CAA3	1
CAA5	1
CAA4	1
C490	1
C491	1
C689	1
C996	1
C68A	1
C997	1
C68B	1
C68C	1
C8A1	1
C390	1
C3B0	1
45	1
65	1
C388	1
C389	1
C38A	1
C38B	1
C3A8	1
C3A9	1
C3AA	1
C3AB	1
C492	1
C493	1
C494	1
C495	1
C496	1
C497	1
C498	1
C499	1
C49A	1
C49B	1
C884	1
C885	1
C886	1
C887	1
C8A8	1
C8A9	1
CDA4	1
C68E	1
C79D	1
C68F	1
C999	1
C690	1
C99B	1
C998	1
C99A	1
C99C	1
C99D	1
C99E	1
CA9A	1
C9A4	1
46	1
66	1
CAA9	1
C691	1
C692	1
47	1
67	1
C49C	1
C49D	1
C49E	1
C49F	1
C4A0	1
C4A1	1
C4A2	1
C4A3	1
C7A6	1
C7A7	1
C7B4	1
C7B5	1
C9A1	1
C9A2	1
C7A4	1
C7A5	1
C693	1
C9A0	1
CA9B	1
C694	1
C9A3	1
CBA0	1
C6A2	1
C6A3	1
48	1
68	1
C4A4	1
C4A5	1
C89E	1
C89F	1
CAB0	1
CDAA	1
CA9C	1
C695	1
C7B6	1
C4A6	1
C4A7	1
C9A6	1
CAB1	1
C9A7	1
CABB	1
CABD	1
49	1
69	1
C38C	1
C38D	1
C38E	1
C38F	1
C3AC	1
C3AD	1
C3AE	1
C3AF	1
C4A8	1
C4A9	1
C4AA	1
C4AB	1
C4AC	1
C4AD	1
C4AE	1
C4AF	1
C4B0	1
C78F	1
C790	1
C888	1
C889	1
C88A	1
C88B	1
CDA5	1
C4B2	1
C4B3	1
C4B1	1
C9AA	1
C697	1
C9A8	1
C696	1
C9A9	1
4A	1
6A	1
C4B4	1
C4B5	1
C7B0	1
CAB2	1
CA9D	1
C99F	1
CA84	1
4B	1
6B	1
C4B6	1
C4B7	1
C7A8	1
C7A9	1
C698	1
C699	1
CA9E	1
4C	1
6C	1
C4B9	1
C4BA	1
C4BB	1
C4BC	1
C4BD	1
C4BE	1
CBA1	1
C4BF	1
C580	1
C787	1
C788	1
C789	1
CAAA	1
CAAB	1
CA9F	1
C581	1
C582	1
C69A	1
C9AB	1
C9AC	1
C9AD	1
C8B4	1
C9AE	1
C69B	1
CA8E	1
4D	1
6D	1
CDAB	1
C9B1	1
4E	1
6E	1
C391	1
C3B1	1
C583	1
C584	1
C585	1
C586	1
C587	1
C588	1
C7B8	1
C7B9	1
C78A	1
C78B	1
C78C	1
C9B4	1
C69D	1
C9B2	1
C69E	1
C8A0	1
C9B3	1
C8B5	1
C58A	1
C58B	1
4F	1
6F	1
C2BA	1
C392	1
C393	1
C394	1
C3B2	1
C3B3	1
C3B4	1
C58C	1
C58D	1
C58E	1
C58F	1
C590	1
C591	1
C6A0	1
C6A1	1
C791	1
C792	1
C7AA	1
C7AB	1
C7AC	1
C7AD	1
C88C	1
C88D	1
C88E	1
C88F	1
C8AA	1
C8AB	1
C8AC	1
C8AD	1
C8AE	1
C8AF	1
C8B0	1
C8B1	1
CDA6	1
C592	1
C593	1
C9B6	1
C398	1
C3B8	1
C7BE	1
C7BF	1
C686	1
C994	1
C69F	1
C9B5	1
C9B7	1
C8A2	1
C8A3	1
50	1
70	1
C6A4	1
C6A5	1
C9B8	1
51	1
71	1
CAA0	1
C4B8	1
52	1
72	1
C594	1
C595	1
C596	1
C597	1
C598	1
C599	1
C890	1
C891	1
C892	1
C893	1
CAB3	1
CDAC	1
C6A6	1
CA80	1
C9B9	1
CAB4	1
C9BA	1
C9BB	1
CAB5	1
C9BC	1
C9BD	1
C9BE	1
C9BF	1
CA81	1
CAB6	1
53	1
73	1
C59A	1
C59B	1
C59C	1
C59D	1
C59E	1
C59F	1
C5BF	1
C898	1
C899	1
CBA2	1
C39F	1
C5A0	1
C5A1	1
5A	1
7A	1
C5BD	1
C5BE	1
CA82	1
C6A9	1
CA83	1
C6AA	1
CA85	1
CA86	1
54	1
74	1
C5A2	1
C5A3	1
C5A4	1
C5A5	1
C89A	1
C89B	1
CDAD	1
CAA8	1
C6BE	1
CAA6	1
CAA7	1
C5A6	1
C5A7	1
C6AB	1
C6AC	1
C6AD	1
C6AE	1
CA88	1
C8B6	1
CA87	1
55	1
75	1
C399	1
C39A	1
C39B	1
C3B9	1
C3BA	1
C3BB	1
C5A8	1
C5A9	1
C5AA	1
C5AB	1
C5AC	1
C5AD	1
C5AE	1
C5AF	1
C5B0	1
C5B1	1
C5B2	1
C5B3	1
C6AF	1
C6B0	1
C793	1
C794	1
C795	1
C796	1
C797	1
C798	1
C799	1
C79A	1
C79B	1
C79C	1
C894	1
C895	1
C896	1
C897	1
CDA7	1
CA89	1
C9A5	1
CAAE	1
CAAF	1
C69C	1
C9AF	1
C9B0	1
C6B1	1
CA8A	1
56	1
76	1
CDAE	1
C6B2	1
CA8B	1
CA8C	1
57	1
77	1
C5B4	1
C5B5	1
CAB7	1
C395	1
C3B5	1
C384	1
C3A4	1
C396	1
C3B6	1
C39C	1
C3BC	1
CA8D	1
58	1
78	1
CBA3	1
CDAF	1
59	1
79	1
C39D	1
C3BD	1
C3BF	1
C5B6	1
C5B7	1
C5B8	1
C8B2	1
C8B3	1
CAB8	1
CA8F	1
C6B3	1
C6B4	1
C5B9	1
C5BA	1
C5BB	1
C5BC	1
C68D	1
C6B5	1
C6B6	1
C8A4	1
C8A5	1
CA90	1
CA91	1
C6B7	1
C7AE	1
C7AF	1
CA92	1
C6B8	1
C6B9	1
C6BA	1
CA93	1
C89C	1
C89D	1
C39E	1
C3BE	1
C6BF	1
C7B7	1
C6BB	1
C6A7	1
C6A8	1
C6BC	1
C6BD	1
C684	1
C685	1
CA94	1
CB80	1
CABC	1
C589	1
CBAE	1
CABE	1
CA95	1
CBA4	1
CABF	1
CB81	1
CAA1	1
CAA2	1
CA96	1
C780	1
C781	1
C782	1
C783	1
CA97	1
CA98	1
CAAC	1
CAAD	1
CE86	1
CE91	1
CEAC	1
CEB1	1
CE92	1
CEB2	1
CF90	1
CE93	1
CEB3	1
CE94	1
CEB4	1
CE88	1
CE95	1
CEAD	1
CEB5	1
CFB5	1
CF9C	1
CF9D	1
CF9A	1
CF9B	1
CE96	1
CEB6	1
CE89	1
CE97	1
CEAE	1
CEB7	1
CE98	1
CEB8	1
CF91	1
CFB4	1
CDBA	1
CE8A	1
CE90	1
CE99	1
CEAA	1
CEAF	1
CEB9	1
CF8A	1
CFB3	1
CE9A	1
CEBA	1
CFB0	1
CF97	1
CE9B	1
CEBB	1
C2B5	1
CE9C	1
CEBC	1
CE9D	1
CEBD	1
CE9E	1
CEBE	1
CE8C	1
CE9F	1
CEBF	1
CF8C	1
CEA0	1
CF80	1
CF96	1
CF9E	1
CF9F	1
CF98	1
CF99	1
CEA1	1
CF81	1
CFB1	1
CEA3	1
CF82	1
CF83	1
CFB2	1
CFB9	1
CEA4	1
CF84	1
CE8E	1
CEA5	1
CEAB	1
CEB0	1
CF85	1
CF8B	1
CF8D	1
CF92	1
CF93	1
CF94	1
CEA6	1
CF86	1
CF95	1
CEA7	1
CF87	1
CEA8	1
CF88	1
CE8F	1
CEA9	1
CF89	1
CF8E	1
CFA0	1
CFA1	1
CFB7	1
CFB8	1
CFBA	1
CFBB	1
CFA2	1
CFA3	1
CFA4	1
CFA5	1
CFA6	1
CFA7	1
CFA8	1
CFA9	1
CFAA	1
CFAB	1
CFAC	1
CFAD	1
CFAE	1
CFAF	1
D090	1
D0B0	1
D390	1
D391	1
D392	1
D393	1
D398	1
D399	1
D39A	1
D39B	1
D394	1
D395	1
D091	1
D0B1	1
D092	1
D0B2	1
D093	1
D0B3	1
D290	1
D291	1
D292	1
D293	1
D294	1
D295	1
D094	1
D0B4	1
D480	1
D481	1
D082	1
D192	1
D482	1
D483	1
D083	1
D193	1
D298	1
D299	1
D080	1
D081	1
D095	1
D0B5	1
D190	1
D191	1
D396	1
D397	1
D084	1
D194	1
D096	1
D0B6	1
D381	1
D382	1
D39C	1
D39D	1
D296	1
D297	1
D097	1
D0B7	1
D484	1
D485	1
D39E	1
D39F	1
D085	1
D195	1
D3A0	1
D3A1	1
D486	1
D487	1
D08D	1
D098	1
D0B8	1
D19D	1
D3A2	1
D3A3	1
D28A	1
D28B	1
D3A4	1
D3A5	1
D086	1
D196	1
D087	1
D197	1
D099	1
D0B9	1
D088	1
D198	1
D09A	1
D0BA	1
D29A	1
D29B	1
D383	1
D384	1
D2A0	1
D2A1	1
D29E	1
D29F	1
D29C	1
D29D	1
D09B	1
D0BB	1
D385	1
D386	1
D089	1
D199	1
D488	1
D489	1
D09C	1
D0BC	1
D38D	1
D38E	1
D09D	1
D0BD	1
D389	1
D38A	1
D2A2	1
D2A3	1
D387	1
D388	1
D2A4	1
D2A5	1
D08A	1
D19A	1
D48A	1
D48B	1
D09E	1
D0BE	1
D3A6	1
D3A7	1
D3A8	1
D3A9	1
D3AA	1
D3AB	1
D09F	1
D0BF	1
D2A6	1
D2A7	1
D280	1
D281	1
D0A0	1
D180	1
D28E	1
D28F	1
D0A1	1
D181	1
D48C	1
D48D	1
D2AA	1
D2AB	1
D0A2	1
D182	1
D48E	1
D48F	1
D2AC	1
D2AD	1
D08B	1
D19B	1
D08C	1
D19C	1
D0A3	1
D183	1
D3AE	1
D3AF	1
D08E	1
D19E	1
D3B0	1
D3B1	1
D3B2	1
D3B3	1
D2AE	1
D2AF	1
D2B0	1
D2B1	1
D1B8	1
D1B9	1
D0A4	1
D184	1
D0A5	1
D185	1
D2B2	1
D2B3	1
D2BA	1
D2BB	1
D1A0	1
D1A1	1
D1BE	1
D1BF	1
D1BC	1
D1BD	1
D1BA	1
D1BB	1
D0A6	1
D186	1
D2B4	1
D2B5	1
D0A7	1
D187	1
D3B4	1
D3B5	1
D2B6	1
D2B7	1
D38B	1
D38C	1
D2B8	1
D2B9	1
D2BC	1
D2BD	1
D2BE	1
D2BF	1
D08F	1
D19F	1
D0A8	1
D188	1
D0A9	1
D189	1
D0AA	1
D18A	1
D0AB	1
D18B	1
D3B8	1
D3B9	1
D0AC	1
D18C	1
D28C	1
D28D	1
D1A2	1
D1A3	1
D0AD	1
D18D	1
D3AC	1
D3AD	1
D0AE	1
D18E	1
D0AF	1
D18F	1
D1A4	1
D1A5	1
D1A6	1
D1A7	1
D1AA	1
D1AB	1
D1A8	1
D1A9	1
D1AC	1
D1AD	1
D1AE	1
D1AF	1
D1B0	1
D1B1	1
D1B2	1
D1B3	1
D1B4	1
D1B5	1
D1B6	1
D1B7	1
D2A8	1
D2A9	1
D380	1
D4B1	1
D5A1	1
D4B2	1
D5A2	1
D4B3	1
D5A3	1
D4B4	1
D5A4	1
D4B5	1
D5A5	1
D687	1
D4B6	1
D5A6	1
D4B7	1
D5A7	1
D4B8	1
D5A8	1
D4B9	1
D5A9	1
D4BA	1
D5AA	1
D4BB	1
D5AB	1
D4BC	1
D5AC	1
D4BD	1
D5AD	1
D4BE	1
D5AE	1
D4BF	1
D5AF	1
D580	1
D5B0	1
D581	1
D5B1	1
D582	1
D5B2	1
D583	1
D5B3	1
D584	1
D5B4	1
D585	1
D5B5	1
D586	1
D5B6	1
D587	1
D5B7	1
D588	1
D5B8	1
D589	1
D5B9	1
D58A	1
D5BA	1
D58B	1
D5BB	1
D58C	1
D5BC	1
D58D	1
D5BD	1
D58E	1
D5BE	1
D58F	1
D5BF	1
D590	1
D680	1
D591	1
D681	1
D592	1
D682	1
D593	1
D683	1
D594	1
D684	1
D595	1
D685	1
D596	1
D686	1
D599	1
D790	1
D791	1
D792	1
D793	1
D794	1
D795	1
D7B0	1
D7B1	1
D796	1
D797	1
D798	1
D799	1
D7B2	1
D79A	1
D79B	1
D79C	1
D79D	1
D79E	1
D79F	1
D7A0	1
D7A1	1
D7A2	1
D7A3	1
D7A4	1
D7A5	1
D7A6	1
D7A7	1
D7A8	1
D7A9	1
D7AA	1
D8A1	1
D9B4	1
DBBD	1
D8A2	1
D8A3	1
D9B2	1
D9B1	1
D8A4	1
D8A5	1
D9B3	1
D8A6	1
D8A7	1
D9B5	1
D9AE	1
D8A8	1
D9BB	1
D9BE	1
DA80	1
D8A9	1
D8AA	1
D8AB	1
D9B9	1
D9BA	1
D9BC	1
D9BD	1
D9BF	1
D8AC	1
DA83	1
DA84	1
DA86	1
DABF	1
DA87	1
D8AD	1
D8AE	1
DA81	1
DA82	1
DA85	1
D8AF	1
D8B0	1
DA88	1
DA89	1
DA8A	1
DA8B	1
DA8C	1
DA8D	1
DA8E	1
DA8F	1
DA90	1
DBAE	1
D8B1	1
D8B2	1
DA91	1
DA92	1
DA93	1
DA94	1
DA95	1
DA96	1
DA97	1
DA98	1
DA99	1
DBAF	1
D8B3	1
D8B4	1
DA9A	1
DA9B	1
DA9C	1
DBBA	1
D8B5	1
D8B6	1
DA9D	1
DA9E	1
DBBB	1
D8B7	1
D8B8	1
DA9F	1
D8B9	1
D8BA	1
DAA0	1
DBBC	1
D981	1
DAA1	1
DAA2	1
DAA3	1
DAA4	1
DAA5	1
DAA6	1
D9AF	1
D982	1
DAA7	1
DAA8	1
D983	1
DAA9	1
DAAA	1
DAAB	1
DAAC	1
DAAD	1
DAAE	1
DAAF	1
DAB0	1
DAB1	1
DAB2	1
DAB3	1
DAB4	1
D984	1
DAB5	1
DAB6	1
DAB7	1
DAB8	1
D985	1
DBBE	1
D986	1
DABA	1
DABB	1
DABC	1
DABD	1
DAB9	1
D987	1
DABE	1
DB81	1
DB82	1
DB83	1
DBBF	1
DB80	1
DB95	1
D988	1
DBA5	1
D9B6	1
DB84	1
DB85	1
DB86	1
DB87	1
D9B7	1
DB88	1
DB89	1
DB8A	1
DB8B	1
DB8F	1
D989	1
D98A	1
DBA6	1
D9B8	1
DB8C	1
DB8D	1
DB8E	1
DB90	1
DB91	1
DB92	1
DB93	1
DC90	1
DC92	1
DCAD	1
DC93	1
DC94	1
DCAE	1
DC96	1
DC95	1
DCAF	1
DC97	1
DC98	1
DC99	1
DD8D	1
DC9A	1
DC9B	1
DC9C	1
DC9D	1
DC9E	1
DC9F	1
DD8E	1
DCA0	1
DCA1	1
DCA2	1
DCA3	1
DCA4	1
DCA5	1
DCA6	1
DCA7	1
DD8F	1
DCA8	1
DCA9	1
DCAA	1
DCAB	1
DCAC	1
DE80	1
DE99	1
DE9A	1
DE81	1
DE82	1
DE83	1
DE9C	1
DE84	1
DE85	1
DE86	1
DE87	1
DEA2	1
DEA3	1
DE88	1
DEA5	1
DE89	1
DE8A	1
DE8B	1
DE9B	1
DE8C	1
DE98	1
DEA0	1
DEA1	1
DE8D	1
DE8E	1
DEA4	1
DE8F	1
DE90	1
DE9D	1
DE9E	1
DE9F	1
DE91	1
DE92	1
DE93	1
DE94	1
DE95	1
DE96	1
DE97	1
DEB1	1
DEA6	1
DEA7	1
DEA8	1
DEA9	1
DEAA	1
DEAB	1
DEAC	1
DEAD	1
DEAE	1
DEAF	1
DEB0	1
E4B880	1
E4B881	1
E4B882	1
E4B883	1
E4B884	1
E4B885	1
E4B886	1
E4B887	1
E4B888	1
E4B889	1
E4B88A	1
E4B88B	1
E4B88C	1
E4B88D	1
E4B88E	1
E4B88F	1
E4B890	1
E4B891	1
E4B892	1
E4B893	1
E4B894	1
E4B895	1
E4B896	1
E4B897	1
E4B898	1
E4B899	1
E4B89A	1
E4B89B	1
E4B89C	1
E4B89D	1
E4B89E	1
E4B89F	1
E4B8A0	1
E4B8A1	1
E4B8A2	1
E4B8A3	1
E4B8A4	1
E4B8A5	1
E4B8A6	1
E4B8A7	1
E4B8A8	1
E4B8A9	1
E4B8AA	1
E4B8AB	1
E4B8AC	1
E4B8AD	1
E4B8AE	1
E4B8AF	1
E4B8B0	1
E4B8B1	1
E4B8B2	1
E4B8B3	1
E4B8B4	1
E4B8B5	1
E4B8B6	1
E4B8B7	1
E4B8B8	1
E4B8B9	1
E4B8BA	1
E4B8BB	1
E4B8BC	1
E4B8BD	1
E4B8BE	1
E4B8BF	1
E4B980	1
E4B981	1
E4B982	1
E4B983	1
E4B984	1
E4B985	1
E4B986	1
E4B987	1
E4B988	1
E4B989	1
E4B98A	1
E4B98B	1
E4B98C	1
E4B98D	1
E4B98E	1
E4B98F	1
E4B990	1
E4B991	1
E4B992	1
E4B993	1
E4B994	1
E4B995	1
E4B996	1
E4B997	1
E4B998	1
E4B999	1
E4B99A	1
E4B99B	1
E4B99C	1
E4B99D	1
E4B99E	1
E4B99F	1
E4B9A0	1
E4B9A1	1
E4B9A2	1
E4B9A3	1
E4B9A4	1
E4B9A5	1
E4B9A6	1
E4B9A7	1
E4B9A8	1
E4B9A9	1
E4B9AA	1
E4B9AB	1
E4B9AC	1
E4B9AD	1
E4B9AE	1
E4B9AF	1
E4B9B0	1
E4B9B1	1
E4B9B2	1
E4B9B3	1
E4B9B4	1
E4B9B5	1
E4B9B6	1
E4B9B7	1
E4B9B8	1
E4B9B9	1
E4B9BA	1
E4B9BB	1
E4B9BC	1
E4B9BD	1
E4B9BE	1
E4B9BF	1
E4BA80	1
E4BA81	1
E4BA82	1
E4BA83	1
E4BA84	1
E4BA85	1
E4BA86	1
E4BA87	1
E4BA88	1
E4BA89	1
E4BA8A	1
E4BA8B	1
E4BA8C	1
E4BA8D	1
E4BA8E	1
E4BA8F	1
E4BA90	1
E4BA91	1
E4BA92	1
E4BA93	1
E4BA94	1
E4BA95	1
E4BA96	1
E4BA97	1
E4BA98	1
E4BA99	1
E4BA9A	1
E4BA9B	1
E4BA9C	1
E4BA9D	1
E4BA9E	1
E4BA9F	1
E4BAA0	1
E4BAA1	1
E4BAA2	1
E4BAA3	1
E4BAA4	1
E4BAA5	1
E4BAA6	1
E4BAA7	1
E4BAA8	1
E4BAA9	1
E4BAAA	1
E4BAAB	1
E4BAAC	1
E4BAAD	1
E4BAAE	1
E4BAAF	1
E4BAB0	1
E4BAB1	1
E4BAB2	1
E4BAB3	1
E4BAB4	1
E4BAB5	1
E4BAB6	1
E4BAB7	1
E4BAB8	1
E4BAB9	1
E4BABA	1
E4BABB	1
E4BABC	1
E4BABD	1
E4BABE	1
E4BABF	1
E4BB80	1
E4BB81	1
E4BB82	1
E4BB83	1
E4BB84	1
E4BB85	1
E4BB86	1
E4BB87	1
E4BB88	1
E4BB89	1
E4BB8A	1
E4BB8B	1
E4BB8C	1
E4BB8D	1
E4BB8E	1
E4BB8F	1
E4BB90	1
E4BB91	1
E4BB92	1
E4BB93	1
E4BB94	1
E4BB95	1
E4BB96	1
E4BB97	1
E4BB98	1
E4BB99	1
E4BB9A	1
E4BB9B	1
E4BB9C	1
E4BB9D	1
E4BB9E	1
E4BB9F	1
E4BBA0	1
E4BBA1	1
E4BBA2	1
E4BBA3	1
E4BBA4	1
E4BBA5	1
E4BBA6	1
E4BBA7	1
E4BBA8	1
E4BBA9	1
E4BBAA	1
E4BBAB	1
E4BBAC	1
E4BBAD	1
E4BBAE	1
E4BBAF	1
E4BBB0	1
E4BBB1	1
E4BBB2	1
E4BBB3	1
E4BBB4	1
E4BBB5	1
E4BBB6	1
E4BBB7	1
E4BBB8	1
E4BBB9	1
E4BBBA	1
E4BBBB	1
E4BBBC	1
E4BBBD	1
E4BBBE	1
E4BBBF	1
E4BC80	1
E4BC81	1
E4BC82	1
E4BC83	1
E4BC84	1
E4BC85	1
E4BC86	1
E4BC87	1
E4BC88	1
E4BC89	1
E4BC8A	1
E4BC8B	1
E4BC8C	1
E4BC8D	1
E4BC8E	1
E4BC8F	1
E4BC90	1
E4BC91	1
E4BC92	1
E4BC93	1
E4BC94	1
E4BC95	1
E4BC96	1
E4BC97	1
E4BC98	1
E4BC99	1
E4BC9A	1
E4BC9B	1
E4BC9C	1
E4BC9D	1
E4BC9E	1
E4BC9F	1
E4BCA0	1
E4BCA1	1
E4BCA2	1
E4BCA3	1
E4BCA4	1
E4BCA5	1
E4BCA6	1
E4BCA7	1
E4BCA8	1
E4BCA9	1
E4BCAA	1
E4BCAB	1
E4BCAC	1
E4BCAD	1
E4BCAE	1
E4BCAF	1
E4BCB0	1
E4BCB1	1
E4BCB2	1
E4BCB3	1
E4BCB4	1
E4BCB5	1
E4BCB6	1
E4BCB7	1
E4BCB8	1
E4BCB9	1
E4BCBA	1
E4BCBB	1
E4BCBC	1
E4BCBD	1
E4BCBE	1
E4BCBF	1
E4BD80	1
E4BD81	1
E4BD82	1
E4BD83	1
E4BD84	1
E4BD85	1
E4BD86	1
E4BD87	1
E4BD88	1
E4BD89	1
E4BD8A	1
E4BD8B	1
E4BD8C	1
E4BD8D	1
E4BD8E	1
E4BD8F	1
E4BD90	1
E4BD91	1
E4BD92	1
E4BD93	1
E4BD94	1
E4BD95	1
E4BD96	1
E4BD97	1
E4BD98	1
E4BD99	1
E4BD9A	1
E4BD9B	1
E4BD9C	1
E4BD9D	1
E4BD9E	1
E4BD9F	1
E4BDA0	1
E4BDA1	1
E4BDA2	1
E4BDA3	1
E4BDA4	1
E4BDA5	1
E4BDA6	1
E4BDA7	1
E4BDA8	1
E4BDA9	1
E4BDAA	1
E4BDAB	1
E4BDAC	1
E4BDAD	1
E4BDAE	1
E4BDAF	1
E4BDB0	1
E4BDB1	1
E4BDB2	1
E4BDB3	1
E4BDB4	1
E4BDB5	1
E4BDB6	1
E4BDB7	1
E4BDB8	1
E4BDB9	1
E4BDBA	1
E4BDBB	1
E4BDBC	1
E4BDBD	1
E4BDBE	1
E4BDBF	1
E4BE80	1
E4BE81	1
E4BE82	1
E4BE83	1
E4BE84	1
E4BE85	1
E4BE86	1
E4BE87	1
E4BE88	1
E4BE89	1
E4BE8A	1
E4BE8B	1
E4BE8C	1
E4BE8D	1
E4BE8E	1
E4BE8F	1
E4BE90	1
E4BE91	1
E4BE92	1
E4BE93	1
E4BE94	1
E4BE95	1
E4BE96	1
E4BE97	1
E4BE98	1
E4BE99	1
E4BE9A	1
E4BE9B	1
E4BE9C	1
E4BE9D	1
E4BE9E	1
E4BE9F	1
E4BEA0	1
E4BEA1	1
E4BEA2	1
E4BEA3	1
E4BEA4	1
E4BEA5	1
E4BEA6	1
E4BEA7	1
E4BEA8	1
E4BEA9	1
E4BEAA	1
E4BEAB	1
E4BEAC	1
E4BEAD	1
E4BEAE	1
E4BEAF	1
E4BEB0	1
E4BEB1	1
E4BEB2	1
E4BEB3	1
E4BEB4	1
E4BEB5	1
E4BEB6	1
E4BEB7	1
E4BEB8	1
E4BEB9	1
E4BEBA	1
E4BEBB	1
E4BEBC	1
E4BEBD	1
E4BEBE	1
E4BEBF	1
E4BF80	1
E4BF81	1
E4BF82	1
E4BF83	1
E4BF84	1
E4BF85	1
E4BF86	1
E4BF87	1
E4BF88	1
E4BF89	1
E4BF8A	1
E4BF8B	1
E4BF8C	1
E4BF8D	1
E4BF8E	1
E4BF8F	1
E4BF90	1
E4BF91	1
E4BF92	1
E4BF93	1
E4BF94	1
E4BF95	1
E4BF96	1
E4BF97	1
E4BF98	1
E4BF99	1
E4BF9A	1
E4BF9B	1
E4BF9C	1
E4BF9D	1
E4BF9E	1
E4BF9F	1
E4BFA0	1
E4BFA1	1
E4BFA2	1
E4BFA3	1
E4BFA4	1
E4BFA5	1
E4BFA6	1
E4BFA7	1
E4BFA8	1
E4BFA9	1
E4BFAA	1
E4BFAB	1
E4BFAC	1
E4BFAD	1
E4BFAE	1
E4BFAF	1
E4BFB0	1
E4BFB1	1
E4BFB2	1
E4BFB3	1
E4BFB4	1
E4BFB5	1
E4BFB6	1
E4BFB7	1
E4BFB8	1
E4BFB9	1
E4BFBA	1
E4BFBB	1
E4BFBC	1
E4BFBD	1
E4BFBE	1
E4BFBF	1
C8B7	1
C8B8	1
C8B9	1
C8BA	1
C8BB	1
C8BC	1
C8BD	1
C8BE	1
C8BF	1
C980	1
C981	1
C982	1
C983	1
C984	1
C985	1
C986	1
C987	1
C988	1
C989	1
C98A	1
C98B	1
C98C	1
C98D	1
C98E	1
C98F	1
CD98	1
CD99	1
CD9A	1
CD9B	1
CD9C	1
CDB0	1
CDB1	1
CDB2	1
CDB3	1
CDB6	1
CDB7	1
CDB8	1
CDB9	1
CDBB	1
CDBC	1
CDBD	1
CDBF	1
CE80	1
CE81	1
CE82	1
CE83	1
CE8B	1
CE8D	1
CEA2	1
CF8F	1
CFBC	1
CFBD	1
CFBE	1
CFBF	1
D287	1
D38F	1
D3B6	1
D3B7	1
D3BA	1
D3BB	1
D3BC	1
D3BD	1
D3BE	1
D3BF	1
D490	1
D491	1
D492	1
D493	1
D494	1
D495	1
D496	1
D497	1
D498	1
D499	1
D49A	1
D49B	1
D49C	1
D49D	1
D49E	1
D49F	1
D4A0	1
D4A1	1
D4A2	1
D4A3	1
D4A4	1
D4A5	1
D4A6	1
D4A7	1
D4A8	1
D4A9	1
D4AA	1
D4AB	1
D4AC	1
D4AD	1
D4AE	1
D4AF	1
D4B0	1
D597	1
D598	1
D5A0	1
D688	1
D68B	1
D68C	1
D68D	1
D68E	1
D68F	1
D690	1
D6A2	1
D6BA	1
D785	1
D786	1
D787	1
D788	1
D789	1
D78A	1
D78B	1
D78C	1
D78D	1
D78E	1
D78F	1
D7AB	1
D7AC	1
D7AD	1
D7AE	1
D7AF	1
D7B5	1
D7B6	1
D7B7	1
D7B8	1
D7B9	1
D7BA	1
D7BB	1
D7BC	1
D7BD	1
D7BE	1
D7BF	1
D884	1
D885	1
D886	1
D887	1
D888	1
D889	1
D88A	1
D88B	1
D896	1
D897	1
D898	1
D899	1
D89A	1
D89C	1
D89D	1
D89E	1
D8A0	1
D8BB	1
D8BC	1
D8BD	1
D8BE	1
D8BF	1
D999	1
D99A	1
D99B	1
D99C	1
D99D	1
D99E	1
D99F	1
DC8E	1
DD8B	1
DD8C	1
DD90	1
DD91	1
DD92	1
DD93	1
DD94	1
DD95	1
DD96	1
DD97	1
DD98	1
DD99	1
DD9A	1
DD9B	1
DD9C	1
DD9D	1
DD9E	1
DD9F	1
DDA0	1
DDA1	1
DDA2	1
DDA3	1
DDA4	1
DDA5	1
DDA6	1
DDA7	1
DDA8	1
DDA9	1
DDAA	1
DDAB	1
DDAC	1
DDAD	1
DDAE	1
DDAF	1
DDB0	1
DDB1	1
DDB2	1
DDB3	1
DDB4	1
DDB5	1
DDB6	1
DDB7	1
DDB8	1
DDB9	1
DDBA	1
DDBB	1
DDBC	1
DDBD	1
DDBE	1
DDBF	1
DEB2	1
DEB3	1
DEB4	1
DEB5	1
DEB6	1
DEB7	1
DEB8	1
DEB9	1
DEBA	1
DEBB	1
DEBC	1
DEBD	1
DEBE	1
DEBF	1
DF80	1
DF81	1
DF82	1
DF83	1
DF84	1
DF85	1
DF86	1
DF87	1
DF88	1
DF89	1
DF8A	1
DF8B	1
DF8C	1
DF8D	1
DF8E	1
DF8F	1
DF90	1
DF91	1
DF92	1
DF93	1
DF94	1
DF95	1
DF96	1
DF97	1
DF98	1
DF99	1
DF9A	1
DF9B	1
DF9C	1
DF9D	1
DF9E	1
DF9F	1
DFA0	1
DFA1	1
DFA2	1
DFA3	1
DFA4	1
DFA5	1
DFA6	1
DFA7	1
DFA8	1
DFA9	1
DFAA	1
DFAB	1
DFAC	1
DFAD	1
DFAE	1
DFAF	1
DFB0	1
DFB1	1
DFB2	1
DFB3	1
DFB4	1
DFB5	1
DFB6	1
DFB7	1
DFB8	1
DFB9	1
DFBA	1
DFBB	1
DFBC	1
DFBD	1
DFBE	1
DFBF	1
DROP TABLE IF EXISTS test.t1;
DROP TABLE IF EXISTS test.t1;
DROP DATABASE test;
CREATE DATABASE test CHARACTER SET utf8mb3;
USE test;
CREATE TABLE test.t1 (a CHAR(4) CHARACTER SET utf8mb3 COLLATE utf8mb3_general_ci) ENGINE=MyISAM CHARACTER SET utf8mb3 COLLATE utf8mb3_general_ci;
Warnings:
Warning	1287	'utf8mb3' is deprecated and will be removed in a future release. Please use utf8mb4 instead
Warning	3778	'utf8mb3_general_ci' is a collation of the deprecated character set UTF8MB3. Please consider using UTF8MB4 with an appropriate collation instead.
Warning	1287	'utf8mb3' is deprecated and will be removed in a future release. Please use utf8mb4 instead
Warning	3778	'utf8mb3_general_ci' is a collation of the deprecated character set UTF8MB3. Please consider using UTF8MB4 with an appropriate collation instead.
SHOW TABLE STATUS LIKE 't1';
Name	Engine	Version	Row_format	Rows	Avg_row_length	Data_length	Max_data_length	Index_length	Data_free	Auto_increment	Create_time	Update_time	Check_time	Collation	Checksum	Create_options	Comment
t1	MyISAM	#	#	#	#	#	#	#	#	#	#	#	#	utf8mb3_general_ci	#	#	#
LOAD DATA INFILE 
'MYSQL_TEST_DIR/suite/funcs_2/data/charset_utf8.txt' INTO TABLE test.t1;
DELETE FROM test.t1 WHERE CHAR_LENGTH(a) <> 1;
SELECT HEX(ORD(a)) AS a_ord, CHAR_LENGTH(a) AS a_len FROM test.t1 ORDER BY a, ORD(a);
a_ord	a_len
21	1
22	1
23	1
24	1
25	1
26	1
27	1
28	1
29	1
2A	1
2B	1
2C	1
2D	1
2E	1
2F	1
30	1
31	1
32	1
33	1
34	1
35	1
36	1
37	1
38	1
39	1
3A	1
3B	1
3C	1
3D	1
3E	1
3F	1
40	1
41	1
61	1
C380	1
C381	1
C382	1
C383	1
C384	1
C385	1
C3A0	1
C3A1	1
C3A2	1
C3A3	1
C3A4	1
C3A5	1
C480	1
C481	1
C482	1
C483	1
C484	1
C485	1
C78D	1
C78E	1
C79E	1
C79F	1
C7A0	1
C7A1	1
C7BA	1
C7BB	1
C880	1
C881	1
C882	1
C883	1
C8A6	1
C8A7	1
42	1
62	1
43	1
63	1
C387	1
C3A7	1
C486	1
C487	1
C488	1
C489	1
C48A	1
C48B	1
C48C	1
C48D	1
44	1
64	1
C48E	1
C48F	1
45	1
65	1
C388	1
C389	1
C38A	1
C38B	1
C3A8	1
C3A9	1
C3AA	1
C3AB	1
C492	1
C493	1
C494	1
C495	1
C496	1
C497	1
C498	1
C499	1
C49A	1
C49B	1
C884	1
C885	1
C886	1
C887	1
C8A8	1
C8A9	1
46	1
66	1
47	1
67	1
C49C	1
C49D	1
C49E	1
C49F	1
C4A0	1
C4A1	1
C4A2	1
C4A3	1
C7A6	1
C7A7	1
C7B4	1
C7B5	1
48	1
68	1
C4A4	1
C4A5	1
C89E	1
C89F	1
49	1
69	1
C38C	1
C38D	1
C38E	1
C38F	1
C3AC	1
C3AD	1
C3AE	1
C3AF	1
C4A8	1
C4A9	1
C4AA	1
C4AB	1
C4AC	1
C4AD	1
C4AE	1
C4AF	1
C4B0	1
C4B1	1
C78F	1
C790	1
C888	1
C889	1
C88A	1
C88B	1
4A	1
6A	1
C4B4	1
C4B5	1
C7B0	1
4B	1
6B	1
C4B6	1
C4B7	1
C7A8	1
C7A9	1
4C	1
6C	1
C4B9	1
C4BA	1
C4BB	1
C4BC	1
C4BD	1
C4BE	1
4D	1
6D	1
4E	1
6E	1
C391	1
C3B1	1
C583	1
C584	1
C585	1
C586	1
C587	1
C588	1
C7B8	1
C7B9	1
4F	1
6F	1
C392	1
C393	1
C394	1
C395	1
C396	1
C3B2	1
C3B3	1
C3B4	1
C3B5	1
C3B6	1
C58C	1
C58D	1
C58E	1
C58F	1
C590	1
C591	1
C6A0	1
C6A1	1
C791	1
C792	1
C7AA	1
C7AB	1
C7AC	1
C7AD	1
C88C	1
C88D	1
C88E	1
C88F	1
C8AA	1
C8AB	1
C8AC	1
C8AD	1
C8AE	1
C8AF	1
C8B0	1
C8B1	1
50	1
70	1
51	1
71	1
52	1
72	1
C594	1
C595	1
C596	1
C597	1
C598	1
C599	1
C890	1
C891	1
C892	1
C893	1
53	1
73	1
C39F	1
C59A	1
C59B	1
C59C	1
C59D	1
C59E	1
C59F	1
C5A0	1
C5A1	1
C5BF	1
C898	1
C899	1
54	1
74	1
C5A2	1
C5A3	1
C5A4	1
C5A5	1
C89A	1
C89B	1
55	1
75	1
C399	1
C39A	1
C39B	1
C39C	1
C3B9	1
C3BA	1
C3BB	1
C3BC	1
C5A8	1
C5A9	1
C5AA	1
C5AB	1
C5AC	1
C5AD	1
C5AE	1
C5AF	1
C5B0	1
C5B1	1
C5B2	1
C5B3	1
C6AF	1
C6B0	1
C793	1
C794	1
C795	1
C796	1
C797	1
C798	1
C799	1
C79A	1
C79B	1
C79C	1
C894	1
C895	1
C896	1
C897	1
56	1
76	1
57	1
77	1
C5B4	1
C5B5	1
58	1
78	1
59	1
79	1
C39D	1
C3BD	1
C3BF	1
C5B6	1
C5B7	1
C5B8	1
C8B2	1
C8B3	1
5A	1
7A	1
C5B9	1
C5BA	1
C5BB	1
C5BC	1
C5BD	1
C5BE	1
5B	1
5E	1
5F	1
60	1
7B	1
7C	1
7D	1
7E	1
7F	1
C280	1
C281	1
C282	1
C283	1
C284	1
C285	1
C286	1
C287	1
C288	1
C289	1
C28A	1
C28B	1
C28C	1
C28D	1
C28E	1
C28F	1
C290	1
C291	1
C292	1
C293	1
C294	1
C295	1
C296	1
C297	1
C298	1
C299	1
C29A	1
C29B	1
C29C	1
C29D	1
C29E	1
C29F	1
C2A0	1
C2A1	1
C2A2	1
C2A3	1
C2A4	1
C2A5	1
C2A6	1
C2A7	1
C2A8	1
C2A9	1
C2AA	1
C2AB	1
C2AC	1
C2AD	1
C2AE	1
C2AF	1
C2B0	1
C2B1	1
C2B2	1
C2B3	1
C2B4	1
C2B6	1
C2B7	1
C2B8	1
C2B9	1
C2BA	1
C2BB	1
C2BC	1
C2BD	1
C2BE	1
C2BF	1
C386	1
C3A6	1
C7A2	1
C7A3	1
C7BC	1
C7BD	1
C390	1
C3B0	1
C397	1
C398	1
C3B8	1
C7BE	1
C7BF	1
C39E	1
C3BE	1
C3B7	1
C490	1
C491	1
C4A6	1
C4A7	1
C4B2	1
C4B3	1
C4B8	1
C4BF	1
C580	1
C581	1
C582	1
C589	1
C58A	1
C58B	1
C592	1
C593	1
C5A6	1
C5A7	1
C680	1
C681	1
C993	1
C682	1
C683	1
C684	1
C685	1
C686	1
C994	1
C687	1
C688	1
C689	1
C996	1
C68A	1
C997	1
C68B	1
C68C	1
C68D	1
C68E	1
C79D	1
C68F	1
C999	1
C690	1
C99B	1
C691	1
C692	1
C693	1
C9A0	1
C694	1
C9A3	1
C696	1
C9A9	1
C697	1
C9A8	1
C698	1
C699	1
C69A	1
C69B	1
C69C	1
C9AF	1
C69D	1
C9B2	1
C69E	1
C69F	1
C9B5	1
C6A2	1
C6A3	1
C6A4	1
C6A5	1
C6A6	1
CA80	1
C6A7	1
C6A8	1
C6A9	1
CA83	1
C6AA	1
C6AB	1
C6AC	1
C6AD	1
C6AE	1
CA88	1
C6B1	1
CA8A	1
C6B2	1
CA8B	1
C6B3	1
C6B4	1
C6B5	1
C6B6	1
C6B7	1
C7AE	1
C7AF	1
CA92	1
C6B8	1
C6B9	1
C6BA	1
C6BB	1
C6BC	1
C6BD	1
C6BE	1
C780	1
C781	1
C782	1
C783	1
C784	1
C785	1
C786	1
C787	1
C788	1
C789	1
C78A	1
C78B	1
C78C	1
C7A4	1
C7A5	1
C7B1	1
C7B2	1
C7B3	1
C695	1
C7B6	1
C6BF	1
C7B7	1
C89C	1
C89D	1
C8A0	1
C8A1	1
C8A2	1
C8A3	1
C8A4	1
C8A5	1
C8B4	1
C8B5	1
C8B6	1
C8B7	1
C8B8	1
C8B9	1
C8BA	1
C8BB	1
C8BC	1
C8BD	1
C8BE	1
C8BF	1
C980	1
C981	1
C982	1
C983	1
C984	1
C985	1
C986	1
C987	1
C988	1
C989	1
C98A	1
C98B	1
C98C	1
C98D	1
C98E	1
C98F	1
C990	1
C991	1
C992	1
C995	1
C998	1
C99A	1
C99C	1
C99D	1
C99E	1
C99F	1
C9A1	1
C9A2	1
C9A4	1
C9A5	1
C9A6	1
C9A7	1
C9AA	1
C9AB	1
C9AC	1
C9AD	1
C9AE	1
C9B0	1
C9B1	1
C9B3	1
C9B4	1
C9B6	1
C9B7	1
C9B8	1
C9B9	1
C9BA	1
C9BB	1
C9BC	1
C9BD	1
C9BE	1
C9BF	1
CA81	1
CA82	1
CA84	1
CA85	1
CA86	1
CA87	1
CA89	1
CA8C	1
CA8D	1
CA8E	1
CA8F	1
CA90	1
CA91	1
CA93	1
CA94	1
CA95	1
CA96	1
CA97	1
CA98	1
CA99	1
CA9A	1
CA9B	1
CA9C	1
CA9D	1
CA9E	1
CA9F	1
CAA0	1
CAA1	1
CAA2	1
CAA3	1
CAA4	1
CAA5	1
CAA6	1
CAA7	1
CAA8	1
CAA9	1
CAAA	1
CAAB	1
CAAC	1
CAAD	1
CAAE	1
CAAF	1
CAB0	1
CAB1	1
CAB2	1
CAB3	1
CAB4	1
CAB5	1
CAB6	1
CAB7	1
CAB8	1
CAB9	1
CABA	1
CABB	1
CABC	1
CABD	1
CABE	1
CABF	1
CB80	1
CB81	1
CB82	1
CB83	1
CB84	1
CB85	1
CB86	1
CB87	1
CB88	1
CB89	1
CB8A	1
CB8B	1
CB8C	1
CB8D	1
CB8E	1
CB8F	1
CB90	1
CB91	1
CB92	1
CB93	1
CB94	1
CB95	1
CB96	1
CB97	1
CB98	1
CB99	1
CB9A	1
CB9B	1
CB9C	1
CB9D	1
CB9E	1
CB9F	1
CBA0	1
CBA1	1
CBA2	1
CBA3	1
CBA4	1
CBA5	1
CBA6	1
CBA7	1
CBA8	1
CBA9	1
CBAA	1
CBAB	1
CBAC	1
CBAD	1
CBAE	1
CBAF	1
CBB0	1
CBB1	1
CBB2	1
CBB3	1
CBB4	1
CBB5	1
CBB6	1
CBB7	1
CBB8	1
CBB9	1
CBBA	1
CBBB	1
CBBC	1
CBBD	1
CBBE	1
CBBF	1
CC80	1
CC81	1
CC82	1
CC83	1
CC84	1
CC85	1
CC86	1
CC87	1
CC88	1
CC89	1
CC8A	1
CC8B	1
CC8C	1
CC8D	1
CC8E	1
CC8F	1
CC90	1
CC91	1
CC92	1
CC93	1
CC94	1
CC95	1
CC96	1
CC97	1
CC98	1
CC99	1
CC9A	1
CC9B	1
CC9C	1
CC9D	1
CC9E	1
CC9F	1
CCA0	1
CCA1	1
CCA2	1
CCA3	1
CCA4	1
CCA5	1
CCA6	1
CCA7	1
CCA8	1
CCA9	1
CCAA	1
CCAB	1
CCAC	1
CCAD	1
CCAE	1
CCAF	1
CCB0	1
CCB1	1
CCB2	1
CCB3	1
CCB4	1
CCB5	1
CCB6	1
CCB7	1
CCB8	1
CCB9	1
CCBA	1
CCBB	1
CCBC	1
CCBD	1
CCBE	1
CCBF	1
CD80	1
CD81	1
CD82	1
CD83	1
CD84	1
CD86	1
CD87	1
CD88	1
CD89	1
CD8A	1
CD8B	1
CD8C	1
CD8D	1
CD8E	1
CD8F	1
CD90	1
CD91	1
CD92	1
CD93	1
CD94	1
CD95	1
CD96	1
CD97	1
CD98	1
CD99	1
CD9A	1
CD9B	1
CD9C	1
CD9D	1
CD9E	1
CD9F	1
CDA0	1
CDA1	1
CDA2	1
CDA3	1
CDA4	1
CDA5	1
CDA6	1
CDA7	1
CDA8	1
CDA9	1
CDAA	1
CDAB	1
CDAC	1
CDAD	1
CDAE	1
CDAF	1
CDB0	1
CDB1	1
CDB2	1
CDB3	1
CDB4	1
CDB5	1
CDB6	1
CDB7	1
CDB8	1
CDB9	1
CDBA	1
CDBB	1
CDBC	1
CDBD	1
CDBE	1
CDBF	1
CE80	1
CE81	1
CE82	1
CE83	1
CE84	1
CE85	1
CE87	1
CE8B	1
CE8D	1
CE86	1
CE91	1
CEAC	1
CEB1	1
CE92	1
CEB2	1
CF90	1
CE93	1
CEB3	1
CE94	1
CEB4	1
CE88	1
CE95	1
CEAD	1
CEB5	1
CE96	1
CEB6	1
CE89	1
CE97	1
CEAE	1
CEB7	1
CE98	1
CEB8	1
CF91	1
CD85	1
CE8A	1
CE90	1
CE99	1
CEAA	1
CEAF	1
CEB9	1
CF8A	1
CE9A	1
CEBA	1
CFB0	1
CE9B	1
CEBB	1
C2B5	1
CE9C	1
CEBC	1
CE9D	1
CEBD	1
CE9E	1
CEBE	1
CE8C	1
CE9F	1
CEBF	1
CF8C	1
CEA0	1
CF80	1
CF96	1
CEA1	1
CF81	1
CFB1	1
CEA2	1
CEA3	1
CF82	1
CF83	1
CFB2	1
CEA4	1
CF84	1
CE8E	1
CEA5	1
CEAB	1
CEB0	1
CF85	1
CF8B	1
CF8D	1
CEA6	1
CF86	1
CF95	1
CEA7	1
CF87	1
CEA8	1
CF88	1
CE8F	1
CEA9	1
CF89	1
CF8E	1
CF8F	1
CF92	1
CF93	1
CF94	1
CF97	1
CF98	1
CF99	1
CF9A	1
CF9B	1
CF9C	1
CF9D	1
CF9E	1
CF9F	1
CFA0	1
CFA1	1
CFA2	1
CFA3	1
CFA4	1
CFA5	1
CFA6	1
CFA7	1
CFA8	1
CFA9	1
CFAA	1
CFAB	1
CFAC	1
CFAD	1
CFAE	1
CFAF	1
CFB3	1
CFB4	1
CFB5	1
CFB6	1
CFB7	1
CFB8	1
CFB9	1
CFBA	1
CFBB	1
CFBC	1
CFBD	1
CFBE	1
CFBF	1
D082	1
D192	1
D084	1
D194	1
D085	1
D195	1
D086	1
D087	1
D196	1
D197	1
D088	1
D198	1
D089	1
D199	1
D08A	1
D19A	1
D08B	1
D19B	1
D08F	1
D19F	1
D090	1
D0B0	1
D390	1
D391	1
D392	1
D393	1
D091	1
D0B1	1
D092	1
D0B2	1
D083	1
D093	1
D0B3	1
D193	1
D094	1
D0B4	1
D080	1
D081	1
D095	1
D0B5	1
D190	1
D191	1
D396	1
D397	1
D096	1
D0B6	1
D381	1
D382	1
D39C	1
D39D	1
D097	1
D0B7	1
D39E	1
D39F	1
D08D	1
D098	1
D0B8	1
D19D	1
D3A2	1
D3A3	1
D3A4	1
D3A5	1
D099	1
D0B9	1
D08C	1
D09A	1
D0BA	1
D19C	1
D09B	1
D0BB	1
D09C	1
D0BC	1
D09D	1
D0BD	1
D09E	1
D0BE	1
D3A6	1
D3A7	1
D09F	1
D0BF	1
D0A0	1
D180	1
D0A1	1
D181	1
D0A2	1
D182	1
D08E	1
D0A3	1
D183	1
D19E	1
D3AE	1
D3AF	1
D3B0	1
D3B1	1
D3B2	1
D3B3	1
D0A4	1
D184	1
D0A5	1
D185	1
D0A6	1
D186	1
D0A7	1
D187	1
D3B4	1
D3B5	1
D0A8	1
D188	1
D0A9	1
D189	1
D0AA	1
D18A	1
D0AB	1
D18B	1
D3B8	1
D3B9	1
D0AC	1
D18C	1
D0AD	1
D18D	1
D3AC	1
D3AD	1
D0AE	1
D18E	1
D0AF	1
D18F	1
D1A0	1
D1A1	1
D1A2	1
D1A3	1
D1A4	1
D1A5	1
D1A6	1
D1A7	1
D1A8	1
D1A9	1
D1AA	1
D1AB	1
D1AC	1
D1AD	1
D1AE	1
D1AF	1
D1B0	1
D1B1	1
D1B2	1
D1B3	1
D1B4	1
D1B5	1
D1B6	1
D1B7	1
D1B8	1
D1B9	1
D1BA	1
D1BB	1
D1BC	1
D1BD	1
D1BE	1
D1BF	1
D280	1
D281	1
D282	1
D283	1
D284	1
D285	1
D286	1
D287	1
D288	1
D289	1
D28A	1
D28B	1
D28C	1
D28D	1
D28E	1
D28F	1
D290	1
D291	1
D292	1
D293	1
D294	1
D295	1
D296	1
D297	1
D298	1
D299	1
D29A	1
D29B	1
D29C	1
D29D	1
D29E	1
D29F	1
D2A0	1
D2A1	1
D2A2	1
D2A3	1
D2A4	1
D2A5	1
D2A6	1
D2A7	1
D2A8	1
D2A9	1
D2AA	1
D2AB	1
D2AC	1
D2AD	1
D2AE	1
D2AF	1
D2B0	1
D2B1	1
D2B2	1
D2B3	1
D2B4	1
D2B5	1
D2B6	1
D2B7	1
D2B8	1
D2B9	1
D2BA	1
D2BB	1
D2BC	1
D2BD	1
D2BE	1
D2BF	1
D380	1
D383	1
D384	1
D385	1
D386	1
D387	1
D388	1
D389	1
D38A	1
D38B	1
D38C	1
D38D	1
D38E	1
D38F	1
D394	1
D395	1
D398	1
D399	1
D39A	1
D39B	1
D3A0	1
D3A1	1
D3A8	1
D3A9	1
D3AA	1
D3AB	1
D3B6	1
D3B7	1
D3BA	1
D3BB	1
D3BC	1
D3BD	1
D3BE	1
D3BF	1
D480	1
D481	1
D482	1
D483	1
D484	1
D485	1
D486	1
D487	1
D488	1
D489	1
D48A	1
D48B	1
D48C	1
D48D	1
D48E	1
D48F	1
D490	1
D491	1
D492	1
D493	1
D494	1
D495	1
D496	1
D497	1
D498	1
D499	1
D49A	1
D49B	1
D49C	1
D49D	1
D49E	1
D49F	1
D4A0	1
D4A1	1
D4A2	1
D4A3	1
D4A4	1
D4A5	1
D4A6	1
D4A7	1
D4A8	1
D4A9	1
D4AA	1
D4AB	1
D4AC	1
D4AD	1
D4AE	1
D4AF	1
D4B0	1
D4B1	1
D5A1	1
D4B2	1
D5A2	1
D4B3	1
D5A3	1
D4B4	1
D5A4	1
D4B5	1
D5A5	1
D4B6	1
D5A6	1
D4B7	1
D5A7	1
D4B8	1
D5A8	1
D4B9	1
D5A9	1
D4BA	1
D5AA	1
D4BB	1
D5AB	1
D4BC	1
D5AC	1
D4BD	1
D5AD	1
D4BE	1
D5AE	1
D4BF	1
D5AF	1
D580	1
D5B0	1
D581	1
D5B1	1
D582	1
D5B2	1
D583	1
D5B3	1
D584	1
D5B4	1
D585	1
D5B5	1
D586	1
D5B6	1
D587	1
D5B7	1
D588	1
D5B8	1
D589	1
D5B9	1
D58A	1
D5BA	1
D58B	1
D5BB	1
D58C	1
D5BC	1
D58D	1
D5BD	1
D58E	1
D5BE	1
D58F	1
D5BF	1
D590	1
D680	1
D591	1
D681	1
D592	1
D682	1
D593	1
D683	1
D594	1
D684	1
D595	1
D685	1
D596	1
D686	1
D597	1
D598	1
D599	1
D59A	1
D59B	1
D59C	1
D59D	1
D59E	1
D59F	1
D5A0	1
D687	1
D688	1
D689	1
D68A	1
D68B	1
D68C	1
D68D	1
D68E	1
D68F	1
D690	1
D691	1
D692	1
D693	1
D694	1
D695	1
D696	1
D697	1
D698	1
D699	1
D69A	1
D69B	1
D69C	1
D69D	1
D69E	1
D69F	1
D6A0	1
D6A1	1
D6A2	1
D6A3	1
D6A4	1
D6A5	1
D6A6	1
D6A7	1
D6A8	1
D6A9	1
D6AA	1
D6AB	1
D6AC	1
D6AD	1
D6AE	1
D6AF	1
D6B0	1
D6B1	1
D6B2	1
D6B3	1
D6B4	1
D6B5	1
D6B6	1
D6B7	1
D6B8	1
D6B9	1
D6BA	1
D6BB	1
D6BC	1
D6BD	1
D6BE	1
D6BF	1
D780	1
D781	1
D782	1
D783	1
D784	1
D785	1
D786	1
D787	1
D788	1
D789	1
D78A	1
D78B	1
D78C	1
D78D	1
D78E	1
D78F	1
D790	1
D791	1
D792	1
D793	1
D794	1
D795	1
D796	1
D797	1
D798	1
D799	1
D79A	1
D79B	1
D79C	1
D79D	1
D79E	1
D79F	1
D7A0	1
D7A1	1
D7A2	1
D7A3	1
D7A4	1
D7A5	1
D7A6	1
D7A7	1
D7A8	1
D7A9	1
D7AA	1
D7AB	1
D7AC	1
D7AD	1
D7AE	1
D7AF	1
D7B0	1
D7B1	1
D7B2	1
D7B3	1
D7B4	1
D7B5	1
D7B6	1
D7B7	1
D7B8	1
D7B9	1
D7BA	1
D7BB	1
D7BC	1
D7BD	1
D7BE	1
D7BF	1
D880	1
D881	1
D882	1
D883	1
D884	1
D885	1
D886	1
D887	1
D888	1
D889	1
D88A	1
D88B	1
D88C	1
D88D	1
D88E	1
D88F	1
D890	1
D891	1
D892	1
D893	1
D894	1
D895	1
D896	1
D897	1
D898	1
D899	1
D89A	1
D89B	1
D89C	1
D89D	1
D89E	1
D89F	1
D8A0	1
D8A1	1
D8A2	1
D8A3	1
D8A4	1
D8A5	1
D8A6	1
D8A7	1
D8A8	1
D8A9	1
D8AA	1
D8AB	1
D8AC	1
D8AD	1
D8AE	1
D8AF	1
D8B0	1
D8B1	1
D8B2	1
D8B3	1
D8B4	1
D8B5	1
D8B6	1
D8B7	1
D8B8	1
D8B9	1
D8BA	1
D8BB	1
D8BC	1
D8BD	1
D8BE	1
D8BF	1
D980	1
D981	1
D982	1
D983	1
D984	1
D985	1
D986	1
D987	1
D988	1
D989	1
D98A	1
D98B	1
D98C	1
D98D	1
D98E	1
D98F	1
D990	1
D991	1
D992	1
D993	1
D994	1
D995	1
D996	1
D997	1
D998	1
D999	1
D99A	1
D99B	1
D99C	1
D99D	1
D99E	1
D99F	1
D9A0	1
D9A1	1
D9A2	1
D9A3	1
D9A4	1
D9A5	1
D9A6	1
D9A7	1
D9A8	1
D9A9	1
D9AA	1
D9AB	1
D9AC	1
D9AD	1
D9AE	1
D9AF	1
D9B0	1
D9B1	1
D9B2	1
D9B3	1
D9B4	1
D9B5	1
D9B6	1
D9B7	1
D9B8	1
D9B9	1
D9BA	1
D9BB	1
D9BC	1
D9BD	1
D9BE	1
D9BF	1
DA80	1
DA81	1
DA82	1
DA83	1
DA84	1
DA85	1
DA86	1
DA87	1
DA88	1
DA89	1
DA8A	1
DA8B	1
DA8C	1
DA8D	1
DA8E	1
DA8F	1
DA90	1
DA91	1
DA92	1
DA93	1
DA94	1
DA95	1
DA96	1
DA97	1
DA98	1
DA99	1
DA9A	1
DA9B	1
DA9C	1
DA9D	1
DA9E	1
DA9F	1
DAA0	1
DAA1	1
DAA2	1
DAA3	1
DAA4	1
DAA5	1
DAA6	1
DAA7	1
DAA8	1
DAA9	1
DAAA	1
DAAB	1
DAAC	1
DAAD	1
DAAE	1
DAAF	1
DAB0	1
DAB1	1
DAB2	1
DAB3	1
DAB4	1
DAB5	1
DAB6	1
DAB7	1
DAB8	1
DAB9	1
DABA	1
DABB	1
DABC	1
DABD	1
DABE	1
DABF	1
DB80	1
DB81	1
DB82	1
DB83	1
DB84	1
DB85	1
DB86	1
DB87	1
DB88	1
DB89	1
DB8A	1
DB8B	1
DB8C	1
DB8D	1
DB8E	1
DB8F	1
DB90	1
DB91	1
DB92	1
DB93	1
DB94	1
DB95	1
DB96	1
DB97	1
DB98	1
DB99	1
DB9A	1
DB9B	1
DB9C	1
DB9D	1
DB9E	1
DB9F	1
DBA0	1
DBA1	1
DBA2	1
DBA3	1
DBA4	1
DBA5	1
DBA6	1
DBA7	1
DBA8	1
DBA9	1
DBAA	1
DBAB	1
DBAC	1
DBAD	1
DBAE	1
DBAF	1
DBB0	1
DBB1	1
DBB2	1
DBB3	1
DBB4	1
DBB5	1
DBB6	1
DBB7	1
DBB8	1
DBB9	1
DBBA	1
DBBB	1
DBBC	1
DBBD	1
DBBE	1
DBBF	1
DC80	1
DC81	1
DC82	1
DC83	1
DC84	1
DC85	1
DC86	1
DC87	1
DC88	1
DC89	1
DC8A	1
DC8B	1
DC8C	1
DC8D	1
DC8E	1
DC8F	1
DC90	1
DC91	1
DC92	1
DC93	1
DC94	1
DC95	1
DC96	1
DC97	1
DC98	1
DC99	1
DC9A	1
DC9B	1
DC9C	1
DC9D	1
DC9E	1
DC9F	1
DCA0	1
DCA1	1
DCA2	1
DCA3	1
DCA4	1
DCA5	1
DCA6	1
DCA7	1
DCA8	1
DCA9	1
DCAA	1
DCAB	1
DCAC	1
DCAD	1
DCAE	1
DCAF	1
DCB0	1
DCB1	1
DCB2	1
DCB3	1
DCB4	1
DCB5	1
DCB6	1
DCB7	1
DCB8	1
DCB9	1
DCBA	1
DCBB	1
DCBC	1
DCBD	1
DCBE	1
DCBF	1
DD80	1
DD81	1
DD82	1
DD83	1
DD84	1
DD85	1
DD86	1
DD87	1
DD88	1
DD89	1
DD8A	1
DD8B	1
DD8C	1
DD8D	1
DD8E	1
DD8F	1
DD90	1
DD91	1
DD92	1
DD93	1
DD94	1
DD95	1
DD96	1
DD97	1
DD98	1
DD99	1
DD9A	1
DD9B	1
DD9C	1
DD9D	1
DD9E	1
DD9F	1
DDA0	1
DDA1	1
DDA2	1
DDA3	1
DDA4	1
DDA5	1
DDA6	1
DDA7	1
DDA8	1
DDA9	1
DDAA	1
DDAB	1
DDAC	1
DDAD	1
DDAE	1
DDAF	1
DDB0	1
DDB1	1
DDB2	1
DDB3	1
DDB4	1
DDB5	1
DDB6	1
DDB7	1
DDB8	1
DDB9	1
DDBA	1
DDBB	1
DDBC	1
DDBD	1
DDBE	1
DDBF	1
DE80	1
DE81	1
DE82	1
DE83	1
DE84	1
DE85	1
DE86	1
DE87	1
DE88	1
DE89	1
DE8A	1
DE8B	1
DE8C	1
DE8D	1
DE8E	1
DE8F	1
DE90	1
DE91	1
DE92	1
DE93	1
DE94	1
DE95	1
DE96	1
DE97	1
DE98	1
DE99	1
DE9A	1
DE9B	1
DE9C	1
DE9D	1
DE9E	1
DE9F	1
DEA0	1
DEA1	1
DEA2	1
DEA3	1
DEA4	1
DEA5	1
DEA6	1
DEA7	1
DEA8	1
DEA9	1
DEAA	1
DEAB	1
DEAC	1
DEAD	1
DEAE	1
DEAF	1
DEB0	1
DEB1	1
DEB2	1
DEB3	1
DEB4	1
DEB5	1
DEB6	1
DEB7	1
DEB8	1
DEB9	1
DEBA	1
DEBB	1
DEBC	1
DEBD	1
DEBE	1
DEBF	1
DF80	1
DF81	1
DF82	1
DF83	1
DF84	1
DF85	1
DF86	1
DF87	1
DF88	1
DF89	1
DF8A	1
DF8B	1
DF8C	1
DF8D	1
DF8E	1
DF8F	1
DF90	1
DF91	1
DF92	1
DF93	1
DF94	1
DF95	1
DF96	1
DF97	1
DF98	1
DF99	1
DF9A	1
DF9B	1
DF9C	1
DF9D	1
DF9E	1
DF9F	1
DFA0	1
DFA1	1
DFA2	1
DFA3	1
DFA4	1
DFA5	1
DFA6	1
DFA7	1
DFA8	1
DFA9	1
DFAA	1
DFAB	1
DFAC	1
DFAD	1
DFAE	1
DFAF	1
DFB0	1
DFB1	1
DFB2	1
DFB3	1
DFB4	1
DFB5	1
DFB6	1
DFB7	1
DFB8	1
DFB9	1
DFBA	1
DFBB	1
DFBC	1
DFBD	1
DFBE	1
DFBF	1
E4B880	1
E4B881	1
E4B882	1
E4B883	1
E4B884	1
E4B885	1
E4B886	1
E4B887	1
E4B888	1
E4B889	1
E4B88A	1
E4B88B	1
E4B88C	1
E4B88D	1
E4B88E	1
E4B88F	1
E4B890	1
E4B891	1
E4B892	1
E4B893	1
E4B894	1
E4B895	1
E4B896	1
E4B897	1
E4B898	1
E4B899	1
E4B89A	1
E4B89B	1
E4B89C	1
E4B89D	1
E4B89E	1
E4B89F	1
E4B8A0	1
E4B8A1	1
E4B8A2	1
E4B8A3	1
E4B8A4	1
E4B8A5	1
E4B8A6	1
E4B8A7	1
E4B8A8	1
E4B8A9	1
E4B8AA	1
E4B8AB	1
E4B8AC	1
E4B8AD	1
E4B8AE	1
E4B8AF	1
E4B8B0	1
E4B8B1	1
E4B8B2	1
E4B8B3	1
E4B8B4	1
E4B8B5	1
E4B8B6	1
E4B8B7	1
E4B8B8	1
E4B8B9	1
E4B8BA	1
E4B8BB	1
E4B8BC	1
E4B8BD	1
E4B8BE	1
E4B8BF	1
E4B980	1
E4B981	1
E4B982	1
E4B983	1
E4B984	1
E4B985	1
E4B986	1
E4B987	1
E4B988	1
E4B989	1
E4B98A	1
E4B98B	1
E4B98C	1
E4B98D	1
E4B98E	1
E4B98F	1
E4B990	1
E4B991	1
E4B992	1
E4B993	1
E4B994	1
E4B995	1
E4B996	1
E4B997	1
E4B998	1
E4B999	1
E4B99A	1
E4B99B	1
E4B99C	1
E4B99D	1
E4B99E	1
E4B99F	1
E4B9A0	1
E4B9A1	1
E4B9A2	1
E4B9A3	1
E4B9A4	1
E4B9A5	1
E4B9A6	1
E4B9A7	1
E4B9A8	1
E4B9A9	1
E4B9AA	1
E4B9AB	1
E4B9AC	1
E4B9AD	1
E4B9AE	1
E4B9AF	1
E4B9B0	1
E4B9B1	1
E4B9B2	1
E4B9B3	1
E4B9B4	1
E4B9B5	1
E4B9B6	1
E4B9B7	1
E4B9B8	1
E4B9B9	1
E4B9BA	1
E4B9BB	1
E4B9BC	1
E4B9BD	1
E4B9BE	1
E4B9BF	1
E4BA80	1
E4BA81	1
E4BA82	1
E4BA83	1
E4BA84	1
E4BA85	1
E4BA86	1
E4BA87	1
E4BA88	1
E4BA89	1
E4BA8A	1
E4BA8B	1
E4BA8C	1
E4BA8D	1
E4BA8E	1
E4BA8F	1
E4BA90	1
E4BA91	1
E4BA92	1
E4BA93	1
E4BA94	1
E4BA95	1
E4BA96	1
E4BA97	1
E4BA98	1
E4BA99	1
E4BA9A	1
E4BA9B	1
E4BA9C	1
E4BA9D	1
E4BA9E	1
E4BA9F	1
E4BAA0	1
E4BAA1	1
E4BAA2	1
E4BAA3	1
E4BAA4	1
E4BAA5	1
E4BAA6	1
E4BAA7	1
E4BAA8	1
E4BAA9	1
E4BAAA	1
E4BAAB	1
E4BAAC	1
E4BAAD	1
E4BAAE	1
E4BAAF	1
E4BAB0	1
E4BAB1	1
E4BAB2	1
E4BAB3	1
E4BAB4	1
E4BAB5	1
E4BAB6	1
E4BAB7	1
E4BAB8	1
E4BAB9	1
E4BABA	1
E4BABB	1
E4BABC	1
E4BABD	1
E4BABE	1
E4BABF	1
E4BB80	1
E4BB81	1
E4BB82	1
E4BB83	1
E4BB84	1
E4BB85	1
E4BB86	1
E4BB87	1
E4BB88	1
E4BB89	1
E4BB8A	1
E4BB8B	1
E4BB8C	1
E4BB8D	1
E4BB8E	1
E4BB8F	1
E4BB90	1
E4BB91	1
E4BB92	1
E4BB93	1
E4BB94	1
E4BB95	1
E4BB96	1
E4BB97	1
E4BB98	1
E4BB99	1
E4BB9A	1
E4BB9B	1
E4BB9C	1
E4BB9D	1
E4BB9E	1
E4BB9F	1
E4BBA0	1
E4BBA1	1
E4BBA2	1
E4BBA3	1
E4BBA4	1
E4BBA5	1
E4BBA6	1
E4BBA7	1
E4BBA8	1
E4BBA9	1
E4BBAA	1
E4BBAB	1
E4BBAC	1
E4BBAD	1
E4BBAE	1
E4BBAF	1
E4BBB0	1
E4BBB1	1
E4BBB2	1
E4BBB3	1
E4BBB4	1
E4BBB5	1
E4BBB6	1
E4BBB7	1
E4BBB8	1
E4BBB9	1
E4BBBA	1
E4BBBB	1
E4BBBC	1
E4BBBD	1
E4BBBE	1
E4BBBF	1
E4BC80	1
E4BC81	1
E4BC82	1
E4BC83	1
E4BC84	1
E4BC85	1
E4BC86	1
E4BC87	1
E4BC88	1
E4BC89	1
E4BC8A	1
E4BC8B	1
E4BC8C	1
E4BC8D	1
E4BC8E	1
E4BC8F	1
E4BC90	1
E4BC91	1
E4BC92	1
E4BC93	1
E4BC94	1
E4BC95	1
E4BC96	1
E4BC97	1
E4BC98	1
E4BC99	1
E4BC9A	1
E4BC9B	1
E4BC9C	1
E4BC9D	1
E4BC9E	1
E4BC9F	1
E4BCA0	1
E4BCA1	1
E4BCA2	1
E4BCA3	1
E4BCA4	1
E4BCA5	1
E4BCA6	1
E4BCA7	1
E4BCA8	1
E4BCA9	1
E4BCAA	1
E4BCAB	1
E4BCAC	1
E4BCAD	1
E4BCAE	1
E4BCAF	1
E4BCB0	1
E4BCB1	1
E4BCB2	1
E4BCB3	1
E4BCB4	1
E4BCB5	1
E4BCB6	1
E4BCB7	1
E4BCB8	1
E4BCB9	1
E4BCBA	1
E4BCBB	1
E4BCBC	1
E4BCBD	1
E4BCBE	1
E4BCBF	1
E4BD80	1
E4BD81	1
E4BD82	1
E4BD83	1
E4BD84	1
E4BD85	1
E4BD86	1
E4BD87	1
E4BD88	1
E4BD89	1
E4BD8A	1
E4BD8B	1
E4BD8C	1
E4BD8D	1
E4BD8E	1
E4BD8F	1
E4BD90	1
E4BD91	1
E4BD92	1
E4BD93	1
E4BD94	1
E4BD95	1
E4BD96	1
E4BD97	1
E4BD98	1
E4BD99	1
E4BD9A	1
E4BD9B	1
E4BD9C	1
E4BD9D	1
E4BD9E	1
E4BD9F	1
E4BDA0	1
E4BDA1	1
E4BDA2	1
E4BDA3	1
E4BDA4	1
E4BDA5	1
E4BDA6	1
E4BDA7	1
E4BDA8	1
E4BDA9	1
E4BDAA	1
E4BDAB	1
E4BDAC	1
E4BDAD	1
E4BDAE	1
E4BDAF	1
E4BDB0	1
E4BDB1	1
E4BDB2	1
E4BDB3	1
E4BDB4	1
E4BDB5	1
E4BDB6	1
E4BDB7	1
E4BDB8	1
E4BDB9	1
E4BDBA	1
E4BDBB	1
E4BDBC	1
E4BDBD	1
E4BDBE	1
E4BDBF	1
E4BE80	1
E4BE81	1
E4BE82	1
E4BE83	1
E4BE84	1
E4BE85	1
E4BE86	1
E4BE87	1
E4BE88	1
E4BE89	1
E4BE8A	1
E4BE8B	1
E4BE8C	1
E4BE8D	1
E4BE8E	1
E4BE8F	1
E4BE90	1
E4BE91	1
E4BE92	1
E4BE93	1
E4BE94	1
E4BE95	1
E4BE96	1
E4BE97	1
E4BE98	1
E4BE99	1
E4BE9A	1
E4BE9B	1
E4BE9C	1
E4BE9D	1
E4BE9E	1
E4BE9F	1
E4BEA0	1
E4BEA1	1
E4BEA2	1
E4BEA3	1
E4BEA4	1
E4BEA5	1
E4BEA6	1
E4BEA7	1
E4BEA8	1
E4BEA9	1
E4BEAA	1
E4BEAB	1
E4BEAC	1
E4BEAD	1
E4BEAE	1
E4BEAF	1
E4BEB0	1
E4BEB1	1
E4BEB2	1
E4BEB3	1
E4BEB4	1
E4BEB5	1
E4BEB6	1
E4BEB7	1
E4BEB8	1
E4BEB9	1
E4BEBA	1
E4BEBB	1
E4BEBC	1
E4BEBD	1
E4BEBE	1
E4BEBF	1
E4BF80	1
E4BF81	1
E4BF82	1
E4BF83	1
E4BF84	1
E4BF85	1
E4BF86	1
E4BF87	1
E4BF88	1
E4BF89	1
E4BF8A	1
E4BF8B	1
E4BF8C	1
E4BF8D	1
E4BF8E	1
E4BF8F	1
E4BF90	1
E4BF91	1
E4BF92	1
E4BF93	1
E4BF94	1
E4BF95	1
E4BF96	1
E4BF97	1
E4BF98	1
E4BF99	1
E4BF9A	1
E4BF9B	1
E4BF9C	1
E4BF9D	1
E4BF9E	1
E4BF9F	1
E4BFA0	1
E4BFA1	1
E4BFA2	1
E4BFA3	1
E4BFA4	1
E4BFA5	1
E4BFA6	1
E4BFA7	1
E4BFA8	1
E4BFA9	1
E4BFAA	1
E4BFAB	1
E4BFAC	1
E4BFAD	1
E4BFAE	1
E4BFAF	1
E4BFB0	1
E4BFB1	1
E4BFB2	1
E4BFB3	1
E4BFB4	1
E4BFB5	1
E4BFB6	1
E4BFB7	1
E4BFB8	1
E4BFB9	1
E4BFBA	1
E4BFBB	1
E4BFBC	1
E4BFBD	1
E4BFBE	1
E4BFBF	1
DROP TABLE IF EXISTS test.t1;
DROP TABLE IF EXISTS test.t1;
DROP DATABASE test;
CREATE DATABASE test CHARACTER SET utf8mb3;
USE test;
CREATE TABLE test.t1 (a CHAR(4) CHARACTER SET utf8mb3 COLLATE utf8mb3_hungarian_ci) ENGINE=MyISAM CHARACTER SET utf8mb3 COLLATE utf8mb3_hungarian_ci;
Warnings:
Warning	1287	'utf8mb3' is deprecated and will be removed in a future release. Please use utf8mb4 instead
Warning	3778	'utf8mb3_hungarian_ci' is a collation of the deprecated character set UTF8MB3. Please consider using UTF8MB4 with an appropriate collation instead.
Warning	1287	'utf8mb3' is deprecated and will be removed in a future release. Please use utf8mb4 instead
Warning	3778	'utf8mb3_hungarian_ci' is a collation of the deprecated character set UTF8MB3. Please consider using UTF8MB4 with an appropriate collation instead.
SHOW TABLE STATUS LIKE 't1';
Name	Engine	Version	Row_format	Rows	Avg_row_length	Data_length	Max_data_length	Index_length	Data_free	Auto_increment	Create_time	Update_time	Check_time	Collation	Checksum	Create_options	Comment
t1	MyISAM	#	#	#	#	#	#	#	#	#	#	#	#	utf8mb3_hungarian_ci	#	#	#
LOAD DATA INFILE 
'MYSQL_TEST_DIR/suite/funcs_2/data/charset_utf8.txt' INTO TABLE test.t1;
DELETE FROM test.t1 WHERE CHAR_LENGTH(a) <> 1;
SELECT HEX(ORD(a)) AS a_ord, CHAR_LENGTH(a) AS a_len FROM test.t1 ORDER BY a, ORD(a);
a_ord	a_len
C285	1
7F	1
C280	1
C281	1
C282	1
C283	1
C284	1
C286	1
C287	1
C288	1
C289	1
C28A	1
C28B	1
C28C	1
C28D	1
C28E	1
C28F	1
C290	1
C291	1
C292	1
C293	1
C294	1
C295	1
C296	1
C297	1
C298	1
C299	1
C29A	1
C29B	1
C29C	1
C29D	1
C29E	1
C29F	1
C2A0	1
CC80	1
CC81	1
CC82	1
CC83	1
CC84	1
CC85	1
CC86	1
CC87	1
CC88	1
CC89	1
CC8A	1
CC8B	1
CC8C	1
CC8D	1
CC8E	1
CC8F	1
CC90	1
CC91	1
CC92	1
CC93	1
CC94	1
CC95	1
CC96	1
CC97	1
CC98	1
CC99	1
CC9A	1
CC9B	1
CC9C	1
CC9D	1
CC9E	1
CC9F	1
CCA0	1
CCA1	1
CCA2	1
CCA3	1
CCA4	1
CCA5	1
CCA6	1
CCA7	1
CCA8	1
CCA9	1
CCAA	1
CCAB	1
CCAC	1
CCAD	1
CCAE	1
CCAF	1
CCB0	1
CCB1	1
CCB2	1
CCB3	1
CCB4	1
CCB5	1
CCB6	1
CCB7	1
CCB8	1
CCB9	1
CCBA	1
CCBB	1
CCBC	1
CCBD	1
CCBE	1
CCBF	1
CD80	1
CD81	1
CD82	1
CD83	1
CD84	1
CD85	1
CD86	1
CD87	1
CD88	1
CD89	1
CD8A	1
CD8B	1
CD8C	1
CD8D	1
CD8E	1
CD8F	1
CD90	1
CD91	1
CD92	1
CD93	1
CD94	1
CD95	1
CD96	1
CD97	1
CD9D	1
CD9E	1
CD9F	1
CDA0	1
CDA1	1
CDA2	1
D283	1
D284	1
D285	1
D286	1
D288	1
D289	1
D691	1
D692	1
D693	1
D694	1
D695	1
D696	1
D697	1
D698	1
D699	1
D69A	1
D69B	1
D69C	1
D69D	1
D69E	1
D69F	1
D6A0	1
D6A1	1
D6A3	1
D6A4	1
D6A5	1
D6A6	1
D6A7	1
D6A8	1
D6A9	1
D6AA	1
D6AB	1
D6AC	1
D6AD	1
D6AE	1
D6AF	1
D6B0	1
D6B1	1
D6B2	1
D6B3	1
D6B4	1
D6B5	1
D6B6	1
D6B7	1
D6B8	1
D6B9	1
D6BB	1
D6BC	1
D6BD	1
D6BF	1
D781	1
D782	1
D784	1
D880	1
D881	1
D882	1
D883	1
D890	1
D891	1
D892	1
D893	1
D894	1
D895	1
D98B	1
D98C	1
D98D	1
D98E	1
D98F	1
D990	1
D991	1
D992	1
D993	1
D994	1
D995	1
D996	1
D997	1
D998	1
D9B0	1
DB96	1
DB97	1
DB98	1
DB99	1
DB9A	1
DB9B	1
DB9C	1
DB9D	1
DB9E	1
DB9F	1
DBA0	1
DBA1	1
DBA2	1
DBA3	1
DBA4	1
DBA7	1
DBA8	1
DBAA	1
DBAB	1
DBAC	1
DBAD	1
DC8F	1
DC91	1
DCB0	1
DCB1	1
DCB2	1
DCB3	1
DCB4	1
DCB5	1
DCB6	1
DCB7	1
DCB8	1
DCB9	1
DCBA	1
DCBB	1
DCBC	1
DCBD	1
DCBE	1
DCBF	1
DD80	1
DD81	1
DD82	1
DD83	1
DD84	1
DD85	1
DD86	1
DD87	1
DD88	1
DD89	1
DD8A	1
D980	1
60	1
C2B4	1
CE84	1
CB9C	1
5E	1
C2AF	1
CB98	1
CB99	1
C2A8	1
CE85	1
CB9A	1
CB9D	1
C2B8	1
CB9B	1
5F	1
C2AD	1
2D	1
D68A	1
2C	1
D59D	1
D88C	1
D88D	1
D9AB	1
D9AC	1
3B	1
CDBE	1
D89B	1
3A	1
D689	1
DC83	1
DC84	1
DC85	1
DC86	1
DC87	1
DC88	1
21	1
C2A1	1
D59C	1
3F	1
C2BF	1
D59E	1
D89F	1
DC89	1
2E	1
DB94	1
DC81	1
DC82	1
C2B7	1
CE87	1
DC80	1
27	1
22	1
C2AB	1
C2BB	1
28	1
29	1
5B	1
7B	1
7D	1
C2A7	1
C2B6	1
C2A9	1
C2AE	1
40	1
2A	1
D9AD	1
2F	1
26	1
23	1
25	1
D9AA	1
D59A	1
D59B	1
D59F	1
D6BE	1
D780	1
D783	1
D7B3	1
D7B4	1
DC8A	1
DC8B	1
DC8C	1
DC8D	1
CAB9	1
CDB4	1
CDB5	1
CABA	1
CB82	1
CB83	1
CB84	1
CB85	1
CB86	1
CB87	1
CB88	1
CB89	1
CB8A	1
CB8B	1
CB8C	1
CB8D	1
CB8E	1
CB8F	1
CB92	1
CB93	1
CB94	1
CB95	1
CB96	1
CB97	1
CB9E	1
CB9F	1
CBA5	1
CBA6	1
CBA7	1
CBA8	1
CBA9	1
CBAA	1
CBAB	1
CBAC	1
CBAD	1
CBAF	1
CBB0	1
CBB1	1
CBB2	1
CBB3	1
CBB4	1
CBB5	1
CBB6	1
CBB7	1
CBB8	1
CBB9	1
CBBA	1
CBBB	1
CBBC	1
CBBD	1
CBBE	1
CBBF	1
C2B0	1
D282	1
D88E	1
D88F	1
DBA9	1
CFB6	1
2B	1
C2B1	1
C3B7	1
C397	1
3C	1
3D	1
3E	1
C2AC	1
7C	1
C2A6	1
7E	1
CB90	1
CB91	1
C2A4	1
C2A2	1
24	1
C2A3	1
C2A5	1
30	1
D9A0	1
DBB0	1
31	1
C2B9	1
D9A1	1
DBB1	1
C2BD	1
C2BC	1
32	1
C2B2	1
D9A2	1
DBB2	1
33	1
C2B3	1
D9A3	1
DBB3	1
C2BE	1
34	1
D9A4	1
DBB4	1
35	1
D9A5	1
DBB5	1
36	1
D9A6	1
DBB6	1
37	1
D9A7	1
DBB7	1
38	1
D9A8	1
DBB8	1
39	1
D9A9	1
DBB9	1
41	1
61	1
C2AA	1
C380	1
C381	1
C382	1
C383	1
C384	1
C385	1
C3A0	1
C3A1	1
C3A2	1
C3A3	1
C3A4	1
C3A5	1
C480	1
C481	1
C482	1
C483	1
C484	1
C485	1
C78D	1
C78E	1
C79E	1
C79F	1
C7A0	1
C7A1	1
C7BA	1
C7BB	1
C880	1
C881	1
C882	1
C883	1
C8A6	1
C8A7	1
CDA3	1
C386	1
C3A6	1
C7A2	1
C7A3	1
C7BC	1
C7BD	1
C990	1
C991	1
C992	1
42	1
62	1
CA99	1
C680	1
C681	1
C993	1
C682	1
C683	1
43	1
63	1
C387	1
C3A7	1
C486	1
C487	1
C488	1
C489	1
C48A	1
C48B	1
C48C	1
C48D	1
CDA8	1
C687	1
C688	1
C995	1
44	1
64	1
C48E	1
C48F	1
CDA9	1
C784	1
C785	1
C786	1
C7B1	1
C7B2	1
C7B3	1
CAA3	1
CAA5	1
CAA4	1
C490	1
C491	1
C689	1
C996	1
C68A	1
C997	1
C68B	1
C68C	1
C8A1	1
C390	1
C3B0	1
45	1
65	1
C388	1
C389	1
C38A	1
C38B	1
C3A8	1
C3A9	1
C3AA	1
C3AB	1
C492	1
C493	1
C494	1
C495	1
C496	1
C497	1
C498	1
C499	1
C49A	1
C49B	1
C884	1
C885	1
C886	1
C887	1
C8A8	1
C8A9	1
CDA4	1
C68E	1
C79D	1
C68F	1
C999	1
C690	1
C99B	1
C998	1
C99A	1
C99C	1
C99D	1
C99E	1
CA9A	1
C9A4	1
46	1
66	1
CAA9	1
C691	1
C692	1
47	1
67	1
C49C	1
C49D	1
C49E	1
C49F	1
C4A0	1
C4A1	1
C4A2	1
C4A3	1
C7A6	1
C7A7	1
C7B4	1
C7B5	1
C9A1	1
C9A2	1
C7A4	1
C7A5	1
C693	1
C9A0	1
CA9B	1
C694	1
C9A3	1
CBA0	1
C6A2	1
C6A3	1
48	1
68	1
C4A4	1
C4A5	1
C89E	1
C89F	1
CAB0	1
CDAA	1
CA9C	1
C695	1
C7B6	1
C4A6	1
C4A7	1
C9A6	1
CAB1	1
C9A7	1
CABB	1
CABD	1
49	1
69	1
C38C	1
C38D	1
C38E	1
C38F	1
C3AC	1
C3AD	1
C3AE	1
C3AF	1
C4A8	1
C4A9	1
C4AA	1
C4AB	1
C4AC	1
C4AD	1
C4AE	1
C4AF	1
C4B0	1
C78F	1
C790	1
C888	1
C889	1
C88A	1
C88B	1
CDA5	1
C4B2	1
C4B3	1
C4B1	1
C9AA	1
C697	1
C9A8	1
C696	1
C9A9	1
4A	1
6A	1
C4B4	1
C4B5	1
C7B0	1
CAB2	1
CA9D	1
C99F	1
CA84	1
4B	1
6B	1
C4B6	1
C4B7	1
C7A8	1
C7A9	1
C698	1
C699	1
CA9E	1
4C	1
6C	1
C4B9	1
C4BA	1
C4BB	1
C4BC	1
C4BD	1
C4BE	1
CBA1	1
C4BF	1
C580	1
C787	1
C788	1
C789	1
CAAA	1
CAAB	1
CA9F	1
C581	1
C582	1
C69A	1
C9AB	1
C9AC	1
C9AD	1
C8B4	1
C9AE	1
C69B	1
CA8E	1
4D	1
6D	1
CDAB	1
C9B1	1
4E	1
6E	1
C391	1
C3B1	1
C583	1
C584	1
C585	1
C586	1
C587	1
C588	1
C7B8	1
C7B9	1
C78A	1
C78B	1
C78C	1
C9B4	1
C69D	1
C9B2	1
C69E	1
C8A0	1
C9B3	1
C8B5	1
C58A	1
C58B	1
4F	1
6F	1
C2BA	1
C392	1
C393	1
C394	1
C395	1
C3B2	1
C3B3	1
C3B4	1
C3B5	1
C58C	1
C58D	1
C58E	1
C58F	1
C6A0	1
C6A1	1
C791	1
C792	1
C7AA	1
C7AB	1
C7AC	1
C7AD	1
C88C	1
C88D	1
C88E	1
C88F	1
C8AA	1
C8AB	1
C8AC	1
C8AD	1
C8AE	1
C8AF	1
C8B0	1
C8B1	1
CDA6	1
C592	1
C593	1
C396	1
C3B6	1
C590	1
C591	1
C9B6	1
C398	1
C3B8	1
C7BE	1
C7BF	1
C686	1
C994	1
C69F	1
C9B5	1
C9B7	1
C8A2	1
C8A3	1
50	1
70	1
C6A4	1
C6A5	1
C9B8	1
51	1
71	1
CAA0	1
C4B8	1
52	1
72	1
C594	1
C595	1
C596	1
C597	1
C598	1
C599	1
C890	1
C891	1
C892	1
C893	1
CAB3	1
CDAC	1
C6A6	1
CA80	1
C9B9	1
CAB4	1
C9BA	1
C9BB	1
CAB5	1
C9BC	1
C9BD	1
C9BE	1
C9BF	1
CA81	1
CAB6	1
53	1
73	1
C59A	1
C59B	1
C59C	1
C59D	1
C59E	1
C59F	1
C5A0	1
C5A1	1
C5BF	1
C898	1
C899	1
CBA2	1
C39F	1
CA82	1
C6A9	1
CA83	1
C6AA	1
CA85	1
CA86	1
54	1
74	1
C5A2	1
C5A3	1
C5A4	1
C5A5	1
C89A	1
C89B	1
CDAD	1
CAA8	1
C6BE	1
CAA6	1
CAA7	1
C5A6	1
C5A7	1
C6AB	1
C6AC	1
C6AD	1
C6AE	1
CA88	1
C8B6	1
CA87	1
55	1
75	1
C399	1
C39A	1
C39B	1
C3B9	1
C3BA	1
C3BB	1
C5A8	1
C5A9	1
C5AA	1
C5AB	1
C5AC	1
C5AD	1
C5AE	1
C5AF	1
C5B2	1
C5B3	1
C6AF	1
C6B0	1
C793	1
C794	1
C795	1
C796	1
C797	1
C798	1
C799	1
C79A	1
C79B	1
C79C	1
C894	1
C895	1
C896	1
C897	1
CDA7	1
C39C	1
C3BC	1
C5B0	1
C5B1	1
CA89	1
C9A5	1
CAAE	1
CAAF	1
C69C	1
C9AF	1
C9B0	1
C6B1	1
CA8A	1
56	1
76	1
CDAE	1
C6B2	1
CA8B	1
CA8C	1
57	1
77	1
C5B4	1
C5B5	1
CAB7	1
CA8D	1
58	1
78	1
CBA3	1
CDAF	1
59	1
79	1
C39D	1
C3BD	1
C3BF	1
C5B6	1
C5B7	1
C5B8	1
C8B2	1
C8B3	1
CAB8	1
CA8F	1
C6B3	1
C6B4	1
5A	1
7A	1
C5B9	1
C5BA	1
C5BB	1
C5BC	1
C5BD	1
C5BE	1
C68D	1
C6B5	1
C6B6	1
C8A4	1
C8A5	1
CA90	1
CA91	1
C6B7	1
C7AE	1
C7AF	1
CA92	1
C6B8	1
C6B9	1
C6BA	1
CA93	1
C89C	1
C89D	1
C39E	1
C3BE	1
C6BF	1
C7B7	1
C6BB	1
C6A7	1
C6A8	1
C6BC	1
C6BD	1
C684	1
C685	1
CA94	1
CB80	1
CABC	1
C589	1
CBAE	1
CABE	1
CA95	1
CBA4	1
CABF	1
CB81	1
CAA1	1
CAA2	1
CA96	1
C780	1
C781	1
C782	1
C783	1
CA97	1
CA98	1
CAAC	1
CAAD	1
CE86	1
CE91	1
CEAC	1
CEB1	1
CE92	1
CEB2	1
CF90	1
CE93	1
CEB3	1
CE94	1
CEB4	1
CE88	1
CE95	1
CEAD	1
CEB5	1
CFB5	1
CF9C	1
CF9D	1
CF9A	1
CF9B	1
CE96	1
CEB6	1
CE89	1
CE97	1
CEAE	1
CEB7	1
CE98	1
CEB8	1
CF91	1
CFB4	1
CDBA	1
CE8A	1
CE90	1
CE99	1
CEAA	1
CEAF	1
CEB9	1
CF8A	1
CFB3	1
CE9A	1
CEBA	1
CFB0	1
CF97	1
CE9B	1
CEBB	1
C2B5	1
CE9C	1
CEBC	1
CE9D	1
CEBD	1
CE9E	1
CEBE	1
CE8C	1
CE9F	1
CEBF	1
CF8C	1
CEA0	1
CF80	1
CF96	1
CF9E	1
CF9F	1
CF98	1
CF99	1
CEA1	1
CF81	1
CFB1	1
CEA3	1
CF82	1
CF83	1
CFB2	1
CFB9	1
CEA4	1
CF84	1
CE8E	1
CEA5	1
CEAB	1
CEB0	1
CF85	1
CF8B	1
CF8D	1
CF92	1
CF93	1
CF94	1
CEA6	1
CF86	1
CF95	1
CEA7	1
CF87	1
CEA8	1
CF88	1
CE8F	1
CEA9	1
CF89	1
CF8E	1
CFA0	1
CFA1	1
CFB7	1
CFB8	1
CFBA	1
CFBB	1
CFA2	1
CFA3	1
CFA4	1
CFA5	1
CFA6	1
CFA7	1
CFA8	1
CFA9	1
CFAA	1
CFAB	1
CFAC	1
CFAD	1
CFAE	1
CFAF	1
D090	1
D0B0	1
D390	1
D391	1
D392	1
D393	1
D398	1
D399	1
D39A	1
D39B	1
D394	1
D395	1
D091	1
D0B1	1
D092	1
D0B2	1
D093	1
D0B3	1
D290	1
D291	1
D292	1
D293	1
D294	1
D295	1
D094	1
D0B4	1
D480	1
D481	1
D082	1
D192	1
D482	1
D483	1
D083	1
D193	1
D298	1
D299	1
D080	1
D081	1
D095	1
D0B5	1
D190	1
D191	1
D396	1
D397	1
D084	1
D194	1
D096	1
D0B6	1
D381	1
D382	1
D39C	1
D39D	1
D296	1
D297	1
D097	1
D0B7	1
D484	1
D485	1
D39E	1
D39F	1
D085	1
D195	1
D3A0	1
D3A1	1
D486	1
D487	1
D08D	1
D098	1
D0B8	1
D19D	1
D3A2	1
D3A3	1
D28A	1
D28B	1
D3A4	1
D3A5	1
D086	1
D196	1
D087	1
D197	1
D099	1
D0B9	1
D088	1
D198	1
D09A	1
D0BA	1
D29A	1
D29B	1
D383	1
D384	1
D2A0	1
D2A1	1
D29E	1
D29F	1
D29C	1
D29D	1
D09B	1
D0BB	1
D385	1
D386	1
D089	1
D199	1
D488	1
D489	1
D09C	1
D0BC	1
D38D	1
D38E	1
D09D	1
D0BD	1
D389	1
D38A	1
D2A2	1
D2A3	1
D387	1
D388	1
D2A4	1
D2A5	1
D08A	1
D19A	1
D48A	1
D48B	1
D09E	1
D0BE	1
D3A6	1
D3A7	1
D3A8	1
D3A9	1
D3AA	1
D3AB	1
D09F	1
D0BF	1
D2A6	1
D2A7	1
D280	1
D281	1
D0A0	1
D180	1
D28E	1
D28F	1
D0A1	1
D181	1
D48C	1
D48D	1
D2AA	1
D2AB	1
D0A2	1
D182	1
D48E	1
D48F	1
D2AC	1
D2AD	1
D08B	1
D19B	1
D08C	1
D19C	1
D0A3	1
D183	1
D3AE	1
D3AF	1
D08E	1
D19E	1
D3B0	1
D3B1	1
D3B2	1
D3B3	1
D2AE	1
D2AF	1
D2B0	1
D2B1	1
D1B8	1
D1B9	1
D0A4	1
D184	1
D0A5	1
D185	1
D2B2	1
D2B3	1
D2BA	1
D2BB	1
D1A0	1
D1A1	1
D1BE	1
D1BF	1
D1BC	1
D1BD	1
D1BA	1
D1BB	1
D0A6	1
D186	1
D2B4	1
D2B5	1
D0A7	1
D187	1
D3B4	1
D3B5	1
D2B6	1
D2B7	1
D38B	1
D38C	1
D2B8	1
D2B9	1
D2BC	1
D2BD	1
D2BE	1
D2BF	1
D08F	1
D19F	1
D0A8	1
D188	1
D0A9	1
D189	1
D0AA	1
D18A	1
D0AB	1
D18B	1
D3B8	1
D3B9	1
D0AC	1
D18C	1
D28C	1
D28D	1
D1A2	1
D1A3	1
D0AD	1
D18D	1
D3AC	1
D3AD	1
D0AE	1
D18E	1
D0AF	1
D18F	1
D1A4	1
D1A5	1
D1A6	1
D1A7	1
D1AA	1
D1AB	1
D1A8	1
D1A9	1
D1AC	1
D1AD	1
D1AE	1
D1AF	1
D1B0	1
D1B1	1
D1B2	1
D1B3	1
D1B4	1
D1B5	1
D1B6	1
D1B7	1
D2A8	1
D2A9	1
D380	1
D4B1	1
D5A1	1
D4B2	1
D5A2	1
D4B3	1
D5A3	1
D4B4	1
D5A4	1
D4B5	1
D5A5	1
D687	1
D4B6	1
D5A6	1
D4B7	1
D5A7	1
D4B8	1
D5A8	1
D4B9	1
D5A9	1
D4BA	1
D5AA	1
D4BB	1
D5AB	1
D4BC	1
D5AC	1
D4BD	1
D5AD	1
D4BE	1
D5AE	1
D4BF	1
D5AF	1
D580	1
D5B0	1
D581	1
D5B1	1
D582	1
D5B2	1
D583	1
D5B3	1
D584	1
D5B4	1
D585	1
D5B5	1
D586	1
D5B6	1
D587	1
D5B7	1
D588	1
D5B8	1
D589	1
D5B9	1
D58A	1
D5BA	1
D58B	1
D5BB	1
D58C	1
D5BC	1
D58D	1
D5BD	1
D58E	1
D5BE	1
D58F	1
D5BF	1
D590	1
D680	1
D591	1
D681	1
D592	1
D682	1
D593	1
D683	1
D594	1
D684	1
D595	1
D685	1
D596	1
D686	1
D599	1
D790	1
D791	1
D792	1
D793	1
D794	1
D795	1
D7B0	1
D7B1	1
D796	1
D797	1
D798	1
D799	1
D7B2	1
D79A	1
D79B	1
D79C	1
D79D	1
D79E	1
D79F	1
D7A0	1
D7A1	1
D7A2	1
D7A3	1
D7A4	1
D7A5	1
D7A6	1
D7A7	1
D7A8	1
D7A9	1
D7AA	1
D8A1	1
D9B4	1
DBBD	1
D8A2	1
D8A3	1
D9B2	1
D9B1	1
D8A4	1
D8A5	1
D9B3	1
D8A6	1
D8A7	1
D9B5	1
D9AE	1
D8A8	1
D9BB	1
D9BE	1
DA80	1
D8A9	1
D8AA	1
D8AB	1
D9B9	1
D9BA	1
D9BC	1
D9BD	1
D9BF	1
D8AC	1
DA83	1
DA84	1
DA86	1
DABF	1
DA87	1
D8AD	1
D8AE	1
DA81	1
DA82	1
DA85	1
D8AF	1
D8B0	1
DA88	1
DA89	1
DA8A	1
DA8B	1
DA8C	1
DA8D	1
DA8E	1
DA8F	1
DA90	1
DBAE	1
D8B1	1
D8B2	1
DA91	1
DA92	1
DA93	1
DA94	1
DA95	1
DA96	1
DA97	1
DA98	1
DA99	1
DBAF	1
D8B3	1
D8B4	1
DA9A	1
DA9B	1
DA9C	1
DBBA	1
D8B5	1
D8B6	1
DA9D	1
DA9E	1
DBBB	1
D8B7	1
D8B8	1
DA9F	1
D8B9	1
D8BA	1
DAA0	1
DBBC	1
D981	1
DAA1	1
DAA2	1
DAA3	1
DAA4	1
DAA5	1
DAA6	1
D9AF	1
D982	1
DAA7	1
DAA8	1
D983	1
DAA9	1
DAAA	1
DAAB	1
DAAC	1
DAAD	1
DAAE	1
DAAF	1
DAB0	1
DAB1	1
DAB2	1
DAB3	1
DAB4	1
D984	1
DAB5	1
DAB6	1
DAB7	1
DAB8	1
D985	1
DBBE	1
D986	1
DABA	1
DABB	1
DABC	1
DABD	1
DAB9	1
D987	1
DABE	1
DB81	1
DB82	1
DB83	1
DBBF	1
DB80	1
DB95	1
D988	1
DBA5	1
D9B6	1
DB84	1
DB85	1
DB86	1
DB87	1
D9B7	1
DB88	1
DB89	1
DB8A	1
DB8B	1
DB8F	1
D989	1
D98A	1
DBA6	1
D9B8	1
DB8C	1
DB8D	1
DB8E	1
DB90	1
DB91	1
DB92	1
DB93	1
DC90	1
DC92	1
DCAD	1
DC93	1
DC94	1
DCAE	1
DC96	1
DC95	1
DCAF	1
DC97	1
DC98	1
DC99	1
DD8D	1
DC9A	1
DC9B	1
DC9C	1
DC9D	1
DC9E	1
DC9F	1
DD8E	1
DCA0	1
DCA1	1
DCA2	1
DCA3	1
DCA4	1
DCA5	1
DCA6	1
DCA7	1
DD8F	1
DCA8	1
DCA9	1
DCAA	1
DCAB	1
DCAC	1
DE80	1
DE99	1
DE9A	1
DE81	1
DE82	1
DE83	1
DE9C	1
DE84	1
DE85	1
DE86	1
DE87	1
DEA2	1
DEA3	1
DE88	1
DEA5	1
DE89	1
DE8A	1
DE8B	1
DE9B	1
DE8C	1
DE98	1
DEA0	1
DEA1	1
DE8D	1
DE8E	1
DEA4	1
DE8F	1
DE90	1
DE9D	1
DE9E	1
DE9F	1
DE91	1
DE92	1
DE93	1
DE94	1
DE95	1
DE96	1
DE97	1
DEB1	1
DEA6	1
DEA7	1
DEA8	1
DEA9	1
DEAA	1
DEAB	1
DEAC	1
DEAD	1
DEAE	1
DEAF	1
DEB0	1
E4B880	1
E4B881	1
E4B882	1
E4B883	1
E4B884	1
E4B885	1
E4B886	1
E4B887	1
E4B888	1
E4B889	1
E4B88A	1
E4B88B	1
E4B88C	1
E4B88D	1
E4B88E	1
E4B88F	1
E4B890	1
E4B891	1
E4B892	1
E4B893	1
E4B894	1
E4B895	1
E4B896	1
E4B897	1
E4B898	1
E4B899	1
E4B89A	1
E4B89B	1
E4B89C	1
E4B89D	1
E4B89E	1
E4B89F	1
E4B8A0	1
E4B8A1	1
E4B8A2	1
E4B8A3	1
E4B8A4	1
E4B8A5	1
E4B8A6	1
E4B8A7	1
E4B8A8	1
E4B8A9	1
E4B8AA	1
E4B8AB	1
E4B8AC	1
E4B8AD	1
E4B8AE	1
E4B8AF	1
E4B8B0	1
E4B8B1	1
E4B8B2	1
E4B8B3	1
E4B8B4	1
E4B8B5	1
E4B8B6	1
E4B8B7	1
E4B8B8	1
E4B8B9	1
E4B8BA	1
E4B8BB	1
E4B8BC	1
E4B8BD	1
E4B8BE	1
E4B8BF	1
E4B980	1
E4B981	1
E4B982	1
E4B983	1
E4B984	1
E4B985	1
E4B986	1
E4B987	1
E4B988	1
E4B989	1
E4B98A	1
E4B98B	1
E4B98C	1
E4B98D	1
E4B98E	1
E4B98F	1
E4B990	1
E4B991	1
E4B992	1
E4B993	1
E4B994	1
E4B995	1
E4B996	1
E4B997	1
E4B998	1
E4B999	1
E4B99A	1
E4B99B	1
E4B99C	1
E4B99D	1
E4B99E	1
E4B99F	1
E4B9A0	1
E4B9A1	1
E4B9A2	1
E4B9A3	1
E4B9A4	1
E4B9A5	1
E4B9A6	1
E4B9A7	1
E4B9A8	1
E4B9A9	1
E4B9AA	1
E4B9AB	1
E4B9AC	1
E4B9AD	1
E4B9AE	1
E4B9AF	1
E4B9B0	1
E4B9B1	1
E4B9B2	1
E4B9B3	1
E4B9B4	1
E4B9B5	1
E4B9B6	1
E4B9B7	1
E4B9B8	1
E4B9B9	1
E4B9BA	1
E4B9BB	1
E4B9BC	1
E4B9BD	1
E4B9BE	1
E4B9BF	1
E4BA80	1
E4BA81	1
E4BA82	1
E4BA83	1
E4BA84	1
E4BA85	1
E4BA86	1
E4BA87	1
E4BA88	1
E4BA89	1
E4BA8A	1
E4BA8B	1
E4BA8C	1
E4BA8D	1
E4BA8E	1
E4BA8F	1
E4BA90	1
E4BA91	1
E4BA92	1
E4BA93	1
E4BA94	1
E4BA95	1
E4BA96	1
E4BA97	1
E4BA98	1
E4BA99	1
E4BA9A	1
E4BA9B	1
E4BA9C	1
E4BA9D	1
E4BA9E	1
E4BA9F	1
E4BAA0	1
E4BAA1	1
E4BAA2	1
E4BAA3	1
E4BAA4	1
E4BAA5	1
E4BAA6	1
E4BAA7	1
E4BAA8	1
E4BAA9	1
E4BAAA	1
E4BAAB	1
E4BAAC	1
E4BAAD	1
E4BAAE	1
E4BAAF	1
E4BAB0	1
E4BAB1	1
E4BAB2	1
E4BAB3	1
E4BAB4	1
E4BAB5	1
E4BAB6	1
E4BAB7	1
E4BAB8	1
E4BAB9	1
E4BABA	1
E4BABB	1
E4BABC	1
E4BABD	1
E4BABE	1
E4BABF	1
E4BB80	1
E4BB81	1
E4BB82	1
E4BB83	1
E4BB84	1
E4BB85	1
E4BB86	1
E4BB87	1
E4BB88	1
E4BB89	1
E4BB8A	1
E4BB8B	1
E4BB8C	1
E4BB8D	1
E4BB8E	1
E4BB8F	1
E4BB90	1
E4BB91	1
E4BB92	1
E4BB93	1
E4BB94	1
E4BB95	1
E4BB96	1
E4BB97	1
E4BB98	1
E4BB99	1
E4BB9A	1
E4BB9B	1
E4BB9C	1
E4BB9D	1
E4BB9E	1
E4BB9F	1
E4BBA0	1
E4BBA1	1
E4BBA2	1
E4BBA3	1
E4BBA4	1
E4BBA5	1
E4BBA6	1
E4BBA7	1
E4BBA8	1
E4BBA9	1
E4BBAA	1
E4BBAB	1
E4BBAC	1
E4BBAD	1
E4BBAE	1
E4BBAF	1
E4BBB0	1
E4BBB1	1
E4BBB2	1
E4BBB3	1
E4BBB4	1
E4BBB5	1
E4BBB6	1
E4BBB7	1
E4BBB8	1
E4BBB9	1
E4BBBA	1
E4BBBB	1
E4BBBC	1
E4BBBD	1
E4BBBE	1
E4BBBF	1
E4BC80	1
E4BC81	1
E4BC82	1
E4BC83	1
E4BC84	1
E4BC85	1
E4BC86	1
E4BC87	1
E4BC88	1
E4BC89	1
E4BC8A	1
E4BC8B	1
E4BC8C	1
E4BC8D	1
E4BC8E	1
E4BC8F	1
E4BC90	1
E4BC91	1
E4BC92	1
E4BC93	1
E4BC94	1
E4BC95	1
E4BC96	1
E4BC97	1
E4BC98	1
E4BC99	1
E4BC9A	1
E4BC9B	1
E4BC9C	1
E4BC9D	1
E4BC9E	1
E4BC9F	1
E4BCA0	1
E4BCA1	1
E4BCA2	1
E4BCA3	1
E4BCA4	1
E4BCA5	1
E4BCA6	1
E4BCA7	1
E4BCA8	1
E4BCA9	1
E4BCAA	1
E4BCAB	1
E4BCAC	1
E4BCAD	1
E4BCAE	1
E4BCAF	1
E4BCB0	1
E4BCB1	1
E4BCB2	1
E4BCB3	1
E4BCB4	1
E4BCB5	1
E4BCB6	1
E4BCB7	1
E4BCB8	1
E4BCB9	1
E4BCBA	1
E4BCBB	1
E4BCBC	1
E4BCBD	1
E4BCBE	1
E4BCBF	1
E4BD80	1
E4BD81	1
E4BD82	1
E4BD83	1
E4BD84	1
E4BD85	1
E4BD86	1
E4BD87	1
E4BD88	1
E4BD89	1
E4BD8A	1
E4BD8B	1
E4BD8C	1
E4BD8D	1
E4BD8E	1
E4BD8F	1
E4BD90	1
E4BD91	1
E4BD92	1
E4BD93	1
E4BD94	1
E4BD95	1
E4BD96	1
E4BD97	1
E4BD98	1
E4BD99	1
E4BD9A	1
E4BD9B	1
E4BD9C	1
E4BD9D	1
E4BD9E	1
E4BD9F	1
E4BDA0	1
E4BDA1	1
E4BDA2	1
E4BDA3	1
E4BDA4	1
E4BDA5	1
E4BDA6	1
E4BDA7	1
E4BDA8	1
E4BDA9	1
E4BDAA	1
E4BDAB	1
E4BDAC	1
E4BDAD	1
E4BDAE	1
E4BDAF	1
E4BDB0	1
E4BDB1	1
E4BDB2	1
E4BDB3	1
E4BDB4	1
E4BDB5	1
E4BDB6	1
E4BDB7	1
E4BDB8	1
E4BDB9	1
E4BDBA	1
E4BDBB	1
E4BDBC	1
E4BDBD	1
E4BDBE	1
E4BDBF	1
E4BE80	1
E4BE81	1
E4BE82	1
E4BE83	1
E4BE84	1
E4BE85	1
E4BE86	1
E4BE87	1
E4BE88	1
E4BE89	1
E4BE8A	1
E4BE8B	1
E4BE8C	1
E4BE8D	1
E4BE8E	1
E4BE8F	1
E4BE90	1
E4BE91	1
E4BE92	1
E4BE93	1
E4BE94	1
E4BE95	1
E4BE96	1
E4BE97	1
E4BE98	1
E4BE99	1
E4BE9A	1
E4BE9B	1
E4BE9C	1
E4BE9D	1
E4BE9E	1
E4BE9F	1
E4BEA0	1
E4BEA1	1
E4BEA2	1
E4BEA3	1
E4BEA4	1
E4BEA5	1
E4BEA6	1
E4BEA7	1
E4BEA8	1
E4BEA9	1
E4BEAA	1
E4BEAB	1
E4BEAC	1
E4BEAD	1
E4BEAE	1
E4BEAF	1
E4BEB0	1
E4BEB1	1
E4BEB2	1
E4BEB3	1
E4BEB4	1
E4BEB5	1
E4BEB6	1
E4BEB7	1
E4BEB8	1
E4BEB9	1
E4BEBA	1
E4BEBB	1
E4BEBC	1
E4BEBD	1
E4BEBE	1
E4BEBF	1
E4BF80	1
E4BF81	1
E4BF82	1
E4BF83	1
E4BF84	1
E4BF85	1
E4BF86	1
E4BF87	1
E4BF88	1
E4BF89	1
E4BF8A	1
E4BF8B	1
E4BF8C	1
E4BF8D	1
E4BF8E	1
E4BF8F	1
E4BF90	1
E4BF91	1
E4BF92	1
E4BF93	1
E4BF94	1
E4BF95	1
E4BF96	1
E4BF97	1
E4BF98	1
E4BF99	1
E4BF9A	1
E4BF9B	1
E4BF9C	1
E4BF9D	1
E4BF9E	1
E4BF9F	1
E4BFA0	1
E4BFA1	1
E4BFA2	1
E4BFA3	1
E4BFA4	1
E4BFA5	1
E4BFA6	1
E4BFA7	1
E4BFA8	1
E4BFA9	1
E4BFAA	1
E4BFAB	1
E4BFAC	1
E4BFAD	1
E4BFAE	1
E4BFAF	1
E4BFB0	1
E4BFB1	1
E4BFB2	1
E4BFB3	1
E4BFB4	1
E4BFB5	1
E4BFB6	1
E4BFB7	1
E4BFB8	1
E4BFB9	1
E4BFBA	1
E4BFBB	1
E4BFBC	1
E4BFBD	1
E4BFBE	1
E4BFBF	1
C8B7	1
C8B8	1
C8B9	1
C8BA	1
C8BB	1
C8BC	1
C8BD	1
C8BE	1
C8BF	1
C980	1
C981	1
C982	1
C983	1
C984	1
C985	1
C986	1
C987	1
C988	1
C989	1
C98A	1
C98B	1
C98C	1
C98D	1
C98E	1
C98F	1
CD98	1
CD99	1
CD9A	1
CD9B	1
CD9C	1
CDB0	1
CDB1	1
CDB2	1
CDB3	1
CDB6	1
CDB7	1
CDB8	1
CDB9	1
CDBB	1
CDBC	1
CDBD	1
CDBF	1
CE80	1
CE81	1
CE82	1
CE83	1
CE8B	1
CE8D	1
CEA2	1
CF8F	1
CFBC	1
CFBD	1
CFBE	1
CFBF	1
D287	1
D38F	1
D3B6	1
D3B7	1
D3BA	1
D3BB	1
D3BC	1
D3BD	1
D3BE	1
D3BF	1
D490	1
D491	1
D492	1
D493	1
D494	1
D495	1
D496	1
D497	1
D498	1
D499	1
D49A	1
D49B	1
D49C	1
D49D	1
D49E	1
D49F	1
D4A0	1
D4A1	1
D4A2	1
D4A3	1
D4A4	1
D4A5	1
D4A6	1
D4A7	1
D4A8	1
D4A9	1
D4AA	1
D4AB	1
D4AC	1
D4AD	1
D4AE	1
D4AF	1
D4B0	1
D597	1
D598	1
D5A0	1
D688	1
D68B	1
D68C	1
D68D	1
D68E	1
D68F	1
D690	1
D6A2	1
D6BA	1
D785	1
D786	1
D787	1
D788	1
D789	1
D78A	1
D78B	1
D78C	1
D78D	1
D78E	1
D78F	1
D7AB	1
D7AC	1
D7AD	1
D7AE	1
D7AF	1
D7B5	1
D7B6	1
D7B7	1
D7B8	1
D7B9	1
D7BA	1
D7BB	1
D7BC	1
D7BD	1
D7BE	1
D7BF	1
D884	1
D885	1
D886	1
D887	1
D888	1
D889	1
D88A	1
D88B	1
D896	1
D897	1
D898	1
D899	1
D89A	1
D89C	1
D89D	1
D89E	1
D8A0	1
D8BB	1
D8BC	1
D8BD	1
D8BE	1
D8BF	1
D999	1
D99A	1
D99B	1
D99C	1
D99D	1
D99E	1
D99F	1
DC8E	1
DD8B	1
DD8C	1
DD90	1
DD91	1
DD92	1
DD93	1
DD94	1
DD95	1
DD96	1
DD97	1
DD98	1
DD99	1
DD9A	1
DD9B	1
DD9C	1
DD9D	1
DD9E	1
DD9F	1
DDA0	1
DDA1	1
DDA2	1
DDA3	1
DDA4	1
DDA5	1
DDA6	1
DDA7	1
DDA8	1
DDA9	1
DDAA	1
DDAB	1
DDAC	1
DDAD	1
DDAE	1
DDAF	1
DDB0	1
DDB1	1
DDB2	1
DDB3	1
DDB4	1
DDB5	1
DDB6	1
DDB7	1
DDB8	1
DDB9	1
DDBA	1
DDBB	1
DDBC	1
DDBD	1
DDBE	1
DDBF	1
DEB2	1
DEB3	1
DEB4	1
DEB5	1
DEB6	1
DEB7	1
DEB8	1
DEB9	1
DEBA	1
DEBB	1
DEBC	1
DEBD	1
DEBE	1
DEBF	1
DF80	1
DF81	1
DF82	1
DF83	1
DF84	1
DF85	1
DF86	1
DF87	1
DF88	1
DF89	1
DF8A	1
DF8B	1
DF8C	1
DF8D	1
DF8E	1
DF8F	1
DF90	1
DF91	1
DF92	1
DF93	1
DF94	1
DF95	1
DF96	1
DF97	1
DF98	1
DF99	1
DF9A	1
DF9B	1
DF9C	1
DF9D	1
DF9E	1
DF9F	1
DFA0	1
DFA1	1
DFA2	1
DFA3	1
DFA4	1
DFA5	1
DFA6	1
DFA7	1
DFA8	1
DFA9	1
DFAA	1
DFAB	1
DFAC	1
DFAD	1
DFAE	1
DFAF	1
DFB0	1
DFB1	1
DFB2	1
DFB3	1
DFB4	1
DFB5	1
DFB6	1
DFB7	1
DFB8	1
DFB9	1
DFBA	1
DFBB	1
DFBC	1
DFBD	1
DFBE	1
DFBF	1
DROP TABLE IF EXISTS test.t1;
DROP TABLE IF EXISTS test.t1;
DROP DATABASE test;
CREATE DATABASE test CHARACTER SET utf8mb3;
USE test;
CREATE TABLE test.t1 (a CHAR(4) CHARACTER SET utf8mb3 COLLATE utf8mb3_icelandic_ci) ENGINE=MyISAM CHARACTER SET utf8mb3 COLLATE utf8mb3_icelandic_ci;
Warnings:
Warning	1287	'utf8mb3' is deprecated and will be removed in a future release. Please use utf8mb4 instead
Warning	3778	'utf8mb3_icelandic_ci' is a collation of the deprecated character set UTF8MB3. Please consider using UTF8MB4 with an appropriate collation instead.
Warning	1287	'utf8mb3' is deprecated and will be removed in a future release. Please use utf8mb4 instead
Warning	3778	'utf8mb3_icelandic_ci' is a collation of the deprecated character set UTF8MB3. Please consider using UTF8MB4 with an appropriate collation instead.
SHOW TABLE STATUS LIKE 't1';
Name	Engine	Version	Row_format	Rows	Avg_row_length	Data_length	Max_data_length	Index_length	Data_free	Auto_increment	Create_time	Update_time	Check_time	Collation	Checksum	Create_options	Comment
t1	MyISAM	#	#	#	#	#	#	#	#	#	#	#	#	utf8mb3_icelandic_ci	#	#	#
LOAD DATA INFILE 
'MYSQL_TEST_DIR/suite/funcs_2/data/charset_utf8.txt' INTO TABLE test.t1;
DELETE FROM test.t1 WHERE CHAR_LENGTH(a) <> 1;
SELECT HEX(ORD(a)) AS a_ord, CHAR_LENGTH(a) AS a_len FROM test.t1 ORDER BY a, ORD(a);
a_ord	a_len
C285	1
7F	1
C280	1
C281	1
C282	1
C283	1
C284	1
C286	1
C287	1
C288	1
C289	1
C28A	1
C28B	1
C28C	1
C28D	1
C28E	1
C28F	1
C290	1
C291	1
C292	1
C293	1
C294	1
C295	1
C296	1
C297	1
C298	1
C299	1
C29A	1
C29B	1
C29C	1
C29D	1
C29E	1
C29F	1
C2A0	1
CC80	1
CC81	1
CC82	1
CC83	1
CC84	1
CC85	1
CC86	1
CC87	1
CC88	1
CC89	1
CC8A	1
CC8B	1
CC8C	1
CC8D	1
CC8E	1
CC8F	1
CC90	1
CC91	1
CC92	1
CC93	1
CC94	1
CC95	1
CC96	1
CC97	1
CC98	1
CC99	1
CC9A	1
CC9B	1
CC9C	1
CC9D	1
CC9E	1
CC9F	1
CCA0	1
CCA1	1
CCA2	1
CCA3	1
CCA4	1
CCA5	1
CCA6	1
CCA7	1
CCA8	1
CCA9	1
CCAA	1
CCAB	1
CCAC	1
CCAD	1
CCAE	1
CCAF	1
CCB0	1
CCB1	1
CCB2	1
CCB3	1
CCB4	1
CCB5	1
CCB6	1
CCB7	1
CCB8	1
CCB9	1
CCBA	1
CCBB	1
CCBC	1
CCBD	1
CCBE	1
CCBF	1
CD80	1
CD81	1
CD82	1
CD83	1
CD84	1
CD85	1
CD86	1
CD87	1
CD88	1
CD89	1
CD8A	1
CD8B	1
CD8C	1
CD8D	1
CD8E	1
CD8F	1
CD90	1
CD91	1
CD92	1
CD93	1
CD94	1
CD95	1
CD96	1
CD97	1
CD9D	1
CD9E	1
CD9F	1
CDA0	1
CDA1	1
CDA2	1
D283	1
D284	1
D285	1
D286	1
D288	1
D289	1
D691	1
D692	1
D693	1
D694	1
D695	1
D696	1
D697	1
D698	1
D699	1
D69A	1
D69B	1
D69C	1
D69D	1
D69E	1
D69F	1
D6A0	1
D6A1	1
D6A3	1
D6A4	1
D6A5	1
D6A6	1
D6A7	1
D6A8	1
D6A9	1
D6AA	1
D6AB	1
D6AC	1
D6AD	1
D6AE	1
D6AF	1
D6B0	1
D6B1	1
D6B2	1
D6B3	1
D6B4	1
D6B5	1
D6B6	1
D6B7	1
D6B8	1
D6B9	1
D6BB	1
D6BC	1
D6BD	1
D6BF	1
D781	1
D782	1
D784	1
D880	1
D881	1
D882	1
D883	1
D890	1
D891	1
D892	1
D893	1
D894	1
D895	1
D98B	1
D98C	1
D98D	1
D98E	1
D98F	1
D990	1
D991	1
D992	1
D993	1
D994	1
D995	1
D996	1
D997	1
D998	1
D9B0	1
DB96	1
DB97	1
DB98	1
DB99	1
DB9A	1
DB9B	1
DB9C	1
DB9D	1
DB9E	1
DB9F	1
DBA0	1
DBA1	1
DBA2	1
DBA3	1
DBA4	1
DBA7	1
DBA8	1
DBAA	1
DBAB	1
DBAC	1
DBAD	1
DC8F	1
DC91	1
DCB0	1
DCB1	1
DCB2	1
DCB3	1
DCB4	1
DCB5	1
DCB6	1
DCB7	1
DCB8	1
DCB9	1
DCBA	1
DCBB	1
DCBC	1
DCBD	1
DCBE	1
DCBF	1
DD80	1
DD81	1
DD82	1
DD83	1
DD84	1
DD85	1
DD86	1
DD87	1
DD88	1
DD89	1
DD8A	1
D980	1
60	1
C2B4	1
CE84	1
CB9C	1
5E	1
C2AF	1
CB98	1
CB99	1
C2A8	1
CE85	1
CB9A	1
CB9D	1
C2B8	1
CB9B	1
5F	1
C2AD	1
2D	1
D68A	1
2C	1
D59D	1
D88C	1
D88D	1
D9AB	1
D9AC	1
3B	1
CDBE	1
D89B	1
3A	1
D689	1
DC83	1
DC84	1
DC85	1
DC86	1
DC87	1
DC88	1
21	1
C2A1	1
D59C	1
3F	1
C2BF	1
D59E	1
D89F	1
DC89	1
2E	1
DB94	1
DC81	1
DC82	1
C2B7	1
CE87	1
DC80	1
27	1
22	1
C2AB	1
C2BB	1
28	1
29	1
5B	1
7B	1
7D	1
C2A7	1
C2B6	1
C2A9	1
C2AE	1
40	1
2A	1
D9AD	1
2F	1
26	1
23	1
25	1
D9AA	1
D59A	1
D59B	1
D59F	1
D6BE	1
D780	1
D783	1
D7B3	1
D7B4	1
DC8A	1
DC8B	1
DC8C	1
DC8D	1
CAB9	1
CDB4	1
CDB5	1
CABA	1
CB82	1
CB83	1
CB84	1
CB85	1
CB86	1
CB87	1
CB88	1
CB89	1
CB8A	1
CB8B	1
CB8C	1
CB8D	1
CB8E	1
CB8F	1
CB92	1
CB93	1
CB94	1
CB95	1
CB96	1
CB97	1
CB9E	1
CB9F	1
CBA5	1
CBA6	1
CBA7	1
CBA8	1
CBA9	1
CBAA	1
CBAB	1
CBAC	1
CBAD	1
CBAF	1
CBB0	1
CBB1	1
CBB2	1
CBB3	1
CBB4	1
CBB5	1
CBB6	1
CBB7	1
CBB8	1
CBB9	1
CBBA	1
CBBB	1
CBBC	1
CBBD	1
CBBE	1
CBBF	1
C2B0	1
D282	1
D88E	1
D88F	1
DBA9	1
CFB6	1
2B	1
C2B1	1
C3B7	1
C397	1
3C	1
3D	1
3E	1
C2AC	1
7C	1
C2A6	1
7E	1
CB90	1
CB91	1
C2A4	1
C2A2	1
24	1
C2A3	1
C2A5	1
30	1
D9A0	1
DBB0	1
31	1
C2B9	1
D9A1	1
DBB1	1
C2BD	1
C2BC	1
32	1
C2B2	1
D9A2	1
DBB2	1
33	1
C2B3	1
D9A3	1
DBB3	1
C2BE	1
34	1
D9A4	1
DBB4	1
35	1
D9A5	1
DBB5	1
36	1
D9A6	1
DBB6	1
37	1
D9A7	1
DBB7	1
38	1
D9A8	1
DBB8	1
39	1
D9A9	1
DBB9	1
41	1
61	1
C2AA	1
C380	1
C382	1
C383	1
C3A0	1
C3A2	1
C3A3	1
C480	1
C481	1
C482	1
C483	1
C484	1
C485	1
C78D	1
C78E	1
C79E	1
C79F	1
C7A0	1
C7A1	1
C7BA	1
C7BB	1
C880	1
C881	1
C882	1
C883	1
C8A6	1
C8A7	1
CDA3	1
C381	1
C3A1	1
C7A2	1
C7A3	1
C7BC	1
C7BD	1
C990	1
C991	1
C992	1
42	1
62	1
CA99	1
C680	1
C681	1
C993	1
C682	1
C683	1
43	1
63	1
C387	1
C3A7	1
C486	1
C487	1
C488	1
C489	1
C48A	1
C48B	1
C48C	1
C48D	1
CDA8	1
C687	1
C688	1
C995	1
44	1
64	1
C48E	1
C48F	1
CDA9	1
C784	1
C785	1
C786	1
C7B1	1
C7B2	1
C7B3	1
CAA3	1
CAA5	1
CAA4	1
C390	1
C3B0	1
C490	1
C491	1
C689	1
C996	1
C68A	1
C997	1
C68B	1
C68C	1
C8A1	1
45	1
65	1
C388	1
C38A	1
C38B	1
C3A8	1
C3AA	1
C3AB	1
C492	1
C493	1
C494	1
C495	1
C496	1
C497	1
C498	1
C499	1
C49A	1
C49B	1
C884	1
C885	1
C886	1
C887	1
C8A8	1
C8A9	1
CDA4	1
C389	1
C3A9	1
C68E	1
C79D	1
C68F	1
C999	1
C690	1
C99B	1
C998	1
C99A	1
C99C	1
C99D	1
C99E	1
CA9A	1
C9A4	1
46	1
66	1
CAA9	1
C691	1
C692	1
47	1
67	1
C49C	1
C49D	1
C49E	1
C49F	1
C4A0	1
C4A1	1
C4A2	1
C4A3	1
C7A6	1
C7A7	1
C7B4	1
C7B5	1
C9A1	1
C9A2	1
C7A4	1
C7A5	1
C693	1
C9A0	1
CA9B	1
C694	1
C9A3	1
CBA0	1
C6A2	1
C6A3	1
48	1
68	1
C4A4	1
C4A5	1
C89E	1
C89F	1
CAB0	1
CDAA	1
CA9C	1
C695	1
C7B6	1
C4A6	1
C4A7	1
C9A6	1
CAB1	1
C9A7	1
CABB	1
CABD	1
49	1
69	1
C38C	1
C38E	1
C38F	1
C3AC	1
C3AE	1
C3AF	1
C4A8	1
C4A9	1
C4AA	1
C4AB	1
C4AC	1
C4AD	1
C4AE	1
C4AF	1
C4B0	1
C78F	1
C790	1
C888	1
C889	1
C88A	1
C88B	1
CDA5	1
C4B2	1
C4B3	1
C38D	1
C3AD	1
C4B1	1
C9AA	1
C697	1
C9A8	1
C696	1
C9A9	1
4A	1
6A	1
C4B4	1
C4B5	1
C7B0	1
CAB2	1
CA9D	1
C99F	1
CA84	1
4B	1
6B	1
C4B6	1
C4B7	1
C7A8	1
C7A9	1
C698	1
C699	1
CA9E	1
4C	1
6C	1
C4B9	1
C4BA	1
C4BB	1
C4BC	1
C4BD	1
C4BE	1
CBA1	1
C4BF	1
C580	1
C787	1
C788	1
C789	1
CAAA	1
CAAB	1
CA9F	1
C581	1
C582	1
C69A	1
C9AB	1
C9AC	1
C9AD	1
C8B4	1
C9AE	1
C69B	1
CA8E	1
4D	1
6D	1
CDAB	1
C9B1	1
4E	1
6E	1
C391	1
C3B1	1
C583	1
C584	1
C585	1
C586	1
C587	1
C588	1
C7B8	1
C7B9	1
C78A	1
C78B	1
C78C	1
C9B4	1
C69D	1
C9B2	1
C69E	1
C8A0	1
C9B3	1
C8B5	1
C58A	1
C58B	1
4F	1
6F	1
C2BA	1
C392	1
C394	1
C395	1
C3B2	1
C3B4	1
C3B5	1
C58C	1
C58D	1
C58E	1
C58F	1
C590	1
C591	1
C6A0	1
C6A1	1
C791	1
C792	1
C7AA	1
C7AB	1
C7AC	1
C7AD	1
C88C	1
C88D	1
C88E	1
C88F	1
C8AA	1
C8AB	1
C8AC	1
C8AD	1
C8AE	1
C8AF	1
C8B0	1
C8B1	1
CDA6	1
C592	1
C593	1
C393	1
C3B3	1
C9B6	1
C7BE	1
C7BF	1
C686	1
C994	1
C69F	1
C9B5	1
C9B7	1
C8A2	1
C8A3	1
50	1
70	1
C6A4	1
C6A5	1
C9B8	1
51	1
71	1
CAA0	1
C4B8	1
52	1
72	1
C594	1
C595	1
C596	1
C597	1
C598	1
C599	1
C890	1
C891	1
C892	1
C893	1
CAB3	1
CDAC	1
C6A6	1
CA80	1
C9B9	1
CAB4	1
C9BA	1
C9BB	1
CAB5	1
C9BC	1
C9BD	1
C9BE	1
C9BF	1
CA81	1
CAB6	1
53	1
73	1
C59A	1
C59B	1
C59C	1
C59D	1
C59E	1
C59F	1
C5A0	1
C5A1	1
C5BF	1
C898	1
C899	1
CBA2	1
C39F	1
CA82	1
C6A9	1
CA83	1
C6AA	1
CA85	1
CA86	1
54	1
74	1
C5A2	1
C5A3	1
C5A4	1
C5A5	1
C89A	1
C89B	1
CDAD	1
CAA8	1
C6BE	1
CAA6	1
CAA7	1
C5A6	1
C5A7	1
C6AB	1
C6AC	1
C6AD	1
C6AE	1
CA88	1
C8B6	1
CA87	1
55	1
75	1
C399	1
C39B	1
C39C	1
C3B9	1
C3BB	1
C3BC	1
C5A8	1
C5A9	1
C5AA	1
C5AB	1
C5AC	1
C5AD	1
C5AE	1
C5AF	1
C5B0	1
C5B1	1
C5B2	1
C5B3	1
C6AF	1
C6B0	1
C793	1
C794	1
C795	1
C796	1
C797	1
C798	1
C799	1
C79A	1
C79B	1
C79C	1
C894	1
C895	1
C896	1
C897	1
CDA7	1
C39A	1
C3BA	1
CA89	1
C9A5	1
CAAE	1
CAAF	1
C69C	1
C9AF	1
C9B0	1
C6B1	1
CA8A	1
56	1
76	1
CDAE	1
C6B2	1
CA8B	1
CA8C	1
57	1
77	1
C5B4	1
C5B5	1
CAB7	1
CA8D	1
58	1
78	1
CBA3	1
CDAF	1
59	1
79	1
C3BF	1
C5B6	1
C5B7	1
C5B8	1
C8B2	1
C8B3	1
CAB8	1
C39D	1
C3BD	1
CA8F	1
C6B3	1
C6B4	1
5A	1
7A	1
C5B9	1
C5BA	1
C5BB	1
C5BC	1
C5BD	1
C5BE	1
C68D	1
C39E	1
C3BE	1
C384	1
C386	1
C3A4	1
C3A6	1
C396	1
C398	1
C3B6	1
C3B8	1
C385	1
C3A5	1
C6B5	1
C6B6	1
C8A4	1
C8A5	1
CA90	1
CA91	1
C6B7	1
C7AE	1
C7AF	1
CA92	1
C6B8	1
C6B9	1
C6BA	1
CA93	1
C89C	1
C89D	1
C6BF	1
C7B7	1
C6BB	1
C6A7	1
C6A8	1
C6BC	1
C6BD	1
C684	1
C685	1
CA94	1
CB80	1
CABC	1
C589	1
CBAE	1
CABE	1
CA95	1
CBA4	1
CABF	1
CB81	1
CAA1	1
CAA2	1
CA96	1
C780	1
C781	1
C782	1
C783	1
CA97	1
CA98	1
CAAC	1
CAAD	1
CE86	1
CE91	1
CEAC	1
CEB1	1
CE92	1
CEB2	1
CF90	1
CE93	1
CEB3	1
CE94	1
CEB4	1
CE88	1
CE95	1
CEAD	1
CEB5	1
CFB5	1
CF9C	1
CF9D	1
CF9A	1
CF9B	1
CE96	1
CEB6	1
CE89	1
CE97	1
CEAE	1
CEB7	1
CE98	1
CEB8	1
CF91	1
CFB4	1
CDBA	1
CE8A	1
CE90	1
CE99	1
CEAA	1
CEAF	1
CEB9	1
CF8A	1
CFB3	1
CE9A	1
CEBA	1
CFB0	1
CF97	1
CE9B	1
CEBB	1
C2B5	1
CE9C	1
CEBC	1
CE9D	1
CEBD	1
CE9E	1
CEBE	1
CE8C	1
CE9F	1
CEBF	1
CF8C	1
CEA0	1
CF80	1
CF96	1
CF9E	1
CF9F	1
CF98	1
CF99	1
CEA1	1
CF81	1
CFB1	1
CEA3	1
CF82	1
CF83	1
CFB2	1
CFB9	1
CEA4	1
CF84	1
CE8E	1
CEA5	1
CEAB	1
CEB0	1
CF85	1
CF8B	1
CF8D	1
CF92	1
CF93	1
CF94	1
CEA6	1
CF86	1
CF95	1
CEA7	1
CF87	1
CEA8	1
CF88	1
CE8F	1
CEA9	1
CF89	1
CF8E	1
CFA0	1
CFA1	1
CFB7	1
CFB8	1
CFBA	1
CFBB	1
CFA2	1
CFA3	1
CFA4	1
CFA5	1
CFA6	1
CFA7	1
CFA8	1
CFA9	1
CFAA	1
CFAB	1
CFAC	1
CFAD	1
CFAE	1
CFAF	1
D090	1
D0B0	1
D390	1
D391	1
D392	1
D393	1
D398	1
D399	1
D39A	1
D39B	1
D394	1
D395	1
D091	1
D0B1	1
D092	1
D0B2	1
D093	1
D0B3	1
D290	1
D291	1
D292	1
D293	1
D294	1
D295	1
D094	1
D0B4	1
D480	1
D481	1
D082	1
D192	1
D482	1
D483	1
D083	1
D193	1
D298	1
D299	1
D080	1
D081	1
D095	1
D0B5	1
D190	1
D191	1
D396	1
D397	1
D084	1
D194	1
D096	1
D0B6	1
D381	1
D382	1
D39C	1
D39D	1
D296	1
D297	1
D097	1
D0B7	1
D484	1
D485	1
D39E	1
D39F	1
D085	1
D195	1
D3A0	1
D3A1	1
D486	1
D487	1
D08D	1
D098	1
D0B8	1
D19D	1
D3A2	1
D3A3	1
D28A	1
D28B	1
D3A4	1
D3A5	1
D086	1
D196	1
D087	1
D197	1
D099	1
D0B9	1
D088	1
D198	1
D09A	1
D0BA	1
D29A	1
D29B	1
D383	1
D384	1
D2A0	1
D2A1	1
D29E	1
D29F	1
D29C	1
D29D	1
D09B	1
D0BB	1
D385	1
D386	1
D089	1
D199	1
D488	1
D489	1
D09C	1
D0BC	1
D38D	1
D38E	1
D09D	1
D0BD	1
D389	1
D38A	1
D2A2	1
D2A3	1
D387	1
D388	1
D2A4	1
D2A5	1
D08A	1
D19A	1
D48A	1
D48B	1
D09E	1
D0BE	1
D3A6	1
D3A7	1
D3A8	1
D3A9	1
D3AA	1
D3AB	1
D09F	1
D0BF	1
D2A6	1
D2A7	1
D280	1
D281	1
D0A0	1
D180	1
D28E	1
D28F	1
D0A1	1
D181	1
D48C	1
D48D	1
D2AA	1
D2AB	1
D0A2	1
D182	1
D48E	1
D48F	1
D2AC	1
D2AD	1
D08B	1
D19B	1
D08C	1
D19C	1
D0A3	1
D183	1
D3AE	1
D3AF	1
D08E	1
D19E	1
D3B0	1
D3B1	1
D3B2	1
D3B3	1
D2AE	1
D2AF	1
D2B0	1
D2B1	1
D1B8	1
D1B9	1
D0A4	1
D184	1
D0A5	1
D185	1
D2B2	1
D2B3	1
D2BA	1
D2BB	1
D1A0	1
D1A1	1
D1BE	1
D1BF	1
D1BC	1
D1BD	1
D1BA	1
D1BB	1
D0A6	1
D186	1
D2B4	1
D2B5	1
D0A7	1
D187	1
D3B4	1
D3B5	1
D2B6	1
D2B7	1
D38B	1
D38C	1
D2B8	1
D2B9	1
D2BC	1
D2BD	1
D2BE	1
D2BF	1
D08F	1
D19F	1
D0A8	1
D188	1
D0A9	1
D189	1
D0AA	1
D18A	1
D0AB	1
D18B	1
D3B8	1
D3B9	1
D0AC	1
D18C	1
D28C	1
D28D	1
D1A2	1
D1A3	1
D0AD	1
D18D	1
D3AC	1
D3AD	1
D0AE	1
D18E	1
D0AF	1
D18F	1
D1A4	1
D1A5	1
D1A6	1
D1A7	1
D1AA	1
D1AB	1
D1A8	1
D1A9	1
D1AC	1
D1AD	1
D1AE	1
D1AF	1
D1B0	1
D1B1	1
D1B2	1
D1B3	1
D1B4	1
D1B5	1
D1B6	1
D1B7	1
D2A8	1
D2A9	1
D380	1
D4B1	1
D5A1	1
D4B2	1
D5A2	1
D4B3	1
D5A3	1
D4B4	1
D5A4	1
D4B5	1
D5A5	1
D687	1
D4B6	1
D5A6	1
D4B7	1
D5A7	1
D4B8	1
D5A8	1
D4B9	1
D5A9	1
D4BA	1
D5AA	1
D4BB	1
D5AB	1
D4BC	1
D5AC	1
D4BD	1
D5AD	1
D4BE	1
D5AE	1
D4BF	1
D5AF	1
D580	1
D5B0	1
D581	1
D5B1	1
D582	1
D5B2	1
D583	1
D5B3	1
D584	1
D5B4	1
D585	1
D5B5	1
D586	1
D5B6	1
D587	1
D5B7	1
D588	1
D5B8	1
D589	1
D5B9	1
D58A	1
D5BA	1
D58B	1
D5BB	1
D58C	1
D5BC	1
D58D	1
D5BD	1
D58E	1
D5BE	1
D58F	1
D5BF	1
D590	1
D680	1
D591	1
D681	1
D592	1
D682	1
D593	1
D683	1
D594	1
D684	1
D595	1
D685	1
D596	1
D686	1
D599	1
D790	1
D791	1
D792	1
D793	1
D794	1
D795	1
D7B0	1
D7B1	1
D796	1
D797	1
D798	1
D799	1
D7B2	1
D79A	1
D79B	1
D79C	1
D79D	1
D79E	1
D79F	1
D7A0	1
D7A1	1
D7A2	1
D7A3	1
D7A4	1
D7A5	1
D7A6	1
D7A7	1
D7A8	1
D7A9	1
D7AA	1
D8A1	1
D9B4	1
DBBD	1
D8A2	1
D8A3	1
D9B2	1
D9B1	1
D8A4	1
D8A5	1
D9B3	1
D8A6	1
D8A7	1
D9B5	1
D9AE	1
D8A8	1
D9BB	1
D9BE	1
DA80	1
D8A9	1
D8AA	1
D8AB	1
D9B9	1
D9BA	1
D9BC	1
D9BD	1
D9BF	1
D8AC	1
DA83	1
DA84	1
DA86	1
DABF	1
DA87	1
D8AD	1
D8AE	1
DA81	1
DA82	1
DA85	1
D8AF	1
D8B0	1
DA88	1
DA89	1
DA8A	1
DA8B	1
DA8C	1
DA8D	1
DA8E	1
DA8F	1
DA90	1
DBAE	1
D8B1	1
D8B2	1
DA91	1
DA92	1
DA93	1
DA94	1
DA95	1
DA96	1
DA97	1
DA98	1
DA99	1
DBAF	1
D8B3	1
D8B4	1
DA9A	1
DA9B	1
DA9C	1
DBBA	1
D8B5	1
D8B6	1
DA9D	1
DA9E	1
DBBB	1
D8B7	1
D8B8	1
DA9F	1
D8B9	1
D8BA	1
DAA0	1
DBBC	1
D981	1
DAA1	1
DAA2	1
DAA3	1
DAA4	1
DAA5	1
DAA6	1
D9AF	1
D982	1
DAA7	1
DAA8	1
D983	1
DAA9	1
DAAA	1
DAAB	1
DAAC	1
DAAD	1
DAAE	1
DAAF	1
DAB0	1
DAB1	1
DAB2	1
DAB3	1
DAB4	1
D984	1
DAB5	1
DAB6	1
DAB7	1
DAB8	1
D985	1
DBBE	1
D986	1
DABA	1
DABB	1
DABC	1
DABD	1
DAB9	1
D987	1
DABE	1
DB81	1
DB82	1
DB83	1
DBBF	1
DB80	1
DB95	1
D988	1
DBA5	1
D9B6	1
DB84	1
DB85	1
DB86	1
DB87	1
D9B7	1
DB88	1
DB89	1
DB8A	1
DB8B	1
DB8F	1
D989	1
D98A	1
DBA6	1
D9B8	1
DB8C	1
DB8D	1
DB8E	1
DB90	1
DB91	1
DB92	1
DB93	1
DC90	1
DC92	1
DCAD	1
DC93	1
DC94	1
DCAE	1
DC96	1
DC95	1
DCAF	1
DC97	1
DC98	1
DC99	1
DD8D	1
DC9A	1
DC9B	1
DC9C	1
DC9D	1
DC9E	1
DC9F	1
DD8E	1
DCA0	1
DCA1	1
DCA2	1
DCA3	1
DCA4	1
DCA5	1
DCA6	1
DCA7	1
DD8F	1
DCA8	1
DCA9	1
DCAA	1
DCAB	1
DCAC	1
DE80	1
DE99	1
DE9A	1
DE81	1
DE82	1
DE83	1
DE9C	1
DE84	1
DE85	1
DE86	1
DE87	1
DEA2	1
DEA3	1
DE88	1
DEA5	1
DE89	1
DE8A	1
DE8B	1
DE9B	1
DE8C	1
DE98	1
DEA0	1
DEA1	1
DE8D	1
DE8E	1
DEA4	1
DE8F	1
DE90	1
DE9D	1
DE9E	1
DE9F	1
DE91	1
DE92	1
DE93	1
DE94	1
DE95	1
DE96	1
DE97	1
DEB1	1
DEA6	1
DEA7	1
DEA8	1
DEA9	1
DEAA	1
DEAB	1
DEAC	1
DEAD	1
DEAE	1
DEAF	1
DEB0	1
E4B880	1
E4B881	1
E4B882	1
E4B883	1
E4B884	1
E4B885	1
E4B886	1
E4B887	1
E4B888	1
E4B889	1
E4B88A	1
E4B88B	1
E4B88C	1
E4B88D	1
E4B88E	1
E4B88F	1
E4B890	1
E4B891	1
E4B892	1
E4B893	1
E4B894	1
E4B895	1
E4B896	1
E4B897	1
E4B898	1
E4B899	1
E4B89A	1
E4B89B	1
E4B89C	1
E4B89D	1
E4B89E	1
E4B89F	1
E4B8A0	1
E4B8A1	1
E4B8A2	1
E4B8A3	1
E4B8A4	1
E4B8A5	1
E4B8A6	1
E4B8A7	1
E4B8A8	1
E4B8A9	1
E4B8AA	1
E4B8AB	1
E4B8AC	1
E4B8AD	1
E4B8AE	1
E4B8AF	1
E4B8B0	1
E4B8B1	1
E4B8B2	1
E4B8B3	1
E4B8B4	1
E4B8B5	1
E4B8B6	1
E4B8B7	1
E4B8B8	1
E4B8B9	1
E4B8BA	1
E4B8BB	1
E4B8BC	1
E4B8BD	1
E4B8BE	1
E4B8BF	1
E4B980	1
E4B981	1
E4B982	1
E4B983	1
E4B984	1
E4B985	1
E4B986	1
E4B987	1
E4B988	1
E4B989	1
E4B98A	1
E4B98B	1
E4B98C	1
E4B98D	1
E4B98E	1
E4B98F	1
E4B990	1
E4B991	1
E4B992	1
E4B993	1
E4B994	1
E4B995	1
E4B996	1
E4B997	1
E4B998	1
E4B999	1
E4B99A	1
E4B99B	1
E4B99C	1
E4B99D	1
E4B99E	1
E4B99F	1
E4B9A0	1
E4B9A1	1
E4B9A2	1
E4B9A3	1
E4B9A4	1
E4B9A5	1
E4B9A6	1
E4B9A7	1
E4B9A8	1
E4B9A9	1
E4B9AA	1
E4B9AB	1
E4B9AC	1
E4B9AD	1
E4B9AE	1
E4B9AF	1
E4B9B0	1
E4B9B1	1
E4B9B2	1
E4B9B3	1
E4B9B4	1
E4B9B5	1
E4B9B6	1
E4B9B7	1
E4B9B8	1
E4B9B9	1
E4B9BA	1
E4B9BB	1
E4B9BC	1
E4B9BD	1
E4B9BE	1
E4B9BF	1
E4BA80	1
E4BA81	1
E4BA82	1
E4BA83	1
E4BA84	1
E4BA85	1
E4BA86	1
E4BA87	1
E4BA88	1
E4BA89	1
E4BA8A	1
E4BA8B	1
E4BA8C	1
E4BA8D	1
E4BA8E	1
E4BA8F	1
E4BA90	1
E4BA91	1
E4BA92	1
E4BA93	1
E4BA94	1
E4BA95	1
E4BA96	1
E4BA97	1
E4BA98	1
E4BA99	1
E4BA9A	1
E4BA9B	1
E4BA9C	1
E4BA9D	1
E4BA9E	1
E4BA9F	1
E4BAA0	1
E4BAA1	1
E4BAA2	1
E4BAA3	1
E4BAA4	1
E4BAA5	1
E4BAA6	1
E4BAA7	1
E4BAA8	1
E4BAA9	1
E4BAAA	1
E4BAAB	1
E4BAAC	1
E4BAAD	1
E4BAAE	1
E4BAAF	1
E4BAB0	1
E4BAB1	1
E4BAB2	1
E4BAB3	1
E4BAB4	1
E4BAB5	1
E4BAB6	1
E4BAB7	1
E4BAB8	1
E4BAB9	1
E4BABA	1
E4BABB	1
E4BABC	1
E4BABD	1
E4BABE	1
E4BABF	1
E4BB80	1
E4BB81	1
E4BB82	1
E4BB83	1
E4BB84	1
E4BB85	1
E4BB86	1
E4BB87	1
E4BB88	1
E4BB89	1
E4BB8A	1
E4BB8B	1
E4BB8C	1
E4BB8D	1
E4BB8E	1
E4BB8F	1
E4BB90	1
E4BB91	1
E4BB92	1
E4BB93	1
E4BB94	1
E4BB95	1
E4BB96	1
E4BB97	1
E4BB98	1
E4BB99	1
E4BB9A	1
E4BB9B	1
E4BB9C	1
E4BB9D	1
E4BB9E	1
E4BB9F	1
E4BBA0	1
E4BBA1	1
E4BBA2	1
E4BBA3	1
E4BBA4	1
E4BBA5	1
E4BBA6	1
E4BBA7	1
E4BBA8	1
E4BBA9	1
E4BBAA	1
E4BBAB	1
E4BBAC	1
E4BBAD	1
E4BBAE	1
E4BBAF	1
E4BBB0	1
E4BBB1	1
E4BBB2	1
E4BBB3	1
E4BBB4	1
E4BBB5	1
E4BBB6	1
E4BBB7	1
E4BBB8	1
E4BBB9	1
E4BBBA	1
E4BBBB	1
E4BBBC	1
E4BBBD	1
E4BBBE	1
E4BBBF	1
E4BC80	1
E4BC81	1
E4BC82	1
E4BC83	1
E4BC84	1
E4BC85	1
E4BC86	1
E4BC87	1
E4BC88	1
E4BC89	1
E4BC8A	1
E4BC8B	1
E4BC8C	1
E4BC8D	1
E4BC8E	1
E4BC8F	1
E4BC90	1
E4BC91	1
E4BC92	1
E4BC93	1
E4BC94	1
E4BC95	1
E4BC96	1
E4BC97	1
E4BC98	1
E4BC99	1
E4BC9A	1
E4BC9B	1
E4BC9C	1
E4BC9D	1
E4BC9E	1
E4BC9F	1
E4BCA0	1
E4BCA1	1
E4BCA2	1
E4BCA3	1
E4BCA4	1
E4BCA5	1
E4BCA6	1
E4BCA7	1
E4BCA8	1
E4BCA9	1
E4BCAA	1
E4BCAB	1
E4BCAC	1
E4BCAD	1
E4BCAE	1
E4BCAF	1
E4BCB0	1
E4BCB1	1
E4BCB2	1
E4BCB3	1
E4BCB4	1
E4BCB5	1
E4BCB6	1
E4BCB7	1
E4BCB8	1
E4BCB9	1
E4BCBA	1
E4BCBB	1
E4BCBC	1
E4BCBD	1
E4BCBE	1
E4BCBF	1
E4BD80	1
E4BD81	1
E4BD82	1
E4BD83	1
E4BD84	1
E4BD85	1
E4BD86	1
E4BD87	1
E4BD88	1
E4BD89	1
E4BD8A	1
E4BD8B	1
E4BD8C	1
E4BD8D	1
E4BD8E	1
E4BD8F	1
E4BD90	1
E4BD91	1
E4BD92	1
E4BD93	1
E4BD94	1
E4BD95	1
E4BD96	1
E4BD97	1
E4BD98	1
E4BD99	1
E4BD9A	1
E4BD9B	1
E4BD9C	1
E4BD9D	1
E4BD9E	1
E4BD9F	1
E4BDA0	1
E4BDA1	1
E4BDA2	1
E4BDA3	1
E4BDA4	1
E4BDA5	1
E4BDA6	1
E4BDA7	1
E4BDA8	1
E4BDA9	1
E4BDAA	1
E4BDAB	1
E4BDAC	1
E4BDAD	1
E4BDAE	1
E4BDAF	1
E4BDB0	1
E4BDB1	1
E4BDB2	1
E4BDB3	1
E4BDB4	1
E4BDB5	1
E4BDB6	1
E4BDB7	1
E4BDB8	1
E4BDB9	1
E4BDBA	1
E4BDBB	1
E4BDBC	1
E4BDBD	1
E4BDBE	1
E4BDBF	1
E4BE80	1
E4BE81	1
E4BE82	1
E4BE83	1
E4BE84	1
E4BE85	1
E4BE86	1
E4BE87	1
E4BE88	1
E4BE89	1
E4BE8A	1
E4BE8B	1
E4BE8C	1
E4BE8D	1
E4BE8E	1
E4BE8F	1
E4BE90	1
E4BE91	1
E4BE92	1
E4BE93	1
E4BE94	1
E4BE95	1
E4BE96	1
E4BE97	1
E4BE98	1
E4BE99	1
E4BE9A	1
E4BE9B	1
E4BE9C	1
E4BE9D	1
E4BE9E	1
E4BE9F	1
E4BEA0	1
E4BEA1	1
E4BEA2	1
E4BEA3	1
E4BEA4	1
E4BEA5	1
E4BEA6	1
E4BEA7	1
E4BEA8	1
E4BEA9	1
E4BEAA	1
E4BEAB	1
E4BEAC	1
E4BEAD	1
E4BEAE	1
E4BEAF	1
E4BEB0	1
E4BEB1	1
E4BEB2	1
E4BEB3	1
E4BEB4	1
E4BEB5	1
E4BEB6	1
E4BEB7	1
E4BEB8	1
E4BEB9	1
E4BEBA	1
E4BEBB	1
E4BEBC	1
E4BEBD	1
E4BEBE	1
E4BEBF	1
E4BF80	1
E4BF81	1
E4BF82	1
E4BF83	1
E4BF84	1
E4BF85	1
E4BF86	1
E4BF87	1
E4BF88	1
E4BF89	1
E4BF8A	1
E4BF8B	1
E4BF8C	1
E4BF8D	1
E4BF8E	1
E4BF8F	1
E4BF90	1
E4BF91	1
E4BF92	1
E4BF93	1
E4BF94	1
E4BF95	1
E4BF96	1
E4BF97	1
E4BF98	1
E4BF99	1
E4BF9A	1
E4BF9B	1
E4BF9C	1
E4BF9D	1
E4BF9E	1
E4BF9F	1
E4BFA0	1
E4BFA1	1
E4BFA2	1
E4BFA3	1
E4BFA4	1
E4BFA5	1
E4BFA6	1
E4BFA7	1
E4BFA8	1
E4BFA9	1
E4BFAA	1
E4BFAB	1
E4BFAC	1
E4BFAD	1
E4BFAE	1
E4BFAF	1
E4BFB0	1
E4BFB1	1
E4BFB2	1
E4BFB3	1
E4BFB4	1
E4BFB5	1
E4BFB6	1
E4BFB7	1
E4BFB8	1
E4BFB9	1
E4BFBA	1
E4BFBB	1
E4BFBC	1
E4BFBD	1
E4BFBE	1
E4BFBF	1
C8B7	1
C8B8	1
C8B9	1
C8BA	1
C8BB	1
C8BC	1
C8BD	1
C8BE	1
C8BF	1
C980	1
C981	1
C982	1
C983	1
C984	1
C985	1
C986	1
C987	1
C988	1
C989	1
C98A	1
C98B	1
C98C	1
C98D	1
C98E	1
C98F	1
CD98	1
CD99	1
CD9A	1
CD9B	1
CD9C	1
CDB0	1
CDB1	1
CDB2	1
CDB3	1
CDB6	1
CDB7	1
CDB8	1
CDB9	1
CDBB	1
CDBC	1
CDBD	1
CDBF	1
CE80	1
CE81	1
CE82	1
CE83	1
CE8B	1
CE8D	1
CEA2	1
CF8F	1
CFBC	1
CFBD	1
CFBE	1
CFBF	1
D287	1
D38F	1
D3B6	1
D3B7	1
D3BA	1
D3BB	1
D3BC	1
D3BD	1
D3BE	1
D3BF	1
D490	1
D491	1
D492	1
D493	1
D494	1
D495	1
D496	1
D497	1
D498	1
D499	1
D49A	1
D49B	1
D49C	1
D49D	1
D49E	1
D49F	1
D4A0	1
D4A1	1
D4A2	1
D4A3	1
D4A4	1
D4A5	1
D4A6	1
D4A7	1
D4A8	1
D4A9	1
D4AA	1
D4AB	1
D4AC	1
D4AD	1
D4AE	1
D4AF	1
D4B0	1
D597	1
D598	1
D5A0	1
D688	1
D68B	1
D68C	1
D68D	1
D68E	1
D68F	1
D690	1
D6A2	1
D6BA	1
D785	1
D786	1
D787	1
D788	1
D789	1
D78A	1
D78B	1
D78C	1
D78D	1
D78E	1
D78F	1
D7AB	1
D7AC	1
D7AD	1
D7AE	1
D7AF	1
D7B5	1
D7B6	1
D7B7	1
D7B8	1
D7B9	1
D7BA	1
D7BB	1
D7BC	1
D7BD	1
D7BE	1
D7BF	1
D884	1
D885	1
D886	1
D887	1
D888	1
D889	1
D88A	1
D88B	1
D896	1
D897	1
D898	1
D899	1
D89A	1
D89C	1
D89D	1
D89E	1
D8A0	1
D8BB	1
D8BC	1
D8BD	1
D8BE	1
D8BF	1
D999	1
D99A	1
D99B	1
D99C	1
D99D	1
D99E	1
D99F	1
DC8E	1
DD8B	1
DD8C	1
DD90	1
DD91	1
DD92	1
DD93	1
DD94	1
DD95	1
DD96	1
DD97	1
DD98	1
DD99	1
DD9A	1
DD9B	1
DD9C	1
DD9D	1
DD9E	1
DD9F	1
DDA0	1
DDA1	1
DDA2	1
DDA3	1
DDA4	1
DDA5	1
DDA6	1
DDA7	1
DDA8	1
DDA9	1
DDAA	1
DDAB	1
DDAC	1
DDAD	1
DDAE	1
DDAF	1
DDB0	1
DDB1	1
DDB2	1
DDB3	1
DDB4	1
DDB5	1
DDB6	1
DDB7	1
DDB8	1
DDB9	1
DDBA	1
DDBB	1
DDBC	1
DDBD	1
DDBE	1
DDBF	1
DEB2	1
DEB3	1
DEB4	1
DEB5	1
DEB6	1
DEB7	1
DEB8	1
DEB9	1
DEBA	1
DEBB	1
DEBC	1
DEBD	1
DEBE	1
DEBF	1
DF80	1
DF81	1
DF82	1
DF83	1
DF84	1
DF85	1
DF86	1
DF87	1
DF88	1
DF89	1
DF8A	1
DF8B	1
DF8C	1
DF8D	1
DF8E	1
DF8F	1
DF90	1
DF91	1
DF92	1
DF93	1
DF94	1
DF95	1
DF96	1
DF97	1
DF98	1
DF99	1
DF9A	1
DF9B	1
DF9C	1
DF9D	1
DF9E	1
DF9F	1
DFA0	1
DFA1	1
DFA2	1
DFA3	1
DFA4	1
DFA5	1
DFA6	1
DFA7	1
DFA8	1
DFA9	1
DFAA	1
DFAB	1
DFAC	1
DFAD	1
DFAE	1
DFAF	1
DFB0	1
DFB1	1
DFB2	1
DFB3	1
DFB4	1
DFB5	1
DFB6	1
DFB7	1
DFB8	1
DFB9	1
DFBA	1
DFBB	1
DFBC	1
DFBD	1
DFBE	1
DFBF	1
DROP TABLE IF EXISTS test.t1;
DROP TABLE IF EXISTS test.t1;
DROP DATABASE test;
CREATE DATABASE test CHARACTER SET utf8mb3;
USE test;
CREATE TABLE test.t1 (a CHAR(4) CHARACTER SET utf8mb3 COLLATE utf8mb3_latvian_ci) ENGINE=MyISAM CHARACTER SET utf8mb3 COLLATE utf8mb3_latvian_ci;
Warnings:
Warning	1287	'utf8mb3' is deprecated and will be removed in a future release. Please use utf8mb4 instead
Warning	3778	'utf8mb3_latvian_ci' is a collation of the deprecated character set UTF8MB3. Please consider using UTF8MB4 with an appropriate collation instead.
Warning	1287	'utf8mb3' is deprecated and will be removed in a future release. Please use utf8mb4 instead
Warning	3778	'utf8mb3_latvian_ci' is a collation of the deprecated character set UTF8MB3. Please consider using UTF8MB4 with an appropriate collation instead.
SHOW TABLE STATUS LIKE 't1';
Name	Engine	Version	Row_format	Rows	Avg_row_length	Data_length	Max_data_length	Index_length	Data_free	Auto_increment	Create_time	Update_time	Check_time	Collation	Checksum	Create_options	Comment
t1	MyISAM	#	#	#	#	#	#	#	#	#	#	#	#	utf8mb3_latvian_ci	#	#	#
LOAD DATA INFILE 
'MYSQL_TEST_DIR/suite/funcs_2/data/charset_utf8.txt' INTO TABLE test.t1;
DELETE FROM test.t1 WHERE CHAR_LENGTH(a) <> 1;
SELECT HEX(ORD(a)) AS a_ord, CHAR_LENGTH(a) AS a_len FROM test.t1 ORDER BY a, ORD(a);
a_ord	a_len
C285	1
7F	1
C280	1
C281	1
C282	1
C283	1
C284	1
C286	1
C287	1
C288	1
C289	1
C28A	1
C28B	1
C28C	1
C28D	1
C28E	1
C28F	1
C290	1
C291	1
C292	1
C293	1
C294	1
C295	1
C296	1
C297	1
C298	1
C299	1
C29A	1
C29B	1
C29C	1
C29D	1
C29E	1
C29F	1
C2A0	1
CC80	1
CC81	1
CC82	1
CC83	1
CC84	1
CC85	1
CC86	1
CC87	1
CC88	1
CC89	1
CC8A	1
CC8B	1
CC8C	1
CC8D	1
CC8E	1
CC8F	1
CC90	1
CC91	1
CC92	1
CC93	1
CC94	1
CC95	1
CC96	1
CC97	1
CC98	1
CC99	1
CC9A	1
CC9B	1
CC9C	1
CC9D	1
CC9E	1
CC9F	1
CCA0	1
CCA1	1
CCA2	1
CCA3	1
CCA4	1
CCA5	1
CCA6	1
CCA7	1
CCA8	1
CCA9	1
CCAA	1
CCAB	1
CCAC	1
CCAD	1
CCAE	1
CCAF	1
CCB0	1
CCB1	1
CCB2	1
CCB3	1
CCB4	1
CCB5	1
CCB6	1
CCB7	1
CCB8	1
CCB9	1
CCBA	1
CCBB	1
CCBC	1
CCBD	1
CCBE	1
CCBF	1
CD80	1
CD81	1
CD82	1
CD83	1
CD84	1
CD85	1
CD86	1
CD87	1
CD88	1
CD89	1
CD8A	1
CD8B	1
CD8C	1
CD8D	1
CD8E	1
CD8F	1
CD90	1
CD91	1
CD92	1
CD93	1
CD94	1
CD95	1
CD96	1
CD97	1
CD9D	1
CD9E	1
CD9F	1
CDA0	1
CDA1	1
CDA2	1
D283	1
D284	1
D285	1
D286	1
D288	1
D289	1
D691	1
D692	1
D693	1
D694	1
D695	1
D696	1
D697	1
D698	1
D699	1
D69A	1
D69B	1
D69C	1
D69D	1
D69E	1
D69F	1
D6A0	1
D6A1	1
D6A3	1
D6A4	1
D6A5	1
D6A6	1
D6A7	1
D6A8	1
D6A9	1
D6AA	1
D6AB	1
D6AC	1
D6AD	1
D6AE	1
D6AF	1
D6B0	1
D6B1	1
D6B2	1
D6B3	1
D6B4	1
D6B5	1
D6B6	1
D6B7	1
D6B8	1
D6B9	1
D6BB	1
D6BC	1
D6BD	1
D6BF	1
D781	1
D782	1
D784	1
D880	1
D881	1
D882	1
D883	1
D890	1
D891	1
D892	1
D893	1
D894	1
D895	1
D98B	1
D98C	1
D98D	1
D98E	1
D98F	1
D990	1
D991	1
D992	1
D993	1
D994	1
D995	1
D996	1
D997	1
D998	1
D9B0	1
DB96	1
DB97	1
DB98	1
DB99	1
DB9A	1
DB9B	1
DB9C	1
DB9D	1
DB9E	1
DB9F	1
DBA0	1
DBA1	1
DBA2	1
DBA3	1
DBA4	1
DBA7	1
DBA8	1
DBAA	1
DBAB	1
DBAC	1
DBAD	1
DC8F	1
DC91	1
DCB0	1
DCB1	1
DCB2	1
DCB3	1
DCB4	1
DCB5	1
DCB6	1
DCB7	1
DCB8	1
DCB9	1
DCBA	1
DCBB	1
DCBC	1
DCBD	1
DCBE	1
DCBF	1
DD80	1
DD81	1
DD82	1
DD83	1
DD84	1
DD85	1
DD86	1
DD87	1
DD88	1
DD89	1
DD8A	1
D980	1
60	1
C2B4	1
CE84	1
CB9C	1
5E	1
C2AF	1
CB98	1
CB99	1
C2A8	1
CE85	1
CB9A	1
CB9D	1
C2B8	1
CB9B	1
5F	1
C2AD	1
2D	1
D68A	1
2C	1
D59D	1
D88C	1
D88D	1
D9AB	1
D9AC	1
3B	1
CDBE	1
D89B	1
3A	1
D689	1
DC83	1
DC84	1
DC85	1
DC86	1
DC87	1
DC88	1
21	1
C2A1	1
D59C	1
3F	1
C2BF	1
D59E	1
D89F	1
DC89	1
2E	1
DB94	1
DC81	1
DC82	1
C2B7	1
CE87	1
DC80	1
27	1
22	1
C2AB	1
C2BB	1
28	1
29	1
5B	1
7B	1
7D	1
C2A7	1
C2B6	1
C2A9	1
C2AE	1
40	1
2A	1
D9AD	1
2F	1
26	1
23	1
25	1
D9AA	1
D59A	1
D59B	1
D59F	1
D6BE	1
D780	1
D783	1
D7B3	1
D7B4	1
DC8A	1
DC8B	1
DC8C	1
DC8D	1
CAB9	1
CDB4	1
CDB5	1
CABA	1
CB82	1
CB83	1
CB84	1
CB85	1
CB86	1
CB87	1
CB88	1
CB89	1
CB8A	1
CB8B	1
CB8C	1
CB8D	1
CB8E	1
CB8F	1
CB92	1
CB93	1
CB94	1
CB95	1
CB96	1
CB97	1
CB9E	1
CB9F	1
CBA5	1
CBA6	1
CBA7	1
CBA8	1
CBA9	1
CBAA	1
CBAB	1
CBAC	1
CBAD	1
CBAF	1
CBB0	1
CBB1	1
CBB2	1
CBB3	1
CBB4	1
CBB5	1
CBB6	1
CBB7	1
CBB8	1
CBB9	1
CBBA	1
CBBB	1
CBBC	1
CBBD	1
CBBE	1
CBBF	1
C2B0	1
D282	1
D88E	1
D88F	1
DBA9	1
CFB6	1
2B	1
C2B1	1
C3B7	1
C397	1
3C	1
3D	1
3E	1
C2AC	1
7C	1
C2A6	1
7E	1
CB90	1
CB91	1
C2A4	1
C2A2	1
24	1
C2A3	1
C2A5	1
30	1
D9A0	1
DBB0	1
31	1
C2B9	1
D9A1	1
DBB1	1
C2BD	1
C2BC	1
32	1
C2B2	1
D9A2	1
DBB2	1
33	1
C2B3	1
D9A3	1
DBB3	1
C2BE	1
34	1
D9A4	1
DBB4	1
35	1
D9A5	1
DBB5	1
36	1
D9A6	1
DBB6	1
37	1
D9A7	1
DBB7	1
38	1
D9A8	1
DBB8	1
39	1
D9A9	1
DBB9	1
41	1
61	1
C2AA	1
C380	1
C381	1
C382	1
C383	1
C384	1
C385	1
C3A0	1
C3A1	1
C3A2	1
C3A3	1
C3A4	1
C3A5	1
C480	1
C481	1
C482	1
C483	1
C484	1
C485	1
C78D	1
C78E	1
C79E	1
C79F	1
C7A0	1
C7A1	1
C7BA	1
C7BB	1
C880	1
C881	1
C882	1
C883	1
C8A6	1
C8A7	1
CDA3	1
C386	1
C3A6	1
C7A2	1
C7A3	1
C7BC	1
C7BD	1
C990	1
C991	1
C992	1
42	1
62	1
CA99	1
C680	1
C681	1
C993	1
C682	1
C683	1
43	1
63	1
C387	1
C3A7	1
C486	1
C487	1
C488	1
C489	1
C48A	1
C48B	1
CDA8	1
C48C	1
C48D	1
C687	1
C688	1
C995	1
44	1
64	1
C48E	1
C48F	1
CDA9	1
C784	1
C785	1
C786	1
C7B1	1
C7B2	1
C7B3	1
CAA3	1
CAA5	1
CAA4	1
C490	1
C491	1
C689	1
C996	1
C68A	1
C997	1
C68B	1
C68C	1
C8A1	1
C390	1
C3B0	1
45	1
65	1
C388	1
C389	1
C38A	1
C38B	1
C3A8	1
C3A9	1
C3AA	1
C3AB	1
C492	1
C493	1
C494	1
C495	1
C496	1
C497	1
C498	1
C499	1
C49A	1
C49B	1
C884	1
C885	1
C886	1
C887	1
C8A8	1
C8A9	1
CDA4	1
C68E	1
C79D	1
C68F	1
C999	1
C690	1
C99B	1
C998	1
C99A	1
C99C	1
C99D	1
C99E	1
CA9A	1
C9A4	1
46	1
66	1
CAA9	1
C691	1
C692	1
47	1
67	1
C49C	1
C49D	1
C49E	1
C49F	1
C4A0	1
C4A1	1
C7A6	1
C7A7	1
C7B4	1
C7B5	1
C4A2	1
C4A3	1
C9A1	1
C9A2	1
C7A4	1
C7A5	1
C693	1
C9A0	1
CA9B	1
C694	1
C9A3	1
CBA0	1
C6A2	1
C6A3	1
48	1
68	1
C4A4	1
C4A5	1
C89E	1
C89F	1
CAB0	1
CDAA	1
CA9C	1
C695	1
C7B6	1
C4A6	1
C4A7	1
C9A6	1
CAB1	1
C9A7	1
CABB	1
CABD	1
49	1
69	1
C38C	1
C38D	1
C38E	1
C38F	1
C3AC	1
C3AD	1
C3AE	1
C3AF	1
C4A8	1
C4A9	1
C4AA	1
C4AB	1
C4AC	1
C4AD	1
C4AE	1
C4AF	1
C4B0	1
C78F	1
C790	1
C888	1
C889	1
C88A	1
C88B	1
CDA5	1
C4B2	1
C4B3	1
59	1
79	1
C4B1	1
C9AA	1
C697	1
C9A8	1
C696	1
C9A9	1
4A	1
6A	1
C4B4	1
C4B5	1
C7B0	1
CAB2	1
CA9D	1
C99F	1
CA84	1
4B	1
6B	1
C7A8	1
C7A9	1
C4B6	1
C4B7	1
C698	1
C699	1
CA9E	1
4C	1
6C	1
C4B9	1
C4BA	1
C4BD	1
C4BE	1
CBA1	1
C4BF	1
C580	1
C787	1
C788	1
C789	1
CAAA	1
CAAB	1
C4BB	1
C4BC	1
CA9F	1
C581	1
C582	1
C69A	1
C9AB	1
C9AC	1
C9AD	1
C8B4	1
C9AE	1
C69B	1
CA8E	1
4D	1
6D	1
CDAB	1
C9B1	1
4E	1
6E	1
C391	1
C3B1	1
C583	1
C584	1
C587	1
C588	1
C7B8	1
C7B9	1
C78A	1
C78B	1
C78C	1
C585	1
C586	1
C9B4	1
C69D	1
C9B2	1
C69E	1
C8A0	1
C9B3	1
C8B5	1
C58A	1
C58B	1
4F	1
6F	1
C2BA	1
C392	1
C393	1
C394	1
C395	1
C396	1
C3B2	1
C3B3	1
C3B4	1
C3B5	1
C3B6	1
C58C	1
C58D	1
C58E	1
C58F	1
C590	1
C591	1
C6A0	1
C6A1	1
C791	1
C792	1
C7AA	1
C7AB	1
C7AC	1
C7AD	1
C88C	1
C88D	1
C88E	1
C88F	1
C8AA	1
C8AB	1
C8AC	1
C8AD	1
C8AE	1
C8AF	1
C8B0	1
C8B1	1
CDA6	1
C592	1
C593	1
C9B6	1
C398	1
C3B8	1
C7BE	1
C7BF	1
C686	1
C994	1
C69F	1
C9B5	1
C9B7	1
C8A2	1
C8A3	1
50	1
70	1
C6A4	1
C6A5	1
C9B8	1
51	1
71	1
CAA0	1
C4B8	1
52	1
72	1
C594	1
C595	1
C598	1
C599	1
C890	1
C891	1
C892	1
C893	1
CAB3	1
CDAC	1
C596	1
C597	1
C6A6	1
CA80	1
C9B9	1
CAB4	1
C9BA	1
C9BB	1
CAB5	1
C9BC	1
C9BD	1
C9BE	1
C9BF	1
CA81	1
CAB6	1
53	1
73	1
C59A	1
C59B	1
C59C	1
C59D	1
C59E	1
C59F	1
C5BF	1
C898	1
C899	1
CBA2	1
C39F	1
C5A0	1
C5A1	1
CA82	1
C6A9	1
CA83	1
C6AA	1
CA85	1
CA86	1
54	1
74	1
C5A2	1
C5A3	1
C5A4	1
C5A5	1
C89A	1
C89B	1
CDAD	1
CAA8	1
C6BE	1
CAA6	1
CAA7	1
C5A6	1
C5A7	1
C6AB	1
C6AC	1
C6AD	1
C6AE	1
CA88	1
C8B6	1
CA87	1
55	1
75	1
C399	1
C39A	1
C39B	1
C39C	1
C3B9	1
C3BA	1
C3BB	1
C3BC	1
C5A8	1
C5A9	1
C5AA	1
C5AB	1
C5AC	1
C5AD	1
C5AE	1
C5AF	1
C5B0	1
C5B1	1
C5B2	1
C5B3	1
C6AF	1
C6B0	1
C793	1
C794	1
C795	1
C796	1
C797	1
C798	1
C799	1
C79A	1
C79B	1
C79C	1
C894	1
C895	1
C896	1
C897	1
CDA7	1
CA89	1
C9A5	1
CAAE	1
CAAF	1
C69C	1
C9AF	1
C9B0	1
C6B1	1
CA8A	1
56	1
76	1
CDAE	1
C6B2	1
CA8B	1
CA8C	1
57	1
77	1
C5B4	1
C5B5	1
CAB7	1
CA8D	1
58	1
78	1
CBA3	1
CDAF	1
C39D	1
C3BD	1
C3BF	1
C5B6	1
C5B7	1
C5B8	1
C8B2	1
C8B3	1
CAB8	1
CA8F	1
C6B3	1
C6B4	1
5A	1
7A	1
C5B9	1
C5BA	1
C5BB	1
C5BC	1
C68D	1
C5BD	1
C5BE	1
C6B5	1
C6B6	1
C8A4	1
C8A5	1
CA90	1
CA91	1
C6B7	1
C7AE	1
C7AF	1
CA92	1
C6B8	1
C6B9	1
C6BA	1
CA93	1
C89C	1
C89D	1
C39E	1
C3BE	1
C6BF	1
C7B7	1
C6BB	1
C6A7	1
C6A8	1
C6BC	1
C6BD	1
C684	1
C685	1
CA94	1
CB80	1
CABC	1
C589	1
CBAE	1
CABE	1
CA95	1
CBA4	1
CABF	1
CB81	1
CAA1	1
CAA2	1
CA96	1
C780	1
C781	1
C782	1
C783	1
CA97	1
CA98	1
CAAC	1
CAAD	1
CE86	1
CE91	1
CEAC	1
CEB1	1
CE92	1
CEB2	1
CF90	1
CE93	1
CEB3	1
CE94	1
CEB4	1
CE88	1
CE95	1
CEAD	1
CEB5	1
CFB5	1
CF9C	1
CF9D	1
CF9A	1
CF9B	1
CE96	1
CEB6	1
CE89	1
CE97	1
CEAE	1
CEB7	1
CE98	1
CEB8	1
CF91	1
CFB4	1
CDBA	1
CE8A	1
CE90	1
CE99	1
CEAA	1
CEAF	1
CEB9	1
CF8A	1
CFB3	1
CE9A	1
CEBA	1
CFB0	1
CF97	1
CE9B	1
CEBB	1
C2B5	1
CE9C	1
CEBC	1
CE9D	1
CEBD	1
CE9E	1
CEBE	1
CE8C	1
CE9F	1
CEBF	1
CF8C	1
CEA0	1
CF80	1
CF96	1
CF9E	1
CF9F	1
CF98	1
CF99	1
CEA1	1
CF81	1
CFB1	1
CEA3	1
CF82	1
CF83	1
CFB2	1
CFB9	1
CEA4	1
CF84	1
CE8E	1
CEA5	1
CEAB	1
CEB0	1
CF85	1
CF8B	1
CF8D	1
CF92	1
CF93	1
CF94	1
CEA6	1
CF86	1
CF95	1
CEA7	1
CF87	1
CEA8	1
CF88	1
CE8F	1
CEA9	1
CF89	1
CF8E	1
CFA0	1
CFA1	1
CFB7	1
CFB8	1
CFBA	1
CFBB	1
CFA2	1
CFA3	1
CFA4	1
CFA5	1
CFA6	1
CFA7	1
CFA8	1
CFA9	1
CFAA	1
CFAB	1
CFAC	1
CFAD	1
CFAE	1
CFAF	1
D090	1
D0B0	1
D390	1
D391	1
D392	1
D393	1
D398	1
D399	1
D39A	1
D39B	1
D394	1
D395	1
D091	1
D0B1	1
D092	1
D0B2	1
D093	1
D0B3	1
D290	1
D291	1
D292	1
D293	1
D294	1
D295	1
D094	1
D0B4	1
D480	1
D481	1
D082	1
D192	1
D482	1
D483	1
D083	1
D193	1
D298	1
D299	1
D080	1
D081	1
D095	1
D0B5	1
D190	1
D191	1
D396	1
D397	1
D084	1
D194	1
D096	1
D0B6	1
D381	1
D382	1
D39C	1
D39D	1
D296	1
D297	1
D097	1
D0B7	1
D484	1
D485	1
D39E	1
D39F	1
D085	1
D195	1
D3A0	1
D3A1	1
D486	1
D487	1
D08D	1
D098	1
D0B8	1
D19D	1
D3A2	1
D3A3	1
D28A	1
D28B	1
D3A4	1
D3A5	1
D086	1
D196	1
D087	1
D197	1
D099	1
D0B9	1
D088	1
D198	1
D09A	1
D0BA	1
D29A	1
D29B	1
D383	1
D384	1
D2A0	1
D2A1	1
D29E	1
D29F	1
D29C	1
D29D	1
D09B	1
D0BB	1
D385	1
D386	1
D089	1
D199	1
D488	1
D489	1
D09C	1
D0BC	1
D38D	1
D38E	1
D09D	1
D0BD	1
D389	1
D38A	1
D2A2	1
D2A3	1
D387	1
D388	1
D2A4	1
D2A5	1
D08A	1
D19A	1
D48A	1
D48B	1
D09E	1
D0BE	1
D3A6	1
D3A7	1
D3A8	1
D3A9	1
D3AA	1
D3AB	1
D09F	1
D0BF	1
D2A6	1
D2A7	1
D280	1
D281	1
D0A0	1
D180	1
D28E	1
D28F	1
D0A1	1
D181	1
D48C	1
D48D	1
D2AA	1
D2AB	1
D0A2	1
D182	1
D48E	1
D48F	1
D2AC	1
D2AD	1
D08B	1
D19B	1
D08C	1
D19C	1
D0A3	1
D183	1
D3AE	1
D3AF	1
D08E	1
D19E	1
D3B0	1
D3B1	1
D3B2	1
D3B3	1
D2AE	1
D2AF	1
D2B0	1
D2B1	1
D1B8	1
D1B9	1
D0A4	1
D184	1
D0A5	1
D185	1
D2B2	1
D2B3	1
D2BA	1
D2BB	1
D1A0	1
D1A1	1
D1BE	1
D1BF	1
D1BC	1
D1BD	1
D1BA	1
D1BB	1
D0A6	1
D186	1
D2B4	1
D2B5	1
D0A7	1
D187	1
D3B4	1
D3B5	1
D2B6	1
D2B7	1
D38B	1
D38C	1
D2B8	1
D2B9	1
D2BC	1
D2BD	1
D2BE	1
D2BF	1
D08F	1
D19F	1
D0A8	1
D188	1
D0A9	1
D189	1
D0AA	1
D18A	1
D0AB	1
D18B	1
D3B8	1
D3B9	1
D0AC	1
D18C	1
D28C	1
D28D	1
D1A2	1
D1A3	1
D0AD	1
D18D	1
D3AC	1
D3AD	1
D0AE	1
D18E	1
D0AF	1
D18F	1
D1A4	1
D1A5	1
D1A6	1
D1A7	1
D1AA	1
D1AB	1
D1A8	1
D1A9	1
D1AC	1
D1AD	1
D1AE	1
D1AF	1
D1B0	1
D1B1	1
D1B2	1
D1B3	1
D1B4	1
D1B5	1
D1B6	1
D1B7	1
D2A8	1
D2A9	1
D380	1
D4B1	1
D5A1	1
D4B2	1
D5A2	1
D4B3	1
D5A3	1
D4B4	1
D5A4	1
D4B5	1
D5A5	1
D687	1
D4B6	1
D5A6	1
D4B7	1
D5A7	1
D4B8	1
D5A8	1
D4B9	1
D5A9	1
D4BA	1
D5AA	1
D4BB	1
D5AB	1
D4BC	1
D5AC	1
D4BD	1
D5AD	1
D4BE	1
D5AE	1
D4BF	1
D5AF	1
D580	1
D5B0	1
D581	1
D5B1	1
D582	1
D5B2	1
D583	1
D5B3	1
D584	1
D5B4	1
D585	1
D5B5	1
D586	1
D5B6	1
D587	1
D5B7	1
D588	1
D5B8	1
D589	1
D5B9	1
D58A	1
D5BA	1
D58B	1
D5BB	1
D58C	1
D5BC	1
D58D	1
D5BD	1
D58E	1
D5BE	1
D58F	1
D5BF	1
D590	1
D680	1
D591	1
D681	1
D592	1
D682	1
D593	1
D683	1
D594	1
D684	1
D595	1
D685	1
D596	1
D686	1
D599	1
D790	1
D791	1
D792	1
D793	1
D794	1
D795	1
D7B0	1
D7B1	1
D796	1
D797	1
D798	1
D799	1
D7B2	1
D79A	1
D79B	1
D79C	1
D79D	1
D79E	1
D79F	1
D7A0	1
D7A1	1
D7A2	1
D7A3	1
D7A4	1
D7A5	1
D7A6	1
D7A7	1
D7A8	1
D7A9	1
D7AA	1
D8A1	1
D9B4	1
DBBD	1
D8A2	1
D8A3	1
D9B2	1
D9B1	1
D8A4	1
D8A5	1
D9B3	1
D8A6	1
D8A7	1
D9B5	1
D9AE	1
D8A8	1
D9BB	1
D9BE	1
DA80	1
D8A9	1
D8AA	1
D8AB	1
D9B9	1
D9BA	1
D9BC	1
D9BD	1
D9BF	1
D8AC	1
DA83	1
DA84	1
DA86	1
DABF	1
DA87	1
D8AD	1
D8AE	1
DA81	1
DA82	1
DA85	1
D8AF	1
D8B0	1
DA88	1
DA89	1
DA8A	1
DA8B	1
DA8C	1
DA8D	1
DA8E	1
DA8F	1
DA90	1
DBAE	1
D8B1	1
D8B2	1
DA91	1
DA92	1
DA93	1
DA94	1
DA95	1
DA96	1
DA97	1
DA98	1
DA99	1
DBAF	1
D8B3	1
D8B4	1
DA9A	1
DA9B	1
DA9C	1
DBBA	1
D8B5	1
D8B6	1
DA9D	1
DA9E	1
DBBB	1
D8B7	1
D8B8	1
DA9F	1
D8B9	1
D8BA	1
DAA0	1
DBBC	1
D981	1
DAA1	1
DAA2	1
DAA3	1
DAA4	1
DAA5	1
DAA6	1
D9AF	1
D982	1
DAA7	1
DAA8	1
D983	1
DAA9	1
DAAA	1
DAAB	1
DAAC	1
DAAD	1
DAAE	1
DAAF	1
DAB0	1
DAB1	1
DAB2	1
DAB3	1
DAB4	1
D984	1
DAB5	1
DAB6	1
DAB7	1
DAB8	1
D985	1
DBBE	1
D986	1
DABA	1
DABB	1
DABC	1
DABD	1
DAB9	1
D987	1
DABE	1
DB81	1
DB82	1
DB83	1
DBBF	1
DB80	1
DB95	1
D988	1
DBA5	1
D9B6	1
DB84	1
DB85	1
DB86	1
DB87	1
D9B7	1
DB88	1
DB89	1
DB8A	1
DB8B	1
DB8F	1
D989	1
D98A	1
DBA6	1
D9B8	1
DB8C	1
DB8D	1
DB8E	1
DB90	1
DB91	1
DB92	1
DB93	1
DC90	1
DC92	1
DCAD	1
DC93	1
DC94	1
DCAE	1
DC96	1
DC95	1
DCAF	1
DC97	1
DC98	1
DC99	1
DD8D	1
DC9A	1
DC9B	1
DC9C	1
DC9D	1
DC9E	1
DC9F	1
DD8E	1
DCA0	1
DCA1	1
DCA2	1
DCA3	1
DCA4	1
DCA5	1
DCA6	1
DCA7	1
DD8F	1
DCA8	1
DCA9	1
DCAA	1
DCAB	1
DCAC	1
DE80	1
DE99	1
DE9A	1
DE81	1
DE82	1
DE83	1
DE9C	1
DE84	1
DE85	1
DE86	1
DE87	1
DEA2	1
DEA3	1
DE88	1
DEA5	1
DE89	1
DE8A	1
DE8B	1
DE9B	1
DE8C	1
DE98	1
DEA0	1
DEA1	1
DE8D	1
DE8E	1
DEA4	1
DE8F	1
DE90	1
DE9D	1
DE9E	1
DE9F	1
DE91	1
DE92	1
DE93	1
DE94	1
DE95	1
DE96	1
DE97	1
DEB1	1
DEA6	1
DEA7	1
DEA8	1
DEA9	1
DEAA	1
DEAB	1
DEAC	1
DEAD	1
DEAE	1
DEAF	1
DEB0	1
E4B880	1
E4B881	1
E4B882	1
E4B883	1
E4B884	1
E4B885	1
E4B886	1
E4B887	1
E4B888	1
E4B889	1
E4B88A	1
E4B88B	1
E4B88C	1
E4B88D	1
E4B88E	1
E4B88F	1
E4B890	1
E4B891	1
E4B892	1
E4B893	1
E4B894	1
E4B895	1
E4B896	1
E4B897	1
E4B898	1
E4B899	1
E4B89A	1
E4B89B	1
E4B89C	1
E4B89D	1
E4B89E	1
E4B89F	1
E4B8A0	1
E4B8A1	1
E4B8A2	1
E4B8A3	1
E4B8A4	1
E4B8A5	1
E4B8A6	1
E4B8A7	1
E4B8A8	1
E4B8A9	1
E4B8AA	1
E4B8AB	1
E4B8AC	1
E4B8AD	1
E4B8AE	1
E4B8AF	1
E4B8B0	1
E4B8B1	1
E4B8B2	1
E4B8B3	1
E4B8B4	1
E4B8B5	1
E4B8B6	1
E4B8B7	1
E4B8B8	1
E4B8B9	1
E4B8BA	1
E4B8BB	1
E4B8BC	1
E4B8BD	1
E4B8BE	1
E4B8BF	1
E4B980	1
E4B981	1
E4B982	1
E4B983	1
E4B984	1
E4B985	1
E4B986	1
E4B987	1
E4B988	1
E4B989	1
E4B98A	1
E4B98B	1
E4B98C	1
E4B98D	1
E4B98E	1
E4B98F	1
E4B990	1
E4B991	1
E4B992	1
E4B993	1
E4B994	1
E4B995	1
E4B996	1
E4B997	1
E4B998	1
E4B999	1
E4B99A	1
E4B99B	1
E4B99C	1
E4B99D	1
E4B99E	1
E4B99F	1
E4B9A0	1
E4B9A1	1
E4B9A2	1
E4B9A3	1
E4B9A4	1
E4B9A5	1
E4B9A6	1
E4B9A7	1
E4B9A8	1
E4B9A9	1
E4B9AA	1
E4B9AB	1
E4B9AC	1
E4B9AD	1
E4B9AE	1
E4B9AF	1
E4B9B0	1
E4B9B1	1
E4B9B2	1
E4B9B3	1
E4B9B4	1
E4B9B5	1
E4B9B6	1
E4B9B7	1
E4B9B8	1
E4B9B9	1
E4B9BA	1
E4B9BB	1
E4B9BC	1
E4B9BD	1
E4B9BE	1
E4B9BF	1
E4BA80	1
E4BA81	1
E4BA82	1
E4BA83	1
E4BA84	1
E4BA85	1
E4BA86	1
E4BA87	1
E4BA88	1
E4BA89	1
E4BA8A	1
E4BA8B	1
E4BA8C	1
E4BA8D	1
E4BA8E	1
E4BA8F	1
E4BA90	1
E4BA91	1
E4BA92	1
E4BA93	1
E4BA94	1
E4BA95	1
E4BA96	1
E4BA97	1
E4BA98	1
E4BA99	1
E4BA9A	1
E4BA9B	1
E4BA9C	1
E4BA9D	1
E4BA9E	1
E4BA9F	1
E4BAA0	1
E4BAA1	1
E4BAA2	1
E4BAA3	1
E4BAA4	1
E4BAA5	1
E4BAA6	1
E4BAA7	1
E4BAA8	1
E4BAA9	1
E4BAAA	1
E4BAAB	1
E4BAAC	1
E4BAAD	1
E4BAAE	1
E4BAAF	1
E4BAB0	1
E4BAB1	1
E4BAB2	1
E4BAB3	1
E4BAB4	1
E4BAB5	1
E4BAB6	1
E4BAB7	1
E4BAB8	1
E4BAB9	1
E4BABA	1
E4BABB	1
E4BABC	1
E4BABD	1
E4BABE	1
E4BABF	1
E4BB80	1
E4BB81	1
E4BB82	1
E4BB83	1
E4BB84	1
E4BB85	1
E4BB86	1
E4BB87	1
E4BB88	1
E4BB89	1
E4BB8A	1
E4BB8B	1
E4BB8C	1
E4BB8D	1
E4BB8E	1
E4BB8F	1
E4BB90	1
E4BB91	1
E4BB92	1
E4BB93	1
E4BB94	1
E4BB95	1
E4BB96	1
E4BB97	1
E4BB98	1
E4BB99	1
E4BB9A	1
E4BB9B	1
E4BB9C	1
E4BB9D	1
E4BB9E	1
E4BB9F	1
E4BBA0	1
E4BBA1	1
E4BBA2	1
E4BBA3	1
E4BBA4	1
E4BBA5	1
E4BBA6	1
E4BBA7	1
E4BBA8	1
E4BBA9	1
E4BBAA	1
E4BBAB	1
E4BBAC	1
E4BBAD	1
E4BBAE	1
E4BBAF	1
E4BBB0	1
E4BBB1	1
E4BBB2	1
E4BBB3	1
E4BBB4	1
E4BBB5	1
E4BBB6	1
E4BBB7	1
E4BBB8	1
E4BBB9	1
E4BBBA	1
E4BBBB	1
E4BBBC	1
E4BBBD	1
E4BBBE	1
E4BBBF	1
E4BC80	1
E4BC81	1
E4BC82	1
E4BC83	1
E4BC84	1
E4BC85	1
E4BC86	1
E4BC87	1
E4BC88	1
E4BC89	1
E4BC8A	1
E4BC8B	1
E4BC8C	1
E4BC8D	1
E4BC8E	1
E4BC8F	1
E4BC90	1
E4BC91	1
E4BC92	1
E4BC93	1
E4BC94	1
E4BC95	1
E4BC96	1
E4BC97	1
E4BC98	1
E4BC99	1
E4BC9A	1
E4BC9B	1
E4BC9C	1
E4BC9D	1
E4BC9E	1
E4BC9F	1
E4BCA0	1
E4BCA1	1
E4BCA2	1
E4BCA3	1
E4BCA4	1
E4BCA5	1
E4BCA6	1
E4BCA7	1
E4BCA8	1
E4BCA9	1
E4BCAA	1
E4BCAB	1
E4BCAC	1
E4BCAD	1
E4BCAE	1
E4BCAF	1
E4BCB0	1
E4BCB1	1
E4BCB2	1
E4BCB3	1
E4BCB4	1
E4BCB5	1
E4BCB6	1
E4BCB7	1
E4BCB8	1
E4BCB9	1
E4BCBA	1
E4BCBB	1
E4BCBC	1
E4BCBD	1
E4BCBE	1
E4BCBF	1
E4BD80	1
E4BD81	1
E4BD82	1
E4BD83	1
E4BD84	1
E4BD85	1
E4BD86	1
E4BD87	1
E4BD88	1
E4BD89	1
E4BD8A	1
E4BD8B	1
E4BD8C	1
E4BD8D	1
E4BD8E	1
E4BD8F	1
E4BD90	1
E4BD91	1
E4BD92	1
E4BD93	1
E4BD94	1
E4BD95	1
E4BD96	1
E4BD97	1
E4BD98	1
E4BD99	1
E4BD9A	1
E4BD9B	1
E4BD9C	1
E4BD9D	1
E4BD9E	1
E4BD9F	1
E4BDA0	1
E4BDA1	1
E4BDA2	1
E4BDA3	1
E4BDA4	1
E4BDA5	1
E4BDA6	1
E4BDA7	1
E4BDA8	1
E4BDA9	1
E4BDAA	1
E4BDAB	1
E4BDAC	1
E4BDAD	1
E4BDAE	1
E4BDAF	1
E4BDB0	1
E4BDB1	1
E4BDB2	1
E4BDB3	1
E4BDB4	1
E4BDB5	1
E4BDB6	1
E4BDB7	1
E4BDB8	1
E4BDB9	1
E4BDBA	1
E4BDBB	1
E4BDBC	1
E4BDBD	1
E4BDBE	1
E4BDBF	1
E4BE80	1
E4BE81	1
E4BE82	1
E4BE83	1
E4BE84	1
E4BE85	1
E4BE86	1
E4BE87	1
E4BE88	1
E4BE89	1
E4BE8A	1
E4BE8B	1
E4BE8C	1
E4BE8D	1
E4BE8E	1
E4BE8F	1
E4BE90	1
E4BE91	1
E4BE92	1
E4BE93	1
E4BE94	1
E4BE95	1
E4BE96	1
E4BE97	1
E4BE98	1
E4BE99	1
E4BE9A	1
E4BE9B	1
E4BE9C	1
E4BE9D	1
E4BE9E	1
E4BE9F	1
E4BEA0	1
E4BEA1	1
E4BEA2	1
E4BEA3	1
E4BEA4	1
E4BEA5	1
E4BEA6	1
E4BEA7	1
E4BEA8	1
E4BEA9	1
E4BEAA	1
E4BEAB	1
E4BEAC	1
E4BEAD	1
E4BEAE	1
E4BEAF	1
E4BEB0	1
E4BEB1	1
E4BEB2	1
E4BEB3	1
E4BEB4	1
E4BEB5	1
E4BEB6	1
E4BEB7	1
E4BEB8	1
E4BEB9	1
E4BEBA	1
E4BEBB	1
E4BEBC	1
E4BEBD	1
E4BEBE	1
E4BEBF	1
E4BF80	1
E4BF81	1
E4BF82	1
E4BF83	1
E4BF84	1
E4BF85	1
E4BF86	1
E4BF87	1
E4BF88	1
E4BF89	1
E4BF8A	1
E4BF8B	1
E4BF8C	1
E4BF8D	1
E4BF8E	1
E4BF8F	1
E4BF90	1
E4BF91	1
E4BF92	1
E4BF93	1
E4BF94	1
E4BF95	1
E4BF96	1
E4BF97	1
E4BF98	1
E4BF99	1
E4BF9A	1
E4BF9B	1
E4BF9C	1
E4BF9D	1
E4BF9E	1
E4BF9F	1
E4BFA0	1
E4BFA1	1
E4BFA2	1
E4BFA3	1
E4BFA4	1
E4BFA5	1
E4BFA6	1
E4BFA7	1
E4BFA8	1
E4BFA9	1
E4BFAA	1
E4BFAB	1
E4BFAC	1
E4BFAD	1
E4BFAE	1
E4BFAF	1
E4BFB0	1
E4BFB1	1
E4BFB2	1
E4BFB3	1
E4BFB4	1
E4BFB5	1
E4BFB6	1
E4BFB7	1
E4BFB8	1
E4BFB9	1
E4BFBA	1
E4BFBB	1
E4BFBC	1
E4BFBD	1
E4BFBE	1
E4BFBF	1
C8B7	1
C8B8	1
C8B9	1
C8BA	1
C8BB	1
C8BC	1
C8BD	1
C8BE	1
C8BF	1
C980	1
C981	1
C982	1
C983	1
C984	1
C985	1
C986	1
C987	1
C988	1
C989	1
C98A	1
C98B	1
C98C	1
C98D	1
C98E	1
C98F	1
CD98	1
CD99	1
CD9A	1
CD9B	1
CD9C	1
CDB0	1
CDB1	1
CDB2	1
CDB3	1
CDB6	1
CDB7	1
CDB8	1
CDB9	1
CDBB	1
CDBC	1
CDBD	1
CDBF	1
CE80	1
CE81	1
CE82	1
CE83	1
CE8B	1
CE8D	1
CEA2	1
CF8F	1
CFBC	1
CFBD	1
CFBE	1
CFBF	1
D287	1
D38F	1
D3B6	1
D3B7	1
D3BA	1
D3BB	1
D3BC	1
D3BD	1
D3BE	1
D3BF	1
D490	1
D491	1
D492	1
D493	1
D494	1
D495	1
D496	1
D497	1
D498	1
D499	1
D49A	1
D49B	1
D49C	1
D49D	1
D49E	1
D49F	1
D4A0	1
D4A1	1
D4A2	1
D4A3	1
D4A4	1
D4A5	1
D4A6	1
D4A7	1
D4A8	1
D4A9	1
D4AA	1
D4AB	1
D4AC	1
D4AD	1
D4AE	1
D4AF	1
D4B0	1
D597	1
D598	1
D5A0	1
D688	1
D68B	1
D68C	1
D68D	1
D68E	1
D68F	1
D690	1
D6A2	1
D6BA	1
D785	1
D786	1
D787	1
D788	1
D789	1
D78A	1
D78B	1
D78C	1
D78D	1
D78E	1
D78F	1
D7AB	1
D7AC	1
D7AD	1
D7AE	1
D7AF	1
D7B5	1
D7B6	1
D7B7	1
D7B8	1
D7B9	1
D7BA	1
D7BB	1
D7BC	1
D7BD	1
D7BE	1
D7BF	1
D884	1
D885	1
D886	1
D887	1
D888	1
D889	1
D88A	1
D88B	1
D896	1
D897	1
D898	1
D899	1
D89A	1
D89C	1
D89D	1
D89E	1
D8A0	1
D8BB	1
D8BC	1
D8BD	1
D8BE	1
D8BF	1
D999	1
D99A	1
D99B	1
D99C	1
D99D	1
D99E	1
D99F	1
DC8E	1
DD8B	1
DD8C	1
DD90	1
DD91	1
DD92	1
DD93	1
DD94	1
DD95	1
DD96	1
DD97	1
DD98	1
DD99	1
DD9A	1
DD9B	1
DD9C	1
DD9D	1
DD9E	1
DD9F	1
DDA0	1
DDA1	1
DDA2	1
DDA3	1
DDA4	1
DDA5	1
DDA6	1
DDA7	1
DDA8	1
DDA9	1
DDAA	1
DDAB	1
DDAC	1
DDAD	1
DDAE	1
DDAF	1
DDB0	1
DDB1	1
DDB2	1
DDB3	1
DDB4	1
DDB5	1
DDB6	1
DDB7	1
DDB8	1
DDB9	1
DDBA	1
DDBB	1
DDBC	1
DDBD	1
DDBE	1
DDBF	1
DEB2	1
DEB3	1
DEB4	1
DEB5	1
DEB6	1
DEB7	1
DEB8	1
DEB9	1
DEBA	1
DEBB	1
DEBC	1
DEBD	1
DEBE	1
DEBF	1
DF80	1
DF81	1
DF82	1
DF83	1
DF84	1
DF85	1
DF86	1
DF87	1
DF88	1
DF89	1
DF8A	1
DF8B	1
DF8C	1
DF8D	1
DF8E	1
DF8F	1
DF90	1
DF91	1
DF92	1
DF93	1
DF94	1
DF95	1
DF96	1
DF97	1
DF98	1
DF99	1
DF9A	1
DF9B	1
DF9C	1
DF9D	1
DF9E	1
DF9F	1
DFA0	1
DFA1	1
DFA2	1
DFA3	1
DFA4	1
DFA5	1
DFA6	1
DFA7	1
DFA8	1
DFA9	1
DFAA	1
DFAB	1
DFAC	1
DFAD	1
DFAE	1
DFAF	1
DFB0	1
DFB1	1
DFB2	1
DFB3	1
DFB4	1
DFB5	1
DFB6	1
DFB7	1
DFB8	1
DFB9	1
DFBA	1
DFBB	1
DFBC	1
DFBD	1
DFBE	1
DFBF	1
DROP TABLE IF EXISTS test.t1;
DROP TABLE IF EXISTS test.t1;
DROP DATABASE test;
CREATE DATABASE test CHARACTER SET utf8mb3;
USE test;
CREATE TABLE test.t1 (a CHAR(4) CHARACTER SET utf8mb3 COLLATE utf8mb3_lithuanian_ci) ENGINE=MyISAM CHARACTER SET utf8mb3 COLLATE utf8mb3_lithuanian_ci;
Warnings:
Warning	1287	'utf8mb3' is deprecated and will be removed in a future release. Please use utf8mb4 instead
Warning	3778	'utf8mb3_lithuanian_ci' is a collation of the deprecated character set UTF8MB3. Please consider using UTF8MB4 with an appropriate collation instead.
Warning	1287	'utf8mb3' is deprecated and will be removed in a future release. Please use utf8mb4 instead
Warning	3778	'utf8mb3_lithuanian_ci' is a collation of the deprecated character set UTF8MB3. Please consider using UTF8MB4 with an appropriate collation instead.
SHOW TABLE STATUS LIKE 't1';
Name	Engine	Version	Row_format	Rows	Avg_row_length	Data_length	Max_data_length	Index_length	Data_free	Auto_increment	Create_time	Update_time	Check_time	Collation	Checksum	Create_options	Comment
t1	MyISAM	#	#	#	#	#	#	#	#	#	#	#	#	utf8mb3_lithuanian_ci	#	#	#
LOAD DATA INFILE 
'MYSQL_TEST_DIR/suite/funcs_2/data/charset_utf8.txt' INTO TABLE test.t1;
DELETE FROM test.t1 WHERE CHAR_LENGTH(a) <> 1;
SELECT HEX(ORD(a)) AS a_ord, CHAR_LENGTH(a) AS a_len FROM test.t1 ORDER BY a, ORD(a);
a_ord	a_len
C285	1
7F	1
C280	1
C281	1
C282	1
C283	1
C284	1
C286	1
C287	1
C288	1
C289	1
C28A	1
C28B	1
C28C	1
C28D	1
C28E	1
C28F	1
C290	1
C291	1
C292	1
C293	1
C294	1
C295	1
C296	1
C297	1
C298	1
C299	1
C29A	1
C29B	1
C29C	1
C29D	1
C29E	1
C29F	1
C2A0	1
CC80	1
CC81	1
CC82	1
CC83	1
CC84	1
CC85	1
CC86	1
CC87	1
CC88	1
CC89	1
CC8A	1
CC8B	1
CC8C	1
CC8D	1
CC8E	1
CC8F	1
CC90	1
CC91	1
CC92	1
CC93	1
CC94	1
CC95	1
CC96	1
CC97	1
CC98	1
CC99	1
CC9A	1
CC9B	1
CC9C	1
CC9D	1
CC9E	1
CC9F	1
CCA0	1
CCA1	1
CCA2	1
CCA3	1
CCA4	1
CCA5	1
CCA6	1
CCA7	1
CCA8	1
CCA9	1
CCAA	1
CCAB	1
CCAC	1
CCAD	1
CCAE	1
CCAF	1
CCB0	1
CCB1	1
CCB2	1
CCB3	1
CCB4	1
CCB5	1
CCB6	1
CCB7	1
CCB8	1
CCB9	1
CCBA	1
CCBB	1
CCBC	1
CCBD	1
CCBE	1
CCBF	1
CD80	1
CD81	1
CD82	1
CD83	1
CD84	1
CD85	1
CD86	1
CD87	1
CD88	1
CD89	1
CD8A	1
CD8B	1
CD8C	1
CD8D	1
CD8E	1
CD8F	1
CD90	1
CD91	1
CD92	1
CD93	1
CD94	1
CD95	1
CD96	1
CD97	1
CD9D	1
CD9E	1
CD9F	1
CDA0	1
CDA1	1
CDA2	1
D283	1
D284	1
D285	1
D286	1
D288	1
D289	1
D691	1
D692	1
D693	1
D694	1
D695	1
D696	1
D697	1
D698	1
D699	1
D69A	1
D69B	1
D69C	1
D69D	1
D69E	1
D69F	1
D6A0	1
D6A1	1
D6A3	1
D6A4	1
D6A5	1
D6A6	1
D6A7	1
D6A8	1
D6A9	1
D6AA	1
D6AB	1
D6AC	1
D6AD	1
D6AE	1
D6AF	1
D6B0	1
D6B1	1
D6B2	1
D6B3	1
D6B4	1
D6B5	1
D6B6	1
D6B7	1
D6B8	1
D6B9	1
D6BB	1
D6BC	1
D6BD	1
D6BF	1
D781	1
D782	1
D784	1
D880	1
D881	1
D882	1
D883	1
D890	1
D891	1
D892	1
D893	1
D894	1
D895	1
D98B	1
D98C	1
D98D	1
D98E	1
D98F	1
D990	1
D991	1
D992	1
D993	1
D994	1
D995	1
D996	1
D997	1
D998	1
D9B0	1
DB96	1
DB97	1
DB98	1
DB99	1
DB9A	1
DB9B	1
DB9C	1
DB9D	1
DB9E	1
DB9F	1
DBA0	1
DBA1	1
DBA2	1
DBA3	1
DBA4	1
DBA7	1
DBA8	1
DBAA	1
DBAB	1
DBAC	1
DBAD	1
DC8F	1
DC91	1
DCB0	1
DCB1	1
DCB2	1
DCB3	1
DCB4	1
DCB5	1
DCB6	1
DCB7	1
DCB8	1
DCB9	1
DCBA	1
DCBB	1
DCBC	1
DCBD	1
DCBE	1
DCBF	1
DD80	1
DD81	1
DD82	1
DD83	1
DD84	1
DD85	1
DD86	1
DD87	1
DD88	1
DD89	1
DD8A	1
D980	1
60	1
C2B4	1
CE84	1
CB9C	1
5E	1
C2AF	1
CB98	1
CB99	1
C2A8	1
CE85	1
CB9A	1
CB9D	1
C2B8	1
CB9B	1
5F	1
C2AD	1
2D	1
D68A	1
2C	1
D59D	1
D88C	1
D88D	1
D9AB	1
D9AC	1
3B	1
CDBE	1
D89B	1
3A	1
D689	1
DC83	1
DC84	1
DC85	1
DC86	1
DC87	1
DC88	1
21	1
C2A1	1
D59C	1
3F	1
C2BF	1
D59E	1
D89F	1
DC89	1
2E	1
DB94	1
DC81	1
DC82	1
C2B7	1
CE87	1
DC80	1
27	1
22	1
C2AB	1
C2BB	1
28	1
29	1
5B	1
7B	1
7D	1
C2A7	1
C2B6	1
C2A9	1
C2AE	1
40	1
2A	1
D9AD	1
2F	1
26	1
23	1
25	1
D9AA	1
D59A	1
D59B	1
D59F	1
D6BE	1
D780	1
D783	1
D7B3	1
D7B4	1
DC8A	1
DC8B	1
DC8C	1
DC8D	1
CAB9	1
CDB4	1
CDB5	1
CABA	1
CB82	1
CB83	1
CB84	1
CB85	1
CB86	1
CB87	1
CB88	1
CB89	1
CB8A	1
CB8B	1
CB8C	1
CB8D	1
CB8E	1
CB8F	1
CB92	1
CB93	1
CB94	1
CB95	1
CB96	1
CB97	1
CB9E	1
CB9F	1
CBA5	1
CBA6	1
CBA7	1
CBA8	1
CBA9	1
CBAA	1
CBAB	1
CBAC	1
CBAD	1
CBAF	1
CBB0	1
CBB1	1
CBB2	1
CBB3	1
CBB4	1
CBB5	1
CBB6	1
CBB7	1
CBB8	1
CBB9	1
CBBA	1
CBBB	1
CBBC	1
CBBD	1
CBBE	1
CBBF	1
C2B0	1
D282	1
D88E	1
D88F	1
DBA9	1
CFB6	1
2B	1
C2B1	1
C3B7	1
C397	1
3C	1
3D	1
3E	1
C2AC	1
7C	1
C2A6	1
7E	1
CB90	1
CB91	1
C2A4	1
C2A2	1
24	1
C2A3	1
C2A5	1
30	1
D9A0	1
DBB0	1
31	1
C2B9	1
D9A1	1
DBB1	1
C2BD	1
C2BC	1
32	1
C2B2	1
D9A2	1
DBB2	1
33	1
C2B3	1
D9A3	1
DBB3	1
C2BE	1
34	1
D9A4	1
DBB4	1
35	1
D9A5	1
DBB5	1
36	1
D9A6	1
DBB6	1
37	1
D9A7	1
DBB7	1
38	1
D9A8	1
DBB8	1
39	1
D9A9	1
DBB9	1
41	1
61	1
C2AA	1
C380	1
C381	1
C382	1
C383	1
C384	1
C385	1
C3A0	1
C3A1	1
C3A2	1
C3A3	1
C3A4	1
C3A5	1
C480	1
C481	1
C482	1
C483	1
C484	1
C485	1
C78D	1
C78E	1
C79E	1
C79F	1
C7A0	1
C7A1	1
C7BA	1
C7BB	1
C880	1
C881	1
C882	1
C883	1
C8A6	1
C8A7	1
CDA3	1
C386	1
C3A6	1
C7A2	1
C7A3	1
C7BC	1
C7BD	1
C990	1
C991	1
C992	1
42	1
62	1
CA99	1
C680	1
C681	1
C993	1
C682	1
C683	1
43	1
63	1
C387	1
C3A7	1
C486	1
C487	1
C488	1
C489	1
C48A	1
C48B	1
CDA8	1
C48C	1
C48D	1
C687	1
C688	1
C995	1
44	1
64	1
C48E	1
C48F	1
CDA9	1
C784	1
C785	1
C786	1
C7B1	1
C7B2	1
C7B3	1
CAA3	1
CAA5	1
CAA4	1
C490	1
C491	1
C689	1
C996	1
C68A	1
C997	1
C68B	1
C68C	1
C8A1	1
C390	1
C3B0	1
45	1
65	1
C388	1
C389	1
C38A	1
C38B	1
C3A8	1
C3A9	1
C3AA	1
C3AB	1
C492	1
C493	1
C494	1
C495	1
C496	1
C497	1
C498	1
C499	1
C49A	1
C49B	1
C884	1
C885	1
C886	1
C887	1
C8A8	1
C8A9	1
CDA4	1
C68E	1
C79D	1
C68F	1
C999	1
C690	1
C99B	1
C998	1
C99A	1
C99C	1
C99D	1
C99E	1
CA9A	1
C9A4	1
46	1
66	1
CAA9	1
C691	1
C692	1
47	1
67	1
C49C	1
C49D	1
C49E	1
C49F	1
C4A0	1
C4A1	1
C4A2	1
C4A3	1
C7A6	1
C7A7	1
C7B4	1
C7B5	1
C9A1	1
C9A2	1
C7A4	1
C7A5	1
C693	1
C9A0	1
CA9B	1
C694	1
C9A3	1
CBA0	1
C6A2	1
C6A3	1
48	1
68	1
C4A4	1
C4A5	1
C89E	1
C89F	1
CAB0	1
CDAA	1
CA9C	1
C695	1
C7B6	1
C4A6	1
C4A7	1
C9A6	1
CAB1	1
C9A7	1
CABB	1
CABD	1
49	1
59	1
69	1
79	1
C38C	1
C38D	1
C38E	1
C38F	1
C3AC	1
C3AD	1
C3AE	1
C3AF	1
C4A8	1
C4A9	1
C4AA	1
C4AB	1
C4AC	1
C4AD	1
C4AE	1
C4AF	1
C4B0	1
C78F	1
C790	1
C888	1
C889	1
C88A	1
C88B	1
CDA5	1
C4B2	1
C4B3	1
C4B1	1
C9AA	1
C697	1
C9A8	1
C696	1
C9A9	1
4A	1
6A	1
C4B4	1
C4B5	1
C7B0	1
CAB2	1
CA9D	1
C99F	1
CA84	1
4B	1
6B	1
C4B6	1
C4B7	1
C7A8	1
C7A9	1
C698	1
C699	1
CA9E	1
4C	1
6C	1
C4B9	1
C4BA	1
C4BB	1
C4BC	1
C4BD	1
C4BE	1
CBA1	1
C4BF	1
C580	1
C787	1
C788	1
C789	1
CAAA	1
CAAB	1
CA9F	1
C581	1
C582	1
C69A	1
C9AB	1
C9AC	1
C9AD	1
C8B4	1
C9AE	1
C69B	1
CA8E	1
4D	1
6D	1
CDAB	1
C9B1	1
4E	1
6E	1
C391	1
C3B1	1
C583	1
C584	1
C585	1
C586	1
C587	1
C588	1
C7B8	1
C7B9	1
C78A	1
C78B	1
C78C	1
C9B4	1
C69D	1
C9B2	1
C69E	1
C8A0	1
C9B3	1
C8B5	1
C58A	1
C58B	1
4F	1
6F	1
C2BA	1
C392	1
C393	1
C394	1
C395	1
C396	1
C3B2	1
C3B3	1
C3B4	1
C3B5	1
C3B6	1
C58C	1
C58D	1
C58E	1
C58F	1
C590	1
C591	1
C6A0	1
C6A1	1
C791	1
C792	1
C7AA	1
C7AB	1
C7AC	1
C7AD	1
C88C	1
C88D	1
C88E	1
C88F	1
C8AA	1
C8AB	1
C8AC	1
C8AD	1
C8AE	1
C8AF	1
C8B0	1
C8B1	1
CDA6	1
C592	1
C593	1
C9B6	1
C398	1
C3B8	1
C7BE	1
C7BF	1
C686	1
C994	1
C69F	1
C9B5	1
C9B7	1
C8A2	1
C8A3	1
50	1
70	1
C6A4	1
C6A5	1
C9B8	1
51	1
71	1
CAA0	1
C4B8	1
52	1
72	1
C594	1
C595	1
C596	1
C597	1
C598	1
C599	1
C890	1
C891	1
C892	1
C893	1
CAB3	1
CDAC	1
C6A6	1
CA80	1
C9B9	1
CAB4	1
C9BA	1
C9BB	1
CAB5	1
C9BC	1
C9BD	1
C9BE	1
C9BF	1
CA81	1
CAB6	1
53	1
73	1
C59A	1
C59B	1
C59C	1
C59D	1
C59E	1
C59F	1
C5BF	1
C898	1
C899	1
CBA2	1
C39F	1
C5A0	1
C5A1	1
CA82	1
C6A9	1
CA83	1
C6AA	1
CA85	1
CA86	1
54	1
74	1
C5A2	1
C5A3	1
C5A4	1
C5A5	1
C89A	1
C89B	1
CDAD	1
CAA8	1
C6BE	1
CAA6	1
CAA7	1
C5A6	1
C5A7	1
C6AB	1
C6AC	1
C6AD	1
C6AE	1
CA88	1
C8B6	1
CA87	1
55	1
75	1
C399	1
C39A	1
C39B	1
C39C	1
C3B9	1
C3BA	1
C3BB	1
C3BC	1
C5A8	1
C5A9	1
C5AA	1
C5AB	1
C5AC	1
C5AD	1
C5AE	1
C5AF	1
C5B0	1
C5B1	1
C5B2	1
C5B3	1
C6AF	1
C6B0	1
C793	1
C794	1
C795	1
C796	1
C797	1
C798	1
C799	1
C79A	1
C79B	1
C79C	1
C894	1
C895	1
C896	1
C897	1
CDA7	1
CA89	1
C9A5	1
CAAE	1
CAAF	1
C69C	1
C9AF	1
C9B0	1
C6B1	1
CA8A	1
56	1
76	1
CDAE	1
C6B2	1
CA8B	1
CA8C	1
57	1
77	1
C5B4	1
C5B5	1
CAB7	1
CA8D	1
58	1
78	1
CBA3	1
CDAF	1
C39D	1
C3BD	1
C3BF	1
C5B6	1
C5B7	1
C5B8	1
C8B2	1
C8B3	1
CAB8	1
CA8F	1
C6B3	1
C6B4	1
5A	1
7A	1
C5B9	1
C5BA	1
C5BB	1
C5BC	1
C68D	1
C5BD	1
C5BE	1
C6B5	1
C6B6	1
C8A4	1
C8A5	1
CA90	1
CA91	1
C6B7	1
C7AE	1
C7AF	1
CA92	1
C6B8	1
C6B9	1
C6BA	1
CA93	1
C89C	1
C89D	1
C39E	1
C3BE	1
C6BF	1
C7B7	1
C6BB	1
C6A7	1
C6A8	1
C6BC	1
C6BD	1
C684	1
C685	1
CA94	1
CB80	1
CABC	1
C589	1
CBAE	1
CABE	1
CA95	1
CBA4	1
CABF	1
CB81	1
CAA1	1
CAA2	1
CA96	1
C780	1
C781	1
C782	1
C783	1
CA97	1
CA98	1
CAAC	1
CAAD	1
CE86	1
CE91	1
CEAC	1
CEB1	1
CE92	1
CEB2	1
CF90	1
CE93	1
CEB3	1
CE94	1
CEB4	1
CE88	1
CE95	1
CEAD	1
CEB5	1
CFB5	1
CF9C	1
CF9D	1
CF9A	1
CF9B	1
CE96	1
CEB6	1
CE89	1
CE97	1
CEAE	1
CEB7	1
CE98	1
CEB8	1
CF91	1
CFB4	1
CDBA	1
CE8A	1
CE90	1
CE99	1
CEAA	1
CEAF	1
CEB9	1
CF8A	1
CFB3	1
CE9A	1
CEBA	1
CFB0	1
CF97	1
CE9B	1
CEBB	1
C2B5	1
CE9C	1
CEBC	1
CE9D	1
CEBD	1
CE9E	1
CEBE	1
CE8C	1
CE9F	1
CEBF	1
CF8C	1
CEA0	1
CF80	1
CF96	1
CF9E	1
CF9F	1
CF98	1
CF99	1
CEA1	1
CF81	1
CFB1	1
CEA3	1
CF82	1
CF83	1
CFB2	1
CFB9	1
CEA4	1
CF84	1
CE8E	1
CEA5	1
CEAB	1
CEB0	1
CF85	1
CF8B	1
CF8D	1
CF92	1
CF93	1
CF94	1
CEA6	1
CF86	1
CF95	1
CEA7	1
CF87	1
CEA8	1
CF88	1
CE8F	1
CEA9	1
CF89	1
CF8E	1
CFA0	1
CFA1	1
CFB7	1
CFB8	1
CFBA	1
CFBB	1
CFA2	1
CFA3	1
CFA4	1
CFA5	1
CFA6	1
CFA7	1
CFA8	1
CFA9	1
CFAA	1
CFAB	1
CFAC	1
CFAD	1
CFAE	1
CFAF	1
D090	1
D0B0	1
D390	1
D391	1
D392	1
D393	1
D398	1
D399	1
D39A	1
D39B	1
D394	1
D395	1
D091	1
D0B1	1
D092	1
D0B2	1
D093	1
D0B3	1
D290	1
D291	1
D292	1
D293	1
D294	1
D295	1
D094	1
D0B4	1
D480	1
D481	1
D082	1
D192	1
D482	1
D483	1
D083	1
D193	1
D298	1
D299	1
D080	1
D081	1
D095	1
D0B5	1
D190	1
D191	1
D396	1
D397	1
D084	1
D194	1
D096	1
D0B6	1
D381	1
D382	1
D39C	1
D39D	1
D296	1
D297	1
D097	1
D0B7	1
D484	1
D485	1
D39E	1
D39F	1
D085	1
D195	1
D3A0	1
D3A1	1
D486	1
D487	1
D08D	1
D098	1
D0B8	1
D19D	1
D3A2	1
D3A3	1
D28A	1
D28B	1
D3A4	1
D3A5	1
D086	1
D196	1
D087	1
D197	1
D099	1
D0B9	1
D088	1
D198	1
D09A	1
D0BA	1
D29A	1
D29B	1
D383	1
D384	1
D2A0	1
D2A1	1
D29E	1
D29F	1
D29C	1
D29D	1
D09B	1
D0BB	1
D385	1
D386	1
D089	1
D199	1
D488	1
D489	1
D09C	1
D0BC	1
D38D	1
D38E	1
D09D	1
D0BD	1
D389	1
D38A	1
D2A2	1
D2A3	1
D387	1
D388	1
D2A4	1
D2A5	1
D08A	1
D19A	1
D48A	1
D48B	1
D09E	1
D0BE	1
D3A6	1
D3A7	1
D3A8	1
D3A9	1
D3AA	1
D3AB	1
D09F	1
D0BF	1
D2A6	1
D2A7	1
D280	1
D281	1
D0A0	1
D180	1
D28E	1
D28F	1
D0A1	1
D181	1
D48C	1
D48D	1
D2AA	1
D2AB	1
D0A2	1
D182	1
D48E	1
D48F	1
D2AC	1
D2AD	1
D08B	1
D19B	1
D08C	1
D19C	1
D0A3	1
D183	1
D3AE	1
D3AF	1
D08E	1
D19E	1
D3B0	1
D3B1	1
D3B2	1
D3B3	1
D2AE	1
D2AF	1
D2B0	1
D2B1	1
D1B8	1
D1B9	1
D0A4	1
D184	1
D0A5	1
D185	1
D2B2	1
D2B3	1
D2BA	1
D2BB	1
D1A0	1
D1A1	1
D1BE	1
D1BF	1
D1BC	1
D1BD	1
D1BA	1
D1BB	1
D0A6	1
D186	1
D2B4	1
D2B5	1
D0A7	1
D187	1
D3B4	1
D3B5	1
D2B6	1
D2B7	1
D38B	1
D38C	1
D2B8	1
D2B9	1
D2BC	1
D2BD	1
D2BE	1
D2BF	1
D08F	1
D19F	1
D0A8	1
D188	1
D0A9	1
D189	1
D0AA	1
D18A	1
D0AB	1
D18B	1
D3B8	1
D3B9	1
D0AC	1
D18C	1
D28C	1
D28D	1
D1A2	1
D1A3	1
D0AD	1
D18D	1
D3AC	1
D3AD	1
D0AE	1
D18E	1
D0AF	1
D18F	1
D1A4	1
D1A5	1
D1A6	1
D1A7	1
D1AA	1
D1AB	1
D1A8	1
D1A9	1
D1AC	1
D1AD	1
D1AE	1
D1AF	1
D1B0	1
D1B1	1
D1B2	1
D1B3	1
D1B4	1
D1B5	1
D1B6	1
D1B7	1
D2A8	1
D2A9	1
D380	1
D4B1	1
D5A1	1
D4B2	1
D5A2	1
D4B3	1
D5A3	1
D4B4	1
D5A4	1
D4B5	1
D5A5	1
D687	1
D4B6	1
D5A6	1
D4B7	1
D5A7	1
D4B8	1
D5A8	1
D4B9	1
D5A9	1
D4BA	1
D5AA	1
D4BB	1
D5AB	1
D4BC	1
D5AC	1
D4BD	1
D5AD	1
D4BE	1
D5AE	1
D4BF	1
D5AF	1
D580	1
D5B0	1
D581	1
D5B1	1
D582	1
D5B2	1
D583	1
D5B3	1
D584	1
D5B4	1
D585	1
D5B5	1
D586	1
D5B6	1
D587	1
D5B7	1
D588	1
D5B8	1
D589	1
D5B9	1
D58A	1
D5BA	1
D58B	1
D5BB	1
D58C	1
D5BC	1
D58D	1
D5BD	1
D58E	1
D5BE	1
D58F	1
D5BF	1
D590	1
D680	1
D591	1
D681	1
D592	1
D682	1
D593	1
D683	1
D594	1
D684	1
D595	1
D685	1
D596	1
D686	1
D599	1
D790	1
D791	1
D792	1
D793	1
D794	1
D795	1
D7B0	1
D7B1	1
D796	1
D797	1
D798	1
D799	1
D7B2	1
D79A	1
D79B	1
D79C	1
D79D	1
D79E	1
D79F	1
D7A0	1
D7A1	1
D7A2	1
D7A3	1
D7A4	1
D7A5	1
D7A6	1
D7A7	1
D7A8	1
D7A9	1
D7AA	1
D8A1	1
D9B4	1
DBBD	1
D8A2	1
D8A3	1
D9B2	1
D9B1	1
D8A4	1
D8A5	1
D9B3	1
D8A6	1
D8A7	1
D9B5	1
D9AE	1
D8A8	1
D9BB	1
D9BE	1
DA80	1
D8A9	1
D8AA	1
D8AB	1
D9B9	1
D9BA	1
D9BC	1
D9BD	1
D9BF	1
D8AC	1
DA83	1
DA84	1
DA86	1
DABF	1
DA87	1
D8AD	1
D8AE	1
DA81	1
DA82	1
DA85	1
D8AF	1
D8B0	1
DA88	1
DA89	1
DA8A	1
DA8B	1
DA8C	1
DA8D	1
DA8E	1
DA8F	1
DA90	1
DBAE	1
D8B1	1
D8B2	1
DA91	1
DA92	1
DA93	1
DA94	1
DA95	1
DA96	1
DA97	1
DA98	1
DA99	1
DBAF	1
D8B3	1
D8B4	1
DA9A	1
DA9B	1
DA9C	1
DBBA	1
D8B5	1
D8B6	1
DA9D	1
DA9E	1
DBBB	1
D8B7	1
D8B8	1
DA9F	1
D8B9	1
D8BA	1
DAA0	1
DBBC	1
D981	1
DAA1	1
DAA2	1
DAA3	1
DAA4	1
DAA5	1
DAA6	1
D9AF	1
D982	1
DAA7	1
DAA8	1
D983	1
DAA9	1
DAAA	1
DAAB	1
DAAC	1
DAAD	1
DAAE	1
DAAF	1
DAB0	1
DAB1	1
DAB2	1
DAB3	1
DAB4	1
D984	1
DAB5	1
DAB6	1
DAB7	1
DAB8	1
D985	1
DBBE	1
D986	1
DABA	1
DABB	1
DABC	1
DABD	1
DAB9	1
D987	1
DABE	1
DB81	1
DB82	1
DB83	1
DBBF	1
DB80	1
DB95	1
D988	1
DBA5	1
D9B6	1
DB84	1
DB85	1
DB86	1
DB87	1
D9B7	1
DB88	1
DB89	1
DB8A	1
DB8B	1
DB8F	1
D989	1
D98A	1
DBA6	1
D9B8	1
DB8C	1
DB8D	1
DB8E	1
DB90	1
DB91	1
DB92	1
DB93	1
DC90	1
DC92	1
DCAD	1
DC93	1
DC94	1
DCAE	1
DC96	1
DC95	1
DCAF	1
DC97	1
DC98	1
DC99	1
DD8D	1
DC9A	1
DC9B	1
DC9C	1
DC9D	1
DC9E	1
DC9F	1
DD8E	1
DCA0	1
DCA1	1
DCA2	1
DCA3	1
DCA4	1
DCA5	1
DCA6	1
DCA7	1
DD8F	1
DCA8	1
DCA9	1
DCAA	1
DCAB	1
DCAC	1
DE80	1
DE99	1
DE9A	1
DE81	1
DE82	1
DE83	1
DE9C	1
DE84	1
DE85	1
DE86	1
DE87	1
DEA2	1
DEA3	1
DE88	1
DEA5	1
DE89	1
DE8A	1
DE8B	1
DE9B	1
DE8C	1
DE98	1
DEA0	1
DEA1	1
DE8D	1
DE8E	1
DEA4	1
DE8F	1
DE90	1
DE9D	1
DE9E	1
DE9F	1
DE91	1
DE92	1
DE93	1
DE94	1
DE95	1
DE96	1
DE97	1
DEB1	1
DEA6	1
DEA7	1
DEA8	1
DEA9	1
DEAA	1
DEAB	1
DEAC	1
DEAD	1
DEAE	1
DEAF	1
DEB0	1
E4B880	1
E4B881	1
E4B882	1
E4B883	1
E4B884	1
E4B885	1
E4B886	1
E4B887	1
E4B888	1
E4B889	1
E4B88A	1
E4B88B	1
E4B88C	1
E4B88D	1
E4B88E	1
E4B88F	1
E4B890	1
E4B891	1
E4B892	1
E4B893	1
E4B894	1
E4B895	1
E4B896	1
E4B897	1
E4B898	1
E4B899	1
E4B89A	1
E4B89B	1
E4B89C	1
E4B89D	1
E4B89E	1
E4B89F	1
E4B8A0	1
E4B8A1	1
E4B8A2	1
E4B8A3	1
E4B8A4	1
E4B8A5	1
E4B8A6	1
E4B8A7	1
E4B8A8	1
E4B8A9	1
E4B8AA	1
E4B8AB	1
E4B8AC	1
E4B8AD	1
E4B8AE	1
E4B8AF	1
E4B8B0	1
E4B8B1	1
E4B8B2	1
E4B8B3	1
E4B8B4	1
E4B8B5	1
E4B8B6	1
E4B8B7	1
E4B8B8	1
E4B8B9	1
E4B8BA	1
E4B8BB	1
E4B8BC	1
E4B8BD	1
E4B8BE	1
E4B8BF	1
E4B980	1
E4B981	1
E4B982	1
E4B983	1
E4B984	1
E4B985	1
E4B986	1
E4B987	1
E4B988	1
E4B989	1
E4B98A	1
E4B98B	1
E4B98C	1
E4B98D	1
E4B98E	1
E4B98F	1
E4B990	1
E4B991	1
E4B992	1
E4B993	1
E4B994	1
E4B995	1
E4B996	1
E4B997	1
E4B998	1
E4B999	1
E4B99A	1
E4B99B	1
E4B99C	1
E4B99D	1
E4B99E	1
E4B99F	1
E4B9A0	1
E4B9A1	1
E4B9A2	1
E4B9A3	1
E4B9A4	1
E4B9A5	1
E4B9A6	1
E4B9A7	1
E4B9A8	1
E4B9A9	1
E4B9AA	1
E4B9AB	1
E4B9AC	1
E4B9AD	1
E4B9AE	1
E4B9AF	1
E4B9B0	1
E4B9B1	1
E4B9B2	1
E4B9B3	1
E4B9B4	1
E4B9B5	1
E4B9B6	1
E4B9B7	1
E4B9B8	1
E4B9B9	1
E4B9BA	1
E4B9BB	1
E4B9BC	1
E4B9BD	1
E4B9BE	1
E4B9BF	1
E4BA80	1
E4BA81	1
E4BA82	1
E4BA83	1
E4BA84	1
E4BA85	1
E4BA86	1
E4BA87	1
E4BA88	1
E4BA89	1
E4BA8A	1
E4BA8B	1
E4BA8C	1
E4BA8D	1
E4BA8E	1
E4BA8F	1
E4BA90	1
E4BA91	1
E4BA92	1
E4BA93	1
E4BA94	1
E4BA95	1
E4BA96	1
E4BA97	1
E4BA98	1
E4BA99	1
E4BA9A	1
E4BA9B	1
E4BA9C	1
E4BA9D	1
E4BA9E	1
E4BA9F	1
E4BAA0	1
E4BAA1	1
E4BAA2	1
E4BAA3	1
E4BAA4	1
E4BAA5	1
E4BAA6	1
E4BAA7	1
E4BAA8	1
E4BAA9	1
E4BAAA	1
E4BAAB	1
E4BAAC	1
E4BAAD	1
E4BAAE	1
E4BAAF	1
E4BAB0	1
E4BAB1	1
E4BAB2	1
E4BAB3	1
E4BAB4	1
E4BAB5	1
E4BAB6	1
E4BAB7	1
E4BAB8	1
E4BAB9	1
E4BABA	1
E4BABB	1
E4BABC	1
E4BABD	1
E4BABE	1
E4BABF	1
E4BB80	1
E4BB81	1
E4BB82	1
E4BB83	1
E4BB84	1
E4BB85	1
E4BB86	1
E4BB87	1
E4BB88	1
E4BB89	1
E4BB8A	1
E4BB8B	1
E4BB8C	1
E4BB8D	1
E4BB8E	1
E4BB8F	1
E4BB90	1
E4BB91	1
E4BB92	1
E4BB93	1
E4BB94	1
E4BB95	1
E4BB96	1
E4BB97	1
E4BB98	1
E4BB99	1
E4BB9A	1
E4BB9B	1
E4BB9C	1
E4BB9D	1
E4BB9E	1
E4BB9F	1
E4BBA0	1
E4BBA1	1
E4BBA2	1
E4BBA3	1
E4BBA4	1
E4BBA5	1
E4BBA6	1
E4BBA7	1
E4BBA8	1
E4BBA9	1
E4BBAA	1
E4BBAB	1
E4BBAC	1
E4BBAD	1
E4BBAE	1
E4BBAF	1
E4BBB0	1
E4BBB1	1
E4BBB2	1
E4BBB3	1
E4BBB4	1
E4BBB5	1
E4BBB6	1
E4BBB7	1
E4BBB8	1
E4BBB9	1
E4BBBA	1
E4BBBB	1
E4BBBC	1
E4BBBD	1
E4BBBE	1
E4BBBF	1
E4BC80	1
E4BC81	1
E4BC82	1
E4BC83	1
E4BC84	1
E4BC85	1
E4BC86	1
E4BC87	1
E4BC88	1
E4BC89	1
E4BC8A	1
E4BC8B	1
E4BC8C	1
E4BC8D	1
E4BC8E	1
E4BC8F	1
E4BC90	1
E4BC91	1
E4BC92	1
E4BC93	1
E4BC94	1
E4BC95	1
E4BC96	1
E4BC97	1
E4BC98	1
E4BC99	1
E4BC9A	1
E4BC9B	1
E4BC9C	1
E4BC9D	1
E4BC9E	1
E4BC9F	1
E4BCA0	1
E4BCA1	1
E4BCA2	1
E4BCA3	1
E4BCA4	1
E4BCA5	1
E4BCA6	1
E4BCA7	1
E4BCA8	1
E4BCA9	1
E4BCAA	1
E4BCAB	1
E4BCAC	1
E4BCAD	1
E4BCAE	1
E4BCAF	1
E4BCB0	1
E4BCB1	1
E4BCB2	1
E4BCB3	1
E4BCB4	1
E4BCB5	1
E4BCB6	1
E4BCB7	1
E4BCB8	1
E4BCB9	1
E4BCBA	1
E4BCBB	1
E4BCBC	1
E4BCBD	1
E4BCBE	1
E4BCBF	1
E4BD80	1
E4BD81	1
E4BD82	1
E4BD83	1
E4BD84	1
E4BD85	1
E4BD86	1
E4BD87	1
E4BD88	1
E4BD89	1
E4BD8A	1
E4BD8B	1
E4BD8C	1
E4BD8D	1
E4BD8E	1
E4BD8F	1
E4BD90	1
E4BD91	1
E4BD92	1
E4BD93	1
E4BD94	1
E4BD95	1
E4BD96	1
E4BD97	1
E4BD98	1
E4BD99	1
E4BD9A	1
E4BD9B	1
E4BD9C	1
E4BD9D	1
E4BD9E	1
E4BD9F	1
E4BDA0	1
E4BDA1	1
E4BDA2	1
E4BDA3	1
E4BDA4	1
E4BDA5	1
E4BDA6	1
E4BDA7	1
E4BDA8	1
E4BDA9	1
E4BDAA	1
E4BDAB	1
E4BDAC	1
E4BDAD	1
E4BDAE	1
E4BDAF	1
E4BDB0	1
E4BDB1	1
E4BDB2	1
E4BDB3	1
E4BDB4	1
E4BDB5	1
E4BDB6	1
E4BDB7	1
E4BDB8	1
E4BDB9	1
E4BDBA	1
E4BDBB	1
E4BDBC	1
E4BDBD	1
E4BDBE	1
E4BDBF	1
E4BE80	1
E4BE81	1
E4BE82	1
E4BE83	1
E4BE84	1
E4BE85	1
E4BE86	1
E4BE87	1
E4BE88	1
E4BE89	1
E4BE8A	1
E4BE8B	1
E4BE8C	1
E4BE8D	1
E4BE8E	1
E4BE8F	1
E4BE90	1
E4BE91	1
E4BE92	1
E4BE93	1
E4BE94	1
E4BE95	1
E4BE96	1
E4BE97	1
E4BE98	1
E4BE99	1
E4BE9A	1
E4BE9B	1
E4BE9C	1
E4BE9D	1
E4BE9E	1
E4BE9F	1
E4BEA0	1
E4BEA1	1
E4BEA2	1
E4BEA3	1
E4BEA4	1
E4BEA5	1
E4BEA6	1
E4BEA7	1
E4BEA8	1
E4BEA9	1
E4BEAA	1
E4BEAB	1
E4BEAC	1
E4BEAD	1
E4BEAE	1
E4BEAF	1
E4BEB0	1
E4BEB1	1
E4BEB2	1
E4BEB3	1
E4BEB4	1
E4BEB5	1
E4BEB6	1
E4BEB7	1
E4BEB8	1
E4BEB9	1
E4BEBA	1
E4BEBB	1
E4BEBC	1
E4BEBD	1
E4BEBE	1
E4BEBF	1
E4BF80	1
E4BF81	1
E4BF82	1
E4BF83	1
E4BF84	1
E4BF85	1
E4BF86	1
E4BF87	1
E4BF88	1
E4BF89	1
E4BF8A	1
E4BF8B	1
E4BF8C	1
E4BF8D	1
E4BF8E	1
E4BF8F	1
E4BF90	1
E4BF91	1
E4BF92	1
E4BF93	1
E4BF94	1
E4BF95	1
E4BF96	1
E4BF97	1
E4BF98	1
E4BF99	1
E4BF9A	1
E4BF9B	1
E4BF9C	1
E4BF9D	1
E4BF9E	1
E4BF9F	1
E4BFA0	1
E4BFA1	1
E4BFA2	1
E4BFA3	1
E4BFA4	1
E4BFA5	1
E4BFA6	1
E4BFA7	1
E4BFA8	1
E4BFA9	1
E4BFAA	1
E4BFAB	1
E4BFAC	1
E4BFAD	1
E4BFAE	1
E4BFAF	1
E4BFB0	1
E4BFB1	1
E4BFB2	1
E4BFB3	1
E4BFB4	1
E4BFB5	1
E4BFB6	1
E4BFB7	1
E4BFB8	1
E4BFB9	1
E4BFBA	1
E4BFBB	1
E4BFBC	1
E4BFBD	1
E4BFBE	1
E4BFBF	1
C8B7	1
C8B8	1
C8B9	1
C8BA	1
C8BB	1
C8BC	1
C8BD	1
C8BE	1
C8BF	1
C980	1
C981	1
C982	1
C983	1
C984	1
C985	1
C986	1
C987	1
C988	1
C989	1
C98A	1
C98B	1
C98C	1
C98D	1
C98E	1
C98F	1
CD98	1
CD99	1
CD9A	1
CD9B	1
CD9C	1
CDB0	1
CDB1	1
CDB2	1
CDB3	1
CDB6	1
CDB7	1
CDB8	1
CDB9	1
CDBB	1
CDBC	1
CDBD	1
CDBF	1
CE80	1
CE81	1
CE82	1
CE83	1
CE8B	1
CE8D	1
CEA2	1
CF8F	1
CFBC	1
CFBD	1
CFBE	1
CFBF	1
D287	1
D38F	1
D3B6	1
D3B7	1
D3BA	1
D3BB	1
D3BC	1
D3BD	1
D3BE	1
D3BF	1
D490	1
D491	1
D492	1
D493	1
D494	1
D495	1
D496	1
D497	1
D498	1
D499	1
D49A	1
D49B	1
D49C	1
D49D	1
D49E	1
D49F	1
D4A0	1
D4A1	1
D4A2	1
D4A3	1
D4A4	1
D4A5	1
D4A6	1
D4A7	1
D4A8	1
D4A9	1
D4AA	1
D4AB	1
D4AC	1
D4AD	1
D4AE	1
D4AF	1
D4B0	1
D597	1
D598	1
D5A0	1
D688	1
D68B	1
D68C	1
D68D	1
D68E	1
D68F	1
D690	1
D6A2	1
D6BA	1
D785	1
D786	1
D787	1
D788	1
D789	1
D78A	1
D78B	1
D78C	1
D78D	1
D78E	1
D78F	1
D7AB	1
D7AC	1
D7AD	1
D7AE	1
D7AF	1
D7B5	1
D7B6	1
D7B7	1
D7B8	1
D7B9	1
D7BA	1
D7BB	1
D7BC	1
D7BD	1
D7BE	1
D7BF	1
D884	1
D885	1
D886	1
D887	1
D888	1
D889	1
D88A	1
D88B	1
D896	1
D897	1
D898	1
D899	1
D89A	1
D89C	1
D89D	1
D89E	1
D8A0	1
D8BB	1
D8BC	1
D8BD	1
D8BE	1
D8BF	1
D999	1
D99A	1
D99B	1
D99C	1
D99D	1
D99E	1
D99F	1
DC8E	1
DD8B	1
DD8C	1
DD90	1
DD91	1
DD92	1
DD93	1
DD94	1
DD95	1
DD96	1
DD97	1
DD98	1
DD99	1
DD9A	1
DD9B	1
DD9C	1
DD9D	1
DD9E	1
DD9F	1
DDA0	1
DDA1	1
DDA2	1
DDA3	1
DDA4	1
DDA5	1
DDA6	1
DDA7	1
DDA8	1
DDA9	1
DDAA	1
DDAB	1
DDAC	1
DDAD	1
DDAE	1
DDAF	1
DDB0	1
DDB1	1
DDB2	1
DDB3	1
DDB4	1
DDB5	1
DDB6	1
DDB7	1
DDB8	1
DDB9	1
DDBA	1
DDBB	1
DDBC	1
DDBD	1
DDBE	1
DDBF	1
DEB2	1
DEB3	1
DEB4	1
DEB5	1
DEB6	1
DEB7	1
DEB8	1
DEB9	1
DEBA	1
DEBB	1
DEBC	1
DEBD	1
DEBE	1
DEBF	1
DF80	1
DF81	1
DF82	1
DF83	1
DF84	1
DF85	1
DF86	1
DF87	1
DF88	1
DF89	1
DF8A	1
DF8B	1
DF8C	1
DF8D	1
DF8E	1
DF8F	1
DF90	1
DF91	1
DF92	1
DF93	1
DF94	1
DF95	1
DF96	1
DF97	1
DF98	1
DF99	1
DF9A	1
DF9B	1
DF9C	1
DF9D	1
DF9E	1
DF9F	1
DFA0	1
DFA1	1
DFA2	1
DFA3	1
DFA4	1
DFA5	1
DFA6	1
DFA7	1
DFA8	1
DFA9	1
DFAA	1
DFAB	1
DFAC	1
DFAD	1
DFAE	1
DFAF	1
DFB0	1
DFB1	1
DFB2	1
DFB3	1
DFB4	1
DFB5	1
DFB6	1
DFB7	1
DFB8	1
DFB9	1
DFBA	1
DFBB	1
DFBC	1
DFBD	1
DFBE	1
DFBF	1
DROP TABLE IF EXISTS test.t1;
DROP TABLE IF EXISTS test.t1;
DROP DATABASE test;
CREATE DATABASE test CHARACTER SET utf8mb3;
USE test;
CREATE TABLE test.t1 (a CHAR(4) CHARACTER SET utf8mb3 COLLATE utf8mb3_persian_ci) ENGINE=MyISAM CHARACTER SET utf8mb3 COLLATE utf8mb3_persian_ci;
Warnings:
Warning	1287	'utf8mb3' is deprecated and will be removed in a future release. Please use utf8mb4 instead
Warning	3778	'utf8mb3_persian_ci' is a collation of the deprecated character set UTF8MB3. Please consider using UTF8MB4 with an appropriate collation instead.
Warning	1287	'utf8mb3' is deprecated and will be removed in a future release. Please use utf8mb4 instead
Warning	3778	'utf8mb3_persian_ci' is a collation of the deprecated character set UTF8MB3. Please consider using UTF8MB4 with an appropriate collation instead.
SHOW TABLE STATUS LIKE 't1';
Name	Engine	Version	Row_format	Rows	Avg_row_length	Data_length	Max_data_length	Index_length	Data_free	Auto_increment	Create_time	Update_time	Check_time	Collation	Checksum	Create_options	Comment
t1	MyISAM	#	#	#	#	#	#	#	#	#	#	#	#	utf8mb3_persian_ci	#	#	#
LOAD DATA INFILE 
'MYSQL_TEST_DIR/suite/funcs_2/data/charset_utf8.txt' INTO TABLE test.t1;
DELETE FROM test.t1 WHERE CHAR_LENGTH(a) <> 1;
SELECT HEX(ORD(a)) AS a_ord, CHAR_LENGTH(a) AS a_len FROM test.t1 ORDER BY a, ORD(a);
a_ord	a_len
D993	1
D994	1
D995	1
D9B0	1
C285	1
7F	1
C280	1
C281	1
C282	1
C283	1
C284	1
C286	1
C287	1
C288	1
C289	1
C28A	1
C28B	1
C28C	1
C28D	1
C28E	1
C28F	1
C290	1
C291	1
C292	1
C293	1
C294	1
C295	1
C296	1
C297	1
C298	1
C299	1
C29A	1
C29B	1
C29C	1
C29D	1
C29E	1
C29F	1
C2A0	1
CC80	1
CC81	1
CC82	1
CC83	1
CC84	1
CC85	1
CC86	1
CC87	1
CC88	1
CC89	1
CC8A	1
CC8B	1
CC8C	1
CC8D	1
CC8E	1
CC8F	1
CC90	1
CC91	1
CC92	1
CC93	1
CC94	1
CC95	1
CC96	1
CC97	1
CC98	1
CC99	1
CC9A	1
CC9B	1
CC9C	1
CC9D	1
CC9E	1
CC9F	1
CCA0	1
CCA1	1
CCA2	1
CCA3	1
CCA4	1
CCA5	1
CCA6	1
CCA7	1
CCA8	1
CCA9	1
CCAA	1
CCAB	1
CCAC	1
CCAD	1
CCAE	1
CCAF	1
CCB0	1
CCB1	1
CCB2	1
CCB3	1
CCB4	1
CCB5	1
CCB6	1
CCB7	1
CCB8	1
CCB9	1
CCBA	1
CCBB	1
CCBC	1
CCBD	1
CCBE	1
CCBF	1
CD80	1
CD81	1
CD82	1
CD83	1
CD84	1
CD85	1
CD86	1
CD87	1
CD88	1
CD89	1
CD8A	1
CD8B	1
CD8C	1
CD8D	1
CD8E	1
CD8F	1
CD90	1
CD91	1
CD92	1
CD93	1
CD94	1
CD95	1
CD96	1
CD97	1
CD9D	1
CD9E	1
CD9F	1
CDA0	1
CDA1	1
CDA2	1
D283	1
D284	1
D285	1
D286	1
D288	1
D289	1
D691	1
D692	1
D693	1
D694	1
D695	1
D696	1
D697	1
D698	1
D699	1
D69A	1
D69B	1
D69C	1
D69D	1
D69E	1
D69F	1
D6A0	1
D6A1	1
D6A3	1
D6A4	1
D6A5	1
D6A6	1
D6A7	1
D6A8	1
D6A9	1
D6AA	1
D6AB	1
D6AC	1
D6AD	1
D6AE	1
D6AF	1
D6B0	1
D6B1	1
D6B2	1
D6B3	1
D6B4	1
D6B5	1
D6B6	1
D6B7	1
D6B8	1
D6B9	1
D6BB	1
D6BC	1
D6BD	1
D6BF	1
D781	1
D782	1
D784	1
D880	1
D881	1
D882	1
D883	1
D890	1
D891	1
D892	1
D893	1
D894	1
D895	1
D991	1
D992	1
D996	1
D997	1
D998	1
DB96	1
DB97	1
DB98	1
DB99	1
DB9A	1
DB9B	1
DB9C	1
DB9D	1
DB9E	1
DB9F	1
DBA0	1
DBA1	1
DBA2	1
DBA3	1
DBA4	1
DBA7	1
DBA8	1
DBAA	1
DBAB	1
DBAC	1
DBAD	1
DC8F	1
DC91	1
DCB0	1
DCB1	1
DCB2	1
DCB3	1
DCB4	1
DCB5	1
DCB6	1
DCB7	1
DCB8	1
DCB9	1
DCBA	1
DCBB	1
DCBC	1
DCBD	1
DCBE	1
DCBF	1
DD80	1
DD81	1
DD82	1
DD83	1
DD84	1
DD85	1
DD86	1
DD87	1
DD88	1
DD89	1
DD8A	1
D980	1
60	1
C2B4	1
CE84	1
CB9C	1
5E	1
C2AF	1
CB98	1
CB99	1
C2A8	1
CE85	1
CB9A	1
CB9D	1
C2B8	1
CB9B	1
5F	1
C2AD	1
2D	1
D68A	1
2C	1
D59D	1
D88C	1
D88D	1
D9AB	1
D9AC	1
3B	1
CDBE	1
D89B	1
3A	1
D689	1
DC83	1
DC84	1
DC85	1
DC86	1
DC87	1
DC88	1
21	1
C2A1	1
D59C	1
3F	1
C2BF	1
D59E	1
D89F	1
DC89	1
2E	1
DB94	1
DC81	1
DC82	1
C2B7	1
CE87	1
DC80	1
27	1
22	1
C2AB	1
C2BB	1
28	1
29	1
5B	1
7B	1
7D	1
C2A7	1
C2B6	1
C2A9	1
C2AE	1
40	1
2A	1
D9AD	1
2F	1
D98E	1
26	1
D990	1
23	1
D98F	1
25	1
D9AA	1
D98B	1
D98D	1
D98C	1
D59A	1
D59B	1
D59F	1
D6BE	1
D780	1
D783	1
D7B3	1
D7B4	1
DC8A	1
DC8B	1
DC8C	1
DC8D	1
CAB9	1
CDB4	1
CDB5	1
CABA	1
CB82	1
CB83	1
CB84	1
CB85	1
CB86	1
CB87	1
CB88	1
CB89	1
CB8A	1
CB8B	1
CB8C	1
CB8D	1
CB8E	1
CB8F	1
CB92	1
CB93	1
CB94	1
CB95	1
CB96	1
CB97	1
CB9E	1
CB9F	1
CBA5	1
CBA6	1
CBA7	1
CBA8	1
CBA9	1
CBAA	1
CBAB	1
CBAC	1
CBAD	1
CBAF	1
CBB0	1
CBB1	1
CBB2	1
CBB3	1
CBB4	1
CBB5	1
CBB6	1
CBB7	1
CBB8	1
CBB9	1
CBBA	1
CBBB	1
CBBC	1
CBBD	1
CBBE	1
CBBF	1
C2B0	1
D282	1
D88E	1
D88F	1
DBA9	1
CFB6	1
2B	1
C2B1	1
C3B7	1
C397	1
3C	1
3D	1
3E	1
C2AC	1
7C	1
C2A6	1
7E	1
CB90	1
CB91	1
C2A4	1
C2A2	1
24	1
C2A3	1
C2A5	1
30	1
D9A0	1
DBB0	1
31	1
C2B9	1
D9A1	1
DBB1	1
C2BD	1
C2BC	1
32	1
C2B2	1
D9A2	1
DBB2	1
33	1
C2B3	1
D9A3	1
DBB3	1
C2BE	1
34	1
D9A4	1
DBB4	1
35	1
D9A5	1
DBB5	1
36	1
D9A6	1
DBB6	1
37	1
D9A7	1
DBB7	1
38	1
D9A8	1
DBB8	1
39	1
D9A9	1
DBB9	1
41	1
61	1
C2AA	1
C380	1
C381	1
C382	1
C383	1
C384	1
C385	1
C3A0	1
C3A1	1
C3A2	1
C3A3	1
C3A4	1
C3A5	1
C480	1
C481	1
C482	1
C483	1
C484	1
C485	1
C78D	1
C78E	1
C79E	1
C79F	1
C7A0	1
C7A1	1
C7BA	1
C7BB	1
C880	1
C881	1
C882	1
C883	1
C8A6	1
C8A7	1
CDA3	1
D8A2	1
D8A7	1
D9B1	1
D8A1	1
D8A3	1
C386	1
C3A6	1
C7A2	1
C7A3	1
C7BC	1
C7BD	1
D8A5	1
D8A4	1
D8A6	1
C990	1
C991	1
C992	1
42	1
62	1
CA99	1
C680	1
C681	1
C993	1
C682	1
C683	1
43	1
63	1
C387	1
C3A7	1
C486	1
C487	1
C488	1
C489	1
C48A	1
C48B	1
C48C	1
C48D	1
CDA8	1
C687	1
C688	1
C995	1
44	1
64	1
C48E	1
C48F	1
CDA9	1
C784	1
C785	1
C786	1
C7B1	1
C7B2	1
C7B3	1
CAA3	1
CAA5	1
CAA4	1
C490	1
C491	1
C689	1
C996	1
C68A	1
C997	1
C68B	1
C68C	1
C8A1	1
C390	1
C3B0	1
45	1
65	1
C388	1
C389	1
C38A	1
C38B	1
C3A8	1
C3A9	1
C3AA	1
C3AB	1
C492	1
C493	1
C494	1
C495	1
C496	1
C497	1
C498	1
C499	1
C49A	1
C49B	1
C884	1
C885	1
C886	1
C887	1
C8A8	1
C8A9	1
CDA4	1
C68E	1
C79D	1
C68F	1
C999	1
C690	1
C99B	1
C998	1
C99A	1
C99C	1
C99D	1
C99E	1
CA9A	1
C9A4	1
46	1
66	1
CAA9	1
C691	1
C692	1
47	1
67	1
C49C	1
C49D	1
C49E	1
C49F	1
C4A0	1
C4A1	1
C4A2	1
C4A3	1
C7A6	1
C7A7	1
C7B4	1
C7B5	1
C9A1	1
C9A2	1
C7A4	1
C7A5	1
C693	1
C9A0	1
CA9B	1
C694	1
C9A3	1
CBA0	1
C6A2	1
C6A3	1
48	1
68	1
C4A4	1
C4A5	1
C89E	1
C89F	1
CAB0	1
CDAA	1
CA9C	1
C695	1
C7B6	1
C4A6	1
C4A7	1
C9A6	1
CAB1	1
C9A7	1
CABB	1
CABD	1
49	1
69	1
C38C	1
C38D	1
C38E	1
C38F	1
C3AC	1
C3AD	1
C3AE	1
C3AF	1
C4A8	1
C4A9	1
C4AA	1
C4AB	1
C4AC	1
C4AD	1
C4AE	1
C4AF	1
C4B0	1
C78F	1
C790	1
C888	1
C889	1
C88A	1
C88B	1
CDA5	1
C4B2	1
C4B3	1
C4B1	1
C9AA	1
C697	1
C9A8	1
C696	1
C9A9	1
4A	1
6A	1
C4B4	1
C4B5	1
C7B0	1
CAB2	1
CA9D	1
C99F	1
CA84	1
4B	1
6B	1
C4B6	1
C4B7	1
C7A8	1
C7A9	1
C698	1
C699	1
CA9E	1
4C	1
6C	1
C4B9	1
C4BA	1
C4BB	1
C4BC	1
C4BD	1
C4BE	1
CBA1	1
C4BF	1
C580	1
C787	1
C788	1
C789	1
CAAA	1
CAAB	1
CA9F	1
C581	1
C582	1
C69A	1
C9AB	1
C9AC	1
C9AD	1
C8B4	1
C9AE	1
C69B	1
CA8E	1
4D	1
6D	1
CDAB	1
C9B1	1
4E	1
6E	1
C391	1
C3B1	1
C583	1
C584	1
C585	1
C586	1
C587	1
C588	1
C7B8	1
C7B9	1
C78A	1
C78B	1
C78C	1
C9B4	1
C69D	1
C9B2	1
C69E	1
C8A0	1
C9B3	1
C8B5	1
C58A	1
C58B	1
4F	1
6F	1
C2BA	1
C392	1
C393	1
C394	1
C395	1
C396	1
C3B2	1
C3B3	1
C3B4	1
C3B5	1
C3B6	1
C58C	1
C58D	1
C58E	1
C58F	1
C590	1
C591	1
C6A0	1
C6A1	1
C791	1
C792	1
C7AA	1
C7AB	1
C7AC	1
C7AD	1
C88C	1
C88D	1
C88E	1
C88F	1
C8AA	1
C8AB	1
C8AC	1
C8AD	1
C8AE	1
C8AF	1
C8B0	1
C8B1	1
CDA6	1
C592	1
C593	1
C9B6	1
C398	1
C3B8	1
C7BE	1
C7BF	1
C686	1
C994	1
C69F	1
C9B5	1
C9B7	1
C8A2	1
C8A3	1
50	1
70	1
C6A4	1
C6A5	1
C9B8	1
51	1
71	1
CAA0	1
C4B8	1
52	1
72	1
C594	1
C595	1
C596	1
C597	1
C598	1
C599	1
C890	1
C891	1
C892	1
C893	1
CAB3	1
CDAC	1
C6A6	1
CA80	1
C9B9	1
CAB4	1
C9BA	1
C9BB	1
CAB5	1
C9BC	1
C9BD	1
C9BE	1
C9BF	1
CA81	1
CAB6	1
53	1
73	1
C59A	1
C59B	1
C59C	1
C59D	1
C59E	1
C59F	1
C5A0	1
C5A1	1
C5BF	1
C898	1
C899	1
CBA2	1
C39F	1
CA82	1
C6A9	1
CA83	1
C6AA	1
CA85	1
CA86	1
54	1
74	1
C5A2	1
C5A3	1
C5A4	1
C5A5	1
C89A	1
C89B	1
CDAD	1
CAA8	1
C6BE	1
CAA6	1
CAA7	1
C5A6	1
C5A7	1
C6AB	1
C6AC	1
C6AD	1
C6AE	1
CA88	1
C8B6	1
CA87	1
55	1
75	1
C399	1
C39A	1
C39B	1
C39C	1
C3B9	1
C3BA	1
C3BB	1
C3BC	1
C5A8	1
C5A9	1
C5AA	1
C5AB	1
C5AC	1
C5AD	1
C5AE	1
C5AF	1
C5B0	1
C5B1	1
C5B2	1
C5B3	1
C6AF	1
C6B0	1
C793	1
C794	1
C795	1
C796	1
C797	1
C798	1
C799	1
C79A	1
C79B	1
C79C	1
C894	1
C895	1
C896	1
C897	1
CDA7	1
CA89	1
C9A5	1
CAAE	1
CAAF	1
C69C	1
C9AF	1
C9B0	1
C6B1	1
CA8A	1
56	1
76	1
CDAE	1
C6B2	1
CA8B	1
CA8C	1
57	1
77	1
C5B4	1
C5B5	1
CAB7	1
CA8D	1
58	1
78	1
CBA3	1
CDAF	1
59	1
79	1
C39D	1
C3BD	1
C3BF	1
C5B6	1
C5B7	1
C5B8	1
C8B2	1
C8B3	1
CAB8	1
CA8F	1
C6B3	1
C6B4	1
5A	1
7A	1
C5B9	1
C5BA	1
C5BB	1
C5BC	1
C5BD	1
C5BE	1
C68D	1
C6B5	1
C6B6	1
C8A4	1
C8A5	1
CA90	1
CA91	1
C6B7	1
C7AE	1
C7AF	1
CA92	1
C6B8	1
C6B9	1
C6BA	1
CA93	1
C89C	1
C89D	1
C39E	1
C3BE	1
C6BF	1
C7B7	1
C6BB	1
C6A7	1
C6A8	1
C6BC	1
C6BD	1
C684	1
C685	1
CA94	1
CB80	1
CABC	1
C589	1
CBAE	1
CABE	1
CA95	1
CBA4	1
CABF	1
CB81	1
CAA1	1
CAA2	1
CA96	1
C780	1
C781	1
C782	1
C783	1
CA97	1
CA98	1
CAAC	1
CAAD	1
CE86	1
CE91	1
CEAC	1
CEB1	1
CE92	1
CEB2	1
CF90	1
CE93	1
CEB3	1
CE94	1
CEB4	1
CE88	1
CE95	1
CEAD	1
CEB5	1
CFB5	1
CF9C	1
CF9D	1
CF9A	1
CF9B	1
CE96	1
CEB6	1
CE89	1
CE97	1
CEAE	1
CEB7	1
CE98	1
CEB8	1
CF91	1
CFB4	1
CDBA	1
CE8A	1
CE90	1
CE99	1
CEAA	1
CEAF	1
CEB9	1
CF8A	1
CFB3	1
CE9A	1
CEBA	1
CFB0	1
CF97	1
CE9B	1
CEBB	1
C2B5	1
CE9C	1
CEBC	1
CE9D	1
CEBD	1
CE9E	1
CEBE	1
CE8C	1
CE9F	1
CEBF	1
CF8C	1
CEA0	1
CF80	1
CF96	1
CF9E	1
CF9F	1
CF98	1
CF99	1
CEA1	1
CF81	1
CFB1	1
CEA3	1
CF82	1
CF83	1
CFB2	1
CFB9	1
CEA4	1
CF84	1
CE8E	1
CEA5	1
CEAB	1
CEB0	1
CF85	1
CF8B	1
CF8D	1
CF92	1
CF93	1
CF94	1
CEA6	1
CF86	1
CF95	1
CEA7	1
CF87	1
CEA8	1
CF88	1
CE8F	1
CEA9	1
CF89	1
CF8E	1
CFA0	1
CFA1	1
CFB7	1
CFB8	1
CFBA	1
CFBB	1
CFA2	1
CFA3	1
CFA4	1
CFA5	1
CFA6	1
CFA7	1
CFA8	1
CFA9	1
CFAA	1
CFAB	1
CFAC	1
CFAD	1
CFAE	1
CFAF	1
D090	1
D0B0	1
D390	1
D391	1
D392	1
D393	1
D398	1
D399	1
D39A	1
D39B	1
D394	1
D395	1
D091	1
D0B1	1
D092	1
D0B2	1
D093	1
D0B3	1
D290	1
D291	1
D292	1
D293	1
D294	1
D295	1
D094	1
D0B4	1
D480	1
D481	1
D082	1
D192	1
D482	1
D483	1
D083	1
D193	1
D298	1
D299	1
D080	1
D081	1
D095	1
D0B5	1
D190	1
D191	1
D396	1
D397	1
D084	1
D194	1
D096	1
D0B6	1
D381	1
D382	1
D39C	1
D39D	1
D296	1
D297	1
D097	1
D0B7	1
D484	1
D485	1
D39E	1
D39F	1
D085	1
D195	1
D3A0	1
D3A1	1
D486	1
D487	1
D08D	1
D098	1
D0B8	1
D19D	1
D3A2	1
D3A3	1
D28A	1
D28B	1
D3A4	1
D3A5	1
D086	1
D196	1
D087	1
D197	1
D099	1
D0B9	1
D088	1
D198	1
D09A	1
D0BA	1
D29A	1
D29B	1
D383	1
D384	1
D2A0	1
D2A1	1
D29E	1
D29F	1
D29C	1
D29D	1
D09B	1
D0BB	1
D385	1
D386	1
D089	1
D199	1
D488	1
D489	1
D09C	1
D0BC	1
D38D	1
D38E	1
D09D	1
D0BD	1
D389	1
D38A	1
D2A2	1
D2A3	1
D387	1
D388	1
D2A4	1
D2A5	1
D08A	1
D19A	1
D48A	1
D48B	1
D09E	1
D0BE	1
D3A6	1
D3A7	1
D3A8	1
D3A9	1
D3AA	1
D3AB	1
D09F	1
D0BF	1
D2A6	1
D2A7	1
D280	1
D281	1
D0A0	1
D180	1
D28E	1
D28F	1
D0A1	1
D181	1
D48C	1
D48D	1
D2AA	1
D2AB	1
D0A2	1
D182	1
D48E	1
D48F	1
D2AC	1
D2AD	1
D08B	1
D19B	1
D08C	1
D19C	1
D0A3	1
D183	1
D3AE	1
D3AF	1
D08E	1
D19E	1
D3B0	1
D3B1	1
D3B2	1
D3B3	1
D2AE	1
D2AF	1
D2B0	1
D2B1	1
D1B8	1
D1B9	1
D0A4	1
D184	1
D0A5	1
D185	1
D2B2	1
D2B3	1
D2BA	1
D2BB	1
D1A0	1
D1A1	1
D1BE	1
D1BF	1
D1BC	1
D1BD	1
D1BA	1
D1BB	1
D0A6	1
D186	1
D2B4	1
D2B5	1
D0A7	1
D187	1
D3B4	1
D3B5	1
D2B6	1
D2B7	1
D38B	1
D38C	1
D2B8	1
D2B9	1
D2BC	1
D2BD	1
D2BE	1
D2BF	1
D08F	1
D19F	1
D0A8	1
D188	1
D0A9	1
D189	1
D0AA	1
D18A	1
D0AB	1
D18B	1
D3B8	1
D3B9	1
D0AC	1
D18C	1
D28C	1
D28D	1
D1A2	1
D1A3	1
D0AD	1
D18D	1
D3AC	1
D3AD	1
D0AE	1
D18E	1
D0AF	1
D18F	1
D1A4	1
D1A5	1
D1A6	1
D1A7	1
D1AA	1
D1AB	1
D1A8	1
D1A9	1
D1AC	1
D1AD	1
D1AE	1
D1AF	1
D1B0	1
D1B1	1
D1B2	1
D1B3	1
D1B4	1
D1B5	1
D1B6	1
D1B7	1
D2A8	1
D2A9	1
D380	1
D4B1	1
D5A1	1
D4B2	1
D5A2	1
D4B3	1
D5A3	1
D4B4	1
D5A4	1
D4B5	1
D5A5	1
D687	1
D4B6	1
D5A6	1
D4B7	1
D5A7	1
D4B8	1
D5A8	1
D4B9	1
D5A9	1
D4BA	1
D5AA	1
D4BB	1
D5AB	1
D4BC	1
D5AC	1
D4BD	1
D5AD	1
D4BE	1
D5AE	1
D4BF	1
D5AF	1
D580	1
D5B0	1
D581	1
D5B1	1
D582	1
D5B2	1
D583	1
D5B3	1
D584	1
D5B4	1
D585	1
D5B5	1
D586	1
D5B6	1
D587	1
D5B7	1
D588	1
D5B8	1
D589	1
D5B9	1
D58A	1
D5BA	1
D58B	1
D5BB	1
D58C	1
D5BC	1
D58D	1
D5BD	1
D58E	1
D5BE	1
D58F	1
D5BF	1
D590	1
D680	1
D591	1
D681	1
D592	1
D682	1
D593	1
D683	1
D594	1
D684	1
D595	1
D685	1
D596	1
D686	1
D599	1
D790	1
D791	1
D792	1
D793	1
D794	1
D795	1
D7B0	1
D7B1	1
D796	1
D797	1
D798	1
D799	1
D7B2	1
D79A	1
D79B	1
D79C	1
D79D	1
D79E	1
D79F	1
D7A0	1
D7A1	1
D7A2	1
D7A3	1
D7A4	1
D7A5	1
D7A6	1
D7A7	1
D7A8	1
D7A9	1
D7AA	1
D9B4	1
DBBD	1
D9B2	1
D9B3	1
D9B5	1
D9AE	1
D8A8	1
D9BB	1
D9BE	1
DA80	1
DA89	1
DA8A	1
D8AA	1
D8AB	1
D9B9	1
D9BA	1
D9BC	1
D9BD	1
D9BF	1
D8AC	1
DA83	1
DA84	1
DA86	1
DABF	1
DA87	1
D8AD	1
D8AE	1
DA81	1
DA82	1
DA85	1
D8AF	1
D8B0	1
DA88	1
DA8B	1
DA8C	1
DA8D	1
DA8E	1
DA8F	1
DA90	1
DBAE	1
D8B1	1
D8B2	1
DA91	1
DA92	1
DA93	1
DA94	1
DA95	1
DA96	1
DA97	1
DA98	1
DA99	1
DBAF	1
D8B3	1
D8B4	1
DA9A	1
DA9B	1
DA9C	1
DBBA	1
D8B5	1
D8B6	1
DA9D	1
DA9E	1
DBBB	1
D8B7	1
D8B8	1
DA9F	1
D8B9	1
D8BA	1
DAA0	1
DBBC	1
D981	1
DAA1	1
DAA2	1
DAA3	1
DAA4	1
DAA5	1
DAA6	1
D9AF	1
D982	1
DAA7	1
DAA9	1
D983	1
DAA8	1
DAAA	1
DAAB	1
DAAC	1
DAAD	1
DAAE	1
DAAF	1
DAB0	1
DAB1	1
DAB2	1
DAB3	1
DAB4	1
D984	1
DAB5	1
DAB6	1
DAB7	1
DAB8	1
D985	1
DBBE	1
D986	1
DABA	1
DABB	1
DABC	1
DABD	1
DAB9	1
DABE	1
DB81	1
DB82	1
DB83	1
DBBF	1
DB95	1
D988	1
DBA5	1
D9B6	1
D987	1
DB84	1
D8A9	1
DB85	1
DB80	1
DB86	1
DB87	1
DB8C	1
D9B7	1
D989	1
DB88	1
D98A	1
DB89	1
DB8A	1
DB8B	1
DB8F	1
DBA6	1
D9B8	1
DB8D	1
DB8E	1
DB90	1
DB91	1
DB92	1
DB93	1
DC90	1
DC92	1
DCAD	1
DC93	1
DC94	1
DCAE	1
DC96	1
DC95	1
DCAF	1
DC97	1
DC98	1
DC99	1
DD8D	1
DC9A	1
DC9B	1
DC9C	1
DC9D	1
DC9E	1
DC9F	1
DD8E	1
DCA0	1
DCA1	1
DCA2	1
DCA3	1
DCA4	1
DCA5	1
DCA6	1
DCA7	1
DD8F	1
DCA8	1
DCA9	1
DCAA	1
DCAB	1
DCAC	1
DE80	1
DE99	1
DE9A	1
DE81	1
DE82	1
DE83	1
DE9C	1
DE84	1
DE85	1
DE86	1
DE87	1
DEA2	1
DEA3	1
DE88	1
DEA5	1
DE89	1
DE8A	1
DE8B	1
DE9B	1
DE8C	1
DE98	1
DEA0	1
DEA1	1
DE8D	1
DE8E	1
DEA4	1
DE8F	1
DE90	1
DE9D	1
DE9E	1
DE9F	1
DE91	1
DE92	1
DE93	1
DE94	1
DE95	1
DE96	1
DE97	1
DEB1	1
DEA6	1
DEA7	1
DEA8	1
DEA9	1
DEAA	1
DEAB	1
DEAC	1
DEAD	1
DEAE	1
DEAF	1
DEB0	1
E4B880	1
E4B881	1
E4B882	1
E4B883	1
E4B884	1
E4B885	1
E4B886	1
E4B887	1
E4B888	1
E4B889	1
E4B88A	1
E4B88B	1
E4B88C	1
E4B88D	1
E4B88E	1
E4B88F	1
E4B890	1
E4B891	1
E4B892	1
E4B893	1
E4B894	1
E4B895	1
E4B896	1
E4B897	1
E4B898	1
E4B899	1
E4B89A	1
E4B89B	1
E4B89C	1
E4B89D	1
E4B89E	1
E4B89F	1
E4B8A0	1
E4B8A1	1
E4B8A2	1
E4B8A3	1
E4B8A4	1
E4B8A5	1
E4B8A6	1
E4B8A7	1
E4B8A8	1
E4B8A9	1
E4B8AA	1
E4B8AB	1
E4B8AC	1
E4B8AD	1
E4B8AE	1
E4B8AF	1
E4B8B0	1
E4B8B1	1
E4B8B2	1
E4B8B3	1
E4B8B4	1
E4B8B5	1
E4B8B6	1
E4B8B7	1
E4B8B8	1
E4B8B9	1
E4B8BA	1
E4B8BB	1
E4B8BC	1
E4B8BD	1
E4B8BE	1
E4B8BF	1
E4B980	1
E4B981	1
E4B982	1
E4B983	1
E4B984	1
E4B985	1
E4B986	1
E4B987	1
E4B988	1
E4B989	1
E4B98A	1
E4B98B	1
E4B98C	1
E4B98D	1
E4B98E	1
E4B98F	1
E4B990	1
E4B991	1
E4B992	1
E4B993	1
E4B994	1
E4B995	1
E4B996	1
E4B997	1
E4B998	1
E4B999	1
E4B99A	1
E4B99B	1
E4B99C	1
E4B99D	1
E4B99E	1
E4B99F	1
E4B9A0	1
E4B9A1	1
E4B9A2	1
E4B9A3	1
E4B9A4	1
E4B9A5	1
E4B9A6	1
E4B9A7	1
E4B9A8	1
E4B9A9	1
E4B9AA	1
E4B9AB	1
E4B9AC	1
E4B9AD	1
E4B9AE	1
E4B9AF	1
E4B9B0	1
E4B9B1	1
E4B9B2	1
E4B9B3	1
E4B9B4	1
E4B9B5	1
E4B9B6	1
E4B9B7	1
E4B9B8	1
E4B9B9	1
E4B9BA	1
E4B9BB	1
E4B9BC	1
E4B9BD	1
E4B9BE	1
E4B9BF	1
E4BA80	1
E4BA81	1
E4BA82	1
E4BA83	1
E4BA84	1
E4BA85	1
E4BA86	1
E4BA87	1
E4BA88	1
E4BA89	1
E4BA8A	1
E4BA8B	1
E4BA8C	1
E4BA8D	1
E4BA8E	1
E4BA8F	1
E4BA90	1
E4BA91	1
E4BA92	1
E4BA93	1
E4BA94	1
E4BA95	1
E4BA96	1
E4BA97	1
E4BA98	1
E4BA99	1
E4BA9A	1
E4BA9B	1
E4BA9C	1
E4BA9D	1
E4BA9E	1
E4BA9F	1
E4BAA0	1
E4BAA1	1
E4BAA2	1
E4BAA3	1
E4BAA4	1
E4BAA5	1
E4BAA6	1
E4BAA7	1
E4BAA8	1
E4BAA9	1
E4BAAA	1
E4BAAB	1
E4BAAC	1
E4BAAD	1
E4BAAE	1
E4BAAF	1
E4BAB0	1
E4BAB1	1
E4BAB2	1
E4BAB3	1
E4BAB4	1
E4BAB5	1
E4BAB6	1
E4BAB7	1
E4BAB8	1
E4BAB9	1
E4BABA	1
E4BABB	1
E4BABC	1
E4BABD	1
E4BABE	1
E4BABF	1
E4BB80	1
E4BB81	1
E4BB82	1
E4BB83	1
E4BB84	1
E4BB85	1
E4BB86	1
E4BB87	1
E4BB88	1
E4BB89	1
E4BB8A	1
E4BB8B	1
E4BB8C	1
E4BB8D	1
E4BB8E	1
E4BB8F	1
E4BB90	1
E4BB91	1
E4BB92	1
E4BB93	1
E4BB94	1
E4BB95	1
E4BB96	1
E4BB97	1
E4BB98	1
E4BB99	1
E4BB9A	1
E4BB9B	1
E4BB9C	1
E4BB9D	1
E4BB9E	1
E4BB9F	1
E4BBA0	1
E4BBA1	1
E4BBA2	1
E4BBA3	1
E4BBA4	1
E4BBA5	1
E4BBA6	1
E4BBA7	1
E4BBA8	1
E4BBA9	1
E4BBAA	1
E4BBAB	1
E4BBAC	1
E4BBAD	1
E4BBAE	1
E4BBAF	1
E4BBB0	1
E4BBB1	1
E4BBB2	1
E4BBB3	1
E4BBB4	1
E4BBB5	1
E4BBB6	1
E4BBB7	1
E4BBB8	1
E4BBB9	1
E4BBBA	1
E4BBBB	1
E4BBBC	1
E4BBBD	1
E4BBBE	1
E4BBBF	1
E4BC80	1
E4BC81	1
E4BC82	1
E4BC83	1
E4BC84	1
E4BC85	1
E4BC86	1
E4BC87	1
E4BC88	1
E4BC89	1
E4BC8A	1
E4BC8B	1
E4BC8C	1
E4BC8D	1
E4BC8E	1
E4BC8F	1
E4BC90	1
E4BC91	1
E4BC92	1
E4BC93	1
E4BC94	1
E4BC95	1
E4BC96	1
E4BC97	1
E4BC98	1
E4BC99	1
E4BC9A	1
E4BC9B	1
E4BC9C	1
E4BC9D	1
E4BC9E	1
E4BC9F	1
E4BCA0	1
E4BCA1	1
E4BCA2	1
E4BCA3	1
E4BCA4	1
E4BCA5	1
E4BCA6	1
E4BCA7	1
E4BCA8	1
E4BCA9	1
E4BCAA	1
E4BCAB	1
E4BCAC	1
E4BCAD	1
E4BCAE	1
E4BCAF	1
E4BCB0	1
E4BCB1	1
E4BCB2	1
E4BCB3	1
E4BCB4	1
E4BCB5	1
E4BCB6	1
E4BCB7	1
E4BCB8	1
E4BCB9	1
E4BCBA	1
E4BCBB	1
E4BCBC	1
E4BCBD	1
E4BCBE	1
E4BCBF	1
E4BD80	1
E4BD81	1
E4BD82	1
E4BD83	1
E4BD84	1
E4BD85	1
E4BD86	1
E4BD87	1
E4BD88	1
E4BD89	1
E4BD8A	1
E4BD8B	1
E4BD8C	1
E4BD8D	1
E4BD8E	1
E4BD8F	1
E4BD90	1
E4BD91	1
E4BD92	1
E4BD93	1
E4BD94	1
E4BD95	1
E4BD96	1
E4BD97	1
E4BD98	1
E4BD99	1
E4BD9A	1
E4BD9B	1
E4BD9C	1
E4BD9D	1
E4BD9E	1
E4BD9F	1
E4BDA0	1
E4BDA1	1
E4BDA2	1
E4BDA3	1
E4BDA4	1
E4BDA5	1
E4BDA6	1
E4BDA7	1
E4BDA8	1
E4BDA9	1
E4BDAA	1
E4BDAB	1
E4BDAC	1
E4BDAD	1
E4BDAE	1
E4BDAF	1
E4BDB0	1
E4BDB1	1
E4BDB2	1
E4BDB3	1
E4BDB4	1
E4BDB5	1
E4BDB6	1
E4BDB7	1
E4BDB8	1
E4BDB9	1
E4BDBA	1
E4BDBB	1
E4BDBC	1
E4BDBD	1
E4BDBE	1
E4BDBF	1
E4BE80	1
E4BE81	1
E4BE82	1
E4BE83	1
E4BE84	1
E4BE85	1
E4BE86	1
E4BE87	1
E4BE88	1
E4BE89	1
E4BE8A	1
E4BE8B	1
E4BE8C	1
E4BE8D	1
E4BE8E	1
E4BE8F	1
E4BE90	1
E4BE91	1
E4BE92	1
E4BE93	1
E4BE94	1
E4BE95	1
E4BE96	1
E4BE97	1
E4BE98	1
E4BE99	1
E4BE9A	1
E4BE9B	1
E4BE9C	1
E4BE9D	1
E4BE9E	1
E4BE9F	1
E4BEA0	1
E4BEA1	1
E4BEA2	1
E4BEA3	1
E4BEA4	1
E4BEA5	1
E4BEA6	1
E4BEA7	1
E4BEA8	1
E4BEA9	1
E4BEAA	1
E4BEAB	1
E4BEAC	1
E4BEAD	1
E4BEAE	1
E4BEAF	1
E4BEB0	1
E4BEB1	1
E4BEB2	1
E4BEB3	1
E4BEB4	1
E4BEB5	1
E4BEB6	1
E4BEB7	1
E4BEB8	1
E4BEB9	1
E4BEBA	1
E4BEBB	1
E4BEBC	1
E4BEBD	1
E4BEBE	1
E4BEBF	1
E4BF80	1
E4BF81	1
E4BF82	1
E4BF83	1
E4BF84	1
E4BF85	1
E4BF86	1
E4BF87	1
E4BF88	1
E4BF89	1
E4BF8A	1
E4BF8B	1
E4BF8C	1
E4BF8D	1
E4BF8E	1
E4BF8F	1
E4BF90	1
E4BF91	1
E4BF92	1
E4BF93	1
E4BF94	1
E4BF95	1
E4BF96	1
E4BF97	1
E4BF98	1
E4BF99	1
E4BF9A	1
E4BF9B	1
E4BF9C	1
E4BF9D	1
E4BF9E	1
E4BF9F	1
E4BFA0	1
E4BFA1	1
E4BFA2	1
E4BFA3	1
E4BFA4	1
E4BFA5	1
E4BFA6	1
E4BFA7	1
E4BFA8	1
E4BFA9	1
E4BFAA	1
E4BFAB	1
E4BFAC	1
E4BFAD	1
E4BFAE	1
E4BFAF	1
E4BFB0	1
E4BFB1	1
E4BFB2	1
E4BFB3	1
E4BFB4	1
E4BFB5	1
E4BFB6	1
E4BFB7	1
E4BFB8	1
E4BFB9	1
E4BFBA	1
E4BFBB	1
E4BFBC	1
E4BFBD	1
E4BFBE	1
E4BFBF	1
C8B7	1
C8B8	1
C8B9	1
C8BA	1
C8BB	1
C8BC	1
C8BD	1
C8BE	1
C8BF	1
C980	1
C981	1
C982	1
C983	1
C984	1
C985	1
C986	1
C987	1
C988	1
C989	1
C98A	1
C98B	1
C98C	1
C98D	1
C98E	1
C98F	1
CD98	1
CD99	1
CD9A	1
CD9B	1
CD9C	1
CDB0	1
CDB1	1
CDB2	1
CDB3	1
CDB6	1
CDB7	1
CDB8	1
CDB9	1
CDBB	1
CDBC	1
CDBD	1
CDBF	1
CE80	1
CE81	1
CE82	1
CE83	1
CE8B	1
CE8D	1
CEA2	1
CF8F	1
CFBC	1
CFBD	1
CFBE	1
CFBF	1
D287	1
D38F	1
D3B6	1
D3B7	1
D3BA	1
D3BB	1
D3BC	1
D3BD	1
D3BE	1
D3BF	1
D490	1
D491	1
D492	1
D493	1
D494	1
D495	1
D496	1
D497	1
D498	1
D499	1
D49A	1
D49B	1
D49C	1
D49D	1
D49E	1
D49F	1
D4A0	1
D4A1	1
D4A2	1
D4A3	1
D4A4	1
D4A5	1
D4A6	1
D4A7	1
D4A8	1
D4A9	1
D4AA	1
D4AB	1
D4AC	1
D4AD	1
D4AE	1
D4AF	1
D4B0	1
D597	1
D598	1
D5A0	1
D688	1
D68B	1
D68C	1
D68D	1
D68E	1
D68F	1
D690	1
D6A2	1
D6BA	1
D785	1
D786	1
D787	1
D788	1
D789	1
D78A	1
D78B	1
D78C	1
D78D	1
D78E	1
D78F	1
D7AB	1
D7AC	1
D7AD	1
D7AE	1
D7AF	1
D7B5	1
D7B6	1
D7B7	1
D7B8	1
D7B9	1
D7BA	1
D7BB	1
D7BC	1
D7BD	1
D7BE	1
D7BF	1
D884	1
D885	1
D886	1
D887	1
D888	1
D889	1
D88A	1
D88B	1
D896	1
D897	1
D898	1
D899	1
D89A	1
D89C	1
D89D	1
D89E	1
D8A0	1
D8BB	1
D8BC	1
D8BD	1
D8BE	1
D8BF	1
D999	1
D99A	1
D99B	1
D99C	1
D99D	1
D99E	1
D99F	1
DC8E	1
DD8B	1
DD8C	1
DD90	1
DD91	1
DD92	1
DD93	1
DD94	1
DD95	1
DD96	1
DD97	1
DD98	1
DD99	1
DD9A	1
DD9B	1
DD9C	1
DD9D	1
DD9E	1
DD9F	1
DDA0	1
DDA1	1
DDA2	1
DDA3	1
DDA4	1
DDA5	1
DDA6	1
DDA7	1
DDA8	1
DDA9	1
DDAA	1
DDAB	1
DDAC	1
DDAD	1
DDAE	1
DDAF	1
DDB0	1
DDB1	1
DDB2	1
DDB3	1
DDB4	1
DDB5	1
DDB6	1
DDB7	1
DDB8	1
DDB9	1
DDBA	1
DDBB	1
DDBC	1
DDBD	1
DDBE	1
DDBF	1
DEB2	1
DEB3	1
DEB4	1
DEB5	1
DEB6	1
DEB7	1
DEB8	1
DEB9	1
DEBA	1
DEBB	1
DEBC	1
DEBD	1
DEBE	1
DEBF	1
DF80	1
DF81	1
DF82	1
DF83	1
DF84	1
DF85	1
DF86	1
DF87	1
DF88	1
DF89	1
DF8A	1
DF8B	1
DF8C	1
DF8D	1
DF8E	1
DF8F	1
DF90	1
DF91	1
DF92	1
DF93	1
DF94	1
DF95	1
DF96	1
DF97	1
DF98	1
DF99	1
DF9A	1
DF9B	1
DF9C	1
DF9D	1
DF9E	1
DF9F	1
DFA0	1
DFA1	1
DFA2	1
DFA3	1
DFA4	1
DFA5	1
DFA6	1
DFA7	1
DFA8	1
DFA9	1
DFAA	1
DFAB	1
DFAC	1
DFAD	1
DFAE	1
DFAF	1
DFB0	1
DFB1	1
DFB2	1
DFB3	1
DFB4	1
DFB5	1
DFB6	1
DFB7	1
DFB8	1
DFB9	1
DFBA	1
DFBB	1
DFBC	1
DFBD	1
DFBE	1
DFBF	1
DROP TABLE IF EXISTS test.t1;
DROP TABLE IF EXISTS test.t1;
DROP DATABASE test;
CREATE DATABASE test CHARACTER SET utf8mb3;
USE test;
CREATE TABLE test.t1 (a CHAR(4) CHARACTER SET utf8mb3 COLLATE utf8mb3_polish_ci) ENGINE=MyISAM CHARACTER SET utf8mb3 COLLATE utf8mb3_polish_ci;
Warnings:
Warning	1287	'utf8mb3' is deprecated and will be removed in a future release. Please use utf8mb4 instead
Warning	3778	'utf8mb3_polish_ci' is a collation of the deprecated character set UTF8MB3. Please consider using UTF8MB4 with an appropriate collation instead.
Warning	1287	'utf8mb3' is deprecated and will be removed in a future release. Please use utf8mb4 instead
Warning	3778	'utf8mb3_polish_ci' is a collation of the deprecated character set UTF8MB3. Please consider using UTF8MB4 with an appropriate collation instead.
SHOW TABLE STATUS LIKE 't1';
Name	Engine	Version	Row_format	Rows	Avg_row_length	Data_length	Max_data_length	Index_length	Data_free	Auto_increment	Create_time	Update_time	Check_time	Collation	Checksum	Create_options	Comment
t1	MyISAM	#	#	#	#	#	#	#	#	#	#	#	#	utf8mb3_polish_ci	#	#	#
LOAD DATA INFILE 
'MYSQL_TEST_DIR/suite/funcs_2/data/charset_utf8.txt' INTO TABLE test.t1;
DELETE FROM test.t1 WHERE CHAR_LENGTH(a) <> 1;
SELECT HEX(ORD(a)) AS a_ord, CHAR_LENGTH(a) AS a_len FROM test.t1 ORDER BY a, ORD(a);
a_ord	a_len
C285	1
7F	1
C280	1
C281	1
C282	1
C283	1
C284	1
C286	1
C287	1
C288	1
C289	1
C28A	1
C28B	1
C28C	1
C28D	1
C28E	1
C28F	1
C290	1
C291	1
C292	1
C293	1
C294	1
C295	1
C296	1
C297	1
C298	1
C299	1
C29A	1
C29B	1
C29C	1
C29D	1
C29E	1
C29F	1
C2A0	1
CC80	1
CC81	1
CC82	1
CC83	1
CC84	1
CC85	1
CC86	1
CC87	1
CC88	1
CC89	1
CC8A	1
CC8B	1
CC8C	1
CC8D	1
CC8E	1
CC8F	1
CC90	1
CC91	1
CC92	1
CC93	1
CC94	1
CC95	1
CC96	1
CC97	1
CC98	1
CC99	1
CC9A	1
CC9B	1
CC9C	1
CC9D	1
CC9E	1
CC9F	1
CCA0	1
CCA1	1
CCA2	1
CCA3	1
CCA4	1
CCA5	1
CCA6	1
CCA7	1
CCA8	1
CCA9	1
CCAA	1
CCAB	1
CCAC	1
CCAD	1
CCAE	1
CCAF	1
CCB0	1
CCB1	1
CCB2	1
CCB3	1
CCB4	1
CCB5	1
CCB6	1
CCB7	1
CCB8	1
CCB9	1
CCBA	1
CCBB	1
CCBC	1
CCBD	1
CCBE	1
CCBF	1
CD80	1
CD81	1
CD82	1
CD83	1
CD84	1
CD85	1
CD86	1
CD87	1
CD88	1
CD89	1
CD8A	1
CD8B	1
CD8C	1
CD8D	1
CD8E	1
CD8F	1
CD90	1
CD91	1
CD92	1
CD93	1
CD94	1
CD95	1
CD96	1
CD97	1
CD9D	1
CD9E	1
CD9F	1
CDA0	1
CDA1	1
CDA2	1
D283	1
D284	1
D285	1
D286	1
D288	1
D289	1
D691	1
D692	1
D693	1
D694	1
D695	1
D696	1
D697	1
D698	1
D699	1
D69A	1
D69B	1
D69C	1
D69D	1
D69E	1
D69F	1
D6A0	1
D6A1	1
D6A3	1
D6A4	1
D6A5	1
D6A6	1
D6A7	1
D6A8	1
D6A9	1
D6AA	1
D6AB	1
D6AC	1
D6AD	1
D6AE	1
D6AF	1
D6B0	1
D6B1	1
D6B2	1
D6B3	1
D6B4	1
D6B5	1
D6B6	1
D6B7	1
D6B8	1
D6B9	1
D6BB	1
D6BC	1
D6BD	1
D6BF	1
D781	1
D782	1
D784	1
D880	1
D881	1
D882	1
D883	1
D890	1
D891	1
D892	1
D893	1
D894	1
D895	1
D98B	1
D98C	1
D98D	1
D98E	1
D98F	1
D990	1
D991	1
D992	1
D993	1
D994	1
D995	1
D996	1
D997	1
D998	1
D9B0	1
DB96	1
DB97	1
DB98	1
DB99	1
DB9A	1
DB9B	1
DB9C	1
DB9D	1
DB9E	1
DB9F	1
DBA0	1
DBA1	1
DBA2	1
DBA3	1
DBA4	1
DBA7	1
DBA8	1
DBAA	1
DBAB	1
DBAC	1
DBAD	1
DC8F	1
DC91	1
DCB0	1
DCB1	1
DCB2	1
DCB3	1
DCB4	1
DCB5	1
DCB6	1
DCB7	1
DCB8	1
DCB9	1
DCBA	1
DCBB	1
DCBC	1
DCBD	1
DCBE	1
DCBF	1
DD80	1
DD81	1
DD82	1
DD83	1
DD84	1
DD85	1
DD86	1
DD87	1
DD88	1
DD89	1
DD8A	1
D980	1
60	1
C2B4	1
CE84	1
CB9C	1
5E	1
C2AF	1
CB98	1
CB99	1
C2A8	1
CE85	1
CB9A	1
CB9D	1
C2B8	1
CB9B	1
5F	1
C2AD	1
2D	1
D68A	1
2C	1
D59D	1
D88C	1
D88D	1
D9AB	1
D9AC	1
3B	1
CDBE	1
D89B	1
3A	1
D689	1
DC83	1
DC84	1
DC85	1
DC86	1
DC87	1
DC88	1
21	1
C2A1	1
D59C	1
3F	1
C2BF	1
D59E	1
D89F	1
DC89	1
2E	1
DB94	1
DC81	1
DC82	1
C2B7	1
CE87	1
DC80	1
27	1
22	1
C2AB	1
C2BB	1
28	1
29	1
5B	1
7B	1
7D	1
C2A7	1
C2B6	1
C2A9	1
C2AE	1
40	1
2A	1
D9AD	1
2F	1
26	1
23	1
25	1
D9AA	1
D59A	1
D59B	1
D59F	1
D6BE	1
D780	1
D783	1
D7B3	1
D7B4	1
DC8A	1
DC8B	1
DC8C	1
DC8D	1
CAB9	1
CDB4	1
CDB5	1
CABA	1
CB82	1
CB83	1
CB84	1
CB85	1
CB86	1
CB87	1
CB88	1
CB89	1
CB8A	1
CB8B	1
CB8C	1
CB8D	1
CB8E	1
CB8F	1
CB92	1
CB93	1
CB94	1
CB95	1
CB96	1
CB97	1
CB9E	1
CB9F	1
CBA5	1
CBA6	1
CBA7	1
CBA8	1
CBA9	1
CBAA	1
CBAB	1
CBAC	1
CBAD	1
CBAF	1
CBB0	1
CBB1	1
CBB2	1
CBB3	1
CBB4	1
CBB5	1
CBB6	1
CBB7	1
CBB8	1
CBB9	1
CBBA	1
CBBB	1
CBBC	1
CBBD	1
CBBE	1
CBBF	1
C2B0	1
D282	1
D88E	1
D88F	1
DBA9	1
CFB6	1
2B	1
C2B1	1
C3B7	1
C397	1
3C	1
3D	1
3E	1
C2AC	1
7C	1
C2A6	1
7E	1
CB90	1
CB91	1
C2A4	1
C2A2	1
24	1
C2A3	1
C2A5	1
30	1
D9A0	1
DBB0	1
31	1
C2B9	1
D9A1	1
DBB1	1
C2BD	1
C2BC	1
32	1
C2B2	1
D9A2	1
DBB2	1
33	1
C2B3	1
D9A3	1
DBB3	1
C2BE	1
34	1
D9A4	1
DBB4	1
35	1
D9A5	1
DBB5	1
36	1
D9A6	1
DBB6	1
37	1
D9A7	1
DBB7	1
38	1
D9A8	1
DBB8	1
39	1
D9A9	1
DBB9	1
41	1
61	1
C2AA	1
C380	1
C381	1
C382	1
C383	1
C384	1
C385	1
C3A0	1
C3A1	1
C3A2	1
C3A3	1
C3A4	1
C3A5	1
C480	1
C481	1
C482	1
C483	1
C78D	1
C78E	1
C79E	1
C79F	1
C7A0	1
C7A1	1
C7BA	1
C7BB	1
C880	1
C881	1
C882	1
C883	1
C8A6	1
C8A7	1
CDA3	1
C484	1
C485	1
C386	1
C3A6	1
C7A2	1
C7A3	1
C7BC	1
C7BD	1
C990	1
C991	1
C992	1
42	1
62	1
CA99	1
C680	1
C681	1
C993	1
C682	1
C683	1
43	1
63	1
C387	1
C3A7	1
C488	1
C489	1
C48A	1
C48B	1
C48C	1
C48D	1
CDA8	1
C486	1
C487	1
C687	1
C688	1
C995	1
44	1
64	1
C48E	1
C48F	1
CDA9	1
C784	1
C785	1
C786	1
C7B1	1
C7B2	1
C7B3	1
CAA3	1
CAA5	1
CAA4	1
C490	1
C491	1
C689	1
C996	1
C68A	1
C997	1
C68B	1
C68C	1
C8A1	1
C390	1
C3B0	1
45	1
65	1
C388	1
C389	1
C38A	1
C38B	1
C3A8	1
C3A9	1
C3AA	1
C3AB	1
C492	1
C493	1
C494	1
C495	1
C496	1
C497	1
C49A	1
C49B	1
C884	1
C885	1
C886	1
C887	1
C8A8	1
C8A9	1
CDA4	1
C498	1
C499	1
C68E	1
C79D	1
C68F	1
C999	1
C690	1
C99B	1
C998	1
C99A	1
C99C	1
C99D	1
C99E	1
CA9A	1
C9A4	1
46	1
66	1
CAA9	1
C691	1
C692	1
47	1
67	1
C49C	1
C49D	1
C49E	1
C49F	1
C4A0	1
C4A1	1
C4A2	1
C4A3	1
C7A6	1
C7A7	1
C7B4	1
C7B5	1
C9A1	1
C9A2	1
C7A4	1
C7A5	1
C693	1
C9A0	1
CA9B	1
C694	1
C9A3	1
CBA0	1
C6A2	1
C6A3	1
48	1
68	1
C4A4	1
C4A5	1
C89E	1
C89F	1
CAB0	1
CDAA	1
CA9C	1
C695	1
C7B6	1
C4A6	1
C4A7	1
C9A6	1
CAB1	1
C9A7	1
CABB	1
CABD	1
49	1
69	1
C38C	1
C38D	1
C38E	1
C38F	1
C3AC	1
C3AD	1
C3AE	1
C3AF	1
C4A8	1
C4A9	1
C4AA	1
C4AB	1
C4AC	1
C4AD	1
C4AE	1
C4AF	1
C4B0	1
C78F	1
C790	1
C888	1
C889	1
C88A	1
C88B	1
CDA5	1
C4B2	1
C4B3	1
C4B1	1
C9AA	1
C697	1
C9A8	1
C696	1
C9A9	1
4A	1
6A	1
C4B4	1
C4B5	1
C7B0	1
CAB2	1
CA9D	1
C99F	1
CA84	1
4B	1
6B	1
C4B6	1
C4B7	1
C7A8	1
C7A9	1
C698	1
C699	1
CA9E	1
4C	1
6C	1
C4B9	1
C4BA	1
C4BB	1
C4BC	1
C4BD	1
C4BE	1
CBA1	1
C4BF	1
C580	1
C787	1
C788	1
C789	1
CAAA	1
CAAB	1
C581	1
C582	1
CA9F	1
C69A	1
C9AB	1
C9AC	1
C9AD	1
C8B4	1
C9AE	1
C69B	1
CA8E	1
4D	1
6D	1
CDAB	1
C9B1	1
4E	1
6E	1
C391	1
C3B1	1
C585	1
C586	1
C587	1
C588	1
C7B8	1
C7B9	1
C78A	1
C78B	1
C78C	1
C583	1
C584	1
C9B4	1
C69D	1
C9B2	1
C69E	1
C8A0	1
C9B3	1
C8B5	1
C58A	1
C58B	1
4F	1
6F	1
C2BA	1
C392	1
C394	1
C395	1
C396	1
C3B2	1
C3B4	1
C3B5	1
C3B6	1
C58C	1
C58D	1
C58E	1
C58F	1
C590	1
C591	1
C6A0	1
C6A1	1
C791	1
C792	1
C7AA	1
C7AB	1
C7AC	1
C7AD	1
C88C	1
C88D	1
C88E	1
C88F	1
C8AA	1
C8AB	1
C8AC	1
C8AD	1
C8AE	1
C8AF	1
C8B0	1
C8B1	1
CDA6	1
C592	1
C593	1
C393	1
C3B3	1
C9B6	1
C398	1
C3B8	1
C7BE	1
C7BF	1
C686	1
C994	1
C69F	1
C9B5	1
C9B7	1
C8A2	1
C8A3	1
50	1
70	1
C6A4	1
C6A5	1
C9B8	1
51	1
71	1
CAA0	1
C4B8	1
52	1
72	1
C594	1
C595	1
C596	1
C597	1
C598	1
C599	1
C890	1
C891	1
C892	1
C893	1
CAB3	1
CDAC	1
C6A6	1
CA80	1
C9B9	1
CAB4	1
C9BA	1
C9BB	1
CAB5	1
C9BC	1
C9BD	1
C9BE	1
C9BF	1
CA81	1
CAB6	1
53	1
73	1
C59C	1
C59D	1
C59E	1
C59F	1
C5A0	1
C5A1	1
C5BF	1
C898	1
C899	1
CBA2	1
C39F	1
C59A	1
C59B	1
CA82	1
C6A9	1
CA83	1
C6AA	1
CA85	1
CA86	1
54	1
74	1
C5A2	1
C5A3	1
C5A4	1
C5A5	1
C89A	1
C89B	1
CDAD	1
CAA8	1
C6BE	1
CAA6	1
CAA7	1
C5A6	1
C5A7	1
C6AB	1
C6AC	1
C6AD	1
C6AE	1
CA88	1
C8B6	1
CA87	1
55	1
75	1
C399	1
C39A	1
C39B	1
C39C	1
C3B9	1
C3BA	1
C3BB	1
C3BC	1
C5A8	1
C5A9	1
C5AA	1
C5AB	1
C5AC	1
C5AD	1
C5AE	1
C5AF	1
C5B0	1
C5B1	1
C5B2	1
C5B3	1
C6AF	1
C6B0	1
C793	1
C794	1
C795	1
C796	1
C797	1
C798	1
C799	1
C79A	1
C79B	1
C79C	1
C894	1
C895	1
C896	1
C897	1
CDA7	1
CA89	1
C9A5	1
CAAE	1
CAAF	1
C69C	1
C9AF	1
C9B0	1
C6B1	1
CA8A	1
56	1
76	1
CDAE	1
C6B2	1
CA8B	1
CA8C	1
57	1
77	1
C5B4	1
C5B5	1
CAB7	1
CA8D	1
58	1
78	1
CBA3	1
CDAF	1
59	1
79	1
C39D	1
C3BD	1
C3BF	1
C5B6	1
C5B7	1
C5B8	1
C8B2	1
C8B3	1
CAB8	1
CA8F	1
C6B3	1
C6B4	1
5A	1
7A	1
C5BD	1
C5BE	1
C68D	1
C5B9	1
C5BA	1
C5BB	1
C5BC	1
C6B5	1
C6B6	1
C8A4	1
C8A5	1
CA90	1
CA91	1
C6B7	1
C7AE	1
C7AF	1
CA92	1
C6B8	1
C6B9	1
C6BA	1
CA93	1
C89C	1
C89D	1
C39E	1
C3BE	1
C6BF	1
C7B7	1
C6BB	1
C6A7	1
C6A8	1
C6BC	1
C6BD	1
C684	1
C685	1
CA94	1
CB80	1
CABC	1
C589	1
CBAE	1
CABE	1
CA95	1
CBA4	1
CABF	1
CB81	1
CAA1	1
CAA2	1
CA96	1
C780	1
C781	1
C782	1
C783	1
CA97	1
CA98	1
CAAC	1
CAAD	1
CE86	1
CE91	1
CEAC	1
CEB1	1
CE92	1
CEB2	1
CF90	1
CE93	1
CEB3	1
CE94	1
CEB4	1
CE88	1
CE95	1
CEAD	1
CEB5	1
CFB5	1
CF9C	1
CF9D	1
CF9A	1
CF9B	1
CE96	1
CEB6	1
CE89	1
CE97	1
CEAE	1
CEB7	1
CE98	1
CEB8	1
CF91	1
CFB4	1
CDBA	1
CE8A	1
CE90	1
CE99	1
CEAA	1
CEAF	1
CEB9	1
CF8A	1
CFB3	1
CE9A	1
CEBA	1
CFB0	1
CF97	1
CE9B	1
CEBB	1
C2B5	1
CE9C	1
CEBC	1
CE9D	1
CEBD	1
CE9E	1
CEBE	1
CE8C	1
CE9F	1
CEBF	1
CF8C	1
CEA0	1
CF80	1
CF96	1
CF9E	1
CF9F	1
CF98	1
CF99	1
CEA1	1
CF81	1
CFB1	1
CEA3	1
CF82	1
CF83	1
CFB2	1
CFB9	1
CEA4	1
CF84	1
CE8E	1
CEA5	1
CEAB	1
CEB0	1
CF85	1
CF8B	1
CF8D	1
CF92	1
CF93	1
CF94	1
CEA6	1
CF86	1
CF95	1
CEA7	1
CF87	1
CEA8	1
CF88	1
CE8F	1
CEA9	1
CF89	1
CF8E	1
CFA0	1
CFA1	1
CFB7	1
CFB8	1
CFBA	1
CFBB	1
CFA2	1
CFA3	1
CFA4	1
CFA5	1
CFA6	1
CFA7	1
CFA8	1
CFA9	1
CFAA	1
CFAB	1
CFAC	1
CFAD	1
CFAE	1
CFAF	1
D090	1
D0B0	1
D390	1
D391	1
D392	1
D393	1
D398	1
D399	1
D39A	1
D39B	1
D394	1
D395	1
D091	1
D0B1	1
D092	1
D0B2	1
D093	1
D0B3	1
D290	1
D291	1
D292	1
D293	1
D294	1
D295	1
D094	1
D0B4	1
D480	1
D481	1
D082	1
D192	1
D482	1
D483	1
D083	1
D193	1
D298	1
D299	1
D080	1
D081	1
D095	1
D0B5	1
D190	1
D191	1
D396	1
D397	1
D084	1
D194	1
D096	1
D0B6	1
D381	1
D382	1
D39C	1
D39D	1
D296	1
D297	1
D097	1
D0B7	1
D484	1
D485	1
D39E	1
D39F	1
D085	1
D195	1
D3A0	1
D3A1	1
D486	1
D487	1
D08D	1
D098	1
D0B8	1
D19D	1
D3A2	1
D3A3	1
D28A	1
D28B	1
D3A4	1
D3A5	1
D086	1
D196	1
D087	1
D197	1
D099	1
D0B9	1
D088	1
D198	1
D09A	1
D0BA	1
D29A	1
D29B	1
D383	1
D384	1
D2A0	1
D2A1	1
D29E	1
D29F	1
D29C	1
D29D	1
D09B	1
D0BB	1
D385	1
D386	1
D089	1
D199	1
D488	1
D489	1
D09C	1
D0BC	1
D38D	1
D38E	1
D09D	1
D0BD	1
D389	1
D38A	1
D2A2	1
D2A3	1
D387	1
D388	1
D2A4	1
D2A5	1
D08A	1
D19A	1
D48A	1
D48B	1
D09E	1
D0BE	1
D3A6	1
D3A7	1
D3A8	1
D3A9	1
D3AA	1
D3AB	1
D09F	1
D0BF	1
D2A6	1
D2A7	1
D280	1
D281	1
D0A0	1
D180	1
D28E	1
D28F	1
D0A1	1
D181	1
D48C	1
D48D	1
D2AA	1
D2AB	1
D0A2	1
D182	1
D48E	1
D48F	1
D2AC	1
D2AD	1
D08B	1
D19B	1
D08C	1
D19C	1
D0A3	1
D183	1
D3AE	1
D3AF	1
D08E	1
D19E	1
D3B0	1
D3B1	1
D3B2	1
D3B3	1
D2AE	1
D2AF	1
D2B0	1
D2B1	1
D1B8	1
D1B9	1
D0A4	1
D184	1
D0A5	1
D185	1
D2B2	1
D2B3	1
D2BA	1
D2BB	1
D1A0	1
D1A1	1
D1BE	1
D1BF	1
D1BC	1
D1BD	1
D1BA	1
D1BB	1
D0A6	1
D186	1
D2B4	1
D2B5	1
D0A7	1
D187	1
D3B4	1
D3B5	1
D2B6	1
D2B7	1
D38B	1
D38C	1
D2B8	1
D2B9	1
D2BC	1
D2BD	1
D2BE	1
D2BF	1
D08F	1
D19F	1
D0A8	1
D188	1
D0A9	1
D189	1
D0AA	1
D18A	1
D0AB	1
D18B	1
D3B8	1
D3B9	1
D0AC	1
D18C	1
D28C	1
D28D	1
D1A2	1
D1A3	1
D0AD	1
D18D	1
D3AC	1
D3AD	1
D0AE	1
D18E	1
D0AF	1
D18F	1
D1A4	1
D1A5	1
D1A6	1
D1A7	1
D1AA	1
D1AB	1
D1A8	1
D1A9	1
D1AC	1
D1AD	1
D1AE	1
D1AF	1
D1B0	1
D1B1	1
D1B2	1
D1B3	1
D1B4	1
D1B5	1
D1B6	1
D1B7	1
D2A8	1
D2A9	1
D380	1
D4B1	1
D5A1	1
D4B2	1
D5A2	1
D4B3	1
D5A3	1
D4B4	1
D5A4	1
D4B5	1
D5A5	1
D687	1
D4B6	1
D5A6	1
D4B7	1
D5A7	1
D4B8	1
D5A8	1
D4B9	1
D5A9	1
D4BA	1
D5AA	1
D4BB	1
D5AB	1
D4BC	1
D5AC	1
D4BD	1
D5AD	1
D4BE	1
D5AE	1
D4BF	1
D5AF	1
D580	1
D5B0	1
D581	1
D5B1	1
D582	1
D5B2	1
D583	1
D5B3	1
D584	1
D5B4	1
D585	1
D5B5	1
D586	1
D5B6	1
D587	1
D5B7	1
D588	1
D5B8	1
D589	1
D5B9	1
D58A	1
D5BA	1
D58B	1
D5BB	1
D58C	1
D5BC	1
D58D	1
D5BD	1
D58E	1
D5BE	1
D58F	1
D5BF	1
D590	1
D680	1
D591	1
D681	1
D592	1
D682	1
D593	1
D683	1
D594	1
D684	1
D595	1
D685	1
D596	1
D686	1
D599	1
D790	1
D791	1
D792	1
D793	1
D794	1
D795	1
D7B0	1
D7B1	1
D796	1
D797	1
D798	1
D799	1
D7B2	1
D79A	1
D79B	1
D79C	1
D79D	1
D79E	1
D79F	1
D7A0	1
D7A1	1
D7A2	1
D7A3	1
D7A4	1
D7A5	1
D7A6	1
D7A7	1
D7A8	1
D7A9	1
D7AA	1
D8A1	1
D9B4	1
DBBD	1
D8A2	1
D8A3	1
D9B2	1
D9B1	1
D8A4	1
D8A5	1
D9B3	1
D8A6	1
D8A7	1
D9B5	1
D9AE	1
D8A8	1
D9BB	1
D9BE	1
DA80	1
D8A9	1
D8AA	1
D8AB	1
D9B9	1
D9BA	1
D9BC	1
D9BD	1
D9BF	1
D8AC	1
DA83	1
DA84	1
DA86	1
DABF	1
DA87	1
D8AD	1
D8AE	1
DA81	1
DA82	1
DA85	1
D8AF	1
D8B0	1
DA88	1
DA89	1
DA8A	1
DA8B	1
DA8C	1
DA8D	1
DA8E	1
DA8F	1
DA90	1
DBAE	1
D8B1	1
D8B2	1
DA91	1
DA92	1
DA93	1
DA94	1
DA95	1
DA96	1
DA97	1
DA98	1
DA99	1
DBAF	1
D8B3	1
D8B4	1
DA9A	1
DA9B	1
DA9C	1
DBBA	1
D8B5	1
D8B6	1
DA9D	1
DA9E	1
DBBB	1
D8B7	1
D8B8	1
DA9F	1
D8B9	1
D8BA	1
DAA0	1
DBBC	1
D981	1
DAA1	1
DAA2	1
DAA3	1
DAA4	1
DAA5	1
DAA6	1
D9AF	1
D982	1
DAA7	1
DAA8	1
D983	1
DAA9	1
DAAA	1
DAAB	1
DAAC	1
DAAD	1
DAAE	1
DAAF	1
DAB0	1
DAB1	1
DAB2	1
DAB3	1
DAB4	1
D984	1
DAB5	1
DAB6	1
DAB7	1
DAB8	1
D985	1
DBBE	1
D986	1
DABA	1
DABB	1
DABC	1
DABD	1
DAB9	1
D987	1
DABE	1
DB81	1
DB82	1
DB83	1
DBBF	1
DB80	1
DB95	1
D988	1
DBA5	1
D9B6	1
DB84	1
DB85	1
DB86	1
DB87	1
D9B7	1
DB88	1
DB89	1
DB8A	1
DB8B	1
DB8F	1
D989	1
D98A	1
DBA6	1
D9B8	1
DB8C	1
DB8D	1
DB8E	1
DB90	1
DB91	1
DB92	1
DB93	1
DC90	1
DC92	1
DCAD	1
DC93	1
DC94	1
DCAE	1
DC96	1
DC95	1
DCAF	1
DC97	1
DC98	1
DC99	1
DD8D	1
DC9A	1
DC9B	1
DC9C	1
DC9D	1
DC9E	1
DC9F	1
DD8E	1
DCA0	1
DCA1	1
DCA2	1
DCA3	1
DCA4	1
DCA5	1
DCA6	1
DCA7	1
DD8F	1
DCA8	1
DCA9	1
DCAA	1
DCAB	1
DCAC	1
DE80	1
DE99	1
DE9A	1
DE81	1
DE82	1
DE83	1
DE9C	1
DE84	1
DE85	1
DE86	1
DE87	1
DEA2	1
DEA3	1
DE88	1
DEA5	1
DE89	1
DE8A	1
DE8B	1
DE9B	1
DE8C	1
DE98	1
DEA0	1
DEA1	1
DE8D	1
DE8E	1
DEA4	1
DE8F	1
DE90	1
DE9D	1
DE9E	1
DE9F	1
DE91	1
DE92	1
DE93	1
DE94	1
DE95	1
DE96	1
DE97	1
DEB1	1
DEA6	1
DEA7	1
DEA8	1
DEA9	1
DEAA	1
DEAB	1
DEAC	1
DEAD	1
DEAE	1
DEAF	1
DEB0	1
E4B880	1
E4B881	1
E4B882	1
E4B883	1
E4B884	1
E4B885	1
E4B886	1
E4B887	1
E4B888	1
E4B889	1
E4B88A	1
E4B88B	1
E4B88C	1
E4B88D	1
E4B88E	1
E4B88F	1
E4B890	1
E4B891	1
E4B892	1
E4B893	1
E4B894	1
E4B895	1
E4B896	1
E4B897	1
E4B898	1
E4B899	1
E4B89A	1
E4B89B	1
E4B89C	1
E4B89D	1
E4B89E	1
E4B89F	1
E4B8A0	1
E4B8A1	1
E4B8A2	1
E4B8A3	1
E4B8A4	1
E4B8A5	1
E4B8A6	1
E4B8A7	1
E4B8A8	1
E4B8A9	1
E4B8AA	1
E4B8AB	1
E4B8AC	1
E4B8AD	1
E4B8AE	1
E4B8AF	1
E4B8B0	1
E4B8B1	1
E4B8B2	1
E4B8B3	1
E4B8B4	1
E4B8B5	1
E4B8B6	1
E4B8B7	1
E4B8B8	1
E4B8B9	1
E4B8BA	1
E4B8BB	1
E4B8BC	1
E4B8BD	1
E4B8BE	1
E4B8BF	1
E4B980	1
E4B981	1
E4B982	1
E4B983	1
E4B984	1
E4B985	1
E4B986	1
E4B987	1
E4B988	1
E4B989	1
E4B98A	1
E4B98B	1
E4B98C	1
E4B98D	1
E4B98E	1
E4B98F	1
E4B990	1
E4B991	1
E4B992	1
E4B993	1
E4B994	1
E4B995	1
E4B996	1
E4B997	1
E4B998	1
E4B999	1
E4B99A	1
E4B99B	1
E4B99C	1
E4B99D	1
E4B99E	1
E4B99F	1
E4B9A0	1
E4B9A1	1
E4B9A2	1
E4B9A3	1
E4B9A4	1
E4B9A5	1
E4B9A6	1
E4B9A7	1
E4B9A8	1
E4B9A9	1
E4B9AA	1
E4B9AB	1
E4B9AC	1
E4B9AD	1
E4B9AE	1
E4B9AF	1
E4B9B0	1
E4B9B1	1
E4B9B2	1
E4B9B3	1
E4B9B4	1
E4B9B5	1
E4B9B6	1
E4B9B7	1
E4B9B8	1
E4B9B9	1
E4B9BA	1
E4B9BB	1
E4B9BC	1
E4B9BD	1
E4B9BE	1
E4B9BF	1
E4BA80	1
E4BA81	1
E4BA82	1
E4BA83	1
E4BA84	1
E4BA85	1
E4BA86	1
E4BA87	1
E4BA88	1
E4BA89	1
E4BA8A	1
E4BA8B	1
E4BA8C	1
E4BA8D	1
E4BA8E	1
E4BA8F	1
E4BA90	1
E4BA91	1
E4BA92	1
E4BA93	1
E4BA94	1
E4BA95	1
E4BA96	1
E4BA97	1
E4BA98	1
E4BA99	1
E4BA9A	1
E4BA9B	1
E4BA9C	1
E4BA9D	1
E4BA9E	1
E4BA9F	1
E4BAA0	1
E4BAA1	1
E4BAA2	1
E4BAA3	1
E4BAA4	1
E4BAA5	1
E4BAA6	1
E4BAA7	1
E4BAA8	1
E4BAA9	1
E4BAAA	1
E4BAAB	1
E4BAAC	1
E4BAAD	1
E4BAAE	1
E4BAAF	1
E4BAB0	1
E4BAB1	1
E4BAB2	1
E4BAB3	1
E4BAB4	1
E4BAB5	1
E4BAB6	1
E4BAB7	1
E4BAB8	1
E4BAB9	1
E4BABA	1
E4BABB	1
E4BABC	1
E4BABD	1
E4BABE	1
E4BABF	1
E4BB80	1
E4BB81	1
E4BB82	1
E4BB83	1
E4BB84	1
E4BB85	1
E4BB86	1
E4BB87	1
E4BB88	1
E4BB89	1
E4BB8A	1
E4BB8B	1
E4BB8C	1
E4BB8D	1
E4BB8E	1
E4BB8F	1
E4BB90	1
E4BB91	1
E4BB92	1
E4BB93	1
E4BB94	1
E4BB95	1
E4BB96	1
E4BB97	1
E4BB98	1
E4BB99	1
E4BB9A	1
E4BB9B	1
E4BB9C	1
E4BB9D	1
E4BB9E	1
E4BB9F	1
E4BBA0	1
E4BBA1	1
E4BBA2	1
E4BBA3	1
E4BBA4	1
E4BBA5	1
E4BBA6	1
E4BBA7	1
E4BBA8	1
E4BBA9	1
E4BBAA	1
E4BBAB	1
E4BBAC	1
E4BBAD	1
E4BBAE	1
E4BBAF	1
E4BBB0	1
E4BBB1	1
E4BBB2	1
E4BBB3	1
E4BBB4	1
E4BBB5	1
E4BBB6	1
E4BBB7	1
E4BBB8	1
E4BBB9	1
E4BBBA	1
E4BBBB	1
E4BBBC	1
E4BBBD	1
E4BBBE	1
E4BBBF	1
E4BC80	1
E4BC81	1
E4BC82	1
E4BC83	1
E4BC84	1
E4BC85	1
E4BC86	1
E4BC87	1
E4BC88	1
E4BC89	1
E4BC8A	1
E4BC8B	1
E4BC8C	1
E4BC8D	1
E4BC8E	1
E4BC8F	1
E4BC90	1
E4BC91	1
E4BC92	1
E4BC93	1
E4BC94	1
E4BC95	1
E4BC96	1
E4BC97	1
E4BC98	1
E4BC99	1
E4BC9A	1
E4BC9B	1
E4BC9C	1
E4BC9D	1
E4BC9E	1
E4BC9F	1
E4BCA0	1
E4BCA1	1
E4BCA2	1
E4BCA3	1
E4BCA4	1
E4BCA5	1
E4BCA6	1
E4BCA7	1
E4BCA8	1
E4BCA9	1
E4BCAA	1
E4BCAB	1
E4BCAC	1
E4BCAD	1
E4BCAE	1
E4BCAF	1
E4BCB0	1
E4BCB1	1
E4BCB2	1
E4BCB3	1
E4BCB4	1
E4BCB5	1
E4BCB6	1
E4BCB7	1
E4BCB8	1
E4BCB9	1
E4BCBA	1
E4BCBB	1
E4BCBC	1
E4BCBD	1
E4BCBE	1
E4BCBF	1
E4BD80	1
E4BD81	1
E4BD82	1
E4BD83	1
E4BD84	1
E4BD85	1
E4BD86	1
E4BD87	1
E4BD88	1
E4BD89	1
E4BD8A	1
E4BD8B	1
E4BD8C	1
E4BD8D	1
E4BD8E	1
E4BD8F	1
E4BD90	1
E4BD91	1
E4BD92	1
E4BD93	1
E4BD94	1
E4BD95	1
E4BD96	1
E4BD97	1
E4BD98	1
E4BD99	1
E4BD9A	1
E4BD9B	1
E4BD9C	1
E4BD9D	1
E4BD9E	1
E4BD9F	1
E4BDA0	1
E4BDA1	1
E4BDA2	1
E4BDA3	1
E4BDA4	1
E4BDA5	1
E4BDA6	1
E4BDA7	1
E4BDA8	1
E4BDA9	1
E4BDAA	1
E4BDAB	1
E4BDAC	1
E4BDAD	1
E4BDAE	1
E4BDAF	1
E4BDB0	1
E4BDB1	1
E4BDB2	1
E4BDB3	1
E4BDB4	1
E4BDB5	1
E4BDB6	1
E4BDB7	1
E4BDB8	1
E4BDB9	1
E4BDBA	1
E4BDBB	1
E4BDBC	1
E4BDBD	1
E4BDBE	1
E4BDBF	1
E4BE80	1
E4BE81	1
E4BE82	1
E4BE83	1
E4BE84	1
E4BE85	1
E4BE86	1
E4BE87	1
E4BE88	1
E4BE89	1
E4BE8A	1
E4BE8B	1
E4BE8C	1
E4BE8D	1
E4BE8E	1
E4BE8F	1
E4BE90	1
E4BE91	1
E4BE92	1
E4BE93	1
E4BE94	1
E4BE95	1
E4BE96	1
E4BE97	1
E4BE98	1
E4BE99	1
E4BE9A	1
E4BE9B	1
E4BE9C	1
E4BE9D	1
E4BE9E	1
E4BE9F	1
E4BEA0	1
E4BEA1	1
E4BEA2	1
E4BEA3	1
E4BEA4	1
E4BEA5	1
E4BEA6	1
E4BEA7	1
E4BEA8	1
E4BEA9	1
E4BEAA	1
E4BEAB	1
E4BEAC	1
E4BEAD	1
E4BEAE	1
E4BEAF	1
E4BEB0	1
E4BEB1	1
E4BEB2	1
E4BEB3	1
E4BEB4	1
E4BEB5	1
E4BEB6	1
E4BEB7	1
E4BEB8	1
E4BEB9	1
E4BEBA	1
E4BEBB	1
E4BEBC	1
E4BEBD	1
E4BEBE	1
E4BEBF	1
E4BF80	1
E4BF81	1
E4BF82	1
E4BF83	1
E4BF84	1
E4BF85	1
E4BF86	1
E4BF87	1
E4BF88	1
E4BF89	1
E4BF8A	1
E4BF8B	1
E4BF8C	1
E4BF8D	1
E4BF8E	1
E4BF8F	1
E4BF90	1
E4BF91	1
E4BF92	1
E4BF93	1
E4BF94	1
E4BF95	1
E4BF96	1
E4BF97	1
E4BF98	1
E4BF99	1
E4BF9A	1
E4BF9B	1
E4BF9C	1
E4BF9D	1
E4BF9E	1
E4BF9F	1
E4BFA0	1
E4BFA1	1
E4BFA2	1
E4BFA3	1
E4BFA4	1
E4BFA5	1
E4BFA6	1
E4BFA7	1
E4BFA8	1
E4BFA9	1
E4BFAA	1
E4BFAB	1
E4BFAC	1
E4BFAD	1
E4BFAE	1
E4BFAF	1
E4BFB0	1
E4BFB1	1
E4BFB2	1
E4BFB3	1
E4BFB4	1
E4BFB5	1
E4BFB6	1
E4BFB7	1
E4BFB8	1
E4BFB9	1
E4BFBA	1
E4BFBB	1
E4BFBC	1
E4BFBD	1
E4BFBE	1
E4BFBF	1
C8B7	1
C8B8	1
C8B9	1
C8BA	1
C8BB	1
C8BC	1
C8BD	1
C8BE	1
C8BF	1
C980	1
C981	1
C982	1
C983	1
C984	1
C985	1
C986	1
C987	1
C988	1
C989	1
C98A	1
C98B	1
C98C	1
C98D	1
C98E	1
C98F	1
CD98	1
CD99	1
CD9A	1
CD9B	1
CD9C	1
CDB0	1
CDB1	1
CDB2	1
CDB3	1
CDB6	1
CDB7	1
CDB8	1
CDB9	1
CDBB	1
CDBC	1
CDBD	1
CDBF	1
CE80	1
CE81	1
CE82	1
CE83	1
CE8B	1
CE8D	1
CEA2	1
CF8F	1
CFBC	1
CFBD	1
CFBE	1
CFBF	1
D287	1
D38F	1
D3B6	1
D3B7	1
D3BA	1
D3BB	1
D3BC	1
D3BD	1
D3BE	1
D3BF	1
D490	1
D491	1
D492	1
D493	1
D494	1
D495	1
D496	1
D497	1
D498	1
D499	1
D49A	1
D49B	1
D49C	1
D49D	1
D49E	1
D49F	1
D4A0	1
D4A1	1
D4A2	1
D4A3	1
D4A4	1
D4A5	1
D4A6	1
D4A7	1
D4A8	1
D4A9	1
D4AA	1
D4AB	1
D4AC	1
D4AD	1
D4AE	1
D4AF	1
D4B0	1
D597	1
D598	1
D5A0	1
D688	1
D68B	1
D68C	1
D68D	1
D68E	1
D68F	1
D690	1
D6A2	1
D6BA	1
D785	1
D786	1
D787	1
D788	1
D789	1
D78A	1
D78B	1
D78C	1
D78D	1
D78E	1
D78F	1
D7AB	1
D7AC	1
D7AD	1
D7AE	1
D7AF	1
D7B5	1
D7B6	1
D7B7	1
D7B8	1
D7B9	1
D7BA	1
D7BB	1
D7BC	1
D7BD	1
D7BE	1
D7BF	1
D884	1
D885	1
D886	1
D887	1
D888	1
D889	1
D88A	1
D88B	1
D896	1
D897	1
D898	1
D899	1
D89A	1
D89C	1
D89D	1
D89E	1
D8A0	1
D8BB	1
D8BC	1
D8BD	1
D8BE	1
D8BF	1
D999	1
D99A	1
D99B	1
D99C	1
D99D	1
D99E	1
D99F	1
DC8E	1
DD8B	1
DD8C	1
DD90	1
DD91	1
DD92	1
DD93	1
DD94	1
DD95	1
DD96	1
DD97	1
DD98	1
DD99	1
DD9A	1
DD9B	1
DD9C	1
DD9D	1
DD9E	1
DD9F	1
DDA0	1
DDA1	1
DDA2	1
DDA3	1
DDA4	1
DDA5	1
DDA6	1
DDA7	1
DDA8	1
DDA9	1
DDAA	1
DDAB	1
DDAC	1
DDAD	1
DDAE	1
DDAF	1
DDB0	1
DDB1	1
DDB2	1
DDB3	1
DDB4	1
DDB5	1
DDB6	1
DDB7	1
DDB8	1
DDB9	1
DDBA	1
DDBB	1
DDBC	1
DDBD	1
DDBE	1
DDBF	1
DEB2	1
DEB3	1
DEB4	1
DEB5	1
DEB6	1
DEB7	1
DEB8	1
DEB9	1
DEBA	1
DEBB	1
DEBC	1
DEBD	1
DEBE	1
DEBF	1
DF80	1
DF81	1
DF82	1
DF83	1
DF84	1
DF85	1
DF86	1
DF87	1
DF88	1
DF89	1
DF8A	1
DF8B	1
DF8C	1
DF8D	1
DF8E	1
DF8F	1
DF90	1
DF91	1
DF92	1
DF93	1
DF94	1
DF95	1
DF96	1
DF97	1
DF98	1
DF99	1
DF9A	1
DF9B	1
DF9C	1
DF9D	1
DF9E	1
DF9F	1
DFA0	1
DFA1	1
DFA2	1
DFA3	1
DFA4	1
DFA5	1
DFA6	1
DFA7	1
DFA8	1
DFA9	1
DFAA	1
DFAB	1
DFAC	1
DFAD	1
DFAE	1
DFAF	1
DFB0	1
DFB1	1
DFB2	1
DFB3	1
DFB4	1
DFB5	1
DFB6	1
DFB7	1
DFB8	1
DFB9	1
DFBA	1
DFBB	1
DFBC	1
DFBD	1
DFBE	1
DFBF	1
DROP TABLE IF EXISTS test.t1;
DROP TABLE IF EXISTS test.t1;
DROP DATABASE test;
CREATE DATABASE test CHARACTER SET utf8mb3;
USE test;
CREATE TABLE test.t1 (a CHAR(4) CHARACTER SET utf8mb3 COLLATE utf8mb3_roman_ci) ENGINE=MyISAM CHARACTER SET utf8mb3 COLLATE utf8mb3_roman_ci;
Warnings:
Warning	1287	'utf8mb3' is deprecated and will be removed in a future release. Please use utf8mb4 instead
Warning	3778	'utf8mb3_roman_ci' is a collation of the deprecated character set UTF8MB3. Please consider using UTF8MB4 with an appropriate collation instead.
Warning	1287	'utf8mb3' is deprecated and will be removed in a future release. Please use utf8mb4 instead
Warning	3778	'utf8mb3_roman_ci' is a collation of the deprecated character set UTF8MB3. Please consider using UTF8MB4 with an appropriate collation instead.
SHOW TABLE STATUS LIKE 't1';
Name	Engine	Version	Row_format	Rows	Avg_row_length	Data_length	Max_data_length	Index_length	Data_free	Auto_increment	Create_time	Update_time	Check_time	Collation	Checksum	Create_options	Comment
t1	MyISAM	#	#	#	#	#	#	#	#	#	#	#	#	utf8mb3_roman_ci	#	#	#
LOAD DATA INFILE 
'MYSQL_TEST_DIR/suite/funcs_2/data/charset_utf8.txt' INTO TABLE test.t1;
DELETE FROM test.t1 WHERE CHAR_LENGTH(a) <> 1;
SELECT HEX(ORD(a)) AS a_ord, CHAR_LENGTH(a) AS a_len FROM test.t1 ORDER BY a, ORD(a);
a_ord	a_len
C285	1
7F	1
C280	1
C281	1
C282	1
C283	1
C284	1
C286	1
C287	1
C288	1
C289	1
C28A	1
C28B	1
C28C	1
C28D	1
C28E	1
C28F	1
C290	1
C291	1
C292	1
C293	1
C294	1
C295	1
C296	1
C297	1
C298	1
C299	1
C29A	1
C29B	1
C29C	1
C29D	1
C29E	1
C29F	1
C2A0	1
CC80	1
CC81	1
CC82	1
CC83	1
CC84	1
CC85	1
CC86	1
CC87	1
CC88	1
CC89	1
CC8A	1
CC8B	1
CC8C	1
CC8D	1
CC8E	1
CC8F	1
CC90	1
CC91	1
CC92	1
CC93	1
CC94	1
CC95	1
CC96	1
CC97	1
CC98	1
CC99	1
CC9A	1
CC9B	1
CC9C	1
CC9D	1
CC9E	1
CC9F	1
CCA0	1
CCA1	1
CCA2	1
CCA3	1
CCA4	1
CCA5	1
CCA6	1
CCA7	1
CCA8	1
CCA9	1
CCAA	1
CCAB	1
CCAC	1
CCAD	1
CCAE	1
CCAF	1
CCB0	1
CCB1	1
CCB2	1
CCB3	1
CCB4	1
CCB5	1
CCB6	1
CCB7	1
CCB8	1
CCB9	1
CCBA	1
CCBB	1
CCBC	1
CCBD	1
CCBE	1
CCBF	1
CD80	1
CD81	1
CD82	1
CD83	1
CD84	1
CD85	1
CD86	1
CD87	1
CD88	1
CD89	1
CD8A	1
CD8B	1
CD8C	1
CD8D	1
CD8E	1
CD8F	1
CD90	1
CD91	1
CD92	1
CD93	1
CD94	1
CD95	1
CD96	1
CD97	1
CD9D	1
CD9E	1
CD9F	1
CDA0	1
CDA1	1
CDA2	1
D283	1
D284	1
D285	1
D286	1
D288	1
D289	1
D691	1
D692	1
D693	1
D694	1
D695	1
D696	1
D697	1
D698	1
D699	1
D69A	1
D69B	1
D69C	1
D69D	1
D69E	1
D69F	1
D6A0	1
D6A1	1
D6A3	1
D6A4	1
D6A5	1
D6A6	1
D6A7	1
D6A8	1
D6A9	1
D6AA	1
D6AB	1
D6AC	1
D6AD	1
D6AE	1
D6AF	1
D6B0	1
D6B1	1
D6B2	1
D6B3	1
D6B4	1
D6B5	1
D6B6	1
D6B7	1
D6B8	1
D6B9	1
D6BB	1
D6BC	1
D6BD	1
D6BF	1
D781	1
D782	1
D784	1
D880	1
D881	1
D882	1
D883	1
D890	1
D891	1
D892	1
D893	1
D894	1
D895	1
D98B	1
D98C	1
D98D	1
D98E	1
D98F	1
D990	1
D991	1
D992	1
D993	1
D994	1
D995	1
D996	1
D997	1
D998	1
D9B0	1
DB96	1
DB97	1
DB98	1
DB99	1
DB9A	1
DB9B	1
DB9C	1
DB9D	1
DB9E	1
DB9F	1
DBA0	1
DBA1	1
DBA2	1
DBA3	1
DBA4	1
DBA7	1
DBA8	1
DBAA	1
DBAB	1
DBAC	1
DBAD	1
DC8F	1
DC91	1
DCB0	1
DCB1	1
DCB2	1
DCB3	1
DCB4	1
DCB5	1
DCB6	1
DCB7	1
DCB8	1
DCB9	1
DCBA	1
DCBB	1
DCBC	1
DCBD	1
DCBE	1
DCBF	1
DD80	1
DD81	1
DD82	1
DD83	1
DD84	1
DD85	1
DD86	1
DD87	1
DD88	1
DD89	1
DD8A	1
D980	1
60	1
C2B4	1
CE84	1
CB9C	1
5E	1
C2AF	1
CB98	1
CB99	1
C2A8	1
CE85	1
CB9A	1
CB9D	1
C2B8	1
CB9B	1
5F	1
C2AD	1
2D	1
D68A	1
2C	1
D59D	1
D88C	1
D88D	1
D9AB	1
D9AC	1
3B	1
CDBE	1
D89B	1
3A	1
D689	1
DC83	1
DC84	1
DC85	1
DC86	1
DC87	1
DC88	1
21	1
C2A1	1
D59C	1
3F	1
C2BF	1
D59E	1
D89F	1
DC89	1
2E	1
DB94	1
DC81	1
DC82	1
C2B7	1
CE87	1
DC80	1
27	1
22	1
C2AB	1
C2BB	1
28	1
29	1
5B	1
7B	1
7D	1
C2A7	1
C2B6	1
C2A9	1
C2AE	1
40	1
2A	1
D9AD	1
2F	1
26	1
23	1
25	1
D9AA	1
D59A	1
D59B	1
D59F	1
D6BE	1
D780	1
D783	1
D7B3	1
D7B4	1
DC8A	1
DC8B	1
DC8C	1
DC8D	1
CAB9	1
CDB4	1
CDB5	1
CABA	1
CB82	1
CB83	1
CB84	1
CB85	1
CB86	1
CB87	1
CB88	1
CB89	1
CB8A	1
CB8B	1
CB8C	1
CB8D	1
CB8E	1
CB8F	1
CB92	1
CB93	1
CB94	1
CB95	1
CB96	1
CB97	1
CB9E	1
CB9F	1
CBA5	1
CBA6	1
CBA7	1
CBA8	1
CBA9	1
CBAA	1
CBAB	1
CBAC	1
CBAD	1
CBAF	1
CBB0	1
CBB1	1
CBB2	1
CBB3	1
CBB4	1
CBB5	1
CBB6	1
CBB7	1
CBB8	1
CBB9	1
CBBA	1
CBBB	1
CBBC	1
CBBD	1
CBBE	1
CBBF	1
C2B0	1
D282	1
D88E	1
D88F	1
DBA9	1
CFB6	1
2B	1
C2B1	1
C3B7	1
C397	1
3C	1
3D	1
3E	1
C2AC	1
7C	1
C2A6	1
7E	1
CB90	1
CB91	1
C2A4	1
C2A2	1
24	1
C2A3	1
C2A5	1
30	1
D9A0	1
DBB0	1
31	1
C2B9	1
D9A1	1
DBB1	1
C2BD	1
C2BC	1
32	1
C2B2	1
D9A2	1
DBB2	1
33	1
C2B3	1
D9A3	1
DBB3	1
C2BE	1
34	1
D9A4	1
DBB4	1
35	1
D9A5	1
DBB5	1
36	1
D9A6	1
DBB6	1
37	1
D9A7	1
DBB7	1
38	1
D9A8	1
DBB8	1
39	1
D9A9	1
DBB9	1
41	1
61	1
C2AA	1
C380	1
C381	1
C382	1
C383	1
C384	1
C385	1
C3A0	1
C3A1	1
C3A2	1
C3A3	1
C3A4	1
C3A5	1
C480	1
C481	1
C482	1
C483	1
C484	1
C485	1
C78D	1
C78E	1
C79E	1
C79F	1
C7A0	1
C7A1	1
C7BA	1
C7BB	1
C880	1
C881	1
C882	1
C883	1
C8A6	1
C8A7	1
CDA3	1
C386	1
C3A6	1
C7A2	1
C7A3	1
C7BC	1
C7BD	1
C990	1
C991	1
C992	1
42	1
62	1
CA99	1
C680	1
C681	1
C993	1
C682	1
C683	1
43	1
63	1
C387	1
C3A7	1
C486	1
C487	1
C488	1
C489	1
C48A	1
C48B	1
C48C	1
C48D	1
CDA8	1
C687	1
C688	1
C995	1
44	1
64	1
C48E	1
C48F	1
CDA9	1
C784	1
C785	1
C786	1
C7B1	1
C7B2	1
C7B3	1
CAA3	1
CAA5	1
CAA4	1
C490	1
C491	1
C689	1
C996	1
C68A	1
C997	1
C68B	1
C68C	1
C8A1	1
C390	1
C3B0	1
45	1
65	1
C388	1
C389	1
C38A	1
C38B	1
C3A8	1
C3A9	1
C3AA	1
C3AB	1
C492	1
C493	1
C494	1
C495	1
C496	1
C497	1
C498	1
C499	1
C49A	1
C49B	1
C884	1
C885	1
C886	1
C887	1
C8A8	1
C8A9	1
CDA4	1
C68E	1
C79D	1
C68F	1
C999	1
C690	1
C99B	1
C998	1
C99A	1
C99C	1
C99D	1
C99E	1
CA9A	1
C9A4	1
46	1
66	1
CAA9	1
C691	1
C692	1
47	1
67	1
C49C	1
C49D	1
C49E	1
C49F	1
C4A0	1
C4A1	1
C4A2	1
C4A3	1
C7A6	1
C7A7	1
C7B4	1
C7B5	1
C9A1	1
C9A2	1
C7A4	1
C7A5	1
C693	1
C9A0	1
CA9B	1
C694	1
C9A3	1
CBA0	1
C6A2	1
C6A3	1
48	1
68	1
C4A4	1
C4A5	1
C89E	1
C89F	1
CAB0	1
CDAA	1
CA9C	1
C695	1
C7B6	1
C4A6	1
C4A7	1
C9A6	1
CAB1	1
C9A7	1
CABB	1
CABD	1
49	1
4A	1
69	1
6A	1
C38C	1
C38D	1
C38E	1
C38F	1
C3AC	1
C3AD	1
C3AE	1
C3AF	1
C4A8	1
C4A9	1
C4AA	1
C4AB	1
C4AC	1
C4AD	1
C4AE	1
C4AF	1
C4B0	1
C78F	1
C790	1
C888	1
C889	1
C88A	1
C88B	1
CDA5	1
C4B2	1
C4B3	1
C4B1	1
C9AA	1
C697	1
C9A8	1
C696	1
C9A9	1
C4B4	1
C4B5	1
C7B0	1
CAB2	1
CA9D	1
C99F	1
CA84	1
4B	1
6B	1
C4B6	1
C4B7	1
C7A8	1
C7A9	1
C698	1
C699	1
CA9E	1
4C	1
6C	1
C4B9	1
C4BA	1
C4BB	1
C4BC	1
C4BD	1
C4BE	1
CBA1	1
C4BF	1
C580	1
C787	1
C788	1
C789	1
CAAA	1
CAAB	1
CA9F	1
C581	1
C582	1
C69A	1
C9AB	1
C9AC	1
C9AD	1
C8B4	1
C9AE	1
C69B	1
CA8E	1
4D	1
6D	1
CDAB	1
C9B1	1
4E	1
6E	1
C391	1
C3B1	1
C583	1
C584	1
C585	1
C586	1
C587	1
C588	1
C7B8	1
C7B9	1
C78A	1
C78B	1
C78C	1
C9B4	1
C69D	1
C9B2	1
C69E	1
C8A0	1
C9B3	1
C8B5	1
C58A	1
C58B	1
4F	1
6F	1
C2BA	1
C392	1
C393	1
C394	1
C395	1
C396	1
C3B2	1
C3B3	1
C3B4	1
C3B5	1
C3B6	1
C58C	1
C58D	1
C58E	1
C58F	1
C590	1
C591	1
C6A0	1
C6A1	1
C791	1
C792	1
C7AA	1
C7AB	1
C7AC	1
C7AD	1
C88C	1
C88D	1
C88E	1
C88F	1
C8AA	1
C8AB	1
C8AC	1
C8AD	1
C8AE	1
C8AF	1
C8B0	1
C8B1	1
CDA6	1
C592	1
C593	1
C9B6	1
C398	1
C3B8	1
C7BE	1
C7BF	1
C686	1
C994	1
C69F	1
C9B5	1
C9B7	1
C8A2	1
C8A3	1
50	1
70	1
C6A4	1
C6A5	1
C9B8	1
51	1
71	1
CAA0	1
C4B8	1
52	1
72	1
C594	1
C595	1
C596	1
C597	1
C598	1
C599	1
C890	1
C891	1
C892	1
C893	1
CAB3	1
CDAC	1
C6A6	1
CA80	1
C9B9	1
CAB4	1
C9BA	1
C9BB	1
CAB5	1
C9BC	1
C9BD	1
C9BE	1
C9BF	1
CA81	1
CAB6	1
53	1
73	1
C59A	1
C59B	1
C59C	1
C59D	1
C59E	1
C59F	1
C5A0	1
C5A1	1
C5BF	1
C898	1
C899	1
CBA2	1
C39F	1
CA82	1
C6A9	1
CA83	1
C6AA	1
CA85	1
CA86	1
54	1
74	1
C5A2	1
C5A3	1
C5A4	1
C5A5	1
C89A	1
C89B	1
CDAD	1
CAA8	1
C6BE	1
CAA6	1
CAA7	1
C5A6	1
C5A7	1
C6AB	1
C6AC	1
C6AD	1
C6AE	1
CA88	1
C8B6	1
CA87	1
C399	1
C39A	1
C39B	1
C39C	1
C3B9	1
C3BA	1
C3BB	1
C3BC	1
C5A8	1
C5A9	1
C5AA	1
C5AB	1
C5AC	1
C5AD	1
C5AE	1
C5AF	1
C5B0	1
C5B1	1
C5B2	1
C5B3	1
C6AF	1
C6B0	1
C793	1
C794	1
C795	1
C796	1
C797	1
C798	1
C799	1
C79A	1
C79B	1
C79C	1
C894	1
C895	1
C896	1
C897	1
CDA7	1
CA89	1
C9A5	1
CAAE	1
CAAF	1
C69C	1
C9AF	1
C9B0	1
C6B1	1
CA8A	1
55	1
56	1
75	1
76	1
CDAE	1
C6B2	1
CA8B	1
CA8C	1
57	1
77	1
C5B4	1
C5B5	1
CAB7	1
CA8D	1
58	1
78	1
CBA3	1
CDAF	1
59	1
79	1
C39D	1
C3BD	1
C3BF	1
C5B6	1
C5B7	1
C5B8	1
C8B2	1
C8B3	1
CAB8	1
CA8F	1
C6B3	1
C6B4	1
5A	1
7A	1
C5B9	1
C5BA	1
C5BB	1
C5BC	1
C5BD	1
C5BE	1
C68D	1
C6B5	1
C6B6	1
C8A4	1
C8A5	1
CA90	1
CA91	1
C6B7	1
C7AE	1
C7AF	1
CA92	1
C6B8	1
C6B9	1
C6BA	1
CA93	1
C89C	1
C89D	1
C39E	1
C3BE	1
C6BF	1
C7B7	1
C6BB	1
C6A7	1
C6A8	1
C6BC	1
C6BD	1
C684	1
C685	1
CA94	1
CB80	1
CABC	1
C589	1
CBAE	1
CABE	1
CA95	1
CBA4	1
CABF	1
CB81	1
CAA1	1
CAA2	1
CA96	1
C780	1
C781	1
C782	1
C783	1
CA97	1
CA98	1
CAAC	1
CAAD	1
CE86	1
CE91	1
CEAC	1
CEB1	1
CE92	1
CEB2	1
CF90	1
CE93	1
CEB3	1
CE94	1
CEB4	1
CE88	1
CE95	1
CEAD	1
CEB5	1
CFB5	1
CF9C	1
CF9D	1
CF9A	1
CF9B	1
CE96	1
CEB6	1
CE89	1
CE97	1
CEAE	1
CEB7	1
CE98	1
CEB8	1
CF91	1
CFB4	1
CDBA	1
CE8A	1
CE90	1
CE99	1
CEAA	1
CEAF	1
CEB9	1
CF8A	1
CFB3	1
CE9A	1
CEBA	1
CFB0	1
CF97	1
CE9B	1
CEBB	1
C2B5	1
CE9C	1
CEBC	1
CE9D	1
CEBD	1
CE9E	1
CEBE	1
CE8C	1
CE9F	1
CEBF	1
CF8C	1
CEA0	1
CF80	1
CF96	1
CF9E	1
CF9F	1
CF98	1
CF99	1
CEA1	1
CF81	1
CFB1	1
CEA3	1
CF82	1
CF83	1
CFB2	1
CFB9	1
CEA4	1
CF84	1
CE8E	1
CEA5	1
CEAB	1
CEB0	1
CF85	1
CF8B	1
CF8D	1
CF92	1
CF93	1
CF94	1
CEA6	1
CF86	1
CF95	1
CEA7	1
CF87	1
CEA8	1
CF88	1
CE8F	1
CEA9	1
CF89	1
CF8E	1
CFA0	1
CFA1	1
CFB7	1
CFB8	1
CFBA	1
CFBB	1
CFA2	1
CFA3	1
CFA4	1
CFA5	1
CFA6	1
CFA7	1
CFA8	1
CFA9	1
CFAA	1
CFAB	1
CFAC	1
CFAD	1
CFAE	1
CFAF	1
D090	1
D0B0	1
D390	1
D391	1
D392	1
D393	1
D398	1
D399	1
D39A	1
D39B	1
D394	1
D395	1
D091	1
D0B1	1
D092	1
D0B2	1
D093	1
D0B3	1
D290	1
D291	1
D292	1
D293	1
D294	1
D295	1
D094	1
D0B4	1
D480	1
D481	1
D082	1
D192	1
D482	1
D483	1
D083	1
D193	1
D298	1
D299	1
D080	1
D081	1
D095	1
D0B5	1
D190	1
D191	1
D396	1
D397	1
D084	1
D194	1
D096	1
D0B6	1
D381	1
D382	1
D39C	1
D39D	1
D296	1
D297	1
D097	1
D0B7	1
D484	1
D485	1
D39E	1
D39F	1
D085	1
D195	1
D3A0	1
D3A1	1
D486	1
D487	1
D08D	1
D098	1
D0B8	1
D19D	1
D3A2	1
D3A3	1
D28A	1
D28B	1
D3A4	1
D3A5	1
D086	1
D196	1
D087	1
D197	1
D099	1
D0B9	1
D088	1
D198	1
D09A	1
D0BA	1
D29A	1
D29B	1
D383	1
D384	1
D2A0	1
D2A1	1
D29E	1
D29F	1
D29C	1
D29D	1
D09B	1
D0BB	1
D385	1
D386	1
D089	1
D199	1
D488	1
D489	1
D09C	1
D0BC	1
D38D	1
D38E	1
D09D	1
D0BD	1
D389	1
D38A	1
D2A2	1
D2A3	1
D387	1
D388	1
D2A4	1
D2A5	1
D08A	1
D19A	1
D48A	1
D48B	1
D09E	1
D0BE	1
D3A6	1
D3A7	1
D3A8	1
D3A9	1
D3AA	1
D3AB	1
D09F	1
D0BF	1
D2A6	1
D2A7	1
D280	1
D281	1
D0A0	1
D180	1
D28E	1
D28F	1
D0A1	1
D181	1
D48C	1
D48D	1
D2AA	1
D2AB	1
D0A2	1
D182	1
D48E	1
D48F	1
D2AC	1
D2AD	1
D08B	1
D19B	1
D08C	1
D19C	1
D0A3	1
D183	1
D3AE	1
D3AF	1
D08E	1
D19E	1
D3B0	1
D3B1	1
D3B2	1
D3B3	1
D2AE	1
D2AF	1
D2B0	1
D2B1	1
D1B8	1
D1B9	1
D0A4	1
D184	1
D0A5	1
D185	1
D2B2	1
D2B3	1
D2BA	1
D2BB	1
D1A0	1
D1A1	1
D1BE	1
D1BF	1
D1BC	1
D1BD	1
D1BA	1
D1BB	1
D0A6	1
D186	1
D2B4	1
D2B5	1
D0A7	1
D187	1
D3B4	1
D3B5	1
D2B6	1
D2B7	1
D38B	1
D38C	1
D2B8	1
D2B9	1
D2BC	1
D2BD	1
D2BE	1
D2BF	1
D08F	1
D19F	1
D0A8	1
D188	1
D0A9	1
D189	1
D0AA	1
D18A	1
D0AB	1
D18B	1
D3B8	1
D3B9	1
D0AC	1
D18C	1
D28C	1
D28D	1
D1A2	1
D1A3	1
D0AD	1
D18D	1
D3AC	1
D3AD	1
D0AE	1
D18E	1
D0AF	1
D18F	1
D1A4	1
D1A5	1
D1A6	1
D1A7	1
D1AA	1
D1AB	1
D1A8	1
D1A9	1
D1AC	1
D1AD	1
D1AE	1
D1AF	1
D1B0	1
D1B1	1
D1B2	1
D1B3	1
D1B4	1
D1B5	1
D1B6	1
D1B7	1
D2A8	1
D2A9	1
D380	1
D4B1	1
D5A1	1
D4B2	1
D5A2	1
D4B3	1
D5A3	1
D4B4	1
D5A4	1
D4B5	1
D5A5	1
D687	1
D4B6	1
D5A6	1
D4B7	1
D5A7	1
D4B8	1
D5A8	1
D4B9	1
D5A9	1
D4BA	1
D5AA	1
D4BB	1
D5AB	1
D4BC	1
D5AC	1
D4BD	1
D5AD	1
D4BE	1
D5AE	1
D4BF	1
D5AF	1
D580	1
D5B0	1
D581	1
D5B1	1
D582	1
D5B2	1
D583	1
D5B3	1
D584	1
D5B4	1
D585	1
D5B5	1
D586	1
D5B6	1
D587	1
D5B7	1
D588	1
D5B8	1
D589	1
D5B9	1
D58A	1
D5BA	1
D58B	1
D5BB	1
D58C	1
D5BC	1
D58D	1
D5BD	1
D58E	1
D5BE	1
D58F	1
D5BF	1
D590	1
D680	1
D591	1
D681	1
D592	1
D682	1
D593	1
D683	1
D594	1
D684	1
D595	1
D685	1
D596	1
D686	1
D599	1
D790	1
D791	1
D792	1
D793	1
D794	1
D795	1
D7B0	1
D7B1	1
D796	1
D797	1
D798	1
D799	1
D7B2	1
D79A	1
D79B	1
D79C	1
D79D	1
D79E	1
D79F	1
D7A0	1
D7A1	1
D7A2	1
D7A3	1
D7A4	1
D7A5	1
D7A6	1
D7A7	1
D7A8	1
D7A9	1
D7AA	1
D8A1	1
D9B4	1
DBBD	1
D8A2	1
D8A3	1
D9B2	1
D9B1	1
D8A4	1
D8A5	1
D9B3	1
D8A6	1
D8A7	1
D9B5	1
D9AE	1
D8A8	1
D9BB	1
D9BE	1
DA80	1
D8A9	1
D8AA	1
D8AB	1
D9B9	1
D9BA	1
D9BC	1
D9BD	1
D9BF	1
D8AC	1
DA83	1
DA84	1
DA86	1
DABF	1
DA87	1
D8AD	1
D8AE	1
DA81	1
DA82	1
DA85	1
D8AF	1
D8B0	1
DA88	1
DA89	1
DA8A	1
DA8B	1
DA8C	1
DA8D	1
DA8E	1
DA8F	1
DA90	1
DBAE	1
D8B1	1
D8B2	1
DA91	1
DA92	1
DA93	1
DA94	1
DA95	1
DA96	1
DA97	1
DA98	1
DA99	1
DBAF	1
D8B3	1
D8B4	1
DA9A	1
DA9B	1
DA9C	1
DBBA	1
D8B5	1
D8B6	1
DA9D	1
DA9E	1
DBBB	1
D8B7	1
D8B8	1
DA9F	1
D8B9	1
D8BA	1
DAA0	1
DBBC	1
D981	1
DAA1	1
DAA2	1
DAA3	1
DAA4	1
DAA5	1
DAA6	1
D9AF	1
D982	1
DAA7	1
DAA8	1
D983	1
DAA9	1
DAAA	1
DAAB	1
DAAC	1
DAAD	1
DAAE	1
DAAF	1
DAB0	1
DAB1	1
DAB2	1
DAB3	1
DAB4	1
D984	1
DAB5	1
DAB6	1
DAB7	1
DAB8	1
D985	1
DBBE	1
D986	1
DABA	1
DABB	1
DABC	1
DABD	1
DAB9	1
D987	1
DABE	1
DB81	1
DB82	1
DB83	1
DBBF	1
DB80	1
DB95	1
D988	1
DBA5	1
D9B6	1
DB84	1
DB85	1
DB86	1
DB87	1
D9B7	1
DB88	1
DB89	1
DB8A	1
DB8B	1
DB8F	1
D989	1
D98A	1
DBA6	1
D9B8	1
DB8C	1
DB8D	1
DB8E	1
DB90	1
DB91	1
DB92	1
DB93	1
DC90	1
DC92	1
DCAD	1
DC93	1
DC94	1
DCAE	1
DC96	1
DC95	1
DCAF	1
DC97	1
DC98	1
DC99	1
DD8D	1
DC9A	1
DC9B	1
DC9C	1
DC9D	1
DC9E	1
DC9F	1
DD8E	1
DCA0	1
DCA1	1
DCA2	1
DCA3	1
DCA4	1
DCA5	1
DCA6	1
DCA7	1
DD8F	1
DCA8	1
DCA9	1
DCAA	1
DCAB	1
DCAC	1
DE80	1
DE99	1
DE9A	1
DE81	1
DE82	1
DE83	1
DE9C	1
DE84	1
DE85	1
DE86	1
DE87	1
DEA2	1
DEA3	1
DE88	1
DEA5	1
DE89	1
DE8A	1
DE8B	1
DE9B	1
DE8C	1
DE98	1
DEA0	1
DEA1	1
DE8D	1
DE8E	1
DEA4	1
DE8F	1
DE90	1
DE9D	1
DE9E	1
DE9F	1
DE91	1
DE92	1
DE93	1
DE94	1
DE95	1
DE96	1
DE97	1
DEB1	1
DEA6	1
DEA7	1
DEA8	1
DEA9	1
DEAA	1
DEAB	1
DEAC	1
DEAD	1
DEAE	1
DEAF	1
DEB0	1
E4B880	1
E4B881	1
E4B882	1
E4B883	1
E4B884	1
E4B885	1
E4B886	1
E4B887	1
E4B888	1
E4B889	1
E4B88A	1
E4B88B	1
E4B88C	1
E4B88D	1
E4B88E	1
E4B88F	1
E4B890	1
E4B891	1
E4B892	1
E4B893	1
E4B894	1
E4B895	1
E4B896	1
E4B897	1
E4B898	1
E4B899	1
E4B89A	1
E4B89B	1
E4B89C	1
E4B89D	1
E4B89E	1
E4B89F	1
E4B8A0	1
E4B8A1	1
E4B8A2	1
E4B8A3	1
E4B8A4	1
E4B8A5	1
E4B8A6	1
E4B8A7	1
E4B8A8	1
E4B8A9	1
E4B8AA	1
E4B8AB	1
E4B8AC	1
E4B8AD	1
E4B8AE	1
E4B8AF	1
E4B8B0	1
E4B8B1	1
E4B8B2	1
E4B8B3	1
E4B8B4	1
E4B8B5	1
E4B8B6	1
E4B8B7	1
E4B8B8	1
E4B8B9	1
E4B8BA	1
E4B8BB	1
E4B8BC	1
E4B8BD	1
E4B8BE	1
E4B8BF	1
E4B980	1
E4B981	1
E4B982	1
E4B983	1
E4B984	1
E4B985	1
E4B986	1
E4B987	1
E4B988	1
E4B989	1
E4B98A	1
E4B98B	1
E4B98C	1
E4B98D	1
E4B98E	1
E4B98F	1
E4B990	1
E4B991	1
E4B992	1
E4B993	1
E4B994	1
E4B995	1
E4B996	1
E4B997	1
E4B998	1
E4B999	1
E4B99A	1
E4B99B	1
E4B99C	1
E4B99D	1
E4B99E	1
E4B99F	1
E4B9A0	1
E4B9A1	1
E4B9A2	1
E4B9A3	1
E4B9A4	1
E4B9A5	1
E4B9A6	1
E4B9A7	1
E4B9A8	1
E4B9A9	1
E4B9AA	1
E4B9AB	1
E4B9AC	1
E4B9AD	1
E4B9AE	1
E4B9AF	1
E4B9B0	1
E4B9B1	1
E4B9B2	1
E4B9B3	1
E4B9B4	1
E4B9B5	1
E4B9B6	1
E4B9B7	1
E4B9B8	1
E4B9B9	1
E4B9BA	1
E4B9BB	1
E4B9BC	1
E4B9BD	1
E4B9BE	1
E4B9BF	1
E4BA80	1
E4BA81	1
E4BA82	1
E4BA83	1
E4BA84	1
E4BA85	1
E4BA86	1
E4BA87	1
E4BA88	1
E4BA89	1
E4BA8A	1
E4BA8B	1
E4BA8C	1
E4BA8D	1
E4BA8E	1
E4BA8F	1
E4BA90	1
E4BA91	1
E4BA92	1
E4BA93	1
E4BA94	1
E4BA95	1
E4BA96	1
E4BA97	1
E4BA98	1
E4BA99	1
E4BA9A	1
E4BA9B	1
E4BA9C	1
E4BA9D	1
E4BA9E	1
E4BA9F	1
E4BAA0	1
E4BAA1	1
E4BAA2	1
E4BAA3	1
E4BAA4	1
E4BAA5	1
E4BAA6	1
E4BAA7	1
E4BAA8	1
E4BAA9	1
E4BAAA	1
E4BAAB	1
E4BAAC	1
E4BAAD	1
E4BAAE	1
E4BAAF	1
E4BAB0	1
E4BAB1	1
E4BAB2	1
E4BAB3	1
E4BAB4	1
E4BAB5	1
E4BAB6	1
E4BAB7	1
E4BAB8	1
E4BAB9	1
E4BABA	1
E4BABB	1
E4BABC	1
E4BABD	1
E4BABE	1
E4BABF	1
E4BB80	1
E4BB81	1
E4BB82	1
E4BB83	1
E4BB84	1
E4BB85	1
E4BB86	1
E4BB87	1
E4BB88	1
E4BB89	1
E4BB8A	1
E4BB8B	1
E4BB8C	1
E4BB8D	1
E4BB8E	1
E4BB8F	1
E4BB90	1
E4BB91	1
E4BB92	1
E4BB93	1
E4BB94	1
E4BB95	1
E4BB96	1
E4BB97	1
E4BB98	1
E4BB99	1
E4BB9A	1
E4BB9B	1
E4BB9C	1
E4BB9D	1
E4BB9E	1
E4BB9F	1
E4BBA0	1
E4BBA1	1
E4BBA2	1
E4BBA3	1
E4BBA4	1
E4BBA5	1
E4BBA6	1
E4BBA7	1
E4BBA8	1
E4BBA9	1
E4BBAA	1
E4BBAB	1
E4BBAC	1
E4BBAD	1
E4BBAE	1
E4BBAF	1
E4BBB0	1
E4BBB1	1
E4BBB2	1
E4BBB3	1
E4BBB4	1
E4BBB5	1
E4BBB6	1
E4BBB7	1
E4BBB8	1
E4BBB9	1
E4BBBA	1
E4BBBB	1
E4BBBC	1
E4BBBD	1
E4BBBE	1
E4BBBF	1
E4BC80	1
E4BC81	1
E4BC82	1
E4BC83	1
E4BC84	1
E4BC85	1
E4BC86	1
E4BC87	1
E4BC88	1
E4BC89	1
E4BC8A	1
E4BC8B	1
E4BC8C	1
E4BC8D	1
E4BC8E	1
E4BC8F	1
E4BC90	1
E4BC91	1
E4BC92	1
E4BC93	1
E4BC94	1
E4BC95	1
E4BC96	1
E4BC97	1
E4BC98	1
E4BC99	1
E4BC9A	1
E4BC9B	1
E4BC9C	1
E4BC9D	1
E4BC9E	1
E4BC9F	1
E4BCA0	1
E4BCA1	1
E4BCA2	1
E4BCA3	1
E4BCA4	1
E4BCA5	1
E4BCA6	1
E4BCA7	1
E4BCA8	1
E4BCA9	1
E4BCAA	1
E4BCAB	1
E4BCAC	1
E4BCAD	1
E4BCAE	1
E4BCAF	1
E4BCB0	1
E4BCB1	1
E4BCB2	1
E4BCB3	1
E4BCB4	1
E4BCB5	1
E4BCB6	1
E4BCB7	1
E4BCB8	1
E4BCB9	1
E4BCBA	1
E4BCBB	1
E4BCBC	1
E4BCBD	1
E4BCBE	1
E4BCBF	1
E4BD80	1
E4BD81	1
E4BD82	1
E4BD83	1
E4BD84	1
E4BD85	1
E4BD86	1
E4BD87	1
E4BD88	1
E4BD89	1
E4BD8A	1
E4BD8B	1
E4BD8C	1
E4BD8D	1
E4BD8E	1
E4BD8F	1
E4BD90	1
E4BD91	1
E4BD92	1
E4BD93	1
E4BD94	1
E4BD95	1
E4BD96	1
E4BD97	1
E4BD98	1
E4BD99	1
E4BD9A	1
E4BD9B	1
E4BD9C	1
E4BD9D	1
E4BD9E	1
E4BD9F	1
E4BDA0	1
E4BDA1	1
E4BDA2	1
E4BDA3	1
E4BDA4	1
E4BDA5	1
E4BDA6	1
E4BDA7	1
E4BDA8	1
E4BDA9	1
E4BDAA	1
E4BDAB	1
E4BDAC	1
E4BDAD	1
E4BDAE	1
E4BDAF	1
E4BDB0	1
E4BDB1	1
E4BDB2	1
E4BDB3	1
E4BDB4	1
E4BDB5	1
E4BDB6	1
E4BDB7	1
E4BDB8	1
E4BDB9	1
E4BDBA	1
E4BDBB	1
E4BDBC	1
E4BDBD	1
E4BDBE	1
E4BDBF	1
E4BE80	1
E4BE81	1
E4BE82	1
E4BE83	1
E4BE84	1
E4BE85	1
E4BE86	1
E4BE87	1
E4BE88	1
E4BE89	1
E4BE8A	1
E4BE8B	1
E4BE8C	1
E4BE8D	1
E4BE8E	1
E4BE8F	1
E4BE90	1
E4BE91	1
E4BE92	1
E4BE93	1
E4BE94	1
E4BE95	1
E4BE96	1
E4BE97	1
E4BE98	1
E4BE99	1
E4BE9A	1
E4BE9B	1
E4BE9C	1
E4BE9D	1
E4BE9E	1
E4BE9F	1
E4BEA0	1
E4BEA1	1
E4BEA2	1
E4BEA3	1
E4BEA4	1
E4BEA5	1
E4BEA6	1
E4BEA7	1
E4BEA8	1
E4BEA9	1
E4BEAA	1
E4BEAB	1
E4BEAC	1
E4BEAD	1
E4BEAE	1
E4BEAF	1
E4BEB0	1
E4BEB1	1
E4BEB2	1
E4BEB3	1
E4BEB4	1
E4BEB5	1
E4BEB6	1
E4BEB7	1
E4BEB8	1
E4BEB9	1
E4BEBA	1
E4BEBB	1
E4BEBC	1
E4BEBD	1
E4BEBE	1
E4BEBF	1
E4BF80	1
E4BF81	1
E4BF82	1
E4BF83	1
E4BF84	1
E4BF85	1
E4BF86	1
E4BF87	1
E4BF88	1
E4BF89	1
E4BF8A	1
E4BF8B	1
E4BF8C	1
E4BF8D	1
E4BF8E	1
E4BF8F	1
E4BF90	1
E4BF91	1
E4BF92	1
E4BF93	1
E4BF94	1
E4BF95	1
E4BF96	1
E4BF97	1
E4BF98	1
E4BF99	1
E4BF9A	1
E4BF9B	1
E4BF9C	1
E4BF9D	1
E4BF9E	1
E4BF9F	1
E4BFA0	1
E4BFA1	1
E4BFA2	1
E4BFA3	1
E4BFA4	1
E4BFA5	1
E4BFA6	1
E4BFA7	1
E4BFA8	1
E4BFA9	1
E4BFAA	1
E4BFAB	1
E4BFAC	1
E4BFAD	1
E4BFAE	1
E4BFAF	1
E4BFB0	1
E4BFB1	1
E4BFB2	1
E4BFB3	1
E4BFB4	1
E4BFB5	1
E4BFB6	1
E4BFB7	1
E4BFB8	1
E4BFB9	1
E4BFBA	1
E4BFBB	1
E4BFBC	1
E4BFBD	1
E4BFBE	1
E4BFBF	1
C8B7	1
C8B8	1
C8B9	1
C8BA	1
C8BB	1
C8BC	1
C8BD	1
C8BE	1
C8BF	1
C980	1
C981	1
C982	1
C983	1
C984	1
C985	1
C986	1
C987	1
C988	1
C989	1
C98A	1
C98B	1
C98C	1
C98D	1
C98E	1
C98F	1
CD98	1
CD99	1
CD9A	1
CD9B	1
CD9C	1
CDB0	1
CDB1	1
CDB2	1
CDB3	1
CDB6	1
CDB7	1
CDB8	1
CDB9	1
CDBB	1
CDBC	1
CDBD	1
CDBF	1
CE80	1
CE81	1
CE82	1
CE83	1
CE8B	1
CE8D	1
CEA2	1
CF8F	1
CFBC	1
CFBD	1
CFBE	1
CFBF	1
D287	1
D38F	1
D3B6	1
D3B7	1
D3BA	1
D3BB	1
D3BC	1
D3BD	1
D3BE	1
D3BF	1
D490	1
D491	1
D492	1
D493	1
D494	1
D495	1
D496	1
D497	1
D498	1
D499	1
D49A	1
D49B	1
D49C	1
D49D	1
D49E	1
D49F	1
D4A0	1
D4A1	1
D4A2	1
D4A3	1
D4A4	1
D4A5	1
D4A6	1
D4A7	1
D4A8	1
D4A9	1
D4AA	1
D4AB	1
D4AC	1
D4AD	1
D4AE	1
D4AF	1
D4B0	1
D597	1
D598	1
D5A0	1
D688	1
D68B	1
D68C	1
D68D	1
D68E	1
D68F	1
D690	1
D6A2	1
D6BA	1
D785	1
D786	1
D787	1
D788	1
D789	1
D78A	1
D78B	1
D78C	1
D78D	1
D78E	1
D78F	1
D7AB	1
D7AC	1
D7AD	1
D7AE	1
D7AF	1
D7B5	1
D7B6	1
D7B7	1
D7B8	1
D7B9	1
D7BA	1
D7BB	1
D7BC	1
D7BD	1
D7BE	1
D7BF	1
D884	1
D885	1
D886	1
D887	1
D888	1
D889	1
D88A	1
D88B	1
D896	1
D897	1
D898	1
D899	1
D89A	1
D89C	1
D89D	1
D89E	1
D8A0	1
D8BB	1
D8BC	1
D8BD	1
D8BE	1
D8BF	1
D999	1
D99A	1
D99B	1
D99C	1
D99D	1
D99E	1
D99F	1
DC8E	1
DD8B	1
DD8C	1
DD90	1
DD91	1
DD92	1
DD93	1
DD94	1
DD95	1
DD96	1
DD97	1
DD98	1
DD99	1
DD9A	1
DD9B	1
DD9C	1
DD9D	1
DD9E	1
DD9F	1
DDA0	1
DDA1	1
DDA2	1
DDA3	1
DDA4	1
DDA5	1
DDA6	1
DDA7	1
DDA8	1
DDA9	1
DDAA	1
DDAB	1
DDAC	1
DDAD	1
DDAE	1
DDAF	1
DDB0	1
DDB1	1
DDB2	1
DDB3	1
DDB4	1
DDB5	1
DDB6	1
DDB7	1
DDB8	1
DDB9	1
DDBA	1
DDBB	1
DDBC	1
DDBD	1
DDBE	1
DDBF	1
DEB2	1
DEB3	1
DEB4	1
DEB5	1
DEB6	1
DEB7	1
DEB8	1
DEB9	1
DEBA	1
DEBB	1
DEBC	1
DEBD	1
DEBE	1
DEBF	1
DF80	1
DF81	1
DF82	1
DF83	1
DF84	1
DF85	1
DF86	1
DF87	1
DF88	1
DF89	1
DF8A	1
DF8B	1
DF8C	1
DF8D	1
DF8E	1
DF8F	1
DF90	1
DF91	1
DF92	1
DF93	1
DF94	1
DF95	1
DF96	1
DF97	1
DF98	1
DF99	1
DF9A	1
DF9B	1
DF9C	1
DF9D	1
DF9E	1
DF9F	1
DFA0	1
DFA1	1
DFA2	1
DFA3	1
DFA4	1
DFA5	1
DFA6	1
DFA7	1
DFA8	1
DFA9	1
DFAA	1
DFAB	1
DFAC	1
DFAD	1
DFAE	1
DFAF	1
DFB0	1
DFB1	1
DFB2	1
DFB3	1
DFB4	1
DFB5	1
DFB6	1
DFB7	1
DFB8	1
DFB9	1
DFBA	1
DFBB	1
DFBC	1
DFBD	1
DFBE	1
DFBF	1
DROP TABLE IF EXISTS test.t1;
DROP TABLE IF EXISTS test.t1;
DROP DATABASE test;
CREATE DATABASE test CHARACTER SET utf8mb3;
USE test;
CREATE TABLE test.t1 (a CHAR(4) CHARACTER SET utf8mb3 COLLATE utf8mb3_romanian_ci) ENGINE=MyISAM CHARACTER SET utf8mb3 COLLATE utf8mb3_romanian_ci;
Warnings:
Warning	1287	'utf8mb3' is deprecated and will be removed in a future release. Please use utf8mb4 instead
Warning	3778	'utf8mb3_romanian_ci' is a collation of the deprecated character set UTF8MB3. Please consider using UTF8MB4 with an appropriate collation instead.
Warning	1287	'utf8mb3' is deprecated and will be removed in a future release. Please use utf8mb4 instead
Warning	3778	'utf8mb3_romanian_ci' is a collation of the deprecated character set UTF8MB3. Please consider using UTF8MB4 with an appropriate collation instead.
SHOW TABLE STATUS LIKE 't1';
Name	Engine	Version	Row_format	Rows	Avg_row_length	Data_length	Max_data_length	Index_length	Data_free	Auto_increment	Create_time	Update_time	Check_time	Collation	Checksum	Create_options	Comment
t1	MyISAM	#	#	#	#	#	#	#	#	#	#	#	#	utf8mb3_romanian_ci	#	#	#
LOAD DATA INFILE 
'MYSQL_TEST_DIR/suite/funcs_2/data/charset_utf8.txt' INTO TABLE test.t1;
DELETE FROM test.t1 WHERE CHAR_LENGTH(a) <> 1;
SELECT HEX(ORD(a)) AS a_ord, CHAR_LENGTH(a) AS a_len FROM test.t1 ORDER BY a, ORD(a);
a_ord	a_len
C285	1
7F	1
C280	1
C281	1
C282	1
C283	1
C284	1
C286	1
C287	1
C288	1
C289	1
C28A	1
C28B	1
C28C	1
C28D	1
C28E	1
C28F	1
C290	1
C291	1
C292	1
C293	1
C294	1
C295	1
C296	1
C297	1
C298	1
C299	1
C29A	1
C29B	1
C29C	1
C29D	1
C29E	1
C29F	1
C2A0	1
CC80	1
CC81	1
CC82	1
CC83	1
CC84	1
CC85	1
CC86	1
CC87	1
CC88	1
CC89	1
CC8A	1
CC8B	1
CC8C	1
CC8D	1
CC8E	1
CC8F	1
CC90	1
CC91	1
CC92	1
CC93	1
CC94	1
CC95	1
CC96	1
CC97	1
CC98	1
CC99	1
CC9A	1
CC9B	1
CC9C	1
CC9D	1
CC9E	1
CC9F	1
CCA0	1
CCA1	1
CCA2	1
CCA3	1
CCA4	1
CCA5	1
CCA6	1
CCA7	1
CCA8	1
CCA9	1
CCAA	1
CCAB	1
CCAC	1
CCAD	1
CCAE	1
CCAF	1
CCB0	1
CCB1	1
CCB2	1
CCB3	1
CCB4	1
CCB5	1
CCB6	1
CCB7	1
CCB8	1
CCB9	1
CCBA	1
CCBB	1
CCBC	1
CCBD	1
CCBE	1
CCBF	1
CD80	1
CD81	1
CD82	1
CD83	1
CD84	1
CD85	1
CD86	1
CD87	1
CD88	1
CD89	1
CD8A	1
CD8B	1
CD8C	1
CD8D	1
CD8E	1
CD8F	1
CD90	1
CD91	1
CD92	1
CD93	1
CD94	1
CD95	1
CD96	1
CD97	1
CD9D	1
CD9E	1
CD9F	1
CDA0	1
CDA1	1
CDA2	1
D283	1
D284	1
D285	1
D286	1
D288	1
D289	1
D691	1
D692	1
D693	1
D694	1
D695	1
D696	1
D697	1
D698	1
D699	1
D69A	1
D69B	1
D69C	1
D69D	1
D69E	1
D69F	1
D6A0	1
D6A1	1
D6A3	1
D6A4	1
D6A5	1
D6A6	1
D6A7	1
D6A8	1
D6A9	1
D6AA	1
D6AB	1
D6AC	1
D6AD	1
D6AE	1
D6AF	1
D6B0	1
D6B1	1
D6B2	1
D6B3	1
D6B4	1
D6B5	1
D6B6	1
D6B7	1
D6B8	1
D6B9	1
D6BB	1
D6BC	1
D6BD	1
D6BF	1
D781	1
D782	1
D784	1
D880	1
D881	1
D882	1
D883	1
D890	1
D891	1
D892	1
D893	1
D894	1
D895	1
D98B	1
D98C	1
D98D	1
D98E	1
D98F	1
D990	1
D991	1
D992	1
D993	1
D994	1
D995	1
D996	1
D997	1
D998	1
D9B0	1
DB96	1
DB97	1
DB98	1
DB99	1
DB9A	1
DB9B	1
DB9C	1
DB9D	1
DB9E	1
DB9F	1
DBA0	1
DBA1	1
DBA2	1
DBA3	1
DBA4	1
DBA7	1
DBA8	1
DBAA	1
DBAB	1
DBAC	1
DBAD	1
DC8F	1
DC91	1
DCB0	1
DCB1	1
DCB2	1
DCB3	1
DCB4	1
DCB5	1
DCB6	1
DCB7	1
DCB8	1
DCB9	1
DCBA	1
DCBB	1
DCBC	1
DCBD	1
DCBE	1
DCBF	1
DD80	1
DD81	1
DD82	1
DD83	1
DD84	1
DD85	1
DD86	1
DD87	1
DD88	1
DD89	1
DD8A	1
D980	1
60	1
C2B4	1
CE84	1
CB9C	1
5E	1
C2AF	1
CB98	1
CB99	1
C2A8	1
CE85	1
CB9A	1
CB9D	1
C2B8	1
CB9B	1
5F	1
C2AD	1
2D	1
D68A	1
2C	1
D59D	1
D88C	1
D88D	1
D9AB	1
D9AC	1
3B	1
CDBE	1
D89B	1
3A	1
D689	1
DC83	1
DC84	1
DC85	1
DC86	1
DC87	1
DC88	1
21	1
C2A1	1
D59C	1
3F	1
C2BF	1
D59E	1
D89F	1
DC89	1
2E	1
DB94	1
DC81	1
DC82	1
C2B7	1
CE87	1
DC80	1
27	1
22	1
C2AB	1
C2BB	1
28	1
29	1
5B	1
7B	1
7D	1
C2A7	1
C2B6	1
C2A9	1
C2AE	1
40	1
2A	1
D9AD	1
2F	1
26	1
23	1
25	1
D9AA	1
D59A	1
D59B	1
D59F	1
D6BE	1
D780	1
D783	1
D7B3	1
D7B4	1
DC8A	1
DC8B	1
DC8C	1
DC8D	1
CAB9	1
CDB4	1
CDB5	1
CABA	1
CB82	1
CB83	1
CB84	1
CB85	1
CB86	1
CB87	1
CB88	1
CB89	1
CB8A	1
CB8B	1
CB8C	1
CB8D	1
CB8E	1
CB8F	1
CB92	1
CB93	1
CB94	1
CB95	1
CB96	1
CB97	1
CB9E	1
CB9F	1
CBA5	1
CBA6	1
CBA7	1
CBA8	1
CBA9	1
CBAA	1
CBAB	1
CBAC	1
CBAD	1
CBAF	1
CBB0	1
CBB1	1
CBB2	1
CBB3	1
CBB4	1
CBB5	1
CBB6	1
CBB7	1
CBB8	1
CBB9	1
CBBA	1
CBBB	1
CBBC	1
CBBD	1
CBBE	1
CBBF	1
C2B0	1
D282	1
D88E	1
D88F	1
DBA9	1
CFB6	1
2B	1
C2B1	1
C3B7	1
C397	1
3C	1
3D	1
3E	1
C2AC	1
7C	1
C2A6	1
7E	1
CB90	1
CB91	1
C2A4	1
C2A2	1
24	1
C2A3	1
C2A5	1
30	1
D9A0	1
DBB0	1
31	1
C2B9	1
D9A1	1
DBB1	1
C2BD	1
C2BC	1
32	1
C2B2	1
D9A2	1
DBB2	1
33	1
C2B3	1
D9A3	1
DBB3	1
C2BE	1
34	1
D9A4	1
DBB4	1
35	1
D9A5	1
DBB5	1
36	1
D9A6	1
DBB6	1
37	1
D9A7	1
DBB7	1
38	1
D9A8	1
DBB8	1
39	1
D9A9	1
DBB9	1
41	1
61	1
C2AA	1
C380	1
C381	1
C383	1
C384	1
C385	1
C3A0	1
C3A1	1
C3A3	1
C3A4	1
C3A5	1
C480	1
C481	1
C484	1
C485	1
C78D	1
C78E	1
C79E	1
C79F	1
C7A0	1
C7A1	1
C7BA	1
C7BB	1
C880	1
C881	1
C882	1
C883	1
C8A6	1
C8A7	1
CDA3	1
C482	1
C483	1
C382	1
C3A2	1
C386	1
C3A6	1
C7A2	1
C7A3	1
C7BC	1
C7BD	1
C990	1
C991	1
C992	1
42	1
62	1
CA99	1
C680	1
C681	1
C993	1
C682	1
C683	1
43	1
63	1
C387	1
C3A7	1
C486	1
C487	1
C488	1
C489	1
C48A	1
C48B	1
C48C	1
C48D	1
CDA8	1
C687	1
C688	1
C995	1
44	1
64	1
C48E	1
C48F	1
CDA9	1
C784	1
C785	1
C786	1
C7B1	1
C7B2	1
C7B3	1
CAA3	1
CAA5	1
CAA4	1
C490	1
C491	1
C689	1
C996	1
C68A	1
C997	1
C68B	1
C68C	1
C8A1	1
C390	1
C3B0	1
45	1
65	1
C388	1
C389	1
C38A	1
C38B	1
C3A8	1
C3A9	1
C3AA	1
C3AB	1
C492	1
C493	1
C494	1
C495	1
C496	1
C497	1
C498	1
C499	1
C49A	1
C49B	1
C884	1
C885	1
C886	1
C887	1
C8A8	1
C8A9	1
CDA4	1
C68E	1
C79D	1
C68F	1
C999	1
C690	1
C99B	1
C998	1
C99A	1
C99C	1
C99D	1
C99E	1
CA9A	1
C9A4	1
46	1
66	1
CAA9	1
C691	1
C692	1
47	1
67	1
C49C	1
C49D	1
C49E	1
C49F	1
C4A0	1
C4A1	1
C4A2	1
C4A3	1
C7A6	1
C7A7	1
C7B4	1
C7B5	1
C9A1	1
C9A2	1
C7A4	1
C7A5	1
C693	1
C9A0	1
CA9B	1
C694	1
C9A3	1
CBA0	1
C6A2	1
C6A3	1
48	1
68	1
C4A4	1
C4A5	1
C89E	1
C89F	1
CAB0	1
CDAA	1
CA9C	1
C695	1
C7B6	1
C4A6	1
C4A7	1
C9A6	1
CAB1	1
C9A7	1
CABB	1
CABD	1
49	1
69	1
C38C	1
C38D	1
C38F	1
C3AC	1
C3AD	1
C3AF	1
C4A8	1
C4A9	1
C4AA	1
C4AB	1
C4AC	1
C4AD	1
C4AE	1
C4AF	1
C4B0	1
C78F	1
C790	1
C888	1
C889	1
C88A	1
C88B	1
CDA5	1
C4B2	1
C4B3	1
C38E	1
C3AE	1
C4B1	1
C9AA	1
C697	1
C9A8	1
C696	1
C9A9	1
4A	1
6A	1
C4B4	1
C4B5	1
C7B0	1
CAB2	1
CA9D	1
C99F	1
CA84	1
4B	1
6B	1
C4B6	1
C4B7	1
C7A8	1
C7A9	1
C698	1
C699	1
CA9E	1
4C	1
6C	1
C4B9	1
C4BA	1
C4BB	1
C4BC	1
C4BD	1
C4BE	1
CBA1	1
C4BF	1
C580	1
C787	1
C788	1
C789	1
CAAA	1
CAAB	1
CA9F	1
C581	1
C582	1
C69A	1
C9AB	1
C9AC	1
C9AD	1
C8B4	1
C9AE	1
C69B	1
CA8E	1
4D	1
6D	1
CDAB	1
C9B1	1
4E	1
6E	1
C391	1
C3B1	1
C583	1
C584	1
C585	1
C586	1
C587	1
C588	1
C7B8	1
C7B9	1
C78A	1
C78B	1
C78C	1
C9B4	1
C69D	1
C9B2	1
C69E	1
C8A0	1
C9B3	1
C8B5	1
C58A	1
C58B	1
4F	1
6F	1
C2BA	1
C392	1
C393	1
C394	1
C395	1
C396	1
C3B2	1
C3B3	1
C3B4	1
C3B5	1
C3B6	1
C58C	1
C58D	1
C58E	1
C58F	1
C590	1
C591	1
C6A0	1
C6A1	1
C791	1
C792	1
C7AA	1
C7AB	1
C7AC	1
C7AD	1
C88C	1
C88D	1
C88E	1
C88F	1
C8AA	1
C8AB	1
C8AC	1
C8AD	1
C8AE	1
C8AF	1
C8B0	1
C8B1	1
CDA6	1
C592	1
C593	1
C9B6	1
C398	1
C3B8	1
C7BE	1
C7BF	1
C686	1
C994	1
C69F	1
C9B5	1
C9B7	1
C8A2	1
C8A3	1
50	1
70	1
C6A4	1
C6A5	1
C9B8	1
51	1
71	1
CAA0	1
C4B8	1
52	1
72	1
C594	1
C595	1
C596	1
C597	1
C598	1
C599	1
C890	1
C891	1
C892	1
C893	1
CAB3	1
CDAC	1
C6A6	1
CA80	1
C9B9	1
CAB4	1
C9BA	1
C9BB	1
CAB5	1
C9BC	1
C9BD	1
C9BE	1
C9BF	1
CA81	1
CAB6	1
53	1
73	1
C59A	1
C59B	1
C59C	1
C59D	1
C5A0	1
C5A1	1
C5BF	1
CBA2	1
C39F	1
C59E	1
C59F	1
C898	1
C899	1
CA82	1
C6A9	1
CA83	1
C6AA	1
CA85	1
CA86	1
54	1
74	1
C5A4	1
C5A5	1
CDAD	1
CAA8	1
C6BE	1
CAA6	1
CAA7	1
C5A2	1
C5A3	1
C89A	1
C89B	1
C5A6	1
C5A7	1
C6AB	1
C6AC	1
C6AD	1
C6AE	1
CA88	1
C8B6	1
CA87	1
55	1
75	1
C399	1
C39A	1
C39B	1
C39C	1
C3B9	1
C3BA	1
C3BB	1
C3BC	1
C5A8	1
C5A9	1
C5AA	1
C5AB	1
C5AC	1
C5AD	1
C5AE	1
C5AF	1
C5B0	1
C5B1	1
C5B2	1
C5B3	1
C6AF	1
C6B0	1
C793	1
C794	1
C795	1
C796	1
C797	1
C798	1
C799	1
C79A	1
C79B	1
C79C	1
C894	1
C895	1
C896	1
C897	1
CDA7	1
CA89	1
C9A5	1
CAAE	1
CAAF	1
C69C	1
C9AF	1
C9B0	1
C6B1	1
CA8A	1
56	1
76	1
CDAE	1
C6B2	1
CA8B	1
CA8C	1
57	1
77	1
C5B4	1
C5B5	1
CAB7	1
CA8D	1
58	1
78	1
CBA3	1
CDAF	1
59	1
79	1
C39D	1
C3BD	1
C3BF	1
C5B6	1
C5B7	1
C5B8	1
C8B2	1
C8B3	1
CAB8	1
CA8F	1
C6B3	1
C6B4	1
5A	1
7A	1
C5B9	1
C5BA	1
C5BB	1
C5BC	1
C5BD	1
C5BE	1
C68D	1
C6B5	1
C6B6	1
C8A4	1
C8A5	1
CA90	1
CA91	1
C6B7	1
C7AE	1
C7AF	1
CA92	1
C6B8	1
C6B9	1
C6BA	1
CA93	1
C89C	1
C89D	1
C39E	1
C3BE	1
C6BF	1
C7B7	1
C6BB	1
C6A7	1
C6A8	1
C6BC	1
C6BD	1
C684	1
C685	1
CA94	1
CB80	1
CABC	1
C589	1
CBAE	1
CABE	1
CA95	1
CBA4	1
CABF	1
CB81	1
CAA1	1
CAA2	1
CA96	1
C780	1
C781	1
C782	1
C783	1
CA97	1
CA98	1
CAAC	1
CAAD	1
CE86	1
CE91	1
CEAC	1
CEB1	1
CE92	1
CEB2	1
CF90	1
CE93	1
CEB3	1
CE94	1
CEB4	1
CE88	1
CE95	1
CEAD	1
CEB5	1
CFB5	1
CF9C	1
CF9D	1
CF9A	1
CF9B	1
CE96	1
CEB6	1
CE89	1
CE97	1
CEAE	1
CEB7	1
CE98	1
CEB8	1
CF91	1
CFB4	1
CDBA	1
CE8A	1
CE90	1
CE99	1
CEAA	1
CEAF	1
CEB9	1
CF8A	1
CFB3	1
CE9A	1
CEBA	1
CFB0	1
CF97	1
CE9B	1
CEBB	1
C2B5	1
CE9C	1
CEBC	1
CE9D	1
CEBD	1
CE9E	1
CEBE	1
CE8C	1
CE9F	1
CEBF	1
CF8C	1
CEA0	1
CF80	1
CF96	1
CF9E	1
CF9F	1
CF98	1
CF99	1
CEA1	1
CF81	1
CFB1	1
CEA3	1
CF82	1
CF83	1
CFB2	1
CFB9	1
CEA4	1
CF84	1
CE8E	1
CEA5	1
CEAB	1
CEB0	1
CF85	1
CF8B	1
CF8D	1
CF92	1
CF93	1
CF94	1
CEA6	1
CF86	1
CF95	1
CEA7	1
CF87	1
CEA8	1
CF88	1
CE8F	1
CEA9	1
CF89	1
CF8E	1
CFA0	1
CFA1	1
CFB7	1
CFB8	1
CFBA	1
CFBB	1
CFA2	1
CFA3	1
CFA4	1
CFA5	1
CFA6	1
CFA7	1
CFA8	1
CFA9	1
CFAA	1
CFAB	1
CFAC	1
CFAD	1
CFAE	1
CFAF	1
D090	1
D0B0	1
D390	1
D391	1
D392	1
D393	1
D398	1
D399	1
D39A	1
D39B	1
D394	1
D395	1
D091	1
D0B1	1
D092	1
D0B2	1
D093	1
D0B3	1
D290	1
D291	1
D292	1
D293	1
D294	1
D295	1
D094	1
D0B4	1
D480	1
D481	1
D082	1
D192	1
D482	1
D483	1
D083	1
D193	1
D298	1
D299	1
D080	1
D081	1
D095	1
D0B5	1
D190	1
D191	1
D396	1
D397	1
D084	1
D194	1
D096	1
D0B6	1
D381	1
D382	1
D39C	1
D39D	1
D296	1
D297	1
D097	1
D0B7	1
D484	1
D485	1
D39E	1
D39F	1
D085	1
D195	1
D3A0	1
D3A1	1
D486	1
D487	1
D08D	1
D098	1
D0B8	1
D19D	1
D3A2	1
D3A3	1
D28A	1
D28B	1
D3A4	1
D3A5	1
D086	1
D196	1
D087	1
D197	1
D099	1
D0B9	1
D088	1
D198	1
D09A	1
D0BA	1
D29A	1
D29B	1
D383	1
D384	1
D2A0	1
D2A1	1
D29E	1
D29F	1
D29C	1
D29D	1
D09B	1
D0BB	1
D385	1
D386	1
D089	1
D199	1
D488	1
D489	1
D09C	1
D0BC	1
D38D	1
D38E	1
D09D	1
D0BD	1
D389	1
D38A	1
D2A2	1
D2A3	1
D387	1
D388	1
D2A4	1
D2A5	1
D08A	1
D19A	1
D48A	1
D48B	1
D09E	1
D0BE	1
D3A6	1
D3A7	1
D3A8	1
D3A9	1
D3AA	1
D3AB	1
D09F	1
D0BF	1
D2A6	1
D2A7	1
D280	1
D281	1
D0A0	1
D180	1
D28E	1
D28F	1
D0A1	1
D181	1
D48C	1
D48D	1
D2AA	1
D2AB	1
D0A2	1
D182	1
D48E	1
D48F	1
D2AC	1
D2AD	1
D08B	1
D19B	1
D08C	1
D19C	1
D0A3	1
D183	1
D3AE	1
D3AF	1
D08E	1
D19E	1
D3B0	1
D3B1	1
D3B2	1
D3B3	1
D2AE	1
D2AF	1
D2B0	1
D2B1	1
D1B8	1
D1B9	1
D0A4	1
D184	1
D0A5	1
D185	1
D2B2	1
D2B3	1
D2BA	1
D2BB	1
D1A0	1
D1A1	1
D1BE	1
D1BF	1
D1BC	1
D1BD	1
D1BA	1
D1BB	1
D0A6	1
D186	1
D2B4	1
D2B5	1
D0A7	1
D187	1
D3B4	1
D3B5	1
D2B6	1
D2B7	1
D38B	1
D38C	1
D2B8	1
D2B9	1
D2BC	1
D2BD	1
D2BE	1
D2BF	1
D08F	1
D19F	1
D0A8	1
D188	1
D0A9	1
D189	1
D0AA	1
D18A	1
D0AB	1
D18B	1
D3B8	1
D3B9	1
D0AC	1
D18C	1
D28C	1
D28D	1
D1A2	1
D1A3	1
D0AD	1
D18D	1
D3AC	1
D3AD	1
D0AE	1
D18E	1
D0AF	1
D18F	1
D1A4	1
D1A5	1
D1A6	1
D1A7	1
D1AA	1
D1AB	1
D1A8	1
D1A9	1
D1AC	1
D1AD	1
D1AE	1
D1AF	1
D1B0	1
D1B1	1
D1B2	1
D1B3	1
D1B4	1
D1B5	1
D1B6	1
D1B7	1
D2A8	1
D2A9	1
D380	1
D4B1	1
D5A1	1
D4B2	1
D5A2	1
D4B3	1
D5A3	1
D4B4	1
D5A4	1
D4B5	1
D5A5	1
D687	1
D4B6	1
D5A6	1
D4B7	1
D5A7	1
D4B8	1
D5A8	1
D4B9	1
D5A9	1
D4BA	1
D5AA	1
D4BB	1
D5AB	1
D4BC	1
D5AC	1
D4BD	1
D5AD	1
D4BE	1
D5AE	1
D4BF	1
D5AF	1
D580	1
D5B0	1
D581	1
D5B1	1
D582	1
D5B2	1
D583	1
D5B3	1
D584	1
D5B4	1
D585	1
D5B5	1
D586	1
D5B6	1
D587	1
D5B7	1
D588	1
D5B8	1
D589	1
D5B9	1
D58A	1
D5BA	1
D58B	1
D5BB	1
D58C	1
D5BC	1
D58D	1
D5BD	1
D58E	1
D5BE	1
D58F	1
D5BF	1
D590	1
D680	1
D591	1
D681	1
D592	1
D682	1
D593	1
D683	1
D594	1
D684	1
D595	1
D685	1
D596	1
D686	1
D599	1
D790	1
D791	1
D792	1
D793	1
D794	1
D795	1
D7B0	1
D7B1	1
D796	1
D797	1
D798	1
D799	1
D7B2	1
D79A	1
D79B	1
D79C	1
D79D	1
D79E	1
D79F	1
D7A0	1
D7A1	1
D7A2	1
D7A3	1
D7A4	1
D7A5	1
D7A6	1
D7A7	1
D7A8	1
D7A9	1
D7AA	1
D8A1	1
D9B4	1
DBBD	1
D8A2	1
D8A3	1
D9B2	1
D9B1	1
D8A4	1
D8A5	1
D9B3	1
D8A6	1
D8A7	1
D9B5	1
D9AE	1
D8A8	1
D9BB	1
D9BE	1
DA80	1
D8A9	1
D8AA	1
D8AB	1
D9B9	1
D9BA	1
D9BC	1
D9BD	1
D9BF	1
D8AC	1
DA83	1
DA84	1
DA86	1
DABF	1
DA87	1
D8AD	1
D8AE	1
DA81	1
DA82	1
DA85	1
D8AF	1
D8B0	1
DA88	1
DA89	1
DA8A	1
DA8B	1
DA8C	1
DA8D	1
DA8E	1
DA8F	1
DA90	1
DBAE	1
D8B1	1
D8B2	1
DA91	1
DA92	1
DA93	1
DA94	1
DA95	1
DA96	1
DA97	1
DA98	1
DA99	1
DBAF	1
D8B3	1
D8B4	1
DA9A	1
DA9B	1
DA9C	1
DBBA	1
D8B5	1
D8B6	1
DA9D	1
DA9E	1
DBBB	1
D8B7	1
D8B8	1
DA9F	1
D8B9	1
D8BA	1
DAA0	1
DBBC	1
D981	1
DAA1	1
DAA2	1
DAA3	1
DAA4	1
DAA5	1
DAA6	1
D9AF	1
D982	1
DAA7	1
DAA8	1
D983	1
DAA9	1
DAAA	1
DAAB	1
DAAC	1
DAAD	1
DAAE	1
DAAF	1
DAB0	1
DAB1	1
DAB2	1
DAB3	1
DAB4	1
D984	1
DAB5	1
DAB6	1
DAB7	1
DAB8	1
D985	1
DBBE	1
D986	1
DABA	1
DABB	1
DABC	1
DABD	1
DAB9	1
D987	1
DABE	1
DB81	1
DB82	1
DB83	1
DBBF	1
DB80	1
DB95	1
D988	1
DBA5	1
D9B6	1
DB84	1
DB85	1
DB86	1
DB87	1
D9B7	1
DB88	1
DB89	1
DB8A	1
DB8B	1
DB8F	1
D989	1
D98A	1
DBA6	1
D9B8	1
DB8C	1
DB8D	1
DB8E	1
DB90	1
DB91	1
DB92	1
DB93	1
DC90	1
DC92	1
DCAD	1
DC93	1
DC94	1
DCAE	1
DC96	1
DC95	1
DCAF	1
DC97	1
DC98	1
DC99	1
DD8D	1
DC9A	1
DC9B	1
DC9C	1
DC9D	1
DC9E	1
DC9F	1
DD8E	1
DCA0	1
DCA1	1
DCA2	1
DCA3	1
DCA4	1
DCA5	1
DCA6	1
DCA7	1
DD8F	1
DCA8	1
DCA9	1
DCAA	1
DCAB	1
DCAC	1
DE80	1
DE99	1
DE9A	1
DE81	1
DE82	1
DE83	1
DE9C	1
DE84	1
DE85	1
DE86	1
DE87	1
DEA2	1
DEA3	1
DE88	1
DEA5	1
DE89	1
DE8A	1
DE8B	1
DE9B	1
DE8C	1
DE98	1
DEA0	1
DEA1	1
DE8D	1
DE8E	1
DEA4	1
DE8F	1
DE90	1
DE9D	1
DE9E	1
DE9F	1
DE91	1
DE92	1
DE93	1
DE94	1
DE95	1
DE96	1
DE97	1
DEB1	1
DEA6	1
DEA7	1
DEA8	1
DEA9	1
DEAA	1
DEAB	1
DEAC	1
DEAD	1
DEAE	1
DEAF	1
DEB0	1
E4B880	1
E4B881	1
E4B882	1
E4B883	1
E4B884	1
E4B885	1
E4B886	1
E4B887	1
E4B888	1
E4B889	1
E4B88A	1
E4B88B	1
E4B88C	1
E4B88D	1
E4B88E	1
E4B88F	1
E4B890	1
E4B891	1
E4B892	1
E4B893	1
E4B894	1
E4B895	1
E4B896	1
E4B897	1
E4B898	1
E4B899	1
E4B89A	1
E4B89B	1
E4B89C	1
E4B89D	1
E4B89E	1
E4B89F	1
E4B8A0	1
E4B8A1	1
E4B8A2	1
E4B8A3	1
E4B8A4	1
E4B8A5	1
E4B8A6	1
E4B8A7	1
E4B8A8	1
E4B8A9	1
E4B8AA	1
E4B8AB	1
E4B8AC	1
E4B8AD	1
E4B8AE	1
E4B8AF	1
E4B8B0	1
E4B8B1	1
E4B8B2	1
E4B8B3	1
E4B8B4	1
E4B8B5	1
E4B8B6	1
E4B8B7	1
E4B8B8	1
E4B8B9	1
E4B8BA	1
E4B8BB	1
E4B8BC	1
E4B8BD	1
E4B8BE	1
E4B8BF	1
E4B980	1
E4B981	1
E4B982	1
E4B983	1
E4B984	1
E4B985	1
E4B986	1
E4B987	1
E4B988	1
E4B989	1
E4B98A	1
E4B98B	1
E4B98C	1
E4B98D	1
E4B98E	1
E4B98F	1
E4B990	1
E4B991	1
E4B992	1
E4B993	1
E4B994	1
E4B995	1
E4B996	1
E4B997	1
E4B998	1
E4B999	1
E4B99A	1
E4B99B	1
E4B99C	1
E4B99D	1
E4B99E	1
E4B99F	1
E4B9A0	1
E4B9A1	1
E4B9A2	1
E4B9A3	1
E4B9A4	1
E4B9A5	1
E4B9A6	1
E4B9A7	1
E4B9A8	1
E4B9A9	1
E4B9AA	1
E4B9AB	1
E4B9AC	1
E4B9AD	1
E4B9AE	1
E4B9AF	1
E4B9B0	1
E4B9B1	1
E4B9B2	1
E4B9B3	1
E4B9B4	1
E4B9B5	1
E4B9B6	1
E4B9B7	1
E4B9B8	1
E4B9B9	1
E4B9BA	1
E4B9BB	1
E4B9BC	1
E4B9BD	1
E4B9BE	1
E4B9BF	1
E4BA80	1
E4BA81	1
E4BA82	1
E4BA83	1
E4BA84	1
E4BA85	1
E4BA86	1
E4BA87	1
E4BA88	1
E4BA89	1
E4BA8A	1
E4BA8B	1
E4BA8C	1
E4BA8D	1
E4BA8E	1
E4BA8F	1
E4BA90	1
E4BA91	1
E4BA92	1
E4BA93	1
E4BA94	1
E4BA95	1
E4BA96	1
E4BA97	1
E4BA98	1
E4BA99	1
E4BA9A	1
E4BA9B	1
E4BA9C	1
E4BA9D	1
E4BA9E	1
E4BA9F	1
E4BAA0	1
E4BAA1	1
E4BAA2	1
E4BAA3	1
E4BAA4	1
E4BAA5	1
E4BAA6	1
E4BAA7	1
E4BAA8	1
E4BAA9	1
E4BAAA	1
E4BAAB	1
E4BAAC	1
E4BAAD	1
E4BAAE	1
E4BAAF	1
E4BAB0	1
E4BAB1	1
E4BAB2	1
E4BAB3	1
E4BAB4	1
E4BAB5	1
E4BAB6	1
E4BAB7	1
E4BAB8	1
E4BAB9	1
E4BABA	1
E4BABB	1
E4BABC	1
E4BABD	1
E4BABE	1
E4BABF	1
E4BB80	1
E4BB81	1
E4BB82	1
E4BB83	1
E4BB84	1
E4BB85	1
E4BB86	1
E4BB87	1
E4BB88	1
E4BB89	1
E4BB8A	1
E4BB8B	1
E4BB8C	1
E4BB8D	1
E4BB8E	1
E4BB8F	1
E4BB90	1
E4BB91	1
E4BB92	1
E4BB93	1
E4BB94	1
E4BB95	1
E4BB96	1
E4BB97	1
E4BB98	1
E4BB99	1
E4BB9A	1
E4BB9B	1
E4BB9C	1
E4BB9D	1
E4BB9E	1
E4BB9F	1
E4BBA0	1
E4BBA1	1
E4BBA2	1
E4BBA3	1
E4BBA4	1
E4BBA5	1
E4BBA6	1
E4BBA7	1
E4BBA8	1
E4BBA9	1
E4BBAA	1
E4BBAB	1
E4BBAC	1
E4BBAD	1
E4BBAE	1
E4BBAF	1
E4BBB0	1
E4BBB1	1
E4BBB2	1
E4BBB3	1
E4BBB4	1
E4BBB5	1
E4BBB6	1
E4BBB7	1
E4BBB8	1
E4BBB9	1
E4BBBA	1
E4BBBB	1
E4BBBC	1
E4BBBD	1
E4BBBE	1
E4BBBF	1
E4BC80	1
E4BC81	1
E4BC82	1
E4BC83	1
E4BC84	1
E4BC85	1
E4BC86	1
E4BC87	1
E4BC88	1
E4BC89	1
E4BC8A	1
E4BC8B	1
E4BC8C	1
E4BC8D	1
E4BC8E	1
E4BC8F	1
E4BC90	1
E4BC91	1
E4BC92	1
E4BC93	1
E4BC94	1
E4BC95	1
E4BC96	1
E4BC97	1
E4BC98	1
E4BC99	1
E4BC9A	1
E4BC9B	1
E4BC9C	1
E4BC9D	1
E4BC9E	1
E4BC9F	1
E4BCA0	1
E4BCA1	1
E4BCA2	1
E4BCA3	1
E4BCA4	1
E4BCA5	1
E4BCA6	1
E4BCA7	1
E4BCA8	1
E4BCA9	1
E4BCAA	1
E4BCAB	1
E4BCAC	1
E4BCAD	1
E4BCAE	1
E4BCAF	1
E4BCB0	1
E4BCB1	1
E4BCB2	1
E4BCB3	1
E4BCB4	1
E4BCB5	1
E4BCB6	1
E4BCB7	1
E4BCB8	1
E4BCB9	1
E4BCBA	1
E4BCBB	1
E4BCBC	1
E4BCBD	1
E4BCBE	1
E4BCBF	1
E4BD80	1
E4BD81	1
E4BD82	1
E4BD83	1
E4BD84	1
E4BD85	1
E4BD86	1
E4BD87	1
E4BD88	1
E4BD89	1
E4BD8A	1
E4BD8B	1
E4BD8C	1
E4BD8D	1
E4BD8E	1
E4BD8F	1
E4BD90	1
E4BD91	1
E4BD92	1
E4BD93	1
E4BD94	1
E4BD95	1
E4BD96	1
E4BD97	1
E4BD98	1
E4BD99	1
E4BD9A	1
E4BD9B	1
E4BD9C	1
E4BD9D	1
E4BD9E	1
E4BD9F	1
E4BDA0	1
E4BDA1	1
E4BDA2	1
E4BDA3	1
E4BDA4	1
E4BDA5	1
E4BDA6	1
E4BDA7	1
E4BDA8	1
E4BDA9	1
E4BDAA	1
E4BDAB	1
E4BDAC	1
E4BDAD	1
E4BDAE	1
E4BDAF	1
E4BDB0	1
E4BDB1	1
E4BDB2	1
E4BDB3	1
E4BDB4	1
E4BDB5	1
E4BDB6	1
E4BDB7	1
E4BDB8	1
E4BDB9	1
E4BDBA	1
E4BDBB	1
E4BDBC	1
E4BDBD	1
E4BDBE	1
E4BDBF	1
E4BE80	1
E4BE81	1
E4BE82	1
E4BE83	1
E4BE84	1
E4BE85	1
E4BE86	1
E4BE87	1
E4BE88	1
E4BE89	1
E4BE8A	1
E4BE8B	1
E4BE8C	1
E4BE8D	1
E4BE8E	1
E4BE8F	1
E4BE90	1
E4BE91	1
E4BE92	1
E4BE93	1
E4BE94	1
E4BE95	1
E4BE96	1
E4BE97	1
E4BE98	1
E4BE99	1
E4BE9A	1
E4BE9B	1
E4BE9C	1
E4BE9D	1
E4BE9E	1
E4BE9F	1
E4BEA0	1
E4BEA1	1
E4BEA2	1
E4BEA3	1
E4BEA4	1
E4BEA5	1
E4BEA6	1
E4BEA7	1
E4BEA8	1
E4BEA9	1
E4BEAA	1
E4BEAB	1
E4BEAC	1
E4BEAD	1
E4BEAE	1
E4BEAF	1
E4BEB0	1
E4BEB1	1
E4BEB2	1
E4BEB3	1
E4BEB4	1
E4BEB5	1
E4BEB6	1
E4BEB7	1
E4BEB8	1
E4BEB9	1
E4BEBA	1
E4BEBB	1
E4BEBC	1
E4BEBD	1
E4BEBE	1
E4BEBF	1
E4BF80	1
E4BF81	1
E4BF82	1
E4BF83	1
E4BF84	1
E4BF85	1
E4BF86	1
E4BF87	1
E4BF88	1
E4BF89	1
E4BF8A	1
E4BF8B	1
E4BF8C	1
E4BF8D	1
E4BF8E	1
E4BF8F	1
E4BF90	1
E4BF91	1
E4BF92	1
E4BF93	1
E4BF94	1
E4BF95	1
E4BF96	1
E4BF97	1
E4BF98	1
E4BF99	1
E4BF9A	1
E4BF9B	1
E4BF9C	1
E4BF9D	1
E4BF9E	1
E4BF9F	1
E4BFA0	1
E4BFA1	1
E4BFA2	1
E4BFA3	1
E4BFA4	1
E4BFA5	1
E4BFA6	1
E4BFA7	1
E4BFA8	1
E4BFA9	1
E4BFAA	1
E4BFAB	1
E4BFAC	1
E4BFAD	1
E4BFAE	1
E4BFAF	1
E4BFB0	1
E4BFB1	1
E4BFB2	1
E4BFB3	1
E4BFB4	1
E4BFB5	1
E4BFB6	1
E4BFB7	1
E4BFB8	1
E4BFB9	1
E4BFBA	1
E4BFBB	1
E4BFBC	1
E4BFBD	1
E4BFBE	1
E4BFBF	1
C8B7	1
C8B8	1
C8B9	1
C8BA	1
C8BB	1
C8BC	1
C8BD	1
C8BE	1
C8BF	1
C980	1
C981	1
C982	1
C983	1
C984	1
C985	1
C986	1
C987	1
C988	1
C989	1
C98A	1
C98B	1
C98C	1
C98D	1
C98E	1
C98F	1
CD98	1
CD99	1
CD9A	1
CD9B	1
CD9C	1
CDB0	1
CDB1	1
CDB2	1
CDB3	1
CDB6	1
CDB7	1
CDB8	1
CDB9	1
CDBB	1
CDBC	1
CDBD	1
CDBF	1
CE80	1
CE81	1
CE82	1
CE83	1
CE8B	1
CE8D	1
CEA2	1
CF8F	1
CFBC	1
CFBD	1
CFBE	1
CFBF	1
D287	1
D38F	1
D3B6	1
D3B7	1
D3BA	1
D3BB	1
D3BC	1
D3BD	1
D3BE	1
D3BF	1
D490	1
D491	1
D492	1
D493	1
D494	1
D495	1
D496	1
D497	1
D498	1
D499	1
D49A	1
D49B	1
D49C	1
D49D	1
D49E	1
D49F	1
D4A0	1
D4A1	1
D4A2	1
D4A3	1
D4A4	1
D4A5	1
D4A6	1
D4A7	1
D4A8	1
D4A9	1
D4AA	1
D4AB	1
D4AC	1
D4AD	1
D4AE	1
D4AF	1
D4B0	1
D597	1
D598	1
D5A0	1
D688	1
D68B	1
D68C	1
D68D	1
D68E	1
D68F	1
D690	1
D6A2	1
D6BA	1
D785	1
D786	1
D787	1
D788	1
D789	1
D78A	1
D78B	1
D78C	1
D78D	1
D78E	1
D78F	1
D7AB	1
D7AC	1
D7AD	1
D7AE	1
D7AF	1
D7B5	1
D7B6	1
D7B7	1
D7B8	1
D7B9	1
D7BA	1
D7BB	1
D7BC	1
D7BD	1
D7BE	1
D7BF	1
D884	1
D885	1
D886	1
D887	1
D888	1
D889	1
D88A	1
D88B	1
D896	1
D897	1
D898	1
D899	1
D89A	1
D89C	1
D89D	1
D89E	1
D8A0	1
D8BB	1
D8BC	1
D8BD	1
D8BE	1
D8BF	1
D999	1
D99A	1
D99B	1
D99C	1
D99D	1
D99E	1
D99F	1
DC8E	1
DD8B	1
DD8C	1
DD90	1
DD91	1
DD92	1
DD93	1
DD94	1
DD95	1
DD96	1
DD97	1
DD98	1
DD99	1
DD9A	1
DD9B	1
DD9C	1
DD9D	1
DD9E	1
DD9F	1
DDA0	1
DDA1	1
DDA2	1
DDA3	1
DDA4	1
DDA5	1
DDA6	1
DDA7	1
DDA8	1
DDA9	1
DDAA	1
DDAB	1
DDAC	1
DDAD	1
DDAE	1
DDAF	1
DDB0	1
DDB1	1
DDB2	1
DDB3	1
DDB4	1
DDB5	1
DDB6	1
DDB7	1
DDB8	1
DDB9	1
DDBA	1
DDBB	1
DDBC	1
DDBD	1
DDBE	1
DDBF	1
DEB2	1
DEB3	1
DEB4	1
DEB5	1
DEB6	1
DEB7	1
DEB8	1
DEB9	1
DEBA	1
DEBB	1
DEBC	1
DEBD	1
DEBE	1
DEBF	1
DF80	1
DF81	1
DF82	1
DF83	1
DF84	1
DF85	1
DF86	1
DF87	1
DF88	1
DF89	1
DF8A	1
DF8B	1
DF8C	1
DF8D	1
DF8E	1
DF8F	1
DF90	1
DF91	1
DF92	1
DF93	1
DF94	1
DF95	1
DF96	1
DF97	1
DF98	1
DF99	1
DF9A	1
DF9B	1
DF9C	1
DF9D	1
DF9E	1
DF9F	1
DFA0	1
DFA1	1
DFA2	1
DFA3	1
DFA4	1
DFA5	1
DFA6	1
DFA7	1
DFA8	1
DFA9	1
DFAA	1
DFAB	1
DFAC	1
DFAD	1
DFAE	1
DFAF	1
DFB0	1
DFB1	1
DFB2	1
DFB3	1
DFB4	1
DFB5	1
DFB6	1
DFB7	1
DFB8	1
DFB9	1
DFBA	1
DFBB	1
DFBC	1
DFBD	1
DFBE	1
DFBF	1
DROP TABLE IF EXISTS test.t1;
DROP TABLE IF EXISTS test.t1;
DROP DATABASE test;
CREATE DATABASE test CHARACTER SET utf8mb3;
USE test;
CREATE TABLE test.t1 (a CHAR(4) CHARACTER SET utf8mb3 COLLATE utf8mb3_slovak_ci) ENGINE=MyISAM CHARACTER SET utf8mb3 COLLATE utf8mb3_slovak_ci;
Warnings:
Warning	1287	'utf8mb3' is deprecated and will be removed in a future release. Please use utf8mb4 instead
Warning	3778	'utf8mb3_slovak_ci' is a collation of the deprecated character set UTF8MB3. Please consider using UTF8MB4 with an appropriate collation instead.
Warning	1287	'utf8mb3' is deprecated and will be removed in a future release. Please use utf8mb4 instead
Warning	3778	'utf8mb3_slovak_ci' is a collation of the deprecated character set UTF8MB3. Please consider using UTF8MB4 with an appropriate collation instead.
SHOW TABLE STATUS LIKE 't1';
Name	Engine	Version	Row_format	Rows	Avg_row_length	Data_length	Max_data_length	Index_length	Data_free	Auto_increment	Create_time	Update_time	Check_time	Collation	Checksum	Create_options	Comment
t1	MyISAM	#	#	#	#	#	#	#	#	#	#	#	#	utf8mb3_slovak_ci	#	#	#
LOAD DATA INFILE 
'MYSQL_TEST_DIR/suite/funcs_2/data/charset_utf8.txt' INTO TABLE test.t1;
DELETE FROM test.t1 WHERE CHAR_LENGTH(a) <> 1;
SELECT HEX(ORD(a)) AS a_ord, CHAR_LENGTH(a) AS a_len FROM test.t1 ORDER BY a, ORD(a);
a_ord	a_len
C285	1
7F	1
C280	1
C281	1
C282	1
C283	1
C284	1
C286	1
C287	1
C288	1
C289	1
C28A	1
C28B	1
C28C	1
C28D	1
C28E	1
C28F	1
C290	1
C291	1
C292	1
C293	1
C294	1
C295	1
C296	1
C297	1
C298	1
C299	1
C29A	1
C29B	1
C29C	1
C29D	1
C29E	1
C29F	1
C2A0	1
CC80	1
CC81	1
CC82	1
CC83	1
CC84	1
CC85	1
CC86	1
CC87	1
CC88	1
CC89	1
CC8A	1
CC8B	1
CC8C	1
CC8D	1
CC8E	1
CC8F	1
CC90	1
CC91	1
CC92	1
CC93	1
CC94	1
CC95	1
CC96	1
CC97	1
CC98	1
CC99	1
CC9A	1
CC9B	1
CC9C	1
CC9D	1
CC9E	1
CC9F	1
CCA0	1
CCA1	1
CCA2	1
CCA3	1
CCA4	1
CCA5	1
CCA6	1
CCA7	1
CCA8	1
CCA9	1
CCAA	1
CCAB	1
CCAC	1
CCAD	1
CCAE	1
CCAF	1
CCB0	1
CCB1	1
CCB2	1
CCB3	1
CCB4	1
CCB5	1
CCB6	1
CCB7	1
CCB8	1
CCB9	1
CCBA	1
CCBB	1
CCBC	1
CCBD	1
CCBE	1
CCBF	1
CD80	1
CD81	1
CD82	1
CD83	1
CD84	1
CD85	1
CD86	1
CD87	1
CD88	1
CD89	1
CD8A	1
CD8B	1
CD8C	1
CD8D	1
CD8E	1
CD8F	1
CD90	1
CD91	1
CD92	1
CD93	1
CD94	1
CD95	1
CD96	1
CD97	1
CD9D	1
CD9E	1
CD9F	1
CDA0	1
CDA1	1
CDA2	1
D283	1
D284	1
D285	1
D286	1
D288	1
D289	1
D691	1
D692	1
D693	1
D694	1
D695	1
D696	1
D697	1
D698	1
D699	1
D69A	1
D69B	1
D69C	1
D69D	1
D69E	1
D69F	1
D6A0	1
D6A1	1
D6A3	1
D6A4	1
D6A5	1
D6A6	1
D6A7	1
D6A8	1
D6A9	1
D6AA	1
D6AB	1
D6AC	1
D6AD	1
D6AE	1
D6AF	1
D6B0	1
D6B1	1
D6B2	1
D6B3	1
D6B4	1
D6B5	1
D6B6	1
D6B7	1
D6B8	1
D6B9	1
D6BB	1
D6BC	1
D6BD	1
D6BF	1
D781	1
D782	1
D784	1
D880	1
D881	1
D882	1
D883	1
D890	1
D891	1
D892	1
D893	1
D894	1
D895	1
D98B	1
D98C	1
D98D	1
D98E	1
D98F	1
D990	1
D991	1
D992	1
D993	1
D994	1
D995	1
D996	1
D997	1
D998	1
D9B0	1
DB96	1
DB97	1
DB98	1
DB99	1
DB9A	1
DB9B	1
DB9C	1
DB9D	1
DB9E	1
DB9F	1
DBA0	1
DBA1	1
DBA2	1
DBA3	1
DBA4	1
DBA7	1
DBA8	1
DBAA	1
DBAB	1
DBAC	1
DBAD	1
DC8F	1
DC91	1
DCB0	1
DCB1	1
DCB2	1
DCB3	1
DCB4	1
DCB5	1
DCB6	1
DCB7	1
DCB8	1
DCB9	1
DCBA	1
DCBB	1
DCBC	1
DCBD	1
DCBE	1
DCBF	1
DD80	1
DD81	1
DD82	1
DD83	1
DD84	1
DD85	1
DD86	1
DD87	1
DD88	1
DD89	1
DD8A	1
D980	1
60	1
C2B4	1
CE84	1
CB9C	1
5E	1
C2AF	1
CB98	1
CB99	1
C2A8	1
CE85	1
CB9A	1
CB9D	1
C2B8	1
CB9B	1
5F	1
C2AD	1
2D	1
D68A	1
2C	1
D59D	1
D88C	1
D88D	1
D9AB	1
D9AC	1
3B	1
CDBE	1
D89B	1
3A	1
D689	1
DC83	1
DC84	1
DC85	1
DC86	1
DC87	1
DC88	1
21	1
C2A1	1
D59C	1
3F	1
C2BF	1
D59E	1
D89F	1
DC89	1
2E	1
DB94	1
DC81	1
DC82	1
C2B7	1
CE87	1
DC80	1
27	1
22	1
C2AB	1
C2BB	1
28	1
29	1
5B	1
7B	1
7D	1
C2A7	1
C2B6	1
C2A9	1
C2AE	1
40	1
2A	1
D9AD	1
2F	1
26	1
23	1
25	1
D9AA	1
D59A	1
D59B	1
D59F	1
D6BE	1
D780	1
D783	1
D7B3	1
D7B4	1
DC8A	1
DC8B	1
DC8C	1
DC8D	1
CAB9	1
CDB4	1
CDB5	1
CABA	1
CB82	1
CB83	1
CB84	1
CB85	1
CB86	1
CB87	1
CB88	1
CB89	1
CB8A	1
CB8B	1
CB8C	1
CB8D	1
CB8E	1
CB8F	1
CB92	1
CB93	1
CB94	1
CB95	1
CB96	1
CB97	1
CB9E	1
CB9F	1
CBA5	1
CBA6	1
CBA7	1
CBA8	1
CBA9	1
CBAA	1
CBAB	1
CBAC	1
CBAD	1
CBAF	1
CBB0	1
CBB1	1
CBB2	1
CBB3	1
CBB4	1
CBB5	1
CBB6	1
CBB7	1
CBB8	1
CBB9	1
CBBA	1
CBBB	1
CBBC	1
CBBD	1
CBBE	1
CBBF	1
C2B0	1
D282	1
D88E	1
D88F	1
DBA9	1
CFB6	1
2B	1
C2B1	1
C3B7	1
C397	1
3C	1
3D	1
3E	1
C2AC	1
7C	1
C2A6	1
7E	1
CB90	1
CB91	1
C2A4	1
C2A2	1
24	1
C2A3	1
C2A5	1
30	1
D9A0	1
DBB0	1
31	1
C2B9	1
D9A1	1
DBB1	1
C2BD	1
C2BC	1
32	1
C2B2	1
D9A2	1
DBB2	1
33	1
C2B3	1
D9A3	1
DBB3	1
C2BE	1
34	1
D9A4	1
DBB4	1
35	1
D9A5	1
DBB5	1
36	1
D9A6	1
DBB6	1
37	1
D9A7	1
DBB7	1
38	1
D9A8	1
DBB8	1
39	1
D9A9	1
DBB9	1
41	1
61	1
C2AA	1
C380	1
C381	1
C382	1
C383	1
C385	1
C3A0	1
C3A1	1
C3A2	1
C3A3	1
C3A5	1
C480	1
C481	1
C482	1
C483	1
C484	1
C485	1
C78D	1
C78E	1
C79E	1
C79F	1
C7A0	1
C7A1	1
C7BA	1
C7BB	1
C880	1
C881	1
C882	1
C883	1
C8A6	1
C8A7	1
CDA3	1
C384	1
C3A4	1
C386	1
C3A6	1
C7A2	1
C7A3	1
C7BC	1
C7BD	1
C990	1
C991	1
C992	1
42	1
62	1
CA99	1
C680	1
C681	1
C993	1
C682	1
C683	1
43	1
63	1
C387	1
C3A7	1
C486	1
C487	1
C488	1
C489	1
C48A	1
C48B	1
CDA8	1
C48C	1
C48D	1
C687	1
C688	1
C995	1
44	1
64	1
C48E	1
C48F	1
CDA9	1
C784	1
C785	1
C786	1
C7B1	1
C7B2	1
C7B3	1
CAA3	1
CAA5	1
CAA4	1
C490	1
C491	1
C689	1
C996	1
C68A	1
C997	1
C68B	1
C68C	1
C8A1	1
C390	1
C3B0	1
45	1
65	1
C388	1
C389	1
C38A	1
C38B	1
C3A8	1
C3A9	1
C3AA	1
C3AB	1
C492	1
C493	1
C494	1
C495	1
C496	1
C497	1
C498	1
C499	1
C49A	1
C49B	1
C884	1
C885	1
C886	1
C887	1
C8A8	1
C8A9	1
CDA4	1
C68E	1
C79D	1
C68F	1
C999	1
C690	1
C99B	1
C998	1
C99A	1
C99C	1
C99D	1
C99E	1
CA9A	1
C9A4	1
46	1
66	1
CAA9	1
C691	1
C692	1
47	1
67	1
C49C	1
C49D	1
C49E	1
C49F	1
C4A0	1
C4A1	1
C4A2	1
C4A3	1
C7A6	1
C7A7	1
C7B4	1
C7B5	1
C9A1	1
C9A2	1
C7A4	1
C7A5	1
C693	1
C9A0	1
CA9B	1
C694	1
C9A3	1
CBA0	1
C6A2	1
C6A3	1
48	1
68	1
C4A4	1
C4A5	1
C89E	1
C89F	1
CAB0	1
CDAA	1
CA9C	1
C695	1
C7B6	1
C4A6	1
C4A7	1
C9A6	1
CAB1	1
C9A7	1
CABB	1
CABD	1
49	1
69	1
C38C	1
C38D	1
C38E	1
C38F	1
C3AC	1
C3AD	1
C3AE	1
C3AF	1
C4A8	1
C4A9	1
C4AA	1
C4AB	1
C4AC	1
C4AD	1
C4AE	1
C4AF	1
C4B0	1
C78F	1
C790	1
C888	1
C889	1
C88A	1
C88B	1
CDA5	1
C4B2	1
C4B3	1
C4B1	1
C9AA	1
C697	1
C9A8	1
C696	1
C9A9	1
4A	1
6A	1
C4B4	1
C4B5	1
C7B0	1
CAB2	1
CA9D	1
C99F	1
CA84	1
4B	1
6B	1
C4B6	1
C4B7	1
C7A8	1
C7A9	1
C698	1
C699	1
CA9E	1
4C	1
6C	1
C4B9	1
C4BA	1
C4BB	1
C4BC	1
C4BD	1
C4BE	1
CBA1	1
C4BF	1
C580	1
C787	1
C788	1
C789	1
CAAA	1
CAAB	1
CA9F	1
C581	1
C582	1
C69A	1
C9AB	1
C9AC	1
C9AD	1
C8B4	1
C9AE	1
C69B	1
CA8E	1
4D	1
6D	1
CDAB	1
C9B1	1
4E	1
6E	1
C391	1
C3B1	1
C583	1
C584	1
C585	1
C586	1
C587	1
C588	1
C7B8	1
C7B9	1
C78A	1
C78B	1
C78C	1
C9B4	1
C69D	1
C9B2	1
C69E	1
C8A0	1
C9B3	1
C8B5	1
C58A	1
C58B	1
4F	1
6F	1
C2BA	1
C392	1
C393	1
C395	1
C396	1
C3B2	1
C3B3	1
C3B5	1
C3B6	1
C58C	1
C58D	1
C58E	1
C58F	1
C590	1
C591	1
C6A0	1
C6A1	1
C791	1
C792	1
C7AA	1
C7AB	1
C7AC	1
C7AD	1
C88C	1
C88D	1
C88E	1
C88F	1
C8AA	1
C8AB	1
C8AC	1
C8AD	1
C8AE	1
C8AF	1
C8B0	1
C8B1	1
CDA6	1
C592	1
C593	1
C394	1
C3B4	1
C9B6	1
C398	1
C3B8	1
C7BE	1
C7BF	1
C686	1
C994	1
C69F	1
C9B5	1
C9B7	1
C8A2	1
C8A3	1
50	1
70	1
C6A4	1
C6A5	1
C9B8	1
51	1
71	1
CAA0	1
C4B8	1
52	1
72	1
C594	1
C595	1
C596	1
C597	1
C598	1
C599	1
C890	1
C891	1
C892	1
C893	1
CAB3	1
CDAC	1
C6A6	1
CA80	1
C9B9	1
CAB4	1
C9BA	1
C9BB	1
CAB5	1
C9BC	1
C9BD	1
C9BE	1
C9BF	1
CA81	1
CAB6	1
53	1
73	1
C59A	1
C59B	1
C59C	1
C59D	1
C59E	1
C59F	1
C5BF	1
C898	1
C899	1
CBA2	1
C39F	1
C5A0	1
C5A1	1
CA82	1
C6A9	1
CA83	1
C6AA	1
CA85	1
CA86	1
54	1
74	1
C5A2	1
C5A3	1
C5A4	1
C5A5	1
C89A	1
C89B	1
CDAD	1
CAA8	1
C6BE	1
CAA6	1
CAA7	1
C5A6	1
C5A7	1
C6AB	1
C6AC	1
C6AD	1
C6AE	1
CA88	1
C8B6	1
CA87	1
55	1
75	1
C399	1
C39A	1
C39B	1
C39C	1
C3B9	1
C3BA	1
C3BB	1
C3BC	1
C5A8	1
C5A9	1
C5AA	1
C5AB	1
C5AC	1
C5AD	1
C5AE	1
C5AF	1
C5B0	1
C5B1	1
C5B2	1
C5B3	1
C6AF	1
C6B0	1
C793	1
C794	1
C795	1
C796	1
C797	1
C798	1
C799	1
C79A	1
C79B	1
C79C	1
C894	1
C895	1
C896	1
C897	1
CDA7	1
CA89	1
C9A5	1
CAAE	1
CAAF	1
C69C	1
C9AF	1
C9B0	1
C6B1	1
CA8A	1
56	1
76	1
CDAE	1
C6B2	1
CA8B	1
CA8C	1
57	1
77	1
C5B4	1
C5B5	1
CAB7	1
CA8D	1
58	1
78	1
CBA3	1
CDAF	1
59	1
79	1
C39D	1
C3BD	1
C3BF	1
C5B6	1
C5B7	1
C5B8	1
C8B2	1
C8B3	1
CAB8	1
CA8F	1
C6B3	1
C6B4	1
5A	1
7A	1
C5B9	1
C5BA	1
C5BB	1
C5BC	1
C68D	1
C5BD	1
C5BE	1
C6B5	1
C6B6	1
C8A4	1
C8A5	1
CA90	1
CA91	1
C6B7	1
C7AE	1
C7AF	1
CA92	1
C6B8	1
C6B9	1
C6BA	1
CA93	1
C89C	1
C89D	1
C39E	1
C3BE	1
C6BF	1
C7B7	1
C6BB	1
C6A7	1
C6A8	1
C6BC	1
C6BD	1
C684	1
C685	1
CA94	1
CB80	1
CABC	1
C589	1
CBAE	1
CABE	1
CA95	1
CBA4	1
CABF	1
CB81	1
CAA1	1
CAA2	1
CA96	1
C780	1
C781	1
C782	1
C783	1
CA97	1
CA98	1
CAAC	1
CAAD	1
CE86	1
CE91	1
CEAC	1
CEB1	1
CE92	1
CEB2	1
CF90	1
CE93	1
CEB3	1
CE94	1
CEB4	1
CE88	1
CE95	1
CEAD	1
CEB5	1
CFB5	1
CF9C	1
CF9D	1
CF9A	1
CF9B	1
CE96	1
CEB6	1
CE89	1
CE97	1
CEAE	1
CEB7	1
CE98	1
CEB8	1
CF91	1
CFB4	1
CDBA	1
CE8A	1
CE90	1
CE99	1
CEAA	1
CEAF	1
CEB9	1
CF8A	1
CFB3	1
CE9A	1
CEBA	1
CFB0	1
CF97	1
CE9B	1
CEBB	1
C2B5	1
CE9C	1
CEBC	1
CE9D	1
CEBD	1
CE9E	1
CEBE	1
CE8C	1
CE9F	1
CEBF	1
CF8C	1
CEA0	1
CF80	1
CF96	1
CF9E	1
CF9F	1
CF98	1
CF99	1
CEA1	1
CF81	1
CFB1	1
CEA3	1
CF82	1
CF83	1
CFB2	1
CFB9	1
CEA4	1
CF84	1
CE8E	1
CEA5	1
CEAB	1
CEB0	1
CF85	1
CF8B	1
CF8D	1
CF92	1
CF93	1
CF94	1
CEA6	1
CF86	1
CF95	1
CEA7	1
CF87	1
CEA8	1
CF88	1
CE8F	1
CEA9	1
CF89	1
CF8E	1
CFA0	1
CFA1	1
CFB7	1
CFB8	1
CFBA	1
CFBB	1
CFA2	1
CFA3	1
CFA4	1
CFA5	1
CFA6	1
CFA7	1
CFA8	1
CFA9	1
CFAA	1
CFAB	1
CFAC	1
CFAD	1
CFAE	1
CFAF	1
D090	1
D0B0	1
D390	1
D391	1
D392	1
D393	1
D398	1
D399	1
D39A	1
D39B	1
D394	1
D395	1
D091	1
D0B1	1
D092	1
D0B2	1
D093	1
D0B3	1
D290	1
D291	1
D292	1
D293	1
D294	1
D295	1
D094	1
D0B4	1
D480	1
D481	1
D082	1
D192	1
D482	1
D483	1
D083	1
D193	1
D298	1
D299	1
D080	1
D081	1
D095	1
D0B5	1
D190	1
D191	1
D396	1
D397	1
D084	1
D194	1
D096	1
D0B6	1
D381	1
D382	1
D39C	1
D39D	1
D296	1
D297	1
D097	1
D0B7	1
D484	1
D485	1
D39E	1
D39F	1
D085	1
D195	1
D3A0	1
D3A1	1
D486	1
D487	1
D08D	1
D098	1
D0B8	1
D19D	1
D3A2	1
D3A3	1
D28A	1
D28B	1
D3A4	1
D3A5	1
D086	1
D196	1
D087	1
D197	1
D099	1
D0B9	1
D088	1
D198	1
D09A	1
D0BA	1
D29A	1
D29B	1
D383	1
D384	1
D2A0	1
D2A1	1
D29E	1
D29F	1
D29C	1
D29D	1
D09B	1
D0BB	1
D385	1
D386	1
D089	1
D199	1
D488	1
D489	1
D09C	1
D0BC	1
D38D	1
D38E	1
D09D	1
D0BD	1
D389	1
D38A	1
D2A2	1
D2A3	1
D387	1
D388	1
D2A4	1
D2A5	1
D08A	1
D19A	1
D48A	1
D48B	1
D09E	1
D0BE	1
D3A6	1
D3A7	1
D3A8	1
D3A9	1
D3AA	1
D3AB	1
D09F	1
D0BF	1
D2A6	1
D2A7	1
D280	1
D281	1
D0A0	1
D180	1
D28E	1
D28F	1
D0A1	1
D181	1
D48C	1
D48D	1
D2AA	1
D2AB	1
D0A2	1
D182	1
D48E	1
D48F	1
D2AC	1
D2AD	1
D08B	1
D19B	1
D08C	1
D19C	1
D0A3	1
D183	1
D3AE	1
D3AF	1
D08E	1
D19E	1
D3B0	1
D3B1	1
D3B2	1
D3B3	1
D2AE	1
D2AF	1
D2B0	1
D2B1	1
D1B8	1
D1B9	1
D0A4	1
D184	1
D0A5	1
D185	1
D2B2	1
D2B3	1
D2BA	1
D2BB	1
D1A0	1
D1A1	1
D1BE	1
D1BF	1
D1BC	1
D1BD	1
D1BA	1
D1BB	1
D0A6	1
D186	1
D2B4	1
D2B5	1
D0A7	1
D187	1
D3B4	1
D3B5	1
D2B6	1
D2B7	1
D38B	1
D38C	1
D2B8	1
D2B9	1
D2BC	1
D2BD	1
D2BE	1
D2BF	1
D08F	1
D19F	1
D0A8	1
D188	1
D0A9	1
D189	1
D0AA	1
D18A	1
D0AB	1
D18B	1
D3B8	1
D3B9	1
D0AC	1
D18C	1
D28C	1
D28D	1
D1A2	1
D1A3	1
D0AD	1
D18D	1
D3AC	1
D3AD	1
D0AE	1
D18E	1
D0AF	1
D18F	1
D1A4	1
D1A5	1
D1A6	1
D1A7	1
D1AA	1
D1AB	1
D1A8	1
D1A9	1
D1AC	1
D1AD	1
D1AE	1
D1AF	1
D1B0	1
D1B1	1
D1B2	1
D1B3	1
D1B4	1
D1B5	1
D1B6	1
D1B7	1
D2A8	1
D2A9	1
D380	1
D4B1	1
D5A1	1
D4B2	1
D5A2	1
D4B3	1
D5A3	1
D4B4	1
D5A4	1
D4B5	1
D5A5	1
D687	1
D4B6	1
D5A6	1
D4B7	1
D5A7	1
D4B8	1
D5A8	1
D4B9	1
D5A9	1
D4BA	1
D5AA	1
D4BB	1
D5AB	1
D4BC	1
D5AC	1
D4BD	1
D5AD	1
D4BE	1
D5AE	1
D4BF	1
D5AF	1
D580	1
D5B0	1
D581	1
D5B1	1
D582	1
D5B2	1
D583	1
D5B3	1
D584	1
D5B4	1
D585	1
D5B5	1
D586	1
D5B6	1
D587	1
D5B7	1
D588	1
D5B8	1
D589	1
D5B9	1
D58A	1
D5BA	1
D58B	1
D5BB	1
D58C	1
D5BC	1
D58D	1
D5BD	1
D58E	1
D5BE	1
D58F	1
D5BF	1
D590	1
D680	1
D591	1
D681	1
D592	1
D682	1
D593	1
D683	1
D594	1
D684	1
D595	1
D685	1
D596	1
D686	1
D599	1
D790	1
D791	1
D792	1
D793	1
D794	1
D795	1
D7B0	1
D7B1	1
D796	1
D797	1
D798	1
D799	1
D7B2	1
D79A	1
D79B	1
D79C	1
D79D	1
D79E	1
D79F	1
D7A0	1
D7A1	1
D7A2	1
D7A3	1
D7A4	1
D7A5	1
D7A6	1
D7A7	1
D7A8	1
D7A9	1
D7AA	1
D8A1	1
D9B4	1
DBBD	1
D8A2	1
D8A3	1
D9B2	1
D9B1	1
D8A4	1
D8A5	1
D9B3	1
D8A6	1
D8A7	1
D9B5	1
D9AE	1
D8A8	1
D9BB	1
D9BE	1
DA80	1
D8A9	1
D8AA	1
D8AB	1
D9B9	1
D9BA	1
D9BC	1
D9BD	1
D9BF	1
D8AC	1
DA83	1
DA84	1
DA86	1
DABF	1
DA87	1
D8AD	1
D8AE	1
DA81	1
DA82	1
DA85	1
D8AF	1
D8B0	1
DA88	1
DA89	1
DA8A	1
DA8B	1
DA8C	1
DA8D	1
DA8E	1
DA8F	1
DA90	1
DBAE	1
D8B1	1
D8B2	1
DA91	1
DA92	1
DA93	1
DA94	1
DA95	1
DA96	1
DA97	1
DA98	1
DA99	1
DBAF	1
D8B3	1
D8B4	1
DA9A	1
DA9B	1
DA9C	1
DBBA	1
D8B5	1
D8B6	1
DA9D	1
DA9E	1
DBBB	1
D8B7	1
D8B8	1
DA9F	1
D8B9	1
D8BA	1
DAA0	1
DBBC	1
D981	1
DAA1	1
DAA2	1
DAA3	1
DAA4	1
DAA5	1
DAA6	1
D9AF	1
D982	1
DAA7	1
DAA8	1
D983	1
DAA9	1
DAAA	1
DAAB	1
DAAC	1
DAAD	1
DAAE	1
DAAF	1
DAB0	1
DAB1	1
DAB2	1
DAB3	1
DAB4	1
D984	1
DAB5	1
DAB6	1
DAB7	1
DAB8	1
D985	1
DBBE	1
D986	1
DABA	1
DABB	1
DABC	1
DABD	1
DAB9	1
D987	1
DABE	1
DB81	1
DB82	1
DB83	1
DBBF	1
DB80	1
DB95	1
D988	1
DBA5	1
D9B6	1
DB84	1
DB85	1
DB86	1
DB87	1
D9B7	1
DB88	1
DB89	1
DB8A	1
DB8B	1
DB8F	1
D989	1
D98A	1
DBA6	1
D9B8	1
DB8C	1
DB8D	1
DB8E	1
DB90	1
DB91	1
DB92	1
DB93	1
DC90	1
DC92	1
DCAD	1
DC93	1
DC94	1
DCAE	1
DC96	1
DC95	1
DCAF	1
DC97	1
DC98	1
DC99	1
DD8D	1
DC9A	1
DC9B	1
DC9C	1
DC9D	1
DC9E	1
DC9F	1
DD8E	1
DCA0	1
DCA1	1
DCA2	1
DCA3	1
DCA4	1
DCA5	1
DCA6	1
DCA7	1
DD8F	1
DCA8	1
DCA9	1
DCAA	1
DCAB	1
DCAC	1
DE80	1
DE99	1
DE9A	1
DE81	1
DE82	1
DE83	1
DE9C	1
DE84	1
DE85	1
DE86	1
DE87	1
DEA2	1
DEA3	1
DE88	1
DEA5	1
DE89	1
DE8A	1
DE8B	1
DE9B	1
DE8C	1
DE98	1
DEA0	1
DEA1	1
DE8D	1
DE8E	1
DEA4	1
DE8F	1
DE90	1
DE9D	1
DE9E	1
DE9F	1
DE91	1
DE92	1
DE93	1
DE94	1
DE95	1
DE96	1
DE97	1
DEB1	1
DEA6	1
DEA7	1
DEA8	1
DEA9	1
DEAA	1
DEAB	1
DEAC	1
DEAD	1
DEAE	1
DEAF	1
DEB0	1
E4B880	1
E4B881	1
E4B882	1
E4B883	1
E4B884	1
E4B885	1
E4B886	1
E4B887	1
E4B888	1
E4B889	1
E4B88A	1
E4B88B	1
E4B88C	1
E4B88D	1
E4B88E	1
E4B88F	1
E4B890	1
E4B891	1
E4B892	1
E4B893	1
E4B894	1
E4B895	1
E4B896	1
E4B897	1
E4B898	1
E4B899	1
E4B89A	1
E4B89B	1
E4B89C	1
E4B89D	1
E4B89E	1
E4B89F	1
E4B8A0	1
E4B8A1	1
E4B8A2	1
E4B8A3	1
E4B8A4	1
E4B8A5	1
E4B8A6	1
E4B8A7	1
E4B8A8	1
E4B8A9	1
E4B8AA	1
E4B8AB	1
E4B8AC	1
E4B8AD	1
E4B8AE	1
E4B8AF	1
E4B8B0	1
E4B8B1	1
E4B8B2	1
E4B8B3	1
E4B8B4	1
E4B8B5	1
E4B8B6	1
E4B8B7	1
E4B8B8	1
E4B8B9	1
E4B8BA	1
E4B8BB	1
E4B8BC	1
E4B8BD	1
E4B8BE	1
E4B8BF	1
E4B980	1
E4B981	1
E4B982	1
E4B983	1
E4B984	1
E4B985	1
E4B986	1
E4B987	1
E4B988	1
E4B989	1
E4B98A	1
E4B98B	1
E4B98C	1
E4B98D	1
E4B98E	1
E4B98F	1
E4B990	1
E4B991	1
E4B992	1
E4B993	1
E4B994	1
E4B995	1
E4B996	1
E4B997	1
E4B998	1
E4B999	1
E4B99A	1
E4B99B	1
E4B99C	1
E4B99D	1
E4B99E	1
E4B99F	1
E4B9A0	1
E4B9A1	1
E4B9A2	1
E4B9A3	1
E4B9A4	1
E4B9A5	1
E4B9A6	1
E4B9A7	1
E4B9A8	1
E4B9A9	1
E4B9AA	1
E4B9AB	1
E4B9AC	1
E4B9AD	1
E4B9AE	1
E4B9AF	1
E4B9B0	1
E4B9B1	1
E4B9B2	1
E4B9B3	1
E4B9B4	1
E4B9B5	1
E4B9B6	1
E4B9B7	1
E4B9B8	1
E4B9B9	1
E4B9BA	1
E4B9BB	1
E4B9BC	1
E4B9BD	1
E4B9BE	1
E4B9BF	1
E4BA80	1
E4BA81	1
E4BA82	1
E4BA83	1
E4BA84	1
E4BA85	1
E4BA86	1
E4BA87	1
E4BA88	1
E4BA89	1
E4BA8A	1
E4BA8B	1
E4BA8C	1
E4BA8D	1
E4BA8E	1
E4BA8F	1
E4BA90	1
E4BA91	1
E4BA92	1
E4BA93	1
E4BA94	1
E4BA95	1
E4BA96	1
E4BA97	1
E4BA98	1
E4BA99	1
E4BA9A	1
E4BA9B	1
E4BA9C	1
E4BA9D	1
E4BA9E	1
E4BA9F	1
E4BAA0	1
E4BAA1	1
E4BAA2	1
E4BAA3	1
E4BAA4	1
E4BAA5	1
E4BAA6	1
E4BAA7	1
E4BAA8	1
E4BAA9	1
E4BAAA	1
E4BAAB	1
E4BAAC	1
E4BAAD	1
E4BAAE	1
E4BAAF	1
E4BAB0	1
E4BAB1	1
E4BAB2	1
E4BAB3	1
E4BAB4	1
E4BAB5	1
E4BAB6	1
E4BAB7	1
E4BAB8	1
E4BAB9	1
E4BABA	1
E4BABB	1
E4BABC	1
E4BABD	1
E4BABE	1
E4BABF	1
E4BB80	1
E4BB81	1
E4BB82	1
E4BB83	1
E4BB84	1
E4BB85	1
E4BB86	1
E4BB87	1
E4BB88	1
E4BB89	1
E4BB8A	1
E4BB8B	1
E4BB8C	1
E4BB8D	1
E4BB8E	1
E4BB8F	1
E4BB90	1
E4BB91	1
E4BB92	1
E4BB93	1
E4BB94	1
E4BB95	1
E4BB96	1
E4BB97	1
E4BB98	1
E4BB99	1
E4BB9A	1
E4BB9B	1
E4BB9C	1
E4BB9D	1
E4BB9E	1
E4BB9F	1
E4BBA0	1
E4BBA1	1
E4BBA2	1
E4BBA3	1
E4BBA4	1
E4BBA5	1
E4BBA6	1
E4BBA7	1
E4BBA8	1
E4BBA9	1
E4BBAA	1
E4BBAB	1
E4BBAC	1
E4BBAD	1
E4BBAE	1
E4BBAF	1
E4BBB0	1
E4BBB1	1
E4BBB2	1
E4BBB3	1
E4BBB4	1
E4BBB5	1
E4BBB6	1
E4BBB7	1
E4BBB8	1
E4BBB9	1
E4BBBA	1
E4BBBB	1
E4BBBC	1
E4BBBD	1
E4BBBE	1
E4BBBF	1
E4BC80	1
E4BC81	1
E4BC82	1
E4BC83	1
E4BC84	1
E4BC85	1
E4BC86	1
E4BC87	1
E4BC88	1
E4BC89	1
E4BC8A	1
E4BC8B	1
E4BC8C	1
E4BC8D	1
E4BC8E	1
E4BC8F	1
E4BC90	1
E4BC91	1
E4BC92	1
E4BC93	1
E4BC94	1
E4BC95	1
E4BC96	1
E4BC97	1
E4BC98	1
E4BC99	1
E4BC9A	1
E4BC9B	1
E4BC9C	1
E4BC9D	1
E4BC9E	1
E4BC9F	1
E4BCA0	1
E4BCA1	1
E4BCA2	1
E4BCA3	1
E4BCA4	1
E4BCA5	1
E4BCA6	1
E4BCA7	1
E4BCA8	1
E4BCA9	1
E4BCAA	1
E4BCAB	1
E4BCAC	1
E4BCAD	1
E4BCAE	1
E4BCAF	1
E4BCB0	1
E4BCB1	1
E4BCB2	1
E4BCB3	1
E4BCB4	1
E4BCB5	1
E4BCB6	1
E4BCB7	1
E4BCB8	1
E4BCB9	1
E4BCBA	1
E4BCBB	1
E4BCBC	1
E4BCBD	1
E4BCBE	1
E4BCBF	1
E4BD80	1
E4BD81	1
E4BD82	1
E4BD83	1
E4BD84	1
E4BD85	1
E4BD86	1
E4BD87	1
E4BD88	1
E4BD89	1
E4BD8A	1
E4BD8B	1
E4BD8C	1
E4BD8D	1
E4BD8E	1
E4BD8F	1
E4BD90	1
E4BD91	1
E4BD92	1
E4BD93	1
E4BD94	1
E4BD95	1
E4BD96	1
E4BD97	1
E4BD98	1
E4BD99	1
E4BD9A	1
E4BD9B	1
E4BD9C	1
E4BD9D	1
E4BD9E	1
E4BD9F	1
E4BDA0	1
E4BDA1	1
E4BDA2	1
E4BDA3	1
E4BDA4	1
E4BDA5	1
E4BDA6	1
E4BDA7	1
E4BDA8	1
E4BDA9	1
E4BDAA	1
E4BDAB	1
E4BDAC	1
E4BDAD	1
E4BDAE	1
E4BDAF	1
E4BDB0	1
E4BDB1	1
E4BDB2	1
E4BDB3	1
E4BDB4	1
E4BDB5	1
E4BDB6	1
E4BDB7	1
E4BDB8	1
E4BDB9	1
E4BDBA	1
E4BDBB	1
E4BDBC	1
E4BDBD	1
E4BDBE	1
E4BDBF	1
E4BE80	1
E4BE81	1
E4BE82	1
E4BE83	1
E4BE84	1
E4BE85	1
E4BE86	1
E4BE87	1
E4BE88	1
E4BE89	1
E4BE8A	1
E4BE8B	1
E4BE8C	1
E4BE8D	1
E4BE8E	1
E4BE8F	1
E4BE90	1
E4BE91	1
E4BE92	1
E4BE93	1
E4BE94	1
E4BE95	1
E4BE96	1
E4BE97	1
E4BE98	1
E4BE99	1
E4BE9A	1
E4BE9B	1
E4BE9C	1
E4BE9D	1
E4BE9E	1
E4BE9F	1
E4BEA0	1
E4BEA1	1
E4BEA2	1
E4BEA3	1
E4BEA4	1
E4BEA5	1
E4BEA6	1
E4BEA7	1
E4BEA8	1
E4BEA9	1
E4BEAA	1
E4BEAB	1
E4BEAC	1
E4BEAD	1
E4BEAE	1
E4BEAF	1
E4BEB0	1
E4BEB1	1
E4BEB2	1
E4BEB3	1
E4BEB4	1
E4BEB5	1
E4BEB6	1
E4BEB7	1
E4BEB8	1
E4BEB9	1
E4BEBA	1
E4BEBB	1
E4BEBC	1
E4BEBD	1
E4BEBE	1
E4BEBF	1
E4BF80	1
E4BF81	1
E4BF82	1
E4BF83	1
E4BF84	1
E4BF85	1
E4BF86	1
E4BF87	1
E4BF88	1
E4BF89	1
E4BF8A	1
E4BF8B	1
E4BF8C	1
E4BF8D	1
E4BF8E	1
E4BF8F	1
E4BF90	1
E4BF91	1
E4BF92	1
E4BF93	1
E4BF94	1
E4BF95	1
E4BF96	1
E4BF97	1
E4BF98	1
E4BF99	1
E4BF9A	1
E4BF9B	1
E4BF9C	1
E4BF9D	1
E4BF9E	1
E4BF9F	1
E4BFA0	1
E4BFA1	1
E4BFA2	1
E4BFA3	1
E4BFA4	1
E4BFA5	1
E4BFA6	1
E4BFA7	1
E4BFA8	1
E4BFA9	1
E4BFAA	1
E4BFAB	1
E4BFAC	1
E4BFAD	1
E4BFAE	1
E4BFAF	1
E4BFB0	1
E4BFB1	1
E4BFB2	1
E4BFB3	1
E4BFB4	1
E4BFB5	1
E4BFB6	1
E4BFB7	1
E4BFB8	1
E4BFB9	1
E4BFBA	1
E4BFBB	1
E4BFBC	1
E4BFBD	1
E4BFBE	1
E4BFBF	1
C8B7	1
C8B8	1
C8B9	1
C8BA	1
C8BB	1
C8BC	1
C8BD	1
C8BE	1
C8BF	1
C980	1
C981	1
C982	1
C983	1
C984	1
C985	1
C986	1
C987	1
C988	1
C989	1
C98A	1
C98B	1
C98C	1
C98D	1
C98E	1
C98F	1
CD98	1
CD99	1
CD9A	1
CD9B	1
CD9C	1
CDB0	1
CDB1	1
CDB2	1
CDB3	1
CDB6	1
CDB7	1
CDB8	1
CDB9	1
CDBB	1
CDBC	1
CDBD	1
CDBF	1
CE80	1
CE81	1
CE82	1
CE83	1
CE8B	1
CE8D	1
CEA2	1
CF8F	1
CFBC	1
CFBD	1
CFBE	1
CFBF	1
D287	1
D38F	1
D3B6	1
D3B7	1
D3BA	1
D3BB	1
D3BC	1
D3BD	1
D3BE	1
D3BF	1
D490	1
D491	1
D492	1
D493	1
D494	1
D495	1
D496	1
D497	1
D498	1
D499	1
D49A	1
D49B	1
D49C	1
D49D	1
D49E	1
D49F	1
D4A0	1
D4A1	1
D4A2	1
D4A3	1
D4A4	1
D4A5	1
D4A6	1
D4A7	1
D4A8	1
D4A9	1
D4AA	1
D4AB	1
D4AC	1
D4AD	1
D4AE	1
D4AF	1
D4B0	1
D597	1
D598	1
D5A0	1
D688	1
D68B	1
D68C	1
D68D	1
D68E	1
D68F	1
D690	1
D6A2	1
D6BA	1
D785	1
D786	1
D787	1
D788	1
D789	1
D78A	1
D78B	1
D78C	1
D78D	1
D78E	1
D78F	1
D7AB	1
D7AC	1
D7AD	1
D7AE	1
D7AF	1
D7B5	1
D7B6	1
D7B7	1
D7B8	1
D7B9	1
D7BA	1
D7BB	1
D7BC	1
D7BD	1
D7BE	1
D7BF	1
D884	1
D885	1
D886	1
D887	1
D888	1
D889	1
D88A	1
D88B	1
D896	1
D897	1
D898	1
D899	1
D89A	1
D89C	1
D89D	1
D89E	1
D8A0	1
D8BB	1
D8BC	1
D8BD	1
D8BE	1
D8BF	1
D999	1
D99A	1
D99B	1
D99C	1
D99D	1
D99E	1
D99F	1
DC8E	1
DD8B	1
DD8C	1
DD90	1
DD91	1
DD92	1
DD93	1
DD94	1
DD95	1
DD96	1
DD97	1
DD98	1
DD99	1
DD9A	1
DD9B	1
DD9C	1
DD9D	1
DD9E	1
DD9F	1
DDA0	1
DDA1	1
DDA2	1
DDA3	1
DDA4	1
DDA5	1
DDA6	1
DDA7	1
DDA8	1
DDA9	1
DDAA	1
DDAB	1
DDAC	1
DDAD	1
DDAE	1
DDAF	1
DDB0	1
DDB1	1
DDB2	1
DDB3	1
DDB4	1
DDB5	1
DDB6	1
DDB7	1
DDB8	1
DDB9	1
DDBA	1
DDBB	1
DDBC	1
DDBD	1
DDBE	1
DDBF	1
DEB2	1
DEB3	1
DEB4	1
DEB5	1
DEB6	1
DEB7	1
DEB8	1
DEB9	1
DEBA	1
DEBB	1
DEBC	1
DEBD	1
DEBE	1
DEBF	1
DF80	1
DF81	1
DF82	1
DF83	1
DF84	1
DF85	1
DF86	1
DF87	1
DF88	1
DF89	1
DF8A	1
DF8B	1
DF8C	1
DF8D	1
DF8E	1
DF8F	1
DF90	1
DF91	1
DF92	1
DF93	1
DF94	1
DF95	1
DF96	1
DF97	1
DF98	1
DF99	1
DF9A	1
DF9B	1
DF9C	1
DF9D	1
DF9E	1
DF9F	1
DFA0	1
DFA1	1
DFA2	1
DFA3	1
DFA4	1
DFA5	1
DFA6	1
DFA7	1
DFA8	1
DFA9	1
DFAA	1
DFAB	1
DFAC	1
DFAD	1
DFAE	1
DFAF	1
DFB0	1
DFB1	1
DFB2	1
DFB3	1
DFB4	1
DFB5	1
DFB6	1
DFB7	1
DFB8	1
DFB9	1
DFBA	1
DFBB	1
DFBC	1
DFBD	1
DFBE	1
DFBF	1
DROP TABLE IF EXISTS test.t1;
DROP TABLE IF EXISTS test.t1;
DROP DATABASE test;
CREATE DATABASE test CHARACTER SET utf8mb3;
USE test;
CREATE TABLE test.t1 (a CHAR(4) CHARACTER SET utf8mb3 COLLATE utf8mb3_slovenian_ci) ENGINE=MyISAM CHARACTER SET utf8mb3 COLLATE utf8mb3_slovenian_ci;
Warnings:
Warning	1287	'utf8mb3' is deprecated and will be removed in a future release. Please use utf8mb4 instead
Warning	3778	'utf8mb3_slovenian_ci' is a collation of the deprecated character set UTF8MB3. Please consider using UTF8MB4 with an appropriate collation instead.
Warning	1287	'utf8mb3' is deprecated and will be removed in a future release. Please use utf8mb4 instead
Warning	3778	'utf8mb3_slovenian_ci' is a collation of the deprecated character set UTF8MB3. Please consider using UTF8MB4 with an appropriate collation instead.
SHOW TABLE STATUS LIKE 't1';
Name	Engine	Version	Row_format	Rows	Avg_row_length	Data_length	Max_data_length	Index_length	Data_free	Auto_increment	Create_time	Update_time	Check_time	Collation	Checksum	Create_options	Comment
t1	MyISAM	#	#	#	#	#	#	#	#	#	#	#	#	utf8mb3_slovenian_ci	#	#	#
LOAD DATA INFILE 
'MYSQL_TEST_DIR/suite/funcs_2/data/charset_utf8.txt' INTO TABLE test.t1;
DELETE FROM test.t1 WHERE CHAR_LENGTH(a) <> 1;
SELECT HEX(ORD(a)) AS a_ord, CHAR_LENGTH(a) AS a_len FROM test.t1 ORDER BY a, ORD(a);
a_ord	a_len
C285	1
7F	1
C280	1
C281	1
C282	1
C283	1
C284	1
C286	1
C287	1
C288	1
C289	1
C28A	1
C28B	1
C28C	1
C28D	1
C28E	1
C28F	1
C290	1
C291	1
C292	1
C293	1
C294	1
C295	1
C296	1
C297	1
C298	1
C299	1
C29A	1
C29B	1
C29C	1
C29D	1
C29E	1
C29F	1
C2A0	1
CC80	1
CC81	1
CC82	1
CC83	1
CC84	1
CC85	1
CC86	1
CC87	1
CC88	1
CC89	1
CC8A	1
CC8B	1
CC8C	1
CC8D	1
CC8E	1
CC8F	1
CC90	1
CC91	1
CC92	1
CC93	1
CC94	1
CC95	1
CC96	1
CC97	1
CC98	1
CC99	1
CC9A	1
CC9B	1
CC9C	1
CC9D	1
CC9E	1
CC9F	1
CCA0	1
CCA1	1
CCA2	1
CCA3	1
CCA4	1
CCA5	1
CCA6	1
CCA7	1
CCA8	1
CCA9	1
CCAA	1
CCAB	1
CCAC	1
CCAD	1
CCAE	1
CCAF	1
CCB0	1
CCB1	1
CCB2	1
CCB3	1
CCB4	1
CCB5	1
CCB6	1
CCB7	1
CCB8	1
CCB9	1
CCBA	1
CCBB	1
CCBC	1
CCBD	1
CCBE	1
CCBF	1
CD80	1
CD81	1
CD82	1
CD83	1
CD84	1
CD85	1
CD86	1
CD87	1
CD88	1
CD89	1
CD8A	1
CD8B	1
CD8C	1
CD8D	1
CD8E	1
CD8F	1
CD90	1
CD91	1
CD92	1
CD93	1
CD94	1
CD95	1
CD96	1
CD97	1
CD9D	1
CD9E	1
CD9F	1
CDA0	1
CDA1	1
CDA2	1
D283	1
D284	1
D285	1
D286	1
D288	1
D289	1
D691	1
D692	1
D693	1
D694	1
D695	1
D696	1
D697	1
D698	1
D699	1
D69A	1
D69B	1
D69C	1
D69D	1
D69E	1
D69F	1
D6A0	1
D6A1	1
D6A3	1
D6A4	1
D6A5	1
D6A6	1
D6A7	1
D6A8	1
D6A9	1
D6AA	1
D6AB	1
D6AC	1
D6AD	1
D6AE	1
D6AF	1
D6B0	1
D6B1	1
D6B2	1
D6B3	1
D6B4	1
D6B5	1
D6B6	1
D6B7	1
D6B8	1
D6B9	1
D6BB	1
D6BC	1
D6BD	1
D6BF	1
D781	1
D782	1
D784	1
D880	1
D881	1
D882	1
D883	1
D890	1
D891	1
D892	1
D893	1
D894	1
D895	1
D98B	1
D98C	1
D98D	1
D98E	1
D98F	1
D990	1
D991	1
D992	1
D993	1
D994	1
D995	1
D996	1
D997	1
D998	1
D9B0	1
DB96	1
DB97	1
DB98	1
DB99	1
DB9A	1
DB9B	1
DB9C	1
DB9D	1
DB9E	1
DB9F	1
DBA0	1
DBA1	1
DBA2	1
DBA3	1
DBA4	1
DBA7	1
DBA8	1
DBAA	1
DBAB	1
DBAC	1
DBAD	1
DC8F	1
DC91	1
DCB0	1
DCB1	1
DCB2	1
DCB3	1
DCB4	1
DCB5	1
DCB6	1
DCB7	1
DCB8	1
DCB9	1
DCBA	1
DCBB	1
DCBC	1
DCBD	1
DCBE	1
DCBF	1
DD80	1
DD81	1
DD82	1
DD83	1
DD84	1
DD85	1
DD86	1
DD87	1
DD88	1
DD89	1
DD8A	1
D980	1
60	1
C2B4	1
CE84	1
CB9C	1
5E	1
C2AF	1
CB98	1
CB99	1
C2A8	1
CE85	1
CB9A	1
CB9D	1
C2B8	1
CB9B	1
5F	1
C2AD	1
2D	1
D68A	1
2C	1
D59D	1
D88C	1
D88D	1
D9AB	1
D9AC	1
3B	1
CDBE	1
D89B	1
3A	1
D689	1
DC83	1
DC84	1
DC85	1
DC86	1
DC87	1
DC88	1
21	1
C2A1	1
D59C	1
3F	1
C2BF	1
D59E	1
D89F	1
DC89	1
2E	1
DB94	1
DC81	1
DC82	1
C2B7	1
CE87	1
DC80	1
27	1
22	1
C2AB	1
C2BB	1
28	1
29	1
5B	1
7B	1
7D	1
C2A7	1
C2B6	1
C2A9	1
C2AE	1
40	1
2A	1
D9AD	1
2F	1
26	1
23	1
25	1
D9AA	1
D59A	1
D59B	1
D59F	1
D6BE	1
D780	1
D783	1
D7B3	1
D7B4	1
DC8A	1
DC8B	1
DC8C	1
DC8D	1
CAB9	1
CDB4	1
CDB5	1
CABA	1
CB82	1
CB83	1
CB84	1
CB85	1
CB86	1
CB87	1
CB88	1
CB89	1
CB8A	1
CB8B	1
CB8C	1
CB8D	1
CB8E	1
CB8F	1
CB92	1
CB93	1
CB94	1
CB95	1
CB96	1
CB97	1
CB9E	1
CB9F	1
CBA5	1
CBA6	1
CBA7	1
CBA8	1
CBA9	1
CBAA	1
CBAB	1
CBAC	1
CBAD	1
CBAF	1
CBB0	1
CBB1	1
CBB2	1
CBB3	1
CBB4	1
CBB5	1
CBB6	1
CBB7	1
CBB8	1
CBB9	1
CBBA	1
CBBB	1
CBBC	1
CBBD	1
CBBE	1
CBBF	1
C2B0	1
D282	1
D88E	1
D88F	1
DBA9	1
CFB6	1
2B	1
C2B1	1
C3B7	1
C397	1
3C	1
3D	1
3E	1
C2AC	1
7C	1
C2A6	1
7E	1
CB90	1
CB91	1
C2A4	1
C2A2	1
24	1
C2A3	1
C2A5	1
30	1
D9A0	1
DBB0	1
31	1
C2B9	1
D9A1	1
DBB1	1
C2BD	1
C2BC	1
32	1
C2B2	1
D9A2	1
DBB2	1
33	1
C2B3	1
D9A3	1
DBB3	1
C2BE	1
34	1
D9A4	1
DBB4	1
35	1
D9A5	1
DBB5	1
36	1
D9A6	1
DBB6	1
37	1
D9A7	1
DBB7	1
38	1
D9A8	1
DBB8	1
39	1
D9A9	1
DBB9	1
41	1
61	1
C2AA	1
C380	1
C381	1
C382	1
C383	1
C384	1
C385	1
C3A0	1
C3A1	1
C3A2	1
C3A3	1
C3A4	1
C3A5	1
C480	1
C481	1
C482	1
C483	1
C484	1
C485	1
C78D	1
C78E	1
C79E	1
C79F	1
C7A0	1
C7A1	1
C7BA	1
C7BB	1
C880	1
C881	1
C882	1
C883	1
C8A6	1
C8A7	1
CDA3	1
C386	1
C3A6	1
C7A2	1
C7A3	1
C7BC	1
C7BD	1
C990	1
C991	1
C992	1
42	1
62	1
CA99	1
C680	1
C681	1
C993	1
C682	1
C683	1
43	1
63	1
C387	1
C3A7	1
C486	1
C487	1
C488	1
C489	1
C48A	1
C48B	1
CDA8	1
C48C	1
C48D	1
C687	1
C688	1
C995	1
44	1
64	1
C48E	1
C48F	1
CDA9	1
C784	1
C785	1
C786	1
C7B1	1
C7B2	1
C7B3	1
CAA3	1
CAA5	1
CAA4	1
C490	1
C491	1
C689	1
C996	1
C68A	1
C997	1
C68B	1
C68C	1
C8A1	1
C390	1
C3B0	1
45	1
65	1
C388	1
C389	1
C38A	1
C38B	1
C3A8	1
C3A9	1
C3AA	1
C3AB	1
C492	1
C493	1
C494	1
C495	1
C496	1
C497	1
C498	1
C499	1
C49A	1
C49B	1
C884	1
C885	1
C886	1
C887	1
C8A8	1
C8A9	1
CDA4	1
C68E	1
C79D	1
C68F	1
C999	1
C690	1
C99B	1
C998	1
C99A	1
C99C	1
C99D	1
C99E	1
CA9A	1
C9A4	1
46	1
66	1
CAA9	1
C691	1
C692	1
47	1
67	1
C49C	1
C49D	1
C49E	1
C49F	1
C4A0	1
C4A1	1
C4A2	1
C4A3	1
C7A6	1
C7A7	1
C7B4	1
C7B5	1
C9A1	1
C9A2	1
C7A4	1
C7A5	1
C693	1
C9A0	1
CA9B	1
C694	1
C9A3	1
CBA0	1
C6A2	1
C6A3	1
48	1
68	1
C4A4	1
C4A5	1
C89E	1
C89F	1
CAB0	1
CDAA	1
CA9C	1
C695	1
C7B6	1
C4A6	1
C4A7	1
C9A6	1
CAB1	1
C9A7	1
CABB	1
CABD	1
49	1
69	1
C38C	1
C38D	1
C38E	1
C38F	1
C3AC	1
C3AD	1
C3AE	1
C3AF	1
C4A8	1
C4A9	1
C4AA	1
C4AB	1
C4AC	1
C4AD	1
C4AE	1
C4AF	1
C4B0	1
C78F	1
C790	1
C888	1
C889	1
C88A	1
C88B	1
CDA5	1
C4B2	1
C4B3	1
C4B1	1
C9AA	1
C697	1
C9A8	1
C696	1
C9A9	1
4A	1
6A	1
C4B4	1
C4B5	1
C7B0	1
CAB2	1
CA9D	1
C99F	1
CA84	1
4B	1
6B	1
C4B6	1
C4B7	1
C7A8	1
C7A9	1
C698	1
C699	1
CA9E	1
4C	1
6C	1
C4B9	1
C4BA	1
C4BB	1
C4BC	1
C4BD	1
C4BE	1
CBA1	1
C4BF	1
C580	1
C787	1
C788	1
C789	1
CAAA	1
CAAB	1
CA9F	1
C581	1
C582	1
C69A	1
C9AB	1
C9AC	1
C9AD	1
C8B4	1
C9AE	1
C69B	1
CA8E	1
4D	1
6D	1
CDAB	1
C9B1	1
4E	1
6E	1
C391	1
C3B1	1
C583	1
C584	1
C585	1
C586	1
C587	1
C588	1
C7B8	1
C7B9	1
C78A	1
C78B	1
C78C	1
C9B4	1
C69D	1
C9B2	1
C69E	1
C8A0	1
C9B3	1
C8B5	1
C58A	1
C58B	1
4F	1
6F	1
C2BA	1
C392	1
C393	1
C394	1
C395	1
C396	1
C3B2	1
C3B3	1
C3B4	1
C3B5	1
C3B6	1
C58C	1
C58D	1
C58E	1
C58F	1
C590	1
C591	1
C6A0	1
C6A1	1
C791	1
C792	1
C7AA	1
C7AB	1
C7AC	1
C7AD	1
C88C	1
C88D	1
C88E	1
C88F	1
C8AA	1
C8AB	1
C8AC	1
C8AD	1
C8AE	1
C8AF	1
C8B0	1
C8B1	1
CDA6	1
C592	1
C593	1
C9B6	1
C398	1
C3B8	1
C7BE	1
C7BF	1
C686	1
C994	1
C69F	1
C9B5	1
C9B7	1
C8A2	1
C8A3	1
50	1
70	1
C6A4	1
C6A5	1
C9B8	1
51	1
71	1
CAA0	1
C4B8	1
52	1
72	1
C594	1
C595	1
C596	1
C597	1
C598	1
C599	1
C890	1
C891	1
C892	1
C893	1
CAB3	1
CDAC	1
C6A6	1
CA80	1
C9B9	1
CAB4	1
C9BA	1
C9BB	1
CAB5	1
C9BC	1
C9BD	1
C9BE	1
C9BF	1
CA81	1
CAB6	1
53	1
73	1
C59A	1
C59B	1
C59C	1
C59D	1
C59E	1
C59F	1
C5BF	1
C898	1
C899	1
CBA2	1
C39F	1
C5A0	1
C5A1	1
CA82	1
C6A9	1
CA83	1
C6AA	1
CA85	1
CA86	1
54	1
74	1
C5A2	1
C5A3	1
C5A4	1
C5A5	1
C89A	1
C89B	1
CDAD	1
CAA8	1
C6BE	1
CAA6	1
CAA7	1
C5A6	1
C5A7	1
C6AB	1
C6AC	1
C6AD	1
C6AE	1
CA88	1
C8B6	1
CA87	1
55	1
75	1
C399	1
C39A	1
C39B	1
C39C	1
C3B9	1
C3BA	1
C3BB	1
C3BC	1
C5A8	1
C5A9	1
C5AA	1
C5AB	1
C5AC	1
C5AD	1
C5AE	1
C5AF	1
C5B0	1
C5B1	1
C5B2	1
C5B3	1
C6AF	1
C6B0	1
C793	1
C794	1
C795	1
C796	1
C797	1
C798	1
C799	1
C79A	1
C79B	1
C79C	1
C894	1
C895	1
C896	1
C897	1
CDA7	1
CA89	1
C9A5	1
CAAE	1
CAAF	1
C69C	1
C9AF	1
C9B0	1
C6B1	1
CA8A	1
56	1
76	1
CDAE	1
C6B2	1
CA8B	1
CA8C	1
57	1
77	1
C5B4	1
C5B5	1
CAB7	1
CA8D	1
58	1
78	1
CBA3	1
CDAF	1
59	1
79	1
C39D	1
C3BD	1
C3BF	1
C5B6	1
C5B7	1
C5B8	1
C8B2	1
C8B3	1
CAB8	1
CA8F	1
C6B3	1
C6B4	1
5A	1
7A	1
C5B9	1
C5BA	1
C5BB	1
C5BC	1
C68D	1
C5BD	1
C5BE	1
C6B5	1
C6B6	1
C8A4	1
C8A5	1
CA90	1
CA91	1
C6B7	1
C7AE	1
C7AF	1
CA92	1
C6B8	1
C6B9	1
C6BA	1
CA93	1
C89C	1
C89D	1
C39E	1
C3BE	1
C6BF	1
C7B7	1
C6BB	1
C6A7	1
C6A8	1
C6BC	1
C6BD	1
C684	1
C685	1
CA94	1
CB80	1
CABC	1
C589	1
CBAE	1
CABE	1
CA95	1
CBA4	1
CABF	1
CB81	1
CAA1	1
CAA2	1
CA96	1
C780	1
C781	1
C782	1
C783	1
CA97	1
CA98	1
CAAC	1
CAAD	1
CE86	1
CE91	1
CEAC	1
CEB1	1
CE92	1
CEB2	1
CF90	1
CE93	1
CEB3	1
CE94	1
CEB4	1
CE88	1
CE95	1
CEAD	1
CEB5	1
CFB5	1
CF9C	1
CF9D	1
CF9A	1
CF9B	1
CE96	1
CEB6	1
CE89	1
CE97	1
CEAE	1
CEB7	1
CE98	1
CEB8	1
CF91	1
CFB4	1
CDBA	1
CE8A	1
CE90	1
CE99	1
CEAA	1
CEAF	1
CEB9	1
CF8A	1
CFB3	1
CE9A	1
CEBA	1
CFB0	1
CF97	1
CE9B	1
CEBB	1
C2B5	1
CE9C	1
CEBC	1
CE9D	1
CEBD	1
CE9E	1
CEBE	1
CE8C	1
CE9F	1
CEBF	1
CF8C	1
CEA0	1
CF80	1
CF96	1
CF9E	1
CF9F	1
CF98	1
CF99	1
CEA1	1
CF81	1
CFB1	1
CEA3	1
CF82	1
CF83	1
CFB2	1
CFB9	1
CEA4	1
CF84	1
CE8E	1
CEA5	1
CEAB	1
CEB0	1
CF85	1
CF8B	1
CF8D	1
CF92	1
CF93	1
CF94	1
CEA6	1
CF86	1
CF95	1
CEA7	1
CF87	1
CEA8	1
CF88	1
CE8F	1
CEA9	1
CF89	1
CF8E	1
CFA0	1
CFA1	1
CFB7	1
CFB8	1
CFBA	1
CFBB	1
CFA2	1
CFA3	1
CFA4	1
CFA5	1
CFA6	1
CFA7	1
CFA8	1
CFA9	1
CFAA	1
CFAB	1
CFAC	1
CFAD	1
CFAE	1
CFAF	1
D090	1
D0B0	1
D390	1
D391	1
D392	1
D393	1
D398	1
D399	1
D39A	1
D39B	1
D394	1
D395	1
D091	1
D0B1	1
D092	1
D0B2	1
D093	1
D0B3	1
D290	1
D291	1
D292	1
D293	1
D294	1
D295	1
D094	1
D0B4	1
D480	1
D481	1
D082	1
D192	1
D482	1
D483	1
D083	1
D193	1
D298	1
D299	1
D080	1
D081	1
D095	1
D0B5	1
D190	1
D191	1
D396	1
D397	1
D084	1
D194	1
D096	1
D0B6	1
D381	1
D382	1
D39C	1
D39D	1
D296	1
D297	1
D097	1
D0B7	1
D484	1
D485	1
D39E	1
D39F	1
D085	1
D195	1
D3A0	1
D3A1	1
D486	1
D487	1
D08D	1
D098	1
D0B8	1
D19D	1
D3A2	1
D3A3	1
D28A	1
D28B	1
D3A4	1
D3A5	1
D086	1
D196	1
D087	1
D197	1
D099	1
D0B9	1
D088	1
D198	1
D09A	1
D0BA	1
D29A	1
D29B	1
D383	1
D384	1
D2A0	1
D2A1	1
D29E	1
D29F	1
D29C	1
D29D	1
D09B	1
D0BB	1
D385	1
D386	1
D089	1
D199	1
D488	1
D489	1
D09C	1
D0BC	1
D38D	1
D38E	1
D09D	1
D0BD	1
D389	1
D38A	1
D2A2	1
D2A3	1
D387	1
D388	1
D2A4	1
D2A5	1
D08A	1
D19A	1
D48A	1
D48B	1
D09E	1
D0BE	1
D3A6	1
D3A7	1
D3A8	1
D3A9	1
D3AA	1
D3AB	1
D09F	1
D0BF	1
D2A6	1
D2A7	1
D280	1
D281	1
D0A0	1
D180	1
D28E	1
D28F	1
D0A1	1
D181	1
D48C	1
D48D	1
D2AA	1
D2AB	1
D0A2	1
D182	1
D48E	1
D48F	1
D2AC	1
D2AD	1
D08B	1
D19B	1
D08C	1
D19C	1
D0A3	1
D183	1
D3AE	1
D3AF	1
D08E	1
D19E	1
D3B0	1
D3B1	1
D3B2	1
D3B3	1
D2AE	1
D2AF	1
D2B0	1
D2B1	1
D1B8	1
D1B9	1
D0A4	1
D184	1
D0A5	1
D185	1
D2B2	1
D2B3	1
D2BA	1
D2BB	1
D1A0	1
D1A1	1
D1BE	1
D1BF	1
D1BC	1
D1BD	1
D1BA	1
D1BB	1
D0A6	1
D186	1
D2B4	1
D2B5	1
D0A7	1
D187	1
D3B4	1
D3B5	1
D2B6	1
D2B7	1
D38B	1
D38C	1
D2B8	1
D2B9	1
D2BC	1
D2BD	1
D2BE	1
D2BF	1
D08F	1
D19F	1
D0A8	1
D188	1
D0A9	1
D189	1
D0AA	1
D18A	1
D0AB	1
D18B	1
D3B8	1
D3B9	1
D0AC	1
D18C	1
D28C	1
D28D	1
D1A2	1
D1A3	1
D0AD	1
D18D	1
D3AC	1
D3AD	1
D0AE	1
D18E	1
D0AF	1
D18F	1
D1A4	1
D1A5	1
D1A6	1
D1A7	1
D1AA	1
D1AB	1
D1A8	1
D1A9	1
D1AC	1
D1AD	1
D1AE	1
D1AF	1
D1B0	1
D1B1	1
D1B2	1
D1B3	1
D1B4	1
D1B5	1
D1B6	1
D1B7	1
D2A8	1
D2A9	1
D380	1
D4B1	1
D5A1	1
D4B2	1
D5A2	1
D4B3	1
D5A3	1
D4B4	1
D5A4	1
D4B5	1
D5A5	1
D687	1
D4B6	1
D5A6	1
D4B7	1
D5A7	1
D4B8	1
D5A8	1
D4B9	1
D5A9	1
D4BA	1
D5AA	1
D4BB	1
D5AB	1
D4BC	1
D5AC	1
D4BD	1
D5AD	1
D4BE	1
D5AE	1
D4BF	1
D5AF	1
D580	1
D5B0	1
D581	1
D5B1	1
D582	1
D5B2	1
D583	1
D5B3	1
D584	1
D5B4	1
D585	1
D5B5	1
D586	1
D5B6	1
D587	1
D5B7	1
D588	1
D5B8	1
D589	1
D5B9	1
D58A	1
D5BA	1
D58B	1
D5BB	1
D58C	1
D5BC	1
D58D	1
D5BD	1
D58E	1
D5BE	1
D58F	1
D5BF	1
D590	1
D680	1
D591	1
D681	1
D592	1
D682	1
D593	1
D683	1
D594	1
D684	1
D595	1
D685	1
D596	1
D686	1
D599	1
D790	1
D791	1
D792	1
D793	1
D794	1
D795	1
D7B0	1
D7B1	1
D796	1
D797	1
D798	1
D799	1
D7B2	1
D79A	1
D79B	1
D79C	1
D79D	1
D79E	1
D79F	1
D7A0	1
D7A1	1
D7A2	1
D7A3	1
D7A4	1
D7A5	1
D7A6	1
D7A7	1
D7A8	1
D7A9	1
D7AA	1
D8A1	1
D9B4	1
DBBD	1
D8A2	1
D8A3	1
D9B2	1
D9B1	1
D8A4	1
D8A5	1
D9B3	1
D8A6	1
D8A7	1
D9B5	1
D9AE	1
D8A8	1
D9BB	1
D9BE	1
DA80	1
D8A9	1
D8AA	1
D8AB	1
D9B9	1
D9BA	1
D9BC	1
D9BD	1
D9BF	1
D8AC	1
DA83	1
DA84	1
DA86	1
DABF	1
DA87	1
D8AD	1
D8AE	1
DA81	1
DA82	1
DA85	1
D8AF	1
D8B0	1
DA88	1
DA89	1
DA8A	1
DA8B	1
DA8C	1
DA8D	1
DA8E	1
DA8F	1
DA90	1
DBAE	1
D8B1	1
D8B2	1
DA91	1
DA92	1
DA93	1
DA94	1
DA95	1
DA96	1
DA97	1
DA98	1
DA99	1
DBAF	1
D8B3	1
D8B4	1
DA9A	1
DA9B	1
DA9C	1
DBBA	1
D8B5	1
D8B6	1
DA9D	1
DA9E	1
DBBB	1
D8B7	1
D8B8	1
DA9F	1
D8B9	1
D8BA	1
DAA0	1
DBBC	1
D981	1
DAA1	1
DAA2	1
DAA3	1
DAA4	1
DAA5	1
DAA6	1
D9AF	1
D982	1
DAA7	1
DAA8	1
D983	1
DAA9	1
DAAA	1
DAAB	1
DAAC	1
DAAD	1
DAAE	1
DAAF	1
DAB0	1
DAB1	1
DAB2	1
DAB3	1
DAB4	1
D984	1
DAB5	1
DAB6	1
DAB7	1
DAB8	1
D985	1
DBBE	1
D986	1
DABA	1
DABB	1
DABC	1
DABD	1
DAB9	1
D987	1
DABE	1
DB81	1
DB82	1
DB83	1
DBBF	1
DB80	1
DB95	1
D988	1
DBA5	1
D9B6	1
DB84	1
DB85	1
DB86	1
DB87	1
D9B7	1
DB88	1
DB89	1
DB8A	1
DB8B	1
DB8F	1
D989	1
D98A	1
DBA6	1
D9B8	1
DB8C	1
DB8D	1
DB8E	1
DB90	1
DB91	1
DB92	1
DB93	1
DC90	1
DC92	1
DCAD	1
DC93	1
DC94	1
DCAE	1
DC96	1
DC95	1
DCAF	1
DC97	1
DC98	1
DC99	1
DD8D	1
DC9A	1
DC9B	1
DC9C	1
DC9D	1
DC9E	1
DC9F	1
DD8E	1
DCA0	1
DCA1	1
DCA2	1
DCA3	1
DCA4	1
DCA5	1
DCA6	1
DCA7	1
DD8F	1
DCA8	1
DCA9	1
DCAA	1
DCAB	1
DCAC	1
DE80	1
DE99	1
DE9A	1
DE81	1
DE82	1
DE83	1
DE9C	1
DE84	1
DE85	1
DE86	1
DE87	1
DEA2	1
DEA3	1
DE88	1
DEA5	1
DE89	1
DE8A	1
DE8B	1
DE9B	1
DE8C	1
DE98	1
DEA0	1
DEA1	1
DE8D	1
DE8E	1
DEA4	1
DE8F	1
DE90	1
DE9D	1
DE9E	1
DE9F	1
DE91	1
DE92	1
DE93	1
DE94	1
DE95	1
DE96	1
DE97	1
DEB1	1
DEA6	1
DEA7	1
DEA8	1
DEA9	1
DEAA	1
DEAB	1
DEAC	1
DEAD	1
DEAE	1
DEAF	1
DEB0	1
E4B880	1
E4B881	1
E4B882	1
E4B883	1
E4B884	1
E4B885	1
E4B886	1
E4B887	1
E4B888	1
E4B889	1
E4B88A	1
E4B88B	1
E4B88C	1
E4B88D	1
E4B88E	1
E4B88F	1
E4B890	1
E4B891	1
E4B892	1
E4B893	1
E4B894	1
E4B895	1
E4B896	1
E4B897	1
E4B898	1
E4B899	1
E4B89A	1
E4B89B	1
E4B89C	1
E4B89D	1
E4B89E	1
E4B89F	1
E4B8A0	1
E4B8A1	1
E4B8A2	1
E4B8A3	1
E4B8A4	1
E4B8A5	1
E4B8A6	1
E4B8A7	1
E4B8A8	1
E4B8A9	1
E4B8AA	1
E4B8AB	1
E4B8AC	1
E4B8AD	1
E4B8AE	1
E4B8AF	1
E4B8B0	1
E4B8B1	1
E4B8B2	1
E4B8B3	1
E4B8B4	1
E4B8B5	1
E4B8B6	1
E4B8B7	1
E4B8B8	1
E4B8B9	1
E4B8BA	1
E4B8BB	1
E4B8BC	1
E4B8BD	1
E4B8BE	1
E4B8BF	1
E4B980	1
E4B981	1
E4B982	1
E4B983	1
E4B984	1
E4B985	1
E4B986	1
E4B987	1
E4B988	1
E4B989	1
E4B98A	1
E4B98B	1
E4B98C	1
E4B98D	1
E4B98E	1
E4B98F	1
E4B990	1
E4B991	1
E4B992	1
E4B993	1
E4B994	1
E4B995	1
E4B996	1
E4B997	1
E4B998	1
E4B999	1
E4B99A	1
E4B99B	1
E4B99C	1
E4B99D	1
E4B99E	1
E4B99F	1
E4B9A0	1
E4B9A1	1
E4B9A2	1
E4B9A3	1
E4B9A4	1
E4B9A5	1
E4B9A6	1
E4B9A7	1
E4B9A8	1
E4B9A9	1
E4B9AA	1
E4B9AB	1
E4B9AC	1
E4B9AD	1
E4B9AE	1
E4B9AF	1
E4B9B0	1
E4B9B1	1
E4B9B2	1
E4B9B3	1
E4B9B4	1
E4B9B5	1
E4B9B6	1
E4B9B7	1
E4B9B8	1
E4B9B9	1
E4B9BA	1
E4B9BB	1
E4B9BC	1
E4B9BD	1
E4B9BE	1
E4B9BF	1
E4BA80	1
E4BA81	1
E4BA82	1
E4BA83	1
E4BA84	1
E4BA85	1
E4BA86	1
E4BA87	1
E4BA88	1
E4BA89	1
E4BA8A	1
E4BA8B	1
E4BA8C	1
E4BA8D	1
E4BA8E	1
E4BA8F	1
E4BA90	1
E4BA91	1
E4BA92	1
E4BA93	1
E4BA94	1
E4BA95	1
E4BA96	1
E4BA97	1
E4BA98	1
E4BA99	1
E4BA9A	1
E4BA9B	1
E4BA9C	1
E4BA9D	1
E4BA9E	1
E4BA9F	1
E4BAA0	1
E4BAA1	1
E4BAA2	1
E4BAA3	1
E4BAA4	1
E4BAA5	1
E4BAA6	1
E4BAA7	1
E4BAA8	1
E4BAA9	1
E4BAAA	1
E4BAAB	1
E4BAAC	1
E4BAAD	1
E4BAAE	1
E4BAAF	1
E4BAB0	1
E4BAB1	1
E4BAB2	1
E4BAB3	1
E4BAB4	1
E4BAB5	1
E4BAB6	1
E4BAB7	1
E4BAB8	1
E4BAB9	1
E4BABA	1
E4BABB	1
E4BABC	1
E4BABD	1
E4BABE	1
E4BABF	1
E4BB80	1
E4BB81	1
E4BB82	1
E4BB83	1
E4BB84	1
E4BB85	1
E4BB86	1
E4BB87	1
E4BB88	1
E4BB89	1
E4BB8A	1
E4BB8B	1
E4BB8C	1
E4BB8D	1
E4BB8E	1
E4BB8F	1
E4BB90	1
E4BB91	1
E4BB92	1
E4BB93	1
E4BB94	1
E4BB95	1
E4BB96	1
E4BB97	1
E4BB98	1
E4BB99	1
E4BB9A	1
E4BB9B	1
E4BB9C	1
E4BB9D	1
E4BB9E	1
E4BB9F	1
E4BBA0	1
E4BBA1	1
E4BBA2	1
E4BBA3	1
E4BBA4	1
E4BBA5	1
E4BBA6	1
E4BBA7	1
E4BBA8	1
E4BBA9	1
E4BBAA	1
E4BBAB	1
E4BBAC	1
E4BBAD	1
E4BBAE	1
E4BBAF	1
E4BBB0	1
E4BBB1	1
E4BBB2	1
E4BBB3	1
E4BBB4	1
E4BBB5	1
E4BBB6	1
E4BBB7	1
E4BBB8	1
E4BBB9	1
E4BBBA	1
E4BBBB	1
E4BBBC	1
E4BBBD	1
E4BBBE	1
E4BBBF	1
E4BC80	1
E4BC81	1
E4BC82	1
E4BC83	1
E4BC84	1
E4BC85	1
E4BC86	1
E4BC87	1
E4BC88	1
E4BC89	1
E4BC8A	1
E4BC8B	1
E4BC8C	1
E4BC8D	1
E4BC8E	1
E4BC8F	1
E4BC90	1
E4BC91	1
E4BC92	1
E4BC93	1
E4BC94	1
E4BC95	1
E4BC96	1
E4BC97	1
E4BC98	1
E4BC99	1
E4BC9A	1
E4BC9B	1
E4BC9C	1
E4BC9D	1
E4BC9E	1
E4BC9F	1
E4BCA0	1
E4BCA1	1
E4BCA2	1
E4BCA3	1
E4BCA4	1
E4BCA5	1
E4BCA6	1
E4BCA7	1
E4BCA8	1
E4BCA9	1
E4BCAA	1
E4BCAB	1
E4BCAC	1
E4BCAD	1
E4BCAE	1
E4BCAF	1
E4BCB0	1
E4BCB1	1
E4BCB2	1
E4BCB3	1
E4BCB4	1
E4BCB5	1
E4BCB6	1
E4BCB7	1
E4BCB8	1
E4BCB9	1
E4BCBA	1
E4BCBB	1
E4BCBC	1
E4BCBD	1
E4BCBE	1
E4BCBF	1
E4BD80	1
E4BD81	1
E4BD82	1
E4BD83	1
E4BD84	1
E4BD85	1
E4BD86	1
E4BD87	1
E4BD88	1
E4BD89	1
E4BD8A	1
E4BD8B	1
E4BD8C	1
E4BD8D	1
E4BD8E	1
E4BD8F	1
E4BD90	1
E4BD91	1
E4BD92	1
E4BD93	1
E4BD94	1
E4BD95	1
E4BD96	1
E4BD97	1
E4BD98	1
E4BD99	1
E4BD9A	1
E4BD9B	1
E4BD9C	1
E4BD9D	1
E4BD9E	1
E4BD9F	1
E4BDA0	1
E4BDA1	1
E4BDA2	1
E4BDA3	1
E4BDA4	1
E4BDA5	1
E4BDA6	1
E4BDA7	1
E4BDA8	1
E4BDA9	1
E4BDAA	1
E4BDAB	1
E4BDAC	1
E4BDAD	1
E4BDAE	1
E4BDAF	1
E4BDB0	1
E4BDB1	1
E4BDB2	1
E4BDB3	1
E4BDB4	1
E4BDB5	1
E4BDB6	1
E4BDB7	1
E4BDB8	1
E4BDB9	1
E4BDBA	1
E4BDBB	1
E4BDBC	1
E4BDBD	1
E4BDBE	1
E4BDBF	1
E4BE80	1
E4BE81	1
E4BE82	1
E4BE83	1
E4BE84	1
E4BE85	1
E4BE86	1
E4BE87	1
E4BE88	1
E4BE89	1
E4BE8A	1
E4BE8B	1
E4BE8C	1
E4BE8D	1
E4BE8E	1
E4BE8F	1
E4BE90	1
E4BE91	1
E4BE92	1
E4BE93	1
E4BE94	1
E4BE95	1
E4BE96	1
E4BE97	1
E4BE98	1
E4BE99	1
E4BE9A	1
E4BE9B	1
E4BE9C	1
E4BE9D	1
E4BE9E	1
E4BE9F	1
E4BEA0	1
E4BEA1	1
E4BEA2	1
E4BEA3	1
E4BEA4	1
E4BEA5	1
E4BEA6	1
E4BEA7	1
E4BEA8	1
E4BEA9	1
E4BEAA	1
E4BEAB	1
E4BEAC	1
E4BEAD	1
E4BEAE	1
E4BEAF	1
E4BEB0	1
E4BEB1	1
E4BEB2	1
E4BEB3	1
E4BEB4	1
E4BEB5	1
E4BEB6	1
E4BEB7	1
E4BEB8	1
E4BEB9	1
E4BEBA	1
E4BEBB	1
E4BEBC	1
E4BEBD	1
E4BEBE	1
E4BEBF	1
E4BF80	1
E4BF81	1
E4BF82	1
E4BF83	1
E4BF84	1
E4BF85	1
E4BF86	1
E4BF87	1
E4BF88	1
E4BF89	1
E4BF8A	1
E4BF8B	1
E4BF8C	1
E4BF8D	1
E4BF8E	1
E4BF8F	1
E4BF90	1
E4BF91	1
E4BF92	1
E4BF93	1
E4BF94	1
E4BF95	1
E4BF96	1
E4BF97	1
E4BF98	1
E4BF99	1
E4BF9A	1
E4BF9B	1
E4BF9C	1
E4BF9D	1
E4BF9E	1
E4BF9F	1
E4BFA0	1
E4BFA1	1
E4BFA2	1
E4BFA3	1
E4BFA4	1
E4BFA5	1
E4BFA6	1
E4BFA7	1
E4BFA8	1
E4BFA9	1
E4BFAA	1
E4BFAB	1
E4BFAC	1
E4BFAD	1
E4BFAE	1
E4BFAF	1
E4BFB0	1
E4BFB1	1
E4BFB2	1
E4BFB3	1
E4BFB4	1
E4BFB5	1
E4BFB6	1
E4BFB7	1
E4BFB8	1
E4BFB9	1
E4BFBA	1
E4BFBB	1
E4BFBC	1
E4BFBD	1
E4BFBE	1
E4BFBF	1
C8B7	1
C8B8	1
C8B9	1
C8BA	1
C8BB	1
C8BC	1
C8BD	1
C8BE	1
C8BF	1
C980	1
C981	1
C982	1
C983	1
C984	1
C985	1
C986	1
C987	1
C988	1
C989	1
C98A	1
C98B	1
C98C	1
C98D	1
C98E	1
C98F	1
CD98	1
CD99	1
CD9A	1
CD9B	1
CD9C	1
CDB0	1
CDB1	1
CDB2	1
CDB3	1
CDB6	1
CDB7	1
CDB8	1
CDB9	1
CDBB	1
CDBC	1
CDBD	1
CDBF	1
CE80	1
CE81	1
CE82	1
CE83	1
CE8B	1
CE8D	1
CEA2	1
CF8F	1
CFBC	1
CFBD	1
CFBE	1
CFBF	1
D287	1
D38F	1
D3B6	1
D3B7	1
D3BA	1
D3BB	1
D3BC	1
D3BD	1
D3BE	1
D3BF	1
D490	1
D491	1
D492	1
D493	1
D494	1
D495	1
D496	1
D497	1
D498	1
D499	1
D49A	1
D49B	1
D49C	1
D49D	1
D49E	1
D49F	1
D4A0	1
D4A1	1
D4A2	1
D4A3	1
D4A4	1
D4A5	1
D4A6	1
D4A7	1
D4A8	1
D4A9	1
D4AA	1
D4AB	1
D4AC	1
D4AD	1
D4AE	1
D4AF	1
D4B0	1
D597	1
D598	1
D5A0	1
D688	1
D68B	1
D68C	1
D68D	1
D68E	1
D68F	1
D690	1
D6A2	1
D6BA	1
D785	1
D786	1
D787	1
D788	1
D789	1
D78A	1
D78B	1
D78C	1
D78D	1
D78E	1
D78F	1
D7AB	1
D7AC	1
D7AD	1
D7AE	1
D7AF	1
D7B5	1
D7B6	1
D7B7	1
D7B8	1
D7B9	1
D7BA	1
D7BB	1
D7BC	1
D7BD	1
D7BE	1
D7BF	1
D884	1
D885	1
D886	1
D887	1
D888	1
D889	1
D88A	1
D88B	1
D896	1
D897	1
D898	1
D899	1
D89A	1
D89C	1
D89D	1
D89E	1
D8A0	1
D8BB	1
D8BC	1
D8BD	1
D8BE	1
D8BF	1
D999	1
D99A	1
D99B	1
D99C	1
D99D	1
D99E	1
D99F	1
DC8E	1
DD8B	1
DD8C	1
DD90	1
DD91	1
DD92	1
DD93	1
DD94	1
DD95	1
DD96	1
DD97	1
DD98	1
DD99	1
DD9A	1
DD9B	1
DD9C	1
DD9D	1
DD9E	1
DD9F	1
DDA0	1
DDA1	1
DDA2	1
DDA3	1
DDA4	1
DDA5	1
DDA6	1
DDA7	1
DDA8	1
DDA9	1
DDAA	1
DDAB	1
DDAC	1
DDAD	1
DDAE	1
DDAF	1
DDB0	1
DDB1	1
DDB2	1
DDB3	1
DDB4	1
DDB5	1
DDB6	1
DDB7	1
DDB8	1
DDB9	1
DDBA	1
DDBB	1
DDBC	1
DDBD	1
DDBE	1
DDBF	1
DEB2	1
DEB3	1
DEB4	1
DEB5	1
DEB6	1
DEB7	1
DEB8	1
DEB9	1
DEBA	1
DEBB	1
DEBC	1
DEBD	1
DEBE	1
DEBF	1
DF80	1
DF81	1
DF82	1
DF83	1
DF84	1
DF85	1
DF86	1
DF87	1
DF88	1
DF89	1
DF8A	1
DF8B	1
DF8C	1
DF8D	1
DF8E	1
DF8F	1
DF90	1
DF91	1
DF92	1
DF93	1
DF94	1
DF95	1
DF96	1
DF97	1
DF98	1
DF99	1
DF9A	1
DF9B	1
DF9C	1
DF9D	1
DF9E	1
DF9F	1
DFA0	1
DFA1	1
DFA2	1
DFA3	1
DFA4	1
DFA5	1
DFA6	1
DFA7	1
DFA8	1
DFA9	1
DFAA	1
DFAB	1
DFAC	1
DFAD	1
DFAE	1
DFAF	1
DFB0	1
DFB1	1
DFB2	1
DFB3	1
DFB4	1
DFB5	1
DFB6	1
DFB7	1
DFB8	1
DFB9	1
DFBA	1
DFBB	1
DFBC	1
DFBD	1
DFBE	1
DFBF	1
DROP TABLE IF EXISTS test.t1;
DROP TABLE IF EXISTS test.t1;
DROP DATABASE test;
CREATE DATABASE test CHARACTER SET utf8mb3;
USE test;
CREATE TABLE test.t1 (a CHAR(4) CHARACTER SET utf8mb3 COLLATE utf8mb3_spanish2_ci) ENGINE=MyISAM CHARACTER SET utf8mb3 COLLATE utf8mb3_spanish2_ci;
Warnings:
Warning	1287	'utf8mb3' is deprecated and will be removed in a future release. Please use utf8mb4 instead
Warning	3778	'utf8mb3_spanish2_ci' is a collation of the deprecated character set UTF8MB3. Please consider using UTF8MB4 with an appropriate collation instead.
Warning	1287	'utf8mb3' is deprecated and will be removed in a future release. Please use utf8mb4 instead
Warning	3778	'utf8mb3_spanish2_ci' is a collation of the deprecated character set UTF8MB3. Please consider using UTF8MB4 with an appropriate collation instead.
SHOW TABLE STATUS LIKE 't1';
Name	Engine	Version	Row_format	Rows	Avg_row_length	Data_length	Max_data_length	Index_length	Data_free	Auto_increment	Create_time	Update_time	Check_time	Collation	Checksum	Create_options	Comment
t1	MyISAM	#	#	#	#	#	#	#	#	#	#	#	#	utf8mb3_spanish2_ci	#	#	#
LOAD DATA INFILE 
'MYSQL_TEST_DIR/suite/funcs_2/data/charset_utf8.txt' INTO TABLE test.t1;
DELETE FROM test.t1 WHERE CHAR_LENGTH(a) <> 1;
SELECT HEX(ORD(a)) AS a_ord, CHAR_LENGTH(a) AS a_len FROM test.t1 ORDER BY a, ORD(a);
a_ord	a_len
C285	1
7F	1
C280	1
C281	1
C282	1
C283	1
C284	1
C286	1
C287	1
C288	1
C289	1
C28A	1
C28B	1
C28C	1
C28D	1
C28E	1
C28F	1
C290	1
C291	1
C292	1
C293	1
C294	1
C295	1
C296	1
C297	1
C298	1
C299	1
C29A	1
C29B	1
C29C	1
C29D	1
C29E	1
C29F	1
C2A0	1
CC80	1
CC81	1
CC82	1
CC83	1
CC84	1
CC85	1
CC86	1
CC87	1
CC88	1
CC89	1
CC8A	1
CC8B	1
CC8C	1
CC8D	1
CC8E	1
CC8F	1
CC90	1
CC91	1
CC92	1
CC93	1
CC94	1
CC95	1
CC96	1
CC97	1
CC98	1
CC99	1
CC9A	1
CC9B	1
CC9C	1
CC9D	1
CC9E	1
CC9F	1
CCA0	1
CCA1	1
CCA2	1
CCA3	1
CCA4	1
CCA5	1
CCA6	1
CCA7	1
CCA8	1
CCA9	1
CCAA	1
CCAB	1
CCAC	1
CCAD	1
CCAE	1
CCAF	1
CCB0	1
CCB1	1
CCB2	1
CCB3	1
CCB4	1
CCB5	1
CCB6	1
CCB7	1
CCB8	1
CCB9	1
CCBA	1
CCBB	1
CCBC	1
CCBD	1
CCBE	1
CCBF	1
CD80	1
CD81	1
CD82	1
CD83	1
CD84	1
CD85	1
CD86	1
CD87	1
CD88	1
CD89	1
CD8A	1
CD8B	1
CD8C	1
CD8D	1
CD8E	1
CD8F	1
CD90	1
CD91	1
CD92	1
CD93	1
CD94	1
CD95	1
CD96	1
CD97	1
CD9D	1
CD9E	1
CD9F	1
CDA0	1
CDA1	1
CDA2	1
D283	1
D284	1
D285	1
D286	1
D288	1
D289	1
D691	1
D692	1
D693	1
D694	1
D695	1
D696	1
D697	1
D698	1
D699	1
D69A	1
D69B	1
D69C	1
D69D	1
D69E	1
D69F	1
D6A0	1
D6A1	1
D6A3	1
D6A4	1
D6A5	1
D6A6	1
D6A7	1
D6A8	1
D6A9	1
D6AA	1
D6AB	1
D6AC	1
D6AD	1
D6AE	1
D6AF	1
D6B0	1
D6B1	1
D6B2	1
D6B3	1
D6B4	1
D6B5	1
D6B6	1
D6B7	1
D6B8	1
D6B9	1
D6BB	1
D6BC	1
D6BD	1
D6BF	1
D781	1
D782	1
D784	1
D880	1
D881	1
D882	1
D883	1
D890	1
D891	1
D892	1
D893	1
D894	1
D895	1
D98B	1
D98C	1
D98D	1
D98E	1
D98F	1
D990	1
D991	1
D992	1
D993	1
D994	1
D995	1
D996	1
D997	1
D998	1
D9B0	1
DB96	1
DB97	1
DB98	1
DB99	1
DB9A	1
DB9B	1
DB9C	1
DB9D	1
DB9E	1
DB9F	1
DBA0	1
DBA1	1
DBA2	1
DBA3	1
DBA4	1
DBA7	1
DBA8	1
DBAA	1
DBAB	1
DBAC	1
DBAD	1
DC8F	1
DC91	1
DCB0	1
DCB1	1
DCB2	1
DCB3	1
DCB4	1
DCB5	1
DCB6	1
DCB7	1
DCB8	1
DCB9	1
DCBA	1
DCBB	1
DCBC	1
DCBD	1
DCBE	1
DCBF	1
DD80	1
DD81	1
DD82	1
DD83	1
DD84	1
DD85	1
DD86	1
DD87	1
DD88	1
DD89	1
DD8A	1
D980	1
60	1
C2B4	1
CE84	1
CB9C	1
5E	1
C2AF	1
CB98	1
CB99	1
C2A8	1
CE85	1
CB9A	1
CB9D	1
C2B8	1
CB9B	1
5F	1
C2AD	1
2D	1
D68A	1
2C	1
D59D	1
D88C	1
D88D	1
D9AB	1
D9AC	1
3B	1
CDBE	1
D89B	1
3A	1
D689	1
DC83	1
DC84	1
DC85	1
DC86	1
DC87	1
DC88	1
21	1
C2A1	1
D59C	1
3F	1
C2BF	1
D59E	1
D89F	1
DC89	1
2E	1
DB94	1
DC81	1
DC82	1
C2B7	1
CE87	1
DC80	1
27	1
22	1
C2AB	1
C2BB	1
28	1
29	1
5B	1
7B	1
7D	1
C2A7	1
C2B6	1
C2A9	1
C2AE	1
40	1
2A	1
D9AD	1
2F	1
26	1
23	1
25	1
D9AA	1
D59A	1
D59B	1
D59F	1
D6BE	1
D780	1
D783	1
D7B3	1
D7B4	1
DC8A	1
DC8B	1
DC8C	1
DC8D	1
CAB9	1
CDB4	1
CDB5	1
CABA	1
CB82	1
CB83	1
CB84	1
CB85	1
CB86	1
CB87	1
CB88	1
CB89	1
CB8A	1
CB8B	1
CB8C	1
CB8D	1
CB8E	1
CB8F	1
CB92	1
CB93	1
CB94	1
CB95	1
CB96	1
CB97	1
CB9E	1
CB9F	1
CBA5	1
CBA6	1
CBA7	1
CBA8	1
CBA9	1
CBAA	1
CBAB	1
CBAC	1
CBAD	1
CBAF	1
CBB0	1
CBB1	1
CBB2	1
CBB3	1
CBB4	1
CBB5	1
CBB6	1
CBB7	1
CBB8	1
CBB9	1
CBBA	1
CBBB	1
CBBC	1
CBBD	1
CBBE	1
CBBF	1
C2B0	1
D282	1
D88E	1
D88F	1
DBA9	1
CFB6	1
2B	1
C2B1	1
C3B7	1
C397	1
3C	1
3D	1
3E	1
C2AC	1
7C	1
C2A6	1
7E	1
CB90	1
CB91	1
C2A4	1
C2A2	1
24	1
C2A3	1
C2A5	1
30	1
D9A0	1
DBB0	1
31	1
C2B9	1
D9A1	1
DBB1	1
C2BD	1
C2BC	1
32	1
C2B2	1
D9A2	1
DBB2	1
33	1
C2B3	1
D9A3	1
DBB3	1
C2BE	1
34	1
D9A4	1
DBB4	1
35	1
D9A5	1
DBB5	1
36	1
D9A6	1
DBB6	1
37	1
D9A7	1
DBB7	1
38	1
D9A8	1
DBB8	1
39	1
D9A9	1
DBB9	1
41	1
61	1
C2AA	1
C380	1
C381	1
C382	1
C383	1
C384	1
C385	1
C3A0	1
C3A1	1
C3A2	1
C3A3	1
C3A4	1
C3A5	1
C480	1
C481	1
C482	1
C483	1
C484	1
C485	1
C78D	1
C78E	1
C79E	1
C79F	1
C7A0	1
C7A1	1
C7BA	1
C7BB	1
C880	1
C881	1
C882	1
C883	1
C8A6	1
C8A7	1
CDA3	1
C386	1
C3A6	1
C7A2	1
C7A3	1
C7BC	1
C7BD	1
C990	1
C991	1
C992	1
42	1
62	1
CA99	1
C680	1
C681	1
C993	1
C682	1
C683	1
43	1
63	1
C387	1
C3A7	1
C486	1
C487	1
C488	1
C489	1
C48A	1
C48B	1
C48C	1
C48D	1
CDA8	1
C687	1
C688	1
C995	1
44	1
64	1
C48E	1
C48F	1
CDA9	1
C784	1
C785	1
C786	1
C7B1	1
C7B2	1
C7B3	1
CAA3	1
CAA5	1
CAA4	1
C490	1
C491	1
C689	1
C996	1
C68A	1
C997	1
C68B	1
C68C	1
C8A1	1
C390	1
C3B0	1
45	1
65	1
C388	1
C389	1
C38A	1
C38B	1
C3A8	1
C3A9	1
C3AA	1
C3AB	1
C492	1
C493	1
C494	1
C495	1
C496	1
C497	1
C498	1
C499	1
C49A	1
C49B	1
C884	1
C885	1
C886	1
C887	1
C8A8	1
C8A9	1
CDA4	1
C68E	1
C79D	1
C68F	1
C999	1
C690	1
C99B	1
C998	1
C99A	1
C99C	1
C99D	1
C99E	1
CA9A	1
C9A4	1
46	1
66	1
CAA9	1
C691	1
C692	1
47	1
67	1
C49C	1
C49D	1
C49E	1
C49F	1
C4A0	1
C4A1	1
C4A2	1
C4A3	1
C7A6	1
C7A7	1
C7B4	1
C7B5	1
C9A1	1
C9A2	1
C7A4	1
C7A5	1
C693	1
C9A0	1
CA9B	1
C694	1
C9A3	1
CBA0	1
C6A2	1
C6A3	1
48	1
68	1
C4A4	1
C4A5	1
C89E	1
C89F	1
CAB0	1
CDAA	1
CA9C	1
C695	1
C7B6	1
C4A6	1
C4A7	1
C9A6	1
CAB1	1
C9A7	1
CABB	1
CABD	1
49	1
69	1
C38C	1
C38D	1
C38E	1
C38F	1
C3AC	1
C3AD	1
C3AE	1
C3AF	1
C4A8	1
C4A9	1
C4AA	1
C4AB	1
C4AC	1
C4AD	1
C4AE	1
C4AF	1
C4B0	1
C78F	1
C790	1
C888	1
C889	1
C88A	1
C88B	1
CDA5	1
C4B2	1
C4B3	1
C4B1	1
C9AA	1
C697	1
C9A8	1
C696	1
C9A9	1
4A	1
6A	1
C4B4	1
C4B5	1
C7B0	1
CAB2	1
CA9D	1
C99F	1
CA84	1
4B	1
6B	1
C4B6	1
C4B7	1
C7A8	1
C7A9	1
C698	1
C699	1
CA9E	1
4C	1
6C	1
C4B9	1
C4BA	1
C4BB	1
C4BC	1
C4BD	1
C4BE	1
CBA1	1
C4BF	1
C580	1
C787	1
C788	1
C789	1
CAAA	1
CAAB	1
CA9F	1
C581	1
C582	1
C69A	1
C9AB	1
C9AC	1
C9AD	1
C8B4	1
C9AE	1
C69B	1
CA8E	1
4D	1
6D	1
CDAB	1
C9B1	1
4E	1
6E	1
C583	1
C584	1
C585	1
C586	1
C587	1
C588	1
C7B8	1
C7B9	1
C78A	1
C78B	1
C78C	1
C391	1
C3B1	1
C9B4	1
C69D	1
C9B2	1
C69E	1
C8A0	1
C9B3	1
C8B5	1
C58A	1
C58B	1
4F	1
6F	1
C2BA	1
C392	1
C393	1
C394	1
C395	1
C396	1
C3B2	1
C3B3	1
C3B4	1
C3B5	1
C3B6	1
C58C	1
C58D	1
C58E	1
C58F	1
C590	1
C591	1
C6A0	1
C6A1	1
C791	1
C792	1
C7AA	1
C7AB	1
C7AC	1
C7AD	1
C88C	1
C88D	1
C88E	1
C88F	1
C8AA	1
C8AB	1
C8AC	1
C8AD	1
C8AE	1
C8AF	1
C8B0	1
C8B1	1
CDA6	1
C592	1
C593	1
C9B6	1
C398	1
C3B8	1
C7BE	1
C7BF	1
C686	1
C994	1
C69F	1
C9B5	1
C9B7	1
C8A2	1
C8A3	1
50	1
70	1
C6A4	1
C6A5	1
C9B8	1
51	1
71	1
CAA0	1
C4B8	1
52	1
72	1
C594	1
C595	1
C596	1
C597	1
C598	1
C599	1
C890	1
C891	1
C892	1
C893	1
CAB3	1
CDAC	1
C6A6	1
CA80	1
C9B9	1
CAB4	1
C9BA	1
C9BB	1
CAB5	1
C9BC	1
C9BD	1
C9BE	1
C9BF	1
CA81	1
CAB6	1
53	1
73	1
C59A	1
C59B	1
C59C	1
C59D	1
C59E	1
C59F	1
C5A0	1
C5A1	1
C5BF	1
C898	1
C899	1
CBA2	1
C39F	1
CA82	1
C6A9	1
CA83	1
C6AA	1
CA85	1
CA86	1
54	1
74	1
C5A2	1
C5A3	1
C5A4	1
C5A5	1
C89A	1
C89B	1
CDAD	1
CAA8	1
C6BE	1
CAA6	1
CAA7	1
C5A6	1
C5A7	1
C6AB	1
C6AC	1
C6AD	1
C6AE	1
CA88	1
C8B6	1
CA87	1
55	1
75	1
C399	1
C39A	1
C39B	1
C39C	1
C3B9	1
C3BA	1
C3BB	1
C3BC	1
C5A8	1
C5A9	1
C5AA	1
C5AB	1
C5AC	1
C5AD	1
C5AE	1
C5AF	1
C5B0	1
C5B1	1
C5B2	1
C5B3	1
C6AF	1
C6B0	1
C793	1
C794	1
C795	1
C796	1
C797	1
C798	1
C799	1
C79A	1
C79B	1
C79C	1
C894	1
C895	1
C896	1
C897	1
CDA7	1
CA89	1
C9A5	1
CAAE	1
CAAF	1
C69C	1
C9AF	1
C9B0	1
C6B1	1
CA8A	1
56	1
76	1
CDAE	1
C6B2	1
CA8B	1
CA8C	1
57	1
77	1
C5B4	1
C5B5	1
CAB7	1
CA8D	1
58	1
78	1
CBA3	1
CDAF	1
59	1
79	1
C39D	1
C3BD	1
C3BF	1
C5B6	1
C5B7	1
C5B8	1
C8B2	1
C8B3	1
CAB8	1
CA8F	1
C6B3	1
C6B4	1
5A	1
7A	1
C5B9	1
C5BA	1
C5BB	1
C5BC	1
C5BD	1
C5BE	1
C68D	1
C6B5	1
C6B6	1
C8A4	1
C8A5	1
CA90	1
CA91	1
C6B7	1
C7AE	1
C7AF	1
CA92	1
C6B8	1
C6B9	1
C6BA	1
CA93	1
C89C	1
C89D	1
C39E	1
C3BE	1
C6BF	1
C7B7	1
C6BB	1
C6A7	1
C6A8	1
C6BC	1
C6BD	1
C684	1
C685	1
CA94	1
CB80	1
CABC	1
C589	1
CBAE	1
CABE	1
CA95	1
CBA4	1
CABF	1
CB81	1
CAA1	1
CAA2	1
CA96	1
C780	1
C781	1
C782	1
C783	1
CA97	1
CA98	1
CAAC	1
CAAD	1
CE86	1
CE91	1
CEAC	1
CEB1	1
CE92	1
CEB2	1
CF90	1
CE93	1
CEB3	1
CE94	1
CEB4	1
CE88	1
CE95	1
CEAD	1
CEB5	1
CFB5	1
CF9C	1
CF9D	1
CF9A	1
CF9B	1
CE96	1
CEB6	1
CE89	1
CE97	1
CEAE	1
CEB7	1
CE98	1
CEB8	1
CF91	1
CFB4	1
CDBA	1
CE8A	1
CE90	1
CE99	1
CEAA	1
CEAF	1
CEB9	1
CF8A	1
CFB3	1
CE9A	1
CEBA	1
CFB0	1
CF97	1
CE9B	1
CEBB	1
C2B5	1
CE9C	1
CEBC	1
CE9D	1
CEBD	1
CE9E	1
CEBE	1
CE8C	1
CE9F	1
CEBF	1
CF8C	1
CEA0	1
CF80	1
CF96	1
CF9E	1
CF9F	1
CF98	1
CF99	1
CEA1	1
CF81	1
CFB1	1
CEA3	1
CF82	1
CF83	1
CFB2	1
CFB9	1
CEA4	1
CF84	1
CE8E	1
CEA5	1
CEAB	1
CEB0	1
CF85	1
CF8B	1
CF8D	1
CF92	1
CF93	1
CF94	1
CEA6	1
CF86	1
CF95	1
CEA7	1
CF87	1
CEA8	1
CF88	1
CE8F	1
CEA9	1
CF89	1
CF8E	1
CFA0	1
CFA1	1
CFB7	1
CFB8	1
CFBA	1
CFBB	1
CFA2	1
CFA3	1
CFA4	1
CFA5	1
CFA6	1
CFA7	1
CFA8	1
CFA9	1
CFAA	1
CFAB	1
CFAC	1
CFAD	1
CFAE	1
CFAF	1
D090	1
D0B0	1
D390	1
D391	1
D392	1
D393	1
D398	1
D399	1
D39A	1
D39B	1
D394	1
D395	1
D091	1
D0B1	1
D092	1
D0B2	1
D093	1
D0B3	1
D290	1
D291	1
D292	1
D293	1
D294	1
D295	1
D094	1
D0B4	1
D480	1
D481	1
D082	1
D192	1
D482	1
D483	1
D083	1
D193	1
D298	1
D299	1
D080	1
D081	1
D095	1
D0B5	1
D190	1
D191	1
D396	1
D397	1
D084	1
D194	1
D096	1
D0B6	1
D381	1
D382	1
D39C	1
D39D	1
D296	1
D297	1
D097	1
D0B7	1
D484	1
D485	1
D39E	1
D39F	1
D085	1
D195	1
D3A0	1
D3A1	1
D486	1
D487	1
D08D	1
D098	1
D0B8	1
D19D	1
D3A2	1
D3A3	1
D28A	1
D28B	1
D3A4	1
D3A5	1
D086	1
D196	1
D087	1
D197	1
D099	1
D0B9	1
D088	1
D198	1
D09A	1
D0BA	1
D29A	1
D29B	1
D383	1
D384	1
D2A0	1
D2A1	1
D29E	1
D29F	1
D29C	1
D29D	1
D09B	1
D0BB	1
D385	1
D386	1
D089	1
D199	1
D488	1
D489	1
D09C	1
D0BC	1
D38D	1
D38E	1
D09D	1
D0BD	1
D389	1
D38A	1
D2A2	1
D2A3	1
D387	1
D388	1
D2A4	1
D2A5	1
D08A	1
D19A	1
D48A	1
D48B	1
D09E	1
D0BE	1
D3A6	1
D3A7	1
D3A8	1
D3A9	1
D3AA	1
D3AB	1
D09F	1
D0BF	1
D2A6	1
D2A7	1
D280	1
D281	1
D0A0	1
D180	1
D28E	1
D28F	1
D0A1	1
D181	1
D48C	1
D48D	1
D2AA	1
D2AB	1
D0A2	1
D182	1
D48E	1
D48F	1
D2AC	1
D2AD	1
D08B	1
D19B	1
D08C	1
D19C	1
D0A3	1
D183	1
D3AE	1
D3AF	1
D08E	1
D19E	1
D3B0	1
D3B1	1
D3B2	1
D3B3	1
D2AE	1
D2AF	1
D2B0	1
D2B1	1
D1B8	1
D1B9	1
D0A4	1
D184	1
D0A5	1
D185	1
D2B2	1
D2B3	1
D2BA	1
D2BB	1
D1A0	1
D1A1	1
D1BE	1
D1BF	1
D1BC	1
D1BD	1
D1BA	1
D1BB	1
D0A6	1
D186	1
D2B4	1
D2B5	1
D0A7	1
D187	1
D3B4	1
D3B5	1
D2B6	1
D2B7	1
D38B	1
D38C	1
D2B8	1
D2B9	1
D2BC	1
D2BD	1
D2BE	1
D2BF	1
D08F	1
D19F	1
D0A8	1
D188	1
D0A9	1
D189	1
D0AA	1
D18A	1
D0AB	1
D18B	1
D3B8	1
D3B9	1
D0AC	1
D18C	1
D28C	1
D28D	1
D1A2	1
D1A3	1
D0AD	1
D18D	1
D3AC	1
D3AD	1
D0AE	1
D18E	1
D0AF	1
D18F	1
D1A4	1
D1A5	1
D1A6	1
D1A7	1
D1AA	1
D1AB	1
D1A8	1
D1A9	1
D1AC	1
D1AD	1
D1AE	1
D1AF	1
D1B0	1
D1B1	1
D1B2	1
D1B3	1
D1B4	1
D1B5	1
D1B6	1
D1B7	1
D2A8	1
D2A9	1
D380	1
D4B1	1
D5A1	1
D4B2	1
D5A2	1
D4B3	1
D5A3	1
D4B4	1
D5A4	1
D4B5	1
D5A5	1
D687	1
D4B6	1
D5A6	1
D4B7	1
D5A7	1
D4B8	1
D5A8	1
D4B9	1
D5A9	1
D4BA	1
D5AA	1
D4BB	1
D5AB	1
D4BC	1
D5AC	1
D4BD	1
D5AD	1
D4BE	1
D5AE	1
D4BF	1
D5AF	1
D580	1
D5B0	1
D581	1
D5B1	1
D582	1
D5B2	1
D583	1
D5B3	1
D584	1
D5B4	1
D585	1
D5B5	1
D586	1
D5B6	1
D587	1
D5B7	1
D588	1
D5B8	1
D589	1
D5B9	1
D58A	1
D5BA	1
D58B	1
D5BB	1
D58C	1
D5BC	1
D58D	1
D5BD	1
D58E	1
D5BE	1
D58F	1
D5BF	1
D590	1
D680	1
D591	1
D681	1
D592	1
D682	1
D593	1
D683	1
D594	1
D684	1
D595	1
D685	1
D596	1
D686	1
D599	1
D790	1
D791	1
D792	1
D793	1
D794	1
D795	1
D7B0	1
D7B1	1
D796	1
D797	1
D798	1
D799	1
D7B2	1
D79A	1
D79B	1
D79C	1
D79D	1
D79E	1
D79F	1
D7A0	1
D7A1	1
D7A2	1
D7A3	1
D7A4	1
D7A5	1
D7A6	1
D7A7	1
D7A8	1
D7A9	1
D7AA	1
D8A1	1
D9B4	1
DBBD	1
D8A2	1
D8A3	1
D9B2	1
D9B1	1
D8A4	1
D8A5	1
D9B3	1
D8A6	1
D8A7	1
D9B5	1
D9AE	1
D8A8	1
D9BB	1
D9BE	1
DA80	1
D8A9	1
D8AA	1
D8AB	1
D9B9	1
D9BA	1
D9BC	1
D9BD	1
D9BF	1
D8AC	1
DA83	1
DA84	1
DA86	1
DABF	1
DA87	1
D8AD	1
D8AE	1
DA81	1
DA82	1
DA85	1
D8AF	1
D8B0	1
DA88	1
DA89	1
DA8A	1
DA8B	1
DA8C	1
DA8D	1
DA8E	1
DA8F	1
DA90	1
DBAE	1
D8B1	1
D8B2	1
DA91	1
DA92	1
DA93	1
DA94	1
DA95	1
DA96	1
DA97	1
DA98	1
DA99	1
DBAF	1
D8B3	1
D8B4	1
DA9A	1
DA9B	1
DA9C	1
DBBA	1
D8B5	1
D8B6	1
DA9D	1
DA9E	1
DBBB	1
D8B7	1
D8B8	1
DA9F	1
D8B9	1
D8BA	1
DAA0	1
DBBC	1
D981	1
DAA1	1
DAA2	1
DAA3	1
DAA4	1
DAA5	1
DAA6	1
D9AF	1
D982	1
DAA7	1
DAA8	1
D983	1
DAA9	1
DAAA	1
DAAB	1
DAAC	1
DAAD	1
DAAE	1
DAAF	1
DAB0	1
DAB1	1
DAB2	1
DAB3	1
DAB4	1
D984	1
DAB5	1
DAB6	1
DAB7	1
DAB8	1
D985	1
DBBE	1
D986	1
DABA	1
DABB	1
DABC	1
DABD	1
DAB9	1
D987	1
DABE	1
DB81	1
DB82	1
DB83	1
DBBF	1
DB80	1
DB95	1
D988	1
DBA5	1
D9B6	1
DB84	1
DB85	1
DB86	1
DB87	1
D9B7	1
DB88	1
DB89	1
DB8A	1
DB8B	1
DB8F	1
D989	1
D98A	1
DBA6	1
D9B8	1
DB8C	1
DB8D	1
DB8E	1
DB90	1
DB91	1
DB92	1
DB93	1
DC90	1
DC92	1
DCAD	1
DC93	1
DC94	1
DCAE	1
DC96	1
DC95	1
DCAF	1
DC97	1
DC98	1
DC99	1
DD8D	1
DC9A	1
DC9B	1
DC9C	1
DC9D	1
DC9E	1
DC9F	1
DD8E	1
DCA0	1
DCA1	1
DCA2	1
DCA3	1
DCA4	1
DCA5	1
DCA6	1
DCA7	1
DD8F	1
DCA8	1
DCA9	1
DCAA	1
DCAB	1
DCAC	1
DE80	1
DE99	1
DE9A	1
DE81	1
DE82	1
DE83	1
DE9C	1
DE84	1
DE85	1
DE86	1
DE87	1
DEA2	1
DEA3	1
DE88	1
DEA5	1
DE89	1
DE8A	1
DE8B	1
DE9B	1
DE8C	1
DE98	1
DEA0	1
DEA1	1
DE8D	1
DE8E	1
DEA4	1
DE8F	1
DE90	1
DE9D	1
DE9E	1
DE9F	1
DE91	1
DE92	1
DE93	1
DE94	1
DE95	1
DE96	1
DE97	1
DEB1	1
DEA6	1
DEA7	1
DEA8	1
DEA9	1
DEAA	1
DEAB	1
DEAC	1
DEAD	1
DEAE	1
DEAF	1
DEB0	1
E4B880	1
E4B881	1
E4B882	1
E4B883	1
E4B884	1
E4B885	1
E4B886	1
E4B887	1
E4B888	1
E4B889	1
E4B88A	1
E4B88B	1
E4B88C	1
E4B88D	1
E4B88E	1
E4B88F	1
E4B890	1
E4B891	1
E4B892	1
E4B893	1
E4B894	1
E4B895	1
E4B896	1
E4B897	1
E4B898	1
E4B899	1
E4B89A	1
E4B89B	1
E4B89C	1
E4B89D	1
E4B89E	1
E4B89F	1
E4B8A0	1
E4B8A1	1
E4B8A2	1
E4B8A3	1
E4B8A4	1
E4B8A5	1
E4B8A6	1
E4B8A7	1
E4B8A8	1
E4B8A9	1
E4B8AA	1
E4B8AB	1
E4B8AC	1
E4B8AD	1
E4B8AE	1
E4B8AF	1
E4B8B0	1
E4B8B1	1
E4B8B2	1
E4B8B3	1
E4B8B4	1
E4B8B5	1
E4B8B6	1
E4B8B7	1
E4B8B8	1
E4B8B9	1
E4B8BA	1
E4B8BB	1
E4B8BC	1
E4B8BD	1
E4B8BE	1
E4B8BF	1
E4B980	1
E4B981	1
E4B982	1
E4B983	1
E4B984	1
E4B985	1
E4B986	1
E4B987	1
E4B988	1
E4B989	1
E4B98A	1
E4B98B	1
E4B98C	1
E4B98D	1
E4B98E	1
E4B98F	1
E4B990	1
E4B991	1
E4B992	1
E4B993	1
E4B994	1
E4B995	1
E4B996	1
E4B997	1
E4B998	1
E4B999	1
E4B99A	1
E4B99B	1
E4B99C	1
E4B99D	1
E4B99E	1
E4B99F	1
E4B9A0	1
E4B9A1	1
E4B9A2	1
E4B9A3	1
E4B9A4	1
E4B9A5	1
E4B9A6	1
E4B9A7	1
E4B9A8	1
E4B9A9	1
E4B9AA	1
E4B9AB	1
E4B9AC	1
E4B9AD	1
E4B9AE	1
E4B9AF	1
E4B9B0	1
E4B9B1	1
E4B9B2	1
E4B9B3	1
E4B9B4	1
E4B9B5	1
E4B9B6	1
E4B9B7	1
E4B9B8	1
E4B9B9	1
E4B9BA	1
E4B9BB	1
E4B9BC	1
E4B9BD	1
E4B9BE	1
E4B9BF	1
E4BA80	1
E4BA81	1
E4BA82	1
E4BA83	1
E4BA84	1
E4BA85	1
E4BA86	1
E4BA87	1
E4BA88	1
E4BA89	1
E4BA8A	1
E4BA8B	1
E4BA8C	1
E4BA8D	1
E4BA8E	1
E4BA8F	1
E4BA90	1
E4BA91	1
E4BA92	1
E4BA93	1
E4BA94	1
E4BA95	1
E4BA96	1
E4BA97	1
E4BA98	1
E4BA99	1
E4BA9A	1
E4BA9B	1
E4BA9C	1
E4BA9D	1
E4BA9E	1
E4BA9F	1
E4BAA0	1
E4BAA1	1
E4BAA2	1
E4BAA3	1
E4BAA4	1
E4BAA5	1
E4BAA6	1
E4BAA7	1
E4BAA8	1
E4BAA9	1
E4BAAA	1
E4BAAB	1
E4BAAC	1
E4BAAD	1
E4BAAE	1
E4BAAF	1
E4BAB0	1
E4BAB1	1
E4BAB2	1
E4BAB3	1
E4BAB4	1
E4BAB5	1
E4BAB6	1
E4BAB7	1
E4BAB8	1
E4BAB9	1
E4BABA	1
E4BABB	1
E4BABC	1
E4BABD	1
E4BABE	1
E4BABF	1
E4BB80	1
E4BB81	1
E4BB82	1
E4BB83	1
E4BB84	1
E4BB85	1
E4BB86	1
E4BB87	1
E4BB88	1
E4BB89	1
E4BB8A	1
E4BB8B	1
E4BB8C	1
E4BB8D	1
E4BB8E	1
E4BB8F	1
E4BB90	1
E4BB91	1
E4BB92	1
E4BB93	1
E4BB94	1
E4BB95	1
E4BB96	1
E4BB97	1
E4BB98	1
E4BB99	1
E4BB9A	1
E4BB9B	1
E4BB9C	1
E4BB9D	1
E4BB9E	1
E4BB9F	1
E4BBA0	1
E4BBA1	1
E4BBA2	1
E4BBA3	1
E4BBA4	1
E4BBA5	1
E4BBA6	1
E4BBA7	1
E4BBA8	1
E4BBA9	1
E4BBAA	1
E4BBAB	1
E4BBAC	1
E4BBAD	1
E4BBAE	1
E4BBAF	1
E4BBB0	1
E4BBB1	1
E4BBB2	1
E4BBB3	1
E4BBB4	1
E4BBB5	1
E4BBB6	1
E4BBB7	1
E4BBB8	1
E4BBB9	1
E4BBBA	1
E4BBBB	1
E4BBBC	1
E4BBBD	1
E4BBBE	1
E4BBBF	1
E4BC80	1
E4BC81	1
E4BC82	1
E4BC83	1
E4BC84	1
E4BC85	1
E4BC86	1
E4BC87	1
E4BC88	1
E4BC89	1
E4BC8A	1
E4BC8B	1
E4BC8C	1
E4BC8D	1
E4BC8E	1
E4BC8F	1
E4BC90	1
E4BC91	1
E4BC92	1
E4BC93	1
E4BC94	1
E4BC95	1
E4BC96	1
E4BC97	1
E4BC98	1
E4BC99	1
E4BC9A	1
E4BC9B	1
E4BC9C	1
E4BC9D	1
E4BC9E	1
E4BC9F	1
E4BCA0	1
E4BCA1	1
E4BCA2	1
E4BCA3	1
E4BCA4	1
E4BCA5	1
E4BCA6	1
E4BCA7	1
E4BCA8	1
E4BCA9	1
E4BCAA	1
E4BCAB	1
E4BCAC	1
E4BCAD	1
E4BCAE	1
E4BCAF	1
E4BCB0	1
E4BCB1	1
E4BCB2	1
E4BCB3	1
E4BCB4	1
E4BCB5	1
E4BCB6	1
E4BCB7	1
E4BCB8	1
E4BCB9	1
E4BCBA	1
E4BCBB	1
E4BCBC	1
E4BCBD	1
E4BCBE	1
E4BCBF	1
E4BD80	1
E4BD81	1
E4BD82	1
E4BD83	1
E4BD84	1
E4BD85	1
E4BD86	1
E4BD87	1
E4BD88	1
E4BD89	1
E4BD8A	1
E4BD8B	1
E4BD8C	1
E4BD8D	1
E4BD8E	1
E4BD8F	1
E4BD90	1
E4BD91	1
E4BD92	1
E4BD93	1
E4BD94	1
E4BD95	1
E4BD96	1
E4BD97	1
E4BD98	1
E4BD99	1
E4BD9A	1
E4BD9B	1
E4BD9C	1
E4BD9D	1
E4BD9E	1
E4BD9F	1
E4BDA0	1
E4BDA1	1
E4BDA2	1
E4BDA3	1
E4BDA4	1
E4BDA5	1
E4BDA6	1
E4BDA7	1
E4BDA8	1
E4BDA9	1
E4BDAA	1
E4BDAB	1
E4BDAC	1
E4BDAD	1
E4BDAE	1
E4BDAF	1
E4BDB0	1
E4BDB1	1
E4BDB2	1
E4BDB3	1
E4BDB4	1
E4BDB5	1
E4BDB6	1
E4BDB7	1
E4BDB8	1
E4BDB9	1
E4BDBA	1
E4BDBB	1
E4BDBC	1
E4BDBD	1
E4BDBE	1
E4BDBF	1
E4BE80	1
E4BE81	1
E4BE82	1
E4BE83	1
E4BE84	1
E4BE85	1
E4BE86	1
E4BE87	1
E4BE88	1
E4BE89	1
E4BE8A	1
E4BE8B	1
E4BE8C	1
E4BE8D	1
E4BE8E	1
E4BE8F	1
E4BE90	1
E4BE91	1
E4BE92	1
E4BE93	1
E4BE94	1
E4BE95	1
E4BE96	1
E4BE97	1
E4BE98	1
E4BE99	1
E4BE9A	1
E4BE9B	1
E4BE9C	1
E4BE9D	1
E4BE9E	1
E4BE9F	1
E4BEA0	1
E4BEA1	1
E4BEA2	1
E4BEA3	1
E4BEA4	1
E4BEA5	1
E4BEA6	1
E4BEA7	1
E4BEA8	1
E4BEA9	1
E4BEAA	1
E4BEAB	1
E4BEAC	1
E4BEAD	1
E4BEAE	1
E4BEAF	1
E4BEB0	1
E4BEB1	1
E4BEB2	1
E4BEB3	1
E4BEB4	1
E4BEB5	1
E4BEB6	1
E4BEB7	1
E4BEB8	1
E4BEB9	1
E4BEBA	1
E4BEBB	1
E4BEBC	1
E4BEBD	1
E4BEBE	1
E4BEBF	1
E4BF80	1
E4BF81	1
E4BF82	1
E4BF83	1
E4BF84	1
E4BF85	1
E4BF86	1
E4BF87	1
E4BF88	1
E4BF89	1
E4BF8A	1
E4BF8B	1
E4BF8C	1
E4BF8D	1
E4BF8E	1
E4BF8F	1
E4BF90	1
E4BF91	1
E4BF92	1
E4BF93	1
E4BF94	1
E4BF95	1
E4BF96	1
E4BF97	1
E4BF98	1
E4BF99	1
E4BF9A	1
E4BF9B	1
E4BF9C	1
E4BF9D	1
E4BF9E	1
E4BF9F	1
E4BFA0	1
E4BFA1	1
E4BFA2	1
E4BFA3	1
E4BFA4	1
E4BFA5	1
E4BFA6	1
E4BFA7	1
E4BFA8	1
E4BFA9	1
E4BFAA	1
E4BFAB	1
E4BFAC	1
E4BFAD	1
E4BFAE	1
E4BFAF	1
E4BFB0	1
E4BFB1	1
E4BFB2	1
E4BFB3	1
E4BFB4	1
E4BFB5	1
E4BFB6	1
E4BFB7	1
E4BFB8	1
E4BFB9	1
E4BFBA	1
E4BFBB	1
E4BFBC	1
E4BFBD	1
E4BFBE	1
E4BFBF	1
C8B7	1
C8B8	1
C8B9	1
C8BA	1
C8BB	1
C8BC	1
C8BD	1
C8BE	1
C8BF	1
C980	1
C981	1
C982	1
C983	1
C984	1
C985	1
C986	1
C987	1
C988	1
C989	1
C98A	1
C98B	1
C98C	1
C98D	1
C98E	1
C98F	1
CD98	1
CD99	1
CD9A	1
CD9B	1
CD9C	1
CDB0	1
CDB1	1
CDB2	1
CDB3	1
CDB6	1
CDB7	1
CDB8	1
CDB9	1
CDBB	1
CDBC	1
CDBD	1
CDBF	1
CE80	1
CE81	1
CE82	1
CE83	1
CE8B	1
CE8D	1
CEA2	1
CF8F	1
CFBC	1
CFBD	1
CFBE	1
CFBF	1
D287	1
D38F	1
D3B6	1
D3B7	1
D3BA	1
D3BB	1
D3BC	1
D3BD	1
D3BE	1
D3BF	1
D490	1
D491	1
D492	1
D493	1
D494	1
D495	1
D496	1
D497	1
D498	1
D499	1
D49A	1
D49B	1
D49C	1
D49D	1
D49E	1
D49F	1
D4A0	1
D4A1	1
D4A2	1
D4A3	1
D4A4	1
D4A5	1
D4A6	1
D4A7	1
D4A8	1
D4A9	1
D4AA	1
D4AB	1
D4AC	1
D4AD	1
D4AE	1
D4AF	1
D4B0	1
D597	1
D598	1
D5A0	1
D688	1
D68B	1
D68C	1
D68D	1
D68E	1
D68F	1
D690	1
D6A2	1
D6BA	1
D785	1
D786	1
D787	1
D788	1
D789	1
D78A	1
D78B	1
D78C	1
D78D	1
D78E	1
D78F	1
D7AB	1
D7AC	1
D7AD	1
D7AE	1
D7AF	1
D7B5	1
D7B6	1
D7B7	1
D7B8	1
D7B9	1
D7BA	1
D7BB	1
D7BC	1
D7BD	1
D7BE	1
D7BF	1
D884	1
D885	1
D886	1
D887	1
D888	1
D889	1
D88A	1
D88B	1
D896	1
D897	1
D898	1
D899	1
D89A	1
D89C	1
D89D	1
D89E	1
D8A0	1
D8BB	1
D8BC	1
D8BD	1
D8BE	1
D8BF	1
D999	1
D99A	1
D99B	1
D99C	1
D99D	1
D99E	1
D99F	1
DC8E	1
DD8B	1
DD8C	1
DD90	1
DD91	1
DD92	1
DD93	1
DD94	1
DD95	1
DD96	1
DD97	1
DD98	1
DD99	1
DD9A	1
DD9B	1
DD9C	1
DD9D	1
DD9E	1
DD9F	1
DDA0	1
DDA1	1
DDA2	1
DDA3	1
DDA4	1
DDA5	1
DDA6	1
DDA7	1
DDA8	1
DDA9	1
DDAA	1
DDAB	1
DDAC	1
DDAD	1
DDAE	1
DDAF	1
DDB0	1
DDB1	1
DDB2	1
DDB3	1
DDB4	1
DDB5	1
DDB6	1
DDB7	1
DDB8	1
DDB9	1
DDBA	1
DDBB	1
DDBC	1
DDBD	1
DDBE	1
DDBF	1
DEB2	1
DEB3	1
DEB4	1
DEB5	1
DEB6	1
DEB7	1
DEB8	1
DEB9	1
DEBA	1
DEBB	1
DEBC	1
DEBD	1
DEBE	1
DEBF	1
DF80	1
DF81	1
DF82	1
DF83	1
DF84	1
DF85	1
DF86	1
DF87	1
DF88	1
DF89	1
DF8A	1
DF8B	1
DF8C	1
DF8D	1
DF8E	1
DF8F	1
DF90	1
DF91	1
DF92	1
DF93	1
DF94	1
DF95	1
DF96	1
DF97	1
DF98	1
DF99	1
DF9A	1
DF9B	1
DF9C	1
DF9D	1
DF9E	1
DF9F	1
DFA0	1
DFA1	1
DFA2	1
DFA3	1
DFA4	1
DFA5	1
DFA6	1
DFA7	1
DFA8	1
DFA9	1
DFAA	1
DFAB	1
DFAC	1
DFAD	1
DFAE	1
DFAF	1
DFB0	1
DFB1	1
DFB2	1
DFB3	1
DFB4	1
DFB5	1
DFB6	1
DFB7	1
DFB8	1
DFB9	1
DFBA	1
DFBB	1
DFBC	1
DFBD	1
DFBE	1
DFBF	1
DROP TABLE IF EXISTS test.t1;
DROP TABLE IF EXISTS test.t1;
DROP DATABASE test;
CREATE DATABASE test CHARACTER SET utf8mb3;
USE test;
CREATE TABLE test.t1 (a CHAR(4) CHARACTER SET utf8mb3 COLLATE utf8mb3_spanish_ci) ENGINE=MyISAM CHARACTER SET utf8mb3 COLLATE utf8mb3_spanish_ci;
Warnings:
Warning	1287	'utf8mb3' is deprecated and will be removed in a future release. Please use utf8mb4 instead
Warning	3778	'utf8mb3_spanish_ci' is a collation of the deprecated character set UTF8MB3. Please consider using UTF8MB4 with an appropriate collation instead.
Warning	1287	'utf8mb3' is deprecated and will be removed in a future release. Please use utf8mb4 instead
Warning	3778	'utf8mb3_spanish_ci' is a collation of the deprecated character set UTF8MB3. Please consider using UTF8MB4 with an appropriate collation instead.
SHOW TABLE STATUS LIKE 't1';
Name	Engine	Version	Row_format	Rows	Avg_row_length	Data_length	Max_data_length	Index_length	Data_free	Auto_increment	Create_time	Update_time	Check_time	Collation	Checksum	Create_options	Comment
t1	MyISAM	#	#	#	#	#	#	#	#	#	#	#	#	utf8mb3_spanish_ci	#	#	#
LOAD DATA INFILE 
'MYSQL_TEST_DIR/suite/funcs_2/data/charset_utf8.txt' INTO TABLE test.t1;
DELETE FROM test.t1 WHERE CHAR_LENGTH(a) <> 1;
SELECT HEX(ORD(a)) AS a_ord, CHAR_LENGTH(a) AS a_len FROM test.t1 ORDER BY a, ORD(a);
a_ord	a_len
C285	1
7F	1
C280	1
C281	1
C282	1
C283	1
C284	1
C286	1
C287	1
C288	1
C289	1
C28A	1
C28B	1
C28C	1
C28D	1
C28E	1
C28F	1
C290	1
C291	1
C292	1
C293	1
C294	1
C295	1
C296	1
C297	1
C298	1
C299	1
C29A	1
C29B	1
C29C	1
C29D	1
C29E	1
C29F	1
C2A0	1
CC80	1
CC81	1
CC82	1
CC83	1
CC84	1
CC85	1
CC86	1
CC87	1
CC88	1
CC89	1
CC8A	1
CC8B	1
CC8C	1
CC8D	1
CC8E	1
CC8F	1
CC90	1
CC91	1
CC92	1
CC93	1
CC94	1
CC95	1
CC96	1
CC97	1
CC98	1
CC99	1
CC9A	1
CC9B	1
CC9C	1
CC9D	1
CC9E	1
CC9F	1
CCA0	1
CCA1	1
CCA2	1
CCA3	1
CCA4	1
CCA5	1
CCA6	1
CCA7	1
CCA8	1
CCA9	1
CCAA	1
CCAB	1
CCAC	1
CCAD	1
CCAE	1
CCAF	1
CCB0	1
CCB1	1
CCB2	1
CCB3	1
CCB4	1
CCB5	1
CCB6	1
CCB7	1
CCB8	1
CCB9	1
CCBA	1
CCBB	1
CCBC	1
CCBD	1
CCBE	1
CCBF	1
CD80	1
CD81	1
CD82	1
CD83	1
CD84	1
CD85	1
CD86	1
CD87	1
CD88	1
CD89	1
CD8A	1
CD8B	1
CD8C	1
CD8D	1
CD8E	1
CD8F	1
CD90	1
CD91	1
CD92	1
CD93	1
CD94	1
CD95	1
CD96	1
CD97	1
CD9D	1
CD9E	1
CD9F	1
CDA0	1
CDA1	1
CDA2	1
D283	1
D284	1
D285	1
D286	1
D288	1
D289	1
D691	1
D692	1
D693	1
D694	1
D695	1
D696	1
D697	1
D698	1
D699	1
D69A	1
D69B	1
D69C	1
D69D	1
D69E	1
D69F	1
D6A0	1
D6A1	1
D6A3	1
D6A4	1
D6A5	1
D6A6	1
D6A7	1
D6A8	1
D6A9	1
D6AA	1
D6AB	1
D6AC	1
D6AD	1
D6AE	1
D6AF	1
D6B0	1
D6B1	1
D6B2	1
D6B3	1
D6B4	1
D6B5	1
D6B6	1
D6B7	1
D6B8	1
D6B9	1
D6BB	1
D6BC	1
D6BD	1
D6BF	1
D781	1
D782	1
D784	1
D880	1
D881	1
D882	1
D883	1
D890	1
D891	1
D892	1
D893	1
D894	1
D895	1
D98B	1
D98C	1
D98D	1
D98E	1
D98F	1
D990	1
D991	1
D992	1
D993	1
D994	1
D995	1
D996	1
D997	1
D998	1
D9B0	1
DB96	1
DB97	1
DB98	1
DB99	1
DB9A	1
DB9B	1
DB9C	1
DB9D	1
DB9E	1
DB9F	1
DBA0	1
DBA1	1
DBA2	1
DBA3	1
DBA4	1
DBA7	1
DBA8	1
DBAA	1
DBAB	1
DBAC	1
DBAD	1
DC8F	1
DC91	1
DCB0	1
DCB1	1
DCB2	1
DCB3	1
DCB4	1
DCB5	1
DCB6	1
DCB7	1
DCB8	1
DCB9	1
DCBA	1
DCBB	1
DCBC	1
DCBD	1
DCBE	1
DCBF	1
DD80	1
DD81	1
DD82	1
DD83	1
DD84	1
DD85	1
DD86	1
DD87	1
DD88	1
DD89	1
DD8A	1
D980	1
60	1
C2B4	1
CE84	1
CB9C	1
5E	1
C2AF	1
CB98	1
CB99	1
C2A8	1
CE85	1
CB9A	1
CB9D	1
C2B8	1
CB9B	1
5F	1
C2AD	1
2D	1
D68A	1
2C	1
D59D	1
D88C	1
D88D	1
D9AB	1
D9AC	1
3B	1
CDBE	1
D89B	1
3A	1
D689	1
DC83	1
DC84	1
DC85	1
DC86	1
DC87	1
DC88	1
21	1
C2A1	1
D59C	1
3F	1
C2BF	1
D59E	1
D89F	1
DC89	1
2E	1
DB94	1
DC81	1
DC82	1
C2B7	1
CE87	1
DC80	1
27	1
22	1
C2AB	1
C2BB	1
28	1
29	1
5B	1
7B	1
7D	1
C2A7	1
C2B6	1
C2A9	1
C2AE	1
40	1
2A	1
D9AD	1
2F	1
26	1
23	1
25	1
D9AA	1
D59A	1
D59B	1
D59F	1
D6BE	1
D780	1
D783	1
D7B3	1
D7B4	1
DC8A	1
DC8B	1
DC8C	1
DC8D	1
CAB9	1
CDB4	1
CDB5	1
CABA	1
CB82	1
CB83	1
CB84	1
CB85	1
CB86	1
CB87	1
CB88	1
CB89	1
CB8A	1
CB8B	1
CB8C	1
CB8D	1
CB8E	1
CB8F	1
CB92	1
CB93	1
CB94	1
CB95	1
CB96	1
CB97	1
CB9E	1
CB9F	1
CBA5	1
CBA6	1
CBA7	1
CBA8	1
CBA9	1
CBAA	1
CBAB	1
CBAC	1
CBAD	1
CBAF	1
CBB0	1
CBB1	1
CBB2	1
CBB3	1
CBB4	1
CBB5	1
CBB6	1
CBB7	1
CBB8	1
CBB9	1
CBBA	1
CBBB	1
CBBC	1
CBBD	1
CBBE	1
CBBF	1
C2B0	1
D282	1
D88E	1
D88F	1
DBA9	1
CFB6	1
2B	1
C2B1	1
C3B7	1
C397	1
3C	1
3D	1
3E	1
C2AC	1
7C	1
C2A6	1
7E	1
CB90	1
CB91	1
C2A4	1
C2A2	1
24	1
C2A3	1
C2A5	1
30	1
D9A0	1
DBB0	1
31	1
C2B9	1
D9A1	1
DBB1	1
C2BD	1
C2BC	1
32	1
C2B2	1
D9A2	1
DBB2	1
33	1
C2B3	1
D9A3	1
DBB3	1
C2BE	1
34	1
D9A4	1
DBB4	1
35	1
D9A5	1
DBB5	1
36	1
D9A6	1
DBB6	1
37	1
D9A7	1
DBB7	1
38	1
D9A8	1
DBB8	1
39	1
D9A9	1
DBB9	1
41	1
61	1
C2AA	1
C380	1
C381	1
C382	1
C383	1
C384	1
C385	1
C3A0	1
C3A1	1
C3A2	1
C3A3	1
C3A4	1
C3A5	1
C480	1
C481	1
C482	1
C483	1
C484	1
C485	1
C78D	1
C78E	1
C79E	1
C79F	1
C7A0	1
C7A1	1
C7BA	1
C7BB	1
C880	1
C881	1
C882	1
C883	1
C8A6	1
C8A7	1
CDA3	1
C386	1
C3A6	1
C7A2	1
C7A3	1
C7BC	1
C7BD	1
C990	1
C991	1
C992	1
42	1
62	1
CA99	1
C680	1
C681	1
C993	1
C682	1
C683	1
43	1
63	1
C387	1
C3A7	1
C486	1
C487	1
C488	1
C489	1
C48A	1
C48B	1
C48C	1
C48D	1
CDA8	1
C687	1
C688	1
C995	1
44	1
64	1
C48E	1
C48F	1
CDA9	1
C784	1
C785	1
C786	1
C7B1	1
C7B2	1
C7B3	1
CAA3	1
CAA5	1
CAA4	1
C490	1
C491	1
C689	1
C996	1
C68A	1
C997	1
C68B	1
C68C	1
C8A1	1
C390	1
C3B0	1
45	1
65	1
C388	1
C389	1
C38A	1
C38B	1
C3A8	1
C3A9	1
C3AA	1
C3AB	1
C492	1
C493	1
C494	1
C495	1
C496	1
C497	1
C498	1
C499	1
C49A	1
C49B	1
C884	1
C885	1
C886	1
C887	1
C8A8	1
C8A9	1
CDA4	1
C68E	1
C79D	1
C68F	1
C999	1
C690	1
C99B	1
C998	1
C99A	1
C99C	1
C99D	1
C99E	1
CA9A	1
C9A4	1
46	1
66	1
CAA9	1
C691	1
C692	1
47	1
67	1
C49C	1
C49D	1
C49E	1
C49F	1
C4A0	1
C4A1	1
C4A2	1
C4A3	1
C7A6	1
C7A7	1
C7B4	1
C7B5	1
C9A1	1
C9A2	1
C7A4	1
C7A5	1
C693	1
C9A0	1
CA9B	1
C694	1
C9A3	1
CBA0	1
C6A2	1
C6A3	1
48	1
68	1
C4A4	1
C4A5	1
C89E	1
C89F	1
CAB0	1
CDAA	1
CA9C	1
C695	1
C7B6	1
C4A6	1
C4A7	1
C9A6	1
CAB1	1
C9A7	1
CABB	1
CABD	1
49	1
69	1
C38C	1
C38D	1
C38E	1
C38F	1
C3AC	1
C3AD	1
C3AE	1
C3AF	1
C4A8	1
C4A9	1
C4AA	1
C4AB	1
C4AC	1
C4AD	1
C4AE	1
C4AF	1
C4B0	1
C78F	1
C790	1
C888	1
C889	1
C88A	1
C88B	1
CDA5	1
C4B2	1
C4B3	1
C4B1	1
C9AA	1
C697	1
C9A8	1
C696	1
C9A9	1
4A	1
6A	1
C4B4	1
C4B5	1
C7B0	1
CAB2	1
CA9D	1
C99F	1
CA84	1
4B	1
6B	1
C4B6	1
C4B7	1
C7A8	1
C7A9	1
C698	1
C699	1
CA9E	1
4C	1
6C	1
C4B9	1
C4BA	1
C4BB	1
C4BC	1
C4BD	1
C4BE	1
CBA1	1
C4BF	1
C580	1
C787	1
C788	1
C789	1
CAAA	1
CAAB	1
CA9F	1
C581	1
C582	1
C69A	1
C9AB	1
C9AC	1
C9AD	1
C8B4	1
C9AE	1
C69B	1
CA8E	1
4D	1
6D	1
CDAB	1
C9B1	1
4E	1
6E	1
C583	1
C584	1
C585	1
C586	1
C587	1
C588	1
C7B8	1
C7B9	1
C78A	1
C78B	1
C78C	1
C391	1
C3B1	1
C9B4	1
C69D	1
C9B2	1
C69E	1
C8A0	1
C9B3	1
C8B5	1
C58A	1
C58B	1
4F	1
6F	1
C2BA	1
C392	1
C393	1
C394	1
C395	1
C396	1
C3B2	1
C3B3	1
C3B4	1
C3B5	1
C3B6	1
C58C	1
C58D	1
C58E	1
C58F	1
C590	1
C591	1
C6A0	1
C6A1	1
C791	1
C792	1
C7AA	1
C7AB	1
C7AC	1
C7AD	1
C88C	1
C88D	1
C88E	1
C88F	1
C8AA	1
C8AB	1
C8AC	1
C8AD	1
C8AE	1
C8AF	1
C8B0	1
C8B1	1
CDA6	1
C592	1
C593	1
C9B6	1
C398	1
C3B8	1
C7BE	1
C7BF	1
C686	1
C994	1
C69F	1
C9B5	1
C9B7	1
C8A2	1
C8A3	1
50	1
70	1
C6A4	1
C6A5	1
C9B8	1
51	1
71	1
CAA0	1
C4B8	1
52	1
72	1
C594	1
C595	1
C596	1
C597	1
C598	1
C599	1
C890	1
C891	1
C892	1
C893	1
CAB3	1
CDAC	1
C6A6	1
CA80	1
C9B9	1
CAB4	1
C9BA	1
C9BB	1
CAB5	1
C9BC	1
C9BD	1
C9BE	1
C9BF	1
CA81	1
CAB6	1
53	1
73	1
C59A	1
C59B	1
C59C	1
C59D	1
C59E	1
C59F	1
C5A0	1
C5A1	1
C5BF	1
C898	1
C899	1
CBA2	1
C39F	1
CA82	1
C6A9	1
CA83	1
C6AA	1
CA85	1
CA86	1
54	1
74	1
C5A2	1
C5A3	1
C5A4	1
C5A5	1
C89A	1
C89B	1
CDAD	1
CAA8	1
C6BE	1
CAA6	1
CAA7	1
C5A6	1
C5A7	1
C6AB	1
C6AC	1
C6AD	1
C6AE	1
CA88	1
C8B6	1
CA87	1
55	1
75	1
C399	1
C39A	1
C39B	1
C39C	1
C3B9	1
C3BA	1
C3BB	1
C3BC	1
C5A8	1
C5A9	1
C5AA	1
C5AB	1
C5AC	1
C5AD	1
C5AE	1
C5AF	1
C5B0	1
C5B1	1
C5B2	1
C5B3	1
C6AF	1
C6B0	1
C793	1
C794	1
C795	1
C796	1
C797	1
C798	1
C799	1
C79A	1
C79B	1
C79C	1
C894	1
C895	1
C896	1
C897	1
CDA7	1
CA89	1
C9A5	1
CAAE	1
CAAF	1
C69C	1
C9AF	1
C9B0	1
C6B1	1
CA8A	1
56	1
76	1
CDAE	1
C6B2	1
CA8B	1
CA8C	1
57	1
77	1
C5B4	1
C5B5	1
CAB7	1
CA8D	1
58	1
78	1
CBA3	1
CDAF	1
59	1
79	1
C39D	1
C3BD	1
C3BF	1
C5B6	1
C5B7	1
C5B8	1
C8B2	1
C8B3	1
CAB8	1
CA8F	1
C6B3	1
C6B4	1
5A	1
7A	1
C5B9	1
C5BA	1
C5BB	1
C5BC	1
C5BD	1
C5BE	1
C68D	1
C6B5	1
C6B6	1
C8A4	1
C8A5	1
CA90	1
CA91	1
C6B7	1
C7AE	1
C7AF	1
CA92	1
C6B8	1
C6B9	1
C6BA	1
CA93	1
C89C	1
C89D	1
C39E	1
C3BE	1
C6BF	1
C7B7	1
C6BB	1
C6A7	1
C6A8	1
C6BC	1
C6BD	1
C684	1
C685	1
CA94	1
CB80	1
CABC	1
C589	1
CBAE	1
CABE	1
CA95	1
CBA4	1
CABF	1
CB81	1
CAA1	1
CAA2	1
CA96	1
C780	1
C781	1
C782	1
C783	1
CA97	1
CA98	1
CAAC	1
CAAD	1
CE86	1
CE91	1
CEAC	1
CEB1	1
CE92	1
CEB2	1
CF90	1
CE93	1
CEB3	1
CE94	1
CEB4	1
CE88	1
CE95	1
CEAD	1
CEB5	1
CFB5	1
CF9C	1
CF9D	1
CF9A	1
CF9B	1
CE96	1
CEB6	1
CE89	1
CE97	1
CEAE	1
CEB7	1
CE98	1
CEB8	1
CF91	1
CFB4	1
CDBA	1
CE8A	1
CE90	1
CE99	1
CEAA	1
CEAF	1
CEB9	1
CF8A	1
CFB3	1
CE9A	1
CEBA	1
CFB0	1
CF97	1
CE9B	1
CEBB	1
C2B5	1
CE9C	1
CEBC	1
CE9D	1
CEBD	1
CE9E	1
CEBE	1
CE8C	1
CE9F	1
CEBF	1
CF8C	1
CEA0	1
CF80	1
CF96	1
CF9E	1
CF9F	1
CF98	1
CF99	1
CEA1	1
CF81	1
CFB1	1
CEA3	1
CF82	1
CF83	1
CFB2	1
CFB9	1
CEA4	1
CF84	1
CE8E	1
CEA5	1
CEAB	1
CEB0	1
CF85	1
CF8B	1
CF8D	1
CF92	1
CF93	1
CF94	1
CEA6	1
CF86	1
CF95	1
CEA7	1
CF87	1
CEA8	1
CF88	1
CE8F	1
CEA9	1
CF89	1
CF8E	1
CFA0	1
CFA1	1
CFB7	1
CFB8	1
CFBA	1
CFBB	1
CFA2	1
CFA3	1
CFA4	1
CFA5	1
CFA6	1
CFA7	1
CFA8	1
CFA9	1
CFAA	1
CFAB	1
CFAC	1
CFAD	1
CFAE	1
CFAF	1
D090	1
D0B0	1
D390	1
D391	1
D392	1
D393	1
D398	1
D399	1
D39A	1
D39B	1
D394	1
D395	1
D091	1
D0B1	1
D092	1
D0B2	1
D093	1
D0B3	1
D290	1
D291	1
D292	1
D293	1
D294	1
D295	1
D094	1
D0B4	1
D480	1
D481	1
D082	1
D192	1
D482	1
D483	1
D083	1
D193	1
D298	1
D299	1
D080	1
D081	1
D095	1
D0B5	1
D190	1
D191	1
D396	1
D397	1
D084	1
D194	1
D096	1
D0B6	1
D381	1
D382	1
D39C	1
D39D	1
D296	1
D297	1
D097	1
D0B7	1
D484	1
D485	1
D39E	1
D39F	1
D085	1
D195	1
D3A0	1
D3A1	1
D486	1
D487	1
D08D	1
D098	1
D0B8	1
D19D	1
D3A2	1
D3A3	1
D28A	1
D28B	1
D3A4	1
D3A5	1
D086	1
D196	1
D087	1
D197	1
D099	1
D0B9	1
D088	1
D198	1
D09A	1
D0BA	1
D29A	1
D29B	1
D383	1
D384	1
D2A0	1
D2A1	1
D29E	1
D29F	1
D29C	1
D29D	1
D09B	1
D0BB	1
D385	1
D386	1
D089	1
D199	1
D488	1
D489	1
D09C	1
D0BC	1
D38D	1
D38E	1
D09D	1
D0BD	1
D389	1
D38A	1
D2A2	1
D2A3	1
D387	1
D388	1
D2A4	1
D2A5	1
D08A	1
D19A	1
D48A	1
D48B	1
D09E	1
D0BE	1
D3A6	1
D3A7	1
D3A8	1
D3A9	1
D3AA	1
D3AB	1
D09F	1
D0BF	1
D2A6	1
D2A7	1
D280	1
D281	1
D0A0	1
D180	1
D28E	1
D28F	1
D0A1	1
D181	1
D48C	1
D48D	1
D2AA	1
D2AB	1
D0A2	1
D182	1
D48E	1
D48F	1
D2AC	1
D2AD	1
D08B	1
D19B	1
D08C	1
D19C	1
D0A3	1
D183	1
D3AE	1
D3AF	1
D08E	1
D19E	1
D3B0	1
D3B1	1
D3B2	1
D3B3	1
D2AE	1
D2AF	1
D2B0	1
D2B1	1
D1B8	1
D1B9	1
D0A4	1
D184	1
D0A5	1
D185	1
D2B2	1
D2B3	1
D2BA	1
D2BB	1
D1A0	1
D1A1	1
D1BE	1
D1BF	1
D1BC	1
D1BD	1
D1BA	1
D1BB	1
D0A6	1
D186	1
D2B4	1
D2B5	1
D0A7	1
D187	1
D3B4	1
D3B5	1
D2B6	1
D2B7	1
D38B	1
D38C	1
D2B8	1
D2B9	1
D2BC	1
D2BD	1
D2BE	1
D2BF	1
D08F	1
D19F	1
D0A8	1
D188	1
D0A9	1
D189	1
D0AA	1
D18A	1
D0AB	1
D18B	1
D3B8	1
D3B9	1
D0AC	1
D18C	1
D28C	1
D28D	1
D1A2	1
D1A3	1
D0AD	1
D18D	1
D3AC	1
D3AD	1
D0AE	1
D18E	1
D0AF	1
D18F	1
D1A4	1
D1A5	1
D1A6	1
D1A7	1
D1AA	1
D1AB	1
D1A8	1
D1A9	1
D1AC	1
D1AD	1
D1AE	1
D1AF	1
D1B0	1
D1B1	1
D1B2	1
D1B3	1
D1B4	1
D1B5	1
D1B6	1
D1B7	1
D2A8	1
D2A9	1
D380	1
D4B1	1
D5A1	1
D4B2	1
D5A2	1
D4B3	1
D5A3	1
D4B4	1
D5A4	1
D4B5	1
D5A5	1
D687	1
D4B6	1
D5A6	1
D4B7	1
D5A7	1
D4B8	1
D5A8	1
D4B9	1
D5A9	1
D4BA	1
D5AA	1
D4BB	1
D5AB	1
D4BC	1
D5AC	1
D4BD	1
D5AD	1
D4BE	1
D5AE	1
D4BF	1
D5AF	1
D580	1
D5B0	1
D581	1
D5B1	1
D582	1
D5B2	1
D583	1
D5B3	1
D584	1
D5B4	1
D585	1
D5B5	1
D586	1
D5B6	1
D587	1
D5B7	1
D588	1
D5B8	1
D589	1
D5B9	1
D58A	1
D5BA	1
D58B	1
D5BB	1
D58C	1
D5BC	1
D58D	1
D5BD	1
D58E	1
D5BE	1
D58F	1
D5BF	1
D590	1
D680	1
D591	1
D681	1
D592	1
D682	1
D593	1
D683	1
D594	1
D684	1
D595	1
D685	1
D596	1
D686	1
D599	1
D790	1
D791	1
D792	1
D793	1
D794	1
D795	1
D7B0	1
D7B1	1
D796	1
D797	1
D798	1
D799	1
D7B2	1
D79A	1
D79B	1
D79C	1
D79D	1
D79E	1
D79F	1
D7A0	1
D7A1	1
D7A2	1
D7A3	1
D7A4	1
D7A5	1
D7A6	1
D7A7	1
D7A8	1
D7A9	1
D7AA	1
D8A1	1
D9B4	1
DBBD	1
D8A2	1
D8A3	1
D9B2	1
D9B1	1
D8A4	1
D8A5	1
D9B3	1
D8A6	1
D8A7	1
D9B5	1
D9AE	1
D8A8	1
D9BB	1
D9BE	1
DA80	1
D8A9	1
D8AA	1
D8AB	1
D9B9	1
D9BA	1
D9BC	1
D9BD	1
D9BF	1
D8AC	1
DA83	1
DA84	1
DA86	1
DABF	1
DA87	1
D8AD	1
D8AE	1
DA81	1
DA82	1
DA85	1
D8AF	1
D8B0	1
DA88	1
DA89	1
DA8A	1
DA8B	1
DA8C	1
DA8D	1
DA8E	1
DA8F	1
DA90	1
DBAE	1
D8B1	1
D8B2	1
DA91	1
DA92	1
DA93	1
DA94	1
DA95	1
DA96	1
DA97	1
DA98	1
DA99	1
DBAF	1
D8B3	1
D8B4	1
DA9A	1
DA9B	1
DA9C	1
DBBA	1
D8B5	1
D8B6	1
DA9D	1
DA9E	1
DBBB	1
D8B7	1
D8B8	1
DA9F	1
D8B9	1
D8BA	1
DAA0	1
DBBC	1
D981	1
DAA1	1
DAA2	1
DAA3	1
DAA4	1
DAA5	1
DAA6	1
D9AF	1
D982	1
DAA7	1
DAA8	1
D983	1
DAA9	1
DAAA	1
DAAB	1
DAAC	1
DAAD	1
DAAE	1
DAAF	1
DAB0	1
DAB1	1
DAB2	1
DAB3	1
DAB4	1
D984	1
DAB5	1
DAB6	1
DAB7	1
DAB8	1
D985	1
DBBE	1
D986	1
DABA	1
DABB	1
DABC	1
DABD	1
DAB9	1
D987	1
DABE	1
DB81	1
DB82	1
DB83	1
DBBF	1
DB80	1
DB95	1
D988	1
DBA5	1
D9B6	1
DB84	1
DB85	1
DB86	1
DB87	1
D9B7	1
DB88	1
DB89	1
DB8A	1
DB8B	1
DB8F	1
D989	1
D98A	1
DBA6	1
D9B8	1
DB8C	1
DB8D	1
DB8E	1
DB90	1
DB91	1
DB92	1
DB93	1
DC90	1
DC92	1
DCAD	1
DC93	1
DC94	1
DCAE	1
DC96	1
DC95	1
DCAF	1
DC97	1
DC98	1
DC99	1
DD8D	1
DC9A	1
DC9B	1
DC9C	1
DC9D	1
DC9E	1
DC9F	1
DD8E	1
DCA0	1
DCA1	1
DCA2	1
DCA3	1
DCA4	1
DCA5	1
DCA6	1
DCA7	1
DD8F	1
DCA8	1
DCA9	1
DCAA	1
DCAB	1
DCAC	1
DE80	1
DE99	1
DE9A	1
DE81	1
DE82	1
DE83	1
DE9C	1
DE84	1
DE85	1
DE86	1
DE87	1
DEA2	1
DEA3	1
DE88	1
DEA5	1
DE89	1
DE8A	1
DE8B	1
DE9B	1
DE8C	1
DE98	1
DEA0	1
DEA1	1
DE8D	1
DE8E	1
DEA4	1
DE8F	1
DE90	1
DE9D	1
DE9E	1
DE9F	1
DE91	1
DE92	1
DE93	1
DE94	1
DE95	1
DE96	1
DE97	1
DEB1	1
DEA6	1
DEA7	1
DEA8	1
DEA9	1
DEAA	1
DEAB	1
DEAC	1
DEAD	1
DEAE	1
DEAF	1
DEB0	1
E4B880	1
E4B881	1
E4B882	1
E4B883	1
E4B884	1
E4B885	1
E4B886	1
E4B887	1
E4B888	1
E4B889	1
E4B88A	1
E4B88B	1
E4B88C	1
E4B88D	1
E4B88E	1
E4B88F	1
E4B890	1
E4B891	1
E4B892	1
E4B893	1
E4B894	1
E4B895	1
E4B896	1
E4B897	1
E4B898	1
E4B899	1
E4B89A	1
E4B89B	1
E4B89C	1
E4B89D	1
E4B89E	1
E4B89F	1
E4B8A0	1
E4B8A1	1
E4B8A2	1
E4B8A3	1
E4B8A4	1
E4B8A5	1
E4B8A6	1
E4B8A7	1
E4B8A8	1
E4B8A9	1
E4B8AA	1
E4B8AB	1
E4B8AC	1
E4B8AD	1
E4B8AE	1
E4B8AF	1
E4B8B0	1
E4B8B1	1
E4B8B2	1
E4B8B3	1
E4B8B4	1
E4B8B5	1
E4B8B6	1
E4B8B7	1
E4B8B8	1
E4B8B9	1
E4B8BA	1
E4B8BB	1
E4B8BC	1
E4B8BD	1
E4B8BE	1
E4B8BF	1
E4B980	1
E4B981	1
E4B982	1
E4B983	1
E4B984	1
E4B985	1
E4B986	1
E4B987	1
E4B988	1
E4B989	1
E4B98A	1
E4B98B	1
E4B98C	1
E4B98D	1
E4B98E	1
E4B98F	1
E4B990	1
E4B991	1
E4B992	1
E4B993	1
E4B994	1
E4B995	1
E4B996	1
E4B997	1
E4B998	1
E4B999	1
E4B99A	1
E4B99B	1
E4B99C	1
E4B99D	1
E4B99E	1
E4B99F	1
E4B9A0	1
E4B9A1	1
E4B9A2	1
E4B9A3	1
E4B9A4	1
E4B9A5	1
E4B9A6	1
E4B9A7	1
E4B9A8	1
E4B9A9	1
E4B9AA	1
E4B9AB	1
E4B9AC	1
E4B9AD	1
E4B9AE	1
E4B9AF	1
E4B9B0	1
E4B9B1	1
E4B9B2	1
E4B9B3	1
E4B9B4	1
E4B9B5	1
E4B9B6	1
E4B9B7	1
E4B9B8	1
E4B9B9	1
E4B9BA	1
E4B9BB	1
E4B9BC	1
E4B9BD	1
E4B9BE	1
E4B9BF	1
E4BA80	1
E4BA81	1
E4BA82	1
E4BA83	1
E4BA84	1
E4BA85	1
E4BA86	1
E4BA87	1
E4BA88	1
E4BA89	1
E4BA8A	1
E4BA8B	1
E4BA8C	1
E4BA8D	1
E4BA8E	1
E4BA8F	1
E4BA90	1
E4BA91	1
E4BA92	1
E4BA93	1
E4BA94	1
E4BA95	1
E4BA96	1
E4BA97	1
E4BA98	1
E4BA99	1
E4BA9A	1
E4BA9B	1
E4BA9C	1
E4BA9D	1
E4BA9E	1
E4BA9F	1
E4BAA0	1
E4BAA1	1
E4BAA2	1
E4BAA3	1
E4BAA4	1
E4BAA5	1
E4BAA6	1
E4BAA7	1
E4BAA8	1
E4BAA9	1
E4BAAA	1
E4BAAB	1
E4BAAC	1
E4BAAD	1
E4BAAE	1
E4BAAF	1
E4BAB0	1
E4BAB1	1
E4BAB2	1
E4BAB3	1
E4BAB4	1
E4BAB5	1
E4BAB6	1
E4BAB7	1
E4BAB8	1
E4BAB9	1
E4BABA	1
E4BABB	1
E4BABC	1
E4BABD	1
E4BABE	1
E4BABF	1
E4BB80	1
E4BB81	1
E4BB82	1
E4BB83	1
E4BB84	1
E4BB85	1
E4BB86	1
E4BB87	1
E4BB88	1
E4BB89	1
E4BB8A	1
E4BB8B	1
E4BB8C	1
E4BB8D	1
E4BB8E	1
E4BB8F	1
E4BB90	1
E4BB91	1
E4BB92	1
E4BB93	1
E4BB94	1
E4BB95	1
E4BB96	1
E4BB97	1
E4BB98	1
E4BB99	1
E4BB9A	1
E4BB9B	1
E4BB9C	1
E4BB9D	1
E4BB9E	1
E4BB9F	1
E4BBA0	1
E4BBA1	1
E4BBA2	1
E4BBA3	1
E4BBA4	1
E4BBA5	1
E4BBA6	1
E4BBA7	1
E4BBA8	1
E4BBA9	1
E4BBAA	1
E4BBAB	1
E4BBAC	1
E4BBAD	1
E4BBAE	1
E4BBAF	1
E4BBB0	1
E4BBB1	1
E4BBB2	1
E4BBB3	1
E4BBB4	1
E4BBB5	1
E4BBB6	1
E4BBB7	1
E4BBB8	1
E4BBB9	1
E4BBBA	1
E4BBBB	1
E4BBBC	1
E4BBBD	1
E4BBBE	1
E4BBBF	1
E4BC80	1
E4BC81	1
E4BC82	1
E4BC83	1
E4BC84	1
E4BC85	1
E4BC86	1
E4BC87	1
E4BC88	1
E4BC89	1
E4BC8A	1
E4BC8B	1
E4BC8C	1
E4BC8D	1
E4BC8E	1
E4BC8F	1
E4BC90	1
E4BC91	1
E4BC92	1
E4BC93	1
E4BC94	1
E4BC95	1
E4BC96	1
E4BC97	1
E4BC98	1
E4BC99	1
E4BC9A	1
E4BC9B	1
E4BC9C	1
E4BC9D	1
E4BC9E	1
E4BC9F	1
E4BCA0	1
E4BCA1	1
E4BCA2	1
E4BCA3	1
E4BCA4	1
E4BCA5	1
E4BCA6	1
E4BCA7	1
E4BCA8	1
E4BCA9	1
E4BCAA	1
E4BCAB	1
E4BCAC	1
E4BCAD	1
E4BCAE	1
E4BCAF	1
E4BCB0	1
E4BCB1	1
E4BCB2	1
E4BCB3	1
E4BCB4	1
E4BCB5	1
E4BCB6	1
E4BCB7	1
E4BCB8	1
E4BCB9	1
E4BCBA	1
E4BCBB	1
E4BCBC	1
E4BCBD	1
E4BCBE	1
E4BCBF	1
E4BD80	1
E4BD81	1
E4BD82	1
E4BD83	1
E4BD84	1
E4BD85	1
E4BD86	1
E4BD87	1
E4BD88	1
E4BD89	1
E4BD8A	1
E4BD8B	1
E4BD8C	1
E4BD8D	1
E4BD8E	1
E4BD8F	1
E4BD90	1
E4BD91	1
E4BD92	1
E4BD93	1
E4BD94	1
E4BD95	1
E4BD96	1
E4BD97	1
E4BD98	1
E4BD99	1
E4BD9A	1
E4BD9B	1
E4BD9C	1
E4BD9D	1
E4BD9E	1
E4BD9F	1
E4BDA0	1
E4BDA1	1
E4BDA2	1
E4BDA3	1
E4BDA4	1
E4BDA5	1
E4BDA6	1
E4BDA7	1
E4BDA8	1
E4BDA9	1
E4BDAA	1
E4BDAB	1
E4BDAC	1
E4BDAD	1
E4BDAE	1
E4BDAF	1
E4BDB0	1
E4BDB1	1
E4BDB2	1
E4BDB3	1
E4BDB4	1
E4BDB5	1
E4BDB6	1
E4BDB7	1
E4BDB8	1
E4BDB9	1
E4BDBA	1
E4BDBB	1
E4BDBC	1
E4BDBD	1
E4BDBE	1
E4BDBF	1
E4BE80	1
E4BE81	1
E4BE82	1
E4BE83	1
E4BE84	1
E4BE85	1
E4BE86	1
E4BE87	1
E4BE88	1
E4BE89	1
E4BE8A	1
E4BE8B	1
E4BE8C	1
E4BE8D	1
E4BE8E	1
E4BE8F	1
E4BE90	1
E4BE91	1
E4BE92	1
E4BE93	1
E4BE94	1
E4BE95	1
E4BE96	1
E4BE97	1
E4BE98	1
E4BE99	1
E4BE9A	1
E4BE9B	1
E4BE9C	1
E4BE9D	1
E4BE9E	1
E4BE9F	1
E4BEA0	1
E4BEA1	1
E4BEA2	1
E4BEA3	1
E4BEA4	1
E4BEA5	1
E4BEA6	1
E4BEA7	1
E4BEA8	1
E4BEA9	1
E4BEAA	1
E4BEAB	1
E4BEAC	1
E4BEAD	1
E4BEAE	1
E4BEAF	1
E4BEB0	1
E4BEB1	1
E4BEB2	1
E4BEB3	1
E4BEB4	1
E4BEB5	1
E4BEB6	1
E4BEB7	1
E4BEB8	1
E4BEB9	1
E4BEBA	1
E4BEBB	1
E4BEBC	1
E4BEBD	1
E4BEBE	1
E4BEBF	1
E4BF80	1
E4BF81	1
E4BF82	1
E4BF83	1
E4BF84	1
E4BF85	1
E4BF86	1
E4BF87	1
E4BF88	1
E4BF89	1
E4BF8A	1
E4BF8B	1
E4BF8C	1
E4BF8D	1
E4BF8E	1
E4BF8F	1
E4BF90	1
E4BF91	1
E4BF92	1
E4BF93	1
E4BF94	1
E4BF95	1
E4BF96	1
E4BF97	1
E4BF98	1
E4BF99	1
E4BF9A	1
E4BF9B	1
E4BF9C	1
E4BF9D	1
E4BF9E	1
E4BF9F	1
E4BFA0	1
E4BFA1	1
E4BFA2	1
E4BFA3	1
E4BFA4	1
E4BFA5	1
E4BFA6	1
E4BFA7	1
E4BFA8	1
E4BFA9	1
E4BFAA	1
E4BFAB	1
E4BFAC	1
E4BFAD	1
E4BFAE	1
E4BFAF	1
E4BFB0	1
E4BFB1	1
E4BFB2	1
E4BFB3	1
E4BFB4	1
E4BFB5	1
E4BFB6	1
E4BFB7	1
E4BFB8	1
E4BFB9	1
E4BFBA	1
E4BFBB	1
E4BFBC	1
E4BFBD	1
E4BFBE	1
E4BFBF	1
C8B7	1
C8B8	1
C8B9	1
C8BA	1
C8BB	1
C8BC	1
C8BD	1
C8BE	1
C8BF	1
C980	1
C981	1
C982	1
C983	1
C984	1
C985	1
C986	1
C987	1
C988	1
C989	1
C98A	1
C98B	1
C98C	1
C98D	1
C98E	1
C98F	1
CD98	1
CD99	1
CD9A	1
CD9B	1
CD9C	1
CDB0	1
CDB1	1
CDB2	1
CDB3	1
CDB6	1
CDB7	1
CDB8	1
CDB9	1
CDBB	1
CDBC	1
CDBD	1
CDBF	1
CE80	1
CE81	1
CE82	1
CE83	1
CE8B	1
CE8D	1
CEA2	1
CF8F	1
CFBC	1
CFBD	1
CFBE	1
CFBF	1
D287	1
D38F	1
D3B6	1
D3B7	1
D3BA	1
D3BB	1
D3BC	1
D3BD	1
D3BE	1
D3BF	1
D490	1
D491	1
D492	1
D493	1
D494	1
D495	1
D496	1
D497	1
D498	1
D499	1
D49A	1
D49B	1
D49C	1
D49D	1
D49E	1
D49F	1
D4A0	1
D4A1	1
D4A2	1
D4A3	1
D4A4	1
D4A5	1
D4A6	1
D4A7	1
D4A8	1
D4A9	1
D4AA	1
D4AB	1
D4AC	1
D4AD	1
D4AE	1
D4AF	1
D4B0	1
D597	1
D598	1
D5A0	1
D688	1
D68B	1
D68C	1
D68D	1
D68E	1
D68F	1
D690	1
D6A2	1
D6BA	1
D785	1
D786	1
D787	1
D788	1
D789	1
D78A	1
D78B	1
D78C	1
D78D	1
D78E	1
D78F	1
D7AB	1
D7AC	1
D7AD	1
D7AE	1
D7AF	1
D7B5	1
D7B6	1
D7B7	1
D7B8	1
D7B9	1
D7BA	1
D7BB	1
D7BC	1
D7BD	1
D7BE	1
D7BF	1
D884	1
D885	1
D886	1
D887	1
D888	1
D889	1
D88A	1
D88B	1
D896	1
D897	1
D898	1
D899	1
D89A	1
D89C	1
D89D	1
D89E	1
D8A0	1
D8BB	1
D8BC	1
D8BD	1
D8BE	1
D8BF	1
D999	1
D99A	1
D99B	1
D99C	1
D99D	1
D99E	1
D99F	1
DC8E	1
DD8B	1
DD8C	1
DD90	1
DD91	1
DD92	1
DD93	1
DD94	1
DD95	1
DD96	1
DD97	1
DD98	1
DD99	1
DD9A	1
DD9B	1
DD9C	1
DD9D	1
DD9E	1
DD9F	1
DDA0	1
DDA1	1
DDA2	1
DDA3	1
DDA4	1
DDA5	1
DDA6	1
DDA7	1
DDA8	1
DDA9	1
DDAA	1
DDAB	1
DDAC	1
DDAD	1
DDAE	1
DDAF	1
DDB0	1
DDB1	1
DDB2	1
DDB3	1
DDB4	1
DDB5	1
DDB6	1
DDB7	1
DDB8	1
DDB9	1
DDBA	1
DDBB	1
DDBC	1
DDBD	1
DDBE	1
DDBF	1
DEB2	1
DEB3	1
DEB4	1
DEB5	1
DEB6	1
DEB7	1
DEB8	1
DEB9	1
DEBA	1
DEBB	1
DEBC	1
DEBD	1
DEBE	1
DEBF	1
DF80	1
DF81	1
DF82	1
DF83	1
DF84	1
DF85	1
DF86	1
DF87	1
DF88	1
DF89	1
DF8A	1
DF8B	1
DF8C	1
DF8D	1
DF8E	1
DF8F	1
DF90	1
DF91	1
DF92	1
DF93	1
DF94	1
DF95	1
DF96	1
DF97	1
DF98	1
DF99	1
DF9A	1
DF9B	1
DF9C	1
DF9D	1
DF9E	1
DF9F	1
DFA0	1
DFA1	1
DFA2	1
DFA3	1
DFA4	1
DFA5	1
DFA6	1
DFA7	1
DFA8	1
DFA9	1
DFAA	1
DFAB	1
DFAC	1
DFAD	1
DFAE	1
DFAF	1
DFB0	1
DFB1	1
DFB2	1
DFB3	1
DFB4	1
DFB5	1
DFB6	1
DFB7	1
DFB8	1
DFB9	1
DFBA	1
DFBB	1
DFBC	1
DFBD	1
DFBE	1
DFBF	1
DROP TABLE IF EXISTS test.t1;
DROP TABLE IF EXISTS test.t1;
DROP DATABASE test;
CREATE DATABASE test CHARACTER SET utf8mb3;
USE test;
CREATE TABLE test.t1 (a CHAR(4) CHARACTER SET utf8mb3 COLLATE utf8mb3_swedish_ci) ENGINE=MyISAM CHARACTER SET utf8mb3 COLLATE utf8mb3_swedish_ci;
Warnings:
Warning	1287	'utf8mb3' is deprecated and will be removed in a future release. Please use utf8mb4 instead
Warning	3778	'utf8mb3_swedish_ci' is a collation of the deprecated character set UTF8MB3. Please consider using UTF8MB4 with an appropriate collation instead.
Warning	1287	'utf8mb3' is deprecated and will be removed in a future release. Please use utf8mb4 instead
Warning	3778	'utf8mb3_swedish_ci' is a collation of the deprecated character set UTF8MB3. Please consider using UTF8MB4 with an appropriate collation instead.
SHOW TABLE STATUS LIKE 't1';
Name	Engine	Version	Row_format	Rows	Avg_row_length	Data_length	Max_data_length	Index_length	Data_free	Auto_increment	Create_time	Update_time	Check_time	Collation	Checksum	Create_options	Comment
t1	MyISAM	#	#	#	#	#	#	#	#	#	#	#	#	utf8mb3_swedish_ci	#	#	#
LOAD DATA INFILE 
'MYSQL_TEST_DIR/suite/funcs_2/data/charset_utf8.txt' INTO TABLE test.t1;
DELETE FROM test.t1 WHERE CHAR_LENGTH(a) <> 1;
SELECT HEX(ORD(a)) AS a_ord, CHAR_LENGTH(a) AS a_len FROM test.t1 ORDER BY a, ORD(a);
a_ord	a_len
C285	1
7F	1
C280	1
C281	1
C282	1
C283	1
C284	1
C286	1
C287	1
C288	1
C289	1
C28A	1
C28B	1
C28C	1
C28D	1
C28E	1
C28F	1
C290	1
C291	1
C292	1
C293	1
C294	1
C295	1
C296	1
C297	1
C298	1
C299	1
C29A	1
C29B	1
C29C	1
C29D	1
C29E	1
C29F	1
C2A0	1
CC80	1
CC81	1
CC82	1
CC83	1
CC84	1
CC85	1
CC86	1
CC87	1
CC88	1
CC89	1
CC8A	1
CC8B	1
CC8C	1
CC8D	1
CC8E	1
CC8F	1
CC90	1
CC91	1
CC92	1
CC93	1
CC94	1
CC95	1
CC96	1
CC97	1
CC98	1
CC99	1
CC9A	1
CC9B	1
CC9C	1
CC9D	1
CC9E	1
CC9F	1
CCA0	1
CCA1	1
CCA2	1
CCA3	1
CCA4	1
CCA5	1
CCA6	1
CCA7	1
CCA8	1
CCA9	1
CCAA	1
CCAB	1
CCAC	1
CCAD	1
CCAE	1
CCAF	1
CCB0	1
CCB1	1
CCB2	1
CCB3	1
CCB4	1
CCB5	1
CCB6	1
CCB7	1
CCB8	1
CCB9	1
CCBA	1
CCBB	1
CCBC	1
CCBD	1
CCBE	1
CCBF	1
CD80	1
CD81	1
CD82	1
CD83	1
CD84	1
CD85	1
CD86	1
CD87	1
CD88	1
CD89	1
CD8A	1
CD8B	1
CD8C	1
CD8D	1
CD8E	1
CD8F	1
CD90	1
CD91	1
CD92	1
CD93	1
CD94	1
CD95	1
CD96	1
CD97	1
CD9D	1
CD9E	1
CD9F	1
CDA0	1
CDA1	1
CDA2	1
D283	1
D284	1
D285	1
D286	1
D288	1
D289	1
D691	1
D692	1
D693	1
D694	1
D695	1
D696	1
D697	1
D698	1
D699	1
D69A	1
D69B	1
D69C	1
D69D	1
D69E	1
D69F	1
D6A0	1
D6A1	1
D6A3	1
D6A4	1
D6A5	1
D6A6	1
D6A7	1
D6A8	1
D6A9	1
D6AA	1
D6AB	1
D6AC	1
D6AD	1
D6AE	1
D6AF	1
D6B0	1
D6B1	1
D6B2	1
D6B3	1
D6B4	1
D6B5	1
D6B6	1
D6B7	1
D6B8	1
D6B9	1
D6BB	1
D6BC	1
D6BD	1
D6BF	1
D781	1
D782	1
D784	1
D880	1
D881	1
D882	1
D883	1
D890	1
D891	1
D892	1
D893	1
D894	1
D895	1
D98B	1
D98C	1
D98D	1
D98E	1
D98F	1
D990	1
D991	1
D992	1
D993	1
D994	1
D995	1
D996	1
D997	1
D998	1
D9B0	1
DB96	1
DB97	1
DB98	1
DB99	1
DB9A	1
DB9B	1
DB9C	1
DB9D	1
DB9E	1
DB9F	1
DBA0	1
DBA1	1
DBA2	1
DBA3	1
DBA4	1
DBA7	1
DBA8	1
DBAA	1
DBAB	1
DBAC	1
DBAD	1
DC8F	1
DC91	1
DCB0	1
DCB1	1
DCB2	1
DCB3	1
DCB4	1
DCB5	1
DCB6	1
DCB7	1
DCB8	1
DCB9	1
DCBA	1
DCBB	1
DCBC	1
DCBD	1
DCBE	1
DCBF	1
DD80	1
DD81	1
DD82	1
DD83	1
DD84	1
DD85	1
DD86	1
DD87	1
DD88	1
DD89	1
DD8A	1
D980	1
60	1
C2B4	1
CE84	1
CB9C	1
5E	1
C2AF	1
CB98	1
CB99	1
C2A8	1
CE85	1
CB9A	1
CB9D	1
C2B8	1
CB9B	1
5F	1
C2AD	1
2D	1
D68A	1
2C	1
D59D	1
D88C	1
D88D	1
D9AB	1
D9AC	1
3B	1
CDBE	1
D89B	1
3A	1
D689	1
DC83	1
DC84	1
DC85	1
DC86	1
DC87	1
DC88	1
21	1
C2A1	1
D59C	1
3F	1
C2BF	1
D59E	1
D89F	1
DC89	1
2E	1
DB94	1
DC81	1
DC82	1
C2B7	1
CE87	1
DC80	1
27	1
22	1
C2AB	1
C2BB	1
28	1
29	1
5B	1
7B	1
7D	1
C2A7	1
C2B6	1
C2A9	1
C2AE	1
40	1
2A	1
D9AD	1
2F	1
26	1
23	1
25	1
D9AA	1
D59A	1
D59B	1
D59F	1
D6BE	1
D780	1
D783	1
D7B3	1
D7B4	1
DC8A	1
DC8B	1
DC8C	1
DC8D	1
CAB9	1
CDB4	1
CDB5	1
CABA	1
CB82	1
CB83	1
CB84	1
CB85	1
CB86	1
CB87	1
CB88	1
CB89	1
CB8A	1
CB8B	1
CB8C	1
CB8D	1
CB8E	1
CB8F	1
CB92	1
CB93	1
CB94	1
CB95	1
CB96	1
CB97	1
CB9E	1
CB9F	1
CBA5	1
CBA6	1
CBA7	1
CBA8	1
CBA9	1
CBAA	1
CBAB	1
CBAC	1
CBAD	1
CBAF	1
CBB0	1
CBB1	1
CBB2	1
CBB3	1
CBB4	1
CBB5	1
CBB6	1
CBB7	1
CBB8	1
CBB9	1
CBBA	1
CBBB	1
CBBC	1
CBBD	1
CBBE	1
CBBF	1
C2B0	1
D282	1
D88E	1
D88F	1
DBA9	1
CFB6	1
2B	1
C2B1	1
C3B7	1
C397	1
3C	1
3D	1
3E	1
C2AC	1
7C	1
C2A6	1
7E	1
CB90	1
CB91	1
C2A4	1
C2A2	1
24	1
C2A3	1
C2A5	1
30	1
D9A0	1
DBB0	1
31	1
C2B9	1
D9A1	1
DBB1	1
C2BD	1
C2BC	1
32	1
C2B2	1
D9A2	1
DBB2	1
33	1
C2B3	1
D9A3	1
DBB3	1
C2BE	1
34	1
D9A4	1
DBB4	1
35	1
D9A5	1
DBB5	1
36	1
D9A6	1
DBB6	1
37	1
D9A7	1
DBB7	1
38	1
D9A8	1
DBB8	1
39	1
D9A9	1
DBB9	1
41	1
61	1
C2AA	1
C380	1
C381	1
C382	1
C383	1
C3A0	1
C3A1	1
C3A2	1
C3A3	1
C480	1
C481	1
C482	1
C483	1
C484	1
C485	1
C78D	1
C78E	1
C79E	1
C79F	1
C7A0	1
C7A1	1
C7BA	1
C7BB	1
C880	1
C881	1
C882	1
C883	1
C8A6	1
C8A7	1
CDA3	1
C7A2	1
C7A3	1
C7BC	1
C7BD	1
C990	1
C991	1
C992	1
42	1
62	1
CA99	1
C680	1
C681	1
C993	1
C682	1
C683	1
43	1
63	1
C387	1
C3A7	1
C486	1
C487	1
C488	1
C489	1
C48A	1
C48B	1
C48C	1
C48D	1
CDA8	1
C687	1
C688	1
C995	1
44	1
64	1
C48E	1
C48F	1
CDA9	1
C784	1
C785	1
C786	1
C7B1	1
C7B2	1
C7B3	1
CAA3	1
CAA5	1
CAA4	1
C490	1
C491	1
C689	1
C996	1
C68A	1
C997	1
C68B	1
C68C	1
C8A1	1
C390	1
C3B0	1
45	1
65	1
C388	1
C389	1
C38A	1
C38B	1
C3A8	1
C3A9	1
C3AA	1
C3AB	1
C492	1
C493	1
C494	1
C495	1
C496	1
C497	1
C498	1
C499	1
C49A	1
C49B	1
C884	1
C885	1
C886	1
C887	1
C8A8	1
C8A9	1
CDA4	1
C68E	1
C79D	1
C68F	1
C999	1
C690	1
C99B	1
C998	1
C99A	1
C99C	1
C99D	1
C99E	1
CA9A	1
C9A4	1
46	1
66	1
CAA9	1
C691	1
C692	1
47	1
67	1
C49C	1
C49D	1
C49E	1
C49F	1
C4A0	1
C4A1	1
C4A2	1
C4A3	1
C7A6	1
C7A7	1
C7B4	1
C7B5	1
C9A1	1
C9A2	1
C7A4	1
C7A5	1
C693	1
C9A0	1
CA9B	1
C694	1
C9A3	1
CBA0	1
C6A2	1
C6A3	1
48	1
68	1
C4A4	1
C4A5	1
C89E	1
C89F	1
CAB0	1
CDAA	1
CA9C	1
C695	1
C7B6	1
C4A6	1
C4A7	1
C9A6	1
CAB1	1
C9A7	1
CABB	1
CABD	1
49	1
69	1
C38C	1
C38D	1
C38E	1
C38F	1
C3AC	1
C3AD	1
C3AE	1
C3AF	1
C4A8	1
C4A9	1
C4AA	1
C4AB	1
C4AC	1
C4AD	1
C4AE	1
C4AF	1
C4B0	1
C78F	1
C790	1
C888	1
C889	1
C88A	1
C88B	1
CDA5	1
C4B2	1
C4B3	1
C4B1	1
C9AA	1
C697	1
C9A8	1
C696	1
C9A9	1
4A	1
6A	1
C4B4	1
C4B5	1
C7B0	1
CAB2	1
CA9D	1
C99F	1
CA84	1
4B	1
6B	1
C4B6	1
C4B7	1
C7A8	1
C7A9	1
C698	1
C699	1
CA9E	1
4C	1
6C	1
C4B9	1
C4BA	1
C4BB	1
C4BC	1
C4BD	1
C4BE	1
CBA1	1
C4BF	1
C580	1
C787	1
C788	1
C789	1
CAAA	1
CAAB	1
CA9F	1
C581	1
C582	1
C69A	1
C9AB	1
C9AC	1
C9AD	1
C8B4	1
C9AE	1
C69B	1
CA8E	1
4D	1
6D	1
CDAB	1
C9B1	1
4E	1
6E	1
C391	1
C3B1	1
C583	1
C584	1
C585	1
C586	1
C587	1
C588	1
C7B8	1
C7B9	1
C78A	1
C78B	1
C78C	1
C9B4	1
C69D	1
C9B2	1
C69E	1
C8A0	1
C9B3	1
C8B5	1
C58A	1
C58B	1
4F	1
6F	1
C2BA	1
C392	1
C393	1
C394	1
C395	1
C3B2	1
C3B3	1
C3B4	1
C3B5	1
C58C	1
C58D	1
C58E	1
C58F	1
C590	1
C591	1
C6A0	1
C6A1	1
C791	1
C792	1
C7AA	1
C7AB	1
C7AC	1
C7AD	1
C88C	1
C88D	1
C88E	1
C88F	1
C8AA	1
C8AB	1
C8AC	1
C8AD	1
C8AE	1
C8AF	1
C8B0	1
C8B1	1
CDA6	1
C592	1
C593	1
C9B6	1
C7BE	1
C7BF	1
C686	1
C994	1
C69F	1
C9B5	1
C9B7	1
C8A2	1
C8A3	1
50	1
70	1
C6A4	1
C6A5	1
C9B8	1
51	1
71	1
CAA0	1
C4B8	1
52	1
72	1
C594	1
C595	1
C596	1
C597	1
C598	1
C599	1
C890	1
C891	1
C892	1
C893	1
CAB3	1
CDAC	1
C6A6	1
CA80	1
C9B9	1
CAB4	1
C9BA	1
C9BB	1
CAB5	1
C9BC	1
C9BD	1
C9BE	1
C9BF	1
CA81	1
CAB6	1
53	1
73	1
C59A	1
C59B	1
C59C	1
C59D	1
C59E	1
C59F	1
C5A0	1
C5A1	1
C5BF	1
C898	1
C899	1
CBA2	1
C39F	1
CA82	1
C6A9	1
CA83	1
C6AA	1
CA85	1
CA86	1
54	1
74	1
C5A2	1
C5A3	1
C5A4	1
C5A5	1
C89A	1
C89B	1
CDAD	1
CAA8	1
C6BE	1
CAA6	1
CAA7	1
C5A6	1
C5A7	1
C6AB	1
C6AC	1
C6AD	1
C6AE	1
CA88	1
C8B6	1
CA87	1
55	1
75	1
C399	1
C39A	1
C39B	1
C3B9	1
C3BA	1
C3BB	1
C5A8	1
C5A9	1
C5AA	1
C5AB	1
C5AC	1
C5AD	1
C5AE	1
C5AF	1
C5B0	1
C5B1	1
C5B2	1
C5B3	1
C6AF	1
C6B0	1
C793	1
C794	1
C795	1
C796	1
C797	1
C798	1
C799	1
C79A	1
C79B	1
C79C	1
C894	1
C895	1
C896	1
C897	1
CDA7	1
CA89	1
C9A5	1
CAAE	1
CAAF	1
C69C	1
C9AF	1
C9B0	1
C6B1	1
CA8A	1
56	1
76	1
CDAE	1
C6B2	1
CA8B	1
CA8C	1
57	1
77	1
C5B4	1
C5B5	1
CAB7	1
CA8D	1
58	1
78	1
CBA3	1
CDAF	1
59	1
79	1
C39C	1
C39D	1
C3BC	1
C3BD	1
C3BF	1
C5B6	1
C5B7	1
C5B8	1
C8B2	1
C8B3	1
CAB8	1
CA8F	1
C6B3	1
C6B4	1
5A	1
7A	1
C5B9	1
C5BA	1
C5BB	1
C5BC	1
C5BD	1
C5BE	1
C68D	1
C385	1
C3A5	1
C384	1
C386	1
C3A4	1
C3A6	1
C396	1
C398	1
C3B6	1
C3B8	1
C6B5	1
C6B6	1
C8A4	1
C8A5	1
CA90	1
CA91	1
C6B7	1
C7AE	1
C7AF	1
CA92	1
C6B8	1
C6B9	1
C6BA	1
CA93	1
C89C	1
C89D	1
C39E	1
C3BE	1
C6BF	1
C7B7	1
C6BB	1
C6A7	1
C6A8	1
C6BC	1
C6BD	1
C684	1
C685	1
CA94	1
CB80	1
CABC	1
C589	1
CBAE	1
CABE	1
CA95	1
CBA4	1
CABF	1
CB81	1
CAA1	1
CAA2	1
CA96	1
C780	1
C781	1
C782	1
C783	1
CA97	1
CA98	1
CAAC	1
CAAD	1
CE86	1
CE91	1
CEAC	1
CEB1	1
CE92	1
CEB2	1
CF90	1
CE93	1
CEB3	1
CE94	1
CEB4	1
CE88	1
CE95	1
CEAD	1
CEB5	1
CFB5	1
CF9C	1
CF9D	1
CF9A	1
CF9B	1
CE96	1
CEB6	1
CE89	1
CE97	1
CEAE	1
CEB7	1
CE98	1
CEB8	1
CF91	1
CFB4	1
CDBA	1
CE8A	1
CE90	1
CE99	1
CEAA	1
CEAF	1
CEB9	1
CF8A	1
CFB3	1
CE9A	1
CEBA	1
CFB0	1
CF97	1
CE9B	1
CEBB	1
C2B5	1
CE9C	1
CEBC	1
CE9D	1
CEBD	1
CE9E	1
CEBE	1
CE8C	1
CE9F	1
CEBF	1
CF8C	1
CEA0	1
CF80	1
CF96	1
CF9E	1
CF9F	1
CF98	1
CF99	1
CEA1	1
CF81	1
CFB1	1
CEA3	1
CF82	1
CF83	1
CFB2	1
CFB9	1
CEA4	1
CF84	1
CE8E	1
CEA5	1
CEAB	1
CEB0	1
CF85	1
CF8B	1
CF8D	1
CF92	1
CF93	1
CF94	1
CEA6	1
CF86	1
CF95	1
CEA7	1
CF87	1
CEA8	1
CF88	1
CE8F	1
CEA9	1
CF89	1
CF8E	1
CFA0	1
CFA1	1
CFB7	1
CFB8	1
CFBA	1
CFBB	1
CFA2	1
CFA3	1
CFA4	1
CFA5	1
CFA6	1
CFA7	1
CFA8	1
CFA9	1
CFAA	1
CFAB	1
CFAC	1
CFAD	1
CFAE	1
CFAF	1
D090	1
D0B0	1
D390	1
D391	1
D392	1
D393	1
D398	1
D399	1
D39A	1
D39B	1
D394	1
D395	1
D091	1
D0B1	1
D092	1
D0B2	1
D093	1
D0B3	1
D290	1
D291	1
D292	1
D293	1
D294	1
D295	1
D094	1
D0B4	1
D480	1
D481	1
D082	1
D192	1
D482	1
D483	1
D083	1
D193	1
D298	1
D299	1
D080	1
D081	1
D095	1
D0B5	1
D190	1
D191	1
D396	1
D397	1
D084	1
D194	1
D096	1
D0B6	1
D381	1
D382	1
D39C	1
D39D	1
D296	1
D297	1
D097	1
D0B7	1
D484	1
D485	1
D39E	1
D39F	1
D085	1
D195	1
D3A0	1
D3A1	1
D486	1
D487	1
D08D	1
D098	1
D0B8	1
D19D	1
D3A2	1
D3A3	1
D28A	1
D28B	1
D3A4	1
D3A5	1
D086	1
D196	1
D087	1
D197	1
D099	1
D0B9	1
D088	1
D198	1
D09A	1
D0BA	1
D29A	1
D29B	1
D383	1
D384	1
D2A0	1
D2A1	1
D29E	1
D29F	1
D29C	1
D29D	1
D09B	1
D0BB	1
D385	1
D386	1
D089	1
D199	1
D488	1
D489	1
D09C	1
D0BC	1
D38D	1
D38E	1
D09D	1
D0BD	1
D389	1
D38A	1
D2A2	1
D2A3	1
D387	1
D388	1
D2A4	1
D2A5	1
D08A	1
D19A	1
D48A	1
D48B	1
D09E	1
D0BE	1
D3A6	1
D3A7	1
D3A8	1
D3A9	1
D3AA	1
D3AB	1
D09F	1
D0BF	1
D2A6	1
D2A7	1
D280	1
D281	1
D0A0	1
D180	1
D28E	1
D28F	1
D0A1	1
D181	1
D48C	1
D48D	1
D2AA	1
D2AB	1
D0A2	1
D182	1
D48E	1
D48F	1
D2AC	1
D2AD	1
D08B	1
D19B	1
D08C	1
D19C	1
D0A3	1
D183	1
D3AE	1
D3AF	1
D08E	1
D19E	1
D3B0	1
D3B1	1
D3B2	1
D3B3	1
D2AE	1
D2AF	1
D2B0	1
D2B1	1
D1B8	1
D1B9	1
D0A4	1
D184	1
D0A5	1
D185	1
D2B2	1
D2B3	1
D2BA	1
D2BB	1
D1A0	1
D1A1	1
D1BE	1
D1BF	1
D1BC	1
D1BD	1
D1BA	1
D1BB	1
D0A6	1
D186	1
D2B4	1
D2B5	1
D0A7	1
D187	1
D3B4	1
D3B5	1
D2B6	1
D2B7	1
D38B	1
D38C	1
D2B8	1
D2B9	1
D2BC	1
D2BD	1
D2BE	1
D2BF	1
D08F	1
D19F	1
D0A8	1
D188	1
D0A9	1
D189	1
D0AA	1
D18A	1
D0AB	1
D18B	1
D3B8	1
D3B9	1
D0AC	1
D18C	1
D28C	1
D28D	1
D1A2	1
D1A3	1
D0AD	1
D18D	1
D3AC	1
D3AD	1
D0AE	1
D18E	1
D0AF	1
D18F	1
D1A4	1
D1A5	1
D1A6	1
D1A7	1
D1AA	1
D1AB	1
D1A8	1
D1A9	1
D1AC	1
D1AD	1
D1AE	1
D1AF	1
D1B0	1
D1B1	1
D1B2	1
D1B3	1
D1B4	1
D1B5	1
D1B6	1
D1B7	1
D2A8	1
D2A9	1
D380	1
D4B1	1
D5A1	1
D4B2	1
D5A2	1
D4B3	1
D5A3	1
D4B4	1
D5A4	1
D4B5	1
D5A5	1
D687	1
D4B6	1
D5A6	1
D4B7	1
D5A7	1
D4B8	1
D5A8	1
D4B9	1
D5A9	1
D4BA	1
D5AA	1
D4BB	1
D5AB	1
D4BC	1
D5AC	1
D4BD	1
D5AD	1
D4BE	1
D5AE	1
D4BF	1
D5AF	1
D580	1
D5B0	1
D581	1
D5B1	1
D582	1
D5B2	1
D583	1
D5B3	1
D584	1
D5B4	1
D585	1
D5B5	1
D586	1
D5B6	1
D587	1
D5B7	1
D588	1
D5B8	1
D589	1
D5B9	1
D58A	1
D5BA	1
D58B	1
D5BB	1
D58C	1
D5BC	1
D58D	1
D5BD	1
D58E	1
D5BE	1
D58F	1
D5BF	1
D590	1
D680	1
D591	1
D681	1
D592	1
D682	1
D593	1
D683	1
D594	1
D684	1
D595	1
D685	1
D596	1
D686	1
D599	1
D790	1
D791	1
D792	1
D793	1
D794	1
D795	1
D7B0	1
D7B1	1
D796	1
D797	1
D798	1
D799	1
D7B2	1
D79A	1
D79B	1
D79C	1
D79D	1
D79E	1
D79F	1
D7A0	1
D7A1	1
D7A2	1
D7A3	1
D7A4	1
D7A5	1
D7A6	1
D7A7	1
D7A8	1
D7A9	1
D7AA	1
D8A1	1
D9B4	1
DBBD	1
D8A2	1
D8A3	1
D9B2	1
D9B1	1
D8A4	1
D8A5	1
D9B3	1
D8A6	1
D8A7	1
D9B5	1
D9AE	1
D8A8	1
D9BB	1
D9BE	1
DA80	1
D8A9	1
D8AA	1
D8AB	1
D9B9	1
D9BA	1
D9BC	1
D9BD	1
D9BF	1
D8AC	1
DA83	1
DA84	1
DA86	1
DABF	1
DA87	1
D8AD	1
D8AE	1
DA81	1
DA82	1
DA85	1
D8AF	1
D8B0	1
DA88	1
DA89	1
DA8A	1
DA8B	1
DA8C	1
DA8D	1
DA8E	1
DA8F	1
DA90	1
DBAE	1
D8B1	1
D8B2	1
DA91	1
DA92	1
DA93	1
DA94	1
DA95	1
DA96	1
DA97	1
DA98	1
DA99	1
DBAF	1
D8B3	1
D8B4	1
DA9A	1
DA9B	1
DA9C	1
DBBA	1
D8B5	1
D8B6	1
DA9D	1
DA9E	1
DBBB	1
D8B7	1
D8B8	1
DA9F	1
D8B9	1
D8BA	1
DAA0	1
DBBC	1
D981	1
DAA1	1
DAA2	1
DAA3	1
DAA4	1
DAA5	1
DAA6	1
D9AF	1
D982	1
DAA7	1
DAA8	1
D983	1
DAA9	1
DAAA	1
DAAB	1
DAAC	1
DAAD	1
DAAE	1
DAAF	1
DAB0	1
DAB1	1
DAB2	1
DAB3	1
DAB4	1
D984	1
DAB5	1
DAB6	1
DAB7	1
DAB8	1
D985	1
DBBE	1
D986	1
DABA	1
DABB	1
DABC	1
DABD	1
DAB9	1
D987	1
DABE	1
DB81	1
DB82	1
DB83	1
DBBF	1
DB80	1
DB95	1
D988	1
DBA5	1
D9B6	1
DB84	1
DB85	1
DB86	1
DB87	1
D9B7	1
DB88	1
DB89	1
DB8A	1
DB8B	1
DB8F	1
D989	1
D98A	1
DBA6	1
D9B8	1
DB8C	1
DB8D	1
DB8E	1
DB90	1
DB91	1
DB92	1
DB93	1
DC90	1
DC92	1
DCAD	1
DC93	1
DC94	1
DCAE	1
DC96	1
DC95	1
DCAF	1
DC97	1
DC98	1
DC99	1
DD8D	1
DC9A	1
DC9B	1
DC9C	1
DC9D	1
DC9E	1
DC9F	1
DD8E	1
DCA0	1
DCA1	1
DCA2	1
DCA3	1
DCA4	1
DCA5	1
DCA6	1
DCA7	1
DD8F	1
DCA8	1
DCA9	1
DCAA	1
DCAB	1
DCAC	1
DE80	1
DE99	1
DE9A	1
DE81	1
DE82	1
DE83	1
DE9C	1
DE84	1
DE85	1
DE86	1
DE87	1
DEA2	1
DEA3	1
DE88	1
DEA5	1
DE89	1
DE8A	1
DE8B	1
DE9B	1
DE8C	1
DE98	1
DEA0	1
DEA1	1
DE8D	1
DE8E	1
DEA4	1
DE8F	1
DE90	1
DE9D	1
DE9E	1
DE9F	1
DE91	1
DE92	1
DE93	1
DE94	1
DE95	1
DE96	1
DE97	1
DEB1	1
DEA6	1
DEA7	1
DEA8	1
DEA9	1
DEAA	1
DEAB	1
DEAC	1
DEAD	1
DEAE	1
DEAF	1
DEB0	1
E4B880	1
E4B881	1
E4B882	1
E4B883	1
E4B884	1
E4B885	1
E4B886	1
E4B887	1
E4B888	1
E4B889	1
E4B88A	1
E4B88B	1
E4B88C	1
E4B88D	1
E4B88E	1
E4B88F	1
E4B890	1
E4B891	1
E4B892	1
E4B893	1
E4B894	1
E4B895	1
E4B896	1
E4B897	1
E4B898	1
E4B899	1
E4B89A	1
E4B89B	1
E4B89C	1
E4B89D	1
E4B89E	1
E4B89F	1
E4B8A0	1
E4B8A1	1
E4B8A2	1
E4B8A3	1
E4B8A4	1
E4B8A5	1
E4B8A6	1
E4B8A7	1
E4B8A8	1
E4B8A9	1
E4B8AA	1
E4B8AB	1
E4B8AC	1
E4B8AD	1
E4B8AE	1
E4B8AF	1
E4B8B0	1
E4B8B1	1
E4B8B2	1
E4B8B3	1
E4B8B4	1
E4B8B5	1
E4B8B6	1
E4B8B7	1
E4B8B8	1
E4B8B9	1
E4B8BA	1
E4B8BB	1
E4B8BC	1
E4B8BD	1
E4B8BE	1
E4B8BF	1
E4B980	1
E4B981	1
E4B982	1
E4B983	1
E4B984	1
E4B985	1
E4B986	1
E4B987	1
E4B988	1
E4B989	1
E4B98A	1
E4B98B	1
E4B98C	1
E4B98D	1
E4B98E	1
E4B98F	1
E4B990	1
E4B991	1
E4B992	1
E4B993	1
E4B994	1
E4B995	1
E4B996	1
E4B997	1
E4B998	1
E4B999	1
E4B99A	1
E4B99B	1
E4B99C	1
E4B99D	1
E4B99E	1
E4B99F	1
E4B9A0	1
E4B9A1	1
E4B9A2	1
E4B9A3	1
E4B9A4	1
E4B9A5	1
E4B9A6	1
E4B9A7	1
E4B9A8	1
E4B9A9	1
E4B9AA	1
E4B9AB	1
E4B9AC	1
E4B9AD	1
E4B9AE	1
E4B9AF	1
E4B9B0	1
E4B9B1	1
E4B9B2	1
E4B9B3	1
E4B9B4	1
E4B9B5	1
E4B9B6	1
E4B9B7	1
E4B9B8	1
E4B9B9	1
E4B9BA	1
E4B9BB	1
E4B9BC	1
E4B9BD	1
E4B9BE	1
E4B9BF	1
E4BA80	1
E4BA81	1
E4BA82	1
E4BA83	1
E4BA84	1
E4BA85	1
E4BA86	1
E4BA87	1
E4BA88	1
E4BA89	1
E4BA8A	1
E4BA8B	1
E4BA8C	1
E4BA8D	1
E4BA8E	1
E4BA8F	1
E4BA90	1
E4BA91	1
E4BA92	1
E4BA93	1
E4BA94	1
E4BA95	1
E4BA96	1
E4BA97	1
E4BA98	1
E4BA99	1
E4BA9A	1
E4BA9B	1
E4BA9C	1
E4BA9D	1
E4BA9E	1
E4BA9F	1
E4BAA0	1
E4BAA1	1
E4BAA2	1
E4BAA3	1
E4BAA4	1
E4BAA5	1
E4BAA6	1
E4BAA7	1
E4BAA8	1
E4BAA9	1
E4BAAA	1
E4BAAB	1
E4BAAC	1
E4BAAD	1
E4BAAE	1
E4BAAF	1
E4BAB0	1
E4BAB1	1
E4BAB2	1
E4BAB3	1
E4BAB4	1
E4BAB5	1
E4BAB6	1
E4BAB7	1
E4BAB8	1
E4BAB9	1
E4BABA	1
E4BABB	1
E4BABC	1
E4BABD	1
E4BABE	1
E4BABF	1
E4BB80	1
E4BB81	1
E4BB82	1
E4BB83	1
E4BB84	1
E4BB85	1
E4BB86	1
E4BB87	1
E4BB88	1
E4BB89	1
E4BB8A	1
E4BB8B	1
E4BB8C	1
E4BB8D	1
E4BB8E	1
E4BB8F	1
E4BB90	1
E4BB91	1
E4BB92	1
E4BB93	1
E4BB94	1
E4BB95	1
E4BB96	1
E4BB97	1
E4BB98	1
E4BB99	1
E4BB9A	1
E4BB9B	1
E4BB9C	1
E4BB9D	1
E4BB9E	1
E4BB9F	1
E4BBA0	1
E4BBA1	1
E4BBA2	1
E4BBA3	1
E4BBA4	1
E4BBA5	1
E4BBA6	1
E4BBA7	1
E4BBA8	1
E4BBA9	1
E4BBAA	1
E4BBAB	1
E4BBAC	1
E4BBAD	1
E4BBAE	1
E4BBAF	1
E4BBB0	1
E4BBB1	1
E4BBB2	1
E4BBB3	1
E4BBB4	1
E4BBB5	1
E4BBB6	1
E4BBB7	1
E4BBB8	1
E4BBB9	1
E4BBBA	1
E4BBBB	1
E4BBBC	1
E4BBBD	1
E4BBBE	1
E4BBBF	1
E4BC80	1
E4BC81	1
E4BC82	1
E4BC83	1
E4BC84	1
E4BC85	1
E4BC86	1
E4BC87	1
E4BC88	1
E4BC89	1
E4BC8A	1
E4BC8B	1
E4BC8C	1
E4BC8D	1
E4BC8E	1
E4BC8F	1
E4BC90	1
E4BC91	1
E4BC92	1
E4BC93	1
E4BC94	1
E4BC95	1
E4BC96	1
E4BC97	1
E4BC98	1
E4BC99	1
E4BC9A	1
E4BC9B	1
E4BC9C	1
E4BC9D	1
E4BC9E	1
E4BC9F	1
E4BCA0	1
E4BCA1	1
E4BCA2	1
E4BCA3	1
E4BCA4	1
E4BCA5	1
E4BCA6	1
E4BCA7	1
E4BCA8	1
E4BCA9	1
E4BCAA	1
E4BCAB	1
E4BCAC	1
E4BCAD	1
E4BCAE	1
E4BCAF	1
E4BCB0	1
E4BCB1	1
E4BCB2	1
E4BCB3	1
E4BCB4	1
E4BCB5	1
E4BCB6	1
E4BCB7	1
E4BCB8	1
E4BCB9	1
E4BCBA	1
E4BCBB	1
E4BCBC	1
E4BCBD	1
E4BCBE	1
E4BCBF	1
E4BD80	1
E4BD81	1
E4BD82	1
E4BD83	1
E4BD84	1
E4BD85	1
E4BD86	1
E4BD87	1
E4BD88	1
E4BD89	1
E4BD8A	1
E4BD8B	1
E4BD8C	1
E4BD8D	1
E4BD8E	1
E4BD8F	1
E4BD90	1
E4BD91	1
E4BD92	1
E4BD93	1
E4BD94	1
E4BD95	1
E4BD96	1
E4BD97	1
E4BD98	1
E4BD99	1
E4BD9A	1
E4BD9B	1
E4BD9C	1
E4BD9D	1
E4BD9E	1
E4BD9F	1
E4BDA0	1
E4BDA1	1
E4BDA2	1
E4BDA3	1
E4BDA4	1
E4BDA5	1
E4BDA6	1
E4BDA7	1
E4BDA8	1
E4BDA9	1
E4BDAA	1
E4BDAB	1
E4BDAC	1
E4BDAD	1
E4BDAE	1
E4BDAF	1
E4BDB0	1
E4BDB1	1
E4BDB2	1
E4BDB3	1
E4BDB4	1
E4BDB5	1
E4BDB6	1
E4BDB7	1
E4BDB8	1
E4BDB9	1
E4BDBA	1
E4BDBB	1
E4BDBC	1
E4BDBD	1
E4BDBE	1
E4BDBF	1
E4BE80	1
E4BE81	1
E4BE82	1
E4BE83	1
E4BE84	1
E4BE85	1
E4BE86	1
E4BE87	1
E4BE88	1
E4BE89	1
E4BE8A	1
E4BE8B	1
E4BE8C	1
E4BE8D	1
E4BE8E	1
E4BE8F	1
E4BE90	1
E4BE91	1
E4BE92	1
E4BE93	1
E4BE94	1
E4BE95	1
E4BE96	1
E4BE97	1
E4BE98	1
E4BE99	1
E4BE9A	1
E4BE9B	1
E4BE9C	1
E4BE9D	1
E4BE9E	1
E4BE9F	1
E4BEA0	1
E4BEA1	1
E4BEA2	1
E4BEA3	1
E4BEA4	1
E4BEA5	1
E4BEA6	1
E4BEA7	1
E4BEA8	1
E4BEA9	1
E4BEAA	1
E4BEAB	1
E4BEAC	1
E4BEAD	1
E4BEAE	1
E4BEAF	1
E4BEB0	1
E4BEB1	1
E4BEB2	1
E4BEB3	1
E4BEB4	1
E4BEB5	1
E4BEB6	1
E4BEB7	1
E4BEB8	1
E4BEB9	1
E4BEBA	1
E4BEBB	1
E4BEBC	1
E4BEBD	1
E4BEBE	1
E4BEBF	1
E4BF80	1
E4BF81	1
E4BF82	1
E4BF83	1
E4BF84	1
E4BF85	1
E4BF86	1
E4BF87	1
E4BF88	1
E4BF89	1
E4BF8A	1
E4BF8B	1
E4BF8C	1
E4BF8D	1
E4BF8E	1
E4BF8F	1
E4BF90	1
E4BF91	1
E4BF92	1
E4BF93	1
E4BF94	1
E4BF95	1
E4BF96	1
E4BF97	1
E4BF98	1
E4BF99	1
E4BF9A	1
E4BF9B	1
E4BF9C	1
E4BF9D	1
E4BF9E	1
E4BF9F	1
E4BFA0	1
E4BFA1	1
E4BFA2	1
E4BFA3	1
E4BFA4	1
E4BFA5	1
E4BFA6	1
E4BFA7	1
E4BFA8	1
E4BFA9	1
E4BFAA	1
E4BFAB	1
E4BFAC	1
E4BFAD	1
E4BFAE	1
E4BFAF	1
E4BFB0	1
E4BFB1	1
E4BFB2	1
E4BFB3	1
E4BFB4	1
E4BFB5	1
E4BFB6	1
E4BFB7	1
E4BFB8	1
E4BFB9	1
E4BFBA	1
E4BFBB	1
E4BFBC	1
E4BFBD	1
E4BFBE	1
E4BFBF	1
C8B7	1
C8B8	1
C8B9	1
C8BA	1
C8BB	1
C8BC	1
C8BD	1
C8BE	1
C8BF	1
C980	1
C981	1
C982	1
C983	1
C984	1
C985	1
C986	1
C987	1
C988	1
C989	1
C98A	1
C98B	1
C98C	1
C98D	1
C98E	1
C98F	1
CD98	1
CD99	1
CD9A	1
CD9B	1
CD9C	1
CDB0	1
CDB1	1
CDB2	1
CDB3	1
CDB6	1
CDB7	1
CDB8	1
CDB9	1
CDBB	1
CDBC	1
CDBD	1
CDBF	1
CE80	1
CE81	1
CE82	1
CE83	1
CE8B	1
CE8D	1
CEA2	1
CF8F	1
CFBC	1
CFBD	1
CFBE	1
CFBF	1
D287	1
D38F	1
D3B6	1
D3B7	1
D3BA	1
D3BB	1
D3BC	1
D3BD	1
D3BE	1
D3BF	1
D490	1
D491	1
D492	1
D493	1
D494	1
D495	1
D496	1
D497	1
D498	1
D499	1
D49A	1
D49B	1
D49C	1
D49D	1
D49E	1
D49F	1
D4A0	1
D4A1	1
D4A2	1
D4A3	1
D4A4	1
D4A5	1
D4A6	1
D4A7	1
D4A8	1
D4A9	1
D4AA	1
D4AB	1
D4AC	1
D4AD	1
D4AE	1
D4AF	1
D4B0	1
D597	1
D598	1
D5A0	1
D688	1
D68B	1
D68C	1
D68D	1
D68E	1
D68F	1
D690	1
D6A2	1
D6BA	1
D785	1
D786	1
D787	1
D788	1
D789	1
D78A	1
D78B	1
D78C	1
D78D	1
D78E	1
D78F	1
D7AB	1
D7AC	1
D7AD	1
D7AE	1
D7AF	1
D7B5	1
D7B6	1
D7B7	1
D7B8	1
D7B9	1
D7BA	1
D7BB	1
D7BC	1
D7BD	1
D7BE	1
D7BF	1
D884	1
D885	1
D886	1
D887	1
D888	1
D889	1
D88A	1
D88B	1
D896	1
D897	1
D898	1
D899	1
D89A	1
D89C	1
D89D	1
D89E	1
D8A0	1
D8BB	1
D8BC	1
D8BD	1
D8BE	1
D8BF	1
D999	1
D99A	1
D99B	1
D99C	1
D99D	1
D99E	1
D99F	1
DC8E	1
DD8B	1
DD8C	1
DD90	1
DD91	1
DD92	1
DD93	1
DD94	1
DD95	1
DD96	1
DD97	1
DD98	1
DD99	1
DD9A	1
DD9B	1
DD9C	1
DD9D	1
DD9E	1
DD9F	1
DDA0	1
DDA1	1
DDA2	1
DDA3	1
DDA4	1
DDA5	1
DDA6	1
DDA7	1
DDA8	1
DDA9	1
DDAA	1
DDAB	1
DDAC	1
DDAD	1
DDAE	1
DDAF	1
DDB0	1
DDB1	1
DDB2	1
DDB3	1
DDB4	1
DDB5	1
DDB6	1
DDB7	1
DDB8	1
DDB9	1
DDBA	1
DDBB	1
DDBC	1
DDBD	1
DDBE	1
DDBF	1
DEB2	1
DEB3	1
DEB4	1
DEB5	1
DEB6	1
DEB7	1
DEB8	1
DEB9	1
DEBA	1
DEBB	1
DEBC	1
DEBD	1
DEBE	1
DEBF	1
DF80	1
DF81	1
DF82	1
DF83	1
DF84	1
DF85	1
DF86	1
DF87	1
DF88	1
DF89	1
DF8A	1
DF8B	1
DF8C	1
DF8D	1
DF8E	1
DF8F	1
DF90	1
DF91	1
DF92	1
DF93	1
DF94	1
DF95	1
DF96	1
DF97	1
DF98	1
DF99	1
DF9A	1
DF9B	1
DF9C	1
DF9D	1
DF9E	1
DF9F	1
DFA0	1
DFA1	1
DFA2	1
DFA3	1
DFA4	1
DFA5	1
DFA6	1
DFA7	1
DFA8	1
DFA9	1
DFAA	1
DFAB	1
DFAC	1
DFAD	1
DFAE	1
DFAF	1
DFB0	1
DFB1	1
DFB2	1
DFB3	1
DFB4	1
DFB5	1
DFB6	1
DFB7	1
DFB8	1
DFB9	1
DFBA	1
DFBB	1
DFBC	1
DFBD	1
DFBE	1
DFBF	1
DROP TABLE IF EXISTS test.t1;
DROP TABLE IF EXISTS test.t1;
DROP DATABASE test;
CREATE DATABASE test CHARACTER SET utf8mb3;
USE test;
CREATE TABLE test.t1 (a CHAR(4) CHARACTER SET utf8mb3 COLLATE utf8mb3_turkish_ci) ENGINE=MyISAM CHARACTER SET utf8mb3 COLLATE utf8mb3_turkish_ci;
Warnings:
Warning	1287	'utf8mb3' is deprecated and will be removed in a future release. Please use utf8mb4 instead
Warning	3778	'utf8mb3_turkish_ci' is a collation of the deprecated character set UTF8MB3. Please consider using UTF8MB4 with an appropriate collation instead.
Warning	1287	'utf8mb3' is deprecated and will be removed in a future release. Please use utf8mb4 instead
Warning	3778	'utf8mb3_turkish_ci' is a collation of the deprecated character set UTF8MB3. Please consider using UTF8MB4 with an appropriate collation instead.
SHOW TABLE STATUS LIKE 't1';
Name	Engine	Version	Row_format	Rows	Avg_row_length	Data_length	Max_data_length	Index_length	Data_free	Auto_increment	Create_time	Update_time	Check_time	Collation	Checksum	Create_options	Comment
t1	MyISAM	#	#	#	#	#	#	#	#	#	#	#	#	utf8mb3_turkish_ci	#	#	#
LOAD DATA INFILE 
'MYSQL_TEST_DIR/suite/funcs_2/data/charset_utf8.txt' INTO TABLE test.t1;
DELETE FROM test.t1 WHERE CHAR_LENGTH(a) <> 1;
SELECT HEX(ORD(a)) AS a_ord, CHAR_LENGTH(a) AS a_len FROM test.t1 ORDER BY a, ORD(a);
a_ord	a_len
C285	1
7F	1
C280	1
C281	1
C282	1
C283	1
C284	1
C286	1
C287	1
C288	1
C289	1
C28A	1
C28B	1
C28C	1
C28D	1
C28E	1
C28F	1
C290	1
C291	1
C292	1
C293	1
C294	1
C295	1
C296	1
C297	1
C298	1
C299	1
C29A	1
C29B	1
C29C	1
C29D	1
C29E	1
C29F	1
C2A0	1
CC80	1
CC81	1
CC82	1
CC83	1
CC84	1
CC85	1
CC86	1
CC87	1
CC88	1
CC89	1
CC8A	1
CC8B	1
CC8C	1
CC8D	1
CC8E	1
CC8F	1
CC90	1
CC91	1
CC92	1
CC93	1
CC94	1
CC95	1
CC96	1
CC97	1
CC98	1
CC99	1
CC9A	1
CC9B	1
CC9C	1
CC9D	1
CC9E	1
CC9F	1
CCA0	1
CCA1	1
CCA2	1
CCA3	1
CCA4	1
CCA5	1
CCA6	1
CCA7	1
CCA8	1
CCA9	1
CCAA	1
CCAB	1
CCAC	1
CCAD	1
CCAE	1
CCAF	1
CCB0	1
CCB1	1
CCB2	1
CCB3	1
CCB4	1
CCB5	1
CCB6	1
CCB7	1
CCB8	1
CCB9	1
CCBA	1
CCBB	1
CCBC	1
CCBD	1
CCBE	1
CCBF	1
CD80	1
CD81	1
CD82	1
CD83	1
CD84	1
CD85	1
CD86	1
CD87	1
CD88	1
CD89	1
CD8A	1
CD8B	1
CD8C	1
CD8D	1
CD8E	1
CD8F	1
CD90	1
CD91	1
CD92	1
CD93	1
CD94	1
CD95	1
CD96	1
CD97	1
CD9D	1
CD9E	1
CD9F	1
CDA0	1
CDA1	1
CDA2	1
D283	1
D284	1
D285	1
D286	1
D288	1
D289	1
D691	1
D692	1
D693	1
D694	1
D695	1
D696	1
D697	1
D698	1
D699	1
D69A	1
D69B	1
D69C	1
D69D	1
D69E	1
D69F	1
D6A0	1
D6A1	1
D6A3	1
D6A4	1
D6A5	1
D6A6	1
D6A7	1
D6A8	1
D6A9	1
D6AA	1
D6AB	1
D6AC	1
D6AD	1
D6AE	1
D6AF	1
D6B0	1
D6B1	1
D6B2	1
D6B3	1
D6B4	1
D6B5	1
D6B6	1
D6B7	1
D6B8	1
D6B9	1
D6BB	1
D6BC	1
D6BD	1
D6BF	1
D781	1
D782	1
D784	1
D880	1
D881	1
D882	1
D883	1
D890	1
D891	1
D892	1
D893	1
D894	1
D895	1
D98B	1
D98C	1
D98D	1
D98E	1
D98F	1
D990	1
D991	1
D992	1
D993	1
D994	1
D995	1
D996	1
D997	1
D998	1
D9B0	1
DB96	1
DB97	1
DB98	1
DB99	1
DB9A	1
DB9B	1
DB9C	1
DB9D	1
DB9E	1
DB9F	1
DBA0	1
DBA1	1
DBA2	1
DBA3	1
DBA4	1
DBA7	1
DBA8	1
DBAA	1
DBAB	1
DBAC	1
DBAD	1
DC8F	1
DC91	1
DCB0	1
DCB1	1
DCB2	1
DCB3	1
DCB4	1
DCB5	1
DCB6	1
DCB7	1
DCB8	1
DCB9	1
DCBA	1
DCBB	1
DCBC	1
DCBD	1
DCBE	1
DCBF	1
DD80	1
DD81	1
DD82	1
DD83	1
DD84	1
DD85	1
DD86	1
DD87	1
DD88	1
DD89	1
DD8A	1
D980	1
60	1
C2B4	1
CE84	1
CB9C	1
5E	1
C2AF	1
CB98	1
CB99	1
C2A8	1
CE85	1
CB9A	1
CB9D	1
C2B8	1
CB9B	1
5F	1
C2AD	1
2D	1
D68A	1
2C	1
D59D	1
D88C	1
D88D	1
D9AB	1
D9AC	1
3B	1
CDBE	1
D89B	1
3A	1
D689	1
DC83	1
DC84	1
DC85	1
DC86	1
DC87	1
DC88	1
21	1
C2A1	1
D59C	1
3F	1
C2BF	1
D59E	1
D89F	1
DC89	1
2E	1
DB94	1
DC81	1
DC82	1
C2B7	1
CE87	1
DC80	1
27	1
22	1
C2AB	1
C2BB	1
28	1
29	1
5B	1
7B	1
7D	1
C2A7	1
C2B6	1
C2A9	1
C2AE	1
40	1
2A	1
D9AD	1
2F	1
26	1
23	1
25	1
D9AA	1
D59A	1
D59B	1
D59F	1
D6BE	1
D780	1
D783	1
D7B3	1
D7B4	1
DC8A	1
DC8B	1
DC8C	1
DC8D	1
CAB9	1
CDB4	1
CDB5	1
CABA	1
CB82	1
CB83	1
CB84	1
CB85	1
CB86	1
CB87	1
CB88	1
CB89	1
CB8A	1
CB8B	1
CB8C	1
CB8D	1
CB8E	1
CB8F	1
CB92	1
CB93	1
CB94	1
CB95	1
CB96	1
CB97	1
CB9E	1
CB9F	1
CBA5	1
CBA6	1
CBA7	1
CBA8	1
CBA9	1
CBAA	1
CBAB	1
CBAC	1
CBAD	1
CBAF	1
CBB0	1
CBB1	1
CBB2	1
CBB3	1
CBB4	1
CBB5	1
CBB6	1
CBB7	1
CBB8	1
CBB9	1
CBBA	1
CBBB	1
CBBC	1
CBBD	1
CBBE	1
CBBF	1
C2B0	1
D282	1
D88E	1
D88F	1
DBA9	1
CFB6	1
2B	1
C2B1	1
C3B7	1
C397	1
3C	1
3D	1
3E	1
C2AC	1
7C	1
C2A6	1
7E	1
CB90	1
CB91	1
C2A4	1
C2A2	1
24	1
C2A3	1
C2A5	1
30	1
D9A0	1
DBB0	1
31	1
C2B9	1
D9A1	1
DBB1	1
C2BD	1
C2BC	1
32	1
C2B2	1
D9A2	1
DBB2	1
33	1
C2B3	1
D9A3	1
DBB3	1
C2BE	1
34	1
D9A4	1
DBB4	1
35	1
D9A5	1
DBB5	1
36	1
D9A6	1
DBB6	1
37	1
D9A7	1
DBB7	1
38	1
D9A8	1
DBB8	1
39	1
D9A9	1
DBB9	1
41	1
61	1
C2AA	1
C380	1
C381	1
C382	1
C383	1
C384	1
C385	1
C3A0	1
C3A1	1
C3A2	1
C3A3	1
C3A4	1
C3A5	1
C480	1
C481	1
C482	1
C483	1
C484	1
C485	1
C78D	1
C78E	1
C79E	1
C79F	1
C7A0	1
C7A1	1
C7BA	1
C7BB	1
C880	1
C881	1
C882	1
C883	1
C8A6	1
C8A7	1
CDA3	1
C386	1
C3A6	1
C7A2	1
C7A3	1
C7BC	1
C7BD	1
C990	1
C991	1
C992	1
42	1
62	1
CA99	1
C680	1
C681	1
C993	1
C682	1
C683	1
43	1
63	1
C486	1
C487	1
C488	1
C489	1
C48A	1
C48B	1
C48C	1
C48D	1
CDA8	1
C387	1
C3A7	1
C687	1
C688	1
C995	1
44	1
64	1
C48E	1
C48F	1
CDA9	1
C784	1
C785	1
C786	1
C7B1	1
C7B2	1
C7B3	1
CAA3	1
CAA5	1
CAA4	1
C490	1
C491	1
C689	1
C996	1
C68A	1
C997	1
C68B	1
C68C	1
C8A1	1
C390	1
C3B0	1
45	1
65	1
C388	1
C389	1
C38A	1
C38B	1
C3A8	1
C3A9	1
C3AA	1
C3AB	1
C492	1
C493	1
C494	1
C495	1
C496	1
C497	1
C498	1
C499	1
C49A	1
C49B	1
C884	1
C885	1
C886	1
C887	1
C8A8	1
C8A9	1
CDA4	1
C68E	1
C79D	1
C68F	1
C999	1
C690	1
C99B	1
C998	1
C99A	1
C99C	1
C99D	1
C99E	1
CA9A	1
C9A4	1
46	1
66	1
CAA9	1
C691	1
C692	1
47	1
67	1
C49C	1
C49D	1
C4A0	1
C4A1	1
C4A2	1
C4A3	1
C7A6	1
C7A7	1
C7B4	1
C7B5	1
C49E	1
C49F	1
C9A1	1
C9A2	1
C7A4	1
C7A5	1
C693	1
C9A0	1
CA9B	1
C694	1
C9A3	1
CBA0	1
C6A2	1
C6A3	1
48	1
68	1
C4A4	1
C4A5	1
C89E	1
C89F	1
CAB0	1
CDAA	1
49	1
C4B1	1
CA9C	1
C695	1
C7B6	1
C4A6	1
C4A7	1
C9A6	1
CAB1	1
C9A7	1
CABB	1
CABD	1
69	1
C38C	1
C38D	1
C38E	1
C38F	1
C3AC	1
C3AD	1
C3AE	1
C3AF	1
C4A8	1
C4A9	1
C4AA	1
C4AB	1
C4AC	1
C4AD	1
C4AE	1
C4AF	1
C4B0	1
C78F	1
C790	1
C888	1
C889	1
C88A	1
C88B	1
CDA5	1
C4B2	1
C4B3	1
C9AA	1
C697	1
C9A8	1
C696	1
C9A9	1
4A	1
6A	1
C4B4	1
C4B5	1
C7B0	1
CAB2	1
CA9D	1
C99F	1
CA84	1
4B	1
6B	1
C4B6	1
C4B7	1
C7A8	1
C7A9	1
C698	1
C699	1
CA9E	1
4C	1
6C	1
C4B9	1
C4BA	1
C4BB	1
C4BC	1
C4BD	1
C4BE	1
CBA1	1
C4BF	1
C580	1
C787	1
C788	1
C789	1
CAAA	1
CAAB	1
CA9F	1
C581	1
C582	1
C69A	1
C9AB	1
C9AC	1
C9AD	1
C8B4	1
C9AE	1
C69B	1
CA8E	1
4D	1
6D	1
CDAB	1
C9B1	1
4E	1
6E	1
C391	1
C3B1	1
C583	1
C584	1
C585	1
C586	1
C587	1
C588	1
C7B8	1
C7B9	1
C78A	1
C78B	1
C78C	1
C9B4	1
C69D	1
C9B2	1
C69E	1
C8A0	1
C9B3	1
C8B5	1
C58A	1
C58B	1
4F	1
6F	1
C2BA	1
C392	1
C393	1
C394	1
C395	1
C3B2	1
C3B3	1
C3B4	1
C3B5	1
C58C	1
C58D	1
C58E	1
C58F	1
C590	1
C591	1
C6A0	1
C6A1	1
C791	1
C792	1
C7AA	1
C7AB	1
C7AC	1
C7AD	1
C88C	1
C88D	1
C88E	1
C88F	1
C8AA	1
C8AB	1
C8AC	1
C8AD	1
C8AE	1
C8AF	1
C8B0	1
C8B1	1
CDA6	1
C592	1
C593	1
C396	1
C3B6	1
C9B6	1
C398	1
C3B8	1
C7BE	1
C7BF	1
C686	1
C994	1
C69F	1
C9B5	1
C9B7	1
C8A2	1
C8A3	1
50	1
70	1
C6A4	1
C6A5	1
C9B8	1
51	1
71	1
CAA0	1
C4B8	1
52	1
72	1
C594	1
C595	1
C596	1
C597	1
C598	1
C599	1
C890	1
C891	1
C892	1
C893	1
CAB3	1
CDAC	1
C6A6	1
CA80	1
C9B9	1
CAB4	1
C9BA	1
C9BB	1
CAB5	1
C9BC	1
C9BD	1
C9BE	1
C9BF	1
CA81	1
CAB6	1
53	1
73	1
C59A	1
C59B	1
C59C	1
C59D	1
C5A0	1
C5A1	1
C5BF	1
C898	1
C899	1
CBA2	1
C39F	1
C59E	1
C59F	1
CA82	1
C6A9	1
CA83	1
C6AA	1
CA85	1
CA86	1
54	1
74	1
C5A2	1
C5A3	1
C5A4	1
C5A5	1
C89A	1
C89B	1
CDAD	1
CAA8	1
C6BE	1
CAA6	1
CAA7	1
C5A6	1
C5A7	1
C6AB	1
C6AC	1
C6AD	1
C6AE	1
CA88	1
C8B6	1
CA87	1
55	1
75	1
C399	1
C39A	1
C39B	1
C3B9	1
C3BA	1
C3BB	1
C5A8	1
C5A9	1
C5AA	1
C5AB	1
C5AC	1
C5AD	1
C5AE	1
C5AF	1
C5B0	1
C5B1	1
C5B2	1
C5B3	1
C6AF	1
C6B0	1
C793	1
C794	1
C795	1
C796	1
C797	1
C798	1
C799	1
C79A	1
C79B	1
C79C	1
C894	1
C895	1
C896	1
C897	1
CDA7	1
C39C	1
C3BC	1
CA89	1
C9A5	1
CAAE	1
CAAF	1
C69C	1
C9AF	1
C9B0	1
C6B1	1
CA8A	1
56	1
76	1
CDAE	1
C6B2	1
CA8B	1
CA8C	1
57	1
77	1
C5B4	1
C5B5	1
CAB7	1
CA8D	1
58	1
78	1
CBA3	1
CDAF	1
59	1
79	1
C39D	1
C3BD	1
C3BF	1
C5B6	1
C5B7	1
C5B8	1
C8B2	1
C8B3	1
CAB8	1
CA8F	1
C6B3	1
C6B4	1
5A	1
7A	1
C5B9	1
C5BA	1
C5BB	1
C5BC	1
C5BD	1
C5BE	1
C68D	1
C6B5	1
C6B6	1
C8A4	1
C8A5	1
CA90	1
CA91	1
C6B7	1
C7AE	1
C7AF	1
CA92	1
C6B8	1
C6B9	1
C6BA	1
CA93	1
C89C	1
C89D	1
C39E	1
C3BE	1
C6BF	1
C7B7	1
C6BB	1
C6A7	1
C6A8	1
C6BC	1
C6BD	1
C684	1
C685	1
CA94	1
CB80	1
CABC	1
C589	1
CBAE	1
CABE	1
CA95	1
CBA4	1
CABF	1
CB81	1
CAA1	1
CAA2	1
CA96	1
C780	1
C781	1
C782	1
C783	1
CA97	1
CA98	1
CAAC	1
CAAD	1
CE86	1
CE91	1
CEAC	1
CEB1	1
CE92	1
CEB2	1
CF90	1
CE93	1
CEB3	1
CE94	1
CEB4	1
CE88	1
CE95	1
CEAD	1
CEB5	1
CFB5	1
CF9C	1
CF9D	1
CF9A	1
CF9B	1
CE96	1
CEB6	1
CE89	1
CE97	1
CEAE	1
CEB7	1
CE98	1
CEB8	1
CF91	1
CFB4	1
CDBA	1
CE8A	1
CE90	1
CE99	1
CEAA	1
CEAF	1
CEB9	1
CF8A	1
CFB3	1
CE9A	1
CEBA	1
CFB0	1
CF97	1
CE9B	1
CEBB	1
C2B5	1
CE9C	1
CEBC	1
CE9D	1
CEBD	1
CE9E	1
CEBE	1
CE8C	1
CE9F	1
CEBF	1
CF8C	1
CEA0	1
CF80	1
CF96	1
CF9E	1
CF9F	1
CF98	1
CF99	1
CEA1	1
CF81	1
CFB1	1
CEA3	1
CF82	1
CF83	1
CFB2	1
CFB9	1
CEA4	1
CF84	1
CE8E	1
CEA5	1
CEAB	1
CEB0	1
CF85	1
CF8B	1
CF8D	1
CF92	1
CF93	1
CF94	1
CEA6	1
CF86	1
CF95	1
CEA7	1
CF87	1
CEA8	1
CF88	1
CE8F	1
CEA9	1
CF89	1
CF8E	1
CFA0	1
CFA1	1
CFB7	1
CFB8	1
CFBA	1
CFBB	1
CFA2	1
CFA3	1
CFA4	1
CFA5	1
CFA6	1
CFA7	1
CFA8	1
CFA9	1
CFAA	1
CFAB	1
CFAC	1
CFAD	1
CFAE	1
CFAF	1
D090	1
D0B0	1
D390	1
D391	1
D392	1
D393	1
D398	1
D399	1
D39A	1
D39B	1
D394	1
D395	1
D091	1
D0B1	1
D092	1
D0B2	1
D093	1
D0B3	1
D290	1
D291	1
D292	1
D293	1
D294	1
D295	1
D094	1
D0B4	1
D480	1
D481	1
D082	1
D192	1
D482	1
D483	1
D083	1
D193	1
D298	1
D299	1
D080	1
D081	1
D095	1
D0B5	1
D190	1
D191	1
D396	1
D397	1
D084	1
D194	1
D096	1
D0B6	1
D381	1
D382	1
D39C	1
D39D	1
D296	1
D297	1
D097	1
D0B7	1
D484	1
D485	1
D39E	1
D39F	1
D085	1
D195	1
D3A0	1
D3A1	1
D486	1
D487	1
D08D	1
D098	1
D0B8	1
D19D	1
D3A2	1
D3A3	1
D28A	1
D28B	1
D3A4	1
D3A5	1
D086	1
D196	1
D087	1
D197	1
D099	1
D0B9	1
D088	1
D198	1
D09A	1
D0BA	1
D29A	1
D29B	1
D383	1
D384	1
D2A0	1
D2A1	1
D29E	1
D29F	1
D29C	1
D29D	1
D09B	1
D0BB	1
D385	1
D386	1
D089	1
D199	1
D488	1
D489	1
D09C	1
D0BC	1
D38D	1
D38E	1
D09D	1
D0BD	1
D389	1
D38A	1
D2A2	1
D2A3	1
D387	1
D388	1
D2A4	1
D2A5	1
D08A	1
D19A	1
D48A	1
D48B	1
D09E	1
D0BE	1
D3A6	1
D3A7	1
D3A8	1
D3A9	1
D3AA	1
D3AB	1
D09F	1
D0BF	1
D2A6	1
D2A7	1
D280	1
D281	1
D0A0	1
D180	1
D28E	1
D28F	1
D0A1	1
D181	1
D48C	1
D48D	1
D2AA	1
D2AB	1
D0A2	1
D182	1
D48E	1
D48F	1
D2AC	1
D2AD	1
D08B	1
D19B	1
D08C	1
D19C	1
D0A3	1
D183	1
D3AE	1
D3AF	1
D08E	1
D19E	1
D3B0	1
D3B1	1
D3B2	1
D3B3	1
D2AE	1
D2AF	1
D2B0	1
D2B1	1
D1B8	1
D1B9	1
D0A4	1
D184	1
D0A5	1
D185	1
D2B2	1
D2B3	1
D2BA	1
D2BB	1
D1A0	1
D1A1	1
D1BE	1
D1BF	1
D1BC	1
D1BD	1
D1BA	1
D1BB	1
D0A6	1
D186	1
D2B4	1
D2B5	1
D0A7	1
D187	1
D3B4	1
D3B5	1
D2B6	1
D2B7	1
D38B	1
D38C	1
D2B8	1
D2B9	1
D2BC	1
D2BD	1
D2BE	1
D2BF	1
D08F	1
D19F	1
D0A8	1
D188	1
D0A9	1
D189	1
D0AA	1
D18A	1
D0AB	1
D18B	1
D3B8	1
D3B9	1
D0AC	1
D18C	1
D28C	1
D28D	1
D1A2	1
D1A3	1
D0AD	1
D18D	1
D3AC	1
D3AD	1
D0AE	1
D18E	1
D0AF	1
D18F	1
D1A4	1
D1A5	1
D1A6	1
D1A7	1
D1AA	1
D1AB	1
D1A8	1
D1A9	1
D1AC	1
D1AD	1
D1AE	1
D1AF	1
D1B0	1
D1B1	1
D1B2	1
D1B3	1
D1B4	1
D1B5	1
D1B6	1
D1B7	1
D2A8	1
D2A9	1
D380	1
D4B1	1
D5A1	1
D4B2	1
D5A2	1
D4B3	1
D5A3	1
D4B4	1
D5A4	1
D4B5	1
D5A5	1
D687	1
D4B6	1
D5A6	1
D4B7	1
D5A7	1
D4B8	1
D5A8	1
D4B9	1
D5A9	1
D4BA	1
D5AA	1
D4BB	1
D5AB	1
D4BC	1
D5AC	1
D4BD	1
D5AD	1
D4BE	1
D5AE	1
D4BF	1
D5AF	1
D580	1
D5B0	1
D581	1
D5B1	1
D582	1
D5B2	1
D583	1
D5B3	1
D584	1
D5B4	1
D585	1
D5B5	1
D586	1
D5B6	1
D587	1
D5B7	1
D588	1
D5B8	1
D589	1
D5B9	1
D58A	1
D5BA	1
D58B	1
D5BB	1
D58C	1
D5BC	1
D58D	1
D5BD	1
D58E	1
D5BE	1
D58F	1
D5BF	1
D590	1
D680	1
D591	1
D681	1
D592	1
D682	1
D593	1
D683	1
D594	1
D684	1
D595	1
D685	1
D596	1
D686	1
D599	1
D790	1
D791	1
D792	1
D793	1
D794	1
D795	1
D7B0	1
D7B1	1
D796	1
D797	1
D798	1
D799	1
D7B2	1
D79A	1
D79B	1
D79C	1
D79D	1
D79E	1
D79F	1
D7A0	1
D7A1	1
D7A2	1
D7A3	1
D7A4	1
D7A5	1
D7A6	1
D7A7	1
D7A8	1
D7A9	1
D7AA	1
D8A1	1
D9B4	1
DBBD	1
D8A2	1
D8A3	1
D9B2	1
D9B1	1
D8A4	1
D8A5	1
D9B3	1
D8A6	1
D8A7	1
D9B5	1
D9AE	1
D8A8	1
D9BB	1
D9BE	1
DA80	1
D8A9	1
D8AA	1
D8AB	1
D9B9	1
D9BA	1
D9BC	1
D9BD	1
D9BF	1
D8AC	1
DA83	1
DA84	1
DA86	1
DABF	1
DA87	1
D8AD	1
D8AE	1
DA81	1
DA82	1
DA85	1
D8AF	1
D8B0	1
DA88	1
DA89	1
DA8A	1
DA8B	1
DA8C	1
DA8D	1
DA8E	1
DA8F	1
DA90	1
DBAE	1
D8B1	1
D8B2	1
DA91	1
DA92	1
DA93	1
DA94	1
DA95	1
DA96	1
DA97	1
DA98	1
DA99	1
DBAF	1
D8B3	1
D8B4	1
DA9A	1
DA9B	1
DA9C	1
DBBA	1
D8B5	1
D8B6	1
DA9D	1
DA9E	1
DBBB	1
D8B7	1
D8B8	1
DA9F	1
D8B9	1
D8BA	1
DAA0	1
DBBC	1
D981	1
DAA1	1
DAA2	1
DAA3	1
DAA4	1
DAA5	1
DAA6	1
D9AF	1
D982	1
DAA7	1
DAA8	1
D983	1
DAA9	1
DAAA	1
DAAB	1
DAAC	1
DAAD	1
DAAE	1
DAAF	1
DAB0	1
DAB1	1
DAB2	1
DAB3	1
DAB4	1
D984	1
DAB5	1
DAB6	1
DAB7	1
DAB8	1
D985	1
DBBE	1
D986	1
DABA	1
DABB	1
DABC	1
DABD	1
DAB9	1
D987	1
DABE	1
DB81	1
DB82	1
DB83	1
DBBF	1
DB80	1
DB95	1
D988	1
DBA5	1
D9B6	1
DB84	1
DB85	1
DB86	1
DB87	1
D9B7	1
DB88	1
DB89	1
DB8A	1
DB8B	1
DB8F	1
D989	1
D98A	1
DBA6	1
D9B8	1
DB8C	1
DB8D	1
DB8E	1
DB90	1
DB91	1
DB92	1
DB93	1
DC90	1
DC92	1
DCAD	1
DC93	1
DC94	1
DCAE	1
DC96	1
DC95	1
DCAF	1
DC97	1
DC98	1
DC99	1
DD8D	1
DC9A	1
DC9B	1
DC9C	1
DC9D	1
DC9E	1
DC9F	1
DD8E	1
DCA0	1
DCA1	1
DCA2	1
DCA3	1
DCA4	1
DCA5	1
DCA6	1
DCA7	1
DD8F	1
DCA8	1
DCA9	1
DCAA	1
DCAB	1
DCAC	1
DE80	1
DE99	1
DE9A	1
DE81	1
DE82	1
DE83	1
DE9C	1
DE84	1
DE85	1
DE86	1
DE87	1
DEA2	1
DEA3	1
DE88	1
DEA5	1
DE89	1
DE8A	1
DE8B	1
DE9B	1
DE8C	1
DE98	1
DEA0	1
DEA1	1
DE8D	1
DE8E	1
DEA4	1
DE8F	1
DE90	1
DE9D	1
DE9E	1
DE9F	1
DE91	1
DE92	1
DE93	1
DE94	1
DE95	1
DE96	1
DE97	1
DEB1	1
DEA6	1
DEA7	1
DEA8	1
DEA9	1
DEAA	1
DEAB	1
DEAC	1
DEAD	1
DEAE	1
DEAF	1
DEB0	1
E4B880	1
E4B881	1
E4B882	1
E4B883	1
E4B884	1
E4B885	1
E4B886	1
E4B887	1
E4B888	1
E4B889	1
E4B88A	1
E4B88B	1
E4B88C	1
E4B88D	1
E4B88E	1
E4B88F	1
E4B890	1
E4B891	1
E4B892	1
E4B893	1
E4B894	1
E4B895	1
E4B896	1
E4B897	1
E4B898	1
E4B899	1
E4B89A	1
E4B89B	1
E4B89C	1
E4B89D	1
E4B89E	1
E4B89F	1
E4B8A0	1
E4B8A1	1
E4B8A2	1
E4B8A3	1
E4B8A4	1
E4B8A5	1
E4B8A6	1
E4B8A7	1
E4B8A8	1
E4B8A9	1
E4B8AA	1
E4B8AB	1
E4B8AC	1
E4B8AD	1
E4B8AE	1
E4B8AF	1
E4B8B0	1
E4B8B1	1
E4B8B2	1
E4B8B3	1
E4B8B4	1
E4B8B5	1
E4B8B6	1
E4B8B7	1
E4B8B8	1
E4B8B9	1
E4B8BA	1
E4B8BB	1
E4B8BC	1
E4B8BD	1
E4B8BE	1
E4B8BF	1
E4B980	1
E4B981	1
E4B982	1
E4B983	1
E4B984	1
E4B985	1
E4B986	1
E4B987	1
E4B988	1
E4B989	1
E4B98A	1
E4B98B	1
E4B98C	1
E4B98D	1
E4B98E	1
E4B98F	1
E4B990	1
E4B991	1
E4B992	1
E4B993	1
E4B994	1
E4B995	1
E4B996	1
E4B997	1
E4B998	1
E4B999	1
E4B99A	1
E4B99B	1
E4B99C	1
E4B99D	1
E4B99E	1
E4B99F	1
E4B9A0	1
E4B9A1	1
E4B9A2	1
E4B9A3	1
E4B9A4	1
E4B9A5	1
E4B9A6	1
E4B9A7	1
E4B9A8	1
E4B9A9	1
E4B9AA	1
E4B9AB	1
E4B9AC	1
E4B9AD	1
E4B9AE	1
E4B9AF	1
E4B9B0	1
E4B9B1	1
E4B9B2	1
E4B9B3	1
E4B9B4	1
E4B9B5	1
E4B9B6	1
E4B9B7	1
E4B9B8	1
E4B9B9	1
E4B9BA	1
E4B9BB	1
E4B9BC	1
E4B9BD	1
E4B9BE	1
E4B9BF	1
E4BA80	1
E4BA81	1
E4BA82	1
E4BA83	1
E4BA84	1
E4BA85	1
E4BA86	1
E4BA87	1
E4BA88	1
E4BA89	1
E4BA8A	1
E4BA8B	1
E4BA8C	1
E4BA8D	1
E4BA8E	1
E4BA8F	1
E4BA90	1
E4BA91	1
E4BA92	1
E4BA93	1
E4BA94	1
E4BA95	1
E4BA96	1
E4BA97	1
E4BA98	1
E4BA99	1
E4BA9A	1
E4BA9B	1
E4BA9C	1
E4BA9D	1
E4BA9E	1
E4BA9F	1
E4BAA0	1
E4BAA1	1
E4BAA2	1
E4BAA3	1
E4BAA4	1
E4BAA5	1
E4BAA6	1
E4BAA7	1
E4BAA8	1
E4BAA9	1
E4BAAA	1
E4BAAB	1
E4BAAC	1
E4BAAD	1
E4BAAE	1
E4BAAF	1
E4BAB0	1
E4BAB1	1
E4BAB2	1
E4BAB3	1
E4BAB4	1
E4BAB5	1
E4BAB6	1
E4BAB7	1
E4BAB8	1
E4BAB9	1
E4BABA	1
E4BABB	1
E4BABC	1
E4BABD	1
E4BABE	1
E4BABF	1
E4BB80	1
E4BB81	1
E4BB82	1
E4BB83	1
E4BB84	1
E4BB85	1
E4BB86	1
E4BB87	1
E4BB88	1
E4BB89	1
E4BB8A	1
E4BB8B	1
E4BB8C	1
E4BB8D	1
E4BB8E	1
E4BB8F	1
E4BB90	1
E4BB91	1
E4BB92	1
E4BB93	1
E4BB94	1
E4BB95	1
E4BB96	1
E4BB97	1
E4BB98	1
E4BB99	1
E4BB9A	1
E4BB9B	1
E4BB9C	1
E4BB9D	1
E4BB9E	1
E4BB9F	1
E4BBA0	1
E4BBA1	1
E4BBA2	1
E4BBA3	1
E4BBA4	1
E4BBA5	1
E4BBA6	1
E4BBA7	1
E4BBA8	1
E4BBA9	1
E4BBAA	1
E4BBAB	1
E4BBAC	1
E4BBAD	1
E4BBAE	1
E4BBAF	1
E4BBB0	1
E4BBB1	1
E4BBB2	1
E4BBB3	1
E4BBB4	1
E4BBB5	1
E4BBB6	1
E4BBB7	1
E4BBB8	1
E4BBB9	1
E4BBBA	1
E4BBBB	1
E4BBBC	1
E4BBBD	1
E4BBBE	1
E4BBBF	1
E4BC80	1
E4BC81	1
E4BC82	1
E4BC83	1
E4BC84	1
E4BC85	1
E4BC86	1
E4BC87	1
E4BC88	1
E4BC89	1
E4BC8A	1
E4BC8B	1
E4BC8C	1
E4BC8D	1
E4BC8E	1
E4BC8F	1
E4BC90	1
E4BC91	1
E4BC92	1
E4BC93	1
E4BC94	1
E4BC95	1
E4BC96	1
E4BC97	1
E4BC98	1
E4BC99	1
E4BC9A	1
E4BC9B	1
E4BC9C	1
E4BC9D	1
E4BC9E	1
E4BC9F	1
E4BCA0	1
E4BCA1	1
E4BCA2	1
E4BCA3	1
E4BCA4	1
E4BCA5	1
E4BCA6	1
E4BCA7	1
E4BCA8	1
E4BCA9	1
E4BCAA	1
E4BCAB	1
E4BCAC	1
E4BCAD	1
E4BCAE	1
E4BCAF	1
E4BCB0	1
E4BCB1	1
E4BCB2	1
E4BCB3	1
E4BCB4	1
E4BCB5	1
E4BCB6	1
E4BCB7	1
E4BCB8	1
E4BCB9	1
E4BCBA	1
E4BCBB	1
E4BCBC	1
E4BCBD	1
E4BCBE	1
E4BCBF	1
E4BD80	1
E4BD81	1
E4BD82	1
E4BD83	1
E4BD84	1
E4BD85	1
E4BD86	1
E4BD87	1
E4BD88	1
E4BD89	1
E4BD8A	1
E4BD8B	1
E4BD8C	1
E4BD8D	1
E4BD8E	1
E4BD8F	1
E4BD90	1
E4BD91	1
E4BD92	1
E4BD93	1
E4BD94	1
E4BD95	1
E4BD96	1
E4BD97	1
E4BD98	1
E4BD99	1
E4BD9A	1
E4BD9B	1
E4BD9C	1
E4BD9D	1
E4BD9E	1
E4BD9F	1
E4BDA0	1
E4BDA1	1
E4BDA2	1
E4BDA3	1
E4BDA4	1
E4BDA5	1
E4BDA6	1
E4BDA7	1
E4BDA8	1
E4BDA9	1
E4BDAA	1
E4BDAB	1
E4BDAC	1
E4BDAD	1
E4BDAE	1
E4BDAF	1
E4BDB0	1
E4BDB1	1
E4BDB2	1
E4BDB3	1
E4BDB4	1
E4BDB5	1
E4BDB6	1
E4BDB7	1
E4BDB8	1
E4BDB9	1
E4BDBA	1
E4BDBB	1
E4BDBC	1
E4BDBD	1
E4BDBE	1
E4BDBF	1
E4BE80	1
E4BE81	1
E4BE82	1
E4BE83	1
E4BE84	1
E4BE85	1
E4BE86	1
E4BE87	1
E4BE88	1
E4BE89	1
E4BE8A	1
E4BE8B	1
E4BE8C	1
E4BE8D	1
E4BE8E	1
E4BE8F	1
E4BE90	1
E4BE91	1
E4BE92	1
E4BE93	1
E4BE94	1
E4BE95	1
E4BE96	1
E4BE97	1
E4BE98	1
E4BE99	1
E4BE9A	1
E4BE9B	1
E4BE9C	1
E4BE9D	1
E4BE9E	1
E4BE9F	1
E4BEA0	1
E4BEA1	1
E4BEA2	1
E4BEA3	1
E4BEA4	1
E4BEA5	1
E4BEA6	1
E4BEA7	1
E4BEA8	1
E4BEA9	1
E4BEAA	1
E4BEAB	1
E4BEAC	1
E4BEAD	1
E4BEAE	1
E4BEAF	1
E4BEB0	1
E4BEB1	1
E4BEB2	1
E4BEB3	1
E4BEB4	1
E4BEB5	1
E4BEB6	1
E4BEB7	1
E4BEB8	1
E4BEB9	1
E4BEBA	1
E4BEBB	1
E4BEBC	1
E4BEBD	1
E4BEBE	1
E4BEBF	1
E4BF80	1
E4BF81	1
E4BF82	1
E4BF83	1
E4BF84	1
E4BF85	1
E4BF86	1
E4BF87	1
E4BF88	1
E4BF89	1
E4BF8A	1
E4BF8B	1
E4BF8C	1
E4BF8D	1
E4BF8E	1
E4BF8F	1
E4BF90	1
E4BF91	1
E4BF92	1
E4BF93	1
E4BF94	1
E4BF95	1
E4BF96	1
E4BF97	1
E4BF98	1
E4BF99	1
E4BF9A	1
E4BF9B	1
E4BF9C	1
E4BF9D	1
E4BF9E	1
E4BF9F	1
E4BFA0	1
E4BFA1	1
E4BFA2	1
E4BFA3	1
E4BFA4	1
E4BFA5	1
E4BFA6	1
E4BFA7	1
E4BFA8	1
E4BFA9	1
E4BFAA	1
E4BFAB	1
E4BFAC	1
E4BFAD	1
E4BFAE	1
E4BFAF	1
E4BFB0	1
E4BFB1	1
E4BFB2	1
E4BFB3	1
E4BFB4	1
E4BFB5	1
E4BFB6	1
E4BFB7	1
E4BFB8	1
E4BFB9	1
E4BFBA	1
E4BFBB	1
E4BFBC	1
E4BFBD	1
E4BFBE	1
E4BFBF	1
C8B7	1
C8B8	1
C8B9	1
C8BA	1
C8BB	1
C8BC	1
C8BD	1
C8BE	1
C8BF	1
C980	1
C981	1
C982	1
C983	1
C984	1
C985	1
C986	1
C987	1
C988	1
C989	1
C98A	1
C98B	1
C98C	1
C98D	1
C98E	1
C98F	1
CD98	1
CD99	1
CD9A	1
CD9B	1
CD9C	1
CDB0	1
CDB1	1
CDB2	1
CDB3	1
CDB6	1
CDB7	1
CDB8	1
CDB9	1
CDBB	1
CDBC	1
CDBD	1
CDBF	1
CE80	1
CE81	1
CE82	1
CE83	1
CE8B	1
CE8D	1
CEA2	1
CF8F	1
CFBC	1
CFBD	1
CFBE	1
CFBF	1
D287	1
D38F	1
D3B6	1
D3B7	1
D3BA	1
D3BB	1
D3BC	1
D3BD	1
D3BE	1
D3BF	1
D490	1
D491	1
D492	1
D493	1
D494	1
D495	1
D496	1
D497	1
D498	1
D499	1
D49A	1
D49B	1
D49C	1
D49D	1
D49E	1
D49F	1
D4A0	1
D4A1	1
D4A2	1
D4A3	1
D4A4	1
D4A5	1
D4A6	1
D4A7	1
D4A8	1
D4A9	1
D4AA	1
D4AB	1
D4AC	1
D4AD	1
D4AE	1
D4AF	1
D4B0	1
D597	1
D598	1
D5A0	1
D688	1
D68B	1
D68C	1
D68D	1
D68E	1
D68F	1
D690	1
D6A2	1
D6BA	1
D785	1
D786	1
D787	1
D788	1
D789	1
D78A	1
D78B	1
D78C	1
D78D	1
D78E	1
D78F	1
D7AB	1
D7AC	1
D7AD	1
D7AE	1
D7AF	1
D7B5	1
D7B6	1
D7B7	1
D7B8	1
D7B9	1
D7BA	1
D7BB	1
D7BC	1
D7BD	1
D7BE	1
D7BF	1
D884	1
D885	1
D886	1
D887	1
D888	1
D889	1
D88A	1
D88B	1
D896	1
D897	1
D898	1
D899	1
D89A	1
D89C	1
D89D	1
D89E	1
D8A0	1
D8BB	1
D8BC	1
D8BD	1
D8BE	1
D8BF	1
D999	1
D99A	1
D99B	1
D99C	1
D99D	1
D99E	1
D99F	1
DC8E	1
DD8B	1
DD8C	1
DD90	1
DD91	1
DD92	1
DD93	1
DD94	1
DD95	1
DD96	1
DD97	1
DD98	1
DD99	1
DD9A	1
DD9B	1
DD9C	1
DD9D	1
DD9E	1
DD9F	1
DDA0	1
DDA1	1
DDA2	1
DDA3	1
DDA4	1
DDA5	1
DDA6	1
DDA7	1
DDA8	1
DDA9	1
DDAA	1
DDAB	1
DDAC	1
DDAD	1
DDAE	1
DDAF	1
DDB0	1
DDB1	1
DDB2	1
DDB3	1
DDB4	1
DDB5	1
DDB6	1
DDB7	1
DDB8	1
DDB9	1
DDBA	1
DDBB	1
DDBC	1
DDBD	1
DDBE	1
DDBF	1
DEB2	1
DEB3	1
DEB4	1
DEB5	1
DEB6	1
DEB7	1
DEB8	1
DEB9	1
DEBA	1
DEBB	1
DEBC	1
DEBD	1
DEBE	1
DEBF	1
DF80	1
DF81	1
DF82	1
DF83	1
DF84	1
DF85	1
DF86	1
DF87	1
DF88	1
DF89	1
DF8A	1
DF8B	1
DF8C	1
DF8D	1
DF8E	1
DF8F	1
DF90	1
DF91	1
DF92	1
DF93	1
DF94	1
DF95	1
DF96	1
DF97	1
DF98	1
DF99	1
DF9A	1
DF9B	1
DF9C	1
DF9D	1
DF9E	1
DF9F	1
DFA0	1
DFA1	1
DFA2	1
DFA3	1
DFA4	1
DFA5	1
DFA6	1
DFA7	1
DFA8	1
DFA9	1
DFAA	1
DFAB	1
DFAC	1
DFAD	1
DFAE	1
DFAF	1
DFB0	1
DFB1	1
DFB2	1
DFB3	1
DFB4	1
DFB5	1
DFB6	1
DFB7	1
DFB8	1
DFB9	1
DFBA	1
DFBB	1
DFBC	1
DFBD	1
DFBE	1
DFBF	1
DROP TABLE IF EXISTS test.t1;
DROP TABLE IF EXISTS test.t1;
DROP DATABASE test;
CREATE DATABASE test CHARACTER SET utf8mb3;
USE test;
CREATE TABLE test.t1 (a CHAR(4) CHARACTER SET utf8mb3 COLLATE utf8mb3_unicode_ci) ENGINE=MyISAM CHARACTER SET utf8mb3 COLLATE utf8mb3_unicode_ci;
Warnings:
Warning	1287	'utf8mb3' is deprecated and will be removed in a future release. Please use utf8mb4 instead
Warning	3778	'utf8mb3_unicode_ci' is a collation of the deprecated character set UTF8MB3. Please consider using UTF8MB4 with an appropriate collation instead.
Warning	1287	'utf8mb3' is deprecated and will be removed in a future release. Please use utf8mb4 instead
Warning	3778	'utf8mb3_unicode_ci' is a collation of the deprecated character set UTF8MB3. Please consider using UTF8MB4 with an appropriate collation instead.
SHOW TABLE STATUS LIKE 't1';
Name	Engine	Version	Row_format	Rows	Avg_row_length	Data_length	Max_data_length	Index_length	Data_free	Auto_increment	Create_time	Update_time	Check_time	Collation	Checksum	Create_options	Comment
t1	MyISAM	#	#	#	#	#	#	#	#	#	#	#	#	utf8mb3_unicode_ci	#	#	#
LOAD DATA INFILE 
'MYSQL_TEST_DIR/suite/funcs_2/data/charset_utf8.txt' INTO TABLE test.t1;
DELETE FROM test.t1 WHERE CHAR_LENGTH(a) <> 1;
SELECT HEX(ORD(a)) AS a_ord, CHAR_LENGTH(a) AS a_len FROM test.t1 ORDER BY a, ORD(a);
a_ord	a_len
C285	1
7F	1
C280	1
C281	1
C282	1
C283	1
C284	1
C286	1
C287	1
C288	1
C289	1
C28A	1
C28B	1
C28C	1
C28D	1
C28E	1
C28F	1
C290	1
C291	1
C292	1
C293	1
C294	1
C295	1
C296	1
C297	1
C298	1
C299	1
C29A	1
C29B	1
C29C	1
C29D	1
C29E	1
C29F	1
C2A0	1
CC80	1
CC81	1
CC82	1
CC83	1
CC84	1
CC85	1
CC86	1
CC87	1
CC88	1
CC89	1
CC8A	1
CC8B	1
CC8C	1
CC8D	1
CC8E	1
CC8F	1
CC90	1
CC91	1
CC92	1
CC93	1
CC94	1
CC95	1
CC96	1
CC97	1
CC98	1
CC99	1
CC9A	1
CC9B	1
CC9C	1
CC9D	1
CC9E	1
CC9F	1
CCA0	1
CCA1	1
CCA2	1
CCA3	1
CCA4	1
CCA5	1
CCA6	1
CCA7	1
CCA8	1
CCA9	1
CCAA	1
CCAB	1
CCAC	1
CCAD	1
CCAE	1
CCAF	1
CCB0	1
CCB1	1
CCB2	1
CCB3	1
CCB4	1
CCB5	1
CCB6	1
CCB7	1
CCB8	1
CCB9	1
CCBA	1
CCBB	1
CCBC	1
CCBD	1
CCBE	1
CCBF	1
CD80	1
CD81	1
CD82	1
CD83	1
CD84	1
CD85	1
CD86	1
CD87	1
CD88	1
CD89	1
CD8A	1
CD8B	1
CD8C	1
CD8D	1
CD8E	1
CD8F	1
CD90	1
CD91	1
CD92	1
CD93	1
CD94	1
CD95	1
CD96	1
CD97	1
CD9D	1
CD9E	1
CD9F	1
CDA0	1
CDA1	1
CDA2	1
D283	1
D284	1
D285	1
D286	1
D288	1
D289	1
D691	1
D692	1
D693	1
D694	1
D695	1
D696	1
D697	1
D698	1
D699	1
D69A	1
D69B	1
D69C	1
D69D	1
D69E	1
D69F	1
D6A0	1
D6A1	1
D6A3	1
D6A4	1
D6A5	1
D6A6	1
D6A7	1
D6A8	1
D6A9	1
D6AA	1
D6AB	1
D6AC	1
D6AD	1
D6AE	1
D6AF	1
D6B0	1
D6B1	1
D6B2	1
D6B3	1
D6B4	1
D6B5	1
D6B6	1
D6B7	1
D6B8	1
D6B9	1
D6BB	1
D6BC	1
D6BD	1
D6BF	1
D781	1
D782	1
D784	1
D880	1
D881	1
D882	1
D883	1
D890	1
D891	1
D892	1
D893	1
D894	1
D895	1
D98B	1
D98C	1
D98D	1
D98E	1
D98F	1
D990	1
D991	1
D992	1
D993	1
D994	1
D995	1
D996	1
D997	1
D998	1
D9B0	1
DB96	1
DB97	1
DB98	1
DB99	1
DB9A	1
DB9B	1
DB9C	1
DB9D	1
DB9E	1
DB9F	1
DBA0	1
DBA1	1
DBA2	1
DBA3	1
DBA4	1
DBA7	1
DBA8	1
DBAA	1
DBAB	1
DBAC	1
DBAD	1
DC8F	1
DC91	1
DCB0	1
DCB1	1
DCB2	1
DCB3	1
DCB4	1
DCB5	1
DCB6	1
DCB7	1
DCB8	1
DCB9	1
DCBA	1
DCBB	1
DCBC	1
DCBD	1
DCBE	1
DCBF	1
DD80	1
DD81	1
DD82	1
DD83	1
DD84	1
DD85	1
DD86	1
DD87	1
DD88	1
DD89	1
DD8A	1
D980	1
60	1
C2B4	1
CE84	1
CB9C	1
5E	1
C2AF	1
CB98	1
CB99	1
C2A8	1
CE85	1
CB9A	1
CB9D	1
C2B8	1
CB9B	1
5F	1
C2AD	1
2D	1
D68A	1
2C	1
D59D	1
D88C	1
D88D	1
D9AB	1
D9AC	1
3B	1
CDBE	1
D89B	1
3A	1
D689	1
DC83	1
DC84	1
DC85	1
DC86	1
DC87	1
DC88	1
21	1
C2A1	1
D59C	1
3F	1
C2BF	1
D59E	1
D89F	1
DC89	1
2E	1
DB94	1
DC81	1
DC82	1
C2B7	1
CE87	1
DC80	1
27	1
22	1
C2AB	1
C2BB	1
28	1
29	1
5B	1
7B	1
7D	1
C2A7	1
C2B6	1
C2A9	1
C2AE	1
40	1
2A	1
D9AD	1
2F	1
26	1
23	1
25	1
D9AA	1
D59A	1
D59B	1
D59F	1
D6BE	1
D780	1
D783	1
D7B3	1
D7B4	1
DC8A	1
DC8B	1
DC8C	1
DC8D	1
CAB9	1
CDB4	1
CDB5	1
CABA	1
CB82	1
CB83	1
CB84	1
CB85	1
CB86	1
CB87	1
CB88	1
CB89	1
CB8A	1
CB8B	1
CB8C	1
CB8D	1
CB8E	1
CB8F	1
CB92	1
CB93	1
CB94	1
CB95	1
CB96	1
CB97	1
CB9E	1
CB9F	1
CBA5	1
CBA6	1
CBA7	1
CBA8	1
CBA9	1
CBAA	1
CBAB	1
CBAC	1
CBAD	1
CBAF	1
CBB0	1
CBB1	1
CBB2	1
CBB3	1
CBB4	1
CBB5	1
CBB6	1
CBB7	1
CBB8	1
CBB9	1
CBBA	1
CBBB	1
CBBC	1
CBBD	1
CBBE	1
CBBF	1
C2B0	1
D282	1
D88E	1
D88F	1
DBA9	1
CFB6	1
2B	1
C2B1	1
C3B7	1
C397	1
3C	1
3D	1
3E	1
C2AC	1
7C	1
C2A6	1
7E	1
CB90	1
CB91	1
C2A4	1
C2A2	1
24	1
C2A3	1
C2A5	1
30	1
D9A0	1
DBB0	1
31	1
C2B9	1
D9A1	1
DBB1	1
C2BD	1
C2BC	1
32	1
C2B2	1
D9A2	1
DBB2	1
33	1
C2B3	1
D9A3	1
DBB3	1
C2BE	1
34	1
D9A4	1
DBB4	1
35	1
D9A5	1
DBB5	1
36	1
D9A6	1
DBB6	1
37	1
D9A7	1
DBB7	1
38	1
D9A8	1
DBB8	1
39	1
D9A9	1
DBB9	1
41	1
61	1
C2AA	1
C380	1
C381	1
C382	1
C383	1
C384	1
C385	1
C3A0	1
C3A1	1
C3A2	1
C3A3	1
C3A4	1
C3A5	1
C480	1
C481	1
C482	1
C483	1
C484	1
C485	1
C78D	1
C78E	1
C79E	1
C79F	1
C7A0	1
C7A1	1
C7BA	1
C7BB	1
C880	1
C881	1
C882	1
C883	1
C8A6	1
C8A7	1
CDA3	1
C386	1
C3A6	1
C7A2	1
C7A3	1
C7BC	1
C7BD	1
C990	1
C991	1
C992	1
42	1
62	1
CA99	1
C680	1
C681	1
C993	1
C682	1
C683	1
43	1
63	1
C387	1
C3A7	1
C486	1
C487	1
C488	1
C489	1
C48A	1
C48B	1
C48C	1
C48D	1
CDA8	1
C687	1
C688	1
C995	1
44	1
64	1
C48E	1
C48F	1
CDA9	1
C784	1
C785	1
C786	1
C7B1	1
C7B2	1
C7B3	1
CAA3	1
CAA5	1
CAA4	1
C490	1
C491	1
C689	1
C996	1
C68A	1
C997	1
C68B	1
C68C	1
C8A1	1
C390	1
C3B0	1
45	1
65	1
C388	1
C389	1
C38A	1
C38B	1
C3A8	1
C3A9	1
C3AA	1
C3AB	1
C492	1
C493	1
C494	1
C495	1
C496	1
C497	1
C498	1
C499	1
C49A	1
C49B	1
C884	1
C885	1
C886	1
C887	1
C8A8	1
C8A9	1
CDA4	1
C68E	1
C79D	1
C68F	1
C999	1
C690	1
C99B	1
C998	1
C99A	1
C99C	1
C99D	1
C99E	1
CA9A	1
C9A4	1
46	1
66	1
CAA9	1
C691	1
C692	1
47	1
67	1
C49C	1
C49D	1
C49E	1
C49F	1
C4A0	1
C4A1	1
C4A2	1
C4A3	1
C7A6	1
C7A7	1
C7B4	1
C7B5	1
C9A1	1
C9A2	1
C7A4	1
C7A5	1
C693	1
C9A0	1
CA9B	1
C694	1
C9A3	1
CBA0	1
C6A2	1
C6A3	1
48	1
68	1
C4A4	1
C4A5	1
C89E	1
C89F	1
CAB0	1
CDAA	1
CA9C	1
C695	1
C7B6	1
C4A6	1
C4A7	1
C9A6	1
CAB1	1
C9A7	1
CABB	1
CABD	1
49	1
69	1
C38C	1
C38D	1
C38E	1
C38F	1
C3AC	1
C3AD	1
C3AE	1
C3AF	1
C4A8	1
C4A9	1
C4AA	1
C4AB	1
C4AC	1
C4AD	1
C4AE	1
C4AF	1
C4B0	1
C78F	1
C790	1
C888	1
C889	1
C88A	1
C88B	1
CDA5	1
C4B2	1
C4B3	1
C4B1	1
C9AA	1
C697	1
C9A8	1
C696	1
C9A9	1
4A	1
6A	1
C4B4	1
C4B5	1
C7B0	1
CAB2	1
CA9D	1
C99F	1
CA84	1
4B	1
6B	1
C4B6	1
C4B7	1
C7A8	1
C7A9	1
C698	1
C699	1
CA9E	1
4C	1
6C	1
C4B9	1
C4BA	1
C4BB	1
C4BC	1
C4BD	1
C4BE	1
CBA1	1
C4BF	1
C580	1
C787	1
C788	1
C789	1
CAAA	1
CAAB	1
CA9F	1
C581	1
C582	1
C69A	1
C9AB	1
C9AC	1
C9AD	1
C8B4	1
C9AE	1
C69B	1
CA8E	1
4D	1
6D	1
CDAB	1
C9B1	1
4E	1
6E	1
C391	1
C3B1	1
C583	1
C584	1
C585	1
C586	1
C587	1
C588	1
C7B8	1
C7B9	1
C78A	1
C78B	1
C78C	1
C9B4	1
C69D	1
C9B2	1
C69E	1
C8A0	1
C9B3	1
C8B5	1
C58A	1
C58B	1
4F	1
6F	1
C2BA	1
C392	1
C393	1
C394	1
C395	1
C396	1
C3B2	1
C3B3	1
C3B4	1
C3B5	1
C3B6	1
C58C	1
C58D	1
C58E	1
C58F	1
C590	1
C591	1
C6A0	1
C6A1	1
C791	1
C792	1
C7AA	1
C7AB	1
C7AC	1
C7AD	1
C88C	1
C88D	1
C88E	1
C88F	1
C8AA	1
C8AB	1
C8AC	1
C8AD	1
C8AE	1
C8AF	1
C8B0	1
C8B1	1
CDA6	1
C592	1
C593	1
C9B6	1
C398	1
C3B8	1
C7BE	1
C7BF	1
C686	1
C994	1
C69F	1
C9B5	1
C9B7	1
C8A2	1
C8A3	1
50	1
70	1
C6A4	1
C6A5	1
C9B8	1
51	1
71	1
CAA0	1
C4B8	1
52	1
72	1
C594	1
C595	1
C596	1
C597	1
C598	1
C599	1
C890	1
C891	1
C892	1
C893	1
CAB3	1
CDAC	1
C6A6	1
CA80	1
C9B9	1
CAB4	1
C9BA	1
C9BB	1
CAB5	1
C9BC	1
C9BD	1
C9BE	1
C9BF	1
CA81	1
CAB6	1
53	1
73	1
C59A	1
C59B	1
C59C	1
C59D	1
C59E	1
C59F	1
C5A0	1
C5A1	1
C5BF	1
C898	1
C899	1
CBA2	1
C39F	1
CA82	1
C6A9	1
CA83	1
C6AA	1
CA85	1
CA86	1
54	1
74	1
C5A2	1
C5A3	1
C5A4	1
C5A5	1
C89A	1
C89B	1
CDAD	1
CAA8	1
C6BE	1
CAA6	1
CAA7	1
C5A6	1
C5A7	1
C6AB	1
C6AC	1
C6AD	1
C6AE	1
CA88	1
C8B6	1
CA87	1
55	1
75	1
C399	1
C39A	1
C39B	1
C39C	1
C3B9	1
C3BA	1
C3BB	1
C3BC	1
C5A8	1
C5A9	1
C5AA	1
C5AB	1
C5AC	1
C5AD	1
C5AE	1
C5AF	1
C5B0	1
C5B1	1
C5B2	1
C5B3	1
C6AF	1
C6B0	1
C793	1
C794	1
C795	1
C796	1
C797	1
C798	1
C799	1
C79A	1
C79B	1
C79C	1
C894	1
C895	1
C896	1
C897	1
CDA7	1
CA89	1
C9A5	1
CAAE	1
CAAF	1
C69C	1
C9AF	1
C9B0	1
C6B1	1
CA8A	1
56	1
76	1
CDAE	1
C6B2	1
CA8B	1
CA8C	1
57	1
77	1
C5B4	1
C5B5	1
CAB7	1
CA8D	1
58	1
78	1
CBA3	1
CDAF	1
59	1
79	1
C39D	1
C3BD	1
C3BF	1
C5B6	1
C5B7	1
C5B8	1
C8B2	1
C8B3	1
CAB8	1
CA8F	1
C6B3	1
C6B4	1
5A	1
7A	1
C5B9	1
C5BA	1
C5BB	1
C5BC	1
C5BD	1
C5BE	1
C68D	1
C6B5	1
C6B6	1
C8A4	1
C8A5	1
CA90	1
CA91	1
C6B7	1
C7AE	1
C7AF	1
CA92	1
C6B8	1
C6B9	1
C6BA	1
CA93	1
C89C	1
C89D	1
C39E	1
C3BE	1
C6BF	1
C7B7	1
C6BB	1
C6A7	1
C6A8	1
C6BC	1
C6BD	1
C684	1
C685	1
CA94	1
CB80	1
CABC	1
C589	1
CBAE	1
CABE	1
CA95	1
CBA4	1
CABF	1
CB81	1
CAA1	1
CAA2	1
CA96	1
C780	1
C781	1
C782	1
C783	1
CA97	1
CA98	1
CAAC	1
CAAD	1
CE86	1
CE91	1
CEAC	1
CEB1	1
CE92	1
CEB2	1
CF90	1
CE93	1
CEB3	1
CE94	1
CEB4	1
CE88	1
CE95	1
CEAD	1
CEB5	1
CFB5	1
CF9C	1
CF9D	1
CF9A	1
CF9B	1
CE96	1
CEB6	1
CE89	1
CE97	1
CEAE	1
CEB7	1
CE98	1
CEB8	1
CF91	1
CFB4	1
CDBA	1
CE8A	1
CE90	1
CE99	1
CEAA	1
CEAF	1
CEB9	1
CF8A	1
CFB3	1
CE9A	1
CEBA	1
CFB0	1
CF97	1
CE9B	1
CEBB	1
C2B5	1
CE9C	1
CEBC	1
CE9D	1
CEBD	1
CE9E	1
CEBE	1
CE8C	1
CE9F	1
CEBF	1
CF8C	1
CEA0	1
CF80	1
CF96	1
CF9E	1
CF9F	1
CF98	1
CF99	1
CEA1	1
CF81	1
CFB1	1
CEA3	1
CF82	1
CF83	1
CFB2	1
CFB9	1
CEA4	1
CF84	1
CE8E	1
CEA5	1
CEAB	1
CEB0	1
CF85	1
CF8B	1
CF8D	1
CF92	1
CF93	1
CF94	1
CEA6	1
CF86	1
CF95	1
CEA7	1
CF87	1
CEA8	1
CF88	1
CE8F	1
CEA9	1
CF89	1
CF8E	1
CFA0	1
CFA1	1
CFB7	1
CFB8	1
CFBA	1
CFBB	1
CFA2	1
CFA3	1
CFA4	1
CFA5	1
CFA6	1
CFA7	1
CFA8	1
CFA9	1
CFAA	1
CFAB	1
CFAC	1
CFAD	1
CFAE	1
CFAF	1
D090	1
D0B0	1
D390	1
D391	1
D392	1
D393	1
D398	1
D399	1
D39A	1
D39B	1
D394	1
D395	1
D091	1
D0B1	1
D092	1
D0B2	1
D093	1
D0B3	1
D290	1
D291	1
D292	1
D293	1
D294	1
D295	1
D094	1
D0B4	1
D480	1
D481	1
D082	1
D192	1
D482	1
D483	1
D083	1
D193	1
D298	1
D299	1
D080	1
D081	1
D095	1
D0B5	1
D190	1
D191	1
D396	1
D397	1
D084	1
D194	1
D096	1
D0B6	1
D381	1
D382	1
D39C	1
D39D	1
D296	1
D297	1
D097	1
D0B7	1
D484	1
D485	1
D39E	1
D39F	1
D085	1
D195	1
D3A0	1
D3A1	1
D486	1
D487	1
D08D	1
D098	1
D0B8	1
D19D	1
D3A2	1
D3A3	1
D28A	1
D28B	1
D3A4	1
D3A5	1
D086	1
D196	1
D087	1
D197	1
D099	1
D0B9	1
D088	1
D198	1
D09A	1
D0BA	1
D29A	1
D29B	1
D383	1
D384	1
D2A0	1
D2A1	1
D29E	1
D29F	1
D29C	1
D29D	1
D09B	1
D0BB	1
D385	1
D386	1
D089	1
D199	1
D488	1
D489	1
D09C	1
D0BC	1
D38D	1
D38E	1
D09D	1
D0BD	1
D389	1
D38A	1
D2A2	1
D2A3	1
D387	1
D388	1
D2A4	1
D2A5	1
D08A	1
D19A	1
D48A	1
D48B	1
D09E	1
D0BE	1
D3A6	1
D3A7	1
D3A8	1
D3A9	1
D3AA	1
D3AB	1
D09F	1
D0BF	1
D2A6	1
D2A7	1
D280	1
D281	1
D0A0	1
D180	1
D28E	1
D28F	1
D0A1	1
D181	1
D48C	1
D48D	1
D2AA	1
D2AB	1
D0A2	1
D182	1
D48E	1
D48F	1
D2AC	1
D2AD	1
D08B	1
D19B	1
D08C	1
D19C	1
D0A3	1
D183	1
D3AE	1
D3AF	1
D08E	1
D19E	1
D3B0	1
D3B1	1
D3B2	1
D3B3	1
D2AE	1
D2AF	1
D2B0	1
D2B1	1
D1B8	1
D1B9	1
D0A4	1
D184	1
D0A5	1
D185	1
D2B2	1
D2B3	1
D2BA	1
D2BB	1
D1A0	1
D1A1	1
D1BE	1
D1BF	1
D1BC	1
D1BD	1
D1BA	1
D1BB	1
D0A6	1
D186	1
D2B4	1
D2B5	1
D0A7	1
D187	1
D3B4	1
D3B5	1
D2B6	1
D2B7	1
D38B	1
D38C	1
D2B8	1
D2B9	1
D2BC	1
D2BD	1
D2BE	1
D2BF	1
D08F	1
D19F	1
D0A8	1
D188	1
D0A9	1
D189	1
D0AA	1
D18A	1
D0AB	1
D18B	1
D3B8	1
D3B9	1
D0AC	1
D18C	1
D28C	1
D28D	1
D1A2	1
D1A3	1
D0AD	1
D18D	1
D3AC	1
D3AD	1
D0AE	1
D18E	1
D0AF	1
D18F	1
D1A4	1
D1A5	1
D1A6	1
D1A7	1
D1AA	1
D1AB	1
D1A8	1
D1A9	1
D1AC	1
D1AD	1
D1AE	1
D1AF	1
D1B0	1
D1B1	1
D1B2	1
D1B3	1
D1B4	1
D1B5	1
D1B6	1
D1B7	1
D2A8	1
D2A9	1
D380	1
D4B1	1
D5A1	1
D4B2	1
D5A2	1
D4B3	1
D5A3	1
D4B4	1
D5A4	1
D4B5	1
D5A5	1
D687	1
D4B6	1
D5A6	1
D4B7	1
D5A7	1
D4B8	1
D5A8	1
D4B9	1
D5A9	1
D4BA	1
D5AA	1
D4BB	1
D5AB	1
D4BC	1
D5AC	1
D4BD	1
D5AD	1
D4BE	1
D5AE	1
D4BF	1
D5AF	1
D580	1
D5B0	1
D581	1
D5B1	1
D582	1
D5B2	1
D583	1
D5B3	1
D584	1
D5B4	1
D585	1
D5B5	1
D586	1
D5B6	1
D587	1
D5B7	1
D588	1
D5B8	1
D589	1
D5B9	1
D58A	1
D5BA	1
D58B	1
D5BB	1
D58C	1
D5BC	1
D58D	1
D5BD	1
D58E	1
D5BE	1
D58F	1
D5BF	1
D590	1
D680	1
D591	1
D681	1
D592	1
D682	1
D593	1
D683	1
D594	1
D684	1
D595	1
D685	1
D596	1
D686	1
D599	1
D790	1
D791	1
D792	1
D793	1
D794	1
D795	1
D7B0	1
D7B1	1
D796	1
D797	1
D798	1
D799	1
D7B2	1
D79A	1
D79B	1
D79C	1
D79D	1
D79E	1
D79F	1
D7A0	1
D7A1	1
D7A2	1
D7A3	1
D7A4	1
D7A5	1
D7A6	1
D7A7	1
D7A8	1
D7A9	1
D7AA	1
D8A1	1
D9B4	1
DBBD	1
D8A2	1
D8A3	1
D9B2	1
D9B1	1
D8A4	1
D8A5	1
D9B3	1
D8A6	1
D8A7	1
D9B5	1
D9AE	1
D8A8	1
D9BB	1
D9BE	1
DA80	1
D8A9	1
D8AA	1
D8AB	1
D9B9	1
D9BA	1
D9BC	1
D9BD	1
D9BF	1
D8AC	1
DA83	1
DA84	1
DA86	1
DABF	1
DA87	1
D8AD	1
D8AE	1
DA81	1
DA82	1
DA85	1
D8AF	1
D8B0	1
DA88	1
DA89	1
DA8A	1
DA8B	1
DA8C	1
DA8D	1
DA8E	1
DA8F	1
DA90	1
DBAE	1
D8B1	1
D8B2	1
DA91	1
DA92	1
DA93	1
DA94	1
DA95	1
DA96	1
DA97	1
DA98	1
DA99	1
DBAF	1
D8B3	1
D8B4	1
DA9A	1
DA9B	1
DA9C	1
DBBA	1
D8B5	1
D8B6	1
DA9D	1
DA9E	1
DBBB	1
D8B7	1
D8B8	1
DA9F	1
D8B9	1
D8BA	1
DAA0	1
DBBC	1
D981	1
DAA1	1
DAA2	1
DAA3	1
DAA4	1
DAA5	1
DAA6	1
D9AF	1
D982	1
DAA7	1
DAA8	1
D983	1
DAA9	1
DAAA	1
DAAB	1
DAAC	1
DAAD	1
DAAE	1
DAAF	1
DAB0	1
DAB1	1
DAB2	1
DAB3	1
DAB4	1
D984	1
DAB5	1
DAB6	1
DAB7	1
DAB8	1
D985	1
DBBE	1
D986	1
DABA	1
DABB	1
DABC	1
DABD	1
DAB9	1
D987	1
DABE	1
DB81	1
DB82	1
DB83	1
DBBF	1
DB80	1
DB95	1
D988	1
DBA5	1
D9B6	1
DB84	1
DB85	1
DB86	1
DB87	1
D9B7	1
DB88	1
DB89	1
DB8A	1
DB8B	1
DB8F	1
D989	1
D98A	1
DBA6	1
D9B8	1
DB8C	1
DB8D	1
DB8E	1
DB90	1
DB91	1
DB92	1
DB93	1
DC90	1
DC92	1
DCAD	1
DC93	1
DC94	1
DCAE	1
DC96	1
DC95	1
DCAF	1
DC97	1
DC98	1
DC99	1
DD8D	1
DC9A	1
DC9B	1
DC9C	1
DC9D	1
DC9E	1
DC9F	1
DD8E	1
DCA0	1
DCA1	1
DCA2	1
DCA3	1
DCA4	1
DCA5	1
DCA6	1
DCA7	1
DD8F	1
DCA8	1
DCA9	1
DCAA	1
DCAB	1
DCAC	1
DE80	1
DE99	1
DE9A	1
DE81	1
DE82	1
DE83	1
DE9C	1
DE84	1
DE85	1
DE86	1
DE87	1
DEA2	1
DEA3	1
DE88	1
DEA5	1
DE89	1
DE8A	1
DE8B	1
DE9B	1
DE8C	1
DE98	1
DEA0	1
DEA1	1
DE8D	1
DE8E	1
DEA4	1
DE8F	1
DE90	1
DE9D	1
DE9E	1
DE9F	1
DE91	1
DE92	1
DE93	1
DE94	1
DE95	1
DE96	1
DE97	1
DEB1	1
DEA6	1
DEA7	1
DEA8	1
DEA9	1
DEAA	1
DEAB	1
DEAC	1
DEAD	1
DEAE	1
DEAF	1
DEB0	1
E4B880	1
E4B881	1
E4B882	1
E4B883	1
E4B884	1
E4B885	1
E4B886	1
E4B887	1
E4B888	1
E4B889	1
E4B88A	1
E4B88B	1
E4B88C	1
E4B88D	1
E4B88E	1
E4B88F	1
E4B890	1
E4B891	1
E4B892	1
E4B893	1
E4B894	1
E4B895	1
E4B896	1
E4B897	1
E4B898	1
E4B899	1
E4B89A	1
E4B89B	1
E4B89C	1
E4B89D	1
E4B89E	1
E4B89F	1
E4B8A0	1
E4B8A1	1
E4B8A2	1
E4B8A3	1
E4B8A4	1
E4B8A5	1
E4B8A6	1
E4B8A7	1
E4B8A8	1
E4B8A9	1
E4B8AA	1
E4B8AB	1
E4B8AC	1
E4B8AD	1
E4B8AE	1
E4B8AF	1
E4B8B0	1
E4B8B1	1
E4B8B2	1
E4B8B3	1
E4B8B4	1
E4B8B5	1
E4B8B6	1
E4B8B7	1
E4B8B8	1
E4B8B9	1
E4B8BA	1
E4B8BB	1
E4B8BC	1
E4B8BD	1
E4B8BE	1
E4B8BF	1
E4B980	1
E4B981	1
E4B982	1
E4B983	1
E4B984	1
E4B985	1
E4B986	1
E4B987	1
E4B988	1
E4B989	1
E4B98A	1
E4B98B	1
E4B98C	1
E4B98D	1
E4B98E	1
E4B98F	1
E4B990	1
E4B991	1
E4B992	1
E4B993	1
E4B994	1
E4B995	1
E4B996	1
E4B997	1
E4B998	1
E4B999	1
E4B99A	1
E4B99B	1
E4B99C	1
E4B99D	1
E4B99E	1
E4B99F	1
E4B9A0	1
E4B9A1	1
E4B9A2	1
E4B9A3	1
E4B9A4	1
E4B9A5	1
E4B9A6	1
E4B9A7	1
E4B9A8	1
E4B9A9	1
E4B9AA	1
E4B9AB	1
E4B9AC	1
E4B9AD	1
E4B9AE	1
E4B9AF	1
E4B9B0	1
E4B9B1	1
E4B9B2	1
E4B9B3	1
E4B9B4	1
E4B9B5	1
E4B9B6	1
E4B9B7	1
E4B9B8	1
E4B9B9	1
E4B9BA	1
E4B9BB	1
E4B9BC	1
E4B9BD	1
E4B9BE	1
E4B9BF	1
E4BA80	1
E4BA81	1
E4BA82	1
E4BA83	1
E4BA84	1
E4BA85	1
E4BA86	1
E4BA87	1
E4BA88	1
E4BA89	1
E4BA8A	1
E4BA8B	1
E4BA8C	1
E4BA8D	1
E4BA8E	1
E4BA8F	1
E4BA90	1
E4BA91	1
E4BA92	1
E4BA93	1
E4BA94	1
E4BA95	1
E4BA96	1
E4BA97	1
E4BA98	1
E4BA99	1
E4BA9A	1
E4BA9B	1
E4BA9C	1
E4BA9D	1
E4BA9E	1
E4BA9F	1
E4BAA0	1
E4BAA1	1
E4BAA2	1
E4BAA3	1
E4BAA4	1
E4BAA5	1
E4BAA6	1
E4BAA7	1
E4BAA8	1
E4BAA9	1
E4BAAA	1
E4BAAB	1
E4BAAC	1
E4BAAD	1
E4BAAE	1
E4BAAF	1
E4BAB0	1
E4BAB1	1
E4BAB2	1
E4BAB3	1
E4BAB4	1
E4BAB5	1
E4BAB6	1
E4BAB7	1
E4BAB8	1
E4BAB9	1
E4BABA	1
E4BABB	1
E4BABC	1
E4BABD	1
E4BABE	1
E4BABF	1
E4BB80	1
E4BB81	1
E4BB82	1
E4BB83	1
E4BB84	1
E4BB85	1
E4BB86	1
E4BB87	1
E4BB88	1
E4BB89	1
E4BB8A	1
E4BB8B	1
E4BB8C	1
E4BB8D	1
E4BB8E	1
E4BB8F	1
E4BB90	1
E4BB91	1
E4BB92	1
E4BB93	1
E4BB94	1
E4BB95	1
E4BB96	1
E4BB97	1
E4BB98	1
E4BB99	1
E4BB9A	1
E4BB9B	1
E4BB9C	1
E4BB9D	1
E4BB9E	1
E4BB9F	1
E4BBA0	1
E4BBA1	1
E4BBA2	1
E4BBA3	1
E4BBA4	1
E4BBA5	1
E4BBA6	1
E4BBA7	1
E4BBA8	1
E4BBA9	1
E4BBAA	1
E4BBAB	1
E4BBAC	1
E4BBAD	1
E4BBAE	1
E4BBAF	1
E4BBB0	1
E4BBB1	1
E4BBB2	1
E4BBB3	1
E4BBB4	1
E4BBB5	1
E4BBB6	1
E4BBB7	1
E4BBB8	1
E4BBB9	1
E4BBBA	1
E4BBBB	1
E4BBBC	1
E4BBBD	1
E4BBBE	1
E4BBBF	1
E4BC80	1
E4BC81	1
E4BC82	1
E4BC83	1
E4BC84	1
E4BC85	1
E4BC86	1
E4BC87	1
E4BC88	1
E4BC89	1
E4BC8A	1
E4BC8B	1
E4BC8C	1
E4BC8D	1
E4BC8E	1
E4BC8F	1
E4BC90	1
E4BC91	1
E4BC92	1
E4BC93	1
E4BC94	1
E4BC95	1
E4BC96	1
E4BC97	1
E4BC98	1
E4BC99	1
E4BC9A	1
E4BC9B	1
E4BC9C	1
E4BC9D	1
E4BC9E	1
E4BC9F	1
E4BCA0	1
E4BCA1	1
E4BCA2	1
E4BCA3	1
E4BCA4	1
E4BCA5	1
E4BCA6	1
E4BCA7	1
E4BCA8	1
E4BCA9	1
E4BCAA	1
E4BCAB	1
E4BCAC	1
E4BCAD	1
E4BCAE	1
E4BCAF	1
E4BCB0	1
E4BCB1	1
E4BCB2	1
E4BCB3	1
E4BCB4	1
E4BCB5	1
E4BCB6	1
E4BCB7	1
E4BCB8	1
E4BCB9	1
E4BCBA	1
E4BCBB	1
E4BCBC	1
E4BCBD	1
E4BCBE	1
E4BCBF	1
E4BD80	1
E4BD81	1
E4BD82	1
E4BD83	1
E4BD84	1
E4BD85	1
E4BD86	1
E4BD87	1
E4BD88	1
E4BD89	1
E4BD8A	1
E4BD8B	1
E4BD8C	1
E4BD8D	1
E4BD8E	1
E4BD8F	1
E4BD90	1
E4BD91	1
E4BD92	1
E4BD93	1
E4BD94	1
E4BD95	1
E4BD96	1
E4BD97	1
E4BD98	1
E4BD99	1
E4BD9A	1
E4BD9B	1
E4BD9C	1
E4BD9D	1
E4BD9E	1
E4BD9F	1
E4BDA0	1
E4BDA1	1
E4BDA2	1
E4BDA3	1
E4BDA4	1
E4BDA5	1
E4BDA6	1
E4BDA7	1
E4BDA8	1
E4BDA9	1
E4BDAA	1
E4BDAB	1
E4BDAC	1
E4BDAD	1
E4BDAE	1
E4BDAF	1
E4BDB0	1
E4BDB1	1
E4BDB2	1
E4BDB3	1
E4BDB4	1
E4BDB5	1
E4BDB6	1
E4BDB7	1
E4BDB8	1
E4BDB9	1
E4BDBA	1
E4BDBB	1
E4BDBC	1
E4BDBD	1
E4BDBE	1
E4BDBF	1
E4BE80	1
E4BE81	1
E4BE82	1
E4BE83	1
E4BE84	1
E4BE85	1
E4BE86	1
E4BE87	1
E4BE88	1
E4BE89	1
E4BE8A	1
E4BE8B	1
E4BE8C	1
E4BE8D	1
E4BE8E	1
E4BE8F	1
E4BE90	1
E4BE91	1
E4BE92	1
E4BE93	1
E4BE94	1
E4BE95	1
E4BE96	1
E4BE97	1
E4BE98	1
E4BE99	1
E4BE9A	1
E4BE9B	1
E4BE9C	1
E4BE9D	1
E4BE9E	1
E4BE9F	1
E4BEA0	1
E4BEA1	1
E4BEA2	1
E4BEA3	1
E4BEA4	1
E4BEA5	1
E4BEA6	1
E4BEA7	1
E4BEA8	1
E4BEA9	1
E4BEAA	1
E4BEAB	1
E4BEAC	1
E4BEAD	1
E4BEAE	1
E4BEAF	1
E4BEB0	1
E4BEB1	1
E4BEB2	1
E4BEB3	1
E4BEB4	1
E4BEB5	1
E4BEB6	1
E4BEB7	1
E4BEB8	1
E4BEB9	1
E4BEBA	1
E4BEBB	1
E4BEBC	1
E4BEBD	1
E4BEBE	1
E4BEBF	1
E4BF80	1
E4BF81	1
E4BF82	1
E4BF83	1
E4BF84	1
E4BF85	1
E4BF86	1
E4BF87	1
E4BF88	1
E4BF89	1
E4BF8A	1
E4BF8B	1
E4BF8C	1
E4BF8D	1
E4BF8E	1
E4BF8F	1
E4BF90	1
E4BF91	1
E4BF92	1
E4BF93	1
E4BF94	1
E4BF95	1
E4BF96	1
E4BF97	1
E4BF98	1
E4BF99	1
E4BF9A	1
E4BF9B	1
E4BF9C	1
E4BF9D	1
E4BF9E	1
E4BF9F	1
E4BFA0	1
E4BFA1	1
E4BFA2	1
E4BFA3	1
E4BFA4	1
E4BFA5	1
E4BFA6	1
E4BFA7	1
E4BFA8	1
E4BFA9	1
E4BFAA	1
E4BFAB	1
E4BFAC	1
E4BFAD	1
E4BFAE	1
E4BFAF	1
E4BFB0	1
E4BFB1	1
E4BFB2	1
E4BFB3	1
E4BFB4	1
E4BFB5	1
E4BFB6	1
E4BFB7	1
E4BFB8	1
E4BFB9	1
E4BFBA	1
E4BFBB	1
E4BFBC	1
E4BFBD	1
E4BFBE	1
E4BFBF	1
C8B7	1
C8B8	1
C8B9	1
C8BA	1
C8BB	1
C8BC	1
C8BD	1
C8BE	1
C8BF	1
C980	1
C981	1
C982	1
C983	1
C984	1
C985	1
C986	1
C987	1
C988	1
C989	1
C98A	1
C98B	1
C98C	1
C98D	1
C98E	1
C98F	1
CD98	1
CD99	1
CD9A	1
CD9B	1
CD9C	1
CDB0	1
CDB1	1
CDB2	1
CDB3	1
CDB6	1
CDB7	1
CDB8	1
CDB9	1
CDBB	1
CDBC	1
CDBD	1
CDBF	1
CE80	1
CE81	1
CE82	1
CE83	1
CE8B	1
CE8D	1
CEA2	1
CF8F	1
CFBC	1
CFBD	1
CFBE	1
CFBF	1
D287	1
D38F	1
D3B6	1
D3B7	1
D3BA	1
D3BB	1
D3BC	1
D3BD	1
D3BE	1
D3BF	1
D490	1
D491	1
D492	1
D493	1
D494	1
D495	1
D496	1
D497	1
D498	1
D499	1
D49A	1
D49B	1
D49C	1
D49D	1
D49E	1
D49F	1
D4A0	1
D4A1	1
D4A2	1
D4A3	1
D4A4	1
D4A5	1
D4A6	1
D4A7	1
D4A8	1
D4A9	1
D4AA	1
D4AB	1
D4AC	1
D4AD	1
D4AE	1
D4AF	1
D4B0	1
D597	1
D598	1
D5A0	1
D688	1
D68B	1
D68C	1
D68D	1
D68E	1
D68F	1
D690	1
D6A2	1
D6BA	1
D785	1
D786	1
D787	1
D788	1
D789	1
D78A	1
D78B	1
D78C	1
D78D	1
D78E	1
D78F	1
D7AB	1
D7AC	1
D7AD	1
D7AE	1
D7AF	1
D7B5	1
D7B6	1
D7B7	1
D7B8	1
D7B9	1
D7BA	1
D7BB	1
D7BC	1
D7BD	1
D7BE	1
D7BF	1
D884	1
D885	1
D886	1
D887	1
D888	1
D889	1
D88A	1
D88B	1
D896	1
D897	1
D898	1
D899	1
D89A	1
D89C	1
D89D	1
D89E	1
D8A0	1
D8BB	1
D8BC	1
D8BD	1
D8BE	1
D8BF	1
D999	1
D99A	1
D99B	1
D99C	1
D99D	1
D99E	1
D99F	1
DC8E	1
DD8B	1
DD8C	1
DD90	1
DD91	1
DD92	1
DD93	1
DD94	1
DD95	1
DD96	1
DD97	1
DD98	1
DD99	1
DD9A	1
DD9B	1
DD9C	1
DD9D	1
DD9E	1
DD9F	1
DDA0	1
DDA1	1
DDA2	1
DDA3	1
DDA4	1
DDA5	1
DDA6	1
DDA7	1
DDA8	1
DDA9	1
DDAA	1
DDAB	1
DDAC	1
DDAD	1
DDAE	1
DDAF	1
DDB0	1
DDB1	1
DDB2	1
DDB3	1
DDB4	1
DDB5	1
DDB6	1
DDB7	1
DDB8	1
DDB9	1
DDBA	1
DDBB	1
DDBC	1
DDBD	1
DDBE	1
DDBF	1
DEB2	1
DEB3	1
DEB4	1
DEB5	1
DEB6	1
DEB7	1
DEB8	1
DEB9	1
DEBA	1
DEBB	1
DEBC	1
DEBD	1
DEBE	1
DEBF	1
DF80	1
DF81	1
DF82	1
DF83	1
DF84	1
DF85	1
DF86	1
DF87	1
DF88	1
DF89	1
DF8A	1
DF8B	1
DF8C	1
DF8D	1
DF8E	1
DF8F	1
DF90	1
DF91	1
DF92	1
DF93	1
DF94	1
DF95	1
DF96	1
DF97	1
DF98	1
DF99	1
DF9A	1
DF9B	1
DF9C	1
DF9D	1
DF9E	1
DF9F	1
DFA0	1
DFA1	1
DFA2	1
DFA3	1
DFA4	1
DFA5	1
DFA6	1
DFA7	1
DFA8	1
DFA9	1
DFAA	1
DFAB	1
DFAC	1
DFAD	1
DFAE	1
DFAF	1
DFB0	1
DFB1	1
DFB2	1
DFB3	1
DFB4	1
DFB5	1
DFB6	1
DFB7	1
DFB8	1
DFB9	1
DFBA	1
DFBB	1
DFBC	1
DFBD	1
DFBE	1
DFBF	1
DROP TABLE IF EXISTS test.t1;
DROP database test;
CREATE database test CHARACTER SET utf8mb4;
