drop table if exists t1, t2;
reset master;
create table t1 (a int) engine=innodb;
create table t2 (a int) engine=innodb;
begin;
insert t1 values (5);
commit;
begin;
insert t2 values (5);
commit;
show binlog events from <binlog_start>;
Log_name	Pos	Event_type	Server_id	End_log_pos	Info
master-bin.000001	#	Query	#	#	use `test`; create table t1 (a int) engine=innodb
master-bin.000001	#	Query	#	#	use `test`; create table t2 (a int) engine=innodb
master-bin.000001	#	Query	#	#	use `test`; BEGIN
master-bin.000001	#	Table_map	#	#	table_id: # (test.t1)
master-bin.000001	#	Write_rows	#	#	table_id: # flags: STMT_END_F
master-bin.000001	#	Xid	#	#	COMMIT /* XID */
master-bin.000001	#	Query	#	#	use `test`; BEGIN
master-bin.000001	#	Table_map	#	#	table_id: # (test.t2)
master-bin.000001	#	Write_rows	#	#	table_id: # flags: STMT_END_F
master-bin.000001	#	Xid	#	#	COMMIT /* XID */
drop table t1,t2;
reset master;
create table t1 (n int) engine=innodb;
begin;
commit;
drop table t1;
show binlog events in 'master-bin.000001' from 106;
Log_name	Pos	Event_type	Server_id	End_log_pos	Info
master-bin.000001	#	Query	1	#	use `test`; create table t1 (n int) engine=innodb
master-bin.000001	#	Query	1	#	use `test`; BEGIN
master-bin.000001	#	Table_map	1	#	table_id: # (test.t1)
master-bin.000001	#	Write_rows	1	#	table_id: # flags: STMT_END_F
master-bin.000001	#	Table_map	1	#	table_id: # (test.t1)
master-bin.000001	#	Write_rows	1	#	table_id: # flags: STMT_END_F
master-bin.000001	#	Table_map	1	#	table_id: # (test.t1)
master-bin.000001	#	Write_rows	1	#	table_id: # flags: STMT_END_F
master-bin.000001	#	Table_map	1	#	table_id: # (test.t1)
master-bin.000001	#	Write_rows	1	#	table_id: # flags: STMT_END_F
master-bin.000001	#	Table_map	1	#	table_id: # (test.t1)
master-bin.000001	#	Write_rows	1	#	table_id: # flags: STMT_END_F
master-bin.000001	#	Table_map	1	#	table_id: # (test.t1)
master-bin.000001	#	Write_rows	1	#	table_id: # flags: STMT_END_F
master-bin.000001	#	Table_map	1	#	table_id: # (test.t1)
master-bin.000001	#	Write_rows	1	#	table_id: # flags: STMT_END_F
master-bin.000001	#	Table_map	1	#	table_id: # (test.t1)
master-bin.000001	#	Write_rows	1	#	table_id: # flags: STMT_END_F
master-bin.000001	#	Table_map	1	#	table_id: # (test.t1)
master-bin.000001	#	Write_rows	1	#	table_id: # flags: STMT_END_F
master-bin.000001	#	Table_map	1	#	table_id: # (test.t1)
master-bin.000001	#	Write_rows	1	#	table_id: # flags: STMT_END_F
master-bin.000001	#	Table_map	1	#	table_id: # (test.t1)
master-bin.000001	#	Write_rows	1	#	table_id: # flags: STMT_END_F
master-bin.000001	#	Table_map	1	#	table_id: # (test.t1)
master-bin.000001	#	Write_rows	1	#	table_id: # flags: STMT_END_F
master-bin.000001	#	Table_map	1	#	table_id: # (test.t1)
master-bin.000001	#	Write_rows	1	#	table_id: # flags: STMT_END_F
master-bin.000001	#	Table_map	1	#	table_id: # (test.t1)
master-bin.000001	#	Write_rows	1	#	table_id: # flags: STMT_END_F
master-bin.000001	#	Table_map	1	#	table_id: # (test.t1)
master-bin.000001	#	Write_rows	1	#	table_id: # flags: STMT_END_F
master-bin.000001	#	Table_map	1	#	table_id: # (test.t1)
master-bin.000001	#	Write_rows	1	#	table_id: # flags: STMT_END_F
master-bin.000001	#	Table_map	1	#	table_id: # (test.t1)
master-bin.000001	#	Write_rows	1	#	table_id: # flags: STMT_END_F
master-bin.000001	#	Table_map	1	#	table_id: # (test.t1)
master-bin.000001	#	Write_rows	1	#	table_id: # flags: STMT_END_F
master-bin.000001	#	Table_map	1	#	table_id: # (test.t1)
master-bin.000001	#	Write_rows	1	#	table_id: # flags: STMT_END_F
master-bin.000001	#	Table_map	1	#	table_id: # (test.t1)
master-bin.000001	#	Write_rows	1	#	table_id: # flags: STMT_END_F
master-bin.000001	#	Table_map	1	#	table_id: # (test.t1)
master-bin.000001	#	Write_rows	1	#	table_id: # flags: STMT_END_F
master-bin.000001	#	Table_map	1	#	table_id: # (test.t1)
master-bin.000001	#	Write_rows	1	#	table_id: # flags: STMT_END_F
master-bin.000001	#	Table_map	1	#	table_id: # (test.t1)
master-bin.000001	#	Write_rows	1	#	table_id: # flags: STMT_END_F
master-bin.000001	#	Table_map	1	#	table_id: # (test.t1)
master-bin.000001	#	Write_rows	1	#	table_id: # flags: STMT_END_F
master-bin.000001	#	Table_map	1	#	table_id: # (test.t1)
master-bin.000001	#	Write_rows	1	#	table_id: # flags: STMT_END_F
master-bin.000001	#	Table_map	1	#	table_id: # (test.t1)
master-bin.000001	#	Write_rows	1	#	table_id: # flags: STMT_END_F
master-bin.000001	#	Table_map	1	#	table_id: # (test.t1)
master-bin.000001	#	Write_rows	1	#	table_id: # flags: STMT_END_F
master-bin.000001	#	Table_map	1	#	table_id: # (test.t1)
master-bin.000001	#	Write_rows	1	#	table_id: # flags: STMT_END_F
master-bin.000001	#	Table_map	1	#	table_id: # (test.t1)
master-bin.000001	#	Write_rows	1	#	table_id: # flags: STMT_END_F
master-bin.000001	#	Table_map	1	#	table_id: # (test.t1)
master-bin.000001	#	Write_rows	1	#	table_id: # flags: STMT_END_F
master-bin.000001	#	Table_map	1	#	table_id: # (test.t1)
master-bin.000001	#	Write_rows	1	#	table_id: # flags: STMT_END_F
master-bin.000001	#	Table_map	1	#	table_id: # (test.t1)
master-bin.000001	#	Write_rows	1	#	table_id: # flags: STMT_END_F
master-bin.000001	#	Table_map	1	#	table_id: # (test.t1)
master-bin.000001	#	Write_rows	1	#	table_id: # flags: STMT_END_F
master-bin.000001	#	Table_map	1	#	table_id: # (test.t1)
master-bin.000001	#	Write_rows	1	#	table_id: # flags: STMT_END_F
master-bin.000001	#	Table_map	1	#	table_id: # (test.t1)
master-bin.000001	#	Write_rows	1	#	table_id: # flags: STMT_END_F
master-bin.000001	#	Table_map	1	#	table_id: # (test.t1)
master-bin.000001	#	Write_rows	1	#	table_id: # flags: STMT_END_F
master-bin.000001	#	Table_map	1	#	table_id: # (test.t1)
master-bin.000001	#	Write_rows	1	#	table_id: # flags: STMT_END_F
master-bin.000001	#	Table_map	1	#	table_id: # (test.t1)
master-bin.000001	#	Write_rows	1	#	table_id: # flags: STMT_END_F
master-bin.000001	#	Table_map	1	#	table_id: # (test.t1)
master-bin.000001	#	Write_rows	1	#	table_id: # flags: STMT_END_F
master-bin.000001	#	Table_map	1	#	table_id: # (test.t1)
master-bin.000001	#	Write_rows	1	#	table_id: # flags: STMT_END_F
master-bin.000001	#	Table_map	1	#	table_id: # (test.t1)
master-bin.000001	#	Write_rows	1	#	table_id: # flags: STMT_END_F
master-bin.000001	#	Table_map	1	#	table_id: # (test.t1)
master-bin.000001	#	Write_rows	1	#	table_id: # flags: STMT_END_F
master-bin.000001	#	Table_map	1	#	table_id: # (test.t1)
master-bin.000001	#	Write_rows	1	#	table_id: # flags: STMT_END_F
master-bin.000001	#	Table_map	1	#	table_id: # (test.t1)
master-bin.000001	#	Write_rows	1	#	table_id: # flags: STMT_END_F
master-bin.000001	#	Table_map	1	#	table_id: # (test.t1)
master-bin.000001	#	Write_rows	1	#	table_id: # flags: STMT_END_F
master-bin.000001	#	Table_map	1	#	table_id: # (test.t1)
master-bin.000001	#	Write_rows	1	#	table_id: # flags: STMT_END_F
master-bin.000001	#	Table_map	1	#	table_id: # (test.t1)
master-bin.000001	#	Write_rows	1	#	table_id: # flags: STMT_END_F
master-bin.000001	#	Table_map	1	#	table_id: # (test.t1)
master-bin.000001	#	Write_rows	1	#	table_id: # flags: STMT_END_F
master-bin.000001	#	Table_map	1	#	table_id: # (test.t1)
master-bin.000001	#	Write_rows	1	#	table_id: # flags: STMT_END_F
master-bin.000001	#	Table_map	1	#	table_id: # (test.t1)
master-bin.000001	#	Write_rows	1	#	table_id: # flags: STMT_END_F
master-bin.000001	#	Table_map	1	#	table_id: # (test.t1)
master-bin.000001	#	Write_rows	1	#	table_id: # flags: STMT_END_F
master-bin.000001	#	Table_map	1	#	table_id: # (test.t1)
master-bin.000001	#	Write_rows	1	#	table_id: # flags: STMT_END_F
master-bin.000001	#	Table_map	1	#	table_id: # (test.t1)
master-bin.000001	#	Write_rows	1	#	table_id: # flags: STMT_END_F
master-bin.000001	#	Table_map	1	#	table_id: # (test.t1)
master-bin.000001	#	Write_rows	1	#	table_id: # flags: STMT_END_F
master-bin.000001	#	Table_map	1	#	table_id: # (test.t1)
master-bin.000001	#	Write_rows	1	#	table_id: # flags: STMT_END_F
master-bin.000001	#	Table_map	1	#	table_id: # (test.t1)
master-bin.000001	#	Write_rows	1	#	table_id: # flags: STMT_END_F
master-bin.000001	#	Table_map	1	#	table_id: # (test.t1)
master-bin.000001	#	Write_rows	1	#	table_id: # flags: STMT_END_F
master-bin.000001	#	Table_map	1	#	table_id: # (test.t1)
master-bin.000001	#	Write_rows	1	#	table_id: # flags: STMT_END_F
master-bin.000001	#	Table_map	1	#	table_id: # (test.t1)
master-bin.000001	#	Write_rows	1	#	table_id: # flags: STMT_END_F
master-bin.000001	#	Table_map	1	#	table_id: # (test.t1)
master-bin.000001	#	Write_rows	1	#	table_id: # flags: STMT_END_F
master-bin.000001	#	Table_map	1	#	table_id: # (test.t1)
master-bin.000001	#	Write_rows	1	#	table_id: # flags: STMT_END_F
master-bin.000001	#	Table_map	1	#	table_id: # (test.t1)
master-bin.000001	#	Write_rows	1	#	table_id: # flags: STMT_END_F
master-bin.000001	#	Table_map	1	#	table_id: # (test.t1)
master-bin.000001	#	Write_rows	1	#	table_id: # flags: STMT_END_F
master-bin.000001	#	Table_map	1	#	table_id: # (test.t1)
master-bin.000001	#	Write_rows	1	#	table_id: # flags: STMT_END_F
master-bin.000001	#	Table_map	1	#	table_id: # (test.t1)
master-bin.000001	#	Write_rows	1	#	table_id: # flags: STMT_END_F
master-bin.000001	#	Table_map	1	#	table_id: # (test.t1)
master-bin.000001	#	Write_rows	1	#	table_id: # flags: STMT_END_F
master-bin.000001	#	Table_map	1	#	table_id: # (test.t1)
master-bin.000001	#	Write_rows	1	#	table_id: # flags: STMT_END_F
master-bin.000001	#	Table_map	1	#	table_id: # (test.t1)
master-bin.000001	#	Write_rows	1	#	table_id: # flags: STMT_END_F
master-bin.000001	#	Table_map	1	#	table_id: # (test.t1)
master-bin.000001	#	Write_rows	1	#	table_id: # flags: STMT_END_F
master-bin.000001	#	Table_map	1	#	table_id: # (test.t1)
master-bin.000001	#	Write_rows	1	#	table_id: # flags: STMT_END_F
master-bin.000001	#	Table_map	1	#	table_id: # (test.t1)
master-bin.000001	#	Write_rows	1	#	table_id: # flags: STMT_END_F
master-bin.000001	#	Table_map	1	#	table_id: # (test.t1)
master-bin.000001	#	Write_rows	1	#	table_id: # flags: STMT_END_F
master-bin.000001	#	Table_map	1	#	table_id: # (test.t1)
master-bin.000001	#	Write_rows	1	#	table_id: # flags: STMT_END_F
master-bin.000001	#	Table_map	1	#	table_id: # (test.t1)
master-bin.000001	#	Write_rows	1	#	table_id: # flags: STMT_END_F
master-bin.000001	#	Table_map	1	#	table_id: # (test.t1)
master-bin.000001	#	Write_rows	1	#	table_id: # flags: STMT_END_F
master-bin.000001	#	Table_map	1	#	table_id: # (test.t1)
master-bin.000001	#	Write_rows	1	#	table_id: # flags: STMT_END_F
master-bin.000001	#	Table_map	1	#	table_id: # (test.t1)
master-bin.000001	#	Write_rows	1	#	table_id: # flags: STMT_END_F
master-bin.000001	#	Table_map	1	#	table_id: # (test.t1)
master-bin.000001	#	Write_rows	1	#	table_id: # flags: STMT_END_F
master-bin.000001	#	Table_map	1	#	table_id: # (test.t1)
master-bin.000001	#	Write_rows	1	#	table_id: # flags: STMT_END_F
master-bin.000001	#	Table_map	1	#	table_id: # (test.t1)
master-bin.000001	#	Write_rows	1	#	table_id: # flags: STMT_END_F
master-bin.000001	#	Table_map	1	#	table_id: # (test.t1)
master-bin.000001	#	Write_rows	1	#	table_id: # flags: STMT_END_F
master-bin.000001	#	Table_map	1	#	table_id: # (test.t1)
master-bin.000001	#	Write_rows	1	#	table_id: # flags: STMT_END_F
master-bin.000001	#	Table_map	1	#	table_id: # (test.t1)
master-bin.000001	#	Write_rows	1	#	table_id: # flags: STMT_END_F
master-bin.000001	#	Table_map	1	#	table_id: # (test.t1)
master-bin.000001	#	Write_rows	1	#	table_id: # flags: STMT_END_F
master-bin.000001	#	Table_map	1	#	table_id: # (test.t1)
master-bin.000001	#	Write_rows	1	#	table_id: # flags: STMT_END_F
master-bin.000001	#	Table_map	1	#	table_id: # (test.t1)
master-bin.000001	#	Write_rows	1	#	table_id: # flags: STMT_END_F
master-bin.000001	#	Table_map	1	#	table_id: # (test.t1)
master-bin.000001	#	Write_rows	1	#	table_id: # flags: STMT_END_F
master-bin.000001	#	Table_map	1	#	table_id: # (test.t1)
master-bin.000001	#	Write_rows	1	#	table_id: # flags: STMT_END_F
master-bin.000001	#	Table_map	1	#	table_id: # (test.t1)
master-bin.000001	#	Write_rows	1	#	table_id: # flags: STMT_END_F
master-bin.000001	#	Table_map	1	#	table_id: # (test.t1)
master-bin.000001	#	Write_rows	1	#	table_id: # flags: STMT_END_F
master-bin.000001	#	Table_map	1	#	table_id: # (test.t1)
master-bin.000001	#	Write_rows	1	#	table_id: # flags: STMT_END_F
master-bin.000001	#	Table_map	1	#	table_id: # (test.t1)
master-bin.000001	#	Write_rows	1	#	table_id: # flags: STMT_END_F
master-bin.000001	#	Table_map	1	#	table_id: # (test.t1)
master-bin.000001	#	Write_rows	1	#	table_id: # flags: STMT_END_F
master-bin.000001	#	Table_map	1	#	table_id: # (test.t1)
master-bin.000001	#	Write_rows	1	#	table_id: # flags: STMT_END_F
master-bin.000001	#	Table_map	1	#	table_id: # (test.t1)
master-bin.000001	#	Write_rows	1	#	table_id: # flags: STMT_END_F
master-bin.000001	#	Table_map	1	#	table_id: # (test.t1)
master-bin.000001	#	Write_rows	1	#	table_id: # flags: STMT_END_F
master-bin.000001	#	Table_map	1	#	table_id: # (test.t1)
master-bin.000001	#	Write_rows	1	#	table_id: # flags: STMT_END_F
master-bin.000001	#	Table_map	1	#	table_id: # (test.t1)
master-bin.000001	#	Write_rows	1	#	table_id: # flags: STMT_END_F
master-bin.000001	#	Table_map	1	#	table_id: # (test.t1)
master-bin.000001	#	Write_rows	1	#	table_id: # flags: STMT_END_F
master-bin.000001	#	Table_map	1	#	table_id: # (test.t1)
master-bin.000001	#	Write_rows	1	#	table_id: # flags: STMT_END_F
master-bin.000001	#	Xid	1	#	COMMIT /* xid= */
master-bin.000001	#	Rotate	1	#	master-bin.000002;pos=4
show binlog events in 'master-bin.000002' from 106;
Log_name	Pos	Event_type	Server_id	End_log_pos	Info
master-bin.000002	#	Query	1	#	use `test`; drop table t1
reset master;
create table t1 (id tinyint auto_increment primary key);
set insert_id=128;
insert into t1 values(null);
Warnings:
Warning	1264	Out of range value for column 'id' at row 1
select * from t1;
id
127
drop table t1;
create table t1 (a int);
create table if not exists t2 select * from t1;
create temporary table tt1 (a int);
create table if not exists t3 like tt1;
USE mysql;
INSERT INTO user SET host='localhost', user='@#@', password=password('Just a test');
UPDATE user SET password=password('Another password') WHERE host='localhost' AND user='@#@';
DELETE FROM user WHERE host='localhost' AND user='@#@';
use test;
show binlog events from <binlog_start>;
Log_name	Pos	Event_type	Server_id	End_log_pos	Info
master-bin.000001	#	Query	#	#	use `test`; create table t1 (id tinyint auto_increment primary key)
master-bin.000001	#	Table_map	#	#	table_id: # (test.t1)
master-bin.000001	#	Write_rows	#	#	table_id: # flags: STMT_END_F
master-bin.000001	#	Query	#	#	use `test`; drop table t1
master-bin.000001	#	Query	#	#	use `test`; create table t1 (a int)
master-bin.000001	#	Query	#	#	use `test`; CREATE TABLE IF NOT EXISTS `t2` (
  `a` int(11) DEFAULT NULL
)
master-bin.000001	#	Query	#	#	use `test`; CREATE TABLE IF NOT EXISTS `t3` (
  `a` int(11) DEFAULT NULL
)
master-bin.000001	#	Table_map	#	#	table_id: # (mysql.user)
master-bin.000001	#	Write_rows	#	#	table_id: # flags: STMT_END_F
master-bin.000001	#	Table_map	#	#	table_id: # (mysql.user)
master-bin.000001	#	Update_rows	#	#	table_id: # flags: STMT_END_F
master-bin.000001	#	Table_map	#	#	table_id: # (mysql.user)
master-bin.000001	#	Delete_rows	#	#	table_id: # flags: STMT_END_F
drop table t1,t2,t3,tt1;
create table t1 (a int not null auto_increment, primary key (a)) engine=myisam;
set @@session.auto_increment_increment=1, @@session.auto_increment_offset=1;
insert delayed into t1 values (207);
insert delayed into t1 values (null);
insert delayed into t1 values (300);
show binlog events from <binlog_start>;
Log_name	Pos	Event_type	Server_id	End_log_pos	Info
master-bin.000001	#	Query	#	#	use `test`; create table t1 (id tinyint auto_increment primary key)
master-bin.000001	#	Table_map	#	#	table_id: # (test.t1)
master-bin.000001	#	Write_rows	#	#	table_id: # flags: STMT_END_F
master-bin.000001	#	Query	#	#	use `test`; drop table t1
master-bin.000001	#	Query	#	#	use `test`; create table t1 (a int)
master-bin.000001	#	Query	#	#	use `test`; CREATE TABLE IF NOT EXISTS `t2` (
  `a` int(11) DEFAULT NULL
)
master-bin.000001	#	Query	#	#	use `test`; CREATE TABLE IF NOT EXISTS `t3` (
  `a` int(11) DEFAULT NULL
)
master-bin.000001	#	Table_map	#	#	table_id: # (mysql.user)
master-bin.000001	#	Write_rows	#	#	table_id: # flags: STMT_END_F
master-bin.000001	#	Table_map	#	#	table_id: # (mysql.user)
master-bin.000001	#	Update_rows	#	#	table_id: # flags: STMT_END_F
master-bin.000001	#	Table_map	#	#	table_id: # (mysql.user)
master-bin.000001	#	Delete_rows	#	#	table_id: # flags: STMT_END_F
master-bin.000001	#	Query	#	#	use `test`; DROP TABLE `t1`,`t2`,`t3` /* generated by server */
master-bin.000001	#	Query	#	#	use `test`; create table t1 (a int not null auto_increment, primary key (a)) engine=myisam
master-bin.000001	#	Table_map	#	#	table_id: # (test.t1)
master-bin.000001	#	Write_rows	#	#	table_id: # flags: STMT_END_F
master-bin.000001	#	Table_map	#	#	table_id: # (test.t1)
master-bin.000001	#	Write_rows	#	#	table_id: # flags: STMT_END_F
master-bin.000001	#	Table_map	#	#	table_id: # (test.t1)
master-bin.000001	#	Write_rows	#	#	table_id: # flags: STMT_END_F
insert delayed into t1 values (null),(null),(null),(null);
insert delayed into t1 values (null),(null),(400),(null);
11 == 11
select * from t1;
a
207
208
300
301
302
303
304
305
306
400
401
drop table t1;
reset master;
drop table if exists t3;
create table t3 (a int(11) NOT NULL AUTO_INCREMENT, b text, PRIMARY KEY (a) ) engine=innodb;
show master status;
File	Position	Binlog_Do_DB	Binlog_Ignore_DB
master-bin.000001	346		
insert into t3(b) values ('aaaaaaaaaaaaaaaaaaaaaaaaaaaaaaaaaaaaaaaaaaaaaaaaaaaaaaaaaaaaaaaaaaaaaaaaaaaaaaaaaaaaaaaaaaaaaaaaaaaaaaaaaaaaaaaaaaaaaaaaaaaaaaaaaaaaaaaaaaaaaaaaaaaaaaaaaaaaaaaaaaaaaaaaaaaaaaaaaaaaaaaaaaaaaaaaaaaaaaaaaaaaaaaaaaaaaaaaaaaaaaaaaaaaaaaaaaaaaaaaaaaaaaaaaaaaaaaaaaaaaaaaaaaaaaaaaaaaaaaaaaaaaaaaaaaaaaaaaaaaaaaaaaaaaaaaaaaaaaaaaaaaaaaaaaaaaaaaaaaaaaaaaaaaaaaaaaaaaaaaaaaaaaaaaaaaaaaaaaaaaaaaaaaaaaaaaaaaaaaaaaaaaaaaaaaaaaaaaaaaaaaaaaaaaaaaaaaaaaaaaaaaaaaaaaaaaaaaaaaaaaaaaaaaaaaaaaaaaaaaaaaaaaaaaaaaaaaaaaaaaaaaaaaaaaaaaaaaaaaaaaaaaaaaaaaaaaaaaaaaaaaaaaaaaaaaaaaaaaaaaaaaaaaaaaaaaaaaaaaaaaaaaaaaaaaaaaaaaaaaaaaaaaaaaaaaaaaaaaaaaaaaaaaaaaaaaaaaaaaaaaaaaaaaaaaaaaaaaaaaaaaaaaaaaaaaaaaaaaaaaaaaaaaaaaaaaaaaaaaaaaaaaaaaaaaaaaaaaaaaaaaaaaaaaaaaaaaaaaaaaaaaaaaaaaaaaaaaaaaaaaaaaaaaaaaaaaaaaaaaaaaaaaaaaaaaaaaaaaaaaaaaaaaaaaaaaaaaaaaaaaaaaaaaaaaaaaaaaaaaaaaaaaaaaaaaaaaaaaaaaaaaaaaaaaaaaaaaaaaaaaaaaaaaaaaaaaaaaaaaaaaaaaaaaaaaaaaaaaaaaaaaaaaaaaaaaaaaaaaaaaaaaaaaaaaaaaaaaaaaaaaaaaaaaaaaaaaaaaaaaaaa');
insert into t3(b) values ('aaaaaaaaaaaaaaaaaaaaaaaaaaaaaaaaaaaaaaaaaaaaaaaaaaaaaaaaaaaaaaaaaaaaaaaaaaaaaaaaaaaaaaaaaaaaaaaaaaaaaaaaaaaaaaaaaaaaaaaaaaaaaaaaaaaaaaaaaaaaaaaaaaaaaaaaaaaaaaaaaaaaaaaaaaaaaaaaaaaaaaaaaaaaaaaaaaaaaaaaaaaaaaaaaaaaaaaaaaaaaaaaaaaaaaaaaaaaaaaaaaaaaaaaaaaaaaaaaaaaaaaaaaaaaaaaaaaaaaaaaaaaaaaaaaaaaaaaaaaaaaaaaaaaaaaaaaaaaaaaaaaaaaaaaaaaaaaaaaaaaaaaaaaaaaaaaaaaaaaaaaaaaaaaaaaaaaaaaaaaaaaaaaaaaaaaaaaaaaaaaaaaaaaaaaaaaaaaaaaaaaaaaaaaaaaaaaaaaaaaaaaaaaaaaaaaaaaaaaaaaaaaaaaaaaaaaaaaaaaaaaaaaaaaaaaaaaaaaaaaaaaaaaaaaaaaaaaaaaaaaaaaaaaaaaaaaaaaaaaaaaaaaaaaaaaaaaaaaaaaaaaaaaaaaaaaaaaaaaaaaaaaaaaaaaaaaaaaaaaaaaaaaaaaaaaaaaaaaaaaaaaaaaaaaaaaaaaaaaaaaaaaaaaaaaaaaaaaaaaaaaaaaaaaaaaaaaaaaaaaaaaaaaaaaaaaaaaaaaaaaaaaaaaaaaaaaaaaaaaaaaaaaaaaaaaaaaaaaaaaaaaaaaaaaaaaaaaaaaaaaaaaaaaaaaaaaaaaaaaaaaaaaaaaaaaaaaaaaaaaaaaaaaaaaaaaaaaaaaaaaaaaaaaaaaaaaaaaaaaaaaaaaaaaaaaaaaaaaaaaaaaaaaaaaaaaaaaaaaaaaaaaaaaaaaaaaaaaaaaaaaaaaaaaaaaaaaaaaaaaaaaaaaaaaaaaaaaaaaaaaaaaaaaaaaaaaaaaaaaaaaaaaaaaaaaaaaaaaaaaaaaa');
insert into t3(b) values ('aaaaaaaaaaaaaaaaaaaaaaaaaaaaaaaaaaaaaaaaaaaaaaaaaaaaaaaaaaaaaaaaaaaaaaaaaaaaaaaaaaaaaaaaaaaaaaaaaaaaaaaaaaaaaaaaaaaaaaaaaaaaaaaaaaaaaaaaaaaaaaaaaaaaaaaaaaaaaaaaaaaaaaaaaaaaaaaaaaaaaaaaaaaaaaaaaaaaaaaaaaaaaaaaaaaaaaaaaaaaaaaaaaaaaaaaaaaaaaaaaaaaaaaaaaaaaaaaaaaaaaaaaaaaaaaaaaaaaaaaaaaaaaaaaaaaaaaaaaaaaaaaaaaaaaaaaaaaaaaaaaaaaaaaaaaaaaaaaaaaaaaaaaaaaaaaaaaaaaaaaaaaaaaaaaaaaaaaaaaaaaaaaaaaaaaaaaaaaaaaaaaaaaaaaaaaaaaaaaaaaaaaaaaaaaaaaaaaaaaaaaaaaaaaaaaaaaaaaaaaaaaaaaaaaaaaaaaaaaaaaaaaaaaaaaaaaaaaaaaaaaaaaaaaaaaaaaaaaaaaaaaaaaaaaaaaaaaaaaaaaaaaaaaaaaaaaaaaaaaaaaaaaaaaaaaaaaaaaaaaaaaaaaaaaaaaaaaaaaaaaaaaaaaaaaaaaaaaaaaaaaaaaaaaaaaaaaaaaaaaaaaaaaaaaaaaaaaaaaaaaaaaaaaaaaaaaaaaaaaaaaaaaaaaaaaaaaaaaaaaaaaaaaaaaaaaaaaaaaaaaaaaaaaaaaaaaaaaaaaaaaaaaaaaaaaaaaaaaaaaaaaaaaaaaaaaaaaaaaaaaaaaaaaaaaaaaaaaaaaaaaaaaaaaaaaaaaaaaaaaaaaaaaaaaaaaaaaaaaaaaaaaaaaaaaaaaaaaaaaaaaaaaaaaaaaaaaaaaaaaaaaaaaaaaaaaaaaaaaaaaaaaaaaaaaaaaaaaaaaaaaaaaaaaaaaaaaaaaaaaaaaaaaaaaaaaaaaaaaaaaaaaaaaaaaaaaaaaaaaaaaaa');
insert into t3(b) values ('aaaaaaaaaaaaaaaaaaaaaaaaaaaaaaaaaaaaaaaaaaaaaaaaaaaaaaaaaaaaaaaaaaaaaaaaaaaaaaaaaaaaaaaaaaaaaaaaaaaaaaaaaaaaaaaaaaaaaaaaaaaaaaaaaaaaaaaaaaaaaaaaaaaaaaaaaaaaaaaaaaaaaaaaaaaaaaaaaaaaaaaaaaaaaaaaaaaaaaaaaaaaaaaaaaaaaaaaaaaaaaaaaaaaaaaaaaaaaaaaaaaaaaaaaaaaaaaaaaaaaaaaaaaaaaaaaaaaaaaaaaaaaaaaaaaaaaaaaaaaaaaaaaaaaaaaaaaaaaaaaaaaaaaaaaaaaaaaaaaaaaaaaaaaaaaaaaaaaaaaaaaaaaaaaaaaaaaaaaaaaaaaaaaaaaaaaaaaaaaaaaaaaaaaaaaaaaaaaaaaaaaaaaaaaaaaaaaaaaaaaaaaaaaaaaaaaaaaaaaaaaaaaaaaaaaaaaaaaaaaaaaaaaaaaaaaaaaaaaaaaaaaaaaaaaaaaaaaaaaaaaaaaaaaaaaaaaaaaaaaaaaaaaaaaaaaaaaaaaaaaaaaaaaaaaaaaaaaaaaaaaaaaaaaaaaaaaaaaaaaaaaaaaaaaaaaaaaaaaaaaaaaaaaaaaaaaaaaaaaaaaaaaaaaaaaaaaaaaaaaaaaaaaaaaaaaaaaaaaaaaaaaaaaaaaaaaaaaaaaaaaaaaaaaaaaaaaaaaaaaaaaaaaaaaaaaaaaaaaaaaaaaaaaaaaaaaaaaaaaaaaaaaaaaaaaaaaaaaaaaaaaaaaaaaaaaaaaaaaaaaaaaaaaaaaaaaaaaaaaaaaaaaaaaaaaaaaaaaaaaaaaaaaaaaaaaaaaaaaaaaaaaaaaaaaaaaaaaaaaaaaaaaaaaaaaaaaaaaaaaaaaaaaaaaaaaaaaaaaaaaaaaaaaaaaaaaaaaaaaaaaaaaaaaaaaaaaaaaaaaaaaaaaaaaaaaaaaaaaaaaaaa');
show master status /* must show new binlog index after rotating */;
File	Position	Binlog_Do_DB	Binlog_Ignore_DB
master-bin.000002	106		
drop table t3;
