DROP TABLE IF EXISTS t1;
#
# Start of 8.0 tests
#
#
# WL#9125: Add utf8mb4_800_ci_ai
#
SET NAMES utf8mb4 COLLATE utf8mb4_800_ci_ai;
SET @test_character_set= 'utf8mb4';
SET @test_collation= 'utf8mb4_800_ci_ai';
SET @safe_character_set_server= @@character_set_server;
SET @safe_collation_server= @@collation_server;
SET @safe_character_set_client= @@character_set_client;
SET @safe_character_set_results= @@character_set_results;
SET character_set_server= @test_character_set;
SET collation_server= @test_collation;
CREATE DATABASE d1;
USE d1;
CREATE TABLE t1 (c CHAR(10), KEY(c));
SHOW FULL COLUMNS FROM t1;
Field	Type	Collation	Null	Key	Default	Extra	Privileges	Comment
c	char(10)	utf8mb4_800_ci_ai	YES	MUL	NULL			
INSERT INTO t1 VALUES ('aaa'),('aaaa'),('aaaaa');
SELECT c as want3results FROM t1 WHERE c LIKE 'aaa%';
want3results
aaa
aaaa
aaaaa
DROP TABLE t1;
CREATE TABLE t1 (c1 varchar(15), KEY c1 (c1(2)));
SHOW FULL COLUMNS FROM t1;
Field	Type	Collation	Null	Key	Default	Extra	Privileges	Comment
c1	varchar(15)	utf8mb4_800_ci_ai	YES	MUL	NULL			
INSERT INTO t1 VALUES ('location'),('loberge'),('lotre'),('boabab');
SELECT c1 as want3results from t1 where c1 like 'l%';
want3results
location
loberge
lotre
SELECT c1 as want3results from t1 where c1 like 'lo%';
want3results
location
loberge
lotre
SELECT c1 as want1result  from t1 where c1 like 'loc%';
want1result
location
SELECT c1 as want1result  from t1 where c1 like 'loca%';
want1result
location
SELECT c1 as want1result  from t1 where c1 like 'locat%';
want1result
location
SELECT c1 as want1result  from t1 where c1 like 'locati%';
want1result
location
SELECT c1 as want1result  from t1 where c1 like 'locatio%';
want1result
location
SELECT c1 as want1result  from t1 where c1 like 'location%';
want1result
location
DROP TABLE t1;
create table t1 (a set('a') not null);
insert ignore into t1 values (),();
Warnings:
Warning	1364	Field 'a' doesn't have a default value
select cast(a as char(1)) from t1;
cast(a as char(1))


select a sounds like a from t1;
a sounds like a
1
1
select 1 from t1 order by cast(a as char(1));
1
1
1
drop table t1;
set names utf8;
create table t1 (
name varchar(10),
level smallint unsigned);
show create table t1;
Table	Create Table
t1	CREATE TABLE `t1` (
  `name` varchar(10) COLLATE utf8mb4_800_ci_ai DEFAULT NULL,
  `level` smallint(5) unsigned DEFAULT NULL
) ENGINE=InnoDB DEFAULT CHARSET=utf8mb4 COLLATE=utf8mb4_800_ci_ai
insert into t1 values ('string',1);
select concat(name,space(level)), concat(name, repeat(' ',level)) from t1;
concat(name,space(level))	concat(name, repeat(' ',level))
string 	string 
drop table t1;
DROP DATABASE d1;
USE test;
SET character_set_server= @safe_character_set_server;
SET collation_server= @safe_collation_server;
SET character_set_client= @safe_character_set_client;
SET character_set_results= @safe_character_set_results;
SET NAMES utf8mb4 COLLATE utf8mb4_800_ci_ai;
create table t1 select repeat('a',4000) a;
delete from t1;
insert into t1 values ('a'), ('a '), ('a\t');
select collation(a),hex(a) from t1 order by a;
collation(a)	hex(a)
utf8mb4_800_ci_ai	6109
utf8mb4_800_ci_ai	61
utf8mb4_800_ci_ai	6120
drop table t1;
create table t1 engine=innodb select repeat('a',50) as c1;
alter table t1 add index(c1(5));
insert into t1 values ('abcdefg'),('abcde100'),('abcde110'),('abcde111');
select collation(c1) from t1 limit 1;
collation(c1)
utf8mb4_800_ci_ai
select c1 from t1 where c1 like 'abcdef%' order by c1;
c1
abcdefg
select c1 from t1 where c1 like 'abcde1%' order by c1;
c1
abcde100
abcde110
abcde111
select c1 from t1 where c1 like 'abcde11%' order by c1;
c1
abcde110
abcde111
select c1 from t1 where c1 like 'abcde111%' order by c1;
c1
abcde111
drop table t1;
select @@collation_connection;
@@collation_connection
utf8mb4_800_ci_ai
create table t1 ROW_FORMAT=DYNAMIC select repeat('a',50) as c1 ;
insert into t1 values('abcdef');
insert into t1 values('_bcdef');
insert into t1 values('a_cdef');
insert into t1 values('ab_def');
insert into t1 values('abc_ef');
insert into t1 values('abcd_f');
insert into t1 values('abcde_');
select c1 as c1u from t1 where c1 like 'ab\_def';
c1u
ab_def
select c1 as c2h from t1 where c1 like 'ab#_def' escape '#';
c2h
ab_def
drop table t1;
drop table if exists t1;
create table t1 select repeat('a',10) as c1;
delete from t1;
insert into t1 values (0x20),(0x21),(0x22),(0x23),(0x24),(0x25),(0x26),(0x27),(0x28),(0x29),(0x2A),(0x2B),(0x2C),(0x2D),(0x2E),(0x2F);
insert into t1 values (0x30),(0x31),(0x32),(0x33),(0x34),(0x35),(0x36),(0x37),(0x38),(0x39),(0x3A),(0x3B),(0x3C),(0x3D),(0x3E),(0x3F);
insert into t1 values (0x40),(0x41),(0x42),(0x43),(0x44),(0x45),(0x46),(0x47),(0x48),(0x49),(0x4A),(0x4B),(0x4C),(0x4D),(0x4E),(0x4F);
insert into t1 values (0x50),(0x51),(0x52),(0x53),(0x54),(0x55),(0x56),(0x57),(0x58),(0x59),(0x5A),(0x5B),(0x5C),(0x5D),(0x5E),(0x5F);
insert into t1 values (0x60),(0x61),(0x62),(0x63),(0x64),(0x65),(0x66),(0x67),(0x68),(0x69),(0x6A),(0x6B),(0x6C),(0x6D),(0x6E),(0x6F);
insert into t1 values (0x70),(0x71),(0x72),(0x73),(0x74),(0x75),(0x76),(0x77),(0x78),(0x79),(0x7A),(0x7B),(0x7C),(0x7D),(0x7E),(0x7F);
SELECT GROUP_CONCAT(c1 ORDER BY binary c1 SEPARATOR ''), GROUP_CONCAT(hex(c1) ORDER BY BINARY c1) FROM t1 GROUP BY c1;
GROUP_CONCAT(c1 ORDER BY binary c1 SEPARATOR '')	GROUP_CONCAT(hex(c1) ORDER BY BINARY c1)
 	20,7F
_	5F
-	2D
,	2C
;	3B
:	3A
!	21
?	3F
.	2E
'	27
"	22
(	28
)	29
[	5B
]	5D
{	7B
}	7D
@	40
*	2A
/	2F
\	5C
&	26
#	23
%	25
`	60
^	5E
+	2B
<	3C
=	3D
>	3E
|	7C
~	7E
$	24
0	30
1	31
2	32
3	33
4	34
5	35
6	36
7	37
8	38
9	39
Aa	41,61
Bb	42,62
Cc	43,63
Dd	44,64
Ee	45,65
Ff	46,66
Gg	47,67
Hh	48,68
Ii	49,69
Jj	4A,6A
Kk	4B,6B
Ll	4C,6C
Mm	4D,6D
Nn	4E,6E
Oo	4F,6F
Pp	50,70
Qq	51,71
Rr	52,72
Ss	53,73
Tt	54,74
Uu	55,75
Vv	56,76
Ww	57,77
Xx	58,78
Yy	59,79
Zz	5A,7A
drop table t1;
SET NAMES utf8mb4 COLLATE utf8mb4_800_ci_ai;
SELECT HEX(CONVERT(_utf8mb4 0xF091AB9B41 USING ucs2));
HEX(CONVERT(_utf8mb4 0xF091AB9B41 USING ucs2))
003F0041
SELECT HEX(CONVERT(_utf8mb4 0xF091AB9B41 USING utf16));
HEX(CONVERT(_utf8mb4 0xF091AB9B41 USING utf16))
D806DEDB0041
SELECT HEX(CONVERT(_utf8mb4 0xF091AB9B41 USING utf32));
HEX(CONVERT(_utf8mb4 0xF091AB9B41 USING utf32))
00011ADB00000041
SELECT HEX(CONVERT(_ucs2 0xF8FF USING utf8mb4));
HEX(CONVERT(_ucs2 0xF8FF USING utf8mb4))
EFA3BF
SELECT HEX(CONVERT(_utf16 0xF8FF USING utf8mb4));
HEX(CONVERT(_utf16 0xF8FF USING utf8mb4))
EFA3BF
SELECT HEX(CONVERT(_utf32 0xF8FF USING utf8mb4));
HEX(CONVERT(_utf32 0xF8FF USING utf8mb4))
EFA3BF
SELECT HEX(CONVERT(_utf8mb4 0x8F USING ucs2));
ERROR HY000: Invalid utf8mb4 character string: '8F'
SELECT HEX(CONVERT(_utf8mb4 0xC230 USING ucs2));
ERROR HY000: Invalid utf8mb4 character string: 'C230'
SELECT HEX(CONVERT(_utf8mb4 0xE234F1 USING ucs2));
ERROR HY000: Invalid utf8mb4 character string: 'E234F1'
SELECT HEX(CONVERT(_utf8mb4 0xF4E25634 USING ucs2));
ERROR HY000: Invalid utf8mb4 character string: 'F4E256'
SELECT ASCII('ABC');
ASCII('ABC')
65
SELECT BIT_LENGTH('a');
BIT_LENGTH('a')
8
SELECT BIT_LENGTH('À');
BIT_LENGTH('À')
16
SELECT BIT_LENGTH('テ');
BIT_LENGTH('テ')
24
SELECT BIT_LENGTH('𝌆');
BIT_LENGTH('?')
32
SELECT CHAR_LENGTH('𝌆テÀa');
CHAR_LENGTH('?テÀa')
4
SELECT LENGTH('𝌆テÀa');
LENGTH('?テÀa')
10
SELECT FIELD('a', '𝌆テÀa');
FIELD('a', '?テÀa')
0
SELECT HEX('𝌆テÀa');
HEX('?テÀa')
F09D8C86E38386C38061
SELECT INSERT('𝌆テÀa', 2, 2, 'テb');
INSERT('?テÀa', 2, 2, 'テb')
𝌆テba
SELECT LOWER('𝌆テÀBcd');
LOWER('?テÀBcd')
𝌆テàbcd
SELECT ORD('𝌆');
ORD('?')
4036856966
SELECT UPPER('𝌆テàbCD');
UPPER('?テàbCD')
𝌆テÀBCD
SELECT LOCATE(_utf8mb4 0xF091AB9B41, _utf8mb4 0xF091AB9B42F091AB9B41F091AB9B43);
LOCATE(_utf8mb4 0xF091AB9B41, _utf8mb4 0xF091AB9B42F091AB9B41F091AB9B43)
3
SELECT HEX(REVERSE(_utf8mb4 0xF091AB9B41F091AB9B42F091AB9B43));
HEX(REVERSE(_utf8mb4 0xF091AB9B41F091AB9B42F091AB9B43))
43F091AB9B42F091AB9B41F091AB9B
SELECT HEX(SUBSTRING(_utf8mb4 0xF091AB9B41F091AB9B42F091AB9B43, 1, 2));
HEX(SUBSTRING(_utf8mb4 0xF091AB9B41F091AB9B42F091AB9B43, 1, 2))
F091AB9B41
SELECT HEX(SUBSTRING(_utf8mb4 0xF091AB9B41F091AB9B42F091AB9B43, -3, 2));
HEX(SUBSTRING(_utf8mb4 0xF091AB9B41F091AB9B42F091AB9B43, -3, 2))
42F091AB9B
SELECT HEX(TRIM(_utf8mb4 0x2020F091AB9B4120F091AB9B4120202020));
HEX(TRIM(_utf8mb4 0x2020F091AB9B4120F091AB9B4120202020))
F091AB9B4120F091AB9B41
SELECT HEX(WEIGHT_STRING('aA'));
HEX(WEIGHT_STRING('aA'))
1BC21BC2
SELECT HEX(WEIGHT_STRING(CAST(_utf32 x'337F' AS CHAR)));
HEX(WEIGHT_STRING(CAST(_utf32 x'337F' AS CHAR)))
FB40E82AFB40DF0FFB40CF1AFB40F93E
SELECT HEX(WEIGHT_STRING(CAST(_utf32 x'FDFA' AS CHAR)));
HEX(WEIGHT_STRING(CAST(_utf32 x'FDFA' AS CHAR)))
22DB2311233902092286231123112325
select @@collation_connection;
@@collation_connection
utf8mb4_800_ci_ai
select hex(weight_string('a'));
hex(weight_string('a'))
1BC2
select hex(weight_string('A'));
hex(weight_string('A'))
1BC2
select hex(weight_string('abc'));
hex(weight_string('abc'))
1BC21BDB1BF5
select hex(weight_string('abc' as char(2)));
hex(weight_string('abc' as char(2)))
1BC21BDB
select hex(weight_string('abc' as char(3)));
hex(weight_string('abc' as char(3)))
1BC21BDB1BF5
select hex(weight_string('abc' as char(5)));
hex(weight_string('abc' as char(5)))
1BC21BDB1BF502090209
select hex(weight_string('abc', 1, 2, 0xC0));
hex(weight_string('abc', 1, 2, 0xC0))
1B
select hex(weight_string('abc', 2, 2, 0xC0));
hex(weight_string('abc', 2, 2, 0xC0))
1BC2
select hex(weight_string('abc', 3, 2, 0xC0));
hex(weight_string('abc', 3, 2, 0xC0))
1BC21B
select hex(weight_string('abc', 4, 2, 0xC0));
hex(weight_string('abc', 4, 2, 0xC0))
1BC21BDB
select hex(weight_string('abc', 5, 2, 0xC0));
hex(weight_string('abc', 5, 2, 0xC0))
1BC21BDB02
select hex(weight_string('abc',25, 2, 0xC0));
hex(weight_string('abc',25, 2, 0xC0))
1BC21BDB020902090209020902090209020902090209020902
select hex(weight_string('abc', 1, 3, 0xC0));
hex(weight_string('abc', 1, 3, 0xC0))
1B
select hex(weight_string('abc', 2, 3, 0xC0));
hex(weight_string('abc', 2, 3, 0xC0))
1BC2
select hex(weight_string('abc', 3, 3, 0xC0));
hex(weight_string('abc', 3, 3, 0xC0))
1BC21B
select hex(weight_string('abc', 4, 3, 0xC0));
hex(weight_string('abc', 4, 3, 0xC0))
1BC21BDB
select hex(weight_string('abc', 5, 3, 0xC0));
hex(weight_string('abc', 5, 3, 0xC0))
1BC21BDB1B
select hex(weight_string('abc',25, 3, 0xC0));
hex(weight_string('abc',25, 3, 0xC0))
1BC21BDB1BF502090209020902090209020902090209020902
select hex(weight_string('abc', 1, 4, 0xC0));
hex(weight_string('abc', 1, 4, 0xC0))
1B
select hex(weight_string('abc', 2, 4, 0xC0));
hex(weight_string('abc', 2, 4, 0xC0))
1BC2
select hex(weight_string('abc', 3, 4, 0xC0));
hex(weight_string('abc', 3, 4, 0xC0))
1BC21B
select hex(weight_string('abc', 4, 4, 0xC0));
hex(weight_string('abc', 4, 4, 0xC0))
1BC21BDB
select hex(weight_string('abc', 5, 4, 0xC0));
hex(weight_string('abc', 5, 4, 0xC0))
1BC21BDB1B
select hex(weight_string('abc',25, 4, 0xC0));
hex(weight_string('abc',25, 4, 0xC0))
1BC21BDB1BF502090209020902090209020902090209020902
select @@collation_connection;
@@collation_connection
utf8mb4_800_ci_ai
select hex(weight_string(cast(_latin1 0x80 as char)));
hex(weight_string(cast(_latin1 0x80 as char)))
1BA5
select hex(weight_string(cast(_latin1 0x808080 as char)));
hex(weight_string(cast(_latin1 0x808080 as char)))
1BA51BA51BA5
select hex(weight_string(cast(_latin1 0x808080 as char) as char(2)));
hex(weight_string(cast(_latin1 0x808080 as char) as char(2)))
1BA51BA5
select hex(weight_string(cast(_latin1 0x808080 as char) as char(3)));
hex(weight_string(cast(_latin1 0x808080 as char) as char(3)))
1BA51BA51BA5
select hex(weight_string(cast(_latin1 0x808080 as char) as char(5)));
hex(weight_string(cast(_latin1 0x808080 as char) as char(5)))
1BA51BA51BA502090209
select hex(weight_string(cast(_latin1 0x808080 as char), 1, 2, 0xC0));
hex(weight_string(cast(_latin1 0x808080 as char), 1, 2, 0xC0))
1B
select hex(weight_string(cast(_latin1 0x808080 as char), 2, 2, 0xC0));
hex(weight_string(cast(_latin1 0x808080 as char), 2, 2, 0xC0))
1BA5
select hex(weight_string(cast(_latin1 0x808080 as char), 3, 2, 0xC0));
hex(weight_string(cast(_latin1 0x808080 as char), 3, 2, 0xC0))
1BA51B
select hex(weight_string(cast(_latin1 0x808080 as char), 4, 2, 0xC0));
hex(weight_string(cast(_latin1 0x808080 as char), 4, 2, 0xC0))
1BA51BA5
select hex(weight_string(cast(_latin1 0x808080 as char), 5, 2, 0xC0));
hex(weight_string(cast(_latin1 0x808080 as char), 5, 2, 0xC0))
1BA51BA502
select hex(weight_string(cast(_latin1 0x808080 as char),25, 2, 0xC0));
hex(weight_string(cast(_latin1 0x808080 as char),25, 2, 0xC0))
1BA51BA5020902090209020902090209020902090209020902
select hex(weight_string(cast(_latin1 0x808080 as char), 1, 3, 0xC0));
hex(weight_string(cast(_latin1 0x808080 as char), 1, 3, 0xC0))
1B
select hex(weight_string(cast(_latin1 0x808080 as char), 2, 3, 0xC0));
hex(weight_string(cast(_latin1 0x808080 as char), 2, 3, 0xC0))
1BA5
select hex(weight_string(cast(_latin1 0x808080 as char), 3, 3, 0xC0));
hex(weight_string(cast(_latin1 0x808080 as char), 3, 3, 0xC0))
1BA51B
select hex(weight_string(cast(_latin1 0x808080 as char), 4, 3, 0xC0));
hex(weight_string(cast(_latin1 0x808080 as char), 4, 3, 0xC0))
1BA51BA5
select hex(weight_string(cast(_latin1 0x808080 as char), 5, 3, 0xC0));
hex(weight_string(cast(_latin1 0x808080 as char), 5, 3, 0xC0))
1BA51BA51B
select hex(weight_string(cast(_latin1 0x808080 as char),25, 3, 0xC0));
hex(weight_string(cast(_latin1 0x808080 as char),25, 3, 0xC0))
1BA51BA51BA502090209020902090209020902090209020902
select hex(weight_string(cast(_latin1 0x808080 as char), 1, 4, 0xC0));
hex(weight_string(cast(_latin1 0x808080 as char), 1, 4, 0xC0))
1B
select hex(weight_string(cast(_latin1 0x808080 as char), 2, 4, 0xC0));
hex(weight_string(cast(_latin1 0x808080 as char), 2, 4, 0xC0))
1BA5
select hex(weight_string(cast(_latin1 0x808080 as char), 3, 4, 0xC0));
hex(weight_string(cast(_latin1 0x808080 as char), 3, 4, 0xC0))
1BA51B
select hex(weight_string(cast(_latin1 0x808080 as char), 4, 4, 0xC0));
hex(weight_string(cast(_latin1 0x808080 as char), 4, 4, 0xC0))
1BA51BA5
select hex(weight_string(cast(_latin1 0x808080 as char), 5, 4, 0xC0));
hex(weight_string(cast(_latin1 0x808080 as char), 5, 4, 0xC0))
1BA51BA51B
select hex(weight_string(cast(_latin1 0x808080 as char),25, 4, 0xC0));
hex(weight_string(cast(_latin1 0x808080 as char),25, 4, 0xC0))
1BA51BA51BA502090209020902090209020902090209020902
select @@collation_connection;
@@collation_connection
utf8mb4_800_ci_ai
select hex(weight_string('a' LEVEL 1));
hex(weight_string('a' LEVEL 1))
1BC2
select hex(weight_string('A' LEVEL 1));
hex(weight_string('A' LEVEL 1))
1BC2
select hex(weight_string('abc' LEVEL 1));
hex(weight_string('abc' LEVEL 1))
1BC21BDB1BF5
select hex(weight_string('abc' as char(2) LEVEL 1));
hex(weight_string('abc' as char(2) LEVEL 1))
1BC21BDB
select hex(weight_string('abc' as char(3) LEVEL 1));
hex(weight_string('abc' as char(3) LEVEL 1))
1BC21BDB1BF5
select hex(weight_string('abc' as char(5) LEVEL 1));
hex(weight_string('abc' as char(5) LEVEL 1))
1BC21BDB1BF502090209
select hex(weight_string('abc' as char(5) LEVEL 1 REVERSE));
hex(weight_string('abc' as char(5) LEVEL 1 REVERSE))
09020902F51BDB1BC21B
select hex(weight_string('abc' as char(5) LEVEL 1 DESC));
hex(weight_string('abc' as char(5) LEVEL 1 DESC))
E43DE424E40AFDF6FDF6
select hex(weight_string('abc' as char(5) LEVEL 1 DESC REVERSE));
hex(weight_string('abc' as char(5) LEVEL 1 DESC REVERSE))
F6FDF6FD0AE424E43DE4
CREATE TABLE t1 AS SELECT repeat('a', 10) as c LIMIT 0;
SHOW CREATE TABLE t1;
Table	Create Table
t1	CREATE TABLE `t1` (
  `c` varchar(10) CHARACTER SET utf8mb4 COLLATE utf8mb4_800_ci_ai DEFAULT NULL
) ENGINE=InnoDB DEFAULT CHARSET=latin1
INSERT INTO t1 VALUES (_utf32 0x0180),(_utf32 0x023A);
INSERT INTO t1 VALUES (_utf32 0x023B),(_utf32 0x023C);
INSERT INTO t1 VALUES (_utf32 0x023D),(_utf32 0x023E);
INSERT INTO t1 VALUES (_utf32 0x0241),(_utf32 0x0242);
INSERT INTO t1 VALUES (_utf32 0x0243),(_utf32 0x0244);
INSERT INTO t1 VALUES (_utf32 0x0245),(_utf32 0x0246);
INSERT INTO t1 VALUES (_utf32 0x0247),(_utf32 0x0248);
INSERT INTO t1 VALUES (_utf32 0x0249),(_utf32 0x024A);
INSERT INTO t1 VALUES (_utf32 0x024B),(_utf32 0x024C);
INSERT INTO t1 VALUES (_utf32 0x024D),(_utf32 0x024E);
INSERT INTO t1 VALUES (_utf32 0x024F),(_utf32 0x026B);
INSERT INTO t1 VALUES (_utf32 0x027D),(_utf32 0x0289);
INSERT INTO t1 VALUES (_utf32 0x028C);
INSERT INTO t1 VALUES (_utf32 0x037B), (_utf32 0x037C);
INSERT INTO t1 VALUES (_utf32 0x037D), (_utf32 0x03FD);
INSERT INTO t1 VALUES (_utf32 0x03FE), (_utf32 0x03FF);
INSERT INTO t1 VALUES (_utf32 0x04C0), (_utf32 0x04CF);
INSERT INTO t1 VALUES (_utf32 0x04F6), (_utf32 0x04F7);
INSERT INTO t1 VALUES (_utf32 0x04FA), (_utf32 0x04FB);
INSERT INTO t1 VALUES (_utf32 0x04FC), (_utf32 0x04FD);
INSERT INTO t1 VALUES (_utf32 0x04FE), (_utf32 0x04FF);
INSERT INTO t1 VALUES (_utf32 0x0510), (_utf32 0x0511);
INSERT INTO t1 VALUES (_utf32 0x0512), (_utf32 0x0513);
INSERT INTO t1 VALUES (_utf32 0x10A0), (_utf32 0x10A1);
INSERT INTO t1 VALUES (_utf32 0x10A2), (_utf32 0x10A3);
INSERT INTO t1 VALUES (_utf32 0x10A4), (_utf32 0x10A5);
INSERT INTO t1 VALUES (_utf32 0x10A6), (_utf32 0x10A7);
INSERT INTO t1 VALUES (_utf32 0x2D00), (_utf32 0x2D01);
INSERT INTO t1 VALUES (_utf32 0x2D02), (_utf32 0x2D03);
INSERT INTO t1 VALUES (_utf32 0x2D04), (_utf32 0x2D05);
INSERT INTO t1 VALUES (_utf32 0x2D06), (_utf32 0x2D07);
INSERT INTO t1 VALUES (_utf32 0x1D7D);
INSERT INTO t1 VALUES (_utf32 0x2132),(_utf32 0x214E);
INSERT INTO t1 VALUES (_utf32 0x2183),(_utf32 0x2184);
INSERT INTO t1 VALUES (_utf32 0x2C80), (_utf32 0x2C81);
INSERT INTO t1 VALUES (_utf32 0x2C82), (_utf32 0x2C83);
INSERT INTO t1 VALUES (_utf32 0x2C84), (_utf32 0x2C85);
INSERT INTO t1 VALUES (_utf32 0x2C86), (_utf32 0x2C87);
INSERT INTO t1 VALUES (_utf32 0x2C88), (_utf32 0x2C89);
INSERT INTO t1 VALUES (_utf32 0x2C8A), (_utf32 0x2C8B);
INSERT INTO t1 VALUES (_utf32 0x2C8C), (_utf32 0x2C8D);
INSERT INTO t1 VALUES (_utf32 0x2C8E), (_utf32 0x2C8F);
INSERT INTO t1 VALUES (_utf32 0x2C60), (_utf32 0x2C61);
INSERT INTO t1 VALUES (_utf32 0x2C62), (_utf32 0x2C63);
INSERT INTO t1 VALUES (_utf32 0x2C64), (_utf32 0x2C65);
INSERT INTO t1 VALUES (_utf32 0x2C66), (_utf32 0x2C67);
INSERT INTO t1 VALUES (_utf32 0x2C68), (_utf32 0x2C69);
INSERT INTO t1 VALUES (_utf32 0x2C6A), (_utf32 0x2C6B);
INSERT INTO t1 VALUES (_utf32 0x2C6C), (_utf32 0x2C75);
INSERT INTO t1 VALUES (_utf32 0x2C76);
INSERT INTO t1 VALUES (_utf32 0x2C00), (_utf32 0x2C01);
INSERT INTO t1 VALUES (_utf32 0x2C02), (_utf32 0x2C03);
INSERT INTO t1 VALUES (_utf32 0x2C04), (_utf32 0x2C05);
INSERT INTO t1 VALUES (_utf32 0x2C06), (_utf32 0x2C07);
INSERT INTO t1 VALUES (_utf32 0x2C30), (_utf32 0x2C31);
INSERT INTO t1 VALUES (_utf32 0x2C32), (_utf32 0x2C33);
INSERT INTO t1 VALUES (_utf32 0x2C34), (_utf32 0x2C35);
INSERT INTO t1 VALUES (_utf32 0x2C36), (_utf32 0x2C37);
INSERT INTO t1 VALUES (_utf32 0x10400), (_utf32 0x10401);
INSERT INTO t1 VALUES (_utf32 0x10402), (_utf32 0x10403);
INSERT INTO t1 VALUES (_utf32 0x10404), (_utf32 0x10405);
INSERT INTO t1 VALUES (_utf32 0x10406), (_utf32 0x10407);
INSERT INTO t1 VALUES (_utf32 0x10428), (_utf32 0x10429);
INSERT INTO t1 VALUES (_utf32 0x1042A), (_utf32 0x1042B);
INSERT INTO t1 VALUES (_utf32 0x1042C), (_utf32 0x1042D);
INSERT INTO t1 VALUES (_utf32 0x1042E), (_utf32 0x1042F);
INSERT INTO t1 VALUES (_utf32 0x0370);
INSERT INTO t1 VALUES (_utf32 0x0371);
INSERT INTO t1 VALUES (_utf32 0x0372);
INSERT INTO t1 VALUES (_utf32 0x0373);
INSERT INTO t1 VALUES (_utf32 0x0514);
INSERT INTO t1 VALUES (_utf32 0x0515);
INSERT INTO t1 VALUES (_utf32 0x0516);
INSERT INTO t1 VALUES (_utf32 0x0517);
INSERT INTO t1 VALUES (_utf32 0xA640);
INSERT INTO t1 VALUES (_utf32 0xA641);
INSERT INTO t1 VALUES (_utf32 0xA642);
INSERT INTO t1 VALUES (_utf32 0xA643);
INSERT INTO t1 VALUES (_utf32 0xA722);
INSERT INTO t1 VALUES (_utf32 0xA723);
INSERT INTO t1 VALUES (_utf32 0xA724);
INSERT INTO t1 VALUES (_utf32 0xA725);
INSERT INTO t1 VALUES (_utf32 0xA726);
INSERT INTO t1 VALUES (_utf32 0xA727);
INSERT INTO t1 VALUES (_utf32 0xA728);
INSERT INTO t1 VALUES (_utf32 0xA729);
INSERT INTO t1 VALUES (_utf32 0xA72A);
INSERT INTO t1 VALUES (_utf32 0xA72B);
INSERT INTO t1 VALUES (_utf32 0x2CEB);
INSERT INTO t1 VALUES (_utf32 0x2CEC);
INSERT INTO t1 VALUES (_utf32 0x2CED);
INSERT INTO t1 VALUES (_utf32 0x2CEE);
INSERT INTO t1 VALUES (_utf32 0x1FA01);
INSERT INTO t1 VALUES (_utf32 0x1FB01);
INSERT INTO t1 VALUES (_utf32 0x1FC01);
INSERT INTO t1 VALUES (_utf32 0x1FD01);
INSERT INTO t1 VALUES (_utf32 0x1F603);
INSERT INTO t1 VALUES (_utf32 0x1F604);
INSERT INTO t1 VALUES (_utf32 0x1F648);
INSERT INTO t1 VALUES (_utf32 0x1F64F);
INSERT INTO t1 VALUES (_utf32 0x2B759);
INSERT INTO t1 VALUES (_utf32 0x2B760);
INSERT INTO t1 VALUES (_utf32 0x2B761);
INSERT INTO t1 VALUES (_utf32 0x2B762);
INSERT INTO t1 VALUES (_utf32 0x16F00);
INSERT INTO t1 VALUES (_utf32 0x16F01);
INSERT INTO t1 VALUES (_utf32 0x08A2);
INSERT INTO t1 VALUES (_utf32 0x08A3);
INSERT INTO t1 VALUES (_utf32 0xA794);
INSERT INTO t1 VALUES (_utf32 0xA795);
INSERT INTO t1 VALUES (_utf32 0xA796);
INSERT INTO t1 VALUES (_utf32 0xA797);
INSERT INTO t1 VALUES (_utf32 0xAB37);
INSERT INTO t1 VALUES (_utf32 0xAB38);
INSERT INTO t1 VALUES (_utf32 0x10600);
INSERT INTO t1 VALUES (_utf32 0x10601);
INSERT INTO t1 VALUES (_utf32 0x10602);
INSERT INTO t1 VALUES (_utf32 0x10603);
INSERT INTO t1 VALUES (_utf32 0x1F800);
INSERT INTO t1 VALUES (_utf32 0x1F801);
INSERT INTO t1 VALUES (_utf32 0x1F802);
INSERT INTO t1 VALUES (_utf32 0x1F803);
INSERT INTO t1 VALUES (_utf32 0x10C92);
INSERT INTO t1 VALUES (_utf32 0x10C93);
INSERT INTO t1 VALUES (_utf32 0x10C94);
INSERT INTO t1 VALUES (_utf32 0x10C95);
INSERT INTO t1 VALUES (_utf32 0x2B836);
INSERT INTO t1 VALUES (_utf32 0x2B837);
INSERT INTO t1 VALUES (_utf32 0x2B838);
INSERT INTO t1 VALUES (_utf32 0x2B839);
SELECT hex(c), hex(lower(c)), hex(upper(c)), hex(weight_string(c)), c
FROM t1 ORDER BY c, BINARY c;
hex(c)	hex(lower(c))	hex(upper(c))	hex(weight_string(c))	c
F09F9883	F09F9883	F09F9883	1593	😃
F09F9884	F09F9884	F09F9884	1594	😄
F09F9988	F09F9988	F09F9988	15D8	🙈
F09F998F	F09F998F	F09F998F	15DF	🙏
F09FA080	F09FA080	F09FA080	173B	🠀
F09FA081	F09FA081	F09FA081	173C	🠁
F09FA082	F09FA082	F09FA082	173D	🠂
F09FA083	F09FA083	F09FA083	173E	🠃
C8BA		C8BA	1BC7	Ⱥ
E2B1A5	E2B1A5	C8BA	1BC7	ⱥ
C680	C680	C983	1BE3	ƀ
C983	C680	C983	1BE3	Ƀ
EA9E96	EA9E97	EA9E96	1BEA	Ꞗ
EA9E97	EA9E97	EA9E96	1BEA	ꞗ
C8BB	C8BC	C8BB	1BFA	Ȼ
C8BC	C8BC	C8BB	1BFA	ȼ
EA9E94	EA9E94	EA9E94	1BFF	ꞔ
E28683	E28684	E28683	1C08	Ↄ
E28684	E28684	E28683	1C08	ↄ
C986	C987	C986	1C2C	Ɇ
C987	C987	C986	1C2C	ɇ
E284B2	E2858E	E284B2	1C6D	Ⅎ
E2858E	E2858E	E284B2	1C6D	ⅎ
EA9E95	EA9E95	EA9E95	1C9F	ꞕ
E2B1A7	E2B1A8	E2B1A7	1CA4	Ⱨ
E2B1A8	E2B1A8	E2B1A7	1CA4	ⱨ
E2B1B5	E2B1B6	E2B1B5	1CA5	Ⱶ
E2B1B6	E2B1B6	E2B1B5	1CA5	ⱶ
EA9CA6	EA9CA7	EA9CA6	1CA6	Ꜧ
EA9CA7	EA9CA7	EA9CA6	1CA6	ꜧ
C988	C989	C988	1CD0	Ɉ
C989	C989	C988	1CD0	ɉ
E2B1A9	E2B1AA	E2B1A9	1CEA	Ⱪ
E2B1AA	E2B1AA	E2B1A9	1CEA	ⱪ
C8BD	C69A	C8BD	1CFD	Ƚ
E2B1A0	E2B1A1	E2B1A0	1D01	Ⱡ
E2B1A1	E2B1A1	E2B1A0	1D01	ⱡ
C9AB	C9AB		1D02	ɫ
E2B1A2	C9AB	E2B1A2	1D02	Ɫ
EAACB8	EAACB8	EAACB8	1D06	ꬸ
EAACB7	EAACB7	EAACB7	1D0C	ꬷ
E1B5BD	E1B5BD	E2B1A3	1D8C	ᵽ
E2B1A3	E1B5BD	E2B1A3	1D8C	Ᵽ
C98A	C98B	C98A	1DA6	Ɋ
C98B	C98B	C98A	1DA6	ɋ
C98C	C98D	C98C	1DBA	Ɍ
C98D	C98D	C98C	1DBA	ɍ
C9BD	C9BD		1DD2	ɽ
E2B1A4	C9BD	E2B1A4	1DD2	Ɽ
EA9CA8	EA9CA9	EA9CA8	1E101E9C	Ꜩ
EA9CA9	EA9CA9	EA9CA8	1E101E9C	ꜩ
C8BE		C8BE	1E19	Ⱦ
E2B1A6	E2B1A6	C8BE	1E19	ⱦ
C984	CA89	C984	1E3B	Ʉ
CA89	CA89	C984	1E3B	ʉ
C985	CA8C	C985	1E6C	Ʌ
CA8C	CA8C	C985	1E6C	ʌ
C98E	C98F	C98E	1E8E	Ɏ
C98F	C98F	C98E	1E8E	ɏ
E2B1AB	E2B1AC	E2B1AB	1EB7	Ⱬ
E2B1AC	E2B1AC	E2B1AB	1EB7	ⱬ
EA9CAA	EA9CAB	EA9CAA	1EE1	Ꜫ
EA9CAB	EA9CAB	EA9CAA	1EE1	ꜫ
C981	C982	C981	1EF4	Ɂ
C982	C982	C981	1EF4	ɂ
EA9CA2	EA9CA3	EA9CA2	1EFC	Ꜣ
EA9CA3	EA9CA3	EA9CA2	1EFC	ꜣ
EA9CA4	EA9CA5	EA9CA4	1F07	Ꜥ
EA9CA5	EA9CA5	EA9CA4	1F07	ꜥ
CDB0	CDB1	CDB0	1F3E	Ͱ
CDB1	CDB1	CDB0	1F3E	ͱ
CDBC	CDBC	CFBE	1F53	ͼ
CFBE	CDBC	CFBE	1F53	Ͼ
CDBB	CDBB	CFBD	1F54	ͻ
CFBD	CDBB	CFBD	1F54	Ͻ
CDBD	CDBD	CFBF	1F55	ͽ
CFBF	CDBD	CFBF	1F55	Ͽ
CDB2	CDB3	CDB2	1F5F	Ͳ
CDB3	CDB3	CDB2	1F5F	ͳ
E2B280	E2B281	E2B280	1F61	Ⲁ
E2B281	E2B281	E2B280	1F61	ⲁ
E2B282	E2B283	E2B282	1F62	Ⲃ
E2B283	E2B283	E2B282	1F62	ⲃ
E2B284	E2B285	E2B284	1F63	Ⲅ
E2B285	E2B285	E2B284	1F63	ⲅ
E2B286	E2B287	E2B286	1F64	Ⲇ
E2B287	E2B287	E2B286	1F64	ⲇ
E2B288	E2B289	E2B288	1F65	Ⲉ
E2B289	E2B289	E2B288	1F65	ⲉ
E2B28A	E2B28B	E2B28A	1F67	Ⲋ
E2B28B	E2B28B	E2B28A	1F67	ⲋ
E2B28C	E2B28D	E2B28C	1F68	Ⲍ
E2B28D	E2B28D	E2B28C	1F68	ⲍ
E2B28E	E2B28F	E2B28E	1F69	Ⲏ
E2B28F	E2B28F	E2B28E	1F69	ⲏ
E2B3AB	E2B3AC	E2B3AB	1F81	Ⳬ
E2B3AC	E2B3AC	E2B3AB	1F81	ⳬ
E2B3AD	E2B3AE	E2B3AD	1F91	Ⳮ
E2B3AE	E2B3AE	E2B3AD	1F91	ⳮ
D3BA	D3BB	D3BA	1FB9	Ӻ
D3BB	D3BB	D3BA	1FB9	ӻ
D3B6	D3B7	D3B6	1FC1	Ӷ
D3B7	D3B7	D3B6	1FC1	ӷ
EA9980	EA9981	EA9980	1FEB	Ꙁ
EA9981	EA9981	EA9980	1FEB	ꙁ
D490	D491	D490	1FED	Ԑ
D491	D491	D490	1FED	ԑ
EA9982	EA9983	EA9982	1FEE	Ꙃ
EA9983	EA9983	EA9982	1FEE	ꙃ
D492	D493	D492	2035	Ԓ
D493	D493	D492	2035	ԓ
D494	D495	D494	203D	Ԕ
D495	D495	D494	203D	ԕ
D496	D497	D496	207F	Ԗ
D497	D497	D496	207F	ԗ
D3BC	D3BD	D3BC	20B1	Ӽ
D3BD	D3BD	D3BC	20B1	ӽ
D3BE	D3BF	D3BE	20B5	Ӿ
D3BF	D3BF	D3BE	20B5	ӿ
D380	D38F	D380	215C	Ӏ
D38F	D38F	D380	215C	ӏ
E2B080	E2B0B0	E2B080	2160	Ⰰ
E2B0B0	E2B0B0	E2B080	2160	ⰰ
E2B081	E2B0B1	E2B081	2161	Ⰱ
E2B0B1	E2B0B1	E2B081	2161	ⰱ
E2B082	E2B0B2	E2B082	2162	Ⰲ
E2B0B2	E2B0B2	E2B082	2162	ⰲ
E2B083	E2B0B3	E2B083	2163	Ⰳ
E2B0B3	E2B0B3	E2B083	2163	ⰳ
E2B084	E2B0B4	E2B084	2164	Ⰴ
E2B0B4	E2B0B4	E2B084	2164	ⰴ
E2B085	E2B0B5	E2B085	2165	Ⰵ
E2B0B5	E2B0B5	E2B085	2165	ⰵ
E2B086	E2B0B6	E2B086	2166	Ⰶ
E2B0B6	E2B0B6	E2B086	2166	ⰶ
E2B087	E2B0B7	E2B087	2167	Ⰷ
E2B0B7	E2B0B7	E2B087	2167	ⰷ
E182A0	E2B480	E182A0	21B6	Ⴀ
E2B480	E2B480	E182A0	21B6	ⴀ
E182A1	E2B481	E182A1	21B8	Ⴁ
E2B481	E2B481	E182A1	21B8	ⴁ
E182A2	E2B482	E182A2	21BA	Ⴂ
E2B482	E2B482	E182A2	21BA	ⴂ
E182A3	E2B483	E182A3	21BC	Ⴃ
E2B483	E2B483	E182A3	21BC	ⴃ
E182A4	E2B484	E182A4	21BE	Ⴄ
E2B484	E2B484	E182A4	21BE	ⴄ
E182A5	E2B485	E182A5	21C0	Ⴅ
E2B485	E2B485	E182A5	21C0	ⴅ
E182A6	E2B486	E182A6	21C2	Ⴆ
E2B486	E2B486	E182A6	21C2	ⴆ
E182A7	E2B487	E182A7	21C6	Ⴇ
E2B487	E2B487	E182A7	21C6	ⴇ
E0A2A2	E0A2A2	E0A2A2	22A3	ࢢ
E0A2A3	E0A2A3	E0A2A3	22E4	ࢣ
F090B292	F090B392	F090B292	359D	𐲒
F090B293	F090B393	F090B293	359E	𐲓
F090B294	F090B394	F090B294	359F	𐲔
F090B295	F090B395	F090B295	35A0	𐲕
F096BC80	F096BC80	F096BC80	40E3	𖼀
F096BC81	F096BC81	F096BC81	40E4	𖼁
F0909080	F09090A8	F0909080	42BB	𐐀
F09090A8	F09090A8	F0909080	42BB	𐐨
F0909081	F09090A9	F0909081	42BC	𐐁
F09090A9	F09090A9	F0909081	42BC	𐐩
F0909082	F09090AA	F0909082	42BD	𐐂
F09090AA	F09090AA	F0909082	42BD	𐐪
F0909083	F09090AB	F0909083	42BE	𐐃
F09090AB	F09090AB	F0909083	42BE	𐐫
F0909084	F09090AC	F0909084	42BF	𐐄
F09090AC	F09090AC	F0909084	42BF	𐐬
F0909085	F09090AD	F0909085	42C0	𐐅
F09090AD	F09090AD	F0909085	42C0	𐐭
F0909086	F09090AE	F0909086	42C1	𐐆
F09090AE	F09090AE	F0909086	42C1	𐐮
F0909087	F09090AF	F0909087	42C2	𐐇
F09090AF	F09090AF	F0909087	42C2	𐐯
F0909880	F0909880	F0909880	4523	𐘀
F0909881	F0909881	F0909881	4524	𐘁
F0909882	F0909882	F0909882	4525	𐘂
F0909883	F0909883	F0909883	4526	𐘃
F09FA881	F09FA881	F09FA881	FBC3FA01	🨁
F09FAC81	F09FAC81	F09FAC81	FBC3FB01	🬁
F09FB081	F09FB081	F09FB081	FBC3FC01	🰁
F09FB481	F09FB481	F09FB481	FBC3FD01	🴁
F0AB9D99	F0AB9D99	F0AB9D99	FBC5B759	𫝙
F0AB9DA0	F0AB9DA0	F0AB9DA0	FBC5B760	𫝠
F0AB9DA1	F0AB9DA1	F0AB9DA1	FBC5B761	𫝡
F0AB9DA2	F0AB9DA2	F0AB9DA2	FBC5B762	𫝢
F0ABA0B6	F0ABA0B6	F0ABA0B6	FBC5B836	𫠶
F0ABA0B7	F0ABA0B7	F0ABA0B7	FBC5B837	𫠷
F0ABA0B8	F0ABA0B8	F0ABA0B8	FBC5B838	𫠸
F0ABA0B9	F0ABA0B9	F0ABA0B9	FBC5B839	𫠹
INSERT INTO t1 VALUES ('a');
INSERT INTO t1 VALUES (concat(_utf32 0x61, _utf32 0xFFFF));
INSERT INTO t1 VALUES (concat(_utf32 0x61, _utf32 0x10FFFF));
INSERT INTO t1 VALUES (concat(_utf32 0x61, _utf32 0x10400));
SELECT hex(c), hex(weight_string(c)) FROM t1 WHERE c LIKE 'a%' ORDER BY c;
hex(c)	hex(weight_string(c))
61	1BC2
61F0909080	1BC242BB
61EFBFBF	1BC2FBC1FFFF
61F48FBFBF	1BC2FBE1FFFF
SELECT hex(c), hex(weight_string(c)), c FROM t1 WHERE c LIKE _utf32 0x10400 ORDER BY c, BINARY c;
hex(c)	hex(weight_string(c))	c
F0909080	42BB	𐐀
F09090A8	42BB	𐐨
SELECT hex(c), hex(weight_string(c)), c FROM t1 WHERE c LIKE _utf32 0x10428 ORDER BY c, BINARY c;
hex(c)	hex(weight_string(c))	c
F0909080	42BB	𐐀
F09090A8	42BB	𐐨
ALTER TABLE t1 ADD KEY(c);
EXPLAIN SELECT hex(c) FROM t1 WHERE c LIKE 'a%' ORDER BY c;
id	select_type	table	partitions	type	possible_keys	key	key_len	ref	rows	filtered	Extra
1	SIMPLE	t1	NULL	range	c	c	43	NULL	4	100.00	Using where; Using index
Warnings:
Note	1003	/* select#1 */ select hex(`test`.`t1`.`c`) AS `hex(c)` from `test`.`t1` where (`test`.`t1`.`c` like 'a%') order by `test`.`t1`.`c`
SELECT hex(c), hex(weight_string(c)) FROM t1 WHERE c LIKE 'a%' ORDER BY c;
hex(c)	hex(weight_string(c))
61	1BC2
61F0909080	1BC242BB
61EFBFBF	1BC2FBC1FFFF
61F48FBFBF	1BC2FBE1FFFF
SELECT hex(c), hex(weight_string(c)), c FROM t1 WHERE c LIKE _utf32 0x10400 ORDER BY c, BINARY c;
hex(c)	hex(weight_string(c))	c
F0909080	42BB	𐐀
F09090A8	42BB	𐐨
SELECT hex(c), hex(weight_string(c)), c FROM t1 WHERE c LIKE _utf32 0x10428 ORDER BY c, BINARY c;
hex(c)	hex(weight_string(c))	c
F0909080	42BB	𐐀
F09090A8	42BB	𐐨
DROP TABLE t1;
SELECT 'a' = 'a ';
'a' = 'a '
1
SELECT 'a\0' < 'a';
'a\0' < 'a'
0
SELECT 'a\0' < 'a ';
'a\0' < 'a '
0
SELECT 'a\t' < 'a';
'a\t' < 'a'
1
SELECT 'a\t' < 'a ';
'a\t' < 'a '
1
SELECT 'a' LIKE 'a';
'a' LIKE 'a'
1
SELECT 'A' LIKE 'a';
'A' LIKE 'a'
1
SELECT _utf8mb4 0xD0B0D0B1D0B2 LIKE CONCAT(_utf8mb4'%',_utf8mb4 0xD0B1,_utf8mb4 '%');
_utf8mb4 0xD0B0D0B1D0B2 LIKE CONCAT(_utf8mb4'%',_utf8mb4 0xD0B1,_utf8mb4 '%')
1
SELECT is_ipv4(inet_ntoa('1'));
is_ipv4(inet_ntoa('1'))
1
SELECT is_ipv6(inet_ntoa('1'));
is_ipv6(inet_ntoa('1'))
0
SELECT inet6_aton(inet_ntoa('1'));
inet6_aton(inet_ntoa('1'))
   
SELECT inet6_ntoa(inet_ntoa('1'));
inet6_ntoa(inet_ntoa('1'))
NULL
Warnings:
Warning	1411	Incorrect string value: 'inet_ntoa('1')' for function inet6_ntoa
#
# Bug#14040277 UNINITIALIZED VALUE REFERENCED IN STR_TO_IPV6
#
SELECT inet6_aton(soundex('a'));
inet6_aton(soundex('a'))
NULL
Warnings:
Warning	1411	Incorrect string value: 'soundex('a')' for function inet6_aton
#
# Bug#19047425 UNINITIALISED VALUE IN STR_TO_IPV6
#
do is_ipv4_mapped(inet6_aton(convert(_ascii "a:" using utf8mb4)));
Warnings:
Warning	1411	Incorrect string value: 'convert(_ascii'a:' using utf8mb4)' for function inet6_aton
CREATE TABLE t1 (c VARCHAR(10) CHARACTER SET utf8mb4);
INSERT INTO t1 VALUES (_utf8mb4 0xF09090A7), (_utf8mb4 0xEA8B93), (_utf8mb4 0xC4BC), (_utf8mb4 0xC6AD), (_utf8mb4 0xF090918F), (_utf8mb4 0xEAAD8B);
SELECT HEX(ANY_VALUE(c)), COUNT(c) FROM t1 GROUP BY c COLLATE utf8mb4_800_ci_ai;
HEX(ANY_VALUE(c))	COUNT(c)
C4BC	1
EAAD8B	1
C6AD	1
EA8B93	1
F09090A7	2
DROP TABLE t1;
CREATE TABLE t1 (a VARCHAR(10), b VARCHAR(10)) COLLATE utf8mb4_800_ci_ai;
INSERT INTO t1 VALUES(_utf16 0xAC00, _utf16 0x326E), (_utf16 0xAD, _utf16 0xA0),
(_utf16 0xC6, _utf16 0x41), (_utf16 0xC6, _utf16 0xAA), (_utf16 0xA73A, _utf16 0xA738);
SELECT a = b FROM t1;
a = b
1
1
0
0
1
DROP TABLE t1;
#
# End of 8.0 tests
#
