DROP TABLE IF EXISTS t1;
SET CHARACTER SET koi8r;
CREATE TABLE t1 (word VARCHAR(64) CHARACTER SET ucs2);
INSERT INTO t1 VALUES (_koi8r'Р'), (X'2004');
SELECT hex(word) FROM t1 ORDER BY word;
hex(word)
0420
2004
DELETE FROM t1;
INSERT INTO t1 VALUES (X'042000200020'), (X'200400200020');
SELECT hex(word) FROM t1 ORDER BY word;
hex(word)
0420
2004
DROP TABLE t1;
SELECT LPAD(_ucs2 X'0420',10,_ucs2 X'0421');
LPAD(_ucs2 X'0420',10,_ucs2 X'0421')
СССССССССР
SELECT LPAD(_ucs2 X'0420',10,_ucs2 X'04210422');
LPAD(_ucs2 X'0420',10,_ucs2 X'04210422')
СТСТСТСТСР
SELECT LPAD(_ucs2 X'0420',10,_ucs2 X'042104220423');
LPAD(_ucs2 X'0420',10,_ucs2 X'042104220423')
СТУСТУСТУР
SELECT LPAD(_ucs2 X'0420042104220423042404250426042704280429042A042B',10,_ucs2 X'042104220423');
LPAD(_ucs2 X'0420042104220423042404250426042704280429042A042B',10,_ucs2 X'042104220423')
РСТУФХЦЧШЩ
SELECT RPAD(_ucs2 X'0420',10,_ucs2 X'0421');
RPAD(_ucs2 X'0420',10,_ucs2 X'0421')
РССССССССС
SELECT RPAD(_ucs2 X'0420',10,_ucs2 X'04210422');
RPAD(_ucs2 X'0420',10,_ucs2 X'04210422')
РСТСТСТСТС
SELECT RPAD(_ucs2 X'0420',10,_ucs2 X'042104220423');
RPAD(_ucs2 X'0420',10,_ucs2 X'042104220423')
РСТУСТУСТУ
SELECT RPAD(_ucs2 X'0420042104220423042404250426042704280429042A042B',10,_ucs2 X'042104220423');
RPAD(_ucs2 X'0420042104220423042404250426042704280429042A042B',10,_ucs2 X'042104220423')
РСТУФХЦЧШЩ
CREATE TABLE t1 SELECT 
LPAD(_ucs2 X'0420',10,_ucs2 X'0421') l,
RPAD(_ucs2 X'0420',10,_ucs2 X'0421') r;
SHOW CREATE TABLE t1;
Table	Create Table
t1	CREATE TABLE `t1` (
  `l` char(10) character set ucs2 NOT NULL default '',
  `r` char(10) character set ucs2 NOT NULL default ''
) TYPE=MyISAM DEFAULT CHARSET=latin1
DROP TABLE t1;
SET NAMES koi8r;
SET character_set_connection=ucs2;
create table t1 (a varchar(10) character set ucs2, key(a));
insert into t1 values ("a"),("abc"),("abcd"),("hello"),("test");
explain select * from t1 where a like 'abc%';
id	select_type	table	type	possible_keys	key	key_len	ref	rows	Extra
1	SIMPLE	t1	range	a	a	21	NULL	1	Using where; Using index
explain select * from t1 where a like concat('abc','%');
id	select_type	table	type	possible_keys	key	key_len	ref	rows	Extra
1	SIMPLE	t1	range	a	a	21	NULL	1	Using where; Using index
select * from t1 where a like "abc%";
a
abc
abcd
select * from t1 where a like concat("abc","%");
a
abc
abcd
select * from t1 where a like "ABC%";
a
abc
abcd
select * from t1 where a like "test%";
a
test
select * from t1 where a like "te_t";
a
test
select * from t1 where a like "%a%";
a
select * from t1 where a like "%abcd%";
a
abcd
select * from t1 where a like "%abc\d%";
a
abcd
drop table t1;
CREATE TABLE t1 (a VARCHAR(10) CHARACTER SET ucs2);
INSERT INTO t1 VALUES ('фыва'),('Фыва'),('фЫва'),('фыВа'),('фывА'),('ФЫВА');
INSERT INTO t1 VALUES ('фывапролдж'),('Фывапролдж'),('фЫвапролдж'),('фыВапролдж');
INSERT INTO t1 VALUES ('фывАпролдж'),('фываПролдж'),('фывапРолдж'),('фывапрОлдж');
INSERT INTO t1 VALUES ('фывапроЛдж'),('фывапролДж'),('фывапролдЖ'),('ФЫВАПРОЛДЖ');
SELECT * FROM t1 WHERE a LIKE '%фЫва%';
a
фыва
Фыва
фЫва
фыВа
фывА
ФЫВА
фывапролдж
Фывапролдж
фЫвапролдж
фыВапролдж
фывАпролдж
фываПролдж
фывапРолдж
фывапрОлдж
фывапроЛдж
фывапролДж
фывапролдЖ
ФЫВАПРОЛДЖ
SELECT * FROM t1 WHERE a LIKE '%фЫв%';
a
фыва
Фыва
фЫва
фыВа
фывА
ФЫВА
фывапролдж
Фывапролдж
фЫвапролдж
фыВапролдж
фывАпролдж
фываПролдж
фывапРолдж
фывапрОлдж
фывапроЛдж
фывапролДж
фывапролдЖ
ФЫВАПРОЛДЖ
SELECT * FROM t1 WHERE a LIKE 'фЫва%';
a
фыва
Фыва
фЫва
фыВа
фывА
ФЫВА
фывапролдж
Фывапролдж
фЫвапролдж
фыВапролдж
фывАпролдж
фываПролдж
фывапРолдж
фывапрОлдж
фывапроЛдж
фывапролДж
фывапролдЖ
ФЫВАПРОЛДЖ
SELECT * FROM t1 WHERE a LIKE 'фЫва%' COLLATE ucs2_bin;
a
фЫва
фЫвапролдж
DROP TABLE t1;
CREATE TABLE t1 (word varchar(64) NOT NULL, PRIMARY KEY (word))
TYPE=MyISAM CHARACTER SET ucs2 COLLATE ucs2_general_ci;
INSERT INTO t1 (word) VALUES ("cat");
SELECT * FROM t1 WHERE word LIKE "c%";
word
cat
SELECT * FROM t1 WHERE word LIKE "ca_";
word
cat
SELECT * FROM t1 WHERE word LIKE "cat";
word
cat
SELECT * FROM t1 WHERE word LIKE _ucs2 x'00630025';
word
cat
SELECT * FROM t1 WHERE word LIKE _ucs2 x'00630061005F';
word
cat
DROP TABLE t1;
SET NAMES latin1;
CREATE TABLE t1 (
word VARCHAR(64),
bar INT(11) default 0,
PRIMARY KEY (word))
TYPE=MyISAM
CHARSET ucs2
COLLATE ucs2_general_ci ;
INSERT INTO t1 (word) VALUES ("aar");
INSERT INTO t1 (word) VALUES ("a");
INSERT INTO t1 (word) VALUES ("aardvar");
INSERT INTO t1 (word) VALUES ("aardvark");
INSERT INTO t1 (word) VALUES ("aardvara");
INSERT INTO t1 (word) VALUES ("aardvarz");
EXPLAIN SELECT * FROM t1 ORDER BY word;
id	select_type	table	type	possible_keys	key	key_len	ref	rows	Extra
1	SIMPLE	t1	ALL	NULL	NULL	NULL	NULL	6	Using filesort
SELECT * FROM t1 ORDER BY word;
word	bar
a	0
aar	0
aardvar	0
aardvara	0
aardvark	0
aardvarz	0
EXPLAIN SELECT word FROM t1 ORDER BY word;
id	select_type	table	type	possible_keys	key	key_len	ref	rows	Extra
1	SIMPLE	t1	index	NULL	PRIMARY	128	NULL	6	Using index
SELECT word FROM t1 ORDER by word;
word
a
aar
aardvar
aardvara
aardvark
aardvarz
DROP TABLE t1;
CREATE TABLE t1 (
word VARCHAR(64) ,
PRIMARY KEY (word))
TYPE=MyISAM
CHARSET ucs2
COLLATE ucs2_general_ci;
INSERT INTO t1 (word) VALUES ("aar");
INSERT INTO t1 (word) VALUES ("a");
INSERT INTO t1 (word) VALUES ("aardvar");
INSERT INTO t1 (word) VALUES ("aardvark");
INSERT INTO t1 (word) VALUES ("aardvara");
INSERT INTO t1 (word) VALUES ("aardvarz");
EXPLAIN SELECT * FROM t1 ORDER BY WORD;
id	select_type	table	type	possible_keys	key	key_len	ref	rows	Extra
1	SIMPLE	t1	index	NULL	PRIMARY	128	NULL	6	Using index
SELECT * FROM t1 ORDER BY word;
word
a
aar
aardvar
aardvara
aardvark
aardvarz
DROP TABLE t1;
CREATE TABLE t1 (
word TEXT,
bar INT(11) AUTO_INCREMENT,
PRIMARY KEY (bar))
TYPE=MyISAM
CHARSET ucs2
COLLATE ucs2_general_ci ;
INSERT INTO t1 (word) VALUES ("aar");
INSERT INTO t1 (word) VALUES ("a" );
INSERT INTO t1 (word) VALUES ("aardvar");
INSERT INTO t1 (word) VALUES ("aardvark");
INSERT INTO t1 (word) VALUES ("aardvara");
INSERT INTO t1 (word) VALUES ("aardvarz");
EXPLAIN SELECT * FROM t1 ORDER BY word;
id	select_type	table	type	possible_keys	key	key_len	ref	rows	Extra
1	SIMPLE	t1	ALL	NULL	NULL	NULL	NULL	6	Using filesort
SELECT * FROM t1 ORDER BY word;
word	bar
a	2
aar	1
aardvar	3
aardvara	5
aardvark	4
aardvarz	6
EXPLAIN SELECT word FROM t1 ORDER BY word;
id	select_type	table	type	possible_keys	key	key_len	ref	rows	Extra
1	SIMPLE	t1	ALL	NULL	NULL	NULL	NULL	6	Using filesort
SELECT word FROM t1 ORDER BY word;
word
a
aar
aardvar
aardvara
aardvark
aardvarz
DROP TABLE t1;
