DROP TABLE IF EXISTS t1;
SET CHARACTER SET koi8r;
CREATE TABLE t1 (word VARCHAR(64) CHARACTER SET ucs2);
INSERT INTO t1 VALUES (_koi8r'Р'), (X'2004');
SELECT hex(word) FROM t1 ORDER BY word;
hex(word)
0420
2004
DELETE FROM t1;
INSERT INTO t1 VALUES (X'042000200020'), (X'200400200020');
SELECT hex(word) FROM t1 ORDER BY word;
hex(word)
0420
2004
DROP TABLE t1;
SELECT LPAD(_ucs2 X'0420',10,_ucs2 X'0421');
LPAD(_ucs2 X'0420',10,_ucs2 X'0421')
СССССССССР
SELECT LPAD(_ucs2 X'0420',10,_ucs2 X'04210422');
LPAD(_ucs2 X'0420',10,_ucs2 X'04210422')
СТСТСТСТСР
SELECT LPAD(_ucs2 X'0420',10,_ucs2 X'042104220423');
LPAD(_ucs2 X'0420',10,_ucs2 X'042104220423')
СТУСТУСТУР
SELECT LPAD(_ucs2 X'0420042104220423042404250426042704280429042A042B',10,_ucs2 X'042104220423');
LPAD(_ucs2 X'0420042104220423042404250426042704280429042A042B',10,_ucs2 X'042104220423')
РСТУФХЦЧШЩ
SELECT RPAD(_ucs2 X'0420',10,_ucs2 X'0421');
RPAD(_ucs2 X'0420',10,_ucs2 X'0421')
РССССССССС
SELECT RPAD(_ucs2 X'0420',10,_ucs2 X'04210422');
RPAD(_ucs2 X'0420',10,_ucs2 X'04210422')
РСТСТСТСТС
SELECT RPAD(_ucs2 X'0420',10,_ucs2 X'042104220423');
RPAD(_ucs2 X'0420',10,_ucs2 X'042104220423')
РСТУСТУСТУ
SELECT RPAD(_ucs2 X'0420042104220423042404250426042704280429042A042B',10,_ucs2 X'042104220423');
RPAD(_ucs2 X'0420042104220423042404250426042704280429042A042B',10,_ucs2 X'042104220423')
РСТУФХЦЧШЩ
CREATE TABLE t1 SELECT 
LPAD(_ucs2 X'0420',10,_ucs2 X'0421') l,
RPAD(_ucs2 X'0420',10,_ucs2 X'0421') r;
SHOW CREATE TABLE t1;
Table	Create Table
t1	CREATE TABLE `t1` (
  `l` char(10) character set ucs2 NOT NULL default '',
  `r` char(10) character set ucs2 NOT NULL default ''
) ENGINE=MyISAM DEFAULT CHARSET=latin1
DROP TABLE t1;
create table t2(f1 Char(30));
insert into t2 values ("103000"), ("22720000"), ("3401200"), ("78000");
select lpad(f1, 12, "-o-/") from t2;
lpad(f1, 12, "-o-/")
-o-/-o103000
-o-/22720000
-o-/-3401200
-o-/-o-78000
drop table t2;
SET NAMES koi8r;
SET character_set_connection=ucs2;
create table t1 (a varchar(10) character set ucs2, key(a));
insert into t1 values ("a"),("abc"),("abcd"),("hello"),("test");
explain select * from t1 where a like 'abc%';
id	select_type	table	type	possible_keys	key	key_len	ref	rows	Extra
1	SIMPLE	t1	index	a	a	21	NULL	5	Using where; Using index
explain select * from t1 where a like concat('abc','%');
id	select_type	table	type	possible_keys	key	key_len	ref	rows	Extra
1	SIMPLE	t1	index	a	a	21	NULL	5	Using where; Using index
select * from t1 where a like "abc%";
a
abc
abcd
select * from t1 where a like concat("abc","%");
a
abc
abcd
select * from t1 where a like "ABC%";
a
abc
abcd
select * from t1 where a like "test%";
a
test
select * from t1 where a like "te_t";
a
test
select * from t1 where a like "%a%";
a
a
abc
abcd
select * from t1 where a like "%abcd%";
a
abcd
select * from t1 where a like "%abc\d%";
a
abcd
drop table t1;
select 'AA' like 'AA';
'AA' like 'AA'
1
select 'AA' like 'A%A';
'AA' like 'A%A'
1
select 'AA' like 'A%%A';
'AA' like 'A%%A'
1
select 'AA' like 'AA%';
'AA' like 'AA%'
1
select 'AA' like '%AA%';
'AA' like '%AA%'
1
select 'AA' like '%A';
'AA' like '%A'
1
select 'AA' like '%AA';
'AA' like '%AA'
1
select 'AA' like 'A%A%';
'AA' like 'A%A%'
1
select 'AA' like '_%_%';
'AA' like '_%_%'
1
select 'AA' like '%A%A';
'AA' like '%A%A'
1
select 'AAA'like 'A%A%A';
'AAA'like 'A%A%A'
1
select 'AZ' like 'AZ';
'AZ' like 'AZ'
1
select 'AZ' like 'A%Z';
'AZ' like 'A%Z'
1
select 'AZ' like 'A%%Z';
'AZ' like 'A%%Z'
1
select 'AZ' like 'AZ%';
'AZ' like 'AZ%'
1
select 'AZ' like '%AZ%';
'AZ' like '%AZ%'
1
select 'AZ' like '%Z';
'AZ' like '%Z'
1
select 'AZ' like '%AZ';
'AZ' like '%AZ'
1
select 'AZ' like 'A%Z%';
'AZ' like 'A%Z%'
1
select 'AZ' like '_%_%';
'AZ' like '_%_%'
1
select 'AZ' like '%A%Z';
'AZ' like '%A%Z'
1
select 'AZ' like 'A_';
'AZ' like 'A_'
1
select 'AZ' like '_Z';
'AZ' like '_Z'
1
select 'AMZ'like 'A%M%Z';
'AMZ'like 'A%M%Z'
1
CREATE TABLE t1 (a VARCHAR(10) CHARACTER SET ucs2);
INSERT INTO t1 VALUES ('фыва'),('Фыва'),('фЫва'),('фыВа'),('фывА'),('ФЫВА');
INSERT INTO t1 VALUES ('фывапролдж'),('Фывапролдж'),('фЫвапролдж'),('фыВапролдж');
INSERT INTO t1 VALUES ('фывАпролдж'),('фываПролдж'),('фывапРолдж'),('фывапрОлдж');
INSERT INTO t1 VALUES ('фывапроЛдж'),('фывапролДж'),('фывапролдЖ'),('ФЫВАПРОЛДЖ');
SELECT * FROM t1 WHERE a LIKE '%фЫва%';
a
фыва
Фыва
фЫва
фыВа
фывА
ФЫВА
фывапролдж
Фывапролдж
фЫвапролдж
фыВапролдж
фывАпролдж
фываПролдж
фывапРолдж
фывапрОлдж
фывапроЛдж
фывапролДж
фывапролдЖ
ФЫВАПРОЛДЖ
SELECT * FROM t1 WHERE a LIKE '%фЫв%';
a
фыва
Фыва
фЫва
фыВа
фывА
ФЫВА
фывапролдж
Фывапролдж
фЫвапролдж
фыВапролдж
фывАпролдж
фываПролдж
фывапРолдж
фывапрОлдж
фывапроЛдж
фывапролДж
фывапролдЖ
ФЫВАПРОЛДЖ
SELECT * FROM t1 WHERE a LIKE 'фЫва%';
a
фыва
Фыва
фЫва
фыВа
фывА
ФЫВА
фывапролдж
Фывапролдж
фЫвапролдж
фыВапролдж
фывАпролдж
фываПролдж
фывапРолдж
фывапрОлдж
фывапроЛдж
фывапролДж
фывапролдЖ
ФЫВАПРОЛДЖ
SELECT * FROM t1 WHERE a LIKE 'фЫва%' COLLATE ucs2_bin;
a
фЫва
фЫвапролдж
DROP TABLE t1;
CREATE TABLE t1 (word varchar(64) NOT NULL, PRIMARY KEY (word))
ENGINE=MyISAM CHARACTER SET ucs2 COLLATE ucs2_general_ci;
INSERT INTO t1 (word) VALUES ("cat");
SELECT * FROM t1 WHERE word LIKE "c%";
word
cat
SELECT * FROM t1 WHERE word LIKE "ca_";
word
cat
SELECT * FROM t1 WHERE word LIKE "cat";
word
cat
SELECT * FROM t1 WHERE word LIKE _ucs2 x'00630025';
word
cat
SELECT * FROM t1 WHERE word LIKE _ucs2 x'00630061005F';
word
cat
DROP TABLE t1;
select insert(_ucs2 0x006100620063,10,2,_ucs2 0x006400650066);
insert(_ucs2 0x006100620063,10,2,_ucs2 0x006400650066)
abc
select insert(_ucs2 0x006100620063,1,2,_ucs2 0x006400650066);
insert(_ucs2 0x006100620063,1,2,_ucs2 0x006400650066)
defc
SET NAMES latin1;
CREATE TABLE t1 (
word VARCHAR(64),
bar INT(11) default 0,
PRIMARY KEY (word))
ENGINE=MyISAM
CHARSET ucs2
COLLATE ucs2_general_ci ;
INSERT INTO t1 (word) VALUES ("aar");
INSERT INTO t1 (word) VALUES ("a");
INSERT INTO t1 (word) VALUES ("aardvar");
INSERT INTO t1 (word) VALUES ("aardvark");
INSERT INTO t1 (word) VALUES ("aardvara");
INSERT INTO t1 (word) VALUES ("aardvarz");
EXPLAIN SELECT * FROM t1 ORDER BY word;
id	select_type	table	type	possible_keys	key	key_len	ref	rows	Extra
1	SIMPLE	t1	ALL	NULL	NULL	NULL	NULL	6	Using filesort
SELECT * FROM t1 ORDER BY word;
word	bar
a	0
aar	0
aardvar	0
aardvara	0
aardvark	0
aardvarz	0
EXPLAIN SELECT word FROM t1 ORDER BY word;
id	select_type	table	type	possible_keys	key	key_len	ref	rows	Extra
1	SIMPLE	t1	index	NULL	PRIMARY	128	NULL	6	Using index
SELECT word FROM t1 ORDER by word;
word
a
aar
aardvar
aardvara
aardvark
aardvarz
DROP TABLE t1;
CREATE TABLE t1 (
word VARCHAR(64) ,
PRIMARY KEY (word))
ENGINE=MyISAM
CHARSET ucs2
COLLATE ucs2_general_ci;
INSERT INTO t1 (word) VALUES ("aar");
INSERT INTO t1 (word) VALUES ("a");
INSERT INTO t1 (word) VALUES ("aardvar");
INSERT INTO t1 (word) VALUES ("aardvark");
INSERT INTO t1 (word) VALUES ("aardvara");
INSERT INTO t1 (word) VALUES ("aardvarz");
EXPLAIN SELECT * FROM t1 ORDER BY WORD;
id	select_type	table	type	possible_keys	key	key_len	ref	rows	Extra
1	SIMPLE	t1	index	NULL	PRIMARY	128	NULL	6	Using index
SELECT * FROM t1 ORDER BY word;
word
a
aar
aardvar
aardvara
aardvark
aardvarz
DROP TABLE t1;
CREATE TABLE t1 (
word TEXT,
bar INT(11) AUTO_INCREMENT,
PRIMARY KEY (bar))
ENGINE=MyISAM
CHARSET ucs2
COLLATE ucs2_general_ci ;
INSERT INTO t1 (word) VALUES ("aar");
INSERT INTO t1 (word) VALUES ("a" );
INSERT INTO t1 (word) VALUES ("aardvar");
INSERT INTO t1 (word) VALUES ("aardvark");
INSERT INTO t1 (word) VALUES ("aardvara");
INSERT INTO t1 (word) VALUES ("aardvarz");
EXPLAIN SELECT * FROM t1 ORDER BY word;
id	select_type	table	type	possible_keys	key	key_len	ref	rows	Extra
1	SIMPLE	t1	ALL	NULL	NULL	NULL	NULL	6	Using filesort
SELECT * FROM t1 ORDER BY word;
word	bar
a	2
aar	1
aardvar	3
aardvara	5
aardvark	4
aardvarz	6
EXPLAIN SELECT word FROM t1 ORDER BY word;
id	select_type	table	type	possible_keys	key	key_len	ref	rows	Extra
1	SIMPLE	t1	ALL	NULL	NULL	NULL	NULL	6	Using filesort
SELECT word FROM t1 ORDER BY word;
word
a
aar
aardvar
aardvara
aardvark
aardvarz
DROP TABLE t1;
SELECT HEX(_ucs2 0x0);
HEX(_ucs2 0x0)
0000
SELECT HEX(_ucs2 0x01);
HEX(_ucs2 0x01)
0001
SELECT HEX(_ucs2 0x012);
HEX(_ucs2 0x012)
0012
SELECT HEX(_ucs2 0x0123);
HEX(_ucs2 0x0123)
0123
SELECT HEX(_ucs2 0x01234);
HEX(_ucs2 0x01234)
00001234
SELECT HEX(_ucs2 0x012345);
HEX(_ucs2 0x012345)
00012345
SELECT HEX(_ucs2 0x0123456);
HEX(_ucs2 0x0123456)
00123456
SELECT HEX(_ucs2 0x01234567);
HEX(_ucs2 0x01234567)
01234567
SELECT HEX(_ucs2 0x012345678);
HEX(_ucs2 0x012345678)
000012345678
SELECT HEX(_ucs2 0x0123456789);
HEX(_ucs2 0x0123456789)
000123456789
SELECT HEX(_ucs2 0x0123456789A);
HEX(_ucs2 0x0123456789A)
00123456789A
SELECT HEX(_ucs2 0x0123456789AB);
HEX(_ucs2 0x0123456789AB)
0123456789AB
SELECT HEX(_ucs2 0x0123456789ABC);
HEX(_ucs2 0x0123456789ABC)
0000123456789ABC
SELECT HEX(_ucs2 0x0123456789ABCD);
HEX(_ucs2 0x0123456789ABCD)
000123456789ABCD
SELECT HEX(_ucs2 0x0123456789ABCDE);
HEX(_ucs2 0x0123456789ABCDE)
00123456789ABCDE
SELECT HEX(_ucs2 0x0123456789ABCDEF);
HEX(_ucs2 0x0123456789ABCDEF)
0123456789ABCDEF
SELECT hex(cast(0xAA as char character set ucs2));
hex(cast(0xAA as char character set ucs2))
00AA
SELECT hex(convert(0xAA using ucs2));
hex(convert(0xAA using ucs2))
00AA
CREATE TABLE t1 (a char(10) character set ucs2);
INSERT INTO t1 VALUES (0xA),(0xAA),(0xAAA),(0xAAAA),(0xAAAAA);
SELECT HEX(a) FROM t1;
HEX(a)
000A
00AA
0AAA
AAAA
000AAAAA
DROP TABLE t1;
CREATE TABLE t1 (a varchar(10) character set ucs2);
INSERT INTO t1 VALUES (0xA),(0xAA),(0xAAA),(0xAAAA),(0xAAAAA);
SELECT HEX(a) FROM t1;
HEX(a)
000A
00AA
0AAA
AAAA
000AAAAA
DROP TABLE t1;
CREATE TABLE t1 (a text character set ucs2);
INSERT INTO t1 VALUES (0xA),(0xAA),(0xAAA),(0xAAAA),(0xAAAAA);
SELECT HEX(a) FROM t1;
HEX(a)
000A
00AA
0AAA
AAAA
000AAAAA
DROP TABLE t1;
CREATE TABLE t1 (a mediumtext character set ucs2);
INSERT INTO t1 VALUES (0xA),(0xAA),(0xAAA),(0xAAAA),(0xAAAAA);
SELECT HEX(a) FROM t1;
HEX(a)
000A
00AA
0AAA
AAAA
000AAAAA
DROP TABLE t1;
CREATE TABLE t1 (a longtext character set ucs2);
INSERT INTO t1 VALUES (0xA),(0xAA),(0xAAA),(0xAAAA),(0xAAAAA);
SELECT HEX(a) FROM t1;
HEX(a)
000A
00AA
0AAA
AAAA
000AAAAA
DROP TABLE t1;
