DROP TABLE IF EXISTS t1;
#
# Start of 5.5 tests
#
set names utf8;
set collation_connection=utf16_unicode_ci;
select hex('a'), hex('a ');
hex('a')	hex('a ')
0061	00610020
select 'a' = 'a', 'a' = 'a ', 'a ' = 'a';
'a' = 'a'	'a' = 'a '	'a ' = 'a'
1	1	1
select 'a\0' = 'a', 'a\0' < 'a', 'a\0' > 'a';
'a\0' = 'a'	'a\0' < 'a'	'a\0' > 'a'
1	0	0
select 'a' = 'a\0', 'a' < 'a\0', 'a' > 'a\0';
'a' = 'a\0'	'a' < 'a\0'	'a' > 'a\0'
1	0	0
select 'a\0' = 'a ', 'a\0' < 'a ', 'a\0' > 'a ';
'a\0' = 'a '	'a\0' < 'a '	'a\0' > 'a '
1	0	0
select 'a ' = 'a\0', 'a ' < 'a\0', 'a ' > 'a\0';
'a ' = 'a\0'	'a ' < 'a\0'	'a ' > 'a\0'
1	0	0
select 'a  a' > 'a', 'a  \0' < 'a';
'a  a' > 'a'	'a  \0' < 'a'
1	0
select binary 'a  a' > 'a', binary 'a  \0' > 'a', binary 'a\0' > 'a';
binary 'a  a' > 'a'	binary 'a  \0' > 'a'	binary 'a\0' > 'a'
1	1	1
select 'c' like '\_' as want0;
want0
0
CREATE TABLE t (
c char(20) NOT NULL
) ENGINE=MyISAM DEFAULT CHARACTER SET utf16 COLLATE utf16_unicode_ci;
INSERT INTO t VALUES ('a'),('ab'),('aba');
ALTER TABLE t ADD INDEX (c);
SELECT c FROM t WHERE c LIKE 'a%';
c
a
ab
aba
DROP TABLE t;
create table t1 (c1 char(10) character set utf16 collate utf16_bin);
insert into t1 values ('A'),('a');
insert into t1 values ('B'),('b');
insert into t1 values ('C'),('c');
insert into t1 values ('D'),('d');
insert into t1 values ('E'),('e');
insert into t1 values ('F'),('f');
insert into t1 values ('G'),('g');
insert into t1 values ('H'),('h');
insert into t1 values ('I'),('i');
insert into t1 values ('J'),('j');
insert into t1 values ('K'),('k');
insert into t1 values ('L'),('l');
insert into t1 values ('M'),('m');
insert into t1 values ('N'),('n');
insert into t1 values ('O'),('o');
insert into t1 values ('P'),('p');
insert into t1 values ('Q'),('q');
insert into t1 values ('R'),('r');
insert into t1 values ('S'),('s');
insert into t1 values ('T'),('t');
insert into t1 values ('U'),('u');
insert into t1 values ('V'),('v');
insert into t1 values ('W'),('w');
insert into t1 values ('X'),('x');
insert into t1 values ('Y'),('y');
insert into t1 values ('Z'),('z');
insert into t1 values (_ucs2 0x00e0),(_ucs2 0x00c0);
insert into t1 values (_ucs2 0x00e1),(_ucs2 0x00c1);
insert into t1 values (_ucs2 0x00e2),(_ucs2 0x00c2);
insert into t1 values (_ucs2 0x00e3),(_ucs2 0x00c3);
insert into t1 values (_ucs2 0x00e4),(_ucs2 0x00c4);
insert into t1 values (_ucs2 0x00e5),(_ucs2 0x00c5);
insert into t1 values (_ucs2 0x00e6),(_ucs2 0x00c6);
insert into t1 values (_ucs2 0x00e7),(_ucs2 0x00c7);
insert into t1 values (_ucs2 0x00e8),(_ucs2 0x00c8);
insert into t1 values (_ucs2 0x00e9),(_ucs2 0x00c9);
insert into t1 values (_ucs2 0x00ea),(_ucs2 0x00ca);
insert into t1 values (_ucs2 0x00eb),(_ucs2 0x00cb);
insert into t1 values (_ucs2 0x00ec),(_ucs2 0x00cc);
insert into t1 values (_ucs2 0x00ed),(_ucs2 0x00cd);
insert into t1 values (_ucs2 0x00ee),(_ucs2 0x00ce);
insert into t1 values (_ucs2 0x00ef),(_ucs2 0x00cf);
insert into t1 values (_ucs2 0x00f0),(_ucs2 0x00d0);
insert into t1 values (_ucs2 0x00f1),(_ucs2 0x00d1);
insert into t1 values (_ucs2 0x00f2),(_ucs2 0x00d2);
insert into t1 values (_ucs2 0x00f3),(_ucs2 0x00d3);
insert into t1 values (_ucs2 0x00f4),(_ucs2 0x00d4);
insert into t1 values (_ucs2 0x00f5),(_ucs2 0x00d5);
insert into t1 values (_ucs2 0x00f6),(_ucs2 0x00d6);
insert into t1 values (_ucs2 0x00f7),(_ucs2 0x00d7);
insert into t1 values (_ucs2 0x00f8),(_ucs2 0x00d8);
insert into t1 values (_ucs2 0x00f9),(_ucs2 0x00d9);
insert into t1 values (_ucs2 0x00fa),(_ucs2 0x00da);
insert into t1 values (_ucs2 0x00fb),(_ucs2 0x00db);
insert into t1 values (_ucs2 0x00fc),(_ucs2 0x00dc);
insert into t1 values (_ucs2 0x00fd),(_ucs2 0x00dd);
insert into t1 values (_ucs2 0x00fe),(_ucs2 0x00de);
insert into t1 values (_ucs2 0x00ff),(_ucs2 0x00df);
insert into t1 values (_ucs2 0x0100),(_ucs2 0x0101),(_ucs2 0x0102),(_ucs2 0x0103);
insert into t1 values (_ucs2 0x0104),(_ucs2 0x0105),(_ucs2 0x0106),(_ucs2 0x0107);
insert into t1 values (_ucs2 0x0108),(_ucs2 0x0109),(_ucs2 0x010a),(_ucs2 0x010b);
insert into t1 values (_ucs2 0x010c),(_ucs2 0x010d),(_ucs2 0x010e),(_ucs2 0x010f);
insert into t1 values (_ucs2 0x0110),(_ucs2 0x0111),(_ucs2 0x0112),(_ucs2 0x0113);
insert into t1 values (_ucs2 0x0114),(_ucs2 0x0115),(_ucs2 0x0116),(_ucs2 0x0117);
insert into t1 values (_ucs2 0x0118),(_ucs2 0x0119),(_ucs2 0x011a),(_ucs2 0x011b);
insert into t1 values (_ucs2 0x011c),(_ucs2 0x011d),(_ucs2 0x011e),(_ucs2 0x011f);
insert into t1 values (_ucs2 0x0120),(_ucs2 0x0121),(_ucs2 0x0122),(_ucs2 0x0123);
insert into t1 values (_ucs2 0x0124),(_ucs2 0x0125),(_ucs2 0x0126),(_ucs2 0x0127);
insert into t1 values (_ucs2 0x0128),(_ucs2 0x0129),(_ucs2 0x012a),(_ucs2 0x012b);
insert into t1 values (_ucs2 0x012c),(_ucs2 0x012d),(_ucs2 0x012e),(_ucs2 0x012f);
insert into t1 values (_ucs2 0x0130),(_ucs2 0x0131),(_ucs2 0x0132),(_ucs2 0x0133);
insert into t1 values (_ucs2 0x0134),(_ucs2 0x0135),(_ucs2 0x0136),(_ucs2 0x0137);
insert into t1 values (_ucs2 0x0138),(_ucs2 0x0139),(_ucs2 0x013a),(_ucs2 0x013b);
insert into t1 values (_ucs2 0x013c),(_ucs2 0x013d),(_ucs2 0x013e),(_ucs2 0x013f);
insert into t1 values (_ucs2 0x0140),(_ucs2 0x0141),(_ucs2 0x0142),(_ucs2 0x0143);
insert into t1 values (_ucs2 0x0144),(_ucs2 0x0145),(_ucs2 0x0146),(_ucs2 0x0147);
insert into t1 values (_ucs2 0x0148),(_ucs2 0x0149),(_ucs2 0x014a),(_ucs2 0x014b);
insert into t1 values (_ucs2 0x014c),(_ucs2 0x014d),(_ucs2 0x014e),(_ucs2 0x014f);
insert into t1 values (_ucs2 0x0150),(_ucs2 0x0151),(_ucs2 0x0152),(_ucs2 0x0153);
insert into t1 values (_ucs2 0x0154),(_ucs2 0x0155),(_ucs2 0x0156),(_ucs2 0x0157);
insert into t1 values (_ucs2 0x0158),(_ucs2 0x0159),(_ucs2 0x015a),(_ucs2 0x015b);
insert into t1 values (_ucs2 0x015c),(_ucs2 0x015d),(_ucs2 0x015e),(_ucs2 0x015f);
insert into t1 values (_ucs2 0x0160),(_ucs2 0x0161),(_ucs2 0x0162),(_ucs2 0x0163);
insert into t1 values (_ucs2 0x0164),(_ucs2 0x0165),(_ucs2 0x0166),(_ucs2 0x0167);
insert into t1 values (_ucs2 0x0168),(_ucs2 0x0169),(_ucs2 0x016a),(_ucs2 0x016b);
insert into t1 values (_ucs2 0x016c),(_ucs2 0x016d),(_ucs2 0x016e),(_ucs2 0x016f);
insert into t1 values (_ucs2 0x0170),(_ucs2 0x0171),(_ucs2 0x0172),(_ucs2 0x0173);
insert into t1 values (_ucs2 0x0174),(_ucs2 0x0175),(_ucs2 0x0176),(_ucs2 0x0177);
insert into t1 values (_ucs2 0x0178),(_ucs2 0x0179),(_ucs2 0x017a),(_ucs2 0x017b);
insert into t1 values (_ucs2 0x017c),(_ucs2 0x017d),(_ucs2 0x017e),(_ucs2 0x017f);
insert into t1 values (_ucs2 0x0180),(_ucs2 0x0181),(_ucs2 0x0182),(_ucs2 0x0183);
insert into t1 values (_ucs2 0x0184),(_ucs2 0x0185),(_ucs2 0x0186),(_ucs2 0x0187);
insert into t1 values (_ucs2 0x0188),(_ucs2 0x0189),(_ucs2 0x018a),(_ucs2 0x018b);
insert into t1 values (_ucs2 0x018c),(_ucs2 0x018d),(_ucs2 0x018e),(_ucs2 0x018f);
insert into t1 values (_ucs2 0x0190),(_ucs2 0x0191),(_ucs2 0x0192),(_ucs2 0x0193);
insert into t1 values (_ucs2 0x0194),(_ucs2 0x0195),(_ucs2 0x0196),(_ucs2 0x0197);
insert into t1 values (_ucs2 0x0198),(_ucs2 0x0199),(_ucs2 0x019a),(_ucs2 0x019b);
insert into t1 values (_ucs2 0x019c),(_ucs2 0x019d),(_ucs2 0x019e),(_ucs2 0x019f);
insert into t1 values (_ucs2 0x01a0),(_ucs2 0x01a1),(_ucs2 0x01a2),(_ucs2 0x01a3);
insert into t1 values (_ucs2 0x01a4),(_ucs2 0x01a5),(_ucs2 0x01a6),(_ucs2 0x01a7);
insert into t1 values (_ucs2 0x01a8),(_ucs2 0x01a9),(_ucs2 0x01aa),(_ucs2 0x01ab);
insert into t1 values (_ucs2 0x01ac),(_ucs2 0x01ad),(_ucs2 0x01ae),(_ucs2 0x01af);
insert into t1 values (_ucs2 0x01b0),(_ucs2 0x01b1),(_ucs2 0x01b2),(_ucs2 0x01b3);
insert into t1 values (_ucs2 0x01b4),(_ucs2 0x01b5),(_ucs2 0x01b6),(_ucs2 0x01b7);
insert into t1 values (_ucs2 0x01b8),(_ucs2 0x01b9),(_ucs2 0x01ba),(_ucs2 0x01bb);
insert into t1 values (_ucs2 0x01bc),(_ucs2 0x01bd),(_ucs2 0x01be),(_ucs2 0x01bf);
insert into t1 values (_ucs2 0x01c0),(_ucs2 0x01c1),(_ucs2 0x01c2),(_ucs2 0x01c3);
insert into t1 values (_ucs2 0x01c4),(_ucs2 0x01c5),(_ucs2 0x01c6),(_ucs2 0x01c7);
insert into t1 values (_ucs2 0x01c8),(_ucs2 0x01c9),(_ucs2 0x01ca),(_ucs2 0x01cb);
insert into t1 values (_ucs2 0x01cc),(_ucs2 0x01cd),(_ucs2 0x01ce),(_ucs2 0x01cf);
insert into t1 values (_ucs2 0x01d0),(_ucs2 0x01d1),(_ucs2 0x01d2),(_ucs2 0x01d3);
insert into t1 values (_ucs2 0x01d4),(_ucs2 0x01d5),(_ucs2 0x01d6),(_ucs2 0x01d7);
insert into t1 values (_ucs2 0x01d8),(_ucs2 0x01d9),(_ucs2 0x01da),(_ucs2 0x01db);
insert into t1 values (_ucs2 0x01dc),(_ucs2 0x01dd),(_ucs2 0x01de),(_ucs2 0x01df);
insert into t1 values (_ucs2 0x01e0),(_ucs2 0x01e1),(_ucs2 0x01e2),(_ucs2 0x01e3);
insert into t1 values (_ucs2 0x01e4),(_ucs2 0x01e5),(_ucs2 0x01e6),(_ucs2 0x01e7);
insert into t1 values (_ucs2 0x01e8),(_ucs2 0x01e9),(_ucs2 0x01ea),(_ucs2 0x01eb);
insert into t1 values (_ucs2 0x01ec),(_ucs2 0x01ed),(_ucs2 0x01ee),(_ucs2 0x01ef);
insert into t1 values (_ucs2 0x01f0),(_ucs2 0x01f1),(_ucs2 0x01f2),(_ucs2 0x01f3);
insert into t1 values (_ucs2 0x01f4),(_ucs2 0x01f5),(_ucs2 0x01f6),(_ucs2 0x01f7);
insert into t1 values (_ucs2 0x01f8),(_ucs2 0x01f9),(_ucs2 0x01fa),(_ucs2 0x01fb);
insert into t1 values (_ucs2 0x01fc),(_ucs2 0x01fd),(_ucs2 0x01fe),(_ucs2 0x01ff);
INSERT INTO t1 VALUES (_ucs2 0x1EA0),(_ucs2 0x1EA1),(_ucs2 0x1EA2),(_ucs2 0x1EA3);
INSERT INTO t1 VALUES (_ucs2 0x1EA4),(_ucs2 0x1EA5),(_ucs2 0x1EA6),(_ucs2 0x1EA7);
INSERT INTO t1 VALUES (_ucs2 0x1EA8),(_ucs2 0x1EA9),(_ucs2 0x1EAA),(_ucs2 0x1EAB);
INSERT INTO t1 VALUES (_ucs2 0x1EAC),(_ucs2 0x1EAD),(_ucs2 0x1EAE),(_ucs2 0x1EAF);
INSERT INTO t1 VALUES (_ucs2 0x1EB0),(_ucs2 0x1EB1),(_ucs2 0x1EB2),(_ucs2 0x1EB3);
INSERT INTO t1 VALUES (_ucs2 0x1EB4),(_ucs2 0x1EB5),(_ucs2 0x1EB6),(_ucs2 0x1EB7);
INSERT INTO t1 VALUES (_ucs2 0x1EB8),(_ucs2 0x1EB9),(_ucs2 0x1EBA),(_ucs2 0x1EBB);
INSERT INTO t1 VALUES (_ucs2 0x1EBC),(_ucs2 0x1EBD),(_ucs2 0x1EBE),(_ucs2 0x1EBF);
INSERT INTO t1 VALUES (_ucs2 0x1EC0),(_ucs2 0x1EC1),(_ucs2 0x1EC2),(_ucs2 0x1EC3);
INSERT INTO t1 VALUES (_ucs2 0x1EC4),(_ucs2 0x1EC5),(_ucs2 0x1EC6),(_ucs2 0x1EC7);
INSERT INTO t1 VALUES (_ucs2 0x1EC8),(_ucs2 0x1EC9),(_ucs2 0x1ECA),(_ucs2 0x1ECB);
INSERT INTO t1 VALUES (_ucs2 0x1ECC),(_ucs2 0x1ECD),(_ucs2 0x1ECE),(_ucs2 0x1ECF);
INSERT INTO t1 VALUES (_ucs2 0x1ED0),(_ucs2 0x1ED1),(_ucs2 0x1ED2),(_ucs2 0x1ED3);
INSERT INTO t1 VALUES (_ucs2 0x1ED4),(_ucs2 0x1ED5),(_ucs2 0x1ED6),(_ucs2 0x1ED7);
INSERT INTO t1 VALUES (_ucs2 0x1ED8),(_ucs2 0x1ED9),(_ucs2 0x1EDA),(_ucs2 0x1EDB);
INSERT INTO t1 VALUES (_ucs2 0x1EDC),(_ucs2 0x1EDD),(_ucs2 0x1EDE),(_ucs2 0x1EDF);
INSERT INTO t1 VALUES (_ucs2 0x1EE0),(_ucs2 0x1EE1),(_ucs2 0x1EE2),(_ucs2 0x1EE3);
INSERT INTO t1 VALUES (_ucs2 0x1EE4),(_ucs2 0x1EE5),(_ucs2 0x1EE6),(_ucs2 0x1EE7);
INSERT INTO t1 VALUES (_ucs2 0x1EE8),(_ucs2 0x1EE9),(_ucs2 0x1EEA),(_ucs2 0x1EEB);
INSERT INTO t1 VALUES (_ucs2 0x1EEC),(_ucs2 0x1EED),(_ucs2 0x1EEE),(_ucs2 0x1EEF);
INSERT INTO t1 VALUES (_ucs2 0x1EF0),(_ucs2 0x1EF1);
insert into t1 values ('AA'),('Aa'),('aa'),('aA');
insert into t1 values ('AE'),('Ae'),('ae'),('aE');
insert into t1 values ('CH'),('Ch'),('ch'),('cH');
insert into t1 values ('DZ'),('Dz'),('dz'),('dZ');
insert into t1 values ('DŽ'),('Dž'),('dž'),('dŽ');
insert into t1 values ('IJ'),('Ij'),('ij'),('iJ');
insert into t1 values ('LJ'),('Lj'),('lj'),('lJ');
insert into t1 values ('LL'),('Ll'),('ll'),('lL');
insert into t1 values ('NJ'),('Nj'),('nj'),('nJ');
insert into t1 values ('OE'),('Oe'),('oe'),('oE');
insert into t1 values ('SS'),('Ss'),('ss'),('sS');
insert into t1 values ('RR'),('Rr'),('rr'),('rR');
select group_concat(c1 order by binary c1 separator '') from t1 group by c1 collate utf16_unicode_ci;
group_concat(c1 order by binary c1 separator '')
÷
×
AaÀÁÂÃÄÅàáâãäåĀāĂăĄąǍǎǞǟǠǡǺǻẠạẢảẤấẦầẨẩẪẫẬậẮắẰằẲẳẴẵẶặ
AAAaaAaa
AEAeaEae
ÆæǢǣǼǽ
Bb
ƀ
Ɓ
Ƃƃ
CcÇçĆćĈĉĊċČč
CHChcHch
Ƈƈ
DdĎď
DZDzDŽDždZdzdŽdžǄǅǆǱǲǳ
Đđ
Ɖ
Ɗ
Ƌƌ
Ðð
EeÈÉÊËèéêëĒēĔĕĖėĘęĚěẸẹẺẻẼẽẾếỀềỂểỄễỆệ
Ǝǝ
Ə
Ɛ
Ff
Ƒƒ
GgĜĝĞğĠġĢģǦǧǴǵ
Ǥǥ
Ɠ
Ɣ
Ƣƣ
HhĤĥ
ƕǶ
Ħħ
IiÌÍÎÏìíîïĨĩĪīĬĭĮįİǏǐỈỉỊị
IJIjiJijĲĳ
ı
Ɨ
Ɩ
JjĴĵǰ
KkĶķǨǩ
Ƙƙ
LlĹĺĻļĽľ
Ŀŀ
LJLjlJljǇǈǉ
LLLllLll
Łł
ƚ
ƛ
Mm
NnÑñŃńŅņŇňǸǹ
NJNjnJnjǊǋǌ
Ɲ
ƞ
Ŋŋ
OoÒÓÔÕÖòóôõöŌōŎŏŐőƠơǑǒǪǫǬǭỌọỎỏỐốỒồỔổỖỗỘộỚớỜờỞởỠỡỢợ
OEOeoEoeŒœ
ØøǾǿ
Ɔ
Ɵ
Pp
Ƥƥ
Qq
ĸ
RrŔŕŖŗŘř
RRRrrRrr
Ʀ
SsŚśŜŝŞşŠšſ
SSSssSssß
Ʃ
ƪ
TtŢţŤť
ƾ
Ŧŧ
ƫ
Ƭƭ
Ʈ
UuÙÚÛÜùúûüŨũŪūŬŭŮůŰűŲųƯưǓǔǕǖǗǘǙǚǛǜỤụỦủỨứỪừỬửỮữỰự
Ɯ
Ʊ
Vv
Ʋ
WwŴŵ
Xx
YyÝýÿŶŷŸ
Ƴƴ
ZzŹźŻżŽž
ƍ
Ƶƶ
ƷǮǯ
Ƹƹ
ƺ
Þþ
ƿǷ
ƻ
Ƨƨ
Ƽƽ
Ƅƅ
ŉ
ǀ
ǁ
ǂ
ǃ
select group_concat(c1 order by binary c1 separator '') from t1 group by c1 collate utf16_icelandic_ci;
group_concat(c1 order by binary c1 separator '')
÷
×
AaÀÂÃàâãĀāĂăĄąǍǎǞǟǠǡǺǻẠạẢảẤấẦầẨẩẪẫẬậẮắẰằẲẳẴẵẶặ
AAAaaAaa
AEAeaEae
Áá
ǢǣǼǽ
Bb
ƀ
Ɓ
Ƃƃ
CcÇçĆćĈĉĊċČč
CHChcHch
Ƈƈ
DdĎď
DZDzDŽDždZdzdŽdžǄǅǆǱǲǳ
Ðð
Đđ
Ɖ
Ɗ
Ƌƌ
EeÈÊËèêëĒēĔĕĖėĘęĚěẸẹẺẻẼẽẾếỀềỂểỄễỆệ
Éé
Ǝǝ
Ə
Ɛ
Ff
Ƒƒ
GgĜĝĞğĠġĢģǦǧǴǵ
Ǥǥ
Ɠ
Ɣ
Ƣƣ
HhĤĥ
ƕǶ
Ħħ
IiÌÎÏìîïĨĩĪīĬĭĮįİǏǐỈỉỊị
IJIjiJijĲĳ
Íí
ı
Ɨ
Ɩ
JjĴĵǰ
KkĶķǨǩ
Ƙƙ
LlĹĺĻļĽľ
Ŀŀ
LJLjlJljǇǈǉ
LLLllLll
Łł
ƚ
ƛ
Mm
NnÑñŃńŅņŇňǸǹ
NJNjnJnjǊǋǌ
Ɲ
ƞ
Ŋŋ
OoÒÔÕòôõŌōŎŏŐőƠơǑǒǪǫǬǭỌọỎỏỐốỒồỔổỖỗỘộỚớỜờỞởỠỡỢợ
OEOeoEoeŒœ
Óó
Ǿǿ
Ɔ
Ɵ
Pp
Ƥƥ
Qq
ĸ
RrŔŕŖŗŘř
RRRrrRrr
Ʀ
SsŚśŜŝŞşŠšſ
SSSssSssß
Ʃ
ƪ
TtŢţŤť
ƾ
Ŧŧ
ƫ
Ƭƭ
Ʈ
UuÙÛÜùûüŨũŪūŬŭŮůŰűŲųƯưǓǔǕǖǗǘǙǚǛǜỤụỦủỨứỪừỬửỮữỰự
Úú
Ɯ
Ʊ
Vv
Ʋ
WwŴŵ
Xx
YyÿŶŷŸ
Ýý
Ƴƴ
ZzŹźŻżŽž
ƍ
Þþ
ÄÆäæ
ÖØöø
Åå
Ƶƶ
ƷǮǯ
Ƹƹ
ƺ
ƿǷ
ƻ
Ƨƨ
Ƽƽ
Ƅƅ
ŉ
ǀ
ǁ
ǂ
ǃ
select group_concat(c1 order by binary c1 separator '') from t1 group by c1 collate utf16_latvian_ci;
group_concat(c1 order by binary c1 separator '')
÷
×
AaÀÁÂÃÄÅàáâãäåĀāĂăĄąǍǎǞǟǠǡǺǻẠạẢảẤấẦầẨẩẪẫẬậẮắẰằẲẳẴẵẶặ
AAAaaAaa
AEAeaEae
ÆæǢǣǼǽ
Bb
ƀ
Ɓ
Ƃƃ
CcÇçĆćĈĉĊċ
CHChcHch
Čč
Ƈƈ
DdĎď
DZDzdZdzǄǅǆǱǲǳ
DŽDždŽdž
Đđ
Ɖ
Ɗ
Ƌƌ
Ðð
EeÈÉÊËèéêëĒēĔĕĖėĘęĚěẸẹẺẻẼẽẾếỀềỂểỄễỆệ
Ǝǝ
Ə
Ɛ
Ff
Ƒƒ
GgĜĝĞğĠġǦǧǴǵ
Ģģ
Ǥǥ
Ɠ
Ɣ
Ƣƣ
HhĤĥ
ƕǶ
Ħħ
IiÌÍÎÏìíîïĨĩĪīĬĭĮįİǏǐỈỉỊị
IJIjiJijĲĳ
Yy
ı
Ɨ
Ɩ
JjĴĵǰ
KkǨǩ
Ķķ
Ƙƙ
LlĹĺĽľ
Ŀŀ
LJLjlJljǇǈǉ
LLLllLll
Ļļ
Łł
ƚ
ƛ
Mm
NnÑñŃńŇňǸǹ
NJNjnJnjǊǋǌ
Ņņ
Ɲ
ƞ
Ŋŋ
OoÒÓÔÕÖòóôõöŌōŎŏŐőƠơǑǒǪǫǬǭỌọỎỏỐốỒồỔổỖỗỘộỚớỜờỞởỠỡỢợ
OEOeoEoeŒœ
ØøǾǿ
Ɔ
Ɵ
Pp
Ƥƥ
Qq
ĸ
RrŔŕŘř
RRRrrRrr
Ŗŗ
Ʀ
SsŚśŜŝŞşſ
SSSssSssß
Šš
Ʃ
ƪ
TtŢţŤť
ƾ
Ŧŧ
ƫ
Ƭƭ
Ʈ
UuÙÚÛÜùúûüŨũŪūŬŭŮůŰűŲųƯưǓǔǕǖǗǘǙǚǛǜỤụỦủỨứỪừỬửỮữỰự
Ɯ
Ʊ
Vv
Ʋ
WwŴŵ
Xx
ÝýÿŶŷŸ
Ƴƴ
ZzŹźŻż
ƍ
Žž
Ƶƶ
ƷǮǯ
Ƹƹ
ƺ
Þþ
ƿǷ
ƻ
Ƨƨ
Ƽƽ
Ƅƅ
ŉ
ǀ
ǁ
ǂ
ǃ
select group_concat(c1 order by binary c1 separator '') from t1 group by c1 collate utf16_romanian_ci;
group_concat(c1 order by binary c1 separator '')
÷
×
AaÀÁÃÄÅàáãäåĀāĄąǍǎǞǟǠǡǺǻẠạẢảẤấẦầẨẩẪẫẬậẮắẰằẲẳẴẵẶặ
AAAaaAaa
AEAeaEae
Ăă
Ââ
ÆæǢǣǼǽ
Bb
ƀ
Ɓ
Ƃƃ
CcÇçĆćĈĉĊċČč
CHChcHch
Ƈƈ
DdĎď
DZDzDŽDždZdzdŽdžǄǅǆǱǲǳ
Đđ
Ɖ
Ɗ
Ƌƌ
Ðð
EeÈÉÊËèéêëĒēĔĕĖėĘęĚěẸẹẺẻẼẽẾếỀềỂểỄễỆệ
Ǝǝ
Ə
Ɛ
Ff
Ƒƒ
GgĜĝĞğĠġĢģǦǧǴǵ
Ǥǥ
Ɠ
Ɣ
Ƣƣ
HhĤĥ
ƕǶ
Ħħ
IiÌÍÏìíïĨĩĪīĬĭĮįİǏǐỈỉỊị
IJIjiJijĲĳ
Îî
ı
Ɨ
Ɩ
JjĴĵǰ
KkĶķǨǩ
Ƙƙ
LlĹĺĻļĽľ
Ŀŀ
LJLjlJljǇǈǉ
LLLllLll
Łł
ƚ
ƛ
Mm
NnÑñŃńŅņŇňǸǹ
NJNjnJnjǊǋǌ
Ɲ
ƞ
Ŋŋ
OoÒÓÔÕÖòóôõöŌōŎŏŐőƠơǑǒǪǫǬǭỌọỎỏỐốỒồỔổỖỗỘộỚớỜờỞởỠỡỢợ
OEOeoEoeŒœ
ØøǾǿ
Ɔ
Ɵ
Pp
Ƥƥ
Qq
ĸ
RrŔŕŖŗŘř
RRRrrRrr
Ʀ
SsŚśŜŝŠšſ
SSSssSssß
Şş
Ʃ
ƪ
TtŤť
ƾ
Ţţ
Ŧŧ
ƫ
Ƭƭ
Ʈ
UuÙÚÛÜùúûüŨũŪūŬŭŮůŰűŲųƯưǓǔǕǖǗǘǙǚǛǜỤụỦủỨứỪừỬửỮữỰự
Ɯ
Ʊ
Vv
Ʋ
WwŴŵ
Xx
YyÝýÿŶŷŸ
Ƴƴ
ZzŹźŻżŽž
ƍ
Ƶƶ
ƷǮǯ
Ƹƹ
ƺ
Þþ
ƿǷ
ƻ
Ƨƨ
Ƽƽ
Ƅƅ
ŉ
ǀ
ǁ
ǂ
ǃ
select group_concat(c1 order by binary c1 separator '') from t1 group by c1 collate utf16_slovenian_ci;
group_concat(c1 order by binary c1 separator '')
÷
×
AaÀÁÂÃÄÅàáâãäåĀāĂăĄąǍǎǞǟǠǡǺǻẠạẢảẤấẦầẨẩẪẫẬậẮắẰằẲẳẴẵẶặ
AAAaaAaa
AEAeaEae
ÆæǢǣǼǽ
Bb
ƀ
Ɓ
Ƃƃ
CcÇçĆćĈĉĊċ
CHChcHch
Čč
Ƈƈ
DdĎď
DZDzdZdzǄǅǆǱǲǳ
DŽDždŽdž
Đđ
Ɖ
Ɗ
Ƌƌ
Ðð
EeÈÉÊËèéêëĒēĔĕĖėĘęĚěẸẹẺẻẼẽẾếỀềỂểỄễỆệ
Ǝǝ
Ə
Ɛ
Ff
Ƒƒ
GgĜĝĞğĠġĢģǦǧǴǵ
Ǥǥ
Ɠ
Ɣ
Ƣƣ
HhĤĥ
ƕǶ
Ħħ
IiÌÍÎÏìíîïĨĩĪīĬĭĮįİǏǐỈỉỊị
IJIjiJijĲĳ
ı
Ɨ
Ɩ
JjĴĵǰ
KkĶķǨǩ
Ƙƙ
LlĹĺĻļĽľ
Ŀŀ
LJLjlJljǇǈǉ
LLLllLll
Łł
ƚ
ƛ
Mm
NnÑñŃńŅņŇňǸǹ
NJNjnJnjǊǋǌ
Ɲ
ƞ
Ŋŋ
OoÒÓÔÕÖòóôõöŌōŎŏŐőƠơǑǒǪǫǬǭỌọỎỏỐốỒồỔổỖỗỘộỚớỜờỞởỠỡỢợ
OEOeoEoeŒœ
ØøǾǿ
Ɔ
Ɵ
Pp
Ƥƥ
Qq
ĸ
RrŔŕŖŗŘř
RRRrrRrr
Ʀ
SsŚśŜŝŞşſ
SSSssSssß
Šš
Ʃ
ƪ
TtŢţŤť
ƾ
Ŧŧ
ƫ
Ƭƭ
Ʈ
UuÙÚÛÜùúûüŨũŪūŬŭŮůŰűŲųƯưǓǔǕǖǗǘǙǚǛǜỤụỦủỨứỪừỬửỮữỰự
Ɯ
Ʊ
Vv
Ʋ
WwŴŵ
Xx
YyÝýÿŶŷŸ
Ƴƴ
ZzŹźŻż
ƍ
Žž
Ƶƶ
ƷǮǯ
Ƹƹ
ƺ
Þþ
ƿǷ
ƻ
Ƨƨ
Ƽƽ
Ƅƅ
ŉ
ǀ
ǁ
ǂ
ǃ
select group_concat(c1 order by binary c1 separator '') from t1 group by c1 collate utf16_polish_ci;
group_concat(c1 order by binary c1 separator '')
÷
×
AaÀÁÂÃÄÅàáâãäåĀāĂăǍǎǞǟǠǡǺǻẠạẢảẤấẦầẨẩẪẫẬậẮắẰằẲẳẴẵẶặ
AAAaaAaa
AEAeaEae
Ąą
ÆæǢǣǼǽ
Bb
ƀ
Ɓ
Ƃƃ
CcÇçĈĉĊċČč
CHChcHch
Ćć
Ƈƈ
DdĎď
DZDzDŽDždZdzdŽdžǄǅǆǱǲǳ
Đđ
Ɖ
Ɗ
Ƌƌ
Ðð
EeÈÉÊËèéêëĒēĔĕĖėĚěẸẹẺẻẼẽẾếỀềỂểỄễỆệ
Ęę
Ǝǝ
Ə
Ɛ
Ff
Ƒƒ
GgĜĝĞğĠġĢģǦǧǴǵ
Ǥǥ
Ɠ
Ɣ
Ƣƣ
HhĤĥ
ƕǶ
Ħħ
IiÌÍÎÏìíîïĨĩĪīĬĭĮįİǏǐỈỉỊị
IJIjiJijĲĳ
ı
Ɨ
Ɩ
JjĴĵǰ
KkĶķǨǩ
Ƙƙ
LlĹĺĻļĽľ
Ŀŀ
LJLjlJljǇǈǉ
LLLllLll
Łł
ƚ
ƛ
Mm
NnÑñŅņŇňǸǹ
NJNjnJnjǊǋǌ
Ńń
Ɲ
ƞ
Ŋŋ
OoÒÔÕÖòôõöŌōŎŏŐőƠơǑǒǪǫǬǭỌọỎỏỐốỒồỔổỖỗỘộỚớỜờỞởỠỡỢợ
OEOeoEoeŒœ
Óó
ØøǾǿ
Ɔ
Ɵ
Pp
Ƥƥ
Qq
ĸ
RrŔŕŖŗŘř
RRRrrRrr
Ʀ
SsŜŝŞşŠšſ
SSSssSssß
Śś
Ʃ
ƪ
TtŢţŤť
ƾ
Ŧŧ
ƫ
Ƭƭ
Ʈ
UuÙÚÛÜùúûüŨũŪūŬŭŮůŰűŲųƯưǓǔǕǖǗǘǙǚǛǜỤụỦủỨứỪừỬửỮữỰự
Ɯ
Ʊ
Vv
Ʋ
WwŴŵ
Xx
YyÝýÿŶŷŸ
Ƴƴ
ZzŽž
ƍ
Źź
Żż
Ƶƶ
ƷǮǯ
Ƹƹ
ƺ
Þþ
ƿǷ
ƻ
Ƨƨ
Ƽƽ
Ƅƅ
ŉ
ǀ
ǁ
ǂ
ǃ
select group_concat(c1 order by binary c1 separator '') from t1 group by c1 collate utf16_estonian_ci;
group_concat(c1 order by binary c1 separator '')
÷
×
AaÀÁÂÃÅàáâãåĀāĂăĄąǍǎǞǟǠǡǺǻẠạẢảẤấẦầẨẩẪẫẬậẮắẰằẲẳẴẵẶặ
AAAaaAaa
AEAeaEae
ÆæǢǣǼǽ
Bb
ƀ
Ɓ
Ƃƃ
CcÇçĆćĈĉĊċČč
CHChcHch
Ƈƈ
DdĎď
DZDzdZdz
DŽDždŽdž
ǄǅǆǱǲǳ
Đđ
Ɖ
Ɗ
Ƌƌ
Ðð
EeÈÉÊËèéêëĒēĔĕĖėĘęĚěẸẹẺẻẼẽẾếỀềỂểỄễỆệ
Ǝǝ
Ə
Ɛ
Ff
Ƒƒ
GgĜĝĞğĠġĢģǦǧǴǵ
Ǥǥ
Ɠ
Ɣ
Ƣƣ
HhĤĥ
ƕǶ
Ħħ
IiÌÍÎÏìíîïĨĩĪīĬĭĮįİǏǐỈỉỊị
IJIjiJijĲĳ
ı
Ɨ
Ɩ
JjĴĵǰ
KkĶķǨǩ
Ƙƙ
LlĹĺĻļĽľ
Ŀŀ
LJLjlJljǇǈǉ
LLLllLll
Łł
ƚ
ƛ
Mm
NnÑñŃńŅņŇňǸǹ
NJNjnJnjǊǋǌ
Ɲ
ƞ
Ŋŋ
OoÒÓÔòóôŌōŎŏŐőƠơǑǒǪǫǬǭỌọỎỏỐốỒồỔổỖỗỘộỚớỜờỞởỠỡỢợ
OEOeoEoeŒœ
ØøǾǿ
Ɔ
Ɵ
Pp
Ƥƥ
Qq
ĸ
RrŔŕŖŗŘř
RRRrrRrr
Ʀ
SsŚśŜŝŞşſ
SSSssSssß
Šš
Zz
Žž
Ʃ
ƪ
TtŢţŤť
ƾ
Ŧŧ
ƫ
Ƭƭ
Ʈ
UuÙÚÛùúûŨũŪūŬŭŮůŰűŲųƯưǓǔǕǖǗǘǙǚǛǜỤụỦủỨứỪừỬửỮữỰự
Ɯ
Ʊ
Vv
Ʋ
WwŴŵ
Õõ
Ää
Öö
Üü
Xx
YyÝýÿŶŷŸ
Ƴƴ
ŹźŻż
ƍ
Ƶƶ
ƷǮǯ
Ƹƹ
ƺ
Þþ
ƿǷ
ƻ
Ƨƨ
Ƽƽ
Ƅƅ
ŉ
ǀ
ǁ
ǂ
ǃ
select group_concat(c1 order by binary c1 separator '') from t1 group by c1 collate utf16_spanish_ci;
group_concat(c1 order by binary c1 separator '')
÷
×
AaÀÁÂÃÄÅàáâãäåĀāĂăĄąǍǎǞǟǠǡǺǻẠạẢảẤấẦầẨẩẪẫẬậẮắẰằẲẳẴẵẶặ
AAAaaAaa
AEAeaEae
ÆæǢǣǼǽ
Bb
ƀ
Ɓ
Ƃƃ
CcÇçĆćĈĉĊċČč
CHChcHch
Ƈƈ
DdĎď
DZDzDŽDždZdzdŽdžǄǅǆǱǲǳ
Đđ
Ɖ
Ɗ
Ƌƌ
Ðð
EeÈÉÊËèéêëĒēĔĕĖėĘęĚěẸẹẺẻẼẽẾếỀềỂểỄễỆệ
Ǝǝ
Ə
Ɛ
Ff
Ƒƒ
GgĜĝĞğĠġĢģǦǧǴǵ
Ǥǥ
Ɠ
Ɣ
Ƣƣ
HhĤĥ
ƕǶ
Ħħ
IiÌÍÎÏìíîïĨĩĪīĬĭĮįİǏǐỈỉỊị
IJIjiJijĲĳ
ı
Ɨ
Ɩ
JjĴĵǰ
KkĶķǨǩ
Ƙƙ
LlĹĺĻļĽľ
Ŀŀ
LJLjlJljǇǈǉ
LLLllLll
Łł
ƚ
ƛ
Mm
NnŃńŅņŇňǸǹ
NJNjnJnjǊǋǌ
Ññ
Ɲ
ƞ
Ŋŋ
OoÒÓÔÕÖòóôõöŌōŎŏŐőƠơǑǒǪǫǬǭỌọỎỏỐốỒồỔổỖỗỘộỚớỜờỞởỠỡỢợ
OEOeoEoeŒœ
ØøǾǿ
Ɔ
Ɵ
Pp
Ƥƥ
Qq
ĸ
RrŔŕŖŗŘř
RRRrrRrr
Ʀ
SsŚśŜŝŞşŠšſ
SSSssSssß
Ʃ
ƪ
TtŢţŤť
ƾ
Ŧŧ
ƫ
Ƭƭ
Ʈ
UuÙÚÛÜùúûüŨũŪūŬŭŮůŰűŲųƯưǓǔǕǖǗǘǙǚǛǜỤụỦủỨứỪừỬửỮữỰự
Ɯ
Ʊ
Vv
Ʋ
WwŴŵ
Xx
YyÝýÿŶŷŸ
Ƴƴ
ZzŹźŻżŽž
ƍ
Ƶƶ
ƷǮǯ
Ƹƹ
ƺ
Þþ
ƿǷ
ƻ
Ƨƨ
Ƽƽ
Ƅƅ
ŉ
ǀ
ǁ
ǂ
ǃ
select group_concat(c1 order by binary c1 separator '') from t1 group by c1 collate utf16_swedish_ci;
group_concat(c1 order by binary c1 separator '')
÷
×
AaÀÁÂÃàáâãĀāĂăĄąǍǎǞǟǠǡǺǻẠạẢảẤấẦầẨẩẪẫẬậẮắẰằẲẳẴẵẶặ
AAAaaAaa
AEAeaEae
ǢǣǼǽ
Bb
ƀ
Ɓ
Ƃƃ
CcÇçĆćĈĉĊċČč
CHChcHch
Ƈƈ
DdĎď
DZDzDŽDždZdzdŽdžǄǅǆǱǲǳ
Đđ
Ɖ
Ɗ
Ƌƌ
Ðð
EeÈÉÊËèéêëĒēĔĕĖėĘęĚěẸẹẺẻẼẽẾếỀềỂểỄễỆệ
Ǝǝ
Ə
Ɛ
Ff
Ƒƒ
GgĜĝĞğĠġĢģǦǧǴǵ
Ǥǥ
Ɠ
Ɣ
Ƣƣ
HhĤĥ
ƕǶ
Ħħ
IiÌÍÎÏìíîïĨĩĪīĬĭĮįİǏǐỈỉỊị
IJIjiJijĲĳ
ı
Ɨ
Ɩ
JjĴĵǰ
KkĶķǨǩ
Ƙƙ
LlĹĺĻļĽľ
Ŀŀ
LJLjlJljǇǈǉ
LLLllLll
Łł
ƚ
ƛ
Mm
NnÑñŃńŅņŇňǸǹ
NJNjnJnjǊǋǌ
Ɲ
ƞ
Ŋŋ
OoÒÓÔÕòóôõŌōŎŏŐőƠơǑǒǪǫǬǭỌọỎỏỐốỒồỔổỖỗỘộỚớỜờỞởỠỡỢợ
OEOeoEoeŒœ
Ǿǿ
Ɔ
Ɵ
Pp
Ƥƥ
Qq
ĸ
RrŔŕŖŗŘř
RRRrrRrr
Ʀ
SsŚśŜŝŞşŠšſ
SSSssSssß
Ʃ
ƪ
TtŢţŤť
ƾ
Ŧŧ
ƫ
Ƭƭ
Ʈ
UuÙÚÛùúûŨũŪūŬŭŮůŰűŲųƯưǓǔǕǖǗǘǙǚǛǜỤụỦủỨứỪừỬửỮữỰự
Ɯ
Ʊ
Vv
Ʋ
WwŴŵ
Xx
YyÜÝüýÿŶŷŸ
Ƴƴ
ZzŹźŻżŽž
ƍ
Åå
ÄÆäæ
ÖØöø
Ƶƶ
ƷǮǯ
Ƹƹ
ƺ
Þþ
ƿǷ
ƻ
Ƨƨ
Ƽƽ
Ƅƅ
ŉ
ǀ
ǁ
ǂ
ǃ
select group_concat(c1 order by binary c1 separator '') from t1 group by c1 collate utf16_turkish_ci;
group_concat(c1 order by binary c1 separator '')
÷
×
AaÀÁÂÃÄÅàáâãäåĀāĂăĄąǍǎǞǟǠǡǺǻẠạẢảẤấẦầẨẩẪẫẬậẮắẰằẲẳẴẵẶặ
AAAaaAaa
AEAeaEae
ÆæǢǣǼǽ
Bb
ƀ
Ɓ
Ƃƃ
CcĆćĈĉĊċČč
CHChcHch
Çç
Ƈƈ
DdĎď
DZDzDŽDždZdzdŽdžǄǅǆǱǲǳ
Đđ
Ɖ
Ɗ
Ƌƌ
Ðð
EeÈÉÊËèéêëĒēĔĕĖėĘęĚěẸẹẺẻẼẽẾếỀềỂểỄễỆệ
Ǝǝ
Ə
Ɛ
Ff
Ƒƒ
GgĜĝĠġĢģǦǧǴǵ
Ğğ
Ǥǥ
Ɠ
Ɣ
Ƣƣ
HhĤĥ
Iı
IJIj
ƕǶ
Ħħ
iÌÍÎÏìíîïĨĩĪīĬĭĮįİǏǐỈỉỊị
iJijĲĳ
Ɨ
Ɩ
JjĴĵǰ
KkĶķǨǩ
Ƙƙ
LlĹĺĻļĽľ
Ŀŀ
LJLjlJljǇǈǉ
LLLllLll
Łł
ƚ
ƛ
Mm
NnÑñŃńŅņŇňǸǹ
NJNjnJnjǊǋǌ
Ɲ
ƞ
Ŋŋ
OoÒÓÔÕòóôõŌōŎŏŐőƠơǑǒǪǫǬǭỌọỎỏỐốỒồỔổỖỗỘộỚớỜờỞởỠỡỢợ
OEOeoEoeŒœ
Öö
ØøǾǿ
Ɔ
Ɵ
Pp
Ƥƥ
Qq
ĸ
RrŔŕŖŗŘř
RRRrrRrr
Ʀ
SsŚśŜŝŠšſ
SSSssSssß
Şş
Ʃ
ƪ
TtŢţŤť
ƾ
Ŧŧ
ƫ
Ƭƭ
Ʈ
UuÙÚÛùúûŨũŪūŬŭŮůŰűŲųƯưǓǔǕǖǗǘǙǚǛǜỤụỦủỨứỪừỬửỮữỰự
Üü
Ɯ
Ʊ
Vv
Ʋ
WwŴŵ
Xx
YyÝýÿŶŷŸ
Ƴƴ
ZzŹźŻżŽž
ƍ
Ƶƶ
ƷǮǯ
Ƹƹ
ƺ
Þþ
ƿǷ
ƻ
Ƨƨ
Ƽƽ
Ƅƅ
ŉ
ǀ
ǁ
ǂ
ǃ
select group_concat(c1 order by binary c1 separator '') from t1 group by c1 collate utf16_czech_ci;
group_concat(c1 order by binary c1 separator '')
÷
×
AaÀÁÂÃÄÅàáâãäåĀāĂăĄąǍǎǞǟǠǡǺǻẠạẢảẤấẦầẨẩẪẫẬậẮắẰằẲẳẴẵẶặ
AAAaaAaa
AEAeaEae
ÆæǢǣǼǽ
Bb
ƀ
Ɓ
Ƃƃ
CcÇçĆćĈĉĊċ
cH
Čč
Ƈƈ
DdĎď
DZDzdZdzǄǅǆǱǲǳ
DŽDždŽdž
Đđ
Ɖ
Ɗ
Ƌƌ
Ðð
EeÈÉÊËèéêëĒēĔĕĖėĘęĚěẸẹẺẻẼẽẾếỀềỂểỄễỆệ
Ǝǝ
Ə
Ɛ
Ff
Ƒƒ
GgĜĝĞğĠġĢģǦǧǴǵ
Ǥǥ
Ɠ
Ɣ
Ƣƣ
HhĤĥ
CHChch
ƕǶ
Ħħ
IiÌÍÎÏìíîïĨĩĪīĬĭĮįİǏǐỈỉỊị
IJIjiJijĲĳ
ı
Ɨ
Ɩ
JjĴĵǰ
KkĶķǨǩ
Ƙƙ
LlĹĺĻļĽľ
Ŀŀ
LJLjlJljǇǈǉ
LLLllLll
Łł
ƚ
ƛ
Mm
NnÑñŃńŅņŇňǸǹ
NJNjnJnjǊǋǌ
Ɲ
ƞ
Ŋŋ
OoÒÓÔÕÖòóôõöŌōŎŏŐőƠơǑǒǪǫǬǭỌọỎỏỐốỒồỔổỖỗỘộỚớỜờỞởỠỡỢợ
OEOeoEoeŒœ
ØøǾǿ
Ɔ
Ɵ
Pp
Ƥƥ
Qq
ĸ
RrŔŕŖŗ
RRRrrRrr
Řř
Ʀ
SsŚśŜŝŞşſ
SSSssSssß
Šš
Ʃ
ƪ
TtŢţŤť
ƾ
Ŧŧ
ƫ
Ƭƭ
Ʈ
UuÙÚÛÜùúûüŨũŪūŬŭŮůŰűŲųƯưǓǔǕǖǗǘǙǚǛǜỤụỦủỨứỪừỬửỮữỰự
Ɯ
Ʊ
Vv
Ʋ
WwŴŵ
Xx
YyÝýÿŶŷŸ
Ƴƴ
ZzŹźŻż
ƍ
Žž
Ƶƶ
ƷǮǯ
Ƹƹ
ƺ
Þþ
ƿǷ
ƻ
Ƨƨ
Ƽƽ
Ƅƅ
ŉ
ǀ
ǁ
ǂ
ǃ
select group_concat(c1 order by binary c1 separator '') from t1 group by c1 collate utf16_danish_ci;
group_concat(c1 order by binary c1 separator '')
÷
×
AaÀÁÂÃàáâãĀāĂăĄąǍǎǞǟǠǡǺǻẠạẢảẤấẦầẨẩẪẫẬậẮắẰằẲẳẴẵẶặ
aA
AEAeaEae
ǢǣǼǽ
Bb
ƀ
Ɓ
Ƃƃ
CcÇçĆćĈĉĊċČč
CHChcHch
Ƈƈ
DdĎď
DZDzDŽDždZdzdŽdžǄǅǆǱǲǳ
Đđ
Ɖ
Ɗ
Ƌƌ
Ðð
EeÈÉÊËèéêëĒēĔĕĖėĘęĚěẸẹẺẻẼẽẾếỀềỂểỄễỆệ
Ǝǝ
Ə
Ɛ
Ff
Ƒƒ
GgĜĝĞğĠġĢģǦǧǴǵ
Ǥǥ
Ɠ
Ɣ
Ƣƣ
HhĤĥ
ƕǶ
Ħħ
IiÌÍÎÏìíîïĨĩĪīĬĭĮįİǏǐỈỉỊị
IJIjiJijĲĳ
ı
Ɨ
Ɩ
JjĴĵǰ
KkĶķǨǩ
Ƙƙ
LlĹĺĻļĽľ
Ŀŀ
LJLjlJljǇǈǉ
LLLllLll
Łł
ƚ
ƛ
Mm
NnÑñŃńŅņŇňǸǹ
NJNjnJnjǊǋǌ
Ɲ
ƞ
Ŋŋ
OoÒÓÔÕòóôõŌōŎŏƠơǑǒǪǫǬǭỌọỎỏỐốỒồỔổỖỗỘộỚớỜờỞởỠỡỢợ
OEOeoEoeŒœ
Ǿǿ
Ɔ
Ɵ
Pp
Ƥƥ
Qq
ĸ
RrŔŕŖŗŘř
RRRrrRrr
Ʀ
SsŚśŜŝŞşŠšſ
SSSssSssß
Ʃ
ƪ
TtŢţŤť
ƾ
Ŧŧ
ƫ
Ƭƭ
Ʈ
UuÙÚÛùúûŨũŪūŬŭŮůŲųƯưǓǔǕǖǗǘǙǚǛǜỤụỦủỨứỪừỬửỮữỰự
Ɯ
Ʊ
Vv
Ʋ
WwŴŵ
Xx
YyÜÝüýÿŰűŶŷŸ
Ƴƴ
ZzŹźŻżŽž
ƍ
ÄÆäæ
ÖØöøŐő
AAAaaaÅå
Ƶƶ
ƷǮǯ
Ƹƹ
ƺ
Þþ
ƿǷ
ƻ
Ƨƨ
Ƽƽ
Ƅƅ
ŉ
ǀ
ǁ
ǂ
ǃ
select group_concat(c1 order by binary c1 separator '') from t1 group by c1 collate utf16_lithuanian_ci;
group_concat(c1 order by binary c1 separator '')
÷
×
AaÀÁÂÃÄÅàáâãäåĀāĂăĄąǍǎǞǟǠǡǺǻẠạẢảẤấẦầẨẩẪẫẬậẮắẰằẲẳẴẵẶặ
AAAaaAaa
AEAeaEae
ÆæǢǣǼǽ
Bb
ƀ
Ɓ
Ƃƃ
CCHChcchÇçĆćĈĉĊċ
cH
Čč
Ƈƈ
DdĎď
DZDzdZdzǄǅǆǱǲǳ
DŽDždŽdž
Đđ
Ɖ
Ɗ
Ƌƌ
Ðð
EeÈÉÊËèéêëĒēĔĕĖėĘęĚěẸẹẺẻẼẽẾếỀềỂểỄễỆệ
Ǝǝ
Ə
Ɛ
Ff
Ƒƒ
GgĜĝĞğĠġĢģǦǧǴǵ
Ǥǥ
Ɠ
Ɣ
Ƣƣ
HhĤĥ
ƕǶ
Ħħ
IYiyÌÍÎÏìíîïĨĩĪīĬĭĮįİǏǐỈỉỊị
IJIjiJijĲĳ
ı
Ɨ
Ɩ
JjĴĵǰ
KkĶķǨǩ
Ƙƙ
LlĹĺĻļĽľ
Ŀŀ
LJLjlJljǇǈǉ
LLLllLll
Łł
ƚ
ƛ
Mm
NnÑñŃńŅņŇňǸǹ
NJNjnJnjǊǋǌ
Ɲ
ƞ
Ŋŋ
OoÒÓÔÕÖòóôõöŌōŎŏŐőƠơǑǒǪǫǬǭỌọỎỏỐốỒồỔổỖỗỘộỚớỜờỞởỠỡỢợ
OEOeoEoeŒœ
ØøǾǿ
Ɔ
Ɵ
Pp
Ƥƥ
Qq
ĸ
RrŔŕŖŗŘř
RRRrrRrr
Ʀ
SsŚśŜŝŞşſ
SSSssSssß
Šš
Ʃ
ƪ
TtŢţŤť
ƾ
Ŧŧ
ƫ
Ƭƭ
Ʈ
UuÙÚÛÜùúûüŨũŪūŬŭŮůŰűŲųƯưǓǔǕǖǗǘǙǚǛǜỤụỦủỨứỪừỬửỮữỰự
Ɯ
Ʊ
Vv
Ʋ
WwŴŵ
Xx
ÝýÿŶŷŸ
Ƴƴ
ZzŹźŻż
ƍ
Žž
Ƶƶ
ƷǮǯ
Ƹƹ
ƺ
Þþ
ƿǷ
ƻ
Ƨƨ
Ƽƽ
Ƅƅ
ŉ
ǀ
ǁ
ǂ
ǃ
select group_concat(c1 order by binary c1 separator '') from t1 group by c1 collate utf16_slovak_ci;
group_concat(c1 order by binary c1 separator '')
÷
×
AaÀÁÂÃÅàáâãåĀāĂăĄąǍǎǞǟǠǡǺǻẠạẢảẤấẦầẨẩẪẫẬậẮắẰằẲẳẴẵẶặ
AAAaaAaa
AEAeaEae
Ää
ÆæǢǣǼǽ
Bb
ƀ
Ɓ
Ƃƃ
CcÇçĆćĈĉĊċ
cH
Čč
Ƈƈ
DdĎď
DZDzdZdzǄǅǆǱǲǳ
DŽDždŽdž
Đđ
Ɖ
Ɗ
Ƌƌ
Ðð
EeÈÉÊËèéêëĒēĔĕĖėĘęĚěẸẹẺẻẼẽẾếỀềỂểỄễỆệ
Ǝǝ
Ə
Ɛ
Ff
Ƒƒ
GgĜĝĞğĠġĢģǦǧǴǵ
Ǥǥ
Ɠ
Ɣ
Ƣƣ
HhĤĥ
CHChch
ƕǶ
Ħħ
IiÌÍÎÏìíîïĨĩĪīĬĭĮįİǏǐỈỉỊị
IJIjiJijĲĳ
ı
Ɨ
Ɩ
JjĴĵǰ
KkĶķǨǩ
Ƙƙ
LlĹĺĻļĽľ
Ŀŀ
LJLjlJljǇǈǉ
LLLllLll
Łł
ƚ
ƛ
Mm
NnÑñŃńŅņŇňǸǹ
NJNjnJnjǊǋǌ
Ɲ
ƞ
Ŋŋ
OoÒÓÕÖòóõöŌōŎŏŐőƠơǑǒǪǫǬǭỌọỎỏỐốỒồỔổỖỗỘộỚớỜờỞởỠỡỢợ
OEOeoEoeŒœ
Ôô
ØøǾǿ
Ɔ
Ɵ
Pp
Ƥƥ
Qq
ĸ
RrŔŕŖŗŘř
RRRrrRrr
Ʀ
SsŚśŜŝŞşſ
SSSssSssß
Šš
Ʃ
ƪ
TtŢţŤť
ƾ
Ŧŧ
ƫ
Ƭƭ
Ʈ
UuÙÚÛÜùúûüŨũŪūŬŭŮůŰűŲųƯưǓǔǕǖǗǘǙǚǛǜỤụỦủỨứỪừỬửỮữỰự
Ɯ
Ʊ
Vv
Ʋ
WwŴŵ
Xx
YyÝýÿŶŷŸ
Ƴƴ
ZzŹźŻż
ƍ
Žž
Ƶƶ
ƷǮǯ
Ƹƹ
ƺ
Þþ
ƿǷ
ƻ
Ƨƨ
Ƽƽ
Ƅƅ
ŉ
ǀ
ǁ
ǂ
ǃ
select group_concat(c1 order by binary c1 separator '') from t1 group by c1 collate utf16_spanish2_ci;
group_concat(c1 order by binary c1 separator '')
÷
×
AaÀÁÂÃÄÅàáâãäåĀāĂăĄąǍǎǞǟǠǡǺǻẠạẢảẤấẦầẨẩẪẫẬậẮắẰằẲẳẴẵẶặ
AAAaaAaa
AEAeaEae
ÆæǢǣǼǽ
Bb
ƀ
Ɓ
Ƃƃ
CcÇçĆćĈĉĊċČč
cH
CHChch
Ƈƈ
DdĎď
DZDzDŽDždZdzdŽdžǄǅǆǱǲǳ
Đđ
Ɖ
Ɗ
Ƌƌ
Ðð
EeÈÉÊËèéêëĒēĔĕĖėĘęĚěẸẹẺẻẼẽẾếỀềỂểỄễỆệ
Ǝǝ
Ə
Ɛ
Ff
Ƒƒ
GgĜĝĞğĠġĢģǦǧǴǵ
Ǥǥ
Ɠ
Ɣ
Ƣƣ
HhĤĥ
ƕǶ
Ħħ
IiÌÍÎÏìíîïĨĩĪīĬĭĮįİǏǐỈỉỊị
IJIjiJijĲĳ
ı
Ɨ
Ɩ
JjĴĵǰ
KkĶķǨǩ
Ƙƙ
LlĹĺĻļĽľ
Ŀŀ
LJLjlJljǇǈǉ
lL
LLLlll
Łł
ƚ
ƛ
Mm
NnŃńŅņŇňǸǹ
NJNjnJnjǊǋǌ
Ññ
Ɲ
ƞ
Ŋŋ
OoÒÓÔÕÖòóôõöŌōŎŏŐőƠơǑǒǪǫǬǭỌọỎỏỐốỒồỔổỖỗỘộỚớỜờỞởỠỡỢợ
OEOeoEoeŒœ
ØøǾǿ
Ɔ
Ɵ
Pp
Ƥƥ
Qq
ĸ
RrŔŕŖŗŘř
RRRrrRrr
Ʀ
SsŚśŜŝŞşŠšſ
SSSssSssß
Ʃ
ƪ
TtŢţŤť
ƾ
Ŧŧ
ƫ
Ƭƭ
Ʈ
UuÙÚÛÜùúûüŨũŪūŬŭŮůŰűŲųƯưǓǔǕǖǗǘǙǚǛǜỤụỦủỨứỪừỬửỮữỰự
Ɯ
Ʊ
Vv
Ʋ
WwŴŵ
Xx
YyÝýÿŶŷŸ
Ƴƴ
ZzŹźŻżŽž
ƍ
Ƶƶ
ƷǮǯ
Ƹƹ
ƺ
Þþ
ƿǷ
ƻ
Ƨƨ
Ƽƽ
Ƅƅ
ŉ
ǀ
ǁ
ǂ
ǃ
select group_concat(c1 order by binary c1 separator '') from t1 group by c1 collate utf16_roman_ci;
group_concat(c1 order by binary c1 separator '')
÷
×
AaÀÁÂÃÄÅàáâãäåĀāĂăĄąǍǎǞǟǠǡǺǻẠạẢảẤấẦầẨẩẪẫẬậẮắẰằẲẳẴẵẶặ
AAAaaAaa
AEAeaEae
ÆæǢǣǼǽ
Bb
ƀ
Ɓ
Ƃƃ
CcÇçĆćĈĉĊċČč
CHChcHch
Ƈƈ
DdĎď
DZDzDŽDždZdzdŽdžǄǅǆǱǲǳ
Đđ
Ɖ
Ɗ
Ƌƌ
Ðð
EeÈÉÊËèéêëĒēĔĕĖėĘęĚěẸẹẺẻẼẽẾếỀềỂểỄễỆệ
Ǝǝ
Ə
Ɛ
Ff
Ƒƒ
GgĜĝĞğĠġĢģǦǧǴǵ
Ǥǥ
Ɠ
Ɣ
Ƣƣ
HhĤĥ
ƕǶ
Ħħ
IJijÌÍÎÏìíîïĨĩĪīĬĭĮįİǏǐỈỉỊị
IJIjiJij
Ĳĳ
ı
Ɨ
Ɩ
Ĵĵǰ
KkĶķǨǩ
Ƙƙ
LlĹĺĻļĽľ
Ŀŀ
LJLjlJlj
Ǉǈǉ
LLLllLll
Łł
ƚ
ƛ
Mm
NnÑñŃńŅņŇňǸǹ
NJNjnJnj
Ǌǋǌ
Ɲ
ƞ
Ŋŋ
OoÒÓÔÕÖòóôõöŌōŎŏŐőƠơǑǒǪǫǬǭỌọỎỏỐốỒồỔổỖỗỘộỚớỜờỞởỠỡỢợ
OEOeoEoeŒœ
ØøǾǿ
Ɔ
Ɵ
Pp
Ƥƥ
Qq
ĸ
RrŔŕŖŗŘř
RRRrrRrr
Ʀ
SsŚśŜŝŞşŠšſ
SSSssSssß
Ʃ
ƪ
TtŢţŤť
ƾ
Ŧŧ
ƫ
Ƭƭ
Ʈ
ÙÚÛÜùúûüŨũŪūŬŭŮůŰűŲųƯưǓǔǕǖǗǘǙǚǛǜỤụỦủỨứỪừỬửỮữỰự
Ɯ
Ʊ
UVuv
Ʋ
WwŴŵ
Xx
YyÝýÿŶŷŸ
Ƴƴ
ZzŹźŻżŽž
ƍ
Ƶƶ
ƷǮǯ
Ƹƹ
ƺ
Þþ
ƿǷ
ƻ
Ƨƨ
Ƽƽ
Ƅƅ
ŉ
ǀ
ǁ
ǂ
ǃ
select group_concat(c1 order by binary c1 separator '') from t1 group by c1 collate utf16_esperanto_ci;
group_concat(c1 order by binary c1 separator '')
÷
×
AaÀÁÂÃÄÅàáâãäåĀāĂăĄąǍǎǞǟǠǡǺǻẠạẢảẤấẦầẨẩẪẫẬậẮắẰằẲẳẴẵẶặ
AAAaaAaa
AEAeaEae
ÆæǢǣǼǽ
Bb
ƀ
Ɓ
Ƃƃ
CcÇçĆćĊċČč
CHChcHch
Ĉĉ
Ƈƈ
DdĎď
DZDzDŽDždZdzdŽdžǄǅǆǱǲǳ
Đđ
Ɖ
Ɗ
Ƌƌ
Ðð
EeÈÉÊËèéêëĒēĔĕĖėĘęĚěẸẹẺẻẼẽẾếỀềỂểỄễỆệ
Ǝǝ
Ə
Ɛ
Ff
Ƒƒ
GgĞğĠġĢģǦǧǴǵ
Ĝĝ
Ǥǥ
Ɠ
Ɣ
Ƣƣ
Hh
Ĥĥ
ƕǶ
Ħħ
IiÌÍÎÏìíîïĨĩĪīĬĭĮįİǏǐỈỉỊị
IJIjiJijĲĳ
ı
Ɨ
Ɩ
Jjǰ
Ĵĵ
KkĶķǨǩ
Ƙƙ
LlĹĺĻļĽľ
Ŀŀ
LJLjlJljǇǈǉ
LLLllLll
Łł
ƚ
ƛ
Mm
NnÑñŃńŅņŇňǸǹ
NJNjnJnjǊǋǌ
Ɲ
ƞ
Ŋŋ
OoÒÓÔÕÖòóôõöŌōŎŏŐőƠơǑǒǪǫǬǭỌọỎỏỐốỒồỔổỖỗỘộỚớỜờỞởỠỡỢợ
OEOeoEoeŒœ
ØøǾǿ
Ɔ
Ɵ
Pp
Ƥƥ
Qq
ĸ
RrŔŕŖŗŘř
RRRrrRrr
Ʀ
SsŚśŞşŠšſ
SSSssSssß
Ŝŝ
Ʃ
ƪ
TtŢţŤť
ƾ
Ŧŧ
ƫ
Ƭƭ
Ʈ
UuÙÚÛÜùúûüŨũŪūŮůŰűŲųƯưǓǔǕǖǗǘǙǚǛǜỤụỦủỨứỪừỬửỮữỰự
Ŭŭ
Ɯ
Ʊ
Vv
Ʋ
WwŴŵ
Xx
YyÝýÿŶŷŸ
Ƴƴ
ZzŹźŻżŽž
ƍ
Ƶƶ
ƷǮǯ
Ƹƹ
ƺ
Þþ
ƿǷ
ƻ
Ƨƨ
Ƽƽ
Ƅƅ
ŉ
ǀ
ǁ
ǂ
ǃ
select group_concat(c1 order by binary c1 separator '') from t1 group by c1 collate utf16_hungarian_ci;
group_concat(c1 order by binary c1 separator '')
÷
×
AaÀÁÂÃÄÅàáâãäåĀāĂăĄąǍǎǞǟǠǡǺǻẠạẢảẤấẦầẨẩẪẫẬậẮắẰằẲẳẴẵẶặ
AAAaaAaa
AEAeaEae
ÆæǢǣǼǽ
Bb
ƀ
Ɓ
Ƃƃ
CcÇçĆćĈĉĊċČč
CHChcHch
Ƈƈ
DdĎď
DZDzDŽDždZdzdŽdžǄǅǆǱǲǳ
Đđ
Ɖ
Ɗ
Ƌƌ
Ðð
EeÈÉÊËèéêëĒēĔĕĖėĘęĚěẸẹẺẻẼẽẾếỀềỂểỄễỆệ
Ǝǝ
Ə
Ɛ
Ff
Ƒƒ
GgĜĝĞğĠġĢģǦǧǴǵ
Ǥǥ
Ɠ
Ɣ
Ƣƣ
HhĤĥ
ƕǶ
Ħħ
IiÌÍÎÏìíîïĨĩĪīĬĭĮįİǏǐỈỉỊị
IJIjiJijĲĳ
ı
Ɨ
Ɩ
JjĴĵǰ
KkĶķǨǩ
Ƙƙ
LlĹĺĻļĽľ
Ŀŀ
LJLjlJljǇǈǉ
LLLllLll
Łł
ƚ
ƛ
Mm
NnÑñŃńŅņŇňǸǹ
NJNjnJnjǊǋǌ
Ɲ
ƞ
Ŋŋ
OoÒÓÔÕòóôõŌōŎŏƠơǑǒǪǫǬǭỌọỎỏỐốỒồỔổỖỗỘộỚớỜờỞởỠỡỢợ
OEOeoEoeŒœ
ÖöŐő
ØøǾǿ
Ɔ
Ɵ
Pp
Ƥƥ
Qq
ĸ
RrŔŕŖŗŘř
RRRrrRrr
Ʀ
SsŚśŜŝŞşŠšſ
SSSssSssß
Ʃ
ƪ
TtŢţŤť
ƾ
Ŧŧ
ƫ
Ƭƭ
Ʈ
UuÙÚÛùúûŨũŪūŬŭŮůŲųƯưǓǔǕǖǗǘǙǚǛǜỤụỦủỨứỪừỬửỮữỰự
ÜüŰű
Ɯ
Ʊ
Vv
Ʋ
WwŴŵ
Xx
YyÝýÿŶŷŸ
Ƴƴ
ZzŹźŻżŽž
ƍ
Ƶƶ
ƷǮǯ
Ƹƹ
ƺ
Þþ
ƿǷ
ƻ
Ƨƨ
Ƽƽ
Ƅƅ
ŉ
ǀ
ǁ
ǂ
ǃ
select group_concat(c1 order by binary c1 separator '') from t1 group by c1 collate utf16_croatian_ci;
group_concat(c1 order by binary c1 separator '')
÷
×
AaÀÁÂÃÄÅàáâãäåĀāĂăĄąǍǎǞǟǠǡǺǻẠạẢảẤấẦầẨẩẪẫẬậẮắẰằẲẳẴẵẶặ
AAAaaAaa
AEAeaEae
ÆæǢǣǼǽ
Bb
ƀ
Ɓ
Ƃƃ
CcÇçĈĉĊċ
CHChcHch
Čč
Ćć
Ƈƈ
DdĎď
DZDzdZdzǱǲǳ
DŽDždŽdžǄǅǆ
Đđ
Ɖ
Ɗ
Ƌƌ
Ðð
EeÈÉÊËèéêëĒēĔĕĖėĘęĚěẸẹẺẻẼẽẾếỀềỂểỄễỆệ
Ǝǝ
Ə
Ɛ
Ff
Ƒƒ
GgĜĝĞğĠġĢģǦǧǴǵ
Ǥǥ
Ɠ
Ɣ
Ƣƣ
HhĤĥ
ƕǶ
Ħħ
IiÌÍÎÏìíîïĨĩĪīĬĭĮįİǏǐỈỉỊị
IJIjiJijĲĳ
ı
Ɨ
Ɩ
JjĴĵǰ
KkĶķǨǩ
Ƙƙ
LlĹĺĻļĽľ
Ŀŀ
LLLllLll
LJLjlJljǇǈǉ
Łł
ƚ
ƛ
Mm
NnÑñŃńŅņŇňǸǹ
NJNjnJnjǊǋǌ
Ɲ
ƞ
Ŋŋ
OoÒÓÔÕÖòóôõöŌōŎŏŐőƠơǑǒǪǫǬǭỌọỎỏỐốỒồỔổỖỗỘộỚớỜờỞởỠỡỢợ
OEOeoEoeŒœ
ØøǾǿ
Ɔ
Ɵ
Pp
Ƥƥ
Qq
ĸ
RrŔŕŖŗŘř
RRRrrRrr
Ʀ
SsŚśŜŝŞşſ
SSSssSssß
Šš
Ʃ
ƪ
TtŢţŤť
ƾ
Ŧŧ
ƫ
Ƭƭ
Ʈ
UuÙÚÛÜùúûüŨũŪūŬŭŮůŰűŲųƯưǓǔǕǖǗǘǙǚǛǜỤụỦủỨứỪừỬửỮữỰự
Ɯ
Ʊ
Vv
Ʋ
WwŴŵ
Xx
YyÝýÿŶŷŸ
Ƴƴ
ZzŹźŻż
ƍ
Žž
Ƶƶ
ƷǮǯ
Ƹƹ
ƺ
Þþ
ƿǷ
ƻ
Ƨƨ
Ƽƽ
Ƅƅ
ŉ
ǀ
ǁ
ǂ
ǃ
select group_concat(c1 order by binary c1 separator '') from t1 group by c1 collate utf16_german2_ci;
group_concat(c1 order by binary c1 separator '')
÷
×
AaÀÁÂÃÅàáâãåĀāĂăĄąǍǎǞǟǠǡǺǻẠạẢảẤấẦầẨẩẪẫẬậẮắẰằẲẳẴẵẶặ
AAAaaAaa
AEAeaEaeÄÆäæ
ǢǣǼǽ
Bb
ƀ
Ɓ
Ƃƃ
CcÇçĆćĈĉĊċČč
CHChcHch
Ƈƈ
DdĎď
DZDzDŽDždZdzdŽdžǄǅǆǱǲǳ
Đđ
Ɖ
Ɗ
Ƌƌ
Ðð
EeÈÉÊËèéêëĒēĔĕĖėĘęĚěẸẹẺẻẼẽẾếỀềỂểỄễỆệ
Ǝǝ
Ə
Ɛ
Ff
Ƒƒ
GgĜĝĞğĠġĢģǦǧǴǵ
Ǥǥ
Ɠ
Ɣ
Ƣƣ
HhĤĥ
ƕǶ
Ħħ
IiÌÍÎÏìíîïĨĩĪīĬĭĮįİǏǐỈỉỊị
IJIjiJijĲĳ
ı
Ɨ
Ɩ
JjĴĵǰ
KkĶķǨǩ
Ƙƙ
LlĹĺĻļĽľ
Ŀŀ
LJLjlJljǇǈǉ
LLLllLll
Łł
ƚ
ƛ
Mm
NnÑñŃńŅņŇňǸǹ
NJNjnJnjǊǋǌ
Ɲ
ƞ
Ŋŋ
OoÒÓÔÕòóôõŌōŎŏŐőƠơǑǒǪǫǬǭỌọỎỏỐốỒồỔổỖỗỘộỚớỜờỞởỠỡỢợ
OEOeoEoeÖöŒœ
ØøǾǿ
Ɔ
Ɵ
Pp
Ƥƥ
Qq
ĸ
RrŔŕŖŗŘř
RRRrrRrr
Ʀ
SsŚśŜŝŞşŠšſ
SSSssSssß
Ʃ
ƪ
TtŢţŤť
ƾ
Ŧŧ
ƫ
Ƭƭ
Ʈ
UuÙÚÛùúûŨũŪūŬŭŮůŰűŲųƯưǓǔǕǖǗǘǙǚǛǜỤụỦủỨứỪừỬửỮữỰự
Üü
Ɯ
Ʊ
Vv
Ʋ
WwŴŵ
Xx
YyÝýÿŶŷŸ
Ƴƴ
ZzŹźŻżŽž
ƍ
Ƶƶ
ƷǮǯ
Ƹƹ
ƺ
Þþ
ƿǷ
ƻ
Ƨƨ
Ƽƽ
Ƅƅ
ŉ
ǀ
ǁ
ǂ
ǃ
select group_concat(c1 order by binary c1 separator '') from t1 group by c1 collate utf16_unicode_520_ci;
group_concat(c1 order by binary c1 separator '')
÷
×
AaÀÁÂÃÄÅàáâãäåĀāĂăĄąǍǎǞǟǠǡǺǻẠạẢảẤấẦầẨẩẪẫẬậẮắẰằẲẳẴẵẶặ
AAAaaAaa
AEAeaEaeÆæǢǣǼǽ
Bb
ƀ
Ɓ
Ƃƃ
CcÇçĆćĈĉĊċČč
CHChcHch
Ƈƈ
DdÐðĎďĐđ
DZDzDŽDždZdzdŽdžǄǅǆǱǲǳ
Ɖ
Ɗ
Ƌƌ
EeÈÉÊËèéêëĒēĔĕĖėĘęĚěẸẹẺẻẼẽẾếỀềỂểỄễỆệ
Ǝǝ
Ə
Ɛ
Ff
Ƒƒ
GgĜĝĞğĠġĢģǦǧǴǵ
Ǥǥ
Ɠ
Ɣ
Ƣƣ
HhĤĥĦħ
ƕǶ
IiÌÍÎÏìíîïĨĩĪīĬĭĮįİǏǐỈỉỊị
IJIjiJijĲĳ
ı
Ɨ
Ɩ
JjĴĵǰ
KkĶķǨǩ
Ƙƙ
LlĹĺĻļĽľĿŀŁł
LJLjlJljǇǈǉ
LLLllLll
ƚ
ƛ
Mm
NnÑñŃńŅņŇňǸǹ
NJNjnJnjǊǋǌ
Ɲ
ƞ
Ŋŋ
OoÒÓÔÕÖØòóôõöøŌōŎŏŐőƠơǑǒǪǫǬǭǾǿỌọỎỏỐốỒồỔổỖỗỘộỚớỜờỞởỠỡỢợ
OEOeoEoeŒœ
Ɔ
Ɵ
Pp
Ƥƥ
Qq
ĸ
RrŔŕŖŗŘř
RRRrrRrr
Ʀ
SsŚśŜŝŞşŠšſ
SSSssSssß
Ʃ
ƪ
TtŢţŤť
ƾ
Ŧŧ
ƫ
Ƭƭ
Ʈ
UuÙÚÛÜùúûüŨũŪūŬŭŮůŰűŲųƯưǓǔǕǖǗǘǙǚǛǜỤụỦủỨứỪừỬửỮữỰự
Ɯ
Ʊ
Vv
Ʋ
WwŴŵ
Xx
YyÝýÿŶŷŸ
Ƴƴ
ZzŹźŻżŽž
ƍ
Ƶƶ
ƷǮǯ
Ƹƹ
ƺ
Þþ
ƿǷ
ƻ
Ƨƨ
Ƽƽ
Ƅƅ
ŉ
ǀ
ǁ
ǂ
ǃ
select group_concat(c1 order by binary c1 separator '') from t1 group by c1 collate utf16_vietnamese_ci;
group_concat(c1 order by binary c1 separator '')
÷
×
AaÀÁÃÄÅàáãäåĀāĄąǍǎǞǟǠǡǺǻẠạẢả
AAAaaAaa
AEAeaEae
ĂăẮắẰằẲẳẴẵẶặ
ÂâẤấẦầẨẩẪẫẬậ
ÆæǢǣǼǽ
Bb
ƀ
Ɓ
Ƃƃ
CcÇçĆćĈĉĊċČč
CHChcHch
Ƈƈ
DdĎď
DZDzDŽDždZdzdŽdžǄǅǆǱǲǳ
Đđ
Ɖ
Ɗ
Ƌƌ
Ðð
EeÈÉËèéëĒēĔĕĖėĘęĚěẸẹẺẻẼẽ
ÊêẾếỀềỂểỄễỆệ
Ǝǝ
Ə
Ɛ
Ff
Ƒƒ
GgĜĝĞğĠġĢģǦǧǴǵ
Ǥǥ
Ɠ
Ɣ
Ƣƣ
HhĤĥ
ƕǶ
Ħħ
IiÌÍÎÏìíîïĨĩĪīĬĭĮįİǏǐỈỉỊị
IJIjiJijĲĳ
ı
Ɨ
Ɩ
JjĴĵǰ
KkĶķǨǩ
Ƙƙ
LlĹĺĻļĽľ
Ŀŀ
LJLjlJljǇǈǉ
LLLllLll
Łł
ƚ
ƛ
Mm
NnÑñŃńŅņŇňǸǹ
NJNjnJnjǊǋǌ
Ɲ
ƞ
Ŋŋ
OoÒÓÕÖòóõöŌōŎŏŐőǑǒǪǫǬǭỌọỎỏ
OEOeoEoeŒœ
ÔôỐốỒồỔổỖỗỘộ
ƠơỚớỜờỞởỠỡỢợ
ØøǾǿ
Ɔ
Ɵ
Pp
Ƥƥ
Qq
ĸ
RrŔŕŖŗŘř
RRRrrRrr
Ʀ
SsŚśŜŝŞşŠšſ
SSSssSssß
Ʃ
ƪ
TtŢţŤť
ƾ
Ŧŧ
ƫ
Ƭƭ
Ʈ
UuÙÚÛÜùúûüŨũŪūŬŭŮůŰűŲųǓǔǕǖǗǘǙǚǛǜỤụỦủ
ƯưỨứỪừỬửỮữỰự
Ɯ
Ʊ
Vv
Ʋ
WwŴŵ
Xx
YyÝýÿŶŷŸ
Ƴƴ
ZzŹźŻżŽž
ƍ
Ƶƶ
ƷǮǯ
Ƹƹ
ƺ
Þþ
ƿǷ
ƻ
Ƨƨ
Ƽƽ
Ƅƅ
ŉ
ǀ
ǁ
ǂ
ǃ
drop table t1;
SET NAMES utf8;
CREATE TABLE t1 (c varchar(150) CHARACTER SET utf16 COLLATE utf16_general_ci NOT NULL, INDEX (c));
INSERT INTO t1 VALUES (0x039C03C903B403B11F770308);
SELECT * FROM t1 WHERE c LIKE _utf16 0x039C0025 COLLATE utf16_general_ci;
c
Μωδαί̈
INSERT INTO t1 VALUES (0x039C03C903B4);
SELECT * FROM t1 WHERE c LIKE _utf16 0x039C0025
COLLATE utf16_general_ci ORDER BY c;
c
Μωδ
Μωδαί̈
DROP TABLE t1;
CREATE TABLE t1 (c varchar(150) CHARACTER SET utf16 COLLATE utf16_unicode_ci NOT NULL, INDEX (c));
INSERT INTO t1 VALUES (0x039C03C903B403B11F770308);
SELECT * FROM t1 WHERE c LIKE _utf16 0x039C0025 COLLATE utf16_unicode_ci;
c
Μωδαί̈
INSERT INTO t1 VALUES (0x039C03C903B4);
SELECT * FROM t1 WHERE c LIKE _utf16 0x039C0025
COLLATE utf16_unicode_ci ORDER BY c;
c
Μωδ
Μωδαί̈
DROP TABLE t1;
CREATE TABLE t1 (c varchar(150) CHARACTER SET utf16 COLLATE utf16_unicode_ci NOT NULL, INDEX (c));
INSERT INTO t1 VALUES (0x039C03C903B403B11F770308);
SELECT * FROM t1 WHERE c LIKE _utf16 0x039C0025 COLLATE utf16_unicode_ci;
c
Μωδαί̈
INSERT INTO t1 VALUES (0x039C03C903B4);
SELECT * FROM t1 WHERE c LIKE _utf16 0x039C0025
COLLATE utf16_unicode_ci ORDER BY c;
c
Μωδ
Μωδαί̈
DROP TABLE t1;
SET NAMES utf8;
SET @test_character_set='utf16';
SET @test_collation='utf16_swedish_ci';
SET @safe_character_set_server= @@character_set_server;
SET @safe_collation_server= @@collation_server;
SET @safe_character_set_client= @@character_set_client;
SET @safe_character_set_results= @@character_set_results;
SET character_set_server= @test_character_set;
SET collation_server= @test_collation;
CREATE DATABASE d1;
USE d1;
CREATE TABLE t1 (c CHAR(10), KEY(c));
SHOW FULL COLUMNS FROM t1;
Field	Type	Collation	Null	Key	Default	Extra	Privileges	Comment
c	char(10)	utf16_swedish_ci	YES	MUL	NULL			
INSERT INTO t1 VALUES ('aaa'),('aaaa'),('aaaaa');
SELECT c as want3results FROM t1 WHERE c LIKE 'aaa%';
want3results
aaa
aaaa
aaaaa
DROP TABLE t1;
CREATE TABLE t1 (c1 varchar(15), KEY c1 (c1(2)));
SHOW FULL COLUMNS FROM t1;
Field	Type	Collation	Null	Key	Default	Extra	Privileges	Comment
c1	varchar(15)	utf16_swedish_ci	YES	MUL	NULL			
INSERT INTO t1 VALUES ('location'),('loberge'),('lotre'),('boabab');
SELECT c1 as want3results from t1 where c1 like 'l%';
want3results
location
loberge
lotre
SELECT c1 as want3results from t1 where c1 like 'lo%';
want3results
location
loberge
lotre
SELECT c1 as want1result  from t1 where c1 like 'loc%';
want1result
location
SELECT c1 as want1result  from t1 where c1 like 'loca%';
want1result
location
SELECT c1 as want1result  from t1 where c1 like 'locat%';
want1result
location
SELECT c1 as want1result  from t1 where c1 like 'locati%';
want1result
location
SELECT c1 as want1result  from t1 where c1 like 'locatio%';
want1result
location
SELECT c1 as want1result  from t1 where c1 like 'location%';
want1result
location
DROP TABLE t1;
create table t1 (a set('a') not null);
insert ignore into t1 values (),();
Warnings:
Warning	1364	Field 'a' doesn't have a default value
select cast(a as char(1)) from t1;
cast(a as char(1))


select a sounds like a from t1;
a sounds like a
1
1
select 1 from t1 order by cast(a as char(1));
1
1
1
drop table t1;
set names utf8;
create table t1 (
name varchar(10),
level smallint unsigned);
show create table t1;
Table	Create Table
t1	CREATE TABLE `t1` (
  `name` varchar(10) COLLATE utf16_swedish_ci DEFAULT NULL,
  `level` smallint(5) unsigned DEFAULT NULL
) ENGINE=InnoDB DEFAULT CHARSET=utf16 COLLATE=utf16_swedish_ci
insert into t1 values ('string',1);
select concat(name,space(level)), concat(name, repeat(' ',level)) from t1;
concat(name,space(level))	concat(name, repeat(' ',level))
string 	string 
drop table t1;
DROP DATABASE d1;
USE test;
SET character_set_server= @safe_character_set_server;
SET collation_server= @safe_collation_server;
SET character_set_client= @safe_character_set_client;
SET character_set_results= @safe_character_set_results;
SET collation_connection='utf16_unicode_ci';
create table t1 select repeat('a',4000) a;
delete from t1;
insert into t1 values ('a'), ('a '), ('a\t');
select collation(a),hex(a) from t1 order by a;
collation(a)	hex(a)
utf16_unicode_ci	00610009
utf16_unicode_ci	0061
utf16_unicode_ci	00610020
drop table t1;
select @@collation_connection;
@@collation_connection
utf16_unicode_ci
create table t1 ROW_FORMAT=DYNAMIC select repeat('a',50) as c1 ;
insert into t1 values('abcdef');
insert into t1 values('_bcdef');
insert into t1 values('a_cdef');
insert into t1 values('ab_def');
insert into t1 values('abc_ef');
insert into t1 values('abcd_f');
insert into t1 values('abcde_');
select c1 as c1u from t1 where c1 like 'ab\_def';
c1u
ab_def
select c1 as c2h from t1 where c1 like 'ab#_def' escape '#';
c2h
ab_def
drop table t1;
End of 4.1 tests
CREATE TABLE t1 (id int, a varchar(30) character set utf16);
INSERT INTO t1 VALUES (1, 0x01310069), (2, 0x01310131);
INSERT INTO t1 VALUES (3, 0x00690069), (4, 0x01300049);
INSERT INTO t1 VALUES (5, 0x01300130), (6, 0x00490049);
SELECT a, length(a) la, @l:=lower(a) l, length(@l) ll, @u:=upper(a) u, length(@u) lu
FROM t1 ORDER BY id;
a	la	l	ll	u	lu
ıi	4	ıi	4	II	4
ıı	4	ıı	4	II	4
ii	4	ii	4	II	4
İI	4	ii	4	İI	4
İİ	4	ii	4	İİ	4
II	4	ii	4	II	4
ALTER TABLE t1 MODIFY a VARCHAR(30) character set utf16 collate utf16_turkish_ci;
SELECT a, length(a) la, @l:=lower(a) l, length(@l) ll, @u:=upper(a) u, length(@u) lu
FROM t1 ORDER BY id;
a	la	l	ll	u	lu
ıi	4	ıi	4	Iİ	4
ıı	4	ıı	4	II	4
ii	4	ii	4	İİ	4
İI	4	iı	4	İI	4
İİ	4	ii	4	İİ	4
II	4	ıı	4	II	4
DROP TABLE t1;
CREATE TABLE t1 (
c1 text character set utf16 collate utf16_polish_ci NOT NULL
) ENGINE=MyISAM;
insert into t1 values (''),('a');
SELECT COUNT(*), c1 FROM t1 GROUP BY c1;
COUNT(*)	c1
1	
1	a
DROP TABLE IF EXISTS t1;
set collation_connection=utf16_unicode_ci;
drop table if exists t1;
create table t1 as
select repeat(' ', 64) as s1, repeat(' ',64) as s2
union
select null, null;
show create table t1;
Table	Create Table
t1	CREATE TABLE `t1` (
  `s1` varchar(64) CHARACTER SET utf16 COLLATE utf16_unicode_ci DEFAULT NULL,
  `s2` varchar(64) CHARACTER SET utf16 COLLATE utf16_unicode_ci DEFAULT NULL
) ENGINE=default_engine DEFAULT CHARSET=latin1
delete from t1;
insert into t1 values('aaa','aaa');
insert into t1 values('aaa|qqq','qqq');
insert into t1 values('gheis','^[^a-dXYZ]+$');
insert into t1 values('aab','^aa?b');
insert into t1 values('Baaan','^Ba*n');
insert into t1 values('aaa','qqq|aaa');
insert into t1 values('qqq','qqq|aaa');
insert into t1 values('bbb','qqq|aaa');
insert into t1 values('bbb','qqq');
insert into t1 values('aaa','aba');
insert into t1 values(null,'abc');
insert into t1 values('def',null);
insert into t1 values(null,null);
insert into t1 values('ghi','ghi[');
select HIGH_PRIORITY s1 regexp s2 from t1;
s1 regexp s2
1
1
1
1
1
1
1
0
0
0
NULL
NULL
NULL
NULL
drop table t1;
SET collation_connection=utf16_czech_ci;
SELECT @@collation_connection;
@@collation_connection
utf16_czech_ci
#
# Bug#57737 Character sets: search fails with like, contraction, index
#
CREATE TABLE t1 AS SELECT REPEAT(' ', 10) AS s1 LIMIT 0;
INSERT INTO t1 VALUES ('c'),('ce'),('cé'),('ch');
SELECT * FROM t1 WHERE s1 LIKE 'c%';
s1
c
ce
cé
ch
ALTER TABLE t1 ADD KEY s1 (s1);
SELECT * FROM t1 WHERE s1 LIKE 'c%';
s1
c
ce
cé
ch
ALTER TABLE t1 DROP KEY s1, ADD KEY(s1(1));
SELECT * FROM t1 WHERE s1 LIKE 'ch';
s1
ch
DROP TABLE t1;
SELECT @@collation_connection;
@@collation_connection
utf16_czech_ci
#
# Bug#57737 Character sets: search fails with like, contraction, index
# Part#2 - ignorable characters
#
CREATE TABLE t1 AS SELECT REPEAT(' ', 10) AS s1 LIMIT 0;
INSERT INTO t1 VALUES ('a\0\0\0\0\0\t'),('a'),('b'),('c'),('d'),('e');
SELECT HEX(s1) FROM t1 WHERE s1 LIKE 'a%';
HEX(s1)
0061000000000000000000000009
0061
ALTER TABLE t1 ADD KEY s1 (s1);
SELECT HEX(s1) FROM t1 WHERE s1 LIKE 'a%';
HEX(s1)
0061000000000000000000000009
0061
DROP TABLE t1;
#
# End of 5.5 tests
#
#
# Start of 5.6 tests
#
#
# WL#3664 WEIGHT_STRING
#
set collation_connection=utf16_unicode_ci;
select @@collation_connection;
@@collation_connection
utf16_unicode_ci
select hex(weight_string('a'));
hex(weight_string('a'))
0E33
select hex(weight_string('A'));
hex(weight_string('A'))
0E33
select hex(weight_string('abc'));
hex(weight_string('abc'))
0E330E4A0E60
select hex(weight_string('abc' as char(2)));
hex(weight_string('abc' as char(2)))
0E330E4A
select hex(weight_string('abc' as char(3)));
hex(weight_string('abc' as char(3)))
0E330E4A0E60
select hex(weight_string('abc' as char(5)));
hex(weight_string('abc' as char(5)))
0E330E4A0E6002090209
select hex(weight_string('abc', 1, 2, 0xC0));
hex(weight_string('abc', 1, 2, 0xC0))
0E
select hex(weight_string('abc', 2, 2, 0xC0));
hex(weight_string('abc', 2, 2, 0xC0))
0E33
select hex(weight_string('abc', 3, 2, 0xC0));
hex(weight_string('abc', 3, 2, 0xC0))
0E330E
select hex(weight_string('abc', 4, 2, 0xC0));
hex(weight_string('abc', 4, 2, 0xC0))
0E330E4A
select hex(weight_string('abc', 5, 2, 0xC0));
hex(weight_string('abc', 5, 2, 0xC0))
0E330E4A02
select hex(weight_string('abc',25, 2, 0xC0));
hex(weight_string('abc',25, 2, 0xC0))
0E330E4A020902090209020902090209020902090209020902
select hex(weight_string('abc', 1, 3, 0xC0));
hex(weight_string('abc', 1, 3, 0xC0))
0E
select hex(weight_string('abc', 2, 3, 0xC0));
hex(weight_string('abc', 2, 3, 0xC0))
0E33
select hex(weight_string('abc', 3, 3, 0xC0));
hex(weight_string('abc', 3, 3, 0xC0))
0E330E
select hex(weight_string('abc', 4, 3, 0xC0));
hex(weight_string('abc', 4, 3, 0xC0))
0E330E4A
select hex(weight_string('abc', 5, 3, 0xC0));
hex(weight_string('abc', 5, 3, 0xC0))
0E330E4A0E
select hex(weight_string('abc',25, 3, 0xC0));
hex(weight_string('abc',25, 3, 0xC0))
0E330E4A0E6002090209020902090209020902090209020902
select hex(weight_string('abc', 1, 4, 0xC0));
hex(weight_string('abc', 1, 4, 0xC0))
0E
select hex(weight_string('abc', 2, 4, 0xC0));
hex(weight_string('abc', 2, 4, 0xC0))
0E33
select hex(weight_string('abc', 3, 4, 0xC0));
hex(weight_string('abc', 3, 4, 0xC0))
0E330E
select hex(weight_string('abc', 4, 4, 0xC0));
hex(weight_string('abc', 4, 4, 0xC0))
0E330E4A
select hex(weight_string('abc', 5, 4, 0xC0));
hex(weight_string('abc', 5, 4, 0xC0))
0E330E4A0E
select hex(weight_string('abc',25, 4, 0xC0));
hex(weight_string('abc',25, 4, 0xC0))
0E330E4A0E6002090209020902090209020902090209020902
select @@collation_connection;
@@collation_connection
utf16_unicode_ci
select hex(weight_string(cast(_latin1 0x80 as char)));
hex(weight_string(cast(_latin1 0x80 as char)))
0E23
select hex(weight_string(cast(_latin1 0x808080 as char)));
hex(weight_string(cast(_latin1 0x808080 as char)))
0E230E230E23
select hex(weight_string(cast(_latin1 0x808080 as char) as char(2)));
hex(weight_string(cast(_latin1 0x808080 as char) as char(2)))
0E230E23
select hex(weight_string(cast(_latin1 0x808080 as char) as char(3)));
hex(weight_string(cast(_latin1 0x808080 as char) as char(3)))
0E230E230E23
select hex(weight_string(cast(_latin1 0x808080 as char) as char(5)));
hex(weight_string(cast(_latin1 0x808080 as char) as char(5)))
0E230E230E2302090209
select hex(weight_string(cast(_latin1 0x808080 as char), 1, 2, 0xC0));
hex(weight_string(cast(_latin1 0x808080 as char), 1, 2, 0xC0))
0E
select hex(weight_string(cast(_latin1 0x808080 as char), 2, 2, 0xC0));
hex(weight_string(cast(_latin1 0x808080 as char), 2, 2, 0xC0))
0E23
select hex(weight_string(cast(_latin1 0x808080 as char), 3, 2, 0xC0));
hex(weight_string(cast(_latin1 0x808080 as char), 3, 2, 0xC0))
0E230E
select hex(weight_string(cast(_latin1 0x808080 as char), 4, 2, 0xC0));
hex(weight_string(cast(_latin1 0x808080 as char), 4, 2, 0xC0))
0E230E23
select hex(weight_string(cast(_latin1 0x808080 as char), 5, 2, 0xC0));
hex(weight_string(cast(_latin1 0x808080 as char), 5, 2, 0xC0))
0E230E2302
select hex(weight_string(cast(_latin1 0x808080 as char),25, 2, 0xC0));
hex(weight_string(cast(_latin1 0x808080 as char),25, 2, 0xC0))
0E230E23020902090209020902090209020902090209020902
select hex(weight_string(cast(_latin1 0x808080 as char), 1, 3, 0xC0));
hex(weight_string(cast(_latin1 0x808080 as char), 1, 3, 0xC0))
0E
select hex(weight_string(cast(_latin1 0x808080 as char), 2, 3, 0xC0));
hex(weight_string(cast(_latin1 0x808080 as char), 2, 3, 0xC0))
0E23
select hex(weight_string(cast(_latin1 0x808080 as char), 3, 3, 0xC0));
hex(weight_string(cast(_latin1 0x808080 as char), 3, 3, 0xC0))
0E230E
select hex(weight_string(cast(_latin1 0x808080 as char), 4, 3, 0xC0));
hex(weight_string(cast(_latin1 0x808080 as char), 4, 3, 0xC0))
0E230E23
select hex(weight_string(cast(_latin1 0x808080 as char), 5, 3, 0xC0));
hex(weight_string(cast(_latin1 0x808080 as char), 5, 3, 0xC0))
0E230E230E
select hex(weight_string(cast(_latin1 0x808080 as char),25, 3, 0xC0));
hex(weight_string(cast(_latin1 0x808080 as char),25, 3, 0xC0))
0E230E230E2302090209020902090209020902090209020902
select hex(weight_string(cast(_latin1 0x808080 as char), 1, 4, 0xC0));
hex(weight_string(cast(_latin1 0x808080 as char), 1, 4, 0xC0))
0E
select hex(weight_string(cast(_latin1 0x808080 as char), 2, 4, 0xC0));
hex(weight_string(cast(_latin1 0x808080 as char), 2, 4, 0xC0))
0E23
select hex(weight_string(cast(_latin1 0x808080 as char), 3, 4, 0xC0));
hex(weight_string(cast(_latin1 0x808080 as char), 3, 4, 0xC0))
0E230E
select hex(weight_string(cast(_latin1 0x808080 as char), 4, 4, 0xC0));
hex(weight_string(cast(_latin1 0x808080 as char), 4, 4, 0xC0))
0E230E23
select hex(weight_string(cast(_latin1 0x808080 as char), 5, 4, 0xC0));
hex(weight_string(cast(_latin1 0x808080 as char), 5, 4, 0xC0))
0E230E230E
select hex(weight_string(cast(_latin1 0x808080 as char),25, 4, 0xC0));
hex(weight_string(cast(_latin1 0x808080 as char),25, 4, 0xC0))
0E230E230E2302090209020902090209020902090209020902
select hex(weight_string(_utf16 0xD800DC00 collate utf16_unicode_ci));
hex(weight_string(_utf16 0xD800DC00 collate utf16_unicode_ci))
FFFD
select hex(weight_string(_utf16 0xD800DC01 collate utf16_unicode_ci));
hex(weight_string(_utf16 0xD800DC01 collate utf16_unicode_ci))
FFFD
select @@collation_connection;
@@collation_connection
utf16_unicode_ci
select hex(weight_string('a' LEVEL 1));
hex(weight_string('a' LEVEL 1))
0E33
select hex(weight_string('A' LEVEL 1));
hex(weight_string('A' LEVEL 1))
0E33
select hex(weight_string('abc' LEVEL 1));
hex(weight_string('abc' LEVEL 1))
0E330E4A0E60
select hex(weight_string('abc' as char(2) LEVEL 1));
hex(weight_string('abc' as char(2) LEVEL 1))
0E330E4A
select hex(weight_string('abc' as char(3) LEVEL 1));
hex(weight_string('abc' as char(3) LEVEL 1))
0E330E4A0E60
select hex(weight_string('abc' as char(5) LEVEL 1));
hex(weight_string('abc' as char(5) LEVEL 1))
0E330E4A0E6002090209
select hex(weight_string('abc' as char(5) LEVEL 1 REVERSE));
hex(weight_string('abc' as char(5) LEVEL 1 REVERSE))
09020902600E4A0E330E
select hex(weight_string('abc' as char(5) LEVEL 1 DESC));
hex(weight_string('abc' as char(5) LEVEL 1 DESC))
F1CCF1B5F19FFDF6FDF6
select hex(weight_string('abc' as char(5) LEVEL 1 DESC REVERSE));
hex(weight_string('abc' as char(5) LEVEL 1 DESC REVERSE))
F6FDF6FD9FF1B5F1CCF1
set @@collation_connection=utf16_czech_ci;
select @@collation_connection;
@@collation_connection
utf16_czech_ci
select collation(cast(_latin1 0xDF as char));
collation(cast(_latin1 0xDF as char))
utf16_czech_ci
select hex(weight_string('s'));
hex(weight_string('s'))
0FEA
select hex(weight_string(cast(_latin1 0xDF as char)));
hex(weight_string(cast(_latin1 0xDF as char)))
0FEA0FEA
select hex(weight_string(cast(_latin1 0xDF as char) as char(1)));
hex(weight_string(cast(_latin1 0xDF as char) as char(1)))
0FEA
select hex(weight_string('c'));
hex(weight_string('c'))
0E60
select hex(weight_string('h'));
hex(weight_string('h'))
0EE1
select hex(weight_string('ch'));
hex(weight_string('ch'))
0EE2
select hex(weight_string('i'));
hex(weight_string('i'))
0EFB
select hex(weight_string(cast(_latin1 0x6368DF as char)));
hex(weight_string(cast(_latin1 0x6368DF as char)))
0EE20FEA0FEA
select hex(weight_string(cast(_latin1 0x6368DF as char) as char(1)));
hex(weight_string(cast(_latin1 0x6368DF as char) as char(1)))
0EE2
select hex(weight_string(cast(_latin1 0x6368DF as char) as char(2)));
hex(weight_string(cast(_latin1 0x6368DF as char) as char(2)))
0EE20FEA
select hex(weight_string(cast(_latin1 0x6368DF as char) as char(3)));
hex(weight_string(cast(_latin1 0x6368DF as char) as char(3)))
0EE20FEA0FEA
select hex(weight_string(cast(_latin1 0x6368DF as char) as char(4)));
hex(weight_string(cast(_latin1 0x6368DF as char) as char(4)))
0EE20FEA0FEA0209
select hex(weight_string(cast(_latin1 0xDF6368 as char)));
hex(weight_string(cast(_latin1 0xDF6368 as char)))
0FEA0FEA0EE2
select hex(weight_string(cast(_latin1 0xDF6368 as char) as char(1)));
hex(weight_string(cast(_latin1 0xDF6368 as char) as char(1)))
0FEA
select hex(weight_string(cast(_latin1 0xDF6368 as char) as char(2)));
hex(weight_string(cast(_latin1 0xDF6368 as char) as char(2)))
0FEA0FEA
select hex(weight_string(cast(_latin1 0xDF6368 as char) as char(3)));
hex(weight_string(cast(_latin1 0xDF6368 as char) as char(3)))
0FEA0FEA0EE2
select hex(weight_string(cast(_latin1 0xDF6368 as char) as char(4)));
hex(weight_string(cast(_latin1 0xDF6368 as char) as char(4)))
0FEA0FEA0EE20209
select hex(weight_string(cast(_latin1 0x6368DF as char), 1, 2, 0xC0));
hex(weight_string(cast(_latin1 0x6368DF as char), 1, 2, 0xC0))
0E
select hex(weight_string(cast(_latin1 0x6368DF as char), 2, 2, 0xC0));
hex(weight_string(cast(_latin1 0x6368DF as char), 2, 2, 0xC0))
0EE2
select hex(weight_string(cast(_latin1 0x6368DF as char), 3, 2, 0xC0));
hex(weight_string(cast(_latin1 0x6368DF as char), 3, 2, 0xC0))
0EE20F
select hex(weight_string(cast(_latin1 0x6368DF as char), 4, 2, 0xC0));
hex(weight_string(cast(_latin1 0x6368DF as char), 4, 2, 0xC0))
0EE20FEA
select hex(weight_string(cast(_latin1 0x6368DF as char),25, 2, 0xC0));
hex(weight_string(cast(_latin1 0x6368DF as char),25, 2, 0xC0))
0EE20FEA020902090209020902090209020902090209020902
select hex(weight_string(cast(_latin1 0x6368DF as char), 1, 3, 0xC0));
hex(weight_string(cast(_latin1 0x6368DF as char), 1, 3, 0xC0))
0E
select hex(weight_string(cast(_latin1 0x6368DF as char), 2, 3, 0xC0));
hex(weight_string(cast(_latin1 0x6368DF as char), 2, 3, 0xC0))
0EE2
select hex(weight_string(cast(_latin1 0x6368DF as char), 3, 3, 0xC0));
hex(weight_string(cast(_latin1 0x6368DF as char), 3, 3, 0xC0))
0EE20F
select hex(weight_string(cast(_latin1 0x6368DF as char), 4, 3, 0xC0));
hex(weight_string(cast(_latin1 0x6368DF as char), 4, 3, 0xC0))
0EE20FEA
select hex(weight_string(cast(_latin1 0x6368DF as char),25, 3, 0xC0));
hex(weight_string(cast(_latin1 0x6368DF as char),25, 3, 0xC0))
0EE20FEA0FEA02090209020902090209020902090209020902
select hex(weight_string(cast(_latin1 0x6368DF as char), 1, 4, 0xC0));
hex(weight_string(cast(_latin1 0x6368DF as char), 1, 4, 0xC0))
0E
select hex(weight_string(cast(_latin1 0x6368DF as char), 2, 4, 0xC0));
hex(weight_string(cast(_latin1 0x6368DF as char), 2, 4, 0xC0))
0EE2
select hex(weight_string(cast(_latin1 0x6368DF as char), 3, 4, 0xC0));
hex(weight_string(cast(_latin1 0x6368DF as char), 3, 4, 0xC0))
0EE20F
select hex(weight_string(cast(_latin1 0x6368DF as char), 4, 4, 0xC0));
hex(weight_string(cast(_latin1 0x6368DF as char), 4, 4, 0xC0))
0EE20FEA
select hex(weight_string(cast(_latin1 0x6368DF as char),25, 4, 0xC0));
hex(weight_string(cast(_latin1 0x6368DF as char),25, 4, 0xC0))
0EE20FEA0FEA02090209020902090209020902090209020902
select hex(weight_string(cast(_latin1 0xDF6368 as char), 1, 2,0xC0));
hex(weight_string(cast(_latin1 0xDF6368 as char), 1, 2,0xC0))
0F
select hex(weight_string(cast(_latin1 0xDF6368 as char), 2, 2,0xC0));
hex(weight_string(cast(_latin1 0xDF6368 as char), 2, 2,0xC0))
0FEA
select hex(weight_string(cast(_latin1 0xDF6368 as char), 3, 2,0xC0));
hex(weight_string(cast(_latin1 0xDF6368 as char), 3, 2,0xC0))
0FEA0F
select hex(weight_string(cast(_latin1 0xDF6368 as char), 4, 2,0xC0));
hex(weight_string(cast(_latin1 0xDF6368 as char), 4, 2,0xC0))
0FEA0FEA
select hex(weight_string(cast(_latin1 0xDF6368 as char),25, 2,0xC0));
hex(weight_string(cast(_latin1 0xDF6368 as char),25, 2,0xC0))
0FEA0FEA020902090209020902090209020902090209020902
select hex(weight_string(cast(_latin1 0xDF6368 as char), 1, 3,0xC0));
hex(weight_string(cast(_latin1 0xDF6368 as char), 1, 3,0xC0))
0F
select hex(weight_string(cast(_latin1 0xDF6368 as char), 2, 3,0xC0));
hex(weight_string(cast(_latin1 0xDF6368 as char), 2, 3,0xC0))
0FEA
select hex(weight_string(cast(_latin1 0xDF6368 as char), 3, 3,0xC0));
hex(weight_string(cast(_latin1 0xDF6368 as char), 3, 3,0xC0))
0FEA0F
select hex(weight_string(cast(_latin1 0xDF6368 as char), 4, 3,0xC0));
hex(weight_string(cast(_latin1 0xDF6368 as char), 4, 3,0xC0))
0FEA0FEA
select hex(weight_string(cast(_latin1 0xDF6368 as char),25, 3,0xC0));
hex(weight_string(cast(_latin1 0xDF6368 as char),25, 3,0xC0))
0FEA0FEA0EE202090209020902090209020902090209020902
select hex(weight_string(cast(_latin1 0xDF6368 as char), 1, 4,0xC0));
hex(weight_string(cast(_latin1 0xDF6368 as char), 1, 4,0xC0))
0F
select hex(weight_string(cast(_latin1 0xDF6368 as char), 2, 4,0xC0));
hex(weight_string(cast(_latin1 0xDF6368 as char), 2, 4,0xC0))
0FEA
select hex(weight_string(cast(_latin1 0xDF6368 as char), 3, 4,0xC0));
hex(weight_string(cast(_latin1 0xDF6368 as char), 3, 4,0xC0))
0FEA0F
select hex(weight_string(cast(_latin1 0xDF6368 as char), 4, 4,0xC0));
hex(weight_string(cast(_latin1 0xDF6368 as char), 4, 4,0xC0))
0FEA0FEA
select hex(weight_string(cast(_latin1 0xDF6368 as char),25, 4,0xC0));
hex(weight_string(cast(_latin1 0xDF6368 as char),25, 4,0xC0))
0FEA0FEA0EE202090209020902090209020902090209020902
SET NAMES utf8;
SET collation_connection=utf16_german2_ci;
"BEGIN ctype_german.inc"
drop table if exists t1;
create table t1 as select repeat(' ', 64) as s1;
select collation(s1) from t1;
collation(s1)
utf16_german2_ci
delete from t1;
INSERT INTO t1 VALUES ('ud'),('uf');
INSERT INTO t1 VALUES ('od'),('of');
INSERT INTO t1 VALUES ('e');
INSERT INTO t1 VALUES ('ad'),('af');
insert into t1 values ('a'),('ae'),(_latin1 0xE4);
insert into t1 values ('o'),('oe'),(_latin1 0xF6);
insert into t1 values ('s'),('ss'),(_latin1 0xDF);
insert into t1 values ('u'),('ue'),(_latin1 0xFC);
INSERT INTO t1 VALUES (_latin1 0xE6), (_latin1 0xC6);
INSERT INTO t1 VALUES (_latin1 0x9C), (_latin1 0x8C);
select s1, hex(s1) from t1 order by s1, binary s1;
s1	hex(s1)
a	0061
ad	00610064
ae	00610065
Æ	00C6
ä	00E4
æ	00E6
af	00610066
e	0065
o	006F
od	006F0064
oe	006F0065
ö	00F6
Œ	0152
œ	0153
of	006F0066
s	0073
ss	00730073
ß	00DF
u	0075
ud	00750064
ue	00750065
ü	00FC
uf	00750066
select group_concat(s1 order by binary s1) from t1 group by s1;
group_concat(s1 order by binary s1)
a
ad
ae,Æ,ä,æ
af
e
o
od
oe,ö,Œ,œ
of
s
ss,ß
u
ud
ue,ü
uf
SELECT s1, hex(s1), hex(weight_string(s1)) FROM t1 ORDER BY s1, BINARY(s1);
s1	hex(s1)	hex(weight_string(s1))
a	0061	0E33
ad	00610064	0E330E6D
ae	00610065	0E330E8B
Æ	00C6	0E330E8B
ä	00E4	0E330E8B
æ	00E6	0E330E8B
af	00610066	0E330EB9
e	0065	0E8B
o	006F	0F82
od	006F0064	0F820E6D
oe	006F0065	0F820E8B
ö	00F6	0F820E8B
Œ	0152	0F820E8B
œ	0153	0F820E8B
of	006F0066	0F820EB9
s	0073	0FEA
ss	00730073	0FEA0FEA
ß	00DF	0FEA0FEA
u	0075	101F
ud	00750064	101F0E6D
ue	00750065	101F0E8B
ü	00FC	101F0E8B
uf	00750066	101F0EB9
SELECT s1, hex(s1) FROM t1 WHERE s1='ae' ORDER BY s1, BINARY(s1);
s1	hex(s1)
ae	00610065
Æ	00C6
ä	00E4
æ	00E6
drop table t1;
"END ctype_german.inc"
#
# WL#2673 Unicode Collation Algorithm new version
#
SET NAMES utf8mb4;
SET collation_connection=utf16_unicode_520_ci;
CREATE TABLE t1 AS SELECT repeat('a', 10) as c LIMIT 0;
SHOW CREATE TABLE t1;
Table	Create Table
t1	CREATE TABLE `t1` (
  `c` varchar(10) CHARACTER SET utf16 COLLATE utf16_unicode_520_ci DEFAULT NULL
) ENGINE=InnoDB DEFAULT CHARSET=latin1
INSERT INTO t1 VALUES (_utf32 0x0180),(_utf32 0x023A);
INSERT INTO t1 VALUES (_utf32 0x023B),(_utf32 0x023C);
INSERT INTO t1 VALUES (_utf32 0x023D),(_utf32 0x023E);
INSERT INTO t1 VALUES (_utf32 0x0241),(_utf32 0x0242);
INSERT INTO t1 VALUES (_utf32 0x0243),(_utf32 0x0244);
INSERT INTO t1 VALUES (_utf32 0x0245),(_utf32 0x0246);
INSERT INTO t1 VALUES (_utf32 0x0247),(_utf32 0x0248);
INSERT INTO t1 VALUES (_utf32 0x0249),(_utf32 0x024A);
INSERT INTO t1 VALUES (_utf32 0x024B),(_utf32 0x024C);
INSERT INTO t1 VALUES (_utf32 0x024D),(_utf32 0x024E);
INSERT INTO t1 VALUES (_utf32 0x024F),(_utf32 0x026B);
INSERT INTO t1 VALUES (_utf32 0x027D),(_utf32 0x0289);
INSERT INTO t1 VALUES (_utf32 0x028C);
INSERT INTO t1 VALUES (_utf32 0x037B), (_utf32 0x037C);
INSERT INTO t1 VALUES (_utf32 0x037D), (_utf32 0x03FD);
INSERT INTO t1 VALUES (_utf32 0x03FE), (_utf32 0x03FF);
INSERT INTO t1 VALUES (_utf32 0x04C0), (_utf32 0x04CF);
INSERT INTO t1 VALUES (_utf32 0x04F6), (_utf32 0x04F7);
INSERT INTO t1 VALUES (_utf32 0x04FA), (_utf32 0x04FB);
INSERT INTO t1 VALUES (_utf32 0x04FC), (_utf32 0x04FD);
INSERT INTO t1 VALUES (_utf32 0x04FE), (_utf32 0x04FF);
INSERT INTO t1 VALUES (_utf32 0x0510), (_utf32 0x0511);
INSERT INTO t1 VALUES (_utf32 0x0512), (_utf32 0x0513);
INSERT INTO t1 VALUES (_utf32 0x10A0), (_utf32 0x10A1);
INSERT INTO t1 VALUES (_utf32 0x10A2), (_utf32 0x10A3);
INSERT INTO t1 VALUES (_utf32 0x10A4), (_utf32 0x10A5);
INSERT INTO t1 VALUES (_utf32 0x10A6), (_utf32 0x10A7);
INSERT INTO t1 VALUES (_utf32 0x2D00), (_utf32 0x2D01);
INSERT INTO t1 VALUES (_utf32 0x2D02), (_utf32 0x2D03);
INSERT INTO t1 VALUES (_utf32 0x2D04), (_utf32 0x2D05);
INSERT INTO t1 VALUES (_utf32 0x2D06), (_utf32 0x2D07);
INSERT INTO t1 VALUES (_utf32 0x1D7D);
INSERT INTO t1 VALUES (_utf32 0x2132),(_utf32 0x214E);
INSERT INTO t1 VALUES (_utf32 0x2183),(_utf32 0x2184);
INSERT INTO t1 VALUES (_utf32 0x2C80), (_utf32 0x2C81);
INSERT INTO t1 VALUES (_utf32 0x2C82), (_utf32 0x2C83);
INSERT INTO t1 VALUES (_utf32 0x2C84), (_utf32 0x2C85);
INSERT INTO t1 VALUES (_utf32 0x2C86), (_utf32 0x2C87);
INSERT INTO t1 VALUES (_utf32 0x2C88), (_utf32 0x2C89);
INSERT INTO t1 VALUES (_utf32 0x2C8A), (_utf32 0x2C8B);
INSERT INTO t1 VALUES (_utf32 0x2C8C), (_utf32 0x2C8D);
INSERT INTO t1 VALUES (_utf32 0x2C8E), (_utf32 0x2C8F);
INSERT INTO t1 VALUES (_utf32 0x2C60), (_utf32 0x2C61);
INSERT INTO t1 VALUES (_utf32 0x2C62), (_utf32 0x2C63);
INSERT INTO t1 VALUES (_utf32 0x2C64), (_utf32 0x2C65);
INSERT INTO t1 VALUES (_utf32 0x2C66), (_utf32 0x2C67);
INSERT INTO t1 VALUES (_utf32 0x2C68), (_utf32 0x2C69);
INSERT INTO t1 VALUES (_utf32 0x2C6A), (_utf32 0x2C6B);
INSERT INTO t1 VALUES (_utf32 0x2C6C), (_utf32 0x2C75);
INSERT INTO t1 VALUES (_utf32 0x2C76);
INSERT INTO t1 VALUES (_utf32 0x2C00), (_utf32 0x2C01);
INSERT INTO t1 VALUES (_utf32 0x2C02), (_utf32 0x2C03);
INSERT INTO t1 VALUES (_utf32 0x2C04), (_utf32 0x2C05);
INSERT INTO t1 VALUES (_utf32 0x2C06), (_utf32 0x2C07);
INSERT INTO t1 VALUES (_utf32 0x2C30), (_utf32 0x2C31);
INSERT INTO t1 VALUES (_utf32 0x2C32), (_utf32 0x2C33);
INSERT INTO t1 VALUES (_utf32 0x2C34), (_utf32 0x2C35);
INSERT INTO t1 VALUES (_utf32 0x2C36), (_utf32 0x2C37);
INSERT INTO t1 VALUES (_utf32 0x10400), (_utf32 0x10401);
INSERT INTO t1 VALUES (_utf32 0x10402), (_utf32 0x10403);
INSERT INTO t1 VALUES (_utf32 0x10404), (_utf32 0x10405);
INSERT INTO t1 VALUES (_utf32 0x10406), (_utf32 0x10407);
INSERT INTO t1 VALUES (_utf32 0x10428), (_utf32 0x10429);
INSERT INTO t1 VALUES (_utf32 0x1042A), (_utf32 0x1042B);
INSERT INTO t1 VALUES (_utf32 0x1042C), (_utf32 0x1042D);
INSERT INTO t1 VALUES (_utf32 0x1042E), (_utf32 0x1042F);
INSERT INTO t1 VALUES (_utf32 0x0370);
INSERT INTO t1 VALUES (_utf32 0x0371);
INSERT INTO t1 VALUES (_utf32 0x0372);
INSERT INTO t1 VALUES (_utf32 0x0373);
INSERT INTO t1 VALUES (_utf32 0x0514);
INSERT INTO t1 VALUES (_utf32 0x0515);
INSERT INTO t1 VALUES (_utf32 0x0516);
INSERT INTO t1 VALUES (_utf32 0x0517);
INSERT INTO t1 VALUES (_utf32 0xA640);
INSERT INTO t1 VALUES (_utf32 0xA641);
INSERT INTO t1 VALUES (_utf32 0xA642);
INSERT INTO t1 VALUES (_utf32 0xA643);
INSERT INTO t1 VALUES (_utf32 0xA722);
INSERT INTO t1 VALUES (_utf32 0xA723);
INSERT INTO t1 VALUES (_utf32 0xA724);
INSERT INTO t1 VALUES (_utf32 0xA725);
INSERT INTO t1 VALUES (_utf32 0xA726);
INSERT INTO t1 VALUES (_utf32 0xA727);
INSERT INTO t1 VALUES (_utf32 0xA728);
INSERT INTO t1 VALUES (_utf32 0xA729);
INSERT INTO t1 VALUES (_utf32 0xA72A);
INSERT INTO t1 VALUES (_utf32 0xA72B);
INSERT INTO t1 VALUES (_utf32 0x2CEB);
INSERT INTO t1 VALUES (_utf32 0x2CEC);
INSERT INTO t1 VALUES (_utf32 0x2CED);
INSERT INTO t1 VALUES (_utf32 0x2CEE);
SELECT hex(c), hex(lower(c)), hex(upper(c)), hex(weight_string(c)), c
FROM t1 ORDER BY c, BINARY c;
hex(c)	hex(lower(c))	hex(upper(c))	hex(weight_string(c))	c
023A	2C65	023A	1214	Ⱥ
2C65	2C65	023A	1214	ⱥ
0180	0180	0243	122D	ƀ
0243	0180	0243	122D	Ƀ
023B	023C	023B	1242	Ȼ
023C	023C	023B	1242	ȼ
2183	2184	2183	124E	Ↄ
2184	2184	2183	124E	ↄ
0246	0247	0246	1270	Ɇ
0247	0247	0246	1270	ɇ
2132	214E	2132	12AE	Ⅎ
214E	214E	2132	12AE	ⅎ
2C67	2C68	2C67	12E3	Ⱨ
2C68	2C68	2C67	12E3	ⱨ
2C75	2C76	2C75	12E4	Ⱶ
2C76	2C76	2C75	12E4	ⱶ
A726	A727	A726	12E5	Ꜧ
A727	A727	A726	12E5	ꜧ
0248	0249	0248	130E	Ɉ
0249	0249	0248	130E	ɉ
2C69	2C6A	2C69	1328	Ⱪ
2C6A	2C6A	2C69	1328	ⱪ
023D	019A	023D	133B	Ƚ
2C60	2C61	2C60	133F	Ⱡ
2C61	2C61	2C60	133F	ⱡ
026B	026B	2C62	1340	ɫ
2C62	026B	2C62	1340	Ɫ
1D7D	1D7D	2C63	13B8	ᵽ
2C63	1D7D	2C63	13B8	Ᵽ
024A	024B	024A	13D2	Ɋ
024B	024B	024A	13D2	ɋ
024C	024D	024C	13E4	Ɍ
024D	024D	024C	13E4	ɍ
027D	027D	2C64	13FC	ɽ
2C64	027D	2C64	13FC	Ɽ
A728	A729	A728	143314AD	Ꜩ
A729	A729	A728	143314AD	ꜩ
023E	2C66	023E	143C	Ⱦ
2C66	2C66	023E	143C	ⱦ
0244	0289	0244	145B	Ʉ
0289	0289	0244	145B	ʉ
0245	028C	0245	1489	Ʌ
028C	028C	0245	1489	ʌ
024E	024F	024E	14A4	Ɏ
024F	024F	024E	14A4	ɏ
2C6B	2C6C	2C6B	14C8	Ⱬ
2C6C	2C6C	2C6B	14C8	ⱬ
A72A	A72B	A72A	14F3	Ꜫ
A72B	A72B	A72A	14F3	ꜫ
0241	0242	0241	1506	Ɂ
0242	0242	0241	1506	ɂ
A722	A723	A722	150E	Ꜣ
A723	A723	A722	150E	ꜣ
A724	A725	A724	1518	Ꜥ
A725	A725	A724	1518	ꜥ
0370	0371	0370	154F	Ͱ
0371	0371	0370	154F	ͱ
037C	037C	03FE	1564	ͼ
03FE	037C	03FE	1564	Ͼ
037B	037B	03FD	1565	ͻ
03FD	037B	03FD	1565	Ͻ
037D	037D	03FF	1566	ͽ
03FF	037D	03FF	1566	Ͽ
0372	0373	0372	156F	Ͳ
0373	0373	0372	156F	ͳ
2C80	2C81	2C80	1571	Ⲁ
2C81	2C81	2C80	1571	ⲁ
2C82	2C83	2C82	1572	Ⲃ
2C83	2C83	2C82	1572	ⲃ
2C84	2C85	2C84	1573	Ⲅ
2C85	2C85	2C84	1573	ⲅ
2C86	2C87	2C86	1574	Ⲇ
2C87	2C87	2C86	1574	ⲇ
2C88	2C89	2C88	1575	Ⲉ
2C89	2C89	2C88	1575	ⲉ
2C8A	2C8B	2C8A	1577	Ⲋ
2C8B	2C8B	2C8A	1577	ⲋ
2C8C	2C8D	2C8C	1578	Ⲍ
2C8D	2C8D	2C8C	1578	ⲍ
2C8E	2C8F	2C8E	1579	Ⲏ
2C8F	2C8F	2C8E	1579	ⲏ
2CEB	2CEC	2CEB	1591	Ⳬ
2CEC	2CEC	2CEB	1591	ⳬ
2CED	2CEE	2CED	15A0	Ⳮ
2CEE	2CEE	2CED	15A0	ⳮ
04FA	04FB	04FA	15D4	Ӻ
04FB	04FB	04FA	15D4	ӻ
04F6	04F7	04F6	15DC	Ӷ
04F7	04F7	04F6	15DC	ӷ
A640	A641	A640	1611	Ꙁ
A641	A641	A640	1611	ꙁ
0510	0511	0510	1613	Ԑ
0511	0511	0510	1613	ԑ
A642	A643	A642	1618	Ꙃ
A643	A643	A642	1618	ꙃ
0512	0513	0512	1666	Ԓ
0513	0513	0512	1666	ԓ
0514	0515	0514	166E	Ԕ
0515	0515	0514	166E	ԕ
0516	0517	0516	16B7	Ԗ
0517	0517	0516	16B7	ԗ
04FC	04FD	04FC	16F9	Ӽ
04FD	04FD	04FC	16F9	ӽ
04FE	04FF	04FE	16FD	Ӿ
04FF	04FF	04FE	16FD	ӿ
04C0	04CF	04C0	17B1	Ӏ
04CF	04CF	04C0	17B1	ӏ
2C00	2C30	2C00	17B5	Ⰰ
2C30	2C30	2C00	17B5	ⰰ
2C01	2C31	2C01	17B6	Ⰱ
2C31	2C31	2C01	17B6	ⰱ
2C02	2C32	2C02	17B7	Ⰲ
2C32	2C32	2C02	17B7	ⰲ
2C03	2C33	2C03	17B8	Ⰳ
2C33	2C33	2C03	17B8	ⰳ
2C04	2C34	2C04	17B9	Ⰴ
2C34	2C34	2C04	17B9	ⰴ
2C05	2C35	2C05	17BA	Ⰵ
2C35	2C35	2C05	17BA	ⰵ
2C06	2C36	2C06	17BB	Ⰶ
2C36	2C36	2C06	17BB	ⰶ
2C07	2C37	2C07	17BC	Ⰷ
2C37	2C37	2C07	17BC	ⰷ
10A0	2D00	10A0	17E5	Ⴀ
2D00	2D00	10A0	17E5	ⴀ
10A1	2D01	10A1	17E7	Ⴁ
2D01	2D01	10A1	17E7	ⴁ
10A2	2D02	10A2	17E9	Ⴂ
2D02	2D02	10A2	17E9	ⴂ
10A3	2D03	10A3	17EB	Ⴃ
2D03	2D03	10A3	17EB	ⴃ
10A4	2D04	10A4	17ED	Ⴄ
2D04	2D04	10A4	17ED	ⴄ
10A5	2D05	10A5	17EF	Ⴅ
2D05	2D05	10A5	17EF	ⴅ
10A6	2D06	10A6	17F1	Ⴆ
2D06	2D06	10A6	17F1	ⴆ
10A7	2D07	10A7	17F5	Ⴇ
2D07	2D07	10A7	17F5	ⴇ
D801DC00	D801DC28	D801DC00	30D2	𐐀
D801DC28	D801DC28	D801DC00	30D2	𐐨
D801DC01	D801DC29	D801DC01	30D3	𐐁
D801DC29	D801DC29	D801DC01	30D3	𐐩
D801DC02	D801DC2A	D801DC02	30D4	𐐂
D801DC2A	D801DC2A	D801DC02	30D4	𐐪
D801DC03	D801DC2B	D801DC03	30D5	𐐃
D801DC2B	D801DC2B	D801DC03	30D5	𐐫
D801DC04	D801DC2C	D801DC04	30D6	𐐄
D801DC2C	D801DC2C	D801DC04	30D6	𐐬
D801DC05	D801DC2D	D801DC05	30D7	𐐅
D801DC2D	D801DC2D	D801DC05	30D7	𐐭
D801DC06	D801DC2E	D801DC06	30D8	𐐆
D801DC2E	D801DC2E	D801DC06	30D8	𐐮
D801DC07	D801DC2F	D801DC07	30D9	𐐇
D801DC2F	D801DC2F	D801DC07	30D9	𐐯
INSERT INTO t1 VALUES ('a');
INSERT INTO t1 VALUES (concat(_utf32 0x61, _utf32 0xFFFF));
INSERT INTO t1 VALUES (concat(_utf32 0x61, _utf32 0x10FFFF));
INSERT INTO t1 VALUES (concat(_utf32 0x61, _utf32 0x10400));
SELECT hex(c), hex(weight_string(c)) FROM t1 WHERE c LIKE 'a%' ORDER BY c;
hex(c)	hex(weight_string(c))
0061	120F
0061D801DC00	120F30D2
0061FFFF	120FFBC1FFFF
0061DBFFDFFF	120FFBE1FFFF
SELECT hex(c), hex(weight_string(c)), c FROM t1 WHERE c LIKE _utf32 0x10400 ORDER BY c, BINARY c;
hex(c)	hex(weight_string(c))	c
D801DC00	30D2	𐐀
D801DC28	30D2	𐐨
SELECT hex(c), hex(weight_string(c)), c FROM t1 WHERE c LIKE _utf32 0x10428 ORDER BY c, BINARY c;
hex(c)	hex(weight_string(c))	c
D801DC00	30D2	𐐀
D801DC28	30D2	𐐨
ALTER TABLE t1 ADD KEY(c);
EXPLAIN SELECT hex(c) FROM t1 WHERE c LIKE 'a%' ORDER BY c;
id	select_type	table	partitions	type	possible_keys	key	key_len	ref	rows	filtered	Extra
1	SIMPLE	t1	NULL	range	c	c	43	NULL	4	100.00	Using where; Using index
Warnings:
Note	1003	/* select#1 */ select hex(`test`.`t1`.`c`) AS `hex(c)` from `test`.`t1` where (`test`.`t1`.`c` like 'a%') order by `test`.`t1`.`c`
SELECT hex(c), hex(weight_string(c)) FROM t1 WHERE c LIKE 'a%' ORDER BY c;
hex(c)	hex(weight_string(c))
0061	120F
0061D801DC00	120F30D2
0061FFFF	120FFBC1FFFF
0061DBFFDFFF	120FFBE1FFFF
SELECT hex(c), hex(weight_string(c)), c FROM t1 WHERE c LIKE _utf32 0x10400 ORDER BY c, BINARY c;
hex(c)	hex(weight_string(c))	c
D801DC00	30D2	𐐀
D801DC28	30D2	𐐨
SELECT hex(c), hex(weight_string(c)), c FROM t1 WHERE c LIKE _utf32 0x10428 ORDER BY c, BINARY c;
hex(c)	hex(weight_string(c))	c
D801DC00	30D2	𐐀
D801DC28	30D2	𐐨
DROP TABLE t1;
#
# End of 5.6 tests
#
