# FR 5) UPDATE and DELETE operations on parent of foreign key table must
# generate binlog for CASCADE operations
# FR 5.1) Test foreign key cascade generates child binlogs with row-based binary logging.
# Set BINLOG_FORMAT to 'ROW'.
# Create tables t1, t2, t22, t3, and t4 with foreign key constraints.
# Insert data into the tables.
# Perform DELETE and UPDATE operations on t1.
# Verify that the binary log is generated correctly.
# Check the contents of the binary log file fk_binlog.sql.
# Apply the binary log to the database and verify the results.
SET @saved_binlog_format = (SELECT @@global.binlog_format);
Warnings:
Warning	1287	'@@binlog_format' is deprecated and will be removed in a future release.
SET BINLOG_FORMAT='ROW';
Warnings:
Warning	1287	'@@binlog_format' is deprecated and will be removed in a future release.
reset binary logs and gtids;
CREATE TABLE t1 (f1 INT PRIMARY KEY);
CREATE TABLE t2 (f1 INT PRIMARY KEY, f2 INT, UNIQUE KEY(f2), FOREIGN KEY (f2) REFERENCES t1(f1) ON DELETE CASCADE ON UPDATE CASCADE);
CREATE TABLE t22 (f1 INT PRIMARY KEY, f2 INT, FOREIGN KEY (f2) REFERENCES t1(f1) ON DELETE SET NULL ON UPDATE SET NULL);
CREATE TABLE t3 (f1 INT PRIMARY KEY, f2 INT, UNIQUE KEY(f2), FOREIGN KEY (f2) REFERENCES t2(f2) ON DELETE CASCADE ON UPDATE CASCADE);
CREATE TABLE t4 (f1 INT PRIMARY KEY, f2 INT, FOREIGN KEY (f2) REFERENCES t3(f2) ON DELETE CASCADE ON UPDATE CASCADE);
INSERT INTO t1 VALUES (1),(2),(3);
INSERT INTO t2 VALUES (1, 1),(2, 2),(3, 3);
INSERT INTO t22 VALUES (1, 1),(2, 2),(3, 3);
INSERT INTO t3 VALUES (1, 1),(2, 2),(3, 3);
INSERT INTO t4 VALUES (1, 1),(2, 2),(3, 3);
DELETE FROM t1 WHERE f1=2;
UPDATE t1 SET f1=5 WHERE f1=3;
flush logs;
mysqlbinlog var/log/master_binlog_file > var/tmp/fk_binlog.sql
DELETE FROM t2;
DELETE FROM t22;
DELETE FROM t3;
DELETE FROM t4;
DROP TABLE t4, t3, t22, t2, t1;
Pattern "NO_FOREIGN_KEY_CHECKS_F" found
Pattern "USE_SQL_FOREIGN_KEY_F" found
reset binary logs and gtids;
SELECT * FROM t2 ORDER BY f1;
f1	f2
1	1
3	5
SELECT * FROM t22 ORDER BY f1;
f1	f2
1	1
2	NULL
3	NULL
SELECT * FROM t3 ORDER BY f1;
f1	f2
1	1
3	5
SELECT * FROM t4 ORDER BY f1;
f1	f2
1	1
3	5
DROP TABLE t4, t3, t22, t2, t1;
SET BINLOG_FORMAT='STATEMENT';
Warnings:
Warning	1287	'@@binlog_format' is deprecated and will be removed in a future release.
reset binary logs and gtids;
# FR 5.2) Test foreign key support with mixed statement and row-based binary logging.
# Set BINLOG_FORMAT to 'STATEMENT' initially.
# Create tables t1, t2, and t3 with foreign key constraints.
# Insert data into the tables.
# Perform DELETE operation on t1 with BINLOG_FORMAT set to 'STATEMENT'.
# Switch to BINLOG_FORMAT 'ROW' and perform UPDATE operation on t1.
# Switch back to BINLOG_FORMAT 'STATEMENT' and perform another DELETE operation on t1.
# Switch to BINLOG_FORMAT 'ROW' again and perform another UPDATE operation on t1.
# Verify that the binary log is generated correctly.
# Check the contents of the binary log file fk_both_binlog.sql.
# Apply the binary log to the database and verify the results.
CREATE TABLE t1 (f1 INT PRIMARY KEY);
CREATE TABLE t2 (f1 INT PRIMARY KEY, f2 INT, FOREIGN KEY (f2) REFERENCES t1(f1) ON DELETE CASCADE ON UPDATE CASCADE);
CREATE TABLE t3 (f1 INT PRIMARY KEY, f2 INT, FOREIGN KEY (f2) REFERENCES t1(f1) ON DELETE SET NULL ON UPDATE SET NULL);
INSERT INTO t1 VALUES (1),(2),(3),(4),(5);
INSERT INTO t2 VALUES (1, 1),(2, 2),(3, 3), (4, 4), (5, 5);
INSERT INTO t3 VALUES (1, 1),(2, 2),(3, 3), (4, 4), (5, 5);
DELETE FROM t1 WHERE f1=2;
SET BINLOG_FORMAT='ROW';
Warnings:
Warning	1287	'@@binlog_format' is deprecated and will be removed in a future release.
UPDATE t1 SET f1=9 WHERE f1=3;
SET BINLOG_FORMAT='STATEMENT';
Warnings:
Warning	1287	'@@binlog_format' is deprecated and will be removed in a future release.
DELETE FROM t1 WHERE f1=4;
SET BINLOG_FORMAT='ROW';
Warnings:
Warning	1287	'@@binlog_format' is deprecated and will be removed in a future release.
UPDATE t1 SET f1=10 WHERE f1=5;
flush logs;
mysqlbinlog var/log/master_binlog_file > var/tmp/fk_both_binlog.sql
DELETE FROM t2;
DELETE FROM t3;
SELECT * FROM t2;
f1	f2
SELECT * FROM t3;
f1	f2
DROP TABLE t3, t2, t1;
reset binary logs and gtids;
SELECT * FROM t2 ORDER BY f1;
f1	f2
1	1
3	9
5	10
SELECT * FROM t3 ORDER BY f1;
f1	f2
1	1
2	NULL
3	NULL
4	NULL
5	NULL
DROP TABLE t3, t2, t1;
# WL#17024 Fire child trigger during cascade action
# child table binlog should not contain FKC binlog flag for
# tables mentioned in it's trigger.
# FR 9: Binary Logging
# Source must log all the changes performed inside cascade-induced triggers
# of child table
# case 1: ROW format
SET BINLOG_FORMAT='ROW';
Warnings:
Warning	1287	'@@binlog_format' is deprecated and will be removed in a future release.
reset binary logs and gtids;
CREATE TABLE t1 (f1 INT PRIMARY KEY);
CREATE TABLE t2 (f1 INT PRIMARY KEY, f2 INT, UNIQUE KEY(f2), FOREIGN KEY (f2) REFERENCES t1(f1) ON DELETE CASCADE ON UPDATE CASCADE);
CREATE TABLE logtable (action VARCHAR(128), oldval INT, newval INT);
INSERT INTO t1 VALUES (1),(2),(3);
INSERT INTO t2 VALUES (1, 1),(2, 2),(3, 3);
CREATE TRIGGER trg1 AFTER DELETE ON t1
FOR EACH ROW BEGIN
INSERT INTO logtable VALUES("t1-AFTER-DELETE", OLD.f1, 0);
END//
CREATE TRIGGER trg2 AFTER DELETE ON t2
FOR EACH ROW BEGIN
SET FOREIGN_KEY_CHECKS = ON;
INSERT INTO logtable VALUES("t2-AFTER-DELETE", OLD.f2, 0);
END//
CREATE TRIGGER trg3 AFTER UPDATE ON t1
FOR EACH ROW BEGIN
INSERT INTO logtable VALUES("t1-AFTER-UPDATE", OLD.f1, NEW.f1);
END//
CREATE TRIGGER trg4 AFTER UPDATE ON t2
FOR EACH ROW BEGIN
SET FOREIGN_KEY_CHECKS = ON;
INSERT INTO logtable VALUES("t2-AFTER-UPDATE", OLD.f2, NEW.f2);
END//
SET enable_cascade_triggers = ON;
Warnings:
Warning	1681	'enable_cascade_triggers' is deprecated and will be removed in a future release.
DELETE FROM t1 WHERE f1=2;
UPDATE t1 SET f1=5 WHERE f1=3;
SET enable_cascade_triggers = OFF;
Warnings:
Warning	4166	'enable_cascade_triggers' is deprecated and will be removed in a future release. Triggers on child table will not fire during foreign key cascade.
SELECT * FROM t1 ORDER BY f1;
f1
1
5
SELECT * FROM t2 ORDER BY f1;
f1	f2
1	1
3	5
SELECT * FROM logtable;
action	oldval	newval
t2-AFTER-DELETE	2	0
t1-AFTER-DELETE	2	0
t2-AFTER-UPDATE	3	5
t1-AFTER-UPDATE	3	5
flush logs;
mysqlbinlog var/log/master_binlog_file > var/tmp/fk_binlog.sql
DROP TABLE t2, t1, logtable;
#NO_FOREIGN_KEY_CHECKS_F flag should appear only twice
#once for DELETE cascade and once for UPDATE CASCADE
#write_rows event from logtable INSERT in trigger should not have this flag.
# Show binlog events
include/rpl/deprecated/show_binlog_events.inc
Log_name	Pos	Event_type	Server_id	End_log_pos	Info
binlog.000001	#	Query	#	#	use `test`; CREATE TABLE t1 (f1 INT PRIMARY KEY)
binlog.000001	#	Query	#	#	use `test`; CREATE TABLE t2 (f1 INT PRIMARY KEY, f2 INT, UNIQUE KEY(f2), FOREIGN KEY (f2) REFERENCES t1(f1) ON DELETE CASCADE ON UPDATE CASCADE)
binlog.000001	#	Query	#	#	use `test`; CREATE TABLE logtable (action VARCHAR(128), oldval INT, newval INT)
binlog.000001	#	Query	#	#	BEGIN
binlog.000001	#	Table_map	#	#	table_id: # (test.t1)
binlog.000001	#	Write_rows	#	#	table_id: # flags: STMT_END_F USE_SQL_FOREIGN_KEY_F
binlog.000001	#	Xid	#	#	COMMIT /* XID */
binlog.000001	#	Query	#	#	BEGIN
binlog.000001	#	Table_map	#	#	table_id: # (test.t2)
binlog.000001	#	Write_rows	#	#	table_id: # flags: STMT_END_F USE_SQL_FOREIGN_KEY_F
binlog.000001	#	Xid	#	#	COMMIT /* XID */
binlog.000001	#	Query	#	#	use `test`; CREATE DEFINER=`root`@`localhost` TRIGGER trg1 AFTER DELETE ON t1
FOR EACH ROW BEGIN
INSERT INTO logtable VALUES("t1-AFTER-DELETE", OLD.f1, 0);
END
binlog.000001	#	Query	#	#	use `test`; CREATE DEFINER=`root`@`localhost` TRIGGER trg2 AFTER DELETE ON t2
FOR EACH ROW BEGIN
SET FOREIGN_KEY_CHECKS = ON;
INSERT INTO logtable VALUES("t2-AFTER-DELETE", OLD.f2, 0);
END
binlog.000001	#	Query	#	#	use `test`; CREATE DEFINER=`root`@`localhost` TRIGGER trg3 AFTER UPDATE ON t1
FOR EACH ROW BEGIN
INSERT INTO logtable VALUES("t1-AFTER-UPDATE", OLD.f1, NEW.f1);
END
binlog.000001	#	Query	#	#	use `test`; CREATE DEFINER=`root`@`localhost` TRIGGER trg4 AFTER UPDATE ON t2
FOR EACH ROW BEGIN
SET FOREIGN_KEY_CHECKS = ON;
INSERT INTO logtable VALUES("t2-AFTER-UPDATE", OLD.f2, NEW.f2);
END
binlog.000001	#	Query	#	#	BEGIN
binlog.000001	#	Table_map	#	#	table_id: # (test.t1)
binlog.000001	#	Table_map	#	#	table_id: # (test.logtable)
binlog.000001	#	Table_map	#	#	table_id: # (test.t2)
binlog.000001	#	Table_map	#	#	table_id: # (test.logtable)
binlog.000001	#	Delete_rows	#	#	table_id: # flags: NO_FOREIGN_KEY_CHECKS_F USE_SQL_FOREIGN_KEY_F
binlog.000001	#	Write_rows	#	#	table_id: # flags: USE_SQL_FOREIGN_KEY_F
binlog.000001	#	Delete_rows	#	#	table_id: # flags: USE_SQL_FOREIGN_KEY_F
binlog.000001	#	Write_rows	#	#	table_id: # flags: STMT_END_F USE_SQL_FOREIGN_KEY_F
binlog.000001	#	Xid	#	#	COMMIT /* XID */
binlog.000001	#	Query	#	#	BEGIN
binlog.000001	#	Table_map	#	#	table_id: # (test.t1)
binlog.000001	#	Table_map	#	#	table_id: # (test.logtable)
binlog.000001	#	Table_map	#	#	table_id: # (test.t2)
binlog.000001	#	Table_map	#	#	table_id: # (test.logtable)
binlog.000001	#	Update_rows	#	#	table_id: # flags: NO_FOREIGN_KEY_CHECKS_F USE_SQL_FOREIGN_KEY_F
binlog.000001	#	Write_rows	#	#	table_id: # flags: USE_SQL_FOREIGN_KEY_F
binlog.000001	#	Update_rows	#	#	table_id: # flags: USE_SQL_FOREIGN_KEY_F
binlog.000001	#	Write_rows	#	#	table_id: # flags: STMT_END_F USE_SQL_FOREIGN_KEY_F
binlog.000001	#	Xid	#	#	COMMIT /* XID */
binlog.000001	#	Rotate	#	#	binlog.000002;pos=POS
reset binary logs and gtids;
SELECT * FROM t1 ORDER BY f1;
f1
1
5
SELECT * FROM t2 ORDER BY f1;
f1	f2
1	1
3	5
SELECT * FROM logtable;
action	oldval	newval
t2-AFTER-DELETE	2	0
t1-AFTER-DELETE	2	0
t2-AFTER-UPDATE	3	5
t1-AFTER-UPDATE	3	5
DROP TABLE t2, t1, logtable;
reset binary logs and gtids;
# case 2: STATEMENT format
SET BINLOG_FORMAT='STATEMENT';
Warnings:
Warning	1287	'@@binlog_format' is deprecated and will be removed in a future release.
reset binary logs and gtids;
CREATE TABLE t1 (f1 INT PRIMARY KEY);
CREATE TABLE t2 (f1 INT PRIMARY KEY, f2 INT, UNIQUE KEY(f2), FOREIGN KEY (f2) REFERENCES t1(f1) ON DELETE CASCADE ON UPDATE CASCADE);
CREATE TABLE logtable (action VARCHAR(128), oldval INT, newval INT);
INSERT INTO t1 VALUES (1),(2),(3);
INSERT INTO t2 VALUES (1, 1),(2, 2),(3, 3);
CREATE TRIGGER trg1 AFTER DELETE ON t1
FOR EACH ROW BEGIN
INSERT INTO logtable VALUES("t1-AFTER-DELETE", OLD.f1, 0);
END//
CREATE TRIGGER trg2 AFTER DELETE ON t2
FOR EACH ROW BEGIN
SET FOREIGN_KEY_CHECKS = ON;
INSERT INTO logtable VALUES("t2-AFTER-DELETE", OLD.f2, 0);
END//
CREATE TRIGGER trg3 AFTER UPDATE ON t1
FOR EACH ROW BEGIN
INSERT INTO logtable VALUES("t1-AFTER-UPDATE", OLD.f1, NEW.f1);
END//
CREATE TRIGGER trg4 AFTER UPDATE ON t2
FOR EACH ROW BEGIN
SET FOREIGN_KEY_CHECKS = ON;
INSERT INTO logtable VALUES("t2-AFTER-UPDATE", OLD.f2, NEW.f2);
END//
SET enable_cascade_triggers = ON;
Warnings:
Warning	1681	'enable_cascade_triggers' is deprecated and will be removed in a future release.
DELETE FROM t1 WHERE f1=2;
UPDATE t1 SET f1=5 WHERE f1=3;
SELECT * FROM t1 ORDER BY f1;
f1
1
5
SELECT * FROM t2 ORDER BY f1;
f1	f2
1	1
3	5
SELECT * FROM logtable;
action	oldval	newval
t2-AFTER-DELETE	2	0
t1-AFTER-DELETE	2	0
t2-AFTER-UPDATE	3	5
t1-AFTER-UPDATE	3	5
flush logs;
mysqlbinlog var/log/master_binlog_file > var/tmp/fk_binlog.sql
DROP TABLE t2, t1, logtable;
#NO_FOREIGN_KEY_CHECKS_F flag should not appear in stmt binlog mode
#check if logtable is present 5(create+4 triggers) times in binlog
# Show binlog events
include/rpl/deprecated/show_binlog_events.inc
Log_name	Pos	Event_type	Server_id	End_log_pos	Info
binlog.000001	#	Query	#	#	use `test`; CREATE TABLE t1 (f1 INT PRIMARY KEY)
binlog.000001	#	Query	#	#	use `test`; CREATE TABLE t2 (f1 INT PRIMARY KEY, f2 INT, UNIQUE KEY(f2), FOREIGN KEY (f2) REFERENCES t1(f1) ON DELETE CASCADE ON UPDATE CASCADE)
binlog.000001	#	Query	#	#	use `test`; CREATE TABLE logtable (action VARCHAR(128), oldval INT, newval INT)
binlog.000001	#	Query	#	#	BEGIN
binlog.000001	#	Query	#	#	use `test`; INSERT INTO t1 VALUES (1),(2),(3)
binlog.000001	#	Xid	#	#	COMMIT /* XID */
binlog.000001	#	Query	#	#	BEGIN
binlog.000001	#	Query	#	#	use `test`; INSERT INTO t2 VALUES (1, 1),(2, 2),(3, 3)
binlog.000001	#	Xid	#	#	COMMIT /* XID */
binlog.000001	#	Query	#	#	use `test`; CREATE DEFINER=`root`@`localhost` TRIGGER trg1 AFTER DELETE ON t1
FOR EACH ROW BEGIN
INSERT INTO logtable VALUES("t1-AFTER-DELETE", OLD.f1, 0);
END
binlog.000001	#	Query	#	#	use `test`; CREATE DEFINER=`root`@`localhost` TRIGGER trg2 AFTER DELETE ON t2
FOR EACH ROW BEGIN
SET FOREIGN_KEY_CHECKS = ON;
INSERT INTO logtable VALUES("t2-AFTER-DELETE", OLD.f2, 0);
END
binlog.000001	#	Query	#	#	use `test`; CREATE DEFINER=`root`@`localhost` TRIGGER trg3 AFTER UPDATE ON t1
FOR EACH ROW BEGIN
INSERT INTO logtable VALUES("t1-AFTER-UPDATE", OLD.f1, NEW.f1);
END
binlog.000001	#	Query	#	#	use `test`; CREATE DEFINER=`root`@`localhost` TRIGGER trg4 AFTER UPDATE ON t2
FOR EACH ROW BEGIN
SET FOREIGN_KEY_CHECKS = ON;
INSERT INTO logtable VALUES("t2-AFTER-UPDATE", OLD.f2, NEW.f2);
END
binlog.000001	#	Query	#	#	BEGIN
binlog.000001	#	Query	#	#	use `test`; DELETE FROM t1 WHERE f1=2
binlog.000001	#	Xid	#	#	COMMIT /* XID */
binlog.000001	#	Query	#	#	BEGIN
binlog.000001	#	Query	#	#	use `test`; UPDATE t1 SET f1=5 WHERE f1=3
binlog.000001	#	Xid	#	#	COMMIT /* XID */
binlog.000001	#	Rotate	#	#	binlog.000002;pos=POS
reset binary logs and gtids;
SELECT * FROM t1 ORDER BY f1;
f1
1
5
SELECT * FROM t2 ORDER BY f1;
f1	f2
1	1
3	5
SELECT * FROM logtable;
action	oldval	newval
t2-AFTER-DELETE	2	0
t1-AFTER-DELETE	2	0
t2-AFTER-UPDATE	3	5
t1-AFTER-UPDATE	3	5
DROP TABLE t2, t1, logtable;
reset binary logs and gtids;
# case 3: Enabling enable_cascade_triggers in STATEMENT format with
#         InnoDB FK handling should give warning
# restart: --innodb_native_foreign_keys=ON
SET BINLOG_FORMAT='STATEMENT';
Warnings:
Warning	1287	'@@binlog_format' is deprecated and will be removed in a future release.
reset binary logs and gtids;
CREATE TABLE t1 (f1 INT PRIMARY KEY);
CREATE TABLE t2 (f1 INT PRIMARY KEY, f2 INT, UNIQUE KEY(f2),
FOREIGN KEY (f2) REFERENCES t1(f1) ON DELETE CASCADE ON UPDATE CASCADE);
CREATE TABLE logtable (action VARCHAR(128), oldval INT, newval INT);
INSERT INTO t1 VALUES (1),(2),(3);
INSERT INTO t2 VALUES (1, 1),(2, 2),(3, 3);
CREATE TRIGGER trg1 AFTER DELETE ON t1
FOR EACH ROW BEGIN
INSERT INTO logtable VALUES("t1-AFTER-DELETE", OLD.f1, 0);
END//
CREATE TRIGGER trg2 AFTER DELETE ON t2
FOR EACH ROW BEGIN
INSERT INTO logtable VALUES("t2-AFTER-DELETE", OLD.f2, 0);
END//
SET enable_cascade_triggers = ON;
Warnings:
Warning	4166	'enable_cascade_triggers' is deprecated and will be removed in a future release. Enabling trigger execution on child table is supported only with SQL Foreign Key handling (i.e with innodb_native_foreign_keys = OFF).
DELETE FROM t1 WHERE f1=2;
DROP TABLE t1, t2, logtable;
include/assert_grep.inc ["Check for InnoDB FK enable_cascade_trigger warning in the server log"]
# cleanup: restart without innodb_native_foreign_keys variable
# restart:
