# Test of the JSON data type.
# ----------------------------------------------------------------------
SET NAMES utf8;
CREATE TABLE t1 (i INT, j JSON) ENGINE=InnoDB;
SHOW CREATE TABLE t1;
Table	Create Table
t1	CREATE TABLE `t1` (
  `i` int(11) DEFAULT NULL,
  `j` json DEFAULT NULL
) ENGINE=InnoDB DEFAULT CHARSET=latin1
INSERT INTO t1 VALUES (0, NULL);
INSERT INTO t1 VALUES (1, '{"a": 2}');
INSERT INTO t1 VALUES (2, '[1,2]');
INSERT INTO t1 VALUES (3, '{"a":"b", "c":"d","ab":"abc", "bc": ["x", "y"]}');
INSERT INTO t1 VALUES (4, '["here", ["I", "am"], "!!!"]');
INSERT INTO t1 VALUES (5, '"scalar string"');
INSERT INTO t1 VALUES (6, 'true');
INSERT INTO t1 VALUES (7, 'false');
INSERT INTO t1 VALUES (8, 'null');
INSERT INTO t1 VALUES (9, '-1');
INSERT INTO t1 VALUES (10, CAST(CAST(1 AS UNSIGNED) AS JSON));
INSERT INTO t1 VALUES (11, '32767');
INSERT INTO t1 VALUES (12, '32768');
INSERT INTO t1 VALUES (13, '-32768');
INSERT INTO t1 VALUES (14, '-32769');
INSERT INTO t1 VALUES (15, '2147483647');
INSERT INTO t1 VALUES (16, '2147483648');
INSERT INTO t1 VALUES (17, '-2147483648');
INSERT INTO t1 VALUES (18, '-2147483649');
INSERT INTO t1 VALUES (19, '18446744073709551615');
INSERT INTO t1 VALUES (20, '18446744073709551616');
INSERT INTO t1 VALUES (21, '3.14');
INSERT INTO t1 VALUES (22, '{}');
INSERT INTO t1 VALUES (23, '[]');
INSERT INTO t1 VALUES (24, CAST(CAST('2015-01-15 23:24:25' AS DATETIME) AS JSON));
INSERT INTO t1 VALUES (25, CAST(CAST('23:24:25' AS TIME) AS JSON));
INSERT INTO t1 VALUES (26, CAST(CAST('2015-01-15' AS DATE) AS JSON));
INSERT INTO t1 VALUES (27, CAST(TIMESTAMP'2015-01-15 23:24:25' AS JSON));
INSERT INTO t1 VALUES (28, CAST(ST_GeomFromText('POINT(1 1)') AS JSON));
INSERT INTO t1 VALUES (29, CAST('[]' AS CHAR CHARACTER SET 'ascii'));
INSERT INTO t1 VALUES (30, CAST(x'cafe' AS JSON));
INSERT INTO t1 VALUES (31, CAST(x'cafebabe' AS JSON));
INSERT INTO t1 VALUES (100, CONCAT('{"', REPEAT('a', 64 * 1024 - 1), '":123}'));
INSERT INTO t1 VALUES (101, CONCAT('{"', REPEAT('a', 64 * 1024), '":123}'));
ERROR 22032: The JSON object contains a key name that is too long.
INSERT INTO t1 VALUES (102, CAST(CONCAT('{"', REPEAT('a', 64 * 1024), '":123}') AS JSON));
ERROR 22032: The JSON object contains a key name that is too long.
SELECT i, LENGTH(j), j FROM t1 ORDER BY i;
i	LENGTH(j)	j
0	NULL	NULL
1	8	{"a": 2}
2	6	[1, 2]
3	51	{"a": "b", "c": "d", "ab": "abc", "bc": ["x", "y"]}
4	28	["here", ["I", "am"], "!!!"]
5	15	"scalar string"
6	4	true
7	5	false
8	4	null
9	2	-1
10	1	1
11	5	32767
12	5	32768
13	6	-32768
14	6	-32769
15	10	2147483647
16	10	2147483648
17	11	-2147483648
18	11	-2147483649
19	20	18446744073709551615
20	21	1.8446744073709552e19
21	4	3.14
22	2	{}
23	2	[]
24	28	"2015-01-15 23:24:25.000000"
25	17	"23:24:25.000000"
26	12	"2015-01-15"
27	28	"2015-01-15 23:24:25.000000"
28	40	{"type": "Point", "coordinates": [1, 1]}
29	2	[]
30	20	"base64:type16:yv4="
31	24	"base64:type16:yv66vg=="
100	65544	{"aaaaaaaaaaaaaaaaaaaaaaaaaaaaaaaaaaaaaaaaaaaaaaaaaaaaaaaaaaaaaaaaaaaaaaaaaaaaaaaaaaaaaaaaaaaaaaaaaaaaaaaaaaaaaaaaaaaaaaaaaaaaaaaaaaaaaaaaaaaaaaaaaaaaaaaaaaaaaaaaaaaaaaaaaaaaaaaaaaaaaaaaaaaaaaaaaaaaaaaaaaaaaaaaaaaaaaaaaaaaaaaaaaaaaaaaaaaaaaaaaaaaaaaaaaaaaaaaaaaaaaaaaaaaaaaaaaaaaaaaaaaaaaaaaaaaaaaaaaaaaaaaaaaaaaaaaaaaaaaaaaaaaaaaaaaaaaaaaaaaaaaaaaaaaaaaaaaaaaaaaaaaaaaaaaaaaaaaaaaaaaaaaaaaaaaaaaaaaaaaaaaaaaaaaaaaaaaaaaaaaaaaaaaaaaaaaaaaaaaaaaaaaaaaaaaaaaaaaaaaaaaaaaaaaaaaaaaaaaaaaaaaaaaaaaaaaaaaaaaaaaaaaaaaaaaaaaaaaaaaaaaaaaaaaaaaaaaaaaaaaaaaaaaaaaaaaaaaaaaaaaaaaaaaaaaaaaaaaaaaaaaaaaaaaaaaaaaaaaaaaaaaaaaaaaaaaaaaaaaaaaaaaaaaaaaaaaaaaaaaaaaaaaaaaaaaaaaaaaaaaaaaaaaaaaaaaaaaaaaaaaaaaaaaaaaaaaaaaaaaaaaaaaaaaaaaaaaaaaaaaaaaaaaaaaaaaaaaaaaaaaaaaaaaaaaaaaaaaaaaaaaaaaaaaaaaaaaaaaaaaaaaaaaaaaaaaaaaaaaaaaaaaaaaaaaaaaaaaaaaaaaaaaaaaaaaaaaaaaaaaaaaaaaaaaaaaaaaaaaaaaaaaaaaaaaaaaaaaaaaaaaaaaaaaaaaaaaaaaaaaaaaaaaaaaaaaaaaaaaaaaaaaaaaaaaaaaaaaaaaaaaaaaaaaaaaaaaaaaaaaaaaaaaaaaaaaaaaaaaaaaaaaaaaaaaaaaaaaaaaaaaaaaaaaaaaaaaaaaaaaaaaaaaaaaaaaaaaaaaaaaaaaaaaaaaaaaaaaaaaaaaaaaaaaaaaaaaaaaaaaaaaaaaaaaaaaaaaaaaaaaaaaaaaaaaaaaaaaaaaaaaaaaaaaaaaaaaaaaaaaaaaaaaaaaaaaaaaaaaaaaaaaaaaaaaaaaaaaaaaaaaaaaaaaaaaaaaaaaaaaaaaaaaaaaaaaaaaaaaaaaaaaaaaaaaaaaaaaaaaaaaaaaaaaaaaaaaaaaaaaaaaaaaaaaaaaaaaaaaaaaaaaaaaaaaaaaaaaaaaaaaaaaaaaaaaaaaaaaaaaaaaaaaaaaaaaaaaaaaaaaaaaaaaaaaaaaaaaaaaaaaaaaaaaaaaaaaaaaaaaaaaaaaaaaaaaaaaaaaaaaaaaaaaaaaaaaaaaaaaaaaaaaaaaaaaaaaaaaaaaaaaaaaaaaaaaaaaaaaaaaaaaaaaaaaaaaaaaaaaaaaaaaaaaaaaaaaaaaaaaaaaaaaaaaaaaaaaaaaaaaaaaaaaaaaaaaaaaaaaaaaaaaaaaaaaaaaaaaaaaaaaaaaaaaaaaaaaaaaaaaaaaaaaaaaaaaaaaaaaaaaaaaaaaaaaaaaaaaaaaaaaaaaaaaaaaaaaaaaaaaaaaaaaaaaaaaaaaaaaaaaaaaaaaaaaaaaaaaaaaaaaaaaaaaaaaaaaaaaaaaaaaaaaaaaaaaaaaaaaaaaaaaaaaaaaaaaaaaaaaaaaaaaaaaaaaaaaaaaaaaaaaaaaaaaaaaaaaaaaaaaaaaaaaaaaaaaaaaaaaaaaaaaaaaaaaaaaaaaaaaaaaaaaaaaaaaaaaaaaaaaaaaaaaaaaaaaaaaaaaaaaaaaaaaaaaaaaaaaaaaaaaaaaaaaaaaaaaaaaaaaaaaaaaaaaaaaaaaaaaaaaaaaaaaaaaaaaaaaaaaaaaaaaaaaaaaaaaaaaaaaaaaaaaaaaaaaaaaaaaaaaaaaaaaaaaaaaaaaaaaaaaaaaaaaaaaaaaaaaaaaaaaaaaaaaaaaaaaaaaaaaaaaaaaaaaaaaaaaaaaaaaaaaaaaaaaaaaaaaaaaaaaaaaaaaaaaaaaaaaaaaaaaaaaaaaaaaaaaaaaaaaaaaaaaaaaaaaaaaaaaaaaaaaaaaaaaaaaaaaaaaaaaaaaaaaaaaaaaaaaaaaaaaaaaaaaaaaaaaaaaaaaaaaaaaaaaaaaaaaaaaaaaaaaaaaaaaaaaaaaaaaaaaaaaaaaaaaaaaaaaaaaaaaaaaaaaaaaaaaaaaaaaaaaaaaaaaaaaaaaaaaaaaaaaaaaaaaaaaaaaaaaaaaaaaaaaaaaaaaaaaaaaaaaaaaaaaaaaaaaaaaaaaaaaaaaaaaaaaaaaaaaaaaaaaaaaaaaaaaaaaaaaaaaaaaaaaaaaaaaaaaaaaaaaaaaaaaaaaaaaaaaaaaaaaaaaaaaaaaaaaaaaaaaaaaaaaaaaaaaaaaaaaaaaaaaaaaaaaaaaaaaaaaaaaaaaaaaaaaaaaaaaaaaaaaaaaaaaaaaaaaaaaaaaaaaaaaaaaaaaaaaaaaaaaaaaaaaaaaaaaaaaaaaaaaaaaaaaaaaaaaaaaaaaaaaaaaaaaaaaaaaaaaaaaaaaaaaaaaaaaaaaaaaaaaaaaaaaaaaaaaaaaaaaaaaaaaaaaaaaaaaaaaaaaaaaaaaaaaaaaaaaaaaaaaaaaaaaaaaaaaaaaaaaaaaaaaaaaaaaaaaaaaaaaaaaaaaaaaaaaaaaaaaaaaaaaaaaaaaaaaaaaaaaaaaaaaaaaaaaaaaaaaaaaaaaaaaaaaaaaaaaaaaaaaaaaaaaaaaaaaaaaaaaaaaaaaaaaaaaaaaaaaaaaaaaaaaaaaaaaaaaaaaaaaaaaaaaaaaaaaaaaaaaaaaaaaaaaaaaaaaaaaaaaaaaaaaaaaaaaaaaaaaaaaaaaaaaaaaaaaaaaaaaaaaaaaaaaaaaaaaaaaaaaaaaaaaaaaaaaaaaaaaaaaaaaaaaaaaaaaaaaaaaaaaaaaaaaaaaaaaaaaaaaaaaaaaaaaaaaaaaaaaaaaaaaaaaaaaaaaaaaaaaaaaaaaaaaaaaaaaaaaaaaaaaaaaaaaaaaaaaaaaaaaaaaaaaaaaaaaaaaaaaaaaaaaaaaaaaaaaaaaaaaaaaaaaaaaaaaaaaaaaaaaaaaaaaaaaaaaaaaaaaaaaaaaaaaaaaaaaaaaaaaaaaaaaaaaaaaaaaaaaaaaaaaaaaaaaaaaaaaaaaaaaaaaaaaaaaaaaaaaaaaaaaaaaaaaaaaaaaaaaaaaaaaaaaaaaaaaaaaaaaaaaaaaaaaaaaaaaaaaaaaaaaaaaaaaaaaaaaaaaaaaaaaaaaaaaaaaaaaaaaaaaaaaaaaaaaaaaaaaaaaaaaaaaaaaaaaaaaaaaaaaaaaaaaaaaaaaaaaaaaaaaaaaaaaaaaaaaaaaaaaaaaaaaaaaaaaaaaaaaaaaaaaaaaaaaaaaaaaaaaaaaaaaaaaaaaaaaaaaaaaaaaaaaaaaaaaaaaaaaaaaaaaaaaaaaaaaaaaaaaaaaaaaaaaaaaaaaaaaaaaaaaaaaaaaaaaaaaaaaaaaaaaaaaaaaaaaaaaaaaaaaaaaaaaaaaaaaaaaaaaaaaaaaaaaaaaaaaaaaaaaaaaaaaaaaaaaaaaaaaaaaaaaaaaaaaaaaaaaaaaaaaaaaaaaaaaaaaaaaaaaaaaaaaaaaaaaaaaaaaaaaaaaaaaaaaaaaaaaaaaaaaaaaaaaaaaaaaaaaaaaaaaaaaaaaaaaaaaaaaaaaaaaaaaaaaaaaaaaaaaaaaaaaaaaaaaaaaaaaaaaaaaaaaaaaaaaaaaaaaaaaaaaaaaaaaaaaaaaaaaaaaaaaaaaaaaaaaaaaaaaaaaaaaaaaaaaaaaaaaaaaaaaaaaaaaaaaaaaaaaaaaaaaaaaaaaaaaaaaaaaaaaaaaaaaaaaaaaaaaaaaaaaaaaaaaaaaaaaaaaaaaaaaaaaaaaaaaaaaaaaaaaaaaaaaaaaaaaaaaaaaaaaaaaaaaaaaaaaaaaaaaaaaaaaaaaaaaaaaaaaaaaaaaaaaaaaaaaaaaaaaaaaaaaaaaaaaaaaaaaaaaaaaaaaaaaaaaaaaaaaaaaaaaaaaaaaaaaaaaaaaaaaaaaaaaaaaaaaaaaaaaaaaaaaaaaaaaaaaaaaaaaaaaaaaaaaaaaaaaaaaaaaaaaaaaaaaaaaaaaaaaaaaaaaaaaaaaaaaaaaaaaaaaaaaaaaaaaaaaaaaaaaaaaaaaaaaaaaaaaaaaaaaaaaaaaaaaaaaaaaaaaaaaaaaaaaaaaaaaaaaaaaaaaaaaaaaaaaaaaaaaaaaaaaaaaaaaaaaaaaaaaaaaaaaaaaaaaaaaaaaaaaaaaaaaaaaaaaaaaaaaaaaaaaaaaaaaaaaaaaaaaaaaaaaaaaaaaaaaaaaaaaaaaaaaaaaaaaaaaaaaaaaaaaaaaaaaaaaaaaaaaaaaaaaaaaaaaaaaaaaaaaaaaaaaaaaaaaaaaaaaaaaaaaaaaaaaaaaaaaaaaaaaaaaaaaaaaaaaaaaaaaaaaaaaaaaaaaaaaaaaaaaaaaaaaaaaaaaaaaaaaaaaaaaaaaaaaaaaaaaaaaaaaaaaaaaaaaaaaaaaaaaaaaaaaaaaaaaaaaaaaaaaaaaaaaaaaaaaaaaaaaaaaaaaaaaaaaaaaaaaaaaaaaaaaaaaaaaaaaaaaaaaaaaaaaaaaaaaaaaaaaaaaaaaaaaaaaaaaaaaaaaaaaaaaaaaaaaaaaaaaaaaaaaaaaaaaaaaaaaaaaaaaaaaaaaaaaaaaaaaaaaaaaaaaaaaaaaaaaaaaaaaaaaaaaaaaaaaaaaaaaaaaaaaaaaaaaaaaaaaaaaaaaaaaaaaaaaaaaaaaaaaaaaaaaaaaaaaaaaaaaaaaaaaaaaaaaaaaaaaaaaaaaaaaaaaaaaaaaaaaaaaaaaaaaaaaaaaaaaaaaaaaaaaaaaaaaaaaaaaaaaaaaaaaaaaaaaaaaaaaaaaaaaaaaaaaaaaaaaaaaaaaaaaaaaaaaaaaaaaaaaaaaaaaaaaaaaaaaaaaaaaaaaaaaaaaaaaaaaaaaaaaaaaaaaaaaaaaaaaaaaaaaaaaaaaaaaaaaaaaaaaaaaaaaaaaaaaaaaaaaaaaaaaaaaaaaaaaaaaaaaaaaaaaaaaaaaaaaaaaaaaaaaaaaaaaaaaaaaaaaaaaaaaaaaaaaaaaaaaaaaaaaaaaaaaaaaaaaaaaaaaaaaaaaaaaaaaaaaaaaaaaaaaaaaaaaaaaaaaaaaaaaaaaaaaaaaaaaaaaaaaaaaaaaaaaaaaaaaaaaaaaaaaaaaaaaaaaaaaaaaaaaaaaaaaaaaaaaaaaaaaaaaaaaaaaaaaaaaaaaaaaaaaaaaaaaaaaaaaaaaaaaaaaaaaaaaaaaaaaaaaaaaaaaaaaaaaaaaaaaaaaaaaaaaaaaaaaaaaaaaaaaaaaaaaaaaaaaaaaaaaaaaaaaaaaaaaaaaaaaaaaaaaaaaaaaaaaaaaaaaaaaaaaaaaaaaaaaaaaaaaaaaaaaaaaaaaaaaaaaaaaaaaaaaaaaaaaaaaaaaaaaaaaaaaaaaaaaaaaaaaaaaaaaaaaaaaaaaaaaaaaaaaaaaaaaaaaaaaaaaaaaaaaaaaaaaaaaaaaaaaaaaaaaaaaaaaaaaaaaaaaaaaaaaaaaaaaaaaaaaaaaaaaaaaaaaaaaaaaaaaaaaaaaaaaaaaaaaaaaaaaaaaaaaaaaaaaaaaaaaaaaaaaaaaaaaaaaaaaaaaaaaaaaaaaaaaaaaaaaaaaaaaaaaaaaaaaaaaaaaaaaaaaaaaaaaaaaaaaaaaaaaaaaaaaaaaaaaaaaaaaaaaaaaaaaaaaaaaaaaaaaaaaaaaaaaaaaaaaaaaaaaaaaaaaaaaaaaaaaaaaaaaaaaaaaaaaaaaaaaaaaaaaaaaaaaaaaaaaaaaaaaaaaaaaaaaaaaaaaaaaaaaaaaaaaaaaaaaaaaaaaaaaaaaaaaaaaaaaaaaaaaaaaaaaaaaaaaaaaaaaaaaaaaaaaaaaaaaaaaaaaaaaaaaaaaaaaaaaaaaaaaaaaaaaaaaaaaaaaaaaaaaaaaaaaaaaaaaaaaaaaaaaaaaaaaaaaaaaaaaaaaaaaaaaaaaaaaaaaaaaaaaaaaaaaaaaaaaaaaaaaaaaaaaaaaaaaaaaaaaaaaaaaaaaaaaaaaaaaaaaaaaaaaaaaaaaaaaaaaaaaaaaaaaaaaaaaaaaaaaaaaaaaaaaaaaaaaaaaaaaaaaaaaaaaaaaaaaaaaaaaaaaaaaaaaaaaaaaaaaaaaaaaaaaaaaaaaaaaaaaaaaaaaaaaaaaaaaaaaaaaaaaaaaaaaaaaaaaaaaaaaaaaaaaaaaaaaaaaaaaaaaaaaaaaaaaaaaaaaaaaaaaaaaaaaaaaaaaaaaaaaaaaaaaaaaaaaaaaaaaaaaaaaaaaaaaaaaaaaaaaaaaaaaaaaaaaaaaaaaaaaaaaaaaaaaaaaaaaaaaaaaaaaaaaaaaaaaaaaaaaaaaaaaaaaaaaaaaaaaaaaaaaaaaaaaaaaaaaaaaaaaaaaaaaaaaaaaaaaaaaaaaaaaaaaaaaaaaaaaaaaaaaaaaaaaaaaaaaaaaaaaaaaaaaaaaaaaaaaaaaaaaaaaaaaaaaaaaaaaaaaaaaaaaaaaaaaaaaaaaaaaaaaaaaaaaaaaaaaaaaaaaaaaaaaaaaaaaaaaaaaaaaaaaaaaaaaaaaaaaaaaaaaaaaaaaaaaaaaaaaaaaaaaaaaaaaaaaaaaaaaaaaaaaaaaaaaaaaaaaaaaaaaaaaaaaaaaaaaaaaaaaaaaaaaaaaaaaaaaaaaaaaaaaaaaaaaaaaaaaaaaaaaaaaaaaaaaaaaaaaaaaaaaaaaaaaaaaaaaaaaaaaaaaaaaaaaaaaaaaaaaaaaaaaaaaaaaaaaaaaaaaaaaaaaaaaaaaaaaaaaaaaaaaaaaaaaaaaaaaaaaaaaaaaaaaaaaaaaaaaaaaaaaaaaaaaaaaaaaaaaaaaaaaaaaaaaaaaaaaaaaaaaaaaaaaaaaaaaaaaaaaaaaaaaaaaaaaaaaaaaaaaaaaaaaaaaaaaaaaaaaaaaaaaaaaaaaaaaaaaaaaaaaaaaaaaaaaaaaaaaaaaaaaaaaaaaaaaaaaaaaaaaaaaaaaaaaaaaaaaaaaaaaaaaaaaaaaaaaaaaaaaaaaaaaaaaaaaaaaaaaaaaaaaaaaaaaaaaaaaaaaaaaaaaaaaaaaaaaaaaaaaaaaaaaaaaaaaaaaaaaaaaaaaaaaaaaaaaaaaaaaaaaaaaaaaaaaaaaaaaaaaaaaaaaaaaaaaaaaaaaaaaaaaaaaaaaaaaaaaaaaaaaaaaaaaaaaaaaaaaaaaaaaaaaaaaaaaaaaaaaaaaaaaaaaaaaaaaaaaaaaaaaaaaaaaaaaaaaaaaaaaaaaaaaaaaaaaaaaaaaaaaaaaaaaaaaaaaaaaaaaaaaaaaaaaaaaaaaaaaaaaaaaaaaaaaaaaaaaaaaaaaaaaaaaaaaaaaaaaaaaaaaaaaaaaaaaaaaaaaaaaaaaaaaaaaaaaaaaaaaaaaaaaaaaaaaaaaaaaaaaaaaaaaaaaaaaaaaaaaaaaaaaaaaaaaaaaaaaaaaaaaaaaaaaaaaaaaaaaaaaaaaaaaaaaaaaaaaaaaaaaaaaaaaaaaaaaaaaaaaaaaaaaaaaaaaaaaaaaaaaaaaaaaaaaaaaaaaaaaaaaaaaaaaaaaaaaaaaaaaaaaaaaaaaaaaaaaaaaaaaaaaaaaaaaaaaaaaaaaaaaaaaaaaaaaaaaaaaaaaaaaaaaaaaaaaaaaaaaaaaaaaaaaaaaaaaaaaaaaaaaaaaaaaaaaaaaaaaaaaaaaaaaaaaaaaaaaaaaaaaaaaaaaaaaaaaaaaaaaaaaaaaaaaaaaaaaaaaaaaaaaaaaaaaaaaaaaaaaaaaaaaaaaaaaaaaaaaaaaaaaaaaaaaaaaaaaaaaaaaaaaaaaaaaaaaaaaaaaaaaaaaaaaaaaaaaaaaaaaaaaaaaaaaaaaaaaaaaaaaaaaaaaaaaaaaaaaaaaaaaaaaaaaaaaaaaaaaaaaaaaaaaaaaaaaaaaaaaaaaaaaaaaaaaaaaaaaaaaaaaaaaaaaaaaaaaaaaaaaaaaaaaaaaaaaaaaaaaaaaaaaaaaaaaaaaaaaaaaaaaaaaaaaaaaaaaaaaaaaaaaaaaaaaaaaaaaaaaaaaaaaaaaaaaaaaaaaaaaaaaaaaaaaaaaaaaaaaaaaaaaaaaaaaaaaaaaaaaaaaaaaaaaaaaaaaaaaaaaaaaaaaaaaaaaaaaaaaaaaaaaaaaaaaaaaaaaaaaaaaaaaaaaaaaaaaaaaaaaaaaaaaaaaaaaaaaaaaaaaaaaaaaaaaaaaaaaaaaaaaaaaaaaaaaaaaaaaaaaaaaaaaaaaaaaaaaaaaaaaaaaaaaaaaaaaaaaaaaaaaaaaaaaaaaaaaaaaaaaaaaaaaaaaaaaaaaaaaaaaaaaaaaaaaaaaaaaaaaaaaaaaaaaaaaaaaaaaaaaaaaaaaaaaaaaaaaaaaaaaaaaaaaaaaaaaaaaaaaaaaaaaaaaaaaaaaaaaaaaaaaaaaaaaaaaaaaaaaaaaaaaaaaaaaaaaaaaaaaaaaaaaaaaaaaaaaaaaaaaaaaaaaaaaaaaaaaaaaaaaaaaaaaaaaaaaaaaaaaaaaaaaaaaaaaaaaaaaaaaaaaaaaaaaaaaaaaaaaaaaaaaaaaaaaaaaaaaaaaaaaaaaaaaaaaaaaaaaaaaaaaaaaaaaaaaaaaaaaaaaaaaaaaaaaaaaaaaaaaaaaaaaaaaaaaaaaaaaaaaaaaaaaaaaaaaaaaaaaaaaaaaaaaaaaaaaaaaaaaaaaaaaaaaaaaaaaaaaaaaaaaaaaaaaaaaaaaaaaaaaaaaaaaaaaaaaaaaaaaaaaaaaaaaaaaaaaaaaaaaaaaaaaaaaaaaaaaaaaaaaaaaaaaaaaaaaaaaaaaaaaaaaaaaaaaaaaaaaaaaaaaaaaaaaaaaaaaaaaaaaaaaaaaaaaaaaaaaaaaaaaaaaaaaaaaaaaaaaaaaaaaaaaaaaaaaaaaaaaaaaaaaaaaaaaaaaaaaaaaaaaaaaaaaaaaaaaaaaaaaaaaaaaaaaaaaaaaaaaaaaaaaaaaaaaaaaaaaaaaaaaaaaaaaaaaaaaaaaaaaaaaaaaaaaaaaaaaaaaaaaaaaaaaaaaaaaaaaaaaaaaaaaaaaaaaaaaaaaaaaaaaaaaaaaaaaaaaaaaaaaaaaaaaaaaaaaaaaaaaaaaaaaaaaaaaaaaaaaaaaaaaaaaaaaaaaaaaaaaaaaaaaaaaaaaaaaaaaaaaaaaaaaaaaaaaaaaaaaaaaaaaaaaaaaaaaaaaaaaaaaaaaaaaaaaaaaaaaaaaaaaaaaaaaaaaaaaaaaaaaaaaaaaaaaaaaaaaaaaaaaaaaaaaaaaaaaaaaaaaaaaaaaaaaaaaaaaaaaaaaaaaaaaaaaaaaaaaaaaaaaaaaaaaaaaaaaaaaaaaaaaaaaaaaaaaaaaaaaaaaaaaaaaaaaaaaaaaaaaaaaaaaaaaaaaaaaaaaaaaaaaaaaaaaaaaaaaaaaaaaaaaaaaaaaaaaaaaaaaaaaaaaaaaaaaaaaaaaaaaaaaaaaaaaaaaaaaaaaaaaaaaaaaaaaaaaaaaaaaaaaaaaaaaaaaaaaaaaaaaaaaaaaaaaaaaaaaaaaaaaaaaaaaaaaaaaaaaaaaaaaaaaaaaaaaaaaaaaaaaaaaaaaaaaaaaaaaaaaaaaaaaaaaaaaaaaaaaaaaaaaaaaaaaaaaaaaaaaaaaaaaaaaaaaaaaaaaaaaaaaaaaaaaaaaaaaaaaaaaaaaaaaaaaaaaaaaaaaaaaaaaaaaaaaaaaaaaaaaaaaaaaaaaaaaaaaaaaaaaaaaaaaaaaaaaaaaaaaaaaaaaaaaaaaaaaaaaaaaaaaaaaaaaaaaaaaaaaaaaaaaaaaaaaaaaaaaaaaaaaaaaaaaaaaaaaaaaaaaaaaaaaaaaaaaaaaaaaaaaaaaaaaaaaaaaaaaaaaaaaaaaaaaaaaaaaaaaaaaaaaaaaaaaaaaaaaaaaaaaaaaaaaaaaaaaaaaaaaaaaaaaaaaaaaaaaaaaaaaaaaaaaaaaaaaaaaaaaaaaaaaaaaaaaaaaaaaaaaaaaaaaaaaaaaaaaaaaaaaaaaaaaaaaaaaaaaaaaaaaaaaaaaaaaaaaaaaaaaaaaaaaaaaaaaaaaaaaaaaaaaaaaaaaaaaaaaaaaaaaaaaaaaaaaaaaaaaaaaaaaaaaaaaaaaaaaaaaaaaaaaaaaaaaaaaaaaaaaaaaaaaaaaaaaaaaaaaaaaaaaaaaaaaaaaaaaaaaaaaaaaaaaaaaaaaaaaaaaaaaaaaaaaaaaaaaaaaaaaaaaaaaaaaaaaaaaaaaaaaaaaaaaaaaaaaaaaaaaaaaaaaaaaaaaaaaaaaaaaaaaaaaaaaaaaaaaaaaaaaaaaaaaaaaaaaaaaaaaaaaaaaaaaaaaaaaaaaaaaaaaaaaaaaaaaaaaaaaaaaaaaaaaaaaaaaaaaaaaaaaaaaaaaaaaaaaaaaaaaaaaaaaaaaaaaaaaaaaaaaaaaaaaaaaaaaaaaaaaaaaaaaaaaaaaaaaaaaaaaaaaaaaaaaaaaaaaaaaaaaaaaaaaaaaaaaaaaaaaaaaaaaaaaaaaaaaaaaaaaaaaaaaaaaaaaaaaaaaaaaaaaaaaaaaaaaaaaaaaaaaaaaaaaaaaaaaaaaaaaaaaaaaaaaaaaaaaaaaaaaaaaaaaaaaaaaaaaaaaaaaaaaaaaaaaaaaaaaaaaaaaaaaaaaaaaaaaaaaaaaaaaaaaaaaaaaaaaaaaaaaaaaaaaaaaaaaaaaaaaaaaaaaaaaaaaaaaaaaaaaaaaaaaaaaaaaaaaaaaaaaaaaaaaaaaaaaaaaaaaaaaaaaaaaaaaaaaaaaaaaaaaaaaaaaaaaaaaaaaaaaaaaaaaaaaaaaaaaaaaaaaaaaaaaaaaaaaaaaaaaaaaaaaaaaaaaaaaaaaaaaaaaaaaaaaaaaaaaaaaaaaaaaaaaaaaaaaaaaaaaaaaaaaaaaaaaaaaaaaaaaaaaaaaaaaaaaaaaaaaaaaaaaaaaaaaaaaaaaaaaaaaaaaaaaaaaaaaaaaaaaaaaaaaaaaaaaaaaaaaaaaaaaaaaaaaaaaaaaaaaaaaaaaaaaaaaaaaaaaaaaaaaaaaaaaaaaaaaaaaaaaaaaaaaaaaaaaaaaaaaaaaaaaaaaaaaaaaaaaaaaaaaaaaaaaaaaaaaaaaaaaaaaaaaaaaaaaaaaaaaaaaaaaaaaaaaaaaaaaaaaaaaaaaaaaaaaaaaaaaaaaaaaaaaaaaaaaaaaaaaaaaaaaaaaaaaaaaaaaaaaaaaaaaaaaaaaaaaaaaaaaaaaaaaaaaaaaaaaaaaaaaaaaaaaaaaaaaaaaaaaaaaaaaaaaaaaaaaaaaaaaaaaaaaaaaaaaaaaaaaaaaaaaaaaaaaaaaaaaaaaaaaaaaaaaaaaaaaaaaaaaaaaaaaaaaaaaaaaaaaaaaaaaaaaaaaaaaaaaaaaaaaaaaaaaaaaaaaaaaaaaaaaaaaaaaaaaaaaaaaaaaaaaaaaaaaaaaaaaaaaaaaaaaaaaaaaaaaaaaaaaaaaaaaaaaaaaaaaaaaaaaaaaaaaaaaaaaaaaaaaaaaaaaaaaaaaaaaaaaaaaaaaaaaaaaaaaaaaaaaaaaaaaaaaaaaaaaaaaaaaaaaaaaaaaaaaaaaaaaaaaaaaaaaaaaaaaaaaaaaaaaaaaaaaaaaaaaaaaaaaaaaaaaaaaaaaaaaaaaaaaaaaaaaaaaaaaaaaaaaaaaaaaaaaaaaaaaaaaaaaaaaaaaaaaaaaaaaaaaaaaaaaaaaaaaaaaaaaaaaaaaaaaaaaaaaaaaaaaaaaaaaaaaaaaaaaaaaaaaaaaaaaaaaaaaaaaaaaaaaaaaaaaaaaaaaaaaaaaaaaaaaaaaaaaaaaaaaaaaaaaaaaaaaaaaaaaaaaaaaaaaaaaaaaaaaaaaaaaaaaaaaaaaaaaaaaaaaaaaaaaaaaaaaaaaaaaaaaaaaaaaaaaaaaaaaaaaaaaaaaaaaaaaaaaaaaaaaaaaaaaaaaaaaaaaaaaaaaaaaaaaaaaaaaaaaaaaaaaaaaaaaaaaaaaaaaaaaaaaaaaaaaaaaaaaaaaaaaaaaaaaaaaaaaaaaaaaaaaaaaaaaaaaaaaaaaaaaaaaaaaaaaaaaaaaaaaaaaaaaaaaaaaaaaaaaaaaaaaaaaaaaaaaaaaaaaaaaaaaaaaaaaaaaaaaaaaaaaaaaaaaaaaaaaaaaaaaaaaaaaaaaaaaaaaaaaaaaaaaaaaaaaaaaaaaaaaaaaaaaaaaaaaaaaaaaaaaaaaaaaaaaaaaaaaaaaaaaaaaaaaaaaaaaaaaaaaaaaaaaaaaaaaaaaaaaaaaaaaaaaaaaaaaaaaaaaaaaaaaaaaaaaaaaaaaaaaaaaaaaaaaaaaaaaaaaaaaaaaaaaaaaaaaaaaaaaaaaaaaaaaaaaaaaaaaaaaaaaaaaaaaaaaaaaaaaaaaaaaaaaaaaaaaaaaaaaaaaaaaaaaaaaaaaaaaaaaaaaaaaaaaaaaaaaaaaaaaaaaaaaaaaaaaaaaaaaaaaaaaaaaaaaaaaaaaaaaaaaaaaaaaaaaaaaaaaaaaaaaaaaaaaaaaaaaaaaaaaaaaaaaaaaaaaaaaaaaaaaaaaaaaaaaaaaaaaaaaaaaaaaaaaaaaaaaaaaaaaaaaaaaaaaaaaaaaaaaaaaaaaaaaaaaaaaaaaaaaaaaaaaaaaaaaaaaaaaaaaaaaaaaaaaaaaaaaaaaaaaaaaaaaaaaaaaaaaaaaaaaaaaaaaaaaaaaaaaaaaaaaaaaaaaaaaaaaaaaaaaaaaaaaaaaaaaaaaaaaaaaaaaaaaaaaaaaaaaaaaaaaaaaaaaaaaaaaaaaaaaaaaaaaaaaaaaaaaaaaaaaaaaaaaaaaaaaaaaaaaaaaaaaaaaaaaaaaaaaaaaaaaaaaaaaaaaaaaaaaaaaaaaaaaaaaaaaaaaaaaaaaaaaaaaaaaaaaaaaaaaaaaaaaaaaaaaaaaaaaaaaaaaaaaaaaaaaaaaaaaaaaaaaaaaaaaaaaaaaaaaaaaaaaaaaaaaaaaaaaaaaaaaaaaaaaaaaaaaaaaaaaaaaaaaaaaaaaaaaaaaaaaaaaaaaaaaaaaaaaaaaaaaaaaaaaaaaaaaaaaaaaaaaaaaaaaaaaaaaaaaaaaaaaaaaaaaaaaaaaaaaaaaaaaaaaaaaaaaaaaaaaaaaaaaaaaaaaaaaaaaaaaaaaaaaaaaaaaaaaaaaaaaaaaaaaaaaaaaaaaaaaaaaaaaaaaaaaaaaaaaaaaaaaaaaaaaaaaaaaaaaaaaaaaaaaaaaaaaaaaaaaaaaaaaaaaaaaaaaaaaaaaaaaaaaaaaaaaaaaaaaaaaaaaaaaaaaaaaaaaaaaaaaaaaaaaaaaaaaaaaaaaaaaaaaaaaaaaaaaaaaaaaaaaaaaaaaaaaaaaaaaaaaaaaaaaaaaaaaaaaaaaaaaaaaaaaaaaaaaaaaaaaaaaaaaaaaaaaaaaaaaaaaaaaaaaaaaaaaaaaaaaaaaaaaaaaaaaaaaaaaaaaaaaaaaaaaaaaaaaaaaaaaaaaaaaaaaaaaaaaaaaaaaaaaaaaaaaaaaaaaaaaaaaaaaaaaaaaaaaaaaaaaaaaaaaaaaaaaaaaaaaaaaaaaaaaaaaaaaaaaaaaaaaaaaaaaaaaaaaaaaaaaaaaaaaaaaaaaaaaaaaaaaaaaaaaaaaaaaaaaaaaaaaaaaaaaaaaaaaaaaaaaaaaaaaaaaaaaaaaaaaaaaaaaaaaaaaaaaaaaaaaaaaaaaaaaaaaaaaaaaaaaaaaaaaaaaaaaaaaaaaaaaaaaaaaaaaaaaaaaaaaaaaaaaaaaaaaaaaaaaaaaaaaaaaaaaaaaaaaaaaaaaaaaaaaaaaaaaaaaaaaaaaaaaaaaaaaaaaaaaaaaaaaaaaaaaaaaaaaaaaaaaaaaaaaaaaaaaaaaaaaaaaaaaaaaaaaaaaaaaaaaaaaaaaaaaaaaaaaaaaaaaaaaaaaaaaaaaaaaaaaaaaaaaaaaaaaaaaaaaaaaaaaaaaaaaaaaaaaaaaaaaaaaaaaaaaaaaaaaaaaaaaaaaaaaaaaaaaaaaaaaaaaaaaaaaaaaaaaaaaaaaaaaaaaaaaaaaaaaaaaaaaaaaaaaaaaaaaaaaaaaaaaaaaaaaaaaaaaaaaaaaaaaaaaaaaaaaaaaaaaaaaaaaaaaaaaaaaaaaaaaaaaaaaaaaaaaaaaaaaaaaaaaaaaaaaaaaaaaaaaaaaaaaaaaaaaaaaaaaaaaaaaaaaaaaaaaaaaaaaaaaaaaaaaaaaaaaaaaaaaaaaaaaaaaaaaaaaaaaaaaaaaaaaaaaaaaaaaaaaaaaaaaaaaaaaaaaaaaaaaaaaaaaaaaaaaaaaaaaaaaaaaaaaaaaaaaaaaaaaaaaaaaaaaaaaaaaaaaaaaaaaaaaaaaaaaaaaaaaaaaaaaaaaaaaaaaaaaaaaaaaaaaaaaaaaaaaaaaaaaaaaaaaaaaaaaaaaaaaaaaaaaaaaaaaaaaaaaaaaaaaaaaaaaaaaaaaaaaaaaaaaaaaaaaaaaaaaaaaaaaaaaaaaaaaaaaaaaaaaaaaaaaaaaaaaaaaaaaaaaaaaaaaaaaaaaaaaaaaaaaaaaaaaaaaaaaaaaaaaaaaaaaaaaaaaaaaaaaaaaaaaaaaaaaaaaaaaaaaaaaaaaaaaaaaaaaaaaaaaaaaaaaaaaaaaaaaaaaaaaaaaaaaaaaaaaaaaaaaaaaaaaaaaaaaaaaaaaaaaaaaaaaaaaaaaaaaaaaaaaaaaaaaaaaaaaaaaaaaaaaaaaaaaaaaaaaaaaaaaaaaaaaaaaaaaaaaaaaaaaaaaaaaaaaaaaaaaaaaaaaaaaaaaaaaaaaaaaaaaaaaaaaaaaaaaaaaaaaaaaaaaaaaaaaaaaaaaaaaaaaaaaaaaaaaaaaaaaaaaaaaaaaaaaaaaaaaaaaaaaaaaaaaaaaaaaaaaaaaaaaaaaaaaaaaaaaaaaaaaaaaaaaaaaaaaaaaaaaaaaaaaaaaaaaaaaaaaaaaaaaaaaaaaaaaaaaaaaaaaaaaaaaaaaaaaaaaaaaaaaaaaaaaaaaaaaaaaaaaaaaaaaaaaaaaaaaaaaaaaaaaaaaaaaaaaaaaaaaaaaaaaaaaaaaaaaaaaaaaaaaaaaaaaaaaaaaaaaaaaaaaaaaaaaaaaaaaaaaaaaaaaaaaaaaaaaaaaaaaaaaaaaaaaaaaaaaaaaaaaaaaaaaaaaaaaaaaaaaaaaaaaaaaaaaaaaaaaaaaaaaaaaaaaaaaaaaaaaaaaaaaaaaaaaaaaaaaaaaaaaaaaaaaaaaaaaaaaaaaaaaaaaaaaaaaaaaaaaaaaaaaaaaaaaaaaaaaaaaaaaaaaaaaaaaaaaaaaaaaaaaaaaaaaaaaaaaaaaaaaaaaaaaaaaaaaaaaaaaaaaaaaaaaaaaaaaaaaaaaaaaaaaaaaaaaaaaaaaaaaaaaaaaaaaaaaaaaaaaaaaaaaaaaaaaaaaaaaaaaaaaaaaaaaaaaaaaaaaaaaaaaaaaaaaaaaaaaaaaaaaaaaaaaaaaaaaaaaaaaaaaaaaaaaaaaaaaaaaaaaaaaaaaaaaaaaaaaaaaaaaaaaaaaaaaaaaaaaaaaaaaaaaaaaaaaaaaaaaaaaaaaaaaaaaaaaaaaaaaaaaaaaaaaaaaaaaaaaaaaaaaaaaaaaaaaaaaaaaaaaaaaaaaaaaaaaaaaaaaaaaaaaaaaaaaaaaaaaaaaaaaaaaaaaaaaaaaaaaaaaaaaaaaaaaaaaaaaaaaaaaaaaaaaaaaaaaaaaaaaaaaaaaaaaaaaaaaaaaaaaaaaaaaaaaaaaaaaaaaaaaaaaaaaaaaaaaaaaaaaaaaaaaaaaaaaaaaaaaaaaaaaaaaaaaaaaaaaaaaaaaaaaaaaaaaaaaaaaaaaaaaaaaaaaaaaaaaaaaaaaaaaaaaaaaaaaaaaaaaaaaaaaaaaaaaaaaaaaaaaaaaaaaaaaaaaaaaaaaaaaaaaaaaaaaaaaaaaaaaaaaaaaaaaaaaaaaaaaaaaaaaaaaaaaaaaaaaaaaaaaaaaaaaaaaaaaaaaaaaaaaaaaaaaaaaaaaaaaaaaaaaaaaaaaaaaaaaaaaaaaaaaaaaaaaaaaaaaaaaaaaaaaaaaaaaaaaaaaaaaaaaaaaaaaaaaaaaaaaaaaaaaaaaaaaaaaaaaaaaaaaaaaaaaaaaaaaaaaaaaaaaaaaaaaaaaaaaaaaaaaaaaaaaaaaaaaaaaaaaaaaaaaaaaaaaaaaaaaaaaaaaaaaaaaaaaaaaaaaaaaaaaaaaaaaaaaaaaaaaaaaaaaaaaaaaaaaaaaaaaaaaaaaaaaaaaaaaaaaaaaaaaaaaaaaaaaaaaaaaaaaaaaaaaaaaaaaaaaaaaaaaaaaaaaaaaaaaaaaaaaaaaaaaaaaaaaaaaaaaaaaaaaaaaaaaaaaaaaaaaaaaaaaaaaaaaaaaaaaaaaaaaaaaaaaaaaaaaaaaaaaaaaaaaaaaaaaaaaaaaaaaaaaaaaaaaaaaaaaaaaaaaaaaaaaaaaaaaaaaaaaaaaaaaaaaaaaaaaaaaaaaaaaaaaaaaaaaaaaaaaaaaaaaaaaaaaaaaaaaaaaaaaaaaaaaaaaaaaaaaaaaaaaaaaaaaaaaaaaaaaaaaaaaaaaaaaaaaaaaaaaaaaaaaaaaaaaaaaaaaaaaaaaaaaaaaaaaaaaaaaaaaaaaaaaaaaaaaaaaaaaaaaaaaaaaaaaaaaaaaaaaaaaaaaaaaaaaaaaaaaaaaaaaaaaaaaaaaaaaaaaaaaaaaaaaaaaaaaaaaaaaaaaaaaaaaaaaaaaaaaaaaaaaaaaaaaaaaaaaaaaaaaaaaaaaaaaaaaaaaaaaaaaaaaaaaaaaaaaaaaaaaaaaaaaaaaaaaaaaaaaaaaaaaaaaaaaaaaaaaaaaaaaaaaaaaaaaaaaaaaaaaaaaaaaaaaaaaaaaaaaaaaaaaaaaaaaaaaaaaaaaaaaaaaaaaaaaaaaaaaaaaaaaaaaaaaaaaaaaaaaaaaaaaaaaaaaaaaaaaaaaaaaaaaaaaaaaaaaaaaaaaaaaaaaaaaaaaaaaaaaaaaaaaaaaaaaaaaaaaaaaaaaaaaaaaaaaaaaaaaaaaaaaaaaaaaaaaaaaaaaaaaaaaaaaaaaaaaaaaaaaaaaaaaaaaaaaaaaaaaaaaaaaaaaaaaaaaaaaaaaaaaaaaaaaaaaaaaaaaaaaaaaaaaaaaaaaaaaaaaaaaaaaaaaaaaaaaaaaaaaaaaaaaaaaaaaaaaaaaaaaaaaaaaaaaaaaaaaaaaaaaaaaaaaaaaaaaaaaaaaaaaaaaaaaaaaaaaaaaaaaaaaaaaaaaaaaaaaaaaaaaaaaaaaaaaaaaaaaaaaaaaaaaaaaaaaaaaaaaaaaaaaaaaaaaaaaaaaaaaaaaaaaaaaaaaaaaaaaaaaaaaaaaaaaaaaaaaaaaaaaaaaaaaaaaaaaaaaaaaaaaaaaaaaaaaaaaaaaaaaaaaaaaaaaaaaaaaaaaaaaaaaaaaaaaaaaaaaaaaaaaaaaaaaaaaaaaaaaaaaaaaaaaaaaaaaaaaaaaaaaaaaaaaaaaaaaaaaaaaaaaaaaaaaaaaaaaaaaaaaaaaaaaaaaaaaaaaaaaaaaaaaaaaaaaaaaaaaaaaaaaaaaaaaaaaaaaaaaaaaaaaaaaaaaaaaaaaaaaaaaaaaaaaaaaaaaaaaaaaaaaaaaaaaaaaaaaaaaaaaaaaaaaaaaaaaaaaaaaaaaaaaaaaaaaaaaaaaaaaaaaaaaaaaaaaaaaaaaaaaaaaaaaaaaaaaaaaaaaaaaaaaaaaaaaaaaaaaaaaaaaaaaaaaaaaaaaaaaaaaaaaaaaaaaaaaaaaaaaaaaaaaaaaaaaaaaaaaaaaaaaaaaaaaaaaaaaaaaaaaaaaaaaaaaaaaaaaaaaaaaaaaaaaaaaaaaaaaaaaaaaaaaaaaaaaaaaaaaaaaaaaaaaaaaaaaaaaaaaaaaaaaaaaaaaaaaaaaaaaaaaaaaaaaaaaaaaaaaaaaaaaaaaaaaaaaaaaaaaaaaaaaaaaaaaaaaaaaaaaaaaaaaaaaaaaaaaaaaaaaaaaaaaaaaaaaaaaaaaaaaaaaaaaaaaaaaaaaaaaaaaaaaaaaaaaaaaaaaaaaaaaaaaaaaaaaaaaaaaaaaaaaaaaaaaaaaaaaaaaaaaaaaaaaaaaaaaaaaaaaaaaaaaaaaaaaaaaaaaaaaaaaaaaaaaaaaaaaaaaaaaaaaaaaaaaaaaaaaaaaaaaaaaaaaaaaaaaaaaaaaaaaaaaaaaaaaaaaaaaaaaaaaaaaaaaaaaaaaaaaaaaaaaaaaaaaaaaaaaaaaaaaaaaaaaaaaaaaaaaaaaaaaaaaaaaaaaaaaaaaaaaaaaaaaaaaaaaaaaaaaaaaaaaaaaaaaaaaaaaaaaaaaaaaaaaaaaaaaaaaaaaaaaaaaaaaaaaaaaaaaaaaaaaaaaaaaaaaaaaaaaaaaaaaaaaaaaaaaaaaaaaaaaaaaaaaaaaaaaaaaaaaaaaaaaaaaaaaaaaaaaaaaaaaaaaaaaaaaaaaaaaaaaaaaaaaaaaaaaaaaaaaaaaaaaaaaaaaaaaaaaaaaaaaaaaaaaaaaaaaaaaaaaaaaaaaaaaaaaaaaaaaaaaaaaaaaaaaaaaaaaaaaaaaaaaaaaaaaaaaaaaaaaaaaaaaaaaaaaaaaaaaaaaaaaaaaaaaaaaaaaaaaaaaaaaaaaaaaaaaaaaaaaaaaaaaaaaaaaaaaaaaaaaaaaaaaaaaaaaaaaaaaaaaaaaaaaaaaaaaaaaaaaaaaaaaaaaaaaaaaaaaaaaaaaaaaaaaaaaaaaaaaaaaaaaaaaaaaaaaaaaaaaaaaaaaaaaaaaaaaaaaaaaaaaaaaaaaaaaaaaaaaaaaaaaaaaaaaaaaaaaaaaaaaaaaaaaaaaaaaaaaaaaaaaaaaaaaaaaaaaaaaaaaaaaaaaaaaaaaaaaaaaaaaaaaaaaaaaaaaaaaaaaaaaaaaaaaaaaaaaaaaaaaaaaaaaaaaaaaaaaaaaaaaaaaaaaaaaaaaaaaaaaaaaaaaaaaaaaaaaaaaaaaaaaaaaaaaaaaaaaaaaaaaaaaaaaaaaaaaaaaaaaaaaaaaaaaaaaaaaaaaaaaaaaaaaaaaaaaaaaaaaaaaaaaaaaaaaaaaaaaaaaaaaaaaaaaaaaaaaaaaaaaaaaaaaaaaaaaaaaaaaaaaaaaaaaaaaaaaaaaaaaaaaaaaaaaaaaaaaaaaaaaaaaaaaaaaaaaaaaaaaaaaaaaaaaaaaaaaaaaaaaaaaaaaaaaaaaaaaaaaaaaaaaaaaaaaaaaaaaaaaaaaaaaaaaaaaaaaaaaaaaaaaaaaaaaaaaaaaaaaaaaaaaaaaaaaaaaaaaaaaaaaaaaaaaaaaaaaaaaaaaaaaaaaaaaaaaaaaaaaaaaaaaaaaaaaaaaaaaaaaaaaaaaaaaaaaaaaaaaaaaaaaaaaaaaaaaaaaaaaaaaaaaaaaaaaaaaaaaaaaaaaaaaaaaaaaaaaaaaaaaaaaaaaaaaaaaaaaaaaaaaaaaaaaaaaaaaaaaaaaaaaaaaaaaaaaaaaaaaaaaaaaaaaaaaaaaaaaaaaaaaaaaaaaaaaaaaaaaaaaaaaaaaaaaaaaaaaaaaaaaaaaaaaaaaaaaaaaaaaaaaaaaaaaaaaaaaaaaaaaaaaaaaaaaaaaaaaaaaaaaaaaaaaaaaaaaaaaaaaaaaaaaaaaaaaaaaaaaaaaaaaaaaaaaaaaaaaaaaaaaaaaaaaaaaaaaaaaaaaaaaaaaaaaaaaaaaaaaaaaaaaaaaaaaaaaaaaaaaaaaaaaaaaaaaaaaaaaaaaaaaaaaaaaaaaaaaaaaaaaaaaaaaaaaaaaaaaaaaaaaaaaaaaaaaaaaaaaaaaaaaaaaaaaaaaaaaaaaaaaaaaaaaaaaaaaaaaaaaaaaaaaaaaaaaaaaaaaaaaaaaaaaaaaaaaaaaaaaaaaaaaaaaaaaaaaaaaaaaaaaaaaaaaaaaaaaaaaaaaaaaaaaaaaaaaaaaaaaaaaaaaaaaaaaaaaaaaaaaaaaaaaaaaaaaaaaaaaaaaaaaaaaaaaaaaaaaaaaaaaaaaaaaaaaaaaaaaaaaaaaaaaaaaaaaaaaaaaaaaaaaaaaaaaaaaaaaaaaaaaaaaaaaaaaaaaaaaaaaaaaaaaaaaaaaaaaaaaaaaaaaaaaaaaaaaaaaaaaaaaaaaaaaaaaaaaaaaaaaaaaaaaaaaaaaaaaaaaaaaaaaaaaaaaaaaaaaaaaaaaaaaaaaaaaaaaaaaaaaaaaaaaaaaaaaaaaaaaaaaaaaaaaaaaaaaaaaaaaaaaaaaaaaaaaaaaaaaaaaaaaaaaaaaaaaaaaaaaaaaaaaaaaaaaaaaaaaaaaaaaaaaaaaaaaaaaaaaaaaaaaaaaaaaaaaaaaaaaaaaaaaaaaaaaaaaaaaaaaaaaaaaaaaaaaaaaaaaaaaaaaaaaaaaaaaaaaaaaaaaaaaaaaaaaaaaaaaaaaaaaaaaaaaaaaaaaaaaaaaaaaaaaaaaaaaaaaaaaaaaaaaaaaaaaaaaaaaaaaaaaaaaaaaaaaaaaaaaaaaaaaaaaaaaaaaaaaaaaaaaaaaaaaaaaaaaaaaaaaaaaaaaaaaaaaaaaaaaaaaaaaaaaaaaaaaaaaaaaaaaaaaaaaaaaaaaaaaaaaaaaaaaaaaaaaaaaaaaaaaaaaaaaaaaaaaaaaaaaaaaaaaaaaaaaaaaaaaaaaaaaaaaaaaaaaaaaaaaaaaaaaaaaaaaaaaaaaaaaaaaaaaaaaaaaaaaaaaaaaaaaaaaaaaaaaaaaaaaaaaaaaaaaaaaaaaaaaaaaaaaaaaaaaaaaaaaaaaaaaaaaaaaaaaaaaaaaaaaaaaaaaaaaaaaaaaaaaaaaaaaaaaaaaaaaaaaaaaaaaaaaaaaaaaaaaaaaaaaaaaaaaaaaaaaaaaaaaaaaaaaaaaaaaaaaaaaaaaaaaaaaaaaaaaaaaaaaaaaaaaaaaaaaaaaaaaaaaaaaaaaaaaaaaaaaaaaaaaaaaaaaaaaaaaaaaaaaaaaaaaaaaaaaaaaaaaaaaaaaaaaaaaaaaaaaaaaaaaaaaaaaaaaaaaaaaaaaaaaaaaaaaaaaaaaaaaaaaaaaaaaaaaaaaaaaaaaaaaaaaaaaaaaaaaaaaaaaaaaaaaaaaaaaaaaaaaaaaaaaaaaaaaaaaaaaaaaaaaaaaaaaaaaaaaaaaaaaaaaaaaaaaaaaaaaaaaaaaaaaaaaaaaaaaaaaaaaaaaaaaaaaaaaaaaaaaaaaaaaaaaaaaaaaaaaaaaaaaaaaaaaaaaaaaaaaaaaaaaaaaaaaaaaaaaaaaaaaaaaaaaaaaaaaaaaaaaaaaaaaaaaaaaaaaaaaaaaaaaaaaaaaaaaaaaaaaaaaaaaaaaaaaaaaaaaaaaaaaaaaaaaaaaaaaaaaaaaaaaaaaaaaaaaaaaaaaaaaaaaaaaaaaaaaaaaaaaaaaaaaaaaaaaaaaaaaaaaaaaaaaaaaaaaaaaaaaaaaaaaaaaaaaaaaaaaaaaaaaaaaaaaaaaaaaaaaaaaaaaaaaaaaaaaaaaaaaaaaaaaaaaaaaaaaaaaaaaaaaaaaaaaaaaaaaaaaaaaaaaaaaaaaaaaaaaaaaaaaaaaaaaaaaaaaaaaaaaaaaaaaaaaaaaaaaaaaaaaaaaaaaaaaaaaaaaaaaaaaaaaaaaaaaaaaaaaaaaaaaaaaaaaaaaaaaaaaaaaaaaaaaaaaaaaaaaaaaaaaaaaaaaaaaaaaaaaaaaaaaaaaaaaaaaaaaaaaaaaaaaaaaaaaaaaaaaaaaaaaaaaaaaaaaaaaaaaaaaaaaaaaaaaaaaaaaaaaaaaaaaaaaaaaaaaaaaaaaaaaaaaaaaaaaaaaaaaaaaaaaaaaaaaaaaaaaaaaaaaaaaaaaaaaaaaaaaaaaaaaaaaaaaaaaaaaaaaaaaaaaaaaaaaaaaaaaaaaaaaaaaaaaaaaaaaaaaaaaaaaaaaaaaaaaaaaaaaaaaaaaaaaaaaaaaaaaaaaaaaaaaaaaaaaaaaaaaaaaaaaaaaaaaaaaaaaaaaaaaaaaaaaaaaaaaaaaaaaaaaaaaaaaaaaaaaaaaaaaaaaaaaaaaaaaaaaaaaaaaaaaaaaaaaaaaaaaaaaaaaaaaaaaaaaaaaaaaaaaaaaaaaaaaaaaaaaaaaaaaaaaaaaaaaaaaaaaaaaaaaaaaaaaaaaaaaaaaaaaaaaaaaaaaaaaaaaaaaaaaaaaaaaaaaaaaaaaaaaaaaaaaaaaaaaaaaaaaaaaaaaaaaaaaaaaaaaaaaaaaaaaaaaaaaaaaaaaaaaaaaaaaaaaaaaaaaaaaaaaaaaaaaaaaaaaaaaaaaaaaaaaaaaaaaaaaaaaaaaaaaaaaaaaaaaaaaaaaaaaaaaaaaaaaaaaaaaaaaaaaaaaaaaaaaaaaaaaaaaaaaaaaaaaaaaaaaaaaaaaaaaaaaaaaaaaaaaaaaaaaaaaaaaaaaaaaaaaaaaaaaaaaaaaaaaaaaaaaaaaaaaaaaaaaaaaaaaaaaaaaaaaaaaaaaaaaaaaaaaaaaaaaaaaaaaaaaaaaaaaaaaaaaaaaaaaaaaaaaaaaaaaaaaaaaaaaaaaaaaaaaaaaaaaaaaaaaaaaaaaaaaaaaaaaaaaaaaaaaaaaaaaaaaaaaaaaaaaaaaaaaaaaaaaaaaaaaaaaaaaaaaaaaaaaaaaaaaaaaaaaaaaaaaaaaaaaaaaaaaaaaaaaaaaaaaaaaaaaaaaaaaaaaaaaaaaaaaaaaaaaaaaaaaaaaaaaaaaaaaaaaaaaaaaaaaaaaaaaaaaaaaaaaaaaaaaaaaaaaaaaaaaaaaaaaaaaaaaaaaaaaaaaaaaaaaaaaaaaaaaaaaaaaaaaaaaaaaaaaaaaaaaaaaaaaaaaaaaaaaaaaaaaaaaaaaaaaaaaaaaaaaaaaaaaaaaaaaaaaaaaaaaaaaaaaaaaaaaaaaaaaaaaaaaaaaaaaaaaaaaaaaaaaaaaaaaaaaaaaaaaaaaaaaaaaaaaaaaaaaaaaaaaaaaaaaaaaaaaaaaaaaaaaaaaaaaaaaaaaaaaaaaaaaaaaaaaaaaaaaaaaaaaaaaaaaaaaaaaaaaaaaaaaaaaaaaaaaaaaaaaaaaaaaaaaaaaaaaaaaaaaaaaaaaaaaaaaaaaaaaaaaaaaaaaaaaaaaaaaaaaaaaaaaaaaaaaaaaaaaaaaaaaaaaaaaaaaaaaaaaaaaaaaaaaaaaaaaaaaaaaaaaaaaaaaaaaaaaaaaaaaaaaaaaaaaaaaaaaaaaaaaaaaaaaaaaaaaaaaaaaaaaaaaaaaaaaaaaaaaaaaaaaaaaaaaaaaaaaaaaaaaaaaaaaaaaaaaaaaaaaaaaaaaaaaaaaaaaaaaaaaaaaaaaaaaaaaaaaaaaaaaaaaaaaaaaaaaaaaaaaaaaaaaaaaaaaaaaaaaaaaaaaaaaaaaaaaaaaaaaaaaaaaaaaaaaaaaaaaaaaaaaaaaaaaaaaaaaaaaaaaaaaaaaaaaaaaaaaaaaaaaaaaaaaaaaaaaaaaaaaaaaaaaaaaaaaaaaaaaaaaaaaaaaaaaaaaaaaaaaaaaaaaaaaaaaaaaaaaaaaaaaaaaaaaaaaaaaaaaaaaaaaaaaaaaaaaaaaaaaaaaaaaaaaaaaaaaaaaaaaaaaaaaaaaaaaaaaaaaaaaaaaaaaaaaaaaaaaaaaaaaaaaaaaaaaaaaaaaaaaaaaaaaaaaaaaaaaaaaaaaaaaaaaaaaaaaaaaaaaaaaaaaaaaaaaaaaaaaaaaaaaaaaaaaaaaaaaaaaaaaaaaaaaaaaaaaaaaaaaaaaaaaaaaaaaaaaaaaaaaaaaaaaaaaaaaaaaaaaaaaaaaaaaaaaaaaaaaaaaaaaaaaaaaaaaaaaaaaaaaaaaaaaaaaaaaaaaaaaaaaaaaaaaaaaaaaaaaaaaaaaaaaaaaaaaaaaaaaaaaaaaaaaaaaaaaaaaaaaaaaaaaaaaaaaaaaaaaaaaaaaaaaaaaaaaaaaaaaaaaaaaaaaaaaaaaaaaaaaaaaaaaaaaaaaaaaaaaaaaaaaaaaaaaaaaaaaaaaaaaaaaaaaaaaaaaaaaaaaaaaaaaaaaaaaaaaaaaaaaaaaaaaaaaaaaaaaaaaaaaaaaaaaaaaaaaaaaaaaaaaaaaaaaaaaaaaaaaaaaaaaaaaaaaaaaaaaaaaaaaaaaaaaaaaaaaaaaaaaaaaaaaaaaaaaaaaaaaaaaaaaaaaaaaaaaaaaaaaaaaaaaaaaaaaaaaaaaaaaaaaaaaaaaaaaaaaaaaaaaaaaaaaaaaaaaaaaaaaaaaaaaaaaaaaaaaaaaaaaaaaaaaaaaaaaaaaaaaaaaaaaaaaaaaaaaaaaaaaaaaaaaaaaaaaaaaaaaaaaaaaaaaaaaaaaaaaaaaaaaaaaaaaaaaaaaaaaaaaaaaaaaaaaaaaaaaaaaaaaaaaaaaaaaaaaaaaaaaaaaaaaaaaaaaaaaaaaaaaaaaaaaaaaaaaaaaaaaaaaaaaaaaaaaaaaaaaaaaaaaaaaaaaaaaaaaaaaaaaaaaaaaaaaaaaaaaaaaaaaaaaaaaaaaaaaaaaaaaaaaaaaaaaaaaaaaaaaaaaaaaaaaaaaaaaaaaaaaaaaaaaaaaaaaaaaaaaaaaaaaaaaaaaaaaaaaaaaaaaaaaaaaaaaaaaaaaaaaaaaaaaaaaaaaaaaaaaaaaaaaaaaaaaaaaaaaaaaaaaaaaaaaaaaaaaaaaaaaaaaaaaaaaaaaaaaaaaaaaaaaaaaaaaaaaaaaaaaaaaaaaaaaaaaaaaaaaaaaaaaaaaaaaaaaaaaaaaaaaaaaaaaaaaaaaaaaaaaaaaaaaaaaaaaaaaaaaaaaaaaaaaaaaaaaaaaaaaaaaaaaaaaaaaaaaaaaaaaaaaaaaaaaaaaaaaaaaaaaaaaaaaaaaaaaaaaaaaaaaaaaaaaaaaaaaaaaaaaaaaaaaaaaaaaaaaaaaaaaaaaaaaaaaaaaaaaaaaaaaaaaaaaaaaaaaaaaaaaaaaaaaaaaaaaaaaaaaaaaaaaaaaaaaaaaaaaaaaaaaaaaaaaaaaaaaaaaaaaaaaaaaaaaaaaaaaaaaaaaaaaaaaaaaaaaaaaaaaaaaaaaaaaaaaaaaaaaaaaaaaaaaaaaaaaaaaaaaaaaaaaaaaaaaaaaaaaaaaaaaaaaaaaaaaaaaaaaaaaaaaaaaaaaaaaaaaaaaaaaaaaaaaaaaaaaaaaaaaaaaaaaaaaaaaaaaaaaaaaaaaaaaaaaaaaaaaaaaaaaaaaaaaaaaaaaaaaaaaaaaaaaaaaaaaaaaaaaaaaaaaaaaaaaaaaaaaaaaaaaaaaaaaaaaaaaaaaaaaaaaaaaaaaaaaaaaaaaaaaaaaaaaaaaaaaaaaaaaaaaaaaaaaaaaaaaaaaaaaaaaaaaaaaaaaaaaaaaaaaaaaaaaaaaaaaaaaaaaaaaaaaaaaaaaaaaaaaaaaaaaaaaaaaaaaaaaaaaaaaaaaaaaaaaaaaaaaaaaaaaaaaaaaaaaaaaaaaaaaaaaaaaaaaaaaaaaaaaaaaaaaaaaaaaaaaaaaaaaaaaaaaaaaaaaaaaaaaaaaaaaaaaaaaaaaaaaaaaaaaaaaaaaaaaaaaaaaaaaaaaaaaaaaaaaaaaaaaaaaaaaaaaaaaaaaaaaaaaaaaaaaaaaaaaaaaaaaaaaaaaaaaaaaaaaaaaaaaaaaaaaaaaaaaaaaaaaaaaaaaaaaaaaaaaaaaaaaaaaaaaaaaaaaaaaaaaaaaaaaaaaaaaaaaaaaaaaaaaaaaaaaaaaaaaaaaaaaaaaaaaaaaaaaaaaaaaaaaaaaaaaaaaaaaaaaaaaaaaaaaaaaaaaaaaaaaaaaaaaaaaaaaaaaaaaaaaaaaaaaaaaaaaaaaaaaaaaaaaaaaaaaaaaaaaaaaaaaaaaaaaaaaaaaaaaaaaaaaaaaaaaaaaaaaaaaaaaaaaaaaaaaaaaaaaaaaaaaaaaaaaaaaaaaaaaaaaaaaaaaaaaaaaaaaaaaaaaaaaaaaaaaaaaaaaaaaaaaaaaaaaaaaaaaaaaaaaaaaaaaaaaaaaaaaaaaaaaaaaaaaaaaaaaaaaaaaaaaaaaaaaaaaaaaaaaaaaaaaaaaaaaaaaaaaaaaaaaaaaaaaaaaaaaaaaaaaaaaaaaaaaaaaaaaaaaaaaaaaaaaaaaaaaaaaaaaaaaaaaaaaaaaaaaaaaaaaaaaaaaaaaaaaaaaaaaaaaaaaaaaaaaaaaaaaaaaaaaaaaaaaaaaaaaaaaaaaaaaaaaaaaaaaaaaaaaaaaaaaaaaaaaaaaaaaaaaaaaaaaaaaaaaaaaaaaaaaaaaaaaaaaaaaaaaaaaaaaaaaaaaaaaaaaaaaaaaaaaaaaaaaaaaaaaaaaaaaaaaaaaaaaaaaaaaaaaaaaaaaaaaaaaaaaaaaaaaaaaaaaaaaaaaaaaaaaaaaaaaaaaaaaaaaaaaaaaaaaaaaaaaaaaaaaaaaaaaaaaaaaaaaaaaaaaaaaaaaaaaaaaaaaaaaaaaaaaaaaaaaaaaaaaaaaaaaaaaaaaaaaaaaaaaaaaaaaaaaaaaaaaaaaaaaaaaaaaaaaaaaaaaaaaaaaaaaaaaaaaaaaaaaaaaaaaaaaaaaaaaaaaaaaaaaaaaaaaaaaaaaaaaaaaaaaaaaaaaaaaaaaaaaaaaaaaaaaaaaaaaaaaaaaaaaaaaaaaaaaaaaaaaaaaaaaaaaaaaaaaaaaaaaaaaaaaaaaaaaaaaaaaaaaaaaaaaaaaaaaaaaaaaaaaaaaaaaaaaaaaaaaaaaaaaaaaaaaaaaaaaaaaaaaaaaaaaaaaaaaaaaaaaaaaaaaaaaaaaaaaaaaaaaaaaaaaaaaaaaaaaaaaaaaaaaaaaaaaaaaaaaaaaaaaaaaaaaaaaaaaaaaaaaaaaaaaaaaaaaaaaaaaaaaaaaaaaaaaaaaaaaaaaaaaaaaaaaaaaaaaaaaaaaaaaaaaaaaaaaaaaaaaaaaaaaaaaaaaaaaaaaaaaaaaaaaaaaaaaaaaaaaaaaaaaaaaaaaaaaaaaaaaaaaaaaaaaaaaaaaaaaaaaaaaaaaaaaaaaaaaaaaaaaaaaaaaaaaaaaaaaaaaaaaaaaaaaaaaaaaaaaaaaaaaaaaaaaaaaaaaaaaaaaaaaaaaaaaaaaaaaaaaaaaaaaaaaaaaaaaaaaaaaaaaaaaaaaaaaaaaaaaaaaaaaaaaaaaaaaaaaaaaaaaaaaaaaaaaaaaaaaaaaaaaaaaaaaaaaaaaaaaaaaaaaaaaaaaaaaaaaaaaaaaaaaaaaaaaaaaaaaaaaaaaaaaaaaaaaaaaaaaaaaaaaaaaaaaaaaaaaaaaaaaaaaaaaaaaaaaaaaaaaaaaaaaaaaaaaaaaaaaaaaaaaaaaaaaaaaaaaaaaaaaaaaaaaaaaaaaaaaaaaaaaaaaaaaaaaaaaaaaaaaaaaaaaaaaaaaaaaaaaaaaaaaaaaaaaaaaaaaaaaaaaaaaaaaaaaaaaaaaaaaaaaaaaaaaaaaaaaaaaaaaaaaaaaaaaaaaaaaaaaaaaaaaaaaaaaaaaaaaaaaaaaaaaaaaaaaaaaaaaaaaaaaaaaaaaaaaaaaaaaaaaaaaaaaaaaaaaaaaaaaaaaaaaaaaaaaaaaaaaaaaaaaaaaaaaaaaaaaaaaaaaaaaaaaaaaaaaaaaaaaaaaaaaaaaaaaaaaaaaaaaaaaaaaaaaaaaaaaaaaaaaaaaaaaaaaaaaaaaaaaaaaaaaaaaaaaaaaaaaaaaaaaaaaaaaaaaaaaaaaaaaaaaaaaaaaaaaaaaaaaaaaaaaaaaaaaaaaaaaaaaaaaaaaaaaaaaaaaaaaaaaaaaaaaaaaaaaaaaaaaaaaaaaaaaaaaaaaaaaaaaaaaaaaaaaaaaaaaaaaaaaaaaaaaaaaaaaaaaaaaaaaaaaaaaaaaaaaaaaaaaaaaaaaaaaaaaaaaaaaaaaaaaaaaaaaaaaaaaaaaaaaaaaaaaaaaaaaaaaaaaaaaaaaaaaaaaaaaaaaaaaaaaaaaaaaaaaaaaaaaaaaaaaaaaaaaaaaaaaaaaaaaaaaaaaaaaaaaaaaaaaaaaaaaaaaaaaaaaaaaaaaaaaaaaaaaaaaaaaaaaaaaaaaaaaaaaaaaaaaaaaaaaaaaaaaaaaaaaaaaaaaaaaaaaaaaaaaaaaaaaaaaaaaaaaaaaaaaaaaaaaaaaaaaaaaaaaaaaaaaaaaaaaaaaaaaaaaaaaaaaaaaaaaaaaaaaaaaaaaaaaaaaaaaaaaaaaaaaaaaaaaaaaaaaaaaaaaaaaaaaaaaaaaaaaaaaaaaaaaaaaaaaaaaaaaaaaaaaaaaaaaaaaaaaaaaaaaaaaaaaaaaaaaaaaaaaaaaaaaaaaaaaaaaaaaaaaaaaaaaaaaaaaaaaaaaaaaaaaaaaaaaaaaaaaaaaaaaaaaaaaaaaaaaaaaaaaaaaaaaaaaaaaaaaaaaaaaaaaaaaaaaaaaaaaaaaaaaaaaaaaaaaaaaaaaaaaaaaaaaaaaaaaaaaaaaaaaaaaaaaaaaaaaaaaaaaaaaaaaaaaaaaaaaaaaaaaaaaaaaaaaaaaaaaaaaaaaaaaaaaaaaaaaaaaaaaaaaaaaaaaaaaaaaaaaaaaaaaaaaaaaaaaaaaaaaaaaaaaaaaaaaaaaaaaaaaaaaaaaaaaaaaaaaaaaaaaaaaaaaaaaaaaaaaaaaaaaaaaaaaaaaaaaaaaaaaaaaaaaaaaaaaaaaaaaaaaaaaaaaaaaaaaaaaaaaaaaaaaaaaaaaaaaaaaaaaaaaaaaaaaaaaaaaaaaaaaaaaaaaaaaaaaaaaaaaaaaaaaaaaaaaaaaaaaaaaaaaaaaaaaaaaaaaaaaaaaaaaaaaaaaaaaaaaaaaaaaaaaaaaaaaaaaaaaaaaaaaaaaaaaaaaaaaaaaaaaaaaaaaaaaaaaaaaaaaaaaaaaaaaaaaaaaaaaaaaaaaaaaaaaaaaaaaaaaaaaaaaaaaaaaaaaaaaaaaaaaaaaaaaaaaaaaaaaaaaaaaaaaaaaaaaaaaaaaaaaaaaaaaaaaaaaaaaaaaaaaaaaaaaaaaaaaaaaaaaaaaaaaaaaaaaaaaaaaaaaaaaaaaaaaaaaaaaaaaaaaaaaaaaaaaaaaaaaaaaaaaaaaaaaaaaaaaaaaaaaaaaaaaaaaaaaaaaaaaaaaaaaaaaaaaaaaaaaaaaaaaaaaaaaaaaaaaaaaaaaaaaaaaaaaaaaaaaaaaaaaaaaaaaaaaaaaaaaaaaaaaaaaaaaaaaaaaaaaaaaaaaaaaaaaaaaaaaaaaaaaaaaaaaaaaaaaaaaaaaaaaaaaaaaaaaaaaaaaaaaaaaaaaaaaaaaaaaaaaaaaaaaaaaaaaaaaaaaaaaaaaaaaaaaaaaaaaaaaaaaaaaaaaaaaaaaaaaaaaaaaaaaaaaaaaaaaaaaaaaaaaaaaaaaaaaaaaaaaaaaaaaaaaaaaaaaaaaaaaaaaaaaaaaaaaaaaaaaaaaaaaaaaaaaaaaaaaaaaaaaaaaaaaaaaaaaaaaaaaaaaaaaaaaaaaaaaaaaaaaaaaaaaaaaaaaaaaaaaaaaaaaaaaaaaaaaaaaaaaaaaaaaaaaaaaaaaaaaaaaaaaaaaaaaaaaaaaaaaaaaaaaaaaaaaaaaaaaaaaaaaaaaaaaaaaaaaaaaaaaaaaaaaaaaaaaaaaaaaaaaaaaaaaaaaaaaaaaaaaaaaaaaaaaaaaaaaaaaaaaaaaaaaaaaaaaaaaaaaaaaaaaaaaaaaaaaaaaaaaaaaaaaaaaaaaaaaaaaaaaaaaaaaaaaaaaaaaaaaaaaaaaaaaaaaaaaaaaaaaaaaaaaaaaaaaaaaaaaaaaaaaaaaaaaaaaaaaaaaaaaaaaaaaaaaaaaaaaaaaaaaaaaaaaaaaaaaaaaaaaaaaaaaaaaaaaaaaaaaaaaaaaaaaaaaaaaaaaaaaaaaaaaaaaaaaaaaaaaaaaaaaaaaaaaaaaaaaaaaaaaaaaaaaaaaaaaaaaaaaaaaaaaaaaaaaaaaaaaaaaaaaaaaaaaaaaaaaaaaaaaaaaaaaaaaaaaaaaaaaaaaaaaaaaaaaaaaaaaaaaaaaaaaaaaaaaaaaaaaaaaaaaaaaaaaaaaaaaaaaaaaaaaaaaaaaaaaaaaaaaaaaaaaaaaaaaaaaaaaaaaaaaaaaaaaaaaaaaaaaaaaaaaaaaaaaaaaaaaaaaaaaaaaaaaaaaaaaaaaaaaaaaaaaaaaaaaaaaaaaaaaaaaaaaaaaaaaaaaaaaaaaaaaaaaaaaaaaaaaaaaaaaaaaaaaaaaaaaaaaaaaaaaaaaaaaaaaaaaaaaaaaaaaaaaaaaaaaaaaaaaaaaaaaaaaaaaaaaaaaaaaaaaaaaaaaaaaaaaaaaaaaaaaaaaaaaaaaaaaaaaaaaaaaaaaaaaaaaaaaaaaaaaaaaaaaaaaaaaaaaaaaaaaaaaaaaaaaaaaaaaaaaaaaaaaaaaaaaaaaaaaaaaaaaaaaaaaaaaaaaaaaaaaaaaaaaaaaaaaaaaaaaaaaaaaaaaaaaaaaaaaaaaaaaaaaaaaaaaaaaaaaaaaaaaaaaaaaaaaaaaaaaaaaaaaaaaaaaaaaaaaaaaaaaaaaaaaaaaaaaaaaaaaaaaaaaaaaaaaaaaaaaaaaaaaaaaaaaaaaaaaaaaaaaaaaaaaaaaaaaaaaaaaaaaaaaaaaaaaaaaaaaaaaaaaaaaaaaaaaaaaaaaaaaaaaaaaaaaaaaaaaaaaaaaaaaaaaaaaaaaaaaaaaaaaaaaaaaaaaaaaaaaaaaaaaaaaaaaaaaaaaaaaaaaaaaaaaaaaaaaaaaaaaaaaaaaaaaaaaaaaaaaaaaaaaaaaaaaaaaaaaaaaaaaaaaaaaaaaaaaaaaaaaaaaaaaaaaaaaaaaaaaaaaaaaaaaaaaaaaaaaaaaaaaaaaaaaaaaaaaaaaaaaaaaaaaaaaaaaaaaaaaaaaaaaaaaaaaaaaaaaaaaaaaaaaaaaaaaaaaaaaaaaaaaaaaaaaaaaaaaaaaaaaaaaaaaaaaaaaaaaaaaaaaaaaaaaaaaaaaaaaaaaaaaaaaaaaaaaaaaaaaaaaaaaaaaaaaaaaaaaaaaaaaaaaaaaaaaaaaaaaaaaaaaaaaaaaaaaaaaaaaaaaaaaaaaaaaaaaaaaaaaaaaaaaaaaaaaaaaaaaaaaaaaaaaaaaaaaaaaaaaaaaaaaaaaaaaaaaaaaaaaaaaaaaaaaaaaaaaaaaaaaaaaaaaaaaaaaaaaaaaaaaaaaaaaaaaaaaaaaaaaaaaaaaaaaaaaaaaaaaaaaaaaaaaaaaaaaaaaaaaaaaaaaaaaaaaaaaaaaaaaaaaaaaaaaaaaaaaaaaaaaaaaaaaaaaaaaaaaaaaaaaaaaaaaaaaaaaaaaaaaaaaaaaaaaaaaaaaaaaaaaaaaaaaaaaaaaaaaaaaaaaaaaaaaaaaaaaaaaaaaaaaaaaaaaaaaaaaaaaaaaaaaaaaaaaaaaaaaaaaaaaaaaaaaaaaaaaaaaaaaaaaaaaaaaaaaaaaaaaaaaaaaaaaaaaaaaaaaaaaaaaaaaaaaaaaaaaaaaaaaaaaaaaaaaaaaaaaaaaaaaaaaaaaaaaaaaaaaaaaaaaaaaaaaaaaaaaaaaaaaaaaaaaaaaaaaaaaaaaaaaaaaaaaaaaaaaaaaaaaaaaaaaaaaaaaaaaaaaaaaaaaaaaaaaaaaaaaaaaaaaaaaaaaaaaaaaaaaaaaaaaaaaaaaaaaaaaaaaaaaaaaaaaaaaaaaaaaaaaaaaaaaaaaaaaaaaaaaaaaaaaaaaaaaaaaaaaaaaaaaaaaaaaaaaaaaaaaaaaaaaaaaaaaaaaaaaaaaaaaaaaaaaaaaaaaaaaaaaaaaaaaaaaaaaaaaaaaaaaaaaaaaaaaaaaaaaaaaaaaaaaaaaaaaaaaaaaaaaaaaaaaaaaaaaaaaaaaaaaaaaaaaaaaaaaaaaaaaaaaaaaaaaaaaaaaaaaaaaaaaaaaaaaaaaaaaaaaaaaaaaaaaaaaaaaaaaaaaaaaaaaaaaaaaaaaaaaaaaaaaaaaaaaaaaaaaaaaaaaaaaaaaaaaaaaaaaaaaaaaaaaaaaaaaaaaaaaaaaaaaaaaaaaaaaaaaaaaaaaaaaaaaaaaaaaaaaaaaaaaaaaaaaaaaaaaaaaaaaaaaaaaaaaaaaaaaaaaaaaaaaaaaaaaaaaaaaaaaaaaaaaaaaaaaaaaaaaaaaaaaaaaaaaaaaaaaaaaaaaaaaaaaaaaaaaaaaaaaaaaaaaaaaaaaaaaaaaaaaaaaaaaaaaaaaaaaaaaaaaaaaaaaaaaaaaaaaaaaaaaaaaaaaaaaaaaaaaaaaaaaaaaaaaaaaaaaaaaaaaaaaaaaaaaaaaaaaaaaaaaaaaaaaaaaaaaaaaaaaaaaaaaaaaaaaaaaaaaaaaaaaaaaaaaaaaaaaaaaaaaaaaaaaaaaaaaaaaaaaaaaaaaaaaaaaaaaaaaaaaaaaaaaaaaaaaaaaaaaaaaaaaaaaaaaaaaaaaaaaaaaaaaaaaaaaaaaaaaaaaaaaaaaaaaaaaaaaaaaaaaaaaaaaaaaaaaaaaaaaaaaaaaaaaaaaaaaaaaaaaaaaaaaaaaaaaaaaaaaaaaaaaaaaaaaaaaaaaaaaaaaaaaaaaaaaaaaaaaaaaaaaaaaaaaaaaaaaaaaaaaaaaaaaaaaaaaaaaaaaaaaaaaaaaaaaaaaaaaaaaaaaaaaaaaaaaaaaaaaaaaaaaaaaaaaaaaaaaaaaaaaaaaaaaaaaaaaaaaaaaaaaaaaaaaaaaaaaaaaaaaaaaaaaaaaaaaaaaaaaaaaaaaaaaaaaaaaaaaaaaaaaaaaaaaaaaaaaaaaaaaaaaaaaaaaaaaaaaaaaaaaaaaaaaaaaaaaaaaaaaaaaaaaaaaaaaaaaaaaaaaaaaaaaaaaaaaaaaaaaaaaaaaaaaaaaaaaaaaaaaaaaaaaaaaaaaaaaaaaaaaaaaaaaaaaaaaaaaaaaaaaaaaaaaaaaaaaaaaaaaaaaaaaaaaaaaaaaaaaaaaaaaaaaaaaaaaaaaaaaaaaaaaaaaaaaaaaaaaaaaaaaaaaaaaaaaaaaaaaaaaaaaaaaaaaaaaaaaaaaaaaaaaaaaaaaaaaaaaaaaaaaaaaaaaaaaaaaaaaaaaaaaaaaaaaaaaaaaaaaaaaaaaaaaaaaaaaaaaaaaaaaaaaaaaaaaaaaaaaaaaaaaaaaaaaaaaaaaaaaaaaaaaaaaaaaaaaaaaaaaaaaaaaaaaaaaaaaaaaaaaaaaaaaaaaaaaaaaaaaaaaaaaaaaaaaaaaaaaaaaaaaaaaaaaaaaaaaaaaaaaaaaaaaaaaaaaaaaaaaaaaaaaaaaaaaaaaaaaaaaaaaaaaaaaaaaaaaaaaaaaaaaaaaaaaaaaaaaaaaaaaaaaaaaaaaaaaaaaaaaaaaaaaaaaaaaaaaaaaaaaaaaaaaaaaaaaaaaaaaaaaaaaaaaaaaaaaaaaaaaaaaaaaaaaaaaaaaaaaaaaaaaaaaaaaaaaaaaaaaaaaaaaaaaaaaaaaaaaaaaaaaaaaaaaaaaaaaaaaaaaaaaaaaaaaaaaaaaaaaaaaaaaaaaaaaaaaaaaaaaaaaaaaaaaaaaaaaaaaaaaaaaaaaaaaaaaaaaaaaaaaaaaaaaaaaaaaaaaaaaaaaaaaaaaaaaaaaaaaaaaaaaaaaaaaaaaaaaaaaaaaaaaaaaaaaaaaaaaaaaaaaaaaaaaaaaaaaaaaaaaaaaaaaaaaaaaaaaaaaaaaaaaaaaaaaaaaaaaaaaaaaaaaaaaaaaaaaaaaaaaaaaaaaaaaaaaaaaaaaaaaaaaaaaaaaaaaaaaaaaaaaaaaaaaaaaaaaaaaaaaaaaaaaaaaaaaaaaaaaaaaaaaaaaaaaaaaaaaaaaaaaaaaaaaaaaaaaaaaaaaaaaaaaaaaaaaaaaaaaaaaaaaaaaaaaaaaaaaaaaaaaaaaaaaaaaaaaaaaaaaaaaaaaaaaaaaaaaaaaaaaaaaaaaaaaaaaaaaaaaaaaaaaaaaaaaaaaaaaaaaaaaaaaaaaaaaaaaaaaaaaaaaaaaaaaaaaaaaaaaaaaaaaaaaaaaaaaaaaaaaaaaaaaaaaaaaaaaaaaaaaaaaaaaaaaaaaaaaaaaaaaaaaaaaaaaaaaaaaaaaaaaaaaaaaaaaaaaaaaaaaaaaaaaaaaaaaaaaaaaaaaaaaaaaaaaaaaaaaaaaaaaaaaaaaaaaaaaaaaaaaaaaaaaaaaaaaaaaaaaaaaaaaaaaaaaaaaaaaaaaaaaaaaaaaaaaaaaaaaaaaaaaaaaaaaaaaaaaaaaaaaaaaaaaaaaaaaaaaaaaaaaaaaaaaaaaaaaaaaaaaaaaaaaaaaaaaaaaaaaaaaaaaaaaaaaaaaaaaaaaaaaaaaaaaaaaaaaaaaaaaaaaaaaaaaaaaaaaaaaaaaaaaaaaaaaaaaaaaaaaaaaaaaaaaaaaaaaaaaaaaaaaaaaaaaaaaaaaaaaaaaaaaaaaaaaaaaaaaaaaaaaaaaaaaaaaaaaaaaaaaaaaaaaaaaaaaaaaaaaaaaaaaaaaaaaaaaaaaaaaaaaaaaaaaaaaaaaaaaaaaaaaaaaaaaaaaaaaaaaaaaaaaaaaaaaaaaaaaaaaaaaaaaaaaaaaaaaaaaaaaaaaaaaaaaaaaaaaaaaaaaaaaaaaaaaaaaaaaaaaaaaaaaaaaaaaaaaaaaaaaaaaaaaaaaaaaaaaaaaaaaaaaaaaaaaaaaaaaaaaaaaaaaaaaaaaaaaaaaaaaaaaaaaaaaaaaaaaaaaaaaaaaaaaaaaaaaaaaaaaaaaaaaaaaaaaaaaaaaaaaaaaaaaaaaaaaaaaaaaaaaaaaaaaaaaaaaaaaaaaaaaaaaaaaaaaaaaaaaaaaaaaaaaaaaaaaaaaaaaaaaaaaaaaaaaaaaaaaaaaaaaaaaaaaaaaaaaaaaaaaaaaaaaaaaaaaaaaaaaaaaaaaaaaaaaaaaaaaaaaaaaaaaaaaaaaaaaaaaaaaaaaaaaaaaaaaaaaaaaaaaaaaaaaaaaaaaaaaaaaaaaaaaaaaaaaaaaaaaaaaaaaaaaaaaaaaaaaaaaaaaaaaaaaaaaaaaaaaaaaaaaaaaaaaaaaaaaaaaaaaaaaaaaaaaaaaaaaaaaaaaaaaaaaaaaaaaaaaaaaaaaaaaaaaaaaaaaaaaaaaaaaaaaaaaaaaaaaaaaaaaaaaaaaaaaaaaaaaaaaaaaaaaaaaaaaaaaaaaaaaaaaaaaaaaaaaaaaaaaaaaaaaaaaaaaaaaaaaaaaaaaaaaaaaaaaaaaaaaaaaaaaaaaaaaaaaaaaaaaaaaaaaaaaaaaaaaaaaaaaaaaaaaaaaaaaaaaaaaaaaaaaaaaaaaaaaaaaaaaaaaaaaaaaaaaaaaaaaaaaaaaaaaaaaaaaaaaaaaaaaaaaaaaaaaaaaaaaaaaaaaaaaaaaaaaaaaaaaaaaaaaaaaaaaaaaaaaaaaaaaaaaaaaaaaaaaaaaaaaaaaaaaaaaaaaaaaaaaaaaaaaaaaaaaaaaaaaaaaaaaaaaaaaaaaaaaaaaaaaaaaaaaaaaaaaaaaaaaaaaaaaaaaaaaaaaaaaaaaaaaaaaaaaaaaaaaaaaaaaaaaaaaaaaaaaaaaaaaaaaaaaaaaaaaaaaaaaaaaaaaaaaaaaaaaaaaaaaaaaaaaaaaaaaaaaaaaaaaaaaaaaaaaaaaaaaaaaaaaaaaaaaaaaaaaaaaaaaaaaaaaaaaaaaaaaaaaaaaaaaaaaaaaaaaaaaaaaaaaaaaaaaaaaaaaaaaaaaaaaaaaaaaaaaaaaaaaaaaaaaaaaaaaaaaaaaaaaaaaaaaaaaaaaaaaaaaaaaaaaaaaaaaaaaaaaaaaaaaaaaaaaaaaaaaaaaaaaaaaaaaaaaaaaaaaaaaaaaaaaaaaaaaaaaaaaaaaaaaaaaaaaaaaaaaaaaaaaaaaaaaaaaaaaaaaaaaaaaaaaaaaaaaaaaaaaaaaaaaaaaaaaaaaaaaaaaaaaaaaaaaaaaaaaaaaaaaaaaaaaaaaaaaaaaaaaaaaaaaaaaaaaaaaaaaaaaaaaaaaaaaaaaaaaaaaaaaaaaaaaaaaaaaaaaaaaaaaaaaaaaaaaaaaaaaaaaaaaaaaaaaaaaaaaaaaaaaaaaaaaaaaaaaaaaaaaaaaaaaaaaaaaaaaaaaaaaaaaaaaaaaaaaaaaaaaaaaaaaaaaaaaaaaaaaaaaaaaaaaaaaaaaaaaaaaaaaaaaaaaaaaaaaaaaaaaaaaaaaaaaaaaaaaaaaaaaaaaaaaaaaaaaaaaaaaaaaaaaaaaaaaaaaaaaaaaaaaaaaaaaaaaaaaaaaaaaaaaaaaaaaaaaaaaaaaaaaaaaaaaaaaaaaaaaaaaaaaaaaaaaaaaaaaaaaaaaaaaaaaaaaaaaaaaaaaaaaaaaaaaaaaaaaaaaaaaaaaaaaaaaaaaaaaaaaaaaaaaaaaaaaaaaaaaaaaaaaaaaaaaaaaaaaaaaaaaaaaaaaaaaaaaaaaaaaaaaaaaaaaaaaaaaaaaaaaaaaaaaaaaaaaaaaaaaaaaaaaaaaaaaaaaaaaaaaaaaaaaaaaaaaaaaaaaaaaaaaaaaaaaaaaaaaaaaaaaaaaaaaaaaaaaaaaaaaaaaaaaaaaaaaaaaaaaaaaaaaaaaaaaaaaaaaaaaaaaaaaaaaaaaaaaaaaaaaaaaaaaaaaaaaaaaaaaaaaaaaaaaaaaaaaaaaaaaaaaaaaaaaaaaaaaaaaaaaaaaaaaaaaaaaaaaaaaaaaaaaaaaaaaaaaaaaaaaaaaaaaaaaaaaaaaaaaaaaaaaaaaaaaaaaaaaaaaaaaaaaaaaaaaaaaaaaaaaaaaaaaaaaaaaaaaaaaaaaaaaaaaaaaaaaaaaaaaaaaaaaaaaaaaaaaaaaaaaaaaaaaaaaaaaaaaaaaaaaaaaaaaaaaaaaaaaaaaaaaaaaaaaaaaaaaaaaaaaaaaaaaaaaaaaaaaaaaaaaaaaaaaaaaaaaaaaaaaaaaaaaaaaaaaaaaaaaaaaaaaaaaaaaaaaaaaaaaaaaaaaaaaaaaaaaaaaaaaaaaaaaaaaaaaaaaaaaaaaaaaaaaaaaaaaaaaaaaaaaaaaaaaaaaaaaaaaaaaaaaaaaaaaaaaaaaaaaaaaaaaaaaaaaaaaaaaaaaaaaaaaaaaaaaaaaaaaaaaaaaaaaaaaaaaaaaaaaaaaaaaaaaaaaaaaaaaaaaaaaaaaaaaaaaaaaaaaaaaaaaaaaaaaaaaaaaaaaaaaaaaaaaaaaaaaaaaaaaaaaaaaaaaaaaaaaaaaaaaaaaaaaaaaaaaaaaaaaaaaaaaaaaaaaaaaaaaaaaaaaaaaaaaaaaaaaaaaaaaaaaaaaaaaaaaaaaaaaaaaaaaaaaaaaaaaaaaaaaaaaaaaaaaaaaaaaaaaaaaaaaaaaaaaaaaaaaaaaaaaaaaaaaaaaaaaaaaaaaaaaaaaaaaaaaaaaaaaaaaaaaaaaaaaaaaaaaaaaaaaaaaaaaaaaaaaaaaaaaaaaaaaaaaaaaaaaaaaaaaaaaaaaaaaaaaaaaaaaaaaaaaaaaaaaaaaaaaaaaaaaaaaaaaaaaaaaaaaaaaaaaaaaaaaaaaaaaaaaaaaaaaaaaaaaaaaaaaaaaaaaaaaaaaaaaaaaaaaaaaaaaaaaaaaaaaaaaaaaaaaaaaaaaaaaaaaaaaaaaaaaaaaaaaaaaaaaaaaaaaaaaaaaaaaaaaaaaaaaaaaaaaaaaaaaaaaaaaaaaaaaaaaaaaaaaaaaaaaaaaaaaaaaaaaaaaaaaaaaaaaaaaaaaaaaaaaaaaaaaaaaaaaaaaaaaaaaaaaaaaaaaaaaaaaaaaaaaaaaaaaaaaaaaaaaaaaaaaaaaaaaaaaaaaaaaaaaaaaaaaaaaaaaaaaaaaaaaaaaaaaaaaaaaaaaaaaaaaaaaaaaaaaaaaaaaaaaaaaaaaaaaaaaaaaaaaaaaaaaaaaaaaaaaaaaaaaaaaaaaaaaaaaaaaaaaaaaaaaaaaaaaaaaaaaaaaaaaaaaaaaaaaaaaaaaaaaaaaaaaaaaaaaaaaaaaaaaaaaaaaaaaaaaaaaaaaaaaaaaaaaaaaaaaaaaaaaaaaaaaaaaaaaaaaaaaaaaaaaaaaaaaaaaaaaaaaaaaaaaaaaaaaaaaaaaaaaaaaaaaaaaaaaaaaaaaaaaaaaaaaaaaaaaaaaaaaaaaaaaaaaaaaaaaaaaaaaaaaaaaaaaaaaaaaaaaaaaaaaaaaaaaaaaaaaaaaaaaaaaaaaaaaaaaaaaaaaaaaaaaaaaaaaaaaaaaaaaaaaaaaaaaaaaaaaaaaaaaaaaaaaaaaaaaaaaaaaaaaaaaaaaaaaaaaaaaaaaaaaaaaaaaaaaaaaaaaaaaaaaaaaaaaaaaaaaaaaaaaaaaaaaaaaaaaaaaaaaaaaaaaaaaaaaaaaaaaaaaaaaaaaaaaaaaaaaaaaaaaaaaaaaaaaaaaaaaaaaaaaaaaaaaaaaaaaaaaaaaaaaaaaaaaaaaaaaaaaaaaaaaaaaaaaaaaaaaaaaaaaaaaaaaaaaaaaaaaaaaaaaaaaaaaaaaaaaaaaaaaaaaaaaaaaaaaaaaaaaaaaaaaaaaaaaaaaaaaaaaaaaaaaaaaaaaaaaaaaaaaaaaaaaaaaaaaaaaaaaaaaaaaaaaaaaaaaaaaaaaaaaaaaaaaaaaaaaaaaaaaaaaaaaaaaaaaaaaaaaaaaaaaaaaaaaaaaaaaaaaaaaaaaaaaaaaaaaaaaaaaaaaaaaaaaaaaaaaaaaaaaaaaaaaaaaaaaaaaaaaaaaaaaaaaaaaaaaaaaaaaaaaaaaaaaaaaaaaaaaaaaaaaaaaaaaaaaaaaaaaaaaaaaaaaaaaaaaaaaaaaaaaaaaaaaaaaaaaaaaaaaaaaaaaaaaaaaaaaaaaaaaaaaaaaaaaaaaaaaaaaaaaaaaaaaaaaaaaaaaaaaaaaaaaaaaaaaaaaaaaaaaaaaaaaaaaaaaaaaaaaaaaaaaaaaaaaaaaaaaaaaaaaaaaaaaaaaaaaaaaaaaaaaaaaaaaaaaaaaaaaaaaaaaaaaaaaaaaaaaaaaaaaaaaaaaaaaaaaaaaaaaaaaaaaaaaaaaaaaaaaaaaaaaaaaaaaaaaaaaaaaaaaaaaaaaaaaaaaaaaaaaaaaaaaaaaaaaaaaaaaaaaaaaaaaaaaaaaaaaaaaaaaaaaaaaaaaaaaaaaaaaaaaaaaaaaaaaaaaaaaaaaaaaaaaaaaaaaaaaaaaaaaaaaaaaaaaaaaaaaaaaaaaaaaaaaaaaaaaaaaaaaaaaaaaaaaaaaaaaaaaaaaaaaaaaaaaaaaaaaaaaaaaaaaaaaaaaaaaaaaaaaaaaaaaaaaaaaaaaaaaaaaaaaaaaaaaaaaaaaaaaaaaaaaaaaaaaaaaaaaaaaaaaaaaaaaaaaaaaaaaaaaaaaaaaaaaaaaaaaaaaaaaaaaaaaaaaaaaaaaaaaaaaaaaaaaaaaaaaaaaaaaaaaaaaaaaaaaaaaaaaaaaaaaaaaaaaaaaaaaaaaaaaaaaaaaaaaaaaaaaaaaaaaaaaaaaaaaaaaaaaaaaaaaaaaaaaaaaaaaaaaaaaaaaaaaaaaaaaaaaaaaaaaaaaaaaaaaaaaaaaaaaaaaaaaaaaaaaaaaaaaaaaaaaaaaaaaaaaaaaaaaaaaaaaaaaaaaaaaaaaaaaaaaaaaaaaaaaaaaaaaaaaaaaaaaaaaaaaaaaaaaaaaaaaaaaaaaaaaaaaaaaaaaaaaaaaaaaaaaaaaaaaaaaaaaaaaaaaaaaaaaaaaaaaaaaaaaaaaaaaaaaaaaaaaaaaaaaaaaaaaaaaaaaaaaaaaaaaaaaaaaaaaaaaaaaaaaaaaaaaaaaaaaaaaaaaaaaaaaaaaaaaaaaaaaaaaaaaaaaaaaaaaaaaaaaaaaaaaaaaaaaaaaaaaaaaaaaaaaaaaaaaaaaaaaaaaaaaaaaaaaaaaaaaaaaaaaaaaaaaaaaaaaaaaaaaaaaaaaaaaaaaaaaaaaaaaaaaaaaaaaaaaaaaaaaaaaaaaaaaaaaaaaaaaaaaaaaaaaaaaaaaaaaaaaaaaaaaaaaaaaaaaaaaaaaaaaaaaaaaaaaaaaaaaaaaaaaaaaaaaaaaaaaaaaaaaaaaaaaaaaaaaaaaaaaaaaaaaaaaaaaaaaaaaaaaaaaaaaaaaaaaaaaaaaaaaaaaaaaaaaaaaaaaaaaaaaaaaaaaaaaaaaaaaaaaaaaaaaaaaaaaaaaaaaaaaaaaaaaaaaaaaaaaaaaaaaaaaaaaaaaaaaaaaaaaaaaaaaaaaaaaaaaaaaaaaaaaaaaaaaaaaaaaaaaaaaaaaaaaaaaaaaaaaaaaaaaaaaaaaaaaaaaaaaaaaaaaaaaaaaaaaaaaaaaaaaaaaaaaaaaaaaaaaaaaaaaaaaaaaaaaaaaaaaaaaaaaaaaaaaaaaaaaaaaaaaaaaaaaaaaaaaaaaaaaaaaaaaaaaaaaaaaaaaaaaaaaaaaaaaaaaaaaaaaaaaaaaaaaaaaaaaaaaaaaaaaaaaaaaaaaaaaaaaaaaaaaaaaaaaaaaaaaaaaaaaaaaaaaaaaaaaaaaaaaaaaaaaaaaaaaaaaaaaaaaaaaaaaaaaaaaaaaaaaaaaaaaaaaaaaaaaaaaaaaaaaaaaaaaaaaaaaaaaaaaaaaaaaaaaaaaaaaaaaaaaaaaaaaaaaaaaaaaaaaaaaaaaaaaaaaaaaaaaaaaaaaaaaaaaaaaaaaaaaaaaaaaaaaaaaaaaaaaaaaaaaaaaaaaaaaaaaaaaaaaaaaaaaaaaaaaaaaaaaaaaaaaaaaaaaaaaaaaaaaaaaaaaaaaaaaaaaaaaaaaaaaaaaaaaaaaaaaaaaaaaaaaaaaaaaaaaaaaaaaaaaaaaaaaaaaaaaaaaaaaaaaaaaaaaaaaaaaaaaaaaaaaaaaaaaaaaaaaaaaaaaaaaaaaaaaaaaaaaaaaaaaaaaaaaaaaaaaaaaaaaaaaaaaaaaaaaaaaaaaaaaaaaaaaaaaaaaaaaaaaaaaaaaaaaaaaaaaaaaaaaaaaaaaaaaaaaaaaaaaaaaaaaaaaaaaaaaaaaaaaaaaaaaaaaaaaaaaaaaaaaaaaaaaaaaaaaaaaaaaaaaaaaaaaaaaaaaaaaaaaaaaaaaaaaaaaaaaaaaaaaaaaaaaaaaaaaaaaaaaaaaaaaaaaaaaaaaaaaaaaaaaaaaaaaaaaaaaaaaaaaaaaaaaaaaaaaaaaaaaaaaaaaaaaaaaaaaaaaaaaaaaaaaaaaaaaaaaaaaaaaaaaaaaaaaaaaaaaaaaaaaaaaaaaaaaaaaaaaaaaaaaaaaaaaaaaaaaaaaaaaaaaaaaaaaaaaaaaaaaaaaaaaaaaaaaaaaaaaaaaaaaaaaaaaaaaaaaaaaaaaaaaaaaaaaaaaaaaaaaaaaaaaaaaaaaaaaaaaaaaaaaaaaaaaaaaaaaaaaaaaaaaaaaaaaaaaaaaaaaaaaaaaaaaaaaaaaaaaaaaaaaaaaaaaaaaaaaaaaaaaaaaaaaaaaaaaaaaaaaaaaaaaaaaaaaaaaaaaaaaaaaaaaaaaaaaaaaaaaaaaaaaaaaaaaaaaaaaaaaaaaaaaaaaaaaaaaaaaaaaaaaaaaaaaaaaaaaaaaaaaaaaaaaaaaaaaaaaaaaaaaaaaaaaaaaaaaaaaaaaaaaaaaaaaaaaaaaaaaaaaaaaaaaaaaaaaaaaaaaaaaaaaaaaaaaaaaaaaaaaaaaaaaaaaaaaaaaaaaaaaaaaaaaaaaaaaaaaaaaaaaaaaaaaaaaaaaaaaaaaaaaaaaaaaaaaaaaaaaaaaaaaaaaaaaaaaaaaaaaaaaaaaaaaaaaaaaaaaaaaaaaaaaaaaaaaaaaaaaaaaaaaaaaaaaaaaaaaaaaaaaaaaaaaaaaaaaaaaaaaaaaaaaaaaaaaaaaaaaaaaaaaaaaaaaaaaaaaaaaaaaaaaaaaaaaaaaaaaaaaaaaaaaaaaaaaaaaaaaaaaaaaaaaaaaaaaaaaaaaaaaaaaaaaaaaaaaaaaaaaaaaaaaaaaaaaaaaaaaaaaaaaaaaaaaaaaaaaaaaaaaaaaaaaaaaaaaaaaaaaaaaaaaaaaaaaaaaaaaaaaaaaaaaaaaaaaaaaaaaaaaaaaaaaaaaaaaaaaaaaaaaaaaaaaaaaaaaaaaaaaaaaaaaaaaaaaaaaaaaaaaaaaaaaaaaaaaaaaaaaaaaaaaaaaaaaaaaaaaaaaaaaaaaaaaaaaaaaaaaaaaaaaaaaaaaaaaaaaaaaaaaaaaaaaaaaaaaaaaaaaaaaaaaaaaaaaaaaaaaaaaaaaaaaaaaaaaaaaaaaaaaaaaaaaaaaaaaaaaaaaaaaaaaaaaaaaaaaaaaaaaaaaaaaaaaaaaaaaaaaaaaaaaaaaaaaaaaaaaaaaaaaaaaaaaaaaaaaaaaaaaaaaaaaaaaaaaaaaaaaaaaaaaaaaaaaaaaaaaaaaaaaaaaaaaaaaaaaaaaaaaaaaaaaaaaaaaaaaaaaaaaaaaaaaaaaaaaaaaaaaaaaaaaaaaaaaaaaaaaaaaaaaaaaaaaaaaaaaaaaaaaaaaaaaaaaaaaaaaaaaaaaaaaaaaaaaaaaaaaaaaaaaaaaaaaaaaaaaaaaaaaaaaaaaaaaaaaaaaaaaaaaaaaaaaaaaaaaaaaaaaaaaaaaaaaaaaaaaaaaaaaaaaaaaaaaaaaaaaaaaaaaaaaaaaaaaaaaaaaaaaaaaaaaaaaaaaaaaaaaaaaaaaaaaaaaaaaaaaaaaaaaaaaaaaaaaaaaaaaaaaaaaaaaaaaaaaaaaaaaaaaaaaaaaaaaaaaaaaaaaaaaaaaaaaaaaaaaaaaaaaaaaaaaaaaaaaaaaaaaaaaaaaaaaaaaaaaaaaaaaaaaaaaaaaaaaaaaaaaaaaaaaaaaaaaaaaaaaaaaaaaaaaaaaaaaaaaaaaaaaaaaaaaaaaaaaaaaaaaaaaaaaaaaaaaaaaaaaaaaaaaaaaaaaaaaaaaaaaaaaaaaaaaaaaaaaaaaaaaaaaaaaaaaaaaaaaaaaaaaaaaaaaaaaaaaaaaaaaaaaaaaaaaaaaaaaaaaaaaaaaaaaaaaaaaaaaaaaaaaaaaaaaaaaaaaaaaaaaaaaaaaaaaaaaaaaaaaaaaaaaaaaaaaaaaaaaaaaaaaaaaaaaaaaaaaaaaaaaaaaaaaaaaaaaaaaaaaaaaaaaaaaaaaaaaaaaaaaaaaaaaaaaaaaaaaaaaaaaaaaaaaaaaaaaaaaaaaaaaaaaaaaaaaaaaaaaaaaaaaaaaaaaaaaaaaaaaaaaaaaaaaaaaaaaaaaaaaaaaaaaaaaaaaaaaaaaaaaaaaaaaaaaaaaaaaaaaaaaaaaaaaaaaaaaaaaaaaaaaaaaaaaaaaaaaaaaaaaaaaaaaaaaaaaaaaaaaaaaaaaaaaaaaaaaaaaaaaaaaaaaaaaaaaaaaaaaaaaaaaaaaaaaaaaaaaaaaaaaaaaaaaaaaaaaaaaaaaaaaaaaaaaaaaaaaaaaaaaaaaaaaaaaaaaaaaaaaaaaaaaaaaaaaaaaaaaaaaaaaaaaaaaaaaaaaaaaaaaaaaaaaaaaaaaaaaaaaaaaaaaaaaaaaaaaaaaaaaaaaaaaaaaaaaaaaaaaaaaaaaaaaaaaaaaaaaaaaaaaaaaaaaaaaaaaaaaaaaaaaaaaaaaaaaaaaaaaaaaaaaaaaaaaaaaaaaaaaaaaaaaaaaaaaaaaaaaaaaaaaaaaaaaaaaaaaaaaaaaaaaaaaaaaaaaaaaaaaaaaaaaaaaaaaaaaaaaaaaaaaaaaaaaaaaaaaaaaaaaaaaaaaaaaaaaaaaaaaaaaaaaaaaaaaaaaaaaaaaaaaaaaaaaaaaaaaaaaaaaaaaaaaaaaaaaaaaaaaaaaaaaaaaaaaaaaaaaaaaaaaaaaaaaaaaaaaaaaaaaaaaaaaaaaaaaaaaaaaaaaaaaaaaaaaaaaaaaaaaaaaaaaaaaaaaaaaaaaaaaaaaaaaaaaaaaaaaaaaaaaaaaaaaaaaaaaaaaaaaaaaaaaaaaaaaaaaaaaaaaaaaaaaaaaaaaaaaaaaaaaaaaaaaaaaaaaaaaaaaaaaaaaaaaaaaaaaaaaaaaaaaaaaaaaaaaaaaaaaaaaaaaaaaaaaaaaaaaaaaaaaaaaaaaaaaaaaaaaaaaaaaaaaaaaaaaaaaaaaaaaaaaaaaaaaaaaaaaaaaaaaaaaaaaaaaaaaaaaaaaaaaaaaaaaaaaaaaaaaaaaaaaaaaaaaaaaaaaaaaaaaaaaaaaaaaaaaaaaaaaaaaaaaaaaaaaaaaaaaaaaaaaaaaaaaaaaaaaaaaaaaaaaaaaaaaaaaaaaaaaaaaaaaaaaaaaaaaaaaaaaaaaaaaaaaaaaaaaaaaaaaaaaaaaaaaaaaaaaaaaaaaaaaaaaaaaaaaaaaaaaaaaaaaaaaaaaaaaaaaaaaaaaaaaaaaaaaaaaaaaaaaaaaaaaaaaaaaaaaaaaaaaaaaaaaaaaaaaaaaaaaaaaaaaaaaaaaaaaaaaaaaaaaaaaaaaaaaaaaaaaaaaaaaaaaaaaaaaaaaaaaaaaaaaaaaaaaaaaaaaaaaaaaaaaaaaaaaaaaaaaaaaaaaaaaaaaaaaaaaaaaaaaaaaaaaaaaaaaaaaaaaaaaaaaaaaaaaaaaaaaaaaaaaaaaaaaaaaaaaaaaaaaaaaaaaaaaaaaaaaaaaaaaaaaaaaaaaaaaaaaaaaaaaaaaaaaaaaaaaaaaaaaaaaaaaaaaaaaaaaaaaaaaaaaaaaaaaaaaaaaaaaaaaaaaaaaaaaaaaaaaaaaaaaaaaaaaaaaaaaaaaaaaaaaaaaaaaaaaaaaaaaaaaaaaaaaaaaaaaaaaaaaaaaaaaaaaaaaaaaaaaaaaaaaaaaaaaaaaaaaaaaaaaaaaaaaaaaaaaaaaaaaaaaaaaaaaaaaaaaaaaaaaaaaaaaaaaaaaaaaaaaaaaaaaaaaaaaaaaaaaaaaaaaaaaaaaaaaaaaaaaaaaaaaaaaaaaaaaaaaaaaaaaaaaaaaaaaaaaaaaaaaaaaaaaaaaaaaaaaaaaaaaaaaaaaaaaaaaaaaaaaaaaaaaaaaaaaaaaaaaaaaaaaaaaaaaaaaaaaaaaaaaaaaaaaaaaaaaaaaaaaaaaaaaaaaaaaaaaaaaaaaaaaaaaaaaaaaaaaaaaaaaaaaaaaaaaaaaaaaaaaaaaaaaaaaaaaaaaaaaaaaaaaaaaaaaaaaaaaaaaaaaaaaaaaaaaaaaaaaaaaaaaaaaaaaaaaaaaaaaaaaaaaaaaaaaaaaaaaaaaaaaaaaaaaaaaaaaaaaaaaaaaaaaaaaaaaaaaaaaaaaaaaaaaaaaaaaaaaaaaaaaaaaaaaaaaaaaaaaaaaaaaaaaaaaaaaaaaaaaaaaaaaaaaaaaaaaaaaaaaaaaaaaaaaaaaaaaaaaaaaaaaaaaaaaaaaaaaaaaaaaaaaaaaaaaaaaaaaaaaaaaaaaaaaaaaaaaaaaaaaaaaaaaaaaaaaaaaaaaaaaaaaaaaaaaaaaaaaaaaaaaaaaaaaaaaaaaaaaaaaaaaaaaaaaaaaaaaaaaaaaaaaaaaaaaaaaaaaaaaaaaaaaaaaaaaaaaaaaaaaaaaaaaaaaaaaaaaaaaaaaaaaaaaaaaaaaaaaaaaaaaaaaaaaaaaaaaaaaaaaaaaaaaaaaaaaaaaaaaaaaaaaaaaaaaaaaaaaaaaaaaaaaaaaaaaaaaaaaaaaaaaaaaaaaaaaaaaaaaaaaaaaaaaaaaaaaaaaaaaaaaaaaaaaaaaaaaaaaaaaaaaaaaaaaaaaaaaaaaaaaaaaaaaaaaaaaaaaaaaaaaaaaaaaaaaaaaaaaaaaaaaaaaaaaaaaaaaaaaaaaaaaaaaaaaaaaaaaaaaaaaaaaaaaaaaaaaaaaaaaaaaaaaaaaaaaaaaaaaaaaaaaaaaaaaaaaaaaaaaaaaaaaaaaaaaaaaaaaaaaaaaaaaaaaaaaaaaaaaaaaaaaaaaaaaaaaaaaaaaaaaaaaaaaaaaaaaaaaaaaaaaaaaaaaaaaaaaaaaaaaaaaaaaaaaaaaaaaaaaaaaaaaaaaaaaaaaaaaaaaaaaaaaaaaaaaaaaaaaaaaaaaaaaaaaaaaaaaaaaaaaaaaaaaaaaaaaaaaaaaaaaaaaaaaaaaaaaaaaaaaaaaaaaaaaaaaaaaaaaaaaaaaaaaaaaaaaaaaaaaaaaaaaaaaaaaaaaaaaaaaaaaaaaaaaaaaaaaaaaaaaaaaaaaaaaaaaaaaaaaaaaaaaaaaaaaaaaaaaaaaaaaaaaaaaaaaaaaaaaaaaaaaaaaaaaaaaaaaaaaaaaaaaaaaaaaaaaaaaaaaaaaaaaaaaaaaaaaaaaaaaaaaaaaaaaaaaaaaaaaaaaaaaaaaaaaaaaaaaaaaaaaaaaaaaaaaaaaaaaaaaaaaaaaaaaaaaaaaaaaaaaaaaaaaaaaaaaaaaaaaaaaaaaaaaaaaaaaaaaaaaaaaaaaaaaaaaaaaaaaaaaaaaaaaaaaaaaaaaaaaaaaaaaaaaaaaaaaaaaaaaaaaaaaaaaaaaaaaaaaaaaaaaaaaaaaaaaaaaaaaaaaaaaaaaaaaaaaaaaaaaaaaaaaaaaaaaaaaaaaaaaaaaaaaaaaaaaaaaaaaaaaaaaaaaaaaaaaaaaaaaaaaaaaaaaaaaaaaaaaaaaaaaaaaaaaaaaaaaaaaaaaaaaaaaaaaaaaaaaaaaaaaaaaaaaaaaaaaaaaaaaaaaaaaaaaaaaaaaaaaaaaaaaaaaaaaaaaaaaaaaaaaaaaaaaaaaaaaaaaaaaaaaaaaaaaaaaaaaaaaaaaaaaaaaaaaaaaaaaaaaaaaaaaaaaaaaaaaaaaaaaaaaaaaaaaaaaaaaaaaaaaaaaaaaaaaaaaaaaaaaaaaaaaaaaaaaaaaaaaaaaaaaaaaaaaaaaaaaaaaaaaaaaaaaaaaaaaaaaaaaaaaaaaaaaaaaaaaaaaaaaaaaaaaaaaaaaaaaaaaaaaaaaaaaaaaaaaaaaaaaaaaaaaaaaaaaaaaaaaaaaaaaaaaaaaaaaaaaaaaaaaaaaaaaaaaaaaaaaaaaaaaaaaaaaaaaaaaaaaaaaaaaaaaaaaaaaaaaaaaaaaaaaaaaaaaaaaaaaaaaaaaaaaaaaaaaaaaaaaaaaaaaaaaaaaaaaaaaaaaaaaaaaaaaaaaaaaaaaaaaaaaaaaaaaaaaaaaaaaaaaaaaaaaaaaaaaaaaaaaaaaaaaaaaaaaaaaaaaaaaaaaaaaaaaaaaaaaaaaaaaaaaaaaaaaaaaaaaaaaaaaaaaaaaaaaaaaaaaaaaaaaaaaaaaaaaaaaaaaaaaaaaaaaaaaaaaaaaaaaaaaaaaaaaaaaaaaaaaaaaaaaaaaaaaaaaaaaaaaaaaaaaaaaaaaaaaaaaaaaaaaaaaaaaaaaaaaaaaaaaaaaaaaaaaaaaaaaaaaaaaaaaaaaaaaaaaaaaaaaaaaaaaaaaaaaaaaaaaaaaaaaaaaaaaaaaaaaaaaaaaaaaaaaaaaaaaaaaaaaaaaaaaaaaaaaaaaaaaaaaaaaaaaaaaaaaaaaaaaaaaaaaaaaaaaaaaaaaaaaaaaaaaaaaaaaaaaaaaaaaaaaaaaaaaaaaaaaaaaaaaaaaaaaaaaaaaaaaaaaaaaaaaaaaaaaaaaaaaaaaaaaaaaaaaaaaaaaaaaaaaaaaaaaaaaaaaaaaaaaaaaaaaaaaaaaaaaaaaaaaaaaaaaaaaaaaaaaaaaaaaaaaaaaaaaaaaaaaaaaaaaaaaaaaaaaaaaaaaaaaaaaaaaaaaaaaaaaaaaaaaaaaaaaaaaaaaaaaaaaaaaaaaaaaaaaaaaaaaaaaaaaaaaaaaaaaaaaaaaaaaaaaaaaaaaaaaaaaaaaaaaaaaaaaaaaaaaaaaaaaaaaaaaaaaaaaaaaaaaaaaaaaaaaaaaaaaaaaaaaaaaaaaaaaaaaaaaaaaaaaaaaaaaaaaaaaaaaaaaaaaaaaaaaaaaaaaaaaaaaaaaaaaaaaaaaaaaaaaaaaaaaaaaaaaaaaaaaaaaaaaaaaaaaaaaaaaaaaaaaaaaaaaaaaaaaaaaaaaaaaaaaaaaaaaaaaaaaaaaaaaaaaaaaaaaaaaaaaaaaaaaaaaaaaaaaaaaaaaaaaaaaaaaaaaaaaaaaaaaaaaaaaaaaaaaaaaaaaaaaaaaaaaaaaaaaaaaaaaaaaaaaaaaaaaaaaaaaaaaaaaaaaaaaaaaaaaaaaaaaaaaaaaaaaaaaaaaaaaaaaaaaaaaaaaaaaaaaaaaaaaaaaaaaaaaaaaaaaaaaaaaaaaaaaaaaaaaaaaaaaaaaaaaaaaaaaaaaaaaaaaaaaaaaaaaaaaaaaaaaaaaaaaaaaaaaaaaaaaaaaaaaaaaaaaaaaaaaaaaaaaaaaaaaaaaaaaaaaaaaaaaaaaaaaaaaaaaaaaaaaaaaaaaaaaaaaaaaaaaaaaaaaaaaaaaaaaaaaaaaaaaaaaaaaaaaaaaaaaaaaaaaaaaaaaaaaaaaaaaaaaaaaaaaaaaaaaaaaaaaaaaaaaaaaaaaaaaaaaaaaaaaaaaaaaaaaaaaaaaaaaaaaaaaaaaaaaaaaaaaaaaaaaaaaaaaaaaaaaaaaaaaaaaaaaaaaaaaaaaaaaaaaaaaaaaaaaaaaaaaaaaaaaaaaaaaaaaaaaaaaaaaaaaaaaaaaaaaaaaaaaaaaaaaaaaaaaaaaaaaaaaaaaaaaaaaaaaaaaaaaaaaaaaaaaaaaaaaaaaaaaaaaaaaaaaaaaaaaaaaaaaaaaaaaaaaaaaaaaaaaaaaaaaaaaaaaaaaaaaaaaaaaaaaaaaaaaaaaaaaaaaaaaaaaaaaaaaaaaaaaaaaaaaaaaaaaaaaaaaaaaaaaaaaaaaaaaaaaaaaaaaaaaaaaaaaaaaaaaaaaaaaaaaaaaaaaaaaaaaaaaaaaaaaaaaaaaaaaaaaaaaaaaaaaaaaaaaaaaaaaaaaaaaaaaaaaaaaaaaaaaaaaaaaaaaaaaaaaaaaaaaaaaaaaaaaaaaaaaaaaaaaaaaaaaaaaaaaaaaaaaaaaaaaaaaaaaaaaaaaaaaaaaaaaaaaaaaaaaaaaaaaaaaaaaaaaaaaaaaaaaaaaaaaaaaaaaaaaaaaaaaaaaaaaaaaaaaaaaaaaaaaaaaaaaaaaaaaaaaaaaaaaaaaaaaaaaaaaaaaaaaaaaaaaaaaaaaaaaaaaaaaaaaaaaaaaaaaaaaaaaaaaaaaaaaaaaaaaaaaaaaaaaaaaaaaaaaaaaaaaaaaaaaaaaaaaaaaaaaaaaaaaaaaaaaaaaaaaaaaaaaaaaaaaaaaaaaaaaaaaaaaaaaaaaaaaaaaaaaaaaaaaaaaaaaaaaaaaaaaaaaaaaaaaaaaaaaaaaaaaaaaaaaaaaaaaaaaaaaaaaaaaaaaaaaaaaaaaaaaaaaaaaaaaaaaaaaaaaaaaaaaaaaaaaaaaaaaaaaaaaaaaaaaaaaaaaaaaaaaaaaaaaaaaaaaaaaaaaaaaaaaaaaaaaaaaaaaaaaaaaaaaaaaaaaaaaaaaaaaaaaaaaaaaaaaaaaaaaaaaaaaaaaaaaaaaaaaaaaaaaaaaaaaaaaaaaaaaaaaaaaaaaaaaaaaaaaaaaaaaaaaaaaaaaaaaaaaaaaaaaaaaaaaaaaaaaaaaaaaaaaaaaaaaaaaaaaaaaaaaaaaaaaaaaaaaaaaaaaaaaaaaaaaaaaaaaaaaaaaaaaaaaaaaaaaaaaaaaaaaaaaaaaaaaaaaaaaaaaaaaaaaaaaaaaaaaaaaaaaaaaaaaaaaaaaaaaaaaaaaaaaaaaaaaaaaaaaaaaaaaaaaaaaaaaaaaaaaaaaaaaaaaaaaaaaaaaaaaaaaaaaaaaaaaaaaaaaaaaaaaaaaaaaaaaaaaaaaaaaaaaaaaaaaaaaaaaaaaaaaaaaaaaaaaaaaaaaaaaaaaaaaaaaaaaaaaaaaaaaaaaaaaaaaaaaaaaaaaaaaaaaaaaaaaaaaaaaaaaaaaaaaaaaaaaaaaaaaaaaaaaaaaaaaaaaaaaaaaaaaaaaaaaaaaaaaaaaaaaaaaaaaaaaaaaaaaaaaaaaaaaaaaaaaaaaaaaaaaaaaaaaaaaaaaaaaaaaaaaaaaaaaaaaaaaaaaaaaaaaaaaaaaaaaaaaaaaaaaaaaaaaaaaaaaaaaaaaaaaaaaaaaaaaaaaaaaaaaaaaaaaaaaaaaaaaaaaaaaaaaaaaaaaaaaaaaaaaaaaaaaaaaaaaaaaaaaaaaaaaaaaaaaaaaaaaaaaaaaaaaaaaaaaaaaaaaaaaaaaaaaaaaaaaaaaaaaaaaaaaaaaaaaaaaaaaaaaaaaaaaaaaaaaaaaaaaaaaaaaaaaaaaaaaaaaaaaaaaaaaaaaaaaaaaaaaaaaaaaaaaaaaaaaaaaaaaaaaaaaaaaaaaaaaaaaaaaaaaaaaaaaaaaaaaaaaaaaaaaaaaaaaaaaaaaaaaaaaaaaaaaaaaaaaaaaaaaaaaaaaaaaaaaaaaaaaaaaaaaaaaaaaaaaaaaaaaaaaaaaaaaaaaaaaaaaaaaaaaaaaaaaaaaaaaaaaaaaaaaaaaaaaaaaaaaaaaaaaaaaaaaaaaaaaaaaaaaaaaaaaaaaaaaaaaaaaaaaaaaaaaaaaaaaaaaaaaaaaaaaaaaaaaaaaaaaaaaaaaaaaaaaaaaaaaaaaaaaaaaaaaaaaaaaaaaaaaaaaaaaaaaaaaaaaaaaaaaaaaaaaaaaaaaaaaaaaaaaaaaaaaaaaaaaaaaaaaaaaaaaaaaaaaaaaaaaaaaaaaaaaaaaaaaaaaaaaaaaaaaaaaaaaaaaaaaaaaaaaaaaaaaaaaaaaaaaaaaaaaaaaaaaaaaaaaaaaaaaaaaaaaaaaaaaaaaaaaaaaaaaaaaaaaaaaaaaaaaaaaaaaaaaaaaaaaaaaaaaaaaaaaaaaaaaaaaaaaaaaaaaaaaaaaaaaaaaaaaaaaaaaaaaaaaaaaaaaaaaaaaaaaaaaaaaaaaaaaaaaaaaaaaaaaaaaaaaaaaaaaaaaaaaaaaaaaaaaaaaaaaaaaaaaaaaaaaaaaaaaaaaaaaaaaaaaaaaaaaaaaaaaaaaaaaaaaaaaaaaaaaaaaaaaaaaaaaaaaaaaaaaaaaaaaaaaaaaaaaaaaaaaaaaaaaaaaaaaaaaaaaaaaaaaaaaaaaaaaaaaaaaaaaaaaaaaaaaaaaaaaaaaaaaaaaaaaaaaaaaaaaaaaaaaaaaaaaaaaaaaaaaaaaaaaaaaaaaaaaaaaaaaaaaaaaaaaaaaaaaaaaaaaaaaaaaaaaaaaaaaaaaaaaaaaaaaaaaaaaaaaaaaaaaaaaaaaaaaaaaaaaaaaaaaaaaaaaaaaaaaaaaaaaaaaaaaaaaaaaaaaaaaaaaaaaaaaaaaaaaaaaaaaaaaaaaaaaaaaaaaaaaaaaaaaaaaaaaaaaaaaaaaaaaaaaaaaaaaaaaaaaaaaaaaaaaaaaaaaaaaaaaaaaaaaaaaaaaaaaaaaaaaaaaaaaaaaaaaaaaaaaaaaaaaaaaaaaaaaaaaaaaaaaaaaaaaaaaaaaaaaaaaaaaaaaaaaaaaaaaaaaaaaaaaaaaaaaaaaaaaaaaaaaaaaaaaaaaaaaaaaaaaaaaaaaaaaaaaaaaaaaaaaaaaaaaaaaaaaaaaaaaaaaaaaaaaaaaaaaaaaaaaaaaaaaaaaaaaaaaaaaaaaaaaaaaaaaaaaaaaaaaaaaaaaaaaaaaaaaaaaaaaaaaaaaaaaaaaaaaaaaaaaaaaaaaaaaaaaaaaaaaaaaaaaaaaaaaaaaaaaaaaaaaaaaaaaaaaaaaaaaaaaaaaaaaaaaaaaaaaaaaaaaaaaaaaaaaaaaaaaaaaaaaaaaaaaaaaaaaaaaaaaaaaaaaaaaaaaaaaaaaaaaaaaaaaaaaaaaaaaaaaaaaaaaaaaaaaaaaaaaaaaaaaaaaaaaaaaaaaaaaaaaaaaaaaaaaaaaaaaaaaaaaaaaaaaaaaaaaaaaaaaaaaaaaaaaaaaaaaaaaaaaaaaaaaaaaaaaaaaaaaaaaaaaaaaaaaaaaaaaaaaaaaaaaaaaaaaaaaaaaaaaaaaaaaaaaaaaaaaaaaaaaaaaaaaaaaaaaaaaaaaaaaaaaaaaaaaaaaaaaaaaaaaaaaaaaaaaaaaaaaaaaaaaaaaaaaaaaaaaaaaaaaaaaaaaaaaaaaaaaaaaaaaaaaaaaaaaaaaaaaaaaaaaaaaaaaaaaaaaaaaaaaaaaaaaaaaaaaaaaaaaaaaaaaaaaaaaaaaaaaaaaaaaaaaaaaaaaaaaaaaaaaaaaaaaaaaaaaaaaaaaaaaaaaaaaaaaaaaaaaaaaaaaaaaaaaaaaaaaaaaaaaaaaaaaaaaaaaaaaaaaaaaaaaaaaaaaaaaaaaaaaaaaaaaaaaaaaaaaaaaaaaaaaaaaaaaaaaaaaaaaaaaaaaaaaaaaaaaaaaaaaaaaaaaaaaaaaaaaaaaaaaaaaaaaaaaaaaaaaaaaaaaaaaaaaaaaaaaaaaaaaaaaaaaaaaaaaaaaaaaaaaaaaaaaaaaaaaaaaaaaaaaaaaaaaaaaaaaaaaaaaaaaaaaaaaaaaaaaaaaaaaaaaaaaaaaaaaaaaaaaaaaaaaaaaaaaaaaaaaaaaaaaaaaaaaaaaaaaaaaaaaaaaaaaaaaaaaaaaaaaaaaaaaaaaaaaaaaaaaaaaaaaaaaaaaaaaaaaaaaaaaaaaaaaaaaaaaaaaaaaaaaaaaaaaaaaaaaaaaaaaaaaaaaaaaaaaaaaaaaaaaaaaaaaaaaaaaaaaaaaaaaaaaaaaaaaaaaaaaaaaaaaaaaaaaaaaaaaaaaaaaaaaaaaaaaaaaaaaaaaaaaaaaaaaaaaaaaaaaaaaaaaaaaaaaaaaaaaaaaaaaaaaaaaaaaaaaaaaaaaaaaaaaaaaaaaaaaaaaaaaaaaaaaaaaaaaaaaaaaaaaaaaaaaaaaaaaaaaaaaaaaaaaaaaaaaaaaaaaaaaaaaaaaaaaaaaaaaaaaaaaaaaaaaaaaaaaaaaaaaaaaaaaaaaaaaaaaaaaaaaaaaaaaaaaaaaaaaaaaaaaaaaaaaaaaaaaaaaaaaaaaaaaaaaaaaaaaaaaaaaaaaaaaaaaaaaaaaaaaaaaaaaaaaaaaaaaaaaaaaaaaaaaaaaaaaaaaaaaaaaaaaaaaaaaaaaaaaaaaaaaaaaaaaaaaaaaaaaaaaaaaaaaaaaaaaaaaaaaaaaaaaaaaaaaaaaaaaaaaaaaaaaaaaaaaaaaaaaaaaaaaaaaaaaaaaaaaaaaaaaaaaaaaaaaaaaaaaaaaaaaaaaaaaaaaaaaaaaaaaaaaaaaaaaaaaaaaaaaaaaaaaaaaaaaaaaaaaaaaaaaaaaaaaaaaaaaaaaaaaaaaaaaaaaaaaaaaaaaaaaaaaaaaaaaaaaaaaaaaaaaaaaaaaaaaaaaaaaaaaaaaaaaaaaaaaaaaaaaaaaaaaaaaaaaaaaaaaaaaaaaaaaaaaaaaaaaaaaaaaaaaaaaaaaaaaaaaaaaaaaaaaaaaaaaaaaaaaaaaaaaaaaaaaaaaaaaaaaaaaaaaaaaaaaaaaaaaaaaaaaaaaaaaaaaaaaaaaaaaaaaaaaaaaaaaaaaaaaaaaaaaaaaaaaaaaaaaaaaaaaaaaaaaaaaaaaaaaaaaaaaaaaaaaaaaaaaaaaaaaaaaaaaaaaaaaaaaaaaaaaaaaaaaaaaaaaaaaaaaaaaaaaaaaaaaaaaaaaaaaaaaaaaaaaaaaaaaaaaaaaaaaaaaaaaaaaaaaaaaaaaaaaaaaaaaaaaaaaaaaaaaaaaaaaaaaaaaaaaaaaaaaaaaaaaaaaaaaaaaaaaaaaaaaaaaaaaaaaaaaaaaaaaaaaaaaaaaaaaaaaaaaaaaaaaaaaaaaaaaaaaaaaaaaaaaaaaaaaaaaaaaaaaaaaaaaaaaaaaaaaaaaaaaaaaaaaaaaaaaaaaaaaaaaaaaaaaaaaaaaaaaaaaaaaaaaaaaaaaaaaaaaaaaaaaaaaaaaaaaaaaaaaaaaaaaaaaaaaaaaaaaaaaaaaaaaaaaaaaaaaaaaaaaaaaaaaaaaaaaaaaaaaaaaaaaaaaaaaaaaaaaaaaaaaaaaaaaaaaaaaaaaaaaaaaaaaaaaaaaaaaaaaaaaaaaaaaaaaaaaaaaaaaaaaaaaaaaaaaaaaaaaaaaaaaaaaaaaaaaaaaaaaaaaaaaaaaaaaaaaaaaaaaaaaaaaaaaaaaaaaaaaaaaaaaaaaaaaaaaaaaaaaaaaaaaaaaaaaaaaaaaaaaaaaaaaaaaaaaaaaaaaaaaaaaaaaaaaaaaaaaaaaaaaaaaaaaaaaaaaaaaaaaaaaaaaaaaaaaaaaaaaaaaaaaaaaaaaaaaaaaaaaaaaaaaaaaaaaaaaaaaaaaaaaaaaaaaaaaaaaaaaaaaaaaaaaaaaaaaaaaaaaaaaaaaaaaaaaaaaaaaaaaaaaaaaaaaaaaaaaaaaaaaaaaaaaaaaaaaaaaaaaaaaaaaaaaaaaaaaaaaaaaaaaaaaaaaaaaaaaaaaaaaaaaaaaaaaaaaaaaaaaaaaaaaaaaaaaaaaaaaaaaaaaaaaaaaaaaaaaaaaaaaaaaaaaaaaaaaaaaaaaaaaaaaaaaaaaaaaaaaaaaaaaaaaaaaaaaaaaaaaaaaaaaaaaaaaaaaaaaaaaaaaaaaaaaaaaaaaaaaaaaaaaaaaaaaaaaaaaaaaaaaaaaaaaaaaaaaaaaaaaaaaaaaaaaaaaaaaaaaaaaaaaaaaaaaaaaaaaaaaaaaaaaaaaaaaaaaaaaaaaaaaaaaaaaaaaaaaaaaaaaaaaaaaaaaaaaaaaaaaaaaaaaaaaaaaaaaaaaaaaaaaaaaaaaaaaaaaaaaaaaaaaaaaaaaaaaaaaaaaaaaaaaaaaaaaaaaaaaaaaaaaaaaaaaaaaaaaaaaaaaaaaaaaaaaaaaaaaaaaaaaaaaaaaaaaaaaaaaaaaaaaaaaaaaaaaaaaaaaaaaaaaaaaaaaaaaaaaaaaaaaaaaaaaaaaaaaaaaaaaaaaaaaaaaaaaaaaaaaaaaaaaaaaaaaaaaaaaaaaaaaaaaaaaaaaaaaaaaaaaaaaaaaaaaaaaaaaaaaaaaaaaaaaaaaaaaaaaaaaaaaaaaaaaaaaaaaaaaaaaaaaaaaaaaaaaaaaaaaaaaaaaaaaaaaaaaaaaaaaaaaaaaaaaaaaaaaaaaaaaaaaaaaaaaaaaaaaaaaaaaaaaaaaaaaaaaaaaaaaaaaaaaaaaaaaaaaaaaaaaaaaaaaaaaaaaaaaaaaaaaaaaaaaaaaaaaaaaaaaaaaaaaaaaaaaaaaaaaaaaaaaaaaaaaaaaaaaaaaaaaaaaaaaaaaaaaaaaaaaaaaaaaaaaaaaaaaaaaaaaaaaaaaaaaaaaaaaaaaaaaaaaaaaaaaaaaaaaaaaaaaaaaaaaaaaaaaaaaaaaaaaaaaaaaaaaaaaaaaaaaaaaaaaaaaaaaaaaaaaaaaaaaaaaaaaaaaaaaaaaaaaaaaaaaaaaaaaaaaaaaaaaaaaaaaaaaaaaaaaaaaaaaaaaaaaaaaaaaaaaaaaaaaaaaaaaaaaaaaaaaaaaaaaaaaaaaaaaaaaaaaaaaaaaaaaaaaaaaaaaaaaaaaaaaaaaaaaaaaaaaaaaaaaaaaaaaaaaaaaaaaaaaaaaaaaaaaaaaaaaaaaaaaaaaaaaaaaaaaaaaaaaaaaaaaaaaaaaaaaaaaaaaaaaaaaaaaaaaaaaaaaaaaaaaaaaaaaaaaaaaaaaaaaaaaaaaaaaaaaaaaaaaaaaaaaaaaaaaaaaaaaaaaaaaaaaaaaaaaaaaaaaaaaaaaaaaaaaaaaaaaaaaaaaaaaaaaaaaaaaaaaaaaaaaaaaaaaaaaaaaaaaaaaaaaaaaaaaaaaaaaaaaaaaaaaaaaaaaaaaaaaaaaaaaaaaaaaaaaaaaaaaaaaaaaaaaaaaaaaaaaaaaaaaaaaaaaaaaaaaaaaaaaaaaaaaaaaaaaaaaaaaaaaaaaaaaaaaaaaaaaaaaaaaaaaaaaaaaaaaaaaaaaaaaaaaaaaaaaaaaaaaaaaaaaaaaaaaaaaaaaaaaaaaaaaaaaaaaaaaaaaaaaaaaaaaaaaaaaaaaaaaaaaaaaaaaaaaaaaaaaaaaaaaaaaaaaaaaaaaaaaaaaaaaaaaaaaaaaaaaaaaaaaaaaaaaaaaaaaaaaaaaaaaaaaaaaaaaaaaaaaaaaaaaaaaaaaaaaaaaaaaaaaaaaaaaaaaaaaaaaaaaaaaaaaaaaaaaaaaaaaaaaaaaaaaaaaaaaaaaaaaaaaaaaaaaaaaaaaaaaaaaaaaaaaaaaaaaaaaaaaaaaaaaaaaaaaaaaaaaaaaaaaaaaaaaaaaaaaaaaaaaaaaaaaaaaaaaaaaaaaaaaaaaaaaaaaaaaaaaaaaaaaaaaaaaaaaaaaaaaaaaaaaaaaaaaaaaaaaaaaaaaaaaaaaaaaaaaaaaaaaaaaaaaaaaaaaaaaaaaaaaaaaaaaaaaaaaaaaaaaaaaaaaaaaaaaaaaaaaaaaaaaaaaaaaaaaaaaaaaaaaaaaaaaaaaaaaaaaaaaaaaaaaaaaaaaaaaaaaaaaaaaaaaaaaaaaaaaaaaaaaaaaaaaaaaaaaaaaaaaaaaaaaaaaaaaaaaaaaaaaaaaaaaaaaaaaaaaaaaaaaaaaaaaaaaaaaaaaaaaaaaaaaaaaaaaaaaaaaaaaaaaaaaaaaaaaaaaaaaaaaaaaaaaaaaaaaaaaaaaaaaaaaaaaaaaaaaaaaaaaaaaaaaaaaaaaaaaaaaaaaaaaaaaaaaaaaaaaaaaaaaaaaaaaaaaaaaaaaaaaaaaaaaaaaaaaaaaaaaaaaaaaaaaaaaaaaaaaaaaaaaaaaaaaaaaaaaaaaaaaaaaaaaaaaaaaaaaaaaaaaaaaaaaaaaaaaaaaaaaaaaaaaaaaaaaaaaaaaaaaaaaaaaaaaaaaaaaaaaaaaaaaaaaaaaaaaaaaaaaaaaaaaaaaaaaaaaaaaaaaaaaaaaaaaaaaaaaaaaaaaaaaaaaaaaaaaaaaaaaaaaaaaaaaaaaaaaaaaaaaaaaaaaaaaaaaaaaaaaaaaaaaaaaaaaaaaaaaaaaaaaaaaaaaaaaaaaaaaaaaaaaaaaaaaaaaaaaaaaaaaaaaaaaaaaaaaaaaaaaaaaaaaaaaaaaaaaaaaaaaaaaaaaaaaaaaaaaaaaaaaaaaaaaaaaaaaaaaaaaaaaaaaaaaaaaaaaaaaaaaaaaaaaaaaaaaaaaaaaaaaaaaaaaaaaaaaaaaaaaaaaaaaaaaaaaaaaaaaaaaaaaaaaaaaaaaaaaaaaaaaaaaaaaaaaaaaaaaaaaaaaaaaaaaaaaaaaaaaaaaaaaaaaaaaaaaaaaaaaaaaaaaaaaaaaaaaaaaaaaaaaaaaaaaaaaaaaaaaaaaaaaaaaaaaaaaaaaaaaaaaaaaaaaaaaaaaaaaaaaaaaaaaaaaaaaaaaaaaaaaaaaaaaaaaaaaaaaaaaaaaaaaaaaaaaaaaaaaaaaaaaaaaaaaaaaaaaaaaaaaaaaaaaaaaaaaaaaaaaaaaaaaaaaaaaaaaaaaaaaaaaaaaaaaaaaaaaaaaaaaaaaaaaaaaaaaaaaaaaaaaaaaaaaaaaaaaaaaaaaaaaaaaaaaaaaaaaaaaaaaaaaaaaaaaaaaaaaaaaaaaaaaaaaaaaaaaaaaaaaaaaaaaaaaaaaaaaaaaaaaaaaaaaaaaaaaaaaaaaaaaaaaaaaaaaaaaaaaaaaaaaaaaaaaaaaaaaaaaaaaaaaaaaaaaaaaaaaaaaaaaaaaaaaaaaaaaaaaaaaaaaaaaaaaaaaaaaaaaaaaaaaaaaaaaaaaaaaaaaaaaaaaaaaaaaaaaaaaaaaaaaaaaaaaaaaaaaaaaaaaaaaaaaaaaaaaaaaaaaaaaaaaaaaaaaaaaaaaaaaaaaaaaaaaaaaaaaaaaaaaaaaaaaaaaaaaaaaaaaaaaaaaaaaaaaaaaaaaaaaaaaaaaaaaaaaaaaaaaaaaaaaaaaaaaaaaaaaaaaaaaaaaaaaaaaaaaaaaaaaaaaaaaaaaaaaaaaaaaaaaaaaaaaaaaaaaaaaaaaaaaaaaaaaaaaaaaaaaaaaaaaaaaaaaaaaaaaaaaaaaaaaaaaaaaaaaaaaaaaaaaaaaaaaaaaaaaaaaaaaaaaaaaaaaaaaaaaaaaaaaaaaaaaaaaaaaaaaaaaaaaaaaaaaaaaaaaaaaaaaaaaaaaaaaaaaaaaaaaaaaaaaaaaaaaaaaaaaaaaaaaaaaaaaaaaaaaaaaaaaaaaaaaaaaaaaaaaaaaaaaaaaaaaaaaaaaaaaaaaaaaaaaaaaaaaaaaaaaaaaaaaaaaaaaaaaaaaaaaaaaaaaaaaaaaaaaaaaaaaaaaaaaaaaaaaaaaaaaaaaaaaaaaaaaaaaaaaaaaaaaaaaaaaaaaaaaaaaaaaaaaaaaaaaaaaaaaaaaaaaaaaaaaaaaaaaaaaaaaaaaaaaaaaaaaaaaaaaaaaaaaaaaaaaaaaaaaaaaaaaaaaaaaaaaaaaaaaaaaaaaaaaaaaaaaaaaaaaaaaaaaaaaaaaaaaaaaaaaaaaaaaaaaaaaaaaaaaaaaaaaaaaaaaaaaaaaaaaaaaaaaaaaaaaaaaaaaaaaaaaaaaaaaaaaaaaaaaaaaaaaaaaaaaaaaaaaaaaaaaaaaaaaaaaaaaaaaaaaaaaaaaaaaaaaaaaaaaaaaaaaaaaaaaaaaaaaaaaaaaaaaaaaaaaaaaaaaaaaaaaaaaaaaaaaaaaaaaaaaaaaaaaaaaaaaaaaaaaaaaaaaaaaaaaaaaaaaaaaaaaaaaaaaaaaaaaaaaaaaaaaaaaaaaaaaaaaaaaaaaaaaaaaaaaaaaaaaaaaaaaaaaaaaaaaaaaaaaaaaaaaaaaaaaaaaaaaaaaaaaaaaaaaaaaaaaaaaaaaaaaaaaaaaaaaaaaaaaaaaaaaaaaaaaaaaaaaaaaaaaaaaaaaaaaaaaaaaaaaaaaaaaaaaaaaaaaaaaaaaaaaaaaaaaaaaaaaaaaaaaaaaaaaaaaaaaaaaaaaaaaaaaaaaaaaaaaaaaaaaaaaaaaaaaaaaaaaaaaaaaaaaaaaaaaaaaaaaaaaaaaaaaaaaaaaaaaaaaaaaaaaaaaaaaaaaaaaaaaaaaaaaaaaaaaaaaaaaaaaaaaaaaaaaaaaaaaaaaaaaaaaaaaaaaaaaaaaaaaaaaaaaaaaaaaaaaaaaaaaaaaaaaaaaaaaaaaaaaaaaaaaaaaaaaaaaaaaaaaaaaaaaaaaaaaaaaaaaaaaaaaaaaaaaaaaaaaaaaaaaaaaaaaaaaaaaaaaaaaaaaaaaaaaaaaaaaaaaaaaaaaaaaaaaaaaaaaaaaaaaaaaaaaaaaaaaaaaaaaaaaaaaaaaaaaaaaaaaaaaaaaaaaaaaaaaaaaaaaaaaaaaaaaaaaaaaaaaaaaaaaaaaaaaaaaaaaaaaaaaaaaaaaaaaaaaaaaaaaaaaaaaaaaaaaaaaaaaaaaaaaaaaaaaaaaaaaaaaaaaaaaaaaaaaaaaaaaaaaaaaaaaaaaaaaaaaaaaaaaaaaaaaaaaaaaaaaaaaaaaaaaaaaaaaaaaaaaaaaaaaaaaaaaaaaaaaaaaaaaaaaaaaaaaaaaaaaaaaaaaaaaaaaaaaaaaaaaaaaaaaaaaaaaaaaaaaaaaaaaaaaaaaaaaaaaaaaaaaaaaaaaaaaaaaaaaaaaaaaaaaaaaaaaaaaaaaaaaaaaaaaaaaaaaaaaaaaaaaaaaaaaaaaaaaaaaaaaaaaaaaaaaaaaaaaaaaaaaaaaaaaaaaaaaaaaaaaaaaaaaaaaaaaaaaaaaaaaaaaaaaaaaaaaaaaaaaaaaaaaaaaaaaaaaaaaaaaaaaaaaaaaaaaaaaaaaaaaaaaaaaaaaaaaaaaaaaaaaaaaaaaaaaaaaaaaaaaaaaaaaaaaaaaaaaaaaaaaaaaaaaaaaaaaaaaaaaaaaaaaaaaaaaaaaaaaaaaaaaaaaaaaaaaaaaaaaaaaaaaaaaaaaaaaaaaaaaaaaaaaaaaaaaaaaaaaaaaaaaaaaaaaaaaaaaaaaaaaaaaaaaaaaaaaaaaaaaaaaaaaaaaaaaaaaaaaaaaaaaaaaaaaaaaaaaaaaaaaaaaaaaaaaaaaaaaaaaaaaaaaaaaaaaaaaaaaaaaaaaaaaaaaaaaaaaaaaaaaaaaaaaaaaaaaaaaaaaaaaaaaaaaaaaaaaaaaaaaaaaaaaaaaaaaaaaaaaaaaaaaaaaaaaaaaaaaaaaaaaaaaaaaaaaaaaaaaaaaaaaaaaaaaaaaaaaaaaaaaaaaaaaaaaaaaaaaaaaaaaaaaaaaaaaaaaaaaaaaaaaaaaaaaaaaaaaaaaaaaaaaaaaaaaaaaaaaaaaaaaaaaaaaaaaaaaaaaaaaaaaaaaaaaaaaaaaaaaaaaaaaaaaaaaaaaaaaaaaaaaaaaaaaaaaaaaaaaaaaaaaaaaaaaaaaaaaaaaaaaaaaaaaaaaaaaaaaaaaaaaaaaaaaaaaaaaaaaaaaaaaaaaaaaaaaaaaaaaaaaaaaaaaaaaaaaaaaaaaaaaaaaaaaaaaaaaaaaaaaaaaaaaaaaaaaaaaaaaaaaaaaaaaaaaaaaaaaaaaaaaaaaaaaaaaaaaaaaaaaaaaaaaaaaaaaaaaaaaaaaaaaaaaaaaaaaaaaaaaaaaaaaaaaaaaaaaaaaaaaaaaaaaaaaaaaaaaaaaaaaaaaaaaaaaaaaaaaaaaaaaaaaaaaaaaaaaaaaaaaaaaaaaaaaaaaaaaaaaaaaaaaaaaaaaaaaaaaaaaaaaaaaaaaaaaaaaaaaaaaaaaaaaaaaaaaaaaaaaaaaaaaaaaaaaaaaaaaaaaaaaaaaaaaaaaaaaaaaaaaaaaaaaaaaaaaaaaaaaaaaaaaaaaaaaaaaaaaaaaaaaaaaaaaaaaaaaaaaaaaaaaaaaaaaaaaaaaaaaaaaaaaaaaaaaaaaaaaaaaaaaaaaaaaaaaaaaaaaaaaaaaaaaaaaaaaaaaaaaaaaaaaaaaaaaaaaaaaaaaaaaaaaaaaaaaaaaaaaaaaaaaaaaaaaaaaaaaaaaaaaaaaaaaaaaaaaaaaaaaaaaaaaaaaaaaaaaaaaaaaaaaaaaaaaaaaaaaaaaaaaaaaaaaaaaaaaaaaaaaaaaaaaaaaaaaaaaaaaaaaaaaaaaaaaaaaaaaaaaaaaaaaaaaaaaaaaaaaaaaaaaaaaaaaaaaaaaaaaaaaaaaaaaaaaaaaaaaaaaaaaaaaaaaaaaaaaaaaaaaaaaaaaaaaaaaaaaaaaaaaaaaaaaaaaaaaaaaaaaaaaaaaaaaaaaaaaaaaaaaaaaaaaaaaaaaaaaaaaaaaaaaaaaaaaaaaaaaaaaaaaaaaaaaaaaaaaaaaaaaaaaaaaaaaaaaaaaaaaaaaaaaaaaaaaaaaaaaaaaaaaaaaaaaaaaaaaaaaaaaaaaaaaaaaaaaaaaaaaaaaaaaaaaaaaaaaaaaaaaaaaaaaaaaaaaaaaaaaaaaaaaaaaaaaaaaaaaaaaaaaaaaaaaaaaaaaaaaaaaaaaaaaaaaaaaaaaaaaaaaaaaaaaaaaaaaaaaaaaaaaaaaaaaaaaaaaaaaaaaaaaaaaaaaaaaaaaaaaaaaaaaaaaaaaaaaaaaaaaaaaaaaaaaaaaaaaaaaaaaaaaaaaaaaaaaaaaaaaaaaaaaaaaaaaaaaaaaaaaaaaaaaaaaaaaaaaaaaaaaaaaaaaaaaaaaaaaaaaaaaaaaaaaaaaaaaaaaaaaaaaaaaaaaaaaaaaaaaaaaaaaaaaaaaaaaaaaaaaaaaaaaaaaaaaaaaaaaaaaaaaaaaaaaaaaaaaaaaaaaaaaaaaaaaaaaaaaaaaaaaaaaaaaaaaaaaaaaaaaaaaaaaaaaaaaaaaaaaaaaaaaaaaaaaaaaaaaaaaaaaaaaaaaaaaaaaaaaaaaaaaaaaaaaaaaaaaaaaaaaaaaaaaaaaaaaaaaaaaaaaaaaaaaaaaaaaaaaaaaaaaaaaaaaaaaaaaaaaaaaaaaaaaaaaaaaaaaaaaaaaaaaaaaaaaaaaaaaaaaaaaaaaaaaaaaaaaaaaaaaaaaaaaaaaaaaaaaaaaaaaaaaaaaaaaaaaaaaaaaaaaaaaaaaaaaaaaaaaaaaaaaaaaaaaaaaaaaaaaaaaaaaaaaaaaaaaaaaaaaaaaaaaaaaaaaaaaaaaaaaaaaaaaaaaaaaaaaaaaaaaaaaaaaaaaaaaaaaaaaaaaaaaaaaaaaaaaaaaaaaaaaaaaaaaaaaaaaaaaaaaaaaaaaaaaaaaaaaaaaaaaaaaaaaaaaaaaaaaaaaaaaaaaaaaaaaaaaaaaaaaaaaaaaaaaaaaaaaaaaaaaaaaaaaaaaaaaaaaaaaaaaaaaaaaaaaaaaaaaaaaaaaaaaaaaaaaaaaaaaaaaaaaaaaaaaaaaaaaaaaaaaaaaaaaaaaaaaaaaaaaaaaaaaaaaaaaaaaaaaaaaaaaaaaaaaaaaaaaaaaaaaaaaaaaaaaaaaaaaaaaaaaaaaaaaaaaaaaaaaaaaaaaaaaaaaaaaaaaaaaaaaaaaaaaaaaaaaaaaaaaaaaaaaaaaaaaaaaaaaaaaaaaaaaaaaaaaaaaaaaaaaaaaaaaaaaaaaaaaaaaaaaaaaaaaaaaaaaaaaaaaaaaaaaaaaaaaaaaaaaaaaaaaaaaaaaaaaaaaaaaaaaaaaaaaaaaaaaaaaaaaaaaaaaaaaaaaaaaaaaaaaaaaaaaaaaaaaaaaaaaaaaaaaaaaaaaaaaaaaaaaaaaaaaaaaaaaaaaaaaaaaaaaaaaaaaaaaaaaaaaaaaaaaaaaaaaaaaaaaaaaaaaaaaaaaaaaaaaaaaaaaaaaaaaaaaaaaaaaaaaaaaaaaaaaaaaaaaaaaaaaaaaaaaaaaaaaaaaaaaaaaaaaaaaaaaaaaaaaaaaaaaaaaaaaaaaaaaaaaaaaaaaaaaaaaaaaaaaaaaaaaaaaaaaaaaaaaaaaaaaaaaaaaaaaaaaaaaaaaaaaaaaaaaaaaaaaaaaaaaaaaaaaaaaaaaaaaaaaaaaaaaaaaaaaaaaaaaaaaaaaaaaaaaaaaaaaaaaaaaaaaaaaaaaaaaaaaaaaaaaaaaaaaaaaaaaaaaaaaaaaaaaaaaaaaaaaaaaaaaaaaaaaaaaaaaaaaaaaaaaaaaaaaaaaaaaaaaaaaaaaaaaaaaaaaaaaaaaaaaaaaaaaaaaaaaaaaaaaaaaaaaaaaaaaaaaaaaaaaaaaaaaaaaaaaaaaaaaaaaaaaaaaaaaaaaaaaaaaaaaaaaaaaaaaaaaaaaaaaaaaaaaaaaaaaaaaaaaaaaaaaaaaaaaaaaaaaaaaaaaaaaaaaaaaaaaaaaaaaaaaaaaaaaaaaaaaaaaaaaaaaaaaaaaaaaaaaaaaaaaaaaaaaaaaaaaaaaaaaaaaaaaaaaaaaaaaaaaaaaaaaaaaaaaaaaaaaaaaaaaaaaaaaaaaaaaaaaaaaaaaaaaaaaaaaaaaaaaaaaaaaaaaaaaaaaaaaaaaaaaaaaaaaaaaaaaaaaaaaaaaaaaaaaaaaaaaaaaaaaaaaaaaaaaaaaaaaaaaaaaaaaaaaaaaaaaaaaaaaaaaaaaaaaaaaaaaaaaaaaaaaaaaaaaaaaaaaaaaaaaaaaaaaaaaaaaaaaaaaaaaaaaaaaaaaaaaaaaaaaaaaaaaaaaaaaaaaaaaaaaaaaaaaaaaaaaaaaaaaaaaaaaaaaaaaaaaaaaaaaaaaaaaaaaaaaaaaaaaaaaaaaaaaaaaaaaaaaaaaaaaaaaaaaaaaaaaaaaaaaaaaaaaaaaaaaaaaaaaaaaaaaaaaaaaaaaaaaaaaaaaaaaaaaaaaaaaaaaaaaaaaaaaaaaaaaaaaaaaaaaaaaaaaaaaaaaaaaaaaaaaaaaaaaaaaaaaaaaaaaaaaaaaaaaaaaaaaaaaaaaaaaaaaaaaaaaaaaaaaaaaaaaaaaaaaaaaaaaaaaaaaaaaaaaaaaaaaaaaaaaaaaaaaaaaaaaaaaaaaaaaaaaaaaaaaaaaaaaaaaaaaaaaaaaaaaaaaaaaaaaaaaaaaaaaaaaaaaaaaaaaaaaaaaaaaaaaaaaaaaaaaaaaaaaaaaaaaaaaaaaaaaaaaaaaaaaaaaaaaaaaaaaaaaaaaaaaaaaaaaaaaaaaaaaaaaaaaaaaaaaaaaaaaaaaaaaaaaaaaaaaaaaaaaaaaaaaaaaaaaaaaaaaaaaaaaaaaaaaaaaaaaaaaaaaaaaaaaaaaaaaaaaaaaaaaaaaaaaaaaaaaaaaaaaaaaaaaaaaaaaaaaaaaaaaaaaaaaaaaaaaaaaaaaaaaaaaaaaaaaaaaaaaaaaaaaaaaaaaaaaaaaaaaaaaaaaaaaaaaaaaaaaaaaaaaaaaaaaaaaaaaaaaaaaaaaaaaaaaaaaaaaaaaaaaaaaaaaaaaaaaaaaaaaaaaaaaaaaaaaaaaaaaaaaaaaaaaaaaaaaaaaaaaaaaaaaaaaaaaaaaaaaaaaaaaaaaaaaaaaaaaaaaaaaaaaaaaaaaaaaaaaaaaaaaaaaaaaaaaaaaaaaaaaaa": 123}
CREATE TABLE auxtbl(ts TIMESTAMP);
INSERT INTO auxtbl VALUES ('2015-02-24 18:52:00');
INSERT INTO t1(j) VALUES ('');
ERROR 22032: Invalid JSON text: "The document is empty." at position 0 in value for column 't1.j'.
INSERT INTO t1(j) VALUES ('[');
ERROR 22032: Invalid JSON text: "Invalid value." at position 1 in value for column 't1.j'.
INSERT INTO t1(j) VALUES (x'cafebabe');
ERROR 22032: Cannot create a JSON value from a string with CHARACTER SET 'binary'.
INSERT INTO t1(j) VALUES (ST_GeomFromText('POINT(1 1)'));
ERROR 22032: Cannot create a JSON value from a string with CHARACTER SET 'binary'.
INSERT INTO t1(j) VALUES (-1);
ERROR 22032: Invalid JSON text: "not a JSON text, may need CAST" at position 0 in value for column 't1.j'.
INSERT INTO t1(j) VALUES (CAST(1 AS UNSIGNED));
ERROR 22032: Invalid JSON text: "not a JSON text, may need CAST" at position 0 in value for column 't1.j'.
INSERT INTO t1(j) VALUES (3.14);
ERROR 22032: Invalid JSON text: "not a JSON text, may need CAST" at position 0 in value for column 't1.j'.
INSERT INTO t1(j) VALUES (3.14E30);
ERROR 22032: Invalid JSON text: "not a JSON text, may need CAST" at position 0 in value for column 't1.j'.
INSERT INTO t1(j) VALUES (PI());
ERROR 22032: Invalid JSON text: "not a JSON text, may need CAST" at position 0 in value for column 't1.j'.
INSERT INTO t1(j) select ts from auxtbl;
ERROR 22032: Invalid JSON text: "The document root must not follow by other values." at position 4 in value for column 't1.j'.
DROP TABLE auxtbl;
INSERT INTO t1(j) VALUES (CAST('15:52:00' as TIME));
ERROR 22032: Invalid JSON text: "not a JSON text, may need CAST" at position 0 in value for column 't1.j'.
INSERT INTO t1(j) VALUES (CAST('2015-02-24' as DATE));
ERROR 22032: Invalid JSON text: "not a JSON text, may need CAST" at position 0 in value for column 't1.j'.
INSERT INTO t1(j) VALUES (TIMESTAMP '2015-02-24 15:52:00');
ERROR 22032: Invalid JSON text: "not a JSON text, may need CAST" at position 0 in value for column 't1.j'.
# ----------------------------------------------------------------------
# INSERT using prepared statement (PS)
# ----------------------------------------------------------------------
create table pt1(j json);
create table pt2(j json);
prepare ps1 from 'insert into pt1 values (cast(? as json))';
prepare ps2 from 'insert into pt2 values (?)';
set @a=123;
set @b='123';
set @c=3.14;
set @d=3.14E1;
set @e='"123"';
set @f='2010-12-01 18:44:25';
set @g=null;
execute ps1 using @a;
execute ps1 using @b;
execute ps1 using @c;
execute ps1 using @d;
execute ps1 using @e;
execute ps1 using @f;
ERROR 22032: Invalid JSON text in argument 1 to function cast_as_json: "The document root must not follow by other values." at position 4.
execute ps1 using @g;
execute ps2 using @a;
ERROR 22032: Invalid JSON text: "not a JSON text, may need CAST" at position 0 in value for column 'pt2.j'.
execute ps2 using @b;
execute ps2 using @c;
ERROR 22032: Invalid JSON text: "not a JSON text, may need CAST" at position 0 in value for column 'pt2.j'.
execute ps2 using @d;
ERROR 22032: Invalid JSON text: "not a JSON text, may need CAST" at position 0 in value for column 'pt2.j'.
execute ps2 using @e;
execute ps2 using @f;
ERROR 22032: Invalid JSON text: "The document root must not follow by other values." at position 4 in value for column 'pt2.j'.
execute ps2 using @g;
select json_type(j), j from pt1;
json_type(j)	j
INTEGER	123
INTEGER	123
DECIMAL	3.14
DOUBLE	31.4
STRING	"123"
NULL	NULL
select json_type(j), j from pt2;
json_type(j)	j
INTEGER	123
STRING	"123"
NULL	NULL
drop prepare ps1;
drop prepare ps2;
drop table pt1;
drop table pt2;
CREATE INDEX t1_idx_j ON t1(j);
ERROR 42000: JSON column 'j' cannot be used in key specification.
CREATE INDEX t1_idx_i_j ON t1(i, j);
ERROR 42000: JSON column 'j' cannot be used in key specification.
CREATE INDEX t1_idx_j_i ON t1(j, i);
ERROR 42000: JSON column 'j' cannot be used in key specification.
CREATE INDEX t1_idx_i ON t1(i);
DROP INDEX t1_idx_i ON t1;
CREATE TABLE t2(i INT, j JSON);
INSERT INTO t2 SELECT i, j FROM t1;
SELECT i, LENGTH(j) FROM t2 ORDER BY i;
i	LENGTH(j)
0	NULL
1	8
2	6
3	51
4	28
5	15
6	4
7	5
8	4
9	2
10	1
11	5
12	5
13	6
14	6
15	10
16	10
17	11
18	11
19	20
20	21
21	4
22	2
23	2
24	28
25	17
26	12
27	28
28	40
29	2
30	20
31	24
100	65544
DROP TABLE t2;
CREATE TABLE json(json int);
INSERT INTO json(json) VALUES (1);
SELECT json FROM json;
json
1
DROP TABLE json;
CREATE PROCEDURE p()
BEGIN
json: LOOP
LEAVE json;
END LOOP json;
END|
CALL p();
DROP PROCEDURE p;
#
# Test of JSON comparator.
#
SELECT i,
(j = '"scalar string"') AS c1,
(j = 'scalar string') AS c2,
(j = CAST('"scalar string"' AS JSON)) AS c3,
(j = CAST(CAST(j AS CHAR CHARACTER SET 'utf8mb4') AS JSON)) AS c4,
(j = CAST(NULL AS JSON)) AS c5,
(j = NULL) AS c6,
(j <=> NULL) AS c7,
(j <=> CAST(NULL AS JSON)) AS c8,
(j IN (-1, 2, 32768, 3.14)) AS c9,
(j IN (CAST('[1, 2]' AS JSON), CAST('{}' AS JSON), CAST(3.14 AS JSON)))
AS c10,
(j = (SELECT j FROM t1 WHERE j = CAST('null' AS JSON))) AS c11,
(j = (SELECT j FROM t1 WHERE j IS NULL)) AS c12,
(j = (SELECT j FROM t1 WHERE 1<>1)) AS c13,
(j = DATE'2015-01-15') AS c14,
(j = TIME'23:24:25') AS c15,
(j = TIMESTAMP'2015-01-15 23:24:25') AS c16,
(j = CURRENT_TIMESTAMP) AS c17,
(j = ST_GeomFromText('POINT(1 1)')) AS c18,
(JSON_EXTRACT(j, '$.a') = 2) AS c19
FROM t1
ORDER BY i;
i	c1	c2	c3	c4	c5	c6	c7	c8	c9	c10	c11	c12	c13	c14	c15	c16	c17	c18	c19
0	NULL	NULL	NULL	NULL	NULL	NULL	1	1	NULL	NULL	NULL	NULL	NULL	NULL	NULL	NULL	NULL	NULL	NULL
1	0	0	0	1	NULL	NULL	0	0	0	0	0	NULL	NULL	0	0	0	0	0	1
2	0	0	0	1	NULL	NULL	0	0	0	1	0	NULL	NULL	0	0	0	0	0	NULL
3	0	0	0	1	NULL	NULL	0	0	0	0	0	NULL	NULL	0	0	0	0	0	0
4	0	0	0	1	NULL	NULL	0	0	0	0	0	NULL	NULL	0	0	0	0	0	NULL
5	0	1	1	1	NULL	NULL	0	0	0	0	0	NULL	NULL	0	0	0	0	0	NULL
6	0	0	0	1	NULL	NULL	0	0	0	0	0	NULL	NULL	0	0	0	0	0	NULL
7	0	0	0	1	NULL	NULL	0	0	0	0	0	NULL	NULL	0	0	0	0	0	NULL
8	0	0	0	1	NULL	NULL	0	0	0	0	1	NULL	NULL	0	0	0	0	0	NULL
9	0	0	0	1	NULL	NULL	0	0	1	0	0	NULL	NULL	0	0	0	0	0	NULL
10	0	0	0	1	NULL	NULL	0	0	0	0	0	NULL	NULL	0	0	0	0	0	NULL
11	0	0	0	1	NULL	NULL	0	0	0	0	0	NULL	NULL	0	0	0	0	0	NULL
12	0	0	0	1	NULL	NULL	0	0	1	0	0	NULL	NULL	0	0	0	0	0	NULL
13	0	0	0	1	NULL	NULL	0	0	0	0	0	NULL	NULL	0	0	0	0	0	NULL
14	0	0	0	1	NULL	NULL	0	0	0	0	0	NULL	NULL	0	0	0	0	0	NULL
15	0	0	0	1	NULL	NULL	0	0	0	0	0	NULL	NULL	0	0	0	0	0	NULL
16	0	0	0	1	NULL	NULL	0	0	0	0	0	NULL	NULL	0	0	0	0	0	NULL
17	0	0	0	1	NULL	NULL	0	0	0	0	0	NULL	NULL	0	0	0	0	0	NULL
18	0	0	0	1	NULL	NULL	0	0	0	0	0	NULL	NULL	0	0	0	0	0	NULL
19	0	0	0	1	NULL	NULL	0	0	0	0	0	NULL	NULL	0	0	0	0	0	NULL
20	0	0	0	1	NULL	NULL	0	0	0	0	0	NULL	NULL	0	0	0	0	0	NULL
21	0	0	0	1	NULL	NULL	0	0	1	1	0	NULL	NULL	0	0	0	0	0	NULL
22	0	0	0	1	NULL	NULL	0	0	0	1	0	NULL	NULL	0	0	0	0	0	NULL
23	0	0	0	1	NULL	NULL	0	0	0	0	0	NULL	NULL	0	0	0	0	0	NULL
24	0	0	0	0	NULL	NULL	0	0	0	0	0	NULL	NULL	0	0	1	0	0	NULL
25	0	0	0	0	NULL	NULL	0	0	0	0	0	NULL	NULL	0	1	0	0	0	NULL
26	0	0	0	0	NULL	NULL	0	0	0	0	0	NULL	NULL	1	0	0	0	0	NULL
27	0	0	0	0	NULL	NULL	0	0	0	0	0	NULL	NULL	0	0	1	0	0	NULL
28	0	0	0	1	NULL	NULL	0	0	0	0	0	NULL	NULL	0	0	0	0	1	NULL
29	0	0	0	1	NULL	NULL	0	0	0	0	0	NULL	NULL	0	0	0	0	0	NULL
30	0	0	0	0	NULL	NULL	0	0	0	0	0	NULL	NULL	0	0	0	0	0	NULL
31	0	0	0	0	NULL	NULL	0	0	0	0	0	NULL	NULL	0	0	0	0	0	NULL
100	0	0	0	1	NULL	NULL	0	0	0	0	0	NULL	NULL	0	0	0	0	0	NULL
Warnings:
Warning	1235	This version of MySQL doesn't yet support 'comparison of JSON in the IN operator'
Warning	1235	This version of MySQL doesn't yet support 'comparison of JSON in the IN operator'
Warning	3156	Invalid JSON value for CAST to DOUBLE from column j at row 2
Warning	3156	Invalid JSON value for CAST to DOUBLE from column j at row 35
Warning	3156	Invalid JSON value for CAST to DOUBLE from column j at row 36
Warning	3156	Invalid JSON value for CAST to DOUBLE from column j at row 37
Warning	3156	Invalid JSON value for CAST to DOUBLE from column j at row 38
Warning	3156	Invalid JSON value for CAST to DOUBLE from column j at row 41
Warning	3156	Invalid JSON value for CAST to DOUBLE from column j at row 55
Warning	3156	Invalid JSON value for CAST to DOUBLE from column j at row 56
Warning	3156	Invalid JSON value for CAST to DOUBLE from column j at row 57
Warning	3156	Invalid JSON value for CAST to DOUBLE from column j at row 58
Warning	3156	Invalid JSON value for CAST to DOUBLE from column j at row 59
Warning	3156	Invalid JSON value for CAST to DOUBLE from column j at row 60
Warning	3156	Invalid JSON value for CAST to DOUBLE from column j at row 61
Warning	3156	Invalid JSON value for CAST to DOUBLE from column j at row 62
Warning	3156	Invalid JSON value for CAST to DOUBLE from column j at row 63
Warning	3156	Invalid JSON value for CAST to DOUBLE from column j at row 64
Warning	3156	Invalid JSON value for CAST to DOUBLE from column j at row 65
SELECT i FROM t1
WHERE j = CAST(CAST(j AS CHAR CHARACTER SET 'utf8') AS JSON)
ORDER BY i;
i
1
2
3
4
5
6
7
8
9
10
11
12
13
14
15
16
17
18
19
20
21
22
23
28
29
100
SELECT CAST(NULL AS UNSIGNED) = CAST(NULL AS JSON);
CAST(NULL AS UNSIGNED) = CAST(NULL AS JSON)
NULL
SELECT CAST(NULL AS JSON) = CAST(NULL AS JSON);
CAST(NULL AS JSON) = CAST(NULL AS JSON)
NULL
SELECT CAST(NULL AS JSON) = NULL;
CAST(NULL AS JSON) = NULL
NULL
SELECT CAST(1 AS JSON) = NULL;
CAST(1 AS JSON) = NULL
NULL
SELECT CAST('true' AS JSON) = 1;
CAST('true' AS JSON) = 1
0
SELECT CAST('true' AS JSON) = true;
CAST('true' AS JSON) = true
1
SELECT a.i, b.i, a.j < b.j, a.j = b.j, a.j > b.j, a.j <> b.j, a.j <=> b.j
FROM t1 a, t1 b
ORDER BY a.i, b.i;
i	i	a.j < b.j	a.j = b.j	a.j > b.j	a.j <> b.j	a.j <=> b.j
0	0	NULL	NULL	NULL	NULL	1
0	1	NULL	NULL	NULL	NULL	0
0	2	NULL	NULL	NULL	NULL	0
0	3	NULL	NULL	NULL	NULL	0
0	4	NULL	NULL	NULL	NULL	0
0	5	NULL	NULL	NULL	NULL	0
0	6	NULL	NULL	NULL	NULL	0
0	7	NULL	NULL	NULL	NULL	0
0	8	NULL	NULL	NULL	NULL	0
0	9	NULL	NULL	NULL	NULL	0
0	10	NULL	NULL	NULL	NULL	0
0	11	NULL	NULL	NULL	NULL	0
0	12	NULL	NULL	NULL	NULL	0
0	13	NULL	NULL	NULL	NULL	0
0	14	NULL	NULL	NULL	NULL	0
0	15	NULL	NULL	NULL	NULL	0
0	16	NULL	NULL	NULL	NULL	0
0	17	NULL	NULL	NULL	NULL	0
0	18	NULL	NULL	NULL	NULL	0
0	19	NULL	NULL	NULL	NULL	0
0	20	NULL	NULL	NULL	NULL	0
0	21	NULL	NULL	NULL	NULL	0
0	22	NULL	NULL	NULL	NULL	0
0	23	NULL	NULL	NULL	NULL	0
0	24	NULL	NULL	NULL	NULL	0
0	25	NULL	NULL	NULL	NULL	0
0	26	NULL	NULL	NULL	NULL	0
0	27	NULL	NULL	NULL	NULL	0
0	28	NULL	NULL	NULL	NULL	0
0	29	NULL	NULL	NULL	NULL	0
0	30	NULL	NULL	NULL	NULL	0
0	31	NULL	NULL	NULL	NULL	0
0	100	NULL	NULL	NULL	NULL	0
1	0	NULL	NULL	NULL	NULL	0
1	1	0	1	0	0	1
1	2	1	0	0	1	0
1	3	1	0	0	1	0
1	4	1	0	0	1	0
1	5	0	0	1	1	0
1	6	1	0	0	1	0
1	7	1	0	0	1	0
1	8	0	0	1	1	0
1	9	0	0	1	1	0
1	10	0	0	1	1	0
1	11	0	0	1	1	0
1	12	0	0	1	1	0
1	13	0	0	1	1	0
1	14	0	0	1	1	0
1	15	0	0	1	1	0
1	16	0	0	1	1	0
1	17	0	0	1	1	0
1	18	0	0	1	1	0
1	19	0	0	1	1	0
1	20	0	0	1	1	0
1	21	0	0	1	1	0
1	22	0	0	1	1	0
1	23	1	0	0	1	0
1	24	1	0	0	1	0
1	25	1	0	0	1	0
1	26	1	0	0	1	0
1	27	1	0	0	1	0
1	28	1	0	0	1	0
1	29	1	0	0	1	0
1	30	1	0	0	1	0
1	31	1	0	0	1	0
1	100	1	0	0	1	0
2	0	NULL	NULL	NULL	NULL	0
2	1	0	0	1	1	0
2	2	0	1	0	0	1
2	3	0	0	1	1	0
2	4	1	0	0	1	0
2	5	0	0	1	1	0
2	6	1	0	0	1	0
2	7	1	0	0	1	0
2	8	0	0	1	1	0
2	9	0	0	1	1	0
2	10	0	0	1	1	0
2	11	0	0	1	1	0
2	12	0	0	1	1	0
2	13	0	0	1	1	0
2	14	0	0	1	1	0
2	15	0	0	1	1	0
2	16	0	0	1	1	0
2	17	0	0	1	1	0
2	18	0	0	1	1	0
2	19	0	0	1	1	0
2	20	0	0	1	1	0
2	21	0	0	1	1	0
2	22	0	0	1	1	0
2	23	0	0	1	1	0
2	24	1	0	0	1	0
2	25	1	0	0	1	0
2	26	1	0	0	1	0
2	27	1	0	0	1	0
2	28	0	0	1	1	0
2	29	0	0	1	1	0
2	30	1	0	0	1	0
2	31	1	0	0	1	0
2	100	0	0	1	1	0
3	0	NULL	NULL	NULL	NULL	0
3	1	0	0	1	1	0
3	2	1	0	0	1	0
3	3	0	1	0	0	1
3	4	1	0	0	1	0
3	5	0	0	1	1	0
3	6	1	0	0	1	0
3	7	1	0	0	1	0
3	8	0	0	1	1	0
3	9	0	0	1	1	0
3	10	0	0	1	1	0
3	11	0	0	1	1	0
3	12	0	0	1	1	0
3	13	0	0	1	1	0
3	14	0	0	1	1	0
3	15	0	0	1	1	0
3	16	0	0	1	1	0
3	17	0	0	1	1	0
3	18	0	0	1	1	0
3	19	0	0	1	1	0
3	20	0	0	1	1	0
3	21	0	0	1	1	0
3	22	0	0	1	1	0
3	23	1	0	0	1	0
3	24	1	0	0	1	0
3	25	1	0	0	1	0
3	26	1	0	0	1	0
3	27	1	0	0	1	0
3	28	0	0	1	1	0
3	29	1	0	0	1	0
3	30	1	0	0	1	0
3	31	1	0	0	1	0
3	100	0	0	1	1	0
4	0	NULL	NULL	NULL	NULL	0
4	1	0	0	1	1	0
4	2	0	0	1	1	0
4	3	0	0	1	1	0
4	4	0	1	0	0	1
4	5	0	0	1	1	0
4	6	1	0	0	1	0
4	7	1	0	0	1	0
4	8	0	0	1	1	0
4	9	0	0	1	1	0
4	10	0	0	1	1	0
4	11	0	0	1	1	0
4	12	0	0	1	1	0
4	13	0	0	1	1	0
4	14	0	0	1	1	0
4	15	0	0	1	1	0
4	16	0	0	1	1	0
4	17	0	0	1	1	0
4	18	0	0	1	1	0
4	19	0	0	1	1	0
4	20	0	0	1	1	0
4	21	0	0	1	1	0
4	22	0	0	1	1	0
4	23	0	0	1	1	0
4	24	1	0	0	1	0
4	25	1	0	0	1	0
4	26	1	0	0	1	0
4	27	1	0	0	1	0
4	28	0	0	1	1	0
4	29	0	0	1	1	0
4	30	1	0	0	1	0
4	31	1	0	0	1	0
4	100	0	0	1	1	0
5	0	NULL	NULL	NULL	NULL	0
5	1	1	0	0	1	0
5	2	1	0	0	1	0
5	3	1	0	0	1	0
5	4	1	0	0	1	0
5	5	0	1	0	0	1
5	6	1	0	0	1	0
5	7	1	0	0	1	0
5	8	0	0	1	1	0
5	9	0	0	1	1	0
5	10	0	0	1	1	0
5	11	0	0	1	1	0
5	12	0	0	1	1	0
5	13	0	0	1	1	0
5	14	0	0	1	1	0
5	15	0	0	1	1	0
5	16	0	0	1	1	0
5	17	0	0	1	1	0
5	18	0	0	1	1	0
5	19	0	0	1	1	0
5	20	0	0	1	1	0
5	21	0	0	1	1	0
5	22	1	0	0	1	0
5	23	1	0	0	1	0
5	24	1	0	0	1	0
5	25	1	0	0	1	0
5	26	1	0	0	1	0
5	27	1	0	0	1	0
5	28	1	0	0	1	0
5	29	1	0	0	1	0
5	30	1	0	0	1	0
5	31	1	0	0	1	0
5	100	1	0	0	1	0
6	0	NULL	NULL	NULL	NULL	0
6	1	0	0	1	1	0
6	2	0	0	1	1	0
6	3	0	0	1	1	0
6	4	0	0	1	1	0
6	5	0	0	1	1	0
6	6	0	1	0	0	1
6	7	0	0	1	1	0
6	8	0	0	1	1	0
6	9	0	0	1	1	0
6	10	0	0	1	1	0
6	11	0	0	1	1	0
6	12	0	0	1	1	0
6	13	0	0	1	1	0
6	14	0	0	1	1	0
6	15	0	0	1	1	0
6	16	0	0	1	1	0
6	17	0	0	1	1	0
6	18	0	0	1	1	0
6	19	0	0	1	1	0
6	20	0	0	1	1	0
6	21	0	0	1	1	0
6	22	0	0	1	1	0
6	23	0	0	1	1	0
6	24	1	0	0	1	0
6	25	1	0	0	1	0
6	26	1	0	0	1	0
6	27	1	0	0	1	0
6	28	0	0	1	1	0
6	29	0	0	1	1	0
6	30	1	0	0	1	0
6	31	1	0	0	1	0
6	100	0	0	1	1	0
7	0	NULL	NULL	NULL	NULL	0
7	1	0	0	1	1	0
7	2	0	0	1	1	0
7	3	0	0	1	1	0
7	4	0	0	1	1	0
7	5	0	0	1	1	0
7	6	1	0	0	1	0
7	7	0	1	0	0	1
7	8	0	0	1	1	0
7	9	0	0	1	1	0
7	10	0	0	1	1	0
7	11	0	0	1	1	0
7	12	0	0	1	1	0
7	13	0	0	1	1	0
7	14	0	0	1	1	0
7	15	0	0	1	1	0
7	16	0	0	1	1	0
7	17	0	0	1	1	0
7	18	0	0	1	1	0
7	19	0	0	1	1	0
7	20	0	0	1	1	0
7	21	0	0	1	1	0
7	22	0	0	1	1	0
7	23	0	0	1	1	0
7	24	1	0	0	1	0
7	25	1	0	0	1	0
7	26	1	0	0	1	0
7	27	1	0	0	1	0
7	28	0	0	1	1	0
7	29	0	0	1	1	0
7	30	1	0	0	1	0
7	31	1	0	0	1	0
7	100	0	0	1	1	0
8	0	NULL	NULL	NULL	NULL	0
8	1	1	0	0	1	0
8	2	1	0	0	1	0
8	3	1	0	0	1	0
8	4	1	0	0	1	0
8	5	1	0	0	1	0
8	6	1	0	0	1	0
8	7	1	0	0	1	0
8	8	0	1	0	0	1
8	9	1	0	0	1	0
8	10	1	0	0	1	0
8	11	1	0	0	1	0
8	12	1	0	0	1	0
8	13	1	0	0	1	0
8	14	1	0	0	1	0
8	15	1	0	0	1	0
8	16	1	0	0	1	0
8	17	1	0	0	1	0
8	18	1	0	0	1	0
8	19	1	0	0	1	0
8	20	1	0	0	1	0
8	21	1	0	0	1	0
8	22	1	0	0	1	0
8	23	1	0	0	1	0
8	24	1	0	0	1	0
8	25	1	0	0	1	0
8	26	1	0	0	1	0
8	27	1	0	0	1	0
8	28	1	0	0	1	0
8	29	1	0	0	1	0
8	30	1	0	0	1	0
8	31	1	0	0	1	0
8	100	1	0	0	1	0
9	0	NULL	NULL	NULL	NULL	0
9	1	1	0	0	1	0
9	2	1	0	0	1	0
9	3	1	0	0	1	0
9	4	1	0	0	1	0
9	5	1	0	0	1	0
9	6	1	0	0	1	0
9	7	1	0	0	1	0
9	8	0	0	1	1	0
9	9	0	1	0	0	1
9	10	1	0	0	1	0
9	11	1	0	0	1	0
9	12	1	0	0	1	0
9	13	0	0	1	1	0
9	14	0	0	1	1	0
9	15	1	0	0	1	0
9	16	1	0	0	1	0
9	17	0	0	1	1	0
9	18	0	0	1	1	0
9	19	1	0	0	1	0
9	20	1	0	0	1	0
9	21	1	0	0	1	0
9	22	1	0	0	1	0
9	23	1	0	0	1	0
9	24	1	0	0	1	0
9	25	1	0	0	1	0
9	26	1	0	0	1	0
9	27	1	0	0	1	0
9	28	1	0	0	1	0
9	29	1	0	0	1	0
9	30	1	0	0	1	0
9	31	1	0	0	1	0
9	100	1	0	0	1	0
10	0	NULL	NULL	NULL	NULL	0
10	1	1	0	0	1	0
10	2	1	0	0	1	0
10	3	1	0	0	1	0
10	4	1	0	0	1	0
10	5	1	0	0	1	0
10	6	1	0	0	1	0
10	7	1	0	0	1	0
10	8	0	0	1	1	0
10	9	0	0	1	1	0
10	10	0	1	0	0	1
10	11	1	0	0	1	0
10	12	1	0	0	1	0
10	13	0	0	1	1	0
10	14	0	0	1	1	0
10	15	1	0	0	1	0
10	16	1	0	0	1	0
10	17	0	0	1	1	0
10	18	0	0	1	1	0
10	19	1	0	0	1	0
10	20	1	0	0	1	0
10	21	1	0	0	1	0
10	22	1	0	0	1	0
10	23	1	0	0	1	0
10	24	1	0	0	1	0
10	25	1	0	0	1	0
10	26	1	0	0	1	0
10	27	1	0	0	1	0
10	28	1	0	0	1	0
10	29	1	0	0	1	0
10	30	1	0	0	1	0
10	31	1	0	0	1	0
10	100	1	0	0	1	0
11	0	NULL	NULL	NULL	NULL	0
11	1	1	0	0	1	0
11	2	1	0	0	1	0
11	3	1	0	0	1	0
11	4	1	0	0	1	0
11	5	1	0	0	1	0
11	6	1	0	0	1	0
11	7	1	0	0	1	0
11	8	0	0	1	1	0
11	9	0	0	1	1	0
11	10	0	0	1	1	0
11	11	0	1	0	0	1
11	12	1	0	0	1	0
11	13	0	0	1	1	0
11	14	0	0	1	1	0
11	15	1	0	0	1	0
11	16	1	0	0	1	0
11	17	0	0	1	1	0
11	18	0	0	1	1	0
11	19	1	0	0	1	0
11	20	1	0	0	1	0
11	21	0	0	1	1	0
11	22	1	0	0	1	0
11	23	1	0	0	1	0
11	24	1	0	0	1	0
11	25	1	0	0	1	0
11	26	1	0	0	1	0
11	27	1	0	0	1	0
11	28	1	0	0	1	0
11	29	1	0	0	1	0
11	30	1	0	0	1	0
11	31	1	0	0	1	0
11	100	1	0	0	1	0
12	0	NULL	NULL	NULL	NULL	0
12	1	1	0	0	1	0
12	2	1	0	0	1	0
12	3	1	0	0	1	0
12	4	1	0	0	1	0
12	5	1	0	0	1	0
12	6	1	0	0	1	0
12	7	1	0	0	1	0
12	8	0	0	1	1	0
12	9	0	0	1	1	0
12	10	0	0	1	1	0
12	11	0	0	1	1	0
12	12	0	1	0	0	1
12	13	0	0	1	1	0
12	14	0	0	1	1	0
12	15	1	0	0	1	0
12	16	1	0	0	1	0
12	17	0	0	1	1	0
12	18	0	0	1	1	0
12	19	1	0	0	1	0
12	20	1	0	0	1	0
12	21	0	0	1	1	0
12	22	1	0	0	1	0
12	23	1	0	0	1	0
12	24	1	0	0	1	0
12	25	1	0	0	1	0
12	26	1	0	0	1	0
12	27	1	0	0	1	0
12	28	1	0	0	1	0
12	29	1	0	0	1	0
12	30	1	0	0	1	0
12	31	1	0	0	1	0
12	100	1	0	0	1	0
13	0	NULL	NULL	NULL	NULL	0
13	1	1	0	0	1	0
13	2	1	0	0	1	0
13	3	1	0	0	1	0
13	4	1	0	0	1	0
13	5	1	0	0	1	0
13	6	1	0	0	1	0
13	7	1	0	0	1	0
13	8	0	0	1	1	0
13	9	1	0	0	1	0
13	10	1	0	0	1	0
13	11	1	0	0	1	0
13	12	1	0	0	1	0
13	13	0	1	0	0	1
13	14	0	0	1	1	0
13	15	1	0	0	1	0
13	16	1	0	0	1	0
13	17	0	0	1	1	0
13	18	0	0	1	1	0
13	19	1	0	0	1	0
13	20	1	0	0	1	0
13	21	1	0	0	1	0
13	22	1	0	0	1	0
13	23	1	0	0	1	0
13	24	1	0	0	1	0
13	25	1	0	0	1	0
13	26	1	0	0	1	0
13	27	1	0	0	1	0
13	28	1	0	0	1	0
13	29	1	0	0	1	0
13	30	1	0	0	1	0
13	31	1	0	0	1	0
13	100	1	0	0	1	0
14	0	NULL	NULL	NULL	NULL	0
14	1	1	0	0	1	0
14	2	1	0	0	1	0
14	3	1	0	0	1	0
14	4	1	0	0	1	0
14	5	1	0	0	1	0
14	6	1	0	0	1	0
14	7	1	0	0	1	0
14	8	0	0	1	1	0
14	9	1	0	0	1	0
14	10	1	0	0	1	0
14	11	1	0	0	1	0
14	12	1	0	0	1	0
14	13	1	0	0	1	0
14	14	0	1	0	0	1
14	15	1	0	0	1	0
14	16	1	0	0	1	0
14	17	0	0	1	1	0
14	18	0	0	1	1	0
14	19	1	0	0	1	0
14	20	1	0	0	1	0
14	21	1	0	0	1	0
14	22	1	0	0	1	0
14	23	1	0	0	1	0
14	24	1	0	0	1	0
14	25	1	0	0	1	0
14	26	1	0	0	1	0
14	27	1	0	0	1	0
14	28	1	0	0	1	0
14	29	1	0	0	1	0
14	30	1	0	0	1	0
14	31	1	0	0	1	0
14	100	1	0	0	1	0
15	0	NULL	NULL	NULL	NULL	0
15	1	1	0	0	1	0
15	2	1	0	0	1	0
15	3	1	0	0	1	0
15	4	1	0	0	1	0
15	5	1	0	0	1	0
15	6	1	0	0	1	0
15	7	1	0	0	1	0
15	8	0	0	1	1	0
15	9	0	0	1	1	0
15	10	0	0	1	1	0
15	11	0	0	1	1	0
15	12	0	0	1	1	0
15	13	0	0	1	1	0
15	14	0	0	1	1	0
15	15	0	1	0	0	1
15	16	1	0	0	1	0
15	17	0	0	1	1	0
15	18	0	0	1	1	0
15	19	1	0	0	1	0
15	20	1	0	0	1	0
15	21	0	0	1	1	0
15	22	1	0	0	1	0
15	23	1	0	0	1	0
15	24	1	0	0	1	0
15	25	1	0	0	1	0
15	26	1	0	0	1	0
15	27	1	0	0	1	0
15	28	1	0	0	1	0
15	29	1	0	0	1	0
15	30	1	0	0	1	0
15	31	1	0	0	1	0
15	100	1	0	0	1	0
16	0	NULL	NULL	NULL	NULL	0
16	1	1	0	0	1	0
16	2	1	0	0	1	0
16	3	1	0	0	1	0
16	4	1	0	0	1	0
16	5	1	0	0	1	0
16	6	1	0	0	1	0
16	7	1	0	0	1	0
16	8	0	0	1	1	0
16	9	0	0	1	1	0
16	10	0	0	1	1	0
16	11	0	0	1	1	0
16	12	0	0	1	1	0
16	13	0	0	1	1	0
16	14	0	0	1	1	0
16	15	0	0	1	1	0
16	16	0	1	0	0	1
16	17	0	0	1	1	0
16	18	0	0	1	1	0
16	19	1	0	0	1	0
16	20	1	0	0	1	0
16	21	0	0	1	1	0
16	22	1	0	0	1	0
16	23	1	0	0	1	0
16	24	1	0	0	1	0
16	25	1	0	0	1	0
16	26	1	0	0	1	0
16	27	1	0	0	1	0
16	28	1	0	0	1	0
16	29	1	0	0	1	0
16	30	1	0	0	1	0
16	31	1	0	0	1	0
16	100	1	0	0	1	0
17	0	NULL	NULL	NULL	NULL	0
17	1	1	0	0	1	0
17	2	1	0	0	1	0
17	3	1	0	0	1	0
17	4	1	0	0	1	0
17	5	1	0	0	1	0
17	6	1	0	0	1	0
17	7	1	0	0	1	0
17	8	0	0	1	1	0
17	9	1	0	0	1	0
17	10	1	0	0	1	0
17	11	1	0	0	1	0
17	12	1	0	0	1	0
17	13	1	0	0	1	0
17	14	1	0	0	1	0
17	15	1	0	0	1	0
17	16	1	0	0	1	0
17	17	0	1	0	0	1
17	18	0	0	1	1	0
17	19	1	0	0	1	0
17	20	1	0	0	1	0
17	21	1	0	0	1	0
17	22	1	0	0	1	0
17	23	1	0	0	1	0
17	24	1	0	0	1	0
17	25	1	0	0	1	0
17	26	1	0	0	1	0
17	27	1	0	0	1	0
17	28	1	0	0	1	0
17	29	1	0	0	1	0
17	30	1	0	0	1	0
17	31	1	0	0	1	0
17	100	1	0	0	1	0
18	0	NULL	NULL	NULL	NULL	0
18	1	1	0	0	1	0
18	2	1	0	0	1	0
18	3	1	0	0	1	0
18	4	1	0	0	1	0
18	5	1	0	0	1	0
18	6	1	0	0	1	0
18	7	1	0	0	1	0
18	8	0	0	1	1	0
18	9	1	0	0	1	0
18	10	1	0	0	1	0
18	11	1	0	0	1	0
18	12	1	0	0	1	0
18	13	1	0	0	1	0
18	14	1	0	0	1	0
18	15	1	0	0	1	0
18	16	1	0	0	1	0
18	17	1	0	0	1	0
18	18	0	1	0	0	1
18	19	1	0	0	1	0
18	20	1	0	0	1	0
18	21	1	0	0	1	0
18	22	1	0	0	1	0
18	23	1	0	0	1	0
18	24	1	0	0	1	0
18	25	1	0	0	1	0
18	26	1	0	0	1	0
18	27	1	0	0	1	0
18	28	1	0	0	1	0
18	29	1	0	0	1	0
18	30	1	0	0	1	0
18	31	1	0	0	1	0
18	100	1	0	0	1	0
19	0	NULL	NULL	NULL	NULL	0
19	1	1	0	0	1	0
19	2	1	0	0	1	0
19	3	1	0	0	1	0
19	4	1	0	0	1	0
19	5	1	0	0	1	0
19	6	1	0	0	1	0
19	7	1	0	0	1	0
19	8	0	0	1	1	0
19	9	0	0	1	1	0
19	10	0	0	1	1	0
19	11	0	0	1	1	0
19	12	0	0	1	1	0
19	13	0	0	1	1	0
19	14	0	0	1	1	0
19	15	0	0	1	1	0
19	16	0	0	1	1	0
19	17	0	0	1	1	0
19	18	0	0	1	1	0
19	19	0	1	0	0	1
19	20	1	0	0	1	0
19	21	0	0	1	1	0
19	22	1	0	0	1	0
19	23	1	0	0	1	0
19	24	1	0	0	1	0
19	25	1	0	0	1	0
19	26	1	0	0	1	0
19	27	1	0	0	1	0
19	28	1	0	0	1	0
19	29	1	0	0	1	0
19	30	1	0	0	1	0
19	31	1	0	0	1	0
19	100	1	0	0	1	0
20	0	NULL	NULL	NULL	NULL	0
20	1	1	0	0	1	0
20	2	1	0	0	1	0
20	3	1	0	0	1	0
20	4	1	0	0	1	0
20	5	1	0	0	1	0
20	6	1	0	0	1	0
20	7	1	0	0	1	0
20	8	0	0	1	1	0
20	9	0	0	1	1	0
20	10	0	0	1	1	0
20	11	0	0	1	1	0
20	12	0	0	1	1	0
20	13	0	0	1	1	0
20	14	0	0	1	1	0
20	15	0	0	1	1	0
20	16	0	0	1	1	0
20	17	0	0	1	1	0
20	18	0	0	1	1	0
20	19	0	0	1	1	0
20	20	0	1	0	0	1
20	21	0	0	1	1	0
20	22	1	0	0	1	0
20	23	1	0	0	1	0
20	24	1	0	0	1	0
20	25	1	0	0	1	0
20	26	1	0	0	1	0
20	27	1	0	0	1	0
20	28	1	0	0	1	0
20	29	1	0	0	1	0
20	30	1	0	0	1	0
20	31	1	0	0	1	0
20	100	1	0	0	1	0
21	0	NULL	NULL	NULL	NULL	0
21	1	1	0	0	1	0
21	2	1	0	0	1	0
21	3	1	0	0	1	0
21	4	1	0	0	1	0
21	5	1	0	0	1	0
21	6	1	0	0	1	0
21	7	1	0	0	1	0
21	8	0	0	1	1	0
21	9	0	0	1	1	0
21	10	0	0	1	1	0
21	11	1	0	0	1	0
21	12	1	0	0	1	0
21	13	0	0	1	1	0
21	14	0	0	1	1	0
21	15	1	0	0	1	0
21	16	1	0	0	1	0
21	17	0	0	1	1	0
21	18	0	0	1	1	0
21	19	1	0	0	1	0
21	20	1	0	0	1	0
21	21	0	1	0	0	1
21	22	1	0	0	1	0
21	23	1	0	0	1	0
21	24	1	0	0	1	0
21	25	1	0	0	1	0
21	26	1	0	0	1	0
21	27	1	0	0	1	0
21	28	1	0	0	1	0
21	29	1	0	0	1	0
21	30	1	0	0	1	0
21	31	1	0	0	1	0
21	100	1	0	0	1	0
22	0	NULL	NULL	NULL	NULL	0
22	1	1	0	0	1	0
22	2	1	0	0	1	0
22	3	1	0	0	1	0
22	4	1	0	0	1	0
22	5	0	0	1	1	0
22	6	1	0	0	1	0
22	7	1	0	0	1	0
22	8	0	0	1	1	0
22	9	0	0	1	1	0
22	10	0	0	1	1	0
22	11	0	0	1	1	0
22	12	0	0	1	1	0
22	13	0	0	1	1	0
22	14	0	0	1	1	0
22	15	0	0	1	1	0
22	16	0	0	1	1	0
22	17	0	0	1	1	0
22	18	0	0	1	1	0
22	19	0	0	1	1	0
22	20	0	0	1	1	0
22	21	0	0	1	1	0
22	22	0	1	0	0	1
22	23	1	0	0	1	0
22	24	1	0	0	1	0
22	25	1	0	0	1	0
22	26	1	0	0	1	0
22	27	1	0	0	1	0
22	28	1	0	0	1	0
22	29	1	0	0	1	0
22	30	1	0	0	1	0
22	31	1	0	0	1	0
22	100	1	0	0	1	0
23	0	NULL	NULL	NULL	NULL	0
23	1	0	0	1	1	0
23	2	1	0	0	1	0
23	3	0	0	1	1	0
23	4	1	0	0	1	0
23	5	0	0	1	1	0
23	6	1	0	0	1	0
23	7	1	0	0	1	0
23	8	0	0	1	1	0
23	9	0	0	1	1	0
23	10	0	0	1	1	0
23	11	0	0	1	1	0
23	12	0	0	1	1	0
23	13	0	0	1	1	0
23	14	0	0	1	1	0
23	15	0	0	1	1	0
23	16	0	0	1	1	0
23	17	0	0	1	1	0
23	18	0	0	1	1	0
23	19	0	0	1	1	0
23	20	0	0	1	1	0
23	21	0	0	1	1	0
23	22	0	0	1	1	0
23	23	0	1	0	0	1
23	24	1	0	0	1	0
23	25	1	0	0	1	0
23	26	1	0	0	1	0
23	27	1	0	0	1	0
23	28	0	0	1	1	0
23	29	0	1	0	0	1
23	30	1	0	0	1	0
23	31	1	0	0	1	0
23	100	0	0	1	1	0
24	0	NULL	NULL	NULL	NULL	0
24	1	0	0	1	1	0
24	2	0	0	1	1	0
24	3	0	0	1	1	0
24	4	0	0	1	1	0
24	5	0	0	1	1	0
24	6	0	0	1	1	0
24	7	0	0	1	1	0
24	8	0	0	1	1	0
24	9	0	0	1	1	0
24	10	0	0	1	1	0
24	11	0	0	1	1	0
24	12	0	0	1	1	0
24	13	0	0	1	1	0
24	14	0	0	1	1	0
24	15	0	0	1	1	0
24	16	0	0	1	1	0
24	17	0	0	1	1	0
24	18	0	0	1	1	0
24	19	0	0	1	1	0
24	20	0	0	1	1	0
24	21	0	0	1	1	0
24	22	0	0	1	1	0
24	23	0	0	1	1	0
24	24	0	1	0	0	1
24	25	0	0	1	1	0
24	26	0	0	1	1	0
24	27	0	1	0	0	1
24	28	0	0	1	1	0
24	29	0	0	1	1	0
24	30	1	0	0	1	0
24	31	1	0	0	1	0
24	100	0	0	1	1	0
25	0	NULL	NULL	NULL	NULL	0
25	1	0	0	1	1	0
25	2	0	0	1	1	0
25	3	0	0	1	1	0
25	4	0	0	1	1	0
25	5	0	0	1	1	0
25	6	0	0	1	1	0
25	7	0	0	1	1	0
25	8	0	0	1	1	0
25	9	0	0	1	1	0
25	10	0	0	1	1	0
25	11	0	0	1	1	0
25	12	0	0	1	1	0
25	13	0	0	1	1	0
25	14	0	0	1	1	0
25	15	0	0	1	1	0
25	16	0	0	1	1	0
25	17	0	0	1	1	0
25	18	0	0	1	1	0
25	19	0	0	1	1	0
25	20	0	0	1	1	0
25	21	0	0	1	1	0
25	22	0	0	1	1	0
25	23	0	0	1	1	0
25	24	1	0	0	1	0
25	25	0	1	0	0	1
25	26	0	0	1	1	0
25	27	1	0	0	1	0
25	28	0	0	1	1	0
25	29	0	0	1	1	0
25	30	1	0	0	1	0
25	31	1	0	0	1	0
25	100	0	0	1	1	0
26	0	NULL	NULL	NULL	NULL	0
26	1	0	0	1	1	0
26	2	0	0	1	1	0
26	3	0	0	1	1	0
26	4	0	0	1	1	0
26	5	0	0	1	1	0
26	6	0	0	1	1	0
26	7	0	0	1	1	0
26	8	0	0	1	1	0
26	9	0	0	1	1	0
26	10	0	0	1	1	0
26	11	0	0	1	1	0
26	12	0	0	1	1	0
26	13	0	0	1	1	0
26	14	0	0	1	1	0
26	15	0	0	1	1	0
26	16	0	0	1	1	0
26	17	0	0	1	1	0
26	18	0	0	1	1	0
26	19	0	0	1	1	0
26	20	0	0	1	1	0
26	21	0	0	1	1	0
26	22	0	0	1	1	0
26	23	0	0	1	1	0
26	24	1	0	0	1	0
26	25	1	0	0	1	0
26	26	0	1	0	0	1
26	27	1	0	0	1	0
26	28	0	0	1	1	0
26	29	0	0	1	1	0
26	30	1	0	0	1	0
26	31	1	0	0	1	0
26	100	0	0	1	1	0
27	0	NULL	NULL	NULL	NULL	0
27	1	0	0	1	1	0
27	2	0	0	1	1	0
27	3	0	0	1	1	0
27	4	0	0	1	1	0
27	5	0	0	1	1	0
27	6	0	0	1	1	0
27	7	0	0	1	1	0
27	8	0	0	1	1	0
27	9	0	0	1	1	0
27	10	0	0	1	1	0
27	11	0	0	1	1	0
27	12	0	0	1	1	0
27	13	0	0	1	1	0
27	14	0	0	1	1	0
27	15	0	0	1	1	0
27	16	0	0	1	1	0
27	17	0	0	1	1	0
27	18	0	0	1	1	0
27	19	0	0	1	1	0
27	20	0	0	1	1	0
27	21	0	0	1	1	0
27	22	0	0	1	1	0
27	23	0	0	1	1	0
27	24	0	1	0	0	1
27	25	0	0	1	1	0
27	26	0	0	1	1	0
27	27	0	1	0	0	1
27	28	0	0	1	1	0
27	29	0	0	1	1	0
27	30	1	0	0	1	0
27	31	1	0	0	1	0
27	100	0	0	1	1	0
28	0	NULL	NULL	NULL	NULL	0
28	1	0	0	1	1	0
28	2	1	0	0	1	0
28	3	1	0	0	1	0
28	4	1	0	0	1	0
28	5	0	0	1	1	0
28	6	1	0	0	1	0
28	7	1	0	0	1	0
28	8	0	0	1	1	0
28	9	0	0	1	1	0
28	10	0	0	1	1	0
28	11	0	0	1	1	0
28	12	0	0	1	1	0
28	13	0	0	1	1	0
28	14	0	0	1	1	0
28	15	0	0	1	1	0
28	16	0	0	1	1	0
28	17	0	0	1	1	0
28	18	0	0	1	1	0
28	19	0	0	1	1	0
28	20	0	0	1	1	0
28	21	0	0	1	1	0
28	22	0	0	1	1	0
28	23	1	0	0	1	0
28	24	1	0	0	1	0
28	25	1	0	0	1	0
28	26	1	0	0	1	0
28	27	1	0	0	1	0
28	28	0	1	0	0	1
28	29	1	0	0	1	0
28	30	1	0	0	1	0
28	31	1	0	0	1	0
28	100	0	0	1	1	0
29	0	NULL	NULL	NULL	NULL	0
29	1	0	0	1	1	0
29	2	1	0	0	1	0
29	3	0	0	1	1	0
29	4	1	0	0	1	0
29	5	0	0	1	1	0
29	6	1	0	0	1	0
29	7	1	0	0	1	0
29	8	0	0	1	1	0
29	9	0	0	1	1	0
29	10	0	0	1	1	0
29	11	0	0	1	1	0
29	12	0	0	1	1	0
29	13	0	0	1	1	0
29	14	0	0	1	1	0
29	15	0	0	1	1	0
29	16	0	0	1	1	0
29	17	0	0	1	1	0
29	18	0	0	1	1	0
29	19	0	0	1	1	0
29	20	0	0	1	1	0
29	21	0	0	1	1	0
29	22	0	0	1	1	0
29	23	0	1	0	0	1
29	24	1	0	0	1	0
29	25	1	0	0	1	0
29	26	1	0	0	1	0
29	27	1	0	0	1	0
29	28	0	0	1	1	0
29	29	0	1	0	0	1
29	30	1	0	0	1	0
29	31	1	0	0	1	0
29	100	0	0	1	1	0
30	0	NULL	NULL	NULL	NULL	0
30	1	0	0	1	1	0
30	2	0	0	1	1	0
30	3	0	0	1	1	0
30	4	0	0	1	1	0
30	5	0	0	1	1	0
30	6	0	0	1	1	0
30	7	0	0	1	1	0
30	8	0	0	1	1	0
30	9	0	0	1	1	0
30	10	0	0	1	1	0
30	11	0	0	1	1	0
30	12	0	0	1	1	0
30	13	0	0	1	1	0
30	14	0	0	1	1	0
30	15	0	0	1	1	0
30	16	0	0	1	1	0
30	17	0	0	1	1	0
30	18	0	0	1	1	0
30	19	0	0	1	1	0
30	20	0	0	1	1	0
30	21	0	0	1	1	0
30	22	0	0	1	1	0
30	23	0	0	1	1	0
30	24	0	0	1	1	0
30	25	0	0	1	1	0
30	26	0	0	1	1	0
30	27	0	0	1	1	0
30	28	0	0	1	1	0
30	29	0	0	1	1	0
30	30	0	1	0	0	1
30	31	1	0	0	1	0
30	100	0	0	1	1	0
31	0	NULL	NULL	NULL	NULL	0
31	1	0	0	1	1	0
31	2	0	0	1	1	0
31	3	0	0	1	1	0
31	4	0	0	1	1	0
31	5	0	0	1	1	0
31	6	0	0	1	1	0
31	7	0	0	1	1	0
31	8	0	0	1	1	0
31	9	0	0	1	1	0
31	10	0	0	1	1	0
31	11	0	0	1	1	0
31	12	0	0	1	1	0
31	13	0	0	1	1	0
31	14	0	0	1	1	0
31	15	0	0	1	1	0
31	16	0	0	1	1	0
31	17	0	0	1	1	0
31	18	0	0	1	1	0
31	19	0	0	1	1	0
31	20	0	0	1	1	0
31	21	0	0	1	1	0
31	22	0	0	1	1	0
31	23	0	0	1	1	0
31	24	0	0	1	1	0
31	25	0	0	1	1	0
31	26	0	0	1	1	0
31	27	0	0	1	1	0
31	28	0	0	1	1	0
31	29	0	0	1	1	0
31	30	0	0	1	1	0
31	31	0	1	0	0	1
31	100	0	0	1	1	0
100	0	NULL	NULL	NULL	NULL	0
100	1	0	0	1	1	0
100	2	1	0	0	1	0
100	3	1	0	0	1	0
100	4	1	0	0	1	0
100	5	0	0	1	1	0
100	6	1	0	0	1	0
100	7	1	0	0	1	0
100	8	0	0	1	1	0
100	9	0	0	1	1	0
100	10	0	0	1	1	0
100	11	0	0	1	1	0
100	12	0	0	1	1	0
100	13	0	0	1	1	0
100	14	0	0	1	1	0
100	15	0	0	1	1	0
100	16	0	0	1	1	0
100	17	0	0	1	1	0
100	18	0	0	1	1	0
100	19	0	0	1	1	0
100	20	0	0	1	1	0
100	21	0	0	1	1	0
100	22	0	0	1	1	0
100	23	1	0	0	1	0
100	24	1	0	0	1	0
100	25	1	0	0	1	0
100	26	1	0	0	1	0
100	27	1	0	0	1	0
100	28	1	0	0	1	0
100	29	1	0	0	1	0
100	30	1	0	0	1	0
100	31	1	0	0	1	0
100	100	0	1	0	0	1
# Verify that the index on the int column is not used when
# comparing the int column to a JSON column. The two columns
# should be compared using the JSON comparator.
CREATE TABLE t2(i int, j json);
CREATE INDEX t2_i ON t2(i);
INSERT INTO t2 values (1, CAST(1 AS JSON));
INSERT INTO t2 values (1, CAST('"1"' AS JSON));
ANALYZE TABLE t2;
Table	Op	Msg_type	Msg_text
test.t2	analyze	status	OK
EXPLAIN SELECT * FROM t2 where i = j;
id	select_type	table	partitions	type	possible_keys	key	key_len	ref	rows	filtered	Extra
1	SIMPLE	t2	NULL	ALL	NULL	NULL	NULL	NULL	2	50.00	Using where
Warnings:
Note	1003	/* select#1 */ select `test`.`t2`.`i` AS `i`,`test`.`t2`.`j` AS `j` from `test`.`t2` where (`test`.`t2`.`i` = `test`.`t2`.`j`)
SELECT * FROM t2 where i = j;
i	j
1	1
DROP TABLE t2;
CREATE TABLE numbers(id INT NOT NULL AUTO_INCREMENT,
rank INT,
j JSON,
PRIMARY KEY(id));
INSERT INTO numbers(rank, j) VALUES
(1, '-1e100'),
(2, '-1e65'),
# smallest DECIMAL (negative with 65 digits)
(3, CAST(-99999999999999999999999999999999999999999999999999999999999999999 AS JSON)),
(4, CAST(-9223372036854776001 AS JSON)),
(5, CAST(-9223372036854776000 AS JSON)),
# closest DOUBLE approximation of the smallest SIGNED BIGINT
(5 /* same rank as previous */, '-9.223372036854776e18'),
(6, CAST(-9223372036854775999 AS JSON)),
(7, CAST(-9223372036854775809 AS JSON)),   # smallest SIGNED BIGINT - 1
(8, CAST(-9223372036854775808 AS JSON)),   # smallest SIGNED BIGINT
(9, CAST(-9223372036854775807 AS JSON)),   # smallest SIGNED BIGINT + 1
(10, '-1e-50'),                  # close to zero, fits in a DECIMAL
(11, '-1.2345678901234e-71'),    # has to be truncated to fit in a DECIMAL
(12, CAST(-0.000000000000000000000000000000000000000000000000000000000000000000000012 AS JSON)),
(12 /* same rank as previous */, '-1.2e-71'),
(13, '-1.0345678901234e-71'),    # has to be truncated to fit in a DECIMAL
(14, '-1e-100'),                 # too close to zero to fit in a DECIMAL
(15, '0'),
(15 /* same rank as previous */, '0.0'),
(15 /* same rank as previous */, '-0.0'),
(15 /* same rank as previous */, CAST(0.0 AS JSON)),
(15 /* same rank as previous */, CAST(CAST(-0.0e0 AS DECIMAL) AS JSON)),
(16, '1e-100'),                  # too close to zero to fit in a DECIMAL
(17, '1.0345678901234e-71'),     # has to be truncated to fit in a DECIMAL
(18, CAST(0.000000000000000000000000000000000000000000000000000000000000000000000012 AS JSON)),
(18 /* same rank as previous */, '1.2e-71'),
(19, '1.2345678901234e-71'),     # has to be truncated to fit in a DECIMAL
(20, '1e-50'),                   # close to zero, fits in a DECIMAL
(21, CAST(9223372036854775806 AS JSON)),    # largest SIGNED BIGINT - 1
(22, CAST(9223372036854775807 AS JSON)),    # largest SIGNED BIGINT
(23, CAST(9223372036854775808 AS JSON)),    # largest SIGNED BIGINT + 1
(24, CAST(9223372036854775999 AS JSON)),
# closest DOUBLE approximation of the largest SIGNED BIGINT
(25, '9.223372036854776e18'),
(25 /* same rank as previous */, CAST(9223372036854776000 AS JSON)),
(26, CAST(9223372036854776001 AS JSON)),
(27, CAST(18446744073709551614 AS JSON)),   # largest UNSIGNED BIGINT - 1
(28, CAST(18446744073709551615 AS JSON)),   # largest UNSIGNED BIGINT
(29, CAST(18446744073709551616 AS JSON)),   # largest UNSIGNED BIGINT + 1
# Gets converted to the closest DOUBLE approximation of UNSIGNED BIGINT + 1
# by the JSON parser
(30, '18446744073709551616'),
# biggest DECIMAL (65 digits)
(31, CAST(99999999999999999999999999999999999999999999999999999999999999999 AS JSON)),
(32, CAST('1e65' AS JSON)),
(33, CAST('1e100' AS JSON));
SELECT *, JSON_TYPE(j) FROM numbers ORDER BY id;
id	rank	j	JSON_TYPE(j)
1	1	-1e100	DOUBLE
2	2	-1e65	DOUBLE
3	3	-99999999999999999999999999999999999999999999999999999999999999999	DECIMAL
4	4	-9223372036854776001	DECIMAL
5	5	-9223372036854776000	DECIMAL
6	5	-9.223372036854776e18	DOUBLE
7	6	-9223372036854775999	DECIMAL
8	7	-9223372036854775809	DECIMAL
9	8	-9223372036854775808	INTEGER
10	9	-9223372036854775807	INTEGER
11	10	-9.999999999999999e-51	DOUBLE
12	11	-1.2345678901233999e-71	DOUBLE
13	12	-0.000000000000000000000000000000000000000000000000000000000000000000000012	DECIMAL
14	12	-1.2e-71	DOUBLE
15	13	-1.0345678901234e-71	DOUBLE
16	14	-1e-100	DOUBLE
17	15	0	INTEGER
18	15	0	DOUBLE
19	15	-0	DOUBLE
20	15	0.0	DECIMAL
21	15	0	DECIMAL
22	16	1e-100	DOUBLE
23	17	1.0345678901234e-71	DOUBLE
24	18	0.000000000000000000000000000000000000000000000000000000000000000000000012	DECIMAL
25	18	1.2e-71	DOUBLE
26	19	1.2345678901233999e-71	DOUBLE
27	20	9.999999999999999e-51	DOUBLE
28	21	9223372036854775806	INTEGER
29	22	9223372036854775807	INTEGER
30	23	9223372036854775808	UNSIGNED INTEGER
31	24	9223372036854775999	UNSIGNED INTEGER
32	25	9.223372036854776e18	DOUBLE
33	25	9223372036854776000	UNSIGNED INTEGER
34	26	9223372036854776001	UNSIGNED INTEGER
35	27	18446744073709551614	UNSIGNED INTEGER
36	28	18446744073709551615	UNSIGNED INTEGER
37	29	18446744073709551616	DECIMAL
38	30	1.8446744073709552e19	DOUBLE
39	31	99999999999999999999999999999999999999999999999999999999999999999	DECIMAL
40	32	1e65	DOUBLE
41	33	1e100	DOUBLE
SELECT a.j, b.j, a.j < b.j, a.j = b.j, a.j > b.j, a.j <=> b.j
FROM numbers a, numbers b
WHERE ((a.j < b.j) <> (a.rank < b.rank)) OR
((a.j = b.j) <> (a.rank = b.rank)) OR
((a.j > b.j) <> (a.rank > b.rank)) OR
((a.j <=> b.j) <> (a.rank <=> b.rank));
j	j	a.j < b.j	a.j = b.j	a.j > b.j	a.j <=> b.j
DROP TABLE numbers;
SELECT CAST(0.0e0 AS JSON) = -0.0e0;
CAST(0.0e0 AS JSON) = -0.0e0
1
SELECT CAST(CAST(0 AS DECIMAL) AS JSON) = CAST(-0.0e0 AS DECIMAL);
CAST(CAST(0 AS DECIMAL) AS JSON) = CAST(-0.0e0 AS DECIMAL)
1
SELECT CAST(0.0e0 AS JSON) = CAST(-0.0e0 AS DECIMAL);
CAST(0.0e0 AS JSON) = CAST(-0.0e0 AS DECIMAL)
1
SELECT CAST(CAST(0 AS DECIMAL) AS JSON) = -0.0e0;
CAST(CAST(0 AS DECIMAL) AS JSON) = -0.0e0
1
SELECT CAST(CAST(0 AS SIGNED) AS JSON) = -0.0e0;
CAST(CAST(0 AS SIGNED) AS JSON) = -0.0e0
1
SELECT CAST(CAST(0 AS SIGNED) AS JSON) = CAST(-0.0e0 AS DECIMAL);
CAST(CAST(0 AS SIGNED) AS JSON) = CAST(-0.0e0 AS DECIMAL)
1
SELECT CAST(CAST(0 AS UNSIGNED) AS JSON) = -0.0e0;
CAST(CAST(0 AS UNSIGNED) AS JSON) = -0.0e0
1
SELECT CAST(CAST(0 AS UNSIGNED) AS JSON) = CAST(-0.0e0 AS DECIMAL);
CAST(CAST(0 AS UNSIGNED) AS JSON) = CAST(-0.0e0 AS DECIMAL)
1
CREATE TABLE t(txt TEXT);
INSERT INTO t VALUES ('');
SELECT COUNT(*) FROM t WHERE JSON_EXTRACT(txt, '$') = 5;
ERROR 22032: Invalid JSON text in argument 1 to function json_extract: "The document is empty." at position 0.
SELECT COUNT(*) FROM t WHERE 5 = JSON_EXTRACT(txt, '$');
ERROR 22032: Invalid JSON text in argument 1 to function json_extract: "The document is empty." at position 0.
DROP TABLE t;
#
# WL#8539 - Ordering of scalar JSON values
#
CREATE TABLE timestamps (ts TIMESTAMP(6));
INSERT INTO timestamps VALUES
('2000-01-01 00:00:00'),
('2000-01-01 00:00:00.01'),
('2000-01-01 00:00:00.001'),
('2000-01-01 00:00:00.002'),
('2000-01-01 00:00:00.02'),
('2000-01-01 23:59:59.999999'),
('2000-01-02 00:00:00'),
('2000-02-01 00:00:00'),
('2010-12-02 01:00:00'),
('2010-12-02 01:02:00'),
('2010-12-02 01:02:03'),
('2010-12-02 02:01:00'),
('1970-01-02 00:00:01'),
('1970-01-02 00:00:01.000001');
SELECT * FROM timestamps ORDER BY CAST(ts AS JSON);
ts
1970-01-02 00:00:01.000000
1970-01-02 00:00:01.000001
2000-01-01 00:00:00.000000
2000-01-01 00:00:00.001000
2000-01-01 00:00:00.002000
2000-01-01 00:00:00.010000
2000-01-01 00:00:00.020000
2000-01-01 23:59:59.999999
2000-01-02 00:00:00.000000
2000-02-01 00:00:00.000000
2010-12-02 01:00:00.000000
2010-12-02 01:02:00.000000
2010-12-02 01:02:03.000000
2010-12-02 02:01:00.000000
CREATE TABLE datetimes (dt DATETIME(6));
INSERT INTO datetimes SELECT ts FROM timestamps;
INSERT INTO datetimes VALUES
('1960-01-02 03:04:05'),
('1960-01-02 03:04:06'),
('1000-01-01 00:00:00'),
('9999-12-31 23:59:59.999999');
SELECT * FROM datetimes ORDER BY CAST(dt AS JSON);
dt
1000-01-01 00:00:00.000000
1960-01-02 03:04:05.000000
1960-01-02 03:04:06.000000
1970-01-02 00:00:01.000000
1970-01-02 00:00:01.000001
2000-01-01 00:00:00.000000
2000-01-01 00:00:00.001000
2000-01-01 00:00:00.002000
2000-01-01 00:00:00.010000
2000-01-01 00:00:00.020000
2000-01-01 23:59:59.999999
2000-01-02 00:00:00.000000
2000-02-01 00:00:00.000000
2010-12-02 01:00:00.000000
2010-12-02 01:02:00.000000
2010-12-02 01:02:03.000000
2010-12-02 02:01:00.000000
9999-12-31 23:59:59.999999
CREATE TABLE times (t TIME(6));
INSERT INTO times SELECT DISTINCT TIME(dt) FROM datetimes;
INSERT INTO times VALUES
('-838:59:59'),
('838:59:59'),
('-00:00:00.000001'),
('-00:00:00'),
('24:00:00'),
('-12:00:00'),
('-24:00:00');
SELECT * FROM times ORDER BY CAST(t AS JSON);
t
-838:59:59.000000
-24:00:00.000000
-12:00:00.000000
-00:00:00.000001
00:00:00.000000
00:00:00.000000
00:00:00.001000
00:00:00.002000
00:00:00.010000
00:00:00.020000
00:00:01.000000
00:00:01.000001
01:00:00.000000
01:02:00.000000
01:02:03.000000
02:01:00.000000
03:04:05.000000
03:04:06.000000
23:59:59.999999
24:00:00.000000
838:59:59.000000
CREATE TABLE dates(d DATE);
INSERT INTO dates SELECT DISTINCT DATE(dt) FROM datetimes;
CREATE TABLE signed_integers(i BIGINT);
INSERT INTO signed_integers VALUES
(0), (1), (2), (3), (4), (5), (10), (11), (12), (20), (21), (22),
(99), (100), (101), (999), (1000), (1001),
(9223372036854775806), (9223372036854775807);
INSERT INTO signed_integers SELECT -i FROM signed_integers;
INSERT INTO signed_integers VALUES (-9223372036854775808);
SELECT * FROM signed_integers ORDER BY CAST(i AS JSON);
i
-9223372036854775808
-9223372036854775807
-9223372036854775806
-1001
-1000
-999
-101
-100
-99
-22
-21
-20
-12
-11
-10
-5
-4
-3
-2
-1
0
0
1
2
3
4
5
10
11
12
20
21
22
99
100
101
999
1000
1001
9223372036854775806
9223372036854775807
CREATE TABLE unsigned_integers(i BIGINT UNSIGNED);
INSERT INTO unsigned_integers SELECT i FROM signed_integers where i >= 0;
INSERT INTO unsigned_integers VALUES
(9223372036854775808), (18446744073709551614), (18446744073709551615);
SELECT * FROM unsigned_integers ORDER BY CAST(i AS JSON);
i
0
0
1
2
3
4
5
10
11
12
20
21
22
99
100
101
999
1000
1001
9223372036854775806
9223372036854775807
9223372036854775808
18446744073709551614
18446744073709551615
CREATE TABLE decimals (d DECIMAL(25,3));
INSERT INTO decimals SELECT i FROM signed_integers;
INSERT INTO decimals SELECT i FROM unsigned_integers;
INSERT INTO decimals VALUES
(9223372036854776000), (-9223372036854776000),
(9223372036854776001), (-9223372036854776001),
(3.13), (3.14), (3.15), (-3.13), (-3.14), (-3.15),
(3.131), (3.141), (3.151), (-3.131), (-3.141), (-3.151),
(3.129), (3.139), (3.149), (-3.129), (-3.139), (-3.149),
(0.1), (0.01), (0.001), (-0.1), (-0.01), (-0.001);
SELECT * FROM decimals ORDER BY CAST(d AS JSON);
d
-9223372036854776001.000
-9223372036854776000.000
-9223372036854775808.000
-9223372036854775807.000
-9223372036854775806.000
-1001.000
-1000.000
-999.000
-101.000
-100.000
-99.000
-22.000
-21.000
-20.000
-12.000
-11.000
-10.000
-5.000
-4.000
-3.151
-3.150
-3.149
-3.141
-3.140
-3.139
-3.131
-3.130
-3.129
-3.000
-2.000
-1.000
-0.100
-0.010
-0.001
0.000
0.000
0.000
0.000
0.001
0.010
0.100
1.000
1.000
2.000
2.000
3.000
3.000
3.129
3.130
3.131
3.139
3.140
3.141
3.149
3.150
3.151
4.000
4.000
5.000
5.000
10.000
10.000
11.000
11.000
12.000
12.000
20.000
20.000
21.000
21.000
22.000
22.000
99.000
99.000
100.000
100.000
101.000
101.000
999.000
999.000
1000.000
1000.000
1001.000
1001.000
9223372036854775806.000
9223372036854775806.000
9223372036854775807.000
9223372036854775807.000
9223372036854775808.000
9223372036854776000.000
9223372036854776001.000
18446744073709551614.000
18446744073709551615.000
CREATE TABLE doubles (d DOUBLE);
INSERT INTO doubles SELECT d FROM decimals;
INSERT INTO doubles VALUES
(1.5E-200), (1.5E200), (-1.5E-200), (-1.5E200),
(-1E-323), (-1E-322), (-1E-321), (1E-323), (1E-322), (1E-321),
(-1E308), (-1E307), (-1E306), (1E308), (1E307), (1E306);
SELECT * FROM doubles ORDER BY CAST(d AS JSON);
d
-1e308
-1e307
-1e306
-1.5e200
-9.223372036854776e18
-9.223372036854776e18
-9.223372036854776e18
-9.223372036854776e18
-9.223372036854776e18
-1001
-1000
-999
-101
-100
-99
-22
-21
-20
-12
-11
-10
-5
-4
-3.151
-3.15
-3.149
-3.141
-3.14
-3.139
-3.131
-3.13
-3.129
-3
-2
-1
-0.1
-0.01
-0.001
-1.5e-200
-1e-321
-1e-322
-1e-323
0
0
0
0
1e-323
1e-322
1e-321
1.5e-200
0.001
0.01
0.1
1
1
2
2
3
3
3.129
3.13
3.131
3.139
3.14
3.141
3.149
3.15
3.151
4
4
5
5
10
10
11
11
12
12
20
20
21
21
22
22
99
99
100
100
101
101
999
999
1000
1000
1001
1001
9.223372036854776e18
9.223372036854776e18
9.223372036854776e18
9.223372036854776e18
9.223372036854776e18
9.223372036854776e18
9.223372036854776e18
1.8446744073709552e19
1.8446744073709552e19
1.5e200
1e306
1e307
1e308
CREATE TABLE t(id INT PRIMARY KEY AUTO_INCREMENT, j JSON);
INSERT INTO t(j) SELECT CAST(ts AS JSON) FROM timestamps ORDER BY ts;
INSERT INTO t(j) SELECT CAST(dt AS JSON) FROM datetimes ORDER BY dt;
INSERT INTO t(j) SELECT CAST(t AS JSON) FROM times ORDER BY t;
INSERT INTO t(j) SELECT CAST(d AS JSON) FROM dates ORDER BY d;
INSERT INTO t(j) SELECT CAST(i AS JSON) FROM signed_integers ORDER BY i;
INSERT INTO t(j) SELECT CAST(i AS JSON) FROM unsigned_integers ORDER BY i;
INSERT INTO t(j) SELECT CAST(d AS JSON) FROM decimals ORDER BY d;
INSERT INTO t(j) SELECT CAST(d AS JSON) FROM doubles ORDER BY d;
INSERT INTO t(j) VALUES
(NULL), (NULL), ('true'), ('false'), ('null'),
('"abc"'), ('""'), ('"abcd"'), ('"bc"'),
('"abc\\u0000\\u0000"'), ('"abc\\u0000"'),
('0.0'), ('-0.0'), ('9223372036854776000'),
('1e-15'), ('1.1e-15'), ('1e-16'), ('1.1e-16'),
(CAST(0.000000000000001 AS JSON)),
(CAST(0.0000000000000011 AS JSON)),
(CAST(0.0000000000000001 AS JSON)),
(CAST(0.00000000000000011 AS JSON)),
(CAST(0.0 AS JSON)),
(CAST(-999999999999999999999999999999999999999999999999999999999999999999999999999999999 AS JSON)),
(CAST(-999999999999999999999999999999999999999999999999999999999999999999999999999999998 AS JSON)),
(CAST(-999999999999999999999999999999999999999999999999999999999999999999999999999999997 AS JSON)),
(CAST(999999999999999999999999999999999999999999999999999999999999999999999999999999997 AS JSON)),
(CAST(999999999999999999999999999999999999999999999999999999999999999999999999999999998 AS JSON)),
(CAST(999999999999999999999999999999999999999999999999999999999999999999999999999999999 AS JSON)),
(CAST(-1E81 AS JSON)),
(CAST(-9.99E80 AS JSON)),
(CAST(9.99E80 AS JSON)),
(CAST(1E81 AS JSON)),
(JSON_ARRAY('an array')),
(JSON_ARRAY('another array')),
(JSON_OBJECT('an', 'object')),
(JSON_OBJECT('another', 'object')),
(CAST(ST_GeomFromText('POINT(0 0)') AS JSON)),
(CAST(ST_GeomFromText('POINT(0 1)') AS JSON)),
(CAST(CAST('1234abcd' AS BINARY) AS JSON));
SELECT j, JSON_TYPE(j) AS tp FROM t ORDER BY j, id;
j	tp
NULL	NULL
NULL	NULL
null	NULL
-1e308	DOUBLE
-1e307	DOUBLE
-1e306	DOUBLE
-1.5e200	DOUBLE
-1e81	DOUBLE
-999999999999999999999999999999999999999999999999999999999999999999999999999999999	DECIMAL
-999999999999999999999999999999999999999999999999999999999999999999999999999999998	DECIMAL
-999999999999999999999999999999999999999999999999999999999999999999999999999999997	DECIMAL
-9.99e80	DOUBLE
-9223372036854776001.000	DECIMAL
-9223372036854776000.000	DECIMAL
-9.223372036854776e18	DOUBLE
-9.223372036854776e18	DOUBLE
-9.223372036854776e18	DOUBLE
-9.223372036854776e18	DOUBLE
-9.223372036854776e18	DOUBLE
-9223372036854775808	INTEGER
-9223372036854775808.000	DECIMAL
-9223372036854775807	INTEGER
-9223372036854775807.000	DECIMAL
-9223372036854775806	INTEGER
-9223372036854775806.000	DECIMAL
-1001	INTEGER
-1001.000	DECIMAL
-1001	DOUBLE
-1000	INTEGER
-1000.000	DECIMAL
-1000	DOUBLE
-999	INTEGER
-999.000	DECIMAL
-999	DOUBLE
-101	INTEGER
-101.000	DECIMAL
-101	DOUBLE
-100	INTEGER
-100.000	DECIMAL
-100	DOUBLE
-99	INTEGER
-99.000	DECIMAL
-99	DOUBLE
-22	INTEGER
-22.000	DECIMAL
-22	DOUBLE
-21	INTEGER
-21.000	DECIMAL
-21	DOUBLE
-20	INTEGER
-20.000	DECIMAL
-20	DOUBLE
-12	INTEGER
-12.000	DECIMAL
-12	DOUBLE
-11	INTEGER
-11.000	DECIMAL
-11	DOUBLE
-10	INTEGER
-10.000	DECIMAL
-10	DOUBLE
-5	INTEGER
-5.000	DECIMAL
-5	DOUBLE
-4	INTEGER
-4.000	DECIMAL
-4	DOUBLE
-3.151	DECIMAL
-3.151	DOUBLE
-3.150	DECIMAL
-3.15	DOUBLE
-3.149	DECIMAL
-3.149	DOUBLE
-3.141	DECIMAL
-3.141	DOUBLE
-3.140	DECIMAL
-3.14	DOUBLE
-3.139	DECIMAL
-3.139	DOUBLE
-3.131	DECIMAL
-3.131	DOUBLE
-3.130	DECIMAL
-3.13	DOUBLE
-3.129	DECIMAL
-3.129	DOUBLE
-3	INTEGER
-3.000	DECIMAL
-3	DOUBLE
-2	INTEGER
-2.000	DECIMAL
-2	DOUBLE
-1	INTEGER
-1.000	DECIMAL
-1	DOUBLE
-0.100	DECIMAL
-0.1	DOUBLE
-0.010	DECIMAL
-0.01	DOUBLE
-0.001	DECIMAL
-0.001	DOUBLE
-1.5e-200	DOUBLE
-1e-321	DOUBLE
-1e-322	DOUBLE
-1e-323	DOUBLE
0	INTEGER
0	INTEGER
0	UNSIGNED INTEGER
0	UNSIGNED INTEGER
0.000	DECIMAL
0.000	DECIMAL
0.000	DECIMAL
0.000	DECIMAL
0	DOUBLE
0	DOUBLE
0	DOUBLE
0	DOUBLE
0	DOUBLE
-0	DOUBLE
0.0	DECIMAL
1e-323	DOUBLE
1e-322	DOUBLE
1e-321	DOUBLE
1.5e-200	DOUBLE
1e-16	DOUBLE
0.0000000000000001	DECIMAL
1.1e-16	DOUBLE
0.00000000000000011	DECIMAL
0.000000000000001	DOUBLE
0.000000000000001	DECIMAL
0.0000000000000011	DOUBLE
0.0000000000000011	DECIMAL
0.001	DECIMAL
0.001	DOUBLE
0.010	DECIMAL
0.01	DOUBLE
0.100	DECIMAL
0.1	DOUBLE
1	INTEGER
1	UNSIGNED INTEGER
1.000	DECIMAL
1.000	DECIMAL
1	DOUBLE
1	DOUBLE
2	INTEGER
2	UNSIGNED INTEGER
2.000	DECIMAL
2.000	DECIMAL
2	DOUBLE
2	DOUBLE
3	INTEGER
3	UNSIGNED INTEGER
3.000	DECIMAL
3.000	DECIMAL
3	DOUBLE
3	DOUBLE
3.129	DECIMAL
3.129	DOUBLE
3.130	DECIMAL
3.13	DOUBLE
3.131	DECIMAL
3.131	DOUBLE
3.139	DECIMAL
3.139	DOUBLE
3.140	DECIMAL
3.14	DOUBLE
3.141	DECIMAL
3.141	DOUBLE
3.149	DECIMAL
3.149	DOUBLE
3.150	DECIMAL
3.15	DOUBLE
3.151	DECIMAL
3.151	DOUBLE
4	INTEGER
4	UNSIGNED INTEGER
4.000	DECIMAL
4.000	DECIMAL
4	DOUBLE
4	DOUBLE
5	INTEGER
5	UNSIGNED INTEGER
5.000	DECIMAL
5.000	DECIMAL
5	DOUBLE
5	DOUBLE
10	INTEGER
10	UNSIGNED INTEGER
10.000	DECIMAL
10.000	DECIMAL
10	DOUBLE
10	DOUBLE
11	INTEGER
11	UNSIGNED INTEGER
11.000	DECIMAL
11.000	DECIMAL
11	DOUBLE
11	DOUBLE
12	INTEGER
12	UNSIGNED INTEGER
12.000	DECIMAL
12.000	DECIMAL
12	DOUBLE
12	DOUBLE
20	INTEGER
20	UNSIGNED INTEGER
20.000	DECIMAL
20.000	DECIMAL
20	DOUBLE
20	DOUBLE
21	INTEGER
21	UNSIGNED INTEGER
21.000	DECIMAL
21.000	DECIMAL
21	DOUBLE
21	DOUBLE
22	INTEGER
22	UNSIGNED INTEGER
22.000	DECIMAL
22.000	DECIMAL
22	DOUBLE
22	DOUBLE
99	INTEGER
99	UNSIGNED INTEGER
99.000	DECIMAL
99.000	DECIMAL
99	DOUBLE
99	DOUBLE
100	INTEGER
100	UNSIGNED INTEGER
100.000	DECIMAL
100.000	DECIMAL
100	DOUBLE
100	DOUBLE
101	INTEGER
101	UNSIGNED INTEGER
101.000	DECIMAL
101.000	DECIMAL
101	DOUBLE
101	DOUBLE
999	INTEGER
999	UNSIGNED INTEGER
999.000	DECIMAL
999.000	DECIMAL
999	DOUBLE
999	DOUBLE
1000	INTEGER
1000	UNSIGNED INTEGER
1000.000	DECIMAL
1000.000	DECIMAL
1000	DOUBLE
1000	DOUBLE
1001	INTEGER
1001	UNSIGNED INTEGER
1001.000	DECIMAL
1001.000	DECIMAL
1001	DOUBLE
1001	DOUBLE
9223372036854775806	INTEGER
9223372036854775806	UNSIGNED INTEGER
9223372036854775806.000	DECIMAL
9223372036854775806.000	DECIMAL
9223372036854775807	INTEGER
9223372036854775807	UNSIGNED INTEGER
9223372036854775807.000	DECIMAL
9223372036854775807.000	DECIMAL
9223372036854775808	UNSIGNED INTEGER
9223372036854775808.000	DECIMAL
9223372036854776000.000	DECIMAL
9.223372036854776e18	DOUBLE
9.223372036854776e18	DOUBLE
9.223372036854776e18	DOUBLE
9.223372036854776e18	DOUBLE
9.223372036854776e18	DOUBLE
9.223372036854776e18	DOUBLE
9.223372036854776e18	DOUBLE
9223372036854776000	UNSIGNED INTEGER
9223372036854776001.000	DECIMAL
18446744073709551614	UNSIGNED INTEGER
18446744073709551614.000	DECIMAL
18446744073709551615	UNSIGNED INTEGER
18446744073709551615.000	DECIMAL
1.8446744073709552e19	DOUBLE
1.8446744073709552e19	DOUBLE
9.99e80	DOUBLE
999999999999999999999999999999999999999999999999999999999999999999999999999999997	DECIMAL
999999999999999999999999999999999999999999999999999999999999999999999999999999998	DECIMAL
999999999999999999999999999999999999999999999999999999999999999999999999999999999	DECIMAL
1e81	DOUBLE
1.5e200	DOUBLE
1e306	DOUBLE
1e307	DOUBLE
1e308	DOUBLE
""	STRING
"abc"	STRING
"abc\u0000"	STRING
"abc\u0000\u0000"	STRING
"abcd"	STRING
"bc"	STRING
{"an": "object"}	OBJECT
{"another": "object"}	OBJECT
{"type": "Point", "coordinates": [0, 0]}	OBJECT
{"type": "Point", "coordinates": [0, 1]}	OBJECT
["an array"]	ARRAY
["another array"]	ARRAY
false	BOOLEAN
true	BOOLEAN
"1000-01-01"	DATE
"1960-01-02"	DATE
"1970-01-02"	DATE
"2000-01-01"	DATE
"2000-01-02"	DATE
"2000-02-01"	DATE
"2010-12-02"	DATE
"9999-12-31"	DATE
"-630:59:59.000000"	TIME
"-24:00:00.000000"	TIME
"-12:00:00.000000"	TIME
"-00:00:00.000001"	TIME
"00:00:00.000000"	TIME
"00:00:00.000000"	TIME
"00:00:00.001000"	TIME
"00:00:00.002000"	TIME
"00:00:00.010000"	TIME
"00:00:00.020000"	TIME
"00:00:01.000000"	TIME
"00:00:01.000001"	TIME
"01:00:00.000000"	TIME
"01:02:00.000000"	TIME
"01:02:03.000000"	TIME
"02:01:00.000000"	TIME
"03:04:05.000000"	TIME
"03:04:06.000000"	TIME
"23:59:59.999999"	TIME
"24:00:00.000000"	TIME
"630:59:59.000000"	TIME
"1000-01-01 00:00:00.000000"	DATETIME
"1960-01-02 03:04:05.000000"	DATETIME
"1960-01-02 03:04:06.000000"	DATETIME
"1970-01-02 00:00:01.000000"	TIMESTAMP
"1970-01-02 00:00:01.000000"	DATETIME
"1970-01-02 00:00:01.000001"	TIMESTAMP
"1970-01-02 00:00:01.000001"	DATETIME
"2000-01-01 00:00:00.000000"	TIMESTAMP
"2000-01-01 00:00:00.000000"	DATETIME
"2000-01-01 00:00:00.001000"	TIMESTAMP
"2000-01-01 00:00:00.001000"	DATETIME
"2000-01-01 00:00:00.002000"	TIMESTAMP
"2000-01-01 00:00:00.002000"	DATETIME
"2000-01-01 00:00:00.010000"	TIMESTAMP
"2000-01-01 00:00:00.010000"	DATETIME
"2000-01-01 00:00:00.020000"	TIMESTAMP
"2000-01-01 00:00:00.020000"	DATETIME
"2000-01-01 23:59:59.999999"	TIMESTAMP
"2000-01-01 23:59:59.999999"	DATETIME
"2000-01-02 00:00:00.000000"	TIMESTAMP
"2000-01-02 00:00:00.000000"	DATETIME
"2000-02-01 00:00:00.000000"	TIMESTAMP
"2000-02-01 00:00:00.000000"	DATETIME
"2010-12-02 01:00:00.000000"	TIMESTAMP
"2010-12-02 01:00:00.000000"	DATETIME
"2010-12-02 01:02:00.000000"	TIMESTAMP
"2010-12-02 01:02:00.000000"	DATETIME
"2010-12-02 01:02:03.000000"	TIMESTAMP
"2010-12-02 01:02:03.000000"	DATETIME
"2010-12-02 02:01:00.000000"	TIMESTAMP
"2010-12-02 02:01:00.000000"	DATETIME
"9999-12-31 23:59:59.999999"	DATETIME
"base64:type253:MTIzNGFiY2Q="	BLOB
Warnings:
Warning	1235	This version of MySQL doesn't yet support 'sorting of non-scalar JSON values'
SELECT j, JSON_TYPE(j) AS tp FROM t ORDER BY j DESC, id;
j	tp
"base64:type253:MTIzNGFiY2Q="	BLOB
"9999-12-31 23:59:59.999999"	DATETIME
"2010-12-02 02:01:00.000000"	TIMESTAMP
"2010-12-02 02:01:00.000000"	DATETIME
"2010-12-02 01:02:03.000000"	TIMESTAMP
"2010-12-02 01:02:03.000000"	DATETIME
"2010-12-02 01:02:00.000000"	TIMESTAMP
"2010-12-02 01:02:00.000000"	DATETIME
"2010-12-02 01:00:00.000000"	TIMESTAMP
"2010-12-02 01:00:00.000000"	DATETIME
"2000-02-01 00:00:00.000000"	TIMESTAMP
"2000-02-01 00:00:00.000000"	DATETIME
"2000-01-02 00:00:00.000000"	TIMESTAMP
"2000-01-02 00:00:00.000000"	DATETIME
"2000-01-01 23:59:59.999999"	TIMESTAMP
"2000-01-01 23:59:59.999999"	DATETIME
"2000-01-01 00:00:00.020000"	TIMESTAMP
"2000-01-01 00:00:00.020000"	DATETIME
"2000-01-01 00:00:00.010000"	TIMESTAMP
"2000-01-01 00:00:00.010000"	DATETIME
"2000-01-01 00:00:00.002000"	TIMESTAMP
"2000-01-01 00:00:00.002000"	DATETIME
"2000-01-01 00:00:00.001000"	TIMESTAMP
"2000-01-01 00:00:00.001000"	DATETIME
"2000-01-01 00:00:00.000000"	TIMESTAMP
"2000-01-01 00:00:00.000000"	DATETIME
"1970-01-02 00:00:01.000001"	TIMESTAMP
"1970-01-02 00:00:01.000001"	DATETIME
"1970-01-02 00:00:01.000000"	TIMESTAMP
"1970-01-02 00:00:01.000000"	DATETIME
"1960-01-02 03:04:06.000000"	DATETIME
"1960-01-02 03:04:05.000000"	DATETIME
"1000-01-01 00:00:00.000000"	DATETIME
"630:59:59.000000"	TIME
"24:00:00.000000"	TIME
"23:59:59.999999"	TIME
"03:04:06.000000"	TIME
"03:04:05.000000"	TIME
"02:01:00.000000"	TIME
"01:02:03.000000"	TIME
"01:02:00.000000"	TIME
"01:00:00.000000"	TIME
"00:00:01.000001"	TIME
"00:00:01.000000"	TIME
"00:00:00.020000"	TIME
"00:00:00.010000"	TIME
"00:00:00.002000"	TIME
"00:00:00.001000"	TIME
"00:00:00.000000"	TIME
"00:00:00.000000"	TIME
"-00:00:00.000001"	TIME
"-12:00:00.000000"	TIME
"-24:00:00.000000"	TIME
"-630:59:59.000000"	TIME
"9999-12-31"	DATE
"2010-12-02"	DATE
"2000-02-01"	DATE
"2000-01-02"	DATE
"2000-01-01"	DATE
"1970-01-02"	DATE
"1960-01-02"	DATE
"1000-01-01"	DATE
true	BOOLEAN
false	BOOLEAN
["an array"]	ARRAY
["another array"]	ARRAY
{"type": "Point", "coordinates": [0, 0]}	OBJECT
{"type": "Point", "coordinates": [0, 1]}	OBJECT
{"an": "object"}	OBJECT
{"another": "object"}	OBJECT
"bc"	STRING
"abcd"	STRING
"abc\u0000\u0000"	STRING
"abc\u0000"	STRING
"abc"	STRING
""	STRING
1e308	DOUBLE
1e307	DOUBLE
1e306	DOUBLE
1.5e200	DOUBLE
1e81	DOUBLE
999999999999999999999999999999999999999999999999999999999999999999999999999999999	DECIMAL
999999999999999999999999999999999999999999999999999999999999999999999999999999998	DECIMAL
999999999999999999999999999999999999999999999999999999999999999999999999999999997	DECIMAL
9.99e80	DOUBLE
1.8446744073709552e19	DOUBLE
1.8446744073709552e19	DOUBLE
18446744073709551615	UNSIGNED INTEGER
18446744073709551615.000	DECIMAL
18446744073709551614	UNSIGNED INTEGER
18446744073709551614.000	DECIMAL
9223372036854776001.000	DECIMAL
9223372036854776000.000	DECIMAL
9.223372036854776e18	DOUBLE
9.223372036854776e18	DOUBLE
9.223372036854776e18	DOUBLE
9.223372036854776e18	DOUBLE
9.223372036854776e18	DOUBLE
9.223372036854776e18	DOUBLE
9.223372036854776e18	DOUBLE
9223372036854776000	UNSIGNED INTEGER
9223372036854775808	UNSIGNED INTEGER
9223372036854775808.000	DECIMAL
9223372036854775807	INTEGER
9223372036854775807	UNSIGNED INTEGER
9223372036854775807.000	DECIMAL
9223372036854775807.000	DECIMAL
9223372036854775806	INTEGER
9223372036854775806	UNSIGNED INTEGER
9223372036854775806.000	DECIMAL
9223372036854775806.000	DECIMAL
1001	INTEGER
1001	UNSIGNED INTEGER
1001.000	DECIMAL
1001.000	DECIMAL
1001	DOUBLE
1001	DOUBLE
1000	INTEGER
1000	UNSIGNED INTEGER
1000.000	DECIMAL
1000.000	DECIMAL
1000	DOUBLE
1000	DOUBLE
999	INTEGER
999	UNSIGNED INTEGER
999.000	DECIMAL
999.000	DECIMAL
999	DOUBLE
999	DOUBLE
101	INTEGER
101	UNSIGNED INTEGER
101.000	DECIMAL
101.000	DECIMAL
101	DOUBLE
101	DOUBLE
100	INTEGER
100	UNSIGNED INTEGER
100.000	DECIMAL
100.000	DECIMAL
100	DOUBLE
100	DOUBLE
99	INTEGER
99	UNSIGNED INTEGER
99.000	DECIMAL
99.000	DECIMAL
99	DOUBLE
99	DOUBLE
22	INTEGER
22	UNSIGNED INTEGER
22.000	DECIMAL
22.000	DECIMAL
22	DOUBLE
22	DOUBLE
21	INTEGER
21	UNSIGNED INTEGER
21.000	DECIMAL
21.000	DECIMAL
21	DOUBLE
21	DOUBLE
20	INTEGER
20	UNSIGNED INTEGER
20.000	DECIMAL
20.000	DECIMAL
20	DOUBLE
20	DOUBLE
12	INTEGER
12	UNSIGNED INTEGER
12.000	DECIMAL
12.000	DECIMAL
12	DOUBLE
12	DOUBLE
11	INTEGER
11	UNSIGNED INTEGER
11.000	DECIMAL
11.000	DECIMAL
11	DOUBLE
11	DOUBLE
10	INTEGER
10	UNSIGNED INTEGER
10.000	DECIMAL
10.000	DECIMAL
10	DOUBLE
10	DOUBLE
5	INTEGER
5	UNSIGNED INTEGER
5.000	DECIMAL
5.000	DECIMAL
5	DOUBLE
5	DOUBLE
4	INTEGER
4	UNSIGNED INTEGER
4.000	DECIMAL
4.000	DECIMAL
4	DOUBLE
4	DOUBLE
3.151	DECIMAL
3.151	DOUBLE
3.150	DECIMAL
3.15	DOUBLE
3.149	DECIMAL
3.149	DOUBLE
3.141	DECIMAL
3.141	DOUBLE
3.140	DECIMAL
3.14	DOUBLE
3.139	DECIMAL
3.139	DOUBLE
3.131	DECIMAL
3.131	DOUBLE
3.130	DECIMAL
3.13	DOUBLE
3.129	DECIMAL
3.129	DOUBLE
3	INTEGER
3	UNSIGNED INTEGER
3.000	DECIMAL
3.000	DECIMAL
3	DOUBLE
3	DOUBLE
2	INTEGER
2	UNSIGNED INTEGER
2.000	DECIMAL
2.000	DECIMAL
2	DOUBLE
2	DOUBLE
1	INTEGER
1	UNSIGNED INTEGER
1.000	DECIMAL
1.000	DECIMAL
1	DOUBLE
1	DOUBLE
0.100	DECIMAL
0.1	DOUBLE
0.010	DECIMAL
0.01	DOUBLE
0.001	DECIMAL
0.001	DOUBLE
0.0000000000000011	DOUBLE
0.0000000000000011	DECIMAL
0.000000000000001	DOUBLE
0.000000000000001	DECIMAL
1.1e-16	DOUBLE
0.00000000000000011	DECIMAL
1e-16	DOUBLE
0.0000000000000001	DECIMAL
1.5e-200	DOUBLE
1e-321	DOUBLE
1e-322	DOUBLE
1e-323	DOUBLE
0	INTEGER
0	INTEGER
0	UNSIGNED INTEGER
0	UNSIGNED INTEGER
0.000	DECIMAL
0.000	DECIMAL
0.000	DECIMAL
0.000	DECIMAL
0	DOUBLE
0	DOUBLE
0	DOUBLE
0	DOUBLE
0	DOUBLE
-0	DOUBLE
0.0	DECIMAL
-1e-323	DOUBLE
-1e-322	DOUBLE
-1e-321	DOUBLE
-1.5e-200	DOUBLE
-0.001	DECIMAL
-0.001	DOUBLE
-0.010	DECIMAL
-0.01	DOUBLE
-0.100	DECIMAL
-0.1	DOUBLE
-1	INTEGER
-1.000	DECIMAL
-1	DOUBLE
-2	INTEGER
-2.000	DECIMAL
-2	DOUBLE
-3	INTEGER
-3.000	DECIMAL
-3	DOUBLE
-3.129	DECIMAL
-3.129	DOUBLE
-3.130	DECIMAL
-3.13	DOUBLE
-3.131	DECIMAL
-3.131	DOUBLE
-3.139	DECIMAL
-3.139	DOUBLE
-3.140	DECIMAL
-3.14	DOUBLE
-3.141	DECIMAL
-3.141	DOUBLE
-3.149	DECIMAL
-3.149	DOUBLE
-3.150	DECIMAL
-3.15	DOUBLE
-3.151	DECIMAL
-3.151	DOUBLE
-4	INTEGER
-4.000	DECIMAL
-4	DOUBLE
-5	INTEGER
-5.000	DECIMAL
-5	DOUBLE
-10	INTEGER
-10.000	DECIMAL
-10	DOUBLE
-11	INTEGER
-11.000	DECIMAL
-11	DOUBLE
-12	INTEGER
-12.000	DECIMAL
-12	DOUBLE
-20	INTEGER
-20.000	DECIMAL
-20	DOUBLE
-21	INTEGER
-21.000	DECIMAL
-21	DOUBLE
-22	INTEGER
-22.000	DECIMAL
-22	DOUBLE
-99	INTEGER
-99.000	DECIMAL
-99	DOUBLE
-100	INTEGER
-100.000	DECIMAL
-100	DOUBLE
-101	INTEGER
-101.000	DECIMAL
-101	DOUBLE
-999	INTEGER
-999.000	DECIMAL
-999	DOUBLE
-1000	INTEGER
-1000.000	DECIMAL
-1000	DOUBLE
-1001	INTEGER
-1001.000	DECIMAL
-1001	DOUBLE
-9223372036854775806	INTEGER
-9223372036854775806.000	DECIMAL
-9223372036854775807	INTEGER
-9223372036854775807.000	DECIMAL
-9223372036854775808	INTEGER
-9223372036854775808.000	DECIMAL
-9223372036854776000.000	DECIMAL
-9.223372036854776e18	DOUBLE
-9.223372036854776e18	DOUBLE
-9.223372036854776e18	DOUBLE
-9.223372036854776e18	DOUBLE
-9.223372036854776e18	DOUBLE
-9223372036854776001.000	DECIMAL
-9.99e80	DOUBLE
-999999999999999999999999999999999999999999999999999999999999999999999999999999997	DECIMAL
-999999999999999999999999999999999999999999999999999999999999999999999999999999998	DECIMAL
-999999999999999999999999999999999999999999999999999999999999999999999999999999999	DECIMAL
-1e81	DOUBLE
-1.5e200	DOUBLE
-1e306	DOUBLE
-1e307	DOUBLE
-1e308	DOUBLE
null	NULL
NULL	NULL
NULL	NULL
Warnings:
Warning	1235	This version of MySQL doesn't yet support 'sorting of non-scalar JSON values'
SELECT JSON_EXTRACT(j, '$') AS je, JSON_TYPE(j) AS tp FROM t ORDER BY je, id;
je	tp
NULL	NULL
NULL	NULL
null	NULL
-1e308	DOUBLE
-1e307	DOUBLE
-1e306	DOUBLE
-1.5e200	DOUBLE
-1e81	DOUBLE
-999999999999999999999999999999999999999999999999999999999999999999999999999999999	DECIMAL
-999999999999999999999999999999999999999999999999999999999999999999999999999999998	DECIMAL
-999999999999999999999999999999999999999999999999999999999999999999999999999999997	DECIMAL
-9.99e80	DOUBLE
-9223372036854776001.000	DECIMAL
-9223372036854776000.000	DECIMAL
-9.223372036854776e18	DOUBLE
-9.223372036854776e18	DOUBLE
-9.223372036854776e18	DOUBLE
-9.223372036854776e18	DOUBLE
-9.223372036854776e18	DOUBLE
-9223372036854775808	INTEGER
-9223372036854775808.000	DECIMAL
-9223372036854775807	INTEGER
-9223372036854775807.000	DECIMAL
-9223372036854775806	INTEGER
-9223372036854775806.000	DECIMAL
-1001	INTEGER
-1001.000	DECIMAL
-1001	DOUBLE
-1000	INTEGER
-1000.000	DECIMAL
-1000	DOUBLE
-999	INTEGER
-999.000	DECIMAL
-999	DOUBLE
-101	INTEGER
-101.000	DECIMAL
-101	DOUBLE
-100	INTEGER
-100.000	DECIMAL
-100	DOUBLE
-99	INTEGER
-99.000	DECIMAL
-99	DOUBLE
-22	INTEGER
-22.000	DECIMAL
-22	DOUBLE
-21	INTEGER
-21.000	DECIMAL
-21	DOUBLE
-20	INTEGER
-20.000	DECIMAL
-20	DOUBLE
-12	INTEGER
-12.000	DECIMAL
-12	DOUBLE
-11	INTEGER
-11.000	DECIMAL
-11	DOUBLE
-10	INTEGER
-10.000	DECIMAL
-10	DOUBLE
-5	INTEGER
-5.000	DECIMAL
-5	DOUBLE
-4	INTEGER
-4.000	DECIMAL
-4	DOUBLE
-3.151	DECIMAL
-3.151	DOUBLE
-3.150	DECIMAL
-3.15	DOUBLE
-3.149	DECIMAL
-3.149	DOUBLE
-3.141	DECIMAL
-3.141	DOUBLE
-3.140	DECIMAL
-3.14	DOUBLE
-3.139	DECIMAL
-3.139	DOUBLE
-3.131	DECIMAL
-3.131	DOUBLE
-3.130	DECIMAL
-3.13	DOUBLE
-3.129	DECIMAL
-3.129	DOUBLE
-3	INTEGER
-3.000	DECIMAL
-3	DOUBLE
-2	INTEGER
-2.000	DECIMAL
-2	DOUBLE
-1	INTEGER
-1.000	DECIMAL
-1	DOUBLE
-0.100	DECIMAL
-0.1	DOUBLE
-0.010	DECIMAL
-0.01	DOUBLE
-0.001	DECIMAL
-0.001	DOUBLE
-1.5e-200	DOUBLE
-1e-321	DOUBLE
-1e-322	DOUBLE
-1e-323	DOUBLE
0	INTEGER
0	INTEGER
0	UNSIGNED INTEGER
0	UNSIGNED INTEGER
0.000	DECIMAL
0.000	DECIMAL
0.000	DECIMAL
0.000	DECIMAL
0	DOUBLE
0	DOUBLE
0	DOUBLE
0	DOUBLE
0	DOUBLE
-0	DOUBLE
0.0	DECIMAL
1e-323	DOUBLE
1e-322	DOUBLE
1e-321	DOUBLE
1.5e-200	DOUBLE
1e-16	DOUBLE
0.0000000000000001	DECIMAL
1.1e-16	DOUBLE
0.00000000000000011	DECIMAL
0.000000000000001	DOUBLE
0.000000000000001	DECIMAL
0.0000000000000011	DOUBLE
0.0000000000000011	DECIMAL
0.001	DECIMAL
0.001	DOUBLE
0.010	DECIMAL
0.01	DOUBLE
0.100	DECIMAL
0.1	DOUBLE
1	INTEGER
1	UNSIGNED INTEGER
1.000	DECIMAL
1.000	DECIMAL
1	DOUBLE
1	DOUBLE
2	INTEGER
2	UNSIGNED INTEGER
2.000	DECIMAL
2.000	DECIMAL
2	DOUBLE
2	DOUBLE
3	INTEGER
3	UNSIGNED INTEGER
3.000	DECIMAL
3.000	DECIMAL
3	DOUBLE
3	DOUBLE
3.129	DECIMAL
3.129	DOUBLE
3.130	DECIMAL
3.13	DOUBLE
3.131	DECIMAL
3.131	DOUBLE
3.139	DECIMAL
3.139	DOUBLE
3.140	DECIMAL
3.14	DOUBLE
3.141	DECIMAL
3.141	DOUBLE
3.149	DECIMAL
3.149	DOUBLE
3.150	DECIMAL
3.15	DOUBLE
3.151	DECIMAL
3.151	DOUBLE
4	INTEGER
4	UNSIGNED INTEGER
4.000	DECIMAL
4.000	DECIMAL
4	DOUBLE
4	DOUBLE
5	INTEGER
5	UNSIGNED INTEGER
5.000	DECIMAL
5.000	DECIMAL
5	DOUBLE
5	DOUBLE
10	INTEGER
10	UNSIGNED INTEGER
10.000	DECIMAL
10.000	DECIMAL
10	DOUBLE
10	DOUBLE
11	INTEGER
11	UNSIGNED INTEGER
11.000	DECIMAL
11.000	DECIMAL
11	DOUBLE
11	DOUBLE
12	INTEGER
12	UNSIGNED INTEGER
12.000	DECIMAL
12.000	DECIMAL
12	DOUBLE
12	DOUBLE
20	INTEGER
20	UNSIGNED INTEGER
20.000	DECIMAL
20.000	DECIMAL
20	DOUBLE
20	DOUBLE
21	INTEGER
21	UNSIGNED INTEGER
21.000	DECIMAL
21.000	DECIMAL
21	DOUBLE
21	DOUBLE
22	INTEGER
22	UNSIGNED INTEGER
22.000	DECIMAL
22.000	DECIMAL
22	DOUBLE
22	DOUBLE
99	INTEGER
99	UNSIGNED INTEGER
99.000	DECIMAL
99.000	DECIMAL
99	DOUBLE
99	DOUBLE
100	INTEGER
100	UNSIGNED INTEGER
100.000	DECIMAL
100.000	DECIMAL
100	DOUBLE
100	DOUBLE
101	INTEGER
101	UNSIGNED INTEGER
101.000	DECIMAL
101.000	DECIMAL
101	DOUBLE
101	DOUBLE
999	INTEGER
999	UNSIGNED INTEGER
999.000	DECIMAL
999.000	DECIMAL
999	DOUBLE
999	DOUBLE
1000	INTEGER
1000	UNSIGNED INTEGER
1000.000	DECIMAL
1000.000	DECIMAL
1000	DOUBLE
1000	DOUBLE
1001	INTEGER
1001	UNSIGNED INTEGER
1001.000	DECIMAL
1001.000	DECIMAL
1001	DOUBLE
1001	DOUBLE
9223372036854775806	INTEGER
9223372036854775806	UNSIGNED INTEGER
9223372036854775806.000	DECIMAL
9223372036854775806.000	DECIMAL
9223372036854775807	INTEGER
9223372036854775807	UNSIGNED INTEGER
9223372036854775807.000	DECIMAL
9223372036854775807.000	DECIMAL
9223372036854775808	UNSIGNED INTEGER
9223372036854775808.000	DECIMAL
9223372036854776000.000	DECIMAL
9.223372036854776e18	DOUBLE
9.223372036854776e18	DOUBLE
9.223372036854776e18	DOUBLE
9.223372036854776e18	DOUBLE
9.223372036854776e18	DOUBLE
9.223372036854776e18	DOUBLE
9.223372036854776e18	DOUBLE
9223372036854776000	UNSIGNED INTEGER
9223372036854776001.000	DECIMAL
18446744073709551614	UNSIGNED INTEGER
18446744073709551614.000	DECIMAL
18446744073709551615	UNSIGNED INTEGER
18446744073709551615.000	DECIMAL
1.8446744073709552e19	DOUBLE
1.8446744073709552e19	DOUBLE
9.99e80	DOUBLE
999999999999999999999999999999999999999999999999999999999999999999999999999999997	DECIMAL
999999999999999999999999999999999999999999999999999999999999999999999999999999998	DECIMAL
999999999999999999999999999999999999999999999999999999999999999999999999999999999	DECIMAL
1e81	DOUBLE
1.5e200	DOUBLE
1e306	DOUBLE
1e307	DOUBLE
1e308	DOUBLE
""	STRING
"abc"	STRING
"abc\u0000"	STRING
"abc\u0000\u0000"	STRING
"abcd"	STRING
"bc"	STRING
{"an": "object"}	OBJECT
{"another": "object"}	OBJECT
{"type": "Point", "coordinates": [0, 0]}	OBJECT
{"type": "Point", "coordinates": [0, 1]}	OBJECT
["an array"]	ARRAY
["another array"]	ARRAY
false	BOOLEAN
true	BOOLEAN
"1000-01-01"	DATE
"1960-01-02"	DATE
"1970-01-02"	DATE
"2000-01-01"	DATE
"2000-01-02"	DATE
"2000-02-01"	DATE
"2010-12-02"	DATE
"9999-12-31"	DATE
"-630:59:59.000000"	TIME
"-24:00:00.000000"	TIME
"-12:00:00.000000"	TIME
"-00:00:00.000001"	TIME
"00:00:00.000000"	TIME
"00:00:00.000000"	TIME
"00:00:00.001000"	TIME
"00:00:00.002000"	TIME
"00:00:00.010000"	TIME
"00:00:00.020000"	TIME
"00:00:01.000000"	TIME
"00:00:01.000001"	TIME
"01:00:00.000000"	TIME
"01:02:00.000000"	TIME
"01:02:03.000000"	TIME
"02:01:00.000000"	TIME
"03:04:05.000000"	TIME
"03:04:06.000000"	TIME
"23:59:59.999999"	TIME
"24:00:00.000000"	TIME
"630:59:59.000000"	TIME
"1000-01-01 00:00:00.000000"	DATETIME
"1960-01-02 03:04:05.000000"	DATETIME
"1960-01-02 03:04:06.000000"	DATETIME
"1970-01-02 00:00:01.000000"	TIMESTAMP
"1970-01-02 00:00:01.000000"	DATETIME
"1970-01-02 00:00:01.000001"	TIMESTAMP
"1970-01-02 00:00:01.000001"	DATETIME
"2000-01-01 00:00:00.000000"	TIMESTAMP
"2000-01-01 00:00:00.000000"	DATETIME
"2000-01-01 00:00:00.001000"	TIMESTAMP
"2000-01-01 00:00:00.001000"	DATETIME
"2000-01-01 00:00:00.002000"	TIMESTAMP
"2000-01-01 00:00:00.002000"	DATETIME
"2000-01-01 00:00:00.010000"	TIMESTAMP
"2000-01-01 00:00:00.010000"	DATETIME
"2000-01-01 00:00:00.020000"	TIMESTAMP
"2000-01-01 00:00:00.020000"	DATETIME
"2000-01-01 23:59:59.999999"	TIMESTAMP
"2000-01-01 23:59:59.999999"	DATETIME
"2000-01-02 00:00:00.000000"	TIMESTAMP
"2000-01-02 00:00:00.000000"	DATETIME
"2000-02-01 00:00:00.000000"	TIMESTAMP
"2000-02-01 00:00:00.000000"	DATETIME
"2010-12-02 01:00:00.000000"	TIMESTAMP
"2010-12-02 01:00:00.000000"	DATETIME
"2010-12-02 01:02:00.000000"	TIMESTAMP
"2010-12-02 01:02:00.000000"	DATETIME
"2010-12-02 01:02:03.000000"	TIMESTAMP
"2010-12-02 01:02:03.000000"	DATETIME
"2010-12-02 02:01:00.000000"	TIMESTAMP
"2010-12-02 02:01:00.000000"	DATETIME
"9999-12-31 23:59:59.999999"	DATETIME
"base64:type253:MTIzNGFiY2Q="	BLOB
Warnings:
Warning	1235	This version of MySQL doesn't yet support 'sorting of non-scalar JSON values'
SET @@max_sort_length=4;
SELECT j, JSON_TYPE(j) AS tp FROM t ORDER BY j, id;
j	tp
NULL	NULL
NULL	NULL
null	NULL
-1e308	DOUBLE
-1e307	DOUBLE
-1e306	DOUBLE
-1.5e200	DOUBLE
-1e81	DOUBLE
-999999999999999999999999999999999999999999999999999999999999999999999999999999999	DECIMAL
-999999999999999999999999999999999999999999999999999999999999999999999999999999998	DECIMAL
-999999999999999999999999999999999999999999999999999999999999999999999999999999997	DECIMAL
-9.99e80	DOUBLE
-9223372036854775808	INTEGER
-9223372036854775807	INTEGER
-9223372036854775806	INTEGER
-9223372036854776001.000	DECIMAL
-9223372036854776000.000	DECIMAL
-9223372036854775808.000	DECIMAL
-9223372036854775807.000	DECIMAL
-9223372036854775806.000	DECIMAL
-9.223372036854776e18	DOUBLE
-9.223372036854776e18	DOUBLE
-9.223372036854776e18	DOUBLE
-9.223372036854776e18	DOUBLE
-9.223372036854776e18	DOUBLE
-1001	INTEGER
-1000	INTEGER
-1001.000	DECIMAL
-1000.000	DECIMAL
-1001	DOUBLE
-1000	DOUBLE
-999	INTEGER
-999.000	DECIMAL
-999	DOUBLE
-101	INTEGER
-100	INTEGER
-101.000	DECIMAL
-100.000	DECIMAL
-101	DOUBLE
-100	DOUBLE
-99	INTEGER
-99.000	DECIMAL
-99	DOUBLE
-22	INTEGER
-21	INTEGER
-20	INTEGER
-22.000	DECIMAL
-21.000	DECIMAL
-20.000	DECIMAL
-22	DOUBLE
-21	DOUBLE
-20	DOUBLE
-12	INTEGER
-11	INTEGER
-10	INTEGER
-12.000	DECIMAL
-11.000	DECIMAL
-10.000	DECIMAL
-12	DOUBLE
-11	DOUBLE
-10	DOUBLE
-5	INTEGER
-5.000	DECIMAL
-5	DOUBLE
-4	INTEGER
-4.000	DECIMAL
-4	DOUBLE
-3	INTEGER
-3.151	DECIMAL
-3.150	DECIMAL
-3.149	DECIMAL
-3.141	DECIMAL
-3.140	DECIMAL
-3.139	DECIMAL
-3.131	DECIMAL
-3.130	DECIMAL
-3.129	DECIMAL
-3.000	DECIMAL
-3.151	DOUBLE
-3.15	DOUBLE
-3.149	DOUBLE
-3.141	DOUBLE
-3.14	DOUBLE
-3.139	DOUBLE
-3.131	DOUBLE
-3.13	DOUBLE
-3.129	DOUBLE
-3	DOUBLE
-2	INTEGER
-2.000	DECIMAL
-2	DOUBLE
-1	INTEGER
-1.000	DECIMAL
-1	DOUBLE
-0.100	DECIMAL
-0.1	DOUBLE
-0.010	DECIMAL
-0.01	DOUBLE
-0.001	DECIMAL
-0.001	DOUBLE
-1.5e-200	DOUBLE
-1e-321	DOUBLE
-1e-322	DOUBLE
-1e-323	DOUBLE
0	INTEGER
0	INTEGER
0	UNSIGNED INTEGER
0	UNSIGNED INTEGER
0.000	DECIMAL
0.000	DECIMAL
0.000	DECIMAL
0.000	DECIMAL
0	DOUBLE
0	DOUBLE
0	DOUBLE
0	DOUBLE
0	DOUBLE
-0	DOUBLE
0.0	DECIMAL
1e-323	DOUBLE
1e-322	DOUBLE
1e-321	DOUBLE
1.5e-200	DOUBLE
1e-16	DOUBLE
1.1e-16	DOUBLE
0.0000000000000001	DECIMAL
0.00000000000000011	DECIMAL
0.000000000000001	DOUBLE
0.0000000000000011	DOUBLE
0.000000000000001	DECIMAL
0.0000000000000011	DECIMAL
0.001	DECIMAL
0.001	DOUBLE
0.010	DECIMAL
0.01	DOUBLE
0.100	DECIMAL
0.1	DOUBLE
1	INTEGER
1	UNSIGNED INTEGER
1.000	DECIMAL
1.000	DECIMAL
1	DOUBLE
1	DOUBLE
2	INTEGER
2	UNSIGNED INTEGER
2.000	DECIMAL
2.000	DECIMAL
2	DOUBLE
2	DOUBLE
3	INTEGER
3	UNSIGNED INTEGER
3.000	DECIMAL
3.000	DECIMAL
3.129	DECIMAL
3.130	DECIMAL
3.131	DECIMAL
3.139	DECIMAL
3.140	DECIMAL
3.141	DECIMAL
3.149	DECIMAL
3.150	DECIMAL
3.151	DECIMAL
3	DOUBLE
3	DOUBLE
3.129	DOUBLE
3.13	DOUBLE
3.131	DOUBLE
3.139	DOUBLE
3.14	DOUBLE
3.141	DOUBLE
3.149	DOUBLE
3.15	DOUBLE
3.151	DOUBLE
4	INTEGER
4	UNSIGNED INTEGER
4.000	DECIMAL
4.000	DECIMAL
4	DOUBLE
4	DOUBLE
5	INTEGER
5	UNSIGNED INTEGER
5.000	DECIMAL
5.000	DECIMAL
5	DOUBLE
5	DOUBLE
10	INTEGER
11	INTEGER
12	INTEGER
10	UNSIGNED INTEGER
11	UNSIGNED INTEGER
12	UNSIGNED INTEGER
10.000	DECIMAL
10.000	DECIMAL
11.000	DECIMAL
11.000	DECIMAL
12.000	DECIMAL
12.000	DECIMAL
10	DOUBLE
10	DOUBLE
11	DOUBLE
11	DOUBLE
12	DOUBLE
12	DOUBLE
20	INTEGER
21	INTEGER
22	INTEGER
20	UNSIGNED INTEGER
21	UNSIGNED INTEGER
22	UNSIGNED INTEGER
20.000	DECIMAL
20.000	DECIMAL
21.000	DECIMAL
21.000	DECIMAL
22.000	DECIMAL
22.000	DECIMAL
20	DOUBLE
20	DOUBLE
21	DOUBLE
21	DOUBLE
22	DOUBLE
22	DOUBLE
99	INTEGER
99	UNSIGNED INTEGER
99.000	DECIMAL
99.000	DECIMAL
99	DOUBLE
99	DOUBLE
100	INTEGER
101	INTEGER
100	UNSIGNED INTEGER
101	UNSIGNED INTEGER
100.000	DECIMAL
100.000	DECIMAL
101.000	DECIMAL
101.000	DECIMAL
100	DOUBLE
100	DOUBLE
101	DOUBLE
101	DOUBLE
999	INTEGER
999	UNSIGNED INTEGER
999.000	DECIMAL
999.000	DECIMAL
999	DOUBLE
999	DOUBLE
1000	INTEGER
1001	INTEGER
1000	UNSIGNED INTEGER
1001	UNSIGNED INTEGER
1000.000	DECIMAL
1000.000	DECIMAL
1001.000	DECIMAL
1001.000	DECIMAL
1000	DOUBLE
1000	DOUBLE
1001	DOUBLE
1001	DOUBLE
9223372036854775806	INTEGER
9223372036854775807	INTEGER
9223372036854775806	UNSIGNED INTEGER
9223372036854775807	UNSIGNED INTEGER
9223372036854775808	UNSIGNED INTEGER
9223372036854775806.000	DECIMAL
9223372036854775806.000	DECIMAL
9223372036854775807.000	DECIMAL
9223372036854775807.000	DECIMAL
9223372036854775808.000	DECIMAL
9223372036854776000.000	DECIMAL
9223372036854776001.000	DECIMAL
9.223372036854776e18	DOUBLE
9.223372036854776e18	DOUBLE
9.223372036854776e18	DOUBLE
9.223372036854776e18	DOUBLE
9.223372036854776e18	DOUBLE
9.223372036854776e18	DOUBLE
9.223372036854776e18	DOUBLE
9223372036854776000	UNSIGNED INTEGER
18446744073709551614	UNSIGNED INTEGER
18446744073709551615	UNSIGNED INTEGER
18446744073709551614.000	DECIMAL
18446744073709551615.000	DECIMAL
1.8446744073709552e19	DOUBLE
1.8446744073709552e19	DOUBLE
999999999999999999999999999999999999999999999999999999999999999999999999999999997	DECIMAL
999999999999999999999999999999999999999999999999999999999999999999999999999999998	DECIMAL
999999999999999999999999999999999999999999999999999999999999999999999999999999999	DECIMAL
9.99e80	DOUBLE
1e81	DOUBLE
1.5e200	DOUBLE
1e306	DOUBLE
1e307	DOUBLE
1e308	DOUBLE
"abc"	STRING
""	STRING
"abcd"	STRING
"bc"	STRING
"abc\u0000\u0000"	STRING
"abc\u0000"	STRING
{"an": "object"}	OBJECT
{"another": "object"}	OBJECT
{"type": "Point", "coordinates": [0, 0]}	OBJECT
{"type": "Point", "coordinates": [0, 1]}	OBJECT
["an array"]	ARRAY
["another array"]	ARRAY
false	BOOLEAN
true	BOOLEAN
"1000-01-01"	DATE
"1960-01-02"	DATE
"1970-01-02"	DATE
"2000-01-01"	DATE
"2000-01-02"	DATE
"2000-02-01"	DATE
"2010-12-02"	DATE
"9999-12-31"	DATE
"-630:59:59.000000"	TIME
"-24:00:00.000000"	TIME
"-12:00:00.000000"	TIME
"-00:00:00.000001"	TIME
"00:00:00.000000"	TIME
"00:00:00.000000"	TIME
"00:00:00.001000"	TIME
"00:00:00.002000"	TIME
"00:00:00.010000"	TIME
"00:00:00.020000"	TIME
"00:00:01.000000"	TIME
"00:00:01.000001"	TIME
"01:00:00.000000"	TIME
"01:02:00.000000"	TIME
"01:02:03.000000"	TIME
"02:01:00.000000"	TIME
"03:04:05.000000"	TIME
"03:04:06.000000"	TIME
"23:59:59.999999"	TIME
"24:00:00.000000"	TIME
"630:59:59.000000"	TIME
"1000-01-01 00:00:00.000000"	DATETIME
"1960-01-02 03:04:05.000000"	DATETIME
"1960-01-02 03:04:06.000000"	DATETIME
"1970-01-02 00:00:01.000000"	TIMESTAMP
"1970-01-02 00:00:01.000001"	TIMESTAMP
"1970-01-02 00:00:01.000000"	DATETIME
"1970-01-02 00:00:01.000001"	DATETIME
"2000-01-01 00:00:00.000000"	TIMESTAMP
"2000-01-01 00:00:00.001000"	TIMESTAMP
"2000-01-01 00:00:00.002000"	TIMESTAMP
"2000-01-01 00:00:00.010000"	TIMESTAMP
"2000-01-01 00:00:00.020000"	TIMESTAMP
"2000-01-01 00:00:00.000000"	DATETIME
"2000-01-01 00:00:00.001000"	DATETIME
"2000-01-01 00:00:00.002000"	DATETIME
"2000-01-01 00:00:00.010000"	DATETIME
"2000-01-01 00:00:00.020000"	DATETIME
"2000-01-01 23:59:59.999999"	TIMESTAMP
"2000-01-01 23:59:59.999999"	DATETIME
"2000-01-02 00:00:00.000000"	TIMESTAMP
"2000-01-02 00:00:00.000000"	DATETIME
"2000-02-01 00:00:00.000000"	TIMESTAMP
"2000-02-01 00:00:00.000000"	DATETIME
"2010-12-02 01:00:00.000000"	TIMESTAMP
"2010-12-02 01:02:00.000000"	TIMESTAMP
"2010-12-02 01:02:03.000000"	TIMESTAMP
"2010-12-02 02:01:00.000000"	TIMESTAMP
"2010-12-02 01:00:00.000000"	DATETIME
"2010-12-02 01:02:00.000000"	DATETIME
"2010-12-02 01:02:03.000000"	DATETIME
"2010-12-02 02:01:00.000000"	DATETIME
"9999-12-31 23:59:59.999999"	DATETIME
"base64:type253:MTIzNGFiY2Q="	BLOB
Warnings:
Warning	1235	This version of MySQL doesn't yet support 'sorting of non-scalar JSON values'
SET @@max_sort_length=default;
ANALYZE TABLE t;
Table	Op	Msg_type	Msg_text
test.t	analyze	status	OK
EXPLAIN SELECT j, COUNT(*) FROM t GROUP BY j ORDER BY j;
id	select_type	table	partitions	type	possible_keys	key	key_len	ref	rows	filtered	Extra
1	SIMPLE	t	NULL	ALL	NULL	NULL	NULL	NULL	368	100.00	Using temporary; Using filesort
Warnings:
Note	1003	/* select#1 */ select `test`.`t`.`j` AS `j`,count(0) AS `COUNT(*)` from `test`.`t` group by `test`.`t`.`j` order by `test`.`t`.`j`
EXPLAIN SELECT j, COUNT(*) FROM t GROUP BY j WITH ROLLUP;
id	select_type	table	partitions	type	possible_keys	key	key_len	ref	rows	filtered	Extra
1	SIMPLE	t	NULL	ALL	NULL	NULL	NULL	NULL	368	100.00	Using filesort
Warnings:
Note	1003	/* select#1 */ select `test`.`t`.`j` AS `j`,count(0) AS `COUNT(*)` from `test`.`t` group by `test`.`t`.`j` with rollup
SELECT j, COUNT(*) FROM t GROUP BY j ORDER BY j;
j	COUNT(*)
NULL	2
null	1
-1e308	1
-1e307	1
-1e306	1
-1.5e200	1
-1e81	1
-999999999999999999999999999999999999999999999999999999999999999999999999999999999	1
-999999999999999999999999999999999999999999999999999999999999999999999999999999998	1
-999999999999999999999999999999999999999999999999999999999999999999999999999999997	1
-9.99e80	1
-9223372036854776001.000	1
-9223372036854776000.000	6
-9223372036854775808	2
-9223372036854775807	2
-9223372036854775806	2
-1001	3
-1000	3
-999	3
-101	3
-100	3
-99	3
-22	3
-21	3
-20	3
-12	3
-11	3
-10	3
-5	3
-4	3
-3.151	2
-3.150	2
-3.149	2
-3.141	2
-3.140	2
-3.139	2
-3.131	2
-3.130	2
-3.129	2
-3	3
-2	3
-1	3
-0.100	2
-0.010	2
-0.001	2
-1.5e-200	1
-1e-321	1
-1e-322	1
-1e-323	1
0	15
1e-323	1
1e-322	1
1e-321	1
1.5e-200	1
1e-16	2
1.1e-16	2
0.000000000000001	2
0.0000000000000011	2
0.001	2
0.010	2
0.100	2
1	6
2	6
3	6
3.129	2
3.130	2
3.131	2
3.139	2
3.140	2
3.141	2
3.149	2
3.150	2
3.151	2
4	6
5	6
10	6
11	6
12	6
20	6
21	6
22	6
99	6
100	6
101	6
999	6
1000	6
1001	6
9223372036854775806	4
9223372036854775807	4
9223372036854775808	2
9223372036854776000.000	9
9223372036854776001.000	1
18446744073709551614	2
18446744073709551615	2
1.8446744073709552e19	2
9.99e80	1
999999999999999999999999999999999999999999999999999999999999999999999999999999997	1
999999999999999999999999999999999999999999999999999999999999999999999999999999998	1
999999999999999999999999999999999999999999999999999999999999999999999999999999999	1
1e81	1
1.5e200	1
1e306	1
1e307	1
1e308	1
""	1
"abc"	1
"abc\u0000"	1
"abc\u0000\u0000"	1
"abcd"	1
"bc"	1
{"an": "object"}	1
{"another": "object"}	1
{"type": "Point", "coordinates": [0, 0]}	1
{"type": "Point", "coordinates": [0, 1]}	1
["an array"]	1
["another array"]	1
false	1
true	1
"1000-01-01"	1
"1960-01-02"	1
"1970-01-02"	1
"2000-01-01"	1
"2000-01-02"	1
"2000-02-01"	1
"2010-12-02"	1
"9999-12-31"	1
"-630:59:59.000000"	1
"-24:00:00.000000"	1
"-12:00:00.000000"	1
"-00:00:00.000001"	1
"00:00:00.000000"	2
"00:00:00.001000"	1
"00:00:00.002000"	1
"00:00:00.010000"	1
"00:00:00.020000"	1
"00:00:01.000000"	1
"00:00:01.000001"	1
"01:00:00.000000"	1
"01:02:00.000000"	1
"01:02:03.000000"	1
"02:01:00.000000"	1
"03:04:05.000000"	1
"03:04:06.000000"	1
"23:59:59.999999"	1
"24:00:00.000000"	1
"630:59:59.000000"	1
"1000-01-01 00:00:00.000000"	1
"1960-01-02 03:04:05.000000"	1
"1960-01-02 03:04:06.000000"	1
"1970-01-02 00:00:01.000000"	2
"1970-01-02 00:00:01.000001"	2
"2000-01-01 00:00:00.000000"	2
"2000-01-01 00:00:00.001000"	2
"2000-01-01 00:00:00.002000"	2
"2000-01-01 00:00:00.010000"	2
"2000-01-01 00:00:00.020000"	2
"2000-01-01 23:59:59.999999"	2
"2000-01-02 00:00:00.000000"	2
"2000-02-01 00:00:00.000000"	2
"2010-12-02 01:00:00.000000"	2
"2010-12-02 01:02:00.000000"	2
"2010-12-02 01:02:03.000000"	2
"2010-12-02 02:01:00.000000"	2
"9999-12-31 23:59:59.999999"	1
"base64:type253:MTIzNGFiY2Q="	1
Warnings:
Warning	1235	This version of MySQL doesn't yet support 'sorting of non-scalar JSON values'
SELECT JSON_EXTRACT(j, '$') AS je, COUNT(*) FROM t GROUP BY je ORDER BY je;
je	COUNT(*)
NULL	2
null	1
-1e308	1
-1e307	1
-1e306	1
-1.5e200	1
-1e81	1
-999999999999999999999999999999999999999999999999999999999999999999999999999999999	1
-999999999999999999999999999999999999999999999999999999999999999999999999999999998	1
-999999999999999999999999999999999999999999999999999999999999999999999999999999997	1
-9.99e80	1
-9223372036854776001.000	1
-9223372036854776000.000	6
-9223372036854775808	2
-9223372036854775807	2
-9223372036854775806	2
-1001	3
-1000	3
-999	3
-101	3
-100	3
-99	3
-22	3
-21	3
-20	3
-12	3
-11	3
-10	3
-5	3
-4	3
-3.151	2
-3.150	2
-3.149	2
-3.141	2
-3.140	2
-3.139	2
-3.131	2
-3.130	2
-3.129	2
-3	3
-2	3
-1	3
-0.100	2
-0.010	2
-0.001	2
-1.5e-200	1
-1e-321	1
-1e-322	1
-1e-323	1
0	15
1e-323	1
1e-322	1
1e-321	1
1.5e-200	1
1e-16	2
1.1e-16	2
0.000000000000001	2
0.0000000000000011	2
0.001	2
0.010	2
0.100	2
1	6
2	6
3	6
3.129	2
3.130	2
3.131	2
3.139	2
3.140	2
3.141	2
3.149	2
3.150	2
3.151	2
4	6
5	6
10	6
11	6
12	6
20	6
21	6
22	6
99	6
100	6
101	6
999	6
1000	6
1001	6
9223372036854775806	4
9223372036854775807	4
9223372036854775808	2
9223372036854776000.000	9
9223372036854776001.000	1
18446744073709551614	2
18446744073709551615	2
1.8446744073709552e19	2
9.99e80	1
999999999999999999999999999999999999999999999999999999999999999999999999999999997	1
999999999999999999999999999999999999999999999999999999999999999999999999999999998	1
999999999999999999999999999999999999999999999999999999999999999999999999999999999	1
1e81	1
1.5e200	1
1e306	1
1e307	1
1e308	1
""	1
"abc"	1
"abc\u0000"	1
"abc\u0000\u0000"	1
"abcd"	1
"bc"	1
{"an": "object"}	1
{"another": "object"}	1
{"type": "Point", "coordinates": [0, 0]}	1
{"type": "Point", "coordinates": [0, 1]}	1
["an array"]	1
["another array"]	1
false	1
true	1
"1000-01-01"	1
"1960-01-02"	1
"1970-01-02"	1
"2000-01-01"	1
"2000-01-02"	1
"2000-02-01"	1
"2010-12-02"	1
"9999-12-31"	1
"-630:59:59.000000"	1
"-24:00:00.000000"	1
"-12:00:00.000000"	1
"-00:00:00.000001"	1
"00:00:00.000000"	2
"00:00:00.001000"	1
"00:00:00.002000"	1
"00:00:00.010000"	1
"00:00:00.020000"	1
"00:00:01.000000"	1
"00:00:01.000001"	1
"01:00:00.000000"	1
"01:02:00.000000"	1
"01:02:03.000000"	1
"02:01:00.000000"	1
"03:04:05.000000"	1
"03:04:06.000000"	1
"23:59:59.999999"	1
"24:00:00.000000"	1
"630:59:59.000000"	1
"1000-01-01 00:00:00.000000"	1
"1960-01-02 03:04:05.000000"	1
"1960-01-02 03:04:06.000000"	1
"1970-01-02 00:00:01.000000"	2
"1970-01-02 00:00:01.000001"	2
"2000-01-01 00:00:00.000000"	2
"2000-01-01 00:00:00.001000"	2
"2000-01-01 00:00:00.002000"	2
"2000-01-01 00:00:00.010000"	2
"2000-01-01 00:00:00.020000"	2
"2000-01-01 23:59:59.999999"	2
"2000-01-02 00:00:00.000000"	2
"2000-02-01 00:00:00.000000"	2
"2010-12-02 01:00:00.000000"	2
"2010-12-02 01:02:00.000000"	2
"2010-12-02 01:02:03.000000"	2
"2010-12-02 02:01:00.000000"	2
"9999-12-31 23:59:59.999999"	1
"base64:type253:MTIzNGFiY2Q="	1
Warnings:
Warning	1235	This version of MySQL doesn't yet support 'sorting of non-scalar JSON values'
SELECT j, COUNT(*) FROM t GROUP BY j WITH ROLLUP;
j	COUNT(*)
NULL	2
null	1
-1e308	1
-1e307	1
-1e306	1
-1.5e200	1
-1e81	1
-999999999999999999999999999999999999999999999999999999999999999999999999999999999	1
-999999999999999999999999999999999999999999999999999999999999999999999999999999998	1
-999999999999999999999999999999999999999999999999999999999999999999999999999999997	1
-9.99e80	1
-9223372036854776001.000	1
-9.223372036854776e18	6
-9223372036854775808	2
-9223372036854775807	2
-9223372036854775806	2
-1001	3
-1000	3
-999	3
-101	3
-100	3
-99	3
-22	3
-21	3
-20	3
-12	3
-11	3
-10	3
-5	3
-4	3
-3.151	2
-3.15	2
-3.149	2
-3.141	2
-3.14	2
-3.139	2
-3.131	2
-3.13	2
-3.129	2
-3	3
-2	3
-1	3
-0.1	2
-0.01	2
-0.001	2
-1.5e-200	1
-1e-321	1
-1e-322	1
-1e-323	1
0	15
1e-323	1
1e-322	1
1e-321	1
1.5e-200	1
1e-16	2
1.1e-16	2
0.000000000000001	2
0.0000000000000011	2
0.001	2
0.01	2
0.1	2
1	6
2	6
3	6
3.129	2
3.13	2
3.131	2
3.139	2
3.14	2
3.141	2
3.149	2
3.15	2
3.151	2
4	6
5	6
10	6
11	6
12	6
20	6
21.000	6
22.000	6
99.000	6
100.000	6
101.000	6
999.000	6
1000.000	6
1001.000	6
9223372036854775806.000	4
9223372036854775807.000	4
9223372036854775808.000	2
9223372036854776000.000	9
9223372036854776001.000	1
18446744073709551614.000	2
18446744073709551615.000	2
1.8446744073709552e19	2
9.99e80	1
999999999999999999999999999999999999999999999999999999999999999999999999999999997	1
999999999999999999999999999999999999999999999999999999999999999999999999999999998	1
999999999999999999999999999999999999999999999999999999999999999999999999999999999	1
1e81	1
1.5e200	1
1e306	1
1e307	1
1e308	1
""	1
"abc"	1
"abc\u0000"	1
"abc\u0000\u0000"	1
"abcd"	1
"bc"	1
{"an": "object"}	1
{"another": "object"}	1
{"type": "Point", "coordinates": [0, 0]}	1
{"type": "Point", "coordinates": [0, 1]}	1
["an array"]	1
["another array"]	1
false	1
true	1
"1000-01-01"	1
"1960-01-02"	1
"1970-01-02"	1
"2000-01-01"	1
"2000-01-02"	1
"2000-02-01"	1
"2010-12-02"	1
"9999-12-31"	1
"-630:59:59.000000"	1
"-24:00:00.000000"	1
"-12:00:00.000000"	1
"-00:00:00.000001"	1
"00:00:00.000000"	2
"00:00:00.001000"	1
"00:00:00.002000"	1
"00:00:00.010000"	1
"00:00:00.020000"	1
"00:00:01.000000"	1
"00:00:01.000001"	1
"01:00:00.000000"	1
"01:02:00.000000"	1
"01:02:03.000000"	1
"02:01:00.000000"	1
"03:04:05.000000"	1
"03:04:06.000000"	1
"23:59:59.999999"	1
"24:00:00.000000"	1
"630:59:59.000000"	1
"1000-01-01 00:00:00.000000"	1
"1960-01-02 03:04:05.000000"	1
"1960-01-02 03:04:06.000000"	1
"1970-01-02 00:00:01.000000"	2
"1970-01-02 00:00:01.000001"	2
"2000-01-01 00:00:00.000000"	2
"2000-01-01 00:00:00.001000"	2
"2000-01-01 00:00:00.002000"	2
"2000-01-01 00:00:00.010000"	2
"2000-01-01 00:00:00.020000"	2
"2000-01-01 23:59:59.999999"	2
"2000-01-02 00:00:00.000000"	2
"2000-02-01 00:00:00.000000"	2
"2010-12-02 01:00:00.000000"	2
"2010-12-02 01:02:00.000000"	2
"2010-12-02 01:02:03.000000"	2
"2010-12-02 02:01:00.000000"	2
"9999-12-31 23:59:59.999999"	1
"base64:type253:MTIzNGFiY2Q="	1
NULL	368
Warnings:
Warning	1235	This version of MySQL doesn't yet support 'sorting of non-scalar JSON values'
SELECT JSON_EXTRACT(j, '$') AS je, COUNT(*) FROM t GROUP BY je WITH ROLLUP;
je	COUNT(*)
NULL	2
null	1
-1e308	1
-1e307	1
-1e306	1
-1.5e200	1
-1e81	1
-999999999999999999999999999999999999999999999999999999999999999999999999999999999	1
-999999999999999999999999999999999999999999999999999999999999999999999999999999998	1
-999999999999999999999999999999999999999999999999999999999999999999999999999999997	1
-9.99e80	1
-9223372036854776001.000	1
-9.223372036854776e18	6
-9223372036854775808	2
-9223372036854775807	2
-9223372036854775806	2
-1001	3
-1000	3
-999	3
-101	3
-100	3
-99	3
-22	3
-21	3
-20	3
-12	3
-11	3
-10	3
-5	3
-4	3
-3.151	2
-3.15	2
-3.149	2
-3.141	2
-3.14	2
-3.139	2
-3.131	2
-3.13	2
-3.129	2
-3	3
-2	3
-1	3
-0.1	2
-0.01	2
-0.001	2
-1.5e-200	1
-1e-321	1
-1e-322	1
-1e-323	1
0	15
1e-323	1
1e-322	1
1e-321	1
1.5e-200	1
1e-16	2
1.1e-16	2
0.000000000000001	2
0.0000000000000011	2
0.001	2
0.01	2
0.1	2
1	6
2	6
3	6
3.129	2
3.13	2
3.131	2
3.139	2
3.14	2
3.141	2
3.149	2
3.15	2
3.151	2
4	6
5	6
10	6
11	6
12	6
20	6
21.000	6
22.000	6
99.000	6
100.000	6
101.000	6
999.000	6
1000.000	6
1001.000	6
9223372036854775806.000	4
9223372036854775807.000	4
9223372036854775808.000	2
9223372036854776000.000	9
9223372036854776001.000	1
18446744073709551614.000	2
18446744073709551615.000	2
1.8446744073709552e19	2
9.99e80	1
999999999999999999999999999999999999999999999999999999999999999999999999999999997	1
999999999999999999999999999999999999999999999999999999999999999999999999999999998	1
999999999999999999999999999999999999999999999999999999999999999999999999999999999	1
1e81	1
1.5e200	1
1e306	1
1e307	1
1e308	1
""	1
"abc"	1
"abc\u0000"	1
"abc\u0000\u0000"	1
"abcd"	1
"bc"	1
{"an": "object"}	1
{"another": "object"}	1
{"type": "Point", "coordinates": [0, 0]}	1
{"type": "Point", "coordinates": [0, 1]}	1
["an array"]	1
["another array"]	1
false	1
true	1
"1000-01-01"	1
"1960-01-02"	1
"1970-01-02"	1
"2000-01-01"	1
"2000-01-02"	1
"2000-02-01"	1
"2010-12-02"	1
"9999-12-31"	1
"-630:59:59.000000"	1
"-24:00:00.000000"	1
"-12:00:00.000000"	1
"-00:00:00.000001"	1
"00:00:00.000000"	2
"00:00:00.001000"	1
"00:00:00.002000"	1
"00:00:00.010000"	1
"00:00:00.020000"	1
"00:00:01.000000"	1
"00:00:01.000001"	1
"01:00:00.000000"	1
"01:02:00.000000"	1
"01:02:03.000000"	1
"02:01:00.000000"	1
"03:04:05.000000"	1
"03:04:06.000000"	1
"23:59:59.999999"	1
"24:00:00.000000"	1
"630:59:59.000000"	1
"1000-01-01 00:00:00.000000"	1
"1960-01-02 03:04:05.000000"	1
"1960-01-02 03:04:06.000000"	1
"1970-01-02 00:00:01.000000"	2
"1970-01-02 00:00:01.000001"	2
"2000-01-01 00:00:00.000000"	2
"2000-01-01 00:00:00.001000"	2
"2000-01-01 00:00:00.002000"	2
"2000-01-01 00:00:00.010000"	2
"2000-01-01 00:00:00.020000"	2
"2000-01-01 23:59:59.999999"	2
"2000-01-02 00:00:00.000000"	2
"2000-02-01 00:00:00.000000"	2
"2010-12-02 01:00:00.000000"	2
"2010-12-02 01:02:00.000000"	2
"2010-12-02 01:02:03.000000"	2
"2010-12-02 02:01:00.000000"	2
"9999-12-31 23:59:59.999999"	1
"base64:type253:MTIzNGFiY2Q="	1
NULL	368
Warnings:
Warning	1235	This version of MySQL doesn't yet support 'sorting of non-scalar JSON values'
DROP TABLE t, timestamps, datetimes, times, dates, signed_integers,
unsigned_integers, decimals, doubles;
CREATE TABLE t(j JSON NOT NULL);
INSERT INTO t VALUES ('1'), ('2'), ('10'), ('"1"'), ('"2"'), ('"10"'),
('true'), ('false'), ('null');
SELECT j FROM t ORDER BY j;
j
null
1
2
10
"1"
"10"
"2"
false
true
SELECT j FROM t ORDER BY JSON_EXTRACT(j, '$');
j
null
1
2
10
"1"
"10"
"2"
false
true
SELECT JSON_EXTRACT(j, '$') FROM t ORDER BY 1;
JSON_EXTRACT(j, '$')
null
1
2
10
"1"
"10"
"2"
false
true
SELECT j FROM t ORDER BY j+1, JSON_TYPE(j);
j
false
null
true
1
"1"
2
"2"
10
"10"
Warnings:
Warning	3156	Invalid JSON value for CAST to DOUBLE from column j at row 1
DROP TABLE t;
CREATE TABLE t(
j JSON,
stored_gc JSON GENERATED ALWAYS AS (JSON_EXTRACT(j, '$[0]')) STORED,
virtual_gc JSON GENERATED ALWAYS AS (JSON_EXTRACT(j, '$[1]')) VIRTUAL);
INSERT INTO t(j) VALUES
(JSON_ARRAY(1, 2)), (JSON_ARRAY(2, 1)), (JSON_ARRAY(10, 10)), (JSON_ARRAY(5));
SELECT * FROM t ORDER BY stored_gc;
j	stored_gc	virtual_gc
[1, 2]	1	2
[2, 1]	2	1
[5]	5	NULL
[10, 10]	10	10
SELECT * FROM t ORDER BY virtual_gc;
j	stored_gc	virtual_gc
[5]	5	NULL
[2, 1]	2	1
[1, 2]	1	2
[10, 10]	10	10
DROP TABLE t;
CREATE TABLE t(vc varchar(10));
INSERT INTO t VALUES ('["abc"]'), ('[1');
SELECT * FROM t ORDER BY CAST(vc AS JSON);
ERROR 22032: Invalid JSON text in argument 1 to function cast_as_json: "Missing a comma or ']' after an array element." at position 2.
SELECT * FROM t ORDER BY JSON_EXTRACT(vc, '$[0]');
ERROR 22032: Invalid JSON text in argument 1 to function json_extract: "Missing a comma or ']' after an array element." at position 2.
SELECT CAST(vc AS JSON) AS j FROM t ORDER BY j;
ERROR 22032: Invalid JSON text in argument 1 to function cast_as_json: "Missing a comma or ']' after an array element." at position 2.
SELECT JSON_EXTRACT(vc, '$[0]') AS j FROM t ORDER BY j;
ERROR 22032: Invalid JSON text in argument 1 to function json_extract: "Missing a comma or ']' after an array element." at position 2.
SELECT CAST(vc AS JSON) FROM t ORDER BY 1;
ERROR 22032: Invalid JSON text in argument 1 to function cast_as_json: "Missing a comma or ']' after an array element." at position 2.
SELECT JSON_EXTRACT(vc, '$[0]') FROM t ORDER BY 1;
ERROR 22032: Invalid JSON text in argument 1 to function json_extract: "Missing a comma or ']' after an array element." at position 2.
DROP TABLE t;
#
# Interal ordering of arrays and objects. Ordered by cardinality.
#
CREATE TABLE t(i int, j json);
INSERT INTO t VALUES
(1, '{}'), (2, '{"a":1}'), (3, '{"ab":2}'), (4, '{"a":1,"b":2}'),
(5, '{"c":3,"d":4}'), (6, '{"a":1,"b":2,"c":3,"d":4}');
INSERT INTO t VALUES
(1, '[]'), (2, '[1]'), (3, '[2]'), (4, '[1,2]'), (5, '[2,1]'), (6, '[1,2,3]'),
(7, '[1,2,3,4]'), (8, '[4,3,2,1]'), (9, '[1,2,3,4,5]');
INSERT INTO t SELECT i+100, j FROM t;
SELECT * FROM t ORDER BY j, i;
i	j
1	{}
101	{}
2	{"a": 1}
3	{"ab": 2}
102	{"a": 1}
103	{"ab": 2}
4	{"a": 1, "b": 2}
5	{"c": 3, "d": 4}
104	{"a": 1, "b": 2}
105	{"c": 3, "d": 4}
6	{"a": 1, "b": 2, "c": 3, "d": 4}
106	{"a": 1, "b": 2, "c": 3, "d": 4}
1	[]
101	[]
2	[1]
3	[2]
102	[1]
103	[2]
4	[1, 2]
5	[2, 1]
104	[1, 2]
105	[2, 1]
6	[1, 2, 3]
106	[1, 2, 3]
7	[1, 2, 3, 4]
8	[4, 3, 2, 1]
107	[1, 2, 3, 4]
108	[4, 3, 2, 1]
9	[1, 2, 3, 4, 5]
109	[1, 2, 3, 4, 5]
Warnings:
Warning	1235	This version of MySQL doesn't yet support 'sorting of non-scalar JSON values'
SELECT * FROM t ORDER BY j DESC, i;
i	j
9	[1, 2, 3, 4, 5]
109	[1, 2, 3, 4, 5]
7	[1, 2, 3, 4]
8	[4, 3, 2, 1]
107	[1, 2, 3, 4]
108	[4, 3, 2, 1]
6	[1, 2, 3]
106	[1, 2, 3]
4	[1, 2]
5	[2, 1]
104	[1, 2]
105	[2, 1]
2	[1]
3	[2]
102	[1]
103	[2]
1	[]
101	[]
6	{"a": 1, "b": 2, "c": 3, "d": 4}
106	{"a": 1, "b": 2, "c": 3, "d": 4}
4	{"a": 1, "b": 2}
5	{"c": 3, "d": 4}
104	{"a": 1, "b": 2}
105	{"c": 3, "d": 4}
2	{"a": 1}
3	{"ab": 2}
102	{"a": 1}
103	{"ab": 2}
1	{}
101	{}
Warnings:
Warning	1235	This version of MySQL doesn't yet support 'sorting of non-scalar JSON values'
SELECT j, COUNT(*) FROM t GROUP BY j ORDER BY j;
j	COUNT(*)
{}	2
{"a": 1}	2
{"ab": 2}	2
{"c": 3, "d": 4}	2
{"a": 1, "b": 2}	2
{"a": 1, "b": 2, "c": 3, "d": 4}	2
[]	2
[2]	2
[1]	2
[1, 2]	2
[2, 1]	2
[1, 2, 3]	2
[1, 2, 3, 4]	2
[4, 3, 2, 1]	2
[1, 2, 3, 4, 5]	2
Warnings:
Warning	1235	This version of MySQL doesn't yet support 'sorting of non-scalar JSON values'
SELECT j, COUNT(*) FROM t GROUP BY j WITH ROLLUP;
j	COUNT(*)
{}	2
{"a": 1}	2
{"ab": 2}	2
{"c": 3, "d": 4}	2
{"a": 1, "b": 2}	2
{"a": 1, "b": 2, "c": 3, "d": 4}	2
[]	2
[2]	2
[1]	2
[1, 2]	2
[2, 1]	2
[1, 2, 3]	2
[1, 2, 3, 4]	2
[4, 3, 2, 1]	2
[1, 2, 3, 4, 5]	2
NULL	30
Warnings:
Warning	1235	This version of MySQL doesn't yet support 'sorting of non-scalar JSON values'
DROP TABLE t;
# Test NULLs sorting.
CREATE TABLE t(i int, j json);
INSERT INTO t(i) VALUES (1),(2),(3),(2),(1);
SELECT * FROM t ORDER BY j, i;
i	j
1	NULL
1	NULL
2	NULL
2	NULL
3	NULL
SELECT * FROM t ORDER BY j DESC, i;
i	j
1	NULL
1	NULL
2	NULL
2	NULL
3	NULL
SELECT i, JSON_EXTRACT(j, '$') AS je FROM t ORDER BY je, i;
i	je
1	NULL
1	NULL
2	NULL
2	NULL
3	NULL
SELECT i, JSON_EXTRACT(j, '$') AS je FROM t ORDER BY je DESC, i;
i	je
1	NULL
1	NULL
2	NULL
2	NULL
3	NULL
INSERT INTO t(i, j) VALUES (1, '1');
SELECT * FROM t ORDER BY j, i;
i	j
1	NULL
1	NULL
2	NULL
2	NULL
3	NULL
1	1
SELECT * FROM t ORDER BY j DESC, i;
i	j
1	1
1	NULL
1	NULL
2	NULL
2	NULL
3	NULL
SELECT i, JSON_EXTRACT(j, '$') AS je FROM t ORDER BY je, i;
i	je
1	NULL
1	NULL
2	NULL
2	NULL
3	NULL
1	1
SELECT i, JSON_EXTRACT(j, '$') AS je FROM t ORDER BY je DESC, i;
i	je
1	1
1	NULL
1	NULL
2	NULL
2	NULL
3	NULL
DROP TABLE t;
CREATE TABLE t(vc TEXT, j JSON);
INSERT INTO t (vc) VALUES ('a'), ('b'), ('c');
INSERT INTO t SELECT * FROM t;
INSERT INTO t SELECT * FROM t;
INSERT INTO t SELECT * FROM t;
INSERT INTO t SELECT * FROM t;
INSERT INTO t SELECT * FROM t;
INSERT INTO t SELECT * FROM t;
INSERT INTO t SELECT * FROM t;
SELECT * FROM t ORDER BY vc, j;
vc	j
a	NULL
a	NULL
a	NULL
a	NULL
a	NULL
a	NULL
a	NULL
a	NULL
a	NULL
a	NULL
a	NULL
a	NULL
a	NULL
a	NULL
a	NULL
a	NULL
a	NULL
a	NULL
a	NULL
a	NULL
a	NULL
a	NULL
a	NULL
a	NULL
a	NULL
a	NULL
a	NULL
a	NULL
a	NULL
a	NULL
a	NULL
a	NULL
a	NULL
a	NULL
a	NULL
a	NULL
a	NULL
a	NULL
a	NULL
a	NULL
a	NULL
a	NULL
a	NULL
a	NULL
a	NULL
a	NULL
a	NULL
a	NULL
a	NULL
a	NULL
a	NULL
a	NULL
a	NULL
a	NULL
a	NULL
a	NULL
a	NULL
a	NULL
a	NULL
a	NULL
a	NULL
a	NULL
a	NULL
a	NULL
a	NULL
a	NULL
a	NULL
a	NULL
a	NULL
a	NULL
a	NULL
a	NULL
a	NULL
a	NULL
a	NULL
a	NULL
a	NULL
a	NULL
a	NULL
a	NULL
a	NULL
a	NULL
a	NULL
a	NULL
a	NULL
a	NULL
a	NULL
a	NULL
a	NULL
a	NULL
a	NULL
a	NULL
a	NULL
a	NULL
a	NULL
a	NULL
a	NULL
a	NULL
a	NULL
a	NULL
a	NULL
a	NULL
a	NULL
a	NULL
a	NULL
a	NULL
a	NULL
a	NULL
a	NULL
a	NULL
a	NULL
a	NULL
a	NULL
a	NULL
a	NULL
a	NULL
a	NULL
a	NULL
a	NULL
a	NULL
a	NULL
a	NULL
a	NULL
a	NULL
a	NULL
a	NULL
a	NULL
a	NULL
b	NULL
b	NULL
b	NULL
b	NULL
b	NULL
b	NULL
b	NULL
b	NULL
b	NULL
b	NULL
b	NULL
b	NULL
b	NULL
b	NULL
b	NULL
b	NULL
b	NULL
b	NULL
b	NULL
b	NULL
b	NULL
b	NULL
b	NULL
b	NULL
b	NULL
b	NULL
b	NULL
b	NULL
b	NULL
b	NULL
b	NULL
b	NULL
b	NULL
b	NULL
b	NULL
b	NULL
b	NULL
b	NULL
b	NULL
b	NULL
b	NULL
b	NULL
b	NULL
b	NULL
b	NULL
b	NULL
b	NULL
b	NULL
b	NULL
b	NULL
b	NULL
b	NULL
b	NULL
b	NULL
b	NULL
b	NULL
b	NULL
b	NULL
b	NULL
b	NULL
b	NULL
b	NULL
b	NULL
b	NULL
b	NULL
b	NULL
b	NULL
b	NULL
b	NULL
b	NULL
b	NULL
b	NULL
b	NULL
b	NULL
b	NULL
b	NULL
b	NULL
b	NULL
b	NULL
b	NULL
b	NULL
b	NULL
b	NULL
b	NULL
b	NULL
b	NULL
b	NULL
b	NULL
b	NULL
b	NULL
b	NULL
b	NULL
b	NULL
b	NULL
b	NULL
b	NULL
b	NULL
b	NULL
b	NULL
b	NULL
b	NULL
b	NULL
b	NULL
b	NULL
b	NULL
b	NULL
b	NULL
b	NULL
b	NULL
b	NULL
b	NULL
b	NULL
b	NULL
b	NULL
b	NULL
b	NULL
b	NULL
b	NULL
b	NULL
b	NULL
b	NULL
b	NULL
b	NULL
b	NULL
b	NULL
b	NULL
b	NULL
b	NULL
c	NULL
c	NULL
c	NULL
c	NULL
c	NULL
c	NULL
c	NULL
c	NULL
c	NULL
c	NULL
c	NULL
c	NULL
c	NULL
c	NULL
c	NULL
c	NULL
c	NULL
c	NULL
c	NULL
c	NULL
c	NULL
c	NULL
c	NULL
c	NULL
c	NULL
c	NULL
c	NULL
c	NULL
c	NULL
c	NULL
c	NULL
c	NULL
c	NULL
c	NULL
c	NULL
c	NULL
c	NULL
c	NULL
c	NULL
c	NULL
c	NULL
c	NULL
c	NULL
c	NULL
c	NULL
c	NULL
c	NULL
c	NULL
c	NULL
c	NULL
c	NULL
c	NULL
c	NULL
c	NULL
c	NULL
c	NULL
c	NULL
c	NULL
c	NULL
c	NULL
c	NULL
c	NULL
c	NULL
c	NULL
c	NULL
c	NULL
c	NULL
c	NULL
c	NULL
c	NULL
c	NULL
c	NULL
c	NULL
c	NULL
c	NULL
c	NULL
c	NULL
c	NULL
c	NULL
c	NULL
c	NULL
c	NULL
c	NULL
c	NULL
c	NULL
c	NULL
c	NULL
c	NULL
c	NULL
c	NULL
c	NULL
c	NULL
c	NULL
c	NULL
c	NULL
c	NULL
c	NULL
c	NULL
c	NULL
c	NULL
c	NULL
c	NULL
c	NULL
c	NULL
c	NULL
c	NULL
c	NULL
c	NULL
c	NULL
c	NULL
c	NULL
c	NULL
c	NULL
c	NULL
c	NULL
c	NULL
c	NULL
c	NULL
c	NULL
c	NULL
c	NULL
c	NULL
c	NULL
c	NULL
c	NULL
c	NULL
c	NULL
c	NULL
DROP TABLE t;
# ----------------------------------------------------------------------
# Test of JSON_VALID function.
# ----------------------------------------------------------------------

# Table - Json string column - utf-8, NULL
Note: 'utf8' is a subset of internal 'utf8mb4'

create table utf8_t (c varchar(20)) CHARACTER SET 'utf8';
insert into utf8_t values (NULL);
# Expect NULL:
select JSON_VALID(c) from utf8_t;
JSON_VALID(c)
NULL
delete from utf8_t;

# Table - Json string column - utf-8, valid
insert into utf8_t values ('[123]');
select JSON_VALID(c) from utf8_t;
JSON_VALID(c)
1
delete from utf8_t;

# Table - Json string column - utf-8, non-utf8
insert into utf8_t values ('[123');
expect 0 (false)
select JSON_VALID(c) from utf8_t;
JSON_VALID(c)
0
delete from utf8_t;

# Table - Try to extract JSON from TIMESTAMP column
ALTER TABLE utf8_t ADD d TIMESTAMP;
# Should give false; not string or JSON type
# and we do not convert automatically from TIMESTAMP to JSON
insert into utf8_t values (NULL, '2014-11-25 18:00');
select JSON_VALID(d) from utf8_t;
JSON_VALID(d)
0
# Explicit cast to a character data type
# allows MySQL to parse this is a JSON text
# The string isn't a legal JSON document, tho, so not valid.
select JSON_VALID(CAST(d as CHAR)) from utf8_t;
JSON_VALID(CAST(d as CHAR))
0
# Should give true
select JSON_VALID(CONCAT( CONCAT('"', CAST(d as CHAR)), '"')) from utf8_t;
JSON_VALID(CONCAT( CONCAT('"', CAST(d as CHAR)), '"'))
1
delete from utf8_t;
drop table utf8_t;

# Table - JSON type; should give true by definition
create table json_t(t json);
insert into json_t values ('[123]');
select json_VALID(t) from json_t;
json_VALID(t)
1

# String literal - valid JSON
select JSON_VALID('123');
JSON_VALID('123')
1
select JSON_VALID('-123');
JSON_VALID('-123')
1
select JSON_VALID('5000000000');
JSON_VALID('5000000000')
1
select JSON_VALID('-5000000000');
JSON_VALID('-5000000000')
1
select JSON_VALID('1.23');
JSON_VALID('1.23')
1
select JSON_VALID('"123"');
JSON_VALID('"123"')
1
select JSON_VALID('true');
JSON_VALID('true')
1
select JSON_VALID('false');
JSON_VALID('false')
1
select JSON_VALID('null');
JSON_VALID('null')
1
select JSON_VALID('{"address": "Trondheim"}');
JSON_VALID('{"address": "Trondheim"}')
1

# String literal - not valid JSON
select JSON_VALID('12 3');
JSON_VALID('12 3')
0

# String literal not in UTF-8
set names 'ascii';
select JSON_VALID('123');
JSON_VALID('123')
1
set names 'utf8';

# Json expression
select JSON_VALID(cast('[123]' as JSON ));
JSON_VALID(cast('[123]' as JSON ))
1

# Json expression NULL
select JSON_VALID(cast(NULL as JSON ));
JSON_VALID(cast(NULL as JSON ))
NULL

# Bare NULL
select JSON_VALID( NULL );
JSON_VALID( NULL )
NULL

# Function result - string
select JSON_VALID( UPPER('"abc"') );
JSON_VALID( UPPER('"abc"') )
1
set names 'latin1';

# Function result - string
select JSON_VALID( UPPER('"abc"') );
JSON_VALID( UPPER('"abc"') )
1
set names 'utf8';

# Function result - date, not valid as JSON without CAST
select JSON_VALID( CAST('2015-01-15' AS DATE) );
JSON_VALID( CAST('2015-01-15' AS DATE) )
0

# The date string doesn't parse as JSON text, so wrong:
select JSON_VALID( CAST(CAST('2015-01-15' AS DATE) as CHAR CHARACTER SET 'utf8') );
JSON_VALID( CAST(CAST('2015-01-15' AS DATE) as CHAR CHARACTER SET 'utf8') )
0
# OK, though:
select JSON_VALID( CAST(CURDATE() as JSON) );
JSON_VALID( CAST(CURDATE() as JSON) )
1

# Function result - NULL
select JSON_VALID( UPPER(NULL) );
JSON_VALID( UPPER(NULL) )
NULL
select JSON_VALID( UPPER(CAST(NULL as CHAR)) );
JSON_VALID( UPPER(CAST(NULL as CHAR)) )
NULL

# Function result - JSON
select JSON_VALID( JSON_ARRAY(t, t) ) from json_t;
JSON_VALID( JSON_ARRAY(t, t) )
1
drop table json_t;
SELECT JSON_VALID( '{ "firstName" : "Fred", "lastName" : "Flintstone" }' );
JSON_VALID( '{ "firstName" : "Fred", "lastName" : "Flintstone" }' )
1
SELECT JSON_VALID( '3' );
JSON_VALID( '3' )
1
SELECT JSON_VALID( null );
JSON_VALID( null )
NULL
# ----------------------------------------------------------------------
# Test of JSON_CONTAINS_PATH function.
# ----------------------------------------------------------------------
select json_contains_path();
ERROR 42000: Incorrect parameter count in the call to native function 'json_contains_path'
select json_contains_path('{ "a": true }' );
ERROR 42000: Incorrect parameter count in the call to native function 'json_contains_path'
select json_contains_path('{ "a": true }', 'all' );
ERROR 42000: Incorrect parameter count in the call to native function 'json_contains_path'
select json_contains_path('{ "a": tru }', 'all', '$' );
ERROR 22032: Invalid JSON text in argument 1 to function json_contains_path: "Invalid value." at position 10.
select json_contains_path('{ "a": true }', 'all', '$[' );
ERROR 42000: Invalid JSON path expression. The error is around character position 2.
select json_contains_path('{ "a": true }', 'all', '$a.***[3]' );
ERROR 42000: Invalid JSON path expression. The error is around character position 1.
select json_contains_path('{ "a": true }', 'foo', '$.a' );
ERROR 42000: The oneOrAll argument to json_contains_path may take these values: 'one' or 'all'.
select json_contains_path('{}', 'all', cast('$' as binary));
ERROR 22032: Cannot create a JSON value from a string with CHARACTER SET 'binary'.
select json_contains_path(null, 'all', '$.a' );
json_contains_path(null, 'all', '$.a' )
NULL
select json_contains_path('{ "a": true }', null, '$.a' );
json_contains_path('{ "a": true }', null, '$.a' )
NULL
select json_contains_path('{ "a": true }', 'all', null );
json_contains_path('{ "a": true }', 'all', null )
NULL
select json_contains_path('{ "a": true }', 'all', '$' );
json_contains_path('{ "a": true }', 'all', '$' )
1
select json_contains_path('{ "a": true }', 'all', '$.a' );
json_contains_path('{ "a": true }', 'all', '$.a' )
1
select json_contains_path('{ "a": true }', 'one', '$.a' );
json_contains_path('{ "a": true }', 'one', '$.a' )
1
select json_contains_path('{ "a": true }', 'all', '$.b' );
json_contains_path('{ "a": true }', 'all', '$.b' )
0
select json_contains_path('{ "a": true }', 'one', '$.b' );
json_contains_path('{ "a": true }', 'one', '$.b' )
0
select json_contains_path('{ "a": true }', 'all', '$.a', '$.b' );
json_contains_path('{ "a": true }', 'all', '$.a', '$.b' )
0
select json_contains_path('{ "a": true }', 'all', '$.b', '$.a' );
json_contains_path('{ "a": true }', 'all', '$.b', '$.a' )
0
select json_contains_path('{ "a": true }', 'ALL', '$.a', '$.b' );
json_contains_path('{ "a": true }', 'ALL', '$.a', '$.b' )
0
select json_contains_path('{ "a": true }', 'aLl', '$.a', '$.b' );
json_contains_path('{ "a": true }', 'aLl', '$.a', '$.b' )
0
select json_contains_path('{ "a": true }', 'one', '$.a', '$.b' );
json_contains_path('{ "a": true }', 'one', '$.a', '$.b' )
1
select json_contains_path('{ "a": true }', 'one', '$.b', '$.a' );
json_contains_path('{ "a": true }', 'one', '$.b', '$.a' )
1
select json_contains_path('{ "a": true }', 'ONE', '$.a', '$.b' );
json_contains_path('{ "a": true }', 'ONE', '$.a', '$.b' )
1
select json_contains_path('{ "a": true }', 'oNe', '$.a', '$.b' );
json_contains_path('{ "a": true }', 'oNe', '$.a', '$.b' )
1
select json_contains_path('{ "a": true, "b": [ 1, 2, { "c": [ 4, 5, { "d": [ 6, 7, 8, 9, 10 ]} ] } ] }', 'all', '$**[4]' );
json_contains_path('{ "a": true, "b": [ 1, 2, { "c": [ 4, 5, { "d": [ 6, 7, 8, 9, 10 ]} ] } ] }', 'all', '$**[4]' )
1
select json_contains_path('{ "a": true, "b": [ 1, 2, { "c": [ 4, 5, { "d": [ 6, 7, 8, 9, 10 ]} ] } ] }', 'all', '$**[4]', '$**[5]' );
json_contains_path('{ "a": true, "b": [ 1, 2, { "c": [ 4, 5, { "d": [ 6, 7, 8, 9, 10 ]} ] } ] }', 'all', '$**[4]', '$**[5]' )
0
select json_contains_path('{ "a": true, "b": [ 1, 2, { "c": [ 4, 5, { "d": [ 6, 7, 8, 9, 10 ]} ] } ] }', 'all', '$**.c[2]' );
json_contains_path('{ "a": true, "b": [ 1, 2, { "c": [ 4, 5, { "d": [ 6, 7, 8, 9, 10 ]} ] } ] }', 'all', '$**.c[2]' )
1
select json_contains_path('{ "a": true, "b": [ 1, 2, { "c": [ 4, 5, { "d": [ 6, 7, 8, 9, 10 ]} ] } ] }', 'all', '$**.c[3]' );
json_contains_path('{ "a": true, "b": [ 1, 2, { "c": [ 4, 5, { "d": [ 6, 7, 8, 9, 10 ]} ] } ] }', 'all', '$**.c[3]' )
0
select json_contains_path('{"a":1, "b":2}', 'one', '$.*');
json_contains_path('{"a":1, "b":2}', 'one', '$.*')
1
select json_contains_path('[1,2,3]', 'one', '$.*');
json_contains_path('[1,2,3]', 'one', '$.*')
0
select json_contains_path('{}', 'one', '$[*]');
json_contains_path('{}', 'one', '$[*]')
0
SELECT JSON_CONTAINS_PATH('[1, [[{"x": [{"a":{"b":{"c":42}}}]}]]]',
'one', '$**.a.*');
JSON_CONTAINS_PATH('[1, [[{"x": [{"a":{"b":{"c":42}}}]}]]]',
'one', '$**.a.*')
1
SELECT JSON_CONTAINS_PATH('[1, [[{"x": [{"a":{"b":{"c":42}}}]}]]]',
'all', '$**.a.*');
JSON_CONTAINS_PATH('[1, [[{"x": [{"a":{"b":{"c":42}}}]}]]]',
'all', '$**.a.*')
1
SELECT JSON_CONTAINS_PATH('[1,2,3]', 'one', '$**[*]');
JSON_CONTAINS_PATH('[1,2,3]', 'one', '$**[*]')
1
SELECT JSON_CONTAINS_PATH('[1,2,3]', 'all', '$**[*]');
JSON_CONTAINS_PATH('[1,2,3]', 'all', '$**[*]')
1
select json_contains_path('{ "a": true, "b": [ 1, 2 ] }', 'all', '$**[1]', '$.b[0]', '$.c' );
json_contains_path('{ "a": true, "b": [ 1, 2 ] }', 'all', '$**[1]', '$.b[0]', '$.c' )
0
select json_contains_path('{ "a": true, "b": [ 1, 2 ] }', 'all', '$.c', '$**[1]', '$.b[0]' );
json_contains_path('{ "a": true, "b": [ 1, 2 ] }', 'all', '$.c', '$**[1]', '$.b[0]' )
0
select json_contains_path('{ "a": true, "b": [ 1, 2 ] }', 'all', '$.b[0]', '$.c', '$**[1]' );
json_contains_path('{ "a": true, "b": [ 1, 2 ] }', 'all', '$.b[0]', '$.c', '$**[1]' )
0
select json_contains_path('{ "a": true, "b": [ 1, 2 ] }', 'one', '$**[1]', '$.b[0]', '$.c' );
json_contains_path('{ "a": true, "b": [ 1, 2 ] }', 'one', '$**[1]', '$.b[0]', '$.c' )
1
select json_contains_path('{ "a": true, "b": [ 1, 2 ] }', 'one', '$.c', '$**[1]', '$.b[0]' );
json_contains_path('{ "a": true, "b": [ 1, 2 ] }', 'one', '$.c', '$**[1]', '$.b[0]' )
1
select json_contains_path('{ "a": true, "b": [ 1, 2 ] }', 'one', '$.b[0]', '$.c', '$**[1]' );
json_contains_path('{ "a": true, "b": [ 1, 2 ] }', 'one', '$.b[0]', '$.c', '$**[1]' )
1
SELECT JSON_CONTAINS_PATH
(
'{ "a" : 123, "b" : [ 123, 456 ] }',
'all',
'$.a.c',
'$.b[1]'
);
JSON_CONTAINS_PATH
(
'{ "a" : 123, "b" : [ 123, 456 ] }',
'all',
'$.a.c',
'$.b[1]'
)
0
SELECT JSON_CONTAINS_PATH
(
'{ "a" : 123, "b" : [ 123, 456 ] }',
'one',
'$.a.c',
'$.b[1]'
);
JSON_CONTAINS_PATH
(
'{ "a" : 123, "b" : [ 123, 456 ] }',
'one',
'$.a.c',
'$.b[1]'
)
1
SELECT JSON_CONTAINS_PATH
(
'{ "a" : 123, "b" : [ 123, 456 ] }',
'all',
'$.c'
);
JSON_CONTAINS_PATH
(
'{ "a" : 123, "b" : [ 123, 456 ] }',
'all',
'$.c'
)
0
SELECT JSON_CONTAINS_PATH
(
'{ "a" : 123, "b" : [ 123, { "c" : { "d" : true } } ] }',
'all',
'$.b[1].c.d'
);
JSON_CONTAINS_PATH
(
'{ "a" : 123, "b" : [ 123, { "c" : { "d" : true } } ] }',
'all',
'$.b[1].c.d'
)
1
# ----------------------------------------------------------------------
# Test of JSON_LENGTH function.
# ----------------------------------------------------------------------
create table utf8_mj_length (a int, c varchar(20)) CHARACTER SET 'utf8';
insert into utf8_mj_length values( 1, null );
insert into utf8_mj_length values( 2, '1' );
insert into utf8_mj_length values( 3, 'abc' );
insert into utf8_mj_length values( 4, '"abc"' );
insert into utf8_mj_length values ( 5, 'true' );
insert into utf8_mj_length values ( 6, 'false' );
insert into utf8_mj_length values ( 7, 'null' );
select a, c, json_length( c ) from utf8_mj_length where a = 1;
a	c	json_length( c )
1	NULL	NULL
select a, c, json_length( c ) from utf8_mj_length where a = 2;
a	c	json_length( c )
2	1	1

# invalid json text
select a, c, json_length( c ) from utf8_mj_length where a = 3;
ERROR 22032: Invalid JSON text in argument 1 to function json_length: "Invalid value." at position 0.
select a, c, json_length( c ) from utf8_mj_length where a = 4;
a	c	json_length( c )
4	"abc"	1
select a, c, json_length( c ) from utf8_mj_length where a = 5;
a	c	json_length( c )
5	true	1
select a, c, json_length( c ) from utf8_mj_length where a = 6;
a	c	json_length( c )
6	false	1
select a, c, json_length( c ) from utf8_mj_length where a = 7;
a	c	json_length( c )
7	null	1
create table json_mj_length( a int, b json );
insert into json_mj_length values( 1, NULL );
select a, b, json_length( b ) from json_mj_length where a = 1;
a	b	json_length( b )
1	NULL	NULL
set names 'ascii';

# path auto-converted to a utf8 string from ascii

select a, c, json_length( c, '$' ) from utf8_mj_length where a = 2;
a	c	json_length( c, '$' )
2	1	1
set names 'utf8';
select a, c, json_length( c, '$' ) from utf8_mj_length where a = 1;
a	c	json_length( c, '$' )
1	NULL	NULL
select a, c, json_length( c, '$' ) from utf8_mj_length where a = 2;
a	c	json_length( c, '$' )
2	1	1

# invalid json text
select a, c, json_length( c, '$' ) from utf8_mj_length where a = 3;
ERROR 22032: Invalid JSON text in argument 1 to function json_length: "Invalid value." at position 0.
select a, c, json_length( c, '$' ) from utf8_mj_length where a = 4;
a	c	json_length( c, '$' )
4	"abc"	1
select a, c, json_length( c, '$' ) from utf8_mj_length where a = 5;
a	c	json_length( c, '$' )
5	true	1
select a, c, json_length( c, '$' ) from utf8_mj_length where a = 6;
a	c	json_length( c, '$' )
6	false	1
select a, c, json_length( c, '$' ) from utf8_mj_length where a = 7;
a	c	json_length( c, '$' )
7	null	1
select a, b, json_length( b, '$' ) from json_mj_length where a = 1;
a	b	json_length( b, '$' )
1	NULL	NULL
drop table utf8_mj_length;
drop table json_mj_length;
select json_length( null );
json_length( null )
NULL
select json_length( '1' );
json_length( '1' )
1

# invalid json text
select json_length( 'abc' );
ERROR 22032: Invalid JSON text in argument 1 to function json_length: "Invalid value." at position 0.
select json_length( '"abc"' );
json_length( '"abc"' )
1
select json_length( 'true' );
json_length( 'true' )
1
select json_length( 'false' );
json_length( 'false' )
1
select json_length( 'null' );
json_length( 'null' )
1
select json_length( '{}' );
json_length( '{}' )
0
select json_length( '{ "a" : 100, "b" : 200 }' );
json_length( '{ "a" : 100, "b" : 200 }' )
2
select json_length( '{ "a" : 100, "b" : [ 300, 400, 500 ] }' );
json_length( '{ "a" : 100, "b" : [ 300, 400, 500 ] }' )
2
select json_length( '[]' );
json_length( '[]' )
0
select json_length( '[ null, "foo", true, 1.1 ]' );
json_length( '[ null, "foo", true, 1.1 ]' )
4
select json_length( '[ null, "foo", true, { "a" : "b", "c" : "d" } ]' );
json_length( '[ null, "foo", true, { "a" : "b", "c" : "d" } ]' )
4
select json_length( '"foo"' );
json_length( '"foo"' )
1
select json_length( '1.2' );
json_length( '1.2' )
1

# invalid json path
select json_length( 'true', 'c$' );
ERROR 42000: Invalid JSON path expression. The error is around character position 1.

# invalid json path
select json_length( '{ "foo" : [ true, false ] }', '$.foo[bar]' );
ERROR 42000: Invalid JSON path expression. The error is around character position 6.

# wildcards not allowed in path expressions for this function
select json_length( 'true', '$.*' );
ERROR 42000: In this situation, path expressions may not contain the * and ** tokens.

# wildcards not allowed in path expressions for this function
select json_length( 'true', '$.foo**.bar' );
ERROR 42000: In this situation, path expressions may not contain the * and ** tokens.
select json_length( '[ 1, [ 2, 3, 4 ], 5 ]', '$[0]' );
json_length( '[ 1, [ 2, 3, 4 ], 5 ]', '$[0]' )
1
select json_length( '[ 1, [ 2, 3, 4 ], 5 ]', '$[1]' );
json_length( '[ 1, [ 2, 3, 4 ], 5 ]', '$[1]' )
3
select json_length( '[ 1, [ 2, 3, 4 ], 5 ]', '$[2]' );
json_length( '[ 1, [ 2, 3, 4 ], 5 ]', '$[2]' )
1
select json_length( '[ 1, [ 2, 3, 4 ], 5 ]', '$[2][0]' );
json_length( '[ 1, [ 2, 3, 4 ], 5 ]', '$[2][0]' )
1
select json_length( '[ 1, [ 2, 3, 4 ], {"a": 1} ]', '$[2][0]' );
json_length( '[ 1, [ 2, 3, 4 ], {"a": 1} ]', '$[2][0]' )
1
select json_length( '[ 1, [ 2, 3, 4 ], 5 ]', '$[2][1]' );
json_length( '[ 1, [ 2, 3, 4 ], 5 ]', '$[2][1]' )
NULL
select json_length( '[ 1, { "a": true, "b": false, "c": null }, 5 ]', '$[1]' );
json_length( '[ 1, { "a": true, "b": false, "c": null }, 5 ]', '$[1]' )
3
SELECT JSON_LENGTH
(
'{}'
);
JSON_LENGTH
(
'{}'
)
0
SELECT JSON_LENGTH
(
'3'
);
JSON_LENGTH
(
'3'
)
1
SELECT JSON_LENGTH
(
'{ "a" : 123, "b" : [ 123, 456, 789 ] }'
);
JSON_LENGTH
(
'{ "a" : 123, "b" : [ 123, 456, 789 ] }'
)
2
SELECT JSON_LENGTH
(
'{ "a" : 123, "b" : [ 123, 456, 789 ] }',
'$.b'
);
JSON_LENGTH
(
'{ "a" : 123, "b" : [ 123, 456, 789 ] }',
'$.b'
)
3
SELECT JSON_LENGTH
(
'{ "a" : 123, "b" : [ 123, 456, 789 ] }',
'$.c'
);
JSON_LENGTH
(
'{ "a" : 123, "b" : [ 123, 456, 789 ] }',
'$.c'
)
NULL
# ----------------------------------------------------------------------
# Test of JSON_DEPTH function.
# ----------------------------------------------------------------------
select json_depth(null);
json_depth(null)
NULL
select json_depth(cast(null as json));
json_depth(cast(null as json))
NULL
select i, json_depth(j) from t1;
i	json_depth(j)
0	NULL
1	2
2	2
3	3
4	3
5	1
6	1
7	1
8	1
9	1
10	1
11	1
12	1
13	1
14	1
15	1
16	1
17	1
18	1
19	1
20	1
21	1
22	1
23	1
24	1
25	1
26	1
27	1
28	3
29	1
30	1
31	1
100	2
select json_depth(cast('[]' as json)),
json_depth(cast('{}' as json)),
json_depth(cast('null' as json)),
json_depth(json_quote('foo'));
json_depth(cast('[]' as json))	json_depth(cast('{}' as json))	json_depth(cast('null' as json))	json_depth(json_quote('foo'))
1	1	1	1
select json_depth(cast('[[2], 3, [[[4]]]]' as json));
json_depth(cast('[[2], 3, [[[4]]]]' as json))
5
select json_depth(cast('{"a": {"a1": [3]}, "b": {"b1": {"c": {"d": [5]}}}}' as json));
json_depth(cast('{"a": {"a1": [3]}, "b": {"b1": {"c": {"d": [5]}}}}' as json))
6
SELECT JSON_DEPTH
(
'{}'
);
JSON_DEPTH
(
'{}'
)
1
SELECT JSON_DEPTH
(
'[]'
);
JSON_DEPTH
(
'[]'
)
1
SELECT JSON_DEPTH( '"abc"' );
JSON_DEPTH( '"abc"' )
1
SELECT JSON_DEPTH( CAST( '"abc"' AS JSON ) );
JSON_DEPTH( CAST( '"abc"' AS JSON ) )
1
SELECT JSON_DEPTH( 1 );
ERROR 22032: Invalid data type for JSON data in argument 1 to function json_depth; a JSON string or JSON type is required.
SELECT JSON_DEPTH( 'abc' );
ERROR 22032: Invalid JSON text in argument 1 to function json_depth: "Invalid value." at position 0.
SELECT JSON_DEPTH( CAST( 1 AS JSON ) );
JSON_DEPTH( CAST( 1 AS JSON ) )
1
SELECT JSON_DEPTH
(
'{ "a" : true, "b" : false, "c" : null }'
);
JSON_DEPTH
(
'{ "a" : true, "b" : false, "c" : null }'
)
2
SELECT JSON_DEPTH
(
'[ "a", true, "b" , false, "c" , null ]'
);
JSON_DEPTH
(
'[ "a", true, "b" , false, "c" , null ]'
)
2
SELECT JSON_DEPTH
(
'{ "a" : true, "b" : {}, "c" : null }'
);
JSON_DEPTH
(
'{ "a" : true, "b" : {}, "c" : null }'
)
2
SELECT JSON_DEPTH
(
'[ "a", true, "b" , {}, "c" , null ]'
);
JSON_DEPTH
(
'[ "a", true, "b" , {}, "c" , null ]'
)
2
SELECT JSON_DEPTH
(
'{ "a" : true, "b" : { "e" : false }, "c" : null }'
);
JSON_DEPTH
(
'{ "a" : true, "b" : { "e" : false }, "c" : null }'
)
3
SELECT JSON_DEPTH
(
'[ "a", true, "b" , { "e" : false }, "c" , null ]'
);
JSON_DEPTH
(
'[ "a", true, "b" , { "e" : false }, "c" , null ]'
)
3
SELECT JSON_DEPTH
(
'[ "a", true, "b" , { "e" : false }, "c" , null'
);
ERROR 22032: Invalid JSON text in argument 1 to function json_depth: "Missing a comma or ']' after an array element." at position 46.
# ----------------------------------------------------------------------
# Test of JSON_REMOVE function.
# ----------------------------------------------------------------------
select json_remove( null, '$[1]' );
json_remove( null, '$[1]' )
NULL
select json_remove( null, '$[1]' ) is null;
json_remove( null, '$[1]' ) is null
1
select json_remove( '[ 1, { "a": true, "b": false, "c": null }, 5 ]', null );
json_remove( '[ 1, { "a": true, "b": false, "c": null }, 5 ]', null )
NULL
select json_remove( '[ 1, { "a": true, "b": false, "c": null }, 5 ]', null ) is null;
json_remove( '[ 1, { "a": true, "b": false, "c": null }, 5 ]', null ) is null
1
select json_remove( '[ 1, { "a": true, "b": false, "c": null }, 5 ]', '$[1]', null );
json_remove( '[ 1, { "a": true, "b": false, "c": null }, 5 ]', '$[1]', null )
NULL
select json_remove( '[ 1, { "a": true, "b": false, "c": null }, 5 ]', '$[1]', null ) is null;
json_remove( '[ 1, { "a": true, "b": false, "c": null }, 5 ]', '$[1]', null ) is null
1

# not enough args
select json_remove();
ERROR 42000: Incorrect parameter count in the call to native function 'json_remove'

# not enough args
select json_remove( '[ 1, { "a": true, "b": false, "c": null }, 5 ]' );
ERROR 42000: Incorrect parameter count in the call to native function 'json_remove'

# not enough args
select json_remove( '$[1]' );
ERROR 42000: Incorrect parameter count in the call to native function 'json_remove'

# invalid json text
select json_remove( '[ 1, { "a": true, "b": false, "c": null }, 5 ', '$[1]', '$[2]' );
ERROR 22032: Invalid JSON text in argument 1 to function json_remove: "Missing a comma or ']' after an array element." at position 45.

# invalid json path
select json_remove( '[ 1, { "a": true, "b": false, "c": null }, 5 ]', '$[1', '$[2]' );
ERROR 42000: Invalid JSON path expression. The error is around character position 3.

# invalid json path
select json_remove( '[ 1, { "a": true, "b": false, "c": null }, 5 ]', '$[1]', '$[2' );
ERROR 42000: Invalid JSON path expression. The error is around character position 3.

# Vacuous path expression
select json_remove( '[ 1, 2, 3 ]', '$' );
ERROR 42000: The path expression '$' is not allowed in this context.

# Vacuous path expression
select json_remove( '[ 1, 2, 3 ]', '$', '$[2]' );
ERROR 42000: The path expression '$' is not allowed in this context.

# Vacuous path expression
select json_remove( '[ 1, 2, 3 ]', '$[1]', '$' );
ERROR 42000: The path expression '$' is not allowed in this context.
select json_remove( '[ 1, 2, 3 ]', '$[*]' );
ERROR 42000: In this situation, path expressions may not contain the * and ** tokens.
select json_remove( '[ 1, 2, 3 ]', '$**[2]' );
ERROR 42000: In this situation, path expressions may not contain the * and ** tokens.
select json_remove( '[ 1, 2, 3 ]', '$[2]', '$[*]' );
ERROR 42000: In this situation, path expressions may not contain the * and ** tokens.
select json_remove( '[ 1, 2, 3 ]', '$[2]', '$**[2]' );
ERROR 42000: In this situation, path expressions may not contain the * and ** tokens.
select json_remove( '[ 1, 2, 3 ]', '$[0]' );
json_remove( '[ 1, 2, 3 ]', '$[0]' )
[2, 3]
select json_remove( '[ 1, 2, 3 ]', '$[1]' );
json_remove( '[ 1, 2, 3 ]', '$[1]' )
[1, 3]
select json_remove( '[ 1, 2, 3 ]', '$[2]' );
json_remove( '[ 1, 2, 3 ]', '$[2]' )
[1, 2]
select json_remove( '[ 1, 2, 3 ]', '$[3]' );
json_remove( '[ 1, 2, 3 ]', '$[3]' )
[1, 2, 3]
select json_remove( '[ 1, { "a": true, "b": false, "c": null }, 5 ]', '$[1]' );
json_remove( '[ 1, { "a": true, "b": false, "c": null }, 5 ]', '$[1]' )
[1, 5]
select json_remove( '[ { "a": { "a": true } } ]', '$**.a' );
ERROR 42000: In this situation, path expressions may not contain the * and ** tokens.
select json_remove( '[ { "a": true }, { "b": false }, { "c": null }, { "a": null } ]', '$[0].a', '$[2].c' );
json_remove( '[ { "a": true }, { "b": false }, { "c": null }, { "a": null } ]', '$[0].a', '$[2].c' )
[{}, {"b": false}, {}, {"a": null}]
select json_remove( '[ { "a": true }, { "b": [ { "c": { "a": true } }  ] }, { "c": null }, { "a": null } ]', '$**.a' );
ERROR 42000: In this situation, path expressions may not contain the * and ** tokens.
select json_remove( '{"id": 123, "name": "systemQA", "array": [1, 2, 3]}', '$[0]' );
json_remove( '{"id": 123, "name": "systemQA", "array": [1, 2, 3]}', '$[0]' )
{"id": 123, "name": "systemQA", "array": [1, 2, 3]}
CREATE TABLE json_remove_t(j JSON, p TEXT);
INSERT INTO json_remove_t(p) VALUES ('$.a'), ('$.b'), ('$.c');
UPDATE json_remove_t SET j = '{"a":1,"b":2,"c":3}';
SELECT j, p, json_remove(j, p) FROM json_remove_t ORDER BY p;
j	p	json_remove(j, p)
{"a": 1, "b": 2, "c": 3}	$.a	{"b": 2, "c": 3}
{"a": 1, "b": 2, "c": 3}	$.b	{"a": 1, "c": 3}
{"a": 1, "b": 2, "c": 3}	$.c	{"a": 1, "b": 2}
DROP TABLE json_remove_t;
SELECT JSON_REMOVE
(
'{"a" : "foo", "b" : [true, {"c" : 123}]}',
'$.b[ 1 ]'
);
JSON_REMOVE
(
'{"a" : "foo", "b" : [true, {"c" : 123}]}',
'$.b[ 1 ]'
)
{"a": "foo", "b": [true]}
SELECT JSON_REMOVE
(
'{ "a" : "foo", "b" : [ true, { "c" : 123, "c" : 456 } ] }',
'$.b[ 1 ].c'
);
JSON_REMOVE
(
'{ "a" : "foo", "b" : [ true, { "c" : 123, "c" : 456 } ] }',
'$.b[ 1 ].c'
)
{"a": "foo", "b": [true, {}]}
SELECT JSON_REMOVE
(
'{ "a" : "foo", "b" : [ true, { "c" : 123 } ] }',
'$.b[ 1 ].c'
);
JSON_REMOVE
(
'{ "a" : "foo", "b" : [ true, { "c" : 123 } ] }',
'$.b[ 1 ].c'
)
{"a": "foo", "b": [true, {}]}
SELECT JSON_REMOVE
(
'{ "a" : "foo", "b" : [ true, { "c" : 123, "d" : 456 } ] }',
'$.b[ 1 ].e'
);
JSON_REMOVE
(
'{ "a" : "foo", "b" : [ true, { "c" : 123, "d" : 456 } ] }',
'$.b[ 1 ].e'
)
{"a": "foo", "b": [true, {"c": 123, "d": 456}]}
# ----------------------------------------------------------------------
# Test of JSON_MERGE function.
# ----------------------------------------------------------------------

# not enough args
select json_merge();
ERROR 42000: Incorrect parameter count in the call to native function 'json_merge'

# not enough args
select json_merge( '[ 1, 2, 3 ]' );
ERROR 42000: Incorrect parameter count in the call to native function 'json_merge'
select json_merge( null, null );
json_merge( null, null )
NULL
select json_merge( null, '[ 1, 2, 3 ]' );
json_merge( null, '[ 1, 2, 3 ]' )
NULL
select json_merge( '[ 1, 2, 3 ]', null );
json_merge( '[ 1, 2, 3 ]', null )
NULL
select json_merge( null, '[ 1, 2, 3 ]', '[ 4, 5, 6 ]' );
json_merge( null, '[ 1, 2, 3 ]', '[ 4, 5, 6 ]' )
NULL
select json_merge( '[ 1, 2, 3 ]', null, '[ 4, 5, 6 ]' );
json_merge( '[ 1, 2, 3 ]', null, '[ 4, 5, 6 ]' )
NULL
select json_merge( '[ 1, 2, 3 ]', '[ 4, 5, 6 ]', null );
json_merge( '[ 1, 2, 3 ]', '[ 4, 5, 6 ]', null )
NULL
select json_merge( '[1, 2]', '[3, 4' );
ERROR 22032: Invalid JSON text in argument 2 to function json_merge: "Missing a comma or ']' after an array element." at position 5.
select json_merge( '[1, 2', '[3, 4]' );
ERROR 22032: Invalid JSON text in argument 1 to function json_merge: "Missing a comma or ']' after an array element." at position 5.
select json_merge( '1', '2' );
json_merge( '1', '2' )
[1, 2]
select json_merge( '1', '[2, 3]' );
json_merge( '1', '[2, 3]' )
[1, 2, 3]
select json_merge( '[1, 2]', '3' );
json_merge( '[1, 2]', '3' )
[1, 2, 3]
select json_merge( '1', '{ "a": 2 }' );
json_merge( '1', '{ "a": 2 }' )
[1, {"a": 2}]
select json_merge( '{ "a": 2 }', '1' );
json_merge( '{ "a": 2 }', '1' )
[{"a": 2}, 1]
select json_merge( '[1, 2]', '[3, 4]' );
json_merge( '[1, 2]', '[3, 4]' )
[1, 2, 3, 4]
select json_merge( '{ "a": 2 }', '{ "b": 3}' );
json_merge( '{ "a": 2 }', '{ "b": 3}' )
{"a": 2, "b": 3}
select json_merge( '[1, 2]', '{ "a": 2 }' );
json_merge( '[1, 2]', '{ "a": 2 }' )
[1, 2, {"a": 2}]
select json_merge( '{ "a": 2 }', '[1, 2]' );
json_merge( '{ "a": 2 }', '[1, 2]' )
[{"a": 2}, 1, 2]
select json_merge( '{"a": 1, "b": 2 }', '{"b": 3, "d": 4 }' );
json_merge( '{"a": 1, "b": 2 }', '{"b": 3, "d": 4 }' )
{"a": 1, "b": [2, 3], "d": 4}
select json_merge( '{"a": 1, "b": 2 }', '{"b": [3, 4], "d": 4 }' );
json_merge( '{"a": 1, "b": 2 }', '{"b": [3, 4], "d": 4 }' )
{"a": 1, "b": [2, 3, 4], "d": 4}
select json_merge( '{"a": 1, "b": [2, 3] }', '{"b": 4, "d": 4 }' );
json_merge( '{"a": 1, "b": [2, 3] }', '{"b": 4, "d": 4 }' )
{"a": 1, "b": [2, 3, 4], "d": 4}
select json_merge( '{"a": 1, "b": 2 }', '{"b": {"e": 7, "f": 8}, "d": 4 }' );
json_merge( '{"a": 1, "b": 2 }', '{"b": {"e": 7, "f": 8}, "d": 4 }' )
{"a": 1, "b": [2, {"e": 7, "f": 8}], "d": 4}
select json_merge( '{"b": {"e": 7, "f": 8}, "d": 4 }', '{"a": 1, "b": 2 }' );
json_merge( '{"b": {"e": 7, "f": 8}, "d": 4 }', '{"a": 1, "b": 2 }' )
{"a": 1, "b": [{"e": 7, "f": 8}, 2], "d": 4}
select json_merge( '{"a": 1, "b": [2, 9] }', '{"b": [10, 11], "d": 4 }' );
json_merge( '{"a": 1, "b": [2, 9] }', '{"b": [10, 11], "d": 4 }' )
{"a": 1, "b": [2, 9, 10, 11], "d": 4}
select json_merge( '{"a": 1, "b": [2, 9] }', '{"b": {"e": 7, "f": 8}, "d": 4 }' );
json_merge( '{"a": 1, "b": [2, 9] }', '{"b": {"e": 7, "f": 8}, "d": 4 }' )
{"a": 1, "b": [2, 9, {"e": 7, "f": 8}], "d": 4}
select json_merge( '{"b": {"e": 7, "f": 8}, "d": 4 }', '{"a": 1, "b": [2, 9] }' );
json_merge( '{"b": {"e": 7, "f": 8}, "d": 4 }', '{"a": 1, "b": [2, 9] }' )
{"a": 1, "b": [{"e": 7, "f": 8}, 2, 9], "d": 4}
select json_merge( '{"b": {"e": 7, "f": 8}, "d": 4 }', '{ "a": 1, "b": {"e": 20, "g": 21 } }' );
json_merge( '{"b": {"e": 7, "f": 8}, "d": 4 }', '{ "a": 1, "b": {"e": 20, "g": 21 } }' )
{"a": 1, "b": {"e": [7, 20], "f": 8, "g": 21}, "d": 4}
select json_merge( '1', '2', '3' );
json_merge( '1', '2', '3' )
[1, 2, 3]
select json_merge( '[1, 2 ]', '3', '[4, 5]' );
json_merge( '[1, 2 ]', '3', '[4, 5]' )
[1, 2, 3, 4, 5]
select json_merge
(
'{ "a": true, "b": { "c": 3, "d": 4 }, "e": [ 1, 2 ] }',
'{ "d": false, "b": { "g": 3, "d": 5 }, "f": [ 1, 2 ] }',
'{ "m": true, "b": { "h": 8, "d": 4 }, "e": [ 3, 4 ] }'
);
json_merge
(
'{ "a": true, "b": { "c": 3, "d": 4 }, "e": [ 1, 2 ] }',
'{ "d": false, "b": { "g": 3, "d": 5 }, "f": [ 1, 2 ] }',
'{ "m": true, "b": { "h": 8, "d": 4 }, "e": [ 3, 4 ] }'
)
{"a": true, "b": {"c": 3, "d": [4, 5, 4], "g": 3, "h": 8}, "d": false, "e": [1, 2, 3, 4], "f": [1, 2], "m": true}
CREATE TABLE json_merge_t(i INT, j JSON);
INSERT INTO json_merge_t VALUES
(0, NULL),
(1, 'true'),
(2, '5'),
(3, '[1,2]'),
(4, '{"a":["x", "y"]}'),
(5, '{"a":"b","c":"d"}');
SELECT t1.j, t2.j, json_merge(t1.j, t2.j), json_merge(t2.j, t1.j)
FROM json_merge_t t1, json_merge_t t2 ORDER BY t1.i, t2.i;
j	j	json_merge(t1.j, t2.j)	json_merge(t2.j, t1.j)
NULL	NULL	NULL	NULL
NULL	true	NULL	NULL
NULL	5	NULL	NULL
NULL	[1, 2]	NULL	NULL
NULL	{"a": ["x", "y"]}	NULL	NULL
NULL	{"a": "b", "c": "d"}	NULL	NULL
true	NULL	NULL	NULL
true	true	[true, true]	[true, true]
true	5	[true, 5]	[5, true]
true	[1, 2]	[true, 1, 2]	[1, 2, true]
true	{"a": ["x", "y"]}	[true, {"a": ["x", "y"]}]	[{"a": ["x", "y"]}, true]
true	{"a": "b", "c": "d"}	[true, {"a": "b", "c": "d"}]	[{"a": "b", "c": "d"}, true]
5	NULL	NULL	NULL
5	true	[5, true]	[true, 5]
5	5	[5, 5]	[5, 5]
5	[1, 2]	[5, 1, 2]	[1, 2, 5]
5	{"a": ["x", "y"]}	[5, {"a": ["x", "y"]}]	[{"a": ["x", "y"]}, 5]
5	{"a": "b", "c": "d"}	[5, {"a": "b", "c": "d"}]	[{"a": "b", "c": "d"}, 5]
[1, 2]	NULL	NULL	NULL
[1, 2]	true	[1, 2, true]	[true, 1, 2]
[1, 2]	5	[1, 2, 5]	[5, 1, 2]
[1, 2]	[1, 2]	[1, 2, 1, 2]	[1, 2, 1, 2]
[1, 2]	{"a": ["x", "y"]}	[1, 2, {"a": ["x", "y"]}]	[{"a": ["x", "y"]}, 1, 2]
[1, 2]	{"a": "b", "c": "d"}	[1, 2, {"a": "b", "c": "d"}]	[{"a": "b", "c": "d"}, 1, 2]
{"a": ["x", "y"]}	NULL	NULL	NULL
{"a": ["x", "y"]}	true	[{"a": ["x", "y"]}, true]	[true, {"a": ["x", "y"]}]
{"a": ["x", "y"]}	5	[{"a": ["x", "y"]}, 5]	[5, {"a": ["x", "y"]}]
{"a": ["x", "y"]}	[1, 2]	[{"a": ["x", "y"]}, 1, 2]	[1, 2, {"a": ["x", "y"]}]
{"a": ["x", "y"]}	{"a": ["x", "y"]}	{"a": ["x", "y", "x", "y"]}	{"a": ["x", "y", "x", "y"]}
{"a": ["x", "y"]}	{"a": "b", "c": "d"}	{"a": ["x", "y", "b"], "c": "d"}	{"a": ["b", "x", "y"], "c": "d"}
{"a": "b", "c": "d"}	NULL	NULL	NULL
{"a": "b", "c": "d"}	true	[{"a": "b", "c": "d"}, true]	[true, {"a": "b", "c": "d"}]
{"a": "b", "c": "d"}	5	[{"a": "b", "c": "d"}, 5]	[5, {"a": "b", "c": "d"}]
{"a": "b", "c": "d"}	[1, 2]	[{"a": "b", "c": "d"}, 1, 2]	[1, 2, {"a": "b", "c": "d"}]
{"a": "b", "c": "d"}	{"a": ["x", "y"]}	{"a": ["b", "x", "y"], "c": "d"}	{"a": ["x", "y", "b"], "c": "d"}
{"a": "b", "c": "d"}	{"a": "b", "c": "d"}	{"a": ["b", "b"], "c": ["d", "d"]}	{"a": ["b", "b"], "c": ["d", "d"]}
DROP TABLE json_merge_t;
SELECT JSON_MERGE
(
'{ "a" : "foo", "b" : [ true, { "c" : 123 } ] }',
'[ 5, 6]'
);
JSON_MERGE
(
'{ "a" : "foo", "b" : [ true, { "c" : 123 } ] }',
'[ 5, 6]'
)
[{"a": "foo", "b": [true, {"c": 123}]}, 5, 6]
SELECT JSON_MERGE
(
'{ "a" : "foo", "b" : [ true, { "c" : 123 } ] }',
'{ "b": [ false, 34 ] }'
);
JSON_MERGE
(
'{ "a" : "foo", "b" : [ true, { "c" : 123 } ] }',
'{ "b": [ false, 34 ] }'
)
{"a": "foo", "b": [true, {"c": 123}, false, 34]}
SELECT JSON_MERGE
(
'{ "a" : "foo", "b" : [ true, { "c" : 123 } ] }',
'{ "b": "bar" }'
);
JSON_MERGE
(
'{ "a" : "foo", "b" : [ true, { "c" : 123 } ] }',
'{ "b": "bar" }'
)
{"a": "foo", "b": [true, {"c": 123}, "bar"]}
SELECT JSON_MERGE
(
'{ "a" : { "b" : 1 } }',
'{ "a" : { "c" : 1 } }'
);
JSON_MERGE
(
'{ "a" : { "b" : 1 } }',
'{ "a" : { "c" : 1 } }'
)
{"a": {"b": 1, "c": 1}}
# ----------------------------------------------------------------------
# Test of JSON_TYPE function.
# ----------------------------------------------------------------------
select json_type('abc');
ERROR 22032: Invalid JSON text in argument 1 to function json_type: "Invalid value." at position 0.
select i, json_type(j) from t1;
i	json_type(j)
0	NULL
1	OBJECT
2	ARRAY
3	OBJECT
4	ARRAY
5	STRING
6	BOOLEAN
7	BOOLEAN
8	NULL
9	INTEGER
10	UNSIGNED INTEGER
11	INTEGER
12	INTEGER
13	INTEGER
14	INTEGER
15	INTEGER
16	INTEGER
17	INTEGER
18	INTEGER
19	UNSIGNED INTEGER
20	DOUBLE
21	DOUBLE
22	OBJECT
23	ARRAY
24	DATETIME
25	TIME
26	DATE
27	DATETIME
28	OBJECT
29	ARRAY
30	BIT
31	BIT
100	OBJECT
select json_type('{"a": 2}');
json_type('{"a": 2}')
OBJECT
select json_type('[1,2]');
json_type('[1,2]')
ARRAY
select json_type('"scalar string"');
json_type('"scalar string"')
STRING
select json_type('true');
json_type('true')
BOOLEAN
select json_type('false');
json_type('false')
BOOLEAN
select json_type('null');
json_type('null')
NULL
select json_type('1');
json_type('1')
INTEGER
select json_type('-0');
json_type('-0')
INTEGER
select json_type('-0.0');
json_type('-0.0')
DOUBLE
select json_type(-1);
ERROR 22032: Invalid data type for JSON data in argument 1 to function json_type; a JSON string or JSON type is required.
select json_type(CAST(1 AS UNSIGNED));
ERROR 22032: Invalid data type for JSON data in argument 1 to function json_type; a JSON string or JSON type is required.
select json_type('32767');
json_type('32767')
INTEGER
select json_type(PI());
ERROR 22032: Invalid data type for JSON data in argument 1 to function json_type; a JSON string or JSON type is required.
select json_type('3.14');
json_type('3.14')
DOUBLE
select json_type(CAST(CAST('2015-01-15' AS DATE) as CHAR CHARACTER SET 'utf8'));
ERROR 22032: Invalid JSON text in argument 1 to function json_type: "The document root must not follow by other values." at position 4.
create table keys1(i int, j json);
insert into keys1 select * from t1;
DROP TABLE t1;
create table rawOrders( orderID int, doc json );
insert into rawOrders values ( 1, '100' ), ( 2, '{ "id": 2, "quantity": 200 }' );
create table orders( orderID int, quantity int unsigned );
INSERT INTO orders( orderID, quantity )
SELECT
r.orderID,
CASE( JSON_TYPE( r.doc ) )
WHEN "INTEGER" THEN CAST( r.doc AS UNSIGNED INT )
WHEN "OBJECT" THEN CAST( JSON_EXTRACT( r.doc, '$.quantity' ) AS UNSIGNED INT )
ELSE NULL
END
FROM rawOrders r;
select * from rawOrders;
orderID	doc
1	100
2	{"id": 2, "quantity": 200}
select * from orders;
orderID	quantity
1	100
2	200
drop table rawOrders;
drop table orders;
select charset(json_type('{}'));
charset(json_type('{}'))
utf8mb4
# ----------------------------------------------------------------------
# Test of CAST(<column> AS JSON)
# ----------------------------------------------------------------------
create table t1(dati datetime, da date,
tim time, ts timestamp,
y year,
--
ti tinyint,   tiu tinyint unsigned,
si smallint,  siu smallint unsigned,
mi mediumint, miu mediumint unsigned,
i  int,       iu  int unsigned,
bi bigint,    biu bigint unsigned,
boo boolean,
--
dc decimal(5,2),
n numeric(5,2),
--
f float, d double,
bitt bit(10),
blb blob,
bin binary(10),
en enum('a','b','c'),
se set('a','b','c'),
--
ge geometry,
po point,
ls linestring,
py polygon,
js json
);
insert into t1 values('2014-11-25 18:00', '2014-11-25',
'18:00:59', '2014-11-25 18:00',
'1999',
--
127, 255,
32767, 65535,
8388607, 16777215, -- 3 bytes
2147483647, 4294967295, -- 4 bytes
9223372036854775807, 18446744073709551615,
true,
--
3.14,
3.14,
--
3.14, 3.14,
b'10101',
'10101abcde',
'10101abcde',
'b',
'a,c',
--
ST_GeomFromText('POINT(1 1)'),
ST_GeomFromText('POINT(1 1)'),
ST_GeomFromText('LINESTRING(0 0,1 1,2 2)'),
ST_GeomFromText('POLYGON((0 0,10 0,10 10,0 10,0 0),
                                            (5 5,7 5,7 7,5 7, 5 5))'),
'[123]'
                      );
select json_type(cast(dati as json)) from t1;
json_type(cast(dati as json))
DATETIME
select json_type(cast(da as json)) from t1;
json_type(cast(da as json))
DATE
select json_type(cast(tim as json)) from t1;
json_type(cast(tim as json))
TIME
select json_type(cast(ts as json)) from t1;
json_type(cast(ts as json))
TIMESTAMP
select json_type(cast(y as json)) from t1;
json_type(cast(y as json))
OPAQUE
select json_type(cast(ti as json)) from t1;
json_type(cast(ti as json))
INTEGER
select json_type(cast(tiu as json)) from t1;
json_type(cast(tiu as json))
UNSIGNED INTEGER
select json_type(cast(si as json)) from t1;
json_type(cast(si as json))
INTEGER
select json_type(cast(siu as json)) from t1;
json_type(cast(siu as json))
UNSIGNED INTEGER
select json_type(cast(mi as json)) from t1;
json_type(cast(mi as json))
INTEGER
select json_type(cast(miu as json)) from t1;
json_type(cast(miu as json))
UNSIGNED INTEGER
select json_type(cast(i as json)) from t1;
json_type(cast(i as json))
INTEGER
select json_type(cast(iu as json)) from t1;
json_type(cast(iu as json))
UNSIGNED INTEGER
select json_type(cast(bi as json)) from t1;
json_type(cast(bi as json))
INTEGER
select json_type(cast(biu as json)) from t1;
json_type(cast(biu as json))
UNSIGNED INTEGER
select json_type(cast(boo as json)) from t1;
json_type(cast(boo as json))
INTEGER
select json_type(cast(dc as json)) from t1;
json_type(cast(dc as json))
DECIMAL
select json_type(cast(f as json)) from t1;
json_type(cast(f as json))
DOUBLE
select json_type(cast(d as json)) from t1;
json_type(cast(d as json))
DOUBLE
select json_type(cast(bitt as json)) from t1;
json_type(cast(bitt as json))
BIT
select json_type(cast(blb as json)) from t1;
json_type(cast(blb as json))
BLOB
select json_type(cast(bin as json)) from t1;
json_type(cast(bin as json))
BLOB
select json_type(cast(en as json)) from t1;
json_type(cast(en as json))
STRING
select json_type(cast(se as json)) from t1;
json_type(cast(se as json))
STRING
select json_type(cast(ge as json)) from t1;
json_type(cast(ge as json))
OBJECT
select json_type(cast(po as json)) from t1;
json_type(cast(po as json))
OBJECT
select json_type(cast(ls as json)) from t1;
json_type(cast(ls as json))
OBJECT
select json_type(cast(py as json)) from t1;
json_type(cast(py as json))
OBJECT
select json_type(cast(js as json)) from t1;
json_type(cast(js as json))
ARRAY
select cast(dati as json) from t1;
cast(dati as json)
"2014-11-25 18:00:00.000000"
select cast(da as json) from t1;
cast(da as json)
"2014-11-25"
select cast(tim as json) from t1;
cast(tim as json)
"18:00:59.000000"
select cast(ts as json) from t1;
cast(ts as json)
"2014-11-25 18:00:00.000000"
select cast(y as json) from t1;
cast(y as json)
"base64:type13:MTk5OQ=="
select cast(ti as json) from t1;
cast(ti as json)
127
select cast(tiu as json) from t1;
cast(tiu as json)
255
select cast(si as json) from t1;
cast(si as json)
32767
select cast(siu as json) from t1;
cast(siu as json)
65535
select cast(mi as json) from t1;
cast(mi as json)
8388607
select cast(miu as json) from t1;
cast(miu as json)
16777215
select cast(i as json) from t1;
cast(i as json)
2147483647
select cast(iu as json) from t1;
cast(iu as json)
4294967295
select cast(bi as json) from t1;
cast(bi as json)
9223372036854775807
select cast(biu as json) from t1;
cast(biu as json)
18446744073709551615
select cast(boo as json) from t1;
cast(boo as json)
1
select cast(dc as json) from t1;
cast(dc as json)
3.14
select cast(f as json) from t1;
cast(f as json)
3.140000104904175
select cast(d as json) from t1;
cast(d as json)
3.14
select cast(bitt as json) from t1;
cast(bitt as json)
"base64:type16:ABU="
select cast(blb as json) from t1;
cast(blb as json)
"base64:type252:MTAxMDFhYmNkZQ=="
select cast(bin as json) from t1;
cast(bin as json)
"base64:type254:MTAxMDFhYmNkZQ=="
select cast(en as json) from t1;
cast(en as json)
"b"
select cast(se as json) from t1;
cast(se as json)
"a,c"
select cast(ge as json) from t1;
cast(ge as json)
{"type": "Point", "coordinates": [1, 1]}
select cast(po as json) from t1;
cast(po as json)
{"type": "Point", "coordinates": [1, 1]}
select cast(ls as json) from t1;
cast(ls as json)
{"type": "LineString", "coordinates": [[0, 0], [1, 1], [2, 2]]}
select cast(py as json) from t1;
cast(py as json)
{"type": "Polygon", "coordinates": [[[0, 0], [10, 0], [10, 10], [0, 10], [0, 0]], [[5, 5], [7, 5], [7, 7], [5, 7], [5, 5]]]}
select cast(js as json) from t1;
cast(js as json)
[123]
#
# Bug#21442878 INCORRECT RETURN STATUS FROM
#              ITEM_JSON_TYPECAST::VAL_JSON() ON PARSE ERRORS
#
select json_extract(en, '$') from t1;
ERROR 22032: Invalid data type for JSON data in argument 1 to function json_extract; a JSON string or JSON type is required.
drop table t1;
create table t1 ( c1 varchar(200) character set 'latin1',
c2 varchar(200) character set 'utf8' );
insert into t1 values ('[1,2]',  # legal json, but not utf-8
'[1,2 ');
select cast(c1 as json) from t1;
cast(c1 as json)
[1, 2]
select cast(c2 as json) from t1;
ERROR 22032: Invalid JSON text in argument 1 to function cast_as_json: "Missing a comma or ']' after an array element." at position 5.
select cast(c2 as json) is null from t1;
ERROR 22032: Invalid JSON text in argument 1 to function cast_as_json: "Missing a comma or ']' after an array element." at position 5.
drop table t1;
# ----------------------------------------------------------------------
# Test of CAST(literal AS JSON)
# ----------------------------------------------------------------------
select json_type(cast(cast('2014-11-25 18:00' as datetime) as json));
json_type(cast(cast('2014-11-25 18:00' as datetime) as json))
DATETIME
select json_type(cast(cast('2014-11-25' as date) as json));
json_type(cast(cast('2014-11-25' as date) as json))
DATE
select json_type(cast(cast('18:00:59' as time) as json));
json_type(cast(cast('18:00:59' as time) as json))
TIME
select json_type(cast(127 as json));
json_type(cast(127 as json))
INTEGER
select json_type(cast(255 as json));
json_type(cast(255 as json))
INTEGER
select json_type(cast(32767 as json));
json_type(cast(32767 as json))
INTEGER
select json_type(cast(65535 as json));
json_type(cast(65535 as json))
INTEGER
select json_type(cast(8388607 as json));
json_type(cast(8388607 as json))
INTEGER
select json_type(cast(16777215 as json));
json_type(cast(16777215 as json))
INTEGER
select json_type(cast(2147483647 as json));
json_type(cast(2147483647 as json))
INTEGER
select json_type(cast(4294967295 as json));
json_type(cast(4294967295 as json))
INTEGER
select json_type(cast(9223372036854775807 as json));
json_type(cast(9223372036854775807 as json))
INTEGER
select json_type(cast(18446744073709551615 as json));
json_type(cast(18446744073709551615 as json))
UNSIGNED INTEGER
select json_type(cast(true as json));
json_type(cast(true as json))
BOOLEAN
select json_type(cast(b'10101' as json));
json_type(cast(b'10101' as json))
BIT
select json_type(cast(cast(3.14 as decimal(5,2)) as json));
json_type(cast(cast(3.14 as decimal(5,2)) as json))
DECIMAL
select json_type(cast(3.14 as json));
json_type(cast(3.14 as json))
DECIMAL
select json_type(cast(3.14E30 as json));
json_type(cast(3.14E30 as json))
DOUBLE
select json_type(cast(cast('10101abcde' as binary) as json));
json_type(cast(cast('10101abcde' as binary) as json))
BLOB
select json_type(cast(ST_GeomFromText('POINT(1 1)') as json));
json_type(cast(ST_GeomFromText('POINT(1 1)') as json))
OBJECT
select json_type(cast(ST_GeomFromText('LINESTRING(0 0,1 1,2 2)') as json));
json_type(cast(ST_GeomFromText('LINESTRING(0 0,1 1,2 2)') as json))
OBJECT
select json_type(cast(ST_GeomFromText('POLYGON((0 0,10 0,10 10,0 10,0 0),
                                     (5 5,7 5,7 7,5 7, 5 5))') as json));
json_type(cast(ST_GeomFromText('POLYGON((0 0,10 0,10 10,0 10,0 0),
                                     (5 5,7 5,7 7,5 7, 5 5))') as json))
OBJECT
select json_type(cast(null as json));
json_type(cast(null as json))
NULL
select json_type(cast(null as json)) is null;
json_type(cast(null as json)) is null
1
select json_type(null) is null;
json_type(null) is null
1
select cast(cast('2014-11-25 18:00' as datetime) as json);
cast(cast('2014-11-25 18:00' as datetime) as json)
"2014-11-25 18:00:00.000000"
select cast(cast('2014-11-25' as date) as json);
cast(cast('2014-11-25' as date) as json)
"2014-11-25"
select cast(cast('18:00:59' as time) as json);
cast(cast('18:00:59' as time) as json)
"18:00:59.000000"
select cast(127 as json);
cast(127 as json)
127
select cast(255 as json);
cast(255 as json)
255
select cast(32767 as json);
cast(32767 as json)
32767
select cast(65535 as json);
cast(65535 as json)
65535
select cast(8388607 as json);
cast(8388607 as json)
8388607
select cast(16777215 as json);
cast(16777215 as json)
16777215
select cast(2147483647 as json);
cast(2147483647 as json)
2147483647
select cast(4294967295 as json);
cast(4294967295 as json)
4294967295
select cast(9223372036854775807 as json);
cast(9223372036854775807 as json)
9223372036854775807
select cast(18446744073709551615 as json);
cast(18446744073709551615 as json)
18446744073709551615
select cast(true as json);
cast(true as json)
true
select cast(b'10101' as json);
cast(b'10101' as json)
"base64:type16:FQ=="
select cast(cast(3.14 as decimal(5,2)) as json);
cast(cast(3.14 as decimal(5,2)) as json)
3.14
select cast(3.14 as json);
cast(3.14 as json)
3.14
select cast(3.14e0 as json);
cast(3.14e0 as json)
3.14
select cast(cast('10101abcde' as binary) as json);
cast(cast('10101abcde' as binary) as json)
"base64:type253:MTAxMDFhYmNkZQ=="
select cast(ST_GeomFromText('POINT(1 1)') as json);
cast(ST_GeomFromText('POINT(1 1)') as json)
{"type": "Point", "coordinates": [1, 1]}
select cast(ST_GeomFromText('LINESTRING(0 0,1 1,2 2)') as json);
cast(ST_GeomFromText('LINESTRING(0 0,1 1,2 2)') as json)
{"type": "LineString", "coordinates": [[0, 0], [1, 1], [2, 2]]}
select cast(ST_GeomFromText('POLYGON((0 0,10 0,10 10,0 10,0 0),
                                     (5 5,7 5,7 7,5 7, 5 5))') as json);
cast(ST_GeomFromText('POLYGON((0 0,10 0,10 10,0 10,0 0),
                                     (5 5,7 5,7 7,5 7, 5 5))') as json)
{"type": "Polygon", "coordinates": [[[0, 0], [10, 0], [10, 10], [0, 10], [0, 0]], [[5, 5], [7, 5], [7, 7], [5, 7], [5, 5]]]}
select cast(null as json);
cast(null as json)
NULL
select cast(null as json) is null;
cast(null as json) is null
1
create table t2(x int);
insert into t2 values (1), (2);
select x, cast(y as json) from (select x, cast(x as json) as y from t2) s;
x	cast(y as json)
1	1
2	2
select x, cast(y as json) from (select x, cast(cast(x as json) as char charset utf8) as y from t2) s;
x	cast(y as json)
1	1
2	2
select cast('"abc"' as json);
cast('"abc"' as json)
"abc"
select cast('abc' as json);
ERROR 22032: Invalid JSON text in argument 1 to function cast_as_json: "Invalid value." at position 0.
drop table t2;
# ----------------------------------------------------------------------
# Test of CAST(<select> AS JSON)
# ----------------------------------------------------------------------
select cast((select 1) as json);
cast((select 1) as json)
1
create table t(i int, j json, c char(10) character set 'utf8');
insert into t values (5, '6', '{}');
select cast((select i from t) as json);
cast((select i from t) as json)
5
select cast((select j from t) as json);
cast((select j from t) as json)
6
select cast((select c from t) as json);
cast((select c from t) as json)
{}
select cast((select cast(i as json) from t) as json);
cast((select cast(i as json) from t) as json)
5
select cast((select cast(j as json) from t) as json);
cast((select cast(j as json) from t) as json)
6
select cast((select cast(c as json) from t) as json);
cast((select cast(c as json) from t) as json)
{}
select cast((select i,i from t) as json);
ERROR 21000: Operand should contain 1 column(s)
select cast((select * from t) as json);
ERROR 21000: Operand should contain 1 column(s)
insert into t values (7, '8', '[]');
select cast((select i from t) as json);
ERROR 21000: Subquery returns more than 1 row
delete from t;
insert into t values (null, null, null);
select cast((select i from t) as json);
cast((select i from t) as json)
NULL
select cast((select j from t) as json);
cast((select j from t) as json)
NULL
select cast((select cast(i as json) from t) as json);
cast((select cast(i as json) from t) as json)
NULL
select cast((select cast(j as json) from t) as json);
cast((select cast(j as json) from t) as json)
NULL
select cast((select cast(c as json) from t) as json);
cast((select cast(c as json) from t) as json)
NULL
drop table t;
# ----------------------------------------------------------------------
# Test of generated columns that call JSON functions
# ----------------------------------------------------------------------
CREATE TABLE t(id INT, j JSON,
gc INT GENERATED ALWAYS AS (JSON_EXTRACT(j, '$[0]')));
INSERT INTO t(id, j) VALUES (0, '"5"'), (1, '[]'), (2, '[1,2]'), (3, '5');
INSERT INTO t(j) VALUES ('{}');
ERROR 22018: Invalid JSON value for CAST to INTEGER from column json_extract at row 1
INSERT INTO t(j) VALUES ('{"a":1}');
ERROR 22018: Invalid JSON value for CAST to INTEGER from column json_extract at row 1
INSERT INTO t(j) VALUES ('"abc"');
ERROR 22018: Invalid JSON value for CAST to INTEGER from column json_extract at row 1
INSERT INTO t(j) VALUES ('');
ERROR 22032: Invalid JSON text: "The document is empty." at position 0 in value for column 't.j'.
INSERT INTO t(j) VALUES ('[');
ERROR 22032: Invalid JSON text: "Invalid value." at position 1 in value for column 't.j'.
SELECT * FROM t ORDER BY id;
id	j	gc
0	"5"	5
1	[]	NULL
2	[1, 2]	1
3	5	5
UPDATE t SET j = '[123]';
SELECT * FROM t ORDER BY id;
id	j	gc
0	[123]	123
1	[123]	123
2	[123]	123
3	[123]	123
UPDATE t SET j = '[';
ERROR 22032: Invalid JSON text: "Invalid value." at position 1 in value for column 't.j'.
DROP TABLE t;
CREATE TABLE t(id INT, j JSON,
gc JSON GENERATED ALWAYS AS (JSON_ARRAY(j)));
INSERT INTO t(id, j)
VALUES (1, '1'), (2, '[true, false]'), (3, '{"a":1,"b":2}');
INSERT INTO t(j) VALUES ('');
ERROR 22032: Invalid JSON text: "The document is empty." at position 0 in value for column 't.j'.
INSERT INTO t(j) VALUES ('[');
ERROR 22032: Invalid JSON text: "Invalid value." at position 1 in value for column 't.j'.
SELECT * FROM t ORDER BY id;
id	j	gc
1	1	[1]
2	[true, false]	[[true, false]]
3	{"a": 1, "b": 2}	[{"a": 1, "b": 2}]
UPDATE t SET j = '"abc"';
SELECT * FROM t ORDER BY id;
id	j	gc
1	"abc"	["abc"]
2	"abc"	["abc"]
3	"abc"	["abc"]
UPDATE t SET j = '[';
ERROR 22032: Invalid JSON text: "Invalid value." at position 1 in value for column 't.j'.
DROP TABLE t;
# ----------------------------------------------------------------------
# Test of JSON_KEYS function.
# ----------------------------------------------------------------------
select i, json_keys(j) from keys1;
i	json_keys(j)
0	NULL
1	["a"]
2	NULL
3	["a", "c", "ab", "bc"]
4	NULL
5	NULL
6	NULL
7	NULL
8	NULL
9	NULL
10	NULL
11	NULL
12	NULL
13	NULL
14	NULL
15	NULL
16	NULL
17	NULL
18	NULL
19	NULL
20	NULL
21	NULL
22	[]
23	NULL
24	NULL
25	NULL
26	NULL
27	NULL
28	["type", "coordinates"]
29	NULL
30	NULL
31	NULL
100	["aaaaaaaaaaaaaaaaaaaaaaaaaaaaaaaaaaaaaaaaaaaaaaaaaaaaaaaaaaaaaaaaaaaaaaaaaaaaaaaaaaaaaaaaaaaaaaaaaaaaaaaaaaaaaaaaaaaaaaaaaaaaaaaaaaaaaaaaaaaaaaaaaaaaaaaaaaaaaaaaaaaaaaaaaaaaaaaaaaaaaaaaaaaaaaaaaaaaaaaaaaaaaaaaaaaaaaaaaaaaaaaaaaaaaaaaaaaaaaaaaaaaaaaaaaaaaaaaaaaaaaaaaaaaaaaaaaaaaaaaaaaaaaaaaaaaaaaaaaaaaaaaaaaaaaaaaaaaaaaaaaaaaaaaaaaaaaaaaaaaaaaaaaaaaaaaaaaaaaaaaaaaaaaaaaaaaaaaaaaaaaaaaaaaaaaaaaaaaaaaaaaaaaaaaaaaaaaaaaaaaaaaaaaaaaaaaaaaaaaaaaaaaaaaaaaaaaaaaaaaaaaaaaaaaaaaaaaaaaaaaaaaaaaaaaaaaaaaaaaaaaaaaaaaaaaaaaaaaaaaaaaaaaaaaaaaaaaaaaaaaaaaaaaaaaaaaaaaaaaaaaaaaaaaaaaaaaaaaaaaaaaaaaaaaaaaaaaaaaaaaaaaaaaaaaaaaaaaaaaaaaaaaaaaaaaaaaaaaaaaaaaaaaaaaaaaaaaaaaaaaaaaaaaaaaaaaaaaaaaaaaaaaaaaaaaaaaaaaaaaaaaaaaaaaaaaaaaaaaaaaaaaaaaaaaaaaaaaaaaaaaaaaaaaaaaaaaaaaaaaaaaaaaaaaaaaaaaaaaaaaaaaaaaaaaaaaaaaaaaaaaaaaaaaaaaaaaaaaaaaaaaaaaaaaaaaaaaaaaaaaaaaaaaaaaaaaaaaaaaaaaaaaaaaaaaaaaaaaaaaaaaaaaaaaaaaaaaaaaaaaaaaaaaaaaaaaaaaaaaaaaaaaaaaaaaaaaaaaaaaaaaaaaaaaaaaaaaaaaaaaaaaaaaaaaaaaaaaaaaaaaaaaaaaaaaaaaaaaaaaaaaaaaaaaaaaaaaaaaaaaaaaaaaaaaaaaaaaaaaaaaaaaaaaaaaaaaaaaaaaaaaaaaaaaaaaaaaaaaaaaaaaaaaaaaaaaaaaaaaaaaaaaaaaaaaaaaaaaaaaaaaaaaaaaaaaaaaaaaaaaaaaaaaaaaaaaaaaaaaaaaaaaaaaaaaaaaaaaaaaaaaaaaaaaaaaaaaaaaaaaaaaaaaaaaaaaaaaaaaaaaaaaaaaaaaaaaaaaaaaaaaaaaaaaaaaaaaaaaaaaaaaaaaaaaaaaaaaaaaaaaaaaaaaaaaaaaaaaaaaaaaaaaaaaaaaaaaaaaaaaaaaaaaaaaaaaaaaaaaaaaaaaaaaaaaaaaaaaaaaaaaaaaaaaaaaaaaaaaaaaaaaaaaaaaaaaaaaaaaaaaaaaaaaaaaaaaaaaaaaaaaaaaaaaaaaaaaaaaaaaaaaaaaaaaaaaaaaaaaaaaaaaaaaaaaaaaaaaaaaaaaaaaaaaaaaaaaaaaaaaaaaaaaaaaaaaaaaaaaaaaaaaaaaaaaaaaaaaaaaaaaaaaaaaaaaaaaaaaaaaaaaaaaaaaaaaaaaaaaaaaaaaaaaaaaaaaaaaaaaaaaaaaaaaaaaaaaaaaaaaaaaaaaaaaaaaaaaaaaaaaaaaaaaaaaaaaaaaaaaaaaaaaaaaaaaaaaaaaaaaaaaaaaaaaaaaaaaaaaaaaaaaaaaaaaaaaaaaaaaaaaaaaaaaaaaaaaaaaaaaaaaaaaaaaaaaaaaaaaaaaaaaaaaaaaaaaaaaaaaaaaaaaaaaaaaaaaaaaaaaaaaaaaaaaaaaaaaaaaaaaaaaaaaaaaaaaaaaaaaaaaaaaaaaaaaaaaaaaaaaaaaaaaaaaaaaaaaaaaaaaaaaaaaaaaaaaaaaaaaaaaaaaaaaaaaaaaaaaaaaaaaaaaaaaaaaaaaaaaaaaaaaaaaaaaaaaaaaaaaaaaaaaaaaaaaaaaaaaaaaaaaaaaaaaaaaaaaaaaaaaaaaaaaaaaaaaaaaaaaaaaaaaaaaaaaaaaaaaaaaaaaaaaaaaaaaaaaaaaaaaaaaaaaaaaaaaaaaaaaaaaaaaaaaaaaaaaaaaaaaaaaaaaaaaaaaaaaaaaaaaaaaaaaaaaaaaaaaaaaaaaaaaaaaaaaaaaaaaaaaaaaaaaaaaaaaaaaaaaaaaaaaaaaaaaaaaaaaaaaaaaaaaaaaaaaaaaaaaaaaaaaaaaaaaaaaaaaaaaaaaaaaaaaaaaaaaaaaaaaaaaaaaaaaaaaaaaaaaaaaaaaaaaaaaaaaaaaaaaaaaaaaaaaaaaaaaaaaaaaaaaaaaaaaaaaaaaaaaaaaaaaaaaaaaaaaaaaaaaaaaaaaaaaaaaaaaaaaaaaaaaaaaaaaaaaaaaaaaaaaaaaaaaaaaaaaaaaaaaaaaaaaaaaaaaaaaaaaaaaaaaaaaaaaaaaaaaaaaaaaaaaaaaaaaaaaaaaaaaaaaaaaaaaaaaaaaaaaaaaaaaaaaaaaaaaaaaaaaaaaaaaaaaaaaaaaaaaaaaaaaaaaaaaaaaaaaaaaaaaaaaaaaaaaaaaaaaaaaaaaaaaaaaaaaaaaaaaaaaaaaaaaaaaaaaaaaaaaaaaaaaaaaaaaaaaaaaaaaaaaaaaaaaaaaaaaaaaaaaaaaaaaaaaaaaaaaaaaaaaaaaaaaaaaaaaaaaaaaaaaaaaaaaaaaaaaaaaaaaaaaaaaaaaaaaaaaaaaaaaaaaaaaaaaaaaaaaaaaaaaaaaaaaaaaaaaaaaaaaaaaaaaaaaaaaaaaaaaaaaaaaaaaaaaaaaaaaaaaaaaaaaaaaaaaaaaaaaaaaaaaaaaaaaaaaaaaaaaaaaaaaaaaaaaaaaaaaaaaaaaaaaaaaaaaaaaaaaaaaaaaaaaaaaaaaaaaaaaaaaaaaaaaaaaaaaaaaaaaaaaaaaaaaaaaaaaaaaaaaaaaaaaaaaaaaaaaaaaaaaaaaaaaaaaaaaaaaaaaaaaaaaaaaaaaaaaaaaaaaaaaaaaaaaaaaaaaaaaaaaaaaaaaaaaaaaaaaaaaaaaaaaaaaaaaaaaaaaaaaaaaaaaaaaaaaaaaaaaaaaaaaaaaaaaaaaaaaaaaaaaaaaaaaaaaaaaaaaaaaaaaaaaaaaaaaaaaaaaaaaaaaaaaaaaaaaaaaaaaaaaaaaaaaaaaaaaaaaaaaaaaaaaaaaaaaaaaaaaaaaaaaaaaaaaaaaaaaaaaaaaaaaaaaaaaaaaaaaaaaaaaaaaaaaaaaaaaaaaaaaaaaaaaaaaaaaaaaaaaaaaaaaaaaaaaaaaaaaaaaaaaaaaaaaaaaaaaaaaaaaaaaaaaaaaaaaaaaaaaaaaaaaaaaaaaaaaaaaaaaaaaaaaaaaaaaaaaaaaaaaaaaaaaaaaaaaaaaaaaaaaaaaaaaaaaaaaaaaaaaaaaaaaaaaaaaaaaaaaaaaaaaaaaaaaaaaaaaaaaaaaaaaaaaaaaaaaaaaaaaaaaaaaaaaaaaaaaaaaaaaaaaaaaaaaaaaaaaaaaaaaaaaaaaaaaaaaaaaaaaaaaaaaaaaaaaaaaaaaaaaaaaaaaaaaaaaaaaaaaaaaaaaaaaaaaaaaaaaaaaaaaaaaaaaaaaaaaaaaaaaaaaaaaaaaaaaaaaaaaaaaaaaaaaaaaaaaaaaaaaaaaaaaaaaaaaaaaaaaaaaaaaaaaaaaaaaaaaaaaaaaaaaaaaaaaaaaaaaaaaaaaaaaaaaaaaaaaaaaaaaaaaaaaaaaaaaaaaaaaaaaaaaaaaaaaaaaaaaaaaaaaaaaaaaaaaaaaaaaaaaaaaaaaaaaaaaaaaaaaaaaaaaaaaaaaaaaaaaaaaaaaaaaaaaaaaaaaaaaaaaaaaaaaaaaaaaaaaaaaaaaaaaaaaaaaaaaaaaaaaaaaaaaaaaaaaaaaaaaaaaaaaaaaaaaaaaaaaaaaaaaaaaaaaaaaaaaaaaaaaaaaaaaaaaaaaaaaaaaaaaaaaaaaaaaaaaaaaaaaaaaaaaaaaaaaaaaaaaaaaaaaaaaaaaaaaaaaaaaaaaaaaaaaaaaaaaaaaaaaaaaaaaaaaaaaaaaaaaaaaaaaaaaaaaaaaaaaaaaaaaaaaaaaaaaaaaaaaaaaaaaaaaaaaaaaaaaaaaaaaaaaaaaaaaaaaaaaaaaaaaaaaaaaaaaaaaaaaaaaaaaaaaaaaaaaaaaaaaaaaaaaaaaaaaaaaaaaaaaaaaaaaaaaaaaaaaaaaaaaaaaaaaaaaaaaaaaaaaaaaaaaaaaaaaaaaaaaaaaaaaaaaaaaaaaaaaaaaaaaaaaaaaaaaaaaaaaaaaaaaaaaaaaaaaaaaaaaaaaaaaaaaaaaaaaaaaaaaaaaaaaaaaaaaaaaaaaaaaaaaaaaaaaaaaaaaaaaaaaaaaaaaaaaaaaaaaaaaaaaaaaaaaaaaaaaaaaaaaaaaaaaaaaaaaaaaaaaaaaaaaaaaaaaaaaaaaaaaaaaaaaaaaaaaaaaaaaaaaaaaaaaaaaaaaaaaaaaaaaaaaaaaaaaaaaaaaaaaaaaaaaaaaaaaaaaaaaaaaaaaaaaaaaaaaaaaaaaaaaaaaaaaaaaaaaaaaaaaaaaaaaaaaaaaaaaaaaaaaaaaaaaaaaaaaaaaaaaaaaaaaaaaaaaaaaaaaaaaaaaaaaaaaaaaaaaaaaaaaaaaaaaaaaaaaaaaaaaaaaaaaaaaaaaaaaaaaaaaaaaaaaaaaaaaaaaaaaaaaaaaaaaaaaaaaaaaaaaaaaaaaaaaaaaaaaaaaaaaaaaaaaaaaaaaaaaaaaaaaaaaaaaaaaaaaaaaaaaaaaaaaaaaaaaaaaaaaaaaaaaaaaaaaaaaaaaaaaaaaaaaaaaaaaaaaaaaaaaaaaaaaaaaaaaaaaaaaaaaaaaaaaaaaaaaaaaaaaaaaaaaaaaaaaaaaaaaaaaaaaaaaaaaaaaaaaaaaaaaaaaaaaaaaaaaaaaaaaaaaaaaaaaaaaaaaaaaaaaaaaaaaaaaaaaaaaaaaaaaaaaaaaaaaaaaaaaaaaaaaaaaaaaaaaaaaaaaaaaaaaaaaaaaaaaaaaaaaaaaaaaaaaaaaaaaaaaaaaaaaaaaaaaaaaaaaaaaaaaaaaaaaaaaaaaaaaaaaaaaaaaaaaaaaaaaaaaaaaaaaaaaaaaaaaaaaaaaaaaaaaaaaaaaaaaaaaaaaaaaaaaaaaaaaaaaaaaaaaaaaaaaaaaaaaaaaaaaaaaaaaaaaaaaaaaaaaaaaaaaaaaaaaaaaaaaaaaaaaaaaaaaaaaaaaaaaaaaaaaaaaaaaaaaaaaaaaaaaaaaaaaaaaaaaaaaaaaaaaaaaaaaaaaaaaaaaaaaaaaaaaaaaaaaaaaaaaaaaaaaaaaaaaaaaaaaaaaaaaaaaaaaaaaaaaaaaaaaaaaaaaaaaaaaaaaaaaaaaaaaaaaaaaaaaaaaaaaaaaaaaaaaaaaaaaaaaaaaaaaaaaaaaaaaaaaaaaaaaaaaaaaaaaaaaaaaaaaaaaaaaaaaaaaaaaaaaaaaaaaaaaaaaaaaaaaaaaaaaaaaaaaaaaaaaaaaaaaaaaaaaaaaaaaaaaaaaaaaaaaaaaaaaaaaaaaaaaaaaaaaaaaaaaaaaaaaaaaaaaaaaaaaaaaaaaaaaaaaaaaaaaaaaaaaaaaaaaaaaaaaaaaaaaaaaaaaaaaaaaaaaaaaaaaaaaaaaaaaaaaaaaaaaaaaaaaaaaaaaaaaaaaaaaaaaaaaaaaaaaaaaaaaaaaaaaaaaaaaaaaaaaaaaaaaaaaaaaaaaaaaaaaaaaaaaaaaaaaaaaaaaaaaaaaaaaaaaaaaaaaaaaaaaaaaaaaaaaaaaaaaaaaaaaaaaaaaaaaaaaaaaaaaaaaaaaaaaaaaaaaaaaaaaaaaaaaaaaaaaaaaaaaaaaaaaaaaaaaaaaaaaaaaaaaaaaaaaaaaaaaaaaaaaaaaaaaaaaaaaaaaaaaaaaaaaaaaaaaaaaaaaaaaaaaaaaaaaaaaaaaaaaaaaaaaaaaaaaaaaaaaaaaaaaaaaaaaaaaaaaaaaaaaaaaaaaaaaaaaaaaaaaaaaaaaaaaaaaaaaaaaaaaaaaaaaaaaaaaaaaaaaaaaaaaaaaaaaaaaaaaaaaaaaaaaaaaaaaaaaaaaaaaaaaaaaaaaaaaaaaaaaaaaaaaaaaaaaaaaaaaaaaaaaaaaaaaaaaaaaaaaaaaaaaaaaaaaaaaaaaaaaaaaaaaaaaaaaaaaaaaaaaaaaaaaaaaaaaaaaaaaaaaaaaaaaaaaaaaaaaaaaaaaaaaaaaaaaaaaaaaaaaaaaaaaaaaaaaaaaaaaaaaaaaaaaaaaaaaaaaaaaaaaaaaaaaaaaaaaaaaaaaaaaaaaaaaaaaaaaaaaaaaaaaaaaaaaaaaaaaaaaaaaaaaaaaaaaaaaaaaaaaaaaaaaaaaaaaaaaaaaaaaaaaaaaaaaaaaaaaaaaaaaaaaaaaaaaaaaaaaaaaaaaaaaaaaaaaaaaaaaaaaaaaaaaaaaaaaaaaaaaaaaaaaaaaaaaaaaaaaaaaaaaaaaaaaaaaaaaaaaaaaaaaaaaaaaaaaaaaaaaaaaaaaaaaaaaaaaaaaaaaaaaaaaaaaaaaaaaaaaaaaaaaaaaaaaaaaaaaaaaaaaaaaaaaaaaaaaaaaaaaaaaaaaaaaaaaaaaaaaaaaaaaaaaaaaaaaaaaaaaaaaaaaaaaaaaaaaaaaaaaaaaaaaaaaaaaaaaaaaaaaaaaaaaaaaaaaaaaaaaaaaaaaaaaaaaaaaaaaaaaaaaaaaaaaaaaaaaaaaaaaaaaaaaaaaaaaaaaaaaaaaaaaaaaaaaaaaaaaaaaaaaaaaaaaaaaaaaaaaaaaaaaaaaaaaaaaaaaaaaaaaaaaaaaaaaaaaaaaaaaaaaaaaaaaaaaaaaaaaaaaaaaaaaaaaaaaaaaaaaaaaaaaaaaaaaaaaaaaaaaaaaaaaaaaaaaaaaaaaaaaaaaaaaaaaaaaaaaaaaaaaaaaaaaaaaaaaaaaaaaaaaaaaaaaaaaaaaaaaaaaaaaaaaaaaaaaaaaaaaaaaaaaaaaaaaaaaaaaaaaaaaaaaaaaaaaaaaaaaaaaaaaaaaaaaaaaaaaaaaaaaaaaaaaaaaaaaaaaaaaaaaaaaaaaaaaaaaaaaaaaaaaaaaaaaaaaaaaaaaaaaaaaaaaaaaaaaaaaaaaaaaaaaaaaaaaaaaaaaaaaaaaaaaaaaaaaaaaaaaaaaaaaaaaaaaaaaaaaaaaaaaaaaaaaaaaaaaaaaaaaaaaaaaaaaaaaaaaaaaaaaaaaaaaaaaaaaaaaaaaaaaaaaaaaaaaaaaaaaaaaaaaaaaaaaaaaaaaaaaaaaaaaaaaaaaaaaaaaaaaaaaaaaaaaaaaaaaaaaaaaaaaaaaaaaaaaaaaaaaaaaaaaaaaaaaaaaaaaaaaaaaaaaaaaaaaaaaaaaaaaaaaaaaaaaaaaaaaaaaaaaaaaaaaaaaaaaaaaaaaaaaaaaaaaaaaaaaaaaaaaaaaaaaaaaaaaaaaaaaaaaaaaaaaaaaaaaaaaaaaaaaaaaaaaaaaaaaaaaaaaaaaaaaaaaaaaaaaaaaaaaaaaaaaaaaaaaaaaaaaaaaaaaaaaaaaaaaaaaaaaaaaaaaaaaaaaaaaaaaaaaaaaaaaaaaaaaaaaaaaaaaaaaaaaaaaaaaaaaaaaaaaaaaaaaaaaaaaaaaaaaaaaaaaaaaaaaaaaaaaaaaaaaaaaaaaaaaaaaaaaaaaaaaaaaaaaaaaaaaaaaaaaaaaaaaaaaaaaaaaaaaaaaaaaaaaaaaaaaaaaaaaaaaaaaaaaaaaaaaaaaaaaaaaaaaaaaaaaaaaaaaaaaaaaaaaaaaaaaaaaaaaaaaaaaaaaaaaaaaaaaaaaaaaaaaaaaaaaaaaaaaaaaaaaaaaaaaaaaaaaaaaaaaaaaaaaaaaaaaaaaaaaaaaaaaaaaaaaaaaaaaaaaaaaaaaaaaaaaaaaaaaaaaaaaaaaaaaaaaaaaaaaaaaaaaaaaaaaaaaaaaaaaaaaaaaaaaaaaaaaaaaaaaaaaaaaaaaaaaaaaaaaaaaaaaaaaaaaaaaaaaaaaaaaaaaaaaaaaaaaaaaaaaaaaaaaaaaaaaaaaaaaaaaaaaaaaaaaaaaaaaaaaaaaaaaaaaaaaaaaaaaaaaaaaaaaaaaaaaaaaaaaaaaaaaaaaaaaaaaaaaaaaaaaaaaaaaaaaaaaaaaaaaaaaaaaaaaaaaaaaaaaaaaaaaaaaaaaaaaaaaaaaaaaaaaaaaaaaaaaaaaaaaaaaaaaaaaaaaaaaaaaaaaaaaaaaaaaaaaaaaaaaaaaaaaaaaaaaaaaaaaaaaaaaaaaaaaaaaaaaaaaaaaaaaaaaaaaaaaaaaaaaaaaaaaaaaaaaaaaaaaaaaaaaaaaaaaaaaaaaaaaaaaaaaaaaaaaaaaaaaaaaaaaaaaaaaaaaaaaaaaaaaaaaaaaaaaaaaaaaaaaaaaaaaaaaaaaaaaaaaaaaaaaaaaaaaaaaaaaaaaaaaaaaaaaaaaaaaaaaaaaaaaaaaaaaaaaaaaaaaaaaaaaaaaaaaaaaaaaaaaaaaaaaaaaaaaaaaaaaaaaaaaaaaaaaaaaaaaaaaaaaaaaaaaaaaaaaaaaaaaaaaaaaaaaaaaaaaaaaaaaaaaaaaaaaaaaaaaaaaaaaaaaaaaaaaaaaaaaaaaaaaaaaaaaaaaaaaaaaaaaaaaaaaaaaaaaaaaaaaaaaaaaaaaaaaaaaaaaaaaaaaaaaaaaaaaaaaaaaaaaaaaaaaaaaaaaaaaaaaaaaaaaaaaaaaaaaaaaaaaaaaaaaaaaaaaaaaaaaaaaaaaaaaaaaaaaaaaaaaaaaaaaaaaaaaaaaaaaaaaaaaaaaaaaaaaaaaaaaaaaaaaaaaaaaaaaaaaaaaaaaaaaaaaaaaaaaaaaaaaaaaaaaaaaaaaaaaaaaaaaaaaaaaaaaaaaaaaaaaaaaaaaaaaaaaaaaaaaaaaaaaaaaaaaaaaaaaaaaaaaaaaaaaaaaaaaaaaaaaaaaaaaaaaaaaaaaaaaaaaaaaaaaaaaaaaaaaaaaaaaaaaaaaaaaaaaaaaaaaaaaaaaaaaaaaaaaaaaaaaaaaaaaaaaaaaaaaaaaaaaaaaaaaaaaaaaaaaaaaaaaaaaaaaaaaaaaaaaaaaaaaaaaaaaaaaaaaaaaaaaaaaaaaaaaaaaaaaaaaaaaaaaaaaaaaaaaaaaaaaaaaaaaaaaaaaaaaaaaaaaaaaaaaaaaaaaaaaaaaaaaaaaaaaaaaaaaaaaaaaaaaaaaaaaaaaaaaaaaaaaaaaaaaaaaaaaaaaaaaaaaaaaaaaaaaaaaaaaaaaaaaaaaaaaaaaaaaaaaaaaaaaaaaaaaaaaaaaaaaaaaaaaaaaaaaaaaaaaaaaaaaaaaaaaaaaaaaaaaaaaaaaaaaaaaaaaaaaaaaaaaaaaaaaaaaaaaaaaaaaaaaaaaaaaaaaaaaaaaaaaaaaaaaaaaaaaaaaaaaaaaaaaaaaaaaaaaaaaaaaaaaaaaaaaaaaaaaaaaaaaaaaaaaaaaaaaaaaaaaaaaaaaaaaaaaaaaaaaaaaaaaaaaaaaaaaaaaaaaaaaaaaaaaaaaaaaaaaaaaaaaaaaaaaaaaaaaaaaaaaaaaaaaaaaaaaaaaaaaaaaaaaaaaaaaaaaaaaaaaaaaaaaaaaaaaaaaaaaaaaaaaaaaaaaaaaaaaaaaaaaaaaaaaaaaaaaaaaaaaaaaaaaaaaaaaaaaaaaaaaaaaaaaaaaaaaaaaaaaaaaaaaaaaaaaaaaaaaaaaaaaaaaaaaaaaaaaaaaaaaaaaaaaaaaaaaaaaaaaaaaaaaaaaaaaaaaaaaaaaaaaaaaaaaaaaaaaaaaaaaaaaaaaaaaaaaaaaaaaaaaaaaaaaaaaaaaaaaaaaaaaaaaaaaaaaaaaaaaaaaaaaaaaaaaaaaaaaaaaaaaaaaaaaaaaaaaaaaaaaaaaaaaaaaaaaaaaaaaaaaaaaaaaaaaaaaaaaaaaaaaaaaaaaaaaaaaaaaaaaaaaaaaaaaaaaaaaaaaaaaaaaaaaaaaaaaaaaaaaaaaaaaaaaaaaaaaaaaaaaaaaaaaaaaaaaaaaaaaaaaaaaaaaaaaaaaaaaaaaaaaaaaaaaaaaaaaaaaaaaaaaaaaaaaaaaaaaaaaaaaaaaaaaaaaaaaaaaaaaaaaaaaaaaaaaaaaaaaaaaaaaaaaaaaaaaaaaaaaaaaaaaaaaaaaaaaaaaaaaaaaaaaaaaaaaaaaaaaaaaaaaaaaaaaaaaaaaaaaaaaaaaaaaaaaaaaaaaaaaaaaaaaaaaaaaaaaaaaaaaaaaaaaaaaaaaaaaaaaaaaaaaaaaaaaaaaaaaaaaaaaaaaaaaaaaaaaaaaaaaaaaaaaaaaaaaaaaaaaaaaaaaaaaaaaaaaaaaaaaaaaaaaaaaaaaaaaaaaaaaaaaaaaaaaaaaaaaaaaaaaaaaaaaaaaaaaaaaaaaaaaaaaaaaaaaaaaaaaaaaaaaaaaaaaaaaaaaaaaaaaaaaaaaaaaaaaaaaaaaaaaaaaaaaaaaaaaaaaaaaaaaaaaaaaaaaaaaaaaaaaaaaaaaaaaaaaaaaaaaaaaaaaaaaaaaaaaaaaaaaaaaaaaaaaaaaaaaaaaaaaaaaaaaaaaaaaaaaaaaaaaaaaaaaaaaaaaaaaaaaaaaaaaaaaaaaaaaaaaaaaaaaaaaaaaaaaaaaaaaaaaaaaaaaaaaaaaaaaaaaaaaaaaaaaaaaaaaaaaaaaaaaaaaaaaaaaaaaaaaaaaaaaaaaaaaaaaaaaaaaaaaaaaaaaaaaaaaaaaaaaaaaaaaaaaaaaaaaaaaaaaaaaaaaaaaaaaaaaaaaaaaaaaaaaaaaaaaaaaaaaaaaaaaaaaaaaaaaaaaaaaaaaaaaaaaaaaaaaaaaaaaaaaaaaaaaaaaaaaaaaaaaaaaaaaaaaaaaaaaaaaaaaaaaaaaaaaaaaaaaaaaaaaaaaaaaaaaaaaaaaaaaaaaaaaaaaaaaaaaaaaaaaaaaaaaaaaaaaaaaaaaaaaaaaaaaaaaaaaaaaaaaaaaaaaaaaaaaaaaaaaaaaaaaaaaaaaaaaaaaaaaaaaaaaaaaaaaaaaaaaaaaaaaaaaaaaaaaaaaaaaaaaaaaaaaaaaaaaaaaaaaaaaaaaaaaaaaaaaaaaaaaaaaaaaaaaaaaaaaaaaaaaaaaaaaaaaaaaaaaaaaaaaaaaaaaaaaaaaaaaaaaaaaaaaaaaaaaaaaaaaaaaaaaaaaaaaaaaaaaaaaaaaaaaaaaaaaaaaaaaaaaaaaaaaaaaaaaaaaaaaaaaaaaaaaaaaaaaaaaaaaaaaaaaaaaaaaaaaaaaaaaaaaaaaaaaaaaaaaaaaaaaaaaaaaaaaaaaaaaaaaaaaaaaaaaaaaaaaaaaaaaaaaaaaaaaaaaaaaaaaaaaaaaaaaaaaaaaaaaaaaaaaaaaaaaaaaaaaaaaaaaaaaaaaaaaaaaaaaaaaaaaaaaaaaaaaaaaaaaaaaaaaaaaaaaaaaaaaaaaaaaaaaaaaaaaaaaaaaaaaaaaaaaaaaaaaaaaaaaaaaaaaaaaaaaaaaaaaaaaaaaaaaaaaaaaaaaaaaaaaaaaaaaaaaaaaaaaaaaaaaaaaaaaaaaaaaaaaaaaaaaaaaaaaaaaaaaaaaaaaaaaaaaaaaaaaaaaaaaaaaaaaaaaaaaaaaaaaaaaaaaaaaaaaaaaaaaaaaaaaaaaaaaaaaaaaaaaaaaaaaaaaaaaaaaaaaaaaaaaaaaaaaaaaaaaaaaaaaaaaaaaaaaaaaaaaaaaaaaaaaaaaaaaaaaaaaaaaaaaaaaaaaaaaaaaaaaaaaaaaaaaaaaaaaaaaaaaaaaaaaaaaaaaaaaaaaaaaaaaaaaaaaaaaaaaaaaaaaaaaaaaaaaaaaaaaaaaaaaaaaaaaaaaaaaaaaaaaaaaaaaaaaaaaaaaaaaaaaaaaaaaaaaaaaaaaaaaaaaaaaaaaaaaaaaaaaaaaaaaaaaaaaaaaaaaaaaaaaaaaaaaaaaaaaaaaaaaaaaaaaaaaaaaaaaaaaaaaaaaaaaaaaaaaaaaaaaaaaaaaaaaaaaaaaaaaaaaaaaaaaaaaaaaaaaaaaaaaaaaaaaaaaaaaaaaaaaaaaaaaaaaaaaaaaaaaaaaaaaaaaaaaaaaaaaaaaaaaaaaaaaaaaaaaaaaaaaaaaaaaaaaaaaaaaaaaaaaaaaaaaaaaaaaaaaaaaaaaaaaaaaaaaaaaaaaaaaaaaaaaaaaaaaaaaaaaaaaaaaaaaaaaaaaaaaaaaaaaaaaaaaaaaaaaaaaaaaaaaaaaaaaaaaaaaaaaaaaaaaaaaaaaaaaaaaaaaaaaaaaaaaaaaaaaaaaaaaaaaaaaaaaaaaaaaaaaaaaaaaaaaaaaaaaaaaaaaaaaaaaaaaaaaaaaaaaaaaaaaaaaaaaaaaaaaaaaaaaaaaaaaaaaaaaaaaaaaaaaaaaaaaaaaaaaaaaaaaaaaaaaaaaaaaaaaaaaaaaaaaaaaaaaaaaaaaaaaaaaaaaaaaaaaaaaaaaaaaaaaaaaaaaaaaaaaaaaaaaaaaaaaaaaaaaaaaaaaaaaaaaaaaaaaaaaaaaaaaaaaaaaaaaaaaaaaaaaaaaaaaaaaaaaaaaaaaaaaaaaaaaaaaaaaaaaaaaaaaaaaaaaaaaaaaaaaaaaaaaaaaaaaaaaaaaaaaaaaaaaaaaaaaaaaaaaaaaaaaaaaaaaaaaaaaaaaaaaaaaaaaaaaaaaaaaaaaaaaaaaaaaaaaaaaaaaaaaaaaaaaaaaaaaaaaaaaaaaaaaaaaaaaaaaaaaaaaaaaaaaaaaaaaaaaaaaaaaaaaaaaaaaaaaaaaaaaaaaaaaaaaaaaaaaaaaaaaaaaaaaaaaaaaaaaaaaaaaaaaaaaaaaaaaaaaaaaaaaaaaaaaaaaaaaaaaaaaaaaaaaaaaaaaaaaaaaaaaaaaaaaaaaaaaaaaaaaaaaaaaaaaaaaaaaaaaaaaaaaaaaaaaaaaaaaaaaaaaaaaaaaaaaaaaaaaaaaaaaaaaaaaaaaaaaaaaaaaaaaaaaaaaaaaaaaaaaaaaaaaaaaaaaaaaaaaaaaaaaaaaaaaaaaaaaaaaaaaaaaaaaaaaaaaaaaaaaaaaaaaaaaaaaaaaaaaaaaaaaaaaaaaaaaaaaaaaaaaaaaaaaaaaaaaaaaaaaaaaaaaaaaaaaaaaaaaaaaaaaaaaaaaaaaaaaaaaaaaaaaaaaaaaaaaaaaaaaaaaaaaaaaaaaaaaaaaaaaaaaaaaaaaaaaaaaaaaaaaaaaaaaaaaaaaaaaaaaaaaaaaaaaaaaaaaaaaaaaaaaaaaaaaaaaaaaaaaaaaaaaaaaaaaaaaaaaaaaaaaaaaaaaaaaaaaaaaaaaaaaaaaaaaaaaaaaaaaaaaaaaaaaaaaaaaaaaaaaaaaaaaaaaaaaaaaaaaaaaaaaaaaaaaaaaaaaaaaaaaaaaaaaaaaaaaaaaaaaaaaaaaaaaaaaaaaaaaaaaaaaaaaaaaaaaaaaaaaaaaaaaaaaaaaaaaaaaaaaaaaaaaaaaaaaaaaaaaaaaaaaaaaaaaaaaaaaaaaaaaaaaaaaaaaaaaaaaaaaaaaaaaaaaaaaaaaaaaaaaaaaaaaaaaaaaaaaaaaaaaaaaaaaaaaaaaaaaaaaaaaaaaaaaaaaaaaaaaaaaaaaaaaaaaaaaaaaaaaaaaaaaaaaaaaaaaaaaaaaaaaaaaaaaaaaaaaaaaaaaaaaaaaaaaaaaaaaaaaaaaaaaaaaaaaaaaaaaaaaaaaaaaaaaaaaaaaaaaaaaaaaaaaaaaaaaaaaaaaaaaaaaaaaaaaaaaaaaaaaaaaaaaaaaaaaaaaaaaaaaaaaaaaaaaaaaaaaaaaaaaaaaaaaaaaaaaaaaaaaaaaaaaaaaaaaaaaaaaaaaaaaaaaaaaaaaaaaaaaaaaaaaaaaaaaaaaaaaaaaaaaaaaaaaaaaaaaaaaaaaaaaaaaaaaaaaaaaaaaaaaaaaaaaaaaaaaaaaaaaaaaaaaaaaaaaaaaaaaaaaaaaaaaaaaaaaaaaaaaaaaaaaaaaaaaaaaaaaaaaaaaaaaaaaaaaaaaaaaaaaaaaaaaaaaaaaaaaaaaaaaaaaaaaaaaaaaaaaaaaaaaaaaaaaaaaaaaaaaaaaaaaaaaaaaaaaaaaaaaaaaaaaaaaaaaaaaaaaaaaaaaaaaaaaaaaaaaaaaaaaaaaaaaaaaaaaaaaaaaaaaaaaaaaaaaaaaaaaaaaaaaaaaaaaaaaaaaaaaaaaaaaaaaaaaaaaaaaaaaaaaaaaaaaaaaaaaaaaaaaaaaaaaaaaaaaaaaaaaaaaaaaaaaaaaaaaaaaaaaaaaaaaaaaaaaaaaaaaaaaaaaaaaaaaaaaaaaaaaaaaaaaaaaaaaaaaaaaaaaaaaaaaaaaaaaaaaaaaaaaaaaaaaaaaaaaaaaaaaaaaaaaaaaaaaaaaaaaaaaaaaaaaaaaaaaaaaaaaaaaaaaaaaaaaaaaaaaaaaaaaaaaaaaaaaaaaaaaaaaaaaaaaaaaaaaaaaaaaaaaaaaaaaaaaaaaaaaaaaaaaaaaaaaaaaaaaaaaaaaaaaaaaaaaaaaaaaaaaaaaaaaaaaaaaaaaaaaaaaaaaaaaaaaaaaaaaaaaaaaaaaaaaaaaaaaaaaaaaaaaaaaaaaaaaaaaaaaaaaaaaaaaaaaaaaaaaaaaaaaaaaaaaaaaaaaaaaaaaaaaaaaaaaaaaaaaaaaaaaaaaaaaaaaaaaaaaaaaaaaaaaaaaaaaaaaaaaaaaaaaaaaaaaaaaaaaaaaaaaaaaaaaaaaaaaaaaaaaaaaaaaaaaaaaaaaaaaaaaaaaaaaaaaaaaaaaaaaaaaaaaaaaaaaaaaaaaaaaaaaaaaaaaaaaaaaaaaaaaaaaaaaaaaaaaaaaaaaaaaaaaaaaaaaaaaaaaaaaaaaaaaaaaaaaaaaaaaaaaaaaaaaaaaaaaaaaaaaaaaaaaaaaaaaaaaaaaaaaaaaaaaaaaaaaaaaaaaaaaaaaaaaaaaaaaaaaaaaaaaaaaaaaaaaaaaaaaaaaaaaaaaaaaaaaaaaaaaaaaaaaaaaaaaaaaaaaaaaaaaaaaaaaaaaaaaaaaaaaaaaaaaaaaaaaaaaaaaaaaaaaaaaaaaaaaaaaaaaaaaaaaaaaaaaaaaaaaaaaaaaaaaaaaaaaaaaaaaaaaaaaaaaaaaaaaaaaaaaaaaaaaaaaaaaaaaaaaaaaaaaaaaaaaaaaaaaaaaaaaaaaaaaaaaaaaaaaaaaaaaaaaaaaaaaaaaaaaaaaaaaaaaaaaaaaaaaaaaaaaaaaaaaaaaaaaaaaaaaaaaaaaaaaaaaaaaaaaaaaaaaaaaaaaaaaaaaaaaaaaaaaaaaaaaaaaaaaaaaaaaaaaaaaaaaaaaaaaaaaaaaaaaaaaaaaaaaaaaaaaaaaaaaaaaaaaaaaaaaaaaaaaaaaaaaaaaaaaaaaaaaaaaaaaaaaaaaaaaaaaaaaaaaaaaaaaaaaaaaaaaaaaaaaaaaaaaaaaaaaaaaaaaaaaaaaaaaaaaaaaaaaaaaaaaaaaaaaaaaaaaaaaaaaaaaaaaaaaaaaaaaaaaaaaaaaaaaaaaaaaaaaaaaaaaaaaaaaaaaaaaaaaaaaaaaaaaaaaaaaaaaaaaaaaaaaaaaaaaaaaaaaaaaaaaaaaaaaaaaaaaaaaaaaaaaaaaaaaaaaaaaaaaaaaaaaaaaaaaaaaaaaaaaaaaaaaaaaaaaaaaaaaaaaaaaaaaaaaaaaaaaaaaaaaaaaaaaaaaaaaaaaaaaaaaaaaaaaaaaaaaaaaaaaaaaaaaaaaaaaaaaaaaaaaaaaaaaaaaaaaaaaaaaaaaaaaaaaaaaaaaaaaaaaaaaaaaaaaaaaaaaaaaaaaaaaaaaaaaaaaaaaaaaaaaaaaaaaaaaaaaaaaaaaaaaaaaaaaaaaaaaaaaaaaaaaaaaaaaaaaaaaaaaaaaaaaaaaaaaaaaaaaaaaaaaaaaaaaaaaaaaaaaaaaaaaaaaaaaaaaaaaaaaaaaaaaaaaaaaaaaaaaaaaaaaaaaaaaaaaaaaaaaaaaaaaaaaaaaaaaaaaaaaaaaaaaaaaaaaaaaaaaaaaaaaaaaaaaaaaaaaaaaaaaaaaaaaaaaaaaaaaaaaaaaaaaaaaaaaaaaaaaaaaaaaaaaaaaaaaaaaaaaaaaaaaaaaaaaaaaaaaaaaaaaaaaaaaaaaaaaaaaaaaaaaaaaaaaaaaaaaaaaaaaaaaaaaaaaaaaaaaaaaaaaaaaaaaaaaaaaaaaaaaaaaaaaaaaaaaaaaaaaaaaaaaaaaaaaaaaaaaaaaaaaaaaaaaaaaaaaaaaaaaaaaaaaaaaaaaaaaaaaaaaaaaaaaaaaaaaaaaaaaaaaaaaaaaaaaaaaaaaaaaaaaaaaaaaaaaaaaaaaaaaaaaaaaaaaaaaaaaaaaaaaaaaaaaaaaaaaaaaaaaaaaaaaaaaaaaaaaaaaaaaaaaaaaaaaaaaaaaaaaaaaaaaaaaaaaaaaaaaaaaaaaaaaaaaaaaaaaaaaaaaaaaaaaaaaaaaaaaaaaaaaaaaaaaaaaaaaaaaaaaaaaaaaaaaaaaaaaaaaaaaaaaaaaaaaaaaaaaaaaaaaaaaaaaaaaaaaaaaaaaaaaaaaaaaaaaaaaaaaaaaaaaaaaaaaaaaaaaaaaaaaaaaaaaaaaaaaaaaaaaaaaaaaaaaaaaaaaaaaaaaaaaaaaaaaaaaaaaaaaaaaaaaaaaaaaaaaaaaaaaaaaaaaaaaaaaaaaaaaaaaaaaaaaaaaaaaaaaaaaaaaaaaaaaaaaaaaaaaaaaaaaaaaaaaaaaaaaaaaaaaaaaaaaaaaaaaaaaaaaaaaaaaaaaaaaaaaaaaaaaaaaaaaaaaaaaaaaaaaaaaaaaaaaaaaaaaaaaaaaaaaaaaaaaaaaaaaaaaaaaaaaaaaaaaaaaaaaaaaaaaaaaaaaaaaaaaaaaaaaaaaaaaaaaaaaaaaaaaaaaaaaaaaaaaaaaaaaaaaaaaaaaaaaaaaaaaaaaaaaaaaaaaaaaaaaaaaaaaaaaaaaaaaaaaaaaaaaaaaaaaaaaaaaaaaaaaaaaaaaaaaaaaaaaaaaaaaaaaaaaaaaaaaaaaaaaaaaaaaaaaaaaaaaaaaaaaaaaaaaaaaaaaaaaaaaaaaaaaaaaaaaaaaaaaaaaaaaaaaaaaaaaaaaaaaaaaaaaaaaaaaaaaaaaaaaaaaaaaaaaaaaaaaaaaaaaaaaaaaaaaaaaaaaaaaaaaaaaaaaaaaaaaaaaaaaaaaaaaaaaaaaaaaaaaaaaaaaaaaaaaaaaaaaaaaaaaaaaaaaaaaaaaaaaaaaaaaaaaaaaaaaaaaaaaaaaaaaaaaaaaaaaaaaaaaaaaaaaaaaaaaaaaaaaaaaaaaaaaaaaaaaaaaaaaaaaaaaaaaaaaaaaaaaaaaaaaaaaaaaaaaaaaaaaaaaaaaaaaaaaaaaaaaaaaaaaaaaaaaaaaaaaaaaaaaaaaaaaaaaaaaaaaaaaaaaaaaaaaaaaaaaaaaaaaaaaaaaaaaaaaaaaaaaaaaaaaaaaaaaaaaaaaaaaaaaaaaaaaaaaaaaaaaaaaaaaaaaaaaaaaaaaaaaaaaaaaaaaaaaaaaaaaaaaaaaaaaaaaaaaaaaaaaaaaaaaaaaaaaaaaaaaaaaaaaaaaaaaaaaaaaaaaaaaaaaaaaaaaaaaaaaaaaaaaaaaaaaaaaaaaaaaaaaaaaaaaaaaaaaaaaaaaaaaaaaaaaaaaaaaaaaaaaaaaaaaaaaaaaaaaaaaaaaaaaaaaaaaaaaaaaaaaaaaaaaaaaaaaaaaaaaaaaaaaaaaaaaaaaaaaaaaaaaaaaaaaaaaaaaaaaaaaaaaaaaaaaaaaaaaaaaaaaaaaaaaaaaaaaaaaaaaaaaaaaaaaaaaaaaaaaaaaaaaaaaaaaaaaaaaaaaaaaaaaaaaaaaaaaaaaaaaaaaaaaaaaaaaaaaaaaaaaaaaaaaaaaaaaaaaaaaaaaaaaaaaaaaaaaaaaaaaaaaaaaaaaaaaaaaaaaaaaaaaaaaaaaaaaaaaaaaaaaaaaaaaaaaaaaaaaaaaaaaaaaaaaaaaaaaaaaaaaaaaaaaaaaaaaaaaaaaaaaaaaaaaaaaaaaaaaaaaaaaaaaaaaaaaaaaaaaaaaaaaaaaaaaaaaaaaaaaaaaaaaaaaaaaaaaaaaaaaaaaaaaaaaaaaaaaaaaaaaaaaaaaaaaaaaaaaaaaaaaaaaaaaaaaaaaaaaaaaaaaaaaaaaaaaaaaaaaaaaaaaaaaaaaaaaaaaaaaaaaaaaaaaaaaaaaaaaaaaaaaaaaaaaaaaaaaaaaaaaaaaaaaaaaaaaaaaaaaaaaaaaaaaaaaaaaaaaaaaaaaaaaaaaaaaaaaaaaaaaaaaaaaaaaaaaaaaaaaaaaaaaaaaaaaaaaaaaaaaaaaaaaaaaaaaaaaaaaaaaaaaaaaaaaaaaaaaaaaaaaaaaaaaaaaaaaaaaaaaaaaaaaaaaaaaaaaaaaaaaaaaaaaaaaaaaaaaaaaaaaaaaaaaaaaaaaaaaaaaaaaaaaaaaaaaaaaaaaaaaaaaaaaaaaaaaaaaaaaaaaaaaaaaaaaaaaaaaaaaaaaaaaaaaaaaaaaaaaaaaaaaaaaaaaaaaaaaaaaaaaaaaaaaaaaaaaaaaaaaaaaaaaaaaaaaaaaaaaaaaaaaaaaaaaaaaaaaaaaaaaaaaaaaaaaaaaaaaaaaaaaaaaaaaaaaaaaaaaaaaaaaaaaaaaaaaaaaaaaaaaaaaaaaaaaaaaaaaaaaaaaaaaaaaaaaaaaaaaaaaaaaaaaaaaaaaaaaaaaaaaaaaaaaaaaaaaaaaaaaaaaaaaaaaaaaaaaaaaaaaaaaaaaaaaaaaaaaaaaaaaaaaaaaaaaaaaaaaaaaaaaaaaaaaaaaaaaaaaaaaaaaaaaaaaaaaaaaaaaaaaaaaaaaaaaaaaaaaaaaaaaaaaaaaaaaaaaaaaaaaaaaaaaaaaaaaaaaaaaaaaaaaaaaaaaaaaaaaaaaaaaaaaaaaaaaaaaaaaaaaaaaaaaaaaaaaaaaaaaaaaaaaaaaaaaaaaaaaaaaaaaaaaaaaaaaaaaaaaaaaaaaaaaaaaaaaaaaaaaaaaaaaaaaaaaaaaaaaaaaaaaaaaaaaaaaaaaaaaaaaaaaaaaaaaaaaaaaaaaaaaaaaaaaaaaaaaaaaaaaaaaaaaaaaaaaaaaaaaaaaaaaaaaaaaaaaaaaaaaaaaaaaaaaaaaaaaaaaaaaaaaaaaaaaaaaaaaaaaaaaaaaaaaaaaaaaaaaaaaaaaaaaaaaaaaaaaaaaaaaaaaaaaaaaaaaaaaaaaaaaaaaaaaaaaaaaaaaaaaaaaaaaaaaaaaaaaaaaaaaaaaaaaaaaaaaaaaaaaaaaaaaaaaaaaaaaaaaaaaaaaaaaaaaaaaaaaaaaaaaaaaaaaaaaaaaaaaaaaaaaaaaaaaaaaaaaaaaaaaaaaaaaaaaaaaaaaaaaaaaaaaaaaaaaaaaaaaaaaaaaaaaaaaaaaaaaaaaaaaaaaaaaaaaaaaaaaaaaaaaaaaaaaaaaaaaaaaaaaaaaaaaaaaaaaaaaaaaaaaaaaaaaaaaaaaaaaaaaaaaaaaaaaaaaaaaaaaaaaaaaaaaaaaaaaaaaaaaaaaaaaaaaaaaaaaaaaaaaaaaaaaaaaaaaaaaaaaaaaaaaaaaaaaaaaaaaaaaaaaaaaaaaaaaaaaaaaaaaaaaaaaaaaaaaaaaaaaaaaaaaaaaaaaaaaaaaaaaaaaaaaaaaaaaaaaaaaaaaaaaaaaaaaaaaaaaaaaaaaaaaaaaaaaaaaaaaaaaaaaaaaaaaaaaaaaaaaaaaaaaaaaaaaaaaaaaaaaaaaaaaaaaaaaaaaaaaaaaaaaaaaaaaaaaaaaaaaaaaaaaaaaaaaaaaaaaaaaaaaaaaaaaaaaaaaaaaaaaaaaaaaaaaaaaaaaaaaaaaaaaaaaaaaaaaaaaaaaaaaaaaaaaaaaaaaaaaaaaaaaaaaaaaaaaaaaaaaaaaaaaaaaaaaaaaaaaaaaaaaaaaaaaaaaaaaaaaaaaaaaaaaaaaaaaaaaaaaaaaaaaaaaaaaaaaaaaaaaaaaaaaaaaaaaaaaaaaaaaaaaaaaaaaaaaaaaaaaaaaaaaaaaaaaaaaaaaaaaaaaaaaaaaaaaaaaaaaaaaaaaaaaaaaaaaaaaaaaaaaaaaaaaaaaaaaaaaaaaaaaaaaaaaaaaaaaaaaaaaaaaaaaaaaaaaaaaaaaaaaaaaaaaaaaaaaaaaaaaaaaaaaaaaaaaaaaaaaaaaaaaaaaaaaaaaaaaaaaaaaaaaaaaaaaaaaaaaaaaaaaaaaaaaaaaaaaaaaaaaaaaaaaaaaaaaaaaaaaaaaaaaaaaaaaaaaaaaaaaaaaaaaaaaaaaaaaaaaaaaaaaaaaaaaaaaaaaaaaaaaaaaaaaaaaaaaaaaaaaaaaaaaaaaaaaaaaaaaaaaaaaaaaaaaaaaaaaaaaaaaaaaaaaaaaaaaaaaaaaaaaaaaaaaaaaaaaaaaaaaaaaaaaaaaaaaaaaaaaaaaaaaaaaaaaaaaaaaaaaaaaaaaaaaaaaaaaaaaaaaaaaaaaaaaaaaaaaaaaaaaaaaaaaaaaaaaaaaaaaaaaaaaaaaaaaaaaaaaaaaaaaaaaaaaaaaaaaaaaaaaaaaaaaaaaaaaaaaaaaaaaaaaaaaaaaaaaaaaaaaaaaaaaaaaaaaaaaaaaaaaaaaaaaaaaaaaaaaaaaaaaaaaaaaaaaaaaaaaaaaaaaaaaaaaaaaaaaaaaaaaaaaaaaaaaaaaaaaaaaaaaaaaaaaaaaaaaaaaaaaaaaaaaaaaaaaaaaaaaaaaaaaaaaaaaaaaaaaaaaaaaaaaaaaaaaaaaaaaaaaaaaaaaaaaaaaaaaaaaaaaaaaaaaaaaaaaaaaaaaaaaaaaaaaaaaaaaaaaaaaaaaaaaaaaaaaaaaaaaaaaaaaaaaaaaaaaaaaaaaaaaaaaaaaaaaaaaaaaaaaaaaaaaaaaaaaaaaaaaaaaaaaaaaaaaaaaaaaaaaaaaaaaaaaaaaaaaaaaaaaaaaaaaaaaaaaaaaaaaaaaaaaaaaaaaaaaaaaaaaaaaaaaaaaaaaaaaaaaaaaaaaaaaaaaaaaaaaaaaaaaaaaaaaaaaaaaaaaaaaaaaaaaaaaaaaaaaaaaaaaaaaaaaaaaaaaaaaaaaaaaaaaaaaaaaaaaaaaaaaaaaaaaaaaaaaaaaaaaaaaaaaaaaaaaaaaaaaaaaaaaaaaaaaaaaaaaaaaaaaaaaaaaaaaaaaaaaaaaaaaaaaaaaaaaaaaaaaaaaaaaaaaaaaaaaaaaaaaaaaaaaaaaaaaaaaaaaaaaaaaaaaaaaaaaaaaaaaaaaaaaaaaaaaaaaaaaaaaaaaaaaaaaaaaaaaaaaaaaaaaaaaaaaaaaaaaaaaaaaaaaaaaaaaaaaaaaaaaaaaaaaaaaaaaaaaaaaaaaaaaaaaaaaaaaaaaaaaaaaaaaaaaaaaaaaaaaaaaaaaaaaaaaaaaaaaaaaaaaaaaaaaaaaaaaaaaaaaaaaaaaaaaaaaaaaaaaaaaaaaaaaaaaaaaaaaaaaaaaaaaaaaaaaaaaaaaaaaaaaaaaaaaaaaaaaaaaaaaaaaaaaaaaaaaaaaaaaaaaaaaaaaaaaaaaaaaaaaaaaaaaaaaaaaaaaaaaaaaaaaaaaaaaaaaaaaaaaaaaaaaaaaaaaaaaaaaaaaaaaaaaaaaaaaaaaaaaaaaaaaaaaaaaaaaaaaaaaaaaaaaaaaaaaaaaaaaaaaaaaaaaaaaaaaaaaaaaaaaaaaaaaaaaaaaaaaaaaaaaaaaaaaaaaaaaaaaaaaaaaaaaaaaaaaaaaaaaaaaaaaaaaaaaaaaaaaaaaaaaaaaaaaaaaaaaaaaaaaaaaaaaaaaaaaaaaaaaaaaaaaaaaaaaaaaaaaaaaaaaaaaaaaaaaaaaaaaaaaaaaaaaaaaaaaaaaaaaaaaaaaaaaaaaaaaaaaaaaaaaaaaaaaaaaaaaaaaaaaaaaaaaaaaaaaaaaaaaaaaaaaaaaaaaaaaaaaaaaaaaaaaaaaaaaaaaaaaaaaaaaaaaaaaaaaaaaaaaaaaaaaaaaaaaaaaaaaaaaaaaaaaaaaaaaaaaaaaaaaaaaaaaaaaaaaaaaaaaaaaaaaaaaaaaaaaaaaaaaaaaaaaaaaaaaaaaaaaaaaaaaaaaaaaaaaaaaaaaaaaaaaaaaaaaaaaaaaaaaaaaaaaaaaaaaaaaaaaaaaaaaaaaaaaaaaaaaaaaaaaaaaaaaaaaaaaaaaaaaaaaaaaaaaaaaaaaaaaaaaaaaaaaaaaaaaaaaaaaaaaaaaaaaaaaaaaaaaaaaaaaaaaaaaaaaaaaaaaaaaaaaaaaaaaaaaaaaaaaaaaaaaaaaaaaaaaaaaaaaaaaaaaaaaaaaaaaaaaaaaaaaaaaaaaaaaaaaaaaaaaaaaaaaaaaaaaaaaaaaaaaaaaaaaaaaaaaaaaaaaaaaaaaaaaaaaaaaaaaaaaaaaaaaaaaaaaaaaaaaaaaaaaaaaaaaaaaaaaaaaaaaaaaaaaaaaaaaaaaaaaaaaaaaaaaaaaaaaaaaaaaaaaaaaaaaaaaaaaaaaaaaaaaaaaaaaaaaaaaaaaaaaaaaaaaaaaaaaaaaaaaaaaaaaaaaaaaaaaaaaaaaaaaaaaaaaaaaaaaaaaaaaaaaaaaaaaaaaaaaaaaaaaaaaaaaaaaaaaaaaaaaaaaaaaaaaaaaaaaaaaaaaaaaaaaaaaaaaaaaaaaaaaaaaaaaaaaaaaaaaaaaaaaaaaaaaaaaaaaaaaaaaaaaaaaaaaaaaaaaaaaaaaaaaaaaaaaaaaaaaaaaaaaaaaaaaaaaaaaaaaaaaaaaaaaaaaaaaaaaaaaaaaaaaaaaaaaaaaaaaaaaaaaaaaaaaaaaaaaaaaaaaaaaaaaaaaaaaaaaaaaaaaaaaaaaaaaaaaaaaaaaaaaaaaaaaaaaaaaaaaaaaaaaaaaaaaaaaaaaaaaaaaaaaaaaaaaaaaaaaaaaaaaaaaaaaaaaaaaaaaaaaaaaaaaaaaaaaaaaaaaaaaaaaaaaaaaaaaaaaaaaaaaaaaaaaaaaaaaaaaaaaaaaaaaaaaaaaaaaaaaaaaaaaaaaaaaaaaaaaaaaaaaaaaaaaaaaaaaaaaaaaaaaaaaaaaaaaaaaaaaaaaaaaaaaaaaaaaaaaaaaaaaaaaaaaaaaaaaaaaaaaaaaaaaaaaaaaaaaaaaaaaaaaaaaaaaaaaaaaaaaaaaaaaaaaaaaaaaaaaaaaaaaaaaaaaaaaaaaaaaaaaaaaaaaaaaaaaaaaaaaaaaaaaaaaaaaaaaaaaaaaaaaaaaaaaaaaaaaaaaaaaaaaaaaaaaaaaaaaaaaaaaaaaaaaaaaaaaaaaaaaaaaaaaaaaaaaaaaaaaaaaaaaaaaaaaaaaaaaaaaaaaaaaaaaaaaaaaaaaaaaaaaaaaaaaaaaaaaaaaaaaaaaaaaaaaaaaaaaaaaaaaaaaaaaaaaaaaaaaaaaaaaaaaaaaaaaaaaaaaaaaaaaaaaaaaaaaaaaaaaaaaaaaaaaaaaaaaaaaaaaaaaaaaaaaaaaaaaaaaaaaaaaaaaaaaaaaaaaaaaaaaaaaaaaaaaaaaaaaaaaaaaaaaaaaaaaaaaaaaaaaaaaaaaaaaaaaaaaaaaaaaaaaaaaaaaaaaaaaaaaaaaaaaaaaaaaaaaaaaaaaaaaaaaaaaaaaaaaaaaaaaaaaaaaaaaaaaaaaaaaaaaaaaaaaaaaaaaaaaaaaaaaaaaaaaaaaaaaaaaaaaaaaaaaaaaaaaaaaaaaaaaaaaaaaaaaaaaaaaaaaaaaaaaaaaaaaaaaaaaaaaaaaaaaaaaaaaaaaaaaaaaaaaaaaaaaaaaaaaaaaaaaaaaaaaaaaaaaaaaaaaaaaaaaaaaaaaaaaaaaaaaaaaaaaaaaaaaaaaaaaaaaaaaaaaaaaaaaaaaaaaaaaaaaaaaaaaaaaaaaaaaaaaaaaaaaaaaaaaaaaaaaaaaaaaaaaaaaaaaaaaaaaaaaaaaaaaaaaaaaaaaaaaaaaaaaaaaaaaaaaaaaaaaaaaaaaaaaaaaaaaaaaaaaaaaaaaaaaaaaaaaaaaaaaaaaaaaaaaaaaaaaaaaaaaaaaaaaaaaaaaaaaaaaaaaaaaaaaaaaaaaaaaaaaaaaaaaaaaaaaaaaaaaaaaaaaaaaaaaaaaaaaaaaaaaaaaaaaaaaaaaaaaaaaaaaaaaaaaaaaaaaaaaaaaaaaaaaaaaaaaaaaaaaaaaaaaaaaaaaaaaaaaaaaaaaaaaaaaaaaaaaaaaaaaaaaaaaaaaaaaaaaaaaaaaaaaaaaaaaaaaaaaaaaaaaaaaaaaaaaaaaaaaaaaaaaaaaaaaaaaaaaaaaaaaaaaaaaaaaaaaaaaaaaaaaaaaaaaaaaaaaaaaaaaaaaaaaaaaaaaaaaaaaaaaaaaaaaaaaaaaaaaaaaaaaaaaaaaaaaaaaaaaaaaaaaaaaaaaaaaaaaaaaaaaaaaaaaaaaaaaaaaaaaaaaaaaaaaaaaaaaaaaaaaaaaaaaaaaaaaaaaaaaaaaaaaaaaaaaaaaaaaaaaaaaaaaaaaaaaaaaaaaaaaaaaaaaaaaaaaaaaaaaaaaaaaaaaaaaaaaaaaaaaaaaaaaaaaaaaaaaaaaaaaaaaaaaaaaaaaaaaaaaaaaaaaaaaaaaaaaaaaaaaaaaaaaaaaaaaaaaaaaaaaaaaaaaaaaaaaaaaaaaaaaaaaaaaaaaaaaaaaaaaaaaaaaaaaaaaaaaaaaaaaaaaaaaaaaaaaaaaaaaaaaaaaaaaaaaaaaaaaaaaaaaaaaaaaaaaaaaaaaaaaaaaaaaaaaaaaaaaaaaaaaaaaaaaaaaaaaaaaaaaaaaaaaaaaaaaaaaaaaaaaaaaaaaaaaaaaaaaaaaaaaaaaaaaaaaaaaaaaaaaaaaaaaaaaaaaaaaaaaaaaaaaaaaaaaaaaaaaaaaaaaaaaaaaaaaaaaaaaaaaaaaaaaaaaaaaaaaaaaaaaaaaaaaaaaaaaaaaaaaaaaaaaaaaaaaaaaaaaaaaaaaaaaaaaaaaaaaaaaaaaaaaaaaaaaaaaaaaaaaaaaaaaaaaaaaaaaaaaaaaaaaaaaaaaaaaaaaaaaaaaaaaaaaaaaaaaaaaaaaaaaaaaaaaaaaaaaaaaaaaaaaaaaaaaaaaaaaaaaaaaaaaaaaaaaaaaaaaaaaaaaaaaaaaaaaaaaaaaaaaaaaaaaaaaaaaaaaaaaaaaaaaaaaaaaaaaaaaaaaaaaaaaaaaaaaaaaaaaaaaaaaaaaaaaaaaaaaaaaaaaaaaaaaaaaaaaaaaaaaaaaaaaaaaaaaaaaaaaaaaaaaaaaaaaaaaaaaaaaaaaaaaaaaaaaaaaaaaaaaaaaaaaaaaaaaaaaaaaaaaaaaaaaaaaaaaaaaaaaaaaaaaaaaaaaaaaaaaaaaaaaaaaaaaaaaaaaaaaaaaaaaaaaaaaaaaaaaaaaaaaaaaaaaaaaaaaaaaaaaaaaaaaaaaaaaaaaaaaaaaaaaaaaaaaaaaaaaaaaaaaaaaaaaaaaaaaaaaaaaaaaaaaaaaaaaaaaaaaaaaaaaaaaaaaaaaaaaaaaaaaaaaaaaaaaaaaaaaaaaaaaaaaaaaaaaaaaaaaaaaaaaaaaaaaaaaaaaaaaaaaaaaaaaaaaaaaaaaaaaaaaaaaaaaaaaaaaaaaaaaaaaaaaaaaaaaaaaaaaaaaaaaaaaaaaaaaaaaaaaaaaaaaaaaaaaaaaaaaaaaaaaaaaaaaaaaaaaaaaaaaaaaaaaaaaaaaaaaaaaaaaaaaaaaaaaaaaaaaaaaaaaaaaaaaaaaaaaaaaaaaaaaaaaaaaaaaaaaaaaaaaaaaaaaaaaaaaaaaaaaaaaaaaaaaaaaaaaaaaaaaaaaaaaaaaaaaaaaaaaaaaaaaaaaaaaaaaaaaaaaaaaaaaaaaaaaaaaaaaaaaaaaaaaaaaaaaaaaaaaaaaaaaaaaaaaaaaaaaaaaaaaaaaaaaaaaaaaaaaaaaaaaaaaaaaaaaaaaaaaaaaaaaaaaaaaaaaaaaaaaaaaaaaaaaaaaaaaaaaaaaaaaaaaaaaaaaaaaaaaaaaaaaaaaaaaaaaaaaaaaaaaaaaaaaaaaaaaaaaaaaaaaaaaaaaaaaaaaaaaaaaaaaaaaaaaaaaaaaaaaaaaaaaaaaaaaaaaaaaaaaaaaaaaaaaaaaaaaaaaaaaaaaaaaaaaaaaaaaaaaaaaaaaaaaaaaaaaaaaaaaaaaaaaaaaaaaaaaaaaaaaaaaaaaaaaaaaaaaaaaaaaaaaaaaaaaaaaaaaaaaaaaaaaaaaaaaaaaaaaaaaaaaaaaaaaaaaaaaaaaaaaaaaaaaaaaaaaaaaaaaaaaaaaaaaaaaaaaaaaaaaaaaaaaaaaaaaaaaaaaaaaaaaaaaaaaaaaaaaaaaaaaaaaaaaaaaaaaaaaaaaaaaaaaaaaaaaaaaaaaaaaaaaaaaaaaaaaaaaaaaaaaaaaaaaaaaaaaaaaaaaaaaaaaaaaaaaaaaaaaaaaaaaaaaaaaaaaaaaaaaaaaaaaaaaaaaaaaaaaaaaaaaaaaaaaaaaaaaaaaaaaaaaaaaaaaaaaaaaaaaaaaaaaaaaaaaaaaaaaaaaaaaaaaaaaaaaaaaaaaaaaaaaaaaaaaaaaaaaaaaaaaaaaaaaaaaaaaaaaaaaaaaaaaaaaaaaaaaaaaaaaaaaaaaaaaaaaaaaaaaaaaaaaaaaaaaaaaaaaaaaaaaaaaaaaaaaaaaaaaaaaaaaaaaaaaaaaaaaaaaaaaaaaaaaaaaaaaaaaaaaaaaaaaaaaaaaaaaaaaaaaaaaaaaaaaaaaaaaaaaaaaaaaaaaaaaaaaaaaaaaaaaaaaaaaaaaaaaaaaaaaaaaaaaaaaaaaaaaaaaaaaaaaaaaaaaaaaaaaaaaaaaaaaaaaaaaaaaaaaaaaaaaaaaaaaaaaaaaaaaaaaaaaaaaaaaaaaaaaaaaaaaaaaaaaaaaaaaaaaaaaaaaaaaaaaaaaaaaaaaaaaaaaaaaaaaaaaaaaaaaaaaaaaaaaaaaaaaaaaaaaaaaaaaaaaaaaaaaaaaaaaaaaaaaaaaaaaaaaaaaaaaaaaaaaaaaaaaaaaaaaaaaaaaaaaaaaaaaaaaaaaaaaaaaaaaaaaaaaaaaaaaaaaaaaaaaaaaaaaaaaaaaaaaaaaaaaaaaaaaaaaaaaaaaaaaaaaaaaaaaaaaaaaaaaaaaaaaaaaaaaaaaaaaaaaaaaaaaaaaaaaaaaaaaaaaaaaaaaaaaaaaaaaaaaaaaaaaaaaaaaaaaaaaaaaaaaaaaaaaaaaaaaaaaaaaaaaaaaaaaaaaaaaaaaaaaaaaaaaaaaaaaaaaaaaaaaaaaaaaaaaaaaaaaaaaaaaaaaaaaaaaaaaaaaaaaaaaaaaaaaaaaaaaaaaaaaaaaaaaaaaaaaaaaaaaaaaaaaaaaaaaaaaaaaaaaaaaaaaaaaaaaaaaaaaaaaaaaaaaaaaaaaaaaaaaaaaaaaaaaaaaaaaaaaaaaaaaaaaaaaaaaaaaaaaaaaaaaaaaaaaaaaaaaaaaaaaaaaaaaaaaaaaaaaaaaaaaaaaaaaaaaaaaaaaaaaaaaaaaaaaaaaaaaaaaaaaaaaaaaaaaaaaaaaaaaaaaaaaaaaaaaaaaaaaaaaaaaaaaaaaaaaaaaaaaaaaaaaaaaaaaaaaaaaaaaaaaaaaaaaaaaaaaaaaaaaaaaaaaaaaaaaaaaaaaaaaaaaaaaaaaaaaaaaaaaaaaaaaaaaaaaaaaaaaaaaaaaaaaaaaaaaaaaaaaaaaaaaaaaaaaaaaaaaaaaaaaaaaaaaaaaaaaaaaaaaaaaaaaaaaaaaaaaaaaaaaaaaaaaaaaaaaaaaaaaaaaaaaaaaaaaaaaaaaaaaaaaaaaaaaaaaaaaaaaaaaaaaaaaaaaaaaaaaaaaaaaaaaaaaaaaaaaaaaaaaaaaaaaaaaaaaaaaaaaaaaaaaaaaaaaaaaaaaaaaaaaaaaaaaaaaaaaaaaaaaaaaaaaaaaaaaaaaaaaaaaaaaaaaaaaaaaaaaaaaaaaaaaaaaaaaaaaaaaaaaaaaaaaaaaaaaaaaaaaaaaaaaaaaaaaaaaaaaaaaaaaaaaaaaaaaaaaaaaaaaaaaaaaaaaaaaaaaaaaaaaaaaaaaaaaaaaaaaaaaaaaaaaaaaaaaaaaaaaaaaaaaaaaaaaaaaaaaaaaaaaaaaaaaaaaaaaaaaaaaaaaaaaaaaaaaaaaaaaaaaaaaaaaaaaaaaaaaaaaaaaaaaaaaaaaaaaaaaaaaaaaaaaaaaaaaaaaaaaaaaaaaaaaaaaaaaaaaaaaaaaaaaaaaaaaaaaaaaaaaaaaaaaaaaaaaaaaaaaaaaaaaaaaaaaaaaaaaaaaaaaaaaaaaaaaaaaaaaaaaaaaaaaaaaaaaaaaaaaaaaaaaaaaaaaaaaaaaaaaaaaaaaaaaaaaaaaaaaaaaaaaaaaaaaaaaaaaaaaaaaaaaaaaaaaaaaaaaaaaaaaaaaaaaaaaaaaaaaaaaaaaaaaaaaaaaaaaaaaaaaaaaaaaaaaaaaaaaaaaaaaaaaaaaaaaaaaaaaaaaaaaaaaaaaaaaaaaaaaaaaaaaaaaaaaaaaaaaaaaaaaaaaaaaaaaaaaaaaaaaaaaaaaaaaaaaaaaaaaaaaaaaaaaaaaaaaaaaaaaaaaaaaaaaaaaaaaaaaaaaaaaaaaaaaaaaaaaaaaaaaaaaaaaaaaaaaaaaaaaaaaaaaaaaaaaaaaaaaaaaaaaaaaaaaaaaaaaaaaaaaaaaaaaaaaaaaaaaaaaaaaaaaaaaaaaaaaaaaaaaaaaaaaaaaaaaaaaaaaaaaaaaaaaaaaaaaaaaaaaaaaaaaaaaaaaaaaaaaaaaaaaaaaaaaaaaaaaaaaaaaaaaaaaaaaaaaaaaaaaaaaaaaaaaaaaaaaaaaaaaaaaaaaaaaaaaaaaaaaaaaaaaaaaaaaaaaaaaaaaaaaaaaaaaaaaaaaaaaaaaaaaaaaaaaaaaaaaaaaaaaaaaaaaaaaaaaaaaaaaaaaaaaaaaaaaaaaaaaaaaaaaaaaaaaaaaaaaaaaaaaaaaaaaaaaaaaaaaaaaaaaaaaaaaaaaaaaaaaaaaaaaaaaaaaaaaaaaaaaaaaaaaaaaaaaaaaaaaaaaaaaaaaaaaaaaaaaaaaaaaaaaaaaaaaaaaaaaaaaaaaaaaaaaaaaaaaaaaaaaaaaaaaaaaaaaaaaaaaaaaaaaaaaaaaaaaaaaaaaaaaaaaaaaaaaaaaaaaaaaaaaaaaaaaaaaaaaaaaaaaaaaaaaaaaaaaaaaaaaaaaaaaaaaaaaaaaaaaaaaaaaaaaaaaaaaaaaaaaaaaaaaaaaaaaaaaaaaaaaaaaaaaaaaaaaaaaaaaaaaaaaaaaaaaaaaaaaaaaaaaaaaaaaaaaaaaaaaaaaaaaaaaaaaaaaaaaaaaaaaaaaaaaaaaaaaaaaaaaaaaaaaaaaaaaaaaaaaaaaaaaaaaaaaaaaaaaaaaaaaaaaaaaaaaaaaaaaaaaaaaaaaaaaaaaaaaaaaaaaaaaaaaaaaaaaaaaaaaaaaaaaaaaaaaaaaaaaaaaaaaaaaaaaaaaaaaaaaaaaaaaaaaaaaaaaaaaaaaaaaaaaaaaaaaaaaaaaaaaaaaaaaaaaaaaaaaaaaaaaaaaaaaaaaaaaaaaaaaaaaaaaaaaaaaaaaaaaaaaaaaaaaaaaaaaaaaaaaaaaaaaaaaaaaaaaaaaaaaaaaaaaaaaaaaaaaaaaaaaaaaaaaaaaaaaaaaaaaaaaaaaaaaaaaaaaaaaaaaaaaaaaaaaaaaaaaaaaaaaaaaaaaaaaaaaaaaaaaaaaaaaaaaaaaaaaaaaaaaaaaaaaaaaaaaaaaaaaaaaaaaaaaaaaaaaaaaaaaaaaaaaaaaaaaaaaaaaaaaaaaaaaaaaaaaaaaaaaaaaaaaaaaaaaaaaaaaaaaaaaaaaaaaaaaaaaaaaaaaaaaaaaaaaaaaaaaaaaaaaaaaaaaaaaaaaaaaaaaaaaaaaaaaaaaaaaaaaaaaaaaaaaaaaaaaaaaaaaaaaaaaaaaaaaaaaaaaaaaaaaaaaaaaaaaaaaaaaaaaaaaaaaaaaaaaaaaaaaaaaaaaaaaaaaaaaaaaaaaaaaaaaaaaaaaaaaaaaaaaaaaaaaaaaaaaaaaaaaaaaaaaaaaaaaaaaaaaaaaaaaaaaaaaaaaaaaaaaaaaaaaaaaaaaaaaaaaaaaaaaaaaaaaaaaaaaaaaaaaaaaaaaaaaaaaaaaaaaaaaaaaaaaaaaaaaaaaaaaaaaaaaaaaaaaaaaaaaaaaaaaaaaaaaaaaaaaaaaaaaaaaaaaaaaaaaaaaaaaaaaaaaaaaaaaaaaaaaaaaaaaaaaaaaaaaaaaaaaaaaaaaaaaaaaaaaaaaaaaaaaaaaaaaaaaaaaaaaaaaaaaaaaaaaaaaaaaaaaaaaaaaaaaaaaaaaaaaaaaaaaaaaaaaaaaaaaaaaaaaaaaaaaaaaaaaaaaaaaaaaaaaaaaaaaaaaaaaaaaaaaaaaaaaaaaaaaaaaaaaaaaaaaaaaaaaaaaaaaaaaaaaaaaaaaaaaaaaaaaaaaaaaaaaaaaaaaaaaaaaaaaaaaaaaaaaaaaaaaaaaaaaaaaaaaaaaaaaaaaaaaaaaaaaaaaaaaaaaaaaaaaaaaaaaaaaaaaaaaaaaaaaaaaaaaaaaaaaaaaaaaaaaaaaaaaaaaaaaaaaaaaaaaaaaaaaaaaaaaaaaaaaaaaaaaaaaaaaaaaaaaaaaaaaaaaaaaaaaaaaaaaaaaaaaaaaaaaaaaaaaaaaaaaaaaaaaaaaaaaaaaaaaaaaaaaaaaaaaaaaaaaaaaaaaaaaaaaaaaaaaaaaaaaaaaaaaaaaaaaaaaaaaaaaaaaaaaaaaaaaaaaaaaaaaaaaaaaaaaaaaaaaaaaaaaaaaaaaaaaaaaaaaaaaaaaaaaaaaaaaaaaaaaaaaaaaaaaaaaaaaaaaaaaaaaaaaaaaaaaaaaaaaaaaaaaaaaaaaaaaaaaaaaaaaaaaaaaaaaaaaaaaaaaaaaaaaaaaaaaaaaaaaaaaaaaaaaaaaaaaaaaaaaaaaaaaaaaaaaaaaaaaaaaaaaaaaaaaaaaaaaaaaaaaaaaaaaaaaaaaaaaaaaaaaaaaaaaaaaaaaaaaaaaaaaaaaaaaaaaaaaaaaaaaaaaaaaaaaaaaaaaaaaaaaaaaaaaaaaaaaaaaaaaaaaaaaaaaaaaaaaaaaaaaaaaaaaaaaaaaaaaaaaaaaaaaaaaaaaaaaaaaaaaaaaaaaaaaaaaaaaaaaaaaaaaaaaaaaaaaaaaaaaaaaaaaaaaaaaaaaaaaaaaaaaaaaaaaaaaaaaaaaaaaaaaaaaaaaaaaaaaaaaaaaaaaaaaaaaaaaaaaaaaaaaaaaaaaaaaaaaaaaaaaaaaaaaaaaaaaaaaaaaaaaaaaaaaaaaaaaaaaaaaaaaaaaaaaaaaaaaaaaaaaaaaaaaaaaaaaaaaaaaaaaaaaaaaaaaaaaaaaaaaaaaaaaaaaaaaaaaaaaaaaaaaaaaaaaaaaaaaaaaaaaaaaaaaaaaaaaaaaaaaaaaaaaaaaaaaaaaaaaaaaaaaaaaaaaaaaaaaaaaaaaaaaaaaaaaaaaaaaaaaaaaaaaaaaaaaaaaaaaaaaaaaaaaaaaaaaaaaaaaaaaaaaaaaaaaaaaaaaaaaaaaaaaaaaaaaaaaaaaaaaaaaaaaaaaaaaaaaaaaaaaaaaaaaaaaaaaaaaaaaaaaaaaaaaaaaaaaaaaaaaaaaaaaaaaaaaaaaaaaaaaaaaaaaaaaaaaaaaaaaaaaaaaaaaaaaaaaaaaaaaaaaaaaaaaaaaaaaaaaaaaaaaaaaaaaaaaaaaaaaaaaaaaaaaaaaaaaaaaaaaaaaaaaaaaaaaaaaaaaaaaaaaaaaaaaaaaaaaaaaaaaaaaaaaaaaaaaaaaaaaaaaaaaaaaaaaaaaaaaaaaaaaaaaaaaaaaaaaaaaaaaaaaaaaaaaaaaaaaaaaaaaaaaaaaaaaaaaaaaaaaaaaaaaaaaaaaaaaaaaaaaaaaaaaaaaaaaaaaaaaaaaaaaaaaaaaaaaaaaaaaaaaaaaaaaaaaaaaaaaaaaaaaaaaaaaaaaaaaaaaaaaaaaaaaaaaaaaaaaaaaaaaaaaaaaaaaaaaaaaaaaaaaaaaaaaaaaaaaaaaaaaaaaaaaaaaaaaaaaaaaaaaaaaaaaaaaaaaaaaaaaaaaaaaaaaaaaaaaaaaaaaaaaaaaaaaaaaaaaaaaaaaaaaaaaaaaaaaaaaaaaaaaaaaaaaaaaaaaaaaaaaaaaaaaaaaaaaaaaaaaaaaaaaaaaaaaaaaaaaaaaaaaaaaaaaaaaaaaaaaaaaaaaaaaaaaaaaaaaaaaaaaaaaaaaaaaaaaaaaaaaaaaaaaaaaaaaaaaaaaaaaaaaaaaaaaaaaaaaaaaaaaaaaaaaaaaaaaaaaaaaaaaaaaaaaaaaaaaaaaaaaaaaaaaaaaaaaaaaaaaaaaaaaaaaaaaaaaaaaaaaaaaaaaaaaaaaaaaaaaaaaaaaaaaaaaaaaaaaaaaaaaaaaaaaaaaaaaaaaaaaaaaaaaaaaaaaaaaaaaaaaaaaaaaaaaaaaaaaaaaaaaaaaaaaaaaaaaaaaaaaaaaaaaaaaaaaaaaaaaaaaaaaaaaaaaaaaaaaaaaaaaaaaaaaaaaaaaaaaaaaaaaaaaaaaaaaaaaaaaaaaaaaaaaaaaaaaaaaaaaaaaaaaaaaaaaaaaaaaaaaaaaaaaaaaaaaaaaaaaaaaaaaaaaaaaaaaaaaaaaaaaaaaaaaaaaaaaaaaaaaaaaaaaaaaaaaaaaaaaaaaaaaaaaaaaaaaaaaaaaaaaaaaaaaaaaaaaaaaaaaaaaaaaaaaaaaaaaaaaaaaaaaaaaaaaaaaaaaaaaaaaaaaaaaaaaaaaaaaaaaaaaaaaaaaaaaaaaaaaaaaaaaaaaaaaaaaaaaaaaaaaaaaaaaaaaaaaaaaaaaaaaaaaaaaaaaaaaaaaaaaaaaaaaaaaaaaaaaaaaaaaaaaaaaaaaaaaaaaaaaaaaaaaaaaaaaaaaaaaaaaaaaaaaaaaaaaaaaaaaaaaaaaaaaaaaaaaaaaaaaaaaaaaaaaaaaaaaaaaaaaaaaaaaaaaaaaaaaaaaaaaaaaaaaaaaaaaaaaaaaaaaaaaaaaaaaaaaaaaaaaaaaaaaaaaaaaaaaaaaaaaaaaaaaaaaaaaaaaaaaaaaaaaaaaaaaaaaaaaaaaaaaaaaaaaaaaaaaaaaaaaaaaaaaaaaaaaaaaaaaaaaaaaaaaaaaaaaaaaaaaaaaaaaaaaaaaaaaaaaaaaaaaaaaaaaaaaaaaaaaaaaaaaaaaaaaaaaaaaaaaaaaaaaaaaaaaaaaaaaaaaaaaaaaaaaaaaaaaaaaaaaaaaaaaaaaaaaaaaaaaaaaaaaaaaaaaaaaaaaaaaaaaaaaaaaaaaaaaaaaaaaaaaaaaaaaaaaaaaaaaaaaaaaaaaaaaaaaaaaaaaaaaaaaaaaaaaaaaaaaaaaaaaaaaaaaaaaaaaaaaaaaaaaaaaaaaaaaaaaaaaaaaaaaaaaaaaaaaaaaaaaaaaaaaaaaaaaaaaaaaaaaaaaaaaaaaaaaaaaaaaaaaaaaaaaaaaaaaaaaaaaaaaaaaaaaaaaaaaaaaaaaaaaaaaaaaaaaaaaaaaaaaaaaaaaaaaaaaaaaaaaaaaaaaaaaaaaaaaaaaaaaaaaaaaaaaaaaaaaaaaaaaaaaaaaaaaaaaaaaaaaaaaaaaaaaaaaaaaaaaaaaaaaaaaaaaaaaaaaaaaaaaaaaaaaaaaaaaaaaaaaaaaaaaaaaaaaaaaaaaaaaaaaaaaaaaaaaaaaaaaaaaaaaaaaaaaaaaaaaaaaaaaaaaaaaaaaaaaaaaaaaaaaaaaaaaaaaaaaaaaaaaaaaaaaaaaaaaaaaaaaaaaaaaaaaaaaaaaaaaaaaaaaaaaaaaaaaaaaaaaaaaaaaaaaaaaaaaaaaaaaaaaaaaaaaaaaaaaaaaaaaaaaaaaaaaaaaaaaaaaaaaaaaaaaaaaaaaaaaaaaaaaaaaaaaaaaaaaaaaaaaaaaaaaaaaaaaaaaaaaaaaaaaaaaaaaaaaaaaaaaaaaaaaaaaaaaaaaaaaaaaaaaaaaaaaaaaaaaaaaaaaaaaaaaaaaaaaaaaaaaaaaaaaaaaaaaaaaaaaaaaaaaaaaaaaaaaaaaaaaaaaaaaaaaaaaaaaaaaaaaaaaaaaaaaaaaaaaaaaaaaaaaaaaaaaaaaaaaaaaaaaaaaaaaaaaaaaaaaaaaaaaaaaaaaaaaaaaaaaaaaaaaaaaaaaaaaaaaaaaaaaaaaaaaaaaaaaaaaaaaaaaaaaaaaaaaaaaaaaaaaaaaaaaaaaaaaaaaaaaaaaaaaaaaaaaaaaaaaaaaaaaaaaaaaaaaaaaaaaaaaaaaaaaaaaaaaaaaaaaaaaaaaaaaaaaaaaaaaaaaaaaaaaaaaaaaaaaaaaaaaaaaaaaaaaaaaaaaaaaaaaaaaaaaaaaaaaaaaaaaaaaaaaaaaaaaaaaaaaaaaaaaaaaaaaaaaaaaaaaaaaaaaaaaaaaaaaaaaaaaaaaaaaaaaaaaaaaaaaaaaaaaaaaaaaaaaaaaaaaaaaaaaaaaaaaaaaaaaaaaaaaaaaaaaaaaaaaaaaaaaaaaaaaaaaaaaaaaaaaaaaaaaaaaaaaaaaaaaaaaaaaaaaaaaaaaaaaaaaaaaaaaaaaaaaaaaaaaaaaaaaaaaaaaaaaaaaaaaaaaaaaaaaaaaaaaaaaaaaaaaaaaaaaaaaaaaaaaaaaaaaaaaaaaaaaaaaaaaaaaaaaaaaaaaaaaaaaaaaaaaaaaaaaaaaaaaaaaaaaaaaaaaaaaaaaaaaaaaaaaaaaaaaaaaaaaaaaaaaaaaaaaaaaaaaaaaaaaaaaaaaaaaaaaaaaaaaaaaaaaaaaaaaaaaaaaaaaaaaaaaaaaaaaaaaaaaaaaaaaaaaaaaaaaaaaaaaaaaaaaaaaaaaaaaaaaaaaaaaaaaaaaaaaaaaaaaaaaaaaaaaaaaaaaaaaaaaaaaaaaaaaaaaaaaaaaaaaaaaaaaaaaaaaaaaaaaaaaaaaaaaaaaaaaaaaaaaaaaaaaaaaaaaaaaaaaaaaaaaaaaaaaaaaaaaaaaaaaaaaaaaaaaaaaaaaaaaaaaaaaaaaaaaaaaaaaaaaaaaaaaaaaaaaaaaaaaaaaaaaaaaaaaaaaaaaaaaaaaaaaaaaaaaaaaaaaaaaaaaaaaaaaaaaaaaaaaaaaaaaaaaaaaaaaaaaaaaaaaaaaaaaaaaaaaaaaaaaaaaaaaaaaaaaaaaaaaaaaaaaaaaaaaaaaaaaaaaaaaaaaaaaaaaaaaaaaaaaaaaaaaaaaaaaaaaaaaaaaaaaaaaaaaaaaaaaaaaaaaaaaaaaaaaaaaaaaaaaaaaaaaaaaaaaaaaaaaaaaaaaaaaaaaaaaaaaaaaaaaaaaaaaaaaaaaaaaaaaaaaaaaaaaaaaaaaaaaaaaaaaaaaaaaaaaaaaaaaaaaaaaaaaaaaaaaaaaaaaaaaaaaaaaaaaaaaaaaaaaaaaaaaaaaaaaaaaaaaaaaaaaaaaaaaaaaaaaaaaaaaaaaaaaaaaaaaaaaaaaaaaaaaaaaaaaaaaaaaaaaaaaaaaaaaaaaaaaaaaaaaaaaaaaaaaaaaaaaaaaaaaaaaaaaaaaaaaaaaaaaaaaaaaaaaaaaaaaaaaaaaaaaaaaaaaaaaaaaaaaaaaaaaaaaaaaaaaaaaaaaaaaaaaaaaaaaaaaaaaaaaaaaaaaaaaaaaaaaaaaaaaaaaaaaaaaaaaaaaaaaaaaaaaaaaaaaaaaaaaaaaaaaaaaaaaaaaaaaaaaaaaaaaaaaaaaaaaaaaaaaaaaaaaaaaaaaaaaaaaaaaaaaaaaaaaaaaaaaaaaaaaaaaaaaaaaaaaaaaaaaaaaaaaaaaaaaaaaaaaaaaaaaaaaaaaaaaaaaaaaaaaaaaaaaaaaaaaaaaaaaaaaaaaaaaaaaaaaaaaaaaaaaaaaaaaaaaaaaaaaaaaaaaaaaaaaaaaaaaaaaaaaaaaaaaaaaaaaaaaaaaaaaaaaaaaaaaaaaaaaaaaaaaaaaaaaaaaaaaaaaaaaaaaaaaaaaaaaaaaaaaaaaaaaaaaaaaaaaaaaaaaaaaaaaaaaaaaaaaaaaaaaaaaaaaaaaaaaaaaaaaaaaaaaaaaaaaaaaaaaaaaaaaaaaaaaaaaaaaaaaaaaaaaaaaaaaaaaaaaaaaaaaaaaaaaaaaaaaaaaaaaaaaaaaaaaaaaaaaaaaaaaaaaaaaaaaaaaaaaaaaaaaaaaaaaaaaaaaaaaaaaaaaaaaaaaaaaaaaaaaaaaaaaaaaaaaaaaaaaaaaaaaaaaaaaaaaaaaaaaaaaaaaaaaaaaaaaaaaaaaaaaaaaaaaaaaaaaaaaaaaaaaaaaaaaaaaaaaaaaaaaaaaaaaaaaaaaaaaaaaaaaaaaaaaaaaaaaaaaaaaaaaaaaaaaaaaaaaaaaaaaaaaaaaaaaaaaaaaaaaaaaaaaaaaaaaaaaaaaaaaaaaaaaaaaaaaaaaaaaaaaaaaaaaaaaaaaaaaaaaaaaaaaaaaaaaaaaaaaaaaaaaaaaaaaaaaaaaaaaaaaaaaaaaaaaaaaaaaaaaaaaaaaaaaaaaaaaaaaaaaaaaaaaaaaaaaaaaaaaaaaaaaaaaaaaaaaaaaaaaaaaaaaaaaaaaaaaaaaaaaaaaaaaaaaaaaaaaaaaaaaaaaaaaaaaaaaaaaaaaaaaaaaaaaaaaaaaaaaaaaaaaaaaaaaaaaaaaaaaaaaaaaaaaaaaaaaaaaaaaaaaaaaaaaaaaaaaaaaaaaaaaaaaaaaaaaaaaaaaaaaaaaaaaaaaaaaaaaaaaaaaaaaaaaaaaaaaaaaaaaaaaaaaaaaaaaaaaaaaaaaaaaaaaaaaaaaaaaaaaaaaaaaaaaaaaaaaaaaaaaaaaaaaaaaaaaaaaaaaaaaaaaaaaaaaaaaaaaaaaaaaaaaaaaaaaaaaaaaaaaaaaaaaaaaaaaaaaaaaaaaaaaaaaaaaaaaaaaaaaaaaaaaaaaaaaaaaaaaaaaaaaaaaaaaaaaaaaaaaaaaaaaaaaaaaaaaaaaaaaaaaaaaaaaaaaaaaaaaaaaaaaaaaaaaaaaaaaaaaaaaaaaaaaaaaaaaaaaaaaaaaaaaaaaaaaaaaaaaaaaaaaaaaaaaaaaaaaaaaaaaaaaaaaaaaaaaaaaaaaaaaaaaaaaaaaaaaaaaaaaaaaaaaaaaaaaaaaaaaaaaaaaaaaaaaaaaaaaaaaaaaaaaaaaaaaaaaaaaaaaaaaaaaaaaaaaaaaaaaaaaaaaaaaaaaaaaaaaaaaaaaaaaaaaaaaaaaaaaaaaaaaaaaaaaaaaaaaaaaaaaaaaaaaaaaaaaaaaaaaaaaaaaaaaaaaaaaaaaaaaaaaaaaaaaaaaaaaaaaaaaaaaaaaaaaaaaaaaaaaaaaaaaaaaaaaaaaaaaaaaaaaaaaaaaaaaaaaaaaaaaaaaaaaaaaaaaaaaaaaaaaaaaaaaaaaaaaaaaaaaaaaaaaaaaaaaaaaaaaaaaaaaaaaaaaaaaaaaaaaaaaaaaaaaaaaaaaaaaaaaaaaaaaaaaaaaaaaaaaaaaaaaaaaaaaaaaaaaaaaaaaaaaaaaaaaaaaaaaaaaaaaaaaaaaaaaaaaaaaaaaaaaaaaaaaaaaaaaaaaaaaaaaaaaaaaaaaaaaaaaaaaaaaaaaaaaaaaaaaaaaaaaaaaaaaaaaaaaaaaaaaaaaaaaaaaaaaaaaaaaaaaaaaaaaaaaaaaaaaaaaaaaaaaaaaaaaaaaaaaaaaaaaaaaaaaaaaaaaaaaaaaaaaaaaaaaaaaaaaaaaaaaaaaaaaaaaaaaaaaaaaaaaaaaaaaaaaaaaaaaaaaaaaaaaaaaaaaaaaaaaaaaaaaaaaaaaaaaaaaaaaaaaaaaaaaaaaaaaaaaaaaaaaaaaaaaaaaaaaaaaaaaaaaaaaaaaaaaaaaaaaaaaaaaaaaaaaaaaaaaaaaaaaaaaaaaaaaaaaaaaaaaaaaaaaaaaaaaaaaaaaaaaaaaaaaaaaaaaaaaaaaaaaaaaaaaaaaaaaaaaaaaaaaaaaaaaaaaaaaaaaaaaaaaaaaaaaaaaaaaaaaaaaaaaaaaaaaaaaaaaaaaaaaaaaaaaaaaaaaaaaaaaaaaaaaaaaaaaaaaaaaaaaaaaaaaaaaaaaaaaaaaaaaaaaaaaaaaaaaaaaaaaaaaaaaaaaaaaaaaaaaaaaaaaaaaaaaaaaaaaaaaaaaaaaaaaaaaaaaaaaaaaaaaaaaaaaaaaaaaaaaaaaaaaaaaaaaaaaaaaaaaaaaaaaaaaaaaaaaaaaaaaaaaaaaaaaaaaaaaaaaaaaaaaaaaaaaaaaaaaaaaaaaaaaaaaaaaaaaaaaaaaaaaaaaaaaaaaaaaaaaaaaaaaaaaaaaaaaaaaaaaaaaaaaaaaaaaaaaaaaaaaaaaaaaaaaaaaaaaaaaaaaaaaaaaaaaaaaaaaaaaaaaaaaaaaaaaaaaaaaaaaaaaaaaaaaaaaaaaaaaaaaaaaaaaaaaaaaaaaaaaaaaaaaaaaaaaaaaaaaaaaaaaaaaaaaaaaaaaaaaaaaaaaaaaaaaaaaaaaaaaaaaaaaaaaaaaaaaaaaaaaaaaaaaaaaaaaaaaaaaaaaaaaaaaaaaaaaaaaaaaaaaaaaaaaaaaaaaaaaaaaaaaaaaaaaaaaaaaaaaaaaaaaaaaaaaaaaaaaaaaaaaaaaaaaaaaaaaaaaaaaaaaaaaaaaaaaaaaaaaaaaaaaaaaaaaaaaaaaaaaaaaaaaaaaaaaaaaaaaaaaaaaaaaaaaaaaaaaaaaaaaaaaaaaaaaaaaaaaaaaaaaaaaaaaaaaaaaaaaaaaaaaaaaaaaaaaaaaaaaaaaaaaaaaaaaaaaaaaaaaaaaaaaaaaaaaaaaaaaaaaaaaaaaaaaaaaaaaaaaaaaaaaaaaaaaaaaaaaaaaaaaaaaaaaaaaaaaaaaaaaaaaaaaaaaaaaaaaaaaaaaaaaaaaaaaaaaaaaaaaaaaaaaaaaaaaaaaaaaaaaaaaaaaaaaaaaaaaaaaaaaaaaaaaaaaaaaaaaaaaaaaaaaaaaaaaaaaaaaaaaaaaaaaaaaaaaaaaaaaaaaaaaaaaaaaaaaaaaaaaaaaaaaaaaaaaaaaaaaaaaaaaaaaaaaaaaaaaaaaaaaaaaaaaaaaaaaaaaaaaaaaaaaaaaaaaaaaaaaaaaaaaaaaaaaaaaaaaaaaaaaaaaaaaaaaaaaaaaaaaaaaaaaaaaaaaaaaaaaaaaaaaaaaaaaaaaaaaaaaaaaaaaaaaaaaaaaaaaaaaaaaaaaaaaaaaaaaaaaaaaaaaaaaaaaaaaaaaaaaaaaaaaaaaaaaaaaaaaaaaaaaaaaaaaaaaaaaaaaaaaaaaaaaaaaaaaaaaaaaaaaaaaaaaaaaaaaaaaaaaaaaaaaaaaaaaaaaaaaaaaaaaaaaaaaaaaaaaaaaaaaaaaaaaaaaaaaaaaaaaaaaaaaaaaaaaaaaaaaaaaaaaaaaaaaaaaaaaaaaaaaaaaaaaaaaaaaaaaaaaaaaaaaaaaaaaaaaaaaaaaaaaaaaaaaaaaaaaaaaaaaaaaaaaaaaaaaaaaaaaaaaaaaaaaaaaaaaaaaaaaaaaaaaaaaaaaaaaaaaaaaaaaaaaaaaaaaaaaaaaaaaaaaaaaaaaaaaaaaaaaaaaaaaaaaaaaaaaaaaaaaaaaaaaaaaaaaaaaaaaaaaaaaaaaaaaaaaaaaaaaaaaaaaaaaaaaaaaaaaaaaaaaaaaaaaaaaaaaaaaaaaaaaaaaaaaaaaaaaaaaaaaaaaaaaaaaaaaaaaaaaaaaaaaaaaaaaaaaaaaaaaaaaaaaaaaaaaaaaaaaaaaaaaaaaaaaaaaaaaaaaaaaaaaaaaaaaaaaaaaaaaaaaaaaaaaaaaaaaaaaaaaaaaaaaaaaaaaaaaaaaaaaaaaaaaaaaaaaaaaaaaaaaaaaaaaaaaaaaaaaaaaaaaaaaaaaaaaaaaaaaaaaaaaaaaaaaaaaaaaaaaaaaaaaaaaaaaaaaaaaaaaaaaaaaaaaaaaaaaaaaaaaaaaaaaaaaaaaaaaaaaaaaaaaaaaaaaaaaaaaaaaaaaaaaaaaaaaaaaaaaaaaaaaaaaaaaaaaaaaaaaaaaaaaaaaaaaaaaaaaaaaaaaaaaaaaaaaaaaaaaaaaaaaaaaaaaaaaaaaaaaaaaaaaaaaaaaaaaaaaaaaaaaaaaaaaaaaaaaaaaaaaaaaaaaaaaaaaaaaaaaaaaaaaaaaaaaaaaaaaaaaaaaaaaaaaaaaaaaaaaaaaaaaaaaaaaaaaaaaaaaaaaaaaaaaaaaaaaaaaaaaaaaaaaaaaaaaaaaaaaaaaaaaaaaaaaaaaaaaaaaaaaaaaaaaaaaaaaaaaaaaaaaaaaaaaaaaaaaaaaaaaaaaaaaaaaaaaaaaaaaaaaaaaaaaaaaaaaaaaaaaaaaaaaaaaaaaaaaaaaaaaaaaaaaaaaaaaaaaaaaaaaaaaaaaaaaaaaaaaaaaaaaaaaaaaaaaaaaaaaaaaaaaaaaaaaaaaaaaaaaaaaaaaaaaaaaaaaaaaaaaaaaaaaaaaaaaaaaaaaaaaaaaaaaaaaaaaaaaaaaaaaaaaaaaaaaaaaaaaaaaaaaaaaaaaaaaaaaaaaaaaaaaaaaaaaaaaaaaaaaaaaaaaaaaaaaaaaaaaaaaaaaaaaaaaaaaaaaaaaaaaaaaaaaaaaaaaaaaaaaaaaaaaaaaaaaaaaaaaaaaaaaaaaaaaaaaaaaaaaaaaaaaaaaaaaaaaaaaaaaaaaaaaaaaaaaaaaaaaaaaaaaaaaaaaaaaaaaaaaaaaaaaaaaaaaaaaaaaaaaaaaaaaaaaaaaaaaaaaaaaaaaaaaaaaaaaaaaaaaaaaaaaaaaaaaaaaaaaaaaaaaaaaaaaaaaaaaaaaaaaaaaaaaaaaaaaaaaaaaaaaaaaaaaaaaaaaaaaaaaaaaaaaaaaaaaaaaaaaaaaaaaaaaaaaaaaaaaaaaaaaaaaaaaaaaaaaaaaaaaaaaaaaaaaaaaaaaaaaaaaaaaaaaaaaaaaaaaaaaaaaaaaaaaaaaaaaaaaaaaaaaaaaaaaaaaaaaaaaaaaaaaaaaaaaaaaaaaaaaaaaaaaaaaaaaaaaaaaaaaaaaaaaaaaaaaaaaaaaaaaaaaaaaaaaaaaaaaaaaaaaaaaaaaaaaaaaaaaaaaaaaaaaaaaaaaaaaaaaaaaaaaaaaaaaaaaaaaaaaaaaaaaaaaaaaaaaaaaaaaaaaaaaaaaaaaaaaaaaaaaaaaaaaaaaaaaaaaaaaaaaaaaaaaaaaaaaaaaaaaaaaaaaaaaaaaaaaaaaaaaaaaaaaaaaaaaaaaaaaaaaaaaaaaaaaaaaaaaaaaaaaaaaaaaaaaaaaaaaaaaaaaaaaaaaaaaaaaaaaaaaaaaaaaaaaaaaaaaaaaaaaaaaaaaaaaaaaaaaaaaaaaaaaaaaaaaaaaaaaaaaaaaaaaaaaaaaaaaaaaaaaaaaaaaaaaaaaaaaaaaaaaaaaaaaaaaaaaaaaaaaaaaaaaaaaaaaaaaaaaaaaaaaaaaaaaaaaaaaaaaaaaaaaaaaaaaaaaaaaaaaaaaaaaaaaaaaaaaaaaaaaaaaaaaaaaaaaaaaaaaaaaaaaaaaaaaaaaaaaaaaaaaaaaaaaaaaaaaaaaaaaaaaaaaaaaaaaaaaaaaaaaaaaaaaaaaaaaaaaaaaaaaaaaaaaaaaaaaaaaaaaaaaaaaaaaaaaaaaaaaaaaaaaaaaaaaaaaaaaaaaaaaaaaaaaaaaaaaaaaaaaaaaaaaaaaaaaaaaaaaaaaaaaaaaaaaaaaaaaaaaaaaaaaaaaaaaaaaaaaaaaaaaaaaaaaaaaaaaaaaaaaaaaaaaaaaaaaaaaaaaaaaaaaaaaaaaaaaaaaaaaaaaaaaaaaaaaaaaaaaaaaaaaaaaaaaaaaaaaaaaaaaaaaaaaaaaaaaaaaaaaaaaaaaaaaaaaaaaaaaaaaaaaaaaaaaaaaaaaaaaaaaaaaaaaaaaaaaaaaaaaaaaaaaaaaaaaaaaaaaaaaaaaaaaaaaaaaaaaaaaaaaaaaaaaaaaaaaaaaaaaaaaaaaaaaaaaaaaaaaaaaaaaaaaaaaaaaaaaaaaaaaaaaaaaaaaaaaaaaaaaaaaaaaaaaaaaaaaaaaaaaaaaaaaaaaaaaaaaaaaaaaaaaaaaaaaaaaaaaaaaaaaaaaaaaaaaaaaaaaaaaaaaaaaaaaaaaaaaaaaaaaaaaaaaaaaaaaaaaaaaaaaaaaaaaaaaaaaaaaaaaaaaaaaaaaaaaaaaaaaaaaaaaaaaaaaaaaaaaaaaaaaaaaaaaaaaaaaaaaaaaaaaaaaaaaaaaaaaaaaaaaaaaaaaaaaaaaaaaaaaaaaaaaaaaaaaaaaaaaaaaaaaaaaaaaaaaaaaaaaaaaaaaaaaaaaaaaaaaaaaaaaaaaaaaaaaaaaaaaaaaaaaaaaaaaaaaaaaaaaaaaaaaaaaaaaaaaaaaaaaaaaaaaaaaaaaaaaaaaaaaaaaaaaaaaaaaaaaaaaaaaaaaaaaaaaaaaaaaaaaaaaaaaaaaaaaaaaaaaaaaaaaaaaaaaaaaaaaaaaaaaaaaaaaaaaaaaaaaaaaaaaaaaaaaaaaaaaaaaaaaaaaaaaaaaaaaaaaaaaaaaaaaaaaaaaaaaaaaaaaaaaaaaaaaaaaaaaaaaaaaaaaaaaaaaaaaaaaaaaaaaaaaaaaaaaaaaaaaaaaaaaaaaaaaaaaaaaaaaaaaaaaaaaaaaaaaaaaaaaaaaaaaaaaaaaaaaaaaaaaaaaaaaaaaaaaaaaaaaaaaaaaaaaaaaaaaaaaaaaaaaaaaaaaaaaaaaaaaaaaaaaaaaaaaaaaaaaaaaaaaaaaaaaaaaaaaaaaaaaaaaaaaaaaaaaaaaaaaaaaaaaaaaaaaaaaaaaaaaaaaaaaaaaaaaaaaaaaaaaaaaaaaaaaaaaaaaaaaaaaaaaaaaaaaaaaaaaaaaaaaaaaaaaaaaaaaaaaaaaaaaaaaaaaaaaaaaaaaaaaaaaaaaaaaaaaaaaaaaaaaaaaaaaaaaaaaaaaaaaaaaaaaaaaaaaaaaaaaaaaaaaaaaaaaaaaaaaaaaaaaaaaaaaaaaaaaaaaaaaaaaaaaaaaaaaaaaaaaaaaaaaaaaaaaaaaaaaaaaaaaaaaaaaaaaaaaaaaaaaaaaaaaaaaaaaaaaaaaaaaaaaaaaaaaaaaaaaaaaaaaaaaaaaaaaaaaaaaaaaaaaaaaaaaaaaaaaaaaaaaaaaaaaaaaaaaaaaaaaaaaaaaaaaaaaaaaaaaaaaaaaaaaaaaaaaaaaaaaaaaaaaaaaaaaaaaaaaaaaaaaaaaaaaaaaaaaaaaaaaaaaaaaaaaaaaaaaaaaaaaaaaaaaaaaaaaaaaaaaaaaaaaaaaaaaaaaaaaaaaaaaaaaaaaaaaaaaaaaaaaaaaaaaaaaaaaaaaaaaaaaaaaaaaaaaaaaaaaaaaaaaaaaaaaaaaaaaaaaaaaaaaaaaaaaaaaaaaaaaaaaaaaaaaaaaaaaaaaaaaaaaaaaaaaaaaaaaaaaaaaaaaaaaaaaaaaaaaaaaaaaaaaaaaaaaaaaaaaaaaaaaaaaaaaaaaaaaaaaaaaaaaaaaaaaaaaaaaaaaaaaaaaaaaaaaaaaaaaaaaaaaaaaaaaaaaaaaaaaaaaaaaaaaaaaaaaaaaaaaaaaaaaaaaaaaaaaaaaaaaaaaaaaaaaaaaaaaaaaaaaaaaaaaaaaaaaaaaaaaaaaaaaaaaaaaaaaaaaaaaaaaaaaaaaaaaaaaaaaaaaaaaaaaaaaaaaaaaaaaaaaaaaaaaaaaaaaaaaaaaaaaaaaaaaaaaaaaaaaaaaaaaaaaaaaaaaaaaaaaaaaaaaaaaaaaaaaaaaaaaaaaaaaaaaaaaaaaaaaaaaaaaaaaaaaaaaaaaaaaaaaaaaaaaaaaaaaaaaaaaaaaaaaaaaaaaaaaaaaaaaaaaaaaaaaaaaaaaaaaaaaaaaaaaaaaaaaaaaaaaaaaaaaaaaaaaaaaaaaaaaaaaaaaaaaaaaaaaaaaaaaaaaaaaaaaaaaaaaaaaaaaaaaaaaaaaaaaaaaaaaaaaaaaaaaaaaaaaaaaaaaaaaaaaaaaaaaaaaaaaaaaaaaaaaaaaaaaaaaaaaaaaaaaaaaaaaaaaaaaaaaaaaaaaaaaaaaaaaaaaaaaaaaaaaaaaaaaaaaaaaaaaaaaaaaaaaaaaaaaaaaaaaaaaaaaaaaaaaaaaaaaaaaaaaaaaaaaaaaaaaaaaaaaaaaaaaaaaaaaaaaaaaaaaaaaaaaaaaaaaaaaaaaaaaaaaaaaaaaaaaaaaaaaaaaaaaaaaaaaaaaaaaaaaaaaaaaaaaaaaaaaaaaaaaaaaaaaaaaaaaaaaaaaaaaaaaaaaaaaaaaaaaaaaaaaaaaaaaaaaaaaaaaaaaaaaaaaaaaaaaaaaaaaaaaaaaaaaaaaaaaaaaaaaaaaaaaaaaaaaaaaaaaaaaaaaaaaaaaaaaaaaaaaaaaaaaaaaaaaaaaaaaaaaaaaaaaaaaaaaaaaaaaaaaaaaaaaaaaaaaaaaaaaaaaaaaaaaaaaaaaaaaaaaaaaaaaaaaaaaaaaaaaaaaaaaaaaaaaaaaaaaaaaaaaaaaaaaaaaaaaaaaaaaaaaaaaaaaaaaaaaaaaaaaaaaaaaaaaaaaaaaaaaaaaaaaaaaaaaaaaaaaaaaaaaaaaaaaaaaaaaaaaaaaaaaaaaaaaaaaaaaaaaaaaaaaaaaaaaaaaaaaaaaaaaaaaaaaaaaaaaaaaaaaaaaaaaaaaaaaaaaaaaaaaaaaaaaaaaaaaaaaaaaaaaaaaaaaaaaaaaaaaaaaaaaaaaaaaaaaaaaaaaaaaaaaaaaaaaaaaaaaaaaaaaaaaaaaaaaaaaaaaaaaaaaaaaaaaaaaaaaaaaaaaaaaaaaaaaaaaaaaaaaaaaaaaaaaaaaaaaaaaaaaaaaaaaaaaaaaaaaaaaaaaaaaaaaaaaaaaaaaaaaaaaaaaaaaaaaaaaaaaaaaaaaaaaaaaaaaaaaaaaaaaaaaaaaaaaaaaaaaaaaaaaaaaaaaaaaaaaaaaaaaaaaaaaaaaaaaaaaaaaaaaaaaaaaaaaaaaaaaaaaaaaaaaaaaaaaaaaaaaaaaaaaaaaaaaaaaaaaaaaaaaaaaaaaaaaaaaaaaaaaaaaaaaaaaaaaaaaaaaaaaaaaaaaaaaaaaaaaaaaaaaaaaaaaaaaaaaaaaaaaaaaaaaaaaaaaaaaaaaaaaaaaaaaaaaaaaaaaaaaaaaaaaaaaaaaaaaaaaaaaaaaaaaaaaaaaaaaaaaaaaaaaaaaaaaaaaaaaaaaaaaaaaaaaaaaaaaaaaaaaaaaaaaaaaaaaaaaaaaaaaaaaaaaaaaaaaaaaaaaaaaaaaaaaaaaaaaaaaaaaaaaaaaaaaaaaaaaaaaaaaaaaaaaaaaaaaaaaaaaaaaaaaaaaaaaaaaaaaaaaaaaaaaaaaaaaaaaaaaaaaaaaaaaaaaaaaaaaaaaaaaaaaaaaaaaaaaaaaaaaaaaaaaaaaaaaaaaaaaaaaaaaaaaaaaaaaaaaaaaaaaaaaaaaaaaaaaaaaaaaaaaaaaaaaaaaaaaaaaaaaaaaaaaaaaaaaaaaaaaaaaaaaaaaaaaaaaaaaaaaaaaaaaaaaaaaaaaaaaaaaaaaaaaaaaaaaaaaaaaaaaaaaaaaaaaaaaaaaaaaaaaaaaaaaaaaaaaaaaaaaaaaaaaaaaaaaaaaaaaaaaaaaaaaaaaaaaaaaaaaaaaaaaaaaaaaaaaaaaaaaaaaaaaaaaaaaaaaaaaaaaaaaaaaaaaaaaaaaaaaaaaaaaaaaaaaaaaaaaaaaaaaaaaaaaaaaaaaaaaaaaaaaaaaaaaaaaaaaaaaaaaaaaaaaaaaaaaaaaaaaaaaaaaaaaaaaaaaaaaaaaaaaaaaaaaaaaaaaaaaaaaaaaaaaaaaaaaaaaaaaaaaaaaaaaaaaaaaaaaaaaaaaaaaaaaaaaaaaaaaaaaaaaaaaaaaaaaaaaaaaaaaaaaaaaaaaaaaaaaaaaaaaaaaaaaaaaaaaaaaaaaaaaaaaaaaaaaaaaaaaaaaaaaaaaaaaaaaaaaaaaaaaaaaaaaaaaaaaaaaaaaaaaaaaaaaaaaaaaaaaaaaaaaaaaaaaaaaaaaaaaaaaaaaaaaaaaaaaaaaaaaaaaaaaaaaaaaaaaaaaaaaaaaaaaaaaaaaaaaaaaaaaaaaaaaaaaaaaaaaaaaaaaaaaaaaaaaaaaaaaaaaaaaaaaaaaaaaaaaaaaaaaaaaaaaaaaaaaaaaaaaaaaaaaaaaaaaaaaaaaaaaaaaaaaaaaaaaaaaaaaaaaaaaaaaaaaaaaaaaaaaaaaaaaaaaaaaaaaaaaaaaaaaaaaaaaaaaaaaaaaaaaaaaaaaaaaaaaaaaaaaaaaaaaaaaaaaaaaaaaaaaaaaaaaaaaaaaaaaaaaaaaaaaaaaaaaaaaaaaaaaaaaaaaaaaaaaaaaaaaaaaaaaaaaaaaaaaaaaaaaaaaaaaaaaaaaaaaaaaaaaaaaaaaaaaaaaaaaaaaaaaaaaaaaaaaaaaaaaaaaaaaaaaaaaaaaaaaaaaaaaaaaaaaaaaaaaaaaaaaaaaaaaaaaaaaaaaaaaaaaaaaaaaaaaaaaaaaaaaaaaaaaaaaaaaaaaaaaaaaaaaaaaaaaaaaaaaaaaaaaaaaaaaaaaaaaaaaaaaaaaaaaaaaaaaaaaaaaaaaaaaaaaaaaaaaaaaaaaaaaaaaaaaaaaaaaaaaaaaaaaaaaaaaaaaaaaaaaaaaaaaaaaaaaaaaaaaaaaaaaaaaaaaaaaaaaaaaaaaaaaaaaaaaaaaaaaaaaaaaaaaaaaaaaaaaaaaaaaaaaaaaaaaaaaaaaaaaaaaaaaaaaaaaaaaaaaaaaaaaaaaaaaaaaaaaaaaaaaaaaaaaaaaaaaaaaaaaaaaaaaaaaaaaaaaaaaaaaaaaaaaaaaaaaaaaaaaaaaaaaaaaaaaaaaaaaaaaaaaaaaaaaaaaaaaaaaaaaaaaaaaaaaaaaaaaaaaaaaaaaaaaaaaaaaaaaaaaaaaaaaaaaaaaaaaaaaaaaaaaaaaaaaaaaaaaaaaaaaaaaaaaaaaaaaaaaaaaaaaaaaaaaaaaaaaaaaaaaaaaaaaaaaaaaaaaaaaaaaaaaaaaaaaaaaaaaaaaaaaaaaaaaaaaaaaaaaaaaaaaaaaaaaaaaaaaaaaaaaaaaaaaaaaaaaaaaaaaaaaaaaaaaaaaaaaaaaaaaaaaaaaaaaaaaaaaaaaaaaaaaaaaaaaaaaaaaaaaaaaaaaaaaaaaaaaaaaaaaaaaaaaaaaaaaaaaaaaaaaaaaaaaaaaaaaaaaaaaaaaaaaaaaaaaaaaaaaaaaaaaaaaaaaaaaaaaaaaaaaaaaaaaaaaaaaaaaaaaaaaaaaaaaaaaaaaaaaaaaaaaaaaaaaaaaaaaaaaaaaaaaaaaaaaaaaaaaaaaaaaaaaaaaaaaaaaaaaaaaaaaaaaaaaaaaaaaaaaaaaaaaaaaaaaaaaaaaaaaaaaaaaaaaaaaaaaaaaaaaaaaaaaaaaaaaaaaaaaaaaaaaaaaaaaaaaaaaaaaaaaaaaaaaaaaaaaaaaaaaaaaaaaaaaaaaaaaaaaaaaaaaaaaaaaaaaaaaaaaaaaaaaaaaaaaaaaaaaaaaaaaaaaaaaaaaaaaaaaaaaaaaaaaaaaaaaaaaaaaaaaaaaaaaaaaaaaaaaaaaaaaaaaaaaaaaaaaaaaaaaaaaaaaaaaaaaaaaaaaaaaaaaaaaaaaaaaaaaaaaaaaaaaaaaaaaaaaaaaaaaaaaaaaaaaaaaaaaaaaaaaaaaaaaaaaaaaaaaaaaaaaaaaaaaaaaaaaaaaaaaaaaaaaaaaaaaaaaaaaaaaaaaaaaaaaaaaaaaaaaaaaaaaaaaaaaaaaaaaaaaaaaaaaaaaaaaaaaaaaaaaaaaaaaaaaaaaaaaaaaaaaaaaaaaaaaaaaaaaaaaaaaaaaaaaaaaaaaaaaaaaaaaaaaaaaaaaaaaaaaaaaaaaaaaaaaaaaaaaaaaaaaaaaaaaaaaaaaaaaaaaaaaaaaaaaaaaaaaaaaaaaaaaaaaaaaaaaaaaaaaaaaaaaaaaaaaaaaaaaaaaaaaaaaaaaaaaaaaaaaaaaaaaaaaaaaaaaaaaaaaaaaaaaaaaaaaaaaaaaaaaaaaaaaaaaaaaaaaaaaaaaaaaaaaaaaaaaaaaaaaaaaaaaaaaaaaaaaaaaaaaaaaaaaaaaaaaaaaaaaaaaaaaaaaaaaaaaaaaaaaaaaaaaaaaaaaaaaaaaaaaaaaaaaaaaaaaaaaaaaaaaaaaaaaaaaaaaaaaaaaaaaaaaaaaaaaaaaaaaaaaaaaaaaaaaaaaaaaaaaaaaaaaaaaaaaaaaaaaaaaaaaaaaaaaaaaaaaaaaaaaaaaaaaaaaaaaaaaaaaaaaaaaaaaaaaaaaaaaaaaaaaaaaaaaaaaaaaaaaaaaaaaaaaaaaaaaaaaaaaaaaaaaaaaaaaaaaaaaaaaaaaaaaaaaaaaaaaaaaaaaaaaaaaaaaaaaaaaaaaaaaaaaaaaaaaaaaaaaaaaaaaaaaaaaaaaaaaaaaaaaaaaaaaaaaaaaaaaaaaaaaaaaaaaaaaaaaaaaaaaaaaaaaaaaaaaaaaaaaaaaaaaaaaaaaaaaaaaaaaaaaaaaaaaaaaaaaaaaaaaaaaaaaaaaaaaaaaaaaaaaaaaaaaaaaaaaaaaaaaaaaaaaaaaaaaaaaaaaaaaaaaaaaaaaaaaaaaaaaaaaaaaaaaaaaaaaaaaaaaaaaaaaaaaaaaaaaaaaaaaaaaaaaaaaaaaaaaaaaaaaaaaaaaaaaaaaaaaaaaaaaaaaaaaaaaaaaaaaaaaaaaaaaaaaaaaaaaaaaaaaaaaaaaaaaaaaaaaaaaaaaaaaaaaaaaaaaaaaaaaaaaaaaaaaaaaaaaaaaaaaaaaaaaaaaaaaaaaaaaaaaaaaaaaaaaaaaaaaaaaaaaaaaaaaaaaaaaaaaaaaaaaaaaaaaaaaaaaaaaaaaaaaaaaaaaaaaaaaaaaaaaaaaaaaaaaaaaaaaaaaaaaaaaaaaaaaaaaaaaaaaaaaaaaaaaaaaaaaaaaaaaaaaaaaaaaaaaaaaaaaaaaaaaaaaaaaaaaaaaaaaaaaaaaaaaaaaaaaaaaaaaaaaaaaaaaaaaaaaaaaaaaaaaaaaaaaaaaaaaaaaaaaaaaaaaaaaaaaaaaaaaaaaaaaaaaaaaaaaaaaaaaaaaaaaaaaaaaaaaaaaaaaaaaaaaaaaaaaaaaaaaaaaaaaaaaaaaaaaaaaaaaaaaaaaaaaaaaaaaaaaaaaaaaaaaaaaaaaaaaaaaaaaaaaaaaaaaaaaaaaaaaaaaaaaaaaaaaaaaaaaaaaaaaaaaaaaaaaaaaaaaaaaaaaaaaaaaaaaaaaaaaaaaaaaaaaaaaaaaaaaaaaaaaaaaaaaaaaaaaaaaaaaaaaaaaaaaaaaaaaaaaaaaaaaaaaaaaaaaaaaaaaaaaaaaaaaaaaaaaaaaaaaaaaaaaaaaaaaaaaaaaaaaaaaaaaaaaaaaaaaaaaaaaaaaaaaaaaaaaaaaaaaaaaaaaaaaaaaaaaaaaaaaaaaaaaaaaaaaaaaaaaaaaaaaaaaaaaaaaaaaaaaaaaaaaaaaaaaaaaaaaaaaaaaaaaaaaaaaaaaaaaaaaaaaaaaaaaaaaaaaaaaaaaaaaaaaaaaaaaaaaaaaaaaaaaaaaaaaaaaaaaaaaaaaaaaaaaaaaaaaaaaaaaaaaaaaaaaaaaaaaaaaaaaaaaaaaaaaaaaaaaaaaaaaaaaaaaaaaaaaaaaaaaaaaaaaaaaaaaaaaaaaaaaaaaaaaaaaaaaaaaaaaaaaaaaaaaaaaaaaaaaaaaaaaaaaaaaaaaaaaaaaaaaaaaaaaaaaaaaaaaaaaaaaaaaaaaaaaaaaaaaaaaaaaaaaaaaaaaaaaaaaaaaaaaaaaaaaaaaaaaaaaaaaaaaaaaaaaaaaaaaaaaaaaaaaaaaaaaaaaaaaaaaaaaaaaaaaaaaaaaaaaaaaaaaaaaaaaaaaaaaaaaaaaaaaaaaaaaaaaaaaaaaaaaaaaaaaaaaaaaaaaaaaaaaaaaaaaaaaaaaaaaaaaaaaaaaaaaaaaaaaaaaaaaaaaaaaaaaaaaaaaaaaaaaaaaaaaaaaaaaaaaaaaaaaaaaaaaaaaaaaaaaaaaaaaaaaaaaaaaaaaaaaaaaaaaaaaaaaaaaaaaaaaaaaaaaaaaaaaaaaaaaaaaaaaaaaaaaaaaaaaaaaaaaaaaaaaaaaaaaaaaaaaaaaaaaaaaaaaaaaaaaaaaaaaaaaaaaaaaaaaaaaaaaaaaaaaaaaaaaaaaaaaaaaaaaaaaaaaaaaaaaaaaaaaaaaaaaaaaaaaaaaaaaaaaaaaaaaaaaaaaaaaaaaaaaaaaaaaaaaaaaaaaaaaaaaaaaaaaaaaaaaaaaaaaaaaaaaaaaaaaaaaaaaaaaaaaaaaaaaaaaaaaaaaaaaaaaaaaaaaaaaaaaaaaaaaaaaaaaaaaaaaaaaaaaaaaaaaaaaaaaaaaaaaaaaaaaaaaaaaaaaaaaaaaaaaaaaaaaaaaaaaaaaaaaaaaaaaaaaaaaaaaaaaaaaaaaaaaaaaaaaaaaaaaaaaaaaaaaaaaaaaaaaaaaaaaaaaaaaaaaaaaaaaaaaaaaaaaaaaaaaaaaaaaaaaaaaaaaaaaaaaaaaaaaaaaaaaaaaaaaaaaaaaaaaaaaaaaaaaaaaaaaaaaaaaaaaaaaaaaaaaaaaaaaaaaaaaaaaaaaaaaaaaaaaaaaaaaaaaaaaaaaaaaaaaaaaaaaaaaaaaaaaaaaaaaaaaaaaaaaaaaaaaaaaaaaaaaaaaaaaaaaaaaaaaaaaaaaaaaaaaaaaaaaaaaaaaaaaaaaaaaaaaaaaaaaaaaaaaaaaaaaaaaaaaaaaaaaaaaaaaaaaaaaaaaaaaaaaaaaaaaaaaaaaaaaaaaaaaaaaaaaaaaaaaaaaaaaaaaaaaaaaaaaaaaaaaaaaaaaaaaaaaaaaaaaaaaaaaaaaaaaaaaaaaaaaaaaaaaaaaaaaaaaaaaaaaaaaaaaaaaaaaaaaaaaaaaaaaaaaaaaaaaaaaaaaaaaaaaaaaaaaaaaaaaaaaaaaaaaaaaaaaaaaaaaaaaaaaaaaaaaaaaaaaaaaaaaaaaaaaaaaaaaaaaaaaaaaaaaaaaaaaaaaaaaaaaaaaaaaaaaaaaaaaaaaaaaaaaaaaaaaaaaaaaaaaaaaaaaaaaaaaaaaaaaaaaaaaaaaaaaaaaaaaaaaaaaaaaaaaaaaaaaaaaaaaaaaaaaaaaaaaaaaaaaaaaaaaaaaaaaaaaaaaaaaaaaaaaaaaaaaaaaaaaaaaaaaaaaaaaaaaaaaaaaaaaaaaaaaaaaaaaaaaaaaaaaaaaaaaaaaaaaaaaaaaaaaaaaaaaaaaaaaaaaaaaaaaaaaaaaaaaaaaaaaaaaaaaaaaaaaaaaaaaaaaaaaaaaaaaaaaaaaaaaaaaaaaaaaaaaaaaaaaaaaaaaaaaaaaaaaaaaaaaaaaaaaaaaaaaaaaaaaaaaaaaaaaaaaaaaaaaaaaaaaaaaaaaaaaaaaaaaaaaaaaaaaaaaaaaaaaaaaaaaaaaaaaaaaaaaaaaaaaaaaaaaaaaaaaaaaaaaaaaaaaaaaaaaaaaaaaaaaaaaaaaaaaaaaaaaaaaaaaaaaaaaaaaaaaaaaaaaaaaaaaaaaaaaaaaaaaaaaaaaaaaaaaaaaaaaaaaaaaaaaaaaaaaaaaaaaaaaaaaaaaaaaaaaaaaaaaaaaaaaaaaaaaaaaaaaaaaaaaaaaaaaaaaaaaaaaaaaaaaaaaaaaaaaaaaaaaaaaaaaaaaaaaaaaaaaaaaaaaaaaaaaaaaaaaaaaaaaaaaaaaaaaaaaaaaaaaaaaaaaaaaaaaaaaaaaaaaaaaaaaaaaaaaaaaaaaaaaaaaaaaaaaaaaaaaaaaaaaaaaaaaaaaaaaaaaaaaaaaaaaaaaaaaaaaaaaaaaaaaaaaaaaaaaaaaaaaaaaaaaaaaaaaaaaaaaaaaaaaaaaaaaaaaaaaaaaaaaaaaaaaaaaaaaaaaaaaaaaaaaaaaaaaaaaaaaaaaaaaaaaaaaaaaaaaaaaaaaaaaaaaaaaaaaaaaaaaaaaaaaaaaaaaaaaaaaaaaaaaaaaaaaaaaaaaaaaaaaaaaaaaaaaaaaaaaaaaaaaaaaaaaaaaaaaaaaaaaaaaaaaaaaaaaaaaaaaaaaaaaaaaaaaaaaaaaaaaaaaaaaaaaaaaaaaaaaaaaaaaaaaaaaaaaaaaaaaaaaaaaaaaaaaaaaaaaaaaaaaaaaaaaaaaaaaaaaaaaaaaaaaaaaaaaaaaaaaaaaaaaaaaaaaaaaaaaaaaaaaaaaaaaaaaaaaaaaaaaaaaaaaaaaaaaaaaaaaaaaaaaaaaaaaaaaaaaaaaaaaaaaaaaaaaaaaaaaaaaaaaaaaaaaaaaaaaaaaaaaaaaaaaaaaaaaaaaaaaaaaaaaaaaaaaaaaaaaaaaaaaaaaaaaaaaaaaaaaaaaaaaaaaaaaaaaaaaaaaaaaaaaaaaaaaaaaaaaaaaaaaaaaaaaaaaaaaaaaaaaaaaaaaaaaaaaaaaaaaaaaaaaaaaaaaaaaaaaaaaaaaaaaaaaaaaaaaaaaaaaaaaaaaaaaaaaaaaaaaaaaaaaaaaaaaaaaaaaaaaaaaaaaaaaaaaaaaaaaaaaaaaaaaaaaaaaaaaaaaaaaaaaaaaaaaaaaaaaaaaaaaaaaaaaaaaaaaaaaaaaaaaaaaaaaaaaaaaaaaaaaaaaaaaaaaaaaaaaaaaaaaaaaaaaaaaaaaaaaaaaaaaaaaaaaaaaaaaaaaaaaaaaaaaaaaaaaaaaaaaaaaaaaaaaaaaaaaaaaaaaaaaaaaaaaaaaaaaaaaaaaaaaaaaaaaaaaaaaaaaaaaaaaaaaaaaaaaaaaaaaaaaaaaaaaaaaaaaaaaaaaaaaaaaaaaaaaaaaaaaaaaaaaaaaaaaaaaaaaaaaaaaaaaaaaaaaaaaaaaaaaaaaaaaaaaaaaaaaaaaaaaaaaaaaaaaaaaaaaaaaaaaaaaaaaaaaaaaaaaaaaaaaaaaaaaaaaaaaaaaaaaaaaaaaaaaaaaaaaaaaaaaaaaaaaaaaaaaaaaaaaaaaaaaaaaaaaaaaaaaaaaaaaaaaaaaaaaaaaaaaaaaaaaaaaaaaaaaaaaaaaaaaaaaaaaaaaaaaaaaaaaaaaaaaaaaaaaaaaaaaaaaaaaaaaaaaaaaaaaaaaaaaaaaaaaaaaaaaaaaaaaaaaaaaaaaaaaaaaaaaaaaaaaaaaaaaaaaaaaaaaaaaaaaaaaaaaaaaaaaaaaaaaaaaaaaaaaaaaaaaaaaaaaaaaaaaaaaaaaaaaaaaaaaaaaaaaaaaaaaaaaaaaaaaaaaaaaaaaaaaaaaaaaaaaaaaaaaaaaaaaaaaaaaaaaaaaaaaaaaaaaaaaaaaaaaaaaaaaaaaaaaaaaaaaaaaaaaaaaaaaaaaaaaaaaaaaaaaaaaaaaaaaaaaaaaaaaaaaaaaaaaaaaaaaaaaaaaaaaaaaaaaaaaaaaaaaaaaaaaaaaaaaaaaaaaaaaaaaaaaaaaaaaaaaaaaaaaaaaaaaaaaaaaaaaaaaaaaaaaaaaaaaaaaaaaaaaaaaaaaaaaaaaaaaaaaaaaaaaaaaaaaaaaaaaaaaaaaaaaaaaaaaaaaaaaaaaaaaaaaaaaaaaaaaaaaaaaaaaaaaaaaaaaaaaaaaaaaaaaaaaaaaaaaaaaaaaaaaaaaaaaaaaaaaaaaaaaaaaaaaaaaaaaaaaaaaaaaaaaaaaaaaaaaaaaaaaaaaaaaaaaaaaaaaaaaaaaaaaaaaaaaaaaaaaaaaaaaaaaaaaaaaaaaaaaaaaaaaaaaaaaaaaaaaaaaaaaaaaaaaaaaaaaaaaaaaaaaaaaaaaaaaaaaaaaaaaaaaaaaaaaaaaaaaaaaaaaaaaaaaaaaaaaaaaaaaaaaaaaaaaaaaaaaaaaaaaaaaaaaaaaaaaaaaaaaaaaaaaaaaaaaaaaaaaaaaaaaaaaaaaaaaaaaaaaaaaaaaaaaaaaaaaaaaaaaaaaaaaaaaaaaaaaaaaaaaaaaaaaaaaaaaaaaaaaaaaaaaaaaaaaaaaaaaaaaaaaaaaaaaaaaaaaaaaaaaaaaaaaaaaaaaaaaaaaaaaaaaaaaaaaaaaaaaaaaaaaaaaaaaaaaaaaaaaaaaaaaaaaaaaaaaaaaaaaaaaaaaaaaaaaaaaaaaaaaaaaaaaaaaaaaaaaaaaaaaaaaaaaaaaaaaaaaaaaaaaaaaaaaaaaaaaaaaaaaaaaaaaaaaaaaaaaaaaaaaaaaaaaaaaaaaaaaaaaaaaaaaaaaaaaaaaaaaaaaaaaaaaaaaaaaaaaaaaaaaaaaaaaaaaaaaaaaaaaaaaaaaaaaaaaaaaaaaaaaaaaaaaaaaaaaaaaaaaaaaaaaaaaaaaaaaaaaaaaaaaaaaaaaaaaaaaaaaaaaaaaaaaaaaaaaaaaaaaaaaaaaaaaaaaaaaaaaaaaaaaaaaaaaaaaaaaaaaaaaaaaaaaaaaaaaaaaaaaaaaaaaaaaaaaaaaaaaaaaaaaaaaaaaaaaaaaaaaaaaaaaaaaaaaaaaaaaaaaaaaaaaaaaaaaaaaaaaaaaaaaaaaaaaaaaaaaaaaaaaaaaaaaaaaaaaaaaaaaaaaaaaaaaaaaaaaaaaaaaaaaaaaaaaaaaaaaaaaaaaaaaaaaaaaaaaaaaaaaaaaaaaaaaaaaaaaaaaaaaaaaaaaaaaaaaaaaaaaaaaaaaaaaaaaaaaaaaaaaaaaaaaaaaaaaaaaaaaaaaaaaaaaaaaaaaaaaaaaaaaaaaaaaaaaaaaaaaaaaaaaaaaaaaaaaaaaaaaaaaaaaaaaaaaaaaaaaaaaaaaaaaaaaaaaaaaaaaaaaaaaaaaaaaaaaaaaaaaaaaaaaaaaaaaaaaaaaaaaaaaaaaaaaaaaaaaaaaaaaaaaaaaaaaaaaaaaaaaaaaaaaaaaaaaaaaaaaaaaaaaaaaaaaaaaaaaaaaaaaaaaaaaaaaaaaaaaaaaaaaaaaaaaaaaaaaaaaaaaaaaaaaaaaaaaaaaaaaaaaaaaaaaaaaaaaaaaaaaaaaaaaaaaaaaaaaaaaaaaaaaaaaaaaaaaaaaaaaaaaaaaaaaaaaaaaaaaaaaaaaaaaaaaaaaaaaaaaaaaaaaaaaaaaaaaaaaaaaaaaaaaaaaaaaaaaaaaaaaaaaaaaaaaaaaaaaaaaaaaaaaaaaaaaaaaaaaaaaaaaaaaaaaaaaaaaaaaaaaaaaaaaaaaaaaaaaaaaaaaaaaaaaaaaaaaaaaaaaaaaaaaaaaaaaaaaaaaaaaaaaaaaaaaaaaaaaaaaaaaaaaaaaaaaaaaaaaaaaaaaaaaaaaaaaaaaaaaaaaaaaaaaaaaaaaaaaaaaaaaaaaaaaaaaaaaaaaaaaaaaaaaaaaaaaaaaaaaaaaaaaaaaaaaaaaaaaaaaaaaaaaaaaaaaaaaaaaaaaaaaaaaaaaaaaaaaaaaaaaaaaaaaaaaaaaaaaaaaaaaaaaaaaaaaaaaaaaaaaaaaaaaaaaaaaaaaaaaaaaaaaaaaaaaaaaaaaaaaaaaaaaaaaaaaaaaaaaaaaaaaaaaaaaaaaaaaaaaaaaaaaaaaaaaaaaaaaaaaaaaaaaaaaaaaaaaaaaaaaaaaaaaaaaaaaaaaaaaaaaaaaaaaaaaaaaaaaaaaaaaaaaaaaaaaaaaaaaaaaaaaaaaaaaaaaaaaaaaaaaaaaaaaaaaaaaaaaaaaaaaaaaaaaaaaaaaaaaaaaaaaaaaaaaaaaaaaaaaaaaaaaaaaaaaaaaaaaaaaaaaaaaaaaaaaaaaaaaaaaaaaaaaaaaaaaaaaaaaaaaaaaaaaaaaaaaaaaaaaaaaaaaaaaaaaaaaaaaaaaaaaaaaaaaaaaaaaaaaaaaaaaaaaaaaaaaaaaaaaaaaaaaaaaaaaaaaaaaaaaaaaaaaaaaaaaaaaaaaaaaaaaaaaaaaaaaaaaaaaaaaaaaaaaaaaaaaaaaaaaaaaaaaaaaaaaaaaaaaaaaaaaaaaaaaaaaaaaaaaaaaaaaaaaaaaaaaaaaaaaaaaaaaaaaaaaaaaaaaaaaaaaaaaaaaaaaaaaaaaaaaaaaaaaaaaaaaaaaaaaaaaaaaaaaaaaaaaaaaaaaaaaaaaaaaaaaaaaaaaaaaaaaaaaaaaaaaaaaaaaaaaaaaaaaaaaaaaaaaaaaaaaaaaaaaaaaaaaaaaaaaaaaaaaaaaaaaaaaaaaaaaaaaaaaaaaaaaaaaaaaaaaaaaaaaaaaaaaaaaaaaaaaaaaaaaaaaaaaaaaaaaaaaaaaaaaaaaaaaaaaaaaaaaaaaaaaaaaaaaaaaaaaaaaaaaaaaaaaaaaaaaaaaaaaaaaaaaaaaaaaaaaaaaaaaaaaaaaaaaaaaaaaaaaaaaaaaaaaaaaaaaaaaaaaaaaaaaaaaaaaaaaaaaaaaaaaaaaaaaaaaaaaaaaaaaaaaaaaaaaaaaaaaaaaaaaaaaaaaaaaaaaaaaaaaaaaaaaaaaaaaaaaaaaaaaaaaaaaaaaaaaaaaaaaaaaaaaaaaaaaaaaaaaaaaaaaaaaaaaaaaaaaaaaaaaaaaaaaaaaaaaaaaaaaaaaaaaaaaaaaaaaaaaaaaaaaaaaaaaaaaaaaaaaaaaaaaaaaaaaaaaaaaaaaaaaaaaaaaaaaaaaaaaaaaaaaaaaaaaaaaaaaaaaaaaaaaaaaaaaaaaaaaaaaaaaaaaaaaaaaaaaaaaaaaaaaaaaaaaaaaaaaaaaaaaaaaaaaaaaaaaaaaaaaaaaaaaaaaaaaaaaaaaaaaaaaaaaaaaaaaaaaaaaaaaaaaaaaaaaaaaaaaaaaaaaaaaaaaaaaaaaaaaaaaaaaaaaaaaaaaaaaaaaaaaaaaaaaaaaaaaaaaaaaaaaaaaaaaaaaaaaaaaaaaaaaaaaaaaaaaaaaaaaaaaaaaaaaaaaaaaaaaaaaaaaaaaaaaaaaaaaaaaaaaaaaaaaaaaaaaaaaaaaaaaaaaaaaaaaaaaaaaaaaaaaaaaaaaaaaaaaaaaaaaaaaaaaaaaaaaaaaaaaaaaaaaaaaaaaaaaaaaaaaaaaaaaaaaaaaaaaaaaaaaaaaaaaaaaaaaaaaaaaaaaaaaaaaaaaaaaaaaaaaaaaaaaaaaaaaaaaaaaaaaaaaaaaaaaaaaaaaaaaaaaaaaaaaaaaaaaaaaaaaaaaaaaaaaaaaaaaaaaaaaaaaaaaaaaaaaaaaaaaaaaaaaaaaaaaaaaaaaaaaaaaaaaaaaaaaaaaaaaaaaaaaaaaaaaaaaaaaaaaaaaaaaaaaaaaaaaaaaaaaaaaaaaaaaaaaaaaaaaaaaaaaaaaaaaaaaaaaaaaaaaaaaaaaaaaaaaaaaaaaaaaaaaaaaaaaaaaaaaaaaaaaaaaaaaaaaaaaaaaaaaaaaaaaaaaaaaaaaaaaaaaaaaaaaaaaaaaaaaaaaaaaaaaaaaaaaaaaaaaaaaaaaaaaaaaaaaaaaaaaaaaaaaaaaaaaaaaaaaaaaaaaaaaaaaaaaaaaaaaaaaaaaaaaaaaaaaaaaaaaaaaaaaaaaaaaaaaaaaaaaaaaaaaaaaaaaaaaaaaaaaaaaaaaaaaaaaaaaaaaaaaaaaaaaaaaaaaaaaaaaaaaaaaaaaaaaaaaaaaaaaaaaaaaaaaaaaaaaaaaaaaaaaaaaaaaaaaaaaaaaaaaaaaaaaaaaaaaaaaaaaaaaaaaaaaaaaaaaaaaaaaaaaaaaaaaaaaaaaaaaaaaaaaaaaaaaaaaaaaaaaaaaaaaaaaaaaaaaaaaaaaaaaaaaaaaaaaaaaaaaaaaaaaaaaaaaaaaaaaaaaaaaaaaaaaaaaaaaaaaaaaaaaaaaaaaaaaaaaaaaaaaaaaaaaaaaaaaaaaaaaaaaaaaaaaaaaaaaaaaaaaaaaaaaaaaaaaaaaaaaaaaaaaaaaaaaaaaaaaaaaaaaaaaaaaaaaaaaaaaaaaaaaaaaaaaaaaaaaaaaaaaaaaaaaaaaaaaaaaaaaaaaaaaaaaaaaaaaaaaaaaaaaaaaaaaaaaaaaaaaaaaaaaaaaaaaaaaaaaaaaaaaaaaaaaaaaaaaaaaaaaaaaaaaaaaaaaaaaaaaaaaaaaaaaaaaaaaaaaaaaaaaaaaaaaaaaaaaaaaaaaaaaaaaaaaaaaaaaaaaaaaaaaaaaaaaaaaaaaaaaaaaaaaaaaaaaaaaaaaaaaaaaaaaaaaaaaaaaaaaaaaaaaaaaaaaaaaaaaaaaaaaaaaaaaaaaaaaaaaaaaaaaaaaaaaaaaaaaaaaaaaaaaaaaaaaaaaaaaaaaaaaaaaaaaaaaaaaaaaaaaaaaaaaaaaaaaaaaaaaaaaaaaaaaaaaaaaaaaaaaaaaaaaaaaaaaaaaaaaaaaaaaaaaaaaaaaaaaaaaaaaaaaaaaaaaaaaaaaaaaaaaaaaaaaaaaaaaaaaaaaaaaaaaaaaaaaaaaaaaaaaaaaaaaaaaaaaaaaaaaaaaaaaaaaaaaaaaaaaaaaaaaaaaaaaaaaaaaaaaaaaaaaaaaaaaaaaaaaaaaaaaaaaaaaaaaaaaaaaaaaaaaaaaaaaaaaaaaaaaaaaaaaaaaaaaaaaaaaaaaaaaaaaaaaaaaaaaaaaaaaaaaaaaaaaaaaaaaaaaaaaaaaaaaaaaaaaaaaaaaaaaaaaaaaaaaaaaaaaaaaaaaaaaaaaaaaaaaaaaaaaaaaaaaaaaaaaaaaaaaaaaaaaaaaaaaaaaaaaaaaaaaaaaaaaaaaaaaaaaaaaaaaaaaaaaaaaaaaaaaaaaaaaaaaaaaaaaaaaaaaaaaaaaaaaaaaaaaaaaaaaaaaaaaaaaaaaaaaaaaaaaaaaaaaaaaaaaaaaaaaaaaaaaaaaaaaaaaaaaaaaaaaaaaaaaaaaaaaaaaaaaaaaaaaaaaaaaaaaaaaaaaaaaaaaaaaaaaaaaaaaaaaaaaaaaaaaaaaaaaaaaaaaaaaaaaaaaaaaaaaaaaaaaaaaaaaaaaaaaaaaaaaaaaaaaaaaaaaaaaaaaaaaaaaaaaaaaaaaaaaaaaaaaaaaaaaaaaaaaaaaaaaaaaaaaaaaaaaaaaaaaaaaaaaaaaaaaaaaaaaaaaaaaaaaaaaaaaaaaaaaaaaaaaaaaaaaaaaaaaaaaaaaaaaaaaaaaaaaaaaaaaaaaaaaaaaaaaaaaaaaaaaaaaaaaaaaaaaaaaaaaaaaaaaaaaaaaaaaaaaaaaaaaaaaaaaaaaaaaaaaaaaaaaaaaaaaaaaaaaaaaaaaaaaaaaaaaaaaaaaaaaaaaaaaaaaaaaaaaaaaaaaaaaaaaaaaaaaaaaaaaaaaaaaaaaaaaaaaaaaaaaaaaaaaaaaaaaaaaaaaaaaaaaaaaaaaaaaaaaaaaaaaaaaaaaaaaaaaaaaaaaaaaaaaaaaaaaaaaaaaaaaaaaaaaaaaaaaaaaaaaaaaaaaaaaaaaaaaaaaaaaaaaaaaaaaaaaaaaaaaaaaaaaaaaaaaaaaaaaaaaaaaaaaaaaaaaaaaaaaaaaaaaaaaaaaaaaaaaaaaaaaaaaaaaaaaaaaaaaaaaaaaaaaaaaaaaaaaaaaaaaaaaaaaaaaaaaaaaaaaaaaaaaaaaaaaaaaaaaaaaaaaaaaaaaaaaaaaaaaaaaaaaaaaaaaaaaaaaaaaaaaaaaaaaaaaaaaaaaaaaaaaaaaaaaaaaaaaaaaaaaaaaaaaaaaaaaaaaaaaaaaaaaaaaaaaaaaaaaaaaaaaaaaaaaaaaaaaaaaaaaaaaaaaaaaaaaaaaaaaaaaaaaaaaaaaaaaaaaaaaaaaaaaaaaaaaaaaaaaaaaaaaaaaaaaaaaaaaaaaaaaaaaaaaaaaaaaaaaaaaaaaaaaaaaaaaaaaaaaaaaaaaaaaaaaaaaaaaaaaaaaaaaaaaaaaaaaaaaaaaaaaaaaaaaaaaaaaaaaaaaaaaaaaaaaaaaaaaaaaaaaaaaaaaaaaaaaaaaaaaaaaaaaaaaaaaaaaaaaaaaaaaaaaaaaaaaaaaaaaaaaaaaaaaaaaaaaaaaaaaaaaaaaaaaaaaaaaaaaaaaaaaaaaaaaaaaaaaaaaaaaaaaaaaaaaaaaaaaaaaaaaaaaaaaaaaaaaaaaaaaaaaaaaaaaaaaaaaaaaaaaaaaaaaaaaaaaaaaaaaaaaaaaaaaaaaaaaaaaaaaaaaaaaaaaaaaaaaaaaaaaaaaaaaaaaaaaaaaaaaaaaaaaaaaaaaaaaaaaaaaaaaaaaaaaaaaaaaaaaaaaaaaaaaaaaaaaaaaaaaaaaaaaaaaaaaaaaaaaaaaaaaaaaaaaaaaaaaaaaaaaaaaaaaaaaaaaaaaaaaaaaaaaaaaaaaaaaaaaaaaaaaaaaaaaaaaaaaaaaaaaaaaaaaaaaaaaaaaaaaaaaaaaaaaaaaaaaaaaaaaaaaaaaaaaaaaaaaaaaaaaaaaaaaaaaaaaaaaaaaaaaaaaaaaaaaaaaaaaaaaaaaaaaaaaaaaaaaaaaaaaaaaaaaaaaaaaaaaaaaaaaaaaaaaaaaaaaaaaaaaaaaaaaaaaaaaaaaaaaaaaaaaaaaaaaaaaaaaaaaaaaaaaaaaaaaaaaaaaaaaaaaaaaaaaaaaaaaaaaaaaaaaaaaaaaaaaaaaaaaaaaaaaaaaaaaaaaaaaaaaaaaaaaaaaaaaaaaaaaaaaaaaaaaaaaaaaaaaaaaaaaaaaaaaaaaaaaaaaaaaaaaaaaaaaaaaaaaaaaaaaaaaaaaaaaaaaaaaaaaaaaaaaaaaaaaaaaaaaaaaaaaaaaaaaaaaaaaaaaaaaaaaaaaaaaaaaaaaaaaaaaaaaaaaaaaaaaaaaaaaaaaaaaaaaaaaaaaaaaaaaaaaaaaaaaaaaaaaaaaaaaaaaaaaaaaaaaaaaaaaaaaaaaaaaaaaaaaaaaaaaaaaaaaaaaaaaaaaaaaaaaaaaaaaaaaaaaaaaaaaaaaaaaaaaaaaaaaaaaaaaaaaaaaaaaaaaaaaaaaaaaaaaaaaaaaaaaaaaaaaaaaaaaaaaaaaaaaaaaaaaaaaaaaaaaaaaaaaaaaaaaaaaaaaaaaaaaaaaaaaaaaaaaaaaaaaaaaaaaaaaaaaaaaaaaaaaaaaaaaaaaaaaaaaaaaaaaaaaaaaaaaaaaaaaaaaaaaaaaaaaaaaaaaaaaaaaaaaaaaaaaaaaaaaaaaaaaaaaaaaaaaaaaaaaaaaaaaaaaaaaaaaaaaaaaaaaaaaaaaaaaaaaaaaaaaaaaaaaaaaaaaaaaaaaaaaaaaaaaaaaaaaaaaaaaaaaaaaaaaaaaaaaaaaaaaaaaaaaaaaaaaaaaaaaaaaaaaaaaaaaaaaaaaaaaaaaaaaaaaaaaaaaaaaaaaaaaaaaaaaaaaaaaaaaaaaaaaaaaaaaaaaaaaaaaaaaaaaaaaaaaaaaaaaaaaaaaaaaaaaaaaaaaaaaaaaaaaaaaaaaaaaaaaaaaaaaaaaaaaaaaaaaaaaaaaaaaaaaaaaaaaaaaaaaaaaaaaaaaaaaaaaaaaaaaaaaaaaaaaaaaaaaaaaaaaaaaaaaaaaaaaaaaaaaaaaaaaaaaaaaaaaaaaaaaaaaaaaaaaaaaaaaaaaaaaaaaaaaaaaaaaaaaaaaaaaaaaaaaaaaaaaaaaaaaaaaaaaaaaaaaaaaaaaaaaaaaaaaaaaaaaaaaaaaaaaaaaaaaaaaaaaaaaaaaaaaaaaaaaaaaaaaaaaaaaaaaaaaaaaaaaaaaaaaaaaaaaaaaaaaaaaaaaaaaaaaaaaaaaaaaaaaaaaaaaaaaaaaaaaaaaaaaaaaaaaaaaaaaaaaaaaaaaaaaaaaaaaaaaaaaaaaaaaaaaaaaaaaaaaaaaaaaaaaaaaaaaaaaaaaaaaaaaaaaaaaaaaaaaaaaaaaaaaaaaaaaaaaaaaaaaaaaaaaaaaaaaaaaaaaaaaaaaaaaaaaaaaaaaaaaaaaaaaaaaaaaaaaaaaaaaaaaaaaaaaaaaaaaaaaaaaaaaaaaaaaaaaaaaaaaaaaaaaaaaaaaaaaaaaaaaaaaaaaaaaaaaaaaaaaaaaaaaaaaaaaaaaaaaaaaaaaaaaaaaaaaaaaaaaaaaaaaaaaaaaaaaaaaaaaaaaaaaaaaaaaaaaaaaaaaaaaaaaaaaaaaaaaaaaaaaaaaaaaaaaaaaaaaaaaaaaaaaaaaaaaaaaaaaaaaaaaaaaaaaaaaaaaaaaaaaaaaaaaaaaaaaaaaaaaaaaaaaaaaaaaaaaaaaaaaaaaaaaaaaaaaaaaaaaaaaaaaaaaaaaaaaaaaaaaaaaaaaaaaaaaaaaaaaaaaaaaaaaaaaaaaaaaaaaaaaaaaaaaaaaaaaaaaaaaaaaaaaaaaaaaaaaaaaaaaaaaaaaaaaaaaaaaaaaaaaaaaaaaaaaaaaaaaaaaaaaaaaaaaaaaaaaaaaaaaaaaaaaaaaaaaaaaaaaaaaaaaaaaaaaaaaaaaaaaaaaaaaaaaaaaaaaaaaaaaaaaaaaaaaaaaaaaaaaaaaaaaaaaaaaaaaaaaaaaaaaaaaaaaaaaaaaaaaaaaaaaaaaaaaaaaaaaaaaaaaaaaaaaaaaaaaaaaaaaaaaaaaaaaaaaaaaaaaaaaaaaaaaaaaaaaaaaaaaaaaaaaaaaaaaaaaaaaaaaaaaaaaaaaaaaaaaaaaaaaaaaaaaaaaaaaaaaaaaaaaaaaaaaaaaaaaaaaaaaaaaaaaaaaaaaaaaaaaaaaaaaaaaaaaaaaaaaaaaaaaaaaaaaaaaaaaaaaaaaaaaaaaaaaaaaaaaaaaaaaaaaaaaaaaaaaaaaaaaaaaaaaaaaaaaaaaaaaaaaaaaaaaaaaaaaaaaaaaaaaaaaaaaaaaaaaaaaaaaaaaaaaaaaaaaaaaaaaaaaaaaaaaaaaaaaaaaaaaaaaaaaaaaaaaaaaaaaaaaaaaaaaaaaaaaaaaaaaaaaaaaaaaaaaaaaaaaaaaaaaaaaaaaaaaaaaaaaaaaaaaaaaaaaaaaaaaaaaaaaaaaaaaaaaaaaaaaaaaaaaaaaaaaaaaaaaaaaaaaaaaaaaaaaaaaaaaaaaaaaaaaaaaaaaaaaaaaaaaaaaaaaaaaaaaaaaaaaaaaaaaaaaaaaaaaaaaaaaaaaaaaaaaaaaaaaaaaaaaaaaaaaaaaaaaaaaaaaaaaaaaaaaaaaaaaaaaaaaaaaaaaaaaaaaaaaaaaaaaaaaaaaaaaaaaaaaaaaaaaaaaaaaaaaaaaaaaaaaaaaaaaaaaaaaaaaaaaaaaaaaaaaaaaaaaaaaaaaaaaaaaaaaaaaaaaaaaaaaaaaaaaaaaaaaaaaaaaaaaaaaaaaaaaaaaaaaaaaaaaaaaaaaaaaaaaaaaaaaaaaaaaaaaaaaaaaaaaaaaaaaaaaaaaaaaaaaaaaaaaaaaaaaaaaaaaaaaaaaaaaaaaaaaaaaaaaaaaaaaaaaaaaaaaaaaaaaaaaaaaaaaaaaaaaaaaaaaaaaaaaaaaaaaaaaaaaaaaaaaaaaaaaaaaaaaaaaaaaaaaaaaaaaaaaaaaaaaaaaaaaaaaaaaaaaaaaaaaaaaaaaaaaaaaaaaaaaaaaaaaaaaaaaaaaaaaaaaaaaaaaaaaaaaaaaaaaaaaaaaaaaaaaaaaaaaaaaaaaaaaaaaaaaaaaaaaaaaaaaaaaaaaaaaaaaaaaaaaaaaaaaaaaaaaaaaaaaaaaaaaaaaaaaaaaaaaaaaaaaaaaaaaaaaaaaaaaaaaaaaaaaaaaaaaaaaaaaaaaaaaaaaaaaaaaaaaaaaaaaaaaaaaaaaaaaaaaaaaaaaaaaaaaaaaaaaaaaaaaaaaaaaaaaaaaaaaaaaaaaaaaaaaaaaaaaaaaaaaaaaaaaaaaaaaaaaaaaaaaaaaaaaaaaaaaaaaaaaaaaaaaaaaaaaaaaaaaaaaaaaaaaaaaaaaaaaaaaaaaaaaaaaaaaaaaaaaaaaaaaaaaaaaaaaaaaaaaaaaaaaaaaaaaaaaaaaaaaaaaaaaaaaaaaaaaaaaaaaaaaaaaaaaaaaaaaaaaaaaaaaaaaaaaaaaaaaaaaaaaaaaaaaaaaaaaaaaaaaaaaaaaaaaaaaaaaaaaaaaaaaaaaaaaaaaaaaaaaaaaaaaaaaaaaaaaaaaaaaaaaaaaaaaaaaaaaaaaaaaaaaaaaaaaaaaaaaaaaaaaaaaaaaaaaaaaaaaaaaaaaaaaaaaaaaaaaaaaaaaaaaaaaaaaaaaaaaaaaaaaaaaaaaaaaaaaaaaaaaaaaaaaaaaaaaaaaaaaaaaaaaaaaaaaaaaaaaaaaaaaaaaaaaaaaaaaaaaaaaaaaaaaaaaaaaaaaaaaaaaaaaaaaaaaaaaaaaaaaaaaaaaaaaaaaaaaaaaaaaaaaaaaaaaaaaaaaaaaaaaaaaaaaaaaaaaaaaaaaaaaaaaaaaaaaaaaaaaaaaaaaaaaaaaaaaaaaaaaaaaaaaaaaaaaaaaaaaaaaaaaaaaaaaaaaaaaaaaaaaaa"]
select json_keys(NULL);
json_keys(NULL)
NULL
select json_keys(NULL, '$.b');
json_keys(NULL, '$.b')
NULL
select json_keys(NULL, NULL);
json_keys(NULL, NULL)
NULL
select json_keys('{"a": 1, "b": {"e": "foo", "b": 3}}', '$.a');
json_keys('{"a": 1, "b": {"e": "foo", "b": 3}}', '$.a')
NULL
select json_keys('{"a": 1, "b": {"e": "foo", "b": 3}}', NULL);
json_keys('{"a": 1, "b": {"e": "foo", "b": 3}}', NULL)
NULL
select json_keys('{"a": 1, "b": {"e": "foo", "b": 3}}');
json_keys('{"a": 1, "b": {"e": "foo", "b": 3}}')
["a", "b"]
select json_keys('{"a": 1, "b": {"e": "foo", "b": 3}}', '$.b');
json_keys('{"a": 1, "b": {"e": "foo", "b": 3}}', '$.b')
["b", "e"]
select json_keys('{"a": 1, "b": {"e": "foo", "b": 3}}', '$.*.b');
ERROR 42000: In this situation, path expressions may not contain the * and ** tokens.
delete from keys1;
insert into keys1 values (0, NULL),
(1, '{"a": 1, "b": {"e": "foo", "b": 3}}');
select i, json_keys(j), json_keys(j, '$.b') from keys1;
i	json_keys(j)	json_keys(j, '$.b')
0	NULL	NULL
1	["a", "b"]	["b", "e"]
# returns [ "a", "b" ]
SELECT JSON_KEYS('{ "a" : "foo", "b" : [ true, { "c" : "123" } ] }');
JSON_KEYS('{ "a" : "foo", "b" : [ true, { "c" : "123" } ] }')
["a", "b"]
# returns []
SELECT JSON_KEYS('{ "a" : "foo", "b" : [ true, { "c" : {} } ] }',
'$.b[1].c');
JSON_KEYS('{ "a" : "foo", "b" : [ true, { "c" : {} } ] }',
'$.b[1].c')
[]
# returns NULL
SELECT JSON_KEYS('{ "a" : "foo", "b" : [ true, { "c" : {} } ] }',
'$.a.b[2]');
JSON_KEYS('{ "a" : "foo", "b" : [ true, { "c" : {} } ] }',
'$.a.b[2]')
NULL
SELECT JSON_KEYS('{"a":1}', '1010');
ERROR 42000: Invalid JSON path expression. The error is around character position 1.
SELECT JSON_KEYS('{"a":1}', '1010') IS NULL;
ERROR 42000: Invalid JSON path expression. The error is around character position 1.
SELECT JSON_KEYS
(
'{ "a" : "foo", "b" : [ true, { "c" : "123" } ] }'
);
JSON_KEYS
(
'{ "a" : "foo", "b" : [ true, { "c" : "123" } ] }'
)
["a", "b"]
SELECT JSON_KEYS
(
'{ "a" : "foo", "b" : [ true, { "c" : {} } ] }',
'$.b[1].c'
);
JSON_KEYS
(
'{ "a" : "foo", "b" : [ true, { "c" : {} } ] }',
'$.b[1].c'
)
[]
SELECT JSON_KEYS
(
'{ "a" : "foo", "b" : [ true, { "c" : {} } ] }',
'$.a.b[2]'
);
JSON_KEYS
(
'{ "a" : "foo", "b" : [ true, { "c" : {} } ] }',
'$.a.b[2]'
)
NULL
SELECT JSON_KEYS();
ERROR 42000: Incorrect parameter count in the call to native function 'JSON_KEYS'
SELECT JSON_KEYS('{}', '$', '$');
ERROR 42000: Incorrect parameter count in the call to native function 'JSON_KEYS'
# ----------------------------------------------------------------------
# CAST(<json> AS CHAR). See also 'json_conversions.test' for other
# conversion tests.
# ----------------------------------------------------------------------
select cast(json_keys('{"a": 1}') as char);
cast(json_keys('{"a": 1}') as char)
["a"]
select cast(cast(1 as json) as char);
cast(cast(1 as json) as char)
1
select cast(json_keys(NULL) as char);
cast(json_keys(NULL) as char)
NULL
select cast(j as char) from keys1;
cast(j as char)
NULL
{"a": 1, "b": {"b": 3, "e": "foo"}}
create table t(i int);
select cast(json_extract(j, '$.b.b') as char) from keys1;
cast(json_extract(j, '$.b.b') as char)
NULL
3
insert into t select cast(json_extract(j, '$.b.b') as char) from keys1;
select * from t;
i
NULL
3
drop table t;
drop table keys1;
CREATE TABLE t(ts TIMESTAMP, j JSON AS (CAST(ts AS JSON)));
INSERT INTO t(ts) VALUES ('2000-01-01 00:00:00');
SELECT CAST(JSON_ARRAY(ts, j) AS CHAR) FROM t;
CAST(JSON_ARRAY(ts, j) AS CHAR)
["2000-01-01 00:00:00.000000", "2000-01-01 00:00:00.000000"]
DROP TABLE t;
# ----------------------------------------------------------------------
# Path matching with double-quotes
# ----------------------------------------------------------------------
select json_extract( '{ "one potato" : 1 }', '$."one potato"' );
json_extract( '{ "one potato" : 1 }', '$."one potato"' )
1
select json_extract( '{ "a.b" : 1 }', '$."a.b"' );
json_extract( '{ "a.b" : 1 }', '$."a.b"' )
1
select json_extract( '{ "\\"a\\"": 1}', '$."a"' );
json_extract( '{ "\\"a\\"": 1}', '$."a"' )
NULL
select json_extract( '{ "\\"a\\"": 1}', '$."\\"a\\""' );
json_extract( '{ "\\"a\\"": 1}', '$."\\"a\\""' )
1
select json_extract( '{ "a": 1}', '$."a"' );
json_extract( '{ "a": 1}', '$."a"' )
1
select json_extract( '{ "a": 1}', '$.a' );
json_extract( '{ "a": 1}', '$.a' )
1
select json_extract( '{ "a": [ [ 3, 2 ], [ { "c" : "d" }, 1 ] ], "b": { "c" : 6 }, "one potato": 7, "b.c" : 8 }', '$.a[0]' );
json_extract( '{ "a": [ [ 3, 2 ], [ { "c" : "d" }, 1 ] ], "b": { "c" : 6 }, "one potato": 7, "b.c" : 8 }', '$.a[0]' )
[3, 2]
select json_extract( '{ "a": [ [ 3, 2 ], [ { "c" : "d" }, 1 ] ], "b": { "c" : 6 }, "one potato": 7, "b.c" : 8 }', '$.a[0][1]' );
json_extract( '{ "a": [ [ 3, 2 ], [ { "c" : "d" }, 1 ] ], "b": { "c" : 6 }, "one potato": 7, "b.c" : 8 }', '$.a[0][1]' )
2
select json_extract( '{ "a": [ [ 3, 2 ], [ { "c" : "d" }, 1 ] ], "b": { "c" : 6 }, "one potato": 7, "b.c" : 8 }', '$.a[1]' );
json_extract( '{ "a": [ [ 3, 2 ], [ { "c" : "d" }, 1 ] ], "b": { "c" : 6 }, "one potato": 7, "b.c" : 8 }', '$.a[1]' )
[{"c": "d"}, 1]
select json_extract( '{ "a": [ [ 3, 2 ], [ { "c" : "d" }, 1 ] ], "b": { "c" : 6 }, "one potato": 7, "b.c" : 8 }', '$.a[1][0]' );
json_extract( '{ "a": [ [ 3, 2 ], [ { "c" : "d" }, 1 ] ], "b": { "c" : 6 }, "one potato": 7, "b.c" : 8 }', '$.a[1][0]' )
{"c": "d"}
select json_extract( '{ "a": [ [ 3, 2 ], [ { "c" : "d" }, 1 ] ], "b": { "c" : 6 }, "one potato": 7, "b.c" : 8 }', '$.a[1][0].c' );
json_extract( '{ "a": [ [ 3, 2 ], [ { "c" : "d" }, 1 ] ], "b": { "c" : 6 }, "one potato": 7, "b.c" : 8 }', '$.a[1][0].c' )
"d"
select json_extract( '{ "a": [ [ 3, 2 ], [ { "c" : "d" }, 1 ] ], "b": { "c" : 6 }, "one potato": 7, "b.c" : 8 }', '$."one potato"' );
json_extract( '{ "a": [ [ 3, 2 ], [ { "c" : "d" }, 1 ] ], "b": { "c" : 6 }, "one potato": 7, "b.c" : 8 }', '$."one potato"' )
7
select json_extract( '{ "a": [ [ 3, 2 ], [ { "c" : "d" }, 1 ] ], "b": { "c" : 6 }, "one potato": 7, "b.c" : 8 }', '$.b.c' );
json_extract( '{ "a": [ [ 3, 2 ], [ { "c" : "d" }, 1 ] ], "b": { "c" : 6 }, "one potato": 7, "b.c" : 8 }', '$.b.c' )
6
select json_extract( '{ "a": [ [ 3, 2 ], [ { "c" : "d" }, 1 ] ], "b": { "c" : 6 }, "one potato": 7, "b.c" : 8 }', '$."b.c"' );
json_extract( '{ "a": [ [ 3, 2 ], [ { "c" : "d" }, 1 ] ], "b": { "c" : 6 }, "one potato": 7, "b.c" : 8 }', '$."b.c"' )
8
# ----------------------------------------------------------------------
# Test of JSON_EXTRACT function.
# ----------------------------------------------------------------------
select json_extract(NULL);
ERROR 42000: Incorrect parameter count in the call to native function 'json_extract'
select json_extract('$.b');
ERROR 42000: Incorrect parameter count in the call to native function 'json_extract'
select json_extract('{"a": 1, "b": {"e": "foo", "b": 3}}');
ERROR 42000: Incorrect parameter count in the call to native function 'json_extract'
select json_extract('$.a', '{"a": 1, "b": {"e": "foo", "b": 3}}');
ERROR 22032: Invalid JSON text in argument 1 to function json_extract: "Invalid value." at position 0.
select json_extract(NULL, '$.b');
json_extract(NULL, '$.b')
NULL
select json_extract(NULL, NULL);
json_extract(NULL, NULL)
NULL
select json_extract('{"a": 1, "b": {"e": "foo", "b": 3}}', '$.a');
json_extract('{"a": 1, "b": {"e": "foo", "b": 3}}', '$.a')
1
select json_extract('{"a": 1, "b": {"e": "foo", "b": 3}}', '$.*');
json_extract('{"a": 1, "b": {"e": "foo", "b": 3}}', '$.*')
[1, {"b": 3, "e": "foo"}]
select json_extract('{"a": 1, "b": {"e": "foo", "b": 3}}', '$.a', '$.b.e');
json_extract('{"a": 1, "b": {"e": "foo", "b": 3}}', '$.a', '$.b.e')
[1, "foo"]
select json_extract('{"a": 1, "b": [1,2,3]}', '$.b[2]');
json_extract('{"a": 1, "b": [1,2,3]}', '$.b[2]')
3
select json_extract('{"a": 1, "b": {"e": "foo", "b": 3}}', '$.a', NULL);
json_extract('{"a": 1, "b": {"e": "foo", "b": 3}}', '$.a', NULL)
NULL
# returns a JSON value containing just the string "123"
SELECT JSON_EXTRACT('{ "a" : "foo", "b" : [ true, { "c" : "123" } ] }',
'$.b[ 1 ].c');
JSON_EXTRACT('{ "a" : "foo", "b" : [ true, { "c" : "123" } ] }',
'$.b[ 1 ].c')
"123"
# returns a JSON value containing just the number 123
SELECT JSON_EXTRACT('{ "a" : "foo", "b" : [ true, { "c" : 123 } ] }',
'$.b[ 1 ].c');
JSON_EXTRACT('{ "a" : "foo", "b" : [ true, { "c" : 123 } ] }',
'$.b[ 1 ].c')
123
# raises an error because the document is not valid
SELECT JSON_EXTRACT('{ "a" : [ }',
'$.b[ 1 ].c');
ERROR 22032: Invalid JSON text in argument 1 to function json_extract: "Invalid value." at position 10.
# raises an error because the path is invalid
SELECT JSON_EXTRACT('{ "a" : "foo", "b" : [ true, { "c" : 123 } ] }',
'$.b[ 1 ].');
ERROR 42000: Invalid JSON path expression. The error is around character position 9.
# returns a JSON value containing the number 123 (because of
# auto-wrapping the scalar)
SELECT JSON_EXTRACT('{ "a" : "foo", "b" : [ true, { "c" : 123 } ] }',
'$.b[ 1 ].c[ 0 ]');
JSON_EXTRACT('{ "a" : "foo", "b" : [ true, { "c" : 123 } ] }',
'$.b[ 1 ].c[ 0 ]')
123
# returns a JSON value containing the object because of auto-wrapping
SELECT JSON_EXTRACT('{ "a" : "foo", "b" : [ true, { "c" : {"not array": 4} } ] }',
'$.b[ 1 ].c[ 0 ]');
JSON_EXTRACT('{ "a" : "foo", "b" : [ true, { "c" : {"not array": 4} } ] }',
'$.b[ 1 ].c[ 0 ]')
{"not array": 4}
# returns null because the path, although valid, does not identify a value
SELECT JSON_EXTRACT('{ "a" : "foo", "b" : [ true, { "c" : 123 } ] }',
'$.b[ 1 ].c[ 1 ]');
JSON_EXTRACT('{ "a" : "foo", "b" : [ true, { "c" : 123 } ] }',
'$.b[ 1 ].c[ 1 ]')
NULL
# returns a JSON value containing the number 123 (due to normalization)
SELECT JSON_EXTRACT('{ "a" : "foo", "b" : [ true, { "c" : 123, "c" : 456 } ] }',
'$.b[ 1 ].c');
JSON_EXTRACT('{ "a" : "foo", "b" : [ true, { "c" : 123, "c" : 456 } ] }',
'$.b[ 1 ].c')
123
# returns a JSON array [ "foo", true ]
SELECT JSON_EXTRACT('{ "a" : "foo", "b" : [ true, { "c" : 123, "c" : 456 } ] }',
'$.a', '$.b[0]');
JSON_EXTRACT('{ "a" : "foo", "b" : [ true, { "c" : 123, "c" : 456 } ] }',
'$.a', '$.b[0]')
["foo", true]
# returns a JSON array [ true ]
SELECT JSON_EXTRACT('{ "a" : "foo", "b" : [ true, { "c" : 123, "c" : 456 } ] }',
'$.d', '$.b[0]');
JSON_EXTRACT('{ "a" : "foo", "b" : [ true, { "c" : 123, "c" : 456 } ] }',
'$.d', '$.b[0]')
[true]
select json_extract( '[1]', '$[0][0]' );
json_extract( '[1]', '$[0][0]' )
1
select json_extract( '[1]', '$**[0]' );
json_extract( '[1]', '$**[0]' )
[1]
select json_extract( '{ "a": 1 }', '$.a[0]' );
json_extract( '{ "a": 1 }', '$.a[0]' )
1
select json_extract( '{ "a": 1 }', '$**[0]' );
json_extract( '{ "a": 1 }', '$**[0]' )
[{"a": 1}, 1]
select json_extract( '{ "a": 1 }', '$[0].a' );
json_extract( '{ "a": 1 }', '$[0].a' )
1
select json_extract( '{ "a": 1 }', '$**.a' );
json_extract( '{ "a": 1 }', '$**.a' )
[1]
select json_extract( '{ "a": 1 }', '$[0].a[0]' );
json_extract( '{ "a": 1 }', '$[0].a[0]' )
1
select json_extract( '{ "a": 1 }', '$**[0]' );
json_extract( '{ "a": 1 }', '$**[0]' )
[{"a": 1}, 1]
select json_extract( '{ "a": 1 }', '$[0].a' );
json_extract( '{ "a": 1 }', '$[0].a' )
1
select json_extract( '{ "a": 1 }', '$**.a' );
json_extract( '{ "a": 1 }', '$**.a' )
[1]
select json_extract( '{ "a": 1 }', '$[0][0].a' );
json_extract( '{ "a": 1 }', '$[0][0].a' )
1
select json_extract( '{ "a": 1 }', '$[0][0][0].a' );
json_extract( '{ "a": 1 }', '$[0][0][0].a' )
1
SELECT JSON_EXTRACT('[1, [[{"x": [{"a":{"b":{"c":42}}}]}]]]', '$**.a.*');
JSON_EXTRACT('[1, [[{"x": [{"a":{"b":{"c":42}}}]}]]]', '$**.a.*')
[{"c": 42}]
SELECT JSON_EXTRACT('[1, [[{"x": [{"a":{"b":{"c":42}}}]}]]]',
'$[1][0][0].x[0].a.*');
JSON_EXTRACT('[1, [[{"x": [{"a":{"b":{"c":42}}}]}]]]',
'$[1][0][0].x[0].a.*')
[{"c": 42}]
SELECT JSON_EXTRACT
(
'{ "a" : "foo", "b" : [ true, { "c" : "123" } ] }',
'$.b[ 1 ].c'
);
JSON_EXTRACT
(
'{ "a" : "foo", "b" : [ true, { "c" : "123" } ] }',
'$.b[ 1 ].c'
)
"123"
SELECT JSON_EXTRACT
(
'{ "a" : "foo", "b" : [ true, { "c" : 123 } ] }',
'$.b[ 1 ].c'
);
JSON_EXTRACT
(
'{ "a" : "foo", "b" : [ true, { "c" : 123 } ] }',
'$.b[ 1 ].c'
)
123
SELECT JSON_EXTRACT
(
'{ "a" : [ }',
'$.b[ 1 ].c'
);
ERROR 22032: Invalid JSON text in argument 1 to function json_extract: "Invalid value." at position 10.
SELECT JSON_EXTRACT
(
'{ "a" : "foo", "b" : [ true, { "c" : 123 } ] }',
'$.b[ 1 ].'
);
ERROR 42000: Invalid JSON path expression. The error is around character position 9.
SELECT JSON_EXTRACT
(
'{ "a" : "foo", "b" : [ true, { "c" : 123 } ] }',
'$.b[ 1 ].c[ 0 ]'
);
JSON_EXTRACT
(
'{ "a" : "foo", "b" : [ true, { "c" : 123 } ] }',
'$.b[ 1 ].c[ 0 ]'
)
123
SELECT JSON_EXTRACT
(
'{ "a" : "foo", "b" : [ true, { "c" : 123 } ] }',
'$.b[ 1 ].c[ 1 ]'
);
JSON_EXTRACT
(
'{ "a" : "foo", "b" : [ true, { "c" : 123 } ] }',
'$.b[ 1 ].c[ 1 ]'
)
NULL
SELECT JSON_EXTRACT
(
'{ "a" : "foo", "b" : [ true, { "c" : 123, "c" : 456 } ] }',
'$.b[ 1 ].c'
);
JSON_EXTRACT
(
'{ "a" : "foo", "b" : [ true, { "c" : 123, "c" : 456 } ] }',
'$.b[ 1 ].c'
)
123
SELECT JSON_EXTRACT
(
'{ "a" : "foo", "b" : [ true, { "c" : 123, "c" : 456 } ] }',
'$.a', '$.b[0]'
);
JSON_EXTRACT
(
'{ "a" : "foo", "b" : [ true, { "c" : 123, "c" : 456 } ] }',
'$.a', '$.b[0]'
)
["foo", true]
SELECT JSON_EXTRACT
(
'{ "a" : "foo", "b" : [ true, { "c" : 123, "c" : 456 } ] }',
'$.d', '$.b[0]'
);
JSON_EXTRACT
(
'{ "a" : "foo", "b" : [ true, { "c" : 123, "c" : 456 } ] }',
'$.d', '$.b[0]'
)
[true]
select json_extract( '[ { "a": 1 }, { "a": 2 } ]', '$[*].b' ) jdoc;
jdoc
NULL
select json_extract( '[ { "a": 1 }, { "a": 2 } ]', '$[0].b' ) jdoc;
jdoc
NULL
select json_extract( '[ { "a": 1 }, { "a": 2 } ]', '$[0].a' ) jdoc;
jdoc
1
select json_extract( '[ { "a": 1 }, { "a": 2 } ]', '$[*].a' ) jdoc;
jdoc
[1, 2]
select json_extract( '[ { "a": 1 }, { "b": 2 } ]', '$[*].a' ) jdoc;
jdoc
[1]
select json_extract( '[ { "a": [3,4] }, { "b": 2 } ]', '$[0].a' ) jdoc;
jdoc
[3, 4]
select json_extract( '[ { "a": [3,4] }, { "b": 2 } ]', '$[*].a' ) jdoc;
jdoc
[[3, 4]]
select json_extract( '[ { "a": [3,4] }, { "b": 2 } ]', '$[0].a', '$[1].a' ) jdoc;
jdoc
[[3, 4]]
# ----------------------------------------------------------------------
# Test of JSON_ARRAY_APPEND function.
# ----------------------------------------------------------------------
select json_array_append(NULL, '$.b', cast(1 as json));
json_array_append(NULL, '$.b', cast(1 as json))
NULL
select json_array_append('[1,2,3]', NULL, cast(1 as json));
json_array_append('[1,2,3]', NULL, cast(1 as json))
NULL
select json_array_append('[1,2,3]', '$', NULL);
json_array_append('[1,2,3]', '$', NULL)
[1, 2, 3, null]
select json_array_append(NULL);
ERROR 42000: Incorrect parameter count in the call to native function 'json_array_append'
select json_array_append(NULL, NULL);
ERROR 42000: Incorrect parameter count in the call to native function 'json_array_append'
select json_array_append(NULL, NULL, NULL, NULL);
ERROR 42000: Incorrect parameter count in the call to native function 'json_array_append'
create table t(j json);
insert into t values ('[ 1, 2, 3, {"a": [4,5,6]}]');
select json_array_append(j, '$[3].a', cast(7 as json)) from t;
json_array_append(j, '$[3].a', cast(7 as json))
[1, 2, 3, {"a": [4, 5, 6, 7]}]
select json_array_append(j, '$', 7) from t;
json_array_append(j, '$', 7)
[1, 2, 3, {"a": [4, 5, 6]}, 7]
select json_array_append(j, '$', cast(7 as json), '$[3].a', 3.14) from t;
json_array_append(j, '$', cast(7 as json), '$[3].a', 3.14)
[1, 2, 3, {"a": [4, 5, 6, 3.14]}, 7]
# second path's append ignored since it doesn't specify an array
# nor is it an existing scalar,  so no auto-wrapping either
select json_array_append(j, '$', 7, '$[3].b', cast(8 as json)) from t;
json_array_append(j, '$', 7, '$[3].b', cast(8 as json))
[1, 2, 3, {"a": [4, 5, 6]}, 7]
drop table t;
SELECT JSON_ARRAY_APPEND(cast('1' as json), '$', 3);
JSON_ARRAY_APPEND(cast('1' as json), '$', 3)
[1, 3]
SELECT JSON_ARRAY_APPEND(cast('{"a": 3}' as json), '$', 3);
JSON_ARRAY_APPEND(cast('{"a": 3}' as json), '$', 3)
[{"a": 3}, 3]
select json_array_append(cast('{"a": {"b": [3]}}' as json), '$**[0]', 6);
ERROR 42000: In this situation, path expressions may not contain the * and ** tokens.
# Auto-wrapping, since because the paths identify scalars.
# should return {"a": "foo", "b": ["bar", 4], "c": ["wibble", "grape"]}
SELECT JSON_ARRAY_APPEND('{"a": "foo", "b": "bar", "c": "wibble"}',
'$.b', cast(4 as json),
'$.c', cast('"grape"' as json));
JSON_ARRAY_APPEND('{"a": "foo", "b": "bar", "c": "wibble"}',
'$.b', cast(4 as json),
'$.c', cast('"grape"' as json))
{"a": "foo", "b": ["bar", 4], "c": ["wibble", "grape"]}
# should return {"a": "foo", "b": [1, 2, 3, 4],
#                "c": ["apple", "pear", "grape"]}
SELECT JSON_ARRAY_APPEND('{"a" : "foo","b": [1, 2, 3], "c": ["apple", "pear"]}',
'$.b', cast(4 as json),
'$.c', cast('"grape"' as json));
JSON_ARRAY_APPEND('{"a" : "foo","b": [1, 2, 3], "c": ["apple", "pear"]}',
'$.b', cast(4 as json),
'$.c', cast('"grape"' as json))
{"a": "foo", "b": [1, 2, 3, 4], "c": ["apple", "pear", "grape"]}
SELECT JSON_ARRAY_APPEND('{"a" : "foo","b": [1, 2, 3], "c": ["apple", "pear"]}',
'$.b', 4,
'$.c', 'grape');
JSON_ARRAY_APPEND('{"a" : "foo","b": [1, 2, 3], "c": ["apple", "pear"]}',
'$.b', 4,
'$.c', 'grape')
{"a": "foo", "b": [1, 2, 3, 4], "c": ["apple", "pear", "grape"]}
select json_array_append( '[[], [], []]', '$[*]', 3, '$[*]', 4);
ERROR 42000: In this situation, path expressions may not contain the * and ** tokens.
select json_array_append( '[[], "not array", []]', '$[*]', 3, '$[*]', 4);
ERROR 42000: In this situation, path expressions may not contain the * and ** tokens.
SELECT JSON_ARRAY_APPEND
(
'{ "a" : "foo", "b" : "bar", "c" : "wibble" }',
'$.b', 4,
'$.c', "grape"
);
JSON_ARRAY_APPEND
(
'{ "a" : "foo", "b" : "bar", "c" : "wibble" }',
'$.b', 4,
'$.c', "grape"
)
{"a": "foo", "b": ["bar", 4], "c": ["wibble", "grape"]}
SELECT JSON_ARRAY_APPEND
(
'{ "a" : "foo", "b" : [ 1, 2, 3 ], "c" : [ "apple", "pear" ] }',
'$.b', 4,
'$.c', "grape"
);
JSON_ARRAY_APPEND
(
'{ "a" : "foo", "b" : [ 1, 2, 3 ], "c" : [ "apple", "pear" ] }',
'$.b', 4,
'$.c', "grape"
)
{"a": "foo", "b": [1, 2, 3, 4], "c": ["apple", "pear", "grape"]}
# ----------------------------------------------------------------------
# Bug#21373874 ASSERTION `PARENT' FAILED
# ----------------------------------------------------------------------
select json_array_append('{"a":1}', '$[0]', 100);
json_array_append('{"a":1}', '$[0]', 100)
[{"a": 1}, 100]
select json_array_append('3', '$[0]', 100);
json_array_append('3', '$[0]', 100)
[3, 100]
select json_array_append('3', '$[0][0][0][0]', 100);
json_array_append('3', '$[0][0][0][0]', 100)
[3, 100]
# ----------------------------------------------------------------------
# Test of JSON_INSERT function.
# ----------------------------------------------------------------------
select json_insert(NULL, '$.b', cast(1 as json));
json_insert(NULL, '$.b', cast(1 as json))
NULL
select json_insert('[1,2,3]', NULL, cast(1 as json));
json_insert('[1,2,3]', NULL, cast(1 as json))
NULL
select json_insert('[1,2,3]', '$[3]', NULL);
json_insert('[1,2,3]', '$[3]', NULL)
[1, 2, 3, null]
select json_insert(NULL);
ERROR 42000: Incorrect parameter count in the call to native function 'json_insert'
select json_insert(NULL, NULL);
ERROR 42000: Incorrect parameter count in the call to native function 'json_insert'
select json_insert(NULL, NULL, NULL, NULL);
ERROR 42000: Incorrect parameter count in the call to native function 'json_insert'
select json_insert('[1,2,3]', '$[2]', 4);
json_insert('[1,2,3]', '$[2]', 4)
[1, 2, 3]
select json_insert('[1,2,3]', '$[3]', 4);
json_insert('[1,2,3]', '$[3]', 4)
[1, 2, 3, 4]
select json_insert('[1,2,3]', '$[10]', 4);
json_insert('[1,2,3]', '$[10]', 4)
[1, 2, 3, 4]
select json_insert('{"c":4}', '$.c', 4);
json_insert('{"c":4}', '$.c', 4)
{"c": 4}
select json_insert('{"c":4}', '$.a', 4);
json_insert('{"c":4}', '$.a', 4)
{"a": 4, "c": 4}
select json_insert('1', '$', 4);
json_insert('1', '$', 4)
1
select json_insert('1', '$[0]', 4);
json_insert('1', '$[0]', 4)
1
select json_insert('1', '$[1]', 4);
json_insert('1', '$[1]', 4)
[1, 4]
select json_insert('1', '$[10]', '4', '$[11]', 5);
json_insert('1', '$[10]', '4', '$[11]', 5)
[1, "4", 5]
select json_insert('[1,2,3]', '$[2][0]', 4);
json_insert('[1,2,3]', '$[2][0]', 4)
[1, 2, 3]
select json_insert('[1,2,3]', '$[2][2]', 4);
json_insert('[1,2,3]', '$[2][2]', 4)
[1, 2, [3, 4]]
select json_insert('{"a": 3}', '$.a[0]', 4);
json_insert('{"a": 3}', '$.a[0]', 4)
{"a": 3}
select json_insert('{"a": 3}', '$.a[1]', 4, '$.a[2]', '5');
json_insert('{"a": 3}', '$.a[1]', 4, '$.a[2]', '5')
{"a": [3, 4, "5"]}
select json_insert(cast('{"a": [1], "b": 2}' as json), '$.*[1]', 6);
ERROR 42000: In this situation, path expressions may not contain the * and ** tokens.
select json_insert(cast('{"a": 1, "b": 2}' as json), '$.*[1]', 6);
ERROR 42000: In this situation, path expressions may not contain the * and ** tokens.
select json_insert(cast('{"a": {"b": 3}}' as json),   '$.a.*[1]', 6);
ERROR 42000: In this situation, path expressions may not contain the * and ** tokens.
select json_insert(cast('{"a": {"b": [3]}}' as json), '$.a.*[1]', 6);
ERROR 42000: In this situation, path expressions may not contain the * and ** tokens.
select json_insert(cast('{"a": {"b": 3}}' as json),   '$**[1]', 6);
ERROR 42000: In this situation, path expressions may not contain the * and ** tokens.
select json_insert(cast('{"a": {"b": [3]}}' as json), '$**[1]', 6);
ERROR 42000: In this situation, path expressions may not contain the * and ** tokens.
select json_insert(cast('[1]' as json), '$[*][1]', 6);
ERROR 42000: In this situation, path expressions may not contain the * and ** tokens.
select json_insert(cast('[1]' as json), '$**[1]', 6);
ERROR 42000: In this situation, path expressions may not contain the * and ** tokens.
select json_insert(cast('[1, [2], 3]' as json), '$[*][1]', 6);
ERROR 42000: In this situation, path expressions may not contain the * and ** tokens.
select json_insert(cast('[1, [2], 3]' as json), '$**[1]', 6);
ERROR 42000: In this situation, path expressions may not contain the * and ** tokens.
select json_insert(cast('[[1]]' as json), '$[*][1]', 6);
ERROR 42000: In this situation, path expressions may not contain the * and ** tokens.
select json_insert(cast('[[1]]' as json), '$**[1]', 6);
ERROR 42000: In this situation, path expressions may not contain the * and ** tokens.
select json_insert(cast('{"a": 3}' as json), '$[1]', 6);
json_insert(cast('{"a": 3}' as json), '$[1]', 6)
[{"a": 3}, 6]
SELECT JSON_INSERT('{ "a" : "foo", "b" : [ 1, 2, 3 ] }', '$.a', true);
JSON_INSERT('{ "a" : "foo", "b" : [ 1, 2, 3 ] }', '$.a', true)
{"a": "foo", "b": [1, 2, 3]}
SELECT JSON_INSERT('{ "a" : "foo", "b" : [ 1, 2, 3 ] }', '$.c', 123);
JSON_INSERT('{ "a" : "foo", "b" : [ 1, 2, 3 ] }', '$.c', 123)
{"a": "foo", "b": [1, 2, 3], "c": 123}
SELECT JSON_INSERT('{ "a" : "foo", "b" : [ 1, 2, 3 ] }', '$.c', '123');
JSON_INSERT('{ "a" : "foo", "b" : [ 1, 2, 3 ] }', '$.c', '123')
{"a": "foo", "b": [1, 2, 3], "c": "123"}
SELECT JSON_INSERT('{ "a" : "foo", "b" : [ 1, 2, 3 ] }', '$.a[1]', true);
JSON_INSERT('{ "a" : "foo", "b" : [ 1, 2, 3 ] }', '$.a[1]', true)
{"a": ["foo", true], "b": [1, 2, 3]}
SELECT JSON_INSERT('{ "a" : "foo"}', '$.b', true, '$.b', false);
JSON_INSERT('{ "a" : "foo"}', '$.b', true, '$.b', false)
{"a": "foo", "b": true}
SELECT JSON_INSERT
(
'{ "a" : "foo", "b" : [ 1, 2, 3 ] }',
'$.a',
true
);
JSON_INSERT
(
'{ "a" : "foo", "b" : [ 1, 2, 3 ] }',
'$.a',
true
)
{"a": "foo", "b": [1, 2, 3]}
SELECT JSON_INSERT
(
'{ "a" : "foo", "b" : [ 1, 2, 3 ] }',
'$.c',
123
);
JSON_INSERT
(
'{ "a" : "foo", "b" : [ 1, 2, 3 ] }',
'$.c',
123
)
{"a": "foo", "b": [1, 2, 3], "c": 123}
SELECT JSON_INSERT
(
'{ "a" : "foo", "b" : [ 1, 2, 3 ] }',
'$.c',
'123'
);
JSON_INSERT
(
'{ "a" : "foo", "b" : [ 1, 2, 3 ] }',
'$.c',
'123'
)
{"a": "foo", "b": [1, 2, 3], "c": "123"}
SELECT JSON_INSERT
(
'{ "a" : "foo", "b" : [ 1, 2, 3 ] }',
'$.a[1]',
true
);
JSON_INSERT
(
'{ "a" : "foo", "b" : [ 1, 2, 3 ] }',
'$.a[1]',
true
)
{"a": ["foo", true], "b": [1, 2, 3]}
SELECT JSON_INSERT
(
'{ "a" : "foo"}',
'$.b', true,
'$.b', false
);
JSON_INSERT
(
'{ "a" : "foo"}',
'$.b', true,
'$.b', false
)
{"a": "foo", "b": true}
# ----------------------------------------------------------------------
# Test of JSON_ARRAY_INSERT function.
# ----------------------------------------------------------------------
select json_array_insert(NULL, '$.b[1]', 1);
json_array_insert(NULL, '$.b[1]', 1)
NULL
select json_array_insert('[1,2,3]', NULL, 1);
json_array_insert('[1,2,3]', NULL, 1)
NULL
select json_array_insert('[1,2,3]', '$[3]', NULL);
json_array_insert('[1,2,3]', '$[3]', NULL)
[1, 2, 3, null]
select json_array_insert(NULL);
ERROR 42000: Incorrect parameter count in the call to native function 'json_array_insert'
select json_array_insert(NULL, NULL);
ERROR 42000: Incorrect parameter count in the call to native function 'json_array_insert'
select json_array_insert(NULL, NULL, NULL, NULL);
ERROR 42000: Incorrect parameter count in the call to native function 'json_array_insert'
select json_array_insert('true', '$', 1);
ERROR 42000: A path expression is not a path to a cell in an array.
select json_array_insert('true', '$.a', 1);
ERROR 42000: A path expression is not a path to a cell in an array.
select json_array_insert('true', '$.a[1].b', 1);
ERROR 42000: A path expression is not a path to a cell in an array.
select json_array_insert( 'true', '$[0]', false );
json_array_insert( 'true', '$[0]', false )
true
select json_array_insert( 'true', '$[1]', false );
json_array_insert( 'true', '$[1]', false )
true
select json_array_insert( '{ "a": true }', '$.a[0]', false );
json_array_insert( '{ "a": true }', '$.a[0]', false )
{"a": true}
select json_array_insert( '{ "a": true }', '$.a[1]', false );
json_array_insert( '{ "a": true }', '$.a[1]', false )
{"a": true}
select json_array_insert( '[]', '$[0]', false );
json_array_insert( '[]', '$[0]', false )
[false]
select json_array_insert( '[]', '$[1]', false );
json_array_insert( '[]', '$[1]', false )
[false]
select json_array_insert( '[true]', '$[0]', false );
json_array_insert( '[true]', '$[0]', false )
[false, true]
select json_array_insert( '[true]', '$[1]', false );
json_array_insert( '[true]', '$[1]', false )
[true, false]
select json_array_insert( '[true]', '$[2]', false );
json_array_insert( '[true]', '$[2]', false )
[true, false]
select json_array_insert( '{ "a": [] }', '$.a[0]', false );
json_array_insert( '{ "a": [] }', '$.a[0]', false )
{"a": [false]}
select json_array_insert( '{ "a": [] }', '$.a[1]', false );
json_array_insert( '{ "a": [] }', '$.a[1]', false )
{"a": [false]}
select json_array_insert( '{ "a": [true] }', '$.a[0]', false );
json_array_insert( '{ "a": [true] }', '$.a[0]', false )
{"a": [false, true]}
select json_array_insert( '{ "a": [true] }', '$.a[1]', false );
json_array_insert( '{ "a": [true] }', '$.a[1]', false )
{"a": [true, false]}
select json_array_insert( '{ "a": [true] }', '$.a[2]', false );
json_array_insert( '{ "a": [true] }', '$.a[2]', false )
{"a": [true, false]}
select json_array_insert( '[1, 2, 3, 4]', '$[0]', false );
json_array_insert( '[1, 2, 3, 4]', '$[0]', false )
[false, 1, 2, 3, 4]
select json_array_insert( '[1, 2, 3, 4]', '$[1]', false );
json_array_insert( '[1, 2, 3, 4]', '$[1]', false )
[1, false, 2, 3, 4]
select json_array_insert( '[1, 2, 3, 4]', '$[2]', false );
json_array_insert( '[1, 2, 3, 4]', '$[2]', false )
[1, 2, false, 3, 4]
select json_array_insert( '[1, 2, 3, 4]', '$[3]', false );
json_array_insert( '[1, 2, 3, 4]', '$[3]', false )
[1, 2, 3, false, 4]
select json_array_insert( '[1, 2, 3, 4]', '$[4]', false );
json_array_insert( '[1, 2, 3, 4]', '$[4]', false )
[1, 2, 3, 4, false]
select json_array_insert( '[1, 2, 3, 4]', '$[5]', false );
json_array_insert( '[1, 2, 3, 4]', '$[5]', false )
[1, 2, 3, 4, false]
select json_array_insert( '{ "a": [1, 2, 3, 4] }', '$.a[0]', false );
json_array_insert( '{ "a": [1, 2, 3, 4] }', '$.a[0]', false )
{"a": [false, 1, 2, 3, 4]}
select json_array_insert( '{ "a": [1, 2, 3, 4] }', '$.a[1]', false );
json_array_insert( '{ "a": [1, 2, 3, 4] }', '$.a[1]', false )
{"a": [1, false, 2, 3, 4]}
select json_array_insert( '{ "a": [1, 2, 3, 4] }', '$.a[2]', false );
json_array_insert( '{ "a": [1, 2, 3, 4] }', '$.a[2]', false )
{"a": [1, 2, false, 3, 4]}
select json_array_insert( '{ "a": [1, 2, 3, 4] }', '$.a[3]', false );
json_array_insert( '{ "a": [1, 2, 3, 4] }', '$.a[3]', false )
{"a": [1, 2, 3, false, 4]}
select json_array_insert( '{ "a": [1, 2, 3, 4] }', '$.a[4]', false );
json_array_insert( '{ "a": [1, 2, 3, 4] }', '$.a[4]', false )
{"a": [1, 2, 3, 4, false]}
select json_array_insert( '{ "a": [1, 2, 3, 4] }', '$.a[5]', false );
json_array_insert( '{ "a": [1, 2, 3, 4] }', '$.a[5]', false )
{"a": [1, 2, 3, 4, false]}
select json_array_insert( '{ "a": [1, 2, 3, 4] }', '$.b[0]', false );
json_array_insert( '{ "a": [1, 2, 3, 4] }', '$.b[0]', false )
{"a": [1, 2, 3, 4]}
select json_array_insert( '{ "a": [1, 2, 3, 4] }', '$.b[1]', false );
json_array_insert( '{ "a": [1, 2, 3, 4] }', '$.b[1]', false )
{"a": [1, 2, 3, 4]}
create table jdoc( id int, doc json );
insert into jdoc values
( 1, '[ [ true ], [ false ] ]' ),
( 2, '[ [ 0 ], [ 1 ] ]' ),
( 3, '[ [ "abc" ], [ "def" ] ]' );
select id, json_array_insert( doc, '$[0][1]', 'fred' )
from jdoc order by id;
id	json_array_insert( doc, '$[0][1]', 'fred' )
1	[[true, "fred"], [false]]
2	[[0, "fred"], [1]]
3	[["abc", "fred"], ["def"]]
select id, json_array_insert( doc, '$[1][0]', 'fred' )
from jdoc order by id;
id	json_array_insert( doc, '$[1][0]', 'fred' )
1	[[true], ["fred", false]]
2	[[0], ["fred", 1]]
3	[["abc"], ["fred", "def"]]
drop table jdoc;
create table t( id int, v varchar(10));
insert into t values (1, 'a'), (2, null), (3, 'a');
select id v, json_array_insert('[[1]]', '$[0][0]', v) from t order by id;
v	json_array_insert('[[1]]', '$[0][0]', v)
1	[["a", 1]]
2	[[null, 1]]
3	[["a", 1]]
drop table t;
select json_array_insert( '"a"', '$[0]', true );
json_array_insert( '"a"', '$[0]', true )
"a"
select json_array_insert( '[ "a" ]', '$[0][0]', true );
json_array_insert( '[ "a" ]', '$[0][0]', true )
["a"]
select json_array_insert( '"a"', '$[1]', true );
json_array_insert( '"a"', '$[1]', true )
"a"
select json_insert('[]', '$.a.*[1]', 6);
ERROR 42000: In this situation, path expressions may not contain the * and ** tokens.
select json_insert('[]', '$**[1]', 6);
ERROR 42000: In this situation, path expressions may not contain the * and ** tokens.
select json_insert('[]', '$[*][1]', 6);
ERROR 42000: In this situation, path expressions may not contain the * and ** tokens.
select json_array_insert( '[ 1, 2, 3 ]', '$[1]', true, '$[1]', false );
json_array_insert( '[ 1, 2, 3 ]', '$[1]', true, '$[1]', false )
[1, false, true, 2, 3]
select json_array_insert( '[ 1, 2, 3 ]', '$[1]',
cast( '[ "a", "b", "c", "d" ]' as json ), '$[1][2]', false );
json_array_insert( '[ 1, 2, 3 ]', '$[1]',
cast( '[ "a", "b", "c", "d" ]' as json ), '$[1][2]', false )
[1, ["a", "b", false, "c", "d"], 2, 3]
SELECT JSON_ARRAY_INSERT(JSON_EXTRACT('[1', '$'), '$[0]', 1);
ERROR 22032: Invalid JSON text in argument 1 to function json_extract: "Missing a comma or ']' after an array element." at position 2.
select json_array_insert( '[ 1, 2, 3 ]', '$[1]', json_extract( '[', '$' ) );
ERROR 22032: Invalid JSON text in argument 1 to function json_extract: "Invalid value." at position 1.
# ----------------------------------------------------------------------
# Test of JSON_SET function.
# ----------------------------------------------------------------------
select json_set(NULL, '$.b', cast(1 as json));
json_set(NULL, '$.b', cast(1 as json))
NULL
select json_set('[1,2,3]', NULL, cast(1 as json));
json_set('[1,2,3]', NULL, cast(1 as json))
NULL
select json_set('[1,2,3]', '$[3]', NULL);
json_set('[1,2,3]', '$[3]', NULL)
[1, 2, 3, null]
select json_set(NULL);
ERROR 42000: Incorrect parameter count in the call to native function 'json_set'
select json_set(NULL, NULL);
ERROR 42000: Incorrect parameter count in the call to native function 'json_set'
select json_set(NULL, NULL, NULL, NULL);
ERROR 42000: Incorrect parameter count in the call to native function 'json_set'
SELECT JSON_SET('{}', '$.name', JSON_EXTRACT('', '$'));
ERROR 22032: Invalid JSON text in argument 1 to function json_extract: "The document is empty." at position 0.
select json_set('[1,2,3]', '$[2]', 4);
json_set('[1,2,3]', '$[2]', 4)
[1, 2, 4]
select json_set('[1,2,3]', '$[3]', 4);
json_set('[1,2,3]', '$[3]', 4)
[1, 2, 3, 4]
select json_set('[1,2,3]', '$[10]', 4);
json_set('[1,2,3]', '$[10]', 4)
[1, 2, 3, 4]
select json_set('{"c":4}', '$.c', 5);
json_set('{"c":4}', '$.c', 5)
{"c": 5}
select json_set('{"c":4}', '$.a', 5);
json_set('{"c":4}', '$.a', 5)
{"a": 5, "c": 4}
select json_set('1', '$', 4);
json_set('1', '$', 4)
4
select json_set('1', '$[0]', 4);
json_set('1', '$[0]', 4)
4
select json_set('1', '$[1]', 4);
json_set('1', '$[1]', 4)
[1, 4]
select json_set('1', '$[10]', '4', '$[11]', 5);
json_set('1', '$[10]', '4', '$[11]', 5)
[1, "4", 5]
select json_set('[1,2,3]', '$[2][0]', 4);
json_set('[1,2,3]', '$[2][0]', 4)
[1, 2, 4]
select json_set('[1,2,3]', '$[2][2]', 4);
json_set('[1,2,3]', '$[2][2]', 4)
[1, 2, [3, 4]]
select json_set('{"a": 3}', '$.a[0]', 4);
json_set('{"a": 3}', '$.a[0]', 4)
{"a": 4}
select json_set('{"a": 3}', '$.a[1]', 4, '$.a[2]', '5');
json_set('{"a": 3}', '$.a[1]', 4, '$.a[2]', '5')
{"a": [3, 4, "5"]}
select json_set(cast('{"a": {"b": [3]}}' as json), '$**[1]', 6);
ERROR 42000: In this situation, path expressions may not contain the * and ** tokens.
SELECT JSON_SET('{ "a" : "foo", "b" : [ 1, 2, 3 ] }',
'$.a',
JSON_OBJECT());
JSON_SET('{ "a" : "foo", "b" : [ 1, 2, 3 ] }',
'$.a',
JSON_OBJECT())
{"a": {}, "b": [1, 2, 3]}
SELECT JSON_SET('{ "a" : "foo"}', '$.a',
JSON_OBJECT( 'b', false ), '$.a.c', true);
JSON_SET('{ "a" : "foo"}', '$.a',
JSON_OBJECT( 'b', false ), '$.a.c', true)
{"a": {"b": false, "c": true}}
select json_set('{ "a" : "foo", "b" : [ 1, 2, 3 ] }',
'$.a',
cast('{}' as json));
json_set('{ "a" : "foo", "b" : [ 1, 2, 3 ] }',
'$.a',
cast('{}' as json))
{"a": {}, "b": [1, 2, 3]}
select json_set('{ "a" : "foo", "b" : [ 1, 2, 3 ] }',
'$.c',
cast('[true, false]' as json));
json_set('{ "a" : "foo", "b" : [ 1, 2, 3 ] }',
'$.c',
cast('[true, false]' as json))
{"a": "foo", "b": [1, 2, 3], "c": [true, false]}
select json_set('1', '$[3]', 2);
json_set('1', '$[3]', 2)
[1, 2]
select json_set('{ "a" : "foo"}', '$.a',
cast('{"b": false}' as json), '$.a.c', true);
json_set('{ "a" : "foo"}', '$.a',
cast('{"b": false}' as json), '$.a.c', true)
{"a": {"b": false, "c": true}}
SELECT JSON_SET
(
'{ "a" : "foo", "b" : [ 1, 2, 3 ] }',
'$.a',
JSON_OBJECT()
);
JSON_SET
(
'{ "a" : "foo", "b" : [ 1, 2, 3 ] }',
'$.a',
JSON_OBJECT()
)
{"a": {}, "b": [1, 2, 3]}
SELECT JSON_SET
(
'{ "a" : "foo", "b" : [ 1, 2, 3 ] }',
'$.c',
JSON_ARRAY( true, false )
);
JSON_SET
(
'{ "a" : "foo", "b" : [ 1, 2, 3 ] }',
'$.c',
JSON_ARRAY( true, false )
)
{"a": "foo", "b": [1, 2, 3], "c": [true, false]}
SELECT JSON_SET
(
'{ "a" : "foo", "b" : [ 1, 2, 3 ] }',
'$.c',
JSON_ARRAY( CAST( 'true' AS JSON ), CAST( 'false' AS JSON ) )
);
JSON_SET
(
'{ "a" : "foo", "b" : [ 1, 2, 3 ] }',
'$.c',
JSON_ARRAY( CAST( 'true' AS JSON ), CAST( 'false' AS JSON ) )
)
{"a": "foo", "b": [1, 2, 3], "c": [true, false]}
SELECT JSON_SET
(
'1',
'$[3]',
2
);
JSON_SET
(
'1',
'$[3]',
2
)
[1, 2]
SELECT JSON_SET
(
'{ "a" : "foo"}',
'$.a', JSON_OBJECT( 'b', false ),
'$.a.c', true
);
JSON_SET
(
'{ "a" : "foo"}',
'$.a', JSON_OBJECT( 'b', false ),
'$.a.c', true
)
{"a": {"b": false, "c": true}}
#
# Bug #21304639: JSON_SET() WITH MULTI-LEG PATH RETURNS DIFFERENT
#                RESULTS ON FIRST ROW VS NEXT
#
create table t21304639(pk int);
insert into t21304639 values (2), (1), (3);
select json_set(
json_object('existing', pk),
'$.key_b.test',
json_object('new', 'apple')
) as field1 from t21304639;
field1
{"existing": 2}
{"existing": 1}
{"existing": 3}
select json_set(
json_object('existing', pk),
'$.key_b.test',
json_object('new', 'apple')
) as field1 from t21304639 order by field1;
field1
{"existing": 2}
{"existing": 3}
{"existing": 1}
Warnings:
Warning	1235	This version of MySQL doesn't yet support 'sorting of non-scalar JSON values'
drop table t21304639;
# ----------------------------------------------------------------------
# Test of JSON_REPLACE function.
# ----------------------------------------------------------------------
select json_replace(NULL, '$.b', cast(1 as json));
json_replace(NULL, '$.b', cast(1 as json))
NULL
select json_replace('[1,2,3]', NULL, cast(1 as json));
json_replace('[1,2,3]', NULL, cast(1 as json))
NULL
select json_replace('[1,2,3]', '$[2]', NULL);
json_replace('[1,2,3]', '$[2]', NULL)
[1, 2, null]
select json_replace(NULL);
ERROR 42000: Incorrect parameter count in the call to native function 'json_replace'
select json_replace(NULL, NULL);
ERROR 42000: Incorrect parameter count in the call to native function 'json_replace'
select json_replace(NULL, NULL, NULL, NULL);
ERROR 42000: Incorrect parameter count in the call to native function 'json_replace'
select json_replace('[1,2,3]', '$[2]', 4);
json_replace('[1,2,3]', '$[2]', 4)
[1, 2, 4]
select json_replace('[1,2,3]', '$[3]', 4);
json_replace('[1,2,3]', '$[3]', 4)
[1, 2, 3]
select json_replace('[1,2,3]', '$[10]', 4);
json_replace('[1,2,3]', '$[10]', 4)
[1, 2, 3]
select json_replace('{"c":4}', '$.c', 5);
json_replace('{"c":4}', '$.c', 5)
{"c": 5}
select json_replace('{"c":4}', '$.a', 5);
json_replace('{"c":4}', '$.a', 5)
{"c": 4}
select json_replace('1', '$', 4);
json_replace('1', '$', 4)
4
select json_replace('1', '$[0]', 4);
json_replace('1', '$[0]', 4)
4
select json_replace('1', '$[1]', 4);
json_replace('1', '$[1]', 4)
1
select json_replace('1', '$[10]', '4', '$[11]', 5);
json_replace('1', '$[10]', '4', '$[11]', 5)
1
select json_replace('[1,2,3]', '$[2][0]', 4);
json_replace('[1,2,3]', '$[2][0]', 4)
[1, 2, 4]
select json_replace('[1,2,3]', '$[2][2]', 4);
json_replace('[1,2,3]', '$[2][2]', 4)
[1, 2, 3]
select json_replace('{"a": 3}', '$.a[0]', 4);
json_replace('{"a": 3}', '$.a[0]', 4)
{"a": 4}
select json_replace('{"a": 3}', '$.a[1]', 4, '$.a[2]', '5');
json_replace('{"a": 3}', '$.a[1]', 4, '$.a[2]', '5')
{"a": 3}
SELECT JSON_REPLACE('{ "a" : "foo", "b" : [ 1, 2, 3 ] }',
'$.c',
true);
JSON_REPLACE('{ "a" : "foo", "b" : [ 1, 2, 3 ] }',
'$.c',
true)
{"a": "foo", "b": [1, 2, 3]}
SELECT JSON_REPLACE('{ "a" : "foo", "b" : [ 1, 2, 3 ] }',
'$.a[0]',
true);
JSON_REPLACE('{ "a" : "foo", "b" : [ 1, 2, 3 ] }',
'$.a[0]',
true)
{"a": true, "b": [1, 2, 3]}
SELECT JSON_REPLACE('{ "a" : "foo", "b" : [ 1, 2, 3 ] }',
'$.b[5]',
true);
JSON_REPLACE('{ "a" : "foo", "b" : [ 1, 2, 3 ] }',
'$.b[5]',
true)
{"a": "foo", "b": [1, 2, 3]}
# ----------------------------------------------------------------------
# Test of JSON_ARRAY function.
# ----------------------------------------------------------------------
select json_array(NULL, '$.b', cast(1 as json));
json_array(NULL, '$.b', cast(1 as json))
[null, "$.b", 1]
select json_array('[1,2,3]', NULL, cast(1 as json));
json_array('[1,2,3]', NULL, cast(1 as json))
["[1,2,3]", null, 1]
select json_array('[1,2,3]', '$[3]', NULL);
json_array('[1,2,3]', '$[3]', NULL)
["[1,2,3]", "$[3]", null]
select json_array();
json_array()
[]
select json_array(3.14);
json_array(3.14)
[3.14]
select json_array('[1,2,3]');
json_array('[1,2,3]')
["[1,2,3]"]
select json_array(cast('[1,2,3]' as json));
json_array(cast('[1,2,3]' as json))
[[1, 2, 3]]
select json_array(1,2,3);
json_array(1,2,3)
[1, 2, 3]
select json_array(b'0', b'1', b'10');
json_array(b'0', b'1', b'10')
["base64:type16:AA==", "base64:type16:AQ==", "base64:type16:Ag=="]
create table t (i int, j json, d double);
insert into t values (3, '["a", "b"]', 3.14);
select json_array(i, j, d) from t;
json_array(i, j, d)
[3, ["a", "b"], 3.14]
drop table t;
CREATE TABLE t(j JSON);
INSERT INTO t VALUES (JSON_ARRAY(-9223372036854775808, 18446744073709551614));
SELECT * FROM t;
j
[-9223372036854775808, 18446744073709551614]
DROP TABLE t;
create table department( id int, deptName varchar(50), isExempt boolean, blobColumn blob );
insert into department values ( 405, 'Accounting', true, '<a><b>ccc</b><d></d></a>' );
SELECT JSON_ARRAY();
JSON_ARRAY()
[]
SELECT JSON_ARRAY( d.deptName, CAST( '{ "processed" : true }' AS JSON ) )
FROM department d
WHERE id = 405;
JSON_ARRAY( d.deptName, CAST( '{ "processed" : true }' AS JSON ) )
["Accounting", {"processed": true}]
create table json_table( json_column json );
INSERT INTO json_table( json_column )
SELECT JSON_ARRAY( d.deptName, d.id, d.blobColumn )
FROM department d
WHERE id = 405;
drop table json_table;
drop table department;
create table misc_dt
(
id int, py polygon
);
insert into misc_dt values
(
1, ST_GeomFromText('POLYGON((0 0,10 0,10 10,0 10,0 0),
    (5 5,7 5,7 7,5 7, 5 5))')
),
(
2, null
);
select id, json_array( true, py, false ) from misc_dt order by id;
id	json_array( true, py, false )
1	[true, {"type": "Polygon", "coordinates": [[[0, 0], [10, 0], [10, 10], [0, 10], [0, 0]], [[5, 5], [7, 5], [7, 7], [5, 7], [5, 5]]]}, false]
2	[true, null, false]
drop table misc_dt;
# ----------------------------------------------------------------------
# Test of JSON_OBJECT function.
# ----------------------------------------------------------------------
select json_object( 'a' );
ERROR 42000: Incorrect parameter count in the call to native function 'json_object'
select json_object( 'a', 1, 'b' );
ERROR 42000: Incorrect parameter count in the call to native function 'json_object'
select json_object( null, 1 );
ERROR 22032: JSON documents may not contain NULL member names.
select json_object();
json_object()
{}
select json_object( 'a', null );
json_object( 'a', null )
{"a": null}
select json_object( 'a', 1 );
json_object( 'a', 1 )
{"a": 1}
select json_object( 'a', 1, 'b', 'foo' );
json_object( 'a', 1, 'b', 'foo' )
{"a": 1, "b": "foo"}
select json_object( 'a', 1, 'b', 'foo', 'c', cast( '{ "d": "wibble" }' as json ) );
json_object( 'a', 1, 'b', 'foo', 'c', cast( '{ "d": "wibble" }' as json ) )
{"a": 1, "b": "foo", "c": {"d": "wibble"}}
select json_object( 'a', true, 'b', false, 'c', cast( 'null' as json) );
json_object( 'a', true, 'b', false, 'c', cast( 'null' as json) )
{"a": true, "b": false, "c": null}
select json_valid( json_object( '"a"', 1 ) );
json_valid( json_object( '"a"', 1 ) )
1
select json_object( REPEAT('a', 64 * 1024), 1 );
json_object( REPEAT('a', 64 * 1024), 1 )
{"aaaaaaaaaaaaaaaaaaaaaaaaaaaaaaaaaaaaaaaaaaaaaaaaaaaaaaaaaaaaaaaaaaaaaaaaaaaaaaaaaaaaaaaaaaaaaaaaaaaaaaaaaaaaaaaaaaaaaaaaaaaaaaaaaaaaaaaaaaaaaaaaaaaaaaaaaaaaaaaaaaaaaaaaaaaaaaaaaaaaaaaaaaaaaaaaaaaaaaaaaaaaaaaaaaaaaaaaaaaaaaaaaaaaaaaaaaaaaaaaaaaaaaaaaaaaaaaaaaaaaaaaaaaaaaaaaaaaaaaaaaaaaaaaaaaaaaaaaaaaaaaaaaaaaaaaaaaaaaaaaaaaaaaaaaaaaaaaaaaaaaaaaaaaaaaaaaaaaaaaaaaaaaaaaaaaaaaaaaaaaaaaaaaaaaaaaaaaaaaaaaaaaaaaaaaaaaaaaaaaaaaaaaaaaaaaaaaaaaaaaaaaaaaaaaaaaaaaaaaaaaaaaaaaaaaaaaaaaaaaaaaaaaaaaaaaaaaaaaaaaaaaaaaaaaaaaaaaaaaaaaaaaaaaaaaaaaaaaaaaaaaaaaaaaaaaaaaaaaaaaaaaaaaaaaaaaaaaaaaaaaaaaaaaaaaaaaaaaaaaaaaaaaaaaaaaaaaaaaaaaaaaaaaaaaaaaaaaaaaaaaaaaaaaaaaaaaaaaaaaaaaaaaaaaaaaaaaaaaaaaaaaaaaaaaaaaaaaaaaaaaaaaaaaaaaaaaaaaaaaaaaaaaaaaaaaaaaaaaaaaaaaaaaaaaaaaaaaaaaaaaaaaaaaaaaaaaaaaaaaaaaaaaaaaaaaaaaaaaaaaaaaaaaaaaaaaaaaaaaaaaaaaaaaaaaaaaaaaaaaaaaaaaaaaaaaaaaaaaaaaaaaaaaaaaaaaaaaaaaaaaaaaaaaaaaaaaaaaaaaaaaaaaaaaaaaaaaaaaaaaaaaaaaaaaaaaaaaaaaaaaaaaaaaaaaaaaaaaaaaaaaaaaaaaaaaaaaaaaaaaaaaaaaaaaaaaaaaaaaaaaaaaaaaaaaaaaaaaaaaaaaaaaaaaaaaaaaaaaaaaaaaaaaaaaaaaaaaaaaaaaaaaaaaaaaaaaaaaaaaaaaaaaaaaaaaaaaaaaaaaaaaaaaaaaaaaaaaaaaaaaaaaaaaaaaaaaaaaaaaaaaaaaaaaaaaaaaaaaaaaaaaaaaaaaaaaaaaaaaaaaaaaaaaaaaaaaaaaaaaaaaaaaaaaaaaaaaaaaaaaaaaaaaaaaaaaaaaaaaaaaaaaaaaaaaaaaaaaaaaaaaaaaaaaaaaaaaaaaaaaaaaaaaaaaaaaaaaaaaaaaaaaaaaaaaaaaaaaaaaaaaaaaaaaaaaaaaaaaaaaaaaaaaaaaaaaaaaaaaaaaaaaaaaaaaaaaaaaaaaaaaaaaaaaaaaaaaaaaaaaaaaaaaaaaaaaaaaaaaaaaaaaaaaaaaaaaaaaaaaaaaaaaaaaaaaaaaaaaaaaaaaaaaaaaaaaaaaaaaaaaaaaaaaaaaaaaaaaaaaaaaaaaaaaaaaaaaaaaaaaaaaaaaaaaaaaaaaaaaaaaaaaaaaaaaaaaaaaaaaaaaaaaaaaaaaaaaaaaaaaaaaaaaaaaaaaaaaaaaaaaaaaaaaaaaaaaaaaaaaaaaaaaaaaaaaaaaaaaaaaaaaaaaaaaaaaaaaaaaaaaaaaaaaaaaaaaaaaaaaaaaaaaaaaaaaaaaaaaaaaaaaaaaaaaaaaaaaaaaaaaaaaaaaaaaaaaaaaaaaaaaaaaaaaaaaaaaaaaaaaaaaaaaaaaaaaaaaaaaaaaaaaaaaaaaaaaaaaaaaaaaaaaaaaaaaaaaaaaaaaaaaaaaaaaaaaaaaaaaaaaaaaaaaaaaaaaaaaaaaaaaaaaaaaaaaaaaaaaaaaaaaaaaaaaaaaaaaaaaaaaaaaaaaaaaaaaaaaaaaaaaaaaaaaaaaaaaaaaaaaaaaaaaaaaaaaaaaaaaaaaaaaaaaaaaaaaaaaaaaaaaaaaaaaaaaaaaaaaaaaaaaaaaaaaaaaaaaaaaaaaaaaaaaaaaaaaaaaaaaaaaaaaaaaaaaaaaaaaaaaaaaaaaaaaaaaaaaaaaaaaaaaaaaaaaaaaaaaaaaaaaaaaaaaaaaaaaaaaaaaaaaaaaaaaaaaaaaaaaaaaaaaaaaaaaaaaaaaaaaaaaaaaaaaaaaaaaaaaaaaaaaaaaaaaaaaaaaaaaaaaaaaaaaaaaaaaaaaaaaaaaaaaaaaaaaaaaaaaaaaaaaaaaaaaaaaaaaaaaaaaaaaaaaaaaaaaaaaaaaaaaaaaaaaaaaaaaaaaaaaaaaaaaaaaaaaaaaaaaaaaaaaaaaaaaaaaaaaaaaaaaaaaaaaaaaaaaaaaaaaaaaaaaaaaaaaaaaaaaaaaaaaaaaaaaaaaaaaaaaaaaaaaaaaaaaaaaaaaaaaaaaaaaaaaaaaaaaaaaaaaaaaaaaaaaaaaaaaaaaaaaaaaaaaaaaaaaaaaaaaaaaaaaaaaaaaaaaaaaaaaaaaaaaaaaaaaaaaaaaaaaaaaaaaaaaaaaaaaaaaaaaaaaaaaaaaaaaaaaaaaaaaaaaaaaaaaaaaaaaaaaaaaaaaaaaaaaaaaaaaaaaaaaaaaaaaaaaaaaaaaaaaaaaaaaaaaaaaaaaaaaaaaaaaaaaaaaaaaaaaaaaaaaaaaaaaaaaaaaaaaaaaaaaaaaaaaaaaaaaaaaaaaaaaaaaaaaaaaaaaaaaaaaaaaaaaaaaaaaaaaaaaaaaaaaaaaaaaaaaaaaaaaaaaaaaaaaaaaaaaaaaaaaaaaaaaaaaaaaaaaaaaaaaaaaaaaaaaaaaaaaaaaaaaaaaaaaaaaaaaaaaaaaaaaaaaaaaaaaaaaaaaaaaaaaaaaaaaaaaaaaaaaaaaaaaaaaaaaaaaaaaaaaaaaaaaaaaaaaaaaaaaaaaaaaaaaaaaaaaaaaaaaaaaaaaaaaaaaaaaaaaaaaaaaaaaaaaaaaaaaaaaaaaaaaaaaaaaaaaaaaaaaaaaaaaaaaaaaaaaaaaaaaaaaaaaaaaaaaaaaaaaaaaaaaaaaaaaaaaaaaaaaaaaaaaaaaaaaaaaaaaaaaaaaaaaaaaaaaaaaaaaaaaaaaaaaaaaaaaaaaaaaaaaaaaaaaaaaaaaaaaaaaaaaaaaaaaaaaaaaaaaaaaaaaaaaaaaaaaaaaaaaaaaaaaaaaaaaaaaaaaaaaaaaaaaaaaaaaaaaaaaaaaaaaaaaaaaaaaaaaaaaaaaaaaaaaaaaaaaaaaaaaaaaaaaaaaaaaaaaaaaaaaaaaaaaaaaaaaaaaaaaaaaaaaaaaaaaaaaaaaaaaaaaaaaaaaaaaaaaaaaaaaaaaaaaaaaaaaaaaaaaaaaaaaaaaaaaaaaaaaaaaaaaaaaaaaaaaaaaaaaaaaaaaaaaaaaaaaaaaaaaaaaaaaaaaaaaaaaaaaaaaaaaaaaaaaaaaaaaaaaaaaaaaaaaaaaaaaaaaaaaaaaaaaaaaaaaaaaaaaaaaaaaaaaaaaaaaaaaaaaaaaaaaaaaaaaaaaaaaaaaaaaaaaaaaaaaaaaaaaaaaaaaaaaaaaaaaaaaaaaaaaaaaaaaaaaaaaaaaaaaaaaaaaaaaaaaaaaaaaaaaaaaaaaaaaaaaaaaaaaaaaaaaaaaaaaaaaaaaaaaaaaaaaaaaaaaaaaaaaaaaaaaaaaaaaaaaaaaaaaaaaaaaaaaaaaaaaaaaaaaaaaaaaaaaaaaaaaaaaaaaaaaaaaaaaaaaaaaaaaaaaaaaaaaaaaaaaaaaaaaaaaaaaaaaaaaaaaaaaaaaaaaaaaaaaaaaaaaaaaaaaaaaaaaaaaaaaaaaaaaaaaaaaaaaaaaaaaaaaaaaaaaaaaaaaaaaaaaaaaaaaaaaaaaaaaaaaaaaaaaaaaaaaaaaaaaaaaaaaaaaaaaaaaaaaaaaaaaaaaaaaaaaaaaaaaaaaaaaaaaaaaaaaaaaaaaaaaaaaaaaaaaaaaaaaaaaaaaaaaaaaaaaaaaaaaaaaaaaaaaaaaaaaaaaaaaaaaaaaaaaaaaaaaaaaaaaaaaaaaaaaaaaaaaaaaaaaaaaaaaaaaaaaaaaaaaaaaaaaaaaaaaaaaaaaaaaaaaaaaaaaaaaaaaaaaaaaaaaaaaaaaaaaaaaaaaaaaaaaaaaaaaaaaaaaaaaaaaaaaaaaaaaaaaaaaaaaaaaaaaaaaaaaaaaaaaaaaaaaaaaaaaaaaaaaaaaaaaaaaaaaaaaaaaaaaaaaaaaaaaaaaaaaaaaaaaaaaaaaaaaaaaaaaaaaaaaaaaaaaaaaaaaaaaaaaaaaaaaaaaaaaaaaaaaaaaaaaaaaaaaaaaaaaaaaaaaaaaaaaaaaaaaaaaaaaaaaaaaaaaaaaaaaaaaaaaaaaaaaaaaaaaaaaaaaaaaaaaaaaaaaaaaaaaaaaaaaaaaaaaaaaaaaaaaaaaaaaaaaaaaaaaaaaaaaaaaaaaaaaaaaaaaaaaaaaaaaaaaaaaaaaaaaaaaaaaaaaaaaaaaaaaaaaaaaaaaaaaaaaaaaaaaaaaaaaaaaaaaaaaaaaaaaaaaaaaaaaaaaaaaaaaaaaaaaaaaaaaaaaaaaaaaaaaaaaaaaaaaaaaaaaaaaaaaaaaaaaaaaaaaaaaaaaaaaaaaaaaaaaaaaaaaaaaaaaaaaaaaaaaaaaaaaaaaaaaaaaaaaaaaaaaaaaaaaaaaaaaaaaaaaaaaaaaaaaaaaaaaaaaaaaaaaaaaaaaaaaaaaaaaaaaaaaaaaaaaaaaaaaaaaaaaaaaaaaaaaaaaaaaaaaaaaaaaaaaaaaaaaaaaaaaaaaaaaaaaaaaaaaaaaaaaaaaaaaaaaaaaaaaaaaaaaaaaaaaaaaaaaaaaaaaaaaaaaaaaaaaaaaaaaaaaaaaaaaaaaaaaaaaaaaaaaaaaaaaaaaaaaaaaaaaaaaaaaaaaaaaaaaaaaaaaaaaaaaaaaaaaaaaaaaaaaaaaaaaaaaaaaaaaaaaaaaaaaaaaaaaaaaaaaaaaaaaaaaaaaaaaaaaaaaaaaaaaaaaaaaaaaaaaaaaaaaaaaaaaaaaaaaaaaaaaaaaaaaaaaaaaaaaaaaaaaaaaaaaaaaaaaaaaaaaaaaaaaaaaaaaaaaaaaaaaaaaaaaaaaaaaaaaaaaaaaaaaaaaaaaaaaaaaaaaaaaaaaaaaaaaaaaaaaaaaaaaaaaaaaaaaaaaaaaaaaaaaaaaaaaaaaaaaaaaaaaaaaaaaaaaaaaaaaaaaaaaaaaaaaaaaaaaaaaaaaaaaaaaaaaaaaaaaaaaaaaaaaaaaaaaaaaaaaaaaaaaaaaaaaaaaaaaaaaaaaaaaaaaaaaaaaaaaaaaaaaaaaaaaaaaaaaaaaaaaaaaaaaaaaaaaaaaaaaaaaaaaaaaaaaaaaaaaaaaaaaaaaaaaaaaaaaaaaaaaaaaaaaaaaaaaaaaaaaaaaaaaaaaaaaaaaaaaaaaaaaaaaaaaaaaaaaaaaaaaaaaaaaaaaaaaaaaaaaaaaaaaaaaaaaaaaaaaaaaaaaaaaaaaaaaaaaaaaaaaaaaaaaaaaaaaaaaaaaaaaaaaaaaaaaaaaaaaaaaaaaaaaaaaaaaaaaaaaaaaaaaaaaaaaaaaaaaaaaaaaaaaaaaaaaaaaaaaaaaaaaaaaaaaaaaaaaaaaaaaaaaaaaaaaaaaaaaaaaaaaaaaaaaaaaaaaaaaaaaaaaaaaaaaaaaaaaaaaaaaaaaaaaaaaaaaaaaaaaaaaaaaaaaaaaaaaaaaaaaaaaaaaaaaaaaaaaaaaaaaaaaaaaaaaaaaaaaaaaaaaaaaaaaaaaaaaaaaaaaaaaaaaaaaaaaaaaaaaaaaaaaaaaaaaaaaaaaaaaaaaaaaaaaaaaaaaaaaaaaaaaaaaaaaaaaaaaaaaaaaaaaaaaaaaaaaaaaaaaaaaaaaaaaaaaaaaaaaaaaaaaaaaaaaaaaaaaaaaaaaaaaaaaaaaaaaaaaaaaaaaaaaaaaaaaaaaaaaaaaaaaaaaaaaaaaaaaaaaaaaaaaaaaaaaaaaaaaaaaaaaaaaaaaaaaaaaaaaaaaaaaaaaaaaaaaaaaaaaaaaaaaaaaaaaaaaaaaaaaaaaaaaaaaaaaaaaaaaaaaaaaaaaaaaaaaaaaaaaaaaaaaaaaaaaaaaaaaaaaaaaaaaaaaaaaaaaaaaaaaaaaaaaaaaaaaaaaaaaaaaaaaaaaaaaaaaaaaaaaaaaaaaaaaaaaaaaaaaaaaaaaaaaaaaaaaaaaaaaaaaaaaaaaaaaaaaaaaaaaaaaaaaaaaaaaaaaaaaaaaaaaaaaaaaaaaaaaaaaaaaaaaaaaaaaaaaaaaaaaaaaaaaaaaaaaaaaaaaaaaaaaaaaaaaaaaaaaaaaaaaaaaaaaaaaaaaaaaaaaaaaaaaaaaaaaaaaaaaaaaaaaaaaaaaaaaaaaaaaaaaaaaaaaaaaaaaaaaaaaaaaaaaaaaaaaaaaaaaaaaaaaaaaaaaaaaaaaaaaaaaaaaaaaaaaaaaaaaaaaaaaaaaaaaaaaaaaaaaaaaaaaaaaaaaaaaaaaaaaaaaaaaaaaaaaaaaaaaaaaaaaaaaaaaaaaaaaaaaaaaaaaaaaaaaaaaaaaaaaaaaaaaaaaaaaaaaaaaaaaaaaaaaaaaaaaaaaaaaaaaaaaaaaaaaaaaaaaaaaaaaaaaaaaaaaaaaaaaaaaaaaaaaaaaaaaaaaaaaaaaaaaaaaaaaaaaaaaaaaaaaaaaaaaaaaaaaaaaaaaaaaaaaaaaaaaaaaaaaaaaaaaaaaaaaaaaaaaaaaaaaaaaaaaaaaaaaaaaaaaaaaaaaaaaaaaaaaaaaaaaaaaaaaaaaaaaaaaaaaaaaaaaaaaaaaaaaaaaaaaaaaaaaaaaaaaaaaaaaaaaaaaaaaaaaaaaaaaaaaaaaaaaaaaaaaaaaaaaaaaaaaaaaaaaaaaaaaaaaaaaaaaaaaaaaaaaaaaaaaaaaaaaaaaaaaaaaaaaaaaaaaaaaaaaaaaaaaaaaaaaaaaaaaaaaaaaaaaaaaaaaaaaaaaaaaaaaaaaaaaaaaaaaaaaaaaaaaaaaaaaaaaaaaaaaaaaaaaaaaaaaaaaaaaaaaaaaaaaaaaaaaaaaaaaaaaaaaaaaaaaaaaaaaaaaaaaaaaaaaaaaaaaaaaaaaaaaaaaaaaaaaaaaaaaaaaaaaaaaaaaaaaaaaaaaaaaaaaaaaaaaaaaaaaaaaaaaaaaaaaaaaaaaaaaaaaaaaaaaaaaaaaaaaaaaaaaaaaaaaaaaaaaaaaaaaaaaaaaaaaaaaaaaaaaaaaaaaaaaaaaaaaaaaaaaaaaaaaaaaaaaaaaaaaaaaaaaaaaaaaaaaaaaaaaaaaaaaaaaaaaaaaaaaaaaaaaaaaaaaaaaaaaaaaaaaaaaaaaaaaaaaaaaaaaaaaaaaaaaaaaaaaaaaaaaaaaaaaaaaaaaaaaaaaaaaaaaaaaaaaaaaaaaaaaaaaaaaaaaaaaaaaaaaaaaaaaaaaaaaaaaaaaaaaaaaaaaaaaaaaaaaaaaaaaaaaaaaaaaaaaaaaaaaaaaaaaaaaaaaaaaaaaaaaaaaaaaaaaaaaaaaaaaaaaaaaaaaaaaaaaaaaaaaaaaaaaaaaaaaaaaaaaaaaaaaaaaaaaaaaaaaaaaaaaaaaaaaaaaaaaaaaaaaaaaaaaaaaaaaaaaaaaaaaaaaaaaaaaaaaaaaaaaaaaaaaaaaaaaaaaaaaaaaaaaaaaaaaaaaaaaaaaaaaaaaaaaaaaaaaaaaaaaaaaaaaaaaaaaaaaaaaaaaaaaaaaaaaaaaaaaaaaaaaaaaaaaaaaaaaaaaaaaaaaaaaaaaaaaaaaaaaaaaaaaaaaaaaaaaaaaaaaaaaaaaaaaaaaaaaaaaaaaaaaaaaaaaaaaaaaaaaaaaaaaaaaaaaaaaaaaaaaaaaaaaaaaaaaaaaaaaaaaaaaaaaaaaaaaaaaaaaaaaaaaaaaaaaaaaaaaaaaaaaaaaaaaaaaaaaaaaaaaaaaaaaaaaaaaaaaaaaaaaaaaaaaaaaaaaaaaaaaaaaaaaaaaaaaaaaaaaaaaaaaaaaaaaaaaaaaaaaaaaaaaaaaaaaaaaaaaaaaaaaaaaaaaaaaaaaaaaaaaaaaaaaaaaaaaaaaaaaaaaaaaaaaaaaaaaaaaaaaaaaaaaaaaaaaaaaaaaaaaaaaaaaaaaaaaaaaaaaaaaaaaaaaaaaaaaaaaaaaaaaaaaaaaaaaaaaaaaaaaaaaaaaaaaaaaaaaaaaaaaaaaaaaaaaaaaaaaaaaaaaaaaaaaaaaaaaaaaaaaaaaaaaaaaaaaaaaaaaaaaaaaaaaaaaaaaaaaaaaaaaaaaaaaaaaaaaaaaaaaaaaaaaaaaaaaaaaaaaaaaaaaaaaaaaaaaaaaaaaaaaaaaaaaaaaaaaaaaaaaaaaaaaaaaaaaaaaaaaaaaaaaaaaaaaaaaaaaaaaaaaaaaaaaaaaaaaaaaaaaaaaaaaaaaaaaaaaaaaaaaaaaaaaaaaaaaaaaaaaaaaaaaaaaaaaaaaaaaaaaaaaaaaaaaaaaaaaaaaaaaaaaaaaaaaaaaaaaaaaaaaaaaaaaaaaaaaaaaaaaaaaaaaaaaaaaaaaaaaaaaaaaaaaaaaaaaaaaaaaaaaaaaaaaaaaaaaaaaaaaaaaaaaaaaaaaaaaaaaaaaaaaaaaaaaaaaaaaaaaaaaaaaaaaaaaaaaaaaaaaaaaaaaaaaaaaaaaaaaaaaaaaaaaaaaaaaaaaaaaaaaaaaaaaaaaaaaaaaaaaaaaaaaaaaaaaaaaaaaaaaaaaaaaaaaaaaaaaaaaaaaaaaaaaaaaaaaaaaaaaaaaaaaaaaaaaaaaaaaaaaaaaaaaaaaaaaaaaaaaaaaaaaaaaaaaaaaaaaaaaaaaaaaaaaaaaaaaaaaaaaaaaaaaaaaaaaaaaaaaaaaaaaaaaaaaaaaaaaaaaaaaaaaaaaaaaaaaaaaaaaaaaaaaaaaaaaaaaaaaaaaaaaaaaaaaaaaaaaaaaaaaaaaaaaaaaaaaaaaaaaaaaaaaaaaaaaaaaaaaaaaaaaaaaaaaaaaaaaaaaaaaaaaaaaaaaaaaaaaaaaaaaaaaaaaaaaaaaaaaaaaaaaaaaaaaaaaaaaaaaaaaaaaaaaaaaaaaaaaaaaaaaaaaaaaaaaaaaaaaaaaaaaaaaaaaaaaaaaaaaaaaaaaaaaaaaaaaaaaaaaaaaaaaaaaaaaaaaaaaaaaaaaaaaaaaaaaaaaaaaaaaaaaaaaaaaaaaaaaaaaaaaaaaaaaaaaaaaaaaaaaaaaaaaaaaaaaaaaaaaaaaaaaaaaaaaaaaaaaaaaaaaaaaaaaaaaaaaaaaaaaaaaaaaaaaaaaaaaaaaaaaaaaaaaaaaaaaaaaaaaaaaaaaaaaaaaaaaaaaaaaaaaaaaaaaaaaaaaaaaaaaaaaaaaaaaaaaaaaaaaaaaaaaaaaaaaaaaaaaaaaaaaaaaaaaaaaaaaaaaaaaaaaaaaaaaaaaaaaaaaaaaaaaaaaaaaaaaaaaaaaaaaaaaaaaaaaaaaaaaaaaaaaaaaaaaaaaaaaaaaaaaaaaaaaaaaaaaaaaaaaaaaaaaaaaaaaaaaaaaaaaaaaaaaaaaaaaaaaaaaaaaaaaaaaaaaaaaaaaaaaaaaaaaaaaaaaaaaaaaaaaaaaaaaaaaaaaaaaaaaaaaaaaaaaaaaaaaaaaaaaaaaaaaaaaaaaaaaaaaaaaaaaaaaaaaaaaaaaaaaaaaaaaaaaaaaaaaaaaaaaaaaaaaaaaaaaaaaaaaaaaaaaaaaaaaaaaaaaaaaaaaaaaaaaaaaaaaaaaaaaaaaaaaaaaaaaaaaaaaaaaaaaaaaaaaaaaaaaaaaaaaaaaaaaaaaaaaaaaaaaaaaaaaaaaaaaaaaaaaaaaaaaaaaaaaaaaaaaaaaaaaaaaaaaaaaaaaaaaaaaaaaaaaaaaaaaaaaaaaaaaaaaaaaaaaaaaaaaaaaaaaaaaaaaaaaaaaaaaaaaaaaaaaaaaaaaaaaaaaaaaaaaaaaaaaaaaaaaaaaaaaaaaaaaaaaaaaaaaaaaaaaaaaaaaaaaaaaaaaaaaaaaaaaaaaaaaaaaaaaaaaaaaaaaaaaaaaaaaaaaaaaaaaaaaaaaaaaaaaaaaaaaaaaaaaaaaaaaaaaaaaaaaaaaaaaaaaaaaaaaaaaaaaaaaaaaaaaaaaaaaaaaaaaaaaaaaaaaaaaaaaaaaaaaaaaaaaaaaaaaaaaaaaaaaaaaaaaaaaaaaaaaaaaaaaaaaaaaaaaaaaaaaaaaaaaaaaaaaaaaaaaaaaaaaaaaaaaaaaaaaaaaaaaaaaaaaaaaaaaaaaaaaaaaaaaaaaaaaaaaaaaaaaaaaaaaaaaaaaaaaaaaaaaaaaaaaaaaaaaaaaaaaaaaaaaaaaaaaaaaaaaaaaaaaaaaaaaaaaaaaaaaaaaaaaaaaaaaaaaaaaaaaaaaaaaaaaaaaaaaaaaaaaaaaaaaaaaaaaaaaaaaaaaaaaaaaaaaaaaaaaaaaaaaaaaaaaaaaaaaaaaaaaaaaaaaaaaaaaaaaaaaaaaaaaaaaaaaaaaaaaaaaaaaaaaaaaaaaaaaaaaaaaaaaaaaaaaaaaaaaaaaaaaaaaaaaaaaaaaaaaaaaaaaaaaaaaaaaaaaaaaaaaaaaaaaaaaaaaaaaaaaaaaaaaaaaaaaaaaaaaaaaaaaaaaaaaaaaaaaaaaaaaaaaaaaaaaaaaaaaaaaaaaaaaaaaaaaaaaaaaaaaaaaaaaaaaaaaaaaaaaaaaaaaaaaaaaaaaaaaaaaaaaaaaaaaaaaaaaaaaaaaaaaaaaaaaaaaaaaaaaaaaaaaaaaaaaaaaaaaaaaaaaaaaaaaaaaaaaaaaaaaaaaaaaaaaaaaaaaaaaaaaaaaaaaaaaaaaaaaaaaaaaaaaaaaaaaaaaaaaaaaaaaaaaaaaaaaaaaaaaaaaaaaaaaaaaaaaaaaaaaaaaaaaaaaaaaaaaaaaaaaaaaaaaaaaaaaaaaaaaaaaaaaaaaaaaaaaaaaaaaaaaaaaaaaaaaaaaaaaaaaaaaaaaaaaaaaaaaaaaaaaaaaaaaaaaaaaaaaaaaaaaaaaaaaaaaaaaaaaaaaaaaaaaaaaaaaaaaaaaaaaaaaaaaaaaaaaaaaaaaaaaaaaaaaaaaaaaaaaaaaaaaaaaaaaaaaaaaaaaaaaaaaaaaaaaaaaaaaaaaaaaaaaaaaaaaaaaaaaaaaaaaaaaaaaaaaaaaaaaaaaaaaaaaaaaaaaaaaaaaaaaaaaaaaaaaaaaaaaaaaaaaaaaaaaaaaaaaaaaaaaaaaaaaaaaaaaaaaaaaaaaaaaaaaaaaaaaaaaaaaaaaaaaaaaaaaaaaaaaaaaaaaaaaaaaaaaaaaaaaaaaaaaaaaaaaaaaaaaaaaaaaaaaaaaaaaaaaaaaaaaaaaaaaaaaaaaaaaaaaaaaaaaaaaaaaaaaaaaaaaaaaaaaaaaaaaaaaaaaaaaaaaaaaaaaaaaaaaaaaaaaaaaaaaaaaaaaaaaaaaaaaaaaaaaaaaaaaaaaaaaaaaaaaaaaaaaaaaaaaaaaaaaaaaaaaaaaaaaaaaaaaaaaaaaaaaaaaaaaaaaaaaaaaaaaaaaaaaaaaaaaaaaaaaaaaaaaaaaaaaaaaaaaaaaaaaaaaaaaaaaaaaaaaaaaaaaaaaaaaaaaaaaaaaaaaaaaaaaaaaaaaaaaaaaaaaaaaaaaaaaaaaaaaaaaaaaaaaaaaaaaaaaaaaaaaaaaaaaaaaaaaaaaaaaaaaaaaaaaaaaaaaaaaaaaaaaaaaaaaaaaaaaaaaaaaaaaaaaaaaaaaaaaaaaaaaaaaaaaaaaaaaaaaaaaaaaaaaaaaaaaaaaaaaaaaaaaaaaaaaaaaaaaaaaaaaaaaaaaaaaaaaaaaaaaaaaaaaaaaaaaaaaaaaaaaaaaaaaaaaaaaaaaaaaaaaaaaaaaaaaaaaaaaaaaaaaaaaaaaaaaaaaaaaaaaaaaaaaaaaaaaaaaaaaaaaaaaaaaaaaaaaaaaaaaaaaaaaaaaaaaaaaaaaaaaaaaaaaaaaaaaaaaaaaaaaaaaaaaaaaaaaaaaaaaaaaaaaaaaaaaaaaaaaaaaaaaaaaaaaaaaaaaaaaaaaaaaaaaaaaaaaaaaaaaaaaaaaaaaaaaaaaaaaaaaaaaaaaaaaaaaaaaaaaaaaaaaaaaaaaaaaaaaaaaaaaaaaaaaaaaaaaaaaaaaaaaaaaaaaaaaaaaaaaaaaaaaaaaaaaaaaaaaaaaaaaaaaaaaaaaaaaaaaaaaaaaaaaaaaaaaaaaaaaaaaaaaaaaaaaaaaaaaaaaaaaaaaaaaaaaaaaaaaaaaaaaaaaaaaaaaaaaaaaaaaaaaaaaaaaaaaaaaaaaaaaaaaaaaaaaaaaaaaaaaaaaaaaaaaaaaaaaaaaaaaaaaaaaaaaaaaaaaaaaaaaaaaaaaaaaaaaaaaaaaaaaaaaaaaaaaaaaaaaaaaaaaaaaaaaaaaaaaaaaaaaaaaaaaaaaaaaaaaaaaaaaaaaaaaaaaaaaaaaaaaaaaaaaaaaaaaaaaaaaaaaaaaaaaaaaaaaaaaaaaaaaaaaaaaaaaaaaaaaaaaaaaaaaaaaaaaaaaaaaaaaaaaaaaaaaaaaaaaaaaaaaaaaaaaaaaaaaaaaaaaaaaaaaaaaaaaaaaaaaaaaaaaaaaaaaaaaaaaaaaaaaaaaaaaaaaaaaaaaaaaaaaaaaaaaaaaaaaaaaaaaaaaaaaaaaaaaaaaaaaaaaaaaaaaaaaaaaaaaaaaaaaaaaaaaaaaaaaaaaaaaaaaaaaaaaaaaaaaaaaaaaaaaaaaaaaaaaaaaaaaaaaaaaaaaaaaaaaaaaaaaaaaaaaaaaaaaaaaaaaaaaaaaaaaaaaaaaaaaaaaaaaaaaaaaaaaaaaaaaaaaaaaaaaaaaaaaaaaaaaaaaaaaaaaaaaaaaaaaaaaaaaaaaaaaaaaaaaaaaaaaaaaaaaaaaaaaaaaaaaaaaaaaaaaaaaaaaaaaaaaaaaaaaaaaaaaaaaaaaaaaaaaaaaaaaaaaaaaaaaaaaaaaaaaaaaaaaaaaaaaaaaaaaaaaaaaaaaaaaaaaaaaaaaaaaaaaaaaaaaaaaaaaaaaaaaaaaaaaaaaaaaaaaaaaaaaaaaaaaaaaaaaaaaaaaaaaaaaaaaaaaaaaaaaaaaaaaaaaaaaaaaaaaaaaaaaaaaaaaaaaaaaaaaaaaaaaaaaaaaaaaaaaaaaaaaaaaaaaaaaaaaaaaaaaaaaaaaaaaaaaaaaaaaaaaaaaaaaaaaaaaaaaaaaaaaaaaaaaaaaaaaaaaaaaaaaaaaaaaaaaaaaaaaaaaaaaaaaaaaaaaaaaaaaaaaaaaaaaaaaaaaaaaaaaaaaaaaaaaaaaaaaaaaaaaaaaaaaaaaaaaaaaaaaaaaaaaaaaaaaaaaaaaaaaaaaaaaaaaaaaaaaaaaaaaaaaaaaaaaaaaaaaaaaaaaaaaaaaaaaaaaaaaaaaaaaaaaaaaaaaaaaaaaaaaaaaaaaaaaaaaaaaaaaaaaaaaaaaaaaaaaaaaaaaaaaaaaaaaaaaaaaaaaaaaaaaaaaaaaaaaaaaaaaaaaaaaaaaaaaaaaaaaaaaaaaaaaaaaaaaaaaaaaaaaaaaaaaaaaaaaaaaaaaaaaaaaaaaaaaaaaaaaaaaaaaaaaaaaaaaaaaaaaaaaaaaaaaaaaaaaaaaaaaaaaaaaaaaaaaaaaaaaaaaaaaaaaaaaaaaaaaaaaaaaaaaaaaaaaaaaaaaaaaaaaaaaaaaaaaaaaaaaaaaaaaaaaaaaaaaaaaaaaaaaaaaaaaaaaaaaaaaaaaaaaaaaaaaaaaaaaaaaaaaaaaaaaaaaaaaaaaaaaaaaaaaaaaaaaaaaaaaaaaaaaaaaaaaaaaaaaaaaaaaaaaaaaaaaaaaaaaaaaaaaaaaaaaaaaaaaaaaaaaaaaaaaaaaaaaaaaaaaaaaaaaaaaaaaaaaaaaaaaaaaaaaaaaaaaaaaaaaaaaaaaaaaaaaaaaaaaaaaaaaaaaaaaaaaaaaaaaaaaaaaaaaaaaaaaaaaaaaaaaaaaaaaaaaaaaaaaaaaaaaaaaaaaaaaaaaaaaaaaaaaaaaaaaaaaaaaaaaaaaaaaaaaaaaaaaaaaaaaaaaaaaaaaaaaaaaaaaaaaaaaaaaaaaaaaaaaaaaaaaaaaaaaaaaaaaaaaaaaaaaaaaaaaaaaaaaaaaaaaaaaaaaaaaaaaaaaaaaaaaaaaaaaaaaaaaaaaaaaaaaaaaaaaaaaaaaaaaaaaaaaaaaaaaaaaaaaaaaaaaaaaaaaaaaaaaaaaaaaaaaaaaaaaaaaaaaaaaaaaaaaaaaaaaaaaaaaaaaaaaaaaaaaaaaaaaaaaaaaaaaaaaaaaaaaaaaaaaaaaaaaaaaaaaaaaaaaaaaaaaaaaaaaaaaaaaaaaaaaaaaaaaaaaaaaaaaaaaaaaaaaaaaaaaaaaaaaaaaaaaaaaaaaaaaaaaaaaaaaaaaaaaaaaaaaaaaaaaaaaaaaaaaaaaaaaaaaaaaaaaaaaaaaaaaaaaaaaaaaaaaaaaaaaaaaaaaaaaaaaaaaaaaaaaaaaaaaaaaaaaaaaaaaaaaaaaaaaaaaaaaaaaaaaaaaaaaaaaaaaaaaaaaaaaaaaaaaaaaaaaaaaaaaaaaaaaaaaaaaaaaaaaaaaaaaaaaaaaaaaaaaaaaaaaaaaaaaaaaaaaaaaaaaaaaaaaaaaaaaaaaaaaaaaaaaaaaaaaaaaaaaaaaaaaaaaaaaaaaaaaaaaaaaaaaaaaaaaaaaaaaaaaaaaaaaaaaaaaaaaaaaaaaaaaaaaaaaaaaaaaaaaaaaaaaaaaaaaaaaaaaaaaaaaaaaaaaaaaaaaaaaaaaaaaaaaaaaaaaaaaaaaaaaaaaaaaaaaaaaaaaaaaaaaaaaaaaaaaaaaaaaaaaaaaaaaaaaaaaaaaaaaaaaaaaaaaaaaaaaaaaaaaaaaaaaaaaaaaaaaaaaaaaaaaaaaaaaaaaaaaaaaaaaaaaaaaaaaaaaaaaaaaaaaaaaaaaaaaaaaaaaaaaaaaaaaaaaaaaaaaaaaaaaaaaaaaaaaaaaaaaaaaaaaaaaaaaaaaaaaaaaaaaaaaaaaaaaaaaaaaaaaaaaaaaaaaaaaaaaaaaaaaaaaaaaaaaaaaaaaaaaaaaaaaaaaaaaaaaaaaaaaaaaaaaaaaaaaaaaaaaaaaaaaaaaaaaaaaaaaaaaaaaaaaaaaaaaaaaaaaaaaaaaaaaaaaaaaaaaaaaaaaaaaaaaaaaaaaaaaaaaaaaaaaaaaaaaaaaaaaaaaaaaaaaaaaaaaaaaaaaaaaaaaaaaaaaaaaaaaaaaaaaaaaaaaaaaaaaaaaaaaaaaaaaaaaaaaaaaaaaaaaaaaaaaaaaaaaaaaaaaaaaaaaaaaaaaaaaaaaaaaaaaaaaaaaaaaaaaaaaaaaaaaaaaaaaaaaaaaaaaaaaaaaaaaaaaaaaaaaaaaaaaaaaaaaaaaaaaaaaaaaaaaaaaaaaaaaaaaaaaaaaaaaaaaaaaaaaaaaaaaaaaaaaaaaaaaaaaaaaaaaaaaaaaaaaaaaaaaaaaaaaaaaaaaaaaaaaaaaaaaaaaaaaaaaaaaaaaaaaaaaaaaaaaaaaaaaaaaaaaaaaaaaaaaaaaaaaaaaaaaaaaaaaaaaaaaaaaaaaaaaaaaaaaaaaaaaaaaaaaaaaaaaaaaaaaaaaaaaaaaaaaaaaaaaaaaaaaaaaaaaaaaaaaaaaaaaaaaaaaaaaaaaaaaaaaaaaaaaaaaaaaaaaaaaaaaaaaaaaaaaaaaaaaaaaaaaaaaaaaaaaaaaaaaaaaaaaaaaaaaaaaaaaaaaaaaaaaaaaaaaaaaaaaaaaaaaaaaaaaaaaaaaaaaaaaaaaaaaaaaaaaaaaaaaaaaaaaaaaaaaaaaaaaaaaaaaaaaaaaaaaaaaaaaaaaaaaaaaaaaaaaaaaaaaaaaaaaaaaaaaaaaaaaaaaaaaaaaaaaaaaaaaaaaaaaaaaaaaaaaaaaaaaaaaaaaaaaaaaaaaaaaaaaaaaaaaaaaaaaaaaaaaaaaaaaaaaaaaaaaaaaaaaaaaaaaaaaaaaaaaaaaaaaaaaaaaaaaaaaaaaaaaaaaaaaaaaaaaaaaaaaaaaaaaaaaaaaaaaaaaaaaaaaaaaaaaaaaaaaaaaaaaaaaaaaaaaaaaaaaaaaaaaaaaaaaaaaaaaaaaaaaaaaaaaaaaaaaaaaaaaaaaaaaaaaaaaaaaaaaaaaaaaaaaaaaaaaaaaaaaaaaaaaaaaaaaaaaaaaaaaaaaaaaaaaaaaaaaaaaaaaaaaaaaaaaaaaaaaaaaaaaaaaaaaaaaaaaaaaaaaaaaaaaaaaaaaaaaaaaaaaaaaaaaaaaaaaaaaaaaaaaaaaaaaaaaaaaaaaaaaaaaaaaaaaaaaaaaaaaaaaaaaaaaaaaaaaaaaaaaaaaaaaaaaaaaaaaaaaaaaaaaaaaaaaaaaaaaaaaaaaaaaaaaaaaaaaaaaaaaaaaaaaaaaaaaaaaaaaaaaaaaaaaaaaaaaaaaaaaaaaaaaaaaaaaaaaaaaaaaaaaaaaaaaaaaaaaaaaaaaaaaaaaaaaaaaaaaaaaaaaaaaaaaaaaaaaaaaaaaaaaaaaaaaaaaaaaaaaaaaaaaaaaaaaaaaaaaaaaaaaaaaaaaaaaaaaaaaaaaaaaaaaaaaaaaaaaaaaaaaaaaaaaaaaaaaaaaaaaaaaaaaaaaaaaaaaaaaaaaaaaaaaaaaaaaaaaaaaaaaaaaaaaaaaaaaaaaaaaaaaaaaaaaaaaaaaaaaaaaaaaaaaaaaaaaaaaaaaaaaaaaaaaaaaaaaaaaaaaaaaaaaaaaaaaaaaaaaaaaaaaaaaaaaaaaaaaaaaaaaaaaaaaaaaaaaaaaaaaaaaaaaaaaaaaaaaaaaaaaaaaaaaaaaaaaaaaaaaaaaaaaaaaaaaaaaaaaaaaaaaaaaaaaaaaaaaaaaaaaaaaaaaaaaaaaaaaaaaaaaaaaaaaaaaaaaaaaaaaaaaaaaaaaaaaaaaaaaaaaaaaaaaaaaaaaaaaaaaaaaaaaaaaaaaaaaaaaaaaaaaaaaaaaaaaaaaaaaaaaaaaaaaaaaaaaaaaaaaaaaaaaaaaaaaaaaaaaaaaaaaaaaaaaaaaaaaaaaaaaaaaaaaaaaaaaaaaaaaaaaaaaaaaaaaaaaaaaaaaaaaaaaaaaaaaaaaaaaaaaaaaaaaaaaaaaaaaaaaaaaaaaaaaaaaaaaaaaaaaaaaaaaaaaaaaaaaaaaaaaaaaaaaaaaaaaaaaaaaaaaaaaaaaaaaaaaaaaaaaaaaaaaaaaaaaaaaaaaaaaaaaaaaaaaaaaaaaaaaaaaaaaaaaaaaaaaaaaaaaaaaaaaaaaaaaaaaaaaaaaaaaaaaaaaaaaaaaaaaaaaaaaaaaaaaaaaaaaaaaaaaaaaaaaaaaaaaaaaaaaaaaaaaaaaaaaaaaaaaaaaaaaaaaaaaaaaaaaaaaaaaaaaaaaaaaaaaaaaaaaaaaaaaaaaaaaaaaaaaaaaaaaaaaaaaaaaaaaaaaaaaaaaaaaaaaaaaaaaaaaaaaaaaaaaaaaaaaaaaaaaaaaaaaaaaaaaaaaaaaaaaaaaaaaaaaaaaaaaaaaaaaaaaaaaaaaaaaaaaaaaaaaaaaaaaaaaaaaaaaaaaaaaaaaaaaaaaaaaaaaaaaaaaaaaaaaaaaaaaaaaaaaaaaaaaaaaaaaaaaaaaaaaaaaaaaaaaaaaaaaaaaaaaaaaaaaaaaaaaaaaaaaaaaaaaaaaaaaaaaaaaaaaaaaaaaaaaaaaaaaaaaaaaaaaaaaaaaaaaaaaaaaaaaaaaaaaaaaaaaaaaaaaaaaaaaaaaaaaaaaaaaaaaaaaaaaaaaaaaaaaaaaaaaaaaaaaaaaaaaaaaaaaaaaaaaaaaaaaaaaaaaaaaaaaaaaaaaaaaaaaaaaaaaaaaaaaaaaaaaaaaaaaaaaaaaaaaaaaaaaaaaaaaaaaaaaaaaaaaaaaaaaaaaaaaaaaaaaaaaaaaaaaaaaaaaaaaaaaaaaaaaaaaaaaaaaaaaaaaaaaaaaaaaaaaaaaaaaaaaaaaaaaaaaaaaaaaaaaaaaaaaaaaaaaaaaaaaaaaaaaaaaaaaaaaaaaaaaaaaaaaaaaaaaaaaaaaaaaaaaaaaaaaaaaaaaaaaaaaaaaaaaaaaaaaaaaaaaaaaaaaaaaaaaaaaaaaaaaaaaaaaaaaaaaaaaaaaaaaaaaaaaaaaaaaaaaaaaaaaaaaaaaaaaaaaaaaaaaaaaaaaaaaaaaaaaaaaaaaaaaaaaaaaaaaaaaaaaaaaaaaaaaaaaaaaaaaaaaaaaaaaaaaaaaaaaaaaaaaaaaaaaaaaaaaaaaaaaaaaaaaaaaaaaaaaaaaaaaaaaaaaaaaaaaaaaaaaaaaaaaaaaaaaaaaaaaaaaaaaaaaaaaaaaaaaaaaaaaaaaaaaaaaaaaaaaaaaaaaaaaaaaaaaaaaaaaaaaaaaaaaaaaaaaaaaaaaaaaaaaaaaaaaaaaaaaaaaaaaaaaaaaaaaaaaaaaaaaaaaaaaaaaaaaaaaaaaaaaaaaaaaaaaaaaaaaaaaaaaaaaaaaaaaaaaaaaaaaaaaaaaaaaaaaaaaaaaaaaaaaaaaaaaaaaaaaaaaaaaaaaaaaaaaaaaaaaaaaaaaaaaaaaaaaaaaaaaaaaaaaaaaaaaaaaaaaaaaaaaaaaaaaaaaaaaaaaaaaaaaaaaaaaaaaaaaaaaaaaaaaaaaaaaaaaaaaaaaaaaaaaaaaaaaaaaaaaaaaaaaaaaaaaaaaaaaaaaaaaaaaaaaaaaaaaaaaaaaaaaaaaaaaaaaaaaaaaaaaaaaaaaaaaaaaaaaaaaaaaaaaaaaaaaaaaaaaaaaaaaaaaaaaaaaaaaaaaaaaaaaaaaaaaaaaaaaaaaaaaaaaaaaaaaaaaaaaaaaaaaaaaaaaaaaaaaaaaaaaaaaaaaaaaaaaaaaaaaaaaaaaaaaaaaaaaaaaaaaaaaaaaaaaaaaaaaaaaaaaaaaaaaaaaaaaaaaaaaaaaaaaaaaaaaaaaaaaaaaaaaaaaaaaaaaaaaaaaaaaaaaaaaaaaaaaaaaaaaaaaaaaaaaaaaaaaaaaaaaaaaaaaaaaaaaaaaaaaaaaaaaaaaaaaaaaaaaaaaaaaaaaaaaaaaaaaaaaaaaaaaaaaaaaaaaaaaaaaaaaaaaaaaaaaaaaaaaaaaaaaaaaaaaaaaaaaaaaaaaaaaaaaaaaaaaaaaaaaaaaaaaaaaaaaaaaaaaaaaaaaaaaaaaaaaaaaaaaaaaaaaaaaaaaaaaaaaaaaaaaaaaaaaaaaaaaaaaaaaaaaaaaaaaaaaaaaaaaaaaaaaaaaaaaaaaaaaaaaaaaaaaaaaaaaaaaaaaaaaaaaaaaaaaaaaaaaaaaaaaaaaaaaaaaaaaaaaaaaaaaaaaaaaaaaaaaaaaaaaaaaaaaaaaaaaaaaaaaaaaaaaaaaaaaaaaaaaaaaaaaaaaaaaaaaaaaaaaaaaaaaaaaaaaaaaaaaaaaaaaaaaaaaaaaaaaaaaaaaaaaaaaaaaaaaaaaaaaaaaaaaaaaaaaaaaaaaaaaaaaaaaaaaaaaaaaaaaaaaaaaaaaaaaaaaaaaaaaaaaaaaaaaaaaaaaaaaaaaaaaaaaaaaaaaaaaaaaaaaaaaaaaaaaaaaaaaaaaaaaaaaaaaaaaaaaaaaaaaaaaaaaaaaaaaaaaaaaaaaaaaaaaaaaaaaaaaaaaaaaaaaaaaaaaaaaaaaaaaaaaaaaaaaaaaaaaaaaaaaaaaaaaaaaaaaaaaaaaaaaaaaaaaaaaaaaaaaaaaaaaaaaaaaaaaaaaaaaaaaaaaaaaaaaaaaaaaaaaaaaaaaaaaaaaaaaaaaaaaaaaaaaaaaaaaaaaaaaaaaaaaaaaaaaaaaaaaaaaaaaaaaaaaaaaaaaaaaaaaaaaaaaaaaaaaaaaaaaaaaaaaaaaaaaaaaaaaaaaaaaaaaaaaaaaaaaaaaaaaaaaaaaaaaaaaaaaaaaaaaaaaaaaaaaaaaaaaaaaaaaaaaaaaaaaaaaaaaaaaaaaaaaaaaaaaaaaaaaaaaaaaaaaaaaaaaaaaaaaaaaaaaaaaaaaaaaaaaaaaaaaaaaaaaaaaaaaaaaaaaaaaaaaaaaaaaaaaaaaaaaaaaaaaaaaaaaaaaaaaaaaaaaaaaaaaaaaaaaaaaaaaaaaaaaaaaaaaaaaaaaaaaaaaaaaaaaaaaaaaaaaaaaaaaaaaaaaaaaaaaaaaaaaaaaaaaaaaaaaaaaaaaaaaaaaaaaaaaaaaaaaaaaaaaaaaaaaaaaaaaaaaaaaaaaaaaaaaaaaaaaaaaaaaaaaaaaaaaaaaaaaaaaaaaaaaaaaaaaaaaaaaaaaaaaaaaaaaaaaaaaaaaaaaaaaaaaaaaaaaaaaaaaaaaaaaaaaaaaaaaaaaaaaaaaaaaaaaaaaaaaaaaaaaaaaaaaaaaaaaaaaaaaaaaaaaaaaaaaaaaaaaaaaaaaaaaaaaaaaaaaaaaaaaaaaaaaaaaaaaaaaaaaaaaaaaaaaaaaaaaaaaaaaaaaaaaaaaaaaaaaaaaaaaaaaaaaaaaaaaaaaaaaaaaaaaaaaaaaaaaaaaaaaaaaaaaaaaaaaaaaaaaaaaaaaaaaaaaaaaaaaaaaaaaaaaaaaaaaaaaaaaaaaaaaaaaaaaaaaaaaaaaaaaaaaaaaaaaaaaaaaaaaaaaaaaaaaaaaaaaaaaaaaaaaaaaaaaaaaaaaaaaaaaaaaaaaaaaaaaaaaaaaaaaaaaaaaaaaaaaaaaaaaaaaaaaaaaaaaaaaaaaaaaaaaaaaaaaaaaaaaaaaaaaaaaaaaaaaaaaaaaaaaaaaaaaaaaaaaaaaaaaaaaaaaaaaaaaaaaaaaaaaaaaaaaaaaaaaaaaaaaaaaaaaaaaaaaaaaaaaaaaaaaaaaaaaaaaaaaaaaaaaaaaaaaaaaaaaaaaaaaaaaaaaaaaaaaaaaaaaaaaaaaaaaaaaaaaaaaaaaaaaaaaaaaaaaaaaaaaaaaaaaaaaaaaaaaaaaaaaaaaaaaaaaaaaaaaaaaaaaaaaaaaaaaaaaaaaaaaaaaaaaaaaaaaaaaaaaaaaaaaaaaaaaaaaaaaaaaaaaaaaaaaaaaaaaaaaaaaaaaaaaaaaaaaaaaaaaaaaaaaaaaaaaaaaaaaaaaaaaaaaaaaaaaaaaaaaaaaaaaaaaaaaaaaaaaaaaaaaaaaaaaaaaaaaaaaaaaaaaaaaaaaaaaaaaaaaaaaaaaaaaaaaaaaaaaaaaaaaaaaaaaaaaaaaaaaaaaaaaaaaaaaaaaaaaaaaaaaaaaaaaaaaaaaaaaaaaaaaaaaaaaaaaaaaaaaaaaaaaaaaaaaaaaaaaaaaaaaaaaaaaaaaaaaaaaaaaaaaaaaaaaaaaaaaaaaaaaaaaaaaaaaaaaaaaaaaaaaaaaaaaaaaaaaaaaaaaaaaaaaaaaaaaaaaaaaaaaaaaaaaaaaaaaaaaaaaaaaaaaaaaaaaaaaaaaaaaaaaaaaaaaaaaaaaaaaaaaaaaaaaaaaaaaaaaaaaaaaaaaaaaaaaaaaaaaaaaaaaaaaaaaaaaaaaaaaaaaaaaaaaaaaaaaaaaaaaaaaaaaaaaaaaaaaaaaaaaaaaaaaaaaaaaaaaaaaaaaaaaaaaaaaaaaaaaaaaaaaaaaaaaaaaaaaaaaaaaaaaaaaaaaaaaaaaaaaaaaaaaaaaaaaaaaaaaaaaaaaaaaaaaaaaaaaaaaaaaaaaaaaaaaaaaaaaaaaaaaaaaaaaaaaaaaaaaaaaaaaaaaaaaaaaaaaaaaaaaaaaaaaaaaaaaaaaaaaaaaaaaaaaaaaaaaaaaaaaaaaaaaaaaaaaaaaaaaaaaaaaaaaaaaaaaaaaaaaaaaaaaaaaaaaaaaaaaaaaaaaaaaaaaaaaaaaaaaaaaaaaaaaaaaaaaaaaaaaaaaaaaaaaaaaaaaaaaaaaaaaaaaaaaaaaaaaaaaaaaaaaaaaaaaaaaaaaaaaaaaaaaaaaaaaaaaaaaaaaaaaaaaaaaaaaaaaaaaaaaaaaaaaaaaaaaaaaaaaaaaaaaaaaaaaaaaaaaaaaaaaaaaaaaaaaaaaaaaaaaaaaaaaaaaaaaaaaaaaaaaaaaaaaaaaaaaaaaaaaaaaaaaaaaaaaaaaaaaaaaaaaaaaaaaaaaaaaaaaaaaaaaaaaaaaaaaaaaaaaaaaaaaaaaaaaaaaaaaaaaaaaaaaaaaaaaaaaaaaaaaaaaaaaaaaaaaaaaaaaaaaaaaaaaaaaaaaaaaaaaaaaaaaaaaaaaaaaaaaaaaaaaaaaaaaaaaaaaaaaaaaaaaaaaaaaaaaaaaaaaaaaaaaaaaaaaaaaaaaaaaaaaaaaaaaaaaaaaaaaaaaaaaaaaaaaaaaaaaaaaaaaaaaaaaaaaaaaaaaaaaaaaaaaaaaaaaaaaaaaaaaaaaaaaaaaaaaaaaaaaaaaaaaaaaaaaaaaaaaaaaaaaaaaaaaaaaaaaaaaaaaaaaaaaaaaaaaaaaaaaaaaaaaaaaaaaaaaaaaaaaaaaaaaaaaaaaaaaaaaaaaaaaaaaaaaaaaaaaaaaaaaaaaaaaaaaaaaaaaaaaaaaaaaaaaaaaaaaaaaaaaaaaaaaaaaaaaaaaaaaaaaaaaaaaaaaaaaaaaaaaaaaaaaaaaaaaaaaaaaaaaaaaaaaaaaaaaaaaaaaaaaaaaaaaaaaaaaaaaaaaaaaaaaaaaaaaaaaaaaaaaaaaaaaaaaaaaaaaaaaaaaaaaaaaaaaaaaaaaaaaaaaaaaaaaaaaaaaaaaaaaaaaaaaaaaaaaaaaaaaaaaaaaaaaaaaaaaaaaaaaaaaaaaaaaaaaaaaaaaaaaaaaaaaaaaaaaaaaaaaaaaaaaaaaaaaaaaaaaaaaaaaaaaaaaaaaaaaaaaaaaaaaaaaaaaaaaaaaaaaaaaaaaaaaaaaaaaaaaaaaaaaaaaaaaaaaaaaaaaaaaaaaaaaaaaaaaaaaaaaaaaaaaaaaaaaaaaaaaaaaaaaaaaaaaaaaaaaaaaaaaaaaaaaaaaaaaaaaaaaaaaaaaaaaaaaaaaaaaaaaaaaaaaaaaaaaaaaaaaaaaaaaaaaaaaaaaaaaaaaaaaaaaaaaaaaaaaaaaaaaaaaaaaaaaaaaaaaaaaaaaaaaaaaaaaaaaaaaaaaaaaaaaaaaaaaaaaaaaaaaaaaaaaaaaaaaaaaaaaaaaaaaaaaaaaaaaaaaaaaaaaaaaaaaaaaaaaaaaaaaaaaaaaaaaaaaaaaaaaaaaaaaaaaaaaaaaaaaaaaaaaaaaaaaaaaaaaaaaaaaaaaaaaaaaaaaaaaaaaaaaaaaaaaaaaaaaaaaaaaaaaaaaaaaaaaaaaaaaaaaaaaaaaaaaaaaaaaaaaaaaaaaaaaaaaaaaaaaaaaaaaaaaaaaaaaaaaaaaaaaaaaaaaaaaaaaaaaaaaaaaaaaaaaaaaaaaaaaaaaaaaaaaaaaaaaaaaaaaaaaaaaaaaaaaaaaaaaaaaaaaaaaaaaaaaaaaaaaaaaaaaaaaaaaaaaaaaaaaaaaaaaaaaaaaaaaaaaaaaaaaaaaaaaaaaaaaaaaaaaaaaaaaaaaaaaaaaaaaaaaaaaaaaaaaaaaaaaaaaaaaaaaaaaaaaaaaaaaaaaaaaaaaaaaaaaaaaaaaaaaaaaaaaaaaaaaaaaaaaaaaaaaaaaaaaaaaaaaaaaaaaaaaaaaaaaaaaaaaaaaaaaaaaaaaaaaaaaaaaaaaaaaaaaaaaaaaaaaaaaaaaaaaaaaaaaaaaaaaaaaaaaaaaaaaaaaaaaaaaaaaaaaaaaaaaaaaaaaaaaaaaaaaaaaaaaaaaaaaaaaaaaaaaaaaaaaaaaaaaaaaaaaaaaaaaaaaaaaaaaaaaaaaaaaaaaaaaaaaaaaaaaaaaaaaaaaaaaaaaaaaaaaaaaaaaaaaaaaaaaaaaaaaaaaaaaaaaaaaaaaaaaaaaaaaaaaaaaaaaaaaaaaaaaaaaaaaaaaaaaaaaaaaaaaaaaaaaaaaaaaaaaaaaaaaaaaaaaaaaaaaaaaaaaaaaaaaaaaaaaaaaaaaaaaaaaaaaaaaaaaaaaaaaaaaaaaaaaaaaaaaaaaaaaaaaaaaaaaaaaaaaaaaaaaaaaaaaaaaaaaaaaaaaaaaaaaaaaaaaaaaaaaaaaaaaaaaaaaaaaaaaaaaaaaaaaaaaaaaaaaaaaaaaaaaaaaaaaaaaaaaaaaaaaaaaaaaaaaaaaaaaaaaaaaaaaaaaaaaaaaaaaaaaaaaaaaaaaaaaaaaaaaaaaaaaaaaaaaaaaaaaaaaaaaaaaaaaaaaaaaaaaaaaaaaaaaaaaaaaaaaaaaaaaaaaaaaaaaaaaaaaaaaaaaaaaaaaaaaaaaaaaaaaaaaaaaaaaaaaaaaaaaaaaaaaaaaaaaaaaaaaaaaaaaaaaaaaaaaaaaaaaaaaaaaaaaaaaaaaaaaaaaaaaaaaaaaaaaaaaaaaaaaaaaaaaaaaaaaaaaaaaaaaaaaaaaaaaaaaaaaaaaaaaaaaaaaaaaaaaaaaaaaaaaaaaaaaaaaaaaaaaaaaaaaaaaaaaaaaaaaaaaaaaaaaaaaaaaaaaaaaaaaaaaaaaaaaaaaaaaaaaaaaaaaaaaaaaaaaaaaaaaaaaaaaaaaaaaaaaaaaaaaaaaaaaaaaaaaaaaaaaaaaaaaaaaaaaaaaaaaaaaaaaaaaaaaaaaaaaaaaaaaaaaaaaaaaaaaaaaaaaaaaaaaaaaaaaaaaaaaaaaaaaaaaaaaaaaaaaaaaaaaaaaaaaaaaaaaaaaaaaaaaaaaaaaaaaaaaaaaaaaaaaaaaaaaaaaaaaaaaaaaaaaaaaaaaaaaaaaaaaaaaaaaaaaaaaaaaaaaaaaaaaaaaaaaaaaaaaaaaaaaaaaaaaaaaaaaaaaaaaaaaaaaaaaaaaaaaaaaaaaaaaaaaaaaaaaaaaaaaaaaaaaaaaaaaaaaaaaaaaaaaaaaaaaaaaaaaaaaaaaaaaaaaaaaaaaaaaaaaaaaaaaaaaaaaaaaaaaaaaaaaaaaaaaaaaaaaaaaaaaaaaaaaaaaaaaaaaaaaaaaaaaaaaaaaaaaaaaaaaaaaaaaaaaaaaaaaaaaaaaaaaaaaaaaaaaaaaaaaaaaaaaaaaaaaaaaaaaaaaaaaaaaaaaaaaaaaaaaaaaaaaaaaaaaaaaaaaaaaaaaaaaaaaaaaaaaaaaaaaaaaaaaaaaaaaaaaaaaaaaaaaaaaaaaaaaaaaaaaaaaaaaaaaaaaaaaaaaaaaaaaaaaaaaaaaaaaaaaaaaaaaaaaaaaaaaaaaaaaaaaaaaaaaaaaaaaaaaaaaaaaaaaaaaaaaaaaaaaaaaaaaaaaaaaaaaaaaaaaaaaaaaaaaaaaaaaaaaaaaaaaaaaaaaaaaaaaaaaaaaaaaaaaaaaaaaaaaaaaaaaaaaaaaaaaaaaaaaaaaaaaaaaaaaaaaaaaaaaaaaaaaaaaaaaaaaaaaaaaaaaaaaaaaaaaaaaaaaaaaaaaaaaaaaaaaaaaaaaaaaaaaaaaaaaaaaaaaaaaaaaaaaaaaaaaaaaaaaaaaaaaaaaaaaaaaaaaaaaaaaaaaaaaaaaaaaaaaaaaaaaaaaaaaaaaaaaaaaaaaaaaaaaaaaaaaaaaaaaaaaaaaaaaaaaaaaaaaaaaaaaaaaaaaaaaaaaaaaaaaaaaaaaaaaaaaaaaaaaaaaaaaaaaaaaaaaaaaaaaaaaaaaaaaaaaaaaaaaaaaaaaaaaaaaaaaaaaaaaaaaaaaaaaaaaaaaaaaaaaaaaaaaaaaaaaaaaaaaaaaaaaaaaaaaaaaaaaaaaaaaaaaaaaaaaaaaaaaaaaaaaaaaaaaaaaaaaaaaaaaaaaaaaaaaaaaaaaaaaaaaaaaaaaaaaaaaaaaaaaaaaaaaaaaaaaaaaaaaaaaaaaaaaaaaaaaaaaaaaaaaaaaaaaaaaaaaaaaaaaaaaaaaaaaaaaaaaaaaaaaaaaaaaaaaaaaaaaaaaaaaaaaaaaaaaaaaaaaaaaaaaaaaaaaaaaaaaaaaaaaaaaaaaaaaaaaaaaaaaaaaaaaaaaaaaaaaaaaaaaaaaaaaaaaaaaaaaaaaaaaaaaaaaaaaaaaaaaaaaaaaaaaaaaaaaaaaaaaaaaaaaaaaaaaaaaaaaaaaaaaaaaaaaaaaaaaaaaaaaaaaaaaaaaaaaaaaaaaaaaaaaaaaaaaaaaaaaaaaaaaaaaaaaaaaaaaaaaaaaaaaaaaaaaaaaaaaaaaaaaaaaaaaaaaaaaaaaaaaaaaaaaaaaaaaaaaaaaaaaaaaaaaaaaaaaaaaaaaaaaaaaaaaaaaaaaaaaaaaaaaaaaaaaaaaaaaaaaaaaaaaaaaaaaaaaaaaaaaaaaaaaaaaaaaaaaaaaaaaaaaaaaaaaaaaaaaaaaaaaaaaaaaaaaaaaaaaaaaaaaaaaaaaaaaaaaaaaaaaaaaaaaaaaaaaaaaaaaaaaaaaaaaaaaaaaaaaaaaaaaaaaaaaaaaaaaaaaaaaaaaaaaaaaaaaaaaaaaaaaaaaaaaaaaaaaaaaaaaaaaaaaaaaaaaaaaaaaaaaaaaaaaaaaaaaaaaaaaaaaaaaaaaaaaaaaaaaaaaaaaaaaaaaaaaaaaaaaaaaaaaaaaaaaaaaaaaaaaaaaaaaaaaaaaaaaaaaaaaaaaaaaaaaaaaaaaaaaaaaaaaaaaaaaaaaaaaaaaaaaaaaaaaaaaaaaaaaaaaaaaaaaaaaaaaaaaaaaaaaaaaaaaaaaaaaaaaaaaaaaaaaaaaaaaaaaaaaaaaaaaaaaaaaaaaaaaaaaaaaaaaaaaaaaaaaaaaaaaaaaaaaaaaaaaaaaaaaaaaaaaaaaaaaaaaaaaaaaaaaaaaaaaaaaaaaaaaaaaaaaaaaaaaaaaaaaaaaaaaaaaaaaaaaaaaaaaaaaaaaaaaaaaaaaaaaaaaaaaaaaaaaaaaaaaaaaaaaaaaaaaaaaaaaaaaaaaaaaaaaaaaaaaaaaaaaaaaaaaaaaaaaaaaaaaaaaaaaaaaaaaaaaaaaaaaaaaaaaaaaaaaaaaaaaaaaaaaaaaaaaaaaaaaaaaaaaaaaaaaaaaaaaaaaaaaaaaaaaaaaaaaaaaaaaaaaaaaaaaaaaaaaaaaaaaaaaaaaaaaaaaaaaaaaaaaaaaaaaaaaaaaaaaaaaaaaaaaaaaaaaaaaaaaaaaaaaaaaaaaaaaaaaaaaaaaaaaaaaaaaaaaaaaaaaaaaaaaaaaaaaaaaaaaaaaaaaaaaaaaaaaaaaaaaaaaaaaaaaaaaaaaaaaaaaaaaaaaaaaaaaaaaaaaaaaaaaaaaaaaaaaaaaaaaaaaaaaaaaaaaaaaaaaaaaaaaaaaaaaaaaaaaaaaaaaaaaaaaaaaaaaaaaaaaaaaaaaaaaaaaaaaaaaaaaaaaaaaaaaaaaaaaaaaaaaaaaaaaaaaaaaaaaaaaaaaaaaaaaaaaaaaaaaaaaaaaaaaaaaaaaaaaaaaaaaaaaaaaaaaaaaaaaaaaaaaaaaaaaaaaaaaaaaaaaaaaaaaaaaaaaaaaaaaaaaaaaaaaaaaaaaaaaaaaaaaaaaaaaaaaaaaaaaaaaaaaaaaaaaaaaaaaaaaaaaaaaaaaaaaaaaaaaaaaaaaaaaaaaaaaaaaaaaaaaaaaaaaaaaaaaaaaaaaaaaaaaaaaaaaaaaaaaaaaaaaaaaaaaaaaaaaaaaaaaaaaaaaaaaaaaaaaaaaaaaaaaaaaaaaaaaaaaaaaaaaaaaaaaaaaaaaaaaaaaaaaaaaaaaaaaaaaaaaaaaaaaaaaaaaaaaaaaaaaaaaaaaaaaaaaaaaaaaaaaaaaaaaaaaaaaaaaaaaaaaaaaaaaaaaaaaaaaaaaaaaaaaaaaaaaaaaaaaaaaaaaaaaaaaaaaaaaaaaaaaaaaaaaaaaaaaaaaaaaaaaaaaaaaaaaaaaaaaaaaaaaaaaaaaaaaaaaaaaaaaaaaaaaaaaaaaaaaaaaaaaaaaaaaaaaaaaaaaaaaaaaaaaaaaaaaaaaaaaaaaaaaaaaaaaaaaaaaaaaaaaaaaaaaaaaaaaaaaaaaaaaaaaaaaaaaaaaaaaaaaaaaaaaaaaaaaaaaaaaaaaaaaaaaaaaaaaaaaaaaaaaaaaaaaaaaaaaaaaaaaaaaaaaaaaaaaaaaaaaaaaaaaaaaaaaaaaaaaaaaaaaaaaaaaaaaaaaaaaaaaaaaaaaaaaaaaaaaaaaaaaaaaaaaaaaaaaaaaaaaaaaaaaaaaaaaaaaaaaaaaaaaaaaaaaaaaaaaaaaaaaaaaaaaaaaaaaaaaaaaaaaaaaaaaaaaaaaaaaaaaaaaaaaaaaaaaaaaaaaaaaaaaaaaaaaaaaaaaaaaaaaaaaaaaaaaaaaaaaaaaaaaaaaaaaaaaaaaaaaaaaaaaaaaaaaaaaaaaaaaaaaaaaaaaaaaaaaaaaaaaaaaaaaaaaaaaaaaaaaaaaaaaaaaaaaaaaaaaaaaaaaaaaaaaaaaaaaaaaaaaaaaaaaaaaaaaaaaaaaaaaaaaaaaaaaaaaaaaaaaaaaaaaaaaaaaaaaaaaaaaaaaaaaaaaaaaaaaaaaaaaaaaaaaaaaaaaaaaaaaaaaaaaaaaaaaaaaaaaaaaaaaaaaaaaaaaaaaaaaaaaaaaaaaaaaaaaaaaaaaaaaaaaaaaaaaaaaaaaaaaaaaaaaaaaaaaaaaaaaaaaaaaaaaaaaaaaaaaaaaaaaaaaaaaaaaaaaaaaaaaaaaaaaaaaaaaaaaaaaaaaaaaaaaaaaaaaaaaaaaaaaaaaaaaaaaaaaaaaaaaaaaaaaaaaaaaaaaaaaaaaaaaaaaaaaaaaaaaaaaaaaaaaaaaaaaaaaaaaaaaaaaaaaaaaaaaaaaaaaaaaaaaaaaaaaaaaaaaaaaaaaaaaaaaaaaaaaaaaaaaaaaaaaaaaaaaaaaaaaaaaaaaaaaaaaaaaaaaaaaaaaaaaaaaaaaaaaaaaaaaaaaaaaaaaaaaaaaaaaaaaaaaaaaaaaaaaaaaaaaaaaaaaaaaaaaaaaaaaaaaaaaaaaaaaaaaaaaaaaaaaaaaaaaaaaaaaaaaaaaaaaaaaaaaaaaaaaaaaaaaaaaaaaaaaaaaaaaaaaaaaaaaaaaaaaaaaaaaaaaaaaaaaaaaaaaaaaaaaaaaaaaaaaaaaaaaaaaaaaaaaaaaaaaaaaaaaaaaaaaaaaaaaaaaaaaaaaaaaaaaaaaaaaaaaaaaaaaaaaaaaaaaaaaaaaaaaaaaaaaaaaaaaaaaaaaaaaaaaaaaaaaaaaaaaaaaaaaaaaaaaaaaaaaaaaaaaaaaaaaaaaaaaaaaaaaaaaaaaaaaaaaaaaaaaaaaaaaaaaaaaaaaaaaaaaaaaaaaaaaaaaaaaaaaaaaaaaaaaaaaaaaaaaaaaaaaaaaaaaaaaaaaaaaaaaaaaaaaaaaaaaaaaaaaaaaaaaaaaaaaaaaaaaaaaaaaaaaaaaaaaaaaaaaaaaaaaaaaaaaaaaaaaaaaaaaaaaaaaaaaaaaaaaaaaaaaaaaaaaaaaaaaaaaaaaaaaaaaaaaaaaaaaaaaaaaaaaaaaaaaaaaaaaaaaaaaaaaaaaaaaaaaaaaaaaaaaaaaaaaaaaaaaaaaaaaaaaaaaaaaaaaaaaaaaaaaaaaaaaaaaaaaaaaaaaaaaaaaaaaaaaaaaaaaaaaaaaaaaaaaaaaaaaaaaaaaaaaaaaaaaaaaaaaaaaaaaaaaaaaaaaaaaaaaaaaaaaaaaaaaaaaaaaaaaaaaaaaaaaaaaaaaaaaaaaaaaaaaaaaaaaaaaaaaaaaaaaaaaaaaaaaaaaaaaaaaaaaaaaaaaaaaaaaaaaaaaaaaaaaaaaaaaaaaaaaaaaaaaaaaaaaaaaaaaaaaaaaaaaaaaaaaaaaaaaaaaaaaaaaaaaaaaaaaaaaaaaaaaaaaaaaaaaaaaaaaaaaaaaaaaaaaaaaaaaaaaaaaaaaaaaaaaaaaaaaaaaaaaaaaaaaaaaaaaaaaaaaaaaaaaaaaaaaaaaaaaaaaaaaaaaaaaaaaaaaaaaaaaaaaaaaaaaaaaaaaaaaaaaaaaaaaaaaaaaaaaaaaaaaaaaaaaaaaaaaaaaaaaaaaaaaaaaaaaaaaaaaaaaaaaaaaaaaaaaaaaaaaaaaaaaaaaaaaaaaaaaaaaaaaaaaaaaaaaaaaaaaaaaaaaaaaaaaaaaaaaaaaaaaaaaaaaaaaaaaaaaaaaaaaaaaaaaaaaaaaaaaaaaaaaaaaaaaaaaaaaaaaaaaaaaaaaaaaaaaaaaaaaaaaaaaaaaaaaaaaaaaaaaaaaaaaaaaaaaaaaaaaaaaaaaaaaaaaaaaaaaaaaaaaaaaaaaaaaaaaaaaaaaaaaaaaaaaaaaaaaaaaaaaaaaaaaaaaaaaaaaaaaaaaaaaaaaaaaaaaaaaaaaaaaaaaaaaaaaaaaaaaaaaaaaaaaaaaaaaaaaaaaaaaaaaaaaaaaaaaaaaaaaaaaaaaaaaaaaaaaaaaaaaaaaaaaaaaaaaaaaaaaaaaaaaaaaaaaaaaaaaaaaaaaaaaaaaaaaaaaaaaaaaaaaaaaaaaaaaaaaaaaaaaaaaaaaaaaaaaaaaaaaaaaaaaaaaaaaaaaaaaaaaaaaaaaaaaaaaaaaaaaaaaaaaaaaaaaaaaaaaaaaaaaaaaaaaaaaaaaaaaaaaaaaaaaaaaaaaaaaaaaaaaaaaaaaaaaaaaaaaaaaaaaaaaaaaaaaaaaaaaaaaaaaaaaaaaaaaaaaaaaaaaaaaaaaaaaaaaaaaaaaaaaaaaaaaaaaaaaaaaaaaaaaaaaaaaaaaaaaaaaaaaaaaaaaaaaaaaaaaaaaaaaaaaaaaaaaaaaaaaaaaaaaaaaaaaaaaaaaaaaaaaaaaaaaaaaaaaaaaaaaaaaaaaaaaaaaaaaaaaaaaaaaaaaaaaaaaaaaaaaaaaaaaaaaaaaaaaaaaaaaaaaaaaaaaaaaaaaaaaaaaaaaaaaaaaaaaaaaaaaaaaaaaaaaaaaaaaaaaaaaaaaaaaaaaaaaaaaaaaaaaaaaaaaaaaaaaaaaaaaaaaaaaaaaaaaaaaaaaaaaaaaaaaaaaaaaaaaaaaaaaaaaaaaaaaaaaaaaaaaaaaaaaaaaaaaaaaaaaaaaaaaaaaaaaaaaaaaaaaaaaaaaaaaaaaaaaaaaaaaaaaaaaaaaaaaaaaaaaaaaaaaaaaaaaaaaaaaaaaaaaaaaaaaaaaaaaaaaaaaaaaaaaaaaaaaaaaaaaaaaaaaaaaaaaaaaaaaaaaaaaaaaaaaaaaaaaaaaaaaaaaaaaaaaaaaaaaaaaaaaaaaaaaaaaaaaaaaaaaaaaaaaaaaaaaaaaaaaaaaaaaaaaaaaaaaaaaaaaaaaaaaaaaaaaaaaaaaaaaaaaaaaaaaaaaaaaaaaaaaaaaaaaaaaaaaaaaaaaaaaaaaaaaaaaaaaaaaaaaaaaaaaaaaaaaaaaaaaaaaaaaaaaaaaaaaaaaaaaaaaaaaaaaaaaaaaaaaaaaaaaaaaaaaaaaaaaaaaaaaaaaaaaaaaaaaaaaaaaaaaaaaaaaaaaaaaaaaaaaaaaaaaaaaaaaaaaaaaaaaaaaaaaaaaaaaaaaaaaaaaaaaaaaaaaaaaaaaaaaaaaaaaaaaaaaaaaaaaaaaaaaaaaaaaaaaaaaaaaaaaaaaaaaaaaaaaaaaaaaaaaaaaaaaaaaaaaaaaaaaaaaaaaaaaaaaaaaaaaaaaaaaaaaaaaaaaaaaaaaaaaaaaaaaaaaaaaaaaaaaaaaaaaaaaaaaaaaaaaaaaaaaaaaaaaaaaaaaaaaaaaaaaaaaaaaaaaaaaaaaaaaaaaaaaaaaaaaaaaaaaaaaaaaaaaaaaaaaaaaaaaaaaaaaaaaaaaaaaaaaaaaaaaaaaaaaaaaaaaaaaaaaaaaaaaaaaaaaaaaaaaaaaaaaaaaaaaaaaaaaaaaaaaaaaaaaaaaaaaaaaaaaaaaaaaaaaaaaaaaaaaaaaaaaaaaaaaaaaaaaaaaaaaaaaaaaaaaaaaaaaaaaaaaaaaaaaaaaaaaaaaaaaaaaaaaaaaaaaaaaaaaaaaaaaaaaaaaaaaaaaaaaaaaaaaaaaaaaaaaaaaaaaaaaaaaaaaaaaaaaaaaaaaaaaaaaaaaaaaaaaaaaaaaaaaaaaaaaaaaaaaaaaaaaaaaaaaaaaaaaaaaaaaaaaaaaaaaaaaaaaaaaaaaaaaaaaaaaaaaaaaaaaaaaaaaaaaaaaaaaaaaaaaaaaaaaaaaaaaaaaaaaaaaaaaaaaaaaaaaaaaaaaaaaaaaaaaaaaaaaaaaaaaaaaaaaaaaaaaaaaaaaaaaaaaaaaaaaaaaaaaaaaaaaaaaaaaaaaaaaaaaaaaaaaaaaaaaaaaaaaaaaaaaaaaaaaaaaaaaaaaaaaaaaaaaaaaaaaaaaaaaaaaaaaaaaaaaaaaaaaaaaaaaaaaaaaaaaaaaaaaaaaaaaaaaaaaaaaaaaaaaaaaaaaaaaaaaaaaaaaaaaaaaaaaaaaaaaaaaaaaaaaaaaaaaaaaaaaaaaaaaaaaaaaaaaaaaaaaaaaaaaaaaaaaaaaaaaaaaaaaaaaaaaaaaaaaaaaaaaaaaaaaaaaaaaaaaaaaaaaaaaaaaaaaaaaaaaaaaaaaaaaaaaaaaaaaaaaaaaaaaaaaaaaaaaaaaaaaaaaaaaaaaaaaaaaaaaaaaaaaaaaaaaaaaaaaaaaaaaaaaaaaaaaaaaaaaaaaaaaaaaaaaaaaaaaaaaaaaaaaaaaaaaaaaaaaaaaaaaaaaaaaaaaaaaaaaaaaaaaaaaaaaaaaaaaaaaaaaaaaaaaaaaaaaaaaaaaaaaaaaaaaaaaaaaaaaaaaaaaaaaaaaaaaaaaaaaaaaaaaaaaaaaaaaaaaaaaaaaaaaaaaaaaaaaaaaaaaaaaaaaaaaaaaaaaaaaaaaaaaaaaaaaaaaaaaaaaaaaaaaaaaaaaaaaaaaaaaaaaaaaaaaaaaaaaaaaaaaaaaaaaaaaaaaaaaaaaaaaaaaaaaaaaaaaaaaaaaaaaaaaaaaaaaaaaaaaaaaaaaaaaaaaaaaaaaaaaaaaaaaaaaaaaaaaaaaaaaaaaaaaaaaaaaaaaaaaaaaaaaaaaaaaaaaaaaaaaaaaaaaaaaaaaaaaaaaaaaaaaaaaaaaaaaaaaaaaaaaaaaaaaaaaaaaaaaaaaaaaaaaaaaaaaaaaaaaaaaaaaaaaaaaaaaaaaaaaaaaaaaaaaaaaaaaaaaaaaaaaaaaaaaaaaaaaaaaaaaaaaaaaaaaaaaaaaaaaaaaaaaaaaaaaaaaaaaaaaaaaaaaaaaaaaaaaaaaaaaaaaaaaaaaaaaaaaaaaaaaaaaaaaaaaaaaaaaaaaaaaaaaaaaaaaaaaaaaaaaaaaaaaaaaaaaaaaaaaaaaaaaaaaaaaaaaaaaaaaaaaaaaaaaaaaaaaaaaaaaaaaaaaaaaaaaaaaaaaaaaaaaaaaaaaaaaaaaaaaaaaaaaaaaaaaaaaaaaaaaaaaaaaaaaaaaaaaaaaaaaaaaaaaaaaaaaaaaaaaaaaaaaaaaaaaaaaaaaaaaaaaaaaaaaaaaaaaaaaaaaaaaaaaaaaaaaaaaaaaaaaaaaaaaaaaaaaaaaaaaaaaaaaaaaaaaaaaaaaaaaaaaaaaaaaaaaaaaaaaaaaaaaaaaaaaaaaaaaaaaaaaaaaaaaaaaaaaaaaaaaaaaaaaaaaaaaaaaaaaaaaaaaaaaaaaaaaaaaaaaaaaaaaaaaaaaaaaaaaaaaaaaaaaaaaaaaaaaaaaaaaaaaaaaaaaaaaaaaaaaaaaaaaaaaaaaaaaaaaaaaaaaaaaaaaaaaaaaaaaaaaaaaaaaaaaaaaaaaaaaaaaaaaaaaaaaaaaaaaaaaaaaaaaaaaaaaaaaaaaaaaaaaaaaaaaaaaaaaaaaaaaaaaaaaaaaaaaaaaaaaaaaaaaaaaaaaaaaaaaaaaaaaaaaaaaaaaaaaaaaaaaaaaaaaaaaaaaaaaaaaaaaaaaaaaaaaaaaaaaaaaaaaaaaaaaaaaaaaaaaaaaaaaaaaaaaaaaaaaaaaaaaaaaaaaaaaaaaaaaaaaaaaaaaaaaaaaaaaaaaaaaaaaaaaaaaaaaaaaaaaaaaaaaaaaaaaaaaaaaaaaaaaaaaaaaaaaaaaaaaaaaaaaaaaaaaaaaaaaaaaaaaaaaaaaaaaaaaaaaaaaaaaaaaaaaaaaaaaaaaaaaaaaaaaaaaaaaaaaaaaaaaaaaaaaaaaaaaaaaaaaaaaaaaaaaaaaaaaaaaaaaaaaaaaaaaaaaaaaaaaaaaaaaaaaaaaaaaaaaaaaaaaaaaaaaaaaaaaaaaaaaaaaaaaaaaaaaaaaaaaaaaaaaaaaaaaaaaaaaaaaaaaaaaaaaaaaaaaaaaaaaaaaaaaaaaaaaaaaaaaaaaaaaaaaaaaaaaaaaaaaaaaaaaaaaaaaaaaaaaaaaaaaaaaaaaaaaaaaaaaaaaaaaaaaaaaaaaaaaaaaaaaaaaaaaaaaaaaaaaaaaaaaaaaaaaaaaaaaaaaaaaaaaaaaaaaaaaaaaaaaaaaaaaaaaaaaaaaaaaaaaaaaaaaaaaaaaaaaaaaaaaaaaaaaaaaaaaaaaaaaaaaaaaaaaaaaaaaaaaaaaaaaaaaaaaaaaaaaaaaaaaaaaaaaaaaaaaaaaaaaaaaaaaaaaaaaaaaaaaaaaaaaaaaaaaaaaaaaaaaaaaaaaaaaaaaaaaaaaaaaaaaaaaaaaaaaaaaaaaaaaaaaaaaaaaaaaaaaaaaaaaaaaaaaaaaaaaaaaaaaaaaaaaaaaaaaaaaaaaaaaaaaaaaaaaaaaaaaaaaaaaaaaaaaaaaaaaaaaaaaaaaaaaaaaaaaaaaaaaaaaaaaaaaaaaaaaaaaaaaaaaaaaaaaaaaaaaaaaaaaaaaaaaaaaaaaaaaaaaaaaaaaaaaaaaaaaaaaaaaaaaaaaaaaaaaaaaaaaaaaaaaaaaaaaaaaaaaaaaaaaaaaaaaaaaaaaaaaaaaaaaaaaaaaaaaaaaaaaaaaaaaaaaaaaaaaaaaaaaaaaaaaaaaaaaaaaaaaaaaaaaaaaaaaaaaaaaaaaaaaaaaaaaaaaaaaaaaaaaaaaaaaaaaaaaaaaaaaaaaaaaaaaaaaaaaaaaaaaaaaaaaaaaaaaaaaaaaaaaaaaaaaaaaaaaaaaaaaaaaaaaaaaaaaaaaaaaaaaaaaaaaaaaaaaaaaaaaaaaaaaaaaaaaaaaaaaaaaaaaaaaaaaaaaaaaaaaaaaaaaaaaaaaaaaaaaaaaaaaaaaaaaaaaaaaaaaaaaaaaaaaaaaaaaaaaaaaaaaaaaaaaaaaaaaaaaaaaaaaaaaaaaaaaaaaaaaaaaaaaaaaaaaaaaaaaaaaaaaaaaaaaaaaaaaaaaaaaaaaaaaaaaaaaaaaaaaaaaaaaaaaaaaaaaaaaaaaaaaaaaaaaaaaaaaaaaaaaaaaaaaaaaaaaaaaaaaaaaaaaaaaaaaaaaaaaaaaaaaaaaaaaaaaaaaaaaaaaaaaaaaaaaaaaaaaaaaaaaaaaaaaaaaaaaaaaaaaaaaaaaaaaaaaaaaaaaaaaaaaaaaaaaaaaaaaaaaaaaaaaaaaaaaaaaaaaaaaaaaaaaaaaaaaaaaaaaaaaaaaaaaaaaaaaaaaaaaaaaaaaaaaaaaaaaaaaaaaaaaaaaaaaaaaaaaaaaaaaaaaaaaaaaaaaaaaaaaaaaaaaaaaaaaaaaaaaaaaaaaaaaaaaaaaaaaaaaaaaaaaaaaaaaaaaaaaaaaaaaaaaaaaaaaaaaaaaaaaaaaaaaaaaaaaaaaaaaaaaaaaaaaaaaaaaaaaaaaaaaaaaaaaaaaaaaaaaaaaaaaaaaaaaaaaaaaaaaaaaaaaaaaaaaaaaaaaaaaaaaaaaaaaaaaaaaaaaaaaaaaaaaaaaaaaaaaaaaaaaaaaaaaaaaaaaaaaaaaaaaaaaaaaaaaaaaaaaaaaaaaaaaaaaaaaaaaaaaaaaaaaaaaaaaaaaaaaaaaaaaaaaaaaaaaaaaaaaaaaaaaaaaaaaaaaaaaaaaaaaaaaaaaaaaaaaaaaaaaaaaaaaaaaaaaaaaaaaaaaaaaaaaaaaaaaaaaaaaaaaaaaaaaaaaaaaaaaaaaaaaaaaaaaaaaaaaaaaaaaaaaaaaaaaaaaaaaaaaaaaaaaaaaaaaaaaaaaaaaaaaaaaaaaaaaaaaaaaaaaaaaaaaaaaaaaaaaaaaaaaaaaaaaaaaaaaaaaaaaaaaaaaaaaaaaaaaaaaaaaaaaaaaaaaaaaaaaaaaaaaaaaaaaaaaaaaaaaaaaaaaaaaaaaaaaaaaaaaaaaaaaaaaaaaaaaaaaaaaaaaaaaaaaaaaaaaaaaaaaaaaaaaaaaaaaaaaaaaaaaaaaaaaaaaaaaaaaaaaaaaaaaaaaaaaaaaaaaaaaaaaaaaaaaaaaaaaaaaaaaaaaaaaaaaaaaaaaaaaaaaaaaaaaaaaaaaaaaaaaaaaaaaaaaaaaaaaaaaaaaaaaaaaaaaaaaaaaaaaaaaaaaaaaaaaaaaaaaaaaaaaaaaaaaaaaaaaaaaaaaaaaaaaaaaaaaaaaaaaaaaaaaaaaaaaaaaaaaaaaaaaaaaaaaaaaaaaaaaaaaaaaaaaaaaaaaaaaaaaaaaaaaaaaaaaaaaaaaaaaaaaaaaaaaaaaaaaaaaaaaaaaaaaaaaaaaaaaaaaaaaaaaaaaaaaaaaaaaaaaaaaaaaaaaaaaaaaaaaaaaaaaaaaaaaaaaaaaaaaaaaaaaaaaaaaaaaaaaaaaaaaaaaaaaaaaaaaaaaaaaaaaaaaaaaaaaaaaaaaaaaaaaaaaaaaaaaaaaaaaaaaaaaaaaaaaaaaaaaaaaaaaaaaaaaaaaaaaaaaaaaaaaaaaaaaaaaaaaaaaaaaaaaaaaaaaaaaaaaaaaaaaaaaaaaaaaaaaaaaaaaaaaaaaaaaaaaaaaaaaaaaaaaaaaaaaaaaaaaaaaaaaaaaaaaaaaaaaaaaaaaaaaaaaaaaaaaaaaaaaaaaaaaaaaaaaaaaaaaaaaaaaaaaaaaaaaaaaaaaaaaaaaaaaaaaaaaaaaaaaaaaaaaaaaaaaaaaaaaaaaaaaaaaaaaaaaaaaaaaaaaaaaaaaaaaaaaaaaaaaaaaaaaaaaaaaaaaaaaaaaaaaaaaaaaaaaaaaaaaaaaaaaaaaaaaaaaaaaaaaaaaaaaaaaaaaaaaaaaaaaaaaaaaaaaaaaaaaaaaaaaaaaaaaaaaaaaaaaaaaaaaaaaaaaaaaaaaaaaaaaaaaaaaaaaaaaaaaaaaaaaaaaaaaaaaaaaaaaaaaaaaaaaaaaaaaaaaaaaaaaaaaaaaaaaaaaaaaaaaaaaaaaaaaaaaaaaaaaaaaaaaaaaaaaaaaaaaaaaaaaaaaaaaaaaaaaaaaaaaaaaaaaaaaaaaaaaaaaaaaaaaaaaaaaaaaaaaaaaaaaaaaaaaaaaaaaaaaaaaaaaaaaaaaaaaaaaaaaaaaaaaaaaaaaaaaaaaaaaaaaaaaaaaaaaaaaaaaaaaaaaaaaaaaaaaaaaaaaaaaaaaaaaaaaaaaaaaaaaaaaaaaaaaaaaaaaaaaaaaaaaaaaaaaaaaaaaaaaaaaaaaaaaaaaaaaaaaaaaaaaaaaaaaaaaaaaaaaaaaaaaaaaaaaaaaaaaaaaaaaaaaaaaaaaaaaaaaaaaaaaaaaaaaaaaaaaaaaaaaaaaaaaaaaaaaaaaaaaaaaaaaaaaaaaaaaaaaaaaaaaaaaaaaaaaaaaaaaaaaaaaaaaaaaaaaaaaaaaaaaaaaaaaaaaaaaaaaaaaaaaaaaaaaaaaaaaaaaaaaaaaaaaaaaaaaaaaaaaaaaaaaaaaaaaaaaaaaaaaaaaaaaaaaaaaaaaaaaaaaaaaaaaaaaaaaaaaaaaaaaaaaaaaaaaaaaaaaaaaaaaaaaaaaaaaaaaaaaaaaaaaaaaaaaaaaaaaaaaaaaaaaaaaaaaaaaaaaaaaaaaaaaaaaaaaaaaaaaaaaaaaaaaaaaaaaaaaaaaaaaaaaaaaaaaaaaaaaaaaaaaaaaaaaaaaaaaaaaaaaaaaaaaaaaaaaaaaaaaaaaaaaaaaaaaaaaaaaaaaaaaaaaaaaaaaaaaaaaaaaaaaaaaaaaaaaaaaaaaaaaaaaaaaaaaaaaaaaaaaaaaaaaaaaaaaaaaaaaaaaaaaaaaaaaaaaaaaaaaaaaaaaaaaaaaaaaaaaaaaaaaaaaaaaaaaaaaaaaaaaaaaaaaaaaaaaaaaaaaaaaaaaaaaaaaaaaaaaaaaaaaaaaaaaaaaaaaaaaaaaaaaaaaaaaaaaaaaaaaaaaaaaaaaaaaaaaaaaaaaaaaaaaaaaaaaaaaaaaaaaaaaaaaaaaaaaaaaaaaaaaaaaaaaaaaaaaaaaaaaaaaaaaaaaaaaaaaaaaaaaaaaaaaaaaaaaaaaaaaaaaaaaaaaaaaaaaaaaaaaaaaaaaaaaaaaaaaaaaaaaaaaaaaaaaaaaaaaaaaaaaaaaaaaaaaaaaaaaaaaaaaaaaaaaaaaaaaaaaaaaaaaaaaaaaaaaaaaaaaaaaaaaaaaaaaaaaaaaaaaaaaaaaaaaaaaaaaaaaaaaaaaaaaaaaaaaaaaaaaaaaaaaaaaaaaaaaaaaaaaaaaaaaaaaaaaaaaaaaaaaaaaaaaaaaaaaaaaaaaaaaaaaaaaaaaaaaaaaaaaaaaaaaaaaaaaaaaaaaaaaaaaaaaaaaaaaaaaaaaaaaaaaaaaaaaaaaaaaaaaaaaaaaaaaaaaaaaaaaaaaaaaaaaaaaaaaaaaaaaaaaaaaaaaaaaaaaaaaaaaaaaaaaaaaaaaaaaaaaaaaaaaaaaaaaaaaaaaaaaaaaaaaaaaaaaaaaaaaaaaaaaaaaaaaaaaaaaaaaaaaaaaaaaaaaaaaaaaaaaaaaaaaaaaaaaaaaaaaaaaaaaaaaaaaaaaaaaaaaaaaaaaaaaaaaaaaaaaaaaaaaaaaaaaaaaaaaaaaaaaaaaaaaaaaaaaaaaaaaaaaaaaaaaaaaaaaaaaaaaaaaaaaaaaaaaaaaaaaaaaaaaaaaaaaaaaaaaaaaaaaaaaaaaaaaaaaaaaaaaaaaaaaaaaaaaaaaaaaaaaaaaaaaaaaaaaaaaaaaaaaaaaaaaaaaaaaaaaaaaaaaaaaaaaaaaaaaaaaaaaaaaaaaaaaaaaaaaaaaaaaaaaaaaaaaaaaaaaaaaaaaaaaaaaaaaaaaaaaaaaaaaaaaaaaaaaaaaaaaaaaaaaaaaaaaaaaaaaaaaaaaaaaaaaaaaaaaaaaaaaaaaaaaaaaaaaaaaaaaaaaaaaaaaaaaaaaaaaaaaaaaaaaaaaaaaaaaaaaaaaaaaaaaaaaaaaaaaaaaaaaaaaaaaaaaaaaaaaaaaaaaaaaaaaaaaaaaaaaaaaaaaaaaaaaaaaaaaaaaaaaaaaaaaaaaaaaaaaaaaaaaaaaaaaaaaaaaaaaaaaaaaaaaaaaaaaaaaaaaaaaaaaaaaaaaaaaaaaaaaaaaaaaaaaaaaaaaaaaaaaaaaaaaaaaaaaaaaaaaaaaaaaaaaaaaaaaaaaaaaaaaaaaaaaaaaaaaaaaaaaaaaaaaaaaaaaaaaaaaaaaaaaaaaaaaaaaaaaaaaaaaaaaaaaaaaaaaaaaaaaaaaaaaaaaaaaaaaaaaaaaaaaaaaaaaaaaaaaaaaaaaaaaaaaaaaaaaaaaaaaaaaaaaaaaaaaaaaaaaaaaaaaaaaaaaaaaaaaaaaaaaaaaaaaaaaaaaaaaaaaaaaaaaaaaaaaaaaaaaaaaaaaaaaaaaaaaaaaaaaaaaaaaaaaaaaaaaaaaaaaaaaaaaaaaaaaaaaaaaaaaaaaaaaaaaaaaaaaaaaaaaaaaaaaaaaaaaaaaaaaaaaaaaaaaaaaaaaaaaaaaaaaaaaaaaaaaaaaaaaaaaaaaaaaaaaaaaaaaaaaaaaaaaaaaaaaaaaaaaaaaaaaaaaaaaaaaaaaaaaaaaaaaaaaaaaaaaaaaaaaaaaaaaaaaaaaaaaaaaaaaaaaaaaaaaaaaaaaaaaaaaaaaaaaaaaaaaaaaaaaaaaaaaaaaaaaaaaaaaaaaaaaaaaaaaaaaaaaaaaaaaaaaaaaaaaaaaaaaaaaaaaaaaaaaaaaaaaaaaaaaaaaaaaaaaaaaaaaaaaaaaaaaaaaaaaaaaaaaaaaaaaaaaaaaaaaaaaaaaaaaaaaaaaaaaaaaaaaaaaaaaaaaaaaaaaaaaaaaaaaaaaaaaaaaaaaaaaaaaaaaaaaaaaaaaaaaaaaaaaaaaaaaaaaaaaaaaaaaaaaaaaaaaaaaaaaaaaaaaaaaaaaaaaaaaaaaaaaaaaaaaaaaaaaaaaaaaaaaaaaaaaaaaaaaaaaaaaaaaaaaaaaaaaaaaaaaaaaaaaaaaaaaaaaaaaaaaaaaaaaaaaaaaaaaaaaaaaaaaaaaaaaaaaaaaaaaaaaaaaaaaaaaaaaaaaaaaaaaaaaaaaaaaaaaaaaaaaaaaaaaaaaaaaaaaaaaaaaaaaaaaaaaaaaaaaaaaaaaaaaaaaaaaaaaaaaaaaaaaaaaaaaaaaaaaaaaaaaaaaaaaaaaaaaaaaaaaaaaaaaaaaaaaaaaaaaaaaaaaaaaaaaaaaaaaaaaaaaaaaaaaaaaaaaaaaaaaaaaaaaaaaaaaaaaaaaaaaaaaaaaaaaaaaaaaaaaaaaaaaaaaaaaaaaaaaaaaaaaaaaaaaaaaaaaaaaaaaaaaaaaaaaaaaaaaaaaaaaaaaaaaaaaaaaaaaaaaaaaaaaaaaaaaaaaaaaaaaaaaaaaaaaaaaaaaaaaaaaaaaaaaaaaaaaaaaaaaaaaaaaaaaaaaaaaaaaaaaaaaaaaaaaaaaaaaaaaaaaaaaaaaaaaaaaaaaaaaaaaaaaaaaaaaaaaaaaaaaaaaaaaaaaaaaaaaaaaaaaaaaaaaaaaaaaaaaaaaaaaaaaaaaaaaaaaaaaaaaaaaaaaaaaaaaaaaaaaaaaaaaaaaaaaaaaaaaaaaaaaaaaaaaaaaaaaaaaaaaaaaaaaaaaaaaaaaaaaaaaaaaaaaaaaaaaaaaaaaaaaaaaaaaaaaaaaaaaaaaaaaaaaaaaaaaaaaaaaaaaaaaaaaaaaaaaaaaaaaaaaaaaaaaaaaaaaaaaaaaaaaaaaaaaaaaaaaaaaaaaaaaaaaaaaaaaaaaaaaaaaaaaaaaaaaaaaaaaaaaaaaaaaaaaaaaaaaaaaaaaaaaaaaaaaaaaaaaaaaaaaaaaaaaaaaaaaaaaaaaaaaaaaaaaaaaaaaaaaaaaaaaaaaaaaaaaaaaaaaaaaaaaaaaaaaaaaaaaaaaaaaaaaaaaaaaaaaaaaaaaaaaaaaaaaaaaaaaaaaaaaaaaaaaaaaaaaaaaaaaaaaaaaaaaaaaaaaaaaaaaaaaaaaaaaaaaaaaaaaaaaaaaaaaaaaaaaaaaaaaaaaaaaaaaaaaaaaaaaaaaaaaaaaaaaaaaaaaaaaaaaaaaaaaaaaaaaaaaaaaaaaaaaaaaaaaaaaaaaaaaaaaaaaaaaaaaaaaaaaaaaaaaaaaaaaaaaaaaaaaaaaaaaaaaaaaaaaaaaaaaaaaaaaaaaaaaaaaaaaaaaaaaaaaaaaaaaaaaaaaaaaaaaaaaaaaaaaaaaaaaaaaaaaaaaaaaaaaaaaaaaaaaaaaaaaaaaaaaaaaaaaaaaaaaaaaaaaaaaaaaaaaaaaaaaaaaaaaaaaaaaaaaaaaaaaaaaaaaaaaaaaaaaaaaaaaaaaaaaaaaaaaaaaaaaaaaaaaaaaaaaaaaaaaaaaaaaaaaaaaaaaaaaaaaaaaaaaaaaaaaaaaaaaaaaaaaaaaaaaaaaaaaaaaaaaaaaaaaaaaaaaaaaaaaaaaaaaaaaaaaaaaaaaaaaaaaaaaaaaaaaaaaaaaaaaaaaaaaaaaaaaaaaaaaaaaaaaaaaaaaaaaaaaaaaaaaaaaaaaaaaaaaaaaaaaaaaaaaaaaaaaaaaaaaaaaaaaaaaaaaaaaaaaaaaaaaaaaaaaaaaaaaaaaaaaaaaaaaaaaaaaaaaaaaaaaaaaaaaaaaaaaaaaaaaaaaaaaaaaaaaaaaaaaaaaaaaaaaaaaaaaaaaaaaaaaaaaaaaaaaaaaaaaaaaaaaaaaaaaaaaaaaaaaaaaaaaaaaaaaaaaaaaaaaaaaaaaaaaaaaaaaaaaaaaaaaaaaaaaaaaaaaaaaaaaaaaaaaaaaaaaaaaaaaaaaaaaaaaaaaaaaaaaaaaaaaaaaaaaaaaaaaaaaaaaaaaaaaaaaaaaaaaaaaaaaaaaaaaaaaaaaaaaaaaaaaaaaaaaaaaaaaaaaaaaaaaaaaaaaaaaaaaaaaaaaaaaaaaaaaaaaaaaaaaaaaaaaaaaaaaaaaaaaaaaaaaaaaaaaaaaaaaaaaaaaaaaaaaaaaaaaaaaaaaaaaaaaaaaaaaaaaaaaaaaaaaaaaaaaaaaaaaaaaaaaaaaaaaaaaaaaaaaaaaaaaaaaaaaaaaaaaaaaaaaaaaaaaaaaaaaaaaaaaaaaaaaaaaaaaaaaaaaaaaaaaaaaaaaaaaaaaaaaaaaaaaaaaaaaaaaaaaaaaaaaaaaaaaaaaaaaaaaaaaaaaaaaaaaaaaaaaaaaaaaaaaaaaaaaaaaaaaaaaaaaaaaaaaaaaaaaaaaaaaaaaaaaaaaaaaaaaaaaaaaaaaaaaaaaaaaaaaaaaaaaaaaaaaaaaaaaaaaaaaaaaaaaaaaaaaaaaaaaaaaaaaaaaaaaaaaaaaaaaaaaaaaaaaaaaaaaaaaaaaaaaaaaaaaaaaaaaaaaaaaaaaaaaaaaaaaaaaaaaaaaaaaaaaaaaaaaaaaaaaaaaaaaaaaaaaaaaaaaaaaaaaaaaaaaaaaaaaaaaaaaaaaaaaaaaaaaaaaaaaaaaaaaaaaaaaaaaaaaaaaaaaaaaaaaaaaaaaaaaaaaaaaaaaaaaaaaaaaaaaaaaaaaaaaaaaaaaaaaaaaaaaaaaaaaaaaaaaaaaaaaaaaaaaaaaaaaaaaaaaaaaaaaaaaaaaaaaaaaaaaaaaaaaaaaaaaaaaaaaaaaaaaaaaaaaaaaaaaaaaaaaaaaaaaaaaaaaaaaaaaaaaaaaaaaaaaaaaaaaaaaaaaaaaaaaaaaaaaaaaaaaaaaaaaaaaaaaaaaaaaaaaaaaaaaaaaaaaaaaaaaaaaaaaaaaaaaaaaaaaaaaaaaaaaaaaaaaaaaaaaaaaaaaaaaaaaaaaaaaaaaaaaaaaaaaaaaaaaaaaaaaaaaaaaaaaaaaaaaaaaaaaaaaaaaaaaaaaaaaaaaaaaaaaaaaaaaaaaaaaaaaaaaaaaaaaaaaaaaaaaaaaaaaaaaaaaaaaaaaaaaaaaaaaaaaaaaaaaaaaaaaaaaaaaaaaaaaaaaaaaaaaaaaaaaaaaaaaaaaaaaaaaaaaaaaaaaaaaaaaaaaaaaaaaaaaaaaaaaaaaaaaaaaaaaaaaaaaaaaaaaaaaaaaaaaaaaaaaaaaaaaaaaaaaaaaaaaaaaaaaaaaaaaaaaaaaaaaaaaaaaaaaaaaaaaaaaaaaaaaaaaaaaaaaaaaaaaaaaaaaaaaaaaaaaaaaaaaaaaaaaaaaaaaaaaaaaaaaaaaaaaaaaaaaaaaaaaaaaaaaaaaaaaaaaaaaaaaaaaaaaaaaaaaaaaaaaaaaaaaaaaaaaaaaaaaaaaaaaaaaaaaaaaaaaaaaaaaaaaaaaaaaaaaaaaaaaaaaaaaaaaaaaaaaaaaaaaaaaaaaaaaaaaaaaaaaaaaaaaaaaaaaaaaaaaaaaaaaaaaaaaaaaaaaaaaaaaaaaaaaaaaaaaaaaaaaaaaaaaaaaaaaaaaaaaaaaaaaaaaaaaaaaaaaaaaaaaaaaaaaaaaaaaaaaaaaaaaaaaaaaaaaaaaaaaaaaaaaaaaaaaaaaaaaaaaaaaaaaaaaaaaaaaaaaaaaaaaaaaaaaaaaaaaaaaaaaaaaaaaaaaaaaaaaaaaaaaaaaaaaaaaaaaaaaaaaaaaaaaaaaaaaaaaaaaaaaaaaaaaaaaaaaaaaaaaaaaaaaaaaaaaaaaaaaaaaaaaaaaaaaaaaaaaaaaaaaaaaaaaaaaaaaaaaaaaaaaaaaaaaaaaaaaaaaaaaaaaaaaaaaaaaaaaaaaaaaaaaaaaaaaaaaaaaaaaaaaaaaaaaaaaaaaaaaaaaaaaaaaaaaaaaaaaaaaaaaaaaaaaaaaaaaaaaaaaaaaaaaaaaaaaaaaaaaaaaaaaaaaaaaaaaaaaaaaaaaaaaaaaaaaaaaaaaaaaaaaaaaaaaaaaaaaaaaaaaaaaaaaaaaaaaaaaaaaaaaaaaaaaaaaaaaaaaaaaaaaaaaaaaaaaaaaaaaaaaaaaaaaaaaaaaaaaaaaaaaaaaaaaaaaaaaaaaaaaaaaaaaaaaaaaaaaaaaaaaaaaaaaaaaaaaaaaaaaaaaaaaaaaaaaaaaaaaaaaaaaaaaaaaaaaaaaaaaaaaaaaaaaaaaaaaaaaaaaaaaaaaaaaaaaaaaaaaaaaaaaaaaaaaaaaaaaaaaaaaaaaaaaaaaaaaaaaaaaaaaaaaaaaaaaaaaaaaaaaaaaaaaaaaaaaaaaaaaaaaaaaaaaaaaaaaaaaaaaaaaaaaaaaaaaaaaaaaaaaaaaaaaaaaaaaaaaaaaaaaaaaaaaaaaaaaaaaaaaaaaaaaaaaaaaaaaaaaaaaaaaaaaaaaaaaaaaaaaaaaaaaaaaaaaaaaaaaaaaaaaaaaaaaaaaaaaaaaaaaaaaaaaaaaaaaaaaaaaaaaaaaaaaaaaaaaaaaaaaaaaaaaaaaaaaaaaaaaaaaaaaaaaaaaaaaaaaaaaaaaaaaaaaaaaaaaaaaaaaaaaaaaaaaaaaaaaaaaaaaaaaaaaaaaaaaaaaaaaaaaaaaaaaaaaaaaaaaaaaaaaaaaaaaaaaaaaaaaaaaaaaaaaaaaaaaaaaaaaaaaaaaaaaaaaaaaaaaaaaaaaaaaaaaaaaaaaaaaaaaaaaaaaaaaaaaaaaaaaaaaaaaaaaaaaaaaaaaaaaaaaaaaaaaaaaaaaaaaaaaaaaaaaaaaaaaaaaaaaaaaaaaaaaaaaaaaaaaaaaaaaaaaaaaaaaaaaaaaaaaaaaaaaaaaaaaaaaaaaaaaaaaaaaaaaaaaaaaaaaaaaaaaaaaaaaaaaaaaaaaaaaaaaaaaaaaaaaaaaaaaaaaaaaaaaaaaaaaaaaaaaaaaaaaaaaaaaaaaaaaaaaaaaaaaaaaaaaaaaaaaaaaaaaaaaaaaaaaaaaaaaaaaaaaaaaaaaaaaaaaaaaaaaaaaaaaaaaaaaaaaaaaaaaaaaaaaaaaaaaaaaaaaaaaaaaaaaaaaaaaaaaaaaaaaaaaaaaaaaaaaaaaaaaaaaaaaaaaaaaaaaaaaaaaaaaaaaaaaaaaaaaaaaaaaaaaaaaaaaaaaaaaaaaaaaaaaaaaaaaaaaaaaaaaaaaaaaaaaaaaaaaaaaaaaaaaaaaaaaaaaaaaaaaaaaaaaaaaaaaaaaaaaaaaaaaaaaaaaaaaaaaaaaaaaaaaaaaaaaaaaaaaaaaaaaaaaaaaaaaaaaaaaaaaaaaaaaaaaaaaaaaaaaaaaaaaaaaaaaaaaaaaaaaaaaaaaaaaaaaaaaaaaaaaaaaaaaaaaaaaaaaaaaaaaaaaaaaaaaaaaaaaaaaaaaaaaaaaaaaaaaaaaaaaaaaaaaaaaaaaaaaaaaaaaaaaaaaaaaaaaaaaaaaaaaaaaaaaaaaaaaaaaaaaaaaaaaaaaaaaaaaaaaaaaaaaaaaaaaaaaaaaaaaaaaaaaaaaaaaaaaaaaaaaaaaaaaaaaaaaaaaaaaaaaaaaaaaaaaaaaaaaaaaaaaaaaaaaaaaaaaaaaaaaaaaaaaaaaaaaaaaaaaaaaaaaaaaaaaaaaaaaaaaaaaaaaaaaaaaaaaaaaaaaaaaaaaaaaaaaaaaaaaaaaaaaaaaaaaaaaaaaaaaaaaaaaaaaaaaaaaaaaaaaaaaaaaaaaaaaaaaaaaaaaaaaaaaaaaaaaaaaaaaaaaaaaaaaaaaaaaaaaaaaaaaaaaaaaaaaaaaaaaaaaaaaaaaaaaaaaaaaaaaaaaaaaaaaaaaaaaaaaaaaaaaaaaaaaaaaaaaaaaaaaaaaaaaaaaaaaaaaaaaaaaaaaaaaaaaaaaaaaaaaaaaaaaaaaaaaaaaaaaaaaaaaaaaaaaaaaaaaaaaaaaaaaaaaaaaaaaaaaaaaaaaaaaaaaaaaaaaaaaaaaaaaaaaaaaaaaaaaaaaaaaaaaaaaaaaaaaaaaaaaaaaaaaaaaaaaaaaaaaaaaaaaaaaaaaaaaaaaaaaaaaaaaaaaaaaaaaaaaaaaaaaaaaaaaaaaaaaaaaaaaaaaaaaaaaaaaaaaaaaaaaaaaaaaaaaaaaaaaaaaaaaaaaaaaaaaaaaaaaaaaaaaaaaaaaaaaaaaaaaaaaaaaaaaaaaaaaaaaaaaaaaaaaaaaaaaaaaaaaaaaaaaaaaaaaaaaaaaaaaaaaaaaaaaaaaaaaaaaaaaaaaaaaaaaaaaaaaaaaaaaaaaaaaaaaaaaaaaaaaaaaaaaaaaaaaaaaaaaaaaaaaaaaaaaaaaaaaaaaaaaaaaaaaaaaaaaaaaaaaaaaaaaaaaaaaaaaaaaaaaaaaaaaaaaaaaaaaaaaaaaaaaaaaaaaaaaaaaaaaaaaaaaaaaaaaaaaaaaaaaaaaaaaaaaaaaaaaaaaaaaaaaaaaaaaaaaaaaaaaaaaaaaaaaaaaaaaaaaaaaaaaaaaaaaaaaaaaaaaaaaaaaaaaaaaaaaaaaaaaaaaaaaaaaaaaaaaaaaaaaaaaaaaaaaaaaaaaaaaaaaaaaaaaaaaaaaaaaaaaaaaaaaaaaaaaaaaaaaaaaaaaaaaaaaaaaaaaaaaaaaaaaaaaaaaaaaaaaaaaaaaaaaaaaaaaaaaaaaaaaaaaaaaaaaaaaaaaaaaaaaaaaaaaaaaaaaaaaaaaaaaaaaaaaaaaaaaaaaaaaaaaaaaaaaaaaaaaaaaaaaaaaaaaaaaaaaaaaaaaaaaaaaaaaaaaaaaaaaaaaaaaaaaaaaaaaaaaaaaaaaaaaaaaaaaaaaaaaaaaaaaaaaaaaaaaaaaaaaaaaaaaaaaaaaaaaaaaaaaaaaaaaaaaaaaaaaaaaaaaaaaaaaaaaaaaaaaaaaaaaaaaaaaaaaaaaaaaaaaaaaaaaaaaaaaaaaaaaaaaaaaaaaaaaaaaaaaaaaaaaaaaaaaaaaaaaaaaaaaaaaaaaaaaaaaaaaaaaaaaaaaaaaaaaaaaaaaaaaaaaaaaaaaaaaaaaaaaaaaaaaaaaaaaaaaaaaaaaaaaaaaaaaaaaaaaaaaaaaaaaaaaaaaaaaaaaaaaaaaaaaaaaaaaaaaaaaaaaaaaaaaaaaaaaaaaaaaaaaaaaaaaaaaaaaaaaaaaaaaaaaaaaaaaaaaaaaaaaaaaaaaaaaaaaaaaaaaaaaaaaaaaaaaaaaaaaaaaaaaaaaaaaaaaaaaaaaaaaaaaaaaaaaaaaaaaaaaaaaaaaaaaaaaaaaaaaaaaaaaaaaaaaaaaaaaaaaaaaaaaaaaaaaaaaaaaaaaaaaaaaaaaaaaaaaaaaaaaaaaaaaaaaaaaaaaaaaaaaaaaaaaaaaaaaaaaaaaaaaaaaaaaaaaaaaaaaaaaaaaaaaaaaaaaaaaaaaaaaaaaaaaaaaaaaaaaaaaaaaaaaaaaaaaaaaaaaaaaaaaaaaaaaaaaaaaaaaaaaaaaaaaaaaaaaaaaaaaaaaaaaaaaaaaaaaaaaaaaaaaaaaaaaaaaaaaaaaaaaaaaaaaaaaaaaaaaaaaaaaaaaaaaaaaaaaaaaaaaaaaaaaaaaaaaaaaaaaaaaaaaaaaaaaaaaaaaaaaaaaaaaaaaaaaaaaaaaaaaaaaaaaaaaaaaaaaaaaaaaaaaaaaaaaaaaaaaaaaaaaaaaaaaaaaaaaaaaaaaaaaaaaaaaaaaaaaaaaaaaaaaaaaaaaaaaaaaaaaaaaaaaaaaaaaaaaaaaaaaaaaaaaaaaaaaaaaaaaaaaaaaaaaaaaaaaaaaaaaaaaaaaaaaaaaaaaaaaaaaaaaaaaaaaaaaaaaaaaaaaaaaaaaaaaaaaaaaaaaaaaaaaaaaaaaaaaaaaaaaaaaaaaaaaaaaaaaaaaaaaaaaaaaaaaaaaaaaaaaaaaaaaaaaaaaaaaaaaaaaaaaaaaaaaaaaaaaaaaaaaaaaaaaaaaaaaaaaaaaaaaaaaaaaaaaaaaaaaaaaaaaaaaaaaaaaaaaaaaaaaaaaaaaaaaaaaaaaaaaaaaaaaaaaaaaaaaaaaaaaaaaaaaaaaaaaaaaaaaaaaaaaaaaaaaaaaaaaaaaaaaaaaaaaaaaaaaaaaaaaaaaaaaaaaaaaaaaaaaaaaaaaaaaaaaaaaaaaaaaaaaaaaaaaaaaaaaaaaaaaaaaaaaaaaaaaaaaaaaaaaaaaaaaaaaaaaaaaaaaaaaaaaaaaaaaaaaaaaaaaaaaaaaaaaaaaaaaaaaaaaaaaaaaaaaaaaaaaaaaaaaaaaaaaaaaaaaaaaaaaaaaaaaaaaaaaaaaaaaaaaaaaaaaaaaaaaaaaaaaaaaaaaaaaaaaaaaaaaaaaaaaaaaaaaaaaaaaaaaaaaaaaaaaaaaaaaaaaaaaaaaaaaaaaaaaaaaaaaaaaaaaaaaaaaaaaaaaaaaaaaaaaaaaaaaaaaaaaaaaaaaaaaaaaaaaaaaaaaaaaaaaaaaaaaaaaaaaaaaaaaaaaaaaaaaaaaaaaaaaaaaaaaaaaaaaaaaaaaaaaaaaaaaaaaaaaaaaaaaaaaaaaaaaaaaaaaaaaaaaaaaaaaaaaaaaaaaaaaaaaaaaaaaaaaaaaaaaaaaaaaaaaaaaaaaaaaaaaaaaaaaaaaaaaaaaaaaaaaaaaaaaaaaaaaaaaaaaaaaaaaaaaaaaaaaaaaaaaaaaaaaaaaaaaaaaaaaaaaaaaaaaaaaaaaaaaaaaaaaaaaaaaaaaaaaaaaaaaaaaaaaaaaaaaaaaaaaaaaaaaaaaaaaaaaaaaaaaaaaaaaaaaaaaaaaaaaaaaaaaaaaaaaaaaaaaaaaaaaaaaaaaaaaaaaaaaaaaaaaaaaaaaaaaaaaaaaaaaaaaaaaaaaaaaaaaaaaaaaaaaaaaaaaaaaaaaaaaaaaaaaaaaaaaaaaaaaaaaaaaaaaaaaaaaaaaaaaaaaaaaaaaaaaaaaaaaaaaaaaaaaaaaaaaaaaaaaaaaaaaaaaaaaaaaaaaaaaaaaaaaaaaaaaaaaaaaaaaaaaaaaaaaaaaaaaaaaaaaaaaaaaaaaaaaaaaaaaaaaaaaaaaaaaaaaaaaaaaaaaaaaaaaaaaaaaaaaaaaaaaaaaaaaaaaaaaaaaaaaaaaaaaaaaaaaaaaaaaaaaaaaaaaaaaaaaaaaaaaaaaaaaaaaaaaaaaaaaaaaaaaaaaaaaaaaaaaaaaaaaaaaaaaaaaaaaaaaaaaaaaaaaaaaaaaaaaaaaaaaaaaaaaaaaaaaaaaaaaaaaaaaaaaaaaaaaaaaaaaaaaaaaaaaaaaaaaaaaaaaaaaaaaaaaaaaaaaaaaaaaaaaaaaaaaaaaaaaaaaaaaaaaaaaaaaaaaaaaaaaaaaaaaaaaaaaaaaaaaaaaaaaaaaaaaaaaaaaaaaaaaaaaaaaaaaaaaaaaaaaaaaaaaaaaaaaaaaaaaaaaaaaaaaaaaaaaaaaaaaaaaaaaaaaaaaaaaaaaaaaaaaaaaaaaaaaaaaaaaaaaaaaaaaaaaaaaaaaaaaaaaaaaaaaaaaaaaaaaaaaaaaaaaaaaaaaaaaaaaaaaaaaaaaaaaaaaaaaaaaaaaaaaaaaaaaaaaaaaaaaaaaaaaaaaaaaaaaaaaaaaaaaaaaaaaaaaaaaaaaaaaaaaaaaaaaaaaaaaaaaaaaaaaaaaaaaaaaaaaaaaaaaaaaaaaaaaaaaaaaaaaaaaaaaaaaaaaaaaaaaaaaaaaaaaaaaaaaaaaaaaaaaaaaaaaaaaaaaaaaaaaaaaaaaaaaaaaaaaaaaaaaaaaaaaaaaaaaaaaaaaaaaaaaaaaaaaaaaaaaaaaaaaaaaaaaaaaaaaaaaaaaaaaaaaaaaaaaaaaaaaaaaaaaaaaaaaaaaaaaaaaaaaaaaaaaaaaaaaaaaaaaaaaaaaaaaaaaaaaaaaaaaaaaaaaaaaaaaaaaaaaaaaaaaaaaaaaaaaaaaaaaaaaaaaaaaaaaaaaaaaaaaaaaaaaaaaaaaaaaaaaaaaaaaaaaaaaaaaaaaaaaaaaaaaaaaaaaaaaaaaaaaaaaaaaaaaaaaaaaaaaaaaaaaaaaaaaaaaaaaaaaaaaaaaaaaaaaaaaaaaaaaaaaaaaaaaaaaaaaaaaaaaaaaaaaaaaaaaaaaaaaaaaaaaaaaaaaaaaaaaaaaaaaaaaaaaaaaaaaaaaaaaaaaaaaaaaaaaaaaaaaaaaaaaaaaaaaaaaaaaaaaaaaaaaaaaaaaaaaaaaaaaaaaaaaaaaaaaaaaaaaaaaaaaaaaaaaaaaaaaaaaaaaaaaaaaaaaaaaaaaaaaaaaaaaaaaaaaaaaaaaaaaaaaaaaaaaaaaaaaaaaaaaaaaaaaaaaaaaaaaaaaaaaaaaaaaaaaaaaaaaaaaaaaaaaaaaaaaaaaaaaaaaaaaaaaaaaaaaaaaaaaaaaaaaaaaaaaaaaaaaaaaaaaaaaaaaaaaaaaaaaaaaaaaaaaaaaaaaaaaaaaaaaaaaaaaaaaaaaaaaaaaaaaaaaaaaaaaaaaaaaaaaaaaaaaaaaaaaaaaaaaaaaaaaaaaaaaaaaaaaaaaaaaaaaaaaaaaaaaaaaaaaaaaaaaaaaaaaaaaaaaaaaaaaaaaaaaaaaaaaaaaaaaaaaaaaaaaaaaaaaaaaaaaaaaaaaaaaaaaaaaaaaaaaaaaaaaaaaaaaaaaaaaaaaaaaaaaaaaaaaaaaaaaaaaaaaaaaaaaaaaaaaaaaaaaaaaaaaaaaaaaaaaaaaaaaaaaaaaaaaaaaaaaaaaaaaaaaaaaaaaaaaaaaaaaaaaaaaaaaaaaaaaaaaaaaaaaaaaaaaaaaaaaaaaaaaaaaaaaaaaaaaaaaaaaaaaaaaaaaaaaaaaaaaaaaaaaaaaaaaaaaaaaaaaaaaaaaaaaaaaaaaaaaaaaaaaaaaaaaaaaaaaaaaaaaaaaaaaaaaaaaaaaaaaaaaaaaaaaaaaaaaaaaaaaaaaaaaaaaaaaaaaaaaaaaaaaaaaaaaaaaaaaaaaaaaaaaaaaaaaaaaaaaaaaaaaaaaaaaaaaaaaaaaaaaaaaaaaaaaaaaaaaaaaaaaaaaaaaaaaaaaaaaaaaaaaaaaaaaaaaaaaaaaaaaaaaaaaaaaaaaaaaaaaaaaaaaaaaaaaaaaaaaaaaaaaaaaaaaaaaaaaaaaaaaaaaaaaaaaaaaaaaaaaaaaaaaaaaaaaaaaaaaaaaaaaaaaaaaaaaaaaaaaaaaaaaaaaaaaaaaaaaaaaaaaaaaaaaaaaaaaaaaaaaaaaaaaaaaaaaaaaaaaaaaaaaaaaaaaaaaaaaaaaaaaaaaaaaaaaaaaaaaaaaaaaaaaaaaaaaaaaaaaaaaaaaaaaaaaaaaaaaaaaaaaaaaaaaaaaaaaaaaaaaaaaaaaaaaaaaaaaaaaaaaaaaaaaaaaaaaaaaaaaaaaaaaaaaaaaaaaaaaaaaaaaaaaaaaaaaaaaaaaaaaaaaaaaaaaaaaaaaaaaaaaaaaaaaaaaaaaaaaaaaaaaaaaaaaaaaaaaaaaaaaaaaaaaaaaaaaaaaaaaaaaaaaaaaaaaaaaaaaaaaaaaaaaaaaaaaaaaaaaaaaaaaaaaaaaaaaaaaaaaaaaaaaaaaaaaaaaaaaaaaaaaaaaaaaaaaaaaaaaaaaaaaaaaaaaaaaaaaaaaaaaaaaaaaaaaaaaaaaaaaaaaaaaaaaaaaaaaaaaaaaaaaaaaaaaaaaaaaaaaaaaaaaaaaaaaaaaaaaaaaaaaaaaaaaaaaaaaaaaaaaaaaaaaaaaaaaaaaaaaaaaaaaaaaaaaaaaaaaaaaaaaaaaaaaaaaaaaaaaaaaaaaaaaaaaaaaaaaaaaaaaaaaaaaaaaaaaaaaaaaaaaaaaaaaaaaaaaaaaaaaaaaaaaaaaaaaaaaaaaaaaaaaaaaaaaaaaaaaaaaaaaaaaaaaaaaaaaaaaaaaaaaaaaaaaaaaaaaaaaaaaaaaaaaaaaaaaaaaaaaaaaaaaaaaaaaaaaaaaaaaaaaaaaaaaaaaaaaaaaaaaaaaaaaaaaaaaaaaaaaaaaaaaaaaaaaaaaaaaaaaaaaaaaaaaaaaaaaaaaaaaaaaaaaaaaaaaaaaaaaaaaaaaaaaaaaaaaaaaaaaaaaaaaaaaaaaaaaaaaaaaaaaaaaaaaaaaaaaaaaaaaaaaaaaaaaaaaaaaaaaaaaaaaaaaaaaaaaaaaaaaaaaaaaaaaaaaaaaaaaaaaaaaaaaaaaaaaaaaaaaaaaaaaaaaaaaaaaaaaaaaaaaaaaaaaaaaaaaaaaaaaaaaaaaaaaaaaaaaaaaaaaaaaaaaaaaaaaaaaaaaaaaaaaaaaaaaaaaaaaaaaaaaaaaaaaaaaaaaaaaaaaaaaaaaaaaaaaaaaaaaaaaaaaaaaaaaaaaaaaaaaaaaaaaaaaaaaaaaaaaaaaaaaaaaaaaaaaaaaaaaaaaaaaaaaaaaaaaaaaaaaaaaaaaaaaaaaaaaaaaaaaaaaaaaaaaaaaaaaaaaaaaaaaaaaaaaaaaaaaaaaaaaaaaaaaaaaaaaaaaaaaaaaaaaaaaaaaaaaaaaaaaaaaaaaaaaaaaaaaaaaaaaaaaaaaaaaaaaaaaaaaaaaaaaaaaaaaaaaaaaaaaaaaaaaaaaaaaaaaaaaaaaaaaaaaaaaaaaaaaaaaaaaaaaaaaaaaaaaaaaaaaaaaaaaaaaaaaaaaaaaaaaaaaaaaaaaaaaaaaaaaaaaaaaaaaaaaaaaaaaaaaaaaaaaaaaaaaaaaaaaaaaaaaaaaaaaaaaaaaaaaaaaaaaaaaaaaaaaaaaaaaaaaaaaaaaaaaaaaaaaaaaaaaaaaaaaaaaaaaaaaaaaaaaaaaaaaaaaaaaaaaaaaaaaaaaaaaaaaaaaaaaaaaaaaaaaaaaaaaaaaaaaaaaaaaaaaaaaaaaaaaaaaaaaaaaaaaaaaaaaaaaaaaaaaaaaaaaaaaaaaaaaaaaaaaaaaaaaaaaaaaaaaaaaaaaaaaaaaaaaaaaaaaaaaaaaaaaaaaaaaaaaaaaaaaaaaaaaaaaaaaaaaaaaaaaaaaaaaaaaaaaaaaaaaaaaaaaaaaaaaaaaaaaaaaaaaaaaaaaaaaaaaaaaaaaaaaaaaaaaaaaaaaaaaaaaaaaaaaaaaaaaaaaaaaaaaaaaaaaaaaaaaaaaaaaaaaaaaaaaaaaaaaaaaaaaaaaaaaaaaaaaaaaaaaaaaaaaaaaaaaaaaaaaaaaaaaaaaaaaaaaaaaaaaaaaaaaaaaaaaaaaaaaaaaaaaaaaaaaaaaaaaaaaaaaaaaaaaaaaaaaaaaaaaaaaaaaaaaaaaaaaaaaaaaaaaaaaaaaaaaaaaaaaaaaaaaaaaaaaaaaaaaaaaaaaaaaaaaaaaaaaaaaaaaaaaaaaaaaaaaaaaaaaaaaaaaaaaaaaaaaaaaaaaaaaaaaaaaaaaaaaaaaaaaaaaaaaaaaaaaaaaaaaaaaaaaaaaaaaaaaaaaaaaaaaaaaaaaaaaaaaaaaaaaaaaaaaaaaaaaaaaaaaaaaaaaaaaaaaaaaaaaaaaaaaaaaaaaaaaaaaaaaaaaaaaaaaaaaaaaaaaaaaaaaaaaaaaaaaaaaaaaaaaaaaaaaaaaaaaaaaaaaaaaaaaaaaaaaaaaaaaaaaaaaaaaaaaaaaaaaaaaaaaaaaaaaaaaaaaaaaaaaaaaaaaaaaaaaaaaaaaaaaaaaaaaaaaaaaaaaaaaaaaaaaaaaaaaaaaaaaaaaaaaaaaaaaaaaaaaaaaaaaaaaaaaaaaaaaaaaaaaaaaaaaaaaaaaaaaaaaaaaaaaaaaaaaaaaaaaaaaaaaaaaaaaaaaaaaaaaaaaaaaaaaaaaaaaaaaaaaaaaaaaaaaaaaaaaaaaaaaaaaaaaaaaaaaaaaaaaaaaaaaaaaaaaaaaaaaaaaaaaaaaaaaaaaaaaaaaaaaaaaaaaaaaaaaaaaaaaaaaaaaaaaaaaaaaaaaaaaaaaaaaaaaaaaaaaaaaaaaaaaaaaaaaaaaaaaaaaaaaaaaaaaaaaaaaaaaaaaaaaaaaaaaaaaaaaaaaaaaaaaaaaaaaaaaaaaaaaaaaaaaaaaaaaaaaaaaaaaaaaaaaaaaaaaaaaaaaaaaaaaaaaaaaaaaaaaaaaaaaaaaaaaaaaaaaaaaaaaaaaaaaaaaaaaaaaaaaaaaaaaaaaaaaaaaaaaaaaaaaaaaaaaaaaaaaaaaaaaaaaaaaaaaaaaaaaaaaaaaaaaaaaaaaaaaaaaaaaaaaaaaaaaaaaaaaaaaaaaaaaaaaaaaaaaaaaaaaaaaaaaaaaaaaaaaaaaaaaaaaaaaaaaaaaaaaaaaaaaaaaaaaaaaaaaaaaaaaaaaaaaaaaaaaaaaaaaaaaaaaaaaaaaaaaaaaaaaaaaaaaaaaaaaaaaaaaaaaaaaaaaaaaaaaaaaaaaaaaaaaaaaaaaaaaaaaaaaaaaaaaaaaaaaaaaaaaaaaaaaaaaaaaaaaaaaaaaaaaaaaaaaaaaaaaaaaaaaaaaaaaaaaaaaaaaaaaaaaaaaaaaaaaaaaaaaaaaaaaaaaaaaaaaaaaaaaaaaaaaaaaaaaaaaaaaaaaaaaaaaaaaaaaaaaaaaaaaaaaaaaaaaaaaaaaaaaaaaaaaaaaaaaaaaaaaaaaaaaaaaaaaaaaaaaaaaaaaaaaaaaaaaaaaaaaaaaaaaaaaaaaaaaaaaaaaaaaaaaaaaaaaaaaaaaaaaaaaaaaaaaaaaaaaaaaaaaaaaaaaaaaaaaaaaaaaaaaaaaaaaaaaaaaaaaaaaaaaaaaaaaaaaaaaaaaaaaaaaaaaaaaaaaaaaaaaaaaaaaaaaaaaaaaaaaaaaaaaaaaaaaaaaaaaaaaaaaaaaaaaaaaaaaaaaaaaaaaaaaaaaaaaaaaaaaaaaaaaaaaaaaaaaaaaaaaaaaaaaaaaaaaaaaaaaaaaaaaaaaaaaaaaaaaaaaaaaaaaaaaaaaaaaaaaaaaaaaaaaaaaaaaaaaaaaaaaaaaaaaaaaaaaaaaaaaaaaaaaaaaaaaaaaaaaaaaaaaaaaaaaaaaaaaaaaaaaaaaaaaaaaaaaaaaaaaaaaaaaaaaaaaaaaaaaaaaaaaaaaaaaaaaaaaaaaaaaaaaaaaaaaaaaaaaaaaaaaaaaaaaaaaaaaaaaaaaaaaaaaaaaaaaaaaaaaaaaaaaaaaaaaaaaaaaaaaaaaaaaaaaaaaaaaaaaaaaaaaaaaaaaaaaaaaaaaaaaaaaaaaaaaaaaaaaaaaaaaaaaaaaaaaaaaaaaaaaaaaaaaaaaaaaaaaaaaaaaaaaaaaaaaaaaaaaaaaaaaaaaaaaaaaaaaaaaaaaaaaaaaaaaaaaaaaaaaaaaaaaaaaaaaaaaaaaaaaaaaaaaaaaaaaaaaaaaaaaaaaaaaaaaaaaaaaaaaaaaaaaaaaaaaaaaaaaaaaaaaaaaaaaaaaaaaaaaaaaaaaaaaaaaaaaaaaaaaaaaaaaaaaaaaaaaaaaaaaaaaaaaaaaaaaaaaaaaaaaaaaaaaaaaaaaaaaaaaaaaaaaaaaaaaaaaaaaaaaaaaaaaaaaaaaaaaaaaaaaaaaaaaaaaaaaaaaaaaaaaaaaaaaaaaaaaaaaaaaaaaaaaaaaaaaaaaaaaaaaaaaaaaaaaaaaaaaaaaaaaaaaaaaaaaaaaaaaaaaaaaaaaaaaaaaaaaaaaaaaaaaaaaaaaaaaaaaaaaaaaaaaaaaaaaaaaaaaaaaaaaaaaaaaaaaaaaaaaaaaaaaaaaaaaaaaaaaaaaaaaaaaaaaaaaaaaaaaaaaaaaaaaaaaaaaaaaaaaaaaaaaaaaaaaaaaaaaaaaaaaaaaaaaaaaaaaaaaaaaaaaaaaaaaaaaaaaaaaaaaaaaaaaaaaaaaaaaaaaaaaaaaaaaaaaaaaaaaaaaaaaaaaaaaaaaaaaaaaaaaaaaaaaaaaaaaaaaaaaaaaaaaaaaaaaaaaaaaaaaaaaaaaaaaaaaaaaaaaaaaaaaaaaaaaaaaaaaaaaaaaaaaaaaaaaaaaaaaaaaaaaaaaaaaaaaaaaaaaaaaaaaaaaaaaaaaaaaaaaaaaaaaaaaaaaaaaaaaaaaaaaaaaaaaaaaaaaaaaaaaaaaaaaaaaaaaaaaaaaaaaaaaaaaaaaaaaaaaaaaaaaaaaaaaaaaaaaaaaaaaaaaaaaaaaaaaaaaaaaaaaaaaaaaaaaaaaaaaaaaaaaaaaaaaaaaaaaaaaaaaaaaaaaaaaaaaaaaaaaaaaaaaaaaaaaaaaaaaaaaaaaaaaaaaaaaaaaaaaaaaaaaaaaaaaaaaaaaaaaaaaaaaaaaaaaaaaaaaaaaaaaaaaaaaaaaaaaaaaaaaaaaaaaaaaaaaaaaaaaaaaaaaaaaaaaaaaaaaaaaaaaaaaaaaaaaaaaaaaaaaaaaaaaaaaaaaaaaaaaaaaaaaaaaaaaaaaaaaaaaaaaaaaaaaaaaaaaaaaaaaaaaaaaaaaaaaaaaaaaaaaaaaaaaaaaaaaaaaaaaaaaaaaaaaaaaaaaaaaaaaaaaaaaaaaaaaaaaaaaaaaaaaaaaaaaaaaaaaaaaaaaaaaaaaaaaaaaaaaaaaaaaaaaaaaaaaaaaaaaaaaaaaaaaaaaaaaaaaaaaaaaaaaaaaaaaaaaaaaaaaaaaaaaaaaaaaaaaaaaaaaaaaaaaaaaaaaaaaaaaaaaaaaaaaaaaaaaaaaaaaaaaaaaaaaaaaaaaaaaaaaaaaaaaaaaaaaaaaaaaaaaaaaaaaaaaaaaaaaaaaaaaaaaaaaaaaaaaaaaaaaaaaaaaaaaaaaaaaaaaaaaaaaaaaaaaaaaaaaaaaaaaaaaaaaaaaaaaaaaaaaaaaaaaaaaaaaaaaaaaaaaaaaaaaaaaaaaaaaaaaaaaaaaaaaaaaaaaaaaaaaaaaaaaaaaaaaaaaaaaaaaaaaaaaaaaaaaaaaaaaaaaaaaaaaaaaaaaaaaaaaaaaaaaaaaaaaaaaaaaaaaaaaaaaaaaaaaaaaaaaaaaaaaaaaaaaaaaaaaaaaaaaaaaaaaaaaaaaaaaaaaaaaaaaaaaaaaaaaaaaaaaaaaaaaaaaaaaaaaaaaaaaaaaaaaaaaaaaaaaaaaaaaaaaaaaaaaaaaaaaaaaaaaaaaaaaaaaaaaaaaaaaaaaaaaaaaaaaaaaaaaaaaaaaaaaaaaaaaaaaaaaaaaaaaaaaaaaaaaaaaaaaaaaaaaaaaaaaaaaaaaaaaaaaaaaaaaaaaaaaaaaaaaaaaaaaaaaaaaaaaaaaaaaaaaaaaaaaaaaaaaaaaaaaaaaaaaaaaaaaaaaaaaaaaaaaaaaaaaaaaaaaaaaaaaaaaaaaaaaaaaaaaaaaaaaaaaaaaaaaaaaaaaaaaaaaaaaaaaaaaaaaaaaaaaaaaaaaaaaaaaaaaaaaaaaaaaaaaaaaaaaaaaaaaaaaaaaaaaaaaaaaaaaaaaaaaaaaaaaaaaaaaaaaaaaaaaaaaaaaaaaaaaaaaaaaaaaaaaaaaaaaaaaaaaaaaaaaaaaaaaaaaaaaaaaaaaaaaaaaaaaaaaaaaaaaaaaaaaaaaaaaaaaaaaaaaaaaaaaaaaaaaaaaaaaaaaaaaaaaaaaaaaaaaaaaaaaaaaaaaaaaaaaaaaaaaaaaaaaaaaaaaaaaaaaaaaaaaaaaaaaaaaaaaaaaaaaaaaaaaaaaaaaaaaaaaaaaaaaaaaaaaaaaaaaaaaaaaaaaaaaaaaaaaaaaaaaaaaaaaaaaaaaaaaaaaaaaaaaaaaaaaaaaaaaaaaaaaaaaaaaaaaaaaaaaaaaaaaaaaaaaaaaaaaaaaaaaaaaaaaaaaaaaaaaaaaaaaaaaaaaaaaaaaaaaaaaaaaaaaaaaaaaaaaaaaaaaaaaaaaaaaaaaaaaaaaaaaaaaaaaaaaaaaaaaaaaaaaaaaaaaaaaaaaaaaaaaaaaaaaaaaaaaaaaaaaaaaaaaaaaaaaaaaaaaaaaaaaaaaaaaaaaaaaaaaaaaaaaaaaaaaaaaaaaaaaaaaaaaaaaaaaaaaaaaaaaaaaaaaaaaaaaaaaaaaaaaaaaaaaaaaaaaaaaaaaaaaaaaaaaaaaaaaaaaaaaaaaaaaaaaaaaaaaaaaaaaaaaaaaaaaaaaaaaaaaaaaaaaaaaaaaaaaaaaaaaaaaaaaaaaaaaaaaaaaaaaaaaaaaaaaaaaaaaaaaaaaaaaaaaaaaaaaaaaaaaaaaaaaaaaaaaaaaaaaaaaaaaaaaaaaaaaaaaaaaaaaaaaaaaaaaaaaaaaaaaaaaaaaaaaaaaaaaaaaaaaaaaaaaaaaaaaaaaaaaaaaaaaaaaaaaaaaaaaaaaaaaaaaaaaaaaaaaaaaaaaaaaaaaaaaaaaaaaaaaaaaaaaaaaaaaaaaaaaaaaaaaaaaaaaaaaaaaaaaaaaaaaaaaaaaaaaaaaaaaaaaaaaaaaaaaaaaaaaaaaaaaaaaaaaaaaaaaaaaaaaaaaaaaaaaaaaaaaaaaaaaaaaaaaaaaaaaaaaaaaaaaaaaaaaaaaaaaaaaaaaaaaaaaaaaaaaaaaaaaaaaaaaaaaaaaaaaaaaaaaaaaaaaaaaaaaaaaaaaaaaaaaaaaaaaaaaaaaaaaaaaaaaaaaaaaaaaaaaaaaaaaaaaaaaaaaaaaaaaaaaaaaaaaaaaaaaaaaaaaaaaaaaaaaaaaaaaaaaaaaaaaaaaaaaaaaaaaaaaaaaaaaaaaaaaaaaaaaaaaaaaaaaaaaaaaaaaaaaaaaaaaaaaaaaaaaaaaaaaaaaaaaaaaaaaaaaaaaaaaaaaaaaaaaaaaaaaaaaaaaaaaaaaaaaaaaaaaaaaaaaaaaaaaaaaaaaaaaaaaaaaaaaaaaaaaaaaaaaaaaaaaaaaaaaaaaaaaaaaaaaaaaaaaaaaaaaaaaaaaaaaaaaaaaaaaaaaaaaaaaaaaaaaaaaaaaaaaaaaaaaaaaaaaaaaaaaaaaaaaaaaaaaaaaaaaaaaaaaaaaaaaaaaaaaaaaaaaaaaaaaaaaaaaaaaaaaaaaaaaaaaaaaaaaaaaaaaaaaaaaaaaaaaaaaaaaaaaaaaaaaaaaaaaaaaaaaaaaaaaaaaaaaaaaaaaaaaaaaaaaaaaaaaaaaaaaaaaaaaaaaaaaaaaaaaaaaaaaaaaaaaaaaaaaaaaaaaaaaaaaaaaaaaaaaaaaaaaaaaaaaaaaaaaaaaaaaaaaaaaaaaaaaaaaaaaaaaaaaaaaaaaaaaaaaaaaaaaaaaaaaaaaaaaaaaaaaaaaaaaaaaaaaaaaaaaaaaaaaaaaaaaaaaaaaaaaaaaaaaaaaaaaaaaaaaaaaaaaaaaaaaaaaaaaaaaaaaaaaaaaaaaaaaaaaaaaaaaaaaaaaaaaaaaaaaaaaaaaaaaaaaaaaaaaaaaaaaaaaaaaaaaaaaaaaaaaaaaaaaaaaaaaaaaaaaaaaaaaaaaaaaaaaaaaaaaaaaaaaaaaaaaaaaaaaaaaaaaaaaaaaaaaaaaaaaaaaaaaaaaaaaaaaaaaaaaaaaaaaaaaaaaaaaaaaaaaaaaaaaaaaaaaaaaaaaaaaaaaaaaaaaaaaaaaaaaaaaaaaaaaaaaaaaaaaaaaaaaaaaaaaaaaaaaaaaaaaaaaaaaaaaaaaaaaaaaaaaaaaaaaaaaaaaaaaaaaaaaaaaaaaaaaaaaaaaaaaaaaaaaaaaaaaaaaaaaaaaaaaaaaaaaaaaaaaaaaaaaaaaaaaaaaaaaaaaaaaaaaaaaaaaaaaaaaaaaaaaaaaaaaaaaaaaaaaaaaaaaaaaaaaaaaaaaaaaaaaaaaaaaaaaaaaaaaaaaaaaaaaaaaaaaaaaaaaaaaaaaaaaaaaaaaaaaaaaaaaaaaaaaaaaaaaaaaaaaaaaaaaaaaaaaaaaaaaaaaaaaaaaaaaaaaaaaaaaaaaaaaaaaaaaaaaaaaaaaaaaaaaaaaaaaaaaaaaaaaaaaaaaaaaaaaaaaaaaaaaaaaaaaaaaaaaaaaaaaaaaaaaaaaaaaaaaaaaaaaaaaaaaaaaaaaaaaaaaaaaaaaaaaaaaaaaaaaaaaaaaaaaaaaaaaaaaaaaaaaaaaaaaaaaaaaaaaaaaaaaaaaaaaaaaaaaaaaaaaaaaaaaaaaaaaaaaaaaaaaaaaaaaaaaaaaaaaaaaaaaaaaaaaaaaaaaaaaaaaaaaaaaaaaaaaaaaaaaaaaaaaaaaaaaaaaaaaaaaaaaaaaaaaaaaaaaaaaaaaaaaaaaaaaaaaaaaaaaaaaaaaaaaaaaaaaaaaaaaaaaaaaaaaaaaaaaaaaaaaaaaaaaaaaaaaaaaaaaaaaaaaaaaaaaaaaaaaaaaaaaaaaaaaaaaaaaaaaaaaaaaaaaaaaaaaaaaaaaaaaaaaaaaaaaaaaaaaaaaaaaaaaaaaaaaaaaaaaaaaaaaaaaaaaaaaaaaaaaaaaaaaaaaaaaaaaaaaaaaaaaaaaaaaaaaaaaaaaaaaaaaaaaaaaaaaaaaaaaaaaaaaaaaaaaaaaaaaaaaaaaaaaaaaaaaaaaaaaaaaaaaaaaaaaaaaaaaaaaaaaaaaaaaaaaaaaaaaaaaaaaaaaaaaaaaaaaaaaaaaaaaaaaaaaaaaaaaaaaaaaaaaaaaaaaaaaaaaaaaaaaaaaaaaaaaaaaaaaaaaaaaaaaaaaaaaaaaaaaaaaaaaaaaaaaaaaaaaaaaaaaaaaaaaaaaaaaaaaaaaaaaaaaaaaaaaaaaaaaaaaaaaaaaaaaaaaaaaaaaaaaaaaaaaaaaaaaaaaaaaaaaaaaaaaaaaaaaaaaaaaaaaaaaaaaaaaaaaaaaaaaaaaaaaaaaaaaaaaaaaaaaaaaaaaaaaaaaaaaaaaaaaaaaaaaaaaaaaaaaaaaaaaaaaaaaaaaaaaaaaaaaaaaaaaaaaaaaaaaaaaaaaaaaaaaaaaaaaaaaaaaaaaaaaaaaaaaaaaaaaaaaaaaaaaaaaaaaaaaaaaaaaaaaaaaaaaaaaaaaaaaaaaaaaaaaaaaaaaaaaaaaaaaaaaaaaaaaaaaaaaaaaaaaaaaaaaaaaaaaaaaaaaaaaaaaaaaaaaaaaaaaaaaaaaaaaaaaaaaaaaaaaaaaaaaaaaaaaaaaaaaaaaaaaaaaaaaaaaaaaaaaaaaaaaaaaaaaaaaaaaaaaaaaaaaaaaaaaaaaaaaaaaaaaaaaaaaaaaaaaaaaaaaaaaaaaaaaaaaaaaaaaaaaaaaaaaaaaaaaaaaaaaaaaaaaaaaaaaaaaaaaaaaaaaaaaaaaaaaaaaaaaaaaaaaaaaaaaaaaaaaaaaaaaaaaaaaaaaaaaaaaaaaaaaaaaaaaaaaaaaaaaaaaaaaaaaaaaaaaaaaaaaaaaaaaaaaaaaaaaaaaaaaaaaaaaaaaaaaaaaaaaaaaaaaaaaaaaaaaaaaaaaaaaaaaaaaaaaaaaaaaaaaaaaaaaaaaaaaaaaaaaaaaaaaaaaaaaaaaaaaaaaaaaaaaaaaaaaaaaaaaaaaaaaaaaaaaaaaaaaaaaaaaaaaaaaaaaaaaaaaaaaaaaaaaaaaaaaaaaaaaaaaaaaaaaaaaaaaaaaaaaaaaaaaaaaaaaaaaaaaaaaaaaaaaaaaaaaaaaaaaaaaaaaaaaaaaaaaaaaaaaaaaaaaaaaaaaaaaaaaaaaaaaaaaaaaaaaaaaaaaaaaaaaaaaaaaaaaaaaaaaaaaaaaaaaaaaaaaaaaaaaaaaaaaaaaaaaaaaaaaaaaaaaaaaaaaaaaaaaaaaaaaaaaaaaaaaaaaaaaaaaaaaaaaaaaaaaaaaaaaaaaaaaaaaaaaaaaaaaaaaaaaaaaaaaaaaaaaaaaaaaaaaaaaaaaaaaaaaaaaaaaaaaaaaaaaaaaaaaaaaaaaaaaaaaaaaaaaaaaaaaaaaaaaaaaaaaaaaaaaaaaaaaaaaaaaaaaaaaaaaaaaaaaaaaaaaaaaaaaaaaaaaaaaaaaaaaaaaaaaaaaaaaaaaaaaaaaaaaaaaaaaaaaaaaaaaaaaaaaaaaaaaaaaaaaaaaaaaaaaaaaaaaaaaaaaaaaaaaaaaaaaaaaaaaaaaaaaaaaaaaaaaaaaaaaaaaaaaaaaaaaaaaaaaaaaaaaaaaaaaaaaaaaaaaaaaaaaaaaaaaaaaaaaaaaaaaaaaaaaaaaaaaaaaaaaaaaaaaaaaaaaaaaaaaaaaaaaaaaaaaaaaaaaaaaaaaaaaaaaaaaaaaaaaaaaaaaaaaaaaaaaaaaaaaaaaaaaaaaaaaaaaaaaaaaaaaaaaaaaaaaaaaaaaaaaaaaaaaaaaaaaaaaaaaaaaaaaaaaaaaaaaaaaaaaaaaaaaaaaaaaaaaaaaaaaaaaaaaaaaaaaaaaaaaaaaaaaaaaaaaaaaaaaaaaaaaaaaaaaaaaaaaaaaaaaaaaaaaaaaaaaaaaaaaaaaaaaaaaaaaaaaaaaaaaaaaaaaaaaaaaaaaaaaaaaaaaaaaaaaaaaaaaaaaaaaaaaaaaaaaaaaaaaaaaaaaaaaaaaaaaaaaaaaaaaaaaaaaaaaaaaaaaaaaaaaaaaaaaaaaaaaaaaaaaaaaaaaaaaaaaaaaaaaaaaaaaaaaaaaaaaaaaaaaaaaaaaaaaaaaaaaaaaaaaaaaaaaaaaaaaaaaaaaaaaaaaaaaaaaaaaaaaaaaaaaaaaaaaaaaaaaaaaaaaaaaaaaaaaaaaaaaaaaaaaaaaaaaaaaaaaaaaaaaaaaaaaaaaaaaaaaaaaaaaaaaaaaaaaaaaaaaaaaaaaaaaaaaaaaaaaaaaaaaaaaaaaaaaaaaaaaaaaaaaaaaaaaaaaaaaaaaaaaaaaaaaaaaaaaaaaaaaaaaaaaaaaaaaaaaaaaaaaaaaaaaaaaaaaaaaaaaaaaaaaaaaaaaaaaaaaaaaaaaaaaaaaaaaaaaaaaaaaaaaaaaaaaaaaaaaaaaaaaaaaaaaaaaaaaaaaaaaaaaaaaaaaaaaaaaaaaaaaaaaaaaaaaaaaaaaaaaaaaaaaaaaaaaaaaaaaaaaaaaaaaaaaaaaaaaaaaaaaaaaaaaaaaaaaaaaaaaaaaaaaaaaaaaaaaaaaaaaaaaaaaaaaaaaaaaaaaaaaaaaaaaaaaaaaaaaaaaaaaaaaaaaaaaaaaaaaaaaaaaaaaaaaaaaaaaaaaaaaaaaaaaaaaaaaaaaaaaaaaaaaaaaaaaaaaaaaaaaaaaaaaaaaaaaaaaaaaaaaaaaaaaaaaaaaaaaaaaaaaaaaaaaaaaaaaaaaaaaaaaaaaaaaaaaaaaaaaaaaaaaaaaaaaaaaaaaaaaaaaaaaaaaaaaaaaaaaaaaaaaaaaaaaaaaaaaaaaaaaaaaaaaaaaaaaaaaaaaaaaaaaaaaaaaaaaaaaaaaaaaaaaaaaaaaaaaaaaaaaaaaaaaaaaaaaaaaaaaaaaaaaaaaaaaaaaaaaaaaaaaaaaaaaaaaaaaaaaaaaaaaaaaaaaaaaaaaaaaaaaaaaaaaaaaaaaaaaaaaaaaaaaaaaaaaaaaaaaaaaaaaaaaaaaaaaaaaaaaaaaaaaaaaaaaaaaaaaaaaaaaaaaaaaaaaaaaaaaaaaaaaaaaaaaaaaaaaaaaaaaaaaaaaaaaaaaaaaaaaaaaaaaaaaaaaaaaaaaaaaaaaaaaaaaaaaaaaaaaaaaaaaaaaaaaaaaaaaaaaaaaaaaaaaaaaaaaaaaaaaaaaaaaaaaaaaaaaaaaaaaaaaaaaaaaaaaaaaaaaaaaaaaaaaaaaaaaaaaaaaaaaaaaaaaaaaaaaaaaaaaaaaaaaaaaaaaaaaaaaaaaaaaaaaaaaaaaaaaaaaaaaaaaaaaaaaaaaaaaaaaaaaaaaaaaaaaaaaaaaaaaaaaaaaaaaaaaaaaaaaaaaaaaaaaaaaaaaaaaaaaaaaaaaaaaaaaaaaaaaaaaaaaaaaaaaaaaaaaaaaaaaaaaaaaaaaaaaaaaaaaaaaaaaaaaaaaaaaaaaaaaaaaaaaaaaaaaaaaaaaaaaaaaaaaaaaaaaaaaaaaaaaaaaaaaaaaaaaaaaaaaaaaaaaaaaaaaaaaaaaaaaaaaaaaaaaaaaaaaaaaaaaaaaaaaaaaaaaaaaaaaaaaaaaaaaaaaaaaaaaaaaaaaaaaaaaaaaaaaaaaaaaaaaaaaaaaaaaaaaaaaaaaaaaaaaaaaaaaaaaaaaaaaaaaaaaaaaaaaaaaaaaaaaaaaaaaaaaaaaaaaaaaaaaaaaaaaaaaaaaaaaaaaaaaaaaaaaaaaaaaaaaaaaaaaaaaaaaaaaaaaaaaaaaaaaaaaaaaaaaaaaaaaaaaaaaaaaaaaaaaaaaaaaaaaaaaaaaaaaaaaaaaaaaaaaaaaaaaaaaaaaaaaaaaaaaaaaaaaaaaaaaaaaaaaaaaaaaaaaaaaaaaaaaaaaaaaaaaaaaaaaaaaaaaaaaaaaaaaaaaaaaaaaaaaaaaaaaaaaaaaaaaaaaaaaaaaaaaaaaaaaaaaaaaaaaaaaaaaaaaaaaaaaaaaaaaaaaaaaaaaaaaaaaaaaaaaaaaaaaaaaaaaaaaaaaaaaaaaaaaaaaaaaaaaaaaaaaaaaaaaaaaaaaaaaaaaaaaaaaaaaaaaaaaaaaaaaaaaaaaaaaaaaaaaaaaa": 1}
create table jro
(
a int,
b varchar( 10 ),
c boolean
);
insert into jro( a, b, c ) values
( 0, 'zero', false ),
( 1, 'one', true ),
( null, null, null );
select a, json_object( 'a', a, 'b', b, 'c', c )
from jro
order by a;
a	json_object( 'a', a, 'b', b, 'c', c )
NULL	{"a": null, "b": null, "c": null}
0	{"a": 0, "b": "zero", "c": 0}
1	{"a": 1, "b": "one", "c": 1}
drop table jro;
create table jro2( a int, b varchar( 10 ), c json );
insert into jro2 ( a, b, c ) values
( 1, 'array', '[ 1, 2, 3 ]' ), ( 2, 'object', '{ "d": "foo", "e": true }' );
select a, json_object( 'type', b, 'value', c )
from jro2 order by a;
a	json_object( 'type', b, 'value', c )
1	{"type": "array", "value": [1, 2, 3]}
2	{"type": "object", "value": {"d": "foo", "e": true}}
drop table jro2;
select json_object(json_array(), json_array());
json_object(json_array(), json_array())
{"[]": []}
select json_object( cast(json_array() as char), json_array());
json_object( cast(json_array() as char), json_array())
{"[]": []}
select json_object( 1, json_array());
json_object( 1, json_array())
{"1": []}
select json_object( cast(1 as char), json_array());
json_object( cast(1 as char), json_array())
{"1": []}
create table department( id int, deptName varchar(50), isExempt boolean, blobColumn blob );
insert into department values ( 405, 'Accounting', true, '<a><b>ccc</b><d></d></a>' );
SELECT JSON_OBJECT();
JSON_OBJECT()
{}
SELECT JSON_OBJECT
(
'deptName', d.deptName,
'id', d.id,
'isExempt', d.isExempt and true
)
FROM department d
WHERE id = 405;
JSON_OBJECT
(
'deptName', d.deptName,
'id', d.id,
'isExempt', d.isExempt and true
)
{"id": 405, "deptName": "Accounting", "isExempt": true}
drop table department;
create table misc_dt
(
py polygon
);
insert into misc_dt values
(
ST_GeomFromText('POLYGON((0 0,10 0,10 10,0 10,0 0),
    (5 5,7 5,7 7,5 7, 5 5))')
);
select json_object( py, 'def' ) from misc_dt;
ERROR 22032: Cannot create a JSON value from a string with CHARACTER SET 'binary'.
drop table misc_dt;
# ----------------------------------------------------------------------
# Test of JSON_SEARCH function.
# ----------------------------------------------------------------------
select json_search();
ERROR 42000: Incorrect parameter count in the call to native function 'json_search'
select json_search( '{ "a": true }' );
ERROR 42000: Incorrect parameter count in the call to native function 'json_search'
select json_search( '{ "a": true }', 'one' );
ERROR 42000: Incorrect parameter count in the call to native function 'json_search'
select json_search( null, 'one', 'foo' );
json_search( null, 'one', 'foo' )
NULL
select json_search( '{ "a": "foo" }', null, 'foo' );
json_search( '{ "a": "foo" }', null, 'foo' )
NULL
select json_search( '{ "a": "foo" }', 'one', 'foo', null, null );
json_search( '{ "a": "foo" }', 'one', 'foo', null, null )
NULL
select json_search( '{ "a": "foo" }', 'one', 'foo', null, '$.a', null );
json_search( '{ "a": "foo" }', 'one', 'foo', null, '$.a', null )
NULL
select json_search( '{ "a": "foo" }', 'twof', 'foo' );
ERROR 42000: The oneOrAll argument to json_search may take these values: 'one' or 'all'.
select json_search( '{ "a": "foo" }', 'two', 'foo' );
ERROR 42000: The oneOrAll argument to json_search may take these values: 'one' or 'all'.
select json_search( '{ "a": "foo" }', 'one', 'foo', 'ab' );
ERROR HY000: Incorrect arguments to ESCAPE
select json_search( '{ "a": "foo" }', 'one', 'foo', null, '$a' );
ERROR 42000: Invalid JSON path expression. The error is around character position 1.
select json_search( '{ "a": "foo" }', 'all', 'foo', null, '$.a', '$b' );
ERROR 42000: Invalid JSON path expression. The error is around character position 1.
select json_search(a, b, c);
ERROR 42S22: Unknown column 'a' in 'field list'
select json_search( '{ "a": "foobar" }', 'one', 'foo%' );
json_search( '{ "a": "foobar" }', 'one', 'foo%' )
"$.a"
select json_search( '{ "a": "foobar", "b": "focus", "c": [ "arm", "foot", "shoulder" ] }', 'one', 'foo%' );
json_search( '{ "a": "foobar", "b": "focus", "c": [ "arm", "foot", "shoulder" ] }', 'one', 'foo%' )
"$.a"
select json_search( '{ "a": "foobar", "b": "focus", "c": [ "arm", "foot", "shoulder" ] }', 'all', 'foo%' );
json_search( '{ "a": "foobar", "b": "focus", "c": [ "arm", "foot", "shoulder" ] }', 'all', 'foo%' )
["$.a", "$.c[1]"]
select json_search( '{ "a": "foobar", "b": "focus", "c": [ "arm", "foot", "shoulder" ] }', 'all', 'f__us' );
json_search( '{ "a": "foobar", "b": "focus", "c": [ "arm", "foot", "shoulder" ] }', 'all', 'f__us' )
"$.b"
create table json_search_table( id_col int, json_col json );
insert into json_search_table values
( 1, '{ "a": "foobar" }' ),
( 2, '{ "a": "foobar", "b": "focus", "c": [ "arm", "foot", "shoulder" ] }' );
select id_col, json_search( json_col, 'all', 'foo%' )
from json_search_table
order by id_col;
id_col	json_search( json_col, 'all', 'foo%' )
1	"$.a"
2	["$.a", "$.c[1]"]
select id_col, json_search( json_col, 'all', 'foot' )
from json_search_table
order by id_col;
id_col	json_search( json_col, 'all', 'foot' )
1	NULL
2	"$.c[1]"
select id_col, json_search( json_col, 'all', 'f__us' )
from json_search_table
order by id_col;
id_col	json_search( json_col, 'all', 'f__us' )
1	NULL
2	"$.b"
delete from json_search_table;
insert into json_search_table values
( 1, '{ "a": "foobar" }' ),
( 2, '{ "a": [ "foolish", "folly", "foolhardy"  ], "b" : "fool" }' );
select json_search( '{ "a": [ "foolish", "folly", "foolhardy"  ], "b" : "fool" }', 'all', 'foo%', null, '$.a' );
json_search( '{ "a": [ "foolish", "folly", "foolhardy"  ], "b" : "fool" }', 'all', 'foo%', null, '$.a' )
["$.a[0]", "$.a[2]"]
select json_search( '{ "a": [ "foolish", "folly", "foolhardy"  ], "b" : "fool" }', 'all', 'foo%', null, '$.a', '$.b' );
json_search( '{ "a": [ "foolish", "folly", "foolhardy"  ], "b" : "fool" }', 'all', 'foo%', null, '$.a', '$.b' )
["$.a[0]", "$.a[2]", "$.b"]
select json_search( '{ "a": [ "foolish", "folly", "foolhardy"  ], "b" : "fool" }', 'one', 'foo%', null, '$.a', '$.b' );
json_search( '{ "a": [ "foolish", "folly", "foolhardy"  ], "b" : "fool" }', 'one', 'foo%', null, '$.a', '$.b' )
"$.a[0]"
select json_search( '{ "a": [ "foolish", "folly", "foolhardy"  ], "b" : "fool" }', 'ALL', 'foo%', null, '$.a' );
json_search( '{ "a": [ "foolish", "folly", "foolhardy"  ], "b" : "fool" }', 'ALL', 'foo%', null, '$.a' )
["$.a[0]", "$.a[2]"]
select json_search( '{ "a": [ "foolish", "folly", "foolhardy"  ], "b" : "fool" }', 'aLl', 'foo%', null, '$.a', '$.b' );
json_search( '{ "a": [ "foolish", "folly", "foolhardy"  ], "b" : "fool" }', 'aLl', 'foo%', null, '$.a', '$.b' )
["$.a[0]", "$.a[2]", "$.b"]
select json_search( '{ "a": [ "foolish", "folly", "foolhardy"  ], "b" : "fool" }', 'ONE', 'foo%', null, '$.a', '$.b' );
json_search( '{ "a": [ "foolish", "folly", "foolhardy"  ], "b" : "fool" }', 'ONE', 'foo%', null, '$.a', '$.b' )
"$.a[0]"
select id_col, json_search( json_col, 'all', 'foo%', null, '$.a' )
from json_search_table
order by id_col;
id_col	json_search( json_col, 'all', 'foo%', null, '$.a' )
1	"$.a"
2	["$.a[0]", "$.a[2]"]
select id_col, json_search( json_col, 'all', 'foo%', null, '$.a', '$.b' )
from json_search_table
order by id_col;
id_col	json_search( json_col, 'all', 'foo%', null, '$.a', '$.b' )
1	"$.a"
2	["$.a[0]", "$.a[2]", "$.b"]
select id_col, json_search( json_col, 'one', 'foo%', null, '$.a', '$.b' )
from json_search_table
order by id_col;
id_col	json_search( json_col, 'one', 'foo%', null, '$.a', '$.b' )
1	"$.a"
2	"$.a[0]"
select json_search
(
'[ { "a": { "b": { "c": "fool" } } }, { "b": { "c": "shoulder" } }, { "c": { "c": "food"} } ]',
'all',
'foo%',
null,
'$**.c'
);
json_search
(
'[ { "a": { "b": { "c": "fool" } } }, { "b": { "c": "shoulder" } }, { "c": { "c": "food"} } ]',
'all',
'foo%',
null,
'$**.c'
)
["$[0].a.b.c", "$[2].c.c"]
delete from json_search_table;
insert into json_search_table values
( 1, '{ "a": "foobar" }' ),
( 2, '[ { "a": { "b": { "c": "fool" } } }, { "b": { "c": "shoulder" } }, { "c": { "c": "food"} } ]' );
select id_col, json_search( json_col, 'all', 'foo%', null, '$.a', '$**.c' )
from json_search_table
order by id_col;
id_col	json_search( json_col, 'all', 'foo%', null, '$.a', '$**.c' )
1	"$.a"
2	["$[0].a.b.c", "$[2].c.c"]
select id_col, json_search( json_col, 'one', 'foo%', null, '$.a', '$**.c' )
from json_search_table
order by id_col;
id_col	json_search( json_col, 'one', 'foo%', null, '$.a', '$**.c' )
1	"$.a"
2	"$[0].a.b.c"
select json_search
(
'[ { "a": { "b": { "c": "showtime" } } }, { "b": { "c": "shoulder" } }, { "c": { "c": "shoe"} } ]',
'all',
'sho%',
null,
'$**.c'
);
json_search
(
'[ { "a": { "b": { "c": "showtime" } } }, { "b": { "c": "shoulder" } }, { "c": { "c": "shoe"} } ]',
'all',
'sho%',
null,
'$**.c'
)
["$[0].a.b.c", "$[1].b.c", "$[2].c.c"]
select json_search
(
'[ { "a": { "b": { "c": "showtime" } } }, { "b": { "c": "shoulder" } }, { "c": { "c": "shoe"} } ]',
'all',
'sho%e',
null,
'$**.c'
);
json_search
(
'[ { "a": { "b": { "c": "showtime" } } }, { "b": { "c": "shoulder" } }, { "c": { "c": "shoe"} } ]',
'all',
'sho%e',
null,
'$**.c'
)
["$[0].a.b.c", "$[2].c.c"]
select json_search
(
'[ { "a": { "b": { "c": "showtime" } } }, { "b": { "c": "shoulder" } }, { "c": { "c": "shoe"} } ]',
'all',
'sho%',
null,
'$[*].c'
);
json_search
(
'[ { "a": { "b": { "c": "showtime" } } }, { "b": { "c": "shoulder" } }, { "c": { "c": "shoe"} } ]',
'all',
'sho%',
null,
'$[*].c'
)
"$[2].c.c"
select json_search
(
'[ { "a": { "b": { "c": "showtime" } } }, [ { "b": { "c": "shout" } }, { "c": { "c": "shoe"} } ] ]',
'all',
'sho%',
null,
'$[1]**.c'
);
json_search
(
'[ { "a": { "b": { "c": "showtime" } } }, [ { "b": { "c": "shout" } }, { "c": { "c": "shoe"} } ] ]',
'all',
'sho%',
null,
'$[1]**.c'
)
["$[1][0].b.c", "$[1][1].c.c"]
select json_search( '[ "footbar", "foo%bar" ]', 'all', 'foo%bar' );
json_search( '[ "footbar", "foo%bar" ]', 'all', 'foo%bar' )
["$[0]", "$[1]"]
select json_search( '[ "footbar", "foo%bar" ]', 'all', 'foo\%bar' );
json_search( '[ "footbar", "foo%bar" ]', 'all', 'foo\%bar' )
"$[1]"
select json_search( '[ "footbar", "foo%bar" ]', 'all', 'foo|%bar', '|' );
json_search( '[ "footbar", "foo%bar" ]', 'all', 'foo|%bar', '|' )
"$[1]"
select json_search( '[ "footbar", "foo%bar" ]', 'all', 'foo|%bar', '|', '$[0]' );
json_search( '[ "footbar", "foo%bar" ]', 'all', 'foo|%bar', '|', '$[0]' )
NULL
select json_search( '[ "footbar", "foo%bar" ]', 'all', 'foo|%bar', '|', '$[0]', '$[1]' );
json_search( '[ "footbar", "foo%bar" ]', 'all', 'foo|%bar', '|', '$[0]', '$[1]' )
"$[1]"
select json_search( '[ "footbar", "foo%bar" ]', 'all', 'foo|%bar', '|', '$[0]', '$[1]', '$[2]' );
json_search( '[ "footbar", "foo%bar" ]', 'all', 'foo|%bar', '|', '$[0]', '$[1]', '$[2]' )
"$[1]"
select json_search( '[ "footbar", "foo%bar" ]', 'all', 'foo\%bar', null );
json_search( '[ "footbar", "foo%bar" ]', 'all', 'foo\%bar', null )
"$[1]"
select json_search( '[ "footbar", "foo%bar" ]', 'all', 'foo\%bar', null, '$[0]' );
json_search( '[ "footbar", "foo%bar" ]', 'all', 'foo\%bar', null, '$[0]' )
NULL
select json_search( '[ "footbar", "foo%bar" ]', 'all', 'foo\%bar', null, '$[1]' );
json_search( '[ "footbar", "foo%bar" ]', 'all', 'foo\%bar', null, '$[1]' )
"$[1]"
select json_search( '[ "footbar", "foo%bar" ]', 'all', 'foo|%bar', '|', '$[0]' );
json_search( '[ "footbar", "foo%bar" ]', 'all', 'foo|%bar', '|', '$[0]' )
NULL
select json_search( '[ "footbar", "foo%bar" ]', 'all', 'foo|%bar', '|', '$[1]' );
json_search( '[ "footbar", "foo%bar" ]', 'all', 'foo|%bar', '|', '$[1]' )
"$[1]"
select json_search( '[ "abc", "ABC" ]', 'all', 'aBc' );
json_search( '[ "abc", "ABC" ]', 'all', 'aBc' )
NULL
select json_search( '[ "abc", "ABC" ]', 'all', 'abc' );
json_search( '[ "abc", "ABC" ]', 'all', 'abc' )
"$[0]"
select json_search( '[ "abc", "ABC" ]', 'all', 'ABC' );
json_search( '[ "abc", "ABC" ]', 'all', 'ABC' )
"$[1]"
select json_search( '[ 10, "10", 1.0, "1.0" ]', 'all', '1%' );
json_search( '[ 10, "10", 1.0, "1.0" ]', 'all', '1%' )
["$[1]", "$[3]"]
drop table json_search_table;
create table jep( key_col int primary key, doc json, path varchar( 50 ) );
insert into jep values
( 1, '{ "onepotato": "seven"  }', '$.onepotato' ),
( 2, '{ "one potato": "seven"  }', '$."one potato"' ),
( 3, '{ "one \\"potato": "seven"  }', '$."one \\"potato"' ),
( 4, '{ "one \\npotato": "seven"  }', '$."one \\npotato"' );
select key_col,
json_search( doc, 'all', 'seven' ) paths,
json_unquote( cast( json_search( doc, 'all', 'seven' ) as char ) ) unquoted,
path
from jep order by key_col;
key_col	paths	unquoted	path
1	"$.onepotato"	$.onepotato	$.onepotato
2	"$.\"one potato\""	$."one potato"	$."one potato"
3	"$.\"one \\\"potato\""	$."one \"potato"	$."one \"potato"
4	"$.\"one \\npotato\""	$."one \npotato"	$."one \npotato"
drop table jep;
SELECT JSON_SEARCH
(
'{ "a" : 123, "b" : [ 123, 456 ] }',
'one',
'123'
);
JSON_SEARCH
(
'{ "a" : 123, "b" : [ 123, 456 ] }',
'one',
'123'
)
NULL
SELECT JSON_SEARCH
(
'{ "a" : "123", "b" : [ 123, "789", "123", "456", "123" ] }',
'one',
'123',
null,
'$.b'
);
JSON_SEARCH
(
'{ "a" : "123", "b" : [ 123, "789", "123", "456", "123" ] }',
'one',
'123',
null,
'$.b'
)
"$.b[2]"
SELECT JSON_SEARCH
(
'{ "a" : "123", "b" : { "key" : "123" } }',
'one',
'123'
);
JSON_SEARCH
(
'{ "a" : "123", "b" : { "key" : "123" } }',
'one',
'123'
)
"$.a"
SELECT JSON_SEARCH
(
'{ "a" : "1243", "b" : { "key" : "1234" } }',
'one',
'123%'
);
JSON_SEARCH
(
'{ "a" : "1243", "b" : { "key" : "1234" } }',
'one',
'123%'
)
"$.b.key"
SELECT JSON_SEARCH
(
'{ "a" : "1243", "b" : { "key" : "1234", "c": "directorysub%directoryabc" } }',
'one',
'dir%torysub@%dir%',
'@'
);
JSON_SEARCH
(
'{ "a" : "1243", "b" : { "key" : "1234", "c": "directorysub%directoryabc" } }',
'one',
'dir%torysub@%dir%',
'@'
)
"$.b.c"
SELECT JSON_SEARCH
(
'{ "a" : "1243", "b" : { "key" : "1234" } }',
'one',
'123%',
null,
'$.c'
);
JSON_SEARCH
(
'{ "a" : "1243", "b" : { "key" : "1234" } }',
'one',
'123%',
null,
'$.c'
)
NULL
SELECT JSON_UNQUOTE
(
JSON_SEARCH
(
'{ "onepotato": "foot", "one potato": "food" , "one \\"potato": "fool" }',
'all',
'food'
  )
);
JSON_UNQUOTE
(
JSON_SEARCH
(
'{ "onepotato": "foot", "one potato": "food" , "one \\"potato": "fool" }',
'all',
'food'
  )
)
$."one potato"
# ----------------------------------------------------------------------
# Test of CASE and IF expressions returning JSON
# ----------------------------------------------------------------------
create table t(j json);
insert into t values (null), ('[3,4,5]');
select json_type(case (null is null) when 1 then
cast('null' as json) else
cast('[1,2,3]' as json) end);
json_type(case (null is null) when 1 then
cast('null' as json) else
cast('[1,2,3]' as json) end)
NULL
select json_type(case (null is not null) when 1 then
cast('null' as json) else
cast('[1,2,3]' as json) end);
json_type(case (null is not null) when 1 then
cast('null' as json) else
cast('[1,2,3]' as json) end)
ARRAY
select json_type(case (j is null) when 1 then
cast('null' as json) else
cast('[1,2,3]' as json) end) from t;
json_type(case (j is null) when 1 then
cast('null' as json) else
cast('[1,2,3]' as json) end)
NULL
ARRAY
select json_type(case (j is null) when 1 then cast(1 as json) end) from t;
json_type(case (j is null) when 1 then cast(1 as json) end)
INTEGER
NULL
select json_type( if(null is null,
cast('null' as json),
cast('[1,2,3]' as json)) );
json_type( if(null is null,
cast('null' as json),
cast('[1,2,3]' as json)) )
NULL
select json_type( if(null is not null,
cast('null' as json),
cast('[1,2,3]' as json)));
json_type( if(null is not null,
cast('null' as json),
cast('[1,2,3]' as json)))
ARRAY
select json_type( if(j is null,
cast('{"a": 6}' as json),
cast('[1,2,3]' as json))) from t;
json_type( if(j is null,
cast('{"a": 6}' as json),
cast('[1,2,3]' as json)))
OBJECT
ARRAY
select json_type( if(j is null,
NULL,
cast('[1,2,3]' as json))    ) from t;
json_type( if(j is null,
NULL,
cast('[1,2,3]' as json))    )
NULL
ARRAY
# ----------------------------------------------------------------------
# Test of CASE and IF expressions with mix of JSON and other types
# Common result type is VARCHAR
# ----------------------------------------------------------------------
select json_type(case (j is null) when 1 then
3.14 else
cast('[1,2,3]' as json) end) from t;
json_type(case (j is null) when 1 then
3.14 else
cast('[1,2,3]' as json) end)
DOUBLE
ARRAY
select case (j is null) when 1 then
3.14 else
cast('[1,2,3]' as json) end from t;
case (j is null) when 1 then
3.14 else
cast('[1,2,3]' as json) end
3.14
[1, 2, 3]
select case (j is null) when 1 then
'foobar' else
cast('[1,2,3]' as json) end from t;
case (j is null) when 1 then
'foobar' else
cast('[1,2,3]' as json) end
foobar
[1, 2, 3]
select json_type( if(j is null,
3.14,
cast('[1,2,3]' as json))) from t;
json_type( if(j is null,
3.14,
cast('[1,2,3]' as json)))
DOUBLE
ARRAY
select if(j is null,
3.14,
cast('[1,2,3]' as json)) from t;
if(j is null,
3.14,
cast('[1,2,3]' as json))
3.14
[1, 2, 3]
# ----------------------------------------------------------------------
# Test of IFNULL
# ----------------------------------------------------------------------
select json_type(ifnull(j, cast(3 as json))) from t;
json_type(ifnull(j, cast(3 as json)))
INTEGER
ARRAY
select ifnull(j, cast(3 as json)) from t;
ifnull(j, cast(3 as json))
3
[3, 4, 5]
select json_type(ifnull(NULL, cast(3 as json)));
json_type(ifnull(NULL, cast(3 as json)))
INTEGER
select json_type(ifnull(cast(3 as json), NULL));
json_type(ifnull(cast(3 as json), NULL))
INTEGER
SELECT JSON_TYPE(IFNULL(JSON_EXTRACT(CONCAT(t1.j, 'abc'), '$'), t2.j))
FROM t t1, t t2;
ERROR 22032: Invalid JSON text in argument 1 to function json_extract: "The document root must not follow by other values." at position 9.
SELECT JSON_TYPE(IFNULL(t1.j, JSON_EXTRACT(CONCAT(t2.j, 'abc'), '$')))
FROM t t1, t t2;
ERROR 22032: Invalid JSON text in argument 1 to function json_extract: "The document root must not follow by other values." at position 9.
# ----------------------------------------------------------------------
# Json values used in text contexts
# ----------------------------------------------------------------------
delete from t;
insert into t values (NULL), (cast('"aBc"' as json));
select upper(j) from t;
upper(j)
NULL
"ABC"
select cast(json_extract(cast(concat('[', cast('["A",2]' as json), ']') as json),
'$[0][1]') as char) = 2;
cast(json_extract(cast(concat('[', cast('["A",2]' as json), ']') as json),
'$[0][1]') as char) = 2
1
# ----------------------------------------------------------------------
# Test of aggregate function MAX, MIN.
# ----------------------------------------------------------------------
select max(cast('[1,2,3]' as json));
max(cast('[1,2,3]' as json))
[1, 2, 3]
delete from t;
insert into t values (cast(1 as json)), (cast(10 as json)), (cast(2 as json));
select * from t order by j;
j
1
2
10
select max(j) from t;
max(j)
10
select json_type(max(j)) from t;
json_type(max(j))
INTEGER
select min(j) from t;
min(j)
1
select json_type(max(j)) from t;
json_type(max(j))
INTEGER
select max(cast(j as unsigned)) from t;
max(cast(j as unsigned))
10
select json_type(max(cast(j as unsigned))) from t;
ERROR 22032: Invalid data type for JSON data in argument 1 to function json_type; a JSON string or JSON type is required.
drop table t;
#
# Full Text Search on columns generated from JSON
#
set names utf8;
create table messages
(
id int,
raw_message json,
sender varchar(50) generated always as (json_unquote( json_extract( raw_message, '$.sender' ) )) stored,
receiver varchar(50) generated always as (json_unquote( json_extract( raw_message, '$.receiver' ) )) stored,
subject text generated always as (json_extract( raw_message, '$.subject' )) stored,
received datetime generated always as (json_unquote( json_extract( raw_message, '$.received' ) )) stored,
body text generated always as (json_extract( raw_message, '$.body' )) stored,
fulltext key( subject ),
fulltext key( body ),
primary key( id ),
key( received, sender, receiver ),
key( sender, receiver, received )
) ENGINE = InnoDB;
insert into messages(id, raw_message) values
(
1,
'{
     "sender": "fred",
     "receiver": "alice",
     "subject": "lunch today?",
     "received": "2015-05-11 09:30:05",
     "body": "How about lunch around 11:30? Thai food sounds good to me."
  }'
),
(
2,
'{
     "sender": "alice",
     "receiver": "fred",
     "subject": "re: lunch today?",
     "received": "2015-05-11 09:45:05",
     "body": "Great! No big deadline today."
  }'
),
(
3,
'{
     "sender": "fred",
     "receiver": "alice",
     "subject": "tea at 4:00?",
     "received": "2015-05-11 14:30:05",
     "body": "I have some yummy scones."
  }'
),
(
4,
'{
     "sender": "alice",
     "receiver": "fred",
     "subject": "re: tea at 4:00?",
     "received": "2015-05-11 14:45:05",
     "body": "Yes indeed."
  }'
),
(
5,
'{
     "sender": "fred",
     "receiver": "alice",
     "subject": "lunch today?",
     "received": "2015-05-18 09:30:05",
     "body": "Chinese for lunch?"
  }'
),
(
6,
'{
     "sender": "alice",
     "receiver": "fred",
     "subject": "re: lunch today?",
     "received": "2015-05-18 09:45:05",
     "body": "Sorry. I have a tight deadline I have to meet."
  }'
)
;
analyze table messages;
Table	Op	Msg_type	Msg_text
test.messages	analyze	status	OK
select * from messages order by id;
id	raw_message	sender	receiver	subject	received	body
1	{"body": "How about lunch around 11:30? Thai food sounds good to me.", "sender": "fred", "subject": "lunch today?", "received": "2015-05-11 09:30:05", "receiver": "alice"}	fred	alice	"lunch today?"	2015-05-11 09:30:05	"How about lunch around 11:30? Thai food sounds good to me."
2	{"body": "Great! No big deadline today.", "sender": "alice", "subject": "re: lunch today?", "received": "2015-05-11 09:45:05", "receiver": "fred"}	alice	fred	"re: lunch today?"	2015-05-11 09:45:05	"Great! No big deadline today."
3	{"body": "I have some yummy scones.", "sender": "fred", "subject": "tea at 4:00?", "received": "2015-05-11 14:30:05", "receiver": "alice"}	fred	alice	"tea at 4:00?"	2015-05-11 14:30:05	"I have some yummy scones."
4	{"body": "Yes indeed.", "sender": "alice", "subject": "re: tea at 4:00?", "received": "2015-05-11 14:45:05", "receiver": "fred"}	alice	fred	"re: tea at 4:00?"	2015-05-11 14:45:05	"Yes indeed."
5	{"body": "Chinese for lunch?", "sender": "fred", "subject": "lunch today?", "received": "2015-05-18 09:30:05", "receiver": "alice"}	fred	alice	"lunch today?"	2015-05-18 09:30:05	"Chinese for lunch?"
6	{"body": "Sorry. I have a tight deadline I have to meet.", "sender": "alice", "subject": "re: lunch today?", "received": "2015-05-18 09:45:05", "receiver": "fred"}	alice	fred	"re: lunch today?"	2015-05-18 09:45:05	"Sorry. I have a tight deadline I have to meet."
alter table messages add fulltext index (raw_message) ;
ERROR HY000: Column 'raw_message' cannot be part of FULLTEXT index
select id from messages
where match( body ) against ( 'thai' )
and match( subject ) against( 'lunch' )
order by id;
id
1
select id from messages
where match( body ) against ( 'deadline' )
and received > timestamp '2015-05-13 09:45:05'
  order by id;
id
6
select id from messages
where match( body ) against ( 'thai' )
and match( subject ) against( 'lunch' )
and JSON_VALID(raw_message)
and ( JSON_TYPE(raw_message) = "OBJECT")
order by id;
id
1
select id from messages
where match( body ) against ( 'thai' )
and match( subject ) against( 'lunch' )
and ( JSON_TYPE(JSON_KEYS(raw_message)) != "ARRAY"  or JSON_CONTAINS (raw_message,CAST('{"received": "2015-05-11 09:30:05"}' AS JSON) ) )
order by id;
id
1
select id from messages
where match( subject ) against( '+tea' in boolean mode)
and LENGTH(JSON_UNQUOTE(JSON_EXTRACT( raw_message, '$.sender' ))) = 5
order by id;
id
4
select id from messages
where match( body ) against( 'lunch' with query expansion)
and JSON_DEPTH(raw_message) != 0;
id
1
5
update messages
set raw_message = json_replace(raw_message, '$.body', 'On second thought, I want Chinese.')
where id=1;
select * from messages order by id;
id	raw_message	sender	receiver	subject	received	body
1	{"body": "On second thought, I want Chinese.", "sender": "fred", "subject": "lunch today?", "received": "2015-05-11 09:30:05", "receiver": "alice"}	fred	alice	"lunch today?"	2015-05-11 09:30:05	"On second thought, I want Chinese."
2	{"body": "Great! No big deadline today.", "sender": "alice", "subject": "re: lunch today?", "received": "2015-05-11 09:45:05", "receiver": "fred"}	alice	fred	"re: lunch today?"	2015-05-11 09:45:05	"Great! No big deadline today."
3	{"body": "I have some yummy scones.", "sender": "fred", "subject": "tea at 4:00?", "received": "2015-05-11 14:30:05", "receiver": "alice"}	fred	alice	"tea at 4:00?"	2015-05-11 14:30:05	"I have some yummy scones."
4	{"body": "Yes indeed.", "sender": "alice", "subject": "re: tea at 4:00?", "received": "2015-05-11 14:45:05", "receiver": "fred"}	alice	fred	"re: tea at 4:00?"	2015-05-11 14:45:05	"Yes indeed."
5	{"body": "Chinese for lunch?", "sender": "fred", "subject": "lunch today?", "received": "2015-05-18 09:30:05", "receiver": "alice"}	fred	alice	"lunch today?"	2015-05-18 09:30:05	"Chinese for lunch?"
6	{"body": "Sorry. I have a tight deadline I have to meet.", "sender": "alice", "subject": "re: lunch today?", "received": "2015-05-18 09:45:05", "receiver": "fred"}	alice	fred	"re: lunch today?"	2015-05-18 09:45:05	"Sorry. I have a tight deadline I have to meet."
select id from messages
where match( body ) against ( 'thai' )
and match( subject ) against( 'lunch' )
order by id;
id
drop table messages;
# ----------------------------------------------------------------------
# Test JSON arguments and return values of stored functions
# ----------------------------------------------------------------------
create function make_message
(
sender varchar(50),
receiver varchar(50),
subject text,
received datetime,
body text
)
returns json
language sql deterministic no sql
return json_object
(
'sender', sender,
'receiver', receiver,
'subject', subject,
'received', received,
'body', body
);
create function extract_date( message json )
returns datetime
language sql deterministic no sql
return json_extract( message, '$.received' );
create table messages
(
id int,
raw_message json
);
insert into messages(id, raw_message) values
(
1,
make_message
(
'fred',
'alice',
'lunch today?',
timestamp( '2015-05-11 09:30:05' ),
'How about lunch at 11:30?'
  )
),
(
2,
make_message
(
'alice',
'fred',
're: lunch today?',
timestamp( '2015-05-11 09:45:05' ),
'Sorry. I am in meetings all day long.'
  )
),
(
3,
json_object
(
'sender', 'fred',
'receiver', 'alice',
'subject', 're: lunch today?',
'received', timestamp( '2015-05-11 09:50:05' ),
'body', 'Oh, bummer.'
  )
)
;
select * from messages order by id;
id	raw_message
1	{"body": "How about lunch at 11:30?", "sender": "fred", "subject": "lunch today?", "received": "2015-05-11 09:30:05.000000", "receiver": "alice"}
2	{"body": "Sorry. I am in meetings all day long.", "sender": "alice", "subject": "re: lunch today?", "received": "2015-05-11 09:45:05.000000", "receiver": "fred"}
3	{"body": "Oh, bummer.", "sender": "fred", "subject": "re: lunch today?", "received": "2015-05-11 09:50:05.000000", "receiver": "alice"}
select json_type
(
json_extract
(
json_object
(
'sender', 'fred',
'receiver', 'alice',
'subject', 'lunch today?',
'received', timestamp( '2015-05-11 09:45:05' ),
'body', 'How about lunch at 11:30?'
    ),
'$.received'
  )
) received_type
;
received_type
DATETIME
select id, extract_date( raw_message ) extracted_date
from messages order by id;
id	extracted_date
1	2015-05-11 09:30:05
2	2015-05-11 09:45:05
3	2015-05-11 09:50:05
create function show_received_type( message json )
returns tinytext
language sql deterministic no sql
return json_type( json_extract( message, '$.received' ) );
select show_received_type
(
json_object
(
'sender', 'fred',
'receiver', 'alice',
'subject', 're: lunch today?',
'received', timestamp( '2015-05-11 09:50:05' ),
'body', 'Oh, bummer.'
  )
) received_type;
received_type
DATETIME
select show_received_type
(
make_message
(
'fred',
'alice',
'lunch today?',
timestamp( '2015-05-11 09:30:05' ),
'How about lunch at 11:30?'
     )
) received_type;
received_type
DATETIME
select id, show_received_type( raw_message ) received_type
from messages order by id;
id	received_type
1	DATETIME
2	DATETIME
3	DATETIME
drop function show_received_type;
drop function make_message;
drop function extract_date;
drop table messages;
# Test a function that fails.
CREATE FUNCTION func_that_fails() RETURNS JSON
LANGUAGE SQL DETERMINISTIC NO SQL
RETURN '[not valid json]';
SELECT JSON_EXTRACT(func_that_fails(), '$');
ERROR 22032: Invalid JSON text: "Invalid value." at position 2 in value for column '.func_that_fails()'.
DROP FUNCTION func_that_fails;
create function get_types( input_value json )
returns json
language sql deterministic contains sql
begin
declare array_length integer;
declare return_value json;
declare idx int;
declare path varchar(100);
set array_length = json_length( input_value );
set return_value = json_array();
set idx = 0;
while idx < array_length do
set path = concat( '$[', idx, ']' );
set return_value = json_array_append
(
return_value,
'$',
json_type( json_extract( input_value, path ) )
);
set idx = idx + 1;
end while;
return return_value;
end//
create table blob_table( blob_col blob );
insert into blob_table values( '10101abcde' );
select json_type( dt.a ), dt.a
from
( select get_types
(
json_array
(
cast( '{}' as json ),
cast( '[]' as json ),
'null',
true,
1,
2.3,
timestamp( '2015-05-11 09:30:05' ),
cast('23:24:25' as time),
cast('2015-01-15' as date),
b'10101',
blob_col
)
) a
from blob_table
) dt;
json_type( dt.a )	a
ARRAY	["OBJECT", "ARRAY", "STRING", "BOOLEAN", "INTEGER", "DECIMAL", "DATETIME", "TIME", "DATE", "BIT", "BLOB"]
drop table blob_table;
drop function get_types;
create procedure merge_docs
(
inout inout_value json
)
begin
set inout_value = json_object();
end//
create procedure merge_doc_types()
begin
declare proc_inout json;
declare tmp_types varchar(100);
set proc_inout = null;
call merge_docs( proc_inout );
set tmp_types = json_type( proc_inout );
end//
call merge_doc_types();
drop procedure merge_doc_types;
drop procedure merge_docs;
create function get_types( input_value json )
returns json
language sql deterministic contains sql
begin
declare array_length integer;
declare return_value json;
declare idx int;
declare path varchar(100);
set array_length = json_length( input_value );
set return_value = json_array();
set idx = 0;
while idx < array_length do
set path = concat( '$[', idx, ']' );
set return_value = json_array_append
(
return_value,
'$',
json_type( json_extract( input_value, path ) )
);
set idx = idx + 1;
end while;
return return_value;
end//
create procedure merge_docs
(
in in_value json,
inout inout_value json,
out out_value json
)
language sql deterministic contains sql
begin
set out_value = json_merge( in_value, inout_value );
set inout_value = in_value;
end//
create procedure merge_doc_types
(
out in_types varchar(100),
out inout_types varchar(100),
out out_types varchar(100)
)
language sql deterministic contains sql
begin
declare proc_in json;
declare proc_inout json;
declare proc_out json;
set proc_in = json_array
(
cast( '{}' as json ),
cast( '[]' as json ),
'null',
true
);
set proc_inout = json_array
(
1,
2.3,
timestamp( '2015-05-11 09:30:05' ),
cast('23:24:25' as time),
cast('2015-01-15' as date),
b'10101'
  );
set proc_out = null;
call merge_docs( proc_in, proc_inout, proc_out );
set in_types = get_types( proc_in );
set inout_types = get_types( proc_inout );
set out_types = get_types( proc_out );
end//
call merge_doc_types( @in_types, @inout_types, @out_types );
select @in_types, @inout_types, @out_types;
@in_types	@inout_types	@out_types
["OBJECT", "ARRAY", "STRING", "BOOLEAN"]	["OBJECT", "ARRAY", "STRING", "BOOLEAN"]	["OBJECT", "ARRAY", "STRING", "BOOLEAN", "INTEGER", "DECIMAL", "DATETIME", "TIME", "DATE", "BIT"]
drop procedure merge_doc_types;
drop procedure merge_docs;
drop function get_types;
#
# Bug#20898238: WRONG RESULT FOR MAX() OF JSON SCALARS RETURNED
#               WHEN NULL IS PRESENT
#
CREATE TABLE bug20898238(j JSON);
INSERT INTO bug20898238 VALUES ('{"id":1}'), (NULL), ('{"id":2}'), ('{"id":0}');
SELECT MIN(JSON_EXTRACT(j, '$.id')),
MAX(JSON_EXTRACT(j, '$.id')) FROM bug20898238;
MIN(JSON_EXTRACT(j, '$.id'))	MAX(JSON_EXTRACT(j, '$.id'))
0	2
DROP TABLE bug20898238;
# ----------------------------------------------------------------------
# Test of aggregate function SUM, AVG: in constrast to strings, we do not
# auto-convert to numeric (double) type:
# ----------------------------------------------------------------------
create table t(j json, c varchar(20));
insert into t values (cast('[1,2,3]' as json), '[a,b,c]');
insert into t values (cast(7 as json), '7'),  (cast(2 as json), '2');
select sum(j), sum(cast(j as unsigned)), sum(c) from t;
sum(j)	sum(cast(j as unsigned))	sum(c)
9	9	9
Warnings:
Warning	3156	Invalid JSON value for CAST to DOUBLE from column j at row 1
Warning	3156	Invalid JSON value for CAST to INTEGER from column j at row 1
Warning	1292	Truncated incorrect DOUBLE value: '[a,b,c]'
select avg(j), avg(cast(j as unsigned)), avg(c) from t;
avg(j)	avg(cast(j as unsigned))	avg(c)
3	3.0000	3
Warnings:
Warning	3156	Invalid JSON value for CAST to DOUBLE from column j at row 1
Warning	3156	Invalid JSON value for CAST to INTEGER from column j at row 1
Warning	1292	Truncated incorrect DOUBLE value: '[a,b,c]'
# ----------------------------------------------------------------------
# Test of aggregate function GROUP_CONCAT
# ----------------------------------------------------------------------
select group_concat(j), group_concat(distinct j), group_concat(c) from t;
group_concat(j)	group_concat(distinct j)	group_concat(c)
[1, 2, 3],7,2	[1, 2, 3],7,2	[a,b,c],7,2
insert into t values (NULL, NULL);
select group_concat(j), group_concat(distinct j), group_concat(c) from t;
group_concat(j)	group_concat(distinct j)	group_concat(c)
[1, 2, 3],7,2	[1, 2, 3],7,2	[a,b,c],7,2
create table t2(j json);
insert into t2 values (json_array(ST_GeomFromText('LineString(0 0, 1 1, 2 2)')));
select group_concat(j) from t2;
group_concat(j)
[{"type": "LineString", "coordinates": [[0, 0], [1, 1], [2, 2]]}]
drop table t2;
# ----------------------------------------------------------------------
# Test of aggregate function COUNT(DISTINCT) and unaggregated DISTINCT
# ----------------------------------------------------------------------
create table t_doc( bucket int, doc json);
insert into t_doc values
( 1, cast( 1 as json ) ),
( 1, cast( 1.0 as json ) ),
( 1, cast( 1e0 as json ) ),
( 2, cast( cast( 1 as unsigned ) as json ) ),
( 2, cast( 2 as json ) ),
( 2, cast( 2.0 as json ) ),
( 3, cast( 2e0 as json ) ),
( 3, cast( cast( 7 as unsigned ) as json ) ),
( 3, cast( 7 as json ) ),
( 4, cast( 7.0 as json ) ),
( 4, cast( 7e0 as json ) ),
( 4, cast( cast( 7 as unsigned ) as json ) ),
( 5, cast( true as json ) ),
( 5, cast( true as json ) ),
( 5, cast( false as json ) ),
( 6, cast( false as json ) ),
( 6, cast( 'null' as json ) ),
( 6, cast( 'null' as json ) ),
( 7, cast( '"abc"' as json ) ),
( 7, cast( '"abc"' as json ) ),
( 7, cast( '"abcd"' as json ) ),
( 8, cast( '"abcd"' as json ) ),
( 8, cast( '{ "a": 1, "b": 2 }' as json ) ),
( 8, cast( '{ "a": 1, "b": 2 }' as json ) ),
( 9, cast( '{ "a": 1, "b": 3 }' as json ) ),
( 9, cast( '{ "a": 1, "b": 3 }' as json ) ),
( 9, cast( '[ true, false ]' as json ) ),
( 10, cast( '[ true, false ]' as json ) ),
( 10, cast( '[ true, true ]' as json ) );
select distinct( doc ) a from t_doc order by a;
a
null
1
2
7
"abc"
"abcd"
{"a": 1, "b": 2}
{"a": 1, "b": 3}
[true, false]
[true, true]
false
true
Warnings:
Warning	1235	This version of MySQL doesn't yet support 'sorting of non-scalar JSON values'
select count( distinct doc ) from t_doc;
count( distinct doc )
12
select bucket, count( distinct doc ) from t_doc group by bucket;
bucket	count( distinct doc )
1	1
2	2
3	2
4	1
5	2
6	2
7	2
8	2
9	2
10	2
delete from t_doc;
create table dt(dati datetime, da date,
tim time, ts timestamp,
y year,
--
ti tinyint,   tiu tinyint unsigned,
si smallint,  siu smallint unsigned,
mi mediumint, miu mediumint unsigned,
i  int,       iu  int unsigned,
bi bigint,    biu bigint unsigned,
boo boolean,
--
dc decimal(5,2),
n numeric(5,2),
--
f float, d double,
bitt bit(10),
blb blob,
bin binary(10),
en enum('a','b','c'),
se set('a','b','c'),
--
ge geometry,
po point,
ls linestring,
py polygon,
jso json,
jsa json,
id int
);
insert into dt values('2014-11-25 18:00', '2014-11-25',
'18:00:59', '2014-11-25 17:00',
'1999',
--
127, 255,
32767, 65535,
8388607, 16777215, -- 3 bytes
2147483647, 4294967295, -- 4 bytes
9223372036854775807, 18446744073709551615,
true,
--
3.1,
3.2,
--
3.3, 3.4,
b'10101',
'10101abcde',
'10001abcde',
'b',
'a,c',
--
ST_GeomFromText('POINT(1 1)'),
ST_GeomFromText('POINT(1 2)'),
ST_GeomFromText('LINESTRING(0 0,1 1,2 2)'),
ST_GeomFromText('POLYGON((0 0,10 0,10 10,0 10,0 0),
                                            (5 5,7 5,7 7,5 7, 5 5))'),
'{"a": 1, "b": 2 }',
'[1, 2]',
1
),
('2013-11-25 18:00', '2013-11-25',
'17:00:59', '2013-11-25 17:00',
'1998',
--
126, 254,
32766, 65534,
8388606, 16777214, -- 3 bytes
2147483646, 4294967294, -- 4 bytes
9223372036854775806, 18446744073709551614,
false,
--
4.1,
4.2,
--
4.3, 4.4,
b'10111',
'10001abcdf',
'10101abcdf',
'a',
'a,b',
--
ST_GeomFromText('POINT(1 3)'),
ST_GeomFromText('POINT(1 4)'),
ST_GeomFromText('LINESTRING(0 0,1 1,2 3)'),
ST_GeomFromText('POLYGON((0 0,10 0,10 10,0 9,0 0),
                                            (5 5,7 5,7 7,5 7, 5 5))'),
'{"a": 1, "b": 3 }',
'[1, 3]',
2
);
insert into t_doc select id, cast(f as json) from dt;
insert into t_doc select id, cast(d as json) from dt;
insert into t_doc select * from t_doc;
select count( distinct doc ) from t_doc;
count( distinct doc )
4
select bucket, count( distinct doc ) from t_doc group by bucket;
bucket	count( distinct doc )
1	2
2	2
delete from t_doc;
insert into t_doc select id, cast(dati as json) from dt;
insert into t_doc select id, cast(da as json) from dt;
insert into t_doc select id, cast(tim as json) from dt;
insert into t_doc select id, cast(ts as json) from dt;
insert into t_doc select id, cast(y as json) from dt;
insert into t_doc select id, cast(ti as json) from dt;
insert into t_doc select id, cast(tiu as json) from dt;
insert into t_doc select id, cast(si as json) from dt;
insert into t_doc select id, cast(siu as json) from dt;
insert into t_doc select id, cast(mi as json) from dt;
insert into t_doc select id, cast(miu as json) from dt;
insert into t_doc select id, cast(i as json) from dt;
insert into t_doc select id, cast(iu as json) from dt;
insert into t_doc select id, cast(bi as json) from dt;
insert into t_doc select id, cast(biu as json) from dt;
insert into t_doc select id, cast(dc as json) from dt;
insert into t_doc select id, cast(n as json) from dt;
insert into t_doc select id, cast(bitt as json) from dt;
insert into t_doc select id, cast(blb as json) from dt;
insert into t_doc select id, cast(bin as json) from dt;
insert into t_doc select id, cast(en as json) from dt;
insert into t_doc select id, cast(se as json) from dt;
insert into t_doc select id, cast(ge as json) from dt;
insert into t_doc select id, cast(po as json) from dt;
insert into t_doc select id, cast(ls as json) from dt;
insert into t_doc select id, cast(py as json) from dt;
insert into t_doc select id, jso from dt;
insert into t_doc select id, jsa from dt;
insert into t_doc select * from t_doc;
select distinct( doc ) a from t_doc order by a;
a
3.10
3.20
4.10
4.20
126
127
254
255
32766
32767
65534
65535
8388606
8388607
16777214
16777215
2147483646
2147483647
4294967294
4294967295
9223372036854775806
9223372036854775807
18446744073709551614
18446744073709551615
"a"
"a,b"
"a,c"
"b"
{"a": 1, "b": 2}
{"a": 1, "b": 3}
{"type": "Polygon", "coordinates": [[[0, 0], [10, 0], [10, 10], [0, 10], [0, 0]], [[5, 5], [7, 5], [7, 7], [5, 7], [5, 5]]]}
{"type": "Polygon", "coordinates": [[[0, 0], [10, 0], [10, 10], [0, 9], [0, 0]], [[5, 5], [7, 5], [7, 7], [5, 7], [5, 5]]]}
{"type": "LineString", "coordinates": [[0, 0], [1, 1], [2, 2]]}
{"type": "LineString", "coordinates": [[0, 0], [1, 1], [2, 3]]}
{"type": "Point", "coordinates": [1, 1]}
{"type": "Point", "coordinates": [1, 4]}
{"type": "Point", "coordinates": [1, 2]}
{"type": "Point", "coordinates": [1, 3]}
[1, 2]
[1, 3]
"2013-11-25"
"2014-11-25"
"17:00:59.000000"
"18:00:59.000000"
"2013-11-25 17:00:00.000000"
"2013-11-25 18:00:00.000000"
"2014-11-25 17:00:00.000000"
"2014-11-25 18:00:00.000000"
"base64:type13:MTk5OA=="
"base64:type13:MTk5OQ=="
"base64:type16:ABU="
"base64:type16:ABc="
"base64:type252:MTAwMDFhYmNkZg=="
"base64:type252:MTAxMDFhYmNkZQ=="
"base64:type254:MTAwMDFhYmNkZQ=="
"base64:type254:MTAxMDFhYmNkZg=="
Warnings:
Warning	1235	This version of MySQL doesn't yet support 'sorting of non-scalar JSON values'
select count( distinct doc ) from t_doc;
count( distinct doc )
56
select bucket, count( distinct doc ) from t_doc group by bucket;
bucket	count( distinct doc )
1	28
2	28
delete from t_doc;
create table ndt(dati datetime,
ts timestamp,
--
ti tinyint,   tiu tinyint unsigned,
si smallint,  siu smallint unsigned,
mi mediumint, miu mediumint unsigned,
i  int,       iu  int unsigned,
bi bigint,    biu bigint unsigned,
--
dc decimal(5,2),
n numeric(5,2),
--
f float, d double,
id int
);
insert into ndt values('2014-11-25 18:00',
'2014-11-25 18:00',
--
1, 1,
1, 1,
1, 1,
1, 1,
1, 1,
--
1.0,
1.0,
--
1.0, 1.0,
1
),
('2013-11-25 18:00',
'2013-11-25 18:00',
--
2, 2,
2, 2,
2, 2,
2, 2,
2, 2,
--
2.0,
2.0,
--
2.0, 2.0,
2
);
insert into t_doc select id, cast(dati as json) from ndt;
insert into t_doc select id, cast(ts as json) from ndt;
insert into t_doc select id, cast(ti as json) from ndt;
insert into t_doc select id, cast(tiu as json) from ndt;
insert into t_doc select id, cast(si as json) from ndt;
insert into t_doc select id, cast(siu as json) from ndt;
insert into t_doc select id, cast(mi as json) from ndt;
insert into t_doc select id, cast(miu as json) from ndt;
insert into t_doc select id, cast(i as json) from ndt;
insert into t_doc select id, cast(iu as json) from ndt;
insert into t_doc select id, cast(bi as json) from ndt;
insert into t_doc select id, cast(biu as json) from ndt;
insert into t_doc select id, cast(dc as json) from ndt;
insert into t_doc select id, cast(n as json) from ndt;
insert into t_doc select id, cast(f as json) from ndt;
insert into t_doc select id, cast(d as json) from ndt;
insert into t_doc select * from t_doc;
select distinct( doc ) a from t_doc order by a;
a
1
2
"2013-11-25 18:00:00.000000"
"2014-11-25 18:00:00.000000"
select count( distinct doc ) from t_doc;
count( distinct doc )
4
select bucket, count( distinct doc ) from t_doc group by bucket;
bucket	count( distinct doc )
1	2
2	2
drop table t_doc;
drop table dt;
drop table ndt;
# ----------------------------------------------------------------------
# Special CASTing behavior of geometry types
# ----------------------------------------------------------------------
create table jtable( id int, descr varchar(20), doc json );
create table misc_dt
(
ge geometry,
po point,
ls linestring,
py polygon
);
insert into misc_dt values
(
ST_GeomFromText('POINT(1 1)'),
ST_GeomFromText('POINT(1 1)'),
ST_GeomFromText('LINESTRING(0 0,1 1,2 2)'),
ST_GeomFromText('POLYGON((0 0,10 0,10 10,0 10,0 0),
    (5 5,7 5,7 7,5 7, 5 5))')
);
insert into jtable select 1, 'geometry', cast(ge as json) from misc_dt;
insert into jtable select 2, 'point', cast(po as json) from misc_dt;
insert into jtable select 3, 'linestring', cast(ls as json) from misc_dt;
insert into jtable select 4, 'polygon', cast(py as json) from misc_dt;
select id, descr, json_type( doc ), doc from jtable order by id;
id	descr	json_type( doc )	doc
1	geometry	OBJECT	{"type": "Point", "coordinates": [1, 1]}
2	point	OBJECT	{"type": "Point", "coordinates": [1, 1]}
3	linestring	OBJECT	{"type": "LineString", "coordinates": [[0, 0], [1, 1], [2, 2]]}
4	polygon	OBJECT	{"type": "Polygon", "coordinates": [[[0, 0], [10, 0], [10, 10], [0, 10], [0, 0]], [[5, 5], [7, 5], [7, 7], [5, 7], [5, 5]]]}
select json_object
(
'geometry', ST_GeomFromText('POINT(1 1)'),
'point', ST_GeomFromText('POINT(1 1)'),
'linestring', ST_GeomFromText('LINESTRING(0 0,1 1,2 2)'),
'polygon', ST_GeomFromText('POLYGON((0 0,10 0,10 10,0 10,0 0),
    (5 5,7 5,7 7,5 7, 5 5))')
);
json_object
(
'geometry', ST_GeomFromText('POINT(1 1)'),
'point', ST_GeomFromText('POINT(1 1)'),
'linestring', ST_GeomFromText('LINESTRING(0 0,1 1,2 2)'),
'polygon', ST_GeomFromText('POLYGON((0 0,10 0,10 10,0 10,0 0),
    (5 5,7 5,7 7,5 7, 5 5))')
)
{"point": {"type": "Point", "coordinates": [1, 1]}, "polygon": {"type": "Polygon", "coordinates": [[[0, 0], [10, 0], [10, 10], [0, 10], [0, 0]], [[5, 5], [7, 5], [7, 7], [5, 7], [5, 5]]]}, "geometry": {"type": "Point", "coordinates": [1, 1]}, "linestring": {"type": "LineString", "coordinates": [[0, 0], [1, 1], [2, 2]]}}
delete from misc_dt;
select * from misc_dt;
ge	po	ls	py
insert into misc_dt values
(
(select ST_GeomFromGeoJSON( cast( doc as char ) ) from jtable where id = 1),
(select ST_GeomFromGeoJSON( cast( doc as char ) ) from jtable where id = 2),
(select ST_GeomFromGeoJSON( cast( doc as char ) ) from jtable where id = 3),
(select ST_GeomFromGeoJSON( cast( doc as char ) ) from jtable where id = 4)
);
select ST_AsGeoJSON( ge ),
ST_AsGeoJSON( po ),
ST_AsGeoJSON( ls ),
ST_AsGeoJSON( py )
from misc_dt;
ST_AsGeoJSON( ge )	ST_AsGeoJSON( po )	ST_AsGeoJSON( ls )	ST_AsGeoJSON( py )
{"type": "Point", "coordinates": [1, 1]}	{"type": "Point", "coordinates": [1, 1]}	{"type": "LineString", "coordinates": [[0, 0], [1, 1], [2, 2]]}	{"type": "Polygon", "coordinates": [[[0, 0], [10, 0], [10, 10], [0, 10], [0, 0]], [[5, 5], [7, 5], [7, 7], [5, 7], [5, 5]]]}
drop table misc_dt;
drop table jtable;
create table jtable( id int, descr varchar(20), doc json );
create table misc_dt
(
ge geometrycollection,
po multipoint,
ls multilinestring,
py multipolygon
);
insert into misc_dt values
(
geometrycollection(point(1, 1), point(2, 2)),
multipoint(point(1, 1), point(2, 2)),
multilinestring
(
linestring(point(0, 0), point(1, 1), point(2, 2)),
linestring(point(0, 0), point(11, 11), point(12, 12))
),
multipolygon
(
polygon
(
linestring(point(0, 0), point(10, 0), point(10, 10), point(0, 10), point(0, 0)),
linestring(point(5, 5), point(7, 5), point(7, 7), point(5, 7), point(5, 5))
),
polygon
(
linestring(point(0, 0), point(10, 0), point(10, 10), point(0, 10), point(0, 0)),
linestring(point(5, 5), point(7, 5), point(7, 7), point(5, 7), point(5, 5))
)
)
);
insert into jtable select 1, 'geometrycollection', cast(ge as json) from misc_dt;
insert into jtable select 2, 'multipoint', cast(po as json) from misc_dt;
insert into jtable select 3, 'multilinestring', cast(ls as json) from misc_dt;
insert into jtable select 4, 'multipolygon', cast(py as json) from misc_dt;
select id, descr, json_type( doc ), doc from jtable order by id;
id	descr	json_type( doc )	doc
1	geometrycollection	OBJECT	{"type": "GeometryCollection", "geometries": [{"type": "Point", "coordinates": [1, 1]}, {"type": "Point", "coordinates": [2, 2]}]}
2	multipoint	OBJECT	{"type": "MultiPoint", "coordinates": [[1, 1], [2, 2]]}
3	multilinestring	OBJECT	{"type": "MultiLineString", "coordinates": [[[0, 0], [1, 1], [2, 2]], [[0, 0], [11, 11], [12, 12]]]}
4	multipolygon	OBJECT	{"type": "MultiPolygon", "coordinates": [[[[0, 0], [10, 0], [10, 10], [0, 10], [0, 0]], [[5, 5], [7, 5], [7, 7], [5, 7], [5, 5]]], [[[0, 0], [10, 0], [10, 10], [0, 10], [0, 0]], [[5, 5], [7, 5], [7, 7], [5, 7], [5, 5]]]]}
select ST_AsGeoJSON( ge ),
ST_AsGeoJSON( po ),
ST_AsGeoJSON( ls ),
ST_AsGeoJSON( py )
from misc_dt;
ST_AsGeoJSON( ge )	ST_AsGeoJSON( po )	ST_AsGeoJSON( ls )	ST_AsGeoJSON( py )
{"type": "GeometryCollection", "geometries": [{"type": "Point", "coordinates": [1, 1]}, {"type": "Point", "coordinates": [2, 2]}]}	{"type": "MultiPoint", "coordinates": [[1, 1], [2, 2]]}	{"type": "MultiLineString", "coordinates": [[[0, 0], [1, 1], [2, 2]], [[0, 0], [11, 11], [12, 12]]]}	{"type": "MultiPolygon", "coordinates": [[[[0, 0], [10, 0], [10, 10], [0, 10], [0, 0]], [[5, 5], [7, 5], [7, 7], [5, 7], [5, 5]]], [[[0, 0], [10, 0], [10, 10], [0, 10], [0, 0]], [[5, 5], [7, 5], [7, 7], [5, 7], [5, 5]]]]}
delete from misc_dt;
select * from misc_dt;
ge	po	ls	py
insert into misc_dt values
(
(select ST_GeomFromGeoJSON( cast( doc as char ) ) from jtable where id = 1),
(select ST_GeomFromGeoJSON( cast( doc as char ) ) from jtable where id = 2),
(select ST_GeomFromGeoJSON( cast( doc as char ) ) from jtable where id = 3),
(select ST_GeomFromGeoJSON( cast( doc as char ) ) from jtable where id = 4)
);
select ST_AsGeoJSON( ge ),
ST_AsGeoJSON( po ),
ST_AsGeoJSON( ls ),
ST_AsGeoJSON( py )
from misc_dt;
ST_AsGeoJSON( ge )	ST_AsGeoJSON( po )	ST_AsGeoJSON( ls )	ST_AsGeoJSON( py )
{"type": "GeometryCollection", "geometries": [{"type": "Point", "coordinates": [1, 1]}, {"type": "Point", "coordinates": [2, 2]}]}	{"type": "MultiPoint", "coordinates": [[1, 1], [2, 2]]}	{"type": "MultiLineString", "coordinates": [[[0, 0], [1, 1], [2, 2]], [[0, 0], [11, 11], [12, 12]]]}	{"type": "MultiPolygon", "coordinates": [[[[0, 0], [10, 0], [10, 10], [0, 10], [0, 0]], [[5, 5], [7, 5], [7, 7], [5, 7], [5, 5]]], [[[0, 0], [10, 0], [10, 10], [0, 10], [0, 0]], [[5, 5], [7, 5], [7, 7], [5, 7], [5, 5]]]]}
drop table misc_dt;
drop table jtable;
# ----------------------------------------------------------------------
# Test of COALESCE
# ----------------------------------------------------------------------
select coalesce(cast(1 as json), cast(2 as json));
coalesce(cast(1 as json), cast(2 as json))
1
select coalesce(j, cast(3 as json)) from t;
coalesce(j, cast(3 as json))
[1, 2, 3]
7
2
3
select coalesce(j, 666) from t;
coalesce(j, 666)
[1, 2, 3]
7
2
666
select json_type(coalesce(j, '[1,2,3]')) from t;
json_type(coalesce(j, '[1,2,3]'))
ARRAY
INTEGER
INTEGER
ARRAY
select json_type(coalesce(j, 'abc')) from t;
ERROR 22032: Invalid JSON text in argument 1 to function json_type: "Invalid value." at position 0.
select json_type(coalesce(j, cast('"arg2"' as json))) from t order by c;
json_type(coalesce(j, cast('"arg2"' as json)))
STRING
INTEGER
INTEGER
ARRAY
select json_type(coalesce(j, j)) from t order by c;
json_type(coalesce(j, j))
NULL
INTEGER
INTEGER
ARRAY
select json_type(coalesce(json_extract(concat(j, 'abc'), '$'), j)) from t;
ERROR 22032: Invalid JSON text in argument 1 to function json_extract: "The document root must not follow by other values." at position 9.
select json_type(coalesce(t1.j, json_extract(concat(t2.j, 'abc'), '$')))
from t t1, t t2;
ERROR 22032: Invalid JSON text in argument 1 to function json_extract: "The document root must not follow by other values." at position 9.
drop table t;
# ----------------------------------------------------------------------
# Auto-convert of non-utf8 returning system function
# ----------------------------------------------------------------------
create table t(j json, id int);
insert into t values ('{"user": "foo"}', 8), (NULL, 8);
update t set j=json_set(j, '$.user', current_user()) where id=8;
select j from t;
j
{"user": "root@localhost"}
NULL
update t set j=json_set(j, '$.user', rtrim('foo    '))  where id=8;
select j from t;
j
{"user": "foo"}
NULL
update t set j=json_set(j, '$.user', hex('abc'))  where id=8;
select j from t;
j
{"user": "616263"}
NULL
update t set j=json_set(j, '$.user', md5('bingle'))  where id=8;
select j from t;
j
{"user": "f7bffef41562255b44fe01aadecb5c8d"}
NULL
update t set j=json_set(j, '$.user', database())  where id=8;
select j from t;
j
{"user": "test"}
NULL
update t set j=json_set(j, '$.user', schema()) where id=8;
select j from t;
j
{"user": "test"}
NULL
update t set j=json_set(j, '$.user',
cast(UNHEX('F0A09C8E') as char character set 'utf8mb4')) where id=8;
set names 'utf8mb4';
select j from t;
j
{"user": "𠜎"}
NULL
select char_length(json_extract(j, '$.user')) from t;
char_length(json_extract(j, '$.user'))
3
NULL
drop table t;
# ----------------------------------------------------------------------
# Test of JSON_QUOTE, JSON_UNQUOTE
# ----------------------------------------------------------------------
select json_quote();
ERROR 42000: Incorrect parameter count in the call to native function 'json_quote'
select json_quote('abc', 'def');
ERROR 42000: Incorrect parameter count in the call to native function 'json_quote'
select json_quote(NULL, 'def');
ERROR 42000: Incorrect parameter count in the call to native function 'json_quote'
select json_quote('abc', NULL);
ERROR 42000: Incorrect parameter count in the call to native function 'json_quote'
select json_unquote();
ERROR 42000: Incorrect parameter count in the call to native function 'json_unquote'
select json_unquote('"abc"', '"def"');
ERROR 42000: Incorrect parameter count in the call to native function 'json_unquote'
select json_unquote(NULL, 'def');
ERROR 42000: Incorrect parameter count in the call to native function 'json_unquote'
select json_unquote('"abc"', NULL);
ERROR 42000: Incorrect parameter count in the call to native function 'json_unquote'
select json_quote(NULL);
json_quote(NULL)
NULL
select json_unquote(NULL);
json_unquote(NULL)
NULL
select json_quote('abc');
json_quote('abc')
"abc"
select json_quote(convert('abc' using ascii));
json_quote(convert('abc' using ascii))
"abc"
select json_quote(convert('abc' using latin1));
json_quote(convert('abc' using latin1))
"abc"
select json_quote(convert('abc' using utf8));
json_quote(convert('abc' using utf8))
"abc"
select json_quote(convert('abc' using utf8mb4));
json_quote(convert('abc' using utf8mb4))
"abc"
select json_unquote('abc');
json_unquote('abc')
abc
select json_unquote('"abc"');
json_unquote('"abc"')
abc
select json_unquote(convert('"abc"' using ascii));
json_unquote(convert('"abc"' using ascii))
abc
select json_unquote(convert('"abc"' using latin1));
json_unquote(convert('"abc"' using latin1))
abc
select json_unquote(convert('"abc"' using utf8));
json_unquote(convert('"abc"' using utf8))
abc
select json_unquote(convert('"abc"' using utf8mb4));
json_unquote(convert('"abc"' using utf8mb4))
abc
select json_quote('"');
json_quote('"')
"\""
select json_unquote('"');
json_unquote('"')
"
select json_quote(123);
ERROR HY000: Incorrect type for argument 1 in function json_quote.
select json_unquote(123);
ERROR HY000: Incorrect type for argument 1 in function json_unquote.
select json_unquote('""');
json_unquote('""')

select char_length(json_unquote('""'));
char_length(json_unquote('""'))
0
select json_unquote('"" ');
json_unquote('"" ')
"" 
select json_unquote(cast(json_quote('abc') as json));
json_unquote(cast(json_quote('abc') as json))
abc
select cast('{"abc": "foo"}' as json);
cast('{"abc": "foo"}' as json)
{"abc": "foo"}
select json_unquote(cast('{"abc": "foo"}' as json));
json_unquote(cast('{"abc": "foo"}' as json))
{"abc": "foo"}
select json_extract(cast('{"abc": "foo"}' as json), '$.abc');
json_extract(cast('{"abc": "foo"}' as json), '$.abc')
"foo"
select json_unquote(json_extract(cast('{"abc": "foo"}' as json), '$.abc'));
json_unquote(json_extract(cast('{"abc": "foo"}' as json), '$.abc'))
foo
select json_unquote('["a", "b", "c"]');
json_unquote('["a", "b", "c"]')
["a", "b", "c"]
select json_unquote(cast('["a", "b", "c"]' as json));
json_unquote(cast('["a", "b", "c"]' as json))
["a", "b", "c"]
select charset(json_unquote('"abc"'));
charset(json_unquote('"abc"'))
utf8mb4
create table t (c varchar(20));
insert into t values ('\\');
select char_length(c) from t;
char_length(c)
1
insert into t values (X'0C');
select sum(char_length(c)) from t;
sum(char_length(c))
2
insert into t values ('"');
select sum(char_length(c)) from t;
sum(char_length(c))
3
insert into t values ('\a');
select sum(char_length(c)) from t;
sum(char_length(c))
4
insert into t values ('\b');
select sum(char_length(c)) from t;
sum(char_length(c))
5
insert into t values ('\t');
select sum(char_length(c)) from t;
sum(char_length(c))
6
insert into t values ('\n');
select sum(char_length(c)) from t;
sum(char_length(c))
7
insert into t values ('\r');
select sum(char_length(c)) from t;
sum(char_length(c))
8
insert into t values (X'10');
select sum(char_length(c)) from t;
sum(char_length(c))
9
select group_concat(c) from t;
group_concat(c)
\,,",a,,	,
,,
select char_length(group_concat(c)) from t;
char_length(group_concat(c))
17
select json_quote(group_concat(c)) from t;
json_quote(group_concat(c))
"\\,\f,\",a,\b,\t,\n,\r,\u0010"
select char_length(json_quote(group_concat(c))) from t;
char_length(json_quote(group_concat(c)))
31
select convert(group_concat(c) using utf8mb4) =
json_unquote(group_concat(c)) as should_be_equal from t;
should_be_equal
1
select json_quote(convert(X'e68891' using utf8));
json_quote(convert(X'e68891' using utf8))
"我"
select json_quote(convert(X'e68891' using utf8mb4));
json_quote(convert(X'e68891' using utf8mb4))
"我"
select cast(json_quote(convert(X'e68891' using utf8)) as json);
cast(json_quote(convert(X'e68891' using utf8)) as json)
"我"
select json_unquote(convert(X'e68891' using utf8));
json_unquote(convert(X'e68891' using utf8))
我
select  json_quote(json_quote(json_quote('abc')));
json_quote(json_quote(json_quote('abc')))
"\"\\\"abc\\\"\""
select  json_unquote(json_unquote(json_unquote(        # long round trip of it
json_quote(json_quote(json_quote('abc'))))));
json_unquote(json_unquote(json_unquote(        # long round trip of it
json_quote(json_quote(json_quote('abc'))))))
abc
select cast(cast('2015-01-15 23:24:25' as datetime) as json);
cast(cast('2015-01-15 23:24:25' as datetime) as json)
"2015-01-15 23:24:25.000000"
select json_unquote(cast(cast('2015-01-15 23:24:25' as datetime) as json));
json_unquote(cast(cast('2015-01-15 23:24:25' as datetime) as json))
2015-01-15 23:24:25.000000
select cast(st_geomfromtext('point(1 1)') as json);
cast(st_geomfromtext('point(1 1)') as json)
{"type": "Point", "coordinates": [1, 1]}
select json_unquote(cast(st_geomfromtext('point(1 1)') as json));
json_unquote(cast(st_geomfromtext('point(1 1)') as json))
{"type": "Point", "coordinates": [1, 1]}
delete from t;
alter table t add column (j json);
insert into t values (NULL, NULL);
select json_quote(c), json_quote(j) from t;
json_quote(c)	json_quote(j)
NULL	NULL
select json_unquote(c), json_unquote(j) from t;
json_unquote(c)	json_unquote(j)
NULL	NULL
drop table t;
#
# Bug#21257946 JSON_TYPE(TEXT) OF TABLE COLUMN STICKS WITH NULL
#              AFTER FIRST ENCOUNTER OF NULL
#
CREATE TABLE T_WITH_NULLS(i INT, j JSON);
INSERT INTO T_WITH_NULLS VALUES
(0, NULL),
(1, '[1]'),
(2, NULL),
(3, '{"a":"b"}'),
(4, NULL),
(5, '"abc"');
SELECT
JSON_VALID(j),
JSON_TYPE(j),
JSON_KEYS(j),
JSON_EXTRACT(j, '$'),
JSON_REMOVE(j, '$.a.b.c'),
JSON_ARRAY_APPEND(j, '$', 2),
JSON_SET(j, '$[0]', 2),
JSON_INSERT(j, '$[0]', 2),
JSON_REPLACE(j, '$[0]', 2),
JSON_MERGE(j, j),
JSON_SEARCH(j, 'one', 'abc'),
JSON_CONTAINS(j, '[1]'),
JSON_CONTAINS_PATH(j, 'all', '$.a'),
JSON_LENGTH(j),
JSON_DEPTH(j),
JSON_ARRAY(j, j),
JSON_OBJECT('k', j),
JSON_UNQUOTE(CAST(j AS CHAR)),
JSON_QUOTE(CAST(j AS CHAR))
FROM T_WITH_NULLS
ORDER BY i;
JSON_VALID(j)	JSON_TYPE(j)	JSON_KEYS(j)	JSON_EXTRACT(j, '$')	JSON_REMOVE(j, '$.a.b.c')	JSON_ARRAY_APPEND(j, '$', 2)	JSON_SET(j, '$[0]', 2)	JSON_INSERT(j, '$[0]', 2)	JSON_REPLACE(j, '$[0]', 2)	JSON_MERGE(j, j)	JSON_SEARCH(j, 'one', 'abc')	JSON_CONTAINS(j, '[1]')	JSON_CONTAINS_PATH(j, 'all', '$.a')	JSON_LENGTH(j)	JSON_DEPTH(j)	JSON_ARRAY(j, j)	JSON_OBJECT('k', j)	JSON_UNQUOTE(CAST(j AS CHAR))	JSON_QUOTE(CAST(j AS CHAR))
NULL	NULL	NULL	NULL	NULL	NULL	NULL	NULL	NULL	NULL	NULL	NULL	NULL	NULL	NULL	[null, null]	{"k": null}	NULL	NULL
1	ARRAY	NULL	[1]	[1]	[1, 2]	[2]	[1]	[2]	[1, 1]	NULL	1	0	1	2	[[1], [1]]	{"k": [1]}	[1]	"[1]"
NULL	NULL	NULL	NULL	NULL	NULL	NULL	NULL	NULL	NULL	NULL	NULL	NULL	NULL	NULL	[null, null]	{"k": null}	NULL	NULL
1	OBJECT	["a"]	{"a": "b"}	{"a": "b"}	[{"a": "b"}, 2]	2	{"a": "b"}	2	{"a": ["b", "b"]}	NULL	0	1	1	2	[{"a": "b"}, {"a": "b"}]	{"k": {"a": "b"}}	{"a": "b"}	"{\"a\": \"b\"}"
NULL	NULL	NULL	NULL	NULL	NULL	NULL	NULL	NULL	NULL	NULL	NULL	NULL	NULL	NULL	[null, null]	{"k": null}	NULL	NULL
1	STRING	NULL	"abc"	"abc"	["abc", 2]	2	"abc"	2	["abc", "abc"]	"$"	0	0	1	1	["abc", "abc"]	{"k": "abc"}	abc	"\"abc\""
ALTER TABLE T_WITH_NULLS MODIFY COLUMN j TEXT;
SELECT
JSON_VALID(j),
JSON_TYPE(j),
JSON_KEYS(j),
JSON_EXTRACT(j, '$'),
JSON_REMOVE(j, '$.a.b.c'),
JSON_ARRAY_APPEND(j, '$', 2),
JSON_SET(j, '$[0]', 2),
JSON_INSERT(j, '$[0]', 2),
JSON_REPLACE(j, '$[0]', 2),
JSON_MERGE(j, j),
JSON_SEARCH(j, 'one', 'abc'),
JSON_CONTAINS(j, '[1]'),
JSON_CONTAINS_PATH(j, 'all', '$.a'),
JSON_LENGTH(j),
JSON_DEPTH(j),
JSON_ARRAY(j, j),
JSON_OBJECT('k', j),
JSON_UNQUOTE(CAST(j AS CHAR)),
JSON_QUOTE(CAST(j AS CHAR))
FROM T_WITH_NULLS
ORDER BY i;
JSON_VALID(j)	JSON_TYPE(j)	JSON_KEYS(j)	JSON_EXTRACT(j, '$')	JSON_REMOVE(j, '$.a.b.c')	JSON_ARRAY_APPEND(j, '$', 2)	JSON_SET(j, '$[0]', 2)	JSON_INSERT(j, '$[0]', 2)	JSON_REPLACE(j, '$[0]', 2)	JSON_MERGE(j, j)	JSON_SEARCH(j, 'one', 'abc')	JSON_CONTAINS(j, '[1]')	JSON_CONTAINS_PATH(j, 'all', '$.a')	JSON_LENGTH(j)	JSON_DEPTH(j)	JSON_ARRAY(j, j)	JSON_OBJECT('k', j)	JSON_UNQUOTE(CAST(j AS CHAR))	JSON_QUOTE(CAST(j AS CHAR))
NULL	NULL	NULL	NULL	NULL	NULL	NULL	NULL	NULL	NULL	NULL	NULL	NULL	NULL	NULL	[null, null]	{"k": null}	NULL	NULL
1	ARRAY	NULL	[1]	[1]	[1, 2]	[2]	[1]	[2]	[1, 1]	NULL	1	0	1	2	["[1]", "[1]"]	{"k": "[1]"}	[1]	"[1]"
NULL	NULL	NULL	NULL	NULL	NULL	NULL	NULL	NULL	NULL	NULL	NULL	NULL	NULL	NULL	[null, null]	{"k": null}	NULL	NULL
1	OBJECT	["a"]	{"a": "b"}	{"a": "b"}	[{"a": "b"}, 2]	2	{"a": "b"}	2	{"a": ["b", "b"]}	NULL	0	1	1	2	["{\"a\": \"b\"}", "{\"a\": \"b\"}"]	{"k": "{\"a\": \"b\"}"}	{"a": "b"}	"{\"a\": \"b\"}"
NULL	NULL	NULL	NULL	NULL	NULL	NULL	NULL	NULL	NULL	NULL	NULL	NULL	NULL	NULL	[null, null]	{"k": null}	NULL	NULL
1	STRING	NULL	"abc"	"abc"	["abc", 2]	2	"abc"	2	["abc", "abc"]	"$"	0	0	1	1	["\"abc\"", "\"abc\""]	{"k": "\"abc\""}	abc	"\"abc\""
DROP TABLE T_WITH_NULLS;
CREATE TABLE t_latin1(id INT PRIMARY KEY AUTO_INCREMENT,
json_text VARCHAR(20),
json_atom_text VARCHAR(20),
json_path VARCHAR(20))
CHARACTER SET 'latin1';
INSERT INTO t_latin1 (json_text, json_atom_text, json_path) VALUES
(CONVERT(X'5B22E6F8E5225D' USING latin1),             # ["\u00e6\u00f8\u00e5"]
CONVERT(X'E5F8E6' USING latin1),                     # \u00e5\u00f8\u00e6
'$[0]'),
(CONVERT(X'7B22E6F8E5223A22E6F8E5227D' USING latin1),
# {"\u00e6\u00f8\u00e5":"\u00e6\u00f8\u00e5"}
CONVERT(X'E5F8E6' USING latin1),                     # \u00e5\u00f8\u00e6
CONVERT(X'242E22E6F8E522' USING latin1));
SELECT * FROM t_latin1 ORDER BY id;
id	json_text	json_atom_text	json_path
1	["æøå"]	åøæ	$[0]
2	{"æøå":"æøå"}	åøæ	$."æøå"
SELECT CAST(json_text AS JSON) FROM t_latin1 ORDER BY id;
CAST(json_text AS JSON)
["æøå"]
{"æøå": "æøå"}
SELECT JSON_VALID(json_text) FROM t_latin1 ORDER BY id;
JSON_VALID(json_text)
1
1
SELECT JSON_VALID(json_atom_text) FROM t_latin1 ORDER BY id;
JSON_VALID(json_atom_text)
0
0
SELECT JSON_TYPE(json_text) FROM t_latin1 ORDER BY id;
JSON_TYPE(json_text)
ARRAY
OBJECT
SELECT JSON_EXTRACT(json_text, json_path) FROM t_latin1 ORDER BY id;
JSON_EXTRACT(json_text, json_path)
"æøå"
"æøå"
SELECT JSON_REMOVE(json_text, json_path) FROM t_latin1 ORDER BY id;
JSON_REMOVE(json_text, json_path)
[]
{}
SELECT JSON_ARRAY_APPEND(json_text, json_path, json_atom_text)
FROM t_latin1 ORDER BY id;
JSON_ARRAY_APPEND(json_text, json_path, json_atom_text)
[["æøå", "åøæ"]]
{"æøå": ["æøå", "åøæ"]}
SELECT JSON_SET(json_text, json_path, json_atom_text) FROM t_latin1 ORDER BY id;
JSON_SET(json_text, json_path, json_atom_text)
["åøæ"]
{"æøå": "åøæ"}
SELECT JSON_INSERT(json_text, json_path, json_atom_text)
FROM t_latin1 ORDER BY id;
JSON_INSERT(json_text, json_path, json_atom_text)
["æøå"]
{"æøå": "æøå"}
SELECT JSON_REPLACE(json_text, json_path, json_atom_text)
FROM t_latin1 ORDER BY id;
JSON_REPLACE(json_text, json_path, json_atom_text)
["åøæ"]
{"æøå": "åøæ"}
SELECT JSON_MERGE(json_text, json_text) FROM t_latin1 ORDER BY id;
JSON_MERGE(json_text, json_text)
["æøå", "æøå"]
{"æøå": ["æøå", "æøå"]}
SELECT JSON_SEARCH(json_text, CONVERT('one' USING latin1), json_atom_text,
CONVERT(X'F8' USING latin1), json_path)
FROM t_latin1 ORDER BY id;
JSON_SEARCH(json_text, CONVERT('one' USING latin1), json_atom_text,
CONVERT(X'F8' USING latin1), json_path)
NULL
NULL
SELECT JSON_CONTAINS(json_text, json_text, json_path) FROM t_latin1 ORDER BY id;
JSON_CONTAINS(json_text, json_text, json_path)
0
0
SELECT JSON_CONTAINS_PATH(json_text, CONVERT('one' USING latin1), json_path)
FROM t_latin1 ORDER BY id;
JSON_CONTAINS_PATH(json_text, CONVERT('one' USING latin1), json_path)
1
1
SELECT JSON_LENGTH(json_text, json_path) FROM t_latin1 ORDER BY id;
JSON_LENGTH(json_text, json_path)
1
1
SELECT JSON_DEPTH(json_text) FROM t_latin1 ORDER BY id;
JSON_DEPTH(json_text)
2
2
SELECT JSON_ARRAY(json_atom_text, json_atom_text) FROM t_latin1 ORDER BY id;
JSON_ARRAY(json_atom_text, json_atom_text)
["åøæ", "åøæ"]
["åøæ", "åøæ"]
SELECT JSON_OBJECT(json_atom_text, json_atom_text) FROM t_latin1 ORDER BY id;
JSON_OBJECT(json_atom_text, json_atom_text)
{"åøæ": "åøæ"}
{"åøæ": "åøæ"}
SELECT JSON_UNQUOTE(json_atom_text) FROM t_latin1 ORDER BY id;
JSON_UNQUOTE(json_atom_text)
åøæ
åøæ
SELECT JSON_UNQUOTE(CONVERT(CONCAT('"', json_atom_text, '"') USING latin1))
FROM t_latin1 ORDER BY id;
JSON_UNQUOTE(CONVERT(CONCAT('"', json_atom_text, '"') USING latin1))
åøæ
åøæ
SELECT JSON_QUOTE(json_atom_text) FROM t_latin1 ORDER BY id;
JSON_QUOTE(json_atom_text)
"åøæ"
"åøæ"
DROP TABLE t_latin1;
SELECT JSON_UNQUOTE( '"abc"' );
JSON_UNQUOTE( '"abc"' )
abc
SELECT JSON_UNQUOTE( '"abc' );
JSON_UNQUOTE( '"abc' )
"abc
SELECT JSON_UNQUOTE( 123 );
ERROR HY000: Incorrect type for argument 1 in function json_unquote.
SELECT JSON_UNQUOTE
( CAST( CAST( '"abc"' AS JSON ) AS CHAR ) );
JSON_UNQUOTE
( CAST( CAST( '"abc"' AS JSON ) AS CHAR ) )
abc
SELECT JSON_UNQUOTE
(
CAST(
JSON_EXTRACT( '{ "userName" : "fred" }', '$.userName' )
AS CHAR
)
) = 'fred';
JSON_UNQUOTE
(
CAST(
JSON_EXTRACT( '{ "userName" : "fred" }', '$.userName' )
AS CHAR
)
) = 'fred'
1
SELECT
CAST(
JSON_EXTRACT( '{ "userName" : "fred" }', '$.userName' )
AS CHAR
) = 'fred';
CAST(
JSON_EXTRACT( '{ "userName" : "fred" }', '$.userName' )
AS CHAR
) = 'fred'
0
SELECT JSON_QUOTE( 'abc' );
JSON_QUOTE( 'abc' )
"abc"
SELECT JSON_QUOTE( 123 );
ERROR HY000: Incorrect type for argument 1 in function json_quote.
SELECT CAST( JSON_QUOTE( '123' ) AS JSON );
CAST( JSON_QUOTE( '123' ) AS JSON )
"123"
# ----------------------------------------------------------------------
# Test that boolean expressions are treated as boolean atom literals
# ----------------------------------------------------------------------
create table t_bool_literals( a int, b varchar(10) );
insert into t_bool_literals values ( 1, 'food' ), ( 2, 'fool' ), ( 3, 'water' );
select a, json_array( ((a < 3) and (a > 1)) ) from t_bool_literals order by a;
a	json_array( ((a < 3) and (a > 1)) )
1	[false]
2	[true]
3	[false]
select a, json_array_append( '[]', '$', ((a < 3) and (a > 1)) ) from t_bool_literals order by a;
a	json_array_append( '[]', '$', ((a < 3) and (a > 1)) )
1	[false]
2	[true]
3	[false]
select a, json_array( not ((a < 3) and (a > 1)) ) from t_bool_literals order by a;
a	json_array( not ((a < 3) and (a > 1)) )
1	[true]
2	[false]
3	[true]
select a, json_array_append( '[]', '$', not ((a < 3) and (a > 1)) ) from t_bool_literals order by a;
a	json_array_append( '[]', '$', not ((a < 3) and (a > 1)) )
1	[true]
2	[false]
3	[true]
select a, json_array( ((a < 3) or (a > 1)) ) from t_bool_literals order by a;
a	json_array( ((a < 3) or (a > 1)) )
1	[true]
2	[true]
3	[true]
select a, json_array_append( '[]', '$', ((a < 3) or (a > 1)) ) from t_bool_literals order by a;
a	json_array_append( '[]', '$', ((a < 3) or (a > 1)) )
1	[true]
2	[true]
3	[true]
select a, json_array( not ((a < 3) or (a > 1)) ) from t_bool_literals order by a;
a	json_array( not ((a < 3) or (a > 1)) )
1	[false]
2	[false]
3	[false]
select a, json_array_append( '[]', '$', not ((a < 3) or (a > 1)) ) from t_bool_literals order by a;
a	json_array_append( '[]', '$', not ((a < 3) or (a > 1)) )
1	[false]
2	[false]
3	[false]
select json_array( not true, not false );
json_array( not true, not false )
[false, true]
select json_array_append( '[]', '$', not true, '$', not false );
json_array_append( '[]', '$', not true, '$', not false )
[false, true]
select a, json_array( 1 and true ) from t_bool_literals order by a;
a	json_array( 1 and true )
1	[true]
2	[true]
3	[true]
select a, json_array_append( '[]', '$', 1 and true ) from t_bool_literals order by a;
a	json_array_append( '[]', '$', 1 and true )
1	[true]
2	[true]
3	[true]
select a, json_array( not 1 ) from t_bool_literals order by a;
a	json_array( not 1 )
1	[false]
2	[false]
3	[false]
select a, json_array_append( '[]', '$', not 1 ) from t_bool_literals order by a;
a	json_array_append( '[]', '$', not 1 )
1	[false]
2	[false]
3	[false]
select json_array( true, false );
json_array( true, false )
[true, false]
select json_array_append( '[]', '$', true, '$', false );
json_array_append( '[]', '$', true, '$', false )
[true, false]
select a, json_array( (a < 3) ) from t_bool_literals order by a;
a	json_array( (a < 3) )
1	[true]
2	[true]
3	[false]
select a, json_array_append( '[]', '$', (a < 3) ) from t_bool_literals order by a;
a	json_array_append( '[]', '$', (a < 3) )
1	[true]
2	[true]
3	[false]
select a, json_array( (a <= 3) ) from t_bool_literals order by a;
a	json_array( (a <= 3) )
1	[true]
2	[true]
3	[true]
select a, json_array_append( '[]', '$', (a <= 3) ) from t_bool_literals order by a;
a	json_array_append( '[]', '$', (a <= 3) )
1	[true]
2	[true]
3	[true]
select a, json_array( (a > 3) ) from t_bool_literals order by a;
a	json_array( (a > 3) )
1	[false]
2	[false]
3	[false]
select a, json_array_append( '[]', '$', (a > 3) ) from t_bool_literals order by a;
a	json_array_append( '[]', '$', (a > 3) )
1	[false]
2	[false]
3	[false]
select a, json_array( (a >= 3) ) from t_bool_literals order by a;
a	json_array( (a >= 3) )
1	[false]
2	[false]
3	[true]
select a, json_array_append( '[]', '$', (a >= 3) ) from t_bool_literals order by a;
a	json_array_append( '[]', '$', (a >= 3) )
1	[false]
2	[false]
3	[true]
select a, json_array( (a <> 3) ) from t_bool_literals order by a;
a	json_array( (a <> 3) )
1	[true]
2	[true]
3	[false]
select a, json_array_append( '[]', '$', (a <> 3) ) from t_bool_literals order by a;
a	json_array_append( '[]', '$', (a <> 3) )
1	[true]
2	[true]
3	[false]
select a, json_array( (a != 3) ) from t_bool_literals order by a;
a	json_array( (a != 3) )
1	[true]
2	[true]
3	[false]
select a, json_array_append( '[]', '$', (a != 3) ) from t_bool_literals order by a;
a	json_array_append( '[]', '$', (a != 3) )
1	[true]
2	[true]
3	[false]
select a, json_array( a is null ) from t_bool_literals order by a;
a	json_array( a is null )
1	[false]
2	[false]
3	[false]
select a, json_array_append( '[]', '$', a is null ) from t_bool_literals order by a;
a	json_array_append( '[]', '$', a is null )
1	[false]
2	[false]
3	[false]
select a, json_array( a is not null ) from t_bool_literals order by a;
a	json_array( a is not null )
1	[true]
2	[true]
3	[true]
select a, json_array_append( '[]', '$', a is not null ) from t_bool_literals order by a;
a	json_array_append( '[]', '$', a is not null )
1	[true]
2	[true]
3	[true]
select a, json_array( a is true ) from t_bool_literals order by a;
a	json_array( a is true )
1	[true]
2	[true]
3	[true]
select a, json_array_append( '[]', '$', a is true ) from t_bool_literals order by a;
a	json_array_append( '[]', '$', a is true )
1	[true]
2	[true]
3	[true]
select a, json_array( a is not true ) from t_bool_literals order by a;
a	json_array( a is not true )
1	[false]
2	[false]
3	[false]
select a, json_array_append( '[]', '$', a is not true ) from t_bool_literals order by a;
a	json_array_append( '[]', '$', a is not true )
1	[false]
2	[false]
3	[false]
select a, json_array(nullif(true, false)  ) from t_bool_literals order by a;
a	json_array(nullif(true, false)  )
1	[true]
2	[true]
3	[true]
select a, json_array_append
(
'[]',
'$',  nullif(true, false)
) from t_bool_literals order by a;
a	json_array_append
(
'[]',
'$',  nullif(true, false)
)
1	[true]
2	[true]
3	[true]
select a, json_array( (case when (a > 1) then true else false end) and true ) from t_bool_literals order by a;
a	json_array( (case when (a > 1) then true else false end) and true )
1	[false]
2	[true]
3	[true]
select a, json_array_append
(
'[]',
'$', (case when (a > 1) then true else false end) and true
) from t_bool_literals order by a;
a	json_array_append
(
'[]',
'$', (case when (a > 1) then true else false end) and true
)
1	[false]
2	[true]
3	[true]
select a, json_array( a between 2 and 4 ) from t_bool_literals order by a;
a	json_array( a between 2 and 4 )
1	[false]
2	[true]
3	[true]
select a, json_array_append( '[]', '$', a between 2 and 4 ) from t_bool_literals order by a;
a	json_array_append( '[]', '$', a between 2 and 4 )
1	[false]
2	[true]
3	[true]
select a, json_array( a in (1,3) ) from t_bool_literals order by a;
a	json_array( a in (1,3) )
1	[true]
2	[false]
3	[true]
select a, json_array_append( '[]', '$', a in (1,3) ) from t_bool_literals order by a;
a	json_array_append( '[]', '$', a in (1,3) )
1	[true]
2	[false]
3	[true]
select a, json_array( b like 'foo%' ) from t_bool_literals order by a;
a	json_array( b like 'foo%' )
1	[true]
2	[true]
3	[false]
select a, json_array_append( '[]', '$', b like 'foo%' ) from t_bool_literals order by a;
a	json_array_append( '[]', '$', b like 'foo%' )
1	[true]
2	[true]
3	[false]
select a, json_array( b REGEXP '^fo+d' ) from t_bool_literals order by a;
a	json_array( b REGEXP '^fo+d' )
1	[true]
2	[false]
3	[false]
select a, json_array_append( '[]', '$', b REGEXP '^fo+d' ) from t_bool_literals order by a;
a	json_array_append( '[]', '$', b REGEXP '^fo+d' )
1	[true]
2	[false]
3	[false]
select a, json_array( b rlike '^fo+d' ) from t_bool_literals order by a;
a	json_array( b rlike '^fo+d' )
1	[true]
2	[false]
3	[false]
select a, json_array_append( '[]', '$', b rlike '^fo+d' ) from t_bool_literals order by a;
a	json_array_append( '[]', '$', b rlike '^fo+d' )
1	[true]
2	[false]
3	[false]
select a, json_array( b not REGEXP '^fo+d' ) from t_bool_literals order by a;
a	json_array( b not REGEXP '^fo+d' )
1	[false]
2	[true]
3	[true]
select a, json_array_append( '[]', '$', b not REGEXP '^fo+d' ) from t_bool_literals order by a;
a	json_array_append( '[]', '$', b not REGEXP '^fo+d' )
1	[false]
2	[true]
3	[true]
select a, json_array( b not rlike '^fo+d' ) from t_bool_literals order by a;
a	json_array( b not rlike '^fo+d' )
1	[false]
2	[true]
3	[true]
select a, json_array_append( '[]', '$', b not rlike '^fo+d' ) from t_bool_literals order by a;
a	json_array_append( '[]', '$', b not rlike '^fo+d' )
1	[false]
2	[true]
3	[true]
select a, json_array( b = some( select b from t_bool_literals ) ) from t_bool_literals order by a;
a	json_array( b = some( select b from t_bool_literals ) )
1	[true]
2	[true]
3	[true]
select a, json_array_append( '[]', '$', b = some( select b from t_bool_literals ) ) from t_bool_literals order by a;
a	json_array_append( '[]', '$', b = some( select b from t_bool_literals ) )
1	[true]
2	[true]
3	[true]
select a, json_array( b = all( select b from t_bool_literals ) ) from t_bool_literals order by a;
a	json_array( b = all( select b from t_bool_literals ) )
1	[false]
2	[false]
3	[false]
select a, json_array_append( '[]', '$', b = all( select b from t_bool_literals ) ) from t_bool_literals order by a;
a	json_array_append( '[]', '$', b = all( select b from t_bool_literals ) )
1	[false]
2	[false]
3	[false]
select a, json_array( b = any( select b from t_bool_literals ) ) from t_bool_literals order by a;
a	json_array( b = any( select b from t_bool_literals ) )
1	[true]
2	[true]
3	[true]
select a, json_array_append( '[]', '$', b = any( select b from t_bool_literals ) ) from t_bool_literals order by a;
a	json_array_append( '[]', '$', b = any( select b from t_bool_literals ) )
1	[true]
2	[true]
3	[true]
select a, json_array( b > some( select b from t_bool_literals ) ) from t_bool_literals order by a;
a	json_array( b > some( select b from t_bool_literals ) )
1	[false]
2	[true]
3	[true]
select a, json_array_append( '[]', '$', b > some( select b from t_bool_literals ) ) from t_bool_literals order by a;
a	json_array_append( '[]', '$', b > some( select b from t_bool_literals ) )
1	[false]
2	[true]
3	[true]
select a, json_array( b > all( select b from t_bool_literals ) ) from t_bool_literals order by a;
a	json_array( b > all( select b from t_bool_literals ) )
1	[false]
2	[false]
3	[false]
select a, json_array_append( '[]', '$', b > all( select b from t_bool_literals ) ) from t_bool_literals order by a;
a	json_array_append( '[]', '$', b > all( select b from t_bool_literals ) )
1	[false]
2	[false]
3	[false]
select a, json_array( b > any( select b from t_bool_literals ) ) from t_bool_literals order by a;
a	json_array( b > any( select b from t_bool_literals ) )
1	[false]
2	[true]
3	[true]
select a, json_array_append( '[]', '$', b > any( select b from t_bool_literals ) ) from t_bool_literals order by a;
a	json_array_append( '[]', '$', b > any( select b from t_bool_literals ) )
1	[false]
2	[true]
3	[true]
select a, json_array( b < some( select b from t_bool_literals ) ) from t_bool_literals order by a;
a	json_array( b < some( select b from t_bool_literals ) )
1	[true]
2	[true]
3	[false]
select a, json_array_append( '[]', '$', b < some( select b from t_bool_literals ) ) from t_bool_literals order by a;
a	json_array_append( '[]', '$', b < some( select b from t_bool_literals ) )
1	[true]
2	[true]
3	[false]
select a, json_array( b < all( select b from t_bool_literals ) ) from t_bool_literals order by a;
a	json_array( b < all( select b from t_bool_literals ) )
1	[false]
2	[false]
3	[false]
select a, json_array_append( '[]', '$', b < all( select b from t_bool_literals ) ) from t_bool_literals order by a;
a	json_array_append( '[]', '$', b < all( select b from t_bool_literals ) )
1	[false]
2	[false]
3	[false]
select a, json_array( b < any( select b from t_bool_literals ) ) from t_bool_literals order by a;
a	json_array( b < any( select b from t_bool_literals ) )
1	[true]
2	[true]
3	[false]
select a, json_array_append( '[]', '$', b < any( select b from t_bool_literals ) ) from t_bool_literals order by a;
a	json_array_append( '[]', '$', b < any( select b from t_bool_literals ) )
1	[true]
2	[true]
3	[false]
select a, json_array( b <= some( select b from t_bool_literals ) ) from t_bool_literals order by a;
a	json_array( b <= some( select b from t_bool_literals ) )
1	[true]
2	[true]
3	[true]
select a, json_array_append( '[]', '$', b <= some( select b from t_bool_literals ) ) from t_bool_literals order by a;
a	json_array_append( '[]', '$', b <= some( select b from t_bool_literals ) )
1	[true]
2	[true]
3	[true]
select a, json_array( b <= all( select b from t_bool_literals ) ) from t_bool_literals order by a;
a	json_array( b <= all( select b from t_bool_literals ) )
1	[true]
2	[false]
3	[false]
select a, json_array_append( '[]', '$', b <= all( select b from t_bool_literals ) ) from t_bool_literals order by a;
a	json_array_append( '[]', '$', b <= all( select b from t_bool_literals ) )
1	[true]
2	[false]
3	[false]
select a, json_array( b <= any( select b from t_bool_literals ) ) from t_bool_literals order by a;
a	json_array( b <= any( select b from t_bool_literals ) )
1	[true]
2	[true]
3	[true]
select a, json_array_append( '[]', '$', b <= any( select b from t_bool_literals ) ) from t_bool_literals order by a;
a	json_array_append( '[]', '$', b <= any( select b from t_bool_literals ) )
1	[true]
2	[true]
3	[true]
select a, json_array( b >= some( select b from t_bool_literals ) ) from t_bool_literals order by a;
a	json_array( b >= some( select b from t_bool_literals ) )
1	[true]
2	[true]
3	[true]
select a, json_array_append( '[]', '$', b >= some( select b from t_bool_literals ) ) from t_bool_literals order by a;
a	json_array_append( '[]', '$', b >= some( select b from t_bool_literals ) )
1	[true]
2	[true]
3	[true]
select a, json_array( b >= all( select b from t_bool_literals ) ) from t_bool_literals order by a;
a	json_array( b >= all( select b from t_bool_literals ) )
1	[false]
2	[false]
3	[true]
select a, json_array_append( '[]', '$', b >= all( select b from t_bool_literals ) ) from t_bool_literals order by a;
a	json_array_append( '[]', '$', b >= all( select b from t_bool_literals ) )
1	[false]
2	[false]
3	[true]
select a, json_array( b >= any( select b from t_bool_literals ) ) from t_bool_literals order by a;
a	json_array( b >= any( select b from t_bool_literals ) )
1	[true]
2	[true]
3	[true]
select a, json_array_append( '[]', '$', b >= any( select b from t_bool_literals ) ) from t_bool_literals order by a;
a	json_array_append( '[]', '$', b >= any( select b from t_bool_literals ) )
1	[true]
2	[true]
3	[true]
select a, json_array( exists( select b from t_bool_literals where a = 1 ) ) from t_bool_literals order by a;
a	json_array( exists( select b from t_bool_literals where a = 1 ) )
1	[true]
2	[true]
3	[true]
select a, json_array_append( '[]', '$', exists( select b from t_bool_literals where a = 1 ) ) from t_bool_literals order by a;
a	json_array_append( '[]', '$', exists( select b from t_bool_literals where a = 1 ) )
1	[true]
2	[true]
3	[true]
select a, json_array( not exists( select b from t_bool_literals where a = 1 ) ) from t_bool_literals order by a;
a	json_array( not exists( select b from t_bool_literals where a = 1 ) )
1	[false]
2	[false]
3	[false]
select a, json_array_append( '[]', '$', not exists( select b from t_bool_literals where a = 1 ) ) from t_bool_literals order by a;
a	json_array_append( '[]', '$', not exists( select b from t_bool_literals where a = 1 ) )
1	[false]
2	[false]
3	[false]
select a, json_array( json_valid( b ) ) from t_bool_literals order by a;
a	json_array( json_valid( b ) )
1	[false]
2	[false]
3	[false]
select a, json_array_append( '[]', '$', json_valid( b ) ) from t_bool_literals order by a;
a	json_array_append( '[]', '$', json_valid( b ) )
1	[false]
2	[false]
3	[false]
select a, json_array( not json_valid( b ) ) from t_bool_literals order by a;
a	json_array( not json_valid( b ) )
1	[true]
2	[true]
3	[true]
select a, json_array_append( '[]', '$', not json_valid( b ) ) from t_bool_literals order by a;
a	json_array_append( '[]', '$', not json_valid( b ) )
1	[true]
2	[true]
3	[true]
select json_array( json_contains_path( '{ "a" : { "b" : 100 } }', 'all', '$.a.b' ) );
json_array( json_contains_path( '{ "a" : { "b" : 100 } }', 'all', '$.a.b' ) )
[true]
select a, json_array( gtid_subset('3E11FA47-71CA-11E1-9E33-C80AA9429562:23', '3E11FA47-71CA-11E1-9E33-C80AA9429562:21-57') )
from t_bool_literals order by a;
a	json_array( gtid_subset('3E11FA47-71CA-11E1-9E33-C80AA9429562:23', '3E11FA47-71CA-11E1-9E33-C80AA9429562:21-57') )
1	[true]
2	[true]
3	[true]
select a, json_array_append( '[]', '$', gtid_subset('3E11FA47-71CA-11E1-9E33-C80AA9429562:23', '3E11FA47-71CA-11E1-9E33-C80AA9429562:21-57') )
from t_bool_literals order by a;
a	json_array_append( '[]', '$', gtid_subset('3E11FA47-71CA-11E1-9E33-C80AA9429562:23', '3E11FA47-71CA-11E1-9E33-C80AA9429562:21-57') )
1	[true]
2	[true]
3	[true]
select a, json_array( not gtid_subset('3E11FA47-71CA-11E1-9E33-C80AA9429562:23', '3E11FA47-71CA-11E1-9E33-C80AA9429562:21-57') )
from t_bool_literals order by a;
a	json_array( not gtid_subset('3E11FA47-71CA-11E1-9E33-C80AA9429562:23', '3E11FA47-71CA-11E1-9E33-C80AA9429562:21-57') )
1	[false]
2	[false]
3	[false]
select a, json_array_append( '[]', '$', not gtid_subset('3E11FA47-71CA-11E1-9E33-C80AA9429562:23', '3E11FA47-71CA-11E1-9E33-C80AA9429562:21-57') )
from t_bool_literals order by a;
a	json_array_append( '[]', '$', not gtid_subset('3E11FA47-71CA-11E1-9E33-C80AA9429562:23', '3E11FA47-71CA-11E1-9E33-C80AA9429562:21-57') )
1	[false]
2	[false]
3	[false]
select a, json_array( b = ( select distinct b from t_bool_literals where a = 1 ) ) from t_bool_literals order by a;
a	json_array( b = ( select distinct b from t_bool_literals where a = 1 ) )
1	[true]
2	[false]
3	[false]
select a, json_array_append( '[]', '$',  b = ( select distinct b from t_bool_literals where a = 1 ) ) from t_bool_literals order by a;
a	json_array_append( '[]', '$',  b = ( select distinct b from t_bool_literals where a = 1 ) )
1	[true]
2	[false]
3	[false]
select a, json_array( b > ( select distinct b from t_bool_literals where a = 1 ) ) from t_bool_literals order by a;
a	json_array( b > ( select distinct b from t_bool_literals where a = 1 ) )
1	[false]
2	[true]
3	[true]
select a, json_array_append( '[]', '$',  b > ( select distinct b from t_bool_literals where a = 1 ) ) from t_bool_literals order by a;
a	json_array_append( '[]', '$',  b > ( select distinct b from t_bool_literals where a = 1 ) )
1	[false]
2	[true]
3	[true]
select a, json_array( b >= ( select distinct b from t_bool_literals where a = 1 ) ) from t_bool_literals order by a;
a	json_array( b >= ( select distinct b from t_bool_literals where a = 1 ) )
1	[true]
2	[true]
3	[true]
select a, json_array_append( '[]', '$',  b >= ( select distinct b from t_bool_literals where a = 1 ) ) from t_bool_literals order by a;
a	json_array_append( '[]', '$',  b >= ( select distinct b from t_bool_literals where a = 1 ) )
1	[true]
2	[true]
3	[true]
select a, json_array( b < ( select distinct b from t_bool_literals where a = 1 ) ) from t_bool_literals order by a;
a	json_array( b < ( select distinct b from t_bool_literals where a = 1 ) )
1	[false]
2	[false]
3	[false]
select a, json_array_append( '[]', '$',  b < ( select distinct b from t_bool_literals where a = 1 ) ) from t_bool_literals order by a;
a	json_array_append( '[]', '$',  b < ( select distinct b from t_bool_literals where a = 1 ) )
1	[false]
2	[false]
3	[false]
select a, json_array( b <= ( select distinct b from t_bool_literals where a = 1 ) ) from t_bool_literals order by a;
a	json_array( b <= ( select distinct b from t_bool_literals where a = 1 ) )
1	[true]
2	[false]
3	[false]
select a, json_array_append( '[]', '$',  b <= ( select distinct b from t_bool_literals where a = 1 ) ) from t_bool_literals order by a;
a	json_array_append( '[]', '$',  b <= ( select distinct b from t_bool_literals where a = 1 ) )
1	[true]
2	[false]
3	[false]
select a, json_array( ( select distinct a from t_bool_literals where a = 1 ) ) from t_bool_literals order by a;
a	json_array( ( select distinct a from t_bool_literals where a = 1 ) )
1	[1]
2	[1]
3	[1]
drop table t_bool_literals;
# ----------------------------------------------------------------------
# Test of JSON_CONTAINS
# ----------------------------------------------------------------------
# should give NULL
select json_contains(NULL, NULL);
json_contains(NULL, NULL)
NULL
select json_contains(cast('{"a": 1, "b": 2}' as json), NULL);
json_contains(cast('{"a": 1, "b": 2}' as json), NULL)
NULL
select json_contains(NULL, cast('null' as json));
json_contains(NULL, cast('null' as json))
NULL
select json_contains(cast('[1]' as json), cast('[1]' as json), NULL);
json_contains(cast('[1]' as json), cast('[1]' as json), NULL)
NULL
# should give 0:
select json_contains(cast(3.14 as json), cast(3 as json));
json_contains(cast(3.14 as json), cast(3 as json))
0
# should give 0: not at top level
select json_contains(cast('{"a": {"b": 7}}' as json), cast('{"b": 7}' as json));
json_contains(cast('{"a": {"b": 7}}' as json), cast('{"b": 7}' as json))
0
# but path argument will fix it:
select json_contains(cast('{"a": {"b": 7}}' as json), cast('{"b": 7}' as json), '$.a');
json_contains(cast('{"a": {"b": 7}}' as json), cast('{"b": 7}' as json), '$.a')
1
# but arrays "introspect"
select json_contains(cast('[1,[2.0, 3.0]]' as json), cast('[2.0]' as json));
json_contains(cast('[1,[2.0, 3.0]]' as json), cast('[2.0]' as json))
1
select json_contains(cast('[1, 2, [3, [4, 5]], 6, 7]' as json), cast('5' as json));
json_contains(cast('[1, 2, [3, [4, 5]], 6, 7]' as json), cast('5' as json))
1
# should give 0: just a key
select json_contains(cast('{"a": 1, "b": 2}' as json), cast('"a"' as json));
json_contains(cast('{"a": 1, "b": 2}' as json), cast('"a"' as json))
0
# should give 0: one candidate element doesn't match
select json_contains(cast('[1]' as json), cast('[1,2]' as json));
json_contains(cast('[1]' as json), cast('[1,2]' as json))
0
# should all give 1
select json_contains(cast('null' as json), cast('null' as json));
json_contains(cast('null' as json), cast('null' as json))
1
# simple object subset
select json_contains(cast('{"a": 1, "b": 2}' as json), cast( '{"a": 1}' as json));
json_contains(cast('{"a": 1, "b": 2}' as json), cast( '{"a": 1}' as json))
1
# simple vector subset
select json_contains(cast('[1, 2, 3]' as json), cast('[1, 3]' as json));
json_contains(cast('[1, 2, 3]' as json), cast('[1, 3]' as json))
1
# auto-wrap, should give 1
select json_contains(cast('[1, 2, 3]' as json), cast(3 as json));
json_contains(cast('[1, 2, 3]' as json), cast(3 as json))
1
# ok even with nested cast off elements
select json_contains(cast('{"person": {"id": 1, "country": "norway"}}' as json),
cast('{"person": {"country": "norway"}}' as json));
json_contains(cast('{"person": {"id": 1, "country": "norway"}}' as json),
cast('{"person": {"country": "norway"}}' as json))
1
# vector reordering and duplicates is ok
select json_contains(cast('[1,3,5]' as json), cast('[5,3,1,5]' as json));
json_contains(cast('[1,3,5]' as json), cast('[5,3,1,5]' as json))
1
# ok even with more elts in candidate than in doc
select json_contains(cast('[{"b": 4, "a":7}]' as json), cast('[{"a":7},{"b":4}]' as json));
json_contains(cast('[{"b": 4, "a":7}]' as json), cast('[{"a":7},{"b":4}]' as json))
1
select json_contains(cast('[{"b": 4, "a":7}, 5]' as json), cast('[5, {"a":7, "b":4}]' as json));
json_contains(cast('[{"b": 4, "a":7}, 5]' as json), cast('[5, {"a":7, "b":4}]' as json))
1
# ok even with mixed number types that compare equal
select json_contains(cast('[{"b": 4, "a":7}, 5.0]' as json), cast('[5, {"a":7.0E0, "b":4}]' as json));
json_contains(cast('[{"b": 4, "a":7}, 5.0]' as json), cast('[5, {"a":7.0E0, "b":4}]' as json))
1
select json_contains( '{"customer": "cust3"}', '{"customer": "cust1"}' );
json_contains( '{"customer": "cust3"}', '{"customer": "cust1"}' )
0
SELECT JSON_CONTAINS('[null,1,[2,3],true,false]', '[null,1,[3],false]');
JSON_CONTAINS('[null,1,[2,3],true,false]', '[null,1,[3],false]')
1
SELECT JSON_CONTAINS('[null,1,[2,3],true,false]', '[null,1,[4],false]');
JSON_CONTAINS('[null,1,[2,3],true,false]', '[null,1,[4],false]')
0
SELECT JSON_CONTAINS('[true,false]', '[[true]]');
JSON_CONTAINS('[true,false]', '[[true]]')
0
SELECT JSON_CONTAINS('[1,2]', '[[1]]');
JSON_CONTAINS('[1,2]', '[[1]]')
0
SELECT JSON_CONTAINS('[1,2]', '1', '$.abc');
JSON_CONTAINS('[1,2]', '1', '$.abc')
NULL
SELECT JSON_CONTAINS
(
CAST('[1, 4, 6]' AS JSON),
CAST('[1, 6]' AS JSON)
);
JSON_CONTAINS
(
CAST('[1, 4, 6]' AS JSON),
CAST('[1, 6]' AS JSON)
)
1
SELECT JSON_CONTAINS
(
CAST('{"person": {"id": 1, "country": "norway"}}' AS JSON),
CAST('{"person": {"country": "norway"}}' AS JSON)
);
JSON_CONTAINS
(
CAST('{"person": {"id": 1, "country": "norway"}}' AS JSON),
CAST('{"person": {"country": "norway"}}' AS JSON)
)
1
SELECT JSON_CONTAINS
(
CAST('[1,3,5]' AS JSON),
CAST('[5,3,1,5]' AS JSON)
);
JSON_CONTAINS
(
CAST('[1,3,5]' AS JSON),
CAST('[5,3,1,5]' AS JSON)
)
1
SELECT JSON_CONTAINS
(
CAST('[3.14]' AS JSON),
CAST('[3]' AS JSON)
);
JSON_CONTAINS
(
CAST('[3.14]' AS JSON),
CAST('[3]' AS JSON)
)
0
SELECT JSON_CONTAINS
(
CAST('[1, 2, 3]' AS JSON),
CAST(3 AS JSON)
);
JSON_CONTAINS
(
CAST('[1, 2, 3]' AS JSON),
CAST(3 AS JSON)
)
1
SELECT JSON_CONTAINS();
ERROR 42000: Incorrect parameter count in the call to native function 'JSON_CONTAINS'
SELECT JSON_CONTAINS('[1]');
ERROR 42000: Incorrect parameter count in the call to native function 'JSON_CONTAINS'
SELECT JSON_CONTAINS('[1]', '[1]', '$', '$[0]');
ERROR 42000: Incorrect parameter count in the call to native function 'JSON_CONTAINS'
# ----------------------------------------------------------------------
# Verify that all of the string types behave similarly when used as ANY_JSON_ATOMS
# ----------------------------------------------------------------------
create table t_char( a int, b char(20) );
insert into t_char values ( 1, 'foo' );
create table t_varchar( a int, b varchar(20) );
insert into t_varchar values ( 1, 'foo' );
Create table t_tinytext( a int, b tinytext );
insert into t_tinytext values ( 1, 'foo' );
create table t_text( a int, b text );
insert into t_text values ( 1, 'foo' );
create table t_mediumtext( a int, b mediumtext );
insert into t_mediumtext values ( 1, 'foo' );
create table t_longtext( a int, b longtext );
insert into t_longtext values ( 1, 'foo' );
select json_array( b ) from t_char;
json_array( b )
["foo"]
select json_array( b ) from t_varchar;
json_array( b )
["foo"]
select json_array( b ) from t_tinytext;
json_array( b )
["foo"]
select json_array( b ) from t_text;
json_array( b )
["foo"]
select json_array( b ) from t_mediumtext;
json_array( b )
["foo"]
select json_array( b ) from t_longtext;
json_array( b )
["foo"]
select json_array( cast( b as char ) ) from t_char;
json_array( cast( b as char ) )
["foo"]
select json_array( cast( b as char ) ) from t_varchar;
json_array( cast( b as char ) )
["foo"]
select json_array( cast( b as char ) ) from t_tinytext;
json_array( cast( b as char ) )
["foo"]
select json_array( cast( b as char ) ) from t_text;
json_array( cast( b as char ) )
["foo"]
select json_array( cast( b as char ) ) from t_mediumtext;
json_array( cast( b as char ) )
["foo"]
select json_array( cast( b as char ) ) from t_longtext;
json_array( cast( b as char ) )
["foo"]
select json_array( UpdateXML('<a><b>ccc</b><d></d></a>', '/a/d', '<e>fff</e>') );
json_array( UpdateXML('<a><b>ccc</b><d></d></a>', '/a/d', '<e>fff</e>') )
["<a><b>ccc</b><e>fff</e></a>"]
select json_array( cast( UpdateXML('<a><b>ccc</b><d></d></a>', '/a/d', '<e>fff</e>') as char ) );
json_array( cast( UpdateXML('<a><b>ccc</b><d></d></a>', '/a/d', '<e>fff</e>') as char ) )
["<a><b>ccc</b><e>fff</e></a>"]
select json_array( ExtractValue('<r><n id="1">v1</n><n id="2">v2</n></r>','//n[@id=1]' ) );
json_array( ExtractValue('<r><n id="1">v1</n><n id="2">v2</n></r>','//n[@id=1]' ) )
["v1"]
select json_array( cast( ExtractValue('<r><n id="1">v1</n><n id="2">v2</n></r>','//n[@id=1]' ) as char ) );
json_array( cast( ExtractValue('<r><n id="1">v1</n><n id="2">v2</n></r>','//n[@id=1]' ) as char ) )
["v1"]
drop table t_char;
drop table t_varchar;
drop table t_tinytext;
drop table t_text;
drop table t_mediumtext;
drop table t_longtext;
# ----------------------------------------------------------------------
# Check that JSON values stemming from views and derived tables work
# ----------------------------------------------------------------------
create table t(x int);
insert into t values (NULL), (4);
select json_array(x) from (select x from t) tt order by x;
json_array(x)
[null]
[4]
create view v as select * from t;
select json_array(x) from v order by x;
json_array(x)
[null]
[4]
drop view v;
drop table t;
# ----------------------------------------------------------------------
# Ignore collation.collation when handing off val_str to a JSON field -
# bug found by John E.
# ----------------------------------------------------------------------
create table t3( col_json json );
insert into t3(col_json) values ( json_quote( '1' ) );
select * from t3;
col_json
"1"
select json_type(col_json) from t3;
json_type(col_json)
STRING
# ----------------------------------------------------------------------
# Wrong collation from JSON_QUOTE caused problems: Set it in
# Item_func_json_quote::fix_length_and_dec.   Bug found by Knut.
# Similar issue for JSON_UNQUOTE and JSON_TYPE.
# ----------------------------------------------------------------------
select json_object("a", ifnull(json_quote('test'), cast('null' as json)));
json_object("a", ifnull(json_quote('test'), cast('null' as json)))
{"a": "\"test\""}
select cast(concat('[', json_quote('ab'), ']') as json);
cast(concat('[', json_quote('ab'), ']') as json)
["ab"]
select cast(concat('[', json_unquote('"12"'), ']') as json);
cast(concat('[', json_unquote('"12"'), ']') as json)
[12]
select cast(concat('["', json_type(cast(1 as json)), '"]') as json);
cast(concat('["', json_type(cast(1 as json)), '"]') as json)
["INTEGER"]
drop table t3;
# ----------------------------------------------------------------------
# Correctly escape key names when pretty-printing JSON objects.
# Correct behavior means that the strings can be re-used for
# their original purposes as key names and paths.
# ----------------------------------------------------------------------
create table jep( key_col int primary key, doc json, path varchar( 50 ) );
insert into jep values
( 1, '{ "one \\"potato": "seven"  }', '$."one \\"potato"' ),
( 2, '{ "one \\npotato": "seven"  }', '$."one \\npotato"' ),
( 3, '{ "one \\tpotato": "seven"  }', '$."one \\tpotato"' ),
( 4, '{ "one \\bpotato": "seven"  }', '$."one \\bpotato"' ),
( 5, '{ "one \\fpotato": "seven"  }', '$."one \\fpotato"' ),
( 6, '{ "one \\rpotato": "seven"  }', '$."one \\rpotato"' ),
( 7, '{ "one \\\\potato": "seven"  }', '$."one \\\\potato"' );
insert into jep select key_col + 100, cast( doc as char ), path from jep;
select key_col, doc, json_keys( doc ) from jep order by key_col;
key_col	doc	json_keys( doc )
1	{"one \"potato": "seven"}	["one \"potato"]
2	{"one \npotato": "seven"}	["one \npotato"]
3	{"one \tpotato": "seven"}	["one \tpotato"]
4	{"one \bpotato": "seven"}	["one \bpotato"]
5	{"one \fpotato": "seven"}	["one \fpotato"]
6	{"one \rpotato": "seven"}	["one \rpotato"]
7	{"one \\potato": "seven"}	["one \\potato"]
101	{"one \"potato": "seven"}	["one \"potato"]
102	{"one \npotato": "seven"}	["one \npotato"]
103	{"one \tpotato": "seven"}	["one \tpotato"]
104	{"one \bpotato": "seven"}	["one \bpotato"]
105	{"one \fpotato": "seven"}	["one \fpotato"]
106	{"one \rpotato": "seven"}	["one \rpotato"]
107	{"one \\potato": "seven"}	["one \\potato"]
select key_col, doc, json_extract( doc, cast(path as char) ) from jep order by key_col;
key_col	doc	json_extract( doc, cast(path as char) )
1	{"one \"potato": "seven"}	"seven"
2	{"one \npotato": "seven"}	"seven"
3	{"one \tpotato": "seven"}	"seven"
4	{"one \bpotato": "seven"}	"seven"
5	{"one \fpotato": "seven"}	"seven"
6	{"one \rpotato": "seven"}	"seven"
7	{"one \\potato": "seven"}	"seven"
101	{"one \"potato": "seven"}	"seven"
102	{"one \npotato": "seven"}	"seven"
103	{"one \tpotato": "seven"}	"seven"
104	{"one \bpotato": "seven"}	"seven"
105	{"one \fpotato": "seven"}	"seven"
106	{"one \rpotato": "seven"}	"seven"
107	{"one \\potato": "seven"}	"seven"
select * from jep order by key_col;
key_col	doc	path
1	{"one \"potato": "seven"}	$."one \"potato"
2	{"one \npotato": "seven"}	$."one \npotato"
3	{"one \tpotato": "seven"}	$."one \tpotato"
4	{"one \bpotato": "seven"}	$."one \bpotato"
5	{"one \fpotato": "seven"}	$."one \fpotato"
6	{"one \rpotato": "seven"}	$."one \rpotato"
7	{"one \\potato": "seven"}	$."one \\potato"
101	{"one \"potato": "seven"}	$."one \"potato"
102	{"one \npotato": "seven"}	$."one \npotato"
103	{"one \tpotato": "seven"}	$."one \tpotato"
104	{"one \bpotato": "seven"}	$."one \bpotato"
105	{"one \fpotato": "seven"}	$."one \fpotato"
106	{"one \rpotato": "seven"}	$."one \rpotato"
107	{"one \\potato": "seven"}	$."one \\potato"
drop table jep;
# ----------------------------------------------------------------------
# Test that cached, constant path objects are restored
# after the leg popping which happens inside json_insert()
# and json_replace().
# ----------------------------------------------------------------------
create table t_cache( id int, doc json );
insert into t_cache values
( 1, '{ "a": { "b": 1 } }' ),
( 2, '{ "a": { "c": 1 } }' ),
( 3, '{ "a": { "d": 1 } }' );
select id, doc, json_insert( doc, '$.a.c', 2 ) from t_cache order by id;
id	doc	json_insert( doc, '$.a.c', 2 )
1	{"a": {"b": 1}}	{"a": {"b": 1, "c": 2}}
2	{"a": {"c": 1}}	{"a": {"c": 1}}
3	{"a": {"d": 1}}	{"a": {"c": 2, "d": 1}}
select id, doc, json_insert( doc, '$.a.c', 2, '$.a.d', 3 ) from t_cache order by id;
id	doc	json_insert( doc, '$.a.c', 2, '$.a.d', 3 )
1	{"a": {"b": 1}}	{"a": {"b": 1, "c": 2, "d": 3}}
2	{"a": {"c": 1}}	{"a": {"c": 1, "d": 3}}
3	{"a": {"d": 1}}	{"a": {"c": 2, "d": 1}}
delete from t_cache;
insert into t_cache values
( 1, '{ "a": { "b": 1, "c": 2, "d": 3 } }' ),
( 2, '{ "a": { "c": 2, "d": 3 } }' ),
( 3, '{ "a": { "b": 1, "d": 3 } }' ),
( 4, '{ "a": { "b": 1, "c": 2 } }' ),
( 5, '{ "a": { "b": 1 } }' ),
( 6, '{ "a": { "c": 2 } }' ),
( 7, '{ "a": { "d": 3 } }' ),
( 8, '{ "a": {} }' );
select id, doc, json_replace( doc, '$.a.c', 20 ) from t_cache order by id;
id	doc	json_replace( doc, '$.a.c', 20 )
1	{"a": {"b": 1, "c": 2, "d": 3}}	{"a": {"b": 1, "c": 20, "d": 3}}
2	{"a": {"c": 2, "d": 3}}	{"a": {"c": 20, "d": 3}}
3	{"a": {"b": 1, "d": 3}}	{"a": {"b": 1, "d": 3}}
4	{"a": {"b": 1, "c": 2}}	{"a": {"b": 1, "c": 20}}
5	{"a": {"b": 1}}	{"a": {"b": 1}}
6	{"a": {"c": 2}}	{"a": {"c": 20}}
7	{"a": {"d": 3}}	{"a": {"d": 3}}
8	{"a": {}}	{"a": {}}
select id, doc, json_replace( doc, '$.a.c', 20, '$.a.d', 30 ) from t_cache order by id;
id	doc	json_replace( doc, '$.a.c', 20, '$.a.d', 30 )
1	{"a": {"b": 1, "c": 2, "d": 3}}	{"a": {"b": 1, "c": 20, "d": 30}}
2	{"a": {"c": 2, "d": 3}}	{"a": {"c": 20, "d": 30}}
3	{"a": {"b": 1, "d": 3}}	{"a": {"b": 1, "d": 30}}
4	{"a": {"b": 1, "c": 2}}	{"a": {"b": 1, "c": 20}}
5	{"a": {"b": 1}}	{"a": {"b": 1}}
6	{"a": {"c": 2}}	{"a": {"c": 20}}
7	{"a": {"d": 3}}	{"a": {"d": 30}}
8	{"a": {}}	{"a": {}}
drop table t_cache;
# ----------------------------------------------------------------------
# Test that one_or_all arguments are cached correctly.
# ----------------------------------------------------------------------
create table t_ooa( id int, doc json, one_or_all varchar(10) );
insert into t_ooa values
( 1, '{ "a": 1, "b": 2, "c": 3 }', 'one' ),
( 2, '{ "d": 4 }', 'one' ),
( 3, '{ "a": 1, "b": 2, "d": 4 }', 'all' ),
( 4, '{ "a": 1, "c": 3 }', 'all' ),
( 5, '{ "d": 4 }', 'all' ),
( 6, '{ "a": 1, "b": 2, "c": 3 }', null );
select id, doc, one_or_all, json_contains_path( doc, one_or_all, '$.a', '$.b' ) from t_ooa order by id;
id	doc	one_or_all	json_contains_path( doc, one_or_all, '$.a', '$.b' )
1	{"a": 1, "b": 2, "c": 3}	one	1
2	{"d": 4}	one	0
3	{"a": 1, "b": 2, "d": 4}	all	1
4	{"a": 1, "c": 3}	all	0
5	{"d": 4}	all	0
6	{"a": 1, "b": 2, "c": 3}	NULL	NULL
select id, doc, json_contains_path( doc, 'one', '$.a', '$.b' ) from t_ooa order by id;
id	doc	json_contains_path( doc, 'one', '$.a', '$.b' )
1	{"a": 1, "b": 2, "c": 3}	1
2	{"d": 4}	0
3	{"a": 1, "b": 2, "d": 4}	1
4	{"a": 1, "c": 3}	1
5	{"d": 4}	0
6	{"a": 1, "b": 2, "c": 3}	1
select id, doc, json_contains_path( doc, 'all', '$.a', '$.b' ) from t_ooa order by id;
id	doc	json_contains_path( doc, 'all', '$.a', '$.b' )
1	{"a": 1, "b": 2, "c": 3}	1
2	{"d": 4}	0
3	{"a": 1, "b": 2, "d": 4}	1
4	{"a": 1, "c": 3}	0
5	{"d": 4}	0
6	{"a": 1, "b": 2, "c": 3}	1
select id, doc, json_contains_path( doc, null, '$.a', '$.b' ) from t_ooa order by id;
id	doc	json_contains_path( doc, null, '$.a', '$.b' )
1	{"a": 1, "b": 2, "c": 3}	NULL
2	{"d": 4}	NULL
3	{"a": 1, "b": 2, "d": 4}	NULL
4	{"a": 1, "c": 3}	NULL
5	{"d": 4}	NULL
6	{"a": 1, "b": 2, "c": 3}	NULL
delete from t_ooa;
insert into t_ooa values
( 1, '{ "a": "foot", "b": "fool", "c": "food" }', 'one' ),
( 1, '{ "a": "foot", "b": "fool", "c": "food" }', 'all' ),
( 1, '{ "a": "foot", "b": "fool", "c": "food" }', null );
select id, doc, one_or_all, json_search( doc, one_or_all, 'foo%' ) from t_ooa order by id;
id	doc	one_or_all	json_search( doc, one_or_all, 'foo%' )
1	{"a": "foot", "b": "fool", "c": "food"}	one	"$.a"
1	{"a": "foot", "b": "fool", "c": "food"}	all	["$.a", "$.b", "$.c"]
1	{"a": "foot", "b": "fool", "c": "food"}	NULL	NULL
select id, doc, json_search( doc, 'one', 'foo%' ) from t_ooa order by id;
id	doc	json_search( doc, 'one', 'foo%' )
1	{"a": "foot", "b": "fool", "c": "food"}	"$.a"
1	{"a": "foot", "b": "fool", "c": "food"}	"$.a"
1	{"a": "foot", "b": "fool", "c": "food"}	"$.a"
select id, doc, json_search( doc, 'all', 'foo%' ) from t_ooa order by id;
id	doc	json_search( doc, 'all', 'foo%' )
1	{"a": "foot", "b": "fool", "c": "food"}	["$.a", "$.b", "$.c"]
1	{"a": "foot", "b": "fool", "c": "food"}	["$.a", "$.b", "$.c"]
1	{"a": "foot", "b": "fool", "c": "food"}	["$.a", "$.b", "$.c"]
select id, doc, json_search( doc, null, 'foo%' ) from t_ooa order by id;
id	doc	json_search( doc, null, 'foo%' )
1	{"a": "foot", "b": "fool", "c": "food"}	NULL
1	{"a": "foot", "b": "fool", "c": "food"}	NULL
1	{"a": "foot", "b": "fool", "c": "food"}	NULL
drop table t_ooa;
CREATE TABLE t1(j JSON);
CREATE TABLE t2(j JSON);
INSERT INTO t1 VALUES ('[1]'), ('[2]'), ('[3]'), ('[4]');
INSERT INTO t2 VALUES ('[1]');
ANALYZE TABLE t1, t2;
Table	Op	Msg_type	Msg_text
test.t1	analyze	status	OK
test.t2	analyze	status	OK
EXPLAIN UPDATE t1, t2 SET t1.j = JSON_INSERT(t2.j, '$[1]', t2.j) WHERE t1.j=t2.j;
id	select_type	table	partitions	type	possible_keys	key	key_len	ref	rows	filtered	Extra
1	SIMPLE	t2	NULL	ALL	NULL	NULL	NULL	NULL	1	100.00	NULL
1	UPDATE	t1	NULL	ALL	NULL	NULL	NULL	NULL	4	25.00	Using where
UPDATE t1, t2 SET t1.j = JSON_INSERT(t2.j, '$[1]', t2.j) WHERE t1.j=t2.j;
SELECT * FROM t1 ORDER BY (CAST(j AS CHAR));
j
[1, [1]]
[2]
[3]
[4]
DROP TABLE t1, t2;
#
# Bug#20888919: ASSERT `!THD->IS_ERROR()' FAILED IN HANDLE_QUERY()
#               ON EXPLAIN SELECT JSON
#
create table t (pk int primary key, col_json json);
ANALYZE TABLE t;
Table	Op	Msg_type	Msg_text
test.t	analyze	status	OK
explain SELECT col_json FROM t WHERE pk = 1;
id	select_type	table	partitions	type	possible_keys	key	key_len	ref	rows	filtered	Extra
1	SIMPLE	NULL	NULL	NULL	NULL	NULL	NULL	NULL	NULL	NULL	no matching row in const table
Warnings:
Note	1003	/* select#1 */ select NULL AS `col_json` from `test`.`t` where multiple equal(1, NULL)
drop table t;
#
# Bug#20912438: ITEM_TYPE_HOLDER::DISPLAY_LENGTH(ITEM*): ASSERTION `0' FAILED
#
(SELECT JSON_KEYS('{ "key80": "2015-04-20 11:53:55"}')) UNION ALL
(SELECT JSON_KEYS('{ "key80": "2015-04-20 11:53:55" }') LIMIT 0);
JSON_KEYS('{ "key80": "2015-04-20 11:53:55"}')
["key80"]
SELECT CAST(1 AS JSON) UNION ALL SELECT CAST(1 AS JSON);
CAST(1 AS JSON)
1
1
# ----------------------------------------------------------------------
# Bug#20889248 Used to crash the server
# ----------------------------------------------------------------------
create table tt(i int, j json, si int);
select count(*) , json_keys('{"key17": {"a": {"b": "c"}}, "key88": "value94"}');
count(*)	json_keys('{"key17": {"a": {"b": "c"}}, "key88": "value94"}')
1	["key17", "key88"]
insert into tt(i, j)
select count(*), json_extract('{"key17": {"a": {"b": "c"}}, "key88": 100}',
'$.key88');
insert into tt(i, si)
select count(*), json_extract('{"key17": {"a": {"b": "c"}}, "key88": 100}',
'$.key88');
select * from tt;
i	j	si
1	100	NULL
1	NULL	100
SELECT COUNT(*), CAST(NULL AS JSON);
COUNT(*)	CAST(NULL AS JSON)
1	NULL
SELECT COUNT(*), JSON_EXTRACT('not valid json!', '$');
ERROR 22032: Invalid JSON text in argument 1 to function json_extract: "Invalid value." at position 1.
delete from tt;
insert into tt(j) values (cast(1 as json)), (null);
select sum( distinct j ) from tt group by j having j in ( avg( 1 ), 1 + j);
sum( distinct j )
1
Warnings:
Warning	1235	This version of MySQL doesn't yet support 'comparison of JSON in the IN operator'
SELECT JSON_ARRAY(j), COUNT(*) FROM tt GROUP BY j, i WITH ROLLUP;
JSON_ARRAY(j)	COUNT(*)
[null]	1
[null]	1
[1]	1
[1]	1
[null]	2
SELECT REPEAT('abc', j), COUNT(*) FROM tt GROUP BY j, i WITH ROLLUP;
REPEAT('abc', j)	COUNT(*)
NULL	1
NULL	1
abc	1
abc	1
NULL	2
SELECT REPEAT(j, 2), COUNT(*) FROM tt GROUP BY j, i WITH ROLLUP;
REPEAT(j, 2)	COUNT(*)
NULL	1
NULL	1
11	1
11	1
NULL	2
SELECT CAST(j AS DECIMAL(5,2)), COUNT(*) FROM tt GROUP BY j, i WITH ROLLUP;
CAST(j AS DECIMAL(5,2))	COUNT(*)
NULL	1
NULL	1
1.00	1
1.00	1
NULL	2
UPDATE tt SET j = CAST(CAST('12:13:14' AS TIME) AS JSON) WHERE j IS NOT NULL;
SELECT CAST(j AS TIME), COUNT(*) FROM tt GROUP BY j, i WITH ROLLUP;
CAST(j AS TIME)	COUNT(*)
NULL	1
NULL	1
12:13:14	1
12:13:14	1
NULL	2
SELECT CAST(j AS DATE) = CURRENT_DATE, COUNT(*) FROM tt
GROUP BY j, i WITH ROLLUP;
CAST(j AS DATE) = CURRENT_DATE	COUNT(*)
NULL	1
NULL	1
1	1
1	1
NULL	2
UPDATE tt SET j = CAST(CAST('2015-06-19' AS DATE) AS JSON) WHERE j IS NOT NULL;
SELECT CAST(j AS DATE), COUNT(*) FROM tt GROUP BY j, i WITH ROLLUP;
CAST(j AS DATE)	COUNT(*)
NULL	1
NULL	1
2015-06-19	1
2015-06-19	1
NULL	2
DELETE FROM tt;
INSERT INTO tt(j) VALUES (JSON_ARRAY(REPEAT('abc', 100)));
UPDATE tt SET j = JSON_ARRAY(j,j,j,j);
SET GLOBAL net_buffer_length = 1024;
SET GLOBAL max_allowed_packet = 1024;
SELECT REPEAT(j, 2), COUNT(*) FROM tt GROUP BY j, i WITH ROLLUP;
REPEAT(j, 2)	COUNT(*)
NULL	1
NULL	1
NULL	1
Warnings:
Warning	1235	This version of MySQL doesn't yet support 'sorting of non-scalar JSON values'
Warning	1301	Result of j() was larger than max_allowed_packet (1024) - truncated
SET GLOBAL max_allowed_packet = default;
SET GLOBAL net_buffer_length = default;
DROP TABLE tt;
# ----------------------------------------------------------------------
# Bug#20914054 Used to crash the server
# ----------------------------------------------------------------------
CREATE TABLE t1 (
pk INT NOT NULL,
col_int_key INT,
col_json json,
PRIMARY KEY (pk),
KEY col_int_key (col_int_key)
);
INSERT INTO t1 VALUES (8, 4, '{}');
CREATE TABLE t2 (
pk INT NOT NULL,
PRIMARY KEY (pk)
);
INSERT INTO t2 VALUES (20);
SELECT MIN(JSON_KEYS( t1.col_json )) AS field1
FROM t1 JOIN t2
HAVING field1 = 7;
field1
Warnings:
Warning	3156	Invalid JSON value for CAST to DOUBLE from column ? at row 2
drop table t1;
drop table t2;
# ----------------------------------------------------------------------
# Bug#20920788 Used to give SQL state 22032: Cannot create a JSON value
# from a string with CHARACTER SET 'binary'.
#----------------------------------------------------------------------
CREATE TABLE t (
col_json JSON,
col_varchar VARCHAR(1),
col_varchar_key VARCHAR(1),
KEY col_varchar_key (col_varchar_key)
);
INSERT INTO t VALUES ('{}', 'a', 'a');
# This always succeeded, group by column is indexed, optimizer does not
# use filesort:
SELECT MAX(col_json) AS field1, col_varchar_key AS field2 FROM t GROUP BY field2;
field1	field2
{}	a
# This used to fail, group by column is not indexed, EXPLAIN says
# filesort is used:
SELECT MAX(col_json) AS field1, col_varchar AS field2 FROM t GROUP BY field2;
field1	field2
{}	a
drop table t;
# ----------------------------------------------------------------------
# Bug  report from John E.
# Crash in Item_copy_json::~Item_copy_json
# ----------------------------------------------------------------------
EXPLAIN SELECT COUNT(*), JSON_KEYS('{}');
id	select_type	table	partitions	type	possible_keys	key	key_len	ref	rows	filtered	Extra
1	SIMPLE	NULL	NULL	NULL	NULL	NULL	NULL	NULL	NULL	NULL	No tables used
Warnings:
Note	1003	/* select#1 */ select count(0) AS `COUNT(*)`,json_keys('{}') AS `JSON_KEYS('{}')`
# ----------------------------------------------------------------------
# Bug#20962317 WARNING 3150 'INVALID JSON VALUE FOR CAST TO INTEGER' ON
#              SUBQUERY IN JSON_VALID
#----------------------------------------------------------------------
create table myt(col_json json);
insert into myt values ('{}');
# This statement used to give two wrong warnings
select json_valid((select col_json from myt));
json_valid((select col_json from myt))
1
drop table myt;
# ----------------------------------------------------------------------
# Bug#20954309 JSON_SEARCH() IN VIEWS DOES NOT WORK, ALWAYS RETURNS NULL
#----------------------------------------------------------------------
CREATE TABLE t_20954309 (id int, col_json JSON);
INSERT INTO t_20954309 VALUES
(2, '{"keyA": "eleven"}');
CREATE VIEW v1_20954309 AS SELECT id, JSON_SEARCH(col_json, 'one', 'ele%' ) FROM t_20954309;
CREATE VIEW v2_20954309 AS SELECT id, col_json FROM t_20954309;
SELECT id, JSON_SEARCH(col_json, 'one', 'ele%' ) from t_20954309 order by id;
id	JSON_SEARCH(col_json, 'one', 'ele%' )
2	"$.keyA"
SELECT id, JSON_SEARCH(col_json, 'one', 'eleven' ) from v2_20954309 order by id;
id	JSON_SEARCH(col_json, 'one', 'eleven' )
2	"$.keyA"
SELECT * FROM v1_20954309 order by id;
id	JSON_SEARCH(col_json, 'one', 'ele%' )
2	"$.keyA"
select json_search( '{ "a": "foo" }', 'one', 'foo', 'a' );
json_search( '{ "a": "foo" }', 'one', 'foo', 'a' )
"$.a"
select json_search( '{ "a": "foo" }', 'one', 'foo', null );
json_search( '{ "a": "foo" }', 'one', 'foo', null )
"$.a"
select json_search( '{ "a": "foo" }', 'one', 'foo', convert(x'f8' using latin1) );
json_search( '{ "a": "foo" }', 'one', 'foo', convert(x'f8' using latin1) )
"$.a"
select json_search( '{ "a": "foo" }', 'one', 'foo', 'ab' );
ERROR HY000: Incorrect arguments to ESCAPE
drop view v1_20954309;
drop view v2_20954309;
drop table t_20954309;
create table t_20954309 (id int, doc JSON, search_string varchar(20), escape_char varchar(10) );
insert into t_20954309 values
(1, '{"match11": "eleven", "match12": "element", "notMatch": "elven" }', 'ele%', null ),
(2, '{"match21": "eleven", "match22": "element", "notMatch": "elven" }', 'ele%', 'z' ),
(3, '{"match31": "tw%elve", "match32": "tw%ilight", "notMatch": "twitter" }', 'tw|%%', '|' );
select id, json_search( doc, 'all', search_string, '|' ) from t_20954309 order by id;
id	json_search( doc, 'all', search_string, '|' )
1	["$.match11", "$.match12"]
2	["$.match21", "$.match22"]
3	["$.match31", "$.match32"]
create view v_20954309 as select id, json_search( doc, 'all', search_string, '|' ) from t_20954309 order by id;
select * from v_20954309;
id	json_search( doc, 'all', search_string, '|' )
1	["$.match11", "$.match12"]
2	["$.match21", "$.match22"]
3	["$.match31", "$.match32"]
select id, json_search( doc, 'all', search_string, null ) from t_20954309 where id < 3 order by id;
id	json_search( doc, 'all', search_string, null )
1	["$.match11", "$.match12"]
2	["$.match21", "$.match22"]
create view v2_20954309 as select id, json_search( doc, 'all', search_string, null ) result from t_20954309 where id < 3 order by id;
select * from v2_20954309;
id	result
1	["$.match11", "$.match12"]
2	["$.match21", "$.match22"]
drop view v_20954309;
drop view v2_20954309;
drop table t_20954309;
create table t_doc (id int, doc JSON );
insert into t_doc values
(1, '{"match11": "eleven", "match12": "element", "notMatch": "elven" }' ),
(2, '{"match21": "eleven", "match22": "element", "notMatch": "elven" }' ),
(3, '{"match31": "tw%elve", "match32": "tw%ilight", "notMatch": "twitter" }' );
create table t_search_string (id int, search_string varchar(20) );
insert into t_search_string values
(1, 'ele%' ),
(2, 'ele%' ),
(3, 'tw|%%' );
select t.id, json_search( doc, 'all', (select search_string from t_search_string s where s.id = t.id), '|' )
from t_doc t order by id;
id	json_search( doc, 'all', (select search_string from t_search_string s where s.id = t.id), '|' )
1	["$.match11", "$.match12"]
2	["$.match21", "$.match22"]
3	["$.match31", "$.match32"]
create view v_doc as
select t.id, json_search( doc, 'all', (select search_string from t_search_string s where s.id = t.id), '|' )
from t_doc t order by id;
select * from v_doc;
id	Name_exp_2
1	["$.match11", "$.match12"]
2	["$.match21", "$.match22"]
3	["$.match31", "$.match32"]
drop view v_doc;
drop table t_doc;
drop table t_search_string;
set names default;
# ----------------------------------------------------------------------
# Wrong results when Json_path_cache primed is accessed
# during the prepare-phase.
#----------------------------------------------------------------------
select json_remove( '[ 1, { "a": true, "b": false, "c": null }, 5 ]', null ) is null;
json_remove( '[ 1, { "a": true, "b": false, "c": null }, 5 ]', null ) is null
1
prepare stmt1 from 'select json_remove( ''[ 1, { "a": true, "b": false, "c": null }, 5 ]'', null ) is null';
execute stmt1;
json_remove( '[ 1, { "a": true, "b": false, "c": null }, 5 ]', null ) is null
1
select json_remove( '[ 1, { "a": true, "b": false, "c": null }, 5 ]', '$.' ) is null;
ERROR 42000: Invalid JSON path expression. The error is around character position 2.
prepare stmt1 from 'select json_remove( ''[ 1, { "a": true, "b": false, "c": null }, 5 ]'', ''$.'' ) is null';
ERROR 42000: Invalid JSON path expression. The error is around character position 2.
#
# Bug#20972793 ASSERT FIELD_TYPE() == MYSQL_TYPE_JSON...
#              IN ARG_COMPARATOR::COMPARE_JSON
#
CREATE TABLE t1 (
pk INT NOT NULL,
col_int_key INT,
col_int INT,
col_json JSON,
PRIMARY KEY (pk),
KEY col_int_key (col_int_key)
) ENGINE=InnoDB;
INSERT INTO t1 VALUES (2,4,2,NULL);
CREATE TABLE t2 (
pk INT NOT NULL,
col_int_key INT,
PRIMARY KEY (pk),
KEY col_int_key (col_int_key)
) ENGINE=InnoDB;
SELECT
(SELECT MAX(sq1_alias1.pk) AS sq1_field1
FROM (t1 AS sq1_alias1
INNER JOIN t2 AS sq1_alias2
ON (sq1_alias2.col_int_key = sq1_alias1.col_int_key)
)
WHERE sq1_alias2.pk <= alias1.col_int
) AS field1,
MAX(alias1.col_json) AS field2
FROM (
SELECT sq2_alias1.*
FROM t1 AS sq2_alias1
) AS alias1
GROUP BY field1
HAVING field2 > 1;
field1	field2
DROP TABLE t1, t2;
# ----------------------------------------------------------------------
# Bug#20987329 VALUE OF PREPARED STATEMENT PLACEHOLDER FOR PARAMETER
#              IN JSON_EXTRACT IS STICKY
#----------------------------------------------------------------------
CREATE TABLE t_reuse (pk INT, col_json JSON);
INSERT INTO t_reuse VALUES (1, '{"keyA": 1}'), (2, '{"keyA": 2, "keyB": 22}');
PREPARE getjson FROM 'SELECT JSON_EXTRACT(col_json, ?) FROM t_reuse';
SET @mypath = '$.keyA';
EXECUTE getjson USING @mypath;
JSON_EXTRACT(col_json, ?)
1
2
SET @mypath = '$.keyB';
EXECUTE getjson USING @mypath;
JSON_EXTRACT(col_json, ?)
NULL
22
prepare json_stmt1 FROM 'select json_contains( ''{ "keyA": [1, 2, 3], "keyB": [4, 5, 6] }'', ''[2]'', ? )';
set @mypath = '$.keyA';
execute json_stmt1 USING @mypath;
json_contains( '{ "keyA": [1, 2, 3], "keyB": [4, 5, 6] }', '[2]', ? )
1
set @mypath = '$.keyB';
execute json_stmt1 USING @mypath;
json_contains( '{ "keyA": [1, 2, 3], "keyB": [4, 5, 6] }', '[2]', ? )
0
prepare json_stmt2 FROM 'select json_contains_path( ''{ "keyA": [1, 2, 3] }'', ''all'', ? )';
set @mypath = '$.keyA';
execute json_stmt2 USING @mypath;
json_contains_path( '{ "keyA": [1, 2, 3] }', 'all', ? )
1
set @mypath = '$.keyB';
execute json_stmt2 USING @mypath;
json_contains_path( '{ "keyA": [1, 2, 3] }', 'all', ? )
0
prepare json_stmt3 FROM 'select json_length( ''{ "keyA": [1, 2, 3], "keyB": [1, 2, 3, 4] }'', ? )';
set @mypath = '$.keyA';
execute json_stmt3 USING @mypath;
json_length( '{ "keyA": [1, 2, 3], "keyB": [1, 2, 3, 4] }', ? )
3
set @mypath = '$.keyB';
execute json_stmt3 USING @mypath;
json_length( '{ "keyA": [1, 2, 3], "keyB": [1, 2, 3, 4] }', ? )
4
prepare json_stmt4 FROM 'select json_keys( ''[ { "keyA": true }, { "keyB": false } ]'', ? )';
set @mypath = '$[0]';
execute json_stmt4 USING @mypath;
json_keys( '[ { "keyA": true }, { "keyB": false } ]', ? )
["keyA"]
set @mypath = '$[1]';
execute json_stmt4 USING @mypath;
json_keys( '[ { "keyA": true }, { "keyB": false } ]', ? )
["keyB"]
prepare json_stmt5 FROM 'select json_array_append( ''{ "keyA": [1, 2], "keyB": [3, 4] }'', ?, 5 )';
set @mypath = '$.keyA';
execute json_stmt5 USING @mypath;
json_array_append( '{ "keyA": [1, 2], "keyB": [3, 4] }', ?, 5 )
{"keyA": [1, 2, 5], "keyB": [3, 4]}
set @mypath = '$.keyB';
execute json_stmt5 USING @mypath;
json_array_append( '{ "keyA": [1, 2], "keyB": [3, 4] }', ?, 5 )
{"keyA": [1, 2], "keyB": [3, 4, 5]}
prepare json_stmt6 FROM 'select json_insert( ''{ "keyA": [1, 2], "keyB": [3, 4] }'', ?, 5 )';
set @mypath = '$.keyA[2]';
execute json_stmt6 USING @mypath;
json_insert( '{ "keyA": [1, 2], "keyB": [3, 4] }', ?, 5 )
{"keyA": [1, 2, 5], "keyB": [3, 4]}
set @mypath = '$.keyB[2]';
execute json_stmt6 USING @mypath;
json_insert( '{ "keyA": [1, 2], "keyB": [3, 4] }', ?, 5 )
{"keyA": [1, 2], "keyB": [3, 4, 5]}
prepare json_stmt7 FROM 'select json_set( ''{ "keyA": [1, 2], "keyB": [3, 4] }'', ?, 5 )';
set @mypath = '$.keyA[2]';
execute json_stmt7 USING @mypath;
json_set( '{ "keyA": [1, 2], "keyB": [3, 4] }', ?, 5 )
{"keyA": [1, 2, 5], "keyB": [3, 4]}
set @mypath = '$.keyB[2]';
execute json_stmt7 USING @mypath;
json_set( '{ "keyA": [1, 2], "keyB": [3, 4] }', ?, 5 )
{"keyA": [1, 2], "keyB": [3, 4, 5]}
prepare json_stmt8 FROM 'select json_replace( ''{ "keyA": [1, 2], "keyB": [3, 4] }'', ?, 5 )';
set @mypath = '$.keyA[1]';
execute json_stmt8 USING @mypath;
json_replace( '{ "keyA": [1, 2], "keyB": [3, 4] }', ?, 5 )
{"keyA": [1, 5], "keyB": [3, 4]}
set @mypath = '$.keyB[1]';
execute json_stmt8 USING @mypath;
json_replace( '{ "keyA": [1, 2], "keyB": [3, 4] }', ?, 5 )
{"keyA": [1, 2], "keyB": [3, 5]}
prepare json_stmt9 FROM 'select json_search( ''{ "keyA": [ "foot" ], "keyB": [ "food" ] }'', ''all'', ''foo%'', null, ? )';
set @mypath = '$.keyA';
execute json_stmt9 USING @mypath;
json_search( '{ "keyA": [ "foot" ], "keyB": [ "food" ] }', 'all', 'foo%', null, ? )
"$.keyA[0]"
set @mypath = '$.keyB';
execute json_stmt9 USING @mypath;
json_search( '{ "keyA": [ "foot" ], "keyB": [ "food" ] }', 'all', 'foo%', null, ? )
"$.keyB[0]"
prepare json_stmt10 FROM 'select json_remove( ''{ "keyA": [ "foot" ], "keyB": [ "food" ] }'', ? )';
set @mypath = '$.keyA';
execute json_stmt10 USING @mypath;
json_remove( '{ "keyA": [ "foot" ], "keyB": [ "food" ] }', ? )
{"keyB": ["food"]}
set @mypath = '$.keyB';
execute json_stmt10 USING @mypath;
json_remove( '{ "keyA": [ "foot" ], "keyB": [ "food" ] }', ? )
{"keyA": ["foot"]}
prepare json_stmt11 FROM 'select json_contains_path( ''{ "keyA": true }'', ?, ''$.keyA'', ''$.keyB'' )';
set @mypath = 'one';
execute json_stmt11 USING @mypath;
json_contains_path( '{ "keyA": true }', ?, '$.keyA', '$.keyB' )
1
set @mypath = 'all';
execute json_stmt11 USING @mypath;
json_contains_path( '{ "keyA": true }', ?, '$.keyA', '$.keyB' )
0
prepare json_stmt12 FROM 'select json_search( ''{ "keyA": [ "foot" ], "keyB": [ "food" ] }'', ?, ''foo%'' )';
set @mypath = 'one';
execute json_stmt12 USING @mypath;
json_search( '{ "keyA": [ "foot" ], "keyB": [ "food" ] }', ?, 'foo%' )
"$.keyA[0]"
set @mypath = 'all';
execute json_stmt12 USING @mypath;
json_search( '{ "keyA": [ "foot" ], "keyB": [ "food" ] }', ?, 'foo%' )
["$.keyA[0]", "$.keyB[0]"]
drop table t_reuse;
#
# Test that max_allowed_packet is respected.
#
SET GLOBAL net_buffer_length = 1024;
SET GLOBAL max_allowed_packet = 1024;
CREATE TABLE t1(j JSON);
INSERT INTO t1 VALUES (JSON_ARRAY(REPEAT('abc', 100)));
SELECT JSON_ARRAY(j, j, j, j) FROM t1;
JSON_ARRAY(j, j, j, j)
NULL
Warnings:
Warning	1301	Result of json_array() was larger than max_allowed_packet (1024) - truncated
UPDATE t1 SET j = JSON_ARRAY(j, j, j, j);
ERROR HY000: Result of json_binary::serialize() was larger than max_allowed_packet (1024) - truncated
CREATE TABLE t2(s TEXT);
INSERT INTO t2 SELECT JSON_ARRAY(j, j, j, j) FROM t1;
ERROR HY000: Result of json_array() was larger than max_allowed_packet (1024) - truncated
SELECT * FROM t2;
s
INSERT INTO t2 SELECT * FROM t1;
UPDATE t2 SET s = JSON_ARRAY(s, s, s, s);
ERROR HY000: Result of json_array() was larger than max_allowed_packet (1024) - truncated
DROP TABLE t1, t2;
SET GLOBAL max_allowed_packet = default;
SET GLOBAL net_buffer_length = default;
#
# Test that very deep documents are rejected.
#
CREATE TABLE t(jarray JSON, jobject JSON, jmix JSON) ROW_FORMAT=DYNAMIC;
INSERT INTO t VALUES ('1', '1', '1');
UPDATE t SET jarray  = JSON_ARRAY(jarray),
jobject = JSON_OBJECT('a', jobject),
jmix    = CASE WHEN MOD(1, 2) = 0
THEN JSON_ARRAY(jmix)
ELSE JSON_OBJECT('a', jmix)
END;
UPDATE t SET jarray  = JSON_ARRAY(jarray),
jobject = JSON_OBJECT('a', jobject),
jmix    = CASE WHEN MOD(2, 2) = 0
THEN JSON_ARRAY(jmix)
ELSE JSON_OBJECT('a', jmix)
END;
UPDATE t SET jarray  = JSON_ARRAY(jarray),
jobject = JSON_OBJECT('a', jobject),
jmix    = CASE WHEN MOD(3, 2) = 0
THEN JSON_ARRAY(jmix)
ELSE JSON_OBJECT('a', jmix)
END;
UPDATE t SET jarray  = JSON_ARRAY(jarray),
jobject = JSON_OBJECT('a', jobject),
jmix    = CASE WHEN MOD(4, 2) = 0
THEN JSON_ARRAY(jmix)
ELSE JSON_OBJECT('a', jmix)
END;
UPDATE t SET jarray  = JSON_ARRAY(jarray),
jobject = JSON_OBJECT('a', jobject),
jmix    = CASE WHEN MOD(5, 2) = 0
THEN JSON_ARRAY(jmix)
ELSE JSON_OBJECT('a', jmix)
END;
UPDATE t SET jarray  = JSON_ARRAY(jarray),
jobject = JSON_OBJECT('a', jobject),
jmix    = CASE WHEN MOD(6, 2) = 0
THEN JSON_ARRAY(jmix)
ELSE JSON_OBJECT('a', jmix)
END;
UPDATE t SET jarray  = JSON_ARRAY(jarray),
jobject = JSON_OBJECT('a', jobject),
jmix    = CASE WHEN MOD(7, 2) = 0
THEN JSON_ARRAY(jmix)
ELSE JSON_OBJECT('a', jmix)
END;
UPDATE t SET jarray  = JSON_ARRAY(jarray),
jobject = JSON_OBJECT('a', jobject),
jmix    = CASE WHEN MOD(8, 2) = 0
THEN JSON_ARRAY(jmix)
ELSE JSON_OBJECT('a', jmix)
END;
UPDATE t SET jarray  = JSON_ARRAY(jarray),
jobject = JSON_OBJECT('a', jobject),
jmix    = CASE WHEN MOD(9, 2) = 0
THEN JSON_ARRAY(jmix)
ELSE JSON_OBJECT('a', jmix)
END;
UPDATE t SET jarray  = JSON_ARRAY(jarray),
jobject = JSON_OBJECT('a', jobject),
jmix    = CASE WHEN MOD(10, 2) = 0
THEN JSON_ARRAY(jmix)
ELSE JSON_OBJECT('a', jmix)
END;
UPDATE t SET jarray  = JSON_ARRAY(jarray),
jobject = JSON_OBJECT('a', jobject),
jmix    = CASE WHEN MOD(11, 2) = 0
THEN JSON_ARRAY(jmix)
ELSE JSON_OBJECT('a', jmix)
END;
UPDATE t SET jarray  = JSON_ARRAY(jarray),
jobject = JSON_OBJECT('a', jobject),
jmix    = CASE WHEN MOD(12, 2) = 0
THEN JSON_ARRAY(jmix)
ELSE JSON_OBJECT('a', jmix)
END;
UPDATE t SET jarray  = JSON_ARRAY(jarray),
jobject = JSON_OBJECT('a', jobject),
jmix    = CASE WHEN MOD(13, 2) = 0
THEN JSON_ARRAY(jmix)
ELSE JSON_OBJECT('a', jmix)
END;
UPDATE t SET jarray  = JSON_ARRAY(jarray),
jobject = JSON_OBJECT('a', jobject),
jmix    = CASE WHEN MOD(14, 2) = 0
THEN JSON_ARRAY(jmix)
ELSE JSON_OBJECT('a', jmix)
END;
UPDATE t SET jarray  = JSON_ARRAY(jarray),
jobject = JSON_OBJECT('a', jobject),
jmix    = CASE WHEN MOD(15, 2) = 0
THEN JSON_ARRAY(jmix)
ELSE JSON_OBJECT('a', jmix)
END;
UPDATE t SET jarray  = JSON_ARRAY(jarray),
jobject = JSON_OBJECT('a', jobject),
jmix    = CASE WHEN MOD(16, 2) = 0
THEN JSON_ARRAY(jmix)
ELSE JSON_OBJECT('a', jmix)
END;
UPDATE t SET jarray  = JSON_ARRAY(jarray),
jobject = JSON_OBJECT('a', jobject),
jmix    = CASE WHEN MOD(17, 2) = 0
THEN JSON_ARRAY(jmix)
ELSE JSON_OBJECT('a', jmix)
END;
UPDATE t SET jarray  = JSON_ARRAY(jarray),
jobject = JSON_OBJECT('a', jobject),
jmix    = CASE WHEN MOD(18, 2) = 0
THEN JSON_ARRAY(jmix)
ELSE JSON_OBJECT('a', jmix)
END;
UPDATE t SET jarray  = JSON_ARRAY(jarray),
jobject = JSON_OBJECT('a', jobject),
jmix    = CASE WHEN MOD(19, 2) = 0
THEN JSON_ARRAY(jmix)
ELSE JSON_OBJECT('a', jmix)
END;
UPDATE t SET jarray  = JSON_ARRAY(jarray),
jobject = JSON_OBJECT('a', jobject),
jmix    = CASE WHEN MOD(20, 2) = 0
THEN JSON_ARRAY(jmix)
ELSE JSON_OBJECT('a', jmix)
END;
UPDATE t SET jarray  = JSON_ARRAY(jarray),
jobject = JSON_OBJECT('a', jobject),
jmix    = CASE WHEN MOD(21, 2) = 0
THEN JSON_ARRAY(jmix)
ELSE JSON_OBJECT('a', jmix)
END;
UPDATE t SET jarray  = JSON_ARRAY(jarray),
jobject = JSON_OBJECT('a', jobject),
jmix    = CASE WHEN MOD(22, 2) = 0
THEN JSON_ARRAY(jmix)
ELSE JSON_OBJECT('a', jmix)
END;
UPDATE t SET jarray  = JSON_ARRAY(jarray),
jobject = JSON_OBJECT('a', jobject),
jmix    = CASE WHEN MOD(23, 2) = 0
THEN JSON_ARRAY(jmix)
ELSE JSON_OBJECT('a', jmix)
END;
UPDATE t SET jarray  = JSON_ARRAY(jarray),
jobject = JSON_OBJECT('a', jobject),
jmix    = CASE WHEN MOD(24, 2) = 0
THEN JSON_ARRAY(jmix)
ELSE JSON_OBJECT('a', jmix)
END;
UPDATE t SET jarray  = JSON_ARRAY(jarray),
jobject = JSON_OBJECT('a', jobject),
jmix    = CASE WHEN MOD(25, 2) = 0
THEN JSON_ARRAY(jmix)
ELSE JSON_OBJECT('a', jmix)
END;
UPDATE t SET jarray  = JSON_ARRAY(jarray),
jobject = JSON_OBJECT('a', jobject),
jmix    = CASE WHEN MOD(26, 2) = 0
THEN JSON_ARRAY(jmix)
ELSE JSON_OBJECT('a', jmix)
END;
UPDATE t SET jarray  = JSON_ARRAY(jarray),
jobject = JSON_OBJECT('a', jobject),
jmix    = CASE WHEN MOD(27, 2) = 0
THEN JSON_ARRAY(jmix)
ELSE JSON_OBJECT('a', jmix)
END;
UPDATE t SET jarray  = JSON_ARRAY(jarray),
jobject = JSON_OBJECT('a', jobject),
jmix    = CASE WHEN MOD(28, 2) = 0
THEN JSON_ARRAY(jmix)
ELSE JSON_OBJECT('a', jmix)
END;
UPDATE t SET jarray  = JSON_ARRAY(jarray),
jobject = JSON_OBJECT('a', jobject),
jmix    = CASE WHEN MOD(29, 2) = 0
THEN JSON_ARRAY(jmix)
ELSE JSON_OBJECT('a', jmix)
END;
UPDATE t SET jarray  = JSON_ARRAY(jarray),
jobject = JSON_OBJECT('a', jobject),
jmix    = CASE WHEN MOD(30, 2) = 0
THEN JSON_ARRAY(jmix)
ELSE JSON_OBJECT('a', jmix)
END;
UPDATE t SET jarray  = JSON_ARRAY(jarray),
jobject = JSON_OBJECT('a', jobject),
jmix    = CASE WHEN MOD(31, 2) = 0
THEN JSON_ARRAY(jmix)
ELSE JSON_OBJECT('a', jmix)
END;
UPDATE t SET jarray  = JSON_ARRAY(jarray),
jobject = JSON_OBJECT('a', jobject),
jmix    = CASE WHEN MOD(32, 2) = 0
THEN JSON_ARRAY(jmix)
ELSE JSON_OBJECT('a', jmix)
END;
UPDATE t SET jarray  = JSON_ARRAY(jarray),
jobject = JSON_OBJECT('a', jobject),
jmix    = CASE WHEN MOD(33, 2) = 0
THEN JSON_ARRAY(jmix)
ELSE JSON_OBJECT('a', jmix)
END;
UPDATE t SET jarray  = JSON_ARRAY(jarray),
jobject = JSON_OBJECT('a', jobject),
jmix    = CASE WHEN MOD(34, 2) = 0
THEN JSON_ARRAY(jmix)
ELSE JSON_OBJECT('a', jmix)
END;
UPDATE t SET jarray  = JSON_ARRAY(jarray),
jobject = JSON_OBJECT('a', jobject),
jmix    = CASE WHEN MOD(35, 2) = 0
THEN JSON_ARRAY(jmix)
ELSE JSON_OBJECT('a', jmix)
END;
UPDATE t SET jarray  = JSON_ARRAY(jarray),
jobject = JSON_OBJECT('a', jobject),
jmix    = CASE WHEN MOD(36, 2) = 0
THEN JSON_ARRAY(jmix)
ELSE JSON_OBJECT('a', jmix)
END;
UPDATE t SET jarray  = JSON_ARRAY(jarray),
jobject = JSON_OBJECT('a', jobject),
jmix    = CASE WHEN MOD(37, 2) = 0
THEN JSON_ARRAY(jmix)
ELSE JSON_OBJECT('a', jmix)
END;
UPDATE t SET jarray  = JSON_ARRAY(jarray),
jobject = JSON_OBJECT('a', jobject),
jmix    = CASE WHEN MOD(38, 2) = 0
THEN JSON_ARRAY(jmix)
ELSE JSON_OBJECT('a', jmix)
END;
UPDATE t SET jarray  = JSON_ARRAY(jarray),
jobject = JSON_OBJECT('a', jobject),
jmix    = CASE WHEN MOD(39, 2) = 0
THEN JSON_ARRAY(jmix)
ELSE JSON_OBJECT('a', jmix)
END;
UPDATE t SET jarray  = JSON_ARRAY(jarray),
jobject = JSON_OBJECT('a', jobject),
jmix    = CASE WHEN MOD(40, 2) = 0
THEN JSON_ARRAY(jmix)
ELSE JSON_OBJECT('a', jmix)
END;
UPDATE t SET jarray  = JSON_ARRAY(jarray),
jobject = JSON_OBJECT('a', jobject),
jmix    = CASE WHEN MOD(41, 2) = 0
THEN JSON_ARRAY(jmix)
ELSE JSON_OBJECT('a', jmix)
END;
UPDATE t SET jarray  = JSON_ARRAY(jarray),
jobject = JSON_OBJECT('a', jobject),
jmix    = CASE WHEN MOD(42, 2) = 0
THEN JSON_ARRAY(jmix)
ELSE JSON_OBJECT('a', jmix)
END;
UPDATE t SET jarray  = JSON_ARRAY(jarray),
jobject = JSON_OBJECT('a', jobject),
jmix    = CASE WHEN MOD(43, 2) = 0
THEN JSON_ARRAY(jmix)
ELSE JSON_OBJECT('a', jmix)
END;
UPDATE t SET jarray  = JSON_ARRAY(jarray),
jobject = JSON_OBJECT('a', jobject),
jmix    = CASE WHEN MOD(44, 2) = 0
THEN JSON_ARRAY(jmix)
ELSE JSON_OBJECT('a', jmix)
END;
UPDATE t SET jarray  = JSON_ARRAY(jarray),
jobject = JSON_OBJECT('a', jobject),
jmix    = CASE WHEN MOD(45, 2) = 0
THEN JSON_ARRAY(jmix)
ELSE JSON_OBJECT('a', jmix)
END;
UPDATE t SET jarray  = JSON_ARRAY(jarray),
jobject = JSON_OBJECT('a', jobject),
jmix    = CASE WHEN MOD(46, 2) = 0
THEN JSON_ARRAY(jmix)
ELSE JSON_OBJECT('a', jmix)
END;
UPDATE t SET jarray  = JSON_ARRAY(jarray),
jobject = JSON_OBJECT('a', jobject),
jmix    = CASE WHEN MOD(47, 2) = 0
THEN JSON_ARRAY(jmix)
ELSE JSON_OBJECT('a', jmix)
END;
UPDATE t SET jarray  = JSON_ARRAY(jarray),
jobject = JSON_OBJECT('a', jobject),
jmix    = CASE WHEN MOD(48, 2) = 0
THEN JSON_ARRAY(jmix)
ELSE JSON_OBJECT('a', jmix)
END;
UPDATE t SET jarray  = JSON_ARRAY(jarray),
jobject = JSON_OBJECT('a', jobject),
jmix    = CASE WHEN MOD(49, 2) = 0
THEN JSON_ARRAY(jmix)
ELSE JSON_OBJECT('a', jmix)
END;
UPDATE t SET jarray  = JSON_ARRAY(jarray),
jobject = JSON_OBJECT('a', jobject),
jmix    = CASE WHEN MOD(50, 2) = 0
THEN JSON_ARRAY(jmix)
ELSE JSON_OBJECT('a', jmix)
END;
UPDATE t SET jarray  = JSON_ARRAY(jarray),
jobject = JSON_OBJECT('a', jobject),
jmix    = CASE WHEN MOD(51, 2) = 0
THEN JSON_ARRAY(jmix)
ELSE JSON_OBJECT('a', jmix)
END;
UPDATE t SET jarray  = JSON_ARRAY(jarray),
jobject = JSON_OBJECT('a', jobject),
jmix    = CASE WHEN MOD(52, 2) = 0
THEN JSON_ARRAY(jmix)
ELSE JSON_OBJECT('a', jmix)
END;
UPDATE t SET jarray  = JSON_ARRAY(jarray),
jobject = JSON_OBJECT('a', jobject),
jmix    = CASE WHEN MOD(53, 2) = 0
THEN JSON_ARRAY(jmix)
ELSE JSON_OBJECT('a', jmix)
END;
UPDATE t SET jarray  = JSON_ARRAY(jarray),
jobject = JSON_OBJECT('a', jobject),
jmix    = CASE WHEN MOD(54, 2) = 0
THEN JSON_ARRAY(jmix)
ELSE JSON_OBJECT('a', jmix)
END;
UPDATE t SET jarray  = JSON_ARRAY(jarray),
jobject = JSON_OBJECT('a', jobject),
jmix    = CASE WHEN MOD(55, 2) = 0
THEN JSON_ARRAY(jmix)
ELSE JSON_OBJECT('a', jmix)
END;
UPDATE t SET jarray  = JSON_ARRAY(jarray),
jobject = JSON_OBJECT('a', jobject),
jmix    = CASE WHEN MOD(56, 2) = 0
THEN JSON_ARRAY(jmix)
ELSE JSON_OBJECT('a', jmix)
END;
UPDATE t SET jarray  = JSON_ARRAY(jarray),
jobject = JSON_OBJECT('a', jobject),
jmix    = CASE WHEN MOD(57, 2) = 0
THEN JSON_ARRAY(jmix)
ELSE JSON_OBJECT('a', jmix)
END;
UPDATE t SET jarray  = JSON_ARRAY(jarray),
jobject = JSON_OBJECT('a', jobject),
jmix    = CASE WHEN MOD(58, 2) = 0
THEN JSON_ARRAY(jmix)
ELSE JSON_OBJECT('a', jmix)
END;
UPDATE t SET jarray  = JSON_ARRAY(jarray),
jobject = JSON_OBJECT('a', jobject),
jmix    = CASE WHEN MOD(59, 2) = 0
THEN JSON_ARRAY(jmix)
ELSE JSON_OBJECT('a', jmix)
END;
UPDATE t SET jarray  = JSON_ARRAY(jarray),
jobject = JSON_OBJECT('a', jobject),
jmix    = CASE WHEN MOD(60, 2) = 0
THEN JSON_ARRAY(jmix)
ELSE JSON_OBJECT('a', jmix)
END;
UPDATE t SET jarray  = JSON_ARRAY(jarray),
jobject = JSON_OBJECT('a', jobject),
jmix    = CASE WHEN MOD(61, 2) = 0
THEN JSON_ARRAY(jmix)
ELSE JSON_OBJECT('a', jmix)
END;
UPDATE t SET jarray  = JSON_ARRAY(jarray),
jobject = JSON_OBJECT('a', jobject),
jmix    = CASE WHEN MOD(62, 2) = 0
THEN JSON_ARRAY(jmix)
ELSE JSON_OBJECT('a', jmix)
END;
UPDATE t SET jarray  = JSON_ARRAY(jarray),
jobject = JSON_OBJECT('a', jobject),
jmix    = CASE WHEN MOD(63, 2) = 0
THEN JSON_ARRAY(jmix)
ELSE JSON_OBJECT('a', jmix)
END;
UPDATE t SET jarray  = JSON_ARRAY(jarray),
jobject = JSON_OBJECT('a', jobject),
jmix    = CASE WHEN MOD(64, 2) = 0
THEN JSON_ARRAY(jmix)
ELSE JSON_OBJECT('a', jmix)
END;
UPDATE t SET jarray  = JSON_ARRAY(jarray),
jobject = JSON_OBJECT('a', jobject),
jmix    = CASE WHEN MOD(65, 2) = 0
THEN JSON_ARRAY(jmix)
ELSE JSON_OBJECT('a', jmix)
END;
UPDATE t SET jarray  = JSON_ARRAY(jarray),
jobject = JSON_OBJECT('a', jobject),
jmix    = CASE WHEN MOD(66, 2) = 0
THEN JSON_ARRAY(jmix)
ELSE JSON_OBJECT('a', jmix)
END;
UPDATE t SET jarray  = JSON_ARRAY(jarray),
jobject = JSON_OBJECT('a', jobject),
jmix    = CASE WHEN MOD(67, 2) = 0
THEN JSON_ARRAY(jmix)
ELSE JSON_OBJECT('a', jmix)
END;
UPDATE t SET jarray  = JSON_ARRAY(jarray),
jobject = JSON_OBJECT('a', jobject),
jmix    = CASE WHEN MOD(68, 2) = 0
THEN JSON_ARRAY(jmix)
ELSE JSON_OBJECT('a', jmix)
END;
UPDATE t SET jarray  = JSON_ARRAY(jarray),
jobject = JSON_OBJECT('a', jobject),
jmix    = CASE WHEN MOD(69, 2) = 0
THEN JSON_ARRAY(jmix)
ELSE JSON_OBJECT('a', jmix)
END;
UPDATE t SET jarray  = JSON_ARRAY(jarray),
jobject = JSON_OBJECT('a', jobject),
jmix    = CASE WHEN MOD(70, 2) = 0
THEN JSON_ARRAY(jmix)
ELSE JSON_OBJECT('a', jmix)
END;
UPDATE t SET jarray  = JSON_ARRAY(jarray),
jobject = JSON_OBJECT('a', jobject),
jmix    = CASE WHEN MOD(71, 2) = 0
THEN JSON_ARRAY(jmix)
ELSE JSON_OBJECT('a', jmix)
END;
UPDATE t SET jarray  = JSON_ARRAY(jarray),
jobject = JSON_OBJECT('a', jobject),
jmix    = CASE WHEN MOD(72, 2) = 0
THEN JSON_ARRAY(jmix)
ELSE JSON_OBJECT('a', jmix)
END;
UPDATE t SET jarray  = JSON_ARRAY(jarray),
jobject = JSON_OBJECT('a', jobject),
jmix    = CASE WHEN MOD(73, 2) = 0
THEN JSON_ARRAY(jmix)
ELSE JSON_OBJECT('a', jmix)
END;
UPDATE t SET jarray  = JSON_ARRAY(jarray),
jobject = JSON_OBJECT('a', jobject),
jmix    = CASE WHEN MOD(74, 2) = 0
THEN JSON_ARRAY(jmix)
ELSE JSON_OBJECT('a', jmix)
END;
UPDATE t SET jarray  = JSON_ARRAY(jarray),
jobject = JSON_OBJECT('a', jobject),
jmix    = CASE WHEN MOD(75, 2) = 0
THEN JSON_ARRAY(jmix)
ELSE JSON_OBJECT('a', jmix)
END;
UPDATE t SET jarray  = JSON_ARRAY(jarray),
jobject = JSON_OBJECT('a', jobject),
jmix    = CASE WHEN MOD(76, 2) = 0
THEN JSON_ARRAY(jmix)
ELSE JSON_OBJECT('a', jmix)
END;
UPDATE t SET jarray  = JSON_ARRAY(jarray),
jobject = JSON_OBJECT('a', jobject),
jmix    = CASE WHEN MOD(77, 2) = 0
THEN JSON_ARRAY(jmix)
ELSE JSON_OBJECT('a', jmix)
END;
UPDATE t SET jarray  = JSON_ARRAY(jarray),
jobject = JSON_OBJECT('a', jobject),
jmix    = CASE WHEN MOD(78, 2) = 0
THEN JSON_ARRAY(jmix)
ELSE JSON_OBJECT('a', jmix)
END;
UPDATE t SET jarray  = JSON_ARRAY(jarray),
jobject = JSON_OBJECT('a', jobject),
jmix    = CASE WHEN MOD(79, 2) = 0
THEN JSON_ARRAY(jmix)
ELSE JSON_OBJECT('a', jmix)
END;
UPDATE t SET jarray  = JSON_ARRAY(jarray),
jobject = JSON_OBJECT('a', jobject),
jmix    = CASE WHEN MOD(80, 2) = 0
THEN JSON_ARRAY(jmix)
ELSE JSON_OBJECT('a', jmix)
END;
UPDATE t SET jarray  = JSON_ARRAY(jarray),
jobject = JSON_OBJECT('a', jobject),
jmix    = CASE WHEN MOD(81, 2) = 0
THEN JSON_ARRAY(jmix)
ELSE JSON_OBJECT('a', jmix)
END;
UPDATE t SET jarray  = JSON_ARRAY(jarray),
jobject = JSON_OBJECT('a', jobject),
jmix    = CASE WHEN MOD(82, 2) = 0
THEN JSON_ARRAY(jmix)
ELSE JSON_OBJECT('a', jmix)
END;
UPDATE t SET jarray  = JSON_ARRAY(jarray),
jobject = JSON_OBJECT('a', jobject),
jmix    = CASE WHEN MOD(83, 2) = 0
THEN JSON_ARRAY(jmix)
ELSE JSON_OBJECT('a', jmix)
END;
UPDATE t SET jarray  = JSON_ARRAY(jarray),
jobject = JSON_OBJECT('a', jobject),
jmix    = CASE WHEN MOD(84, 2) = 0
THEN JSON_ARRAY(jmix)
ELSE JSON_OBJECT('a', jmix)
END;
UPDATE t SET jarray  = JSON_ARRAY(jarray),
jobject = JSON_OBJECT('a', jobject),
jmix    = CASE WHEN MOD(85, 2) = 0
THEN JSON_ARRAY(jmix)
ELSE JSON_OBJECT('a', jmix)
END;
UPDATE t SET jarray  = JSON_ARRAY(jarray),
jobject = JSON_OBJECT('a', jobject),
jmix    = CASE WHEN MOD(86, 2) = 0
THEN JSON_ARRAY(jmix)
ELSE JSON_OBJECT('a', jmix)
END;
UPDATE t SET jarray  = JSON_ARRAY(jarray),
jobject = JSON_OBJECT('a', jobject),
jmix    = CASE WHEN MOD(87, 2) = 0
THEN JSON_ARRAY(jmix)
ELSE JSON_OBJECT('a', jmix)
END;
UPDATE t SET jarray  = JSON_ARRAY(jarray),
jobject = JSON_OBJECT('a', jobject),
jmix    = CASE WHEN MOD(88, 2) = 0
THEN JSON_ARRAY(jmix)
ELSE JSON_OBJECT('a', jmix)
END;
UPDATE t SET jarray  = JSON_ARRAY(jarray),
jobject = JSON_OBJECT('a', jobject),
jmix    = CASE WHEN MOD(89, 2) = 0
THEN JSON_ARRAY(jmix)
ELSE JSON_OBJECT('a', jmix)
END;
UPDATE t SET jarray  = JSON_ARRAY(jarray),
jobject = JSON_OBJECT('a', jobject),
jmix    = CASE WHEN MOD(90, 2) = 0
THEN JSON_ARRAY(jmix)
ELSE JSON_OBJECT('a', jmix)
END;
UPDATE t SET jarray  = JSON_ARRAY(jarray),
jobject = JSON_OBJECT('a', jobject),
jmix    = CASE WHEN MOD(91, 2) = 0
THEN JSON_ARRAY(jmix)
ELSE JSON_OBJECT('a', jmix)
END;
UPDATE t SET jarray  = JSON_ARRAY(jarray),
jobject = JSON_OBJECT('a', jobject),
jmix    = CASE WHEN MOD(92, 2) = 0
THEN JSON_ARRAY(jmix)
ELSE JSON_OBJECT('a', jmix)
END;
UPDATE t SET jarray  = JSON_ARRAY(jarray),
jobject = JSON_OBJECT('a', jobject),
jmix    = CASE WHEN MOD(93, 2) = 0
THEN JSON_ARRAY(jmix)
ELSE JSON_OBJECT('a', jmix)
END;
UPDATE t SET jarray  = JSON_ARRAY(jarray),
jobject = JSON_OBJECT('a', jobject),
jmix    = CASE WHEN MOD(94, 2) = 0
THEN JSON_ARRAY(jmix)
ELSE JSON_OBJECT('a', jmix)
END;
UPDATE t SET jarray  = JSON_ARRAY(jarray),
jobject = JSON_OBJECT('a', jobject),
jmix    = CASE WHEN MOD(95, 2) = 0
THEN JSON_ARRAY(jmix)
ELSE JSON_OBJECT('a', jmix)
END;
UPDATE t SET jarray  = JSON_ARRAY(jarray),
jobject = JSON_OBJECT('a', jobject),
jmix    = CASE WHEN MOD(96, 2) = 0
THEN JSON_ARRAY(jmix)
ELSE JSON_OBJECT('a', jmix)
END;
UPDATE t SET jarray  = JSON_ARRAY(jarray),
jobject = JSON_OBJECT('a', jobject),
jmix    = CASE WHEN MOD(97, 2) = 0
THEN JSON_ARRAY(jmix)
ELSE JSON_OBJECT('a', jmix)
END;
UPDATE t SET jarray  = JSON_ARRAY(jarray),
jobject = JSON_OBJECT('a', jobject),
jmix    = CASE WHEN MOD(98, 2) = 0
THEN JSON_ARRAY(jmix)
ELSE JSON_OBJECT('a', jmix)
END;
UPDATE t SET jarray  = JSON_ARRAY(jarray),
jobject = JSON_OBJECT('a', jobject),
jmix    = CASE WHEN MOD(99, 2) = 0
THEN JSON_ARRAY(jmix)
ELSE JSON_OBJECT('a', jmix)
END;
SELECT JSON_DEPTH(jarray), JSON_DEPTH(jobject), JSON_DEPTH(jmix) FROM t;
JSON_DEPTH(jarray)	JSON_DEPTH(jobject)	JSON_DEPTH(jmix)
100	100	100
SELECT JSON_DEPTH(CAST(jarray AS CHAR)),
JSON_DEPTH(CAST(jobject AS CHAR)),
JSON_DEPTH(CAST(jmix AS CHAR)) FROM t;
JSON_DEPTH(CAST(jarray AS CHAR))	JSON_DEPTH(CAST(jobject AS CHAR))	JSON_DEPTH(CAST(jmix AS CHAR))
100	100	100
SELECT JSON_VALID(jarray), JSON_VALID(jobject), JSON_VALID(jmix) FROM t;
JSON_VALID(jarray)	JSON_VALID(jobject)	JSON_VALID(jmix)
1	1	1
SELECT JSON_VALID(CAST(jarray AS CHAR)),
JSON_VALID(CAST(jobject AS CHAR)),
JSON_VALID(CAST(jmix AS CHAR)) FROM t;
JSON_VALID(CAST(jarray AS CHAR))	JSON_VALID(CAST(jobject AS CHAR))	JSON_VALID(CAST(jmix AS CHAR))
1	1	1
INSERT INTO t(jarray) SELECT JSON_ARRAY(jarray) FROM t;
ERROR 22032: The JSON document exceeds the maximum depth.
INSERT INTO t(jobject) SELECT JSON_OBJECT('a', jobject) FROM t;
ERROR 22032: The JSON document exceeds the maximum depth.
INSERT INTO t(jmix) SELECT JSON_ARRAY(jmix) FROM t;
ERROR 22032: The JSON document exceeds the maximum depth.
INSERT INTO t(jmix) SELECT JSON_OBJECT('a', jmix) FROM t;
ERROR 22032: The JSON document exceeds the maximum depth.
CREATE TABLE too_deep_docs(id INT PRIMARY KEY AUTO_INCREMENT, x text);
INSERT INTO too_deep_docs(x) SELECT CONCAT('[', jarray, ']') FROM t;
INSERT INTO too_deep_docs(x) SELECT CONCAT('[', jobject, ']') FROM t;
INSERT INTO too_deep_docs(x) SELECT CONCAT('[', jmix, ']') FROM t;
INSERT INTO too_deep_docs(x) SELECT CONCAT('{"a":', jarray, '}') FROM t;
INSERT INTO too_deep_docs(x) SELECT CONCAT('{"a":', jobject, '}') FROM t;
INSERT INTO too_deep_docs(x) SELECT CONCAT('{"a":', jmix, '}') FROM t;
INSERT INTO too_deep_docs(x) SELECT CONCAT('["abc", [', jarray, ']]') FROM t;
INSERT INTO too_deep_docs(x)
SELECT CONCAT('{"a":2,"b":{"c":', jobject, '}}') FROM t;
SELECT CAST(x AS JSON) FROM too_deep_docs WHERE id=8;
ERROR 22032: The JSON document exceeds the maximum depth.
SELECT JSON_DEPTH(x) FROM too_deep_docs WHERE id=8;
ERROR 22032: The JSON document exceeds the maximum depth.
SELECT JSON_VALID(x) FROM too_deep_docs WHERE id=8;
ERROR 22032: The JSON document exceeds the maximum depth.
INSERT INTO t(jarray) SELECT x FROM too_deep_docs WHERE id=8;
ERROR 22032: The JSON document exceeds the maximum depth.
SELECT CAST(x AS JSON) FROM too_deep_docs WHERE id=7;
ERROR 22032: The JSON document exceeds the maximum depth.
SELECT JSON_DEPTH(x) FROM too_deep_docs WHERE id=7;
ERROR 22032: The JSON document exceeds the maximum depth.
SELECT JSON_VALID(x) FROM too_deep_docs WHERE id=7;
ERROR 22032: The JSON document exceeds the maximum depth.
INSERT INTO t(jarray) SELECT x FROM too_deep_docs WHERE id=7;
ERROR 22032: The JSON document exceeds the maximum depth.
SELECT CAST(x AS JSON) FROM too_deep_docs WHERE id=6;
ERROR 22032: The JSON document exceeds the maximum depth.
SELECT JSON_DEPTH(x) FROM too_deep_docs WHERE id=6;
ERROR 22032: The JSON document exceeds the maximum depth.
SELECT JSON_VALID(x) FROM too_deep_docs WHERE id=6;
ERROR 22032: The JSON document exceeds the maximum depth.
INSERT INTO t(jarray) SELECT x FROM too_deep_docs WHERE id=6;
ERROR 22032: The JSON document exceeds the maximum depth.
SELECT CAST(x AS JSON) FROM too_deep_docs WHERE id=5;
ERROR 22032: The JSON document exceeds the maximum depth.
SELECT JSON_DEPTH(x) FROM too_deep_docs WHERE id=5;
ERROR 22032: The JSON document exceeds the maximum depth.
SELECT JSON_VALID(x) FROM too_deep_docs WHERE id=5;
ERROR 22032: The JSON document exceeds the maximum depth.
INSERT INTO t(jarray) SELECT x FROM too_deep_docs WHERE id=5;
ERROR 22032: The JSON document exceeds the maximum depth.
SELECT CAST(x AS JSON) FROM too_deep_docs WHERE id=4;
ERROR 22032: The JSON document exceeds the maximum depth.
SELECT JSON_DEPTH(x) FROM too_deep_docs WHERE id=4;
ERROR 22032: The JSON document exceeds the maximum depth.
SELECT JSON_VALID(x) FROM too_deep_docs WHERE id=4;
ERROR 22032: The JSON document exceeds the maximum depth.
INSERT INTO t(jarray) SELECT x FROM too_deep_docs WHERE id=4;
ERROR 22032: The JSON document exceeds the maximum depth.
SELECT CAST(x AS JSON) FROM too_deep_docs WHERE id=3;
ERROR 22032: The JSON document exceeds the maximum depth.
SELECT JSON_DEPTH(x) FROM too_deep_docs WHERE id=3;
ERROR 22032: The JSON document exceeds the maximum depth.
SELECT JSON_VALID(x) FROM too_deep_docs WHERE id=3;
ERROR 22032: The JSON document exceeds the maximum depth.
INSERT INTO t(jarray) SELECT x FROM too_deep_docs WHERE id=3;
ERROR 22032: The JSON document exceeds the maximum depth.
SELECT CAST(x AS JSON) FROM too_deep_docs WHERE id=2;
ERROR 22032: The JSON document exceeds the maximum depth.
SELECT JSON_DEPTH(x) FROM too_deep_docs WHERE id=2;
ERROR 22032: The JSON document exceeds the maximum depth.
SELECT JSON_VALID(x) FROM too_deep_docs WHERE id=2;
ERROR 22032: The JSON document exceeds the maximum depth.
INSERT INTO t(jarray) SELECT x FROM too_deep_docs WHERE id=2;
ERROR 22032: The JSON document exceeds the maximum depth.
SELECT CAST(x AS JSON) FROM too_deep_docs WHERE id=1;
ERROR 22032: The JSON document exceeds the maximum depth.
SELECT JSON_DEPTH(x) FROM too_deep_docs WHERE id=1;
ERROR 22032: The JSON document exceeds the maximum depth.
SELECT JSON_VALID(x) FROM too_deep_docs WHERE id=1;
ERROR 22032: The JSON document exceeds the maximum depth.
INSERT INTO t(jarray) SELECT x FROM too_deep_docs WHERE id=1;
ERROR 22032: The JSON document exceeds the maximum depth.
SELECT CAST(JSON_ARRAY(jarray) AS CHAR) FROM t;
ERROR 22032: The JSON document exceeds the maximum depth.
SELECT CAST(JSON_OBJECT('a', jobject) AS CHAR) FROM t;
ERROR 22032: The JSON document exceeds the maximum depth.
SELECT CAST(JSON_ARRAY(jmix) AS CHAR) FROM t;
ERROR 22032: The JSON document exceeds the maximum depth.
SELECT CAST(JSON_OBJECT('a', jmix) AS CHAR) FROM t;
ERROR 22032: The JSON document exceeds the maximum depth.
DROP TABLE t, too_deep_docs;
#
# Bug#21054252 QUERY HAVING SQL_BIG_RESULT ON JSON DATA GIVES INVALID
#              DATA ERROR
#
CREATE TABLE t1 (i1 INT, KEY(i1)) ENGINE=innodb;
CREATE TABLE t2 (i2 INT, j2 JSON) ENGINE=innodb;
INSERT INTO t2 (i2, j2) VALUES
(1, '["a"]'),
(2, '["ab"]');
SELECT SQL_BIG_RESULT i1, j2
FROM t2 LEFT JOIN t1 ON i2 < i1 GROUP BY j2 ORDER BY i2;
i1	j2
NULL	["a"]
NULL	["ab"]
Warnings:
Warning	1235	This version of MySQL doesn't yet support 'sorting of non-scalar JSON values'
DROP TABLE t1, t2;
#
# Bug#21104470 WL8132:ASSERTION `! IS_SET()' FAILED.
#
CREATE TABLE t_21104470(j JSON);
INSERT INTO t_21104470 VALUES (NULL), (NULL);
SELECT j FROM t_21104470 GROUP BY j;
j
NULL
SELECT DISTINCT j FROM t_21104470;
j
NULL
CREATE TABLE D_21104470 (
pk int(11) NOT NULL AUTO_INCREMENT,
col_int_nokey json NOT NULL,
col_int_key int(11) NOT NULL,
col_date_key date NOT NULL,
col_date_nokey json NOT NULL,
col_time_key time NOT NULL,
col_time_nokey json NOT NULL,
col_datetime_key datetime NOT NULL,
col_datetime_nokey json NOT NULL,
col_varchar_key varchar(1) NOT NULL,
col_varchar_nokey json NOT NULL,
PRIMARY KEY (pk),
KEY col_int_key (col_int_key),
KEY col_date_key (col_date_key),
KEY col_time_key (col_time_key),
KEY col_datetime_key (col_datetime_key),
KEY col_varchar_key (col_varchar_key),
KEY col_int_key_2 (col_int_key,col_date_key,col_time_key,col_datetime_key,col_varchar_key)
) ENGINE=MyISAM AUTO_INCREMENT=11 DEFAULT CHARSET=latin1;
INSERT INTO D_21104470
VALUES
(1,'{"int1": "6"}',3,
'2007-06-18','{"date": "2007-06-18"}',
'00:00:00','{"time": null}',
'2002-08-20 22:48:00','{"datetime": "2002-08-20 22:48:00.035785"}',
'd','{"varc": "d"}'),
(2,'{"int1": "2"}',8,
'2002-10-13','{"date": "2002-10-13"}',
'00:00:00','{"time": "00:00:00"}',
'1900-01-01 00:00:00','{"datetime": "1900-01-01 00:00:00"}',
's','{"varc": "s"}'),
(3,'{"int1": "4"}',1,
'1900-01-01','{"date": "1900-01-01"}',
'15:57:25','{"time": "15:57:25.019666"}',
'2005-08-15 00:00:00','{"datetime": "2005-08-15 00:00:00"}',
'r','{"varc": "r"}'),
(4,'{"int1": "8"}',8,
'0000-00-00','{"date": null}',
'07:05:51','{"time": "07:05:51.006712"}',
'1900-01-01 00:00:00','{"datetime": "1900-01-01 00:00:00"}',
'm','{"varc": "m"}'),
(5,'{"int1": "4"}',8,
'2006-03-09','{"date": "2006-03-09"}',
'19:22:21','{"time": "19:22:21.057406"}',
'2008-05-16 08:09:06','{"datetime": "2008-05-16 08:09:06.002924"}',
'b','{"varc": "b"}'),
(6,'{"int1": "4"}',5,
'2001-06-05','{"date": "2001-06-05"}',
'03:53:16','{"time": "03:53:16.001370"}',
'2001-01-20 12:47:23','{"datetime": "2001-01-20 12:47:23.022022"}',
'x','{"varc": "x"}'),
(7,'{"int1": "7"}',7,
'2006-05-28','{"date": "2006-05-28"}',
'09:16:38','{"time": "09:16:38.034570"}',
'2008-07-02 00:00:00','{"datetime": "2008-07-02 00:00:00"}',
'g','{"varc": "g"}'),
(8,'{"int1": "4"}',5,
'2001-04-19','{"date": "2001-04-19"}',
'15:37:26','{"time": "15:37:26.028315"}',
'1900-01-01 00:00:00','{"datetime": "1900-01-01 00:00:00"}',
'p','{"varc": "p"}'),
(9,'{"int1": "1"}',1,
'1900-01-01','{"date": "1900-01-01"}',
'00:00:00','{"time": "00:00:00"}',
'2002-12-08 11:34:58','{"datetime": "2002-12-08 11:34:58.001571"}',
'q','{"varc": "q"}'),
(10,'{"int1": "9"}',6,
'2004-08-20','{"date": "2004-08-20"}',
'05:03:03','{"time": "05:03:03.047452"}',
'1900-01-01 00:00:00','{"datetime": "1900-01-01 00:00:00"}',
'w','{"varc": "w"}');
Warnings:
Warning	1264	Out of range value for column 'col_date_key' at row 4
CREATE TABLE DD_21104470 (
pk int(11) NOT NULL AUTO_INCREMENT,
col_int_nokey json NOT NULL,
col_int_key int(11) NOT NULL,
col_date_key date NOT NULL,
col_date_nokey json NOT NULL,
col_time_key time NOT NULL,
col_time_nokey json NOT NULL,
col_datetime_key datetime NOT NULL,
col_datetime_nokey json NOT NULL,
col_varchar_key varchar(1) NOT NULL,
col_varchar_nokey json NOT NULL,
PRIMARY KEY (pk),
KEY col_int_key (col_int_key),
KEY col_date_key (col_date_key),
KEY col_time_key (col_time_key),
KEY col_datetime_key (col_datetime_key),
KEY col_varchar_key (col_varchar_key),
KEY col_int_key_2 (col_int_key,col_date_key,col_time_key,col_datetime_key,col_varchar_key)
) ENGINE=MyISAM AUTO_INCREMENT=20 DEFAULT CHARSET=latin1;
INSERT INTO DD_21104470
VALUES
(10,'{"int1": "6"}',3,
'2002-12-16','{"date": "2002-12-16"}',
'17:54:20','{"time": "17:54:20.050299"}',
'2007-04-06 06:20:37','{"datetime": "2007-04-06 06:20:37.035492"}',
'i','{"varc": "i"}'),
(11,'{"int1": "1"}',1,
'2005-08-08','{"date": "2005-08-08"}',
'08:53:47','{"time": "08:53:47.064602"}',
'2008-03-07 00:00:00','{"datetime": "2008-03-07 00:00:00"}',
'x','{"varc": "x"}'),
(12,'{"int1": "5"}',2,
'2004-11-16','{"date": "2004-11-16"}',
'01:40:28','{"time": "01:40:28.015719"}',
'2002-01-25 10:15:08','{"datetime": "2002-01-25 10:15:08.014682"}',
'l','{"varc": "l"}'),
(13,'{"int1": "6"}',7,
'0000-00-00','{"date": null}',
'16:37:21','{"time": "16:37:21.055310"}',
'2001-02-26 23:35:13','{"datetime": "2001-02-26 23:35:13.014897"}',
'q','{"varc": "q"}'),
(14,'{"int1": "2"}',6,
'2006-05-14','{"date": "2006-05-14"}',
'01:00:33','{"time": "01:00:33.038177"}',
'2001-06-23 13:47:43','{"datetime": "2001-06-23 13:47:43.001775"}',
'n','{"varc": "n"}'),
(15,'{"int1": "4"}',1,
'2005-01-19','{"date": "2005-01-19"}',
'03:06:43','{"time": "03:06:43.059217"}',
'2007-01-17 05:06:55','{"datetime": "2007-01-17 05:06:55.064405"}',
'r','{"varc": "r"}'),
(16,'{"int1": "231"}',156,
'1900-01-01','{"date": "1900-01-01"}',
'00:00:00','{"time": null}',
'2001-10-23 00:00:00','{"datetime": "2001-10-23 00:00:00"}',
'c','{"varc": "c"}'),
(17,'{"int1": "4"}',8,
'2004-06-25','{"date": "2004-06-25"}',
'16:13:44','{"time": "16:13:44.008978"}',
'2003-11-24 04:13:27','{"datetime": "2003-11-24 04:13:27.046820"}',
'h','{"varc": "h"}'),
(18,'{"int1": "3"}',7,
'2009-12-22','{"date": "2009-12-22"}',
'14:09:13','{"time": "14:09:13.028533"}',
'2007-09-19 14:33:09','{"datetime": "2007-09-19 14:33:09.017132"}',
'k','{"varc": "k"}'),
(19,'{"int1": "3"}',2,
'2004-06-25','{"date": "2004-06-25"}',
'10:09:51','{"time": "10:09:51.017335"}',
'1900-01-01 00:00:00','{"datetime": "1900-01-01 00:00:00"}',
't','{"varc": "t"}');
Warnings:
Warning	1264	Out of range value for column 'col_date_key' at row 4
CREATE TABLE insert_select_21104470
SELECT
table3 . col_datetime_nokey AS field1
FROM
D_21104470 AS table1
LEFT  JOIN  DD_21104470 AS table2
LEFT  JOIN DD_21104470 AS table3
ON table2 . col_int_key <  table3 . col_int_key
ON  table1 . pk =  table2 . col_int_key
WHERE   table1 . col_int_key >= 3
AND table1 . col_int_key < ( 3 + 7 )
OR table1 . col_int_key >= 3
AND table1 . col_int_key < ( 3 + 25 )
AND table1 . col_int_key != table2 . pk
AND table1 . col_int_key IS  NULL
AND  table1 . pk IS  NULL
OR table1 . col_int_key > 3
GROUP BY field1
ORDER BY field1;
Warnings:
Warning	1235	This version of MySQL doesn't yet support 'sorting of non-scalar JSON values'
DROP TABLE D_21104470;
DROP TABLE DD_21104470;
DROP TABLE insert_select_21104470;
DROP TABLE t_21104470;
CREATE TABLE t(j JSON NOT NULL);
INSERT INTO t(j) VALUES (DEFAULT);
ERROR HY000: Field 'j' doesn't have a default value
SET sql_mode = '';
Warnings:
Warning	3090	Changing sql mode 'NO_AUTO_CREATE_USER' is deprecated. It will be removed in a future release.
INSERT INTO t(j) VALUES (DEFAULT);
Warnings:
Warning	1364	Field 'j' doesn't have a default value
SELECT * FROM t;
j
null
SET sql_mode = default;
DROP TABLE t;
#
# Bug#21072360 ASSERTION `(*A)->FIELD_TYPE() == MYSQL_TYPE_JSON ||
#              (*B)->FIELD_TYPE() == FAILED
#
CREATE TABLE t (j JSON);
INSERT INTO t VALUES ('true'), ('"abc"');
SELECT j FROM t WHERE j <= 'xyz' AND j = 'abc';
j
"abc"
DROP TABLE t;
#
# Bug#21094905 VALGRIND ERRORS WITH LATEST BUILDS OF WL7909
#
CREATE TABLE F (i1 INT, j JSON);
INSERT INTO F VALUES (1, '1'), (2, '2');
CREATE TABLE H (i2 INT);
SELECT SUM(DISTINCT i2), j FROM F LEFT JOIN H ON i1 = i2 GROUP BY j ORDER BY j;
SUM(DISTINCT i2)	j
NULL	1
NULL	2
DROP TABLE F, H;
#
# Bug#21110783 WL8132:DEBUG CRASH AT WRAPPER_TO_STRING | SQL/JSON_DOM.CC
#
CREATE TABLE t1 (i1 INT) ENGINE=MyISAM;
INSERT INTO t1 VALUES (1);
CREATE TABLE t2 (i2 INT, j JSON) ENGINE=MyISAM;
CREATE TABLE t3(v VARCHAR(100), j JSON) ENGINE=MyISAM;
INSERT INTO t3(v) SELECT j FROM t1 LEFT JOIN t2 ON i1 = i2 GROUP BY j;
INSERT INTO t3(j) SELECT j FROM t1 LEFT JOIN t2 ON i1 = i2 GROUP BY j;
SELECT * FROM t3;
v	j
NULL	NULL
NULL	NULL
DROP TABLE t1, t2, t3;
#
# Bug#21128632 JSON_QUOTE(JSON_TYPE(...)) GIVES ERROR 3139 ER_INVALID_JSON_CHARSET
#
select json_quote( json_type( json_object() ) );
json_quote( json_type( json_object() ) )
"OBJECT"
select json_quote( json_type( cast('{}' as json) ) );
json_quote( json_type( cast('{}' as json) ) )
"OBJECT"
#
# Bug#21096340 VIEW WITH QUERY HAVING SUM ON JSON COLUMN RETURNS INVALID DATA
#
CREATE TABLE D (
col_varchar_10_latin1 varchar(10) CHARACTER SET latin1,
col_varchar_255_latin1_key varchar(255) CHARACTER SET latin1,
col_int_key int,
pk integer auto_increment,
col_varchar_255_utf8_key varchar(255) CHARACTER SET utf8,
col_int int,
col_varchar_10_utf8 varchar(10) CHARACTER SET utf8,
col_varchar_255_latin1 varchar(255) CHARACTER SET latin1,
col_varchar_255_utf8 varchar(255) CHARACTER SET utf8,
col_varchar_10_latin1_key varchar(10) CHARACTER SET latin1,
col_varchar_10_utf8_key varchar(10) CHARACTER SET utf8,
/*Indices*/
key (col_varchar_255_latin1_key),
key (col_int_key),
primary key (pk),
key (col_varchar_255_utf8_key),
key (col_varchar_10_latin1_key),
key (col_varchar_10_utf8_key)
) ENGINE=innodb;
INSERT INTO D VALUES  ('have', 'say', NULL, NULL, 'who',
NULL, 'JBIYP', 'he''s', 'VWJOC', 'your',
'VDMAE') ,  ('YQAHN', 'GIKYQ', 3, NULL, 'no', 1933049856,
'got', 'icz', 'RMHUR', 'MPCRS', 'so') ,
('had', 'PASVH', 2144141312, NULL, 'look',
808058880, 'czstj', 'z', 'MRRVF', 'UHWEV',
'that') ,  ('BSXXI', 'DLIRG', NULL, NULL,
'zstjzfsu', 1562116096, 'is', 'WKDGV', 'stj',
'tjzf', 'with') ,  ('JFSGY', 'c', 98828288,
NULL, 'n', 269418496, 'LDJWY', 'jzfsu', 'QPXVX',
'zfsunwdg', 'we');
ALTER TABLE D MODIFY COLUMN col_int JSON;
SELECT SUM(col_int), col_int FROM D AS table1 WHERE table1.pk = table1.pk;
SUM(col_int)	col_int
4572643328	NULL
CREATE OR REPLACE VIEW view1 AS SELECT SUM(col_int), col_int FROM D AS table1
WHERE table1.pk = table1.pk;
SELECT * FROM view1;
SUM(col_int)	col_int
4572643328	NULL
SELECT  SUM(col_int), col_int FROM D AS table1 WHERE table1.pk = table1.pk;
SUM(col_int)	col_int
4572643328	NULL
SELECT * FROM view1;
SUM(col_int)	col_int
4572643328	NULL
DROP VIEW view1;
DROP TABLE D;
#
# Bug#21119971 WL8132:DEBUG CRASH AT ITEM_CACHE_JSON::CACHE_VALUE
#
CREATE TABLE t1(j1 JSON);
CREATE TABLE t2(j2 JSON);
CREATE TABLE t3(j3 JSON);
INSERT INTO t1 VALUES ('1');
INSERT INTO t2 VALUES ('1');
INSERT INTO t3 VALUES ('1');
SELECT * FROM t1 WHERE j1 >= ALL (SELECT j3 FROM t2 LEFT JOIN t3 ON (j2 > j3));
j1
DROP TABLE t1, t2, t3;
#
# Bug#21145759 ER_INVALID_CAST_TO_JSON ON CALL TO JSON_REMOVE
#              WITH EMPTY ARG + ORDER BY
#
CREATE TABLE t (pk INT PRIMARY KEY, col_json JSON);
INSERT INTO t VALUES (1, JSON_OBJECT());
SELECT JSON_REMOVE((SELECT col_json FROM t WHERE pk = 3),
'$.testpath1') AS field1
FROM t HAVING field1 >= 'c' ORDER BY field1;
field1
SELECT JSON_REMOVE((SELECT col_json FROM t WHERE pk = 3),
'$.testpath1') AS field1
FROM t HAVING field1 >= 'c';
field1
SELECT JSON_REMOVE((SELECT col_json FROM t WHERE pk = 3),
'$.testpath1') AS field1
FROM t ORDER BY field1;
field1
NULL
SELECT JSON_REMOVE((SELECT col_json FROM t WHERE pk = 3),
'$.testpath1') AS field1
FROM t;
field1
NULL
DROP TABLE t;
#
# Bug#21148020 OUTPUT FROM JSON_TYPE() IS TRUNCATED
#              WHEN EXECUTED IN A VIEW OR JOIN
#
SELECT JSON_TYPE(JSON_OBJECT());
JSON_TYPE(JSON_OBJECT())
OBJECT
CREATE VIEW v1 AS SELECT JSON_TYPE(JSON_OBJECT());
SELECT * FROM v1;
JSON_TYPE(JSON_OBJECT())
OBJECT
SELECT JSON_TYPE(CAST(CAST('2015-05-25 11:23:55' AS DATETIME) AS JSON));
JSON_TYPE(CAST(CAST('2015-05-25 11:23:55' AS DATETIME) AS JSON))
DATETIME
CREATE VIEW v2 AS SELECT JSON_TYPE(CAST(CAST('2015-05-25 11:23:55' AS
DATETIME) AS JSON));
SELECT * FROM v2;
JSON_TYPE(CAST(CAST('2015-05-25 11:23:55' AS
DATETIME) AS JSON))
DATETIME
drop view v1;
drop view v2;
#
# Bug#21135312 BUG IN JSON COMPARE OPARATOR WHEN USING JSON_QUOTE
#
CREATE TABLE t1(c VARCHAR(10) CHARACTER SET latin1);
INSERT INTO t1 VALUES ('abc'), ('"abc"');
CREATE TABLE t2(j JSON);
INSERT INTO t2 VALUES ('"abc"');
SELECT c,
c = CAST('"abc"' AS JSON) AS eq1,
c = JSON_EXTRACT('"abc"', '$') AS eq2,
c = j AS eq3
FROM t1, t2 ORDER BY c;
c	eq1	eq2	eq3
"abc"	0	0	0
abc	1	1	1
DROP TABLE t1, t2;
#
# Bug#21147943 JSON_CONTAINS() RETURNS INCORRECT RESULT
#
SELECT JSON_CONTAINS('[1, 2, [4] ]', '{ "b" : 2 }');
JSON_CONTAINS('[1, 2, [4] ]', '{ "b" : 2 }')
0
SELECT JSON_CONTAINS('[1, 2, [4,5] ]', '[1,2,3,4,5,6,7,8,9]');
JSON_CONTAINS('[1, 2, [4,5] ]', '[1,2,3,4,5,6,7,8,9]')
0
SELECT JSON_CONTAINS('[1, 2, [4,5] ]', '[111111111111111111]');
JSON_CONTAINS('[1, 2, [4,5] ]', '[111111111111111111]')
0
#
# Bug#21169109 WL8249:WRONG RESULTS WHILE COMPARING A JSON COLUMN
#              WITH AN INDEXED INT COLUMN
#
CREATE TABLE t1(j JSON, i INT);
INSERT INTO t1 VALUES
('0', 0), ('1', 1), ('1.0', 2), ('[1,2,3]', 3), ('{}', 4), ('"abc"', 5);
ANALYZE TABLE t1;
Table	Op	Msg_type	Msg_text
test.t1	analyze	status	OK
EXPLAIN SELECT * FROM t1 WHERE j > i ORDER BY i;
id	select_type	table	partitions	type	possible_keys	key	key_len	ref	rows	filtered	Extra
1	SIMPLE	t1	NULL	ALL	NULL	NULL	NULL	NULL	6	33.33	Using where; Using filesort
Warnings:
Note	1003	/* select#1 */ select `test`.`t1`.`j` AS `j`,`test`.`t1`.`i` AS `i` from `test`.`t1` where (`test`.`t1`.`j` > `test`.`t1`.`i`) order by `test`.`t1`.`i`
EXPLAIN SELECT * FROM t1 AS a, t1 AS b WHERE a.j > b.i ORDER BY b.i, a.i;
id	select_type	table	partitions	type	possible_keys	key	key_len	ref	rows	filtered	Extra
1	SIMPLE	a	NULL	ALL	NULL	NULL	NULL	NULL	6	100.00	Using temporary; Using filesort
1	SIMPLE	b	NULL	ALL	NULL	NULL	NULL	NULL	6	33.33	Using where; Using join buffer (Block Nested Loop)
Warnings:
Note	1003	/* select#1 */ select `test`.`a`.`j` AS `j`,`test`.`a`.`i` AS `i`,`test`.`b`.`j` AS `j`,`test`.`b`.`i` AS `i` from `test`.`t1` `a` join `test`.`t1` `b` where (`test`.`a`.`j` > `test`.`b`.`i`) order by `test`.`b`.`i`,`test`.`a`.`i`
SELECT * FROM t1 WHERE j > i ORDER BY i;
j	i
[1, 2, 3]	3
{}	4
"abc"	5
SELECT * FROM t1 AS a, t1 AS b WHERE a.j > b.i ORDER BY b.i, a.i;
j	i	j	i
1	1	0	0
1	2	0	0
[1, 2, 3]	3	0	0
{}	4	0	0
"abc"	5	0	0
[1, 2, 3]	3	1	1
{}	4	1	1
"abc"	5	1	1
[1, 2, 3]	3	1	2
{}	4	1	2
"abc"	5	1	2
[1, 2, 3]	3	[1, 2, 3]	3
{}	4	[1, 2, 3]	3
"abc"	5	[1, 2, 3]	3
[1, 2, 3]	3	{}	4
{}	4	{}	4
"abc"	5	{}	4
[1, 2, 3]	3	"abc"	5
{}	4	"abc"	5
"abc"	5	"abc"	5
# Create an index on the INT column and verify that it is not used.
CREATE INDEX t1_idx ON t1(i);
ANALYZE TABLE t1;
Table	Op	Msg_type	Msg_text
test.t1	analyze	status	OK
EXPLAIN SELECT * FROM t1 WHERE j > i ORDER BY i;
id	select_type	table	partitions	type	possible_keys	key	key_len	ref	rows	filtered	Extra
1	SIMPLE	t1	NULL	ALL	NULL	NULL	NULL	NULL	6	33.33	Using where; Using filesort
Warnings:
Note	1003	/* select#1 */ select `test`.`t1`.`j` AS `j`,`test`.`t1`.`i` AS `i` from `test`.`t1` where (`test`.`t1`.`j` > `test`.`t1`.`i`) order by `test`.`t1`.`i`
EXPLAIN SELECT * FROM t1 AS a, t1 AS b WHERE a.j > b.i ORDER BY b.i, a.i;
id	select_type	table	partitions	type	possible_keys	key	key_len	ref	rows	filtered	Extra
1	SIMPLE	a	NULL	ALL	NULL	NULL	NULL	NULL	6	100.00	Using temporary; Using filesort
1	SIMPLE	b	NULL	ALL	t1_idx	NULL	NULL	NULL	6	33.33	Using where; Using join buffer (Block Nested Loop)
Warnings:
Warning	1739	Cannot use range access on index 't1_idx' due to type or collation conversion on field 'i'
Note	1003	/* select#1 */ select `test`.`a`.`j` AS `j`,`test`.`a`.`i` AS `i`,`test`.`b`.`j` AS `j`,`test`.`b`.`i` AS `i` from `test`.`t1` `a` join `test`.`t1` `b` where (`test`.`a`.`j` > `test`.`b`.`i`) order by `test`.`b`.`i`,`test`.`a`.`i`
SELECT * FROM t1 WHERE j > i ORDER BY i;
j	i
[1, 2, 3]	3
{}	4
"abc"	5
SELECT * FROM t1 AS a, t1 AS b WHERE a.j > b.i ORDER BY b.i, a.i;
j	i	j	i
1	1	0	0
1	2	0	0
[1, 2, 3]	3	0	0
{}	4	0	0
"abc"	5	0	0
[1, 2, 3]	3	1	1
{}	4	1	1
"abc"	5	1	1
[1, 2, 3]	3	1	2
{}	4	1	2
"abc"	5	1	2
[1, 2, 3]	3	[1, 2, 3]	3
{}	4	[1, 2, 3]	3
"abc"	5	[1, 2, 3]	3
[1, 2, 3]	3	{}	4
{}	4	{}	4
"abc"	5	{}	4
[1, 2, 3]	3	"abc"	5
{}	4	"abc"	5
"abc"	5	"abc"	5
CREATE TABLE t2(i INT, vc VARCHAR(10))
ENGINE=InnoDB CHARACTER SET 'utf8mb4' COLLATE 'utf8mb4_bin';
INSERT INTO t2 VALUES (1, 'abc'), (2, '"abc"');
ANALYZE TABLE t2;
Table	Op	Msg_type	Msg_text
test.t2	analyze	status	OK
EXPLAIN SELECT i FROM t2 WHERE vc = CAST('"abc"' AS JSON);
id	select_type	table	partitions	type	possible_keys	key	key_len	ref	rows	filtered	Extra
1	SIMPLE	t2	NULL	ALL	NULL	NULL	NULL	NULL	2	50.00	Using where
Warnings:
Note	1003	/* select#1 */ select `test`.`t2`.`i` AS `i` from `test`.`t2` where (`test`.`t2`.`vc` = <cache>(cast('"abc"' as json)))
SELECT i FROM t2 WHERE vc = CAST('"abc"' AS JSON);
i
1
# Create an index on the VARCHAR column and verify that it is not used.
# Used to return 2 instead of 1.
CREATE INDEX t2_idx ON t2(vc);
ANALYZE TABLE t2;
Table	Op	Msg_type	Msg_text
test.t2	analyze	status	OK
EXPLAIN SELECT i FROM t2 WHERE vc = CAST('"abc"' AS JSON);
id	select_type	table	partitions	type	possible_keys	key	key_len	ref	rows	filtered	Extra
1	SIMPLE	t2	NULL	ALL	t2_idx	NULL	NULL	NULL	2	50.00	Using where
Warnings:
Warning	1739	Cannot use ref access on index 't2_idx' due to type or collation conversion on field 'vc'
Warning	1739	Cannot use range access on index 't2_idx' due to type or collation conversion on field 'vc'
Note	1003	/* select#1 */ select `test`.`t2`.`i` AS `i` from `test`.`t2` where (`test`.`t2`.`vc` = <cache>(cast('"abc"' as json)))
SELECT i FROM t2 WHERE vc = CAST('"abc"' AS JSON);
i
1
DROP INDEX t2_idx ON t2;
# Create a unique index on the VARCHAR column and verify that it is not
# used. Used to return an empty result.
CREATE UNIQUE INDEX t2_idx ON t2(vc);
ANALYZE TABLE t2;
Table	Op	Msg_type	Msg_text
test.t2	analyze	status	OK
EXPLAIN SELECT i FROM t2 WHERE vc = CAST('"abc"' AS JSON);
id	select_type	table	partitions	type	possible_keys	key	key_len	ref	rows	filtered	Extra
1	SIMPLE	t2	NULL	ALL	t2_idx	NULL	NULL	NULL	2	50.00	Using where
Warnings:
Warning	1739	Cannot use ref access on index 't2_idx' due to type or collation conversion on field 'vc'
Warning	1739	Cannot use range access on index 't2_idx' due to type or collation conversion on field 'vc'
Note	1003	/* select#1 */ select `test`.`t2`.`i` AS `i` from `test`.`t2` where (`test`.`t2`.`vc` = <cache>(cast('"abc"' as json)))
SELECT i FROM t2 WHERE vc = CAST('"abc"' AS JSON);
i
1
DROP TABLE t1, t2;
#
# Bug#21144949 WL8132:DELETE QUERY HAVING A SUB-QUERY DOES NOT
#              DELETE ROWS IN THE TABLE
#
CREATE TABLE t(j JSON);
INSERT INTO t VALUES (JSON_OBJECT('a', 'b')), (JSON_OBJECT('a', 'b'));
DELETE FROM t WHERE j IN (SELECT JSON_OBJECT('a', 'b') FROM DUAL WHERE 1);
SELECT * FROM t;
j
INSERT INTO t VALUES (JSON_OBJECT('a', 'b')), (JSON_OBJECT('a', 'b'));
DELETE FROM t WHERE j IN (SELECT JSON_OBJECT('a', 'b') FROM DUAL);
SELECT * FROM t;
j
INSERT INTO t VALUES (JSON_OBJECT('a', 'b')), (JSON_OBJECT('a', 'b'));
DELETE FROM t WHERE j IN (SELECT CAST(NULL AS JSON) FROM DUAL);
DELETE FROM t WHERE j IN (SELECT CAST(NULL AS JSON) FROM DUAL WHERE 1);
DELETE FROM t WHERE j IN (SELECT CAST('not json' AS JSON) FROM DUAL);
ERROR 22032: Invalid JSON text in argument 1 to function cast_as_json: "Invalid value." at position 1.
DELETE FROM t WHERE j IN (SELECT CAST('not json' AS JSON) FROM DUAL WHERE 1);
ERROR 22032: Invalid JSON text in argument 1 to function cast_as_json: "Invalid value." at position 1.
SELECT * FROM t;
j
{"a": "b"}
{"a": "b"}
DROP TABLE t;
#
# Bug#21198333 SIG 6 IN ITEM_CACHE_JSON::CACHE_VALUE AT SQL/ITEM.CC:9470
#
SELECT MIN(JSON_EXTRACT('not json', '$'));
ERROR 22032: Invalid JSON text in argument 1 to function json_extract: "Invalid value." at position 1.
#
# Bug#21200657 DATA FROM DERIVED TABLE BASED
# ON JSN_QUOTE()/JSN_UNQUOTE() CALL IS TRUNCATED
#
SELECT JSON_QUOTE('This is a string that should not be truncated') AS field1;
field1
"This is a string that should not be truncated"
SELECT JSON_UNQUOTE(JSON_QUOTE('This is a string that should not be truncated')) AS field1;
field1
This is a string that should not be truncated
SELECT * FROM (SELECT JSON_QUOTE('This is a string that should not be truncated') AS field1) AS DERIVED_TABLE;
field1
"This is a string that should not be truncated"
SELECT * FROM (SELECT JSON_UNQUOTE("This is a string that should not be truncated") AS field1) AS DERIVED_TABLE;
field1
This is a string that should not be truncated
SELECT * FROM (SELECT JSON_UNQUOTE(JSON_QUOTE('This is a string that should not be truncated')) AS field1) AS DERIVED_TABLE;
field1
This is a string that should not be truncated
create table t_varchar( a varchar(3) );
insert into t_varchar values ( json_unquote( '"\\u0000\\u0001\\u0002"' ) );
select length(a) l from t_varchar;
l
3
select length( json_quote( a ) ) l, json_quote( a ) v from t_varchar;
l	v
20	"\u0000\u0001\u0002"
select * from
(
select length( json_quote( a ) ) as field0,
json_quote( a ) as field1
from t_varchar
) as derived_table;
field0	field1
20	"\u0000\u0001\u0002"
drop table t_varchar;
#
# Bug#21193273 CREATE TABLE SELECT JSN_QUOTE() RESULTS
# IN TRUNCATED DATA
#
SELECT JSON_QUOTE('table') AS field1;
field1
"table"
CREATE TABLE t SELECT JSON_QUOTE('table') AS field1;
SHOW WARNINGS;
Level	Code	Message
SELECT * FROM t;
field1
"table"
DESCRIBE t;
Field	Type	Null	Key	Default	Extra
field1	varchar(32)	YES		NULL	
drop table t;
select json_unquote( '"table"' ) as field1;
field1
table
create table t1 select json_unquote( '"table"' ) as field1;
SHOW WARNINGS;
Level	Code	Message
SELECT * FROM t1;
field1
table
DESCRIBE t1;
Field	Type	Null	Key	Default	Extra
field1	varchar(7)	YES		NULL	
drop table t1;
#
# Bug#21230644 JSON_MERGE MEMORY USAGE
#
CREATE TABLE t (doc json);
INSERT INTO t VALUES('{"array":[1,2,3,4]}');
UPDATE t SET doc=JSON_MERGE(doc,doc);
UPDATE t SET doc=JSON_MERGE(doc,doc);
drop table t;
#
# Bug#21224267 DEEPLY NESTED JSON OBJECTS MAY CAUSE CRASH
#
CREATE TABLE t (j JSON);
INSERT INTO t VALUES (CONCAT(REPEAT('{"v":', 5000), '1', REPEAT('}', 5000)));
ERROR 22032: The JSON document exceeds the maximum depth.
INSERT INTO t VALUES (CONCAT(REPEAT('{"v":[', 5000), '1', REPEAT(']}', 5000)));
ERROR 22032: The JSON document exceeds the maximum depth.
INSERT INTO t VALUES (CONCAT(REPEAT('[{"v":', 5000), '1', REPEAT('}]', 5000)));
ERROR 22032: The JSON document exceeds the maximum depth.
DROP TABLE t;
#
# JSON should work with INSERT .. ON DUPLICATE KEY UPDATE
#
CREATE TABLE t(id INT PRIMARY KEY, j JSON);
INSERT INTO t VALUES (1, '[1]')
ON DUPLICATE KEY UPDATE j = JSON_OBJECT("a", VALUES(j));
SELECT * FROM t;
id	j
1	[1]
INSERT INTO t VALUES (1, '[1,2]')
ON DUPLICATE KEY UPDATE j = JSON_OBJECT("ab", VALUES(j));
SELECT * FROM t;
id	j
1	{"ab": [1, 2]}
INSERT INTO t VALUES (1, '[1,2,3]')
ON DUPLICATE KEY UPDATE j = JSON_OBJECT("abc", VALUES(j));
SELECT * FROM t;
id	j
1	{"abc": [1, 2, 3]}
DROP TABLE t;
#
# Bug#21278178 JSON_QUOTE(LITERAL) GETS APPLIED DOUBLE DURING SELECT
#              FROM TABLE WITH MTR
#
CREATE TABLE t(x INT);
INSERT INTO t VALUES (1), (2), (3);
SET NAMES latin1;
SELECT JSON_QUOTE('abc') FROM t;
JSON_QUOTE('abc')
"abc"
"abc"
"abc"
SET NAMES utf8mb4;
SELECT JSON_QUOTE('abc') FROM t;
JSON_QUOTE('abc')
"abc"
"abc"
"abc"
SET NAMES default;
DROP TABLE t;
#
# Bug#21296173 JSON_OBJECT('KEY', BOOLEAN_LITERAL) USES VALUES 0, 1
#               FOR BOOL WHEN USED VIA VIEW
#
SELECT JSON_OBJECT('key1', false, 'key2', true);
JSON_OBJECT('key1', false, 'key2', true)
{"key1": false, "key2": true}
SELECT JSON_ARRAY('key1', false, 'key2', true);
JSON_ARRAY('key1', false, 'key2', true)
["key1", false, "key2", true]
CREATE VIEW v1 AS SELECT JSON_OBJECT('key1', false, 'key2', true);
SELECT * FROM v1;
JSON_OBJECT('key1', false, 'key2', true)
{"key1": false, "key2": true}
CREATE VIEW v2 AS SELECT JSON_ARRAY('key1', false, 'key2', true);
SELECT * FROM v2;
JSON_ARRAY('key1', false, 'key2', true)
["key1", false, "key2", true]
drop view v1;
drop view v2;
#
# Bug#21291993 ASSERT `0' FAILED AT THD::SEND_STATEMENT_STATUS()
#              ON JSON_SEARCH(NULL, ...)+JOIN
#
CREATE TABLE t (pk INT NOT NULL PRIMARY KEY, col_varchar VARCHAR(1));
SELECT COUNT(*), JSON_SEARCH(NULL, 'one', '5%')
FROM t t1, t t2 WHERE t1.pk = t2.pk;
COUNT(*)	JSON_SEARCH(NULL, 'one', '5%')
0	NULL
DROP TABLE t;
#
# Bug#21293089 JSON_CONTAINS() RETURNS WRONG RESULT WITH EMPTY JSON ARRAY
#
SELECT JSON_CONTAINS('[]', '{"a" : 1}');
JSON_CONTAINS('[]', '{"a" : 1}')
0
SELECT JSON_CONTAINS('[]', '[1, 2, 3, 4, 5]');
JSON_CONTAINS('[]', '[1, 2, 3, 4, 5]')
0
SELECT JSON_CONTAINS('[]', '[1, 2, 3, 4, {"a" : 1}]');
JSON_CONTAINS('[]', '[1, 2, 3, 4, {"a" : 1}]')
0
SELECT JSON_CONTAINS('[]', '{"a" : [1, 2, 3, 4, 5]}');
JSON_CONTAINS('[]', '{"a" : [1, 2, 3, 4, 5]}')
0
SELECT JSON_CONTAINS('[]', '[]');
JSON_CONTAINS('[]', '[]')
1
#
# Bug#21376088 JSON: CRASH IN VAL_JSON_FUNC_FIELD_SUBSELECT
#
create table t(a json);
insert into t values('{}');
select a from t where (select a from t where 1) in (select 1 from t);
a
select a from t where (select a from t where 1) in (select cast('{}' as json) from t);
a
{}
drop table t;
#
# Bug#21054516:QUERY HAVING SQL_BIG_RESULT ON JSON DATA GIVES EXTRA
#              ROWS IN OUTPUT
#
CREATE TABLE t1 (
pk integer auto_increment key,
col_varchar_255_utf8_key varchar(255)  CHARACTER SET utf8
) ENGINE=innodb;
INSERT INTO t1 VALUES (NULL, 'q') , (NULL, 'tgzvsj') ,
(NULL, 'b') , (NULL, 'q') , (NULL, 'up') , (NULL, 'up') ;
ALTER TABLE t1 ADD COLUMN json_varchar255_utf8_key json;
UPDATE t1 SET json_varchar255_utf8_key =
JSON_OBJECT('col_varchar_255_utf8_key', col_varchar_255_utf8_key);
ALTER TABLE t1 MODIFY col_varchar_255_utf8_key VARCHAR(255)
GENERATED ALWAYS AS
(JSON_EXTRACT(json_varchar255_utf8_key,'$.col_varchar_255_utf8_key[0]'))
STORED;
SELECT SQL_BIG_RESULT table1.json_varchar255_utf8_key AS field1, count(*)
FROM t1 AS table1 LEFT JOIN t1 AS table2 ON table1.pk <= table2.pk
GROUP  BY field1;
field1	count(*)
{"col_varchar_255_utf8_key": "up"}	3
{"col_varchar_255_utf8_key": "q"}	9
{"col_varchar_255_utf8_key": "b"}	4
{"col_varchar_255_utf8_key": "tgzvsj"}	5
Warnings:
Warning	1235	This version of MySQL doesn't yet support 'sorting of non-scalar JSON values'
DROP TABLE t1;
#
# Bug#21377136 STACK OVERFLOW IN RAPIDJSON::GENERICREADER
#
SELECT JSON_VALID(REPEAT('[', 100000));
ERROR 22032: The JSON document exceeds the maximum depth.
SELECT JSON_VALID(REPEAT('{"a":', 100000));
ERROR 22032: The JSON document exceeds the maximum depth.
SELECT JSON_VALID(REPEAT('{"a":[', 100000));
ERROR 22032: The JSON document exceeds the maximum depth.
SELECT JSON_VALID(REPEAT('[{"a":', 100000));
ERROR 22032: The JSON document exceeds the maximum depth.
#
# Bug#21381806 JSON: ASSERTION FAILED: ARG->NULL_VALUE
#
SELECT JSON_SET(CASE WHEN 1 THEN NULL ELSE NULL END, '{}', '{}');
JSON_SET(CASE WHEN 1 THEN NULL ELSE NULL END, '{}', '{}')
NULL
SELECT JSON_VALID(CASE WHEN 1 THEN NULL ELSE NULL END);
JSON_VALID(CASE WHEN 1 THEN NULL ELSE NULL END)
NULL
SELECT JSON_ARRAY(CASE WHEN 1 THEN NULL ELSE NULL END);
JSON_ARRAY(CASE WHEN 1 THEN NULL ELSE NULL END)
[null]
#
# Bug#21383497 DBUG_ABORT() IN VAL_JSON
#
CREATE TABLE t(a INT PRIMARY KEY);
INSERT INTO t VALUES (1), (2), (3), (4), (5);
SELECT 1 FROM t GROUP BY ST_ASGEOJSON(POINT(1, 1)) WITH ROLLUP;
1
1
1
Warnings:
Warning	1235	This version of MySQL doesn't yet support 'sorting of non-scalar JSON values'
SELECT JSON_EXTRACT('{"a":1}', '$.a') AS je, COUNT(DISTINCT a)
FROM t GROUP BY je WITH ROLLUP;
je	COUNT(DISTINCT a)
1	5
NULL	5
SELECT JSON_EXTRACT(NULL, '$.a') AS je, COUNT(DISTINCT a)
FROM t GROUP BY je WITH ROLLUP;
je	COUNT(DISTINCT a)
NULL	5
NULL	5
SELECT JSON_EXTRACT('{"a":1}', '$.a') AS je, a, COUNT(DISTINCT a)
FROM t GROUP BY je, a WITH ROLLUP;
je	a	COUNT(DISTINCT a)
1	1	1
1	2	1
1	3	1
1	4	1
1	5	1
1	NULL	5
NULL	NULL	5
SELECT JSON_EXTRACT('{"a":1}', '$.a') AS je, a, COUNT(DISTINCT a)
FROM t GROUP BY a, je WITH ROLLUP;
je	a	COUNT(DISTINCT a)
1	1	1
NULL	1	1
1	2	1
NULL	2	1
1	3	1
NULL	3	1
1	4	1
NULL	4	1
1	5	1
NULL	5	1
NULL	NULL	5
DROP TABLE t;
#
# Bug#21384048 ASSERTION FAILED: N >= 0 && N <= 308
#              IN RAPIDJSON::INTERNAL::FASTPATH
#
SELECT JSON_EXTRACT('-1E-36181012216111515851075235238', '$');
JSON_EXTRACT('-1E-36181012216111515851075235238', '$')
-0
SELECT JSON_EXTRACT('1E-36181012216111515851075235238', '$');
JSON_EXTRACT('1E-36181012216111515851075235238', '$')
0
SELECT JSON_EXTRACT('1E-325', '$');
JSON_EXTRACT('1E-325', '$')
0
SELECT JSON_EXTRACT('1E-324', '$');
JSON_EXTRACT('1E-324', '$')
0
SELECT JSON_EXTRACT('1E-323', '$');
JSON_EXTRACT('1E-323', '$')
1e-323
SELECT JSON_EXTRACT('1E+308', '$');
JSON_EXTRACT('1E+308', '$')
1e308
SELECT JSON_EXTRACT('1E+309', '$');
ERROR 22032: Invalid JSON text in argument 1 to function json_extract: "Number too big to be stored in double." at position 6.
SELECT JSON_EXTRACT('1E+36181012216111515851075235238', '$');
ERROR 22032: Invalid JSON text in argument 1 to function json_extract: "Number too big to be stored in double." at position 6.
SELECT JSON_EXTRACT('-1E+36181012216111515851075235238', '$');
ERROR 22032: Invalid JSON text in argument 1 to function json_extract: "Number too big to be stored in double." at position 7.
#
# Bug#21383284: ASSERTION IN SELECT_LEX::SETUP_CONDS
#
SELECT 1 FROM dual WHERE JSON_SEARCH('{}', 'one', 'foo', 'too-long-escape');
ERROR HY000: Incorrect arguments to ESCAPE
SELECT 1 FROM dual WHERE JSON_SEARCH('{}', 'one', 'foo', JSON_EXTRACT('', '$'));
ERROR 22032: Invalid JSON text in argument 1 to function json_extract: "The document is empty." at position 0.
#
# Bug#21437989: ASSERTION FAILED:
#               JSON_BINARY::PARSE_BINARY(PTR, LENGTH).IS_VALID()
#
CREATE TABLE t(j JSON NOT NULL);
INSERT INTO t VALUES ();
ERROR HY000: Field 'j' doesn't have a default value
INSERT INTO t VALUES (NULL);
ERROR 23000: Column 'j' cannot be null
INSERT IGNORE INTO t VALUES ();
Warnings:
Warning	1364	Field 'j' doesn't have a default value
INSERT IGNORE INTO t VALUES (NULL);
Warnings:
Warning	1048	Column 'j' cannot be null
SELECT * FROM t;
j
null
null
INSERT INTO t SELECT j FROM t;
REPLACE INTO t SELECT j FROM t;
SELECT * FROM t;
j
null
null
null
null
null
null
null
null
DROP TABLE t;
#
# Bug#21448719: WRONG RESULT FOR JSON VALUE IN OUTER JOIN WITH VIEW
#
CREATE TABLE t1(j1 JSON);
CREATE TABLE t2(j2 JSON);
CREATE VIEW v AS SELECT CAST('1' AS JSON) AS jv, j2 FROM t2;
INSERT INTO t1 VALUES ('1');
SELECT j1, jv, j2, JSON_ARRAY(j1, jv, j2) FROM t1 LEFT JOIN v ON j1 = jv;
j1	jv	j2	JSON_ARRAY(j1, jv, j2)
1	NULL	NULL	[1, null, null]
INSERT INTO t2 VALUES ('1');
SELECT j1, jv, j2, JSON_ARRAY(j1, jv, j2) FROM t1 LEFT JOIN v ON j1 = jv;
j1	jv	j2	JSON_ARRAY(j1, jv, j2)
1	1	1	[1, 1, 1]
DROP TABLE t1, t2;
DROP VIEW v;
#
# Bug#21442624 INCORRECT RESULT FROM JSON_SET WITH AUTO-WRAPPING
#
SELECT JSON_SET('1', '$', 100);
JSON_SET('1', '$', 100)
100
SELECT JSON_SET('1', '$[0]', 100);
JSON_SET('1', '$[0]', 100)
100
SELECT JSON_SET('1', '$[0][0]', 100);
JSON_SET('1', '$[0][0]', 100)
100
SELECT JSON_SET('1', '$[0][0][0]', 100);
JSON_SET('1', '$[0][0][0]', 100)
100
SELECT JSON_SET('[]', '$', 100);
JSON_SET('[]', '$', 100)
100
SELECT JSON_SET('[]', '$[0]', 100);
JSON_SET('[]', '$[0]', 100)
[100]
SELECT JSON_SET('[]', '$[0][0]', 100);
JSON_SET('[]', '$[0][0]', 100)
[]
SELECT JSON_SET('[]', '$[0][0][0]', 100);
JSON_SET('[]', '$[0][0][0]', 100)
[]
SELECT JSON_SET('[1]', '$', 100);
JSON_SET('[1]', '$', 100)
100
SELECT JSON_SET('[1]', '$[0]', 100);
JSON_SET('[1]', '$[0]', 100)
[100]
SELECT JSON_SET('[1]', '$[0][0]', 100);
JSON_SET('[1]', '$[0][0]', 100)
[100]
SELECT JSON_SET('[1]', '$[0][0][0]', 100);
JSON_SET('[1]', '$[0][0][0]', 100)
[100]
SELECT JSON_SET('[[1]]', '$', 100);
JSON_SET('[[1]]', '$', 100)
100
SELECT JSON_SET('[[1]]', '$[0]', 100);
JSON_SET('[[1]]', '$[0]', 100)
[100]
SELECT JSON_SET('[[1]]', '$[0][0]', 100);
JSON_SET('[[1]]', '$[0][0]', 100)
[[100]]
SELECT JSON_SET('[[1]]', '$[0][0][0]', 100);
JSON_SET('[[1]]', '$[0][0][0]', 100)
[[100]]
SELECT JSON_SET('[[[1]]]', '$', 100);
JSON_SET('[[[1]]]', '$', 100)
100
SELECT JSON_SET('[[[1]]]', '$[0]', 100);
JSON_SET('[[[1]]]', '$[0]', 100)
[100]
SELECT JSON_SET('[[[1]]]', '$[0][0]', 100);
JSON_SET('[[[1]]]', '$[0][0]', 100)
[[100]]
SELECT JSON_SET('[[[1]]]', '$[0][0][0]', 100);
JSON_SET('[[[1]]]', '$[0][0][0]', 100)
[[[100]]]
SELECT JSON_REPLACE('1', '$', 100);
JSON_REPLACE('1', '$', 100)
100
SELECT JSON_REPLACE('1', '$[0]', 100);
JSON_REPLACE('1', '$[0]', 100)
100
SELECT JSON_REPLACE('1', '$[0][0]', 100);
JSON_REPLACE('1', '$[0][0]', 100)
100
SELECT JSON_REPLACE('1', '$[0][0][0]', 100);
JSON_REPLACE('1', '$[0][0][0]', 100)
100
SELECT JSON_REPLACE('[]', '$', 100);
JSON_REPLACE('[]', '$', 100)
100
SELECT JSON_REPLACE('[]', '$[0]', 100);
JSON_REPLACE('[]', '$[0]', 100)
[]
SELECT JSON_REPLACE('[]', '$[0][0]', 100);
JSON_REPLACE('[]', '$[0][0]', 100)
[]
SELECT JSON_REPLACE('[]', '$[0][0][0]', 100);
JSON_REPLACE('[]', '$[0][0][0]', 100)
[]
SELECT JSON_REPLACE('[1]', '$', 100);
JSON_REPLACE('[1]', '$', 100)
100
SELECT JSON_REPLACE('[1]', '$[0]', 100);
JSON_REPLACE('[1]', '$[0]', 100)
[100]
SELECT JSON_REPLACE('[1]', '$[0][0]', 100);
JSON_REPLACE('[1]', '$[0][0]', 100)
[100]
SELECT JSON_REPLACE('[1]', '$[0][0][0]', 100);
JSON_REPLACE('[1]', '$[0][0][0]', 100)
[100]
SELECT JSON_REPLACE('[[1]]', '$', 100);
JSON_REPLACE('[[1]]', '$', 100)
100
SELECT JSON_REPLACE('[[1]]', '$[0]', 100);
JSON_REPLACE('[[1]]', '$[0]', 100)
[100]
SELECT JSON_REPLACE('[[1]]', '$[0][0]', 100);
JSON_REPLACE('[[1]]', '$[0][0]', 100)
[[100]]
SELECT JSON_REPLACE('[[1]]', '$[0][0][0]', 100);
JSON_REPLACE('[[1]]', '$[0][0][0]', 100)
[[100]]
SELECT JSON_REPLACE('[[[1]]]', '$', 100);
JSON_REPLACE('[[[1]]]', '$', 100)
100
SELECT JSON_REPLACE('[[[1]]]', '$[0]', 100);
JSON_REPLACE('[[[1]]]', '$[0]', 100)
[100]
SELECT JSON_REPLACE('[[[1]]]', '$[0][0]', 100);
JSON_REPLACE('[[[1]]]', '$[0][0]', 100)
[[100]]
SELECT JSON_REPLACE('[[[1]]]', '$[0][0][0]', 100);
JSON_REPLACE('[[[1]]]', '$[0][0][0]', 100)
[[[100]]]
#
# Bug#21472872 WRONG RESULTS CAUSED BY PATH LEG POPPING
# IN JSON FUNCTIONS
#
create table tdoc( id int, doc json );
insert into tdoc values
( 1, '[]' ),
( 2, '{ "a": { "b": true } }' );
select id, json_insert( doc, '$.a.c', false ) from tdoc where id = 2;
id	json_insert( doc, '$.a.c', false )
2	{"a": {"b": true, "c": false}}
select id, json_insert( doc, '$.a.c', false ) from tdoc order by id;
id	json_insert( doc, '$.a.c', false )
1	[]
2	{"a": {"b": true, "c": false}}
drop table tdoc;
create table tdoc( id int, doc json, new_value varchar( 10 ) );
insert into tdoc values
( 1, '{ "a": { "b": true } }', null ),
( 2, '{ "a": { "b": true } }', 'abc' );
select id, json_insert( doc, '$.a.c', new_value ) from tdoc where id = 2;
id	json_insert( doc, '$.a.c', new_value )
2	{"a": {"b": true, "c": "abc"}}
select id, json_insert( doc, '$.a.c', new_value ) from tdoc order by id;
id	json_insert( doc, '$.a.c', new_value )
1	{"a": {"b": true, "c": null}}
2	{"a": {"b": true, "c": "abc"}}
drop table tdoc;
#
# Bug#21491442 VARIANT::FORCED_RETURN() [WITH T = JSON_SCALAR*]:
#              ASSERTION `FALSE' FAILED.
#
create table t (a json, b blob,
c int generated always as (1!=a) virtual not null) engine=innodb;
insert into t(a) values('[1]');
insert into t(a) values('[1]');
select a,c from t;
a	c
[1]	1
[1]	1
prepare ps1 from 'insert into t(a) values(?)';
set @a='[1]';
execute ps1 using @a;
execute ps1 using @a;
select a,c from t;
a	c
[1]	1
[1]	1
[1]	1
[1]	1
drop table t;
create temporary table t (a json, b blob,
c int generated always as (1!=a) virtual not null) engine=innodb;
insert into t(a) values('[1]');
insert into t(a) values('[1]');
select a,c from t;
a	c
[1]	1
[1]	1
prepare ps1 from 'insert into t(a) values(?)';
set @a='[1]';
execute ps1 using @a;
execute ps1 using @a;
select a,c from t;
a	c
[1]	1
[1]	1
[1]	1
[1]	1
drop table t;
#
# Bug#21487833: DBUG_ABORT() IN JSON_WRAPPER::MAKE_HASH_KEY
#               WITH ORDERED JSON
#
Warnings:
Warning	3135	'NO_ZERO_DATE', 'NO_ZERO_IN_DATE' and 'ERROR_FOR_DIVISION_BY_ZERO' sql modes should be used with strict mode. They will be merged with strict mode in a future release.
CREATE TABLE t (a BLOB, b JSON NOT NULL) ENGINE=InnoDB;
INSERT INTO t VALUES ('', NULL), ('', NULL);
Warnings:
Warning	1048	Column 'b' cannot be null
UPDATE t SET a = 1 ORDER BY b;
SELECT COUNT(a) FROM t GROUP BY b;
COUNT(a)
2
SELECT DISTINCT B FROM t;
B
null
SELECT b FROM t UNION DISTINCT SELECT b FROM t;
b
null
SELECT * FROM t ORDER BY b;
a	b
1	null
1	null
DROP TABLE t;
#
# Bug#21541481: MEMORY LEAK OF ALLOCATIONS MADE IN
#               VAL_JSON_FUNC_FIELD_SUBSELECT
#
# This comparison gave valgrind leakage before the fix
create table t(a json not null) engine=innodb;
insert into t values('{}');
select row(uuid(), a) < row(a, str_to_date(1,1)) from t;
row(uuid(), a) < row(a, str_to_date(1,1))
1
drop table t;
# Bug#21547877: UPDATE/INSERT JSON COLUMN CRASHES IF EXPRESSION
#               REFERS TO SELF
#
SET NAMES latin1;
CREATE TABLE t (j JSON);
INSERT INTO t VALUES ('{}');
UPDATE t SET j='1', j='1111-11-11', j=('1' NOT BETWEEN j AND '1');
ERROR 22032: Invalid JSON text: "The document root must not follow by other values." at position 4 in value for column 't.j'.
SELECT * FROM t;
j
{}
DROP TABLE t;
SET NAMES DEFAULT;
#
# Bug#21602361: ASSERTION FAILED: (VECTOR_IDX == -1) || (VECTOR_IDX >= 0)
#
create table t(b int, key(b))engine=innodb;
insert into t values(1),(2);
select json_length('{}',@uninitialized_21602361)
from t group by b into @uninitialized_21602361;
ERROR 42000: Result consisted of more than one row
set @initialized_21602361 = '$';
select json_length('{}',@initialized_21602361)
from t group by b into @initialized_21602361;
ERROR 42000: Invalid JSON path expression. The error is around character position 1.
set @error_value_21602361 = '$[';
select json_length('{}',@error_value_21602361)
from t group by b into @error_value_21602361;
ERROR 42000: Invalid JSON path expression. The error is around character position 2.
set @valid_path_21602361 = '$';
select concat( '$[', json_length('{}',@valid_path_21602361), ']' )
from t group by b into @valid_path_21602361;
ERROR 42000: Result consisted of more than one row
set @null_value_21602361 = null;
select json_length('{}',@null_value_21602361)
from t group by b into @null_value_21602361;
ERROR 42000: Result consisted of more than one row
drop table t;
#
# Bug#21649073: JSON_TYPE RETURNS OPAQUE FOR SOME BINARY VALUES
#
SELECT JSON_TYPE(CAST(CAST('abcd' AS BINARY) AS JSON));
JSON_TYPE(CAST(CAST('abcd' AS BINARY) AS JSON))
BLOB
CREATE TABLE t (bn BINARY(5), vb VARBINARY(5),
tb TINYBLOB, mb MEDIUMBLOB, bb BLOB, lb LONGBLOB);
INSERT INTO t (bn) VALUES (x'cafe');
UPDATE t SET vb = bn, tb = bn, mb = bn, bb = bn, lb = bn;
SELECT JSON_TYPE(CAST(bn AS JSON)) AS bn, JSON_TYPE(CAST(vb AS JSON)) AS vb,
JSON_TYPE(CAST(tb AS JSON)) AS tb, JSON_TYPE(CAST(mb AS JSON)) AS mb,
JSON_TYPE(CAST(bb AS JSON)) AS bb, JSON_TYPE(CAST(lb AS JSON)) AS lb
FROM t;
bn	vb	tb	mb	bb	lb
BLOB	BLOB	BLOB	BLOB	BLOB	BLOB
DROP TABLE t;
#
# Basic tests for inlined JSON path
#
CREATE TABLE t1(f1 JSON);
INSERT INTO t1 VALUES('{"a":1}'),('{"a":3}'),('{"a":2}');
INSERT INTO t1 VALUES('{"a":11, "b":3}'),('{"a":33, "b":1}'),('{"a":22,"b":2}');
ANALYZE TABLE t1;
Table	Op	Msg_type	Msg_text
test.t1	analyze	status	OK
SELECT f1->"$.a" FROM t1;
f1->"$.a"
1
3
2
11
33
22
EXPLAIN SELECT f1->"$.a" FROM t1;
id	select_type	table	partitions	type	possible_keys	key	key_len	ref	rows	filtered	Extra
1	SIMPLE	t1	NULL	ALL	NULL	NULL	NULL	NULL	6	100.00	NULL
Warnings:
Note	1003	/* select#1 */ select json_extract(`test`.`t1`.`f1`,'$.a') AS `f1->"$.a"` from `test`.`t1`
SELECT f1->"$.a" FROM t1 WHERE f1->"$.b" > 1;
f1->"$.a"
11
22
EXPLAIN SELECT f1->"$.a" FROM t1 WHERE f1->"$.b" > 1;
id	select_type	table	partitions	type	possible_keys	key	key_len	ref	rows	filtered	Extra
1	SIMPLE	t1	NULL	ALL	NULL	NULL	NULL	NULL	6	100.00	Using where
Warnings:
Note	1003	/* select#1 */ select json_extract(`test`.`t1`.`f1`,'$.a') AS `f1->"$.a"` from `test`.`t1` where (json_extract(`test`.`t1`.`f1`,'$.b') > 1)
SELECT f1->"$.a", f1->"$.b" FROM t1 ORDER BY f1->"$.b";
f1->"$.a"	f1->"$.b"
1	NULL
3	NULL
2	NULL
33	1
22	2
11	3
EXPLAIN SELECT f1->"$.a", f1->"$.b" FROM t1 ORDER BY f1->"$.b";
id	select_type	table	partitions	type	possible_keys	key	key_len	ref	rows	filtered	Extra
1	SIMPLE	t1	NULL	ALL	NULL	NULL	NULL	NULL	6	100.00	Using filesort
Warnings:
Note	1003	/* select#1 */ select json_extract(`test`.`t1`.`f1`,'$.a') AS `f1->"$.a"`,json_extract(`test`.`t1`.`f1`,'$.b') AS `f1->"$.b"` from `test`.`t1` order by json_extract(`test`.`t1`.`f1`,'$.b')
SELECT MAX(f1->"$.a"), f1->"$.b" FROM t1 GROUP BY f1->"$.b";
MAX(f1->"$.a")	f1->"$.b"
3	NULL
33	1
22	2
11	3
EXPLAIN SELECT MAX(f1->"$.a"), f1->"$.b" FROM t1 GROUP BY f1->"$.b";
id	select_type	table	partitions	type	possible_keys	key	key_len	ref	rows	filtered	Extra
1	SIMPLE	t1	NULL	ALL	NULL	NULL	NULL	NULL	6	100.00	Using temporary; Using filesort
Warnings:
Note	1003	/* select#1 */ select max(json_extract(`test`.`t1`.`f1`,'$.a')) AS `MAX(f1->"$.a")`,json_extract(`test`.`t1`.`f1`,'$.b') AS `f1->"$.b"` from `test`.`t1` group by json_extract(`test`.`t1`.`f1`,'$.b')
SELECT JSON_OBJECT("c",f1->"$.b") AS f2
FROM t1 HAVING JSON_TYPE(f2->"$.c") <> 'NULL';
f2
{"c": 3}
{"c": 1}
{"c": 2}
EXPLAIN
SELECT JSON_OBJECT("c",f1->"$.b") AS f2 FROM t1 HAVING JSON_TYPE(f2->"$.c") <> 'NULL';
id	select_type	table	partitions	type	possible_keys	key	key_len	ref	rows	filtered	Extra
1	SIMPLE	t1	NULL	ALL	NULL	NULL	NULL	NULL	6	100.00	NULL
Warnings:
Note	1003	/* select#1 */ select json_object('c',json_extract(`test`.`t1`.`f1`,'$.b')) AS `f2` from `test`.`t1` having (json_type(json_extract(`f2`,'$.c')) <> 'NULL')
DROP TABLE t1;
#
# Bug#21828321: JSON FUNCS CALL DBUG_ABORT OR EXIT() ON WINDOWS!
#
SELECT JSON_ARRAY(LEAST(NULL, NULL), GREATEST(NULL, NULL), LEAST(j1, NULL),
GREATEST(NULL, j2), LEAST(j1, j2), GREATEST(j1, j2)) AS j
FROM (SELECT CAST('1' AS JSON) AS j1, CAST('2' AS JSON) AS j2) t;
j
[null, null, null, null, "1", "2"]
Warnings:
Warning	1235	This version of MySQL doesn't yet support 'comparison of JSON in the LEAST and GREATEST operators'
Warning	1235	This version of MySQL doesn't yet support 'comparison of JSON in the LEAST and GREATEST operators'
Warning	1235	This version of MySQL doesn't yet support 'comparison of JSON in the LEAST and GREATEST operators'
Warning	1235	This version of MySQL doesn't yet support 'comparison of JSON in the LEAST and GREATEST operators'
#
#  Bug#22278524: ALTER TABLE SOMETIMES CONVERTS TEXT TO JSON WITHOUT
#                SYNTAX CHECKING
#
CREATE TABLE t1(txt TEXT CHARACTER SET utf8mb4 COLLATE utf8mb4_bin);
INSERT INTO t1 VALUES ('not JSON');
ALTER TABLE t1 MODIFY COLUMN txt JSON;
ERROR 22032: Invalid JSON text: "Invalid value." at position 1 in value for column '#sql-temporary.txt'.
SELECT * FROM t1;
txt
not JSON
CREATE TABLE t2(j JSON);
INSERT INTO t2 VALUES (JSON_OBJECT('a', 'b'));
ALTER TABLE t2 MODIFY COLUMN j TEXT CHARACTER SET utf8mb4 COLLATE utf8mb4_bin;
SELECT * FROM t2;
j
{"a": "b"}
CREATE TABLE t3 (j JSON);
INSERT INTO t3 VALUES (JSON_OBJECT('a', 'b'));
CREATE TABLE t4 AS SELECT UPPER(j) AS jj FROM t3;
INSERT INTO t4 VALUES ('not JSON');
ALTER TABLE t4 MODIFY COLUMN jj JSON;
ERROR 22032: Invalid JSON text: "Invalid value." at position 1 in value for column '#sql-temporary.jj'.
SELECT * FROM t4;
jj
{"A": "B"}
not JSON
DROP TABLE t1, t2, t3, t4;
