stop slave;
drop table if exists t1,t2,t3,t4,t5,t6,t7,t8,t9;
reset master;
reset slave;
drop table if exists t1,t2,t3,t4,t5,t6,t7,t8,t9;
start slave;
**** On Master ****
SET SESSION BINLOG_FORMAT=STATEMENT;
SET GLOBAL  BINLOG_FORMAT=STATEMENT;
CREATE TABLE t1 (a INT, b LONG) ENGINE=MyISAM;
INSERT INTO t1 VALUES (1,1), (2,2);
SELECT * FROM t1;
a	b
1	1
2	2
**** On Slave ****
INSERT INTO t1 VALUE (3,3);
SELECT * FROM t1;
a	b
1	1
2	2
3	3
**** On Master ****
TRUNCATE TABLE t1;
SELECT * FROM t1;
a	b
**** On Slave ****
SELECT * FROM t1;
a	b
**** On Master ****
DROP TABLE t1;
SHOW BINLOG EVENTS;
Log_name	Pos	Event_type	Server_id	End_log_pos	Info
master-bin.000001	4	Format_desc	1	102	Server ver: SERVER_VERSION, Binlog ver: 4
master-bin.000001	102	Query	1	210	use `test`; CREATE TABLE t1 (a INT, b LONG) ENGINE=MyISAM
master-bin.000001	210	Query	1	307	use `test`; INSERT INTO t1 VALUES (1,1), (2,2)
master-bin.000001	307	Query	1	387	use `test`; TRUNCATE TABLE t1
master-bin.000001	387	Query	1	463	use `test`; DROP TABLE t1
**** On Master ****
SET SESSION BINLOG_FORMAT=MIXED;
SET GLOBAL  BINLOG_FORMAT=MIXED;
CREATE TABLE t1 (a INT, b LONG) ENGINE=MyISAM;
INSERT INTO t1 VALUES (1,1), (2,2);
SELECT * FROM t1;
a	b
1	1
2	2
**** On Slave ****
INSERT INTO t1 VALUE (3,3);
SELECT * FROM t1;
a	b
1	1
2	2
3	3
**** On Master ****
TRUNCATE TABLE t1;
SELECT * FROM t1;
a	b
**** On Slave ****
SELECT * FROM t1;
a	b
**** On Master ****
DROP TABLE t1;
SHOW BINLOG EVENTS;
Log_name	Pos	Event_type	Server_id	End_log_pos	Info
master-bin.000001	4	Format_desc	1	102	Server ver: SERVER_VERSION, Binlog ver: 4
master-bin.000001	102	Query	1	210	use `test`; CREATE TABLE t1 (a INT, b LONG) ENGINE=MyISAM
master-bin.000001	210	Query	1	307	use `test`; INSERT INTO t1 VALUES (1,1), (2,2)
master-bin.000001	307	Query	1	387	use `test`; TRUNCATE TABLE t1
master-bin.000001	387	Query	1	463	use `test`; DROP TABLE t1
**** On Master ****
SET SESSION BINLOG_FORMAT=ROW;
SET GLOBAL  BINLOG_FORMAT=ROW;
CREATE TABLE t1 (a INT, b LONG) ENGINE=MyISAM;
INSERT INTO t1 VALUES (1,1), (2,2);
SELECT * FROM t1;
a	b
1	1
2	2
**** On Slave ****
INSERT INTO t1 VALUE (3,3);
SELECT * FROM t1;
a	b
1	1
2	2
3	3
**** On Master ****
TRUNCATE TABLE t1;
SELECT * FROM t1;
a	b
**** On Slave ****
SELECT * FROM t1;
a	b
**** On Master ****
DROP TABLE t1;
SHOW BINLOG EVENTS;
Log_name	Pos	Event_type	Server_id	End_log_pos	Info
master-bin.000001	4	Format_desc	1	102	Server ver: SERVER_VERSION, Binlog ver: 4
master-bin.000001	102	Query	1	210	use `test`; CREATE TABLE t1 (a INT, b LONG) ENGINE=MyISAM
master-bin.000001	210	Table_map	1	250	table_id: # (test.t1)
master-bin.000001	250	Write_rows	1	297	table_id: # flags: STMT_END_F
master-bin.000001	297	Query	1	377	use `test`; TRUNCATE TABLE t1
master-bin.000001	377	Query	1	453	use `test`; DROP TABLE t1
**** On Master ****
SET SESSION BINLOG_FORMAT=STATEMENT;
SET GLOBAL  BINLOG_FORMAT=STATEMENT;
CREATE TABLE t1 (a INT, b LONG) ENGINE=MyISAM;
INSERT INTO t1 VALUES (1,1), (2,2);
SELECT * FROM t1;
a	b
1	1
2	2
**** On Slave ****
INSERT INTO t1 VALUE (3,3);
SELECT * FROM t1;
a	b
1	1
2	2
3	3
**** On Master ****
DELETE FROM t1;
SELECT * FROM t1;
a	b
**** On Slave ****
SELECT * FROM t1;
a	b
**** On Master ****
DROP TABLE t1;
SHOW BINLOG EVENTS;
Log_name	Pos	Event_type	Server_id	End_log_pos	Info
master-bin.000001	4	Format_desc	1	102	Server ver: SERVER_VERSION, Binlog ver: 4
master-bin.000001	102	Query	1	210	use `test`; CREATE TABLE t1 (a INT, b LONG) ENGINE=MyISAM
master-bin.000001	210	Query	1	307	use `test`; INSERT INTO t1 VALUES (1,1), (2,2)
master-bin.000001	307	Query	1	384	use `test`; DELETE FROM t1
master-bin.000001	384	Query	1	460	use `test`; DROP TABLE t1
**** On Master ****
SET SESSION BINLOG_FORMAT=MIXED;
SET GLOBAL  BINLOG_FORMAT=MIXED;
CREATE TABLE t1 (a INT, b LONG) ENGINE=MyISAM;
INSERT INTO t1 VALUES (1,1), (2,2);
SELECT * FROM t1;
a	b
1	1
2	2
**** On Slave ****
INSERT INTO t1 VALUE (3,3);
SELECT * FROM t1;
a	b
1	1
2	2
3	3
**** On Master ****
DELETE FROM t1;
SELECT * FROM t1;
a	b
**** On Slave ****
SELECT * FROM t1;
a	b
**** On Master ****
DROP TABLE t1;
SHOW BINLOG EVENTS;
Log_name	Pos	Event_type	Server_id	End_log_pos	Info
master-bin.000001	4	Format_desc	1	102	Server ver: SERVER_VERSION, Binlog ver: 4
master-bin.000001	102	Query	1	210	use `test`; CREATE TABLE t1 (a INT, b LONG) ENGINE=MyISAM
master-bin.000001	210	Query	1	307	use `test`; INSERT INTO t1 VALUES (1,1), (2,2)
master-bin.000001	307	Query	1	384	use `test`; DELETE FROM t1
master-bin.000001	384	Query	1	460	use `test`; DROP TABLE t1
**** On Master ****
SET SESSION BINLOG_FORMAT=ROW;
SET GLOBAL  BINLOG_FORMAT=ROW;
CREATE TABLE t1 (a INT, b LONG) ENGINE=MyISAM;
INSERT INTO t1 VALUES (1,1), (2,2);
SELECT * FROM t1;
a	b
1	1
2	2
**** On Slave ****
INSERT INTO t1 VALUE (3,3);
SELECT * FROM t1;
a	b
1	1
2	2
3	3
**** On Master ****
DELETE FROM t1;
SELECT * FROM t1;
a	b
**** On Slave ****
SELECT * FROM t1;
a	b
3	3
**** On Master ****
DROP TABLE t1;
SHOW BINLOG EVENTS;
Log_name	Pos	Event_type	Server_id	End_log_pos	Info
master-bin.000001	4	Format_desc	1	102	Server ver: SERVER_VERSION, Binlog ver: 4
master-bin.000001	102	Query	1	210	use `test`; CREATE TABLE t1 (a INT, b LONG) ENGINE=MyISAM
master-bin.000001	210	Table_map	1	250	table_id: # (test.t1)
master-bin.000001	250	Write_rows	1	297	table_id: # flags: STMT_END_F
master-bin.000001	297	Table_map	1	337	table_id: # (test.t1)
master-bin.000001	337	Delete_rows	1	384	table_id: # flags: STMT_END_F
master-bin.000001	384	Query	1	460	use `test`; DROP TABLE t1
