stop slave;
drop table if exists t1,t2,t3,t4,t5,t6,t7,t8,t9;
reset master;
reset slave;
drop table if exists t1,t2,t3,t4,t5,t6,t7,t8,t9;
start slave;
**** On Master ****
CREATE TABLE t1 (a INT PRIMARY KEY, b LONG) ENGINE=NDB;
INSERT INTO t1 VALUES (1,1), (2,2);
SELECT * FROM t1 ORDER BY a,b;
a	b
1	1
2	2
**** On Slave ****
INSERT INTO t1 VALUE (3,3);
SELECT * FROM t1 ORDER BY a,b;
a	b
1	1
2	2
3	3
**** On Master ****
TRUNCATE TABLE t1;
SELECT * FROM t1 ORDER BY a,b;
a	b
**** On Slave ****
SELECT * FROM t1 ORDER BY a,b;
a	b
**** On Master ****
DROP TABLE t1;
SHOW BINLOG EVENTS;
Log_name	Pos	Event_type	Server_id	End_log_pos	Info
master-bin.000001	4	Format_desc	1	105	Server ver: SERVER_VERSION, Binlog ver: 4
master-bin.000001	105	Query	1	222	use `test`; CREATE TABLE t1 (a INT PRIMARY KEY, b LONG) ENGINE=NDB
master-bin.000001	222	Query	1	286	BEGIN
master-bin.000001	286	Table_map	1	40	table_id: # (test.t1)
master-bin.000001	326	Table_map	1	95	table_id: # (mysql.ndb_apply_status)
master-bin.000001	381	Write_rows	1	137	table_id: #
master-bin.000001	423	Write_rows	1	175	table_id: #
master-bin.000001	461	Write_rows	1	213	table_id: # flags: STMT_END_F
master-bin.000001	499	Query	1	564	COMMIT
master-bin.000001	564	Query	1	644	use `test`; TRUNCATE TABLE t1
master-bin.000001	644	Query	1	720	use `test`; DROP TABLE t1
**** On Master ****
CREATE TABLE t1 (a INT PRIMARY KEY, b LONG) ENGINE=NDB;
INSERT INTO t1 VALUES (1,1), (2,2);
SELECT * FROM t1 ORDER BY a,b;
a	b
1	1
2	2
**** On Slave ****
INSERT INTO t1 VALUE (3,3);
SELECT * FROM t1 ORDER BY a,b;
a	b
1	1
2	2
3	3
**** On Master ****
DELETE FROM t1;
SELECT * FROM t1 ORDER BY a,b;
a	b
**** On Slave ****
SELECT * FROM t1 ORDER BY a,b;
a	b
3	3
**** On Master ****
DROP TABLE t1;
SHOW BINLOG EVENTS;
Log_name	Pos	Event_type	Server_id	End_log_pos	Info
master-bin.000001	4	Format_desc	1	105	Server ver: SERVER_VERSION, Binlog ver: 4
master-bin.000001	105	Query	1	222	use `test`; CREATE TABLE t1 (a INT PRIMARY KEY, b LONG) ENGINE=NDB
master-bin.000001	222	Query	1	286	BEGIN
master-bin.000001	286	Table_map	1	40	table_id: # (test.t1)
master-bin.000001	326	Table_map	1	95	table_id: # (mysql.ndb_apply_status)
master-bin.000001	381	Write_rows	1	137	table_id: #
master-bin.000001	423	Write_rows	1	175	table_id: #
master-bin.000001	461	Write_rows	1	213	table_id: # flags: STMT_END_F
master-bin.000001	499	Query	1	564	COMMIT
master-bin.000001	564	Query	1	644	use `test`; TRUNCATE TABLE t1
master-bin.000001	644	Query	1	720	use `test`; DROP TABLE t1
master-bin.000001	720	Query	1	837	use `test`; CREATE TABLE t1 (a INT PRIMARY KEY, b LONG) ENGINE=NDB
master-bin.000001	837	Query	1	901	BEGIN
master-bin.000001	901	Table_map	1	40	table_id: # (test.t1)
master-bin.000001	941	Table_map	1	95	table_id: # (mysql.ndb_apply_status)
master-bin.000001	996	Write_rows	1	137	table_id: #
master-bin.000001	1038	Write_rows	1	175	table_id: #
master-bin.000001	1076	Write_rows	1	213	table_id: # flags: STMT_END_F
master-bin.000001	1114	Query	1	1179	COMMIT
master-bin.000001	1179	Query	1	1243	BEGIN
master-bin.000001	1243	Table_map	1	40	table_id: # (test.t1)
master-bin.000001	1283	Table_map	1	95	table_id: # (mysql.ndb_apply_status)
master-bin.000001	1338	Write_rows	1	137	table_id: #
master-bin.000001	1380	Delete_rows	1	171	table_id: #
master-bin.000001	1414	Delete_rows	1	205	table_id: # flags: STMT_END_F
master-bin.000001	1448	Query	1	1513	COMMIT
master-bin.000001	1513	Query	1	1589	use `test`; DROP TABLE t1
