stop slave;
drop table if exists t1,t2,t3,t4,t5,t6,t7,t8,t9;
reset master;
reset slave;
drop table if exists t1,t2,t3,t4,t5,t6,t7,t8,t9;
start slave;
**** On Master ****
CREATE TABLE t1 (a INT PRIMARY KEY, b LONG) ENGINE=NDB;
INSERT INTO t1 VALUES (1,1), (2,2);
SELECT * FROM t1 ORDER BY a,b;
a	b
1	1
2	2
**** On Slave ****
INSERT INTO t1 VALUE (3,3);
SELECT * FROM t1 ORDER BY a,b;
a	b
1	1
2	2
3	3
**** On Master ****
TRUNCATE TABLE t1;
SELECT * FROM t1 ORDER BY a,b;
a	b
**** On Slave ****
SELECT * FROM t1 ORDER BY a,b;
a	b
**** On Master ****
DROP TABLE t1;
SHOW BINLOG EVENTS;
Log_name	Pos	Event_type	Server_id	End_log_pos	Info
master-bin.000001	4	Format_desc	1	106	Server ver: SERVER_VERSION, Binlog ver: 4
master-bin.000001	106	Query	1	223	use `test`; CREATE TABLE t1 (a INT PRIMARY KEY, b LONG) ENGINE=NDB
master-bin.000001	223	Query	1	287	BEGIN
master-bin.000001	287	Table_map	1	43	table_id: # (test.t1)
master-bin.000001	330	Table_map	1	105	table_id: # (mysql.ndb_apply_status)
master-bin.000001	392	Write_rows	1	164	table_id: #
master-bin.000001	451	Write_rows	1	202	table_id: #
master-bin.000001	489	Write_rows	1	240	table_id: # flags: STMT_END_F
master-bin.000001	527	Query	1	592	COMMIT
master-bin.000001	592	Query	1	672	use `test`; TRUNCATE TABLE t1
master-bin.000001	672	Query	1	748	use `test`; DROP TABLE t1
**** On Master ****
CREATE TABLE t1 (a INT PRIMARY KEY, b LONG) ENGINE=NDB;
INSERT INTO t1 VALUES (1,1), (2,2);
SELECT * FROM t1 ORDER BY a,b;
a	b
1	1
2	2
**** On Slave ****
INSERT INTO t1 VALUE (3,3);
SELECT * FROM t1 ORDER BY a,b;
a	b
1	1
2	2
3	3
**** On Master ****
DELETE FROM t1;
SELECT * FROM t1 ORDER BY a,b;
a	b
**** On Slave ****
SELECT * FROM t1 ORDER BY a,b;
a	b
3	3
**** On Master ****
DROP TABLE t1;
SHOW BINLOG EVENTS;
Log_name	Pos	Event_type	Server_id	End_log_pos	Info
master-bin.000001	4	Format_desc	1	106	Server ver: SERVER_VERSION, Binlog ver: 4
master-bin.000001	106	Query	1	223	use `test`; CREATE TABLE t1 (a INT PRIMARY KEY, b LONG) ENGINE=NDB
master-bin.000001	223	Query	1	287	BEGIN
master-bin.000001	287	Table_map	1	43	table_id: # (test.t1)
master-bin.000001	330	Table_map	1	105	table_id: # (mysql.ndb_apply_status)
master-bin.000001	392	Write_rows	1	164	table_id: #
master-bin.000001	451	Write_rows	1	202	table_id: #
master-bin.000001	489	Write_rows	1	240	table_id: # flags: STMT_END_F
master-bin.000001	527	Query	1	592	COMMIT
master-bin.000001	592	Query	1	672	use `test`; TRUNCATE TABLE t1
master-bin.000001	672	Query	1	748	use `test`; DROP TABLE t1
master-bin.000001	748	Query	1	865	use `test`; CREATE TABLE t1 (a INT PRIMARY KEY, b LONG) ENGINE=NDB
master-bin.000001	865	Query	1	929	BEGIN
master-bin.000001	929	Table_map	1	43	table_id: # (test.t1)
master-bin.000001	972	Table_map	1	105	table_id: # (mysql.ndb_apply_status)
master-bin.000001	1034	Write_rows	1	164	table_id: #
master-bin.000001	1093	Write_rows	1	202	table_id: #
master-bin.000001	1131	Write_rows	1	240	table_id: # flags: STMT_END_F
master-bin.000001	1169	Query	1	1234	COMMIT
master-bin.000001	1234	Query	1	1298	BEGIN
master-bin.000001	1298	Table_map	1	43	table_id: # (test.t1)
master-bin.000001	1341	Table_map	1	105	table_id: # (mysql.ndb_apply_status)
master-bin.000001	1403	Write_rows	1	164	table_id: #
master-bin.000001	1462	Delete_rows	1	198	table_id: #
master-bin.000001	1496	Delete_rows	1	232	table_id: # flags: STMT_END_F
master-bin.000001	1530	Query	1	1595	COMMIT
master-bin.000001	1595	Query	1	1671	use `test`; DROP TABLE t1
