stop slave;
drop table if exists t1,t2,t3,t4,t5,t6,t7,t8,t9;
reset master;
reset slave;
drop table if exists t1,t2,t3,t4,t5,t6,t7,t8,t9;
start slave;
**** On Master ****
CREATE TABLE t1 (a INT PRIMARY KEY, b LONG) ENGINE=NDB;
INSERT INTO t1 VALUES (1,1), (2,2);
SELECT * FROM t1 ORDER BY a,b;
a	b
1	1
2	2
**** On Slave ****
INSERT INTO t1 VALUE (3,3);
SELECT * FROM t1 ORDER BY a,b;
a	b
1	1
2	2
3	3
**** On Master ****
TRUNCATE TABLE t1;
SELECT * FROM t1 ORDER BY a,b;
a	b
**** On Slave ****
SELECT * FROM t1 ORDER BY a,b;
a	b
**** On Master ****
DROP TABLE t1;
SHOW BINLOG EVENTS;
Log_name	Pos	Event_type	Server_id	End_log_pos	Info
master-bin.000001	4	Format_desc	1	103	Server ver: SERVER_VERSION, Binlog ver: 4
master-bin.000001	103	Query	1	220	use `test`; CREATE TABLE t1 (a INT PRIMARY KEY, b LONG) ENGINE=NDB
master-bin.000001	220	Query	1	284	BEGIN
master-bin.000001	284	Table_map	1	40	table_id: # (test.t1)
master-bin.000001	324	Table_map	1	95	table_id: # (mysql.ndb_apply_status)
master-bin.000001	379	Write_rows	1	137	table_id: #
master-bin.000001	421	Write_rows	1	184	table_id: # flags: STMT_END_F
master-bin.000001	468	Query	1	533	COMMIT
master-bin.000001	533	Query	1	613	use `test`; TRUNCATE TABLE t1
master-bin.000001	613	Query	1	689	use `test`; DROP TABLE t1
**** On Master ****
CREATE TABLE t1 (a INT PRIMARY KEY, b LONG) ENGINE=NDB;
INSERT INTO t1 VALUES (1,1), (2,2);
SELECT * FROM t1 ORDER BY a,b;
a	b
1	1
2	2
**** On Slave ****
INSERT INTO t1 VALUE (3,3);
SELECT * FROM t1 ORDER BY a,b;
a	b
1	1
2	2
3	3
**** On Master ****
DELETE FROM t1;
SELECT * FROM t1 ORDER BY a,b;
a	b
**** On Slave ****
SELECT * FROM t1 ORDER BY a,b;
a	b
3	3
**** On Master ****
DROP TABLE t1;
SHOW BINLOG EVENTS;
Log_name	Pos	Event_type	Server_id	End_log_pos	Info
master-bin.000001	4	Format_desc	1	103	Server ver: SERVER_VERSION, Binlog ver: 4
master-bin.000001	103	Query	1	220	use `test`; CREATE TABLE t1 (a INT PRIMARY KEY, b LONG) ENGINE=NDB
master-bin.000001	220	Query	1	284	BEGIN
master-bin.000001	284	Table_map	1	40	table_id: # (test.t1)
master-bin.000001	324	Table_map	1	95	table_id: # (mysql.ndb_apply_status)
master-bin.000001	379	Write_rows	1	137	table_id: #
master-bin.000001	421	Write_rows	1	184	table_id: # flags: STMT_END_F
master-bin.000001	468	Query	1	533	COMMIT
master-bin.000001	533	Query	1	613	use `test`; TRUNCATE TABLE t1
master-bin.000001	613	Query	1	689	use `test`; DROP TABLE t1
master-bin.000001	689	Query	1	806	use `test`; CREATE TABLE t1 (a INT PRIMARY KEY, b LONG) ENGINE=NDB
master-bin.000001	806	Query	1	870	BEGIN
master-bin.000001	870	Table_map	1	40	table_id: # (test.t1)
master-bin.000001	910	Table_map	1	95	table_id: # (mysql.ndb_apply_status)
master-bin.000001	965	Write_rows	1	137	table_id: #
master-bin.000001	1007	Write_rows	1	184	table_id: # flags: STMT_END_F
master-bin.000001	1054	Query	1	1119	COMMIT
master-bin.000001	1119	Query	1	1183	BEGIN
master-bin.000001	1183	Table_map	1	40	table_id: # (test.t1)
master-bin.000001	1223	Table_map	1	95	table_id: # (mysql.ndb_apply_status)
master-bin.000001	1278	Write_rows	1	137	table_id: #
master-bin.000001	1320	Delete_rows	1	176	table_id: # flags: STMT_END_F
master-bin.000001	1359	Query	1	1424	COMMIT
master-bin.000001	1424	Query	1	1500	use `test`; DROP TABLE t1
