stop slave;
drop table if exists t1,t2,t3,t4,t5,t6,t7,t8,t9;
reset master;
reset slave;
drop table if exists t1,t2,t3,t4,t5,t6,t7,t8,t9;
start slave;
**** On Master ****
SET SESSION BINLOG_FORMAT=STATEMENT;
SET GLOBAL  BINLOG_FORMAT=STATEMENT;
CREATE TABLE t1 (a INT, b LONG) ENGINE=InnoDB;
INSERT INTO t1 VALUES (1,1), (2,2);
SELECT * FROM t1;
a	b
1	1
2	2
**** On Slave ****
INSERT INTO t1 VALUE (3,3);
SELECT * FROM t1;
a	b
1	1
2	2
3	3
**** On Master ****
TRUNCATE TABLE t1;
SELECT * FROM t1;
a	b
**** On Slave ****
SELECT * FROM t1;
a	b
**** On Master ****
DROP TABLE t1;
SHOW BINLOG EVENTS;
Log_name	Pos	Event_type	Server_id	End_log_pos	Info
master-bin.000001	4	Format_desc	1	103	Server ver: SERVER_VERSION, Binlog ver: 4
master-bin.000001	103	Query	1	211	use `test`; CREATE TABLE t1 (a INT, b LONG) ENGINE=InnoDB
master-bin.000001	211	Query	1	97	use `test`; INSERT INTO t1 VALUES (1,1), (2,2)
master-bin.000001	308	Xid	1	335	COMMIT /* xid= */
master-bin.000001	335	Query	1	80	use `test`; TRUNCATE TABLE t1
master-bin.000001	415	Xid	1	442	COMMIT /* xid= */
master-bin.000001	442	Query	1	518	use `test`; DROP TABLE t1
**** On Master ****
SET SESSION BINLOG_FORMAT=MIXED;
SET GLOBAL  BINLOG_FORMAT=MIXED;
CREATE TABLE t1 (a INT, b LONG) ENGINE=InnoDB;
INSERT INTO t1 VALUES (1,1), (2,2);
SELECT * FROM t1;
a	b
1	1
2	2
**** On Slave ****
INSERT INTO t1 VALUE (3,3);
SELECT * FROM t1;
a	b
1	1
2	2
3	3
**** On Master ****
TRUNCATE TABLE t1;
SELECT * FROM t1;
a	b
**** On Slave ****
SELECT * FROM t1;
a	b
**** On Master ****
DROP TABLE t1;
SHOW BINLOG EVENTS;
Log_name	Pos	Event_type	Server_id	End_log_pos	Info
master-bin.000001	4	Format_desc	1	103	Server ver: SERVER_VERSION, Binlog ver: 4
master-bin.000001	103	Query	1	211	use `test`; CREATE TABLE t1 (a INT, b LONG) ENGINE=InnoDB
master-bin.000001	211	Query	1	97	use `test`; INSERT INTO t1 VALUES (1,1), (2,2)
master-bin.000001	308	Xid	1	335	COMMIT /* xid= */
master-bin.000001	335	Query	1	80	use `test`; TRUNCATE TABLE t1
master-bin.000001	415	Xid	1	442	COMMIT /* xid= */
master-bin.000001	442	Query	1	518	use `test`; DROP TABLE t1
**** On Master ****
SET SESSION BINLOG_FORMAT=ROW;
SET GLOBAL  BINLOG_FORMAT=ROW;
CREATE TABLE t1 (a INT, b LONG) ENGINE=InnoDB;
INSERT INTO t1 VALUES (1,1), (2,2);
SELECT * FROM t1;
a	b
1	1
2	2
**** On Slave ****
INSERT INTO t1 VALUE (3,3);
SELECT * FROM t1;
a	b
1	1
2	2
3	3
**** On Master ****
TRUNCATE TABLE t1;
SELECT * FROM t1;
a	b
**** On Slave ****
SELECT * FROM t1;
a	b
**** On Master ****
DROP TABLE t1;
SHOW BINLOG EVENTS;
Log_name	Pos	Event_type	Server_id	End_log_pos	Info
master-bin.000001	4	Format_desc	1	103	Server ver: SERVER_VERSION, Binlog ver: 4
master-bin.000001	103	Query	1	211	use `test`; CREATE TABLE t1 (a INT, b LONG) ENGINE=InnoDB
master-bin.000001	211	Table_map	1	40	table_id: # (test.t1)
master-bin.000001	251	Write_rows	1	87	table_id: # flags: STMT_END_F
master-bin.000001	298	Xid	1	325	COMMIT /* xid= */
master-bin.000001	325	Query	1	80	use `test`; TRUNCATE TABLE t1
master-bin.000001	405	Xid	1	432	COMMIT /* xid= */
master-bin.000001	432	Query	1	508	use `test`; DROP TABLE t1
**** On Master ****
SET SESSION BINLOG_FORMAT=STATEMENT;
SET GLOBAL  BINLOG_FORMAT=STATEMENT;
CREATE TABLE t1 (a INT, b LONG) ENGINE=InnoDB;
INSERT INTO t1 VALUES (1,1), (2,2);
SELECT * FROM t1;
a	b
1	1
2	2
**** On Slave ****
INSERT INTO t1 VALUE (3,3);
SELECT * FROM t1;
a	b
1	1
2	2
3	3
**** On Master ****
DELETE FROM t1;
SELECT * FROM t1;
a	b
**** On Slave ****
SELECT * FROM t1;
a	b
**** On Master ****
DROP TABLE t1;
SHOW BINLOG EVENTS;
Log_name	Pos	Event_type	Server_id	End_log_pos	Info
master-bin.000001	4	Format_desc	1	103	Server ver: SERVER_VERSION, Binlog ver: 4
master-bin.000001	103	Query	1	211	use `test`; CREATE TABLE t1 (a INT, b LONG) ENGINE=InnoDB
master-bin.000001	211	Query	1	97	use `test`; INSERT INTO t1 VALUES (1,1), (2,2)
master-bin.000001	308	Xid	1	335	COMMIT /* xid= */
master-bin.000001	335	Query	1	77	use `test`; DELETE FROM t1
master-bin.000001	412	Xid	1	439	COMMIT /* xid= */
master-bin.000001	439	Query	1	515	use `test`; DROP TABLE t1
**** On Master ****
SET SESSION BINLOG_FORMAT=MIXED;
SET GLOBAL  BINLOG_FORMAT=MIXED;
CREATE TABLE t1 (a INT, b LONG) ENGINE=InnoDB;
INSERT INTO t1 VALUES (1,1), (2,2);
SELECT * FROM t1;
a	b
1	1
2	2
**** On Slave ****
INSERT INTO t1 VALUE (3,3);
SELECT * FROM t1;
a	b
1	1
2	2
3	3
**** On Master ****
DELETE FROM t1;
SELECT * FROM t1;
a	b
**** On Slave ****
SELECT * FROM t1;
a	b
**** On Master ****
DROP TABLE t1;
SHOW BINLOG EVENTS;
Log_name	Pos	Event_type	Server_id	End_log_pos	Info
master-bin.000001	4	Format_desc	1	103	Server ver: SERVER_VERSION, Binlog ver: 4
master-bin.000001	103	Query	1	211	use `test`; CREATE TABLE t1 (a INT, b LONG) ENGINE=InnoDB
master-bin.000001	211	Query	1	97	use `test`; INSERT INTO t1 VALUES (1,1), (2,2)
master-bin.000001	308	Xid	1	335	COMMIT /* xid= */
master-bin.000001	335	Query	1	77	use `test`; DELETE FROM t1
master-bin.000001	412	Xid	1	439	COMMIT /* xid= */
master-bin.000001	439	Query	1	515	use `test`; DROP TABLE t1
**** On Master ****
SET SESSION BINLOG_FORMAT=ROW;
SET GLOBAL  BINLOG_FORMAT=ROW;
CREATE TABLE t1 (a INT, b LONG) ENGINE=InnoDB;
INSERT INTO t1 VALUES (1,1), (2,2);
SELECT * FROM t1;
a	b
1	1
2	2
**** On Slave ****
INSERT INTO t1 VALUE (3,3);
SELECT * FROM t1;
a	b
1	1
2	2
3	3
**** On Master ****
DELETE FROM t1;
SELECT * FROM t1;
a	b
**** On Slave ****
SELECT * FROM t1;
a	b
3	3
**** On Master ****
DROP TABLE t1;
SHOW BINLOG EVENTS;
Log_name	Pos	Event_type	Server_id	End_log_pos	Info
master-bin.000001	4	Format_desc	1	103	Server ver: SERVER_VERSION, Binlog ver: 4
master-bin.000001	103	Query	1	211	use `test`; CREATE TABLE t1 (a INT, b LONG) ENGINE=InnoDB
master-bin.000001	211	Table_map	1	40	table_id: # (test.t1)
master-bin.000001	251	Write_rows	1	87	table_id: # flags: STMT_END_F
master-bin.000001	298	Xid	1	325	COMMIT /* xid= */
master-bin.000001	325	Table_map	1	40	table_id: # (test.t1)
master-bin.000001	365	Delete_rows	1	87	table_id: # flags: STMT_END_F
master-bin.000001	412	Xid	1	439	COMMIT /* xid= */
master-bin.000001	439	Query	1	515	use `test`; DROP TABLE t1
