stop slave;
drop table if exists t1,t2,t3,t4,t5,t6,t7,t8,t9;
reset master;
reset slave;
drop table if exists t1,t2,t3,t4,t5,t6,t7,t8,t9;
start slave;
**** On Master ****
SET SESSION BINLOG_FORMAT=STATEMENT;
SET GLOBAL  BINLOG_FORMAT=STATEMENT;
CREATE TABLE t1 (a INT, b LONG) ENGINE=MyISAM;
INSERT INTO t1 VALUES (1,1), (2,2);
SELECT * FROM t1;
a	b
1	1
2	2
**** On Slave ****
INSERT INTO t1 VALUE (3,3);
SELECT * FROM t1;
a	b
1	1
2	2
3	3
**** On Master ****
TRUNCATE TABLE t1;
SELECT * FROM t1;
a	b
**** On Slave ****
SELECT * FROM t1;
a	b
**** On Master ****
DROP TABLE t1;
SHOW BINLOG EVENTS;
Log_name	Pos	Event_type	Server_id	End_log_pos	Info
master-bin.000001	4	Format_desc	1	106	Server ver: SERVER_VERSION, Binlog ver: 4
master-bin.000001	106	Query	1	214	use `test`; CREATE TABLE t1 (a INT, b LONG) ENGINE=MyISAM
master-bin.000001	214	Query	1	311	use `test`; INSERT INTO t1 VALUES (1,1), (2,2)
master-bin.000001	311	Query	1	391	use `test`; TRUNCATE TABLE t1
master-bin.000001	391	Query	1	467	use `test`; DROP TABLE t1
**** On Master ****
SET SESSION BINLOG_FORMAT=MIXED;
SET GLOBAL  BINLOG_FORMAT=MIXED;
CREATE TABLE t1 (a INT, b LONG) ENGINE=MyISAM;
INSERT INTO t1 VALUES (1,1), (2,2);
SELECT * FROM t1;
a	b
1	1
2	2
**** On Slave ****
INSERT INTO t1 VALUE (3,3);
SELECT * FROM t1;
a	b
1	1
2	2
3	3
**** On Master ****
TRUNCATE TABLE t1;
SELECT * FROM t1;
a	b
**** On Slave ****
SELECT * FROM t1;
a	b
**** On Master ****
DROP TABLE t1;
SHOW BINLOG EVENTS;
Log_name	Pos	Event_type	Server_id	End_log_pos	Info
master-bin.000001	4	Format_desc	1	106	Server ver: SERVER_VERSION, Binlog ver: 4
master-bin.000001	106	Query	1	214	use `test`; CREATE TABLE t1 (a INT, b LONG) ENGINE=MyISAM
master-bin.000001	214	Query	1	311	use `test`; INSERT INTO t1 VALUES (1,1), (2,2)
master-bin.000001	311	Query	1	391	use `test`; TRUNCATE TABLE t1
master-bin.000001	391	Query	1	467	use `test`; DROP TABLE t1
**** On Master ****
SET SESSION BINLOG_FORMAT=ROW;
SET GLOBAL  BINLOG_FORMAT=ROW;
CREATE TABLE t1 (a INT, b LONG) ENGINE=MyISAM;
INSERT INTO t1 VALUES (1,1), (2,2);
SELECT * FROM t1;
a	b
1	1
2	2
**** On Slave ****
INSERT INTO t1 VALUE (3,3);
SELECT * FROM t1;
a	b
1	1
2	2
3	3
**** On Master ****
TRUNCATE TABLE t1;
SELECT * FROM t1;
a	b
**** On Slave ****
SELECT * FROM t1;
a	b
**** On Master ****
DROP TABLE t1;
SHOW BINLOG EVENTS;
Log_name	Pos	Event_type	Server_id	End_log_pos	Info
master-bin.000001	4	Format_desc	1	106	Server ver: SERVER_VERSION, Binlog ver: 4
master-bin.000001	106	Query	1	214	use `test`; CREATE TABLE t1 (a INT, b LONG) ENGINE=MyISAM
master-bin.000001	214	Table_map	1	254	table_id: # (test.t1)
master-bin.000001	254	Write_rows	1	301	table_id: # flags: STMT_END_F
master-bin.000001	301	Query	1	381	use `test`; TRUNCATE TABLE t1
master-bin.000001	381	Query	1	457	use `test`; DROP TABLE t1
**** On Master ****
SET SESSION BINLOG_FORMAT=STATEMENT;
SET GLOBAL  BINLOG_FORMAT=STATEMENT;
CREATE TABLE t1 (a INT, b LONG) ENGINE=MyISAM;
INSERT INTO t1 VALUES (1,1), (2,2);
SELECT * FROM t1;
a	b
1	1
2	2
**** On Slave ****
INSERT INTO t1 VALUE (3,3);
SELECT * FROM t1;
a	b
1	1
2	2
3	3
**** On Master ****
DELETE FROM t1;
SELECT * FROM t1;
a	b
**** On Slave ****
SELECT * FROM t1;
a	b
**** On Master ****
DROP TABLE t1;
SHOW BINLOG EVENTS;
Log_name	Pos	Event_type	Server_id	End_log_pos	Info
master-bin.000001	4	Format_desc	1	106	Server ver: SERVER_VERSION, Binlog ver: 4
master-bin.000001	106	Query	1	214	use `test`; CREATE TABLE t1 (a INT, b LONG) ENGINE=MyISAM
master-bin.000001	214	Query	1	311	use `test`; INSERT INTO t1 VALUES (1,1), (2,2)
master-bin.000001	311	Query	1	388	use `test`; DELETE FROM t1
master-bin.000001	388	Query	1	464	use `test`; DROP TABLE t1
**** On Master ****
SET SESSION BINLOG_FORMAT=MIXED;
SET GLOBAL  BINLOG_FORMAT=MIXED;
CREATE TABLE t1 (a INT, b LONG) ENGINE=MyISAM;
INSERT INTO t1 VALUES (1,1), (2,2);
SELECT * FROM t1;
a	b
1	1
2	2
**** On Slave ****
INSERT INTO t1 VALUE (3,3);
SELECT * FROM t1;
a	b
1	1
2	2
3	3
**** On Master ****
DELETE FROM t1;
SELECT * FROM t1;
a	b
**** On Slave ****
SELECT * FROM t1;
a	b
**** On Master ****
DROP TABLE t1;
SHOW BINLOG EVENTS;
Log_name	Pos	Event_type	Server_id	End_log_pos	Info
master-bin.000001	4	Format_desc	1	106	Server ver: SERVER_VERSION, Binlog ver: 4
master-bin.000001	106	Query	1	214	use `test`; CREATE TABLE t1 (a INT, b LONG) ENGINE=MyISAM
master-bin.000001	214	Query	1	311	use `test`; INSERT INTO t1 VALUES (1,1), (2,2)
master-bin.000001	311	Query	1	388	use `test`; DELETE FROM t1
master-bin.000001	388	Query	1	464	use `test`; DROP TABLE t1
**** On Master ****
SET SESSION BINLOG_FORMAT=ROW;
SET GLOBAL  BINLOG_FORMAT=ROW;
CREATE TABLE t1 (a INT, b LONG) ENGINE=MyISAM;
INSERT INTO t1 VALUES (1,1), (2,2);
SELECT * FROM t1;
a	b
1	1
2	2
**** On Slave ****
INSERT INTO t1 VALUE (3,3);
SELECT * FROM t1;
a	b
1	1
2	2
3	3
**** On Master ****
DELETE FROM t1;
SELECT * FROM t1;
a	b
**** On Slave ****
SELECT * FROM t1;
a	b
3	3
**** On Master ****
DROP TABLE t1;
SHOW BINLOG EVENTS;
Log_name	Pos	Event_type	Server_id	End_log_pos	Info
master-bin.000001	4	Format_desc	1	106	Server ver: SERVER_VERSION, Binlog ver: 4
master-bin.000001	106	Query	1	214	use `test`; CREATE TABLE t1 (a INT, b LONG) ENGINE=MyISAM
master-bin.000001	214	Table_map	1	254	table_id: # (test.t1)
master-bin.000001	254	Write_rows	1	301	table_id: # flags: STMT_END_F
master-bin.000001	301	Table_map	1	341	table_id: # (test.t1)
master-bin.000001	341	Delete_rows	1	388	table_id: # flags: STMT_END_F
master-bin.000001	388	Query	1	464	use `test`; DROP TABLE t1
