set optimizer_join_cache_level=6;
show variables like 'optimizer_join_cache_level';
Variable_name	Value
optimizer_join_cache_level	6
drop table if exists t0, t1, t2, t10, t11, t12;
create table t1 (a int not null, b int, primary key (a));
create table t2 (a int not null, primary key (a));
create table t3 (a int not null, b int, primary key (a));
insert into t1 values (1,10), (2,20), (3,30),  (4,40);
insert into t2 values (2), (3), (4), (5);
insert into t3 values (10,3), (20,4), (30,5);
select * from t2 where t2.a in (select a from t1);
a
2
3
4
explain extended select * from t2 where t2.a in (select a from t1);
id	select_type	table	type	possible_keys	key	key_len	ref	rows	filtered	Extra
1	PRIMARY	t2	index	PRIMARY	PRIMARY	4	NULL	4	100.00	Using index
1	PRIMARY	t1	index	PRIMARY	PRIMARY	4	NULL	4	75.00	Using where; Using index; Using join buffer (BNL, incremental buffers)
Warnings:
Note	1003	select `test`.`t2`.`a` AS `a` from `test`.`t1` join `test`.`t2` where (`test`.`t1`.`a` = `test`.`t2`.`a`)
select * from t2 where t2.a in (select a from t1 where t1.b <> 30);
a
2
4
explain extended select * from t2 where t2.a in (select a from t1 where t1.b <> 30);
id	select_type	table	type	possible_keys	key	key_len	ref	rows	filtered	Extra
1	PRIMARY	t2	index	PRIMARY	PRIMARY	4	NULL	4	100.00	Using index
1	PRIMARY	t1	ALL	PRIMARY	NULL	NULL	NULL	4	75.00	Using where; Using join buffer (BNL, incremental buffers)
Warnings:
Note	1003	select `test`.`t2`.`a` AS `a` from `test`.`t1` join `test`.`t2` where ((`test`.`t1`.`a` = `test`.`t2`.`a`) and (`test`.`t1`.`b` <> 30))
select * from t2 where t2.a in (select t1.a from t1,t3 where t1.b=t3.a);
a
2
3
explain extended select * from t2 where t2.a in (select t1.a from t1,t3 where t1.b=t3.a);
id	select_type	table	type	possible_keys	key	key_len	ref	rows	filtered	Extra
1	PRIMARY	t2	index	PRIMARY	PRIMARY	4	NULL	4	100.00	Using index
1	PRIMARY	t1	ALL	PRIMARY	NULL	NULL	NULL	4	75.00	Using where; Using join buffer (BNL, incremental buffers)
1	PRIMARY	t3	eq_ref	PRIMARY	PRIMARY	4	test.t1.b	1	100.00	Using index
Warnings:
Note	1003	select `test`.`t2`.`a` AS `a` from `test`.`t1` join `test`.`t3` join `test`.`t2` where ((`test`.`t1`.`a` = `test`.`t2`.`a`) and (`test`.`t3`.`a` = `test`.`t1`.`b`))
drop table t1, t2, t3;
create table t1 (a int, b int, index a (a,b));
create table t2 (a int, index a (a));
create table t3 (a int, b int, index a (a));
insert into t1 values (1,10), (2,20), (3,30), (4,40);
create table t0(a int);
insert into t0 values (0),(1),(2),(3),(4),(5),(6),(7),(8),(9);
insert into t1
select rand()*100000+200,rand()*100000 from t0 A, t0 B, t0 C, t0 D;
insert into t2 values (2), (3), (4), (5);
insert into t3 values (10,3), (20,4), (30,5);
select * from t2 where t2.a in (select a from t1);
a
2
3
4
explain extended select * from t2 where t2.a in (select a from t1);
id	select_type	table	type	possible_keys	key	key_len	ref	rows	filtered	Extra
1	PRIMARY	t2	index	a	a	5	NULL	4	100.00	Using where; Using index; Start temporary
1	PRIMARY	t1	ref	a	a	5	test.t2.a	101	100.00	Using index; End temporary
Warnings:
Note	1003	select `test`.`t2`.`a` AS `a` from `test`.`t2` semi join (`test`.`t1`) where (`test`.`t1`.`a` = `test`.`t2`.`a`)
select * from t2 where t2.a in (select a from t1 where t1.b <> 30);
a
2
4
explain extended select * from t2 where t2.a in (select a from t1 where t1.b <> 30);
id	select_type	table	type	possible_keys	key	key_len	ref	rows	filtered	Extra
1	PRIMARY	t2	index	a	a	5	NULL	4	100.00	Using where; Using index; Start temporary
1	PRIMARY	t1	ref	a	a	5	test.t2.a	101	100.00	Using where; Using index; End temporary
Warnings:
Note	1003	select `test`.`t2`.`a` AS `a` from `test`.`t2` semi join (`test`.`t1`) where ((`test`.`t1`.`a` = `test`.`t2`.`a`) and (`test`.`t1`.`b` <> 30))
select * from t2 where t2.a in (select t1.a from t1,t3 where t1.b=t3.a);
a
2
3
explain extended select * from t2 where t2.a in (select t1.a from t1,t3 where t1.b=t3.a);
id	select_type	table	type	possible_keys	key	key_len	ref	rows	filtered	Extra
1	PRIMARY	t3	index	a	a	5	NULL	3	100.00	Using where; Using index; Start temporary
1	PRIMARY	t2	index	a	a	5	NULL	4	100.00	Using where; Using index; Using join buffer (BNL, incremental buffers)
1	PRIMARY	t1	ref	a	a	10	test.t2.a,test.t3.a	116	100.00	Using index; End temporary
Warnings:
Note	1003	select `test`.`t2`.`a` AS `a` from `test`.`t2` semi join (`test`.`t1` join `test`.`t3`) where ((`test`.`t1`.`a` = `test`.`t2`.`a`) and (`test`.`t1`.`b` = `test`.`t3`.`a`))
insert into t1 values (3,31);
select * from t2 where t2.a in (select a from t1 where t1.b <> 30);
a
2
3
4
select * from t2 where t2.a in (select a from t1 where t1.b <> 30 and t1.b <> 31);
a
2
4
explain extended select * from t2 where t2.a in (select a from t1 where t1.b <> 30);
id	select_type	table	type	possible_keys	key	key_len	ref	rows	filtered	Extra
1	PRIMARY	t2	index	a	a	5	NULL	4	100.00	Using where; Using index; Start temporary
1	PRIMARY	t1	ref	a	a	5	test.t2.a	101	100.00	Using where; Using index; End temporary
Warnings:
Note	1003	select `test`.`t2`.`a` AS `a` from `test`.`t2` semi join (`test`.`t1`) where ((`test`.`t1`.`a` = `test`.`t2`.`a`) and (`test`.`t1`.`b` <> 30))
drop table t0, t1, t2, t3;
create table t0 (a int);
insert into t0 values (0),(1),(2),(3),(4),(5),(6),(7),(8),(9);
create table t1(a int, b int);
insert into t1 values (0,0),(1,1),(2,2);
create table t2 as select * from t1;
create table t11(a int, b int);
create table t10 (pk int, a int, primary key(pk));
insert into t10 select a,a from t0;
create table t12 like t10;
insert into t12 select * from t10;
Flattened because of dependency, t10=func(t1)
explain select * from t1 where a in (select pk from t10);
id	select_type	table	type	possible_keys	key	key_len	ref	rows	Extra
1	PRIMARY	t1	ALL	NULL	NULL	NULL	NULL	3	Using where
1	PRIMARY	t10	eq_ref	PRIMARY	PRIMARY	4	test.t1.a	1	Using index
select * from t1 where a in (select pk from t10);
a	b
0	0
1	1
2	2
A confluent case of dependency
explain select * from t1 where a in (select a from t10 where pk=12);
id	select_type	table	type	possible_keys	key	key_len	ref	rows	Extra
1	PRIMARY	NULL	NULL	NULL	NULL	NULL	NULL	NULL	Impossible WHERE noticed after reading const tables
select * from t1 where a in (select a from t10 where pk=12);
a	b
explain select * from t1 where a in (select a from t10 where pk=9);
id	select_type	table	type	possible_keys	key	key_len	ref	rows	Extra
1	PRIMARY	t10	const	PRIMARY	PRIMARY	4	const	1	
1	PRIMARY	t1	ALL	NULL	NULL	NULL	NULL	3	Using where
select * from t1 where a in (select a from t10 where pk=9);
a	b
An empty table inside
explain select * from t1 where a in (select a from t11);
id	select_type	table	type	possible_keys	key	key_len	ref	rows	Extra
1	PRIMARY	NULL	NULL	NULL	NULL	NULL	NULL	NULL	Impossible WHERE noticed after reading const tables
select * from t1 where a in (select a from t11);
a	b
explain select * from t1 where a in (select pk from t10) and b in (select pk from t10);
id	select_type	table	type	possible_keys	key	key_len	ref	rows	Extra
1	PRIMARY	t1	ALL	NULL	NULL	NULL	NULL	3	Using where
1	PRIMARY	t10	eq_ref	PRIMARY	PRIMARY	4	test.t1.a	1	Using index
1	PRIMARY	t10	eq_ref	PRIMARY	PRIMARY	4	test.t1.b	1	Using index
select * from t1 where a in (select pk from t10) and b in (select pk from t10);
a	b
0	0
1	1
2	2
flattening a nested subquery
explain select * from t1 where a in (select pk from t10 where t10.a in (select pk from t12));
id	select_type	table	type	possible_keys	key	key_len	ref	rows	Extra
1	PRIMARY	t1	ALL	NULL	NULL	NULL	NULL	3	Using where
1	PRIMARY	t10	eq_ref	PRIMARY	PRIMARY	4	test.t1.a	1	Using where
1	PRIMARY	t12	eq_ref	PRIMARY	PRIMARY	4	test.t10.a	1	Using index
select * from t1 where a in (select pk from t10 where t10.a in (select pk from t12));
a	b
0	0
1	1
2	2
flattening subquery w/ several tables
explain extended select * from t1 where a in (select t10.pk from t10, t12 where t12.pk=t10.a);
id	select_type	table	type	possible_keys	key	key_len	ref	rows	filtered	Extra
1	PRIMARY	t1	ALL	NULL	NULL	NULL	NULL	3	100.00	Using where
1	PRIMARY	t10	eq_ref	PRIMARY	PRIMARY	4	test.t1.a	1	100.00	Using where
1	PRIMARY	t12	eq_ref	PRIMARY	PRIMARY	4	test.t10.a	1	100.00	Using index
Warnings:
Note	1003	select `test`.`t1`.`a` AS `a`,`test`.`t1`.`b` AS `b` from `test`.`t10` join `test`.`t12` join `test`.`t1` where ((`test`.`t10`.`pk` = `test`.`t1`.`a`) and (`test`.`t12`.`pk` = `test`.`t10`.`a`))
subqueries within outer joins go into ON expr.
explAin extended
select * from t1 left join (t2 A, t2 B) on ( A.A= t1.A And B.A in (select pk from t10));
id	select_type	tABle	type	possiBle_keys	key	key_len	ref	rows	filtered	ExtrA
1	PRIMARY	t1	ALL	NULL	NULL	NULL	NULL	3	100.00	
1	PRIMARY	A	ALL	NULL	NULL	NULL	NULL	3	100.00	Using where; Using join Buffer (BNL, incrementAl Buffers)
1	PRIMARY	B	ALL	NULL	NULL	NULL	NULL	3	100.00	Using where; Using join Buffer (BNL, incrementAl Buffers)
2	DEPENDENT SUBQUERY	t10	unique_suBquery	PRIMARY	PRIMARY	4	func	1	100.00	Using index
Warnings:
Note	1003	select `test`.`t1`.`A` AS `A`,`test`.`t1`.`B` AS `B`,`test`.`A`.`A` AS `A`,`test`.`A`.`B` AS `B`,`test`.`B`.`A` AS `A`,`test`.`B`.`B` AS `B` from `test`.`t1` left join (`test`.`t2` `A` join `test`.`t2` `B`) on(((`test`.`A`.`A` = `test`.`t1`.`A`) And <in_optimizer>(`test`.`B`.`A`,<exists>(<primAry_index_lookup>(<cAche>(`test`.`B`.`A`) in t10 on PRIMARY))))) where 1
t2 should be wrapped into OJ-nest, so we have "t1 LJ (t2 J t10)"
explAin extended
select * from t1 left join t2 on (t2.A= t1.A And t2.A in (select pk from t10));
id	select_type	tABle	type	possiBle_keys	key	key_len	ref	rows	filtered	ExtrA
1	PRIMARY	t1	ALL	NULL	NULL	NULL	NULL	3	100.00	
1	PRIMARY	t2	ALL	NULL	NULL	NULL	NULL	3	100.00	Using where; Using join Buffer (BNL, incrementAl Buffers)
2	DEPENDENT SUBQUERY	t10	unique_suBquery	PRIMARY	PRIMARY	4	func	1	100.00	Using index
Warnings:
Note	1003	select `test`.`t1`.`A` AS `A`,`test`.`t1`.`B` AS `B`,`test`.`t2`.`A` AS `A`,`test`.`t2`.`B` AS `B` from `test`.`t1` left join `test`.`t2` on(((`test`.`t2`.`A` = `test`.`t1`.`A`) And <in_optimizer>(`test`.`t2`.`A`,<exists>(<primAry_index_lookup>(<cAche>(`test`.`t2`.`A`) in t10 on PRIMARY))))) where 1
we shouldn't flatten if we're going to get a join of > MAX_TABLES.
explain select * from 
t1 s00, t1 s01,  t1 s02, t1 s03, t1 s04,t1 s05,t1 s06,t1 s07,t1 s08,t1 s09,
t1 s10, t1 s11,  t1 s12, t1 s13, t1 s14,t1 s15,t1 s16,t1 s17,t1 s18,t1 s19,
t1 s20, t1 s21,  t1 s22, t1 s23, t1 s24,t1 s25,t1 s26,t1 s27,t1 s28,t1 s29,
t1 s30, t1 s31,  t1 s32, t1 s33, t1 s34,t1 s35,t1 s36,t1 s37,t1 s38,t1 s39,
t1 s40, t1 s41,  t1 s42, t1 s43, t1 s44,t1 s45,t1 s46,t1 s47,t1 s48,t1 s49
where
s00.a in (
select m00.a from
t1 m00, t1 m01,  t1 m02, t1 m03, t1 m04,t1 m05,t1 m06,t1 m07,t1 m08,t1 m09,
t1 m10, t1 m11,  t1 m12, t1 m13, t1 m14,t1 m15,t1 m16,t1 m17,t1 m18,t1 m19
);
id	select_type	table	type	possible_keys	key	key_len	ref	rows	Extra
1	PRIMARY	s00	ALL	NULL	NULL	NULL	NULL	3	Using where
1	PRIMARY	s01	ALL	NULL	NULL	NULL	NULL	3	Using join buffer (BNL, incremental buffers)
1	PRIMARY	s02	ALL	NULL	NULL	NULL	NULL	3	Using join buffer (BNL, incremental buffers)
1	PRIMARY	s03	ALL	NULL	NULL	NULL	NULL	3	Using join buffer (BNL, incremental buffers)
1	PRIMARY	s04	ALL	NULL	NULL	NULL	NULL	3	Using join buffer (BNL, incremental buffers)
1	PRIMARY	s05	ALL	NULL	NULL	NULL	NULL	3	Using join buffer (BNL, incremental buffers)
1	PRIMARY	s06	ALL	NULL	NULL	NULL	NULL	3	Using join buffer (BNL, incremental buffers)
1	PRIMARY	s07	ALL	NULL	NULL	NULL	NULL	3	Using join buffer (BNL, incremental buffers)
1	PRIMARY	s08	ALL	NULL	NULL	NULL	NULL	3	Using join buffer (BNL, incremental buffers)
1	PRIMARY	s09	ALL	NULL	NULL	NULL	NULL	3	Using join buffer (BNL, incremental buffers)
1	PRIMARY	s10	ALL	NULL	NULL	NULL	NULL	3	Using join buffer (BNL, incremental buffers)
1	PRIMARY	s11	ALL	NULL	NULL	NULL	NULL	3	Using join buffer (BNL, incremental buffers)
1	PRIMARY	s12	ALL	NULL	NULL	NULL	NULL	3	Using join buffer (BNL, incremental buffers)
1	PRIMARY	s13	ALL	NULL	NULL	NULL	NULL	3	Using join buffer (BNL, incremental buffers)
1	PRIMARY	s14	ALL	NULL	NULL	NULL	NULL	3	Using join buffer (BNL, incremental buffers)
1	PRIMARY	s15	ALL	NULL	NULL	NULL	NULL	3	Using join buffer (BNL, incremental buffers)
1	PRIMARY	s16	ALL	NULL	NULL	NULL	NULL	3	Using join buffer (BNL, incremental buffers)
1	PRIMARY	s17	ALL	NULL	NULL	NULL	NULL	3	Using join buffer (BNL, incremental buffers)
1	PRIMARY	s18	ALL	NULL	NULL	NULL	NULL	3	Using join buffer (BNL, incremental buffers)
1	PRIMARY	s19	ALL	NULL	NULL	NULL	NULL	3	Using join buffer (BNL, incremental buffers)
1	PRIMARY	s20	ALL	NULL	NULL	NULL	NULL	3	Using join buffer (BNL, incremental buffers)
1	PRIMARY	s21	ALL	NULL	NULL	NULL	NULL	3	Using join buffer (BNL, incremental buffers)
1	PRIMARY	s22	ALL	NULL	NULL	NULL	NULL	3	Using join buffer (BNL, incremental buffers)
1	PRIMARY	s23	ALL	NULL	NULL	NULL	NULL	3	Using join buffer (BNL, incremental buffers)
1	PRIMARY	s24	ALL	NULL	NULL	NULL	NULL	3	Using join buffer (BNL, incremental buffers)
1	PRIMARY	s25	ALL	NULL	NULL	NULL	NULL	3	Using join buffer (BNL, incremental buffers)
1	PRIMARY	s26	ALL	NULL	NULL	NULL	NULL	3	Using join buffer (BNL, incremental buffers)
1	PRIMARY	s27	ALL	NULL	NULL	NULL	NULL	3	Using join buffer (BNL, incremental buffers)
1	PRIMARY	s28	ALL	NULL	NULL	NULL	NULL	3	Using join buffer (BNL, incremental buffers)
1	PRIMARY	s29	ALL	NULL	NULL	NULL	NULL	3	Using join buffer (BNL, incremental buffers)
1	PRIMARY	s30	ALL	NULL	NULL	NULL	NULL	3	Using join buffer (BNL, incremental buffers)
1	PRIMARY	s31	ALL	NULL	NULL	NULL	NULL	3	Using join buffer (BNL, incremental buffers)
1	PRIMARY	s32	ALL	NULL	NULL	NULL	NULL	3	Using join buffer (BNL, incremental buffers)
1	PRIMARY	s33	ALL	NULL	NULL	NULL	NULL	3	Using join buffer (BNL, incremental buffers)
1	PRIMARY	s34	ALL	NULL	NULL	NULL	NULL	3	Using join buffer (BNL, incremental buffers)
1	PRIMARY	s35	ALL	NULL	NULL	NULL	NULL	3	Using join buffer (BNL, incremental buffers)
1	PRIMARY	s36	ALL	NULL	NULL	NULL	NULL	3	Using join buffer (BNL, incremental buffers)
1	PRIMARY	s37	ALL	NULL	NULL	NULL	NULL	3	Using join buffer (BNL, incremental buffers)
1	PRIMARY	s38	ALL	NULL	NULL	NULL	NULL	3	Using join buffer (BNL, incremental buffers)
1	PRIMARY	s39	ALL	NULL	NULL	NULL	NULL	3	Using join buffer (BNL, incremental buffers)
1	PRIMARY	s40	ALL	NULL	NULL	NULL	NULL	3	Using join buffer (BNL, incremental buffers)
1	PRIMARY	s41	ALL	NULL	NULL	NULL	NULL	3	Using join buffer (BNL, incremental buffers)
1	PRIMARY	s42	ALL	NULL	NULL	NULL	NULL	3	Using join buffer (BNL, incremental buffers)
1	PRIMARY	s43	ALL	NULL	NULL	NULL	NULL	3	Using join buffer (BNL, incremental buffers)
1	PRIMARY	s44	ALL	NULL	NULL	NULL	NULL	3	Using join buffer (BNL, incremental buffers)
1	PRIMARY	s45	ALL	NULL	NULL	NULL	NULL	3	Using join buffer (BNL, incremental buffers)
1	PRIMARY	s46	ALL	NULL	NULL	NULL	NULL	3	Using join buffer (BNL, incremental buffers)
1	PRIMARY	s47	ALL	NULL	NULL	NULL	NULL	3	Using join buffer (BNL, incremental buffers)
1	PRIMARY	s48	ALL	NULL	NULL	NULL	NULL	3	Using join buffer (BNL, incremental buffers)
1	PRIMARY	s49	ALL	NULL	NULL	NULL	NULL	3	Using join buffer (BNL, incremental buffers)
2	DEPENDENT SUBQUERY	m00	ALL	NULL	NULL	NULL	NULL	3	Using where
2	DEPENDENT SUBQUERY	m01	ALL	NULL	NULL	NULL	NULL	3	Using join buffer (BNL, incremental buffers)
2	DEPENDENT SUBQUERY	m02	ALL	NULL	NULL	NULL	NULL	3	Using join buffer (BNL, incremental buffers)
2	DEPENDENT SUBQUERY	m03	ALL	NULL	NULL	NULL	NULL	3	Using join buffer (BNL, incremental buffers)
2	DEPENDENT SUBQUERY	m04	ALL	NULL	NULL	NULL	NULL	3	Using join buffer (BNL, incremental buffers)
2	DEPENDENT SUBQUERY	m05	ALL	NULL	NULL	NULL	NULL	3	Using join buffer (BNL, incremental buffers)
2	DEPENDENT SUBQUERY	m06	ALL	NULL	NULL	NULL	NULL	3	Using join buffer (BNL, incremental buffers)
2	DEPENDENT SUBQUERY	m07	ALL	NULL	NULL	NULL	NULL	3	Using join buffer (BNL, incremental buffers)
2	DEPENDENT SUBQUERY	m08	ALL	NULL	NULL	NULL	NULL	3	Using join buffer (BNL, incremental buffers)
2	DEPENDENT SUBQUERY	m09	ALL	NULL	NULL	NULL	NULL	3	Using join buffer (BNL, incremental buffers)
2	DEPENDENT SUBQUERY	m10	ALL	NULL	NULL	NULL	NULL	3	Using join buffer (BNL, incremental buffers)
2	DEPENDENT SUBQUERY	m11	ALL	NULL	NULL	NULL	NULL	3	Using join buffer (BNL, incremental buffers)
2	DEPENDENT SUBQUERY	m12	ALL	NULL	NULL	NULL	NULL	3	Using join buffer (BNL, incremental buffers)
2	DEPENDENT SUBQUERY	m13	ALL	NULL	NULL	NULL	NULL	3	Using join buffer (BNL, incremental buffers)
2	DEPENDENT SUBQUERY	m14	ALL	NULL	NULL	NULL	NULL	3	Using join buffer (BNL, incremental buffers)
2	DEPENDENT SUBQUERY	m15	ALL	NULL	NULL	NULL	NULL	3	Using join buffer (BNL, incremental buffers)
2	DEPENDENT SUBQUERY	m16	ALL	NULL	NULL	NULL	NULL	3	Using join buffer (BNL, incremental buffers)
2	DEPENDENT SUBQUERY	m17	ALL	NULL	NULL	NULL	NULL	3	Using join buffer (BNL, incremental buffers)
2	DEPENDENT SUBQUERY	m18	ALL	NULL	NULL	NULL	NULL	3	Using join buffer (BNL, incremental buffers)
2	DEPENDENT SUBQUERY	m19	ALL	NULL	NULL	NULL	NULL	3	Using where; Using join buffer (BNL, incremental buffers)
select * from
t1 left join t2 on (t2.a= t1.a and t2.a in (select pk from t10)) 
where t1.a < 5;
a	b	a	b
0	0	0	0
1	1	1	1
2	2	2	2
prepare s1 from
' select * from
    t1 left join t2 on (t2.a= t1.a and t2.a in (select pk from t10))
  where t1.a < 5';
execute s1;
a	b	a	b
0	0	0	0
1	1	1	1
2	2	2	2
execute s1;
a	b	a	b
0	0	0	0
1	1	1	1
2	2	2	2
insert into t1 select (A.a + 10 * B.a),1 from t0 A, t0 B;
explain extended select * from t1 where a in (select pk from t10 where pk<3);
id	select_type	table	type	possible_keys	key	key_len	ref	rows	filtered	Extra
1	PRIMARY	t10	range	PRIMARY	PRIMARY	4	NULL	4	100.00	Using where; Using index
1	PRIMARY	t1	ALL	NULL	NULL	NULL	NULL	103	100.00	Using where; Using join buffer (BNL, incremental buffers)
Warnings:
Note	1003	select `test`.`t1`.`a` AS `a`,`test`.`t1`.`b` AS `b` from `test`.`t10` join `test`.`t1` where ((`test`.`t1`.`a` = `test`.`t10`.`pk`) and (`test`.`t10`.`pk` < 3))
drop table t0, t1, t2;
drop table t10, t11, t12;
#
# Check that subqueries with outer joins or straight_join work for 
# different permutations of const and non-const tables.  (Ref. Bug#46692)
#
CREATE TABLE t1 (i INTEGER);
CREATE TABLE t2 (i INTEGER);
CREATE TABLE t3 (i INTEGER);
SELECT (SELECT COUNT(*) from t1),
(SELECT COUNT(*) from t2),
(SELECT COUNT(*) from t3);
(SELECT COUNT(*) from t1)	(SELECT COUNT(*) from t2)	(SELECT COUNT(*) from t3)
0	0	0
EXPLAIN SELECT * FROM t1 WHERE (t1.i) IN 
(SELECT t3.i FROM t2 LEFT JOIN t3 ON t2.i=t3.i);
id	select_type	table	type	possible_keys	key	key_len	ref	rows	Extra
1	PRIMARY	NULL	NULL	NULL	NULL	NULL	NULL	NULL	Impossible WHERE noticed after reading const tables
SELECT * FROM t1 WHERE (t1.i) IN 
(SELECT t3.i FROM t2 LEFT JOIN t3 ON t2.i=t3.i);
i
EXPLAIN SELECT * FROM t1 WHERE (t1.i) IN 
(SELECT t3.i FROM t2 RIGHT JOIN t3 ON t2.i=t3.i);
id	select_type	table	type	possible_keys	key	key_len	ref	rows	Extra
1	PRIMARY	NULL	NULL	NULL	NULL	NULL	NULL	NULL	Impossible WHERE noticed after reading const tables
SELECT * FROM t1 WHERE (t1.i) IN 
(SELECT t3.i FROM t2 RIGHT JOIN t3 ON t2.i=t3.i);
i
EXPLAIN SELECT * FROM t1 WHERE (t1.i) IN 
(SELECT t3.i FROM t2 STRAIGHT_JOIN t3);
id	select_type	table	type	possible_keys	key	key_len	ref	rows	Extra
1	PRIMARY	NULL	NULL	NULL	NULL	NULL	NULL	NULL	Impossible WHERE noticed after reading const tables
SELECT * FROM t1 WHERE (t1.i) IN 
(SELECT t3.i FROM t2 STRAIGHT_JOIN t3);
i
EXPLAIN SELECT * FROM t1 WHERE (11) IN 
(SELECT t3.i FROM t2 LEFT JOIN t3 ON t2.i=t3.i);
id	select_type	table	type	possible_keys	key	key_len	ref	rows	Extra
1	PRIMARY	NULL	NULL	NULL	NULL	NULL	NULL	NULL	Impossible WHERE noticed after reading const tables
SELECT * FROM t1 WHERE (11) IN 
(SELECT t3.i FROM t2 LEFT JOIN t3 ON t2.i=t3.i);
i
EXPLAIN SELECT * FROM t1 WHERE (11) IN 
(SELECT t3.i FROM t2 LEFT JOIN t3 ON t2.i=t3.i WHERE t1.i);
id	select_type	table	type	possible_keys	key	key_len	ref	rows	Extra
1	PRIMARY	NULL	NULL	NULL	NULL	NULL	NULL	NULL	Impossible WHERE noticed after reading const tables
SELECT * FROM t1 WHERE (11) IN 
(SELECT t3.i FROM t2 LEFT JOIN t3 ON t2.i=t3.i WHERE t1.i);
i
EXPLAIN SELECT * FROM t1 WHERE (11) IN 
(SELECT t3.i FROM t2 RIGHT JOIN t3 ON t2.i=t3.i);
id	select_type	table	type	possible_keys	key	key_len	ref	rows	Extra
1	PRIMARY	NULL	NULL	NULL	NULL	NULL	NULL	NULL	Impossible WHERE noticed after reading const tables
SELECT * FROM t1 WHERE (11) IN 
(SELECT t3.i FROM t2 RIGHT JOIN t3 ON t2.i=t3.i);
i
EXPLAIN SELECT * FROM t1 WHERE (11) IN 
(SELECT t3.i FROM t2 STRAIGHT_JOIN t3);
id	select_type	table	type	possible_keys	key	key_len	ref	rows	Extra
1	PRIMARY	NULL	NULL	NULL	NULL	NULL	NULL	NULL	Impossible WHERE noticed after reading const tables
SELECT * FROM t1 WHERE (11) IN 
(SELECT t3.i FROM t2 STRAIGHT_JOIN t3);
i
INSERT INTO t3 VALUES (2);
SELECT (SELECT COUNT(*) from t1),
(SELECT COUNT(*) from t2),
(SELECT COUNT(*) from t3);
(SELECT COUNT(*) from t1)	(SELECT COUNT(*) from t2)	(SELECT COUNT(*) from t3)
0	0	1
EXPLAIN SELECT * FROM t1 WHERE (t1.i) IN 
(SELECT t3.i FROM t2 LEFT JOIN t3 ON t2.i=t3.i);
id	select_type	table	type	possible_keys	key	key_len	ref	rows	Extra
1	PRIMARY	NULL	NULL	NULL	NULL	NULL	NULL	NULL	Impossible WHERE noticed after reading const tables
SELECT * FROM t1 WHERE (t1.i) IN 
(SELECT t3.i FROM t2 LEFT JOIN t3 ON t2.i=t3.i);
i
EXPLAIN SELECT * FROM t1 WHERE (t1.i) IN 
(SELECT t3.i FROM t2 RIGHT JOIN t3 ON t2.i=t3.i);
id	select_type	table	type	possible_keys	key	key_len	ref	rows	Extra
1	PRIMARY	NULL	NULL	NULL	NULL	NULL	NULL	NULL	Impossible WHERE noticed after reading const tables
SELECT * FROM t1 WHERE (t1.i) IN 
(SELECT t3.i FROM t2 RIGHT JOIN t3 ON t2.i=t3.i);
i
EXPLAIN SELECT * FROM t1 WHERE (t1.i) IN 
(SELECT t3.i FROM t2 STRAIGHT_JOIN t3);
id	select_type	table	type	possible_keys	key	key_len	ref	rows	Extra
1	PRIMARY	NULL	NULL	NULL	NULL	NULL	NULL	NULL	Impossible WHERE noticed after reading const tables
SELECT * FROM t1 WHERE (t1.i) IN 
(SELECT t3.i FROM t2 STRAIGHT_JOIN t3);
i
EXPLAIN SELECT * FROM t1 WHERE (11) IN 
(SELECT t3.i FROM t2 LEFT JOIN t3 ON t2.i=t3.i);
id	select_type	table	type	possible_keys	key	key_len	ref	rows	Extra
1	PRIMARY	NULL	NULL	NULL	NULL	NULL	NULL	NULL	Impossible WHERE noticed after reading const tables
SELECT * FROM t1 WHERE (11) IN 
(SELECT t3.i FROM t2 LEFT JOIN t3 ON t2.i=t3.i);
i
EXPLAIN SELECT * FROM t1 WHERE (11) IN 
(SELECT t3.i FROM t2 LEFT JOIN t3 ON t2.i=t3.i WHERE t1.i);
id	select_type	table	type	possible_keys	key	key_len	ref	rows	Extra
1	PRIMARY	NULL	NULL	NULL	NULL	NULL	NULL	NULL	Impossible WHERE noticed after reading const tables
SELECT * FROM t1 WHERE (11) IN 
(SELECT t3.i FROM t2 LEFT JOIN t3 ON t2.i=t3.i WHERE t1.i);
i
EXPLAIN SELECT * FROM t1 WHERE (11) IN 
(SELECT t3.i FROM t2 RIGHT JOIN t3 ON t2.i=t3.i);
id	select_type	table	type	possible_keys	key	key_len	ref	rows	Extra
1	PRIMARY	NULL	NULL	NULL	NULL	NULL	NULL	NULL	Impossible WHERE noticed after reading const tables
SELECT * FROM t1 WHERE (11) IN 
(SELECT t3.i FROM t2 RIGHT JOIN t3 ON t2.i=t3.i);
i
EXPLAIN SELECT * FROM t1 WHERE (11) IN 
(SELECT t3.i FROM t2 STRAIGHT_JOIN t3);
id	select_type	table	type	possible_keys	key	key_len	ref	rows	Extra
1	PRIMARY	NULL	NULL	NULL	NULL	NULL	NULL	NULL	Impossible WHERE noticed after reading const tables
SELECT * FROM t1 WHERE (11) IN 
(SELECT t3.i FROM t2 STRAIGHT_JOIN t3);
i
INSERT INTO t3 VALUES (1);
SELECT (SELECT COUNT(*) from t1),
(SELECT COUNT(*) from t2),
(SELECT COUNT(*) from t3);
(SELECT COUNT(*) from t1)	(SELECT COUNT(*) from t2)	(SELECT COUNT(*) from t3)
0	0	2
EXPLAIN SELECT * FROM t1 WHERE (t1.i) IN 
(SELECT t3.i FROM t2 LEFT JOIN t3 ON t2.i=t3.i);
id	select_type	table	type	possible_keys	key	key_len	ref	rows	Extra
1	PRIMARY	NULL	NULL	NULL	NULL	NULL	NULL	NULL	Impossible WHERE noticed after reading const tables
SELECT * FROM t1 WHERE (t1.i) IN 
(SELECT t3.i FROM t2 LEFT JOIN t3 ON t2.i=t3.i);
i
EXPLAIN SELECT * FROM t1 WHERE (t1.i) IN 
(SELECT t3.i FROM t2 RIGHT JOIN t3 ON t2.i=t3.i);
id	select_type	table	type	possible_keys	key	key_len	ref	rows	Extra
1	PRIMARY	NULL	NULL	NULL	NULL	NULL	NULL	NULL	Impossible WHERE noticed after reading const tables
SELECT * FROM t1 WHERE (t1.i) IN 
(SELECT t3.i FROM t2 RIGHT JOIN t3 ON t2.i=t3.i);
i
EXPLAIN SELECT * FROM t1 WHERE (t1.i) IN 
(SELECT t3.i FROM t2 STRAIGHT_JOIN t3);
id	select_type	table	type	possible_keys	key	key_len	ref	rows	Extra
1	PRIMARY	NULL	NULL	NULL	NULL	NULL	NULL	NULL	Impossible WHERE noticed after reading const tables
SELECT * FROM t1 WHERE (t1.i) IN 
(SELECT t3.i FROM t2 STRAIGHT_JOIN t3);
i
EXPLAIN SELECT * FROM t1 WHERE (11) IN 
(SELECT t3.i FROM t2 LEFT JOIN t3 ON t2.i=t3.i);
id	select_type	table	type	possible_keys	key	key_len	ref	rows	Extra
1	PRIMARY	NULL	NULL	NULL	NULL	NULL	NULL	NULL	Impossible WHERE noticed after reading const tables
SELECT * FROM t1 WHERE (11) IN 
(SELECT t3.i FROM t2 LEFT JOIN t3 ON t2.i=t3.i);
i
EXPLAIN SELECT * FROM t1 WHERE (11) IN 
(SELECT t3.i FROM t2 LEFT JOIN t3 ON t2.i=t3.i WHERE t1.i);
id	select_type	table	type	possible_keys	key	key_len	ref	rows	Extra
1	PRIMARY	NULL	NULL	NULL	NULL	NULL	NULL	NULL	Impossible WHERE noticed after reading const tables
SELECT * FROM t1 WHERE (11) IN 
(SELECT t3.i FROM t2 LEFT JOIN t3 ON t2.i=t3.i WHERE t1.i);
i
EXPLAIN SELECT * FROM t1 WHERE (11) IN 
(SELECT t3.i FROM t2 RIGHT JOIN t3 ON t2.i=t3.i);
id	select_type	table	type	possible_keys	key	key_len	ref	rows	Extra
1	PRIMARY	NULL	NULL	NULL	NULL	NULL	NULL	NULL	Impossible WHERE noticed after reading const tables
SELECT * FROM t1 WHERE (11) IN 
(SELECT t3.i FROM t2 RIGHT JOIN t3 ON t2.i=t3.i);
i
EXPLAIN SELECT * FROM t1 WHERE (11) IN 
(SELECT t3.i FROM t2 STRAIGHT_JOIN t3);
id	select_type	table	type	possible_keys	key	key_len	ref	rows	Extra
1	PRIMARY	NULL	NULL	NULL	NULL	NULL	NULL	NULL	Impossible WHERE noticed after reading const tables
SELECT * FROM t1 WHERE (11) IN 
(SELECT t3.i FROM t2 STRAIGHT_JOIN t3);
i
INSERT INTO t3 VALUES (0);
DELETE FROM t3;
INSERT INTO t2 VALUES (2);
SELECT (SELECT COUNT(*) from t1),
(SELECT COUNT(*) from t2),
(SELECT COUNT(*) from t3);
(SELECT COUNT(*) from t1)	(SELECT COUNT(*) from t2)	(SELECT COUNT(*) from t3)
0	1	0
EXPLAIN SELECT * FROM t1 WHERE (t1.i) IN 
(SELECT t3.i FROM t2 LEFT JOIN t3 ON t2.i=t3.i);
id	select_type	table	type	possible_keys	key	key_len	ref	rows	Extra
1	PRIMARY	NULL	NULL	NULL	NULL	NULL	NULL	NULL	Impossible WHERE noticed after reading const tables
SELECT * FROM t1 WHERE (t1.i) IN 
(SELECT t3.i FROM t2 LEFT JOIN t3 ON t2.i=t3.i);
i
EXPLAIN SELECT * FROM t1 WHERE (t1.i) IN 
(SELECT t3.i FROM t2 RIGHT JOIN t3 ON t2.i=t3.i);
id	select_type	table	type	possible_keys	key	key_len	ref	rows	Extra
1	PRIMARY	NULL	NULL	NULL	NULL	NULL	NULL	NULL	Impossible WHERE noticed after reading const tables
SELECT * FROM t1 WHERE (t1.i) IN 
(SELECT t3.i FROM t2 RIGHT JOIN t3 ON t2.i=t3.i);
i
EXPLAIN SELECT * FROM t1 WHERE (t1.i) IN 
(SELECT t3.i FROM t2 STRAIGHT_JOIN t3);
id	select_type	table	type	possible_keys	key	key_len	ref	rows	Extra
1	PRIMARY	NULL	NULL	NULL	NULL	NULL	NULL	NULL	Impossible WHERE noticed after reading const tables
SELECT * FROM t1 WHERE (t1.i) IN 
(SELECT t3.i FROM t2 STRAIGHT_JOIN t3);
i
EXPLAIN SELECT * FROM t1 WHERE (11) IN 
(SELECT t3.i FROM t2 LEFT JOIN t3 ON t2.i=t3.i);
id	select_type	table	type	possible_keys	key	key_len	ref	rows	Extra
1	PRIMARY	NULL	NULL	NULL	NULL	NULL	NULL	NULL	Impossible WHERE noticed after reading const tables
SELECT * FROM t1 WHERE (11) IN 
(SELECT t3.i FROM t2 LEFT JOIN t3 ON t2.i=t3.i);
i
EXPLAIN SELECT * FROM t1 WHERE (11) IN 
(SELECT t3.i FROM t2 LEFT JOIN t3 ON t2.i=t3.i WHERE t1.i);
id	select_type	table	type	possible_keys	key	key_len	ref	rows	Extra
1	PRIMARY	NULL	NULL	NULL	NULL	NULL	NULL	NULL	Impossible WHERE noticed after reading const tables
SELECT * FROM t1 WHERE (11) IN 
(SELECT t3.i FROM t2 LEFT JOIN t3 ON t2.i=t3.i WHERE t1.i);
i
EXPLAIN SELECT * FROM t1 WHERE (11) IN 
(SELECT t3.i FROM t2 RIGHT JOIN t3 ON t2.i=t3.i);
id	select_type	table	type	possible_keys	key	key_len	ref	rows	Extra
1	PRIMARY	NULL	NULL	NULL	NULL	NULL	NULL	NULL	Impossible WHERE noticed after reading const tables
SELECT * FROM t1 WHERE (11) IN 
(SELECT t3.i FROM t2 RIGHT JOIN t3 ON t2.i=t3.i);
i
EXPLAIN SELECT * FROM t1 WHERE (11) IN 
(SELECT t3.i FROM t2 STRAIGHT_JOIN t3);
id	select_type	table	type	possible_keys	key	key_len	ref	rows	Extra
1	PRIMARY	NULL	NULL	NULL	NULL	NULL	NULL	NULL	Impossible WHERE noticed after reading const tables
SELECT * FROM t1 WHERE (11) IN 
(SELECT t3.i FROM t2 STRAIGHT_JOIN t3);
i
INSERT INTO t3 VALUES (2);
SELECT (SELECT COUNT(*) from t1),
(SELECT COUNT(*) from t2),
(SELECT COUNT(*) from t3);
(SELECT COUNT(*) from t1)	(SELECT COUNT(*) from t2)	(SELECT COUNT(*) from t3)
0	1	1
EXPLAIN SELECT * FROM t1 WHERE (t1.i) IN 
(SELECT t3.i FROM t2 LEFT JOIN t3 ON t2.i=t3.i);
id	select_type	table	type	possible_keys	key	key_len	ref	rows	Extra
1	PRIMARY	NULL	NULL	NULL	NULL	NULL	NULL	NULL	Impossible WHERE noticed after reading const tables
SELECT * FROM t1 WHERE (t1.i) IN 
(SELECT t3.i FROM t2 LEFT JOIN t3 ON t2.i=t3.i);
i
EXPLAIN SELECT * FROM t1 WHERE (t1.i) IN 
(SELECT t3.i FROM t2 RIGHT JOIN t3 ON t2.i=t3.i);
id	select_type	table	type	possible_keys	key	key_len	ref	rows	Extra
1	PRIMARY	NULL	NULL	NULL	NULL	NULL	NULL	NULL	Impossible WHERE noticed after reading const tables
SELECT * FROM t1 WHERE (t1.i) IN 
(SELECT t3.i FROM t2 RIGHT JOIN t3 ON t2.i=t3.i);
i
EXPLAIN SELECT * FROM t1 WHERE (t1.i) IN 
(SELECT t3.i FROM t2 STRAIGHT_JOIN t3);
id	select_type	table	type	possible_keys	key	key_len	ref	rows	Extra
1	PRIMARY	NULL	NULL	NULL	NULL	NULL	NULL	NULL	Impossible WHERE noticed after reading const tables
SELECT * FROM t1 WHERE (t1.i) IN 
(SELECT t3.i FROM t2 STRAIGHT_JOIN t3);
i
EXPLAIN SELECT * FROM t1 WHERE (11) IN 
(SELECT t3.i FROM t2 LEFT JOIN t3 ON t2.i=t3.i);
id	select_type	table	type	possible_keys	key	key_len	ref	rows	Extra
1	PRIMARY	NULL	NULL	NULL	NULL	NULL	NULL	NULL	Impossible WHERE noticed after reading const tables
SELECT * FROM t1 WHERE (11) IN 
(SELECT t3.i FROM t2 LEFT JOIN t3 ON t2.i=t3.i);
i
EXPLAIN SELECT * FROM t1 WHERE (11) IN 
(SELECT t3.i FROM t2 LEFT JOIN t3 ON t2.i=t3.i WHERE t1.i);
id	select_type	table	type	possible_keys	key	key_len	ref	rows	Extra
1	PRIMARY	NULL	NULL	NULL	NULL	NULL	NULL	NULL	Impossible WHERE noticed after reading const tables
SELECT * FROM t1 WHERE (11) IN 
(SELECT t3.i FROM t2 LEFT JOIN t3 ON t2.i=t3.i WHERE t1.i);
i
EXPLAIN SELECT * FROM t1 WHERE (11) IN 
(SELECT t3.i FROM t2 RIGHT JOIN t3 ON t2.i=t3.i);
id	select_type	table	type	possible_keys	key	key_len	ref	rows	Extra
1	PRIMARY	NULL	NULL	NULL	NULL	NULL	NULL	NULL	Impossible WHERE noticed after reading const tables
SELECT * FROM t1 WHERE (11) IN 
(SELECT t3.i FROM t2 RIGHT JOIN t3 ON t2.i=t3.i);
i
EXPLAIN SELECT * FROM t1 WHERE (11) IN 
(SELECT t3.i FROM t2 STRAIGHT_JOIN t3);
id	select_type	table	type	possible_keys	key	key_len	ref	rows	Extra
1	PRIMARY	NULL	NULL	NULL	NULL	NULL	NULL	NULL	Impossible WHERE noticed after reading const tables
SELECT * FROM t1 WHERE (11) IN 
(SELECT t3.i FROM t2 STRAIGHT_JOIN t3);
i
INSERT INTO t3 VALUES (1);
SELECT (SELECT COUNT(*) from t1),
(SELECT COUNT(*) from t2),
(SELECT COUNT(*) from t3);
(SELECT COUNT(*) from t1)	(SELECT COUNT(*) from t2)	(SELECT COUNT(*) from t3)
0	1	2
EXPLAIN SELECT * FROM t1 WHERE (t1.i) IN 
(SELECT t3.i FROM t2 LEFT JOIN t3 ON t2.i=t3.i);
id	select_type	table	type	possible_keys	key	key_len	ref	rows	Extra
1	PRIMARY	NULL	NULL	NULL	NULL	NULL	NULL	NULL	Impossible WHERE noticed after reading const tables
SELECT * FROM t1 WHERE (t1.i) IN 
(SELECT t3.i FROM t2 LEFT JOIN t3 ON t2.i=t3.i);
i
EXPLAIN SELECT * FROM t1 WHERE (t1.i) IN 
(SELECT t3.i FROM t2 RIGHT JOIN t3 ON t2.i=t3.i);
id	select_type	table	type	possible_keys	key	key_len	ref	rows	Extra
1	PRIMARY	NULL	NULL	NULL	NULL	NULL	NULL	NULL	Impossible WHERE noticed after reading const tables
SELECT * FROM t1 WHERE (t1.i) IN 
(SELECT t3.i FROM t2 RIGHT JOIN t3 ON t2.i=t3.i);
i
EXPLAIN SELECT * FROM t1 WHERE (t1.i) IN 
(SELECT t3.i FROM t2 STRAIGHT_JOIN t3);
id	select_type	table	type	possible_keys	key	key_len	ref	rows	Extra
1	PRIMARY	NULL	NULL	NULL	NULL	NULL	NULL	NULL	Impossible WHERE noticed after reading const tables
SELECT * FROM t1 WHERE (t1.i) IN 
(SELECT t3.i FROM t2 STRAIGHT_JOIN t3);
i
EXPLAIN SELECT * FROM t1 WHERE (11) IN 
(SELECT t3.i FROM t2 LEFT JOIN t3 ON t2.i=t3.i);
id	select_type	table	type	possible_keys	key	key_len	ref	rows	Extra
1	PRIMARY	NULL	NULL	NULL	NULL	NULL	NULL	NULL	Impossible WHERE noticed after reading const tables
SELECT * FROM t1 WHERE (11) IN 
(SELECT t3.i FROM t2 LEFT JOIN t3 ON t2.i=t3.i);
i
EXPLAIN SELECT * FROM t1 WHERE (11) IN 
(SELECT t3.i FROM t2 LEFT JOIN t3 ON t2.i=t3.i WHERE t1.i);
id	select_type	table	type	possible_keys	key	key_len	ref	rows	Extra
1	PRIMARY	NULL	NULL	NULL	NULL	NULL	NULL	NULL	Impossible WHERE noticed after reading const tables
SELECT * FROM t1 WHERE (11) IN 
(SELECT t3.i FROM t2 LEFT JOIN t3 ON t2.i=t3.i WHERE t1.i);
i
EXPLAIN SELECT * FROM t1 WHERE (11) IN 
(SELECT t3.i FROM t2 RIGHT JOIN t3 ON t2.i=t3.i);
id	select_type	table	type	possible_keys	key	key_len	ref	rows	Extra
1	PRIMARY	NULL	NULL	NULL	NULL	NULL	NULL	NULL	Impossible WHERE noticed after reading const tables
SELECT * FROM t1 WHERE (11) IN 
(SELECT t3.i FROM t2 RIGHT JOIN t3 ON t2.i=t3.i);
i
EXPLAIN SELECT * FROM t1 WHERE (11) IN 
(SELECT t3.i FROM t2 STRAIGHT_JOIN t3);
id	select_type	table	type	possible_keys	key	key_len	ref	rows	Extra
1	PRIMARY	NULL	NULL	NULL	NULL	NULL	NULL	NULL	Impossible WHERE noticed after reading const tables
SELECT * FROM t1 WHERE (11) IN 
(SELECT t3.i FROM t2 STRAIGHT_JOIN t3);
i
INSERT INTO t3 VALUES (0);
DELETE FROM t3;
INSERT INTO t2 VALUES (1);
SELECT (SELECT COUNT(*) from t1),
(SELECT COUNT(*) from t2),
(SELECT COUNT(*) from t3);
(SELECT COUNT(*) from t1)	(SELECT COUNT(*) from t2)	(SELECT COUNT(*) from t3)
0	2	0
EXPLAIN SELECT * FROM t1 WHERE (t1.i) IN 
(SELECT t3.i FROM t2 LEFT JOIN t3 ON t2.i=t3.i);
id	select_type	table	type	possible_keys	key	key_len	ref	rows	Extra
1	PRIMARY	NULL	NULL	NULL	NULL	NULL	NULL	NULL	Impossible WHERE noticed after reading const tables
SELECT * FROM t1 WHERE (t1.i) IN 
(SELECT t3.i FROM t2 LEFT JOIN t3 ON t2.i=t3.i);
i
EXPLAIN SELECT * FROM t1 WHERE (t1.i) IN 
(SELECT t3.i FROM t2 RIGHT JOIN t3 ON t2.i=t3.i);
id	select_type	table	type	possible_keys	key	key_len	ref	rows	Extra
1	PRIMARY	NULL	NULL	NULL	NULL	NULL	NULL	NULL	Impossible WHERE noticed after reading const tables
SELECT * FROM t1 WHERE (t1.i) IN 
(SELECT t3.i FROM t2 RIGHT JOIN t3 ON t2.i=t3.i);
i
EXPLAIN SELECT * FROM t1 WHERE (t1.i) IN 
(SELECT t3.i FROM t2 STRAIGHT_JOIN t3);
id	select_type	table	type	possible_keys	key	key_len	ref	rows	Extra
1	PRIMARY	NULL	NULL	NULL	NULL	NULL	NULL	NULL	Impossible WHERE noticed after reading const tables
SELECT * FROM t1 WHERE (t1.i) IN 
(SELECT t3.i FROM t2 STRAIGHT_JOIN t3);
i
EXPLAIN SELECT * FROM t1 WHERE (11) IN 
(SELECT t3.i FROM t2 LEFT JOIN t3 ON t2.i=t3.i);
id	select_type	table	type	possible_keys	key	key_len	ref	rows	Extra
1	PRIMARY	NULL	NULL	NULL	NULL	NULL	NULL	NULL	Impossible WHERE noticed after reading const tables
SELECT * FROM t1 WHERE (11) IN 
(SELECT t3.i FROM t2 LEFT JOIN t3 ON t2.i=t3.i);
i
EXPLAIN SELECT * FROM t1 WHERE (11) IN 
(SELECT t3.i FROM t2 LEFT JOIN t3 ON t2.i=t3.i WHERE t1.i);
id	select_type	table	type	possible_keys	key	key_len	ref	rows	Extra
1	PRIMARY	NULL	NULL	NULL	NULL	NULL	NULL	NULL	Impossible WHERE noticed after reading const tables
SELECT * FROM t1 WHERE (11) IN 
(SELECT t3.i FROM t2 LEFT JOIN t3 ON t2.i=t3.i WHERE t1.i);
i
EXPLAIN SELECT * FROM t1 WHERE (11) IN 
(SELECT t3.i FROM t2 RIGHT JOIN t3 ON t2.i=t3.i);
id	select_type	table	type	possible_keys	key	key_len	ref	rows	Extra
1	PRIMARY	NULL	NULL	NULL	NULL	NULL	NULL	NULL	Impossible WHERE noticed after reading const tables
SELECT * FROM t1 WHERE (11) IN 
(SELECT t3.i FROM t2 RIGHT JOIN t3 ON t2.i=t3.i);
i
EXPLAIN SELECT * FROM t1 WHERE (11) IN 
(SELECT t3.i FROM t2 STRAIGHT_JOIN t3);
id	select_type	table	type	possible_keys	key	key_len	ref	rows	Extra
1	PRIMARY	NULL	NULL	NULL	NULL	NULL	NULL	NULL	Impossible WHERE noticed after reading const tables
SELECT * FROM t1 WHERE (11) IN 
(SELECT t3.i FROM t2 STRAIGHT_JOIN t3);
i
INSERT INTO t3 VALUES (2);
SELECT (SELECT COUNT(*) from t1),
(SELECT COUNT(*) from t2),
(SELECT COUNT(*) from t3);
(SELECT COUNT(*) from t1)	(SELECT COUNT(*) from t2)	(SELECT COUNT(*) from t3)
0	2	1
EXPLAIN SELECT * FROM t1 WHERE (t1.i) IN 
(SELECT t3.i FROM t2 LEFT JOIN t3 ON t2.i=t3.i);
id	select_type	table	type	possible_keys	key	key_len	ref	rows	Extra
1	PRIMARY	NULL	NULL	NULL	NULL	NULL	NULL	NULL	Impossible WHERE noticed after reading const tables
SELECT * FROM t1 WHERE (t1.i) IN 
(SELECT t3.i FROM t2 LEFT JOIN t3 ON t2.i=t3.i);
i
EXPLAIN SELECT * FROM t1 WHERE (t1.i) IN 
(SELECT t3.i FROM t2 RIGHT JOIN t3 ON t2.i=t3.i);
id	select_type	table	type	possible_keys	key	key_len	ref	rows	Extra
1	PRIMARY	NULL	NULL	NULL	NULL	NULL	NULL	NULL	Impossible WHERE noticed after reading const tables
SELECT * FROM t1 WHERE (t1.i) IN 
(SELECT t3.i FROM t2 RIGHT JOIN t3 ON t2.i=t3.i);
i
EXPLAIN SELECT * FROM t1 WHERE (t1.i) IN 
(SELECT t3.i FROM t2 STRAIGHT_JOIN t3);
id	select_type	table	type	possible_keys	key	key_len	ref	rows	Extra
1	PRIMARY	NULL	NULL	NULL	NULL	NULL	NULL	NULL	Impossible WHERE noticed after reading const tables
SELECT * FROM t1 WHERE (t1.i) IN 
(SELECT t3.i FROM t2 STRAIGHT_JOIN t3);
i
EXPLAIN SELECT * FROM t1 WHERE (11) IN 
(SELECT t3.i FROM t2 LEFT JOIN t3 ON t2.i=t3.i);
id	select_type	table	type	possible_keys	key	key_len	ref	rows	Extra
1	PRIMARY	NULL	NULL	NULL	NULL	NULL	NULL	NULL	Impossible WHERE noticed after reading const tables
SELECT * FROM t1 WHERE (11) IN 
(SELECT t3.i FROM t2 LEFT JOIN t3 ON t2.i=t3.i);
i
EXPLAIN SELECT * FROM t1 WHERE (11) IN 
(SELECT t3.i FROM t2 LEFT JOIN t3 ON t2.i=t3.i WHERE t1.i);
id	select_type	table	type	possible_keys	key	key_len	ref	rows	Extra
1	PRIMARY	NULL	NULL	NULL	NULL	NULL	NULL	NULL	Impossible WHERE noticed after reading const tables
SELECT * FROM t1 WHERE (11) IN 
(SELECT t3.i FROM t2 LEFT JOIN t3 ON t2.i=t3.i WHERE t1.i);
i
EXPLAIN SELECT * FROM t1 WHERE (11) IN 
(SELECT t3.i FROM t2 RIGHT JOIN t3 ON t2.i=t3.i);
id	select_type	table	type	possible_keys	key	key_len	ref	rows	Extra
1	PRIMARY	NULL	NULL	NULL	NULL	NULL	NULL	NULL	Impossible WHERE noticed after reading const tables
SELECT * FROM t1 WHERE (11) IN 
(SELECT t3.i FROM t2 RIGHT JOIN t3 ON t2.i=t3.i);
i
EXPLAIN SELECT * FROM t1 WHERE (11) IN 
(SELECT t3.i FROM t2 STRAIGHT_JOIN t3);
id	select_type	table	type	possible_keys	key	key_len	ref	rows	Extra
1	PRIMARY	NULL	NULL	NULL	NULL	NULL	NULL	NULL	Impossible WHERE noticed after reading const tables
SELECT * FROM t1 WHERE (11) IN 
(SELECT t3.i FROM t2 STRAIGHT_JOIN t3);
i
INSERT INTO t3 VALUES (1);
SELECT (SELECT COUNT(*) from t1),
(SELECT COUNT(*) from t2),
(SELECT COUNT(*) from t3);
(SELECT COUNT(*) from t1)	(SELECT COUNT(*) from t2)	(SELECT COUNT(*) from t3)
0	2	2
EXPLAIN SELECT * FROM t1 WHERE (t1.i) IN 
(SELECT t3.i FROM t2 LEFT JOIN t3 ON t2.i=t3.i);
id	select_type	table	type	possible_keys	key	key_len	ref	rows	Extra
1	PRIMARY	NULL	NULL	NULL	NULL	NULL	NULL	NULL	Impossible WHERE noticed after reading const tables
SELECT * FROM t1 WHERE (t1.i) IN 
(SELECT t3.i FROM t2 LEFT JOIN t3 ON t2.i=t3.i);
i
EXPLAIN SELECT * FROM t1 WHERE (t1.i) IN 
(SELECT t3.i FROM t2 RIGHT JOIN t3 ON t2.i=t3.i);
id	select_type	table	type	possible_keys	key	key_len	ref	rows	Extra
1	PRIMARY	NULL	NULL	NULL	NULL	NULL	NULL	NULL	Impossible WHERE noticed after reading const tables
SELECT * FROM t1 WHERE (t1.i) IN 
(SELECT t3.i FROM t2 RIGHT JOIN t3 ON t2.i=t3.i);
i
EXPLAIN SELECT * FROM t1 WHERE (t1.i) IN 
(SELECT t3.i FROM t2 STRAIGHT_JOIN t3);
id	select_type	table	type	possible_keys	key	key_len	ref	rows	Extra
1	PRIMARY	NULL	NULL	NULL	NULL	NULL	NULL	NULL	Impossible WHERE noticed after reading const tables
SELECT * FROM t1 WHERE (t1.i) IN 
(SELECT t3.i FROM t2 STRAIGHT_JOIN t3);
i
EXPLAIN SELECT * FROM t1 WHERE (11) IN 
(SELECT t3.i FROM t2 LEFT JOIN t3 ON t2.i=t3.i);
id	select_type	table	type	possible_keys	key	key_len	ref	rows	Extra
1	PRIMARY	NULL	NULL	NULL	NULL	NULL	NULL	NULL	Impossible WHERE noticed after reading const tables
SELECT * FROM t1 WHERE (11) IN 
(SELECT t3.i FROM t2 LEFT JOIN t3 ON t2.i=t3.i);
i
EXPLAIN SELECT * FROM t1 WHERE (11) IN 
(SELECT t3.i FROM t2 LEFT JOIN t3 ON t2.i=t3.i WHERE t1.i);
id	select_type	table	type	possible_keys	key	key_len	ref	rows	Extra
1	PRIMARY	NULL	NULL	NULL	NULL	NULL	NULL	NULL	Impossible WHERE noticed after reading const tables
SELECT * FROM t1 WHERE (11) IN 
(SELECT t3.i FROM t2 LEFT JOIN t3 ON t2.i=t3.i WHERE t1.i);
i
EXPLAIN SELECT * FROM t1 WHERE (11) IN 
(SELECT t3.i FROM t2 RIGHT JOIN t3 ON t2.i=t3.i);
id	select_type	table	type	possible_keys	key	key_len	ref	rows	Extra
1	PRIMARY	NULL	NULL	NULL	NULL	NULL	NULL	NULL	Impossible WHERE noticed after reading const tables
SELECT * FROM t1 WHERE (11) IN 
(SELECT t3.i FROM t2 RIGHT JOIN t3 ON t2.i=t3.i);
i
EXPLAIN SELECT * FROM t1 WHERE (11) IN 
(SELECT t3.i FROM t2 STRAIGHT_JOIN t3);
id	select_type	table	type	possible_keys	key	key_len	ref	rows	Extra
1	PRIMARY	NULL	NULL	NULL	NULL	NULL	NULL	NULL	Impossible WHERE noticed after reading const tables
SELECT * FROM t1 WHERE (11) IN 
(SELECT t3.i FROM t2 STRAIGHT_JOIN t3);
i
INSERT INTO t3 VALUES (0);
DELETE FROM t3;
INSERT INTO t2 VALUES (0);
DELETE FROM t2;
INSERT INTO t1 VALUES (2);
SELECT (SELECT COUNT(*) from t1),
(SELECT COUNT(*) from t2),
(SELECT COUNT(*) from t3);
(SELECT COUNT(*) from t1)	(SELECT COUNT(*) from t2)	(SELECT COUNT(*) from t3)
1	0	0
EXPLAIN SELECT * FROM t1 WHERE (t1.i) IN 
(SELECT t3.i FROM t2 LEFT JOIN t3 ON t2.i=t3.i);
id	select_type	table	type	possible_keys	key	key_len	ref	rows	Extra
1	PRIMARY	NULL	NULL	NULL	NULL	NULL	NULL	NULL	Impossible WHERE noticed after reading const tables
SELECT * FROM t1 WHERE (t1.i) IN 
(SELECT t3.i FROM t2 LEFT JOIN t3 ON t2.i=t3.i);
i
EXPLAIN SELECT * FROM t1 WHERE (t1.i) IN 
(SELECT t3.i FROM t2 RIGHT JOIN t3 ON t2.i=t3.i);
id	select_type	table	type	possible_keys	key	key_len	ref	rows	Extra
1	PRIMARY	NULL	NULL	NULL	NULL	NULL	NULL	NULL	Impossible WHERE noticed after reading const tables
SELECT * FROM t1 WHERE (t1.i) IN 
(SELECT t3.i FROM t2 RIGHT JOIN t3 ON t2.i=t3.i);
i
EXPLAIN SELECT * FROM t1 WHERE (t1.i) IN 
(SELECT t3.i FROM t2 STRAIGHT_JOIN t3);
id	select_type	table	type	possible_keys	key	key_len	ref	rows	Extra
1	PRIMARY	NULL	NULL	NULL	NULL	NULL	NULL	NULL	Impossible WHERE noticed after reading const tables
SELECT * FROM t1 WHERE (t1.i) IN 
(SELECT t3.i FROM t2 STRAIGHT_JOIN t3);
i
EXPLAIN SELECT * FROM t1 WHERE (11) IN 
(SELECT t3.i FROM t2 LEFT JOIN t3 ON t2.i=t3.i);
id	select_type	table	type	possible_keys	key	key_len	ref	rows	Extra
1	PRIMARY	NULL	NULL	NULL	NULL	NULL	NULL	NULL	Impossible WHERE noticed after reading const tables
SELECT * FROM t1 WHERE (11) IN 
(SELECT t3.i FROM t2 LEFT JOIN t3 ON t2.i=t3.i);
i
EXPLAIN SELECT * FROM t1 WHERE (11) IN 
(SELECT t3.i FROM t2 LEFT JOIN t3 ON t2.i=t3.i WHERE t1.i);
id	select_type	table	type	possible_keys	key	key_len	ref	rows	Extra
1	PRIMARY	NULL	NULL	NULL	NULL	NULL	NULL	NULL	Impossible WHERE noticed after reading const tables
SELECT * FROM t1 WHERE (11) IN 
(SELECT t3.i FROM t2 LEFT JOIN t3 ON t2.i=t3.i WHERE t1.i);
i
EXPLAIN SELECT * FROM t1 WHERE (11) IN 
(SELECT t3.i FROM t2 RIGHT JOIN t3 ON t2.i=t3.i);
id	select_type	table	type	possible_keys	key	key_len	ref	rows	Extra
1	PRIMARY	NULL	NULL	NULL	NULL	NULL	NULL	NULL	Impossible WHERE noticed after reading const tables
SELECT * FROM t1 WHERE (11) IN 
(SELECT t3.i FROM t2 RIGHT JOIN t3 ON t2.i=t3.i);
i
EXPLAIN SELECT * FROM t1 WHERE (11) IN 
(SELECT t3.i FROM t2 STRAIGHT_JOIN t3);
id	select_type	table	type	possible_keys	key	key_len	ref	rows	Extra
1	PRIMARY	NULL	NULL	NULL	NULL	NULL	NULL	NULL	Impossible WHERE noticed after reading const tables
SELECT * FROM t1 WHERE (11) IN 
(SELECT t3.i FROM t2 STRAIGHT_JOIN t3);
i
INSERT INTO t3 VALUES (2);
SELECT (SELECT COUNT(*) from t1),
(SELECT COUNT(*) from t2),
(SELECT COUNT(*) from t3);
(SELECT COUNT(*) from t1)	(SELECT COUNT(*) from t2)	(SELECT COUNT(*) from t3)
1	0	1
EXPLAIN SELECT * FROM t1 WHERE (t1.i) IN 
(SELECT t3.i FROM t2 LEFT JOIN t3 ON t2.i=t3.i);
id	select_type	table	type	possible_keys	key	key_len	ref	rows	Extra
1	PRIMARY	NULL	NULL	NULL	NULL	NULL	NULL	NULL	Impossible WHERE noticed after reading const tables
SELECT * FROM t1 WHERE (t1.i) IN 
(SELECT t3.i FROM t2 LEFT JOIN t3 ON t2.i=t3.i);
i
EXPLAIN SELECT * FROM t1 WHERE (t1.i) IN 
(SELECT t3.i FROM t2 RIGHT JOIN t3 ON t2.i=t3.i);
id	select_type	table	type	possible_keys	key	key_len	ref	rows	Extra
1	PRIMARY	t1	system	NULL	NULL	NULL	NULL	1	
1	PRIMARY	t2	system	NULL	NULL	NULL	NULL	0	const row not found
1	PRIMARY	t3	system	NULL	NULL	NULL	NULL	1	
SELECT * FROM t1 WHERE (t1.i) IN 
(SELECT t3.i FROM t2 RIGHT JOIN t3 ON t2.i=t3.i);
i
2
EXPLAIN SELECT * FROM t1 WHERE (t1.i) IN 
(SELECT t3.i FROM t2 STRAIGHT_JOIN t3);
id	select_type	table	type	possible_keys	key	key_len	ref	rows	Extra
1	PRIMARY	NULL	NULL	NULL	NULL	NULL	NULL	NULL	Impossible WHERE noticed after reading const tables
SELECT * FROM t1 WHERE (t1.i) IN 
(SELECT t3.i FROM t2 STRAIGHT_JOIN t3);
i
EXPLAIN SELECT * FROM t1 WHERE (11) IN 
(SELECT t3.i FROM t2 LEFT JOIN t3 ON t2.i=t3.i);
id	select_type	table	type	possible_keys	key	key_len	ref	rows	Extra
1	PRIMARY	NULL	NULL	NULL	NULL	NULL	NULL	NULL	Impossible WHERE noticed after reading const tables
SELECT * FROM t1 WHERE (11) IN 
(SELECT t3.i FROM t2 LEFT JOIN t3 ON t2.i=t3.i);
i
EXPLAIN SELECT * FROM t1 WHERE (11) IN 
(SELECT t3.i FROM t2 LEFT JOIN t3 ON t2.i=t3.i WHERE t1.i);
id	select_type	table	type	possible_keys	key	key_len	ref	rows	Extra
1	PRIMARY	NULL	NULL	NULL	NULL	NULL	NULL	NULL	Impossible WHERE noticed after reading const tables
SELECT * FROM t1 WHERE (11) IN 
(SELECT t3.i FROM t2 LEFT JOIN t3 ON t2.i=t3.i WHERE t1.i);
i
EXPLAIN SELECT * FROM t1 WHERE (11) IN 
(SELECT t3.i FROM t2 RIGHT JOIN t3 ON t2.i=t3.i);
id	select_type	table	type	possible_keys	key	key_len	ref	rows	Extra
1	PRIMARY	NULL	NULL	NULL	NULL	NULL	NULL	NULL	Impossible WHERE noticed after reading const tables
SELECT * FROM t1 WHERE (11) IN 
(SELECT t3.i FROM t2 RIGHT JOIN t3 ON t2.i=t3.i);
i
EXPLAIN SELECT * FROM t1 WHERE (11) IN 
(SELECT t3.i FROM t2 STRAIGHT_JOIN t3);
id	select_type	table	type	possible_keys	key	key_len	ref	rows	Extra
1	PRIMARY	NULL	NULL	NULL	NULL	NULL	NULL	NULL	Impossible WHERE noticed after reading const tables
SELECT * FROM t1 WHERE (11) IN 
(SELECT t3.i FROM t2 STRAIGHT_JOIN t3);
i
INSERT INTO t3 VALUES (1);
SELECT (SELECT COUNT(*) from t1),
(SELECT COUNT(*) from t2),
(SELECT COUNT(*) from t3);
(SELECT COUNT(*) from t1)	(SELECT COUNT(*) from t2)	(SELECT COUNT(*) from t3)
1	0	2
EXPLAIN SELECT * FROM t1 WHERE (t1.i) IN 
(SELECT t3.i FROM t2 LEFT JOIN t3 ON t2.i=t3.i);
id	select_type	table	type	possible_keys	key	key_len	ref	rows	Extra
1	PRIMARY	NULL	NULL	NULL	NULL	NULL	NULL	NULL	Impossible WHERE noticed after reading const tables
SELECT * FROM t1 WHERE (t1.i) IN 
(SELECT t3.i FROM t2 LEFT JOIN t3 ON t2.i=t3.i);
i
EXPLAIN SELECT * FROM t1 WHERE (t1.i) IN 
(SELECT t3.i FROM t2 RIGHT JOIN t3 ON t2.i=t3.i);
id	select_type	table	type	possible_keys	key	key_len	ref	rows	Extra
1	PRIMARY	t1	system	NULL	NULL	NULL	NULL	1	
1	PRIMARY	t2	system	NULL	NULL	NULL	NULL	0	const row not found
1	PRIMARY	t3	ALL	NULL	NULL	NULL	NULL	2	Using where; Start temporary; End temporary
SELECT * FROM t1 WHERE (t1.i) IN 
(SELECT t3.i FROM t2 RIGHT JOIN t3 ON t2.i=t3.i);
i
2
EXPLAIN SELECT * FROM t1 WHERE (t1.i) IN 
(SELECT t3.i FROM t2 STRAIGHT_JOIN t3);
id	select_type	table	type	possible_keys	key	key_len	ref	rows	Extra
1	PRIMARY	NULL	NULL	NULL	NULL	NULL	NULL	NULL	Impossible WHERE noticed after reading const tables
SELECT * FROM t1 WHERE (t1.i) IN 
(SELECT t3.i FROM t2 STRAIGHT_JOIN t3);
i
EXPLAIN SELECT * FROM t1 WHERE (11) IN 
(SELECT t3.i FROM t2 LEFT JOIN t3 ON t2.i=t3.i);
id	select_type	table	type	possible_keys	key	key_len	ref	rows	Extra
1	PRIMARY	NULL	NULL	NULL	NULL	NULL	NULL	NULL	Impossible WHERE noticed after reading const tables
SELECT * FROM t1 WHERE (11) IN 
(SELECT t3.i FROM t2 LEFT JOIN t3 ON t2.i=t3.i);
i
EXPLAIN SELECT * FROM t1 WHERE (11) IN 
(SELECT t3.i FROM t2 LEFT JOIN t3 ON t2.i=t3.i WHERE t1.i);
id	select_type	table	type	possible_keys	key	key_len	ref	rows	Extra
1	PRIMARY	NULL	NULL	NULL	NULL	NULL	NULL	NULL	Impossible WHERE noticed after reading const tables
SELECT * FROM t1 WHERE (11) IN 
(SELECT t3.i FROM t2 LEFT JOIN t3 ON t2.i=t3.i WHERE t1.i);
i
EXPLAIN SELECT * FROM t1 WHERE (11) IN 
(SELECT t3.i FROM t2 RIGHT JOIN t3 ON t2.i=t3.i);
id	select_type	table	type	possible_keys	key	key_len	ref	rows	Extra
1	PRIMARY	t1	system	NULL	NULL	NULL	NULL	1	
1	PRIMARY	t2	system	NULL	NULL	NULL	NULL	0	const row not found
1	PRIMARY	t3	ALL	NULL	NULL	NULL	NULL	2	Using where; Start temporary; End temporary
SELECT * FROM t1 WHERE (11) IN 
(SELECT t3.i FROM t2 RIGHT JOIN t3 ON t2.i=t3.i);
i
EXPLAIN SELECT * FROM t1 WHERE (11) IN 
(SELECT t3.i FROM t2 STRAIGHT_JOIN t3);
id	select_type	table	type	possible_keys	key	key_len	ref	rows	Extra
1	PRIMARY	NULL	NULL	NULL	NULL	NULL	NULL	NULL	Impossible WHERE noticed after reading const tables
SELECT * FROM t1 WHERE (11) IN 
(SELECT t3.i FROM t2 STRAIGHT_JOIN t3);
i
INSERT INTO t3 VALUES (0);
DELETE FROM t3;
INSERT INTO t2 VALUES (2);
SELECT (SELECT COUNT(*) from t1),
(SELECT COUNT(*) from t2),
(SELECT COUNT(*) from t3);
(SELECT COUNT(*) from t1)	(SELECT COUNT(*) from t2)	(SELECT COUNT(*) from t3)
1	1	0
EXPLAIN SELECT * FROM t1 WHERE (t1.i) IN 
(SELECT t3.i FROM t2 LEFT JOIN t3 ON t2.i=t3.i);
id	select_type	table	type	possible_keys	key	key_len	ref	rows	Extra
1	PRIMARY	NULL	NULL	NULL	NULL	NULL	NULL	NULL	Impossible WHERE noticed after reading const tables
SELECT * FROM t1 WHERE (t1.i) IN 
(SELECT t3.i FROM t2 LEFT JOIN t3 ON t2.i=t3.i);
i
EXPLAIN SELECT * FROM t1 WHERE (t1.i) IN 
(SELECT t3.i FROM t2 RIGHT JOIN t3 ON t2.i=t3.i);
id	select_type	table	type	possible_keys	key	key_len	ref	rows	Extra
1	PRIMARY	NULL	NULL	NULL	NULL	NULL	NULL	NULL	Impossible WHERE noticed after reading const tables
SELECT * FROM t1 WHERE (t1.i) IN 
(SELECT t3.i FROM t2 RIGHT JOIN t3 ON t2.i=t3.i);
i
EXPLAIN SELECT * FROM t1 WHERE (t1.i) IN 
(SELECT t3.i FROM t2 STRAIGHT_JOIN t3);
id	select_type	table	type	possible_keys	key	key_len	ref	rows	Extra
1	PRIMARY	NULL	NULL	NULL	NULL	NULL	NULL	NULL	Impossible WHERE noticed after reading const tables
SELECT * FROM t1 WHERE (t1.i) IN 
(SELECT t3.i FROM t2 STRAIGHT_JOIN t3);
i
EXPLAIN SELECT * FROM t1 WHERE (11) IN 
(SELECT t3.i FROM t2 LEFT JOIN t3 ON t2.i=t3.i);
id	select_type	table	type	possible_keys	key	key_len	ref	rows	Extra
1	PRIMARY	NULL	NULL	NULL	NULL	NULL	NULL	NULL	Impossible WHERE noticed after reading const tables
SELECT * FROM t1 WHERE (11) IN 
(SELECT t3.i FROM t2 LEFT JOIN t3 ON t2.i=t3.i);
i
EXPLAIN SELECT * FROM t1 WHERE (11) IN 
(SELECT t3.i FROM t2 LEFT JOIN t3 ON t2.i=t3.i WHERE t1.i);
id	select_type	table	type	possible_keys	key	key_len	ref	rows	Extra
1	PRIMARY	NULL	NULL	NULL	NULL	NULL	NULL	NULL	Impossible WHERE noticed after reading const tables
SELECT * FROM t1 WHERE (11) IN 
(SELECT t3.i FROM t2 LEFT JOIN t3 ON t2.i=t3.i WHERE t1.i);
i
EXPLAIN SELECT * FROM t1 WHERE (11) IN 
(SELECT t3.i FROM t2 RIGHT JOIN t3 ON t2.i=t3.i);
id	select_type	table	type	possible_keys	key	key_len	ref	rows	Extra
1	PRIMARY	NULL	NULL	NULL	NULL	NULL	NULL	NULL	Impossible WHERE noticed after reading const tables
SELECT * FROM t1 WHERE (11) IN 
(SELECT t3.i FROM t2 RIGHT JOIN t3 ON t2.i=t3.i);
i
EXPLAIN SELECT * FROM t1 WHERE (11) IN 
(SELECT t3.i FROM t2 STRAIGHT_JOIN t3);
id	select_type	table	type	possible_keys	key	key_len	ref	rows	Extra
1	PRIMARY	NULL	NULL	NULL	NULL	NULL	NULL	NULL	Impossible WHERE noticed after reading const tables
SELECT * FROM t1 WHERE (11) IN 
(SELECT t3.i FROM t2 STRAIGHT_JOIN t3);
i
INSERT INTO t3 VALUES (2);
SELECT (SELECT COUNT(*) from t1),
(SELECT COUNT(*) from t2),
(SELECT COUNT(*) from t3);
(SELECT COUNT(*) from t1)	(SELECT COUNT(*) from t2)	(SELECT COUNT(*) from t3)
1	1	1
EXPLAIN SELECT * FROM t1 WHERE (t1.i) IN 
(SELECT t3.i FROM t2 LEFT JOIN t3 ON t2.i=t3.i);
id	select_type	table	type	possible_keys	key	key_len	ref	rows	Extra
1	PRIMARY	t1	system	NULL	NULL	NULL	NULL	1	
1	PRIMARY	t2	system	NULL	NULL	NULL	NULL	1	
1	PRIMARY	t3	system	NULL	NULL	NULL	NULL	1	
SELECT * FROM t1 WHERE (t1.i) IN 
(SELECT t3.i FROM t2 LEFT JOIN t3 ON t2.i=t3.i);
i
2
EXPLAIN SELECT * FROM t1 WHERE (t1.i) IN 
(SELECT t3.i FROM t2 RIGHT JOIN t3 ON t2.i=t3.i);
id	select_type	table	type	possible_keys	key	key_len	ref	rows	Extra
1	PRIMARY	t1	system	NULL	NULL	NULL	NULL	1	
1	PRIMARY	t3	system	NULL	NULL	NULL	NULL	1	
1	PRIMARY	t2	system	NULL	NULL	NULL	NULL	1	
SELECT * FROM t1 WHERE (t1.i) IN 
(SELECT t3.i FROM t2 RIGHT JOIN t3 ON t2.i=t3.i);
i
2
EXPLAIN SELECT * FROM t1 WHERE (t1.i) IN 
(SELECT t3.i FROM t2 STRAIGHT_JOIN t3);
id	select_type	table	type	possible_keys	key	key_len	ref	rows	Extra
1	PRIMARY	t1	system	NULL	NULL	NULL	NULL	1	
1	PRIMARY	t2	system	NULL	NULL	NULL	NULL	1	
1	PRIMARY	t3	system	NULL	NULL	NULL	NULL	1	
SELECT * FROM t1 WHERE (t1.i) IN 
(SELECT t3.i FROM t2 STRAIGHT_JOIN t3);
i
2
EXPLAIN SELECT * FROM t1 WHERE (11) IN 
(SELECT t3.i FROM t2 LEFT JOIN t3 ON t2.i=t3.i);
id	select_type	table	type	possible_keys	key	key_len	ref	rows	Extra
1	PRIMARY	NULL	NULL	NULL	NULL	NULL	NULL	NULL	Impossible WHERE noticed after reading const tables
SELECT * FROM t1 WHERE (11) IN 
(SELECT t3.i FROM t2 LEFT JOIN t3 ON t2.i=t3.i);
i
EXPLAIN SELECT * FROM t1 WHERE (11) IN 
(SELECT t3.i FROM t2 LEFT JOIN t3 ON t2.i=t3.i WHERE t1.i);
id	select_type	table	type	possible_keys	key	key_len	ref	rows	Extra
1	PRIMARY	NULL	NULL	NULL	NULL	NULL	NULL	NULL	Impossible WHERE noticed after reading const tables
SELECT * FROM t1 WHERE (11) IN 
(SELECT t3.i FROM t2 LEFT JOIN t3 ON t2.i=t3.i WHERE t1.i);
i
EXPLAIN SELECT * FROM t1 WHERE (11) IN 
(SELECT t3.i FROM t2 RIGHT JOIN t3 ON t2.i=t3.i);
id	select_type	table	type	possible_keys	key	key_len	ref	rows	Extra
1	PRIMARY	NULL	NULL	NULL	NULL	NULL	NULL	NULL	Impossible WHERE noticed after reading const tables
SELECT * FROM t1 WHERE (11) IN 
(SELECT t3.i FROM t2 RIGHT JOIN t3 ON t2.i=t3.i);
i
EXPLAIN SELECT * FROM t1 WHERE (11) IN 
(SELECT t3.i FROM t2 STRAIGHT_JOIN t3);
id	select_type	table	type	possible_keys	key	key_len	ref	rows	Extra
1	PRIMARY	NULL	NULL	NULL	NULL	NULL	NULL	NULL	Impossible WHERE noticed after reading const tables
SELECT * FROM t1 WHERE (11) IN 
(SELECT t3.i FROM t2 STRAIGHT_JOIN t3);
i
INSERT INTO t3 VALUES (1);
SELECT (SELECT COUNT(*) from t1),
(SELECT COUNT(*) from t2),
(SELECT COUNT(*) from t3);
(SELECT COUNT(*) from t1)	(SELECT COUNT(*) from t2)	(SELECT COUNT(*) from t3)
1	1	2
EXPLAIN SELECT * FROM t1 WHERE (t1.i) IN 
(SELECT t3.i FROM t2 LEFT JOIN t3 ON t2.i=t3.i);
id	select_type	table	type	possible_keys	key	key_len	ref	rows	Extra
1	PRIMARY	t1	system	NULL	NULL	NULL	NULL	1	
1	PRIMARY	t2	system	NULL	NULL	NULL	NULL	1	
1	PRIMARY	t3	ALL	NULL	NULL	NULL	NULL	2	Using where; Start temporary; End temporary
SELECT * FROM t1 WHERE (t1.i) IN 
(SELECT t3.i FROM t2 LEFT JOIN t3 ON t2.i=t3.i);
i
2
EXPLAIN SELECT * FROM t1 WHERE (t1.i) IN 
(SELECT t3.i FROM t2 RIGHT JOIN t3 ON t2.i=t3.i);
id	select_type	table	type	possible_keys	key	key_len	ref	rows	Extra
1	PRIMARY	t1	system	NULL	NULL	NULL	NULL	1	
1	PRIMARY	t3	ALL	NULL	NULL	NULL	NULL	2	Using where; Start temporary
1	PRIMARY	t2	ALL	NULL	NULL	NULL	NULL	1	Using where; End temporary; Using join buffer (BNL, incremental buffers)
SELECT * FROM t1 WHERE (t1.i) IN 
(SELECT t3.i FROM t2 RIGHT JOIN t3 ON t2.i=t3.i);
i
2
EXPLAIN SELECT * FROM t1 WHERE (t1.i) IN 
(SELECT t3.i FROM t2 STRAIGHT_JOIN t3);
id	select_type	table	type	possible_keys	key	key_len	ref	rows	Extra
1	PRIMARY	t1	system	NULL	NULL	NULL	NULL	1	
1	PRIMARY	t2	system	NULL	NULL	NULL	NULL	1	
1	PRIMARY	t3	ALL	NULL	NULL	NULL	NULL	2	Using where; Start temporary; End temporary
SELECT * FROM t1 WHERE (t1.i) IN 
(SELECT t3.i FROM t2 STRAIGHT_JOIN t3);
i
2
EXPLAIN SELECT * FROM t1 WHERE (11) IN 
(SELECT t3.i FROM t2 LEFT JOIN t3 ON t2.i=t3.i);
id	select_type	table	type	possible_keys	key	key_len	ref	rows	Extra
1	PRIMARY	t1	system	NULL	NULL	NULL	NULL	1	
1	PRIMARY	t2	system	NULL	NULL	NULL	NULL	1	
1	PRIMARY	t3	ALL	NULL	NULL	NULL	NULL	2	Using where; Start temporary; End temporary
SELECT * FROM t1 WHERE (11) IN 
(SELECT t3.i FROM t2 LEFT JOIN t3 ON t2.i=t3.i);
i
EXPLAIN SELECT * FROM t1 WHERE (11) IN 
(SELECT t3.i FROM t2 LEFT JOIN t3 ON t2.i=t3.i WHERE t1.i);
id	select_type	table	type	possible_keys	key	key_len	ref	rows	Extra
1	PRIMARY	t1	system	NULL	NULL	NULL	NULL	1	
1	PRIMARY	t2	system	NULL	NULL	NULL	NULL	1	
1	PRIMARY	t3	ALL	NULL	NULL	NULL	NULL	2	Using where; Start temporary; End temporary
SELECT * FROM t1 WHERE (11) IN 
(SELECT t3.i FROM t2 LEFT JOIN t3 ON t2.i=t3.i WHERE t1.i);
i
EXPLAIN SELECT * FROM t1 WHERE (11) IN 
(SELECT t3.i FROM t2 RIGHT JOIN t3 ON t2.i=t3.i);
id	select_type	table	type	possible_keys	key	key_len	ref	rows	Extra
1	PRIMARY	t1	system	NULL	NULL	NULL	NULL	1	
1	PRIMARY	t3	ALL	NULL	NULL	NULL	NULL	2	Using where; Start temporary
1	PRIMARY	t2	ALL	NULL	NULL	NULL	NULL	1	Using where; End temporary; Using join buffer (BNL, incremental buffers)
SELECT * FROM t1 WHERE (11) IN 
(SELECT t3.i FROM t2 RIGHT JOIN t3 ON t2.i=t3.i);
i
EXPLAIN SELECT * FROM t1 WHERE (11) IN 
(SELECT t3.i FROM t2 STRAIGHT_JOIN t3);
id	select_type	table	type	possible_keys	key	key_len	ref	rows	Extra
1	PRIMARY	t1	system	NULL	NULL	NULL	NULL	1	
1	PRIMARY	t2	system	NULL	NULL	NULL	NULL	1	
1	PRIMARY	t3	ALL	NULL	NULL	NULL	NULL	2	Using where; Start temporary; End temporary
SELECT * FROM t1 WHERE (11) IN 
(SELECT t3.i FROM t2 STRAIGHT_JOIN t3);
i
INSERT INTO t3 VALUES (0);
DELETE FROM t3;
INSERT INTO t2 VALUES (1);
SELECT (SELECT COUNT(*) from t1),
(SELECT COUNT(*) from t2),
(SELECT COUNT(*) from t3);
(SELECT COUNT(*) from t1)	(SELECT COUNT(*) from t2)	(SELECT COUNT(*) from t3)
1	2	0
EXPLAIN SELECT * FROM t1 WHERE (t1.i) IN 
(SELECT t3.i FROM t2 LEFT JOIN t3 ON t2.i=t3.i);
id	select_type	table	type	possible_keys	key	key_len	ref	rows	Extra
1	PRIMARY	NULL	NULL	NULL	NULL	NULL	NULL	NULL	Impossible WHERE noticed after reading const tables
SELECT * FROM t1 WHERE (t1.i) IN 
(SELECT t3.i FROM t2 LEFT JOIN t3 ON t2.i=t3.i);
i
EXPLAIN SELECT * FROM t1 WHERE (t1.i) IN 
(SELECT t3.i FROM t2 RIGHT JOIN t3 ON t2.i=t3.i);
id	select_type	table	type	possible_keys	key	key_len	ref	rows	Extra
1	PRIMARY	NULL	NULL	NULL	NULL	NULL	NULL	NULL	Impossible WHERE noticed after reading const tables
SELECT * FROM t1 WHERE (t1.i) IN 
(SELECT t3.i FROM t2 RIGHT JOIN t3 ON t2.i=t3.i);
i
EXPLAIN SELECT * FROM t1 WHERE (t1.i) IN 
(SELECT t3.i FROM t2 STRAIGHT_JOIN t3);
id	select_type	table	type	possible_keys	key	key_len	ref	rows	Extra
1	PRIMARY	t1	system	NULL	NULL	NULL	NULL	1	
1	PRIMARY	t2	ALL	NULL	NULL	NULL	NULL	2	Start temporary
1	PRIMARY	t3	ALL	NULL	NULL	NULL	NULL	0	Using where; End temporary; Using join buffer (BNL, incremental buffers)
SELECT * FROM t1 WHERE (t1.i) IN 
(SELECT t3.i FROM t2 STRAIGHT_JOIN t3);
i
EXPLAIN SELECT * FROM t1 WHERE (11) IN 
(SELECT t3.i FROM t2 LEFT JOIN t3 ON t2.i=t3.i);
id	select_type	table	type	possible_keys	key	key_len	ref	rows	Extra
1	PRIMARY	NULL	NULL	NULL	NULL	NULL	NULL	NULL	Impossible WHERE noticed after reading const tables
SELECT * FROM t1 WHERE (11) IN 
(SELECT t3.i FROM t2 LEFT JOIN t3 ON t2.i=t3.i);
i
EXPLAIN SELECT * FROM t1 WHERE (11) IN 
(SELECT t3.i FROM t2 LEFT JOIN t3 ON t2.i=t3.i WHERE t1.i);
id	select_type	table	type	possible_keys	key	key_len	ref	rows	Extra
1	PRIMARY	NULL	NULL	NULL	NULL	NULL	NULL	NULL	Impossible WHERE noticed after reading const tables
SELECT * FROM t1 WHERE (11) IN 
(SELECT t3.i FROM t2 LEFT JOIN t3 ON t2.i=t3.i WHERE t1.i);
i
EXPLAIN SELECT * FROM t1 WHERE (11) IN 
(SELECT t3.i FROM t2 RIGHT JOIN t3 ON t2.i=t3.i);
id	select_type	table	type	possible_keys	key	key_len	ref	rows	Extra
1	PRIMARY	NULL	NULL	NULL	NULL	NULL	NULL	NULL	Impossible WHERE noticed after reading const tables
SELECT * FROM t1 WHERE (11) IN 
(SELECT t3.i FROM t2 RIGHT JOIN t3 ON t2.i=t3.i);
i
EXPLAIN SELECT * FROM t1 WHERE (11) IN 
(SELECT t3.i FROM t2 STRAIGHT_JOIN t3);
id	select_type	table	type	possible_keys	key	key_len	ref	rows	Extra
1	PRIMARY	t1	system	NULL	NULL	NULL	NULL	1	
1	PRIMARY	t2	ALL	NULL	NULL	NULL	NULL	2	Start temporary
1	PRIMARY	t3	ALL	NULL	NULL	NULL	NULL	0	Using where; End temporary; Using join buffer (BNL, incremental buffers)
SELECT * FROM t1 WHERE (11) IN 
(SELECT t3.i FROM t2 STRAIGHT_JOIN t3);
i
INSERT INTO t3 VALUES (2);
SELECT (SELECT COUNT(*) from t1),
(SELECT COUNT(*) from t2),
(SELECT COUNT(*) from t3);
(SELECT COUNT(*) from t1)	(SELECT COUNT(*) from t2)	(SELECT COUNT(*) from t3)
1	2	1
EXPLAIN SELECT * FROM t1 WHERE (t1.i) IN 
(SELECT t3.i FROM t2 LEFT JOIN t3 ON t2.i=t3.i);
id	select_type	table	type	possible_keys	key	key_len	ref	rows	Extra
1	PRIMARY	t1	system	NULL	NULL	NULL	NULL	1	
1	PRIMARY	t2	ALL	NULL	NULL	NULL	NULL	2	Start temporary
1	PRIMARY	t3	ALL	NULL	NULL	NULL	NULL	1	Using where; End temporary; Using join buffer (BNL, incremental buffers)
SELECT * FROM t1 WHERE (t1.i) IN 
(SELECT t3.i FROM t2 LEFT JOIN t3 ON t2.i=t3.i);
i
2
EXPLAIN SELECT * FROM t1 WHERE (t1.i) IN 
(SELECT t3.i FROM t2 RIGHT JOIN t3 ON t2.i=t3.i);
id	select_type	table	type	possible_keys	key	key_len	ref	rows	Extra
1	PRIMARY	t1	system	NULL	NULL	NULL	NULL	1	
1	PRIMARY	t3	system	NULL	NULL	NULL	NULL	1	
1	PRIMARY	t2	ALL	NULL	NULL	NULL	NULL	2	Using where; Start temporary; End temporary
SELECT * FROM t1 WHERE (t1.i) IN 
(SELECT t3.i FROM t2 RIGHT JOIN t3 ON t2.i=t3.i);
i
2
EXPLAIN SELECT * FROM t1 WHERE (t1.i) IN 
(SELECT t3.i FROM t2 STRAIGHT_JOIN t3);
id	select_type	table	type	possible_keys	key	key_len	ref	rows	Extra
1	PRIMARY	t1	system	NULL	NULL	NULL	NULL	1	
1	PRIMARY	t2	ALL	NULL	NULL	NULL	NULL	2	Start temporary
1	PRIMARY	t3	ALL	NULL	NULL	NULL	NULL	1	Using where; End temporary; Using join buffer (BNL, incremental buffers)
SELECT * FROM t1 WHERE (t1.i) IN 
(SELECT t3.i FROM t2 STRAIGHT_JOIN t3);
i
2
EXPLAIN SELECT * FROM t1 WHERE (11) IN 
(SELECT t3.i FROM t2 LEFT JOIN t3 ON t2.i=t3.i);
id	select_type	table	type	possible_keys	key	key_len	ref	rows	Extra
1	PRIMARY	t1	system	NULL	NULL	NULL	NULL	1	
1	PRIMARY	t2	ALL	NULL	NULL	NULL	NULL	2	Start temporary
1	PRIMARY	t3	ALL	NULL	NULL	NULL	NULL	1	Using where; End temporary; Using join buffer (BNL, incremental buffers)
SELECT * FROM t1 WHERE (11) IN 
(SELECT t3.i FROM t2 LEFT JOIN t3 ON t2.i=t3.i);
i
EXPLAIN SELECT * FROM t1 WHERE (11) IN 
(SELECT t3.i FROM t2 LEFT JOIN t3 ON t2.i=t3.i WHERE t1.i);
id	select_type	table	type	possible_keys	key	key_len	ref	rows	Extra
1	PRIMARY	t1	system	NULL	NULL	NULL	NULL	1	
1	PRIMARY	t2	ALL	NULL	NULL	NULL	NULL	2	Start temporary
1	PRIMARY	t3	ALL	NULL	NULL	NULL	NULL	1	Using where; End temporary; Using join buffer (BNL, incremental buffers)
SELECT * FROM t1 WHERE (11) IN 
(SELECT t3.i FROM t2 LEFT JOIN t3 ON t2.i=t3.i WHERE t1.i);
i
EXPLAIN SELECT * FROM t1 WHERE (11) IN 
(SELECT t3.i FROM t2 RIGHT JOIN t3 ON t2.i=t3.i);
id	select_type	table	type	possible_keys	key	key_len	ref	rows	Extra
1	PRIMARY	NULL	NULL	NULL	NULL	NULL	NULL	NULL	Impossible WHERE noticed after reading const tables
SELECT * FROM t1 WHERE (11) IN 
(SELECT t3.i FROM t2 RIGHT JOIN t3 ON t2.i=t3.i);
i
EXPLAIN SELECT * FROM t1 WHERE (11) IN 
(SELECT t3.i FROM t2 STRAIGHT_JOIN t3);
id	select_type	table	type	possible_keys	key	key_len	ref	rows	Extra
1	PRIMARY	t1	system	NULL	NULL	NULL	NULL	1	
1	PRIMARY	t2	ALL	NULL	NULL	NULL	NULL	2	Start temporary
1	PRIMARY	t3	ALL	NULL	NULL	NULL	NULL	1	Using where; End temporary; Using join buffer (BNL, incremental buffers)
SELECT * FROM t1 WHERE (11) IN 
(SELECT t3.i FROM t2 STRAIGHT_JOIN t3);
i
INSERT INTO t3 VALUES (1);
SELECT (SELECT COUNT(*) from t1),
(SELECT COUNT(*) from t2),
(SELECT COUNT(*) from t3);
(SELECT COUNT(*) from t1)	(SELECT COUNT(*) from t2)	(SELECT COUNT(*) from t3)
1	2	2
EXPLAIN SELECT * FROM t1 WHERE (t1.i) IN 
(SELECT t3.i FROM t2 LEFT JOIN t3 ON t2.i=t3.i);
id	select_type	table	type	possible_keys	key	key_len	ref	rows	Extra
1	PRIMARY	t1	system	NULL	NULL	NULL	NULL	1	
1	PRIMARY	t2	ALL	NULL	NULL	NULL	NULL	2	Start temporary
1	PRIMARY	t3	ALL	NULL	NULL	NULL	NULL	2	Using where; End temporary; Using join buffer (BNL, incremental buffers)
SELECT * FROM t1 WHERE (t1.i) IN 
(SELECT t3.i FROM t2 LEFT JOIN t3 ON t2.i=t3.i);
i
2
EXPLAIN SELECT * FROM t1 WHERE (t1.i) IN 
(SELECT t3.i FROM t2 RIGHT JOIN t3 ON t2.i=t3.i);
id	select_type	table	type	possible_keys	key	key_len	ref	rows	Extra
1	PRIMARY	t1	system	NULL	NULL	NULL	NULL	1	
1	PRIMARY	t3	ALL	NULL	NULL	NULL	NULL	2	Using where; Start temporary
1	PRIMARY	t2	ALL	NULL	NULL	NULL	NULL	2	Using where; End temporary; Using join buffer (BNL, incremental buffers)
SELECT * FROM t1 WHERE (t1.i) IN 
(SELECT t3.i FROM t2 RIGHT JOIN t3 ON t2.i=t3.i);
i
2
EXPLAIN SELECT * FROM t1 WHERE (t1.i) IN 
(SELECT t3.i FROM t2 STRAIGHT_JOIN t3);
id	select_type	table	type	possible_keys	key	key_len	ref	rows	Extra
1	PRIMARY	t1	system	NULL	NULL	NULL	NULL	1	
1	PRIMARY	t2	ALL	NULL	NULL	NULL	NULL	2	Start temporary
1	PRIMARY	t3	ALL	NULL	NULL	NULL	NULL	2	Using where; End temporary; Using join buffer (BNL, incremental buffers)
SELECT * FROM t1 WHERE (t1.i) IN 
(SELECT t3.i FROM t2 STRAIGHT_JOIN t3);
i
2
EXPLAIN SELECT * FROM t1 WHERE (11) IN 
(SELECT t3.i FROM t2 LEFT JOIN t3 ON t2.i=t3.i);
id	select_type	table	type	possible_keys	key	key_len	ref	rows	Extra
1	PRIMARY	t1	system	NULL	NULL	NULL	NULL	1	
1	PRIMARY	t2	ALL	NULL	NULL	NULL	NULL	2	Start temporary
1	PRIMARY	t3	ALL	NULL	NULL	NULL	NULL	2	Using where; End temporary; Using join buffer (BNL, incremental buffers)
SELECT * FROM t1 WHERE (11) IN 
(SELECT t3.i FROM t2 LEFT JOIN t3 ON t2.i=t3.i);
i
EXPLAIN SELECT * FROM t1 WHERE (11) IN 
(SELECT t3.i FROM t2 LEFT JOIN t3 ON t2.i=t3.i WHERE t1.i);
id	select_type	table	type	possible_keys	key	key_len	ref	rows	Extra
1	PRIMARY	t1	system	NULL	NULL	NULL	NULL	1	
1	PRIMARY	t2	ALL	NULL	NULL	NULL	NULL	2	Start temporary
1	PRIMARY	t3	ALL	NULL	NULL	NULL	NULL	2	Using where; End temporary; Using join buffer (BNL, incremental buffers)
SELECT * FROM t1 WHERE (11) IN 
(SELECT t3.i FROM t2 LEFT JOIN t3 ON t2.i=t3.i WHERE t1.i);
i
EXPLAIN SELECT * FROM t1 WHERE (11) IN 
(SELECT t3.i FROM t2 RIGHT JOIN t3 ON t2.i=t3.i);
id	select_type	table	type	possible_keys	key	key_len	ref	rows	Extra
1	PRIMARY	t1	system	NULL	NULL	NULL	NULL	1	
1	PRIMARY	t3	ALL	NULL	NULL	NULL	NULL	2	Using where; Start temporary
1	PRIMARY	t2	ALL	NULL	NULL	NULL	NULL	2	Using where; End temporary; Using join buffer (BNL, incremental buffers)
SELECT * FROM t1 WHERE (11) IN 
(SELECT t3.i FROM t2 RIGHT JOIN t3 ON t2.i=t3.i);
i
EXPLAIN SELECT * FROM t1 WHERE (11) IN 
(SELECT t3.i FROM t2 STRAIGHT_JOIN t3);
id	select_type	table	type	possible_keys	key	key_len	ref	rows	Extra
1	PRIMARY	t1	system	NULL	NULL	NULL	NULL	1	
1	PRIMARY	t2	ALL	NULL	NULL	NULL	NULL	2	Start temporary
1	PRIMARY	t3	ALL	NULL	NULL	NULL	NULL	2	Using where; End temporary; Using join buffer (BNL, incremental buffers)
SELECT * FROM t1 WHERE (11) IN 
(SELECT t3.i FROM t2 STRAIGHT_JOIN t3);
i
INSERT INTO t3 VALUES (0);
DELETE FROM t3;
INSERT INTO t2 VALUES (0);
DELETE FROM t2;
INSERT INTO t1 VALUES (1);
SELECT (SELECT COUNT(*) from t1),
(SELECT COUNT(*) from t2),
(SELECT COUNT(*) from t3);
(SELECT COUNT(*) from t1)	(SELECT COUNT(*) from t2)	(SELECT COUNT(*) from t3)
2	0	0
EXPLAIN SELECT * FROM t1 WHERE (t1.i) IN 
(SELECT t3.i FROM t2 LEFT JOIN t3 ON t2.i=t3.i);
id	select_type	table	type	possible_keys	key	key_len	ref	rows	Extra
1	PRIMARY	NULL	NULL	NULL	NULL	NULL	NULL	NULL	Impossible WHERE noticed after reading const tables
SELECT * FROM t1 WHERE (t1.i) IN 
(SELECT t3.i FROM t2 LEFT JOIN t3 ON t2.i=t3.i);
i
EXPLAIN SELECT * FROM t1 WHERE (t1.i) IN 
(SELECT t3.i FROM t2 RIGHT JOIN t3 ON t2.i=t3.i);
id	select_type	table	type	possible_keys	key	key_len	ref	rows	Extra
1	PRIMARY	NULL	NULL	NULL	NULL	NULL	NULL	NULL	Impossible WHERE noticed after reading const tables
SELECT * FROM t1 WHERE (t1.i) IN 
(SELECT t3.i FROM t2 RIGHT JOIN t3 ON t2.i=t3.i);
i
EXPLAIN SELECT * FROM t1 WHERE (t1.i) IN 
(SELECT t3.i FROM t2 STRAIGHT_JOIN t3);
id	select_type	table	type	possible_keys	key	key_len	ref	rows	Extra
1	PRIMARY	NULL	NULL	NULL	NULL	NULL	NULL	NULL	Impossible WHERE noticed after reading const tables
SELECT * FROM t1 WHERE (t1.i) IN 
(SELECT t3.i FROM t2 STRAIGHT_JOIN t3);
i
EXPLAIN SELECT * FROM t1 WHERE (11) IN 
(SELECT t3.i FROM t2 LEFT JOIN t3 ON t2.i=t3.i);
id	select_type	table	type	possible_keys	key	key_len	ref	rows	Extra
1	PRIMARY	NULL	NULL	NULL	NULL	NULL	NULL	NULL	Impossible WHERE noticed after reading const tables
SELECT * FROM t1 WHERE (11) IN 
(SELECT t3.i FROM t2 LEFT JOIN t3 ON t2.i=t3.i);
i
EXPLAIN SELECT * FROM t1 WHERE (11) IN 
(SELECT t3.i FROM t2 LEFT JOIN t3 ON t2.i=t3.i WHERE t1.i);
id	select_type	table	type	possible_keys	key	key_len	ref	rows	Extra
1	PRIMARY	NULL	NULL	NULL	NULL	NULL	NULL	NULL	Impossible WHERE noticed after reading const tables
SELECT * FROM t1 WHERE (11) IN 
(SELECT t3.i FROM t2 LEFT JOIN t3 ON t2.i=t3.i WHERE t1.i);
i
EXPLAIN SELECT * FROM t1 WHERE (11) IN 
(SELECT t3.i FROM t2 RIGHT JOIN t3 ON t2.i=t3.i);
id	select_type	table	type	possible_keys	key	key_len	ref	rows	Extra
1	PRIMARY	NULL	NULL	NULL	NULL	NULL	NULL	NULL	Impossible WHERE noticed after reading const tables
SELECT * FROM t1 WHERE (11) IN 
(SELECT t3.i FROM t2 RIGHT JOIN t3 ON t2.i=t3.i);
i
EXPLAIN SELECT * FROM t1 WHERE (11) IN 
(SELECT t3.i FROM t2 STRAIGHT_JOIN t3);
id	select_type	table	type	possible_keys	key	key_len	ref	rows	Extra
1	PRIMARY	NULL	NULL	NULL	NULL	NULL	NULL	NULL	Impossible WHERE noticed after reading const tables
SELECT * FROM t1 WHERE (11) IN 
(SELECT t3.i FROM t2 STRAIGHT_JOIN t3);
i
INSERT INTO t3 VALUES (2);
SELECT (SELECT COUNT(*) from t1),
(SELECT COUNT(*) from t2),
(SELECT COUNT(*) from t3);
(SELECT COUNT(*) from t1)	(SELECT COUNT(*) from t2)	(SELECT COUNT(*) from t3)
2	0	1
EXPLAIN SELECT * FROM t1 WHERE (t1.i) IN 
(SELECT t3.i FROM t2 LEFT JOIN t3 ON t2.i=t3.i);
id	select_type	table	type	possible_keys	key	key_len	ref	rows	Extra
1	PRIMARY	NULL	NULL	NULL	NULL	NULL	NULL	NULL	Impossible WHERE noticed after reading const tables
SELECT * FROM t1 WHERE (t1.i) IN 
(SELECT t3.i FROM t2 LEFT JOIN t3 ON t2.i=t3.i);
i
EXPLAIN SELECT * FROM t1 WHERE (t1.i) IN 
(SELECT t3.i FROM t2 RIGHT JOIN t3 ON t2.i=t3.i);
id	select_type	table	type	possible_keys	key	key_len	ref	rows	Extra
1	PRIMARY	t2	system	NULL	NULL	NULL	NULL	0	const row not found
1	PRIMARY	t3	system	NULL	NULL	NULL	NULL	1	
1	PRIMARY	t1	ALL	NULL	NULL	NULL	NULL	2	Using where
SELECT * FROM t1 WHERE (t1.i) IN 
(SELECT t3.i FROM t2 RIGHT JOIN t3 ON t2.i=t3.i);
i
2
EXPLAIN SELECT * FROM t1 WHERE (t1.i) IN 
(SELECT t3.i FROM t2 STRAIGHT_JOIN t3);
id	select_type	table	type	possible_keys	key	key_len	ref	rows	Extra
1	PRIMARY	NULL	NULL	NULL	NULL	NULL	NULL	NULL	Impossible WHERE noticed after reading const tables
SELECT * FROM t1 WHERE (t1.i) IN 
(SELECT t3.i FROM t2 STRAIGHT_JOIN t3);
i
EXPLAIN SELECT * FROM t1 WHERE (11) IN 
(SELECT t3.i FROM t2 LEFT JOIN t3 ON t2.i=t3.i);
id	select_type	table	type	possible_keys	key	key_len	ref	rows	Extra
1	PRIMARY	NULL	NULL	NULL	NULL	NULL	NULL	NULL	Impossible WHERE noticed after reading const tables
SELECT * FROM t1 WHERE (11) IN 
(SELECT t3.i FROM t2 LEFT JOIN t3 ON t2.i=t3.i);
i
EXPLAIN SELECT * FROM t1 WHERE (11) IN 
(SELECT t3.i FROM t2 LEFT JOIN t3 ON t2.i=t3.i WHERE t1.i);
id	select_type	table	type	possible_keys	key	key_len	ref	rows	Extra
1	PRIMARY	NULL	NULL	NULL	NULL	NULL	NULL	NULL	Impossible WHERE noticed after reading const tables
SELECT * FROM t1 WHERE (11) IN 
(SELECT t3.i FROM t2 LEFT JOIN t3 ON t2.i=t3.i WHERE t1.i);
i
EXPLAIN SELECT * FROM t1 WHERE (11) IN 
(SELECT t3.i FROM t2 RIGHT JOIN t3 ON t2.i=t3.i);
id	select_type	table	type	possible_keys	key	key_len	ref	rows	Extra
1	PRIMARY	NULL	NULL	NULL	NULL	NULL	NULL	NULL	Impossible WHERE noticed after reading const tables
SELECT * FROM t1 WHERE (11) IN 
(SELECT t3.i FROM t2 RIGHT JOIN t3 ON t2.i=t3.i);
i
EXPLAIN SELECT * FROM t1 WHERE (11) IN 
(SELECT t3.i FROM t2 STRAIGHT_JOIN t3);
id	select_type	table	type	possible_keys	key	key_len	ref	rows	Extra
1	PRIMARY	NULL	NULL	NULL	NULL	NULL	NULL	NULL	Impossible WHERE noticed after reading const tables
SELECT * FROM t1 WHERE (11) IN 
(SELECT t3.i FROM t2 STRAIGHT_JOIN t3);
i
INSERT INTO t3 VALUES (1);
SELECT (SELECT COUNT(*) from t1),
(SELECT COUNT(*) from t2),
(SELECT COUNT(*) from t3);
(SELECT COUNT(*) from t1)	(SELECT COUNT(*) from t2)	(SELECT COUNT(*) from t3)
2	0	2
EXPLAIN SELECT * FROM t1 WHERE (t1.i) IN 
(SELECT t3.i FROM t2 LEFT JOIN t3 ON t2.i=t3.i);
id	select_type	table	type	possible_keys	key	key_len	ref	rows	Extra
1	PRIMARY	NULL	NULL	NULL	NULL	NULL	NULL	NULL	Impossible WHERE noticed after reading const tables
SELECT * FROM t1 WHERE (t1.i) IN 
(SELECT t3.i FROM t2 LEFT JOIN t3 ON t2.i=t3.i);
i
EXPLAIN SELECT * FROM t1 WHERE (t1.i) IN 
(SELECT t3.i FROM t2 RIGHT JOIN t3 ON t2.i=t3.i);
id	select_type	table	type	possible_keys	key	key_len	ref	rows	Extra
1	PRIMARY	t2	system	NULL	NULL	NULL	NULL	0	const row not found
1	PRIMARY	t1	ALL	NULL	NULL	NULL	NULL	2	Start temporary
1	PRIMARY	t3	ALL	NULL	NULL	NULL	NULL	2	Using where; End temporary; Using join buffer (BNL, incremental buffers)
SELECT * FROM t1 WHERE (t1.i) IN 
(SELECT t3.i FROM t2 RIGHT JOIN t3 ON t2.i=t3.i);
i
2
1
EXPLAIN SELECT * FROM t1 WHERE (t1.i) IN 
(SELECT t3.i FROM t2 STRAIGHT_JOIN t3);
id	select_type	table	type	possible_keys	key	key_len	ref	rows	Extra
1	PRIMARY	NULL	NULL	NULL	NULL	NULL	NULL	NULL	Impossible WHERE noticed after reading const tables
SELECT * FROM t1 WHERE (t1.i) IN 
(SELECT t3.i FROM t2 STRAIGHT_JOIN t3);
i
EXPLAIN SELECT * FROM t1 WHERE (11) IN 
(SELECT t3.i FROM t2 LEFT JOIN t3 ON t2.i=t3.i);
id	select_type	table	type	possible_keys	key	key_len	ref	rows	Extra
1	PRIMARY	NULL	NULL	NULL	NULL	NULL	NULL	NULL	Impossible WHERE noticed after reading const tables
SELECT * FROM t1 WHERE (11) IN 
(SELECT t3.i FROM t2 LEFT JOIN t3 ON t2.i=t3.i);
i
EXPLAIN SELECT * FROM t1 WHERE (11) IN 
(SELECT t3.i FROM t2 LEFT JOIN t3 ON t2.i=t3.i WHERE t1.i);
id	select_type	table	type	possible_keys	key	key_len	ref	rows	Extra
1	PRIMARY	NULL	NULL	NULL	NULL	NULL	NULL	NULL	Impossible WHERE noticed after reading const tables
SELECT * FROM t1 WHERE (11) IN 
(SELECT t3.i FROM t2 LEFT JOIN t3 ON t2.i=t3.i WHERE t1.i);
i
EXPLAIN SELECT * FROM t1 WHERE (11) IN 
(SELECT t3.i FROM t2 RIGHT JOIN t3 ON t2.i=t3.i);
id	select_type	table	type	possible_keys	key	key_len	ref	rows	Extra
1	PRIMARY	t2	system	NULL	NULL	NULL	NULL	0	const row not found
1	PRIMARY	t3	ALL	NULL	NULL	NULL	NULL	2	Using where; Start temporary; End temporary
1	PRIMARY	t1	ALL	NULL	NULL	NULL	NULL	2	Using join buffer (BNL, incremental buffers)
SELECT * FROM t1 WHERE (11) IN 
(SELECT t3.i FROM t2 RIGHT JOIN t3 ON t2.i=t3.i);
i
EXPLAIN SELECT * FROM t1 WHERE (11) IN 
(SELECT t3.i FROM t2 STRAIGHT_JOIN t3);
id	select_type	table	type	possible_keys	key	key_len	ref	rows	Extra
1	PRIMARY	NULL	NULL	NULL	NULL	NULL	NULL	NULL	Impossible WHERE noticed after reading const tables
SELECT * FROM t1 WHERE (11) IN 
(SELECT t3.i FROM t2 STRAIGHT_JOIN t3);
i
INSERT INTO t3 VALUES (0);
DELETE FROM t3;
INSERT INTO t2 VALUES (2);
SELECT (SELECT COUNT(*) from t1),
(SELECT COUNT(*) from t2),
(SELECT COUNT(*) from t3);
(SELECT COUNT(*) from t1)	(SELECT COUNT(*) from t2)	(SELECT COUNT(*) from t3)
2	1	0
EXPLAIN SELECT * FROM t1 WHERE (t1.i) IN 
(SELECT t3.i FROM t2 LEFT JOIN t3 ON t2.i=t3.i);
id	select_type	table	type	possible_keys	key	key_len	ref	rows	Extra
1	PRIMARY	t2	system	NULL	NULL	NULL	NULL	1	
1	PRIMARY	t3	system	NULL	NULL	NULL	NULL	0	const row not found
1	PRIMARY	t1	ALL	NULL	NULL	NULL	NULL	2	Using where
SELECT * FROM t1 WHERE (t1.i) IN 
(SELECT t3.i FROM t2 LEFT JOIN t3 ON t2.i=t3.i);
i
EXPLAIN SELECT * FROM t1 WHERE (t1.i) IN 
(SELECT t3.i FROM t2 RIGHT JOIN t3 ON t2.i=t3.i);
id	select_type	table	type	possible_keys	key	key_len	ref	rows	Extra
1	PRIMARY	NULL	NULL	NULL	NULL	NULL	NULL	NULL	Impossible WHERE noticed after reading const tables
SELECT * FROM t1 WHERE (t1.i) IN 
(SELECT t3.i FROM t2 RIGHT JOIN t3 ON t2.i=t3.i);
i
EXPLAIN SELECT * FROM t1 WHERE (t1.i) IN 
(SELECT t3.i FROM t2 STRAIGHT_JOIN t3);
id	select_type	table	type	possible_keys	key	key_len	ref	rows	Extra
1	PRIMARY	NULL	NULL	NULL	NULL	NULL	NULL	NULL	Impossible WHERE noticed after reading const tables
SELECT * FROM t1 WHERE (t1.i) IN 
(SELECT t3.i FROM t2 STRAIGHT_JOIN t3);
i
EXPLAIN SELECT * FROM t1 WHERE (11) IN 
(SELECT t3.i FROM t2 LEFT JOIN t3 ON t2.i=t3.i);
id	select_type	table	type	possible_keys	key	key_len	ref	rows	Extra
1	PRIMARY	NULL	NULL	NULL	NULL	NULL	NULL	NULL	Impossible WHERE noticed after reading const tables
SELECT * FROM t1 WHERE (11) IN 
(SELECT t3.i FROM t2 LEFT JOIN t3 ON t2.i=t3.i);
i
EXPLAIN SELECT * FROM t1 WHERE (11) IN 
(SELECT t3.i FROM t2 LEFT JOIN t3 ON t2.i=t3.i WHERE t1.i);
id	select_type	table	type	possible_keys	key	key_len	ref	rows	Extra
1	PRIMARY	NULL	NULL	NULL	NULL	NULL	NULL	NULL	Impossible WHERE noticed after reading const tables
SELECT * FROM t1 WHERE (11) IN 
(SELECT t3.i FROM t2 LEFT JOIN t3 ON t2.i=t3.i WHERE t1.i);
i
EXPLAIN SELECT * FROM t1 WHERE (11) IN 
(SELECT t3.i FROM t2 RIGHT JOIN t3 ON t2.i=t3.i);
id	select_type	table	type	possible_keys	key	key_len	ref	rows	Extra
1	PRIMARY	NULL	NULL	NULL	NULL	NULL	NULL	NULL	Impossible WHERE noticed after reading const tables
SELECT * FROM t1 WHERE (11) IN 
(SELECT t3.i FROM t2 RIGHT JOIN t3 ON t2.i=t3.i);
i
EXPLAIN SELECT * FROM t1 WHERE (11) IN 
(SELECT t3.i FROM t2 STRAIGHT_JOIN t3);
id	select_type	table	type	possible_keys	key	key_len	ref	rows	Extra
1	PRIMARY	NULL	NULL	NULL	NULL	NULL	NULL	NULL	Impossible WHERE noticed after reading const tables
SELECT * FROM t1 WHERE (11) IN 
(SELECT t3.i FROM t2 STRAIGHT_JOIN t3);
i
INSERT INTO t3 VALUES (2);
SELECT (SELECT COUNT(*) from t1),
(SELECT COUNT(*) from t2),
(SELECT COUNT(*) from t3);
(SELECT COUNT(*) from t1)	(SELECT COUNT(*) from t2)	(SELECT COUNT(*) from t3)
2	1	1
EXPLAIN SELECT * FROM t1 WHERE (t1.i) IN 
(SELECT t3.i FROM t2 LEFT JOIN t3 ON t2.i=t3.i);
id	select_type	table	type	possible_keys	key	key_len	ref	rows	Extra
1	PRIMARY	t2	system	NULL	NULL	NULL	NULL	1	
1	PRIMARY	t3	system	NULL	NULL	NULL	NULL	1	
1	PRIMARY	t1	ALL	NULL	NULL	NULL	NULL	2	Using where
SELECT * FROM t1 WHERE (t1.i) IN 
(SELECT t3.i FROM t2 LEFT JOIN t3 ON t2.i=t3.i);
i
2
EXPLAIN SELECT * FROM t1 WHERE (t1.i) IN 
(SELECT t3.i FROM t2 RIGHT JOIN t3 ON t2.i=t3.i);
id	select_type	table	type	possible_keys	key	key_len	ref	rows	Extra
1	PRIMARY	t3	system	NULL	NULL	NULL	NULL	1	
1	PRIMARY	t2	system	NULL	NULL	NULL	NULL	1	
1	PRIMARY	t1	ALL	NULL	NULL	NULL	NULL	2	Using where
SELECT * FROM t1 WHERE (t1.i) IN 
(SELECT t3.i FROM t2 RIGHT JOIN t3 ON t2.i=t3.i);
i
2
EXPLAIN SELECT * FROM t1 WHERE (t1.i) IN 
(SELECT t3.i FROM t2 STRAIGHT_JOIN t3);
id	select_type	table	type	possible_keys	key	key_len	ref	rows	Extra
1	PRIMARY	t2	system	NULL	NULL	NULL	NULL	1	
1	PRIMARY	t3	system	NULL	NULL	NULL	NULL	1	
1	PRIMARY	t1	ALL	NULL	NULL	NULL	NULL	2	Using where
SELECT * FROM t1 WHERE (t1.i) IN 
(SELECT t3.i FROM t2 STRAIGHT_JOIN t3);
i
2
EXPLAIN SELECT * FROM t1 WHERE (11) IN 
(SELECT t3.i FROM t2 LEFT JOIN t3 ON t2.i=t3.i);
id	select_type	table	type	possible_keys	key	key_len	ref	rows	Extra
1	PRIMARY	NULL	NULL	NULL	NULL	NULL	NULL	NULL	Impossible WHERE noticed after reading const tables
SELECT * FROM t1 WHERE (11) IN 
(SELECT t3.i FROM t2 LEFT JOIN t3 ON t2.i=t3.i);
i
EXPLAIN SELECT * FROM t1 WHERE (11) IN 
(SELECT t3.i FROM t2 LEFT JOIN t3 ON t2.i=t3.i WHERE t1.i);
id	select_type	table	type	possible_keys	key	key_len	ref	rows	Extra
1	PRIMARY	NULL	NULL	NULL	NULL	NULL	NULL	NULL	Impossible WHERE noticed after reading const tables
SELECT * FROM t1 WHERE (11) IN 
(SELECT t3.i FROM t2 LEFT JOIN t3 ON t2.i=t3.i WHERE t1.i);
i
EXPLAIN SELECT * FROM t1 WHERE (11) IN 
(SELECT t3.i FROM t2 RIGHT JOIN t3 ON t2.i=t3.i);
id	select_type	table	type	possible_keys	key	key_len	ref	rows	Extra
1	PRIMARY	NULL	NULL	NULL	NULL	NULL	NULL	NULL	Impossible WHERE noticed after reading const tables
SELECT * FROM t1 WHERE (11) IN 
(SELECT t3.i FROM t2 RIGHT JOIN t3 ON t2.i=t3.i);
i
EXPLAIN SELECT * FROM t1 WHERE (11) IN 
(SELECT t3.i FROM t2 STRAIGHT_JOIN t3);
id	select_type	table	type	possible_keys	key	key_len	ref	rows	Extra
1	PRIMARY	NULL	NULL	NULL	NULL	NULL	NULL	NULL	Impossible WHERE noticed after reading const tables
SELECT * FROM t1 WHERE (11) IN 
(SELECT t3.i FROM t2 STRAIGHT_JOIN t3);
i
INSERT INTO t3 VALUES (1);
SELECT (SELECT COUNT(*) from t1),
(SELECT COUNT(*) from t2),
(SELECT COUNT(*) from t3);
(SELECT COUNT(*) from t1)	(SELECT COUNT(*) from t2)	(SELECT COUNT(*) from t3)
2	1	2
EXPLAIN SELECT * FROM t1 WHERE (t1.i) IN 
(SELECT t3.i FROM t2 LEFT JOIN t3 ON t2.i=t3.i);
id	select_type	table	type	possible_keys	key	key_len	ref	rows	Extra
1	PRIMARY	t2	system	NULL	NULL	NULL	NULL	1	
1	PRIMARY	t1	ALL	NULL	NULL	NULL	NULL	2	Start temporary
1	PRIMARY	t3	ALL	NULL	NULL	NULL	NULL	2	Using where; End temporary; Using join buffer (BNL, incremental buffers)
SELECT * FROM t1 WHERE (t1.i) IN 
(SELECT t3.i FROM t2 LEFT JOIN t3 ON t2.i=t3.i);
i
2
EXPLAIN SELECT * FROM t1 WHERE (t1.i) IN 
(SELECT t3.i FROM t2 RIGHT JOIN t3 ON t2.i=t3.i);
id	select_type	table	type	possible_keys	key	key_len	ref	rows	Extra
1	PRIMARY	t1	ALL	NULL	NULL	NULL	NULL	2	Start temporary
1	PRIMARY	t3	ALL	NULL	NULL	NULL	NULL	2	Using where; Using join buffer (BNL, incremental buffers)
1	PRIMARY	t2	ALL	NULL	NULL	NULL	NULL	1	Using where; End temporary; Using join buffer (BNL, incremental buffers)
SELECT * FROM t1 WHERE (t1.i) IN 
(SELECT t3.i FROM t2 RIGHT JOIN t3 ON t2.i=t3.i);
i
2
1
EXPLAIN SELECT * FROM t1 WHERE (t1.i) IN 
(SELECT t3.i FROM t2 STRAIGHT_JOIN t3);
id	select_type	table	type	possible_keys	key	key_len	ref	rows	Extra
1	PRIMARY	t2	system	NULL	NULL	NULL	NULL	1	
1	PRIMARY	t1	ALL	NULL	NULL	NULL	NULL	2	Start temporary
1	PRIMARY	t3	ALL	NULL	NULL	NULL	NULL	2	Using where; End temporary; Using join buffer (BNL, incremental buffers)
SELECT * FROM t1 WHERE (t1.i) IN 
(SELECT t3.i FROM t2 STRAIGHT_JOIN t3);
i
2
1
EXPLAIN SELECT * FROM t1 WHERE (11) IN 
(SELECT t3.i FROM t2 LEFT JOIN t3 ON t2.i=t3.i);
id	select_type	table	type	possible_keys	key	key_len	ref	rows	Extra
1	PRIMARY	t2	system	NULL	NULL	NULL	NULL	1	
1	PRIMARY	t3	ALL	NULL	NULL	NULL	NULL	2	Using where; Start temporary; End temporary
1	PRIMARY	t1	ALL	NULL	NULL	NULL	NULL	2	Using join buffer (BNL, incremental buffers)
SELECT * FROM t1 WHERE (11) IN 
(SELECT t3.i FROM t2 LEFT JOIN t3 ON t2.i=t3.i);
i
EXPLAIN SELECT * FROM t1 WHERE (11) IN 
(SELECT t3.i FROM t2 LEFT JOIN t3 ON t2.i=t3.i WHERE t1.i);
id	select_type	table	type	possible_keys	key	key_len	ref	rows	Extra
1	PRIMARY	t2	system	NULL	NULL	NULL	NULL	1	
1	PRIMARY	t1	ALL	NULL	NULL	NULL	NULL	2	Using where; Start temporary
1	PRIMARY	t3	ALL	NULL	NULL	NULL	NULL	2	Using where; End temporary; Using join buffer (BNL, incremental buffers)
SELECT * FROM t1 WHERE (11) IN 
(SELECT t3.i FROM t2 LEFT JOIN t3 ON t2.i=t3.i WHERE t1.i);
i
EXPLAIN SELECT * FROM t1 WHERE (11) IN 
(SELECT t3.i FROM t2 RIGHT JOIN t3 ON t2.i=t3.i);
id	select_type	table	type	possible_keys	key	key_len	ref	rows	Extra
1	PRIMARY	t1	ALL	NULL	NULL	NULL	NULL	2	Start temporary
1	PRIMARY	t3	ALL	NULL	NULL	NULL	NULL	2	Using where; Using join buffer (BNL, incremental buffers)
1	PRIMARY	t2	ALL	NULL	NULL	NULL	NULL	1	Using where; End temporary; Using join buffer (BNL, incremental buffers)
SELECT * FROM t1 WHERE (11) IN 
(SELECT t3.i FROM t2 RIGHT JOIN t3 ON t2.i=t3.i);
i
EXPLAIN SELECT * FROM t1 WHERE (11) IN 
(SELECT t3.i FROM t2 STRAIGHT_JOIN t3);
id	select_type	table	type	possible_keys	key	key_len	ref	rows	Extra
1	PRIMARY	t2	system	NULL	NULL	NULL	NULL	1	
1	PRIMARY	t3	ALL	NULL	NULL	NULL	NULL	2	Using where; Start temporary; End temporary
1	PRIMARY	t1	ALL	NULL	NULL	NULL	NULL	2	Using join buffer (BNL, incremental buffers)
SELECT * FROM t1 WHERE (11) IN 
(SELECT t3.i FROM t2 STRAIGHT_JOIN t3);
i
INSERT INTO t3 VALUES (0);
DELETE FROM t3;
INSERT INTO t2 VALUES (1);
SELECT (SELECT COUNT(*) from t1),
(SELECT COUNT(*) from t2),
(SELECT COUNT(*) from t3);
(SELECT COUNT(*) from t1)	(SELECT COUNT(*) from t2)	(SELECT COUNT(*) from t3)
2	2	0
EXPLAIN SELECT * FROM t1 WHERE (t1.i) IN 
(SELECT t3.i FROM t2 LEFT JOIN t3 ON t2.i=t3.i);
id	select_type	table	type	possible_keys	key	key_len	ref	rows	Extra
1	PRIMARY	t3	system	NULL	NULL	NULL	NULL	0	const row not found
1	PRIMARY	t1	ALL	NULL	NULL	NULL	NULL	2	Using where; Start temporary
1	PRIMARY	t2	ALL	NULL	NULL	NULL	NULL	2	End temporary; Using join buffer (BNL, incremental buffers)
SELECT * FROM t1 WHERE (t1.i) IN 
(SELECT t3.i FROM t2 LEFT JOIN t3 ON t2.i=t3.i);
i
EXPLAIN SELECT * FROM t1 WHERE (t1.i) IN 
(SELECT t3.i FROM t2 RIGHT JOIN t3 ON t2.i=t3.i);
id	select_type	table	type	possible_keys	key	key_len	ref	rows	Extra
1	PRIMARY	NULL	NULL	NULL	NULL	NULL	NULL	NULL	Impossible WHERE noticed after reading const tables
SELECT * FROM t1 WHERE (t1.i) IN 
(SELECT t3.i FROM t2 RIGHT JOIN t3 ON t2.i=t3.i);
i
EXPLAIN SELECT * FROM t1 WHERE (t1.i) IN 
(SELECT t3.i FROM t2 STRAIGHT_JOIN t3);
id	select_type	table	type	possible_keys	key	key_len	ref	rows	Extra
1	PRIMARY	t1	ALL	NULL	NULL	NULL	NULL	2	Start temporary
1	PRIMARY	t2	ALL	NULL	NULL	NULL	NULL	2	Using join buffer (BNL, incremental buffers)
1	PRIMARY	t3	ALL	NULL	NULL	NULL	NULL	0	Using where; End temporary; Using join buffer (BNL, incremental buffers)
SELECT * FROM t1 WHERE (t1.i) IN 
(SELECT t3.i FROM t2 STRAIGHT_JOIN t3);
i
EXPLAIN SELECT * FROM t1 WHERE (11) IN 
(SELECT t3.i FROM t2 LEFT JOIN t3 ON t2.i=t3.i);
id	select_type	table	type	possible_keys	key	key_len	ref	rows	Extra
1	PRIMARY	NULL	NULL	NULL	NULL	NULL	NULL	NULL	Impossible WHERE noticed after reading const tables
SELECT * FROM t1 WHERE (11) IN 
(SELECT t3.i FROM t2 LEFT JOIN t3 ON t2.i=t3.i);
i
EXPLAIN SELECT * FROM t1 WHERE (11) IN 
(SELECT t3.i FROM t2 LEFT JOIN t3 ON t2.i=t3.i WHERE t1.i);
id	select_type	table	type	possible_keys	key	key_len	ref	rows	Extra
1	PRIMARY	NULL	NULL	NULL	NULL	NULL	NULL	NULL	Impossible WHERE noticed after reading const tables
SELECT * FROM t1 WHERE (11) IN 
(SELECT t3.i FROM t2 LEFT JOIN t3 ON t2.i=t3.i WHERE t1.i);
i
EXPLAIN SELECT * FROM t1 WHERE (11) IN 
(SELECT t3.i FROM t2 RIGHT JOIN t3 ON t2.i=t3.i);
id	select_type	table	type	possible_keys	key	key_len	ref	rows	Extra
1	PRIMARY	NULL	NULL	NULL	NULL	NULL	NULL	NULL	Impossible WHERE noticed after reading const tables
SELECT * FROM t1 WHERE (11) IN 
(SELECT t3.i FROM t2 RIGHT JOIN t3 ON t2.i=t3.i);
i
EXPLAIN SELECT * FROM t1 WHERE (11) IN 
(SELECT t3.i FROM t2 STRAIGHT_JOIN t3);
id	select_type	table	type	possible_keys	key	key_len	ref	rows	Extra
1	PRIMARY	t1	ALL	NULL	NULL	NULL	NULL	2	Start temporary
1	PRIMARY	t2	ALL	NULL	NULL	NULL	NULL	2	Using join buffer (BNL, incremental buffers)
1	PRIMARY	t3	ALL	NULL	NULL	NULL	NULL	0	Using where; End temporary; Using join buffer (BNL, incremental buffers)
SELECT * FROM t1 WHERE (11) IN 
(SELECT t3.i FROM t2 STRAIGHT_JOIN t3);
i
INSERT INTO t3 VALUES (2);
SELECT (SELECT COUNT(*) from t1),
(SELECT COUNT(*) from t2),
(SELECT COUNT(*) from t3);
(SELECT COUNT(*) from t1)	(SELECT COUNT(*) from t2)	(SELECT COUNT(*) from t3)
2	2	1
EXPLAIN SELECT * FROM t1 WHERE (t1.i) IN 
(SELECT t3.i FROM t2 LEFT JOIN t3 ON t2.i=t3.i);
id	select_type	table	type	possible_keys	key	key_len	ref	rows	Extra
1	PRIMARY	t1	ALL	NULL	NULL	NULL	NULL	2	Start temporary
1	PRIMARY	t2	ALL	NULL	NULL	NULL	NULL	2	Using join buffer (BNL, incremental buffers)
1	PRIMARY	t3	ALL	NULL	NULL	NULL	NULL	1	Using where; End temporary; Using join buffer (BNL, incremental buffers)
SELECT * FROM t1 WHERE (t1.i) IN 
(SELECT t3.i FROM t2 LEFT JOIN t3 ON t2.i=t3.i);
i
2
EXPLAIN SELECT * FROM t1 WHERE (t1.i) IN 
(SELECT t3.i FROM t2 RIGHT JOIN t3 ON t2.i=t3.i);
id	select_type	table	type	possible_keys	key	key_len	ref	rows	Extra
1	PRIMARY	t3	system	NULL	NULL	NULL	NULL	1	
1	PRIMARY	t1	ALL	NULL	NULL	NULL	NULL	2	Using where; Start temporary
1	PRIMARY	t2	ALL	NULL	NULL	NULL	NULL	2	Using where; End temporary; Using join buffer (BNL, incremental buffers)
SELECT * FROM t1 WHERE (t1.i) IN 
(SELECT t3.i FROM t2 RIGHT JOIN t3 ON t2.i=t3.i);
i
2
EXPLAIN SELECT * FROM t1 WHERE (t1.i) IN 
(SELECT t3.i FROM t2 STRAIGHT_JOIN t3);
id	select_type	table	type	possible_keys	key	key_len	ref	rows	Extra
1	PRIMARY	t1	ALL	NULL	NULL	NULL	NULL	2	Start temporary
1	PRIMARY	t2	ALL	NULL	NULL	NULL	NULL	2	Using join buffer (BNL, incremental buffers)
1	PRIMARY	t3	ALL	NULL	NULL	NULL	NULL	1	Using where; End temporary; Using join buffer (BNL, incremental buffers)
SELECT * FROM t1 WHERE (t1.i) IN 
(SELECT t3.i FROM t2 STRAIGHT_JOIN t3);
i
2
EXPLAIN SELECT * FROM t1 WHERE (11) IN 
(SELECT t3.i FROM t2 LEFT JOIN t3 ON t2.i=t3.i);
id	select_type	table	type	possible_keys	key	key_len	ref	rows	Extra
1	PRIMARY	t1	ALL	NULL	NULL	NULL	NULL	2	Start temporary
1	PRIMARY	t2	ALL	NULL	NULL	NULL	NULL	2	Using join buffer (BNL, incremental buffers)
1	PRIMARY	t3	ALL	NULL	NULL	NULL	NULL	1	Using where; End temporary; Using join buffer (BNL, incremental buffers)
SELECT * FROM t1 WHERE (11) IN 
(SELECT t3.i FROM t2 LEFT JOIN t3 ON t2.i=t3.i);
i
EXPLAIN SELECT * FROM t1 WHERE (11) IN 
(SELECT t3.i FROM t2 LEFT JOIN t3 ON t2.i=t3.i WHERE t1.i);
id	select_type	table	type	possible_keys	key	key_len	ref	rows	Extra
1	PRIMARY	t1	ALL	NULL	NULL	NULL	NULL	2	Using where; Start temporary
1	PRIMARY	t2	ALL	NULL	NULL	NULL	NULL	2	Using join buffer (BNL, incremental buffers)
1	PRIMARY	t3	ALL	NULL	NULL	NULL	NULL	1	Using where; End temporary; Using join buffer (BNL, incremental buffers)
SELECT * FROM t1 WHERE (11) IN 
(SELECT t3.i FROM t2 LEFT JOIN t3 ON t2.i=t3.i WHERE t1.i);
i
EXPLAIN SELECT * FROM t1 WHERE (11) IN 
(SELECT t3.i FROM t2 RIGHT JOIN t3 ON t2.i=t3.i);
id	select_type	table	type	possible_keys	key	key_len	ref	rows	Extra
1	PRIMARY	NULL	NULL	NULL	NULL	NULL	NULL	NULL	Impossible WHERE noticed after reading const tables
SELECT * FROM t1 WHERE (11) IN 
(SELECT t3.i FROM t2 RIGHT JOIN t3 ON t2.i=t3.i);
i
EXPLAIN SELECT * FROM t1 WHERE (11) IN 
(SELECT t3.i FROM t2 STRAIGHT_JOIN t3);
id	select_type	table	type	possible_keys	key	key_len	ref	rows	Extra
1	PRIMARY	t1	ALL	NULL	NULL	NULL	NULL	2	Start temporary
1	PRIMARY	t2	ALL	NULL	NULL	NULL	NULL	2	Using join buffer (BNL, incremental buffers)
1	PRIMARY	t3	ALL	NULL	NULL	NULL	NULL	1	Using where; End temporary; Using join buffer (BNL, incremental buffers)
SELECT * FROM t1 WHERE (11) IN 
(SELECT t3.i FROM t2 STRAIGHT_JOIN t3);
i
INSERT INTO t3 VALUES (1);
SELECT (SELECT COUNT(*) from t1),
(SELECT COUNT(*) from t2),
(SELECT COUNT(*) from t3);
(SELECT COUNT(*) from t1)	(SELECT COUNT(*) from t2)	(SELECT COUNT(*) from t3)
2	2	2
EXPLAIN SELECT * FROM t1 WHERE (t1.i) IN 
(SELECT t3.i FROM t2 LEFT JOIN t3 ON t2.i=t3.i);
id	select_type	table	type	possible_keys	key	key_len	ref	rows	Extra
1	PRIMARY	t1	ALL	NULL	NULL	NULL	NULL	2	Start temporary
1	PRIMARY	t2	ALL	NULL	NULL	NULL	NULL	2	Using join buffer (BNL, incremental buffers)
1	PRIMARY	t3	ALL	NULL	NULL	NULL	NULL	2	Using where; End temporary; Using join buffer (BNL, incremental buffers)
SELECT * FROM t1 WHERE (t1.i) IN 
(SELECT t3.i FROM t2 LEFT JOIN t3 ON t2.i=t3.i);
i
2
1
EXPLAIN SELECT * FROM t1 WHERE (t1.i) IN 
(SELECT t3.i FROM t2 RIGHT JOIN t3 ON t2.i=t3.i);
id	select_type	table	type	possible_keys	key	key_len	ref	rows	Extra
1	PRIMARY	t1	ALL	NULL	NULL	NULL	NULL	2	Start temporary
1	PRIMARY	t3	ALL	NULL	NULL	NULL	NULL	2	Using where; Using join buffer (BNL, incremental buffers)
1	PRIMARY	t2	ALL	NULL	NULL	NULL	NULL	2	Using where; End temporary; Using join buffer (BNL, incremental buffers)
SELECT * FROM t1 WHERE (t1.i) IN 
(SELECT t3.i FROM t2 RIGHT JOIN t3 ON t2.i=t3.i);
i
2
1
EXPLAIN SELECT * FROM t1 WHERE (t1.i) IN 
(SELECT t3.i FROM t2 STRAIGHT_JOIN t3);
id	select_type	table	type	possible_keys	key	key_len	ref	rows	Extra
1	PRIMARY	t1	ALL	NULL	NULL	NULL	NULL	2	Start temporary
1	PRIMARY	t2	ALL	NULL	NULL	NULL	NULL	2	Using join buffer (BNL, incremental buffers)
1	PRIMARY	t3	ALL	NULL	NULL	NULL	NULL	2	Using where; End temporary; Using join buffer (BNL, incremental buffers)
SELECT * FROM t1 WHERE (t1.i) IN 
(SELECT t3.i FROM t2 STRAIGHT_JOIN t3);
i
2
1
EXPLAIN SELECT * FROM t1 WHERE (11) IN 
(SELECT t3.i FROM t2 LEFT JOIN t3 ON t2.i=t3.i);
id	select_type	table	type	possible_keys	key	key_len	ref	rows	Extra
1	PRIMARY	t1	ALL	NULL	NULL	NULL	NULL	2	Start temporary
1	PRIMARY	t2	ALL	NULL	NULL	NULL	NULL	2	Using join buffer (BNL, incremental buffers)
1	PRIMARY	t3	ALL	NULL	NULL	NULL	NULL	2	Using where; End temporary; Using join buffer (BNL, incremental buffers)
SELECT * FROM t1 WHERE (11) IN 
(SELECT t3.i FROM t2 LEFT JOIN t3 ON t2.i=t3.i);
i
EXPLAIN SELECT * FROM t1 WHERE (11) IN 
(SELECT t3.i FROM t2 LEFT JOIN t3 ON t2.i=t3.i WHERE t1.i);
id	select_type	table	type	possible_keys	key	key_len	ref	rows	Extra
1	PRIMARY	t1	ALL	NULL	NULL	NULL	NULL	2	Using where; Start temporary
1	PRIMARY	t2	ALL	NULL	NULL	NULL	NULL	2	Using join buffer (BNL, incremental buffers)
1	PRIMARY	t3	ALL	NULL	NULL	NULL	NULL	2	Using where; End temporary; Using join buffer (BNL, incremental buffers)
SELECT * FROM t1 WHERE (11) IN 
(SELECT t3.i FROM t2 LEFT JOIN t3 ON t2.i=t3.i WHERE t1.i);
i
EXPLAIN SELECT * FROM t1 WHERE (11) IN 
(SELECT t3.i FROM t2 RIGHT JOIN t3 ON t2.i=t3.i);
id	select_type	table	type	possible_keys	key	key_len	ref	rows	Extra
1	PRIMARY	t1	ALL	NULL	NULL	NULL	NULL	2	Start temporary
1	PRIMARY	t3	ALL	NULL	NULL	NULL	NULL	2	Using where; Using join buffer (BNL, incremental buffers)
1	PRIMARY	t2	ALL	NULL	NULL	NULL	NULL	2	Using where; End temporary; Using join buffer (BNL, incremental buffers)
SELECT * FROM t1 WHERE (11) IN 
(SELECT t3.i FROM t2 RIGHT JOIN t3 ON t2.i=t3.i);
i
EXPLAIN SELECT * FROM t1 WHERE (11) IN 
(SELECT t3.i FROM t2 STRAIGHT_JOIN t3);
id	select_type	table	type	possible_keys	key	key_len	ref	rows	Extra
1	PRIMARY	t1	ALL	NULL	NULL	NULL	NULL	2	Start temporary
1	PRIMARY	t2	ALL	NULL	NULL	NULL	NULL	2	Using join buffer (BNL, incremental buffers)
1	PRIMARY	t3	ALL	NULL	NULL	NULL	NULL	2	Using where; End temporary; Using join buffer (BNL, incremental buffers)
SELECT * FROM t1 WHERE (11) IN 
(SELECT t3.i FROM t2 STRAIGHT_JOIN t3);
i
INSERT INTO t3 VALUES (0);
DELETE FROM t3;
INSERT INTO t2 VALUES (0);
DELETE FROM t2;
INSERT INTO t1 VALUES (0);
DROP TABLE t1, t2, t3;
create table x1(k int primary key, d1 int, d2 int);
create table x2(k int primary key, d1 int, d2 int);
insert into x1 values
(10,   10,   10),
(20,   20,   20),
(21,   20,   null),
(30,   null, 30),
(40,   40,   40);
insert into x2 values
(10,   10,   10),
(20,   20,   20),
(21,   20,   null),
(30,   null, 30);
select *
from x1
where (d1, d2) in (select d1, d2
from x2);
k	d1	d2
10	10	10
20	20	20
select *
from x1
where (d1, d2) in (select d1, d2
from x2) is true;
k	d1	d2
10	10	10
20	20	20
select *
from x1
where (d1, d2) in (select d1, d2
from x2) is false;
k	d1	d2
40	40	40
select *
from x1
where (d1, d2) in (select d1, d2
from x2) is unknown;
k	d1	d2
21	20	NULL
30	NULL	30
select *
from x1
where d1 in (select d1
from x2
where x1.d2=x2.d2);
k	d1	d2
10	10	10
20	20	20
select *
from x1
where d1 in (select d1
from x2
where x1.d2=x2.d2) is true;
k	d1	d2
10	10	10
20	20	20
select *
from x1
where d1 in (select d1
from x2
where x1.d2=x2.d2) is false;
k	d1	d2
21	20	NULL
40	40	40
select *
from x1
where d1 in (select d1
from x2
where x1.d2=x2.d2) is unknown;
k	d1	d2
30	NULL	30
select *
from x1
where 1 in (select 1
from x2
where x1.d1=x2.d1 and x1.d2=x2.d2);
k	d1	d2
10	10	10
20	20	20
select *
from x1
where 1 in (select 1
from x2
where x1.d1=x2.d1 and x1.d2=x2.d2) is true;
k	d1	d2
10	10	10
20	20	20
select *
from x1
where 1 in (select 1
from x2
where x1.d1=x2.d1 and x1.d2=x2.d2) is false;
k	d1	d2
21	20	NULL
30	NULL	30
40	40	40
select *
from x1
where 1 in (select 1
from x2
where x1.d1=x2.d1 and x1.d2=x2.d2) is unknown;
k	d1	d2
select *
from x1
where exists (select *
from x2
where x1.d1=x2.d1 and x1.d2=x2.d2);
k	d1	d2
10	10	10
20	20	20
drop table x1;
drop table x2;
CREATE TABLE t1 (
a int(11) NOT NULL,
b int(11) NOT NULL,
c datetime default NULL,
PRIMARY KEY  (a),
KEY idx_bc (b,c)
);
INSERT INTO t1 VALUES 
(406989,67,'2006-02-23 17:08:46'), (150078,67,'2005-10-26 11:17:45'),
(406993,67,'2006-02-27 11:20:57'), (245655,67,'2005-12-08 15:59:08'),
(406994,67,'2006-02-27 11:26:46'), (256,67,NULL),
(398341,67,'2006-02-20 04:48:44'), (254,67,NULL),(1120,67,NULL),
(406988,67,'2006-02-23 17:07:22'), (255,67,NULL),
(398340,67,'2006-02-20 04:38:53'),(406631,67,'2006-02-23 10:49:42'),
(245653,67,'2005-12-08 15:59:07'),(406992,67,'2006-02-24 16:47:18'),
(245654,67,'2005-12-08 15:59:08'),(406995,67,'2006-02-28 11:55:00'),
(127261,67,'2005-10-13 12:17:58'),(406991,67,'2006-02-24 16:42:32'),
(245652,67,'2005-12-08 15:58:27'),(398545,67,'2006-02-20 04:53:13'),
(154504,67,'2005-10-28 11:53:01'),(9199,67,NULL),(1,67,'2006-02-23 15:01:35'),
(223456,67,NULL),(4101,67,NULL),(1133,67,NULL),
(406990,67,'2006-02-23 18:01:45'),(148815,67,'2005-10-25 15:34:17'),
(148812,67,'2005-10-25 15:30:01'),(245651,67,'2005-12-08 15:58:27'),
(154503,67,'2005-10-28 11:52:38');
create table t11 select * from t1 where b = 67 AND (c IS NULL OR c > NOW()) order by 3 asc;
create table t12 select * from t1 where b = 67 AND (c IS NULL OR c > NOW()) order by 3 desc;
create table t21 select * from t1 where b = 67 AND (c IS NULL OR c > '2005-12-08') order by 3 asc;
create table t22 select * from t1 where b = 67 AND (c IS NULL OR c > '2005-12-08') order by 3 desc;
update t22 set c = '2005-12-08 15:58:27' where a = 255;
explain select t21.* from t21,t22 where t21.a = t22.a and 
t22.a in (select t12.a from t11, t12 where t11.a in(255,256) and t11.a = t12.a and t11.c is null) and t22.c is null order by t21.a;
id	select_type	table	type	possible_keys	key	key_len	ref	rows	Extra
1	PRIMARY	t11	ALL	NULL	NULL	NULL	NULL	8	Using where; Using temporary; Using filesort; Start temporary
1	PRIMARY	t12	ALL	NULL	NULL	NULL	NULL	8	Using where; Using join buffer (BNL, incremental buffers)
1	PRIMARY	t22	ALL	NULL	NULL	NULL	NULL	26	Using where; End temporary; Using join buffer (BNL, incremental buffers)
1	PRIMARY	t21	ALL	NULL	NULL	NULL	NULL	26	Using where; Using join buffer (BNL, incremental buffers)
select t21.* from t21,t22 where t21.a = t22.a and 
t22.a in (select t12.a from t11, t12 where t11.a in(255,256) and t11.a = t12.a and t11.c is null) and t22.c is null order by t21.a;
a	b	c
256	67	NULL
drop table t1, t11, t12, t21, t22;
create table t1(a int);
insert into t1 values (0),(1);
explain 
select (select max(Y.a) from t1 Y where a in (select a from t1 Z) and a < X.a) as subq from t1 X;
id	select_type	table	type	possible_keys	key	key_len	ref	rows	Extra
1	PRIMARY	X	ALL	NULL	NULL	NULL	NULL	2	
2	DEPENDENT SUBQUERY	Y	ALL	NULL	NULL	NULL	NULL	2	Using where; Start temporary
2	DEPENDENT SUBQUERY	Z	ALL	NULL	NULL	NULL	NULL	2	Using where; End temporary; Using join buffer (BNL, incremental buffers)
select (select max(Y.a) from t1 Y where a in (select a from t1 Z) and a < X.a) as subq from t1 X;
subq
NULL
0
drop table t1;
create table t0 (a int);
insert into t0 values (0),(1),(2),(3),(4),(5),(6),(7),(8),(9);
create table t1 as select * from t0;
insert into t1 select a+10 from t0;
insert into t0 values(2);
explain select * from t1 where 2 in (select a from t0);
id	select_type	table	type	possible_keys	key	key_len	ref	rows	Extra
1	PRIMARY	t0	ALL	NULL	NULL	NULL	NULL	11	Using where; Start temporary; End temporary
1	PRIMARY	t1	ALL	NULL	NULL	NULL	NULL	20	Using join buffer (BNL, incremental buffers)
select * from t1 where 2 in (select a from t0);
a
0
1
2
3
4
5
6
7
8
9
10
11
12
13
14
15
16
17
18
19
explain select * from (select a from t0) X where a in (select a from t1);
id	select_type	table	type	possible_keys	key	key_len	ref	rows	Extra
1	PRIMARY	<derived2>	ALL	NULL	NULL	NULL	NULL	11	Start temporary
1	PRIMARY	t1	ALL	NULL	NULL	NULL	NULL	20	Using where; End temporary; Using join buffer (BNL, incremental buffers)
2	DERIVED	t0	ALL	NULL	NULL	NULL	NULL	11	
drop table t0, t1;
create table t0 (a int);
insert into t0 values (0),(1),(2),(3),(4),(5),(6),(7),(8),(9);
create table t1 (kp1 int, kp2 int, c int, filler char(100), key(kp1, kp2));
insert into t1 select A.a+10*(B.a+10*C.a), 0, 0, 'filler' from t0 A, t0 B, t0 C;
insert into t1 select * from t1 where kp1 < 20;
create table t3 (a int);
insert into t3 select A.a + 10*B.a from t0 A, t0 B;
explain select * from t3 where a in (select kp1 from t1 where kp1<20);
id	select_type	table	type	possible_keys	key	key_len	ref	rows	Extra
1	PRIMARY	t3	ALL	NULL	NULL	NULL	NULL	100	Using where; Start temporary
1	PRIMARY	t1	ref	kp1	kp1	5	test.t3.a	1	Using index; End temporary
select * from t3 where a in (select kp1 from t1 where kp1<20);
a
0
1
2
3
4
5
6
7
8
9
10
11
12
13
14
15
16
17
18
19
explain select * from t3 where a in (select kp1 from t1 where kp1<20) and a<20;
id	select_type	table	type	possible_keys	key	key_len	ref	rows	Extra
1	PRIMARY	t3	ALL	NULL	NULL	NULL	NULL	100	Using where; Start temporary
1	PRIMARY	t1	ref	kp1	kp1	5	test.t3.a	1	Using index; End temporary
select * from t3 where a in (select kp1 from t1 where kp1<20) and a<20;
a
0
1
2
3
4
5
6
7
8
9
10
11
12
13
14
15
16
17
18
19
create table t4 (pk int primary key);
insert into t4 select a from t3;
explain select * from t3 where a in 
(select t1.kp1 from t1,t4 where kp1<20 and t4.pk=t1.c);
id	select_type	table	type	possible_keys	key	key_len	ref	rows	Extra
1	PRIMARY	t3	ALL	NULL	NULL	NULL	NULL	100	Using where; Start temporary
1	PRIMARY	t1	ref	kp1	kp1	5	test.t3.a	1	Using where
1	PRIMARY	t4	eq_ref	PRIMARY	PRIMARY	4	test.t1.c	1	Using index; End temporary
select * from t3 where a in 
(select t1.kp1 from t1,t4 where kp1<20 and t4.pk=t1.c);
a
0
1
2
3
4
5
6
7
8
9
10
11
12
13
14
15
16
17
18
19
drop table t1, t3, t4;
create table t1 (a int);
insert into t1 values (0),(0),(0),(1),(1),(1),(2),(2),(2),(3),(3),(3);
set @save_max_heap_table_size=@@max_heap_table_size;
set @@max_heap_table_size= 16384;
# Attempt to make one test that overflows the heap table when a
# non-duplicate row is inserted and one test that overflows the
# heap table when a duplicate record is inserted. Debugging showed
# that these situations occurred with max_heap_table_size=16384
# and optimizer_join_cache_level equals 1 and 0, respectively.
# Finally execute a test that does not overflow the heap table.
explain
select count(*) from t0 A, t0 B, t0 C
where C.a in (select a from t1 D);
id	select_type	table	type	possible_keys	key	key_len	ref	rows	Extra
1	PRIMARY	A	ALL	NULL	NULL	NULL	NULL	10	Start temporary
1	PRIMARY	B	ALL	NULL	NULL	NULL	NULL	10	Using join buffer (BNL, incremental buffers)
1	PRIMARY	C	ALL	NULL	NULL	NULL	NULL	10	Using join buffer (BNL, incremental buffers)
1	PRIMARY	D	ALL	NULL	NULL	NULL	NULL	12	Using where; End temporary; Using join buffer (BNL, incremental buffers)
flush status;
select count(*) from t0 A, t0 B, t0 C
where C.a in (select a from t1 D);
count(*)
400
show status like 'Created_tmp_disk_tables';
Variable_name	Value
Created_tmp_disk_tables	1
set @@max_heap_table_size= @save_max_heap_table_size;
flush status;
select count(*) from t0 A, t0 B, t0 C
where C.a in (select a from t1 D);
count(*)
400
show status like 'Created_tmp_disk_tables';
Variable_name	Value
Created_tmp_disk_tables	0
drop table t0, t1;
create table t0 (a int);
insert into t0 values (0),(1),(2),(3),(4),(5),(6),(7),(8),(9);
create table t2(a int);
insert into t2 values (1),(2);
create table t3 ( a int , filler char(100), key(a));
insert into t3 select A.a + 10*B.a, 'filler' from t0 A, t0 B;
explain select * from t3 where a in (select a from t2) and (a > 5 or a < 10);
id	select_type	table	type	possible_keys	key	key_len	ref	rows	Extra
1	PRIMARY	t2	ALL	NULL	NULL	NULL	NULL	2	Using where; Start temporary
1	PRIMARY	t3	ref	a	a	5	test.t2.a	1	End temporary
select * from t3 where a in (select a from t2);
a	filler
1	filler
2	filler
drop table t0, t2, t3;
create table t1 (a date);
insert into t1 values ('2008-01-01'),('2008-01-01'),('2008-02-01'),('2008-02-01');
create table t2 (a int);
insert into t2 values (1),(2);
create table t3 (a char(10));
insert into t3 select * from t1;
insert into t3 values (1),(2);
explain select * from t2 where a in (select a from t1);
id	select_type	table	type	possible_keys	key	key_len	ref	rows	Extra
1	PRIMARY	t2	ALL	NULL	NULL	NULL	NULL	2	Start temporary
1	PRIMARY	t1	ALL	NULL	NULL	NULL	NULL	4	Using where; End temporary; Using join buffer (BNL, incremental buffers)
explain select * from t2 where a in (select a from t2);
id	select_type	table	type	possible_keys	key	key_len	ref	rows	Extra
1	PRIMARY	t2	ALL	NULL	NULL	NULL	NULL	2	Start temporary
1	PRIMARY	t2	ALL	NULL	NULL	NULL	NULL	2	Using where; End temporary; Using join buffer (BNL, incremental buffers)
explain select * from t2 where a in (select a from t3);
id	select_type	table	type	possible_keys	key	key_len	ref	rows	Extra
1	PRIMARY	t2	ALL	NULL	NULL	NULL	NULL	2	Start temporary
1	PRIMARY	t3	ALL	NULL	NULL	NULL	NULL	6	Using where; End temporary; Using join buffer (BNL, incremental buffers)
explain select * from t1 where a in (select a from t3);
id	select_type	table	type	possible_keys	key	key_len	ref	rows	Extra
1	PRIMARY	t1	ALL	NULL	NULL	NULL	NULL	4	Start temporary
1	PRIMARY	t3	ALL	NULL	NULL	NULL	NULL	6	Using where; End temporary; Using join buffer (BNL, incremental buffers)
drop table t1, t2, t3;
create table t1 (a decimal);
insert into t1 values (1),(2);
explain select * from t1 where a in (select a from t1);
id	select_type	table	type	possible_keys	key	key_len	ref	rows	Extra
1	PRIMARY	t1	ALL	NULL	NULL	NULL	NULL	2	Start temporary
1	PRIMARY	t1	ALL	NULL	NULL	NULL	NULL	2	Using where; End temporary; Using join buffer (BNL, incremental buffers)
drop table t1;
create table t1 (a int);
insert into t1 values (0),(1),(2),(3),(4),(5),(6),(7),(8),(9);
create table t2 as select * from t1;
create table t3 (a int, b int, filler char(100), key(a));
insert into t3 select A.a + 10*B.a, A.a + 10*B.a, 'filler' from t1 A, t1 B, t1 C;
explain select * from t1, t3 where t3.a in (select a from t2) and (t3.a < 10 or t3.a >30) and t1.a =3;
id	select_type	table	type	possible_keys	key	key_len	ref	rows	Extra
1	PRIMARY	t1	ALL	NULL	NULL	NULL	NULL	10	Using where; Start temporary
1	PRIMARY	t2	ALL	NULL	NULL	NULL	NULL	10	Using where; Using join buffer (BNL, incremental buffers)
1	PRIMARY	t3	ref	a	a	5	test.t2.a	10	End temporary
explain select straight_join * from t1 A, t1 B where A.a in (select a from t2);
id	select_type	table	type	possible_keys	key	key_len	ref	rows	Extra
1	PRIMARY	A	ALL	NULL	NULL	NULL	NULL	10	Using where
1	PRIMARY	B	ALL	NULL	NULL	NULL	NULL	10	Using join buffer (BNL, incremental buffers)
2	DEPENDENT SUBQUERY	t2	ALL	NULL	NULL	NULL	NULL	10	Using where
explain select * from t2 where a in (select straight_join A.a from t1 A, t1 B);
id	select_type	table	type	possible_keys	key	key_len	ref	rows	Extra
1	PRIMARY	t2	ALL	NULL	NULL	NULL	NULL	10	Using where
2	DEPENDENT SUBQUERY	A	ALL	NULL	NULL	NULL	NULL	10	Using where
2	DEPENDENT SUBQUERY	B	ALL	NULL	NULL	NULL	NULL	10	Using where; Using join buffer (BNL, incremental buffers)
explain select * from t2 where a in (select straight_join A.a from t1 A, t1 B);
id	select_type	table	type	possible_keys	key	key_len	ref	rows	Extra
1	PRIMARY	t2	ALL	NULL	NULL	NULL	NULL	10	Using where
2	DEPENDENT SUBQUERY	A	ALL	NULL	NULL	NULL	NULL	10	Using where
2	DEPENDENT SUBQUERY	B	ALL	NULL	NULL	NULL	NULL	10	Using where; Using join buffer (BNL, incremental buffers)
explain select straight_join * from t2 X, t2 Y 
where X.a in (select straight_join A.a from t1 A, t1 B);
id	select_type	table	type	possible_keys	key	key_len	ref	rows	Extra
1	PRIMARY	X	ALL	NULL	NULL	NULL	NULL	10	Using where
1	PRIMARY	Y	ALL	NULL	NULL	NULL	NULL	10	Using join buffer (BNL, incremental buffers)
2	DEPENDENT SUBQUERY	A	ALL	NULL	NULL	NULL	NULL	10	Using where
2	DEPENDENT SUBQUERY	B	ALL	NULL	NULL	NULL	NULL	10	Using where; Using join buffer (BNL, incremental buffers)
create table t0 (a int, b int);
insert into t0 values(1,1);
explain select * from t0, t3 where t3.a in (select a from t2) and (t3.a < 10 or t3.a >30);
id	select_type	table	type	possible_keys	key	key_len	ref	rows	Extra
1	PRIMARY	t0	system	NULL	NULL	NULL	NULL	1	
1	PRIMARY	t2	ALL	NULL	NULL	NULL	NULL	10	Using where; Start temporary
1	PRIMARY	t3	ref	a	a	5	test.t2.a	10	End temporary
create table t4 as select a as x, a as y from t1;
explain select * from t0, t3 where (t3.a, t3.b) in (select x,y from t4) and (t3.a < 10 or t3.a >30);
id	select_type	table	type	possible_keys	key	key_len	ref	rows	Extra
1	PRIMARY	t0	system	NULL	NULL	NULL	NULL	1	
1	PRIMARY	t4	ALL	NULL	NULL	NULL	NULL	10	Using where; Start temporary
1	PRIMARY	t3	ref	a	a	5	test.t4.x	10	Using where; End temporary
drop table t0,t1,t2,t3,t4;
create table t0 (a int);
insert into t0 values (0),(1),(2),(3),(4),(5),(6),(7),(8),(9);
create table t1 (a int, b int, filler char(100), key(a,b));
insert into t1 select A.a, B.a, 'filler' from t0 A, t0 B;
create table t2 as select * from t1;
explain select * from t2 where a in (select b from t1 where a=3);
id	select_type	table	type	possible_keys	key	key_len	ref	rows	Extra
1	PRIMARY	t2	ALL	NULL	NULL	NULL	NULL	100	Using where; Start temporary
1	PRIMARY	t1	ref	a	a	10	const,test.t2.a	1	Using index; End temporary
explain select * from t2 where (b,a) in (select a,b from t1 where a=3);
id	select_type	table	type	possible_keys	key	key_len	ref	rows	Extra
1	PRIMARY	t2	ALL	NULL	NULL	NULL	NULL	100	Using where; Start temporary
1	PRIMARY	t1	ref	a	a	10	const,test.t2.a	1	Using index; End temporary
drop table t1,t2;
create table t1 (a int, b int);
insert into t1 select a,a from t0;
create table t2 (a int, b int);
insert into t2 select A.a + 10*B.a, A.a + 10*B.a from t0 A, t0 B;
explain select * from t1 where (a,b) in (select a,b from t2);
id	select_type	table	type	possible_keys	key	key_len	ref	rows	Extra
1	PRIMARY	t1	ALL	NULL	NULL	NULL	NULL	10	Start temporary
1	PRIMARY	t2	ALL	NULL	NULL	NULL	NULL	100	Using where; End temporary; Using join buffer (BNL, incremental buffers)
drop table t0, t1, t2;
create table t0 (a decimal(4,2));
insert into t0 values (10.24), (22.11);
create table t1 as select * from t0;
insert into t1 select * from t0;
explain select * from t0 where a in (select a from t1);
id	select_type	table	type	possible_keys	key	key_len	ref	rows	Extra
1	PRIMARY	t0	ALL	NULL	NULL	NULL	NULL	2	Start temporary
1	PRIMARY	t1	ALL	NULL	NULL	NULL	NULL	4	Using where; End temporary; Using join buffer (BNL, incremental buffers)
select * from t0 where a in (select a from t1);
a
10.24
22.11
drop table t0, t1;
create table t0(a date);
insert into t0 values ('2008-01-01'),('2008-02-02');
create table t1 as select * from t0;
insert into t1 select * from t0;
explain select * from t0 where a in (select a from t1);
id	select_type	table	type	possible_keys	key	key_len	ref	rows	Extra
1	PRIMARY	t0	ALL	NULL	NULL	NULL	NULL	2	Start temporary
1	PRIMARY	t1	ALL	NULL	NULL	NULL	NULL	4	Using where; End temporary; Using join buffer (BNL, incremental buffers)
select * from t0 where a in (select a from t1);
a
2008-01-01
2008-02-02
drop table t0, t1;
create table t0(a int);
insert into t0 values (0),(1),(2),(3),(4),(5),(6),(7),(8),(9);
create table t1 as select a as a, a as b, a as c from t0 where a < 3;
create table t2 as select a as a, a as b from t0 where a < 3;
insert into t2 select * from t2;
explain select * from t1 where (a,b,c) in (select X.a, Y.a, Z.a from t2 X, t2 Y, t2 Z where X.b=33);
id	select_type	table	type	possible_keys	key	key_len	ref	rows	Extra
1	PRIMARY	t1	ALL	NULL	NULL	NULL	NULL	3	Start temporary
1	PRIMARY	X	ALL	NULL	NULL	NULL	NULL	6	Using where; Using join buffer (BNL, incremental buffers)
1	PRIMARY	Y	ALL	NULL	NULL	NULL	NULL	6	Using where; Using join buffer (BNL, incremental buffers)
1	PRIMARY	Z	ALL	NULL	NULL	NULL	NULL	6	Using where; End temporary; Using join buffer (BNL, incremental buffers)
drop table t0,t1,t2;
set @save_join_buffer_size = @@join_buffer_size;
set join_buffer_size= 8192;
create table t0 (a int);
insert into t0 values (0),(1),(2),(3),(4),(5),(6),(7),(8),(9);
create table t1 (a int, filler1 binary(200), filler2 binary(200));
insert into t1 select a, 'filler123456', 'filler123456' from t0;
insert into t1 select a+10, 'filler123456', 'filler123456' from t0;
create table t2 as select * from t1;
insert into t1 select a+20, 'filler123456', 'filler123456' from t0;
insert into t1 values (2, 'duplicate ok', 'duplicate ok');
insert into t1 values (18, 'duplicate ok', 'duplicate ok');
insert into t2 values (3, 'duplicate ok', 'duplicate ok');
insert into t2 values (19, 'duplicate ok', 'duplicate ok');
explain select 
a, mid(filler1, 1,10), length(filler1)=length(filler2) as Z 
from t1 ot where a in (select a from t2 it);
id	select_type	table	type	possible_keys	key	key_len	ref	rows	Extra
1	PRIMARY	it	ALL	NULL	NULL	NULL	NULL	22	Start temporary
1	PRIMARY	ot	ALL	NULL	NULL	NULL	NULL	32	Using where; End temporary; Using join buffer (BNL, incremental buffers)
select 
a, mid(filler1, 1,10), length(filler1)=length(filler2) as Z 
from t1 ot where a in (select a from t2 it);
a	mid(filler1, 1,10)	Z
0	filler1234	1
1	filler1234	1
10	filler1234	1
11	filler1234	1
12	filler1234	1
13	filler1234	1
14	filler1234	1
15	filler1234	1
16	filler1234	1
17	filler1234	1
18	duplicate 	1
18	filler1234	1
19	filler1234	1
2	duplicate 	1
2	filler1234	1
3	filler1234	1
4	filler1234	1
5	filler1234	1
6	filler1234	1
7	filler1234	1
8	filler1234	1
9	filler1234	1
explain select 
a, mid(filler1, 1,10), length(filler1)=length(filler2) 
from t2 ot where a in (select a from t1 it);
id	select_type	table	type	possible_keys	key	key_len	ref	rows	Extra
1	PRIMARY	ot	ALL	NULL	NULL	NULL	NULL	22	Start temporary
1	PRIMARY	it	ALL	NULL	NULL	NULL	NULL	32	Using where; End temporary; Using join buffer (BNL, incremental buffers)
select 
a, mid(filler1, 1,10), length(filler1)=length(filler2) 
from t2 ot where a in (select a from t1 it);
a	mid(filler1, 1,10)	length(filler1)=length(filler2)
0	filler1234	1
1	filler1234	1
10	filler1234	1
11	filler1234	1
12	filler1234	1
13	filler1234	1
14	filler1234	1
15	filler1234	1
16	filler1234	1
17	filler1234	1
18	filler1234	1
19	duplicate 	1
19	filler1234	1
2	filler1234	1
3	duplicate 	1
3	filler1234	1
4	filler1234	1
5	filler1234	1
6	filler1234	1
7	filler1234	1
8	filler1234	1
9	filler1234	1
insert into t1 select a+20, 'filler123456', 'filler123456' from t0;
insert into t1 select a+20, 'filler123456', 'filler123456' from t0;
explain select 
a, mid(filler1, 1,10), length(filler1)=length(filler2) as Z 
from t1 ot where a in (select a from t2 it);
id	select_type	table	type	possible_keys	key	key_len	ref	rows	Extra
1	PRIMARY	it	ALL	NULL	NULL	NULL	NULL	22	Start temporary
1	PRIMARY	ot	ALL	NULL	NULL	NULL	NULL	52	Using where; End temporary; Using join buffer (BNL, incremental buffers)
select 
a, mid(filler1, 1,10), length(filler1)=length(filler2) as Z 
from t1 ot where a in (select a from t2 it);
a	mid(filler1, 1,10)	Z
0	filler1234	1
1	filler1234	1
10	filler1234	1
11	filler1234	1
12	filler1234	1
13	filler1234	1
14	filler1234	1
15	filler1234	1
16	filler1234	1
17	filler1234	1
18	duplicate 	1
18	filler1234	1
19	filler1234	1
2	duplicate 	1
2	filler1234	1
3	filler1234	1
4	filler1234	1
5	filler1234	1
6	filler1234	1
7	filler1234	1
8	filler1234	1
9	filler1234	1
explain select 
a, mid(filler1, 1,10), length(filler1)=length(filler2) 
from t2 ot where a in (select a from t1 it);
id	select_type	table	type	possible_keys	key	key_len	ref	rows	Extra
1	PRIMARY	ot	ALL	NULL	NULL	NULL	NULL	22	Start temporary
1	PRIMARY	it	ALL	NULL	NULL	NULL	NULL	52	Using where; End temporary; Using join buffer (BNL, incremental buffers)
select 
a, mid(filler1, 1,10), length(filler1)=length(filler2) 
from t2 ot where a in (select a from t1 it);
a	mid(filler1, 1,10)	length(filler1)=length(filler2)
0	filler1234	1
1	filler1234	1
10	filler1234	1
11	filler1234	1
12	filler1234	1
13	filler1234	1
14	filler1234	1
15	filler1234	1
16	filler1234	1
17	filler1234	1
18	filler1234	1
19	duplicate 	1
19	filler1234	1
2	filler1234	1
3	duplicate 	1
3	filler1234	1
4	filler1234	1
5	filler1234	1
6	filler1234	1
7	filler1234	1
8	filler1234	1
9	filler1234	1
set @@join_buffer_size = @save_join_buffer_size;
drop table t1, t2;
create table t1 (a int, b int, key(a));
create table t2 (a int, b int, key(a));
create table t3 (a int, b int, key(a));
insert into t1 select a,a from t0;
insert into t2 select a,a from t0;
insert into t3 select a,a from t0;
t2 and t3 must be use 'ref', not 'ALL':
explain select * 
from t0 where a in
(select t2.a+t3.a from t1 left join (t2 join t3) on t2.a=t1.a and t3.a=t1.a);
id	select_type	table	type	possible_keys	key	key_len	ref	rows	Extra
1	PRIMARY	t0	ALL	NULL	NULL	NULL	NULL	10	Start temporary
1	PRIMARY	t1	index	NULL	a	5	NULL	10	Using index; Using join buffer (BNL, incremental buffers)
1	PRIMARY	t2	ref	a	a	5	test.t1.a	1	Using index
1	PRIMARY	t3	ref	a	a	5	test.t1.a	1	Using where; Using index; End temporary
drop table t0, t1,t2,t3;

Test that neither MaterializeLookup strategy for semijoin,
nor subquery materialization is used when BLOBs are involved 
(except when arguments of some functions).

set @prefix_len = 6;
set @blob_len = 16;
set @suffix_len = @blob_len - @prefix_len;
create table t1_16 (a1 blob(16), a2 blob(16));
create table t2_16 (b1 blob(16), b2 blob(16));
create table t3_16 (c1 blob(16), c2 blob(16));
insert into t1_16 values
(concat('1 - 00', repeat('x', @suffix_len)), concat('2 - 00', repeat('x', @suffix_len)));
insert into t1_16 values
(concat('1 - 01', repeat('x', @suffix_len)), concat('2 - 01', repeat('x', @suffix_len)));
insert into t1_16 values
(concat('1 - 02', repeat('x', @suffix_len)), concat('2 - 02', repeat('x', @suffix_len)));
insert into t2_16 values
(concat('1 - 01', repeat('x', @suffix_len)), concat('2 - 01', repeat('x', @suffix_len)));
insert into t2_16 values
(concat('1 - 02', repeat('x', @suffix_len)), concat('2 - 02', repeat('x', @suffix_len)));
insert into t2_16 values
(concat('1 - 03', repeat('x', @suffix_len)), concat('2 - 03', repeat('x', @suffix_len)));
insert into t3_16 values
(concat('1 - 01', repeat('x', @suffix_len)), concat('2 - 01', repeat('x', @suffix_len)));
insert into t3_16 values
(concat('1 - 02', repeat('x', @suffix_len)), concat('2 - 02', repeat('x', @suffix_len)));
insert into t3_16 values
(concat('1 - 03', repeat('x', @suffix_len)), concat('2 - 03', repeat('x', @suffix_len)));
insert into t3_16 values
(concat('1 - 04', repeat('x', @suffix_len)), concat('2 - 04', repeat('x', @suffix_len)));
explain extended select left(a1,7), left(a2,7)
from t1_16
where a1 in (select b1 from t2_16 where b1 > '0');
id	select_type	table	type	possible_keys	key	key_len	ref	rows	filtered	Extra
1	PRIMARY	t1_16	ALL	NULL	NULL	NULL	NULL	3	100.00	Using where; Start temporary
1	PRIMARY	t2_16	ALL	NULL	NULL	NULL	NULL	3	100.00	Using where; End temporary; Using join buffer (BNL, incremental buffers)
Warnings:
Note	1003	select left(`test`.`t1_16`.`a1`,7) AS `left(a1,7)`,left(`test`.`t1_16`.`a2`,7) AS `left(a2,7)` from `test`.`t1_16` semi join (`test`.`t2_16`) where ((`test`.`t2_16`.`b1` = `test`.`t1_16`.`a1`) and (`test`.`t1_16`.`a1` > '0'))
select left(a1,7), left(a2,7)
from t1_16
where a1 in (select b1 from t2_16 where b1 > '0');
left(a1,7)	left(a2,7)
1 - 01x	2 - 01x
1 - 02x	2 - 02x
explain extended select left(a1,7), left(a2,7)
from t1_16
where (a1,a2) in (select b1, b2 from t2_16 where b1 > '0');
id	select_type	table	type	possible_keys	key	key_len	ref	rows	filtered	Extra
1	PRIMARY	t1_16	ALL	NULL	NULL	NULL	NULL	3	100.00	Using where; Start temporary
1	PRIMARY	t2_16	ALL	NULL	NULL	NULL	NULL	3	100.00	Using where; End temporary; Using join buffer (BNL, incremental buffers)
Warnings:
Note	1003	select left(`test`.`t1_16`.`a1`,7) AS `left(a1,7)`,left(`test`.`t1_16`.`a2`,7) AS `left(a2,7)` from `test`.`t1_16` semi join (`test`.`t2_16`) where ((`test`.`t2_16`.`b2` = `test`.`t1_16`.`a2`) and (`test`.`t2_16`.`b1` = `test`.`t1_16`.`a1`) and (`test`.`t1_16`.`a1` > '0'))
select left(a1,7), left(a2,7)
from t1_16
where (a1,a2) in (select b1, b2 from t2_16 where b1 > '0');
left(a1,7)	left(a2,7)
1 - 01x	2 - 01x
1 - 02x	2 - 02x
explain extended select left(a1,7), left(a2,7)
from t1_16
where a1 in (select substring(b1,1,16) from t2_16 where b1 > '0');
id	select_type	table	type	possible_keys	key	key_len	ref	rows	filtered	Extra
1	PRIMARY	t1_16	ALL	NULL	NULL	NULL	NULL	3	100.00	Start temporary
1	PRIMARY	t2_16	ALL	NULL	NULL	NULL	NULL	3	100.00	Using where; End temporary; Using join buffer (BNL, incremental buffers)
Warnings:
Note	1003	select left(`test`.`t1_16`.`a1`,7) AS `left(a1,7)`,left(`test`.`t1_16`.`a2`,7) AS `left(a2,7)` from `test`.`t1_16` semi join (`test`.`t2_16`) where ((`test`.`t2_16`.`b1` > '0') and (`test`.`t1_16`.`a1` = substr(`test`.`t2_16`.`b1`,1,16)))
select left(a1,7), left(a2,7)
from t1_16
where a1 in (select substring(b1,1,16) from t2_16 where b1 > '0');
left(a1,7)	left(a2,7)
1 - 01x	2 - 01x
1 - 02x	2 - 02x
explain extended select left(a1,7), left(a2,7)
from t1_16
where a1 in (select group_concat(b1) from t2_16 group by b2);
id	select_type	table	type	possible_keys	key	key_len	ref	rows	filtered	Extra
1	PRIMARY	t1_16	ALL	NULL	NULL	NULL	NULL	3	100.00	Using where
2	DEPENDENT SUBQUERY	t2_16	ALL	NULL	NULL	NULL	NULL	3	100.00	Using filesort
Warnings:
Note	1003	select left(`test`.`t1_16`.`a1`,7) AS `left(a1,7)`,left(`test`.`t1_16`.`a2`,7) AS `left(a2,7)` from `test`.`t1_16` where <in_optimizer>(`test`.`t1_16`.`a1`,<exists>(select group_concat(`test`.`t2_16`.`b1` separator ',') from `test`.`t2_16` group by `test`.`t2_16`.`b2` having (<cache>(`test`.`t1_16`.`a1`) = <ref_null_helper>(group_concat(`test`.`t2_16`.`b1` separator ',')))))
select left(a1,7), left(a2,7)
from t1_16
where a1 in (select group_concat(b1) from t2_16 group by b2);
left(a1,7)	left(a2,7)
1 - 01x	2 - 01x
1 - 02x	2 - 02x
set @@group_concat_max_len = 256;
explain extended select left(a1,7), left(a2,7)
from t1_16
where a1 in (select group_concat(b1) from t2_16 group by b2);
id	select_type	table	type	possible_keys	key	key_len	ref	rows	filtered	Extra
1	PRIMARY	t1_16	ALL	NULL	NULL	NULL	NULL	3	100.00	Using where
2	DEPENDENT SUBQUERY	t2_16	ALL	NULL	NULL	NULL	NULL	3	100.00	Using filesort
Warnings:
Note	1003	select left(`test`.`t1_16`.`a1`,7) AS `left(a1,7)`,left(`test`.`t1_16`.`a2`,7) AS `left(a2,7)` from `test`.`t1_16` where <in_optimizer>(`test`.`t1_16`.`a1`,<exists>(select group_concat(`test`.`t2_16`.`b1` separator ',') from `test`.`t2_16` group by `test`.`t2_16`.`b2` having (<cache>(`test`.`t1_16`.`a1`) = <ref_null_helper>(group_concat(`test`.`t2_16`.`b1` separator ',')))))
select left(a1,7), left(a2,7)
from t1_16
where a1 in (select group_concat(b1) from t2_16 group by b2);
left(a1,7)	left(a2,7)
1 - 01x	2 - 01x
1 - 02x	2 - 02x
create table t1 (a1 char(8), a2 char(8));
create table t2 (b1 char(8), b2 char(8));
create table t3 (c1 char(8), c2 char(8));
insert into t1 values ('1 - 00', '2 - 00');
insert into t1 values ('1 - 01', '2 - 01');
insert into t1 values ('1 - 02', '2 - 02');
insert into t2 values ('1 - 01', '2 - 01');
insert into t2 values ('1 - 01', '2 - 01');
insert into t2 values ('1 - 02', '2 - 02');
insert into t2 values ('1 - 02', '2 - 02');
insert into t2 values ('1 - 03', '2 - 03');
insert into t3 values ('1 - 01', '2 - 01');
insert into t3 values ('1 - 02', '2 - 02');
insert into t3 values ('1 - 03', '2 - 03');
insert into t3 values ('1 - 04', '2 - 04');
explain extended
select * from t1
where concat(a1,'x') IN
(select left(a1,8) from t1_16
where (a1, a2) IN
(select t2_16.b1, t2_16.b2 from t2_16, t2
where t2.b2 = substring(t2_16.b2,1,6) and
t2.b1 IN (select c1 from t3 where c2 > '0')));
id	select_type	table	type	possible_keys	key	key_len	ref	rows	filtered	Extra
1	PRIMARY	t1	ALL	NULL	NULL	NULL	NULL	3	100.00	Start temporary
1	PRIMARY	t1_16	ALL	NULL	NULL	NULL	NULL	3	100.00	Using where; Using join buffer (BNL, incremental buffers)
1	PRIMARY	t3	ALL	NULL	NULL	NULL	NULL	4	100.00	Using where; Using join buffer (BNL, incremental buffers)
1	PRIMARY	t2_16	ALL	NULL	NULL	NULL	NULL	3	100.00	Using where; Using join buffer (BNL, incremental buffers)
1	PRIMARY	t2	ALL	NULL	NULL	NULL	NULL	5	100.00	Using where; End temporary; Using join buffer (BNL, incremental buffers)
Warnings:
Note	1003	select `test`.`t1`.`a1` AS `a1`,`test`.`t1`.`a2` AS `a2` from `test`.`t1` semi join (`test`.`t3` join `test`.`t2_16` join `test`.`t2` join `test`.`t1_16`) where ((`test`.`t2_16`.`b2` = `test`.`t1_16`.`a2`) and (`test`.`t2_16`.`b1` = `test`.`t1_16`.`a1`) and (`test`.`t2`.`b1` = `test`.`t3`.`c1`) and (`test`.`t2`.`b2` = substr(`test`.`t2_16`.`b2`,1,6)) and (`test`.`t3`.`c2` > '0') and (concat(`test`.`t1`.`a1`,'x') = left(`test`.`t1_16`.`a1`,8)))
drop table t1_16, t2_16, t3_16, t1, t2, t3;
set @blob_len = 512;
set @suffix_len = @blob_len - @prefix_len;
create table t1_512 (a1 blob(512), a2 blob(512));
create table t2_512 (b1 blob(512), b2 blob(512));
create table t3_512 (c1 blob(512), c2 blob(512));
insert into t1_512 values
(concat('1 - 00', repeat('x', @suffix_len)), concat('2 - 00', repeat('x', @suffix_len)));
insert into t1_512 values
(concat('1 - 01', repeat('x', @suffix_len)), concat('2 - 01', repeat('x', @suffix_len)));
insert into t1_512 values
(concat('1 - 02', repeat('x', @suffix_len)), concat('2 - 02', repeat('x', @suffix_len)));
insert into t2_512 values
(concat('1 - 01', repeat('x', @suffix_len)), concat('2 - 01', repeat('x', @suffix_len)));
insert into t2_512 values
(concat('1 - 02', repeat('x', @suffix_len)), concat('2 - 02', repeat('x', @suffix_len)));
insert into t2_512 values
(concat('1 - 03', repeat('x', @suffix_len)), concat('2 - 03', repeat('x', @suffix_len)));
insert into t3_512 values
(concat('1 - 01', repeat('x', @suffix_len)), concat('2 - 01', repeat('x', @suffix_len)));
insert into t3_512 values
(concat('1 - 02', repeat('x', @suffix_len)), concat('2 - 02', repeat('x', @suffix_len)));
insert into t3_512 values
(concat('1 - 03', repeat('x', @suffix_len)), concat('2 - 03', repeat('x', @suffix_len)));
insert into t3_512 values
(concat('1 - 04', repeat('x', @suffix_len)), concat('2 - 04', repeat('x', @suffix_len)));
explain extended select left(a1,7), left(a2,7)
from t1_512
where a1 in (select b1 from t2_512 where b1 > '0');
id	select_type	table	type	possible_keys	key	key_len	ref	rows	filtered	Extra
1	PRIMARY	t1_512	ALL	NULL	NULL	NULL	NULL	3	100.00	Using where; Start temporary
1	PRIMARY	t2_512	ALL	NULL	NULL	NULL	NULL	3	100.00	Using where; End temporary; Using join buffer (BNL, incremental buffers)
Warnings:
Note	1003	select left(`test`.`t1_512`.`a1`,7) AS `left(a1,7)`,left(`test`.`t1_512`.`a2`,7) AS `left(a2,7)` from `test`.`t1_512` semi join (`test`.`t2_512`) where ((`test`.`t2_512`.`b1` = `test`.`t1_512`.`a1`) and (`test`.`t1_512`.`a1` > '0'))
select left(a1,7), left(a2,7)
from t1_512
where a1 in (select b1 from t2_512 where b1 > '0');
left(a1,7)	left(a2,7)
1 - 01x	2 - 01x
1 - 02x	2 - 02x
explain extended select left(a1,7), left(a2,7)
from t1_512
where (a1,a2) in (select b1, b2 from t2_512 where b1 > '0');
id	select_type	table	type	possible_keys	key	key_len	ref	rows	filtered	Extra
1	PRIMARY	t1_512	ALL	NULL	NULL	NULL	NULL	3	100.00	Using where; Start temporary
1	PRIMARY	t2_512	ALL	NULL	NULL	NULL	NULL	3	100.00	Using where; End temporary; Using join buffer (BNL, incremental buffers)
Warnings:
Note	1003	select left(`test`.`t1_512`.`a1`,7) AS `left(a1,7)`,left(`test`.`t1_512`.`a2`,7) AS `left(a2,7)` from `test`.`t1_512` semi join (`test`.`t2_512`) where ((`test`.`t2_512`.`b2` = `test`.`t1_512`.`a2`) and (`test`.`t2_512`.`b1` = `test`.`t1_512`.`a1`) and (`test`.`t1_512`.`a1` > '0'))
select left(a1,7), left(a2,7)
from t1_512
where (a1,a2) in (select b1, b2 from t2_512 where b1 > '0');
left(a1,7)	left(a2,7)
1 - 01x	2 - 01x
1 - 02x	2 - 02x
explain extended select left(a1,7), left(a2,7)
from t1_512
where a1 in (select substring(b1,1,512) from t2_512 where b1 > '0');
id	select_type	table	type	possible_keys	key	key_len	ref	rows	filtered	Extra
1	PRIMARY	t1_512	ALL	NULL	NULL	NULL	NULL	3	100.00	Start temporary
1	PRIMARY	t2_512	ALL	NULL	NULL	NULL	NULL	3	100.00	Using where; End temporary; Using join buffer (BNL, incremental buffers)
Warnings:
Note	1003	select left(`test`.`t1_512`.`a1`,7) AS `left(a1,7)`,left(`test`.`t1_512`.`a2`,7) AS `left(a2,7)` from `test`.`t1_512` semi join (`test`.`t2_512`) where ((`test`.`t2_512`.`b1` > '0') and (`test`.`t1_512`.`a1` = substr(`test`.`t2_512`.`b1`,1,512)))
select left(a1,7), left(a2,7)
from t1_512
where a1 in (select substring(b1,1,512) from t2_512 where b1 > '0');
left(a1,7)	left(a2,7)
1 - 01x	2 - 01x
1 - 02x	2 - 02x
explain extended select left(a1,7), left(a2,7)
from t1_512
where a1 in (select group_concat(b1) from t2_512 group by b2);
id	select_type	table	type	possible_keys	key	key_len	ref	rows	filtered	Extra
1	PRIMARY	t1_512	ALL	NULL	NULL	NULL	NULL	3	100.00	Using where
2	DEPENDENT SUBQUERY	t2_512	ALL	NULL	NULL	NULL	NULL	3	100.00	Using filesort
Warnings:
Note	1003	select left(`test`.`t1_512`.`a1`,7) AS `left(a1,7)`,left(`test`.`t1_512`.`a2`,7) AS `left(a2,7)` from `test`.`t1_512` where <in_optimizer>(`test`.`t1_512`.`a1`,<exists>(select group_concat(`test`.`t2_512`.`b1` separator ',') from `test`.`t2_512` group by `test`.`t2_512`.`b2` having (<cache>(`test`.`t1_512`.`a1`) = <ref_null_helper>(group_concat(`test`.`t2_512`.`b1` separator ',')))))
select left(a1,7), left(a2,7)
from t1_512
where a1 in (select group_concat(b1) from t2_512 group by b2);
left(a1,7)	left(a2,7)
set @@group_concat_max_len = 256;
explain extended select left(a1,7), left(a2,7)
from t1_512
where a1 in (select group_concat(b1) from t2_512 group by b2);
id	select_type	table	type	possible_keys	key	key_len	ref	rows	filtered	Extra
1	PRIMARY	t1_512	ALL	NULL	NULL	NULL	NULL	3	100.00	Using where
2	DEPENDENT SUBQUERY	t2_512	ALL	NULL	NULL	NULL	NULL	3	100.00	Using filesort
Warnings:
Note	1003	select left(`test`.`t1_512`.`a1`,7) AS `left(a1,7)`,left(`test`.`t1_512`.`a2`,7) AS `left(a2,7)` from `test`.`t1_512` where <in_optimizer>(`test`.`t1_512`.`a1`,<exists>(select group_concat(`test`.`t2_512`.`b1` separator ',') from `test`.`t2_512` group by `test`.`t2_512`.`b2` having (<cache>(`test`.`t1_512`.`a1`) = <ref_null_helper>(group_concat(`test`.`t2_512`.`b1` separator ',')))))
select left(a1,7), left(a2,7)
from t1_512
where a1 in (select group_concat(b1) from t2_512 group by b2);
left(a1,7)	left(a2,7)
drop table t1_512, t2_512, t3_512;
set @blob_len = 513;
set @suffix_len = @blob_len - @prefix_len;
create table t1_513 (a1 blob(513), a2 blob(513));
create table t2_513 (b1 blob(513), b2 blob(513));
create table t3_513 (c1 blob(513), c2 blob(513));
insert into t1_513 values
(concat('1 - 00', repeat('x', @suffix_len)), concat('2 - 00', repeat('x', @suffix_len)));
insert into t1_513 values
(concat('1 - 01', repeat('x', @suffix_len)), concat('2 - 01', repeat('x', @suffix_len)));
insert into t1_513 values
(concat('1 - 02', repeat('x', @suffix_len)), concat('2 - 02', repeat('x', @suffix_len)));
insert into t2_513 values
(concat('1 - 01', repeat('x', @suffix_len)), concat('2 - 01', repeat('x', @suffix_len)));
insert into t2_513 values
(concat('1 - 02', repeat('x', @suffix_len)), concat('2 - 02', repeat('x', @suffix_len)));
insert into t2_513 values
(concat('1 - 03', repeat('x', @suffix_len)), concat('2 - 03', repeat('x', @suffix_len)));
insert into t3_513 values
(concat('1 - 01', repeat('x', @suffix_len)), concat('2 - 01', repeat('x', @suffix_len)));
insert into t3_513 values
(concat('1 - 02', repeat('x', @suffix_len)), concat('2 - 02', repeat('x', @suffix_len)));
insert into t3_513 values
(concat('1 - 03', repeat('x', @suffix_len)), concat('2 - 03', repeat('x', @suffix_len)));
insert into t3_513 values
(concat('1 - 04', repeat('x', @suffix_len)), concat('2 - 04', repeat('x', @suffix_len)));
explain extended select left(a1,7), left(a2,7)
from t1_513
where a1 in (select b1 from t2_513 where b1 > '0');
id	select_type	table	type	possible_keys	key	key_len	ref	rows	filtered	Extra
1	PRIMARY	t1_513	ALL	NULL	NULL	NULL	NULL	3	100.00	Using where; Start temporary
1	PRIMARY	t2_513	ALL	NULL	NULL	NULL	NULL	3	100.00	Using where; End temporary; Using join buffer (BNL, incremental buffers)
Warnings:
Note	1003	select left(`test`.`t1_513`.`a1`,7) AS `left(a1,7)`,left(`test`.`t1_513`.`a2`,7) AS `left(a2,7)` from `test`.`t1_513` semi join (`test`.`t2_513`) where ((`test`.`t2_513`.`b1` = `test`.`t1_513`.`a1`) and (`test`.`t1_513`.`a1` > '0'))
select left(a1,7), left(a2,7)
from t1_513
where a1 in (select b1 from t2_513 where b1 > '0');
left(a1,7)	left(a2,7)
1 - 01x	2 - 01x
1 - 02x	2 - 02x
explain extended select left(a1,7), left(a2,7)
from t1_513
where (a1,a2) in (select b1, b2 from t2_513 where b1 > '0');
id	select_type	table	type	possible_keys	key	key_len	ref	rows	filtered	Extra
1	PRIMARY	t1_513	ALL	NULL	NULL	NULL	NULL	3	100.00	Using where; Start temporary
1	PRIMARY	t2_513	ALL	NULL	NULL	NULL	NULL	3	100.00	Using where; End temporary; Using join buffer (BNL, incremental buffers)
Warnings:
Note	1003	select left(`test`.`t1_513`.`a1`,7) AS `left(a1,7)`,left(`test`.`t1_513`.`a2`,7) AS `left(a2,7)` from `test`.`t1_513` semi join (`test`.`t2_513`) where ((`test`.`t2_513`.`b2` = `test`.`t1_513`.`a2`) and (`test`.`t2_513`.`b1` = `test`.`t1_513`.`a1`) and (`test`.`t1_513`.`a1` > '0'))
select left(a1,7), left(a2,7)
from t1_513
where (a1,a2) in (select b1, b2 from t2_513 where b1 > '0');
left(a1,7)	left(a2,7)
1 - 01x	2 - 01x
1 - 02x	2 - 02x
explain extended select left(a1,7), left(a2,7)
from t1_513
where a1 in (select substring(b1,1,513) from t2_513 where b1 > '0');
id	select_type	table	type	possible_keys	key	key_len	ref	rows	filtered	Extra
1	PRIMARY	t1_513	ALL	NULL	NULL	NULL	NULL	3	100.00	Start temporary
1	PRIMARY	t2_513	ALL	NULL	NULL	NULL	NULL	3	100.00	Using where; End temporary; Using join buffer (BNL, incremental buffers)
Warnings:
Note	1003	select left(`test`.`t1_513`.`a1`,7) AS `left(a1,7)`,left(`test`.`t1_513`.`a2`,7) AS `left(a2,7)` from `test`.`t1_513` semi join (`test`.`t2_513`) where ((`test`.`t2_513`.`b1` > '0') and (`test`.`t1_513`.`a1` = substr(`test`.`t2_513`.`b1`,1,513)))
select left(a1,7), left(a2,7)
from t1_513
where a1 in (select substring(b1,1,513) from t2_513 where b1 > '0');
left(a1,7)	left(a2,7)
1 - 01x	2 - 01x
1 - 02x	2 - 02x
explain extended select left(a1,7), left(a2,7)
from t1_513
where a1 in (select group_concat(b1) from t2_513 group by b2);
id	select_type	table	type	possible_keys	key	key_len	ref	rows	filtered	Extra
1	PRIMARY	t1_513	ALL	NULL	NULL	NULL	NULL	3	100.00	Using where
2	DEPENDENT SUBQUERY	t2_513	ALL	NULL	NULL	NULL	NULL	3	100.00	Using filesort
Warnings:
Note	1003	select left(`test`.`t1_513`.`a1`,7) AS `left(a1,7)`,left(`test`.`t1_513`.`a2`,7) AS `left(a2,7)` from `test`.`t1_513` where <in_optimizer>(`test`.`t1_513`.`a1`,<exists>(select group_concat(`test`.`t2_513`.`b1` separator ',') from `test`.`t2_513` group by `test`.`t2_513`.`b2` having (<cache>(`test`.`t1_513`.`a1`) = <ref_null_helper>(group_concat(`test`.`t2_513`.`b1` separator ',')))))
select left(a1,7), left(a2,7)
from t1_513
where a1 in (select group_concat(b1) from t2_513 group by b2);
left(a1,7)	left(a2,7)
drop table t1_513, t2_513, t3_513;
set @blob_len = 1024;
set @suffix_len = @blob_len - @prefix_len;
create table t1_1024 (a1 blob(1024), a2 blob(1024));
create table t2_1024 (b1 blob(1024), b2 blob(1024));
create table t3_1024 (c1 blob(1024), c2 blob(1024));
insert into t1_1024 values
(concat('1 - 00', repeat('x', @suffix_len)), concat('2 - 00', repeat('x', @suffix_len)));
insert into t1_1024 values
(concat('1 - 01', repeat('x', @suffix_len)), concat('2 - 01', repeat('x', @suffix_len)));
insert into t1_1024 values
(concat('1 - 02', repeat('x', @suffix_len)), concat('2 - 02', repeat('x', @suffix_len)));
insert into t2_1024 values
(concat('1 - 01', repeat('x', @suffix_len)), concat('2 - 01', repeat('x', @suffix_len)));
insert into t2_1024 values
(concat('1 - 02', repeat('x', @suffix_len)), concat('2 - 02', repeat('x', @suffix_len)));
insert into t2_1024 values
(concat('1 - 03', repeat('x', @suffix_len)), concat('2 - 03', repeat('x', @suffix_len)));
insert into t3_1024 values
(concat('1 - 01', repeat('x', @suffix_len)), concat('2 - 01', repeat('x', @suffix_len)));
insert into t3_1024 values
(concat('1 - 02', repeat('x', @suffix_len)), concat('2 - 02', repeat('x', @suffix_len)));
insert into t3_1024 values
(concat('1 - 03', repeat('x', @suffix_len)), concat('2 - 03', repeat('x', @suffix_len)));
insert into t3_1024 values
(concat('1 - 04', repeat('x', @suffix_len)), concat('2 - 04', repeat('x', @suffix_len)));
explain extended select left(a1,7), left(a2,7)
from t1_1024
where a1 in (select b1 from t2_1024 where b1 > '0');
id	select_type	table	type	possible_keys	key	key_len	ref	rows	filtered	Extra
1	PRIMARY	t1_1024	ALL	NULL	NULL	NULL	NULL	3	100.00	Using where; Start temporary
1	PRIMARY	t2_1024	ALL	NULL	NULL	NULL	NULL	3	100.00	Using where; End temporary; Using join buffer (BNL, incremental buffers)
Warnings:
Note	1003	select left(`test`.`t1_1024`.`a1`,7) AS `left(a1,7)`,left(`test`.`t1_1024`.`a2`,7) AS `left(a2,7)` from `test`.`t1_1024` semi join (`test`.`t2_1024`) where ((`test`.`t2_1024`.`b1` = `test`.`t1_1024`.`a1`) and (`test`.`t1_1024`.`a1` > '0'))
select left(a1,7), left(a2,7)
from t1_1024
where a1 in (select b1 from t2_1024 where b1 > '0');
left(a1,7)	left(a2,7)
1 - 01x	2 - 01x
1 - 02x	2 - 02x
explain extended select left(a1,7), left(a2,7)
from t1_1024
where (a1,a2) in (select b1, b2 from t2_1024 where b1 > '0');
id	select_type	table	type	possible_keys	key	key_len	ref	rows	filtered	Extra
1	PRIMARY	t1_1024	ALL	NULL	NULL	NULL	NULL	3	100.00	Using where; Start temporary
1	PRIMARY	t2_1024	ALL	NULL	NULL	NULL	NULL	3	100.00	Using where; End temporary; Using join buffer (BNL, incremental buffers)
Warnings:
Note	1003	select left(`test`.`t1_1024`.`a1`,7) AS `left(a1,7)`,left(`test`.`t1_1024`.`a2`,7) AS `left(a2,7)` from `test`.`t1_1024` semi join (`test`.`t2_1024`) where ((`test`.`t2_1024`.`b2` = `test`.`t1_1024`.`a2`) and (`test`.`t2_1024`.`b1` = `test`.`t1_1024`.`a1`) and (`test`.`t1_1024`.`a1` > '0'))
select left(a1,7), left(a2,7)
from t1_1024
where (a1,a2) in (select b1, b2 from t2_1024 where b1 > '0');
left(a1,7)	left(a2,7)
1 - 01x	2 - 01x
1 - 02x	2 - 02x
explain extended select left(a1,7), left(a2,7)
from t1_1024
where a1 in (select substring(b1,1,1024) from t2_1024 where b1 > '0');
id	select_type	table	type	possible_keys	key	key_len	ref	rows	filtered	Extra
1	PRIMARY	t1_1024	ALL	NULL	NULL	NULL	NULL	3	100.00	Start temporary
1	PRIMARY	t2_1024	ALL	NULL	NULL	NULL	NULL	3	100.00	Using where; End temporary; Using join buffer (BNL, incremental buffers)
Warnings:
Note	1003	select left(`test`.`t1_1024`.`a1`,7) AS `left(a1,7)`,left(`test`.`t1_1024`.`a2`,7) AS `left(a2,7)` from `test`.`t1_1024` semi join (`test`.`t2_1024`) where ((`test`.`t2_1024`.`b1` > '0') and (`test`.`t1_1024`.`a1` = substr(`test`.`t2_1024`.`b1`,1,1024)))
select left(a1,7), left(a2,7)
from t1_1024
where a1 in (select substring(b1,1,1024) from t2_1024 where b1 > '0');
left(a1,7)	left(a2,7)
1 - 01x	2 - 01x
1 - 02x	2 - 02x
explain extended select left(a1,7), left(a2,7)
from t1_1024
where a1 in (select group_concat(b1) from t2_1024 group by b2);
id	select_type	table	type	possible_keys	key	key_len	ref	rows	filtered	Extra
1	PRIMARY	t1_1024	ALL	NULL	NULL	NULL	NULL	3	100.00	Using where
2	DEPENDENT SUBQUERY	t2_1024	ALL	NULL	NULL	NULL	NULL	3	100.00	Using filesort
Warnings:
Note	1003	select left(`test`.`t1_1024`.`a1`,7) AS `left(a1,7)`,left(`test`.`t1_1024`.`a2`,7) AS `left(a2,7)` from `test`.`t1_1024` where <in_optimizer>(`test`.`t1_1024`.`a1`,<exists>(select group_concat(`test`.`t2_1024`.`b1` separator ',') from `test`.`t2_1024` group by `test`.`t2_1024`.`b2` having (<cache>(`test`.`t1_1024`.`a1`) = <ref_null_helper>(group_concat(`test`.`t2_1024`.`b1` separator ',')))))
select left(a1,7), left(a2,7)
from t1_1024
where a1 in (select group_concat(b1) from t2_1024 group by b2);
left(a1,7)	left(a2,7)
set @@group_concat_max_len = 256;
explain extended select left(a1,7), left(a2,7)
from t1_1024
where a1 in (select group_concat(b1) from t2_1024 group by b2);
id	select_type	table	type	possible_keys	key	key_len	ref	rows	filtered	Extra
1	PRIMARY	t1_1024	ALL	NULL	NULL	NULL	NULL	3	100.00	Using where
2	DEPENDENT SUBQUERY	t2_1024	ALL	NULL	NULL	NULL	NULL	3	100.00	Using filesort
Warnings:
Note	1003	select left(`test`.`t1_1024`.`a1`,7) AS `left(a1,7)`,left(`test`.`t1_1024`.`a2`,7) AS `left(a2,7)` from `test`.`t1_1024` where <in_optimizer>(`test`.`t1_1024`.`a1`,<exists>(select group_concat(`test`.`t2_1024`.`b1` separator ',') from `test`.`t2_1024` group by `test`.`t2_1024`.`b2` having (<cache>(`test`.`t1_1024`.`a1`) = <ref_null_helper>(group_concat(`test`.`t2_1024`.`b1` separator ',')))))
select left(a1,7), left(a2,7)
from t1_1024
where a1 in (select group_concat(b1) from t2_1024 group by b2);
left(a1,7)	left(a2,7)
drop table t1_1024, t2_1024, t3_1024;
set @blob_len = 1025;
set @suffix_len = @blob_len - @prefix_len;
create table t1_1025 (a1 blob(1025), a2 blob(1025));
create table t2_1025 (b1 blob(1025), b2 blob(1025));
create table t3_1025 (c1 blob(1025), c2 blob(1025));
insert into t1_1025 values
(concat('1 - 00', repeat('x', @suffix_len)), concat('2 - 00', repeat('x', @suffix_len)));
insert into t1_1025 values
(concat('1 - 01', repeat('x', @suffix_len)), concat('2 - 01', repeat('x', @suffix_len)));
insert into t1_1025 values
(concat('1 - 02', repeat('x', @suffix_len)), concat('2 - 02', repeat('x', @suffix_len)));
insert into t2_1025 values
(concat('1 - 01', repeat('x', @suffix_len)), concat('2 - 01', repeat('x', @suffix_len)));
insert into t2_1025 values
(concat('1 - 02', repeat('x', @suffix_len)), concat('2 - 02', repeat('x', @suffix_len)));
insert into t2_1025 values
(concat('1 - 03', repeat('x', @suffix_len)), concat('2 - 03', repeat('x', @suffix_len)));
insert into t3_1025 values
(concat('1 - 01', repeat('x', @suffix_len)), concat('2 - 01', repeat('x', @suffix_len)));
insert into t3_1025 values
(concat('1 - 02', repeat('x', @suffix_len)), concat('2 - 02', repeat('x', @suffix_len)));
insert into t3_1025 values
(concat('1 - 03', repeat('x', @suffix_len)), concat('2 - 03', repeat('x', @suffix_len)));
insert into t3_1025 values
(concat('1 - 04', repeat('x', @suffix_len)), concat('2 - 04', repeat('x', @suffix_len)));
explain extended select left(a1,7), left(a2,7)
from t1_1025
where a1 in (select b1 from t2_1025 where b1 > '0');
id	select_type	table	type	possible_keys	key	key_len	ref	rows	filtered	Extra
1	PRIMARY	t1_1025	ALL	NULL	NULL	NULL	NULL	3	100.00	Using where; Start temporary
1	PRIMARY	t2_1025	ALL	NULL	NULL	NULL	NULL	3	100.00	Using where; End temporary; Using join buffer (BNL, incremental buffers)
Warnings:
Note	1003	select left(`test`.`t1_1025`.`a1`,7) AS `left(a1,7)`,left(`test`.`t1_1025`.`a2`,7) AS `left(a2,7)` from `test`.`t1_1025` semi join (`test`.`t2_1025`) where ((`test`.`t2_1025`.`b1` = `test`.`t1_1025`.`a1`) and (`test`.`t1_1025`.`a1` > '0'))
select left(a1,7), left(a2,7)
from t1_1025
where a1 in (select b1 from t2_1025 where b1 > '0');
left(a1,7)	left(a2,7)
1 - 01x	2 - 01x
1 - 02x	2 - 02x
explain extended select left(a1,7), left(a2,7)
from t1_1025
where (a1,a2) in (select b1, b2 from t2_1025 where b1 > '0');
id	select_type	table	type	possible_keys	key	key_len	ref	rows	filtered	Extra
1	PRIMARY	t1_1025	ALL	NULL	NULL	NULL	NULL	3	100.00	Using where; Start temporary
1	PRIMARY	t2_1025	ALL	NULL	NULL	NULL	NULL	3	100.00	Using where; End temporary; Using join buffer (BNL, incremental buffers)
Warnings:
Note	1003	select left(`test`.`t1_1025`.`a1`,7) AS `left(a1,7)`,left(`test`.`t1_1025`.`a2`,7) AS `left(a2,7)` from `test`.`t1_1025` semi join (`test`.`t2_1025`) where ((`test`.`t2_1025`.`b2` = `test`.`t1_1025`.`a2`) and (`test`.`t2_1025`.`b1` = `test`.`t1_1025`.`a1`) and (`test`.`t1_1025`.`a1` > '0'))
select left(a1,7), left(a2,7)
from t1_1025
where (a1,a2) in (select b1, b2 from t2_1025 where b1 > '0');
left(a1,7)	left(a2,7)
1 - 01x	2 - 01x
1 - 02x	2 - 02x
explain extended select left(a1,7), left(a2,7)
from t1_1025
where a1 in (select substring(b1,1,1025) from t2_1025 where b1 > '0');
id	select_type	table	type	possible_keys	key	key_len	ref	rows	filtered	Extra
1	PRIMARY	t1_1025	ALL	NULL	NULL	NULL	NULL	3	100.00	Start temporary
1	PRIMARY	t2_1025	ALL	NULL	NULL	NULL	NULL	3	100.00	Using where; End temporary; Using join buffer (BNL, incremental buffers)
Warnings:
Note	1003	select left(`test`.`t1_1025`.`a1`,7) AS `left(a1,7)`,left(`test`.`t1_1025`.`a2`,7) AS `left(a2,7)` from `test`.`t1_1025` semi join (`test`.`t2_1025`) where ((`test`.`t2_1025`.`b1` > '0') and (`test`.`t1_1025`.`a1` = substr(`test`.`t2_1025`.`b1`,1,1025)))
select left(a1,7), left(a2,7)
from t1_1025
where a1 in (select substring(b1,1,1025) from t2_1025 where b1 > '0');
left(a1,7)	left(a2,7)
1 - 01x	2 - 01x
1 - 02x	2 - 02x
explain extended select left(a1,7), left(a2,7)
from t1_1025
where a1 in (select group_concat(b1) from t2_1025 group by b2);
id	select_type	table	type	possible_keys	key	key_len	ref	rows	filtered	Extra
1	PRIMARY	t1_1025	ALL	NULL	NULL	NULL	NULL	3	100.00	Using where
2	DEPENDENT SUBQUERY	t2_1025	ALL	NULL	NULL	NULL	NULL	3	100.00	Using filesort
Warnings:
Note	1003	select left(`test`.`t1_1025`.`a1`,7) AS `left(a1,7)`,left(`test`.`t1_1025`.`a2`,7) AS `left(a2,7)` from `test`.`t1_1025` where <in_optimizer>(`test`.`t1_1025`.`a1`,<exists>(select group_concat(`test`.`t2_1025`.`b1` separator ',') from `test`.`t2_1025` group by `test`.`t2_1025`.`b2` having (<cache>(`test`.`t1_1025`.`a1`) = <ref_null_helper>(group_concat(`test`.`t2_1025`.`b1` separator ',')))))
select left(a1,7), left(a2,7)
from t1_1025
where a1 in (select group_concat(b1) from t2_1025 group by b2);
left(a1,7)	left(a2,7)
set @@group_concat_max_len = 256;
explain extended select left(a1,7), left(a2,7)
from t1_1025
where a1 in (select group_concat(b1) from t2_1025 group by b2);
id	select_type	table	type	possible_keys	key	key_len	ref	rows	filtered	Extra
1	PRIMARY	t1_1025	ALL	NULL	NULL	NULL	NULL	3	100.00	Using where
2	DEPENDENT SUBQUERY	t2_1025	ALL	NULL	NULL	NULL	NULL	3	100.00	Using filesort
Warnings:
Note	1003	select left(`test`.`t1_1025`.`a1`,7) AS `left(a1,7)`,left(`test`.`t1_1025`.`a2`,7) AS `left(a2,7)` from `test`.`t1_1025` where <in_optimizer>(`test`.`t1_1025`.`a1`,<exists>(select group_concat(`test`.`t2_1025`.`b1` separator ',') from `test`.`t2_1025` group by `test`.`t2_1025`.`b2` having (<cache>(`test`.`t1_1025`.`a1`) = <ref_null_helper>(group_concat(`test`.`t2_1025`.`b1` separator ',')))))
select left(a1,7), left(a2,7)
from t1_1025
where a1 in (select group_concat(b1) from t2_1025 group by b2);
left(a1,7)	left(a2,7)
drop table t1_1025, t2_1025, t3_1025;
#
# Bug#48868: Left outer join in subquery causes segmentation fault in
#            make_join_select.
#
CREATE TABLE t1 (i INTEGER);
INSERT INTO t1 VALUES (1);
INSERT INTO t1 VALUES (2);
CREATE TABLE t2 (i INTEGER);
INSERT INTO t2 VALUES(1);
CREATE TABLE t3 (i INTEGER);
INSERT INTO t3 VALUES (1);
INSERT INTO t3 VALUES (2);
SELECT * FROM t1 WHERE (t1.i) IN 
(SELECT t2.i FROM t2 LEFT JOIN t3 ON t2.i=t3.i);
i
1
DROP TABLE t1, t2, t3;

Bug#37899: Wrongly checked optimization prerequisite caused failed
assertion.

CREATE TABLE t1 (
`pk` int(11),
`varchar_nokey` varchar(5)
);
INSERT INTO t1 VALUES
(1,'qk'),(2,'j'),(3,'aew');
SELECT *
FROM t1
WHERE varchar_nokey IN (
SELECT
varchar_nokey
FROM
t1
) XOR pk = 30;
pk	varchar_nokey
1	qk
2	j
3	aew
drop table t1;
#
# BUG#41842: Semi-join materialization strategy crashes when the upper query has HAVING
#
CREATE TABLE t1 (
pk int(11) NOT NULL AUTO_INCREMENT,
int_nokey int(11) NOT NULL,
time_key time NOT NULL,
datetime_key datetime NOT NULL,
datetime_nokey datetime NOT NULL,
varchar_key varchar(1) NOT NULL,
varchar_nokey varchar(1) NOT NULL,
PRIMARY KEY (pk),
KEY time_key (time_key),
KEY datetime_key (datetime_key),
KEY varchar_key (varchar_key)
);
INSERT INTO t1 VALUES 
(1,0, '00:16:10','2008-09-03 14:25:40','2008-09-03 14:25:40','h','h'),
(2,7, '00:00:00','2001-01-13 00:00:00','2001-01-13 00:00:00','',''),
(3,0, '00:00:00','0000-00-00 00:00:00','0000-00-00 00:00:00','x','x'),
(4,2, '16:29:24','2000-10-16 01:39:08','2000-10-16 01:39:08','w','w'),
(5,1, '09:23:32','0000-00-00 00:00:00','0000-00-00 00:00:00','p','p'),
(6,3, '00:00:00','2007-12-02 00:00:00','2007-12-02 00:00:00','o','o'),
(7,3, '00:00:00','2008-09-11 00:00:00','2008-09-11 00:00:00','',''),
(8,0, '13:59:04','0000-00-00 00:00:00','0000-00-00 00:00:00','s','s'),
(9,7, '09:01:06','0000-00-00 00:00:00','0000-00-00 00:00:00','d','d'),
(10,5,'00:00:00','0000-00-00 00:00:00','0000-00-00 00:00:00','n','n'),
(11,0,'21:06:46','0000-00-00 00:00:00','0000-00-00 00:00:00','o','o'),
(12,2,'00:00:00','0000-00-00 00:00:00','0000-00-00 00:00:00','',''),
(13,6,'14:45:34','2003-07-28 02:34:08','2003-07-28 02:34:08','w','w'),
(14,1,'15:04:12','0000-00-00 00:00:00','0000-00-00 00:00:00','o','o'),
(15,0,'00:00:00','0000-00-00 00:00:00','0000-00-00 00:00:00','x','x'),
(16,0,'15:55:23','2004-03-17 00:32:27','2004-03-17 00:32:27','p','p'),
(17,1,'16:30:00','2004-12-27 19:20:00','2004-12-27 19:20:00','d','d'),
(18,0,'00:00:00','0000-00-00 00:00:00','0000-00-00 00:00:00','h','h'),
(19,0,'14:13:26','2008-11-09 05:53:48','2008-11-09 05:53:48','o','o'),
(20,0,'00:00:00','2009-10-11 06:58:04','2009-10-11 06:58:04','k','k');
CREATE TABLE t2 (
pk int(11) NOT NULL AUTO_INCREMENT,
int_nokey int(11) NOT NULL,
time_key time NOT NULL,
datetime_key datetime NOT NULL,
datetime_nokey datetime NOT NULL,
varchar_key varchar(1) NOT NULL,
varchar_nokey varchar(1) NOT NULL,
PRIMARY KEY (pk),
KEY time_key (time_key),
KEY datetime_key (datetime_key),
KEY varchar_key (varchar_key)
);
INSERT INTO t2 VALUES 
(10,0,'19:39:13','0000-00-00 00:00:00','0000-00-00 00:00:00','g','g'),
(11,8,'03:43:53','0000-00-00 00:00:00','0000-00-00 00:00:00','b','b');
SELECT OUTR.datetime_nokey AS X FROM t1 AS OUTR 
WHERE 
OUTR.varchar_nokey IN (SELECT 
INNR . varchar_nokey AS Y 
FROM t2 AS INNR 
WHERE
INNR . datetime_key >= INNR . time_key OR 
INNR . pk = INNR . int_nokey  
) 
AND OUTR . varchar_nokey <= 'w' 
HAVING X > '2012-12-12';
X
drop table t1, t2;

Bug#46797 "Crash in fix_semijoin_strategies_for_picked_join_order 
with semijoin=on"

CREATE TABLE t1 (
varchar_key varchar(1) DEFAULT NULL,
KEY varchar_key (varchar_key)
);
CREATE TABLE t2 (
varchar_key varchar(1) DEFAULT NULL,
KEY varchar_key (varchar_key)
);
INSERT INTO t2 VALUES
(NULL),(NULL),(NULL),(NULL),('a'),('a'),('a'),('b'),('b'),('b'),('b'),('c'),
('c'),('c'),('c'),('c'),('c'),('c'),('d'),('d'),('d'),('d'),('d'),('d'),('e'),
('e'),('e'),('e'),('e'),('e'),('f'),('f'),('f'),('g'),('g'),('h'),('h'),('h'),
('h'),('i'),('j'),('j'),('j'),('k'),('k'),('l'),('l'),('m'),('m'),('m'),('m'),
('n'),('n'),('n'),('o'),('o'),('o'),('p'),('p'),('p'),('q'),('q'),('q'),('r'),
('r'),('r'),('r'),('s'),('s'),('s'),('s'),('t'),('t'),('t'),('t'),('u'),('u'),
('u'),('u'),('v'),('v'),('v'),('v'),('w'),('w'),('w'),('w'),('w'),('w'),('x'),
('x'),('x'),('y'),('y'),('y'),('y'),('z'),('z'),('z'),('z');
CREATE TABLE t3 (
varchar_key varchar(1) DEFAULT NULL,
KEY varchar_key (varchar_key)
) ENGINE=MyISAM DEFAULT CHARSET=latin1;
INSERT INTO t3 VALUES
(NULL),('c'),('d'),('e'),('f'),('h'),('j'),('k'),('k'),('m'),('m'),('m'),
('n'),('o'),('r'),('t'),('t'),('u'),('w'),('y');
SELECT varchar_key FROM t3 
WHERE (SELECT varchar_key FROM t3 
WHERE (varchar_key,varchar_key) 
IN (SELECT t1.varchar_key, t2 .varchar_key 
FROM t1 RIGHT JOIN t2 ON t1.varchar_key  
)  
);
varchar_key
DROP TABLE t1, t2, t3;
#
# Bug#46556 Returning incorrect, empty results for some IN subqueries 
#           w/semijoin=on
#
CREATE TABLE t0 (
pk INTEGER,
vkey VARCHAR(1),
vnokey VARCHAR(1),
PRIMARY KEY (pk),
KEY vkey(vkey)
);
INSERT INTO t0 
VALUES (1,'g','g'), (2,'v','v'), (3,'t','t'), (4,'u','u'), (5,'n','n');
EXPLAIN EXTENDED SELECT vkey FROM t0 WHERE pk IN 
(SELECT t1.pk FROM t0 t1 JOIN t0 t2 ON t2.vkey = t1.vnokey);
id	select_type	table	type	possible_keys	key	key_len	ref	rows	filtered	Extra
1	PRIMARY	t0	ALL	PRIMARY	NULL	NULL	NULL	5	100.00	Start temporary
1	PRIMARY	t1	eq_ref	PRIMARY	PRIMARY	4	test.t0.pk	1	100.00	
1	PRIMARY	t2	index	vkey	vkey	4	NULL	5	80.00	Using where; Using index; End temporary; Using join buffer (BNL, incremental buffers)
Warnings:
Note	1003	select `test`.`t0`.`vkey` AS `vkey` from `test`.`t0` `t1` semi join (`test`.`t0` `t2`) join `test`.`t0` where ((`test`.`t2`.`vkey` = `test`.`t1`.`vnokey`) and (`test`.`t1`.`pk` = `test`.`t0`.`pk`))
SELECT vkey FROM t0 WHERE pk IN 
(SELECT t1.pk FROM t0 t1 JOIN t0 t2 ON t2.vkey = t1.vnokey);
vkey
g
v
t
u
n
DROP TABLE t0;
# End of bug#46556

Bug#48834: Procedure with view + subquery + semijoin=on 
crashes on second call.

CREATE TABLE t1 ( t1field integer, primary key (t1field));
CREATE TABLE t2 ( t2field integer, primary key (t2field));
CREATE VIEW v1 AS 
SELECT t1field as v1field
FROM t1 A 
WHERE A.t1field IN (SELECT t1field FROM t2 );
CREATE VIEW v2 AS 
SELECT t2field as v2field
FROM t2 A 
WHERE A.t2field IN (SELECT t2field FROM t2 );
CREATE PROCEDURE p1 () 
BEGIN 
SELECT v1field
FROM v1 
WHERE v1field IN ( SELECT v2field as vf_inner FROM v2 );
END|
INSERT INTO t1 VALUES (1),(2),(3);
INSERT INTO t2 VALUES (2),(3),(4);
CALL p1;
v1field
2
3
CALL p1;
v1field
2
3
DROP TABLE t1,t2;
DROP VIEW v1,v2;
DROP PROCEDURE p1;
# End of BUG#48834
#
# Bug#46692 "Crash occurring on queries with nested FROM subqueries 
# using materialization."
#
CREATE TABLE t1 (
pk INTEGER PRIMARY KEY,
int_key INTEGER,
KEY int_key(int_key)
);
INSERT INTO t1 VALUES (10,186),(11,NULL),(12,2),(13,3),(14,0),(15,133),(16,1);
CREATE TABLE t2 (
pk INTEGER PRIMARY KEY,
int_key INTEGER,
KEY int_key(int_key)
);
INSERT INTO t2 VALUES (1,7),(2,2);
SELECT * FROM t1 WHERE (140, 4) IN 
(SELECT t2.int_key, t2 .pk FROM t2 STRAIGHT_JOIN t1 ON t2.int_key);
pk	int_key
DROP TABLE t1, t2;
#
# Bug#42353 "SELECT ... WHERE oe IN (SELECT w/ LEFT JOIN) query
# causes crash."
#
CREATE TABLE t1 (
pk INTEGER PRIMARY KEY,
int_nokey INTEGER,
int_key INTEGER,
date_key DATE,
datetime_nokey DATETIME,
varchar_nokey VARCHAR(1)
);
CREATE TABLE t2 (
date_nokey DATE
);
CREATE TABLE t3 (
pk INTEGER PRIMARY KEY,
int_nokey INTEGER,
date_key date,
varchar_key VARCHAR(1),
varchar_nokey VARCHAR(1),
KEY date_key (date_key)
);
SELECT date_key FROM t1
WHERE (int_key, int_nokey)
IN (SELECT  t3.int_nokey, t3.pk
FROM t2 LEFT JOIN t3 ON (t2.date_nokey < t3.date_key) 
WHERE t3.varchar_key <= t3.varchar_nokey OR t3.int_nokey <= t3.pk
)
AND (varchar_nokey <> 'f' OR NOT int_key < 7);
date_key
#
# Bug#45933 "Crash in optimize_semijoin_nests on JOIN in subquery 
# + AND in outer query".
#
INSERT INTO t1 VALUES (10,7,5,'2009-06-16','2002-04-10 14:25:30','w'),
(11,7,0,'0000-00-00','0000-00-00 00:00:00','s'), 
(12,4,0,'2003-07-14','2006-09-14 04:01:02','y'), 
(13,0,4,'2002-07-25','0000-00-00 00:00:00','c'), 
(14,1,8,'2007-07-03','0000-00-00 00:00:00','q'), 
(15,6,5,'2001-11-12','0000-00-00 00:00:00',''), 
(16,2,9,'0000-00-00','0000-00-00 00:00:00','j'), 
(29,9,1,'0000-00-00','2003-08-11 00:00:00','m');
INSERT INTO t3 VALUES (1,9,'0000-00-00','b','b'),
(2,2,'2002-09-17','h','h');
SELECT t1.varchar_nokey FROM t1 JOIN t3 ON t1.datetime_nokey
WHERE t1.varchar_nokey 
IN (SELECT varchar_nokey FROM t1 
WHERE (pk) 
IN (SELECT t3.int_nokey
FROM t3 LEFT JOIN t1 ON t1.varchar_nokey
WHERE t3.date_key BETWEEN '2008-06-07' AND '2006-06-26'
           )  
);
varchar_nokey
DROP TABLE t1, t2, t3;
#
# Bug#45219 "Crash on SELECT DISTINCT query containing a  
# LEFT JOIN in subquery"
#
CREATE TABLE t1 (
pk INTEGER NOT NULL,
int_nokey INTEGER NOT NULL,
datetime_key DATETIME NOT NULL,
varchar_key VARCHAR(1) NOT NULL,
PRIMARY KEY (pk),
KEY datetime_key (datetime_key),
KEY varchar_key (varchar_key)
);
INSERT INTO t1 VALUES
(1,9,'0000-00-00 00:00:00','p'),(2,0,'2002-02-09 07:38:13','v'),
(3,8,'2001-05-03 12:08:14','t'),(4,3,'0000-00-00 00:00:00','u'),
(5,7,'2009-07-28 03:43:30','n'),(6,0,'2009-08-04 00:00:00','l'),
(7,1,'0000-00-00 00:00:00','h'),(8,9,'0000-00-00 00:00:00','u'),
(9,0,'2005-08-02 17:16:54','n'),(10,9,'2002-12-21 00:00:00','j'),
(11,0,'2005-08-15 12:37:35','k'),(12,5,'0000-00-00 00:00:00','e'),
(13,0,'2006-03-10 00:00:00','i'),(14,8,'2005-05-16 11:02:36','u'),
(15,8,'2008-11-02 00:00:00','n'),(16,5,'2006-03-15 00:00:00','b'),
(17,1,'0000-00-00 00:00:00','x'),(18,7,'0000-00-00 00:00:00',''),
(19,0,'2008-12-17 20:15:40','q'),(20,9,'0000-00-00 00:00:00','u');
CREATE TABLE t2 LIKE t1;
INSERT INTO t2 VALUES 
(10,0,'2006-07-07 07:26:28','q'),(11,5,'2002-09-23 00:00:00','m'),
(12,7,'0000-00-00 00:00:00','j'),(13,1,'2006-06-07 00:00:00','z'),
(14,8,'2000-09-16 12:15:34','a'),(15,2,'2007-08-05 15:47:52',''),
(16,1,'0000-00-00 00:00:00','e'),(17,8,'2005-12-02 19:34:26','t'),
(18,5,'0000-00-00 00:00:00','q'),(19,4,'0000-00-00 00:00:00','b'),
(20,5,'2007-12-28 00:00:00','w'),(21,3,'2004-08-02 11:48:43','m'),
(22,0,'0000-00-00 00:00:00','x'),(23,8,'2004-04-19 12:18:43',''),
(24,0,'2009-04-27 00:00:00','w'),(25,4,'2006-10-20 14:52:15','x'),
(26,0,'0000-00-00 00:00:00','e'),(27,0,'2002-03-22 11:48:37','e'),
(28,2,'0000-00-00 00:00:00','p'),(29,0,'2001-01-04 03:55:07','x');
CREATE TABLE t3 LIKE t1;
INSERT INTO t3 VALUES
(10,8,'2007-08-19 08:08:38','i'),(11,0,'2000-05-21 03:51:51','');
SELECT DISTINCT datetime_key FROM t1
WHERE (int_nokey, pk)  
IN (SELECT t3.pk, t3.pk FROM t2 LEFT JOIN t3 ON t3.varchar_key)  
AND pk = 9;
datetime_key
DROP TABLE t1, t2, t3;
#
# Bug#46550 Azalea returning duplicate results for some IN subqueries
# w/ semijoin=on
#
DROP TABLE IF EXISTS t0, t1, t2;
CREATE TABLE t0 (
int_key int(11) DEFAULT NULL,
varchar_key varchar(1) DEFAULT NULL,
varchar_nokey varchar(1) DEFAULT NULL,
KEY int_key (int_key),
KEY varchar_key (varchar_key,int_key)
);
INSERT INTO t0 VALUES
(1,'m','m'),
(40,'h','h'),
(1,'r','r'),
(1,'h','h'),
(9,'x','x'),
(NULL,'q','q'),
(NULL,'k','k'),
(7,'l','l'),
(182,'k','k'),
(202,'a','a'),
(7,'x','x'),
(6,'j','j'),
(119,'z','z'),
(4,'d','d'),
(5,'h','h'),
(1,'u','u'),
(3,'q','q'),
(7,'a','a'),
(3,'e','e'),
(6,'l','l');
CREATE TABLE t1 (
int_key int(11) DEFAULT NULL,
varchar_key varchar(1) DEFAULT NULL,
varchar_nokey varchar(1) DEFAULT NULL,
KEY int_key (int_key),
KEY varchar_key (varchar_key,int_key)
);
INSERT INTO t1 VALUES (7,NULL,NULL),(4,'x','x');
CREATE TABLE t2 (
int_key int(11) DEFAULT NULL,
varchar_key varchar(1) DEFAULT NULL,
varchar_nokey varchar(1) DEFAULT NULL,
KEY int_key (int_key),
KEY varchar_key (varchar_key,int_key)
);
INSERT INTO t2 VALUES (123,NULL,NULL);
SELECT int_key  
FROM t0  
WHERE varchar_nokey  IN (  
SELECT t1 .varchar_key  from t1
);
int_key
9
7
SELECT t0.int_key  
FROM t0
WHERE t0.varchar_nokey  IN (  
SELECT t1_1 .varchar_key  
FROM t1 AS t1_1  JOIN t1 AS t1_2 ON t1_1 .int_key
);
int_key
9
7
EXPLAIN
SELECT t0.int_key  
FROM t0
WHERE t0.varchar_nokey  IN (  
SELECT t1_1 .varchar_key  
FROM t1 AS t1_1  JOIN t1 AS t1_2 ON t1_1 .int_key
);
id	select_type	table	type	possible_keys	key	key_len	ref	rows	Extra
1	PRIMARY	t1_1	index	varchar_key	varchar_key	9	NULL	2	Using where; Using index; Start temporary
1	PRIMARY	t1_2	index	NULL	int_key	5	NULL	2	Using index; Using join buffer (BNL, incremental buffers)
1	PRIMARY	t0	ALL	NULL	NULL	NULL	NULL	20	Using where; End temporary; Using join buffer (BNL, incremental buffers)
SELECT t0.int_key  
FROM t0, t2
WHERE t0.varchar_nokey  IN (  
SELECT t1_1 .varchar_key  
FROM t1 AS t1_1  JOIN t1 AS t1_2 ON t1_1 .int_key  
);
int_key
9
7
EXPLAIN
SELECT t0.int_key  
FROM t0, t2
WHERE t0.varchar_nokey  IN (  
SELECT t1_1 .varchar_key  
FROM t1 AS t1_1  JOIN t1 AS t1_2 ON t1_1 .int_key  
);
id	select_type	table	type	possible_keys	key	key_len	ref	rows	Extra
1	PRIMARY	t2	system	NULL	NULL	NULL	NULL	1	
1	PRIMARY	t1_1	index	varchar_key	varchar_key	9	NULL	2	Using where; Using index; Start temporary
1	PRIMARY	t1_2	index	NULL	int_key	5	NULL	2	Using index; Using join buffer (BNL, incremental buffers)
1	PRIMARY	t0	ALL	NULL	NULL	NULL	NULL	20	Using where; End temporary; Using join buffer (BNL, incremental buffers)
DROP TABLE t0, t1, t2;
# End of bug#46550

Bug #48073 Subquery on char columns from view crashes Mysql

DROP TABLE IF EXISTS t1, t2;
DROP VIEW IF EXISTS v1;
CREATE TABLE t1 (
city VARCHAR(50) NOT NULL,
country_id SMALLINT UNSIGNED NOT NULL
);
INSERT INTO t1 VALUES 
('Batna',2),
('Bchar',2),
('Skikda',2),
('Tafuna',3),
('Algeria',2) ;
CREATE TABLE t2 (
country_id SMALLINT UNSIGNED NOT NULL,
country VARCHAR(50) NOT NULL
);
INSERT INTO t2 VALUES
(2,'Algeria'),
(3,'American Samoa') ;
CREATE VIEW v1 AS 
SELECT country_id, country 
FROM t2
WHERE LEFT(country,1) = "A" 
;
SELECT city, country_id
FROM t1
WHERE city IN (
SELECT country 
FROM t2
WHERE LEFT(country, 1) = "A" 
);
city	country_id
Algeria	2
SELECT city, country_id
FROM t1
WHERE city IN (
SELECT country 
FROM v1
);
city	country_id
Algeria	2
drop table t1, t2;
drop view v1;
# End of bug#48073

Bug#49097 subquery with view generates wrong result with
non-prepared statement

DROP TABLE IF EXISTS t1, t2;
DROP VIEW IF EXISTS v1;
CREATE TABLE t1 (
city VARCHAR(50) NOT NULL,
country_id SMALLINT UNSIGNED NOT NULL
);
INSERT INTO t1 VALUES 
('Batna',2),
('Bchar',2),
('Skikda',2),
('Tafuna',3),
('Algeria',2) ;
CREATE TABLE t2 (
country_id SMALLINT UNSIGNED NOT NULL,
country VARCHAR(50) NOT NULL
);
INSERT INTO t2 VALUES
(2,'Algeria'),
(3,'XAmerican Samoa') ;
CREATE VIEW v1 AS 
SELECT country_id, country 
FROM t2
WHERE LEFT(country,1) = "A" 
;
SELECT city, country_id
FROM t1
WHERE country_id IN (
SELECT country_id 
FROM t2
WHERE LEFT(country,1) = "A" 
);
city	country_id
Batna	2
Bchar	2
Skikda	2
Algeria	2
SELECT city, country_id
FROM t1
WHERE country_id IN (
SELECT country_id 
FROM v1
);
city	country_id
Batna	2
Bchar	2
Skikda	2
Algeria	2
PREPARE stmt FROM
"
SELECT city, country_id
FROM t1
WHERE country_id IN (
  SELECT country_id 
  FROM v1
);
";
execute stmt;
city	country_id
Batna	2
Bchar	2
Skikda	2
Algeria	2
deallocate prepare stmt;
drop table t1, t2;
drop view v1;
# End of Bug#49097
# 
# Bug#49198 Wrong result for second call of procedure
#           with view in subselect.
# 
CREATE TABLE t1 (t1field integer, primary key (t1field));
CREATE TABLE t2 (t2field integer, primary key (t2field));
CREATE TABLE t3 (t3field integer, primary key (t3field));
CREATE VIEW v2 AS SELECT * FROM t2;
CREATE VIEW v3 AS SELECT * FROM t3;
INSERT INTO t1 VALUES(1),(2);
INSERT INTO t2 VALUES(1),(2);
INSERT INTO t3 VALUES(1),(2);
PREPARE stmt FROM
"
SELECT t1field
FROM t1
WHERE t1field IN (SELECT * FROM v2);
";
EXECUTE stmt;
t1field
1
2
EXECUTE stmt;
t1field
1
2
PREPARE stmt FROM
"
EXPLAIN
SELECT t1field
FROM t1
WHERE t1field IN (SELECT * FROM v2)
  AND t1field IN (SELECT * FROM v3)
";
EXECUTE stmt;
id	select_type	table	type	possible_keys	key	key_len	ref	rows	Extra
1	PRIMARY	t1	index	PRIMARY	PRIMARY	4	NULL	2	Using index
1	PRIMARY	t2	eq_ref	PRIMARY	PRIMARY	4	test.t1.t1field	1	Using index
1	PRIMARY	t3	eq_ref	PRIMARY	PRIMARY	4	test.t1.t1field	1	Using index
EXECUTE stmt;
id	select_type	table	type	possible_keys	key	key_len	ref	rows	Extra
1	SIMPLE	t1	index	PRIMARY	PRIMARY	4	NULL	2	Using index
1	SIMPLE	t2	eq_ref	PRIMARY	PRIMARY	4	test.t1.t1field	1	Using index
1	SIMPLE	t3	eq_ref	PRIMARY	PRIMARY	4	test.t1.t1field	1	Using index
DROP TABLE t1, t2, t3;
DROP VIEW v2, v3;
# End of Bug#49198
# 
# Bug#48623 Multiple subqueries are optimized incorrectly
# 
CREATE TABLE ot(val VARCHAR(10));
CREATE TABLE it1(val VARCHAR(10));
CREATE TABLE it2(val VARCHAR(10));
INSERT INTO ot  VALUES('aaa'), ('bbb'), ('eee'), ('mmm'), ('ppp');
INSERT INTO it1 VALUES('aaa'), ('aaa'), ('bbb'), ('eee'), ('mmm'), ('ppp');
INSERT INTO it2 VALUES('aaa'), ('bbb'), ('eee'), ('mmm'), ('ppp');
EXPLAIN
SELECT *
FROM ot
WHERE ot.val IN (SELECT it1.val FROM it1
WHERE  it1.val LIKE 'a%' OR it1.val LIKE 'e%')
AND ot.val IN (SELECT it2.val FROM it2
WHERE  it2.val LIKE 'a%' OR it2.val LIKE 'e%');
id	select_type	table	type	possible_keys	key	key_len	ref	rows	Extra
1	PRIMARY	ot	ALL	NULL	NULL	NULL	NULL	5	Start temporary
1	PRIMARY	it2	ALL	NULL	NULL	NULL	NULL	5	Using where; Using join buffer (BNL, incremental buffers)
1	PRIMARY	it1	ALL	NULL	NULL	NULL	NULL	6	Using where; End temporary; Using join buffer (BNL, incremental buffers)
SELECT *
FROM ot
WHERE ot.val IN (SELECT it1.val FROM it1
WHERE  it1.val LIKE 'a%' OR it1.val LIKE 'e%')
AND ot.val IN (SELECT it2.val FROM it2
WHERE  it2.val LIKE 'a%' OR it2.val LIKE 'e%');
val
aaa
eee
DROP TABLE ot;
DROP TABLE it1;
DROP TABLE it2;
# End of Bug#48623
# 
# Bug #51487 Assertion failure when semi-join flattening occurs
#            for a subquery in HAVING 
# 
CREATE TABLE t1 (a INT, b INT);
INSERT INTO t1 VALUES (1,10),(2,11),(1,13);
CREATE TABLE t2 AS SELECT * FROM t1;
CREATE TABLE t3 AS SELECT * FROM t1;
SELECT COUNT(*) FROM t1
GROUP BY t1.a 
HAVING t1.a IN (SELECT t3.a FROM t3
WHERE t3.b IN (SELECT b FROM t2 WHERE t2.a=t1.a));
COUNT(*)
2
1
DROP TABLE t1, t2, t3;
# End of Bug#51487
# 
# BUG#38075: Wrong result: rows matching a subquery with outer join not returned
# 
DROP TABLE IF EXISTS ot1, it1, it2;
CREATE TABLE it2 (
int_key int(11) NOT NULL,
datetime_key datetime NOT NULL,
KEY int_key (int_key),
KEY datetime_key (datetime_key)
);
INSERT INTO it2 VALUES
(5,'2002-04-10 14:25:30'), (0,'0000-00-00 00:00:00'),
(0,'2006-09-14 04:01:02'), (4,'0000-00-00 00:00:00'),
(8,'0000-00-00 00:00:00'), (5,'0000-00-00 00:00:00'),
(9,'0000-00-00 00:00:00'), (8,'2007-04-01 11:04:17'),
(1,'0000-00-00 00:00:00'), (7,'2009-01-12 00:00:00'),
(0,'2009-06-05 00:00:00'), (3,'2006-02-14 18:06:35'),
(5,'2006-02-21 07:08:16'), (0,'0000-00-00 00:00:00'),
(7,'0000-00-00 00:00:00'), (0,'0000-00-00 00:00:00'),
(0,'2007-02-13 00:00:00'), (1,'0000-00-00 00:00:00'),
(0,'0000-00-00 00:00:00'), (1,'2003-08-11 00:00:00');
CREATE TABLE ot1 (
int_nokey int(11) NOT NULL,
int_key int(11) NOT NULL,
KEY int_key (int_key)
);
INSERT INTO ot1 VALUES
(5,0), (3,0), (0,2), (3,0), (1,3), (0,0), (1,7), (7,0), (1,7), (0,7),
(0,9), (8,2), (4,4), (9,3), (0,9), (2,5), (0,5), (8,0), (5,8), (1,5);
CREATE TABLE it1 (
int_nokey int(11) NOT NULL,
int_key int(11) NOT NULL,
KEY int_key (int_key)
);
INSERT INTO it1 VALUES
(9,5), (0,4);
SELECT int_key FROM ot1
WHERE int_nokey IN (SELECT it2.int_key
FROM it1 LEFT JOIN it2 ON it2.datetime_key);
int_key
0
0
0
0
0
0
2
2
3
5
5
7
7
7
8
9
9
EXPLAIN
SELECT int_key FROM ot1
WHERE int_nokey IN (SELECT it2.int_key
FROM it1 LEFT JOIN it2 ON it2.datetime_key);
id	select_type	table	type	possible_keys	key	key_len	ref	rows	Extra
1	PRIMARY	it1	index	NULL	int_key	4	NULL	2	Using index; Start temporary
1	PRIMARY	ot1	ALL	NULL	NULL	NULL	NULL	20	Using join buffer (BNL, incremental buffers)
1	PRIMARY	it2	ALL	NULL	NULL	NULL	NULL	20	Using where; End temporary; Using join buffer (BNL, incremental buffers)
DROP TABLE ot1, it1, it2;
# End of BUG#38075
# 
# BUG#50089: Second call of procedure with view in subselect crashes server
# 
CREATE TABLE t1(t1field INTEGER, PRIMARY KEY(t1field));
CREATE VIEW v1 AS 
SELECT t1field AS v1field
FROM t1 a
WHERE a.t1field IN (SELECT t1field FROM t1);
INSERT INTO t1 VALUES(1),(2);
SELECT t1field
FROM t1
WHERE t1field IN (SELECT v1field FROM v1);
t1field
1
2
EXPLAIN
SELECT t1field
FROM t1
WHERE t1field IN (SELECT v1field FROM v1);
id	select_type	table	type	possible_keys	key	key_len	ref	rows	Extra
1	PRIMARY	t1	index	PRIMARY	PRIMARY	4	NULL	2	Using index
1	PRIMARY	a	eq_ref	PRIMARY	PRIMARY	4	test.t1.t1field	1	Using where; Using index
4	DEPENDENT SUBQUERY	t1	unique_subquery	PRIMARY	PRIMARY	4	func	1	Using index
CREATE PROCEDURE p1() 
BEGIN 
SELECT t1field
FROM t1
WHERE t1field IN (SELECT v1field FROM v1);
END|
CALL p1;
t1field
1
2
CALL p1;
t1field
1
2
PREPARE stmt FROM
"
SELECT t1field
FROM t1
WHERE t1field IN (SELECT v1field FROM v1);
";
EXECUTE stmt;
t1field
1
2
EXECUTE stmt;
t1field
1
2
DROP PROCEDURE p1;
DROP VIEW v1;
DROP TABLE t1;
# End of BUG#50089
#
# Bug#45191: Incorrectly initialized semi-join led to a wrong result.
#
CREATE TABLE STAFF (EMPNUM   CHAR(3) NOT NULL,
EMPNAME  CHAR(20), GRADE DECIMAL(4), CITY CHAR(15));
CREATE TABLE PROJ (PNUM CHAR(3) NOT NULL,
PNAME    CHAR(20), PTYPE CHAR(6),
BUDGET   DECIMAL(9),
CITY     CHAR(15));
CREATE TABLE WORKS (EMPNUM CHAR(3) NOT NULL,
PNUM CHAR(3) NOT NULL, HOURS DECIMAL(5));
INSERT INTO STAFF VALUES ('E1','Alice',12,'Deale');
INSERT INTO STAFF VALUES ('E2','Betty',10,'Vienna');
INSERT INTO STAFF VALUES ('E3','Carmen',13,'Vienna');
INSERT INTO STAFF VALUES ('E4','Don',12,'Deale');
INSERT INTO STAFF VALUES ('E5','Ed',13,'Akron');
INSERT INTO PROJ VALUES  ('P1','MXSS','Design',10000,'Deale');
INSERT INTO PROJ VALUES  ('P2','CALM','Code',30000,'Vienna');
INSERT INTO PROJ VALUES  ('P3','SDP','Test',30000,'Tampa');
INSERT INTO PROJ VALUES  ('P4','SDP','Design',20000,'Deale');
INSERT INTO PROJ VALUES  ('P5','IRM','Test',10000,'Vienna');
INSERT INTO PROJ VALUES  ('P6','PAYR','Design',50000,'Deale');
INSERT INTO WORKS VALUES  ('E1','P1',40);
INSERT INTO WORKS VALUES  ('E1','P2',20);
INSERT INTO WORKS VALUES  ('E1','P3',80);
INSERT INTO WORKS VALUES  ('E1','P4',20);
INSERT INTO WORKS VALUES  ('E1','P5',12);
INSERT INTO WORKS VALUES  ('E1','P6',12);
INSERT INTO WORKS VALUES  ('E2','P1',40);
INSERT INTO WORKS VALUES  ('E2','P2',80);
INSERT INTO WORKS VALUES  ('E3','P2',20);
INSERT INTO WORKS VALUES  ('E4','P2',20);
INSERT INTO WORKS VALUES  ('E4','P4',40);
INSERT INTO WORKS VALUES  ('E4','P5',80);
explain SELECT EMPNUM, EMPNAME
FROM STAFF
WHERE EMPNUM IN
(SELECT EMPNUM  FROM WORKS
WHERE PNUM IN
(SELECT PNUM  FROM PROJ));
id	select_type	table	type	possible_keys	key	key_len	ref	rows	Extra
1	PRIMARY	STAFF	ALL	NULL	NULL	NULL	NULL	5	Start temporary
1	PRIMARY	PROJ	ALL	NULL	NULL	NULL	NULL	6	Using join buffer (BNL, incremental buffers)
1	PRIMARY	WORKS	ALL	NULL	NULL	NULL	NULL	12	Using where; End temporary; Using join buffer (BNL, incremental buffers)
SELECT EMPNUM, EMPNAME
FROM STAFF
WHERE EMPNUM IN
(SELECT EMPNUM  FROM WORKS
WHERE PNUM IN
(SELECT PNUM  FROM PROJ));
EMPNUM	EMPNAME
E1	Alice
E2	Betty
E3	Carmen
E4	Don
drop table STAFF,WORKS,PROJ;
# End of bug#45191
#  
# BUG#36896: Server crash on SELECT FROM DUAL
# 
create table t1 (a int);
select 1 as res from dual where (1) in (select * from t1);
res
drop table t1;

BUG#40118 Crash when running Batched Key Access and requiring one match for each key

create table t0(a int);
insert into t0 values (0),(1),(2),(3),(4),(5),(6),(7),(8),(9);
create table t1 (a int, key(a));
insert into t1 select * from t0;
alter table t1 add b int not null, add filler char(200);
insert into t1 select * from t1;
insert into t1 select * from t1;
select * from t0 where t0.a in (select t1.a from t1 where t1.b=0);
a
0
1
2
3
4
5
6
7
8
9
drop table t0, t1;
# 
# BUG#32665 Query with dependent subquery is too slow
#
create table t1 (
idIndividual int primary key
);
insert into t1 values (1),(2);
create table t2 (
idContact int primary key,
contactType int,
idObj int
);
insert into t2 values (1,1,1),(2,2,2),(3,3,3);
create table t3 (
idAddress int primary key,
idContact int,
postalStripped varchar(100)
);
insert into t3 values (1,1, 'foo'), (2,2,'bar');
The following must be converted to a semi-join:
explain extended SELECT a.idIndividual FROM t1 a 
WHERE a.idIndividual IN 
(	SELECT c.idObj FROM t3 cona 
INNER JOIN t2 c ON c.idContact=cona.idContact 
WHERE cona.postalStripped='T2H3B2'
	);
id	select_type	table	type	possible_keys	key	key_len	ref	rows	filtered	Extra
1	PRIMARY	cona	ALL	NULL	NULL	NULL	NULL	2	100.00	Using where; Start temporary
1	PRIMARY	c	eq_ref	PRIMARY	PRIMARY	4	test.cona.idContact	1	100.00	Using where
1	PRIMARY	a	eq_ref	PRIMARY	PRIMARY	4	test.c.idObj	1	100.00	Using index; End temporary
Warnings:
Note	1003	select `test`.`a`.`idIndividual` AS `idIndividual` from `test`.`t1` `a` semi join (`test`.`t3` `cona` join `test`.`t2` `c`) where ((`test`.`c`.`idContact` = `test`.`cona`.`idContact`) and (`test`.`a`.`idIndividual` = `test`.`c`.`idObj`) and (`test`.`cona`.`postalStripped` = 'T2H3B2'))
drop table t1,t2,t3;
CREATE TABLE t1 (one int, two int, flag char(1));
CREATE TABLE t2 (one int, two int, flag char(1));
INSERT INTO t1 VALUES(1,2,'Y'),(2,3,'Y'),(3,4,'Y'),(5,6,'N'),(7,8,'N');
INSERT INTO t2 VALUES(1,2,'Y'),(2,3,'Y'),(3,4,'Y'),(5,6,'N'),(7,8,'N');
SELECT * FROM t1
WHERE ROW(one,two) IN (SELECT DISTINCT one,two FROM t2 WHERE flag = 'N');
one	two	flag
5	6	N
7	8	N
SELECT * FROM t1
WHERE ROW(one,two) IN (SELECT DISTINCT one,two FROM t1 WHERE flag = 'N');
one	two	flag
5	6	N
7	8	N
insert into t2 values (null,null,'N');
insert into t2 values (null,3,'0');
insert into t2 values (null,5,'0');
insert into t2 values (10,null,'0');
insert into t1 values (10,3,'0');
insert into t1 values (10,5,'0');
insert into t1 values (10,10,'0');
SELECT one,two,ROW(one,two) IN (SELECT one,two FROM t2 WHERE flag = 'N') as 'test' from t1;
one	two	test
1	2	NULL
2	3	NULL
3	4	NULL
5	6	1
7	8	1
10	3	NULL
10	5	NULL
10	10	NULL
SELECT one,two from t1 where ROW(one,two) IN (SELECT one,two FROM t2 WHERE flag = 'N');
one	two
5	6
7	8
SELECT one,two,ROW(one,two) IN (SELECT one,two FROM t2 WHERE flag = 'N' group by one,two) as 'test' from t1;
one	two	test
1	2	NULL
2	3	NULL
3	4	NULL
5	6	1
7	8	1
10	3	NULL
10	5	NULL
10	10	NULL
SELECT one,two,ROW(one,two) IN (SELECT one,two FROM t2 WHERE flag = '0') as 'test' from t1;
one	two	test
1	2	0
2	3	NULL
3	4	0
5	6	0
7	8	0
10	3	NULL
10	5	NULL
10	10	NULL
SELECT one,two,ROW(one,two) IN (SELECT one,two FROM t2 WHERE flag = '0' group by one,two) as 'test' from t1;
one	two	test
1	2	0
2	3	NULL
3	4	0
5	6	0
7	8	0
10	3	NULL
10	5	NULL
10	10	NULL
explain extended SELECT one,two,ROW(one,two) IN (SELECT one,two FROM t2 WHERE flag = '0') as 'test' from t1;
id	select_type	table	type	possible_keys	key	key_len	ref	rows	filtered	Extra
1	PRIMARY	t1	ALL	NULL	NULL	NULL	NULL	8	100.00	
2	DEPENDENT SUBQUERY	t2	ALL	NULL	NULL	NULL	NULL	9	100.00	Using where
Warnings:
Note	1003	select `test`.`t1`.`one` AS `one`,`test`.`t1`.`two` AS `two`,<in_optimizer>((`test`.`t1`.`one`,`test`.`t1`.`two`),<exists>(select `test`.`t2`.`one`,`test`.`t2`.`two` from `test`.`t2` where ((`test`.`t2`.`flag` = '0') and trigcond(((<cache>(`test`.`t1`.`one`) = `test`.`t2`.`one`) or isnull(`test`.`t2`.`one`))) and trigcond(((<cache>(`test`.`t1`.`two`) = `test`.`t2`.`two`) or isnull(`test`.`t2`.`two`)))) having (trigcond(<is_not_null_test>(`test`.`t2`.`one`)) and trigcond(<is_not_null_test>(`test`.`t2`.`two`))))) AS `test` from `test`.`t1`
explain extended SELECT one,two from t1 where ROW(one,two) IN (SELECT one,two FROM t2 WHERE flag = 'N');
id	select_type	table	type	possible_keys	key	key_len	ref	rows	filtered	Extra
1	PRIMARY	t1	ALL	NULL	NULL	NULL	NULL	8	100.00	Start temporary
1	PRIMARY	t2	ALL	NULL	NULL	NULL	NULL	9	100.00	Using where; End temporary; Using join buffer (BNL, incremental buffers)
Warnings:
Note	1003	select `test`.`t1`.`one` AS `one`,`test`.`t1`.`two` AS `two` from `test`.`t1` semi join (`test`.`t2`) where ((`test`.`t2`.`two` = `test`.`t1`.`two`) and (`test`.`t2`.`one` = `test`.`t1`.`one`) and (`test`.`t2`.`flag` = 'N'))
explain extended SELECT one,two,ROW(one,two) IN (SELECT one,two FROM t2 WHERE flag = '0' group by one,two) as 'test' from t1;
id	select_type	table	type	possible_keys	key	key_len	ref	rows	filtered	Extra
1	PRIMARY	t1	ALL	NULL	NULL	NULL	NULL	8	100.00	
2	DEPENDENT SUBQUERY	t2	ALL	NULL	NULL	NULL	NULL	9	100.00	Using where; Using temporary; Using filesort
Warnings:
Note	1003	select `test`.`t1`.`one` AS `one`,`test`.`t1`.`two` AS `two`,<in_optimizer>((`test`.`t1`.`one`,`test`.`t1`.`two`),<exists>(select `test`.`t2`.`one`,`test`.`t2`.`two` from `test`.`t2` where (`test`.`t2`.`flag` = '0') group by `test`.`t2`.`one`,`test`.`t2`.`two` having (trigcond(((<cache>(`test`.`t1`.`one`) = `test`.`t2`.`one`) or isnull(`test`.`t2`.`one`))) and trigcond(((<cache>(`test`.`t1`.`two`) = `test`.`t2`.`two`) or isnull(`test`.`t2`.`two`))) and trigcond(<is_not_null_test>(`test`.`t2`.`one`)) and trigcond(<is_not_null_test>(`test`.`t2`.`two`))))) AS `test` from `test`.`t1`
DROP TABLE t1,t2;
CREATE TABLE t1 (a char(5), b char(5));
INSERT INTO t1 VALUES (NULL,'aaa'), ('aaa','aaa');
SELECT * FROM t1 WHERE (a,b) IN (('aaa','aaa'), ('aaa','bbb'));
a	b
aaa	aaa
DROP TABLE t1;
CREATE TABLE t1 (a CHAR(1), b VARCHAR(10));
INSERT INTO t1 VALUES ('a', 'aa');
INSERT INTO t1 VALUES ('a', 'aaa');
SELECT a,b FROM t1 WHERE b IN (SELECT a FROM t1);
a	b
CREATE INDEX I1 ON t1 (a);
CREATE INDEX I2 ON t1 (b);
EXPLAIN SELECT a,b FROM t1 WHERE b IN (SELECT a FROM t1);
id	select_type	table	type	possible_keys	key	key_len	ref	rows	Extra
1	PRIMARY	t1	ALL	I2	NULL	NULL	NULL	2	Start temporary
1	PRIMARY	t1	index	I1	I1	2	NULL	2	Using where; Using index; End temporary; Using join buffer (BNL, incremental buffers)
SELECT a,b FROM t1 WHERE b IN (SELECT a FROM t1);
a	b
CREATE TABLE t2 (a VARCHAR(1), b VARCHAR(10));
INSERT INTO t2 SELECT * FROM t1;
CREATE INDEX I1 ON t2 (a);
CREATE INDEX I2 ON t2 (b);
EXPLAIN SELECT a,b FROM t2 WHERE b IN (SELECT a FROM t2);
id	select_type	table	type	possible_keys	key	key_len	ref	rows	Extra
1	PRIMARY	t2	ALL	I2	NULL	NULL	NULL	2	Start temporary
1	PRIMARY	t2	index	I1	I1	4	NULL	2	Using where; Using index; End temporary; Using join buffer (BNL, incremental buffers)
SELECT a,b FROM t2 WHERE b IN (SELECT a FROM t2);
a	b
EXPLAIN
SELECT a,b FROM t1 WHERE b IN (SELECT a FROM t1 WHERE LENGTH(a)<500);
id	select_type	table	type	possible_keys	key	key_len	ref	rows	Extra
1	PRIMARY	t1	ALL	I2	NULL	NULL	NULL	2	Start temporary
1	PRIMARY	t1	index	I1	I1	2	NULL	2	Using where; Using index; End temporary; Using join buffer (BNL, incremental buffers)
SELECT a,b FROM t1 WHERE b IN (SELECT a FROM t1 WHERE LENGTH(a)<500);
a	b
DROP TABLE t1,t2;
#
# BUG#45928 "Differing query results depending on MRR and
# engine_condition_pushdown settings"
#
CREATE TABLE `t1` (
`pk` int(11) NOT NULL AUTO_INCREMENT,
`time_nokey` time NOT NULL,
`varchar_key` varchar(1) NOT NULL,
`varchar_nokey` varchar(1) NOT NULL,
PRIMARY KEY (`pk`),
KEY `varchar_key` (`varchar_key`)
) AUTO_INCREMENT=12 DEFAULT CHARSET=latin1;
INSERT INTO `t1` VALUES (10,'00:00:00','i','i'),(11,'00:00:00','','');
SELECT `time_nokey` G1  FROM t1  WHERE ( `varchar_nokey`  , `varchar_key`  )  IN ( 
SELECT `varchar_nokey`  , `varchar_nokey`  )  AND `varchar_key`  >= 'c' HAVING G1  ORDER 
BY `pk`   ;
G1
DROP TABLE t1;
#
# BUG#45863 "Assertion failed: (fixed == 0), function fix_fields(),
#            file item.cc, line 4448"
#
DROP TABLE IF EXISTS C, BB;
CREATE TABLE C (
varchar_nokey varchar(1) NOT NULL
);
INSERT INTO C VALUES
('k'),('a'),(''),('u'),('e'),('v'),('i'),
('t'),('u'),('f'),('u'),('m'),('j'),('f'),
('v'),('j'),('g'),('e'),('h'),('z');
CREATE TABLE BB (
varchar_nokey varchar(1) NOT NULL
);
INSERT INTO BB VALUES ('i'),('t');
SELECT varchar_nokey FROM C
WHERE (varchar_nokey, OUTR) IN (SELECT varchar_nokey
FROM BB);
ERROR 21000: Operand should contain 2 column(s)
SELECT varchar_nokey FROM C
WHERE (varchar_nokey, OUTR) IN (SELECT varchar_nokey, varchar_nokey
FROM BB);
ERROR 42S22: Unknown column 'OUTR' in 'IN/ALL/ANY subquery'
DROP TABLE C,BB;
#
# During work with BUG#45863 I had problems with a query that was
# optimized differently in regular and prepared mode.
# Because there was a bug in one of the selected strategies, I became
# aware of the problem. Adding an EXPLAIN query to catch this.
DROP TABLE IF EXISTS t1, t2, t3;
CREATE TABLE t1
(EMPNUM   CHAR(3) NOT NULL,
EMPNAME  CHAR(20),
GRADE    DECIMAL(4),
CITY     CHAR(15));
CREATE TABLE t2
(PNUM     CHAR(3) NOT NULL,
PNAME    CHAR(20),
PTYPE    CHAR(6),
BUDGET   DECIMAL(9),
CITY     CHAR(15));
CREATE TABLE t3
(EMPNUM   CHAR(3) NOT NULL,
PNUM     CHAR(3) NOT NULL,
HOURS    DECIMAL(5));
INSERT INTO t1 VALUES ('E1','Alice',12,'Deale');
INSERT INTO t1 VALUES ('E2','Betty',10,'Vienna');
INSERT INTO t1 VALUES ('E3','Carmen',13,'Vienna');
INSERT INTO t1 VALUES ('E4','Don',12,'Deale');
INSERT INTO t1 VALUES ('E5','Ed',13,'Akron');
INSERT INTO t2 VALUES ('P1','MXSS','Design',10000,'Deale');
INSERT INTO t2 VALUES ('P2','CALM','Code',30000,'Vienna');
INSERT INTO t2 VALUES ('P3','SDP','Test',30000,'Tampa');
INSERT INTO t2 VALUES ('P4','SDP','Design',20000,'Deale');
INSERT INTO t2 VALUES ('P5','IRM','Test',10000,'Vienna');
INSERT INTO t2 VALUES ('P6','PAYR','Design',50000,'Deale');
INSERT INTO t3 VALUES  ('E1','P1',40);
INSERT INTO t3 VALUES  ('E1','P2',20);
INSERT INTO t3 VALUES  ('E1','P3',80);
INSERT INTO t3 VALUES  ('E1','P4',20);
INSERT INTO t3 VALUES  ('E1','P5',12);
INSERT INTO t3 VALUES  ('E1','P6',12);
INSERT INTO t3 VALUES  ('E2','P1',40);
INSERT INTO t3 VALUES  ('E2','P2',80);
INSERT INTO t3 VALUES  ('E3','P2',20);
INSERT INTO t3 VALUES  ('E4','P2',20);
INSERT INTO t3 VALUES  ('E4','P4',40);
INSERT INTO t3 VALUES  ('E4','P5',80);
CREATE UNIQUE INDEX t1_IDX ON t1(EMPNUM);
EXPLAIN SELECT EMPNAME
FROM t1
WHERE EMPNUM IN
(SELECT EMPNUM
FROM t3
WHERE PNUM IN
(SELECT PNUM
FROM t2
WHERE PTYPE = 'Design'));
id	select_type	table	type	possible_keys	key	key_len	ref	rows	Extra
1	PRIMARY	t2	ALL	NULL	NULL	NULL	NULL	6	Using where; Start temporary
1	PRIMARY	t3	ALL	NULL	NULL	NULL	NULL	12	Using where; Using join buffer (BNL, incremental buffers)
1	PRIMARY	t1	eq_ref	t1_IDX	t1_IDX	3	test.t3.EMPNUM	1	End temporary
PREPARE stmt FROM "EXPLAIN SELECT EMPNAME
FROM t1
WHERE EMPNUM IN
   (SELECT EMPNUM
    FROM t3
    WHERE PNUM IN
       (SELECT PNUM
        FROM t2
        WHERE PTYPE = 'Design'))";
EXECUTE stmt;
id	select_type	table	type	possible_keys	key	key_len	ref	rows	Extra
1	PRIMARY	t2	ALL	NULL	NULL	NULL	NULL	6	Using where; Start temporary
1	PRIMARY	t3	ALL	NULL	NULL	NULL	NULL	12	Using where; Using join buffer (BNL, incremental buffers)
1	PRIMARY	t1	eq_ref	t1_IDX	t1_IDX	3	test.t3.EMPNUM	1	End temporary
EXECUTE stmt;
id	select_type	table	type	possible_keys	key	key_len	ref	rows	Extra
1	SIMPLE	t2	ALL	NULL	NULL	NULL	NULL	6	Using where; Start temporary
1	SIMPLE	t3	ALL	NULL	NULL	NULL	NULL	12	Using where; Using join buffer (BNL, incremental buffers)
1	SIMPLE	t1	eq_ref	t1_IDX	t1_IDX	3	test.t3.EMPNUM	1	End temporary
DEALLOCATE PREPARE stmt;
DROP INDEX t1_IDX ON t1;
CREATE INDEX t1_IDX ON t1(EMPNUM);
EXPLAIN SELECT EMPNAME
FROM t1
WHERE EMPNUM IN
(SELECT EMPNUM
FROM t3
WHERE PNUM IN
(SELECT PNUM
FROM t2
WHERE PTYPE = 'Design'));
id	select_type	table	type	possible_keys	key	key_len	ref	rows	Extra
1	PRIMARY	t2	ALL	NULL	NULL	NULL	NULL	6	Using where; Start temporary
1	PRIMARY	t3	ALL	NULL	NULL	NULL	NULL	12	Using where; Using join buffer (BNL, incremental buffers)
1	PRIMARY	t1	ALL	t1_IDX	NULL	NULL	NULL	5	Using where; End temporary; Using join buffer (BNL, incremental buffers)
PREPARE stmt FROM "EXPLAIN SELECT EMPNAME
FROM t1
WHERE EMPNUM IN
   (SELECT EMPNUM
    FROM t3
    WHERE PNUM IN
       (SELECT PNUM
        FROM t2
        WHERE PTYPE = 'Design'))";
EXECUTE stmt;
id	select_type	table	type	possible_keys	key	key_len	ref	rows	Extra
1	PRIMARY	t2	ALL	NULL	NULL	NULL	NULL	6	Using where; Start temporary
1	PRIMARY	t3	ALL	NULL	NULL	NULL	NULL	12	Using where; Using join buffer (BNL, incremental buffers)
1	PRIMARY	t1	ALL	t1_IDX	NULL	NULL	NULL	5	Using where; End temporary; Using join buffer (BNL, incremental buffers)
EXECUTE stmt;
id	select_type	table	type	possible_keys	key	key_len	ref	rows	Extra
1	SIMPLE	t2	ALL	NULL	NULL	NULL	NULL	6	Using where; Start temporary
1	SIMPLE	t3	ALL	NULL	NULL	NULL	NULL	12	Using where; Using join buffer (BNL, incremental buffers)
1	SIMPLE	t1	ALL	t1_IDX	NULL	NULL	NULL	5	Using where; End temporary; Using join buffer (BNL, incremental buffers)
DEALLOCATE PREPARE stmt;
DROP INDEX t1_IDX ON t1;
EXPLAIN SELECT EMPNAME
FROM t1
WHERE EMPNUM IN
(SELECT EMPNUM
FROM t3
WHERE PNUM IN
(SELECT PNUM
FROM t2
WHERE PTYPE = 'Design'));
id	select_type	table	type	possible_keys	key	key_len	ref	rows	Extra
1	PRIMARY	t1	ALL	NULL	NULL	NULL	NULL	5	Start temporary
1	PRIMARY	t2	ALL	NULL	NULL	NULL	NULL	6	Using where; Using join buffer (BNL, incremental buffers)
1	PRIMARY	t3	ALL	NULL	NULL	NULL	NULL	12	Using where; End temporary; Using join buffer (BNL, incremental buffers)
PREPARE stmt FROM "EXPLAIN SELECT EMPNAME
FROM t1
WHERE EMPNUM IN
   (SELECT EMPNUM
    FROM t3
    WHERE PNUM IN
       (SELECT PNUM
        FROM t2
        WHERE PTYPE = 'Design'))";
EXECUTE stmt;
id	select_type	table	type	possible_keys	key	key_len	ref	rows	Extra
1	PRIMARY	t1	ALL	NULL	NULL	NULL	NULL	5	Start temporary
1	PRIMARY	t2	ALL	NULL	NULL	NULL	NULL	6	Using where; Using join buffer (BNL, incremental buffers)
1	PRIMARY	t3	ALL	NULL	NULL	NULL	NULL	12	Using where; End temporary; Using join buffer (BNL, incremental buffers)
EXECUTE stmt;
id	select_type	table	type	possible_keys	key	key_len	ref	rows	Extra
1	SIMPLE	t1	ALL	NULL	NULL	NULL	NULL	5	Start temporary
1	SIMPLE	t2	ALL	NULL	NULL	NULL	NULL	6	Using where; Using join buffer (BNL, incremental buffers)
1	SIMPLE	t3	ALL	NULL	NULL	NULL	NULL	12	Using where; End temporary; Using join buffer (BNL, incremental buffers)
DEALLOCATE PREPARE stmt;
DROP TABLE t1, t2, t3;
#
# BUG#45221 Query SELECT pk FROM C WHERE pk IN (SELECT int_key) failing
#
CREATE TABLE t1 (
i1_key INT,
i2 INT,
i3 INT,
KEY i1_index (i1_key)
);
INSERT INTO t1 VALUES (9,1,2), (9,2,1);
CREATE TABLE t2 (
pk INT NOT NULL,
i1 INT,
PRIMARY KEY (pk)
);
INSERT INTO t2 VALUES (9,1);
SELECT pk
FROM t2
WHERE 
pk IN ( 
SELECT i1_key
FROM t1
WHERE t1.i2 < t1.i3 XOR t2.i1 > 1
ORDER BY t1.i2 desc);
pk
9
DROP TABLE t1,t2;
# BUG#50361 Doublenested noncorrelated subquery with FirstMatch and join cache wrong result
#
CREATE TABLE t1(
id INTEGER
);
INSERT INTO t1 VALUES(10),(20);
create table t2 select * from t1;
create table t3 select * from t1;
SELECT *
FROM t1
WHERE 1 IN(SELECT 1
FROM t2
WHERE 1 IN(SELECT 1
FROM t3));
id
10
20
explain extended SELECT *
FROM t1
WHERE 1 IN(SELECT 1
FROM t2
WHERE 1 IN(SELECT 1
FROM t3));
id	select_type	table	type	possible_keys	key	key_len	ref	rows	filtered	Extra
1	PRIMARY	t1	ALL	NULL	NULL	NULL	NULL	2	100.00	Start temporary
1	PRIMARY	t2	ALL	NULL	NULL	NULL	NULL	2	100.00	Using join buffer (BNL, incremental buffers)
1	PRIMARY	t3	ALL	NULL	NULL	NULL	NULL	2	100.00	End temporary; Using join buffer (BNL, incremental buffers)
Warnings:
Note	1003	select `test`.`t1`.`id` AS `id` from `test`.`t1` semi join (`test`.`t3` join `test`.`t2`) where 1
delete from t2;
delete from t3;
INSERT INTO t1 VALUES(30),(40),(50),(60),(70),(80),(90);
insert into t2 select * from t1;
insert into t3 select * from t1;
create table t4 select * from t1;
SELECT *
FROM t1
WHERE 1 IN(SELECT 1
FROM t2
WHERE 1 IN(SELECT 1
FROM t3
WHERE 1 IN(SELECT 1
FROM t4)));
id
10
20
30
40
50
60
70
80
90
explain SELECT *
FROM t1
WHERE 1 IN(SELECT 1
FROM t2
WHERE 1 IN(SELECT 1
FROM t3
WHERE 1 IN(SELECT 1
FROM t4)));
id	select_type	table	type	possible_keys	key	key_len	ref	rows	Extra
1	PRIMARY	t1	ALL	NULL	NULL	NULL	NULL	9	Start temporary
1	PRIMARY	t2	ALL	NULL	NULL	NULL	NULL	9	Using join buffer (BNL, incremental buffers)
1	PRIMARY	t3	ALL	NULL	NULL	NULL	NULL	9	Using join buffer (BNL, incremental buffers)
1	PRIMARY	t4	ALL	NULL	NULL	NULL	NULL	9	End temporary; Using join buffer (BNL, incremental buffers)
SELECT *
FROM t1
WHERE 1 IN(SELECT 1
FROM t1
WHERE 1 IN(SELECT 1
FROM t1
WHERE 1 IN(SELECT 1
FROM t1)));
id
10
20
30
40
50
60
70
80
90
drop table t1,t2,t3,t4;
#
# Bug#53236 Segfault in DTCollation::set(DTCollation&)
#
CREATE TABLE t1 (
pk INTEGER AUTO_INCREMENT,
col_varchar VARCHAR(1),
PRIMARY KEY (pk)
)
;
INSERT INTO t1 (col_varchar) 
VALUES
('w'),
('m')
;
SELECT  table1.pk
FROM ( t1 AS table1 JOIN t1 AS table2 ON (table1.col_varchar =
table2.col_varchar) ) 
WHERE ( 1, 2 ) IN ( SELECT SUBQUERY1_t1.pk AS SUBQUERY1_field1,
SUBQUERY1_t1.pk AS SUBQUERY1_field2
FROM ( t1 AS SUBQUERY1_t1 JOIN t1 AS SUBQUERY1_t2
ON (SUBQUERY1_t2.col_varchar =
SUBQUERY1_t1.col_varchar) ) ) 
;
pk
drop table t1;
#
# BUG#53298 "wrong result with semijoin (no semijoin strategy chosen)"
#
create table t1 (uid int, fid int);
insert into t1 values (1,1), (3,1);
create table t2 (uid int, name varchar(128));
insert into t2 values (1, "A"), (2, "B");
create table t3 (uid int, fid int, index(uid));
insert into t3 values (1,3), (1,3);
create table t4 (uid int);
insert into t4 values (3);
explain select t2.uid from t2, t1 
where t1.uid in (select t4.uid from t4, t3 where t3.uid=1 and t4.uid=t3.fid)
and t2.uid=t1.fid;
id	select_type	table	type	possible_keys	key	key_len	ref	rows	Extra
1	PRIMARY	t4	system	NULL	NULL	NULL	NULL	1	
1	PRIMARY	t3	ref	uid	uid	5	const	1	Using where; Start temporary
1	PRIMARY	t2	ALL	NULL	NULL	NULL	NULL	2	Using join buffer (BNL, incremental buffers)
1	PRIMARY	t1	ALL	NULL	NULL	NULL	NULL	2	Using where; End temporary; Using join buffer (BNL, incremental buffers)
select t2.uid from t2, t1 
where t1.uid in (select t4.uid from t4, t3 where t3.uid=1 and t4.uid=t3.fid)
and t2.uid=t1.fid;
uid
1
drop table t1,t2,t3,t4;
CREATE TABLE t1 (
pk int,
a varchar(1),
b varchar(4),
c varchar(4),
d varchar(4),
PRIMARY KEY (pk)
);
INSERT INTO t1 VALUES (1,'o','ffff','ffff','ffoo'),(2,'f','ffff','ffff','ffff');
CREATE TABLE t2 LIKE t1;
INSERT INTO t2 VALUES (1,'i','iiii','iiii','iiii'),(2,'f','ffff','ffff','ffff');
EXPLAIN SELECT pk FROM t1 WHERE (a) IN (SELECT a FROM t2 WHERE pk > 0);
id	select_type	table	type	possible_keys	key	key_len	ref	rows	Extra
1	PRIMARY	t1	ALL	NULL	NULL	NULL	NULL	2	Start temporary
1	PRIMARY	t2	range	PRIMARY	PRIMARY	4	NULL	2	Using where; End temporary; Using join buffer (BNL, incremental buffers)
SELECT pk FROM t1 WHERE (a) IN (SELECT a FROM t2 WHERE pk > 0);
pk
2
SELECT pk FROM t1 WHERE (b,c,d) IN (SELECT b,c,d FROM t2 WHERE pk > 0);
pk
2
DROP TABLE t1, t2;
CREATE TABLE t1 (f1 INT, f2 DECIMAL(5,3)) ENGINE=MyISAM;
INSERT INTO t1 (f1, f2) VALUES (1, 1.789);
INSERT INTO t1 (f1, f2) VALUES (13, 1.454);
INSERT INTO t1 (f1, f2) VALUES (10, 1.668);
CREATE TABLE t2 LIKE t1;
INSERT INTO t2 VALUES (1, 1.789);
INSERT INTO t2 VALUES (13, 1.454);
EXPLAIN SELECT COUNT(*) FROM t1 WHERE (f1,f2) IN (SELECT f1,f2 FROM t2);
id	select_type	table	type	possible_keys	key	key_len	ref	rows	Extra
1	PRIMARY	t2	ALL	NULL	NULL	NULL	NULL	2	Start temporary
1	PRIMARY	t1	ALL	NULL	NULL	NULL	NULL	3	Using where; End temporary; Using join buffer (BNL, incremental buffers)
SELECT COUNT(*) FROM t1 WHERE (f1,f2) IN (SELECT f1,f2 FROM t2);
COUNT(*)
2
DROP TABLE t1, t2;
CREATE TABLE t1 (
ID int(11) NOT NULL auto_increment,
Name char(35) NOT NULL default '',
Country char(3) NOT NULL default '',
Population int(11) NOT NULL default '0',
PRIMARY KEY  (ID),
INDEX (Population),
INDEX (Country) 
);
CREATE TABLE t2 (
Code char(3) NOT NULL default '',
Name char(52) NOT NULL default '',
SurfaceArea float(10,2) NOT NULL default '0.00',
Population int(11) NOT NULL default '0',
Capital int(11) default NULL,
PRIMARY KEY  (Code),
UNIQUE INDEX (Name),
INDEX (Population)
);
CREATE TABLE t3 (
Country char(3) NOT NULL default '',
Language char(30) NOT NULL default '',
Percentage float(3,1) NOT NULL default '0.0',
PRIMARY KEY  (Country, Language),
INDEX (Percentage)
);
EXPLAIN
SELECT Name FROM t2 
WHERE t2.Code IN (SELECT Country FROM t1 WHERE Population > 5000000)
AND
t2.Code IN (SELECT Country FROM t3 
WHERE Language='English' AND Percentage > 10 AND
t2.Population > 100000);
id	select_type	table	type	possible_keys	key	key_len	ref	rows	Extra
1	PRIMARY	t1	range	Population,Country	Population	4	NULL	1	Using where; Start temporary
1	PRIMARY	t2	eq_ref	PRIMARY,Population	PRIMARY	3	test.t1.Country	1	Using where
1	PRIMARY	t3	eq_ref	PRIMARY,Percentage	PRIMARY	33	test.t2.Code,const	1	Using where; End temporary
DROP TABLE t1,t2,t3;
CREATE TABLE t1 (
Code char(3) NOT NULL DEFAULT '',
Name char(52) NOT NULL DEFAULT '',
Continent enum('Asia','Europe','North America','Africa','Oceania','Antarctica','South America') NOT NULL DEFAULT 'Asia',
Region char(26) NOT NULL DEFAULT '',
SurfaceArea float(10,2) NOT NULL DEFAULT '0.00',
IndepYear smallint(6) DEFAULT NULL,
Population int(11) NOT NULL DEFAULT '0',
LifeExpectancy float(3,1) DEFAULT NULL,
GNP float(10,2) DEFAULT NULL,
GNPOld float(10,2) DEFAULT NULL,
LocalName char(45) NOT NULL DEFAULT '',
GovernmentForm char(45) NOT NULL DEFAULT '',
HeadOfState char(60) DEFAULT NULL,
Capital int(11) DEFAULT NULL,
Code2 char(2) NOT NULL DEFAULT '',
PRIMARY KEY (Code)
);
CREATE TABLE t2 (
ID int(11) NOT NULL AUTO_INCREMENT,
Name char(35) NOT NULL DEFAULT '',
CountryCode char(3) NOT NULL DEFAULT '',
District char(20) NOT NULL DEFAULT '',
Population int(11) NOT NULL DEFAULT '0',
PRIMARY KEY (ID),
KEY CountryCode (CountryCode)
);
Fill the table with test data
This must not use LooseScan:
EXPLAIN SELECT Name FROM t1 
WHERE t1.Code IN (
SELECT t2.CountryCode FROM t2 WHERE Population > 5000000);
id	select_type	table	type	possible_keys	key	key_len	ref	rows	Extra
1	PRIMARY	t1	ALL	PRIMARY	NULL	NULL	NULL	31	Start temporary
1	PRIMARY	t2	ref	CountryCode	CountryCode	3	test.t1.Code	18	Using where; End temporary
SELECT Name FROM t1 
WHERE t1.Code IN (
SELECT t2.CountryCode FROM t2 WHERE Population > 5000000);
Name
Austria
Canada
China
Czech Republic
drop table t1, t2;
create table t0 (a int);
insert into t0 values (0),(1),(2),(3),(4);
create table t1 (a int, b int, key(a));
insert into t1 select a,a from t0;
create table t2 (a int, b int, primary key(a));
insert into t2 select * from t1;
Table t2, unlike table t1, should be displayed as pulled out
explain extended select * from t0
where t0.a in ( select t1.a from t1,t2 where t2.a=t0.a and
t1.b=t2.b);
id	select_type	table	type	possible_keys	key	key_len	ref	rows	filtered	Extra
1	PRIMARY	t0	ALL	NULL	NULL	NULL	NULL	5	100.00	Using where; Start temporary
1	PRIMARY	t1	ref	a	a	5	test.t0.a	1	100.00	
1	PRIMARY	t2	eq_ref	PRIMARY	PRIMARY	4	test.t0.a	1	100.00	Using where; End temporary
Warnings:
Note	1276	Field or reference 'test.t0.a' of SELECT #2 was resolved in SELECT #1
Note	1003	select `test`.`t0`.`a` AS `a` from `test`.`t2` semi join (`test`.`t1`) join `test`.`t0` where ((`test`.`t2`.`b` = `test`.`t1`.`b`) and (`test`.`t1`.`a` = `test`.`t0`.`a`) and (`test`.`t2`.`a` = `test`.`t0`.`a`))
update t1 set a=3, b=11 where a=4;
update t2 set b=11 where a=3;
create temporary table tmp select * from t0 where t0.a in 
(select t1.a from t1, t2 where t2.a=t0.a and t1.b=t2.b);
create temporary table tmp_as_ref (a int);
insert into tmp_as_ref values(0),(1),(2),(3);
select * from tmp;
a
0
1
2
3
drop table t0, t1, t2, tmp, tmp_as_ref;
CREATE TABLE t1 (
id int(11) NOT NULL,
PRIMARY KEY (id));
CREATE TABLE t2 (
id int(11) NOT NULL,
fid int(11) NOT NULL,
PRIMARY KEY (id));
insert into t1 values(1);
insert into t2 values(1,7503),(2,1);
explain select count(*) 
from t1 
where fid IN (select fid from t2 where (id between 7502 and 8420) order by fid );
ERROR 42S22: Unknown column 'fid' in 'IN/ALL/ANY subquery'
drop table t1, t2;
create table t1 (a int, b int, key (a), key (b));
insert into t1 values (2,4),(2,4),(2,4);
select t1.a from t1 
where 
t1.a in (select 1 from t1 where t1.a in (select 1 from t1) group by  t1.a);
a
drop table t1;
create table t1(a int,b int,key(a),key(b));
insert into t1 values (1,1),(2,2),(3,3);
select 1 from t1 
where t1.a not in (select 1 from t1 
where t1.a in (select 1 from t1) 
group by  t1.b);
1
1
1
drop table t1;
CREATE TABLE t1
(EMPNUM   CHAR(3) NOT NULL,
EMPNAME  CHAR(20),
GRADE    DECIMAL(4),
CITY     CHAR(15));
CREATE TABLE t2
(PNUM     CHAR(3) NOT NULL,
PNAME    CHAR(20),
PTYPE    CHAR(6),
BUDGET   DECIMAL(9),
CITY     CHAR(15));
CREATE TABLE t3
(EMPNUM   CHAR(3) NOT NULL,
PNUM     CHAR(3) NOT NULL,
HOURS    DECIMAL(5));
INSERT INTO t1 VALUES ('E1','Alice',12,'Deale');
INSERT INTO t1 VALUES ('E2','Betty',10,'Vienna');
INSERT INTO t1 VALUES ('E3','Carmen',13,'Vienna');
INSERT INTO t1 VALUES ('E4','Don',12,'Deale');
INSERT INTO t1 VALUES ('E5','Ed',13,'Akron');
INSERT INTO t2 VALUES ('P1','MXSS','Design',10000,'Deale');
INSERT INTO t2 VALUES ('P2','CALM','Code',30000,'Vienna');
INSERT INTO t2 VALUES ('P3','SDP','Test',30000,'Tampa');
INSERT INTO t2 VALUES ('P4','SDP','Design',20000,'Deale');
INSERT INTO t2 VALUES ('P5','IRM','Test',10000,'Vienna');
INSERT INTO t2 VALUES ('P6','PAYR','Design',50000,'Deale');
INSERT INTO t3 VALUES  ('E1','P1',40);
INSERT INTO t3 VALUES  ('E1','P2',20);
INSERT INTO t3 VALUES  ('E1','P3',80);
INSERT INTO t3 VALUES  ('E1','P4',20);
INSERT INTO t3 VALUES  ('E1','P5',12);
INSERT INTO t3 VALUES  ('E1','P6',12);
INSERT INTO t3 VALUES  ('E2','P1',40);
INSERT INTO t3 VALUES  ('E2','P2',80);
INSERT INTO t3 VALUES  ('E3','P2',20);
INSERT INTO t3 VALUES  ('E4','P2',20);
INSERT INTO t3 VALUES  ('E4','P4',40);
INSERT INTO t3 VALUES  ('E4','P5',80);
SELECT * FROM t1;
EMPNUM	EMPNAME	GRADE	CITY
E1	Alice	12	Deale
E2	Betty	10	Vienna
E3	Carmen	13	Vienna
E4	Don	12	Deale
E5	Ed	13	Akron
CREATE UNIQUE INDEX t1_IDX ON t1(EMPNUM);
SELECT EMPNAME
FROM t1
WHERE EMPNUM IN
(SELECT EMPNUM
FROM t3
WHERE PNUM IN
(SELECT PNUM
FROM t2
WHERE PTYPE = 'Design'));
EMPNAME
Alice
Betty
Don
DROP INDEX t1_IDX ON t1;
CREATE INDEX t1_IDX ON t1(EMPNUM);
SELECT EMPNAME
FROM t1
WHERE EMPNUM IN
(SELECT EMPNUM
FROM t3
WHERE PNUM IN
(SELECT PNUM
FROM t2
WHERE PTYPE = 'Design'));
EMPNAME
Alice
Betty
Don
DROP INDEX t1_IDX ON t1;
SELECT EMPNAME
FROM t1
WHERE EMPNUM IN
(SELECT EMPNUM
FROM t3
WHERE PNUM IN
(SELECT PNUM
FROM t2
WHERE PTYPE = 'Design'));
EMPNAME
Alice
Betty
Don
DROP TABLE t1, t2, t3;
CREATE TABLE t1 (f1 INT NOT NULL);
CREATE VIEW v1 (a) AS SELECT f1 IN (SELECT f1 FROM t1) FROM t1;
SELECT * FROM v1;
a
drop view v1;
drop table t1;
create table t0 (a int);
insert into t0 values (0),(1),(2),(3),(4),(5),(6),(7),(8),(9);
create table t1(a int, b int);
insert into t1 values (0,0),(1,1),(2,2);
create table t2 as select * from t1;
create table t3 (pk int, a int, primary key(pk));
insert into t3 select a,a from t0;
explain 
select * from t1 left join t2 on (t2.a= t1.a and t2.a in (select pk from t3));
id	select_type	table	type	possible_keys	key	key_len	ref	rows	Extra
1	PRIMARY	t1	ALL	NULL	NULL	NULL	NULL	3	
1	PRIMARY	t2	ALL	NULL	NULL	NULL	NULL	3	Using where; Using join buffer (BNL, incremental buffers)
2	DEPENDENT SUBQUERY	t3	unique_subquery	PRIMARY	PRIMARY	4	func	1	Using index
drop table t0, t1, t2, t3;
create table t1 (a int not null);
drop procedure if exists p1|
CREATE PROCEDURE p1()
BEGIN
DECLARE EXIT HANDLER FOR SQLEXCEPTION select a from t1;
prepare s1 from '
  select a from t1 where a in ( 
  select a from t1 where a in ( 
  select a from t1 where a in ( 
  select a from t1 where a in ( 
  select a from t1 where a in ( 
  select a from t1 where a in ( 
  select a from t1 where a in ( 
  select a from t1 where a in ( 
  select a from t1 where a in ( 
  select a from t1 where a in ( 
  select a from t1 where a in ( 
  select a from t1 where a in ( 
  select a from t1 where a in ( 
  select a from t1 where a in ( 
  select a from t1 where a in ( 
  select a from t1 where a in ( 
  select a from t1 where a in ( 
  select a from t1 where a in ( 
  select a from t1 where a in ( 
  select a from t1 where a in ( 
  select a from t1 where a in ( 
  select a from t1 where a in ( 
  select a from t1 where a in ( 
  select a from t1 where a in ( 
  select a from t1 where a in ( 
  select a from t1 where a in ( 
  select a from t1 where a in ( 
  select a from t1 where a in ( 
  select a from t1 where a in ( 
  select a from t1 where a in ( 
  select a from t1 where a in ( 
  select a from t1 where a in ( 
  select a from t1 where a in ( 
  select a from t1 where a in ( 
  select a from t1 where a in ( 
  select a from t1 where a in ( 
  select a from t1 where a in ( 
  select a from t1 where a in ( 
  select a from t1 where a in ( 
  select a from t1 where a in ( 
  select a from t1 where a in ( 
  select a from t1 where a in ( 
  select a from t1 where a in ( 
  select a from t1 where a in ( 
  select a from t1 where a in ( 
  select a from t1 where a in ( 
  select a from t1 where a in ( 
  select a from t1 where a in ( 
  select a from t1 where a in ( 
  select a from t1 where a in ( 
  select a from t1 where a in ( 
  select a from t1 where a in ( 
  select a from t1 where a in ( 
  select a from t1 where a in ( 
  select a from t1 where a in ( 
  select a from t1 where a in ( 
  select a from t1 where a in ( 
  select a from t1 where a in ( 
  select a from t1 where a in ( 
  select a from t1 where a in ( 
  select a from t1 where a in ( 
  select a from t1 where a in ( select a from t1) 
  )))))))))))))))))))))))))))))))))))))))))))))))))))))))))))))';
execute s1;
END;
|
call p1();
a
drop procedure p1;
drop table t1;
create table t0 (a int);
insert into t0 values (0),(1),(2),(3),(4),(5),(6),(7),(8),(9);
create table t1 (a int) as select A.a + 10 *(B.a + 10*C.a) as a  from t0 A, t0 B, t0 C;
create table t2 (id int, a int, primary key(id), key(a)) as select a as id, a as a  from t1;
show create table t2;
Table	Create Table
t2	CREATE TABLE `t2` (
  `id` int(11) NOT NULL DEFAULT '0',
  `a` int(11) DEFAULT NULL,
  PRIMARY KEY (`id`),
  KEY `a` (`a`)
) ENGINE=MyISAM DEFAULT CHARSET=latin1
set @a=0;
create table t3 as select * from t2 limit 0;
insert into t3 select @a:=@a+1, t2.a from t2, t0;
insert into t3 select @a:=@a+1, t2.a from t2, t0;
insert into t3 select @a:=@a+1, t2.a from t2, t0;
alter table t3 add primary key(id), add key(a);
The following must use loose index scan over t3, key a:
explain select count(a) from t2 where a in ( SELECT  a FROM t3);
id	select_type	table	type	possible_keys	key	key_len	ref	rows	Extra
1	PRIMARY	t2	index	a	a	5	NULL	1000	Using where; Using index; Start temporary
1	PRIMARY	t3	ref	a	a	5	test.t2.a	30	Using index; End temporary
select count(a) from t2 where a in ( SELECT  a FROM t3);
count(a)
1000
drop table t0,t1,t2,t3;
#
# Bug#33062: subquery in stored routine cause crash
#
CREATE TABLE t1(a INT);
CREATE TABLE t2(c INT);
CREATE PROCEDURE p1(v1 int)
BEGIN
SELECT 1 FROM t1 WHERE a = v1 AND a IN (SELECT c FROM t2);
END
//
CREATE PROCEDURE p2(v1 int)
BEGIN
SELECT 1 FROM t1 WHERE a IN (SELECT c FROM t2);
END
//
CREATE PROCEDURE p3(v1 int)
BEGIN
SELECT 1 
FROM 
t1 t01,t1 t02,t1 t03,t1 t04,t1 t05,t1 t06,t1 t07,t1 t08,
t1 t09,t1 t10,t1 t11,t1 t12,t1 t13,t1 t14,t1 t15,t1 t16,
t1 t17,t1 t18,t1 t19,t1 t20,t1 t21,t1 t22,t1 t23,t1 t24,
t1 t25,t1 t26,t1 t27,t1 t28,t1 t29,t1 t30,t1 t31,t1 t32,
t1 t33,t1 t34,t1 t35,t1 t36,t1 t37,t1 t38,t1 t39,t1 t40,
t1 t41,t1 t42,t1 t43,t1 t44,t1 t45,t1 t46,t1 t47,t1 t48,
t1 t49,t1 t50,t1 t51,t1 t52,t1 t53,t1 t54,t1 t55,t1 t56,
t1 t57,t1 t58,t1 t59,t1 t60
WHERE t01.a IN (SELECT c FROM t2);
END
//
CREATE PROCEDURE p4(v1 int)
BEGIN
SELECT 1 
FROM 
t1 t01,t1 t02,t1 t03,t1 t04,t1 t05,t1 t06,t1 t07,t1 t08,
t1 t09,t1 t10,t1 t11,t1 t12,t1 t13,t1 t14,t1 t15,t1 t16,
t1 t17,t1 t18,t1 t19,t1 t20,t1 t21,t1 t22,t1 t23,t1 t24,
t1 t25,t1 t26,t1 t27,t1 t28,t1 t29,t1 t30,t1 t31,t1 t32,
t1 t33,t1 t34,t1 t35,t1 t36,t1 t37,t1 t38,t1 t39,t1 t40,
t1 t41,t1 t42,t1 t43,t1 t44,t1 t45,t1 t46,t1 t47,t1 t48,
t1 t49,t1 t50,t1 t51,t1 t52,t1 t53,t1 t54,t1 t55,t1 t56,
t1 t57,t1 t58,t1 t59,t1 t60
WHERE t01.a = v1 AND t01.a IN (SELECT c FROM t2);
END
//
CALL p1(1);
1
CALL p2(1);
1
CALL p3(1);
1
CALL p4(1);
1
DROP TABLE t1, t2;
DROP PROCEDURE p1;
DROP PROCEDURE p2;
DROP PROCEDURE p3;
DROP PROCEDURE p4;
# 
# Bug#48213 Materialized subselect crashes if using GEOMETRY type
# 
CREATE TABLE t1 (
pk int,
a varchar(1),
b varchar(4),
c tinyblob,
d blob,
e mediumblob,
f longblob,
g tinytext,
h text,
i mediumtext,
j longtext,
k geometry,
PRIMARY KEY (pk)
);
INSERT INTO t1 VALUES (1,'o','ffff','ffff','ffoo','ffff','ffff','ffff','ffff','ffff','ffff',GeomFromText('POLYGON((0 0, 0 2, 2 2, 2 0, 0 0))')), (2,'f','ffff','ffff','ffff', 'ffff','ffff','ffff','ffff','ffff','ffff',GeomFromText('POLYGON((0 0, 0 2, 2 2, 2 0, 0 0))'));
CREATE TABLE t2 LIKE t1;
INSERT INTO t2 VALUES (1,'i','iiii','iiii','iiii','iiii','ffff','ffff','ffff','ffff','ffff',GeomFromText('POLYGON((0 0, 0 2, 2 2, 2 0, 0 0))')), (2,'f','ffff','ffff','ffff','ffff','ffff','ffff','ffff','ffff','ffff',GeomFromText('POLYGON((0 0, 0 2, 2 2, 2 0, 0 0))'));
EXPLAIN EXTENDED SELECT pk FROM t1 WHERE (a, b) IN (SELECT a, b FROM t2 WHERE pk > 0);
id	select_type	table	type	possible_keys	key	key_len	ref	rows	filtered	Extra
1	PRIMARY	t1	ALL	NULL	NULL	NULL	NULL	2	100.00	Start temporary
1	PRIMARY	t2	range	PRIMARY	PRIMARY	4	NULL	2	100.00	Using where; End temporary; Using join buffer (BNL, incremental buffers)
Warnings:
Note	1003	select `test`.`t1`.`pk` AS `pk` from `test`.`t1` semi join (`test`.`t2`) where ((`test`.`t2`.`b` = `test`.`t1`.`b`) and (`test`.`t2`.`a` = `test`.`t1`.`a`) and (`test`.`t2`.`pk` > 0))
SELECT pk FROM t1 WHERE (a, b) IN (SELECT a, b FROM t2 WHERE pk > 0);
pk
2
EXPLAIN EXTENDED SELECT pk FROM t1 WHERE (b, c) IN (SELECT b, c FROM t2 WHERE pk > 0);
id	select_type	table	type	possible_keys	key	key_len	ref	rows	filtered	Extra
1	PRIMARY	t1	ALL	NULL	NULL	NULL	NULL	2	100.00	Start temporary
1	PRIMARY	t2	range	PRIMARY	PRIMARY	4	NULL	2	100.00	Using where; End temporary; Using join buffer (BNL, incremental buffers)
Warnings:
Note	1003	select `test`.`t1`.`pk` AS `pk` from `test`.`t1` semi join (`test`.`t2`) where ((`test`.`t2`.`c` = `test`.`t1`.`c`) and (`test`.`t2`.`b` = `test`.`t1`.`b`) and (`test`.`t2`.`pk` > 0))
SELECT pk FROM t1 WHERE (b, c) IN (SELECT b, c FROM t2 WHERE pk > 0);
pk
1
2
EXPLAIN EXTENDED SELECT pk FROM t1 WHERE (b, d) IN (SELECT b, d FROM t2 WHERE pk > 0);
id	select_type	table	type	possible_keys	key	key_len	ref	rows	filtered	Extra
1	PRIMARY	t1	ALL	NULL	NULL	NULL	NULL	2	100.00	Start temporary
1	PRIMARY	t2	range	PRIMARY	PRIMARY	4	NULL	2	100.00	Using where; End temporary; Using join buffer (BNL, incremental buffers)
Warnings:
Note	1003	select `test`.`t1`.`pk` AS `pk` from `test`.`t1` semi join (`test`.`t2`) where ((`test`.`t2`.`d` = `test`.`t1`.`d`) and (`test`.`t2`.`b` = `test`.`t1`.`b`) and (`test`.`t2`.`pk` > 0))
SELECT pk FROM t1 WHERE (b, d) IN (SELECT b, d FROM t2 WHERE pk > 0);
pk
2
EXPLAIN EXTENDED SELECT pk FROM t1 WHERE (b, e) IN (SELECT b, e FROM t2 WHERE pk > 0);
id	select_type	table	type	possible_keys	key	key_len	ref	rows	filtered	Extra
1	PRIMARY	t1	ALL	NULL	NULL	NULL	NULL	2	100.00	Start temporary
1	PRIMARY	t2	range	PRIMARY	PRIMARY	4	NULL	2	100.00	Using where; End temporary; Using join buffer (BNL, incremental buffers)
Warnings:
Note	1003	select `test`.`t1`.`pk` AS `pk` from `test`.`t1` semi join (`test`.`t2`) where ((`test`.`t2`.`e` = `test`.`t1`.`e`) and (`test`.`t2`.`b` = `test`.`t1`.`b`) and (`test`.`t2`.`pk` > 0))
SELECT pk FROM t1 WHERE (b, e) IN (SELECT b, e FROM t2 WHERE pk > 0);
pk
1
2
EXPLAIN EXTENDED SELECT pk FROM t1 WHERE (b, f) IN (SELECT b, f FROM t2 WHERE pk > 0);
id	select_type	table	type	possible_keys	key	key_len	ref	rows	filtered	Extra
1	PRIMARY	t1	ALL	NULL	NULL	NULL	NULL	2	100.00	Start temporary
1	PRIMARY	t2	range	PRIMARY	PRIMARY	4	NULL	2	100.00	Using where; End temporary; Using join buffer (BNL, incremental buffers)
Warnings:
Note	1003	select `test`.`t1`.`pk` AS `pk` from `test`.`t1` semi join (`test`.`t2`) where ((`test`.`t2`.`f` = `test`.`t1`.`f`) and (`test`.`t2`.`b` = `test`.`t1`.`b`) and (`test`.`t2`.`pk` > 0))
SELECT pk FROM t1 WHERE (b, f) IN (SELECT b, f FROM t2 WHERE pk > 0);
pk
1
2
EXPLAIN EXTENDED SELECT pk FROM t1 WHERE (b, g) IN (SELECT b, g FROM t2 WHERE pk > 0);
id	select_type	table	type	possible_keys	key	key_len	ref	rows	filtered	Extra
1	PRIMARY	t1	ALL	NULL	NULL	NULL	NULL	2	100.00	Start temporary
1	PRIMARY	t2	range	PRIMARY	PRIMARY	4	NULL	2	100.00	Using where; End temporary; Using join buffer (BNL, incremental buffers)
Warnings:
Note	1003	select `test`.`t1`.`pk` AS `pk` from `test`.`t1` semi join (`test`.`t2`) where ((`test`.`t2`.`g` = `test`.`t1`.`g`) and (`test`.`t2`.`b` = `test`.`t1`.`b`) and (`test`.`t2`.`pk` > 0))
SELECT pk FROM t1 WHERE (b, g) IN (SELECT b, g FROM t2 WHERE pk > 0);
pk
1
2
EXPLAIN EXTENDED SELECT pk FROM t1 WHERE (b, h) IN (SELECT b, h FROM t2 WHERE pk > 0);
id	select_type	table	type	possible_keys	key	key_len	ref	rows	filtered	Extra
1	PRIMARY	t1	ALL	NULL	NULL	NULL	NULL	2	100.00	Start temporary
1	PRIMARY	t2	range	PRIMARY	PRIMARY	4	NULL	2	100.00	Using where; End temporary; Using join buffer (BNL, incremental buffers)
Warnings:
Note	1003	select `test`.`t1`.`pk` AS `pk` from `test`.`t1` semi join (`test`.`t2`) where ((`test`.`t2`.`h` = `test`.`t1`.`h`) and (`test`.`t2`.`b` = `test`.`t1`.`b`) and (`test`.`t2`.`pk` > 0))
SELECT pk FROM t1 WHERE (b, h) IN (SELECT b, h FROM t2 WHERE pk > 0);
pk
1
2
EXPLAIN EXTENDED SELECT pk FROM t1 WHERE (b, i) IN (SELECT b, i FROM t2 WHERE pk > 0);
id	select_type	table	type	possible_keys	key	key_len	ref	rows	filtered	Extra
1	PRIMARY	t1	ALL	NULL	NULL	NULL	NULL	2	100.00	Start temporary
1	PRIMARY	t2	range	PRIMARY	PRIMARY	4	NULL	2	100.00	Using where; End temporary; Using join buffer (BNL, incremental buffers)
Warnings:
Note	1003	select `test`.`t1`.`pk` AS `pk` from `test`.`t1` semi join (`test`.`t2`) where ((`test`.`t2`.`i` = `test`.`t1`.`i`) and (`test`.`t2`.`b` = `test`.`t1`.`b`) and (`test`.`t2`.`pk` > 0))
SELECT pk FROM t1 WHERE (b, i) IN (SELECT b, i FROM t2 WHERE pk > 0);
pk
1
2
EXPLAIN EXTENDED SELECT pk FROM t1 WHERE (b, j) IN (SELECT b, j FROM t2 WHERE pk > 0);
id	select_type	table	type	possible_keys	key	key_len	ref	rows	filtered	Extra
1	PRIMARY	t1	ALL	NULL	NULL	NULL	NULL	2	100.00	Start temporary
1	PRIMARY	t2	range	PRIMARY	PRIMARY	4	NULL	2	100.00	Using where; End temporary; Using join buffer (BNL, incremental buffers)
Warnings:
Note	1003	select `test`.`t1`.`pk` AS `pk` from `test`.`t1` semi join (`test`.`t2`) where ((`test`.`t2`.`j` = `test`.`t1`.`j`) and (`test`.`t2`.`b` = `test`.`t1`.`b`) and (`test`.`t2`.`pk` > 0))
SELECT pk FROM t1 WHERE (b, j) IN (SELECT b, j FROM t2 WHERE pk > 0);
pk
1
2
EXPLAIN EXTENDED SELECT pk FROM t1 WHERE (b, k) IN (SELECT b, k FROM t2 WHERE pk > 0);
id	select_type	table	type	possible_keys	key	key_len	ref	rows	filtered	Extra
1	PRIMARY	t1	ALL	NULL	NULL	NULL	NULL	2	100.00	Start temporary
1	PRIMARY	t2	range	PRIMARY	PRIMARY	4	NULL	2	100.00	Using where; End temporary; Using join buffer (BNL, incremental buffers)
Warnings:
Note	1003	select `test`.`t1`.`pk` AS `pk` from `test`.`t1` semi join (`test`.`t2`) where ((`test`.`t2`.`k` = `test`.`t1`.`k`) and (`test`.`t2`.`b` = `test`.`t1`.`b`) and (`test`.`t2`.`pk` > 0))
SELECT pk FROM t1 WHERE (b, k) IN (SELECT b, k FROM t2 WHERE pk > 0);
pk
1
2
DROP TABLE t1, t2;
# End of Bug#48213
# 
# BUG#53060: LooseScan semijoin strategy does not return all rows
# 
CREATE TABLE t1 (i INTEGER);
INSERT INTO t1 VALUES (1), (2), (3), (4), (5);
CREATE TABLE t2 (i INTEGER, j INTEGER, KEY k(i, j));
INSERT INTO t2 VALUES (1, 0), (1, 1), (2, 0), (2, 1);
EXPLAIN
SELECT * FROM t1 WHERE (i) IN (SELECT i FROM t2 where j > 0);
id	select_type	table	type	possible_keys	key	key_len	ref	rows	Extra
1	PRIMARY	t1	ALL	NULL	NULL	NULL	NULL	5	Start temporary
1	PRIMARY	t2	index	k	k	10	NULL	4	Using where; Using index; End temporary; Using join buffer (BNL, incremental buffers)
SELECT * FROM t1 WHERE (i) IN (SELECT i FROM t2 where j > 0);
i
1
2
DROP TABLE t1, t2;
# End of BUG#53060
#
# Bug#53305 "Duplicate weedout + join buffer (join cache --level=7,8) loses rows"
#
create table t1 (uid int, fid int, index(uid));
insert into t1 values
(1,1), (1,2), (1,3), (1,4),
(2,5), (2,6), (2,7), (2,8),
(3,1), (3,2), (3,9);
create table t2 (uid int primary key, name varchar(128), index(name));
insert into t2 values 
(1, "A"), (2, "B"), (3, "C"), (4, "D"), (5, "E"),
(6, "F"), (7, "G"), (8, "H"), (9, "I");
create table t3 (uid int, fid int, index(uid));
insert into t3 values
(1,1), (1,2), (1,3),(1,4),
(2,5), (2,6), (2,7), (2,8),
(3,1), (3,2), (3,9);
create table t4 (uid int primary key, name varchar(128), index(name));
insert into t4 values 
(1, "A"), (2, "B"), (3, "C"), (4, "D"), (5, "E"),
(6, "F"), (7, "G"), (8, "H"), (9, "I");
explain select name from t2, t1 
where t1.uid in (select t4.uid from t4, t3 where t3.uid=1 and t4.uid=t3.fid)
and t2.uid=t1.fid;
id	select_type	table	type	possible_keys	key	key_len	ref	rows	Extra
1	PRIMARY	t3	ref	uid	uid	5	const	4	Using where; Start temporary
1	PRIMARY	t4	eq_ref	PRIMARY	PRIMARY	4	test.t3.fid	1	Using index
1	PRIMARY	t1	ref	uid	uid	5	test.t4.uid	2	Using where; End temporary
1	PRIMARY	t2	ALL	PRIMARY	NULL	NULL	NULL	9	Using where; Using join buffer (BNL, incremental buffers)
select name from t2, t1 
where t1.uid in (select t4.uid from t4, t3 where t3.uid=1 and t4.uid=t3.fid)
and t2.uid=t1.fid;
name
A
A
B
B
C
D
E
F
G
H
I
drop table t1,t2,t3,t4;
#
# Bug#53058 - semijoin execution of subquery with outerjoin yields wrong result
#
CREATE TABLE t1 (i INTEGER);
CREATE TABLE t2 (i INTEGER);
CREATE TABLE t3 (i INTEGER);
INSERT INTO t1 VALUES (1), (2);
INSERT INTO t2 VALUES (6);
INSERT INTO t3 VALUES (1), (2);
explain extended SELECT * FROM t1 WHERE (t1.i) IN 
(SELECT t3.i FROM t3 LEFT JOIN t2 ON t2.i=t3.i);
id	select_type	table	type	possible_keys	key	key_len	ref	rows	filtered	Extra
1	PRIMARY	t1	ALL	NULL	NULL	NULL	NULL	2	100.00	Start temporary
1	PRIMARY	t3	ALL	NULL	NULL	NULL	NULL	2	100.00	Using where; Using join buffer (BNL, incremental buffers)
1	PRIMARY	t2	ALL	NULL	NULL	NULL	NULL	1	100.00	Using where; End temporary; Using join buffer (BNL, incremental buffers)
Warnings:
Note	1003	select `test`.`t1`.`i` AS `i` from `test`.`t1` semi join (`test`.`t3` left join `test`.`t2` on((`test`.`t2`.`i` = `test`.`t3`.`i`))) where (`test`.`t3`.`i` = `test`.`t1`.`i`)
SELECT * FROM t1 WHERE (t1.i) IN 
(SELECT t3.i FROM t3 LEFT JOIN t2 ON t2.i=t3.i);
i
1
2
drop table t1,t2,t3;
#
# BUG#49453: re-execution of prepared statement with view 
#            and semijoin crashes
#
CREATE TABLE t1 (city VARCHAR(50), country_id INT);
CREATE TABLE t2 (country_id INT, country VARCHAR(50));
INSERT INTO t1 VALUES 
('Batna',2),('Bchar',2),('Skikda',2),('Tafuna',3),('Algeria',2) ;
INSERT INTO t2 VALUES (2,'Algeria'),(2,'AlgeriaDup'),(3,'XAmerican Samoa');
CREATE VIEW v1 AS 
SELECT country_id as vf_country_id
FROM t2
WHERE LEFT(country,1) = "A";
PREPARE stmt FROM "
SELECT city, country_id
FROM t1
WHERE country_id IN (SELECT vf_country_id FROM v1);
";

EXECUTE stmt;
city	country_id
Batna	2
Bchar	2
Skikda	2
Algeria	2
EXECUTE stmt;
city	country_id
Batna	2
Bchar	2
Skikda	2
Algeria	2
DROP TABLE t1,t2;
DROP VIEW v1;
#
# Bug#54437 Extra rows with LEFT JOIN + semijoin (firstmatch
# and duplicates weedout)
#
create table t1 (a int);
create table t2 (a int);
create table t3 (a int);
insert into t1 values(1),(1);
insert into t2 values(1),(1),(1),(1);
insert into t3 values(2),(2);
explain select * from t1 where t1.a in (select t2.a from t2 left join t3 on t2.a=t3.a);
id	select_type	table	type	possible_keys	key	key_len	ref	rows	Extra
1	PRIMARY	t1	ALL	NULL	NULL	NULL	NULL	2	Start temporary
1	PRIMARY	t2	ALL	NULL	NULL	NULL	NULL	4	Using where; Using join buffer (BNL, incremental buffers)
1	PRIMARY	t3	ALL	NULL	NULL	NULL	NULL	2	Using where; End temporary; Using join buffer (BNL, incremental buffers)
select * from t1 where t1.a in (select t2.a from t2 left join t3 on t2.a=t3.a);
a
1
1
drop table t1,t2,t3;
#
# Bug#55955: crash in MEMORY engine with IN(LEFT JOIN (JOIN))
#
CREATE TABLE t1 (a INT);
CREATE TABLE t2 (a INT);
CREATE TABLE t3 (a INT);
INSERT INTO t1 VALUES(1),(1);
INSERT INTO t2 VALUES(1),(1);
INSERT INTO t3 VALUES(2),(2);
explain SELECT * FROM t1
WHERE t1.a IN (SELECT t2.a
FROM t2 LEFT JOIN (t2 AS t2inner, t3) ON t2.a=t3.a);
id	select_type	table	type	possible_keys	key	key_len	ref	rows	Extra
1	PRIMARY	t1	ALL	NULL	NULL	NULL	NULL	2	Start temporary
1	PRIMARY	t2	ALL	NULL	NULL	NULL	NULL	2	Using where; Using join buffer (BNL, incremental buffers)
1	PRIMARY	t2inner	ALL	NULL	NULL	NULL	NULL	2	Using join buffer (BNL, incremental buffers)
1	PRIMARY	t3	ALL	NULL	NULL	NULL	NULL	2	Using where; End temporary; Using join buffer (BNL, incremental buffers)
SELECT * FROM t1
WHERE t1.a IN (SELECT t2.a
FROM t2 LEFT JOIN (t2 AS t2inner, t3) ON t2.a=t3.a);
a
1
1
DROP TABLE t1,t2,t3;
#
# BUG#52329 - Wrong result: subquery materialization, IN, 
#             non-null field followed by nullable
#
CREATE TABLE t1 (a1 CHAR(8) NOT NULL, a2 char(8) NOT NULL);
CREATE TABLE t2a (b1 char(8), b2 char(8));
CREATE TABLE t2b (b1 CHAR(8), b2 char(8) NOT NULL);
CREATE TABLE t2c (b1 CHAR(8) NOT NULL, b2 char(8));
INSERT INTO t1 VALUES ('1 - 12', '2 - 22');
INSERT INTO t2a VALUES ('1 - 11', '2 - 21'),
('1 - 11', '2 - 21'),
('1 - 12', '2 - 22'),
('1 - 12', '2 - 22'),
('1 - 13', '2 - 23');
INSERT INTO t2b SELECT * FROM t2a;
INSERT INTO t2c SELECT * FROM t2a;
SELECT * FROM t1
WHERE (a1, a2) IN (
SELECT b1, b2 FROM t2c WHERE b1 > '0' GROUP BY b1, b2);
a1	a2
1 - 12	2 - 22
SELECT * FROM t1
WHERE (a1, a2) IN (
SELECT b1, b2 FROM t2a WHERE b1 > '0');
a1	a2
1 - 12	2 - 22
SELECT * FROM t1
WHERE (a1, a2) IN (
SELECT b1, b2 FROM t2b WHERE b1 > '0');
a1	a2
1 - 12	2 - 22
SELECT * FROM t1
WHERE (a1, a2) IN (
SELECT b1, b2 FROM t2c WHERE b1 > '0');
a1	a2
1 - 12	2 - 22
DROP TABLE t1,t2a,t2b,t2c;
# End BUG#52329
#
# Bug#45174: Incorrectly applied equality propagation caused wrong
# result on a query with a materialized semi-join.
#
CREATE TABLE t1 (
varchar_nokey varchar(1) NOT NULL
);
INSERT INTO t1 VALUES
('v'), ('u'), ('n'), ('l'), ('h'), ('u'), ('n'), ('j'), ('k'),
('e'), ('i'), ('u'), ('n'), ('b'), ('x'), (''), ('q'), ('u');
CREATE TABLE t2 (
pk int NOT NULL,
varchar_key varchar(1) NOT NULL,
varchar_nokey varchar(1) NOT NULL,
PRIMARY KEY(pk),
KEY varchar_key(varchar_key)
);
INSERT INTO t2 VALUES
(11,'m','m'), (12,'j','j'), (13,'z','z'), (14,'a','a'), (15,'',''),
(16,'e','e'), (17,'t','t'), (19,'b','b'), (20,'w','w'), (21,'m','m'),
(23,'',''), (24,'w','w'), (26,'e','e'), (27,'e','e'), (28,'p','p');
SELECT varchar_nokey
FROM t1
WHERE (varchar_nokey, varchar_nokey) IN (SELECT varchar_key, varchar_nokey
FROM t2  
WHERE varchar_nokey < 'n' XOR pk);
varchar_nokey
explain SELECT varchar_nokey
FROM t1
WHERE (varchar_nokey, varchar_nokey) IN (SELECT varchar_key, varchar_nokey
FROM t2  
WHERE varchar_nokey < 'n' XOR pk);
id	select_type	table	type	possible_keys	key	key_len	ref	rows	Extra
1	PRIMARY	t1	ALL	NULL	NULL	NULL	NULL	18	Start temporary
1	PRIMARY	t2	ref	varchar_key	varchar_key	3	test.t1.varchar_nokey	2	Using where; End temporary
DROP TABLE t1, t2;
# End of the test for bug#45174.
#
# Bug#50019: Wrong result for IN-query with materialization
#
CREATE TABLE t1(i INT);
INSERT INTO t1 VALUES (1), (2), (3), (4), (5), (6), (7), (8), (9), (10);
CREATE TABLE t2(i INT);
INSERT INTO t2 VALUES (1), (2), (3), (4), (5), (6), (7), (8), (9), (10);
CREATE TABLE t3(i INT);
INSERT INTO t3 VALUES (1), (2), (3), (4), (5), (6), (7), (8), (9), (10);
SELECT * FROM t1 WHERE t1.i IN (SELECT t2.i
FROM t2 JOIN t3
WHERE t2.i + t3.i = 5);
i
4
3
2
1
explain SELECT * FROM t1 WHERE t1.i IN (SELECT t2.i
FROM t2 JOIN t3
WHERE t2.i + t3.i = 5);
id	select_type	table	type	possible_keys	key	key_len	ref	rows	Extra
1	PRIMARY	t1	ALL	NULL	NULL	NULL	NULL	10	Start temporary
1	PRIMARY	t2	ALL	NULL	NULL	NULL	NULL	10	Using where; Using join buffer (BNL, incremental buffers)
1	PRIMARY	t3	ALL	NULL	NULL	NULL	NULL	10	Using where; End temporary; Using join buffer (BNL, incremental buffers)
DROP TABLE t1,t2,t3;
# End of the test for bug#50019.
#
# Bug#52068: Optimizer generates invalid semijoin materialization plan
#
CREATE TABLE ot1(a INTEGER);
INSERT INTO ot1 VALUES(5), (8);
CREATE TABLE it2(a INTEGER);
INSERT INTO it2 VALUES(9), (5), (1), (8);
CREATE TABLE it3(a INTEGER);
INSERT INTO it3 VALUES(7), (1), (0), (5), (1), (4);
CREATE TABLE ot4(a INTEGER);
INSERT INTO ot4 VALUES(1), (3), (5), (7), (9), (7), (3), (1);
SELECT * FROM ot1,ot4
WHERE (ot1.a,ot4.a) IN (SELECT it2.a,it3.a
FROM it2,it3);
a	a
5	1
8	1
5	5
8	5
5	7
8	7
5	7
8	7
5	1
8	1
explain SELECT * FROM ot1,ot4
WHERE (ot1.a,ot4.a) IN (SELECT it2.a,it3.a
FROM it2,it3);
id	select_type	table	type	possible_keys	key	key_len	ref	rows	Extra
1	PRIMARY	ot1	ALL	NULL	NULL	NULL	NULL	2	Start temporary
1	PRIMARY	it2	ALL	NULL	NULL	NULL	NULL	4	Using where; Using join buffer (BNL, incremental buffers)
1	PRIMARY	it3	ALL	NULL	NULL	NULL	NULL	6	Using join buffer (BNL, incremental buffers)
1	PRIMARY	ot4	ALL	NULL	NULL	NULL	NULL	8	Using where; End temporary; Using join buffer (BNL, incremental buffers)
DROP TABLE IF EXISTS ot1, ot4, it2, it3;
# End of the test for bug#52068.
#
# Bug#57623: subquery within before insert trigger causes crash (sj=on)
#
CREATE TABLE ot1(a INT);
CREATE TABLE ot2(a INT);
CREATE TABLE ot3(a INT);
CREATE TABLE it1(a INT);
INSERT INTO ot1 VALUES(0),(1),(2),(3),(4),(5),(6),(7);
INSERT INTO ot2 VALUES(0),(2),(4),(6);
INSERT INTO ot3 VALUES(0),(3),(6);
INSERT INTO it1 VALUES(0),(1),(2),(3),(4),(5),(6),(7);
explain SELECT *
FROM   ot1
LEFT JOIN
(ot2 JOIN ot3 on ot2.a=ot3.a)
ON ot1.a=ot2.a AND ot1.a IN (SELECT a from it1);
id	select_type	table	type	possible_keys	key	key_len	ref	rows	Extra
1	PRIMARY	ot1	ALL	NULL	NULL	NULL	NULL	8	
1	PRIMARY	ot3	ALL	NULL	NULL	NULL	NULL	3	Using where; Using join buffer (BNL, incremental buffers)
1	PRIMARY	ot2	ALL	NULL	NULL	NULL	NULL	4	Using where; Using join buffer (BNL, incremental buffers)
2	DEPENDENT SUBQUERY	it1	ALL	NULL	NULL	NULL	NULL	8	Using where
SELECT *
FROM   ot1
LEFT JOIN
(ot2 JOIN ot3 on ot2.a=ot3.a)
ON ot1.a=ot2.a AND ot1.a IN (SELECT a from it1);
a	a	a
0	0	0
6	6	6
1	NULL	NULL
2	NULL	NULL
3	NULL	NULL
4	NULL	NULL
5	NULL	NULL
7	NULL	NULL
prepare s from 'SELECT *
FROM   ot1
LEFT JOIN
(ot2 JOIN ot3 on ot2.a=ot3.a)
ON ot1.a=ot2.a AND ot1.a IN (SELECT a from it1)';
execute s;
a	a	a
0	0	0
6	6	6
1	NULL	NULL
2	NULL	NULL
3	NULL	NULL
4	NULL	NULL
5	NULL	NULL
7	NULL	NULL
execute s;
a	a	a
0	0	0
6	6	6
1	NULL	NULL
2	NULL	NULL
3	NULL	NULL
4	NULL	NULL
5	NULL	NULL
7	NULL	NULL
deallocate prepare s;
DROP TABLE ot1, ot2, ot3, it1;
# End of the test for bug#57623.
set optimizer_switch=default;
set optimizer_join_cache_level=default;
