drop table if exists t1, t2, t3;
create table t1 (a datetime(7));
ERROR 42000: Too big precision 7 specified for column 'a'. Maximum is 6.
create table t1 (a datetime(3), key(a));
insert t1 values ('2010-12-11 00:20:03.1234');
insert t1 values ('2010-12-11 15:47:11.1234');
insert t1 values (20101211010203.45678);
insert t1 values (20101211030405.789e0);
insert t1 values (99991231235959e1);
Warnings:
Warning	1265	Data truncated for column 'a' at row 1
select * from t1;
a
0000-00-00 00:00:00.000
2010-12-11 00:20:03.123
2010-12-11 01:02:03.456
2010-12-11 03:04:05.789
2010-12-11 15:47:11.123
select truncate(a, 6) from t1;
truncate(a, 6)
0.000000
20101211002003.121094
20101211010203.457031
20101211030405.789062
20101211154711.121094
select a DIV 1 from t1;
a DIV 1
0
20101211002003
20101211010203
20101211030405
20101211154711
select group_concat(distinct a) from t1;
group_concat(distinct a)
0000-00-00 00:00:00.000,2010-12-11 00:20:03.123,2010-12-11 01:02:03.456,2010-12-11 03:04:05.789,2010-12-11 15:47:11.123
alter table t1 engine=innodb;
select * from t1;
a
0000-00-00 00:00:00.000
2010-12-11 00:20:03.123
2010-12-11 01:02:03.456
2010-12-11 03:04:05.789
2010-12-11 15:47:11.123
drop table t1;
create table t1 (a datetime(4)) engine=innodb;
insert t1 values ('2010-12-11 01:02:03.456789');
select * from t1;
a
2010-12-11 01:02:03.4567
select extract(microsecond from a + interval 100 microsecond) from t1 where a>'2010-11-12 01:02:03.456';
extract(microsecond from a + interval 100 microsecond)
456800
select a from t1 where a>'2010-11-12 01:02:03.456' group by a;
a
2010-12-11 01:02:03.4567
show create table t1;
Table	Create Table
t1	CREATE TABLE `t1` (
  `a` datetime(4) DEFAULT NULL
) ENGINE=InnoDB DEFAULT CHARSET=latin1
show columns from t1;
Field	Type	Null	Key	Default	Extra
a	datetime(4)	YES		NULL	
select table_name, column_name, column_default, is_nullable, data_type, character_maximum_length, character_octet_length, numeric_precision, numeric_scale, datetime_precision, character_set_name, collation_name, column_type, column_key, extra from information_schema.columns where table_name='t1';
table_name	t1
column_name	a
column_default	NULL
is_nullable	YES
data_type	datetime
character_maximum_length	NULL
character_octet_length	NULL
numeric_precision	NULL
numeric_scale	NULL
datetime_precision	4
character_set_name	NULL
collation_name	NULL
column_type	datetime(4)
column_key	
extra	
select a, a+interval 9876543 microsecond from t1;
a	a+interval 9876543 microsecond
2010-12-11 01:02:03.4567	2010-12-11 01:02:13.333243
update t1 set a=a+interval 9876543 microsecond;
select * from t1;
a
2010-12-11 01:02:13.3332
insert t1 select a + interval 2 year from t1;
select * from t1;
a
2010-12-11 01:02:13.3332
2012-12-11 01:02:13.3332
delete from t1 where a < 20110101;
select * from t1;
a
2012-12-11 01:02:13.3332
create table t2 select * from t1;
create table t3 like t1;
show create table t2;
Table	Create Table
t2	CREATE TABLE `t2` (
  `a` datetime(4) DEFAULT NULL
) ENGINE=MyISAM DEFAULT CHARSET=latin1
show create table t3;
Table	Create Table
t3	CREATE TABLE `t3` (
  `a` datetime(4) DEFAULT NULL
) ENGINE=InnoDB DEFAULT CHARSET=latin1
drop table t1, t2, t3;
create table t1 (a datetime(6), b datetime(6));
create procedure foo(x datetime, y datetime(4)) insert into t1 values (x, y);
call foo('2010-02-03 4:5:6.789123', '2010-02-03 4:5:6.789123');
select * from t1;
a	b
2010-02-03 04:05:06.000000	2010-02-03 04:05:06.789100
create procedure bar(a int, c datetime(5))
begin
declare b datetime(4);
set b = c + interval a microsecond;
insert t1 values (b, c + interval a microsecond);
end|
call bar(1111111, '2011-01-02 3:4:5.123456');
select * from t1;
a	b
2010-02-03 04:05:06.000000	2010-02-03 04:05:06.789100
2011-01-02 03:04:06.234500	2011-01-02 03:04:06.234561
drop procedure foo;
drop procedure bar;
create function xyz(s char(20)) returns datetime(4)
return addtime('2010-10-10 10:10:10.101010', s);
select xyz('1:1:1.010101');
xyz('1:1:1.010101')
2010-10-10 11:11:11.1111
drop function xyz;
create view v1 as select * from t1 group by a,b;
select * from v1;
a	b
2010-02-03 04:05:06.000000	2010-02-03 04:05:06.789100
2011-01-02 03:04:06.234500	2011-01-02 03:04:06.234561
show columns from v1;
Field	Type	Null	Key	Default	Extra
a	datetime(6)	YES		NULL	
b	datetime(6)	YES		NULL	
create table t2 select * from v1;
show create table t2;
Table	Create Table
t2	CREATE TABLE `t2` (
  `a` datetime(6) DEFAULT NULL,
  `b` datetime(6) DEFAULT NULL
) ENGINE=MyISAM DEFAULT CHARSET=latin1
drop view v1;
drop table t1, t2;
CREATE TABLE t1 (
taken datetime(5) NOT NULL DEFAULT '0000-00-00 00:00:00',
id int(11) NOT NULL DEFAULT '0',
PRIMARY KEY (id,taken),
KEY taken (taken)
)
PARTITION BY RANGE (to_days(taken))
(
PARTITION p01 VALUES LESS THAN (732920),
PARTITION p02 VALUES LESS THAN (732950),
PARTITION p03 VALUES LESS THAN MAXVALUE);
INSERT INTO t1 VALUES
('2006-09-27 21:50:01.123456',0),
('2006-09-27 21:50:01.123456',1),
('2006-09-27 21:50:01.123456',2),
('2006-09-28 21:50:01.123456',3),
('2006-09-29 21:50:01.123456',4),
('2006-09-29 21:50:01.123456',5),
('2006-09-30 21:50:01.123456',6),
('2006-10-01 21:50:01.123456',7),
('2006-10-02 21:50:01.123456',8),
('2006-10-02 21:50:01.123456',9);
SELECT id,to_days(taken) FROM t1 order by 2;
id	to_days(taken)
0	732946
1	732946
2	732946
3	732947
5	732948
4	732948
6	732949
7	732950
8	732951
9	732951
CREATE TABLE t2 (
taken datetime(5) NOT NULL DEFAULT '0000-00-00 00:00:00',
id int(11) NOT NULL DEFAULT '0',
PRIMARY KEY (id,taken),
KEY taken (taken)
)
PARTITION BY RANGE (extract(microsecond from taken))
(
PARTITION p01 VALUES LESS THAN (123000),
PARTITION p02 VALUES LESS THAN (500000),
PARTITION p03 VALUES LESS THAN MAXVALUE);
INSERT INTO t2 VALUES
('2006-09-27 21:50:01',0),
('2006-09-27 21:50:01.1',1),
('2006-09-27 21:50:01.12',2),
('2006-09-28 21:50:01.123',3),
('2006-09-29 21:50:01.1234',4),
('2006-09-29 21:50:01.12345',5),
('2006-09-30 21:50:01.123456',6),
('2006-10-01 21:50:01.56',7),
('2006-10-02 21:50:01.567',8),
('2006-10-02 21:50:01.5678',9);
select table_name,partition_name,partition_method,partition_expression,partition_description,table_rows from information_schema.partitions where table_name in ('t1', 't2');
table_name	partition_name	partition_method	partition_expression	partition_description	table_rows
t1	p01	RANGE	to_days(taken)	732920	0
t1	p02	RANGE	to_days(taken)	732950	7
t1	p03	RANGE	to_days(taken)	MAXVALUE	3
t2	p01	RANGE	extract(microsecond from taken)	123000	3
t2	p02	RANGE	extract(microsecond from taken)	500000	4
t2	p03	RANGE	extract(microsecond from taken)	MAXVALUE	3
drop table t1, t2;
