drop table if exists t1, t2, t3;
create table t1 (a timestamp(7));
ERROR 42000: Too big precision 7 specified for column 'a'. Maximum is 6.
create table t1 (a timestamp(3));
insert t1 values ('2010-12-11 01:02:03.4567');
insert t1 values (20101211010203.45678);
insert t1 values (20101211030405.789e0);
insert t1 values (99991231235959e1);
Warnings:
Warning	1265	Data truncated for column 'a' at row 1
select * from t1;
a
2010-12-11 01:02:03.456
2010-12-11 01:02:03.456
2010-12-11 03:04:05.789
0000-00-00 00:00:00.000
select truncate(a, 6) from t1;
truncate(a, 6)
20101211010203.457031
20101211010203.457031
20101211030405.789062
0.000000
select a DIV 1 from t1;
a DIV 1
20101211010203
20101211010203
20101211030405
0
select group_concat(distinct a) from t1;
group_concat(distinct a)
2010-12-11 01:02:03.456,2010-12-11 03:04:05.789,0000-00-00 00:00:00.000
alter table t1 engine=innodb;
select * from t1;
a
2010-12-11 01:02:03.456
2010-12-11 01:02:03.456
2010-12-11 03:04:05.789
0000-00-00 00:00:00.000
drop table t1;
create table t1 (a timestamp(4)) engine=innodb;
insert t1 values ('2010-12-11 01:02:03.456789');
select * from t1;
a
2010-12-11 01:02:03.4567
select extract(microsecond from a + interval 100 microsecond) from t1 where a>'2010-11-12 01:02:03.456';
extract(microsecond from a + interval 100 microsecond)
456800
select a from t1 where a>'2010-11-12 01:02:03.456' group by a;
a
2010-12-11 01:02:03.4567
show create table t1;
Table	Create Table
t1	CREATE TABLE `t1` (
  `a` timestamp(4) NOT NULL DEFAULT CURRENT_TIMESTAMP ON UPDATE CURRENT_TIMESTAMP
) ENGINE=InnoDB DEFAULT CHARSET=latin1
show columns from t1;
Field	Type	Null	Key	Default	Extra
a	timestamp(4)	NO		CURRENT_TIMESTAMP	on update CURRENT_TIMESTAMP
select table_name, column_name, column_default, is_nullable, data_type, character_maximum_length, character_octet_length, numeric_precision, numeric_scale, datetime_precision, character_set_name, collation_name, column_type, column_key, extra from information_schema.columns where table_name='t1';
table_name	t1
column_name	a
column_default	CURRENT_TIMESTAMP
is_nullable	NO
data_type	timestamp
character_maximum_length	NULL
character_octet_length	NULL
numeric_precision	NULL
numeric_scale	NULL
datetime_precision	4
character_set_name	NULL
collation_name	NULL
column_type	timestamp(4)
column_key	
extra	on update CURRENT_TIMESTAMP
select a, a+interval 9876543 microsecond from t1;
a	a+interval 9876543 microsecond
2010-12-11 01:02:03.4567	2010-12-11 01:02:13.333243
update t1 set a=a+interval 9876543 microsecond;
select * from t1;
a
2010-12-11 01:02:13.3332
insert t1 select a + interval 2 year from t1;
select * from t1;
a
2010-12-11 01:02:13.3332
2012-12-11 01:02:13.3332
delete from t1 where a < 20110101;
select * from t1;
a
2012-12-11 01:02:13.3332
create table t2 select * from t1;
create table t3 like t1;
show create table t2;
Table	Create Table
t2	CREATE TABLE `t2` (
  `a` timestamp(4) NOT NULL DEFAULT '0000-00-00 00:00:00.0000'
) ENGINE=MyISAM DEFAULT CHARSET=latin1
show create table t3;
Table	Create Table
t3	CREATE TABLE `t3` (
  `a` timestamp(4) NOT NULL DEFAULT CURRENT_TIMESTAMP ON UPDATE CURRENT_TIMESTAMP
) ENGINE=InnoDB DEFAULT CHARSET=latin1
drop table t1, t2, t3;
create table t1 (a timestamp(6), b timestamp(6));
create procedure foo(x timestamp, y timestamp(4)) insert into t1 values (x, y);
call foo('2010-02-03 4:5:6.789123', '2010-02-03 4:5:6.789123');
select * from t1;
a	b
2010-02-03 04:05:06.000000	2010-02-03 04:05:06.789100
create procedure bar(a int, c timestamp(5))
begin
declare b timestamp(4);
set b = c + interval a microsecond;
insert t1 values (b, c + interval a microsecond);
end|
call bar(1111111, '2011-01-02 3:4:5.123456');
select * from t1;
a	b
2010-02-03 04:05:06.000000	2010-02-03 04:05:06.789100
2011-01-02 03:04:06.234500	2011-01-02 03:04:06.234561
drop procedure foo;
drop procedure bar;
create function xyz(s char(20)) returns timestamp(4)
return addtime('2010-10-10 10:10:10.101010', s);
select xyz('1:1:1.010101');
xyz('1:1:1.010101')
2010-10-10 11:11:11.1111
drop function xyz;
create view v1 as select * from t1 group by a,b;
select * from v1;
a	b
2010-02-03 04:05:06.000000	2010-02-03 04:05:06.789100
2011-01-02 03:04:06.234500	2011-01-02 03:04:06.234561
show columns from v1;
Field	Type	Null	Key	Default	Extra
a	timestamp(6)	NO		0000-00-00 00:00:00.000000	
b	timestamp(6)	NO		0000-00-00 00:00:00.000000	
create table t2 select * from v1;
show create table t2;
Table	Create Table
t2	CREATE TABLE `t2` (
  `a` timestamp(6) NOT NULL DEFAULT '0000-00-00 00:00:00.000000',
  `b` timestamp(6) NOT NULL DEFAULT '0000-00-00 00:00:00.000000'
) ENGINE=MyISAM DEFAULT CHARSET=latin1
drop view v1;
drop table t1, t2;
set timestamp=unix_timestamp('2011-01-01 01:01:01') + 0.123456, time_zone='+03:00';
create table t1 (a timestamp(5));
insert t1 values ();
select * from t1;
a
2011-01-01 01:01:01.12345
drop table t1;
