create table t1(a int) engine=innodb;
create table t2(a int) engine=innodb;
insert into t1 values(10),(11),(12),(13),(14),(15),(16);
insert into t2 values(100),(11),(120);
analyze table t1,t2;
Table	Op	Msg_type	Msg_text
test.t1	analyze	status	OK
test.t2	analyze	status	OK
explain format=tree update t1 set t1.a=3 where a=(select a from t2);
EXPLAIN
-> <not executable by iterator executor>

explain update t1 set t1.a=3 where a=(select a from t2);
id	select_type	table	partitions	type	possible_keys	key	key_len	ref	rows	filtered	Extra
1	UPDATE	t1	NULL	ALL	NULL	NULL	NULL	NULL	7	100.00	Using where
2	SUBQUERY	t2	NULL	ALL	NULL	NULL	NULL	NULL	3	100.00	NULL
Warnings:
Note	1003	update `test`.`t1` set `test`.`t1`.`a` = 3 where (`test`.`t1`.`a` = (/* select#2 */ select `test`.`t2`.`a` from `test`.`t2`))
explain format=tree delete from t1 where a=(select a from t2);
EXPLAIN
-> <not executable by iterator executor>

explain delete from t1 where a=(select a from t2);
id	select_type	table	partitions	type	possible_keys	key	key_len	ref	rows	filtered	Extra
1	DELETE	t1	NULL	ALL	NULL	NULL	NULL	NULL	7	100.00	Using where
2	SUBQUERY	t2	NULL	ALL	NULL	NULL	NULL	NULL	3	100.00	NULL
Warnings:
Note	1003	delete from `test`.`t1` where (`test`.`t1`.`a` = (/* select#2 */ select `test`.`t2`.`a` from `test`.`t2`))
# This line exists only to help --skip_if_hypergraph diffing.
explain update t1 set t1.a=3 where a in (select a from t2);
id	select_type	table	partitions	type	possible_keys	key	key_len	ref	rows	filtered	Extra
1	SIMPLE	t2	NULL	ALL	NULL	NULL	NULL	NULL	3	100.00	Start temporary
1	UPDATE	t1	NULL	ALL	NULL	NULL	NULL	NULL	7	14.29	Using where; End temporary
Warnings:
Note	1003	update `test`.`t1` set `test`.`t1`.`a` = 3 where (`test`.`t1`.`a` = `test`.`t2`.`a`)
update t1 set t1.a=3 where a in (select a from t2);
select * from t1;
a
10
3
12
13
14
15
16
delete from t1;
insert into t1 values(10),(11),(12),(13),(14),(15),(16);
analyze table t1;
Table	Op	Msg_type	Msg_text
test.t1	analyze	status	OK
explain delete from t1 where a in (select a from t2);
id	select_type	table	partitions	type	possible_keys	key	key_len	ref	rows	filtered	Extra
1	SIMPLE	t2	NULL	ALL	NULL	NULL	NULL	NULL	3	100.00	Start temporary
1	DELETE	t1	NULL	ALL	NULL	NULL	NULL	NULL	7	14.29	Using where; End temporary
Warnings:
Note	1003	delete from `test`.`t1` where (`test`.`t1`.`a` = `test`.`t2`.`a`)
delete from t1 where a in (select a from t2);
select * from t1;
a
10
12
13
14
15
16
delete from t1;
insert into t1 values(10),(11),(12),(13),(14),(15),(16);
analyze table t1;
Table	Op	Msg_type	Msg_text
test.t1	analyze	status	OK
explain update t1 set t1.a=3 where a in (select /*+ no_semijoin() */ a from t2);
id	select_type	table	partitions	type	possible_keys	key	key_len	ref	rows	filtered	Extra
1	UPDATE	t1	NULL	ALL	NULL	NULL	NULL	NULL	7	100.00	Using where
2	SUBQUERY	t2	NULL	ALL	NULL	NULL	NULL	NULL	3	100.00	NULL
Warnings:
Note	1003	update /*+ NO_SEMIJOIN(@`select#2`) */ `test`.`t1` set `test`.`t1`.`a` = 3 where <in_optimizer>(`test`.`t1`.`a`,`test`.`t1`.`a` in ( <materialize> (/* select#2 */ select `test`.`t2`.`a` from `test`.`t2` where true ), <primary_index_lookup>(`test`.`t1`.`a` in <temporary table> on <auto_distinct_key> where ((`test`.`t1`.`a` = `<materialized_subquery>`.`a`)))))
explain delete from t1 where a in (select /*+ no_semijoin() */ a from t2);
id	select_type	table	partitions	type	possible_keys	key	key_len	ref	rows	filtered	Extra
1	DELETE	t1	NULL	ALL	NULL	NULL	NULL	NULL	7	100.00	Using where
2	SUBQUERY	t2	NULL	ALL	NULL	NULL	NULL	NULL	3	100.00	NULL
Warnings:
Note	1003	delete /*+ NO_SEMIJOIN(@`select#2`) */ from `test`.`t1` where <in_optimizer>(`test`.`t1`.`a`,`test`.`t1`.`a` in ( <materialize> (/* select#2 */ select `test`.`t2`.`a` from `test`.`t2` where true ), <primary_index_lookup>(`test`.`t1`.`a` in <temporary table> on <auto_distinct_key> where ((`test`.`t1`.`a` = `<materialized_subquery>`.`a`)))))
delete from t1;
insert into t1 values(10),(11),(12);
analyze table t1;
Table	Op	Msg_type	Msg_text
test.t1	analyze	status	OK
explain update t1 set t1.a=3 where a in (select /*+ no_semijoin() */ a from t2);
id	select_type	table	partitions	type	possible_keys	key	key_len	ref	rows	filtered	Extra
1	UPDATE	t1	NULL	ALL	NULL	NULL	NULL	NULL	3	100.00	Using where
2	DEPENDENT SUBQUERY	t2	NULL	ALL	NULL	NULL	NULL	NULL	3	33.33	Using where
Warnings:
Note	1003	update /*+ NO_SEMIJOIN(@`select#2`) */ `test`.`t1` set `test`.`t1`.`a` = 3 where <in_optimizer>(`test`.`t1`.`a`,<exists>(/* select#2 */ select `test`.`t2`.`a` from `test`.`t2` where (<cache>(`test`.`t1`.`a`) = `test`.`t2`.`a`)))
explain delete from t1 where a in (select /*+ no_semijoin() */ a from t2);
id	select_type	table	partitions	type	possible_keys	key	key_len	ref	rows	filtered	Extra
1	DELETE	t1	NULL	ALL	NULL	NULL	NULL	NULL	3	100.00	Using where
2	DEPENDENT SUBQUERY	t2	NULL	ALL	NULL	NULL	NULL	NULL	3	33.33	Using where
Warnings:
Note	1003	delete /*+ NO_SEMIJOIN(@`select#2`) */ from `test`.`t1` where <in_optimizer>(`test`.`t1`.`a`,<exists>(/* select#2 */ select `test`.`t2`.`a` from `test`.`t2` where (<cache>(`test`.`t1`.`a`) = `test`.`t2`.`a`)))
delete from t1;
insert into t1 values(10),(11),(12),(13),(14),(15),(16);
analyze table t1;
Table	Op	Msg_type	Msg_text
test.t1	analyze	status	OK
explain format=tree update t1 set t1.a=3 where a in (select /*+ subquery(intoexists) */ a from t2);
EXPLAIN
-> <not executable by iterator executor>

explain update t1 set t1.a=3 where a in (select /*+ subquery(intoexists) */ a from t2);
id	select_type	table	partitions	type	possible_keys	key	key_len	ref	rows	filtered	Extra
1	UPDATE	t1	NULL	ALL	NULL	NULL	NULL	NULL	7	100.00	Using where
2	DEPENDENT SUBQUERY	t2	NULL	ALL	NULL	NULL	NULL	NULL	3	33.33	Using where
Warnings:
Note	1003	update /*+ SUBQUERY(@`select#2` INTOEXISTS) */ `test`.`t1` set `test`.`t1`.`a` = 3 where <in_optimizer>(`test`.`t1`.`a`,<exists>(/* select#2 */ select `test`.`t2`.`a` from `test`.`t2` where (<cache>(`test`.`t1`.`a`) = `test`.`t2`.`a`)))
explain format=tree delete from t1 where a in (select /*+ subquery(intoexists) */ a from t2);
EXPLAIN
-> <not executable by iterator executor>

explain delete from t1 where a in (select /*+ subquery(intoexists) */ a from t2);
id	select_type	table	partitions	type	possible_keys	key	key_len	ref	rows	filtered	Extra
1	DELETE	t1	NULL	ALL	NULL	NULL	NULL	NULL	7	100.00	Using where
2	DEPENDENT SUBQUERY	t2	NULL	ALL	NULL	NULL	NULL	NULL	3	33.33	Using where
Warnings:
Note	1003	delete /*+ SUBQUERY(@`select#2` INTOEXISTS) */ from `test`.`t1` where <in_optimizer>(`test`.`t1`.`a`,<exists>(/* select#2 */ select `test`.`t2`.`a` from `test`.`t2` where (<cache>(`test`.`t1`.`a`) = `test`.`t2`.`a`)))
set optimizer_switch='semijoin=off,materialization=off';
explain format=tree update t1 set t1.a=3 where a in (select a from t2);
EXPLAIN
-> <not executable by iterator executor>

explain format=tree delete from t1 where a in (select a from t2);
EXPLAIN
-> <not executable by iterator executor>

set optimizer_switch=default;
alter table t1 engine=myisam;
alter table t2 engine=myisam;
analyze table t1,t2;
Table	Op	Msg_type	Msg_text
test.t1	analyze	status	OK
test.t2	analyze	status	OK
explain update t1 set t1.a=3 where a in (select a from t2);
id	select_type	table	partitions	type	possible_keys	key	key_len	ref	rows	filtered	Extra
1	SIMPLE	t2	NULL	ALL	NULL	NULL	NULL	NULL	3	100.00	Start temporary
1	UPDATE	t1	NULL	ALL	NULL	NULL	NULL	NULL	7	14.29	Using where; End temporary
Warnings:
Note	1003	update `test`.`t1` set `test`.`t1`.`a` = 3 where (`test`.`t1`.`a` = `test`.`t2`.`a`)
update t1 set t1.a=3 where a in (select a from t2);
select * from t1;
a
10
12
13
14
15
16
3
delete from t1;
insert into t1 values(10),(11),(12),(13),(14),(15),(16);
analyze table t1;
Table	Op	Msg_type	Msg_text
test.t1	analyze	status	OK
explain delete from t1 where a in (select a from t2);
id	select_type	table	partitions	type	possible_keys	key	key_len	ref	rows	filtered	Extra
1	SIMPLE	t2	NULL	ALL	NULL	NULL	NULL	NULL	3	100.00	Start temporary
1	DELETE	t1	NULL	ALL	NULL	NULL	NULL	NULL	7	14.29	Using where; End temporary
Warnings:
Note	1003	delete from `test`.`t1` where (`test`.`t1`.`a` = `test`.`t2`.`a`)
delete from t1 where a in (select a from t2);
select * from t1;
a
10
12
13
14
15
16
delete from t1;
insert into t1 values(10),(11),(12),(13),(14),(15),(16);
analyze table t1;
Table	Op	Msg_type	Msg_text
test.t1	analyze	status	OK
alter table t1 engine=memory;
alter table t2 engine=memory;
explain update t1 set t1.a=3 where a in (select a from t2);
id	select_type	table	partitions	type	possible_keys	key	key_len	ref	rows	filtered	Extra
1	SIMPLE	t2	NULL	ALL	NULL	NULL	NULL	NULL	3	100.00	Start temporary
1	UPDATE	t1	NULL	ALL	NULL	NULL	NULL	NULL	7	14.29	Using where; End temporary
Warnings:
Note	1003	update `test`.`t1` set `test`.`t1`.`a` = 3 where (`test`.`t1`.`a` = `test`.`t2`.`a`)
update t1 set t1.a=3 where a in (select a from t2);
select * from t1;
a
10
12
13
14
15
16
3
delete from t1;
insert into t1 values(10),(11),(12),(13),(14),(15),(16);
analyze table t1;
Table	Op	Msg_type	Msg_text
test.t1	analyze	note	The storage engine for the table doesn't support analyze
explain delete from t1 where a in (select a from t2);
id	select_type	table	partitions	type	possible_keys	key	key_len	ref	rows	filtered	Extra
1	SIMPLE	t2	NULL	ALL	NULL	NULL	NULL	NULL	3	100.00	Start temporary
1	DELETE	t1	NULL	ALL	NULL	NULL	NULL	NULL	7	14.29	Using where; End temporary
Warnings:
Note	1003	delete from `test`.`t1` where (`test`.`t1`.`a` = `test`.`t2`.`a`)
delete from t1 where a in (select a from t2);
select * from t1;
a
10
12
13
14
15
16
delete from t1;
insert into t1 values(10),(11),(12),(13),(14),(15),(16);
alter table t1 engine=innodb;
analyze table t1;
Table	Op	Msg_type	Msg_text
test.t1	analyze	status	OK
set transaction isolation level repeatable read;
explain update t1 set t1.a=3 where a in (select a from t2);
id	select_type	table	partitions	type	possible_keys	key	key_len	ref	rows	filtered	Extra
1	UPDATE	t1	NULL	ALL	NULL	NULL	NULL	NULL	7	100.00	NULL
1	SIMPLE	t2	NULL	ALL	NULL	NULL	NULL	NULL	3	33.33	Using where; FirstMatch(t1)
Warnings:
Note	1003	update `test`.`t1` set `test`.`t1`.`a` = 3 where (`test`.`t2`.`a` = `test`.`t1`.`a`)
set transaction isolation level read committed;
explain update t1 set t1.a=3 where a in (select a from t2);
id	select_type	table	partitions	type	possible_keys	key	key_len	ref	rows	filtered	Extra
1	UPDATE	t1	NULL	ALL	NULL	NULL	NULL	NULL	7	100.00	NULL
1	SIMPLE	t2	NULL	ALL	NULL	NULL	NULL	NULL	3	33.33	Using where; FirstMatch(t1)
Warnings:
Note	1003	update `test`.`t1` set `test`.`t1`.`a` = 3 where (`test`.`t2`.`a` = `test`.`t1`.`a`)
alter table t1 engine=myisam;
explain update t1 set t1.a=3 where a in (select a from t2);
id	select_type	table	partitions	type	possible_keys	key	key_len	ref	rows	filtered	Extra
1	UPDATE	t1	NULL	ALL	NULL	NULL	NULL	NULL	7	100.00	NULL
1	SIMPLE	t2	NULL	ALL	NULL	NULL	NULL	NULL	3	33.33	Using where; FirstMatch(t1)
Warnings:
Note	1003	update `test`.`t1` set `test`.`t1`.`a` = 3 where (`test`.`t2`.`a` = `test`.`t1`.`a`)
drop table t1,t2;
