create table t1(c1 bigint not null, c2 varchar(32) default 'abc') engine = warp;
insert into t1 values (NULL,NULL);
ERROR 23000: Column 'c1' cannot be null
insert into t1 values (1, NULL);
insert into t1 values (2, DEFAULT);
insert into t1 values (3,'def');
select * from t1 order by c1;
c1	c2
1	NULL
2	abc
3	def
select * from t1 order by c1 desc;
c1	c2
3	def
2	abc
1	NULL
select count(*) from t1;
count(*)
3
select * from t1 where c1 is null order by c1;
c1	c2
select * from t1 where c1 = 1;
c1	c2
1	NULL
select * from t1 where c2 = 'abc' order by c1;
c1	c2
2	abc
select * from t1 where c2 != 'abc' order by c1;
c1	c2
3	def
select * from t1 where c2 is not null order by c1;
c1	c2
2	abc
3	def
select count(*) from t1 where c1 > 1 or c2 is null;
count(*)
3
delete from t1 where c1 = 1;
select count(*) from t1 where c1 > 1 or c2 is null;
count(*)
2
select count(c2) from t1;
count(c2)
2
