use test;
CREATE table tab1(c1 int);
# create bootstrap file
# Stop the MTR default DB server
# Run the bootstrap command of datadir1
SELECT @@datadir;
@@datadir
MYSQLD_DATADIR1/
SHOW VARIABLES LIKE 'keyring_file%';
Variable_name	Value
keyring_file_data	key_file/my_keyfile
SELECT @@innodb_undo_log_encrypt;
@@innodb_undo_log_encrypt
1
CREATE UNDO TABLESPACE undo_003 ADD DATAFILE 'undo_003.ibu';
CREATE DATABASE nath;
use nath;
CREATE TABLE tab2(c1 int , c2 varchar(10)) Engine=InnoDB ENCRYPTION='Y';
INSERT INTO tab2 VALUES(2, 'VISH');
CREATE INDEX ix2 ON tab2(c2) ;
Server crashes here 
CREATE UNDO TABLESPACE undo_004 ADD DATAFILE 'undo_004.ibu';
ALTER UNDO TABLESPACE undo_003 SET INACTIVE;
ALTER UNDO TABLESPACE undo_004 SET INACTIVE;
DELETE FROM tab2;
DROP UNDO TABLESPACE undo_003;
DROP UNDO TABLESPACE undo_004;
DROP TABLE tab2;
DROP DATABASE nath;
# Stop the encrypt server 
# restart: --datadir=OLD_DATADIR
SELECT @@datadir;
@@datadir
MYSQLD_OLD_DATADIR
use test;
DROP TABLE tab1;
