#
# undo tablespace counter
#
SHOW VARIABLES LIKE 'innodb_rollback_segments';
Variable_name	Value
innodb_rollback_segments	1
SELECT NAME, SPACE_TYPE, STATE FROM INFORMATION_SCHEMA.INNODB_TABLESPACES
WHERE SPACE_TYPE = 'Undo' ORDER BY NAME;
NAME	SPACE_TYPE	STATE
innodb_undo_001	Undo	active
innodb_undo_002	Undo	active
SET GLOBAL innodb_purge_stop_now=ON;
create table t1(
keyc int,
c1 char(255),
c2 char(255),
c3 char(255),
c4 char(255),
c5 char(255),
c6 char(255),
primary key(keyc)) engine = innodb;
CREATE PROCEDURE populate_t1()
BEGIN
DECLARE i INT DEFAULT 1;
while (i <= 20000) DO
insert into t1 values (i, 'a', 'b', 'c', 'd', 'e', 'f' );
SET i = i + 1;
END WHILE;
END |
call populate_t1();
delete from t1 where keyc < 10000;
update t1 set c1 = 'mysql' where  keyc > 10000;
update t1 set c2 = 'mysql' where  keyc > 10000;
update t1 set c3= 'mysql' where keyc > 10000;
update t1 set c4= 'mysql' where keyc > 10000;
update t1 set c5= 'mysql' where keyc > 10000;
update t1 set c6= 'mysql' where keyc > 10000;
SELECT @@innodb_undo_spaces_snapshot_tickets;
@@innodb_undo_spaces_snapshot_tickets
100
SET GLOBAL debug="+d,until_undo_spaces_snapshot_change,abort_if_use_undospace_latch";
SET GLOBAL innodb_purge_run_now=ON;
SET GLOBAL debug="-d,until_undo_spaces_snapshot_change";
update t1 set c6= 'modified' where keyc = 10000;
SET GLOBAL debug="-d,abort_if_use_undospace_latch";
drop PROCEDURE populate_t1;
drop table t1;