SET @wkt_pt = 'POINT(0 0)';
SET @wkt_ln = 'LINESTRING(0 0,2 2,4 4,6 6,8 8, 10 10)';
SET @wkt_py = 'POLYGON((0 0,0 10,10 10,10 0,0 0),(4 4,4 6,6 6,6 4,4 4))';
SET @wkt_mpt = 'MULTIPOINT(0 0,2 2,4 4,6 6)';
SET @wkt_mln = 'MULTILINESTRING((0 0,2 2,4 4),(6 6,8 8,10 10))';
SET @wkt_mpy = 'MULTIPOLYGON(((0 0,0 10,10 10,10 0,0 0),(4 4,4 6,6 6,6 4,4 4)),'
                            '((10 10,10 12,12 12,12 10,10 10)))';
SET @wkt_gc = 'GEOMETRYCOLLECTION('
                  'POINT(0 0),'
                  'LINESTRING(0 0,10 10),'
                  'POLYGON((0 0,0 10,10 10,10 0, 0 0)),'
                  'MULTIPOINT(0 0,2 2,4 4,6 6,8 8,10 10),'
                  'MULTILINESTRING((0 0,10 10),(0 10,10 0)),'
                  'MULTIPOLYGON(((0 0,0 5,5 5,5 0,0 0)),((5 5,5 10,10 10,10 5,5 5))))';
#
# Functions that accept a WKT value of any geometry type.
#
# ST_GeomFromText()
SELECT ST_AsText(ST_GeomFromText(@wkt_pt));
ST_AsText(ST_GeomFromText(@wkt_pt))
POINT(0 0)
SELECT ST_AsText(ST_GeomFromText(@wkt_ln));
ST_AsText(ST_GeomFromText(@wkt_ln))
LINESTRING(0 0,2 2,4 4,6 6,8 8,10 10)
SELECT ST_AsText(ST_GeomFromText(@wkt_py));
ST_AsText(ST_GeomFromText(@wkt_py))
POLYGON((0 0,0 10,10 10,10 0,0 0),(4 4,4 6,6 6,6 4,4 4))
SELECT ST_AsText(ST_GeomFromText(@wkt_mpt));
ST_AsText(ST_GeomFromText(@wkt_mpt))
MULTIPOINT((0 0),(2 2),(4 4),(6 6))
SELECT ST_AsText(ST_GeomFromText(@wkt_mln));
ST_AsText(ST_GeomFromText(@wkt_mln))
MULTILINESTRING((0 0,2 2,4 4),(6 6,8 8,10 10))
SELECT ST_AsText(ST_GeomFromText(@wkt_mpy));
ST_AsText(ST_GeomFromText(@wkt_mpy))
MULTIPOLYGON(((0 0,0 10,10 10,10 0,0 0),(4 4,4 6,6 6,6 4,4 4)),((10 10,10 12,12 12,12 10,10 10)))
SELECT ST_AsText(ST_GeomFromText(@wkt_gc));
ST_AsText(ST_GeomFromText(@wkt_gc))
GEOMETRYCOLLECTION(POINT(0 0),LINESTRING(0 0,10 10),POLYGON((0 0,0 10,10 10,10 0,0 0)),MULTIPOINT((0 0),(2 2),(4 4),(6 6),(8 8),(10 10)),MULTILINESTRING((0 0,10 10),(0 10,10 0)),MULTIPOLYGON(((0 0,0 5,5 5,5 0,0 0)),((5 5,5 10,10 10,10 5,5 5))))
# ST_GeometryFromText()
SELECT ST_AsText(ST_GeometryFromText(@wkt_pt));
ST_AsText(ST_GeometryFromText(@wkt_pt))
POINT(0 0)
SELECT ST_AsText(ST_GeometryFromText(@wkt_ln));
ST_AsText(ST_GeometryFromText(@wkt_ln))
LINESTRING(0 0,2 2,4 4,6 6,8 8,10 10)
SELECT ST_AsText(ST_GeometryFromText(@wkt_py));
ST_AsText(ST_GeometryFromText(@wkt_py))
POLYGON((0 0,0 10,10 10,10 0,0 0),(4 4,4 6,6 6,6 4,4 4))
SELECT ST_AsText(ST_GeometryFromText(@wkt_mpt));
ST_AsText(ST_GeometryFromText(@wkt_mpt))
MULTIPOINT((0 0),(2 2),(4 4),(6 6))
SELECT ST_AsText(ST_GeometryFromText(@wkt_mln));
ST_AsText(ST_GeometryFromText(@wkt_mln))
MULTILINESTRING((0 0,2 2,4 4),(6 6,8 8,10 10))
SELECT ST_AsText(ST_GeometryFromText(@wkt_mpy));
ST_AsText(ST_GeometryFromText(@wkt_mpy))
MULTIPOLYGON(((0 0,0 10,10 10,10 0,0 0),(4 4,4 6,6 6,6 4,4 4)),((10 10,10 12,12 12,12 10,10 10)))
SELECT ST_AsText(ST_GeometryFromText(@wkt_gc));
ST_AsText(ST_GeometryFromText(@wkt_gc))
GEOMETRYCOLLECTION(POINT(0 0),LINESTRING(0 0,10 10),POLYGON((0 0,0 10,10 10,10 0,0 0)),MULTIPOINT((0 0),(2 2),(4 4),(6 6),(8 8),(10 10)),MULTILINESTRING((0 0,10 10),(0 10,10 0)),MULTIPOLYGON(((0 0,0 5,5 5,5 0,0 0)),((5 5,5 10,10 10,10 5,5 5))))
#
# Function that accepts a WKT value of Point geometry
#
# ST_PointFromText()
SELECT ST_AsText(ST_PointFromText(@wkt_pt));
ST_AsText(ST_PointFromText(@wkt_pt))
POINT(0 0)
#
# Functions that accept a WKT value of LineString geometry
#
# ST_LineFromText()
SELECT ST_AsText(ST_LineFromText(@wkt_ln));
ST_AsText(ST_LineFromText(@wkt_ln))
LINESTRING(0 0,2 2,4 4,6 6,8 8,10 10)
# ST_LineStringFromText()
SELECT ST_AsText(ST_LineStringFromText(@wkt_ln));
ST_AsText(ST_LineStringFromText(@wkt_ln))
LINESTRING(0 0,2 2,4 4,6 6,8 8,10 10)
#
# Functions that accept a WKT value of Polygon geometry
#
# ST_PolyFromText()
SELECT ST_AsText(ST_PolyFromText(@wkt_py));
ST_AsText(ST_PolyFromText(@wkt_py))
POLYGON((0 0,0 10,10 10,10 0,0 0),(4 4,4 6,6 6,6 4,4 4))
# ST_PolygonFromText()
SELECT ST_AsText(ST_PolygonFromText(@wkt_py));
ST_AsText(ST_PolygonFromText(@wkt_py))
POLYGON((0 0,0 10,10 10,10 0,0 0),(4 4,4 6,6 6,6 4,4 4))
#
# Functions that accept a WKT value of MultiPoint geometry
#
# ST_MPointFromText()
SELECT ST_AsText(ST_MPointFromText(@wkt_mpt));
ST_AsText(ST_MPointFromText(@wkt_mpt))
MULTIPOINT((0 0),(2 2),(4 4),(6 6))
# ST_MultiPointFromText()
SELECT ST_AsText(ST_MultiPointFromText(@wkt_mpt));
ST_AsText(ST_MultiPointFromText(@wkt_mpt))
MULTIPOINT((0 0),(2 2),(4 4),(6 6))
#
# Functions that accept a WKT value of MultiLineString geometry
#
# ST_MLineFromText()
SELECT ST_AsText(ST_MLineFromText(@wkt_mln));
ST_AsText(ST_MLineFromText(@wkt_mln))
MULTILINESTRING((0 0,2 2,4 4),(6 6,8 8,10 10))
# ST_MultiLineStringFromText()
SELECT ST_AsText(ST_MultiLineStringFromText(@wkt_mln));
ST_AsText(ST_MultiLineStringFromText(@wkt_mln))
MULTILINESTRING((0 0,2 2,4 4),(6 6,8 8,10 10))
#
# Functions that accept a WKT value of MultiPolygon geometry
#
# ST_MPolyFromText()
SELECT ST_AsText(ST_MPolyFromText(@wkt_mpy));
ST_AsText(ST_MPolyFromText(@wkt_mpy))
MULTIPOLYGON(((0 0,0 10,10 10,10 0,0 0),(4 4,4 6,6 6,6 4,4 4)),((10 10,10 12,12 12,12 10,10 10)))
# ST_MultiPolygonFromText()
SELECT ST_AsText(ST_MultiPolygonFromText(@wkt_mpy));
ST_AsText(ST_MultiPolygonFromText(@wkt_mpy))
MULTIPOLYGON(((0 0,0 10,10 10,10 0,0 0),(4 4,4 6,6 6,6 4,4 4)),((10 10,10 12,12 12,12 10,10 10)))
#
# Functions that accept a WKT value of GeometryCollection geometry
#
# ST_GeomCollFromTxt()
SELECT ST_AsText(ST_GeomCollFromTxt(@wkt_gc));
ST_AsText(ST_GeomCollFromTxt(@wkt_gc))
GEOMETRYCOLLECTION(POINT(0 0),LINESTRING(0 0,10 10),POLYGON((0 0,0 10,10 10,10 0,0 0)),MULTIPOINT((0 0),(2 2),(4 4),(6 6),(8 8),(10 10)),MULTILINESTRING((0 0,10 10),(0 10,10 0)),MULTIPOLYGON(((0 0,0 5,5 5,5 0,0 0)),((5 5,5 10,10 10,10 5,5 5))))
# ST_GeomCollFromText()
SELECT ST_AsText(ST_GeomCollFromText(@wkt_gc));
ST_AsText(ST_GeomCollFromText(@wkt_gc))
GEOMETRYCOLLECTION(POINT(0 0),LINESTRING(0 0,10 10),POLYGON((0 0,0 10,10 10,10 0,0 0)),MULTIPOINT((0 0),(2 2),(4 4),(6 6),(8 8),(10 10)),MULTILINESTRING((0 0,10 10),(0 10,10 0)),MULTIPOLYGON(((0 0,0 5,5 5,5 0,0 0)),((5 5,5 10,10 10,10 5,5 5))))
# ST_GeometryCollectionFromText()
SELECT ST_AsText(ST_GeometryCollectionFromText(@wkt_gc));
ST_AsText(ST_GeometryCollectionFromText(@wkt_gc))
GEOMETRYCOLLECTION(POINT(0 0),LINESTRING(0 0,10 10),POLYGON((0 0,0 10,10 10,10 0,0 0)),MULTIPOINT((0 0),(2 2),(4 4),(6 6),(8 8),(10 10)),MULTILINESTRING((0 0,10 10),(0 10,10 0)),MULTIPOLYGON(((0 0,0 5,5 5,5 0,0 0)),((5 5,5 10,10 10,10 5,5 5))))
#
# Invalid function calls
#
SELECT ST_GeomFromText();
ERROR 42000: Incorrect parameter count in the call to native function 'ST_GeomFromText'
SELECT ST_GeomFromText(NULL);
ST_GeomFromText(NULL)
NULL
SELECT ST_GeomFromText('POINT()');
ERROR 22023: Invalid GIS data provided to function st_geomfromtext.
SELECT ST_GeomFromText('LINESTRING(0 0,! 10)');
ERROR 22023: Invalid GIS data provided to function st_geomfromtext.
SELECT ST_GeometryFromText();
ERROR 42000: Incorrect parameter count in the call to native function 'ST_GeometryFromText'
SELECT ST_GeometryFromText(NULL);
ST_GeometryFromText(NULL)
NULL
SELECT ST_GeometryFromText('POINT(! 0)');
ERROR 22023: Invalid GIS data provided to function st_geometryfromtext.
SELECT ST_GeometryFromText('POLYGON((0 0,0 10,10 10,10 0,0 0)');
ERROR 22023: Invalid GIS data provided to function st_geometryfromtext.
SELECT ST_PointFromText();
ERROR 42000: Incorrect parameter count in the call to native function 'ST_PointFromText'
SELECT ST_PointFromText(NULL);
ST_PointFromText(NULL)
NULL
SELECT ST_PointFromText('POINT()');
ERROR 22023: Invalid GIS data provided to function st_pointfromtext.
SELECT ST_LineFromText();
ERROR 42000: Incorrect parameter count in the call to native function 'ST_LineFromText'
SELECT ST_LineFromText(NULL);
ST_LineFromText(NULL)
NULL
SELECT ST_LineFromText('LINESTRING(a a,b b)');
ERROR 22023: Invalid GIS data provided to function st_linefromtext.
SELECT ST_LineStringFromText();
ERROR 42000: Incorrect parameter count in the call to native function 'ST_LineStringFromText'
SELECT ST_LineStringFromText(NULL);
ST_LineStringFromText(NULL)
NULL
SELECT ST_LineStringFromText('LINESTRING(1 1,1 b)');
ERROR 22023: Invalid GIS data provided to function st_linestringfromtext.
SELECT ST_PolyFromText();
ERROR 42000: Incorrect parameter count in the call to native function 'ST_PolyFromText'
SELECT ST_PolyFromText(NULL);
ST_PolyFromText(NULL)
NULL
SELECT ST_PolyFromText('POLYGON(())');
ERROR 22023: Invalid GIS data provided to function st_polyfromtext.
SELECT ST_PolygonFromText();
ERROR 42000: Incorrect parameter count in the call to native function 'ST_PolygonFromText'
SELECT ST_PolygonFromText(NULL);
ST_PolygonFromText(NULL)
NULL
SELECT ST_PolygonFromText('POLYGON((0 0,0 5,5 5,5 0,0 0),())');
ERROR 22023: Invalid GIS data provided to function st_polygonfromtext.
SELECT ST_MPointFromText();
ERROR 42000: Incorrect parameter count in the call to native function 'ST_MPointFromText'
SELECT ST_MPointFromText(NULL);
ST_MPointFromText(NULL)
NULL
SELECT ST_MPointFromText('MULTIPOINT(0 0,1)');
ERROR 22023: Invalid GIS data provided to function st_mpointfromtext.
SELECT ST_MultiPointFromText();
ERROR 42000: Incorrect parameter count in the call to native function 'ST_MultiPointFromText'
SELECT ST_MultiPointFromText(NULL);
ST_MultiPointFromText(NULL)
NULL
SELECT ST_MultiPointFromText('MULTIPOINT(0 0,1 1 1)');
ERROR 22023: Invalid GIS data provided to function st_multipointfromtext.
SELECT ST_MLineFromText();
ERROR 42000: Incorrect parameter count in the call to native function 'ST_MLineFromText'
SELECT ST_MLineFromText(NULL);
ST_MLineFromText(NULL)
NULL
SELECT ST_MLineFromText('MULTILINESTRING((0 0,1),())');
ERROR 22023: Invalid GIS data provided to function st_mlinefromtext.
SELECT ST_MultiLineStringFromText();
ERROR 42000: Incorrect parameter count in the call to native function 'ST_MultiLineStringFromText'
SELECT ST_MultiLineStringFromText(NULL);
ST_MultiLineStringFromText(NULL)
NULL
SELECT ST_MultiLineStringFromText('MULTILINESTRING((0 0,1),(1 1,2 2)');
ERROR 22023: Invalid GIS data provided to function st_multilinestringfromtext.
SELECT ST_MPolyFromText();
ERROR 42000: Incorrect parameter count in the call to native function 'ST_MPolyFromText'
SELECT ST_MPolyFromText(NULL);
ST_MPolyFromText(NULL)
NULL
SELECT ST_MPolyFromText('MULTIPOLYGON(((0 0,1)),(()))');
ERROR 22023: Invalid GIS data provided to function st_mpolyfromtext.
SELECT ST_MultiPolygonFromText();
ERROR 42000: Incorrect parameter count in the call to native function 'ST_MultiPolygonFromText'
SELECT ST_MultiPolygonFromText(NULL);
ST_MultiPolygonFromText(NULL)
NULL
SELECT ST_MultiPolygonFromText('MULTIPOLYGON(((0 0,0 1,1 1,1 0,0 0)),(2 2,2 3,3 3,3 2,2 2))');
ERROR 22023: Invalid GIS data provided to function st_multipolygonfromtext.
SELECT ST_GeomCollFromTxt();
ERROR 42000: Incorrect parameter count in the call to native function 'ST_GeomCollFromTxt'
SELECT ST_GeomCollFromTxt(NULL);
ST_GeomCollFromTxt(NULL)
NULL
SELECT ST_GeomCollFromTxt('GEOMETRYCOLLECTION(POINT())');
ERROR 22023: Invalid GIS data provided to function st_geomcollfromtxt.
SELECT ST_GeomCollFromText();
ERROR 42000: Incorrect parameter count in the call to native function 'ST_GeomCollFromText'
SELECT ST_GeomCollFromText(NULL);
ST_GeomCollFromText(NULL)
NULL
SELECT ST_GeomCollFromText('GEOMETRYCOLLECTION(POINT(a a))');
ERROR 22023: Invalid GIS data provided to function st_geomcollfromtext.
SELECT ST_GeometryCollectionFromText();
ERROR 42000: Incorrect parameter count in the call to native function 'ST_GeometryCollectionFromText'
SELECT ST_GeometryCollectionFromText(NULL);
ST_GeometryCollectionFromText(NULL)
NULL
SELECT ST_GeometryCollectionFromText('GEOMETRYCOLLECTION(POINT(0 0), LINESTRING(0 0,1 1)');
ERROR 22023: Invalid GIS data provided to function st_geometrycollectionfromtext.
#
# WL#8579 Spatial Reference Systems
#
CREATE PROCEDURE gis_wkt_funcs(IN srid INT)
BEGIN
SET @wkt_pt = 'POINT(0 0)';
SET @wkt_ln = 'LINESTRING(0 0,2 2,4 4,6 6,8 8, 10 10)';
SET @wkt_py = 'POLYGON((0 0,0 10,10 10,10 0,0 0),(4 4,4 6,6 6,6 4,4 4))';
SET @wkt_mpt = 'MULTIPOINT(0 0,2 2,4 4,6 6)';
SET @wkt_mln = 'MULTILINESTRING((0 0,2 2,4 4),(6 6,8 8,10 10))';
SET @wkt_mpy = 'MULTIPOLYGON(((0 0,0 10,10 10,10 0,0 0),(4 4,4 6,6 6,6 4,4 4)),'
                                                '((10 10,10 12,12 12,12 10,10 10)))';
SET @wkt_gc = 'GEOMETRYCOLLECTION('
                      'POINT(0 0),'
                      'LINESTRING(0 0,10 10),'
                      'POLYGON((0 0,0 10,10 10,10 0, 0 0)),'
                      'MULTIPOINT(0 0,2 2,4 4,6 6,8 8,10 10),'
                      'MULTILINESTRING((0 0,10 10),(0 10,10 0)),'
                      'MULTIPOLYGON(((0 0,0 5,5 5,5 0,0 0)),((5 5,5 10,10 10,10 5,5 5))))';
# GIS WKT functions
DO ST_GeomFromText(@wkt_pt, srid);
DO ST_GeometryFromText(@wkt_pt, srid);
DO ST_PointFromText(@wkt_pt, srid);
DO ST_LineFromText(@wkt_ln, srid);
DO ST_LineStringFromText(@wkt_ln, srid);
DO ST_PolyFromText(@wkt_py, srid);
DO ST_PolygonFromText(@wkt_py, srid);
DO ST_MPointFromText(@wkt_mpt, srid);
DO ST_MultiPointFromText(@wkt_mpt, srid);
DO ST_MLineFromText(@wkt_mln, srid);
DO ST_MultiLineStringFromText(@wkt_mln, srid);
DO ST_MPolyFromText(@wkt_mpy, srid);
DO ST_MultiPolygonFromText(@wkt_mpy, srid);
DO ST_GeomCollFromTxt(@wkt_gc, srid);
DO ST_GeomCollFromText(@wkt_gc, srid);
DO ST_GeometryCollectionFromText(@wkt_gc, srid);
END |
# SRID 0 (should pass)
CALL gis_wkt_funcs(0);
# Projected SRS (should pass)
CALL gis_wkt_funcs(2000);
# Geographic SRS (should pass)
CALL gis_wkt_funcs(4326);
# Undefined SRS (should pass)
CALL gis_wkt_funcs(19000000);
# Unparseable SRS definition (should pass)
INSERT INTO mysql.st_spatial_reference_systems(id, catalog_id, name,
organization, organization_coordsys_id, definition, description)
VALUES (55555555, 1, 'TEST55555555', 'Foo', 55555555, 'FOOBAR', '');
CALL gis_wkt_funcs(55555555);
# Clean up
DROP PROCEDURE gis_wkt_funcs;
DELETE FROM mysql.st_spatial_reference_systems WHERE id = 55555555;
#
# Bug #23632147 MYSQL USES INVALID WKT FOR EMPTY GEOMETRYCOLLECTION
#
SELECT ST_ASTEXT(ST_GEOMFROMTEXT('POINT EMPTY'));
ERROR 22023: Invalid GIS data provided to function st_geomfromtext.
SELECT ST_ASTEXT(ST_GEOMFROMTEXT('POINT()'));
ERROR 22023: Invalid GIS data provided to function st_geomfromtext.
SELECT ST_ASTEXT(ST_GEOMFROMTEXT(' POINT  EMPTY '));
ERROR 22023: Invalid GIS data provided to function st_geomfromtext.
SELECT ST_ASTEXT(ST_GEOMFROMTEXT('POINT EMPTY()'));
ERROR 22023: Invalid GIS data provided to function st_geomfromtext.
SELECT ST_ASTEXT(ST_GEOMFROMTEXT('POINT EMPT'));
ERROR 22023: Invalid GIS data provided to function st_geomfromtext.
SELECT ST_ASTEXT(ST_GEOMFROMTEXT('POINT EMPTYNESS'));
ERROR 22023: Invalid GIS data provided to function st_geomfromtext.
SELECT ST_ASTEXT(ST_GEOMFROMTEXT('LINESTRING EMPTY'));
ERROR 22023: Invalid GIS data provided to function st_geomfromtext.
SELECT ST_ASTEXT(ST_GEOMFROMTEXT('LINESTRING()'));
ERROR 22023: Invalid GIS data provided to function st_geomfromtext.
SELECT ST_ASTEXT(ST_GEOMFROMTEXT(' LINESTRING  EMPTY '));
ERROR 22023: Invalid GIS data provided to function st_geomfromtext.
SELECT ST_ASTEXT(ST_GEOMFROMTEXT('LINESTRING EMPTY()'));
ERROR 22023: Invalid GIS data provided to function st_geomfromtext.
SELECT ST_ASTEXT(ST_GEOMFROMTEXT('LINESTRING EMPT'));
ERROR 22023: Invalid GIS data provided to function st_geomfromtext.
SELECT ST_ASTEXT(ST_GEOMFROMTEXT('LINESTRING EMPTYNESS'));
ERROR 22023: Invalid GIS data provided to function st_geomfromtext.
SELECT ST_ASTEXT(ST_GEOMFROMTEXT('POLYGON EMPTY'));
ERROR 22023: Invalid GIS data provided to function st_geomfromtext.
SELECT ST_ASTEXT(ST_GEOMFROMTEXT('POLYGON()'));
ERROR 22023: Invalid GIS data provided to function st_geomfromtext.
SELECT ST_ASTEXT(ST_GEOMFROMTEXT(' POLYGON  EMPTY '));
ERROR 22023: Invalid GIS data provided to function st_geomfromtext.
SELECT ST_ASTEXT(ST_GEOMFROMTEXT('POLYGON EMPTY()'));
ERROR 22023: Invalid GIS data provided to function st_geomfromtext.
SELECT ST_ASTEXT(ST_GEOMFROMTEXT('POLYGON EMPT'));
ERROR 22023: Invalid GIS data provided to function st_geomfromtext.
SELECT ST_ASTEXT(ST_GEOMFROMTEXT('POLYGON EMPTYNESS'));
ERROR 22023: Invalid GIS data provided to function st_geomfromtext.
SELECT ST_ASTEXT(ST_GEOMFROMTEXT('MULTIPOINT EMPTY'));
ERROR 22023: Invalid GIS data provided to function st_geomfromtext.
SELECT ST_ASTEXT(ST_GEOMFROMTEXT('MULTIPOINT()'));
ERROR 22023: Invalid GIS data provided to function st_geomfromtext.
SELECT ST_ASTEXT(ST_GEOMFROMTEXT(' MULTIPOINT  EMPTY '));
ERROR 22023: Invalid GIS data provided to function st_geomfromtext.
SELECT ST_ASTEXT(ST_GEOMFROMTEXT('MULTIPOINT EMPTY()'));
ERROR 22023: Invalid GIS data provided to function st_geomfromtext.
SELECT ST_ASTEXT(ST_GEOMFROMTEXT('MULTIPOINT EMPT'));
ERROR 22023: Invalid GIS data provided to function st_geomfromtext.
SELECT ST_ASTEXT(ST_GEOMFROMTEXT('MULTIPOINT EMPTYNESS'));
ERROR 22023: Invalid GIS data provided to function st_geomfromtext.
SELECT ST_ASTEXT(ST_GEOMFROMTEXT('MULTILINESTRING EMPTY'));
ERROR 22023: Invalid GIS data provided to function st_geomfromtext.
SELECT ST_ASTEXT(ST_GEOMFROMTEXT('MULTILINESTRING()'));
ERROR 22023: Invalid GIS data provided to function st_geomfromtext.
SELECT ST_ASTEXT(ST_GEOMFROMTEXT(' MULTILINESTRING  EMPTY '));
ERROR 22023: Invalid GIS data provided to function st_geomfromtext.
SELECT ST_ASTEXT(ST_GEOMFROMTEXT('MULTILINESTRING EMPTY()'));
ERROR 22023: Invalid GIS data provided to function st_geomfromtext.
SELECT ST_ASTEXT(ST_GEOMFROMTEXT('MULTILINESTRING EMPT'));
ERROR 22023: Invalid GIS data provided to function st_geomfromtext.
SELECT ST_ASTEXT(ST_GEOMFROMTEXT('MULTILINESTRING EMPTYNESS'));
ERROR 22023: Invalid GIS data provided to function st_geomfromtext.
SELECT ST_ASTEXT(ST_GEOMFROMTEXT('MULTIPOLYGON EMPTY'));
ERROR 22023: Invalid GIS data provided to function st_geomfromtext.
SELECT ST_ASTEXT(ST_GEOMFROMTEXT('MULTIPOLYGON()'));
ERROR 22023: Invalid GIS data provided to function st_geomfromtext.
SELECT ST_ASTEXT(ST_GEOMFROMTEXT(' MULTIPOLYGON  EMPTY '));
ERROR 22023: Invalid GIS data provided to function st_geomfromtext.
SELECT ST_ASTEXT(ST_GEOMFROMTEXT('MULTIPOLYGON EMPTY()'));
ERROR 22023: Invalid GIS data provided to function st_geomfromtext.
SELECT ST_ASTEXT(ST_GEOMFROMTEXT('MULTIPOLYGON EMPT'));
ERROR 22023: Invalid GIS data provided to function st_geomfromtext.
SELECT ST_ASTEXT(ST_GEOMFROMTEXT('MULTIPOLYGON EMPTYNESS'));
ERROR 22023: Invalid GIS data provided to function st_geomfromtext.
SELECT ST_ASTEXT(ST_GEOMFROMTEXT('GEOMETRYCOLLECTION EMPTY'));
ST_ASTEXT(ST_GEOMFROMTEXT('GEOMETRYCOLLECTION EMPTY'))
GEOMETRYCOLLECTION EMPTY
SELECT ST_ASTEXT(ST_GEOMFROMTEXT('GEOMETRYCOLLECTION()'));
ST_ASTEXT(ST_GEOMFROMTEXT('GEOMETRYCOLLECTION()'))
GEOMETRYCOLLECTION EMPTY
SELECT ST_ASTEXT(ST_GEOMFROMTEXT(' GEOMETRYCOLLECTION  EMPTY '));
ST_ASTEXT(ST_GEOMFROMTEXT(' GEOMETRYCOLLECTION  EMPTY '))
GEOMETRYCOLLECTION EMPTY
SELECT ST_ASTEXT(ST_GEOMFROMTEXT('GEOMETRYCOLLECTION EMPTY()'));
ERROR 22023: Invalid GIS data provided to function st_geomfromtext.
SELECT ST_ASTEXT(ST_GEOMFROMTEXT('GEOMETRYCOLLECTION EMPT'));
ERROR 22023: Invalid GIS data provided to function st_geomfromtext.
SELECT ST_ASTEXT(ST_GEOMFROMTEXT('GEOMETRYCOLLECTION EMPTYNESS'));
ERROR 22023: Invalid GIS data provided to function st_geomfromtext.
SELECT ST_ASTEXT(ST_GEOMFROMTEXT(
'GEOMETRYCOLLECTION(
     GEOMETRYCOLLECTION(
       GEOMETRYCOLLECTION EMPTY,
       GEOMETRYCOLLECTION ()
     )
   )'
));
ST_ASTEXT(ST_GEOMFROMTEXT(
'GEOMETRYCOLLECTION(
     GEOMETRYCOLLECTION(
       GEOMETRYCOLLECTION EMPTY,
       GEOMETRYCOLLECTION ()
     )
   )'
))
GEOMETRYCOLLECTION(GEOMETRYCOLLECTION(GEOMETRYCOLLECTION EMPTY,GEOMETRYCOLLECTION EMPTY))
