SELECT @@global.innodb_table_locks into @table_locks;
SET @@global.innodb_table_locks= OFF;
DROP TABLE IF EXISTS t1, t2;
DROP VIEW IF EXISTS v1;
SET autocommit=0;
SET autocommit=0;
connection default;
CREATE TABLE t1 (k INT NOT NULL PRIMARY KEY, i INT, j INT, l INT) ENGINE=InnoDB;
INSERT INTO t1 VALUES (1,123,1,123);
INSERT INTO t1 VALUES (2,124,2,124);
INSERT INTO t1 VALUES (3,125,3,125);
INSERT INTO t1 VALUES (4,126,4,126);
CREATE INDEX ixi ON t1 (i);
CREATE TABLE t2 (k INT NOT NULL PRIMARY KEY, i INT, j INT, l INT) ENGINE=InnoDB;
INSERT INTO t2 VALUES (1,123,1,123);
INSERT INTO t2 VALUES (2,124,2,124);
INSERT INTO t2 VALUES (3,125,3,125);
INSERT INTO t2 VALUES (4,126,4,126);
CREATE INDEX ixi ON t2 (i);
CREATE TRIGGER trig_t2 AFTER UPDATE ON t2
FOR EACH ROW BEGIN
UPDATE t1 SET l = NEW.i WHERE i = OLD.i;
END;
|
COMMIT;
SELECT @@global.tx_isolation;
@@global.tx_isolation
REPEATABLE-READ
EXPLAIN SELECT t1.i FROM t1 WHERE t1.i< 125 FOR UPDATE;
id	select_type	table	type	possible_keys	key	key_len	ref	rows	Extra
1	SIMPLE	t1	index	ixi	ixi	5	NULL	4	Using where; Using index
SELECT t1.i FROM t1 WHERE t1.i< 125 FOR UPDATE;
i
123
124
connection root1;
UPDATE t2 SET t2.i=225 WHERE t2.i=125;
SELECT * FROM t1 ORDER BY t1.k;
k	i	j	l
1	123	1	123
2	124	2	124
3	125	3	225
4	126	4	126
SELECT * FROM t2 ORDER BY t2.k;
k	i	j	l
1	123	1	123
2	124	2	124
3	225	3	125
4	126	4	126
connection default;
UPDATE t2 SET t2.i=223 WHERE t2.i=123;
SELECT * FROM t1 ORDER BY t1.k;
k	i	j	l
1	123	1	223
2	124	2	124
3	125	3	125
4	126	4	126
SELECT * FROM t2 ORDER BY t2.k;
k	i	j	l
1	223	1	123
2	124	2	124
3	125	3	125
4	126	4	126
connection root1;
UPDATE t2 SET t2.i=226 WHERE t2.i=126;
SELECT * FROM t1 ORDER BY t1.k;
k	i	j	l
1	123	1	123
2	124	2	124
3	125	3	225
4	126	4	226
SELECT * FROM t2 ORDER BY t2.k;
k	i	j	l
1	123	1	123
2	124	2	124
3	225	3	125
4	226	4	126
connection default;
UPDATE t2 SET t2.i=224 WHERE t2.i=124;
SELECT * FROM t1 ORDER BY t1.k;
k	i	j	l
1	123	1	223
2	124	2	224
3	125	3	125
4	126	4	126
SELECT * FROM t2 ORDER BY t2.k;
k	i	j	l
1	223	1	123
2	224	2	124
3	125	3	125
4	126	4	126
connection root1;
DELETE FROM t1 WHERE t1.i=226;
SELECT * FROM t1 ORDER BY t1.k;
k	i	j	l
1	123	1	123
2	124	2	124
3	125	3	225
4	126	4	226
SELECT * FROM t2 ORDER BY t2.k;
k	i	j	l
1	123	1	123
2	124	2	124
3	225	3	125
4	226	4	126
connection default;
DELETE FROM t1 WHERE t1.i=224;
SELECT * FROM t1 ORDER BY t1.k;
k	i	j	l
1	123	1	223
2	124	2	224
3	125	3	125
4	126	4	126
SELECT * FROM t2 ORDER BY t2.k;
k	i	j	l
1	223	1	123
2	224	2	124
3	125	3	125
4	126	4	126
COMMIT;
connection root1;
ROLLBACK;
connection default;
SELECT * FROM t1 ORDER BY t1.k;
k	i	j	l
1	123	1	223
2	124	2	224
3	125	3	125
4	126	4	126
SELECT * FROM t2 ORDER BY t2.k;
k	i	j	l
1	223	1	123
2	224	2	124
3	125	3	125
4	126	4	126
connection root1;
SELECT * FROM t1 ORDER BY t1.k;
k	i	j	l
1	123	1	223
2	124	2	224
3	125	3	125
4	126	4	126
SELECT * FROM t2 ORDER BY t2.k;
k	i	j	l
1	223	1	123
2	224	2	124
3	125	3	125
4	126	4	126
connection default;
DROP TABLE t1, t2;
SET @@global.innodb_table_locks= @table_locks;
