stop slave;
drop table if exists t1,t2,t3,t4,t5,t6,t7,t8,t9;
reset master;
reset slave;
drop table if exists t1,t2,t3,t4,t5,t6,t7,t8,t9;
start slave;
**** On Master ****
CREATE TABLE t1 (a INT PRIMARY KEY, b LONG) ENGINE=NDB;
INSERT INTO t1 VALUES (1,1), (2,2);
SELECT * FROM t1 ORDER BY a,b;
a	b
1	1
2	2
**** On Slave ****
INSERT INTO t1 VALUE (3,3);
SELECT * FROM t1 ORDER BY a,b;
a	b
1	1
2	2
3	3
**** On Master ****
TRUNCATE TABLE t1;
SELECT * FROM t1 ORDER BY a,b;
a	b
**** On Slave ****
SELECT * FROM t1 ORDER BY a,b;
a	b
**** On Master ****
DROP TABLE t1;
SHOW BINLOG EVENTS;
Log_name	Pos	Event_type	Server_id	End_log_pos	Info
master-bin.000001	4	Format_desc	1	106	Server ver: SERVER_VERSION, Binlog ver: 4
master-bin.000001	106	Query	1	223	use `test`; CREATE TABLE t1 (a INT PRIMARY KEY, b LONG) ENGINE=NDB
master-bin.000001	223	Query	1	287	BEGIN
master-bin.000001	287	Table_map	1	327	table_id: # (test.t1)
master-bin.000001	327	Table_map	1	385	table_id: # (mysql.ndb_apply_status)
master-bin.000001	385	Write_rows	1	444	table_id: #
master-bin.000001	444	Write_rows	1	491	table_id: # flags: STMT_END_F
master-bin.000001	491	Query	1	556	COMMIT
master-bin.000001	556	Query	1	636	use `test`; TRUNCATE TABLE t1
master-bin.000001	636	Query	1	712	use `test`; DROP TABLE t1
**** On Master ****
CREATE TABLE t1 (a INT PRIMARY KEY, b LONG) ENGINE=NDB;
INSERT INTO t1 VALUES (1,1), (2,2);
SELECT * FROM t1 ORDER BY a,b;
a	b
1	1
2	2
**** On Slave ****
INSERT INTO t1 VALUE (3,3);
SELECT * FROM t1 ORDER BY a,b;
a	b
1	1
2	2
3	3
**** On Master ****
DELETE FROM t1;
SELECT * FROM t1 ORDER BY a,b;
a	b
**** On Slave ****
SELECT * FROM t1 ORDER BY a,b;
a	b
3	3
**** On Master ****
DROP TABLE t1;
SHOW BINLOG EVENTS;
Log_name	Pos	Event_type	Server_id	End_log_pos	Info
master-bin.000001	4	Format_desc	1	106	Server ver: SERVER_VERSION, Binlog ver: 4
master-bin.000001	106	Query	1	223	use `test`; CREATE TABLE t1 (a INT PRIMARY KEY, b LONG) ENGINE=NDB
master-bin.000001	223	Query	1	287	BEGIN
master-bin.000001	287	Table_map	1	327	table_id: # (test.t1)
master-bin.000001	327	Table_map	1	385	table_id: # (mysql.ndb_apply_status)
master-bin.000001	385	Write_rows	1	444	table_id: #
master-bin.000001	444	Write_rows	1	491	table_id: # flags: STMT_END_F
master-bin.000001	491	Query	1	556	COMMIT
master-bin.000001	556	Query	1	636	use `test`; TRUNCATE TABLE t1
master-bin.000001	636	Query	1	712	use `test`; DROP TABLE t1
master-bin.000001	712	Query	1	829	use `test`; CREATE TABLE t1 (a INT PRIMARY KEY, b LONG) ENGINE=NDB
master-bin.000001	829	Query	1	893	BEGIN
master-bin.000001	893	Table_map	1	933	table_id: # (test.t1)
master-bin.000001	933	Table_map	1	991	table_id: # (mysql.ndb_apply_status)
master-bin.000001	991	Write_rows	1	1050	table_id: #
master-bin.000001	1050	Write_rows	1	1097	table_id: # flags: STMT_END_F
master-bin.000001	1097	Query	1	1162	COMMIT
master-bin.000001	1162	Query	1	1226	BEGIN
master-bin.000001	1226	Table_map	1	1266	table_id: # (test.t1)
master-bin.000001	1266	Table_map	1	1324	table_id: # (mysql.ndb_apply_status)
master-bin.000001	1324	Write_rows	1	1383	table_id: #
master-bin.000001	1383	Delete_rows	1	1422	table_id: # flags: STMT_END_F
master-bin.000001	1422	Query	1	1487	COMMIT
master-bin.000001	1487	Query	1	1563	use `test`; DROP TABLE t1
