stop slave;
drop table if exists t1,t2,t3,t4,t5,t6,t7,t8,t9;
reset master;
reset slave;
drop table if exists t1,t2,t3,t4,t5,t6,t7,t8,t9;
start slave;
**** Test 1 ****
insert into mysql.ndb_replication values ("test", "t1", 0, NULL, "NDB$MAX(X)");
create table t1 (a int, b varchar(32), X int unsigned, d varchar(9), primary key (a, d)) engine ndb;
create table t2 (a int key, b varchar(32), c int unsigned, d varchar(9)) engine ndb;
begin;
insert into t1 values (1, "Master t1 a=1 at X=10", 10, '111');
insert into t1 values (2, "Master t1 a=2 at X=10", 10, '111222');
insert into t1 values (3, "Master t1 a=3 at X=10", 10, '111222333');
insert into t2 values (1, "Master t2 a=1 at c=10", 10, '111');
insert into t2 values (2, "Master t2 a=2 at c=10", 10, '111222');
insert into t2 values (3, "Master t2 a=3 at c=10", 10, '111222333');
commit;
SELECT VARIABLE_VALUE-@init_ndb_conflict_fn_max FROM INFORMATION_SCHEMA.GLOBAL_STATUS WHERE VARIABLE_NAME LIKE "NDB_CONFLICT_FN_MAX";
VARIABLE_VALUE-@init_ndb_conflict_fn_max
0
SELECT VARIABLE_VALUE-@init_ndb_conflict_fn_old FROM INFORMATION_SCHEMA.GLOBAL_STATUS WHERE VARIABLE_NAME LIKE "NDB_CONFLICT_FN_OLD";
VARIABLE_VALUE-@init_ndb_conflict_fn_old
0
SELECT * FROM `t1$EX` ORDER BY server_id, master_server_id, master_epoch, count;
SELECT * FROM `t1$EX` ORDER BY a, d;
SELECT * FROM `t2$EX` ORDER BY server_id, master_server_id, master_epoch, count;
SELECT * FROM `t2$EX` ORDER BY a, d;
select * from t1 order by a, d;
a	b	X	d
1	Master t1 a=1 at X=10	10	111
2	Master t1 a=2 at X=10	10	111222
3	Master t1 a=3 at X=10	10	111222333
select * from t2 order by a, d;
a	b	c	d
1	Master t2 a=1 at c=10	10	111
2	Master t2 a=2 at c=10	10	111222
3	Master t2 a=3 at c=10	10	111222333
begin;
update t1 set b="Slave t1 a=1 at X=12", X=12 where a=1 and d='111';
update t1 set b="Slave t1 a=2 at X=12", X=12 where a=2 and d='111222';
update t1 set b="Slave t1 a=3 at X=12", X=12 where a=3 and d='111222333';
update t2 set b="Slave t2 a=1 at c=12", c=12 where a=1;
update t2 set b="Slave t2 a=2 at c=12", c=12 where a=2;
update t2 set b="Slave t2 a=3 at c=12", c=12 where a=3;
commit;
begin;
update t1 set b="Master t1 a=1 at X=11", X=11 where a=1 and d='111';
update t1 set b="Master t1 a=2 at X=11", X=11 where a=2 and d='111222';
update t1 set b="Master t1 a=3 at X=11", X=11 where a=3 and d='111222333';
update t2 set b="Master t2 a=1 at c=11", c=11 where a=1;
update t2 set b="Master t2 a=2 at c=11", c=11 where a=2;
update t2 set b="Master t2 a=3 at c=11", c=11 where a=3;
commit;
SELECT VARIABLE_VALUE-@init_ndb_conflict_fn_max FROM INFORMATION_SCHEMA.GLOBAL_STATUS WHERE VARIABLE_NAME LIKE "NDB_CONFLICT_FN_MAX";
VARIABLE_VALUE-@init_ndb_conflict_fn_max
3
SELECT VARIABLE_VALUE-@init_ndb_conflict_fn_old FROM INFORMATION_SCHEMA.GLOBAL_STATUS WHERE VARIABLE_NAME LIKE "NDB_CONFLICT_FN_OLD";
VARIABLE_VALUE-@init_ndb_conflict_fn_old
0
SELECT * FROM `t1$EX` ORDER BY server_id, master_server_id, master_epoch, count;
SELECT * FROM `t1$EX` ORDER BY a, d;
SELECT * FROM `t2$EX` ORDER BY server_id, master_server_id, master_epoch, count;
SELECT * FROM `t2$EX` ORDER BY a, d;
select * from t1 order by a, d;
a	b	X	d
1	Slave t1 a=1 at X=12	12	111
2	Slave t1 a=2 at X=12	12	111222
3	Slave t1 a=3 at X=12	12	111222333
select * from t2 order by a, d;
a	b	c	d
1	Master t2 a=1 at c=11	11	111
2	Master t2 a=2 at c=11	11	111222
3	Master t2 a=3 at c=11	11	111222333
begin;
update t1 set b="Master t1 a=1 at X=13", X=13 where a=1 and d='111';
update t1 set b="Master t1 a=2 at X=13", X=13 where a=2 and d='111222';
update t1 set b="Master t1 a=3 at X=13", X=13 where a=3 and d='111222333';
update t2 set b="Master t2 a=1 at c=13", c=13 where a=1;
update t2 set b="Master t2 a=2 at c=13", c=13 where a=2;
update t2 set b="Master t2 a=3 at c=13", c=13 where a=3;
commit;
SELECT VARIABLE_VALUE-@init_ndb_conflict_fn_max FROM INFORMATION_SCHEMA.GLOBAL_STATUS WHERE VARIABLE_NAME LIKE "NDB_CONFLICT_FN_MAX";
VARIABLE_VALUE-@init_ndb_conflict_fn_max
3
SELECT VARIABLE_VALUE-@init_ndb_conflict_fn_old FROM INFORMATION_SCHEMA.GLOBAL_STATUS WHERE VARIABLE_NAME LIKE "NDB_CONFLICT_FN_OLD";
VARIABLE_VALUE-@init_ndb_conflict_fn_old
0
SELECT * FROM `t1$EX` ORDER BY server_id, master_server_id, master_epoch, count;
SELECT * FROM `t1$EX` ORDER BY a, d;
SELECT * FROM `t2$EX` ORDER BY server_id, master_server_id, master_epoch, count;
SELECT * FROM `t2$EX` ORDER BY a, d;
select * from t1 order by a, d;
a	b	X	d
1	Master t1 a=1 at X=13	13	111
2	Master t1 a=2 at X=13	13	111222
3	Master t1 a=3 at X=13	13	111222333
select * from t2 order by a, d;
a	b	c	d
1	Master t2 a=1 at c=13	13	111
2	Master t2 a=2 at c=13	13	111222
3	Master t2 a=3 at c=13	13	111222333
drop table t1, t2;
**** Test 2 ****
set global ndb_log_update_as_write=1;
update mysql.ndb_replication set binlog_type=4;
create table t1 (a int, b varchar(32), X bigint unsigned, d varchar(9), primary key (a, d)) engine ndb;
create table t2 (a int key, b varchar(32), c int unsigned, d varchar(9)) engine ndb;
begin;
insert into t1 values (1, "Master t1 a=1 at X=10", 10, '111');
insert into t1 values (2, "Master t1 a=2 at X=10", 10, '111222');
insert into t1 values (3, "Master t1 a=3 at X=10", 10, '111222333');
insert into t2 values (1, "Master t2 a=1 at c=10", 10, '111');
insert into t2 values (2, "Master t2 a=2 at c=10", 10, '111222');
insert into t2 values (3, "Master t2 a=3 at c=10", 10, '111222333');
commit;
SELECT VARIABLE_VALUE-@init_ndb_conflict_fn_max FROM INFORMATION_SCHEMA.GLOBAL_STATUS WHERE VARIABLE_NAME LIKE "NDB_CONFLICT_FN_MAX";
VARIABLE_VALUE-@init_ndb_conflict_fn_max
3
SELECT VARIABLE_VALUE-@init_ndb_conflict_fn_old FROM INFORMATION_SCHEMA.GLOBAL_STATUS WHERE VARIABLE_NAME LIKE "NDB_CONFLICT_FN_OLD";
VARIABLE_VALUE-@init_ndb_conflict_fn_old
0
SELECT * FROM `t1$EX` ORDER BY server_id, master_server_id, master_epoch, count;
SELECT * FROM `t1$EX` ORDER BY a, d;
SELECT * FROM `t2$EX` ORDER BY server_id, master_server_id, master_epoch, count;
SELECT * FROM `t2$EX` ORDER BY a, d;
select * from t1 order by a, d;
a	b	X	d
1	Master t1 a=1 at X=10	10	111
2	Master t1 a=2 at X=10	10	111222
3	Master t1 a=3 at X=10	10	111222333
select * from t2 order by a, d;
a	b	c	d
1	Master t2 a=1 at c=10	10	111
2	Master t2 a=2 at c=10	10	111222
3	Master t2 a=3 at c=10	10	111222333
begin;
update t1 set b="Slave t1 a=1 at X=12", X=12 where a=1 and d='111';
update t1 set b="Slave t1 a=2 at X=12", X=12 where a=2 and d='111222';
update t1 set b="Slave t1 a=3 at X=12", X=12 where a=3 and d='111222333';
update t2 set b="Slave t2 a=1 at c=12", c=12 where a=1;
update t2 set b="Slave t2 a=2 at c=12", c=12 where a=2;
update t2 set b="Slave t2 a=3 at c=12", c=12 where a=3;
commit;
begin;
update t1 set b="Master t1 a=1 at X=11", X=11 where a=1 and d='111';
update t1 set b="Master t1 a=2 at X=11", X=11 where a=2 and d='111222';
update t1 set b="Master t1 a=3 at X=11", X=11 where a=3 and d='111222333';
update t2 set b="Master t2 a=1 at c=11", c=11 where a=1;
update t2 set b="Master t2 a=2 at c=11", c=11 where a=2;
update t2 set b="Master t2 a=3 at c=11", c=11 where a=3;
commit;
SELECT VARIABLE_VALUE-@init_ndb_conflict_fn_max FROM INFORMATION_SCHEMA.GLOBAL_STATUS WHERE VARIABLE_NAME LIKE "NDB_CONFLICT_FN_MAX";
VARIABLE_VALUE-@init_ndb_conflict_fn_max
6
SELECT VARIABLE_VALUE-@init_ndb_conflict_fn_old FROM INFORMATION_SCHEMA.GLOBAL_STATUS WHERE VARIABLE_NAME LIKE "NDB_CONFLICT_FN_OLD";
VARIABLE_VALUE-@init_ndb_conflict_fn_old
0
SELECT * FROM `t1$EX` ORDER BY server_id, master_server_id, master_epoch, count;
SELECT * FROM `t1$EX` ORDER BY a, d;
SELECT * FROM `t2$EX` ORDER BY server_id, master_server_id, master_epoch, count;
SELECT * FROM `t2$EX` ORDER BY a, d;
select * from t1 order by a, d;
a	b	X	d
1	Slave t1 a=1 at X=12	12	111
2	Slave t1 a=2 at X=12	12	111222
3	Slave t1 a=3 at X=12	12	111222333
select * from t2 order by a, d;
a	b	c	d
1	Master t2 a=1 at c=11	11	111
2	Master t2 a=2 at c=11	11	111222
3	Master t2 a=3 at c=11	11	111222333
begin;
update t1 set b="Master t1 a=1 at X=13", X=13 where a=1 and d='111';
update t1 set b="Master t1 a=2 at X=13", X=13 where a=2 and d='111222';
update t1 set b="Master t1 a=3 at X=13", X=13 where a=3 and d='111222333';
update t2 set b="Master t2 a=1 at c=13", c=13 where a=1;
update t2 set b="Master t2 a=2 at c=13", c=13 where a=2;
update t2 set b="Master t2 a=3 at c=13", c=13 where a=3;
commit;
SELECT VARIABLE_VALUE-@init_ndb_conflict_fn_max FROM INFORMATION_SCHEMA.GLOBAL_STATUS WHERE VARIABLE_NAME LIKE "NDB_CONFLICT_FN_MAX";
VARIABLE_VALUE-@init_ndb_conflict_fn_max
6
SELECT VARIABLE_VALUE-@init_ndb_conflict_fn_old FROM INFORMATION_SCHEMA.GLOBAL_STATUS WHERE VARIABLE_NAME LIKE "NDB_CONFLICT_FN_OLD";
VARIABLE_VALUE-@init_ndb_conflict_fn_old
0
SELECT * FROM `t1$EX` ORDER BY server_id, master_server_id, master_epoch, count;
SELECT * FROM `t1$EX` ORDER BY a, d;
SELECT * FROM `t2$EX` ORDER BY server_id, master_server_id, master_epoch, count;
SELECT * FROM `t2$EX` ORDER BY a, d;
select * from t1 order by a, d;
a	b	X	d
1	Master t1 a=1 at X=13	13	111
2	Master t1 a=2 at X=13	13	111222
3	Master t1 a=3 at X=13	13	111222333
select * from t2 order by a, d;
a	b	c	d
1	Master t2 a=1 at c=13	13	111
2	Master t2 a=2 at c=13	13	111222
3	Master t2 a=3 at c=13	13	111222333
drop table t1, t2;
**** Test 3 ****
set global ndb_log_update_as_write=0;
update mysql.ndb_replication set binlog_type=2;
create table t1 (a int, b varchar(32), X int unsigned, d varchar(9), primary key (a, d)) engine ndb;
create table t2 (a int key, b varchar(32), c int unsigned, d varchar(9)) engine ndb;
begin;
insert into t1 values (1, "Master t1 a=1 at X=10", 10, '111');
insert into t1 values (2, "Master t1 a=2 at X=10", 10, '111222');
insert into t1 values (3, "Master t1 a=3 at X=10", 10, '111222333');
insert into t2 values (1, "Master t2 a=1 at c=10", 10, '111');
insert into t2 values (2, "Master t2 a=2 at c=10", 10, '111222');
insert into t2 values (3, "Master t2 a=3 at c=10", 10, '111222333');
commit;
SELECT VARIABLE_VALUE-@init_ndb_conflict_fn_max FROM INFORMATION_SCHEMA.GLOBAL_STATUS WHERE VARIABLE_NAME LIKE "NDB_CONFLICT_FN_MAX";
VARIABLE_VALUE-@init_ndb_conflict_fn_max
6
SELECT VARIABLE_VALUE-@init_ndb_conflict_fn_old FROM INFORMATION_SCHEMA.GLOBAL_STATUS WHERE VARIABLE_NAME LIKE "NDB_CONFLICT_FN_OLD";
VARIABLE_VALUE-@init_ndb_conflict_fn_old
0
SELECT * FROM `t1$EX` ORDER BY server_id, master_server_id, master_epoch, count;
SELECT * FROM `t1$EX` ORDER BY a, d;
SELECT * FROM `t2$EX` ORDER BY server_id, master_server_id, master_epoch, count;
SELECT * FROM `t2$EX` ORDER BY a, d;
select * from t1 order by a, d;
a	b	X	d
1	Master t1 a=1 at X=10	10	111
2	Master t1 a=2 at X=10	10	111222
3	Master t1 a=3 at X=10	10	111222333
select * from t2 order by a, d;
a	b	c	d
1	Master t2 a=1 at c=10	10	111
2	Master t2 a=2 at c=10	10	111222
3	Master t2 a=3 at c=10	10	111222333
begin;
update t1 set b="Slave t1 a=1 at X=12", X=12 where a=1 and d='111';
update t1 set b="Slave t1 a=2 at X=12", X=12 where a=2 and d='111222';
update t1 set b="Slave t1 a=3 at X=12", X=12 where a=3 and d='111222333';
update t2 set b="Slave t2 a=1 at c=12", c=12 where a=1;
update t2 set b="Slave t2 a=2 at c=12", c=12 where a=2;
update t2 set b="Slave t2 a=3 at c=12", c=12 where a=3;
commit;
begin;
update t1 set b="Master t1 a=1 at X=11", X=11 where a=1 and d='111';
update t1 set b="Master t1 a=2 at X=11", X=11 where a=2 and d='111222';
update t1 set b="Master t1 a=3 at X=11", X=11 where a=3 and d='111222333';
update t2 set b="Master t2 a=1 at c=11", c=11 where a=1;
update t2 set b="Master t2 a=2 at c=11", c=11 where a=2;
update t2 set b="Master t2 a=3 at c=11", c=11 where a=3;
commit;
SELECT VARIABLE_VALUE-@init_ndb_conflict_fn_max FROM INFORMATION_SCHEMA.GLOBAL_STATUS WHERE VARIABLE_NAME LIKE "NDB_CONFLICT_FN_MAX";
VARIABLE_VALUE-@init_ndb_conflict_fn_max
6
SELECT VARIABLE_VALUE-@init_ndb_conflict_fn_old FROM INFORMATION_SCHEMA.GLOBAL_STATUS WHERE VARIABLE_NAME LIKE "NDB_CONFLICT_FN_OLD";
VARIABLE_VALUE-@init_ndb_conflict_fn_old
0
SELECT * FROM `t1$EX` ORDER BY server_id, master_server_id, master_epoch, count;
SELECT * FROM `t1$EX` ORDER BY a, d;
SELECT * FROM `t2$EX` ORDER BY server_id, master_server_id, master_epoch, count;
SELECT * FROM `t2$EX` ORDER BY a, d;
select * from t1 order by a, d;
a	b	X	d
1	Master t1 a=1 at X=11	11	111
2	Master t1 a=2 at X=11	11	111222
3	Master t1 a=3 at X=11	11	111222333
select * from t2 order by a, d;
a	b	c	d
1	Master t2 a=1 at c=11	11	111
2	Master t2 a=2 at c=11	11	111222
3	Master t2 a=3 at c=11	11	111222333
begin;
update t1 set b="Master t1 a=1 at X=13", X=13 where a=1 and d='111';
update t1 set b="Master t1 a=2 at X=13", X=13 where a=2 and d='111222';
update t1 set b="Master t1 a=3 at X=13", X=13 where a=3 and d='111222333';
update t2 set b="Master t2 a=1 at c=13", c=13 where a=1;
update t2 set b="Master t2 a=2 at c=13", c=13 where a=2;
update t2 set b="Master t2 a=3 at c=13", c=13 where a=3;
commit;
SELECT VARIABLE_VALUE-@init_ndb_conflict_fn_max FROM INFORMATION_SCHEMA.GLOBAL_STATUS WHERE VARIABLE_NAME LIKE "NDB_CONFLICT_FN_MAX";
VARIABLE_VALUE-@init_ndb_conflict_fn_max
6
SELECT VARIABLE_VALUE-@init_ndb_conflict_fn_old FROM INFORMATION_SCHEMA.GLOBAL_STATUS WHERE VARIABLE_NAME LIKE "NDB_CONFLICT_FN_OLD";
VARIABLE_VALUE-@init_ndb_conflict_fn_old
0
SELECT * FROM `t1$EX` ORDER BY server_id, master_server_id, master_epoch, count;
SELECT * FROM `t1$EX` ORDER BY a, d;
SELECT * FROM `t2$EX` ORDER BY server_id, master_server_id, master_epoch, count;
SELECT * FROM `t2$EX` ORDER BY a, d;
select * from t1 order by a, d;
a	b	X	d
1	Master t1 a=1 at X=13	13	111
2	Master t1 a=2 at X=13	13	111222
3	Master t1 a=3 at X=13	13	111222333
select * from t2 order by a, d;
a	b	c	d
1	Master t2 a=1 at c=13	13	111
2	Master t2 a=2 at c=13	13	111222
3	Master t2 a=3 at c=13	13	111222333
drop table t1, t2;
