stop slave;
drop table if exists t1,t2,t3,t4,t5,t6,t7,t8,t9;
reset master;
reset slave;
drop table if exists t1,t2,t3,t4,t5,t6,t7,t8,t9;
start slave;
set @old_global_binlog_format = @@global.binlog_format;
set @@global.binlog_format = row;
CREATE SCHEMA IF NOT EXISTS mysqlslap;
USE mysqlslap;
select @@global.binlog_format;
@@global.binlog_format
ROW
CREATE TABLE t1 (id INT primary key auto_increment, name VARCHAR(64));
FLUSH TABLE t1;
SELECT COUNT(*) FROM t1;
COUNT(*)
5000
use mysqlslap;
SELECT COUNT(*) FROM t1;
COUNT(*)
5000
truncate table t1;
insert delayed into t1 values(10, "my name");
insert delayed into t1 values(10, "is Bond"), (20, "James Bond");
flush table t1;
select * from t1;
id	name
10	my name
20	James Bond
select * from t1;
id	name
10	my name
20	James Bond
delete from t1 where id!=10;
insert delayed into t1 values(20, "is Bond"), (10, "James Bond");
flush table t1;
select * from t1;
id	name
10	my name
20	is Bond
select * from t1;
id	name
10	my name
20	is Bond
USE test;
DROP SCHEMA mysqlslap;
use test;
CREATE TABLE t1(a int, UNIQUE(a));
INSERT DELAYED IGNORE INTO t1 VALUES(1);
INSERT DELAYED IGNORE INTO t1 VALUES(1);
flush table t1;
select * from t1;
a
1
On slave
select * from t1;
a
1
drop table t1;
End of 5.0 tests
set @@global.binlog_format = @old_global_binlog_format;
