include/master-slave.inc
Warnings:
Note	####	Sending passwords in plain text without SSL/TLS is extremely insecure.
Note	####	Storing MySQL user name or password information in the connection metadata repository is not secure and is therefore not recommended. Please consider using the USER and PASSWORD connection options for START REPLICA; see the 'START REPLICA Syntax' in the MySQL Manual for more information.
[connection master]
Basic insert, update, delete from Master->Slave
DBUG code will set + check transfer of extra
row data in RBR
**** On Master ****
CREATE TABLE t1 (a INT);
Ten inserts in one transaction -> 1 epoch transaction
BEGIN;
INSERT INTO t1 VALUES (1),(2),(3),(4),(5),(6),(7),(8),(9),(10);
COMMIT;
Wait for Binlog-on-disk
flush logs;
Check that we have the expected extra row data in the Binlog
create table raw_data(txt varchar(1000));
select replace(txt, '\r', '') from raw_data where txt like '%### Extra row ndb info: data_format:%' order by txt;
replace(txt, '\r', '')
### Extra row ndb info: data_format: 0, len: 0, data: ""
### Extra row ndb info: data_format: 1, len: 1, data: 0x01
### Extra row ndb info: data_format: 2, len: 2, data: 0x0202
### Extra row ndb info: data_format: 3, len: 3, data: 0x030303
### Extra row ndb info: data_format: 4, len: 4, data: 0x04040404
### Extra row ndb info: data_format: 5, len: 5, data: 0x0505050505
### Extra row ndb info: data_format: 6, len: 6, data: 0x060606060606
### Extra row ndb info: data_format: 7, len: 7, data: 0x07070707070707
### Extra row ndb info: data_format: 8, len: 8, data: 0x0808080808080808
### Extra row ndb info: data_format: 9, len: 9, data: 0x090909090909090909
drop table raw_data;
Generate some more insert, update, delete traffic
INSERT INTO t1 SELECT a+10 FROM t1;
INSERT INTO t1 SELECT a+20 FROM t1;
INSERT INTO t1 SELECT a+40 FROM t1;
UPDATE t1 SET a = a+1;
UPDATE t1 SET a = a+1;
UPDATE t1 SET a = a+1;
UPDATE t1 SET a = a+1;
UPDATE t1 SET a = a+1;
DELETE FROM t1 WHERE a > 390;
**** On Slave ****
include/sync_slave_sql_with_master.inc
Check row count and that slave is running ok
SELECT count(*) from t1;
count(*)
80
include/check_slave_is_running.inc
DROP TABLE t1;
include/sync_slave_sql_with_master.inc
include/rpl_end.inc
