include/rpl/init_source_replica.inc
Warnings:
Note	####	Sending passwords in plain text without SSL/TLS is extremely insecure.
Note	####	Storing MySQL user name or password information in the connection metadata repository is not secure and is therefore not recommended. Please consider using the USER and PASSWORD connection options for START REPLICA; see the 'START REPLICA Syntax' in the MySQL Manual for more information.
[connection master]
SET @@BINLOG_FORMAT = ROW;
SELECT @@BINLOG_FORMAT;
@@BINLOG_FORMAT
ROW
Warnings:
Warning	1287	'@@binlog_format' is deprecated and will be removed in a future release.
**** Partition RANGE testing ****
CREATE TABLE t1 (id MEDIUMINT NOT NULL, b1 BIT(8), vc VARCHAR(255), 
bc CHAR(255), d DECIMAL(10,4) DEFAULT 0, 
f FLOAT DEFAULT 0, total BIGINT UNSIGNED, 
y YEAR, t DATE)
PARTITION BY RANGE (YEAR(t)) 
(PARTITION p0 VALUES LESS THAN (1901), 
PARTITION p1 VALUES LESS THAN (1946),  
PARTITION p2 VALUES LESS THAN (1966), 
PARTITION p3 VALUES LESS THAN (1986), 
PARTITION p4 VALUES LESS THAN (2005), 
PARTITION p5 VALUES LESS THAN MAXVALUE);
--- On master ---
SHOW CREATE TABLE t1;
Table	Create Table
t1	CREATE TABLE `t1` (
  `id` mediumint NOT NULL,
  `b1` bit(8) DEFAULT NULL,
  `vc` varchar(255) DEFAULT NULL,
  `bc` char(255) DEFAULT NULL,
  `d` decimal(10,4) DEFAULT '0.0000',
  `f` float DEFAULT '0',
  `total` bigint unsigned DEFAULT NULL,
  `y` year DEFAULT NULL,
  `t` date DEFAULT NULL
) ENGINE=ENGINE DEFAULT CHARSET=utf8mb4 COLLATE=utf8mb4_0900_ai_ci
/*!50100 PARTITION BY RANGE (year(`t`))
(PARTITION p0 VALUES LESS THAN (1901) ENGINE = ENGINE,
 PARTITION p1 VALUES LESS THAN (1946) ENGINE = ENGINE,
 PARTITION p2 VALUES LESS THAN (1966) ENGINE = ENGINE,
 PARTITION p3 VALUES LESS THAN (1986) ENGINE = ENGINE,
 PARTITION p4 VALUES LESS THAN (2005) ENGINE = ENGINE,
 PARTITION p5 VALUES LESS THAN MAXVALUE ENGINE = ENGINE) */
--- On slave --
include/rpl/sync_to_replica.inc
SHOW CREATE TABLE t1;
Table	Create Table
t1	CREATE TABLE `t1` (
  `id` mediumint NOT NULL,
  `b1` bit(8) DEFAULT NULL,
  `vc` varchar(255) DEFAULT NULL,
  `bc` char(255) DEFAULT NULL,
  `d` decimal(10,4) DEFAULT '0.0000',
  `f` float DEFAULT '0',
  `total` bigint unsigned DEFAULT NULL,
  `y` year DEFAULT NULL,
  `t` date DEFAULT NULL
) ENGINE=ENGINE DEFAULT CHARSET=utf8mb4 COLLATE=utf8mb4_0900_ai_ci
/*!50100 PARTITION BY RANGE (year(`t`))
(PARTITION p0 VALUES LESS THAN (1901) ENGINE = ENGINE,
 PARTITION p1 VALUES LESS THAN (1946) ENGINE = ENGINE,
 PARTITION p2 VALUES LESS THAN (1966) ENGINE = ENGINE,
 PARTITION p3 VALUES LESS THAN (1986) ENGINE = ENGINE,
 PARTITION p4 VALUES LESS THAN (2005) ENGINE = ENGINE,
 PARTITION p5 VALUES LESS THAN MAXVALUE ENGINE = ENGINE) */
"--- Insert into t1 --" as "";
--- Select from t1 on master --- 
select id,hex(b1),vc,bc,d,f,total,y,t from t1 order by id;
id	hex(b1)	vc	bc	d	f	total	y	t
2	1	Testing MySQL databases is a cool 	Must make it bug free for the customer	654321.4321	15.21	0	1965	1965-11-14
4	1	Testing MySQL databases is a cool 	Must make it bug free for the customer	654321.4321	15.21	0	1965	1985-11-14
42	1	Testing MySQL databases is a cool 	Must make it bug free for the customer	654321.4321	15.21	0	1965	1905-11-14
142	1	Testing MySQL databases is a cool 	Must make it bug free for the customer	654321.4321	15.21	0	1965	1995-11-14
412	1	Testing MySQL databases is a cool 	Must make it bug free for the customer	654321.4321	15.21	0	1965	2005-11-14
--- Select from t1 on slave ---
select id,hex(b1),vc,bc,d,f,total,y,t from t1 order by id;
id	hex(b1)	vc	bc	d	f	total	y	t
2	1	Testing MySQL databases is a cool 	Must make it bug free for the customer	654321.4321	15.21	0	1965	1965-11-14
4	1	Testing MySQL databases is a cool 	Must make it bug free for the customer	654321.4321	15.21	0	1965	1985-11-14
42	1	Testing MySQL databases is a cool 	Must make it bug free for the customer	654321.4321	15.21	0	1965	1905-11-14
142	1	Testing MySQL databases is a cool 	Must make it bug free for the customer	654321.4321	15.21	0	1965	1995-11-14
412	1	Testing MySQL databases is a cool 	Must make it bug free for the customer	654321.4321	15.21	0	1965	2005-11-14
--- Update t1 on master --
UPDATE t1 SET b1 = 0, t="2006-02-22" WHERE id = 412;
--- Check the update on master --- 
SELECT id,hex(b1),vc,bc,d,f,total,y,t FROM t1 WHERE id = 412;
id	hex(b1)	vc	bc	d	f	total	y	t
412	0	Testing MySQL databases is a cool 	Must make it bug free for the customer	654321.4321	15.21	0	1965	2006-02-22
--- Check Update on slave ---
SELECT id,hex(b1),vc,bc,d,f,total,y,t FROM t1 WHERE id = 412;
id	hex(b1)	vc	bc	d	f	total	y	t
412	0	Testing MySQL databases is a cool 	Must make it bug free for the customer	654321.4321	15.21	0	1965	2006-02-22
--- Remove a record from t1 on master ---
DELETE FROM t1 WHERE id = 42;
--- Show current count on master for t1 ---
SELECT COUNT(*) FROM t1;
COUNT(*)
4
--- Show current count on slave for t1 --- 
SELECT COUNT(*) FROM t1;
COUNT(*)
4
DELETE FROM t1;
ALTER TABLE t1 MODIFY vc TEXT;
--- On master ---
SHOW CREATE TABLE t1;
Table	Create Table
t1	CREATE TABLE `t1` (
  `id` mediumint NOT NULL,
  `b1` bit(8) DEFAULT NULL,
  `vc` text,
  `bc` char(255) DEFAULT NULL,
  `d` decimal(10,4) DEFAULT '0.0000',
  `f` float DEFAULT '0',
  `total` bigint unsigned DEFAULT NULL,
  `y` year DEFAULT NULL,
  `t` date DEFAULT NULL
) ENGINE=ENGINE DEFAULT CHARSET=utf8mb4 COLLATE=utf8mb4_0900_ai_ci
/*!50100 PARTITION BY RANGE (year(`t`))
(PARTITION p0 VALUES LESS THAN (1901) ENGINE = ENGINE,
 PARTITION p1 VALUES LESS THAN (1946) ENGINE = ENGINE,
 PARTITION p2 VALUES LESS THAN (1966) ENGINE = ENGINE,
 PARTITION p3 VALUES LESS THAN (1986) ENGINE = ENGINE,
 PARTITION p4 VALUES LESS THAN (2005) ENGINE = ENGINE,
 PARTITION p5 VALUES LESS THAN MAXVALUE ENGINE = ENGINE) */
--- On slave ---
include/rpl/sync_to_replica.inc
SHOW CREATE TABLE t1;
Table	Create Table
t1	CREATE TABLE `t1` (
  `id` mediumint NOT NULL,
  `b1` bit(8) DEFAULT NULL,
  `vc` text,
  `bc` char(255) DEFAULT NULL,
  `d` decimal(10,4) DEFAULT '0.0000',
  `f` float DEFAULT '0',
  `total` bigint unsigned DEFAULT NULL,
  `y` year DEFAULT NULL,
  `t` date DEFAULT NULL
) ENGINE=ENGINE DEFAULT CHARSET=utf8mb4 COLLATE=utf8mb4_0900_ai_ci
/*!50100 PARTITION BY RANGE (year(`t`))
(PARTITION p0 VALUES LESS THAN (1901) ENGINE = ENGINE,
 PARTITION p1 VALUES LESS THAN (1946) ENGINE = ENGINE,
 PARTITION p2 VALUES LESS THAN (1966) ENGINE = ENGINE,
 PARTITION p3 VALUES LESS THAN (1986) ENGINE = ENGINE,
 PARTITION p4 VALUES LESS THAN (2005) ENGINE = ENGINE,
 PARTITION p5 VALUES LESS THAN MAXVALUE ENGINE = ENGINE) */
"--- Insert into t1 --" as "";
--- Select from t1 on master --- 
select id,hex(b1),vc,bc,d,f,total,y,t from t1 order by id;
id	hex(b1)	vc	bc	d	f	total	y	t
2	1	Testing MySQL databases is a cool 	Must make it bug free for the customer	654321.4321	15.21	0	1965	1965-11-14
4	1	Testing MySQL databases is a cool 	Must make it bug free for the customer	654321.4321	15.21	0	1965	1985-11-14
42	1	Testing MySQL databases is a cool 	Must make it bug free for the customer	654321.4321	15.21	0	1965	1905-11-14
142	1	Testing MySQL databases is a cool 	Must make it bug free for the customer	654321.4321	15.21	0	1965	1995-11-14
412	1	Testing MySQL databases is a cool 	Must make it bug free for the customer	654321.4321	15.21	0	1965	2005-11-14
--- Select from t1 on slave ---
select id,hex(b1),vc,bc,d,f,total,y,t from t1 order by id;
id	hex(b1)	vc	bc	d	f	total	y	t
2	1	Testing MySQL databases is a cool 	Must make it bug free for the customer	654321.4321	15.21	0	1965	1965-11-14
4	1	Testing MySQL databases is a cool 	Must make it bug free for the customer	654321.4321	15.21	0	1965	1985-11-14
42	1	Testing MySQL databases is a cool 	Must make it bug free for the customer	654321.4321	15.21	0	1965	1905-11-14
142	1	Testing MySQL databases is a cool 	Must make it bug free for the customer	654321.4321	15.21	0	1965	1995-11-14
412	1	Testing MySQL databases is a cool 	Must make it bug free for the customer	654321.4321	15.21	0	1965	2005-11-14
--- Update t1 on master --
UPDATE t1 SET b1 = 0, t="2006-02-22" WHERE id = 412;
--- Check the update on master --- 
SELECT id,hex(b1),vc,bc,d,f,total,y,t FROM t1 WHERE id = 412;
id	hex(b1)	vc	bc	d	f	total	y	t
412	0	Testing MySQL databases is a cool 	Must make it bug free for the customer	654321.4321	15.21	0	1965	2006-02-22
--- Check Update on slave ---
SELECT id,hex(b1),vc,bc,d,f,total,y,t FROM t1 WHERE id = 412;
id	hex(b1)	vc	bc	d	f	total	y	t
412	0	Testing MySQL databases is a cool 	Must make it bug free for the customer	654321.4321	15.21	0	1965	2006-02-22
--- Remove a record from t1 on master ---
DELETE FROM t1 WHERE id = 42;
--- Show current count on master for t1 ---
SELECT COUNT(*) FROM t1;
COUNT(*)
4
--- Show current count on slave for t1 --- 
SELECT COUNT(*) FROM t1;
COUNT(*)
4
DELETE FROM t1;
DROP TABLE IF EXISTS t1;
**** Partition LIST testing ****
CREATE TABLE t1 (id MEDIUMINT NOT NULL, b1 BIT(8), vc VARCHAR(255), 
bc CHAR(255), d DECIMAL(10,4) DEFAULT 0, 
f FLOAT DEFAULT 0, total BIGINT UNSIGNED, 
y YEAR, t DATE)
PARTITION BY LIST(id) 
(PARTITION p0 VALUES IN (2, 4), 
PARTITION p1 VALUES IN (42, 142),
PARTITION p2 VALUES IN (412));
--- On master ---
SHOW CREATE TABLE t1;
Table	Create Table
t1	CREATE TABLE `t1` (
  `id` mediumint NOT NULL,
  `b1` bit(8) DEFAULT NULL,
  `vc` varchar(255) DEFAULT NULL,
  `bc` char(255) DEFAULT NULL,
  `d` decimal(10,4) DEFAULT '0.0000',
  `f` float DEFAULT '0',
  `total` bigint unsigned DEFAULT NULL,
  `y` year DEFAULT NULL,
  `t` date DEFAULT NULL
) ENGINE=ENGINE DEFAULT CHARSET=utf8mb4 COLLATE=utf8mb4_0900_ai_ci
/*!50100 PARTITION BY LIST (`id`)
(PARTITION p0 VALUES IN (2,4) ENGINE = ENGINE,
 PARTITION p1 VALUES IN (42,142) ENGINE = ENGINE,
 PARTITION p2 VALUES IN (412) ENGINE = ENGINE) */
--- On slave ---
include/rpl/sync_to_replica.inc
SHOW CREATE TABLE t1;
Table	Create Table
t1	CREATE TABLE `t1` (
  `id` mediumint NOT NULL,
  `b1` bit(8) DEFAULT NULL,
  `vc` varchar(255) DEFAULT NULL,
  `bc` char(255) DEFAULT NULL,
  `d` decimal(10,4) DEFAULT '0.0000',
  `f` float DEFAULT '0',
  `total` bigint unsigned DEFAULT NULL,
  `y` year DEFAULT NULL,
  `t` date DEFAULT NULL
) ENGINE=ENGINE DEFAULT CHARSET=utf8mb4 COLLATE=utf8mb4_0900_ai_ci
/*!50100 PARTITION BY LIST (`id`)
(PARTITION p0 VALUES IN (2,4) ENGINE = ENGINE,
 PARTITION p1 VALUES IN (42,142) ENGINE = ENGINE,
 PARTITION p2 VALUES IN (412) ENGINE = ENGINE) */
"--- Insert into t1 --" as "";
--- Select from t1 on master --- 
select id,hex(b1),vc,bc,d,f,total,y,t from t1 order by id;
id	hex(b1)	vc	bc	d	f	total	y	t
2	1	Testing MySQL databases is a cool 	Must make it bug free for the customer	654321.4321	15.21	0	1965	1965-11-14
4	1	Testing MySQL databases is a cool 	Must make it bug free for the customer	654321.4321	15.21	0	1965	1985-11-14
42	1	Testing MySQL databases is a cool 	Must make it bug free for the customer	654321.4321	15.21	0	1965	1905-11-14
142	1	Testing MySQL databases is a cool 	Must make it bug free for the customer	654321.4321	15.21	0	1965	1995-11-14
412	1	Testing MySQL databases is a cool 	Must make it bug free for the customer	654321.4321	15.21	0	1965	2005-11-14
--- Select from t1 on slave ---
select id,hex(b1),vc,bc,d,f,total,y,t from t1 order by id;
id	hex(b1)	vc	bc	d	f	total	y	t
2	1	Testing MySQL databases is a cool 	Must make it bug free for the customer	654321.4321	15.21	0	1965	1965-11-14
4	1	Testing MySQL databases is a cool 	Must make it bug free for the customer	654321.4321	15.21	0	1965	1985-11-14
42	1	Testing MySQL databases is a cool 	Must make it bug free for the customer	654321.4321	15.21	0	1965	1905-11-14
142	1	Testing MySQL databases is a cool 	Must make it bug free for the customer	654321.4321	15.21	0	1965	1995-11-14
412	1	Testing MySQL databases is a cool 	Must make it bug free for the customer	654321.4321	15.21	0	1965	2005-11-14
--- Update t1 on master --
UPDATE t1 SET b1 = 0, t="2006-02-22" WHERE id = 412;
--- Check the update on master --- 
SELECT id,hex(b1),vc,bc,d,f,total,y,t FROM t1 WHERE id = 412;
id	hex(b1)	vc	bc	d	f	total	y	t
412	0	Testing MySQL databases is a cool 	Must make it bug free for the customer	654321.4321	15.21	0	1965	2006-02-22
--- Check Update on slave ---
SELECT id,hex(b1),vc,bc,d,f,total,y,t FROM t1 WHERE id = 412;
id	hex(b1)	vc	bc	d	f	total	y	t
412	0	Testing MySQL databases is a cool 	Must make it bug free for the customer	654321.4321	15.21	0	1965	2006-02-22
--- Remove a record from t1 on master ---
DELETE FROM t1 WHERE id = 42;
--- Show current count on master for t1 ---
SELECT COUNT(*) FROM t1;
COUNT(*)
4
--- Show current count on slave for t1 --- 
SELECT COUNT(*) FROM t1;
COUNT(*)
4
DELETE FROM t1;
ALTER TABLE t1 MODIFY vc TEXT;
--- On master ---
SHOW CREATE TABLE t1;
Table	Create Table
t1	CREATE TABLE `t1` (
  `id` mediumint NOT NULL,
  `b1` bit(8) DEFAULT NULL,
  `vc` text,
  `bc` char(255) DEFAULT NULL,
  `d` decimal(10,4) DEFAULT '0.0000',
  `f` float DEFAULT '0',
  `total` bigint unsigned DEFAULT NULL,
  `y` year DEFAULT NULL,
  `t` date DEFAULT NULL
) ENGINE=ENGINE DEFAULT CHARSET=utf8mb4 COLLATE=utf8mb4_0900_ai_ci
/*!50100 PARTITION BY LIST (`id`)
(PARTITION p0 VALUES IN (2,4) ENGINE = ENGINE,
 PARTITION p1 VALUES IN (42,142) ENGINE = ENGINE,
 PARTITION p2 VALUES IN (412) ENGINE = ENGINE) */
--- On slave ---
include/rpl/sync_to_replica.inc
SHOW CREATE TABLE t1;
Table	Create Table
t1	CREATE TABLE `t1` (
  `id` mediumint NOT NULL,
  `b1` bit(8) DEFAULT NULL,
  `vc` text,
  `bc` char(255) DEFAULT NULL,
  `d` decimal(10,4) DEFAULT '0.0000',
  `f` float DEFAULT '0',
  `total` bigint unsigned DEFAULT NULL,
  `y` year DEFAULT NULL,
  `t` date DEFAULT NULL
) ENGINE=ENGINE DEFAULT CHARSET=utf8mb4 COLLATE=utf8mb4_0900_ai_ci
/*!50100 PARTITION BY LIST (`id`)
(PARTITION p0 VALUES IN (2,4) ENGINE = ENGINE,
 PARTITION p1 VALUES IN (42,142) ENGINE = ENGINE,
 PARTITION p2 VALUES IN (412) ENGINE = ENGINE) */
"--- Insert into t1 --" as "";
--- Select from t1 on master --- 
select id,hex(b1),vc,bc,d,f,total,y,t from t1 order by id;
id	hex(b1)	vc	bc	d	f	total	y	t
2	1	Testing MySQL databases is a cool 	Must make it bug free for the customer	654321.4321	15.21	0	1965	1965-11-14
4	1	Testing MySQL databases is a cool 	Must make it bug free for the customer	654321.4321	15.21	0	1965	1985-11-14
42	1	Testing MySQL databases is a cool 	Must make it bug free for the customer	654321.4321	15.21	0	1965	1905-11-14
142	1	Testing MySQL databases is a cool 	Must make it bug free for the customer	654321.4321	15.21	0	1965	1995-11-14
412	1	Testing MySQL databases is a cool 	Must make it bug free for the customer	654321.4321	15.21	0	1965	2005-11-14
--- Select from t1 on slave ---
select id,hex(b1),vc,bc,d,f,total,y,t from t1 order by id;
id	hex(b1)	vc	bc	d	f	total	y	t
2	1	Testing MySQL databases is a cool 	Must make it bug free for the customer	654321.4321	15.21	0	1965	1965-11-14
4	1	Testing MySQL databases is a cool 	Must make it bug free for the customer	654321.4321	15.21	0	1965	1985-11-14
42	1	Testing MySQL databases is a cool 	Must make it bug free for the customer	654321.4321	15.21	0	1965	1905-11-14
142	1	Testing MySQL databases is a cool 	Must make it bug free for the customer	654321.4321	15.21	0	1965	1995-11-14
412	1	Testing MySQL databases is a cool 	Must make it bug free for the customer	654321.4321	15.21	0	1965	2005-11-14
--- Update t1 on master --
UPDATE t1 SET b1 = 0, t="2006-02-22" WHERE id = 412;
--- Check the update on master --- 
SELECT id,hex(b1),vc,bc,d,f,total,y,t FROM t1 WHERE id = 412;
id	hex(b1)	vc	bc	d	f	total	y	t
412	0	Testing MySQL databases is a cool 	Must make it bug free for the customer	654321.4321	15.21	0	1965	2006-02-22
--- Check Update on slave ---
SELECT id,hex(b1),vc,bc,d,f,total,y,t FROM t1 WHERE id = 412;
id	hex(b1)	vc	bc	d	f	total	y	t
412	0	Testing MySQL databases is a cool 	Must make it bug free for the customer	654321.4321	15.21	0	1965	2006-02-22
--- Remove a record from t1 on master ---
DELETE FROM t1 WHERE id = 42;
--- Show current count on master for t1 ---
SELECT COUNT(*) FROM t1;
COUNT(*)
4
--- Show current count on slave for t1 --- 
SELECT COUNT(*) FROM t1;
COUNT(*)
4
DELETE FROM t1;
DROP TABLE IF EXISTS t1;
**** Partition HASH testing ****
CREATE TABLE t1 (id MEDIUMINT NOT NULL, b1 BIT(8), vc VARCHAR(255), 
bc CHAR(255), d DECIMAL(10,4) DEFAULT 0, 
f FLOAT DEFAULT 0, total BIGINT UNSIGNED, 
y YEAR, t DATE)
PARTITION BY HASH( YEAR(t) ) 
PARTITIONS 4;
--- On master ---
SHOW CREATE TABLE t1;
Table	Create Table
t1	CREATE TABLE `t1` (
  `id` mediumint NOT NULL,
  `b1` bit(8) DEFAULT NULL,
  `vc` varchar(255) DEFAULT NULL,
  `bc` char(255) DEFAULT NULL,
  `d` decimal(10,4) DEFAULT '0.0000',
  `f` float DEFAULT '0',
  `total` bigint unsigned DEFAULT NULL,
  `y` year DEFAULT NULL,
  `t` date DEFAULT NULL
) ENGINE=ENGINE DEFAULT CHARSET=utf8mb4 COLLATE=utf8mb4_0900_ai_ci
/*!50100 PARTITION BY HASH (year(`t`))
PARTITIONS 4 */
--- On slave ---
include/rpl/sync_to_replica.inc
SHOW CREATE TABLE t1;
Table	Create Table
t1	CREATE TABLE `t1` (
  `id` mediumint NOT NULL,
  `b1` bit(8) DEFAULT NULL,
  `vc` varchar(255) DEFAULT NULL,
  `bc` char(255) DEFAULT NULL,
  `d` decimal(10,4) DEFAULT '0.0000',
  `f` float DEFAULT '0',
  `total` bigint unsigned DEFAULT NULL,
  `y` year DEFAULT NULL,
  `t` date DEFAULT NULL
) ENGINE=ENGINE DEFAULT CHARSET=utf8mb4 COLLATE=utf8mb4_0900_ai_ci
/*!50100 PARTITION BY HASH (year(`t`))
PARTITIONS 4 */
"--- Insert into t1 --" as "";
--- Select from t1 on master --- 
select id,hex(b1),vc,bc,d,f,total,y,t from t1 order by id;
id	hex(b1)	vc	bc	d	f	total	y	t
2	1	Testing MySQL databases is a cool 	Must make it bug free for the customer	654321.4321	15.21	0	1965	1965-11-14
4	1	Testing MySQL databases is a cool 	Must make it bug free for the customer	654321.4321	15.21	0	1965	1985-11-14
42	1	Testing MySQL databases is a cool 	Must make it bug free for the customer	654321.4321	15.21	0	1965	1905-11-14
142	1	Testing MySQL databases is a cool 	Must make it bug free for the customer	654321.4321	15.21	0	1965	1995-11-14
412	1	Testing MySQL databases is a cool 	Must make it bug free for the customer	654321.4321	15.21	0	1965	2005-11-14
--- Select from t1 on slave ---
select id,hex(b1),vc,bc,d,f,total,y,t from t1 order by id;
id	hex(b1)	vc	bc	d	f	total	y	t
2	1	Testing MySQL databases is a cool 	Must make it bug free for the customer	654321.4321	15.21	0	1965	1965-11-14
4	1	Testing MySQL databases is a cool 	Must make it bug free for the customer	654321.4321	15.21	0	1965	1985-11-14
42	1	Testing MySQL databases is a cool 	Must make it bug free for the customer	654321.4321	15.21	0	1965	1905-11-14
142	1	Testing MySQL databases is a cool 	Must make it bug free for the customer	654321.4321	15.21	0	1965	1995-11-14
412	1	Testing MySQL databases is a cool 	Must make it bug free for the customer	654321.4321	15.21	0	1965	2005-11-14
--- Update t1 on master --
UPDATE t1 SET b1 = 0, t="2006-02-22" WHERE id = 412;
--- Check the update on master --- 
SELECT id,hex(b1),vc,bc,d,f,total,y,t FROM t1 WHERE id = 412;
id	hex(b1)	vc	bc	d	f	total	y	t
412	0	Testing MySQL databases is a cool 	Must make it bug free for the customer	654321.4321	15.21	0	1965	2006-02-22
--- Check Update on slave ---
SELECT id,hex(b1),vc,bc,d,f,total,y,t FROM t1 WHERE id = 412;
id	hex(b1)	vc	bc	d	f	total	y	t
412	0	Testing MySQL databases is a cool 	Must make it bug free for the customer	654321.4321	15.21	0	1965	2006-02-22
--- Remove a record from t1 on master ---
DELETE FROM t1 WHERE id = 42;
--- Show current count on master for t1 ---
SELECT COUNT(*) FROM t1;
COUNT(*)
4
--- Show current count on slave for t1 --- 
SELECT COUNT(*) FROM t1;
COUNT(*)
4
DELETE FROM t1;
ALTER TABLE t1 MODIFY vc TEXT;
--- On master ---
SHOW CREATE TABLE t1;
Table	Create Table
t1	CREATE TABLE `t1` (
  `id` mediumint NOT NULL,
  `b1` bit(8) DEFAULT NULL,
  `vc` text,
  `bc` char(255) DEFAULT NULL,
  `d` decimal(10,4) DEFAULT '0.0000',
  `f` float DEFAULT '0',
  `total` bigint unsigned DEFAULT NULL,
  `y` year DEFAULT NULL,
  `t` date DEFAULT NULL
) ENGINE=ENGINE DEFAULT CHARSET=utf8mb4 COLLATE=utf8mb4_0900_ai_ci
/*!50100 PARTITION BY HASH (year(`t`))
PARTITIONS 4 */
--- On slave ---
include/rpl/sync_to_replica.inc
SHOW CREATE TABLE t1;
Table	Create Table
t1	CREATE TABLE `t1` (
  `id` mediumint NOT NULL,
  `b1` bit(8) DEFAULT NULL,
  `vc` text,
  `bc` char(255) DEFAULT NULL,
  `d` decimal(10,4) DEFAULT '0.0000',
  `f` float DEFAULT '0',
  `total` bigint unsigned DEFAULT NULL,
  `y` year DEFAULT NULL,
  `t` date DEFAULT NULL
) ENGINE=ENGINE DEFAULT CHARSET=utf8mb4 COLLATE=utf8mb4_0900_ai_ci
/*!50100 PARTITION BY HASH (year(`t`))
PARTITIONS 4 */
"--- Insert into t1 --" as "";
--- Select from t1 on master --- 
select id,hex(b1),vc,bc,d,f,total,y,t from t1 order by id;
id	hex(b1)	vc	bc	d	f	total	y	t
2	1	Testing MySQL databases is a cool 	Must make it bug free for the customer	654321.4321	15.21	0	1965	1965-11-14
4	1	Testing MySQL databases is a cool 	Must make it bug free for the customer	654321.4321	15.21	0	1965	1985-11-14
42	1	Testing MySQL databases is a cool 	Must make it bug free for the customer	654321.4321	15.21	0	1965	1905-11-14
142	1	Testing MySQL databases is a cool 	Must make it bug free for the customer	654321.4321	15.21	0	1965	1995-11-14
412	1	Testing MySQL databases is a cool 	Must make it bug free for the customer	654321.4321	15.21	0	1965	2005-11-14
--- Select from t1 on slave ---
select id,hex(b1),vc,bc,d,f,total,y,t from t1 order by id;
id	hex(b1)	vc	bc	d	f	total	y	t
2	1	Testing MySQL databases is a cool 	Must make it bug free for the customer	654321.4321	15.21	0	1965	1965-11-14
4	1	Testing MySQL databases is a cool 	Must make it bug free for the customer	654321.4321	15.21	0	1965	1985-11-14
42	1	Testing MySQL databases is a cool 	Must make it bug free for the customer	654321.4321	15.21	0	1965	1905-11-14
142	1	Testing MySQL databases is a cool 	Must make it bug free for the customer	654321.4321	15.21	0	1965	1995-11-14
412	1	Testing MySQL databases is a cool 	Must make it bug free for the customer	654321.4321	15.21	0	1965	2005-11-14
--- Update t1 on master --
UPDATE t1 SET b1 = 0, t="2006-02-22" WHERE id = 412;
--- Check the update on master --- 
SELECT id,hex(b1),vc,bc,d,f,total,y,t FROM t1 WHERE id = 412;
id	hex(b1)	vc	bc	d	f	total	y	t
412	0	Testing MySQL databases is a cool 	Must make it bug free for the customer	654321.4321	15.21	0	1965	2006-02-22
--- Check Update on slave ---
SELECT id,hex(b1),vc,bc,d,f,total,y,t FROM t1 WHERE id = 412;
id	hex(b1)	vc	bc	d	f	total	y	t
412	0	Testing MySQL databases is a cool 	Must make it bug free for the customer	654321.4321	15.21	0	1965	2006-02-22
--- Remove a record from t1 on master ---
DELETE FROM t1 WHERE id = 42;
--- Show current count on master for t1 ---
SELECT COUNT(*) FROM t1;
COUNT(*)
4
--- Show current count on slave for t1 --- 
SELECT COUNT(*) FROM t1;
COUNT(*)
4
DELETE FROM t1;
DROP TABLE IF EXISTS t1;
**** Partition by KEY ****
CREATE TABLE t1 (id MEDIUMINT NOT NULL, b1 BIT(8), vc VARCHAR(255), 
bc CHAR(255), d DECIMAL(10,4) DEFAULT 0, 
f FLOAT DEFAULT 0, total BIGINT UNSIGNED, 
y YEAR, t DATE,PRIMARY KEY(id))
PARTITION BY KEY() 
PARTITIONS 4;
--- On master ---
SHOW CREATE TABLE t1;
Table	Create Table
t1	CREATE TABLE `t1` (
  `id` mediumint NOT NULL,
  `b1` bit(8) DEFAULT NULL,
  `vc` varchar(255) DEFAULT NULL,
  `bc` char(255) DEFAULT NULL,
  `d` decimal(10,4) DEFAULT '0.0000',
  `f` float DEFAULT '0',
  `total` bigint unsigned DEFAULT NULL,
  `y` year DEFAULT NULL,
  `t` date DEFAULT NULL,
  PRIMARY KEY (`id`)
) ENGINE=ENGINE DEFAULT CHARSET=utf8mb4 COLLATE=utf8mb4_0900_ai_ci
/*!50100 PARTITION BY KEY ()
PARTITIONS 4 */
--- On slave ---
include/rpl/sync_to_replica.inc
SHOW CREATE TABLE t1;
Table	Create Table
t1	CREATE TABLE `t1` (
  `id` mediumint NOT NULL,
  `b1` bit(8) DEFAULT NULL,
  `vc` varchar(255) DEFAULT NULL,
  `bc` char(255) DEFAULT NULL,
  `d` decimal(10,4) DEFAULT '0.0000',
  `f` float DEFAULT '0',
  `total` bigint unsigned DEFAULT NULL,
  `y` year DEFAULT NULL,
  `t` date DEFAULT NULL,
  PRIMARY KEY (`id`)
) ENGINE=ENGINE DEFAULT CHARSET=utf8mb4 COLLATE=utf8mb4_0900_ai_ci
/*!50100 PARTITION BY KEY ()
PARTITIONS 4 */
"--- Insert into t1 --" as "";
--- Select from t1 on master --- 
select id,hex(b1),vc,bc,d,f,total,y,t from t1 order by id;
id	hex(b1)	vc	bc	d	f	total	y	t
2	1	Testing MySQL databases is a cool 	Must make it bug free for the customer	654321.4321	15.21	0	1965	1965-11-14
4	1	Testing MySQL databases is a cool 	Must make it bug free for the customer	654321.4321	15.21	0	1965	1985-11-14
42	1	Testing MySQL databases is a cool 	Must make it bug free for the customer	654321.4321	15.21	0	1965	1905-11-14
142	1	Testing MySQL databases is a cool 	Must make it bug free for the customer	654321.4321	15.21	0	1965	1995-11-14
412	1	Testing MySQL databases is a cool 	Must make it bug free for the customer	654321.4321	15.21	0	1965	2005-11-14
--- Select from t1 on slave ---
select id,hex(b1),vc,bc,d,f,total,y,t from t1 order by id;
id	hex(b1)	vc	bc	d	f	total	y	t
2	1	Testing MySQL databases is a cool 	Must make it bug free for the customer	654321.4321	15.21	0	1965	1965-11-14
4	1	Testing MySQL databases is a cool 	Must make it bug free for the customer	654321.4321	15.21	0	1965	1985-11-14
42	1	Testing MySQL databases is a cool 	Must make it bug free for the customer	654321.4321	15.21	0	1965	1905-11-14
142	1	Testing MySQL databases is a cool 	Must make it bug free for the customer	654321.4321	15.21	0	1965	1995-11-14
412	1	Testing MySQL databases is a cool 	Must make it bug free for the customer	654321.4321	15.21	0	1965	2005-11-14
--- Update t1 on master --
UPDATE t1 SET b1 = 0, t="2006-02-22" WHERE id = 412;
--- Check the update on master --- 
SELECT id,hex(b1),vc,bc,d,f,total,y,t FROM t1 WHERE id = 412;
id	hex(b1)	vc	bc	d	f	total	y	t
412	0	Testing MySQL databases is a cool 	Must make it bug free for the customer	654321.4321	15.21	0	1965	2006-02-22
--- Check Update on slave ---
SELECT id,hex(b1),vc,bc,d,f,total,y,t FROM t1 WHERE id = 412;
id	hex(b1)	vc	bc	d	f	total	y	t
412	0	Testing MySQL databases is a cool 	Must make it bug free for the customer	654321.4321	15.21	0	1965	2006-02-22
--- Remove a record from t1 on master ---
DELETE FROM t1 WHERE id = 42;
--- Show current count on master for t1 ---
SELECT COUNT(*) FROM t1;
COUNT(*)
4
--- Show current count on slave for t1 --- 
SELECT COUNT(*) FROM t1;
COUNT(*)
4
DELETE FROM t1;
ALTER TABLE t1 DROP PRIMARY KEY, ADD PRIMARY KEY(id, total);
--- On master ---
SHOW CREATE TABLE t1;
Table	Create Table
t1	CREATE TABLE `t1` (
  `id` mediumint NOT NULL,
  `b1` bit(8) DEFAULT NULL,
  `vc` varchar(255) DEFAULT NULL,
  `bc` char(255) DEFAULT NULL,
  `d` decimal(10,4) DEFAULT '0.0000',
  `f` float DEFAULT '0',
  `total` bigint unsigned NOT NULL,
  `y` year DEFAULT NULL,
  `t` date DEFAULT NULL,
  PRIMARY KEY (`id`,`total`)
) ENGINE=ENGINE DEFAULT CHARSET=utf8mb4 COLLATE=utf8mb4_0900_ai_ci
/*!50100 PARTITION BY KEY ()
PARTITIONS 4 */
--- On slave ---
include/rpl/sync_to_replica.inc
SHOW CREATE TABLE t1;
Table	Create Table
t1	CREATE TABLE `t1` (
  `id` mediumint NOT NULL,
  `b1` bit(8) DEFAULT NULL,
  `vc` varchar(255) DEFAULT NULL,
  `bc` char(255) DEFAULT NULL,
  `d` decimal(10,4) DEFAULT '0.0000',
  `f` float DEFAULT '0',
  `total` bigint unsigned NOT NULL,
  `y` year DEFAULT NULL,
  `t` date DEFAULT NULL,
  PRIMARY KEY (`id`,`total`)
) ENGINE=ENGINE DEFAULT CHARSET=utf8mb4 COLLATE=utf8mb4_0900_ai_ci
/*!50100 PARTITION BY KEY ()
PARTITIONS 4 */
"--- Insert into t1 --" as "";
--- Select from t1 on master --- 
select id,hex(b1),vc,bc,d,f,total,y,t from t1 order by id;
id	hex(b1)	vc	bc	d	f	total	y	t
2	1	Testing MySQL databases is a cool 	Must make it bug free for the customer	654321.4321	15.21	0	1965	1965-11-14
4	1	Testing MySQL databases is a cool 	Must make it bug free for the customer	654321.4321	15.21	0	1965	1985-11-14
42	1	Testing MySQL databases is a cool 	Must make it bug free for the customer	654321.4321	15.21	0	1965	1905-11-14
142	1	Testing MySQL databases is a cool 	Must make it bug free for the customer	654321.4321	15.21	0	1965	1995-11-14
412	1	Testing MySQL databases is a cool 	Must make it bug free for the customer	654321.4321	15.21	0	1965	2005-11-14
--- Select from t1 on slave ---
select id,hex(b1),vc,bc,d,f,total,y,t from t1 order by id;
id	hex(b1)	vc	bc	d	f	total	y	t
2	1	Testing MySQL databases is a cool 	Must make it bug free for the customer	654321.4321	15.21	0	1965	1965-11-14
4	1	Testing MySQL databases is a cool 	Must make it bug free for the customer	654321.4321	15.21	0	1965	1985-11-14
42	1	Testing MySQL databases is a cool 	Must make it bug free for the customer	654321.4321	15.21	0	1965	1905-11-14
142	1	Testing MySQL databases is a cool 	Must make it bug free for the customer	654321.4321	15.21	0	1965	1995-11-14
412	1	Testing MySQL databases is a cool 	Must make it bug free for the customer	654321.4321	15.21	0	1965	2005-11-14
--- Update t1 on master --
UPDATE t1 SET b1 = 0, t="2006-02-22" WHERE id = 412;
--- Check the update on master --- 
SELECT id,hex(b1),vc,bc,d,f,total,y,t FROM t1 WHERE id = 412;
id	hex(b1)	vc	bc	d	f	total	y	t
412	0	Testing MySQL databases is a cool 	Must make it bug free for the customer	654321.4321	15.21	0	1965	2006-02-22
--- Check Update on slave ---
SELECT id,hex(b1),vc,bc,d,f,total,y,t FROM t1 WHERE id = 412;
id	hex(b1)	vc	bc	d	f	total	y	t
412	0	Testing MySQL databases is a cool 	Must make it bug free for the customer	654321.4321	15.21	0	1965	2006-02-22
--- Remove a record from t1 on master ---
DELETE FROM t1 WHERE id = 42;
--- Show current count on master for t1 ---
SELECT COUNT(*) FROM t1;
COUNT(*)
4
--- Show current count on slave for t1 --- 
SELECT COUNT(*) FROM t1;
COUNT(*)
4
DELETE FROM t1;
ALTER TABLE t1 MODIFY vc TEXT;
--- On master ---
SHOW CREATE TABLE t1;
Table	Create Table
t1	CREATE TABLE `t1` (
  `id` mediumint NOT NULL,
  `b1` bit(8) DEFAULT NULL,
  `vc` text,
  `bc` char(255) DEFAULT NULL,
  `d` decimal(10,4) DEFAULT '0.0000',
  `f` float DEFAULT '0',
  `total` bigint unsigned NOT NULL,
  `y` year DEFAULT NULL,
  `t` date DEFAULT NULL,
  PRIMARY KEY (`id`,`total`)
) ENGINE=ENGINE DEFAULT CHARSET=utf8mb4 COLLATE=utf8mb4_0900_ai_ci
/*!50100 PARTITION BY KEY ()
PARTITIONS 4 */
--- On slave ---
include/rpl/sync_to_replica.inc
SHOW CREATE TABLE t1;
Table	Create Table
t1	CREATE TABLE `t1` (
  `id` mediumint NOT NULL,
  `b1` bit(8) DEFAULT NULL,
  `vc` text,
  `bc` char(255) DEFAULT NULL,
  `d` decimal(10,4) DEFAULT '0.0000',
  `f` float DEFAULT '0',
  `total` bigint unsigned NOT NULL,
  `y` year DEFAULT NULL,
  `t` date DEFAULT NULL,
  PRIMARY KEY (`id`,`total`)
) ENGINE=ENGINE DEFAULT CHARSET=utf8mb4 COLLATE=utf8mb4_0900_ai_ci
/*!50100 PARTITION BY KEY ()
PARTITIONS 4 */
"--- Insert into t1 --" as "";
--- Select from t1 on master --- 
select id,hex(b1),vc,bc,d,f,total,y,t from t1 order by id;
id	hex(b1)	vc	bc	d	f	total	y	t
2	1	Testing MySQL databases is a cool 	Must make it bug free for the customer	654321.4321	15.21	0	1965	1965-11-14
4	1	Testing MySQL databases is a cool 	Must make it bug free for the customer	654321.4321	15.21	0	1965	1985-11-14
42	1	Testing MySQL databases is a cool 	Must make it bug free for the customer	654321.4321	15.21	0	1965	1905-11-14
142	1	Testing MySQL databases is a cool 	Must make it bug free for the customer	654321.4321	15.21	0	1965	1995-11-14
412	1	Testing MySQL databases is a cool 	Must make it bug free for the customer	654321.4321	15.21	0	1965	2005-11-14
--- Select from t1 on slave ---
select id,hex(b1),vc,bc,d,f,total,y,t from t1 order by id;
id	hex(b1)	vc	bc	d	f	total	y	t
2	1	Testing MySQL databases is a cool 	Must make it bug free for the customer	654321.4321	15.21	0	1965	1965-11-14
4	1	Testing MySQL databases is a cool 	Must make it bug free for the customer	654321.4321	15.21	0	1965	1985-11-14
42	1	Testing MySQL databases is a cool 	Must make it bug free for the customer	654321.4321	15.21	0	1965	1905-11-14
142	1	Testing MySQL databases is a cool 	Must make it bug free for the customer	654321.4321	15.21	0	1965	1995-11-14
412	1	Testing MySQL databases is a cool 	Must make it bug free for the customer	654321.4321	15.21	0	1965	2005-11-14
--- Update t1 on master --
UPDATE t1 SET b1 = 0, t="2006-02-22" WHERE id = 412;
--- Check the update on master --- 
SELECT id,hex(b1),vc,bc,d,f,total,y,t FROM t1 WHERE id = 412;
id	hex(b1)	vc	bc	d	f	total	y	t
412	0	Testing MySQL databases is a cool 	Must make it bug free for the customer	654321.4321	15.21	0	1965	2006-02-22
--- Check Update on slave ---
SELECT id,hex(b1),vc,bc,d,f,total,y,t FROM t1 WHERE id = 412;
id	hex(b1)	vc	bc	d	f	total	y	t
412	0	Testing MySQL databases is a cool 	Must make it bug free for the customer	654321.4321	15.21	0	1965	2006-02-22
--- Remove a record from t1 on master ---
DELETE FROM t1 WHERE id = 42;
--- Show current count on master for t1 ---
SELECT COUNT(*) FROM t1;
COUNT(*)
4
--- Show current count on slave for t1 --- 
SELECT COUNT(*) FROM t1;
COUNT(*)
4
DELETE FROM t1;
DROP TABLE IF EXISTS t1;
include/rpl/deinit.inc
