include/rpl/init_source_replica.inc
Warnings:
Note	####	Sending passwords in plain text without SSL/TLS is extremely insecure.
Note	####	Storing MySQL user name or password information in the connection metadata repository is not secure and is therefore not recommended. Please consider using the USER and PASSWORD connection options for START REPLICA; see the 'START REPLICA Syntax' in the MySQL Manual for more information.
[connection master]
[connection slave]
include/rpl/stop_replica.inc
SET GLOBAL innodb_lock_wait_timeout = 300;
SET GLOBAL replica_parallel_workers = 4;
include/rpl/start_replica.inc
[connection master]
CREATE DATABASE db1;
CREATE DATABASE db2;
CREATE DATABASE db3;
CREATE TABLE db1.t1 (c1 INT PRIMARY KEY);
CREATE TABLE db2.t1 (c1 INT PRIMARY KEY);
CREATE TABLE db3.t1 (c1 INT PRIMARY KEY);
BEGIN;
INSERT INTO db1.t1 VALUES (1);
INSERT INTO db2.t1 VALUES (1);
INSERT INTO db3.t1 VALUES (1);
COMMIT;
include/rpl/sync_to_replica.inc
[connection slave]
BEGIN;
SELECT * FROM db1.t1 WHERE c1 = 1 FOR UPDATE;
c1
1
[connection slave1]
BEGIN;
SELECT * FROM db3.t1 WHERE c1 = 1 FOR UPDATE;
c1
1
[connection master]
BEGIN;
UPDATE db1.t1 SET c1 = 100 WHERE c1 = 1;
COMMIT;
UPDATE db2.t1 SET c1 = 100 WHERE c1 = 1;
BEGIN;
UPDATE db1.t1 SET c1 = 1000 WHERE c1 = 100;
UPDATE db3.t1 SET c1 = 100 WHERE c1 = 1;
COMMIT;
[connection slave]
[connection slave]
ROLLBACK;
[connection slave1]
ROLLBACK;
[connection slave]
[connection master]
DROP DATABASE db1;
DROP DATABASE db2;
DROP DATABASE db3;
include/rpl/reset.inc
[connection slave]
include/rpl/stop_replica.inc
include/rpl/start_replica.inc
[connection master]
CREATE TABLE t1 (c1 INT PRIMARY KEY);
INSERT INTO t1 VALUES (1), (2), (3);
include/rpl/sync_to_replica.inc
[connection slave]
CREATE TABLE `exists_only_on_replica` (c1 INT);
BEGIN;
INSERT INTO exists_only_on_replica VALUES (1);
[connection slave1]
BEGIN;
SELECT * FROM t1 FOR UPDATE;
c1
1
2
3
[connection master]
UPDATE t1 SET c1 = 100 WHERE c1 = 1;
UPDATE t1 SET c1 = 200 WHERE c1 = 2;
UPDATE t1 SET c1 = 300 WHERE c1 = 3;
DROP TABLE IF EXISTS `exists_only_on_replica`;
Warnings:
Note	1051	Unknown table 'test.exists_only_on_replica'
[connection slave]
[connection slave1]
ROLLBACK;
[connection slave]
include/assert.inc [Assert that table `exists_only_on_replica` still exists]
ROLLBACK;
include/assert.inc [Assert that table `exists_only_on_replica` is no more]
[connection master]
DROP TABLE t1;
include/rpl/sync_to_replica.inc
[connection slave]
include/rpl/stop_replica.inc
include/rpl/start_replica.inc
[connection master]
include/rpl/reset.inc
[connection slave]
include/rpl/stop_replica.inc
SET GLOBAL innodb_lock_wait_timeout = SAVED_INNODB_LOCK_WAIT_TIMEOUT;
SET GLOBAL replica_parallel_workers = SAVED_REPLICA_PARALLEL_WORKERS;;
include/rpl/start_replica.inc
include/rpl/deinit.inc
