include/rpl/init_source_replica.inc
Warnings:
Note	####	Sending passwords in plain text without SSL/TLS is extremely insecure.
Note	####	Storing MySQL user name or password information in the connection metadata repository is not secure and is therefore not recommended. Please consider using the USER and PASSWORD connection options for START REPLICA; see the 'START REPLICA Syntax' in the MySQL Manual for more information.
[connection master]
call mtr.add_suppression("Can.t find record in .t[12].* Error_code: MY-001032");
call mtr.add_suppression("Cannot delete or update a parent row: a foreign key constraint fails .* Error_code: MY-001451");
call mtr.add_suppression("Cannot add or update a child row: a foreign key constraint fails .* Error_code: MY-001452");
call mtr.add_suppression("Duplicate entry '1' for key 'ti1.PRIMARY'.* Error_code: MY-001062.*");
call mtr.add_suppression("The replica coordinator and worker threads are stopped, possibly leaving data in inconsistent state");
include/rpl/reset.inc
set @old_replica_exec_mode= @@global.replica_exec_mode;
set @@global.replica_exec_mode= IDEMPOTENT;
create table ti1 (b int primary key) engine = innodb;
create table ti2 (a int primary key, b int, foreign key (b) references ti1(b))
engine = innodb;
set foreign_key_checks=1 /* ensure the check */;
insert into ti1 values (1),(2),(3);
insert into ti2 set a=2, b=2;
include/rpl/sync_to_replica.inc
select * from ti1 order by b /* must be (1),(2),(3) */;
b
1
2
3
insert into ti2 set a=1, b=1;
select * from ti2 order by b /* must be (1,1) (2,2) */;
a	b
1	1
2	2
set @save_binlog_format= @@session.binlog_format;
Warnings:
Warning	1287	'@@binlog_format' is deprecated and will be removed in a future release.
set @@session.binlog_format= 'row';
Warnings:
Warning	1287	'@@binlog_format' is deprecated and will be removed in a future release.
delete from ti1 where b=1;
select * from ti1 order by b /* must be (2),(3) */;
b
2
3
include/rpl/sync_to_replica.inc
select * from ti1 order by b /* must stays as were on master (1),(2),(3) */;
b
1
2
3
delete from ti1 where b=3;
insert into ti2 set a=3, b=3;
include/rpl/sync_to_replica.inc
select * from ti2 order by b /* must be (1,1),(2,2) - not inserted */;
a	b
1	1
2	2
set global replica_exec_mode='IDEMPOTENT';
set global replica_exec_mode='STRICT';
set global replica_exec_mode='IDEMPOTENT,STRICT';
ERROR 42000: Variable 'replica_exec_mode' can't be set to the value of 'IDEMPOTENT,STRICT'
select @@global.replica_exec_mode /* must be STRICT */;
@@global.replica_exec_mode
STRICT
*** foreign keys errors as above now forces to stop
set foreign_key_checks=0;
drop table ti2, ti1;
create table ti1 (b int primary key) engine = innodb;
create table ti2 (a int primary key, b int, foreign key (b) references ti1(b))
engine = innodb;
set foreign_key_checks=1 /* ensure the check */;
insert into ti1 values (1),(2),(3);
insert into ti2 set a=2, b=2;
include/rpl/sync_to_replica.inc
select * from ti1 order by b /* must be (1),(2),(3) */;
b
1
2
3
*** conspire future problem
insert into ti2 set a=1, b=1;
select * from ti2 order by b /* must be (1,1) (2,2) */;
a	b
1	1
2	2
delete from ti1 where b=1 /* offending delete event */;
select * from ti1 order by b /* must be (2),(3) */;
b
2
3
*** slave must stop (Trying to delete a referenced foreing key)
include/rpl/wait_for_applier_to_stop.inc
Last_SQL_Error
1451
select * from ti1 order by b /* must be (1),(2),(3) - not deleted */;
b
1
2
3
set foreign_key_checks= 0;
delete from ti2 where b=1;
set foreign_key_checks= 1;
set global replica_exec_mode='IDEMPOTENT';
START REPLICA sql_thread;
include/rpl/sync_to_replica.inc
set global replica_exec_mode='STRICT';
include/rpl/sync_to_replica.inc
*** conspire the following insert failure
*** conspire future problem
delete from ti1 where b=3;
insert into ti2 set a=3, b=3 /* offending write event */;
*** slave must stop (Trying to insert an invalid foreign key)
include/rpl/wait_for_applier_to_stop.inc
Last_SQL_Error
1452
select * from ti2 order by b /* must be (2,2) */;
a	b
2	2
set foreign_key_checks= 0;
insert into ti1 set b=3;
set foreign_key_checks= 1;
set global replica_exec_mode='IDEMPOTENT';
START REPLICA sql_thread;
include/rpl/sync_to_replica.inc
set global replica_exec_mode='STRICT';
include/rpl/sync_to_replica.inc
select * from ti2 order by b /* must be (2,2),(3,3) */;
a	b
2	2
3	3
*** other errors
*** conspiring query
insert into ti1 set b=1;
insert into ti1 set b=1 /* offending write event */;
*** slave must stop (Trying to insert a dupliacte key)
include/rpl/wait_for_applier_to_stop.inc
Last_SQL_Error
1062
set foreign_key_checks= 0;
delete from ti1 where b=1;
set foreign_key_checks= 1;
set global replica_exec_mode='IDEMPOTENT';
START REPLICA sql_thread;
include/rpl/sync_to_replica.inc
set global replica_exec_mode='STRICT';
CREATE TABLE t1 (a INT PRIMARY KEY);
CREATE TABLE t2 (a INT);
INSERT INTO t1 VALUES (-1),(-2),(-3);
INSERT INTO t2 VALUES (-1),(-2),(-3);
include/rpl/sync_to_replica.inc
DELETE FROM t1 WHERE a = -2;
DELETE FROM t2 WHERE a = -2;
DELETE FROM t1 WHERE a = -2;
*** slave must stop (Key was not found)
include/rpl/wait_for_applier_to_stop.inc
Last_SQL_Error
1032
set global replica_exec_mode='IDEMPOTENT';
START REPLICA sql_thread;
include/rpl/sync_to_replica.inc
set global replica_exec_mode='STRICT';
DELETE FROM t2 WHERE a = -2;
*** slave must stop (Key was not found)
include/rpl/wait_for_applier_to_stop.inc
Last_SQL_Error
1032
set global replica_exec_mode='IDEMPOTENT';
START REPLICA sql_thread;
include/rpl/sync_to_replica.inc
set global replica_exec_mode='STRICT';
UPDATE t1 SET a = 1 WHERE a = -1;
UPDATE t2 SET a = 1 WHERE a = -1;
UPDATE t1 SET a = 1 WHERE a = -1;
*** slave must stop (Key was not found)
include/rpl/wait_for_applier_to_stop.inc
Last_SQL_Error
1032
set global replica_exec_mode='IDEMPOTENT';
START REPLICA sql_thread;
include/rpl/sync_to_replica.inc
set global replica_exec_mode='STRICT';
UPDATE t2 SET a = 1 WHERE a = -1;
*** slave must stop (Key was not found)
include/rpl/wait_for_applier_to_stop.inc
Last_SQL_Error
1032
set global replica_exec_mode='IDEMPOTENT';
START REPLICA sql_thread;
include/rpl/sync_to_replica.inc
SET @@global.replica_exec_mode= @old_replica_exec_mode;
drop table t1,t2,ti2,ti1;
include/rpl/sync_to_replica.inc
set @@global.replica_exec_mode= @old_replica_exec_mode;
*** end of tests
include/rpl/deinit.inc
