include/only_with_option.inc [GLOBAL.replica_transaction_retries > 2]
#
# 1. Create source-replica topology
include/rpl/init_source_replica.inc
Warnings:
Note	####	Sending passwords in plain text without SSL/TLS is extremely insecure.
Note	####	Storing MySQL user name or password information in the connection metadata repository is not secure and is therefore not recommended. Please consider using the USER and PASSWORD connection options for START REPLICA; see the 'START REPLICA Syntax' in the MySQL Manual for more information.
[connection master]
[connection slave]
SET GLOBAL innodb_lock_wait_timeout = 2;
CALL mtr.add_suppression("Replica SQL for channel.*Consider raising the value of the replica_transaction_retries variable.*");
CALL mtr.add_suppression("Replica SQL for channel.*The replica coordinator and worker threads are stopped.*");
# 2. For each rows scan algorithm 
#
# 2.0 Configure source and replica
[connection master]
CREATE TABLE t1 (a INT PRIMARY KEY, b INT) ENGINE=innodb;
INSERT INTO t1 VALUES (10, 10), (20, 20);
include/rpl/sync_to_replica.inc
#
# 2.1 Stop replica
include/rpl/stop_replica.inc
#
# 2.2 Execute DELETE transaction on source
[connection master]
BEGIN;
DELETE FROM t1;
COMMIT;
#
# 2.3 Begin SELECT ... FOR UPDATE on replica
[connection slave]
BEGIN;
SELECT * FROM t1 WHERE b = 20 FOR UPDATE;
a	b
20	20
#
# 2.4 Start replica from another connection
[connection slave1]
include/rpl/start_replica.inc
#
# 2.5 Wait until the applier retries:'count_transactions_retries' will be
#    incremented
[connection slave]
#
# 2.6 Commit SELECT ... FOR UPDATE on replica
COMMIT;
SHOW STATUS LIKE 'Replica_rows_last_search_algorithm_used';
Variable_name	Value
Replica_rows_last_search_algorithm_used	INDEX_SCAN
#
# 2.7 Restart replica applier
include/rpl/stop_applier.inc
include/rpl/start_applier.inc
[connection master]
DROP TABLE t1;
include/rpl/sync_to_replica.inc
#
# 2.0 Configure source and replica
[connection master]
CREATE TABLE t1 (a INT, b INT, key(a)) ENGINE=innodb;
INSERT INTO t1 VALUES (10, 10), (20, 20);
include/rpl/sync_to_replica.inc
#
# 2.1 Stop replica
include/rpl/stop_replica.inc
#
# 2.2 Execute DELETE transaction on source
[connection master]
BEGIN;
DELETE FROM t1;
COMMIT;
#
# 2.3 Begin SELECT ... FOR UPDATE on replica
[connection slave]
BEGIN;
SELECT * FROM t1 WHERE b = 20 FOR UPDATE;
a	b
20	20
#
# 2.4 Start replica from another connection
[connection slave1]
include/rpl/start_replica.inc
#
# 2.5 Wait until the applier retries:'count_transactions_retries' will be
#    incremented
[connection slave]
#
# 2.6 Commit SELECT ... FOR UPDATE on replica
COMMIT;
SHOW STATUS LIKE 'Replica_rows_last_search_algorithm_used';
Variable_name	Value
Replica_rows_last_search_algorithm_used	HASH_SCAN
#
# 2.7 Restart replica applier
include/rpl/stop_applier.inc
include/rpl/start_applier.inc
[connection master]
DROP TABLE t1;
include/rpl/sync_to_replica.inc
#
# 2.0 Configure source and replica
[connection master]
CREATE TABLE t1 (a INT, b INT, KEY(a), KEY(b)) ENGINE=innodb;
INSERT INTO t1 VALUES (10, 10), (10, 20), (10, 30), (20, 10), (20, 20);
include/rpl/sync_to_replica.inc
#
# 2.1 Stop replica
include/rpl/stop_replica.inc
#
# 2.2 Execute DELETE transaction on source
[connection master]
BEGIN;
DELETE FROM t1;
COMMIT;
#
# 2.3 Begin SELECT ... FOR UPDATE on replica
[connection slave]
BEGIN;
SELECT * FROM t1 WHERE b = 20 FOR UPDATE;
a	b
10	20
20	20
#
# 2.4 Start replica from another connection
[connection slave1]
include/rpl/start_replica.inc
#
# 2.5 Wait until the applier retries:'count_transactions_retries' will be
#    incremented
[connection slave]
#
# 2.6 Commit SELECT ... FOR UPDATE on replica
COMMIT;
SHOW STATUS LIKE 'Replica_rows_last_search_algorithm_used';
Variable_name	Value
Replica_rows_last_search_algorithm_used	HASH_SCAN
#
# 2.7 Restart replica applier
include/rpl/stop_applier.inc
include/rpl/start_applier.inc
[connection master]
DROP TABLE t1;
include/rpl/sync_to_replica.inc
#
# 2.0 Configure source and replica
[connection master]
CREATE TABLE t1 (a INT, b INT) ENGINE=innodb;
INSERT INTO t1 VALUES (10, 10), (20, 20);
include/rpl/sync_to_replica.inc
#
# 2.1 Stop replica
include/rpl/stop_replica.inc
#
# 2.2 Execute DELETE transaction on source
[connection master]
BEGIN;
DELETE FROM t1;
COMMIT;
#
# 2.3 Begin SELECT ... FOR UPDATE on replica
[connection slave]
BEGIN;
SELECT * FROM t1 WHERE b = 20 FOR UPDATE;
a	b
20	20
#
# 2.4 Start replica from another connection
[connection slave1]
include/rpl/start_replica.inc
#
# 2.5 Wait until the applier retries:'count_transactions_retries' will be
#    incremented
[connection slave]
#
# 2.6 Commit SELECT ... FOR UPDATE on replica
COMMIT;
SHOW STATUS LIKE 'Replica_rows_last_search_algorithm_used';
Variable_name	Value
Replica_rows_last_search_algorithm_used	HASH_SCAN
#
# 2.7 Restart replica applier
include/rpl/stop_applier.inc
include/rpl/start_applier.inc
[connection master]
DROP TABLE t1;
include/rpl/sync_to_replica.inc
#
# 3. Clean up
[connection slave]
SET GLOBAL innodb_lock_wait_timeout = INNODB_LOCK_WAIT_TIMEOUT;
include/rpl/deinit.inc
