stop slave;
drop table if exists t1,t2,t3,t4,t5,t6,t7,t8,t9;
reset master;
reset slave;
drop table if exists t1,t2,t3,t4,t5,t6,t7,t8,t9;
start slave;
==== Initialize ====
[on master]
CREATE TABLE t1(a INT PRIMARY KEY);
[on slave]
==== Test: SQL thread sees 'INSERT' of existing key ====
---- Prepare slave so that it will get duplicate key error ----
INSERT INTO t1 VALUES (1);
---- Insert rows on master ----
[on master]
INSERT INTO t1 VALUES (1);
SELECT * FROM t1;
a
1
[on slave]
---- Wait until slave stops with an error ----
Last_SQL_Error = Error 'Duplicate entry '1' for key 'PRIMARY'' on query. Default database: 'test'. Query: 'INSERT INTO t1 VALUES (1)' (expected "duplicate key" error)
SELECT * FROM t1;
a
1
---- Resolve the conflict on the slave and restart SQL thread ----
DELETE FROM t1 WHERE a = 1;
START SLAVE SQL_THREAD;
---- Sync slave and verify that there is no error ----
Last_SQL_Error = '' (expected no error)
SELECT * FROM t1;
a
1
==== Test: SQL thread sees 'DELETE' of non-existing row ====
---- On master, insert two rows, the second with binlogging off ----
[on master]
DELETE FROM t1;
INSERT INTO t1 VALUES (1);
[on slave]
DELETE FROM t1 WHERE a = 1;
---- On master, remove the row that does not exist on slave ----
[on master]
DELETE FROM t1 WHERE a = 1;
SELECT * FROM t1;
a
[on slave]
---- Sync slave and verify that there is no error ----
Last_SQL_Error =  (expected no error)
SELECT * FROM t1;
a
==== Clean up ====
[on master]
DROP TABLE t1;
[on slave]
