DROP TABLE IF EXISTS t1,t2,t3;
CREATE TABLE t1(c1 CHAR(10) NOT NULL);
CREATE TABLE t2(c1 CHAR(10) NOT NULL);
INSERT INTO t2 (c1) VALUES('a'),('aaa'),('b'),('b'),('bb'),('bbb'),('c');
CREATE TABLE t3(c1 CHAR(10) NOT NULL);
INSERT INTO t3 (c1) VALUES('a');
SELECT COUNT(c1) FROM t1;
COUNT(c1)
0
DELETE FROM t1 WHERE c1 = 'a';
SELECT COUNT(c1) FROM t1 WHERE c1 = 'a';
COUNT(c1)
0
SELECT COUNT(c1) FROM t1;
COUNT(c1)
0
DROP TABLE t1,t2,t3;
CREATE TABLE t1(c1 VARCHAR(10) NOT NULL);
CREATE TABLE t2(c1 VARCHAR(10) NOT NULL);
INSERT INTO t2 (c1) VALUES('a'),('aaa'),('b'),('b'),('bb'),('bbb'),('c');
CREATE TABLE t3(c1 VARCHAR(10) NOT NULL);
INSERT INTO t3 (c1) VALUES('a');
SELECT COUNT(c1) FROM t1;
COUNT(c1)
0
DELETE FROM t1 WHERE c1 = 'a';
SELECT COUNT(c1) FROM t1 WHERE c1 = 'a';
COUNT(c1)
0
SELECT COUNT(c1) FROM t1;
COUNT(c1)
0
DROP TABLE t1,t2,t3;
CREATE TABLE t1(c1 BINARY(10) NOT NULL);
CREATE TABLE t2(c1 BINARY(10) NOT NULL);
INSERT INTO t2 (c1) VALUES('a'),('aaa'),('b'),('b'),('bb'),('bbb'),('c');
CREATE TABLE t3(c1 BINARY(10) NOT NULL);
INSERT INTO t3 (c1) VALUES('a');
SELECT COUNT(c1) FROM t1;
COUNT(c1)
0
DELETE FROM t1 WHERE c1 = 'a';
SELECT COUNT(c1) FROM t1 WHERE c1 = 'a';
COUNT(c1)
0
SELECT COUNT(c1) FROM t1;
COUNT(c1)
0
DROP TABLE t1,t2,t3;
CREATE TABLE t1(c1 VARBINARY(10) NOT NULL);
CREATE TABLE t2(c1 VARBINARY(10) NOT NULL);
INSERT INTO t2 (c1) VALUES('a'),('aaa'),('b'),('b'),('bb'),('bbb'),('c');
CREATE TABLE t3(c1 VARBINARY(10) NOT NULL);
INSERT INTO t3 (c1) VALUES('a');
SELECT COUNT(c1) FROM t1;
COUNT(c1)
0
DELETE FROM t1 WHERE c1 = 'a';
SELECT COUNT(c1) FROM t1 WHERE c1 = 'a';
COUNT(c1)
0
SELECT COUNT(c1) FROM t1;
COUNT(c1)
0
DROP TABLE t1,t2,t3;
CREATE TABLE t1(c1 CHAR(10) NOT NULL);
CREATE TABLE t2(c1 CHAR(10) NOT NULL);
INSERT INTO t2 (c1) VALUES('a'),('aaa'),('b'),('b'),('bb'),('bbb'),('c');
CREATE TABLE t3(c1 CHAR(10) NOT NULL);
INSERT INTO t3 (c1) VALUES('a');
SELECT COUNT(c1) FROM t2;
COUNT(c1)
7
DELETE FROM t2 WHERE c1 = 'a';
SELECT COUNT(c1) FROM t2 WHERE c1 = 'a';
COUNT(c1)
0
SELECT COUNT(c1) FROM t2;
COUNT(c1)
6
DROP TABLE t1,t2,t3;
CREATE TABLE t1(c1 VARCHAR(10) NOT NULL);
CREATE TABLE t2(c1 VARCHAR(10) NOT NULL);
INSERT INTO t2 (c1) VALUES('a'),('aaa'),('b'),('b'),('bb'),('bbb'),('c');
CREATE TABLE t3(c1 VARCHAR(10) NOT NULL);
INSERT INTO t3 (c1) VALUES('a');
SELECT COUNT(c1) FROM t2;
COUNT(c1)
7
DELETE FROM t2 WHERE c1 = 'a';
SELECT COUNT(c1) FROM t2 WHERE c1 = 'a';
COUNT(c1)
0
SELECT COUNT(c1) FROM t2;
COUNT(c1)
6
DROP TABLE t1,t2,t3;
CREATE TABLE t1(c1 BINARY(10) NOT NULL);
CREATE TABLE t2(c1 BINARY(10) NOT NULL);
INSERT INTO t2 (c1) VALUES('a'),('aaa'),('b'),('b'),('bb'),('bbb'),('c');
CREATE TABLE t3(c1 BINARY(10) NOT NULL);
INSERT INTO t3 (c1) VALUES('a');
SELECT COUNT(c1) FROM t2;
COUNT(c1)
7
DELETE FROM t2 WHERE c1 = 'a';
SELECT COUNT(c1) FROM t2 WHERE c1 = 'a';
COUNT(c1)
0
SELECT COUNT(c1) FROM t2;
COUNT(c1)
7
DROP TABLE t1,t2,t3;
CREATE TABLE t1(c1 VARBINARY(10) NOT NULL);
CREATE TABLE t2(c1 VARBINARY(10) NOT NULL);
INSERT INTO t2 (c1) VALUES('a'),('aaa'),('b'),('b'),('bb'),('bbb'),('c');
CREATE TABLE t3(c1 VARBINARY(10) NOT NULL);
INSERT INTO t3 (c1) VALUES('a');
SELECT COUNT(c1) FROM t2;
COUNT(c1)
7
DELETE FROM t2 WHERE c1 = 'a';
SELECT COUNT(c1) FROM t2 WHERE c1 = 'a';
COUNT(c1)
0
SELECT COUNT(c1) FROM t2;
COUNT(c1)
6
DROP TABLE t1,t2,t3;
CREATE TABLE t1(c1 CHAR(10) NOT NULL);
CREATE TABLE t2(c1 CHAR(10) NOT NULL);
INSERT INTO t2 (c1) VALUES('a'),('aaa'),('b'),('b'),('bb'),('bbb'),('c');
CREATE TABLE t3(c1 CHAR(10) NOT NULL);
INSERT INTO t3 (c1) VALUES('a');
SELECT COUNT(c1) FROM t3;
COUNT(c1)
1
DELETE FROM t3 WHERE c1 = 'a';
SELECT COUNT(c1) FROM t3 WHERE c1 = 'a';
COUNT(c1)
0
SELECT COUNT(c1) FROM t3;
COUNT(c1)
0
DROP TABLE t1,t2,t3;
CREATE TABLE t1(c1 VARCHAR(10) NOT NULL);
CREATE TABLE t2(c1 VARCHAR(10) NOT NULL);
INSERT INTO t2 (c1) VALUES('a'),('aaa'),('b'),('b'),('bb'),('bbb'),('c');
CREATE TABLE t3(c1 VARCHAR(10) NOT NULL);
INSERT INTO t3 (c1) VALUES('a');
SELECT COUNT(c1) FROM t3;
COUNT(c1)
1
DELETE FROM t3 WHERE c1 = 'a';
SELECT COUNT(c1) FROM t3 WHERE c1 = 'a';
COUNT(c1)
0
SELECT COUNT(c1) FROM t3;
COUNT(c1)
0
DROP TABLE t1,t2,t3;
CREATE TABLE t1(c1 BINARY(10) NOT NULL);
CREATE TABLE t2(c1 BINARY(10) NOT NULL);
INSERT INTO t2 (c1) VALUES('a'),('aaa'),('b'),('b'),('bb'),('bbb'),('c');
CREATE TABLE t3(c1 BINARY(10) NOT NULL);
INSERT INTO t3 (c1) VALUES('a');
SELECT COUNT(c1) FROM t3;
COUNT(c1)
1
DELETE FROM t3 WHERE c1 = 'a';
SELECT COUNT(c1) FROM t3 WHERE c1 = 'a';
COUNT(c1)
0
SELECT COUNT(c1) FROM t3;
COUNT(c1)
1
DROP TABLE t1,t2,t3;
CREATE TABLE t1(c1 VARBINARY(10) NOT NULL);
CREATE TABLE t2(c1 VARBINARY(10) NOT NULL);
INSERT INTO t2 (c1) VALUES('a'),('aaa'),('b'),('b'),('bb'),('bbb'),('c');
CREATE TABLE t3(c1 VARBINARY(10) NOT NULL);
INSERT INTO t3 (c1) VALUES('a');
SELECT COUNT(c1) FROM t3;
COUNT(c1)
1
DELETE FROM t3 WHERE c1 = 'a';
SELECT COUNT(c1) FROM t3 WHERE c1 = 'a';
COUNT(c1)
0
SELECT COUNT(c1) FROM t3;
COUNT(c1)
0
DROP TABLE t1,t2,t3;
CREATE TABLE t1(c1 CHAR(10) NOT NULL);
CREATE TABLE t2(c1 CHAR(10) NOT NULL);
INSERT INTO t2 (c1) VALUES('a'),('aaa'),('b'),('b'),('bb'),('bbb'),('c');
CREATE TABLE t3(c1 CHAR(10) NOT NULL);
INSERT INTO t3 (c1) VALUES('a');
SELECT COUNT(c1) FROM t1;
COUNT(c1)
0
DELETE FROM t1 WHERE c1 = 'b';
SELECT COUNT(c1) FROM t1 WHERE c1 = 'b';
COUNT(c1)
0
SELECT COUNT(c1) FROM t1;
COUNT(c1)
0
DROP TABLE t1,t2,t3;
CREATE TABLE t1(c1 VARCHAR(10) NOT NULL);
CREATE TABLE t2(c1 VARCHAR(10) NOT NULL);
INSERT INTO t2 (c1) VALUES('a'),('aaa'),('b'),('b'),('bb'),('bbb'),('c');
CREATE TABLE t3(c1 VARCHAR(10) NOT NULL);
INSERT INTO t3 (c1) VALUES('a');
SELECT COUNT(c1) FROM t1;
COUNT(c1)
0
DELETE FROM t1 WHERE c1 = 'b';
SELECT COUNT(c1) FROM t1 WHERE c1 = 'b';
COUNT(c1)
0
SELECT COUNT(c1) FROM t1;
COUNT(c1)
0
DROP TABLE t1,t2,t3;
CREATE TABLE t1(c1 BINARY(10) NOT NULL);
CREATE TABLE t2(c1 BINARY(10) NOT NULL);
INSERT INTO t2 (c1) VALUES('a'),('aaa'),('b'),('b'),('bb'),('bbb'),('c');
CREATE TABLE t3(c1 BINARY(10) NOT NULL);
INSERT INTO t3 (c1) VALUES('a');
SELECT COUNT(c1) FROM t1;
COUNT(c1)
0
DELETE FROM t1 WHERE c1 = 'b';
SELECT COUNT(c1) FROM t1 WHERE c1 = 'b';
COUNT(c1)
0
SELECT COUNT(c1) FROM t1;
COUNT(c1)
0
DROP TABLE t1,t2,t3;
CREATE TABLE t1(c1 VARBINARY(10) NOT NULL);
CREATE TABLE t2(c1 VARBINARY(10) NOT NULL);
INSERT INTO t2 (c1) VALUES('a'),('aaa'),('b'),('b'),('bb'),('bbb'),('c');
CREATE TABLE t3(c1 VARBINARY(10) NOT NULL);
INSERT INTO t3 (c1) VALUES('a');
SELECT COUNT(c1) FROM t1;
COUNT(c1)
0
DELETE FROM t1 WHERE c1 = 'b';
SELECT COUNT(c1) FROM t1 WHERE c1 = 'b';
COUNT(c1)
0
SELECT COUNT(c1) FROM t1;
COUNT(c1)
0
DROP TABLE t1,t2,t3;
CREATE TABLE t1(c1 CHAR(10) NOT NULL);
CREATE TABLE t2(c1 CHAR(10) NOT NULL);
INSERT INTO t2 (c1) VALUES('a'),('aaa'),('b'),('b'),('bb'),('bbb'),('c');
CREATE TABLE t3(c1 CHAR(10) NOT NULL);
INSERT INTO t3 (c1) VALUES('a');
SELECT COUNT(c1) FROM t2;
COUNT(c1)
7
DELETE FROM t2 WHERE c1 = 'b';
SELECT COUNT(c1) FROM t2 WHERE c1 = 'b';
COUNT(c1)
0
SELECT COUNT(c1) FROM t2;
COUNT(c1)
5
DROP TABLE t1,t2,t3;
CREATE TABLE t1(c1 VARCHAR(10) NOT NULL);
CREATE TABLE t2(c1 VARCHAR(10) NOT NULL);
INSERT INTO t2 (c1) VALUES('a'),('aaa'),('b'),('b'),('bb'),('bbb'),('c');
CREATE TABLE t3(c1 VARCHAR(10) NOT NULL);
INSERT INTO t3 (c1) VALUES('a');
SELECT COUNT(c1) FROM t2;
COUNT(c1)
7
DELETE FROM t2 WHERE c1 = 'b';
SELECT COUNT(c1) FROM t2 WHERE c1 = 'b';
COUNT(c1)
0
SELECT COUNT(c1) FROM t2;
COUNT(c1)
5
DROP TABLE t1,t2,t3;
CREATE TABLE t1(c1 BINARY(10) NOT NULL);
CREATE TABLE t2(c1 BINARY(10) NOT NULL);
INSERT INTO t2 (c1) VALUES('a'),('aaa'),('b'),('b'),('bb'),('bbb'),('c');
CREATE TABLE t3(c1 BINARY(10) NOT NULL);
INSERT INTO t3 (c1) VALUES('a');
SELECT COUNT(c1) FROM t2;
COUNT(c1)
7
DELETE FROM t2 WHERE c1 = 'b';
SELECT COUNT(c1) FROM t2 WHERE c1 = 'b';
COUNT(c1)
0
SELECT COUNT(c1) FROM t2;
COUNT(c1)
7
DROP TABLE t1,t2,t3;
CREATE TABLE t1(c1 VARBINARY(10) NOT NULL);
CREATE TABLE t2(c1 VARBINARY(10) NOT NULL);
INSERT INTO t2 (c1) VALUES('a'),('aaa'),('b'),('b'),('bb'),('bbb'),('c');
CREATE TABLE t3(c1 VARBINARY(10) NOT NULL);
INSERT INTO t3 (c1) VALUES('a');
SELECT COUNT(c1) FROM t2;
COUNT(c1)
7
DELETE FROM t2 WHERE c1 = 'b';
SELECT COUNT(c1) FROM t2 WHERE c1 = 'b';
COUNT(c1)
0
SELECT COUNT(c1) FROM t2;
COUNT(c1)
5
DROP TABLE t1,t2,t3;
CREATE TABLE t1(c1 CHAR(10) NOT NULL);
CREATE TABLE t2(c1 CHAR(10) NOT NULL);
INSERT INTO t2 (c1) VALUES('a'),('aaa'),('b'),('b'),('bb'),('bbb'),('c');
CREATE TABLE t3(c1 CHAR(10) NOT NULL);
INSERT INTO t3 (c1) VALUES('a');
SELECT COUNT(c1) FROM t3;
COUNT(c1)
1
DELETE FROM t3 WHERE c1 = 'b';
SELECT COUNT(c1) FROM t3 WHERE c1 = 'b';
COUNT(c1)
0
SELECT COUNT(c1) FROM t3;
COUNT(c1)
1
DROP TABLE t1,t2,t3;
CREATE TABLE t1(c1 VARCHAR(10) NOT NULL);
CREATE TABLE t2(c1 VARCHAR(10) NOT NULL);
INSERT INTO t2 (c1) VALUES('a'),('aaa'),('b'),('b'),('bb'),('bbb'),('c');
CREATE TABLE t3(c1 VARCHAR(10) NOT NULL);
INSERT INTO t3 (c1) VALUES('a');
SELECT COUNT(c1) FROM t3;
COUNT(c1)
1
DELETE FROM t3 WHERE c1 = 'b';
SELECT COUNT(c1) FROM t3 WHERE c1 = 'b';
COUNT(c1)
0
SELECT COUNT(c1) FROM t3;
COUNT(c1)
1
DROP TABLE t1,t2,t3;
CREATE TABLE t1(c1 BINARY(10) NOT NULL);
CREATE TABLE t2(c1 BINARY(10) NOT NULL);
INSERT INTO t2 (c1) VALUES('a'),('aaa'),('b'),('b'),('bb'),('bbb'),('c');
CREATE TABLE t3(c1 BINARY(10) NOT NULL);
INSERT INTO t3 (c1) VALUES('a');
SELECT COUNT(c1) FROM t3;
COUNT(c1)
1
DELETE FROM t3 WHERE c1 = 'b';
SELECT COUNT(c1) FROM t3 WHERE c1 = 'b';
COUNT(c1)
0
SELECT COUNT(c1) FROM t3;
COUNT(c1)
1
DROP TABLE t1,t2,t3;
CREATE TABLE t1(c1 VARBINARY(10) NOT NULL);
CREATE TABLE t2(c1 VARBINARY(10) NOT NULL);
INSERT INTO t2 (c1) VALUES('a'),('aaa'),('b'),('b'),('bb'),('bbb'),('c');
CREATE TABLE t3(c1 VARBINARY(10) NOT NULL);
INSERT INTO t3 (c1) VALUES('a');
SELECT COUNT(c1) FROM t3;
COUNT(c1)
1
DELETE FROM t3 WHERE c1 = 'b';
SELECT COUNT(c1) FROM t3 WHERE c1 = 'b';
COUNT(c1)
0
SELECT COUNT(c1) FROM t3;
COUNT(c1)
1
DROP TABLE t1,t2,t3;
CREATE TABLE t1(c1 CHAR(10) NOT NULL);
CREATE TABLE t2(c1 CHAR(10) NOT NULL);
INSERT INTO t2 (c1) VALUES('a'),('aaa'),('b'),('b'),('bb'),('bbb'),('c');
CREATE TABLE t3(c1 CHAR(10) NOT NULL);
INSERT INTO t3 (c1) VALUES('a');
SELECT COUNT(c1) FROM t1;
COUNT(c1)
0
DELETE FROM t1 WHERE c1 = 'c';
SELECT COUNT(c1) FROM t1 WHERE c1 = 'c';
COUNT(c1)
0
SELECT COUNT(c1) FROM t1;
COUNT(c1)
0
DROP TABLE t1,t2,t3;
CREATE TABLE t1(c1 VARCHAR(10) NOT NULL);
CREATE TABLE t2(c1 VARCHAR(10) NOT NULL);
INSERT INTO t2 (c1) VALUES('a'),('aaa'),('b'),('b'),('bb'),('bbb'),('c');
CREATE TABLE t3(c1 VARCHAR(10) NOT NULL);
INSERT INTO t3 (c1) VALUES('a');
SELECT COUNT(c1) FROM t1;
COUNT(c1)
0
DELETE FROM t1 WHERE c1 = 'c';
SELECT COUNT(c1) FROM t1 WHERE c1 = 'c';
COUNT(c1)
0
SELECT COUNT(c1) FROM t1;
COUNT(c1)
0
DROP TABLE t1,t2,t3;
CREATE TABLE t1(c1 BINARY(10) NOT NULL);
CREATE TABLE t2(c1 BINARY(10) NOT NULL);
INSERT INTO t2 (c1) VALUES('a'),('aaa'),('b'),('b'),('bb'),('bbb'),('c');
CREATE TABLE t3(c1 BINARY(10) NOT NULL);
INSERT INTO t3 (c1) VALUES('a');
SELECT COUNT(c1) FROM t1;
COUNT(c1)
0
DELETE FROM t1 WHERE c1 = 'c';
SELECT COUNT(c1) FROM t1 WHERE c1 = 'c';
COUNT(c1)
0
SELECT COUNT(c1) FROM t1;
COUNT(c1)
0
DROP TABLE t1,t2,t3;
CREATE TABLE t1(c1 VARBINARY(10) NOT NULL);
CREATE TABLE t2(c1 VARBINARY(10) NOT NULL);
INSERT INTO t2 (c1) VALUES('a'),('aaa'),('b'),('b'),('bb'),('bbb'),('c');
CREATE TABLE t3(c1 VARBINARY(10) NOT NULL);
INSERT INTO t3 (c1) VALUES('a');
SELECT COUNT(c1) FROM t1;
COUNT(c1)
0
DELETE FROM t1 WHERE c1 = 'c';
SELECT COUNT(c1) FROM t1 WHERE c1 = 'c';
COUNT(c1)
0
SELECT COUNT(c1) FROM t1;
COUNT(c1)
0
DROP TABLE t1,t2,t3;
CREATE TABLE t1(c1 CHAR(10) NOT NULL);
CREATE TABLE t2(c1 CHAR(10) NOT NULL);
INSERT INTO t2 (c1) VALUES('a'),('aaa'),('b'),('b'),('bb'),('bbb'),('c');
CREATE TABLE t3(c1 CHAR(10) NOT NULL);
INSERT INTO t3 (c1) VALUES('a');
SELECT COUNT(c1) FROM t2;
COUNT(c1)
7
DELETE FROM t2 WHERE c1 = 'c';
SELECT COUNT(c1) FROM t2 WHERE c1 = 'c';
COUNT(c1)
0
SELECT COUNT(c1) FROM t2;
COUNT(c1)
6
DROP TABLE t1,t2,t3;
CREATE TABLE t1(c1 VARCHAR(10) NOT NULL);
CREATE TABLE t2(c1 VARCHAR(10) NOT NULL);
INSERT INTO t2 (c1) VALUES('a'),('aaa'),('b'),('b'),('bb'),('bbb'),('c');
CREATE TABLE t3(c1 VARCHAR(10) NOT NULL);
INSERT INTO t3 (c1) VALUES('a');
SELECT COUNT(c1) FROM t2;
COUNT(c1)
7
DELETE FROM t2 WHERE c1 = 'c';
SELECT COUNT(c1) FROM t2 WHERE c1 = 'c';
COUNT(c1)
0
SELECT COUNT(c1) FROM t2;
COUNT(c1)
6
DROP TABLE t1,t2,t3;
CREATE TABLE t1(c1 BINARY(10) NOT NULL);
CREATE TABLE t2(c1 BINARY(10) NOT NULL);
INSERT INTO t2 (c1) VALUES('a'),('aaa'),('b'),('b'),('bb'),('bbb'),('c');
CREATE TABLE t3(c1 BINARY(10) NOT NULL);
INSERT INTO t3 (c1) VALUES('a');
SELECT COUNT(c1) FROM t2;
COUNT(c1)
7
DELETE FROM t2 WHERE c1 = 'c';
SELECT COUNT(c1) FROM t2 WHERE c1 = 'c';
COUNT(c1)
0
SELECT COUNT(c1) FROM t2;
COUNT(c1)
7
DROP TABLE t1,t2,t3;
CREATE TABLE t1(c1 VARBINARY(10) NOT NULL);
CREATE TABLE t2(c1 VARBINARY(10) NOT NULL);
INSERT INTO t2 (c1) VALUES('a'),('aaa'),('b'),('b'),('bb'),('bbb'),('c');
CREATE TABLE t3(c1 VARBINARY(10) NOT NULL);
INSERT INTO t3 (c1) VALUES('a');
SELECT COUNT(c1) FROM t2;
COUNT(c1)
7
DELETE FROM t2 WHERE c1 = 'c';
SELECT COUNT(c1) FROM t2 WHERE c1 = 'c';
COUNT(c1)
0
SELECT COUNT(c1) FROM t2;
COUNT(c1)
6
DROP TABLE t1,t2,t3;
CREATE TABLE t1(c1 CHAR(10) NOT NULL);
CREATE TABLE t2(c1 CHAR(10) NOT NULL);
INSERT INTO t2 (c1) VALUES('a'),('aaa'),('b'),('b'),('bb'),('bbb'),('c');
CREATE TABLE t3(c1 CHAR(10) NOT NULL);
INSERT INTO t3 (c1) VALUES('a');
SELECT COUNT(c1) FROM t3;
COUNT(c1)
1
DELETE FROM t3 WHERE c1 = 'c';
SELECT COUNT(c1) FROM t3 WHERE c1 = 'c';
COUNT(c1)
0
SELECT COUNT(c1) FROM t3;
COUNT(c1)
1
DROP TABLE t1,t2,t3;
CREATE TABLE t1(c1 VARCHAR(10) NOT NULL);
CREATE TABLE t2(c1 VARCHAR(10) NOT NULL);
INSERT INTO t2 (c1) VALUES('a'),('aaa'),('b'),('b'),('bb'),('bbb'),('c');
CREATE TABLE t3(c1 VARCHAR(10) NOT NULL);
INSERT INTO t3 (c1) VALUES('a');
SELECT COUNT(c1) FROM t3;
COUNT(c1)
1
DELETE FROM t3 WHERE c1 = 'c';
SELECT COUNT(c1) FROM t3 WHERE c1 = 'c';
COUNT(c1)
0
SELECT COUNT(c1) FROM t3;
COUNT(c1)
1
DROP TABLE t1,t2,t3;
CREATE TABLE t1(c1 BINARY(10) NOT NULL);
CREATE TABLE t2(c1 BINARY(10) NOT NULL);
INSERT INTO t2 (c1) VALUES('a'),('aaa'),('b'),('b'),('bb'),('bbb'),('c');
CREATE TABLE t3(c1 BINARY(10) NOT NULL);
INSERT INTO t3 (c1) VALUES('a');
SELECT COUNT(c1) FROM t3;
COUNT(c1)
1
DELETE FROM t3 WHERE c1 = 'c';
SELECT COUNT(c1) FROM t3 WHERE c1 = 'c';
COUNT(c1)
0
SELECT COUNT(c1) FROM t3;
COUNT(c1)
1
DROP TABLE t1,t2,t3;
CREATE TABLE t1(c1 VARBINARY(10) NOT NULL);
CREATE TABLE t2(c1 VARBINARY(10) NOT NULL);
INSERT INTO t2 (c1) VALUES('a'),('aaa'),('b'),('b'),('bb'),('bbb'),('c');
CREATE TABLE t3(c1 VARBINARY(10) NOT NULL);
INSERT INTO t3 (c1) VALUES('a');
SELECT COUNT(c1) FROM t3;
COUNT(c1)
1
DELETE FROM t3 WHERE c1 = 'c';
SELECT COUNT(c1) FROM t3 WHERE c1 = 'c';
COUNT(c1)
0
SELECT COUNT(c1) FROM t3;
COUNT(c1)
1
DROP TABLE t1,t2,t3;
CREATE TABLE t1(c1 CHAR(10) NOT NULL);
CREATE TABLE t2(c1 CHAR(10) NOT NULL);
INSERT INTO t2 (c1) VALUES('a'),('aaa'),('b'),('b'),('bb'),('bbb'),('c');
CREATE TABLE t3(c1 CHAR(10) NOT NULL);
INSERT INTO t3 (c1) VALUES('a');
SELECT COUNT(c1) FROM t1;
COUNT(c1)
0
DELETE FROM t1 WHERE c1 = 'd';
SELECT COUNT(c1) FROM t1 WHERE c1 = 'd';
COUNT(c1)
0
SELECT COUNT(c1) FROM t1;
COUNT(c1)
0
DROP TABLE t1,t2,t3;
CREATE TABLE t1(c1 VARCHAR(10) NOT NULL);
CREATE TABLE t2(c1 VARCHAR(10) NOT NULL);
INSERT INTO t2 (c1) VALUES('a'),('aaa'),('b'),('b'),('bb'),('bbb'),('c');
CREATE TABLE t3(c1 VARCHAR(10) NOT NULL);
INSERT INTO t3 (c1) VALUES('a');
SELECT COUNT(c1) FROM t1;
COUNT(c1)
0
DELETE FROM t1 WHERE c1 = 'd';
SELECT COUNT(c1) FROM t1 WHERE c1 = 'd';
COUNT(c1)
0
SELECT COUNT(c1) FROM t1;
COUNT(c1)
0
DROP TABLE t1,t2,t3;
CREATE TABLE t1(c1 BINARY(10) NOT NULL);
CREATE TABLE t2(c1 BINARY(10) NOT NULL);
INSERT INTO t2 (c1) VALUES('a'),('aaa'),('b'),('b'),('bb'),('bbb'),('c');
CREATE TABLE t3(c1 BINARY(10) NOT NULL);
INSERT INTO t3 (c1) VALUES('a');
SELECT COUNT(c1) FROM t1;
COUNT(c1)
0
DELETE FROM t1 WHERE c1 = 'd';
SELECT COUNT(c1) FROM t1 WHERE c1 = 'd';
COUNT(c1)
0
SELECT COUNT(c1) FROM t1;
COUNT(c1)
0
DROP TABLE t1,t2,t3;
CREATE TABLE t1(c1 VARBINARY(10) NOT NULL);
CREATE TABLE t2(c1 VARBINARY(10) NOT NULL);
INSERT INTO t2 (c1) VALUES('a'),('aaa'),('b'),('b'),('bb'),('bbb'),('c');
CREATE TABLE t3(c1 VARBINARY(10) NOT NULL);
INSERT INTO t3 (c1) VALUES('a');
SELECT COUNT(c1) FROM t1;
COUNT(c1)
0
DELETE FROM t1 WHERE c1 = 'd';
SELECT COUNT(c1) FROM t1 WHERE c1 = 'd';
COUNT(c1)
0
SELECT COUNT(c1) FROM t1;
COUNT(c1)
0
DROP TABLE t1,t2,t3;
CREATE TABLE t1(c1 CHAR(10) NOT NULL);
CREATE TABLE t2(c1 CHAR(10) NOT NULL);
INSERT INTO t2 (c1) VALUES('a'),('aaa'),('b'),('b'),('bb'),('bbb'),('c');
CREATE TABLE t3(c1 CHAR(10) NOT NULL);
INSERT INTO t3 (c1) VALUES('a');
SELECT COUNT(c1) FROM t2;
COUNT(c1)
7
DELETE FROM t2 WHERE c1 = 'd';
SELECT COUNT(c1) FROM t2 WHERE c1 = 'd';
COUNT(c1)
0
SELECT COUNT(c1) FROM t2;
COUNT(c1)
7
DROP TABLE t1,t2,t3;
CREATE TABLE t1(c1 VARCHAR(10) NOT NULL);
CREATE TABLE t2(c1 VARCHAR(10) NOT NULL);
INSERT INTO t2 (c1) VALUES('a'),('aaa'),('b'),('b'),('bb'),('bbb'),('c');
CREATE TABLE t3(c1 VARCHAR(10) NOT NULL);
INSERT INTO t3 (c1) VALUES('a');
SELECT COUNT(c1) FROM t2;
COUNT(c1)
7
DELETE FROM t2 WHERE c1 = 'd';
SELECT COUNT(c1) FROM t2 WHERE c1 = 'd';
COUNT(c1)
0
SELECT COUNT(c1) FROM t2;
COUNT(c1)
7
DROP TABLE t1,t2,t3;
CREATE TABLE t1(c1 BINARY(10) NOT NULL);
CREATE TABLE t2(c1 BINARY(10) NOT NULL);
INSERT INTO t2 (c1) VALUES('a'),('aaa'),('b'),('b'),('bb'),('bbb'),('c');
CREATE TABLE t3(c1 BINARY(10) NOT NULL);
INSERT INTO t3 (c1) VALUES('a');
SELECT COUNT(c1) FROM t2;
COUNT(c1)
7
DELETE FROM t2 WHERE c1 = 'd';
SELECT COUNT(c1) FROM t2 WHERE c1 = 'd';
COUNT(c1)
0
SELECT COUNT(c1) FROM t2;
COUNT(c1)
7
DROP TABLE t1,t2,t3;
CREATE TABLE t1(c1 VARBINARY(10) NOT NULL);
CREATE TABLE t2(c1 VARBINARY(10) NOT NULL);
INSERT INTO t2 (c1) VALUES('a'),('aaa'),('b'),('b'),('bb'),('bbb'),('c');
CREATE TABLE t3(c1 VARBINARY(10) NOT NULL);
INSERT INTO t3 (c1) VALUES('a');
SELECT COUNT(c1) FROM t2;
COUNT(c1)
7
DELETE FROM t2 WHERE c1 = 'd';
SELECT COUNT(c1) FROM t2 WHERE c1 = 'd';
COUNT(c1)
0
SELECT COUNT(c1) FROM t2;
COUNT(c1)
7
DROP TABLE t1,t2,t3;
CREATE TABLE t1(c1 CHAR(10) NOT NULL);
CREATE TABLE t2(c1 CHAR(10) NOT NULL);
INSERT INTO t2 (c1) VALUES('a'),('aaa'),('b'),('b'),('bb'),('bbb'),('c');
CREATE TABLE t3(c1 CHAR(10) NOT NULL);
INSERT INTO t3 (c1) VALUES('a');
SELECT COUNT(c1) FROM t3;
COUNT(c1)
1
DELETE FROM t3 WHERE c1 = 'd';
SELECT COUNT(c1) FROM t3 WHERE c1 = 'd';
COUNT(c1)
0
SELECT COUNT(c1) FROM t3;
COUNT(c1)
1
DROP TABLE t1,t2,t3;
CREATE TABLE t1(c1 VARCHAR(10) NOT NULL);
CREATE TABLE t2(c1 VARCHAR(10) NOT NULL);
INSERT INTO t2 (c1) VALUES('a'),('aaa'),('b'),('b'),('bb'),('bbb'),('c');
CREATE TABLE t3(c1 VARCHAR(10) NOT NULL);
INSERT INTO t3 (c1) VALUES('a');
SELECT COUNT(c1) FROM t3;
COUNT(c1)
1
DELETE FROM t3 WHERE c1 = 'd';
SELECT COUNT(c1) FROM t3 WHERE c1 = 'd';
COUNT(c1)
0
SELECT COUNT(c1) FROM t3;
COUNT(c1)
1
DROP TABLE t1,t2,t3;
CREATE TABLE t1(c1 BINARY(10) NOT NULL);
CREATE TABLE t2(c1 BINARY(10) NOT NULL);
INSERT INTO t2 (c1) VALUES('a'),('aaa'),('b'),('b'),('bb'),('bbb'),('c');
CREATE TABLE t3(c1 BINARY(10) NOT NULL);
INSERT INTO t3 (c1) VALUES('a');
SELECT COUNT(c1) FROM t3;
COUNT(c1)
1
DELETE FROM t3 WHERE c1 = 'd';
SELECT COUNT(c1) FROM t3 WHERE c1 = 'd';
COUNT(c1)
0
SELECT COUNT(c1) FROM t3;
COUNT(c1)
1
DROP TABLE t1,t2,t3;
CREATE TABLE t1(c1 VARBINARY(10) NOT NULL);
CREATE TABLE t2(c1 VARBINARY(10) NOT NULL);
INSERT INTO t2 (c1) VALUES('a'),('aaa'),('b'),('b'),('bb'),('bbb'),('c');
CREATE TABLE t3(c1 VARBINARY(10) NOT NULL);
INSERT INTO t3 (c1) VALUES('a');
SELECT COUNT(c1) FROM t3;
COUNT(c1)
1
DELETE FROM t3 WHERE c1 = 'd';
SELECT COUNT(c1) FROM t3 WHERE c1 = 'd';
COUNT(c1)
0
SELECT COUNT(c1) FROM t3;
COUNT(c1)
1
DROP TABLE t1,t2,t3;
