SELECT sys.ps_is_thread_instrumented(NULL);
sys.ps_is_thread_instrumented(NULL)
NULL
Warnings:
Warning	3719	'utf8' is currently an alias for the character set UTF8MB3, which will be replaced by UTF8MB4 in a future release. Please consider using UTF8MB4 in order to be unambiguous.
SELECT sys.ps_is_thread_instrumented(CONNECTION_ID());
sys.ps_is_thread_instrumented(CONNECTION_ID())
YES
UPDATE performance_schema.threads SET instrumented = 'NO' WHERE processlist_id = CONNECTION_ID();
SELECT sys.ps_is_thread_instrumented(CONNECTION_ID());
sys.ps_is_thread_instrumented(CONNECTION_ID())
NO
SELECT sys.ps_is_thread_instrumented(234623462376);
sys.ps_is_thread_instrumented(234623462376)
UNKNOWN
UPDATE performance_schema.threads SET instrumented = 'YES';
