SET DEFAULT_STORAGE_ENGINE = 'tokudb';
# Establish connection conn1 (user = root)
DROP TABLE IF EXISTS foo;
set session tokudb_load_save_space=0;
create table foo (a int) engine=TokuDB;
show create table foo;
Table	Create Table
foo	CREATE TABLE `foo` (
  `a` int(11) DEFAULT NULL
) ENGINE=TokuDB DEFAULT CHARSET=latin1
insert into foo values (1),(2),(3);
set session transaction isolation level repeatable read;
begin;
# should return (1),(2),(3)
select * from foo;
a
1
2
3
delete from foo;
insert into foo values (4);
# should return (4)
select * from foo;
a
4
# should return (1),(2),(3)
select * from foo;
a
1
2
3
set session transaction isolation level serializable;
DROP TABLE foo;
