SET STORAGE_ENGINE = 'tokudb';
# Establish connection conn1 (user = root)
DROP TABLE IF EXISTS foo;
create table foo (a int, b varchar (100), primary key (a)) engine=TokuDB;
show create table foo;
Table	Create Table
foo	CREATE TABLE `foo` (
  `a` int(11) NOT NULL DEFAULT '0',
  `b` varchar(100) DEFAULT NULL,
  PRIMARY KEY (`a`)
) ENGINE=TOKUDB DEFAULT CHARSET=latin1
set session transaction isolation level repeatable read;
begin;
select * from foo;
a	b
replace into foo values (1, "a");
set session transaction isolation level repeatable read;
begin;
select * from foo;
a	b
1	a
delete from foo;
set session transaction isolation level repeatable read;
begin;
select * from foo;
a	b
replace into foo values (1,"abc");
set session transaction isolation level repeatable read;
begin;
select * from foo;
a	b
1	abc
delete from foo;
set session transaction isolation level repeatable read;
begin;
select * from foo;
a	b
select * from foo;
a	b
commit;
select * from foo;
a	b
1	a
commit;
select * from foo;
a	b
commit;
select * from foo;
a	b
1	abc
commit;
select * from foo;
a	b
commit;
set session transaction isolation level serializable;
DROP TABLE foo;
