CREATE DATABASE hospital;
USE hospital;
# Create Patients table
CREATE TABLE Patients (
patient_id INT PRIMARY KEY,
first_name VARCHAR(50) NOT NULL,
last_name VARCHAR(50) NOT NULL,
dob DATE DEFAULT NULL,
gender ENUM('Male', 'Female', 'Other') DEFAULT NULL,
contact_number VARCHAR(15) DEFAULT NULL,
email VARCHAR(100) DEFAULT NULL,
address TEXT DEFAULT NULL,
medical_history TEXT DEFAULT NULL
);
# Create Doctors table
CREATE TABLE Doctors (
doctor_id INT PRIMARY KEY,
first_name VARCHAR(50) NOT NULL,
last_name VARCHAR(50) NOT NULL,
specialty VARCHAR(100) DEFAULT NULL,
contact_number VARCHAR(15) DEFAULT NULL,
email VARCHAR(100) DEFAULT NULL,
department VARCHAR(100) DEFAULT NULL
);
# Create Appointments table
CREATE TABLE Appointments (
appointment_id INT PRIMARY KEY,
patient_id INT NOT NULL,
doctor_id INT NOT NULL,
appointment_time DATETIME NOT NULL,
status ENUM('Scheduled', 'Completed', 'Cancelled') DEFAULT 'Scheduled',
notes TEXT DEFAULT NULL,
FOREIGN KEY (patient_id) REFERENCES Patients(patient_id),
FOREIGN KEY (doctor_id) REFERENCES Doctors(doctor_id)
);
# Create Lab_Reports table
CREATE TABLE Lab_Reports (
report_id INT PRIMARY KEY,
patient_id INT NOT NULL,
doctor_id INT NOT NULL,
test_name VARCHAR(255) DEFAULT NULL,
test_date DATE DEFAULT NULL,
results TEXT DEFAULT NULL,
remarks TEXT DEFAULT NULL,
FOREIGN KEY (patient_id) REFERENCES Patients(patient_id),
FOREIGN KEY (doctor_id) REFERENCES Doctors(doctor_id)
);
# Insert into Doctors table
INSERT INTO Doctors (doctor_id, first_name, last_name, specialty, contact_number, email, department) VALUES
(1, 'John', 'Doe', 'Cardiology', '1234567890', 'johndoe@example.com', 'Cardiology'),
(2, 'Sarah', 'Smith', 'Neurology', '1234567891', 'sarahsmith@example.com', 'Neurology'),
(3, 'James', 'Brown', 'Pediatrics', '1234567892', 'jamesbrown@example.com', 'Pediatrics'),
(4, 'Emily', 'Davis', 'Orthopedics', '1234567893', 'emilydavis@example.com', 'Orthopedics'),
(5, 'Michael', 'Wilson', 'General Medicine', '1234567894', 'michaelwilson@example.com', 'General Medicine');
# Insert into Patients table
INSERT INTO Patients (patient_id, first_name, last_name, dob, gender, contact_number, email, address, medical_history) VALUES
(1, 'Alice', 'Johnson', '1985-06-15', 'Female', '9876543210', 'alicejohnson@example.com', '123 Elm Street', 'Diabetes'),
(2, 'Robert', 'Williams', '1990-09-22', 'Male', '9876543211', 'robertwilliams@example.com', '456 Oak Avenue', 'Hypertension'),
(3, 'Sophia', 'Martinez', '2000-01-05', 'Female', '9876543212', 'sophiamartinez@example.com', '789 Maple Lane', 'Asthma'),
(4, 'David', 'Anderson', '1982-04-17', 'Male', '9876543213', 'davidanderson@example.com', '159 Pine Road', 'No known conditions'),
(5, 'Emma', 'Harris', '1995-07-30', 'Female', '9876543214', 'emmaharris@example.com', '753 Birch Blvd', 'Migraine'),
(6, 'Daniel', 'Thomas', '1988-11-12', 'Male', '9876543215', 'danielthomas@example.com', '951 Cedar Dr', 'Allergic to Penicillin'),
(7, 'Olivia', 'White', '1975-12-25', 'Female', '9876543216', 'oliviawhite@example.com', '852 Spruce St', 'High Cholesterol');
# Insert into Appointments table
INSERT INTO Appointments (appointment_id, patient_id, doctor_id, appointment_time, status, notes) VALUES
(1, 1, 1, '2024-02-05 10:00:00', 'Scheduled', 'Routine check-up'),
(2, 2, 3, '2024-02-06 11:30:00', 'Scheduled', 'Follow-up on hypertension medication'),
(3, 3, 2, '2024-02-07 14:00:00', 'Scheduled', 'Neurology consultation'),
(4, 4, 4, '2024-02-08 09:15:00', 'Scheduled', 'Orthopedic assessment for knee pain'),
(5, 5, 5, '2024-02-09 16:45:00', 'Scheduled', 'General health check-up'),
(6, 6, 1, '2024-02-10 12:00:00', 'Scheduled', 'Heart condition follow-up'),
(7, 7, 2, '2024-02-11 15:30:00', 'Scheduled', 'MRI scan review');
# Insert into Lab_Reports table
INSERT INTO Lab_Reports (report_id, patient_id, doctor_id, test_name, test_date, results, remarks) VALUES
(1, 1, 1, 'Blood Sugar Test', '2024-02-01', 'Fasting: 110 mg/dL, Post-meal: 140 mg/dL', 'Slightly elevated, monitor regularly'),
(2, 2, 3, 'Lipid Profile', '2024-02-02', 'Total Cholesterol: 220 mg/dL, LDL: 150 mg/dL', 'High cholesterol, dietary changes recommended'),
(3, 3, 2, 'MRI Brain Scan', '2024-02-03', 'No abnormalities detected', 'Normal scan, no concerns'),
(4, 4, 4, 'X-ray Knee', '2024-02-04', 'Mild arthritis detected', 'Physical therapy suggested'),
(5, 5, 5, 'Complete Blood Count', '2024-02-05', 'Normal hemoglobin levels', 'No issues detected');
# Additional Lab Reports for Patients
# Reports for Patient 1 (Alice Johnson)
INSERT INTO Lab_Reports (report_id, patient_id, doctor_id, test_name, test_date, results, remarks) VALUES
(6, 1, 1, 'Cholesterol Test', '2024-02-10', 'Total: 200 mg/dL, LDL: 120 mg/dL', 'Normal levels, maintain diet.'),
(7, 1, 2, 'ECG', '2024-02-15', 'No abnormalities detected', 'Healthy heart rhythm.'),
(8, 1, 3, 'Vitamin D Test', '2024-02-20', 'Vitamin D: 22 ng/mL', 'Slightly low, consider supplements.'),
#--echo # Reports for Patient 2 (Robert Williams)
(9, 2, 3, 'Kidney Function Test', '2024-02-08', 'Creatinine: 1.1 mg/dL', 'Within normal range.'),
(10, 2, 4, 'CBC (Complete Blood Count)', '2024-02-12', 'WBC: 6.5k/uL, Hemoglobin: 14 g/dL', 'Normal results.'),
(11, 2, 5, 'Liver Function Test', '2024-02-18', 'ALT: 30 U/L, AST: 28 U/L', 'Liver function normal.'),
#--echo # Reports for Patient 3 (Sophia Martinez)
(12, 3, 2, 'Brain MRI', '2024-02-09', 'No lesions detected', 'Normal scan.'),
(13, 3, 4, 'Blood Pressure Test', '2024-02-14', '120/80 mmHg', 'Blood pressure normal.'),
(14, 3, 1, 'Glucose Tolerance Test', '2024-02-19', 'Fasting: 95 mg/dL, 2-hr: 140 mg/dL', 'Normal response.'),
#--echo # Reports for Patient 4 (David Anderson)
(15, 4, 1, 'X-ray Chest', '2024-02-07', 'No abnormalities', 'Lungs are clear.'),
(16, 4, 5, 'Calcium Test', '2024-02-11', 'Calcium: 9.5 mg/dL', 'Within normal range.'),
(17, 4, 2, 'Thyroid Function Test', '2024-02-16', 'TSH: 2.5 uIU/mL', 'Thyroid function normal.'),
#--echo # Reports for Patient 5 (Emma Harris)
(18, 5, 3, 'Allergy Panel', '2024-02-05', 'Mild pollen allergy', 'Avoid exposure to allergens.'),
(19, 5, 4, 'Urine Analysis', '2024-02-13', 'Normal pH and composition', 'No concerns.'),
(20, 5, 2, 'Iron Panel', '2024-02-17', 'Ferritin: 55 ng/mL', 'Iron levels within range.'),
#--echo # Reports for Patient 6 (Daniel Thomas)
(21, 6, 5, 'Blood Sugar Test', '2024-02-06', 'Fasting: 100 mg/dL', 'Monitor periodically.'),
(22, 6, 1, 'Echocardiogram', '2024-02-10', 'Normal heart structure', 'No cardiac issues.'),
(23, 6, 2, 'Electrolyte Panel', '2024-02-14', 'Sodium: 140 mmol/L, Potassium: 4.0 mmol/L', 'Balanced electrolyte levels.'),
#-echo # Reports for Patient 7 (Olivia White)
(24, 7, 3, 'Bone Density Test', '2024-02-07', 'T-score: -1.0', 'Mild osteopenia, calcium intake recommended.'),
(25, 7, 5, 'Lipid Profile', '2024-02-11', 'HDL: 50 mg/dL, LDL: 135 mg/dL', 'LDL slightly high, consider diet changes.'),
(26, 7, 4, 'Thyroid Ultrasound', '2024-02-15', 'No nodules detected', 'Thyroid appears normal.');
CREATE OR REPLACE JSON RELATIONAL DUALITY VIEW patient_dv AS
SELECT JSON_DUALITY_OBJECT(WITH(INSERT,UPDATE,DELETE)
"_id" : patient_id,
"first_name" :  first_name,
"last_name" :  last_name,
"dob" :  dob,
"gender" :  gender,
"email" :  email,
"appointments" :  (
SELECT JSON_ARRAYAGG(
JSON_DUALITY_OBJECT(WITH(INSERT,UPDATE,DELETE)
"appointment_id" :  appointment_id,
"appointment_time" :  appointment_time,
"status" :  status,
"notes" :  notes,
"doctor" :  (
SELECT JSON_DUALITY_OBJECT(WITH(INSERT,UPDATE)
"doctor_id" :  doctor_id,
"first_name" : first_name,
"last_name" : last_name,
"specialty" : specialty
)
FROM Doctors
WHERE Doctors.doctor_id = Appointments.doctor_id
)
)
)
FROM Appointments
WHERE Patients.patient_id = Appointments.patient_id
),
"reports" :  (
SELECT JSON_ARRAYAGG(
JSON_DUALITY_OBJECT(WITH(INSERT,UPDATE,DELETE)
"report_id" :  report_id,
"test_name" :  test_name,
"test_date" :  test_date,
"results" :  results,
"remarks" :  remarks
))
FROM Lab_Reports
WHERE Lab_Reports.patient_id = Patients.patient_id
)
)
FROM Patients;
CREATE OR REPLACE JSON RELATIONAL DUALITY VIEW doctors_dv AS
SELECT JSON_DUALITY_OBJECT(
"_id" : doctor_id,
"first_name" :  first_name,
"last_name" :  last_name,
"specialty" :  specialty,
"department" :  department,
"email" :  email,
"appointments" :  (
SELECT JSON_ARRAYAGG(
JSON_DUALITY_OBJECT(
"appointment_id" :  appointment_id,
"appointment_time" :  appointment_time,
"status" :  status,
"notes" :  notes,
"patient" :  (
SELECT JSON_DUALITY_OBJECT(
"patient_id" :  patient_id,
"first_name" : first_name,
"last_name" : last_name,
"email" :  email
)
FROM Patients
WHERE Patients.patient_id = Appointments.patient_id
)
)
)
FROM Appointments
WHERE Doctors.doctor_id = Appointments.appointment_id
)
)
FROM Doctors;
# Lab reports view (Admin use case)
CREATE OR REPLACE JSON RELATIONAL DUALITY VIEW lab_reports_dv AS
SELECT JSON_DUALITY_OBJECT(
"_id" :  report_id,
"test_name" :  test_name,
"test_date" :  test_date,
"results" :  results,
"remarks" :  remarks,
"patient" :  (
SELECT JSON_DUALITY_OBJECT(
"patient_id" :  patient_id,
"first_name" :  first_name,
"last_name" :  last_name
)
FROM Patients
WHERE Patients.patient_id = Lab_Reports.patient_id
),
"doctor" :  (
SELECT JSON_DUALITY_OBJECT(
"doctor_id" :  doctor_id,
"first_name" :  first_name,
"last_name" :  last_name
)
FROM Doctors
WHERE Doctors.doctor_id = Lab_Reports.doctor_id
)
)
FROM Lab_Reports;
# Appointment list (Admin usecase)
CREATE OR REPLACE JSON RELATIONAL DUALITY VIEW appointments_dv AS
SELECT JSON_DUALITY_OBJECT(WITH(INSERT,UPDATE,DELETE)
"_id" :  appointment_id,
"time" :  appointment_time,
"status" :  status,
"patient" :  (
SELECT JSON_DUALITY_OBJECT(WITH(INSERT,UPDATE)
"patient_id" :  patient_id,
"first_name" :  first_name,
"last_name" :  last_name
)
FROM Patients
WHERE Appointments.patient_id = Patients.patient_id
),
"doctor" :  (
SELECT JSON_DUALITY_OBJECT(WITH(INSERT,UPDATE)
"doctor_id" :  doctor_id,
"first_name" :  first_name,
"last_name" :  last_name
)
FROM Doctors
WHERE Appointments.doctor_id = Doctors.doctor_id
)
)
FROM Appointments;
INSERT INTO appointments_dv VALUES (
'{
        "_id": 42, "time": "2024-02-25 10:00:00.000000", "status": "Cancelled",
        "doctor": {"doctor_id": 1, "last_name": "Doe", "first_name": "John"},
        "patient": {"last_name": "Johnson", "first_name": "Alice", "patient_id": 1}
    }'
);
UPDATE appointments_dv
SET data = JSON_REPLACE(data, '$.status', 'Cancelled')
WHERE data->'$._id' = 4;
UPDATE appointments_dv
SET data = '{"_id": 5, "time": "2024-02-09 16:45:00.000000", "doctor": {"doctor_id": 5, "last_name": "Wilson", "first_name": "Michael"}, "status": "Scheduled", "patient": {"last_name": "Harris", "first_name": "Emma", "patient_id": 5}, "_metadata": {"etag": "6d113f95099b1f41bbdb833aade3f082"}}'
WHERE data->'$._id' = 5;
DELETE FROM appointments_dv WHERE data->'$._id' = 3;
SELECT data FROM patient_dv;
data
{"_id": 1, "dob": "1985-06-15", "email": "alicejohnson@example.com", "gender": "Female", "reports": [{"remarks": "Slightly elevated, monitor regularly", "results": "Fasting: 110 mg/dL, Post-meal: 140 mg/dL", "report_id": 1, "test_date": "2024-02-01", "test_name": "Blood Sugar Test"}, {"remarks": "Normal levels, maintain diet.", "results": "Total: 200 mg/dL, LDL: 120 mg/dL", "report_id": 6, "test_date": "2024-02-10", "test_name": "Cholesterol Test"}, {"remarks": "Healthy heart rhythm.", "results": "No abnormalities detected", "report_id": 7, "test_date": "2024-02-15", "test_name": "ECG"}, {"remarks": "Slightly low, consider supplements.", "results": "Vitamin D: 22 ng/mL", "report_id": 8, "test_date": "2024-02-20", "test_name": "Vitamin D Test"}], "_metadata": {"etag": "481600cf3fed3d6f5092dbddee8e0663"}, "last_name": "Johnson", "first_name": "Alice", "appointments": [{"notes": "Routine check-up", "doctor": {"doctor_id": 1, "last_name": "Doe", "specialty": "Cardiology", "first_name": "John"}, "status": "Scheduled", "appointment_id": 1, "appointment_time": "2024-02-05 10:00:00.000000"}, {"notes": null, "doctor": {"doctor_id": 1, "last_name": "Doe", "specialty": "Cardiology", "first_name": "John"}, "status": "Cancelled", "appointment_id": 42, "appointment_time": "2024-02-25 10:00:00.000000"}]}
{"_id": 2, "dob": "1990-09-22", "email": "robertwilliams@example.com", "gender": "Male", "reports": [{"remarks": "High cholesterol, dietary changes recommended", "results": "Total Cholesterol: 220 mg/dL, LDL: 150 mg/dL", "report_id": 2, "test_date": "2024-02-02", "test_name": "Lipid Profile"}, {"remarks": "Within normal range.", "results": "Creatinine: 1.1 mg/dL", "report_id": 9, "test_date": "2024-02-08", "test_name": "Kidney Function Test"}, {"remarks": "Normal results.", "results": "WBC: 6.5k/uL, Hemoglobin: 14 g/dL", "report_id": 10, "test_date": "2024-02-12", "test_name": "CBC (Complete Blood Count)"}, {"remarks": "Liver function normal.", "results": "ALT: 30 U/L, AST: 28 U/L", "report_id": 11, "test_date": "2024-02-18", "test_name": "Liver Function Test"}], "_metadata": {"etag": "3744dbd83dd5e278b9b63759da8774d5"}, "last_name": "Williams", "first_name": "Robert", "appointments": [{"notes": "Follow-up on hypertension medication", "doctor": {"doctor_id": 3, "last_name": "Brown", "specialty": "Pediatrics", "first_name": "James"}, "status": "Scheduled", "appointment_id": 2, "appointment_time": "2024-02-06 11:30:00.000000"}]}
{"_id": 3, "dob": "2000-01-05", "email": "sophiamartinez@example.com", "gender": "Female", "reports": [{"remarks": "Normal scan, no concerns", "results": "No abnormalities detected", "report_id": 3, "test_date": "2024-02-03", "test_name": "MRI Brain Scan"}, {"remarks": "Normal scan.", "results": "No lesions detected", "report_id": 12, "test_date": "2024-02-09", "test_name": "Brain MRI"}, {"remarks": "Blood pressure normal.", "results": "120/80 mmHg", "report_id": 13, "test_date": "2024-02-14", "test_name": "Blood Pressure Test"}, {"remarks": "Normal response.", "results": "Fasting: 95 mg/dL, 2-hr: 140 mg/dL", "report_id": 14, "test_date": "2024-02-19", "test_name": "Glucose Tolerance Test"}], "_metadata": {"etag": "bd9d364d9813f915f8fee1886f203a77"}, "last_name": "Martinez", "first_name": "Sophia", "appointments": null}
{"_id": 4, "dob": "1982-04-17", "email": "davidanderson@example.com", "gender": "Male", "reports": [{"remarks": "Physical therapy suggested", "results": "Mild arthritis detected", "report_id": 4, "test_date": "2024-02-04", "test_name": "X-ray Knee"}, {"remarks": "Lungs are clear.", "results": "No abnormalities", "report_id": 15, "test_date": "2024-02-07", "test_name": "X-ray Chest"}, {"remarks": "Within normal range.", "results": "Calcium: 9.5 mg/dL", "report_id": 16, "test_date": "2024-02-11", "test_name": "Calcium Test"}, {"remarks": "Thyroid function normal.", "results": "TSH: 2.5 uIU/mL", "report_id": 17, "test_date": "2024-02-16", "test_name": "Thyroid Function Test"}], "_metadata": {"etag": "4751330ab70ede10a9e7d9ad151fc020"}, "last_name": "Anderson", "first_name": "David", "appointments": [{"notes": "Orthopedic assessment for knee pain", "doctor": {"doctor_id": 4, "last_name": "Davis", "specialty": "Orthopedics", "first_name": "Emily"}, "status": "Cancelled", "appointment_id": 4, "appointment_time": "2024-02-08 09:15:00.000000"}]}
{"_id": 5, "dob": "1995-07-30", "email": "emmaharris@example.com", "gender": "Female", "reports": [{"remarks": "No issues detected", "results": "Normal hemoglobin levels", "report_id": 5, "test_date": "2024-02-05", "test_name": "Complete Blood Count"}, {"remarks": "Avoid exposure to allergens.", "results": "Mild pollen allergy", "report_id": 18, "test_date": "2024-02-05", "test_name": "Allergy Panel"}, {"remarks": "No concerns.", "results": "Normal pH and composition", "report_id": 19, "test_date": "2024-02-13", "test_name": "Urine Analysis"}, {"remarks": "Iron levels within range.", "results": "Ferritin: 55 ng/mL", "report_id": 20, "test_date": "2024-02-17", "test_name": "Iron Panel"}], "_metadata": {"etag": "d9d69f3d590a9acc80df6260c477daa0"}, "last_name": "Harris", "first_name": "Emma", "appointments": [{"notes": "General health check-up", "doctor": {"doctor_id": 5, "last_name": "Wilson", "specialty": "General Medicine", "first_name": "Michael"}, "status": "Scheduled", "appointment_id": 5, "appointment_time": "2024-02-09 16:45:00.000000"}]}
{"_id": 6, "dob": "1988-11-12", "email": "danielthomas@example.com", "gender": "Male", "reports": [{"remarks": "Monitor periodically.", "results": "Fasting: 100 mg/dL", "report_id": 21, "test_date": "2024-02-06", "test_name": "Blood Sugar Test"}, {"remarks": "No cardiac issues.", "results": "Normal heart structure", "report_id": 22, "test_date": "2024-02-10", "test_name": "Echocardiogram"}, {"remarks": "Balanced electrolyte levels.", "results": "Sodium: 140 mmol/L, Potassium: 4.0 mmol/L", "report_id": 23, "test_date": "2024-02-14", "test_name": "Electrolyte Panel"}], "_metadata": {"etag": "885d9f7dd30034dad3a8542cf586fa5f"}, "last_name": "Thomas", "first_name": "Daniel", "appointments": [{"notes": "Heart condition follow-up", "doctor": {"doctor_id": 1, "last_name": "Doe", "specialty": "Cardiology", "first_name": "John"}, "status": "Scheduled", "appointment_id": 6, "appointment_time": "2024-02-10 12:00:00.000000"}]}
{"_id": 7, "dob": "1975-12-25", "email": "oliviawhite@example.com", "gender": "Female", "reports": [{"remarks": "Mild osteopenia, calcium intake recommended.", "results": "T-score: -1.0", "report_id": 24, "test_date": "2024-02-07", "test_name": "Bone Density Test"}, {"remarks": "LDL slightly high, consider diet changes.", "results": "HDL: 50 mg/dL, LDL: 135 mg/dL", "report_id": 25, "test_date": "2024-02-11", "test_name": "Lipid Profile"}, {"remarks": "Thyroid appears normal.", "results": "No nodules detected", "report_id": 26, "test_date": "2024-02-15", "test_name": "Thyroid Ultrasound"}], "_metadata": {"etag": "98ab3f284dc42c25c81e5302a3a2943f"}, "last_name": "White", "first_name": "Olivia", "appointments": [{"notes": "MRI scan review", "doctor": {"doctor_id": 2, "last_name": "Smith", "specialty": "Neurology", "first_name": "Sarah"}, "status": "Scheduled", "appointment_id": 7, "appointment_time": "2024-02-11 15:30:00.000000"}]}
INSERT INTO patient_dv VALUES ('
{
"_id": 101,
"last_name": "Tauheed",
"first_name": "Farhan",
"dob": "1985-06-15", 
"gender": "Male",
"email": "farhan@example.com",

 "appointments": [
   {
     "notes": "Routine check-up",
     "doctor": {
       "doctor_id": 1,
       "last_name": "Doe",
       "specialty": "Cardiology",
       "first_name": "John"
     },
     "status": "Scheduled",
     "appointment_id": 101,
     "appointment_time": "2024-02-05 10:00:00.000000"
   }
 ]
}');
SELECT data FROM patient_dv WHERE data->'$._id' = 101;
data
{"_id": 101, "dob": "1985-06-15", "email": "farhan@example.com", "gender": "Male", "reports": null, "_metadata": {"etag": "f39b42b6155efc3f081d75dffee3466e"}, "last_name": "Tauheed", "first_name": "Farhan", "appointments": [{"notes": "Routine check-up", "doctor": {"doctor_id": 1, "last_name": "Doe", "specialty": "Cardiology", "first_name": "John"}, "status": "Scheduled", "appointment_id": 101, "appointment_time": "2024-02-05 10:00:00.000000"}]}
SELECT data FROM patient_dv WHERE data->'$._id' = 1;
data
{"_id": 1, "dob": "1985-06-15", "email": "alicejohnson@example.com", "gender": "Female", "reports": [{"remarks": "Slightly elevated, monitor regularly", "results": "Fasting: 110 mg/dL, Post-meal: 140 mg/dL", "report_id": 1, "test_date": "2024-02-01", "test_name": "Blood Sugar Test"}, {"remarks": "Normal levels, maintain diet.", "results": "Total: 200 mg/dL, LDL: 120 mg/dL", "report_id": 6, "test_date": "2024-02-10", "test_name": "Cholesterol Test"}, {"remarks": "Healthy heart rhythm.", "results": "No abnormalities detected", "report_id": 7, "test_date": "2024-02-15", "test_name": "ECG"}, {"remarks": "Slightly low, consider supplements.", "results": "Vitamin D: 22 ng/mL", "report_id": 8, "test_date": "2024-02-20", "test_name": "Vitamin D Test"}], "_metadata": {"etag": "481600cf3fed3d6f5092dbddee8e0663"}, "last_name": "Johnson", "first_name": "Alice", "appointments": [{"notes": "Routine check-up", "doctor": {"doctor_id": 1, "last_name": "Doe", "specialty": "Cardiology", "first_name": "John"}, "status": "Scheduled", "appointment_id": 1, "appointment_time": "2024-02-05 10:00:00.000000"}, {"notes": null, "doctor": {"doctor_id": 1, "last_name": "Doe", "specialty": "Cardiology", "first_name": "John"}, "status": "Cancelled", "appointment_id": 42, "appointment_time": "2024-02-25 10:00:00.000000"}]}
UPDATE patient_dv
SET data = JSON_REPLACE(data, '$.gender', 'Female')
WHERE data->'$._id' = 1;
SELECT data FROM patient_dv WHERE data->'$._id' = 1;
data
{"_id": 1, "dob": "1985-06-15", "email": "alicejohnson@example.com", "gender": "Female", "reports": [{"remarks": "Slightly elevated, monitor regularly", "results": "Fasting: 110 mg/dL, Post-meal: 140 mg/dL", "report_id": 1, "test_date": "2024-02-01", "test_name": "Blood Sugar Test"}, {"remarks": "Normal levels, maintain diet.", "results": "Total: 200 mg/dL, LDL: 120 mg/dL", "report_id": 6, "test_date": "2024-02-10", "test_name": "Cholesterol Test"}, {"remarks": "Healthy heart rhythm.", "results": "No abnormalities detected", "report_id": 7, "test_date": "2024-02-15", "test_name": "ECG"}, {"remarks": "Slightly low, consider supplements.", "results": "Vitamin D: 22 ng/mL", "report_id": 8, "test_date": "2024-02-20", "test_name": "Vitamin D Test"}], "_metadata": {"etag": "481600cf3fed3d6f5092dbddee8e0663"}, "last_name": "Johnson", "first_name": "Alice", "appointments": [{"notes": "Routine check-up", "doctor": {"doctor_id": 1, "last_name": "Doe", "specialty": "Cardiology", "first_name": "John"}, "status": "Scheduled", "appointment_id": 1, "appointment_time": "2024-02-05 10:00:00.000000"}, {"notes": null, "doctor": {"doctor_id": 1, "last_name": "Doe", "specialty": "Cardiology", "first_name": "John"}, "status": "Cancelled", "appointment_id": 42, "appointment_time": "2024-02-25 10:00:00.000000"}]}
UPDATE patient_dv
SET data = JSON_REPLACE(data, '$.gender', 'Male')
WHERE data->'$._id' = 1;
SELECT data FROM patient_dv WHERE data->'$._id' = 1;
data
{"_id": 1, "dob": "1985-06-15", "email": "alicejohnson@example.com", "gender": "Male", "reports": [{"remarks": "Slightly elevated, monitor regularly", "results": "Fasting: 110 mg/dL, Post-meal: 140 mg/dL", "report_id": 1, "test_date": "2024-02-01", "test_name": "Blood Sugar Test"}, {"remarks": "Normal levels, maintain diet.", "results": "Total: 200 mg/dL, LDL: 120 mg/dL", "report_id": 6, "test_date": "2024-02-10", "test_name": "Cholesterol Test"}, {"remarks": "Healthy heart rhythm.", "results": "No abnormalities detected", "report_id": 7, "test_date": "2024-02-15", "test_name": "ECG"}, {"remarks": "Slightly low, consider supplements.", "results": "Vitamin D: 22 ng/mL", "report_id": 8, "test_date": "2024-02-20", "test_name": "Vitamin D Test"}], "_metadata": {"etag": "93b19c6973924ef7c82c44b553aa3f66"}, "last_name": "Johnson", "first_name": "Alice", "appointments": [{"notes": "Routine check-up", "doctor": {"doctor_id": 1, "last_name": "Doe", "specialty": "Cardiology", "first_name": "John"}, "status": "Scheduled", "appointment_id": 1, "appointment_time": "2024-02-05 10:00:00.000000"}, {"notes": null, "doctor": {"doctor_id": 1, "last_name": "Doe", "specialty": "Cardiology", "first_name": "John"}, "status": "Cancelled", "appointment_id": 42, "appointment_time": "2024-02-25 10:00:00.000000"}]}
SELECT * FROM INFORMATION_SCHEMA.JSON_DUALITY_VIEWS ORDER BY TABLE_NAME;
TABLE_CATALOG	TABLE_SCHEMA	TABLE_NAME	DEFINER	SECURITY_TYPE	JSON_COLUMN_NAME	ROOT_TABLE_CATALOG	ROOT_TABLE_SCHEMA	ROOT_TABLE_NAME	ALLOW_INSERT	ALLOW_UPDATE	ALLOW_DELETE	READ_ONLY	STATUS
def	hospital	appointments_dv	root@localhost	DEFINER	data	def	hospital	appointments	1	1	1	0	valid
def	hospital	doctors_dv	root@localhost	DEFINER	data	def	hospital	doctors	0	0	0	1	valid
def	hospital	lab_reports_dv	root@localhost	DEFINER	data	def	hospital	lab_reports	0	0	0	1	valid
def	hospital	patient_dv	root@localhost	DEFINER	data	def	hospital	patients	1	1	1	0	valid
SELECT * FROM INFORMATION_SCHEMA.JSON_DUALITY_VIEW_TABLES ORDER BY TABLE_NAME,REFERENCED_TABLE_NAME;
TABLE_CATALOG	TABLE_SCHEMA	TABLE_NAME	REFERENCED_TABLE_CATALOG	REFERENCED_TABLE_SCHEMA	REFERENCED_TABLE_NAME	WHERE_CLAUSE	ALLOW_INSERT	ALLOW_UPDATE	ALLOW_DELETE	READ_ONLY	IS_ROOT_TABLE	REFERENCED_TABLE_ID	REFERENCED_TABLE_PARENT_ID	REFERENCED_TABLE_PARENT_RELATIONSHIP
def	hospital	appointments_dv	def	hospital	appointments		1	1	1	0	1	0	NULL	NULL
def	hospital	appointments_dv	def	hospital	doctors	hospital.doctors.doctor_id = hospital.appointments.doctor_id	1	1	0	0	0	2	0	singleton
def	hospital	appointments_dv	def	hospital	patients	hospital.patients.patient_id = hospital.appointments.patient_id	1	1	0	0	0	1	0	singleton
def	hospital	doctors_dv	def	hospital	appointments	NULL	0	0	0	1	0	1	0	nested
def	hospital	doctors_dv	def	hospital	doctors		0	0	0	1	1	0	NULL	NULL
def	hospital	doctors_dv	def	hospital	patients	hospital.patients.patient_id = hospital.appointments.patient_id	0	0	0	1	0	2	1	singleton
def	hospital	lab_reports_dv	def	hospital	doctors	hospital.doctors.doctor_id = hospital.lab_reports.doctor_id	0	0	0	1	0	2	0	singleton
def	hospital	lab_reports_dv	def	hospital	lab_reports		0	0	0	1	1	0	NULL	NULL
def	hospital	lab_reports_dv	def	hospital	patients	hospital.patients.patient_id = hospital.lab_reports.patient_id	0	0	0	1	0	1	0	singleton
def	hospital	patient_dv	def	hospital	appointments	hospital.appointments.patient_id = hospital.patients.patient_id	1	1	1	0	0	1	0	nested
def	hospital	patient_dv	def	hospital	doctors	hospital.doctors.doctor_id = hospital.appointments.doctor_id	1	1	0	0	0	2	1	singleton
def	hospital	patient_dv	def	hospital	lab_reports	hospital.lab_reports.patient_id = hospital.patients.patient_id	1	1	1	0	0	3	0	nested
def	hospital	patient_dv	def	hospital	patients		1	1	1	0	1	0	NULL	NULL
SELECT * FROM INFORMATION_SCHEMA.JSON_DUALITY_VIEW_COLUMNS ORDER BY TABLE_NAME,REFERENCED_TABLE_NAME,REFERENCED_COLUMN_NAME;
TABLE_CATALOG	TABLE_SCHEMA	TABLE_NAME	REFERENCED_TABLE_CATALOG	REFERENCED_TABLE_SCHEMA	REFERENCED_TABLE_NAME	IS_ROOT_TABLE	REFERENCED_TABLE_ID	REFERENCED_COLUMN_NAME	JSON_KEY_NAME	ALLOW_INSERT	ALLOW_UPDATE	ALLOW_DELETE	READ_ONLY
def	hospital	appointments_dv	def	hospital	appointments	1	0	appointment_id	_id	0	0	0	1
def	hospital	appointments_dv	def	hospital	appointments	1	0	appointment_time	time	0	1	0	0
def	hospital	appointments_dv	def	hospital	appointments	1	0	status	status	0	1	0	0
def	hospital	appointments_dv	def	hospital	doctors	0	2	doctor_id	doctor_id	0	0	0	1
def	hospital	appointments_dv	def	hospital	doctors	0	2	first_name	first_name	0	1	0	0
def	hospital	appointments_dv	def	hospital	doctors	0	2	last_name	last_name	0	1	0	0
def	hospital	appointments_dv	def	hospital	patients	0	1	first_name	first_name	0	1	0	0
def	hospital	appointments_dv	def	hospital	patients	0	1	last_name	last_name	0	1	0	0
def	hospital	appointments_dv	def	hospital	patients	0	1	patient_id	patient_id	0	0	0	1
def	hospital	doctors_dv	def	hospital	appointments	0	1	appointment_id	appointment_id	0	0	0	1
def	hospital	doctors_dv	def	hospital	appointments	0	1	appointment_time	appointment_time	0	0	0	1
def	hospital	doctors_dv	def	hospital	appointments	0	1	notes	notes	0	0	0	1
def	hospital	doctors_dv	def	hospital	appointments	0	1	status	status	0	0	0	1
def	hospital	doctors_dv	def	hospital	doctors	1	0	department	department	0	0	0	1
def	hospital	doctors_dv	def	hospital	doctors	1	0	doctor_id	_id	0	0	0	1
def	hospital	doctors_dv	def	hospital	doctors	1	0	email	email	0	0	0	1
def	hospital	doctors_dv	def	hospital	doctors	1	0	first_name	first_name	0	0	0	1
def	hospital	doctors_dv	def	hospital	doctors	1	0	last_name	last_name	0	0	0	1
def	hospital	doctors_dv	def	hospital	doctors	1	0	specialty	specialty	0	0	0	1
def	hospital	doctors_dv	def	hospital	patients	0	2	email	email	0	0	0	1
def	hospital	doctors_dv	def	hospital	patients	0	2	first_name	first_name	0	0	0	1
def	hospital	doctors_dv	def	hospital	patients	0	2	last_name	last_name	0	0	0	1
def	hospital	doctors_dv	def	hospital	patients	0	2	patient_id	patient_id	0	0	0	1
def	hospital	lab_reports_dv	def	hospital	doctors	0	2	doctor_id	doctor_id	0	0	0	1
def	hospital	lab_reports_dv	def	hospital	doctors	0	2	first_name	first_name	0	0	0	1
def	hospital	lab_reports_dv	def	hospital	doctors	0	2	last_name	last_name	0	0	0	1
def	hospital	lab_reports_dv	def	hospital	lab_reports	1	0	remarks	remarks	0	0	0	1
def	hospital	lab_reports_dv	def	hospital	lab_reports	1	0	report_id	_id	0	0	0	1
def	hospital	lab_reports_dv	def	hospital	lab_reports	1	0	results	results	0	0	0	1
def	hospital	lab_reports_dv	def	hospital	lab_reports	1	0	test_date	test_date	0	0	0	1
def	hospital	lab_reports_dv	def	hospital	lab_reports	1	0	test_name	test_name	0	0	0	1
def	hospital	lab_reports_dv	def	hospital	patients	0	1	first_name	first_name	0	0	0	1
def	hospital	lab_reports_dv	def	hospital	patients	0	1	last_name	last_name	0	0	0	1
def	hospital	lab_reports_dv	def	hospital	patients	0	1	patient_id	patient_id	0	0	0	1
def	hospital	patient_dv	def	hospital	appointments	0	1	appointment_id	appointment_id	0	0	0	1
def	hospital	patient_dv	def	hospital	appointments	0	1	appointment_time	appointment_time	0	1	0	0
def	hospital	patient_dv	def	hospital	appointments	0	1	notes	notes	0	1	0	0
def	hospital	patient_dv	def	hospital	appointments	0	1	status	status	0	1	0	0
def	hospital	patient_dv	def	hospital	doctors	0	2	doctor_id	doctor_id	0	0	0	1
def	hospital	patient_dv	def	hospital	doctors	0	2	first_name	first_name	0	1	0	0
def	hospital	patient_dv	def	hospital	doctors	0	2	last_name	last_name	0	1	0	0
def	hospital	patient_dv	def	hospital	doctors	0	2	specialty	specialty	0	1	0	0
def	hospital	patient_dv	def	hospital	lab_reports	0	3	remarks	remarks	0	1	0	0
def	hospital	patient_dv	def	hospital	lab_reports	0	3	report_id	report_id	0	0	0	1
def	hospital	patient_dv	def	hospital	lab_reports	0	3	results	results	0	1	0	0
def	hospital	patient_dv	def	hospital	lab_reports	0	3	test_date	test_date	0	1	0	0
def	hospital	patient_dv	def	hospital	lab_reports	0	3	test_name	test_name	0	1	0	0
def	hospital	patient_dv	def	hospital	patients	1	0	dob	dob	0	1	0	0
def	hospital	patient_dv	def	hospital	patients	1	0	email	email	0	1	0	0
def	hospital	patient_dv	def	hospital	patients	1	0	first_name	first_name	0	1	0	0
def	hospital	patient_dv	def	hospital	patients	1	0	gender	gender	0	1	0	0
def	hospital	patient_dv	def	hospital	patients	1	0	last_name	last_name	0	1	0	0
def	hospital	patient_dv	def	hospital	patients	1	0	patient_id	_id	0	0	0	1
SELECT * FROM INFORMATION_SCHEMA.JSON_DUALITY_VIEW_LINKS ORDER BY TABLE_NAME,PARENT_TABLE_NAME,CHILD_TABLE_NAME,PARENT_COLUMN_NAME;
TABLE_CATALOG	TABLE_SCHEMA	TABLE_NAME	PARENT_TABLE_CATALOG	PARENT_TABLE_SCHEMA	PARENT_TABLE_NAME	CHILD_TABLE_CATALOG	CHILD_TABLE_SCHEMA	CHILD_TABLE_NAME	PARENT_COLUMN_NAME	CHILD_COLUMN_NAME	JOIN_TYPE	JSON_KEY_NAME
def	hospital	appointments_dv	def	hospital	appointments	def	hospital	doctors	doctor_id	doctor_id	outer	doctor
def	hospital	appointments_dv	def	hospital	appointments	def	hospital	patients	patient_id	patient_id	outer	patient
def	hospital	doctors_dv	def	hospital	appointments	def	hospital	patients	patient_id	patient_id	outer	patient
def	hospital	doctors_dv	def	hospital	doctors	def	hospital	appointments	doctor_id	appointment_id	nested	appointments
def	hospital	lab_reports_dv	def	hospital	lab_reports	def	hospital	doctors	doctor_id	doctor_id	outer	doctor
def	hospital	lab_reports_dv	def	hospital	lab_reports	def	hospital	patients	patient_id	patient_id	outer	patient
def	hospital	patient_dv	def	hospital	appointments	def	hospital	doctors	doctor_id	doctor_id	outer	doctor
def	hospital	patient_dv	def	hospital	patients	def	hospital	appointments	patient_id	patient_id	nested	appointments
def	hospital	patient_dv	def	hospital	patients	def	hospital	lab_reports	patient_id	patient_id	nested	reports
DROP VIEW appointments_dv;
DROP VIEW lab_reports_dv;
DROP VIEW doctors_dv;
DROP VIEW patient_dv;
DROP TABLE Lab_Reports;
DROP TABLE Appointments;
DROP TABLE Doctors;
DROP TABLE Patients;
DROP SCHEMA hospital;
