include/rpl/init_source_replica.inc
Warnings:
Note	####	Sending passwords in plain text without SSL/TLS is extremely insecure.
Note	####	Storing MySQL user name or password information in the connection metadata repository is not secure and is therefore not recommended. Please consider using the USER and PASSWORD connection options for START REPLICA; see the 'START REPLICA Syntax' in the MySQL Manual for more information.
[connection master]
call mtr.add_suppression("Replica I/O: The replica I/O thread stops because a fatal error is encountered when it tried to SET @master_binlog_checksum");
create table t1(n int);
select * from t1;
n
STOP REPLICA sql_thread;
insert into t1 values(1);
insert into t1 values(2);
include/rpl/wait_for_replica_status.inc [Read_Source_Log_Pos]
include/rpl/stop_replica.inc
CHANGE REPLICATION SOURCE to SOURCE_USER='root';
Warnings:
Note	####	Sending passwords in plain text without SSL/TLS is extremely insecure.
Note	####	Storing MySQL user name or password information in the connection metadata repository is not secure and is therefore not recommended. Please consider using the USER and PASSWORD connection options for START REPLICA; see the 'START REPLICA Syntax' in the MySQL Manual for more information.
START REPLICA;
select * from t1;
n
1
2
drop table t1;
include/rpl/reset.inc
create table t1 (a int);
insert into t1 values (1);
flush logs;
insert into t1 values (2);
include/diff_tables.inc [master:t1, slave:t1]
include/rpl/stop_replica.inc
delete from t1 where a=2;
CHANGE REPLICATION SOURCE TO relay_log_file='slave-relay-bin.000005', relay_log_pos=4;
START REPLICA sql_thread;
include/rpl/wait_for_applier_to_start.inc
include/diff_tables.inc [master:t1, slave:t1]
START REPLICA io_thread;
include/rpl/wait_for_receiver_to_start.inc
set global relay_log_purge=1;
drop table t1;
include/rpl/reset.inc
Source_Retry_Count: 
include/rpl/stop_replica.inc
CHANGE REPLICATION SOURCE TO SOURCE_RETRY_COUNT=20;
include/rpl/start_replica.inc
include/rpl/stop_replica.inc
CHANGE REPLICATION SOURCE TO SOURCE_RETRY_COUNT=0;
include/rpl/start_replica.inc
include/rpl/stop_replica.inc
CHANGE REPLICATION SOURCE TO SOURCE_RETRY_COUNT=1;
include/rpl/start_replica.inc
include/rpl/stop_replica.inc
CHANGE REPLICATION SOURCE TO SOURCE_RETRY_COUNT=10;
include/rpl/start_replica.inc
include/rpl/stop_replica.inc
CHANGE REPLICATION SOURCE TO SOURCE_RETRY_COUNT=RETRY_COUNT_SET;
SELECT RETRY_COUNT_EXPECTED AS current_retry_count;
current_retry_count
RETRY_COUNT_EXPECTED
CHANGE REPLICATION SOURCE TO SOURCE_CONNECT_RETRY= 2;
CHANGE REPLICATION SOURCE TO SOURCE_CONNECT_RETRY= 1;
include/rpl/restart_server.inc [server_number=2]
include/rpl/start_replica.inc
include/rpl/stop_replica.inc
CHANGE REPLICATION SOURCE TO SOURCE_RETRY_COUNT=10;
CHANGE REPLICATION SOURCE TO SOURCE_RETRY_COUNT='a';
ERROR 42000: You have an error in your SQL syntax; check the manual that corresponds to your MySQL server version for the right syntax to use near ''a'' at line 1
CHANGE REPLICATION SOURCE TO SOURCE_RETRY_COUNT=-1;
ERROR 42000: You have an error in your SQL syntax; check the manual that corresponds to your MySQL server version for the right syntax to use near '-1' at line 1
include/rpl/start_replica.inc
include/rpl/stop_replica.inc
CHANGE REPLICATION SOURCE TO SOURCE_CONNECT_RETRY= 200, IGNORE_SERVER_IDS= (100, 200, 300, 400, 500);
include/rpl/restart_server.inc [server_number=2]
include/rpl/start_replica.inc
Eexpected values: "100, 200, 300, 400, 500" == "100, 200, 300, 400, 500" or 200 == 200
include/rpl/stop_replica.inc
CHANGE REPLICATION SOURCE TO IGNORE_SERVER_IDS= ();
include/rpl/start_replica.inc
include/rpl/stop_replica.inc
create table t1(n int, b varchar(256));
insert into t1 values(1, <source_bind>);
CHANGE REPLICATION SOURCE to SOURCE_HOST=<source_bind>, SOURCE_BIND=<source_bind>;
START REPLICA;
include/rpl/wait_for_replica_to_start.inc
drop table t1;
include/rpl/stop_replica.inc
create table t1(n int, b varchar(256));
insert into t1 values(1, <source_bind>);
CHANGE REPLICATION SOURCE to  SOURCE_BIND=<source_bind>;
START REPLICA;
include/rpl/wait_for_receiver_error.inc [errno=2003]
got expected error 2003
include/rpl/stop_replica.inc
CHANGE REPLICATION SOURCE to SOURCE_BIND='';
START REPLICA;
include/rpl/wait_for_replica_to_start.inc
drop table t1;
include/rpl/stop_replica.inc
create table t1(n int, b varchar(256));
insert into t1 values(1, <source_bind>);
CHANGE REPLICATION SOURCE to SOURCE_HOST=<source_bind>, SOURCE_BIND=<source_bind>;
START REPLICA;
include/rpl/wait_for_replica_to_start.inc
drop table t1;
include/rpl/stop_replica.inc
create table t1(n int, b varchar(256));
insert into t1 values(1, <source_bind>);
CHANGE REPLICATION SOURCE to  SOURCE_BIND=<source_bind>;
START REPLICA;
include/rpl/wait_for_replica_to_start.inc
drop table t1;
include/rpl/stop_replica.inc
CHANGE REPLICATION SOURCE TO SOURCE_HOST='SAVE_SOURCE_HOST';
include/rpl/start_replica.inc
include/rpl/deinit.inc
