RESET BINARY LOGS AND GTIDS;
CREATE TABLE t1 (c1 char(50)) ENGINE=MyISAM;
LOAD DATA INFILE '../../std_data/words.dat' INTO TABLE t1;
LOAD DATA CONCURRENT INFILE '../../std_data/words.dat' INTO TABLE t1;
include/rpl/deprecated/show_binlog_events.inc
Log_name	Pos	Event_type	Server_id	End_log_pos	Info
master-bin.000001	#	Query	#	#	use `test`; CREATE TABLE t1 (c1 char(50)) ENGINE=MyISAM
master-bin.000001	#	Query	#	#	BEGIN
master-bin.000001	#	Begin_load_query	#	#	;file_id=#;block_len=#
master-bin.000001	#	Execute_load_query	#	#	use `test`; LOAD DATA INFILE '../../std_data/words.dat' INTO TABLE `t1` FIELDS TERMINATED BY '\t' ENCLOSED BY '' ESCAPED BY '\\' LINES TERMINATED BY '\n' (`c1`) ;file_id=#
master-bin.000001	#	Query	#	#	COMMIT
master-bin.000001	#	Query	#	#	BEGIN
master-bin.000001	#	Begin_load_query	#	#	;file_id=#;block_len=#
master-bin.000001	#	Execute_load_query	#	#	use `test`; LOAD DATA CONCURRENT INFILE '../../std_data/words.dat' INTO TABLE `t1` FIELDS TERMINATED BY '\t' ENCLOSED BY '' ESCAPED BY '\\' LINES TERMINATED BY '\n' (`c1`) ;file_id=#
master-bin.000001	#	Query	#	#	COMMIT
DROP TABLE t1;
include/rpl/init_source_replica.inc
Warnings:
Note	####	Sending passwords in plain text without SSL/TLS is extremely insecure.
Note	####	Storing MySQL user name or password information in the connection metadata repository is not secure and is therefore not recommended. Please consider using the USER and PASSWORD connection options for START REPLICA; see the 'START REPLICA Syntax' in the MySQL Manual for more information.
[connection master]
select last_insert_id();
last_insert_id()
0
create table t1(a int not null auto_increment, b int, primary key(a) );
load data CONCURRENT infile '../../std_data/rpl_loaddata.dat' into table t1;
select last_insert_id();
last_insert_id()
1
create temporary table t2 (day date,id int(9),category enum('a','b','c'),name varchar(60));
Warnings:
Warning	1681	Integer display width is deprecated and will be removed in a future release.
load data CONCURRENT infile '../../std_data/rpl_loaddata2.dat' into table t2 fields terminated by ',' optionally enclosed by '%' escaped by '@' lines terminated by '\n##\n' starting by '>' ignore 1 lines;
create table t3 (day date,id int(9),category enum('a','b','c'),name varchar(60));
Warnings:
Warning	1681	Integer display width is deprecated and will be removed in a future release.
insert into t3 select * from t2;
include/rpl/sync_to_replica.inc
select * from t1;
a	b
1	10
2	15
select * from t3;
day	id	category	name
2003-02-22	2461	b	a a a @ %  ' " a
2003-03-22	2161	c	asdf
2003-03-22	2416	a	bbbbb
drop table t1;
drop table t2;
drop table t3;
create table t1(a int, b int, unique(b));
include/rpl/sync_to_replica.inc
insert into t1 values(1,10);
load data CONCURRENT infile '../../std_data/rpl_loaddata.dat' into table t1;
call mtr.add_suppression("Replica SQL.*Error .Duplicate entry .10. for key .t1.b.. on query.* Error_code: MY-001062");
call mtr.add_suppression("Replica SQL.*Query caused different errors on source and replica.*Error on source:.*error code=1062.*Error on replica:.*Error_code: MY-013113");
call mtr.add_suppression("The replica coordinator and worker threads are stopped, possibly leaving data in inconsistent state");
include/rpl/wait_for_applier_error_and_skip.inc [errno=1062]
include/rpl/assert_replica_no_error.inc
set sql_log_bin=0;
delete from t1;
set sql_log_bin=1;
load data CONCURRENT infile '../../std_data/rpl_loaddata.dat' into table t1;
include/rpl/wait_for_applier_error.inc [errno=1062]
include/rpl/stop_receiver.inc
CHANGE REPLICATION SOURCE to SOURCE_USER='test';
Warnings:
Note	####	Sending passwords in plain text without SSL/TLS is extremely insecure.
Note	####	Storing MySQL user name or password information in the connection metadata repository is not secure and is therefore not recommended. Please consider using the USER and PASSWORD connection options for START REPLICA; see the 'START REPLICA Syntax' in the MySQL Manual for more information.
CHANGE REPLICATION SOURCE to SOURCE_USER='root';
Warnings:
Note	####	Sending passwords in plain text without SSL/TLS is extremely insecure.
Note	####	Storing MySQL user name or password information in the connection metadata repository is not secure and is therefore not recommended. Please consider using the USER and PASSWORD connection options for START REPLICA; see the 'START REPLICA Syntax' in the MySQL Manual for more information.
include/rpl/assert_replica_no_error.inc
set global sql_replica_skip_counter=1;
START REPLICA;
set sql_log_bin=0;
delete from t1;
set sql_log_bin=1;
load data CONCURRENT infile '../../std_data/rpl_loaddata.dat' into table t1;
include/rpl/wait_for_applier_error.inc [errno=1062]
STOP REPLICA;
RESET REPLICA;
include/rpl/assert_replica_no_error.inc
reset binary logs and gtids;
create table t2 (day date,id int(9),category enum('a','b','c'),name varchar(60),
unique(day)) engine=MyISAM;
Warnings:
Warning	1681	Integer display width is deprecated and will be removed in a future release.
load data CONCURRENT infile '../../std_data/rpl_loaddata2.dat' into table t2 fields
terminated by ',' optionally enclosed by '%' escaped by '@' lines terminated by
'\n##\n' starting by '>' ignore 1 lines;
ERROR 23000: Duplicate entry '2003-03-22' for key 't2.day'
select * from t2;
day	id	category	name
2003-02-22	2461	b	a a a @ %  ' " a
2003-03-22	2161	c	asdf
START REPLICA;
select * from t2;
day	id	category	name
2003-02-22	2461	b	a a a @ %  ' " a
2003-03-22	2161	c	asdf
alter table t2 drop key day;
delete from t2;
load data CONCURRENT infile '../../std_data/rpl_loaddata2.dat' into table t2 fields
terminated by ',' optionally enclosed by '%' escaped by '@' lines terminated by
'\n##\n' starting by '>' ignore 1 lines;
ERROR 23000: Duplicate entry '2003-03-22' for key 't2.day'
include/rpl/wait_for_applier_error.inc [errno=13113]
drop table t1, t2;
drop table t1, t2;
include/rpl/stop_receiver.inc
RESET REPLICA;
include/rpl/reset.inc
drop database if exists b48297_db1;
drop database if exists b42897_db2;
create database b48297_db1;
create database b42897_db2;
use b48297_db1;
CREATE TABLE t1 (c1 VARCHAR(256)) engine=MyISAM;;
use b42897_db2;
### assertion: works with cross-referenced database
LOAD DATA CONCURRENT LOCAL INFILE 'MYSQLTEST_VARDIR/std_data/loaddata5.dat' INTO TABLE b48297_db1.t1;
use b48297_db1;
### assertion: works with fully qualified name on current database
LOAD DATA CONCURRENT LOCAL INFILE 'MYSQLTEST_VARDIR/std_data/loaddata5.dat' INTO TABLE b48297_db1.t1;
### assertion: works without fully qualified name on current database
LOAD DATA CONCURRENT LOCAL INFILE 'MYSQLTEST_VARDIR/std_data/loaddata5.dat' INTO TABLE t1;
### create connection without default database
### connect (conn2,localhost,root,,*NO-ONE*);
### assertion: works without stating the default database
LOAD DATA CONCURRENT LOCAL INFILE 'MYSQLTEST_VARDIR/std_data/loaddata5.dat' INTO TABLE b48297_db1.t1;
### disconnect and switch back to master connection
include/rpl/sync_to_replica.inc
use b48297_db1;
include/diff_tables.inc [master:b48297_db1.t1, slave:b48297_db1.t1]
DROP DATABASE b48297_db1;
DROP DATABASE b42897_db2;
include/rpl/sync_to_replica.inc
include/rpl/reset.inc
use test;
CREATE TABLE t1 (`key` TEXT, `text` TEXT);
LOAD DATA INFILE '../../std_data/loaddata2.dat' REPLACE INTO TABLE `t1` FIELDS TERMINATED BY ',';
SELECT * FROM t1;
key	text
Field A	'Field B'
Field 1	'Field 2' 
Field 3	'Field 4'
'Field 5' 	'Field 6'
Field 6	 'Field 7'
include/rpl/sync_to_replica.inc
DROP TABLE t1;
include/rpl/deinit.inc
