# ----------------------------------------------------------------------
# Setup
# Creating custom global manifest file for MySQL server
# Creating custom global configuration file for keyring component: component_keyring_file
# Re-starting mysql server with manifest file
# ----------------------------------------------------------------------
#
# wl9508: Show that explicit and implicit undo tablespaces can be encrypted.
#
use test;
CREATE table tab1(c1 int);
# create bootstrap file
# Stop the MTR default DB server
# Taking backup of global manifest file for MySQL server
# Run the bootstrap command of datadir1
# Restore global manifest file for MySQL server from backup
SELECT @@datadir;
@@datadir
MYSQLD_DATADIR1/
SHOW VARIABLES LIKE 'keyring_file%';
Variable_name	Value
SELECT @@innodb_undo_log_encrypt;
@@innodb_undo_log_encrypt
1
CREATE UNDO TABLESPACE undo_003 ADD DATAFILE 'undo_003.ibu';
CREATE DATABASE nath;
use nath;
CREATE TABLE tab2(c1 int , c2 varchar(10)) Engine=InnoDB ENCRYPTION='Y';
INSERT INTO tab2 VALUES(2, 'VISH');
CREATE INDEX ix2 ON tab2(c2) ;
CREATE UNDO TABLESPACE undo_004 ADD DATAFILE 'undo_004.ibu';
ALTER UNDO TABLESPACE undo_003 SET INACTIVE;
ALTER UNDO TABLESPACE undo_004 SET INACTIVE;
DELETE FROM tab2;
DROP UNDO TABLESPACE undo_003;
DROP UNDO TABLESPACE undo_004;
DROP TABLE tab2;
DROP DATABASE nath;
# Stop the encrypt server
SELECT @@datadir;
@@datadir
MYSQLD_OLD_DATADIR
use test;
DROP TABLE tab1;
#
# bug#29006275 : ENCRYPTION MASTER KEY IS GENERATED WITH BLANK UUID
#
# Stop the non-encrypted server
# Run the bootstrap command of datadir1
# Show that a master key with a blank Server UUID is not used.
SELECT * FROM performance_schema.keyring_keys where KEY_ID='INNODBKey--1';
KEY_ID	KEY_OWNER	BACKEND_KEY_ID
# Stop the encrypted server
# ----------------------------------------------------------------------
# Teardown
# Removing local keyring file for keyring component: component_keyring_file
# Removing global configuration file for keyring component: component_keyring_file
# Removing global manifest file for MySQL server
# Restarting server without the manifest file
# ----------------------------------------------------------------------
