# ----------------------------------------------------------------------
# Setup
# Creating local configuration file for keyring component: component_keyring_file
# Creating manifest file for current MySQL server instance
# Re-starting mysql server with manifest file
# ----------------------------------------------------------------------
#########################################################################
# RESTART 1 : WITH  KEYRING
#########################################################################
#########
# SETUP #
#########
CREATE TABLESPACE encrypt_ts ADD DATAFILE 'encrypt_ts.ibd' ENCRYPTION ='Y' ENGINE=InnoDB;
CREATE TABLESPACE encrypt_ts1 ADD DATAFILE 'encrypt_ts1.ibd' ENCRYPTION ='N' ENGINE=InnoDB;
DROP DATABASE IF EXISTS tde_db;
DROP TABLE IF EXISTS tde_db. t_encrypt;
CREATE DATABASE tde_db;
USE tde_db;
CREATE PROCEDURE tde_db.init_setup()
begin
/*  Create table in encrypted tablespace */
CREATE TABLE tde_db.t_encrypt(c2 INT NOT NULL AUTO_INCREMENT PRIMARY KEY,
c3 CHAR(255) Default 'No text',
c4 JSON ,
c5 INT GENERATED ALWAYS AS (JSON_EXTRACT(c4,'$.key_a')) STORED,
c6 INT GENERATED ALWAYS AS (JSON_EXTRACT(c4,'$.key_b')) VIRTUAL,
c7 POINT NOT NULL SRID 0,
spatial INDEX idx2 (c7)
) TABLESPACE=encrypt_ts ENCRYPTION='Y' ENGINE = InnoDB;
/*  Create table in non-encrypted tablesapce */
CREATE TABLE tde_db.t_non_encrypt(c2 INT NOT NULL AUTO_INCREMENT PRIMARY KEY,
c3 CHAR(255) Default 'No text',
c4 JSON ,
c5 INT GENERATED ALWAYS AS (JSON_EXTRACT(c4,'$.key_a')) STORED,
c6 INT GENERATED ALWAYS AS (JSON_EXTRACT(c4,'$.key_b')) VIRTUAL,
c7 POINT NOT NULL SRID 0,
spatial INDEX idx2 (c7)
) TABLESPACE=encrypt_ts1  ENGINE = InnoDB;
/*  insert into encrypted table */
INSERT INTO tde_db.t_encrypt(c3,c4,c7) VALUES(CONCAT(REPEAT('a',200),LPAD(CAST(1 AS CHAR),4,'0')),'{ "key_a": 1, "key_b": 2, "key_c": 3 }',ST_GeomFromText('POINT(383293632 1754448)'));
INSERT INTO tde_db.t_encrypt(c3,c4,c7) SELECT c3,c4,c7 FROM tde_db.t_encrypt;
INSERT INTO tde_db.t_encrypt(c3,c4,c7) SELECT c3,c4,c7 FROM tde_db.t_encrypt;
INSERT INTO tde_db.t_encrypt(c3,c4,c7) SELECT c3,c4,c7 FROM tde_db.t_encrypt;
INSERT INTO tde_db.t_encrypt(c3,c4,c7) SELECT c3,c4,c7 FROM tde_db.t_encrypt;
INSERT INTO tde_db.t_encrypt(c3,c4,c7) SELECT c3,c4,c7 FROM tde_db.t_encrypt;
INSERT INTO tde_db.t_encrypt(c3,c4,c7) SELECT c3,c4,c7 FROM tde_db.t_encrypt;
SELECT '/*  select tde_db.t_encrypt */';
SELECT COUNT(*) FROM tde_db.t_encrypt;
SELECT c2,right(c3,20),c4,c5,c6,ST_AsText(c7) FROM tde_db.t_encrypt LIMIT 10;
/*  insert into non encrypted table */
INSERT INTO tde_db.t_non_encrypt(c2,c3,c4,c7) SELECT c2,c3,c4,c7 FROM tde_db.t_encrypt;
SELECT '/*  select tde_db.t_non_encrypt */';
SELECT COUNT(*) FROM tde_db.t_non_encrypt;
SELECT c2 ,right(c3,20),c4,c5,c6,ST_AsText(c7) FROM tde_db.t_non_encrypt LIMIT 10;
ALTER INSTANCE ROTATE INNODB MASTER KEY;
CREATE TABLE tde_db.t_encrypt_2(c2 INT NOT NULL AUTO_INCREMENT PRIMARY KEY,
c3 CHAR(255) Default 'No text',
c4 JSON ,
c5 INT GENERATED ALWAYS AS (JSON_EXTRACT(c4,'$.key_a')) STORED,
c6 INT GENERATED ALWAYS AS (JSON_EXTRACT(c4,'$.key_b')) VIRTUAL,
c7 POINT NOT NULL SRID 0,
spatial INDEX idx2 (c7)
) TABLESPACE=encrypt_ts ENCRYPTION='Y' ENGINE = InnoDB;
CREATE TABLE tde_db.t_non_encrypt_2(c2 INT NOT NULL AUTO_INCREMENT PRIMARY KEY,
c3 CHAR(255) Default 'No text',
c4 JSON ,
c5 INT GENERATED ALWAYS AS (JSON_EXTRACT(c4,'$.key_a')) STORED,
c6 INT GENERATED ALWAYS AS (JSON_EXTRACT(c4,'$.key_b')) VIRTUAL,
c7 POINT NOT NULL SRID 0,
spatial INDEX idx2 (c7)
) TABLESPACE=encrypt_ts1 ENGINE = InnoDB;
/*  insert into encrypted table 2 */
INSERT INTO tde_db.t_encrypt_2(c3,c4,c7) SELECT c3,c4,c7 FROM tde_db.t_encrypt;
SELECT '/*  select tde_db.t_encrypt_2 */';
SELECT COUNT(*) FROM tde_db.t_encrypt_2;
SELECT c2 ,right(c3,20),c4,c5,c6,ST_AsText(c7) FROM tde_db.t_encrypt_2 LIMIT 10;
/* insert into NON encrypted table 2 */
INSERT INTO tde_db.t_non_encrypt_2(c2,c3,c4,c7) SELECT c2,c3,c4,c7 FROM tde_db.t_encrypt;
SELECT '/*  select tde_db.t_non_encrypt_2 */';
SELECT COUNT(*) FROM tde_db.t_non_encrypt_2;
SELECT c2 ,right(c3,20),c4,c5,c6,ST_AsText(c7) FROM tde_db.t_non_encrypt_2 LIMIT 10;
end|
#-----------------------------------------------------------------------
# Initialize tables
call tde_db.init_setup();
/*  select tde_db.t_encrypt */
/*  select tde_db.t_encrypt */
COUNT(*)
64
c2	right(c3,20)	c4	c5	c6	ST_AsText(c7)
1	aaaaaaaaaaaaaaaa0001	{"key_a": 1, "key_b": 2, "key_c": 3}	1	2	POINT(383293632 1754448)
2	aaaaaaaaaaaaaaaa0001	{"key_a": 1, "key_b": 2, "key_c": 3}	1	2	POINT(383293632 1754448)
3	aaaaaaaaaaaaaaaa0001	{"key_a": 1, "key_b": 2, "key_c": 3}	1	2	POINT(383293632 1754448)
4	aaaaaaaaaaaaaaaa0001	{"key_a": 1, "key_b": 2, "key_c": 3}	1	2	POINT(383293632 1754448)
6	aaaaaaaaaaaaaaaa0001	{"key_a": 1, "key_b": 2, "key_c": 3}	1	2	POINT(383293632 1754448)
7	aaaaaaaaaaaaaaaa0001	{"key_a": 1, "key_b": 2, "key_c": 3}	1	2	POINT(383293632 1754448)
8	aaaaaaaaaaaaaaaa0001	{"key_a": 1, "key_b": 2, "key_c": 3}	1	2	POINT(383293632 1754448)
9	aaaaaaaaaaaaaaaa0001	{"key_a": 1, "key_b": 2, "key_c": 3}	1	2	POINT(383293632 1754448)
13	aaaaaaaaaaaaaaaa0001	{"key_a": 1, "key_b": 2, "key_c": 3}	1	2	POINT(383293632 1754448)
14	aaaaaaaaaaaaaaaa0001	{"key_a": 1, "key_b": 2, "key_c": 3}	1	2	POINT(383293632 1754448)
/*  select tde_db.t_non_encrypt */
/*  select tde_db.t_non_encrypt */
COUNT(*)
64
c2	right(c3,20)	c4	c5	c6	ST_AsText(c7)
1	aaaaaaaaaaaaaaaa0001	{"key_a": 1, "key_b": 2, "key_c": 3}	1	2	POINT(383293632 1754448)
2	aaaaaaaaaaaaaaaa0001	{"key_a": 1, "key_b": 2, "key_c": 3}	1	2	POINT(383293632 1754448)
3	aaaaaaaaaaaaaaaa0001	{"key_a": 1, "key_b": 2, "key_c": 3}	1	2	POINT(383293632 1754448)
4	aaaaaaaaaaaaaaaa0001	{"key_a": 1, "key_b": 2, "key_c": 3}	1	2	POINT(383293632 1754448)
6	aaaaaaaaaaaaaaaa0001	{"key_a": 1, "key_b": 2, "key_c": 3}	1	2	POINT(383293632 1754448)
7	aaaaaaaaaaaaaaaa0001	{"key_a": 1, "key_b": 2, "key_c": 3}	1	2	POINT(383293632 1754448)
8	aaaaaaaaaaaaaaaa0001	{"key_a": 1, "key_b": 2, "key_c": 3}	1	2	POINT(383293632 1754448)
9	aaaaaaaaaaaaaaaa0001	{"key_a": 1, "key_b": 2, "key_c": 3}	1	2	POINT(383293632 1754448)
13	aaaaaaaaaaaaaaaa0001	{"key_a": 1, "key_b": 2, "key_c": 3}	1	2	POINT(383293632 1754448)
14	aaaaaaaaaaaaaaaa0001	{"key_a": 1, "key_b": 2, "key_c": 3}	1	2	POINT(383293632 1754448)
/*  select tde_db.t_encrypt_2 */
/*  select tde_db.t_encrypt_2 */
COUNT(*)
64
c2	right(c3,20)	c4	c5	c6	ST_AsText(c7)
1	aaaaaaaaaaaaaaaa0001	{"key_a": 1, "key_b": 2, "key_c": 3}	1	2	POINT(383293632 1754448)
2	aaaaaaaaaaaaaaaa0001	{"key_a": 1, "key_b": 2, "key_c": 3}	1	2	POINT(383293632 1754448)
3	aaaaaaaaaaaaaaaa0001	{"key_a": 1, "key_b": 2, "key_c": 3}	1	2	POINT(383293632 1754448)
4	aaaaaaaaaaaaaaaa0001	{"key_a": 1, "key_b": 2, "key_c": 3}	1	2	POINT(383293632 1754448)
5	aaaaaaaaaaaaaaaa0001	{"key_a": 1, "key_b": 2, "key_c": 3}	1	2	POINT(383293632 1754448)
6	aaaaaaaaaaaaaaaa0001	{"key_a": 1, "key_b": 2, "key_c": 3}	1	2	POINT(383293632 1754448)
7	aaaaaaaaaaaaaaaa0001	{"key_a": 1, "key_b": 2, "key_c": 3}	1	2	POINT(383293632 1754448)
8	aaaaaaaaaaaaaaaa0001	{"key_a": 1, "key_b": 2, "key_c": 3}	1	2	POINT(383293632 1754448)
9	aaaaaaaaaaaaaaaa0001	{"key_a": 1, "key_b": 2, "key_c": 3}	1	2	POINT(383293632 1754448)
10	aaaaaaaaaaaaaaaa0001	{"key_a": 1, "key_b": 2, "key_c": 3}	1	2	POINT(383293632 1754448)
/*  select tde_db.t_non_encrypt_2 */
/*  select tde_db.t_non_encrypt_2 */
COUNT(*)
64
c2	right(c3,20)	c4	c5	c6	ST_AsText(c7)
1	aaaaaaaaaaaaaaaa0001	{"key_a": 1, "key_b": 2, "key_c": 3}	1	2	POINT(383293632 1754448)
2	aaaaaaaaaaaaaaaa0001	{"key_a": 1, "key_b": 2, "key_c": 3}	1	2	POINT(383293632 1754448)
3	aaaaaaaaaaaaaaaa0001	{"key_a": 1, "key_b": 2, "key_c": 3}	1	2	POINT(383293632 1754448)
4	aaaaaaaaaaaaaaaa0001	{"key_a": 1, "key_b": 2, "key_c": 3}	1	2	POINT(383293632 1754448)
6	aaaaaaaaaaaaaaaa0001	{"key_a": 1, "key_b": 2, "key_c": 3}	1	2	POINT(383293632 1754448)
7	aaaaaaaaaaaaaaaa0001	{"key_a": 1, "key_b": 2, "key_c": 3}	1	2	POINT(383293632 1754448)
8	aaaaaaaaaaaaaaaa0001	{"key_a": 1, "key_b": 2, "key_c": 3}	1	2	POINT(383293632 1754448)
9	aaaaaaaaaaaaaaaa0001	{"key_a": 1, "key_b": 2, "key_c": 3}	1	2	POINT(383293632 1754448)
13	aaaaaaaaaaaaaaaa0001	{"key_a": 1, "key_b": 2, "key_c": 3}	1	2	POINT(383293632 1754448)
14	aaaaaaaaaaaaaaaa0001	{"key_a": 1, "key_b": 2, "key_c": 3}	1	2	POINT(383293632 1754448)
SELECT status_key, status_value FROM
performance_schema.keyring_component_status
WHERE status_key LIKE '%name%' OR status_key LIKE '%status%';
status_key	status_value
Component_name	component_keyring_file
Implementation_name	component_keyring_file
Component_status	Active
# Taking backup of local keyring file for keyring component: component_keyring_file
ALTER INSTANCE RELOAD KEYRING;
# Select non encrypted tables : Pass
SELECT COUNT(*) FROM tde_db.t_non_encrypt;
COUNT(*)
64
SELECT COUNT(*) FROM tde_db.t_non_encrypt_2;
COUNT(*)
64
# Select encrypted tables : No Error (-master key is cached)
SELECT c2 ,right(c3,20),c4,c5,c6,ST_AsText(c7) FROM tde_db.t_encrypt LIMIT 10;
c2	right(c3,20)	c4	c5	c6	ST_AsText(c7)
1	aaaaaaaaaaaaaaaa0001	{"key_a": 1, "key_b": 2, "key_c": 3}	1	2	POINT(383293632 1754448)
2	aaaaaaaaaaaaaaaa0001	{"key_a": 1, "key_b": 2, "key_c": 3}	1	2	POINT(383293632 1754448)
3	aaaaaaaaaaaaaaaa0001	{"key_a": 1, "key_b": 2, "key_c": 3}	1	2	POINT(383293632 1754448)
4	aaaaaaaaaaaaaaaa0001	{"key_a": 1, "key_b": 2, "key_c": 3}	1	2	POINT(383293632 1754448)
6	aaaaaaaaaaaaaaaa0001	{"key_a": 1, "key_b": 2, "key_c": 3}	1	2	POINT(383293632 1754448)
7	aaaaaaaaaaaaaaaa0001	{"key_a": 1, "key_b": 2, "key_c": 3}	1	2	POINT(383293632 1754448)
8	aaaaaaaaaaaaaaaa0001	{"key_a": 1, "key_b": 2, "key_c": 3}	1	2	POINT(383293632 1754448)
9	aaaaaaaaaaaaaaaa0001	{"key_a": 1, "key_b": 2, "key_c": 3}	1	2	POINT(383293632 1754448)
13	aaaaaaaaaaaaaaaa0001	{"key_a": 1, "key_b": 2, "key_c": 3}	1	2	POINT(383293632 1754448)
14	aaaaaaaaaaaaaaaa0001	{"key_a": 1, "key_b": 2, "key_c": 3}	1	2	POINT(383293632 1754448)
SELECT c2 ,right(c3,20),c4,c5,c6,ST_AsText(c7) FROM tde_db.t_encrypt_2 LIMIT 10;
c2	right(c3,20)	c4	c5	c6	ST_AsText(c7)
1	aaaaaaaaaaaaaaaa0001	{"key_a": 1, "key_b": 2, "key_c": 3}	1	2	POINT(383293632 1754448)
2	aaaaaaaaaaaaaaaa0001	{"key_a": 1, "key_b": 2, "key_c": 3}	1	2	POINT(383293632 1754448)
3	aaaaaaaaaaaaaaaa0001	{"key_a": 1, "key_b": 2, "key_c": 3}	1	2	POINT(383293632 1754448)
4	aaaaaaaaaaaaaaaa0001	{"key_a": 1, "key_b": 2, "key_c": 3}	1	2	POINT(383293632 1754448)
5	aaaaaaaaaaaaaaaa0001	{"key_a": 1, "key_b": 2, "key_c": 3}	1	2	POINT(383293632 1754448)
6	aaaaaaaaaaaaaaaa0001	{"key_a": 1, "key_b": 2, "key_c": 3}	1	2	POINT(383293632 1754448)
7	aaaaaaaaaaaaaaaa0001	{"key_a": 1, "key_b": 2, "key_c": 3}	1	2	POINT(383293632 1754448)
8	aaaaaaaaaaaaaaaa0001	{"key_a": 1, "key_b": 2, "key_c": 3}	1	2	POINT(383293632 1754448)
9	aaaaaaaaaaaaaaaa0001	{"key_a": 1, "key_b": 2, "key_c": 3}	1	2	POINT(383293632 1754448)
10	aaaaaaaaaaaaaaaa0001	{"key_a": 1, "key_b": 2, "key_c": 3}	1	2	POINT(383293632 1754448)
SELECT COUNT(*) FROM tde_db.t_encrypt;
COUNT(*)
64
SELECT COUNT(*) FROM tde_db.t_encrypt_2;
COUNT(*)
64
# Error on "ALTER INSTANCE ..."
ALTER INSTANCE ROTATE INNODB MASTER KEY;
ERROR HY000: Can't find master key from keyring, please check in the server log if a keyring is loaded and initialized successfully.
# new table creation in encrypted tablespace is allowed after uninstall
CREATE TABLE tde_db.t_encrypt_3(c2 INT NOT NULL AUTO_INCREMENT PRIMARY KEY,
c3 CHAR(255) Default 'No text',
c4 JSON ,
c5 INT GENERATED ALWAYS AS (JSON_EXTRACT(c4,'$.key_a')) STORED,
c6 INT GENERATED ALWAYS AS (JSON_EXTRACT(c4,'$.key_b')) VIRTUAL,
c7 POINT NOT NULL SRID 0,
spatial INDEX idx2 (c7)
) TABLESPACE=encrypt_ts ENCRYPTION='Y' ENGINE = InnoDB;
# new table in non-encrypted tablespace is allowed after uninstall
CREATE TABLE tde_db.t_non_encrypt_3(c2 INT NOT NULL AUTO_INCREMENT PRIMARY KEY,
c3 CHAR(255) Default 'No text',
c4 JSON ,
c5 INT GENERATED ALWAYS AS (JSON_EXTRACT(c4,'$.key_a')) STORED,
c6 INT GENERATED ALWAYS AS (JSON_EXTRACT(c4,'$.key_b')) VIRTUAL,
c7 POINT NOT NULL SRID 0,
spatial INDEX idx2 (c7)
) TABLESPACE=encrypt_ts1  ENGINE = InnoDB;
DROP TABLE tde_db.t_encrypt , tde_db.t_encrypt_2 , tde_db.t_encrypt_3 ;
DROP TABLE tde_db.t_non_encrypt , tde_db.t_non_encrypt_2 , tde_db.t_non_encrypt_3;
#########################################################################
# Test 1 : Restart with same keyring option
#          - all tables accessible
#########################################################################
# Restoring local keyring file from backup for keyring component: component_keyring_file
ALTER INSTANCE RELOAD KEYRING;
SELECT status_key, status_value FROM
performance_schema.keyring_component_status
WHERE status_key LIKE '%name%' OR status_key LIKE '%status%';
status_key	status_value
Component_name	component_keyring_file
Implementation_name	component_keyring_file
Component_status	Active
# Initialize tables
call tde_db.init_setup();
/*  select tde_db.t_encrypt */
/*  select tde_db.t_encrypt */
COUNT(*)
64
c2	right(c3,20)	c4	c5	c6	ST_AsText(c7)
1	aaaaaaaaaaaaaaaa0001	{"key_a": 1, "key_b": 2, "key_c": 3}	1	2	POINT(383293632 1754448)
2	aaaaaaaaaaaaaaaa0001	{"key_a": 1, "key_b": 2, "key_c": 3}	1	2	POINT(383293632 1754448)
3	aaaaaaaaaaaaaaaa0001	{"key_a": 1, "key_b": 2, "key_c": 3}	1	2	POINT(383293632 1754448)
4	aaaaaaaaaaaaaaaa0001	{"key_a": 1, "key_b": 2, "key_c": 3}	1	2	POINT(383293632 1754448)
6	aaaaaaaaaaaaaaaa0001	{"key_a": 1, "key_b": 2, "key_c": 3}	1	2	POINT(383293632 1754448)
7	aaaaaaaaaaaaaaaa0001	{"key_a": 1, "key_b": 2, "key_c": 3}	1	2	POINT(383293632 1754448)
8	aaaaaaaaaaaaaaaa0001	{"key_a": 1, "key_b": 2, "key_c": 3}	1	2	POINT(383293632 1754448)
9	aaaaaaaaaaaaaaaa0001	{"key_a": 1, "key_b": 2, "key_c": 3}	1	2	POINT(383293632 1754448)
13	aaaaaaaaaaaaaaaa0001	{"key_a": 1, "key_b": 2, "key_c": 3}	1	2	POINT(383293632 1754448)
14	aaaaaaaaaaaaaaaa0001	{"key_a": 1, "key_b": 2, "key_c": 3}	1	2	POINT(383293632 1754448)
/*  select tde_db.t_non_encrypt */
/*  select tde_db.t_non_encrypt */
COUNT(*)
64
c2	right(c3,20)	c4	c5	c6	ST_AsText(c7)
1	aaaaaaaaaaaaaaaa0001	{"key_a": 1, "key_b": 2, "key_c": 3}	1	2	POINT(383293632 1754448)
2	aaaaaaaaaaaaaaaa0001	{"key_a": 1, "key_b": 2, "key_c": 3}	1	2	POINT(383293632 1754448)
3	aaaaaaaaaaaaaaaa0001	{"key_a": 1, "key_b": 2, "key_c": 3}	1	2	POINT(383293632 1754448)
4	aaaaaaaaaaaaaaaa0001	{"key_a": 1, "key_b": 2, "key_c": 3}	1	2	POINT(383293632 1754448)
6	aaaaaaaaaaaaaaaa0001	{"key_a": 1, "key_b": 2, "key_c": 3}	1	2	POINT(383293632 1754448)
7	aaaaaaaaaaaaaaaa0001	{"key_a": 1, "key_b": 2, "key_c": 3}	1	2	POINT(383293632 1754448)
8	aaaaaaaaaaaaaaaa0001	{"key_a": 1, "key_b": 2, "key_c": 3}	1	2	POINT(383293632 1754448)
9	aaaaaaaaaaaaaaaa0001	{"key_a": 1, "key_b": 2, "key_c": 3}	1	2	POINT(383293632 1754448)
13	aaaaaaaaaaaaaaaa0001	{"key_a": 1, "key_b": 2, "key_c": 3}	1	2	POINT(383293632 1754448)
14	aaaaaaaaaaaaaaaa0001	{"key_a": 1, "key_b": 2, "key_c": 3}	1	2	POINT(383293632 1754448)
/*  select tde_db.t_encrypt_2 */
/*  select tde_db.t_encrypt_2 */
COUNT(*)
64
c2	right(c3,20)	c4	c5	c6	ST_AsText(c7)
1	aaaaaaaaaaaaaaaa0001	{"key_a": 1, "key_b": 2, "key_c": 3}	1	2	POINT(383293632 1754448)
2	aaaaaaaaaaaaaaaa0001	{"key_a": 1, "key_b": 2, "key_c": 3}	1	2	POINT(383293632 1754448)
3	aaaaaaaaaaaaaaaa0001	{"key_a": 1, "key_b": 2, "key_c": 3}	1	2	POINT(383293632 1754448)
4	aaaaaaaaaaaaaaaa0001	{"key_a": 1, "key_b": 2, "key_c": 3}	1	2	POINT(383293632 1754448)
5	aaaaaaaaaaaaaaaa0001	{"key_a": 1, "key_b": 2, "key_c": 3}	1	2	POINT(383293632 1754448)
6	aaaaaaaaaaaaaaaa0001	{"key_a": 1, "key_b": 2, "key_c": 3}	1	2	POINT(383293632 1754448)
7	aaaaaaaaaaaaaaaa0001	{"key_a": 1, "key_b": 2, "key_c": 3}	1	2	POINT(383293632 1754448)
8	aaaaaaaaaaaaaaaa0001	{"key_a": 1, "key_b": 2, "key_c": 3}	1	2	POINT(383293632 1754448)
9	aaaaaaaaaaaaaaaa0001	{"key_a": 1, "key_b": 2, "key_c": 3}	1	2	POINT(383293632 1754448)
10	aaaaaaaaaaaaaaaa0001	{"key_a": 1, "key_b": 2, "key_c": 3}	1	2	POINT(383293632 1754448)
/*  select tde_db.t_non_encrypt_2 */
/*  select tde_db.t_non_encrypt_2 */
COUNT(*)
64
c2	right(c3,20)	c4	c5	c6	ST_AsText(c7)
1	aaaaaaaaaaaaaaaa0001	{"key_a": 1, "key_b": 2, "key_c": 3}	1	2	POINT(383293632 1754448)
2	aaaaaaaaaaaaaaaa0001	{"key_a": 1, "key_b": 2, "key_c": 3}	1	2	POINT(383293632 1754448)
3	aaaaaaaaaaaaaaaa0001	{"key_a": 1, "key_b": 2, "key_c": 3}	1	2	POINT(383293632 1754448)
4	aaaaaaaaaaaaaaaa0001	{"key_a": 1, "key_b": 2, "key_c": 3}	1	2	POINT(383293632 1754448)
6	aaaaaaaaaaaaaaaa0001	{"key_a": 1, "key_b": 2, "key_c": 3}	1	2	POINT(383293632 1754448)
7	aaaaaaaaaaaaaaaa0001	{"key_a": 1, "key_b": 2, "key_c": 3}	1	2	POINT(383293632 1754448)
8	aaaaaaaaaaaaaaaa0001	{"key_a": 1, "key_b": 2, "key_c": 3}	1	2	POINT(383293632 1754448)
9	aaaaaaaaaaaaaaaa0001	{"key_a": 1, "key_b": 2, "key_c": 3}	1	2	POINT(383293632 1754448)
13	aaaaaaaaaaaaaaaa0001	{"key_a": 1, "key_b": 2, "key_c": 3}	1	2	POINT(383293632 1754448)
14	aaaaaaaaaaaaaaaa0001	{"key_a": 1, "key_b": 2, "key_c": 3}	1	2	POINT(383293632 1754448)
# restart with same keyring option
# All tables must be accessible
SELECT COUNT(*) FROM tde_db.t_encrypt;
COUNT(*)
64
SELECT c2,right(c3,20),c4,c5,c6,ST_AsText(c7) FROM tde_db.t_encrypt LIMIT 10;
c2	right(c3,20)	c4	c5	c6	ST_AsText(c7)
1	aaaaaaaaaaaaaaaa0001	{"key_a": 1, "key_b": 2, "key_c": 3}	1	2	POINT(383293632 1754448)
2	aaaaaaaaaaaaaaaa0001	{"key_a": 1, "key_b": 2, "key_c": 3}	1	2	POINT(383293632 1754448)
3	aaaaaaaaaaaaaaaa0001	{"key_a": 1, "key_b": 2, "key_c": 3}	1	2	POINT(383293632 1754448)
4	aaaaaaaaaaaaaaaa0001	{"key_a": 1, "key_b": 2, "key_c": 3}	1	2	POINT(383293632 1754448)
6	aaaaaaaaaaaaaaaa0001	{"key_a": 1, "key_b": 2, "key_c": 3}	1	2	POINT(383293632 1754448)
7	aaaaaaaaaaaaaaaa0001	{"key_a": 1, "key_b": 2, "key_c": 3}	1	2	POINT(383293632 1754448)
8	aaaaaaaaaaaaaaaa0001	{"key_a": 1, "key_b": 2, "key_c": 3}	1	2	POINT(383293632 1754448)
9	aaaaaaaaaaaaaaaa0001	{"key_a": 1, "key_b": 2, "key_c": 3}	1	2	POINT(383293632 1754448)
13	aaaaaaaaaaaaaaaa0001	{"key_a": 1, "key_b": 2, "key_c": 3}	1	2	POINT(383293632 1754448)
14	aaaaaaaaaaaaaaaa0001	{"key_a": 1, "key_b": 2, "key_c": 3}	1	2	POINT(383293632 1754448)
SELECT COUNT(*) FROM tde_db.t_non_encrypt;
COUNT(*)
64
SELECT c2,right(c3,20),c4,c5,c6,ST_AsText(c7) FROM tde_db.t_non_encrypt LIMIT 10;
c2	right(c3,20)	c4	c5	c6	ST_AsText(c7)
1	aaaaaaaaaaaaaaaa0001	{"key_a": 1, "key_b": 2, "key_c": 3}	1	2	POINT(383293632 1754448)
2	aaaaaaaaaaaaaaaa0001	{"key_a": 1, "key_b": 2, "key_c": 3}	1	2	POINT(383293632 1754448)
3	aaaaaaaaaaaaaaaa0001	{"key_a": 1, "key_b": 2, "key_c": 3}	1	2	POINT(383293632 1754448)
4	aaaaaaaaaaaaaaaa0001	{"key_a": 1, "key_b": 2, "key_c": 3}	1	2	POINT(383293632 1754448)
6	aaaaaaaaaaaaaaaa0001	{"key_a": 1, "key_b": 2, "key_c": 3}	1	2	POINT(383293632 1754448)
7	aaaaaaaaaaaaaaaa0001	{"key_a": 1, "key_b": 2, "key_c": 3}	1	2	POINT(383293632 1754448)
8	aaaaaaaaaaaaaaaa0001	{"key_a": 1, "key_b": 2, "key_c": 3}	1	2	POINT(383293632 1754448)
9	aaaaaaaaaaaaaaaa0001	{"key_a": 1, "key_b": 2, "key_c": 3}	1	2	POINT(383293632 1754448)
13	aaaaaaaaaaaaaaaa0001	{"key_a": 1, "key_b": 2, "key_c": 3}	1	2	POINT(383293632 1754448)
14	aaaaaaaaaaaaaaaa0001	{"key_a": 1, "key_b": 2, "key_c": 3}	1	2	POINT(383293632 1754448)
SELECT COUNT(*) FROM tde_db.t_encrypt_2;
COUNT(*)
64
SELECT c2,right(c3,20),c4,c5,c6,ST_AsText(c7) FROM tde_db.t_encrypt_2 LIMIT 10;
c2	right(c3,20)	c4	c5	c6	ST_AsText(c7)
1	aaaaaaaaaaaaaaaa0001	{"key_a": 1, "key_b": 2, "key_c": 3}	1	2	POINT(383293632 1754448)
2	aaaaaaaaaaaaaaaa0001	{"key_a": 1, "key_b": 2, "key_c": 3}	1	2	POINT(383293632 1754448)
3	aaaaaaaaaaaaaaaa0001	{"key_a": 1, "key_b": 2, "key_c": 3}	1	2	POINT(383293632 1754448)
4	aaaaaaaaaaaaaaaa0001	{"key_a": 1, "key_b": 2, "key_c": 3}	1	2	POINT(383293632 1754448)
5	aaaaaaaaaaaaaaaa0001	{"key_a": 1, "key_b": 2, "key_c": 3}	1	2	POINT(383293632 1754448)
6	aaaaaaaaaaaaaaaa0001	{"key_a": 1, "key_b": 2, "key_c": 3}	1	2	POINT(383293632 1754448)
7	aaaaaaaaaaaaaaaa0001	{"key_a": 1, "key_b": 2, "key_c": 3}	1	2	POINT(383293632 1754448)
8	aaaaaaaaaaaaaaaa0001	{"key_a": 1, "key_b": 2, "key_c": 3}	1	2	POINT(383293632 1754448)
9	aaaaaaaaaaaaaaaa0001	{"key_a": 1, "key_b": 2, "key_c": 3}	1	2	POINT(383293632 1754448)
10	aaaaaaaaaaaaaaaa0001	{"key_a": 1, "key_b": 2, "key_c": 3}	1	2	POINT(383293632 1754448)
SELECT COUNT(*) FROM tde_db.t_non_encrypt_2;
COUNT(*)
64
SELECT c2,right(c3,20),c4,c5,c6,ST_AsText(c7) FROM tde_db.t_non_encrypt_2 LIMIT 10;
c2	right(c3,20)	c4	c5	c6	ST_AsText(c7)
1	aaaaaaaaaaaaaaaa0001	{"key_a": 1, "key_b": 2, "key_c": 3}	1	2	POINT(383293632 1754448)
2	aaaaaaaaaaaaaaaa0001	{"key_a": 1, "key_b": 2, "key_c": 3}	1	2	POINT(383293632 1754448)
3	aaaaaaaaaaaaaaaa0001	{"key_a": 1, "key_b": 2, "key_c": 3}	1	2	POINT(383293632 1754448)
4	aaaaaaaaaaaaaaaa0001	{"key_a": 1, "key_b": 2, "key_c": 3}	1	2	POINT(383293632 1754448)
6	aaaaaaaaaaaaaaaa0001	{"key_a": 1, "key_b": 2, "key_c": 3}	1	2	POINT(383293632 1754448)
7	aaaaaaaaaaaaaaaa0001	{"key_a": 1, "key_b": 2, "key_c": 3}	1	2	POINT(383293632 1754448)
8	aaaaaaaaaaaaaaaa0001	{"key_a": 1, "key_b": 2, "key_c": 3}	1	2	POINT(383293632 1754448)
9	aaaaaaaaaaaaaaaa0001	{"key_a": 1, "key_b": 2, "key_c": 3}	1	2	POINT(383293632 1754448)
13	aaaaaaaaaaaaaaaa0001	{"key_a": 1, "key_b": 2, "key_c": 3}	1	2	POINT(383293632 1754448)
14	aaaaaaaaaaaaaaaa0001	{"key_a": 1, "key_b": 2, "key_c": 3}	1	2	POINT(383293632 1754448)
# Insert into old encrypted tables
SELECT COUNT(*) FROM tde_db.t_encrypt_2;
COUNT(*)
64
INSERT INTO tde_db.t_encrypt_2(c3,c4,c7) SELECT c3,c4,c7 FROM tde_db.t_encrypt;
SELECT COUNT(*) FROM tde_db.t_encrypt_2;
COUNT(*)
128
# Insert into old non encrypted tables
SELECT COUNT(*) FROM tde_db.t_non_encrypt_2;
COUNT(*)
64
INSERT INTO tde_db.t_non_encrypt_2(c3,c4,c7) SELECT c3,c4,c7 FROM tde_db.t_encrypt;
SELECT COUNT(*) FROM tde_db.t_non_encrypt_2;
COUNT(*)
128
# Update into old encrypted tables
UPDATE tde_db.t_encrypt_2 SET c2 = 1000 WHERE c2 = 1;
SELECT COUNT(*) FROM tde_db.t_encrypt_2 WHERE c2 = 1000 ;
COUNT(*)
1
# Update into old non encrypted tables
UPDATE tde_db.t_non_encrypt_2 SET c2 = 1000 WHERE c2 = 1;
SELECT COUNT(*) FROM tde_db.t_non_encrypt_2 WHERE c2 = 1000 ;
COUNT(*)
1
# Delete from old encrypted tables
DELETE FROM tde_db.t_encrypt_2 WHERE c2 = 1000 ;
SELECT COUNT(*) FROM tde_db.t_encrypt_2 WHERE c2 = 1000 ;
COUNT(*)
0
# Delete from old non encrypted tables
DELETE FROM tde_db.t_non_encrypt_2 WHERE c2 = 1000 ;
SELECT COUNT(*) FROM tde_db.t_non_encrypt_2 WHERE c2 = 1000 ;
COUNT(*)
0
# Create new tables
CREATE TABLE tde_db.t_encrypt_4(c2 INT NOT NULL AUTO_INCREMENT PRIMARY KEY,
c3 CHAR(255) Default 'No text',
c4 JSON ,
c5 INT GENERATED ALWAYS AS (JSON_EXTRACT(c4,'$.key_a')) STORED,
c6 INT GENERATED ALWAYS AS (JSON_EXTRACT(c4,'$.key_b')) VIRTUAL,
c7 POINT NOT NULL SRID 0,
spatial INDEX idx2 (c7)
) TABLESPACE=encrypt_ts ENCRYPTION='Y' ENGINE = InnoDB;
CREATE TABLE tde_db.t_non_encrypt_4(c2 INT NOT NULL AUTO_INCREMENT PRIMARY KEY,
c3 CHAR(255) Default 'No text',
c4 JSON ,
c5 INT GENERATED ALWAYS AS (JSON_EXTRACT(c4,'$.key_a')) STORED,
c6 INT GENERATED ALWAYS AS (JSON_EXTRACT(c4,'$.key_b')) VIRTUAL,
c7 POINT NOT NULL SRID 0,
spatial INDEX idx2 (c7)
) TABLESPACE=encrypt_ts1 ENGINE = InnoDB;
INSERT INTO tde_db.t_encrypt_4(c3,c4,c7) SELECT c3,c4,c7 FROM tde_db.t_encrypt;
INSERT INTO tde_db.t_non_encrypt_4(c3,c4,c7) SELECT c3,c4,c7 FROM tde_db.t_encrypt;
SELECT COUNT(*) FROM tde_db.t_encrypt_4;
COUNT(*)
64
SELECT c2,right(c3,20),c4,c5,c6,ST_AsText(c7) FROM tde_db.t_encrypt_4 LIMIT 10;
c2	right(c3,20)	c4	c5	c6	ST_AsText(c7)
1	aaaaaaaaaaaaaaaa0001	{"key_a": 1, "key_b": 2, "key_c": 3}	1	2	POINT(383293632 1754448)
2	aaaaaaaaaaaaaaaa0001	{"key_a": 1, "key_b": 2, "key_c": 3}	1	2	POINT(383293632 1754448)
3	aaaaaaaaaaaaaaaa0001	{"key_a": 1, "key_b": 2, "key_c": 3}	1	2	POINT(383293632 1754448)
4	aaaaaaaaaaaaaaaa0001	{"key_a": 1, "key_b": 2, "key_c": 3}	1	2	POINT(383293632 1754448)
5	aaaaaaaaaaaaaaaa0001	{"key_a": 1, "key_b": 2, "key_c": 3}	1	2	POINT(383293632 1754448)
6	aaaaaaaaaaaaaaaa0001	{"key_a": 1, "key_b": 2, "key_c": 3}	1	2	POINT(383293632 1754448)
7	aaaaaaaaaaaaaaaa0001	{"key_a": 1, "key_b": 2, "key_c": 3}	1	2	POINT(383293632 1754448)
8	aaaaaaaaaaaaaaaa0001	{"key_a": 1, "key_b": 2, "key_c": 3}	1	2	POINT(383293632 1754448)
9	aaaaaaaaaaaaaaaa0001	{"key_a": 1, "key_b": 2, "key_c": 3}	1	2	POINT(383293632 1754448)
10	aaaaaaaaaaaaaaaa0001	{"key_a": 1, "key_b": 2, "key_c": 3}	1	2	POINT(383293632 1754448)
SELECT COUNT(*) FROM tde_db.t_non_encrypt_4;
COUNT(*)
64
SELECT c2,right(c3,20),c4,c5,c6,ST_AsText(c7) FROM tde_db.t_non_encrypt_4 LIMIT 10;
c2	right(c3,20)	c4	c5	c6	ST_AsText(c7)
1	aaaaaaaaaaaaaaaa0001	{"key_a": 1, "key_b": 2, "key_c": 3}	1	2	POINT(383293632 1754448)
2	aaaaaaaaaaaaaaaa0001	{"key_a": 1, "key_b": 2, "key_c": 3}	1	2	POINT(383293632 1754448)
3	aaaaaaaaaaaaaaaa0001	{"key_a": 1, "key_b": 2, "key_c": 3}	1	2	POINT(383293632 1754448)
4	aaaaaaaaaaaaaaaa0001	{"key_a": 1, "key_b": 2, "key_c": 3}	1	2	POINT(383293632 1754448)
5	aaaaaaaaaaaaaaaa0001	{"key_a": 1, "key_b": 2, "key_c": 3}	1	2	POINT(383293632 1754448)
6	aaaaaaaaaaaaaaaa0001	{"key_a": 1, "key_b": 2, "key_c": 3}	1	2	POINT(383293632 1754448)
7	aaaaaaaaaaaaaaaa0001	{"key_a": 1, "key_b": 2, "key_c": 3}	1	2	POINT(383293632 1754448)
8	aaaaaaaaaaaaaaaa0001	{"key_a": 1, "key_b": 2, "key_c": 3}	1	2	POINT(383293632 1754448)
9	aaaaaaaaaaaaaaaa0001	{"key_a": 1, "key_b": 2, "key_c": 3}	1	2	POINT(383293632 1754448)
10	aaaaaaaaaaaaaaaa0001	{"key_a": 1, "key_b": 2, "key_c": 3}	1	2	POINT(383293632 1754448)
ALTER INSTANCE ROTATE INNODB MASTER KEY;
SELECT COUNT(*) FROM tde_db.t_encrypt;
COUNT(*)
64
SELECT COUNT(*) FROM tde_db.t_non_encrypt;
COUNT(*)
64
SELECT COUNT(*) FROM tde_db.t_encrypt_2;
COUNT(*)
127
SELECT COUNT(*) FROM tde_db.t_non_encrypt_2;
COUNT(*)
127
SELECT COUNT(*) FROM tde_db.t_encrypt_4;
COUNT(*)
64
SELECT COUNT(*) FROM tde_db.t_non_encrypt_4;
COUNT(*)
64
DROP TABLE tde_db.t_encrypt , tde_db.t_encrypt_2 , tde_db.t_encrypt_4;
DROP TABLE tde_db.t_non_encrypt , tde_db.t_non_encrypt_2 , tde_db.t_non_encrypt_4;
#########################################################################
# Test 2 : Restart without  keyring option
#           - old encrypted tables accessible
#           - unencryption tables are accessible
#########################################################################
SELECT status_key, status_value FROM
performance_schema.keyring_component_status
WHERE status_key LIKE '%name%' OR status_key LIKE '%status%';
status_key	status_value
Component_name	component_keyring_file
Implementation_name	component_keyring_file
Component_status	Active
# Initialize tables
call tde_db.init_setup();
/*  select tde_db.t_encrypt */
/*  select tde_db.t_encrypt */
COUNT(*)
64
c2	right(c3,20)	c4	c5	c6	ST_AsText(c7)
1	aaaaaaaaaaaaaaaa0001	{"key_a": 1, "key_b": 2, "key_c": 3}	1	2	POINT(383293632 1754448)
2	aaaaaaaaaaaaaaaa0001	{"key_a": 1, "key_b": 2, "key_c": 3}	1	2	POINT(383293632 1754448)
3	aaaaaaaaaaaaaaaa0001	{"key_a": 1, "key_b": 2, "key_c": 3}	1	2	POINT(383293632 1754448)
4	aaaaaaaaaaaaaaaa0001	{"key_a": 1, "key_b": 2, "key_c": 3}	1	2	POINT(383293632 1754448)
6	aaaaaaaaaaaaaaaa0001	{"key_a": 1, "key_b": 2, "key_c": 3}	1	2	POINT(383293632 1754448)
7	aaaaaaaaaaaaaaaa0001	{"key_a": 1, "key_b": 2, "key_c": 3}	1	2	POINT(383293632 1754448)
8	aaaaaaaaaaaaaaaa0001	{"key_a": 1, "key_b": 2, "key_c": 3}	1	2	POINT(383293632 1754448)
9	aaaaaaaaaaaaaaaa0001	{"key_a": 1, "key_b": 2, "key_c": 3}	1	2	POINT(383293632 1754448)
13	aaaaaaaaaaaaaaaa0001	{"key_a": 1, "key_b": 2, "key_c": 3}	1	2	POINT(383293632 1754448)
14	aaaaaaaaaaaaaaaa0001	{"key_a": 1, "key_b": 2, "key_c": 3}	1	2	POINT(383293632 1754448)
/*  select tde_db.t_non_encrypt */
/*  select tde_db.t_non_encrypt */
COUNT(*)
64
c2	right(c3,20)	c4	c5	c6	ST_AsText(c7)
1	aaaaaaaaaaaaaaaa0001	{"key_a": 1, "key_b": 2, "key_c": 3}	1	2	POINT(383293632 1754448)
2	aaaaaaaaaaaaaaaa0001	{"key_a": 1, "key_b": 2, "key_c": 3}	1	2	POINT(383293632 1754448)
3	aaaaaaaaaaaaaaaa0001	{"key_a": 1, "key_b": 2, "key_c": 3}	1	2	POINT(383293632 1754448)
4	aaaaaaaaaaaaaaaa0001	{"key_a": 1, "key_b": 2, "key_c": 3}	1	2	POINT(383293632 1754448)
6	aaaaaaaaaaaaaaaa0001	{"key_a": 1, "key_b": 2, "key_c": 3}	1	2	POINT(383293632 1754448)
7	aaaaaaaaaaaaaaaa0001	{"key_a": 1, "key_b": 2, "key_c": 3}	1	2	POINT(383293632 1754448)
8	aaaaaaaaaaaaaaaa0001	{"key_a": 1, "key_b": 2, "key_c": 3}	1	2	POINT(383293632 1754448)
9	aaaaaaaaaaaaaaaa0001	{"key_a": 1, "key_b": 2, "key_c": 3}	1	2	POINT(383293632 1754448)
13	aaaaaaaaaaaaaaaa0001	{"key_a": 1, "key_b": 2, "key_c": 3}	1	2	POINT(383293632 1754448)
14	aaaaaaaaaaaaaaaa0001	{"key_a": 1, "key_b": 2, "key_c": 3}	1	2	POINT(383293632 1754448)
/*  select tde_db.t_encrypt_2 */
/*  select tde_db.t_encrypt_2 */
COUNT(*)
64
c2	right(c3,20)	c4	c5	c6	ST_AsText(c7)
1	aaaaaaaaaaaaaaaa0001	{"key_a": 1, "key_b": 2, "key_c": 3}	1	2	POINT(383293632 1754448)
2	aaaaaaaaaaaaaaaa0001	{"key_a": 1, "key_b": 2, "key_c": 3}	1	2	POINT(383293632 1754448)
3	aaaaaaaaaaaaaaaa0001	{"key_a": 1, "key_b": 2, "key_c": 3}	1	2	POINT(383293632 1754448)
4	aaaaaaaaaaaaaaaa0001	{"key_a": 1, "key_b": 2, "key_c": 3}	1	2	POINT(383293632 1754448)
5	aaaaaaaaaaaaaaaa0001	{"key_a": 1, "key_b": 2, "key_c": 3}	1	2	POINT(383293632 1754448)
6	aaaaaaaaaaaaaaaa0001	{"key_a": 1, "key_b": 2, "key_c": 3}	1	2	POINT(383293632 1754448)
7	aaaaaaaaaaaaaaaa0001	{"key_a": 1, "key_b": 2, "key_c": 3}	1	2	POINT(383293632 1754448)
8	aaaaaaaaaaaaaaaa0001	{"key_a": 1, "key_b": 2, "key_c": 3}	1	2	POINT(383293632 1754448)
9	aaaaaaaaaaaaaaaa0001	{"key_a": 1, "key_b": 2, "key_c": 3}	1	2	POINT(383293632 1754448)
10	aaaaaaaaaaaaaaaa0001	{"key_a": 1, "key_b": 2, "key_c": 3}	1	2	POINT(383293632 1754448)
/*  select tde_db.t_non_encrypt_2 */
/*  select tde_db.t_non_encrypt_2 */
COUNT(*)
64
c2	right(c3,20)	c4	c5	c6	ST_AsText(c7)
1	aaaaaaaaaaaaaaaa0001	{"key_a": 1, "key_b": 2, "key_c": 3}	1	2	POINT(383293632 1754448)
2	aaaaaaaaaaaaaaaa0001	{"key_a": 1, "key_b": 2, "key_c": 3}	1	2	POINT(383293632 1754448)
3	aaaaaaaaaaaaaaaa0001	{"key_a": 1, "key_b": 2, "key_c": 3}	1	2	POINT(383293632 1754448)
4	aaaaaaaaaaaaaaaa0001	{"key_a": 1, "key_b": 2, "key_c": 3}	1	2	POINT(383293632 1754448)
6	aaaaaaaaaaaaaaaa0001	{"key_a": 1, "key_b": 2, "key_c": 3}	1	2	POINT(383293632 1754448)
7	aaaaaaaaaaaaaaaa0001	{"key_a": 1, "key_b": 2, "key_c": 3}	1	2	POINT(383293632 1754448)
8	aaaaaaaaaaaaaaaa0001	{"key_a": 1, "key_b": 2, "key_c": 3}	1	2	POINT(383293632 1754448)
9	aaaaaaaaaaaaaaaa0001	{"key_a": 1, "key_b": 2, "key_c": 3}	1	2	POINT(383293632 1754448)
13	aaaaaaaaaaaaaaaa0001	{"key_a": 1, "key_b": 2, "key_c": 3}	1	2	POINT(383293632 1754448)
14	aaaaaaaaaaaaaaaa0001	{"key_a": 1, "key_b": 2, "key_c": 3}	1	2	POINT(383293632 1754448)
# restart without keyring
# Taking backup of local manifest file for MySQL server instance
# Encrypted tables must not be accessible
SELECT COUNT(*) FROM tde_db.t_encrypt;
ERROR HY000: Can't find master key from keyring, please check in the server log if a keyring is loaded and initialized successfully.
SELECT COUNT(*) FROM tde_db.t_encrypt_2;
ERROR HY000: Can't find master key from keyring, please check in the server log if a keyring is loaded and initialized successfully.
# Unencrypted tables must be accessible
SELECT COUNT(*) FROM tde_db.t_non_encrypt;
COUNT(*)
64
SELECT COUNT(*) FROM tde_db.t_non_encrypt_2;
COUNT(*)
64
# Creating table in encrypted tablespace must not be possible as tablespace
# would be missing
CREATE TABLE tde_db.t_encrypt_4(c2 INT NOT NULL AUTO_INCREMENT PRIMARY KEY,
c3 CHAR(255) Default 'No text',
c4 JSON ,
c5 INT GENERATED ALWAYS AS (JSON_EXTRACT(c4,'$.key_a')) STORED,
c6 INT GENERATED ALWAYS AS (JSON_EXTRACT(c4,'$.key_b')) VIRTUAL,
c7 POINT NOT NULL SRID 0,
spatial INDEX idx2 (c7)
) TABLESPACE=encrypt_ts ENCRYPTION='Y' ENGINE = InnoDB;
ERROR HY000: InnoDB: A general tablespace named `encrypt_ts` cannot be found.
# Creating table in unencrypted tablespace must be possible
CREATE TABLE tde_db.t_non_encrypt_4(c2 INT NOT NULL AUTO_INCREMENT PRIMARY KEY,
c3 CHAR(255) Default 'No text',
c4 JSON ,
c5 INT GENERATED ALWAYS AS (JSON_EXTRACT(c4,'$.key_a')) STORED,
c6 INT GENERATED ALWAYS AS (JSON_EXTRACT(c4,'$.key_b')) VIRTUAL,
c7 POINT NOT NULL SRID 0,
spatial INDEX idx2 (c7)
) TABLESPACE=encrypt_ts1 ENGINE = InnoDB;
INSERT INTO tde_db.t_non_encrypt_4(c3,c4,c7) SELECT c3,c4,c7 FROM tde_db.t_non_encrypt;
SELECT COUNT(*) FROM tde_db.t_non_encrypt_4;
COUNT(*)
64
ALTER INSTANCE ROTATE INNODB MASTER KEY;
ERROR HY000: Can't find master key from keyring, please check in the server log if a keyring is loaded and initialized successfully.
# Encrypted tables must not be accessible
SELECT COUNT(*) FROM tde_db.t_encrypt;
ERROR HY000: Can't find master key from keyring, please check in the server log if a keyring is loaded and initialized successfully.
SELECT COUNT(*) FROM tde_db.t_encrypt_2;
ERROR HY000: Can't find master key from keyring, please check in the server log if a keyring is loaded and initialized successfully.
DROP TABLE tde_db.t_encrypt , tde_db.t_encrypt_2;
DROP TABLE tde_db.t_non_encrypt , tde_db.t_non_encrypt_2 ,tde_db.t_non_encrypt_4;
#########################################################################
# Test 3 : Restart and reload keyring using command
#          - All tables must be accessible
#########################################################################
# Restore local manifest file for MySQL server instance from backup
SELECT status_key, status_value FROM
performance_schema.keyring_component_status
WHERE status_key LIKE '%name%' OR status_key LIKE '%status%';
status_key	status_value
Component_name	component_keyring_file
Implementation_name	component_keyring_file
Component_status	Active
# Initalize tables
call tde_db.init_setup();
/*  select tde_db.t_encrypt */
/*  select tde_db.t_encrypt */
COUNT(*)
64
c2	right(c3,20)	c4	c5	c6	ST_AsText(c7)
1	aaaaaaaaaaaaaaaa0001	{"key_a": 1, "key_b": 2, "key_c": 3}	1	2	POINT(383293632 1754448)
2	aaaaaaaaaaaaaaaa0001	{"key_a": 1, "key_b": 2, "key_c": 3}	1	2	POINT(383293632 1754448)
3	aaaaaaaaaaaaaaaa0001	{"key_a": 1, "key_b": 2, "key_c": 3}	1	2	POINT(383293632 1754448)
4	aaaaaaaaaaaaaaaa0001	{"key_a": 1, "key_b": 2, "key_c": 3}	1	2	POINT(383293632 1754448)
6	aaaaaaaaaaaaaaaa0001	{"key_a": 1, "key_b": 2, "key_c": 3}	1	2	POINT(383293632 1754448)
7	aaaaaaaaaaaaaaaa0001	{"key_a": 1, "key_b": 2, "key_c": 3}	1	2	POINT(383293632 1754448)
8	aaaaaaaaaaaaaaaa0001	{"key_a": 1, "key_b": 2, "key_c": 3}	1	2	POINT(383293632 1754448)
9	aaaaaaaaaaaaaaaa0001	{"key_a": 1, "key_b": 2, "key_c": 3}	1	2	POINT(383293632 1754448)
13	aaaaaaaaaaaaaaaa0001	{"key_a": 1, "key_b": 2, "key_c": 3}	1	2	POINT(383293632 1754448)
14	aaaaaaaaaaaaaaaa0001	{"key_a": 1, "key_b": 2, "key_c": 3}	1	2	POINT(383293632 1754448)
/*  select tde_db.t_non_encrypt */
/*  select tde_db.t_non_encrypt */
COUNT(*)
64
c2	right(c3,20)	c4	c5	c6	ST_AsText(c7)
1	aaaaaaaaaaaaaaaa0001	{"key_a": 1, "key_b": 2, "key_c": 3}	1	2	POINT(383293632 1754448)
2	aaaaaaaaaaaaaaaa0001	{"key_a": 1, "key_b": 2, "key_c": 3}	1	2	POINT(383293632 1754448)
3	aaaaaaaaaaaaaaaa0001	{"key_a": 1, "key_b": 2, "key_c": 3}	1	2	POINT(383293632 1754448)
4	aaaaaaaaaaaaaaaa0001	{"key_a": 1, "key_b": 2, "key_c": 3}	1	2	POINT(383293632 1754448)
6	aaaaaaaaaaaaaaaa0001	{"key_a": 1, "key_b": 2, "key_c": 3}	1	2	POINT(383293632 1754448)
7	aaaaaaaaaaaaaaaa0001	{"key_a": 1, "key_b": 2, "key_c": 3}	1	2	POINT(383293632 1754448)
8	aaaaaaaaaaaaaaaa0001	{"key_a": 1, "key_b": 2, "key_c": 3}	1	2	POINT(383293632 1754448)
9	aaaaaaaaaaaaaaaa0001	{"key_a": 1, "key_b": 2, "key_c": 3}	1	2	POINT(383293632 1754448)
13	aaaaaaaaaaaaaaaa0001	{"key_a": 1, "key_b": 2, "key_c": 3}	1	2	POINT(383293632 1754448)
14	aaaaaaaaaaaaaaaa0001	{"key_a": 1, "key_b": 2, "key_c": 3}	1	2	POINT(383293632 1754448)
/*  select tde_db.t_encrypt_2 */
/*  select tde_db.t_encrypt_2 */
COUNT(*)
64
c2	right(c3,20)	c4	c5	c6	ST_AsText(c7)
1	aaaaaaaaaaaaaaaa0001	{"key_a": 1, "key_b": 2, "key_c": 3}	1	2	POINT(383293632 1754448)
2	aaaaaaaaaaaaaaaa0001	{"key_a": 1, "key_b": 2, "key_c": 3}	1	2	POINT(383293632 1754448)
3	aaaaaaaaaaaaaaaa0001	{"key_a": 1, "key_b": 2, "key_c": 3}	1	2	POINT(383293632 1754448)
4	aaaaaaaaaaaaaaaa0001	{"key_a": 1, "key_b": 2, "key_c": 3}	1	2	POINT(383293632 1754448)
5	aaaaaaaaaaaaaaaa0001	{"key_a": 1, "key_b": 2, "key_c": 3}	1	2	POINT(383293632 1754448)
6	aaaaaaaaaaaaaaaa0001	{"key_a": 1, "key_b": 2, "key_c": 3}	1	2	POINT(383293632 1754448)
7	aaaaaaaaaaaaaaaa0001	{"key_a": 1, "key_b": 2, "key_c": 3}	1	2	POINT(383293632 1754448)
8	aaaaaaaaaaaaaaaa0001	{"key_a": 1, "key_b": 2, "key_c": 3}	1	2	POINT(383293632 1754448)
9	aaaaaaaaaaaaaaaa0001	{"key_a": 1, "key_b": 2, "key_c": 3}	1	2	POINT(383293632 1754448)
10	aaaaaaaaaaaaaaaa0001	{"key_a": 1, "key_b": 2, "key_c": 3}	1	2	POINT(383293632 1754448)
/*  select tde_db.t_non_encrypt_2 */
/*  select tde_db.t_non_encrypt_2 */
COUNT(*)
64
c2	right(c3,20)	c4	c5	c6	ST_AsText(c7)
1	aaaaaaaaaaaaaaaa0001	{"key_a": 1, "key_b": 2, "key_c": 3}	1	2	POINT(383293632 1754448)
2	aaaaaaaaaaaaaaaa0001	{"key_a": 1, "key_b": 2, "key_c": 3}	1	2	POINT(383293632 1754448)
3	aaaaaaaaaaaaaaaa0001	{"key_a": 1, "key_b": 2, "key_c": 3}	1	2	POINT(383293632 1754448)
4	aaaaaaaaaaaaaaaa0001	{"key_a": 1, "key_b": 2, "key_c": 3}	1	2	POINT(383293632 1754448)
6	aaaaaaaaaaaaaaaa0001	{"key_a": 1, "key_b": 2, "key_c": 3}	1	2	POINT(383293632 1754448)
7	aaaaaaaaaaaaaaaa0001	{"key_a": 1, "key_b": 2, "key_c": 3}	1	2	POINT(383293632 1754448)
8	aaaaaaaaaaaaaaaa0001	{"key_a": 1, "key_b": 2, "key_c": 3}	1	2	POINT(383293632 1754448)
9	aaaaaaaaaaaaaaaa0001	{"key_a": 1, "key_b": 2, "key_c": 3}	1	2	POINT(383293632 1754448)
13	aaaaaaaaaaaaaaaa0001	{"key_a": 1, "key_b": 2, "key_c": 3}	1	2	POINT(383293632 1754448)
14	aaaaaaaaaaaaaaaa0001	{"key_a": 1, "key_b": 2, "key_c": 3}	1	2	POINT(383293632 1754448)
# Taking backup of local keyring file for keyring component: component_keyring_file
# restart without keyring 
# Restoring local keyring file from backup for keyring component: component_keyring_file
ALTER INSTANCE RELOAD KEYRING;
# All tables must be accessible
SELECT COUNT(*) FROM tde_db.t_encrypt;
COUNT(*)
64
SELECT c2,right(c3,20),c4,c5,c6,ST_AsText(c7) FROM tde_db.t_encrypt LIMIT 10;
c2	right(c3,20)	c4	c5	c6	ST_AsText(c7)
1	aaaaaaaaaaaaaaaa0001	{"key_a": 1, "key_b": 2, "key_c": 3}	1	2	POINT(383293632 1754448)
2	aaaaaaaaaaaaaaaa0001	{"key_a": 1, "key_b": 2, "key_c": 3}	1	2	POINT(383293632 1754448)
3	aaaaaaaaaaaaaaaa0001	{"key_a": 1, "key_b": 2, "key_c": 3}	1	2	POINT(383293632 1754448)
4	aaaaaaaaaaaaaaaa0001	{"key_a": 1, "key_b": 2, "key_c": 3}	1	2	POINT(383293632 1754448)
6	aaaaaaaaaaaaaaaa0001	{"key_a": 1, "key_b": 2, "key_c": 3}	1	2	POINT(383293632 1754448)
7	aaaaaaaaaaaaaaaa0001	{"key_a": 1, "key_b": 2, "key_c": 3}	1	2	POINT(383293632 1754448)
8	aaaaaaaaaaaaaaaa0001	{"key_a": 1, "key_b": 2, "key_c": 3}	1	2	POINT(383293632 1754448)
9	aaaaaaaaaaaaaaaa0001	{"key_a": 1, "key_b": 2, "key_c": 3}	1	2	POINT(383293632 1754448)
13	aaaaaaaaaaaaaaaa0001	{"key_a": 1, "key_b": 2, "key_c": 3}	1	2	POINT(383293632 1754448)
14	aaaaaaaaaaaaaaaa0001	{"key_a": 1, "key_b": 2, "key_c": 3}	1	2	POINT(383293632 1754448)
SELECT COUNT(*) FROM tde_db.t_non_encrypt;
COUNT(*)
64
SELECT c2,right(c3,20),c4,c5,c6,ST_AsText(c7) FROM tde_db.t_non_encrypt LIMIT 10;
c2	right(c3,20)	c4	c5	c6	ST_AsText(c7)
1	aaaaaaaaaaaaaaaa0001	{"key_a": 1, "key_b": 2, "key_c": 3}	1	2	POINT(383293632 1754448)
2	aaaaaaaaaaaaaaaa0001	{"key_a": 1, "key_b": 2, "key_c": 3}	1	2	POINT(383293632 1754448)
3	aaaaaaaaaaaaaaaa0001	{"key_a": 1, "key_b": 2, "key_c": 3}	1	2	POINT(383293632 1754448)
4	aaaaaaaaaaaaaaaa0001	{"key_a": 1, "key_b": 2, "key_c": 3}	1	2	POINT(383293632 1754448)
6	aaaaaaaaaaaaaaaa0001	{"key_a": 1, "key_b": 2, "key_c": 3}	1	2	POINT(383293632 1754448)
7	aaaaaaaaaaaaaaaa0001	{"key_a": 1, "key_b": 2, "key_c": 3}	1	2	POINT(383293632 1754448)
8	aaaaaaaaaaaaaaaa0001	{"key_a": 1, "key_b": 2, "key_c": 3}	1	2	POINT(383293632 1754448)
9	aaaaaaaaaaaaaaaa0001	{"key_a": 1, "key_b": 2, "key_c": 3}	1	2	POINT(383293632 1754448)
13	aaaaaaaaaaaaaaaa0001	{"key_a": 1, "key_b": 2, "key_c": 3}	1	2	POINT(383293632 1754448)
14	aaaaaaaaaaaaaaaa0001	{"key_a": 1, "key_b": 2, "key_c": 3}	1	2	POINT(383293632 1754448)
SELECT COUNT(*) FROM tde_db.t_encrypt_2;
COUNT(*)
64
SELECT c2,right(c3,20),c4,c5,c6,ST_AsText(c7) FROM tde_db.t_encrypt_2 LIMIT 10;
c2	right(c3,20)	c4	c5	c6	ST_AsText(c7)
1	aaaaaaaaaaaaaaaa0001	{"key_a": 1, "key_b": 2, "key_c": 3}	1	2	POINT(383293632 1754448)
2	aaaaaaaaaaaaaaaa0001	{"key_a": 1, "key_b": 2, "key_c": 3}	1	2	POINT(383293632 1754448)
3	aaaaaaaaaaaaaaaa0001	{"key_a": 1, "key_b": 2, "key_c": 3}	1	2	POINT(383293632 1754448)
4	aaaaaaaaaaaaaaaa0001	{"key_a": 1, "key_b": 2, "key_c": 3}	1	2	POINT(383293632 1754448)
5	aaaaaaaaaaaaaaaa0001	{"key_a": 1, "key_b": 2, "key_c": 3}	1	2	POINT(383293632 1754448)
6	aaaaaaaaaaaaaaaa0001	{"key_a": 1, "key_b": 2, "key_c": 3}	1	2	POINT(383293632 1754448)
7	aaaaaaaaaaaaaaaa0001	{"key_a": 1, "key_b": 2, "key_c": 3}	1	2	POINT(383293632 1754448)
8	aaaaaaaaaaaaaaaa0001	{"key_a": 1, "key_b": 2, "key_c": 3}	1	2	POINT(383293632 1754448)
9	aaaaaaaaaaaaaaaa0001	{"key_a": 1, "key_b": 2, "key_c": 3}	1	2	POINT(383293632 1754448)
10	aaaaaaaaaaaaaaaa0001	{"key_a": 1, "key_b": 2, "key_c": 3}	1	2	POINT(383293632 1754448)
SELECT COUNT(*) FROM tde_db.t_non_encrypt_2;
COUNT(*)
64
SELECT c2,right(c3,20),c4,c5,c6,ST_AsText(c7) FROM tde_db.t_non_encrypt_2 LIMIT 10;
c2	right(c3,20)	c4	c5	c6	ST_AsText(c7)
1	aaaaaaaaaaaaaaaa0001	{"key_a": 1, "key_b": 2, "key_c": 3}	1	2	POINT(383293632 1754448)
2	aaaaaaaaaaaaaaaa0001	{"key_a": 1, "key_b": 2, "key_c": 3}	1	2	POINT(383293632 1754448)
3	aaaaaaaaaaaaaaaa0001	{"key_a": 1, "key_b": 2, "key_c": 3}	1	2	POINT(383293632 1754448)
4	aaaaaaaaaaaaaaaa0001	{"key_a": 1, "key_b": 2, "key_c": 3}	1	2	POINT(383293632 1754448)
6	aaaaaaaaaaaaaaaa0001	{"key_a": 1, "key_b": 2, "key_c": 3}	1	2	POINT(383293632 1754448)
7	aaaaaaaaaaaaaaaa0001	{"key_a": 1, "key_b": 2, "key_c": 3}	1	2	POINT(383293632 1754448)
8	aaaaaaaaaaaaaaaa0001	{"key_a": 1, "key_b": 2, "key_c": 3}	1	2	POINT(383293632 1754448)
9	aaaaaaaaaaaaaaaa0001	{"key_a": 1, "key_b": 2, "key_c": 3}	1	2	POINT(383293632 1754448)
13	aaaaaaaaaaaaaaaa0001	{"key_a": 1, "key_b": 2, "key_c": 3}	1	2	POINT(383293632 1754448)
14	aaaaaaaaaaaaaaaa0001	{"key_a": 1, "key_b": 2, "key_c": 3}	1	2	POINT(383293632 1754448)
# Insert into old encrypted tables
SELECT COUNT(*) FROM tde_db.t_encrypt_2;
COUNT(*)
64
INSERT INTO tde_db.t_encrypt_2(c3,c4,c7) SELECT c3,c4,c7 FROM tde_db.t_encrypt;
SELECT COUNT(*) FROM tde_db.t_encrypt_2;
COUNT(*)
128
# Insert into old non encrypted tables
SELECT COUNT(*) FROM tde_db.t_non_encrypt_2;
COUNT(*)
64
INSERT INTO tde_db.t_non_encrypt_2(c3,c4,c7) SELECT c3,c4,c7 FROM tde_db.t_encrypt;
SELECT COUNT(*) FROM tde_db.t_non_encrypt_2;
COUNT(*)
128
# Update into old encrypted tables
UPDATE tde_db.t_encrypt_2 SET c2 = 1000 WHERE c2 = 1;
SELECT COUNT(*) FROM tde_db.t_encrypt_2 WHERE c2 = 1000 ;
COUNT(*)
1
# Update into old non encrypted tables
UPDATE tde_db.t_non_encrypt_2 SET c2 = 1000 WHERE c2 = 1;
SELECT COUNT(*) FROM tde_db.t_non_encrypt_2 WHERE c2 = 1000 ;
COUNT(*)
1
# Delete from old encrypted tables
DELETE FROM tde_db.t_encrypt_2 WHERE c2 = 1000 ;
SELECT COUNT(*) FROM tde_db.t_encrypt_2 WHERE c2 = 1000 ;
COUNT(*)
0
# Delete from old non encrypted tables
DELETE FROM tde_db.t_non_encrypt_2 WHERE c2 = 1000 ;
SELECT COUNT(*) FROM tde_db.t_non_encrypt_2 WHERE c2 = 1000 ;
COUNT(*)
0
# Create new tables
CREATE TABLE tde_db.t_encrypt_4(c2 INT NOT NULL AUTO_INCREMENT PRIMARY KEY,
c3 CHAR(255) Default 'No text',
c4 JSON ,
c5 INT GENERATED ALWAYS AS (JSON_EXTRACT(c4,'$.key_a')) STORED,
c6 INT GENERATED ALWAYS AS (JSON_EXTRACT(c4,'$.key_b')) VIRTUAL,
c7 POINT NOT NULL SRID 0,
spatial INDEX idx2 (c7)
) TABLESPACE=encrypt_ts ENCRYPTION='Y' ENGINE = InnoDB;
CREATE TABLE tde_db.t_non_encrypt_4(c2 INT NOT NULL AUTO_INCREMENT PRIMARY KEY,
c3 CHAR(255) Default 'No text',
c4 JSON ,
c5 INT GENERATED ALWAYS AS (JSON_EXTRACT(c4,'$.key_a')) STORED,
c6 INT GENERATED ALWAYS AS (JSON_EXTRACT(c4,'$.key_b')) VIRTUAL,
c7 POINT NOT NULL SRID 0,
spatial INDEX idx2 (c7)
) TABLESPACE=encrypt_ts1 ENGINE = InnoDB;
INSERT INTO tde_db.t_encrypt_4(c3,c4,c7) SELECT c3,c4,c7 FROM tde_db.t_encrypt;
INSERT INTO tde_db.t_non_encrypt_4(c3,c4,c7) SELECT c3,c4,c7 FROM tde_db.t_encrypt;
SELECT COUNT(*) FROM tde_db.t_encrypt_4;
COUNT(*)
64
SELECT c2,right(c3,20),c4,c5,c6,ST_AsText(c7) FROM tde_db.t_encrypt_4 LIMIT 10;
c2	right(c3,20)	c4	c5	c6	ST_AsText(c7)
1	aaaaaaaaaaaaaaaa0001	{"key_a": 1, "key_b": 2, "key_c": 3}	1	2	POINT(383293632 1754448)
2	aaaaaaaaaaaaaaaa0001	{"key_a": 1, "key_b": 2, "key_c": 3}	1	2	POINT(383293632 1754448)
3	aaaaaaaaaaaaaaaa0001	{"key_a": 1, "key_b": 2, "key_c": 3}	1	2	POINT(383293632 1754448)
4	aaaaaaaaaaaaaaaa0001	{"key_a": 1, "key_b": 2, "key_c": 3}	1	2	POINT(383293632 1754448)
5	aaaaaaaaaaaaaaaa0001	{"key_a": 1, "key_b": 2, "key_c": 3}	1	2	POINT(383293632 1754448)
6	aaaaaaaaaaaaaaaa0001	{"key_a": 1, "key_b": 2, "key_c": 3}	1	2	POINT(383293632 1754448)
7	aaaaaaaaaaaaaaaa0001	{"key_a": 1, "key_b": 2, "key_c": 3}	1	2	POINT(383293632 1754448)
8	aaaaaaaaaaaaaaaa0001	{"key_a": 1, "key_b": 2, "key_c": 3}	1	2	POINT(383293632 1754448)
9	aaaaaaaaaaaaaaaa0001	{"key_a": 1, "key_b": 2, "key_c": 3}	1	2	POINT(383293632 1754448)
10	aaaaaaaaaaaaaaaa0001	{"key_a": 1, "key_b": 2, "key_c": 3}	1	2	POINT(383293632 1754448)
SELECT COUNT(*) FROM tde_db.t_non_encrypt_4;
COUNT(*)
64
SELECT c2,right(c3,20),c4,c5,c6,ST_AsText(c7) FROM tde_db.t_non_encrypt_4 LIMIT 10;
c2	right(c3,20)	c4	c5	c6	ST_AsText(c7)
1	aaaaaaaaaaaaaaaa0001	{"key_a": 1, "key_b": 2, "key_c": 3}	1	2	POINT(383293632 1754448)
2	aaaaaaaaaaaaaaaa0001	{"key_a": 1, "key_b": 2, "key_c": 3}	1	2	POINT(383293632 1754448)
3	aaaaaaaaaaaaaaaa0001	{"key_a": 1, "key_b": 2, "key_c": 3}	1	2	POINT(383293632 1754448)
4	aaaaaaaaaaaaaaaa0001	{"key_a": 1, "key_b": 2, "key_c": 3}	1	2	POINT(383293632 1754448)
5	aaaaaaaaaaaaaaaa0001	{"key_a": 1, "key_b": 2, "key_c": 3}	1	2	POINT(383293632 1754448)
6	aaaaaaaaaaaaaaaa0001	{"key_a": 1, "key_b": 2, "key_c": 3}	1	2	POINT(383293632 1754448)
7	aaaaaaaaaaaaaaaa0001	{"key_a": 1, "key_b": 2, "key_c": 3}	1	2	POINT(383293632 1754448)
8	aaaaaaaaaaaaaaaa0001	{"key_a": 1, "key_b": 2, "key_c": 3}	1	2	POINT(383293632 1754448)
9	aaaaaaaaaaaaaaaa0001	{"key_a": 1, "key_b": 2, "key_c": 3}	1	2	POINT(383293632 1754448)
10	aaaaaaaaaaaaaaaa0001	{"key_a": 1, "key_b": 2, "key_c": 3}	1	2	POINT(383293632 1754448)
ALTER INSTANCE ROTATE INNODB MASTER KEY;
SELECT COUNT(*) FROM tde_db.t_encrypt;
COUNT(*)
64
SELECT COUNT(*) FROM tde_db.t_non_encrypt;
COUNT(*)
64
SELECT COUNT(*) FROM tde_db.t_encrypt_2;
COUNT(*)
127
SELECT COUNT(*) FROM tde_db.t_non_encrypt_2;
COUNT(*)
127
SELECT COUNT(*) FROM tde_db.t_encrypt_4;
COUNT(*)
64
SELECT COUNT(*) FROM tde_db.t_non_encrypt_4;
COUNT(*)
64
DROP TABLE tde_db.t_encrypt , tde_db.t_encrypt_2 , tde_db.t_encrypt_4;
DROP TABLE tde_db.t_non_encrypt , tde_db.t_non_encrypt_2 , tde_db.t_non_encrypt_4;
# Taking backup of local keyring file for keyring component: component_keyring_file
ALTER INSTANCE RELOAD KEYRING;
CREATE TABLE tde_db.t_encrypt_4(c2 INT NOT NULL AUTO_INCREMENT PRIMARY KEY,
c3 CHAR(255) Default 'No text',
c4 JSON ,
c5 INT GENERATED ALWAYS AS (JSON_EXTRACT(c4,'$.key_a')) STORED,
c6 INT GENERATED ALWAYS AS (JSON_EXTRACT(c4,'$.key_b')) VIRTUAL,
c7 POINT NOT NULL SRID 0,
spatial INDEX idx2 (c7)
) TABLESPACE=encrypt_ts ENCRYPTION='Y' ENGINE = InnoDB;
ALTER INSTANCE ROTATE INNODB MASTER KEY;
ERROR HY000: Can't find master key from keyring, please check in the server log if a keyring is loaded and initialized successfully.
DROP TABLE tde_db.t_encrypt_4;
# Restoring local keyring file from backup for keyring component: component_keyring_file
ALTER INSTANCE RELOAD KEYRING;
#########################################################################
# Test 4 : Restart with new keyring_data_file
#            - Old encrypted tables not accessible
#            - Non encrypted tables accessible
#            - Creation of new tables in encrypted/unencrypted tablespace
#              is also posible
#########################################################################
# init tables
call tde_db.init_setup();
/*  select tde_db.t_encrypt */
/*  select tde_db.t_encrypt */
COUNT(*)
64
c2	right(c3,20)	c4	c5	c6	ST_AsText(c7)
1	aaaaaaaaaaaaaaaa0001	{"key_a": 1, "key_b": 2, "key_c": 3}	1	2	POINT(383293632 1754448)
2	aaaaaaaaaaaaaaaa0001	{"key_a": 1, "key_b": 2, "key_c": 3}	1	2	POINT(383293632 1754448)
3	aaaaaaaaaaaaaaaa0001	{"key_a": 1, "key_b": 2, "key_c": 3}	1	2	POINT(383293632 1754448)
4	aaaaaaaaaaaaaaaa0001	{"key_a": 1, "key_b": 2, "key_c": 3}	1	2	POINT(383293632 1754448)
6	aaaaaaaaaaaaaaaa0001	{"key_a": 1, "key_b": 2, "key_c": 3}	1	2	POINT(383293632 1754448)
7	aaaaaaaaaaaaaaaa0001	{"key_a": 1, "key_b": 2, "key_c": 3}	1	2	POINT(383293632 1754448)
8	aaaaaaaaaaaaaaaa0001	{"key_a": 1, "key_b": 2, "key_c": 3}	1	2	POINT(383293632 1754448)
9	aaaaaaaaaaaaaaaa0001	{"key_a": 1, "key_b": 2, "key_c": 3}	1	2	POINT(383293632 1754448)
13	aaaaaaaaaaaaaaaa0001	{"key_a": 1, "key_b": 2, "key_c": 3}	1	2	POINT(383293632 1754448)
14	aaaaaaaaaaaaaaaa0001	{"key_a": 1, "key_b": 2, "key_c": 3}	1	2	POINT(383293632 1754448)
/*  select tde_db.t_non_encrypt */
/*  select tde_db.t_non_encrypt */
COUNT(*)
64
c2	right(c3,20)	c4	c5	c6	ST_AsText(c7)
1	aaaaaaaaaaaaaaaa0001	{"key_a": 1, "key_b": 2, "key_c": 3}	1	2	POINT(383293632 1754448)
2	aaaaaaaaaaaaaaaa0001	{"key_a": 1, "key_b": 2, "key_c": 3}	1	2	POINT(383293632 1754448)
3	aaaaaaaaaaaaaaaa0001	{"key_a": 1, "key_b": 2, "key_c": 3}	1	2	POINT(383293632 1754448)
4	aaaaaaaaaaaaaaaa0001	{"key_a": 1, "key_b": 2, "key_c": 3}	1	2	POINT(383293632 1754448)
6	aaaaaaaaaaaaaaaa0001	{"key_a": 1, "key_b": 2, "key_c": 3}	1	2	POINT(383293632 1754448)
7	aaaaaaaaaaaaaaaa0001	{"key_a": 1, "key_b": 2, "key_c": 3}	1	2	POINT(383293632 1754448)
8	aaaaaaaaaaaaaaaa0001	{"key_a": 1, "key_b": 2, "key_c": 3}	1	2	POINT(383293632 1754448)
9	aaaaaaaaaaaaaaaa0001	{"key_a": 1, "key_b": 2, "key_c": 3}	1	2	POINT(383293632 1754448)
13	aaaaaaaaaaaaaaaa0001	{"key_a": 1, "key_b": 2, "key_c": 3}	1	2	POINT(383293632 1754448)
14	aaaaaaaaaaaaaaaa0001	{"key_a": 1, "key_b": 2, "key_c": 3}	1	2	POINT(383293632 1754448)
/*  select tde_db.t_encrypt_2 */
/*  select tde_db.t_encrypt_2 */
COUNT(*)
64
c2	right(c3,20)	c4	c5	c6	ST_AsText(c7)
1	aaaaaaaaaaaaaaaa0001	{"key_a": 1, "key_b": 2, "key_c": 3}	1	2	POINT(383293632 1754448)
2	aaaaaaaaaaaaaaaa0001	{"key_a": 1, "key_b": 2, "key_c": 3}	1	2	POINT(383293632 1754448)
3	aaaaaaaaaaaaaaaa0001	{"key_a": 1, "key_b": 2, "key_c": 3}	1	2	POINT(383293632 1754448)
4	aaaaaaaaaaaaaaaa0001	{"key_a": 1, "key_b": 2, "key_c": 3}	1	2	POINT(383293632 1754448)
5	aaaaaaaaaaaaaaaa0001	{"key_a": 1, "key_b": 2, "key_c": 3}	1	2	POINT(383293632 1754448)
6	aaaaaaaaaaaaaaaa0001	{"key_a": 1, "key_b": 2, "key_c": 3}	1	2	POINT(383293632 1754448)
7	aaaaaaaaaaaaaaaa0001	{"key_a": 1, "key_b": 2, "key_c": 3}	1	2	POINT(383293632 1754448)
8	aaaaaaaaaaaaaaaa0001	{"key_a": 1, "key_b": 2, "key_c": 3}	1	2	POINT(383293632 1754448)
9	aaaaaaaaaaaaaaaa0001	{"key_a": 1, "key_b": 2, "key_c": 3}	1	2	POINT(383293632 1754448)
10	aaaaaaaaaaaaaaaa0001	{"key_a": 1, "key_b": 2, "key_c": 3}	1	2	POINT(383293632 1754448)
/*  select tde_db.t_non_encrypt_2 */
/*  select tde_db.t_non_encrypt_2 */
COUNT(*)
64
c2	right(c3,20)	c4	c5	c6	ST_AsText(c7)
1	aaaaaaaaaaaaaaaa0001	{"key_a": 1, "key_b": 2, "key_c": 3}	1	2	POINT(383293632 1754448)
2	aaaaaaaaaaaaaaaa0001	{"key_a": 1, "key_b": 2, "key_c": 3}	1	2	POINT(383293632 1754448)
3	aaaaaaaaaaaaaaaa0001	{"key_a": 1, "key_b": 2, "key_c": 3}	1	2	POINT(383293632 1754448)
4	aaaaaaaaaaaaaaaa0001	{"key_a": 1, "key_b": 2, "key_c": 3}	1	2	POINT(383293632 1754448)
6	aaaaaaaaaaaaaaaa0001	{"key_a": 1, "key_b": 2, "key_c": 3}	1	2	POINT(383293632 1754448)
7	aaaaaaaaaaaaaaaa0001	{"key_a": 1, "key_b": 2, "key_c": 3}	1	2	POINT(383293632 1754448)
8	aaaaaaaaaaaaaaaa0001	{"key_a": 1, "key_b": 2, "key_c": 3}	1	2	POINT(383293632 1754448)
9	aaaaaaaaaaaaaaaa0001	{"key_a": 1, "key_b": 2, "key_c": 3}	1	2	POINT(383293632 1754448)
13	aaaaaaaaaaaaaaaa0001	{"key_a": 1, "key_b": 2, "key_c": 3}	1	2	POINT(383293632 1754448)
14	aaaaaaaaaaaaaaaa0001	{"key_a": 1, "key_b": 2, "key_c": 3}	1	2	POINT(383293632 1754448)
# Taking backup of local keyring file for keyring component: component_keyring_file
# restart with with different keyring file
# old encrypted tables not accessible
SELECT COUNT(*) FROM tde_db.t_encrypt;
ERROR HY000: Can't find master key from keyring, please check in the server log if a keyring is loaded and initialized successfully.
SELECT COUNT(*) FROM tde_db.t_encrypt_2;
ERROR HY000: Can't find master key from keyring, please check in the server log if a keyring is loaded and initialized successfully.
# NON encrypted tables accessible
SELECT COUNT(*) FROM tde_db.t_non_encrypt;
COUNT(*)
64
SELECT COUNT(*) FROM tde_db.t_non_encrypt_2;
COUNT(*)
64
# new encrypted tablespace possible
CREATE TABLESPACE encrypt_ts2 ADD DATAFILE 'encrypt_ts2.ibd' ENCRYPTION ='Y' ENGINE=InnoDB;
# new table in new encrypted tablespace possible
CREATE TABLE tde_db.t_encrypt_4(c2 INT NOT NULL AUTO_INCREMENT PRIMARY KEY,
c3 CHAR(255) Default 'No text',
c4 JSON ,
c5 INT GENERATED ALWAYS AS (JSON_EXTRACT(c4,'$.key_a')) STORED,
c6 INT GENERATED ALWAYS AS (JSON_EXTRACT(c4,'$.key_b')) VIRTUAL,
c7 POINT NOT NULL SRID 0,
spatial INDEX idx2 (c7)
) TABLESPACE encrypt_ts2 ENCRYPTION='Y' ENGINE = InnoDB;
# new table in non encrypted tablespace possible
CREATE TABLE tde_db.t_non_encrypt_4(c2 INT NOT NULL AUTO_INCREMENT PRIMARY KEY,
c3 CHAR(255) Default 'No text',
c4 JSON ,
c5 INT GENERATED ALWAYS AS (JSON_EXTRACT(c4,'$.key_a')) STORED,
c6 INT GENERATED ALWAYS AS (JSON_EXTRACT(c4,'$.key_b')) VIRTUAL,
c7 POINT NOT NULL SRID 0,
spatial INDEX idx2 (c7)
) TABLESPACE=encrypt_ts1 ENGINE = InnoDB;
INSERT INTO tde_db.t_encrypt_4(c3,c4,c7) SELECT c3,c4,c7 FROM tde_db.t_non_encrypt;
SELECT COUNT(*) FROM tde_db.t_encrypt_4;
COUNT(*)
64
INSERT INTO tde_db.t_non_encrypt_4(c3,c4,c7) SELECT c3,c4,c7 FROM tde_db.t_non_encrypt;
SELECT COUNT(*) FROM tde_db.t_non_encrypt_4;
COUNT(*)
64
ALTER INSTANCE ROTATE INNODB MASTER KEY;
# Old encrypted tables in encrypted tablespace must not be accessible
SELECT COUNT(*) FROM tde_db.t_encrypt;
ERROR HY000: Can't find master key from keyring, please check in the server log if a keyring is loaded and initialized successfully.
SELECT COUNT(*) FROM tde_db.t_encrypt_2;
ERROR HY000: Can't find master key from keyring, please check in the server log if a keyring is loaded and initialized successfully.
# Old unencrypted table must be accessible
SELECT COUNT(*) FROM tde_db.t_non_encrypt;
COUNT(*)
64
SELECT COUNT(*) FROM tde_db.t_non_encrypt_2;
COUNT(*)
64
# New encrypted tables must be accessible
SELECT COUNT(*) FROM tde_db.t_encrypt_4;
COUNT(*)
64
# New unencrypted tables must be accessible
SELECT COUNT(*) FROM tde_db.t_non_encrypt_4;
COUNT(*)
64
###########
# CLEANUP #
###########
DROP TABLE tde_db.t_encrypt , tde_db.t_encrypt_2 ,tde_db.t_encrypt_4;
DROP TABLE tde_db.t_non_encrypt , tde_db.t_non_encrypt_2 ,tde_db.t_non_encrypt_4;
DROP DATABASE tde_db;
DROP TABLESPACE encrypt_ts;
DROP TABLESPACE encrypt_ts1;
DROP TABLESPACE encrypt_ts2;
# Restoring local keyring file from backup for keyring component: component_keyring_file
# ----------------------------------------------------------------------
# Teardown
# Removing manifest file for current MySQL server instance
# Removing local keyring file for keyring component: component_keyring_file
# Removing local configuration file for keyring component: component_keyring_file
# Restarting server without the manifest file
# ----------------------------------------------------------------------
