# ----------------------------------------------------------------------
# Setup
# Creating custom global manifest file for MySQL server
# Creating custom global configuration file for keyring component: component_keyring_file
# Re-starting mysql server with manifest file
# ----------------------------------------------------------------------
# WL#9289 InnoDB transparent tablespace data encryption for undo log
# create bootstrap file
# Stop the MTR default DB server
# Test1: bootstrap with 2 undo tablespaces and with keyring.
# Run the bootstrap command with keyring
# Start the DB server with undo log encryption disabled, and no keyring.
# Taking backup of global manifest file for MySQL server
# Enable undo log encryption, should report error in server log, since keyring is not loaded.
SET GLOBAL innodb_undo_log_encrypt = ON;
CREATE TABLE t1(c1 INT, c2 char(20)) ENCRYPTION="Y" ENGINE = InnoDB;
ERROR HY000: Can't find master key from keyring, please check in the server log if a keyring is loaded and initialized successfully.
# Start the DB server with undo log encryption disabled and keyring loaded. It should success.
# Restore global manifest file for MySQL server from backup
# Enable undo log encryption, shouldn't report error in server log.
SET GLOBAL innodb_undo_log_encrypt = ON;
CREATE TABLE t1(c1 INT, c2 char(20)) ENCRYPTION='Y' ENGINE = InnoDB;
SHOW CREATE TABLE t1;
Table	Create Table
t1	CREATE TABLE `t1` (
  `c1` int DEFAULT NULL,
  `c2` char(20) DEFAULT NULL
) ENGINE=InnoDB DEFAULT CHARSET=latin1 ENCRYPTION='Y'
INSERT INTO t1 VALUES(0, "aaaaa");
INSERT INTO t1 VALUES(1, "bbbbb");
INSERT INTO t1 VALUES(2, "ccccc");
INSERT INTO t1 VALUES(3, "ddddd");
INSERT INTO t1 VALUES(4, "eeeee");
INSERT INTO t1 VALUES(5, "fffff");
INSERT INTO t1 VALUES(6, "ggggg");
INSERT INTO t1 VALUES(7, "hhhhh");
INSERT INTO t1 VALUES(8, "iiiii");
INSERT INTO t1 VALUES(9, "jjjjj");
INSERT INTO t1 select * from t1;
INSERT INTO t1 select * from t1;
INSERT INTO t1 select * from t1;
INSERT INTO t1 select * from t1;
INSERT INTO t1 select * from t1;
INSERT INTO t1 select * from t1;
CREATE TABLE t2(c1 INT, c2 char(20)) ENGINE = InnoDB;
INSERT INTO t2 select * from t1;
SELECT * FROM t1 ORDER BY c1 LIMIT 10;
c1	c2
0	aaaaa
0	aaaaa
0	aaaaa
0	aaaaa
0	aaaaa
0	aaaaa
0	aaaaa
0	aaaaa
0	aaaaa
0	aaaaa
SELECT * FROM t2 ORDER BY c1 LIMIT 10;
c1	c2
0	aaaaa
0	aaaaa
0	aaaaa
0	aaaaa
0	aaaaa
0	aaaaa
0	aaaaa
0	aaaaa
0	aaaaa
0	aaaaa
# Start the DB server with undo log encryption enabled and keyring loaded. It should success.
SELECT * FROM t1 ORDER BY c1 LIMIT 10;
c1	c2
0	aaaaa
0	aaaaa
0	aaaaa
0	aaaaa
0	aaaaa
0	aaaaa
0	aaaaa
0	aaaaa
0	aaaaa
0	aaaaa
SELECT * FROM t2 ORDER BY c1 LIMIT 10;
c1	c2
0	aaaaa
0	aaaaa
0	aaaaa
0	aaaaa
0	aaaaa
0	aaaaa
0	aaaaa
0	aaaaa
0	aaaaa
0	aaaaa
DROP TABLE t1,t2;
# Search for particular string of encryption metadata, should success since it's encrypted.
Pattern "lCC" found
CREATE TABLE t1(c1 INT, c2 char(20)) ENGINE = InnoDB;
START TRANSACTION;
INSERT INTO t1 VALUES(0, "aaaaa");
INSERT INTO t1 VALUES(1, "bbbbb");
SET GLOBAL innodb_undo_log_encrypt = OFF;
INSERT INTO t1 VALUES(2, "ccccc");
INSERT INTO t1 VALUES(3, "ddddd");
SET GLOBAL innodb_undo_log_encrypt = ON;
INSERT INTO t1 VALUES(4, "eeeee");
INSERT INTO t1 VALUES(5, "fffff");
COMMIT;
START TRANSACTION;
INSERT INTO t1 VALUES(6, "ggggg");
SET GLOBAL innodb_undo_log_encrypt = OFF;
INSERT INTO t1 VALUES(7, "hhhhh");
INSERT INTO t1 VALUES(8, "iiiii");
SET GLOBAL innodb_undo_log_encrypt = ON;
INSERT INTO t1 VALUES(9, "jjjjj");
# Kill and restart to confirm the encryption info can be retrieved properly.
# Kill the server
SELECT * FROM t1 ORDER BY c1 LIMIT 10;
c1	c2
0	aaaaa
1	bbbbb
2	ccccc
3	ddddd
4	eeeee
5	fffff
DELETE FROM t1;
START TRANSACTION;
INSERT INTO t1 VALUES(0, "aaaaa");
INSERT INTO t1 VALUES(1, "bbbbb");
INSERT INTO t1 VALUES(2, "ccccc");
INSERT INTO t1 VALUES(3, "ddddd");
INSERT INTO t1 VALUES(4, "eeeee");
INSERT INTO t1 VALUES(5, "fffff");
INSERT INTO t1 VALUES(6, "ggggg");
INSERT INTO t1 VALUES(7, "hhhhh");
INSERT INTO t1 VALUES(8, "iiiii");
INSERT INTO t1 VALUES(9, "jjjjj");
# Start the DB server with undo log encryption disabled and keyring loaded. It should succeed.
SELECT * FROM t1 ORDER BY c1 LIMIT 10;
c1	c2
ALTER INSTANCE ROTATE INNODB MASTER KEY;
INSERT INTO t1 VALUES(0, "aaaaa");
INSERT INTO t1 VALUES(1, "bbbbb");
INSERT INTO t1 VALUES(2, "ccccc");
INSERT INTO t1 VALUES(3, "ddddd");
INSERT INTO t1 VALUES(4, "eeeee");
INSERT INTO t1 VALUES(5, "fffff");
INSERT INTO t1 VALUES(6, "ggggg");
INSERT INTO t1 VALUES(7, "hhhhh");
INSERT INTO t1 VALUES(8, "iiiii");
INSERT INTO t1 VALUES(9, "jjjjj");
FLUSH ENGINE LOGS;
# Start the DB server with undo log encryption and keyring loaded. It should success.
SELECT * FROM t1 ORDER BY c1 LIMIT 10;
c1	c2
0	aaaaa
1	bbbbb
2	ccccc
3	ddddd
4	eeeee
5	fffff
6	ggggg
7	hhhhh
8	iiiii
9	jjjjj
# Cleanup
DROP TABLE t1;
# restart the server with MTR default
# Remove residue files
# ----------------------------------------------------------------------
# Teardown
# Removing local keyring file for keyring component: component_keyring_file
# Removing global configuration file for keyring component: component_keyring_file
# Removing global manifest file for MySQL server
# Restarting server without the manifest file
# ----------------------------------------------------------------------
