CREATE TABLE t1 (
a int PRIMARY KEY,
b varchar(255)
) ENGINE = NDB;
INSERT INTO t1 VALUES (1, "MySQL Server with NDB");
INSERT INTO t1 (a, b) VALUES (11, "Barrier effect");
INSERT INTO t1 (a, b) VALUES
(12, "The third row"),
(37, "And of course number 37");
SELECT * FROM t1 WHERE a = 1;
a	b
1	MySQL Server with NDB
UPDATE t1 SET b = CONCAT(b, " test") WHERE a = 1;
SELECT * FROM t1 WHERE a = 1;
a	b
1	MySQL Server with NDB test
REPLACE t1 (a, b) VALUES (12, "Another layer");
SELECT * FROM t1 WHERE a = 12 ORDER BY a;
a	b
12	Another layer
DELETE FROM t1 WHERE a = 11;
SELECT COUNT(*) FROM t1;
COUNT(*)
3
SELECT b FROM t1 WHERE b LIKE "MySQL%";
b
MySQL Server with NDB test
DELETE FROM t1 ORDER BY b DESC;
DROP TABLE t1;
#
# WL#6599: New Data Dictionary and I_S Integration.
#
# Test case to check if ndbinfo schema is listed by I_S when ndbcluster
# is running.
#
SELECT schema_name FROM INFORMATION_SCHEMA.SCHEMATA WHERE SCHEMA_NAME = 'ndbinfo';
SCHEMA_NAME
ndbinfo
SELECT table_name FROM INFORMATION_SCHEMA.TABLES WHERE TABLE_SCHEMA = 'ndbinfo';
TABLE_NAME
arbitrator_validity_detail
arbitrator_validity_summary
blocks
cluster_operations
cluster_transactions
config_params
config_values
counters
dict_obj_types
disk_write_speed_aggregate
disk_write_speed_aggregate_node
disk_write_speed_base
diskpagebuffer
logbuffers
logspaces
membership
memory_per_fragment
memoryusage
nodes
operations_per_fragment
resources
restart_info
server_operations
server_transactions
tc_time_track_stats
threadblocks
threadstat
transporters
