use test;
drop table if exists t;
create temporary table t (
i int,
f float,
primary key pk_index(i),
index sec_index(f)
) engine = innodb;
insert into t values (10, 2.2), (20, 3.3), (30, 4.4), (40, 5.5);
rollback;
select * from t;
i	f
10	2.2
20	3.3
30	4.4
40	5.5
update t set i = 50 where i = 40;
update t set i = 60 where i = 30;
rollback;
select * from t;
i	f
10	2.2
20	3.3
60	4.4
50	5.5
delete from t where i = 10;
delete from t where f < 3.4;
rollback;
select * from t;
i	f
60	4.4
50	5.5
delete from t where i = 10;
delete from t;
select * from t;
i	f
drop table if exists t;
create temporary table t (
i int,
f float,
primary key pk_index(i),
index sec_index(f)
) engine = innodb;
begin;
insert into t values (10, 2.2), (20, 3.3), (30, 4.4), (40, 5.5);
select * from t;
i	f
10	2.2
20	3.3
30	4.4
40	5.5
commit;
select * from t;
i	f
10	2.2
20	3.3
30	4.4
40	5.5
rollback;
select * from t;
i	f
10	2.2
20	3.3
30	4.4
40	5.5
drop table if exists t;
create temporary table t (
i int,
f float,
primary key pk_index(i),
index sec_index(f)
) engine = innodb;
begin;
insert into t values (10, 2.2), (20, 3.3), (30, 4.4), (40, 5.5);
select * from t;
i	f
10	2.2
20	3.3
30	4.4
40	5.5
rollback;
select * from t;
i	f
insert into t values (10, 2.2), (20, 3.3), (30, 4.4), (40, 5.5);
begin;
delete from t;
select * from t;
i	f
rollback;
select * from t;
i	f
10	2.2
20	3.3
30	4.4
40	5.5
begin;
update t set i = 50 where i = 40;
update t set i = 60 where i = 30;
select * from t;
i	f
10	2.2
20	3.3
60	4.4
50	5.5
rollback;
select * from t;
i	f
10	2.2
20	3.3
30	4.4
40	5.5
drop table if exists t;
create temporary table t (
i int,
f float,
primary key pk_index(i),
index sec_index(f)
) engine = innodb;
start transaction;
savepoint first;
insert into t values (10, 2.2), (20, 3.3), (30, 4.4), (40, 5.5);
select * from t;
i	f
10	2.2
20	3.3
30	4.4
40	5.5
rollback to first;
select * from t;
i	f
insert into t values (10, 2.2), (20, 3.3), (30, 4.4), (40, 5.5);
begin;
delete from t where i = 10;
select * from t;
i	f
20	3.3
30	4.4
40	5.5
savepoint first;
delete from t;
select * from t;
i	f
rollback to first;
select * from t;
i	f
20	3.3
30	4.4
40	5.5
commit;
select * from t;
i	f
20	3.3
30	4.4
40	5.5
begin;
update t set i = 50 where i = 40;
savepoint first;
update t set i = 60 where i = 30;
select * from t;
i	f
20	3.3
60	4.4
50	5.5
rollback to first;
select * from t;
i	f
20	3.3
30	4.4
50	5.5
commit;
drop table if exists t;
create temporary table t1
(keyc int, c1 char(100), c2 char(100),
primary key(keyc)) engine = innodb;
create procedure populate_t1()
begin
declare i int default 1;
while (i <= 20000) do
insert into t1 values (i, 'a', 'b');
set i = i + 1;
end while;
end|
create procedure populate_t1_small()
begin
declare i int default 1;
while (i <= 2000) do
insert into t1 values (i, 'a', 'b');
set i = i + 1;
end while;
end|
begin;
select count(*) from t1;
count(*)
0
call populate_t1();
select count(*) from t1;
count(*)
20000
select * from t1 limit 10;
keyc	c1	c2
1	a	b
2	a	b
3	a	b
4	a	b
5	a	b
6	a	b
7	a	b
8	a	b
9	a	b
10	a	b
rollback;
select count(*) from t1;
count(*)
0
begin;
call populate_t1();
select count(*) from t1;
count(*)
20000
commit;
select count(*) from t1;
count(*)
20000
truncate table t1;
select count(*) from t1;
count(*)
0
call populate_t1_small();
select count(*) from t1;
count(*)
2000
rollback;
select count(*) from t1;
count(*)
2000
drop procedure populate_t1;
drop procedure populate_t1_small;
drop table t1;
