call mtr.add_suppression("InnoDB: Tablespace innodb_temporary ran out of space. Please add another file or use \'autoextend\' for the last file in setting innodb_temp_data_file_path");
call mtr.add_suppression("The table \'t1\' is full");
set session innodb_create_intrinsic = 1;
create temporary table t1 (i int, j int, primary key pk(i)) engine = innodb;
create temporary table t2 (i int, j int, primary key pk(i)) engine = innodb;
create temporary table t3 (i int, j int, primary key pk(i)) engine = innodb;
create temporary table t4 (i int, j int, primary key pk(i)) engine = innodb;
drop table t1,t2,t3,t4;
create temporary table t1 (i int, j int, primary key pk(i)) engine = innodb;
drop table t1;
use test;
create temporary table t1
(keyc int, c1 char(100), c2 char(100),
primary key(keyc)) engine = innodb;
CREATE PROCEDURE populate_t1()
BEGIN
DECLARE i INT DEFAULT 1;
while (i <= 2000) DO
insert into t1 values (i, 'a', 'b');
SET i = i + 1;
END WHILE;
END|
begin;
call populate_t1();
commit;
select count(*) from t1;
count(*)
2000
truncate t1;
ERROR HY000: Table storage engine for 't1' doesn't have this option
delete from t1 where keyc < 1000;
select count(*) from t1;
count(*)
1001
check table t1;
Table	Op	Msg_type	Msg_text
test.t1	check	status	OK
update t1 set c1 = 'aefafdf' where keyc < 1500;
select count(*) from t1;
count(*)
1001
check table t1;
Table	Op	Msg_type	Msg_text
test.t1	check	status	OK
update t1 set c2 = '141434' where keyc < 2000;
select count(*) from t1;
count(*)
1001
check table t1;
Table	Op	Msg_type	Msg_text
test.t1	check	status	OK
delete from t1;
select count(*) from t1;
count(*)
0
check table t1;
Table	Op	Msg_type	Msg_text
test.t1	check	status	OK
alter table t1 add index sk(c1);
ERROR HY000: Table storage engine for 'InnoDB' doesn't have this option
begin;
call populate_t1();
commit;
select count(*) from t1;
count(*)
2000
truncate t1;
ERROR HY000: Table storage engine for 't1' doesn't have this option
delete from t1 where keyc < 1000;
select count(*) from t1;
count(*)
1001
check table t1;
Table	Op	Msg_type	Msg_text
test.t1	check	status	OK
update t1 set c1 = 'aefafdf' where keyc < 1500;
select count(*) from t1;
count(*)
1001
check table t1;
Table	Op	Msg_type	Msg_text
test.t1	check	status	OK
update t1 set c2 = '141434' where keyc < 2000;
select count(*) from t1;
count(*)
1001
check table t1;
Table	Op	Msg_type	Msg_text
test.t1	check	status	OK
alter table t1 add column (t char(10));
ERROR HY000: Table storage engine for 'InnoDB' doesn't have this option
select * from t1 limit 5;
keyc	c1	c2
1000	aefafdf	141434
1001	aefafdf	141434
1002	aefafdf	141434
1003	aefafdf	141434
1004	aefafdf	141434
delete from t1;
select count(*) from t1;
count(*)
0
check table t1;
Table	Op	Msg_type	Msg_text
test.t1	check	status	OK
create temporary table t2 (
id int primary key, t1_keyc int,
foreign key (t1_keyc) references t1(keyc)) engine = innodb;
ERROR HY000: Cannot add foreign key constraint
drop procedure populate_t1;
drop table t1;
Warnings:
Note	1051	Unknown table 'test.t1'
Note	1051	Unknown table 'test.t2'
Warnings:
Note	1305	FUNCTION test.func1 does not exist
Warnings:
Note	1051	Unknown table 'test.t3'
Warnings:
Note	1051	Unknown table 'test.t4'
Warnings:
Note	1051	Unknown table 'test.t5'
Warnings:
Note	1051	Unknown table 'test.t6'
Warnings:
Note	1051	Unknown table 'test.t7'
Warnings:
Note	1051	Unknown table 'test.t8'
Warnings:
Note	1051	Unknown table 'test.t9'
Note	1051	Unknown table 'test.t10'
Warnings:
Warning	1831	Duplicate index 'col_varchar_key' defined on the table 'test.t9'. This is deprecated and will be disallowed in a future release.
Warnings:
Warning	1831	Duplicate index 'col_varchar_key' defined on the table 'test.t10'. This is deprecated and will be disallowed in a future release.
Table	Op	Msg_type	Msg_text
test.t1	analyze	status	OK
test.t2	analyze	status	OK
test.t3	analyze	status	OK
test.t4	analyze	status	OK
test.t5	analyze	status	OK
test.t6	analyze	status	OK
test.t7	analyze	status	OK
test.t8	analyze	status	OK
test.t9	analyze	status	OK
test.t10	analyze	status	OK
test.t11	analyze	status	OK
test.t12	analyze	status	OK
test.t13	analyze	status	OK
test.t14	analyze	status	OK
select sql_buffer_result * from t1;
a	b
1	a
2	b
3	c
3	c
4	c
select sql_buffer_result * from t2;
a	b
2	d
3	e
4	f
4	f
5	e
select * from t1 left join t2 on t1.b = t2.b order by t1.a;
a	b	a	b
1	a	NULL	NULL
2	b	NULL	NULL
3	c	NULL	NULL
3	c	NULL	NULL
4	c	NULL	NULL
select * from t1 order by func1(a);
a	b
1	a
2	b
3	c
3	c
4	c
select a from t1 group by b order by sum(a);
a
1
2
3
select a from t7 group by b order by sum(a);
a
1
2
3
select sql_big_result distinct * from t1, t2;
a	b	a	b
1	a	2	d
2	b	2	d
3	c	2	d
4	c	2	d
1	a	3	e
2	b	3	e
3	c	3	e
4	c	3	e
1	a	4	f
2	b	4	f
3	c	4	f
4	c	4	f
1	a	5	e
2	b	5	e
3	c	5	e
4	c	5	e
select sql_big_result t1.b from t1, t2 group by t1.b;
b
a
b
c
select sql_big_result distinct t1.a from t1, t2 group by t1.b;
a
1
2
3
select t1.* from t1 inner join t2 on t1.a = t2.a order by t2.a;
a	b
2	b
3	c
3	c
4	c
4	c
select t1.* from t1, t2 where t1.a = t2.a order by t1.a;
a	b
2	b
3	c
3	c
4	c
4	c
select t1.* from t1 inner join t2 where t1.a = t2.a group by t1.a;
a	b
2	b
3	c
4	c
select t1.* from t1 inner join t2 where t1.a = t2.a group by t2.a;
a	b
2	b
3	c
4	c
select a from t1 group by a order by a;
a
1
2
3
4
select b from t1 group by b order by a;
b
a
b
c
select distinct t1.a from t1, t2 where  t1.b = t2.b;
a
select distinct a from t1 group by b,a;
a
1
2
3
4
select distinct t4.a,e from t4, t1 order by t4.b;
a	e
1	5
set big_tables = 1;
select * from t1 union all select * from t2;
a	b
1	a
2	b
3	c
3	c
4	c
2	d
3	e
4	f
4	f
5	e
select * from t1 union select * from t2 order by b;
a	b
1	a
2	b
3	c
4	c
2	d
3	e
5	e
4	f
select tt.* from (select * from t1) as tt;
a	b
1	a
2	b
3	c
3	c
4	c
select b from (select b from t5 where b > 5) tt;
b
7
8
select * from (select b from t1) as t1, (select b from t2) as t2;
b	b
a	d
b	d
c	d
c	d
c	d
a	e
b	e
c	e
c	e
c	e
a	f
b	f
c	f
c	f
c	f
a	f
b	f
c	f
c	f
c	f
a	e
b	e
c	e
c	e
c	e
select * from t1, (select * from t6) as t where t.a =5;
a	b	a	b	c	d
select * from t1 where t1.a in (select a from t2) ;
a	b
2	b
3	c
3	c
4	c
set optimizer_switch='materialization=off';
set optimizer_switch='firstmatch=off';
set optimizer_switch='loosescan=off';
select * from t1 where t1.a in (select a from t2) ;
a	b
2	b
3	c
3	c
4	c
set optimizer_switch=default;
update t1, t2 set t1.a = 9, t2.a = 10 where t1.b = 'a';
update t1, t2 set t1.a = 9, t2.a = 10 where t1.b = 'a';
select count(distinct a) from t1;
count(distinct a)
4
select b, group_concat(a) from t1;
b	group_concat(a)
b	2,3,3,4,9
select * from t1;
a	b
2	b
3	c
3	c
4	c
9	a
select b, count(a), sum(a), avg(a), std(a), min(a),
max(a), bit_and(a), bit_or(a) from t1 group by b;
b	count(a)	sum(a)	avg(a)	std(a)	min(a)	max(a)	bit_and(a)	bit_or(a)
a	1	9	9.0000	0	9	9	9	9
b	1	2	2.0000	0	2	2	2	2
c	3	10	3.3333	0.4714045207910316	3	4	0	7
select sql_big_result * from information_schema.global_variables where variable_name like 'internal_tmp_disk_storage_engine';
VARIABLE_NAME	VARIABLE_VALUE
INTERNAL_TMP_DISK_STORAGE_ENGINE	TMP_TABLE_ENGINE
select 1 union distinct select 1 union all select 1;
1
1
1
select alias1.`col_int_key` AS field1 from (t8 as alias1) where (5) in
(select 7 union select 1) order by alias1.`col_varchar_key` asc;
field1
select t from t12 group by c;
t
NULL

1
a
hello
HELLO MY
drop function func1;
drop table t1, t2, t3, t4, t5, t6, t7, t8, t9, t10, t11, t12, t13, t14;
create temporary table t1 (
a int, b int, c int,
primary key pk(a), index sk(b), index sk2(c)) engine=innodb;
insert into t1 values (1, 1, 1), (2, 2, 2), (3, 3, 3);
update t1 set c = 4 where c = 2;
update t1 set b = 6 where b = 2;
update t1 set a = 100 where a = 1;
update t1 set a = 3 where a = 2;
ERROR 23000: Duplicate entry '3' for key 'PRIMARY'
select * from t1;
a	b	c
2	6	4
3	3	3
100	1	1
begin;
insert into t1 values (4, 4, 4), (5, 5, 5);
rollback;
select * from t1;
a	b	c
2	6	4
3	3	3
4	4	4
5	5	5
100	1	1
insert into t1 values (6, 6, 6), (7, 7, 7), (100, 100, 100);
ERROR 23000: Duplicate entry '100' for key 'PRIMARY'
check table t1;
Table	Op	Msg_type	Msg_text
test.t1	check	status	OK
select * from t1;
a	b	c
2	6	4
3	3	3
4	4	4
5	5	5
6	6	6
7	7	7
100	1	1
insert into t1 values (8, 8, 8), (100, 100, 100)
on duplicate key update c = 100 + c;
select * from t1;
a	b	c
2	6	4
3	3	3
4	4	4
5	5	5
6	6	6
7	7	7
8	8	8
100	1	101
delete from t1;
insert into t1 values (8, 8, 8), (100, 100, 100)
on duplicate key update c = 100 + c;
insert into t1 values (8, 8, 8), (100, 100, 100)
on duplicate key update c = 100 + c;
check table t1;
Table	Op	Msg_type	Msg_text
test.t1	check	status	OK
select * from t1;
a	b	c
8	8	108
100	100	200
drop table t1;
create temporary table t1
(a int not null, d int not null, b varchar(198) not null, c char(179),
unique key (b(10), a, d), index (d), index(a), index (c(99), b(33)),
index (b(5), c(10), a) ) engine=InnoDB;
replace into t1 (a,d,b,c) values ('0','6','kjgclgrtfuyl','');
replace into t1 (a,d,b,c) values ('0','6','0.73611461938','0.799541829209147');
replace into t1 (a,d,b,c) values ('0','6','kjgclgrtfuyl','');
replace into t1 (a,d,b,c) values ('0','6','0.519839844','0.389471635790457');
update t1 set b = 'khFSeqh4XHukO' , d = '128869539', c = '-100141534.687515' where a = '0';
ERROR 23000: Duplicate entry 'khFSeqh4XH-0-128869539' for key 'b'
drop table t1;
use test;
create temporary table t1
(keyc int, c1 blob, c2 char(100),
primary key(keyc), index sk(c1(10)), index sk2(c2)) engine = innodb;
CREATE PROCEDURE populate_t1()
BEGIN
DECLARE i INT DEFAULT 1;
while (i <= 20) DO
insert into t1 values (i, repeat('a', 10000), 'b');
SET i = i + 1;
END WHILE;
END|
begin;
call populate_t1();
commit;
select count(*) from t1;
count(*)
20
check table t1;
Table	Op	Msg_type	Msg_text
test.t1	check	status	OK
truncate t1;
ERROR HY000: Table storage engine for 't1' doesn't have this option
delete from t1 where keyc < 10;
select count(*) from t1;
count(*)
11
check table t1;
Table	Op	Msg_type	Msg_text
test.t1	check	status	OK
update t1 set c1 = 'aefafdf' where keyc < 15;
select count(*) from t1;
count(*)
11
check table t1;
Table	Op	Msg_type	Msg_text
test.t1	check	status	OK
update t1 set c2 = '141434' where keyc < 20;
select count(*) from t1;
count(*)
11
check table t1;
Table	Op	Msg_type	Msg_text
test.t1	check	status	OK
delete from t1;
select count(*) from t1;
count(*)
0
check table t1;
Table	Op	Msg_type	Msg_text
test.t1	check	status	OK
drop procedure populate_t1;
drop table t1;
create temporary table t1 (
c1 char(255), c2 char(255), c3 char(255),
primary key pk (c1, c2, c3)) engine=innodb;
insert into t1 values ('a', 'b', 'c');
insert into t1 values ('a1', 'b1', 'c1');
insert into t1 values ('a2', 'b2', 'c2');
insert into t1 values ('a3', 'b3', 'c3');
insert into t1 values ('a4', 'b4', 'c4');
insert into t1 values ('a5', 'b5', 'c5');
insert into t1 values ('a6', 'b6', 'c6');
insert into t1 values ('a7', 'b7', 'c7');
insert into t1 values ('a8', 'b8', 'c8');
insert into t1 values ('a9', 'b9', 'c9');
delete from t1 where c1 = 'a2';
insert into t1 values ('a2', 'b2', 'c2');
delete from t1 where c1 = 'a2';
insert into t1 values ('a2', 'b2', 'c2');
delete from t1 where c1 = 'a2';
insert into t1 values ('a2', 'b2', 'c2');
delete from t1 where c1 = 'a2';
insert into t1 values ('a2', 'b2', 'c2');
check table t1;
Table	Op	Msg_type	Msg_text
test.t1	check	status	OK
drop table t1;
create temporary table t1 (
i int, j int, primary key pk(i), unique index sk(j)) engine = innodb;
insert into t1 values (1, 1), (2, 2), (3, 3), (4, 4);
select * from t1;
i	j
1	1
2	2
3	3
4	4
delete from t1 where i = 2;
update t1 set i = 3, j = 4 where i = 3;
ERROR 23000: Duplicate entry '4' for key 'sk'
select * from t1;
i	j
1	1
3	3
4	4
check table t1;
Table	Op	Msg_type	Msg_text
test.t1	check	status	OK
drop table t1;
create temporary table t1 (
c1 int auto_increment primary key,
c2 varchar(1024)) engine = innodb;
insert into t1 values (1, repeat('a', 10));
create temporary table t2 like t1;
insert into t2 select * from t1;
insert into t2 select * from t1;
ERROR 23000: Duplicate entry '1' for key 'PRIMARY'
select * from t2;
c1	c2
1	aaaaaaaaaa
insert into t2 values (1, 'bbbbb') on duplicate key update c1 = 100;
select * from t2;
c1	c2
100	aaaaaaaaaa
drop table t1, t2;
# restart
set session innodb_create_intrinsic = 1;
create temporary table t1 (i int, j int, primary key pk(i)) engine = innodb;
create temporary table t2 (i int, j int, primary key pk(i)) engine = innodb;
create temporary table t3 (i int, j int, primary key pk(i)) engine = innodb;
create temporary table t4 (i int, j int, primary key pk(i)) engine = innodb;
drop table t1,t2,t3,t4;
create temporary table t1 (i int, j int, primary key pk(i)) engine = innodb;
drop table t1;
use test;
create temporary table t1
(keyc int, c1 char(100), c2 char(100),
primary key(keyc)) engine = innodb;
CREATE PROCEDURE populate_t1()
BEGIN
DECLARE i INT DEFAULT 1;
while (i <= 2000) DO
insert into t1 values (i, 'a', 'b');
SET i = i + 1;
END WHILE;
END|
begin;
call populate_t1();
commit;
select count(*) from t1;
count(*)
2000
truncate t1;
ERROR HY000: Table storage engine for 't1' doesn't have this option
delete from t1 where keyc < 1000;
select count(*) from t1;
count(*)
1001
check table t1;
Table	Op	Msg_type	Msg_text
test.t1	check	status	OK
update t1 set c1 = 'aefafdf' where keyc < 1500;
select count(*) from t1;
count(*)
1001
check table t1;
Table	Op	Msg_type	Msg_text
test.t1	check	status	OK
update t1 set c2 = '141434' where keyc < 2000;
select count(*) from t1;
count(*)
1001
check table t1;
Table	Op	Msg_type	Msg_text
test.t1	check	status	OK
delete from t1;
select count(*) from t1;
count(*)
0
check table t1;
Table	Op	Msg_type	Msg_text
test.t1	check	status	OK
alter table t1 add index sk(c1);
ERROR HY000: Table storage engine for 'InnoDB' doesn't have this option
begin;
call populate_t1();
commit;
select count(*) from t1;
count(*)
2000
truncate t1;
ERROR HY000: Table storage engine for 't1' doesn't have this option
delete from t1 where keyc < 1000;
select count(*) from t1;
count(*)
1001
check table t1;
Table	Op	Msg_type	Msg_text
test.t1	check	status	OK
update t1 set c1 = 'aefafdf' where keyc < 1500;
select count(*) from t1;
count(*)
1001
check table t1;
Table	Op	Msg_type	Msg_text
test.t1	check	status	OK
update t1 set c2 = '141434' where keyc < 2000;
select count(*) from t1;
count(*)
1001
check table t1;
Table	Op	Msg_type	Msg_text
test.t1	check	status	OK
alter table t1 add column (t char(10));
ERROR HY000: Table storage engine for 'InnoDB' doesn't have this option
select * from t1 limit 5;
keyc	c1	c2
1000	aefafdf	141434
1001	aefafdf	141434
1002	aefafdf	141434
1003	aefafdf	141434
1004	aefafdf	141434
delete from t1;
select count(*) from t1;
count(*)
0
check table t1;
Table	Op	Msg_type	Msg_text
test.t1	check	status	OK
create temporary table t2 (
id int primary key, t1_keyc int,
foreign key (t1_keyc) references t1(keyc)) engine = innodb;
ERROR HY000: Cannot add foreign key constraint
drop procedure populate_t1;
drop table t1;
Warnings:
Note	1051	Unknown table 'test.t1'
Note	1051	Unknown table 'test.t2'
Warnings:
Note	1305	FUNCTION test.func1 does not exist
Warnings:
Note	1051	Unknown table 'test.t3'
Warnings:
Note	1051	Unknown table 'test.t4'
Warnings:
Note	1051	Unknown table 'test.t5'
Warnings:
Note	1051	Unknown table 'test.t6'
Warnings:
Note	1051	Unknown table 'test.t7'
Warnings:
Note	1051	Unknown table 'test.t8'
Warnings:
Note	1051	Unknown table 'test.t9'
Note	1051	Unknown table 'test.t10'
Warnings:
Warning	1831	Duplicate index 'col_varchar_key' defined on the table 'test.t9'. This is deprecated and will be disallowed in a future release.
Warnings:
Warning	1831	Duplicate index 'col_varchar_key' defined on the table 'test.t10'. This is deprecated and will be disallowed in a future release.
Table	Op	Msg_type	Msg_text
test.t1	analyze	status	OK
test.t2	analyze	status	OK
test.t3	analyze	status	OK
test.t4	analyze	status	OK
test.t5	analyze	status	OK
test.t6	analyze	status	OK
test.t7	analyze	status	OK
test.t8	analyze	status	OK
test.t9	analyze	status	OK
test.t10	analyze	status	OK
test.t11	analyze	status	OK
test.t12	analyze	status	OK
test.t13	analyze	status	OK
test.t14	analyze	status	OK
select sql_buffer_result * from t1;
a	b
1	a
2	b
3	c
3	c
4	c
select sql_buffer_result * from t2;
a	b
2	d
3	e
4	f
4	f
5	e
select * from t1 left join t2 on t1.b = t2.b order by t1.a;
a	b	a	b
1	a	NULL	NULL
2	b	NULL	NULL
3	c	NULL	NULL
3	c	NULL	NULL
4	c	NULL	NULL
select * from t1 order by func1(a);
a	b
1	a
2	b
3	c
3	c
4	c
select a from t1 group by b order by sum(a);
a
1
2
3
select a from t7 group by b order by sum(a);
a
1
2
3
select sql_big_result distinct * from t1, t2;
a	b	a	b
1	a	2	d
2	b	2	d
3	c	2	d
4	c	2	d
1	a	3	e
2	b	3	e
3	c	3	e
4	c	3	e
1	a	4	f
2	b	4	f
3	c	4	f
4	c	4	f
1	a	5	e
2	b	5	e
3	c	5	e
4	c	5	e
select sql_big_result t1.b from t1, t2 group by t1.b;
b
a
b
c
select sql_big_result distinct t1.a from t1, t2 group by t1.b;
a
1
2
3
select t1.* from t1 inner join t2 on t1.a = t2.a order by t2.a;
a	b
2	b
3	c
3	c
4	c
4	c
select t1.* from t1, t2 where t1.a = t2.a order by t1.a;
a	b
2	b
3	c
3	c
4	c
4	c
select t1.* from t1 inner join t2 where t1.a = t2.a group by t1.a;
a	b
2	b
3	c
4	c
select t1.* from t1 inner join t2 where t1.a = t2.a group by t2.a;
a	b
2	b
3	c
4	c
select a from t1 group by a order by a;
a
1
2
3
4
select b from t1 group by b order by a;
b
a
b
c
select distinct t1.a from t1, t2 where  t1.b = t2.b;
a
select distinct a from t1 group by b,a;
a
1
2
3
4
select distinct t4.a,e from t4, t1 order by t4.b;
a	e
1	5
set big_tables = 1;
select * from t1 union all select * from t2;
a	b
1	a
2	b
3	c
3	c
4	c
2	d
3	e
4	f
4	f
5	e
select * from t1 union select * from t2 order by b;
a	b
1	a
2	b
3	c
4	c
2	d
3	e
5	e
4	f
select tt.* from (select * from t1) as tt;
a	b
1	a
2	b
3	c
3	c
4	c
select b from (select b from t5 where b > 5) tt;
b
7
8
select * from (select b from t1) as t1, (select b from t2) as t2;
b	b
a	d
b	d
c	d
c	d
c	d
a	e
b	e
c	e
c	e
c	e
a	f
b	f
c	f
c	f
c	f
a	f
b	f
c	f
c	f
c	f
a	e
b	e
c	e
c	e
c	e
select * from t1, (select * from t6) as t where t.a =5;
a	b	a	b	c	d
select * from t1 where t1.a in (select a from t2) ;
a	b
2	b
3	c
3	c
4	c
set optimizer_switch='materialization=off';
set optimizer_switch='firstmatch=off';
set optimizer_switch='loosescan=off';
select * from t1 where t1.a in (select a from t2) ;
a	b
2	b
3	c
3	c
4	c
set optimizer_switch=default;
update t1, t2 set t1.a = 9, t2.a = 10 where t1.b = 'a';
update t1, t2 set t1.a = 9, t2.a = 10 where t1.b = 'a';
select count(distinct a) from t1;
count(distinct a)
4
select b, group_concat(a) from t1;
b	group_concat(a)
b	2,3,3,4,9
select * from t1;
a	b
2	b
3	c
3	c
4	c
9	a
select b, count(a), sum(a), avg(a), std(a), min(a),
max(a), bit_and(a), bit_or(a) from t1 group by b;
b	count(a)	sum(a)	avg(a)	std(a)	min(a)	max(a)	bit_and(a)	bit_or(a)
a	1	9	9.0000	0	9	9	9	9
b	1	2	2.0000	0	2	2	2	2
c	3	10	3.3333	0.4714045207910316	3	4	0	7
select sql_big_result * from information_schema.global_variables where variable_name like 'internal_tmp_disk_storage_engine';
VARIABLE_NAME	VARIABLE_VALUE
INTERNAL_TMP_DISK_STORAGE_ENGINE	TMP_TABLE_ENGINE
select 1 union distinct select 1 union all select 1;
1
1
1
select alias1.`col_int_key` AS field1 from (t8 as alias1) where (5) in
(select 7 union select 1) order by alias1.`col_varchar_key` asc;
field1
select t from t12 group by c;
t
NULL

1
a
hello
HELLO MY
drop function func1;
drop table t1, t2, t3, t4, t5, t6, t7, t8, t9, t10, t11, t12, t13, t14;
create temporary table t1 (
a int, b int, c int,
primary key pk(a), index sk(b), index sk2(c)) engine=innodb;
insert into t1 values (1, 1, 1), (2, 2, 2), (3, 3, 3);
update t1 set c = 4 where c = 2;
update t1 set b = 6 where b = 2;
update t1 set a = 100 where a = 1;
update t1 set a = 3 where a = 2;
ERROR 23000: Duplicate entry '3' for key 'PRIMARY'
select * from t1;
a	b	c
2	6	4
3	3	3
100	1	1
begin;
insert into t1 values (4, 4, 4), (5, 5, 5);
rollback;
select * from t1;
a	b	c
2	6	4
3	3	3
4	4	4
5	5	5
100	1	1
insert into t1 values (6, 6, 6), (7, 7, 7), (100, 100, 100);
ERROR 23000: Duplicate entry '100' for key 'PRIMARY'
check table t1;
Table	Op	Msg_type	Msg_text
test.t1	check	status	OK
select * from t1;
a	b	c
2	6	4
3	3	3
4	4	4
5	5	5
6	6	6
7	7	7
100	1	1
insert into t1 values (8, 8, 8), (100, 100, 100)
on duplicate key update c = 100 + c;
select * from t1;
a	b	c
2	6	4
3	3	3
4	4	4
5	5	5
6	6	6
7	7	7
8	8	8
100	1	101
delete from t1;
insert into t1 values (8, 8, 8), (100, 100, 100)
on duplicate key update c = 100 + c;
insert into t1 values (8, 8, 8), (100, 100, 100)
on duplicate key update c = 100 + c;
check table t1;
Table	Op	Msg_type	Msg_text
test.t1	check	status	OK
select * from t1;
a	b	c
8	8	108
100	100	200
drop table t1;
create temporary table t1
(a int not null, d int not null, b varchar(198) not null, c char(179),
unique key (b(10), a, d), index (d), index(a), index (c(99), b(33)),
index (b(5), c(10), a) ) engine=InnoDB;
replace into t1 (a,d,b,c) values ('0','6','kjgclgrtfuyl','');
replace into t1 (a,d,b,c) values ('0','6','0.73611461938','0.799541829209147');
replace into t1 (a,d,b,c) values ('0','6','kjgclgrtfuyl','');
replace into t1 (a,d,b,c) values ('0','6','0.519839844','0.389471635790457');
update t1 set b = 'khFSeqh4XHukO' , d = '128869539', c = '-100141534.687515' where a = '0';
ERROR 23000: Duplicate entry 'khFSeqh4XH-0-128869539' for key 'b'
drop table t1;
use test;
create temporary table t1
(keyc int, c1 blob, c2 char(100),
primary key(keyc), index sk(c1(10)), index sk2(c2)) engine = innodb;
CREATE PROCEDURE populate_t1()
BEGIN
DECLARE i INT DEFAULT 1;
while (i <= 20) DO
insert into t1 values (i, repeat('a', 10000), 'b');
SET i = i + 1;
END WHILE;
END|
begin;
call populate_t1();
commit;
select count(*) from t1;
count(*)
20
check table t1;
Table	Op	Msg_type	Msg_text
test.t1	check	status	OK
truncate t1;
ERROR HY000: Table storage engine for 't1' doesn't have this option
delete from t1 where keyc < 10;
select count(*) from t1;
count(*)
11
check table t1;
Table	Op	Msg_type	Msg_text
test.t1	check	status	OK
update t1 set c1 = 'aefafdf' where keyc < 15;
select count(*) from t1;
count(*)
11
check table t1;
Table	Op	Msg_type	Msg_text
test.t1	check	status	OK
update t1 set c2 = '141434' where keyc < 20;
select count(*) from t1;
count(*)
11
check table t1;
Table	Op	Msg_type	Msg_text
test.t1	check	status	OK
delete from t1;
select count(*) from t1;
count(*)
0
check table t1;
Table	Op	Msg_type	Msg_text
test.t1	check	status	OK
drop procedure populate_t1;
drop table t1;
create temporary table t1 (
c1 char(255), c2 char(255), c3 char(255),
primary key pk (c1, c2, c3)) engine=innodb;
insert into t1 values ('a', 'b', 'c');
insert into t1 values ('a1', 'b1', 'c1');
insert into t1 values ('a2', 'b2', 'c2');
insert into t1 values ('a3', 'b3', 'c3');
insert into t1 values ('a4', 'b4', 'c4');
insert into t1 values ('a5', 'b5', 'c5');
insert into t1 values ('a6', 'b6', 'c6');
insert into t1 values ('a7', 'b7', 'c7');
insert into t1 values ('a8', 'b8', 'c8');
insert into t1 values ('a9', 'b9', 'c9');
delete from t1 where c1 = 'a2';
insert into t1 values ('a2', 'b2', 'c2');
delete from t1 where c1 = 'a2';
insert into t1 values ('a2', 'b2', 'c2');
delete from t1 where c1 = 'a2';
insert into t1 values ('a2', 'b2', 'c2');
delete from t1 where c1 = 'a2';
insert into t1 values ('a2', 'b2', 'c2');
check table t1;
Table	Op	Msg_type	Msg_text
test.t1	check	status	OK
drop table t1;
create temporary table t1 (
i int, j int, primary key pk(i), unique index sk(j)) engine = innodb;
insert into t1 values (1, 1), (2, 2), (3, 3), (4, 4);
select * from t1;
i	j
1	1
2	2
3	3
4	4
delete from t1 where i = 2;
update t1 set i = 3, j = 4 where i = 3;
ERROR 23000: Duplicate entry '4' for key 'sk'
select * from t1;
i	j
1	1
3	3
4	4
check table t1;
Table	Op	Msg_type	Msg_text
test.t1	check	status	OK
drop table t1;
create temporary table t1 (
c1 int auto_increment primary key,
c2 varchar(1024)) engine = innodb;
insert into t1 values (1, repeat('a', 10));
create temporary table t2 like t1;
insert into t2 select * from t1;
insert into t2 select * from t1;
ERROR 23000: Duplicate entry '1' for key 'PRIMARY'
select * from t2;
c1	c2
1	aaaaaaaaaa
insert into t2 values (1, 'bbbbb') on duplicate key update c1 = 100;
select * from t2;
c1	c2
100	aaaaaaaaaa
drop table t1, t2;
"Restarting Server with temp-tablespace auto-extension turned off"
# restart: --innodb_temp_data_file_path=ibtmp1:12M
create table t0(a serial) engine=innodb;
create temporary table t0t(a serial) engine=innodb;
begin;
insert into t0 values (),(),(),(),(),(),(),(),(),(),(),(),(),(),(),();
insert into t0 select 0 from t0;
insert into t0 select 0 from t0;
insert into t0 select 0 from t0;
insert into t0 select 0 from t0;
insert into t0 select 0 from t0;
insert into t0 select 0 from t0;
insert into t0t select 0 from t0;
update t0 set a=a+1048576;
delete from t0;
update t0t set a=a+1048576;
delete from t0t;
rollback;
select * from t0;
a
select * from t0t;
a
drop table t0,t0t;
set session innodb_create_intrinsic = 1;
create temporary table t1
(keyc int, c1 varchar(1024), c2 varchar(1024),
primary key(keyc)) engine = innodb;
CREATE PROCEDURE populate_t1()
BEGIN
DECLARE i INT DEFAULT 1;
while (i <= 2000) DO
insert into t1 values (i, repeat('a', 1000), repeat('b', 1000));
SET i = i + 1;
END WHILE;
END|
call populate_t1();
ERROR HY000: The table 't1' is full
select count(*) from t1;
count(*)
NUMBER
drop procedure populate_t1;
drop table t1;
# restart
