drop table if exists t1,t2,t3,t4;
drop database if exists mysqltest;
CREATE TABLE bug58912 (a BLOB, b TEXT, PRIMARY KEY(a(1))) ENGINE=InnoDB;
INSERT INTO bug58912 VALUES(REPEAT('a',8000),REPEAT('b',8000));
UPDATE bug58912 SET a=REPEAT('a',7999);
create table t1 (id int unsigned not null auto_increment, code tinyint unsigned not null, name char(20) not null, primary key (id), key (code), unique (name)) engine=innodb;
insert into t1 (code, name) values (1, 'Tim'), (1, 'Monty'), (2, 'David'), (2, 'Erik'), (3, 'Sasha'), (3, 'Jeremy'), (4, 'Matt');
select id, code, name from t1 order by id;
id	code	name
1	1	Tim
2	1	Monty
3	2	David
4	2	Erik
5	3	Sasha
6	3	Jeremy
7	4	Matt
update ignore t1 set id = 8, name = 'Sinisa' where id < 3;
Warnings:
Warning	1062	Duplicate entry '8' for key 't1.PRIMARY'
select id, code, name from t1 order by id;
id	code	name
2	1	Monty
3	2	David
4	2	Erik
5	3	Sasha
6	3	Jeremy
7	4	Matt
8	1	Sinisa
update ignore t1 set id = id + 10, name = 'Ralph' where id < 4;
Warnings:
Warning	1062	Duplicate entry 'Ralph' for key 't1.name'
select id, code, name from t1 order by id;
id	code	name
3	2	David
4	2	Erik
5	3	Sasha
6	3	Jeremy
7	4	Matt
8	1	Sinisa
12	1	Ralph
drop table t1;
CREATE TABLE t1 (
id int(11) NOT NULL auto_increment,
parent_id int(11) DEFAULT '0' NOT NULL,
level tinyint(4) DEFAULT '0' NOT NULL,
PRIMARY KEY (id),
KEY parent_id (parent_id),
KEY level (level)
) engine=innodb;
Warnings:
Warning	1681	Integer display width is deprecated and will be removed in a future release.
Warning	1681	Integer display width is deprecated and will be removed in a future release.
Warning	1681	Integer display width is deprecated and will be removed in a future release.
INSERT INTO t1 VALUES (1,0,0),(3,1,1),(4,1,1),(8,2,2),(9,2,2),(17,3,2),(22,4,2),(24,4,2),(28,5,2),(29,5,2),(30,5,2),(31,6,2),(32,6,2),(33,6,2),(203,7,2),(202,7,2),(20,3,2),(157,0,0),(193,5,2),(40,7,2),(2,1,1),(15,2,2),(6,1,1),(34,6,2),(35,6,2),(16,3,2),(7,1,1),(36,7,2),(18,3,2),(26,5,2),(27,5,2),(183,4,2),(38,7,2),(25,5,2),(37,7,2),(21,4,2),(19,3,2),(5,1,1),(179,5,2);
update t1 set parent_id=parent_id+100;
select * from t1 where parent_id=102;
id	parent_id	level
8	102	2
9	102	2
15	102	2
update t1 set id=id+1000;
update t1 set id=1024 where id=1009;
Got one of the listed errors
select * from t1;
id	parent_id	level
1001	100	0
1002	101	1
1003	101	1
1004	101	1
1005	101	1
1006	101	1
1007	101	1
1008	102	2
1009	102	2
1015	102	2
1016	103	2
1017	103	2
1018	103	2
1019	103	2
1020	103	2
1021	104	2
1022	104	2
1024	104	2
1025	105	2
1026	105	2
1027	105	2
1028	105	2
1029	105	2
1030	105	2
1031	106	2
1032	106	2
1033	106	2
1034	106	2
1035	106	2
1036	107	2
1037	107	2
1038	107	2
1040	107	2
1157	100	0
1179	105	2
1183	104	2
1193	105	2
1202	107	2
1203	107	2
update ignore t1 set id=id+1;
Warnings:
Warning	1062	Duplicate entry '1002' for key 't1.PRIMARY'
Warning	1062	Duplicate entry '1003' for key 't1.PRIMARY'
Warning	1062	Duplicate entry '1004' for key 't1.PRIMARY'
Warning	1062	Duplicate entry '1005' for key 't1.PRIMARY'
Warning	1062	Duplicate entry '1006' for key 't1.PRIMARY'
Warning	1062	Duplicate entry '1007' for key 't1.PRIMARY'
Warning	1062	Duplicate entry '1008' for key 't1.PRIMARY'
Warning	1062	Duplicate entry '1009' for key 't1.PRIMARY'
Warning	1062	Duplicate entry '1016' for key 't1.PRIMARY'
Warning	1062	Duplicate entry '1017' for key 't1.PRIMARY'
Warning	1062	Duplicate entry '1018' for key 't1.PRIMARY'
Warning	1062	Duplicate entry '1019' for key 't1.PRIMARY'
Warning	1062	Duplicate entry '1020' for key 't1.PRIMARY'
Warning	1062	Duplicate entry '1021' for key 't1.PRIMARY'
Warning	1062	Duplicate entry '1022' for key 't1.PRIMARY'
Warning	1062	Duplicate entry '1025' for key 't1.PRIMARY'
Warning	1062	Duplicate entry '1026' for key 't1.PRIMARY'
Warning	1062	Duplicate entry '1027' for key 't1.PRIMARY'
Warning	1062	Duplicate entry '1028' for key 't1.PRIMARY'
Warning	1062	Duplicate entry '1029' for key 't1.PRIMARY'
Warning	1062	Duplicate entry '1030' for key 't1.PRIMARY'
Warning	1062	Duplicate entry '1031' for key 't1.PRIMARY'
Warning	1062	Duplicate entry '1032' for key 't1.PRIMARY'
Warning	1062	Duplicate entry '1033' for key 't1.PRIMARY'
Warning	1062	Duplicate entry '1034' for key 't1.PRIMARY'
Warning	1062	Duplicate entry '1035' for key 't1.PRIMARY'
Warning	1062	Duplicate entry '1036' for key 't1.PRIMARY'
Warning	1062	Duplicate entry '1037' for key 't1.PRIMARY'
Warning	1062	Duplicate entry '1038' for key 't1.PRIMARY'
Warning	1062	Duplicate entry '1203' for key 't1.PRIMARY'
select * from t1;
id	parent_id	level
1001	100	0
1002	101	1
1003	101	1
1004	101	1
1005	101	1
1006	101	1
1007	101	1
1008	102	2
1010	102	2
1015	102	2
1016	103	2
1017	103	2
1018	103	2
1019	103	2
1020	103	2
1021	104	2
1023	104	2
1024	104	2
1025	105	2
1026	105	2
1027	105	2
1028	105	2
1029	105	2
1030	105	2
1031	106	2
1032	106	2
1033	106	2
1034	106	2
1035	106	2
1036	107	2
1037	107	2
1039	107	2
1041	107	2
1158	100	0
1180	105	2
1184	104	2
1194	105	2
1202	107	2
1204	107	2
update ignore t1 set id=1023 where id=1010;
Warnings:
Warning	1062	Duplicate entry '1023' for key 't1.PRIMARY'
select * from t1 where parent_id=102;
id	parent_id	level
1008	102	2
1010	102	2
1015	102	2
explain select level from t1 where level=1;
id	select_type	table	partitions	type	possible_keys	key	key_len	ref	rows	filtered	Extra
1	SIMPLE	t1	NULL	ref	level	level	1	const	#	100.00	Using index
Warnings:
Note	1003	/* select#1 */ select `test`.`t1`.`level` AS `level` from `test`.`t1` where (`test`.`t1`.`level` = 1)
explain select level,id from t1 where level=1;
id	select_type	table	partitions	type	possible_keys	key	key_len	ref	rows	filtered	Extra
1	SIMPLE	t1	NULL	ref	level	level	1	const	#	100.00	Using index
Warnings:
Note	1003	/* select#1 */ select `test`.`t1`.`level` AS `level`,`test`.`t1`.`id` AS `id` from `test`.`t1` where (`test`.`t1`.`level` = 1)
explain select level,id,parent_id from t1 where level=1;
id	select_type	table	partitions	type	possible_keys	key	key_len	ref	rows	filtered	Extra
1	SIMPLE	t1	NULL	ref	level	level	1	const	#	100.00	NULL
Warnings:
Note	1003	/* select#1 */ select `test`.`t1`.`level` AS `level`,`test`.`t1`.`id` AS `id`,`test`.`t1`.`parent_id` AS `parent_id` from `test`.`t1` where (`test`.`t1`.`level` = 1)
select level,id from t1 where level=1;
level	id
1	1002
1	1003
1	1004
1	1005
1	1006
1	1007
select level,id,parent_id from t1 where level=1;
level	id	parent_id
1	1002	101
1	1003	101
1	1004	101
1	1005	101
1	1006	101
1	1007	101
optimize table t1;
Table	Op	Msg_type	Msg_text
test.t1	optimize	note	Table does not support optimize, doing recreate + analyze instead
test.t1	optimize	status	OK
show keys from t1;
Table	Non_unique	Key_name	Seq_in_index	Column_name	Collation	Cardinality	Sub_part	Packed	Null	Index_type	Comment	Index_comment	Visible	Expression
t1	0	PRIMARY	1	id	A	#	NULL	NULL		BTREE			YES	NULL
t1	1	parent_id	1	parent_id	A	#	NULL	NULL		BTREE			YES	NULL
t1	1	level	1	level	A	#	NULL	NULL		BTREE			YES	NULL
drop table t1;
CREATE TABLE t1 (
gesuchnr int(11) DEFAULT '0' NOT NULL,
benutzer_id int(11) DEFAULT '0' NOT NULL,
PRIMARY KEY (gesuchnr,benutzer_id)
) engine=innodb;
Warnings:
Warning	1681	Integer display width is deprecated and will be removed in a future release.
Warning	1681	Integer display width is deprecated and will be removed in a future release.
replace into t1 (gesuchnr,benutzer_id) values (2,1);
replace into t1 (gesuchnr,benutzer_id) values (1,1);
replace into t1 (gesuchnr,benutzer_id) values (1,1);
select * from t1;
gesuchnr	benutzer_id
1	1
2	1
drop table t1;
create table t1 (a int) engine=innodb;
insert into t1 values (1), (2);
optimize table t1;
Table	Op	Msg_type	Msg_text
test.t1	optimize	note	Table does not support optimize, doing recreate + analyze instead
test.t1	optimize	status	OK
delete from t1 where a = 1;
select * from t1;
a
2
check table t1;
Table	Op	Msg_type	Msg_text
test.t1	check	status	OK
drop table t1;
create table t1 (a int,b varchar(20)) engine=innodb;
insert into t1 values (1,""), (2,"testing");
delete from t1 where a = 1;
select * from t1;
a	b
2	testing
create index skr on t1 (a);
insert into t1 values (3,""), (4,"testing");
analyze table t1;
Table	Op	Msg_type	Msg_text
test.t1	analyze	status	OK
show keys from t1;
Table	Non_unique	Key_name	Seq_in_index	Column_name	Collation	Cardinality	Sub_part	Packed	Null	Index_type	Comment	Index_comment	Visible	Expression
t1	1	skr	1	a	A	#	NULL	NULL	YES	BTREE			YES	NULL
drop table t1;
create table t1 (a int,b varchar(20),key(a)) engine=innodb;
insert into t1 values (1,""), (2,"testing");
select * from t1 where a = 1;
a	b
1	
drop table t1;
create table t1 (n int not null primary key) engine=innodb;
set autocommit=0;
insert into t1 values (4);
rollback;
select n, "after rollback" from t1;
n	after rollback
insert into t1 values (4);
commit;
select n, "after commit" from t1;
n	after commit
4	after commit
commit;
insert into t1 values (5);
insert into t1 values (4);
ERROR 23000: Duplicate entry '4' for key 't1.PRIMARY'
commit;
select n, "after commit" from t1;
n	after commit
4	after commit
5	after commit
set autocommit=1;
insert into t1 values (6);
insert into t1 values (4);
ERROR 23000: Duplicate entry '4' for key 't1.PRIMARY'
select n from t1;
n
4
5
6
set autocommit=0;
begin;
savepoint `my_savepoint`;
insert into t1 values (7);
savepoint `savept2`;
insert into t1 values (3);
select n from t1;
n
3
4
5
6
7
savepoint savept3;
rollback to savepoint savept2;
rollback to savepoint savept3;
ERROR 42000: SAVEPOINT savept3 does not exist
rollback to savepoint savept2;
release savepoint `my_savepoint`;
select n from t1;
n
4
5
6
7
rollback to savepoint `my_savepoint`;
ERROR 42000: SAVEPOINT my_savepoint does not exist
rollback to savepoint savept2;
ERROR 42000: SAVEPOINT savept2 does not exist
insert into t1 values (8);
savepoint sv;
commit;
savepoint sv;
set autocommit=1;
rollback;
drop table t1;
create table t1 (n int not null primary key) engine=innodb;
start transaction;
insert into t1 values (4);
flush tables with read lock;
commit;
unlock tables;
commit;
select * from t1;
n
4
drop table t1;
create table t1 ( id int NOT NULL PRIMARY KEY, nom varchar(64)) engine=innodb;
begin;
insert into t1 values(1,'hamdouni');
select id as afterbegin_id,nom as afterbegin_nom from t1;
afterbegin_id	afterbegin_nom
1	hamdouni
rollback;
select id as afterrollback_id,nom as afterrollback_nom from t1;
afterrollback_id	afterrollback_nom
set autocommit=0;
insert into t1 values(2,'mysql');
select id as afterautocommit0_id,nom as afterautocommit0_nom from t1;
afterautocommit0_id	afterautocommit0_nom
2	mysql
rollback;
select id as afterrollback_id,nom as afterrollback_nom from t1;
afterrollback_id	afterrollback_nom
set autocommit=1;
drop table t1;
CREATE TABLE t1 (id char(8) not null primary key, val int not null) engine=innodb;
insert into t1 values ('pippo', 12);
insert into t1 values ('pippo', 12);
ERROR 23000: Duplicate entry 'pippo' for key 't1.PRIMARY'
delete from t1;
delete from t1 where id = 'pippo';
select * from t1;
id	val
insert into t1 values ('pippo', 12);
set autocommit=0;
delete from t1;
rollback;
select * from t1;
id	val
pippo	12
delete from t1;
commit;
select * from t1;
id	val
drop table t1;
create table t1 (a integer) engine=innodb;
start transaction;
rename table t1 to t2;
create table t1 (b integer) engine=innodb;
insert into t1 values (1);
rollback;
drop table t1;
rename table t2 to t1;
drop table t1;
set autocommit=1;
CREATE TABLE t1 (ID INTEGER NOT NULL PRIMARY KEY, NAME VARCHAR(64)) ENGINE=innodb;
INSERT INTO t1 VALUES (1, 'Jochen');
select * from t1;
ID	NAME
1	Jochen
drop table t1;
CREATE TABLE t1 ( _userid VARCHAR(60) NOT NULL PRIMARY KEY) ENGINE=innodb;
set autocommit=0;
INSERT INTO t1  SET _userid='marc@anyware.co.uk';
COMMIT;
SELECT * FROM t1;
_userid
marc@anyware.co.uk
SELECT _userid FROM t1 WHERE _userid='marc@anyware.co.uk';
_userid
marc@anyware.co.uk
drop table t1;
set autocommit=1;
CREATE TABLE t1 (
user_id int(10) DEFAULT '0' NOT NULL,
name varchar(100),
phone varchar(100),
ref_email varchar(100) DEFAULT '' NOT NULL,
detail varchar(200),
PRIMARY KEY (user_id,ref_email)
)engine=innodb;
Warnings:
Warning	1681	Integer display width is deprecated and will be removed in a future release.
INSERT INTO t1 VALUES (10292,'sanjeev','29153373','sansh777@hotmail.com','xxx'),(10292,'shirish','2333604','shirish@yahoo.com','ddsds'),(10292,'sonali','323232','sonali@bolly.com','filmstar');
select * from t1 where user_id=10292;
user_id	name	phone	ref_email	detail
10292	sanjeev	29153373	sansh777@hotmail.com	xxx
10292	shirish	2333604	shirish@yahoo.com	ddsds
10292	sonali	323232	sonali@bolly.com	filmstar
INSERT INTO t1 VALUES (10291,'sanjeev','29153373','sansh777@hotmail.com','xxx'),(10293,'shirish','2333604','shirish@yahoo.com','ddsds');
select * from t1 where user_id=10292;
user_id	name	phone	ref_email	detail
10292	sanjeev	29153373	sansh777@hotmail.com	xxx
10292	shirish	2333604	shirish@yahoo.com	ddsds
10292	sonali	323232	sonali@bolly.com	filmstar
select * from t1 where user_id>=10292;
user_id	name	phone	ref_email	detail
10292	sanjeev	29153373	sansh777@hotmail.com	xxx
10292	shirish	2333604	shirish@yahoo.com	ddsds
10292	sonali	323232	sonali@bolly.com	filmstar
10293	shirish	2333604	shirish@yahoo.com	ddsds
select * from t1 where user_id>10292;
user_id	name	phone	ref_email	detail
10293	shirish	2333604	shirish@yahoo.com	ddsds
select * from t1 where user_id<10292;
user_id	name	phone	ref_email	detail
10291	sanjeev	29153373	sansh777@hotmail.com	xxx
drop table t1;
CREATE TABLE t1 (a int not null, b int not null,c int not null,
key(a),primary key(a,b), unique(c),key(a),unique(b));
Warnings:
Warning	1831	Duplicate index 'a_2' defined on the table 'test.t1'. This is deprecated and will be disallowed in a future release.
show index from t1;
Table	Non_unique	Key_name	Seq_in_index	Column_name	Collation	Cardinality	Sub_part	Packed	Null	Index_type	Comment	Index_comment	Visible	Expression
t1	0	PRIMARY	1	a	A	#	NULL	NULL		BTREE			YES	NULL
t1	0	PRIMARY	2	b	A	#	NULL	NULL		BTREE			YES	NULL
t1	0	c	1	c	A	#	NULL	NULL		BTREE			YES	NULL
t1	0	b	1	b	A	#	NULL	NULL		BTREE			YES	NULL
t1	1	a	1	a	A	#	NULL	NULL		BTREE			YES	NULL
t1	1	a_2	1	a	A	#	NULL	NULL		BTREE			YES	NULL
drop table t1;
create table t1 (col1 int not null, col2 char(4) not null, primary key(col1));
alter table t1 engine=innodb;
insert into t1 values ('1','1'),('5','2'),('2','3'),('3','4'),('4','4');
select * from t1;
col1	col2
1	1
2	3
3	4
4	4
5	2
update t1 set col2='7' where col1='4';
select * from t1;
col1	col2
1	1
2	3
3	4
4	7
5	2
alter table t1 add co3 int not null;
select * from t1;
col1	col2	co3
1	1	0
2	3	0
3	4	0
4	7	0
5	2	0
update t1 set col2='9' where col1='2';
select * from t1;
col1	col2	co3
1	1	0
2	9	0
3	4	0
4	7	0
5	2	0
drop table t1;
create table t1 (a int not null , b int, primary key (a)) engine = innodb;
create table t2 (a int not null , b int, primary key (a)) engine = myisam;
insert into t1 VALUES (1,3) , (2,3), (3,3);
select * from t1;
a	b
1	3
2	3
3	3
insert into t2 select * from t1;
select * from t2;
a	b
1	3
2	3
3	3
delete from t1 where b = 3;
select * from t1;
a	b
insert into t1 select * from t2;
select * from t1;
a	b
1	3
2	3
3	3
select * from t2;
a	b
1	3
2	3
3	3
drop table t1,t2;
CREATE TABLE t1 (
user_name varchar(12),
password text,
subscribed char(1),
user_id int(11) DEFAULT '0' NOT NULL,
quota bigint(20),
weight double,
access_date date,
access_time time,
approved datetime,
dummy_primary_key int(11) NOT NULL auto_increment,
PRIMARY KEY (dummy_primary_key)
) ENGINE=innodb;
Warnings:
Warning	1681	Integer display width is deprecated and will be removed in a future release.
Warning	1681	Integer display width is deprecated and will be removed in a future release.
Warning	1681	Integer display width is deprecated and will be removed in a future release.
INSERT INTO t1 VALUES ('user_0','somepassword','N',0,0,0,'2000-09-07','23:06:59','2000-09-07 23:06:59',1);
INSERT INTO t1 VALUES ('user_1','somepassword','Y',1,1,1,'2000-09-07','23:06:59','2000-09-07 23:06:59',2);
INSERT INTO t1 VALUES ('user_2','somepassword','N',2,2,1.4142135623731,'2000-09-07','23:06:59','2000-09-07 23:06:59',3);
INSERT INTO t1 VALUES ('user_3','somepassword','Y',3,3,1.7320508075689,'2000-09-07','23:06:59','2000-09-07 23:06:59',4);
INSERT INTO t1 VALUES ('user_4','somepassword','N',4,4,2,'2000-09-07','23:06:59','2000-09-07 23:06:59',5);
select  user_name, password , subscribed, user_id, quota, weight, access_date, access_time, approved, dummy_primary_key from t1 order by user_name;
user_name	password	subscribed	user_id	quota	weight	access_date	access_time	approved	dummy_primary_key
user_0	somepassword	N	0	0	0	2000-09-07	23:06:59	2000-09-07 23:06:59	1
user_1	somepassword	Y	1	1	1	2000-09-07	23:06:59	2000-09-07 23:06:59	2
user_2	somepassword	N	2	2	1.4142135623731	2000-09-07	23:06:59	2000-09-07 23:06:59	3
user_3	somepassword	Y	3	3	1.7320508075689	2000-09-07	23:06:59	2000-09-07 23:06:59	4
user_4	somepassword	N	4	4	2	2000-09-07	23:06:59	2000-09-07 23:06:59	5
drop table t1;
CREATE TABLE t1 (
id int(11) NOT NULL auto_increment,
parent_id int(11) DEFAULT '0' NOT NULL,
level tinyint(4) DEFAULT '0' NOT NULL,
KEY (id),
KEY parent_id (parent_id),
KEY level (level)
) engine=innodb;
Warnings:
Warning	1681	Integer display width is deprecated and will be removed in a future release.
Warning	1681	Integer display width is deprecated and will be removed in a future release.
Warning	1681	Integer display width is deprecated and will be removed in a future release.
INSERT INTO t1 VALUES (1,0,0),(3,1,1),(4,1,1),(8,2,2),(9,2,2),(17,3,2),(22,4,2),(24,4,2),(28,5,2),(29,5,2),(30,5,2),(31,6,2),(32,6,2),(33,6,2),(203,7,2),(202,7,2),(20,3,2),(157,0,0),(193,5,2),(40,7,2),(2,1,1),(15,2,2),(6,1,1),(34,6,2),(35,6,2),(16,3,2),(7,1,1),(36,7,2),(18,3,2),(26,5,2),(27,5,2),(183,4,2),(38,7,2),(25,5,2),(37,7,2),(21,4,2),(19,3,2),(5,1,1);
INSERT INTO t1 values (179,5,2);
update t1 set parent_id=parent_id+100;
select * from t1 where parent_id=102;
id	parent_id	level
8	102	2
9	102	2
15	102	2
update t1 set id=id+1000;
update t1 set id=1024 where id=1009;
select * from t1;
id	parent_id	level
1001	100	0
1002	101	1
1003	101	1
1004	101	1
1005	101	1
1006	101	1
1007	101	1
1008	102	2
1015	102	2
1016	103	2
1017	103	2
1018	103	2
1019	103	2
1020	103	2
1021	104	2
1022	104	2
1024	102	2
1024	104	2
1025	105	2
1026	105	2
1027	105	2
1028	105	2
1029	105	2
1030	105	2
1031	106	2
1032	106	2
1033	106	2
1034	106	2
1035	106	2
1036	107	2
1037	107	2
1038	107	2
1040	107	2
1157	100	0
1179	105	2
1183	104	2
1193	105	2
1202	107	2
1203	107	2
update ignore t1 set id=id+1;
select * from t1;
id	parent_id	level
1002	100	0
1003	101	1
1004	101	1
1005	101	1
1006	101	1
1007	101	1
1008	101	1
1009	102	2
1016	102	2
1017	103	2
1018	103	2
1019	103	2
1020	103	2
1021	103	2
1022	104	2
1023	104	2
1025	102	2
1025	104	2
1026	105	2
1027	105	2
1028	105	2
1029	105	2
1030	105	2
1031	105	2
1032	106	2
1033	106	2
1034	106	2
1035	106	2
1036	106	2
1037	107	2
1038	107	2
1039	107	2
1041	107	2
1158	100	0
1180	105	2
1184	104	2
1194	105	2
1203	107	2
1204	107	2
update ignore t1 set id=1023 where id=1010;
select * from t1 where parent_id=102;
id	parent_id	level
1009	102	2
1025	102	2
1016	102	2
explain select level from t1 where level=1;
id	select_type	table	partitions	type	possible_keys	key	key_len	ref	rows	filtered	Extra
1	SIMPLE	t1	NULL	ref	level	level	1	const	#	100.00	Using index
Warnings:
Note	1003	/* select#1 */ select `test`.`t1`.`level` AS `level` from `test`.`t1` where (`test`.`t1`.`level` = 1)
select level,id from t1 where level=1;
level	id
1	1003
1	1004
1	1005
1	1006
1	1007
1	1008
select level,id,parent_id from t1 where level=1;
level	id	parent_id
1	1003	101
1	1004	101
1	1005	101
1	1006	101
1	1007	101
1	1008	101
select level,id from t1 where level=1 order by id;
level	id
1	1003
1	1004
1	1005
1	1006
1	1007
1	1008
delete from t1 where level=1;
select * from t1;
id	parent_id	level
1002	100	0
1009	102	2
1016	102	2
1017	103	2
1018	103	2
1019	103	2
1020	103	2
1021	103	2
1022	104	2
1023	104	2
1025	102	2
1025	104	2
1026	105	2
1027	105	2
1028	105	2
1029	105	2
1030	105	2
1031	105	2
1032	106	2
1033	106	2
1034	106	2
1035	106	2
1036	106	2
1037	107	2
1038	107	2
1039	107	2
1041	107	2
1158	100	0
1180	105	2
1184	104	2
1194	105	2
1203	107	2
1204	107	2
drop table t1;
CREATE TABLE t1 (
sca_code char(6) NOT NULL,
cat_code char(6) NOT NULL,
sca_desc varchar(50),
lan_code char(2) NOT NULL,
sca_pic varchar(100),
sca_sdesc varchar(50),
sca_sch_desc varchar(16),
PRIMARY KEY (sca_code, cat_code, lan_code),
INDEX sca_pic (sca_pic)
) engine = innodb ;
INSERT INTO t1 ( sca_code, cat_code, sca_desc, lan_code, sca_pic, sca_sdesc, sca_sch_desc) VALUES ( 'PD', 'J', 'PENDANT', 'EN', NULL, NULL, 'PENDANT'),( 'RI', 'J', 'RING', 'EN', NULL, NULL, 'RING'),( 'QQ', 'N', 'RING', 'EN', 'not null', NULL, 'RING');
select count(*) from t1 where sca_code = 'PD';
count(*)
1
select count(*) from t1 where sca_code <= 'PD';
count(*)
1
select count(*) from t1 where sca_pic is null;
count(*)
2
alter table t1 drop index sca_pic, add index sca_pic (cat_code, sca_pic);
select count(*) from t1 where sca_code='PD' and sca_pic is null;
count(*)
1
select count(*) from t1 where cat_code='E';
count(*)
0
alter table t1 drop index sca_pic, add index (sca_pic, cat_code);
select count(*) from t1 where sca_code='PD' and sca_pic is null;
count(*)
1
select count(*) from t1 where sca_pic >= 'n';
count(*)
1
select sca_pic from t1 where sca_pic is null;
sca_pic
NULL
NULL
update t1 set sca_pic="test" where sca_pic is null;
delete from t1 where sca_code='pd';
drop table t1;
set @a:=now();
CREATE TABLE t1 (a int not null, b timestamp not null default
current_timestamp on update current_timestamp, primary key (a)) engine=innodb;
insert into t1 (a) values(1),(2),(3);
select t1.a from t1 natural join t1 as t2 where t1.b >= @a order by t1.a;
a
1
2
3
select a from t1 natural join t1 as t2 where b >= @a order by a;
a
1
2
3
update t1 set a=5 where a=1;
select a from t1;
a
2
3
5
drop table t1;
create table t1 (a varchar(100) not null, primary key(a), b int not null) engine=innodb;
insert into t1 values("hello",1),("world",2);
select * from t1 order by b desc;
a	b
world	2
hello	1
optimize table t1;
Table	Op	Msg_type	Msg_text
test.t1	optimize	note	Table does not support optimize, doing recreate + analyze instead
test.t1	optimize	status	OK
show keys from t1;
Table	Non_unique	Key_name	Seq_in_index	Column_name	Collation	Cardinality	Sub_part	Packed	Null	Index_type	Comment	Index_comment	Visible	Expression
t1	0	PRIMARY	1	a	A	#	NULL	NULL		BTREE			YES	NULL
drop table t1;
create table t1 (i int, j int ) ENGINE=innodb;
insert into t1 values (1,2);
select * from t1 where i=1 and j=2;
i	j
1	2
create index ax1 on t1 (i,j);
select * from t1 where i=1 and j=2;
i	j
1	2
drop table t1;
CREATE TABLE t1 (
a int3 unsigned NOT NULL,
b int1 unsigned NOT NULL,
UNIQUE (a, b)
) ENGINE = innodb;
INSERT INTO t1 VALUES (1, 1);
SELECT MIN(B),MAX(b) FROM t1 WHERE t1.a = 1;
MIN(B)	MAX(b)
1	1
drop table t1;
create table t1 (a int  primary key,b int, c int, d int, e int, f int, g int, h int, i int, j int, k int, l int, m int, n int, o int, p int, q int, r int, s int, t int, u int, v int, w int, x int, y int, z int, a1 int, a2 int, a3 int, a4 int, a5 int, a6 int, a7 int, a8 int, a9 int, b1 int, b2 int, b3 int, b4 int, b5 int, b6 int) engine = innodb;
insert into t1 values (1,1,1,1,1,1,1,1,1,1,1,1,1,1,1,1,1,1,1,1,1,1,1,1,1,1,1,1,1,1,1,1,1,1,1,1,1,1,1,1,1);
explain select * from t1 where a > 0 and a < 50;
id	select_type	table	partitions	type	possible_keys	key	key_len	ref	rows	filtered	Extra
1	SIMPLE	t1	NULL	range	PRIMARY	PRIMARY	4	NULL	#	100.00	Using where
Warnings:
Note	1003	/* select#1 */ select `test`.`t1`.`a` AS `a`,`test`.`t1`.`b` AS `b`,`test`.`t1`.`c` AS `c`,`test`.`t1`.`d` AS `d`,`test`.`t1`.`e` AS `e`,`test`.`t1`.`f` AS `f`,`test`.`t1`.`g` AS `g`,`test`.`t1`.`h` AS `h`,`test`.`t1`.`i` AS `i`,`test`.`t1`.`j` AS `j`,`test`.`t1`.`k` AS `k`,`test`.`t1`.`l` AS `l`,`test`.`t1`.`m` AS `m`,`test`.`t1`.`n` AS `n`,`test`.`t1`.`o` AS `o`,`test`.`t1`.`p` AS `p`,`test`.`t1`.`q` AS `q`,`test`.`t1`.`r` AS `r`,`test`.`t1`.`s` AS `s`,`test`.`t1`.`t` AS `t`,`test`.`t1`.`u` AS `u`,`test`.`t1`.`v` AS `v`,`test`.`t1`.`w` AS `w`,`test`.`t1`.`x` AS `x`,`test`.`t1`.`y` AS `y`,`test`.`t1`.`z` AS `z`,`test`.`t1`.`a1` AS `a1`,`test`.`t1`.`a2` AS `a2`,`test`.`t1`.`a3` AS `a3`,`test`.`t1`.`a4` AS `a4`,`test`.`t1`.`a5` AS `a5`,`test`.`t1`.`a6` AS `a6`,`test`.`t1`.`a7` AS `a7`,`test`.`t1`.`a8` AS `a8`,`test`.`t1`.`a9` AS `a9`,`test`.`t1`.`b1` AS `b1`,`test`.`t1`.`b2` AS `b2`,`test`.`t1`.`b3` AS `b3`,`test`.`t1`.`b4` AS `b4`,`test`.`t1`.`b5` AS `b5`,`test`.`t1`.`b6` AS `b6` from `test`.`t1` where ((`test`.`t1`.`a` > 0) and (`test`.`t1`.`a` < 50))
drop table t1;
create table t1 (id int NOT NULL,id2 int NOT NULL,id3 int NOT NULL,dummy1 char(30),primary key (id,id2),index index_id3 (id3)) engine=innodb;
insert into t1 values (0,0,0,'ABCDEFGHIJ'),(2,2,2,'BCDEFGHIJK'),(1,1,1,'CDEFGHIJKL');
LOCK TABLES t1 WRITE;
insert into t1 values (99,1,2,'D'),(1,1,2,'D');
ERROR 23000: Duplicate entry '1-1' for key 't1.PRIMARY'
select id from t1;
id
0
1
2
select id from t1;
id
0
1
2
UNLOCK TABLES;
DROP TABLE t1;
create table t1 (id int NOT NULL,id2 int NOT NULL,id3 int NOT NULL,dummy1 char(30),primary key (id,id2),index index_id3 (id3)) engine=innodb;
insert into t1 values (0,0,0,'ABCDEFGHIJ'),(2,2,2,'BCDEFGHIJK'),(1,1,1,'CDEFGHIJKL');
LOCK TABLES t1 WRITE;
begin;
insert into t1 values (99,1,2,'D'),(1,1,2,'D');
ERROR 23000: Duplicate entry '1-1' for key 't1.PRIMARY'
select id from t1;
id
0
1
2
insert ignore into t1 values (100,1,2,'D'),(1,1,99,'D');
Warnings:
Warning	1062	Duplicate entry '1-1' for key 't1.PRIMARY'
commit;
select id,id3 from t1;
id	id3
0	0
1	1
2	2
100	2
UNLOCK TABLES;
DROP TABLE t1;
create table t1 (a char(20), unique (a(5))) engine=innodb;
drop table t1;
create table t1 (a char(20), index (a(5))) engine=innodb;
show create table t1;
Table	Create Table
t1	CREATE TABLE `t1` (
  `a` char(20) DEFAULT NULL,
  KEY `a` (`a`(5))
) ENGINE=InnoDB DEFAULT CHARSET=utf8mb4 COLLATE=utf8mb4_0900_ai_ci
drop table t1;
create temporary table t1 (a int not null auto_increment, primary key(a)) engine=innodb;
insert into t1 values (NULL),(NULL),(NULL);
delete from t1 where a=3;
insert into t1 values (NULL);
select * from t1;
a
1
2
4
alter table t1 add b int;
select * from t1;
a	b
1	NULL
2	NULL
4	NULL
drop table t1;
create table t1
(
id int auto_increment primary key,
name varchar(32) not null,
value text not null,
uid int not null,
unique key(name,uid)
) engine=innodb;
insert into t1 values (1,'one','one value',101),
(2,'two','two value',102),(3,'three','three value',103);
set insert_id=5;
replace into t1 (value,name,uid) values ('other value','two',102);
delete from t1 where uid=102;
set insert_id=5;
replace into t1 (value,name,uid) values ('other value','two',102);
set insert_id=6;
replace into t1 (value,name,uid) values ('other value','two',102);
select * from t1;
id	name	value	uid
1	one	one value	101
3	three	three value	103
6	two	other value	102
drop table t1;
create database mysqltest;
create table mysqltest.t1 (a int not null) engine= innodb;
insert into mysqltest.t1 values(1);
create table mysqltest.t2 (a int not null) engine= myisam;
insert into mysqltest.t2 values(1);
create table mysqltest.t3 (a int not null) engine= heap;
insert into mysqltest.t3 values(1);
commit;
drop database mysqltest;
show tables from mysqltest;
ERROR 42000: Unknown database 'mysqltest'
set autocommit=0;
create table t1 (a int not null) engine= innodb;
insert into t1 values(1),(2);
truncate table t1;
commit;
truncate table t1;
truncate table t1;
select * from t1;
a
insert into t1 values(1),(2);
delete from t1;
select * from t1;
a
commit;
drop table t1;
set autocommit=1;
create table t1 (a int not null) engine= innodb;
insert into t1 values(1),(2);
truncate table t1;
insert into t1 values(1),(2);
select * from t1;
a
1
2
truncate table t1;
insert into t1 values(1),(2);
delete from t1;
select * from t1;
a
drop table t1;
create table t1 (a int not null, b int not null, c int not null, primary key (a),key(b)) engine=innodb;
insert into t1 values (3,3,3),(1,1,1),(2,2,2),(4,4,4);
explain select * from t1 order by a;
id	select_type	table	partitions	type	possible_keys	key	key_len	ref	rows	filtered	Extra
1	SIMPLE	t1	NULL	index	NULL	PRIMARY	4	NULL	#	100.00	NULL
Warnings:
Note	1003	/* select#1 */ select `test`.`t1`.`a` AS `a`,`test`.`t1`.`b` AS `b`,`test`.`t1`.`c` AS `c` from `test`.`t1` order by `test`.`t1`.`a`
explain select * from t1 order by b;
id	select_type	table	partitions	type	possible_keys	key	key_len	ref	rows	filtered	Extra
1	SIMPLE	t1	NULL	ALL	NULL	NULL	NULL	NULL	#	100.00	Using filesort
Warnings:
Note	1003	/* select#1 */ select `test`.`t1`.`a` AS `a`,`test`.`t1`.`b` AS `b`,`test`.`t1`.`c` AS `c` from `test`.`t1` order by `test`.`t1`.`b`
explain select * from t1 order by c;
id	select_type	table	partitions	type	possible_keys	key	key_len	ref	rows	filtered	Extra
1	SIMPLE	t1	NULL	ALL	NULL	NULL	NULL	NULL	#	100.00	Using filesort
Warnings:
Note	1003	/* select#1 */ select `test`.`t1`.`a` AS `a`,`test`.`t1`.`b` AS `b`,`test`.`t1`.`c` AS `c` from `test`.`t1` order by `test`.`t1`.`c`
explain select a from t1 order by a;
id	select_type	table	partitions	type	possible_keys	key	key_len	ref	rows	filtered	Extra
1	SIMPLE	t1	NULL	index	NULL	PRIMARY	4	NULL	#	100.00	Using index
Warnings:
Note	1003	/* select#1 */ select `test`.`t1`.`a` AS `a` from `test`.`t1` order by `test`.`t1`.`a`
explain select b from t1 order by b;
id	select_type	table	partitions	type	possible_keys	key	key_len	ref	rows	filtered	Extra
1	SIMPLE	t1	NULL	index	NULL	b	4	NULL	#	100.00	Using index
Warnings:
Note	1003	/* select#1 */ select `test`.`t1`.`b` AS `b` from `test`.`t1` order by `test`.`t1`.`b`
explain select a,b from t1 order by b;
id	select_type	table	partitions	type	possible_keys	key	key_len	ref	rows	filtered	Extra
1	SIMPLE	t1	NULL	index	NULL	b	4	NULL	#	100.00	Using index
Warnings:
Note	1003	/* select#1 */ select `test`.`t1`.`a` AS `a`,`test`.`t1`.`b` AS `b` from `test`.`t1` order by `test`.`t1`.`b`
explain select a,b from t1;
id	select_type	table	partitions	type	possible_keys	key	key_len	ref	rows	filtered	Extra
1	SIMPLE	t1	NULL	index	NULL	b	4	NULL	#	100.00	Using index
Warnings:
Note	1003	/* select#1 */ select `test`.`t1`.`a` AS `a`,`test`.`t1`.`b` AS `b` from `test`.`t1`
explain select a,b,c from t1;
id	select_type	table	partitions	type	possible_keys	key	key_len	ref	rows	filtered	Extra
1	SIMPLE	t1	NULL	ALL	NULL	NULL	NULL	NULL	#	100.00	NULL
Warnings:
Note	1003	/* select#1 */ select `test`.`t1`.`a` AS `a`,`test`.`t1`.`b` AS `b`,`test`.`t1`.`c` AS `c` from `test`.`t1`
drop table t1;
create table t1 (t int not null default 1, key (t)) engine=innodb;
desc t1;
Field	Type	Null	Key	Default	Extra
t	int	NO	MUL	1	
drop table t1;
SET sql_mode = 'NO_ENGINE_SUBSTITUTION';
CREATE TABLE t1 (
number bigint(20) NOT NULL default '0',
cname char(15) NOT NULL default '',
carrier_id smallint(6) NOT NULL default '0',
privacy tinyint(4) NOT NULL default '0',
last_mod_date timestamp NOT NULL,
last_mod_id smallint(6) NOT NULL default '0',
last_app_date timestamp NOT NULL,
last_app_id smallint(6) default '-1',
version smallint(6) NOT NULL default '0',
assigned_scps int(11) default '0',
status tinyint(4) default '0'
) ENGINE=InnoDB;
Warnings:
Warning	1681	Integer display width is deprecated and will be removed in a future release.
Warning	1681	Integer display width is deprecated and will be removed in a future release.
Warning	1681	Integer display width is deprecated and will be removed in a future release.
Warning	1681	Integer display width is deprecated and will be removed in a future release.
Warning	1681	Integer display width is deprecated and will be removed in a future release.
Warning	1681	Integer display width is deprecated and will be removed in a future release.
Warning	1681	Integer display width is deprecated and will be removed in a future release.
Warning	1681	Integer display width is deprecated and will be removed in a future release.
INSERT INTO t1 VALUES (4077711111,'SeanWheeler',90,2,20020111112846,500,00000000000000,-1,2,3,1);
INSERT INTO t1 VALUES (9197722223,'berry',90,3,20020111112809,500,20020102114532,501,4,10,0);
INSERT INTO t1 VALUES (650,'San Francisco',0,0,20011227111336,342,00000000000000,-1,1,24,1);
INSERT INTO t1 VALUES (302467,'Sue\'s Subshop',90,3,20020109113241,500,20020102115111,501,7,24,0);
INSERT INTO t1 VALUES (6014911113,'SudzCarwash',520,1,20020102115234,500,20020102115259,501,33,32768,0);
INSERT INTO t1 VALUES (333,'tubs',99,2,20020109113440,501,20020109113440,500,3,10,0);
CREATE TABLE t2 (
number bigint(20) NOT NULL default '0',
cname char(15) NOT NULL default '',
carrier_id smallint(6) NOT NULL default '0',
privacy tinyint(4) NOT NULL default '0',
last_mod_date timestamp NOT NULL,
last_mod_id smallint(6) NOT NULL default '0',
last_app_date timestamp NOT NULL,
last_app_id smallint(6) default '-1',
version smallint(6) NOT NULL default '0',
assigned_scps int(11) default '0',
status tinyint(4) default '0'
) ENGINE=InnoDB;
Warnings:
Warning	1681	Integer display width is deprecated and will be removed in a future release.
Warning	1681	Integer display width is deprecated and will be removed in a future release.
Warning	1681	Integer display width is deprecated and will be removed in a future release.
Warning	1681	Integer display width is deprecated and will be removed in a future release.
Warning	1681	Integer display width is deprecated and will be removed in a future release.
Warning	1681	Integer display width is deprecated and will be removed in a future release.
Warning	1681	Integer display width is deprecated and will be removed in a future release.
Warning	1681	Integer display width is deprecated and will be removed in a future release.
INSERT INTO t2 VALUES (4077711111,'SeanWheeler',0,2,20020111112853,500,00000000000000,-1,2,3,1);
INSERT INTO t2 VALUES (9197722223,'berry',90,3,20020111112818,500,20020102114532,501,4,10,0);
INSERT INTO t2 VALUES (650,'San Francisco',90,0,20020109113158,342,00000000000000,-1,1,24,1);
INSERT INTO t2 VALUES (333,'tubs',99,2,20020109113453,501,20020109113453,500,3,10,0);
select * from t1;
number	cname	carrier_id	privacy	last_mod_date	last_mod_id	last_app_date	last_app_id	version	assigned_scps	status
302467	Sue's Subshop	90	3	2002-01-09 11:32:41	500	2002-01-02 11:51:11	501	7	24	0
333	tubs	99	2	2002-01-09 11:34:40	501	2002-01-09 11:34:40	500	3	10	0
4077711111	SeanWheeler	90	2	2002-01-11 11:28:46	500	0000-00-00 00:00:00	-1	2	3	1
6014911113	SudzCarwash	520	1	2002-01-02 11:52:34	500	2002-01-02 11:52:59	501	33	32768	0
650	San Francisco	0	0	2001-12-27 11:13:36	342	0000-00-00 00:00:00	-1	1	24	1
9197722223	berry	90	3	2002-01-11 11:28:09	500	2002-01-02 11:45:32	501	4	10	0
select * from t2;
number	cname	carrier_id	privacy	last_mod_date	last_mod_id	last_app_date	last_app_id	version	assigned_scps	status
333	tubs	99	2	2002-01-09 11:34:53	501	2002-01-09 11:34:53	500	3	10	0
4077711111	SeanWheeler	0	2	2002-01-11 11:28:53	500	0000-00-00 00:00:00	-1	2	3	1
650	San Francisco	90	0	2002-01-09 11:31:58	342	0000-00-00 00:00:00	-1	1	24	1
9197722223	berry	90	3	2002-01-11 11:28:18	500	2002-01-02 11:45:32	501	4	10	0
delete t1, t2 from t1 left join t2 on t1.number=t2.number where (t1.carrier_id=90 and t1.number=t2.number) or (t2.carrier_id=90 and t1.number=t2.number) or  (t1.carrier_id=90 and t2.number is null);
select * from t1;
number	cname	carrier_id	privacy	last_mod_date	last_mod_id	last_app_date	last_app_id	version	assigned_scps	status
6014911113	SudzCarwash	520	1	2002-01-02 11:52:34	500	2002-01-02 11:52:59	501	33	32768	0
333	tubs	99	2	2002-01-09 11:34:40	501	2002-01-09 11:34:40	500	3	10	0
select * from t2;
number	cname	carrier_id	privacy	last_mod_date	last_mod_id	last_app_date	last_app_id	version	assigned_scps	status
333	tubs	99	2	2002-01-09 11:34:53	501	2002-01-09 11:34:53	500	3	10	0
select * from t2;
number	cname	carrier_id	privacy	last_mod_date	last_mod_id	last_app_date	last_app_id	version	assigned_scps	status
333	tubs	99	2	2002-01-09 11:34:53	501	2002-01-09 11:34:53	500	3	10	0
drop table t1,t2;
SET sql_mode = default;
create table t1 (id int unsigned not null auto_increment, code tinyint unsigned not null, name char(20) not null, primary key (id), key (code), unique (name)) engine=innodb;
BEGIN;
SET SESSION TRANSACTION ISOLATION LEVEL SERIALIZABLE;
SELECT @@transaction_isolation,@@global.transaction_isolation;
@@transaction_isolation	@@global.transaction_isolation
SERIALIZABLE	REPEATABLE-READ
insert into t1 (code, name) values (1, 'Tim'), (1, 'Monty'), (2, 'David');
select id, code, name from t1 order by id;
id	code	name
1	1	Tim
2	1	Monty
3	2	David
COMMIT;
BEGIN;
SET SESSION TRANSACTION ISOLATION LEVEL REPEATABLE READ;
insert into t1 (code, name) values (2, 'Erik'), (3, 'Sasha');
select id, code, name from t1 order by id;
id	code	name
1	1	Tim
2	1	Monty
3	2	David
4	2	Erik
5	3	Sasha
COMMIT;
SET binlog_format='MIXED';
Warnings:
Warning	1287	'@@binlog_format' is deprecated and will be removed in a future release.
BEGIN;
SET SESSION TRANSACTION ISOLATION LEVEL READ UNCOMMITTED;
insert into t1 (code, name) values (3, 'Jeremy'), (4, 'Matt');
select id, code, name from t1 order by id;
id	code	name
1	1	Tim
2	1	Monty
3	2	David
4	2	Erik
5	3	Sasha
6	3	Jeremy
7	4	Matt
COMMIT;
DROP TABLE t1;
create table t1 (n int(10), d int(10)) engine=innodb;
Warnings:
Warning	1681	Integer display width is deprecated and will be removed in a future release.
Warning	1681	Integer display width is deprecated and will be removed in a future release.
create table t2 (n int(10), d int(10)) engine=innodb;
Warnings:
Warning	1681	Integer display width is deprecated and will be removed in a future release.
Warning	1681	Integer display width is deprecated and will be removed in a future release.
insert into t1 values(1,1),(1,2);
insert into t2 values(1,10),(2,20);
UPDATE t1,t2 SET t1.d=t2.d,t2.d=30 WHERE t1.n=t2.n;
select * from t1;
n	d
1	10
1	10
select * from t2;
n	d
1	30
2	20
drop table t1,t2;
drop table if exists t1, t2;
CREATE TABLE t1 (a int, PRIMARY KEY (a));
CREATE TABLE t2 (a int, PRIMARY KEY (a)) ENGINE=InnoDB;
create trigger trg_del_t2 after  delete on t2 for each row
insert into t1 values (1);
insert into t1 values (1);
insert into t2 values (1),(2);
delete t2 from t2;
ERROR 23000: Duplicate entry '1' for key 't1.PRIMARY'
select count(*) from t2 /* must be 2 as restored after rollback caused by the error */;
count(*)
2
drop table t1, t2;
drop table if exists t1, t2;
CREATE TABLE t1 (a int, PRIMARY KEY (a));
CREATE TABLE t2 (a int, PRIMARY KEY (a)) ENGINE=InnoDB;
create trigger trg_del_t2 after  delete on t2 for each row
insert into t1 values (1);
insert into t1 values (1);
insert into t2 values (1),(2);
delete t2 from t2;
ERROR 23000: Duplicate entry '1' for key 't1.PRIMARY'
select count(*) from t2 /* must be 2 as restored after rollback caused by the error */;
count(*)
2
drop table t1, t2;
create table t1 (a int, b int) engine=innodb;
insert into t1 values(20,null);
select t2.b, ifnull(t2.b,"this is null") from t1 as t2 left join t1 as t3 on
t2.b=t3.a;
b	ifnull(t2.b,"this is null")
NULL	this is null
select t2.b, ifnull(t2.b,"this is null") from t1 as t2 left join t1 as t3 on
t2.b=t3.a order by 1;
b	ifnull(t2.b,"this is null")
NULL	this is null
insert into t1 values(10,null);
select t2.b, ifnull(t2.b,"this is null") from t1 as t2 left join t1 as t3 on
t2.b=t3.a order by 1;
b	ifnull(t2.b,"this is null")
NULL	this is null
NULL	this is null
drop table t1;
create table t1 (a varchar(10) not null) engine=myisam;
create table t2 (b varchar(10) not null unique) engine=innodb;
select t1.a from t1,t2 where t1.a=t2.b;
a
drop table t1,t2;
create table t1 (a int not null, b int, primary key (a)) engine = innodb;
create table t2 (a int not null, b int, primary key (a)) engine = innodb;
insert into t1 values (10, 20);
insert into t2 values (10, 20);
update t1, t2 set t1.b = 150, t2.b = t1.b where t2.a = t1.a and t1.a = 10;
drop table t1,t2;
CREATE TABLE t1 (id INT NOT NULL, PRIMARY KEY (id)) ENGINE=INNODB;
CREATE TABLE t2 (id INT PRIMARY KEY, t1_id INT, INDEX par_ind (t1_id), FOREIGN KEY (t1_id) REFERENCES t1(id)  ON DELETE CASCADE ) ENGINE=INNODB;
insert into t1 set id=1;
insert into t2 set id=1, t1_id=1;
delete t1,t2 from t1,t2 where t1.id=t2.t1_id;
select * from t1;
id
select * from t2;
id	t1_id
drop table t2,t1;
CREATE TABLE t1(id INT NOT NULL,  PRIMARY KEY (id)) ENGINE=INNODB;
CREATE TABLE t2(id  INT PRIMARY KEY, t1_id INT, INDEX par_ind (t1_id)  ) ENGINE=INNODB;
INSERT INTO t1 VALUES(1);
INSERT INTO t2 VALUES(1, 1);
SELECT * from t1;
id
1
UPDATE t1,t2 SET t1.id=t1.id+1, t2.t1_id=t1.id+1;
SELECT * from t1;
id
2
UPDATE t1,t2 SET t1.id=t1.id+1 where t1.id!=t2.id;
SELECT * from t1;
id
3
DROP TABLE t1,t2;
set autocommit=0;
CREATE TABLE t1 (id CHAR(15) NOT NULL, value CHAR(40) NOT NULL, PRIMARY KEY(id)) ENGINE=InnoDB;
CREATE TABLE t2 (id CHAR(15) NOT NULL, value CHAR(40) NOT NULL, PRIMARY KEY(id)) ENGINE=InnoDB;
CREATE TABLE t3 (id1 CHAR(15) NOT NULL, id2 CHAR(15) NOT NULL, PRIMARY KEY(id1, id2)) ENGINE=InnoDB;
INSERT INTO t3 VALUES("my-test-1", "my-test-2");
COMMIT;
INSERT INTO t1 VALUES("this-key", "will disappear");
INSERT INTO t2 VALUES("this-key", "will also disappear");
DELETE FROM t3 WHERE id1="my-test-1";
SELECT * FROM t1;
id	value
this-key	will disappear
SELECT * FROM t2;
id	value
this-key	will also disappear
SELECT * FROM t3;
id1	id2
ROLLBACK;
SELECT * FROM t1;
id	value
SELECT * FROM t2;
id	value
SELECT * FROM t3;
id1	id2
my-test-1	my-test-2
SELECT * FROM t3 WHERE id1="my-test-1" LOCK IN SHARE MODE;
id1	id2
my-test-1	my-test-2
COMMIT;
set autocommit=1;
DROP TABLE t1,t2,t3;
CREATE TABLE t1 (a int not null primary key, b int not null, unique (b)) engine=innodb;
INSERT INTO t1 values (1,1),(2,2),(3,3),(4,4),(5,5),(6,6),(7,7),(8,8),(9,9);
UPDATE t1 set a=a+100 where b between 2 and 3 and a < 1000;
SELECT * from t1;
a	b
1	1
102	2
103	3
4	4
5	5
6	6
7	7
8	8
9	9
drop table t1;
CREATE TABLE t2 (   NEXT_T         BIGINT NOT NULL PRIMARY KEY) ENGINE=MyISAM;
CREATE TABLE t1 (  B_ID           INTEGER NOT NULL PRIMARY KEY) ENGINE=InnoDB;
SET AUTOCOMMIT=0;
INSERT INTO t1 ( B_ID ) VALUES ( 1 );
INSERT INTO t2 ( NEXT_T ) VALUES ( 1 );
Warnings:
Warning	6414	Combining the storage engines MyISAM and InnoDB is deprecated, but the statement or transaction updates both the MyISAM table test.t2 and the InnoDB table test.t1.
ROLLBACK;
Warnings:
Warning	1196	Some non-transactional changed tables couldn't be rolled back
SELECT * FROM t1;
B_ID
drop table  t1,t2;
create table t1  ( pk         int primary key,    parent     int not null,    child      int not null,       index (parent)  ) engine = innodb;
insert into t1 values   (1,0,4),  (2,1,3),  (3,2,1),  (4,1,2);
select distinct  parent,child   from t1   order by parent, child;
parent	child
0	4
1	2
1	3
2	1
drop table t1;
create table t1 (a int not null auto_increment primary key, b int, c int, key(c)) engine=innodb;
create table t2 (a int not null auto_increment primary key, b int);
insert into t1 (b) values (null),(null),(null),(null),(null),(null),(null);
insert into t2 (a) select b from t1;
Warnings:
Warning	6414	Combining the storage engines MyISAM and InnoDB is deprecated, but the statement or transaction updates both the MyISAM table test.t2 and the InnoDB table test.t1.
insert into t1 (b) select b from t2;
insert into t2 (a) select b from t1;
insert into t1 (a) select b from t2;
insert into t2 (a) select b from t1;
insert into t1 (a) select b from t2;
insert into t2 (a) select b from t1;
insert into t1 (a) select b from t2;
insert into t2 (a) select b from t1;
insert into t1 (a) select b from t2;
select count(*) from t1;
count(*)
623
explain select * from t1 where c between 1 and 2500;
id	select_type	table	partitions	type	possible_keys	key	key_len	ref	rows	filtered	Extra
1	SIMPLE	t1	NULL	range	c	c	5	NULL	#	100.00	Using index condition
Warnings:
Note	1003	/* select#1 */ select `test`.`t1`.`a` AS `a`,`test`.`t1`.`b` AS `b`,`test`.`t1`.`c` AS `c` from `test`.`t1` where (`test`.`t1`.`c` between 1 and 2500)
update t1 set c=a;
explain select * from t1 where c between 1 and 2500;
id	select_type	table	partitions	type	possible_keys	key	key_len	ref	rows	filtered	Extra
1	SIMPLE	t1	NULL	ALL	c	NULL	NULL	NULL	#	#	Using where
Warnings:
Note	1003	/* select#1 */ select `test`.`t1`.`a` AS `a`,`test`.`t1`.`b` AS `b`,`test`.`t1`.`c` AS `c` from `test`.`t1` where (`test`.`t1`.`c` between 1 and 2500)
drop table t1,t2;
create table t1 (id int primary key auto_increment, fk int, index index_fk (fk)) engine=innodb;
insert into t1 (id) values (null),(null),(null),(null),(null);
update t1 set fk=69 where fk is null order by id limit 1;
SELECT * from t1;
id	fk
1	69
2	NULL
3	NULL
4	NULL
5	NULL
drop table t1;
create table t1 (a int not null, b int not null, key (a));
insert into t1 values (1,1),(1,2),(1,3),(3,1),(3,2),(3,3),(3,1),(3,2),(3,3),(2,1),(2,2),(2,3);
SET @tmp=0;
update t1 set b=(@tmp:=@tmp+1) order by a;
Warnings:
Warning	1287	Setting user variables within expressions is deprecated and will be removed in a future release. Consider alternatives: 'SET variable=expression, ...', or 'SELECT expression(s) INTO variables(s)'.
update t1 set b=99 where a=1 order by b asc limit 1;
update t1 set b=100 where a=1 order by b desc limit 2;
update t1 set a=a+10+b where a=1 order by b;
select * from t1 order by a,b;
a	b
2	4
2	5
2	6
3	7
3	8
3	9
3	10
3	11
3	12
13	2
111	100
111	100
drop table t1;
create table t1 ( c char(8) not null ) engine=innodb;
insert into t1 values ('0'),('1'),('2'),('3'),('4'),('5'),('6'),('7'),('8'),('9');
insert into t1 values ('A'),('B'),('C'),('D'),('E'),('F');
alter table t1 add b char(8) not null;
alter table t1 add a char(8) not null;
alter table t1 add primary key (a,b,c);
update t1 set a=c, b=c;
create table t2 (c char(8) not null, b char(8) not null, a char(8) not null, primary key(a,b,c)) engine=innodb;
insert into t2 select * from t1;
delete t1,t2 from t2,t1 where t1.a<'B' and t2.b=t1.b;
drop table t1,t2;
SET AUTOCOMMIT=1;
create table t1 (a integer auto_increment primary key) engine=innodb;
insert into t1 (a) values (NULL),(NULL);
truncate table t1;
insert into t1 (a) values (NULL),(NULL);
SELECT * from t1;
a
1
2
drop table t1;
CREATE TABLE t1 (`id 1` INT NOT NULL, PRIMARY KEY (`id 1`)) ENGINE=INNODB;
CREATE TABLE t2 (id INT PRIMARY KEY, t1_id INT, INDEX par_ind (t1_id), FOREIGN KEY (`t1_id`) REFERENCES `t1`(`id 1`)  ON DELETE CASCADE ) ENGINE=INNODB;
drop table t2,t1;
create table `t1` (`id` int( 11 ) not null  ,primary key ( `id` )) engine = innodb;
Warnings:
Warning	1681	Integer display width is deprecated and will be removed in a future release.
insert into `t1`values ( 1 ) ;
create table `t2` (`id` int( 11 ) not null default '0',unique key `id` ( `id` ) ,constraint `t1_id_fk` foreign key ( `id` ) references `t1` (`id` )) engine = innodb;
Warnings:
Warning	1681	Integer display width is deprecated and will be removed in a future release.
insert into `t2`values ( 1 ) ;
create table `t3` (`id` int( 11 ) not null default '0',key `id` ( `id` ) ,constraint `t2_id_fk` foreign key ( `id` ) references `t2` (`id` )) engine = innodb;
Warnings:
Warning	1681	Integer display width is deprecated and will be removed in a future release.
insert into `t3`values ( 1 ) ;
delete t3,t2,t1 from t1,t2,t3 where t1.id =1 and t2.id = t1.id and t3.id = t2.id;
ERROR 23000: Cannot delete or update a parent row: a foreign key constraint fails (`test`.`t2`, CONSTRAINT `t1_id_fk` FOREIGN KEY (`id`) REFERENCES `t1` (`id`))
update t1,t2,t3 set t3.id=5, t2.id=6, t1.id=7  where t1.id =1 and t2.id = t1.id and t3.id = t2.id;
ERROR 23000: Cannot delete or update a parent row: a foreign key constraint fails (`test`.`t2`, CONSTRAINT `t1_id_fk` FOREIGN KEY (`id`) REFERENCES `t1` (`id`))
update t3 set  t3.id=7  where t1.id =1 and t2.id = t1.id and t3.id = t2.id;
ERROR 42S22: Unknown column 't1.id' in 'where clause'
drop table t3,t2,t1;
SET restrict_fk_on_non_standard_key=OFF;
Warnings:
Warning	4166	'restrict_fk_on_non_standard_key' is deprecated and will be removed in a future release. Foreign key referring to non-unique or partial keys is unsafe and may break replication.
CREATE TABLE t1 (
c1 VARCHAR(8), c2 VARCHAR(8),
PRIMARY KEY (c1, c2)
) ENGINE=InnoDB;
CREATE TABLE t2 (
c0 INT PRIMARY KEY,
c1 VARCHAR(8) UNIQUE,
FOREIGN KEY (c1) REFERENCES t1 (c1) ON UPDATE CASCADE
) ENGINE=InnoDB;
Warnings:
Warning	6124	Foreign key 't2_ibfk_1' refers to non-unique key or partial key. This is deprecated and will be removed in a future release.
INSERT INTO t1 VALUES ('old', 'somevalu'), ('other', 'anyvalue');
INSERT INTO t2 VALUES (10, 'old'), (20, 'other');
UPDATE t1 SET c1 = 'other' WHERE c1 = 'old';
ERROR 23000: Foreign key constraint for table 't1', record 'other-somevalu' would lead to a duplicate entry in table 't2', key 'c1'
DROP TABLE t2,t1;
SET restrict_fk_on_non_standard_key=ON;
Warnings:
Warning	1681	'restrict_fk_on_non_standard_key' is deprecated and will be removed in a future release.
create table t1(
id int primary key,
pid int,
index(pid),
foreign key(pid) references t1(id) on delete cascade) engine=innodb;
insert into t1 values(0,0),(1,0),(2,1),(3,2),(4,3),(5,4),(6,5),(7,6),
(8,7),(9,8),(10,9),(11,10),(12,11),(13,12),(14,13),(15,14);
delete from t1 where id=0;
ERROR HY000: Foreign key cascade delete/update exceeds max depth of 15.
delete from t1 where id=15;
delete from t1 where id=0;
drop table t1;
CREATE TABLE t1 (col1 int(1))ENGINE=InnoDB;
Warnings:
Warning	1681	Integer display width is deprecated and will be removed in a future release.
CREATE TABLE t2 (col1 int(1),stamp TIMESTAMP,INDEX stamp_idx
(stamp))ENGINE=InnoDB;
Warnings:
Warning	1681	Integer display width is deprecated and will be removed in a future release.
insert into t1 values (1),(2),(3);
insert ignore into t2 values (1, 20020204130000),(2, 20020204130000),(4,20020204310000 ),(5,20020204230000);
Warnings:
Warning	1265	Data truncated for column 'stamp' at row 3
SELECT col1 FROM t1 UNION SELECT col1 FROM t2 WHERE stamp <
'20020204120000' GROUP BY col1;
col1
1
2
3
4
drop table t1,t2;
CREATE TABLE t1 (
`id` int(10) unsigned NOT NULL auto_increment,
`id_object` int(10) unsigned default '0',
`id_version` int(10) unsigned NOT NULL default '1',
`label` varchar(100) NOT NULL default '',
`description` text,
PRIMARY KEY  (`id`),
KEY `id_object` (`id_object`),
KEY `id_version` (`id_version`)
) ENGINE=InnoDB;
Warnings:
Warning	1681	Integer display width is deprecated and will be removed in a future release.
Warning	1681	Integer display width is deprecated and will be removed in a future release.
Warning	1681	Integer display width is deprecated and will be removed in a future release.
INSERT INTO t1 VALUES("6", "3382", "9", "Test", NULL), ("7", "102", "5", "Le Pekin (Test)", NULL),("584", "1794", "4", "Test de resto", NULL),("837", "1822", "6", "Test 3", NULL),("1119", "3524", "1", "Societe Test", NULL),("1122", "3525", "1", "Fournisseur Test", NULL);
CREATE TABLE t2 (
`id` int(10) unsigned NOT NULL auto_increment,
`id_version` int(10) unsigned NOT NULL default '1',
PRIMARY KEY  (`id`),
KEY `id_version` (`id_version`)
) ENGINE=InnoDB;
Warnings:
Warning	1681	Integer display width is deprecated and will be removed in a future release.
Warning	1681	Integer display width is deprecated and will be removed in a future release.
INSERT INTO t2 VALUES("3524", "1"),("3525", "1"),("1794", "4"),("102", "5"),("1822", "6"),("3382", "9");
SELECT t2.id, t1.`label` FROM t2 INNER JOIN
(SELECT t1.id_object as id_object FROM t1 WHERE t1.`label` LIKE '%test%') AS lbl
ON (t2.id = lbl.id_object) INNER JOIN t1 ON (t2.id = t1.id_object) ORDER BY 1;
id	label
102	Le Pekin (Test)
1794	Test de resto
1822	Test 3
3382	Test
3524	Societe Test
3525	Fournisseur Test
drop table t1,t2;
create table t1 (a int, b varchar(200), c text not null) checksum=1 engine=myisam;
create table t2 (a int, b varchar(200), c text not null) checksum=0 engine=innodb;
create table t3 (a int, b varchar(200), c text not null) checksum=1 engine=innodb;
insert t1 values (1, "aaa", "bbb"), (NULL, "", "ccccc"), (0, NULL, "");
insert t2 select * from t1;
insert t3 select * from t1;
checksum table t1, t2, t3, t4 quick;
Table	Checksum
test.t1	2948697075
test.t2	NULL
test.t3	NULL
test.t4	NULL
Warnings:
Error	1146	Table 'test.t4' doesn't exist
checksum table t1, t2, t3, t4;
Table	Checksum
test.t1	2948697075
test.t2	2948697075
test.t3	2948697075
test.t4	NULL
Warnings:
Error	1146	Table 'test.t4' doesn't exist
checksum table t1, t2, t3, t4 extended;
Table	Checksum
test.t1	2948697075
test.t2	2948697075
test.t3	2948697075
test.t4	NULL
Warnings:
Error	1146	Table 'test.t4' doesn't exist
drop table t1,t2,t3;
create table t1 (id int,  name char(10) not null,  name2 char(10) not null) engine=innodb;
insert into t1 values(1,'first','fff'),(2,'second','sss'),(3,'third','ttt');
select trim(name2) from t1  union all  select trim(name) from t1 union all select trim(id) from t1;
trim(name2)
fff
sss
ttt
first
second
third
1
2
3
drop table t1;
create table t1 (a int) engine=innodb;
create table t2 like t1;
drop table t1,t2;
SET restrict_fk_on_non_standard_key=OFF;
Warnings:
Warning	4166	'restrict_fk_on_non_standard_key' is deprecated and will be removed in a future release. Foreign key referring to non-unique or partial keys is unsafe and may break replication.
create table t1 (id int(11) not null, id2 int(11) not null, unique(id,id2)) engine=innodb;
Warnings:
Warning	1681	Integer display width is deprecated and will be removed in a future release.
Warning	1681	Integer display width is deprecated and will be removed in a future release.
create table t2 (id int(11) not null, constraint t1_id_fk foreign key ( id ) references t1 (id)) engine = innodb;
Warnings:
Warning	1681	Integer display width is deprecated and will be removed in a future release.
Warning	6124	Foreign key 't1_id_fk' refers to non-unique key or partial key. This is deprecated and will be removed in a future release.
show create table t1;
Table	Create Table
t1	CREATE TABLE `t1` (
  `id` int NOT NULL,
  `id2` int NOT NULL,
  UNIQUE KEY `id` (`id`,`id2`)
) ENGINE=InnoDB DEFAULT CHARSET=utf8mb4 COLLATE=utf8mb4_0900_ai_ci
show create table t2;
Table	Create Table
t2	CREATE TABLE `t2` (
  `id` int NOT NULL,
  KEY `t1_id_fk` (`id`),
  CONSTRAINT `t1_id_fk` FOREIGN KEY (`id`) REFERENCES `t1` (`id`)
) ENGINE=InnoDB DEFAULT CHARSET=utf8mb4 COLLATE=utf8mb4_0900_ai_ci
create index id on t2 (id);
show create table t2;
Table	Create Table
t2	CREATE TABLE `t2` (
  `id` int NOT NULL,
  KEY `id` (`id`),
  CONSTRAINT `t1_id_fk` FOREIGN KEY (`id`) REFERENCES `t1` (`id`)
) /*!50100 TABLESPACE `innodb_system` */ ENGINE=InnoDB DEFAULT CHARSET=utf8mb4 COLLATE=utf8mb4_0900_ai_ci
create index id2 on t2 (id);
Warnings:
Warning	1831	Duplicate index 'id2' defined on the table 'test.t2'. This is deprecated and will be disallowed in a future release.
show create table t2;
Table	Create Table
t2	CREATE TABLE `t2` (
  `id` int NOT NULL,
  KEY `id` (`id`),
  KEY `id2` (`id`),
  CONSTRAINT `t1_id_fk` FOREIGN KEY (`id`) REFERENCES `t1` (`id`)
) /*!50100 TABLESPACE `innodb_system` */ ENGINE=InnoDB DEFAULT CHARSET=utf8mb4 COLLATE=utf8mb4_0900_ai_ci
drop index id2 on t2;
drop index id on t2;
ERROR HY000: Cannot drop index 'id': needed in a foreign key constraint
show create table t2;
Table	Create Table
t2	CREATE TABLE `t2` (
  `id` int NOT NULL,
  KEY `id` (`id`),
  CONSTRAINT `t1_id_fk` FOREIGN KEY (`id`) REFERENCES `t1` (`id`)
) /*!50100 TABLESPACE `innodb_system` */ ENGINE=InnoDB DEFAULT CHARSET=utf8mb4 COLLATE=utf8mb4_0900_ai_ci
drop table t2;
create table t2 (id int(11) not null, id2 int(11) not null, constraint t1_id_fk foreign key (id,id2) references t1 (id,id2)) engine = innodb;
Warnings:
Warning	1681	Integer display width is deprecated and will be removed in a future release.
Warning	1681	Integer display width is deprecated and will be removed in a future release.
show create table t2;
Table	Create Table
t2	CREATE TABLE `t2` (
  `id` int NOT NULL,
  `id2` int NOT NULL,
  KEY `t1_id_fk` (`id`,`id2`),
  CONSTRAINT `t1_id_fk` FOREIGN KEY (`id`, `id2`) REFERENCES `t1` (`id`, `id2`)
) ENGINE=InnoDB DEFAULT CHARSET=utf8mb4 COLLATE=utf8mb4_0900_ai_ci
create unique index id on t2 (id,id2);
show create table t2;
Table	Create Table
t2	CREATE TABLE `t2` (
  `id` int NOT NULL,
  `id2` int NOT NULL,
  UNIQUE KEY `id` (`id`,`id2`),
  CONSTRAINT `t1_id_fk` FOREIGN KEY (`id`, `id2`) REFERENCES `t1` (`id`, `id2`)
) /*!50100 TABLESPACE `innodb_system` */ ENGINE=InnoDB DEFAULT CHARSET=utf8mb4 COLLATE=utf8mb4_0900_ai_ci
drop table t2;
create table t2 (id int(11) not null, id2 int(11) not null, unique (id,id2),constraint t1_id_fk foreign key (id2,id) references t1 (id,id2)) engine = innodb;
Warnings:
Warning	1681	Integer display width is deprecated and will be removed in a future release.
Warning	1681	Integer display width is deprecated and will be removed in a future release.
show create table t2;
Table	Create Table
t2	CREATE TABLE `t2` (
  `id` int NOT NULL,
  `id2` int NOT NULL,
  UNIQUE KEY `id` (`id`,`id2`),
  KEY `t1_id_fk` (`id2`,`id`),
  CONSTRAINT `t1_id_fk` FOREIGN KEY (`id2`, `id`) REFERENCES `t1` (`id`, `id2`)
) ENGINE=InnoDB DEFAULT CHARSET=utf8mb4 COLLATE=utf8mb4_0900_ai_ci
drop table t2;
create table t2 (id int(11) not null, id2 int(11) not null, unique (id,id2), constraint t1_id_fk foreign key (id) references t1 (id)) engine = innodb;
Warnings:
Warning	1681	Integer display width is deprecated and will be removed in a future release.
Warning	1681	Integer display width is deprecated and will be removed in a future release.
Warning	6124	Foreign key 't1_id_fk' refers to non-unique key or partial key. This is deprecated and will be removed in a future release.
show create table t2;
Table	Create Table
t2	CREATE TABLE `t2` (
  `id` int NOT NULL,
  `id2` int NOT NULL,
  UNIQUE KEY `id` (`id`,`id2`),
  CONSTRAINT `t1_id_fk` FOREIGN KEY (`id`) REFERENCES `t1` (`id`)
) ENGINE=InnoDB DEFAULT CHARSET=utf8mb4 COLLATE=utf8mb4_0900_ai_ci
drop table t2;
create table t2 (id int(11) not null, id2 int(11) not null, unique (id,id2),constraint t1_id_fk foreign key (id2,id) references t1 (id,id2)) engine = innodb;
Warnings:
Warning	1681	Integer display width is deprecated and will be removed in a future release.
Warning	1681	Integer display width is deprecated and will be removed in a future release.
show create table t2;
Table	Create Table
t2	CREATE TABLE `t2` (
  `id` int NOT NULL,
  `id2` int NOT NULL,
  UNIQUE KEY `id` (`id`,`id2`),
  KEY `t1_id_fk` (`id2`,`id`),
  CONSTRAINT `t1_id_fk` FOREIGN KEY (`id2`, `id`) REFERENCES `t1` (`id`, `id2`)
) ENGINE=InnoDB DEFAULT CHARSET=utf8mb4 COLLATE=utf8mb4_0900_ai_ci
drop table t2;
create table t2 (id int(11) not null auto_increment, id2 int(11) not null, constraint t1_id_fk foreign key (id) references t1 (id), primary key (id), index (id,id2)) engine = innodb;
Warnings:
Warning	1681	Integer display width is deprecated and will be removed in a future release.
Warning	1681	Integer display width is deprecated and will be removed in a future release.
Warning	6124	Foreign key 't1_id_fk' refers to non-unique key or partial key. This is deprecated and will be removed in a future release.
show create table t2;
Table	Create Table
t2	CREATE TABLE `t2` (
  `id` int NOT NULL AUTO_INCREMENT,
  `id2` int NOT NULL,
  PRIMARY KEY (`id`),
  KEY `id` (`id`,`id2`),
  CONSTRAINT `t1_id_fk` FOREIGN KEY (`id`) REFERENCES `t1` (`id`)
) ENGINE=InnoDB DEFAULT CHARSET=utf8mb4 COLLATE=utf8mb4_0900_ai_ci
drop table t2;
create table t2 (id int(11) not null auto_increment, id2 int(11) not null, constraint t1_id_fk foreign key (id) references t1 (id)) engine= innodb;
Warnings:
Warning	1681	Integer display width is deprecated and will be removed in a future release.
Warning	1681	Integer display width is deprecated and will be removed in a future release.
Warning	6124	Foreign key 't1_id_fk' refers to non-unique key or partial key. This is deprecated and will be removed in a future release.
show create table t2;
Table	Create Table
t2	CREATE TABLE `t2` (
  `id` int NOT NULL AUTO_INCREMENT,
  `id2` int NOT NULL,
  KEY `t1_id_fk` (`id`),
  CONSTRAINT `t1_id_fk` FOREIGN KEY (`id`) REFERENCES `t1` (`id`)
) ENGINE=InnoDB DEFAULT CHARSET=utf8mb4 COLLATE=utf8mb4_0900_ai_ci
alter table t2 add index id_test (id), add index id_test2 (id,id2);
show create table t2;
Table	Create Table
t2	CREATE TABLE `t2` (
  `id` int NOT NULL AUTO_INCREMENT,
  `id2` int NOT NULL,
  KEY `id_test` (`id`),
  KEY `id_test2` (`id`,`id2`),
  CONSTRAINT `t1_id_fk` FOREIGN KEY (`id`) REFERENCES `t1` (`id`)
) /*!50100 TABLESPACE `innodb_system` */ ENGINE=InnoDB DEFAULT CHARSET=utf8mb4 COLLATE=utf8mb4_0900_ai_ci
drop table t2;
create table t2 (id int(11) not null, id2 int(11) not null, constraint t1_id_fk foreign key (id2,id) references t1 (id)) engine = innodb;
ERROR 42000: Incorrect foreign key definition for 't1_id_fk': Key reference and table reference don't match
create table t2 (a int auto_increment primary key, b int, index(b), foreign key (b) references t1(id), unique(b)) engine=innodb;
Warnings:
Warning	6124	Foreign key 't2_ibfk_1' refers to non-unique key or partial key. This is deprecated and will be removed in a future release.
show create table t2;
Table	Create Table
t2	CREATE TABLE `t2` (
  `a` int NOT NULL AUTO_INCREMENT,
  `b` int DEFAULT NULL,
  PRIMARY KEY (`a`),
  UNIQUE KEY `b_2` (`b`),
  KEY `b` (`b`),
  CONSTRAINT `t2_ibfk_1` FOREIGN KEY (`b`) REFERENCES `t1` (`id`)
) ENGINE=InnoDB DEFAULT CHARSET=utf8mb4 COLLATE=utf8mb4_0900_ai_ci
drop table t2;
create table t2 (a int auto_increment primary key, b int, foreign key (b) references t1(id), foreign key (b) references t1(id), unique(b)) engine=innodb;
Warnings:
Warning	6124	Foreign key 't2_ibfk_1' refers to non-unique key or partial key. This is deprecated and will be removed in a future release.
Warning	6124	Foreign key 't2_ibfk_2' refers to non-unique key or partial key. This is deprecated and will be removed in a future release.
show create table t2;
Table	Create Table
t2	CREATE TABLE `t2` (
  `a` int NOT NULL AUTO_INCREMENT,
  `b` int DEFAULT NULL,
  PRIMARY KEY (`a`),
  UNIQUE KEY `b` (`b`),
  CONSTRAINT `t2_ibfk_1` FOREIGN KEY (`b`) REFERENCES `t1` (`id`),
  CONSTRAINT `t2_ibfk_2` FOREIGN KEY (`b`) REFERENCES `t1` (`id`)
) ENGINE=InnoDB DEFAULT CHARSET=utf8mb4 COLLATE=utf8mb4_0900_ai_ci
drop table t2, t1;
SET restrict_fk_on_non_standard_key=ON;
Warnings:
Warning	1681	'restrict_fk_on_non_standard_key' is deprecated and will be removed in a future release.
create table t1 (c char(10), index (c,c)) engine=innodb;
ERROR 42S21: Duplicate column name 'c'
create table t1 (c1 char(10), c2 char(10), index (c1,c2,c1)) engine=innodb;
ERROR 42S21: Duplicate column name 'c1'
create table t1 (c1 char(10), c2 char(10), index (c1,c1,c2)) engine=innodb;
ERROR 42S21: Duplicate column name 'c1'
create table t1 (c1 char(10), c2 char(10), index (c2,c1,c1)) engine=innodb;
ERROR 42S21: Duplicate column name 'c1'
create table t1 (c1 char(10), c2 char(10)) engine=innodb;
alter table t1 add key (c1,c1);
ERROR 42S21: Duplicate column name 'c1'
alter table t1 add key (c2,c1,c1);
ERROR 42S21: Duplicate column name 'c1'
alter table t1 add key (c1,c2,c1);
ERROR 42S21: Duplicate column name 'c1'
alter table t1 add key (c1,c1,c2);
ERROR 42S21: Duplicate column name 'c1'
drop table t1;
CREATE TABLE t1 (a_id tinyint(4) NOT NULL default '0', PRIMARY KEY  (a_id)) ENGINE=InnoDB DEFAULT CHARSET=latin1;
INSERT INTO t1 VALUES (1),(2),(3);
CREATE TABLE t2 (b_id tinyint(4) NOT NULL default '0',b_a tinyint(4) NOT NULL default '0', PRIMARY KEY  (b_id), KEY  (b_a),
CONSTRAINT fk_b_a FOREIGN KEY (b_a) REFERENCES t1 (a_id) ON DELETE CASCADE ON UPDATE NO ACTION) ENGINE=InnoDB DEFAULT CHARSET=latin1;
INSERT INTO t2 VALUES (1,1),(2,1),(3,1),(4,2),(5,2);
SELECT * FROM (SELECT t1.*,GROUP_CONCAT(t2.b_id SEPARATOR ',') as b_list FROM (t1 LEFT JOIN (t2) on t1.a_id = t2.b_a) GROUP BY t1.a_id ) AS xyz;
a_id	b_list
1	1,2,3
2	4,5
3	NULL
DROP TABLE t2;
DROP TABLE t1;
create temporary table t1 (a int) engine=innodb;
insert into t1 values (4711);
truncate t1;
insert into t1 values (42);
select * from t1;
a
42
drop table t1;
create table t1 (a int) engine=innodb;
insert into t1 values (4711);
truncate t1;
insert into t1 values (42);
select * from t1;
a
42
drop table t1;
create table t1 (a int not null, b int not null, c blob not null, d int not null, e int, primary key (a,b,c(255),d)) engine=innodb;
insert into t1 values (2,2,"b",2,2),(1,1,"a",1,1),(3,3,"ab",3,3);
analyze table t1;
select * from t1 order by a,b,c,d;
a	b	c	d	e
1	1	a	1	1
2	2	b	2	2
3	3	ab	3	3
explain select * from t1 order by a,b,c,d;
id	select_type	table	partitions	type	possible_keys	key	key_len	ref	rows	filtered	Extra
1	SIMPLE	t1	NULL	ALL	NULL	NULL	NULL	NULL	3	100.00	Using filesort
Warnings:
Note	1003	/* select#1 */ select `test`.`t1`.`a` AS `a`,`test`.`t1`.`b` AS `b`,`test`.`t1`.`c` AS `c`,`test`.`t1`.`d` AS `d`,`test`.`t1`.`e` AS `e` from `test`.`t1` order by `test`.`t1`.`a`,`test`.`t1`.`b`,`test`.`t1`.`c`,`test`.`t1`.`d`
drop table t1;
create table t1 (a char(1), b char(1), key(a, b)) engine=innodb;
insert into t1 values ('8', '6'), ('4', '7');
select min(a) from t1;
min(a)
4
select min(b) from t1 where a='8';
min(b)
6
drop table t1;
create table t1 (x bigint unsigned not null primary key) engine=innodb;
insert into t1(x) values (0xfffffffffffffff0),(0xfffffffffffffff1);
select * from t1;
x
18446744073709551600
18446744073709551601
select count(*) from t1 where x>0;
count(*)
2
select count(*) from t1 where x=0;
count(*)
0
select count(*) from t1 where x<0;
count(*)
0
select count(*) from t1 where x < -16;
count(*)
0
select count(*) from t1 where x = -16;
count(*)
0
explain select count(*) from t1 where x > -16;
id	select_type	table	partitions	type	possible_keys	key	key_len	ref	rows	filtered	Extra
1	SIMPLE	t1	NULL	index	NULL	PRIMARY	8	NULL	2	100.00	Using index
Warnings:
Note	1003	/* select#1 */ select count(0) AS `count(*)` from `test`.`t1` where true
select count(*) from t1 where x > -16;
count(*)
2
select * from t1 where x > -16;
x
18446744073709551600
18446744073709551601
select count(*) from t1 where x = 18446744073709551601;
count(*)
1
drop table t1;
SELECT variable_value FROM performance_schema.global_status WHERE LOWER(variable_name) = 'innodb_buffer_pool_pages_total';
variable_value
{checked_valid}
SELECT variable_value FROM performance_schema.global_status WHERE LOWER(variable_name) = 'innodb_page_size';
variable_value
{checked_valid}
SELECT sum(variable_value) - @innodb_rows_deleted_orig FROM performance_schema.global_status WHERE LOWER(variable_name) like 'innodb%_rows_deleted';
sum(variable_value) - @innodb_rows_deleted_orig
1830
SELECT sum(variable_value) - @innodb_rows_inserted_orig FROM performance_schema.global_status WHERE LOWER(variable_name) like 'innodb%_rows_inserted';
sum(variable_value) - @innodb_rows_inserted_orig
2733
SELECT sum(variable_value) - @innodb_rows_updated_orig FROM performance_schema.global_status WHERE LOWER(variable_name) like 'innodb%_rows_updated';
sum(variable_value) - @innodb_rows_updated_orig
2635
SELECT variable_value - @innodb_row_lock_waits_orig FROM performance_schema.global_status WHERE LOWER(variable_name) = 'innodb_row_lock_waits';
variable_value - @innodb_row_lock_waits_orig
0
SELECT variable_value - @innodb_row_lock_current_waits_orig FROM performance_schema.global_status WHERE LOWER(variable_name) = 'innodb_row_lock_current_waits';
variable_value - @innodb_row_lock_current_waits_orig
0
SELECT variable_value - @innodb_row_lock_time_orig FROM performance_schema.global_status WHERE LOWER(variable_name) = 'innodb_row_lock_time';
variable_value - @innodb_row_lock_time_orig
0
SELECT variable_value - @innodb_row_lock_time_max_orig FROM performance_schema.global_status WHERE LOWER(variable_name) = 'innodb_row_lock_time_max';
variable_value - @innodb_row_lock_time_max_orig
0
SELECT variable_value - @innodb_row_lock_time_avg_orig FROM performance_schema.global_status WHERE LOWER(variable_name) = 'innodb_row_lock_time_avg';
variable_value - @innodb_row_lock_time_avg_orig
0
set default_storage_engine=INNODB;
set session old_alter_table=1;
drop table if exists t1,t2,t3;
--- Testing varchar ---
--- Testing varchar ---
create table t1 (v varchar(10), c char(10), t text);
insert into t1 values('+ ', '+ ', '+ ');
set @a=repeat(' ',20);
insert into t1 values (concat('+',@a),concat('+',@a),concat('+',@a));
Warnings:
Note	1265	Data truncated for column 'v' at row 1
select concat('*',v,'*',c,'*',t,'*') from t1;
concat('*',v,'*',c,'*',t,'*')
*+ *+*+ *
*+         *+*+                    *
show create table t1;
Table	Create Table
t1	CREATE TABLE `t1` (
  `v` varchar(10) DEFAULT NULL,
  `c` char(10) DEFAULT NULL,
  `t` text
) ENGINE=InnoDB DEFAULT CHARSET=utf8mb4 COLLATE=utf8mb4_0900_ai_ci
create table t2 like t1;
show create table t2;
Table	Create Table
t2	CREATE TABLE `t2` (
  `v` varchar(10) DEFAULT NULL,
  `c` char(10) DEFAULT NULL,
  `t` text
) ENGINE=InnoDB DEFAULT CHARSET=utf8mb4 COLLATE=utf8mb4_0900_ai_ci
create table t3 select * from t1;
show create table t3;
Table	Create Table
t3	CREATE TABLE `t3` (
  `v` varchar(10) DEFAULT NULL,
  `c` char(10) DEFAULT NULL,
  `t` text
) ENGINE=InnoDB DEFAULT CHARSET=utf8mb4 COLLATE=utf8mb4_0900_ai_ci
alter table t1 modify c varchar(10);
show create table t1;
Table	Create Table
t1	CREATE TABLE `t1` (
  `v` varchar(10) DEFAULT NULL,
  `c` varchar(10) DEFAULT NULL,
  `t` text
) /*!50100 TABLESPACE `innodb_system` */ ENGINE=InnoDB DEFAULT CHARSET=utf8mb4 COLLATE=utf8mb4_0900_ai_ci
alter table t1 modify v char(10);
show create table t1;
Table	Create Table
t1	CREATE TABLE `t1` (
  `v` char(10) DEFAULT NULL,
  `c` varchar(10) DEFAULT NULL,
  `t` text
) /*!50100 TABLESPACE `innodb_system` */ ENGINE=InnoDB DEFAULT CHARSET=utf8mb4 COLLATE=utf8mb4_0900_ai_ci
alter table t1 modify t varchar(10);
Warnings:
Note	1265	Data truncated for column 't' at row 2
show create table t1;
Table	Create Table
t1	CREATE TABLE `t1` (
  `v` char(10) DEFAULT NULL,
  `c` varchar(10) DEFAULT NULL,
  `t` varchar(10) DEFAULT NULL
) /*!50100 TABLESPACE `innodb_system` */ ENGINE=InnoDB DEFAULT CHARSET=utf8mb4 COLLATE=utf8mb4_0900_ai_ci
select concat('*',v,'*',c,'*',t,'*') from t1;
concat('*',v,'*',c,'*',t,'*')
*+*+*+ *
*+*+*+         *
drop table t1,t2,t3;
create table t1 (v varchar(10), c char(10), t text, key(v), key(c), key(t(10)))
stats_persistent=0 charset latin1;
show create table t1;
Table	Create Table
t1	CREATE TABLE `t1` (
  `v` varchar(10) DEFAULT NULL,
  `c` char(10) DEFAULT NULL,
  `t` text,
  KEY `v` (`v`),
  KEY `c` (`c`),
  KEY `t` (`t`(10))
) ENGINE=InnoDB DEFAULT CHARSET=latin1 STATS_PERSISTENT=0
select count(*) from t1;
count(*)
270
insert into t1 values(concat('a','!'),concat('a','!'),concat('a','!'));
select count(*) from t1 where v='a';
count(*)
10
select count(*) from t1 where c='a';
count(*)
10
select count(*) from t1 where t='a';
count(*)
10
select count(*) from t1 where v='a  ';
count(*)
10
select count(*) from t1 where c='a  ';
count(*)
10
select count(*) from t1 where t='a  ';
count(*)
10
select count(*) from t1 where v between 'a' and 'a ';
count(*)
10
select count(*) from t1 where v between 'a' and 'a ' and v between 'a  ' and 'b\n';
count(*)
10
select count(*) from t1 where v like 'a%';
count(*)
11
select count(*) from t1 where c like 'a%';
count(*)
11
select count(*) from t1 where t like 'a%';
count(*)
11
select count(*) from t1 where v like 'a %';
count(*)
9
explain select count(*) from t1 where v='a  ';
id	select_type	table	partitions	type	possible_keys	key	key_len	ref	rows	filtered	Extra
1	SIMPLE	t1	NULL	ref	v	v	13	const	#	100.00	Using index
Warnings:
Note	1003	/* select#1 */ select count(0) AS `count(*)` from `test`.`t1` where (`test`.`t1`.`v` = 'a  ')
explain select count(*) from t1 where c='a  ';
id	select_type	table	partitions	type	possible_keys	key	key_len	ref	rows	filtered	Extra
1	SIMPLE	t1	NULL	ref	c	c	11	const	#	100.00	Using index
Warnings:
Note	1003	/* select#1 */ select count(0) AS `count(*)` from `test`.`t1` where (`test`.`t1`.`c` = 'a  ')
explain select count(*) from t1 where t='a  ';
id	select_type	table	partitions	type	possible_keys	key	key_len	ref	rows	filtered	Extra
1	SIMPLE	t1	NULL	ref	t	t	13	const	#	100.00	Using where
Warnings:
Note	1003	/* select#1 */ select count(0) AS `count(*)` from `test`.`t1` where (`test`.`t1`.`t` = 'a  ')
explain select count(*) from t1 where v like 'a%';
id	select_type	table	partitions	type	possible_keys	key	key_len	ref	rows	filtered	Extra
1	SIMPLE	t1	NULL	range	v	v	13	NULL	#	100.00	Using where; Using index
Warnings:
Note	1003	/* select#1 */ select count(0) AS `count(*)` from `test`.`t1` where (`test`.`t1`.`v` like 'a%')
explain select count(*) from t1 where v between 'a' and 'a ';
id	select_type	table	partitions	type	possible_keys	key	key_len	ref	rows	filtered	Extra
1	SIMPLE	t1	NULL	ref	v	v	13	const	#	100.00	Using index
Warnings:
Note	1003	/* select#1 */ select count(0) AS `count(*)` from `test`.`t1` where (`test`.`t1`.`v` = 'a')
explain select count(*) from t1 where v between 'a' and 'a ' and v between 'a  ' and 'b\n';
id	select_type	table	partitions	type	possible_keys	key	key_len	ref	rows	filtered	Extra
1	SIMPLE	t1	NULL	ref	v	v	13	const	#	100.00	Using index
Warnings:
Note	1003	/* select#1 */ select count(0) AS `count(*)` from `test`.`t1` where (`test`.`t1`.`v` = 'a')
alter table t1 add unique(v);
ERROR 23000: Duplicate entry '{ ' for key 't1.v_2'
alter table t1 add key(v);
Warnings:
Warning	1831	Duplicate index 'v_2' defined on the table 'test.t1'. This is deprecated and will be disallowed in a future release.
select concat('*',v,'*',c,'*',t,'*') as qq from t1 where v='a';
qq
*a*a*a*
*a *a*a *
*a  *a*a  *
*a   *a*a   *
*a    *a*a    *
*a     *a*a     *
*a      *a*a      *
*a       *a*a       *
*a        *a*a        *
*a         *a*a         *
explain select * from t1 where v='a';
id	select_type	table	partitions	type	possible_keys	key	key_len	ref	rows	filtered	Extra
1	SIMPLE	t1	NULL	ref	v,v_2	#	13	const	#	100.00	NULL
Warnings:
Note	1003	/* select#1 */ select `test`.`t1`.`v` AS `v`,`test`.`t1`.`c` AS `c`,`test`.`t1`.`t` AS `t` from `test`.`t1` where (`test`.`t1`.`v` = 'a')
select TRIM(v),count(*) from t1 group by TRIM(v) order by TRIM(v) limit 10;
TRIM(v)	count(*)
a	10
a!	1
b	10
c	10
d	10
e	10
f	10
g	10
h	10
i	10
select TRIM(v),count(t) from t1 group by TRIM(v) order by TRIM(v) limit 10;
TRIM(v)	count(t)
a	10
a!	1
b	10
c	10
d	10
e	10
f	10
g	10
h	10
i	10
select TRIM(v),count(c) from t1 group by TRIM(v) order by TRIM(v) limit 10;
TRIM(v)	count(c)
a	10
a!	1
b	10
c	10
d	10
e	10
f	10
g	10
h	10
i	10
select sql_big_result TRIM(v),count(t) from t1 group by TRIM(v) order by TRIM(v) limit 10;
TRIM(v)	count(t)
a	10
a!	1
b	10
c	10
d	10
e	10
f	10
g	10
h	10
i	10
select sql_big_result TRIM(v),count(c) from t1 group by TRIM(v) order by TRIM(v) limit 10;
TRIM(v)	count(c)
a	10
a!	1
b	10
c	10
d	10
e	10
f	10
g	10
h	10
i	10
select c,count(*) from t1 group by c order by c limit 10;
c	count(*)
a	10
a!	1
b	10
c	10
d	10
e	10
f	10
g	10
h	10
i	10
select c,count(t) from t1 group by c order by c limit 10;
c	count(t)
a	10
a!	1
b	10
c	10
d	10
e	10
f	10
g	10
h	10
i	10
select sql_big_result c,count(t) from t1 group by c limit 10;
c	count(t)
a	10
a!	1
b	10
c	10
d	10
e	10
f	10
g	10
h	10
i	10
select TRIM(t),count(*) from t1 group by TRIM(t) order by TRIM(t) limit 10;
TRIM(t)	count(*)
a	10
a!	1
b	10
c	10
d	10
e	10
f	10
g	10
h	10
i	10
select TRIM(t),count(t) from t1 group by TRIM(t) order by TRIM(t) limit 10;
TRIM(t)	count(t)
a	10
a!	1
b	10
c	10
d	10
e	10
f	10
g	10
h	10
i	10
select sql_big_result TRIM(t),count(t) from t1 group by TRIM(t) order by TRIM(t) limit 10;
TRIM(t)	count(t)
a	10
a!	1
b	10
c	10
d	10
e	10
f	10
g	10
h	10
i	10
alter table t1 modify v varchar(300), drop key v, drop key v_2, add key v (v);
show create table t1;
Table	Create Table
t1	CREATE TABLE `t1` (
  `v` varchar(300) DEFAULT NULL,
  `c` char(10) DEFAULT NULL,
  `t` text,
  KEY `c` (`c`),
  KEY `t` (`t`(10)),
  KEY `v` (`v`)
) /*!50100 TABLESPACE `innodb_system` */ ENGINE=InnoDB DEFAULT CHARSET=latin1 STATS_PERSISTENT=0
select count(*) from t1 where v='a';
count(*)
10
select count(*) from t1 where v='a  ';
count(*)
10
select count(*) from t1 where v between 'a' and 'a ';
count(*)
10
select count(*) from t1 where v between 'a' and 'a ' and v between 'a  ' and 'b\n';
count(*)
10
select count(*) from t1 where v like 'a%';
count(*)
11
select count(*) from t1 where v like 'a %';
count(*)
9
explain select count(*) from t1 where v='a  ';
id	select_type	table	partitions	type	possible_keys	key	key_len	ref	rows	filtered	Extra
1	SIMPLE	t1	NULL	ref	v	v	303	const	#	100.00	Using index
Warnings:
Note	1003	/* select#1 */ select count(0) AS `count(*)` from `test`.`t1` where (`test`.`t1`.`v` = 'a  ')
explain select count(*) from t1 where v like 'a%';
id	select_type	table	partitions	type	possible_keys	key	key_len	ref	rows	filtered	Extra
1	SIMPLE	t1	NULL	range	v	v	303	NULL	#	100.00	Using where; Using index
Warnings:
Note	1003	/* select#1 */ select count(0) AS `count(*)` from `test`.`t1` where (`test`.`t1`.`v` like 'a%')
explain select count(*) from t1 where v between 'a' and 'a ';
id	select_type	table	partitions	type	possible_keys	key	key_len	ref	rows	filtered	Extra
1	SIMPLE	t1	NULL	ref	v	v	303	const	#	100.00	Using index
Warnings:
Note	1003	/* select#1 */ select count(0) AS `count(*)` from `test`.`t1` where (`test`.`t1`.`v` = 'a')
explain select count(*) from t1 where v between 'a' and 'a ' and v between 'a  ' and 'b\n';
id	select_type	table	partitions	type	possible_keys	key	key_len	ref	rows	filtered	Extra
1	SIMPLE	t1	NULL	ref	v	v	303	const	#	100.00	Using index
Warnings:
Note	1003	/* select#1 */ select count(0) AS `count(*)` from `test`.`t1` where (`test`.`t1`.`v` = 'a')
explain select * from t1 where v='a';
id	select_type	table	partitions	type	possible_keys	key	key_len	ref	rows	filtered	Extra
1	SIMPLE	t1	NULL	ref	v	v	303	const	#	100.00	NULL
Warnings:
Note	1003	/* select#1 */ select `test`.`t1`.`v` AS `v`,`test`.`t1`.`c` AS `c`,`test`.`t1`.`t` AS `t` from `test`.`t1` where (`test`.`t1`.`v` = 'a')
select v,count(*) from t1 group by v order by v limit 10;
v	count(*)
a	10
a!	1
b	10
c	10
d	10
e	10
f	10
g	10
h	10
i	10
select TRIM(v),count(t) from t1 group by v order by v limit 10;
TRIM(v)	count(t)
a	10
a!	1
b	10
c	10
d	10
e	10
f	10
g	10
h	10
i	10
select sql_big_result TRIM(v),count(t) from t1 group by v order by v limit 10;
TRIM(v)	count(t)
a	10
a!	1
b	10
c	10
d	10
e	10
f	10
g	10
h	10
i	10
alter table t1 drop key v, add key v (v(30));
show create table t1;
Table	Create Table
t1	CREATE TABLE `t1` (
  `v` varchar(300) DEFAULT NULL,
  `c` char(10) DEFAULT NULL,
  `t` text,
  KEY `c` (`c`),
  KEY `t` (`t`(10)),
  KEY `v` (`v`(30))
) /*!50100 TABLESPACE `innodb_system` */ ENGINE=InnoDB DEFAULT CHARSET=latin1 STATS_PERSISTENT=0
select count(*) from t1 where v='a';
count(*)
10
select count(*) from t1 where v='a  ';
count(*)
10
select count(*) from t1 where v between 'a' and 'a ';
count(*)
10
select count(*) from t1 where v between 'a' and 'a ' and v between 'a  ' and 'b\n';
count(*)
10
select count(*) from t1 where v like 'a%';
count(*)
11
select count(*) from t1 where v like 'a %';
count(*)
9
explain select count(*) from t1 where v='a  ';
id	select_type	table	partitions	type	possible_keys	key	key_len	ref	rows	filtered	Extra
1	SIMPLE	t1	NULL	ref	v	v	33	const	#	100.00	Using where
Warnings:
Note	1003	/* select#1 */ select count(0) AS `count(*)` from `test`.`t1` where (`test`.`t1`.`v` = 'a  ')
explain select count(*) from t1 where v like 'a%';
id	select_type	table	partitions	type	possible_keys	key	key_len	ref	rows	filtered	Extra
1	SIMPLE	t1	NULL	range	v	v	33	NULL	#	100.00	Using where; Using index
Warnings:
Note	1003	/* select#1 */ select count(0) AS `count(*)` from `test`.`t1` where (`test`.`t1`.`v` like 'a%')
explain select count(*) from t1 where v between 'a' and 'a ';
id	select_type	table	partitions	type	possible_keys	key	key_len	ref	rows	filtered	Extra
1	SIMPLE	t1	NULL	ref	v	v	33	const	#	100.00	Using where
Warnings:
Note	1003	/* select#1 */ select count(0) AS `count(*)` from `test`.`t1` where (`test`.`t1`.`v` = 'a')
explain select count(*) from t1 where v between 'a' and 'a ' and v between 'a  ' and 'b\n';
id	select_type	table	partitions	type	possible_keys	key	key_len	ref	rows	filtered	Extra
1	SIMPLE	t1	NULL	ref	v	v	33	const	#	100.00	Using where
Warnings:
Note	1003	/* select#1 */ select count(0) AS `count(*)` from `test`.`t1` where (`test`.`t1`.`v` = 'a')
explain select * from t1 where v='a';
id	select_type	table	partitions	type	possible_keys	key	key_len	ref	rows	filtered	Extra
1	SIMPLE	t1	NULL	ref	v	v	33	const	#	100.00	Using where
Warnings:
Note	1003	/* select#1 */ select `test`.`t1`.`v` AS `v`,`test`.`t1`.`c` AS `c`,`test`.`t1`.`t` AS `t` from `test`.`t1` where (`test`.`t1`.`v` = 'a')
select TRIM(v),count(*) from t1 group by v order by v limit 10;
TRIM(v)	count(*)
a	10
a!	1
b	10
c	10
d	10
e	10
f	10
g	10
h	10
i	10
select TRIM(v),count(t) from t1 group by v order by v limit 10;
TRIM(v)	count(t)
a	10
a!	1
b	10
c	10
d	10
e	10
f	10
g	10
h	10
i	10
select sql_big_result TRIM(v),count(t) from t1 group by v order by v limit 10;
TRIM(v)	count(t)
a	10
a!	1
b	10
c	10
d	10
e	10
f	10
g	10
h	10
i	10
alter table t1 modify v varchar(600), drop key v, add key v (v);
show create table t1;
Table	Create Table
t1	CREATE TABLE `t1` (
  `v` varchar(600) DEFAULT NULL,
  `c` char(10) DEFAULT NULL,
  `t` text,
  KEY `c` (`c`),
  KEY `t` (`t`(10)),
  KEY `v` (`v`)
) /*!50100 TABLESPACE `innodb_system` */ ENGINE=InnoDB DEFAULT CHARSET=latin1 STATS_PERSISTENT=0
select TRIM(v),count(*) from t1 group by v order by v limit 10;
TRIM(v)	count(*)
a	10
a!	1
b	10
c	10
d	10
e	10
f	10
g	10
h	10
i	10
select TRIM(v),count(t) from t1 group by v order by v limit 10;
TRIM(v)	count(t)
a	10
a!	1
b	10
c	10
d	10
e	10
f	10
g	10
h	10
i	10
select sql_big_result TRIM(v),count(t) from t1 group by v order by v limit 10;
TRIM(v)	count(t)
a	10
a!	1
b	10
c	10
d	10
e	10
f	10
g	10
h	10
i	10
drop table t1;
SET NAMES utf8mb4;
create table t1 (a char(10), unique (a));
insert into t1 values ('a   ');
insert into t1 values ('a ');
ERROR 23000: Duplicate entry 'a' for key 't1.a'
alter table t1 modify a varchar(10);
insert into t1 values ('a'),('á'),('à'),('å');
ERROR 23000: Duplicate entry 'a' for key 't1.a'
insert into t1 values ('á');
ERROR 23000: Duplicate entry 'á' for key 't1.a'
insert into t1 values ('A');
ERROR 23000: Duplicate entry 'A' for key 't1.a'
insert into t1 values ('å');
ERROR 23000: Duplicate entry 'å' for key 't1.a'
update t1 set a='a  ' where a like 'a%';
select concat(a,'.') from t1;
concat(a,'.')
a  .
update t1 set a='abc    ' where a like 'a ';
select concat(a,'.') from t1;
concat(a,'.')
a  .
update t1 set a='a      ' where a like 'a %';
select concat(a,'.') from t1;
concat(a,'.')
a      .
update t1 set a='a  ' where a like 'a      ';
select concat(a,'.') from t1;
concat(a,'.')
a  .
drop table t1;
SET NAMES DEFAULT;
create table t1 (v varchar(10), c char(10), t text, key(v(5)), key(c(5)), key(t(5)));
show create table t1;
Table	Create Table
t1	CREATE TABLE `t1` (
  `v` varchar(10) DEFAULT NULL,
  `c` char(10) DEFAULT NULL,
  `t` text,
  KEY `v` (`v`(5)),
  KEY `c` (`c`(5)),
  KEY `t` (`t`(5))
) ENGINE=InnoDB DEFAULT CHARSET=utf8mb4 COLLATE=utf8mb4_0900_ai_ci
drop table t1;
create table t1 (v char(10) character set utf8mb3);
Warnings:
Warning	1287	'utf8mb3' is deprecated and will be removed in a future release. Please use utf8mb4 instead
show create table t1;
Table	Create Table
t1	CREATE TABLE `t1` (
  `v` char(10) CHARACTER SET utf8mb3 COLLATE utf8mb3_general_ci DEFAULT NULL
) ENGINE=InnoDB DEFAULT CHARSET=utf8mb4 COLLATE=utf8mb4_0900_ai_ci
drop table t1;
create table t1 (v varchar(10), c char(10)) row_format=fixed;
Warnings:
Warning	1478	InnoDB: assuming ROW_FORMAT=DYNAMIC.
show create table t1;
Table	Create Table
t1	CREATE TABLE `t1` (
  `v` varchar(10) DEFAULT NULL,
  `c` char(10) DEFAULT NULL
) ENGINE=InnoDB DEFAULT CHARSET=utf8mb4 COLLATE=utf8mb4_0900_ai_ci ROW_FORMAT=DYNAMIC
insert into t1 values('a','a'),('a ','a ');
select concat('*',v,'*',c,'*') from t1;
concat('*',v,'*',c,'*')
*a*a*
*a *a*
drop table t1;
create table t1 (v varchar(65530), key(v(10))) charset latin1;
insert into t1 values(repeat('a',65530));
select length(v) from t1 where v=repeat('a',65530);
length(v)
65530
drop table t1;
create table t1(a int, b varchar(12), key ba(b, a));
insert into t1 values (1, 'A'), (20, NULL);
explain select * from t1 where a=20 and b is null;
id	select_type	table	partitions	type	possible_keys	key	key_len	ref	rows	filtered	Extra
1	SIMPLE	t1	NULL	ref	ba	ba	56	const,const	1	100.00	Using where; Using index
Warnings:
Note	1003	/* select#1 */ select `test`.`t1`.`a` AS `a`,`test`.`t1`.`b` AS `b` from `test`.`t1` where ((`test`.`t1`.`a` = 20) and (`test`.`t1`.`b` is null))
select * from t1 where a=20 and b is null;
a	b
20	NULL
drop table t1;
set session old_alter_table=0;
SET sql_mode = 'NO_ENGINE_SUBSTITUTION,STRICT_TRANS_TABLES';
Warnings:
Warning	3135	'NO_ZERO_DATE', 'NO_ZERO_IN_DATE' and 'ERROR_FOR_DIVISION_BY_ZERO' sql modes should be used with strict mode. They will be merged with strict mode in a future release.
create table t1 (v varchar(65530), key(v)) charset latin1 ROW_FORMAT=COMPACT;
Got one of the listed errors
SET sql_mode = 'NO_ENGINE_SUBSTITUTION';
create table t1 (v varchar(65536));
Warnings:
Note	1246	Converting column 'v' from VARCHAR to TEXT
show create table t1;
Table	Create Table
t1	CREATE TABLE `t1` (
  `v` mediumtext
) ENGINE=InnoDB DEFAULT CHARSET=utf8mb4 COLLATE=utf8mb4_0900_ai_ci
drop table t1;
create table t1 (v varchar(65530) character set utf8mb3);
Warnings:
Warning	1287	'utf8mb3' is deprecated and will be removed in a future release. Please use utf8mb4 instead
Note	1246	Converting column 'v' from VARCHAR to TEXT
show create table t1;
Table	Create Table
t1	CREATE TABLE `t1` (
  `v` mediumtext CHARACTER SET utf8mb3 COLLATE utf8mb3_general_ci
) ENGINE=InnoDB DEFAULT CHARSET=utf8mb4 COLLATE=utf8mb4_0900_ai_ci
drop table t1;
SET sql_mode = default;
set default_storage_engine=MyISAM;
create table t1 (v varchar(16384)) charset latin1 engine=innodb;
drop table t1;
create table t1 (a char(1), b char(1), key(a, b)) engine=innodb;
insert into t1 values ('8', '6'), ('4', '7');
select min(a) from t1;
min(a)
4
select min(b) from t1 where a='8';
min(b)
6
drop table t1;
CREATE TABLE t1 ( `a` int(11) NOT NULL auto_increment, `b` int(11) default NULL,PRIMARY KEY  (`a`),UNIQUE KEY `b` (`b`)) ENGINE=innodb;
Warnings:
Warning	1681	Integer display width is deprecated and will be removed in a future release.
Warning	1681	Integer display width is deprecated and will be removed in a future release.
insert into t1 (b) values (1);
replace into t1 (b) values (2), (1), (3);
select * from t1;
a	b
2	2
3	1
4	3
truncate table t1;
insert into t1 (b) values (1);
replace into t1 (b) values (2);
replace into t1 (b) values (1);
replace into t1 (b) values (3);
select * from t1;
a	b
2	2
3	1
4	3
drop table t1;
create table t1 (rowid int not null auto_increment, val int not null,primary
key (rowid), unique(val)) engine=innodb;
replace into t1 (val) values ('1'),('2');
replace into t1 (val) values ('1'),('2');
insert into t1 (val) values ('1'),('2');
ERROR 23000: Duplicate entry '1' for key 't1.val'
select * from t1;
rowid	val
3	1
4	2
drop table t1;
create table t1 (a int not null auto_increment primary key, val int) engine=InnoDB;
insert into t1 (val) values (1);
update t1 set a=2 where a=1;
insert into t1 (val) values (3);
select * from t1;
a	val
2	1
3	3
insert into t1 values (2, 2);
ERROR 23000: Duplicate entry '2' for key 't1.PRIMARY'
select * from t1;
a	val
2	1
3	3
drop table t1;
CREATE TABLE t1 (GRADE DECIMAL(4) NOT NULL, PRIMARY KEY (GRADE)) ENGINE=INNODB;
INSERT INTO t1 (GRADE) VALUES (151),(252),(343);
SELECT GRADE  FROM t1 WHERE GRADE > 160 AND GRADE < 300;
GRADE
252
SELECT GRADE  FROM t1 WHERE GRADE= 151;
GRADE
151
DROP TABLE t1;
create table t1 (f1 varchar(10), f2 varchar(10), primary key (f1,f2)) engine=innodb;
create table t2 (f3 varchar(10), f4 varchar(10), key (f4)) engine=innodb;
insert into t2 values ('aa','cc');
insert into t1 values ('aa','bb'),('aa','cc');
delete t1 from t1,t2 where f1=f3 and f4='cc';
select * from t1;
f1	f2
drop table t1,t2;
CREATE TABLE t1 (
id INTEGER NOT NULL AUTO_INCREMENT, PRIMARY KEY (id)
) ENGINE=InnoDB;
INSERT INTO t1 (id) VALUES (NULL);
SELECT * FROM t1;
id
1
TRUNCATE t1;
INSERT INTO t1 (id) VALUES (NULL);
SELECT * FROM t1;
id
1
DELETE FROM t1;
TRUNCATE t1;
INSERT INTO t1 (id) VALUES (NULL);
SELECT * FROM t1;
id
1
DROP TABLE t1;
CREATE TABLE t1
(
id INT PRIMARY KEY
) ENGINE=InnoDB;
CREATE TEMPORARY TABLE t2
(
id INT NOT NULL PRIMARY KEY,
b INT,
FOREIGN KEY (b) REFERENCES test.t1(id)
) ENGINE=InnoDB;
ERROR HY000: Cannot add foreign key constraint
DROP TABLE t1;
create table t1 (col1 varchar(2000), index (col1(767)))
character set = latin1 engine = innodb;
create table t2 (col1 char(255), index (col1))
character set = latin1 engine = innodb;
create table t3 (col1 binary(255), index (col1))
character set = latin1 engine = innodb;
create table t4 (col1 varchar(767), index (col1))
character set = latin1 engine = innodb;
create table t5 (col1 varchar(767) primary key)
character set = latin1 engine = innodb;
create table t6 (col1 varbinary(767) primary key)
character set = latin1 engine = innodb;
create table t7 (col1 text, index(col1(767)))
character set = latin1 engine = innodb;
create table t8 (col1 blob, index(col1(767)))
character set = latin1 engine = innodb;
drop table t1, t2, t3, t4, t5, t6, t7, t8;
CREATE TABLE t1
(
id INT PRIMARY KEY
) ENGINE=InnoDB;
CREATE TABLE t2
(
v INT,
CONSTRAINT c1 FOREIGN KEY (v) REFERENCES t1(id)
) ENGINE=InnoDB;
INSERT INTO t2 VALUES(2);
ERROR 23000: Cannot add or update a child row: a foreign key constraint fails (`test`.`t2`, CONSTRAINT `c1` FOREIGN KEY (`v`) REFERENCES `t1` (`id`))
INSERT INTO t1 VALUES(1);
INSERT INTO t2 VALUES(1);
DELETE FROM t1 WHERE id = 1;
ERROR 23000: Cannot delete or update a parent row: a foreign key constraint fails (`test`.`t2`, CONSTRAINT `c1` FOREIGN KEY (`v`) REFERENCES `t1` (`id`))
DROP TABLE t1;
ERROR HY000: Cannot drop table 't1' referenced by a foreign key constraint 'c1' on table 't2'.
SET FOREIGN_KEY_CHECKS=0;
DROP TABLE t1;
SET FOREIGN_KEY_CHECKS=1;
INSERT INTO t2 VALUES(3);
ERROR 23000: Cannot add or update a child row: a foreign key constraint fails (`test`.`t2`, CONSTRAINT `c1` FOREIGN KEY (`v`) REFERENCES `t1` (`id`))
DROP TABLE t2;
create table t1(a int not null) engine=innodb DEFAULT CHARSET=latin1;
insert into t1 values (1),(2);
set autocommit=0;
checksum table t1;
Table	Checksum
test.t1	1531596814
insert into t1 values(3);
checksum table t1;
Table	Checksum
test.t1	1531596814
commit;
checksum table t1;
Table	Checksum
test.t1	2050879373
commit;
drop table t1;
create table t1(a int not null) engine=innodb DEFAULT CHARSET=latin1;
insert into t1 values (1),(2);
set autocommit=1;
checksum table t1;
Table	Checksum
test.t1	1531596814
set autocommit=1;
insert into t1 values(3);
checksum table t1;
Table	Checksum
test.t1	2050879373
drop table t1;
set foreign_key_checks=0;
create table t2 (a int primary key, b int, foreign key (b) references t1(a)) engine = innodb;
create table t1(a char(10) primary key, b varchar(20)) engine = innodb;
ERROR HY000: Referencing column 'b' and referenced column 'a' in foreign key constraint 't2_ibfk_1' are incompatible.
set foreign_key_checks=1;
drop table t2;
set foreign_key_checks=0;
create table t1(a varchar(10) primary key) engine = innodb DEFAULT CHARSET=latin1;
create table t2 (a varchar(10), foreign key (a) references t1(a)) engine = innodb DEFAULT CHARSET=utf8mb3;
ERROR HY000: Referencing column 'a' and referenced column 'a' in foreign key constraint 't2_ibfk_1' are incompatible.
set foreign_key_checks=1;
drop table t1;
set foreign_key_checks=0;
create table t2 (a varchar(10), foreign key (a) references t1(a)) engine = innodb;
create table t1(a varchar(10) primary key) engine = innodb;
alter table t1 modify column a int;
ERROR HY000: Referencing column 'a' and referenced column 'a' in foreign key constraint 't2_ibfk_1' are incompatible.
set foreign_key_checks=1;
drop table t2,t1;
set foreign_key_checks=0;
create table t2 (a varchar(10), foreign key (a) references t1(a)) engine = innodb DEFAULT CHARSET=latin1;
create table t1(a varchar(10) primary key) engine = innodb DEFAULT CHARSET=latin1;
alter table t1 convert to character set utf8mb3;
Warnings:
Warning	1287	'utf8mb3' is deprecated and will be removed in a future release. Please use utf8mb4 instead
set foreign_key_checks=1;
drop table t2,t1;
set foreign_key_checks=0;
create table t2 (a varchar(10), foreign key (a) references t1(a)) engine = innodb DEFAULT CHARSET=latin1;
create table t3(a varchar(10) primary key) engine = innodb DEFAULT CHARSET=utf8mb3;
Warnings:
Warning	1287	'utf8mb3' is deprecated and will be removed in a future release. Please use utf8mb4 instead
rename table t3 to t1;
ERROR HY000: Referencing column 'a' and referenced column 'a' in foreign key constraint 't2_ibfk_1' are incompatible.
set foreign_key_checks=1;
drop table t2,t3;
create table t1(a int primary key) row_format=redundant engine=innodb;
create table t2(a int primary key,constraint foreign key(a)references t1(a)) row_format=compact engine=innodb;
create table t3(a int primary key) row_format=compact engine=innodb;
create table t4(a int primary key,constraint foreign key(a)references t3(a)) row_format=redundant engine=innodb;
insert into t1 values(1);
insert into t3 values(1);
insert into t2 values(2);
ERROR 23000: Cannot add or update a child row: a foreign key constraint fails (`test`.`t2`, CONSTRAINT `t2_ibfk_1` FOREIGN KEY (`a`) REFERENCES `t1` (`a`))
insert into t4 values(2);
ERROR 23000: Cannot add or update a child row: a foreign key constraint fails (`test`.`t4`, CONSTRAINT `t4_ibfk_1` FOREIGN KEY (`a`) REFERENCES `t3` (`a`))
insert into t2 values(1);
insert into t4 values(1);
update t1 set a=2;
ERROR 23000: Cannot delete or update a parent row: a foreign key constraint fails (`test`.`t2`, CONSTRAINT `t2_ibfk_1` FOREIGN KEY (`a`) REFERENCES `t1` (`a`))
update t2 set a=2;
ERROR 23000: Cannot add or update a child row: a foreign key constraint fails (`test`.`t2`, CONSTRAINT `t2_ibfk_1` FOREIGN KEY (`a`) REFERENCES `t1` (`a`))
update t3 set a=2;
ERROR 23000: Cannot delete or update a parent row: a foreign key constraint fails (`test`.`t4`, CONSTRAINT `t4_ibfk_1` FOREIGN KEY (`a`) REFERENCES `t3` (`a`))
update t4 set a=2;
ERROR 23000: Cannot add or update a child row: a foreign key constraint fails (`test`.`t4`, CONSTRAINT `t4_ibfk_1` FOREIGN KEY (`a`) REFERENCES `t3` (`a`))
truncate t1;
ERROR 42000: Cannot truncate a table referenced in a foreign key constraint (`test`.`t2`, CONSTRAINT `t2_ibfk_1`)
truncate t3;
ERROR 42000: Cannot truncate a table referenced in a foreign key constraint (`test`.`t4`, CONSTRAINT `t4_ibfk_1`)
truncate t2;
truncate t4;
truncate t1;
ERROR 42000: Cannot truncate a table referenced in a foreign key constraint (`test`.`t2`, CONSTRAINT `t2_ibfk_1`)
truncate t3;
ERROR 42000: Cannot truncate a table referenced in a foreign key constraint (`test`.`t4`, CONSTRAINT `t4_ibfk_1`)
drop table t4,t3,t2,t1;
SET sql_mode = 'NO_ENGINE_SUBSTITUTION';
create table t1 (s1 varbinary(2),primary key (s1)) engine=innodb;
create table t2 (s1 binary(2),primary key (s1)) engine=innodb;
create table t3 (s1 varchar(2) binary,primary key (s1)) engine=innodb;
Warnings:
Warning	1287	'BINARY as attribute of a type' is deprecated and will be removed in a future release. Please use a CHARACTER SET clause with _bin collation instead
create table t4 (s1 char(2) binary,primary key (s1)) engine=innodb;
Warnings:
Warning	1287	'BINARY as attribute of a type' is deprecated and will be removed in a future release. Please use a CHARACTER SET clause with _bin collation instead
insert into t1 values (0x41),(0x4120),(0x4100);
insert into t2 values (0x41),(0x4120),(0x4100);
ERROR 23000: Duplicate entry 'A' for key 't2.PRIMARY'
insert into t2 values (0x41),(0x4120);
insert into t3 values (0x41),(0x4120),(0x4100);
ERROR 23000: Duplicate entry 'A ' for key 't3.PRIMARY'
insert into t3 values (0x41),(0x4100);
insert into t4 values (0x41),(0x4120),(0x4100);
ERROR 23000: Duplicate entry 'A' for key 't4.PRIMARY'
insert into t4 values (0x41),(0x4100);
select hex(s1) from t1;
hex(s1)
41
4100
4120
select hex(s1) from t2;
hex(s1)
4100
4120
select hex(s1) from t3;
hex(s1)
4100
41
select hex(s1) from t4;
hex(s1)
4100
41
drop table t1,t2,t3,t4;
create table t1 (a int primary key,s1 varbinary(3) not null unique) engine=innodb;
create table t2 (s1 binary(2) not null, constraint c foreign key(s1) references t1(s1) on update cascade) engine=innodb;
insert into t1 values(1,0x4100),(2,0x41),(3,0x4120),(4,0x42);
insert into t2 values(0x42);
ERROR 23000: Cannot add or update a child row: a foreign key constraint fails (`test`.`t2`, CONSTRAINT `c` FOREIGN KEY (`s1`) REFERENCES `t1` (`s1`) ON UPDATE CASCADE)
insert into t2 values(0x41);
select hex(s1) from t2;
hex(s1)
4100
update t1 set s1=0x123456 where a=2;
select hex(s1) from t2;
hex(s1)
4100
update t1 set s1=0x12 where a=1;
ERROR 23000: Cannot delete or update a parent row: a foreign key constraint fails (`test`.`t2`, CONSTRAINT `c` FOREIGN KEY (`s1`) REFERENCES `t1` (`s1`) ON UPDATE CASCADE)
update t1 set s1=0x12345678 where a=1;
ERROR 23000: Cannot delete or update a parent row: a foreign key constraint fails (`test`.`t2`, CONSTRAINT `c` FOREIGN KEY (`s1`) REFERENCES `t1` (`s1`) ON UPDATE CASCADE)
update t1 set s1=0x123457 where a=1;
ERROR 23000: Cannot delete or update a parent row: a foreign key constraint fails (`test`.`t2`, CONSTRAINT `c` FOREIGN KEY (`s1`) REFERENCES `t1` (`s1`) ON UPDATE CASCADE)
update t1 set s1=0x1220 where a=1;
select hex(s1) from t2;
hex(s1)
1220
update t1 set s1=0x1200 where a=1;
select hex(s1) from t2;
hex(s1)
1200
update t1 set s1=0x4200 where a=1;
select hex(s1) from t2;
hex(s1)
4200
delete from t1 where a=1;
ERROR 23000: Cannot delete or update a parent row: a foreign key constraint fails (`test`.`t2`, CONSTRAINT `c` FOREIGN KEY (`s1`) REFERENCES `t1` (`s1`) ON UPDATE CASCADE)
delete from t1 where a=2;
update t2 set s1=0x4120;
delete from t1;
ERROR 23000: Cannot delete or update a parent row: a foreign key constraint fails (`test`.`t2`, CONSTRAINT `c` FOREIGN KEY (`s1`) REFERENCES `t1` (`s1`) ON UPDATE CASCADE)
delete from t1 where a!=3;
select a,hex(s1) from t1;
a	hex(s1)
3	4120
select hex(s1) from t2;
hex(s1)
4120
drop table t2,t1;
create table t1 (a int primary key,s1 varchar(2) binary not null unique) engine=innodb;
Warnings:
Warning	1287	'BINARY as attribute of a type' is deprecated and will be removed in a future release. Please use a CHARACTER SET clause with _bin collation instead
create table t2 (s1 char(2) binary not null, constraint c foreign key(s1) references t1(s1) on update cascade) engine=innodb;
Warnings:
Warning	1287	'BINARY as attribute of a type' is deprecated and will be removed in a future release. Please use a CHARACTER SET clause with _bin collation instead
insert into t1 values(1,0x4100),(2,0x41);
insert into t2 values(0x41);
select hex(s1) from t2;
hex(s1)
41
update t1 set s1=0x1234 where a=1;
select hex(s1) from t2;
hex(s1)
41
update t1 set s1=0x12 where a=2;
select hex(s1) from t2;
hex(s1)
12
delete from t1 where a=1;
delete from t1 where a=2;
ERROR 23000: Cannot delete or update a parent row: a foreign key constraint fails (`test`.`t2`, CONSTRAINT `c` FOREIGN KEY (`s1`) REFERENCES `t1` (`s1`) ON UPDATE CASCADE)
select a,hex(s1) from t1;
a	hex(s1)
2	12
select hex(s1) from t2;
hex(s1)
12
drop table t2,t1;
CREATE TABLE t1(a INT, PRIMARY KEY(a)) ENGINE=InnoDB;
CREATE TABLE t2(a INT) ENGINE=InnoDB;
ALTER TABLE t2 ADD FOREIGN KEY (a) REFERENCES t1(a);
ALTER TABLE t2 DROP FOREIGN KEY t2_ibfk_1;
ALTER TABLE t2 ADD CONSTRAINT t2_ibfk_0 FOREIGN KEY (a) REFERENCES t1(a);
ALTER TABLE t2 DROP FOREIGN KEY t2_ibfk_0;
SHOW CREATE TABLE t2;
Table	Create Table
t2	CREATE TABLE `t2` (
  `a` int DEFAULT NULL,
  KEY `t2_ibfk_0` (`a`)
) /*!50100 TABLESPACE `innodb_system` */ ENGINE=InnoDB DEFAULT CHARSET=utf8mb4 COLLATE=utf8mb4_0900_ai_ci
DROP TABLE t2,t1;
SET sql_mode = default;
SET restrict_fk_on_non_standard_key=OFF;
Warnings:
Warning	4166	'restrict_fk_on_non_standard_key' is deprecated and will be removed in a future release. Foreign key referring to non-unique or partial keys is unsafe and may break replication.
CREATE TABLE t1 (
field1 varchar(8) NOT NULL DEFAULT '',
field2 varchar(8) NOT NULL DEFAULT '',
PRIMARY KEY  (field1, field2)
) ENGINE=InnoDB;
CREATE TABLE t2 (
field1 varchar(8) NOT NULL DEFAULT '' PRIMARY KEY,
FOREIGN KEY (field1) REFERENCES t1 (field1)
ON DELETE CASCADE ON UPDATE CASCADE
) ENGINE=InnoDB;
Warnings:
Warning	6124	Foreign key 't2_ibfk_1' refers to non-unique key or partial key. This is deprecated and will be removed in a future release.
INSERT INTO t1 VALUES ('old', 'somevalu');
INSERT INTO t1 VALUES ('other', 'anyvalue');
INSERT INTO t2 VALUES ('old');
INSERT INTO t2 VALUES ('other');
UPDATE t1 SET field1 = 'other' WHERE field2 = 'somevalu';
ERROR 23000: Foreign key constraint for table 't1', record 'other-somevalu' would lead to a duplicate entry in table 't2', key 'PRIMARY'
DROP TABLE t2;
DROP TABLE t1;
SET restrict_fk_on_non_standard_key=ON;
Warnings:
Warning	1681	'restrict_fk_on_non_standard_key' is deprecated and will be removed in a future release.
create table t1 (
c1 bigint not null,
c2 bigint not null,
primary key (c1),
unique  key (c2)
) engine=innodb;
create table t2 (
c1 bigint not null,
primary key (c1)
) engine=innodb;
alter table t1 add constraint c2_fk foreign key (c2)
references t2(c1) on delete cascade;
show create table t1;
Table	Create Table
t1	CREATE TABLE `t1` (
  `c1` bigint NOT NULL,
  `c2` bigint NOT NULL,
  PRIMARY KEY (`c1`),
  UNIQUE KEY `c2` (`c2`),
  CONSTRAINT `c2_fk` FOREIGN KEY (`c2`) REFERENCES `t2` (`c1`) ON DELETE CASCADE
) /*!50100 TABLESPACE `innodb_system` */ ENGINE=InnoDB DEFAULT CHARSET=utf8mb4 COLLATE=utf8mb4_0900_ai_ci
alter table t1 drop foreign key c2_fk;
show create table t1;
Table	Create Table
t1	CREATE TABLE `t1` (
  `c1` bigint NOT NULL,
  `c2` bigint NOT NULL,
  PRIMARY KEY (`c1`),
  UNIQUE KEY `c2` (`c2`)
) /*!50100 TABLESPACE `innodb_system` */ ENGINE=InnoDB DEFAULT CHARSET=utf8mb4 COLLATE=utf8mb4_0900_ai_ci
drop table t1, t2;
create table t1(a date) engine=innodb;
create table t2(a date, key(a)) engine=innodb;
insert into t1 values('2005-10-01');
insert into t2 values('2005-10-01');
select * from t1, t2
where t2.a between t1.a - interval 2 day and t1.a + interval 2 day;
a	a
2005-10-01	2005-10-01
drop table t1, t2;
create table t1 (id int not null, f_id int not null, f int not null,
primary key(f_id, id)) engine=innodb;
create table t2 (id int not null,s_id int not null,s varchar(200),
primary key(id)) engine=innodb;
INSERT INTO t1 VALUES (8, 1, 3);
INSERT INTO t1 VALUES (1, 2, 1);
INSERT INTO t2 VALUES (1, 0, '');
INSERT INTO t2 VALUES (8, 1, '');
commit;
DELETE ml.* FROM t1 AS ml LEFT JOIN t2 AS mm ON (mm.id=ml.id)
WHERE mm.id IS NULL;
select ml.* from t1 as ml left join t2 as mm on (mm.id=ml.id)
where mm.id is null lock in share mode;
id	f_id	f
drop table t1,t2;
create table t1(a int not null, b int, primary key(a)) engine=innodb;
insert into t1 values(1,1),(2,2),(3,1),(4,2),(5,1),(6,2),(7,3);
commit;
SET binlog_format='MIXED';
Warnings:
Warning	1287	'@@binlog_format' is deprecated and will be removed in a future release.
set autocommit = 0;
SET SESSION TRANSACTION ISOLATION LEVEL READ COMMITTED;
update t1 set b = 5 where b = 1;
SET binlog_format='MIXED';
Warnings:
Warning	1287	'@@binlog_format' is deprecated and will be removed in a future release.
set autocommit = 0;
SET SESSION TRANSACTION ISOLATION LEVEL READ COMMITTED;
select * from t1 where a = 7 and b = 3 for update;
a	b
7	3
commit;
commit;
drop table t1;
create table t1(a int not null, b int, primary key(a)) engine=innodb;
insert into t1 values(1,1),(2,2),(3,1),(4,2),(5,1),(6,2);
commit;
set autocommit = 0;
select * from t1 lock in share mode;
a	b
1	1
2	2
3	1
4	2
5	1
6	2
update t1 set b = 5 where b = 1;
set autocommit = 0;
select * from t1 where a = 2 and b = 2 for update;
ERROR HY000: Lock wait timeout exceeded; try restarting transaction
commit;
commit;
drop table t1;
create table t1(a int not null, b int, primary key(a)) engine=innodb;
insert into t1 values (1,2),(5,3),(4,2);
create table t2(d int not null, e int, primary key(d)) engine=innodb;
insert into t2 values (8,6),(12,1),(3,1);
commit;
set autocommit = 0;
select * from t2 for update;
d	e
3	1
8	6
12	1
SET binlog_format='MIXED';
Warnings:
Warning	1287	'@@binlog_format' is deprecated and will be removed in a future release.
set autocommit = 0;
SET SESSION TRANSACTION ISOLATION LEVEL READ COMMITTED;
insert into t1 select * from t2;
update t1 set b = (select e from t2 where a = d);
create table t3(d int not null, e int, primary key(d)) engine=innodb
select * from t2;
commit;
commit;
drop table t1, t2, t3;
create table t1(a int not null, b int, primary key(a)) engine=innodb;
insert into t1 values (1,2),(5,3),(4,2);
create table t2(a int not null, b int, primary key(a)) engine=innodb;
insert into t2 values (8,6),(12,1),(3,1);
create table t3(d int not null, b int, primary key(d)) engine=innodb;
insert into t3 values (8,6),(12,1),(3,1);
create table t5(a int not null, b int, primary key(a)) engine=innodb;
insert into t5 values (1,2),(5,3),(4,2);
create table t6(d int not null, e int, primary key(d)) engine=innodb;
insert into t6 values (8,6),(12,1),(3,1);
create table t8(a int not null, b int, primary key(a)) engine=innodb;
insert into t8 values (1,2),(5,3),(4,2);
create table t9(d int not null, e int, primary key(d)) engine=innodb;
insert into t9 values (8,6),(12,1),(3,1);
commit;
set autocommit = 0;
select * from t2 for update;
a	b
3	1
8	6
12	1
SET binlog_format='MIXED';
Warnings:
Warning	1287	'@@binlog_format' is deprecated and will be removed in a future release.
set autocommit = 0;
SET SESSION TRANSACTION ISOLATION LEVEL SERIALIZABLE;
insert into t1 select * from t2;
SET binlog_format='MIXED';
Warnings:
Warning	1287	'@@binlog_format' is deprecated and will be removed in a future release.
set autocommit = 0;
SET SESSION TRANSACTION ISOLATION LEVEL SERIALIZABLE;
update t3 set b = (select b from t2 where a = d);
SET binlog_format='MIXED';
Warnings:
Warning	1287	'@@binlog_format' is deprecated and will be removed in a future release.
set autocommit = 0;
SET SESSION TRANSACTION ISOLATION LEVEL SERIALIZABLE;
create table t4(a int not null, b int, primary key(a)) engine=innodb select * from t2;
SET binlog_format='MIXED';
Warnings:
Warning	1287	'@@binlog_format' is deprecated and will be removed in a future release.
set autocommit = 0;
SET SESSION TRANSACTION ISOLATION LEVEL READ COMMITTED;
insert into t5 (select * from t2 lock in share mode);
SET binlog_format='MIXED';
Warnings:
Warning	1287	'@@binlog_format' is deprecated and will be removed in a future release.
set autocommit = 0;
SET SESSION TRANSACTION ISOLATION LEVEL READ COMMITTED;
update t6 set e = (select b from t2 where a = d lock in share mode);
SET binlog_format='MIXED';
Warnings:
Warning	1287	'@@binlog_format' is deprecated and will be removed in a future release.
set autocommit = 0;
SET SESSION TRANSACTION ISOLATION LEVEL READ COMMITTED;
create table t7(a int not null, b int, primary key(a)) engine=innodb select * from t2 lock in share mode;
SET binlog_format='MIXED';
Warnings:
Warning	1287	'@@binlog_format' is deprecated and will be removed in a future release.
set autocommit = 0;
SET SESSION TRANSACTION ISOLATION LEVEL READ COMMITTED;
insert into t8 (select * from t2 for update);
SET binlog_format='MIXED';
Warnings:
Warning	1287	'@@binlog_format' is deprecated and will be removed in a future release.
set autocommit = 0;
SET SESSION TRANSACTION ISOLATION LEVEL READ COMMITTED;
update t9 set e = (select b from t2 where a = d for update);
SET binlog_format='MIXED';
Warnings:
Warning	1287	'@@binlog_format' is deprecated and will be removed in a future release.
set autocommit = 0;
SET SESSION TRANSACTION ISOLATION LEVEL READ COMMITTED;
create table t10(a int not null, b int, primary key(a)) engine=innodb select * from t2 for update;
ERROR HY000: Lock wait timeout exceeded; try restarting transaction
ERROR HY000: Lock wait timeout exceeded; try restarting transaction
ERROR HY000: Lock wait timeout exceeded; try restarting transaction
ERROR HY000: Lock wait timeout exceeded; try restarting transaction
ERROR HY000: Lock wait timeout exceeded; try restarting transaction
ERROR HY000: Lock wait timeout exceeded; try restarting transaction
ERROR HY000: Lock wait timeout exceeded; try restarting transaction
ERROR HY000: Lock wait timeout exceeded; try restarting transaction
ERROR HY000: Can't update table 't2' while 't10' is being created.
commit;
drop table t1, t2, t3, t5, t6, t8, t9;
CREATE TABLE t1 (DB_ROW_ID int) engine=innodb;
ERROR 42000: Incorrect column name 'DB_ROW_ID'
CREATE TABLE t1 (
a BIGINT(20) NOT NULL,
PRIMARY KEY  (a)
) ENGINE=INNODB DEFAULT CHARSET=utf8mb3;
Warnings:
Warning	1681	Integer display width is deprecated and will be removed in a future release.
Warning	1287	'utf8mb3' is deprecated and will be removed in a future release. Please use utf8mb4 instead
CREATE TABLE t2 (
a BIGINT(20) NOT NULL,
b VARCHAR(128) NOT NULL,
c TEXT NOT NULL,
PRIMARY KEY  (a,b),
KEY idx_t2_b_c (b,c(100)),
CONSTRAINT t_fk FOREIGN KEY (a) REFERENCES t1 (a)
ON DELETE CASCADE
) ENGINE=INNODB DEFAULT CHARSET=utf8mb3;
Warnings:
Warning	1681	Integer display width is deprecated and will be removed in a future release.
Warning	1287	'utf8mb3' is deprecated and will be removed in a future release. Please use utf8mb4 instead
INSERT INTO t1 VALUES (1);
INSERT INTO t2 VALUES (1, 'bar', 'vbar');
INSERT INTO t2 VALUES (1, 'BAR2', 'VBAR');
INSERT INTO t2 VALUES (1, 'bar_bar', 'bibi');
INSERT INTO t2 VALUES (1, 'customer_over', '1');
SELECT * FROM t2 WHERE b = 'customer_over';
a	b	c
1	customer_over	1
SELECT * FROM t2 WHERE BINARY b = 'customer_over';
a	b	c
1	customer_over	1
Warnings:
Warning	1287	'BINARY expr' is deprecated and will be removed in a future release. Please use CAST instead
SELECT DISTINCT p0.a FROM t2 p0 WHERE p0.b = 'customer_over';
a
1
/* Bang: Empty result set, above was expected: */
SELECT DISTINCT p0.a FROM t2 p0 WHERE BINARY p0.b = 'customer_over';
a
1
Warnings:
Warning	1287	'BINARY expr' is deprecated and will be removed in a future release. Please use CAST instead
SELECT p0.a FROM t2 p0 WHERE BINARY p0.b = 'customer_over';
a
1
Warnings:
Warning	1287	'BINARY expr' is deprecated and will be removed in a future release. Please use CAST instead
drop table t2, t1;
CREATE TABLE t1 ( a int ) ENGINE=innodb;
BEGIN;
INSERT INTO t1 VALUES (1);
OPTIMIZE TABLE t1;
Table	Op	Msg_type	Msg_text
test.t1	optimize	note	Table does not support optimize, doing recreate + analyze instead
test.t1	optimize	status	OK
DROP TABLE t1;
SET restrict_fk_on_non_standard_key=OFF;
Warnings:
Warning	4166	'restrict_fk_on_non_standard_key' is deprecated and will be removed in a future release. Foreign key referring to non-unique or partial keys is unsafe and may break replication.
CREATE TABLE t1 (id int PRIMARY KEY, f int NOT NULL, INDEX(f)) ENGINE=InnoDB;
CREATE TABLE t2 (id int PRIMARY KEY, f INT NOT NULL,
CONSTRAINT t2_t1 FOREIGN KEY (id) REFERENCES t1 (id)
ON DELETE CASCADE ON UPDATE CASCADE) ENGINE=InnoDB;
ALTER TABLE t2 ADD FOREIGN KEY (f) REFERENCES t1 (f) ON
DELETE CASCADE ON UPDATE CASCADE;
Warnings:
Warning	6124	Foreign key 't2_ibfk_1' refers to non-unique key or partial key. This is deprecated and will be removed in a future release.
SHOW CREATE TABLE t2;
Table	Create Table
t2	CREATE TABLE `t2` (
  `id` int NOT NULL,
  `f` int NOT NULL,
  PRIMARY KEY (`id`),
  KEY `f` (`f`),
  CONSTRAINT `t2_ibfk_1` FOREIGN KEY (`f`) REFERENCES `t1` (`f`) ON DELETE CASCADE ON UPDATE CASCADE,
  CONSTRAINT `t2_t1` FOREIGN KEY (`id`) REFERENCES `t1` (`id`) ON DELETE CASCADE ON UPDATE CASCADE
) /*!50100 TABLESPACE `innodb_system` */ ENGINE=InnoDB DEFAULT CHARSET=utf8mb4 COLLATE=utf8mb4_0900_ai_ci
DROP TABLE t2, t1;
CREATE TABLE t1 (a INT, INDEX(a)) ENGINE=InnoDB;
CREATE TABLE t2 (a INT, INDEX(a)) ENGINE=InnoDB;
INSERT INTO t1 VALUES (1);
INSERT INTO t2 VALUES (1);
ALTER TABLE t2 ADD FOREIGN KEY (a) REFERENCES t1 (a) ON DELETE SET NULL;
Warnings:
Warning	6124	Foreign key 't2_ibfk_1' refers to non-unique key or partial key. This is deprecated and will be removed in a future release.
ALTER TABLE t2 MODIFY a INT NOT NULL;
ERROR HY000: Column 'a' cannot be NOT NULL: needed in a foreign key constraint 't2_ibfk_1' SET NULL
DELETE FROM t1;
DROP TABLE t2,t1;
SET restrict_fk_on_non_standard_key=ON;
Warnings:
Warning	1681	'restrict_fk_on_non_standard_key' is deprecated and will be removed in a future release.
CREATE TABLE t1 (a VARCHAR(5) COLLATE utf8mb3_unicode_ci PRIMARY KEY)
ENGINE=InnoDB;
Warnings:
Warning	3778	'utf8mb3_unicode_ci' is a collation of the deprecated character set UTF8MB3. Please consider using UTF8MB4 with an appropriate collation instead.
INSERT INTO t1 VALUES (0xEFBCA4EFBCA4EFBCA4);
DELETE FROM t1;
INSERT INTO t1 VALUES ('DDD');
SELECT * FROM t1;
a
DDD
DROP TABLE t1;
CREATE TABLE t1 (id int PRIMARY KEY AUTO_INCREMENT) ENGINE=InnoDB
AUTO_INCREMENT=42;
INSERT INTO t1 VALUES (0),(347),(0);
SELECT * FROM t1;
id
42
347
348
SHOW CREATE TABLE t1;
Table	Create Table
t1	CREATE TABLE `t1` (
  `id` int NOT NULL AUTO_INCREMENT,
  PRIMARY KEY (`id`)
) ENGINE=InnoDB AUTO_INCREMENT=349 DEFAULT CHARSET=utf8mb4 COLLATE=utf8mb4_0900_ai_ci
CREATE TABLE t2 (id int PRIMARY KEY) ENGINE=InnoDB;
INSERT INTO t2 VALUES(42),(347),(348);
ALTER TABLE t1 ADD CONSTRAINT t1_t2 FOREIGN KEY (id) REFERENCES t2(id);
SHOW CREATE TABLE t1;
Table	Create Table
t1	CREATE TABLE `t1` (
  `id` int NOT NULL AUTO_INCREMENT,
  PRIMARY KEY (`id`),
  CONSTRAINT `t1_t2` FOREIGN KEY (`id`) REFERENCES `t2` (`id`)
) /*!50100 TABLESPACE `innodb_system` */ ENGINE=InnoDB AUTO_INCREMENT=349 DEFAULT CHARSET=utf8mb4 COLLATE=utf8mb4_0900_ai_ci
DROP TABLE t1,t2;
SET innodb_strict_mode=ON;
CREATE TABLE t1 (
c01 CHAR(255), c02 CHAR(255), c03 CHAR(255), c04 CHAR(255),
c05 CHAR(255), c06 CHAR(255), c07 CHAR(255), c08 CHAR(255),
c09 CHAR(255), c10 CHAR(255), c11 CHAR(255), c12 CHAR(255),
c13 CHAR(255), c14 CHAR(255), c15 CHAR(255), c16 CHAR(255),
c17 CHAR(255), c18 CHAR(255), c19 CHAR(255), c20 CHAR(255),
c21 CHAR(255), c22 CHAR(255), c23 CHAR(255), c24 CHAR(255),
c25 CHAR(255), c26 CHAR(255), c27 CHAR(255), c28 CHAR(255),
c29 CHAR(255), c30 CHAR(255), c31 CHAR(255), c32 CHAR(255)
) charset latin1 ENGINE = InnoDB;
ERROR 42000: Row size too large (> {checked_valid}). Changing some columns to TEXT or BLOB may help. In current row format, BLOB prefix of 0 bytes is stored inline.
SET innodb_strict_mode=OFF;
DROP TABLE IF EXISTS t1;
Warnings:
Note	1051	Unknown table 'test.t1'
CREATE TABLE t1(
id BIGINT(20) NOT NULL AUTO_INCREMENT PRIMARY KEY
) ENGINE=InnoDB;
Warnings:
Warning	1681	Integer display width is deprecated and will be removed in a future release.
INSERT INTO t1 VALUES(-10);
SELECT * FROM t1;
id
-10
INSERT INTO t1 VALUES(NULL);
SELECT * FROM t1;
id
-10
1
DROP TABLE t1;
create table t1 (i int, j int) engine=innodb;
insert into t1 (i, j) values (1, 1), (2, 2);
update t1 set j = 2;
affected rows: 1
info: Rows matched: 2  Changed: 1  Warnings: 0
drop table t1;
create table t1 (id int) comment='this is a comment' engine=innodb;
analyze table t1;
Table	Op	Msg_type	Msg_text
test.t1	analyze	status	OK
select table_comment, data_free > 0 as data_free_is_set
from information_schema.tables
where table_schema='test' and table_name = 't1';
TABLE_COMMENT	data_free_is_set
this is a comment	1
drop table t1;
CREATE TABLE t1 (
c1 INT(10) UNSIGNED NOT NULL AUTO_INCREMENT,
c2 VARCHAR(128) NOT NULL,
PRIMARY KEY(c1)
) ENGINE=InnoDB DEFAULT CHARSET=utf8mb3 AUTO_INCREMENT=100;
Warnings:
Warning	1681	Integer display width is deprecated and will be removed in a future release.
Warning	1287	'utf8mb3' is deprecated and will be removed in a future release. Please use utf8mb4 instead
CREATE TABLE t2 (
c1 INT(10) UNSIGNED NOT NULL AUTO_INCREMENT,
c2 INT(10) UNSIGNED DEFAULT NULL,
PRIMARY KEY(c1)
) ENGINE=InnoDB DEFAULT CHARSET=utf8mb3 AUTO_INCREMENT=200;
Warnings:
Warning	1681	Integer display width is deprecated and will be removed in a future release.
Warning	1681	Integer display width is deprecated and will be removed in a future release.
Warning	1287	'utf8mb3' is deprecated and will be removed in a future release. Please use utf8mb4 instead
ANALYZE TABLE t2;
Table	Op	Msg_type	Msg_text
test.t2	analyze	status	OK
SELECT AUTO_INCREMENT FROM INFORMATION_SCHEMA.TABLES WHERE table_name = 't2';
AUTO_INCREMENT
200
ALTER TABLE t2 ADD CONSTRAINT t1_t2_1 FOREIGN KEY(c1) REFERENCES t1(c1);
ANALYZE TABLE t2;
Table	Op	Msg_type	Msg_text
test.t2	analyze	status	OK
SELECT AUTO_INCREMENT FROM INFORMATION_SCHEMA.TABLES WHERE table_name = 't2';
AUTO_INCREMENT
200
DROP TABLE t2;
DROP TABLE t1;
CREATE TABLE t1 (c1 int default NULL,
c2 int default NULL
) ENGINE=InnoDB DEFAULT CHARSET=latin1;
TRUNCATE TABLE t1;
affected rows: 0
INSERT INTO t1 VALUES (1, 1), (2, 2), (3, 3), (4, 4), (5, 5);
affected rows: 5
info: Records: 5  Duplicates: 0  Warnings: 0
TRUNCATE TABLE t1;
affected rows: 0
DROP TABLE t1;
Variable_name	Value
Handler_update	10
Variable_name	Value
Handler_delete	0
Variable_name	Value
Handler_update	11
Variable_name	Value
Handler_delete	1
DROP TABLE bug58912;
create table t1 (f1 integer primary key) engine=innodb;
flush status;
show status like "handler_read_key";
Variable_name	Value
Handler_read_key	0
select f1 from t1;
f1
show status like "handler_read_key";
Variable_name	Value
Handler_read_key	1
drop table t1;
CREATE TABLE t1 (c1 INT) ENGINE=InnoDB;
CREATE TEMPORARY TABLE t2 (c1 INT) ENGINE=InnoDB;
START TRANSACTION READ ONLY;
INSERT INTO t2 VALUES(0);
INSERT INTO t1 VALUES(0);
ERROR 25006: Cannot execute statement in a READ ONLY transaction.
ROLLBACK;
SELECT * FROM t1;
c1
SELECT * FROM t2;
c1
START TRANSACTION READ ONLY;
INSERT INTO t1 VALUES(0);
ERROR 25006: Cannot execute statement in a READ ONLY transaction.
INSERT INTO t2 VALUES(1);
COMMIT;
SET TRANSACTION READ ONLY;
START TRANSACTION;
INSERT INTO t2 VALUES(3);
INSERT INTO t1 VALUES(0);
ERROR 25006: Cannot execute statement in a READ ONLY transaction.
COMMIT;
SELECT * FROM t1;
c1
SELECT * FROM t2;
c1
1
3
DROP TABLE t2;
CREATE TEMPORARY TABLE t2 (
c1 INT AUTO_INCREMENT PRIMARY KEY,
c2 INT, INDEX idx(c2)) ENGINE=InnoDB;
SHOW CREATE TABLE t2;
Table	Create Table
t2	CREATE TEMPORARY TABLE `t2` (
  `c1` int NOT NULL AUTO_INCREMENT,
  `c2` int DEFAULT NULL,
  PRIMARY KEY (`c1`),
  KEY `idx` (`c2`)
) ENGINE=InnoDB DEFAULT CHARSET=utf8mb4 COLLATE=utf8mb4_0900_ai_ci
START TRANSACTION READ ONLY;
INSERT INTO t2 VALUES(NULL,1),(NULL,2),(NULL,3);
INSERT INTO t1 VALUES(0);
ERROR 25006: Cannot execute statement in a READ ONLY transaction.
ROLLBACK;
SELECT * FROM t1;
c1
SELECT * FROM t2;
c1	c2
START TRANSACTION READ ONLY;
INSERT INTO t1 VALUES(0);
ERROR 25006: Cannot execute statement in a READ ONLY transaction.
INSERT INTO t2 VALUES(NULL,1),(NULL,2),(NULL,3);
COMMIT;
SET TRANSACTION READ ONLY;
START TRANSACTION;
INSERT INTO t2 VALUES(NULL,1),(NULL,2),(NULL,3);
INSERT INTO t1 VALUES(0);
ERROR 25006: Cannot execute statement in a READ ONLY transaction.
COMMIT;
SHOW CREATE TABLE t2;
Table	Create Table
t2	CREATE TEMPORARY TABLE `t2` (
  `c1` int NOT NULL AUTO_INCREMENT,
  `c2` int DEFAULT NULL,
  PRIMARY KEY (`c1`),
  KEY `idx` (`c2`)
) ENGINE=InnoDB AUTO_INCREMENT=10 DEFAULT CHARSET=utf8mb4 COLLATE=utf8mb4_0900_ai_ci
SELECT * FROM t1;
c1
SELECT * FROM t2;
c1	c2
4	1
5	2
6	3
7	1
8	2
9	3
DROP TABLE t1;
DROP TABLE t2;
count_alloc WHERE event_name like 'memory/innodb/other'
count_alloc
0
SET @old_log_bin_trust_function_creators= @@global.log_bin_trust_function_creators;
Warnings:
Warning	1287	'@@log_bin_trust_function_creators' is deprecated and will be removed in a future release.
SET GLOBAL log_bin_trust_function_creators = 1;
Warnings:
Warning	1287	'@@log_bin_trust_function_creators' is deprecated and will be removed in a future release.
create table t1 (col1 integer primary key, col2 integer) engine=innodb;
insert t1 values (1,100);
create function f1 () returns integer begin
declare var1 int;
select col2 into var1 from t1 where col1=1 for update;
return var1;
end|
start transaction;
select f1();
f1()
100
update t1 set col2=0 where col1=1;
select * from t1;
col1	col2
1	100
rollback;
rollback;
drop table t1;
drop function f1;
SET @@global.log_bin_trust_function_creators= @old_log_bin_trust_function_creators;
Warnings:
Warning	1287	'@@log_bin_trust_function_creators' is deprecated and will be removed in a future release.
