#Set the flags
SET GLOBAL innodb_file_per_table=on;
SET GLOBAL innodb_file_format=`1`;
#check the flag is set to 1
SELECT @@innodb_log_compressed_pages;
@@innodb_log_compressed_pages
1
CREATE TABLE t1(id int primary key, a text) 
ENGINE=innodb key_block_size=1;
# start session
# insert some rows to trigger btr page reorg
#Check recovery on INSERT operation.
# Insert a record & crash the server before commit
# Request a crash on next execution of commit.
# Write file to make mysql-test-run.pl start up the server again
# Execute the statement that causes the crash.
ERROR HY000: Lost connection to MySQL server during query
#check if recovery went fine, should show count=0
SELECT COUNT(*) FROM t1 WHERE id = 101;
COUNT(*)
0
#Check recovery on UPDATE operation.
BEGIN;
# Insert a record & crash the server before commit
UPDATE t1 SET a = "updated_col";
# Request a crash on next execution of commit.
SET SESSION debug="+d,crash_commit_before";
# Write file to make mysql-test-run.pl start up the server again
# Execute the statement that causes the crash.
COMMIT;
ERROR HY000: Lost connection to MySQL server during query
#check if recovery went fine, should show count=0
SELECT COUNT(*) FROM t1 WHERE a = "updated_col";
COUNT(*)
0
#Check recovery on DELETE operation.
BEGIN;
# Insert a record & crash the server before commit
DELETE FROM t1;
# Request a crash on next execution of commit.
SET SESSION debug="+d,crash_commit_before";
# Write file to make mysql-test-run.pl start up the server again
# Execute the statement that causes the crash.
COMMIT;
ERROR HY000: Lost connection to MySQL server during query
#check if recovery went fine, should show count=100
SELECT COUNT(*) FROM t1;
COUNT(*)
100
#clean up
DROP TABLE t1;
