CREATE TABLE t1(pkey int not null auto_increment, j json, primary key (pkey)) engine=innodb row_format=dynamic;
SHOW CREATE TABLE t1;
Table	Create Table
t1	CREATE TABLE `t1` (
  `pkey` int NOT NULL AUTO_INCREMENT,
  `j` json DEFAULT NULL,
  PRIMARY KEY (`pkey`)
) ENGINE=InnoDB DEFAULT CHARSET=utf8mb4 COLLATE=utf8mb4_0900_ai_ci ROW_FORMAT=DYNAMIC
INSERT INTO t1(j) values ('["fa37JncCHryDsbzayy4c", "BWDxS22JjzhMaiRrV41m", "tzxlYvKWrO72tK0LK0e1", "zLOZ2nOXpPIhMFSv8kP0", "7U20o0J90xA0GWXIIwo7", "J4ogHFZQxwQ2RQ0DRJKR", "ETPVzxlFrXL8b7mtKLHI", "GhIh5JuWcFwrgJKdE3t5", "bECALy3eKIwYxEF3V7Z8", "KTx0nFe1IX5tjH22F5gX", "Oa5LnIMIQuOiNJj8YL8r", "qDiZSkZfoEDAmGTXXqqv", "kCd5WKE2fMtVXa2zKae6", "opGY4i6bYuUG67LaSXd5", "tUbO4bNPB0TxnkWrSaQy", "UuEa0X9Q5mVwG4JLgeip", "eBlQtFFJpgHJYTrWz0w2", "kQw1UFK8u2yWBjw3yCMl", "qc4M3tt2un4cDzdiEvq8", "vmf7TZAPjUAZ6Cu86nAy", "YDamCCSQ7GX33A8WhGwR", "k40pHuxNf5JEItyS3QrB", "gOChWKCDa6eIAd7RV4mB", "A5NQxJt0jk9N6L5cdFnD", "LSWV3bvYghhol4EgN5e4", "poSt7VVlkJw5jSYm4TKi", "92Ws4iYQoCSbysV6Nyp5", "Fl8wCfiE81uF1O736dRs", "ouSmmxq8tfB7PK3Zzmn5", "lhLm5Qn92F2q9UatPR1G", "4DNRVR0SBlXwQqgTFRdH", "gd5n5ffS4gi9r6YKVZmg", "IIaj8ECLfncKQh5TLkvP", "PcYEg5ZBeJpubNdiZq3C", "beW2JcTeKP4j1ayffXqH", "qdCQ0n8Xb9jDnEF7oij8", "5ls4MqjzLXF9APZ8Cffo", "pP1adEfRuPX0AP2UDmSW", "HhgS6DaIrE4eb5EEJudC", "HACPYCulwMIE1wg57ENy", "QSc1VpFnjqz019PZLHII", "bYWaSAfaM3WnT7oyw2jd", "sibrryODEhTpFzQi73GT", "6kGXr5Ul7DOxwxplwDyA", "uRx8OLoVP2zTmDzeITNN", "ekLYh8KbLIjEihK408aN", "AXrwkoY1HwMtgfSLnmx7", "2gLiLfnKlLhtsWpaKMZZ", "GwTubvFNhAUhppQASDSB", "YA4OetwzDWYTQzNzubMZ", "lqHadfj3sBEOJIkyAevN", "ATpYRAYLlutVj85MnoOf", "yc1HvlF3N8QYaD41OcK7", "VDcELgY8SwlQXmiQVvTt", "4rPe5RdR4xYXB9lUpHdH", "CMgj7O7aHaRJRovWGYvK", "UUrfba7Qpif15LiChpkx", "NCGp0AJGgFYAhPnIxvgn", "dJmgfTqKGbHenWRlgk2K", "xaVeyGuv9YinsTRVwIpC", "t7qedHPH0Pbx04awLSrS", "1YFr1fMvx97oGwQrBp89", "Di5Bmf757yY6UlvTQHOL", "RU9fQZXZNdhYLmj6RqBW", "mhbHRWkrm9BBbIqzqLYD", "zFjK1SQQIav2HWJi22Ym", "9jxkzojp7F06TjRUBptR", "PoUfKlLKnr7uY2eYqLNw", "bO247RWHHNieBAHTwdoh", "Utc3vEbkYyg9KiBS8fjP", "3P1EYJiUwU9ONjRGw00U", "xgbHNmjVRQsUotjMAPo4", "txTEfsUbrT3o9e5UQnxp", "BnIzfzLpO9uF5LTiDvH4", "OKqWywyMhw9sjRsOQBCm", "L61ORS6cONfmhVGdPFx6", "B4xsWpFu0RhJVihu9nWX", "89HndWQ2lL7uQ4mutzmr", "QT9tAqnJcIoiR3W4Zw5K", "GCCeExW5wIwLm5Euu2BU", "KzCj0ioadrsr15VF21Kw", "HEH1KWvCY6es3qb2XNa8", "CSzDVUSVTmSi1jkJFfTl", "k7blvBlSYLajmXwHzNlS", "7DB6utP8WqtGvV0rglHC", "5qtrNq6NBrnI2wPxpm3M", "buaWPYN3KfEPT5EqtKB4", "CzNEtk9jWC377dcUCzWU", "cir5n5uhP5jZ26mwovdJ", "6gOBH0dR09tapkebnWGB", "Zzkc4WWsQ9BWnah2aKUY", "SN7F6lqtF62o6nO8Hu0h", "1CBmkspKBJrbeyqkhfcw", "jekpP9vf1wM36YpqOc8X", "vz8YvxIccsWLVH9sO4XN", "yuO4QCuoo3Ki0SGwNWYx", "P5JsKQkgSG3R8QVYcOKQ", "Rc8R5ONQvuOIxf8H5qvV", "6wwEMQkyo3PFfVeiu09n", "uV3rAB6F1zk6vfII51Gt", "2d6f9kO1iVocyrR80VL1", "U35QiOglPweRai6hTSi9", "vWmtLB1LfKK9OQX6mDsB", "8UagDgNe75n0ZXuujtDM", "EXVcv1ghCYqK1Q0E5NqA", "QbAz94tqw4CAafkVeQBr", "xz9yQAATV0dubltiqlYk", "piuPMet042r111xR97sc", "5TWfFON39unwahMwJDxL", "FmNGlIguQYVV01AFNWIW", "O5Tyknv3yqODcjRO27GQ", "elvcl4r8Y7dwC4supnxn", "dJ0E1Pa3VqT7aMjLOaRu", "h2qr6jlvUgg6xeIy4szZ", "iQgInPb9x14c3sT8ZC14", "si8pKQmOIlvyCZFxwq4t", "p8VrzwxY8yayeioz6YLO", "JHLToaOlOTcEZ65Y2259", "yf7dMtaQRtnjA8Cxibi6", "2IKbON8PNDYMqdxAXVbw", "OOfXWsUERAITSd2ryAEM", "LkgCNdKs6vpUHU1nKTzj", "dIA6tDvpN7BjrptCQD5W", "9szOK0CdS9M5PX9Gk265", "7Fmy5f9TrE0y4zMOxYzP", "gMT3raKZbOeidPhg4oAv", "28t47GQ2mQQQmtUbRmA2", "AmllBQQEEY7EgzGlFglz", "6BOq2sRUeZWmMFXVdxjp", "Tr19oHs1ye04nMvqEKKq", "uoaE28jf3RVXGUe4mV5k", "73muQhkc02Rur18t7pW9", "EzeUUGYGlbyqfkl3STfS", "W4KL6QEBDiKSiywAFTQy", "2Oph8YiY1MyXQGqUg4gs", "l0KRxGbAhz8kNxPTT80V", "Uw0uBrPpt3he315yGe8x", "dHhyC5SgDQ9hK9ZV0wLs", "z2U14azIE8FqNvoX0EBD", "eKszSPSQMnILonKsLKAX", "QNNlICGGQSR3kJ0ChSd3", "GvM2ghs1z0ZNNu6e6MuV", "oKYZbYjI0MLEGiGwN8wK", "8ThUNl8U70zuKXRw3AE3", "XYGlEWhbdbvj4aDSLLuQ", "KrKeOlYPunSRLgAZBp8o", "R1XVZlvs4pIOgd12MZRG", "MsffYpChdIV4H1ZqkTio", "IzBzaC1wjRB4JojpcuXF", "C0JS1qIjJzWcyhZYrYSa", "xbeEQM42GZHQXYqXO9Gg", "6mG2RpaGL0rJcTX2pZ23", "6JSerIBDPRrVC7Xbu5sE", "6jXgC2g0ci1i1TMqkV19", "vtd7y8irEa5IHcwSecQE", "KRxLtH9dn8kgzNnyWTpi", "2u0HUwj8Y7LqZIBQXI3I", "QlyQ9jMdB9LD3JUXDCdl", "JybqEkGk0H0O3zmAg8nr", "H64IPXnchPLyLupYc3Ia", "JIyKFlSwrFn7JqPiNBI4", "ab0vVpR5rjf80bQDMs9C", "7vJQlg66rM8Px8JQwkVn", "U8tSjJf4BnGGiZeTFiZ5", "4hU1pnPjYsU00NShe5lp", "sz3aYh1mPYrRDJQ37pkd", "fFdfc3LH844z48ZcnZMD", "7DcLX3Mcq6FWLq9wtUDz", "ZFydNWDB5aMClyVGzrqq", "w5MHvVDm0OmXek8zGLAJ", "tUUfRztQpkGlnc2h6ET4", "aFbEyjCC2KWwp0ZGxQem", "AtXwTYdZk6dKKCXIvjSw", "3yqqwN4snjewcAs3gVdO", "bGgtRDBKueGwa6mVTpNF", "YzB871BlWm951ozSz8mu", "k1oJ7aoZP9mv6x1CwBvS", "v3VwrSMqb9iJAWcF5OmS", "XYMcTNmPWhpQkLMbnjSM", "q8gyfIBkhyCCUYmyuYLO", "GBoyU9aFq0cg8GclYnVD", "jiOEEAC8hVVvgJtASRQI", "R0wYGYJmKp03VMHhURoB", "xJ6bayk3P8Jp8ENMmg84", "T68wSNcxnQ6khBJH93IY", "BaNHoidYNkdqqllH6NCt", "lGbSRvjaw078aSNO9zwW", "jZKXI3mPQyGBDsbenLDj", "LIpviDHrCDNtngQ3jBS8", "7jHKZtzMCA3VSrOA2f2C", "sN5d3Thne7vkoC4N33jF", "Dlkda8ocnooeBrHDIw0v", "4tfs3jG7lxMwg5aGDMsz", "AedLTsYkpWftNIjRzzWk", "vqfbvFs7Zi4jLh2mXZWM", "59DRPvqPuM7nAmP4zF9Y", "vDFGsI1PrVkufvJ2q9Rj", "TZWcJtgJ8pp425IuLJHC", "p14SvOUlVwSxTzZmqF3z", "2t34wLwHfDRSDTu8pOrL", "IIGlFpW54Z44Q58MR2b4", "D2UQUOWJkMc3esmrfIwh", "q1lG6rbVtCX7D1VfN0y8", "KZ9wPvn5Cjm2iYGnPrGH", "2oODnrsBrqJ9NS5nLsqV", "acVI8m3YbKnb69ot0g4q", "VNzsn5d7xTcX66oCsriR", "9V3Fep9fWDT1ZSrKXVPT", "y2y28mFycxNlTO17E8ki", "LDjsgaBB3ac2ab2iLHev", "D0fgOglamUI5h1yLa7Vd", "h7dIggy0vbt8bYmxCWYy", "0q4hq01O7Wzobd4GH3GC", "c9JDg58sbgrbVvHLvIh0", "mgoNHrdYsrjUz2ff5nVh", "UMGxFVG8lx8XdvtvmURe", "KA8JCnwGYRx0mBx1fDAQ", "8GwkBndxF4ZZDhqNSmdz", "CYzykxxP85nFMjzVUcRk", "e0Jrg8F6ss54R5090yW6", "3HLPzIvTsKDXKVM0dZ5T", "SAYrDWyDUSIYjdviuoCm", "8NHRsePTDUvdfRSqxQ2S", "sKyavrIpgScmqtDgVd8j", "73KkUnZRDbr4vpeqfueL", "NE7D5Jtbw1I12ckWNJwZ", "sndnbFbG9DZWRehXvb8r", "aOrbyZ7Mq1vinWTOl4cs", "I9Phl6EhfKWEiNpfuu1k", "wwQjSt5Byf3EmQvXV8E8", "QlM769m12njyhAf71iIz", "LJB7k5eFBrLbcgigpSfr", "DPnuXQ1Y8HWTbfYJiDWt", "4rTeX9KLc0ApNwksMjOT", "zuuaYTrGeNAgCdKkmc3M", "aDCv7ulUbAva2pAaI1ru", "MzaZasHKTKh3Vrxdli5M", "q0vtp5R65G0PFbynTD8w", "Vny1ctcLZhhQhaHUgiaj", "zb6CC30dG6YmrUlTLNou", "4TIj4ZDiIoPHNVTXYRAn", "XgZM8KpTfdOj7gQ9GdrW", "RGlolCJIeU598eWHwLkb", "x6I2niB1J2VjGGVzSpH4", "JMEPyigs3RRyVj0IPBHj", "BmSR2vRTkiX13lRzT7sV", "WJT21SIQdY7nKXELTdoD", "KLFN5gMWlCzGWRGXtYvU", "61HPYUkz7WDRpQmu47Pp", "JO3nnJIgsEBwDQLlu3j0", "ZuPPKAHOHgBY3DMqWeXO", "qgJ36enzgWzFQOeiYw4n", "aDMdQgSxIzJ7dcAhFvgv", "Rf8p2lXYfbMFpgrFKJCc", "GUjt6sYJnFCDsL2s6aRl", "9lywRnCj6MLKq3BvvkCg", "zPtpiuioS9XbsTYJHi0L", "2LgtMpmFZyuWLnM3f2p7", "BKh3oDK3vKMxd0oyqYDN", "X5ustEuWGjeP4JQqWirP", "0DKbE9Z4flPCqJ3hVxEj", "eq8i7WWdEN0EbKqnRPp7", "8EHzWIe1FsjsgrYnM5Oa", "QOpzhdm60ZD9oT6KlkJz", "b2rFsN3ESRotobqVCdZD", "ClKyEQIx8auhcjxU7ygZ", "NVQB4HeHsES2zm1BAH8G", "p3ySmtutrbRC4pM640Lw", "Cnx9ZyIjDPy3QuTAnL4c", "uTowGA3L9OHJCCRj8jRM", "6PNWJqh69jg4CS0Sd3nk", "Q31aDSJMAkgG73nQrSU0", "BA4Nb3nC4ZwUav4nOM7W", "4nkCqVcfx5e8DiTojF0o", "ouIMqL7ChFil2SxrwYWt", "dA2orVdakdMWWfqMyyYf", "BEODeK2aqXURfUFUzs5i", "URC043K2zqfA42LiMMHC", "tjbYDq3Ah6q9V37Y4RY1", "HE9JGSzaoGkhzLEA9FLq", "JBzmC4KGVtHk5O3Jr1tf", "HdLFwXP5miu3urp6wALP", "1a84z9NqAEVQpqflN2o7", "liAfayjU84t7f1BcBWSL", "kxjZmOK7P6DApLnPJUtP", "ZkWCmfovBEEt9ySvKk1j", "rEteXe3r9uGgclqMQcHa", "qURxQutkcsUR4L5by6S5", "yjlbSZxqBDOzhqw7inpK", "dJmhdrJZwjeuQPVswTj5", "e72LxwQfkFyNXi38XKhT", "3LOUitKeK1hy9jH4fhiN", "velQMmYt6DN9WlbEcwqx", "vXv4ED7tsnHlR0Blmheq", "uzzQiZcLTQIOvBR9MW1D", "JIyiG8T2p5sk3p8lMj6p", "9MC5WdCs9D3QT26jAXjx", "aZhdPoPlXTZeqlhMMsCT", "5GtZGzGOU0L4Z1iwn5gI", "YFwOyciKUtnX7e6NbLl5", "L49u5ppquV8Tk5pifW09", "PngWPlr06a3PeCHi06Yu", "bhNJkBzPhzW6kAa9tR7x", "1AMfLcLLiuFIZbbHmbgT", "aAXJK7SEYYBZiWC18YMq", "Qa8zBiExJsOr2vAK2bYY", "9i7pCHrKpD8DnFAwxOrE", "GF5I8Gb8p7gypll13cJq", "oS2ZhCWcbLqpbv6h9hoy", "oUucEgbFGv34N5e2I8er", "RUg0PkiXRWVEyOqC4RPK", "MTNhYzjo5LfWpKXD4FkU", "jDihZWsdxHwIkJxHGf5L", "0jro1O13bjXKuD0Ujs5f", "71xqIu7YZAtYtjMu7Nwh", "4T1wfzQOrU3zTypmtuIQ", "4AyytKqyfkfhEfcte0FW", "UHTyFGi8A0XCAT83mx2P", "hh5vKhmzh0TCHwAWAsdI", "q8U1bd2Na4lHkqB4Xv1E", "vUOAQWhYMIqDQLEzyELY", "J6n1wy3Rs5dnZ2wyYdWv", "tN6HiIGeWbAnfxobuq0m", "veXSgTQC4v5xGBEwTTa0", "4inifaHXQIJJwplaIAmN", "5qIL1VFTypR0VCiAm0gA", "IxTCmDm5NWQQMijMByp9", "lGAGSqODq4N60pIm22pN", "ZDltuUF5Q2FBGNPjDnu4", "qFAq2Ra2TQP0bAuVc7b2", "AoBQBa7OOzQCFZ2F0cIT", "0fUcqO5QTgTbSc0dD70Z", "5OlIxlXxNpRMVvwJH1ji", "gAK8lKkyPiXU6Gm41I1O", "7QiaJerYeZHKjbQUv8QI", "qvnxBXzCp0ZvPFTiuLHW", "uYqb7E40NUIBQ38Zb5kO", "6JHTYlBQ6Qw0ykb3xf3K", "8MVWNc5yhpLl6cEdLO3R", "oyPlgzodcsxkCRGZ1KWg", "7rSERern2sCpocaVbO8D", "E4wQTAyUSUAaJamiFbVF", "Rg4GGclrzr2DvweO5cqX", "417NZr5mSZ2uD4ATftIe", "kIreFT0K3rp7qxSPmWCF", "3C9GEHht8zXsFNUUqVms", "MczCXQZJulWxvdBAsq30", "pZr4wLXkoHcAraKM0ues", "dAnZmyhemkfbHWdBp8we", "QYmF67c4zGwaOj7AfopR", "XU0oyc0lkuP8QAOXHybE", "EWocFwltkaKF2J4yv2jd", "w7mMF8tW6TiIzUsCOd57", "BOMBhQ9aSrDMwxjB3cf7", "5LP2pGFEtKJ3gfEN4MvU", "D7r74aI6AvDEGbG5rTHi", "oalUGyqIKjmVqdctBuzM", "pAa5lo8cIQL4y4WC2KUK", "4HpssRl4JiQ6ty9ckIF2", "gY4eabrbtJvxalqTCZXW", "Gva9tklb2yciUgK3F9e9", "TX41IsUTSzxiuXplHYLJ", "VxzxdI0rPcysA2sSvMtL", "Kq1COowdKHvpEslpAjea", "McQWfIwYdorveq70c1ew", "GXkSPVIYCu6YXW2AnxiO", "lXJNNOOzQ0tgXd9u6PSJ", "JYpo5syqngEYBVvYtHVH", "FPyk05f7S7OleDYh5WXs", "BjOMEIt5XONnlJVkOArq", "GDZuQ7bUe6Knpj91z06W", "NTJ8mpsAxhyBuW5JbenD", "k70XoAYnAfKX8betOU1K", "A0V2UbL5D6JwEJT0R0oa", "f87lhje6CeQMevO6UiBg", "oUc0o31F3npitvSac4eo", "i2AKwXQQFc414g2sk16n", "mtUfmuFPysDfuMzqrOF6", "yJ5205vi4zTqsxVdrj2o", "bDTTXSKOoXSmqWpobiUg", "hyWXv0AlhAZIM2jrS1GH", "Yg1PCqBmYgSDewlXutIb", "2prMrbDIcRXB8YYIPh4v", "NU9zPsXJjnvldk5ULJkw", "kH5qqd9DKB8ggHf39CMt", "0Fcbyi5JzoDj5IYtvf6E", "oFsSUXVciqVg55H1lKLk", "8YSCp05kdCwRPoutKPV2", "FygJ2xKnFdYOAyYzwdhZ", "ncyCOs6iGZiTYOkaJ3LZ", "ervopTll4RIs1F4P788L", "ionEDXmUY53DxwzkNjUS", "AmKB1MY7TgQBVDNgj7AH", "CCU96UuUDOuL8CU8Y2Dz", "hdAArVoacyrp8KyFmqhx", "CbILnkRJmeJRHRb6xNeX", "MUMSoJfY7MVKxldiV40F", "gHfvgE2bcg9w8TOum4Ss", "QxCMin2Br0PXH4SwGSXs", "7goF8DAsFckfYwzEh0OY", "0l3GnUC3ujw1OkFUvNMA", "x7oT1lijl4FmpH2clCfd", "tbdHKslFD6OADAcCvKvh", "O9TDQTp9dSmW4PmMFVZQ", "bxZm7Bz3Tsir192RcpYD", "HLjJiTfwzFKYCtLI4IJX", "A1MCAMbkBAxTTek98Q35", "fOdpHw5KEOpPPAZZW8Hi", "GE9jttrzHu4uIhiYenqq", "AfFXpm7KvM2Bb9tS0kRI", "cVAtAsPmeFdosqLgdQ0W", "n0fM9Yo7GDPtiYkqQ9d4", "OEqE2Cufas9NspjzLV7c", "iUTO2DFTKqVi2Mu4Wpi6", "hrSae9X0feaL93k9ExaY", "l6EnQ8rwvX0dNSB1cgzF", "LZaSaKbmFCI0GUngddaW", "8a9V3IVdzUsI2SialJLy", "Tdzh8kNjLvFUWNzXdSAa", "v2qxSYVBqqAJS91YrMHD", "IUhoreJT7T30TuxtSQ5G", "FDafKZDBvSMBw3xmgGFl", "jGlA8g4Z47pJKPyewBns", "bA1YBzKrFXaxlL7uz9T4", "GINagKCcTyS58UdJTv9g", "QjdB3l52uW6BnSjTmu3F", "sUIywtFPmO3C6hM9SR9K", "wETjgBCQ5Ddvhwtdp80c", "V4obl8iBYpVU3xDh8N7D", "Yl6GhzrU5s6aut9d1poZ", "fH1gEEOMZVX8EdOvcDQg", "5UGxNOaNDMuqewXq8vDi", "OiqdMCWwPucTPrQkDz5O", "L0Fxwmo4fzk3hae1kBy8", "5YbUNzDYyIxIICFCw3Hb", "21ciaHjKSfQXC10XzD6v", "V3DoDTy9UFkVFMDnbw53", "aWZmVZJUmPOFQb1d20mV", "DU0SpDDQ7JSfp1RKajnK", "8BXXkZAlXvGkPGBCRObW", "f3CU4bncKauRjRyTy6CT", "1SCPgNb5jCcPFmtHLetg", "Cl5vB1N77Zb92nYg89mr", "KMEZ66pRki5xS8sd9DiH", "nHQn4wTA5D2NXGxdKm35", "S82sFsTO4CfrT3cWz3g3", "HgQovNQF7TKYZKQoBuDF", "6q4Xue3thkwwONjJi9Zo", "crM9CmwLg9YkxcIrGJjv", "1fsQ0bjjkGVK8rRIdNdI", "UB0SlGJzY0uZgmzeNhL5", "xqN3hpJJCwZh5Z9ooQnM", "Rgv5StjoY3rTtFXb4qsG", "lRvoy2bmTM6s20xTteFR", "h6uZJP8LE0axPVlNYM8z", "hCrjCmC5OPU6WNdnml90", "ljxAEhVk1bjioYQ0Ka4j", "0YnUtQHg9Qeu9a2MFX6E", "9qvvOLvhvxOvU9PNXf1g", "5gaDEaZR7dfERa9qt3Vp", "0tiU06qXlrDoVl1jLY8Q", "CmdbMmRGnu3mllElr4Ia", "wTPREO9XvHy71bgOL8c7", "0ftmO5XGAoo6HDVUcezX", "uvcvWIHqOrvPWm9trg71", "Uv5m9ZEjBDE59ozd4ERT", "6Mqa8zRydYx8U3sdc4Kn", "HYrOKo2O0Rp4ofduc4qE", "doM7pCiPE0AVW1sqnuEm", "L4q7hT0IWqW9cqER2wqG", "w1jQ0bGmTUYnWMuCqsUM", "h0TJqhlqbZ4VanvZNBLq", "dtdADWM1MoL3ooNcV6S6", "fWbGHUnef8TJz6RCalEx", "ZZ0NMLzpRPw7vVLC08pd", "EIwDMLNx6Zsf9s0TCxId", "MCiFi1Qg9FHLVCYrXumc", "TeFaVG3hBMIWY1jE29sA", "MAVrM2htwTTP6j0bx3I6", "PacwZMAcT3kqDFfXHMOD", "osbubbVYcle0JFwtZ4T2", "7DsISWpisEtg4UYf33Be", "mne60YzZcQcidSy3ymjr", "ydV274h95qnsbRycxvBX", "LnDwGCxEyh3uKXwPbbYe", "RJW2iUefNoBgbOcpaa2W", "F3QZaKw9vToKmKNVnz8A", "lJrLiRAGzAlEE9loUiyN", "Bmiv43Or0X0mop7UGFlG", "QUScdEO5uMT36By9CN0C", "s0yep394HsIhMkHxwf3q", "0Wt4fqDrBE11Cyf01m4I", "eKxy4Eu1sxpsRhu4X8ti", "KuhWsMUu9WAlq6ivKcuA", "Xh0yOv0t3tZNnGrgdKYk", "qgThm9c5lUFGBGEYBCRC", "51XtFMXsg5aXl2EWBobx", "GqBP4QxDaNPgMuZbH6Sv", "90Ss2eOEQz9goK6si16J", "OTzkOWKdamYhmzZpdw14", "tAihSoaBqeSC5RvTvF4V", "zbClajYBfZDZhwE8imJY", "QjjW8ex3r0WqbibBP8M3", "fYaLUoTCbkjzTSTb4Rcv", "R8l0oKBDSVE83oRXbuiC", "cR95rdev2GqRObRCvaNM", "5cS7Qtc1nKBNjJSaw4Vw", "KLLguksqKFANrcUGV5FG", "PRd9i3jc7DYRWr7RbxFt", "APG01jGUmTkBsLIaO2CV", "DiujZzAAuN14kG2lxIDj", "kxucIDDeDN7O6z7fyGoq", "dptO3v70CLjwGcWXnjB0", "5JOBIToFjc5LQwhTsoU4", "7ByOnUvaC4aHNwSeQGt7", "rwSFt9ijwAn3MlP9DIkP", "NIgiD6MbLDiC89RzG7iC", "ITEeCbnPsVpFmTvzaIav", "TG5bNUaebGotj0VvcHJU", "m8hYbaV9q52KK7thbSJB", "i84S6YLipeAZkp6KQbTG", "fWYzbSeBuyMc4O2AwMrl", "0zJlpP3D0WRf00caQFlK", "D7uFVvPSHGBFEUy3r1Es", "WfVUd643LpLWwElQ9AqO", "PzddSaeJbqB5Tfa7le86", "SSaMgLmpTaBqaoR2M3Ly", "tV1N8bStEYxg0X0gqlTJ", "LeAtRbvnfFjWilroKHhW", "qcAq7BVxwwGHbO90y2lb", "HT7xCxlWEQ140Bt7MM4I", "IJYrfhrdjbCz4IuEFeiT", "2jW3vN8HjBY1S6t7lijS", "HvPJDKXSwGuyzQzun8AU", "JiVjmMqX3ZxKTNcgf97b", "P1XNPXHAdReu77dtUROV", "zMnShP6KZDvwCQJZvZjY", "yNQ6V3xxTMSSgDuLd0fA", "CY6MwQwsxdOv1pzUqxPJ", "Hrjv4dGfctpoRw8LK4DF", "iaAhPA9D7YVMNEHPqX5S", "QsEpmKA4NMJ3wUkJcrUh", "Pz3kCK90rCSF5e2pyAuL", "UDMQf6hHvCyI912LLALA", "KlNNNNDKW7d0I0Py46F0", "IEISDJlZT5hno3BCQOWw", "T7xl7MjCQxCjBS9MlutE", "xb0meBy2XSz0ZulfETre", "Q1LZRUvBNpPKON42W043", "Q11yvnd7ESmeR5Bsa63v", "tRDHmGHJGKMhLOfF9IKL", "i4x9A8ziC1d6SoLE4bVL", "vs0EEdTNtmgbqdk0lhiv", "iJ186LNAwsTpiR3w4VHx", "HxY7YG8JyoFe6EnCX8KR", "ymGhDKbInrF4mmBL0Hcy", "4pbA2OKZWezUQF9cXluK", "a7MMrWfsnIop5Px7lHfH", "uemIrtuNemhCs4ZjaCZL", "UM9Yj6fVMImEuWWmQR92", "BoF3qmlOyIiRerzOvctF", "vdTpA0ZaPgaaTpcJZNiY", "fOzIDyg8aXMTApHKnqsC", "XRl0ENHoixMLLJdYFHfn", "m1HxqYFeM6orXZplu7Za", "4tuOAVwNnZBXaQUPwk3I", "qpALNz6F4eq9VkVgFR10", "1CYZc0yWizpYpxrCwyPz", "aF85xbjB2lB1vhZWiX2Q", "XrxKooUjktiK7oO4N5FP", "qPPm4yIkTIByA6Iwskdb", "eJvl5HnSN3qDQDxU9DFc", "WObeSraKcCvGVpzZ6m1T", "npfB2agBotoIHNwhCU1o", "gv2Ai1jomiGXYtjaTNkF", "GWXVtTC5yBsc6umouTbe", "Cp9iisIBF0PTWwyNO8RK", "KJwOBhB3AmhKZr2HhJQv", "HpOokLB8TcSltOA53L8E", "5oWedXvKoJD59artv31M", "dR8XpGctbi5gWZK94DSs", "WfwdFnU8qTTUuZzipbZQ", "Je4oBOvGZN6512hGoBNe", "fq6ZP5HEeocwQgkc2fqb", "1we2xLGlXbNARShoVx0A", "lc4CGooIRerQYWSVphEM", "IcUi4CUZ9Vhu7l6MZsez", "UUP30qWnVl8lNcRPowyx", "RgqWPwsxnVwHzJIx7pka", "YqMvTnIHhED8u3dIxVFk", "yB2vSKqY7b8fRUYsGqAx", "5L4xOhFLAU69d646QveY", "UmDtFmkTauOfDSdb9quI", "L0Ry6T2VMe3oPEgeyQ5Z", "KTEXwp63g0Lzzkx3CyYY", "cZL1o1dkRiJjCWE6JK9z", "ITwHDsJNqruSPFSBG3vh", "mDOwjc20uByCcuSomlBc", "a53xKT8YW4DIFbCwDEw7", "OuI0pimZRyC11DxKg5sA", "76RMhdItsDyE7GCuwzUN", "veNwrKEVP7fVB6rqk8ja", "LgmSuyLrvpEqTZlKtznH", "4SmFZb4Hjlp2RbTMZoDV", "bPJ4z4Mq2954brK8RMN8", "7CBZncvNQ6q1V73SCPJC", "WOG5EYCduZl0muZZWSuu", "Wkt1swS2JjCn7StJz5ur", "egrQYQy3qsxMbpMRloR3", "Xdqc3hu2mouPSlnzAl2y", "exLFmfeWT5XyiNaj3Ump", "HeCjP0iXliWNgpaQUEuv", "JRtznTjqwTdD7quUod2Z", "JWxzLVQnkIi1kb1X2iLy", "By9Im2madmAwG5wbYKMI", "c4KKdJpgzAcA9mQtoAUR", "xcLDhHnDZ7WACoUp5KT4", "S6CbqcVcmx1hZMtEeeRB", "lvLxjolm6EqYI288cbkP", "Yl478xJkbkvLgFIN11A7", "E0dW1lfdKP0sB3xH0G1a", "zuvf7B28BADP9rvAaalv", "ykl7njOlxPLwHEZPOaVZ", "kjytYt16Sn1QXlXKSt5P", "GPKXbrwzRQYC9W3hO5nq", "snENWjfyciLs5dNhVIgw", "iF6pjAU7FFv529QYq5UQ", "lqGrTeYwwEtcRxRB7vGK", "ACNBJnh8qCYc0pTRT1ON", "DFxdCOmIH2aRCwaUhIcY", "SAAQzbrQaDllSiOd6AvL", "BTlNPLr7bRf1cnRZMH0u", "SlftS2WWCPsLsdjGwYNY", "00Xalx95C7zereXJg3nr", "SfCJGtZDQujOuGydD5iP", "Bh22JZJyb6p3kzK0rtDH", "nuffBbIMg0krfmrzJ8xu", "DkwxhGvY87nt1QXC1pXi", "oHXR1NQKVLDi39dlNZHT", "e5NfTsqVhNBTcitb3HtZ", "d6FeDrNbOf42iPhBHXex", "spOSWH3ZZx6A1MoFBCqZ", "psZXGEgXmLSc8r5e68Ef", "3Kp5ecKpo8Md0v8GAmmu", "5EUE3ZsAg4pjPdo1F8r1", "EBcF5iTDUD7YQbmT9ebp", "jPY60L7DRwEg8otDWKOy", "YVWw4GNBvz0cOXiOqnbH", "knxqbo159P1fsWbuky6d", "x4FJZvfPhEhR1cFaRGda", "ddFV7qPrmTVkYk15ehVL", "vCkvozTDD7nqi0Jpqggb", "8BLguKjW1ErvOZqBWJOj", "OCX6AovzUaacjvGdF07F", "CwAbVym1HAieKFkV3eUW", "E46xxLZALgNVdX66Tq8j", "1qNJ45o7jGbxIitF3SOM", "8lrjHwqkmwTlmo5qurwd", "6XZODScGu0a0jQk0MYj8", "UAsEzx5tmzWsW5HkVryP", "pZQYz8XJeGP8QHMPEPG1", "Oltto8dKzZjo67L3DsMr", "6mxW3KuGh8F6t6ziFa0C", "9jzEpKH2AesGQpkR7chp", "lutc1qIGQIQX0Plph3pp", "ff53VoUaOAN74Gk560JU", "Ji0H5j4nktcPZgS2Svcq", "50y7EgDJgUlxCjEITI3B", "AfbhJ1jjwJazHW7UCIns", "mYqzI2FjLIuTvTAFVryP", "8WNQ2UuEkf5WBtTRviAE", "y3huWr7zg3PpamFcE7py", "kuSvluNgaVtZYaT5QY46", "bRvBB8mPDbLxTmrEgEsE", "jlnIMELkmPqOrkX0qJQ2", "sjzLVqZ92SMmB72XMNH6", "k6SZoyaeH0gAheTBS3KT", "TgFeoFA8cPCMTdwHbWuq", "UYy9CSKdTf6uJJW5WeB8", "4MSXzMnYqhMIFLSQlm1C", "P54hMamsFwyHIQmHlZnZ", "E7sSQIqB4rLSwP9G0t8D", "p6S7WEMFm7pyFfQfxGp1", "5ARzaYFYSNjFTBNyNhB7", "p042fUhcjWcmf1mDazl2", "LSHmbckwIu45u87Yao8H", "Ji4yko9KluK6KZttAbpS", "VrXOxewWQ2nhlpdTdmnN", "e5TweMpowfERWlpSNjym", "klTVZ5yArjXUm1QQLGDH", "tRjPBWpYEnKyXmR6rNGg", "4o8qnZE8nPQgr730dtWp", "grnDbCHQXY6bKDP7meFZ", "3fFsmIqO9NDqEz1n9HDh", "pHG7UgEEIRnJ70ArH0DQ", "NREZOEMXVXCInTPF7bUN", "2Fg9GqzVpCvCb8kzM4Vp", "cf7N8UcD56a7KFFY3C3s", "Ow3y4nvOrQDR6KoCoROr", "Vwzp9CNDOQ3kL4iPreoh", "2z66KvH6KdwnZvdh7ysT", "NvDi0u5pWrUWrZd9UsDm", "V9Z22Aj77baUVmATgFGC", "5jiuIJ3kBEUeO1fQCMWH", "w6jRstsW66g9pP35g4pq", "JHUhJ75TUbkQgTpWMf3Q", "ljaZ6deniSdzj5e2DjVf", "JD5xgsT0XUPIEzpIaU3G", "ugFdktevb9auNdp1VI20", "nPGzO6HwYLDSzS5hMjax", "rApCleDGuDEhcVeybuv9", "D8ZAaequMQrDbePMIabD", "onsOIVNrNIyaQXiyAYtW", "zijYN6udgToSFfrXAENX", "UL5utnq3KjXJQErnKjOy", "BDRQsGx0SKVweaoVLeWf", "M3ymHnXZXvVg6w6yA1yc", "KTYy1MRNzx0L0x5FkcmF", "VHvcCzYM1XxLyVHyqiJp", "fJAdGDqzncCIr6s35RO6", "wLPsqgqeO9T1RbefoScb", "4pswvkxy9L33eSwT7k7T", "sbVJA7yzYbacOQWHBSFI", "lGMQjGroyyHqXk9iq6fO", "fFy3eTInvX5eoP4VftHe", "sYSNHa55gkTJyPMcsePl", "9SQvsSOVMf7CCaZRAdWo", "Lz7JORtF3G0ChO6ZrS4B", "8CNIkujuXFitCpAYG2nJ", "ImTzAXWz0Z86jVOTO5Nv", "K3oWsx26zqNFcoDkMjiK", "IqQzKmSirpb9qOdiLfmK", "T7X5wkoGSUaiKyiciAKZ", "ywgoKJVdwHvQPSTJBHZd", "l7L453gnCzKAv0wDHRqD", "hld4B7LMMuz6zJA2KonW", "n5ei5btK0jVfS7jeE40Y", "wyevHmvbbi6Onk5qJy8K", "gez8lhkxjjTgh8ZwsTXR", "BbqxMtnfrwxVYveJaMEJ", "5hxknVegyC79lv67osle", "mg9KblbB8pTBWQuKvYyt", "i31Ux5ZjxKNh1X1aGckM", "RDYwdQEXyAOfBP98TisO", "1D62i7aziKL7Xr39HFgE", "P4tZS0hviXJhlPhRVIQB", "ckI8bKHrZv3xzwUPwBKc", "hcKQz1rUHGfu0w0ZGHOn", "CRi9LCXHMps3RARR9ItR", "WZJUTJ4jYQWisDpDPMTj", "CJkdTB2cSw1yTKTwbVd9", "t7rlKhxi1ORDhCp8Nrip", "lkmE2F8eillbtbLDIGvJ", "eLVJXKPs97ivpS9shGUN", "1FyuoH66XzO9KrSpBriK", "xODmqLcVb6scKoV86ZDd", "WZnrQDeZ5Mr2k5maQP5z", "TvZlk4sqb5T8cEx2SbbV", "ySVgVHFveIu8EUryWjm8", "mFEOSBOukxNiQsNt7cpm", "uhs89j4gTqmF4ycW90Ot", "wlaKbvDiX2UPiMWr6aVX", "RFkTDKzKJLCF4kZffmNC", "nsZVC5KGgon53WYHqVZ9", "qlOuVxZAiuKVmuyxzIDd", "6zi8VEPLjyTXirPDnyMV", "rg0bYyYYEmBJjsRE6oXq", "k0LSslefh0AYe8AD4ijI", "SsZBkyNpkvfVv0vljZOR", "XWzCc9Ngq6xIwUUfTpUD", "k9ge7cNrBkGhEFtrNEXD", "KSVExxtOnNbVUI9csVR3", "FhiTubIHpqU7GyMDvFbg", "bBC5RJfJo4K1j3TeclvS", "ZQXoOr1H5bygk8lBPPUC", "TmDDperSOksx8NlUFlmK", "Kiy4ohDD6fPYRblHFahd", "KZZTwIx91hRLNPNB5aP9", "FmhhNQwb0dEJClk64fG5", "NfPi5mu8LHHa3xFRNB2M", "oEdyyN302J3NyS61Dy7Y", "FP8IMOhhXh1MweIu1Ls2", "cvNZORYbPg9c5FtPba49", "I6TCkl4k5wkhr7EDXnou", "TvXW9QtkyxtG1MSm6WUB", "QEqIL5VqqIlJDIpKgg5e", "dwtdHLPNqtWG5KWQN2HD", "K0WVIJqwxtaZpRC6lZRZ", "SvpVGKtdMApe8J7QbvKY", "ot7cKJi5s8eI3SnJmhv6", "pkiy1nMchfBTYG5qamwQ", "uYhxyUFi98mxqStrGFUx", "sdQQtUHRGBs8hZ5e1IMB", "Q76GZz8pCak5DBT6dkYt", "tO1Zx4DyLZ7lgD2EA83N", "ioSvxv1YeXRVvQ4qSHnn", "puXT6ZhGhlbPX3ISxH0b", "pP6in9ZFQM1FEYjK5QZk", "9A9eCP69g6iVTmEGvnUK", "7VZL1Gg6fDqoLxRXMXe0", "cKW55iK0ToKaHsvI6ZMl", "kAY67zbRWGR6YvCdbUc2", "IwcZmWpt3BeoLCsQ9Tpg", "hEmGAwtjQVmgQMDCq23s", "DggWsYu2zjghyQx6Lonj", "IZOiubsiewapcEMSkESk", "y6PuVM0q8nXQLv8DXzv9", "vUyViIvTXMBTSaNxuNl2", "8HTTCZehYYqR2pwk7qBc", "CM5euSaonLrwcKNnr2UQ", "aLra8mKDcUqootQjM0X7", "KO3ugPfYPAwxTlXZXpm7", "Jav8UKroKMvclxVPMAvl", "IrijbDI825GMf9S9THvm", "drMMorm82ftIVZ26mKEm", "PS63cYA3p6pRvCnh1Xp1", "DiKgFMmzeyl2Rs51QD4E", "JsfC2Qt3yi5BONpdhbaL", "ZMNyEQxce0ovsR8us1vq", "i0z6Loi2NIOuejtq8oRk", "oFdghlYXlSNRSKXm6DoT", "WAN8sEz03QirdLWI52po", "UCFvUkhayT3SePaWdXUe", "vCUZXyrcyfQTrdMKO1uK", "Uwm6JKcus4ZnG1KozAOx", "pnOeQiyojr6ClsG4Dtw3", "vTqCU9yTJMR89nkYWjKF", "YRPJJgLUXFXSjMcDVaho", "v6u4reaNLvbrM08feR8B", "hfcQ1EbWnIIiMAkEnLZ8", "GAyc96FnYLxF1Zd0lEXY", "VnEpyx3jIdpWln6uuJiS", "fffgCIgvWBSzxgptdsct", "TRPFFV79ppZUSE8eWma0", "y2yvgnoKdOD7pbK46RBt", "FkLhwTKSGuRCuP5aCrsn", "F4s4fA7jcIdp1wWxOqOc", "inoaCt9Mi17x50ziA6Sk", "N3ZOx4JLshxZUj9eaIyI", "I6FL6F4EJUzgVY2SaMoT", "3j2WTBA3S7MkBZ3Fo5T6", "ZSm2zpVZBH0C02gTErVe", "wrM7QPMDVnJ2E35DqYkz", "plCpnsHzhmbbbxizL2Ao", "oTq2VtDLRvLEgX2SNJP3", "31ecwLbHLm59Du9ilM4D", "INPwuRMFimGllvNfExvZ", "j0husqdeBfpT2ENugk7O", "UO8DJTsXQn47mj2eadGl", "I5CIKZCyHJMlhSyywpTM", "cWSMFU1n5FWNLiddGpbV", "6xHmODiK2Cedg6zvYyjd", "EFyXwbAAOlfVguF46xO6", "71jn5hjedQFrdEMXnWhC", "FLfwDuyJpLQxM7kRmR3Q", "rJFVVc2I6iSM17IEzEWn", "ZukvzULmwOClfPEA1HR8", "xtSyziAwwgjWaRPawkMq", "9WZovoxv3O10FTwC9675", "nqZLIzvCjF0qjXddLaWO", "wXM9yIM7NTAAHkTXhNhO", "afFKDqvYQRvKyFTuYpzt", "G91WrU1WrjvSM8kZyf6M", "6zg2E9wkzvdD2ejs9jOy", "SHOmP8MLnQhrPNtdXpOU", "izhjePbl8xhYD6KaEew0", "4drRzl3WYPyHOd002Zl8", "UTehZxGlZClcnd3mO6Gu", "VEBss9ssgczB3bqaY6L6", "G7i2ijo4o3yHHA97H00w", "cx5fYvF50YBEfrGLY3PM", "6OeLWlTllThNOm0wgDzg", "mAsPz9lYAAuGWWb2I4o1", "VTNtGNowbnaNwSmvZVRj", "gKzCqZD6bz67STygomcP", "YCkUdVNA0pue9rrxO220", "z87Rb38PoinMtVoU09ez", "wYd3OS1mU3mR9rtitz5h", "fs1YMp0KwfJtBxwZPvKs", "w6J5wAnp7tWljVH3IIOE", "xh78c2i0x2su69z2IlpN", "cJ8JoQN6ilLdQQl3SR3Q", "RtKW0HWI2MeefkySAJYq", "4rRUIDVicY84RQYQg4gi", "QKL45HWDY22csT48eYqH", "6xJWLrw1vciKv1MyGqBo", "sBOkfQqJyhY5erZxgTzc", "5huygGww68kwH8fwYVEX", "Ckaoc7mIajsdQkc60Y26", "ek1wsgqOB2tMnRANYud6", "dWk1EK7Fs7JVpKPf0D2A", "GvW1LeOrZ1yCVgEk0Jzq", "PGLCbisZwujAnFB8uZ0R", "Ywd4apoa7lOUzigaQYAK", "SrUE7fMzCKQlE1popbMw", "KlQJT6std0E3rgHyMcvY", "wJJ9L6x8hI4z3SJWW9N9", "9ZB0GSxc4s8zAQ8VW3bC", "LfBM5SsZbEjknsj3IgdL", "WmKgAQ9gRkslN27SUy24", "CjmzbV1rBeCiOWOYuWDM", "G55e5C4aA4cKnOKMuJE5", "vQlKv8qne37u7CWCNbkX", "fMsRjAldTxiMOSgHaV4E", "WA6bMdmjCUFpp5EYD0Be", "xr0JJfYtAb5elCG7n2px", "W4kJ9zrMx2ysuyABdi3n", "J8S4IgA3gzyA1jU8gLSb", "OQTGOdR2MSndbDgrtqvZ", "ntkmaEuEXMpvmH98uZAE", "1wsa9WS1MNa7EItnUlz2", "7pvr65xye6Dd23EBZgCt", "1lyD3p0Ya0YhnTWrYTpA", "Z0oZ30lagvRfePsgErCm", "pkTcDxTmPGuyHiYIgHrM", "AI1ngsTsjffYP68c2ZMR", "pHN4xtLe8CyJSy46qXzZ", "Ac5ZgD9ikU9XjVaeOvGX", "5FoXDsc3PZaXBd6roDYY", "ff3MAd1ZYH6bWs7hkji7", "IGeRtiGhtoDZUHveuwBR", "CF0i77Orq6y6NcXEKowC", "c7l4MehHbsgl8gTDop5c", "w1hHcEVu0P6bXpftUK83", "DmoJRFWD5Zp1ZWG9jl3j", "B8IgxwXRGeURQIkrYF4d", "mscJMsS3bWlke3Qbzw1E", "aVfymOoIdstNiTh3L94u", "dpfFr3pozq2XJiW36KLh", "AE2rhjs0rwvUkYkbbZNZ", "NQ6g6akAs3p3GrsxZkwQ", "gpsQNazy7NVSlc9pArx3", "sm68by48g0WMpNlCxi83", "5eVoEcbORYRKIVSuRW07", "UXSJuDTptcsxEOlS0NqS", "vGmClC4Dh4IBZkTTvwJp", "W9mkXVCWs1ymHiy0s2BZ", "6UlgEC788OxfYhN3CYZ5", "ZVpoBno4n0drSMVeYdmf", "zjIVQfZbD6gkcVYnGLp3", "LTslnOPKzCzytHUIu1t8", "7Xqj0PVGkKH3l7oZVDrU", "NqRF5vXzuO51vwjtJE73", "WO4GTspz3eRPUseXl9Wd", "XafQUOJnaQo6msMFi9Cl", "ne8FUmmEtHrQrUoLs76S", "XuXHmtXU1jDoLM2o6o0y", "3rOuMBDCIJfoDC5x3aR4", "IdrbxrP1fPzjFObZZnjp", "6OdIYhFaFhcXKT9FKWGy", "uGf7cEe91Ny8kaOIFdqU", "KT0cu7rDd89VMocy0E72", "c58MdWcs9TLSwL2qSs13", "0AXKy7IxMPzyS7K4bwwk", "NFAJaD805923KZNGgdD0", "2AySFGWqBRZYghqHuyFx", "5H0NoLeVypTyySRDgx2r", "ObQ5IEKBCZ8Fr7ddSF8P", "2cN02oEikGY6pwB5ATEK", "3NZsSCVsPcHSCfSCResB", "uQGhMRlWtzouKOkmYDfy", "pwOzZqBzT48NSO3pooJh", "n8b8ULs2YXyMSMLzBVye", "X7zzT0mHo6yaCXigsaiP", "6fjWz2VAXUm2Zk02kmIX", "qG72onieLP1R2kx1nRAI", "twLQeLSP5kwwz1ylofN9", "4PZ67U5stFBmAUCondBs", "L7oK6n3uSR2UoZYt1bmv", "rxh1RsnEVz4q4tBBeC56", "d5YPc4Jef5ZU0EVP6Jbb", "IfQMYZVClbGNemmHq3tU", "8Sy8eSXjj8KzokLKHpX3", "QlQ2YAHMEAqKanTFFyyy", "5GxrzG9G5gHTQhUyslK4", "w9OWwpj9oh7rw2gtIp9M", "URnu6Hsw3A0zHPTDEDM0", "sRpoTVhkJp6nEtfK9XHC", "fF9xcc8ppTniudUM6A4P", "z8ADzpV8KkKy0Ttc61Rt", "SFbLq4huEjIDrSOqGtzY", "eHWclPCpReirrICfMrZa", "arlRK7IY0F6cWdCF2P4R", "1lHs3TXNL6xvwgNGndml", "qsMMTWaWvevwPCmQeJnz", "OisKOFY9qKteADzejZ8f", "D1ZbCM1qfpp1XhJuvr1j", "9uOK7Nyrw6U773iJPk73", "Xw24cMwVDyCNsYfyvdnp", "hHvmId4gLBjq6jti5pBH", "nNeeuHansNdZcWLu7PYT", "ZHHf1AL40WLlrxNlExX6", "K8duezplMNCvdUacevee", "P0OFxlyAjVG1duwHrj1B", "4D7fhfHKZuwwuKBp68zn", "bEoF6kUvTT6YhDDMrTgQ", "LbKFvW2zc0mDEZQIJvDl", "MJH3VSOKt2kEd4RZYUW8", "UJMgqmy9fBs2S93vaRFT", "Uxi507eWbBf3S1jIlfPP", "oIPFPQAzqQRIN7NNE0uq", "9XrZWZrHEEe3U1IsQQrG", "qIYCNtZctRQ0yHZUqOk3", "dM45MKxmkp2b5YnTPK3J", "kTJgkr9ZFrcsBgwX0tJi", "gJJkp4BFNEW5hplPeswu", "jWktAgQAaitG1AypD94a", "Nad2NOQ2FMwwtgp3LGCv", "w39xB8kOFowdOZdkw3mB", "Og7FKvIfBSY7Ti2fon33", "ZyewXIgRJQch6iwQdD6m", "der7Krk8enACjo8H4ogM", "EH1Izwia9oKkRBpl2Zsf", "L2r4ozJrl0DxHCFE8voF", "i809HpsJPkykknmXk6OT", "6ZQLldZuXL7FR7MivE1I", "xy0hlmEUsaxw7MHrxojU", "9qhay3IrII9DG9uzv7Tm", "fRgnnycikLDuBuU7ylwE", "35RHCJE6Ois47WpsSRaD", "ml7vgZ1cKxoL3DcDWpJv", "X9zcgmU8D2LxoSqS0r4K", "pqeq3E3Z3LSaUPAABeHO", "fcJT3Av31xLonzcqEeNH", "zqqTF0cRdtnIV5jWFeZE", "bv1MudC6HZOGNEkdCK2p", "Dp7guqD7SkM1dNNWyXcG", "50WSCE3PY5EjvKQn8bvb", "LFazawVYT5oW6JzGV2f4", "8ul1CBmKkht6uU3UQW3r", "brOf8LweLbgRTRSfbDyL", "urRpJSHjyKZYAxDIG9ub", "la3C2TsbgowZfMMzodgl", "wDJ6AWMOeF0Np1ZpUPQ9", "DLirh2qTfUCZiVdq00Fe", "DDz2EYqgwEn9ZT0EVog9", "HsizMMnMK0yXDxXPTN4P", "crX9LVOoI4xZueWG0JcI", "KYpVTMvxixKKopR7Lnud", "rpAmTg0RzdjH9WndtgYZ", "dqrPgIVz6PavEkfgQg7N", "HpfQLQ1C4XlfOc22vXzz", "uZu7JalhEs4Vhht15vD9", "SzoobroUMnTFMOMdw7KA", "xNdd2We8PpFqo4eOtTqD", "EKSbgmCarVinqLOsr20F", "pG5eIj09AqKP8lymVAMN", "d48TPWMFWKULYZxqGxxP", "mGos1mfWu1rY4z1TTLgz", "g8JEfG3wCyJwE7oFrTmj", "TbHXbHy2cd2GlLVRZWLl", "UefjjUwYvgHOIXvrostO", "VtfECAdmeyV8aBpHdmpY", "Q7xieqXQgRoBKTQXb1HF", "0mMYvBqYvd7Mk22MqamX", "1bgJ24oe63r4qDcjNQII", "4NemPf7DFtkESPVTTI5Z", "LwbB8CtVcBneWQPt5W6I", "NpWoEzHfHMDdGomO0ftd", "ohFK5eD88IQU7uIJrXy9", "tBk70WW0ANbw2pH7RSFa", "kd2pVK8Nr7WiGGpGkJFs", "hopjb4r3U4bDgd2Bx9Ym", "E2UUIHj1bwrIie1KgsLB", "vuMbXOmSVLEhNgAexrdY", "lSqT7slni6wb0ICVfxxA", "G9qbn0DjrqHcH63Owp9c", "t6EsMQN1LJAbQ0DE0Qxp", "FCPWISsCH1p9531SROTl", "hdM8bZKb0FODPnjiGbsV", "chegif884btjDFpon7Ol", "MkymYhSmGIHqyuWgZcmb", "CdJPr8BeEXNYILKo0kaE", "3r41lZfJBQsN3BksIwWW", "Rr4jCNVA55M6vR7e0lx9", "9qXCzH5HBZndRqKbBqkG", "t6NoVSRTDOdKCAXAPaRb", "7DEW3W6EMoSEsp2OITrT", "qSo0aJA0raZwnlRoHX0c", "JSqBGqXYIPz8pl6Q2HOt", "rxociFQxkOZ3qNE6EkcW", "9acwLiKOxiFmf3OLGmJ0", "Aq3zCG3Q0eu7EW1ZCMvA", "4BuiCH1T1IRC9T9JjCjh", "qdm27ncJ7VRCeMsrbtIc", "CjmJCtct6JYuuKv16VID", "0kNf4DUd7mFHV2Ygv8Zz", "P8sJQnIUIagGI1vMFPzK", "9DZfD7J6Ds4ayutNhBrx", "jXB2Z7MoUK6eXfHikaox", "QsXNmOkRXbMG7YGedbS5", "vWjQBy6vWuqvlNIVj0vG", "bFUgljKOKkSDG9bR8hMc", "ZCXKXnoGnhUNwx1igM4y", "6WBNgmmmR7O0JuJph73T", "mYoiVpO9BT7GxIbd2LNT", "SmRkekZJpcmb8YKbOgiX", "9pl55Mg5i4WAoysSiRlW", "2W784PiQ6QyDGhIJ4zPk", "1vsptlFaC06CUDLXb1xh", "RtuhZBzdAOLBHDy9yDj9", "BnJeycBZd6G5y9kXKj8S", "5TdNgZWdmFkv03ZygkYH", "pmMlv5IDoOfurGFVpl6Z", "yqVys4wWnSnaF8L8DbMz", "z1tqG6J5rQdnE8l6Agav", "6OVLUqShRmgQlYE1eW5U", "uiH8o1Dyfnul9P5dEXIf", "Jz44VG49m9dgrtnfu0bZ", "lVIttNU7snkBkmEF3IOp", "P0UGrHtjHSG0wYtpwOuo", "BcyvPA8SQUFpSj3J0u2F", "MIGIp95lVzXecTXzdfR3", "AgqcQtwOnwe8DuQ21UlV", "TI93kf2LKRNU6D5U5zsq", "vWy8ON8OrtrIAyKudKFy", "mcQsoVMtUCjOhgU33dPu", "WGCeFWYqrmmbMDR8gl19", "xjXeP1iSc5K9MWlZ1IPq", "4CPONqX3bWCWFhBejr4L", "wOSGvCpuUDiWN7ukvPlW", "ww09d9oK0sevH4BAGz2k", "AkEXp7FkW0EQuEaYOMqM", "CSFRXRblObUYJi38pIqK", "G4iBHIhdcVxpyDGTcqC0", "RgWjNZrApiS5kBGzRvc4", "RarNn5qNv0NLhr42QtAF", "ZdIKmXHDSsFrS6CDC2a5", "1vQgmSiAMqNtTdDFATRb", "LgQlndwxdU2ePRK9t0HD", "re7KHIYQlx16dRrO2nJg", "HMKenflef2qUgxpwDLMz", "GL3rktGneXTutlWeQIJ4", "K7Yz4LvFeFEsYGkI7y5l", "VWfNIC1gUIimPFlRYehB", "rt3P9niGll0HGfeYpdCH", "wt2J8lleQSpFLtfTgLhQ", "6hfKLHq8u3OouQ82BtgZ", "JUpcNU51nlPtQ4CjL2sE", "5E2zeAzn1eNK8CxTe0SR", "lsICuUvEXlSazUYbfVPg", "9mzFwwgYw7xixDsrgl5D", "VXlU0J6dnTHwDGA7Cqf9", "vapsnfkTQnevJOOJfSwS", "vDP8UXFeLslHSa9DDrhc", "fJVyhtFNJBpEMCKojXT5", "PEMpnT10Lic0z8whzB2J", "MrVg4qVlNyqlCAYzeZ0z", "FaxDitug4wzOlU4nKZZg", "VNPiYvfATd7gE4tuvnax", "hXJT2NGKvpyQBL6jHmri", "NyOb0IUt52qla9CaUSsN", "GroRAs8Pcx70tWZtm3kp", "4YaefmC9D4XRtJq4ByRo", "tZmm3LdpNNeRvD3azFhA", "HCb9TRBfNcRG9B2CWfzt", "0cItpLRmY9xoJYxny8QL", "ipcs0c2WI0OGcgAP0bBY", "i8K0fHndNDy42Yu2BwWR", "uuhUbptbP577BS7ohsR5", "5O95w355xcUqWAK5zEgO", "HmUQEZFvSeyV25Zx6e04", "GVsnfCscOXzdJR4V0HOQ", "vLuwQTrX7rZOKR9xbzY0", "UXdlyfGwwdLqyFmMgbtn", "QQ9jpGgRECRih2Ufiiae", "LvSJ8CgonXZEwhvlvZC9", "mdsTgM7M4h0OaRfgdJSR", "rzdleYWa7jhrKZLytSKw", "7JIfkxJLHlm6iNrNtNvz", "4cqNCBJ3bexgvFJdDcyU", "LjY24PPykKxnwnA6xT8W", "55ByJUZW5WyOFWQJtnFb", "7CO2yY6t0EN3KY2b1Z74", "53QIXrcQcpzi2Okyuqps", "5CwNlwykV3ob6Ctd1T1e", "J0MJM6FHu49xG5IzzGhV", "HT4LgvwhNxJgwfxIjAXe", "EhZSksQi67DObFjHAgwX", "bGBVv6mdGJFSyothgJPn", "Oa9znqEvUBT4PcZKhJvv", "bAMXxFEdWbOu9VuuM6qq", "HHugrSzYjsSK3os014bX", "e0PlTJgpOWefnYKeyHBi", "9d2APs8QxkvZiKKBc010", "WfdHBxu8C3qMgqU5hdTe", "NOD3iXEKWDK0qyG0tA86", "DwQrksuRVL3qjEtPk6iG", "H2G6yW6qeCup6IeoAYGg", "tJWaWO0GUgWjgkpfFtTr", "3Nh9dLynsCTjTyIzMGFo", "wjVcSLFhCiYG3DNgXJUP", "Vv6xrOwDeAzYrTBJoQyy", "7VE8iapFtHcNCjK25EFi", "MDGEgRVSqUOxzb5hBsv2", "9VPKChMIuZ0GkESOgyoU", "SDRPoU6zNzzUVPmh46xy", "exDOAflobZI3khSYBXVW", "UVzzsjhuqetUa4qihbWJ", "9oMtVnQeIvBmQ8mGrRBh", "329b60JnZp6gdRa6C0lU", "twGI20YtPjZTji2pgMbE", "9ful6SrGQckKWzcYz8QP", "qzqZfsNKCyYMbQ5gtwwH", "Zhb3eBcdK008zohch2wr", "ySBatGGkDC1krbnVmN74", "N5CKusxZutQtMaTDqjx1", "tyllXXEKuJMIPZaJRXsJ", "RGClofydMteGpOzNtBfn", "V13uYeBz91JYFTJ49FhT", "6JhwheJYqyMJxNBWzMT9", "NmhaEzeLCJoJdWFI8Wrw", "SBFPWQvUkPd59IgNFIiQ", "cVjFzwV7QM4sVJF2iBUS", "Y7WhNC3bUj16EiJDcpJ2", "9Nsde7dKG7loCHWXTX8v", "G70VpJgR6zREKJrxPUHf", "Z2SlJyIkTPgjWgCKxrj2", "q9G9Q56pXNT6Ovrfr7QK", "U411iEJf52ftBv2c06PV", "SsbqnQVeWtw0xyzdAIHF", "Jw6Sq74oDSKfKvT6Mziq", "qfqmbqPl6gyPd4qRBsFN", "KZ0dVUjpRPfH4T3dHTOO", "7MliPb9YUPtoyuRRO8Ep", "Yr6aLACcbayivkRIJYqn", "xkauczJ06YncNtAi1MJa", "xFHqxi8HEw2Cea4GYNEe", "v1GJtQzsnGTiWkWRQege", "YjoDHsRpGgTBfjSY8QRt", "esZ8c5a0hGeFxTQFLq4b", "UYl7FBgLZ5EEvlMVquVV", "B7j6a7LuxQTPwCX9MBVv", "Eh99TUeJO9pXEYepfxhb", "L80HLVRhgwcudk34CfOY", "mB61hioKdVtzduEwNfd4", "ZEwByyF8dbgQkkPRSDk4", "gd3JVHEtvrvU3rdzpr7R", "SopBYEczRK37y4OTJcKE", "SFhV7KVuBaLcOAnvONun", "ivuezH7IrQVJfCnmUGhe", "q0EDB18ZM2L2vDguUmAK", "CfbrpOcKcJyTJCgSBo0V", "oLYjYEb10jLCPw4EJgWv", "xSOEc2hnofJc0pJY3sX4", "csEznGD6ui1pAO4nQjYF", "OppOe7uizQkbIwa3Dm97", "SBvcXzNxgwA4j0QO5I44", "goexkE0vyA1QJw1qtOlZ", "Iwb2u1QzHU1yGfv0svuq", "3vFKrGAkcuJvqsxirLf8", "pg43Mx3Crv2uqFDfVNP8", "Fg13WylNJOW65Y9PWAbN", "6bFurSaKoxQ3cR58NoWg", "D0kGYtf22EP8nd0c3axr", "WNt6nyEAmipxiZDFRqHT", "4fZqIZSL8PBcl4iW0ugk", "dViJ3tYUkovmTUcj1549", "SDjBFRhFKOyxreEuXlMH", "ZH20jejlhlsAxcJC11SL", "NOGC2V5ZGRpnhrlQVSBB", "B4L8ecLfdl109HBBkGiy", "hXlOOUnswy380MGeybKc", "MJaVYleJ1NHhu13HVq9S", "nCanWqQUQk4m1dGZMssM", "FA38B4PetW6gggRCVrev", "ZhfaKtAgm02z835H8Uw1", "y2feh6oAwT3VAi6SaE8K", "C9JLCPaIrWHqXwSC1HMx", "iPSs5WIfiQzvXHEkeo0V", "LIJqCk2DzO8hlZXq5pWm", "FVhlmvTOjTu2jBqwts7s", "EEZzn6qqvKc9pJuaCLyu", "oquW0lQtbVmojJlUQbLJ", "vxSjFKHPfDHS2Cy2vOtU", "tdIbx45NdOgXK7EZPTw3", "gETgORgJnaleD4FA6JVj", "hAE1FSYcvVfah8G5XxMI", "V7xg9ArDTKxBS9AhajKV", "Cx3t6IwbDGuiLpOVzDiT", "WdcylmgLVyohvsYz8SbL", "iT32IPVHbBi7pK5Y7jta", "hhGbXmafF90vc1xsPSA0", "eq5RBAzGssoXZ485rhk4", "qlzRkxJ9NR71ICQRLPfD", "HTipYrsNYcRMLOl6J5Dh", "ULgkX79sWo3mImZqdRB9", "1aTNyFRIIexkzdVXicND", "RRxjDUXovivuGOHEdiUt", "LReK37pjjDwAetrpNMbG", "2WBIuQXW7zNSR1kS6aBq", "l8yNzoCLAnbDHkTBByfG", "y3gN2Qp9yyxj4v62hGNs", "1y3IhWSqV56R8mo9AbI9", "XFsc8xcqBzgDvhTcDvSg", "1Y57ItGRSWa0jQasLCgX", "9Kk41BhC79t6gwBwqQNG", "wvEeMmUhyAC7UuAT6rfB", "0WHeTSbHqwXnsmRCYvrV", "34aVyky4ZdFYAUCbvlsl", "iPWY9vkgqb9rdjKcSIez", "usX2KkdFTVzBsVh2RRiF", "1r5eYPEyiryahTa1DDFh", "gEqYhYa8xGMy5RbcqpYW", "eU4LyeL9raoVmd4TBca6", "rw5wLeW9T5g6XiRVNmdC", "KRi64mYDM8ID4NAP1eWS", "hCWFtwiGgLS1l85nsdzF", "lHSncaAbFh1wrYBkUu0A", "DR9wZFiSshhcy7PYia9x", "HAt8g3tAvrJ6IS3qhlGY", "SvAO2Zuk73fOBZVsaM0V", "DJbUmcIRNYznT79Tf3Cm", "4r9GOe8w08RBQ1fCdxb1", "VZmwgwOLxa62PFImrOir", "UA2u9g4mdgl7FY1tSPDP", "xJPLWh7N3pCWxCQ4sTrU", "9cbM8aDa0QyvhNGB3LW6", "9ic6v1BlU0FbaoxjP8JN", "ZFIEdXQgswk1dN6WMFFq", "FVPpHKWgSo1z3IEgpcMf", "W7h9Sldm0tcDMz0dJXIl", "LJlOZx3OZN25ShDsSoeQ", "hGb3DbfW8xIRE1ooyrAV", "CCYftjXJYCjFQKHeuwA0", "tQS5PEtL32qFENu66QNe", "a5s0P9cH5lIwBi1Zutux", "vlC785BCTZp3eh31oeJt", "PZnYFo79f26anGgtJr3m", "Qsp4Xr6LVNEuwzS9oaIR", "aM2LciEuXFgy8U0fL6zo", "RDgLB6UxemOE8QZj6lde", "1Ha7jak4fjq6vWS6bw3F", "hRUnq1Wun7YmN6r6hb9M", "LzQGUsK3nNIUmkHammVX", "r1HE88LpjS92PZGtQawD", "vDfgxwGhglCYlTmtb5gJ", "XpLxMcomAjz6wekrZ0XD", "kjlVDWOmZ257rR2D1oyB", "XvFRYzH7yoIiX4BiYXV7", "ZaCOzEZ03XAYTPy1NF6J", "1OzWQAFyhk6GIIcIVBIW", "jS4Aq0BDDFUEdTj2dy0I", "g4WyN8EsJXO2xQCnPLyc", "aSpCvWEYUEo8JK4eSJUm", "qqmlExZdIVEry13tXFQz", "RE7iZBMzUqlIeY2tTbWj", "6ia2jbuGoKFGWKy3UJ3w", "9mFoIHflq9Vus3xbfrqT", "93hdMgfqzgm6SzsjEXU4", "hxxX1s6eju5qynRKT4AQ", "kuUBuNu8sODXK84L0Bzh", "54V1rwJIzRgjMBsGWmOO", "9ZwTh0of9lMFprEfmYvl", "zcSJlLZH5wfETZfBaToh", "CBu209fmfaVcAywvHTAM", "PqZtPE2xgqfszZs0gXkL", "6GyECs8TLInj6McUbcRH", "Q49Qc0QIXAcbOYqaQy1j", "EnSL92pieEx5H5Vt5t9a", "1jCQH2yfyyPAlrVsuIZY", "VWbmb4dexkFxSRNjRJNN", "HmX0b1tVHS2mwbWWg7Ab", "qPWIotzFBMcS68Ti9KBQ", "mBBgnfCRnN0bmXtZOqoZ", "BP0HVTxel72VIBB3rOUc", "lTBV024Osrw3EwJjNEL8", "LLdcXmfMA8wtb7PZ9Rv1", "Gr3UnKB8YWEsqrUNc7hm", "Fdgok3NrSJqj8tBuBL2i", "pHaf620i9hTNK992AXtc", "okJubVonqpTd63JA5JtC", "1KZJRjKbEBB0tVuVyhGm", "WjPakikp0bzzvZIMGavS", "m7SfcK8YzOKV5j5pQocQ", "PcNJ9fdNEZp0gHfGZomZ", "A62En61BueZHEwYLaCio", "lXoPmRdJFPsOTtcEzdQt", "FzARujmUtSGcx4zhVa1j", "zr5QkfejI2aW0lvuSiMJ", "8cv6gun9UmqRetpMYT4p", "UeJUNEOnuk63K170ts7L", "fwmHpbbM3fBXKUzhiLVd", "3ZeNblLSdQoGMYXA89W9", "ofe67donyHO1q2MPlhsP", "7efUCBcKI6R6l5Bqizde", "E2d42zUogKBoyoGAxsTF", "yuKhyVXgU8Ji8wkBwExc", "W6OUuedsU45QwP5uuaZM", "js2pmn0izvJW1fyuIbkk", "fpBaFEU7p1UWtWLeJKMH", "FdnFJl7ZLpJyeUYrh1xU", "2R0uxJYFdsUrUH4l0BKJ", "0dIc6oSnpPHqqFklYGyA", "8S1ch5LgEfzCHHoN6G8t", "dNjTcRD8h9IoaHOHMkxY", "PxkgCX1Gl9APUrq6J1D0", "BVmlnB07vyeKtOz3t0Kf", "8S4cJshauuZ5NLo8WmER", "kskbGjf8hznpRpQih5Jb", "xseKDQRkDfBvXvXlcAtK", "7e7WTVEBaVkVNNoZnFJy", "uSuRMPAyX4GeiMAArOJQ", "u3tFOhoCw58oY0DsPOow", "Q5Y6PiGE5ZexbYCzDz9A", "4IyaICSgYHayK94hrJvw", "qYrR62PH1YR3qOe7Y4n6", "JL2bU6IMNEGEm8dqA279", "bXCPvoURrFXAbZk5d0Rz", "EgDyoqmwru5SPFpI4Kjt", "XG18nlEOmdNyJax5PjzE", "b2e0ITGKlzBJDCR0ydPi", "FkgWLbaiJZuuaYtq198l", "7J4KVTLR5i9KSoqlNORg", "yLZWtQMtXUeengzG9IiC", "ypWQbLAzjbdfvC9maVf8", "zHmkxj151hHzWoO87W5o", "7iS0vbnT7Sb4iMnf5mk5", "T22zoO5tuAh0t90mjnFo", "EpsuBdZEPIHsKIq6gvzZ", "4eZvmZhVLuJXh9Rqny3C", "GK3YateHmbqqGNl2wQVF", "Jmkyv9pg8srMAsvllZ0X", "9oMPB5P5WsJne1lXBYCH", "Q1dZtYIe6G9F2TcDZzG3", "rXoVZZ0k8C1WDc369JiF", "ZqSbJ2ms11tsYhL7HJpN", "WorhRtmaCSnkIFLcH6SG", "7M6f3PnIiadCPTsqMeQW", "6DGNQazfgPvnj1QlQB36", "mfJB8BzSnPwtaBGyjDdP", "bWAKVY5vk7zUmGfsReIE", "1C6ZLKX4W8R5eZP98T2q", "a1KKIzAhbQucay9wGg0m", "oSrQzFZ7ibxGaHYqEgYn", "6SNeOWaeAZPyzEMyTv69", "U1N5HvtVbRHfreKFBssL", "RHIQVeNxYT62SS5jNzDx", "OUaE8sRHlJbAarZ6Tw11", "N52pX5Zt2moREOdKF4cy", "OB8y2f2Vb3Vw7VmeaJXd", "3L2HidbxhBv5M12Mh4qG", "6LBBovpOELzHezWKc5HK", "FANZAPwpSk3W3Ehr9UFN", "pDcUA6onA45PCSyMqsBI", "cDofRTWbxkwnvXF5b1ql", "3vAEM7aCzkScxEFMhmxc", "UsNPNaUyaLidEqraxQkv", "8AV3OkP3ULgyD3NYeqUE", "BCpP1fyy3grBrKED5dHX", "wvW9wrfahAmsKaGLFCII", "q9RhUftXG84D3YKzQyY7", "8IySsCm5O4NCBmsdPl8e", "tDrwj9t97RFDkBeaNQgj", "S1vdonFDYNrPYgJIoDPv", "ce9MplvCBbtbcpEOaRa9", "pRWN6qdu33nffu0Vfvfo", "UXP6McTw333qSaCYOpQR", "qE4W82zmvcaP90UVcxQf", "0RUQzgzNVNmMbrqirpUn", "R2Cb2e4ebSIZum0rQxFv", "I1Fsq3ais2TI4dt5Ivhr", "MzPEjN57IK3aKGS8K0oA", "2HS5vJABDr2ZpPnWmqe4", "BffTt5ZB6OM6fmBY4JhH", "Bioy7ZUuP6wYlZzdfZol", "x8rat19xKoCVWyReXuWu", "0STk0QNfz9QwGFV9Ge4b", "QE4xCUZhO5ZMV06VRR8Q", "ZYLpmqy0S0bsEenO8M5U", "RcqvdvO4MXSt3nipbeq3", "ePus1hG94JbTwSMXNlZh", "I1bLnJBOyzQaOKTQzhX1", "z9VtZrQwczbuyCElUP8Q", "MY0iqR8p9ep6lKzK9NGk", "KrcI2q4WDAuZiuIWMOJT", "08ZlQY5YvJID9uVBjXfu", "hZUNRkrn6BE7HnsiJwGC", "FWPOOvX7SA08hUV9CNuG", "W9NnuETEAhQNDqmajHf9", "SfH77lGJ69acGvNA9pOH", "WnfibPIKgvR6bjCiSQ0Y", "ZY8pTVybKKsp7XXgunyZ", "gQdH7pyZGy7pWFdxibY3", "tPq1uLfp8eOo414Br2i7", "ypuS2VPk4wlyLZxFuc20", "GQnIQrRHr9MpwEHyighm", "aQkv0h9uIBvYaip0XGFO", "QZDMlUJT8yGhMycMgjFw", "v8UTqHTLYgjyFuI0OZUU", "ViBsgmCKTRGOXjpL0IgY", "yPUBJlCfIe8oMHg21qLV", "IbrpKhBJxprwFK5W3FAL", "tI9DZnGZeb4uAvhTcsmY", "ibSvvXRynbIerRsPF6yr", "f2lpvSIWJ24zeWuX3JUo", "tmTiDL7QR3H650tzRAVk", "CXjq3bO4sstjeKQpdXG4", "bV8eUzbv96fMdMAevYjl", "OaT2stqVO4XxXda1cBum", "GX6ttGWmnDWBlzCdq28E", "4fCbImbsxVcD3i5uxZfk", "mBtV858y5EC7rMj78Iz4", "ncFoIIjDpOxbXr6fuCby", "Qn5FAmMG4KIsuWeCoNQe", "jLDGAIt3UU1tG46OrTct", "nvjhROrDlFrTb3hlLbon", "3neHqlfhCIYzBIeagVnP", "jdsKgY3z9qkAbNSR856I", "NfHWxt6bMu05VrNBPR8W", "FseqD6ILCObX3s2yj8Z6", "0Y9VNXekwmEBdszqxHA7", "elcfcecJl9PlfXF22tky", "ey7Fp65mMDtyzTdZ8Dsr", "NGa2np5nhnlLmqabwdLG", "rCEofqLn1DeORFRC2Uzj", "Hi21YaaTEvj35wplkAWl", "LB8lOZxO1v6Id8IChqft", "mMwpGjayr7iAGqveNr0O", "m6ePFwbunEnXZhMnQvmF", "2UPIIJufAu3wzfJCct6N", "5tseaCSy7CB7eaPwrHZz", "Acv9HDLr6RCBK4osFEoK", "QzS4XryP7XOH7IQMVlEZ", "COiURWMgk8087SCeI81P", "fQgmg679pJi1hQV8vpmd", "xnm2DygT5isk6WVmaavP", "tbQazthugTYbEIdQEKtJ", "0m24GXqr5jEyKdYJWDCB", "himt0OJEgDWgxYkB3Y28", "HH6ZucqOq2XViKOgigvO", "tP2oxkz0I08XFC67owTc", "x15fJUMz8FL1eNnZ5mZN", "kfszpy6buaErbJVulptt", "4CsgZfFcQoxARpAGnErf", "m3VNN0F6p6yrIqXpUkRu", "WO2xDAByN2c947XP5kVs", "pTh7IEvmwMeSjePunYtA", "aVJcaq1dZVVOyCTEOOyK", "jamSF9M2hDCFgTsGKrtr", "MMFJWiXs7UCq4wGH3aHi", "oRyUvojDfa42xJLRzqK4", "KUsNR8eSjwBVN7zGtgTW", "HXWCordogxq0SjLrp0HW", "uQ1FXzWOfzvuVR6JHk5x", "fuv5dHuQFCx9cyO8vsWb", "sPTLrae6Ii1vcw1DBvdQ", "5aXgXwmSmI1egVxV3abL", "IcGsWF5i9g6CFeskYeAK", "vCxbfu6iUf1kHFcnVfTc", "KaoZChJkJT2EdznIstyK", "Wz5nDfZiJ2Ida6AmlRU5", "sXJWU7mMyjfViiGvNnbe", "qtFOyPBjodohA6DdBxx7", "gcaNKrGgesKSjapfxyPm", "bBTkFeNQbKWIx6dHvtvY", "jGyRon6jlTVLdw5saSHA", "knQhr3xnwsJg6H7u3Beo", "f77I4CAccPmNCC24DzpA", "q8owNvpQ6TDjYK1cXAD7", "ZzUmAXoNUbVKhJF4C4VH", "Vi0102cVApdjo7TwcFK7", "qpPX9caLe5c7lb9lblFl", "asUMzyJcBdh2Q4XXh7rL", "CRTv2cfdLuOvmrHjnaJy", "B00a5W7mdy5oQYhS8M4T", "EQMyHei4C13M01w3X3nB", "0sxQReqX1uzDLLCaxsfA", "rgUrfQsDRfMRYHrxvgUu", "YT8rnISkA5szjMrOmhZC", "NtdvATq69Kyfm6XZOzHW", "2AWlWL7H2hTNY4IjX8ne", "RlKBqriCozjo9DZeWevW", "LMuuQCbyJOai7utxjbAV", "YrJg4qIaVD6oX0gxBFtS", "bUAjM3e4coX8fpmhd4F8", "FKvmIZkRpdtQ539Q4mUe", "a1lEoXtSc9YrRTej3MBq", "x4G36ORAAvniuYuj5oBf", "vjVMB95CTG2QJGRPcsXm", "nKTgqNNuBWX6D2SO9WYc", "kY33pUQRNyC8Gfo709zC", "fWGtZhFiDoLvMMz9qPbB", "LlKcO6hOGgYvApmjU2Qf", "ojaA5XItvt5GcPq0TXMj", "BvdMiN3CPTpBCPMFve9q", "VE65bx54SPmcKNw2kzC8", "R1JbPdrKF0AiCEnnBqpc", "GbEawAbh7nnYn68AkzUx", "xcg7qTu0IhcYHq6Dyfs5", "TfeEmmOUjqReS5lIZdGp", "KsNbgRne7fkYLMm568Zn", "yyRQ4AgblvQ5nlfSAS6H", "7onS8XVCf2zb1Oz3WecH", "Z0NKj0mtSr9Xdu0mSTy5", "WwhVKgYrI88r8TCpTyit", "npRRkPDAs9FO5utOZPFr", "VLjdnvSEr98dwX4guFqm", "O49Uy0qXO3PtO8V91vOq", "2UTzzXftmUd9YmbWlR29", "UR0qXV0WPMMRooQnJ4g4", "YJD44mYpDawh1uVWQV2n", "pPEdBdQUh4WDMhFQTnDg", "O7LN1rsPMuCAHPnS2Cvj", "GRwc7B0awDHIIceKRWhm", "QuwgJj8Lv12ARwmY5n81", "yNKHywZPSGBq85WRpdki", "cms3gdZlOgnM35bz1ANR", "PWHXcmxPNh5zSw16Zasx", "GdHIitFh1c6Q9Lyl7v8U", "aDS09T7i3xdIatYGmnvl", "Q1CXM8IS1OuZbMalnfRr", "c37AwfQgSLRqKdNejd4k", "1xKbJsK7Vjw5m3FggdM6", "yovGPGu7uxrtu9SB1mGW", "UCbGDovrRHyP3rdR7WY1", "TNtNXJYW6p3azcoBRh2s", "zyG0ptPxPvwqJnDq7kMB", "ZNjWyVhPDkFAgVAWNYTk", "TNbmBmaIWvT3ICaGhHds", "zt2gMDCjldUE03z9pZRM", "UsPl2zziFbaEUdsqo2aX", "f2le5inuIDGk3eT6bToq", "4O5WzvMnyuKbu4Fzm1s2", "C6nFkELMh9CjWFDVBYH7", "SbiNfyKSxCU9JFO3UiN9", "rarLn4pwc633hmOLiild", "vFmCT8Fvqd2gBtzwwotY", "uwbaizvOgg1btllKuyFk", "ZGOk9Oh5Cac5UBfB9YZp", "CbO5M9OE7bzhrLPzj64w", "eez9qeIzAroMQCPlJlzQ", "Nw5EIVDzZGvEuuLkWdhe", "SVyrfMcy7ZNUUShkxsjX", "6dj1V2j2dRe5udwazWW6", "6tZYKEIF61mDeTC8VtA8", "KmCDN6lMdHRh9yFRCVgI", "WRT9ufHOZPWr9g2XnntQ", "3I7AGKbSpHjJgCQbqfzN", "2TECAHhx2aL5rQF7koYX", "6HokTDLHsIetmt5u8mpA", "KAE9aTHIInnM4b6VoQnf", "iRYSIbMOL9XfJlntC29U", "pworWtMKH7xzXVQn6kCR", "uh5DSs5euC7h9vYfmsx3", "yv1VQRGV9Qu37zFZpIEh", "UJObCuEznC0l51ETQSya", "ttb0qoYe4kLX3i8FcNCN", "XD6cCK5dl2BevkcjX8Nb", "sh8tNF7xcJL7URjhkmKV", "oT7hDhRiqmKiRQamfhkF", "05MTU5AEqShevmM6UlpK", "V70vXahBHRQGUnjzqrBg", "JrJCddG5O5PrAOmgwSrE", "rHSM49Jt0UZHLqTxTj2r", "nQhvmRbitSujiM5mTOdR", "qBiA1B7Vt7KeV1ZHRB0I", "bs1JD64gSh8JsqTs0YNt", "fhV9h4Q6DOOpHQ8UUC8x", "sGEi5ha5DxwsdRzITOOh", "mkW18cTdnaYfqkNtPwwc", "tqSUFSkjq8QaruazW3aJ", "b6wQqIJFEGr54IYKkI3Y", "PR8GLiDrko9Lu3jjL3wX", "HmbL49fmRgKq7S4S9IIr", "4RAySufoxcJCOuXQ3BCT", "rWJxwMP5ehwi65eZzKLu", "ue6GXbgaks3cOLZKhwOJ", "cI1iNfFMxYGpDK5iwlIg", "dKGzdnIKigdKyc0KFGgB", "ov0zF6f9pyoRG4QtqiBY", "MmsJMqdb4HmrCnqQrWXg", "SL7gQWXECgmZScqmSTNX", "k8OvtCJkgqO6CUma0HmC", "xYjN8Z9a0V5jdRcWevEI", "jaPt49R2RDDOjwmrUtQS", "OTBzvlTZehrMGEFKOfNp", "qYDaSxPupnNBFWBAIehu", "KWGalUs99Dwzl7XE5v8s", "gT3v0E3GrkA9HRh0tZ72", "l3zUAVgDQp54G7yEJ1UA", "kdHz2yzvW6xH9ulHPSVn", "FYsTfoizpC9XpPWpNTkt", "Zf8gaswxIRlXzbyfPgeC", "tlkgAEUWiENFsWwQOsNg", "H8BGh9t4oVHfFzJNDntv", "0H9sl3I9tdnAkwOR3GWr", "llW0kqOvbFpbUyTF1jMu", "N7273QY5g2wSnRQXFmRq", "0GSUEtkFd470C95DZdIE", "gDeRc4xrpOfpe7Jsz15c", "6AaGJfTqGm2uzgMbjJQY", "h5LJBe9AeCkiMKydxRRD", "DU6AASjrj7PQDihMLqUz", "2EhMWfzR4QeGukQ3A8ut", "FIHQ0ymLmGKoSzAyc7Ph", "Y2xQkLTvTOmhg47g2u2p", "8KbbKkXurvbPxWofqHaJ", "dN0JP6yPyyC6GofYWDTN", "82l3ZZgPqHgUcflzlhOh", "dbnuNTStetGkwzlTYRqN", "gUpG9YFsGeZtDLlaoERQ", "7hA1hvUDKIa1nNHuwXnC", "BK3MfpwR1Np62z6hsYvD", "rTEerVYn0Jx9cyVFlPhm", "kUrnUxSKVLXMnjyeDVPD", "mKNOIse2GJo0ndnFaEa6", "Z5QMpNy0sLDefY1wPfyf", "ykfjORzyfZ2CcRZPoVPg", "rdIW9JQYwOBu9rcXGbTt", "8U5ivc8j8XNz8fTIxuot", "I0mPpOu3xMw3q1llctUk", "PpjXUCnP6cJNa5mNRfQO", "1KRrJAcv44fTtMyLZmld", "M4yu7lFYOfwPzLEGVqCX", "srylCx4lhpM1rLvy4AWS", "nQpkj30DrCkj2hSEcWxJ", "KHIBcD8eLc463tqmwozl", "ziUzPuB1R8IjNas0l0c4", "dhAeayOVkMGj4jgRdrQ2", "xilLGeJ1ev3FcDtB9Get", "csbebH5D9TF691PPdiOH", "eRVEcONle1eEuFsTXvge", "OwiXv8wYqIpSjIfLf24H", "2jWuwONTK45i0oEtw8Rk", "REBAXoUCoYTqFzkCM6de", "AjK8VY1PhS98gIGD4iNt", "FrhUoQe8WGmgx7mSfnrK", "DyQrHf3LNQCcFu54KjCo", "xxUu4EMhzD0AAQ1P54iT", "Tv3in6k7ovvlsNguZ0ZY", "EZiM0jl3mTUDOYvBceGQ", "X9CNWqH3qqb2OHOOz9Pl", "duyzQrB2VPT0ZdN3Te7H", "TiKp0iDzqaiRUeQuVbvz", "1MzYzNbQzifQPzFNgQMU", "12vTgLM9vH6ud6SaR3yO", "mdn9d0WHRqlQsgrW1Dfu", "Smo5qGdFKbb4FODqNj7m", "ZqAPW1vVDYQfIEj8TMLn", "yxpBJ0zgj6SGuafOcYtp", "6HUPUDVxYriUmVf3VeiC", "i8Qaj3yLbp8f7c4ZoYUK", "NCo9hRAA3sMj1mJkpH3Q", "6B3Bl6iXeCr1Of834GD7", "9XqAJ9s8OvWT6YepeNNI", "XEHwsNxwb92kgss00k6O", "dbrj9UXlpu1M8GGybEvC", "Nvx1nn1lY6A9fztmTOXI", "IWfQmvNN7GZSBUUyITio", "XsxCrowJCTbUzEtj8G6F", "Wegh8AdObLC9BAL1yGK9", "htdf6WOEkTRG77vDFXcr", "smy2wH3tXN2FEduK8IWs", "jy7q302HXe6QQ4SLLTCt", "qC62p0NxGto0ptortq6R", "UCptEHCZiOQYaWaNUvJl", "n7lc0ZRtQXIsh7jvMvV4", "JtatQ9Hu4YdrfMSdutUK", "RnA8su2FpVJ7Osym1Df5", "lIxOfP1ZGWrhHzo9rqOf", "JgmhYkUZw9chPX64u7bB", "bQsqQe0HSMwl0iRWRv3N", "2g2PB8S6E3HnU7eumc9C", "w6wxmNRDGTYI7bfIh7Ov", "BfjdlLVVxehtkdoV0EiG", "hFWoqC6XHTRQ6A3rTYMQ", "B4Htf4OeI5uzKPn8Zrdq", "K4HPCIGfrd30fLtIPIwh", "NpefCPnlGOZZToyd7CJw", "nKwQfpj25djSQL5cksLz", "HtWihSLmeciSxcqaQXdV", "BKwbg1COsXN7Otp6J8qy", "jZOe9EEZmp5vAzUo0gCq", "CYxaPkejtVfa21EBFQlz", "EosMlNAj3KaDsXoGISx9", "vchxdt9qJsoVegrP1183", "KiGAE2QUVNdQxIMaBVRS", "NDyztpOtpUw9BCJPFiti", "5U63kSbvx0NIDLF5Bdy0", "6u7H4QeJ8VzCx6DhYocU", "pxk0H05Sb1QhtXwyvYF2", "3FEyJRfpDFJ0B21S24sd", "6GJzlDvgmBinOumhLPWX", "dqXmsYEsd6ThKmg5yclk", "lSV9MFqgfMDGAk20HEsu", "IKZc4Dh2nQkYsGhDVVt8", "q4MymMz3apvs9USEi9EV", "Yz4QFjbiFSr3WB1HY0K6", "oGzvkP7QXMw5LyTYh5Eu", "V3x0FzHnxbtjpqdaGk0l", "4uqNsHvaMASqDQqQN7DI", "g50Wvd49N4sSxippyjNI", "rq82EyTb3grkjrGdUKks", "MdIJJ57HoUafKiiYhB7i", "pxSZogCJ0w9LZPcrUj8H", "EiwWRc36l8ob5F8uvIBu", "EIFmfrd9ZjQnSLHtxKxh", "TjGYyOQugZosr1cWqDeP", "x4APNSGJmB0DuGktcAlG", "iX8ZYj4OuiorkyE8OSP9", "dNMYd4PDDATvhZUDIWbD", "EN2zKF5ihSrJpCpSGEfT", "M6M1fpEwLn7a97XTMa92", "21LrBAHPMuri0Djd2xZO", "igwroRK81SA1TTscd91z", "1sh14Oc6LCS2qOtcnClo", "etp5NfhymgynZdmd2PhL", "ZALPWF0KRj65cwAxZpwM", "Vs74TsfTHNnoV8B1NBJm", "uQrVKzQtoKDKCJMeB07Q", "NsEq1PpMb99TZywtwNkk", "hy2sHPUQPbqkS4aTTPn2", "WuU5tQwplhXTdYJsxnIK", "M62oAaFbx3cUx6XoUUbG", "97hkfyaalqu5wus4U7fP", "8Ft4LRsotS40ZjkEhIoQ", "8gV2YN62TjRbzJfKiW6b", "yAZVtHhYZTyf9UhfplhI", "U6sTNVm51sex1DSsU9R1", "cPgjrLOf63vb8n2VJobI", "fDGgRiYtqxtSLZAAtWpx", "ajYgWZBnLk60wKeN2BEs", "87JRfRcYxPVV82BdZLQu", "3UtzoXKpiXfpewGHNsnJ", "IHoOHy1qHSkIudIj9aWr", "7Bek8v1Vlnm14bQLXRBm", "rt4kVKTevzT088kG1kkm", "XWmb5AuaZ3MRwR9Pja3c", "ZXdfdLwe5gOaAA9GI3qs", "6BH3cQQJ0UwXzZCau8Ey", "maYxjiB1j1tqCArmaH6a", "j07iZKIRQUND5w8mcJnL", "If9Tp0FOGJwzJ4iqMyGk", "TdvWX3G7K3Rdga4UbJsr", "boqsqWhATvvuYqQ4seBA", "hanMBrqk9iZiUNaLsFTL", "AOFhDdl5HuFwV1Ieq8Ox", "qvfJIEeAT7VcUiJhL2kc", "wxZPyr1nyPkoIO7bcjj3", "pFdHvwyHyittdQGcIIPE", "f72yV8X5pG7cTktPfrgd", "XXUByllE18SgDSchY9mO", "QryrasGFhuqDSLMO47c5", "D4jQUM73VsPthNlHFzWx", "sLAKeWiibIloMUCqqKrK", "AGBreu9tudqkyy4aSkI3", "21pMW2CKK2cUImLwgSqY", "4eI0bKb34r56tsSNsdfC", "fIex4ysiQiHUKXVvs4xw", "v21msT9l4pxj5af7YXpw", "D4PXcsRSwOOpOPcGrl1v", "YxddXGk3nYzyaOVAEwcA", "I10eOcvDLu9urkXM0GPn", "mNlMjEVy976P644Tgzg0", "tpujZR3XfRKPo3kVGFRP", "MYmRcquHpaHhOBOvaRTE", "qldenN81cZQx7AMi1Gxo", "oETANr4vHX95Gni18q2j", "PQgVb2BcG8O2KsDhhHcw", "mk20Vk0dY2MxT0Q20bcG", "h0H1qUgYjJST1URWCR7k", "UUgvU4vTeXjLV0LMS1s9", "IKaJn2nxRvitPMorOhK2", "C2Mi0h2RiuYzC9Iz96va", "zdUMxGDLwWM8WiqWNqv5", "iU2vbJskNnIMOkiJztfv", "Pz3vhsQ4iL7RnAKOTA6q", "yPAK7se6lHz9G32vtSzZ", "m4yZCIydR4RPRbhZTJdD", "abMoeOjVpi4bl18xH6bi", "925acn756jIfKcTw1DPq", "tRPcSXakc9Sl9YJlJPpP", "652QiWKjhjXaAuDbPlL1", "snkzJ4lcRY0Xd2vLWD2D", "wXm4Rxfpg0qYmbX3dGg2", "oeZQgSlDfoOZJAdj5HYl", "FOH1xn5Y3jaqN9G1ZzEE", "lbn5jPopgMYviqvgd0Ce", "hnS4ug5UgIiRtUUatIPX", "cwSLmNzNLB12yS6t8ALo", "S1EJVitM1HtbDKwxhtK1", "3J31l8suIBgiDuzgds3c", "7uDIEAFu1Zv4rw4c2uUI", "6B0H5zxiqyKxtWE5eTzf", "1sksnmSpgx8k681B6zsw", "xArog5uKXryYkgOXSqK6", "lSrrZs1frrZn1ObgSV0z", "NyV5eta4huBRN2GwuFZk", "66X8S6mucmrxjM2LDcQt", "WZIrbYlToKDsOiyrpkjP", "VbMEvMX7wvySUGI3m3XY", "MiRkPPZC8JbdsvrlHMsD", "Iodk4vopxJNJzm3OAbaI", "u9vk2kVH6OSMC67Fzt2w", "CPF9AHYKs6ckEVUGFzYJ", "L0gW4lj4elyo8CxIRTaH", "aA1ofT4sQcCkbsEfdvhF", "gg3mq03HUdY2mXoRysIM", "TU42MIhxDNCr1DerBh6d", "Icf49TU5KmPlGUnamUVy", "rfpssTh38nfRPITWmxZ4", "hzpvTcTD4yBub1kTUSVb", "F82dQT9APhE6g129dTMg", "QYa1XIVzkyay6aZW4ifT", "NtZ3vZAW1VCR1kSY3vXl", "r8jviIQmz5DMylOtIYOJ", "1ak2JBaM667wEpru5Hf4", "MsPLblCuJYDJ9wLQ5wmB", "2r7Egx6kElmbc9uDu47C", "dJVkDqAIkuRklZwQU38i", "ouHQ4BeyEjAp2fZFUhXE", "bzxKWti0wqglly9p7llL", "Vw8VZhl1MGGxDDGh6yf1", "pMmYItLNf6j80pdaXMbt", "bppo05U5196oTqMjjf7M", "moUmd6K8Su03hpqisKnr", "Rrgvh0cOgjjQXDABHTHk", "NHl46bkwtVoLKUE1SqO8", "a7W5IhEaAWIVn3XsdImW", "lar6255VuRbUY8XpnmNv", "GfQ1gxtJDgoxEf3Hj6kd", "YL54RctCME7arXcYTVpg", "9dbOHed0jNbHggJ6GBIb", "PQBHvnnOHc3QEemVHNT0", "k4FPiWVyhnZ7BlM7W9Vn", "jWCv9wOQKrO2tbRb7wYp", "i7utqG0NNUA4yKy7HMXb", "Ctd5U3fcxDPfIJX9XVUs", "zcwwxu3CFZnRQOUvP9VN", "Ku2dBXki3Ca0oUwjNyvc", "Xg3v5VqSfJpzDqaMNI2Q", "UaRH5L0QJu2oa3kdYa6B", "st95jjQ50STU3uj6GiWX", "cWMAZ6o5esHWlQaT90Y7", "Q1cTuJZ813fdZzo85aCi", "STEDtme0kC8BCic41AC3", "DpenpQts05YSWlePXGQG", "TWRdE3hDBrGPetARJ1IK", "5qkbbMz7dNN4toh5pMI1", "BXOpQWHjVX1aNmAz876l", "URnLFUO2og1zBNnbt2JP", "ZKxw45tDCxweOkzbCNe1", "2dyD1lnun6HMODHTIAeT", "6Y7UG54TSgSSJQgICTBz", "XSMtdbMwlyNrXUKnZME0", "2gSJ76cJZnG4DaypBIjv", "H6kma2Z8Oo6OSYiZfIqC", "37FEfD3rTmmksUURX4Xv", "qdKIB0qoIg1JlEXRRbGs", "L0bEU5d19AvxnFGwD4lV", "kkmUyJtNs9DE7oQbu1b1", "BWzwjDqwHZPzJ9TFSMaJ", "ToVacvAWujW3DVzwinqx", "NDweMQumkS5EEampTuJN", "dpQqKNk0BYxYjuC5I4s2", "VvEjU1YxtsJXhhL0540E", "cymMqwP6zF8UBLBdKiaD", "atkFZ4Fe8GsiCc40WS6T", "hCvqX7Trp25NtncSrq4x", "4wgGWiG1AKUqWOe4V8vI", "8yd1kDUb3YZ7TDLxvZw4", "tPuOnYSGeLWmI9o2MGdO", "mATFLpBHM7JEUDcHj4XO", "N18fAuhVAJrxRKAl7J0U", "PJgtUIBDMgZhigNqa2Jj", "JAgjToUY6U2VniOHyXSI", "E00ugLiGN0zf8dObQsAW", "MAz7rNMpto85o6xURfjm", "fgRmKnNifVEzeB6VYQIP", "FOU1URUv5Dgit7UBvqtY", "J5YxGcQn3hCG5fHa6jTB", "w9uoFMx8CrgWuCRBpswq", "Z64clLCs5e1zltl0Ej8Q", "apuS1MdoCXcjegLP0WF3", "8F2t8muMV0l3pfVpz7bB", "eEsIsEgsivvqAwjHibbB", "cMEP0hCzoo9R0zhsBNjt", "HchPYRgE0IPccd2cJCa7", "0hYygEpsbWjs8RGhqwvq", "CJTpwTPFfxLeeraJ5P9f", "tsV2Hlj7gcysvRfqs33V", "0M9dCiuH53uztQ19BiGr", "KEiEdN2TQ3zPQ80couru", "vmtmCuvLcCBuOt80E8Td", "CS0aZ0ANu1HnlAZx4THe", "fSZ1Jf1XoV8yv8YU8iq0", "j7nVGLQIofxR5WSO9Sux", "v2vqBRJH99IrE3KUOinA", "OkbTE2qLSkJNkCBvcUBj", "bTaqUsKtZ73vpdM1dCN5", "ueSfodaQ6jAhAiXfZqW8", "xZ3lAPmna9sUlI9aui00", "R8fcpBHO1nUwKXhTuSGU", "Z7xLP6vJmtHE0vop63B7", "of18AjZ49oXivU1IYwcL", "orXmmLZsOkxCPzIZgqbp", "e6VZaXr7RRQDJxx3IWue", "Grodo4ASukFYql7PGxWh", "Owtftqh9NblbSZDFdNhY", "7x6wgCLw7rbTlS9cJole", "PUFp3Q4emmCrhHnLR8FY", "zq1iJ8Kaw3ELXRBasDDc", "xNTeeHx3PCbN3b5KjOse", "R6xzV6XLKkxH8Pukgro3", "4NO5ySNgqFIFJFEmMk8e", "S3taSlJ6b58fSWiPw33k", "IL0ZaELuwRWPVOzv9G2k", "LANme39b6CJMXJv5YFyU", "gSt9qr5057iPF69r9IQE", "Ukaz3U2Zhy2NRtXHiaFo", "fyBu2Kj9aAN2sw1vQ1V7", "0VSPOxe7XutCq24sMo1w", "wNwoJvhjwAoufGJ4Ey9j", "s0wg2yYMkXIguESD7Au3", "KiyyxF09D9s39mj9lFVT", "ll8fxar4ij71S3zNJxWU", "6MYD7FKsTpJEaRrV0iZi", "SehsieDzbhTf3zqAFA0g", "zKuXjl2jSbQsG5iwkvvJ", "cMzdMnmZykFv27TmsVTI", "5tAJzsFhl80LSxzmljJh", "TWcUd5EUZhmebvvYl8FX", "EDsg9pRuWkb0HDSsHgMq", "N7Sw0NUlVhGjv7N4wowT", "XVRogtexX1nu6Dp6aJr3", "z6msD8u9woaTJ1FzsuvP", "tgIxu73UOsYLyIDBQ5JL", "ttmCt0Ajs59ljPidUj8q", "beCYwNjLT2gMwQXnQfWI", "id1R2h5WQDL0pXYjuH4N", "IiiC7FzXuVoc7p39V8ev", "Jzt6URqOhskxZS9gf6DZ", "Zz9gnAoIHSBYP5ftUVF9", "Lz6uRDa6JmdrjmXWvLoC", "l0k83PzXsFhEEl6ezfiG", "PK784dfzwRBiRwoSJo0C", "1fOFOSrN7YcUshdwKGuH", "f5x5zjXHXXRYAnmZFbuL", "9WpzCQwWeolKriPrSw6x", "SXWaKG9Xr2szWgyi6sFj", "gy3YhQN7KT2kyYLGmSlc", "UebzIZhMSu56t6cYWzfp", "QhZMEscyLMan0BmGjScB", "MiFFmslHpO6G6daIWBEp", "XpaVyLlhnNq736Lqy65n", "VB1ZmcpIn35IsenrzYWm", "tNrxTClPJqAmzALlm82X", "B7n2lari8NS1kKwBWfan", "TjZStsEd0EAAJxC3V3ld", "OEc9WXK0AtoecL6VCI8C", "WGMqBWtgZcHwor5KMNLX", "G7BqSFLeYRp2h9qqghUD", "Kl98bETxamSotdfJr0yP", "QlP7uGwaxQoFAxOlApgk", "Z9WSkBlbAhyaSOfLcbvX", "2hnCd9vnwbVVi1vTBg4L", "M1tmPY7z81WAiHKLOD6K", "oZnVZiykN03j1wTOSbNa", "asiI70cWDgo0EcVnITVf", "RWMTQqpsPBTz3BFACpeP", "WTNi3sTLLy1lSLEs91kW", "CDTFNjOXW2w0TKiWABsU", "7rFZATRKSAqfLKui1GFX", "HAWkSEHcQ74VyJ58kUQD", "cHsyZkeazs5G0b0SoF2E", "M7jIOmP9FpMr6CpdwSBv", "KH9KqAkeNkqipY0EKPNZ", "FhPJtCxne8hwNqECyyqM", "hh2WD2iXQ35diSwZerNJ", "y4DJsSVrOMB31DaEDGjd", "KmG0EBar2x8yzLIrlngA", "7rD62lIG02tKm8KzJuqJ", "pwGmHYe3LIBRAOXC8qS8", "qKQaQiZjbN0QJGDZopc8", "7lXF94QFusNiAlJaUsH5", "EGTVWg4JTePbPwoXyEmr", "58ZFtsoNj3QxJuSqYV72", "9WbZQP6OesFjypwsfkDO", "meJ5Wkv4F26OWfvw51Jh", "sYOoLKgz3sLpUdu0No4a", "o9wLmsFrrYWh5uWODCLG", "2h3WKvWfjZFWgBpS14It", "boYeh40uFM8H3BmN4I2m", "pFIVQ7wQ9EJk0pMhuNb9", "jhOmsA7vT9hGOzkm6gCF", "uTyuJKaBh9KQriAhtHcK", "OJYmIIXMyhaq9YjQqJbY", "SvwHb7zSObkntJX9Z2WY", "k4Mrc5HQMsynlt4K03nM", "dV9WmffMh9sPDEGnIVEe", "NAP61UR1VCO6fVcSAGoq", "NeDZsUK8zWlLhAPicoi6", "04CeZn6i1sWOWjxMBIV9", "oGSTQrA1gq7euJIR4O95", "EdUkNP7WfafSq7tEz1Fd", "rKHlcYBgwKm9wEtJbypF", "YThOaabXco8R9QBlyMPs", "e91aNtrxrfCO8tkgRLE1", "8KTHkc0gyNXcXWDuP4pF", "j1bpsLWKfiJn2k4lM2PK", "PwxwT8pqAe3ueehW0Bof", "t6QuqSdBU2TrxOmOWbEh", "DGZruEMsQAVHGv95NmEp", "phhk4T8a2MFDcm3V1PNR", "XtgmmqpAc3zPie9m5HL5", "caJCNKhMh3lEuRygHnos", "qoHXSPJWgebGFuTaC8ut", "Bf6364kMsWEgKVDluVHZ", "9spMlGuxPopYRvaYzIsp", "o6U7ZfsSA71Kxoeg5ZcS", "LRynMYJJqB7dHbkoGcGP", "hFhc2LJ7svXEMT1g0Kzo", "T4RifBWullJS0y32JM7A", "HcOb6NF4fCs8HKouVKoF", "35f23i2L4AVJktsoE7st", "Il1Z5pTY7Gn9LTBN9DiE", "LDV64MuIRlBjWAIZxk52", "0tBJKMgRaMdvZ9zbVsrw", "d0g78we5ej6caFwscaKA", "xx3U636ZtvUWw8b42F8h", "yCJZRDR3ojBjhFDlGHL9", "Dnd7vE9xTHcPRuyt7Owt", "76coJoYZ3rgEeJLZVTUy", "k7NC1K36ix0n3aaMM8tQ", "zZcdqyALReH9jfJkxMrf", "KpQLN0ii6b659igzeoJ5", "TaDADUvApkn7XESuE8cJ", "igOrP3o3r57IgITtmM4Z", "6rgd37VIF6ZxmxmByZDq", "cK6IcXAOtCwx1cY5j4Lx", "8usspd4oAHcmZi3BGDX7", "PT5Q4dVnfoinibgYCiMM", "xw8WeBfsMC0lg3AkgdVM", "SC98nngzV0JQwRwZbbRx", "mPjQSrA7UdTupa3aMjXp", "iqGeIADtkfoW2XwTM4ar", "f1lVbm3vUblCR1qhB4Yv", "hNPhsLAFNk43lnWLaZG4", "8zGY06FA8o3n9TV1mfGA", "OKD76jQgGfkPeyxd2AnB", "woy5HR545JETcPYi6zOM", "c6jE4er6ncFjRCnidski", "By9nNiTTfroFvVTzAJ4v", "vJeKVR19HlpRkzC5fgXK", "XJXTo0QwJUrDmUXHtYOB", "ICa2Bm5oSa6ytdPgdpav", "IQ62udHlAgwSqUS1HVpj", "6vfxW4b9sA28a8AUkRFu", "5AKvemutFjdJcGF8LqGD", "yGJYPT07uE10MJvy3qsI", "XTc8jpE2dSFcjWA8zBFu", "PEsjVlhYZZq52QDmFPot", "s2VbYdhWmuOB6Gsbza9Z", "9xeCMpwZCiQ4itdFXIlJ", "A9TGNLpMvwt5sVFEI9lV", "rCXY59naRYucfLq2eeMa", "aGdQlqe4xOZoa4KdD7Ef", "d6FIR3I3hfbGvCge2Jiz", "hFmFK6sXC6ApAN6ZROd6", "3EKwRzbRIHPxXBCrF2OR", "7ZHHwNrLjSQlgkf5hGXz", "Wwu354uI7GkEpzVkKK33", "mRmRCSWrg1pCvjFyo7Hv", "Oz7ByatGvxHhO46YUdQA", "cFLYwaWignb4kiDiJ7yE", "2EtOIyvmbJuDYFjSoGBU", "1mYmVlSmqPysdpHtnCdO", "VXa1nJRbXc3XNbHqKhcB", "6a1hPIaBSDXvj7uUPM5u", "y8PJhe9zMl8QJA8hQgst", "sPmbVh3s38mzEAJtoSqA", "CzbT9hAXL0ODOBmrspjt", "vTs7d9ySapako9DvqMSC", "KrNi0AZsxGjtkZyLjxlH", "mM1YVETKYvUtkrZkz7ax", "NJo5rkRYhCpRWoz00SKZ", "MoS6dzpb6NWUfKXW4y4k", "9rBffBffbxCxjc2Ncpyi", "CUArmiNoePYnGiRtt4XU", "2jQlMS6yH2eTUpJEVg19", "4XvIFKC6OhbQQzAkREig", "FL7j8Qwd5xk7UdPixZoM", "ENkfMsPl76RMRX3ZvzAy", "us3PWT5T0tnFHWsdOFPV", "LopkJtHFqRBlKF8ogDFe", "63rLXjzvzMRIAE3S7Kfw", "kqf23nqjy5M26DOdvLXs", "hyApABHGWuCElrGoc6WY", "9saE3wpyHMqyI1mTA1je", "wvsfk8RKCxsKnSYrPNpe", "keb2fNTpMCSI5KxpRP9d", "Kzx8STxprkTZO4Z1P3rm", "FJ2Jby62LEefDZld3iSs", "TuRpwyrK1g4Fx6YY2ebN", "sD16mmjpTAhu46jy5aI4", "GMJDRrkTULrKWsQIc885", "GnzIuhGxHX1WtLjKATmc", "mdxIVLb5RhBhU8zMpEJ7", "lLbceKxmmjPWKMnnfMs7", "33oVAosz0B4lUfN80Itk", "zIGJc14HNxOQyDw8zm8x", "vAiQq3WoMPYLfmdHofZ9", "cvaZ6Uh3En09yiXmk4a6", "R6P7q0OcgvmGrKpvmVz0", "Gx9CehyOjYUAcrHTse5W", "ZrmOBcIx5HvLC3YqkUER", "1gbdYr6OVCu21gPBGh6L", "w2f85BznfBCgsnKOcOk7", "Ye8aIXjXEpqApVIsgFdM", "Rp0JbIfDhPJF1RnJyWoA", "KfK9Aa0rqdBFTBW4UBH9", "aaMZzAsxeh5wMN4Uy4Jm", "hU1AeXC6gUFE2bn2jdxM", "K1IeOK7MOQ66t7EVcRbI", "toUtNHt7vpRDqjqE2xZQ", "LfUElhjN6Iex68qUOiZH", "X0ULhIZjD8AZmcnXJVsP", "nWMudBOztvGQvilc1IKE", "PUlB4ZgO4Ynp38jeJ5dC", "0ravXLWYbql0IW9M3pi5", "OWvPee3vie7iThc006Xb", "uIcCmjWoZFtvjmKLPLG7", "xNnQ2PQ2TxbNDBXyv4mU", "HdN0QfJp0ZwxujNu7lwa", "jVyuhTscXc4oGRme65T4", "cN1W4MQ97KioqejX7Z7f", "CBRQcC4gHVkuqjOu5p2A", "7kzxOgSVDZAPkanKmpy1", "Iiv8RK1U73dElcA9GceT", "AnrsLcD7SB8is2pHMqkR", "rNdcxnjDONgW8VOT8baY", "lhGbj5q3taSix5Kur35D", "PkjXF7zLhZtQE81xBry5", "QQnNW6GN7LaU3H0JOzc5", "WWTlcUinKhsk5e5biLwp", "fUIilIzAHcDn6hYg9FTT", "uKBzyHZeaVRFyjwj1trG", "V34ZkaFrphJh1UhxjGbK", "j2XhkTPjNG0qJ4O1ebtS", "IA9JeoEM2pgkqBRYfoH0", "5HoMJCOwmFO4PVM1IYNK", "M14ADUiqIzqLHciYn6UZ", "JqbiMvheU5wq4z0FRi5j", "ft3uWlTHpxq8oRo8NVkp", "Yefddds4Lwm0ppvJYMaN", "JOT5oHB9mtyJYbwBEmEZ", "iyXWlQnJmMe4k77YMJf6", "CdPiEJuS46zm4VGpv26g", "Mki6ppd96IFHudz8wrZ0", "xYlz3zoxzubLcHQR41aB", "HoQBRNILFrKAN3AP2wM2", "pvLRClrGmPP4DnFcBXwO", "MGYkJg9JdTJQMfrYQgmB", "6AFHxSs8yoWK432LjBeK", "cykybaU1EHCIPPaMsSTq", "Ex8I0BbiKF0vBjtkHMkV", "buo0KMMCmn00l8GjHrRc", "4QXE9OyQkgtLbhJv1g5n", "T5lCB1wTqN3tlY5uw1Kf", "iE0JtIEtyHgPMQcVPYwE", "tz7fXAXSBq7t25AtNOmJ", "fRjzrJTGpPUgNZJujrMt", "hRkjXvcuHNEvovufCLt1", "lMh6t10bqLUXkEEH9oAP", "BMKxFCcRYUSHq9Nj8LKy", "emTP1fe8UoVd8pbN2BoY", "fGpTOADUVVTAIwXHcBN4", "ytf6iEUiOIG3X5XvDiPj", "DqrTlOkLX8NV12chF4Qd", "MggrkBkxt8e5yTYjpJ2N", "PPqOQS5fWTIr8wiq8Tnz", "bQ2XtbFjsH4Hhud7Ngmr", "A2gIyP84qt2PH4wBdBsV", "Twk8qLFB2z1C1hSx4Y2s", "R4Hj6CskLkDmgwuWH7gH", "6hT5Ot3RR5Jr7bYBnQv6", "87tm1nGGvwYzd150t8RK", "Bk9GJhR45LBBQ4xRrEhk", "AFkmFnm8vBQ4taKDFlHJ", "4QUUUSvKeb2oqmY3ZI9S", "TaWN8oYLYnecE97gZ0yD", "b1zQlWTJoblGBGbH49cc", "uFF8MKntKl6wm3KWXnpM", "OYaXoBmrINRCceJyy6pH", "rvDcwX6UIvofTOAGXv7p", "IW1sBIo9OdQEWboQ6uuN", "pg0G28WZ3bOL8OBJgzQ3", "cpH6O5XTxPqm6q08wVg0", "64JCQVT5Su85hN95SgYN", "6M9CA7I7cy7j1QtPtNUM", "HaPwxY1NFYkLurV3zlAb", "kFIjdC8XZdtoDGi9ojW1", "FHK88pB5ZJhJYx0B98gg", "jXSxnA6asab7rwDyjM3I", "fiZBgZLngzUPXuKI5Osx", "zU2oOEm7aoOEWvNCTi09", "gSYDKtVPFOKEqL3CXnJ7", "bfJ8bhI4NGB3ijE1aiQq", "4j2u236ZrNeS1yaadrcy", "7n0oUEp3wDr0wtsyxwXm", "ICEH8nrleThjEhXiuMjo", "aapUSfRNaw9q6L7E6wxk", "NfUbKzHEM13ubqO1TpO1", "mXrsry5xs0gFd8qy78AR", "7DLg1iiTV6UFcM6RIBOB", "B4QnCFlILvjS7586loZG", "t4WVQauglIruNIhXXQpq", "KZIPcOVND5b675ZVfTBO", "l3H6JwcoLRefyw4YKXtV", "aVbhYACEbOaNRrRim3W7", "VAkR4o0MJtsuMRbvcm7D", "AhYZX0FH1lOUt6wvuuHB", "n75AZf39RAMZpt6MrLbs", "6xNx3HsxB77yDC6mr9vG", "JFp96tTxE5oI0BF4Q5zb", "B6XOJe88l1N5GACL4dGI", "g4bhDoldskC3rkP8MXE7", "YZAmkK7oyO4cSfJeS2HK", "lUNaCmiYHufpUqZC8h06", "32jTg0781NQmpnM1X2Zo", "wCbO0Aa9pYFsbwMFvRNw", "onidY4c34Bp0OQNMYvVO", "UjE3dYIY0dUmOAOwC0zG", "CmFYCcuiXO6z7L0ktIJr", "tleHu2B628LCuai4Abnf", "ztd6Edo6u5xnrb3jbEnc", "N8oHgXMo69U505BDizJc", "5GOuqRbPfO10XqIBLc0R", "lSUlXfyFcFqfUCXKd8hG", "XjH2XZDs9DHufldAOaQy", "nEcHQ7Z1GHHl0YlX5yNE", "Ac6nNiyjIMf3aFLyNuzb", "9GM9n7eq315Dd9zyrvf7", "HLBpYUnvOmWY0sfnxKe1", "JhCxo9te4ZlLsuAQOvMl", "hqHihuTeE5dYmoTZxKD0", "twLjrU8DPSw5IDlz8EcK", "KDq41HdxcqxTlGDciLn6", "nkB5vw338fMSqAVsS8n4", "xiXiyiIf35lqnwujqvky", "Y6POHuEh01lxjGdgzvL0", "z6rm0jVqeGmAKBYZ5nG6", "oz1WGfCDYXDXb2IbjnPL", "1BVKL4tQr8Ud7U9L7JYf", "qkBPmTyWENpEZLYuPPIG", "XltdD1yKKVx9D6YzXXTm", "sJ0PcWH1vYFRH64U70mS", "TjZgo7eLc57TM5syZAxT", "iCuzJwRQuDqMuP2iVe45", "i9Y4DR1mZyDFB7CS1dsu", "ohGi4IRZvTddaBfnaeY7", "dlMmrWEs94mxl2gqJ5NC", "Wyn6AQui5SogBAS2hgvo", "ifkUgOIxTd7zcu3kKxQP", "NE5ZNVb29Uqs8aKmwcjP", "DoMpiQX0LyOhARGXxpZ6", "IOwQwGAtqtG4hbrNzNNK", "JlzTDFz83WELuBjpPtgG", "kwKPX9kUW7pproH22GA3", "mMMfV5UvwABe4T1acl49", "qrwfgDhgTrhEE3tj6Nc2", "VneXGf7rOCyC3ush8ZLZ", "P2nb5gIB1vBUin2xQ7oo", "Jm1Ler2kOMKnO5OSkfbj", "anEGaEDzLzndjmyOby60", "KQnhUA9EpkvNV9d4Lp3h", "mqIWbGsCEyAXNyEr6L3t", "5yGb6tdRgg6TUOx5cpGp", "lQM8MYxSt0LwxZV3R8S7", "oXYJtVMWIaL41fALB8m4", "6703hU66cXDR4kixD4TU", "fmWePgzaolctrbwW53ch", "an6cXoZlt1DWnjABP9lC", "tO5kx1G22qjadqCBemuV", "l71YqBhDJRNCnSwkSAmU", "0V3bJDmwxeRijRHXcwlt", "N85AZzu17gT5AUhTiRPf", "6pOnGdLqZ4kxCn7jn0is", "gCyqefIM6h2AUOyk1HbY", "LLVV8bFtbxmF7i4mNM8R", "18aWUYGVnp288XdF6s8f", "ostvaxhvJoLIuvoPR3sE", "quMzQxEWqMAeD3XlyFhF", "12XvvKKKNDYD7sAXpO2d", "jAFwBnh70MM1MtuFBDZW", "O7kTxszlHzM09cuINZPL", "ulKGcEUoP3Kn92H6vGpA", "FC8Mo0e9Z3URmoiM0CAQ", "DTBMTSTMgIWvSeHEetNC", "updgbJ1cT90hcB34cUQI", "lvEDXTQALnMFdxuCFvoi", "4mNfyPjYr7qc24oaWCir", "z24azwnErZvuKGZGfGoX", "Ne7OhtwD5e23g4dd1Osq", "wlkG1HWhVKCryJDfB9qG", "nqJRtv4uJuiFfRTfgzKC", "JW1GnEtyNiF8WWZPRbJj", "W0w9RQm7P6HhaIvOWoKr", "UXz14WQT8iCci9j7ZWEw", "cWbBoWZJJrAnPAoReDum", "t5MbC6gjcufCOHNDluW4", "mes9oeYTrQDkVaJfexOG", "s2QGHoR2gv7QaxZMb7nR", "Yz91ZRhBO3PG5pVMbuPI", "oUiMRIg2NUTtTbt02aBQ", "dafhN83z2QHoux8LDpMb", "JnSkOLiQtrpVPUCmcFlc", "g0RYyZsBOEkfzDNMW5mQ", "wbvL376fKpIyohXmENvd", "beGYpcuLhfjcEcvIj1v2", "pD0dsVN7sIiRuw0jYs3E", "XmqmPj26lx8Y97B1cY8V", "oqujlsSJlTXGGN0d52hq", "0qM7vX8X5F0t3vaol18W", "Ufni1lL6o3umrGtml1Hq", "EIhIBI6uHERlsCUrxnxj", "opTd5MNqMfeavJs4Zxyq", "BNa1Z2sVnpCccgDf0bTM", "G7v9PlDyiBnsZNt6PmZC", "ZmmCQ0pQZJlpOgwnP9k8", "KX0rurwJdVTBFGLdEA4n", "TnasRWdqfNwxuunomj5N", "CXYQlr3z25kTsKJHox8T", "K2ODx9zjs345adVLUWKU", "c2ySMHkACqbVsxin7fWx", "iZ0ICTbe0t7cv52FKmPV", "ay0TugGzLlw2KxKUQw6O", "pDylG10ZlO2MK2pCg3Bz", "m8143MWRGbq3oom3nlaZ", "9cvRcieIjnFWtHYwb5Mr", "gCuSyhTmS1LZbEyDwaTd", "Oj9F0gAblWQPgIpexJOP", "Ihwuvt7pTZTpGa3GEDpz", "jDMPVC1TTQql5lf1elo5", "KFtaowo27b0ooMDHWCkx", "abjgKMfy7T1PhsxVmjXt", "IXh6ssOM56Kdf3JzNyvV", "Qvs5noaaX5Rqd9uTzGp2", "N9g0Ax0Yut1KotNahxAD", "2Z1div6gCuiX1OXCMVkG", "PlYBcvlIqtTqTUU9PYpZ", "QW4SuceE5MSS5yefrNxf", "FQWis0pIWdpx9uP1W3EZ", "Ng2Sde7U13AGRewKekcA", "NP7UJWVnXjNsOPK11QT2", "TbHuFBErto2EE7iXcCJ7", "vg0H3II4ik4BJJ6ZVIOM", "7ObJWJo6T7DPnBgoUxqC", "fvMyEQVhiu4nIf6mwtsQ", "04nmDRahORs1KE0YeVEM", "PI8gvESp5JD6L0qYQQGm", "p8o7KoeyHsIf8QL3dlqi", "42oP0eyQ3CDqIzycnca2", "SshaJ2bumRcqTPEU1As2", "M3tc2pEpPmsreXPva0nM", "PQArnMJoWBrqFiSHXe5u", "Qvj3S8w08kKV8VMvpdjM", "naA0GdFnFKfgDOjgWdec", "Nz8VSSQH48brgmrxN6kc", "PQGcmxGJbvvys1SKSqZW", "yBLfxAcIEKudiBEV8Smj", "LfgDh6V7w5btEwYB68TK", "QLw9W8cdaOKu105i4bnz", "eOssIO1MUSfunb1IhdtF", "zD91CFhGoTFQr5G8THUx", "h9sSiriPVbfSpoTz19Dn", "cRDRWRZ0g4vNBloudWJ6", "8wYvj0si75WjWh817izn", "kuBvgznHT5NZ1tSirKRy", "OvfsaothUsVEne7Rbtg4", "y1cxu4ekN5ilyMdY8XGc", "NjoANtZymF0iGce9fIt2", "LZnJvOp3t5dHmRP9Jz53", "C4mTeOaJeTJz24GwT5xM", "9bbv013J06NCA7dnTD67", "eO4fSKZvNWGW5pQ4qTNo", "XizinaTGmXLQvP5OheH5", "9VbELzI9Sew0Kvg6V9KF", "egga3jylMDqVjRh2Py9r", "c5pu0T0UaLjFzNp27lnT", "wdwd3dfSbnHBs54tY4L7", "N2MKQ9NXs8ymkuQlX3B7", "qSGjVKa2Nt9ivT3LaOqQ", "UmCEgazCe8HSbX94qj6D", "aFvWgwpGIegnQr15RzF3", "7UUg1dlrLp2v3wPjsFyB", "rewFTxKtuXw01Qg14PqN", "FtIIni1fvxokaiz3eIwY", "prYrHDqJagepZx5Kd50W", "2mGcVFg7XafLRCAhN0yx", "gdnEYqYBvWfyHvYk8Crg", "nUzCg9t39s1nVmz3aWCW", "0rSHk01sDqWyLVAze43l", "u2XNmWOM0aq1PII9HI1S", "6WQR1aRecSNWSutCPHYP", "pNQEdhLuxLK3rkTqJuUv", "KsQmkHy9XUXMrvZVcsNX", "Dib2Q4tjwLdGD10wGy5n", "Qc8IWhl8X8ejoDlDFcuB", "yVP9WP5nL9Yljg1FLmMt", "t0chDLsSynbuI03pN7ai", "G8RznTF8Fb18bbomxgEt", "RpnknoXAv5qBDH90kO7y", "x66WisIdXUUyHHg23DCz", "I08UHHS0dZyYg24MvKxQ", "mRM3g33jGFiXFr1V6TVk", "1TGhVL1OdymQN9R3CVmQ", "iTvyIwRMOw4NNL4qg3FJ", "z1hM89PIc9hKacGqXhDt", "bHGycIpGL2YK1FeAM3Qy", "A7HjkXZHDm8o4Olegavz", "cRJbgvl1yCx6JEp1kPGx", "9OjDkUqQ4lPeCgGqbzpX", "9ncRzRShohcy3M9oozEr", "icVsGjhqhULqFxHFNiu9", "PX5QrFEfCTWt30jHjO7Q", "tTF8OULlCGvZl00cDEHO", "fmFgmyyTL5sEW7MvZggm", "wZJhYJHjWW7BIKs2HqUc", "tMqQRAL0qzkmZ4R5Lgor", "Du3TEtUThy5aIvyh6Jfu", "JQfqS6vnlhfwbgNoXrHE", "nNm3GlkK2QFJou9Ey21j", "kedJK17psN1ekohyXSHZ", "qWtcO0qK3p4nUh6ogCcZ", "ZdDHRuDwKUW80NkMNYhO", "Oj9sOEe5QGexspEJhPE0", "uk8s5rFQNupjdyb1CE6c", "SiXKVjcB9qB3YHvd683S", "2sBfplf1zjcRS9kvtM62", "AF3iVyLZ5M17FDn4yQ3v", "9fKZn4VgOZgYnhEIdZpi", "wrq92bBy1ErAuBkhEDLa", "kz9XgNnJvb2pSqySR9QQ", "NFYFQGueTDDCCKjqfV8a", "68NWyLyNSMnobL3zcwc3", "9pFK9xAoQGNWOk0K4whW", "ISKrmMoMGQPPDdjMas90", "6WUTEUnIQTngt5VfPJ1f", "kP5x2mIccRajv4C9YxQw", "QDcIG7xgQxL8MO4MBMwn", "lWUgYgn4eB02McKdhGJ7", "BeEV3IrCenxNHS1p8otk", "ytlKT3xAHEFSrTxsjm4L", "Z1iqTjdaWWIUN1mq5iyM", "wCnndkfNVhi4jPtA8Wkc", "114O2rD7Z9SVLFHxxwKS", "e0VLPMVWqE8rDBEF2PLb", "Wl4qyLntG7Ks5pDT9gzz", "s5p5E1JGQcpuNukLDXCT", "cWJiLU9S96S19H5OIMeg", "yUaLMLeXqq1TNI9gnI9w", "OZvXqyv6KYkI0KbMdFtU", "4svP943wKCqiljDZi7d2", "fNJdguzJ8qlCheZqgck0", "nagWHs6zzh0c5JFlDC2J", "2mVhQ2X7fH7Spmy7e24b", "k4DpNSYZcaseMMKlOrs3", "7xTujQzLS4wA89xUZV3B", "4toOF89cxzf2x7xeXw0z", "0u8725bbbcldVX1jfBLa", "Ayd55akaUiYVagacl9CM", "jxzCUzv7AEhIDIMGs4rN", "kPqK5OxoX99E46QW5MdD", "aIUlbq2RuroeEcyH0t5V", "0Ej4LAaOUBc2S4m1uoSm", "dFQrpM8qGDJGQ1Jj9r7d", "1hdTjPSdBuPo9nfx8lnO", "z4cN5t6ElBpkrTDaqfC2", "XZofNUcVDNrCRRXVLdh4", "nXoeyzEocOo7ydmL5OoI", "jfT940ePeLRRqD3oCFdm", "eRuc2gv73jQkMttQtXoV", "rFuhRxUbB7OpWGRXuMex", "34gPvZpp5bKwpDbG85rJ", "AD8fTXCOtqJwtzJoZ9de", "kwYX79nFDfZNsh0KFCi6", "111u1KiYRKAAEihLpTY0", "87OynOI0Zy4a05SzO8Vn", "SfxeLdx86W9CdV8QrPOQ", "NTyLYQIuZnizQdejEZsI", "51UhUb5L0UmLxihT9xOg", "j4f7hHrurjCuifbCGhVE", "BFZ8yEZ5Axlt1O0hepbT", "YlNEQzOeeusp9Qv5cUAm", "QvdPIe6wTfP0RmCpjZUN", "RKAYi3eLWo7wijLyNQuo", "5HmU1xIlUk6v4FRnI56o", "sBiYu4WFSO2Xfm0gjGPB", "0W62jWpzbtmR5UxzWTFy", "rHUU1SBliaui4zklVYl6", "PVWUzTSUvhSkwuFxMOg2", "ybk1YTm3zV7O0dry5JS0", "yskunxp7LUAI3sJbJ3eI", "XlfXNWTSntQlmAdX8QcR", "umjxd2Ww4AFbus6FMYh9", "R7sBFVgLvJno3WjgXGdb", "OsAGiEV4mCBEH3PXY6qR", "NdFQAx7hDkGZaQqIcLKP", "WVdlW0G247TPihqsexXp", "flMF9CVmWnB0Imjmk0on", "5FCnw0eYx9Lavin4uIqO", "5zMLl67U6vH9BTw5SYcP", "ixydflhY4Wu7VHRHNYlR", "S0abRUet3GHlCFOp03L2", "ZGA5VZKq73HX3p6UHjMK", "xd39sPzsTIt0W131aLrf", "O6DPtHsByETwrX5hw2XN", "JQOpRPr1lgh7nsXg7Pp6", "bJ2Sq57k8e8R5UGWr5Wc", "mDkX3HBAe1GFKIf8OmsU", "QytTQ7yIBUuxfcSirdqV", "c7iuNL2j5tDUr4xICvYL", "NSI23iiuJZOwe6o1QrlV", "kwzZ1xpBqNWEqmEtSvll", "U9f6GU7gJs93n9ao6Qxu", "nR6bDJUfEEOgN4mbYtFr", "kPsXYSJcsEUgfbHsukV6", "wtmJvWvRPAG7X8c5ZtfP", "7A3mlJcd15jxzVGs19KO", "KaUrh6vE0ad7kfsTyU6x", "anuXGANFIhccG6RvAK9A", "vkGdN65La9I8xAdBL1Rd", "g3Dw7cpHxwSqhgR4mUOK", "eeRZp2i819jiAucHWSZR", "OzH3fh6PBUhn68KvB33A", "CmsLgTcBtBcFAsHnZNCi", "puUv0or9rsK2fANJdzUU", "95kHx15UMFAB7e68TvHI", "oZITkfkLdFqkKY1FX4ht", "Kr4RW8Xx4nDsMWJ493Qk", "GEUYkWlHaS8sKAKoIrjK", "ewCzQT3aVRKldnILJ3cr", "Wikos2c9tJTWFeTe5UCa", "uUMXHcrYfTQBA8z2AZ91", "sdV6FyiKRuvLOFqerhCW", "9agJifJqDTq56L9LIrfj", "lY48numeawBjXr2DUL2h", "mslsDuBTkpCVNEbB7Nph", "IyQnnQyGj0xWqgM4ZYVJ", "LgmiuOrzjfe1d2oPQlfA", "lagcF0eoW77rnragFPfz", "4IygKl5lWivHIZrVXTJ4", "bOvOGT4TtiSx0PdKAg3g", "OwxfTnA1GS5rq0E4SIYL", "0yIyNuHXYKDvH9YkugjA", "8o0xnE1FUXaTUqRriiNH", "3aAIhi0bOkkXWkUHwTWQ", "z4tTtLIZ3fq4EyMvgLV5", "5FaZx2rtTLHSOBtHUCqV", "rfa5duzIFSNIfxsczhTQ", "2itQtmfLyWro9RrkJo2X", "GNptKfTHMwiPdZnWJTsG", "xj448toPipwwCkqVPHkm", "CQ9pzuLJNBZIsbMyU9OA", "yI7A2vfSCOCOoJDoDX5b", "getZDEVhNrqLAxTCq7c0", "VmNJ5Y5J3AskmjHzxmfI", "eVbmQ5wEAZEfJZwP82iB", "AYtxHAuDvZVX25JS8DgI", "ktv4SrTar9k2hdxwmr7h", "RdETgVuoiY6TR1VuqySg", "5CgkodgYUmFtPRL3uDra", "lx3DwY5kUXQZi4HUhw2A", "iH15gK8aXzAHwCUqiZaB", "4zik10EjwGreVqj9Bphg", "oqxi2RWiy4t13cl5a0mW", "Eb8iRprceXJQNE8Nge5c", "ixdkZNn7LXdX8jFXY5AA", "cRaxfgKJIPu0MVitsT0D", "ybl6Kycq3k0dBYaoEu6W", "I0VeVBWMfUZd6IiOHIFI", "2DuDmSzyN5Td3yFX7ltk", "GSOKj4iyMvGO98ZtbWpw", "aIZdEoAMa36oUS8BUq9o", "kNAtWhk7EZ3oqaP4OaOw", "bTk3vsEOhNCPjNIF40KG", "XL2LvSOH0mEZFyd9prXU", "Dhtu29977RLckOydqMuo", "86NM50TsqyK1fBviI2nP", "R81BUzmILg6SnUmqSFgG", "D0Hs9AYRALobSpkunWD6", "DJYylIoCXSSkQibZq9y1", "TmavbLpMr0T2Kz03ImDn", "CeYcK9BAG99jtkcT5Spu", "SGxkEvmUgzHsdpTvwc6D", "mFudzX62zwxPAs8OlssR", "rAITxlMuNS57gzldWrgT", "lbruTxIEp9eeJw5EfS62", "sB8Y9rCdis5SRwMsrc6g", "liI2cOHHqNIgXOFeFRHx", "HMNiGha7Kel3N44xSLDG", "gVwDtBp8a73rTPXi67pO", "kbQ5fU25nFLTiFfZPUfz", "Zjp16MjASWXC7xHkPHnC", "V6dDMIljlQiK7XLDs2OK", "ZvUeqlPF0APVH2hdJSM2", "s2MyYgBQgXiFQCuGvHVt", "RsPiv4JEWdGMeaIAEUYv", "zGAQQ2gLJAEj2bPvfh99", "INUwwm6AEe5EsEeIGIbY", "SoFTNeO1JW8ctcWnNdyZ", "F1l6FNOUgy06mFX7ru8B", "QHlHrH5Cs1m62VCGtYiX", "WibGv9Ok3WtRleidulpm", "mZsp523yblT5R4MMBi4E", "CyfyaMZU7OFuy5h18kxj", "VQmuU8EeoIszGWvpsUJz", "qWrmcYnkGkRjADddKrH8", "A75Ob0DTUVRL1G7dptL5", "dmpm0QNKIcQQhWoJU0kz", "TBIUQN6FGRIsE5eCUzUm", "bsCIOybtwMqPV8svTw8k", "NPcZSEjwBDgm6q2SpcJl", "w99PF1JjxRRIo1qFDZ9O", "lqArgAHTmbDiiM6yLPfG", "o6Wd5MqIwzghpoWUynvl", "O8R7SX3lwi1lmWMrsC7m", "9nTxbxRZlKI7TiCtDFfA", "vetfADW1NdnWOHTzCsXx", "Dp5eVFXjVArOnk4vvawI", "CkoYzGYB859JsCxORV7u", "fyJQgNMZvIr52de1rCB0", "FKJ5UHTtkYmNU5o8QAhL", "SWPT83SzDdxQvFVNUxHC", "T1Zw6L2UVinwECNKDpIQ", "TFqMSKkwHz8i0ge61hYV", "PLPbYmulbCA2RyPuI7oX", "6vE6bsAcXi5u3UUZGOJq", "aRqzPDtgKgBQbPWCGeml", "MsgOK8vbWCP6dF53Txhn", "bsECIiMYN8Jhyx3J5zsZ", "9HfnWjozeVlFNxPdfl90", "rRgoOj7Sgx1qEfbkMNiy", "sTBDQap3Jy2APgymP3E4", "0DsCsRvCodAe4LrSteTC", "dVL0BHkZLwbJARW0sRBg", "2LK6f9WYozjPT4PcL89e", "4kyCBSD1rOhthzxM7Ttv", "SaIvefYxnhcsQY4Z0Fbr", "bGiJGfdN8UGa4YUiB0ez", "fGp5mrfk7EbiUHziwd54", "7JcCp6s14UykinpUeSEj", "enS94Pr02v28CfI2j81o", "dzYLmLoOm28QqYZuxPty", "Kv6WaMWIUX65WePGxDfj", "Fl83JhwE4pCMiGtHcNZ5", "vf8PHXgEkJwy24zLjvXo", "ikARy1ibPFeIumhBILN2", "cJyeNyx7rVtaD31B3hkS", "wMko9PxPlKPLeO0zKv6B", "Oxlb1kl2PTUJqC7xZ4MK", "Ple17e0RX5bw2KV35E3S", "iXmWhtRHylZLUDMcpM1N", "RaHUvkVyzZQf4C9k6a12", "JaNnmjNb5NwVxDxsyQqv", "xHa2TjmXHlZaJwL5djfj", "6bC1n9ujXieVxCXPtHwA", "2UiJQ3N4m2lqbvsO4k7b", "Sl4OvbnoqjyqDeAciXeS", "ZPH8K7XMrevHO0fJZQ8Q", "84ELjOvPtZpSw6bED6Y4", "iUK4SxMzOSNWWcpD0lau", "IQKFWtRkx0mgS4ks24rQ", "WFw1rjEpUphlF2yjtPTr", "NEVpIDhKIXiomcpbM2Qo", "p6X28VlztDoGRJ6hXl0n", "Iib4LPdfP2TE81GEUzDN", "C0ebJiHoTHbmzBoIaSvx", "UNBcMPoqO1EZzq8JYP5z", "gfleqYuO0qLSDU2ZtqPF", "pbopPx6xK9x1ogdeEX0C", "NLcapc9gQXwG6k3Wf7Ty", "GOx53ahF7iST123rfBX5", "iTJmCKIpRkni8il9ISPO", "8prAru1U3WYjyrW8Covb", "YhHfP2oiTB6b0vjqpiKr", "FsaBi6JsvETRvl6Jlt1C", "45m30VtnEBeR2FakJtcC", "55ezoiIYZHkcMWfK0W7E", "hmdjzDRI43V7776tpMRP", "dCzzgeHg8PsnBTV8gwQi", "yvq52wwqHODuYCsEo9tw", "YjjhDEpr9Ea77QA8K6yb", "S9W0JMD7V612pij0vXs4", "jSBqqJyAPuks1EqKa3R3", "9Q5x9nx4Ip81FHr5YoEx", "gyniCe2kfSnnsrkzef3w", "T9xiOmmwY0sFwdx6Fzov", "PbiGSQF45H0YOvHng1hE", "1ZTvBQzQOnLnO13pRHtX", "Yu3wnKhTJPiKwBD7aCYy", "zrjOtlBI24nYwrUk9ADT", "ZtlV5zdf99b9yKVp5g87", "ktffk8PsIaJpU4KZ1vCB", "2nK15nqBTwGBquqY2DQI", "oj7ImPpnJzyJmGKp390U", "5Fev9UU9gsPUcUmMtZ9A", "Y6UIKm7Ov6q1JUuQxMXd", "Fw5pQpBHOKQuOuAjgH5a", "LvZcOT2JqZu3Tzsto19A", "JZ2iRCR5RWfnPEPlgQ4W", "zyZTvPKhQTpj0rRR3qVV", "KAGkNdV33YZ3W6UQTo7t", "GvaEm0goqBJBJXtgAMjC", "uGFPKhpnVuejpFycDcO3", "nfC4C5jKSSWMhjjzQYnw", "RPdGcbqpDEryt3337kOX", "Currcbr29cwY1apcBfRN", "sILlKMpR6BwH3n6fOxiW", "Xe4XCt9MXYjPp287PvYT", "4Si8FplekR8I6CnG4wcZ", "SLwHO2OlyuC0Mv8aisEQ", "JKiNWTeYNG7qa15w4Sf2", "Mr2hk9HQ1TrKnXiH1KoO", "avE8vI2zkhz4XzjH8yi7", "RZQC66S5QGUy9g74y93g", "p2lM2Sb8RJEqqe3vkT08", "jS6q9Bv5Jwm8xVUxx53O", "NHFBvG4dj5lQVqGe19iK", "6SQ1vuyqy1DJHSSCgXoN", "aXn5N1iNBQhFq8Gl0Cbw", "DoFUEgfsDRFny0qK2YhB", "wMQmUgVTq5P3rdW4J9wW", "aAHWA7oAgVLaslLKPqnF", "tBHlolp5sjbQtqw2xjAb", "EWC4FXPdLAqDL5y7olCg", "Sl6Kb1KXkU8wyI1CnOp7", "WdKqjIxX18CTrIlRJ5y1", "a4yYLxk8LXFpBXfsnbNo", "jZGYs1z97xBf07BL4wRN", "RhCaCsS0Roo8N2gD2gL9", "bWmbbxuftM0J3CtD2KDT", "82bT2Gh4u2BVWx57vzkm", "Li5MszavHnMPnwsqCXs6", "Z4Z31e8weqjzYmKRjuK0", "heNTaEJkl9oJDOMF0T9e", "JqcqdwFKoXLTBgwmuDUg", "NJzahJnhkxK2lusOo5hc", "c23niyXdB2HWLE50XsfI", "nxKZrAvfDcFpcHaJF8uQ", "ABvTP0Ruq6Ac4U9tc2Xp", "dkeF1DWGLQfTZauwYLrM", "P1yRU7L6AsunaW0cjXq2", "vVVV3PPZiGw8GuZk0so8", "kivJDtvwQjzKDSnEsCoY", "RighaEPa6Dipub87V11t", "kyBvRyAHBwpceUJEigno", "tVdl5lqYmsRVqdQHZYWk", "UMK8qbLYH8K9dyughlEU", "bexRFLhouDXOXrVLTqti", "yErZAmGrVSJ66GVLaA8U", "MfqtWLFxB6g7IXfSJvKm", "LbsSsMlQWtusYkk34x0D", "1gJKEykVr2ICe8cUUOuz", "FopoWXrYUpmUW5oi3WDu", "ZT4Dahh23ZzINp4rKtQn", "jAHDF3vGZ688YCJ8ry8u", "X8BuxFkF7A2qIJ3XMwlu", "2t2Y3MgvKpnsvyksCS5J", "a89sPANm48g4zgd10HuJ", "4h9zgtpqKv9u3GnSOACS", "HqWGV7FVP9oTrxRVpGL9", "BU3Ciod6znYEc2U78kcX", "tPyiKPB7eWGnyI0g4bk3", "OIH0Jk7RSiwJ5u2PIBVu", "glhe1hJ6G37fKNdb5j2X", "RyqUqqr62M0g6iI5NbBe", "dHHveuWjdYG2U4UItMPt", "gPZm5rsRR132IIxwCRdo", "xroRuHjnd6eHUD4X2uyR", "tzTCHO6SpkEkZ0BTHtGs", "xsAR5Cz64vXxv19ANEaD", "woxVp7z4yDxv65L9HIFL", "DlG6mOF9cpKYcG3PL0TH", "EQAITVRklf3xQK3AiGHI", "4cqgqr59sYQ4xaMQ4n9p", "QAmqSo084IQ8sEmi6rrw", "OH0JpMht7ohYzTMPHNYK", "fwQVBDDH22BOHBh6VNya", "Bf686TYMq6gT06yBH9QK", "BbiQkOUFlSqu5u3CNZYB", "dCcdGapYhFqspWGZulnd", "DbYHVZTt8z4lBhORFBxx", "RnnEK2nCnYoy9MFfvgY1", "famoF8GTKBOjz9xHBiRy", "HFxQZA5UrbTUAFHNOXqi", "gCRfMMuX4MULZRk9ZnbO", "N5tXKAsgfhMLtnzF7rlC", "BFVleDsD1TcOYTvrdlVG", "SsZMdYZlOKxZZQIDeAPf", "e11AUuz5fVJ8LsUyP3jn", "MeKv5d7hnWKPVLYxFX0u", "0J2J9UIYWzJseelhFqM2", "KgQp1ykETk8S39lDb1j5", "11xdfhIsXesqIIdHGOVi", "8bAAitLKv4Nw5JXi0nYV", "RRLhjzyyLTgT4oblhw3c", "zQW2j1jjoHDDiYuQVsMq", "J0IMot7ToA4naapKcY1O", "oEcWlWuEPG3iGL42C9W0", "Jans8bCi7B7vOjQ7FKLc", "ZOJphLquVMumuie2HqjO", "0qKOXiVm0oNZDgNs1DmU", "XhHRNvRckA0kyI6V0bG1", "NdaaJvRI8Dnds22DxUph", "cqPZ8V494K8Svi0CeRVk", "dGOVGOjDsYtTOG2Vk4co", "NkEIQDV2eynHC9lSXUdO", "0WpNnpsXtUJGEWXcj2fN", "ySdAZMc4qFSqkFDV430y", "XJCjpjMYj1uhRVryrT2f", "hTTRifwniwlEDvv1fHXO", "GP6fsxbhPeM45oTnTNY9", "HHNUDJTsY1EnOKQHG2yd", "gJfj78WaV3hkK5EXMgNs", "fcf3u6K86JjkaMThUxFx", "0whLzuqLYEEDorGgxbn3", "sUnSrE7JCMHCGwXGoMZM", "anZMfo0aNncFINf7ckQo", "4f0KcWaOsAjQvGkY4k9R", "Yleo8Jvk1LW51VQb1yxr", "6gF2xza1jhRFQ53ZNwHO", "ImUHHsqGql7vSKxNJVM0", "BnGbrH8EEOaUA4jRwXhl", "Imgi6b3N4QNFBbp2txE5", "LpZVrGumnbX3LBmRmnmo", "BA4NjrNcoaf8NEdESY0F", "7VJTg3sSodF0lHLU8g5w", "Gk4bxgqPCqfHMwi0xZRj", "Cgjxx2R5jUzxF2ZAgNZs", "BC7V6qW1PxlZdSWYVvdC", "Qa9dcgnI3K8FXGkd4GfR", "BO0mqWKLPxXnYfQ8LBRN", "WXc1lKepZHGkfEVUipp8", "nLvJ0KRJTqgzOG07Zdv8", "s9qYOL26BpEw88D8ScQv", "T6tpLrwuUp0NzotNAtTJ", "ggDpoQvE2L9TQ0IlsDdM", "2dh1RaMZRqq8U3xIRsWU", "EdxeeENWPyqPZWR06lYY", "bOg3QbLrTpLhRHJ5TeZq", "cNFBteAyQiWz4A3UlMKE", "CdudsBgLqDBQaPaS3kQT", "QuRS4UvnqFz0srbl3H4r", "SEF3dpVgZt8xnZQr1Lcr", "YbqQRR9UhEJ9QWA3Mdht", "WnrJMF8NYkD6K1UlSeD7", "qUHG0PJM3yEXm5r8IxUq", "ifu0gOl82yEsST8QsPnt", "O1RA4IGMFkAvP4v3SeAT", "aOL2rSTjrEdFD2PHIgbV", "OjRmnKpDzzgZN0aCS1uJ", "DVZQXwfpaGKzxjji4Yv1", "YaatY8407yJKTqk0lPnJ", "d7Iar1GtYCu4kSvIZzGg", "xX1QOjO79BQkHhJ6gZzE", "jrGRHCjoBxV7VUVrDuyK", "3M3K3MQitNwdCB4SNmGW", "jjdED95P11j4OmNP6l70", "92bJDflaP247jiLxpPMq", "O3smoFAuzHs8JTPU7B2W", "B7bunxpcKBQiDGT1UdtT", "skZADyeI7hnGmO9ZJy9d", "8XKLnnKFODiGxFQ9C3RJ", "kCaUbh3ufAWlhq6SdOiz", "cOFXceeoh67PGftrMum0", "4Gll6qBhEtgoGtMsXygE", "2ldJRWAlQulSAVDELNvZ", "EbMUVgK0eyFhkq09L8uj", "3eCB9NQSkJzztLRO1mMg", "kbNSQLblTUSU6eeF22fk", "LejE09a1vxhdW26wNhfp", "98HFkvUkx7VJmCVmL6nE", "3TsXVySrd5enBv2wrVgo", "c95OKbAdfwsgNkDqgfhJ", "jL4uF7q6cVsCcwbwVjaA", "dQq0A3rohW7QqCI5H99r", "cz3Cvc9QKhav7QuFSj39", "F8X3Ip6XwFOWDQj80qZK", "V7EcW8pyrq54ya6FNCmK", "Q9odZXlZNIssO6SuCFq3", "5t52TBFqM18mAxPjU8Hq", "P9glD7fPKTQQMVQnffd1", "emnnhAU9GlzfseQ5j3U3", "UuTqOrb3UF49zpwgzQnF", "Cnt2PH88JcBnVdcrUDuz", "Qw6Pl23iQrvacod16l9N", "LIAovmfOyXLOTRmCRpur", "eqQEe3FimM55fEsYyXww", "3FJWg5j5sbvXRLl4Mzk6", "JqBw21V0XPvafE6JJnPB", "PKgofQqzPb5iPEfRG8Pn", "XKNAYRUpDtzaDfOq5FpS", "ou9D8ocMu19RMUasw4i7", "xhhAK30OGpo4hxHnjtAd", "tJ3Fmd5ihnpcSUmlXk7o", "XvsCt8zaz9EsRF7DqBtX", "yg9PAt8fbFT88KKzSHaR", "RmIq1P1pasMXYTugK0Lv", "Dn1L7JLXatwzfEpecqTA", "infEEXsWXCRkzQ44jNbJ", "GVJtk6XMxyWdjCqvjiRF", "uszrI1tzOUGc0ZVie04Z", "wYCfk0aShzhZreR7gK42", "nLflsATWBV573GloGJEx", "JvX8ZwEDGIG1dvmW3D2E", "i6KmM3YcMkYff5oC10OF", "IcFuX1QYDQltW5fq8BTS", "v18Y4uj3u7GAjV4EVSmi", "tVbNaFEgOf7KeDqi7Zjz", "ez7LVCZ0eKgVpHrOW52v", "i9DMM12RZjODiWZBi69K", "OpqC7hYbkaUQihk4hkUG", "TsT9M0L25UNRKBdPq90a", "kVyQAiSrSw7tnZ27XLAa", "oV26gdVWnT4Vy2v7iLy8", "I413b1A6LIf9nfFTIix3", "B1W81PFhlBp1Do4oqCtB", "VYIIBXkRDhVOhzWiPlQ8", "vD782BvqLozoKH7Vmrwz", "WPNDNswkbKsWVzfV8YLR", "KKGebN7LC1KiPgumWoW7", "6McbJF7RnSq7l6jKRogb", "pyICeCyA0SG6osh77mWs", "FLxyRgIrSySFxkSZwOiw", "ry0doijtSDlhYid0Mwpo", "sH3n2VLwu3rj1rMnX5g0", "JPfr5JpRDeD5uErwiCqc", "FhJEZf16jf602mp75dWI", "HhL9vC3dMuDbbWnAAmFt", "PLrR5gY8J2QZjkifumGH", "gUqFycO8OdzowqF2XmAo", "mZNWH49BoNQSrFhqr5wF", "gw1dkFfFzn4lKPFbTMnH", "kBjZQPNFUKTBEUmyhPEg", "CGSXff672tOk36JRVfhz", "zA8Bcs7KHLySZQxF43M4", "vioyo5NJk4HhCNspG07X", "J5xrUu6WyQar6OnvRACA", "FRrPpiC3gJYzNWqpQuLM", "IvBPHyIi9UqMuijjOwm4", "DK1aoqPFiiZ1djOuhgbo", "8R827sjToTXzoZacPxp5", "gN6H6SAl8laFAgFGYxjK", "QFKCosnBnaGRxLj1ntlu", "cJ7kzMyYHiqix8sjyfsk", "G6BBRuBFlw7NFE6CY4iq", "mZWhfMOe2GOGNXPmQY1B", "S6XfIdsrhafS799nVWPV", "mlj7I9uifts80PnG2f7j", "EkBLrJ8NnXqXGafZhXFM", "Q7SOWEfWrkG5TPRKgXfT", "3W1J4eqlB45ZBWygkbCZ", "JQfmo47UbkwcGvwIXk3i", "o7H0bDeJmqs6FVs3ZxV9", "iRlwKfFrQGXENnCwyqFl", "f8pubhx9dSILs1FAhU05", "lXJ6KW3JMG21MrtyWq77", "HNQ7MgH1AH6tnQy5uzME", "FOEcD7YiwdpD0GIKuXM4", "nQwaqufit0x6OBiaGGIC", "r5NrLfAFDUI0uCYj4BRv", "BM1YVi8mwOyoTMdnzn0C", "HIAASgtWsKR3fRZA9fw5", "3vtVFVIEIIPYZZi1GbW6", "tx7YOhhVMdbOWStlx9yE", "PNmyuSy81UEsPMPm16HL", "jqjEHaxEjvQ9IA5Bc3Jb", "XYUvsthtzwCgnwu4WsGE", "nfN4pSDQUW1z2VuuOblL", "Wy2JswLMmZaYExa2OnSs", "JRrKxkEJJyfpuf8mZR8M", "1jsDeSD0DdqW5gq0Q3Jj", "zwZtZfd97lT6SLH5lV5y", "8uSBaJByKThJNEAxun4z", "WX3zsK2bn5Zuz15XIFVc", "iDt3P10Jo4IJZLGPeI0R", "NZJLbPsteMUKZLNyNMG9", "OWQyqgNUyOtKvBdWaVOC", "pqUMBrLWBZea54WtltLh", "FFzBQcfy638vtcI3RbZd", "ABBDGh5zYQgmdgx3GazM", "c7GVhYW976kFHvSVaXU6", "yBsbpnd5OaQ0ggTNC0UJ", "4EYJ7ypfWHmSQc1FQcJm", "BhmrNDCXDfqFtOZzMMcq", "bOG21GFPqWB1DvqY815K", "gtZXH6WcQ9Q2Vh4UvJtl", "o4l1zZY6adQGVxmm4IMS", "PnUtUWNNqH8cJrdHRBLz", "nlEGg02kGPDeCfXeCu10", "97cRzFgOP1NAkZQQZQ9q", "nKSxzzbBrcBzinOh143O", "3OWlyu9XKIL6cn3akfjc", "FtZxgxcfzd122Xl0PuVi", "BrolcrLNU5zkyWfcTGGS", "rHStnDrA7NsIEg4oWNB0", "Q8iOeMz7aDXRSzJDAAOI", "XGYjvaYPwhNMo6jSQiYy", "t3PL3iZDrxTOB084YeTU", "Lpr9taaJG6H99eSCL1OC", "wrY6pe8OIascPjjIHJZV", "NqcXS5jl65v1vU7k6F6P", "nzzCgiUw03RNr4uI9c3D", "fxEaPJJVXPsKMrX3YzxY", "3OtsQmAZMCl17xaWHt1m", "Gu4djbeHZbnaxhSORbvn", "lgmseMOtDNfUHj51JjGq", "I4QFjqdAPZvADf0r0MiD", "kLfz5iyMPFChJax2QYAq", "53yJizAiLru3CX3FG1bf", "ElLVJIXkqfYwiWDPTL7n", "CzqPXrelrEO5xjbH16zq", "kVkQzvpTGvETs2qPuU8j", "gXmeELtEQq2ALmYIhOlv", "HxO90EXshdbNALzNhqb7", "edFzNnI291xOxMYxY3pF", "gObpjYCOPnT1Qi1lUHnd", "Gk0D4Y8dZxqDJP21yCPL", "xtMLbL63atfpef2iBBJk", "68xOXyPTAom6h7RHSYK1", "Pxq1cqinz1V67RUfPt6X", "ftdLy3cOZuPysD0S4iE3", "hj7p8ZSXSY36PeRLh3kG", "v7DlLDCNtQQa7WPG5plW", "MoclT3584pPxwahHntce", "J3EOZcecRO8lCkXdlamn", "P9lJjSZULB8cEKylubMK", "zU5BDanyAZmZgVtNxSpG", "dvqqFoZ8PvSMOXYb8JXI", "sHqWmhth7ivibjWqY6yv", "zOILwow47SKxh8RSpK7w", "03dZm9PIDMCBkSWeERgJ", "t1GY7h0xz8rx9UWvctCp", "DM0woXa0yHJpGXNNCMI9", "UA6dcaWERg4d22ZoZ7oV", "M5Iaceyo0ExSM15zZZBz", "GDcGG93nGpJdvZDXD9KB", "OHdiHghqGrpU4PkKYn6p", "bNQWwb18jLJ5bxnqdTgr", "KULOt6hQrnDSAbw4CyCv", "HWyqRmg4FLuZpFvgJa49", "NHZVsWa3SkwjGvahhEku", "ZeRMrM19v5IGLrmBLKEn", "4BXJ45ylHidrK4BAOCJJ", "GbYZQKkmczZe84xC7wvP", "cYEvaP5yaOGoxoNN679g", "4hKClGMrAHGmnUhNrkKR", "8YF3KcROkY4mDMzzaLqk", "b4VOYCkPx2p3Y47sfWGN", "2I9Gc6DDS1x15SNbd5yY", "7nZfqeVVAjsDz1Tc8epY", "fkXkDuLo0JM55tjvYEQi", "wGtvFKXLyKrd5OLGHg4H", "yOK3H3wpGKWCaP7pkf9g", "z0K2PfIgKKvGiFHyHDlX", "XHj7hquPT13R2NTP1k3J", "4wZl9qhQ1SxYkedPTVmw", "XpLZBpwCXzTZv2K4q1Vr", "SQPC50ZYVLS28oZJbVT8", "SwhNw0QmztbRJybMyAsS", "TJSc72tgVNmyHRJEPhyP", "aYqsWQCTa5v2ONcTNV7r", "qtp8I6KioG7MovEJLRmu", "Wfus2WJO1OFsH2yX8GFu", "WKHJGVaZwMRQ1LG1rXPr", "vchAefinvxfPIwgWQG3K", "aVjZoxbgVyVObCZFrF0k", "Ae7Qaowy2yJdT0CHxlvQ", "iQpHcMURbT9l7FCf16e3", "4veVvrlqagHG56XfQ051", "TCkaRuFSzrU1k8XdxIUW", "wjm1nIfDIkClwwJMpWmm", "OGn6NKkIaCoVvbUir9v9", "r7so1BAohua3BOAWgsoF", "4dkzCCh1MaADf2zeB7Ts", "21uBN4h4wTH04zxGBcHV", "CPjpPgTaowRowLzJPeLJ", "7cHCZEQlogG03xnTcG1Q", "BSE7nBQApmRwMi6wuVhg", "BveErRfTihrr95yvEM33", "8VxTB4P4Z4kixPuooaFW", "H6LO9JHNgLQmoMFxOczx", "gide5XQt7gOMkjju30Fh", "JeR50f3OH0JyiwcnR0hZ", "g5tRocJpdWUuAw08Z1Uq", "1nokhOX7PEg3HXS4Altl", "GMfQGdXpe1fenSOSqtZD", "6FHNnhRvRJghfL5txcib", "eNFRpbteVRpbe4wPmOKD", "f0uIKzBHctqEE4d2fUeA", "vTjaYgzK2KVhIPxaM8rw", "zg8DklFPGrY9LFjtvhBx", "1ecH3ZsNfhKeNSq7C3VQ", "v1ZGGH7CyG7xuiEvF6It", "oaX91LHBNkbIlAW1RbBN", "pHKhzZcCds5PRbZQwobJ", "WAZHK3GkcS5RjQ8ixiua", "by00ZXQVJ1npBK4TMKBy", "mHOVfUBcD4Cm2AmZfA4y", "9plI8pjUAvQuAmOnHZPS", "bZCbiwAN4DKD05V8vEa3", "71xFnL22tPSSzc4hWC2a", "NMnOQGWLV7Ma6JqrdqsW", "GIyDv0sRBu2YFnuf4RyX", "WK7abvREkHiyafBVd1uo", "tuL8iFlkejF83MidGAr0", "RYyzD7Uo6NdzHw6xBrho", "bwwcHfFVn5TCbPCoWeca", "1DZJ7fEHXw56q1g5ewaP", "z3caQmMwOwWQA4hHhvYC", "pbIgbzjFtIdsJDQkzmeN", "g9loDS6uMc7BCNpnKZ0D", "rd38qTsnDX9seugrLkjh", "LoqXAgKUFIi4wjCkD3YO", "YfGCXv3sfkX0ZOXj2pBH", "8tJ2dTmoWKA4xPEVKFLx", "0ryXFTEFJPWPHnRuGDgl", "WqnTD2yXHIVF9RmMuybB", "O5afs1X6DDpj1bAFb7kq", "PD6YeqsXpTiDYJqOINSV", "aGEbrPoSUZItmMPPDHw2", "keDGv3cEQ4jyIwZ9JOZn", "vqefA34NK0N2daGYbsk1", "uUzDOXKhtsSmi6Rs9WER", "UbR5AhclXMlRoicCDxr4", "pJqVPILWmZvE9MKJ1w2Y", "Gn05WcFhX7mKOcpmsBGe", "iCrrWB8W5B4Jw2OQdc8A", "huT3WIpPR418Esxk16E6", "FJQBJmawMi53cY56ouTG", "wVOALLtNP7RcQpokaMew", "4hyeF3k4vCIsfe20xtLL", "1lxRaj985m39Tznh0Wjt", "i1lNdmLYdhteSr40YB7e", "xAlP7X673p0jok4PUPx7", "4rmUgqVE1asxkeKpBQwC", "DwtzexO8MLERAyvqmO5l", "yvigX2VgQPsdKlaygy53", "KJSUFNJ1kOmiHVNpVqVu", "GMXa58Ym4bpMsFp7c88K", "Uv1lOOarC6lSQH2VNZHR", "84o1Jd6ujFED8DyUbXJo", "b5E1MFWhom8wquv8V20E", "FCPLQOnzt6nUB0VVFzC1", "lJvaBrghrgt6sJPIfCIY", "I30S3VxGSAHERDmc4SHv", "8Bz0SMH5YZboabGc4EsW", "MAknNUNPwfI4qF3GbKL7", "ruvRVC1ZOu3k2mVPGqoD", "V4HJJKXucs1TmwtF6uoU", "mqCocfBsWx5z1NJKfqEI", "hDjR8ahETTjFJt2vZDo3", "Bt2CEJXsAjApvrG3SvHv", "PyAgsAaPOMQXDSjSmEIu", "wSjrHxujtBeG8nuyvUNJ", "qnq4DYUxmmrgCYXTWRDN", "bpbjaVfW02nqnesyAMwu", "6lbIK8moYxB9kmqLHVpF", "Vc4GEwEOH8JNuugE0Q2Y", "LBf5xTQCwFSPqWf4QsTh", "yk3sch4c749SFmVAEuNA", "7naxHD2h3TN2DQsp5xPC", "1YcFJ7PX1kf9VF4mR6SS", "XpSkDLXIIxSHT2Wm7uH7", "exE8AIubPM2u9UfKpCa5", "70Lb2rLAjdFMaTUklOK8", "jM3qqg9gsjjyi4Zkuusd", "V7z5aRqKo8SXUTLI9Sw2", "Ag0skXcePTGvaDy9fmTT", "utyONHfWkbWuHUm01McP", "psKO4GXj3yCxp8KCPzh9", "aD3sinqhAS4xJMLNdq6g", "mGdcOvmnuTvThwJNk92s", "b7puT9H6zLmmbOMzJ8lC", "cefHaycI7eAgjybD7qH4", "C4olQAjhHUtt8W8gUkzZ", "M7G65pJCfaFpc3b0CKiT", "mZKs6SYYAX8WfMciBvto", "U8e4BD5NVnoHM89Qafzi", "B7FoTrWclPQDX2HhDM2i", "7rxSz6qYkpGvuTjLLFx4", "dMH8MWparqIwfGMcKDA4", "2PxxqgG9wEDXYSfuxTUo", "Jlky17YJKjMK6JFu0W4u", "iFRGi4AfXdRoO9kNEJgW", "02r4K4yKa2CGIbWyffbD", "I2zg9k3O3hu1ij52o3MM", "6WbM77Kmktx2vxi2hjQi", "RJj70m9opT9tzkD6pXsa", "QqaJlHMQ0k6P1nW2ZfoO", "6vG5fTBTz21Nqbhbs1zr", "j5ElsjlRMZnTV1Y8TiZS", "kapYAU72T6rD94w1nhQ9", "GBcjB9serR6Z0t5AOCAr", "G22P6yOrdm0uvbb6kTkZ", "to6tiB36LDvZDyyHuK8Y", "67Q1i16QToxMd3DLCGPV", "RK4dG0uBK1jO87Nq8TEZ", "IBvtC6CMMbrmttPAtJJD", "K0ZQ7wGDOSnebgXnnj97", "IytBrIJiactuaSLhNZtl", "0gPbKuN5dUDtT62INMzx", "wspXJ8Cgg5RgjoF2ic7L", "7KCYPEqmYphTgWyzdAdJ", "E4xvsCxYn5ruP3SoHGYq", "4FJkkFhNPKebMbXClUkY", "ZbQxcsjt7IhBXytHDYcb", "sGCCphMZC65jfWeHMO8T", "gocBkVRw31XtIh35PPeb", "VkI8ExNaLW2zKe828Xy9", "ZV1pD4uaUZ9xHR6VMT3f", "x3cFgjIoGGvnkwavzVVT", "2eOH3UmOwn3rrg7XPNJd", "dEPL9zG8UjZULxlNQVlM", "JoD8SIdpfwRH8qcFprNI", "aukwsWJIz4cGqnOH6z4j", "vV02JdH7UdP2X9yPdFfb", "HHr63EN9DPq7vr9CSOJu", "1gwXotuR6a2OpsUs6pzJ", "EqO7fXK7udzvIvQ6mLVt", "tYFiOjbUWYlkOAq3f88Z", "j7T11t7lCde59toXaNz6", "vkpKsdLYlS7UZYWYSbKc", "EwiLoWsOrrTmaG4StOye", "q66Nccw4EEfQANmwrcJi", "SmS20VSrtRVjVZ67C0AO", "CpoLCYH1BahdK9dKe5BV", "WeEzEJ7OHHkU6WpG54FE", "fwpz5SIiXRD24Q1Gh6cw", "NMQRsDfvIu7vqwsuOAau", "alueBtsq0UlNqBngNSad", "NhYBeQ50Zfu7RojaibPi", "5A3tJoXgH7HcnpnREtRn", "WKuv8bWoCtUF3W8MKd1b", "lIBY6zxKqM5MgxInYmbi", "f6xia32ug1URIfxOesgU", "Fjpte7gCtIsWMpCusEoW", "EIyWwtsamW3zFsstxX3o", "ntK7iW1Yip4w60Q2sIac", "mbbzTRsQytElmYsS2tyj", "h3dl14ltKJV7v46OUxnQ", "o1CZY2zYuyHZzvK0x3sH", "MLMHORgsMRIAQShyVhVN", "dmwcfEaaHSsdmCvAdZ0x", "yI8OlnLEUqZ7aThEhIow", "ieZUrScSzcQxtWKeJfqm", "VNr3qZHVp6RVkyybPa2M", "BSI4wcgFHUzkrrnfO5AB", "BbgtXeTwDVHOvZSrB64Q", "a4ARvv6H0GS9p81KlUHw", "zWKs5kjEqncQpmpiftze", "9RlwYmGHGVDD1V54FmI3", "asRPeG6I95wGVhA1UOIi", "sTwryzwBmCCK5dhhrnzy", "rtCMbMN3idla6fS2dMBN", "YNhb0MJp8GnzAzLjJgkz", "HTaL70NkMY7svmUt6liE", "zVD7SWojCYiT2Io9G9rc", "hwTagvTmg91deEl4lXnv", "6WN6m9D3J4dyy6Ze10Of", "APHmc0pLXcEd6bhtluu4", "wX0seZWdYtJiIYSsYHD5", "sQhy1OrmHloBHp4vMYWu", "RnaiL1YtIkzAAe9B0ywH", "iiRzVVss1MkRAL7TMfNc", "PKlZyulyqfEWNfTt8Jj9", "gTYqmfJ6LejkyUKuM3rA", "g5h3kAuqUbxA5Wyr9FyU", "sfDo9VjTWadCdKDLT6Bv", "h85mc1cmEYE6BPvIuclQ", "CManho88sJ3ZP6K07ukJ", "QyQbOJtGvch5yFsd1ylt", "FoTeslcxfMH3JfehyVxr", "7cw5smjrkSlxFCZ7xC5a", "YKdrzFWvkSmp2gssSZkA", "2V7FhgMcqPAPjnEg0lbi", "BNXD3P6TzqdzLiE0NYaD", "wkadXnKVYvDhHkuK70m4", "oN376F5RmfciPDLu0fPW", "ZcDqK58S4uWsIYyOn3nZ", "jPF8cb3aGQ6n3HdNNmnP", "gKFysDKdH7ByVQ47z7gE", "Wk1Z2fuNRim5012qDMTU", "ScQx1U2yaiC6TEfTrXqG", "FaLFZN5miXEA7e76975j", "qHnHTQkKxYaB6wOfHSQz", "xc94FE9MME3ATqRxGBHB", "hqMnmlQ1Dq1AR8CgNL0h", "X3r1tIw7RBI81dvlMLnZ", "AohbwrFHBFygGpf77bEY", "lUgm7ZYTvL057fe3VrLe", "6HKM7yTCZfjK9N5Fxdgs", "wfv3IX6nOPPSfkomiFwF", "sfYz3bE0EtqAYlBoGFae", "dz6Ihs2N5ybxe7whi9fu", "2V2YEDMUSu65uCNb2Px7", "MY40f0fN7IF9nHfzU0Rw", "uX0mhLMjjJq5rs3Uqgpy", "y45jLlgpj7jdchOJ3k0k", "3opsgqKWW9SSDYBWHpL0", "w2bYizpljnTkbGaH6ula", "3C2EkBk103zu4aQmYFVH", "2y0bEaqKVbsWlulV5TU3", "XTxb2NNaaspaopB2O1Kr", "aCLK46p7aIA5j5glQ1J0", "r9YfwhfIgz9G9VYDZOK7", "eSANXq7xpQvgZRJU8ymo", "vu24NbFuxX2bzAyUz3Po", "UKT1lmVrlGfeAijXHwRE", "URpRclwbpLNHeqINdoFM", "4s0CYjjpe838aqZAaTjN", "p6eRxwoai1wkuwwSedGG", "mHOK8vSgPB3CHfdEZPmI", "Rg0JbvlDW1TGJpaPi035", "B6FTjqfIGQYf4XyfSjqw", "jJD06lPpmQsxW8ODy2VE", "Q2rUZp8zXyvGG6EMsd9c", "32ZX8wi6wBJMDAokywjV", "tdj9jxTZYbBZbj4jdmpZ", "v6t9HhtDcbiVCPctM5Rs", "ecRFJTyuDmR8sKH709Kc", "i05sPhljkCbNn0c4Tbzg", "LQpDj4JjBdJreMj13Tll", "fM8QNjVoISTdsGobI7IU", "lbJNv3OwW7i9UoYpV3bn", "T4QLKFvdMB55lOQgPndt", "uJ1M7Z9balO3pnMA2FlM", "RqQCEoqcbTVWmWqs50Tf", "lpgac3icGRxhHNrU9g6l", "9bFu65kB5Bpo0TNdW3Dl", "VASmVIEfyKO5udx0gh9m", "swarQvUuzffUq6EJOTyK", "lMNdxLbe2lOtfwk5sCyr", "rdLfjXz50vNkGlND4zr6", "iDxNAhR2rPtj2CMkjLpi", "FBSVwpi0mY4Ul2qthHvZ", "gmGgwcQewEMBPmeJbKHM", "sJqcJgT1xPYb9mI6OiiI", "u2TJo5aNQrjGBYsUEKTA", "jzjql1uAicQcesuSxSoN", "KXeT5UvIoNSVMBM8BEGr", "rgRTWLuUoir6DVXJ0SZm", "nzIA8cGJqUAf8c9fv39h", "j0lwUIDSjkEWjUes6sBx", "MKcVujAnkHVTFGOhXZ9G", "KMk3oNtvF3qaNQ3FAB2s", "SVKfmgNHFUVXqDZfaSYo", "VMMqmP5ua6n0b5fLl0cy", "V7UJJ3wtTUfzq1nbOtVw", "zGwYJau4aW15cVNvYJmz", "oQycPmBodfkavf6DF0Fn", "VGr5lEyHVkHH8DuYx5MY", "k46ejDpwD4iiLXl4ljKG", "SZYakQ8iTSECXLoEYd9j", "hpQ0MB55vNLNwrveF4Mj", "UZtzuhCQKJ9z8X0Uj3Xc", "QsxKisyvuJeNsVMkCYAU", "pHUxpUPWXw8vn3DTt9Oo", "Q19GWV0h28BrQfpD9Cje", "7pXuqkNjujVKkebFAZwA", "i716noHuz0Z6n40dpLKh", "4qznUY0c8wmo1muoaBhZ", "9EfuIdV7ypm1fmm8KmkQ", "gXEhJ6UrFBPMP4Gfille", "ZXdEJPMc952paFVrLziZ", "A7vXAACqtxUSV6fmV1Md", "4NQecvVvuEU2JOXTWkHP", "fmq8sVtLUFwZcNDCIh8B", "taDCwjeSTvq6fgFV98pd", "LlAy8OAP3Gawpl8lUkCv", "e22JgFnpNcQgNbeUxnt0", "1RwqC2afnmaPmaiQpVFA", "5drTETvBGo9GF36P6g4r", "QfGCDwc3QpDVT2wfWrpk", "dy0s27G6lKxAxDKB9xCZ", "kN3BQzrwrgeScfJckZiT", "rfdpqyyytAVbXYnvYepN", "IUns76VrfBKXrwKfuGbl", "O7Mvf9pBleW18KuFQN44", "YNZNJr1B7cwVjGONOBW7", "q39wL1AjMEnuZKGsBH1G", "rvjbC8waHSh7To2onCY9", "OJ2yeIonXq4MlnxvtrTB", "KBGlxIalU8urPwp3Cdrh", "Rt4Bez6Wraf9jvueCSPe", "YIVyEK1Pwq6Nh8WK8dqx", "BT4sOyWYRwDxEivQ1vnx", "jsIR0pj6QZ3b07TM4xvT", "r8Q3oMUpFFky73N8q6CG", "dErdLI0NDto51F8nZado", "qLmvO81EEESqSJTlZR9n", "KxqJAy5hXiVN1GIQOKca", "W5QyMshuJohckXtuTyc0", "e5LgLc4hueGQjgM4W3yo", "sdOa8HUbG4cs8vYTXa9R", "FPrw3DyYFwM5Zkff17HF", "Cr6KmclKDslSFbMHoLp1", "FB6ntjSsrj81aEJLo2f1", "tOR8zoPo7CnMNs9Ebc7Q", "JFRuRiDFjsFcGgkGS82Z", "Knwgf3uFf1fzE5rdn2rW", "u668krMDxMkH8evnio2L", "pgI2l7dW9U11Y7AJwUWt", "pG9xv2kbqlwePFg8MJeU", "mdVKjfdd87VxMcsFeaqT", "Lm7izlqK2Too4J7nxkP5", "su0CWsRASHdm1iU1TJLU", "m9IqQPcN81QytOAPGbXh", "s9RtrtsJCDnwK3njRN6Z", "MVXFtfe8G9p6IEx87qPI", "1AEKDz3cM7BicgxWJZeX", "jRdzfZ5mNU2McHgqGhSb", "pcJPGFvamX7TyjRdIWOd", "zQzbfePwLqV8QoYg1REo", "zKFx3gZJDvwAJvlzX9tt", "zO1NAX1AzGwwaBtbsQu3", "JoDbhwaF5R82n7NxdP5c", "f1YDDPo3oi65UHgBDEQH", "fWHScfOF2TrhTNugkgjY", "Oneq4I1FXQWCwmdYPznR", "Qc8tx0ZigGE23qs59rLg", "HpqCbRiyQUPp6Vi2VGi9", "Uw9YlzbsrwW6kMGJmzIA", "ThzXDiZgyHoSCxyxvYnk", "SJqCd7WP6oaXTZ4gFcLB", "t9e34ayz6ljZ4YlgfF5j", "1dGVBI9QuUcmbEpgmodt", "XLSatBGWRJDSxTx6j5We", "Z8Q9KDn7zQ0XlQ7cbL80", "eLTZmOfWTA81GWAbjvgh", "LgE54JhfcqgE97owTRSv", "bYuq42Rlx7SIleLnv3SX", "r6m0BYufxKYXsSNuUmgR", "r6hal3Ng4pCtuwr3SmiP", "6EwxgHrA3XbucHUNKp1M", "fBFX74aZqHxvVtsC9jKA", "Fu5rBXCTNBn0N2VU452v", "Kzqqqg0zPKAcEDRNidq3", "pd1CdWeiaebsdPiS5gPS", "zZ3BkUZR6NStzU5ayhGW", "KpPxE7NJmnklKnw5FTUL", "pwEoQHMNxdtHSICfOawA", "NgthRnkhHC069FsXUEuR", "pogG4tvSTrcoWTTvHCaY", "ObcVoU3IiviWhOmmFhEi", "WpU0IywZ8W5U5h0t91As", "uqMcE8MUnaAHNfIebCBh", "gHBmw9d6Anw5dIfqO1I9", "ZSQv5gZesiJZxVJucwyn", "isqL8V9WURf3s5yxmVac", "Et9BMS3zP1k5taO13YVV", "xAYpEVlyyLYCCiMZAPWX", "PGcGo1GpZlKWusK6L52K", "OaUaIq7TEbydrbrda7S9", "tmdldxry0tGOTlxmZ4Dn", "g9OVkG9KNbREO3z1yqxz", "hEL9xItWN6K1DgUywdGI", "DgWZhWYfKVc0hy9eG2Bb", "6TaJ95F4gWMtAqQrKyUf", "S7d75mmJovtsMTBTYRVD", "vr43iVu2RMftTI1W2loo", "ehgyAqRhHxuAmyBSR5Tt", "P8ktPjNPSBE6ss41iUix", "Ra5BWGewJ7pjDXaaFxyh", "7Cmx4qylIeihCotj2VdM", "aQ5lxfMCcKshUefWSdHl", "GySSkJ9mom8MCD88qSIR", "kA8CmniFPyyduO5eiDQU", "zXpAixIZPay7l6JXs1kF", "xisr5xVlAuF8P2I7zaeM", "AcTthkRZk9ohsgZxb2gm", "uvuJwAPvk3GsehmLSBuC", "KgtAMQ5xRlhLfZdbj0UR", "1kKfS6yuFs6ZYxisMnqn", "ZV6C5hnohHGh0YMScJKr", "BOOiJ6YfuMSRsXbxEOju", "dxbdVv37ELwOhL41RcgJ", "z7ipeJmsfTmHRLsuHu0V", "FwtvHxwhYayXhfMJw6Aa", "XurwGhrXbp0plsk1pegN", "EcsuFCDCGLkmGZiWGX1q", "Mzd8rL7hzl2DNt5d3HnK", "cV6s4oMIKL8gLjmC4tr3", "cuF0lKbobM8ErC4vzRBJ", "kKx51kG6b79EzMCkhlXG", "7dUwqXrnw06gK3kKl0QN", "7XZ5ulnbUKrbyKXmrMZn", "MdRfeBzQBNlHuKMo39PX", "SF8QZdAOxj9HMauymrOx", "E9C9TYxWgL36a9U7keTh", "NcxhCrdwj2sxB44db27H", "L9NtIpy1TRgo1dTDV68E", "80BI4GtfG0ub9FSQ4QRX", "r7Jqlm1Et9Sz9bHCpAr3", "9kcIz4g2U5ZJDr9wdBAU", "IaUSBjc1sT21BfHBjyBE", "3kVEbd8DmGh4q9U2t61l", "Y3kji1sQx3c1m7DLkMWU", "cEZTN1TE8SzeTjLAjEag", "FCfzHtL0DpUp33GP5hdB", "7dnbK8j1MJgaTLZkCskP", "iFDjGT8J9mSGNFpfOYfi", "pLIIgq3tglGM0T6HvCY4", "w1IJG6xeccNSvdiZTlS8", "XjUVAYk5lJ7hKQzYUwD6", "WYYPBHyd0PlV6D1GmlMX", "2TCKrBtL54SZcyylDvOE", "K7hQJig5S0aSSknJugfz", "k5XK1T5FOSRgX66qnltF", "jRfBCSV6683oBa8A2ENO", "go5Dv92isvvcNYlX1Gb7", "MewVD2gFG3duqg6jq8Pi", "1IIMq4trIUxf7r8ItmX8", "q82en6NdEmJE2casgUiw", "wdZ1UiJLUoTIvUwiaHLn", "1c13EZws1cpwFOxh4H2Z", "3UpyymgW3zH3cI6oq0hr", "cUnpqlWv0ZS33H2z1gV3", "gn6G3C4rBjjnBWb2F7xD", "eNHfcHeex8hbtlpuxsm6", "bTunxTnDaiQD5fshuVJq", "byPSjFMf76lgZdTX6Eif", "w6szkkfeDyUoxuGg7bLE", "f7uFiMkpaQUVUMUE49rG", "6J43DJhKs1WX6RkolSdJ", "q7oLRHXUOOkUimXt3FCv", "GiRM7B8scmCSrylJFJne", "fV6LHeFLrRE57fPFpX5P", "HFr9EdQRwB3ZgAvvmAGb", "ZTee63tvYxKoCAxOnLoh", "WpGAxB5jJKIqlwVrxMlW", "J3IUDFsyYef2UuCR3FBL", "XRBIOe8L1tpIw7m8Kf6s", "Hkule4DhIM2nnC6BqCVp", "5I8zQu7iXCZpwRaaWlFm", "7GZtSd2GpV6soCsC6xuc", "9TR5vzdPltBq9khZOknB", "Fr433uD8r8kzZ92U6grp", "X2gglND75yIJoMKrEYx6", "gf3Fo5ivjXkGaOuJk7Qn", "4g6s1RhFzdJdIMq5QWy9", "4iQc5KvnQJaUzfK06zE3", "cXevuUyI1wR5crhhCaSa", "t12qgMpkJ3nwaPpStnks", "hCvJ1czBARl1Sns87hqR", "ibNG0AjuvRkcdgvdIsoR", "KaSkNKrVzhufJFwJPfBI", "6wuicnLse7Hyhkg32XW2", "FQhWfbp2EzKLtC1TxKLb", "RbX7LE8NjeNy23UfeIht", "FzC89Bb4VueuV9zoN7C7", "jZ3laWQFm7614I7BTgGw", "auo43osPt4UdcVOAznPj", "uTixlp8CVM64Gt8If0fY", "37BdaYnaLBJDe28OpHaL", "dfNsYV8DTllUqv7QRtym", "2IxgI647LdQwIlmoGs1i", "dkCTfIs49qoB6mpOquU9", "Vs5ncsbsiaYMKjnyzd26", "UpHab6xPyPYTFbErTniC", "NGWgxHewve2NTHv2OsPK", "FxoVZ2M0q2ABJerEuV9p", "89AZR5cnw17BxtgUw1Uk", "1dvIHlX9EgyMp6wECW18", "V7JQ0yuuxNcy0WHFHmPV", "SLqFSkUcEVkja1Abx2Vs", "P8pNe6btqyOIJEVjwzLA", "T3u352e048tSEipsmOlc", "M7sgKNNGLjRokJppLSoN", "ahnoNbe9zNlMSb0myN3J", "4S5pltc4LORt5DfSoHZn", "eI74t7rqTs7VKDI36t7P", "HWILjxnXELLqdQuVYjLz", "bQUtdnuhg14xYMIHJ4pV", "N8LyYGT4xm3XDYQoJLUz", "KYusvBACDxia33YZH0cD", "mfkzBAoSTIRoqKejVmwg", "hcGkdmItmu6ZXqYjyKBQ", "abCPtq8Mb22IeI1G2J9p", "DFOk3uR1DbRnCdA5SJP3", "JRLwhMCjdLYoYuZbnyc0", "Z2ljfwm5DB8WcUQHoc1Q", "vXETQl2DkdBJfu1IqnO1", "zWWZywrlXqBSNPulBwyt", "Z7AC2BVqztswNMTKIK5p", "AEGWbAHk6EdeLmqNxJCu", "A4qYOKqgctUl7iHgsWRw", "k2Y4oNPkgberdTN1lDgN", "686BqLpisGcaHBc3Y2nC", "dQ3FtOGcZuxd24osPeYF", "s9o7IQBoSw04M2HDQXpy", "QnbSrOJE0pSqwGyEg727", "319O3QbRvPPLCzm1N3DL", "sfBnt71YC2dG3mc6ABV3", "avNks7jFAvY0YhnSpn01", "pdFsNpyV1RYZMtIE0zR8", "ux9RfutUhtTWUjOpYKKX", "mq76kNJiMkrFgygLsZpa", "QI6szThWn13Xp8eZVxGq", "f75L3jgvGTVekaWj3BDo", "AHMzPyXttnjWsmsvVWoj", "yKNgsrNt2bhCs19Fzg8q", "RrNJbDC4h1nfJ8LBzj2z", "Kj9AlJPizYZRNwix9v1q", "unUBvnMtUMsm52woJKXI", "q4hDyQ85JAtDvNOq9ihd", "4YQ7YKwreR9UVpgRFoWY", "wPjpl5eunLXptvwREqGs", "HQLkDzBSnhyi5hXqmBkX", "VFMM9GmN72DOQW7dVI5H", "y3x1iUrSeZz7oJTvaFGf", "IS3iy8MURPjNRgO78Dam", "mXrYpJUNYi2oA3V9Cpbb", "EKyd0Kl8VJtHqknd3F0a", "y2O86rFIgqttApWA7HHc", "aAtPse2uu3Us3qy9gERM", "4IFF7mNC1coakfzdKzVE", "2x46l2DRGdoLv1Y1ltDn", "W2NGfKrzJMBKJFO5IbWW", "EIr8IN73FKqlKBzyVrxn", "B77VMVYc429JLyPdKWeZ", "oVI7eH5A60xI74nUXJ4b", "LBse8HFSluzYNHf1YiBf", "i6vq8iIf1KFKW7zeNC46", "61eTIHVozeRilMWt4oX3", "6mMcrLECXGJcHx5ZFYME", "DnuwAQnCCIEJ2atut66O", "MP0cL49aaVmlJfhT5TfG", "ltXmROgKUkjp8hRRla1M", "4l7NQnqUETizLDlmbP74", "8qrEXGfHoebsPgFoR3Gf", "Xyds9MeimlmsZb65rlKg", "PvYmZmY1pogMkHCteraO", "aMG8wKBn5VRSO0CxklwZ", "XbuGs67WvhuU28cySllV", "EDvcB8XtrUSM5McxRkSM", "RKoTTOPv9BPNMKxVQVOH", "xoe09EvayNuOijpB7F4H", "ORcimaDC3ZS0L40UIv4F", "HxbzgQ8lfA01cdjMBuWE", "RwEn0CHH5KWMF5LvVRg9", "chACIsWTm2hEztzx3EE8", "YiVlnogHGLQq0Y2IQYjB", "YONVHMTKafS7Ovs9kXQ0", "soqqLq6lMpuuDHQSbrmC", "WCJu8B2siSqYFgMaWSJs", "HEkST8u5zeHWrYOxhQpO", "tfw8JHinjzdzDNRhWMkV", "y1zpXOmEoZcfCXlVoRIX", "RvUeHwJlG3GE2E2ZcmoQ", "MO4Wvp2hHIDgChKTbcEr", "dS4gg4DGqzhAOjhHYhxn", "zAT9pmcROoGzFIfvMrCB", "qrJCa0S6fPudXNmM9NlV", "B0VQI8KdxUomJ7yr6Oxj", "lpMGB7bKUModMH2dPKGL", "o27573wBSrvBhFSsM3Ao", "NwQiDSLbmZwYb3di4XsU", "Ong306tL949UyXCAzVll", "4fHfguMkREFoztrxzlI8", "nQajxntxGegLHyyxqIgG", "Wv4TotRlehrP7R95C20T", "feouaksR3WfXPj1BaQwF", "7ncDEjIPmGsPueJTO9sR", "fXx2EwDoM91Ruee7LuW7", "AOU32mWOvMoZtlZ5hnt3", "uvUpX7ws1QyCoQDoCjC6", "50dwlC1SxuTsnwfI3Z94", "z5EnVRZg8jkBkN7TZ8uX", "1LNmH23IbCLaHZLkzsO7", "b8JLVQn3XhYW2vIIvLaW", "Vv4kTNVSFrZq0qAVFxWk", "c4GcxYussTMNMQ6plZH0", "QppQdzusuOcWTs6OPzHF", "Sdao2gclFrmggb4KYyAS", "Nlwob2C01RDR3oE3Sqoi", "haMM9QehNm7iX3W96g75", "8LXB7jEZZ0FEbbYi2COP", "zV7UXbdbFjgN4BW9uiiT", "jygIZEyZPKwMo1qLcSwq", "BcBDoiMgO4850oLY0I5P", "c2jQ3ale2fUBGfO2Lkii", "mqllc5JdNO0zOkOSK74K", "nWV3Br5VZlBLcw4E1LrM", "isK6aiWupaCa4fbEWej5", "QsO2oTEom4AUuUbUA5Oy", "gYYiD8whmdkCV8CKZR6M", "TGoNjPrtVDr9lOpwUmdG", "PNRvTdD12JLVX9sGXh80", "ux7dJwZniA46VV1x6Cy9", "VJc2QVHvCPv5M2gexGRd", "OTjuwip3unAP4mQSFfOQ", "4JVOKB2HPUsmxcesKTvF", "E3cIp0k3f6ThQw6i56xT", "YpFUPrMkKHxYIXo7YW8B", "dbt1Vxjb3e4cTH6t8SbQ", "hWwz3i4ZEDjrmcsIZZta", "DvAfCGWIg7gLdaKeINEW", "axMMXCe4mVczQnca18qi", "FU3q4MVKjhrHcBb7NEB9", "jl78YjiaqXG31Hu4dNOK", "2DZcOBjmPst6dyECgvkW", "S0ZRFRVrmuBm5jOUs5EH", "x5LZ4ajkVTGvRnMgDsXz", "khmnQ8HIETX9ZsidQRLv", "sZqJMByX3VXlAHYYPoqb", "FLloCTPctkYlHM3eXzBY", "SgHdvoBLc0wrLheX9180", "kej10mdWjn2CTIpP6yii", "ycXII9nRBvRvZAwYva2c", "N4ooKbBQat8WWemonYDy", "Tcr1koZfMZIhb4TwgfME", "YTi27Tqs11pSdgTOS01m", "ZHTBMv70aTE6wu91NxuM", "zjpcNIyqJ0asH23bxAbX", "endYima3iSQh9FHWXEKo", "EvhTxi5utePVS21AnbBV", "1bAAoRhMf18rupLpWOjN", "26sU9rcwToPSNZdCyKWc", "JeTCSm1w8jJBpBdw0EsR", "0FuNoXXnp3P8gqI6dK2j", "1LuqUWnUkdwkrq5fNdQA", "enGIcZOFrQysjrgDLRi5", "3cnuSqXnRwx4jDMLklYb", "9VRtK86fXmiaMTSmH0Zj", "wUndg7xQsT02wRtGXxt5", "kZd626tK4Q1ytmZZtWxk", "yvmuNd9sa2xKcZPcdGuh", "etdXfC4Xh0Hfv1XGeg9E", "h4XHbutEAmvmfYKLjMsQ", "M73G8YUmDdyugV9HN0WV", "mPISwaldwb3Hi4Vqczap", "bYhH2qWPr0vdOD3Ilovf", "Pww50RvaPVQ027F4wjTn", "kMO6XSOIEJyeFsjDIdnh", "6Df8JuAFdc0LyORWqpm5", "8ihLbOYtzMY6XDCq7N3i", "z34xQVRGJCJPuylTLHKK", "bsQ93dxAyzrx2vsSOIhh", "Uy7MxsqI7Aaj11q4cnDY", "m4VnzLDLds35rASm0G27", "QcqRbgUBShjClCxiWB39", "16DqEfcEvcMJDAjmrDyH", "ufTfqRLMaOTbTgShJ2uE", "dGWqQFcFSYWMCyz2NIMx", "gpW7Uynnzh0cvWQLj2ZB", "Z3Vj1UjOm5JQsqWKmH6l", "y6NtalCJmjULnz4mRl9B", "oSZgI5z5M5oIBA9jvK2h", "3U2oR4bsnk1bAaITgFW0", "KKJVUSCQmE7og8c7ABxy", "tyZ4WpXA41BOLSrou3Ef", "FJRvP12aDxW6v5AStfcv", "glK2D9q6B2jQJAMjBMHM", "KnTDqddhHEdxzxxB4lHF", "l0e580oHK3eeq5qegTMx", "hzvfuqqyc7CN5qSBoEQ8", "H2l57bio24ji3cNvTBt3", "G3QLtrUh3uqJxZO2A6oA", "8Ys98F4ZOwcez1xtsRYt", "KMCFvZF3d4Ema6vgKyGi", "usLtrIkhkJb2fnHZKWcy", "Yoi8tbpBZ3rTtCLlV5SF", "M3F0pWZ70B3XylfrLS2u", "TtMN6h8bkao7c35PXeWV", "nY2lJgce6cXaWtxcY5BG", "dzLD0QaX450qd3ZujCXp", "m4PIvKsRP1h103EyTpTW", "uUKXXtRE3y3q0R8vlzK9", "02Az5MxWBP03tKYOEycH", "wd7v4EooD9xBB7AET6id", "VhgM1DkDBMV7za02mpqx", "wn95sHJJNzwqgbCgoutz", "GM4Ex3Ghs6fotorl384R", "7zFmaQSMKJJZgNnbQ3IG", "9x20jtjn1lC7kPtIpJe8", "cvhGHUrfX8we5wenoLYn", "6kur9l7x2k5ffmvwGlcl", "tWNwQzjEKH0QzsF7eN4e", "79JkvDh9yHsrlFlBETOW", "kMwiEApqXtVc0oMtz10x", "Gsm17WDJzZphvjP9rC0M", "3Ty3FJuFIuAZmvarRl8Q", "Kv7DdVLUhLrlmnm16hGP", "ZRwMKWBlIKBaFGosl9NR", "SCACzuD4bURBtNVDtgw9", "05iELU65bRW1deDdYQh8", "s8HjVkuMQqUPvCdHehKF", "7oEkSRLyp26i8LPb5KwU", "AQt6aULE9dRGRf1r4Mpt", "NuZTFz5JJ1nRPgXz8qBH", "TaYsDXjHrX8CRggeflxw", "kkN9Ot8UjHmBrI32pnJe", "KPrj5VLiGJcy1y7OrDsY", "SchJulLhWcMozBX5gqlu", "7Ms7KxVB8LhayPrs8CYe", "msSl3xohnYZtuP0EMVNU", "o22mRtdX3BBp1bY4WNjI", "tIBnhB13gMVSOVFoOqLR", "1XE26m4d7nv034nkFmlt", "6ELVjaJ7OcWP7kPEWRpc", "CicFmOx1AisHuDkdm1iA", "dEYlwvxTLm5XUflE3gDC", "N5RHGBt0CbBpohYkaVBv", "HERjuAxxq87DDYTSjMSt", "vdjjIFStldm0sDikLdfC", "mnNxLqP5Asy4TfnmtDde", "pPchbKPwy46krShBI7ER", "xAVQqGAjUnLJBxykILeE", "PlyFDdQTiesfoL4ccEJ4", "2cLBaJtqcX41G0ERbctI", "Glx371dhEvlEX4P5LGtx", "nxy2vBTVnMn26k3Bkgsw", "ZbA7fZA0p4vaztcv24Qq", "QDsUvvfdZVZ94jEhGOh3", "QccQUCLUGjKfuA9n3nRd", "GykLgw2uKiwjIY9mkUFz", "BZe5inslYHMpG6Au2CoL", "si4BGDvzfAwoiarQLjBu", "zYhDcr7d1tyuc05qByno", "9jcrJTHdASX9yEKb3RE2", "JAwv8zjHyX55EfwW6B9E", "beMasg9t8LvPVqKbn1sj", "WxolaiHgtOsV2E3svCl1", "XeQ0UibGjTzEOozyWEcQ", "cUtejwWc8Fddt3dMjCcS", "dbg1NdxspXGRz93g5XIB", "ktoeuPydZa4C9iBXK8P9", "dfbamcHr8X0sRmWJ9Uxi", "2zuCh5j1B6BmjkMVKbMS", "9KLY6prFKmvKlpWTsDS1", "Hbn0J7Vejp6s9PODFFQX", "2LrlAME0Xf1pGmpYuLCd", "8GTIgrVv4wS6HHsQd4OB", "hO0wAnU26efFu6Xav0T0", "ut4ABuYmxwveKtYVh2Xn", "eB2ZFX9BWb9QUDad88Q3", "3JfNDEquEMftVgSkBZth", "826dGeGMnePoy49BG03T", "KgMpKmXWJRBQTH3hwH3h", "uQTsTc1ha2AugUh1EDVW", "eew5uxnoEoT6FwwiWvP7", "vYzc2fbHs4nUihZaeMOq", "BpxOlt4GnTNi1KK2ztJp", "x4JejrENBbDKQ8iC0mSn", "EnVD5oF3hWsfYAJHzVeA", "6qVXwBhwy9hAuBNzzb2g", "7tJe1av06YACMdjIpODl", "VuvP5IN4rNjzG0bHbWFf", "2QpO1XfqvsbRkWqqnBse", "ZZbnaC39hImjgb6i8jY2", "b8TJcH9NT020Zbn7mqET", "9yAnaEVgx2iWABqmRxAu", "xAuVjhaVWnwdl7QJLu0H", "wgn4qboHZwBU63zoiYJE", "JGp4LGMe8Kv40h6qIu7p", "rGKvJHj2n3E6H49aIVEQ", "p8SnpYe5QltH2DDJSuLG", "vYMCcTmsyzIl7iZuGDzg", "wsww37GW1Zkx769jYubU", "trG0ZnunyrSuiOplT5FU", "ezRm4ZTcR36KsKIS7AD5", "zfyh1nRUqgzSeOCivgIM", "hOeZhuzo2Ds2qqhqb6KP", "lHrPe45ZiNwPjYwQTuFV", "55VvtBlSH4r2JiRxmWXS", "rRpbxm1QeEujJNcAYMcq", "QTshCIfwmAPebEFYyExc", "TpJkAwvjIXXgzNN9f05Q", "AS4lfHIbVDEw0VhARarh", "5OL4khBPhHnshrbM6tyc", "4AW4fBD5l4kpR6rBn3YU", "KMKzBwMInKssSOu5a7AJ", "At8bz0mk1ICLeXKqTe6G", "ww6OK1Us6cAGVGrSGbCH", "uNaWutKLVOZSKgoffGVl", "tf2MwrpARzQJMypEp8ZL", "W7lrnZUQqxBhbB3V1qfS", "o3j80WLpes89ztykRQAH", "NKwyTxTUm7uaAdg8A1ym", "s4vrwtaNJkcf2YbWV5yH", "AtpIWUReTNRLRKBNElkV", "TM8Wsk0OnydxrTFMvg0O", "1RkTmvoyeXR7rabkIb85", "Yj0PAFj5ukUv9CMv59rj", "gHoXpQH7zNAX5AvFPeLH", "OnBYzVR4eHnKYbqNz5Uz", "ReUWoPjB22RQpcwo7Mqk", "db2BBsWAw07NccrOzYX1", "byQQYKDeg3OHfQQoHwyD", "w4YWgNsdvQdWM3xvN8Z2", "BvJoLkccgZnbdL7Hi0uc", "OX8kY3duBCwL7F9Rxk1c", "HpDu8I9pG3RcZXN7b01k", "Bv5G9Df6vhiCWt6eADTO", "Gs1nQOv1MulVqpkz2P3x", "6k7abBDlOeAeXBQxXLwr", "DfN1S5yUU0PZkW9LhM75", "1FiWQ8RvRLmcy7eRCatf", "aJEKnNgVilYj0GDOMeHn", "z3Qx92OLcIyDZCVMa9pG", "uOzscAEzoVklX8igA5zn", "LyyuATEid4yVQvO05azr", "6icdqJJ1OGmhEkbNBn5m", "p2IFxeE1EBsKtVvkmEjA", "TVphDQ4MB891ARE53S6H", "ezaXSVFEiyMBRBqcZtzi", "16jBVwGYOLn2KNYkrlwZ", "kGi9PYmwRjeQnObIKqqg", "BdhTzFBq07NiL5qkbcg1", "JKR6g1O0pCf0nMRmZccX", "hzE224mceSdxk43R3PPs", "b4sMOH9xrjTYjhajlKLP", "kyKV1Lu4kJxJMnfk3ogu", "Y9TFo1wXMIu4EEZDZTGH", "lDa7yFpz2TuYaLlOMhtg", "xnlAzINYkdpVoNalbNkd", "re9RzuoKZh0XTjfS22zm", "eoHQApBlCwM3YVTWNHow", "woRPY6qY7pKjdb9nOLWa", "FsclN5FiK3fGq4eM9UuE", "JExun6gBPCje3LOOQd7i", "hkzVmbrv5l9Mx6GkButa", "5cD8ybWMEb5tL2O8dF1i", "yB2vFGfOBWzG9CM7nsRz", "UWtnYHv9XxpT6rPJ82iH", "ZhXirtncjEbBjUzFmsPH", "nEkt67BEAtTjY0PNrCza", "Oak75jNpbk6NyoE4wPG6", "GjnohCBYM87kjrqmYBb7", "vfUtRjwL8CPPuCBbOL8i", "TDTA2JwaUVfP8AGatCvz", "PLMHVWqspyaI93RBKLjo", "rPBzXSXOcTN1miGHE793", "5kJDliO646uvT4s0UQO6", "rj6bRMsdT0gXkykVg6bi", "CUbfWUd0s14hlAIAX8oy", "8SVqOFK5KtnWLNArrnph", "nuMW2cgZkUWrv1fJFzMZ", "r83CVB2Kxr1kjLEmxuJh", "NpWIpCZ2Bwb24cDZmFtj", "4sRoDfYAXppudMASWkUf", "g3gidtFP666AyXw9ASHi", "I6avQlLuTna7qGpT94rD", "AxN6TIFbkUJ0YsvzbEt4", "1TBph0Ho281A3PGWhT8P", "xPQVHJSsYKuXl5NT3eH3", "kHDngRILuOipn8J3Qjty", "3oVnrqGtUVwEkA2QZIjS", "gQHRYYUyIMuJ8O6zEKsh", "onvYvvxUDewr4CJbklX0", "7SKFoOD2j3hXqd3lW0Gi", "fAXjMqK5cs5jINx6mA6T", "Boy2P1lt2zbfA9OUxhZZ", "XdHp0CvkKzBVn9VA9H49", "GdoOkCtirQFO3UD2g6ky", "6wUr3z2AE6JTh7pSIi89", "7NY8qj8WotVunxjoulz9", "pIcVORxg85pDQLLG3Ulr", "LEj8BSu5CtCzAoUYEPEK", "S1XtLq7MIsDd6wjHMeLW", "VXWdKyBWONqoNLhi9p4S", "fF5m9n1VPK2usWYCShiq", "5WfQrK607AQlNWVWJWzg", "r1ahV6tymZmp3PFuiLsp", "TJaqn3K4aJkPJI6oNxm9", "UXwXwBPeUFSxW0lJ45Lc", "O3zhM3WhyGqSlmxivMKP", "ZkM6l5NnAhPYkOG4RklP", "0ZpmJkSC4mbdVvhG053A", "kQhUmxZDhIafqNP97rMB", "cvo7pULpZMyJmflYaIjF", "bHuPeIYj9sujmgobA7Qh", "TMyFzklZ0SobjhyLzX46", "Nwo9bakli9RBTPPT7808", "bnhKSgePBgTYdHgEsOxY", "VOhxm6OtDO1o9j6bNk0Y", "RU42jkGZ7B7capZMtxF6", "KFsTwz3Jh1r6Tv8BeMkl", "YqL6dtSUofZ8sRaoQb56", "cuC4oJFSfzBBnUHQNhtC", "LSIDtq0IR5O20Y6opLET", "IPe6tuUFZNPunf6hW6zv", "9Lx9r3vhM9AdWmhOgBdE", "X08KfCz9Gw5QH2X94ToQ", "ay37ikVNu6bP4hhjuhrA", "dwYty600ZoP9kSESBhn3", "nOSr67ZyoQ8QKhJIlHHK", "5gRn6eDFL1I7PiyTqVRc", "ta0DFHU0YlIbPhOVLalh", "b1oykkSYEr87P9JeQncx", "WsYtavOvV7a49O0t7QPL", "IXQhgjK5Uw2ynYrNTEIw", "Lt0UFzLMPkfhI6Nwnh1I", "b1GOa6j3K00fry86xTRL", "E60WANQy2SGcTUy1Yi5s", "i3WZzedv72GJ9EpHcGFc", "gTE7wB9UtCLZDp6ATj5Y", "kJsrYf88tOkXpxfl8mEz", "wXY9McJnJNL3eBuAr3Ii", "P1GEyty6fA5bhbi3DzqW", "M9azLU9AVSsuT67Rz3Vc", "DYBs9tvKtjoFsOCBrMLK", "oCFFGKeGN7qYf2QmvJ6o", "0u2qHE26YLQKVdZmxB0I", "IqqxqEjmVnYVgYMvlO1J", "hPeD3BzyNzFfn3beIIOn", "6wHkTdfEzgVg39r4Jq1g", "nGJbJuDZDbLHXc1yDgCC", "KgqNpiQ8WRmKh6t0y6aB", "htSCVRBg7LsP1gnpMDvt", "eiBJm2Hk8runiKzDm8rr", "UhHTO2IiDCZpuk8emPOs", "FIfxdd9Nl0EDiVf4Xxmk", "9MZ14hfp52hKILHvyOIh", "PXt50Y9YTtGbFqaIVE7a", "GmsY58S3WijtFcyE85kb", "z0AColUIzZqFKjlPrDRN", "wAF9kDNsJ5RG6aSuLvAK", "U1XmkICbUdwOnBXVNtLe", "yku2KMvfF5xi6UUqlgPD", "JKb4V6ZqzsUwdMwxhrbw", "vYe119qmnDz7XY91ehrc", "ZKYAgS8NKjIDFwCG320r", "ExylV5k8makKuGUYicw0", "JCDX8QnCQm3ehzQD48Lp", "i39cJd91G30XFD4NbqX2", "cagJX4UaBnPtqYU9Bd9P", "g9xtKzGwpmyPKcjsfBSq", "zrjnPBvYo4ySDtLXsaRi", "MP7g0oWfyyTxnAiAMdj8", "hfbsYuOOSp4mDARDwxqu", "uJrfTaqnBXwtAVjgN74q", "v9a8H1JDx98rQxWrVKfh", "pbYz6HfTPiHIpsQ6rjJo", "qPdGN87qSkXGL5FPNtrk", "b82QyQWq7ncxBGBWOGMo", "1s4MxKkIDb0oj0CgQgWX", "R8ScMd8kuTZtLdDGvxZ6", "YZsGa4wykQUCWwmtatbS", "M8JfkWvfUUm02cGahAYP", "a2b5xMwVFXxZeEEOk93C", "enDeQTE5cmUAn4FkQ9Ff", "hACLOQh6ZkJBWWpux3zZ", "oRkZVxHv7UYoek70Ao6i", "WNt0thsrirOUH83m6IiD", "mEzOz4O7qTnMqfLiMDX2", "3vXK4Y68rmJdzI2yKO3A", "rpUgUpOo1to4oLMqsQyj", "DHKCXK8rj91YyWEQJaCK", "T1OGKk6CB5vMKEWqYchH", "jhogD06UbHp2IDIawNn5", "QgPkutaTVGiCxWs8Xxc6", "EP6WbN6Vkra8YxsQqRrJ", "faTa4MgZJGdXgi1H35mn", "xKtTFlt3AlMnJpNL93tS", "KWz0CyHF410zLtQadJdn", "2xbJkwfs0YKK2IIDGXSI", "YTFrKfPxx0jzvIJdEwVC", "SqWS6mfMJ6dpXsgrY3nV", "3WSwmja0d5D5thWzS9Kl", "FxbmnFcJHPmItFFfwnda", "sodkU9hwH1hWwGHkUr3l", "Gq373Gmz3NXuCBeeILaZ", "LF4HULzyA3hQrkVszFp2", "cNumWYQmsyMDEOSghSer", "TJHI1kA0zx1bKvMoUkbK", "jvVvJxb0NDrqW68XqGYp", "EZOWUkJwTuECpj58he64", "rxtL11srGOeSv0wOjFKC", "9ZMwGR4x580u5tF4s7v6", "UXYPWVnFk6PsdlotCrpF", "zp93gM7WR1dvW9J2c6HL", "AgDnPzfbqUooJvrxHwRj", "x4eUCvWo2m9AQKyqKdP8", "5CuO7jJPgk6bni5zeale", "KvokDkYXLyeQAYmFG5cw", "oiXbPbY39JfTCTBQEkvZ", "gX0o4m3KqgEeOlDlKjoT", "2TwDv8d7qWeW4eK6PNQD", "1epON09ijwBjP6wICXP2", "44W6gqC3BaGBC3ZZ3iFm", "ePW2VQKhyij2kF6Q3GUC", "qiN0kuZndnYFC2HhSaMQ", "G5Q0IWOJmsTaZpaHj84M", "vaa5crk3P6TfBsdRM2i9", "sBhP0GgkOj4HJeKwU4xr", "AQVJG8kd8Qk1bRQah5I3", "oKI7xc1RgyIoNn7dupG2", "F03pQSN5Xf9JxPQu2SLg", "OcTlNaPHOfIbeJO4jl9G", "OGZMgyGgOaKmCnYZMvpk", "a7JCOiG8ROMqcuCIsQwG", "0H0C2YkOTX62cQE06T8X", "pVNRNXiFycTwrT7u2pGT", "MNTwlgup91MwUiNrD369", "gZ6X0BP00gUK1xGkbAZk", "BtefZ0Wn3auh7yD89a89", "EaTFWhx7sUq1OUfvS9gW", "kbBrXMxhx4qBeIP8zMGp", "r4pDYU61dnVLMeBt18Yw", "CN7pfWxcrBQgFFtmhxlK", "kEe4spwrvUn6rvvUPq7G", "0XwFknzRlklTwPWpCSg8", "uSEmN9GkxLzxstBch83Q", "rnrnANaNpHVkhhU2qiml", "4lhufqXKyYipJZbSxBpk", "QIS7zw9ndwWhfDbI36a0", "fInwsOOnaBX0Ty8QsHBV", "BiCpvo5xugvXwiSo7qZh", "07hR3psv53REjb1fP7aI", "lVnhDFUI43z48fVBUL5X", "NWk67ljVsJldmYLymnGo", "qGqzvJ8NfDt2hd8nOsIF", "91suXBsJy85nMvkFFsds", "4Uul70YTqoiypZsNkkeh", "skUDdESs43i8XcscbQ6P", "DoN0LFL6z0lqiD3LRTCT", "Xsc4TUh4slT5Xr4t6Pz4", "Piu5vvPKOZntRPyurdwk", "OQnvFrmJHjNeRFiM87gV", "eUO5rMyjxuRJIEDV6zpL", "jAxAOfVWm91ObQUTkQAg", "KbzbnA6rAtCr4AzQnUwa", "ewyFKQg2qoi9PgiBqo2y", "iDpkLpA8H4ityf7I3nLs", "c31zhjAYVBUBOKtj71rO", "6YI4DPLEAg6kh5iPosxI", "3PRPjL8oM0BQYRTjooxy", "U4hB9PawFVCHvdgcwpPJ", "najJ1C2p0xlSzQe7pC13", "iDKboyBlla4YAlp9wrwu", "ngNm6ztuBuxr5FSuBcdx", "CfTLQJSK8PFv5ai9ZZ3i", "SyaXD0PNc2Knhl862aOB", "xb40BkAiIBRkAzFLzfia", "f0NNkTRm1pvzRyxai5J0", "HiiRfykcdTCIRXdB02y2", "qrzFpupW06WHmDgRBQ4m", "rE2JmgUmgQmWIjl5eZbc", "d6rQJXrUvtEn8G6uuYeb", "zR5F8pKmOuMz0DPJkFlg", "8zRGFXA83pj0EmFMbY7x", "STxQhKjPZS3iPUycz7k3", "uR36EHQnnXlFzgfe0M3a", "m7IBZEnZJWaBxbHBqixd", "DiqAMVoMpqubvAkUNW1g", "2ZsxB77zn4d1mTB6xySk", "oLMjV4BsaDXckPYvUftI", "jWHTxSZuOzfAKzro33gc", "EDCyaks5PlL8FcbC285R", "8ibQfTEgUtIi4VedFUgf", "F1lSdLffRi4ZQgy37AjZ", "12F4XthkONNbM74zShct", "PhRnLNqSXZ1XZGb47IpT", "dA5xH9whqYbDD00YNo0s", "NzPvDyzLEmmrxroCyium", "FTzSTx1olzg7z42A2zTH", "kG6f7tr6ZjqmCqFdlEPX", "D4cA8cL8boNL2SyAJqEs", "X2fkssLc6l9JpjSvLn3u", "ZPGcrCkA2w0aydIrVdRb", "MYt9HL4c66WfVkFKxzSx", "vSVu4njZPA9ji2tzLxZR", "134WoKojJEgDfC7jxoIK", "wP4eRvbks89sBEMxYBgp", "PL04V5nSt4lpTnRti0bY", "8lQIznFVwwILHJOkM9CE", "Dv3fiTYOR9xasLqr85K2", "1dOGuk0GtBU74WknxG9O", "N4wGQm7WsSZr3v6vf4BY", "FedKAN55dET1HOHhAMB0", "mkqpfwkK0urEYUWgsbjV", "nCU4Yljh8vhufXiJRQbS", "KSgqxCUnlDIWOnZwWIde", "DJXroD8GdjgwAKm7UFuF", "QAjovIjSbM4mdZbSmhiQ", "ROMZi6eAJWPkg6YaPH0y", "c4kFcKfO1NmQj6zPDdZU", "9wEo3lOS0MQaQ8o2QTPQ", "rBqYIoyTRVxZSALVtjvt", "5JSTRGUqjrGY247Ks3lI", "Yjr0rCTktOdwh5N7Jpx3", "gBZjFg16hnOGUDELPi5G", "4gAkkXr3Nm41veiAIkG0", "VcEzpSIC8LSBzavj8klT", "WnSPRBZivoiOQwNEMdQT", "yrcxRXfXFOyjBR8bcfJV", "TztstE4DpUgnLGilnLI0", "hFjtgrSGXllyicqbquof", "NTQgj6RVSiV9vF0b6Srd", "BactCQU0JHdgk3KT7kyX", "QUhLhfwn6lPFL17VPZVi", "q6Ma7h2EP0mpSRA944vA", "pKQ8JVdi46PvClTJQVXp", "WHcwim4lqzvdJJlaoMIt", "ShmcRFvplRdFgF9N0D8o", "C3STLB39YK0yzmbQ2UGl", "vr0a69x6L5tV6LzRW0b2", "KZ1IMaiM4w7yn5YsCVwV", "ap1gA08fyhfHGeZaEFwJ", "C1Hx4ppFImksZlWijcLi", "J0xYfW8tl5Av4Rr9EgOW", "Q6MystgbV1Hn1ELeiRYU", "WgNZ6EgIt4pH89F00vaU", "urHw6aYm14GWlc5rol9f", "nwvv6Au44UYwJpsNPRAP", "VQvE0y3nhDSU7NNBWFGY", "joU3cLQzkaODzHSxDVku", "gDMoYix2xDah05icO8Z8", "hwJeDlbRFMJvXgh3Od6J", "og0ojgO5nyDUuX85GjUT", "3oPYS4cofi7UM6G6mfBX", "bN1Ts7W6p1aqnxPF111f", "j895CP9x2JUdeU4WbbcO", "aAFN7ea7fbmMhvPsIXpL", "qHySl1wLcWhAhwXoY5vB", "ehXLavBtS0EGGAg1BcKl", "82vpwQeVTXg7FCRp5cgV", "bujr5PqE19099tx5KZYn", "6DtJPK7SunxVigKl59z6", "GzDPr8UBh1woEp5d7C32", "00VggqRjxQnDOycF74Oo", "5IaJ6guDsxFqvjWbZxIU", "M5hk4Hx9LJxPbWihAbt0", "Y6rSpN1MJKqfPXNRoIa8", "bWXA0DsAol8LrznfLo1e", "8sJWNevAwUIX0nhy0X6p", "GEA6CvlXjmBscSM06HA0", "lQVjDAhDil2w0A0C5lhp", "Wsf6Iz6MGEM0erhr1N3h", "83c8EcIHMz4qphw7g1Tv", "DnvscahcxkJ6otC0WTHq", "SMeG3YLiZndnaWdD6Ip4", "36Ap0KnUn4IEOwUQUp82", "cjnBFQOLiBNjHVWFqJhd", "OzpktJAM7GOjzBuCZGWH", "RtzhPVuFpcqBZgvRx4n4", "I9mGIeSrvy6Ks5zFbuUO", "UIZ3wSSuUFynMi1eNTVI", "QcaGfaVEUxcyF9zCaS64", "f2p2jqe6IAMikwwNWRcy", "OCwbKuluKpyzqmzZcefu", "m1aUxWrSvRQHeLryDcqX", "SoUIYSrB6W3qVcKQ69s2", "bHHDa8Bll1IBnmRKEIVI", "mW6F8OfFYWF7lWKJdT4O", "SMXD6yXJE0Z0XgFf2ssa", "O7f9czSFQWbsq66v4dEI", "elG9PTmSLf0kkgrKdKZ4", "o8wdE0YGekYGTmPtFBLb", "oJLXzCrbUPfHXZskaO0C", "8XQbHnSXwl8l5RI4b9d4", "WIJ4qBmOZkYfFyEXlh2f", "SAQXZga8oBCKSTMIe6gB", "rEq6A3btidY8lxeIdERP", "Pbkp547hBlt2xh67ig0Q", "HXZ3UDL5PkVmMDcPFj6Q", "TxQQdVWL9UmQ1JRTWlZt", "V2fpDHESzJrSGFqtkMFt", "rzKqIlKmWrf0rKp2a2UX", "LJxZZnTJ8gBzdTnvC7hh", "wKhneUpCWIjpZgP8UqQa", "WZZ92K2CShtM1Y8d3xqX", "DZNlEmtiaHG6qnDq7D3X", "uuutT2WUxM19uMu86log", "34krrxiy8jW2bOv4QQYL", "kYUeuOk1AWhBaS2PNiMW", "PqY1ES5cqcxaASD4qx5y", "Un92DASasm6IcdHq3MSt", "wNT6pg9ecEc4zk4CuUlk", "Gr0sSHgVc6OWUqdJUmv4", "yW8wGD88frqwjro96Tfg", "Z1D3poLKYGOWmVQ0gZ8L", "QxH7m4HqXuX4vi6lWR32", "hPWSuxSYUZusW90GBF6g", "9dl2JrlnIopxEMP6Jqfl", "PZdtgb9sqDYxrJy88jwO", "WlMi5joMXT7u0lnhMuXB", "858xN45VmzsIjC0ovmBR", "EILC17rO1OZ7Uf2pi6IU", "5AkoMkbGUmhi22v27kQ7", "9xEbaFQILgkOpUD9CmPh", "W4NW5GYC1yJAtWlUl9k6", "nVUczfmCP9rvEESHV0TU", "zleqHNI0U34HWWuVCefZ", "nUVzjxGCxiguRIjif1g7", "4kOYGG2Quf0gAVftQu3L", "cjE31xjewNlz77XLMZmG", "FkuPFaGdSJy20A3z7kb4", "7M3ERYZn8J2L3wkGUytw", "HqyF0zE6jp8q992ahaMn", "tO6vIoBlm3h1teGrdUvL", "H1BQ8EzomLbfhiaxWkiH", "nOIe0XTb1PwHO6hXIeL4", "xujccIa70GMncePcBsCB", "H6QgC7DUkWYhQGK1Ws8W", "8SHl4gLGYXPqepUqufJe", "BrMZ5eabWg5e8MND2jRb", "GoPsdrjVW08fpUEv6nUc", "TaGcwcnzLEYZ2xSdo96I", "9Evyi7rmuMOOwdyqFlpa", "xN9zIZa6igMpvHobPfOJ", "zkfvNdkcMZAJvIGBroGY", "VcNOu9xHnLYm6EgRpQ4A", "xCRqSi2IUIqxsBLkJJ14", "cYqgmU8ZsAhoK9enpe5J", "utHn2aXLrXNU5CApgGMZ", "Q4LjBzW0cZHWSWHS7nmy", "K9QNLZA2pWZEauxjrRjT", "0zySVFua2gZKoxf9WpBK", "MiWuaTeSsLtsKrIo7AO7", "rvQft5mPvwhFeD7DeldW", "5WONMgBRraYgVwJO25mv", "zTAefHpJ1So6wCTIrfjg", "DGKiCb7Cer7eIFGxX5FW", "X3aTD1k2eRirh0asZf4E", "UAqmP6kuBzQg2y7D0pGe", "HwWyx4qWhtiB3YxQefLn", "ejRegZsgO8Id4mczqQUX", "HCiIlejNJ29wjaaP7Q3U", "WM7b8hYx82SNF9gynNJ4", "PS063ZUAzXeUrk5yRbvX", "eNvrWZpHw8MJbKPctrmr", "PPLE9OAYz36dR1SvaHBU", "OVnxpAZj2LYPitdpHmOE", "pSqETIA1YJVwoGtdQSKS", "lspUlRH0DfF273HYLPXt", "i0pWEg7f8S5uKvM4Mb4Z", "FHbMKqteFOXxNLRb1ZG8", "zK2JFMNZxQ6ChfX0WOel", "kBh7U6jWdxecHewUyH1t", "h76NnbNHz12hAhpfoY9R", "Vl2lPyDLDFEvMKI7tdOq", "ePYo6NRstaIMLK7iIJ3T", "YIOsae0UHOIvnqisB7k4", "i2P1MUkcnl6L1SEc5C4M", "aMGMBwEM3wPlxolHITs4", "EwPGObsTnuoME4iP0uk1", "o7ljtW19ztDDnbRBCHdy", "BRIQTynRqVSecDOVjNfi", "Esu1RLAcdnamCsAfoy6e", "RXI4keXUzCAB32CUML6x", "6ejJUuwIq1wHYDJIprkn", "1ty4vBXHUbEaEwtioozc", "pttN6Bfu0Qh1Jf4CoZSI", "AgrOak5OY40Lvsi21Ou1", "mb23E4F3dfJoKAAutFHP", "HHlD7RD8p57Zg8asCoto", "TDanLkiCyxaDEJOKkbQY", "gW7KegDoU4cvHCjbxPlt", "ML6YeVqP4Hvjn01PgCDA", "Hq4W0n5vCroWAt4pMtCQ", "A77v79KmJVuaJy7KlCFv", "14PCxSzHL9hTEnOJug5D", "90oTwtng32b34zFzRCGm", "LwFXjbqbFuoOuaroRcUT", "d4Wh3jfUvtEEpTlW2Z7F", "TwdLUTAw3ePgitMlczDV", "sRhgsQCuzI9TClmgCuaF", "ZxuFqEzQDAv3ccjU2uN0", "CURODD2N8ddfaVsPjppu", "0jxcLh4MbPKlul95y9T4", "k4hJZaiGPV8PE5zYk4sL", "TC4LxBRtLuy5yfOVD4jd", "ar0ow0Mh4E0VO3rLEGFZ", "ABf6o1b06Idg9bS3bnid", "zh9OkyjyEwYM5BSsC1sG", "JTuQ4NTgACH7tOVbMDZY", "77uBGK3RJvhcOc0SxU65", "eOCVkg65rddyjW9zqCQ8", "56kTgjudB0gnMqI5WMAN", "xlKgHTg6e4EjAwBof5Ro", "35bOwrTQBdo9O8peZVkD", "Ywxiq6VWBwIE0uawl3Mx", "e863GtfqNN1vJwb926dD", "1wQ1oyvZ2FUgOYhcSMQp", "hSk0OJ8PQlaRf0QTzL1z", "aTdy2JZSdzHLPzLmIRBg", "Dl5qkVIhqHgPkHLkauAE", "sRZHOs3fKCJVyPJiubNj", "q18ZIRJtKU5CteTGWVto", "hCJdbdJUCgD3hJa0itr2", "LwEDagR49KrqWAU6lnaw", "Snx94X7mOypiu1vShMVq", "eMfAU7GGuoAMZ7UdebO0", "aDiUCbvuxQibmNkGUyUN", "nehKjByLnKMLX2nheibb", "6IBsdt76pZTaC8vvItF5", "DZOibBPFszpyFypspuwe", "TPFfWAZo1mrCLFsuOFAG", "CxFRv2IkwEMPcb38jauk", "MluhymbM2jdCgqeZsuHo", "8eBiFEozoihARcpPMPmM", "6NZnBBK15cpBG0uTDiS1", "R8AqixG4M0PTLyEW9YXC", "AKNOIFsVyIVNQdD6aR9v", "RYMmWaGd6nnH5AdOOVtM", "oMhCzsJaKSTlypWSPm5V", "YqkdyM1MrtgdFNqDG7nY", "XEHV3nxSY0v4qeho0h9p", "apTnDH0ROlztzEM02HSY", "HMc5yJryy0nWqEK1VISr", "2Pkzd40dLQBaknfi5Vg1", "VSYLgsKA8m189k8lo6O8", "UYiFJMxMrcOM2wggm0qs", "ls1uc7dOB2WfYFurZqEQ", "SckSYQ8IPzA8rB0RIepT", "eK7CZ138pHWFrGhNfqf2", "pqAezA3IoqjSAoejqipd", "xJtnaaADQqFDePpdZstO", "jborPTZD9Or4ikrGK2Tj", "qiuU5i7eY10Fcp71GgFP", "24RioJy6JPn95gdAOknu", "jnAJcHLqvYFxafeOyaSH", "0EO3u1EGjzARmKkNZ3DS", "bROB62X2cyHcCfe6eqML", "pUmbnXwMaAnAZBJdDpfp", "nwQzZ43DuPWhrJIeoFzM", "NmUwxoXAbCxO6NLdPOqH", "lMycdFHPSGmp0Gjx2G5b", "Q2zWOK7lix1RHx4tCJIe", "X2RXH8UHMXtmXsGvBNfr", "IgJYdLRoehQBkqg1y8IL", "fB5C2K6Bhl2yPJW0evoG", "cDPK35J1DaKqjQ1jk7uP", "qvNDErDrm07NBVfEazFm", "XYaGwb0eiu3WpPj2Gvt1", "tyM4R1I2yVmV1Mkxwkbe", "cd9Q0qSGjJFcFZehZuhV", "ORzPljNhRwK3XTTXJto3", "A1dOZG58AkdYBcywJJek", "FyonPFKg76hF6Ldfbglj", "QOIZzGWIX83k4pXT2q97", "urNyA0djfOS5lkdiy90V", "F1GJolkpZrwSiJQqI2Zv", "O0y9ibphkoAxnOEc8yRh", "qL7WdYNtauoysm6bOvG6", "jQ4XnG7vFWa3riZUEuLo", "n9kfuqEIkUMRtQygh3Zu", "Z7vPnSt1NDp8MYlGO0W6", "StYLHWzwYWq7elWREOTZ", "bGfvoOCBMiHpZp8rK8ns", "ecxGLUiZq96RPjMC8WNU", "DcJmQSbiYPaA1VRMx9un", "IyCfiXrq3CIEnczD2atY", "zTiyw9JuGDhWBuCrR1hS", "C0fxaeAaE16CUoAOwTIA", "e0hosrfHqLh0JMxr05RF", "6XRYJZxD3FMfD1T3q9Kg", "U2hnOeeNk3aqYzPpYK1Z", "ZNFnOiqEp9sJ9Z4VCgsu", "jQiFP55yP6VzRikpPY1E", "ftWoTaKdHAXybFC0LHwi", "LQhm8PZXyambRIQuqiV5", "s02REESZTMHmmxWvK5QI", "dCs4SIxJ0SMqROIfciE5", "4TprOLkjOAz1Lr4n7145", "RRwspEXQwjTyBJnXeXG1", "gE2z36kB5pGVEAN1MtPG", "atFlA2HmYVnEjqDluxuy", "k8TwJoyfhNwIE91OBIBj", "oyvVm6Ef28dmH6haufDa", "07qFGrbS8m9uj3NV9cAB", "knw1rbZkGnKEsAR9z3Z7", "pizYlN2tzA2jwyjnZIXn", "3r0wzR3zUc4KI4q4RqvQ", "1x7vuqiR7EDA3D43e709", "h4R08F2Z6xx5u50mtgE0", "sR9weBxGJvPyzqy66yfA", "vbFogDaXtmYmBhgpqd67", "YT6VI4bO1FWwqliUyH1p", "3XbFCH23s6AOaGusJTEK", "ikEWTx0PE0EFXoSk3Tlu", "ZvI7AAxTc9lKrzrIuph6", "puKLgm3hFobnjssr0qIc", "z3vr1m9tZpyNhIiN2l4G", "Ze3GWv8UjQ7jS2YRmfKJ", "SIg9aOUb7XreButfn19X", "PEEpEmGyPZIsryzQLU1Q", "1s5CkypVxy2KDGAP0OOO", "xgEpcDDvfEMg4PqmNdHI", "cIcnYmCX9Yt6E7vpI6ky", "K6cMVR8q4O8eglPCVajc", "8ajLfcAyjsu1xUMQvUHy", "qNaW6yjaWQCc1vxeY5cF", "yWGvzcLs5aqvyPQ4L9er", "XrTWkPBGUlVQImLFMf7P", "DyJBLjEgqqVLfysQN1gq", "mCG2waHGDPgQLzaegoKW", "enpKlhi7gOvTYBVSjljw", "ANNTKv70jPULCJdvzL0f", "iv8E5choNQjVl4y5z35i", "SX3eqfXn0YTgRZvWBcLW", "021l6xo50rnSOo4CTa0S", "6T6X014CbNgZPgIVd6Yc", "xL2L75YZfWzlz5Iz5K9g", "hoE4UWX7b5hYOksUpO3U", "u0Dr5Vo8owpVk1YEX3J8", "91fVlVzYr22j0Fa6iMEW", "G1000WCYZUeiTHECkBkb", "EmKEzsIfFVCTUAUVge1D", "6dwZt8ldHVFVFZiESysf", "R28wCaPqDO3J1xtu3eWL", "AloPIUckRSNsUWme69UH", "XVbXRUPU8vnGgaez4GhT", "i5MAb6ofGIvllWIC0if6", "dQNI01F3FwWxzq5YxtCB", "97wudD5dvihW84m951AK", "wgFvVKUQBgbKlVDOiIzb", "0g66lsDosN7m2KhVd9vo", "nU9YxKuectDaYJeJAs50", "DCmDXRi8bbwM53t3Nnhx", "fuVDCAUK0ZKBk6PFV7N4", "jHRmLIng5SeiN7vXFNrF", "xBPhFouitHnaYENrUAYX", "dAGyH9TVXKkUT79gv3Op", "IBNoNkgrtCPUMdSbmv6J", "DpngwuKqvifBs20Fle5e", "oS6A5YjrRqBcdwGZraNk", "G2w83uOmWTQKvUSy2BpR", "z01axH8mrVU7YQGZIcLo", "3j6wDYuDijcfidGduOPj", "troPG2wYeFLfyRb9yVMg", "DwLvZbYRxvApmxE0z9Zc", "OuHNJtUHMrxXlHSLqymo", "rvdcspcpy9RN3hiLaCcu", "1YSnps6fpqTgl4GbutPq", "2qB4XtN54zy5XOqMEw03", "nRiWWy6OpVCqJOspFFuJ", "EqNkED4T84UtWCP09VMy", "yYoIwg7AvzT8qqs22wVA", "z03VAQTJupIsL48GlDQe", "Drk1ic3iXZqWXrzhFS19", "FH0aL6o4KEhV6RWm2XSZ", "4I5b74HMUGUjXSHqY6tq", "KaLOzp81NaaRqf1xhIIB", "Wmu3EArkGkbYIuxIk5J5", "esUUVVSDlkMHUFIgP8Qf", "szB9u8RcCifqY9K4dkFM", "SbcuquaD2zsty22q8RQK", "758gDRioBxAcYmWNf5af", "2RYyTYpbxDu5H2jURRIb", "OQDuDhFqkoVmF2lgaYFY", "l9b0AKUbjkA59LzM3DAl", "1fYEhHuGn7mWHNXPf1yM", "k9RtUODVbNHa0nog4gwr", "oiN53uSguQ2cXTV0riVR", "3k13XqjZWdOIJmLKen0W", "C08jRbhHJDgKvhMRV300", "hPI09eJlPHGbIOJh00yH", "Bea5KwWpzWpgt6f0iwk7", "D0hTM0BMy7c8kCD46jr5", "Ffk7lN7TJrYWpFyCD9WC", "G8KyIX2OGuSTXCYIZejq", "THKJXIVkP1ug8EcOjflx", "XDP4NxKub3k3I2MnLpYk", "oQOud1HMe2K9FjDaeVUE", "WEHoEbcZO8ICYe5BfMYH", "OqQbXbB96fNcrcR5B1dZ", "9vmfXprDBNSZBt8iUJpZ", "wDBnnaqzbRYiMIOs7D5I", "aVplOxRrEGQARZvDAmCj", "DiSY1oQ61TPZyCILAjCM", "xaXN9SaJCm1OURuTDIaE", "jxnf950HmAehk94uZcBk", "OC8rb0IoIs01nlgvofAa", "poGavKUVxdFJoL8PLRCb", "HCa5yG0mvALjxbJqtlJo", "MW8ArEYAfklvuJ0qaydT", "6wA1XTsOCBDZiJhXXDiB", "vR6qj6gJ2Hk8Dt8iK07X", "9K4pdjN8x3JsSPgBTNSV", "cBcq4kWOidtrvvhWf2fc", "5wSXM9hpU9J6KtuOdRlJ", "2eAwapSFr5pu2HQMO79s", "GQzbJtxuIiDJNMFv9fA1", "jxtjCJ5bQCThdQGuIDpa", "u0tHM6AWmKVVFOERgH06", "TSl4szzABmj5maK9hUdR", "m8u1U6QALRFmtyrlyou9", "abEMBWTq06FmE7lhDBpY", "a2LT1ADxy56WgIspmMem", "StWf1FKCQ7lzA4Q9Cb68", "gAeKQW8CqmwHfSuehEr5", "La2TcTco4iwjqY1G29St", "vO8Zo2BVE2ZZab3C2dy7", "MsoCQpRTztMsGUP4UbYi", "b5FAgIKjwJoGBcQcPr5M", "jPDzrc1LBZ1leGvJXF0R", "YmhiO5IlxN8ekLdZves7", "Ctqo9l7ey55VrkDFqVzl", "q7PYQ07JczOoqEdxxicw", "ofRfQctE5sxvxKRLKYew", "V1jJFKGD0q7oWWSu8J6D", "9364NXPh31bW2IpGa3Rb", "uYNO4nIA6ONFRRJmygRz", "g0VgHKwrNLQFtmdvZt5g", "HStgtBQpprmVsHA9Z4yv", "QPAJBmFifKOvlGZcR0QE", "pCkfSsmzwluM83eHnrzQ", "9MJuctV1rtFe5xKVn6Vk", "pN6xOiCBZCajYtd8m69b", "zMG3IYY5c1nSPuNlaavA", "mVtIOUQ9bXkYryb7W8D7", "70ZUsuGRSBbCgUU2wsBV", "Pw4FsdMNjZUrY1LOvZnM", "kOYOq3PnvaGJUIYNuukd", "SESyDmK8L8U4U1QL2p6v", "QKEudkFXdx839bzMNJTg", "Pvksw9DyyHuMb6FCrUjS", "SqVZRUwmlPQBKB1FKEDG", "T5d2CsF1KwTkmyKBQGxB", "dOKvXLApXM30Rg1bWGap", "A1Zxzt8N74ZkQtgxFokm", "8nlYSm9y0inAjL7hEE4K", "Id2iXgdkVNWd8FBa1JX1", "1ICidHPqVUAl5CTar4KM", "PpxY4764Od3NuD5XVVLy", "xTk2eBdVGvrfimBnrGpF", "rscl6iHZBcX86H8kRjFh", "f4KLoU8gkvvboYNsEcRP", "EyXIEd0fNDM0FeL48Sis", "NdS99n1NPSkbPFudtuIE", "6cELEXPNz5DLhdUqQUCp", "wwRLAJw3BEHHoTd100My", "4ZHlDjbbDlRAgqTq9QrI", "c6aRZBQX9mTDLkyWSY6f", "HXpxLJlShckJgIiFT8lb", "uCmEvliNHo2YLqUe7D6o", "or7U9qibwTArfw5Yflvw", "ayTtmvYt8ehwTmRbc9CX", "aKODGRmwCfqmbJgNECGL", "qxHKkgvKn5rNPDZdcLXp", "0OZafDxuPEDEBSWt9RCw", "U1IrFrSrA0e8OCi3Ngvn", "s813ZXviw7cO8sDLhfBp", "fny3ze5NI08A77Cgc7MW", "CwsIp5cUknKOaGPYuUtB", "TzLY6VCgaYCmS43H7fmr", "S4D0KdWE7PPYOj4SEG8n", "mIZFKaURFEHfISec5ApB", "aCjwtmN82VvpmS241WWG", "jlu1DYcHgRSGb9BVvYdw", "1WjnwlqxFKCy54yGcaXI", "zxXa5g50EgwDAdz7Op2e", "9CaCGYQs6w95tegyKlxW", "SrhcVghrTiTcu4oBaD1h", "98m2mQz4CuYclGEEuu6O", "cZ0WbnfC0ht9pd9a46eE", "0DqmR2yLw4hWci3DTgPR", "NGYBuhlwoNAmY0Wz2VJx", "Z0TBgUN9BmaW38hvoSra", "q1MM1tM1OfyvdQ5KsSR3", "C0YF8FAugzUU0pqziAz4", "nxxRL0jESAFfAlsH11Bf", "ye7zTvw96vBrr8IA91OZ", "AcCKN3bM4lz2N6zo0wx4", "p6vgECrLBDvLn5gB8FVC", "yVDLZA7Z62du8ZYLlNgu", "bZGOfuXn73y6Y9P7JXhO", "ZIIiro3aChVnFj9udhfk", "kboGiEN2l2OILe0AS1je", "hEPwvZqYETGw35ClJXl2", "a9KtlL1EKkq1wGxrnlP1", "DexGj7z2el4CsM3ef5s0", "pizkwvbjgzirdf7Mk5MP", "qOZikbKQgCOTtNDnIpXx", "oFoPtwjd150pTYVB9qbp", "0zGrNUfdJAa5NPSEJBsI", "Eq7hOcqVQSKRPZIk3vOK", "3yNRNpfgyVyCM3righE4", "9WVX5mH8ffQjen81angY", "JckdgbJKHXOO2sv7eDEH", "se0WQ8W0uAXBmHoSr5k6", "d9Uf1QkddwuVbt0zzWzt", "gW2QmotbudhXkBAlbsME", "pFiO8iN5CKzsp1Ibq9Ai", "lrFT0NFcDZo0oUOuCj0O", "2xErwVQkcaSNPfrP04zE", "bmEQGbIRIIpKD29AXZs9", "7LXW0MwzOtDzfPNuygLH", "wAbACjIhIArQTMwSgqR4", "ie3N1RF05aH1jq9tZPbq", "aQG3mAVSzuUhYX2YwGYz", "qnzXb8R9Y0x6QB7ALbaI", "V4x2ZyaUE6T2tSaSZzZ5", "zWBNhIV1t5JP7FPeDz8R", "5aTw03MZ0wezSnK86p9x", "sQKxfjcsgkHlIlfJm2sl", "yVkOI3WMqdKj4cgjKIa0", "1rkJaPcLRT6PyomGpIdg", "wvPyV3fpKFoL5YcdxFwN", "i0mepWucpXIjQffwjKj3", "aXMd3yG1BBMrB8VydObS", "tt9KZoEG6xHeVbHYXWXh", "htYq02pdQQ3JHAbowp42", "nJhGuwmSQI97Bfy9flk3", "BlLQtwFpmHqXbXlVRXvs", "p2xzgt8LerPnckEWeTJO", "k9vJegp6Ciw1jt0Pl7iP", "y5DYnP2SsMqaVku8OhCa", "N8a6zYTkfCAbHL85iAVa", "UL8y326QhI05QY9N7d8k", "nGM4ZS7Hccp7wx5xy9Nd", "RMipuqC1TKmGY6I7YQO8", "0BDu7Is5PDgqZNfUDqTg", "8DuhJCoraB0ZKDTRUJUt", "VBi4YLWlByPKBJ1VTnK4", "wIbHU4iwMBnrMTtspOby", "M0IVHHyi3JmzZLE1Ovxk", "6jZQCQI1ot08rGe8WcqZ", "tbWRwjSKeO2i7Z8H0QJm", "JHvAVXGz94W1f3SakusM", "Gt4NSCfScwFtB81efHem", "JAnzBDXt8NFMGJkhTN95", "HMwQSv47AguUpfRytysz", "J7LaP5HsQOwfjs5Bo8Jy", "oBSbqrajpSi7X4hw7wpY", "IlD1bHBPPUMBdmnTeNDR", "ntYKxDH374ZQpkPQ1aoO", "28afsL7UgKwTBSn7e2Aj", "6h9tRXKR76p8ENl6isZO", "ATpMvbTXdbHiIObhvt81", "zw7BJsG0lpOvIEHBnijQ", "Hy6XMiFGbLHZHOkZG0Z1", "pvv57CHutyJAwPiI5xWh", "GnEY9y5OzeNmXIsfT7XM", "5qW1GCHL7o0OZEujBz58", "bSu8jknCrLWw92vNFDhM", "zfiYucF3bIBCl5LSq6cf", "P8cZ8VuLibgfHOE91RCa", "kNnTQ6vECXuadU7lz17g", "dnLsBX1AzDljYYCyc5Do", "c5MFZTyWV5A6qWy21zA0", "AvhiRte3ypqYuClRekw7", "n6DeaBec8oaGiIw99aB8", "O1eGBOin8cutg7XHG9rM", "wPcehWlr7wxTvZj5xRs3", "1lxisSz7coTWD4Atatkf", "of8jEqmAFdDHO8zEbwLB", "infvppoNgW1U99CMzyWF", "bhUxqTCPNVY5GD050nRg", "HSBRZLnXJHktyEqmf0B2", "Uh7ku5osqFX8hgXG1IlK", "ZVBXj0KO0TOUBVD3Z1uP", "ERVv7298KvQrOaN8afUY", "8t3HMEJvFDJTeoMjpTr7", "MFzlpMrP1Lw7CzNZBgUQ", "tnrXaBGPe5W1IVk8pbVo", "uRu7OHgXx8xowmJUxZta", "cPZstJyisUVmtPtGgZnb", "ijPcTi6PFxzrMWjDniwf", "ARP1qJFUq15WkU6BACaP", "9XEU3vhqbbTj0tloAyI0", "zNVhpbtzmROtzaN2W3r7", "eKrfDaRLYkKW5pDvQ4sC", "WF4VpRVLSMT7hIkssBCO", "tWuzL6sj8kuczy5nPb8s", "xZxcrfThof6iByhU2ZDB", "H7nF5t2TS8JPgE0VtRDh", "6HPFD4jGbuRt2C6536YV", "Cpts3tOuKZcOozb12IFd", "CgUCrYGueoQrcJhfA3YS", "aAoM7PO7fdlpID27kI1O", "4PDegtIowqGVy4r5RDD6", "pwu57uCrABECZPrFI94D", "zIgxNX0mlBra7lfDfp2p", "0E1Zesnuzp5y7ltUJuF2", "56aBrDMW2OJ0dIYFBJ78", "8D5FwyiDsxFw3n5s0RM0", "nf1OxXd6qlDywIBsGt67", "oJ3p78h5X16Kg5jccKgQ", "3tOzBXqQPuXDBY1GegMB", "iQTMVCw5XdVYUrYgOM6n", "EbzP90gng0yOQRjvcfy7", "ITfnKBRgVVUj4R9DRn05", "nwUBLB4xq229VguprJTL", "mx4qOB3ny1tjvLuGWwCM", "yCTTsLGiek3Of7E4HFpD", "Eix93pOXkYuikNCdhQLJ", "AMiqTusi8hwMOrUPeqxO", "Or78CHlth4BqQtesnWat", "BUEXLixyYuMwlR4vionO", "qyEHps7aMfUXAi5VQ2Rw", "uoqdFsYwgJKVHYm6Otfk", "Y9FgrKAFKbBCPzpdrOXW", "fr1vNlzlceVAnkpe3zrL", "a0YyzLZrh6LNvMII5H1h", "wUphCeKDdBXEC3A9Ojy6", "nJTidjyiyzPsRFadturV", "3OhFRrNnYLtLfK3G11z0", "yMsPbS0TKpyOBdbaUyO2", "IHNxaOBbPAbLVSi6siXD", "WTZh68Ia5gaNvvITJT5g", "ce176jBzQjAwAhdHntpq", "ZOBTJTwdvzJXeJck0nhQ", "UpKfWwuIph8N5KqNlk0g", "kHBOYn6ZZox3bIg8EYO1", "GWOJqCgaxeGhwQ5SB91k", "xxmZFQfRz3QDXpWMzDww", "rAdlagEmqDWlAGINhvoe", "wDrU2No1akwQuXBTCNF2", "bjlly27fvvJs68K6V884", "s2UkZdDl1Qla8VJ6XQlS", "K2IQAcXdidhYf9JClUyk", "thK1Cd7h4q8OqQmy1Jbj", "wHIZOZm91ktuPBtcp0Jr", "oPFeq1cpJCYFRoppLbxN", "JoFi07Ip5aguztWns7cB", "J9PivCVHlSc2HpkFw122", "biwaZQOPXyZo7yW3A2It", "SuvhhdweeygFeaoByAbW", "8AIG6pHEpZ7FR2x8ftmI", "qQVUyJexRFRaNjoTW5hJ", "eoZ3oWBRNwjDKFgHWKEy", "XdYuMKNrP4A1qh4eDD5Z", "7pmS2QjWkvUHY09sKWjh", "YsiMXk0jy4I5r2VtTENB", "7qRfoaW75Dob3XybFyKD", "0aHrcmi3z6F4wekkCErH", "RetV9p4OlOamyrdYbMcY", "QpdMTL4dZuv0YmThZX5K", "td6rUiO420cSpFmGYot7", "im6EWZv57zQ0cUq5CE9E", "CjezxQDVF6dvrjALI3RN", "2pMdJAgUMpgYYLXVji1w", "ocsdL0zb3Ox4DJhURNwn", "AdLgwqAfY9aKlSw4SvfT", "JaXUtCwKXt5hUQMQEW3k", "dd3O3zQTs3x9eSdXfXqC", "QvssKEIWiKHLvKhxH7Q9", "ALIootKTQ8dp1ThLfyqN", "I7gBPN8gSXndq5Pewh5M", "ph9rArAqp0D55sEUFN8i", "stJiwgLsOQDD7M2IDD60", "DH5J9KlPfs5VlMDi2WaQ", "xnc2AeILrOM3gPKph5CM", "xFpjb1RcXz2UlcVvHnE6", "Ca7qyRdfVq0S5p9fqYHO", "YHqJuLC99QDJzL7xkkaF", "aageOpHEMWaunRBfkLmt", "jyAiHHd10CFamvCAkTN6", "xxylM7O7S9yA77qOMSNM", "ecxQX7ZGZuKWpJFCOeHp", "nDzsKpGhHd3tEyKl6r1d", "lM9YdNi1zzomBncVbqAq", "RCkfA2RErQramz8NKrNJ", "oB3xxfRWVbKwn4cw41At", "R0TCxaZHRwaD6dB3GcZl", "BtfxwFtyG1si1LswvRBK", "MjWSMfTaF2LQtzLnEEmV", "GcBFv3ApSL7o5dEPGh0V", "hJuZIDMXS60iiBvcC5Re", "RYRUAftOLts2BkbTxwyP", "2y5j71LJ4mwTINxQ0rpL", "ihMtRxLOtJmuIrdPqyjt", "idMy0KPy9EIrvejKZ4gR", "NSLdIw36skzaNMYLevJl", "9ba2DJKnL1EjTXKjTNqL", "7ptS9PnlL5WUe7VsOpfk", "qrRIOl1p9p8Ed1fkQSWl", "V0EA7h2UWfELWdbsOafV", "Qni3oNnCnHwJI8TNpTrJ", "83ccgDS3o7YEuEFgb0sP", "Imgau9vjal3gofITriWf", "n2rfH4Lq4BDMytus2qaa", "ZdGNGWo7EIk1LZeadzQi", "9e47VxxWlX6K8NfNtUU6", "mD55mkdQh46qg8vB5rhq", "Mm8V9os0GK60XA6IuhgZ", "jmQPsJZyAEmXyv07hs6x", "AAxiK10CjemQQAqITNEc", "Z17Yu5dbvjW5sRnCRlN8", "N9YnHM4ihGIHFPn7SOiN", "6CTyeE85yVBLej7t6Bcn", "Pu2fIpmkET8KfbGHpOKn", "uV7WFEQJN26mu9PCwCx8", "d5QGegYT3sFxMMRZarsx", "ryhk57w0Hr6uwXAYBg0E", "XF9tZbS7QK2GGj0KowI5", "oOzit8F5oFJLSRC12e8S", "w8iBpiVednjP9h53nK8b", "ZPv1q50si6JcE1n4iGiL", "1PiB4nEr8KRfjKhYPhO7", "ohk0hV4PmkinAQyCBA4H", "UVxCpckCH6I3m04TV6qF", "rW3zuzB5AFLciIoVuWi9", "dyDNyHqRNehC8iB2hL5p", "aQSHgEmYlSiMQvjMAXmV", "9RiH9rHoCMcll42RGmy1", "FgLdZ2yhXiCg9uvGmC4y", "ZejIijhzWfyjJIMsIIZq", "0kU7eQNOcQL942Rlm7iG", "mez6wJwFcU3aEXisv5FY", "TafYa5HMCzcybZ2YtzlT", "Tm3hJlXDpklIKOovT5Fd", "2qaePcAGZtj2fnhwWD9L", "xscGHO9iSOMUCw6aWGq6", "9a6mNmjrzsBwjnA0BJgb", "i26swCSRRJVYtbLEL45K", "uEFb1PbBhGmNGqFD1icS", "z70sgJ42N7KGMXrLvRUc", "hHzx5E86uiWtpXjUqlUC", "toQDKFYFe3pJIoFL0LSv", "4ymrTUJIFnS6aqJu5q7i", "rw19iGUicubetOVKspc5", "a2CAsV2wL7eC3dJlumUU", "g36XRZqHMQNxTX5L26HM", "DtWHXq0PaSrEWxkvUaBr", "0WmT3rn5v2P9uwORkOoK", "pfWLaGE4oPtptfGwV10Q", "2PXwLvN3IBN7osQM8cOx", "2IkvvyqOyqn0FKwZEHcU", "QybEqzawbyrbEZVAWLYU", "9LUOeQvsfWM5SvJGsrCT", "n230ZWA5rgZ001MePGU4", "mq9EjQSbFc23e33CZBHQ", "ppOpojTExvGjlOvUoN34", "z65c96ojF374sUsfBJt8", "F7p0ViTI3UK0aNaiTOPg", "QUiGwav7umD9u27NkYfl", "3zmbMMHnjgR99AP5kJBc", "5OjzRrN9N0tQ0f0KzH8i", "wZp5hD8QWJ2bimZ7buEw", "u7LskLDiaJQWqEZYRgwv", "xyUdi3iHvxEo2ZelspTS", "8rxx3UTUAPP8Nsj4vSLp", "PXdP6F8y5ZPDRM8Uobxx", "0K3MCmO6EhvbFWzJl7Gq", "hf26zAYnkVkiol2yYQ4m", "8xONRNeDSu17Z1DWAmKu", "F2c1of0K526B0SWPnBaG", "5cLdbZ9lJRfWUIWGvWay", "WeAU7euspU8v4UYg1hRI", "75mbLIpGmNCJ1Kn6zhzo", "A5hEXFsWvIo2NbbgtOug", "l6xkRkpQQoCarumP7fv2", "vi2GJbwAxqogulRJUEju", "2uStoEGvrCwmsw2BYwJV", "m6CfrbyLpgDpafgOuxHj", "7DWzAW8gTP9FVJsLurgh", "VsU5XBRP6i7DudA49Iic", "hrqBBiW3XAj02D5YMUvS", "B2d5fn7n3nNjeDunuQpP", "YYQbjT74y2W738AgtFTx", "2ree2WSuuHKSnk1WB8a7", "95ECBOs4bKzd9dI99i43", "zOUk6VEHenPnsbx3yn5Z", "55BEiTMq9Qr6mLqqr45T", "rUEh4Bi2wmZ2rkEZBaNK", "0FQkYGaPJgq884oADUCA", "GmC7UOfgz00xFPiofGBw", "u2334rDGLOQa8afcyKGv", "JFtYebKHpUEkUHlY6wmP", "KCzQkf1hxHcGWVnA45Qu", "Zee1tNYzJKOcXM2Fz1wu", "HZ9n2uw7zMzXydYry6oH", "RAtwUuBTv6MCdVyfPskM", "CjtAKSzIWlaxtRtOJ3pF", "9BPmgLP3DAQNtJVEjSUG", "D2B7U3Vn6K0DUOxAjMEv", "WcIOvoadG4rS72XZ52K9", "KLKmjHxQc9L8jcUcQ4Fe", "766C7dlCd3KwOei5udUW", "kpcTR76p9LUGQYSXABhl", "F1hbeOfYz92kweDMlJBt", "dd93AaaKjF3yHlYt7BP6", "KRqE52apJkgwLpxVNVn7", "lr30aZtfkIl2haHkcpZv", "ZDqt3nOOJCV41X4b6vGp", "DzruX6e7wC1TNrMQejnv", "tGxun1Tswhh7gWzEdcLZ", "mM09BNYo4LjxZhrLgKDb", "zsgfOer1GBY0VZ9fufTy", "yAvYpktW2451wleKPUMd", "dsd8RllJOEFNPAtEsmiu", "oltkXW4u0OWdH7jgsVyH", "hDc6MVJEFz73lylGUpAS", "Ce3Rml5eG3tvFV0byHnD", "GuE1tzHLnQox2rOoaRTo", "TKkiokJm16yFzCHqAWBx", "uxuxnGlNfCC8VwqJe73d", "C1sBC91MeAHW69TtNDE2", "NQ9sKxBy3DZFESQOZPkD", "Xzkd8BWVOlWk9dcUamQb", "z0qBSEa1dKDBIvmQ6JuT", "2ODB1ndZZ2BW2ziSEIRr", "ae0sZnHe4B54XIDY3r5d", "tE7tEpLS7mHgRGYy1na5", "yf7TvKzzB5a2HhvVVEva", "1BGQRnMSaxVXcc0Ww0V6", "336Kk0oDEjoDu4bJpylQ", "vExVqv1ltUpwXvFGt3T8", "kHJdKvw9tiXmwUHlOHUH", "lJCHCRX6UyEEEXrYSmfJ", "UD5OfN73cbJNuVe5w9BQ", "6PcKuSqLEVeggk2M5ANh", "jg2c9fh5msTsF4A7W0Si", "U5O8nQUqYqXGWXsgCZjz", "PDpeH0llyCTSFrb2F3sm", "tN2Ouu27Rl4qwtSBtBws", "NPIcErcStUEmrE8k6ApX", "wtLqkn2cwySKMkuYaV0T", "zCDpQKZWUM1ODMFx7HZ4", "D1MXkE6Kj6lhHwWfG3Cl", "NB7aYKXdZ5hn61KoGQ6z", "VrgkmAP2BZlYlr8JBewl", "jcWndqctFiriYVSKerKp", "R4MCtST46NnpzJdbAFSN", "vJ5TnXlRM4El6avz1O17", "kpvj8YIGllbe2e6p9rEW", "tTHx1Dw2Zw8Jl31rbJ6K", "2hy3M4qVu5zlWFjVQdYx", "ZeHKhGAGXEYavWdFZTjR", "WgA2vtWJV4H4gYNNmXdJ", "lBrefUsCwZbQFmR9dxS8", "zhDfDY2z5dJooAQRdIcX", "rDx5xOCZLefKKqzXOzXT", "coFOygqZwQ6mb4rZQ36m", "fl4xc2V012Seqh2mLqMI", "GQ2sStPtuVdXGfVqhyrj", "yHLmwNYICsYSHaIjRhaJ", "ABoPrHFWF4DDLYzIwWa8", "M6YderL5WtMh5A4uSJOf", "OcthAqz6KXChdlIHabK6", "VglYppSH7ouTQnAbcAfu", "fqZJbsY9TrFwXzUMoubt", "jWM9HXirfMmKCLblB8ud", "z7ZU64ptwOmfu7nAeT1H", "plZ17BmGHetEmRiqTVhP", "uS3oZqwBJyQ7hz8o8t3P", "VwdFNK6qplEhDHUk7QtO", "MJV4JcqRTtryqSEBkI0a", "3CFFTjxYAruWAOaT0RtR", "KiP8AbIvtGTvSiAtS5Ra", "wL67hfYf4R6M9UVI5lBx", "zcqRIyIi3jI02N5k0dP4", "3UQAytQ1ebwdBm2UkIAo", "zTm2orkoS7sTbIeXC2Xo", "cTQnEQFyjQkitUihLQTm", "YLF7brdnuAaWb0JpOXo7", "xWoq1UVKvw4RHKYs99e3", "JCZvArkYOWeJ1S72wcKp", "WPGnhpdqwFsGRP9bGrAc", "OovNE2N8chy84Etl1Xaw", "mSCErJn6AxgWjatvcG2D", "w0J0CDkCiK8SkIeZbSfj", "NKE7u70UM2hI0zGBA0Ls", "IRK0hzaGRDzmXDtPJsuf", "uZvtYB2iANYQmrRTqzjF", "Ci1iut7DlzqdZlU5uWm4", "rKTdBu6ztpC3WElO5rbo", "qPPP8uT2OF5GXYthQ0gH", "ntKH54f8vGuldJ9lBcoa", "proMNf3ndi4RZMicQOiJ", "cc5EvCz7mlfbcRvx6xkk", "fm9C9rmXDUro6u216z6s", "ljRLAMJFJ1zwo86vxsS9", "MHvSBxSFuW5fEWzOrGbA", "HY53gByc2PjOeepoZF3T", "l79zd6MUMxdbWgfArbkt", "yTGd53PeIS83ZF1BJNdf", "IEGmutvkTfbR7p2CsRpA", "svEP8DaRaC4qOKdHCY1f", "Ba6IQ7TIYITQDfqLqOkQ", "YoEx6pCINDvZl0pB7GSd", "Yt4jWs2MEmmnayifoux9", "5tgqtW0ymSbJJf0pV3Bi", "nvTMtB1h3yr6pXug1uem", "KG5dt5QN6b5uWYGQhF5k", "Duo1QihPbKBvaEXRKvoQ", "XtI1RWP6lVqxNeylLdBw", "xMpVbKxtGlHndao24E9q", "hxn2cjovMzrIJgns1klH", "U127Zo7d0GRfECiovWjG", "TaYkELdD4MSYNUdwHkYF", "1zvDCdz57iLYGrISBvgD", "G8ldbMYs667530GFdFLi", "veG9UZcfSGsgObIzxop1", "uv5vvLBXbUFU6WeY3EDT", "U38scQqXEfX6Yc1UxA1W", "cG1hkdFlpRDJUL95jxax", "b739j2dhBeDntCUbpkNe", "BYvdt3gc0HXbMYl6aMnj", "zyXs9zTwhoZqMUSDV8nW", "NK5ksooRBZ8AXf0edRbI", "GA9acbo8hZc3uhnkUZ9f", "8IndvnIWEtpS1y3dXpjE", "OLHG12zTb88hOtLKedoq", "WdJXbK887qLTBaiAbhdA", "njsCcDUEqI5KwMpVevcj", "lxCvVu56ZhFNQ7X1I1D6", "HIQBcDfG8HzsCAnh4sme", "Xzzw4WxMVASkRqw31bI7", "qHz2RmhUdR68Q34UZzq2", "8GmZ4ga3HsB5887Xvp1W", "G5ef8j9fiyhqCSNF8yIO", "oTTucbSVORzcXdHdKPJ1", "NypXQBmZ75xvWOq6xGZL", "hYwCABqSY7Rv5HRWSD3X", "GySnMGtKWRfCzZO7jCaH", "J1BNGctgpuD6serEuiYP", "9Cb9jxGSAokTovq4XhlK", "byQRcHgV0Cs7OTG6OVYY", "HI25BqAiWt15pPXSfBvd", "NnkkEzqcSMBjdBpozxVV", "qWbfv65aHyDejwMxvAYN", "Xh6AqtwpoRLcvuGr0JPH", "Ibt1XExSOTptAt1ylynZ", "P6CL0QAyjXFz87zfLw5h", "NsZVmaTXYG4wLEFJePIO", "wVL3cKivEmbbeA6QiXvF", "m0B7CQQrniDjCYkmtRg5", "DHhrPlG7J9K57VCKva9g", "HMOTs8FjZvpmAUcXFsdY", "1xd7TnRMOa3fuR6mZLU7", "FHtPlVx0LaZLXASyytLK", "RMzLl35IOXPboHzZmua6", "S7PxFrwDiFX7bUSMXVcu", "32VpJSP3Mx9o2YkHNgT3", "t0ASTam06Os7QMujoHl9", "EsvEPfUmJxoCvycOZONd", "nDiBZctMueV6WQJv4ngN", "kUYdSA2zXNaIaIT8tKUl", "yzpTN8MRt2ndUJHvRHuy", "cTGCliIc2mLzjBQ5HmUB", "pHoHY3C0I7yuaD5JtNut", "AFqrQGwi3Rtqgf7FhKFx", "PBsxMvEDG87QMvGkCCQF", "bH3Ix8XcSkXpvNkGIzTZ", "5YxRUDAgOatzsuFn2kPT", "UuGOI1eay573e5T6Gdkc", "Dba5VpsVaFy4AFQSE20C", "88FkBgoPJY2V7cYaRP5z", "e22mFSCTVBfbHsJSZ7rq", "drLkTuKtHPsvRuggLq7q", "1mPIfiiCpa2SPMCrEUkV", "taOJT4xot5cup1BSjteY", "Rfyr18iDcQiT06kT9gF0", "lruYs51Zxd5OI3FHBxSl", "NAFMFxnMd3MMuEvlIuKF", "VQdoRr3boWMAeZUrXHDA", "KXXFmSy2KIHpgsb8jdjW", "95eld8dAPoKkMrx6Hv8b", "BNPsF0yzdhVkk9WNH9Xe", "xsMHhJNxCTWMqvC6wA3X", "rYIbfozuvUYqKv82CTxN", "xTjlPvpJ3squO8T1uQvp", "vSgFLmFVFCsAeZu3SjMV", "aCPyJr0DHt3AJhOeRdAe", "o0pSajT2QnY0zvxGmxU4", "oVE8CckbEsF0t4QTlrTA", "e1Abx7sj2Mlrpyx1afcm", "YpkPuAqdzJndLwFG35x6", "RjvEhqFFTp0zekOWtE8s", "WtUppj5tm2xBjsPQgce9", "Re93OVYFie8EXa3NH8G3", "8DEs3dGhFuoeYvfvRBA9", "pGLNqOk7UyAc9MSAzjrC", "dfoAZU50fF7TUSqKoYQI", "WYsfvJps2e3dHrnqLsoz", "6tQaLGs7oGNInEviXkYZ", "MbCdRySkqGhu87URNLZ9", "ZwRMAM2f4bEOAP0bNSKB", "g16o9aGWtneTh3pqOsVQ", "RipZ7p9UFTdtUjgdIu8B", "hkcOnQCBGichQPEVENxR", "qaKJK0ucu0lbkOyWo8f4", "oFjEexjqLeH9FcQZaJBV", "Jw42I0W69B8xPrA3prs8", "W7FlheIIxRlELpGeomiv", "wrqLiyMVqCbKKp31TLJO", "k4c5srjgbSZVJPozOBTC", "N4WftZhKsygc3Hft8PXh", "p6D6T15rAW1WbXBS4slu", "rRUsiAloXIUMMhQpgTfr", "0gNbCY1EPk9GAb8slrfI", "79cTo2GUWtJUag3kD4yc", "n5qxhwnQnSjsZJJNKZqo", "T9I1oLj1NhdAnT7SPvsA", "LZ2vtJGBs4zJEHI2a11v", "he6S5BuS6maSMaLDtZOj", "eL3qaJqAJr30T9SWLMwP", "6WpQ6AdzizgMKhAu102K", "r6IIDioW4kw8ElZKuCHc", "AxwUf6Ne6NwvREDduz9y", "j56xpdFjqUJ0PFS4JngN", "BcGaoTDiQNe7Qj2FMHyA", "jF88UbBlOr8XSO6EpJvD", "gZK7GMKbbHlIWsRzTckp", "RrLtDR83i3ENaZSptmQT", "39la1AZSkHGC8b3M09Ni", "Ab5l8VY0IyTL7Ct7LQZ5", "ipHoOLAOUV5f58OBeuBu", "scDxn748VcDDPV2ooAAG", "eDthMFsy94q1g3xT8zbe", "bnpzIpn40vKc9EJTRBPb", "DFasIXJPVt34gs3wiq0g", "mKGvWZMyilXw07oGd7f8", "yiCeZGaF6atqt9jNi5LO", "oqKoy65bCijARvny9NDE", "w64pFmCvpWJeMcQIgVts", "Ea1dUobdBmr5suu5g5yT", "ZH7trYCY13ODePo8DNlN", "9bSzVL29Q0cxGiq5E2dD", "62RiPDqdbZyiAOifjio7", "jP4x7v2JvgWzgvh59Xgi", "7eQF16vkphsW6uTBnVUj", "9zgpuOt1tZjyC8EDC7v1", "olVtgy4RSXAbWpPOBIQ2", "p711DDCQK8P6tvzXr2zH", "Z7t3wGR5Yp8Lx9N8KZYc", "fwiXrg4gi3yF9pI35j9b", "ZHwUOJcir9KU501ue4aM", "5YZELrIQZR16gwY4FAm4", "H4XM2WGhar1gNbsjQA7x", "Z73F3bJGk3J15qM8Mcnx", "RobnNTUmcbjBilPlKg04", "kJ4p9OvT0iOQVzDqTfc5", "GKEx5dgPIgS2zWp6ujas", "PyGsyTjP8JSNdgIgIy6Y", "dYac2Nhu4HmUD1M9U3Yb", "L0wyfEfvCjTnH1QHM5BR", "MvtZwFjPHFycEuYr8BkI", "uB69CUQWZbxtVoSR49oJ", "NmvbgTSmdA5XL9hVb51A", "fx3AlTZnbO6y8zXpRxZ4", "7cZSlExMKwUzrV7dzeOY", "0TU9S1wryVv58TVrhQCz", "MgwCA3n9iBfge9p5Alw6", "Fq9NJeCy4OyO3uaDyNKe", "XzK968CGr9K6xTTE7eC9", "2AX356G1RYdyXv6d3Irv", "PBzKeTYj5ls5tO9wSNvt", "wYqTSu5TCuMc4MwgnTQs", "CGx5e406SvyOSmpugsLs", "niSr4NXpqvh0Cc5qh5v9", "1rVRdKLJDg90McpOxKDl", "GslSToGAsBHr0mId4duH", "H4Fee22bNGKd635ZrJhj", "TyaTis5nTz2j3INfKNGf", "bYIibLHRfx86vhZeZeP1", "cRkfj5L2SZh46ykfHz6u", "wF0quYSRCrSoIAS0Fl0g", "IfiObS4tP8nKLoAFMchW", "R7JhIjfXUfBkJt9uJBnj", "HZ3dNBqhnXBCfStvBZSd", "CeOVVVQpeBYvkZY5kPkV", "uuhXMaSW9t7KVVp0yDpc", "PLY7u6DcTv7OpovCNOgU", "FnokHekFrasEtOMmSXOw", "SWIGIBQdX68mtwWAYFOO", "pEagcuS4RrysLG8bQYFx", "cNiVHEeqR2CEEmvqhNs8", "CryX549VaMRCj9gyLKon", "K01YluMSIEYU5V09Z7cA", "T3KAA08UIxFavE8e9S6P", "hdtk8rrhyUpPXAZgAi8T", "dN3WbABkcF9Hs100qrin", "JXCrhmVqSdJ50KZZSkI5", "0PKsOIrF8Z2R4EGkylaQ", "MrTMB3uenChlbzc0ITDO", "0Fp2R6mQpKoC9IWLLQx6", "acqCbSArtLFra3tz9eNy", "wCA6ShPl5MrgwfqX7yNy", "JaprdhqkJEhFOrJqWiba", "2QGy64UB2p8JNvA1c0jt", "CQ7aGQOk7zK9OY6Saabc", "Njtkf3jF2T9ErGn7eBql", "9AtXhzxHXYsuIlevnMAp", "pH1eXmmCycv5koaRnXhI", "5ZCLKpE7BNuyeucAgMKe", "wFjh4H6pon8sMIBf7QkI", "ndGPXrZDDtqA9XpBpvyd", "h4T1NfgS3Pjo2xDZolk2", "eaCl81uvutWbv0dIdHje", "eSSgPdFEM0E1YQkePfZJ", "W6tR4UihjPJOrj4GKISh", "Gggm4QRT3ylZ4cz66fln", "44BvnE98UaniETUJrvkv", "uTSw5P194mx6p6zcK7im", "hTUvwzCosxhkQ9fUXgdb", "SYiHffsxmYkT2ENwBZk4", "UPotXTN470faZLpCzh7l", "ErDG4aCF7vHcK4TpVqtd", "qXBNq0XpgfbuUoAYMKmR", "F11Y3UNZKHA9mJUcJ2Sx", "f3r9pzgBKQcXPe3T8R0R", "g8aSR44k4WgjXXrMXVXp", "v8KImOlspjJTrrtIwx10", "ShixCXKh2pUvxpDhDxY0", "erTWjMmdHlbhQHfbozIo", "oljkavRnqznUpEyWYj9n", "SiVt08So7kbtVKb3D1q1", "0bUnnSHL9Q9c7cT7kvtp", "dUg7nIA0Jz0HYU3MuKf2", "joeqO5x80qxbLcg6ur4D", "o4SMWVgRqMTZ85PXAKd8", "8ZhRBOX5DcG1ggLBC2c0", "M3ZU8wzGGbMOA3qLRLOe", "xcdcIznUzNUJQ1lWvlk9", "M6WU9KnZfBBdlpD3myWj", "Ly2jynDtWx3q3ZKAt5jW", "Et7zgK1QIX9bT9KRuXJP", "SMFVtYekdLGsEOrugsIx", "NRYpYrETMXqpr5IkdwSF", "Gh7U3wNjnfg85Dxb4C2O", "jsDbyUJZOkoeRt7UqSDd", "7sjA3hm5roTahf9d9RCX", "BzAcsH4ijHJo73zAijDZ", "Xh9CMHpTi0yrz8RrPVY6", "krvqss0abE96tHHFY4gE", "4e33nUtAzRHhGAX90WhZ", "irdb8uoezUq18t5tLw4K", "LJzZRXgR3O0lFdMLW8zV", "cnWigZc1TeJovIMMn2nq", "QlZdMtys1vNbisKMPuLt", "YcfRt1ng4YVSJ46fy2Wx", "wrZejtz9lI0HvfiohVSj", "3xBK0HxwITtELSq2JpB4", "69L1p3nUWDDZ9Mt9ep3u", "Iw8dNygempjsz2rm4eGa", "rR80n17PoAJ75RiQOM4A", "Cl09orvsV9QKYYJLYQjM", "Z0TeQC4oY6wiswpgniWG", "pwaNTrh1IQNrQpTqzVcV", "bYCTS17FkbTZW2xztcy9", "2LyQ8RF7wrbWOnxqo54Y", "eX6AX17Rd5YfPX3XyIdt", "AENW1KMpNQM2wQATRIs2", "NRfmyiIu1vl998f8Tzvq", "QFsKf3l4Jc6g3lRzShrT", "cdajlDpCCk3a0tudugiD", "ImsJWHGyy7PYkxHUA4gM", "ohxmbrQTV6hlqX4MoIIk", "QhI8eXambH9Nw4AXvYzP", "eeASBDpxV5ftlx0PSaA1", "pJOmNWHG4Gdgum93zw0S", "1fKmaKA0uK1kbOUyslCx", "0qbuckyZewzgaJQAdaBW", "sAETWiPPRaKRQvM0eIZI", "EWyoqNxRx6xoE9Hlrf8J", "FSkdL4dzMAIZgELUbIuX", "MpLbzaKoFS7Ssq5BsiBD", "qRmVf5zFMtmij5HgfbUt", "1aLrOR3G7CTydDRGJOVd", "IFLzKbf0A7rChC15d4Mj", "Gnfr168IUbtkrCh9nM7y", "Sy89B9FmCZVQKAIJEObj", "xUTmfBwSV3Qv2W5DgIxs", "pTI9bYTqw2XuVygA9aad", "ezYeVbrBrm1gFKopqHdn", "HAfk8JuGuTrWSNAxzz7q", "l8VzQJoHYR4nZhYhyQxs", "toMLCWJ9VQxFYSExj0EF", "PI3yxbdvzbmtN8EXfVg8", "tcNQ4ZNmXb1wr4sodWhd", "5TWQaiyDCcJ5EfVHEs3k", "T4gI7X6k1mL4DrUnYQ0k", "3KpHzJYBBZvdeavl70T6", "mpAzeelC5lu63iL01uCC", "R7n5fhokhGqR50Ohd9sg", "tmmwU7xVz7gRCRUs8Hcp", "VREYPdF2m7gfsSaMYVqV", "cUumvNe4cFr7g6f5js6T", "0m7sDhCjC2EmU9YQUBS6", "OJD4Nq74iBYgyfW9KjsU", "j4EEBkcfv4lHLwJjkRlT", "aJ7WwefENVi4awIjhuPa", "w8sI3BznakEB2MfwyLBJ", "orNMme6TYT1TZrjc1iOb", "QakQuQLsjWBXLZs7DyYj", "PaAyRtZSbx20VkQQAlIr", "FSNb1FgCDFtcp4YEx7fX", "4hXYPvyYfGPsimRhz8rA", "NjmAnJOiQ3DTii16czeH", "D39uobZnjRw4AgEvzcbQ", "eptKXsQ9r4O26Wws7Wdo", "vZs5G4yFgZdIMUbuM11B", "4OEAuA0zedlZBbcRfaeJ", "8IcUmDM7CMIGkWOcfMbJ", "0KrBvTaa2Et8UTcHgzOr", "Lg53BUdqoE7oWwxROX1Q", "ksYEM8T07rpQWvRfN4TB", "Ga0mVvBtRAJB3pPNxrL3", "iBRC6rpTvIcArcwMW8Fx", "GW6JLTeGK0H3BjDHY3iT", "JKdAvYWPelMuFSEYtqpE", "q4F1lSGJTwnlFOvAuQZY", "9tTPJfxCVkQMpdLa6asX", "WdIl1CtwcSSlJvAaY6l2", "qBMdnhCtH4OmhfXgrRaR", "r3C9yLjVPUXFettRY3Io", "7eamJ7S8W3ZO6kX23EVS", "j2hNtYoQb4EgimS2tv8O", "wgm2QH2TVYtEYYZQ5Lqg", "P2L8on8hgE5cupcI4fla", "DcmjBK9Gfzu3zF9n1FTh", "TWKOMwgObQym2jUB3dRg", "bKjaZsOa5pGZLaxfWb46", "10q2hKBiydPXv65UxR32", "GJbcrWFL8JR7IG7zaJiW", "u53pB9H8aK9pbkRSHgmN", "yDSGTaD2tvYnyacAhrGF", "AP4l8TCN8yk69CKbkXbd", "R9OPhyXMqoa0BejJ6tgE", "pOIzZcYJ79xYGJwwIRI8", "Fs8PVrgbjLnYj5XGf3ak", "CVHRoDN6efCsWIF18var", "GLPyOvE3ymn9F2a4Fx8s", "aJi6bx5jqda7y05KvHLr", "470J9aLPVSF6lxAMsE6i", "penocq6X8SNAZNRiwn5R", "DKVyFgI5sMohzbTbSa9Y", "2Uibr7JnsPD5hi1vMI0E", "cmwbONDoxKKzo0Yf7qR0", "De3uK5phLqtxcnZyBmk8", "646u2cXASy8faBYvENaZ", "BTXmH4iQqRYuTcmWFHgf", "GmLoxthAEFjOjEAyGqO4", "HuylXiHk0vPEhk2cbimo", "xUCegKax8y1QryBOgQ6e", "LVs0EtanbNbWplBT3lQC", "iQcZOlv2B1hUUXSiQ2W1", "N5WCrhgsQ446UedqPYrY", "XW023SiUVCTsIz37ejz3", "n49Gin46JvepRdrT5Xxa", "kOR2OU70D63y8DCryHvH", "AX6aAv3GRyoBMFBijIju", "MmtVz3KvKFDTkH3vB49c", "2xnMBw5uCopYYg3WjLR2", "YcTJuWC5YLfYGQuRMxMY", "j94Ip8mWRDY0q1JiVTl1", "oQZ2qSUANoi7xmNks9EI", "KnIAmZqG2bFo1pqpFIza", "6ff1Q2jI9yaUjqcVPTjR", "2zF2m4rzMpZTUFSuFCBN", "AjrtaRMzs4Pv3cxngmm3", "ZJU4Ywwm879Gpy7PPUMG", "WjBXM6K0q43QNXSuSOga", "UnpJlwg8O0OukXR4bl4S", "n6qBbI53ejc6WRPHN3Nm", "4meoH6qtpuJdy7maNrd1", "YF84gVJ2ZgmbQQNiWDZK", "5qx4xjeIYFJ6VP89tRBQ", "7x1WMOCqblAeZ5iUmKmK", "a3O5RWCKvOk3JjXf5jWg", "UgI1k1VWLHpvKDyliB3d", "XleqUBUZuyDMcWNMVstq", "7ikQtgBbrDFMytDR5fyx", "dAKFgfa9WTxd9h32ODeD", "OraMkllnOkl1u3EYgohC", "FeoOKpPg21rOsRlaAUOY", "E7X68mcoYJzmwn8EcXsd", "Wj1O9kxJFLqRQLWY78Ke", "QJQK4YYf4QGa9FxGyuaD", "DOcdj69pFRRfjrznNVSP", "vg02wvJupr52Dfdwmkj1", "BAes1bgN66mzlkzhfIbU", "7eUKJ5F5py4z9ip8JVVN", "aIML2M0gcbAkDd2WiHcW", "GeTNNIVem12KHMfHidxJ", "E61Ph3vPJVtXAMuXdP9N", "OBhdYKtExoX9sWYZYTxr", "xqO7BGcmdl90vqbR8Uf5", "HBC9hkhFBe48SQDbgpNK", "ZWIUKtvSMYVdjfkPPPcZ", "1hfU5t5mgT4FxMjGDcgZ", "BAAspvFFIsmKXRocKrM1", "IQGGkyUwYAVhKgaAZpNp", "f99Aavntn7s5W8JG4lAb", "wgIEKsOrgjgJsoURjFIW", "MAasGr7JbHuXxCjF584j", "pl2gZU7GjNl6XJynA56j", "N0GIB0WE6axvLxbsSg9B", "3uHYDEKLJQ5ePJxaHRoL", "1jFLgoB6TKIUCX3NlNh5", "lkh81cgH3Sc5BpQqeZw5", "uEZ4kcQVx7YjpGrqsY7w", "0izAXN09wuEo7mtrOHMK", "Ov3BBs11Q7xPpuZKHXSE", "Re2YQtPnAk7WfAho0hpR", "olobfLtxqL9F0BoO5BBD", "tIkYQPKR4AqqtcPYxJTn", "cc2coo1ryA2pTkOrAgGC", "o63hgSGdjjOMMPy8Bxx7", "8zxZkJQszf4ol5VSYj3H", "RQdnnatyVq4bn1AXIZNH", "ES3xXZN3GPLhpwSaULY0", "9abxbmSrJq9XGCSljqpy", "F8f248cZR8XZj8UIsuAB", "kHgyR9kBxZ9AhmCjsmGI", "unrbwJsoD2ywHcuijcrg", "B0qql0admovhckGY38KF", "8GBPt38cgzHpy7gj8EKs", "2EXeyoA0wTF5jOSaRaB7", "YSxWXbDdpXWpj3Uircim", "5vpnJHNksYqO0luWM59B", "afyKhQ0W3gI6b7tuPFcF", "nQdmBVGXaPg83fSk5SG6", "8ZDhe4Z1JCE5appmK5Hs", "Uy1VbTFguUn01yif2HfM", "RtP2jEo1J5ul1tFcMUHE", "w2Fx0xb2EGMg7lgoxUqE", "Xi0XbF9vhOAeQNZQKARW", "QlAWVqKSI8hoqfLRsSNZ", "pVBFsleAv3eKopoJd8ku", "HRg76zXyPuVENfUFQ6PJ", "93bvqPDSWxKnM0sSzNOO", "FrdcW5pu9EEGGnB4DMUh", "HoSdoI3lgR8vJjWpoLkv", "YwBmjKouhJby53csMfd0", "5ltMUP9GlrBJnK3VfrNM", "AxIGys8IWjIbVCvxb4CK", "wLdjggCLYafgXxuVo2oK", "k4tDGoAqsKAogmWMQgfw", "GKdlFXF3Y1LI5CVK0dAr", "wKdc67wXobT2t4o6a1A8", "2TO5grPeSZVOu70yEwT2", "Vv5OzrVZsdfs41xisNNL", "wqjoxilCeEE89HU78xey", "aKodLmLC7iX1ZEqUwZgZ", "nvhvA92J7eFfy4IIoeSv", "KxwrBkM6J2f5vK04T0LY", "eaEbcWrQ8JLREGIN0cTI", "d6NWONaqLvOzUcY67PVD", "goeu4vG3VjL8ogdC3D0M", "7PLbzsf4HAIwzuo1p42L", "mNRa34k4GlQN8kw5cbAr", "kQlhKai8clRM6qu8vfCB", "ObWUJSZv1hkl7WSQ49Ye", "ux1ynv6gYHpwsLOBlw4n", "doWjIz7M8d10a0yLv52U", "MpOCBnNuhPhIDEzUB6qH", "jpHHpFdjIdDeSZqbKBW1", "aBKmNJGYO4p7u6NhKyOc", "bZF195dTF7TpInbg4rCS", "w2Yo6vTOtq1SPGTWJ40Y", "BTMSEx6GnIhhIFTN8ulz", "kkP8yseIveo45AUH6aYt", "rDY9Q1UYvGVeyumxkQDf", "3zi6ACOGnu7e7flVeG3X", "UWBQQvL8MYmPWUTgeruP", "jz1ocnJG1KlTqxtEsFNC", "l7ZHb3vDsndcmeQOPkcO", "2OptJj5BwQMhXvx6ysKr", "gvRQXrnvZPHcl7T2qWCk", "xYPSTMZQFrHtkgJHX4A5", "USfDZ6GNcQ7XyW0PrXp4", "M4x6kELGJWLly0wX4Asg", "axCYTCyKhnM3qJ9aWUqp", "09aw7URBfJqFG2oiEk0t", "VNwLe3uAVizUsXQx2s9h", "9zwQ1i6DS66wR0H639GW", "sE0ilRflHmSQlNok5uvW", "z1SQzhW0rlXjzVPku4WB", "rwaaHMLLFGrEGHcDy7En", "sjUrEtZ9w3In0qLFDgaQ", "vRe9gEMdLYQDHv2Woadk", "dtVbkrrxVRLOrzXXBsAX", "QbiiUjCGJnzwgUWQJNLp", "ogBddjBpbJKzs0fMjrd2", "ccxJ4ThOo3BahMEL3P8c", "iScbQHvA7WAj852BWkZK", "livS49l8WtkCJKlkchsj", "D0QK6TVaB2vukoKmv6sR", "zbbHvNzX2rEDrfVv60WF", "0P9kDRV8XNXVy8ksTjNV", "achPFCJJDpYBCfwN6RVc", "m07l8rdca058amXpzo8A", "deLnHFAOgdyRd3CksnKQ", "lPYMC399sGJTseFAuPWY", "1UxcX9KPuepg4L0EM7LE", "NegEGvO8IufJMcutkEGe", "t3IvMG7iOSvj4bxKULRm", "D64ZgyQQCg35hJy3a5mw", "VhdZIbskuJW8Naf3Y6Sj", "mToSmlVKqHGKyutETlwN", "2TTP39RaDrJxK5P4ovPd", "Cdx9VqLyaIKajlyksPK5", "Gb3YfScTNz4Yd1f6q05Q", "GNyz6wkzL22Zc55FWigr", "hlPIm4Pc3S0HnzFtvzqF", "ztmZwsoQYVIDEfU0itbj", "JZ06WFxQCmdAdPjZFYyl", "1GxFtRDbImKbKLhqYcGl", "Orv1HcZUAXE9lBMecaGu", "KaVetATSmjB9Z6AqijIr", "GWyzhLeHtuBDSeqMmJoZ", "0ziZ3qNjYeYoAXmqqQ7j", "KHumvk6i1uF2rvZsjxcH", "bA4jfqZVGfCYw7KppRVp", "Jip9dO1LJdcsmgcPW9vm", "m5IgAbWy2znJicSJySeI", "5H8pvkDSs6CeBVLM6pK6", "m5NUfomdGOtJf27ZmK1c", "QBFbeYviLDo7IAaxyMbE", "kUVOUcxFwwrM56wkcrSx", "3F5LNfHLzsXhK23pd04X", "utu0yoiad8YgNd2iGH3D", "9YuRZyECwGjr8bp6NVg1", "dCfzpfh3wjG3H9To7hy3", "wgs4HfAdAocm1HlovQsr", "96vRFODK3COzsE37sBk0", "0Mm1cVpXwfM5mHUzdiKf", "ugemsgrkrclrwVqW1e1x", "JO23dX3HDLw71YrtEie4", "INtDsijtMlqf9rjmMk1Z", "5ve6UVxgBZiSwafpIOge", "7VJEM0zgi0FlutpMMn2V", "MjxJJa6bxkF4FWHZVGFD", "GSzAJoWfZX9wE4DXfH6c", "1LeFpvoKB2WQUTYoF3Rp", "aYjmdwJIBNsCgWPVQEob", "EI1glaUydulBSUv3OCLZ", "ZBkFg7i6JWhXmhEVFgUs", "aF11iu446OcfZMsFRaJl", "51IriUNxBrnj4mkkgnpm", "9RPilHwCpFxuEEmui9pt", "ycd0MLl08YkHz9yiOsuE", "5q8K4uCm12gxcHyzchxl", "Fi0CpwuEomSscYCgRMTQ", "O7O1OKy01vjEdiQTeIhR", "47JhdTL2pmTEtrFHBDGA", "6xOkfmDI4sj6x2lYV7bK", "t4Ylvl04wGE3CalrMw9O", "oqUjsGHNNqgEuCzny0ps", "E3tQbeGxaNLMEo564LSR", "98d4KdpGdf9pg2GIhWDF", "tXc7LfCPyeo8kRA42zJd", "cSTHSjX7DkN4FxAacMxZ", "yjhi9rmBo3nPTGgwxB18", "tMC9JMhuifTgM8MVx7fj", "AS8egmYdxZjrwvyDIf5y", "IWdfcz8Z6lHFBPtrARS5", "0Buu7s6NW9JoguRGuYqy", "J7DVU4KcVngUwaM1RQOx", "agjEa9SShIPyNcRqfmS8", "X8aThvV8Lr3tXk58tYYY", "oxXAYy0DkQLFXujEpEK8", "5L0b55hzbFXQD2Yl1Yyj", "wHzT9ifyux7xI7WOADNk", "Ts8evgPuCLd8aackGFg8", "Dl6Vqct1oEjF5rt0XIsj", "bTr94RtIhaRuLVPA5HBt", "Vs8Yj1YEHOxqsm0uCrCt", "Rbll68vAP43twARd9yrP", "MmFCYD6k5JbUuKDzT89q", "AAj4K9fS5WrPI4cpIiXN", "z9psR3ru9ylK8SMRZ2tc", "Wi2pmee4KBPKIFCkI1cR", "zLj5m4WL4Pya7yPsc1uu", "DKETXOBnPoCM9wSvyyF2", "MBcR92Jj3EdEWqg1Eroe", "f00nuSgsPvul4XABXSuY", "eWlAMR9aIxCwxDjqdPi2", "JdlL8uXfMRB0xw8HNHse", "E4a9FJzrggrxHbJPVq2r", "FDpBAxSVEI9QLhXayVRd", "BHaSstrNhrCx418CwYg8", "rnYCV3kTYA6hRf9JYyeE", "pqBspH2lniteWPo1SZSz", "hXg8CoPkk3wYt5OiMQR8", "9KmdhZc7646nblvnXKWH", "LSpCWDsscJyjblMIIyPO", "0WBcF4NmMt3hKrtq2lge", "4fNfOhvefK2goDG3Hdpd", "VrIngBdiuHLwugbGOUu3", "owhd7xgMZUx2JFpzOQhI", "h0Eahnq5Hl66fmhnhL7G", "p5I8K75jVlzDlElSzbVF", "KcJyO0l3LqKBvaHGgNxB", "8wMr87K6hnL1Pexlegnx", "X76SfOgJjbVpYpgevyic", "m3b9fZtJFgHmlNDOjtiQ", "VBF10udvsMVcN5m3edMr", "Jbc2xpQeg85BJKAICoB5", "AhhXmRaO4vDLUpNReo6J", "w9UERfWeRhjbMO66ofUs", "YiC0VZS8LWRGdvU4Yyiz", "dPYyod4cGXSmDcmiACoV", "gFlJ9DOfB6dnWBlImns0", "KImVvZE5l0YQGKjNX52h", "CdSgpDwZyoaJ4Moxt00d", "zZ3DtkaOqa30EVg1gaaf", "M8wQTiOMhOxgx0tojTBZ", "1EZDiDEOln17vvXMethL", "GezBdsyMJ9vKLSW3dkQO", "VRVRL0lzsSI87HHk9F4Q", "OxikPEn0zBOUbrtwrfvj", "5BpCS7uZMyzlvfTIuEIr", "QeJzVBvNoo4tzu6Pz0wL", "xt4qYX9SkPH84b7Zm0uY", "oxRlrV8qU49RxEHVjOwR", "oDZqmePWeI4SFUB4zJsT", "NzsID8ovWiKItu8gWYCB", "oFb1jn5g4vAQu0i68Uzf", "CJx6D6mkcwtO9UPsFSZK", "NhkFhSLqvKT7cODnUxX4", "sOQ1tpu6FRQa88qnZ9bU", "S4Z4TnrviNyalOccEUjR", "t72zEsmnzOFRQoVtZLnI", "ilqR9Q4Lslnlqnk4fVpe", "t24JrZBOuyeahV2ot48m", "ptVdgEiLjVxcY1tPZ4nR", "0S2hv2Wm4eYtV2UBGCUz", "gRbERUb0XMPXmPFhRjUV", "L0Mq2r1I1VFfuqtJJUHo", "rhLd6YJWHlzajKQk9P0A", "sGol4h4LAM911Vc71tbH", "cbrMvG64d6CUK0FPgJkq", "dupeNPkOJLftuVFpjJrM", "O4qi257iNqYykNd5nLT4", "g7xbcBOLSGfoIWXKZc3w", "QZtAvWFiphkVof4OoRhH", "hM5xqaHQBIKbqDklhxRW", "eB0Qq2mdTTu8ox5eWL2f", "bNGRYyAEwbkYmixbljEC", "B6Lx1ObVheAJzRiXPtlJ", "UUsFAnovW06f4Pc5nCbV", "qjmnASIYL2poWf1eSpax", "pect3DwoPVHDF30NWItp", "IjbmMcRpRzkEdM7gX2Sw", "Xk9kn78HO15gigT5Jusi", "rcxUw28U4aQaKYK6fSL3", "SQiA5BDM354sh1Mc4S68", "0UgL21PiTkjt9R4CaHYb", "LcT0encgFimGDTZFUwvv", "edpn2rxd6VCR8gSkR2Qf", "lAtwdS97O312gqoihlJn", "FWDLAd5bfTEQd7KHXUMt", "XLwDBitqRDcejpzrS4Q7", "VfW9mqOKKiDp470Dnu4F", "7etoTrftv5yPkUYVJupb", "c0Re8RsvJu8QY0Ezrrsk", "xo9fHfAaXx9AyYo6yezH", "Y8i66u5vkvdfknK1QTby", "Qi6OHsUFXUW5aCCe5HZp", "BAUvvmwMFVIgDO4SGXhn", "1CtZM3BRIiETsgOoTI8i", "lQMxoRP2y7oxHhUdif30", "LHUDyqzR977uXUrJtFMp", "KAmbpEEVrHVCXxNVoNuv", "U1n0TfJMsdBClvnY7z3y", "FZ8mUWHIr9DLA1JcebwW", "C6gyzTU7QY5f5CRZigqZ", "p3sy2AaelU8xaotaHOhi", "wkNzwnYcTO9JQ0HSAp5v", "JDss2mSH87z4pL1k6ZKZ", "wUqKU5keupXC3N457UMF", "ZKHMdI6jqPGmr76JCov5", "eSHhpLkvn4AMOSizknga", "AxK14OKEDFJpfaWUtENg", "IY0fyheiSLHcIZbKyvW9", "8qynOSFIgdwy9vd7cGn2", "b4creD9a6fhEVfzu7EAl", "p4jyzL3ZbrZCtB1VOA5U", "pkgJPfDUsLDfNxcNGfur", "WU1Of0t2AxWxhBG5qRZg", "mnMAiwVybNn6rmUVmLXw", "I1r0C851ZchKN1U3xxzX", "KmbCW3hIOCChD4fQCiRj", "K83g8Xj3SjanT9x0CcGZ", "oTE1VrRfZqOrxQX5vH8O", "yhBRo8R1iiYW9mXcdxFA", "nb1k1ZnxouLmZUDNadMI", "JsoQeJ2FEFN0qPiswWnk", "O8WxchIAKfSbVE1AV1Nk", "Glk78Sx4wkoKqIFQzYaI", "B0tgEvojuATBtBG1eD5Y", "vttlB6B8ejQnjISxBEe5", "O8GHHUIthLSaCLLNPUU4", "DspwAFrLUWRscf8tAOnp", "kFOwYjIxCmzPcnKn2B6W", "fVNHBV9Jru6Z7UUdCmYO", "WYl6J5tLF0quVDAegHvV", "B25GUZtgJR4nxotErla6", "lOzEb7tFOokXqnlJMczd", "12QzqIBh3jmm7j0gqtvC", "gehURSnm4nP5no2d6EI7", "v4t3nthbldnRFSvgujQw", "Uq0Hc0sgCAn8De9yXqaG", "RLhgmbLeIlbmZZ3BZtrm", "3csEG1Dmrl2J4kxqJIVb", "44NbbOnAFcuIFmVTlgFd", "RIuT0rIJAlsCnDlObYWo", "9R6MBZpxF5YeNQ8LHOcP", "7UZuhLIGro40D8MPiAKx", "FqcaGivV4XtBzS5glLwd", "70bL8wiq60mJoOt24mX8", "HQJGrMucfqDmqp5wjnnp", "lZ6Zvxbxj75yVMCMg6xL", "wA5kxBgewRTiyXFrUpoB", "ur9PDJkrPhCJpI3lRiPN", "9r36OJxt6k40bCPnV9ev", "opEc5GNWykt5bx9yE5pK", "prKQ3jBXrqQddcFisaEo", "L5sw21sG6hYtZsKcaT9R", "HX2uAIc2sopDuh8ui09n", "ghgFayp8SzXjWZeerEhi", "1WtvDznt0wggcLtCJiIl", "fpTAM5oEJVuIznDAnz2l", "viPX3IhL0x6emXo9ccLu", "6DC30OClNEUGutmw9TH8", "RLmBtYIVAbNEoaInyUWJ", "g1ZasLW2nn8C7uN0SeTa", "Frn4P5pLXLeDMDlFZIFM", "3NYAFt8fXcDlR0no3c9Y", "vnjG0VTXniro3NzGH7vm", "h8V67IuAs3jooQ4nvXKg", "DAVGXUWmZPZFV2LcLElD", "FSz4s3roY9UlHxzpRTbz", "s8EOBXyUljh19f32gsoF", "zGyHEy6dRfcKoogxMcR7", "K66Tl9TS1HfzWdGkbML1", "1yJnmzi6Z9EtEINxSoNR", "42QaggIF0dG0ZZlKWUQ4", "bcxpvInL7Am9BBhrpz4o", "aLo8sZSN1qRdTMSOdDhi", "OTrZcYOQVSE5l0BcXdxZ", "SMCvgeHJsy1EPsl0O7Qt", "XcxHc8r9kogC8s5oVK8L", "G9Xf0IdON1GsdD9DJ0L3", "m1DssGhNaniquFUuV7Hq", "9Xikisy1qJ3bIGTAXAX5", "vDuqQOkvTzlcUSLCKJE8", "aHjqVD10LW6Hk07AMp4p", "pnQHFlUX2ggavNQQYPPu", "wV9eTEmn1qcoc06rlaPl", "G3L9QkZz9wr3P0fsCSfD", "GG2sG6k0g7luA53apaZw", "XQywOdna5QmMgmCvsuvY", "1gQ9jTkW1HTYgRT22Gb8", "gNSL9eG1ZBXYpviZMQ5N", "hWuLvNOydz4HKWcR8sQf", "3xCrquQCKTZz0RJvofrP", "evfwRHNY8nB9iN0YHQkZ", "sHXsjolVTbt7WY1wpOUv", "Bf5t35RIUBqMQNC79vbc", "WUh32izp6RlH6qA7tZON", "iEh8ZrEinpKHJ1ILjH8p", "gr4lhEqZnEwVScbzTphG", "ezWxyoGh4NUkEYTukKTV", "YN0zzayTPeh2bDza2EH6", "ZkonIIh1c8W8WV7V54yS", "geUHrSrtg7xFrk072g8c", "odkK8soBwkdaO8rGYj7C", "q3PfnPkn5rPsU9Aa1ylv", "jMV5SLJ04RCsSZVDzF02", "4PsWY36Y1pRiCvocG7dI", "Wn8wNb9Ko9MtWFP3GUZH", "J0yTtm67rhNMUTIr4SBt", "ZWm6j97zdgEveCMYwSdo", "91AcSQRXqbQQ7AUoJbnv", "HzqvCCR8d3um22MUTo1H", "PRhWb9Itk3oz2etCoIJR", "LDCNEWqfKrwjHcDslVjU", "YXRZ9Klwb2LwEXIS485M", "z16GdJ7NnopJMGsTZcPA", "el6sGMIIUNfSNlg02lLp", "aA9uRzNyZn8CYE4mbL53", "ikV5VC4VxNLVYSPxPnvz", "Y1B4FDqoWvqFfLI8VKeT", "ixwENM9m92lh3ulG6Z3c", "Vtp8E6HkQtB6o7IBRRxa", "RhFSZyjfYkG1d59pBOXa", "Fge3mxEDMAmor1GQyx4U", "fKTINa6Xxd7CKlE6gQJ3", "a5rP55o11qTgAwxVU32R", "g7eyrq2XGMYpPNEST0RS", "qs60m3UH6UilcKjRAmwP", "6VETsSuJTJjJCqIytkDy", "EwhqEOFNACmEf0gVQapr", "tWB3MR2EBFAN9rEMFRjO", "bVaGTGmtqZli3ulQJlcS", "zmp6b1SoTBC4enJ733zs", "aiYdcH3v3dL0NA6yCZld", "ixfLiyQk1Pcb7AFhRGaS", "svSF6XCG4xrmsW5bTWLU", "tv413HgUVHvNCLbGsnUw", "iLhasm9LGUnAPp9S4pvY", "4ovH9UV2FywxJdW9OfSe", "8EoV1vw6lpepdX4m2YmF", "WjBpKfxiIPNQb9ud5qjo", "fLbGsg0sCn6iUHXmwSVE", "qqdRxX40Lloy6OEx4CnG", "xrwR8RE2uhHkXs9SPETi", "xFg2dsxf4it2apRiHdlB", "K0tps2IFElxC0dCeT9JV", "rDXR0x8HarQvrJkhK0wY", "jtiiUuKx1bStoyInvQ4V", "FVO6m7n47hdpaJX2ErxF", "SO6FMP2Fn4i3Z77KCtOH", "az69Jd9VU7ixVpCpCC2x", "Gkyop681xUJVUPcl1mGV", "tyQMlc9xmBv3ttrjxxis", "RzOtNycOkstbpKxau4Wh", "FRi9IZqEWY6vYSnvRNJ9", "GAl3SgbNl720Wk7nHx1l", "W5e2YPvxnC61Mp4pWdAF", "lADFsL29I1sm7WmdwhYh", "teiGUm3yNBD8LQODjOK0", "QAmVgX8aEgH6IxKkhNg5", "WtDrIZ21yK1MUmr8JzhV", "dwbtuvebIKgmCsdSPdTL", "xThPDYYWVFz69b03Wcdn", "uHZ49BWXoyskRa9c6f8a", "u5g2ge5DEiy90VD7gicV", "gVD53Mh72nhusMwZ02kF", "igMgBXmsFOLvtYyuuf2u", "QhpJ3lq2lYFSEb8N8sFM", "HYH86G3zt3tKkibmSPoB", "x1d9ckWicm4rKK0PY1OP", "4FjmwIYOhKXeL9nvtKcT", "4eJMyJjUK7uMLb8Huhdb", "zAGLJ1EAJqcLTvgPCPuW", "VoqqPy7Hdktdu7wC88KS", "xwlQpRp1rjXMVLCtKHAx", "13YtAS5HbQhYKSyAulBj", "Th3y2FpKUyGVzoM8HSPq", "q6O8WKIO3S7W7AT9NGUr", "EiKEWhMl7jZvnv3JFKiH", "mnntwE0JVS9jATxf8HQD", "008nvA59UlOEYB5UO3mt", "WvcgMYLTpkgoinZbxeiP", "P6bwGeOehAXD57sQfBtT", "vXFbIoDDTvaq0BkGp9uX", "JPiNWalAmcdf9qHSeUd5", "NEwLPgbDpTi7qQULzDVj", "p6OywfOa72gTEaodEOo2", "pW9evbzsoUbdYzZUdw2i", "yg9CGwnTKaV74elzFkp1", "CQekOBCz7Ff3tpDAl1b3", "b6AfkudxeQwrraZDjmCr", "zpuse80P7bSihbLPVwK7", "NGwCoWPYGZPDOJ51P4QW", "drCJQYitS10nHxz6RMcf", "t1sGIvHizfEbURusxalN", "bmBth8x6TZlKadaqYpYW", "Tl7vC1o7bZUBLf40m16F", "YrZ6S8w1vTVOEaKOb8VA", "hzL1dNzPM6cuv9yOHvND", "MsZaQtyzzT9fQTg1odOB", "j03d821NvMaHC8pc1nbz", "Eiec9Ieyv27d18G9AFW3", "b5IlD7NCswB6epho7Lk1", "NreOzsX8729g7SPKXmWQ", "igUKVB8bWsashEGf4mn9", "ouptMEDsyhIeNmyrw5QS", "v0IdCXIGJ3P5vCyGO98K", "qQyCAu16zRXvPpYbMopd", "pCgkMc0il82aWykfslls", "CGlb4HAO3x0s9gaVHZD0", "fDaABIp13atFpcottwHw", "tFo2wNVBugBZtkj22Y46", "7vJuY6nR22OwIAwCVSNP", "8Wz0Gg0JD4NIyeCWkxvn", "xJjDSfPx5kNCHKCVyCm9", "F9PDobhYWcJUu2fMg5Hl", "ncx4u7YtIK0XSQiGzPmW", "16yv6dFmgXWU9TW2b4tt", "NtOpJ63JTpnStlMyMbi3", "6EVEg1GH498R0UGKYJb1", "6ORy7nwRNeUTrzfXztm3", "2sU1MkLu1ut7GK5N81oT", "eHuVEa0DTmGUeiVySosR", "ijZw3eH9e5aGKVjZ5jkW", "T1y5jR3AFtbvc8pdl6lN", "ALdUqK1t1mOUlMXUoac1", "RCv1Ike3rNQzh1TXLTPM", "Fno07LSvt3vKDoLVWyZL", "JxK0zmWKFvhUgVSnpshi", "va38OMcuKBEe8Ye5K8QX", "35zjYRVNKC6Dm7K8Tw0m", "5EQBl2H3BfbCkauI0PgI", "ZkVJrnRIhP4mcSyNVDQe", "szocYisY5WqeGJx55MOm", "mSZOvVjOg70Y7o8fV0Ba", "XzFlIArLXD8JfffYAOuo", "TuMahSDCQOkxNzheAYzf", "l5wOkbvsxpgQi0zNSAXt", "ZHouFVWN1U2kZy7IX2AU", "ppsXprsG2P7ZhvRuPwHQ", "QJ9xHGDoGMG5B6bywTEw", "tLVYFuSeqh2E0BAFPL1f", "hFjsLKpHn3DeNgCcZcGN", "JIcHSkUr5TVniEd2WSJJ", "UVyr98Tilh62xgKPOmFT", "GiEwuqyQGGjklfZso2bX", "hfXfLp2jcHAsxNorDlHT", "1zCkclcOmDvTqT69G9ss", "Q1iOOVDZGV2FSCz4ybTk", "nMBdnIn4RdupedB06PZK", "saZImYMi9nQu8cYtsLvH", "wq4bRGZVd9pThOlTu5C1", "rcwxCUq4nmJhaOGzcqUD", "xJgefP7ZSHYHsUE4w37h", "nOPNmfMOTobQ7F4kcAH5", "PpMHKZKGcPwNnLkYy4wS", "sWqxlvhO3yRSnli5K2Ku", "PGHCZzkX1fxrBoouhTGi", "PhABTsGlsagHovSNtAtu", "nokwaYrF07xPn8aEyrzp", "Pd6CXWZQfQISD2PnZG3Z", "L0w66XK3MKsjvwvSRTq6", "r7Y49xqgBtDVrAbwfwxz", "Epg9jaaA1QEsXnxfilJu", "eXPTfyNIuKF87vGrTqzU", "ECNmzIPf3iZfDw8svW8n", "oNuwHAlkyiDCuawrqLXt", "24WFze6u8EfxaZrrjcZh", "KmsDKo4A8b1AeXPdAVVG", "iABIk27Rce7xRzAjlCut", "mt3QRT3bwWpeg1wQ33qg", "ixb7ujqfviZfcc5136cy", "cPcJQXhUYX8EShLMQA2J", "qbzQB4RD91BlRn2rIkJr", "FR5i8P4WX6qNfnoprF2y", "FDkgymVHUp8kEBQLaSr7", "XfVCSH1IU1GjEyPBlvSD", "iYvwjLHKo7RLkuVBBVTg", "WhNjgluPgKcMqYIZrYrd", "dHyLBSWLxxzRfMAJ72il", "MI7CoOkgubJXsGs2iPLd", "KK4zeDGkFwVaFbk1zUht", "4zOuDGuvdFWyZavElCy1", "8RZL2JNzm2qo1EiETd74", "sb0QCwcx6YwCzVW0ntxZ", "voNv237VeDYVoYvyUVuY", "3oj0KFy78we1kzuk00Ef", "DmAzK3wnYqJZe2ZwHW1N", "SfNAeHsdH4ISqQS9TMuz", "CDWoE5lVZmt1SG94V0hl", "4xDtNd0ozul95HyJLjnu", "Teuts1wN1d86ZKzuvzjt", "rS2ukyE5f1z9dr2Vtyqu", "ax07Hx1Aui3jB4ev2qyg", "rvpSnpxgmnYKkXPzUQAN", "9B4IFiBGY9uN4jppWmTG", "Y2YIZxG1OQMVZRln9w1g", "5v37etx8dOPBQvSztizF", "6LkfmTSuPTaSOdZ0UU76", "tUFHPhHINEXTZF9MiZG7", "1qXNR5OuZV0QzFgMvvfI", "9AmiQt48QIER6lpYqBSO", "gQmdfQxaLcrUndDBUFJu", "WVMcF983KYPyyCZccWAw", "91Qucb56pM1LqLx5U48m", "cYkbiJBIpLEwLdoxEt23", "E1M4KI9mMFYylIXRbgkO", "0wJLZ7Gm1GnFHAHbSONo", "dvkNBGokwW7wRQHyXWiW", "mWj4e0d4Ozq0saL4q7ml", "eth3JxzrTiLDE5Hq5tuS", "skQiKlm9sZuUQbVkWVZz", "DuDPxSF1J9RBtruBceKS", "BCxcmSKIvrI8jTXhtmgD", "t7MmyEyYrG02TvcDMuVH", "llQTCv86goHZvdMtqIRh", "WPhxLIAfCgwwPKPcGViw", "JzTEap7Q5W7avnXE5gtF", "KoBj8YLM31GM0kYZXfzb", "95B3sgHxM9CgxMO3sjQw", "jeGjOpIwSGXaLgdDMs8h", "1KLwej0XRORA0hrPU8Jv", "MoVhU8so00T0IpwxWuUv", "Gv3Hate3zxyLlT0DbszZ", "sTZ8GW5kOXgfQhw1aa4Z", "V2sETsP2iObap9h5fmo1", "IUgi9ajk8lHdl8rC0GEj", "doHQxwWahIbzmIhtqPdz", "8tcs1S4zgJgJ5wk2sEcZ", "WBYGRE7IbjHjctbbJgY0", "xFH2Bz43Bebfn9tFL1Xw", "kogMfFvzvTxqgEspEurP", "WS5KZyXvx4rhqV3VlwSe", "QNV4cLuoElBiDE0mBXh8", "bXqP2rtnoJSChvGJE85S", "tGB6TBrehWmG3ag6SZtE", "qJOXCcoRltte82jbCaDt", "6x98YnEyK5ABPWgZ8V0t", "MuWUuF36nGxrC5zisDeB", "HoMeK2DQVEKs6qK03O5o", "c2fo7dU0q895uVjCVxdz", "9xrFlBDmXIaALDwSqPQf", "XZkS2SeWPFVWAKltTwf1", "FD9YR50FUPu0wdQx52RS", "IuySEhMhdzgsDpQctPrL", "mkLgNlbSm2u4usU8ZqoA", "oU11IPbBoSWYCqDXZozL", "ptPjjsqGicRW4SVMr4Xe", "V2AhsNFRAClz6Agn0U4j", "6VDBvhVml1OG3Zwtw9I4", "J31PCiBCCFtJk7SdmvPV", "wokxLeqHn9K6ALUM3dZE", "sSXaXxDHsannOXkj9Zzw", "iJ0qcSDg5msvCPVkKi1A", "JmxfHgNQFKMvbLlDlyrp", "kjkx6EfQugZBRWriCC9R", "WTM7m6KY4CLnv5i2JNQE", "1zNSUEBgQI6wlQ3YWM4Z", "YPMRU4TmPsyQrLrLY00w", "I4t3UuZzGdYm2sEVwfHJ", "XDjNWYg4YezqissBkR8z", "3gj5WvaQbpj60SRXz8ZX", "mYMTOCe7bk4eOnkujIKI", "63M6TobSu90efK72Wj95", "RBkpySjfk3vq4IvY4U0y", "dyaJGgJkNSqpdaeZ2OFk", "PAZUQS0Uw0QYx1pBh8w4", "amtBKYiKux4J6blU3lzy", "kNWhOLq3Tm81WzAqVsAP", "oDhsmSMoEJmyhGd3bT72", "EF1kCBbi3j7ruojfF4TR", "NDP2T062RD4fQ5QcGzKH", "iQ9bCqGRujsGwFINDOPf", "ZTKzWkckhu1OI8zVxDup", "ul5o0MBCkarK1BHVurFb", "mEz2LwXG9Q53B9r9V2LD", "aCVZMl4EcHpMWnPpju3r", "K6sVFkdikyuJ9NsV8xjj", "EW5iHUV1PYqjfiDsQqZB", "mTSvoKOxH5gUalArEgsb", "CgIpPVipJHy6iQzWlOR0", "R7S1rdt3HjeRQwHpQxcj", "Ebnu1nQk9sjaxBcomVp3", "CTTcOkPoh2XtdJnc6BLF", "34nzDPl0sb154UfQE5Et", "7kmi3XK7jdMkh9hvXTtN", "4uQ6P6XbBjTGRFyUlGbS", "uvAb3sUYLNvPIMTfS0Eb", "ihr9vpcg5D6x7GX881gT", "NbqdxKGNIUy0CpA7cmlg", "xrb2788G8ohVOW6LqMh6", "qd70RF73zqhuhJvnR31X", "si0GC6Z2SE7HsCHJRNKO", "D2GtJ9giDfG3LGHYLoal", "3h2ttICIfUeqUtjn2NWD", "2kGO0VwLKU5LA7C1POI2", "qwrLnY8qwc3wMIKLnEg5", "hlOrraqEw8Fn368qeEeY", "riVD0nYl0DphwDWloM0i", "VFVWJdMxq1WhhzsfmROm", "cDTYRzKDKIvnVPJo0djq", "cFXJEQwzpLlRYDxxAF8U", "V2H0RYoRCYIoln6yB2x0", "NgPurLr2YyU40k4RIrsS", "N8H8wN47Nz6lgTdXoUXN", "Q0PQiRr0IiRdqgkk1osO", "ow7SPkxCDVXdTw4BNt9e", "ZaHOG18Hqyecul4KW1Uh", "U1KxvM6IEGunoCB3DKI1", "IwdBgfVChxr9yB5rWB9k", "P2XCEhFPzXPHS0Q8gtIL", "q9UmIXdojlY6n4I1jVOi", "1nxToOZUHpn8wFuEnY3U", "HZY4br5KMT2LH0o3MLXd", "AIj6XcJI8KmPtLTVAYnU", "zqqEocH8yml64TBc5UsD", "ofchy5A8bwaYkQnW32ez", "pP5rsGRviK8WziCvnK1M", "Gbt00gU3g80VW3NMIoI0", "8QV59hyuzzFEZ8CZmhaS", "pawLbJit50sCONFX2EQ1", "BfFklSJX9rzyRvI1C0uG", "ymSM9hs9tIB5vQpeq7Bz", "y8wO2EPECHSA2uW9aOJT", "eUWXsKBjRKgNTajVm8hy", "OA8Q2dZczs4cKa9DuJuJ", "dYh69QZvXHstP0JRbq2b", "h6D1eKCZd4sHdXLmwvhT", "AZMXYdy7Ryg84t8jCIGp", "N640eOmaJR1RzLyVwucN", "tJUxAceKus8HzCFba19r", "RAGQTEtN9Tk0mCvvmaFh", "SNwPYC06B9wcHC0iPr5W", "LoW50R0nzESSZMp5WqCi", "x6IDIHvf81BRphXn9Va6", "h0YHNMKtCWZ7asKr7EWD", "Fif2PCpWfOdNO9clTwfd", "RCl143s9HPNW50WSAKxp", "iaA6hmqBjTo8fX9ib0rs", "NCNSCruMBrAtPKy55mEm", "D0usY1Y71OxMYKolCh5L", "YDDyYB1bvFN8FHylGXqI", "tocR6RCG8GceTpazybat", "ovz2CxnTUejNQLpWkznq", "DPVfC5cAfD1T80VJxHkQ", "tTlJmYpVWcLjzoOBs1JX", "CKyIKSZGhJgakRrXyg0U", "HLBE8aO0ZhVj0TzKtZYa", "sE8dez8ce64tRF7XnVXK", "B23BU3TLa2uSG23s09Se", "FWXfkcCX8isJktSCuvWU", "xQvEQw4Q6X2L1ZylCBHI", "t9Zb01mtwINugG66D8XJ", "fZcf7ZQHkhZbo6An7wg1", "C1tsIzzV8Uml1MQ6vpNd", "WuCJyN65Hk5UlyK3wHW2", "lGnlbCrW1D8V5Km4fs7x", "cCROBlP73u9mAuXl4NG5", "aMZfgLjMCrJm1i8CRYHS", "SOFaJkMN5aRfw0JaJ0uV", "pDIrtQ3LwJlMh0xyjHKo", "rlSljlL2jGWZRmQJCRc7", "kNTQMQO5firWRJFA2ZBm", "phLETjXdA9ktVEJrcfuI", "Olmp3205b9pOoAaHr8s2", "FbtknAZPpTfDDS3GS1J1", "89PwHxB9539Jc21PCbn1", "2SDFsETKFnJLugHBeSKh", "TT04T0TdZGfbhspZ6IsJ", "39exqt7UJRBktAoK8Gyh", "WdGBT5jXMboNkQLYJS2a", "rCKiK73SN19rcP33TmYp", "LMA3mVc3vcdlmvT62UYP", "TfF35I6W2eJLyTMizwls", "ZMdLI5SIZyi3ev6hBBDD", "nWWmzsUwpEpMaQhqV793", "6p4ik8PvJc678cr5SJ2H", "Xpd6DJuhQ3kUqmAYuZTE", "BXJH78LaRLpxAT1Lkv28", "xkbnWlMRLndULukQ250T", "QqOYHPt1Lu9Gek19UNYp", "9BJS51s74rYUhx0yMsxf", "k4vOnxVHI36PENrHNiMR", "ZtuEquCAk9qUDjryeMFx", "OJKahAs4sCVP5PdtIn40", "usV5bK4EeJB2dTdIdTMT", "dpsjDVcTGeTAWwG6GKKt", "dTtGwUWavq3ZguGrNqKe", "Vno1i45yOPp0qjEnDlL7", "bOgFIw6emOIFA6Fs9KoV", "ieVYLiLWRgd23JGJDMx0", "jFFtKSlRnZwVDQ3Y6N5X", "3iZ40nODALBrZPkrrVGe", "4C7GaBmgWrDZYlcWY0jg", "JvXqIHf9kvmn8t3g2pNY", "fY6BJihqgOWzH2oZHTh2", "PTpVKqBLfWrI5xTMd8CJ", "XhHoj5O0W32vWpQofa9J", "61b9w3WY9gpgN4T67p5e", "s5ZOvyAaWKraJTkDUEld", "uZIIdlMlaRPSXwoSsy0M", "IsxZJhnntWOn3g5hRQQ1", "rnTOhHoYEnuUfr4wWphP", "J5BNmE2DeSDWDesuufS8", "SNc5CgzhVg4nlFAXUCj8", "cwcpaVhU8AcYVFdftcMN", "IRA1gIZ8SIH4CrrmKWFS", "gr094bpyB9JTYTTDl2LD", "IaFUS4EmaTFFJDONpBJ0", "JaSr3v4mvQxByAfQErBp", "LO4cbQxOaHPtrpktindb", "BZm9jPYwGjlZ7n9gB75l", "MScBHN4x8gYJFISwh0sv", "hbToOcVYjYJ50wHFHJCP", "xiiAy87d7zYoZzbva4TH", "cnNchcrwt1Lph1zf96IE", "4o3dmcYMg2dGnysSYhOS", "ghHNiE0pLI4N45yqfWCL", "WoZHmRjL65lmm07SE7IX", "NKuRNsG2NQLrEu91JqMP", "w79g7G9JNPrkjl96cN8x", "oTo2Lv3emN1gUAKZOTrl", "siTZRaf1ylymEnoZiqBS", "DC6gKRDis4RjkuICTwDR", "hCBuxxRdnd4znAf8ZsqQ", "vI9fAPrdJ321DBvA9Mnu", "xrtl0YtXPjxKz4xAUpll", "qom3zfD60y1xouioRZLq", "HH8GL5OnsAZiwJjvzw2z", "t1whvdTKAm8P3GeNK2AA", "Chr81a20V2xM3r3wUUHd", "GP2Iegfwjn6tTv0UU0Sx", "2PJ3GMxjoEK4eMMG3zCk", "nGbGAZieZ8ZZVsalCYS0", "mm2O7Pc8Mos73RLD13pY", "BO8gEiQQEqO1bQNgn0oA", "meHp5d04epdoBjSPRqne", "hBdGc0wNykXlMnYRQZU2", "M7qYqJvF9jtosW4SVyqT", "gNC28lSWIwZe1PApg44o", "nwcdQf6vbwNIHXIQIiwY", "eVBdtLSXPVLARworZulA", "o6Q5dhVwPSS2vdfox6KK", "bfV2ZHr69aFxgf2KKWEk", "ygmtKPgFV0Z4d24BHwHQ", "WULD8MVSsjCoPwhhKLwn", "JUsvWw4osJCNoYYws3Ok", "mZY9VDrnXlbqFTjkPnYG", "7ibvE7r6ADqumM1Gaq37", "cevp5fZTQ7jXoIQ2PH9X", "VxPFKQVsHXxrBsgFVGiw", "LPR9hsC47JZaGyqYOJQd", "qNU0EBFhRxbkK3uzv430", "NcbbYRAwkaYbw2b8Bopc", "jRL3UF2NH3NcfwDBLN56", "wdfqgEyr0nSjElmgyo1F", "rNrUJ2ffOijIMM80a6pY", "rFH403kypkDe726Q3j5R", "Rmjn8rngvdEmsVqrWZpL", "J1zQ33o6msVEeE1n3nRw", "OgjEBX5g4v1Lwzjx2Y2p", "QX32k2nnpFkBvRQ4wVk1", "QkMKj4IjcKY0pZ2ZcqNP", "35bwW10SUjRtTmDAqTtQ", "lQQbzQAZEVxHYWD2XCTz", "vusMe6UUXNuJnIulj2Kx", "WFF4lQ7GcaGVS8p7CJbk", "hU3SmvDVvWRRjgWV4blh", "B1Ad80kKJK2ym3RYwc2s", "6TJq7nLBO4qX61BC1tUI", "DXHxYiWVIWLNxcD2QWBm", "a2Ke1Tq0MJIYoZVMFzpW", "VAtQn4SBaex8eHnfkbd5", "uvdiT63g6sAZ130m7Qxf", "2uogAZJsAwx3qYjJfmxl", "d8Ie9IQHhLujFiONFhGQ", "eBRUkAlPxg8YoQCyhaDO", "v758oTW3BkRnvsFd3y2y", "e8WRZgPGGac9fhHT9nVK", "Vw5PpK2qG3muBGLiuiwA", "IWJwCYPLKudppiEc0FQG", "GA8RQU8KA4SRbjNnHk6b", "fjPSPb4PqUd6elW2DcKO", "gmpFVC0ku6MZnjzCK3ZB", "VAF7wj97LTV0DIFgSERN", "Ilu6UuImvqxR0BWuue2E", "7VEJoRzEdOZw7U2ZMIMH", "6Hg7SBzLp1XuXlDJABVm", "X5ifXiCtyY83qnAGw9Zl", "96feptvy2QkZTQC08Pr4", "vy7ljF0fNZQWe58Rw3Pw", "R9WvXgvf5li1jpkS3i7Q", "IVuuY2LT5lPWstPQaJ3d", "4jelZNDa5I0LnuDJuZmx", "ICR83rWdAaFCJrxqE8QI", "QOdBGpUAOF5eRXmSMJ6U", "rLg8CdzPlNh9kII07k9T", "zE7Ojur5BvZ2EF8Oq5nZ", "RSiBjyBqjKIiXP5GHwKQ", "ptQ37ZRxeDV5fBGOAQDt", "iVZFseUAYoYNhzQmYsiA", "3DGiOU5YuIPbnzqfbInA", "6MXmLyYroG1rTFXqkcMc", "umDfj2JKK6UPQ2Bjyjak", "yabPp8FXjcAdMLJ5LcNe", "gs35sCootPYrx7FmDSKw", "2SYOlrR5Rpj5fkAVuzJn", "MpdJws37KN4NncjXR9cq", "yLtb346x1NiLCLc6BfDU", "1HporYJGhv6dE0EH2IC3", "fvMpEyvOd9seOhRGDkUt", "gbUuZhAZzKadDwSSuOqX", "XgAtLb7YLcPzBusib0HY", "KrBYneyh0mEVSMOlxWJH", "6hEHZ6z84EgN5qtsSrXS", "bjv16Jm3n3IrkX8Hb5Pe", "J61OwuEOjloKTjJZ05ao", "6tfrOm6zpWd9ccVWWisD", "RgVuNoRNr29ytnnHZtEO", "PqVzSzTxfLA6zezMSQkI", "QtGJg1aFupcId5F52j0h", "4Bo4nlQFBAVc4jtikUwd", "HYtub8xeryJw75yuqO70", "XdaZKTH5xDgCjZ4Jf0vX", "yER3KPx8l48Gfip0C537", "IhI0EMJtMEOIQpLiCGrw", "JxCyg0wq5xvLcDLqYcks", "q8BFwUx8lm24kF0OFvCK", "q7dTJzJrb1jQ8sf2La86", "NB87Q6Td1fvsmYJ3Vcu7", "ccVkSAmnksr73xCR4f43", "Kxt5WC81n16Pbb73jrpU", "jeZnckEePHhiEblkltkY", "soxTQ4V9vIbdw9QWtcAI", "tqy6PjoAbYjRNgtljOuc", "eUFadd5WEFm55lBUS0f1", "WMTr2McjiVMMxZuaBz4P", "DqUIZgl0eO18kS0kmaSU", "3oo0LjYWgcttROA02v0e", "H0mzSkjDLBhMxUNHBvlr", "Wflx1tv3muf3uR2KCjXV", "tDrofC5q8rhcUQZVHUW3", "MB4Gc4Zmo4HfH7RuJVkP", "KQ1ooYJ61p9NyCcaGBL2", "FahVh7P1c8QwYQiMyzQx", "mYLkkxI06d3LCiotpCsP", "KJJshzCfybdk9wUrrlrx", "MsGYZ5SOHImZZ5RG3bu1", "CVkJRCAIx0FKqVsPYImn", "bYMAblReLJeXoOpFaxVY", "xisoBiDk1xVaVsi5b9hw", "QLSEjHRKEwsAeiwqQ7YP", "53zatgdVpLPGgrSQ6ukJ", "qaRTINJgUp4Zs18khlFV", "4cjlUB9Y5rruRGNhdeN6", "TRfJTl3AVGfZtOILaRtd", "IjXjxuQbYmhzBKJe6Mnb", "bQ8SpRnNsey9LWqJOFsv", "1ZuCrBpxWaW70dZn4K8u", "w73IbsZz7Rs6ylGpw5lS", "dHXeu6PwOYpLdqbEiABp", "Z4vXpCKjF5CrLhTFosAA", "QzT3p4FWCRJlTFIGPbzc", "g9R1ruFdnPnBMHF9LSfY", "txHMCYcZ9a9pjbraV4DG", "T1SnGfuZ7Y5zVNLfvwE2", "WLrDugoOk1eB06wGjrqr", "PtquG9Z93lBX61lzfZNO", "Y1ZZ6WnpNbgkVUejcBtf", "w2B01wzfTM31OaYS6MHR", "xy9SQnC2y3gs3rt5lqkE", "DlDZLm1Q6Ir3EzUdmedj", "fJbi8SlrJT3UEH1Y12y7", "In8Vma8ZClGr5pYBGH3Z", "l61xL2VK2TPKFWp16xYH", "jo6mcevswwPf1QcMQ6fS", "X4mmaaofXKwE72yjfsZb", "oyEpMqAmupCStyCSY074", "J1GQ3D9i5gHreVhyKriE", "eueVqrxNp2P83fY5qflv", "L3lxYStqHb5tTjOKYKhO", "M4WOh3TYgER0HCvoepet", "OhmsP9AxTpLptqBare8X", "raV6kRuNEXGaC1SbAaZd", "PsQIictXEz55XYCIx4f9", "btkmuAN4lufAn6RVgI1u", "H60pcA5aEkhodRaWcvaL", "qETdKu6yC7qUBoHoyMMB", "43zfTXB3SkOIyrtGk0Ew", "74OJtf5pzP03SxjtUswv", "cKDaA7qu52oC5DTwsWlq", "vmrMhYFCRA53SGccNSUQ", "TJbYW2UMZDCSz2ofa2r1", "Cu3eAfFW5jwY0X4WaYr7", "m1Zj3MOeODfY7gCILPoR", "9ix7G2eoaTvKUS2WoQAA", "cnihUtxnIlCPSAXiC9Uk", "cP34r5aeTio5UXlwOihg", "Su4u4baEk4yKT1MI4vwY", "bjb5EKzc3hGVbKPftxtd", "1pvSpGitBfPmMzqaJpCK", "WSp5lCie9bG8PBaERJ5a", "wTNIQDsh022XSpaD0Js7", "s8GHHoTj7XH10eJOp95q", "B5LcvvptEhy7nEO51qm8", "N3ALiRjVZmLisgKlcAco", "pavdnIio6UuTX4mDUVj3"]');
# Connection con1:
start transaction;
select @var_1 := j from t1;
# Doing small partial update
# Connection default:
start transaction;
update t1 set j = json_set(j, '$[1]',"F2l5j6oJEQ7311gmHMaN");
commit;
# Doing small partial update
# Connection default:
start transaction;
update t1 set j = json_set(j, '$[44]',"qUoMXaX13E2IHlOypAF3");
commit;
# Doing small partial update
# Connection default:
start transaction;
update t1 set j = json_set(j, '$[87]',"bK5aLlMa6uxuOlGvLmuM");
commit;
# Doing small partial update
# Connection default:
start transaction;
update t1 set j = json_set(j, '$[130]',"yufDg1BVBQXkjcK4LefR");
commit;
# Connection con2:
start transaction;
select @var_2 := j from t1;
# Doing small partial update
# Connection default:
start transaction;
update t1 set j = json_set(j, '$[173]',"YaMvMaofKh2JbfWHeglp");
commit;
# Doing small partial update
# Connection default:
start transaction;
update t1 set j = json_set(j, '$[216]',"4GYnqssBVVb33vwPTl3o");
commit;
# Doing small partial update
# Connection default:
start transaction;
update t1 set j = json_set(j, '$[259]',"S353gbJKH27MIf98WzH1");
commit;
# Connection con3:
start transaction;
select @var_3 := j from t1;
# Doing small partial update
# Connection default:
start transaction;
update t1 set j = json_set(j, '$[302]',"Sq2WjztBkuxAx2DbdUvt");
commit;
# Doing small partial update
# Connection default:
start transaction;
update t1 set j = json_set(j, '$[345]',"W3DmgKsCI8BkyCEgB8rt");
commit;
# Doing small partial update
# Connection default:
start transaction;
update t1 set j = json_set(j, '$[388]',"0o3wqEXRjTIFUT08osL4");
commit;
# Connection con4:
start transaction;
select @var_4 := j from t1;
# Doing small partial update
# Connection default:
start transaction;
update t1 set j = json_set(j, '$[431]',"0Umxg1dp7Ui7Gj36ybVh");
commit;
# Doing small partial update
# Connection default:
start transaction;
update t1 set j = json_set(j, '$[474]',"2muUFuc3nv5lQsi4tLu0");
commit;
# Doing small partial update
# Connection default:
start transaction;
update t1 set j = json_set(j, '$[517]',"na53K77GibviNpCcioeT");
commit;
# Connection con5:
start transaction;
select @var_5 := j from t1;
# Doing small partial update
# Connection default:
start transaction;
update t1 set j = json_set(j, '$[560]',"kjE8bxCSG4Q4fW5xdBBJ");
commit;
# Doing small partial update
# Connection default:
start transaction;
update t1 set j = json_set(j, '$[603]',"m6z7vBjbxL4h3JpcE05U");
commit;
# Doing small partial update
# Connection default:
start transaction;
update t1 set j = json_set(j, '$[646]',"4TWhxceYlprXtoepzLQx");
commit;
# Connection con6:
start transaction;
select @var_6 := j from t1;
# Doing small partial update
# Connection default:
start transaction;
update t1 set j = json_set(j, '$[689]',"fVcimQI0QNUUp1CmboLK");
commit;
# Doing small partial update
# Connection default:
start transaction;
update t1 set j = json_set(j, '$[732]',"cArVzTIwmhtRCW7wwQwK");
commit;
# Doing small partial update
# Connection default:
start transaction;
update t1 set j = json_set(j, '$[775]',"lOoaNyLwlgGNo5qnY9kJ");
commit;
# Connection con7:
start transaction;
select @var_7 := j from t1;
# Doing small partial update
# Connection default:
start transaction;
update t1 set j = json_set(j, '$[818]',"qbi05qwzEqJxE6Wc2rWn");
commit;
# Doing small partial update
# Connection default:
start transaction;
update t1 set j = json_set(j, '$[861]',"Vn8Jsz5P8niwOQwSEqRQ");
commit;
# Doing small partial update
# Connection default:
start transaction;
update t1 set j = json_set(j, '$[904]',"gjOsnuSplzbGmjXcgc1m");
commit;
# Connection con8:
start transaction;
select @var_8 := j from t1;
# Doing small partial update
# Connection default:
start transaction;
update t1 set j = json_set(j, '$[947]',"Phim6cEISdj6K7z71Pxk");
commit;
# Doing small partial update
# Connection default:
start transaction;
update t1 set j = json_set(j, '$[990]',"OWy8FVju6kgTQPFUzRmS");
commit;
# Doing small partial update
# Connection default:
start transaction;
update t1 set j = json_set(j, '$[1033]',"3VWNcTTbtQLFuJO7n71t");
commit;
# Connection con9:
start transaction;
select @var_9 := j from t1;
# Doing small partial update
# Connection default:
start transaction;
update t1 set j = json_set(j, '$[1076]',"piKD5ah4zUU2zzOaSrBL");
commit;
# Doing small partial update
# Connection default:
start transaction;
update t1 set j = json_set(j, '$[1119]',"FXZ9oxGb2GSpwn31Li3K");
commit;
# Doing small partial update
# Connection default:
start transaction;
update t1 set j = json_set(j, '$[1162]',"CWLAThkvYtFlOouDj8mj");
commit;
# Connection con10:
start transaction;
select @var_10 := j from t1;
# Doing small partial update
# Connection default:
start transaction;
update t1 set j = json_set(j, '$[1205]',"OFYK0ZJLILdSpwcIdKB9");
commit;
# Doing small partial update
# Connection default:
start transaction;
update t1 set j = json_set(j, '$[1248]',"EQucConvvaeHnBankr62");
commit;
# Doing small partial update
# Connection default:
start transaction;
update t1 set j = json_set(j, '$[1291]',"ChVze5HHORRarJA48yx1");
commit;
# Connection con11:
start transaction;
select @var_11 := j from t1;
# Doing small partial update
# Connection default:
start transaction;
update t1 set j = json_set(j, '$[1334]',"WcIJns4VkAYur1uT49jS");
commit;
# Doing small partial update
# Connection default:
start transaction;
update t1 set j = json_set(j, '$[1377]',"YA2QTDSZ9Pafzrykj2GR");
commit;
# Doing small partial update
# Connection default:
start transaction;
update t1 set j = json_set(j, '$[1420]',"AmKznCTrJCIsKKIlViJe");
commit;
# Connection con12:
start transaction;
select @var_12 := j from t1;
# Doing small partial update
# Connection default:
start transaction;
update t1 set j = json_set(j, '$[1463]',"7rJ5iHpQH3pPp9PaLqQf");
commit;
# Doing small partial update
# Connection default:
start transaction;
update t1 set j = json_set(j, '$[1506]',"0iXK0n3WVMAaEUdujTIz");
commit;
# Doing small partial update
# Connection default:
start transaction;
update t1 set j = json_set(j, '$[1549]',"U8MIHjqbZGEZwlrxWvRz");
commit;
# Connection con13:
start transaction;
select @var_13 := j from t1;
# Doing small partial update
# Connection default:
start transaction;
update t1 set j = json_set(j, '$[1592]',"HZXT1BOjcgi4o2M4mDfL");
commit;
# Doing small partial update
# Connection default:
start transaction;
update t1 set j = json_set(j, '$[1635]',"RttOckJ6fi3vHYOJjk2J");
commit;
# Doing small partial update
# Connection default:
start transaction;
update t1 set j = json_set(j, '$[1678]',"RiODkiFWvsqNjjjJR0N5");
commit;
# Connection con14:
start transaction;
select @var_14 := j from t1;
# Doing small partial update
# Connection default:
start transaction;
update t1 set j = json_set(j, '$[1721]',"iQ0zzMIg7I0W0Mhj4xF0");
commit;
# Doing small partial update
# Connection default:
start transaction;
update t1 set j = json_set(j, '$[1764]',"p3LZk4qC4EFkeFjbb0Ig");
commit;
# Doing small partial update
# Connection default:
start transaction;
update t1 set j = json_set(j, '$[1807]',"IICHcu0grDeeHzB112B5");
commit;
# Connection con15:
start transaction;
select @var_15 := j from t1;
# Doing small partial update
# Connection default:
start transaction;
update t1 set j = json_set(j, '$[1850]',"GQpsdXUDXktn064cy2In");
commit;
# Doing small partial update
# Connection default:
start transaction;
update t1 set j = json_set(j, '$[1893]',"GxRXwbWybg1p6phkM9xr");
commit;
# Doing small partial update
# Connection default:
start transaction;
update t1 set j = json_set(j, '$[1936]',"toctshVqhmdxh3SdcxZD");
commit;
# Connection con16:
start transaction;
select @var_16 := j from t1;
# Doing small partial update
# Connection default:
start transaction;
update t1 set j = json_set(j, '$[1979]',"dZ2hOhRipMXg99a1o3sW");
commit;
# Doing small partial update
# Connection default:
start transaction;
update t1 set j = json_set(j, '$[2022]',"nTTUUu64rdFUCFBYxbEk");
commit;
# Doing small partial update
# Connection default:
start transaction;
update t1 set j = json_set(j, '$[2065]',"vlQ2vy4j2uDnLfIoZOsO");
commit;
# Connection con17:
start transaction;
select @var_17 := j from t1;
# Doing small partial update
# Connection default:
start transaction;
update t1 set j = json_set(j, '$[2108]',"18qCNziIYx2UiTWbRYJR");
commit;
# Doing small partial update
# Connection default:
start transaction;
update t1 set j = json_set(j, '$[2151]',"SUDo9VcirS4qau0wujES");
commit;
# Doing small partial update
# Connection default:
start transaction;
update t1 set j = json_set(j, '$[2194]',"gFuMiPw7xFXOjkCtDmZ4");
commit;
# Connection con18:
start transaction;
select @var_18 := j from t1;
# Doing small partial update
# Connection default:
start transaction;
update t1 set j = json_set(j, '$[2237]',"CcslWthOctrG8jco8Yu4");
commit;
# Doing small partial update
# Connection default:
start transaction;
update t1 set j = json_set(j, '$[2280]',"lRSV9cMMMtOYTGJ090Mj");
commit;
# Doing small partial update
# Connection default:
start transaction;
update t1 set j = json_set(j, '$[2323]',"sBz0vcp18j5u8VNH7jbT");
commit;
# Connection con19:
start transaction;
select @var_19 := j from t1;
# Doing small partial update
# Connection default:
start transaction;
update t1 set j = json_set(j, '$[2366]',"az04FJ2NIO4Aa4ATexUm");
commit;
# Doing small partial update
# Connection default:
start transaction;
update t1 set j = json_set(j, '$[2409]',"eYem3119iccHbaLpuLAA");
commit;
# Doing small partial update
# Connection default:
start transaction;
update t1 set j = json_set(j, '$[2452]',"jCKHESksOFd2nHnoHoxz");
commit;
# Connection con20:
start transaction;
select @var_20 := j from t1;
# Doing small partial update
# Connection default:
start transaction;
update t1 set j = json_set(j, '$[2495]',"PYGy8Zl0svAc6SrKvcDH");
commit;
# Doing small partial update
# Connection default:
start transaction;
update t1 set j = json_set(j, '$[2538]',"poJa34OItKIGsWE0401w");
commit;
# Doing small partial update
# Connection default:
start transaction;
update t1 set j = json_set(j, '$[2581]',"t9WzcMIXyTolH5JIAfb1");
commit;
# Connection con21:
start transaction;
select @var_21 := j from t1;
# Doing small partial update
# Connection default:
start transaction;
update t1 set j = json_set(j, '$[2624]',"zrHrLTqPRpKJyoGaAY56");
commit;
# Doing small partial update
# Connection default:
start transaction;
update t1 set j = json_set(j, '$[2667]',"1rrIvAZ3q84nzJdKmTiC");
commit;
# Doing small partial update
# Connection default:
start transaction;
update t1 set j = json_set(j, '$[2710]',"G2VColnzKq5Lgvcb39er");
commit;
# Connection con22:
start transaction;
select @var_22 := j from t1;
# Doing small partial update
# Connection default:
start transaction;
update t1 set j = json_set(j, '$[2753]',"HgfGzIYjjGtzGO95Aw2S");
commit;
# Doing small partial update
# Connection default:
start transaction;
update t1 set j = json_set(j, '$[2796]',"l7nP0Ny4WcvnGY1DoauX");
commit;
# Doing small partial update
# Connection default:
start transaction;
update t1 set j = json_set(j, '$[2839]',"ooU5Ce8KYAmHFYgGteIO");
commit;
# Doing small partial update
# Connection default:
start transaction;
update t1 set j = json_set(j, '$[2882]',"ED9UkBfYja6XMYaYAirh");
commit;
# Connection con23:
start transaction;
select @var_23 := j from t1;
# Doing small partial update
# Connection default:
start transaction;
update t1 set j = json_set(j, '$[2925]',"qby67fK1HcNUnWwXhc6Q");
commit;
# Doing small partial update
# Connection default:
start transaction;
update t1 set j = json_set(j, '$[2968]',"CAwWiW4rDtY3TW7a9RZP");
commit;
# Doing small partial update
# Connection default:
start transaction;
update t1 set j = json_set(j, '$[3011]',"3wtrRpO8RSXbcT7JxAAA");
commit;
# Connection con24:
start transaction;
select @var_24 := j from t1;
# Doing small partial update
# Connection default:
start transaction;
update t1 set j = json_set(j, '$[3054]',"1gEUCL3KlcjoXcdyP04r");
commit;
# Doing small partial update
# Connection default:
start transaction;
update t1 set j = json_set(j, '$[3097]',"SZQ30WMygU6h8KAIeDcN");
commit;
# Doing small partial update
# Connection default:
start transaction;
update t1 set j = json_set(j, '$[3140]',"nJ9KtnGJlJ8BsYEt4Ypi");
commit;
# Connection con25:
start transaction;
select @var_25 := j from t1;
# Doing small partial update
# Connection default:
start transaction;
update t1 set j = json_set(j, '$[3183]',"0vO8EYRsj3FWLMrE95Vs");
commit;
# Doing small partial update
# Connection default:
start transaction;
update t1 set j = json_set(j, '$[3226]',"Od4HAI8CrxtrqHy4nPuU");
commit;
# Doing small partial update
# Connection default:
start transaction;
update t1 set j = json_set(j, '$[3269]',"Q70lUpydvTWH5aYFqePf");
commit;
# Connection con26:
start transaction;
select @var_26 := j from t1;
# Doing small partial update
# Connection default:
start transaction;
update t1 set j = json_set(j, '$[3312]',"ZIXQXTUIsPmIWn20aycV");
commit;
# Doing small partial update
# Connection default:
start transaction;
update t1 set j = json_set(j, '$[3355]',"R6lUgJhUw7AVNfvv8QB0");
commit;
# Doing small partial update
# Connection default:
start transaction;
update t1 set j = json_set(j, '$[3398]',"pyGJjGKHEwle2W8gpq8j");
commit;
# Connection con27:
start transaction;
select @var_27 := j from t1;
# Doing small partial update
# Connection default:
start transaction;
update t1 set j = json_set(j, '$[3441]',"vIFIxAB3YL1NJIf0WzHl");
commit;
# Doing small partial update
# Connection default:
start transaction;
update t1 set j = json_set(j, '$[3484]',"t2PtYVXMJf3EyIVtRgvz");
commit;
# Doing small partial update
# Connection default:
start transaction;
update t1 set j = json_set(j, '$[3527]',"1wLIC0GjxWSqWph5KEPe");
commit;
# Connection con28:
start transaction;
select @var_28 := j from t1;
# Doing small partial update
# Connection default:
start transaction;
update t1 set j = json_set(j, '$[3570]',"rQsnjNhA2a91WUKjSYQP");
commit;
# Doing small partial update
# Connection default:
start transaction;
update t1 set j = json_set(j, '$[3613]',"4sDbhuez81d0RUnApSIp");
commit;
# Doing small partial update
# Connection default:
start transaction;
update t1 set j = json_set(j, '$[3656]',"0QrXs9ELheimUwL9qz8x");
commit;
# Connection con29:
start transaction;
select @var_29 := j from t1;
# Doing small partial update
# Connection default:
start transaction;
update t1 set j = json_set(j, '$[3699]',"0kvPCgYz7qp7Eec7lqQS");
commit;
# Doing small partial update
# Connection default:
start transaction;
update t1 set j = json_set(j, '$[3742]',"S8Cw4X3tUAqUsju2NQ1U");
commit;
# Doing small partial update
# Connection default:
start transaction;
update t1 set j = json_set(j, '$[3785]',"GoaVQCaB30eV8oQDKR6o");
commit;
# Connection con30:
start transaction;
select @var_30 := j from t1;
# Doing small partial update
# Connection default:
start transaction;
update t1 set j = json_set(j, '$[3828]',"buHRdBT0bTTpH3IgFsrG");
commit;
# Doing small partial update
# Connection default:
start transaction;
update t1 set j = json_set(j, '$[3871]',"sTk1I8CcZGO9Afalo2jN");
commit;
# Doing small partial update
# Connection default:
start transaction;
update t1 set j = json_set(j, '$[3914]',"VADmDVSRMIhElPD1XPb5");
commit;
# Connection con31:
start transaction;
select @var_31 := j from t1;
# Doing small partial update
# Connection default:
start transaction;
update t1 set j = json_set(j, '$[3957]',"f0EnfmWUoErJO24aWU1s");
commit;
# Doing small partial update
# Connection default:
start transaction;
update t1 set j = json_set(j, '$[4000]',"mg4W6IVdh7gL5u6kfdCT");
commit;
# Doing small partial update
# Connection default:
start transaction;
update t1 set j = json_set(j, '$[4043]',"r4lF4pnaHoS2TXYZn3AS");
commit;
# Connection con32:
start transaction;
select @var_32 := j from t1;
# Doing small partial update
# Connection default:
start transaction;
update t1 set j = json_set(j, '$[4086]',"8rnDjsyOV8qKAbXFOLpd");
commit;
# Doing small partial update
# Connection default:
start transaction;
update t1 set j = json_set(j, '$[4129]',"7GfalD9YFI0L9mZqcVF5");
commit;
# Doing small partial update
# Connection default:
start transaction;
update t1 set j = json_set(j, '$[4172]',"d5Poeu12FqfN4JxpU5Lh");
commit;
# Connection con33:
start transaction;
select @var_33 := j from t1;
# Doing small partial update
# Connection default:
start transaction;
update t1 set j = json_set(j, '$[4215]',"NK3U4cKg5XlicAUG4VGI");
commit;
# Doing small partial update
# Connection default:
start transaction;
update t1 set j = json_set(j, '$[4258]',"KudOBaEfdXNyrQQv0lb5");
commit;
# Doing small partial update
# Connection default:
start transaction;
update t1 set j = json_set(j, '$[4301]',"IMltUG7XjMn3EQQPyc4c");
commit;
# Connection con34:
start transaction;
select @var_34 := j from t1;
# Doing small partial update
# Connection default:
start transaction;
update t1 set j = json_set(j, '$[4344]',"9RY1pzwpiWu0qgrLuxqd");
commit;
# Doing small partial update
# Connection default:
start transaction;
update t1 set j = json_set(j, '$[4387]',"JbfX15uzhyZoO8pB5k1n");
commit;
# Doing small partial update
# Connection default:
start transaction;
update t1 set j = json_set(j, '$[4430]',"Gtl6ZdPRYD3roiMplEnQ");
commit;
# Connection con35:
start transaction;
select @var_35 := j from t1;
# Doing small partial update
# Connection default:
start transaction;
update t1 set j = json_set(j, '$[4473]',"AKEWQ4iVmhI2a468fWZD");
commit;
# Doing small partial update
# Connection default:
start transaction;
update t1 set j = json_set(j, '$[4516]',"hc2WKMJ3a6TkPiFpkxLW");
commit;
# Doing small partial update
# Connection default:
start transaction;
update t1 set j = json_set(j, '$[4559]',"edWEfcMI6uToWTIppbsN");
commit;
# Connection con36:
start transaction;
select @var_36 := j from t1;
# Doing small partial update
# Connection default:
start transaction;
update t1 set j = json_set(j, '$[4602]',"gM652LumIFGurm6UMTlT");
commit;
# Doing small partial update
# Connection default:
start transaction;
update t1 set j = json_set(j, '$[4645]',"NEFrgXgV8XrmrxrtGkdW");
commit;
# Doing small partial update
# Connection default:
start transaction;
update t1 set j = json_set(j, '$[4688]',"xrQmdWHzx0QIEfAuCoOJ");
commit;
# Connection con37:
start transaction;
select @var_37 := j from t1;
# Doing small partial update
# Connection default:
start transaction;
update t1 set j = json_set(j, '$[4731]',"JD5AAv1OfcsaTIN4me2i");
commit;
# Doing small partial update
# Connection default:
start transaction;
update t1 set j = json_set(j, '$[4774]',"eSyq86jIv5ZEIfNQYOoB");
commit;
# Doing small partial update
# Connection default:
start transaction;
update t1 set j = json_set(j, '$[4817]',"zglSw8VgkXOMzND5TuMM");
commit;
# Connection con38:
start transaction;
select @var_38 := j from t1;
# Doing small partial update
# Connection default:
start transaction;
update t1 set j = json_set(j, '$[4860]',"zvZHYwh6ITFF91g37Bjs");
commit;
# Doing small partial update
# Connection default:
start transaction;
update t1 set j = json_set(j, '$[4903]',"i6CfRNjsH5FE0mVXgAby");
commit;
# Doing small partial update
# Connection default:
start transaction;
update t1 set j = json_set(j, '$[4946]',"brCkqslx3VnjZyO0L5sb");
commit;
# Connection con39:
start transaction;
select @var_39 := j from t1;
# Doing small partial update
# Connection default:
start transaction;
update t1 set j = json_set(j, '$[4989]',"A5p9rJgXRFU36gluWXsZ");
commit;
# Doing small partial update
# Connection default:
start transaction;
update t1 set j = json_set(j, '$[5032]',"0dIZbeXviNWsTJzKcdq4");
commit;
# Doing small partial update
# Connection default:
start transaction;
update t1 set j = json_set(j, '$[5075]',"tI7xwssSNi1NLHuvtRob");
commit;
# Connection con40:
start transaction;
select @var_40 := j from t1;
# Doing small partial update
# Connection default:
start transaction;
update t1 set j = json_set(j, '$[5118]',"pKSGdPYE3OIueNraDj2b");
commit;
# Doing small partial update
# Connection default:
start transaction;
update t1 set j = json_set(j, '$[5161]',"R1wlIreAGSj5kBLLbuZc");
commit;
# Doing small partial update
# Connection default:
start transaction;
update t1 set j = json_set(j, '$[5204]',"GpWvCLVO5WzUXvFokry1");
commit;
# Connection con41:
start transaction;
select @var_41 := j from t1;
# Doing small partial update
# Connection default:
start transaction;
update t1 set j = json_set(j, '$[5247]',"Jh43rOPQIw2WmWPyrvKu");
commit;
# Doing small partial update
# Connection default:
start transaction;
update t1 set j = json_set(j, '$[5290]',"PJPwDckvUiwlO1nFPAff");
commit;
# Doing small partial update
# Connection default:
start transaction;
update t1 set j = json_set(j, '$[5333]',"6h9qBZn0S7vrRIncsYXM");
commit;
# Connection con42:
start transaction;
select @var_42 := j from t1;
# Doing small partial update
# Connection default:
start transaction;
update t1 set j = json_set(j, '$[5376]',"ES6cRrpq1UT59cwKBjLb");
commit;
# Doing small partial update
# Connection default:
start transaction;
update t1 set j = json_set(j, '$[5419]',"qESFWGrOmNjypnZGeO4f");
commit;
# Doing small partial update
# Connection default:
start transaction;
update t1 set j = json_set(j, '$[5462]',"tVi07eJHNcsEqJTKXJgJ");
commit;
# Connection con43:
start transaction;
select @var_43 := j from t1;
# Doing small partial update
# Connection default:
start transaction;
update t1 set j = json_set(j, '$[5505]',"eNFTAohoDlR4GA4LoNaA");
commit;
# Doing small partial update
# Connection default:
start transaction;
update t1 set j = json_set(j, '$[5548]',"zRMnkp7H6mYk9nBKas6n");
commit;
# Doing small partial update
# Connection default:
start transaction;
update t1 set j = json_set(j, '$[5591]',"bWpper9SDjaAAwyuk39q");
commit;
# Connection con44:
start transaction;
select @var_44 := j from t1;
# Doing small partial update
# Connection default:
start transaction;
update t1 set j = json_set(j, '$[5634]',"phZzTkH3bNoCtb0XS9yf");
commit;
# Doing small partial update
# Connection default:
start transaction;
update t1 set j = json_set(j, '$[5677]',"sWq1TmvBp5zfkYcDHtEs");
commit;
# Doing small partial update
# Connection default:
start transaction;
update t1 set j = json_set(j, '$[5720]',"G228d0d69Zj06Z1XLui9");
commit;
# Doing small partial update
# Connection default:
start transaction;
update t1 set j = json_set(j, '$[5763]',"zhmiEOvVHANVANbmODqV");
commit;
# Connection con45:
start transaction;
select @var_45 := j from t1;
# Doing small partial update
# Connection default:
start transaction;
update t1 set j = json_set(j, '$[5806]',"mZVq7UNQP3ZMlL4zhySy");
commit;
# Doing small partial update
# Connection default:
start transaction;
update t1 set j = json_set(j, '$[5849]',"6nSGA30WEq21OVpV0BtN");
commit;
# Doing small partial update
# Connection default:
start transaction;
update t1 set j = json_set(j, '$[5892]',"ERjxkmuSkKOq7q4Gs3k4");
commit;
# Connection con46:
start transaction;
select @var_46 := j from t1;
# Doing small partial update
# Connection default:
start transaction;
update t1 set j = json_set(j, '$[5935]',"tk3FGtiE2cbE1IAl42Dm");
commit;
# Doing small partial update
# Connection default:
start transaction;
update t1 set j = json_set(j, '$[5978]',"NaaUOdiEgTJXDMnRFVfH");
commit;
# Doing small partial update
# Connection default:
start transaction;
update t1 set j = json_set(j, '$[6021]',"5EU6VesXg3K3bsW0VEE9");
commit;
# Connection con47:
start transaction;
select @var_47 := j from t1;
# Doing small partial update
# Connection default:
start transaction;
update t1 set j = json_set(j, '$[6064]',"fVhtsSK5vyL1Ap7fTxB9");
commit;
# Doing small partial update
# Connection default:
start transaction;
update t1 set j = json_set(j, '$[6107]',"zTDaLhYpvlwbGdS83kEz");
commit;
# Doing small partial update
# Connection default:
start transaction;
update t1 set j = json_set(j, '$[6150]',"gZ0rM5Up1dy069YQq7Fk");
commit;
# Connection con48:
start transaction;
select @var_48 := j from t1;
# Doing small partial update
# Connection default:
start transaction;
update t1 set j = json_set(j, '$[6193]',"sBJ6nlFqTRnAynzKrR9s");
commit;
# Doing small partial update
# Connection default:
start transaction;
update t1 set j = json_set(j, '$[6236]',"35q9DOZ1TmlJw2QjlfXF");
commit;
# Doing small partial update
# Connection default:
start transaction;
update t1 set j = json_set(j, '$[6279]',"4LN26KKxjRnmWdwh0TjT");
commit;
# Connection con49:
start transaction;
select @var_49 := j from t1;
# Doing small partial update
# Connection default:
start transaction;
update t1 set j = json_set(j, '$[6322]',"GSnCVDtGqQTsjquoAEju");
commit;
# Doing small partial update
# Connection default:
start transaction;
update t1 set j = json_set(j, '$[6365]',"fXe98ap82WcIyNSRYJgM");
commit;
# Doing small partial update
# Connection default:
start transaction;
update t1 set j = json_set(j, '$[6408]',"h9ERy8D6KwyxRd4aBtiD");
commit;
# Connection con50:
start transaction;
select @var_50 := j from t1;
# Doing small partial update
# Connection default:
start transaction;
update t1 set j = json_set(j, '$[6451]',"PITMdtnBCTXublJZrWd9");
commit;
# Doing small partial update
# Connection default:
start transaction;
update t1 set j = json_set(j, '$[6494]',"Qc6sFBSO28cSP5o2xZE9");
commit;
# Doing small partial update
# Connection default:
start transaction;
update t1 set j = json_set(j, '$[6537]',"1j1aTK7KokUFMY7ZjXym");
commit;
# Connection con51:
start transaction;
select @var_51 := j from t1;
# Destroying all connections:
# Connection con1:
select @var_end_1 := j from t1;
select @var_1 = @var_end_1;
@var_1 = @var_end_1
1
commit;
# Connection con2:
select @var_end_2 := j from t1;
select @var_2 = @var_end_2;
@var_2 = @var_end_2
1
commit;
# Connection con3:
select @var_end_3 := j from t1;
select @var_3 = @var_end_3;
@var_3 = @var_end_3
1
commit;
# Connection con4:
select @var_end_4 := j from t1;
select @var_4 = @var_end_4;
@var_4 = @var_end_4
1
commit;
# Connection con5:
select @var_end_5 := j from t1;
select @var_5 = @var_end_5;
@var_5 = @var_end_5
1
commit;
# Connection con6:
select @var_end_6 := j from t1;
select @var_6 = @var_end_6;
@var_6 = @var_end_6
1
commit;
# Connection con7:
select @var_end_7 := j from t1;
select @var_7 = @var_end_7;
@var_7 = @var_end_7
1
commit;
# Connection con8:
select @var_end_8 := j from t1;
select @var_8 = @var_end_8;
@var_8 = @var_end_8
1
commit;
# Connection con9:
select @var_end_9 := j from t1;
select @var_9 = @var_end_9;
@var_9 = @var_end_9
1
commit;
# Connection con10:
select @var_end_10 := j from t1;
select @var_10 = @var_end_10;
@var_10 = @var_end_10
1
commit;
# Connection con11:
select @var_end_11 := j from t1;
select @var_11 = @var_end_11;
@var_11 = @var_end_11
1
commit;
# Connection con12:
select @var_end_12 := j from t1;
select @var_12 = @var_end_12;
@var_12 = @var_end_12
1
commit;
# Connection con13:
select @var_end_13 := j from t1;
select @var_13 = @var_end_13;
@var_13 = @var_end_13
1
commit;
# Connection con14:
select @var_end_14 := j from t1;
select @var_14 = @var_end_14;
@var_14 = @var_end_14
1
commit;
# Connection con15:
select @var_end_15 := j from t1;
select @var_15 = @var_end_15;
@var_15 = @var_end_15
1
commit;
# Connection con16:
select @var_end_16 := j from t1;
select @var_16 = @var_end_16;
@var_16 = @var_end_16
1
commit;
# Connection con17:
select @var_end_17 := j from t1;
select @var_17 = @var_end_17;
@var_17 = @var_end_17
1
commit;
# Connection con18:
select @var_end_18 := j from t1;
select @var_18 = @var_end_18;
@var_18 = @var_end_18
1
commit;
# Connection con19:
select @var_end_19 := j from t1;
select @var_19 = @var_end_19;
@var_19 = @var_end_19
1
commit;
# Connection con20:
select @var_end_20 := j from t1;
select @var_20 = @var_end_20;
@var_20 = @var_end_20
1
commit;
# Connection con21:
select @var_end_21 := j from t1;
select @var_21 = @var_end_21;
@var_21 = @var_end_21
1
commit;
# Connection con22:
select @var_end_22 := j from t1;
select @var_22 = @var_end_22;
@var_22 = @var_end_22
1
commit;
# Connection con23:
select @var_end_23 := j from t1;
select @var_23 = @var_end_23;
@var_23 = @var_end_23
1
commit;
# Connection con24:
select @var_end_24 := j from t1;
select @var_24 = @var_end_24;
@var_24 = @var_end_24
1
commit;
# Connection con25:
select @var_end_25 := j from t1;
select @var_25 = @var_end_25;
@var_25 = @var_end_25
1
commit;
# Connection con26:
select @var_end_26 := j from t1;
select @var_26 = @var_end_26;
@var_26 = @var_end_26
1
commit;
# Connection con27:
select @var_end_27 := j from t1;
select @var_27 = @var_end_27;
@var_27 = @var_end_27
1
commit;
# Connection con28:
select @var_end_28 := j from t1;
select @var_28 = @var_end_28;
@var_28 = @var_end_28
1
commit;
# Connection con29:
select @var_end_29 := j from t1;
select @var_29 = @var_end_29;
@var_29 = @var_end_29
1
commit;
# Connection con30:
select @var_end_30 := j from t1;
select @var_30 = @var_end_30;
@var_30 = @var_end_30
1
commit;
# Connection con31:
select @var_end_31 := j from t1;
select @var_31 = @var_end_31;
@var_31 = @var_end_31
1
commit;
# Connection con32:
select @var_end_32 := j from t1;
select @var_32 = @var_end_32;
@var_32 = @var_end_32
1
commit;
# Connection con33:
select @var_end_33 := j from t1;
select @var_33 = @var_end_33;
@var_33 = @var_end_33
1
commit;
# Connection con34:
select @var_end_34 := j from t1;
select @var_34 = @var_end_34;
@var_34 = @var_end_34
1
commit;
# Connection con35:
select @var_end_35 := j from t1;
select @var_35 = @var_end_35;
@var_35 = @var_end_35
1
commit;
# Connection con36:
select @var_end_36 := j from t1;
select @var_36 = @var_end_36;
@var_36 = @var_end_36
1
commit;
# Connection con37:
select @var_end_37 := j from t1;
select @var_37 = @var_end_37;
@var_37 = @var_end_37
1
commit;
# Connection con38:
select @var_end_38 := j from t1;
select @var_38 = @var_end_38;
@var_38 = @var_end_38
1
commit;
# Connection con39:
select @var_end_39 := j from t1;
select @var_39 = @var_end_39;
@var_39 = @var_end_39
1
commit;
# Connection con40:
select @var_end_40 := j from t1;
select @var_40 = @var_end_40;
@var_40 = @var_end_40
1
commit;
# Connection con41:
select @var_end_41 := j from t1;
select @var_41 = @var_end_41;
@var_41 = @var_end_41
1
commit;
# Connection con42:
select @var_end_42 := j from t1;
select @var_42 = @var_end_42;
@var_42 = @var_end_42
1
commit;
# Connection con43:
select @var_end_43 := j from t1;
select @var_43 = @var_end_43;
@var_43 = @var_end_43
1
commit;
# Connection con44:
select @var_end_44 := j from t1;
select @var_44 = @var_end_44;
@var_44 = @var_end_44
1
commit;
# Connection con45:
select @var_end_45 := j from t1;
select @var_45 = @var_end_45;
@var_45 = @var_end_45
1
commit;
# Connection con46:
select @var_end_46 := j from t1;
select @var_46 = @var_end_46;
@var_46 = @var_end_46
1
commit;
# Connection con47:
select @var_end_47 := j from t1;
select @var_47 = @var_end_47;
@var_47 = @var_end_47
1
commit;
# Connection con48:
select @var_end_48 := j from t1;
select @var_48 = @var_end_48;
@var_48 = @var_end_48
1
commit;
# Connection con49:
select @var_end_49 := j from t1;
select @var_49 = @var_end_49;
@var_49 = @var_end_49
1
commit;
# Connection con50:
select @var_end_50 := j from t1;
select @var_50 = @var_end_50;
@var_50 = @var_end_50
1
commit;
# Connection con51:
select @var_end_51 := j from t1;
select @var_51 = @var_end_51;
@var_51 = @var_end_51
1
commit;
# Connection default:
drop table t1;
