CREATE TABLE t1(pkey int not null auto_increment, j json, primary key (pkey)) engine=innodb row_format=dynamic;
SHOW CREATE TABLE t1;
Table	Create Table
t1	CREATE TABLE `t1` (
  `pkey` int(11) NOT NULL AUTO_INCREMENT,
  `j` json DEFAULT NULL,
  PRIMARY KEY (`pkey`)
) ENGINE=InnoDB DEFAULT CHARSET=utf8mb4 COLLATE=utf8mb4_0900_ai_ci ROW_FORMAT=DYNAMIC
INSERT INTO t1(j) values ('["fa37JncCHryDsbzayy4cBWDxS22JjzhMaiRrV41mtzxlYvKWrO", "72tK0LK0e1zLOZ2nOXpPIhMFSv8kP07U20o0J90xA0GWXIIwo7J4ogHFZQxwQ2RQ0DRJKRETPVzxlFrXL8b7mtKLHIGhIh5JuWcFwrgJKdE3t5bECALy3eKI", "wYxEF3V7Z8KTx0nFe1IX5tjH22F5gXOa5LnIMIQuOiNJj8YL8r", "qDiZSkZfoEDAmGTXXqqvkCd5WKE2fMtVXa2zKae6opGY4i6bYuUG67LaSXd5tUbO4bNPB0TxnkWrSaQyUuEa0X9Q5mVwG4JLgeipeBlQtFFJpgHJYTrWz0w2", "kQw1UFK8u2yWBjw3yCMlqc4M3tt2un4cDzdiEvq8vmf7TZAPjU", "AZ6Cu86nAyYDamCCSQ7GX33A8WhGwRk40pHuxNf5JEItyS3QrBgOChWKCDa6eIAd7RV4mBA5NQxJt0jk9N6L5cdFnDLSWV3bvYghhol4EgN5e4poSt7VVlkJ", "w5jSYm4TKi92Ws4iYQoCSbysV6Nyp5Fl8wCfiE81uF1O736dRs", "ouSmmxq8tfB7PK3Zzmn5lhLm5Qn92F2q9UatPR1G4DNRVR0SBlXwQqgTFRdHgd5n5ffS4gi9r6YKVZmgIIaj8ECLfncKQh5TLkvPPcYEg5ZBeJpubNdiZq3C", "beW2JcTeKP4j1ayffXqHqdCQ0n8Xb9jDnEF7oij85ls4MqjzLX", "F9APZ8CffopP1adEfRuPX0AP2UDmSWHhgS6DaIrE4eb5EEJudCHACPYCulwMIE1wg57ENyQSc1VpFnjqz019PZLHIIbYWaSAfaM3WnT7oyw2jdsibrryODEh", "TpFzQi73GT6kGXr5Ul7DOxwxplwDyAuRx8OLoVP2zTmDzeITNN", "ekLYh8KbLIjEihK408aNAXrwkoY1HwMtgfSLnmx72gLiLfnKlLhtsWpaKMZZGwTubvFNhAUhppQASDSBYA4OetwzDWYTQzNzubMZlqHadfj3sBEOJIkyAevN", "ATpYRAYLlutVj85MnoOfyc1HvlF3N8QYaD41OcK7VDcELgY8Sw", "lQXmiQVvTt4rPe5RdR4xYXB9lUpHdHCMgj7O7aHaRJRovWGYvKUUrfba7Qpif15LiChpkxNCGp0AJGgFYAhPnIxvgndJmgfTqKGbHenWRlgk2KxaVeyGuv9Y", "insTRVwIpCt7qedHPH0Pbx04awLSrS1YFr1fMvx97oGwQrBp89", "Di5Bmf757yY6UlvTQHOLRU9fQZXZNdhYLmj6RqBWmhbHRWkrm9BBbIqzqLYDzFjK1SQQIav2HWJi22Ym9jxkzojp7F06TjRUBptRPoUfKlLKnr7uY2eYqLNw", "bO247RWHHNieBAHTwdohUtc3vEbkYyg9KiBS8fjP3P1EYJiUwU", "9ONjRGw00UxgbHNmjVRQsUotjMAPo4txTEfsUbrT3o9e5UQnxpBnIzfzLpO9uF5LTiDvH4OKqWywyMhw9sjRsOQBCmL61ORS6cONfmhVGdPFx6B4xsWpFu0R", "hJVihu9nWX89HndWQ2lL7uQ4mutzmrQT9tAqnJcIoiR3W4Zw5K", "GCCeExW5wIwLm5Euu2BUKzCj0ioadrsr15VF21KwHEH1KWvCY6es3qb2XNa8CSzDVUSVTmSi1jkJFfTlk7blvBlSYLajmXwHzNlS7DB6utP8WqtGvV0rglHC", "5qtrNq6NBrnI2wPxpm3MbuaWPYN3KfEPT5EqtKB4CzNEtk9jWC", "377dcUCzWUcir5n5uhP5jZ26mwovdJ6gOBH0dR09tapkebnWGBZzkc4WWsQ9BWnah2aKUYSN7F6lqtF62o6nO8Hu0h1CBmkspKBJrbeyqkhfcwjekpP9vf1w", "M36YpqOc8Xvz8YvxIccsWLVH9sO4XNyuO4QCuoo3Ki0SGwNWYx", "P5JsKQkgSG3R8QVYcOKQRc8R5ONQvuOIxf8H5qvV6wwEMQkyo3PFfVeiu09nuV3rAB6F1zk6vfII51Gt2d6f9kO1iVocyrR80VL1U35QiOglPweRai6hTSi9", "vWmtLB1LfKK9OQX6mDsB8UagDgNe75n0ZXuujtDMEXVcv1ghCY", "qK1Q0E5NqAQbAz94tqw4CAafkVeQBrxz9yQAATV0dubltiqlYkpiuPMet042r111xR97sc5TWfFON39unwahMwJDxLFmNGlIguQYVV01AFNWIWO5Tyknv3yq", "ODcjRO27GQelvcl4r8Y7dwC4supnxndJ0E1Pa3VqT7aMjLOaRu", "h2qr6jlvUgg6xeIy4szZiQgInPb9x14c3sT8ZC14si8pKQmOIlvyCZFxwq4tp8VrzwxY8yayeioz6YLOJHLToaOlOTcEZ65Y2259yf7dMtaQRtnjA8Cxibi6", "2IKbON8PNDYMqdxAXVbwOOfXWsUERAITSd2ryAEMLkgCNdKs6v", "pUHU1nKTzjdIA6tDvpN7BjrptCQD5W9szOK0CdS9M5PX9Gk2657Fmy5f9TrE0y4zMOxYzPgMT3raKZbOeidPhg4oAv28t47GQ2mQQQmtUbRmA2AmllBQQEEY", "7EgzGlFglz6BOq2sRUeZWmMFXVdxjpTr19oHs1ye04nMvqEKKq", "uoaE28jf3RVXGUe4mV5k73muQhkc02Rur18t7pW9EzeUUGYGlbyqfkl3STfSW4KL6QEBDiKSiywAFTQy2Oph8YiY1MyXQGqUg4gsl0KRxGbAhz8kNxPTT80V", "Uw0uBrPpt3he315yGe8xdHhyC5SgDQ9hK9ZV0wLsz2U14azIE8", "FqNvoX0EBDeKszSPSQMnILonKsLKAXQNNlICGGQSR3kJ0ChSd3GvM2ghs1z0ZNNu6e6MuVoKYZbYjI0MLEGiGwN8wK8ThUNl8U70zuKXRw3AE3XYGlEWhbdb", "vj4aDSLLuQKrKeOlYPunSRLgAZBp8oR1XVZlvs4pIOgd12MZRG", "MsffYpChdIV4H1ZqkTioIzBzaC1wjRB4JojpcuXFC0JS1qIjJzWcyhZYrYSaxbeEQM42GZHQXYqXO9Gg6mG2RpaGL0rJcTX2pZ236JSerIBDPRrVC7Xbu5sE", "6jXgC2g0ci1i1TMqkV19vtd7y8irEa5IHcwSecQEKRxLtH9dn8", "kgzNnyWTpi2u0HUwj8Y7LqZIBQXI3IQlyQ9jMdB9LD3JUXDCdlJybqEkGk0H0O3zmAg8nrH64IPXnchPLyLupYc3IaJIyKFlSwrFn7JqPiNBI4ab0vVpR5rj", "f80bQDMs9C7vJQlg66rM8Px8JQwkVnU8tSjJf4BnGGiZeTFiZ5", "4hU1pnPjYsU00NShe5lpsz3aYh1mPYrRDJQ37pkdfFdfc3LH844z48ZcnZMD7DcLX3Mcq6FWLq9wtUDzZFydNWDB5aMClyVGzrqqw5MHvVDm0OmXek8zGLAJ", "tUUfRztQpkGlnc2h6ET4aFbEyjCC2KWwp0ZGxQemAtXwTYdZk6", "dKKCXIvjSw3yqqwN4snjewcAs3gVdObGgtRDBKueGwa6mVTpNFYzB871BlWm951ozSz8muk1oJ7aoZP9mv6x1CwBvSv3VwrSMqb9iJAWcF5OmSXYMcTNmPWh", "pQkLMbnjSMq8gyfIBkhyCCUYmyuYLOGBoyU9aFq0cg8GclYnVD", "jiOEEAC8hVVvgJtASRQIR0wYGYJmKp03VMHhURoBxJ6bayk3P8Jp8ENMmg84T68wSNcxnQ6khBJH93IYBaNHoidYNkdqqllH6NCtlGbSRvjaw078aSNO9zwW", "jZKXI3mPQyGBDsbenLDjLIpviDHrCDNtngQ3jBS87jHKZtzMCA", "3VSrOA2f2CsN5d3Thne7vkoC4N33jFDlkda8ocnooeBrHDIw0v4tfs3jG7lxMwg5aGDMszAedLTsYkpWftNIjRzzWkvqfbvFs7Zi4jLh2mXZWM59DRPvqPuM", "7nAmP4zF9YvDFGsI1PrVkufvJ2q9RjTZWcJtgJ8pp425IuLJHC", "p14SvOUlVwSxTzZmqF3z2t34wLwHfDRSDTu8pOrLIIGlFpW54Z44Q58MR2b4D2UQUOWJkMc3esmrfIwhq1lG6rbVtCX7D1VfN0y8KZ9wPvn5Cjm2iYGnPrGH", "2oODnrsBrqJ9NS5nLsqVacVI8m3YbKnb69ot0g4qVNzsn5d7xT", "cX66oCsriR9V3Fep9fWDT1ZSrKXVPTy2y28mFycxNlTO17E8kiLDjsgaBB3ac2ab2iLHevD0fgOglamUI5h1yLa7Vdh7dIggy0vbt8bYmxCWYy0q4hq01O7W", "zobd4GH3GCc9JDg58sbgrbVvHLvIh0mgoNHrdYsrjUz2ff5nVh", "UMGxFVG8lx8XdvtvmUReKA8JCnwGYRx0mBx1fDAQ8GwkBndxF4ZZDhqNSmdzCYzykxxP85nFMjzVUcRke0Jrg8F6ss54R5090yW63HLPzIvTsKDXKVM0dZ5T", "SAYrDWyDUSIYjdviuoCm8NHRsePTDUvdfRSqxQ2SsKyavrIpgS", "cmqtDgVd8j73KkUnZRDbr4vpeqfueLNE7D5Jtbw1I12ckWNJwZsndnbFbG9DZWRehXvb8raOrbyZ7Mq1vinWTOl4csI9Phl6EhfKWEiNpfuu1kwwQjSt5Byf", "3EmQvXV8E8QlM769m12njyhAf71iIzLJB7k5eFBrLbcgigpSfr", "DPnuXQ1Y8HWTbfYJiDWt4rTeX9KLc0ApNwksMjOTzuuaYTrGeNAgCdKkmc3MaDCv7ulUbAva2pAaI1ruMzaZasHKTKh3Vrxdli5Mq0vtp5R65G0PFbynTD8w", "Vny1ctcLZhhQhaHUgiajzb6CC30dG6YmrUlTLNou4TIj4ZDiIo", "PHNVTXYRAnXgZM8KpTfdOj7gQ9GdrWRGlolCJIeU598eWHwLkbx6I2niB1J2VjGGVzSpH4JMEPyigs3RRyVj0IPBHjBmSR2vRTkiX13lRzT7sVWJT21SIQdY", "7nKXELTdoDKLFN5gMWlCzGWRGXtYvU61HPYUkz7WDRpQmu47Pp", "JO3nnJIgsEBwDQLlu3j0ZuPPKAHOHgBY3DMqWeXOqgJ36enzgWzFQOeiYw4naDMdQgSxIzJ7dcAhFvgvRf8p2lXYfbMFpgrFKJCcGUjt6sYJnFCDsL2s6aRl", "9lywRnCj6MLKq3BvvkCgzPtpiuioS9XbsTYJHi0L2LgtMpmFZy", "uWLnM3f2p7BKh3oDK3vKMxd0oyqYDNX5ustEuWGjeP4JQqWirP0DKbE9Z4flPCqJ3hVxEjeq8i7WWdEN0EbKqnRPp78EHzWIe1FsjsgrYnM5OaQOpzhdm60Z", "D9oT6KlkJzb2rFsN3ESRotobqVCdZDClKyEQIx8auhcjxU7ygZ", "NVQB4HeHsES2zm1BAH8Gp3ySmtutrbRC4pM640LwCnx9ZyIjDPy3QuTAnL4cuTowGA3L9OHJCCRj8jRM6PNWJqh69jg4CS0Sd3nkQ31aDSJMAkgG73nQrSU0", "BA4Nb3nC4ZwUav4nOM7W4nkCqVcfx5e8DiTojF0oouIMqL7ChF", "il2SxrwYWtdA2orVdakdMWWfqMyyYfBEODeK2aqXURfUFUzs5iURC043K2zqfA42LiMMHCtjbYDq3Ah6q9V37Y4RY1HE9JGSzaoGkhzLEA9FLqJBzmC4KGVt", "Hk5O3Jr1tfHdLFwXP5miu3urp6wALP1a84z9NqAEVQpqflN2o7", "liAfayjU84t7f1BcBWSLkxjZmOK7P6DApLnPJUtPZkWCmfovBEEt9ySvKk1jrEteXe3r9uGgclqMQcHaqURxQutkcsUR4L5by6S5yjlbSZxqBDOzhqw7inpK", "dJmhdrJZwjeuQPVswTj5e72LxwQfkFyNXi38XKhT3LOUitKeK1", "hy9jH4fhiNvelQMmYt6DN9WlbEcwqxvXv4ED7tsnHlR0BlmhequzzQiZcLTQIOvBR9MW1DJIyiG8T2p5sk3p8lMj6p9MC5WdCs9D3QT26jAXjxaZhdPoPlXT", "ZeqlhMMsCT5GtZGzGOU0L4Z1iwn5gIYFwOyciKUtnX7e6NbLl5", "L49u5ppquV8Tk5pifW09PngWPlr06a3PeCHi06YubhNJkBzPhzW6kAa9tR7x1AMfLcLLiuFIZbbHmbgTaAXJK7SEYYBZiWC18YMqQa8zBiExJsOr2vAK2bYY", "9i7pCHrKpD8DnFAwxOrEGF5I8Gb8p7gypll13cJqoS2ZhCWcbL", "qpbv6h9hoyoUucEgbFGv34N5e2I8erRUg0PkiXRWVEyOqC4RPKMTNhYzjo5LfWpKXD4FkUjDihZWsdxHwIkJxHGf5L0jro1O13bjXKuD0Ujs5f71xqIu7YZA", "tYtjMu7Nwh4T1wfzQOrU3zTypmtuIQ4AyytKqyfkfhEfcte0FW", "UHTyFGi8A0XCAT83mx2Phh5vKhmzh0TCHwAWAsdIq8U1bd2Na4lHkqB4Xv1EvUOAQWhYMIqDQLEzyELYJ6n1wy3Rs5dnZ2wyYdWvtN6HiIGeWbAnfxobuq0m", "veXSgTQC4v5xGBEwTTa04inifaHXQIJJwplaIAmN5qIL1VFTyp", "R0VCiAm0gAIxTCmDm5NWQQMijMByp9lGAGSqODq4N60pIm22pNZDltuUF5Q2FBGNPjDnu4qFAq2Ra2TQP0bAuVc7b2AoBQBa7OOzQCFZ2F0cIT0fUcqO5QTg", "TbSc0dD70Z5OlIxlXxNpRMVvwJH1jigAK8lKkyPiXU6Gm41I1O", "7QiaJerYeZHKjbQUv8QIqvnxBXzCp0ZvPFTiuLHWuYqb7E40NUIBQ38Zb5kO6JHTYlBQ6Qw0ykb3xf3K8MVWNc5yhpLl6cEdLO3RoyPlgzodcsxkCRGZ1KWg", "7rSERern2sCpocaVbO8DE4wQTAyUSUAaJamiFbVFRg4GGclrzr", "2DvweO5cqX417NZr5mSZ2uD4ATftIekIreFT0K3rp7qxSPmWCF3C9GEHht8zXsFNUUqVmsMczCXQZJulWxvdBAsq30pZr4wLXkoHcAraKM0uesdAnZmyhemk", "fbHWdBp8weQYmF67c4zGwaOj7AfopRXU0oyc0lkuP8QAOXHybE", "EWocFwltkaKF2J4yv2jdw7mMF8tW6TiIzUsCOd57BOMBhQ9aSrDMwxjB3cf75LP2pGFEtKJ3gfEN4MvUD7r74aI6AvDEGbG5rTHioalUGyqIKjmVqdctBuzM", "pAa5lo8cIQL4y4WC2KUK4HpssRl4JiQ6ty9ckIF2gY4eabrbtJ", "vxalqTCZXWGva9tklb2yciUgK3F9e9TX41IsUTSzxiuXplHYLJVxzxdI0rPcysA2sSvMtLKq1COowdKHvpEslpAjeaMcQWfIwYdorveq70c1ewGXkSPVIYCu", "6YXW2AnxiOlXJNNOOzQ0tgXd9u6PSJJYpo5syqngEYBVvYtHVH", "FPyk05f7S7OleDYh5WXsBjOMEIt5XONnlJVkOArqGDZuQ7bUe6Knpj91z06WNTJ8mpsAxhyBuW5JbenDk70XoAYnAfKX8betOU1KA0V2UbL5D6JwEJT0R0oa", "f87lhje6CeQMevO6UiBgoUc0o31F3npitvSac4eoi2AKwXQQFc", "414g2sk16nmtUfmuFPysDfuMzqrOF6yJ5205vi4zTqsxVdrj2obDTTXSKOoXSmqWpobiUghyWXv0AlhAZIM2jrS1GHYg1PCqBmYgSDewlXutIb2prMrbDIcR", "XB8YYIPh4vNU9zPsXJjnvldk5ULJkwkH5qqd9DKB8ggHf39CMt", "0Fcbyi5JzoDj5IYtvf6EoFsSUXVciqVg55H1lKLk8YSCp05kdCwRPoutKPV2FygJ2xKnFdYOAyYzwdhZncyCOs6iGZiTYOkaJ3LZervopTll4RIs1F4P788L", "ionEDXmUY53DxwzkNjUSAmKB1MY7TgQBVDNgj7AHCCU96UuUDO", "uL8CU8Y2DzhdAArVoacyrp8KyFmqhxCbILnkRJmeJRHRb6xNeXMUMSoJfY7MVKxldiV40FgHfvgE2bcg9w8TOum4SsQxCMin2Br0PXH4SwGSXs7goF8DAsFc", "kfYwzEh0OY0l3GnUC3ujw1OkFUvNMAx7oT1lijl4FmpH2clCfd", "tbdHKslFD6OADAcCvKvhO9TDQTp9dSmW4PmMFVZQbxZm7Bz3Tsir192RcpYDHLjJiTfwzFKYCtLI4IJXA1MCAMbkBAxTTek98Q35fOdpHw5KEOpPPAZZW8Hi", "GE9jttrzHu4uIhiYenqqAfFXpm7KvM2Bb9tS0kRIcVAtAsPmeF", "dosqLgdQ0Wn0fM9Yo7GDPtiYkqQ9d4OEqE2Cufas9NspjzLV7ciUTO2DFTKqVi2Mu4Wpi6hrSae9X0feaL93k9ExaYl6EnQ8rwvX0dNSB1cgzFLZaSaKbmFC", "I0GUngddaW8a9V3IVdzUsI2SialJLyTdzh8kNjLvFUWNzXdSAa", "v2qxSYVBqqAJS91YrMHDIUhoreJT7T30TuxtSQ5GFDafKZDBvSMBw3xmgGFljGlA8g4Z47pJKPyewBnsbA1YBzKrFXaxlL7uz9T4GINagKCcTyS58UdJTv9g", "QjdB3l52uW6BnSjTmu3FsUIywtFPmO3C6hM9SR9KwETjgBCQ5D", "dvhwtdp80cV4obl8iBYpVU3xDh8N7DYl6GhzrU5s6aut9d1poZfH1gEEOMZVX8EdOvcDQg5UGxNOaNDMuqewXq8vDiOiqdMCWwPucTPrQkDz5OL0Fxwmo4fz", "k3hae1kBy85YbUNzDYyIxIICFCw3Hb21ciaHjKSfQXC10XzD6v", "V3DoDTy9UFkVFMDnbw53aWZmVZJUmPOFQb1d20mVDU0SpDDQ7JSfp1RKajnK8BXXkZAlXvGkPGBCRObWf3CU4bncKauRjRyTy6CT1SCPgNb5jCcPFmtHLetg", "Cl5vB1N77Zb92nYg89mrKMEZ66pRki5xS8sd9DiHnHQn4wTA5D", "2NXGxdKm35S82sFsTO4CfrT3cWz3g3HgQovNQF7TKYZKQoBuDF6q4Xue3thkwwONjJi9ZocrM9CmwLg9YkxcIrGJjv1fsQ0bjjkGVK8rRIdNdIUB0SlGJzY0", "uZgmzeNhL5xqN3hpJJCwZh5Z9ooQnMRgv5StjoY3rTtFXb4qsG", "lRvoy2bmTM6s20xTteFRh6uZJP8LE0axPVlNYM8zhCrjCmC5OPU6WNdnml90ljxAEhVk1bjioYQ0Ka4j0YnUtQHg9Qeu9a2MFX6E9qvvOLvhvxOvU9PNXf1g", "5gaDEaZR7dfERa9qt3Vp0tiU06qXlrDoVl1jLY8QCmdbMmRGnu", "3mllElr4IawTPREO9XvHy71bgOL8c70ftmO5XGAoo6HDVUcezXuvcvWIHqOrvPWm9trg71Uv5m9ZEjBDE59ozd4ERT6Mqa8zRydYx8U3sdc4KnHYrOKo2O0R", "p4ofduc4qEdoM7pCiPE0AVW1sqnuEmL4q7hT0IWqW9cqER2wqG", "w1jQ0bGmTUYnWMuCqsUMh0TJqhlqbZ4VanvZNBLqdtdADWM1MoL3ooNcV6S6fWbGHUnef8TJz6RCalExZZ0NMLzpRPw7vVLC08pdEIwDMLNx6Zsf9s0TCxId", "MCiFi1Qg9FHLVCYrXumcTeFaVG3hBMIWY1jE29sAMAVrM2htwT", "TP6j0bx3I6PacwZMAcT3kqDFfXHMODosbubbVYcle0JFwtZ4T27DsISWpisEtg4UYf33Bemne60YzZcQcidSy3ymjrydV274h95qnsbRycxvBXLnDwGCxEyh", "3uKXwPbbYeRJW2iUefNoBgbOcpaa2WF3QZaKw9vToKmKNVnz8A", "lJrLiRAGzAlEE9loUiyNBmiv43Or0X0mop7UGFlGQUScdEO5uMT36By9CN0Cs0yep394HsIhMkHxwf3q0Wt4fqDrBE11Cyf01m4IeKxy4Eu1sxpsRhu4X8ti", "KuhWsMUu9WAlq6ivKcuAXh0yOv0t3tZNnGrgdKYkqgThm9c5lU", "FGBGEYBCRC51XtFMXsg5aXl2EWBobxGqBP4QxDaNPgMuZbH6Sv90Ss2eOEQz9goK6si16JOTzkOWKdamYhmzZpdw14tAihSoaBqeSC5RvTvF4VzbClajYBfZ", "DZhwE8imJYQjjW8ex3r0WqbibBP8M3fYaLUoTCbkjzTSTb4Rcv", "R8l0oKBDSVE83oRXbuiCcR95rdev2GqRObRCvaNM5cS7Qtc1nKBNjJSaw4VwKLLguksqKFANrcUGV5FGPRd9i3jc7DYRWr7RbxFtAPG01jGUmTkBsLIaO2CV", "DiujZzAAuN14kG2lxIDjkxucIDDeDN7O6z7fyGoqdptO3v70CL", "jwGcWXnjB05JOBIToFjc5LQwhTsoU47ByOnUvaC4aHNwSeQGt7rwSFt9ijwAn3MlP9DIkPNIgiD6MbLDiC89RzG7iCITEeCbnPsVpFmTvzaIavTG5bNUaebG", "otj0VvcHJUm8hYbaV9q52KK7thbSJBi84S6YLipeAZkp6KQbTG", "fWYzbSeBuyMc4O2AwMrl0zJlpP3D0WRf00caQFlKD7uFVvPSHGBFEUy3r1EsWfVUd643LpLWwElQ9AqOPzddSaeJbqB5Tfa7le86SSaMgLmpTaBqaoR2M3Ly", "tV1N8bStEYxg0X0gqlTJLeAtRbvnfFjWilroKHhWqcAq7BVxww", "GHbO90y2lbHT7xCxlWEQ140Bt7MM4IIJYrfhrdjbCz4IuEFeiT2jW3vN8HjBY1S6t7lijSHvPJDKXSwGuyzQzun8AUJiVjmMqX3ZxKTNcgf97bP1XNPXHAdR", "eu77dtUROVzMnShP6KZDvwCQJZvZjYyNQ6V3xxTMSSgDuLd0fA", "CY6MwQwsxdOv1pzUqxPJHrjv4dGfctpoRw8LK4DFiaAhPA9D7YVMNEHPqX5SQsEpmKA4NMJ3wUkJcrUhPz3kCK90rCSF5e2pyAuLUDMQf6hHvCyI912LLALA", "KlNNNNDKW7d0I0Py46F0IEISDJlZT5hno3BCQOWwT7xl7MjCQx", "CjBS9MlutExb0meBy2XSz0ZulfETreQ1LZRUvBNpPKON42W043Q11yvnd7ESmeR5Bsa63vtRDHmGHJGKMhLOfF9IKLi4x9A8ziC1d6SoLE4bVLvs0EEdTNtm", "gbqdk0lhiviJ186LNAwsTpiR3w4VHxHxY7YG8JyoFe6EnCX8KR", "ymGhDKbInrF4mmBL0Hcy4pbA2OKZWezUQF9cXluKa7MMrWfsnIop5Px7lHfHuemIrtuNemhCs4ZjaCZLUM9Yj6fVMImEuWWmQR92BoF3qmlOyIiRerzOvctF", "vdTpA0ZaPgaaTpcJZNiYfOzIDyg8aXMTApHKnqsCXRl0ENHoix", "MLLJdYFHfnm1HxqYFeM6orXZplu7Za4tuOAVwNnZBXaQUPwk3IqpALNz6F4eq9VkVgFR101CYZc0yWizpYpxrCwyPzaF85xbjB2lB1vhZWiX2QXrxKooUjkt", "iK7oO4N5FPqPPm4yIkTIByA6IwskdbeJvl5HnSN3qDQDxU9DFc", "WObeSraKcCvGVpzZ6m1TnpfB2agBotoIHNwhCU1ogv2Ai1jomiGXYtjaTNkFGWXVtTC5yBsc6umouTbeCp9iisIBF0PTWwyNO8RKKJwOBhB3AmhKZr2HhJQv", "HpOokLB8TcSltOA53L8E5oWedXvKoJD59artv31MdR8XpGctbi", "5gWZK94DSsWfwdFnU8qTTUuZzipbZQJe4oBOvGZN6512hGoBNefq6ZP5HEeocwQgkc2fqb1we2xLGlXbNARShoVx0Alc4CGooIRerQYWSVphEMIcUi4CUZ9V", "hu7l6MZsezUUP30qWnVl8lNcRPowyxRgqWPwsxnVwHzJIx7pka", "YqMvTnIHhED8u3dIxVFkyB2vSKqY7b8fRUYsGqAx5L4xOhFLAU69d646QveYUmDtFmkTauOfDSdb9quIL0Ry6T2VMe3oPEgeyQ5ZKTEXwp63g0Lzzkx3CyYY", "cZL1o1dkRiJjCWE6JK9zITwHDsJNqruSPFSBG3vhmDOwjc20uB", "yCcuSomlBca53xKT8YW4DIFbCwDEw7OuI0pimZRyC11DxKg5sA76RMhdItsDyE7GCuwzUNveNwrKEVP7fVB6rqk8jaLgmSuyLrvpEqTZlKtznH4SmFZb4Hjl", "p2RbTMZoDVbPJ4z4Mq2954brK8RMN87CBZncvNQ6q1V73SCPJC", "WOG5EYCduZl0muZZWSuuWkt1swS2JjCn7StJz5uregrQYQy3qsxMbpMRloR3Xdqc3hu2mouPSlnzAl2yexLFmfeWT5XyiNaj3UmpHeCjP0iXliWNgpaQUEuv", "JRtznTjqwTdD7quUod2ZJWxzLVQnkIi1kb1X2iLyBy9Im2madm", "AwG5wbYKMIc4KKdJpgzAcA9mQtoAURxcLDhHnDZ7WACoUp5KT4S6CbqcVcmx1hZMtEeeRBlvLxjolm6EqYI288cbkPYl478xJkbkvLgFIN11A7E0dW1lfdKP", "0sB3xH0G1azuvf7B28BADP9rvAaalvykl7njOlxPLwHEZPOaVZ", "kjytYt16Sn1QXlXKSt5PGPKXbrwzRQYC9W3hO5nqsnENWjfyciLs5dNhVIgwiF6pjAU7FFv529QYq5UQlqGrTeYwwEtcRxRB7vGKACNBJnh8qCYc0pTRT1ON", "DFxdCOmIH2aRCwaUhIcYSAAQzbrQaDllSiOd6AvLBTlNPLr7bR", "f1cnRZMH0uSlftS2WWCPsLsdjGwYNY00Xalx95C7zereXJg3nrSfCJGtZDQujOuGydD5iPBh22JZJyb6p3kzK0rtDHnuffBbIMg0krfmrzJ8xuDkwxhGvY87", "nt1QXC1pXioHXR1NQKVLDi39dlNZHTe5NfTsqVhNBTcitb3HtZ", "d6FeDrNbOf42iPhBHXexspOSWH3ZZx6A1MoFBCqZpsZXGEgXmLSc8r5e68Ef3Kp5ecKpo8Md0v8GAmmu5EUE3ZsAg4pjPdo1F8r1EBcF5iTDUD7YQbmT9ebp", "jPY60L7DRwEg8otDWKOyYVWw4GNBvz0cOXiOqnbHknxqbo159P", "1fsWbuky6dx4FJZvfPhEhR1cFaRGdaddFV7qPrmTVkYk15ehVLvCkvozTDD7nqi0Jpqggb8BLguKjW1ErvOZqBWJOjOCX6AovzUaacjvGdF07FCwAbVym1HA", "ieKFkV3eUWE46xxLZALgNVdX66Tq8j1qNJ45o7jGbxIitF3SOM", "8lrjHwqkmwTlmo5qurwd6XZODScGu0a0jQk0MYj8UAsEzx5tmzWsW5HkVryPpZQYz8XJeGP8QHMPEPG1Oltto8dKzZjo67L3DsMr6mxW3KuGh8F6t6ziFa0C", "9jzEpKH2AesGQpkR7chplutc1qIGQIQX0Plph3ppff53VoUaOA", "N74Gk560JUJi0H5j4nktcPZgS2Svcq50y7EgDJgUlxCjEITI3BAfbhJ1jjwJazHW7UCInsmYqzI2FjLIuTvTAFVryP8WNQ2UuEkf5WBtTRviAEy3huWr7zg3", "PpamFcE7pykuSvluNgaVtZYaT5QY46bRvBB8mPDbLxTmrEgEsE", "jlnIMELkmPqOrkX0qJQ2sjzLVqZ92SMmB72XMNH6k6SZoyaeH0gAheTBS3KTTgFeoFA8cPCMTdwHbWuqUYy9CSKdTf6uJJW5WeB84MSXzMnYqhMIFLSQlm1C", "P54hMamsFwyHIQmHlZnZE7sSQIqB4rLSwP9G0t8Dp6S7WEMFm7", "pyFfQfxGp15ARzaYFYSNjFTBNyNhB7p042fUhcjWcmf1mDazl2LSHmbckwIu45u87Yao8HJi4yko9KluK6KZttAbpSVrXOxewWQ2nhlpdTdmnNe5TweMpowf", "ERWlpSNjymklTVZ5yArjXUm1QQLGDHtRjPBWpYEnKyXmR6rNGg", "4o8qnZE8nPQgr730dtWpgrnDbCHQXY6bKDP7meFZ3fFsmIqO9NDqEz1n9HDhpHG7UgEEIRnJ70ArH0DQNREZOEMXVXCInTPF7bUN2Fg9GqzVpCvCb8kzM4Vp", "cf7N8UcD56a7KFFY3C3sOw3y4nvOrQDR6KoCoROrVwzp9CNDOQ", "3kL4iPreoh2z66KvH6KdwnZvdh7ysTNvDi0u5pWrUWrZd9UsDmV9Z22Aj77baUVmATgFGC5jiuIJ3kBEUeO1fQCMWHw6jRstsW66g9pP35g4pqJHUhJ75TUb", "kQgTpWMf3QljaZ6deniSdzj5e2DjVfJD5xgsT0XUPIEzpIaU3G", "ugFdktevb9auNdp1VI20nPGzO6HwYLDSzS5hMjaxrApCleDGuDEhcVeybuv9D8ZAaequMQrDbePMIabDonsOIVNrNIyaQXiyAYtWzijYN6udgToSFfrXAENX", "UL5utnq3KjXJQErnKjOyBDRQsGx0SKVweaoVLeWfM3ymHnXZXv", "Vg6w6yA1ycKTYy1MRNzx0L0x5FkcmFVHvcCzYM1XxLyVHyqiJpfJAdGDqzncCIr6s35RO6wLPsqgqeO9T1RbefoScb4pswvkxy9L33eSwT7k7TsbVJA7yzYb", "acOQWHBSFIlGMQjGroyyHqXk9iq6fOfFy3eTInvX5eoP4VftHe", "sYSNHa55gkTJyPMcsePl9SQvsSOVMf7CCaZRAdWoLz7JORtF3G0ChO6ZrS4B8CNIkujuXFitCpAYG2nJImTzAXWz0Z86jVOTO5NvK3oWsx26zqNFcoDkMjiK", "IqQzKmSirpb9qOdiLfmKT7X5wkoGSUaiKyiciAKZywgoKJVdwH", "vQPSTJBHZdl7L453gnCzKAv0wDHRqDhld4B7LMMuz6zJA2KonWn5ei5btK0jVfS7jeE40YwyevHmvbbi6Onk5qJy8Kgez8lhkxjjTgh8ZwsTXRBbqxMtnfrw", "xVYveJaMEJ5hxknVegyC79lv67oslemg9KblbB8pTBWQuKvYyt", "i31Ux5ZjxKNh1X1aGckMRDYwdQEXyAOfBP98TisO1D62i7aziKL7Xr39HFgEP4tZS0hviXJhlPhRVIQBckI8bKHrZv3xzwUPwBKchcKQz1rUHGfu0w0ZGHOn", "CRi9LCXHMps3RARR9ItRWZJUTJ4jYQWisDpDPMTjCJkdTB2cSw", "1yTKTwbVd9t7rlKhxi1ORDhCp8NriplkmE2F8eillbtbLDIGvJeLVJXKPs97ivpS9shGUN1FyuoH66XzO9KrSpBriKxODmqLcVb6scKoV86ZDdWZnrQDeZ5M", "r2k5maQP5zTvZlk4sqb5T8cEx2SbbVySVgVHFveIu8EUryWjm8", "mFEOSBOukxNiQsNt7cpmuhs89j4gTqmF4ycW90OtwlaKbvDiX2UPiMWr6aVXRFkTDKzKJLCF4kZffmNCnsZVC5KGgon53WYHqVZ9qlOuVxZAiuKVmuyxzIDd", "6zi8VEPLjyTXirPDnyMVrg0bYyYYEmBJjsRE6oXqk0LSslefh0", "AYe8AD4ijISsZBkyNpkvfVv0vljZORXWzCc9Ngq6xIwUUfTpUDk9ge7cNrBkGhEFtrNEXDKSVExxtOnNbVUI9csVR3FhiTubIHpqU7GyMDvFbgbBC5RJfJo4", "K1j3TeclvSZQXoOr1H5bygk8lBPPUCTmDDperSOksx8NlUFlmK", "Kiy4ohDD6fPYRblHFahdKZZTwIx91hRLNPNB5aP9FmhhNQwb0dEJClk64fG5NfPi5mu8LHHa3xFRNB2MoEdyyN302J3NyS61Dy7YFP8IMOhhXh1MweIu1Ls2", "cvNZORYbPg9c5FtPba49I6TCkl4k5wkhr7EDXnouTvXW9Qtkyx", "tG1MSm6WUBQEqIL5VqqIlJDIpKgg5edwtdHLPNqtWG5KWQN2HDK0WVIJqwxtaZpRC6lZRZSvpVGKtdMApe8J7QbvKYot7cKJi5s8eI3SnJmhv6pkiy1nMchf", "BTYG5qamwQuYhxyUFi98mxqStrGFUxsdQQtUHRGBs8hZ5e1IMB", "Q76GZz8pCak5DBT6dkYttO1Zx4DyLZ7lgD2EA83NioSvxv1YeXRVvQ4qSHnnpuXT6ZhGhlbPX3ISxH0bpP6in9ZFQM1FEYjK5QZk9A9eCP69g6iVTmEGvnUK", "7VZL1Gg6fDqoLxRXMXe0cKW55iK0ToKaHsvI6ZMlkAY67zbRWG", "R6YvCdbUc2IwcZmWpt3BeoLCsQ9TpghEmGAwtjQVmgQMDCq23sDggWsYu2zjghyQx6LonjIZOiubsiewapcEMSkESky6PuVM0q8nXQLv8DXzv9vUyViIvTXM", "BTSaNxuNl28HTTCZehYYqR2pwk7qBcCM5euSaonLrwcKNnr2UQ", "aLra8mKDcUqootQjM0X7KO3ugPfYPAwxTlXZXpm7Jav8UKroKMvclxVPMAvlIrijbDI825GMf9S9THvmdrMMorm82ftIVZ26mKEmPS63cYA3p6pRvCnh1Xp1", "DiKgFMmzeyl2Rs51QD4EJsfC2Qt3yi5BONpdhbaLZMNyEQxce0", "ovsR8us1vqi0z6Loi2NIOuejtq8oRkoFdghlYXlSNRSKXm6DoTWAN8sEz03QirdLWI52poUCFvUkhayT3SePaWdXUevCUZXyrcyfQTrdMKO1uKUwm6JKcus4", "ZnG1KozAOxpnOeQiyojr6ClsG4Dtw3vTqCU9yTJMR89nkYWjKF", "YRPJJgLUXFXSjMcDVahov6u4reaNLvbrM08feR8BhfcQ1EbWnIIiMAkEnLZ8GAyc96FnYLxF1Zd0lEXYVnEpyx3jIdpWln6uuJiSfffgCIgvWBSzxgptdsct", "TRPFFV79ppZUSE8eWma0y2yvgnoKdOD7pbK46RBtFkLhwTKSGu", "RCuP5aCrsnF4s4fA7jcIdp1wWxOqOcinoaCt9Mi17x50ziA6SkN3ZOx4JLshxZUj9eaIyII6FL6F4EJUzgVY2SaMoT3j2WTBA3S7MkBZ3Fo5T6ZSm2zpVZBH", "0C02gTErVewrM7QPMDVnJ2E35DqYkzplCpnsHzhmbbbxizL2Ao", "oTq2VtDLRvLEgX2SNJP331ecwLbHLm59Du9ilM4DINPwuRMFimGllvNfExvZj0husqdeBfpT2ENugk7OUO8DJTsXQn47mj2eadGlI5CIKZCyHJMlhSyywpTM", "cWSMFU1n5FWNLiddGpbV6xHmODiK2Cedg6zvYyjdEFyXwbAAOl", "fVguF46xO671jn5hjedQFrdEMXnWhCFLfwDuyJpLQxM7kRmR3QrJFVVc2I6iSM17IEzEWnZukvzULmwOClfPEA1HR8xtSyziAwwgjWaRPawkMq9WZovoxv3O", "10FTwC9675nqZLIzvCjF0qjXddLaWOwXM9yIM7NTAAHkTXhNhO", "afFKDqvYQRvKyFTuYpztG91WrU1WrjvSM8kZyf6M6zg2E9wkzvdD2ejs9jOySHOmP8MLnQhrPNtdXpOUizhjePbl8xhYD6KaEew04drRzl3WYPyHOd002Zl8", "UTehZxGlZClcnd3mO6GuVEBss9ssgczB3bqaY6L6G7i2ijo4o3", "yHHA97H00wcx5fYvF50YBEfrGLY3PM6OeLWlTllThNOm0wgDzgmAsPz9lYAAuGWWb2I4o1VTNtGNowbnaNwSmvZVRjgKzCqZD6bz67STygomcPYCkUdVNA0p", "ue9rrxO220z87Rb38PoinMtVoU09ezwYd3OS1mU3mR9rtitz5h", "fs1YMp0KwfJtBxwZPvKsw6J5wAnp7tWljVH3IIOExh78c2i0x2su69z2IlpNcJ8JoQN6ilLdQQl3SR3QRtKW0HWI2MeefkySAJYq4rRUIDVicY84RQYQg4gi", "QKL45HWDY22csT48eYqH6xJWLrw1vciKv1MyGqBosBOkfQqJyh", "Y5erZxgTzc5huygGww68kwH8fwYVEXCkaoc7mIajsdQkc60Y26ek1wsgqOB2tMnRANYud6dWk1EK7Fs7JVpKPf0D2AGvW1LeOrZ1yCVgEk0JzqPGLCbisZwu", "jAnFB8uZ0RYwd4apoa7lOUzigaQYAKSrUE7fMzCKQlE1popbMw", "KlQJT6std0E3rgHyMcvYwJJ9L6x8hI4z3SJWW9N99ZB0GSxc4s8zAQ8VW3bCLfBM5SsZbEjknsj3IgdLWmKgAQ9gRkslN27SUy24CjmzbV1rBeCiOWOYuWDM", "G55e5C4aA4cKnOKMuJE5vQlKv8qne37u7CWCNbkXfMsRjAldTx", "iMOSgHaV4EWA6bMdmjCUFpp5EYD0Bexr0JJfYtAb5elCG7n2pxW4kJ9zrMx2ysuyABdi3nJ8S4IgA3gzyA1jU8gLSbOQTGOdR2MSndbDgrtqvZntkmaEuEXM", "pvmH98uZAE1wsa9WS1MNa7EItnUlz27pvr65xye6Dd23EBZgCt", "1lyD3p0Ya0YhnTWrYTpAZ0oZ30lagvRfePsgErCmpkTcDxTmPGuyHiYIgHrMAI1ngsTsjffYP68c2ZMRpHN4xtLe8CyJSy46qXzZAc5ZgD9ikU9XjVaeOvGX", "5FoXDsc3PZaXBd6roDYYff3MAd1ZYH6bWs7hkji7IGeRtiGhto", "DZUHveuwBRCF0i77Orq6y6NcXEKowCc7l4MehHbsgl8gTDop5cw1hHcEVu0P6bXpftUK83DmoJRFWD5Zp1ZWG9jl3jB8IgxwXRGeURQIkrYF4dmscJMsS3bW", "lke3Qbzw1EaVfymOoIdstNiTh3L94udpfFr3pozq2XJiW36KLh", "AE2rhjs0rwvUkYkbbZNZNQ6g6akAs3p3GrsxZkwQgpsQNazy7NVSlc9pArx3sm68by48g0WMpNlCxi835eVoEcbORYRKIVSuRW07UXSJuDTptcsxEOlS0NqS", "vGmClC4Dh4IBZkTTvwJpW9mkXVCWs1ymHiy0s2BZ6UlgEC788O", "xfYhN3CYZ5ZVpoBno4n0drSMVeYdmfzjIVQfZbD6gkcVYnGLp3LTslnOPKzCzytHUIu1t87Xqj0PVGkKH3l7oZVDrUNqRF5vXzuO51vwjtJE73WO4GTspz3e", "RPUseXl9WdXafQUOJnaQo6msMFi9Clne8FUmmEtHrQrUoLs76S", "XuXHmtXU1jDoLM2o6o0y3rOuMBDCIJfoDC5x3aR4IdrbxrP1fPzjFObZZnjp6OdIYhFaFhcXKT9FKWGyuGf7cEe91Ny8kaOIFdqUKT0cu7rDd89VMocy0E72", "c58MdWcs9TLSwL2qSs130AXKy7IxMPzyS7K4bwwkNFAJaD8059", "23KZNGgdD02AySFGWqBRZYghqHuyFx5H0NoLeVypTyySRDgx2rObQ5IEKBCZ8Fr7ddSF8P2cN02oEikGY6pwB5ATEK3NZsSCVsPcHSCfSCResBuQGhMRlWtz", "ouKOkmYDfypwOzZqBzT48NSO3pooJhn8b8ULs2YXyMSMLzBVye", "X7zzT0mHo6yaCXigsaiP6fjWz2VAXUm2Zk02kmIXqG72onieLP1R2kx1nRAItwLQeLSP5kwwz1ylofN94PZ67U5stFBmAUCondBsL7oK6n3uSR2UoZYt1bmv", "rxh1RsnEVz4q4tBBeC56d5YPc4Jef5ZU0EVP6JbbIfQMYZVClb", "GNemmHq3tU8Sy8eSXjj8KzokLKHpX3QlQ2YAHMEAqKanTFFyyy5GxrzG9G5gHTQhUyslK4w9OWwpj9oh7rw2gtIp9MURnu6Hsw3A0zHPTDEDM0sRpoTVhkJp", "6nEtfK9XHCfF9xcc8ppTniudUM6A4Pz8ADzpV8KkKy0Ttc61Rt", "SFbLq4huEjIDrSOqGtzYeHWclPCpReirrICfMrZaarlRK7IY0F6cWdCF2P4R1lHs3TXNL6xvwgNGndmlqsMMTWaWvevwPCmQeJnzOisKOFY9qKteADzejZ8f", "D1ZbCM1qfpp1XhJuvr1j9uOK7Nyrw6U773iJPk73Xw24cMwVDy", "CNsYfyvdnphHvmId4gLBjq6jti5pBHnNeeuHansNdZcWLu7PYTZHHf1AL40WLlrxNlExX6K8duezplMNCvdUaceveeP0OFxlyAjVG1duwHrj1B4D7fhfHKZu", "wwuKBp68znbEoF6kUvTT6YhDDMrTgQLbKFvW2zc0mDEZQIJvDl", "MJH3VSOKt2kEd4RZYUW8UJMgqmy9fBs2S93vaRFTUxi507eWbBf3S1jIlfPPoIPFPQAzqQRIN7NNE0uq9XrZWZrHEEe3U1IsQQrGqIYCNtZctRQ0yHZUqOk3", "dM45MKxmkp2b5YnTPK3JkTJgkr9ZFrcsBgwX0tJigJJkp4BFNE", "W5hplPeswujWktAgQAaitG1AypD94aNad2NOQ2FMwwtgp3LGCvw39xB8kOFowdOZdkw3mBOg7FKvIfBSY7Ti2fon33ZyewXIgRJQch6iwQdD6mder7Krk8en", "ACjo8H4ogMEH1Izwia9oKkRBpl2ZsfL2r4ozJrl0DxHCFE8voF", "i809HpsJPkykknmXk6OT6ZQLldZuXL7FR7MivE1Ixy0hlmEUsaxw7MHrxojU9qhay3IrII9DG9uzv7TmfRgnnycikLDuBuU7ylwE35RHCJE6Ois47WpsSRaD", "ml7vgZ1cKxoL3DcDWpJvX9zcgmU8D2LxoSqS0r4Kpqeq3E3Z3L", "SaUPAABeHOfcJT3Av31xLonzcqEeNHzqqTF0cRdtnIV5jWFeZEbv1MudC6HZOGNEkdCK2pDp7guqD7SkM1dNNWyXcG50WSCE3PY5EjvKQn8bvbLFazawVYT5", "oW6JzGV2f48ul1CBmKkht6uU3UQW3rbrOf8LweLbgRTRSfbDyL", "urRpJSHjyKZYAxDIG9ubla3C2TsbgowZfMMzodglwDJ6AWMOeF0Np1ZpUPQ9DLirh2qTfUCZiVdq00FeDDz2EYqgwEn9ZT0EVog9HsizMMnMK0yXDxXPTN4P", "crX9LVOoI4xZueWG0JcIKYpVTMvxixKKopR7LnudrpAmTg0Rzd", "jH9WndtgYZdqrPgIVz6PavEkfgQg7NHpfQLQ1C4XlfOc22vXzzuZu7JalhEs4Vhht15vD9SzoobroUMnTFMOMdw7KAxNdd2We8PpFqo4eOtTqDEKSbgmCarV", "inqLOsr20FpG5eIj09AqKP8lymVAMNd48TPWMFWKULYZxqGxxP", "mGos1mfWu1rY4z1TTLgzg8JEfG3wCyJwE7oFrTmjTbHXbHy2cd2GlLVRZWLlUefjjUwYvgHOIXvrostOVtfECAdmeyV8aBpHdmpYQ7xieqXQgRoBKTQXb1HF", "0mMYvBqYvd7Mk22MqamX1bgJ24oe63r4qDcjNQII4NemPf7DFt", "kESPVTTI5ZLwbB8CtVcBneWQPt5W6INpWoEzHfHMDdGomO0ftdohFK5eD88IQU7uIJrXy9tBk70WW0ANbw2pH7RSFakd2pVK8Nr7WiGGpGkJFshopjb4r3U4", "bDgd2Bx9YmE2UUIHj1bwrIie1KgsLBvuMbXOmSVLEhNgAexrdY", "lSqT7slni6wb0ICVfxxAG9qbn0DjrqHcH63Owp9ct6EsMQN1LJAbQ0DE0QxpFCPWISsCH1p9531SROTlhdM8bZKb0FODPnjiGbsVchegif884btjDFpon7Ol", "MkymYhSmGIHqyuWgZcmbCdJPr8BeEXNYILKo0kaE3r41lZfJBQ", "sN3BksIwWWRr4jCNVA55M6vR7e0lx99qXCzH5HBZndRqKbBqkGt6NoVSRTDOdKCAXAPaRb7DEW3W6EMoSEsp2OITrTqSo0aJA0raZwnlRoHX0cJSqBGqXYIP", "z8pl6Q2HOtrxociFQxkOZ3qNE6EkcW9acwLiKOxiFmf3OLGmJ0", "Aq3zCG3Q0eu7EW1ZCMvA4BuiCH1T1IRC9T9JjCjhqdm27ncJ7VRCeMsrbtIcCjmJCtct6JYuuKv16VID0kNf4DUd7mFHV2Ygv8ZzP8sJQnIUIagGI1vMFPzK", "9DZfD7J6Ds4ayutNhBrxjXB2Z7MoUK6eXfHikaoxQsXNmOkRXb", "MG7YGedbS5vWjQBy6vWuqvlNIVj0vGbFUgljKOKkSDG9bR8hMcZCXKXnoGnhUNwx1igM4y6WBNgmmmR7O0JuJph73TmYoiVpO9BT7GxIbd2LNTSmRkekZJpc", "mb8YKbOgiX9pl55Mg5i4WAoysSiRlW2W784PiQ6QyDGhIJ4zPk", "1vsptlFaC06CUDLXb1xhRtuhZBzdAOLBHDy9yDj9BnJeycBZd6G5y9kXKj8S5TdNgZWdmFkv03ZygkYHpmMlv5IDoOfurGFVpl6ZyqVys4wWnSnaF8L8DbMz", "z1tqG6J5rQdnE8l6Agav6OVLUqShRmgQlYE1eW5UuiH8o1Dyfn", "ul9P5dEXIfJz44VG49m9dgrtnfu0bZlVIttNU7snkBkmEF3IOpP0UGrHtjHSG0wYtpwOuoBcyvPA8SQUFpSj3J0u2FMIGIp95lVzXecTXzdfR3AgqcQtwOnw", "e8DuQ21UlVTI93kf2LKRNU6D5U5zsqvWy8ON8OrtrIAyKudKFy", "mcQsoVMtUCjOhgU33dPuWGCeFWYqrmmbMDR8gl19xjXeP1iSc5K9MWlZ1IPq4CPONqX3bWCWFhBejr4LwOSGvCpuUDiWN7ukvPlWww09d9oK0sevH4BAGz2k", "AkEXp7FkW0EQuEaYOMqMCSFRXRblObUYJi38pIqKG4iBHIhdcV", "xpyDGTcqC0RgWjNZrApiS5kBGzRvc4RarNn5qNv0NLhr42QtAFZdIKmXHDSsFrS6CDC2a51vQgmSiAMqNtTdDFATRbLgQlndwxdU2ePRK9t0HDre7KHIYQlx", "16dRrO2nJgHMKenflef2qUgxpwDLMzGL3rktGneXTutlWeQIJ4", "K7Yz4LvFeFEsYGkI7y5lVWfNIC1gUIimPFlRYehBrt3P9niGll0HGfeYpdCHwt2J8lleQSpFLtfTgLhQ6hfKLHq8u3OouQ82BtgZJUpcNU51nlPtQ4CjL2sE", "5E2zeAzn1eNK8CxTe0SRlsICuUvEXlSazUYbfVPg9mzFwwgYw7", "xixDsrgl5DVXlU0J6dnTHwDGA7Cqf9vapsnfkTQnevJOOJfSwSvDP8UXFeLslHSa9DDrhcfJVyhtFNJBpEMCKojXT5PEMpnT10Lic0z8whzB2JMrVg4qVlNy", "qlCAYzeZ0zFaxDitug4wzOlU4nKZZgVNPiYvfATd7gE4tuvnax", "hXJT2NGKvpyQBL6jHmriNyOb0IUt52qla9CaUSsNGroRAs8Pcx70tWZtm3kp4YaefmC9D4XRtJq4ByRotZmm3LdpNNeRvD3azFhAHCb9TRBfNcRG9B2CWfzt", "0cItpLRmY9xoJYxny8QLipcs0c2WI0OGcgAP0bBYi8K0fHndND", "y42Yu2BwWRuuhUbptbP577BS7ohsR55O95w355xcUqWAK5zEgOHmUQEZFvSeyV25Zx6e04GVsnfCscOXzdJR4V0HOQvLuwQTrX7rZOKR9xbzY0UXdlyfGwwd", "LqyFmMgbtnQQ9jpGgRECRih2UfiiaeLvSJ8CgonXZEwhvlvZC9", "mdsTgM7M4h0OaRfgdJSRrzdleYWa7jhrKZLytSKw7JIfkxJLHlm6iNrNtNvz4cqNCBJ3bexgvFJdDcyULjY24PPykKxnwnA6xT8W55ByJUZW5WyOFWQJtnFb", "7CO2yY6t0EN3KY2b1Z7453QIXrcQcpzi2Okyuqps5CwNlwykV3", "ob6Ctd1T1eJ0MJM6FHu49xG5IzzGhVHT4LgvwhNxJgwfxIjAXeEhZSksQi67DObFjHAgwXbGBVv6mdGJFSyothgJPnOa9znqEvUBT4PcZKhJvvbAMXxFEdWb", "Ou9VuuM6qqHHugrSzYjsSK3os014bXe0PlTJgpOWefnYKeyHBi", "9d2APs8QxkvZiKKBc010WfdHBxu8C3qMgqU5hdTeNOD3iXEKWDK0qyG0tA86DwQrksuRVL3qjEtPk6iGH2G6yW6qeCup6IeoAYGgtJWaWO0GUgWjgkpfFtTr", "3Nh9dLynsCTjTyIzMGFowjVcSLFhCiYG3DNgXJUPVv6xrOwDeA", "zYrTBJoQyy7VE8iapFtHcNCjK25EFiMDGEgRVSqUOxzb5hBsv29VPKChMIuZ0GkESOgyoUSDRPoU6zNzzUVPmh46xyexDOAflobZI3khSYBXVWUVzzsjhuqe", "tUa4qihbWJ9oMtVnQeIvBmQ8mGrRBh329b60JnZp6gdRa6C0lU", "twGI20YtPjZTji2pgMbE9ful6SrGQckKWzcYz8QPqzqZfsNKCyYMbQ5gtwwHZhb3eBcdK008zohch2wrySBatGGkDC1krbnVmN74N5CKusxZutQtMaTDqjx1", "tyllXXEKuJMIPZaJRXsJRGClofydMteGpOzNtBfnV13uYeBz91", "JYFTJ49FhT6JhwheJYqyMJxNBWzMT9NmhaEzeLCJoJdWFI8WrwSBFPWQvUkPd59IgNFIiQcVjFzwV7QM4sVJF2iBUSY7WhNC3bUj16EiJDcpJ29Nsde7dKG7", "loCHWXTX8vG70VpJgR6zREKJrxPUHfZ2SlJyIkTPgjWgCKxrj2", "q9G9Q56pXNT6Ovrfr7QKU411iEJf52ftBv2c06PVSsbqnQVeWtw0xyzdAIHFJw6Sq74oDSKfKvT6MziqqfqmbqPl6gyPd4qRBsFNKZ0dVUjpRPfH4T3dHTOO", "7MliPb9YUPtoyuRRO8EpYr6aLACcbayivkRIJYqnxkauczJ06Y", "ncNtAi1MJaxFHqxi8HEw2Cea4GYNEev1GJtQzsnGTiWkWRQegeYjoDHsRpGgTBfjSY8QRtesZ8c5a0hGeFxTQFLq4bUYl7FBgLZ5EEvlMVquVVB7j6a7LuxQ", "TPwCX9MBVvEh99TUeJO9pXEYepfxhbL80HLVRhgwcudk34CfOY", "mB61hioKdVtzduEwNfd4ZEwByyF8dbgQkkPRSDk4gd3JVHEtvrvU3rdzpr7RSopBYEczRK37y4OTJcKESFhV7KVuBaLcOAnvONunivuezH7IrQVJfCnmUGhe", "q0EDB18ZM2L2vDguUmAKCfbrpOcKcJyTJCgSBo0VoLYjYEb10j", "LCPw4EJgWvxSOEc2hnofJc0pJY3sX4csEznGD6ui1pAO4nQjYFOppOe7uizQkbIwa3Dm97SBvcXzNxgwA4j0QO5I44goexkE0vyA1QJw1qtOlZIwb2u1QzHU", "1yGfv0svuq3vFKrGAkcuJvqsxirLf8pg43Mx3Crv2uqFDfVNP8", "Fg13WylNJOW65Y9PWAbN6bFurSaKoxQ3cR58NoWgD0kGYtf22EP8nd0c3axrWNt6nyEAmipxiZDFRqHT4fZqIZSL8PBcl4iW0ugkdViJ3tYUkovmTUcj1549", "SDjBFRhFKOyxreEuXlMHZH20jejlhlsAxcJC11SLNOGC2V5ZGR", "pnhrlQVSBBB4L8ecLfdl109HBBkGiyhXlOOUnswy380MGeybKcMJaVYleJ1NHhu13HVq9SnCanWqQUQk4m1dGZMssMFA38B4PetW6gggRCVrevZhfaKtAgm0", "2z835H8Uw1y2feh6oAwT3VAi6SaE8KC9JLCPaIrWHqXwSC1HMx", "iPSs5WIfiQzvXHEkeo0VLIJqCk2DzO8hlZXq5pWmFVhlmvTOjTu2jBqwts7sEEZzn6qqvKc9pJuaCLyuoquW0lQtbVmojJlUQbLJvxSjFKHPfDHS2Cy2vOtU", "tdIbx45NdOgXK7EZPTw3gETgORgJnaleD4FA6JVjhAE1FSYcvV", "fah8G5XxMIV7xg9ArDTKxBS9AhajKVCx3t6IwbDGuiLpOVzDiTWdcylmgLVyohvsYz8SbLiT32IPVHbBi7pK5Y7jtahhGbXmafF90vc1xsPSA0eq5RBAzGss", "oXZ485rhk4qlzRkxJ9NR71ICQRLPfDHTipYrsNYcRMLOl6J5Dh", "ULgkX79sWo3mImZqdRB91aTNyFRIIexkzdVXicNDRRxjDUXovivuGOHEdiUtLReK37pjjDwAetrpNMbG2WBIuQXW7zNSR1kS6aBql8yNzoCLAnbDHkTBByfG", "y3gN2Qp9yyxj4v62hGNs1y3IhWSqV56R8mo9AbI9XFsc8xcqBz", "gDvhTcDvSg1Y57ItGRSWa0jQasLCgX9Kk41BhC79t6gwBwqQNGwvEeMmUhyAC7UuAT6rfB0WHeTSbHqwXnsmRCYvrV34aVyky4ZdFYAUCbvlsliPWY9vkgqb", "9rdjKcSIezusX2KkdFTVzBsVh2RRiF1r5eYPEyiryahTa1DDFh", "gEqYhYa8xGMy5RbcqpYWeU4LyeL9raoVmd4TBca6rw5wLeW9T5g6XiRVNmdCKRi64mYDM8ID4NAP1eWShCWFtwiGgLS1l85nsdzFlHSncaAbFh1wrYBkUu0A", "DR9wZFiSshhcy7PYia9xHAt8g3tAvrJ6IS3qhlGYSvAO2Zuk73", "fOBZVsaM0VDJbUmcIRNYznT79Tf3Cm4r9GOe8w08RBQ1fCdxb1VZmwgwOLxa62PFImrOirUA2u9g4mdgl7FY1tSPDPxJPLWh7N3pCWxCQ4sTrU9cbM8aDa0Q", "yvhNGB3LW69ic6v1BlU0FbaoxjP8JNZFIEdXQgswk1dN6WMFFq", "FVPpHKWgSo1z3IEgpcMfW7h9Sldm0tcDMz0dJXIlLJlOZx3OZN25ShDsSoeQhGb3DbfW8xIRE1ooyrAVCCYftjXJYCjFQKHeuwA0tQS5PEtL32qFENu66QNe", "a5s0P9cH5lIwBi1ZutuxvlC785BCTZp3eh31oeJtPZnYFo79f2", "6anGgtJr3mQsp4Xr6LVNEuwzS9oaIRaM2LciEuXFgy8U0fL6zoRDgLB6UxemOE8QZj6lde1Ha7jak4fjq6vWS6bw3FhRUnq1Wun7YmN6r6hb9MLzQGUsK3nN", "IUmkHammVXr1HE88LpjS92PZGtQawDvDfgxwGhglCYlTmtb5gJ", "XpLxMcomAjz6wekrZ0XDkjlVDWOmZ257rR2D1oyBXvFRYzH7yoIiX4BiYXV7ZaCOzEZ03XAYTPy1NF6J1OzWQAFyhk6GIIcIVBIWjS4Aq0BDDFUEdTj2dy0I", "g4WyN8EsJXO2xQCnPLycaSpCvWEYUEo8JK4eSJUmqqmlExZdIV", "Ery13tXFQzRE7iZBMzUqlIeY2tTbWj6ia2jbuGoKFGWKy3UJ3w9mFoIHflq9Vus3xbfrqT93hdMgfqzgm6SzsjEXU4hxxX1s6eju5qynRKT4AQkuUBuNu8sO", "DXK84L0Bzh54V1rwJIzRgjMBsGWmOO9ZwTh0of9lMFprEfmYvl", "zcSJlLZH5wfETZfBaTohCBu209fmfaVcAywvHTAMPqZtPE2xgqfszZs0gXkL6GyECs8TLInj6McUbcRHQ49Qc0QIXAcbOYqaQy1jEnSL92pieEx5H5Vt5t9a", "1jCQH2yfyyPAlrVsuIZYVWbmb4dexkFxSRNjRJNNHmX0b1tVHS", "2mwbWWg7AbqPWIotzFBMcS68Ti9KBQmBBgnfCRnN0bmXtZOqoZBP0HVTxel72VIBB3rOUclTBV024Osrw3EwJjNEL8LLdcXmfMA8wtb7PZ9Rv1Gr3UnKB8YW", "EsqrUNc7hmFdgok3NrSJqj8tBuBL2ipHaf620i9hTNK992AXtc", "okJubVonqpTd63JA5JtC1KZJRjKbEBB0tVuVyhGmWjPakikp0bzzvZIMGavSm7SfcK8YzOKV5j5pQocQPcNJ9fdNEZp0gHfGZomZA62En61BueZHEwYLaCio", "lXoPmRdJFPsOTtcEzdQtFzARujmUtSGcx4zhVa1jzr5QkfejI2", "aW0lvuSiMJ8cv6gun9UmqRetpMYT4pUeJUNEOnuk63K170ts7LfwmHpbbM3fBXKUzhiLVd3ZeNblLSdQoGMYXA89W9ofe67donyHO1q2MPlhsP7efUCBcKI6", "R6l5BqizdeE2d42zUogKBoyoGAxsTFyuKhyVXgU8Ji8wkBwExc", "W6OUuedsU45QwP5uuaZMjs2pmn0izvJW1fyuIbkkfpBaFEU7p1UWtWLeJKMHFdnFJl7ZLpJyeUYrh1xU2R0uxJYFdsUrUH4l0BKJ0dIc6oSnpPHqqFklYGyA", "8S1ch5LgEfzCHHoN6G8tdNjTcRD8h9IoaHOHMkxYPxkgCX1Gl9", "APUrq6J1D0BVmlnB07vyeKtOz3t0Kf8S4cJshauuZ5NLo8WmERkskbGjf8hznpRpQih5JbxseKDQRkDfBvXvXlcAtK7e7WTVEBaVkVNNoZnFJyuSuRMPAyX4", "GeiMAArOJQu3tFOhoCw58oY0DsPOowQ5Y6PiGE5ZexbYCzDz9A", "4IyaICSgYHayK94hrJvwqYrR62PH1YR3qOe7Y4n6JL2bU6IMNEGEm8dqA279bXCPvoURrFXAbZk5d0RzEgDyoqmwru5SPFpI4KjtXG18nlEOmdNyJax5PjzE", "b2e0ITGKlzBJDCR0ydPiFkgWLbaiJZuuaYtq198l7J4KVTLR5i", "9KSoqlNORgyLZWtQMtXUeengzG9IiCypWQbLAzjbdfvC9maVf8zHmkxj151hHzWoO87W5o7iS0vbnT7Sb4iMnf5mk5T22zoO5tuAh0t90mjnFoEpsuBdZEPI", "HsKIq6gvzZ4eZvmZhVLuJXh9Rqny3CGK3YateHmbqqGNl2wQVF", "Jmkyv9pg8srMAsvllZ0X9oMPB5P5WsJne1lXBYCHQ1dZtYIe6G9F2TcDZzG3rXoVZZ0k8C1WDc369JiFZqSbJ2ms11tsYhL7HJpNWorhRtmaCSnkIFLcH6SG", "7M6f3PnIiadCPTsqMeQW6DGNQazfgPvnj1QlQB36mfJB8BzSnP", "wtaBGyjDdPbWAKVY5vk7zUmGfsReIE1C6ZLKX4W8R5eZP98T2qa1KKIzAhbQucay9wGg0moSrQzFZ7ibxGaHYqEgYn6SNeOWaeAZPyzEMyTv69U1N5HvtVbR", "HfreKFBssLRHIQVeNxYT62SS5jNzDxOUaE8sRHlJbAarZ6Tw11", "N52pX5Zt2moREOdKF4cyOB8y2f2Vb3Vw7VmeaJXd3L2HidbxhBv5M12Mh4qG6LBBovpOELzHezWKc5HKFANZAPwpSk3W3Ehr9UFNpDcUA6onA45PCSyMqsBI", "cDofRTWbxkwnvXF5b1ql3vAEM7aCzkScxEFMhmxcUsNPNaUyaL", "idEqraxQkv8AV3OkP3ULgyD3NYeqUEBCpP1fyy3grBrKED5dHXwvW9wrfahAmsKaGLFCIIq9RhUftXG84D3YKzQyY78IySsCm5O4NCBmsdPl8etDrwj9t97R", "FDkBeaNQgjS1vdonFDYNrPYgJIoDPvce9MplvCBbtbcpEOaRa9", "pRWN6qdu33nffu0VfvfoUXP6McTw333qSaCYOpQRqE4W82zmvcaP90UVcxQf0RUQzgzNVNmMbrqirpUnR2Cb2e4ebSIZum0rQxFvI1Fsq3ais2TI4dt5Ivhr", "MzPEjN57IK3aKGS8K0oA2HS5vJABDr2ZpPnWmqe4BffTt5ZB6O", "M6fmBY4JhHBioy7ZUuP6wYlZzdfZolx8rat19xKoCVWyReXuWu0STk0QNfz9QwGFV9Ge4bQE4xCUZhO5ZMV06VRR8QZYLpmqy0S0bsEenO8M5URcqvdvO4MX", "St3nipbeq3ePus1hG94JbTwSMXNlZhI1bLnJBOyzQaOKTQzhX1", "z9VtZrQwczbuyCElUP8QMY0iqR8p9ep6lKzK9NGkKrcI2q4WDAuZiuIWMOJT08ZlQY5YvJID9uVBjXfuhZUNRkrn6BE7HnsiJwGCFWPOOvX7SA08hUV9CNuG", "W9NnuETEAhQNDqmajHf9SfH77lGJ69acGvNA9pOHWnfibPIKgv", "R6bjCiSQ0YZY8pTVybKKsp7XXgunyZgQdH7pyZGy7pWFdxibY3tPq1uLfp8eOo414Br2i7ypuS2VPk4wlyLZxFuc20GQnIQrRHr9MpwEHyighmaQkv0h9uIB", "vYaip0XGFOQZDMlUJT8yGhMycMgjFwv8UTqHTLYgjyFuI0OZUU", "ViBsgmCKTRGOXjpL0IgYyPUBJlCfIe8oMHg21qLVIbrpKhBJxprwFK5W3FALtI9DZnGZeb4uAvhTcsmYibSvvXRynbIerRsPF6yrf2lpvSIWJ24zeWuX3JUo", "tmTiDL7QR3H650tzRAVkCXjq3bO4sstjeKQpdXG4bV8eUzbv96", "fMdMAevYjlOaT2stqVO4XxXda1cBumGX6ttGWmnDWBlzCdq28E4fCbImbsxVcD3i5uxZfkmBtV858y5EC7rMj78Iz4ncFoIIjDpOxbXr6fuCbyQn5FAmMG4K", "IsuWeCoNQejLDGAIt3UU1tG46OrTctnvjhROrDlFrTb3hlLbon", "3neHqlfhCIYzBIeagVnPjdsKgY3z9qkAbNSR856INfHWxt6bMu05VrNBPR8WFseqD6ILCObX3s2yj8Z60Y9VNXekwmEBdszqxHA7elcfcecJl9PlfXF22tky", "ey7Fp65mMDtyzTdZ8DsrNGa2np5nhnlLmqabwdLGrCEofqLn1D", "eORFRC2UzjHi21YaaTEvj35wplkAWlLB8lOZxO1v6Id8IChqftmMwpGjayr7iAGqveNr0Om6ePFwbunEnXZhMnQvmF2UPIIJufAu3wzfJCct6N5tseaCSy7C", "B7eaPwrHZzAcv9HDLr6RCBK4osFEoKQzS4XryP7XOH7IQMVlEZ", "COiURWMgk8087SCeI81PfQgmg679pJi1hQV8vpmdxnm2DygT5isk6WVmaavPtbQazthugTYbEIdQEKtJ0m24GXqr5jEyKdYJWDCBhimt0OJEgDWgxYkB3Y28", "HH6ZucqOq2XViKOgigvOtP2oxkz0I08XFC67owTcx15fJUMz8F", "L1eNnZ5mZNkfszpy6buaErbJVulptt4CsgZfFcQoxARpAGnErfm3VNN0F6p6yrIqXpUkRuWO2xDAByN2c947XP5kVspTh7IEvmwMeSjePunYtAaVJcaq1dZV", "VOyCTEOOyKjamSF9M2hDCFgTsGKrtrMMFJWiXs7UCq4wGH3aHi", "oRyUvojDfa42xJLRzqK4KUsNR8eSjwBVN7zGtgTWHXWCordogxq0SjLrp0HWuQ1FXzWOfzvuVR6JHk5xfuv5dHuQFCx9cyO8vsWbsPTLrae6Ii1vcw1DBvdQ", "5aXgXwmSmI1egVxV3abLIcGsWF5i9g6CFeskYeAKvCxbfu6iUf", "1kHFcnVfTcKaoZChJkJT2EdznIstyKWz5nDfZiJ2Ida6AmlRU5sXJWU7mMyjfViiGvNnbeqtFOyPBjodohA6DdBxx7gcaNKrGgesKSjapfxyPmbBTkFeNQbK", "WIx6dHvtvYjGyRon6jlTVLdw5saSHAknQhr3xnwsJg6H7u3Beo", "f77I4CAccPmNCC24DzpAq8owNvpQ6TDjYK1cXAD7ZzUmAXoNUbVKhJF4C4VHVi0102cVApdjo7TwcFK7qpPX9caLe5c7lb9lblFlasUMzyJcBdh2Q4XXh7rL", "CRTv2cfdLuOvmrHjnaJyB00a5W7mdy5oQYhS8M4TEQMyHei4C1", "3M01w3X3nB0sxQReqX1uzDLLCaxsfArgUrfQsDRfMRYHrxvgUuYT8rnISkA5szjMrOmhZCNtdvATq69Kyfm6XZOzHW2AWlWL7H2hTNY4IjX8neRlKBqriCoz", "jo9DZeWevWLMuuQCbyJOai7utxjbAVYrJg4qIaVD6oX0gxBFtS", "bUAjM3e4coX8fpmhd4F8FKvmIZkRpdtQ539Q4mUea1lEoXtSc9YrRTej3MBqx4G36ORAAvniuYuj5oBfvjVMB95CTG2QJGRPcsXmnKTgqNNuBWX6D2SO9WYc", "kY33pUQRNyC8Gfo709zCfWGtZhFiDoLvMMz9qPbBLlKcO6hOGg", "YvApmjU2QfojaA5XItvt5GcPq0TXMjBvdMiN3CPTpBCPMFve9qVE65bx54SPmcKNw2kzC8R1JbPdrKF0AiCEnnBqpcGbEawAbh7nnYn68AkzUxxcg7qTu0Ih", "cYHq6Dyfs5TfeEmmOUjqReS5lIZdGpKsNbgRne7fkYLMm568Zn", "yyRQ4AgblvQ5nlfSAS6H7onS8XVCf2zb1Oz3WecHZ0NKj0mtSr9Xdu0mSTy5WwhVKgYrI88r8TCpTyitnpRRkPDAs9FO5utOZPFrVLjdnvSEr98dwX4guFqm", "O49Uy0qXO3PtO8V91vOq2UTzzXftmUd9YmbWlR29UR0qXV0WPM", "MRooQnJ4g4YJD44mYpDawh1uVWQV2npPEdBdQUh4WDMhFQTnDgO7LN1rsPMuCAHPnS2CvjGRwc7B0awDHIIceKRWhmQuwgJj8Lv12ARwmY5n81yNKHywZPSG", "Bq85WRpdkicms3gdZlOgnM35bz1ANRPWHXcmxPNh5zSw16Zasx", "GdHIitFh1c6Q9Lyl7v8UaDS09T7i3xdIatYGmnvlQ1CXM8IS1OuZbMalnfRrc37AwfQgSLRqKdNejd4k1xKbJsK7Vjw5m3FggdM6yovGPGu7uxrtu9SB1mGW", "UCbGDovrRHyP3rdR7WY1TNtNXJYW6p3azcoBRh2szyG0ptPxPv", "wqJnDq7kMBZNjWyVhPDkFAgVAWNYTkTNbmBmaIWvT3ICaGhHdszt2gMDCjldUE03z9pZRMUsPl2zziFbaEUdsqo2aXf2le5inuIDGk3eT6bToq4O5WzvMnyu", "Kbu4Fzm1s2C6nFkELMh9CjWFDVBYH7SbiNfyKSxCU9JFO3UiN9", "rarLn4pwc633hmOLiildvFmCT8Fvqd2gBtzwwotYuwbaizvOgg1btllKuyFkZGOk9Oh5Cac5UBfB9YZpCbO5M9OE7bzhrLPzj64weez9qeIzAroMQCPlJlzQ", "Nw5EIVDzZGvEuuLkWdheSVyrfMcy7ZNUUShkxsjX6dj1V2j2dR", "e5udwazWW66tZYKEIF61mDeTC8VtA8KmCDN6lMdHRh9yFRCVgIWRT9ufHOZPWr9g2XnntQ3I7AGKbSpHjJgCQbqfzN2TECAHhx2aL5rQF7koYX6HokTDLHsI", "etmt5u8mpAKAE9aTHIInnM4b6VoQnfiRYSIbMOL9XfJlntC29U", "pworWtMKH7xzXVQn6kCRuh5DSs5euC7h9vYfmsx3yv1VQRGV9Qu37zFZpIEhUJObCuEznC0l51ETQSyattb0qoYe4kLX3i8FcNCNXD6cCK5dl2BevkcjX8Nb", "sh8tNF7xcJL7URjhkmKVoT7hDhRiqmKiRQamfhkF05MTU5AEqS", "hevmM6UlpKV70vXahBHRQGUnjzqrBgJrJCddG5O5PrAOmgwSrErHSM49Jt0UZHLqTxTj2rnQhvmRbitSujiM5mTOdRqBiA1B7Vt7KeV1ZHRB0Ibs1JD64gSh", "8JsqTs0YNtfhV9h4Q6DOOpHQ8UUC8xsGEi5ha5DxwsdRzITOOh", "mkW18cTdnaYfqkNtPwwctqSUFSkjq8QaruazW3aJb6wQqIJFEGr54IYKkI3YPR8GLiDrko9Lu3jjL3wXHmbL49fmRgKq7S4S9IIr4RAySufoxcJCOuXQ3BCT", "rWJxwMP5ehwi65eZzKLuue6GXbgaks3cOLZKhwOJcI1iNfFMxY", "GpDK5iwlIgdKGzdnIKigdKyc0KFGgBov0zF6f9pyoRG4QtqiBYMmsJMqdb4HmrCnqQrWXgSL7gQWXECgmZScqmSTNXk8OvtCJkgqO6CUma0HmCxYjN8Z9a0V", "5jdRcWevEIjaPt49R2RDDOjwmrUtQSOTBzvlTZehrMGEFKOfNp", "qYDaSxPupnNBFWBAIehuKWGalUs99Dwzl7XE5v8sgT3v0E3GrkA9HRh0tZ72l3zUAVgDQp54G7yEJ1UAkdHz2yzvW6xH9ulHPSVnFYsTfoizpC9XpPWpNTkt", "Zf8gaswxIRlXzbyfPgeCtlkgAEUWiENFsWwQOsNgH8BGh9t4oV", "HfFzJNDntv0H9sl3I9tdnAkwOR3GWrllW0kqOvbFpbUyTF1jMuN7273QY5g2wSnRQXFmRq0GSUEtkFd470C95DZdIEgDeRc4xrpOfpe7Jsz15c6AaGJfTqGm", "2uzgMbjJQYh5LJBe9AeCkiMKydxRRDDU6AASjrj7PQDihMLqUz", "2EhMWfzR4QeGukQ3A8utFIHQ0ymLmGKoSzAyc7PhY2xQkLTvTOmhg47g2u2p8KbbKkXurvbPxWofqHaJdN0JP6yPyyC6GofYWDTN82l3ZZgPqHgUcflzlhOh", "dbnuNTStetGkwzlTYRqNgUpG9YFsGeZtDLlaoERQ7hA1hvUDKI", "a1nNHuwXnCBK3MfpwR1Np62z6hsYvDrTEerVYn0Jx9cyVFlPhmkUrnUxSKVLXMnjyeDVPDmKNOIse2GJo0ndnFaEa6Z5QMpNy0sLDefY1wPfyfykfjORzyfZ", "2CcRZPoVPgrdIW9JQYwOBu9rcXGbTt8U5ivc8j8XNz8fTIxuot", "I0mPpOu3xMw3q1llctUkPpjXUCnP6cJNa5mNRfQO1KRrJAcv44fTtMyLZmldM4yu7lFYOfwPzLEGVqCXsrylCx4lhpM1rLvy4AWSnQpkj30DrCkj2hSEcWxJ", "KHIBcD8eLc463tqmwozlziUzPuB1R8IjNas0l0c4dhAeayOVkM", "Gj4jgRdrQ2xilLGeJ1ev3FcDtB9GetcsbebH5D9TF691PPdiOHeRVEcONle1eEuFsTXvgeOwiXv8wYqIpSjIfLf24H2jWuwONTK45i0oEtw8RkREBAXoUCoY", "TqFzkCM6deAjK8VY1PhS98gIGD4iNtFrhUoQe8WGmgx7mSfnrK", "DyQrHf3LNQCcFu54KjCoxxUu4EMhzD0AAQ1P54iTTv3in6k7ovvlsNguZ0ZYEZiM0jl3mTUDOYvBceGQX9CNWqH3qqb2OHOOz9PlduyzQrB2VPT0ZdN3Te7H", "TiKp0iDzqaiRUeQuVbvz1MzYzNbQzifQPzFNgQMU12vTgLM9vH", "6ud6SaR3yOmdn9d0WHRqlQsgrW1DfuSmo5qGdFKbb4FODqNj7mZqAPW1vVDYQfIEj8TMLnyxpBJ0zgj6SGuafOcYtp6HUPUDVxYriUmVf3VeiCi8Qaj3yLbp", "8f7c4ZoYUKNCo9hRAA3sMj1mJkpH3Q6B3Bl6iXeCr1Of834GD7", "9XqAJ9s8OvWT6YepeNNIXEHwsNxwb92kgss00k6Odbrj9UXlpu1M8GGybEvCNvx1nn1lY6A9fztmTOXIIWfQmvNN7GZSBUUyITioXsxCrowJCTbUzEtj8G6F", "Wegh8AdObLC9BAL1yGK9htdf6WOEkTRG77vDFXcrsmy2wH3tXN", "2FEduK8IWsjy7q302HXe6QQ4SLLTCtqC62p0NxGto0ptortq6RUCptEHCZiOQYaWaNUvJln7lc0ZRtQXIsh7jvMvV4JtatQ9Hu4YdrfMSdutUKRnA8su2FpV", "J7Osym1Df5lIxOfP1ZGWrhHzo9rqOfJgmhYkUZw9chPX64u7bB", "bQsqQe0HSMwl0iRWRv3N2g2PB8S6E3HnU7eumc9Cw6wxmNRDGTYI7bfIh7OvBfjdlLVVxehtkdoV0EiGhFWoqC6XHTRQ6A3rTYMQB4Htf4OeI5uzKPn8Zrdq", "K4HPCIGfrd30fLtIPIwhNpefCPnlGOZZToyd7CJwnKwQfpj25d", "jSQL5cksLzHtWihSLmeciSxcqaQXdVBKwbg1COsXN7Otp6J8qyjZOe9EEZmp5vAzUo0gCqCYxaPkejtVfa21EBFQlzEosMlNAj3KaDsXoGISx9vchxdt9qJs", "oVegrP1183KiGAE2QUVNdQxIMaBVRSNDyztpOtpUw9BCJPFiti", "5U63kSbvx0NIDLF5Bdy06u7H4QeJ8VzCx6DhYocUpxk0H05Sb1QhtXwyvYF23FEyJRfpDFJ0B21S24sd6GJzlDvgmBinOumhLPWXdqXmsYEsd6ThKmg5yclk", "lSV9MFqgfMDGAk20HEsuIKZc4Dh2nQkYsGhDVVt8q4MymMz3ap", "vs9USEi9EVYz4QFjbiFSr3WB1HY0K6oGzvkP7QXMw5LyTYh5EuV3x0FzHnxbtjpqdaGk0l4uqNsHvaMASqDQqQN7DIg50Wvd49N4sSxippyjNIrq82EyTb3g", "rkjrGdUKksMdIJJ57HoUafKiiYhB7ipxSZogCJ0w9LZPcrUj8H", "EiwWRc36l8ob5F8uvIBuEIFmfrd9ZjQnSLHtxKxhTjGYyOQugZosr1cWqDePx4APNSGJmB0DuGktcAlGiX8ZYj4OuiorkyE8OSP9dNMYd4PDDATvhZUDIWbD", "EN2zKF5ihSrJpCpSGEfTM6M1fpEwLn7a97XTMa9221LrBAHPMu", "ri0Djd2xZOigwroRK81SA1TTscd91z1sh14Oc6LCS2qOtcnCloetp5NfhymgynZdmd2PhLZALPWF0KRj65cwAxZpwMVs74TsfTHNnoV8B1NBJmuQrVKzQtoK", "DKCJMeB07QNsEq1PpMb99TZywtwNkkhy2sHPUQPbqkS4aTTPn2", "WuU5tQwplhXTdYJsxnIKM62oAaFbx3cUx6XoUUbG97hkfyaalqu5wus4U7fP8Ft4LRsotS40ZjkEhIoQ8gV2YN62TjRbzJfKiW6byAZVtHhYZTyf9UhfplhI", "U6sTNVm51sex1DSsU9R1cPgjrLOf63vb8n2VJobIfDGgRiYtqx", "tSLZAAtWpxajYgWZBnLk60wKeN2BEs87JRfRcYxPVV82BdZLQu3UtzoXKpiXfpewGHNsnJIHoOHy1qHSkIudIj9aWr7Bek8v1Vlnm14bQLXRBmrt4kVKTevz", "T088kG1kkmXWmb5AuaZ3MRwR9Pja3cZXdfdLwe5gOaAA9GI3qs", "6BH3cQQJ0UwXzZCau8EymaYxjiB1j1tqCArmaH6aj07iZKIRQUND5w8mcJnLIf9Tp0FOGJwzJ4iqMyGkTdvWX3G7K3Rdga4UbJsrboqsqWhATvvuYqQ4seBA", "hanMBrqk9iZiUNaLsFTLAOFhDdl5HuFwV1Ieq8OxqvfJIEeAT7", "VcUiJhL2kcwxZPyr1nyPkoIO7bcjj3pFdHvwyHyittdQGcIIPEf72yV8X5pG7cTktPfrgdXXUByllE18SgDSchY9mOQryrasGFhuqDSLMO47c5D4jQUM73Vs", "PthNlHFzWxsLAKeWiibIloMUCqqKrKAGBreu9tudqkyy4aSkI3", "21pMW2CKK2cUImLwgSqY4eI0bKb34r56tsSNsdfCfIex4ysiQiHUKXVvs4xwv21msT9l4pxj5af7YXpwD4PXcsRSwOOpOPcGrl1vYxddXGk3nYzyaOVAEwcA", "I10eOcvDLu9urkXM0GPnmNlMjEVy976P644Tgzg0tpujZR3XfR", "KPo3kVGFRPMYmRcquHpaHhOBOvaRTEqldenN81cZQx7AMi1GxooETANr4vHX95Gni18q2jPQgVb2BcG8O2KsDhhHcwmk20Vk0dY2MxT0Q20bcGh0H1qUgYjJ", "ST1URWCR7kUUgvU4vTeXjLV0LMS1s9IKaJn2nxRvitPMorOhK2", "C2Mi0h2RiuYzC9Iz96vazdUMxGDLwWM8WiqWNqv5iU2vbJskNnIMOkiJztfvPz3vhsQ4iL7RnAKOTA6qyPAK7se6lHz9G32vtSzZm4yZCIydR4RPRbhZTJdD", "abMoeOjVpi4bl18xH6bi925acn756jIfKcTw1DPqtRPcSXakc9", "Sl9YJlJPpP652QiWKjhjXaAuDbPlL1snkzJ4lcRY0Xd2vLWD2DwXm4Rxfpg0qYmbX3dGg2oeZQgSlDfoOZJAdj5HYlFOH1xn5Y3jaqN9G1ZzEElbn5jPopgM", "Yviqvgd0CehnS4ug5UgIiRtUUatIPXcwSLmNzNLB12yS6t8ALo", "S1EJVitM1HtbDKwxhtK13J31l8suIBgiDuzgds3c7uDIEAFu1Zv4rw4c2uUI6B0H5zxiqyKxtWE5eTzf1sksnmSpgx8k681B6zswxArog5uKXryYkgOXSqK6", "lSrrZs1frrZn1ObgSV0zNyV5eta4huBRN2GwuFZk66X8S6mucm", "rxjM2LDcQtWZIrbYlToKDsOiyrpkjPVbMEvMX7wvySUGI3m3XYMiRkPPZC8JbdsvrlHMsDIodk4vopxJNJzm3OAbaIu9vk2kVH6OSMC67Fzt2wCPF9AHYKs6", "ckEVUGFzYJL0gW4lj4elyo8CxIRTaHaA1ofT4sQcCkbsEfdvhF", "gg3mq03HUdY2mXoRysIMTU42MIhxDNCr1DerBh6dIcf49TU5KmPlGUnamUVyrfpssTh38nfRPITWmxZ4hzpvTcTD4yBub1kTUSVbF82dQT9APhE6g129dTMg", "QYa1XIVzkyay6aZW4ifTNtZ3vZAW1VCR1kSY3vXlr8jviIQmz5", "DMylOtIYOJ1ak2JBaM667wEpru5Hf4MsPLblCuJYDJ9wLQ5wmB2r7Egx6kElmbc9uDu47CdJVkDqAIkuRklZwQU38iouHQ4BeyEjAp2fZFUhXEbzxKWti0wq", "glly9p7llLVw8VZhl1MGGxDDGh6yf1pMmYItLNf6j80pdaXMbt", "bppo05U5196oTqMjjf7MmoUmd6K8Su03hpqisKnrRrgvh0cOgjjQXDABHTHkNHl46bkwtVoLKUE1SqO8a7W5IhEaAWIVn3XsdImWlar6255VuRbUY8XpnmNv", "GfQ1gxtJDgoxEf3Hj6kdYL54RctCME7arXcYTVpg9dbOHed0jN", "bHggJ6GBIbPQBHvnnOHc3QEemVHNT0k4FPiWVyhnZ7BlM7W9VnjWCv9wOQKrO2tbRb7wYpi7utqG0NNUA4yKy7HMXbCtd5U3fcxDPfIJX9XVUszcwwxu3CFZ", "nRQOUvP9VNKu2dBXki3Ca0oUwjNyvcXg3v5VqSfJpzDqaMNI2Q", "UaRH5L0QJu2oa3kdYa6Bst95jjQ50STU3uj6GiWXcWMAZ6o5esHWlQaT90Y7Q1cTuJZ813fdZzo85aCiSTEDtme0kC8BCic41AC3DpenpQts05YSWlePXGQG", "TWRdE3hDBrGPetARJ1IK5qkbbMz7dNN4toh5pMI1BXOpQWHjVX", "1aNmAz876lURnLFUO2og1zBNnbt2JPZKxw45tDCxweOkzbCNe12dyD1lnun6HMODHTIAeT6Y7UG54TSgSSJQgICTBzXSMtdbMwlyNrXUKnZME02gSJ76cJZn", "G4DaypBIjvH6kma2Z8Oo6OSYiZfIqC37FEfD3rTmmksUURX4Xv", "qdKIB0qoIg1JlEXRRbGsL0bEU5d19AvxnFGwD4lVkkmUyJtNs9DE7oQbu1b1BWzwjDqwHZPzJ9TFSMaJToVacvAWujW3DVzwinqxNDweMQumkS5EEampTuJN", "dpQqKNk0BYxYjuC5I4s2VvEjU1YxtsJXhhL0540EcymMqwP6zF", "8UBLBdKiaDatkFZ4Fe8GsiCc40WS6ThCvqX7Trp25NtncSrq4x4wgGWiG1AKUqWOe4V8vI8yd1kDUb3YZ7TDLxvZw4tPuOnYSGeLWmI9o2MGdOmATFLpBHM7", "JEUDcHj4XON18fAuhVAJrxRKAl7J0UPJgtUIBDMgZhigNqa2Jj", "JAgjToUY6U2VniOHyXSIE00ugLiGN0zf8dObQsAWMAz7rNMpto85o6xURfjmfgRmKnNifVEzeB6VYQIPFOU1URUv5Dgit7UBvqtYJ5YxGcQn3hCG5fHa6jTB", "w9uoFMx8CrgWuCRBpswqZ64clLCs5e1zltl0Ej8QapuS1MdoCX", "cjegLP0WF38F2t8muMV0l3pfVpz7bBeEsIsEgsivvqAwjHibbBcMEP0hCzoo9R0zhsBNjtHchPYRgE0IPccd2cJCa70hYygEpsbWjs8RGhqwvqCJTpwTPFfx", "LeeraJ5P9ftsV2Hlj7gcysvRfqs33V0M9dCiuH53uztQ19BiGr", "KEiEdN2TQ3zPQ80couruvmtmCuvLcCBuOt80E8TdCS0aZ0ANu1HnlAZx4THefSZ1Jf1XoV8yv8YU8iq0j7nVGLQIofxR5WSO9Suxv2vqBRJH99IrE3KUOinA", "OkbTE2qLSkJNkCBvcUBjbTaqUsKtZ73vpdM1dCN5ueSfodaQ6j", "AhAiXfZqW8xZ3lAPmna9sUlI9aui00R8fcpBHO1nUwKXhTuSGUZ7xLP6vJmtHE0vop63B7of18AjZ49oXivU1IYwcLorXmmLZsOkxCPzIZgqbpe6VZaXr7RR", "QDJxx3IWueGrodo4ASukFYql7PGxWhOwtftqh9NblbSZDFdNhY", "7x6wgCLw7rbTlS9cJolePUFp3Q4emmCrhHnLR8FYzq1iJ8Kaw3ELXRBasDDcxNTeeHx3PCbN3b5KjOseR6xzV6XLKkxH8Pukgro34NO5ySNgqFIFJFEmMk8e", "S3taSlJ6b58fSWiPw33kIL0ZaELuwRWPVOzv9G2kLANme39b6C", "JMXJv5YFyUgSt9qr5057iPF69r9IQEUkaz3U2Zhy2NRtXHiaFofyBu2Kj9aAN2sw1vQ1V70VSPOxe7XutCq24sMo1wwNwoJvhjwAoufGJ4Ey9js0wg2yYMkX", "IguESD7Au3KiyyxF09D9s39mj9lFVTll8fxar4ij71S3zNJxWU", "6MYD7FKsTpJEaRrV0iZiSehsieDzbhTf3zqAFA0gzKuXjl2jSbQsG5iwkvvJcMzdMnmZykFv27TmsVTI5tAJzsFhl80LSxzmljJhTWcUd5EUZhmebvvYl8FX", "EDsg9pRuWkb0HDSsHgMqN7Sw0NUlVhGjv7N4wowTXVRogtexX1", "nu6Dp6aJr3z6msD8u9woaTJ1FzsuvPtgIxu73UOsYLyIDBQ5JLttmCt0Ajs59ljPidUj8qbeCYwNjLT2gMwQXnQfWIid1R2h5WQDL0pXYjuH4NIiiC7FzXuV", "oc7p39V8evJzt6URqOhskxZS9gf6DZZz9gnAoIHSBYP5ftUVF9", "Lz6uRDa6JmdrjmXWvLoCl0k83PzXsFhEEl6ezfiGPK784dfzwRBiRwoSJo0C1fOFOSrN7YcUshdwKGuHf5x5zjXHXXRYAnmZFbuL9WpzCQwWeolKriPrSw6x", "SXWaKG9Xr2szWgyi6sFjgy3YhQN7KT2kyYLGmSlcUebzIZhMSu", "56t6cYWzfpQhZMEscyLMan0BmGjScBMiFFmslHpO6G6daIWBEpXpaVyLlhnNq736Lqy65nVB1ZmcpIn35IsenrzYWmtNrxTClPJqAmzALlm82XB7n2lari8N", "S1kKwBWfanTjZStsEd0EAAJxC3V3ldOEc9WXK0AtoecL6VCI8C", "WGMqBWtgZcHwor5KMNLXG7BqSFLeYRp2h9qqghUDKl98bETxamSotdfJr0yPQlP7uGwaxQoFAxOlApgkZ9WSkBlbAhyaSOfLcbvX2hnCd9vnwbVVi1vTBg4L", "M1tmPY7z81WAiHKLOD6KoZnVZiykN03j1wTOSbNaasiI70cWDg", "o0EcVnITVfRWMTQqpsPBTz3BFACpePWTNi3sTLLy1lSLEs91kWCDTFNjOXW2w0TKiWABsU7rFZATRKSAqfLKui1GFXHAWkSEHcQ74VyJ58kUQDcHsyZkeazs", "5G0b0SoF2EM7jIOmP9FpMr6CpdwSBvKH9KqAkeNkqipY0EKPNZ", "FhPJtCxne8hwNqECyyqMhh2WD2iXQ35diSwZerNJy4DJsSVrOMB31DaEDGjdKmG0EBar2x8yzLIrlngA7rD62lIG02tKm8KzJuqJpwGmHYe3LIBRAOXC8qS8", "qKQaQiZjbN0QJGDZopc87lXF94QFusNiAlJaUsH5EGTVWg4JTe", "PbPwoXyEmr58ZFtsoNj3QxJuSqYV729WbZQP6OesFjypwsfkDOmeJ5Wkv4F26OWfvw51JhsYOoLKgz3sLpUdu0No4ao9wLmsFrrYWh5uWODCLG2h3WKvWfjZ", "FWgBpS14ItboYeh40uFM8H3BmN4I2mpFIVQ7wQ9EJk0pMhuNb9", "jhOmsA7vT9hGOzkm6gCFuTyuJKaBh9KQriAhtHcKOJYmIIXMyhaq9YjQqJbYSvwHb7zSObkntJX9Z2WYk4Mrc5HQMsynlt4K03nMdV9WmffMh9sPDEGnIVEe", "NAP61UR1VCO6fVcSAGoqNeDZsUK8zWlLhAPicoi604CeZn6i1s", "WOWjxMBIV9oGSTQrA1gq7euJIR4O95EdUkNP7WfafSq7tEz1FdrKHlcYBgwKm9wEtJbypFYThOaabXco8R9QBlyMPse91aNtrxrfCO8tkgRLE18KTHkc0gyN", "XcXWDuP4pFj1bpsLWKfiJn2k4lM2PKPwxwT8pqAe3ueehW0Bof", "t6QuqSdBU2TrxOmOWbEhDGZruEMsQAVHGv95NmEpphhk4T8a2MFDcm3V1PNRXtgmmqpAc3zPie9m5HL5caJCNKhMh3lEuRygHnosqoHXSPJWgebGFuTaC8ut", "Bf6364kMsWEgKVDluVHZ9spMlGuxPopYRvaYzIspo6U7ZfsSA7", "1Kxoeg5ZcSLRynMYJJqB7dHbkoGcGPhFhc2LJ7svXEMT1g0KzoT4RifBWullJS0y32JM7AHcOb6NF4fCs8HKouVKoF35f23i2L4AVJktsoE7stIl1Z5pTY7G", "n9LTBN9DiELDV64MuIRlBjWAIZxk520tBJKMgRaMdvZ9zbVsrw", "d0g78we5ej6caFwscaKAxx3U636ZtvUWw8b42F8hyCJZRDR3ojBjhFDlGHL9Dnd7vE9xTHcPRuyt7Owt76coJoYZ3rgEeJLZVTUyk7NC1K36ix0n3aaMM8tQ", "zZcdqyALReH9jfJkxMrfKpQLN0ii6b659igzeoJ5TaDADUvApk", "n7XESuE8cJigOrP3o3r57IgITtmM4Z6rgd37VIF6ZxmxmByZDqcK6IcXAOtCwx1cY5j4Lx8usspd4oAHcmZi3BGDX7PT5Q4dVnfoinibgYCiMMxw8WeBfsMC", "0lg3AkgdVMSC98nngzV0JQwRwZbbRxmPjQSrA7UdTupa3aMjXp", "iqGeIADtkfoW2XwTM4arf1lVbm3vUblCR1qhB4YvhNPhsLAFNk43lnWLaZG48zGY06FA8o3n9TV1mfGAOKD76jQgGfkPeyxd2AnBwoy5HR545JETcPYi6zOM", "c6jE4er6ncFjRCnidskiBy9nNiTTfroFvVTzAJ4vvJeKVR19Hl", "pRkzC5fgXKXJXTo0QwJUrDmUXHtYOBICa2Bm5oSa6ytdPgdpavIQ62udHlAgwSqUS1HVpj6vfxW4b9sA28a8AUkRFu5AKvemutFjdJcGF8LqGDyGJYPT07uE", "10MJvy3qsIXTc8jpE2dSFcjWA8zBFuPEsjVlhYZZq52QDmFPot", "s2VbYdhWmuOB6Gsbza9Z9xeCMpwZCiQ4itdFXIlJA9TGNLpMvwt5sVFEI9lVrCXY59naRYucfLq2eeMaaGdQlqe4xOZoa4KdD7Efd6FIR3I3hfbGvCge2Jiz", "hFmFK6sXC6ApAN6ZROd63EKwRzbRIHPxXBCrF2OR7ZHHwNrLjS", "Qlgkf5hGXzWwu354uI7GkEpzVkKK33mRmRCSWrg1pCvjFyo7HvOz7ByatGvxHhO46YUdQAcFLYwaWignb4kiDiJ7yE2EtOIyvmbJuDYFjSoGBU1mYmVlSmqP", "ysdpHtnCdOVXa1nJRbXc3XNbHqKhcB6a1hPIaBSDXvj7uUPM5u", "y8PJhe9zMl8QJA8hQgstsPmbVh3s38mzEAJtoSqACzbT9hAXL0ODOBmrspjtvTs7d9ySapako9DvqMSCKrNi0AZsxGjtkZyLjxlHmM1YVETKYvUtkrZkz7ax", "NJo5rkRYhCpRWoz00SKZMoS6dzpb6NWUfKXW4y4k9rBffBffbx", "Cxjc2NcpyiCUArmiNoePYnGiRtt4XU2jQlMS6yH2eTUpJEVg194XvIFKC6OhbQQzAkREigFL7j8Qwd5xk7UdPixZoMENkfMsPl76RMRX3ZvzAyus3PWT5T0t", "nFHWsdOFPVLopkJtHFqRBlKF8ogDFe63rLXjzvzMRIAE3S7Kfw", "kqf23nqjy5M26DOdvLXshyApABHGWuCElrGoc6WY9saE3wpyHMqyI1mTA1jewvsfk8RKCxsKnSYrPNpekeb2fNTpMCSI5KxpRP9dKzx8STxprkTZO4Z1P3rm", "FJ2Jby62LEefDZld3iSsTuRpwyrK1g4Fx6YY2ebNsD16mmjpTA", "hu46jy5aI4GMJDRrkTULrKWsQIc885GnzIuhGxHX1WtLjKATmcmdxIVLb5RhBhU8zMpEJ7lLbceKxmmjPWKMnnfMs733oVAosz0B4lUfN80ItkzIGJc14HNx", "OQyDw8zm8xvAiQq3WoMPYLfmdHofZ9cvaZ6Uh3En09yiXmk4a6", "R6P7q0OcgvmGrKpvmVz0Gx9CehyOjYUAcrHTse5WZrmOBcIx5HvLC3YqkUER1gbdYr6OVCu21gPBGh6Lw2f85BznfBCgsnKOcOk7Ye8aIXjXEpqApVIsgFdM", "Rp0JbIfDhPJF1RnJyWoAKfK9Aa0rqdBFTBW4UBH9aaMZzAsxeh", "5wMN4Uy4JmhU1AeXC6gUFE2bn2jdxMK1IeOK7MOQ66t7EVcRbItoUtNHt7vpRDqjqE2xZQLfUElhjN6Iex68qUOiZHX0ULhIZjD8AZmcnXJVsPnWMudBOztv", "GQvilc1IKEPUlB4ZgO4Ynp38jeJ5dC0ravXLWYbql0IW9M3pi5", "OWvPee3vie7iThc006XbuIcCmjWoZFtvjmKLPLG7xNnQ2PQ2TxbNDBXyv4mUHdN0QfJp0ZwxujNu7lwajVyuhTscXc4oGRme65T4cN1W4MQ97KioqejX7Z7f", "CBRQcC4gHVkuqjOu5p2A7kzxOgSVDZAPkanKmpy1Iiv8RK1U73", "dElcA9GceTAnrsLcD7SB8is2pHMqkRrNdcxnjDONgW8VOT8baYlhGbj5q3taSix5Kur35DPkjXF7zLhZtQE81xBry5QQnNW6GN7LaU3H0JOzc5WWTlcUinKh", "sk5e5biLwpfUIilIzAHcDn6hYg9FTTuKBzyHZeaVRFyjwj1trG", "V34ZkaFrphJh1UhxjGbKj2XhkTPjNG0qJ4O1ebtSIA9JeoEM2pgkqBRYfoH05HoMJCOwmFO4PVM1IYNKM14ADUiqIzqLHciYn6UZJqbiMvheU5wq4z0FRi5j", "ft3uWlTHpxq8oRo8NVkpYefddds4Lwm0ppvJYMaNJOT5oHB9mt", "yJYbwBEmEZiyXWlQnJmMe4k77YMJf6CdPiEJuS46zm4VGpv26gMki6ppd96IFHudz8wrZ0xYlz3zoxzubLcHQR41aBHoQBRNILFrKAN3AP2wM2pvLRClrGmP", "P4DnFcBXwOMGYkJg9JdTJQMfrYQgmB6AFHxSs8yoWK432LjBeK", "cykybaU1EHCIPPaMsSTqEx8I0BbiKF0vBjtkHMkVbuo0KMMCmn00l8GjHrRc4QXE9OyQkgtLbhJv1g5nT5lCB1wTqN3tlY5uw1KfiE0JtIEtyHgPMQcVPYwE", "tz7fXAXSBq7t25AtNOmJfRjzrJTGpPUgNZJujrMthRkjXvcuHN", "EvovufCLt1lMh6t10bqLUXkEEH9oAPBMKxFCcRYUSHq9Nj8LKyemTP1fe8UoVd8pbN2BoYfGpTOADUVVTAIwXHcBN4ytf6iEUiOIG3X5XvDiPjDqrTlOkLX8", "NV12chF4QdMggrkBkxt8e5yTYjpJ2NPPqOQS5fWTIr8wiq8Tnz", "bQ2XtbFjsH4Hhud7NgmrA2gIyP84qt2PH4wBdBsVTwk8qLFB2z1C1hSx4Y2sR4Hj6CskLkDmgwuWH7gH6hT5Ot3RR5Jr7bYBnQv687tm1nGGvwYzd150t8RK", "Bk9GJhR45LBBQ4xRrEhkAFkmFnm8vBQ4taKDFlHJ4QUUUSvKeb", "2oqmY3ZI9STaWN8oYLYnecE97gZ0yDb1zQlWTJoblGBGbH49ccuFF8MKntKl6wm3KWXnpMOYaXoBmrINRCceJyy6pHrvDcwX6UIvofTOAGXv7pIW1sBIo9Od", "QEWboQ6uuNpg0G28WZ3bOL8OBJgzQ3cpH6O5XTxPqm6q08wVg0", "64JCQVT5Su85hN95SgYN6M9CA7I7cy7j1QtPtNUMHaPwxY1NFYkLurV3zlAbkFIjdC8XZdtoDGi9ojW1FHK88pB5ZJhJYx0B98ggjXSxnA6asab7rwDyjM3I", "fiZBgZLngzUPXuKI5OsxzU2oOEm7aoOEWvNCTi09gSYDKtVPFO", "KEqL3CXnJ7bfJ8bhI4NGB3ijE1aiQq4j2u236ZrNeS1yaadrcy7n0oUEp3wDr0wtsyxwXmICEH8nrleThjEhXiuMjoaapUSfRNaw9q6L7E6wxkNfUbKzHEM1", "3ubqO1TpO1mXrsry5xs0gFd8qy78AR7DLg1iiTV6UFcM6RIBOB", "B4QnCFlILvjS7586loZGt4WVQauglIruNIhXXQpqKZIPcOVND5b675ZVfTBOl3H6JwcoLRefyw4YKXtVaVbhYACEbOaNRrRim3W7VAkR4o0MJtsuMRbvcm7D", "AhYZX0FH1lOUt6wvuuHBn75AZf39RAMZpt6MrLbs6xNx3HsxB7", "7yDC6mr9vGJFp96tTxE5oI0BF4Q5zbB6XOJe88l1N5GACL4dGIg4bhDoldskC3rkP8MXE7YZAmkK7oyO4cSfJeS2HKlUNaCmiYHufpUqZC8h0632jTg0781N", "QmpnM1X2ZowCbO0Aa9pYFsbwMFvRNwonidY4c34Bp0OQNMYvVO", "UjE3dYIY0dUmOAOwC0zGCmFYCcuiXO6z7L0ktIJrtleHu2B628LCuai4Abnfztd6Edo6u5xnrb3jbEncN8oHgXMo69U505BDizJc5GOuqRbPfO10XqIBLc0R", "lSUlXfyFcFqfUCXKd8hGXjH2XZDs9DHufldAOaQynEcHQ7Z1GH", "Hl0YlX5yNEAc6nNiyjIMf3aFLyNuzb9GM9n7eq315Dd9zyrvf7HLBpYUnvOmWY0sfnxKe1JhCxo9te4ZlLsuAQOvMlhqHihuTeE5dYmoTZxKD0twLjrU8DPS", "w5IDlz8EcKKDq41HdxcqxTlGDciLn6nkB5vw338fMSqAVsS8n4", "xiXiyiIf35lqnwujqvkyY6POHuEh01lxjGdgzvL0z6rm0jVqeGmAKBYZ5nG6oz1WGfCDYXDXb2IbjnPL1BVKL4tQr8Ud7U9L7JYfqkBPmTyWENpEZLYuPPIG", "XltdD1yKKVx9D6YzXXTmsJ0PcWH1vYFRH64U70mSTjZgo7eLc5", "7TM5syZAxTiCuzJwRQuDqMuP2iVe45i9Y4DR1mZyDFB7CS1dsuohGi4IRZvTddaBfnaeY7dlMmrWEs94mxl2gqJ5NCWyn6AQui5SogBAS2hgvoifkUgOIxTd", "7zcu3kKxQPNE5ZNVb29Uqs8aKmwcjPDoMpiQX0LyOhARGXxpZ6", "IOwQwGAtqtG4hbrNzNNKJlzTDFz83WELuBjpPtgGkwKPX9kUW7pproH22GA3mMMfV5UvwABe4T1acl49qrwfgDhgTrhEE3tj6Nc2VneXGf7rOCyC3ush8ZLZ", "P2nb5gIB1vBUin2xQ7ooJm1Ler2kOMKnO5OSkfbjanEGaEDzLz", "ndjmyOby60KQnhUA9EpkvNV9d4Lp3hmqIWbGsCEyAXNyEr6L3t5yGb6tdRgg6TUOx5cpGplQM8MYxSt0LwxZV3R8S7oXYJtVMWIaL41fALB8m46703hU66cX", "DR4kixD4TUfmWePgzaolctrbwW53chan6cXoZlt1DWnjABP9lC", "tO5kx1G22qjadqCBemuVl71YqBhDJRNCnSwkSAmU0V3bJDmwxeRijRHXcwltN85AZzu17gT5AUhTiRPf6pOnGdLqZ4kxCn7jn0isgCyqefIM6h2AUOyk1HbY", "LLVV8bFtbxmF7i4mNM8R18aWUYGVnp288XdF6s8fostvaxhvJo", "LIuvoPR3sEquMzQxEWqMAeD3XlyFhF12XvvKKKNDYD7sAXpO2djAFwBnh70MM1MtuFBDZWO7kTxszlHzM09cuINZPLulKGcEUoP3Kn92H6vGpAFC8Mo0e9Z3", "URmoiM0CAQDTBMTSTMgIWvSeHEetNCupdgbJ1cT90hcB34cUQI", "lvEDXTQALnMFdxuCFvoi4mNfyPjYr7qc24oaWCirz24azwnErZvuKGZGfGoXNe7OhtwD5e23g4dd1OsqwlkG1HWhVKCryJDfB9qGnqJRtv4uJuiFfRTfgzKC", "JW1GnEtyNiF8WWZPRbJjW0w9RQm7P6HhaIvOWoKrUXz14WQT8i", "Cci9j7ZWEwcWbBoWZJJrAnPAoReDumt5MbC6gjcufCOHNDluW4mes9oeYTrQDkVaJfexOGs2QGHoR2gv7QaxZMb7nRYz91ZRhBO3PG5pVMbuPIoUiMRIg2NU", "TtTbt02aBQdafhN83z2QHoux8LDpMbJnSkOLiQtrpVPUCmcFlc", "g0RYyZsBOEkfzDNMW5mQwbvL376fKpIyohXmENvdbeGYpcuLhfjcEcvIj1v2pD0dsVN7sIiRuw0jYs3EXmqmPj26lx8Y97B1cY8VoqujlsSJlTXGGN0d52hq", "0qM7vX8X5F0t3vaol18WUfni1lL6o3umrGtml1HqEIhIBI6uHE", "RlsCUrxnxjopTd5MNqMfeavJs4ZxyqBNa1Z2sVnpCccgDf0bTMG7v9PlDyiBnsZNt6PmZCZmmCQ0pQZJlpOgwnP9k8KX0rurwJdVTBFGLdEA4nTnasRWdqfN", "wxuunomj5NCXYQlr3z25kTsKJHox8TK2ODx9zjs345adVLUWKU", "c2ySMHkACqbVsxin7fWxiZ0ICTbe0t7cv52FKmPVay0TugGzLlw2KxKUQw6OpDylG10ZlO2MK2pCg3Bzm8143MWRGbq3oom3nlaZ9cvRcieIjnFWtHYwb5Mr", "gCuSyhTmS1LZbEyDwaTdOj9F0gAblWQPgIpexJOPIhwuvt7pTZ", "TpGa3GEDpzjDMPVC1TTQql5lf1elo5KFtaowo27b0ooMDHWCkxabjgKMfy7T1PhsxVmjXtIXh6ssOM56Kdf3JzNyvVQvs5noaaX5Rqd9uTzGp2N9g0Ax0Yut", "1KotNahxAD2Z1div6gCuiX1OXCMVkGPlYBcvlIqtTqTUU9PYpZ", "QW4SuceE5MSS5yefrNxfFQWis0pIWdpx9uP1W3EZNg2Sde7U13AGRewKekcANP7UJWVnXjNsOPK11QT2TbHuFBErto2EE7iXcCJ7vg0H3II4ik4BJJ6ZVIOM", "7ObJWJo6T7DPnBgoUxqCfvMyEQVhiu4nIf6mwtsQ04nmDRahOR", "s1KE0YeVEMPI8gvESp5JD6L0qYQQGmp8o7KoeyHsIf8QL3dlqi42oP0eyQ3CDqIzycnca2SshaJ2bumRcqTPEU1As2M3tc2pEpPmsreXPva0nMPQArnMJoWB", "rqFiSHXe5uQvj3S8w08kKV8VMvpdjMnaA0GdFnFKfgDOjgWdec", "Nz8VSSQH48brgmrxN6kcPQGcmxGJbvvys1SKSqZWyBLfxAcIEKudiBEV8SmjLfgDh6V7w5btEwYB68TKQLw9W8cdaOKu105i4bnzeOssIO1MUSfunb1IhdtF", "zD91CFhGoTFQr5G8THUxh9sSiriPVbfSpoTz19DncRDRWRZ0g4", "vNBloudWJ68wYvj0si75WjWh817iznkuBvgznHT5NZ1tSirKRyOvfsaothUsVEne7Rbtg4y1cxu4ekN5ilyMdY8XGcNjoANtZymF0iGce9fIt2LZnJvOp3t5", "dHmRP9Jz53C4mTeOaJeTJz24GwT5xM9bbv013J06NCA7dnTD67", "eO4fSKZvNWGW5pQ4qTNoXizinaTGmXLQvP5OheH59VbELzI9Sew0Kvg6V9KFegga3jylMDqVjRh2Py9rc5pu0T0UaLjFzNp27lnTwdwd3dfSbnHBs54tY4L7", "N2MKQ9NXs8ymkuQlX3B7qSGjVKa2Nt9ivT3LaOqQUmCEgazCe8", "HSbX94qj6DaFvWgwpGIegnQr15RzF37UUg1dlrLp2v3wPjsFyBrewFTxKtuXw01Qg14PqNFtIIni1fvxokaiz3eIwYprYrHDqJagepZx5Kd50W2mGcVFg7Xa", "fLRCAhN0yxgdnEYqYBvWfyHvYk8CrgnUzCg9t39s1nVmz3aWCW", "0rSHk01sDqWyLVAze43lu2XNmWOM0aq1PII9HI1S6WQR1aRecSNWSutCPHYPpNQEdhLuxLK3rkTqJuUvKsQmkHy9XUXMrvZVcsNXDib2Q4tjwLdGD10wGy5n", "Qc8IWhl8X8ejoDlDFcuByVP9WP5nL9Yljg1FLmMtt0chDLsSyn", "buI03pN7aiG8RznTF8Fb18bbomxgEtRpnknoXAv5qBDH90kO7yx66WisIdXUUyHHg23DCzI08UHHS0dZyYg24MvKxQmRM3g33jGFiXFr1V6TVk1TGhVL1Ody", "mQN9R3CVmQiTvyIwRMOw4NNL4qg3FJz1hM89PIc9hKacGqXhDt", "bHGycIpGL2YK1FeAM3QyA7HjkXZHDm8o4OlegavzcRJbgvl1yCx6JEp1kPGx9OjDkUqQ4lPeCgGqbzpX9ncRzRShohcy3M9oozEricVsGjhqhULqFxHFNiu9", "PX5QrFEfCTWt30jHjO7QtTF8OULlCGvZl00cDEHOfmFgmyyTL5", "sEW7MvZggmwZJhYJHjWW7BIKs2HqUctMqQRAL0qzkmZ4R5LgorDu3TEtUThy5aIvyh6JfuJQfqS6vnlhfwbgNoXrHEnNm3GlkK2QFJou9Ey21jkedJK17psN", "1ekohyXSHZqWtcO0qK3p4nUh6ogCcZZdDHRuDwKUW80NkMNYhO", "Oj9sOEe5QGexspEJhPE0uk8s5rFQNupjdyb1CE6cSiXKVjcB9qB3YHvd683S2sBfplf1zjcRS9kvtM62AF3iVyLZ5M17FDn4yQ3v9fKZn4VgOZgYnhEIdZpi", "wrq92bBy1ErAuBkhEDLakz9XgNnJvb2pSqySR9QQNFYFQGueTD", "DCCKjqfV8a68NWyLyNSMnobL3zcwc39pFK9xAoQGNWOk0K4whWISKrmMoMGQPPDdjMas906WUTEUnIQTngt5VfPJ1fkP5x2mIccRajv4C9YxQwQDcIG7xgQx", "L8MO4MBMwnlWUgYgn4eB02McKdhGJ7BeEV3IrCenxNHS1p8otk", "ytlKT3xAHEFSrTxsjm4LZ1iqTjdaWWIUN1mq5iyMwCnndkfNVhi4jPtA8Wkc114O2rD7Z9SVLFHxxwKSe0VLPMVWqE8rDBEF2PLbWl4qyLntG7Ks5pDT9gzz", "s5p5E1JGQcpuNukLDXCTcWJiLU9S96S19H5OIMegyUaLMLeXqq", "1TNI9gnI9wOZvXqyv6KYkI0KbMdFtU4svP943wKCqiljDZi7d2fNJdguzJ8qlCheZqgck0nagWHs6zzh0c5JFlDC2J2mVhQ2X7fH7Spmy7e24bk4DpNSYZca", "seMMKlOrs37xTujQzLS4wA89xUZV3B4toOF89cxzf2x7xeXw0z", "0u8725bbbcldVX1jfBLaAyd55akaUiYVagacl9CMjxzCUzv7AEhIDIMGs4rNkPqK5OxoX99E46QW5MdDaIUlbq2RuroeEcyH0t5V0Ej4LAaOUBc2S4m1uoSm", "dFQrpM8qGDJGQ1Jj9r7d1hdTjPSdBuPo9nfx8lnOz4cN5t6ElB", "pkrTDaqfC2XZofNUcVDNrCRRXVLdh4nXoeyzEocOo7ydmL5OoIjfT940ePeLRRqD3oCFdmeRuc2gv73jQkMttQtXoVrFuhRxUbB7OpWGRXuMex34gPvZpp5b", "KwpDbG85rJAD8fTXCOtqJwtzJoZ9dekwYX79nFDfZNsh0KFCi6", "111u1KiYRKAAEihLpTY087OynOI0Zy4a05SzO8VnSfxeLdx86W9CdV8QrPOQNTyLYQIuZnizQdejEZsI51UhUb5L0UmLxihT9xOgj4f7hHrurjCuifbCGhVE", "BFZ8yEZ5Axlt1O0hepbTYlNEQzOeeusp9Qv5cUAmQvdPIe6wTf", "P0RmCpjZUNRKAYi3eLWo7wijLyNQuo5HmU1xIlUk6v4FRnI56osBiYu4WFSO2Xfm0gjGPB0W62jWpzbtmR5UxzWTFyrHUU1SBliaui4zklVYl6PVWUzTSUvh", "SkwuFxMOg2ybk1YTm3zV7O0dry5JS0yskunxp7LUAI3sJbJ3eI", "XlfXNWTSntQlmAdX8QcRumjxd2Ww4AFbus6FMYh9R7sBFVgLvJno3WjgXGdbOsAGiEV4mCBEH3PXY6qRNdFQAx7hDkGZaQqIcLKPWVdlW0G247TPihqsexXp", "flMF9CVmWnB0Imjmk0on5FCnw0eYx9Lavin4uIqO5zMLl67U6v", "H9BTw5SYcPixydflhY4Wu7VHRHNYlRS0abRUet3GHlCFOp03L2ZGA5VZKq73HX3p6UHjMKxd39sPzsTIt0W131aLrfO6DPtHsByETwrX5hw2XNJQOpRPr1lg", "h7nsXg7Pp6bJ2Sq57k8e8R5UGWr5WcmDkX3HBAe1GFKIf8OmsU", "QytTQ7yIBUuxfcSirdqVc7iuNL2j5tDUr4xICvYLNSI23iiuJZOwe6o1QrlVkwzZ1xpBqNWEqmEtSvllU9f6GU7gJs93n9ao6QxunR6bDJUfEEOgN4mbYtFr", "kPsXYSJcsEUgfbHsukV6wtmJvWvRPAG7X8c5ZtfP7A3mlJcd15", "jxzVGs19KOKaUrh6vE0ad7kfsTyU6xanuXGANFIhccG6RvAK9AvkGdN65La9I8xAdBL1Rdg3Dw7cpHxwSqhgR4mUOKeeRZp2i819jiAucHWSZROzH3fh6PBU", "hn68KvB33ACmsLgTcBtBcFAsHnZNCipuUv0or9rsK2fANJdzUU", "95kHx15UMFAB7e68TvHIoZITkfkLdFqkKY1FX4htKr4RW8Xx4nDsMWJ493QkGEUYkWlHaS8sKAKoIrjKewCzQT3aVRKldnILJ3crWikos2c9tJTWFeTe5UCa", "uUMXHcrYfTQBA8z2AZ91sdV6FyiKRuvLOFqerhCW9agJifJqDT", "q56L9LIrfjlY48numeawBjXr2DUL2hmslsDuBTkpCVNEbB7NphIyQnnQyGj0xWqgM4ZYVJLgmiuOrzjfe1d2oPQlfAlagcF0eoW77rnragFPfz4IygKl5lWi", "vHIZrVXTJ4bOvOGT4TtiSx0PdKAg3gOwxfTnA1GS5rq0E4SIYL", "0yIyNuHXYKDvH9YkugjA8o0xnE1FUXaTUqRriiNH3aAIhi0bOkkXWkUHwTWQz4tTtLIZ3fq4EyMvgLV55FaZx2rtTLHSOBtHUCqVrfa5duzIFSNIfxsczhTQ", "2itQtmfLyWro9RrkJo2XGNptKfTHMwiPdZnWJTsGxj448toPip", "wwCkqVPHkmCQ9pzuLJNBZIsbMyU9OAyI7A2vfSCOCOoJDoDX5bgetZDEVhNrqLAxTCq7c0VmNJ5Y5J3AskmjHzxmfIeVbmQ5wEAZEfJZwP82iBAYtxHAuDvZ", "VX25JS8DgIktv4SrTar9k2hdxwmr7hRdETgVuoiY6TR1VuqySg", "5CgkodgYUmFtPRL3uDralx3DwY5kUXQZi4HUhw2AiH15gK8aXzAHwCUqiZaB4zik10EjwGreVqj9Bphgoqxi2RWiy4t13cl5a0mWEb8iRprceXJQNE8Nge5c", "ixdkZNn7LXdX8jFXY5AAcRaxfgKJIPu0MVitsT0Dybl6Kycq3k", "0dBYaoEu6WI0VeVBWMfUZd6IiOHIFI2DuDmSzyN5Td3yFX7ltkGSOKj4iyMvGO98ZtbWpwaIZdEoAMa36oUS8BUq9okNAtWhk7EZ3oqaP4OaOwbTk3vsEOhN", "CPjNIF40KGXL2LvSOH0mEZFyd9prXUDhtu29977RLckOydqMuo", "86NM50TsqyK1fBviI2nPR81BUzmILg6SnUmqSFgGD0Hs9AYRALobSpkunWD6DJYylIoCXSSkQibZq9y1TmavbLpMr0T2Kz03ImDnCeYcK9BAG99jtkcT5Spu", "SGxkEvmUgzHsdpTvwc6DmFudzX62zwxPAs8OlssRrAITxlMuNS", "57gzldWrgTlbruTxIEp9eeJw5EfS62sB8Y9rCdis5SRwMsrc6gliI2cOHHqNIgXOFeFRHxHMNiGha7Kel3N44xSLDGgVwDtBp8a73rTPXi67pOkbQ5fU25nF", "LTiFfZPUfzZjp16MjASWXC7xHkPHnCV6dDMIljlQiK7XLDs2OK", "ZvUeqlPF0APVH2hdJSM2s2MyYgBQgXiFQCuGvHVtRsPiv4JEWdGMeaIAEUYvzGAQQ2gLJAEj2bPvfh99INUwwm6AEe5EsEeIGIbYSoFTNeO1JW8ctcWnNdyZ", "F1l6FNOUgy06mFX7ru8BQHlHrH5Cs1m62VCGtYiXWibGv9Ok3W", "tRleidulpmmZsp523yblT5R4MMBi4ECyfyaMZU7OFuy5h18kxjVQmuU8EeoIszGWvpsUJzqWrmcYnkGkRjADddKrH8A75Ob0DTUVRL1G7dptL5dmpm0QNKIc", "QQhWoJU0kzTBIUQN6FGRIsE5eCUzUmbsCIOybtwMqPV8svTw8k", "NPcZSEjwBDgm6q2SpcJlw99PF1JjxRRIo1qFDZ9OlqArgAHTmbDiiM6yLPfGo6Wd5MqIwzghpoWUynvlO8R7SX3lwi1lmWMrsC7m9nTxbxRZlKI7TiCtDFfA", "vetfADW1NdnWOHTzCsXxDp5eVFXjVArOnk4vvawICkoYzGYB85", "9JsCxORV7ufyJQgNMZvIr52de1rCB0FKJ5UHTtkYmNU5o8QAhLSWPT83SzDdxQvFVNUxHCT1Zw6L2UVinwECNKDpIQTFqMSKkwHz8i0ge61hYVPLPbYmulbC", "A2RyPuI7oX6vE6bsAcXi5u3UUZGOJqaRqzPDtgKgBQbPWCGeml", "MsgOK8vbWCP6dF53TxhnbsECIiMYN8Jhyx3J5zsZ9HfnWjozeVlFNxPdfl90rRgoOj7Sgx1qEfbkMNiysTBDQap3Jy2APgymP3E40DsCsRvCodAe4LrSteTC", "dVL0BHkZLwbJARW0sRBg2LK6f9WYozjPT4PcL89e4kyCBSD1rO", "hthzxM7TtvSaIvefYxnhcsQY4Z0FbrbGiJGfdN8UGa4YUiB0ezfGp5mrfk7EbiUHziwd547JcCp6s14UykinpUeSEjenS94Pr02v28CfI2j81odzYLmLoOm2", "8QqYZuxPtyKv6WaMWIUX65WePGxDfjFl83JhwE4pCMiGtHcNZ5", "vf8PHXgEkJwy24zLjvXoikARy1ibPFeIumhBILN2cJyeNyx7rVtaD31B3hkSwMko9PxPlKPLeO0zKv6BOxlb1kl2PTUJqC7xZ4MKPle17e0RX5bw2KV35E3S", "iXmWhtRHylZLUDMcpM1NRaHUvkVyzZQf4C9k6a12JaNnmjNb5N", "wVxDxsyQqvxHa2TjmXHlZaJwL5djfj6bC1n9ujXieVxCXPtHwA2UiJQ3N4m2lqbvsO4k7bSl4OvbnoqjyqDeAciXeSZPH8K7XMrevHO0fJZQ8Q84ELjOvPtZ", "pSw6bED6Y4iUK4SxMzOSNWWcpD0lauIQKFWtRkx0mgS4ks24rQ", "WFw1rjEpUphlF2yjtPTrNEVpIDhKIXiomcpbM2Qop6X28VlztDoGRJ6hXl0nIib4LPdfP2TE81GEUzDNC0ebJiHoTHbmzBoIaSvxUNBcMPoqO1EZzq8JYP5z", "gfleqYuO0qLSDU2ZtqPFpbopPx6xK9x1ogdeEX0CNLcapc9gQX", "wG6k3Wf7TyGOx53ahF7iST123rfBX5iTJmCKIpRkni8il9ISPO8prAru1U3WYjyrW8CovbYhHfP2oiTB6b0vjqpiKrFsaBi6JsvETRvl6Jlt1C45m30VtnEB", "eR2FakJtcC55ezoiIYZHkcMWfK0W7EhmdjzDRI43V7776tpMRP", "dCzzgeHg8PsnBTV8gwQiyvq52wwqHODuYCsEo9twYjjhDEpr9Ea77QA8K6ybS9W0JMD7V612pij0vXs4jSBqqJyAPuks1EqKa3R39Q5x9nx4Ip81FHr5YoEx", "gyniCe2kfSnnsrkzef3wT9xiOmmwY0sFwdx6FzovPbiGSQF45H", "0YOvHng1hE1ZTvBQzQOnLnO13pRHtXYu3wnKhTJPiKwBD7aCYyzrjOtlBI24nYwrUk9ADTZtlV5zdf99b9yKVp5g87ktffk8PsIaJpU4KZ1vCB2nK15nqBTw", "GBquqY2DQIoj7ImPpnJzyJmGKp390U5Fev9UU9gsPUcUmMtZ9A", "Y6UIKm7Ov6q1JUuQxMXdFw5pQpBHOKQuOuAjgH5aLvZcOT2JqZu3Tzsto19AJZ2iRCR5RWfnPEPlgQ4WzyZTvPKhQTpj0rRR3qVVKAGkNdV33YZ3W6UQTo7t", "GvaEm0goqBJBJXtgAMjCuGFPKhpnVuejpFycDcO3nfC4C5jKSS", "WMhjjzQYnwRPdGcbqpDEryt3337kOXCurrcbr29cwY1apcBfRNsILlKMpR6BwH3n6fOxiWXe4XCt9MXYjPp287PvYT4Si8FplekR8I6CnG4wcZSLwHO2Olyu", "C0Mv8aisEQJKiNWTeYNG7qa15w4Sf2Mr2hk9HQ1TrKnXiH1KoO", "avE8vI2zkhz4XzjH8yi7RZQC66S5QGUy9g74y93gp2lM2Sb8RJEqqe3vkT08jS6q9Bv5Jwm8xVUxx53ONHFBvG4dj5lQVqGe19iK6SQ1vuyqy1DJHSSCgXoN", "aXn5N1iNBQhFq8Gl0CbwDoFUEgfsDRFny0qK2YhBwMQmUgVTq5", "P3rdW4J9wWaAHWA7oAgVLaslLKPqnFtBHlolp5sjbQtqw2xjAbEWC4FXPdLAqDL5y7olCgSl6Kb1KXkU8wyI1CnOp7WdKqjIxX18CTrIlRJ5y1a4yYLxk8LX", "FpBXfsnbNojZGYs1z97xBf07BL4wRNRhCaCsS0Roo8N2gD2gL9", "bWmbbxuftM0J3CtD2KDT82bT2Gh4u2BVWx57vzkmLi5MszavHnMPnwsqCXs6Z4Z31e8weqjzYmKRjuK0heNTaEJkl9oJDOMF0T9eJqcqdwFKoXLTBgwmuDUg", "NJzahJnhkxK2lusOo5hcc23niyXdB2HWLE50XsfInxKZrAvfDc", "FpcHaJF8uQABvTP0Ruq6Ac4U9tc2XpdkeF1DWGLQfTZauwYLrMP1yRU7L6AsunaW0cjXq2vVVV3PPZiGw8GuZk0so8kivJDtvwQjzKDSnEsCoYRighaEPa6D", "ipub87V11tkyBvRyAHBwpceUJEignotVdl5lqYmsRVqdQHZYWk", "UMK8qbLYH8K9dyughlEUbexRFLhouDXOXrVLTqtiyErZAmGrVSJ66GVLaA8UMfqtWLFxB6g7IXfSJvKmLbsSsMlQWtusYkk34x0D1gJKEykVr2ICe8cUUOuz", "FopoWXrYUpmUW5oi3WDuZT4Dahh23ZzINp4rKtQnjAHDF3vGZ6", "88YCJ8ry8uX8BuxFkF7A2qIJ3XMwlu2t2Y3MgvKpnsvyksCS5Ja89sPANm48g4zgd10HuJ4h9zgtpqKv9u3GnSOACSHqWGV7FVP9oTrxRVpGL9BU3Ciod6zn", "YEc2U78kcXtPyiKPB7eWGnyI0g4bk3OIH0Jk7RSiwJ5u2PIBVu", "glhe1hJ6G37fKNdb5j2XRyqUqqr62M0g6iI5NbBedHHveuWjdYG2U4UItMPtgPZm5rsRR132IIxwCRdoxroRuHjnd6eHUD4X2uyRtzTCHO6SpkEkZ0BTHtGs", "xsAR5Cz64vXxv19ANEaDwoxVp7z4yDxv65L9HIFLDlG6mOF9cp", "KYcG3PL0THEQAITVRklf3xQK3AiGHI4cqgqr59sYQ4xaMQ4n9pQAmqSo084IQ8sEmi6rrwOH0JpMht7ohYzTMPHNYKfwQVBDDH22BOHBh6VNyaBf686TYMq6", "gT06yBH9QKBbiQkOUFlSqu5u3CNZYBdCcdGapYhFqspWGZulnd", "DbYHVZTt8z4lBhORFBxxRnnEK2nCnYoy9MFfvgY1famoF8GTKBOjz9xHBiRyHFxQZA5UrbTUAFHNOXqigCRfMMuX4MULZRk9ZnbON5tXKAsgfhMLtnzF7rlC", "BFVleDsD1TcOYTvrdlVGSsZMdYZlOKxZZQIDeAPfe11AUuz5fV", "J8LsUyP3jnMeKv5d7hnWKPVLYxFX0u0J2J9UIYWzJseelhFqM2KgQp1ykETk8S39lDb1j511xdfhIsXesqIIdHGOVi8bAAitLKv4Nw5JXi0nYVRRLhjzyyLT", "gT4oblhw3czQW2j1jjoHDDiYuQVsMqJ0IMot7ToA4naapKcY1O", "oEcWlWuEPG3iGL42C9W0Jans8bCi7B7vOjQ7FKLcZOJphLquVMumuie2HqjO0qKOXiVm0oNZDgNs1DmUXhHRNvRckA0kyI6V0bG1NdaaJvRI8Dnds22DxUph", "cqPZ8V494K8Svi0CeRVkdGOVGOjDsYtTOG2Vk4coNkEIQDV2ey", "nHC9lSXUdO0WpNnpsXtUJGEWXcj2fNySdAZMc4qFSqkFDV430yXJCjpjMYj1uhRVryrT2fhTTRifwniwlEDvv1fHXOGP6fsxbhPeM45oTnTNY9HHNUDJTsY1", "EnOKQHG2ydgJfj78WaV3hkK5EXMgNsfcf3u6K86JjkaMThUxFx", "0whLzuqLYEEDorGgxbn3sUnSrE7JCMHCGwXGoMZManZMfo0aNncFINf7ckQo4f0KcWaOsAjQvGkY4k9RYleo8Jvk1LW51VQb1yxr6gF2xza1jhRFQ53ZNwHO", "ImUHHsqGql7vSKxNJVM0BnGbrH8EEOaUA4jRwXhlImgi6b3N4Q", "NFBbp2txE5LpZVrGumnbX3LBmRmnmoBA4NjrNcoaf8NEdESY0F7VJTg3sSodF0lHLU8g5wGk4bxgqPCqfHMwi0xZRjCgjxx2R5jUzxF2ZAgNZsBC7V6qW1Px", "lZdSWYVvdCQa9dcgnI3K8FXGkd4GfRBO0mqWKLPxXnYfQ8LBRN", "WXc1lKepZHGkfEVUipp8nLvJ0KRJTqgzOG07Zdv8s9qYOL26BpEw88D8ScQvT6tpLrwuUp0NzotNAtTJggDpoQvE2L9TQ0IlsDdM2dh1RaMZRqq8U3xIRsWU", "EdxeeENWPyqPZWR06lYYbOg3QbLrTpLhRHJ5TeZqcNFBteAyQi", "Wz4A3UlMKECdudsBgLqDBQaPaS3kQTQuRS4UvnqFz0srbl3H4rSEF3dpVgZt8xnZQr1LcrYbqQRR9UhEJ9QWA3MdhtWnrJMF8NYkD6K1UlSeD7qUHG0PJM3y", "EXm5r8IxUqifu0gOl82yEsST8QsPntO1RA4IGMFkAvP4v3SeAT", "aOL2rSTjrEdFD2PHIgbVOjRmnKpDzzgZN0aCS1uJDVZQXwfpaGKzxjji4Yv1YaatY8407yJKTqk0lPnJd7Iar1GtYCu4kSvIZzGgxX1QOjO79BQkHhJ6gZzE", "jrGRHCjoBxV7VUVrDuyK3M3K3MQitNwdCB4SNmGWjjdED95P11", "j4OmNP6l7092bJDflaP247jiLxpPMqO3smoFAuzHs8JTPU7B2WB7bunxpcKBQiDGT1UdtTskZADyeI7hnGmO9ZJy9d8XKLnnKFODiGxFQ9C3RJkCaUbh3ufA", "Wlhq6SdOizcOFXceeoh67PGftrMum04Gll6qBhEtgoGtMsXygE", "2ldJRWAlQulSAVDELNvZEbMUVgK0eyFhkq09L8uj3eCB9NQSkJzztLRO1mMgkbNSQLblTUSU6eeF22fkLejE09a1vxhdW26wNhfp98HFkvUkx7VJmCVmL6nE", "3TsXVySrd5enBv2wrVgoc95OKbAdfwsgNkDqgfhJjL4uF7q6cV", "sCcwbwVjaAdQq0A3rohW7QqCI5H99rcz3Cvc9QKhav7QuFSj39F8X3Ip6XwFOWDQj80qZKV7EcW8pyrq54ya6FNCmKQ9odZXlZNIssO6SuCFq35t52TBFqM1", "8mAxPjU8HqP9glD7fPKTQQMVQnffd1emnnhAU9GlzfseQ5j3U3", "UuTqOrb3UF49zpwgzQnFCnt2PH88JcBnVdcrUDuzQw6Pl23iQrvacod16l9NLIAovmfOyXLOTRmCRpureqQEe3FimM55fEsYyXww3FJWg5j5sbvXRLl4Mzk6", "JqBw21V0XPvafE6JJnPBPKgofQqzPb5iPEfRG8PnXKNAYRUpDt", "zaDfOq5FpSou9D8ocMu19RMUasw4i7xhhAK30OGpo4hxHnjtAdtJ3Fmd5ihnpcSUmlXk7oXvsCt8zaz9EsRF7DqBtXyg9PAt8fbFT88KKzSHaRRmIq1P1pas", "MXYTugK0LvDn1L7JLXatwzfEpecqTAinfEEXsWXCRkzQ44jNbJ", "GVJtk6XMxyWdjCqvjiRFuszrI1tzOUGc0ZVie04ZwYCfk0aShzhZreR7gK42nLflsATWBV573GloGJExJvX8ZwEDGIG1dvmW3D2Ei6KmM3YcMkYff5oC10OF", "IcFuX1QYDQltW5fq8BTSv18Y4uj3u7GAjV4EVSmitVbNaFEgOf", "7KeDqi7Zjzez7LVCZ0eKgVpHrOW52vi9DMM12RZjODiWZBi69KOpqC7hYbkaUQihk4hkUGTsT9M0L25UNRKBdPq90akVyQAiSrSw7tnZ27XLAaoV26gdVWnT", "4Vy2v7iLy8I413b1A6LIf9nfFTIix3B1W81PFhlBp1Do4oqCtB", "VYIIBXkRDhVOhzWiPlQ8vD782BvqLozoKH7VmrwzWPNDNswkbKsWVzfV8YLRKKGebN7LC1KiPgumWoW76McbJF7RnSq7l6jKRogbpyICeCyA0SG6osh77mWs", "FLxyRgIrSySFxkSZwOiwry0doijtSDlhYid0MwposH3n2VLwu3", "rj1rMnX5g0JPfr5JpRDeD5uErwiCqcFhJEZf16jf602mp75dWIHhL9vC3dMuDbbWnAAmFtPLrR5gY8J2QZjkifumGHgUqFycO8OdzowqF2XmAomZNWH49BoN", "QSrFhqr5wFgw1dkFfFzn4lKPFbTMnHkBjZQPNFUKTBEUmyhPEg", "CGSXff672tOk36JRVfhzzA8Bcs7KHLySZQxF43M4vioyo5NJk4HhCNspG07XJ5xrUu6WyQar6OnvRACAFRrPpiC3gJYzNWqpQuLMIvBPHyIi9UqMuijjOwm4", "DK1aoqPFiiZ1djOuhgbo8R827sjToTXzoZacPxp5gN6H6SAl8l", "aFAgFGYxjKQFKCosnBnaGRxLj1ntlucJ7kzMyYHiqix8sjyfskG6BBRuBFlw7NFE6CY4iqmZWhfMOe2GOGNXPmQY1BS6XfIdsrhafS799nVWPVmlj7I9uift", "s80PnG2f7jEkBLrJ8NnXqXGafZhXFMQ7SOWEfWrkG5TPRKgXfT", "3W1J4eqlB45ZBWygkbCZJQfmo47UbkwcGvwIXk3io7H0bDeJmqs6FVs3ZxV9iRlwKfFrQGXENnCwyqFlf8pubhx9dSILs1FAhU05lXJ6KW3JMG21MrtyWq77", "HNQ7MgH1AH6tnQy5uzMEFOEcD7YiwdpD0GIKuXM4nQwaqufit0", "x6OBiaGGICr5NrLfAFDUI0uCYj4BRvBM1YVi8mwOyoTMdnzn0CHIAASgtWsKR3fRZA9fw53vtVFVIEIIPYZZi1GbW6tx7YOhhVMdbOWStlx9yEPNmyuSy81U", "EsPMPm16HLjqjEHaxEjvQ9IA5Bc3JbXYUvsthtzwCgnwu4WsGE", "nfN4pSDQUW1z2VuuOblLWy2JswLMmZaYExa2OnSsJRrKxkEJJyfpuf8mZR8M1jsDeSD0DdqW5gq0Q3JjzwZtZfd97lT6SLH5lV5y8uSBaJByKThJNEAxun4z", "WX3zsK2bn5Zuz15XIFVciDt3P10Jo4IJZLGPeI0RNZJLbPsteM", "UKZLNyNMG9OWQyqgNUyOtKvBdWaVOCpqUMBrLWBZea54WtltLhFFzBQcfy638vtcI3RbZdABBDGh5zYQgmdgx3GazMc7GVhYW976kFHvSVaXU6yBsbpnd5Oa", "Q0ggTNC0UJ4EYJ7ypfWHmSQc1FQcJmBhmrNDCXDfqFtOZzMMcq", "bOG21GFPqWB1DvqY815KgtZXH6WcQ9Q2Vh4UvJtlo4l1zZY6adQGVxmm4IMSPnUtUWNNqH8cJrdHRBLznlEGg02kGPDeCfXeCu1097cRzFgOP1NAkZQQZQ9q", "nKSxzzbBrcBzinOh143O3OWlyu9XKIL6cn3akfjcFtZxgxcfzd", "122Xl0PuViBrolcrLNU5zkyWfcTGGSrHStnDrA7NsIEg4oWNB0Q8iOeMz7aDXRSzJDAAOIXGYjvaYPwhNMo6jSQiYyt3PL3iZDrxTOB084YeTULpr9taaJG6", "H99eSCL1OCwrY6pe8OIascPjjIHJZVNqcXS5jl65v1vU7k6F6P", "nzzCgiUw03RNr4uI9c3DfxEaPJJVXPsKMrX3YzxY3OtsQmAZMCl17xaWHt1mGu4djbeHZbnaxhSORbvnlgmseMOtDNfUHj51JjGqI4QFjqdAPZvADf0r0MiD", "kLfz5iyMPFChJax2QYAq53yJizAiLru3CX3FG1bfElLVJIXkqf", "YwiWDPTL7nCzqPXrelrEO5xjbH16zqkVkQzvpTGvETs2qPuU8jgXmeELtEQq2ALmYIhOlvHxO90EXshdbNALzNhqb7edFzNnI291xOxMYxY3pFgObpjYCOPn", "T1Qi1lUHndGk0D4Y8dZxqDJP21yCPLxtMLbL63atfpef2iBBJk", "68xOXyPTAom6h7RHSYK1Pxq1cqinz1V67RUfPt6XftdLy3cOZuPysD0S4iE3hj7p8ZSXSY36PeRLh3kGv7DlLDCNtQQa7WPG5plWMoclT3584pPxwahHntce", "J3EOZcecRO8lCkXdlamnP9lJjSZULB8cEKylubMKzU5BDanyAZ", "mZgVtNxSpGdvqqFoZ8PvSMOXYb8JXIsHqWmhth7ivibjWqY6yvzOILwow47SKxh8RSpK7w03dZm9PIDMCBkSWeERgJt1GY7h0xz8rx9UWvctCpDM0woXa0yH", "JpGXNNCMI9UA6dcaWERg4d22ZoZ7oVM5Iaceyo0ExSM15zZZBz", "GDcGG93nGpJdvZDXD9KBOHdiHghqGrpU4PkKYn6pbNQWwb18jLJ5bxnqdTgrKULOt6hQrnDSAbw4CyCvHWyqRmg4FLuZpFvgJa49NHZVsWa3SkwjGvahhEku", "ZeRMrM19v5IGLrmBLKEn4BXJ45ylHidrK4BAOCJJGbYZQKkmcz", "Ze84xC7wvPcYEvaP5yaOGoxoNN679g4hKClGMrAHGmnUhNrkKR8YF3KcROkY4mDMzzaLqkb4VOYCkPx2p3Y47sfWGN2I9Gc6DDS1x15SNbd5yY7nZfqeVVAj", "sDz1Tc8epYfkXkDuLo0JM55tjvYEQiwGtvFKXLyKrd5OLGHg4H", "yOK3H3wpGKWCaP7pkf9gz0K2PfIgKKvGiFHyHDlXXHj7hquPT13R2NTP1k3J4wZl9qhQ1SxYkedPTVmwXpLZBpwCXzTZv2K4q1VrSQPC50ZYVLS28oZJbVT8", "SwhNw0QmztbRJybMyAsSTJSc72tgVNmyHRJEPhyPaYqsWQCTa5", "v2ONcTNV7rqtp8I6KioG7MovEJLRmuWfus2WJO1OFsH2yX8GFuWKHJGVaZwMRQ1LG1rXPrvchAefinvxfPIwgWQG3KaVjZoxbgVyVObCZFrF0kAe7Qaowy2y", "JdT0CHxlvQiQpHcMURbT9l7FCf16e34veVvrlqagHG56XfQ051", "TCkaRuFSzrU1k8XdxIUWwjm1nIfDIkClwwJMpWmmOGn6NKkIaCoVvbUir9v9r7so1BAohua3BOAWgsoF4dkzCCh1MaADf2zeB7Ts21uBN4h4wTH04zxGBcHV", "CPjpPgTaowRowLzJPeLJ7cHCZEQlogG03xnTcG1QBSE7nBQApm", "RwMi6wuVhgBveErRfTihrr95yvEM338VxTB4P4Z4kixPuooaFWH6LO9JHNgLQmoMFxOczxgide5XQt7gOMkjju30FhJeR50f3OH0JyiwcnR0hZg5tRocJpdW", "UuAw08Z1Uq1nokhOX7PEg3HXS4AltlGMfQGdXpe1fenSOSqtZD", "6FHNnhRvRJghfL5txcibeNFRpbteVRpbe4wPmOKDf0uIKzBHctqEE4d2fUeAvTjaYgzK2KVhIPxaM8rwzg8DklFPGrY9LFjtvhBx1ecH3ZsNfhKeNSq7C3VQ", "v1ZGGH7CyG7xuiEvF6ItoaX91LHBNkbIlAW1RbBNpHKhzZcCds", "5PRbZQwobJWAZHK3GkcS5RjQ8ixiuaby00ZXQVJ1npBK4TMKBymHOVfUBcD4Cm2AmZfA4y9plI8pjUAvQuAmOnHZPSbZCbiwAN4DKD05V8vEa371xFnL22tP", "SSzc4hWC2aNMnOQGWLV7Ma6JqrdqsWGIyDv0sRBu2YFnuf4RyX", "WK7abvREkHiyafBVd1uotuL8iFlkejF83MidGAr0RYyzD7Uo6NdzHw6xBrhobwwcHfFVn5TCbPCoWeca1DZJ7fEHXw56q1g5ewaPz3caQmMwOwWQA4hHhvYC", "pbIgbzjFtIdsJDQkzmeNg9loDS6uMc7BCNpnKZ0Drd38qTsnDX", "9seugrLkjhLoqXAgKUFIi4wjCkD3YOYfGCXv3sfkX0ZOXj2pBH8tJ2dTmoWKA4xPEVKFLx0ryXFTEFJPWPHnRuGDglWqnTD2yXHIVF9RmMuybBO5afs1X6DD", "pj1bAFb7kqPD6YeqsXpTiDYJqOINSVaGEbrPoSUZItmMPPDHw2", "keDGv3cEQ4jyIwZ9JOZnvqefA34NK0N2daGYbsk1uUzDOXKhtsSmi6Rs9WERUbR5AhclXMlRoicCDxr4pJqVPILWmZvE9MKJ1w2YGn05WcFhX7mKOcpmsBGe", "iCrrWB8W5B4Jw2OQdc8AhuT3WIpPR418Esxk16E6FJQBJmawMi", "53cY56ouTGwVOALLtNP7RcQpokaMew4hyeF3k4vCIsfe20xtLL1lxRaj985m39Tznh0Wjti1lNdmLYdhteSr40YB7exAlP7X673p0jok4PUPx74rmUgqVE1a", "sxkeKpBQwCDwtzexO8MLERAyvqmO5lyvigX2VgQPsdKlaygy53", "KJSUFNJ1kOmiHVNpVqVuGMXa58Ym4bpMsFp7c88KUv1lOOarC6lSQH2VNZHR84o1Jd6ujFED8DyUbXJob5E1MFWhom8wquv8V20EFCPLQOnzt6nUB0VVFzC1", "lJvaBrghrgt6sJPIfCIYI30S3VxGSAHERDmc4SHv8Bz0SMH5YZ", "boabGc4EsWMAknNUNPwfI4qF3GbKL7ruvRVC1ZOu3k2mVPGqoDV4HJJKXucs1TmwtF6uoUmqCocfBsWx5z1NJKfqEIhDjR8ahETTjFJt2vZDo3Bt2CEJXsAj", "ApvrG3SvHvPyAgsAaPOMQXDSjSmEIuwSjrHxujtBeG8nuyvUNJ", "qnq4DYUxmmrgCYXTWRDNbpbjaVfW02nqnesyAMwu6lbIK8moYxB9kmqLHVpFVc4GEwEOH8JNuugE0Q2YLBf5xTQCwFSPqWf4QsThyk3sch4c749SFmVAEuNA", "7naxHD2h3TN2DQsp5xPC1YcFJ7PX1kf9VF4mR6SSXpSkDLXIIx", "SHT2Wm7uH7exE8AIubPM2u9UfKpCa570Lb2rLAjdFMaTUklOK8jM3qqg9gsjjyi4ZkuusdV7z5aRqKo8SXUTLI9Sw2Ag0skXcePTGvaDy9fmTTutyONHfWkb", "WuHUm01McPpsKO4GXj3yCxp8KCPzh9aD3sinqhAS4xJMLNdq6g", "mGdcOvmnuTvThwJNk92sb7puT9H6zLmmbOMzJ8lCcefHaycI7eAgjybD7qH4C4olQAjhHUtt8W8gUkzZM7G65pJCfaFpc3b0CKiTmZKs6SYYAX8WfMciBvto", "U8e4BD5NVnoHM89QafziB7FoTrWclPQDX2HhDM2i7rxSz6qYkp", "GvuTjLLFx4dMH8MWparqIwfGMcKDA42PxxqgG9wEDXYSfuxTUoJlky17YJKjMK6JFu0W4uiFRGi4AfXdRoO9kNEJgW02r4K4yKa2CGIbWyffbDI2zg9k3O3h", "u1ij52o3MM6WbM77Kmktx2vxi2hjQiRJj70m9opT9tzkD6pXsa", "QqaJlHMQ0k6P1nW2ZfoO6vG5fTBTz21Nqbhbs1zrj5ElsjlRMZnTV1Y8TiZSkapYAU72T6rD94w1nhQ9GBcjB9serR6Z0t5AOCArG22P6yOrdm0uvbb6kTkZ", "to6tiB36LDvZDyyHuK8Y67Q1i16QToxMd3DLCGPVRK4dG0uBK1", "jO87Nq8TEZIBvtC6CMMbrmttPAtJJDK0ZQ7wGDOSnebgXnnj97IytBrIJiactuaSLhNZtl0gPbKuN5dUDtT62INMzxwspXJ8Cgg5RgjoF2ic7L7KCYPEqmYp", "hTgWyzdAdJE4xvsCxYn5ruP3SoHGYq4FJkkFhNPKebMbXClUkY", "ZbQxcsjt7IhBXytHDYcbsGCCphMZC65jfWeHMO8TgocBkVRw31XtIh35PPebVkI8ExNaLW2zKe828Xy9ZV1pD4uaUZ9xHR6VMT3fx3cFgjIoGGvnkwavzVVT", "2eOH3UmOwn3rrg7XPNJddEPL9zG8UjZULxlNQVlMJoD8SIdpfw", "RH8qcFprNIaukwsWJIz4cGqnOH6z4jvV02JdH7UdP2X9yPdFfbHHr63EN9DPq7vr9CSOJu1gwXotuR6a2OpsUs6pzJEqO7fXK7udzvIvQ6mLVttYFiOjbUWY", "lkOAq3f88Zj7T11t7lCde59toXaNz6vkpKsdLYlS7UZYWYSbKc", "EwiLoWsOrrTmaG4StOyeq66Nccw4EEfQANmwrcJiSmS20VSrtRVjVZ67C0AOCpoLCYH1BahdK9dKe5BVWeEzEJ7OHHkU6WpG54FEfwpz5SIiXRD24Q1Gh6cw", "NMQRsDfvIu7vqwsuOAaualueBtsq0UlNqBngNSadNhYBeQ50Zf", "u7RojaibPi5A3tJoXgH7HcnpnREtRnWKuv8bWoCtUF3W8MKd1blIBY6zxKqM5MgxInYmbif6xia32ug1URIfxOesgUFjpte7gCtIsWMpCusEoWEIyWwtsamW", "3zFsstxX3ontK7iW1Yip4w60Q2sIacmbbzTRsQytElmYsS2tyj", "h3dl14ltKJV7v46OUxnQo1CZY2zYuyHZzvK0x3sHMLMHORgsMRIAQShyVhVNdmwcfEaaHSsdmCvAdZ0xyI8OlnLEUqZ7aThEhIowieZUrScSzcQxtWKeJfqm", "VNr3qZHVp6RVkyybPa2MBSI4wcgFHUzkrrnfO5ABBbgtXeTwDV", "HOvZSrB64Qa4ARvv6H0GS9p81KlUHwzWKs5kjEqncQpmpiftze9RlwYmGHGVDD1V54FmI3asRPeG6I95wGVhA1UOIisTwryzwBmCCK5dhhrnzyrtCMbMN3id", "la6fS2dMBNYNhb0MJp8GnzAzLjJgkzHTaL70NkMY7svmUt6liE", "zVD7SWojCYiT2Io9G9rchwTagvTmg91deEl4lXnv6WN6m9D3J4dyy6Ze10OfAPHmc0pLXcEd6bhtluu4wX0seZWdYtJiIYSsYHD5sQhy1OrmHloBHp4vMYWu", "RnaiL1YtIkzAAe9B0ywHiiRzVVss1MkRAL7TMfNcPKlZyulyqf", "EWNfTt8Jj9gTYqmfJ6LejkyUKuM3rAg5h3kAuqUbxA5Wyr9FyUsfDo9VjTWadCdKDLT6Bvh85mc1cmEYE6BPvIuclQCManho88sJ3ZP6K07ukJQyQbOJtGvc", "h5yFsd1yltFoTeslcxfMH3JfehyVxr7cw5smjrkSlxFCZ7xC5a", "YKdrzFWvkSmp2gssSZkA2V7FhgMcqPAPjnEg0lbiBNXD3P6TzqdzLiE0NYaDwkadXnKVYvDhHkuK70m4oN376F5RmfciPDLu0fPWZcDqK58S4uWsIYyOn3nZ", "jPF8cb3aGQ6n3HdNNmnPgKFysDKdH7ByVQ47z7gEWk1Z2fuNRi", "m5012qDMTUScQx1U2yaiC6TEfTrXqGFaLFZN5miXEA7e76975jqHnHTQkKxYaB6wOfHSQzxc94FE9MME3ATqRxGBHBhqMnmlQ1Dq1AR8CgNL0hX3r1tIw7RB", "I81dvlMLnZAohbwrFHBFygGpf77bEYlUgm7ZYTvL057fe3VrLe", "6HKM7yTCZfjK9N5Fxdgswfv3IX6nOPPSfkomiFwFsfYz3bE0EtqAYlBoGFaedz6Ihs2N5ybxe7whi9fu2V2YEDMUSu65uCNb2Px7MY40f0fN7IF9nHfzU0Rw", "uX0mhLMjjJq5rs3Uqgpyy45jLlgpj7jdchOJ3k0k3opsgqKWW9", "SSDYBWHpL0w2bYizpljnTkbGaH6ula3C2EkBk103zu4aQmYFVH2y0bEaqKVbsWlulV5TU3XTxb2NNaaspaopB2O1KraCLK46p7aIA5j5glQ1J0r9YfwhfIgz", "9G9VYDZOK7eSANXq7xpQvgZRJU8ymovu24NbFuxX2bzAyUz3Po", "UKT1lmVrlGfeAijXHwREURpRclwbpLNHeqINdoFM4s0CYjjpe838aqZAaTjNp6eRxwoai1wkuwwSedGGmHOK8vSgPB3CHfdEZPmIRg0JbvlDW1TGJpaPi035", "B6FTjqfIGQYf4XyfSjqwjJD06lPpmQsxW8ODy2VEQ2rUZp8zXy", "vGG6EMsd9c32ZX8wi6wBJMDAokywjVtdj9jxTZYbBZbj4jdmpZv6t9HhtDcbiVCPctM5RsecRFJTyuDmR8sKH709Kci05sPhljkCbNn0c4TbzgLQpDj4JjBd", "JreMj13TllfM8QNjVoISTdsGobI7IUlbJNv3OwW7i9UoYpV3bn", "T4QLKFvdMB55lOQgPndtuJ1M7Z9balO3pnMA2FlMRqQCEoqcbTVWmWqs50Tflpgac3icGRxhHNrU9g6l9bFu65kB5Bpo0TNdW3DlVASmVIEfyKO5udx0gh9m", "swarQvUuzffUq6EJOTyKlMNdxLbe2lOtfwk5sCyrrdLfjXz50v", "NkGlND4zr6iDxNAhR2rPtj2CMkjLpiFBSVwpi0mY4Ul2qthHvZgmGgwcQewEMBPmeJbKHMsJqcJgT1xPYb9mI6OiiIu2TJo5aNQrjGBYsUEKTAjzjql1uAic", "QcesuSxSoNKXeT5UvIoNSVMBM8BEGrrgRTWLuUoir6DVXJ0SZm", "nzIA8cGJqUAf8c9fv39hj0lwUIDSjkEWjUes6sBxMKcVujAnkHVTFGOhXZ9GKMk3oNtvF3qaNQ3FAB2sSVKfmgNHFUVXqDZfaSYoVMMqmP5ua6n0b5fLl0cy", "V7UJJ3wtTUfzq1nbOtVwzGwYJau4aW15cVNvYJmzoQycPmBodf", "kavf6DF0FnVGr5lEyHVkHH8DuYx5MYk46ejDpwD4iiLXl4ljKGSZYakQ8iTSECXLoEYd9jhpQ0MB55vNLNwrveF4MjUZtzuhCQKJ9z8X0Uj3XcQsxKisyvuJ", "eNsVMkCYAUpHUxpUPWXw8vn3DTt9OoQ19GWV0h28BrQfpD9Cje", "7pXuqkNjujVKkebFAZwAi716noHuz0Z6n40dpLKh4qznUY0c8wmo1muoaBhZ9EfuIdV7ypm1fmm8KmkQgXEhJ6UrFBPMP4GfilleZXdEJPMc952paFVrLziZ", "A7vXAACqtxUSV6fmV1Md4NQecvVvuEU2JOXTWkHPfmq8sVtLUF", "wZcNDCIh8BtaDCwjeSTvq6fgFV98pdLlAy8OAP3Gawpl8lUkCve22JgFnpNcQgNbeUxnt01RwqC2afnmaPmaiQpVFA5drTETvBGo9GF36P6g4rQfGCDwc3Qp", "DVT2wfWrpkdy0s27G6lKxAxDKB9xCZkN3BQzrwrgeScfJckZiT", "rfdpqyyytAVbXYnvYepNIUns76VrfBKXrwKfuGblO7Mvf9pBleW18KuFQN44YNZNJr1B7cwVjGONOBW7q39wL1AjMEnuZKGsBH1GrvjbC8waHSh7To2onCY9", "OJ2yeIonXq4MlnxvtrTBKBGlxIalU8urPwp3CdrhRt4Bez6Wra", "f9jvueCSPeYIVyEK1Pwq6Nh8WK8dqxBT4sOyWYRwDxEivQ1vnxjsIR0pj6QZ3b07TM4xvTr8Q3oMUpFFky73N8q6CGdErdLI0NDto51F8nZadoqLmvO81EEE", "SqSJTlZR9nKxqJAy5hXiVN1GIQOKcaW5QyMshuJohckXtuTyc0", "e5LgLc4hueGQjgM4W3yosdOa8HUbG4cs8vYTXa9RFPrw3DyYFwM5Zkff17HFCr6KmclKDslSFbMHoLp1FB6ntjSsrj81aEJLo2f1tOR8zoPo7CnMNs9Ebc7Q", "JFRuRiDFjsFcGgkGS82ZKnwgf3uFf1fzE5rdn2rWu668krMDxM", "kH8evnio2LpgI2l7dW9U11Y7AJwUWtpG9xv2kbqlwePFg8MJeUmdVKjfdd87VxMcsFeaqTLm7izlqK2Too4J7nxkP5su0CWsRASHdm1iU1TJLUm9IqQPcN81", "QytOAPGbXhs9RtrtsJCDnwK3njRN6ZMVXFtfe8G9p6IEx87qPI", "1AEKDz3cM7BicgxWJZeXjRdzfZ5mNU2McHgqGhSbpcJPGFvamX7TyjRdIWOdzQzbfePwLqV8QoYg1REozKFx3gZJDvwAJvlzX9ttzO1NAX1AzGwwaBtbsQu3", "JoDbhwaF5R82n7NxdP5cf1YDDPo3oi65UHgBDEQHfWHScfOF2T", "rhTNugkgjYOneq4I1FXQWCwmdYPznRQc8tx0ZigGE23qs59rLgHpqCbRiyQUPp6Vi2VGi9Uw9YlzbsrwW6kMGJmzIAThzXDiZgyHoSCxyxvYnkSJqCd7WP6o", "aXTZ4gFcLBt9e34ayz6ljZ4YlgfF5j1dGVBI9QuUcmbEpgmodt", "XLSatBGWRJDSxTx6j5WeZ8Q9KDn7zQ0XlQ7cbL80eLTZmOfWTA81GWAbjvghLgE54JhfcqgE97owTRSvbYuq42Rlx7SIleLnv3SXr6m0BYufxKYXsSNuUmgR", "r6hal3Ng4pCtuwr3SmiP6EwxgHrA3XbucHUNKp1MfBFX74aZqH", "xvVtsC9jKAFu5rBXCTNBn0N2VU452vKzqqqg0zPKAcEDRNidq3pd1CdWeiaebsdPiS5gPSzZ3BkUZR6NStzU5ayhGWKpPxE7NJmnklKnw5FTULpwEoQHMNxd", "tHSICfOawANgthRnkhHC069FsXUEuRpogG4tvSTrcoWTTvHCaY", "ObcVoU3IiviWhOmmFhEiWpU0IywZ8W5U5h0t91AsuqMcE8MUnaAHNfIebCBhgHBmw9d6Anw5dIfqO1I9ZSQv5gZesiJZxVJucwynisqL8V9WURf3s5yxmVac", "Et9BMS3zP1k5taO13YVVxAYpEVlyyLYCCiMZAPWXPGcGo1GpZl", "KWusK6L52KOaUaIq7TEbydrbrda7S9tmdldxry0tGOTlxmZ4Dng9OVkG9KNbREO3z1yqxzhEL9xItWN6K1DgUywdGIDgWZhWYfKVc0hy9eG2Bb6TaJ95F4gW", "MtAqQrKyUfS7d75mmJovtsMTBTYRVDvr43iVu2RMftTI1W2loo", "ehgyAqRhHxuAmyBSR5TtP8ktPjNPSBE6ss41iUixRa5BWGewJ7pjDXaaFxyh7Cmx4qylIeihCotj2VdMaQ5lxfMCcKshUefWSdHlGySSkJ9mom8MCD88qSIR", "kA8CmniFPyyduO5eiDQUzXpAixIZPay7l6JXs1kFxisr5xVlAu", "F8P2I7zaeMAcTthkRZk9ohsgZxb2gmuvuJwAPvk3GsehmLSBuCKgtAMQ5xRlhLfZdbj0UR1kKfS6yuFs6ZYxisMnqnZV6C5hnohHGh0YMScJKrBOOiJ6YfuM", "SRsXbxEOjudxbdVv37ELwOhL41RcgJz7ipeJmsfTmHRLsuHu0V", "FwtvHxwhYayXhfMJw6AaXurwGhrXbp0plsk1pegNEcsuFCDCGLkmGZiWGX1qMzd8rL7hzl2DNt5d3HnKcV6s4oMIKL8gLjmC4tr3cuF0lKbobM8ErC4vzRBJ", "kKx51kG6b79EzMCkhlXG7dUwqXrnw06gK3kKl0QN7XZ5ulnbUK", "rbyKXmrMZnMdRfeBzQBNlHuKMo39PXSF8QZdAOxj9HMauymrOxE9C9TYxWgL36a9U7keThNcxhCrdwj2sxB44db27HL9NtIpy1TRgo1dTDV68E80BI4GtfG0", "ub9FSQ4QRXr7Jqlm1Et9Sz9bHCpAr39kcIz4g2U5ZJDr9wdBAU", "IaUSBjc1sT21BfHBjyBE3kVEbd8DmGh4q9U2t61lY3kji1sQx3c1m7DLkMWUcEZTN1TE8SzeTjLAjEagFCfzHtL0DpUp33GP5hdB7dnbK8j1MJgaTLZkCskP", "iFDjGT8J9mSGNFpfOYfipLIIgq3tglGM0T6HvCY4w1IJG6xecc", "NSvdiZTlS8XjUVAYk5lJ7hKQzYUwD6WYYPBHyd0PlV6D1GmlMX2TCKrBtL54SZcyylDvOEK7hQJig5S0aSSknJugfzk5XK1T5FOSRgX66qnltFjRfBCSV668", "3oBa8A2ENOgo5Dv92isvvcNYlX1Gb7MewVD2gFG3duqg6jq8Pi", "1IIMq4trIUxf7r8ItmX8q82en6NdEmJE2casgUiwwdZ1UiJLUoTIvUwiaHLn1c13EZws1cpwFOxh4H2Z3UpyymgW3zH3cI6oq0hrcUnpqlWv0ZS33H2z1gV3", "gn6G3C4rBjjnBWb2F7xDeNHfcHeex8hbtlpuxsm6bTunxTnDai", "QD5fshuVJqbyPSjFMf76lgZdTX6Eifw6szkkfeDyUoxuGg7bLEf7uFiMkpaQUVUMUE49rG6J43DJhKs1WX6RkolSdJq7oLRHXUOOkUimXt3FCvGiRM7B8scm", "CSrylJFJnefV6LHeFLrRE57fPFpX5PHFr9EdQRwB3ZgAvvmAGb", "ZTee63tvYxKoCAxOnLohWpGAxB5jJKIqlwVrxMlWJ3IUDFsyYef2UuCR3FBLXRBIOe8L1tpIw7m8Kf6sHkule4DhIM2nnC6BqCVp5I8zQu7iXCZpwRaaWlFm", "7GZtSd2GpV6soCsC6xuc9TR5vzdPltBq9khZOknBFr433uD8r8", "kzZ92U6grpX2gglND75yIJoMKrEYx6gf3Fo5ivjXkGaOuJk7Qn4g6s1RhFzdJdIMq5QWy94iQc5KvnQJaUzfK06zE3cXevuUyI1wR5crhhCaSat12qgMpkJ3", "nwaPpStnkshCvJ1czBARl1Sns87hqRibNG0AjuvRkcdgvdIsoR", "KaSkNKrVzhufJFwJPfBI6wuicnLse7Hyhkg32XW2FQhWfbp2EzKLtC1TxKLbRbX7LE8NjeNy23UfeIhtFzC89Bb4VueuV9zoN7C7jZ3laWQFm7614I7BTgGw", "auo43osPt4UdcVOAznPjuTixlp8CVM64Gt8If0fY37BdaYnaLB", "JDe28OpHaLdfNsYV8DTllUqv7QRtym2IxgI647LdQwIlmoGs1idkCTfIs49qoB6mpOquU9Vs5ncsbsiaYMKjnyzd26UpHab6xPyPYTFbErTniCNGWgxHewve", "2NTHv2OsPKFxoVZ2M0q2ABJerEuV9p89AZR5cnw17BxtgUw1Uk", "1dvIHlX9EgyMp6wECW18V7JQ0yuuxNcy0WHFHmPVSLqFSkUcEVkja1Abx2VsP8pNe6btqyOIJEVjwzLAT3u352e048tSEipsmOlcM7sgKNNGLjRokJppLSoN", "ahnoNbe9zNlMSb0myN3J4S5pltc4LORt5DfSoHZneI74t7rqTs", "7VKDI36t7PHWILjxnXELLqdQuVYjLzbQUtdnuhg14xYMIHJ4pVN8LyYGT4xm3XDYQoJLUzKYusvBACDxia33YZH0cDmfkzBAoSTIRoqKejVmwghcGkdmItmu", "6ZXqYjyKBQabCPtq8Mb22IeI1G2J9pDFOk3uR1DbRnCdA5SJP3", "JRLwhMCjdLYoYuZbnyc0Z2ljfwm5DB8WcUQHoc1QvXETQl2DkdBJfu1IqnO1zWWZywrlXqBSNPulBwytZ7AC2BVqztswNMTKIK5pAEGWbAHk6EdeLmqNxJCu", "A4qYOKqgctUl7iHgsWRwk2Y4oNPkgberdTN1lDgN686BqLpisG", "caHBc3Y2nCdQ3FtOGcZuxd24osPeYFs9o7IQBoSw04M2HDQXpyQnbSrOJE0pSqwGyEg727319O3QbRvPPLCzm1N3DLsfBnt71YC2dG3mc6ABV3avNks7jFAv", "Y0YhnSpn01pdFsNpyV1RYZMtIE0zR8ux9RfutUhtTWUjOpYKKX", "mq76kNJiMkrFgygLsZpaQI6szThWn13Xp8eZVxGqf75L3jgvGTVekaWj3BDoAHMzPyXttnjWsmsvVWojyKNgsrNt2bhCs19Fzg8qRrNJbDC4h1nfJ8LBzj2z", "Kj9AlJPizYZRNwix9v1qunUBvnMtUMsm52woJKXIq4hDyQ85JA", "tDvNOq9ihd4YQ7YKwreR9UVpgRFoWYwPjpl5eunLXptvwREqGsHQLkDzBSnhyi5hXqmBkXVFMM9GmN72DOQW7dVI5Hy3x1iUrSeZz7oJTvaFGfIS3iy8MURP", "jNRgO78DammXrYpJUNYi2oA3V9CpbbEKyd0Kl8VJtHqknd3F0a", "y2O86rFIgqttApWA7HHcaAtPse2uu3Us3qy9gERM4IFF7mNC1coakfzdKzVE2x46l2DRGdoLv1Y1ltDnW2NGfKrzJMBKJFO5IbWWEIr8IN73FKqlKBzyVrxn", "B77VMVYc429JLyPdKWeZoVI7eH5A60xI74nUXJ4bLBse8HFSlu", "zYNHf1YiBfi6vq8iIf1KFKW7zeNC4661eTIHVozeRilMWt4oX36mMcrLECXGJcHx5ZFYMEDnuwAQnCCIEJ2atut66OMP0cL49aaVmlJfhT5TfGltXmROgKUk", "jp8hRRla1M4l7NQnqUETizLDlmbP748qrEXGfHoebsPgFoR3Gf", "Xyds9MeimlmsZb65rlKgPvYmZmY1pogMkHCteraOaMG8wKBn5VRSO0CxklwZXbuGs67WvhuU28cySllVEDvcB8XtrUSM5McxRkSMRKoTTOPv9BPNMKxVQVOH", "xoe09EvayNuOijpB7F4HORcimaDC3ZS0L40UIv4FHxbzgQ8lfA", "01cdjMBuWERwEn0CHH5KWMF5LvVRg9chACIsWTm2hEztzx3EE8YiVlnogHGLQq0Y2IQYjBYONVHMTKafS7Ovs9kXQ0soqqLq6lMpuuDHQSbrmCWCJu8B2siS", "qYFgMaWSJsHEkST8u5zeHWrYOxhQpOtfw8JHinjzdzDNRhWMkV", "y1zpXOmEoZcfCXlVoRIXRvUeHwJlG3GE2E2ZcmoQMO4Wvp2hHIDgChKTbcErdS4gg4DGqzhAOjhHYhxnzAT9pmcROoGzFIfvMrCBqrJCa0S6fPudXNmM9NlV", "B0VQI8KdxUomJ7yr6OxjlpMGB7bKUModMH2dPKGLo27573wBSr", "vBhFSsM3AoNwQiDSLbmZwYb3di4XsUOng306tL949UyXCAzVll4fHfguMkREFoztrxzlI8nQajxntxGegLHyyxqIgGWv4TotRlehrP7R95C20TfeouaksR3W", "fXPj1BaQwF7ncDEjIPmGsPueJTO9sRfXx2EwDoM91Ruee7LuW7", "AOU32mWOvMoZtlZ5hnt3uvUpX7ws1QyCoQDoCjC650dwlC1SxuTsnwfI3Z94z5EnVRZg8jkBkN7TZ8uX1LNmH23IbCLaHZLkzsO7b8JLVQn3XhYW2vIIvLaW", "Vv4kTNVSFrZq0qAVFxWkc4GcxYussTMNMQ6plZH0QppQdzusuO", "cWTs6OPzHFSdao2gclFrmggb4KYyASNlwob2C01RDR3oE3SqoihaMM9QehNm7iX3W96g758LXB7jEZZ0FEbbYi2COPzV7UXbdbFjgN4BW9uiiTjygIZEyZPK", "wMo1qLcSwqBcBDoiMgO4850oLY0I5Pc2jQ3ale2fUBGfO2Lkii", "mqllc5JdNO0zOkOSK74KnWV3Br5VZlBLcw4E1LrMisK6aiWupaCa4fbEWej5QsO2oTEom4AUuUbUA5OygYYiD8whmdkCV8CKZR6MTGoNjPrtVDr9lOpwUmdG", "PNRvTdD12JLVX9sGXh80ux7dJwZniA46VV1x6Cy9VJc2QVHvCP", "v5M2gexGRdOTjuwip3unAP4mQSFfOQ4JVOKB2HPUsmxcesKTvFE3cIp0k3f6ThQw6i56xTYpFUPrMkKHxYIXo7YW8Bdbt1Vxjb3e4cTH6t8SbQhWwz3i4ZED", "jrmcsIZZtaDvAfCGWIg7gLdaKeINEWaxMMXCe4mVczQnca18qi", "FU3q4MVKjhrHcBb7NEB9jl78YjiaqXG31Hu4dNOK2DZcOBjmPst6dyECgvkWS0ZRFRVrmuBm5jOUs5EHx5LZ4ajkVTGvRnMgDsXzkhmnQ8HIETX9ZsidQRLv", "sZqJMByX3VXlAHYYPoqbFLloCTPctkYlHM3eXzBYSgHdvoBLc0", "wrLheX9180kej10mdWjn2CTIpP6yiiycXII9nRBvRvZAwYva2cN4ooKbBQat8WWemonYDyTcr1koZfMZIhb4TwgfMEYTi27Tqs11pSdgTOS01mZHTBMv70aT", "E6wu91NxuMzjpcNIyqJ0asH23bxAbXendYima3iSQh9FHWXEKo", "EvhTxi5utePVS21AnbBV1bAAoRhMf18rupLpWOjN26sU9rcwToPSNZdCyKWcJeTCSm1w8jJBpBdw0EsR0FuNoXXnp3P8gqI6dK2j1LuqUWnUkdwkrq5fNdQA", "enGIcZOFrQysjrgDLRi53cnuSqXnRwx4jDMLklYb9VRtK86fXm", "iaMTSmH0ZjwUndg7xQsT02wRtGXxt5kZd626tK4Q1ytmZZtWxkyvmuNd9sa2xKcZPcdGuhetdXfC4Xh0Hfv1XGeg9Eh4XHbutEAmvmfYKLjMsQM73G8YUmDd", "yugV9HN0WVmPISwaldwb3Hi4VqczapbYhH2qWPr0vdOD3Ilovf", "Pww50RvaPVQ027F4wjTnkMO6XSOIEJyeFsjDIdnh6Df8JuAFdc0LyORWqpm58ihLbOYtzMY6XDCq7N3iz34xQVRGJCJPuylTLHKKbsQ93dxAyzrx2vsSOIhh", "Uy7MxsqI7Aaj11q4cnDYm4VnzLDLds35rASm0G27QcqRbgUBSh", "jClCxiWB3916DqEfcEvcMJDAjmrDyHufTfqRLMaOTbTgShJ2uEdGWqQFcFSYWMCyz2NIMxgpW7Uynnzh0cvWQLj2ZBZ3Vj1UjOm5JQsqWKmH6ly6NtalCJmj", "ULnz4mRl9BoSZgI5z5M5oIBA9jvK2h3U2oR4bsnk1bAaITgFW0", "KKJVUSCQmE7og8c7ABxytyZ4WpXA41BOLSrou3EfFJRvP12aDxW6v5AStfcvglK2D9q6B2jQJAMjBMHMKnTDqddhHEdxzxxB4lHFl0e580oHK3eeq5qegTMx", "hzvfuqqyc7CN5qSBoEQ8H2l57bio24ji3cNvTBt3G3QLtrUh3u", "qJxZO2A6oA8Ys98F4ZOwcez1xtsRYtKMCFvZF3d4Ema6vgKyGiusLtrIkhkJb2fnHZKWcyYoi8tbpBZ3rTtCLlV5SFM3F0pWZ70B3XylfrLS2uTtMN6h8bka", "o7c35PXeWVnY2lJgce6cXaWtxcY5BGdzLD0QaX450qd3ZujCXp", "m4PIvKsRP1h103EyTpTWuUKXXtRE3y3q0R8vlzK902Az5MxWBP03tKYOEycHwd7v4EooD9xBB7AET6idVhgM1DkDBMV7za02mpqxwn95sHJJNzwqgbCgoutz", "GM4Ex3Ghs6fotorl384R7zFmaQSMKJJZgNnbQ3IG9x20jtjn1l", "C7kPtIpJe8cvhGHUrfX8we5wenoLYn6kur9l7x2k5ffmvwGlcltWNwQzjEKH0QzsF7eN4e79JkvDh9yHsrlFlBETOWkMwiEApqXtVc0oMtz10xGsm17WDJzZ", "phvjP9rC0M3Ty3FJuFIuAZmvarRl8QKv7DdVLUhLrlmnm16hGP", "ZRwMKWBlIKBaFGosl9NRSCACzuD4bURBtNVDtgw905iELU65bRW1deDdYQh8s8HjVkuMQqUPvCdHehKF7oEkSRLyp26i8LPb5KwUAQt6aULE9dRGRf1r4Mpt", "NuZTFz5JJ1nRPgXz8qBHTaYsDXjHrX8CRggeflxwkkN9Ot8UjH", "mBrI32pnJeKPrj5VLiGJcy1y7OrDsYSchJulLhWcMozBX5gqlu7Ms7KxVB8LhayPrs8CYemsSl3xohnYZtuP0EMVNUo22mRtdX3BBp1bY4WNjItIBnhB13gM", "VSOVFoOqLR1XE26m4d7nv034nkFmlt6ELVjaJ7OcWP7kPEWRpc", "CicFmOx1AisHuDkdm1iAdEYlwvxTLm5XUflE3gDCN5RHGBt0CbBpohYkaVBvHERjuAxxq87DDYTSjMStvdjjIFStldm0sDikLdfCmnNxLqP5Asy4TfnmtDde", "pPchbKPwy46krShBI7ERxAVQqGAjUnLJBxykILeEPlyFDdQTie", "sfoL4ccEJ42cLBaJtqcX41G0ERbctIGlx371dhEvlEX4P5LGtxnxy2vBTVnMn26k3BkgswZbA7fZA0p4vaztcv24QqQDsUvvfdZVZ94jEhGOh3QccQUCLUGj", "KfuA9n3nRdGykLgw2uKiwjIY9mkUFzBZe5inslYHMpG6Au2CoL", "si4BGDvzfAwoiarQLjBuzYhDcr7d1tyuc05qByno9jcrJTHdASX9yEKb3RE2JAwv8zjHyX55EfwW6B9EbeMasg9t8LvPVqKbn1sjWxolaiHgtOsV2E3svCl1", "XeQ0UibGjTzEOozyWEcQcUtejwWc8Fddt3dMjCcSdbg1NdxspX", "GRz93g5XIBktoeuPydZa4C9iBXK8P9dfbamcHr8X0sRmWJ9Uxi2zuCh5j1B6BmjkMVKbMS9KLY6prFKmvKlpWTsDS1Hbn0J7Vejp6s9PODFFQX2LrlAME0Xf", "1pGmpYuLCd8GTIgrVv4wS6HHsQd4OBhO0wAnU26efFu6Xav0T0", "ut4ABuYmxwveKtYVh2XneB2ZFX9BWb9QUDad88Q33JfNDEquEMftVgSkBZth826dGeGMnePoy49BG03TKgMpKmXWJRBQTH3hwH3huQTsTc1ha2AugUh1EDVW", "eew5uxnoEoT6FwwiWvP7vYzc2fbHs4nUihZaeMOqBpxOlt4GnT", "Ni1KK2ztJpx4JejrENBbDKQ8iC0mSnEnVD5oF3hWsfYAJHzVeA6qVXwBhwy9hAuBNzzb2g7tJe1av06YACMdjIpODlVuvP5IN4rNjzG0bHbWFf2QpO1Xfqvs", "bRkWqqnBseZZbnaC39hImjgb6i8jY2b8TJcH9NT020Zbn7mqET", "9yAnaEVgx2iWABqmRxAuxAuVjhaVWnwdl7QJLu0Hwgn4qboHZwBU63zoiYJEJGp4LGMe8Kv40h6qIu7prGKvJHj2n3E6H49aIVEQp8SnpYe5QltH2DDJSuLG", "vYMCcTmsyzIl7iZuGDzgwsww37GW1Zkx769jYubUtrG0Znunyr", "SuiOplT5FUezRm4ZTcR36KsKIS7AD5zfyh1nRUqgzSeOCivgIMhOeZhuzo2Ds2qqhqb6KPlHrPe45ZiNwPjYwQTuFV55VvtBlSH4r2JiRxmWXSrRpbxm1QeE", "ujJNcAYMcqQTshCIfwmAPebEFYyExcTpJkAwvjIXXgzNN9f05Q", "AS4lfHIbVDEw0VhARarh5OL4khBPhHnshrbM6tyc4AW4fBD5l4kpR6rBn3YUKMKzBwMInKssSOu5a7AJAt8bz0mk1ICLeXKqTe6Gww6OK1Us6cAGVGrSGbCH", "uNaWutKLVOZSKgoffGVltf2MwrpARzQJMypEp8ZLW7lrnZUQqx", "BhbB3V1qfSo3j80WLpes89ztykRQAHNKwyTxTUm7uaAdg8A1yms4vrwtaNJkcf2YbWV5yHAtpIWUReTNRLRKBNElkVTM8Wsk0OnydxrTFMvg0O1RkTmvoyeX", "R7rabkIb85Yj0PAFj5ukUv9CMv59rjgHoXpQH7zNAX5AvFPeLH", "OnBYzVR4eHnKYbqNz5UzReUWoPjB22RQpcwo7Mqkdb2BBsWAw07NccrOzYX1byQQYKDeg3OHfQQoHwyDw4YWgNsdvQdWM3xvN8Z2BvJoLkccgZnbdL7Hi0uc", "OX8kY3duBCwL7F9Rxk1cHpDu8I9pG3RcZXN7b01kBv5G9Df6vh", "iCWt6eADTOGs1nQOv1MulVqpkz2P3x6k7abBDlOeAeXBQxXLwrDfN1S5yUU0PZkW9LhM751FiWQ8RvRLmcy7eRCatfaJEKnNgVilYj0GDOMeHnz3Qx92OLcI", "yDZCVMa9pGuOzscAEzoVklX8igA5znLyyuATEid4yVQvO05azr", "6icdqJJ1OGmhEkbNBn5mp2IFxeE1EBsKtVvkmEjATVphDQ4MB891ARE53S6HezaXSVFEiyMBRBqcZtzi16jBVwGYOLn2KNYkrlwZkGi9PYmwRjeQnObIKqqg", "BdhTzFBq07NiL5qkbcg1JKR6g1O0pCf0nMRmZccXhzE224mceS", "dxk43R3PPsb4sMOH9xrjTYjhajlKLPkyKV1Lu4kJxJMnfk3oguY9TFo1wXMIu4EEZDZTGHlDa7yFpz2TuYaLlOMhtgxnlAzINYkdpVoNalbNkdre9RzuoKZh", "0XTjfS22zmeoHQApBlCwM3YVTWNHowwoRPY6qY7pKjdb9nOLWa", "FsclN5FiK3fGq4eM9UuEJExun6gBPCje3LOOQd7ihkzVmbrv5l9Mx6GkButa5cD8ybWMEb5tL2O8dF1iyB2vFGfOBWzG9CM7nsRzUWtnYHv9XxpT6rPJ82iH", "ZhXirtncjEbBjUzFmsPHnEkt67BEAtTjY0PNrCzaOak75jNpbk", "6NyoE4wPG6GjnohCBYM87kjrqmYBb7vfUtRjwL8CPPuCBbOL8iTDTA2JwaUVfP8AGatCvzPLMHVWqspyaI93RBKLjorPBzXSXOcTN1miGHE7935kJDliO646", "uvT4s0UQO6rj6bRMsdT0gXkykVg6biCUbfWUd0s14hlAIAX8oy", "8SVqOFK5KtnWLNArrnphnuMW2cgZkUWrv1fJFzMZr83CVB2Kxr1kjLEmxuJhNpWIpCZ2Bwb24cDZmFtj4sRoDfYAXppudMASWkUfg3gidtFP666AyXw9ASHi", "I6avQlLuTna7qGpT94rDAxN6TIFbkUJ0YsvzbEt41TBph0Ho28", "1A3PGWhT8PxPQVHJSsYKuXl5NT3eH3kHDngRILuOipn8J3Qjty3oVnrqGtUVwEkA2QZIjSgQHRYYUyIMuJ8O6zEKshonvYvvxUDewr4CJbklX07SKFoOD2j3", "hXqd3lW0GifAXjMqK5cs5jINx6mA6TBoy2P1lt2zbfA9OUxhZZ", "XdHp0CvkKzBVn9VA9H49GdoOkCtirQFO3UD2g6ky6wUr3z2AE6JTh7pSIi897NY8qj8WotVunxjoulz9pIcVORxg85pDQLLG3UlrLEj8BSu5CtCzAoUYEPEK", "S1XtLq7MIsDd6wjHMeLWVXWdKyBWONqoNLhi9p4SfF5m9n1VPK", "2usWYCShiq5WfQrK607AQlNWVWJWzgr1ahV6tymZmp3PFuiLspTJaqn3K4aJkPJI6oNxm9UXwXwBPeUFSxW0lJ45LcO3zhM3WhyGqSlmxivMKPZkM6l5NnAh", "PYkOG4RklP0ZpmJkSC4mbdVvhG053AkQhUmxZDhIafqNP97rMB", "cvo7pULpZMyJmflYaIjFbHuPeIYj9sujmgobA7QhTMyFzklZ0SobjhyLzX46Nwo9bakli9RBTPPT7808bnhKSgePBgTYdHgEsOxYVOhxm6OtDO1o9j6bNk0Y", "RU42jkGZ7B7capZMtxF6KFsTwz3Jh1r6Tv8BeMklYqL6dtSUof", "Z8sRaoQb56cuC4oJFSfzBBnUHQNhtCLSIDtq0IR5O20Y6opLETIPe6tuUFZNPunf6hW6zv9Lx9r3vhM9AdWmhOgBdEX08KfCz9Gw5QH2X94ToQay37ikVNu6", "bP4hhjuhrAdwYty600ZoP9kSESBhn3nOSr67ZyoQ8QKhJIlHHK", "5gRn6eDFL1I7PiyTqVRcta0DFHU0YlIbPhOVLalhb1oykkSYEr87P9JeQncxWsYtavOvV7a49O0t7QPLIXQhgjK5Uw2ynYrNTEIwLt0UFzLMPkfhI6Nwnh1I", "b1GOa6j3K00fry86xTRLE60WANQy2SGcTUy1Yi5si3WZzedv72", "GJ9EpHcGFcgTE7wB9UtCLZDp6ATj5YkJsrYf88tOkXpxfl8mEzwXY9McJnJNL3eBuAr3IiP1GEyty6fA5bhbi3DzqWM9azLU9AVSsuT67Rz3VcDYBs9tvKtj", "oFsOCBrMLKoCFFGKeGN7qYf2QmvJ6o0u2qHE26YLQKVdZmxB0I", "IqqxqEjmVnYVgYMvlO1JhPeD3BzyNzFfn3beIIOn6wHkTdfEzgVg39r4Jq1gnGJbJuDZDbLHXc1yDgCCKgqNpiQ8WRmKh6t0y6aBhtSCVRBg7LsP1gnpMDvt", "eiBJm2Hk8runiKzDm8rrUhHTO2IiDCZpuk8emPOsFIfxdd9Nl0", "EDiVf4Xxmk9MZ14hfp52hKILHvyOIhPXt50Y9YTtGbFqaIVE7aGmsY58S3WijtFcyE85kbz0AColUIzZqFKjlPrDRNwAF9kDNsJ5RG6aSuLvAKU1XmkICbUd", "wOnBXVNtLeyku2KMvfF5xi6UUqlgPDJKb4V6ZqzsUwdMwxhrbw", "vYe119qmnDz7XY91ehrcZKYAgS8NKjIDFwCG320rExylV5k8makKuGUYicw0JCDX8QnCQm3ehzQD48Lpi39cJd91G30XFD4NbqX2cagJX4UaBnPtqYU9Bd9P", "g9xtKzGwpmyPKcjsfBSqzrjnPBvYo4ySDtLXsaRiMP7g0oWfyy", "TxnAiAMdj8hfbsYuOOSp4mDARDwxquuJrfTaqnBXwtAVjgN74qv9a8H1JDx98rQxWrVKfhpbYz6HfTPiHIpsQ6rjJoqPdGN87qSkXGL5FPNtrkb82QyQWq7n", "cxBGBWOGMo1s4MxKkIDb0oj0CgQgWXR8ScMd8kuTZtLdDGvxZ6", "YZsGa4wykQUCWwmtatbSM8JfkWvfUUm02cGahAYPa2b5xMwVFXxZeEEOk93CenDeQTE5cmUAn4FkQ9FfhACLOQh6ZkJBWWpux3zZoRkZVxHv7UYoek70Ao6i", "WNt0thsrirOUH83m6IiDmEzOz4O7qTnMqfLiMDX23vXK4Y68rm", "JdzI2yKO3ArpUgUpOo1to4oLMqsQyjDHKCXK8rj91YyWEQJaCKT1OGKk6CB5vMKEWqYchHjhogD06UbHp2IDIawNn5QgPkutaTVGiCxWs8Xxc6EP6WbN6Vkr", "a8YxsQqRrJfaTa4MgZJGdXgi1H35mnxKtTFlt3AlMnJpNL93tS", "KWz0CyHF410zLtQadJdn2xbJkwfs0YKK2IIDGXSIYTFrKfPxx0jzvIJdEwVCSqWS6mfMJ6dpXsgrY3nV3WSwmja0d5D5thWzS9KlFxbmnFcJHPmItFFfwnda", "sodkU9hwH1hWwGHkUr3lGq373Gmz3NXuCBeeILaZLF4HULzyA3", "hQrkVszFp2cNumWYQmsyMDEOSghSerTJHI1kA0zx1bKvMoUkbKjvVvJxb0NDrqW68XqGYpEZOWUkJwTuECpj58he64rxtL11srGOeSv0wOjFKC9ZMwGR4x58", "0u5tF4s7v6UXYPWVnFk6PsdlotCrpFzp93gM7WR1dvW9J2c6HL", "AgDnPzfbqUooJvrxHwRjx4eUCvWo2m9AQKyqKdP85CuO7jJPgk6bni5zealeKvokDkYXLyeQAYmFG5cwoiXbPbY39JfTCTBQEkvZgX0o4m3KqgEeOlDlKjoT", "2TwDv8d7qWeW4eK6PNQD1epON09ijwBjP6wICXP244W6gqC3Ba", "GBC3ZZ3iFmePW2VQKhyij2kF6Q3GUCqiN0kuZndnYFC2HhSaMQG5Q0IWOJmsTaZpaHj84Mvaa5crk3P6TfBsdRM2i9sBhP0GgkOj4HJeKwU4xrAQVJG8kd8Q", "k1bRQah5I3oKI7xc1RgyIoNn7dupG2F03pQSN5Xf9JxPQu2SLg", "OcTlNaPHOfIbeJO4jl9GOGZMgyGgOaKmCnYZMvpka7JCOiG8ROMqcuCIsQwG0H0C2YkOTX62cQE06T8XpVNRNXiFycTwrT7u2pGTMNTwlgup91MwUiNrD369", "gZ6X0BP00gUK1xGkbAZkBtefZ0Wn3auh7yD89a89EaTFWhx7sU", "q1OUfvS9gWkbBrXMxhx4qBeIP8zMGpr4pDYU61dnVLMeBt18YwCN7pfWxcrBQgFFtmhxlKkEe4spwrvUn6rvvUPq7G0XwFknzRlklTwPWpCSg8uSEmN9GkxL", "zxstBch83QrnrnANaNpHVkhhU2qiml4lhufqXKyYipJZbSxBpk", "QIS7zw9ndwWhfDbI36a0fInwsOOnaBX0Ty8QsHBVBiCpvo5xugvXwiSo7qZh07hR3psv53REjb1fP7aIlVnhDFUI43z48fVBUL5XNWk67ljVsJldmYLymnGo", "qGqzvJ8NfDt2hd8nOsIF91suXBsJy85nMvkFFsds4Uul70YTqo", "iypZsNkkehskUDdESs43i8XcscbQ6PDoN0LFL6z0lqiD3LRTCTXsc4TUh4slT5Xr4t6Pz4Piu5vvPKOZntRPyurdwkOQnvFrmJHjNeRFiM87gVeUO5rMyjxu", "RJIEDV6zpLjAxAOfVWm91ObQUTkQAgKbzbnA6rAtCr4AzQnUwa", "ewyFKQg2qoi9PgiBqo2yiDpkLpA8H4ityf7I3nLsc31zhjAYVBUBOKtj71rO6YI4DPLEAg6kh5iPosxI3PRPjL8oM0BQYRTjooxyU4hB9PawFVCHvdgcwpPJ", "najJ1C2p0xlSzQe7pC13iDKboyBlla4YAlp9wrwungNm6ztuBu", "xr5FSuBcdxCfTLQJSK8PFv5ai9ZZ3iSyaXD0PNc2Knhl862aOBxb40BkAiIBRkAzFLzfiaf0NNkTRm1pvzRyxai5J0HiiRfykcdTCIRXdB02y2qrzFpupW06", "WHmDgRBQ4mrE2JmgUmgQmWIjl5eZbcd6rQJXrUvtEn8G6uuYeb", "zR5F8pKmOuMz0DPJkFlg8zRGFXA83pj0EmFMbY7xSTxQhKjPZS3iPUycz7k3uR36EHQnnXlFzgfe0M3am7IBZEnZJWaBxbHBqixdDiqAMVoMpqubvAkUNW1g", "2ZsxB77zn4d1mTB6xySkoLMjV4BsaDXckPYvUftIjWHTxSZuOz", "fAKzro33gcEDCyaks5PlL8FcbC285R8ibQfTEgUtIi4VedFUgfF1lSdLffRi4ZQgy37AjZ12F4XthkONNbM74zShctPhRnLNqSXZ1XZGb47IpTdA5xH9whqY", "bDD00YNo0sNzPvDyzLEmmrxroCyiumFTzSTx1olzg7z42A2zTH", "kG6f7tr6ZjqmCqFdlEPXD4cA8cL8boNL2SyAJqEsX2fkssLc6l9JpjSvLn3uZPGcrCkA2w0aydIrVdRbMYt9HL4c66WfVkFKxzSxvSVu4njZPA9ji2tzLxZR", "134WoKojJEgDfC7jxoIKwP4eRvbks89sBEMxYBgpPL04V5nSt4", "lpTnRti0bY8lQIznFVwwILHJOkM9CEDv3fiTYOR9xasLqr85K21dOGuk0GtBU74WknxG9ON4wGQm7WsSZr3v6vf4BYFedKAN55dET1HOHhAMB0mkqpfwkK0u", "rEYUWgsbjVnCU4Yljh8vhufXiJRQbSKSgqxCUnlDIWOnZwWIde", "DJXroD8GdjgwAKm7UFuFQAjovIjSbM4mdZbSmhiQROMZi6eAJWPkg6YaPH0yc4kFcKfO1NmQj6zPDdZU9wEo3lOS0MQaQ8o2QTPQrBqYIoyTRVxZSALVtjvt", "5JSTRGUqjrGY247Ks3lIYjr0rCTktOdwh5N7Jpx3gBZjFg16hn", "OGUDELPi5G4gAkkXr3Nm41veiAIkG0VcEzpSIC8LSBzavj8klTWnSPRBZivoiOQwNEMdQTyrcxRXfXFOyjBR8bcfJVTztstE4DpUgnLGilnLI0hFjtgrSGXl", "lyicqbquofNTQgj6RVSiV9vF0b6SrdBactCQU0JHdgk3KT7kyX", "QUhLhfwn6lPFL17VPZViq6Ma7h2EP0mpSRA944vApKQ8JVdi46PvClTJQVXpWHcwim4lqzvdJJlaoMItShmcRFvplRdFgF9N0D8oC3STLB39YK0yzmbQ2UGl", "vr0a69x6L5tV6LzRW0b2KZ1IMaiM4w7yn5YsCVwVap1gA08fyh", "fHGeZaEFwJC1Hx4ppFImksZlWijcLiJ0xYfW8tl5Av4Rr9EgOWQ6MystgbV1Hn1ELeiRYUWgNZ6EgIt4pH89F00vaUurHw6aYm14GWlc5rol9fnwvv6Au44U", "YwJpsNPRAPVQvE0y3nhDSU7NNBWFGYjoU3cLQzkaODzHSxDVku", "gDMoYix2xDah05icO8Z8hwJeDlbRFMJvXgh3Od6Jog0ojgO5nyDUuX85GjUT3oPYS4cofi7UM6G6mfBXbN1Ts7W6p1aqnxPF111fj895CP9x2JUdeU4WbbcO", "aAFN7ea7fbmMhvPsIXpLqHySl1wLcWhAhwXoY5vBehXLavBtS0", "EGGAg1BcKl82vpwQeVTXg7FCRp5cgVbujr5PqE19099tx5KZYn6DtJPK7SunxVigKl59z6GzDPr8UBh1woEp5d7C3200VggqRjxQnDOycF74Oo5IaJ6guDsx", "FqvjWbZxIUM5hk4Hx9LJxPbWihAbt0Y6rSpN1MJKqfPXNRoIa8", "bWXA0DsAol8LrznfLo1e8sJWNevAwUIX0nhy0X6pGEA6CvlXjmBscSM06HA0lQVjDAhDil2w0A0C5lhpWsf6Iz6MGEM0erhr1N3h83c8EcIHMz4qphw7g1Tv", "DnvscahcxkJ6otC0WTHqSMeG3YLiZndnaWdD6Ip436Ap0KnUn4", "IEOwUQUp82cjnBFQOLiBNjHVWFqJhdOzpktJAM7GOjzBuCZGWHRtzhPVuFpcqBZgvRx4n4I9mGIeSrvy6Ks5zFbuUOUIZ3wSSuUFynMi1eNTVIQcaGfaVEUx", "cyF9zCaS64f2p2jqe6IAMikwwNWRcyOCwbKuluKpyzqmzZcefu", "m1aUxWrSvRQHeLryDcqXSoUIYSrB6W3qVcKQ69s2bHHDa8Bll1IBnmRKEIVImW6F8OfFYWF7lWKJdT4OSMXD6yXJE0Z0XgFf2ssaO7f9czSFQWbsq66v4dEI", "elG9PTmSLf0kkgrKdKZ4o8wdE0YGekYGTmPtFBLboJLXzCrbUP", "fHXZskaO0C8XQbHnSXwl8l5RI4b9d4WIJ4qBmOZkYfFyEXlh2fSAQXZga8oBCKSTMIe6gBrEq6A3btidY8lxeIdERPPbkp547hBlt2xh67ig0QHXZ3UDL5Pk", "VmMDcPFj6QTxQQdVWL9UmQ1JRTWlZtV2fpDHESzJrSGFqtkMFt", "rzKqIlKmWrf0rKp2a2UXLJxZZnTJ8gBzdTnvC7hhwKhneUpCWIjpZgP8UqQaWZZ92K2CShtM1Y8d3xqXDZNlEmtiaHG6qnDq7D3XuuutT2WUxM19uMu86log", "34krrxiy8jW2bOv4QQYLkYUeuOk1AWhBaS2PNiMWPqY1ES5cqc", "xaASD4qx5yUn92DASasm6IcdHq3MStwNT6pg9ecEc4zk4CuUlkGr0sSHgVc6OWUqdJUmv4yW8wGD88frqwjro96TfgZ1D3poLKYGOWmVQ0gZ8LQxH7m4HqXu", "X4vi6lWR32hPWSuxSYUZusW90GBF6g9dl2JrlnIopxEMP6Jqfl", "PZdtgb9sqDYxrJy88jwOWlMi5joMXT7u0lnhMuXB858xN45VmzsIjC0ovmBREILC17rO1OZ7Uf2pi6IU5AkoMkbGUmhi22v27kQ79xEbaFQILgkOpUD9CmPh", "W4NW5GYC1yJAtWlUl9k6nVUczfmCP9rvEESHV0TUzleqHNI0U3", "4HWWuVCefZnUVzjxGCxiguRIjif1g74kOYGG2Quf0gAVftQu3LcjE31xjewNlz77XLMZmGFkuPFaGdSJy20A3z7kb47M3ERYZn8J2L3wkGUytwHqyF0zE6jp", "8q992ahaMntO6vIoBlm3h1teGrdUvLH1BQ8EzomLbfhiaxWkiH", "nOIe0XTb1PwHO6hXIeL4xujccIa70GMncePcBsCBH6QgC7DUkWYhQGK1Ws8W8SHl4gLGYXPqepUqufJeBrMZ5eabWg5e8MND2jRbGoPsdrjVW08fpUEv6nUc", "TaGcwcnzLEYZ2xSdo96I9Evyi7rmuMOOwdyqFlpaxN9zIZa6ig", "MpvHobPfOJzkfvNdkcMZAJvIGBroGYVcNOu9xHnLYm6EgRpQ4AxCRqSi2IUIqxsBLkJJ14cYqgmU8ZsAhoK9enpe5JutHn2aXLrXNU5CApgGMZQ4LjBzW0cZ", "HWSWHS7nmyK9QNLZA2pWZEauxjrRjT0zySVFua2gZKoxf9WpBK", "MiWuaTeSsLtsKrIo7AO7rvQft5mPvwhFeD7DeldW5WONMgBRraYgVwJO25mvzTAefHpJ1So6wCTIrfjgDGKiCb7Cer7eIFGxX5FWX3aTD1k2eRirh0asZf4E", "UAqmP6kuBzQg2y7D0pGeHwWyx4qWhtiB3YxQefLnejRegZsgO8", "Id4mczqQUXHCiIlejNJ29wjaaP7Q3UWM7b8hYx82SNF9gynNJ4PS063ZUAzXeUrk5yRbvXeNvrWZpHw8MJbKPctrmrPPLE9OAYz36dR1SvaHBUOVnxpAZj2L", "YPitdpHmOEpSqETIA1YJVwoGtdQSKSlspUlRH0DfF273HYLPXt", "i0pWEg7f8S5uKvM4Mb4ZFHbMKqteFOXxNLRb1ZG8zK2JFMNZxQ6ChfX0WOelkBh7U6jWdxecHewUyH1th76NnbNHz12hAhpfoY9RVl2lPyDLDFEvMKI7tdOq", "ePYo6NRstaIMLK7iIJ3TYIOsae0UHOIvnqisB7k4i2P1MUkcnl", "6L1SEc5C4MaMGMBwEM3wPlxolHITs4EwPGObsTnuoME4iP0uk1o7ljtW19ztDDnbRBCHdyBRIQTynRqVSecDOVjNfiEsu1RLAcdnamCsAfoy6eRXI4keXUzC", "AB32CUML6x6ejJUuwIq1wHYDJIprkn1ty4vBXHUbEaEwtioozc", "pttN6Bfu0Qh1Jf4CoZSIAgrOak5OY40Lvsi21Ou1mb23E4F3dfJoKAAutFHPHHlD7RD8p57Zg8asCotoTDanLkiCyxaDEJOKkbQYgW7KegDoU4cvHCjbxPlt", "ML6YeVqP4Hvjn01PgCDAHq4W0n5vCroWAt4pMtCQA77v79KmJV", "uaJy7KlCFv14PCxSzHL9hTEnOJug5D90oTwtng32b34zFzRCGmLwFXjbqbFuoOuaroRcUTd4Wh3jfUvtEEpTlW2Z7FTwdLUTAw3ePgitMlczDVsRhgsQCuzI", "9TClmgCuaFZxuFqEzQDAv3ccjU2uN0CURODD2N8ddfaVsPjppu", "0jxcLh4MbPKlul95y9T4k4hJZaiGPV8PE5zYk4sLTC4LxBRtLuy5yfOVD4jdar0ow0Mh4E0VO3rLEGFZABf6o1b06Idg9bS3bnidzh9OkyjyEwYM5BSsC1sG", "JTuQ4NTgACH7tOVbMDZY77uBGK3RJvhcOc0SxU65eOCVkg65rd", "dyjW9zqCQ856kTgjudB0gnMqI5WMANxlKgHTg6e4EjAwBof5Ro35bOwrTQBdo9O8peZVkDYwxiq6VWBwIE0uawl3Mxe863GtfqNN1vJwb926dD1wQ1oyvZ2F", "UgOYhcSMQphSk0OJ8PQlaRf0QTzL1zaTdy2JZSdzHLPzLmIRBg", "Dl5qkVIhqHgPkHLkauAEsRZHOs3fKCJVyPJiubNjq18ZIRJtKU5CteTGWVtohCJdbdJUCgD3hJa0itr2LwEDagR49KrqWAU6lnawSnx94X7mOypiu1vShMVq", "eMfAU7GGuoAMZ7UdebO0aDiUCbvuxQibmNkGUyUNnehKjByLnK", "MLX2nheibb6IBsdt76pZTaC8vvItF5DZOibBPFszpyFypspuweTPFfWAZo1mrCLFsuOFAGCxFRv2IkwEMPcb38jaukMluhymbM2jdCgqeZsuHo8eBiFEozoi", "hARcpPMPmM6NZnBBK15cpBG0uTDiS1R8AqixG4M0PTLyEW9YXC", "AKNOIFsVyIVNQdD6aR9vRYMmWaGd6nnH5AdOOVtMoMhCzsJaKSTlypWSPm5VYqkdyM1MrtgdFNqDG7nYXEHV3nxSY0v4qeho0h9papTnDH0ROlztzEM02HSY", "HMc5yJryy0nWqEK1VISr2Pkzd40dLQBaknfi5Vg1VSYLgsKA8m", "189k8lo6O8UYiFJMxMrcOM2wggm0qsls1uc7dOB2WfYFurZqEQSckSYQ8IPzA8rB0RIepTeK7CZ138pHWFrGhNfqf2pqAezA3IoqjSAoejqipdxJtnaaADQq", "FDePpdZstOjborPTZD9Or4ikrGK2TjqiuU5i7eY10Fcp71GgFP", "24RioJy6JPn95gdAOknujnAJcHLqvYFxafeOyaSH0EO3u1EGjzARmKkNZ3DSbROB62X2cyHcCfe6eqMLpUmbnXwMaAnAZBJdDpfpnwQzZ43DuPWhrJIeoFzM", "NmUwxoXAbCxO6NLdPOqHlMycdFHPSGmp0Gjx2G5bQ2zWOK7lix", "1RHx4tCJIeX2RXH8UHMXtmXsGvBNfrIgJYdLRoehQBkqg1y8ILfB5C2K6Bhl2yPJW0evoGcDPK35J1DaKqjQ1jk7uPqvNDErDrm07NBVfEazFmXYaGwb0eiu", "3WpPj2Gvt1tyM4R1I2yVmV1Mkxwkbecd9Q0qSGjJFcFZehZuhV", "ORzPljNhRwK3XTTXJto3A1dOZG58AkdYBcywJJekFyonPFKg76hF6LdfbgljQOIZzGWIX83k4pXT2q97urNyA0djfOS5lkdiy90VF1GJolkpZrwSiJQqI2Zv", "O0y9ibphkoAxnOEc8yRhqL7WdYNtauoysm6bOvG6jQ4XnG7vFW", "a3riZUEuLon9kfuqEIkUMRtQygh3ZuZ7vPnSt1NDp8MYlGO0W6StYLHWzwYWq7elWREOTZbGfvoOCBMiHpZp8rK8nsecxGLUiZq96RPjMC8WNUDcJmQSbiYP", "aA1VRMx9unIyCfiXrq3CIEnczD2atYzTiyw9JuGDhWBuCrR1hS", "C0fxaeAaE16CUoAOwTIAe0hosrfHqLh0JMxr05RF6XRYJZxD3FMfD1T3q9KgU2hnOeeNk3aqYzPpYK1ZZNFnOiqEp9sJ9Z4VCgsujQiFP55yP6VzRikpPY1E", "ftWoTaKdHAXybFC0LHwiLQhm8PZXyambRIQuqiV5s02REESZTM", "HmmxWvK5QIdCs4SIxJ0SMqROIfciE54TprOLkjOAz1Lr4n7145RRwspEXQwjTyBJnXeXG1gE2z36kB5pGVEAN1MtPGatFlA2HmYVnEjqDluxuyk8TwJoyfhN", "wIE91OBIBjoyvVm6Ef28dmH6haufDa07qFGrbS8m9uj3NV9cAB", "knw1rbZkGnKEsAR9z3Z7pizYlN2tzA2jwyjnZIXn3r0wzR3zUc4KI4q4RqvQ1x7vuqiR7EDA3D43e709h4R08F2Z6xx5u50mtgE0sR9weBxGJvPyzqy66yfA", "vbFogDaXtmYmBhgpqd67YT6VI4bO1FWwqliUyH1p3XbFCH23s6", "AOaGusJTEKikEWTx0PE0EFXoSk3TluZvI7AAxTc9lKrzrIuph6puKLgm3hFobnjssr0qIcz3vr1m9tZpyNhIiN2l4GZe3GWv8UjQ7jS2YRmfKJSIg9aOUb7X", "reButfn19XPEEpEmGyPZIsryzQLU1Q1s5CkypVxy2KDGAP0OOO", "xgEpcDDvfEMg4PqmNdHIcIcnYmCX9Yt6E7vpI6kyK6cMVR8q4O8eglPCVajc8ajLfcAyjsu1xUMQvUHyqNaW6yjaWQCc1vxeY5cFyWGvzcLs5aqvyPQ4L9er", "XrTWkPBGUlVQImLFMf7PDyJBLjEgqqVLfysQN1gqmCG2waHGDP", "gQLzaegoKWenpKlhi7gOvTYBVSjljwANNTKv70jPULCJdvzL0fiv8E5choNQjVl4y5z35iSX3eqfXn0YTgRZvWBcLW021l6xo50rnSOo4CTa0S6T6X014CbN", "gZPgIVd6YcxL2L75YZfWzlz5Iz5K9ghoE4UWX7b5hYOksUpO3U", "u0Dr5Vo8owpVk1YEX3J891fVlVzYr22j0Fa6iMEWG1000WCYZUeiTHECkBkbEmKEzsIfFVCTUAUVge1D6dwZt8ldHVFVFZiESysfR28wCaPqDO3J1xtu3eWL", "AloPIUckRSNsUWme69UHXVbXRUPU8vnGgaez4GhTi5MAb6ofGI", "vllWIC0if6dQNI01F3FwWxzq5YxtCB97wudD5dvihW84m951AKwgFvVKUQBgbKlVDOiIzb0g66lsDosN7m2KhVd9vonU9YxKuectDaYJeJAs50DCmDXRi8bb", "wM53t3NnhxfuVDCAUK0ZKBk6PFV7N4jHRmLIng5SeiN7vXFNrF", "xBPhFouitHnaYENrUAYXdAGyH9TVXKkUT79gv3OpIBNoNkgrtCPUMdSbmv6JDpngwuKqvifBs20Fle5eoS6A5YjrRqBcdwGZraNkG2w83uOmWTQKvUSy2BpR", "z01axH8mrVU7YQGZIcLo3j6wDYuDijcfidGduOPjtroPG2wYeF", "LfyRb9yVMgDwLvZbYRxvApmxE0z9ZcOuHNJtUHMrxXlHSLqymorvdcspcpy9RN3hiLaCcu1YSnps6fpqTgl4GbutPq2qB4XtN54zy5XOqMEw03nRiWWy6OpV", "CqJOspFFuJEqNkED4T84UtWCP09VMyyYoIwg7AvzT8qqs22wVA", "z03VAQTJupIsL48GlDQeDrk1ic3iXZqWXrzhFS19FH0aL6o4KEhV6RWm2XSZ4I5b74HMUGUjXSHqY6tqKaLOzp81NaaRqf1xhIIBWmu3EArkGkbYIuxIk5J5", "esUUVVSDlkMHUFIgP8QfszB9u8RcCifqY9K4dkFMSbcuquaD2z", "sty22q8RQK758gDRioBxAcYmWNf5af2RYyTYpbxDu5H2jURRIbOQDuDhFqkoVmF2lgaYFYl9b0AKUbjkA59LzM3DAl1fYEhHuGn7mWHNXPf1yMk9RtUODVbN", "Ha0nog4gwroiN53uSguQ2cXTV0riVR3k13XqjZWdOIJmLKen0W", "C08jRbhHJDgKvhMRV300hPI09eJlPHGbIOJh00yHBea5KwWpzWpgt6f0iwk7D0hTM0BMy7c8kCD46jr5Ffk7lN7TJrYWpFyCD9WCG8KyIX2OGuSTXCYIZejq", "THKJXIVkP1ug8EcOjflxXDP4NxKub3k3I2MnLpYkoQOud1HMe2", "K9FjDaeVUEWEHoEbcZO8ICYe5BfMYHOqQbXbB96fNcrcR5B1dZ9vmfXprDBNSZBt8iUJpZwDBnnaqzbRYiMIOs7D5IaVplOxRrEGQARZvDAmCjDiSY1oQ61T", "PZyCILAjCMxaXN9SaJCm1OURuTDIaEjxnf950HmAehk94uZcBk", "OC8rb0IoIs01nlgvofAapoGavKUVxdFJoL8PLRCbHCa5yG0mvALjxbJqtlJoMW8ArEYAfklvuJ0qaydT6wA1XTsOCBDZiJhXXDiBvR6qj6gJ2Hk8Dt8iK07X", "9K4pdjN8x3JsSPgBTNSVcBcq4kWOidtrvvhWf2fc5wSXM9hpU9", "J6KtuOdRlJ2eAwapSFr5pu2HQMO79sGQzbJtxuIiDJNMFv9fA1jxtjCJ5bQCThdQGuIDpau0tHM6AWmKVVFOERgH06TSl4szzABmj5maK9hUdRm8u1U6QALR", "Fmtyrlyou9abEMBWTq06FmE7lhDBpYa2LT1ADxy56WgIspmMem", "StWf1FKCQ7lzA4Q9Cb68gAeKQW8CqmwHfSuehEr5La2TcTco4iwjqY1G29StvO8Zo2BVE2ZZab3C2dy7MsoCQpRTztMsGUP4UbYib5FAgIKjwJoGBcQcPr5M", "jPDzrc1LBZ1leGvJXF0RYmhiO5IlxN8ekLdZves7Ctqo9l7ey5", "5VrkDFqVzlq7PYQ07JczOoqEdxxicwofRfQctE5sxvxKRLKYewV1jJFKGD0q7oWWSu8J6D9364NXPh31bW2IpGa3RbuYNO4nIA6ONFRRJmygRzg0VgHKwrNL", "QFtmdvZt5gHStgtBQpprmVsHA9Z4yvQPAJBmFifKOvlGZcR0QE", "pCkfSsmzwluM83eHnrzQ9MJuctV1rtFe5xKVn6VkpN6xOiCBZCajYtd8m69bzMG3IYY5c1nSPuNlaavAmVtIOUQ9bXkYryb7W8D770ZUsuGRSBbCgUU2wsBV", "Pw4FsdMNjZUrY1LOvZnMkOYOq3PnvaGJUIYNuukdSESyDmK8L8", "U4U1QL2p6vQKEudkFXdx839bzMNJTgPvksw9DyyHuMb6FCrUjSSqVZRUwmlPQBKB1FKEDGT5d2CsF1KwTkmyKBQGxBdOKvXLApXM30Rg1bWGapA1Zxzt8N74", "ZkQtgxFokm8nlYSm9y0inAjL7hEE4KId2iXgdkVNWd8FBa1JX1", "1ICidHPqVUAl5CTar4KMPpxY4764Od3NuD5XVVLyxTk2eBdVGvrfimBnrGpFrscl6iHZBcX86H8kRjFhf4KLoU8gkvvboYNsEcRPEyXIEd0fNDM0FeL48Sis", "NdS99n1NPSkbPFudtuIE6cELEXPNz5DLhdUqQUCpwwRLAJw3BE", "HHoTd100My4ZHlDjbbDlRAgqTq9QrIc6aRZBQX9mTDLkyWSY6fHXpxLJlShckJgIiFT8lbuCmEvliNHo2YLqUe7D6oor7U9qibwTArfw5YflvwayTtmvYt8e", "hwTmRbc9CXaKODGRmwCfqmbJgNECGLqxHKkgvKn5rNPDZdcLXp", "0OZafDxuPEDEBSWt9RCwU1IrFrSrA0e8OCi3Ngvns813ZXviw7cO8sDLhfBpfny3ze5NI08A77Cgc7MWCwsIp5cUknKOaGPYuUtBTzLY6VCgaYCmS43H7fmr", "S4D0KdWE7PPYOj4SEG8nmIZFKaURFEHfISec5ApBaCjwtmN82V", "vpmS241WWGjlu1DYcHgRSGb9BVvYdw1WjnwlqxFKCy54yGcaXIzxXa5g50EgwDAdz7Op2e9CaCGYQs6w95tegyKlxWSrhcVghrTiTcu4oBaD1h98m2mQz4Cu", "YclGEEuu6OcZ0WbnfC0ht9pd9a46eE0DqmR2yLw4hWci3DTgPR", "NGYBuhlwoNAmY0Wz2VJxZ0TBgUN9BmaW38hvoSraq1MM1tM1OfyvdQ5KsSR3C0YF8FAugzUU0pqziAz4nxxRL0jESAFfAlsH11Bfye7zTvw96vBrr8IA91OZ", "AcCKN3bM4lz2N6zo0wx4p6vgECrLBDvLn5gB8FVCyVDLZA7Z62", "du8ZYLlNgubZGOfuXn73y6Y9P7JXhOZIIiro3aChVnFj9udhfkkboGiEN2l2OILe0AS1jehEPwvZqYETGw35ClJXl2a9KtlL1EKkq1wGxrnlP1DexGj7z2el", "4CsM3ef5s0pizkwvbjgzirdf7Mk5MPqOZikbKQgCOTtNDnIpXx", "oFoPtwjd150pTYVB9qbp0zGrNUfdJAa5NPSEJBsIEq7hOcqVQSKRPZIk3vOK3yNRNpfgyVyCM3righE49WVX5mH8ffQjen81angYJckdgbJKHXOO2sv7eDEH", "se0WQ8W0uAXBmHoSr5k6d9Uf1QkddwuVbt0zzWztgW2Qmotbud", "hXkBAlbsMEpFiO8iN5CKzsp1Ibq9AilrFT0NFcDZo0oUOuCj0O2xErwVQkcaSNPfrP04zEbmEQGbIRIIpKD29AXZs97LXW0MwzOtDzfPNuygLHwAbACjIhIA", "rQTMwSgqR4ie3N1RF05aH1jq9tZPbqaQG3mAVSzuUhYX2YwGYz", "qnzXb8R9Y0x6QB7ALbaIV4x2ZyaUE6T2tSaSZzZ5zWBNhIV1t5JP7FPeDz8R5aTw03MZ0wezSnK86p9xsQKxfjcsgkHlIlfJm2slyVkOI3WMqdKj4cgjKIa0", "1rkJaPcLRT6PyomGpIdgwvPyV3fpKFoL5YcdxFwNi0mepWucpX", "IjQffwjKj3aXMd3yG1BBMrB8VydObStt9KZoEG6xHeVbHYXWXhhtYq02pdQQ3JHAbowp42nJhGuwmSQI97Bfy9flk3BlLQtwFpmHqXbXlVRXvsp2xzgt8Ler", "PnckEWeTJOk9vJegp6Ciw1jt0Pl7iPy5DYnP2SsMqaVku8OhCa", "N8a6zYTkfCAbHL85iAVaUL8y326QhI05QY9N7d8knGM4ZS7Hccp7wx5xy9NdRMipuqC1TKmGY6I7YQO80BDu7Is5PDgqZNfUDqTg8DuhJCoraB0ZKDTRUJUt", "VBi4YLWlByPKBJ1VTnK4wIbHU4iwMBnrMTtspObyM0IVHHyi3J", "mzZLE1Ovxk6jZQCQI1ot08rGe8WcqZtbWRwjSKeO2i7Z8H0QJmJHvAVXGz94W1f3SakusMGt4NSCfScwFtB81efHemJAnzBDXt8NFMGJkhTN95HMwQSv47Ag", "uUpfRytyszJ7LaP5HsQOwfjs5Bo8JyoBSbqrajpSi7X4hw7wpY", "IlD1bHBPPUMBdmnTeNDRntYKxDH374ZQpkPQ1aoO28afsL7UgKwTBSn7e2Aj6h9tRXKR76p8ENl6isZOATpMvbTXdbHiIObhvt81zw7BJsG0lpOvIEHBnijQ", "Hy6XMiFGbLHZHOkZG0Z1pvv57CHutyJAwPiI5xWhGnEY9y5Oze", "NmXIsfT7XM5qW1GCHL7o0OZEujBz58bSu8jknCrLWw92vNFDhMzfiYucF3bIBCl5LSq6cfP8cZ8VuLibgfHOE91RCakNnTQ6vECXuadU7lz17gdnLsBX1AzD", "ljYYCyc5Doc5MFZTyWV5A6qWy21zA0AvhiRte3ypqYuClRekw7", "n6DeaBec8oaGiIw99aB8O1eGBOin8cutg7XHG9rMwPcehWlr7wxTvZj5xRs31lxisSz7coTWD4Atatkfof8jEqmAFdDHO8zEbwLBinfvppoNgW1U99CMzyWF", "bhUxqTCPNVY5GD050nRgHSBRZLnXJHktyEqmf0B2Uh7ku5osqF", "X8hgXG1IlKZVBXj0KO0TOUBVD3Z1uPERVv7298KvQrOaN8afUY8t3HMEJvFDJTeoMjpTr7MFzlpMrP1Lw7CzNZBgUQtnrXaBGPe5W1IVk8pbVouRu7OHgXx8", "xowmJUxZtacPZstJyisUVmtPtGgZnbijPcTi6PFxzrMWjDniwf", "ARP1qJFUq15WkU6BACaP9XEU3vhqbbTj0tloAyI0zNVhpbtzmROtzaN2W3r7eKrfDaRLYkKW5pDvQ4sCWF4VpRVLSMT7hIkssBCOtWuzL6sj8kuczy5nPb8s", "xZxcrfThof6iByhU2ZDBH7nF5t2TS8JPgE0VtRDh6HPFD4jGbu", "Rt2C6536YVCpts3tOuKZcOozb12IFdCgUCrYGueoQrcJhfA3YSaAoM7PO7fdlpID27kI1O4PDegtIowqGVy4r5RDD6pwu57uCrABECZPrFI94DzIgxNX0mlB", "ra7lfDfp2p0E1Zesnuzp5y7ltUJuF256aBrDMW2OJ0dIYFBJ78", "8D5FwyiDsxFw3n5s0RM0nf1OxXd6qlDywIBsGt67oJ3p78h5X16Kg5jccKgQ3tOzBXqQPuXDBY1GegMBiQTMVCw5XdVYUrYgOM6nEbzP90gng0yOQRjvcfy7", "ITfnKBRgVVUj4R9DRn05nwUBLB4xq229VguprJTLmx4qOB3ny1", "tjvLuGWwCMyCTTsLGiek3Of7E4HFpDEix93pOXkYuikNCdhQLJAMiqTusi8hwMOrUPeqxOOr78CHlth4BqQtesnWatBUEXLixyYuMwlR4vionOqyEHps7aMf", "UXAi5VQ2RwuoqdFsYwgJKVHYm6OtfkY9FgrKAFKbBCPzpdrOXW", "fr1vNlzlceVAnkpe3zrLa0YyzLZrh6LNvMII5H1hwUphCeKDdBXEC3A9Ojy6nJTidjyiyzPsRFadturV3OhFRrNnYLtLfK3G11z0yMsPbS0TKpyOBdbaUyO2", "IHNxaOBbPAbLVSi6siXDWTZh68Ia5gaNvvITJT5gce176jBzQj", "AwAhdHntpqZOBTJTwdvzJXeJck0nhQUpKfWwuIph8N5KqNlk0gkHBOYn6ZZox3bIg8EYO1GWOJqCgaxeGhwQ5SB91kxxmZFQfRz3QDXpWMzDwwrAdlagEmqD", "WlAGINhvoewDrU2No1akwQuXBTCNF2bjlly27fvvJs68K6V884", "s2UkZdDl1Qla8VJ6XQlSK2IQAcXdidhYf9JClUykthK1Cd7h4q8OqQmy1JbjwHIZOZm91ktuPBtcp0JroPFeq1cpJCYFRoppLbxNJoFi07Ip5aguztWns7cB", "J9PivCVHlSc2HpkFw122biwaZQOPXyZo7yW3A2ItSuvhhdweey", "gFeaoByAbW8AIG6pHEpZ7FR2x8ftmIqQVUyJexRFRaNjoTW5hJeoZ3oWBRNwjDKFgHWKEyXdYuMKNrP4A1qh4eDD5Z7pmS2QjWkvUHY09sKWjhYsiMXk0jy4", "I5r2VtTENB7qRfoaW75Dob3XybFyKD0aHrcmi3z6F4wekkCErH", "RetV9p4OlOamyrdYbMcYQpdMTL4dZuv0YmThZX5Ktd6rUiO420cSpFmGYot7im6EWZv57zQ0cUq5CE9ECjezxQDVF6dvrjALI3RN2pMdJAgUMpgYYLXVji1w", "ocsdL0zb3Ox4DJhURNwnAdLgwqAfY9aKlSw4SvfTJaXUtCwKXt", "5hUQMQEW3kdd3O3zQTs3x9eSdXfXqCQvssKEIWiKHLvKhxH7Q9ALIootKTQ8dp1ThLfyqNI7gBPN8gSXndq5Pewh5Mph9rArAqp0D55sEUFN8istJiwgLsOQ", "DD7M2IDD60DH5J9KlPfs5VlMDi2WaQxnc2AeILrOM3gPKph5CM", "xFpjb1RcXz2UlcVvHnE6Ca7qyRdfVq0S5p9fqYHOYHqJuLC99QDJzL7xkkaFaageOpHEMWaunRBfkLmtjyAiHHd10CFamvCAkTN6xxylM7O7S9yA77qOMSNM", "ecxQX7ZGZuKWpJFCOeHpnDzsKpGhHd3tEyKl6r1dlM9YdNi1zz", "omBncVbqAqRCkfA2RErQramz8NKrNJoB3xxfRWVbKwn4cw41AtR0TCxaZHRwaD6dB3GcZlBtfxwFtyG1si1LswvRBKMjWSMfTaF2LQtzLnEEmVGcBFv3ApSL", "7o5dEPGh0VhJuZIDMXS60iiBvcC5ReRYRUAftOLts2BkbTxwyP", "2y5j71LJ4mwTINxQ0rpLihMtRxLOtJmuIrdPqyjtidMy0KPy9EIrvejKZ4gRNSLdIw36skzaNMYLevJl9ba2DJKnL1EjTXKjTNqL7ptS9PnlL5WUe7VsOpfk", "qrRIOl1p9p8Ed1fkQSWlV0EA7h2UWfELWdbsOafVQni3oNnCnH", "wJI8TNpTrJ83ccgDS3o7YEuEFgb0sPImgau9vjal3gofITriWfn2rfH4Lq4BDMytus2qaaZdGNGWo7EIk1LZeadzQi9e47VxxWlX6K8NfNtUU6mD55mkdQh4", "6qg8vB5rhqMm8V9os0GK60XA6IuhgZjmQPsJZyAEmXyv07hs6x", "AAxiK10CjemQQAqITNEcZ17Yu5dbvjW5sRnCRlN8N9YnHM4ihGIHFPn7SOiN6CTyeE85yVBLej7t6BcnPu2fIpmkET8KfbGHpOKnuV7WFEQJN26mu9PCwCx8", "d5QGegYT3sFxMMRZarsxryhk57w0Hr6uwXAYBg0EXF9tZbS7QK", "2GGj0KowI5oOzit8F5oFJLSRC12e8Sw8iBpiVednjP9h53nK8bZPv1q50si6JcE1n4iGiL1PiB4nEr8KRfjKhYPhO7ohk0hV4PmkinAQyCBA4HUVxCpckCH6", "I3m04TV6qFrW3zuzB5AFLciIoVuWi9dyDNyHqRNehC8iB2hL5p", "aQSHgEmYlSiMQvjMAXmV9RiH9rHoCMcll42RGmy1FgLdZ2yhXiCg9uvGmC4yZejIijhzWfyjJIMsIIZq0kU7eQNOcQL942Rlm7iGmez6wJwFcU3aEXisv5FY", "TafYa5HMCzcybZ2YtzlTTm3hJlXDpklIKOovT5Fd2qaePcAGZt", "j2fnhwWD9LxscGHO9iSOMUCw6aWGq69a6mNmjrzsBwjnA0BJgbi26swCSRRJVYtbLEL45KuEFb1PbBhGmNGqFD1icSz70sgJ42N7KGMXrLvRUchHzx5E86ui", "WtpXjUqlUCtoQDKFYFe3pJIoFL0LSv4ymrTUJIFnS6aqJu5q7i", "rw19iGUicubetOVKspc5a2CAsV2wL7eC3dJlumUUg36XRZqHMQNxTX5L26HMDtWHXq0PaSrEWxkvUaBr0WmT3rn5v2P9uwORkOoKpfWLaGE4oPtptfGwV10Q", "2PXwLvN3IBN7osQM8cOx2IkvvyqOyqn0FKwZEHcUQybEqzawby", "rbEZVAWLYU9LUOeQvsfWM5SvJGsrCTn230ZWA5rgZ001MePGU4mq9EjQSbFc23e33CZBHQppOpojTExvGjlOvUoN34z65c96ojF374sUsfBJt8F7p0ViTI3U", "K0aNaiTOPgQUiGwav7umD9u27NkYfl3zmbMMHnjgR99AP5kJBc", "5OjzRrN9N0tQ0f0KzH8iwZp5hD8QWJ2bimZ7buEwu7LskLDiaJQWqEZYRgwvxyUdi3iHvxEo2ZelspTS8rxx3UTUAPP8Nsj4vSLpPXdP6F8y5ZPDRM8Uobxx", "0K3MCmO6EhvbFWzJl7Gqhf26zAYnkVkiol2yYQ4m8xONRNeDSu", "17Z1DWAmKuF2c1of0K526B0SWPnBaG5cLdbZ9lJRfWUIWGvWayWeAU7euspU8v4UYg1hRI75mbLIpGmNCJ1Kn6zhzoA5hEXFsWvIo2NbbgtOugl6xkRkpQQo", "CarumP7fv2vi2GJbwAxqogulRJUEju2uStoEGvrCwmsw2BYwJV", "m6CfrbyLpgDpafgOuxHj7DWzAW8gTP9FVJsLurghVsU5XBRP6i7DudA49IichrqBBiW3XAj02D5YMUvSB2d5fn7n3nNjeDunuQpPYYQbjT74y2W738AgtFTx", "2ree2WSuuHKSnk1WB8a795ECBOs4bKzd9dI99i43zOUk6VEHen", "Pnsbx3yn5Z55BEiTMq9Qr6mLqqr45TrUEh4Bi2wmZ2rkEZBaNK0FQkYGaPJgq884oADUCAGmC7UOfgz00xFPiofGBwu2334rDGLOQa8afcyKGvJFtYebKHpU", "EkUHlY6wmPKCzQkf1hxHcGWVnA45QuZee1tNYzJKOcXM2Fz1wu", "HZ9n2uw7zMzXydYry6oHRAtwUuBTv6MCdVyfPskMCjtAKSzIWlaxtRtOJ3pF9BPmgLP3DAQNtJVEjSUGD2B7U3Vn6K0DUOxAjMEvWcIOvoadG4rS72XZ52K9", "KLKmjHxQc9L8jcUcQ4Fe766C7dlCd3KwOei5udUWkpcTR76p9L", "UGQYSXABhlF1hbeOfYz92kweDMlJBtdd93AaaKjF3yHlYt7BP6KRqE52apJkgwLpxVNVn7lr30aZtfkIl2haHkcpZvZDqt3nOOJCV41X4b6vGpDzruX6e7wC", "1TNrMQejnvtGxun1Tswhh7gWzEdcLZmM09BNYo4LjxZhrLgKDb", "zsgfOer1GBY0VZ9fufTyyAvYpktW2451wleKPUMddsd8RllJOEFNPAtEsmiuoltkXW4u0OWdH7jgsVyHhDc6MVJEFz73lylGUpASCe3Rml5eG3tvFV0byHnD", "GuE1tzHLnQox2rOoaRToTKkiokJm16yFzCHqAWBxuxuxnGlNfC", "C8VwqJe73dC1sBC91MeAHW69TtNDE2NQ9sKxBy3DZFESQOZPkDXzkd8BWVOlWk9dcUamQbz0qBSEa1dKDBIvmQ6JuT2ODB1ndZZ2BW2ziSEIRrae0sZnHe4B", "54XIDY3r5dtE7tEpLS7mHgRGYy1na5yf7TvKzzB5a2HhvVVEva", "1BGQRnMSaxVXcc0Ww0V6336Kk0oDEjoDu4bJpylQvExVqv1ltUpwXvFGt3T8kHJdKvw9tiXmwUHlOHUHlJCHCRX6UyEEEXrYSmfJUD5OfN73cbJNuVe5w9BQ", "6PcKuSqLEVeggk2M5ANhjg2c9fh5msTsF4A7W0SiU5O8nQUqYq", "XGWXsgCZjzPDpeH0llyCTSFrb2F3smtN2Ouu27Rl4qwtSBtBwsNPIcErcStUEmrE8k6ApXwtLqkn2cwySKMkuYaV0TzCDpQKZWUM1ODMFx7HZ4D1MXkE6Kj6", "lhHwWfG3ClNB7aYKXdZ5hn61KoGQ6zVrgkmAP2BZlYlr8JBewl", "jcWndqctFiriYVSKerKpR4MCtST46NnpzJdbAFSNvJ5TnXlRM4El6avz1O17kpvj8YIGllbe2e6p9rEWtTHx1Dw2Zw8Jl31rbJ6K2hy3M4qVu5zlWFjVQdYx", "ZeHKhGAGXEYavWdFZTjRWgA2vtWJV4H4gYNNmXdJlBrefUsCwZ", "bQFmR9dxS8zhDfDY2z5dJooAQRdIcXrDx5xOCZLefKKqzXOzXTcoFOygqZwQ6mb4rZQ36mfl4xc2V012Seqh2mLqMIGQ2sStPtuVdXGfVqhyrjyHLmwNYICs", "YSHaIjRhaJABoPrHFWF4DDLYzIwWa8M6YderL5WtMh5A4uSJOf", "OcthAqz6KXChdlIHabK6VglYppSH7ouTQnAbcAfufqZJbsY9TrFwXzUMoubtjWM9HXirfMmKCLblB8udz7ZU64ptwOmfu7nAeT1HplZ17BmGHetEmRiqTVhP", "uS3oZqwBJyQ7hz8o8t3PVwdFNK6qplEhDHUk7QtOMJV4JcqRTt", "ryqSEBkI0a3CFFTjxYAruWAOaT0RtRKiP8AbIvtGTvSiAtS5RawL67hfYf4R6M9UVI5lBxzcqRIyIi3jI02N5k0dP43UQAytQ1ebwdBm2UkIAozTm2orkoS7", "sTbIeXC2XocTQnEQFyjQkitUihLQTmYLF7brdnuAaWb0JpOXo7", "xWoq1UVKvw4RHKYs99e3JCZvArkYOWeJ1S72wcKpWPGnhpdqwFsGRP9bGrAcOovNE2N8chy84Etl1XawmSCErJn6AxgWjatvcG2Dw0J0CDkCiK8SkIeZbSfj", "NKE7u70UM2hI0zGBA0LsIRK0hzaGRDzmXDtPJsufuZvtYB2iAN", "YQmrRTqzjFCi1iut7DlzqdZlU5uWm4rKTdBu6ztpC3WElO5rboqPPP8uT2OF5GXYthQ0gHntKH54f8vGuldJ9lBcoaproMNf3ndi4RZMicQOiJcc5EvCz7ml", "fbcRvx6xkkfm9C9rmXDUro6u216z6sljRLAMJFJ1zwo86vxsS9", "MHvSBxSFuW5fEWzOrGbAHY53gByc2PjOeepoZF3Tl79zd6MUMxdbWgfArbktyTGd53PeIS83ZF1BJNdfIEGmutvkTfbR7p2CsRpAsvEP8DaRaC4qOKdHCY1f", "Ba6IQ7TIYITQDfqLqOkQYoEx6pCINDvZl0pB7GSdYt4jWs2MEm", "mnayifoux95tgqtW0ymSbJJf0pV3BinvTMtB1h3yr6pXug1uemKG5dt5QN6b5uWYGQhF5kDuo1QihPbKBvaEXRKvoQXtI1RWP6lVqxNeylLdBwxMpVbKxtGl", "Hndao24E9qhxn2cjovMzrIJgns1klHU127Zo7d0GRfECiovWjG", "TaYkELdD4MSYNUdwHkYF1zvDCdz57iLYGrISBvgDG8ldbMYs667530GFdFLiveG9UZcfSGsgObIzxop1uv5vvLBXbUFU6WeY3EDTU38scQqXEfX6Yc1UxA1W", "cG1hkdFlpRDJUL95jxaxb739j2dhBeDntCUbpkNeBYvdt3gc0H", "XbMYl6aMnjzyXs9zTwhoZqMUSDV8nWNK5ksooRBZ8AXf0edRbIGA9acbo8hZc3uhnkUZ9f8IndvnIWEtpS1y3dXpjEOLHG12zTb88hOtLKedoqWdJXbK887q", "LTBaiAbhdAnjsCcDUEqI5KwMpVevcjlxCvVu56ZhFNQ7X1I1D6", "HIQBcDfG8HzsCAnh4smeXzzw4WxMVASkRqw31bI7qHz2RmhUdR68Q34UZzq28GmZ4ga3HsB5887Xvp1WG5ef8j9fiyhqCSNF8yIOoTTucbSVORzcXdHdKPJ1", "NypXQBmZ75xvWOq6xGZLhYwCABqSY7Rv5HRWSD3XGySnMGtKWR", "fCzZO7jCaHJ1BNGctgpuD6serEuiYP9Cb9jxGSAokTovq4XhlKbyQRcHgV0Cs7OTG6OVYYHI25BqAiWt15pPXSfBvdNnkkEzqcSMBjdBpozxVVqWbfv65aHy", "DejwMxvAYNXh6AqtwpoRLcvuGr0JPHIbt1XExSOTptAt1ylynZ", "P6CL0QAyjXFz87zfLw5hNsZVmaTXYG4wLEFJePIOwVL3cKivEmbbeA6QiXvFm0B7CQQrniDjCYkmtRg5DHhrPlG7J9K57VCKva9gHMOTs8FjZvpmAUcXFsdY", "1xd7TnRMOa3fuR6mZLU7FHtPlVx0LaZLXASyytLKRMzLl35IOX", "PboHzZmua6S7PxFrwDiFX7bUSMXVcu32VpJSP3Mx9o2YkHNgT3t0ASTam06Os7QMujoHl9EsvEPfUmJxoCvycOZONdnDiBZctMueV6WQJv4ngNkUYdSA2zXN", "aIaIT8tKUlyzpTN8MRt2ndUJHvRHuycTGCliIc2mLzjBQ5HmUB", "pHoHY3C0I7yuaD5JtNutAFqrQGwi3Rtqgf7FhKFxPBsxMvEDG87QMvGkCCQFbH3Ix8XcSkXpvNkGIzTZ5YxRUDAgOatzsuFn2kPTUuGOI1eay573e5T6Gdkc", "Dba5VpsVaFy4AFQSE20C88FkBgoPJY2V7cYaRP5ze22mFSCTVB", "fbHsJSZ7rqdrLkTuKtHPsvRuggLq7q1mPIfiiCpa2SPMCrEUkVtaOJT4xot5cup1BSjteYRfyr18iDcQiT06kT9gF0lruYs51Zxd5OI3FHBxSlNAFMFxnMd3", "MMuEvlIuKFVQdoRr3boWMAeZUrXHDAKXXFmSy2KIHpgsb8jdjW", "95eld8dAPoKkMrx6Hv8bBNPsF0yzdhVkk9WNH9XexsMHhJNxCTWMqvC6wA3XrYIbfozuvUYqKv82CTxNxTjlPvpJ3squO8T1uQvpvSgFLmFVFCsAeZu3SjMV", "aCPyJr0DHt3AJhOeRdAeo0pSajT2QnY0zvxGmxU4oVE8CckbEs", "F0t4QTlrTAe1Abx7sj2Mlrpyx1afcmYpkPuAqdzJndLwFG35x6RjvEhqFFTp0zekOWtE8sWtUppj5tm2xBjsPQgce9Re93OVYFie8EXa3NH8G38DEs3dGhFu", "oeYvfvRBA9pGLNqOk7UyAc9MSAzjrCdfoAZU50fF7TUSqKoYQI", "WYsfvJps2e3dHrnqLsoz6tQaLGs7oGNInEviXkYZMbCdRySkqGhu87URNLZ9ZwRMAM2f4bEOAP0bNSKBg16o9aGWtneTh3pqOsVQRipZ7p9UFTdtUjgdIu8B", "hkcOnQCBGichQPEVENxRqaKJK0ucu0lbkOyWo8f4oFjEexjqLe", "H9FcQZaJBVJw42I0W69B8xPrA3prs8W7FlheIIxRlELpGeomivwrqLiyMVqCbKKp31TLJOk4c5srjgbSZVJPozOBTCN4WftZhKsygc3Hft8PXhp6D6T15rAW", "1WbXBS4slurRUsiAloXIUMMhQpgTfr0gNbCY1EPk9GAb8slrfI", "79cTo2GUWtJUag3kD4ycn5qxhwnQnSjsZJJNKZqoT9I1oLj1NhdAnT7SPvsALZ2vtJGBs4zJEHI2a11vhe6S5BuS6maSMaLDtZOjeL3qaJqAJr30T9SWLMwP", "6WpQ6AdzizgMKhAu102Kr6IIDioW4kw8ElZKuCHcAxwUf6Ne6N", "wvREDduz9yj56xpdFjqUJ0PFS4JngNBcGaoTDiQNe7Qj2FMHyAjF88UbBlOr8XSO6EpJvDgZK7GMKbbHlIWsRzTckpRrLtDR83i3ENaZSptmQT39la1AZSkH", "GC8b3M09NiAb5l8VY0IyTL7Ct7LQZ5ipHoOLAOUV5f58OBeuBu", "scDxn748VcDDPV2ooAAGeDthMFsy94q1g3xT8zbebnpzIpn40vKc9EJTRBPbDFasIXJPVt34gs3wiq0gmKGvWZMyilXw07oGd7f8yiCeZGaF6atqt9jNi5LO", "oqKoy65bCijARvny9NDEw64pFmCvpWJeMcQIgVtsEa1dUobdBm", "r5suu5g5yTZH7trYCY13ODePo8DNlN9bSzVL29Q0cxGiq5E2dD62RiPDqdbZyiAOifjio7jP4x7v2JvgWzgvh59Xgi7eQF16vkphsW6uTBnVUj9zgpuOt1tZ", "jyC8EDC7v1olVtgy4RSXAbWpPOBIQ2p711DDCQK8P6tvzXr2zH", "Z7t3wGR5Yp8Lx9N8KZYcfwiXrg4gi3yF9pI35j9bZHwUOJcir9KU501ue4aM5YZELrIQZR16gwY4FAm4H4XM2WGhar1gNbsjQA7xZ73F3bJGk3J15qM8Mcnx", "RobnNTUmcbjBilPlKg04kJ4p9OvT0iOQVzDqTfc5GKEx5dgPIg", "S2zWp6ujasPyGsyTjP8JSNdgIgIy6YdYac2Nhu4HmUD1M9U3YbL0wyfEfvCjTnH1QHM5BRMvtZwFjPHFycEuYr8BkIuB69CUQWZbxtVoSR49oJNmvbgTSmdA", "5XL9hVb51Afx3AlTZnbO6y8zXpRxZ47cZSlExMKwUzrV7dzeOY", "0TU9S1wryVv58TVrhQCzMgwCA3n9iBfge9p5Alw6Fq9NJeCy4OyO3uaDyNKeXzK968CGr9K6xTTE7eC92AX356G1RYdyXv6d3IrvPBzKeTYj5ls5tO9wSNvt", "wYqTSu5TCuMc4MwgnTQsCGx5e406SvyOSmpugsLsniSr4NXpqv", "h0Cc5qh5v91rVRdKLJDg90McpOxKDlGslSToGAsBHr0mId4duHH4Fee22bNGKd635ZrJhjTyaTis5nTz2j3INfKNGfbYIibLHRfx86vhZeZeP1cRkfj5L2SZ", "h46ykfHz6uwF0quYSRCrSoIAS0Fl0gIfiObS4tP8nKLoAFMchW", "R7JhIjfXUfBkJt9uJBnjHZ3dNBqhnXBCfStvBZSdCeOVVVQpeBYvkZY5kPkVuuhXMaSW9t7KVVp0yDpcPLY7u6DcTv7OpovCNOgUFnokHekFrasEtOMmSXOw", "SWIGIBQdX68mtwWAYFOOpEagcuS4RrysLG8bQYFxcNiVHEeqR2", "CEEmvqhNs8CryX549VaMRCj9gyLKonK01YluMSIEYU5V09Z7cAT3KAA08UIxFavE8e9S6Phdtk8rrhyUpPXAZgAi8TdN3WbABkcF9Hs100qrinJXCrhmVqSd", "J50KZZSkI50PKsOIrF8Z2R4EGkylaQMrTMB3uenChlbzc0ITDO", "0Fp2R6mQpKoC9IWLLQx6acqCbSArtLFra3tz9eNywCA6ShPl5MrgwfqX7yNyJaprdhqkJEhFOrJqWiba2QGy64UB2p8JNvA1c0jtCQ7aGQOk7zK9OY6Saabc", "Njtkf3jF2T9ErGn7eBql9AtXhzxHXYsuIlevnMAppH1eXmmCyc", "v5koaRnXhI5ZCLKpE7BNuyeucAgMKewFjh4H6pon8sMIBf7QkIndGPXrZDDtqA9XpBpvydh4T1NfgS3Pjo2xDZolk2eaCl81uvutWbv0dIdHjeeSSgPdFEM0", "E1YQkePfZJW6tR4UihjPJOrj4GKIShGggm4QRT3ylZ4cz66fln", "44BvnE98UaniETUJrvkvuTSw5P194mx6p6zcK7imhTUvwzCosxhkQ9fUXgdbSYiHffsxmYkT2ENwBZk4UPotXTN470faZLpCzh7lErDG4aCF7vHcK4TpVqtd", "qXBNq0XpgfbuUoAYMKmRF11Y3UNZKHA9mJUcJ2Sxf3r9pzgBKQ", "cXPe3T8R0Rg8aSR44k4WgjXXrMXVXpv8KImOlspjJTrrtIwx10ShixCXKh2pUvxpDhDxY0erTWjMmdHlbhQHfbozIooljkavRnqznUpEyWYj9nSiVt08So7k", "btVKb3D1q10bUnnSHL9Q9c7cT7kvtpdUg7nIA0Jz0HYU3MuKf2", "joeqO5x80qxbLcg6ur4Do4SMWVgRqMTZ85PXAKd88ZhRBOX5DcG1ggLBC2c0M3ZU8wzGGbMOA3qLRLOexcdcIznUzNUJQ1lWvlk9M6WU9KnZfBBdlpD3myWj", "Ly2jynDtWx3q3ZKAt5jWEt7zgK1QIX9bT9KRuXJPSMFVtYekdL", "GsEOrugsIxNRYpYrETMXqpr5IkdwSFGh7U3wNjnfg85Dxb4C2OjsDbyUJZOkoeRt7UqSDd7sjA3hm5roTahf9d9RCXBzAcsH4ijHJo73zAijDZXh9CMHpTi0", "yrz8RrPVY6krvqss0abE96tHHFY4gE4e33nUtAzRHhGAX90WhZ", "irdb8uoezUq18t5tLw4KLJzZRXgR3O0lFdMLW8zVcnWigZc1TeJovIMMn2nqQlZdMtys1vNbisKMPuLtYcfRt1ng4YVSJ46fy2WxwrZejtz9lI0HvfiohVSj", "3xBK0HxwITtELSq2JpB469L1p3nUWDDZ9Mt9ep3uIw8dNygemp", "jsz2rm4eGarR80n17PoAJ75RiQOM4ACl09orvsV9QKYYJLYQjMZ0TeQC4oY6wiswpgniWGpwaNTrh1IQNrQpTqzVcVbYCTS17FkbTZW2xztcy92LyQ8RF7wr", "bWOnxqo54YeX6AX17Rd5YfPX3XyIdtAENW1KMpNQM2wQATRIs2", "NRfmyiIu1vl998f8TzvqQFsKf3l4Jc6g3lRzShrTcdajlDpCCk3a0tudugiDImsJWHGyy7PYkxHUA4gMohxmbrQTV6hlqX4MoIIkQhI8eXambH9Nw4AXvYzP", "eeASBDpxV5ftlx0PSaA1pJOmNWHG4Gdgum93zw0S1fKmaKA0uK", "1kbOUyslCx0qbuckyZewzgaJQAdaBWsAETWiPPRaKRQvM0eIZIEWyoqNxRx6xoE9Hlrf8JFSkdL4dzMAIZgELUbIuXMpLbzaKoFS7Ssq5BsiBDqRmVf5zFMt", "mij5HgfbUt1aLrOR3G7CTydDRGJOVdIFLzKbf0A7rChC15d4Mj", "Gnfr168IUbtkrCh9nM7ySy89B9FmCZVQKAIJEObjxUTmfBwSV3Qv2W5DgIxspTI9bYTqw2XuVygA9aadezYeVbrBrm1gFKopqHdnHAfk8JuGuTrWSNAxzz7q", "l8VzQJoHYR4nZhYhyQxstoMLCWJ9VQxFYSExj0EFPI3yxbdvzb", "mtN8EXfVg8tcNQ4ZNmXb1wr4sodWhd5TWQaiyDCcJ5EfVHEs3kT4gI7X6k1mL4DrUnYQ0k3KpHzJYBBZvdeavl70T6mpAzeelC5lu63iL01uCCR7n5fhokhG", "qR50Ohd9sgtmmwU7xVz7gRCRUs8HcpVREYPdF2m7gfsSaMYVqV", "cUumvNe4cFr7g6f5js6T0m7sDhCjC2EmU9YQUBS6OJD4Nq74iBYgyfW9KjsUj4EEBkcfv4lHLwJjkRlTaJ7WwefENVi4awIjhuPaw8sI3BznakEB2MfwyLBJ", "orNMme6TYT1TZrjc1iObQakQuQLsjWBXLZs7DyYjPaAyRtZSbx", "20VkQQAlIrFSNb1FgCDFtcp4YEx7fX4hXYPvyYfGPsimRhz8rANjmAnJOiQ3DTii16czeHD39uobZnjRw4AgEvzcbQeptKXsQ9r4O26Wws7WdovZs5G4yFgZ", "dIMUbuM11B4OEAuA0zedlZBbcRfaeJ8IcUmDM7CMIGkWOcfMbJ", "0KrBvTaa2Et8UTcHgzOrLg53BUdqoE7oWwxROX1QksYEM8T07rpQWvRfN4TBGa0mVvBtRAJB3pPNxrL3iBRC6rpTvIcArcwMW8FxGW6JLTeGK0H3BjDHY3iT", "JKdAvYWPelMuFSEYtqpEq4F1lSGJTwnlFOvAuQZY9tTPJfxCVk", "QMpdLa6asXWdIl1CtwcSSlJvAaY6l2qBMdnhCtH4OmhfXgrRaRr3C9yLjVPUXFettRY3Io7eamJ7S8W3ZO6kX23EVSj2hNtYoQb4EgimS2tv8Owgm2QH2TVY", "tEYYZQ5LqgP2L8on8hgE5cupcI4flaDcmjBK9Gfzu3zF9n1FTh", "TWKOMwgObQym2jUB3dRgbKjaZsOa5pGZLaxfWb4610q2hKBiydPXv65UxR32GJbcrWFL8JR7IG7zaJiWu53pB9H8aK9pbkRSHgmNyDSGTaD2tvYnyacAhrGF", "AP4l8TCN8yk69CKbkXbdR9OPhyXMqoa0BejJ6tgEpOIzZcYJ79", "xYGJwwIRI8Fs8PVrgbjLnYj5XGf3akCVHRoDN6efCsWIF18varGLPyOvE3ymn9F2a4Fx8saJi6bx5jqda7y05KvHLr470J9aLPVSF6lxAMsE6ipenocq6X8S", "NAZNRiwn5RDKVyFgI5sMohzbTbSa9Y2Uibr7JnsPD5hi1vMI0E", "cmwbONDoxKKzo0Yf7qR0De3uK5phLqtxcnZyBmk8646u2cXASy8faBYvENaZBTXmH4iQqRYuTcmWFHgfGmLoxthAEFjOjEAyGqO4HuylXiHk0vPEhk2cbimo", "xUCegKax8y1QryBOgQ6eLVs0EtanbNbWplBT3lQCiQcZOlv2B1", "hUUXSiQ2W1N5WCrhgsQ446UedqPYrYXW023SiUVCTsIz37ejz3n49Gin46JvepRdrT5XxakOR2OU70D63y8DCryHvHAX6aAv3GRyoBMFBijIjuMmtVz3KvKF", "DTkH3vB49c2xnMBw5uCopYYg3WjLR2YcTJuWC5YLfYGQuRMxMY", "j94Ip8mWRDY0q1JiVTl1oQZ2qSUANoi7xmNks9EIKnIAmZqG2bFo1pqpFIza6ff1Q2jI9yaUjqcVPTjR2zF2m4rzMpZTUFSuFCBNAjrtaRMzs4Pv3cxngmm3", "ZJU4Ywwm879Gpy7PPUMGWjBXM6K0q43QNXSuSOgaUnpJlwg8O0", "OukXR4bl4Sn6qBbI53ejc6WRPHN3Nm4meoH6qtpuJdy7maNrd1YF84gVJ2ZgmbQQNiWDZK5qx4xjeIYFJ6VP89tRBQ7x1WMOCqblAeZ5iUmKmKa3O5RWCKvO", "k3JjXf5jWgUgI1k1VWLHpvKDyliB3dXleqUBUZuyDMcWNMVstq", "7ikQtgBbrDFMytDR5fyxdAKFgfa9WTxd9h32ODeDOraMkllnOkl1u3EYgohCFeoOKpPg21rOsRlaAUOYE7X68mcoYJzmwn8EcXsdWj1O9kxJFLqRQLWY78Ke", "QJQK4YYf4QGa9FxGyuaDDOcdj69pFRRfjrznNVSPvg02wvJupr", "52Dfdwmkj1BAes1bgN66mzlkzhfIbU7eUKJ5F5py4z9ip8JVVNaIML2M0gcbAkDd2WiHcWGeTNNIVem12KHMfHidxJE61Ph3vPJVtXAMuXdP9NOBhdYKtExo", "X9sWYZYTxrxqO7BGcmdl90vqbR8Uf5HBC9hkhFBe48SQDbgpNK", "ZWIUKtvSMYVdjfkPPPcZ1hfU5t5mgT4FxMjGDcgZBAAspvFFIsmKXRocKrM1IQGGkyUwYAVhKgaAZpNpf99Aavntn7s5W8JG4lAbwgIEKsOrgjgJsoURjFIW", "MAasGr7JbHuXxCjF584jpl2gZU7GjNl6XJynA56jN0GIB0WE6a", "xvLxbsSg9B3uHYDEKLJQ5ePJxaHRoL1jFLgoB6TKIUCX3NlNh5lkh81cgH3Sc5BpQqeZw5uEZ4kcQVx7YjpGrqsY7w0izAXN09wuEo7mtrOHMKOv3BBs11Q7", "xPpuZKHXSERe2YQtPnAk7WfAho0hpRolobfLtxqL9F0BoO5BBD", "tIkYQPKR4AqqtcPYxJTncc2coo1ryA2pTkOrAgGCo63hgSGdjjOMMPy8Bxx78zxZkJQszf4ol5VSYj3HRQdnnatyVq4bn1AXIZNHES3xXZN3GPLhpwSaULY0", "9abxbmSrJq9XGCSljqpyF8f248cZR8XZj8UIsuABkHgyR9kBxZ", "9AhmCjsmGIunrbwJsoD2ywHcuijcrgB0qql0admovhckGY38KF8GBPt38cgzHpy7gj8EKs2EXeyoA0wTF5jOSaRaB7YSxWXbDdpXWpj3Uircim5vpnJHNksY", "qO0luWM59BafyKhQ0W3gI6b7tuPFcFnQdmBVGXaPg83fSk5SG6", "8ZDhe4Z1JCE5appmK5HsUy1VbTFguUn01yif2HfMRtP2jEo1J5ul1tFcMUHEw2Fx0xb2EGMg7lgoxUqEXi0XbF9vhOAeQNZQKARWQlAWVqKSI8hoqfLRsSNZ", "pVBFsleAv3eKopoJd8kuHRg76zXyPuVENfUFQ6PJ93bvqPDSWx", "KnM0sSzNOOFrdcW5pu9EEGGnB4DMUhHoSdoI3lgR8vJjWpoLkvYwBmjKouhJby53csMfd05ltMUP9GlrBJnK3VfrNMAxIGys8IWjIbVCvxb4CKwLdjggCLYa", "fgXxuVo2oKk4tDGoAqsKAogmWMQgfwGKdlFXF3Y1LI5CVK0dAr", "wKdc67wXobT2t4o6a1A82TO5grPeSZVOu70yEwT2Vv5OzrVZsdfs41xisNNLwqjoxilCeEE89HU78xeyaKodLmLC7iX1ZEqUwZgZnvhvA92J7eFfy4IIoeSv", "KxwrBkM6J2f5vK04T0LYeaEbcWrQ8JLREGIN0cTId6NWONaqLv", "OzUcY67PVDgoeu4vG3VjL8ogdC3D0M7PLbzsf4HAIwzuo1p42LmNRa34k4GlQN8kw5cbArkQlhKai8clRM6qu8vfCBObWUJSZv1hkl7WSQ49Yeux1ynv6gYH", "pwsLOBlw4ndoWjIz7M8d10a0yLv52UMpOCBnNuhPhIDEzUB6qH", "jpHHpFdjIdDeSZqbKBW1aBKmNJGYO4p7u6NhKyOcbZF195dTF7TpInbg4rCSw2Yo6vTOtq1SPGTWJ40YBTMSEx6GnIhhIFTN8ulzkkP8yseIveo45AUH6aYt", "rDY9Q1UYvGVeyumxkQDf3zi6ACOGnu7e7flVeG3XUWBQQvL8MY", "mPWUTgeruPjz1ocnJG1KlTqxtEsFNCl7ZHb3vDsndcmeQOPkcO2OptJj5BwQMhXvx6ysKrgvRQXrnvZPHcl7T2qWCkxYPSTMZQFrHtkgJHX4A5USfDZ6GNcQ", "7XyW0PrXp4M4x6kELGJWLly0wX4AsgaxCYTCyKhnM3qJ9aWUqp", "09aw7URBfJqFG2oiEk0tVNwLe3uAVizUsXQx2s9h9zwQ1i6DS66wR0H639GWsE0ilRflHmSQlNok5uvWz1SQzhW0rlXjzVPku4WBrwaaHMLLFGrEGHcDy7En", "sjUrEtZ9w3In0qLFDgaQvRe9gEMdLYQDHv2WoadkdtVbkrrxVR", "LOrzXXBsAXQbiiUjCGJnzwgUWQJNLpogBddjBpbJKzs0fMjrd2ccxJ4ThOo3BahMEL3P8ciScbQHvA7WAj852BWkZKlivS49l8WtkCJKlkchsjD0QK6TVaB2", "vukoKmv6sRzbbHvNzX2rEDrfVv60WF0P9kDRV8XNXVy8ksTjNV", "achPFCJJDpYBCfwN6RVcm07l8rdca058amXpzo8AdeLnHFAOgdyRd3CksnKQlPYMC399sGJTseFAuPWY1UxcX9KPuepg4L0EM7LENegEGvO8IufJMcutkEGe", "t3IvMG7iOSvj4bxKULRmD64ZgyQQCg35hJy3a5mwVhdZIbskuJ", "W8Naf3Y6SjmToSmlVKqHGKyutETlwN2TTP39RaDrJxK5P4ovPdCdx9VqLyaIKajlyksPK5Gb3YfScTNz4Yd1f6q05QGNyz6wkzL22Zc55FWigrhlPIm4Pc3S", "0HnzFtvzqFztmZwsoQYVIDEfU0itbjJZ06WFxQCmdAdPjZFYyl", "1GxFtRDbImKbKLhqYcGlOrv1HcZUAXE9lBMecaGuKaVetATSmjB9Z6AqijIrGWyzhLeHtuBDSeqMmJoZ0ziZ3qNjYeYoAXmqqQ7jKHumvk6i1uF2rvZsjxcH", "bA4jfqZVGfCYw7KppRVpJip9dO1LJdcsmgcPW9vmm5IgAbWy2z", "nJicSJySeI5H8pvkDSs6CeBVLM6pK6m5NUfomdGOtJf27ZmK1cQBFbeYviLDo7IAaxyMbEkUVOUcxFwwrM56wkcrSx3F5LNfHLzsXhK23pd04Xutu0yoiad8", "YgNd2iGH3D9YuRZyECwGjr8bp6NVg1dCfzpfh3wjG3H9To7hy3", "wgs4HfAdAocm1HlovQsr96vRFODK3COzsE37sBk00Mm1cVpXwfM5mHUzdiKfugemsgrkrclrwVqW1e1xJO23dX3HDLw71YrtEie4INtDsijtMlqf9rjmMk1Z", "5ve6UVxgBZiSwafpIOge7VJEM0zgi0FlutpMMn2VMjxJJa6bxk", "F4FWHZVGFDGSzAJoWfZX9wE4DXfH6c1LeFpvoKB2WQUTYoF3RpaYjmdwJIBNsCgWPVQEobEI1glaUydulBSUv3OCLZZBkFg7i6JWhXmhEVFgUsaF11iu446O", "cfZMsFRaJl51IriUNxBrnj4mkkgnpm9RPilHwCpFxuEEmui9pt", "ycd0MLl08YkHz9yiOsuE5q8K4uCm12gxcHyzchxlFi0CpwuEomSscYCgRMTQO7O1OKy01vjEdiQTeIhR47JhdTL2pmTEtrFHBDGA6xOkfmDI4sj6x2lYV7bK", "t4Ylvl04wGE3CalrMw9OoqUjsGHNNqgEuCzny0psE3tQbeGxaN", "LMEo564LSR98d4KdpGdf9pg2GIhWDFtXc7LfCPyeo8kRA42zJdcSTHSjX7DkN4FxAacMxZyjhi9rmBo3nPTGgwxB18tMC9JMhuifTgM8MVx7fjAS8egmYdxZ", "jrwvyDIf5yIWdfcz8Z6lHFBPtrARS50Buu7s6NW9JoguRGuYqy", "J7DVU4KcVngUwaM1RQOxagjEa9SShIPyNcRqfmS8X8aThvV8Lr3tXk58tYYYoxXAYy0DkQLFXujEpEK85L0b55hzbFXQD2Yl1YyjwHzT9ifyux7xI7WOADNk", "Ts8evgPuCLd8aackGFg8Dl6Vqct1oEjF5rt0XIsjbTr94RtIha", "RuLVPA5HBtVs8Yj1YEHOxqsm0uCrCtRbll68vAP43twARd9yrPMmFCYD6k5JbUuKDzT89qAAj4K9fS5WrPI4cpIiXNz9psR3ru9ylK8SMRZ2tcWi2pmee4KB", "PKIFCkI1cRzLj5m4WL4Pya7yPsc1uuDKETXOBnPoCM9wSvyyF2", "MBcR92Jj3EdEWqg1Eroef00nuSgsPvul4XABXSuYeWlAMR9aIxCwxDjqdPi2JdlL8uXfMRB0xw8HNHseE4a9FJzrggrxHbJPVq2rFDpBAxSVEI9QLhXayVRd", "BHaSstrNhrCx418CwYg8rnYCV3kTYA6hRf9JYyeEpqBspH2lni", "teWPo1SZSzhXg8CoPkk3wYt5OiMQR89KmdhZc7646nblvnXKWHLSpCWDsscJyjblMIIyPO0WBcF4NmMt3hKrtq2lge4fNfOhvefK2goDG3HdpdVrIngBdiuH", "LwugbGOUu3owhd7xgMZUx2JFpzOQhIh0Eahnq5Hl66fmhnhL7G", "p5I8K75jVlzDlElSzbVFKcJyO0l3LqKBvaHGgNxB8wMr87K6hnL1PexlegnxX76SfOgJjbVpYpgevyicm3b9fZtJFgHmlNDOjtiQVBF10udvsMVcN5m3edMr", "Jbc2xpQeg85BJKAICoB5AhhXmRaO4vDLUpNReo6Jw9UERfWeRh", "jbMO66ofUsYiC0VZS8LWRGdvU4YyizdPYyod4cGXSmDcmiACoVgFlJ9DOfB6dnWBlImns0KImVvZE5l0YQGKjNX52hCdSgpDwZyoaJ4Moxt00dzZ3DtkaOqa", "30EVg1gaafM8wQTiOMhOxgx0tojTBZ1EZDiDEOln17vvXMethL", "GezBdsyMJ9vKLSW3dkQOVRVRL0lzsSI87HHk9F4QOxikPEn0zBOUbrtwrfvj5BpCS7uZMyzlvfTIuEIrQeJzVBvNoo4tzu6Pz0wLxt4qYX9SkPH84b7Zm0uY", "oxRlrV8qU49RxEHVjOwRoDZqmePWeI4SFUB4zJsTNzsID8ovWi", "KItu8gWYCBoFb1jn5g4vAQu0i68UzfCJx6D6mkcwtO9UPsFSZKNhkFhSLqvKT7cODnUxX4sOQ1tpu6FRQa88qnZ9bUS4Z4TnrviNyalOccEUjRt72zEsmnzO", "FRQoVtZLnIilqR9Q4Lslnlqnk4fVpet24JrZBOuyeahV2ot48m", "ptVdgEiLjVxcY1tPZ4nR0S2hv2Wm4eYtV2UBGCUzgRbERUb0XMPXmPFhRjUVL0Mq2r1I1VFfuqtJJUHorhLd6YJWHlzajKQk9P0AsGol4h4LAM911Vc71tbH", "cbrMvG64d6CUK0FPgJkqdupeNPkOJLftuVFpjJrMO4qi257iNq", "YykNd5nLT4g7xbcBOLSGfoIWXKZc3wQZtAvWFiphkVof4OoRhHhM5xqaHQBIKbqDklhxRWeB0Qq2mdTTu8ox5eWL2fbNGRYyAEwbkYmixbljECB6Lx1ObVhe", "AJzRiXPtlJUUsFAnovW06f4Pc5nCbVqjmnASIYL2poWf1eSpax", "pect3DwoPVHDF30NWItpIjbmMcRpRzkEdM7gX2SwXk9kn78HO15gigT5JusircxUw28U4aQaKYK6fSL3SQiA5BDM354sh1Mc4S680UgL21PiTkjt9R4CaHYb", "LcT0encgFimGDTZFUwvvedpn2rxd6VCR8gSkR2QflAtwdS97O3", "12gqoihlJnFWDLAd5bfTEQd7KHXUMtXLwDBitqRDcejpzrS4Q7VfW9mqOKKiDp470Dnu4F7etoTrftv5yPkUYVJupbc0Re8RsvJu8QY0Ezrrskxo9fHfAaXx", "9AyYo6yezHY8i66u5vkvdfknK1QTbyQi6OHsUFXUW5aCCe5HZp", "BAUvvmwMFVIgDO4SGXhn1CtZM3BRIiETsgOoTI8ilQMxoRP2y7oxHhUdif30LHUDyqzR977uXUrJtFMpKAmbpEEVrHVCXxNVoNuvU1n0TfJMsdBClvnY7z3y", "FZ8mUWHIr9DLA1JcebwWC6gyzTU7QY5f5CRZigqZp3sy2AaelU", "8xaotaHOhiwkNzwnYcTO9JQ0HSAp5vJDss2mSH87z4pL1k6ZKZwUqKU5keupXC3N457UMFZKHMdI6jqPGmr76JCov5eSHhpLkvn4AMOSizkngaAxK14OKEDF", "JpfaWUtENgIY0fyheiSLHcIZbKyvW98qynOSFIgdwy9vd7cGn2", "b4creD9a6fhEVfzu7EAlp4jyzL3ZbrZCtB1VOA5UpkgJPfDUsLDfNxcNGfurWU1Of0t2AxWxhBG5qRZgmnMAiwVybNn6rmUVmLXwI1r0C851ZchKN1U3xxzX", "KmbCW3hIOCChD4fQCiRjK83g8Xj3SjanT9x0CcGZoTE1VrRfZq", "OrxQX5vH8OyhBRo8R1iiYW9mXcdxFAnb1k1ZnxouLmZUDNadMIJsoQeJ2FEFN0qPiswWnkO8WxchIAKfSbVE1AV1NkGlk78Sx4wkoKqIFQzYaIB0tgEvojuA", "TBtBG1eD5YvttlB6B8ejQnjISxBEe5O8GHHUIthLSaCLLNPUU4", "DspwAFrLUWRscf8tAOnpkFOwYjIxCmzPcnKn2B6WfVNHBV9Jru6Z7UUdCmYOWYl6J5tLF0quVDAegHvVB25GUZtgJR4nxotErla6lOzEb7tFOokXqnlJMczd", "12QzqIBh3jmm7j0gqtvCgehURSnm4nP5no2d6EI7v4t3nthbld", "nRFSvgujQwUq0Hc0sgCAn8De9yXqaGRLhgmbLeIlbmZZ3BZtrm3csEG1Dmrl2J4kxqJIVb44NbbOnAFcuIFmVTlgFdRIuT0rIJAlsCnDlObYWo9R6MBZpxF5", "YeNQ8LHOcP7UZuhLIGro40D8MPiAKxFqcaGivV4XtBzS5glLwd", "70bL8wiq60mJoOt24mX8HQJGrMucfqDmqp5wjnnplZ6Zvxbxj75yVMCMg6xLwA5kxBgewRTiyXFrUpoBur9PDJkrPhCJpI3lRiPN9r36OJxt6k40bCPnV9ev", "opEc5GNWykt5bx9yE5pKprKQ3jBXrqQddcFisaEoL5sw21sG6h", "YtZsKcaT9RHX2uAIc2sopDuh8ui09nghgFayp8SzXjWZeerEhi1WtvDznt0wggcLtCJiIlfpTAM5oEJVuIznDAnz2lviPX3IhL0x6emXo9ccLu6DC30OClNE", "UGutmw9TH8RLmBtYIVAbNEoaInyUWJg1ZasLW2nn8C7uN0SeTa", "Frn4P5pLXLeDMDlFZIFM3NYAFt8fXcDlR0no3c9YvnjG0VTXniro3NzGH7vmh8V67IuAs3jooQ4nvXKgDAVGXUWmZPZFV2LcLElDFSz4s3roY9UlHxzpRTbz", "s8EOBXyUljh19f32gsoFzGyHEy6dRfcKoogxMcR7K66Tl9TS1H", "fzWdGkbML11yJnmzi6Z9EtEINxSoNR42QaggIF0dG0ZZlKWUQ4bcxpvInL7Am9BBhrpz4oaLo8sZSN1qRdTMSOdDhiOTrZcYOQVSE5l0BcXdxZSMCvgeHJsy", "1EPsl0O7QtXcxHc8r9kogC8s5oVK8LG9Xf0IdON1GsdD9DJ0L3", "m1DssGhNaniquFUuV7Hq9Xikisy1qJ3bIGTAXAX5vDuqQOkvTzlcUSLCKJE8aHjqVD10LW6Hk07AMp4ppnQHFlUX2ggavNQQYPPuwV9eTEmn1qcoc06rlaPl", "G3L9QkZz9wr3P0fsCSfDGG2sG6k0g7luA53apaZwXQywOdna5Q", "mMgmCvsuvY1gQ9jTkW1HTYgRT22Gb8gNSL9eG1ZBXYpviZMQ5NhWuLvNOydz4HKWcR8sQf3xCrquQCKTZz0RJvofrPevfwRHNY8nB9iN0YHQkZsHXsjolVTb", "t7WY1wpOUvBf5t35RIUBqMQNC79vbcWUh32izp6RlH6qA7tZON", "iEh8ZrEinpKHJ1ILjH8pgr4lhEqZnEwVScbzTphGezWxyoGh4NUkEYTukKTVYN0zzayTPeh2bDza2EH6ZkonIIh1c8W8WV7V54ySgeUHrSrtg7xFrk072g8c", "odkK8soBwkdaO8rGYj7Cq3PfnPkn5rPsU9Aa1ylvjMV5SLJ04R", "CsSZVDzF024PsWY36Y1pRiCvocG7dIWn8wNb9Ko9MtWFP3GUZHJ0yTtm67rhNMUTIr4SBtZWm6j97zdgEveCMYwSdo91AcSQRXqbQQ7AUoJbnvHzqvCCR8d3", "um22MUTo1HPRhWb9Itk3oz2etCoIJRLDCNEWqfKrwjHcDslVjU", "YXRZ9Klwb2LwEXIS485Mz16GdJ7NnopJMGsTZcPAel6sGMIIUNfSNlg02lLpaA9uRzNyZn8CYE4mbL53ikV5VC4VxNLVYSPxPnvzY1B4FDqoWvqFfLI8VKeT", "ixwENM9m92lh3ulG6Z3cVtp8E6HkQtB6o7IBRRxaRhFSZyjfYk", "G1d59pBOXaFge3mxEDMAmor1GQyx4UfKTINa6Xxd7CKlE6gQJ3a5rP55o11qTgAwxVU32Rg7eyrq2XGMYpPNEST0RSqs60m3UH6UilcKjRAmwP6VETsSuJTJ", "jJCqIytkDyEwhqEOFNACmEf0gVQaprtWB3MR2EBFAN9rEMFRjO", "bVaGTGmtqZli3ulQJlcSzmp6b1SoTBC4enJ733zsaiYdcH3v3dL0NA6yCZldixfLiyQk1Pcb7AFhRGaSsvSF6XCG4xrmsW5bTWLUtv413HgUVHvNCLbGsnUw", "iLhasm9LGUnAPp9S4pvY4ovH9UV2FywxJdW9OfSe8EoV1vw6lp", "epdX4m2YmFWjBpKfxiIPNQb9ud5qjofLbGsg0sCn6iUHXmwSVEqqdRxX40Lloy6OEx4CnGxrwR8RE2uhHkXs9SPETixFg2dsxf4it2apRiHdlBK0tps2IFEl", "xC0dCeT9JVrDXR0x8HarQvrJkhK0wYjtiiUuKx1bStoyInvQ4V", "FVO6m7n47hdpaJX2ErxFSO6FMP2Fn4i3Z77KCtOHaz69Jd9VU7ixVpCpCC2xGkyop681xUJVUPcl1mGVtyQMlc9xmBv3ttrjxxisRzOtNycOkstbpKxau4Wh", "FRi9IZqEWY6vYSnvRNJ9GAl3SgbNl720Wk7nHx1lW5e2YPvxnC", "61Mp4pWdAFlADFsL29I1sm7WmdwhYhteiGUm3yNBD8LQODjOK0QAmVgX8aEgH6IxKkhNg5WtDrIZ21yK1MUmr8JzhVdwbtuvebIKgmCsdSPdTLxThPDYYWVF", "z69b03WcdnuHZ49BWXoyskRa9c6f8au5g2ge5DEiy90VD7gicV", "gVD53Mh72nhusMwZ02kFigMgBXmsFOLvtYyuuf2uQhpJ3lq2lYFSEb8N8sFMHYH86G3zt3tKkibmSPoBx1d9ckWicm4rKK0PY1OP4FjmwIYOhKXeL9nvtKcT", "4eJMyJjUK7uMLb8HuhdbzAGLJ1EAJqcLTvgPCPuWVoqqPy7Hdk", "tdu7wC88KSxwlQpRp1rjXMVLCtKHAx13YtAS5HbQhYKSyAulBjTh3y2FpKUyGVzoM8HSPqq6O8WKIO3S7W7AT9NGUrEiKEWhMl7jZvnv3JFKiHmnntwE0JVS", "9jATxf8HQD008nvA59UlOEYB5UO3mtWvcgMYLTpkgoinZbxeiP", "P6bwGeOehAXD57sQfBtTvXFbIoDDTvaq0BkGp9uXJPiNWalAmcdf9qHSeUd5NEwLPgbDpTi7qQULzDVjp6OywfOa72gTEaodEOo2pW9evbzsoUbdYzZUdw2i", "yg9CGwnTKaV74elzFkp1CQekOBCz7Ff3tpDAl1b3b6AfkudxeQ", "wrraZDjmCrzpuse80P7bSihbLPVwK7NGwCoWPYGZPDOJ51P4QWdrCJQYitS10nHxz6RMcft1sGIvHizfEbURusxalNbmBth8x6TZlKadaqYpYWTl7vC1o7bZ", "UBLf40m16FYrZ6S8w1vTVOEaKOb8VAhzL1dNzPM6cuv9yOHvND", "MsZaQtyzzT9fQTg1odOBj03d821NvMaHC8pc1nbzEiec9Ieyv27d18G9AFW3b5IlD7NCswB6epho7Lk1NreOzsX8729g7SPKXmWQigUKVB8bWsashEGf4mn9", "ouptMEDsyhIeNmyrw5QSv0IdCXIGJ3P5vCyGO98KqQyCAu16zR", "XvPpYbMopdpCgkMc0il82aWykfsllsCGlb4HAO3x0s9gaVHZD0fDaABIp13atFpcottwHwtFo2wNVBugBZtkj22Y467vJuY6nR22OwIAwCVSNP8Wz0Gg0JD4", "NIyeCWkxvnxJjDSfPx5kNCHKCVyCm9F9PDobhYWcJUu2fMg5Hl", "ncx4u7YtIK0XSQiGzPmW16yv6dFmgXWU9TW2b4ttNtOpJ63JTpnStlMyMbi36EVEg1GH498R0UGKYJb16ORy7nwRNeUTrzfXztm32sU1MkLu1ut7GK5N81oT", "eHuVEa0DTmGUeiVySosRijZw3eH9e5aGKVjZ5jkWT1y5jR3AFt", "bvc8pdl6lNALdUqK1t1mOUlMXUoac1RCv1Ike3rNQzh1TXLTPMFno07LSvt3vKDoLVWyZLJxK0zmWKFvhUgVSnpshiva38OMcuKBEe8Ye5K8QX35zjYRVNKC", "6Dm7K8Tw0m5EQBl2H3BfbCkauI0PgIZkVJrnRIhP4mcSyNVDQe", "szocYisY5WqeGJx55MOmmSZOvVjOg70Y7o8fV0BaXzFlIArLXD8JfffYAOuoTuMahSDCQOkxNzheAYzfl5wOkbvsxpgQi0zNSAXtZHouFVWN1U2kZy7IX2AU", "ppsXprsG2P7ZhvRuPwHQQJ9xHGDoGMG5B6bywTEwtLVYFuSeqh", "2E0BAFPL1fhFjsLKpHn3DeNgCcZcGNJIcHSkUr5TVniEd2WSJJUVyr98Tilh62xgKPOmFTGiEwuqyQGGjklfZso2bXhfXfLp2jcHAsxNorDlHT1zCkclcOmD", "vTqT69G9ssQ1iOOVDZGV2FSCz4ybTknMBdnIn4RdupedB06PZK", "saZImYMi9nQu8cYtsLvHwq4bRGZVd9pThOlTu5C1rcwxCUq4nmJhaOGzcqUDxJgefP7ZSHYHsUE4w37hnOPNmfMOTobQ7F4kcAH5PpMHKZKGcPwNnLkYy4wS", "sWqxlvhO3yRSnli5K2KuPGHCZzkX1fxrBoouhTGiPhABTsGlsa", "gHovSNtAtunokwaYrF07xPn8aEyrzpPd6CXWZQfQISD2PnZG3ZL0w66XK3MKsjvwvSRTq6r7Y49xqgBtDVrAbwfwxzEpg9jaaA1QEsXnxfilJueXPTfyNIuK", "F87vGrTqzUECNmzIPf3iZfDw8svW8noNuwHAlkyiDCuawrqLXt", "24WFze6u8EfxaZrrjcZhKmsDKo4A8b1AeXPdAVVGiABIk27Rce7xRzAjlCutmt3QRT3bwWpeg1wQ33qgixb7ujqfviZfcc5136cycPcJQXhUYX8EShLMQA2J", "qbzQB4RD91BlRn2rIkJrFR5i8P4WX6qNfnoprF2yFDkgymVHUp", "8kEBQLaSr7XfVCSH1IU1GjEyPBlvSDiYvwjLHKo7RLkuVBBVTgWhNjgluPgKcMqYIZrYrddHyLBSWLxxzRfMAJ72ilMI7CoOkgubJXsGs2iPLdKK4zeDGkFw", "VaFbk1zUht4zOuDGuvdFWyZavElCy18RZL2JNzm2qo1EiETd74", "sb0QCwcx6YwCzVW0ntxZvoNv237VeDYVoYvyUVuY3oj0KFy78we1kzuk00EfDmAzK3wnYqJZe2ZwHW1NSfNAeHsdH4ISqQS9TMuzCDWoE5lVZmt1SG94V0hl", "4xDtNd0ozul95HyJLjnuTeuts1wN1d86ZKzuvzjtrS2ukyE5f1", "z9dr2Vtyquax07Hx1Aui3jB4ev2qygrvpSnpxgmnYKkXPzUQAN9B4IFiBGY9uN4jppWmTGY2YIZxG1OQMVZRln9w1g5v37etx8dOPBQvSztizF6LkfmTSuPT", "aSOdZ0UU76tUFHPhHINEXTZF9MiZG71qXNR5OuZV0QzFgMvvfI", "9AmiQt48QIER6lpYqBSOgQmdfQxaLcrUndDBUFJuWVMcF983KYPyyCZccWAw91Qucb56pM1LqLx5U48mcYkbiJBIpLEwLdoxEt23E1M4KI9mMFYylIXRbgkO", "0wJLZ7Gm1GnFHAHbSONodvkNBGokwW7wRQHyXWiWmWj4e0d4Oz", "q0saL4q7mleth3JxzrTiLDE5Hq5tuSskQiKlm9sZuUQbVkWVZzDuDPxSF1J9RBtruBceKSBCxcmSKIvrI8jTXhtmgDt7MmyEyYrG02TvcDMuVHllQTCv86go", "HZvdMtqIRhWPhxLIAfCgwwPKPcGViwJzTEap7Q5W7avnXE5gtF", "KoBj8YLM31GM0kYZXfzb95B3sgHxM9CgxMO3sjQwjeGjOpIwSGXaLgdDMs8h1KLwej0XRORA0hrPU8JvMoVhU8so00T0IpwxWuUvGv3Hate3zxyLlT0DbszZ", "sTZ8GW5kOXgfQhw1aa4ZV2sETsP2iObap9h5fmo1IUgi9ajk8l", "Hdl8rC0GEjdoHQxwWahIbzmIhtqPdz8tcs1S4zgJgJ5wk2sEcZWBYGRE7IbjHjctbbJgY0xFH2Bz43Bebfn9tFL1XwkogMfFvzvTxqgEspEurPWS5KZyXvx4", "rhqV3VlwSeQNV4cLuoElBiDE0mBXh8bXqP2rtnoJSChvGJE85S", "tGB6TBrehWmG3ag6SZtEqJOXCcoRltte82jbCaDt6x98YnEyK5ABPWgZ8V0tMuWUuF36nGxrC5zisDeBHoMeK2DQVEKs6qK03O5oc2fo7dU0q895uVjCVxdz", "9xrFlBDmXIaALDwSqPQfXZkS2SeWPFVWAKltTwf1FD9YR50FUP", "u0wdQx52RSIuySEhMhdzgsDpQctPrLmkLgNlbSm2u4usU8ZqoAoU11IPbBoSWYCqDXZozLptPjjsqGicRW4SVMr4XeV2AhsNFRAClz6Agn0U4j6VDBvhVml1", "OG3Zwtw9I4J31PCiBCCFtJk7SdmvPVwokxLeqHn9K6ALUM3dZE", "sSXaXxDHsannOXkj9ZzwiJ0qcSDg5msvCPVkKi1AJmxfHgNQFKMvbLlDlyrpkjkx6EfQugZBRWriCC9RWTM7m6KY4CLnv5i2JNQE1zNSUEBgQI6wlQ3YWM4Z", "YPMRU4TmPsyQrLrLY00wI4t3UuZzGdYm2sEVwfHJXDjNWYg4Ye", "zqissBkR8z3gj5WvaQbpj60SRXz8ZXmYMTOCe7bk4eOnkujIKI63M6TobSu90efK72Wj95RBkpySjfk3vq4IvY4U0ydyaJGgJkNSqpdaeZ2OFkPAZUQS0Uw0", "QYx1pBh8w4amtBKYiKux4J6blU3lzykNWhOLq3Tm81WzAqVsAP", "oDhsmSMoEJmyhGd3bT72EF1kCBbi3j7ruojfF4TRNDP2T062RD4fQ5QcGzKHiQ9bCqGRujsGwFINDOPfZTKzWkckhu1OI8zVxDupul5o0MBCkarK1BHVurFb", "mEz2LwXG9Q53B9r9V2LDaCVZMl4EcHpMWnPpju3rK6sVFkdiky", "uJ9NsV8xjjEW5iHUV1PYqjfiDsQqZBmTSvoKOxH5gUalArEgsbCgIpPVipJHy6iQzWlOR0R7S1rdt3HjeRQwHpQxcjEbnu1nQk9sjaxBcomVp3CTTcOkPoh2", "XtdJnc6BLF34nzDPl0sb154UfQE5Et7kmi3XK7jdMkh9hvXTtN", "4uQ6P6XbBjTGRFyUlGbSuvAb3sUYLNvPIMTfS0Ebihr9vpcg5D6x7GX881gTNbqdxKGNIUy0CpA7cmlgxrb2788G8ohVOW6LqMh6qd70RF73zqhuhJvnR31X", "si0GC6Z2SE7HsCHJRNKOD2GtJ9giDfG3LGHYLoal3h2ttICIfU", "eqUtjn2NWD2kGO0VwLKU5LA7C1POI2qwrLnY8qwc3wMIKLnEg5hlOrraqEw8Fn368qeEeYriVD0nYl0DphwDWloM0iVFVWJdMxq1WhhzsfmROmcDTYRzKDKI", "vnVPJo0djqcFXJEQwzpLlRYDxxAF8UV2H0RYoRCYIoln6yB2x0", "NgPurLr2YyU40k4RIrsSN8H8wN47Nz6lgTdXoUXNQ0PQiRr0IiRdqgkk1osOow7SPkxCDVXdTw4BNt9eZaHOG18Hqyecul4KW1UhU1KxvM6IEGunoCB3DKI1", "IwdBgfVChxr9yB5rWB9kP2XCEhFPzXPHS0Q8gtILq9UmIXdojl", "Y6n4I1jVOi1nxToOZUHpn8wFuEnY3UHZY4br5KMT2LH0o3MLXdAIj6XcJI8KmPtLTVAYnUzqqEocH8yml64TBc5UsDofchy5A8bwaYkQnW32ezpP5rsGRviK", "8WziCvnK1MGbt00gU3g80VW3NMIoI08QV59hyuzzFEZ8CZmhaS", "pawLbJit50sCONFX2EQ1BfFklSJX9rzyRvI1C0uGymSM9hs9tIB5vQpeq7Bzy8wO2EPECHSA2uW9aOJTeUWXsKBjRKgNTajVm8hyOA8Q2dZczs4cKa9DuJuJ", "dYh69QZvXHstP0JRbq2bh6D1eKCZd4sHdXLmwvhTAZMXYdy7Ry", "g84t8jCIGpN640eOmaJR1RzLyVwucNtJUxAceKus8HzCFba19rRAGQTEtN9Tk0mCvvmaFhSNwPYC06B9wcHC0iPr5WLoW50R0nzESSZMp5WqCix6IDIHvf81", "BRphXn9Va6h0YHNMKtCWZ7asKr7EWDFif2PCpWfOdNO9clTwfd", "RCl143s9HPNW50WSAKxpiaA6hmqBjTo8fX9ib0rsNCNSCruMBrAtPKy55mEmD0usY1Y71OxMYKolCh5LYDDyYB1bvFN8FHylGXqItocR6RCG8GceTpazybat", "ovz2CxnTUejNQLpWkznqDPVfC5cAfD1T80VJxHkQtTlJmYpVWc", "LjzoOBs1JXCKyIKSZGhJgakRrXyg0UHLBE8aO0ZhVj0TzKtZYasE8dez8ce64tRF7XnVXKB23BU3TLa2uSG23s09SeFWXfkcCX8isJktSCuvWUxQvEQw4Q6X", "2L1ZylCBHIt9Zb01mtwINugG66D8XJfZcf7ZQHkhZbo6An7wg1", "C1tsIzzV8Uml1MQ6vpNdWuCJyN65Hk5UlyK3wHW2lGnlbCrW1D8V5Km4fs7xcCROBlP73u9mAuXl4NG5aMZfgLjMCrJm1i8CRYHSSOFaJkMN5aRfw0JaJ0uV", "pDIrtQ3LwJlMh0xyjHKorlSljlL2jGWZRmQJCRc7kNTQMQO5fi", "rWRJFA2ZBmphLETjXdA9ktVEJrcfuIOlmp3205b9pOoAaHr8s2FbtknAZPpTfDDS3GS1J189PwHxB9539Jc21PCbn12SDFsETKFnJLugHBeSKhTT04T0TdZG", "fbhspZ6IsJ39exqt7UJRBktAoK8GyhWdGBT5jXMboNkQLYJS2a", "rCKiK73SN19rcP33TmYpLMA3mVc3vcdlmvT62UYPTfF35I6W2eJLyTMizwlsZMdLI5SIZyi3ev6hBBDDnWWmzsUwpEpMaQhqV7936p4ik8PvJc678cr5SJ2H", "Xpd6DJuhQ3kUqmAYuZTEBXJH78LaRLpxAT1Lkv28xkbnWlMRLn", "dULukQ250TQqOYHPt1Lu9Gek19UNYp9BJS51s74rYUhx0yMsxfk4vOnxVHI36PENrHNiMRZtuEquCAk9qUDjryeMFxOJKahAs4sCVP5PdtIn40usV5bK4EeJ", "B2dTdIdTMTdpsjDVcTGeTAWwG6GKKtdTtGwUWavq3ZguGrNqKe", "Vno1i45yOPp0qjEnDlL7bOgFIw6emOIFA6Fs9KoVieVYLiLWRgd23JGJDMx0jFFtKSlRnZwVDQ3Y6N5X3iZ40nODALBrZPkrrVGe4C7GaBmgWrDZYlcWY0jg", "JvXqIHf9kvmn8t3g2pNYfY6BJihqgOWzH2oZHTh2PTpVKqBLfW", "rI5xTMd8CJXhHoj5O0W32vWpQofa9J61b9w3WY9gpgN4T67p5es5ZOvyAaWKraJTkDUElduZIIdlMlaRPSXwoSsy0MIsxZJhnntWOn3g5hRQQ1rnTOhHoYEn", "uUfr4wWphPJ5BNmE2DeSDWDesuufS8SNc5CgzhVg4nlFAXUCj8", "cwcpaVhU8AcYVFdftcMNIRA1gIZ8SIH4CrrmKWFSgr094bpyB9JTYTTDl2LDIaFUS4EmaTFFJDONpBJ0JaSr3v4mvQxByAfQErBpLO4cbQxOaHPtrpktindb", "BZm9jPYwGjlZ7n9gB75lMScBHN4x8gYJFISwh0svhbToOcVYjY", "J50wHFHJCPxiiAy87d7zYoZzbva4THcnNchcrwt1Lph1zf96IE4o3dmcYMg2dGnysSYhOSghHNiE0pLI4N45yqfWCLWoZHmRjL65lmm07SE7IXNKuRNsG2NQ", "LrEu91JqMPw79g7G9JNPrkjl96cN8xoTo2Lv3emN1gUAKZOTrl", "siTZRaf1ylymEnoZiqBSDC6gKRDis4RjkuICTwDRhCBuxxRdnd4znAf8ZsqQvI9fAPrdJ321DBvA9Mnuxrtl0YtXPjxKz4xAUpllqom3zfD60y1xouioRZLq", "HH8GL5OnsAZiwJjvzw2zt1whvdTKAm8P3GeNK2AAChr81a20V2", "xM3r3wUUHdGP2Iegfwjn6tTv0UU0Sx2PJ3GMxjoEK4eMMG3zCknGbGAZieZ8ZZVsalCYS0mm2O7Pc8Mos73RLD13pYBO8gEiQQEqO1bQNgn0oAmeHp5d04ep", "doBjSPRqnehBdGc0wNykXlMnYRQZU2M7qYqJvF9jtosW4SVyqT", "gNC28lSWIwZe1PApg44onwcdQf6vbwNIHXIQIiwYeVBdtLSXPVLARworZulAo6Q5dhVwPSS2vdfox6KKbfV2ZHr69aFxgf2KKWEkygmtKPgFV0Z4d24BHwHQ", "WULD8MVSsjCoPwhhKLwnJUsvWw4osJCNoYYws3OkmZY9VDrnXl", "bqFTjkPnYG7ibvE7r6ADqumM1Gaq37cevp5fZTQ7jXoIQ2PH9XVxPFKQVsHXxrBsgFVGiwLPR9hsC47JZaGyqYOJQdqNU0EBFhRxbkK3uzv430NcbbYRAwka", "Ybw2b8BopcjRL3UF2NH3NcfwDBLN56wdfqgEyr0nSjElmgyo1F", "rNrUJ2ffOijIMM80a6pYrFH403kypkDe726Q3j5RRmjn8rngvdEmsVqrWZpLJ1zQ33o6msVEeE1n3nRwOgjEBX5g4v1Lwzjx2Y2pQX32k2nnpFkBvRQ4wVk1", "QkMKj4IjcKY0pZ2ZcqNP35bwW10SUjRtTmDAqTtQlQQbzQAZEV", "xHYWD2XCTzvusMe6UUXNuJnIulj2KxWFF4lQ7GcaGVS8p7CJbkhU3SmvDVvWRRjgWV4blhB1Ad80kKJK2ym3RYwc2s6TJq7nLBO4qX61BC1tUIDXHxYiWVIW", "LNxcD2QWBma2Ke1Tq0MJIYoZVMFzpWVAtQn4SBaex8eHnfkbd5", "uvdiT63g6sAZ130m7Qxf2uogAZJsAwx3qYjJfmxld8Ie9IQHhLujFiONFhGQeBRUkAlPxg8YoQCyhaDOv758oTW3BkRnvsFd3y2ye8WRZgPGGac9fhHT9nVK", "Vw5PpK2qG3muBGLiuiwAIWJwCYPLKudppiEc0FQGGA8RQU8KA4", "SRbjNnHk6bfjPSPb4PqUd6elW2DcKOgmpFVC0ku6MZnjzCK3ZBVAF7wj97LTV0DIFgSERNIlu6UuImvqxR0BWuue2E7VEJoRzEdOZw7U2ZMIMH6Hg7SBzLp1", "XuXlDJABVmX5ifXiCtyY83qnAGw9Zl96feptvy2QkZTQC08Pr4", "vy7ljF0fNZQWe58Rw3PwR9WvXgvf5li1jpkS3i7QIVuuY2LT5lPWstPQaJ3d4jelZNDa5I0LnuDJuZmxICR83rWdAaFCJrxqE8QIQOdBGpUAOF5eRXmSMJ6U", "rLg8CdzPlNh9kII07k9TzE7Ojur5BvZ2EF8Oq5nZRSiBjyBqjK", "IiXP5GHwKQptQ37ZRxeDV5fBGOAQDtiVZFseUAYoYNhzQmYsiA3DGiOU5YuIPbnzqfbInA6MXmLyYroG1rTFXqkcMcumDfj2JKK6UPQ2BjyjakyabPp8FXjc", "AdMLJ5LcNegs35sCootPYrx7FmDSKw2SYOlrR5Rpj5fkAVuzJn", "MpdJws37KN4NncjXR9cqyLtb346x1NiLCLc6BfDU1HporYJGhv6dE0EH2IC3fvMpEyvOd9seOhRGDkUtgbUuZhAZzKadDwSSuOqXXgAtLb7YLcPzBusib0HY", "KrBYneyh0mEVSMOlxWJH6hEHZ6z84EgN5qtsSrXSbjv16Jm3n3", "IrkX8Hb5PeJ61OwuEOjloKTjJZ05ao6tfrOm6zpWd9ccVWWisDRgVuNoRNr29ytnnHZtEOPqVzSzTxfLA6zezMSQkIQtGJg1aFupcId5F52j0h4Bo4nlQFBA", "Vc4jtikUwdHYtub8xeryJw75yuqO70XdaZKTH5xDgCjZ4Jf0vX", "yER3KPx8l48Gfip0C537IhI0EMJtMEOIQpLiCGrwJxCyg0wq5xvLcDLqYcksq8BFwUx8lm24kF0OFvCKq7dTJzJrb1jQ8sf2La86NB87Q6Td1fvsmYJ3Vcu7", "ccVkSAmnksr73xCR4f43Kxt5WC81n16Pbb73jrpUjeZnckEePH", "hiEblkltkYsoxTQ4V9vIbdw9QWtcAItqy6PjoAbYjRNgtljOuceUFadd5WEFm55lBUS0f1WMTr2McjiVMMxZuaBz4PDqUIZgl0eO18kS0kmaSU3oo0LjYWgc", "ttROA02v0eH0mzSkjDLBhMxUNHBvlrWflx1tv3muf3uR2KCjXV", "tDrofC5q8rhcUQZVHUW3MB4Gc4Zmo4HfH7RuJVkPKQ1ooYJ61p9NyCcaGBL2FahVh7P1c8QwYQiMyzQxmYLkkxI06d3LCiotpCsPKJJshzCfybdk9wUrrlrx", "MsGYZ5SOHImZZ5RG3bu1CVkJRCAIx0FKqVsPYImnbYMAblReLJ", "eXoOpFaxVYxisoBiDk1xVaVsi5b9hwQLSEjHRKEwsAeiwqQ7YP53zatgdVpLPGgrSQ6ukJqaRTINJgUp4Zs18khlFV4cjlUB9Y5rruRGNhdeN6TRfJTl3AVG", "fZtOILaRtdIjXjxuQbYmhzBKJe6MnbbQ8SpRnNsey9LWqJOFsv", "1ZuCrBpxWaW70dZn4K8uw73IbsZz7Rs6ylGpw5lSdHXeu6PwOYpLdqbEiABpZ4vXpCKjF5CrLhTFosAAQzT3p4FWCRJlTFIGPbzcg9R1ruFdnPnBMHF9LSfY", "txHMCYcZ9a9pjbraV4DGT1SnGfuZ7Y5zVNLfvwE2WLrDugoOk1", "eB06wGjrqrPtquG9Z93lBX61lzfZNOY1ZZ6WnpNbgkVUejcBtfw2B01wzfTM31OaYS6MHRxy9SQnC2y3gs3rt5lqkEDlDZLm1Q6Ir3EzUdmedjfJbi8SlrJT", "3UEH1Y12y7In8Vma8ZClGr5pYBGH3Zl61xL2VK2TPKFWp16xYH", "jo6mcevswwPf1QcMQ6fSX4mmaaofXKwE72yjfsZboyEpMqAmupCStyCSY074J1GQ3D9i5gHreVhyKriEeueVqrxNp2P83fY5qflvL3lxYStqHb5tTjOKYKhO", "M4WOh3TYgER0HCvoepetOhmsP9AxTpLptqBare8XraV6kRuNEX", "GaC1SbAaZdPsQIictXEz55XYCIx4f9btkmuAN4lufAn6RVgI1uH60pcA5aEkhodRaWcvaLqETdKu6yC7qUBoHoyMMB43zfTXB3SkOIyrtGk0Ew74OJtf5pzP", "03SxjtUswvcKDaA7qu52oC5DTwsWlqvmrMhYFCRA53SGccNSUQ", "TJbYW2UMZDCSz2ofa2r1Cu3eAfFW5jwY0X4WaYr7m1Zj3MOeODfY7gCILPoR9ix7G2eoaTvKUS2WoQAAcnihUtxnIlCPSAXiC9UkcP34r5aeTio5UXlwOihg", "Su4u4baEk4yKT1MI4vwYbjb5EKzc3hGVbKPftxtd1pvSpGitBf", "PmMzqaJpCKWSp5lCie9bG8PBaERJ5awTNIQDsh022XSpaD0Js7s8GHHoTj7XH10eJOp95qB5LcvvptEhy7nEO51qm8N3ALiRjVZmLisgKlcAcopavdnIio6U", "uTX4mDUVj3F2l5j6oJEQ7311gmHMaNqUoMXaX13E2IHlOypAF3"]'
);
# Connection con0:
start transaction;
select json_extract(j, '$[0]') from t1 where pkey = 1;
json_extract(j, '$[0]')
"fa37JncCHryDsbzayy4cBWDxS22JjzhMaiRrV41mtzxlYvKWrO"
select json_extract(j, '$[1541]') from t1 where pkey = 1;
json_extract(j, '$[1541]')
"PmMzqaJpCKWSp5lCie9bG8PBaERJ5awTNIQDsh022XSpaD0Js7s8GHHoTj7XH10eJOp95qB5LcvvptEhy7nEO51qm8N3ALiRjVZmLisgKlcAcopavdnIio6U"
select @var_0 := j from t1;
# Doing partial update of length=50:
# Connection default:
select json_extract(j, '$[0]') from t1 where pkey = 1;
json_extract(j, '$[0]')
"fa37JncCHryDsbzayy4cBWDxS22JjzhMaiRrV41mtzxlYvKWrO"
start transaction;
update t1 set j = json_set(j, '$[0]',"bK5aLlMa6uxuOlGvLmuMyufDg1BVBQXkjcK4LefRYaMvMaofKh") where pkey = 1;
select json_extract(j, '$[0]') from t1 where pkey = 1;
json_extract(j, '$[0]')
"bK5aLlMa6uxuOlGvLmuMyufDg1BVBQXkjcK4LefRYaMvMaofKh"
commit;
# Connection con1:
start transaction;
select json_extract(j, '$[0]') from t1 where pkey = 1;
json_extract(j, '$[0]')
"bK5aLlMa6uxuOlGvLmuMyufDg1BVBQXkjcK4LefRYaMvMaofKh"
select json_extract(j, '$[1541]') from t1 where pkey = 1;
json_extract(j, '$[1541]')
"PmMzqaJpCKWSp5lCie9bG8PBaERJ5awTNIQDsh022XSpaD0Js7s8GHHoTj7XH10eJOp95qB5LcvvptEhy7nEO51qm8N3ALiRjVZmLisgKlcAcopavdnIio6U"
select @var_1 := j from t1;
# Doing partial update of length=120:
# Connection default:
select json_extract(j, '$[1541]') from t1 where pkey = 1;
json_extract(j, '$[1541]')
"PmMzqaJpCKWSp5lCie9bG8PBaERJ5awTNIQDsh022XSpaD0Js7s8GHHoTj7XH10eJOp95qB5LcvvptEhy7nEO51qm8N3ALiRjVZmLisgKlcAcopavdnIio6U"
start transaction;
update t1 set j = json_set(j, '$[1541]',"2JbfWHeglp4GYnqssBVVb33vwPTl3oS353gbJKH27MIf98WzH1Sq2WjztBkuxAx2DbdUvtW3DmgKsCI8BkyCEgB8rt0o3wqEXRjTIFUT08osL40Umxg1dp7U") where pkey = 1;
select json_extract(j, '$[1541]') from t1 where pkey = 1;
json_extract(j, '$[1541]')
"2JbfWHeglp4GYnqssBVVb33vwPTl3oS353gbJKH27MIf98WzH1Sq2WjztBkuxAx2DbdUvtW3DmgKsCI8BkyCEgB8rt0o3wqEXRjTIFUT08osL40Umxg1dp7U"
commit;
# Connection con2:
start transaction;
select json_extract(j, '$[0]') from t1 where pkey = 1;
json_extract(j, '$[0]')
"bK5aLlMa6uxuOlGvLmuMyufDg1BVBQXkjcK4LefRYaMvMaofKh"
select json_extract(j, '$[1541]') from t1 where pkey = 1;
json_extract(j, '$[1541]')
"2JbfWHeglp4GYnqssBVVb33vwPTl3oS353gbJKH27MIf98WzH1Sq2WjztBkuxAx2DbdUvtW3DmgKsCI8BkyCEgB8rt0o3wqEXRjTIFUT08osL40Umxg1dp7U"
select @var_2 := j from t1;
# Doing partial update of length=50:
# Connection default:
select json_extract(j, '$[0]') from t1 where pkey = 1;
json_extract(j, '$[0]')
"bK5aLlMa6uxuOlGvLmuMyufDg1BVBQXkjcK4LefRYaMvMaofKh"
start transaction;
update t1 set j = json_set(j, '$[0]',"i7Gj36ybVh2muUFuc3nv5lQsi4tLu0na53K77GibviNpCcioeT") where pkey = 1;
select json_extract(j, '$[0]') from t1 where pkey = 1;
json_extract(j, '$[0]')
"i7Gj36ybVh2muUFuc3nv5lQsi4tLu0na53K77GibviNpCcioeT"
commit;
# Connection con3:
start transaction;
select json_extract(j, '$[0]') from t1 where pkey = 1;
json_extract(j, '$[0]')
"i7Gj36ybVh2muUFuc3nv5lQsi4tLu0na53K77GibviNpCcioeT"
select json_extract(j, '$[1541]') from t1 where pkey = 1;
json_extract(j, '$[1541]')
"2JbfWHeglp4GYnqssBVVb33vwPTl3oS353gbJKH27MIf98WzH1Sq2WjztBkuxAx2DbdUvtW3DmgKsCI8BkyCEgB8rt0o3wqEXRjTIFUT08osL40Umxg1dp7U"
select @var_3 := j from t1;
# Doing partial update of length=120:
# Connection default:
select json_extract(j, '$[1541]') from t1 where pkey = 1;
json_extract(j, '$[1541]')
"2JbfWHeglp4GYnqssBVVb33vwPTl3oS353gbJKH27MIf98WzH1Sq2WjztBkuxAx2DbdUvtW3DmgKsCI8BkyCEgB8rt0o3wqEXRjTIFUT08osL40Umxg1dp7U"
start transaction;
update t1 set j = json_set(j, '$[1541]',"kjE8bxCSG4Q4fW5xdBBJm6z7vBjbxL4h3JpcE05U4TWhxceYlprXtoepzLQxfVcimQI0QNUUp1CmboLKcArVzTIwmhtRCW7wwQwKlOoaNyLwlgGNo5qnY9kJ") where pkey = 1;
select json_extract(j, '$[1541]') from t1 where pkey = 1;
json_extract(j, '$[1541]')
"kjE8bxCSG4Q4fW5xdBBJm6z7vBjbxL4h3JpcE05U4TWhxceYlprXtoepzLQxfVcimQI0QNUUp1CmboLKcArVzTIwmhtRCW7wwQwKlOoaNyLwlgGNo5qnY9kJ"
commit;
# Connection con4:
start transaction;
select json_extract(j, '$[0]') from t1 where pkey = 1;
json_extract(j, '$[0]')
"i7Gj36ybVh2muUFuc3nv5lQsi4tLu0na53K77GibviNpCcioeT"
select json_extract(j, '$[1541]') from t1 where pkey = 1;
json_extract(j, '$[1541]')
"kjE8bxCSG4Q4fW5xdBBJm6z7vBjbxL4h3JpcE05U4TWhxceYlprXtoepzLQxfVcimQI0QNUUp1CmboLKcArVzTIwmhtRCW7wwQwKlOoaNyLwlgGNo5qnY9kJ"
select @var_4 := j from t1;
# Doing partial update of length=50:
# Connection default:
select json_extract(j, '$[0]') from t1 where pkey = 1;
json_extract(j, '$[0]')
"i7Gj36ybVh2muUFuc3nv5lQsi4tLu0na53K77GibviNpCcioeT"
start transaction;
update t1 set j = json_set(j, '$[0]',"qbi05qwzEqJxE6Wc2rWnVn8Jsz5P8niwOQwSEqRQgjOsnuSplz") where pkey = 1;
select json_extract(j, '$[0]') from t1 where pkey = 1;
json_extract(j, '$[0]')
"qbi05qwzEqJxE6Wc2rWnVn8Jsz5P8niwOQwSEqRQgjOsnuSplz"
commit;
# Connection con5:
start transaction;
select json_extract(j, '$[0]') from t1 where pkey = 1;
json_extract(j, '$[0]')
"qbi05qwzEqJxE6Wc2rWnVn8Jsz5P8niwOQwSEqRQgjOsnuSplz"
select json_extract(j, '$[1541]') from t1 where pkey = 1;
json_extract(j, '$[1541]')
"kjE8bxCSG4Q4fW5xdBBJm6z7vBjbxL4h3JpcE05U4TWhxceYlprXtoepzLQxfVcimQI0QNUUp1CmboLKcArVzTIwmhtRCW7wwQwKlOoaNyLwlgGNo5qnY9kJ"
select @var_5 := j from t1;
# Doing partial update of length=120:
# Connection default:
select json_extract(j, '$[1541]') from t1 where pkey = 1;
json_extract(j, '$[1541]')
"kjE8bxCSG4Q4fW5xdBBJm6z7vBjbxL4h3JpcE05U4TWhxceYlprXtoepzLQxfVcimQI0QNUUp1CmboLKcArVzTIwmhtRCW7wwQwKlOoaNyLwlgGNo5qnY9kJ"
start transaction;
update t1 set j = json_set(j, '$[1541]',"bGmjXcgc1mPhim6cEISdj6K7z71PxkOWy8FVju6kgTQPFUzRmS3VWNcTTbtQLFuJO7n71tpiKD5ah4zUU2zzOaSrBLFXZ9oxGb2GSpwn31Li3KCWLAThkvYt") where pkey = 1;
select json_extract(j, '$[1541]') from t1 where pkey = 1;
json_extract(j, '$[1541]')
"bGmjXcgc1mPhim6cEISdj6K7z71PxkOWy8FVju6kgTQPFUzRmS3VWNcTTbtQLFuJO7n71tpiKD5ah4zUU2zzOaSrBLFXZ9oxGb2GSpwn31Li3KCWLAThkvYt"
commit;
# Connection con6:
start transaction;
select json_extract(j, '$[0]') from t1 where pkey = 1;
json_extract(j, '$[0]')
"qbi05qwzEqJxE6Wc2rWnVn8Jsz5P8niwOQwSEqRQgjOsnuSplz"
select json_extract(j, '$[1541]') from t1 where pkey = 1;
json_extract(j, '$[1541]')
"bGmjXcgc1mPhim6cEISdj6K7z71PxkOWy8FVju6kgTQPFUzRmS3VWNcTTbtQLFuJO7n71tpiKD5ah4zUU2zzOaSrBLFXZ9oxGb2GSpwn31Li3KCWLAThkvYt"
select @var_6 := j from t1;
# Doing partial update of length=50:
# Connection default:
select json_extract(j, '$[0]') from t1 where pkey = 1;
json_extract(j, '$[0]')
"qbi05qwzEqJxE6Wc2rWnVn8Jsz5P8niwOQwSEqRQgjOsnuSplz"
start transaction;
update t1 set j = json_set(j, '$[0]',"FlOouDj8mjOFYK0ZJLILdSpwcIdKB9EQucConvvaeHnBankr62") where pkey = 1;
select json_extract(j, '$[0]') from t1 where pkey = 1;
json_extract(j, '$[0]')
"FlOouDj8mjOFYK0ZJLILdSpwcIdKB9EQucConvvaeHnBankr62"
commit;
# Connection con7:
start transaction;
select json_extract(j, '$[0]') from t1 where pkey = 1;
json_extract(j, '$[0]')
"FlOouDj8mjOFYK0ZJLILdSpwcIdKB9EQucConvvaeHnBankr62"
select json_extract(j, '$[1541]') from t1 where pkey = 1;
json_extract(j, '$[1541]')
"bGmjXcgc1mPhim6cEISdj6K7z71PxkOWy8FVju6kgTQPFUzRmS3VWNcTTbtQLFuJO7n71tpiKD5ah4zUU2zzOaSrBLFXZ9oxGb2GSpwn31Li3KCWLAThkvYt"
select @var_7 := j from t1;
# Doing partial update of length=120:
# Connection default:
select json_extract(j, '$[1541]') from t1 where pkey = 1;
json_extract(j, '$[1541]')
"bGmjXcgc1mPhim6cEISdj6K7z71PxkOWy8FVju6kgTQPFUzRmS3VWNcTTbtQLFuJO7n71tpiKD5ah4zUU2zzOaSrBLFXZ9oxGb2GSpwn31Li3KCWLAThkvYt"
start transaction;
update t1 set j = json_set(j, '$[1541]',"ChVze5HHORRarJA48yx1WcIJns4VkAYur1uT49jSYA2QTDSZ9Pafzrykj2GRAmKznCTrJCIsKKIlViJe7rJ5iHpQH3pPp9PaLqQf0iXK0n3WVMAaEUdujTIz") where pkey = 1;
select json_extract(j, '$[1541]') from t1 where pkey = 1;
json_extract(j, '$[1541]')
"ChVze5HHORRarJA48yx1WcIJns4VkAYur1uT49jSYA2QTDSZ9Pafzrykj2GRAmKznCTrJCIsKKIlViJe7rJ5iHpQH3pPp9PaLqQf0iXK0n3WVMAaEUdujTIz"
commit;
# Connection con8:
start transaction;
select json_extract(j, '$[0]') from t1 where pkey = 1;
json_extract(j, '$[0]')
"FlOouDj8mjOFYK0ZJLILdSpwcIdKB9EQucConvvaeHnBankr62"
select json_extract(j, '$[1541]') from t1 where pkey = 1;
json_extract(j, '$[1541]')
"ChVze5HHORRarJA48yx1WcIJns4VkAYur1uT49jSYA2QTDSZ9Pafzrykj2GRAmKznCTrJCIsKKIlViJe7rJ5iHpQH3pPp9PaLqQf0iXK0n3WVMAaEUdujTIz"
select @var_8 := j from t1;
# Doing partial update of length=50:
# Connection default:
select json_extract(j, '$[0]') from t1 where pkey = 1;
json_extract(j, '$[0]')
"FlOouDj8mjOFYK0ZJLILdSpwcIdKB9EQucConvvaeHnBankr62"
start transaction;
update t1 set j = json_set(j, '$[0]',"U8MIHjqbZGEZwlrxWvRzHZXT1BOjcgi4o2M4mDfLRttOckJ6fi") where pkey = 1;
select json_extract(j, '$[0]') from t1 where pkey = 1;
json_extract(j, '$[0]')
"U8MIHjqbZGEZwlrxWvRzHZXT1BOjcgi4o2M4mDfLRttOckJ6fi"
commit;
# Connection con9:
start transaction;
select json_extract(j, '$[0]') from t1 where pkey = 1;
json_extract(j, '$[0]')
"U8MIHjqbZGEZwlrxWvRzHZXT1BOjcgi4o2M4mDfLRttOckJ6fi"
select json_extract(j, '$[1541]') from t1 where pkey = 1;
json_extract(j, '$[1541]')
"ChVze5HHORRarJA48yx1WcIJns4VkAYur1uT49jSYA2QTDSZ9Pafzrykj2GRAmKznCTrJCIsKKIlViJe7rJ5iHpQH3pPp9PaLqQf0iXK0n3WVMAaEUdujTIz"
select @var_9 := j from t1;
# Doing partial update of length=120:
# Connection default:
select json_extract(j, '$[1541]') from t1 where pkey = 1;
json_extract(j, '$[1541]')
"ChVze5HHORRarJA48yx1WcIJns4VkAYur1uT49jSYA2QTDSZ9Pafzrykj2GRAmKznCTrJCIsKKIlViJe7rJ5iHpQH3pPp9PaLqQf0iXK0n3WVMAaEUdujTIz"
start transaction;
update t1 set j = json_set(j, '$[1541]',"3vHYOJjk2JRiODkiFWvsqNjjjJR0N5iQ0zzMIg7I0W0Mhj4xF0p3LZk4qC4EFkeFjbb0IgIICHcu0grDeeHzB112B5GQpsdXUDXktn064cy2InGxRXwbWybg") where pkey = 1;
select json_extract(j, '$[1541]') from t1 where pkey = 1;
json_extract(j, '$[1541]')
"3vHYOJjk2JRiODkiFWvsqNjjjJR0N5iQ0zzMIg7I0W0Mhj4xF0p3LZk4qC4EFkeFjbb0IgIICHcu0grDeeHzB112B5GQpsdXUDXktn064cy2InGxRXwbWybg"
commit;
# Connection con10:
start transaction;
select json_extract(j, '$[0]') from t1 where pkey = 1;
json_extract(j, '$[0]')
"U8MIHjqbZGEZwlrxWvRzHZXT1BOjcgi4o2M4mDfLRttOckJ6fi"
select json_extract(j, '$[1541]') from t1 where pkey = 1;
json_extract(j, '$[1541]')
"3vHYOJjk2JRiODkiFWvsqNjjjJR0N5iQ0zzMIg7I0W0Mhj4xF0p3LZk4qC4EFkeFjbb0IgIICHcu0grDeeHzB112B5GQpsdXUDXktn064cy2InGxRXwbWybg"
select @var_10 := j from t1;
# Doing partial update of length=50:
# Connection default:
select json_extract(j, '$[0]') from t1 where pkey = 1;
json_extract(j, '$[0]')
"U8MIHjqbZGEZwlrxWvRzHZXT1BOjcgi4o2M4mDfLRttOckJ6fi"
start transaction;
update t1 set j = json_set(j, '$[0]',"1p6phkM9xrtoctshVqhmdxh3SdcxZDdZ2hOhRipMXg99a1o3sW") where pkey = 1;
select json_extract(j, '$[0]') from t1 where pkey = 1;
json_extract(j, '$[0]')
"1p6phkM9xrtoctshVqhmdxh3SdcxZDdZ2hOhRipMXg99a1o3sW"
commit;
# Connection con11:
start transaction;
select json_extract(j, '$[0]') from t1 where pkey = 1;
json_extract(j, '$[0]')
"1p6phkM9xrtoctshVqhmdxh3SdcxZDdZ2hOhRipMXg99a1o3sW"
select json_extract(j, '$[1541]') from t1 where pkey = 1;
json_extract(j, '$[1541]')
"3vHYOJjk2JRiODkiFWvsqNjjjJR0N5iQ0zzMIg7I0W0Mhj4xF0p3LZk4qC4EFkeFjbb0IgIICHcu0grDeeHzB112B5GQpsdXUDXktn064cy2InGxRXwbWybg"
select @var_11 := j from t1;
# Doing partial update of length=120:
# Connection default:
select json_extract(j, '$[1541]') from t1 where pkey = 1;
json_extract(j, '$[1541]')
"3vHYOJjk2JRiODkiFWvsqNjjjJR0N5iQ0zzMIg7I0W0Mhj4xF0p3LZk4qC4EFkeFjbb0IgIICHcu0grDeeHzB112B5GQpsdXUDXktn064cy2InGxRXwbWybg"
start transaction;
update t1 set j = json_set(j, '$[1541]',"nTTUUu64rdFUCFBYxbEkvlQ2vy4j2uDnLfIoZOsO18qCNziIYx2UiTWbRYJRSUDo9VcirS4qau0wujESgFuMiPw7xFXOjkCtDmZ4CcslWthOctrG8jco8Yu4") where pkey = 1;
select json_extract(j, '$[1541]') from t1 where pkey = 1;
json_extract(j, '$[1541]')
"nTTUUu64rdFUCFBYxbEkvlQ2vy4j2uDnLfIoZOsO18qCNziIYx2UiTWbRYJRSUDo9VcirS4qau0wujESgFuMiPw7xFXOjkCtDmZ4CcslWthOctrG8jco8Yu4"
commit;
# Connection con12:
start transaction;
select json_extract(j, '$[0]') from t1 where pkey = 1;
json_extract(j, '$[0]')
"1p6phkM9xrtoctshVqhmdxh3SdcxZDdZ2hOhRipMXg99a1o3sW"
select json_extract(j, '$[1541]') from t1 where pkey = 1;
json_extract(j, '$[1541]')
"nTTUUu64rdFUCFBYxbEkvlQ2vy4j2uDnLfIoZOsO18qCNziIYx2UiTWbRYJRSUDo9VcirS4qau0wujESgFuMiPw7xFXOjkCtDmZ4CcslWthOctrG8jco8Yu4"
select @var_12 := j from t1;
# Doing partial update of length=50:
# Connection default:
select json_extract(j, '$[0]') from t1 where pkey = 1;
json_extract(j, '$[0]')
"1p6phkM9xrtoctshVqhmdxh3SdcxZDdZ2hOhRipMXg99a1o3sW"
start transaction;
update t1 set j = json_set(j, '$[0]',"lRSV9cMMMtOYTGJ090MjsBz0vcp18j5u8VNH7jbTaz04FJ2NIO") where pkey = 1;
select json_extract(j, '$[0]') from t1 where pkey = 1;
json_extract(j, '$[0]')
"lRSV9cMMMtOYTGJ090MjsBz0vcp18j5u8VNH7jbTaz04FJ2NIO"
commit;
# Connection con13:
start transaction;
select json_extract(j, '$[0]') from t1 where pkey = 1;
json_extract(j, '$[0]')
"lRSV9cMMMtOYTGJ090MjsBz0vcp18j5u8VNH7jbTaz04FJ2NIO"
select json_extract(j, '$[1541]') from t1 where pkey = 1;
json_extract(j, '$[1541]')
"nTTUUu64rdFUCFBYxbEkvlQ2vy4j2uDnLfIoZOsO18qCNziIYx2UiTWbRYJRSUDo9VcirS4qau0wujESgFuMiPw7xFXOjkCtDmZ4CcslWthOctrG8jco8Yu4"
select @var_13 := j from t1;
# Doing partial update of length=120:
# Connection default:
select json_extract(j, '$[1541]') from t1 where pkey = 1;
json_extract(j, '$[1541]')
"nTTUUu64rdFUCFBYxbEkvlQ2vy4j2uDnLfIoZOsO18qCNziIYx2UiTWbRYJRSUDo9VcirS4qau0wujESgFuMiPw7xFXOjkCtDmZ4CcslWthOctrG8jco8Yu4"
start transaction;
update t1 set j = json_set(j, '$[1541]',"4Aa4ATexUmeYem3119iccHbaLpuLAAjCKHESksOFd2nHnoHoxzPYGy8Zl0svAc6SrKvcDHpoJa34OItKIGsWE0401wt9WzcMIXyTolH5JIAfb1zrHrLTqPRp") where pkey = 1;
select json_extract(j, '$[1541]') from t1 where pkey = 1;
json_extract(j, '$[1541]')
"4Aa4ATexUmeYem3119iccHbaLpuLAAjCKHESksOFd2nHnoHoxzPYGy8Zl0svAc6SrKvcDHpoJa34OItKIGsWE0401wt9WzcMIXyTolH5JIAfb1zrHrLTqPRp"
commit;
# Connection con14:
start transaction;
select json_extract(j, '$[0]') from t1 where pkey = 1;
json_extract(j, '$[0]')
"lRSV9cMMMtOYTGJ090MjsBz0vcp18j5u8VNH7jbTaz04FJ2NIO"
select json_extract(j, '$[1541]') from t1 where pkey = 1;
json_extract(j, '$[1541]')
"4Aa4ATexUmeYem3119iccHbaLpuLAAjCKHESksOFd2nHnoHoxzPYGy8Zl0svAc6SrKvcDHpoJa34OItKIGsWE0401wt9WzcMIXyTolH5JIAfb1zrHrLTqPRp"
select @var_14 := j from t1;
# Doing partial update of length=50:
# Connection default:
select json_extract(j, '$[0]') from t1 where pkey = 1;
json_extract(j, '$[0]')
"lRSV9cMMMtOYTGJ090MjsBz0vcp18j5u8VNH7jbTaz04FJ2NIO"
start transaction;
update t1 set j = json_set(j, '$[0]',"KJyoGaAY561rrIvAZ3q84nzJdKmTiCG2VColnzKq5Lgvcb39er") where pkey = 1;
select json_extract(j, '$[0]') from t1 where pkey = 1;
json_extract(j, '$[0]')
"KJyoGaAY561rrIvAZ3q84nzJdKmTiCG2VColnzKq5Lgvcb39er"
commit;
# Connection con15:
start transaction;
select json_extract(j, '$[0]') from t1 where pkey = 1;
json_extract(j, '$[0]')
"KJyoGaAY561rrIvAZ3q84nzJdKmTiCG2VColnzKq5Lgvcb39er"
select json_extract(j, '$[1541]') from t1 where pkey = 1;
json_extract(j, '$[1541]')
"4Aa4ATexUmeYem3119iccHbaLpuLAAjCKHESksOFd2nHnoHoxzPYGy8Zl0svAc6SrKvcDHpoJa34OItKIGsWE0401wt9WzcMIXyTolH5JIAfb1zrHrLTqPRp"
select @var_15 := j from t1;
# Doing partial update of length=120:
# Connection default:
select json_extract(j, '$[1541]') from t1 where pkey = 1;
json_extract(j, '$[1541]')
"4Aa4ATexUmeYem3119iccHbaLpuLAAjCKHESksOFd2nHnoHoxzPYGy8Zl0svAc6SrKvcDHpoJa34OItKIGsWE0401wt9WzcMIXyTolH5JIAfb1zrHrLTqPRp"
start transaction;
update t1 set j = json_set(j, '$[1541]',"HgfGzIYjjGtzGO95Aw2Sl7nP0Ny4WcvnGY1DoauXooU5Ce8KYAmHFYgGteIOED9UkBfYja6XMYaYAirhqby67fK1HcNUnWwXhc6QCAwWiW4rDtY3TW7a9RZP") where pkey = 1;
select json_extract(j, '$[1541]') from t1 where pkey = 1;
json_extract(j, '$[1541]')
"HgfGzIYjjGtzGO95Aw2Sl7nP0Ny4WcvnGY1DoauXooU5Ce8KYAmHFYgGteIOED9UkBfYja6XMYaYAirhqby67fK1HcNUnWwXhc6QCAwWiW4rDtY3TW7a9RZP"
commit;
# Connection con16:
start transaction;
select json_extract(j, '$[0]') from t1 where pkey = 1;
json_extract(j, '$[0]')
"KJyoGaAY561rrIvAZ3q84nzJdKmTiCG2VColnzKq5Lgvcb39er"
select json_extract(j, '$[1541]') from t1 where pkey = 1;
json_extract(j, '$[1541]')
"HgfGzIYjjGtzGO95Aw2Sl7nP0Ny4WcvnGY1DoauXooU5Ce8KYAmHFYgGteIOED9UkBfYja6XMYaYAirhqby67fK1HcNUnWwXhc6QCAwWiW4rDtY3TW7a9RZP"
select @var_16 := j from t1;
# Doing partial update of length=50:
# Connection default:
select json_extract(j, '$[0]') from t1 where pkey = 1;
json_extract(j, '$[0]')
"KJyoGaAY561rrIvAZ3q84nzJdKmTiCG2VColnzKq5Lgvcb39er"
start transaction;
update t1 set j = json_set(j, '$[0]',"3wtrRpO8RSXbcT7JxAAA1gEUCL3KlcjoXcdyP04rSZQ30WMygU") where pkey = 1;
select json_extract(j, '$[0]') from t1 where pkey = 1;
json_extract(j, '$[0]')
"3wtrRpO8RSXbcT7JxAAA1gEUCL3KlcjoXcdyP04rSZQ30WMygU"
commit;
# Connection con17:
start transaction;
select json_extract(j, '$[0]') from t1 where pkey = 1;
json_extract(j, '$[0]')
"3wtrRpO8RSXbcT7JxAAA1gEUCL3KlcjoXcdyP04rSZQ30WMygU"
select json_extract(j, '$[1541]') from t1 where pkey = 1;
json_extract(j, '$[1541]')
"HgfGzIYjjGtzGO95Aw2Sl7nP0Ny4WcvnGY1DoauXooU5Ce8KYAmHFYgGteIOED9UkBfYja6XMYaYAirhqby67fK1HcNUnWwXhc6QCAwWiW4rDtY3TW7a9RZP"
select @var_17 := j from t1;
# Doing partial update of length=120:
# Connection default:
select json_extract(j, '$[1541]') from t1 where pkey = 1;
json_extract(j, '$[1541]')
"HgfGzIYjjGtzGO95Aw2Sl7nP0Ny4WcvnGY1DoauXooU5Ce8KYAmHFYgGteIOED9UkBfYja6XMYaYAirhqby67fK1HcNUnWwXhc6QCAwWiW4rDtY3TW7a9RZP"
start transaction;
update t1 set j = json_set(j, '$[1541]',"6h8KAIeDcNnJ9KtnGJlJ8BsYEt4Ypi0vO8EYRsj3FWLMrE95VsOd4HAI8CrxtrqHy4nPuUQ70lUpydvTWH5aYFqePfZIXQXTUIsPmIWn20aycVR6lUgJhUw7") where pkey = 1;
select json_extract(j, '$[1541]') from t1 where pkey = 1;
json_extract(j, '$[1541]')
"6h8KAIeDcNnJ9KtnGJlJ8BsYEt4Ypi0vO8EYRsj3FWLMrE95VsOd4HAI8CrxtrqHy4nPuUQ70lUpydvTWH5aYFqePfZIXQXTUIsPmIWn20aycVR6lUgJhUw7"
commit;
# Connection con18:
start transaction;
select json_extract(j, '$[0]') from t1 where pkey = 1;
json_extract(j, '$[0]')
"3wtrRpO8RSXbcT7JxAAA1gEUCL3KlcjoXcdyP04rSZQ30WMygU"
select json_extract(j, '$[1541]') from t1 where pkey = 1;
json_extract(j, '$[1541]')
"6h8KAIeDcNnJ9KtnGJlJ8BsYEt4Ypi0vO8EYRsj3FWLMrE95VsOd4HAI8CrxtrqHy4nPuUQ70lUpydvTWH5aYFqePfZIXQXTUIsPmIWn20aycVR6lUgJhUw7"
select @var_18 := j from t1;
# Doing partial update of length=50:
# Connection default:
select json_extract(j, '$[0]') from t1 where pkey = 1;
json_extract(j, '$[0]')
"3wtrRpO8RSXbcT7JxAAA1gEUCL3KlcjoXcdyP04rSZQ30WMygU"
start transaction;
update t1 set j = json_set(j, '$[0]',"AVNfvv8QB0pyGJjGKHEwle2W8gpq8jvIFIxAB3YL1NJIf0WzHl") where pkey = 1;
select json_extract(j, '$[0]') from t1 where pkey = 1;
json_extract(j, '$[0]')
"AVNfvv8QB0pyGJjGKHEwle2W8gpq8jvIFIxAB3YL1NJIf0WzHl"
commit;
# Connection con19:
start transaction;
select json_extract(j, '$[0]') from t1 where pkey = 1;
json_extract(j, '$[0]')
"AVNfvv8QB0pyGJjGKHEwle2W8gpq8jvIFIxAB3YL1NJIf0WzHl"
select json_extract(j, '$[1541]') from t1 where pkey = 1;
json_extract(j, '$[1541]')
"6h8KAIeDcNnJ9KtnGJlJ8BsYEt4Ypi0vO8EYRsj3FWLMrE95VsOd4HAI8CrxtrqHy4nPuUQ70lUpydvTWH5aYFqePfZIXQXTUIsPmIWn20aycVR6lUgJhUw7"
select @var_19 := j from t1;
# Doing partial update of length=120:
# Connection default:
select json_extract(j, '$[1541]') from t1 where pkey = 1;
json_extract(j, '$[1541]')
"6h8KAIeDcNnJ9KtnGJlJ8BsYEt4Ypi0vO8EYRsj3FWLMrE95VsOd4HAI8CrxtrqHy4nPuUQ70lUpydvTWH5aYFqePfZIXQXTUIsPmIWn20aycVR6lUgJhUw7"
start transaction;
update t1 set j = json_set(j, '$[1541]',"t2PtYVXMJf3EyIVtRgvz1wLIC0GjxWSqWph5KEPerQsnjNhA2a91WUKjSYQP4sDbhuez81d0RUnApSIp0QrXs9ELheimUwL9qz8x0kvPCgYz7qp7Eec7lqQS") where pkey = 1;
select json_extract(j, '$[1541]') from t1 where pkey = 1;
json_extract(j, '$[1541]')
"t2PtYVXMJf3EyIVtRgvz1wLIC0GjxWSqWph5KEPerQsnjNhA2a91WUKjSYQP4sDbhuez81d0RUnApSIp0QrXs9ELheimUwL9qz8x0kvPCgYz7qp7Eec7lqQS"
commit;
# Connection con20:
start transaction;
select json_extract(j, '$[0]') from t1 where pkey = 1;
json_extract(j, '$[0]')
"AVNfvv8QB0pyGJjGKHEwle2W8gpq8jvIFIxAB3YL1NJIf0WzHl"
select json_extract(j, '$[1541]') from t1 where pkey = 1;
json_extract(j, '$[1541]')
"t2PtYVXMJf3EyIVtRgvz1wLIC0GjxWSqWph5KEPerQsnjNhA2a91WUKjSYQP4sDbhuez81d0RUnApSIp0QrXs9ELheimUwL9qz8x0kvPCgYz7qp7Eec7lqQS"
select @var_20 := j from t1;
# Doing partial update of length=50:
# Connection default:
select json_extract(j, '$[0]') from t1 where pkey = 1;
json_extract(j, '$[0]')
"AVNfvv8QB0pyGJjGKHEwle2W8gpq8jvIFIxAB3YL1NJIf0WzHl"
start transaction;
update t1 set j = json_set(j, '$[0]',"S8Cw4X3tUAqUsju2NQ1UGoaVQCaB30eV8oQDKR6obuHRdBT0bT") where pkey = 1;
select json_extract(j, '$[0]') from t1 where pkey = 1;
json_extract(j, '$[0]')
"S8Cw4X3tUAqUsju2NQ1UGoaVQCaB30eV8oQDKR6obuHRdBT0bT"
commit;
# Connection con21:
start transaction;
select json_extract(j, '$[0]') from t1 where pkey = 1;
json_extract(j, '$[0]')
"S8Cw4X3tUAqUsju2NQ1UGoaVQCaB30eV8oQDKR6obuHRdBT0bT"
select json_extract(j, '$[1541]') from t1 where pkey = 1;
json_extract(j, '$[1541]')
"t2PtYVXMJf3EyIVtRgvz1wLIC0GjxWSqWph5KEPerQsnjNhA2a91WUKjSYQP4sDbhuez81d0RUnApSIp0QrXs9ELheimUwL9qz8x0kvPCgYz7qp7Eec7lqQS"
select @var_21 := j from t1;
# Doing partial update of length=120:
# Connection default:
select json_extract(j, '$[1541]') from t1 where pkey = 1;
json_extract(j, '$[1541]')
"t2PtYVXMJf3EyIVtRgvz1wLIC0GjxWSqWph5KEPerQsnjNhA2a91WUKjSYQP4sDbhuez81d0RUnApSIp0QrXs9ELheimUwL9qz8x0kvPCgYz7qp7Eec7lqQS"
start transaction;
update t1 set j = json_set(j, '$[1541]',"TpH3IgFsrGsTk1I8CcZGO9Afalo2jNVADmDVSRMIhElPD1XPb5f0EnfmWUoErJO24aWU1smg4W6IVdh7gL5u6kfdCTr4lF4pnaHoS2TXYZn3AS8rnDjsyOV8") where pkey = 1;
select json_extract(j, '$[1541]') from t1 where pkey = 1;
json_extract(j, '$[1541]')
"TpH3IgFsrGsTk1I8CcZGO9Afalo2jNVADmDVSRMIhElPD1XPb5f0EnfmWUoErJO24aWU1smg4W6IVdh7gL5u6kfdCTr4lF4pnaHoS2TXYZn3AS8rnDjsyOV8"
commit;
# Connection con22:
start transaction;
select json_extract(j, '$[0]') from t1 where pkey = 1;
json_extract(j, '$[0]')
"S8Cw4X3tUAqUsju2NQ1UGoaVQCaB30eV8oQDKR6obuHRdBT0bT"
select json_extract(j, '$[1541]') from t1 where pkey = 1;
json_extract(j, '$[1541]')
"TpH3IgFsrGsTk1I8CcZGO9Afalo2jNVADmDVSRMIhElPD1XPb5f0EnfmWUoErJO24aWU1smg4W6IVdh7gL5u6kfdCTr4lF4pnaHoS2TXYZn3AS8rnDjsyOV8"
select @var_22 := j from t1;
# Doing partial update of length=50:
# Connection default:
select json_extract(j, '$[0]') from t1 where pkey = 1;
json_extract(j, '$[0]')
"S8Cw4X3tUAqUsju2NQ1UGoaVQCaB30eV8oQDKR6obuHRdBT0bT"
start transaction;
update t1 set j = json_set(j, '$[0]',"qKAbXFOLpd7GfalD9YFI0L9mZqcVF5d5Poeu12FqfN4JxpU5Lh") where pkey = 1;
select json_extract(j, '$[0]') from t1 where pkey = 1;
json_extract(j, '$[0]')
"qKAbXFOLpd7GfalD9YFI0L9mZqcVF5d5Poeu12FqfN4JxpU5Lh"
commit;
# Connection con23:
start transaction;
select json_extract(j, '$[0]') from t1 where pkey = 1;
json_extract(j, '$[0]')
"qKAbXFOLpd7GfalD9YFI0L9mZqcVF5d5Poeu12FqfN4JxpU5Lh"
select json_extract(j, '$[1541]') from t1 where pkey = 1;
json_extract(j, '$[1541]')
"TpH3IgFsrGsTk1I8CcZGO9Afalo2jNVADmDVSRMIhElPD1XPb5f0EnfmWUoErJO24aWU1smg4W6IVdh7gL5u6kfdCTr4lF4pnaHoS2TXYZn3AS8rnDjsyOV8"
select @var_23 := j from t1;
# Doing partial update of length=120:
# Connection default:
select json_extract(j, '$[1541]') from t1 where pkey = 1;
json_extract(j, '$[1541]')
"TpH3IgFsrGsTk1I8CcZGO9Afalo2jNVADmDVSRMIhElPD1XPb5f0EnfmWUoErJO24aWU1smg4W6IVdh7gL5u6kfdCTr4lF4pnaHoS2TXYZn3AS8rnDjsyOV8"
start transaction;
update t1 set j = json_set(j, '$[1541]',"NK3U4cKg5XlicAUG4VGIKudOBaEfdXNyrQQv0lb5IMltUG7XjMn3EQQPyc4c9RY1pzwpiWu0qgrLuxqdJbfX15uzhyZoO8pB5k1nGtl6ZdPRYD3roiMplEnQ") where pkey = 1;
select json_extract(j, '$[1541]') from t1 where pkey = 1;
json_extract(j, '$[1541]')
"NK3U4cKg5XlicAUG4VGIKudOBaEfdXNyrQQv0lb5IMltUG7XjMn3EQQPyc4c9RY1pzwpiWu0qgrLuxqdJbfX15uzhyZoO8pB5k1nGtl6ZdPRYD3roiMplEnQ"
commit;
# Connection con24:
start transaction;
select json_extract(j, '$[0]') from t1 where pkey = 1;
json_extract(j, '$[0]')
"qKAbXFOLpd7GfalD9YFI0L9mZqcVF5d5Poeu12FqfN4JxpU5Lh"
select json_extract(j, '$[1541]') from t1 where pkey = 1;
json_extract(j, '$[1541]')
"NK3U4cKg5XlicAUG4VGIKudOBaEfdXNyrQQv0lb5IMltUG7XjMn3EQQPyc4c9RY1pzwpiWu0qgrLuxqdJbfX15uzhyZoO8pB5k1nGtl6ZdPRYD3roiMplEnQ"
select @var_24 := j from t1;
# Doing partial update of length=50:
# Connection default:
select json_extract(j, '$[0]') from t1 where pkey = 1;
json_extract(j, '$[0]')
"qKAbXFOLpd7GfalD9YFI0L9mZqcVF5d5Poeu12FqfN4JxpU5Lh"
start transaction;
update t1 set j = json_set(j, '$[0]',"AKEWQ4iVmhI2a468fWZDhc2WKMJ3a6TkPiFpkxLWedWEfcMI6u") where pkey = 1;
select json_extract(j, '$[0]') from t1 where pkey = 1;
json_extract(j, '$[0]')
"AKEWQ4iVmhI2a468fWZDhc2WKMJ3a6TkPiFpkxLWedWEfcMI6u"
commit;
# Connection con25:
start transaction;
select json_extract(j, '$[0]') from t1 where pkey = 1;
json_extract(j, '$[0]')
"AKEWQ4iVmhI2a468fWZDhc2WKMJ3a6TkPiFpkxLWedWEfcMI6u"
select json_extract(j, '$[1541]') from t1 where pkey = 1;
json_extract(j, '$[1541]')
"NK3U4cKg5XlicAUG4VGIKudOBaEfdXNyrQQv0lb5IMltUG7XjMn3EQQPyc4c9RY1pzwpiWu0qgrLuxqdJbfX15uzhyZoO8pB5k1nGtl6ZdPRYD3roiMplEnQ"
select @var_25 := j from t1;
# Doing partial update of length=120:
# Connection default:
select json_extract(j, '$[1541]') from t1 where pkey = 1;
json_extract(j, '$[1541]')
"NK3U4cKg5XlicAUG4VGIKudOBaEfdXNyrQQv0lb5IMltUG7XjMn3EQQPyc4c9RY1pzwpiWu0qgrLuxqdJbfX15uzhyZoO8pB5k1nGtl6ZdPRYD3roiMplEnQ"
start transaction;
update t1 set j = json_set(j, '$[1541]',"ToWTIppbsNgM652LumIFGurm6UMTlTNEFrgXgV8XrmrxrtGkdWxrQmdWHzx0QIEfAuCoOJJD5AAv1OfcsaTIN4me2ieSyq86jIv5ZEIfNQYOoBzglSw8VgkX") where pkey = 1;
select json_extract(j, '$[1541]') from t1 where pkey = 1;
json_extract(j, '$[1541]')
"ToWTIppbsNgM652LumIFGurm6UMTlTNEFrgXgV8XrmrxrtGkdWxrQmdWHzx0QIEfAuCoOJJD5AAv1OfcsaTIN4me2ieSyq86jIv5ZEIfNQYOoBzglSw8VgkX"
commit;
# Connection con26:
start transaction;
select json_extract(j, '$[0]') from t1 where pkey = 1;
json_extract(j, '$[0]')
"AKEWQ4iVmhI2a468fWZDhc2WKMJ3a6TkPiFpkxLWedWEfcMI6u"
select json_extract(j, '$[1541]') from t1 where pkey = 1;
json_extract(j, '$[1541]')
"ToWTIppbsNgM652LumIFGurm6UMTlTNEFrgXgV8XrmrxrtGkdWxrQmdWHzx0QIEfAuCoOJJD5AAv1OfcsaTIN4me2ieSyq86jIv5ZEIfNQYOoBzglSw8VgkX"
select @var_26 := j from t1;
# Doing partial update of length=50:
# Connection default:
select json_extract(j, '$[0]') from t1 where pkey = 1;
json_extract(j, '$[0]')
"AKEWQ4iVmhI2a468fWZDhc2WKMJ3a6TkPiFpkxLWedWEfcMI6u"
start transaction;
update t1 set j = json_set(j, '$[0]',"OMzND5TuMMzvZHYwh6ITFF91g37Bjsi6CfRNjsH5FE0mVXgAby") where pkey = 1;
select json_extract(j, '$[0]') from t1 where pkey = 1;
json_extract(j, '$[0]')
"OMzND5TuMMzvZHYwh6ITFF91g37Bjsi6CfRNjsH5FE0mVXgAby"
commit;
# Connection con27:
start transaction;
select json_extract(j, '$[0]') from t1 where pkey = 1;
json_extract(j, '$[0]')
"OMzND5TuMMzvZHYwh6ITFF91g37Bjsi6CfRNjsH5FE0mVXgAby"
select json_extract(j, '$[1541]') from t1 where pkey = 1;
json_extract(j, '$[1541]')
"ToWTIppbsNgM652LumIFGurm6UMTlTNEFrgXgV8XrmrxrtGkdWxrQmdWHzx0QIEfAuCoOJJD5AAv1OfcsaTIN4me2ieSyq86jIv5ZEIfNQYOoBzglSw8VgkX"
select @var_27 := j from t1;
# Doing partial update of length=120:
# Connection default:
select json_extract(j, '$[1541]') from t1 where pkey = 1;
json_extract(j, '$[1541]')
"ToWTIppbsNgM652LumIFGurm6UMTlTNEFrgXgV8XrmrxrtGkdWxrQmdWHzx0QIEfAuCoOJJD5AAv1OfcsaTIN4me2ieSyq86jIv5ZEIfNQYOoBzglSw8VgkX"
start transaction;
update t1 set j = json_set(j, '$[1541]',"brCkqslx3VnjZyO0L5sbA5p9rJgXRFU36gluWXsZ0dIZbeXviNWsTJzKcdq4tI7xwssSNi1NLHuvtRobpKSGdPYE3OIueNraDj2bR1wlIreAGSj5kBLLbuZc") where pkey = 1;
select json_extract(j, '$[1541]') from t1 where pkey = 1;
json_extract(j, '$[1541]')
"brCkqslx3VnjZyO0L5sbA5p9rJgXRFU36gluWXsZ0dIZbeXviNWsTJzKcdq4tI7xwssSNi1NLHuvtRobpKSGdPYE3OIueNraDj2bR1wlIreAGSj5kBLLbuZc"
commit;
# Connection con28:
start transaction;
select json_extract(j, '$[0]') from t1 where pkey = 1;
json_extract(j, '$[0]')
"OMzND5TuMMzvZHYwh6ITFF91g37Bjsi6CfRNjsH5FE0mVXgAby"
select json_extract(j, '$[1541]') from t1 where pkey = 1;
json_extract(j, '$[1541]')
"brCkqslx3VnjZyO0L5sbA5p9rJgXRFU36gluWXsZ0dIZbeXviNWsTJzKcdq4tI7xwssSNi1NLHuvtRobpKSGdPYE3OIueNraDj2bR1wlIreAGSj5kBLLbuZc"
select @var_28 := j from t1;
# Doing partial update of length=50:
# Connection default:
select json_extract(j, '$[0]') from t1 where pkey = 1;
json_extract(j, '$[0]')
"OMzND5TuMMzvZHYwh6ITFF91g37Bjsi6CfRNjsH5FE0mVXgAby"
start transaction;
update t1 set j = json_set(j, '$[0]',"GpWvCLVO5WzUXvFokry1Jh43rOPQIw2WmWPyrvKuPJPwDckvUi") where pkey = 1;
select json_extract(j, '$[0]') from t1 where pkey = 1;
json_extract(j, '$[0]')
"GpWvCLVO5WzUXvFokry1Jh43rOPQIw2WmWPyrvKuPJPwDckvUi"
commit;
# Connection con29:
start transaction;
select json_extract(j, '$[0]') from t1 where pkey = 1;
json_extract(j, '$[0]')
"GpWvCLVO5WzUXvFokry1Jh43rOPQIw2WmWPyrvKuPJPwDckvUi"
select json_extract(j, '$[1541]') from t1 where pkey = 1;
json_extract(j, '$[1541]')
"brCkqslx3VnjZyO0L5sbA5p9rJgXRFU36gluWXsZ0dIZbeXviNWsTJzKcdq4tI7xwssSNi1NLHuvtRobpKSGdPYE3OIueNraDj2bR1wlIreAGSj5kBLLbuZc"
select @var_29 := j from t1;
# Doing partial update of length=120:
# Connection default:
select json_extract(j, '$[1541]') from t1 where pkey = 1;
json_extract(j, '$[1541]')
"brCkqslx3VnjZyO0L5sbA5p9rJgXRFU36gluWXsZ0dIZbeXviNWsTJzKcdq4tI7xwssSNi1NLHuvtRobpKSGdPYE3OIueNraDj2bR1wlIreAGSj5kBLLbuZc"
start transaction;
update t1 set j = json_set(j, '$[1541]',"wlO1nFPAff6h9qBZn0S7vrRIncsYXMES6cRrpq1UT59cwKBjLbqESFWGrOmNjypnZGeO4ftVi07eJHNcsEqJTKXJgJeNFTAohoDlR4GA4LoNaAzRMnkp7H6m") where pkey = 1;
select json_extract(j, '$[1541]') from t1 where pkey = 1;
json_extract(j, '$[1541]')
"wlO1nFPAff6h9qBZn0S7vrRIncsYXMES6cRrpq1UT59cwKBjLbqESFWGrOmNjypnZGeO4ftVi07eJHNcsEqJTKXJgJeNFTAohoDlR4GA4LoNaAzRMnkp7H6m"
commit;
# Connection con30:
start transaction;
select json_extract(j, '$[0]') from t1 where pkey = 1;
json_extract(j, '$[0]')
"GpWvCLVO5WzUXvFokry1Jh43rOPQIw2WmWPyrvKuPJPwDckvUi"
select json_extract(j, '$[1541]') from t1 where pkey = 1;
json_extract(j, '$[1541]')
"wlO1nFPAff6h9qBZn0S7vrRIncsYXMES6cRrpq1UT59cwKBjLbqESFWGrOmNjypnZGeO4ftVi07eJHNcsEqJTKXJgJeNFTAohoDlR4GA4LoNaAzRMnkp7H6m"
select @var_30 := j from t1;
# Doing partial update of length=50:
# Connection default:
select json_extract(j, '$[0]') from t1 where pkey = 1;
json_extract(j, '$[0]')
"GpWvCLVO5WzUXvFokry1Jh43rOPQIw2WmWPyrvKuPJPwDckvUi"
start transaction;
update t1 set j = json_set(j, '$[0]',"Yk9nBKas6nbWpper9SDjaAAwyuk39qphZzTkH3bNoCtb0XS9yf") where pkey = 1;
select json_extract(j, '$[0]') from t1 where pkey = 1;
json_extract(j, '$[0]')
"Yk9nBKas6nbWpper9SDjaAAwyuk39qphZzTkH3bNoCtb0XS9yf"
commit;
# Connection con31:
start transaction;
select json_extract(j, '$[0]') from t1 where pkey = 1;
json_extract(j, '$[0]')
"Yk9nBKas6nbWpper9SDjaAAwyuk39qphZzTkH3bNoCtb0XS9yf"
select json_extract(j, '$[1541]') from t1 where pkey = 1;
json_extract(j, '$[1541]')
"wlO1nFPAff6h9qBZn0S7vrRIncsYXMES6cRrpq1UT59cwKBjLbqESFWGrOmNjypnZGeO4ftVi07eJHNcsEqJTKXJgJeNFTAohoDlR4GA4LoNaAzRMnkp7H6m"
select @var_31 := j from t1;
# Doing partial update of length=120:
# Connection default:
select json_extract(j, '$[1541]') from t1 where pkey = 1;
json_extract(j, '$[1541]')
"wlO1nFPAff6h9qBZn0S7vrRIncsYXMES6cRrpq1UT59cwKBjLbqESFWGrOmNjypnZGeO4ftVi07eJHNcsEqJTKXJgJeNFTAohoDlR4GA4LoNaAzRMnkp7H6m"
start transaction;
update t1 set j = json_set(j, '$[1541]',"sWq1TmvBp5zfkYcDHtEsG228d0d69Zj06Z1XLui9zhmiEOvVHANVANbmODqVmZVq7UNQP3ZMlL4zhySy6nSGA30WEq21OVpV0BtNERjxkmuSkKOq7q4Gs3k4") where pkey = 1;
select json_extract(j, '$[1541]') from t1 where pkey = 1;
json_extract(j, '$[1541]')
"sWq1TmvBp5zfkYcDHtEsG228d0d69Zj06Z1XLui9zhmiEOvVHANVANbmODqVmZVq7UNQP3ZMlL4zhySy6nSGA30WEq21OVpV0BtNERjxkmuSkKOq7q4Gs3k4"
commit;
# Connection con32:
start transaction;
select json_extract(j, '$[0]') from t1 where pkey = 1;
json_extract(j, '$[0]')
"Yk9nBKas6nbWpper9SDjaAAwyuk39qphZzTkH3bNoCtb0XS9yf"
select json_extract(j, '$[1541]') from t1 where pkey = 1;
json_extract(j, '$[1541]')
"sWq1TmvBp5zfkYcDHtEsG228d0d69Zj06Z1XLui9zhmiEOvVHANVANbmODqVmZVq7UNQP3ZMlL4zhySy6nSGA30WEq21OVpV0BtNERjxkmuSkKOq7q4Gs3k4"
select @var_32 := j from t1;
# Doing partial update of length=50:
# Connection default:
select json_extract(j, '$[0]') from t1 where pkey = 1;
json_extract(j, '$[0]')
"Yk9nBKas6nbWpper9SDjaAAwyuk39qphZzTkH3bNoCtb0XS9yf"
start transaction;
update t1 set j = json_set(j, '$[0]',"tk3FGtiE2cbE1IAl42DmNaaUOdiEgTJXDMnRFVfH5EU6VesXg3") where pkey = 1;
select json_extract(j, '$[0]') from t1 where pkey = 1;
json_extract(j, '$[0]')
"tk3FGtiE2cbE1IAl42DmNaaUOdiEgTJXDMnRFVfH5EU6VesXg3"
commit;
# Connection con33:
start transaction;
select json_extract(j, '$[0]') from t1 where pkey = 1;
json_extract(j, '$[0]')
"tk3FGtiE2cbE1IAl42DmNaaUOdiEgTJXDMnRFVfH5EU6VesXg3"
select json_extract(j, '$[1541]') from t1 where pkey = 1;
json_extract(j, '$[1541]')
"sWq1TmvBp5zfkYcDHtEsG228d0d69Zj06Z1XLui9zhmiEOvVHANVANbmODqVmZVq7UNQP3ZMlL4zhySy6nSGA30WEq21OVpV0BtNERjxkmuSkKOq7q4Gs3k4"
select @var_33 := j from t1;
# Doing partial update of length=120:
# Connection default:
select json_extract(j, '$[1541]') from t1 where pkey = 1;
json_extract(j, '$[1541]')
"sWq1TmvBp5zfkYcDHtEsG228d0d69Zj06Z1XLui9zhmiEOvVHANVANbmODqVmZVq7UNQP3ZMlL4zhySy6nSGA30WEq21OVpV0BtNERjxkmuSkKOq7q4Gs3k4"
start transaction;
update t1 set j = json_set(j, '$[1541]',"K3bsW0VEE9fVhtsSK5vyL1Ap7fTxB9zTDaLhYpvlwbGdS83kEzgZ0rM5Up1dy069YQq7FksBJ6nlFqTRnAynzKrR9s35q9DOZ1TmlJw2QjlfXF4LN26KKxjR") where pkey = 1;
select json_extract(j, '$[1541]') from t1 where pkey = 1;
json_extract(j, '$[1541]')
"K3bsW0VEE9fVhtsSK5vyL1Ap7fTxB9zTDaLhYpvlwbGdS83kEzgZ0rM5Up1dy069YQq7FksBJ6nlFqTRnAynzKrR9s35q9DOZ1TmlJw2QjlfXF4LN26KKxjR"
commit;
# Connection con34:
start transaction;
select json_extract(j, '$[0]') from t1 where pkey = 1;
json_extract(j, '$[0]')
"tk3FGtiE2cbE1IAl42DmNaaUOdiEgTJXDMnRFVfH5EU6VesXg3"
select json_extract(j, '$[1541]') from t1 where pkey = 1;
json_extract(j, '$[1541]')
"K3bsW0VEE9fVhtsSK5vyL1Ap7fTxB9zTDaLhYpvlwbGdS83kEzgZ0rM5Up1dy069YQq7FksBJ6nlFqTRnAynzKrR9s35q9DOZ1TmlJw2QjlfXF4LN26KKxjR"
select @var_34 := j from t1;
# Doing partial update of length=50:
# Connection default:
select json_extract(j, '$[0]') from t1 where pkey = 1;
json_extract(j, '$[0]')
"tk3FGtiE2cbE1IAl42DmNaaUOdiEgTJXDMnRFVfH5EU6VesXg3"
start transaction;
update t1 set j = json_set(j, '$[0]',"nmWdwh0TjTGSnCVDtGqQTsjquoAEjufXe98ap82WcIyNSRYJgM") where pkey = 1;
select json_extract(j, '$[0]') from t1 where pkey = 1;
json_extract(j, '$[0]')
"nmWdwh0TjTGSnCVDtGqQTsjquoAEjufXe98ap82WcIyNSRYJgM"
commit;
# Connection con35:
start transaction;
select json_extract(j, '$[0]') from t1 where pkey = 1;
json_extract(j, '$[0]')
"nmWdwh0TjTGSnCVDtGqQTsjquoAEjufXe98ap82WcIyNSRYJgM"
select json_extract(j, '$[1541]') from t1 where pkey = 1;
json_extract(j, '$[1541]')
"K3bsW0VEE9fVhtsSK5vyL1Ap7fTxB9zTDaLhYpvlwbGdS83kEzgZ0rM5Up1dy069YQq7FksBJ6nlFqTRnAynzKrR9s35q9DOZ1TmlJw2QjlfXF4LN26KKxjR"
select @var_35 := j from t1;
# Doing partial update of length=120:
# Connection default:
select json_extract(j, '$[1541]') from t1 where pkey = 1;
json_extract(j, '$[1541]')
"K3bsW0VEE9fVhtsSK5vyL1Ap7fTxB9zTDaLhYpvlwbGdS83kEzgZ0rM5Up1dy069YQq7FksBJ6nlFqTRnAynzKrR9s35q9DOZ1TmlJw2QjlfXF4LN26KKxjR"
start transaction;
update t1 set j = json_set(j, '$[1541]',"h9ERy8D6KwyxRd4aBtiDPITMdtnBCTXublJZrWd9Qc6sFBSO28cSP5o2xZE91j1aTK7KokUFMY7ZjXymdYC2by3YXHiWyj6R2DmqyE5ImAsUfoEJMQJxOMWt") where pkey = 1;
select json_extract(j, '$[1541]') from t1 where pkey = 1;
json_extract(j, '$[1541]')
"h9ERy8D6KwyxRd4aBtiDPITMdtnBCTXublJZrWd9Qc6sFBSO28cSP5o2xZE91j1aTK7KokUFMY7ZjXymdYC2by3YXHiWyj6R2DmqyE5ImAsUfoEJMQJxOMWt"
commit;
# Connection con36:
start transaction;
select json_extract(j, '$[0]') from t1 where pkey = 1;
json_extract(j, '$[0]')
"nmWdwh0TjTGSnCVDtGqQTsjquoAEjufXe98ap82WcIyNSRYJgM"
select json_extract(j, '$[1541]') from t1 where pkey = 1;
json_extract(j, '$[1541]')
"h9ERy8D6KwyxRd4aBtiDPITMdtnBCTXublJZrWd9Qc6sFBSO28cSP5o2xZE91j1aTK7KokUFMY7ZjXymdYC2by3YXHiWyj6R2DmqyE5ImAsUfoEJMQJxOMWt"
select @var_36 := j from t1;
# Doing partial update of length=50:
# Connection default:
select json_extract(j, '$[0]') from t1 where pkey = 1;
json_extract(j, '$[0]')
"nmWdwh0TjTGSnCVDtGqQTsjquoAEjufXe98ap82WcIyNSRYJgM"
start transaction;
update t1 set j = json_set(j, '$[0]',"bCQatW1vklmgzpykyoEdcQuwoEsAaM3CYRkRyjLgV5MSsICq7O") where pkey = 1;
select json_extract(j, '$[0]') from t1 where pkey = 1;
json_extract(j, '$[0]')
"bCQatW1vklmgzpykyoEdcQuwoEsAaM3CYRkRyjLgV5MSsICq7O"
commit;
# Connection con37:
start transaction;
select json_extract(j, '$[0]') from t1 where pkey = 1;
json_extract(j, '$[0]')
"bCQatW1vklmgzpykyoEdcQuwoEsAaM3CYRkRyjLgV5MSsICq7O"
select json_extract(j, '$[1541]') from t1 where pkey = 1;
json_extract(j, '$[1541]')
"h9ERy8D6KwyxRd4aBtiDPITMdtnBCTXublJZrWd9Qc6sFBSO28cSP5o2xZE91j1aTK7KokUFMY7ZjXymdYC2by3YXHiWyj6R2DmqyE5ImAsUfoEJMQJxOMWt"
select @var_37 := j from t1;
# Doing partial update of length=120:
# Connection default:
select json_extract(j, '$[1541]') from t1 where pkey = 1;
json_extract(j, '$[1541]')
"h9ERy8D6KwyxRd4aBtiDPITMdtnBCTXublJZrWd9Qc6sFBSO28cSP5o2xZE91j1aTK7KokUFMY7ZjXymdYC2by3YXHiWyj6R2DmqyE5ImAsUfoEJMQJxOMWt"
start transaction;
update t1 set j = json_set(j, '$[1541]',"ShmMeaYUk7qmHOD1n9k6pFB9g4SqsXFKEzfqaDKKKA6bWKaIRLOHYaOEcq3UNGnaFSQpdl8wtCVQU6iwP6Dveb8GQBjlRWLgwmUZVcTOozmJ3UFQZQJD1RSP") where pkey = 1;
select json_extract(j, '$[1541]') from t1 where pkey = 1;
json_extract(j, '$[1541]')
"ShmMeaYUk7qmHOD1n9k6pFB9g4SqsXFKEzfqaDKKKA6bWKaIRLOHYaOEcq3UNGnaFSQpdl8wtCVQU6iwP6Dveb8GQBjlRWLgwmUZVcTOozmJ3UFQZQJD1RSP"
commit;
# Connection con38:
start transaction;
select json_extract(j, '$[0]') from t1 where pkey = 1;
json_extract(j, '$[0]')
"bCQatW1vklmgzpykyoEdcQuwoEsAaM3CYRkRyjLgV5MSsICq7O"
select json_extract(j, '$[1541]') from t1 where pkey = 1;
json_extract(j, '$[1541]')
"ShmMeaYUk7qmHOD1n9k6pFB9g4SqsXFKEzfqaDKKKA6bWKaIRLOHYaOEcq3UNGnaFSQpdl8wtCVQU6iwP6Dveb8GQBjlRWLgwmUZVcTOozmJ3UFQZQJD1RSP"
select @var_38 := j from t1;
# Doing partial update of length=50:
# Connection default:
select json_extract(j, '$[0]') from t1 where pkey = 1;
json_extract(j, '$[0]')
"bCQatW1vklmgzpykyoEdcQuwoEsAaM3CYRkRyjLgV5MSsICq7O"
start transaction;
update t1 set j = json_set(j, '$[0]',"aBB1hUgdGAAjke6YbspcN40wUJ7UlZrJk2LPXz2l9DTtpZPORF") where pkey = 1;
select json_extract(j, '$[0]') from t1 where pkey = 1;
json_extract(j, '$[0]')
"aBB1hUgdGAAjke6YbspcN40wUJ7UlZrJk2LPXz2l9DTtpZPORF"
commit;
# Connection con39:
start transaction;
select json_extract(j, '$[0]') from t1 where pkey = 1;
json_extract(j, '$[0]')
"aBB1hUgdGAAjke6YbspcN40wUJ7UlZrJk2LPXz2l9DTtpZPORF"
select json_extract(j, '$[1541]') from t1 where pkey = 1;
json_extract(j, '$[1541]')
"ShmMeaYUk7qmHOD1n9k6pFB9g4SqsXFKEzfqaDKKKA6bWKaIRLOHYaOEcq3UNGnaFSQpdl8wtCVQU6iwP6Dveb8GQBjlRWLgwmUZVcTOozmJ3UFQZQJD1RSP"
select @var_39 := j from t1;
# Doing partial update of length=120:
# Connection default:
select json_extract(j, '$[1541]') from t1 where pkey = 1;
json_extract(j, '$[1541]')
"ShmMeaYUk7qmHOD1n9k6pFB9g4SqsXFKEzfqaDKKKA6bWKaIRLOHYaOEcq3UNGnaFSQpdl8wtCVQU6iwP6Dveb8GQBjlRWLgwmUZVcTOozmJ3UFQZQJD1RSP"
start transaction;
update t1 set j = json_set(j, '$[1541]',"0oH0ikJoE2N5M66fVbeWKlhncWM1uoEsaWsHG95SAQVUUZ9yAlUTWBG8fb7ZPKPxqFC4OFWWgz08Z76hsaAMjPSO0axPsKKiZXkwmESQDRXkYdSPCalvzEKz") where pkey = 1;
select json_extract(j, '$[1541]') from t1 where pkey = 1;
json_extract(j, '$[1541]')
"0oH0ikJoE2N5M66fVbeWKlhncWM1uoEsaWsHG95SAQVUUZ9yAlUTWBG8fb7ZPKPxqFC4OFWWgz08Z76hsaAMjPSO0axPsKKiZXkwmESQDRXkYdSPCalvzEKz"
commit;
# Connection con40:
start transaction;
select json_extract(j, '$[0]') from t1 where pkey = 1;
json_extract(j, '$[0]')
"aBB1hUgdGAAjke6YbspcN40wUJ7UlZrJk2LPXz2l9DTtpZPORF"
select json_extract(j, '$[1541]') from t1 where pkey = 1;
json_extract(j, '$[1541]')
"0oH0ikJoE2N5M66fVbeWKlhncWM1uoEsaWsHG95SAQVUUZ9yAlUTWBG8fb7ZPKPxqFC4OFWWgz08Z76hsaAMjPSO0axPsKKiZXkwmESQDRXkYdSPCalvzEKz"
select @var_40 := j from t1;
# Doing partial update of length=50:
# Connection default:
select json_extract(j, '$[0]') from t1 where pkey = 1;
json_extract(j, '$[0]')
"aBB1hUgdGAAjke6YbspcN40wUJ7UlZrJk2LPXz2l9DTtpZPORF"
start transaction;
update t1 set j = json_set(j, '$[0]',"mFMeafK9C45wGWLTvsCTVcshCcdCov9YAWCi9UsLWvFmPaDKSP") where pkey = 1;
select json_extract(j, '$[0]') from t1 where pkey = 1;
json_extract(j, '$[0]')
"mFMeafK9C45wGWLTvsCTVcshCcdCov9YAWCi9UsLWvFmPaDKSP"
commit;
# Connection con41:
start transaction;
select json_extract(j, '$[0]') from t1 where pkey = 1;
json_extract(j, '$[0]')
"mFMeafK9C45wGWLTvsCTVcshCcdCov9YAWCi9UsLWvFmPaDKSP"
select json_extract(j, '$[1541]') from t1 where pkey = 1;
json_extract(j, '$[1541]')
"0oH0ikJoE2N5M66fVbeWKlhncWM1uoEsaWsHG95SAQVUUZ9yAlUTWBG8fb7ZPKPxqFC4OFWWgz08Z76hsaAMjPSO0axPsKKiZXkwmESQDRXkYdSPCalvzEKz"
select @var_41 := j from t1;
# Doing partial update of length=120:
# Connection default:
select json_extract(j, '$[1541]') from t1 where pkey = 1;
json_extract(j, '$[1541]')
"0oH0ikJoE2N5M66fVbeWKlhncWM1uoEsaWsHG95SAQVUUZ9yAlUTWBG8fb7ZPKPxqFC4OFWWgz08Z76hsaAMjPSO0axPsKKiZXkwmESQDRXkYdSPCalvzEKz"
start transaction;
update t1 set j = json_set(j, '$[1541]',"mw1cdCEEO27VYIzk08CqRgkhS9HeUi3Ee3qFF5Sb5X6ep4MoCXceDMJeUaIyGJAsK06Z3WA93FlrJ5fTcH7ocQS6zi2DzC6KCAtGg2NjF6aWBDzmT5a5T09Q") where pkey = 1;
select json_extract(j, '$[1541]') from t1 where pkey = 1;
json_extract(j, '$[1541]')
"mw1cdCEEO27VYIzk08CqRgkhS9HeUi3Ee3qFF5Sb5X6ep4MoCXceDMJeUaIyGJAsK06Z3WA93FlrJ5fTcH7ocQS6zi2DzC6KCAtGg2NjF6aWBDzmT5a5T09Q"
commit;
# Connection con42:
start transaction;
select json_extract(j, '$[0]') from t1 where pkey = 1;
json_extract(j, '$[0]')
"mFMeafK9C45wGWLTvsCTVcshCcdCov9YAWCi9UsLWvFmPaDKSP"
select json_extract(j, '$[1541]') from t1 where pkey = 1;
json_extract(j, '$[1541]')
"mw1cdCEEO27VYIzk08CqRgkhS9HeUi3Ee3qFF5Sb5X6ep4MoCXceDMJeUaIyGJAsK06Z3WA93FlrJ5fTcH7ocQS6zi2DzC6KCAtGg2NjF6aWBDzmT5a5T09Q"
select @var_42 := j from t1;
# Doing partial update of length=50:
# Connection default:
select json_extract(j, '$[0]') from t1 where pkey = 1;
json_extract(j, '$[0]')
"mFMeafK9C45wGWLTvsCTVcshCcdCov9YAWCi9UsLWvFmPaDKSP"
start transaction;
update t1 set j = json_set(j, '$[0]',"gBefLizXqrlWt6D6CocOzZASeiV6gcWMn816o1ceqNAjUOngAN") where pkey = 1;
select json_extract(j, '$[0]') from t1 where pkey = 1;
json_extract(j, '$[0]')
"gBefLizXqrlWt6D6CocOzZASeiV6gcWMn816o1ceqNAjUOngAN"
commit;
# Connection con43:
start transaction;
select json_extract(j, '$[0]') from t1 where pkey = 1;
json_extract(j, '$[0]')
"gBefLizXqrlWt6D6CocOzZASeiV6gcWMn816o1ceqNAjUOngAN"
select json_extract(j, '$[1541]') from t1 where pkey = 1;
json_extract(j, '$[1541]')
"mw1cdCEEO27VYIzk08CqRgkhS9HeUi3Ee3qFF5Sb5X6ep4MoCXceDMJeUaIyGJAsK06Z3WA93FlrJ5fTcH7ocQS6zi2DzC6KCAtGg2NjF6aWBDzmT5a5T09Q"
select @var_43 := j from t1;
# Doing partial update of length=120:
# Connection default:
select json_extract(j, '$[1541]') from t1 where pkey = 1;
json_extract(j, '$[1541]')
"mw1cdCEEO27VYIzk08CqRgkhS9HeUi3Ee3qFF5Sb5X6ep4MoCXceDMJeUaIyGJAsK06Z3WA93FlrJ5fTcH7ocQS6zi2DzC6KCAtGg2NjF6aWBDzmT5a5T09Q"
start transaction;
update t1 set j = json_set(j, '$[1541]',"27wAYZs3fYe9sPIuW6t8ljVtQxFDcPaeVUp33f4gCiq486yeCpkvYDpyB29nQhPvCCyDs2u4ji6ro5TysBsROfNZhXK7Ci2Ouyak1SmiAtXwwyso9kDXNb55") where pkey = 1;
select json_extract(j, '$[1541]') from t1 where pkey = 1;
json_extract(j, '$[1541]')
"27wAYZs3fYe9sPIuW6t8ljVtQxFDcPaeVUp33f4gCiq486yeCpkvYDpyB29nQhPvCCyDs2u4ji6ro5TysBsROfNZhXK7Ci2Ouyak1SmiAtXwwyso9kDXNb55"
commit;
# Connection con44:
start transaction;
select json_extract(j, '$[0]') from t1 where pkey = 1;
json_extract(j, '$[0]')
"gBefLizXqrlWt6D6CocOzZASeiV6gcWMn816o1ceqNAjUOngAN"
select json_extract(j, '$[1541]') from t1 where pkey = 1;
json_extract(j, '$[1541]')
"27wAYZs3fYe9sPIuW6t8ljVtQxFDcPaeVUp33f4gCiq486yeCpkvYDpyB29nQhPvCCyDs2u4ji6ro5TysBsROfNZhXK7Ci2Ouyak1SmiAtXwwyso9kDXNb55"
select @var_44 := j from t1;
# Doing partial update of length=50:
# Connection default:
select json_extract(j, '$[0]') from t1 where pkey = 1;
json_extract(j, '$[0]')
"gBefLizXqrlWt6D6CocOzZASeiV6gcWMn816o1ceqNAjUOngAN"
start transaction;
update t1 set j = json_set(j, '$[0]',"6NAI5DhyBFgAhTqpMNlGLb4UKI0hr5kxQvFU6uSH98QqZGfvcO") where pkey = 1;
select json_extract(j, '$[0]') from t1 where pkey = 1;
json_extract(j, '$[0]')
"6NAI5DhyBFgAhTqpMNlGLb4UKI0hr5kxQvFU6uSH98QqZGfvcO"
commit;
# Connection con45:
start transaction;
select json_extract(j, '$[0]') from t1 where pkey = 1;
json_extract(j, '$[0]')
"6NAI5DhyBFgAhTqpMNlGLb4UKI0hr5kxQvFU6uSH98QqZGfvcO"
select json_extract(j, '$[1541]') from t1 where pkey = 1;
json_extract(j, '$[1541]')
"27wAYZs3fYe9sPIuW6t8ljVtQxFDcPaeVUp33f4gCiq486yeCpkvYDpyB29nQhPvCCyDs2u4ji6ro5TysBsROfNZhXK7Ci2Ouyak1SmiAtXwwyso9kDXNb55"
select @var_45 := j from t1;
# Doing partial update of length=120:
# Connection default:
select json_extract(j, '$[1541]') from t1 where pkey = 1;
json_extract(j, '$[1541]')
"27wAYZs3fYe9sPIuW6t8ljVtQxFDcPaeVUp33f4gCiq486yeCpkvYDpyB29nQhPvCCyDs2u4ji6ro5TysBsROfNZhXK7Ci2Ouyak1SmiAtXwwyso9kDXNb55"
start transaction;
update t1 set j = json_set(j, '$[1541]',"BxyEQIUQxLTiItbXNhQpwZwKOVb3PBQY8OmYeEwbZPHpJsLgXlUUKOogtNiGY8pfUZB8o8hLXzBopWVNFxpXLbEExwTT4I8WrIedQJxvG8i6cDRr8EOTpcfk") where pkey = 1;
select json_extract(j, '$[1541]') from t1 where pkey = 1;
json_extract(j, '$[1541]')
"BxyEQIUQxLTiItbXNhQpwZwKOVb3PBQY8OmYeEwbZPHpJsLgXlUUKOogtNiGY8pfUZB8o8hLXzBopWVNFxpXLbEExwTT4I8WrIedQJxvG8i6cDRr8EOTpcfk"
commit;
# Connection con46:
start transaction;
select json_extract(j, '$[0]') from t1 where pkey = 1;
json_extract(j, '$[0]')
"6NAI5DhyBFgAhTqpMNlGLb4UKI0hr5kxQvFU6uSH98QqZGfvcO"
select json_extract(j, '$[1541]') from t1 where pkey = 1;
json_extract(j, '$[1541]')
"BxyEQIUQxLTiItbXNhQpwZwKOVb3PBQY8OmYeEwbZPHpJsLgXlUUKOogtNiGY8pfUZB8o8hLXzBopWVNFxpXLbEExwTT4I8WrIedQJxvG8i6cDRr8EOTpcfk"
select @var_46 := j from t1;
# Doing partial update of length=50:
# Connection default:
select json_extract(j, '$[0]') from t1 where pkey = 1;
json_extract(j, '$[0]')
"6NAI5DhyBFgAhTqpMNlGLb4UKI0hr5kxQvFU6uSH98QqZGfvcO"
start transaction;
update t1 set j = json_set(j, '$[0]',"W8EYQK4Gcgr00ouGucKWnjLvviOlI3TpChNa2Soc8gd6SVLN7d") where pkey = 1;
select json_extract(j, '$[0]') from t1 where pkey = 1;
json_extract(j, '$[0]')
"W8EYQK4Gcgr00ouGucKWnjLvviOlI3TpChNa2Soc8gd6SVLN7d"
commit;
# Connection con47:
start transaction;
select json_extract(j, '$[0]') from t1 where pkey = 1;
json_extract(j, '$[0]')
"W8EYQK4Gcgr00ouGucKWnjLvviOlI3TpChNa2Soc8gd6SVLN7d"
select json_extract(j, '$[1541]') from t1 where pkey = 1;
json_extract(j, '$[1541]')
"BxyEQIUQxLTiItbXNhQpwZwKOVb3PBQY8OmYeEwbZPHpJsLgXlUUKOogtNiGY8pfUZB8o8hLXzBopWVNFxpXLbEExwTT4I8WrIedQJxvG8i6cDRr8EOTpcfk"
select @var_47 := j from t1;
# Doing partial update of length=120:
# Connection default:
select json_extract(j, '$[1541]') from t1 where pkey = 1;
json_extract(j, '$[1541]')
"BxyEQIUQxLTiItbXNhQpwZwKOVb3PBQY8OmYeEwbZPHpJsLgXlUUKOogtNiGY8pfUZB8o8hLXzBopWVNFxpXLbEExwTT4I8WrIedQJxvG8i6cDRr8EOTpcfk"
start transaction;
update t1 set j = json_set(j, '$[1541]',"ruLDpGvBzDET0OAOxAolnwPO1srMFyx4qIHdZAoYM0zMPAkMIY53TVPSNGoaEje22ufZ4T7QU7lrFTBV0GZTjyv4FheRQHUQB9zFb5e3APsPq3uqHRJ1OC5b") where pkey = 1;
select json_extract(j, '$[1541]') from t1 where pkey = 1;
json_extract(j, '$[1541]')
"ruLDpGvBzDET0OAOxAolnwPO1srMFyx4qIHdZAoYM0zMPAkMIY53TVPSNGoaEje22ufZ4T7QU7lrFTBV0GZTjyv4FheRQHUQB9zFb5e3APsPq3uqHRJ1OC5b"
commit;
# Connection con48:
start transaction;
select json_extract(j, '$[0]') from t1 where pkey = 1;
json_extract(j, '$[0]')
"W8EYQK4Gcgr00ouGucKWnjLvviOlI3TpChNa2Soc8gd6SVLN7d"
select json_extract(j, '$[1541]') from t1 where pkey = 1;
json_extract(j, '$[1541]')
"ruLDpGvBzDET0OAOxAolnwPO1srMFyx4qIHdZAoYM0zMPAkMIY53TVPSNGoaEje22ufZ4T7QU7lrFTBV0GZTjyv4FheRQHUQB9zFb5e3APsPq3uqHRJ1OC5b"
select @var_48 := j from t1;
# Doing partial update of length=50:
# Connection default:
select json_extract(j, '$[0]') from t1 where pkey = 1;
json_extract(j, '$[0]')
"W8EYQK4Gcgr00ouGucKWnjLvviOlI3TpChNa2Soc8gd6SVLN7d"
start transaction;
update t1 set j = json_set(j, '$[0]',"ri2GzUgAceNBjzEtM6GD783MaLLyVPZN7Zb44FEetZpcZ1Vv7l") where pkey = 1;
select json_extract(j, '$[0]') from t1 where pkey = 1;
json_extract(j, '$[0]')
"ri2GzUgAceNBjzEtM6GD783MaLLyVPZN7Zb44FEetZpcZ1Vv7l"
commit;
# Connection con49:
start transaction;
select json_extract(j, '$[0]') from t1 where pkey = 1;
json_extract(j, '$[0]')
"ri2GzUgAceNBjzEtM6GD783MaLLyVPZN7Zb44FEetZpcZ1Vv7l"
select json_extract(j, '$[1541]') from t1 where pkey = 1;
json_extract(j, '$[1541]')
"ruLDpGvBzDET0OAOxAolnwPO1srMFyx4qIHdZAoYM0zMPAkMIY53TVPSNGoaEje22ufZ4T7QU7lrFTBV0GZTjyv4FheRQHUQB9zFb5e3APsPq3uqHRJ1OC5b"
select @var_49 := j from t1;
# Doing partial update of length=120:
# Connection default:
select json_extract(j, '$[1541]') from t1 where pkey = 1;
json_extract(j, '$[1541]')
"ruLDpGvBzDET0OAOxAolnwPO1srMFyx4qIHdZAoYM0zMPAkMIY53TVPSNGoaEje22ufZ4T7QU7lrFTBV0GZTjyv4FheRQHUQB9zFb5e3APsPq3uqHRJ1OC5b"
start transaction;
update t1 set j = json_set(j, '$[1541]',"8CuAYSVuO0JxLQWwUYCgA3Dzgm09g5tmHlwqDRkbQ3WlR0gtZqXhtkhZXfhBlax2LsqWHY7hbdR0b7t8xQqo9XOgA5pvdmwyekUuJZbsA2tl7ku29krIFDwN") where pkey = 1;
select json_extract(j, '$[1541]') from t1 where pkey = 1;
json_extract(j, '$[1541]')
"8CuAYSVuO0JxLQWwUYCgA3Dzgm09g5tmHlwqDRkbQ3WlR0gtZqXhtkhZXfhBlax2LsqWHY7hbdR0b7t8xQqo9XOgA5pvdmwyekUuJZbsA2tl7ku29krIFDwN"
commit;
# Connection con50:
start transaction;
select json_extract(j, '$[0]') from t1 where pkey = 1;
json_extract(j, '$[0]')
"ri2GzUgAceNBjzEtM6GD783MaLLyVPZN7Zb44FEetZpcZ1Vv7l"
select json_extract(j, '$[1541]') from t1 where pkey = 1;
json_extract(j, '$[1541]')
"8CuAYSVuO0JxLQWwUYCgA3Dzgm09g5tmHlwqDRkbQ3WlR0gtZqXhtkhZXfhBlax2LsqWHY7hbdR0b7t8xQqo9XOgA5pvdmwyekUuJZbsA2tl7ku29krIFDwN"
select @var_50 := j from t1;
# Doing partial update of length=50:
# Connection default:
select json_extract(j, '$[0]') from t1 where pkey = 1;
json_extract(j, '$[0]')
"ri2GzUgAceNBjzEtM6GD783MaLLyVPZN7Zb44FEetZpcZ1Vv7l"
start transaction;
update t1 set j = json_set(j, '$[0]',"GlJtVDr8xJ2Gsb70c0ljidkpLb7Ym1w2kDvGQkML3MctxhtZhc") where pkey = 1;
select json_extract(j, '$[0]') from t1 where pkey = 1;
json_extract(j, '$[0]')
"GlJtVDr8xJ2Gsb70c0ljidkpLb7Ym1w2kDvGQkML3MctxhtZhc"
commit;
# Connection con51:
start transaction;
select json_extract(j, '$[0]') from t1 where pkey = 1;
json_extract(j, '$[0]')
"GlJtVDr8xJ2Gsb70c0ljidkpLb7Ym1w2kDvGQkML3MctxhtZhc"
select json_extract(j, '$[1541]') from t1 where pkey = 1;
json_extract(j, '$[1541]')
"8CuAYSVuO0JxLQWwUYCgA3Dzgm09g5tmHlwqDRkbQ3WlR0gtZqXhtkhZXfhBlax2LsqWHY7hbdR0b7t8xQqo9XOgA5pvdmwyekUuJZbsA2tl7ku29krIFDwN"
select @var_51 := j from t1;
# Doing partial update of length=120:
# Connection default:
select json_extract(j, '$[1541]') from t1 where pkey = 1;
json_extract(j, '$[1541]')
"8CuAYSVuO0JxLQWwUYCgA3Dzgm09g5tmHlwqDRkbQ3WlR0gtZqXhtkhZXfhBlax2LsqWHY7hbdR0b7t8xQqo9XOgA5pvdmwyekUuJZbsA2tl7ku29krIFDwN"
start transaction;
update t1 set j = json_set(j, '$[1541]',"HNE1DZaI8MK2M4FHIf1e02yavwHmTwMkIajVAHnGb5IxAXCQAD38D1j6vysPtF7Bppgx6RBiXTdfyq3816HF8yL1wCQnRWyELeAR4L7ZpjClZFuYM9nS57Rz") where pkey = 1;
select json_extract(j, '$[1541]') from t1 where pkey = 1;
json_extract(j, '$[1541]')
"HNE1DZaI8MK2M4FHIf1e02yavwHmTwMkIajVAHnGb5IxAXCQAD38D1j6vysPtF7Bppgx6RBiXTdfyq3816HF8yL1wCQnRWyELeAR4L7ZpjClZFuYM9nS57Rz"
commit;
# Connection con52:
start transaction;
select json_extract(j, '$[0]') from t1 where pkey = 1;
json_extract(j, '$[0]')
"GlJtVDr8xJ2Gsb70c0ljidkpLb7Ym1w2kDvGQkML3MctxhtZhc"
select json_extract(j, '$[1541]') from t1 where pkey = 1;
json_extract(j, '$[1541]')
"HNE1DZaI8MK2M4FHIf1e02yavwHmTwMkIajVAHnGb5IxAXCQAD38D1j6vysPtF7Bppgx6RBiXTdfyq3816HF8yL1wCQnRWyELeAR4L7ZpjClZFuYM9nS57Rz"
select @var_52 := j from t1;
# Doing partial update of length=50:
# Connection default:
select json_extract(j, '$[0]') from t1 where pkey = 1;
json_extract(j, '$[0]')
"GlJtVDr8xJ2Gsb70c0ljidkpLb7Ym1w2kDvGQkML3MctxhtZhc"
start transaction;
update t1 set j = json_set(j, '$[0]',"HsniOluhO26SOEzBvBwSQo0kvmA0tcyASlqoWiVulZK7lJIgSC") where pkey = 1;
select json_extract(j, '$[0]') from t1 where pkey = 1;
json_extract(j, '$[0]')
"HsniOluhO26SOEzBvBwSQo0kvmA0tcyASlqoWiVulZK7lJIgSC"
commit;
# Connection con53:
start transaction;
select json_extract(j, '$[0]') from t1 where pkey = 1;
json_extract(j, '$[0]')
"HsniOluhO26SOEzBvBwSQo0kvmA0tcyASlqoWiVulZK7lJIgSC"
select json_extract(j, '$[1541]') from t1 where pkey = 1;
json_extract(j, '$[1541]')
"HNE1DZaI8MK2M4FHIf1e02yavwHmTwMkIajVAHnGb5IxAXCQAD38D1j6vysPtF7Bppgx6RBiXTdfyq3816HF8yL1wCQnRWyELeAR4L7ZpjClZFuYM9nS57Rz"
select @var_53 := j from t1;
# Doing partial update of length=120:
# Connection default:
select json_extract(j, '$[1541]') from t1 where pkey = 1;
json_extract(j, '$[1541]')
"HNE1DZaI8MK2M4FHIf1e02yavwHmTwMkIajVAHnGb5IxAXCQAD38D1j6vysPtF7Bppgx6RBiXTdfyq3816HF8yL1wCQnRWyELeAR4L7ZpjClZFuYM9nS57Rz"
start transaction;
update t1 set j = json_set(j, '$[1541]',"8tz9bsvktmKpumaiY6O1z7aHEMZU21fBseIUUBCLxWApGkXopvno3N3FjckkeNtW1ByTMApHez6skbgZWRLXpOlW1VGfq79rI8KcG7tt7xlrYQO3rjYe7JB6") where pkey = 1;
select json_extract(j, '$[1541]') from t1 where pkey = 1;
json_extract(j, '$[1541]')
"8tz9bsvktmKpumaiY6O1z7aHEMZU21fBseIUUBCLxWApGkXopvno3N3FjckkeNtW1ByTMApHez6skbgZWRLXpOlW1VGfq79rI8KcG7tt7xlrYQO3rjYe7JB6"
commit;
# Connection con54:
start transaction;
select json_extract(j, '$[0]') from t1 where pkey = 1;
json_extract(j, '$[0]')
"HsniOluhO26SOEzBvBwSQo0kvmA0tcyASlqoWiVulZK7lJIgSC"
select json_extract(j, '$[1541]') from t1 where pkey = 1;
json_extract(j, '$[1541]')
"8tz9bsvktmKpumaiY6O1z7aHEMZU21fBseIUUBCLxWApGkXopvno3N3FjckkeNtW1ByTMApHez6skbgZWRLXpOlW1VGfq79rI8KcG7tt7xlrYQO3rjYe7JB6"
select @var_54 := j from t1;
# Doing partial update of length=50:
# Connection default:
select json_extract(j, '$[0]') from t1 where pkey = 1;
json_extract(j, '$[0]')
"HsniOluhO26SOEzBvBwSQo0kvmA0tcyASlqoWiVulZK7lJIgSC"
start transaction;
update t1 set j = json_set(j, '$[0]',"mPjcXtRpzkQDrJ6yHqnnGBq7uNk0gv6TKo3rhVfeD5r4Mw3bmo") where pkey = 1;
select json_extract(j, '$[0]') from t1 where pkey = 1;
json_extract(j, '$[0]')
"mPjcXtRpzkQDrJ6yHqnnGBq7uNk0gv6TKo3rhVfeD5r4Mw3bmo"
commit;
# Connection con55:
start transaction;
select json_extract(j, '$[0]') from t1 where pkey = 1;
json_extract(j, '$[0]')
"mPjcXtRpzkQDrJ6yHqnnGBq7uNk0gv6TKo3rhVfeD5r4Mw3bmo"
select json_extract(j, '$[1541]') from t1 where pkey = 1;
json_extract(j, '$[1541]')
"8tz9bsvktmKpumaiY6O1z7aHEMZU21fBseIUUBCLxWApGkXopvno3N3FjckkeNtW1ByTMApHez6skbgZWRLXpOlW1VGfq79rI8KcG7tt7xlrYQO3rjYe7JB6"
select @var_55 := j from t1;
# Doing partial update of length=120:
# Connection default:
select json_extract(j, '$[1541]') from t1 where pkey = 1;
json_extract(j, '$[1541]')
"8tz9bsvktmKpumaiY6O1z7aHEMZU21fBseIUUBCLxWApGkXopvno3N3FjckkeNtW1ByTMApHez6skbgZWRLXpOlW1VGfq79rI8KcG7tt7xlrYQO3rjYe7JB6"
start transaction;
update t1 set j = json_set(j, '$[1541]',"P20D7uarsFmxg5ljuQCX4PcvUxrVYdJvdH7lAfa2uLzYQiII8SqCsQ6KNxnwZ4pCMwvWcWWUrU3FCJXJlLVbmbt9Xg36jtG5nCZNg5qXZtkmAF5tbYVN8MUd") where pkey = 1;
select json_extract(j, '$[1541]') from t1 where pkey = 1;
json_extract(j, '$[1541]')
"P20D7uarsFmxg5ljuQCX4PcvUxrVYdJvdH7lAfa2uLzYQiII8SqCsQ6KNxnwZ4pCMwvWcWWUrU3FCJXJlLVbmbt9Xg36jtG5nCZNg5qXZtkmAF5tbYVN8MUd"
commit;
# Connection con56:
start transaction;
select json_extract(j, '$[0]') from t1 where pkey = 1;
json_extract(j, '$[0]')
"mPjcXtRpzkQDrJ6yHqnnGBq7uNk0gv6TKo3rhVfeD5r4Mw3bmo"
select json_extract(j, '$[1541]') from t1 where pkey = 1;
json_extract(j, '$[1541]')
"P20D7uarsFmxg5ljuQCX4PcvUxrVYdJvdH7lAfa2uLzYQiII8SqCsQ6KNxnwZ4pCMwvWcWWUrU3FCJXJlLVbmbt9Xg36jtG5nCZNg5qXZtkmAF5tbYVN8MUd"
select @var_56 := j from t1;
# Doing partial update of length=50:
# Connection default:
select json_extract(j, '$[0]') from t1 where pkey = 1;
json_extract(j, '$[0]')
"mPjcXtRpzkQDrJ6yHqnnGBq7uNk0gv6TKo3rhVfeD5r4Mw3bmo"
start transaction;
update t1 set j = json_set(j, '$[0]',"1YhkPxnA7MYnROK1F2lPIoItKlES8i57GkrdieopyMdPivOxy7") where pkey = 1;
select json_extract(j, '$[0]') from t1 where pkey = 1;
json_extract(j, '$[0]')
"1YhkPxnA7MYnROK1F2lPIoItKlES8i57GkrdieopyMdPivOxy7"
commit;
# Connection con57:
start transaction;
select json_extract(j, '$[0]') from t1 where pkey = 1;
json_extract(j, '$[0]')
"1YhkPxnA7MYnROK1F2lPIoItKlES8i57GkrdieopyMdPivOxy7"
select json_extract(j, '$[1541]') from t1 where pkey = 1;
json_extract(j, '$[1541]')
"P20D7uarsFmxg5ljuQCX4PcvUxrVYdJvdH7lAfa2uLzYQiII8SqCsQ6KNxnwZ4pCMwvWcWWUrU3FCJXJlLVbmbt9Xg36jtG5nCZNg5qXZtkmAF5tbYVN8MUd"
select @var_57 := j from t1;
# Doing partial update of length=120:
# Connection default:
select json_extract(j, '$[1541]') from t1 where pkey = 1;
json_extract(j, '$[1541]')
"P20D7uarsFmxg5ljuQCX4PcvUxrVYdJvdH7lAfa2uLzYQiII8SqCsQ6KNxnwZ4pCMwvWcWWUrU3FCJXJlLVbmbt9Xg36jtG5nCZNg5qXZtkmAF5tbYVN8MUd"
start transaction;
update t1 set j = json_set(j, '$[1541]',"KEtc7EMLeS1iZGSOtA0fyyzZLhUkcQpwejZjvv2ZN4HuIiI9qIpoGoLbUoJ6E73roaYjTbIqdYivE024IrrWgC580NEDUH2IrazI9H6mnof1oi44XvYB5eJ6") where pkey = 1;
select json_extract(j, '$[1541]') from t1 where pkey = 1;
json_extract(j, '$[1541]')
"KEtc7EMLeS1iZGSOtA0fyyzZLhUkcQpwejZjvv2ZN4HuIiI9qIpoGoLbUoJ6E73roaYjTbIqdYivE024IrrWgC580NEDUH2IrazI9H6mnof1oi44XvYB5eJ6"
commit;
# Connection con58:
start transaction;
select json_extract(j, '$[0]') from t1 where pkey = 1;
json_extract(j, '$[0]')
"1YhkPxnA7MYnROK1F2lPIoItKlES8i57GkrdieopyMdPivOxy7"
select json_extract(j, '$[1541]') from t1 where pkey = 1;
json_extract(j, '$[1541]')
"KEtc7EMLeS1iZGSOtA0fyyzZLhUkcQpwejZjvv2ZN4HuIiI9qIpoGoLbUoJ6E73roaYjTbIqdYivE024IrrWgC580NEDUH2IrazI9H6mnof1oi44XvYB5eJ6"
select @var_58 := j from t1;
# Doing partial update of length=50:
# Connection default:
select json_extract(j, '$[0]') from t1 where pkey = 1;
json_extract(j, '$[0]')
"1YhkPxnA7MYnROK1F2lPIoItKlES8i57GkrdieopyMdPivOxy7"
start transaction;
update t1 set j = json_set(j, '$[0]',"1YHTnJjdtiv3x2njqRkd7mhehGqls9rrf8KRP34GjzHgz5PoU8") where pkey = 1;
select json_extract(j, '$[0]') from t1 where pkey = 1;
json_extract(j, '$[0]')
"1YHTnJjdtiv3x2njqRkd7mhehGqls9rrf8KRP34GjzHgz5PoU8"
commit;
# Connection con59:
start transaction;
select json_extract(j, '$[0]') from t1 where pkey = 1;
json_extract(j, '$[0]')
"1YHTnJjdtiv3x2njqRkd7mhehGqls9rrf8KRP34GjzHgz5PoU8"
select json_extract(j, '$[1541]') from t1 where pkey = 1;
json_extract(j, '$[1541]')
"KEtc7EMLeS1iZGSOtA0fyyzZLhUkcQpwejZjvv2ZN4HuIiI9qIpoGoLbUoJ6E73roaYjTbIqdYivE024IrrWgC580NEDUH2IrazI9H6mnof1oi44XvYB5eJ6"
select @var_59 := j from t1;
# Doing partial update of length=120:
# Connection default:
select json_extract(j, '$[1541]') from t1 where pkey = 1;
json_extract(j, '$[1541]')
"KEtc7EMLeS1iZGSOtA0fyyzZLhUkcQpwejZjvv2ZN4HuIiI9qIpoGoLbUoJ6E73roaYjTbIqdYivE024IrrWgC580NEDUH2IrazI9H6mnof1oi44XvYB5eJ6"
start transaction;
update t1 set j = json_set(j, '$[1541]',"Rbu6DaK3LCBA1oGLFfMJv5HDkEG92kHTJAYWisY33jB4VRQl4k2zoHAYWQfW8x0P5YwnOUoRBzWeOuPScQPQhYyBwei5ZgUcCOPaqB018WgWO3w0RJR7rNIo") where pkey = 1;
select json_extract(j, '$[1541]') from t1 where pkey = 1;
json_extract(j, '$[1541]')
"Rbu6DaK3LCBA1oGLFfMJv5HDkEG92kHTJAYWisY33jB4VRQl4k2zoHAYWQfW8x0P5YwnOUoRBzWeOuPScQPQhYyBwei5ZgUcCOPaqB018WgWO3w0RJR7rNIo"
commit;
# Connection con60:
start transaction;
select json_extract(j, '$[0]') from t1 where pkey = 1;
json_extract(j, '$[0]')
"1YHTnJjdtiv3x2njqRkd7mhehGqls9rrf8KRP34GjzHgz5PoU8"
select json_extract(j, '$[1541]') from t1 where pkey = 1;
json_extract(j, '$[1541]')
"Rbu6DaK3LCBA1oGLFfMJv5HDkEG92kHTJAYWisY33jB4VRQl4k2zoHAYWQfW8x0P5YwnOUoRBzWeOuPScQPQhYyBwei5ZgUcCOPaqB018WgWO3w0RJR7rNIo"
select @var_60 := j from t1;
# Doing partial update of length=50:
# Connection default:
select json_extract(j, '$[0]') from t1 where pkey = 1;
json_extract(j, '$[0]')
"1YHTnJjdtiv3x2njqRkd7mhehGqls9rrf8KRP34GjzHgz5PoU8"
start transaction;
update t1 set j = json_set(j, '$[0]',"zyrWcL8oiVNYgNYmrCIDFCDfWcmNy4Bx12SdMaQ44lai68VvKl") where pkey = 1;
select json_extract(j, '$[0]') from t1 where pkey = 1;
json_extract(j, '$[0]')
"zyrWcL8oiVNYgNYmrCIDFCDfWcmNy4Bx12SdMaQ44lai68VvKl"
commit;
# Connection con61:
start transaction;
select json_extract(j, '$[0]') from t1 where pkey = 1;
json_extract(j, '$[0]')
"zyrWcL8oiVNYgNYmrCIDFCDfWcmNy4Bx12SdMaQ44lai68VvKl"
select json_extract(j, '$[1541]') from t1 where pkey = 1;
json_extract(j, '$[1541]')
"Rbu6DaK3LCBA1oGLFfMJv5HDkEG92kHTJAYWisY33jB4VRQl4k2zoHAYWQfW8x0P5YwnOUoRBzWeOuPScQPQhYyBwei5ZgUcCOPaqB018WgWO3w0RJR7rNIo"
select @var_61 := j from t1;
# Doing partial update of length=120:
# Connection default:
select json_extract(j, '$[1541]') from t1 where pkey = 1;
json_extract(j, '$[1541]')
"Rbu6DaK3LCBA1oGLFfMJv5HDkEG92kHTJAYWisY33jB4VRQl4k2zoHAYWQfW8x0P5YwnOUoRBzWeOuPScQPQhYyBwei5ZgUcCOPaqB018WgWO3w0RJR7rNIo"
start transaction;
update t1 set j = json_set(j, '$[1541]',"8YyLDUyzpw11r01JcLs0Pwlyep67kPtsvrB6J958347t37CfS2dqyMobBsivHZlCQwIh4Lo5OtyR094TBhJ835hCxN7FxqPLmg3o1puNiqmjzqA9VTFWWwiT") where pkey = 1;
select json_extract(j, '$[1541]') from t1 where pkey = 1;
json_extract(j, '$[1541]')
"8YyLDUyzpw11r01JcLs0Pwlyep67kPtsvrB6J958347t37CfS2dqyMobBsivHZlCQwIh4Lo5OtyR094TBhJ835hCxN7FxqPLmg3o1puNiqmjzqA9VTFWWwiT"
commit;
# Connection con62:
start transaction;
select json_extract(j, '$[0]') from t1 where pkey = 1;
json_extract(j, '$[0]')
"zyrWcL8oiVNYgNYmrCIDFCDfWcmNy4Bx12SdMaQ44lai68VvKl"
select json_extract(j, '$[1541]') from t1 where pkey = 1;
json_extract(j, '$[1541]')
"8YyLDUyzpw11r01JcLs0Pwlyep67kPtsvrB6J958347t37CfS2dqyMobBsivHZlCQwIh4Lo5OtyR094TBhJ835hCxN7FxqPLmg3o1puNiqmjzqA9VTFWWwiT"
select @var_62 := j from t1;
# Doing partial update of length=50:
# Connection default:
select json_extract(j, '$[0]') from t1 where pkey = 1;
json_extract(j, '$[0]')
"zyrWcL8oiVNYgNYmrCIDFCDfWcmNy4Bx12SdMaQ44lai68VvKl"
start transaction;
update t1 set j = json_set(j, '$[0]',"JniGd6aOmdClS698xvruk11FSGkyASSUE8irEID0tQmJUtSPoH") where pkey = 1;
select json_extract(j, '$[0]') from t1 where pkey = 1;
json_extract(j, '$[0]')
"JniGd6aOmdClS698xvruk11FSGkyASSUE8irEID0tQmJUtSPoH"
commit;
# Connection con63:
start transaction;
select json_extract(j, '$[0]') from t1 where pkey = 1;
json_extract(j, '$[0]')
"JniGd6aOmdClS698xvruk11FSGkyASSUE8irEID0tQmJUtSPoH"
select json_extract(j, '$[1541]') from t1 where pkey = 1;
json_extract(j, '$[1541]')
"8YyLDUyzpw11r01JcLs0Pwlyep67kPtsvrB6J958347t37CfS2dqyMobBsivHZlCQwIh4Lo5OtyR094TBhJ835hCxN7FxqPLmg3o1puNiqmjzqA9VTFWWwiT"
select @var_63 := j from t1;
# Doing partial update of length=120:
# Connection default:
select json_extract(j, '$[1541]') from t1 where pkey = 1;
json_extract(j, '$[1541]')
"8YyLDUyzpw11r01JcLs0Pwlyep67kPtsvrB6J958347t37CfS2dqyMobBsivHZlCQwIh4Lo5OtyR094TBhJ835hCxN7FxqPLmg3o1puNiqmjzqA9VTFWWwiT"
start transaction;
update t1 set j = json_set(j, '$[1541]',"IWHJmhaWgiw6CACt0R9DP1b9K62kTp0lLH35ybZcJUgUetLcIUqfTRpoVpWxcWgylj1kKbKc516hsRK8t8nNXa93Ody0AewvMydeXwGcvKHnlbvdjg0HF7Id") where pkey = 1;
select json_extract(j, '$[1541]') from t1 where pkey = 1;
json_extract(j, '$[1541]')
"IWHJmhaWgiw6CACt0R9DP1b9K62kTp0lLH35ybZcJUgUetLcIUqfTRpoVpWxcWgylj1kKbKc516hsRK8t8nNXa93Ody0AewvMydeXwGcvKHnlbvdjg0HF7Id"
commit;
# Connection con64:
start transaction;
select json_extract(j, '$[0]') from t1 where pkey = 1;
json_extract(j, '$[0]')
"JniGd6aOmdClS698xvruk11FSGkyASSUE8irEID0tQmJUtSPoH"
select json_extract(j, '$[1541]') from t1 where pkey = 1;
json_extract(j, '$[1541]')
"IWHJmhaWgiw6CACt0R9DP1b9K62kTp0lLH35ybZcJUgUetLcIUqfTRpoVpWxcWgylj1kKbKc516hsRK8t8nNXa93Ody0AewvMydeXwGcvKHnlbvdjg0HF7Id"
select @var_64 := j from t1;
# Doing partial update of length=50:
# Connection default:
select json_extract(j, '$[0]') from t1 where pkey = 1;
json_extract(j, '$[0]')
"JniGd6aOmdClS698xvruk11FSGkyASSUE8irEID0tQmJUtSPoH"
start transaction;
update t1 set j = json_set(j, '$[0]',"kEdsqYmCWPp3J5dEOu17UukBZiSopiPaw0QlYCx4cm5vqi8Eb9") where pkey = 1;
select json_extract(j, '$[0]') from t1 where pkey = 1;
json_extract(j, '$[0]')
"kEdsqYmCWPp3J5dEOu17UukBZiSopiPaw0QlYCx4cm5vqi8Eb9"
commit;
# Connection con65:
start transaction;
select json_extract(j, '$[0]') from t1 where pkey = 1;
json_extract(j, '$[0]')
"kEdsqYmCWPp3J5dEOu17UukBZiSopiPaw0QlYCx4cm5vqi8Eb9"
select json_extract(j, '$[1541]') from t1 where pkey = 1;
json_extract(j, '$[1541]')
"IWHJmhaWgiw6CACt0R9DP1b9K62kTp0lLH35ybZcJUgUetLcIUqfTRpoVpWxcWgylj1kKbKc516hsRK8t8nNXa93Ody0AewvMydeXwGcvKHnlbvdjg0HF7Id"
select @var_65 := j from t1;
# Doing partial update of length=120:
# Connection default:
select json_extract(j, '$[1541]') from t1 where pkey = 1;
json_extract(j, '$[1541]')
"IWHJmhaWgiw6CACt0R9DP1b9K62kTp0lLH35ybZcJUgUetLcIUqfTRpoVpWxcWgylj1kKbKc516hsRK8t8nNXa93Ody0AewvMydeXwGcvKHnlbvdjg0HF7Id"
start transaction;
update t1 set j = json_set(j, '$[1541]',"J524GZmhNaNk8IkY3JlyLLjPEZ7MlgU4lU603rfOR28XIs3L9mIT71sKYxeHc8LLaQLdHy1g19BH0Ed71va6uQQSM3jy92JkSdNhbNNaUYsUlTcmMAqGbFgv") where pkey = 1;
select json_extract(j, '$[1541]') from t1 where pkey = 1;
json_extract(j, '$[1541]')
"J524GZmhNaNk8IkY3JlyLLjPEZ7MlgU4lU603rfOR28XIs3L9mIT71sKYxeHc8LLaQLdHy1g19BH0Ed71va6uQQSM3jy92JkSdNhbNNaUYsUlTcmMAqGbFgv"
commit;
# Connection con66:
start transaction;
select json_extract(j, '$[0]') from t1 where pkey = 1;
json_extract(j, '$[0]')
"kEdsqYmCWPp3J5dEOu17UukBZiSopiPaw0QlYCx4cm5vqi8Eb9"
select json_extract(j, '$[1541]') from t1 where pkey = 1;
json_extract(j, '$[1541]')
"J524GZmhNaNk8IkY3JlyLLjPEZ7MlgU4lU603rfOR28XIs3L9mIT71sKYxeHc8LLaQLdHy1g19BH0Ed71va6uQQSM3jy92JkSdNhbNNaUYsUlTcmMAqGbFgv"
select @var_66 := j from t1;
# Doing partial update of length=50:
# Connection default:
select json_extract(j, '$[0]') from t1 where pkey = 1;
json_extract(j, '$[0]')
"kEdsqYmCWPp3J5dEOu17UukBZiSopiPaw0QlYCx4cm5vqi8Eb9"
start transaction;
update t1 set j = json_set(j, '$[0]',"IPrRP89slXZLsvtMRjrCCRwWblkA0O3GnuhB3r1mMY5CTzYtiN") where pkey = 1;
select json_extract(j, '$[0]') from t1 where pkey = 1;
json_extract(j, '$[0]')
"IPrRP89slXZLsvtMRjrCCRwWblkA0O3GnuhB3r1mMY5CTzYtiN"
commit;
# Connection con67:
start transaction;
select json_extract(j, '$[0]') from t1 where pkey = 1;
json_extract(j, '$[0]')
"IPrRP89slXZLsvtMRjrCCRwWblkA0O3GnuhB3r1mMY5CTzYtiN"
select json_extract(j, '$[1541]') from t1 where pkey = 1;
json_extract(j, '$[1541]')
"J524GZmhNaNk8IkY3JlyLLjPEZ7MlgU4lU603rfOR28XIs3L9mIT71sKYxeHc8LLaQLdHy1g19BH0Ed71va6uQQSM3jy92JkSdNhbNNaUYsUlTcmMAqGbFgv"
select @var_67 := j from t1;
# Doing partial update of length=120:
# Connection default:
select json_extract(j, '$[1541]') from t1 where pkey = 1;
json_extract(j, '$[1541]')
"J524GZmhNaNk8IkY3JlyLLjPEZ7MlgU4lU603rfOR28XIs3L9mIT71sKYxeHc8LLaQLdHy1g19BH0Ed71va6uQQSM3jy92JkSdNhbNNaUYsUlTcmMAqGbFgv"
start transaction;
update t1 set j = json_set(j, '$[1541]',"5to0NOl8WjWazIUgTVVUGp2LzUKYN1tQugOH49NaquApAdUb6x5Ml5ikX0Gs1AHvqfBsnYSdQbTaExBIuEffINQnLegNoxGcaRUNyx1OWSxiP80HLfvb0JOM") where pkey = 1;
select json_extract(j, '$[1541]') from t1 where pkey = 1;
json_extract(j, '$[1541]')
"5to0NOl8WjWazIUgTVVUGp2LzUKYN1tQugOH49NaquApAdUb6x5Ml5ikX0Gs1AHvqfBsnYSdQbTaExBIuEffINQnLegNoxGcaRUNyx1OWSxiP80HLfvb0JOM"
commit;
# Connection con68:
start transaction;
select json_extract(j, '$[0]') from t1 where pkey = 1;
json_extract(j, '$[0]')
"IPrRP89slXZLsvtMRjrCCRwWblkA0O3GnuhB3r1mMY5CTzYtiN"
select json_extract(j, '$[1541]') from t1 where pkey = 1;
json_extract(j, '$[1541]')
"5to0NOl8WjWazIUgTVVUGp2LzUKYN1tQugOH49NaquApAdUb6x5Ml5ikX0Gs1AHvqfBsnYSdQbTaExBIuEffINQnLegNoxGcaRUNyx1OWSxiP80HLfvb0JOM"
select @var_68 := j from t1;
# Doing partial update of length=50:
# Connection default:
select json_extract(j, '$[0]') from t1 where pkey = 1;
json_extract(j, '$[0]')
"IPrRP89slXZLsvtMRjrCCRwWblkA0O3GnuhB3r1mMY5CTzYtiN"
start transaction;
update t1 set j = json_set(j, '$[0]',"x2hmzxMYNrvLmuhIMe0jly14ewfcF3wC6dw3ZHbw8VHsPyAkb8") where pkey = 1;
select json_extract(j, '$[0]') from t1 where pkey = 1;
json_extract(j, '$[0]')
"x2hmzxMYNrvLmuhIMe0jly14ewfcF3wC6dw3ZHbw8VHsPyAkb8"
commit;
# Connection con69:
start transaction;
select json_extract(j, '$[0]') from t1 where pkey = 1;
json_extract(j, '$[0]')
"x2hmzxMYNrvLmuhIMe0jly14ewfcF3wC6dw3ZHbw8VHsPyAkb8"
select json_extract(j, '$[1541]') from t1 where pkey = 1;
json_extract(j, '$[1541]')
"5to0NOl8WjWazIUgTVVUGp2LzUKYN1tQugOH49NaquApAdUb6x5Ml5ikX0Gs1AHvqfBsnYSdQbTaExBIuEffINQnLegNoxGcaRUNyx1OWSxiP80HLfvb0JOM"
select @var_69 := j from t1;
# Doing partial update of length=120:
# Connection default:
select json_extract(j, '$[1541]') from t1 where pkey = 1;
json_extract(j, '$[1541]')
"5to0NOl8WjWazIUgTVVUGp2LzUKYN1tQugOH49NaquApAdUb6x5Ml5ikX0Gs1AHvqfBsnYSdQbTaExBIuEffINQnLegNoxGcaRUNyx1OWSxiP80HLfvb0JOM"
start transaction;
update t1 set j = json_set(j, '$[1541]',"TM6UQiO5Jb6FmArgCQxlK5GZxeV5O6BrSIKqyitHIyV48MkIki44lIbhu6mIDy8dEQSC6LSOJxSQHDg1tk3e1cLti6Av2IZGg1QmKsBcnd24og3hP4KQgfHP") where pkey = 1;
select json_extract(j, '$[1541]') from t1 where pkey = 1;
json_extract(j, '$[1541]')
"TM6UQiO5Jb6FmArgCQxlK5GZxeV5O6BrSIKqyitHIyV48MkIki44lIbhu6mIDy8dEQSC6LSOJxSQHDg1tk3e1cLti6Av2IZGg1QmKsBcnd24og3hP4KQgfHP"
commit;
# Connection con70:
start transaction;
select json_extract(j, '$[0]') from t1 where pkey = 1;
json_extract(j, '$[0]')
"x2hmzxMYNrvLmuhIMe0jly14ewfcF3wC6dw3ZHbw8VHsPyAkb8"
select json_extract(j, '$[1541]') from t1 where pkey = 1;
json_extract(j, '$[1541]')
"TM6UQiO5Jb6FmArgCQxlK5GZxeV5O6BrSIKqyitHIyV48MkIki44lIbhu6mIDy8dEQSC6LSOJxSQHDg1tk3e1cLti6Av2IZGg1QmKsBcnd24og3hP4KQgfHP"
select @var_70 := j from t1;
# Doing partial update of length=50:
# Connection default:
select json_extract(j, '$[0]') from t1 where pkey = 1;
json_extract(j, '$[0]')
"x2hmzxMYNrvLmuhIMe0jly14ewfcF3wC6dw3ZHbw8VHsPyAkb8"
start transaction;
update t1 set j = json_set(j, '$[0]',"lRIljpzPqQA9GLl4wl6jRAQqCkEtOWG7xYtfOs2CGCLVV4ZQnf") where pkey = 1;
select json_extract(j, '$[0]') from t1 where pkey = 1;
json_extract(j, '$[0]')
"lRIljpzPqQA9GLl4wl6jRAQqCkEtOWG7xYtfOs2CGCLVV4ZQnf"
commit;
# Connection con71:
start transaction;
select json_extract(j, '$[0]') from t1 where pkey = 1;
json_extract(j, '$[0]')
"lRIljpzPqQA9GLl4wl6jRAQqCkEtOWG7xYtfOs2CGCLVV4ZQnf"
select json_extract(j, '$[1541]') from t1 where pkey = 1;
json_extract(j, '$[1541]')
"TM6UQiO5Jb6FmArgCQxlK5GZxeV5O6BrSIKqyitHIyV48MkIki44lIbhu6mIDy8dEQSC6LSOJxSQHDg1tk3e1cLti6Av2IZGg1QmKsBcnd24og3hP4KQgfHP"
select @var_71 := j from t1;
# Doing partial update of length=120:
# Connection default:
select json_extract(j, '$[1541]') from t1 where pkey = 1;
json_extract(j, '$[1541]')
"TM6UQiO5Jb6FmArgCQxlK5GZxeV5O6BrSIKqyitHIyV48MkIki44lIbhu6mIDy8dEQSC6LSOJxSQHDg1tk3e1cLti6Av2IZGg1QmKsBcnd24og3hP4KQgfHP"
start transaction;
update t1 set j = json_set(j, '$[1541]',"9DnX10GGrek7jffaI3RJEfTZAzcjPPNWc83e8Hsxta4dFkDWlcpzIIXSF9AcWX87dAjmRbhL9mwOU7uDkhB20iSDpcqJ7wQl69VYiCrrwnEQu6eeopemV7zK") where pkey = 1;
select json_extract(j, '$[1541]') from t1 where pkey = 1;
json_extract(j, '$[1541]')
"9DnX10GGrek7jffaI3RJEfTZAzcjPPNWc83e8Hsxta4dFkDWlcpzIIXSF9AcWX87dAjmRbhL9mwOU7uDkhB20iSDpcqJ7wQl69VYiCrrwnEQu6eeopemV7zK"
commit;
# Connection con72:
start transaction;
select json_extract(j, '$[0]') from t1 where pkey = 1;
json_extract(j, '$[0]')
"lRIljpzPqQA9GLl4wl6jRAQqCkEtOWG7xYtfOs2CGCLVV4ZQnf"
select json_extract(j, '$[1541]') from t1 where pkey = 1;
json_extract(j, '$[1541]')
"9DnX10GGrek7jffaI3RJEfTZAzcjPPNWc83e8Hsxta4dFkDWlcpzIIXSF9AcWX87dAjmRbhL9mwOU7uDkhB20iSDpcqJ7wQl69VYiCrrwnEQu6eeopemV7zK"
select @var_72 := j from t1;
# Doing partial update of length=50:
# Connection default:
select json_extract(j, '$[0]') from t1 where pkey = 1;
json_extract(j, '$[0]')
"lRIljpzPqQA9GLl4wl6jRAQqCkEtOWG7xYtfOs2CGCLVV4ZQnf"
start transaction;
update t1 set j = json_set(j, '$[0]',"hnbpk2Yq91MsDDjAyxYt2CVqz8aSDZkuNMh7ODvXEINST5aS08") where pkey = 1;
select json_extract(j, '$[0]') from t1 where pkey = 1;
json_extract(j, '$[0]')
"hnbpk2Yq91MsDDjAyxYt2CVqz8aSDZkuNMh7ODvXEINST5aS08"
commit;
# Connection con73:
start transaction;
select json_extract(j, '$[0]') from t1 where pkey = 1;
json_extract(j, '$[0]')
"hnbpk2Yq91MsDDjAyxYt2CVqz8aSDZkuNMh7ODvXEINST5aS08"
select json_extract(j, '$[1541]') from t1 where pkey = 1;
json_extract(j, '$[1541]')
"9DnX10GGrek7jffaI3RJEfTZAzcjPPNWc83e8Hsxta4dFkDWlcpzIIXSF9AcWX87dAjmRbhL9mwOU7uDkhB20iSDpcqJ7wQl69VYiCrrwnEQu6eeopemV7zK"
select @var_73 := j from t1;
# Doing partial update of length=120:
# Connection default:
select json_extract(j, '$[1541]') from t1 where pkey = 1;
json_extract(j, '$[1541]')
"9DnX10GGrek7jffaI3RJEfTZAzcjPPNWc83e8Hsxta4dFkDWlcpzIIXSF9AcWX87dAjmRbhL9mwOU7uDkhB20iSDpcqJ7wQl69VYiCrrwnEQu6eeopemV7zK"
start transaction;
update t1 set j = json_set(j, '$[1541]',"J2JmsGuSj70T0LpfQBtLh7b4Z397TAEmCXW3lRTUWTwWmjCCv3YcA7eiAopby3N8Ys9IJdmn4gIrQS1JVXvffXNnLBPHCkOjcX1tAlfDSx2qN39sb2VGZr1t") where pkey = 1;
select json_extract(j, '$[1541]') from t1 where pkey = 1;
json_extract(j, '$[1541]')
"J2JmsGuSj70T0LpfQBtLh7b4Z397TAEmCXW3lRTUWTwWmjCCv3YcA7eiAopby3N8Ys9IJdmn4gIrQS1JVXvffXNnLBPHCkOjcX1tAlfDSx2qN39sb2VGZr1t"
commit;
# Connection con74:
start transaction;
select json_extract(j, '$[0]') from t1 where pkey = 1;
json_extract(j, '$[0]')
"hnbpk2Yq91MsDDjAyxYt2CVqz8aSDZkuNMh7ODvXEINST5aS08"
select json_extract(j, '$[1541]') from t1 where pkey = 1;
json_extract(j, '$[1541]')
"J2JmsGuSj70T0LpfQBtLh7b4Z397TAEmCXW3lRTUWTwWmjCCv3YcA7eiAopby3N8Ys9IJdmn4gIrQS1JVXvffXNnLBPHCkOjcX1tAlfDSx2qN39sb2VGZr1t"
select @var_74 := j from t1;
# Doing partial update of length=50:
# Connection default:
select json_extract(j, '$[0]') from t1 where pkey = 1;
json_extract(j, '$[0]')
"hnbpk2Yq91MsDDjAyxYt2CVqz8aSDZkuNMh7ODvXEINST5aS08"
start transaction;
update t1 set j = json_set(j, '$[0]',"2QAC9Yvl4wdEiIP8DRyaV5S45vKemJXmigzrCscGpDTVVsbiKX") where pkey = 1;
select json_extract(j, '$[0]') from t1 where pkey = 1;
json_extract(j, '$[0]')
"2QAC9Yvl4wdEiIP8DRyaV5S45vKemJXmigzrCscGpDTVVsbiKX"
commit;
# Connection con75:
start transaction;
select json_extract(j, '$[0]') from t1 where pkey = 1;
json_extract(j, '$[0]')
"2QAC9Yvl4wdEiIP8DRyaV5S45vKemJXmigzrCscGpDTVVsbiKX"
select json_extract(j, '$[1541]') from t1 where pkey = 1;
json_extract(j, '$[1541]')
"J2JmsGuSj70T0LpfQBtLh7b4Z397TAEmCXW3lRTUWTwWmjCCv3YcA7eiAopby3N8Ys9IJdmn4gIrQS1JVXvffXNnLBPHCkOjcX1tAlfDSx2qN39sb2VGZr1t"
select @var_75 := j from t1;
# Doing partial update of length=120:
# Connection default:
select json_extract(j, '$[1541]') from t1 where pkey = 1;
json_extract(j, '$[1541]')
"J2JmsGuSj70T0LpfQBtLh7b4Z397TAEmCXW3lRTUWTwWmjCCv3YcA7eiAopby3N8Ys9IJdmn4gIrQS1JVXvffXNnLBPHCkOjcX1tAlfDSx2qN39sb2VGZr1t"
start transaction;
update t1 set j = json_set(j, '$[1541]',"Inairfe9JOSpBAV8zh0awnnPGHHpzZMGKwwBbYKtvlg4tBCtqATmyEBCVR2TyMhJJbUsAnj3WP7NYJGPTh9PuJaPicqgyXzF9S8HFpKjFP6niLA90IXub7KJ") where pkey = 1;
select json_extract(j, '$[1541]') from t1 where pkey = 1;
json_extract(j, '$[1541]')
"Inairfe9JOSpBAV8zh0awnnPGHHpzZMGKwwBbYKtvlg4tBCtqATmyEBCVR2TyMhJJbUsAnj3WP7NYJGPTh9PuJaPicqgyXzF9S8HFpKjFP6niLA90IXub7KJ"
commit;
# Connection con76:
start transaction;
select json_extract(j, '$[0]') from t1 where pkey = 1;
json_extract(j, '$[0]')
"2QAC9Yvl4wdEiIP8DRyaV5S45vKemJXmigzrCscGpDTVVsbiKX"
select json_extract(j, '$[1541]') from t1 where pkey = 1;
json_extract(j, '$[1541]')
"Inairfe9JOSpBAV8zh0awnnPGHHpzZMGKwwBbYKtvlg4tBCtqATmyEBCVR2TyMhJJbUsAnj3WP7NYJGPTh9PuJaPicqgyXzF9S8HFpKjFP6niLA90IXub7KJ"
select @var_76 := j from t1;
# Doing partial update of length=50:
# Connection default:
select json_extract(j, '$[0]') from t1 where pkey = 1;
json_extract(j, '$[0]')
"2QAC9Yvl4wdEiIP8DRyaV5S45vKemJXmigzrCscGpDTVVsbiKX"
start transaction;
update t1 set j = json_set(j, '$[0]',"jAxfgxvnP12cqKL3jPrRkzYlH3fqAx7r65Xk0QXNRZzHtILafA") where pkey = 1;
select json_extract(j, '$[0]') from t1 where pkey = 1;
json_extract(j, '$[0]')
"jAxfgxvnP12cqKL3jPrRkzYlH3fqAx7r65Xk0QXNRZzHtILafA"
commit;
# Connection con77:
start transaction;
select json_extract(j, '$[0]') from t1 where pkey = 1;
json_extract(j, '$[0]')
"jAxfgxvnP12cqKL3jPrRkzYlH3fqAx7r65Xk0QXNRZzHtILafA"
select json_extract(j, '$[1541]') from t1 where pkey = 1;
json_extract(j, '$[1541]')
"Inairfe9JOSpBAV8zh0awnnPGHHpzZMGKwwBbYKtvlg4tBCtqATmyEBCVR2TyMhJJbUsAnj3WP7NYJGPTh9PuJaPicqgyXzF9S8HFpKjFP6niLA90IXub7KJ"
select @var_77 := j from t1;
# Doing partial update of length=120:
# Connection default:
select json_extract(j, '$[1541]') from t1 where pkey = 1;
json_extract(j, '$[1541]')
"Inairfe9JOSpBAV8zh0awnnPGHHpzZMGKwwBbYKtvlg4tBCtqATmyEBCVR2TyMhJJbUsAnj3WP7NYJGPTh9PuJaPicqgyXzF9S8HFpKjFP6niLA90IXub7KJ"
start transaction;
update t1 set j = json_set(j, '$[1541]',"1Q7X9PbmFjkLboQ6YOW3lxciCTyV3dd21lXAA6xNqfiRT6VzS12Dwct83rc4TF6U0bd8iaUYDAxgFSdhRfvNFmTIe5M7JQZH1CQjksFx2CbHcEx3rqQ6csMG") where pkey = 1;
select json_extract(j, '$[1541]') from t1 where pkey = 1;
json_extract(j, '$[1541]')
"1Q7X9PbmFjkLboQ6YOW3lxciCTyV3dd21lXAA6xNqfiRT6VzS12Dwct83rc4TF6U0bd8iaUYDAxgFSdhRfvNFmTIe5M7JQZH1CQjksFx2CbHcEx3rqQ6csMG"
commit;
# Connection con78:
start transaction;
select json_extract(j, '$[0]') from t1 where pkey = 1;
json_extract(j, '$[0]')
"jAxfgxvnP12cqKL3jPrRkzYlH3fqAx7r65Xk0QXNRZzHtILafA"
select json_extract(j, '$[1541]') from t1 where pkey = 1;
json_extract(j, '$[1541]')
"1Q7X9PbmFjkLboQ6YOW3lxciCTyV3dd21lXAA6xNqfiRT6VzS12Dwct83rc4TF6U0bd8iaUYDAxgFSdhRfvNFmTIe5M7JQZH1CQjksFx2CbHcEx3rqQ6csMG"
select @var_78 := j from t1;
# Doing partial update of length=50:
# Connection default:
select json_extract(j, '$[0]') from t1 where pkey = 1;
json_extract(j, '$[0]')
"jAxfgxvnP12cqKL3jPrRkzYlH3fqAx7r65Xk0QXNRZzHtILafA"
start transaction;
update t1 set j = json_set(j, '$[0]',"xiLE8tWA5urom7lmHL2uXzvNpMTREqg9W1OdssnymckWhTIzoK") where pkey = 1;
select json_extract(j, '$[0]') from t1 where pkey = 1;
json_extract(j, '$[0]')
"xiLE8tWA5urom7lmHL2uXzvNpMTREqg9W1OdssnymckWhTIzoK"
commit;
# Connection con79:
start transaction;
select json_extract(j, '$[0]') from t1 where pkey = 1;
json_extract(j, '$[0]')
"xiLE8tWA5urom7lmHL2uXzvNpMTREqg9W1OdssnymckWhTIzoK"
select json_extract(j, '$[1541]') from t1 where pkey = 1;
json_extract(j, '$[1541]')
"1Q7X9PbmFjkLboQ6YOW3lxciCTyV3dd21lXAA6xNqfiRT6VzS12Dwct83rc4TF6U0bd8iaUYDAxgFSdhRfvNFmTIe5M7JQZH1CQjksFx2CbHcEx3rqQ6csMG"
select @var_79 := j from t1;
# Doing partial update of length=120:
# Connection default:
select json_extract(j, '$[1541]') from t1 where pkey = 1;
json_extract(j, '$[1541]')
"1Q7X9PbmFjkLboQ6YOW3lxciCTyV3dd21lXAA6xNqfiRT6VzS12Dwct83rc4TF6U0bd8iaUYDAxgFSdhRfvNFmTIe5M7JQZH1CQjksFx2CbHcEx3rqQ6csMG"
start transaction;
update t1 set j = json_set(j, '$[1541]',"rKHmh668WIwCSTBo64er0OTku9DA80TzKklzps7LA4XaVgMbi0QiOrQG0cR8cu5ucptRfymn2HMVwi4ehUN3MlIKNjRxbWpBJgdyfNkfd6BZmFBRiWT2IlMf") where pkey = 1;
select json_extract(j, '$[1541]') from t1 where pkey = 1;
json_extract(j, '$[1541]')
"rKHmh668WIwCSTBo64er0OTku9DA80TzKklzps7LA4XaVgMbi0QiOrQG0cR8cu5ucptRfymn2HMVwi4ehUN3MlIKNjRxbWpBJgdyfNkfd6BZmFBRiWT2IlMf"
commit;
#
# Function: destroy_connections_with_json_select()
# total_connections=80
# idx1=0
# idx2=1541
#
# Destroying all connections: 
# Connection con0:
select * from t1;
select @var_end_0 := j from t1;
select @var_0 = @var_end_0;
@var_0 = @var_end_0
1
select json_extract(j, '$[0]') from t1 where pkey = 1;
json_extract(j, '$[0]')
"fa37JncCHryDsbzayy4cBWDxS22JjzhMaiRrV41mtzxlYvKWrO"
select json_extract(j, '$[1541]') from t1 where pkey = 1;
json_extract(j, '$[1541]')
"PmMzqaJpCKWSp5lCie9bG8PBaERJ5awTNIQDsh022XSpaD0Js7s8GHHoTj7XH10eJOp95qB5LcvvptEhy7nEO51qm8N3ALiRjVZmLisgKlcAcopavdnIio6U"
commit;
select json_extract(j, '$[0]') from t1 where pkey = 1;
json_extract(j, '$[0]')
"xiLE8tWA5urom7lmHL2uXzvNpMTREqg9W1OdssnymckWhTIzoK"
select json_extract(j, '$[1541]') from t1 where pkey = 1;
json_extract(j, '$[1541]')
"rKHmh668WIwCSTBo64er0OTku9DA80TzKklzps7LA4XaVgMbi0QiOrQG0cR8cu5ucptRfymn2HMVwi4ehUN3MlIKNjRxbWpBJgdyfNkfd6BZmFBRiWT2IlMf"
# Connection con1:
select * from t1;
select @var_end_1 := j from t1;
select @var_1 = @var_end_1;
@var_1 = @var_end_1
1
select json_extract(j, '$[0]') from t1 where pkey = 1;
json_extract(j, '$[0]')
"bK5aLlMa6uxuOlGvLmuMyufDg1BVBQXkjcK4LefRYaMvMaofKh"
select json_extract(j, '$[1541]') from t1 where pkey = 1;
json_extract(j, '$[1541]')
"PmMzqaJpCKWSp5lCie9bG8PBaERJ5awTNIQDsh022XSpaD0Js7s8GHHoTj7XH10eJOp95qB5LcvvptEhy7nEO51qm8N3ALiRjVZmLisgKlcAcopavdnIio6U"
commit;
select json_extract(j, '$[0]') from t1 where pkey = 1;
json_extract(j, '$[0]')
"xiLE8tWA5urom7lmHL2uXzvNpMTREqg9W1OdssnymckWhTIzoK"
select json_extract(j, '$[1541]') from t1 where pkey = 1;
json_extract(j, '$[1541]')
"rKHmh668WIwCSTBo64er0OTku9DA80TzKklzps7LA4XaVgMbi0QiOrQG0cR8cu5ucptRfymn2HMVwi4ehUN3MlIKNjRxbWpBJgdyfNkfd6BZmFBRiWT2IlMf"
# Connection con2:
select * from t1;
select @var_end_2 := j from t1;
select @var_2 = @var_end_2;
@var_2 = @var_end_2
1
select json_extract(j, '$[0]') from t1 where pkey = 1;
json_extract(j, '$[0]')
"bK5aLlMa6uxuOlGvLmuMyufDg1BVBQXkjcK4LefRYaMvMaofKh"
select json_extract(j, '$[1541]') from t1 where pkey = 1;
json_extract(j, '$[1541]')
"2JbfWHeglp4GYnqssBVVb33vwPTl3oS353gbJKH27MIf98WzH1Sq2WjztBkuxAx2DbdUvtW3DmgKsCI8BkyCEgB8rt0o3wqEXRjTIFUT08osL40Umxg1dp7U"
commit;
select json_extract(j, '$[0]') from t1 where pkey = 1;
json_extract(j, '$[0]')
"xiLE8tWA5urom7lmHL2uXzvNpMTREqg9W1OdssnymckWhTIzoK"
select json_extract(j, '$[1541]') from t1 where pkey = 1;
json_extract(j, '$[1541]')
"rKHmh668WIwCSTBo64er0OTku9DA80TzKklzps7LA4XaVgMbi0QiOrQG0cR8cu5ucptRfymn2HMVwi4ehUN3MlIKNjRxbWpBJgdyfNkfd6BZmFBRiWT2IlMf"
# Connection con3:
select * from t1;
select @var_end_3 := j from t1;
select @var_3 = @var_end_3;
@var_3 = @var_end_3
1
select json_extract(j, '$[0]') from t1 where pkey = 1;
json_extract(j, '$[0]')
"i7Gj36ybVh2muUFuc3nv5lQsi4tLu0na53K77GibviNpCcioeT"
select json_extract(j, '$[1541]') from t1 where pkey = 1;
json_extract(j, '$[1541]')
"2JbfWHeglp4GYnqssBVVb33vwPTl3oS353gbJKH27MIf98WzH1Sq2WjztBkuxAx2DbdUvtW3DmgKsCI8BkyCEgB8rt0o3wqEXRjTIFUT08osL40Umxg1dp7U"
commit;
select json_extract(j, '$[0]') from t1 where pkey = 1;
json_extract(j, '$[0]')
"xiLE8tWA5urom7lmHL2uXzvNpMTREqg9W1OdssnymckWhTIzoK"
select json_extract(j, '$[1541]') from t1 where pkey = 1;
json_extract(j, '$[1541]')
"rKHmh668WIwCSTBo64er0OTku9DA80TzKklzps7LA4XaVgMbi0QiOrQG0cR8cu5ucptRfymn2HMVwi4ehUN3MlIKNjRxbWpBJgdyfNkfd6BZmFBRiWT2IlMf"
# Connection con4:
select * from t1;
select @var_end_4 := j from t1;
select @var_4 = @var_end_4;
@var_4 = @var_end_4
1
select json_extract(j, '$[0]') from t1 where pkey = 1;
json_extract(j, '$[0]')
"i7Gj36ybVh2muUFuc3nv5lQsi4tLu0na53K77GibviNpCcioeT"
select json_extract(j, '$[1541]') from t1 where pkey = 1;
json_extract(j, '$[1541]')
"kjE8bxCSG4Q4fW5xdBBJm6z7vBjbxL4h3JpcE05U4TWhxceYlprXtoepzLQxfVcimQI0QNUUp1CmboLKcArVzTIwmhtRCW7wwQwKlOoaNyLwlgGNo5qnY9kJ"
commit;
select json_extract(j, '$[0]') from t1 where pkey = 1;
json_extract(j, '$[0]')
"xiLE8tWA5urom7lmHL2uXzvNpMTREqg9W1OdssnymckWhTIzoK"
select json_extract(j, '$[1541]') from t1 where pkey = 1;
json_extract(j, '$[1541]')
"rKHmh668WIwCSTBo64er0OTku9DA80TzKklzps7LA4XaVgMbi0QiOrQG0cR8cu5ucptRfymn2HMVwi4ehUN3MlIKNjRxbWpBJgdyfNkfd6BZmFBRiWT2IlMf"
# Connection con5:
select * from t1;
select @var_end_5 := j from t1;
select @var_5 = @var_end_5;
@var_5 = @var_end_5
1
select json_extract(j, '$[0]') from t1 where pkey = 1;
json_extract(j, '$[0]')
"qbi05qwzEqJxE6Wc2rWnVn8Jsz5P8niwOQwSEqRQgjOsnuSplz"
select json_extract(j, '$[1541]') from t1 where pkey = 1;
json_extract(j, '$[1541]')
"kjE8bxCSG4Q4fW5xdBBJm6z7vBjbxL4h3JpcE05U4TWhxceYlprXtoepzLQxfVcimQI0QNUUp1CmboLKcArVzTIwmhtRCW7wwQwKlOoaNyLwlgGNo5qnY9kJ"
commit;
select json_extract(j, '$[0]') from t1 where pkey = 1;
json_extract(j, '$[0]')
"xiLE8tWA5urom7lmHL2uXzvNpMTREqg9W1OdssnymckWhTIzoK"
select json_extract(j, '$[1541]') from t1 where pkey = 1;
json_extract(j, '$[1541]')
"rKHmh668WIwCSTBo64er0OTku9DA80TzKklzps7LA4XaVgMbi0QiOrQG0cR8cu5ucptRfymn2HMVwi4ehUN3MlIKNjRxbWpBJgdyfNkfd6BZmFBRiWT2IlMf"
# Connection con6:
select * from t1;
select @var_end_6 := j from t1;
select @var_6 = @var_end_6;
@var_6 = @var_end_6
1
select json_extract(j, '$[0]') from t1 where pkey = 1;
json_extract(j, '$[0]')
"qbi05qwzEqJxE6Wc2rWnVn8Jsz5P8niwOQwSEqRQgjOsnuSplz"
select json_extract(j, '$[1541]') from t1 where pkey = 1;
json_extract(j, '$[1541]')
"bGmjXcgc1mPhim6cEISdj6K7z71PxkOWy8FVju6kgTQPFUzRmS3VWNcTTbtQLFuJO7n71tpiKD5ah4zUU2zzOaSrBLFXZ9oxGb2GSpwn31Li3KCWLAThkvYt"
commit;
select json_extract(j, '$[0]') from t1 where pkey = 1;
json_extract(j, '$[0]')
"xiLE8tWA5urom7lmHL2uXzvNpMTREqg9W1OdssnymckWhTIzoK"
select json_extract(j, '$[1541]') from t1 where pkey = 1;
json_extract(j, '$[1541]')
"rKHmh668WIwCSTBo64er0OTku9DA80TzKklzps7LA4XaVgMbi0QiOrQG0cR8cu5ucptRfymn2HMVwi4ehUN3MlIKNjRxbWpBJgdyfNkfd6BZmFBRiWT2IlMf"
# Connection con7:
select * from t1;
select @var_end_7 := j from t1;
select @var_7 = @var_end_7;
@var_7 = @var_end_7
1
select json_extract(j, '$[0]') from t1 where pkey = 1;
json_extract(j, '$[0]')
"FlOouDj8mjOFYK0ZJLILdSpwcIdKB9EQucConvvaeHnBankr62"
select json_extract(j, '$[1541]') from t1 where pkey = 1;
json_extract(j, '$[1541]')
"bGmjXcgc1mPhim6cEISdj6K7z71PxkOWy8FVju6kgTQPFUzRmS3VWNcTTbtQLFuJO7n71tpiKD5ah4zUU2zzOaSrBLFXZ9oxGb2GSpwn31Li3KCWLAThkvYt"
commit;
select json_extract(j, '$[0]') from t1 where pkey = 1;
json_extract(j, '$[0]')
"xiLE8tWA5urom7lmHL2uXzvNpMTREqg9W1OdssnymckWhTIzoK"
select json_extract(j, '$[1541]') from t1 where pkey = 1;
json_extract(j, '$[1541]')
"rKHmh668WIwCSTBo64er0OTku9DA80TzKklzps7LA4XaVgMbi0QiOrQG0cR8cu5ucptRfymn2HMVwi4ehUN3MlIKNjRxbWpBJgdyfNkfd6BZmFBRiWT2IlMf"
# Connection con8:
select * from t1;
select @var_end_8 := j from t1;
select @var_8 = @var_end_8;
@var_8 = @var_end_8
1
select json_extract(j, '$[0]') from t1 where pkey = 1;
json_extract(j, '$[0]')
"FlOouDj8mjOFYK0ZJLILdSpwcIdKB9EQucConvvaeHnBankr62"
select json_extract(j, '$[1541]') from t1 where pkey = 1;
json_extract(j, '$[1541]')
"ChVze5HHORRarJA48yx1WcIJns4VkAYur1uT49jSYA2QTDSZ9Pafzrykj2GRAmKznCTrJCIsKKIlViJe7rJ5iHpQH3pPp9PaLqQf0iXK0n3WVMAaEUdujTIz"
commit;
select json_extract(j, '$[0]') from t1 where pkey = 1;
json_extract(j, '$[0]')
"xiLE8tWA5urom7lmHL2uXzvNpMTREqg9W1OdssnymckWhTIzoK"
select json_extract(j, '$[1541]') from t1 where pkey = 1;
json_extract(j, '$[1541]')
"rKHmh668WIwCSTBo64er0OTku9DA80TzKklzps7LA4XaVgMbi0QiOrQG0cR8cu5ucptRfymn2HMVwi4ehUN3MlIKNjRxbWpBJgdyfNkfd6BZmFBRiWT2IlMf"
# Connection con9:
select * from t1;
select @var_end_9 := j from t1;
select @var_9 = @var_end_9;
@var_9 = @var_end_9
1
select json_extract(j, '$[0]') from t1 where pkey = 1;
json_extract(j, '$[0]')
"U8MIHjqbZGEZwlrxWvRzHZXT1BOjcgi4o2M4mDfLRttOckJ6fi"
select json_extract(j, '$[1541]') from t1 where pkey = 1;
json_extract(j, '$[1541]')
"ChVze5HHORRarJA48yx1WcIJns4VkAYur1uT49jSYA2QTDSZ9Pafzrykj2GRAmKznCTrJCIsKKIlViJe7rJ5iHpQH3pPp9PaLqQf0iXK0n3WVMAaEUdujTIz"
commit;
select json_extract(j, '$[0]') from t1 where pkey = 1;
json_extract(j, '$[0]')
"xiLE8tWA5urom7lmHL2uXzvNpMTREqg9W1OdssnymckWhTIzoK"
select json_extract(j, '$[1541]') from t1 where pkey = 1;
json_extract(j, '$[1541]')
"rKHmh668WIwCSTBo64er0OTku9DA80TzKklzps7LA4XaVgMbi0QiOrQG0cR8cu5ucptRfymn2HMVwi4ehUN3MlIKNjRxbWpBJgdyfNkfd6BZmFBRiWT2IlMf"
# Connection con10:
select * from t1;
select @var_end_10 := j from t1;
select @var_10 = @var_end_10;
@var_10 = @var_end_10
1
select json_extract(j, '$[0]') from t1 where pkey = 1;
json_extract(j, '$[0]')
"U8MIHjqbZGEZwlrxWvRzHZXT1BOjcgi4o2M4mDfLRttOckJ6fi"
select json_extract(j, '$[1541]') from t1 where pkey = 1;
json_extract(j, '$[1541]')
"3vHYOJjk2JRiODkiFWvsqNjjjJR0N5iQ0zzMIg7I0W0Mhj4xF0p3LZk4qC4EFkeFjbb0IgIICHcu0grDeeHzB112B5GQpsdXUDXktn064cy2InGxRXwbWybg"
commit;
select json_extract(j, '$[0]') from t1 where pkey = 1;
json_extract(j, '$[0]')
"xiLE8tWA5urom7lmHL2uXzvNpMTREqg9W1OdssnymckWhTIzoK"
select json_extract(j, '$[1541]') from t1 where pkey = 1;
json_extract(j, '$[1541]')
"rKHmh668WIwCSTBo64er0OTku9DA80TzKklzps7LA4XaVgMbi0QiOrQG0cR8cu5ucptRfymn2HMVwi4ehUN3MlIKNjRxbWpBJgdyfNkfd6BZmFBRiWT2IlMf"
# Connection con11:
select * from t1;
select @var_end_11 := j from t1;
select @var_11 = @var_end_11;
@var_11 = @var_end_11
1
select json_extract(j, '$[0]') from t1 where pkey = 1;
json_extract(j, '$[0]')
"1p6phkM9xrtoctshVqhmdxh3SdcxZDdZ2hOhRipMXg99a1o3sW"
select json_extract(j, '$[1541]') from t1 where pkey = 1;
json_extract(j, '$[1541]')
"3vHYOJjk2JRiODkiFWvsqNjjjJR0N5iQ0zzMIg7I0W0Mhj4xF0p3LZk4qC4EFkeFjbb0IgIICHcu0grDeeHzB112B5GQpsdXUDXktn064cy2InGxRXwbWybg"
commit;
select json_extract(j, '$[0]') from t1 where pkey = 1;
json_extract(j, '$[0]')
"xiLE8tWA5urom7lmHL2uXzvNpMTREqg9W1OdssnymckWhTIzoK"
select json_extract(j, '$[1541]') from t1 where pkey = 1;
json_extract(j, '$[1541]')
"rKHmh668WIwCSTBo64er0OTku9DA80TzKklzps7LA4XaVgMbi0QiOrQG0cR8cu5ucptRfymn2HMVwi4ehUN3MlIKNjRxbWpBJgdyfNkfd6BZmFBRiWT2IlMf"
# Connection con12:
select * from t1;
select @var_end_12 := j from t1;
select @var_12 = @var_end_12;
@var_12 = @var_end_12
1
select json_extract(j, '$[0]') from t1 where pkey = 1;
json_extract(j, '$[0]')
"1p6phkM9xrtoctshVqhmdxh3SdcxZDdZ2hOhRipMXg99a1o3sW"
select json_extract(j, '$[1541]') from t1 where pkey = 1;
json_extract(j, '$[1541]')
"nTTUUu64rdFUCFBYxbEkvlQ2vy4j2uDnLfIoZOsO18qCNziIYx2UiTWbRYJRSUDo9VcirS4qau0wujESgFuMiPw7xFXOjkCtDmZ4CcslWthOctrG8jco8Yu4"
commit;
select json_extract(j, '$[0]') from t1 where pkey = 1;
json_extract(j, '$[0]')
"xiLE8tWA5urom7lmHL2uXzvNpMTREqg9W1OdssnymckWhTIzoK"
select json_extract(j, '$[1541]') from t1 where pkey = 1;
json_extract(j, '$[1541]')
"rKHmh668WIwCSTBo64er0OTku9DA80TzKklzps7LA4XaVgMbi0QiOrQG0cR8cu5ucptRfymn2HMVwi4ehUN3MlIKNjRxbWpBJgdyfNkfd6BZmFBRiWT2IlMf"
# Connection con13:
select * from t1;
select @var_end_13 := j from t1;
select @var_13 = @var_end_13;
@var_13 = @var_end_13
1
select json_extract(j, '$[0]') from t1 where pkey = 1;
json_extract(j, '$[0]')
"lRSV9cMMMtOYTGJ090MjsBz0vcp18j5u8VNH7jbTaz04FJ2NIO"
select json_extract(j, '$[1541]') from t1 where pkey = 1;
json_extract(j, '$[1541]')
"nTTUUu64rdFUCFBYxbEkvlQ2vy4j2uDnLfIoZOsO18qCNziIYx2UiTWbRYJRSUDo9VcirS4qau0wujESgFuMiPw7xFXOjkCtDmZ4CcslWthOctrG8jco8Yu4"
commit;
select json_extract(j, '$[0]') from t1 where pkey = 1;
json_extract(j, '$[0]')
"xiLE8tWA5urom7lmHL2uXzvNpMTREqg9W1OdssnymckWhTIzoK"
select json_extract(j, '$[1541]') from t1 where pkey = 1;
json_extract(j, '$[1541]')
"rKHmh668WIwCSTBo64er0OTku9DA80TzKklzps7LA4XaVgMbi0QiOrQG0cR8cu5ucptRfymn2HMVwi4ehUN3MlIKNjRxbWpBJgdyfNkfd6BZmFBRiWT2IlMf"
# Connection con14:
select * from t1;
select @var_end_14 := j from t1;
select @var_14 = @var_end_14;
@var_14 = @var_end_14
1
select json_extract(j, '$[0]') from t1 where pkey = 1;
json_extract(j, '$[0]')
"lRSV9cMMMtOYTGJ090MjsBz0vcp18j5u8VNH7jbTaz04FJ2NIO"
select json_extract(j, '$[1541]') from t1 where pkey = 1;
json_extract(j, '$[1541]')
"4Aa4ATexUmeYem3119iccHbaLpuLAAjCKHESksOFd2nHnoHoxzPYGy8Zl0svAc6SrKvcDHpoJa34OItKIGsWE0401wt9WzcMIXyTolH5JIAfb1zrHrLTqPRp"
commit;
select json_extract(j, '$[0]') from t1 where pkey = 1;
json_extract(j, '$[0]')
"xiLE8tWA5urom7lmHL2uXzvNpMTREqg9W1OdssnymckWhTIzoK"
select json_extract(j, '$[1541]') from t1 where pkey = 1;
json_extract(j, '$[1541]')
"rKHmh668WIwCSTBo64er0OTku9DA80TzKklzps7LA4XaVgMbi0QiOrQG0cR8cu5ucptRfymn2HMVwi4ehUN3MlIKNjRxbWpBJgdyfNkfd6BZmFBRiWT2IlMf"
# Connection con15:
select * from t1;
select @var_end_15 := j from t1;
select @var_15 = @var_end_15;
@var_15 = @var_end_15
1
select json_extract(j, '$[0]') from t1 where pkey = 1;
json_extract(j, '$[0]')
"KJyoGaAY561rrIvAZ3q84nzJdKmTiCG2VColnzKq5Lgvcb39er"
select json_extract(j, '$[1541]') from t1 where pkey = 1;
json_extract(j, '$[1541]')
"4Aa4ATexUmeYem3119iccHbaLpuLAAjCKHESksOFd2nHnoHoxzPYGy8Zl0svAc6SrKvcDHpoJa34OItKIGsWE0401wt9WzcMIXyTolH5JIAfb1zrHrLTqPRp"
commit;
select json_extract(j, '$[0]') from t1 where pkey = 1;
json_extract(j, '$[0]')
"xiLE8tWA5urom7lmHL2uXzvNpMTREqg9W1OdssnymckWhTIzoK"
select json_extract(j, '$[1541]') from t1 where pkey = 1;
json_extract(j, '$[1541]')
"rKHmh668WIwCSTBo64er0OTku9DA80TzKklzps7LA4XaVgMbi0QiOrQG0cR8cu5ucptRfymn2HMVwi4ehUN3MlIKNjRxbWpBJgdyfNkfd6BZmFBRiWT2IlMf"
# Connection con16:
select * from t1;
select @var_end_16 := j from t1;
select @var_16 = @var_end_16;
@var_16 = @var_end_16
1
select json_extract(j, '$[0]') from t1 where pkey = 1;
json_extract(j, '$[0]')
"KJyoGaAY561rrIvAZ3q84nzJdKmTiCG2VColnzKq5Lgvcb39er"
select json_extract(j, '$[1541]') from t1 where pkey = 1;
json_extract(j, '$[1541]')
"HgfGzIYjjGtzGO95Aw2Sl7nP0Ny4WcvnGY1DoauXooU5Ce8KYAmHFYgGteIOED9UkBfYja6XMYaYAirhqby67fK1HcNUnWwXhc6QCAwWiW4rDtY3TW7a9RZP"
commit;
select json_extract(j, '$[0]') from t1 where pkey = 1;
json_extract(j, '$[0]')
"xiLE8tWA5urom7lmHL2uXzvNpMTREqg9W1OdssnymckWhTIzoK"
select json_extract(j, '$[1541]') from t1 where pkey = 1;
json_extract(j, '$[1541]')
"rKHmh668WIwCSTBo64er0OTku9DA80TzKklzps7LA4XaVgMbi0QiOrQG0cR8cu5ucptRfymn2HMVwi4ehUN3MlIKNjRxbWpBJgdyfNkfd6BZmFBRiWT2IlMf"
# Connection con17:
select * from t1;
select @var_end_17 := j from t1;
select @var_17 = @var_end_17;
@var_17 = @var_end_17
1
select json_extract(j, '$[0]') from t1 where pkey = 1;
json_extract(j, '$[0]')
"3wtrRpO8RSXbcT7JxAAA1gEUCL3KlcjoXcdyP04rSZQ30WMygU"
select json_extract(j, '$[1541]') from t1 where pkey = 1;
json_extract(j, '$[1541]')
"HgfGzIYjjGtzGO95Aw2Sl7nP0Ny4WcvnGY1DoauXooU5Ce8KYAmHFYgGteIOED9UkBfYja6XMYaYAirhqby67fK1HcNUnWwXhc6QCAwWiW4rDtY3TW7a9RZP"
commit;
select json_extract(j, '$[0]') from t1 where pkey = 1;
json_extract(j, '$[0]')
"xiLE8tWA5urom7lmHL2uXzvNpMTREqg9W1OdssnymckWhTIzoK"
select json_extract(j, '$[1541]') from t1 where pkey = 1;
json_extract(j, '$[1541]')
"rKHmh668WIwCSTBo64er0OTku9DA80TzKklzps7LA4XaVgMbi0QiOrQG0cR8cu5ucptRfymn2HMVwi4ehUN3MlIKNjRxbWpBJgdyfNkfd6BZmFBRiWT2IlMf"
# Connection con18:
select * from t1;
select @var_end_18 := j from t1;
select @var_18 = @var_end_18;
@var_18 = @var_end_18
1
select json_extract(j, '$[0]') from t1 where pkey = 1;
json_extract(j, '$[0]')
"3wtrRpO8RSXbcT7JxAAA1gEUCL3KlcjoXcdyP04rSZQ30WMygU"
select json_extract(j, '$[1541]') from t1 where pkey = 1;
json_extract(j, '$[1541]')
"6h8KAIeDcNnJ9KtnGJlJ8BsYEt4Ypi0vO8EYRsj3FWLMrE95VsOd4HAI8CrxtrqHy4nPuUQ70lUpydvTWH5aYFqePfZIXQXTUIsPmIWn20aycVR6lUgJhUw7"
commit;
select json_extract(j, '$[0]') from t1 where pkey = 1;
json_extract(j, '$[0]')
"xiLE8tWA5urom7lmHL2uXzvNpMTREqg9W1OdssnymckWhTIzoK"
select json_extract(j, '$[1541]') from t1 where pkey = 1;
json_extract(j, '$[1541]')
"rKHmh668WIwCSTBo64er0OTku9DA80TzKklzps7LA4XaVgMbi0QiOrQG0cR8cu5ucptRfymn2HMVwi4ehUN3MlIKNjRxbWpBJgdyfNkfd6BZmFBRiWT2IlMf"
# Connection con19:
select * from t1;
select @var_end_19 := j from t1;
select @var_19 = @var_end_19;
@var_19 = @var_end_19
1
select json_extract(j, '$[0]') from t1 where pkey = 1;
json_extract(j, '$[0]')
"AVNfvv8QB0pyGJjGKHEwle2W8gpq8jvIFIxAB3YL1NJIf0WzHl"
select json_extract(j, '$[1541]') from t1 where pkey = 1;
json_extract(j, '$[1541]')
"6h8KAIeDcNnJ9KtnGJlJ8BsYEt4Ypi0vO8EYRsj3FWLMrE95VsOd4HAI8CrxtrqHy4nPuUQ70lUpydvTWH5aYFqePfZIXQXTUIsPmIWn20aycVR6lUgJhUw7"
commit;
select json_extract(j, '$[0]') from t1 where pkey = 1;
json_extract(j, '$[0]')
"xiLE8tWA5urom7lmHL2uXzvNpMTREqg9W1OdssnymckWhTIzoK"
select json_extract(j, '$[1541]') from t1 where pkey = 1;
json_extract(j, '$[1541]')
"rKHmh668WIwCSTBo64er0OTku9DA80TzKklzps7LA4XaVgMbi0QiOrQG0cR8cu5ucptRfymn2HMVwi4ehUN3MlIKNjRxbWpBJgdyfNkfd6BZmFBRiWT2IlMf"
# Connection con20:
select * from t1;
select @var_end_20 := j from t1;
select @var_20 = @var_end_20;
@var_20 = @var_end_20
1
select json_extract(j, '$[0]') from t1 where pkey = 1;
json_extract(j, '$[0]')
"AVNfvv8QB0pyGJjGKHEwle2W8gpq8jvIFIxAB3YL1NJIf0WzHl"
select json_extract(j, '$[1541]') from t1 where pkey = 1;
json_extract(j, '$[1541]')
"t2PtYVXMJf3EyIVtRgvz1wLIC0GjxWSqWph5KEPerQsnjNhA2a91WUKjSYQP4sDbhuez81d0RUnApSIp0QrXs9ELheimUwL9qz8x0kvPCgYz7qp7Eec7lqQS"
commit;
select json_extract(j, '$[0]') from t1 where pkey = 1;
json_extract(j, '$[0]')
"xiLE8tWA5urom7lmHL2uXzvNpMTREqg9W1OdssnymckWhTIzoK"
select json_extract(j, '$[1541]') from t1 where pkey = 1;
json_extract(j, '$[1541]')
"rKHmh668WIwCSTBo64er0OTku9DA80TzKklzps7LA4XaVgMbi0QiOrQG0cR8cu5ucptRfymn2HMVwi4ehUN3MlIKNjRxbWpBJgdyfNkfd6BZmFBRiWT2IlMf"
# Connection con21:
select * from t1;
select @var_end_21 := j from t1;
select @var_21 = @var_end_21;
@var_21 = @var_end_21
1
select json_extract(j, '$[0]') from t1 where pkey = 1;
json_extract(j, '$[0]')
"S8Cw4X3tUAqUsju2NQ1UGoaVQCaB30eV8oQDKR6obuHRdBT0bT"
select json_extract(j, '$[1541]') from t1 where pkey = 1;
json_extract(j, '$[1541]')
"t2PtYVXMJf3EyIVtRgvz1wLIC0GjxWSqWph5KEPerQsnjNhA2a91WUKjSYQP4sDbhuez81d0RUnApSIp0QrXs9ELheimUwL9qz8x0kvPCgYz7qp7Eec7lqQS"
commit;
select json_extract(j, '$[0]') from t1 where pkey = 1;
json_extract(j, '$[0]')
"xiLE8tWA5urom7lmHL2uXzvNpMTREqg9W1OdssnymckWhTIzoK"
select json_extract(j, '$[1541]') from t1 where pkey = 1;
json_extract(j, '$[1541]')
"rKHmh668WIwCSTBo64er0OTku9DA80TzKklzps7LA4XaVgMbi0QiOrQG0cR8cu5ucptRfymn2HMVwi4ehUN3MlIKNjRxbWpBJgdyfNkfd6BZmFBRiWT2IlMf"
# Connection con22:
select * from t1;
select @var_end_22 := j from t1;
select @var_22 = @var_end_22;
@var_22 = @var_end_22
1
select json_extract(j, '$[0]') from t1 where pkey = 1;
json_extract(j, '$[0]')
"S8Cw4X3tUAqUsju2NQ1UGoaVQCaB30eV8oQDKR6obuHRdBT0bT"
select json_extract(j, '$[1541]') from t1 where pkey = 1;
json_extract(j, '$[1541]')
"TpH3IgFsrGsTk1I8CcZGO9Afalo2jNVADmDVSRMIhElPD1XPb5f0EnfmWUoErJO24aWU1smg4W6IVdh7gL5u6kfdCTr4lF4pnaHoS2TXYZn3AS8rnDjsyOV8"
commit;
select json_extract(j, '$[0]') from t1 where pkey = 1;
json_extract(j, '$[0]')
"xiLE8tWA5urom7lmHL2uXzvNpMTREqg9W1OdssnymckWhTIzoK"
select json_extract(j, '$[1541]') from t1 where pkey = 1;
json_extract(j, '$[1541]')
"rKHmh668WIwCSTBo64er0OTku9DA80TzKklzps7LA4XaVgMbi0QiOrQG0cR8cu5ucptRfymn2HMVwi4ehUN3MlIKNjRxbWpBJgdyfNkfd6BZmFBRiWT2IlMf"
# Connection con23:
select * from t1;
select @var_end_23 := j from t1;
select @var_23 = @var_end_23;
@var_23 = @var_end_23
1
select json_extract(j, '$[0]') from t1 where pkey = 1;
json_extract(j, '$[0]')
"qKAbXFOLpd7GfalD9YFI0L9mZqcVF5d5Poeu12FqfN4JxpU5Lh"
select json_extract(j, '$[1541]') from t1 where pkey = 1;
json_extract(j, '$[1541]')
"TpH3IgFsrGsTk1I8CcZGO9Afalo2jNVADmDVSRMIhElPD1XPb5f0EnfmWUoErJO24aWU1smg4W6IVdh7gL5u6kfdCTr4lF4pnaHoS2TXYZn3AS8rnDjsyOV8"
commit;
select json_extract(j, '$[0]') from t1 where pkey = 1;
json_extract(j, '$[0]')
"xiLE8tWA5urom7lmHL2uXzvNpMTREqg9W1OdssnymckWhTIzoK"
select json_extract(j, '$[1541]') from t1 where pkey = 1;
json_extract(j, '$[1541]')
"rKHmh668WIwCSTBo64er0OTku9DA80TzKklzps7LA4XaVgMbi0QiOrQG0cR8cu5ucptRfymn2HMVwi4ehUN3MlIKNjRxbWpBJgdyfNkfd6BZmFBRiWT2IlMf"
# Connection con24:
select * from t1;
select @var_end_24 := j from t1;
select @var_24 = @var_end_24;
@var_24 = @var_end_24
1
select json_extract(j, '$[0]') from t1 where pkey = 1;
json_extract(j, '$[0]')
"qKAbXFOLpd7GfalD9YFI0L9mZqcVF5d5Poeu12FqfN4JxpU5Lh"
select json_extract(j, '$[1541]') from t1 where pkey = 1;
json_extract(j, '$[1541]')
"NK3U4cKg5XlicAUG4VGIKudOBaEfdXNyrQQv0lb5IMltUG7XjMn3EQQPyc4c9RY1pzwpiWu0qgrLuxqdJbfX15uzhyZoO8pB5k1nGtl6ZdPRYD3roiMplEnQ"
commit;
select json_extract(j, '$[0]') from t1 where pkey = 1;
json_extract(j, '$[0]')
"xiLE8tWA5urom7lmHL2uXzvNpMTREqg9W1OdssnymckWhTIzoK"
select json_extract(j, '$[1541]') from t1 where pkey = 1;
json_extract(j, '$[1541]')
"rKHmh668WIwCSTBo64er0OTku9DA80TzKklzps7LA4XaVgMbi0QiOrQG0cR8cu5ucptRfymn2HMVwi4ehUN3MlIKNjRxbWpBJgdyfNkfd6BZmFBRiWT2IlMf"
# Connection con25:
select * from t1;
select @var_end_25 := j from t1;
select @var_25 = @var_end_25;
@var_25 = @var_end_25
1
select json_extract(j, '$[0]') from t1 where pkey = 1;
json_extract(j, '$[0]')
"AKEWQ4iVmhI2a468fWZDhc2WKMJ3a6TkPiFpkxLWedWEfcMI6u"
select json_extract(j, '$[1541]') from t1 where pkey = 1;
json_extract(j, '$[1541]')
"NK3U4cKg5XlicAUG4VGIKudOBaEfdXNyrQQv0lb5IMltUG7XjMn3EQQPyc4c9RY1pzwpiWu0qgrLuxqdJbfX15uzhyZoO8pB5k1nGtl6ZdPRYD3roiMplEnQ"
commit;
select json_extract(j, '$[0]') from t1 where pkey = 1;
json_extract(j, '$[0]')
"xiLE8tWA5urom7lmHL2uXzvNpMTREqg9W1OdssnymckWhTIzoK"
select json_extract(j, '$[1541]') from t1 where pkey = 1;
json_extract(j, '$[1541]')
"rKHmh668WIwCSTBo64er0OTku9DA80TzKklzps7LA4XaVgMbi0QiOrQG0cR8cu5ucptRfymn2HMVwi4ehUN3MlIKNjRxbWpBJgdyfNkfd6BZmFBRiWT2IlMf"
# Connection con26:
select * from t1;
select @var_end_26 := j from t1;
select @var_26 = @var_end_26;
@var_26 = @var_end_26
1
select json_extract(j, '$[0]') from t1 where pkey = 1;
json_extract(j, '$[0]')
"AKEWQ4iVmhI2a468fWZDhc2WKMJ3a6TkPiFpkxLWedWEfcMI6u"
select json_extract(j, '$[1541]') from t1 where pkey = 1;
json_extract(j, '$[1541]')
"ToWTIppbsNgM652LumIFGurm6UMTlTNEFrgXgV8XrmrxrtGkdWxrQmdWHzx0QIEfAuCoOJJD5AAv1OfcsaTIN4me2ieSyq86jIv5ZEIfNQYOoBzglSw8VgkX"
commit;
select json_extract(j, '$[0]') from t1 where pkey = 1;
json_extract(j, '$[0]')
"xiLE8tWA5urom7lmHL2uXzvNpMTREqg9W1OdssnymckWhTIzoK"
select json_extract(j, '$[1541]') from t1 where pkey = 1;
json_extract(j, '$[1541]')
"rKHmh668WIwCSTBo64er0OTku9DA80TzKklzps7LA4XaVgMbi0QiOrQG0cR8cu5ucptRfymn2HMVwi4ehUN3MlIKNjRxbWpBJgdyfNkfd6BZmFBRiWT2IlMf"
# Connection con27:
select * from t1;
select @var_end_27 := j from t1;
select @var_27 = @var_end_27;
@var_27 = @var_end_27
1
select json_extract(j, '$[0]') from t1 where pkey = 1;
json_extract(j, '$[0]')
"OMzND5TuMMzvZHYwh6ITFF91g37Bjsi6CfRNjsH5FE0mVXgAby"
select json_extract(j, '$[1541]') from t1 where pkey = 1;
json_extract(j, '$[1541]')
"ToWTIppbsNgM652LumIFGurm6UMTlTNEFrgXgV8XrmrxrtGkdWxrQmdWHzx0QIEfAuCoOJJD5AAv1OfcsaTIN4me2ieSyq86jIv5ZEIfNQYOoBzglSw8VgkX"
commit;
select json_extract(j, '$[0]') from t1 where pkey = 1;
json_extract(j, '$[0]')
"xiLE8tWA5urom7lmHL2uXzvNpMTREqg9W1OdssnymckWhTIzoK"
select json_extract(j, '$[1541]') from t1 where pkey = 1;
json_extract(j, '$[1541]')
"rKHmh668WIwCSTBo64er0OTku9DA80TzKklzps7LA4XaVgMbi0QiOrQG0cR8cu5ucptRfymn2HMVwi4ehUN3MlIKNjRxbWpBJgdyfNkfd6BZmFBRiWT2IlMf"
# Connection con28:
select * from t1;
select @var_end_28 := j from t1;
select @var_28 = @var_end_28;
@var_28 = @var_end_28
1
select json_extract(j, '$[0]') from t1 where pkey = 1;
json_extract(j, '$[0]')
"OMzND5TuMMzvZHYwh6ITFF91g37Bjsi6CfRNjsH5FE0mVXgAby"
select json_extract(j, '$[1541]') from t1 where pkey = 1;
json_extract(j, '$[1541]')
"brCkqslx3VnjZyO0L5sbA5p9rJgXRFU36gluWXsZ0dIZbeXviNWsTJzKcdq4tI7xwssSNi1NLHuvtRobpKSGdPYE3OIueNraDj2bR1wlIreAGSj5kBLLbuZc"
commit;
select json_extract(j, '$[0]') from t1 where pkey = 1;
json_extract(j, '$[0]')
"xiLE8tWA5urom7lmHL2uXzvNpMTREqg9W1OdssnymckWhTIzoK"
select json_extract(j, '$[1541]') from t1 where pkey = 1;
json_extract(j, '$[1541]')
"rKHmh668WIwCSTBo64er0OTku9DA80TzKklzps7LA4XaVgMbi0QiOrQG0cR8cu5ucptRfymn2HMVwi4ehUN3MlIKNjRxbWpBJgdyfNkfd6BZmFBRiWT2IlMf"
# Connection con29:
select * from t1;
select @var_end_29 := j from t1;
select @var_29 = @var_end_29;
@var_29 = @var_end_29
1
select json_extract(j, '$[0]') from t1 where pkey = 1;
json_extract(j, '$[0]')
"GpWvCLVO5WzUXvFokry1Jh43rOPQIw2WmWPyrvKuPJPwDckvUi"
select json_extract(j, '$[1541]') from t1 where pkey = 1;
json_extract(j, '$[1541]')
"brCkqslx3VnjZyO0L5sbA5p9rJgXRFU36gluWXsZ0dIZbeXviNWsTJzKcdq4tI7xwssSNi1NLHuvtRobpKSGdPYE3OIueNraDj2bR1wlIreAGSj5kBLLbuZc"
commit;
select json_extract(j, '$[0]') from t1 where pkey = 1;
json_extract(j, '$[0]')
"xiLE8tWA5urom7lmHL2uXzvNpMTREqg9W1OdssnymckWhTIzoK"
select json_extract(j, '$[1541]') from t1 where pkey = 1;
json_extract(j, '$[1541]')
"rKHmh668WIwCSTBo64er0OTku9DA80TzKklzps7LA4XaVgMbi0QiOrQG0cR8cu5ucptRfymn2HMVwi4ehUN3MlIKNjRxbWpBJgdyfNkfd6BZmFBRiWT2IlMf"
# Connection con30:
select * from t1;
select @var_end_30 := j from t1;
select @var_30 = @var_end_30;
@var_30 = @var_end_30
1
select json_extract(j, '$[0]') from t1 where pkey = 1;
json_extract(j, '$[0]')
"GpWvCLVO5WzUXvFokry1Jh43rOPQIw2WmWPyrvKuPJPwDckvUi"
select json_extract(j, '$[1541]') from t1 where pkey = 1;
json_extract(j, '$[1541]')
"wlO1nFPAff6h9qBZn0S7vrRIncsYXMES6cRrpq1UT59cwKBjLbqESFWGrOmNjypnZGeO4ftVi07eJHNcsEqJTKXJgJeNFTAohoDlR4GA4LoNaAzRMnkp7H6m"
commit;
select json_extract(j, '$[0]') from t1 where pkey = 1;
json_extract(j, '$[0]')
"xiLE8tWA5urom7lmHL2uXzvNpMTREqg9W1OdssnymckWhTIzoK"
select json_extract(j, '$[1541]') from t1 where pkey = 1;
json_extract(j, '$[1541]')
"rKHmh668WIwCSTBo64er0OTku9DA80TzKklzps7LA4XaVgMbi0QiOrQG0cR8cu5ucptRfymn2HMVwi4ehUN3MlIKNjRxbWpBJgdyfNkfd6BZmFBRiWT2IlMf"
# Connection con31:
select * from t1;
select @var_end_31 := j from t1;
select @var_31 = @var_end_31;
@var_31 = @var_end_31
1
select json_extract(j, '$[0]') from t1 where pkey = 1;
json_extract(j, '$[0]')
"Yk9nBKas6nbWpper9SDjaAAwyuk39qphZzTkH3bNoCtb0XS9yf"
select json_extract(j, '$[1541]') from t1 where pkey = 1;
json_extract(j, '$[1541]')
"wlO1nFPAff6h9qBZn0S7vrRIncsYXMES6cRrpq1UT59cwKBjLbqESFWGrOmNjypnZGeO4ftVi07eJHNcsEqJTKXJgJeNFTAohoDlR4GA4LoNaAzRMnkp7H6m"
commit;
select json_extract(j, '$[0]') from t1 where pkey = 1;
json_extract(j, '$[0]')
"xiLE8tWA5urom7lmHL2uXzvNpMTREqg9W1OdssnymckWhTIzoK"
select json_extract(j, '$[1541]') from t1 where pkey = 1;
json_extract(j, '$[1541]')
"rKHmh668WIwCSTBo64er0OTku9DA80TzKklzps7LA4XaVgMbi0QiOrQG0cR8cu5ucptRfymn2HMVwi4ehUN3MlIKNjRxbWpBJgdyfNkfd6BZmFBRiWT2IlMf"
# Connection con32:
select * from t1;
select @var_end_32 := j from t1;
select @var_32 = @var_end_32;
@var_32 = @var_end_32
1
select json_extract(j, '$[0]') from t1 where pkey = 1;
json_extract(j, '$[0]')
"Yk9nBKas6nbWpper9SDjaAAwyuk39qphZzTkH3bNoCtb0XS9yf"
select json_extract(j, '$[1541]') from t1 where pkey = 1;
json_extract(j, '$[1541]')
"sWq1TmvBp5zfkYcDHtEsG228d0d69Zj06Z1XLui9zhmiEOvVHANVANbmODqVmZVq7UNQP3ZMlL4zhySy6nSGA30WEq21OVpV0BtNERjxkmuSkKOq7q4Gs3k4"
commit;
select json_extract(j, '$[0]') from t1 where pkey = 1;
json_extract(j, '$[0]')
"xiLE8tWA5urom7lmHL2uXzvNpMTREqg9W1OdssnymckWhTIzoK"
select json_extract(j, '$[1541]') from t1 where pkey = 1;
json_extract(j, '$[1541]')
"rKHmh668WIwCSTBo64er0OTku9DA80TzKklzps7LA4XaVgMbi0QiOrQG0cR8cu5ucptRfymn2HMVwi4ehUN3MlIKNjRxbWpBJgdyfNkfd6BZmFBRiWT2IlMf"
# Connection con33:
select * from t1;
select @var_end_33 := j from t1;
select @var_33 = @var_end_33;
@var_33 = @var_end_33
1
select json_extract(j, '$[0]') from t1 where pkey = 1;
json_extract(j, '$[0]')
"tk3FGtiE2cbE1IAl42DmNaaUOdiEgTJXDMnRFVfH5EU6VesXg3"
select json_extract(j, '$[1541]') from t1 where pkey = 1;
json_extract(j, '$[1541]')
"sWq1TmvBp5zfkYcDHtEsG228d0d69Zj06Z1XLui9zhmiEOvVHANVANbmODqVmZVq7UNQP3ZMlL4zhySy6nSGA30WEq21OVpV0BtNERjxkmuSkKOq7q4Gs3k4"
commit;
select json_extract(j, '$[0]') from t1 where pkey = 1;
json_extract(j, '$[0]')
"xiLE8tWA5urom7lmHL2uXzvNpMTREqg9W1OdssnymckWhTIzoK"
select json_extract(j, '$[1541]') from t1 where pkey = 1;
json_extract(j, '$[1541]')
"rKHmh668WIwCSTBo64er0OTku9DA80TzKklzps7LA4XaVgMbi0QiOrQG0cR8cu5ucptRfymn2HMVwi4ehUN3MlIKNjRxbWpBJgdyfNkfd6BZmFBRiWT2IlMf"
# Connection con34:
select * from t1;
select @var_end_34 := j from t1;
select @var_34 = @var_end_34;
@var_34 = @var_end_34
1
select json_extract(j, '$[0]') from t1 where pkey = 1;
json_extract(j, '$[0]')
"tk3FGtiE2cbE1IAl42DmNaaUOdiEgTJXDMnRFVfH5EU6VesXg3"
select json_extract(j, '$[1541]') from t1 where pkey = 1;
json_extract(j, '$[1541]')
"K3bsW0VEE9fVhtsSK5vyL1Ap7fTxB9zTDaLhYpvlwbGdS83kEzgZ0rM5Up1dy069YQq7FksBJ6nlFqTRnAynzKrR9s35q9DOZ1TmlJw2QjlfXF4LN26KKxjR"
commit;
select json_extract(j, '$[0]') from t1 where pkey = 1;
json_extract(j, '$[0]')
"xiLE8tWA5urom7lmHL2uXzvNpMTREqg9W1OdssnymckWhTIzoK"
select json_extract(j, '$[1541]') from t1 where pkey = 1;
json_extract(j, '$[1541]')
"rKHmh668WIwCSTBo64er0OTku9DA80TzKklzps7LA4XaVgMbi0QiOrQG0cR8cu5ucptRfymn2HMVwi4ehUN3MlIKNjRxbWpBJgdyfNkfd6BZmFBRiWT2IlMf"
# Connection con35:
select * from t1;
select @var_end_35 := j from t1;
select @var_35 = @var_end_35;
@var_35 = @var_end_35
1
select json_extract(j, '$[0]') from t1 where pkey = 1;
json_extract(j, '$[0]')
"nmWdwh0TjTGSnCVDtGqQTsjquoAEjufXe98ap82WcIyNSRYJgM"
select json_extract(j, '$[1541]') from t1 where pkey = 1;
json_extract(j, '$[1541]')
"K3bsW0VEE9fVhtsSK5vyL1Ap7fTxB9zTDaLhYpvlwbGdS83kEzgZ0rM5Up1dy069YQq7FksBJ6nlFqTRnAynzKrR9s35q9DOZ1TmlJw2QjlfXF4LN26KKxjR"
commit;
select json_extract(j, '$[0]') from t1 where pkey = 1;
json_extract(j, '$[0]')
"xiLE8tWA5urom7lmHL2uXzvNpMTREqg9W1OdssnymckWhTIzoK"
select json_extract(j, '$[1541]') from t1 where pkey = 1;
json_extract(j, '$[1541]')
"rKHmh668WIwCSTBo64er0OTku9DA80TzKklzps7LA4XaVgMbi0QiOrQG0cR8cu5ucptRfymn2HMVwi4ehUN3MlIKNjRxbWpBJgdyfNkfd6BZmFBRiWT2IlMf"
# Connection con36:
select * from t1;
select @var_end_36 := j from t1;
select @var_36 = @var_end_36;
@var_36 = @var_end_36
1
select json_extract(j, '$[0]') from t1 where pkey = 1;
json_extract(j, '$[0]')
"nmWdwh0TjTGSnCVDtGqQTsjquoAEjufXe98ap82WcIyNSRYJgM"
select json_extract(j, '$[1541]') from t1 where pkey = 1;
json_extract(j, '$[1541]')
"h9ERy8D6KwyxRd4aBtiDPITMdtnBCTXublJZrWd9Qc6sFBSO28cSP5o2xZE91j1aTK7KokUFMY7ZjXymdYC2by3YXHiWyj6R2DmqyE5ImAsUfoEJMQJxOMWt"
commit;
select json_extract(j, '$[0]') from t1 where pkey = 1;
json_extract(j, '$[0]')
"xiLE8tWA5urom7lmHL2uXzvNpMTREqg9W1OdssnymckWhTIzoK"
select json_extract(j, '$[1541]') from t1 where pkey = 1;
json_extract(j, '$[1541]')
"rKHmh668WIwCSTBo64er0OTku9DA80TzKklzps7LA4XaVgMbi0QiOrQG0cR8cu5ucptRfymn2HMVwi4ehUN3MlIKNjRxbWpBJgdyfNkfd6BZmFBRiWT2IlMf"
# Connection con37:
select * from t1;
select @var_end_37 := j from t1;
select @var_37 = @var_end_37;
@var_37 = @var_end_37
1
select json_extract(j, '$[0]') from t1 where pkey = 1;
json_extract(j, '$[0]')
"bCQatW1vklmgzpykyoEdcQuwoEsAaM3CYRkRyjLgV5MSsICq7O"
select json_extract(j, '$[1541]') from t1 where pkey = 1;
json_extract(j, '$[1541]')
"h9ERy8D6KwyxRd4aBtiDPITMdtnBCTXublJZrWd9Qc6sFBSO28cSP5o2xZE91j1aTK7KokUFMY7ZjXymdYC2by3YXHiWyj6R2DmqyE5ImAsUfoEJMQJxOMWt"
commit;
select json_extract(j, '$[0]') from t1 where pkey = 1;
json_extract(j, '$[0]')
"xiLE8tWA5urom7lmHL2uXzvNpMTREqg9W1OdssnymckWhTIzoK"
select json_extract(j, '$[1541]') from t1 where pkey = 1;
json_extract(j, '$[1541]')
"rKHmh668WIwCSTBo64er0OTku9DA80TzKklzps7LA4XaVgMbi0QiOrQG0cR8cu5ucptRfymn2HMVwi4ehUN3MlIKNjRxbWpBJgdyfNkfd6BZmFBRiWT2IlMf"
# Connection con38:
select * from t1;
select @var_end_38 := j from t1;
select @var_38 = @var_end_38;
@var_38 = @var_end_38
1
select json_extract(j, '$[0]') from t1 where pkey = 1;
json_extract(j, '$[0]')
"bCQatW1vklmgzpykyoEdcQuwoEsAaM3CYRkRyjLgV5MSsICq7O"
select json_extract(j, '$[1541]') from t1 where pkey = 1;
json_extract(j, '$[1541]')
"ShmMeaYUk7qmHOD1n9k6pFB9g4SqsXFKEzfqaDKKKA6bWKaIRLOHYaOEcq3UNGnaFSQpdl8wtCVQU6iwP6Dveb8GQBjlRWLgwmUZVcTOozmJ3UFQZQJD1RSP"
commit;
select json_extract(j, '$[0]') from t1 where pkey = 1;
json_extract(j, '$[0]')
"xiLE8tWA5urom7lmHL2uXzvNpMTREqg9W1OdssnymckWhTIzoK"
select json_extract(j, '$[1541]') from t1 where pkey = 1;
json_extract(j, '$[1541]')
"rKHmh668WIwCSTBo64er0OTku9DA80TzKklzps7LA4XaVgMbi0QiOrQG0cR8cu5ucptRfymn2HMVwi4ehUN3MlIKNjRxbWpBJgdyfNkfd6BZmFBRiWT2IlMf"
# Connection con39:
select * from t1;
select @var_end_39 := j from t1;
select @var_39 = @var_end_39;
@var_39 = @var_end_39
1
select json_extract(j, '$[0]') from t1 where pkey = 1;
json_extract(j, '$[0]')
"aBB1hUgdGAAjke6YbspcN40wUJ7UlZrJk2LPXz2l9DTtpZPORF"
select json_extract(j, '$[1541]') from t1 where pkey = 1;
json_extract(j, '$[1541]')
"ShmMeaYUk7qmHOD1n9k6pFB9g4SqsXFKEzfqaDKKKA6bWKaIRLOHYaOEcq3UNGnaFSQpdl8wtCVQU6iwP6Dveb8GQBjlRWLgwmUZVcTOozmJ3UFQZQJD1RSP"
commit;
select json_extract(j, '$[0]') from t1 where pkey = 1;
json_extract(j, '$[0]')
"xiLE8tWA5urom7lmHL2uXzvNpMTREqg9W1OdssnymckWhTIzoK"
select json_extract(j, '$[1541]') from t1 where pkey = 1;
json_extract(j, '$[1541]')
"rKHmh668WIwCSTBo64er0OTku9DA80TzKklzps7LA4XaVgMbi0QiOrQG0cR8cu5ucptRfymn2HMVwi4ehUN3MlIKNjRxbWpBJgdyfNkfd6BZmFBRiWT2IlMf"
# Connection con40:
select * from t1;
select @var_end_40 := j from t1;
select @var_40 = @var_end_40;
@var_40 = @var_end_40
1
select json_extract(j, '$[0]') from t1 where pkey = 1;
json_extract(j, '$[0]')
"aBB1hUgdGAAjke6YbspcN40wUJ7UlZrJk2LPXz2l9DTtpZPORF"
select json_extract(j, '$[1541]') from t1 where pkey = 1;
json_extract(j, '$[1541]')
"0oH0ikJoE2N5M66fVbeWKlhncWM1uoEsaWsHG95SAQVUUZ9yAlUTWBG8fb7ZPKPxqFC4OFWWgz08Z76hsaAMjPSO0axPsKKiZXkwmESQDRXkYdSPCalvzEKz"
commit;
select json_extract(j, '$[0]') from t1 where pkey = 1;
json_extract(j, '$[0]')
"xiLE8tWA5urom7lmHL2uXzvNpMTREqg9W1OdssnymckWhTIzoK"
select json_extract(j, '$[1541]') from t1 where pkey = 1;
json_extract(j, '$[1541]')
"rKHmh668WIwCSTBo64er0OTku9DA80TzKklzps7LA4XaVgMbi0QiOrQG0cR8cu5ucptRfymn2HMVwi4ehUN3MlIKNjRxbWpBJgdyfNkfd6BZmFBRiWT2IlMf"
# Connection con41:
select * from t1;
select @var_end_41 := j from t1;
select @var_41 = @var_end_41;
@var_41 = @var_end_41
1
select json_extract(j, '$[0]') from t1 where pkey = 1;
json_extract(j, '$[0]')
"mFMeafK9C45wGWLTvsCTVcshCcdCov9YAWCi9UsLWvFmPaDKSP"
select json_extract(j, '$[1541]') from t1 where pkey = 1;
json_extract(j, '$[1541]')
"0oH0ikJoE2N5M66fVbeWKlhncWM1uoEsaWsHG95SAQVUUZ9yAlUTWBG8fb7ZPKPxqFC4OFWWgz08Z76hsaAMjPSO0axPsKKiZXkwmESQDRXkYdSPCalvzEKz"
commit;
select json_extract(j, '$[0]') from t1 where pkey = 1;
json_extract(j, '$[0]')
"xiLE8tWA5urom7lmHL2uXzvNpMTREqg9W1OdssnymckWhTIzoK"
select json_extract(j, '$[1541]') from t1 where pkey = 1;
json_extract(j, '$[1541]')
"rKHmh668WIwCSTBo64er0OTku9DA80TzKklzps7LA4XaVgMbi0QiOrQG0cR8cu5ucptRfymn2HMVwi4ehUN3MlIKNjRxbWpBJgdyfNkfd6BZmFBRiWT2IlMf"
# Connection con42:
select * from t1;
select @var_end_42 := j from t1;
select @var_42 = @var_end_42;
@var_42 = @var_end_42
1
select json_extract(j, '$[0]') from t1 where pkey = 1;
json_extract(j, '$[0]')
"mFMeafK9C45wGWLTvsCTVcshCcdCov9YAWCi9UsLWvFmPaDKSP"
select json_extract(j, '$[1541]') from t1 where pkey = 1;
json_extract(j, '$[1541]')
"mw1cdCEEO27VYIzk08CqRgkhS9HeUi3Ee3qFF5Sb5X6ep4MoCXceDMJeUaIyGJAsK06Z3WA93FlrJ5fTcH7ocQS6zi2DzC6KCAtGg2NjF6aWBDzmT5a5T09Q"
commit;
select json_extract(j, '$[0]') from t1 where pkey = 1;
json_extract(j, '$[0]')
"xiLE8tWA5urom7lmHL2uXzvNpMTREqg9W1OdssnymckWhTIzoK"
select json_extract(j, '$[1541]') from t1 where pkey = 1;
json_extract(j, '$[1541]')
"rKHmh668WIwCSTBo64er0OTku9DA80TzKklzps7LA4XaVgMbi0QiOrQG0cR8cu5ucptRfymn2HMVwi4ehUN3MlIKNjRxbWpBJgdyfNkfd6BZmFBRiWT2IlMf"
# Connection con43:
select * from t1;
select @var_end_43 := j from t1;
select @var_43 = @var_end_43;
@var_43 = @var_end_43
1
select json_extract(j, '$[0]') from t1 where pkey = 1;
json_extract(j, '$[0]')
"gBefLizXqrlWt6D6CocOzZASeiV6gcWMn816o1ceqNAjUOngAN"
select json_extract(j, '$[1541]') from t1 where pkey = 1;
json_extract(j, '$[1541]')
"mw1cdCEEO27VYIzk08CqRgkhS9HeUi3Ee3qFF5Sb5X6ep4MoCXceDMJeUaIyGJAsK06Z3WA93FlrJ5fTcH7ocQS6zi2DzC6KCAtGg2NjF6aWBDzmT5a5T09Q"
commit;
select json_extract(j, '$[0]') from t1 where pkey = 1;
json_extract(j, '$[0]')
"xiLE8tWA5urom7lmHL2uXzvNpMTREqg9W1OdssnymckWhTIzoK"
select json_extract(j, '$[1541]') from t1 where pkey = 1;
json_extract(j, '$[1541]')
"rKHmh668WIwCSTBo64er0OTku9DA80TzKklzps7LA4XaVgMbi0QiOrQG0cR8cu5ucptRfymn2HMVwi4ehUN3MlIKNjRxbWpBJgdyfNkfd6BZmFBRiWT2IlMf"
# Connection con44:
select * from t1;
select @var_end_44 := j from t1;
select @var_44 = @var_end_44;
@var_44 = @var_end_44
1
select json_extract(j, '$[0]') from t1 where pkey = 1;
json_extract(j, '$[0]')
"gBefLizXqrlWt6D6CocOzZASeiV6gcWMn816o1ceqNAjUOngAN"
select json_extract(j, '$[1541]') from t1 where pkey = 1;
json_extract(j, '$[1541]')
"27wAYZs3fYe9sPIuW6t8ljVtQxFDcPaeVUp33f4gCiq486yeCpkvYDpyB29nQhPvCCyDs2u4ji6ro5TysBsROfNZhXK7Ci2Ouyak1SmiAtXwwyso9kDXNb55"
commit;
select json_extract(j, '$[0]') from t1 where pkey = 1;
json_extract(j, '$[0]')
"xiLE8tWA5urom7lmHL2uXzvNpMTREqg9W1OdssnymckWhTIzoK"
select json_extract(j, '$[1541]') from t1 where pkey = 1;
json_extract(j, '$[1541]')
"rKHmh668WIwCSTBo64er0OTku9DA80TzKklzps7LA4XaVgMbi0QiOrQG0cR8cu5ucptRfymn2HMVwi4ehUN3MlIKNjRxbWpBJgdyfNkfd6BZmFBRiWT2IlMf"
# Connection con45:
select * from t1;
select @var_end_45 := j from t1;
select @var_45 = @var_end_45;
@var_45 = @var_end_45
1
select json_extract(j, '$[0]') from t1 where pkey = 1;
json_extract(j, '$[0]')
"6NAI5DhyBFgAhTqpMNlGLb4UKI0hr5kxQvFU6uSH98QqZGfvcO"
select json_extract(j, '$[1541]') from t1 where pkey = 1;
json_extract(j, '$[1541]')
"27wAYZs3fYe9sPIuW6t8ljVtQxFDcPaeVUp33f4gCiq486yeCpkvYDpyB29nQhPvCCyDs2u4ji6ro5TysBsROfNZhXK7Ci2Ouyak1SmiAtXwwyso9kDXNb55"
commit;
select json_extract(j, '$[0]') from t1 where pkey = 1;
json_extract(j, '$[0]')
"xiLE8tWA5urom7lmHL2uXzvNpMTREqg9W1OdssnymckWhTIzoK"
select json_extract(j, '$[1541]') from t1 where pkey = 1;
json_extract(j, '$[1541]')
"rKHmh668WIwCSTBo64er0OTku9DA80TzKklzps7LA4XaVgMbi0QiOrQG0cR8cu5ucptRfymn2HMVwi4ehUN3MlIKNjRxbWpBJgdyfNkfd6BZmFBRiWT2IlMf"
# Connection con46:
select * from t1;
select @var_end_46 := j from t1;
select @var_46 = @var_end_46;
@var_46 = @var_end_46
1
select json_extract(j, '$[0]') from t1 where pkey = 1;
json_extract(j, '$[0]')
"6NAI5DhyBFgAhTqpMNlGLb4UKI0hr5kxQvFU6uSH98QqZGfvcO"
select json_extract(j, '$[1541]') from t1 where pkey = 1;
json_extract(j, '$[1541]')
"BxyEQIUQxLTiItbXNhQpwZwKOVb3PBQY8OmYeEwbZPHpJsLgXlUUKOogtNiGY8pfUZB8o8hLXzBopWVNFxpXLbEExwTT4I8WrIedQJxvG8i6cDRr8EOTpcfk"
commit;
select json_extract(j, '$[0]') from t1 where pkey = 1;
json_extract(j, '$[0]')
"xiLE8tWA5urom7lmHL2uXzvNpMTREqg9W1OdssnymckWhTIzoK"
select json_extract(j, '$[1541]') from t1 where pkey = 1;
json_extract(j, '$[1541]')
"rKHmh668WIwCSTBo64er0OTku9DA80TzKklzps7LA4XaVgMbi0QiOrQG0cR8cu5ucptRfymn2HMVwi4ehUN3MlIKNjRxbWpBJgdyfNkfd6BZmFBRiWT2IlMf"
# Connection con47:
select * from t1;
select @var_end_47 := j from t1;
select @var_47 = @var_end_47;
@var_47 = @var_end_47
1
select json_extract(j, '$[0]') from t1 where pkey = 1;
json_extract(j, '$[0]')
"W8EYQK4Gcgr00ouGucKWnjLvviOlI3TpChNa2Soc8gd6SVLN7d"
select json_extract(j, '$[1541]') from t1 where pkey = 1;
json_extract(j, '$[1541]')
"BxyEQIUQxLTiItbXNhQpwZwKOVb3PBQY8OmYeEwbZPHpJsLgXlUUKOogtNiGY8pfUZB8o8hLXzBopWVNFxpXLbEExwTT4I8WrIedQJxvG8i6cDRr8EOTpcfk"
commit;
select json_extract(j, '$[0]') from t1 where pkey = 1;
json_extract(j, '$[0]')
"xiLE8tWA5urom7lmHL2uXzvNpMTREqg9W1OdssnymckWhTIzoK"
select json_extract(j, '$[1541]') from t1 where pkey = 1;
json_extract(j, '$[1541]')
"rKHmh668WIwCSTBo64er0OTku9DA80TzKklzps7LA4XaVgMbi0QiOrQG0cR8cu5ucptRfymn2HMVwi4ehUN3MlIKNjRxbWpBJgdyfNkfd6BZmFBRiWT2IlMf"
# Connection con48:
select * from t1;
select @var_end_48 := j from t1;
select @var_48 = @var_end_48;
@var_48 = @var_end_48
1
select json_extract(j, '$[0]') from t1 where pkey = 1;
json_extract(j, '$[0]')
"W8EYQK4Gcgr00ouGucKWnjLvviOlI3TpChNa2Soc8gd6SVLN7d"
select json_extract(j, '$[1541]') from t1 where pkey = 1;
json_extract(j, '$[1541]')
"ruLDpGvBzDET0OAOxAolnwPO1srMFyx4qIHdZAoYM0zMPAkMIY53TVPSNGoaEje22ufZ4T7QU7lrFTBV0GZTjyv4FheRQHUQB9zFb5e3APsPq3uqHRJ1OC5b"
commit;
select json_extract(j, '$[0]') from t1 where pkey = 1;
json_extract(j, '$[0]')
"xiLE8tWA5urom7lmHL2uXzvNpMTREqg9W1OdssnymckWhTIzoK"
select json_extract(j, '$[1541]') from t1 where pkey = 1;
json_extract(j, '$[1541]')
"rKHmh668WIwCSTBo64er0OTku9DA80TzKklzps7LA4XaVgMbi0QiOrQG0cR8cu5ucptRfymn2HMVwi4ehUN3MlIKNjRxbWpBJgdyfNkfd6BZmFBRiWT2IlMf"
# Connection con49:
select * from t1;
select @var_end_49 := j from t1;
select @var_49 = @var_end_49;
@var_49 = @var_end_49
1
select json_extract(j, '$[0]') from t1 where pkey = 1;
json_extract(j, '$[0]')
"ri2GzUgAceNBjzEtM6GD783MaLLyVPZN7Zb44FEetZpcZ1Vv7l"
select json_extract(j, '$[1541]') from t1 where pkey = 1;
json_extract(j, '$[1541]')
"ruLDpGvBzDET0OAOxAolnwPO1srMFyx4qIHdZAoYM0zMPAkMIY53TVPSNGoaEje22ufZ4T7QU7lrFTBV0GZTjyv4FheRQHUQB9zFb5e3APsPq3uqHRJ1OC5b"
commit;
select json_extract(j, '$[0]') from t1 where pkey = 1;
json_extract(j, '$[0]')
"xiLE8tWA5urom7lmHL2uXzvNpMTREqg9W1OdssnymckWhTIzoK"
select json_extract(j, '$[1541]') from t1 where pkey = 1;
json_extract(j, '$[1541]')
"rKHmh668WIwCSTBo64er0OTku9DA80TzKklzps7LA4XaVgMbi0QiOrQG0cR8cu5ucptRfymn2HMVwi4ehUN3MlIKNjRxbWpBJgdyfNkfd6BZmFBRiWT2IlMf"
# Connection con50:
select * from t1;
select @var_end_50 := j from t1;
select @var_50 = @var_end_50;
@var_50 = @var_end_50
1
select json_extract(j, '$[0]') from t1 where pkey = 1;
json_extract(j, '$[0]')
"ri2GzUgAceNBjzEtM6GD783MaLLyVPZN7Zb44FEetZpcZ1Vv7l"
select json_extract(j, '$[1541]') from t1 where pkey = 1;
json_extract(j, '$[1541]')
"8CuAYSVuO0JxLQWwUYCgA3Dzgm09g5tmHlwqDRkbQ3WlR0gtZqXhtkhZXfhBlax2LsqWHY7hbdR0b7t8xQqo9XOgA5pvdmwyekUuJZbsA2tl7ku29krIFDwN"
commit;
select json_extract(j, '$[0]') from t1 where pkey = 1;
json_extract(j, '$[0]')
"xiLE8tWA5urom7lmHL2uXzvNpMTREqg9W1OdssnymckWhTIzoK"
select json_extract(j, '$[1541]') from t1 where pkey = 1;
json_extract(j, '$[1541]')
"rKHmh668WIwCSTBo64er0OTku9DA80TzKklzps7LA4XaVgMbi0QiOrQG0cR8cu5ucptRfymn2HMVwi4ehUN3MlIKNjRxbWpBJgdyfNkfd6BZmFBRiWT2IlMf"
# Connection con51:
select * from t1;
select @var_end_51 := j from t1;
select @var_51 = @var_end_51;
@var_51 = @var_end_51
1
select json_extract(j, '$[0]') from t1 where pkey = 1;
json_extract(j, '$[0]')
"GlJtVDr8xJ2Gsb70c0ljidkpLb7Ym1w2kDvGQkML3MctxhtZhc"
select json_extract(j, '$[1541]') from t1 where pkey = 1;
json_extract(j, '$[1541]')
"8CuAYSVuO0JxLQWwUYCgA3Dzgm09g5tmHlwqDRkbQ3WlR0gtZqXhtkhZXfhBlax2LsqWHY7hbdR0b7t8xQqo9XOgA5pvdmwyekUuJZbsA2tl7ku29krIFDwN"
commit;
select json_extract(j, '$[0]') from t1 where pkey = 1;
json_extract(j, '$[0]')
"xiLE8tWA5urom7lmHL2uXzvNpMTREqg9W1OdssnymckWhTIzoK"
select json_extract(j, '$[1541]') from t1 where pkey = 1;
json_extract(j, '$[1541]')
"rKHmh668WIwCSTBo64er0OTku9DA80TzKklzps7LA4XaVgMbi0QiOrQG0cR8cu5ucptRfymn2HMVwi4ehUN3MlIKNjRxbWpBJgdyfNkfd6BZmFBRiWT2IlMf"
# Connection con52:
select * from t1;
select @var_end_52 := j from t1;
select @var_52 = @var_end_52;
@var_52 = @var_end_52
1
select json_extract(j, '$[0]') from t1 where pkey = 1;
json_extract(j, '$[0]')
"GlJtVDr8xJ2Gsb70c0ljidkpLb7Ym1w2kDvGQkML3MctxhtZhc"
select json_extract(j, '$[1541]') from t1 where pkey = 1;
json_extract(j, '$[1541]')
"HNE1DZaI8MK2M4FHIf1e02yavwHmTwMkIajVAHnGb5IxAXCQAD38D1j6vysPtF7Bppgx6RBiXTdfyq3816HF8yL1wCQnRWyELeAR4L7ZpjClZFuYM9nS57Rz"
commit;
select json_extract(j, '$[0]') from t1 where pkey = 1;
json_extract(j, '$[0]')
"xiLE8tWA5urom7lmHL2uXzvNpMTREqg9W1OdssnymckWhTIzoK"
select json_extract(j, '$[1541]') from t1 where pkey = 1;
json_extract(j, '$[1541]')
"rKHmh668WIwCSTBo64er0OTku9DA80TzKklzps7LA4XaVgMbi0QiOrQG0cR8cu5ucptRfymn2HMVwi4ehUN3MlIKNjRxbWpBJgdyfNkfd6BZmFBRiWT2IlMf"
# Connection con53:
select * from t1;
select @var_end_53 := j from t1;
select @var_53 = @var_end_53;
@var_53 = @var_end_53
1
select json_extract(j, '$[0]') from t1 where pkey = 1;
json_extract(j, '$[0]')
"HsniOluhO26SOEzBvBwSQo0kvmA0tcyASlqoWiVulZK7lJIgSC"
select json_extract(j, '$[1541]') from t1 where pkey = 1;
json_extract(j, '$[1541]')
"HNE1DZaI8MK2M4FHIf1e02yavwHmTwMkIajVAHnGb5IxAXCQAD38D1j6vysPtF7Bppgx6RBiXTdfyq3816HF8yL1wCQnRWyELeAR4L7ZpjClZFuYM9nS57Rz"
commit;
select json_extract(j, '$[0]') from t1 where pkey = 1;
json_extract(j, '$[0]')
"xiLE8tWA5urom7lmHL2uXzvNpMTREqg9W1OdssnymckWhTIzoK"
select json_extract(j, '$[1541]') from t1 where pkey = 1;
json_extract(j, '$[1541]')
"rKHmh668WIwCSTBo64er0OTku9DA80TzKklzps7LA4XaVgMbi0QiOrQG0cR8cu5ucptRfymn2HMVwi4ehUN3MlIKNjRxbWpBJgdyfNkfd6BZmFBRiWT2IlMf"
# Connection con54:
select * from t1;
select @var_end_54 := j from t1;
select @var_54 = @var_end_54;
@var_54 = @var_end_54
1
select json_extract(j, '$[0]') from t1 where pkey = 1;
json_extract(j, '$[0]')
"HsniOluhO26SOEzBvBwSQo0kvmA0tcyASlqoWiVulZK7lJIgSC"
select json_extract(j, '$[1541]') from t1 where pkey = 1;
json_extract(j, '$[1541]')
"8tz9bsvktmKpumaiY6O1z7aHEMZU21fBseIUUBCLxWApGkXopvno3N3FjckkeNtW1ByTMApHez6skbgZWRLXpOlW1VGfq79rI8KcG7tt7xlrYQO3rjYe7JB6"
commit;
select json_extract(j, '$[0]') from t1 where pkey = 1;
json_extract(j, '$[0]')
"xiLE8tWA5urom7lmHL2uXzvNpMTREqg9W1OdssnymckWhTIzoK"
select json_extract(j, '$[1541]') from t1 where pkey = 1;
json_extract(j, '$[1541]')
"rKHmh668WIwCSTBo64er0OTku9DA80TzKklzps7LA4XaVgMbi0QiOrQG0cR8cu5ucptRfymn2HMVwi4ehUN3MlIKNjRxbWpBJgdyfNkfd6BZmFBRiWT2IlMf"
# Connection con55:
select * from t1;
select @var_end_55 := j from t1;
select @var_55 = @var_end_55;
@var_55 = @var_end_55
1
select json_extract(j, '$[0]') from t1 where pkey = 1;
json_extract(j, '$[0]')
"mPjcXtRpzkQDrJ6yHqnnGBq7uNk0gv6TKo3rhVfeD5r4Mw3bmo"
select json_extract(j, '$[1541]') from t1 where pkey = 1;
json_extract(j, '$[1541]')
"8tz9bsvktmKpumaiY6O1z7aHEMZU21fBseIUUBCLxWApGkXopvno3N3FjckkeNtW1ByTMApHez6skbgZWRLXpOlW1VGfq79rI8KcG7tt7xlrYQO3rjYe7JB6"
commit;
select json_extract(j, '$[0]') from t1 where pkey = 1;
json_extract(j, '$[0]')
"xiLE8tWA5urom7lmHL2uXzvNpMTREqg9W1OdssnymckWhTIzoK"
select json_extract(j, '$[1541]') from t1 where pkey = 1;
json_extract(j, '$[1541]')
"rKHmh668WIwCSTBo64er0OTku9DA80TzKklzps7LA4XaVgMbi0QiOrQG0cR8cu5ucptRfymn2HMVwi4ehUN3MlIKNjRxbWpBJgdyfNkfd6BZmFBRiWT2IlMf"
# Connection con56:
select * from t1;
select @var_end_56 := j from t1;
select @var_56 = @var_end_56;
@var_56 = @var_end_56
1
select json_extract(j, '$[0]') from t1 where pkey = 1;
json_extract(j, '$[0]')
"mPjcXtRpzkQDrJ6yHqnnGBq7uNk0gv6TKo3rhVfeD5r4Mw3bmo"
select json_extract(j, '$[1541]') from t1 where pkey = 1;
json_extract(j, '$[1541]')
"P20D7uarsFmxg5ljuQCX4PcvUxrVYdJvdH7lAfa2uLzYQiII8SqCsQ6KNxnwZ4pCMwvWcWWUrU3FCJXJlLVbmbt9Xg36jtG5nCZNg5qXZtkmAF5tbYVN8MUd"
commit;
select json_extract(j, '$[0]') from t1 where pkey = 1;
json_extract(j, '$[0]')
"xiLE8tWA5urom7lmHL2uXzvNpMTREqg9W1OdssnymckWhTIzoK"
select json_extract(j, '$[1541]') from t1 where pkey = 1;
json_extract(j, '$[1541]')
"rKHmh668WIwCSTBo64er0OTku9DA80TzKklzps7LA4XaVgMbi0QiOrQG0cR8cu5ucptRfymn2HMVwi4ehUN3MlIKNjRxbWpBJgdyfNkfd6BZmFBRiWT2IlMf"
# Connection con57:
select * from t1;
select @var_end_57 := j from t1;
select @var_57 = @var_end_57;
@var_57 = @var_end_57
1
select json_extract(j, '$[0]') from t1 where pkey = 1;
json_extract(j, '$[0]')
"1YhkPxnA7MYnROK1F2lPIoItKlES8i57GkrdieopyMdPivOxy7"
select json_extract(j, '$[1541]') from t1 where pkey = 1;
json_extract(j, '$[1541]')
"P20D7uarsFmxg5ljuQCX4PcvUxrVYdJvdH7lAfa2uLzYQiII8SqCsQ6KNxnwZ4pCMwvWcWWUrU3FCJXJlLVbmbt9Xg36jtG5nCZNg5qXZtkmAF5tbYVN8MUd"
commit;
select json_extract(j, '$[0]') from t1 where pkey = 1;
json_extract(j, '$[0]')
"xiLE8tWA5urom7lmHL2uXzvNpMTREqg9W1OdssnymckWhTIzoK"
select json_extract(j, '$[1541]') from t1 where pkey = 1;
json_extract(j, '$[1541]')
"rKHmh668WIwCSTBo64er0OTku9DA80TzKklzps7LA4XaVgMbi0QiOrQG0cR8cu5ucptRfymn2HMVwi4ehUN3MlIKNjRxbWpBJgdyfNkfd6BZmFBRiWT2IlMf"
# Connection con58:
select * from t1;
select @var_end_58 := j from t1;
select @var_58 = @var_end_58;
@var_58 = @var_end_58
1
select json_extract(j, '$[0]') from t1 where pkey = 1;
json_extract(j, '$[0]')
"1YhkPxnA7MYnROK1F2lPIoItKlES8i57GkrdieopyMdPivOxy7"
select json_extract(j, '$[1541]') from t1 where pkey = 1;
json_extract(j, '$[1541]')
"KEtc7EMLeS1iZGSOtA0fyyzZLhUkcQpwejZjvv2ZN4HuIiI9qIpoGoLbUoJ6E73roaYjTbIqdYivE024IrrWgC580NEDUH2IrazI9H6mnof1oi44XvYB5eJ6"
commit;
select json_extract(j, '$[0]') from t1 where pkey = 1;
json_extract(j, '$[0]')
"xiLE8tWA5urom7lmHL2uXzvNpMTREqg9W1OdssnymckWhTIzoK"
select json_extract(j, '$[1541]') from t1 where pkey = 1;
json_extract(j, '$[1541]')
"rKHmh668WIwCSTBo64er0OTku9DA80TzKklzps7LA4XaVgMbi0QiOrQG0cR8cu5ucptRfymn2HMVwi4ehUN3MlIKNjRxbWpBJgdyfNkfd6BZmFBRiWT2IlMf"
# Connection con59:
select * from t1;
select @var_end_59 := j from t1;
select @var_59 = @var_end_59;
@var_59 = @var_end_59
1
select json_extract(j, '$[0]') from t1 where pkey = 1;
json_extract(j, '$[0]')
"1YHTnJjdtiv3x2njqRkd7mhehGqls9rrf8KRP34GjzHgz5PoU8"
select json_extract(j, '$[1541]') from t1 where pkey = 1;
json_extract(j, '$[1541]')
"KEtc7EMLeS1iZGSOtA0fyyzZLhUkcQpwejZjvv2ZN4HuIiI9qIpoGoLbUoJ6E73roaYjTbIqdYivE024IrrWgC580NEDUH2IrazI9H6mnof1oi44XvYB5eJ6"
commit;
select json_extract(j, '$[0]') from t1 where pkey = 1;
json_extract(j, '$[0]')
"xiLE8tWA5urom7lmHL2uXzvNpMTREqg9W1OdssnymckWhTIzoK"
select json_extract(j, '$[1541]') from t1 where pkey = 1;
json_extract(j, '$[1541]')
"rKHmh668WIwCSTBo64er0OTku9DA80TzKklzps7LA4XaVgMbi0QiOrQG0cR8cu5ucptRfymn2HMVwi4ehUN3MlIKNjRxbWpBJgdyfNkfd6BZmFBRiWT2IlMf"
# Connection con60:
select * from t1;
select @var_end_60 := j from t1;
select @var_60 = @var_end_60;
@var_60 = @var_end_60
1
select json_extract(j, '$[0]') from t1 where pkey = 1;
json_extract(j, '$[0]')
"1YHTnJjdtiv3x2njqRkd7mhehGqls9rrf8KRP34GjzHgz5PoU8"
select json_extract(j, '$[1541]') from t1 where pkey = 1;
json_extract(j, '$[1541]')
"Rbu6DaK3LCBA1oGLFfMJv5HDkEG92kHTJAYWisY33jB4VRQl4k2zoHAYWQfW8x0P5YwnOUoRBzWeOuPScQPQhYyBwei5ZgUcCOPaqB018WgWO3w0RJR7rNIo"
commit;
select json_extract(j, '$[0]') from t1 where pkey = 1;
json_extract(j, '$[0]')
"xiLE8tWA5urom7lmHL2uXzvNpMTREqg9W1OdssnymckWhTIzoK"
select json_extract(j, '$[1541]') from t1 where pkey = 1;
json_extract(j, '$[1541]')
"rKHmh668WIwCSTBo64er0OTku9DA80TzKklzps7LA4XaVgMbi0QiOrQG0cR8cu5ucptRfymn2HMVwi4ehUN3MlIKNjRxbWpBJgdyfNkfd6BZmFBRiWT2IlMf"
# Connection con61:
select * from t1;
select @var_end_61 := j from t1;
select @var_61 = @var_end_61;
@var_61 = @var_end_61
1
select json_extract(j, '$[0]') from t1 where pkey = 1;
json_extract(j, '$[0]')
"zyrWcL8oiVNYgNYmrCIDFCDfWcmNy4Bx12SdMaQ44lai68VvKl"
select json_extract(j, '$[1541]') from t1 where pkey = 1;
json_extract(j, '$[1541]')
"Rbu6DaK3LCBA1oGLFfMJv5HDkEG92kHTJAYWisY33jB4VRQl4k2zoHAYWQfW8x0P5YwnOUoRBzWeOuPScQPQhYyBwei5ZgUcCOPaqB018WgWO3w0RJR7rNIo"
commit;
select json_extract(j, '$[0]') from t1 where pkey = 1;
json_extract(j, '$[0]')
"xiLE8tWA5urom7lmHL2uXzvNpMTREqg9W1OdssnymckWhTIzoK"
select json_extract(j, '$[1541]') from t1 where pkey = 1;
json_extract(j, '$[1541]')
"rKHmh668WIwCSTBo64er0OTku9DA80TzKklzps7LA4XaVgMbi0QiOrQG0cR8cu5ucptRfymn2HMVwi4ehUN3MlIKNjRxbWpBJgdyfNkfd6BZmFBRiWT2IlMf"
# Connection con62:
select * from t1;
select @var_end_62 := j from t1;
select @var_62 = @var_end_62;
@var_62 = @var_end_62
1
select json_extract(j, '$[0]') from t1 where pkey = 1;
json_extract(j, '$[0]')
"zyrWcL8oiVNYgNYmrCIDFCDfWcmNy4Bx12SdMaQ44lai68VvKl"
select json_extract(j, '$[1541]') from t1 where pkey = 1;
json_extract(j, '$[1541]')
"8YyLDUyzpw11r01JcLs0Pwlyep67kPtsvrB6J958347t37CfS2dqyMobBsivHZlCQwIh4Lo5OtyR094TBhJ835hCxN7FxqPLmg3o1puNiqmjzqA9VTFWWwiT"
commit;
select json_extract(j, '$[0]') from t1 where pkey = 1;
json_extract(j, '$[0]')
"xiLE8tWA5urom7lmHL2uXzvNpMTREqg9W1OdssnymckWhTIzoK"
select json_extract(j, '$[1541]') from t1 where pkey = 1;
json_extract(j, '$[1541]')
"rKHmh668WIwCSTBo64er0OTku9DA80TzKklzps7LA4XaVgMbi0QiOrQG0cR8cu5ucptRfymn2HMVwi4ehUN3MlIKNjRxbWpBJgdyfNkfd6BZmFBRiWT2IlMf"
# Connection con63:
select * from t1;
select @var_end_63 := j from t1;
select @var_63 = @var_end_63;
@var_63 = @var_end_63
1
select json_extract(j, '$[0]') from t1 where pkey = 1;
json_extract(j, '$[0]')
"JniGd6aOmdClS698xvruk11FSGkyASSUE8irEID0tQmJUtSPoH"
select json_extract(j, '$[1541]') from t1 where pkey = 1;
json_extract(j, '$[1541]')
"8YyLDUyzpw11r01JcLs0Pwlyep67kPtsvrB6J958347t37CfS2dqyMobBsivHZlCQwIh4Lo5OtyR094TBhJ835hCxN7FxqPLmg3o1puNiqmjzqA9VTFWWwiT"
commit;
select json_extract(j, '$[0]') from t1 where pkey = 1;
json_extract(j, '$[0]')
"xiLE8tWA5urom7lmHL2uXzvNpMTREqg9W1OdssnymckWhTIzoK"
select json_extract(j, '$[1541]') from t1 where pkey = 1;
json_extract(j, '$[1541]')
"rKHmh668WIwCSTBo64er0OTku9DA80TzKklzps7LA4XaVgMbi0QiOrQG0cR8cu5ucptRfymn2HMVwi4ehUN3MlIKNjRxbWpBJgdyfNkfd6BZmFBRiWT2IlMf"
# Connection con64:
select * from t1;
select @var_end_64 := j from t1;
select @var_64 = @var_end_64;
@var_64 = @var_end_64
1
select json_extract(j, '$[0]') from t1 where pkey = 1;
json_extract(j, '$[0]')
"JniGd6aOmdClS698xvruk11FSGkyASSUE8irEID0tQmJUtSPoH"
select json_extract(j, '$[1541]') from t1 where pkey = 1;
json_extract(j, '$[1541]')
"IWHJmhaWgiw6CACt0R9DP1b9K62kTp0lLH35ybZcJUgUetLcIUqfTRpoVpWxcWgylj1kKbKc516hsRK8t8nNXa93Ody0AewvMydeXwGcvKHnlbvdjg0HF7Id"
commit;
select json_extract(j, '$[0]') from t1 where pkey = 1;
json_extract(j, '$[0]')
"xiLE8tWA5urom7lmHL2uXzvNpMTREqg9W1OdssnymckWhTIzoK"
select json_extract(j, '$[1541]') from t1 where pkey = 1;
json_extract(j, '$[1541]')
"rKHmh668WIwCSTBo64er0OTku9DA80TzKklzps7LA4XaVgMbi0QiOrQG0cR8cu5ucptRfymn2HMVwi4ehUN3MlIKNjRxbWpBJgdyfNkfd6BZmFBRiWT2IlMf"
# Connection con65:
select * from t1;
select @var_end_65 := j from t1;
select @var_65 = @var_end_65;
@var_65 = @var_end_65
1
select json_extract(j, '$[0]') from t1 where pkey = 1;
json_extract(j, '$[0]')
"kEdsqYmCWPp3J5dEOu17UukBZiSopiPaw0QlYCx4cm5vqi8Eb9"
select json_extract(j, '$[1541]') from t1 where pkey = 1;
json_extract(j, '$[1541]')
"IWHJmhaWgiw6CACt0R9DP1b9K62kTp0lLH35ybZcJUgUetLcIUqfTRpoVpWxcWgylj1kKbKc516hsRK8t8nNXa93Ody0AewvMydeXwGcvKHnlbvdjg0HF7Id"
commit;
select json_extract(j, '$[0]') from t1 where pkey = 1;
json_extract(j, '$[0]')
"xiLE8tWA5urom7lmHL2uXzvNpMTREqg9W1OdssnymckWhTIzoK"
select json_extract(j, '$[1541]') from t1 where pkey = 1;
json_extract(j, '$[1541]')
"rKHmh668WIwCSTBo64er0OTku9DA80TzKklzps7LA4XaVgMbi0QiOrQG0cR8cu5ucptRfymn2HMVwi4ehUN3MlIKNjRxbWpBJgdyfNkfd6BZmFBRiWT2IlMf"
# Connection con66:
select * from t1;
select @var_end_66 := j from t1;
select @var_66 = @var_end_66;
@var_66 = @var_end_66
1
select json_extract(j, '$[0]') from t1 where pkey = 1;
json_extract(j, '$[0]')
"kEdsqYmCWPp3J5dEOu17UukBZiSopiPaw0QlYCx4cm5vqi8Eb9"
select json_extract(j, '$[1541]') from t1 where pkey = 1;
json_extract(j, '$[1541]')
"J524GZmhNaNk8IkY3JlyLLjPEZ7MlgU4lU603rfOR28XIs3L9mIT71sKYxeHc8LLaQLdHy1g19BH0Ed71va6uQQSM3jy92JkSdNhbNNaUYsUlTcmMAqGbFgv"
commit;
select json_extract(j, '$[0]') from t1 where pkey = 1;
json_extract(j, '$[0]')
"xiLE8tWA5urom7lmHL2uXzvNpMTREqg9W1OdssnymckWhTIzoK"
select json_extract(j, '$[1541]') from t1 where pkey = 1;
json_extract(j, '$[1541]')
"rKHmh668WIwCSTBo64er0OTku9DA80TzKklzps7LA4XaVgMbi0QiOrQG0cR8cu5ucptRfymn2HMVwi4ehUN3MlIKNjRxbWpBJgdyfNkfd6BZmFBRiWT2IlMf"
# Connection con67:
select * from t1;
select @var_end_67 := j from t1;
select @var_67 = @var_end_67;
@var_67 = @var_end_67
1
select json_extract(j, '$[0]') from t1 where pkey = 1;
json_extract(j, '$[0]')
"IPrRP89slXZLsvtMRjrCCRwWblkA0O3GnuhB3r1mMY5CTzYtiN"
select json_extract(j, '$[1541]') from t1 where pkey = 1;
json_extract(j, '$[1541]')
"J524GZmhNaNk8IkY3JlyLLjPEZ7MlgU4lU603rfOR28XIs3L9mIT71sKYxeHc8LLaQLdHy1g19BH0Ed71va6uQQSM3jy92JkSdNhbNNaUYsUlTcmMAqGbFgv"
commit;
select json_extract(j, '$[0]') from t1 where pkey = 1;
json_extract(j, '$[0]')
"xiLE8tWA5urom7lmHL2uXzvNpMTREqg9W1OdssnymckWhTIzoK"
select json_extract(j, '$[1541]') from t1 where pkey = 1;
json_extract(j, '$[1541]')
"rKHmh668WIwCSTBo64er0OTku9DA80TzKklzps7LA4XaVgMbi0QiOrQG0cR8cu5ucptRfymn2HMVwi4ehUN3MlIKNjRxbWpBJgdyfNkfd6BZmFBRiWT2IlMf"
# Connection con68:
select * from t1;
select @var_end_68 := j from t1;
select @var_68 = @var_end_68;
@var_68 = @var_end_68
1
select json_extract(j, '$[0]') from t1 where pkey = 1;
json_extract(j, '$[0]')
"IPrRP89slXZLsvtMRjrCCRwWblkA0O3GnuhB3r1mMY5CTzYtiN"
select json_extract(j, '$[1541]') from t1 where pkey = 1;
json_extract(j, '$[1541]')
"5to0NOl8WjWazIUgTVVUGp2LzUKYN1tQugOH49NaquApAdUb6x5Ml5ikX0Gs1AHvqfBsnYSdQbTaExBIuEffINQnLegNoxGcaRUNyx1OWSxiP80HLfvb0JOM"
commit;
select json_extract(j, '$[0]') from t1 where pkey = 1;
json_extract(j, '$[0]')
"xiLE8tWA5urom7lmHL2uXzvNpMTREqg9W1OdssnymckWhTIzoK"
select json_extract(j, '$[1541]') from t1 where pkey = 1;
json_extract(j, '$[1541]')
"rKHmh668WIwCSTBo64er0OTku9DA80TzKklzps7LA4XaVgMbi0QiOrQG0cR8cu5ucptRfymn2HMVwi4ehUN3MlIKNjRxbWpBJgdyfNkfd6BZmFBRiWT2IlMf"
# Connection con69:
select * from t1;
select @var_end_69 := j from t1;
select @var_69 = @var_end_69;
@var_69 = @var_end_69
1
select json_extract(j, '$[0]') from t1 where pkey = 1;
json_extract(j, '$[0]')
"x2hmzxMYNrvLmuhIMe0jly14ewfcF3wC6dw3ZHbw8VHsPyAkb8"
select json_extract(j, '$[1541]') from t1 where pkey = 1;
json_extract(j, '$[1541]')
"5to0NOl8WjWazIUgTVVUGp2LzUKYN1tQugOH49NaquApAdUb6x5Ml5ikX0Gs1AHvqfBsnYSdQbTaExBIuEffINQnLegNoxGcaRUNyx1OWSxiP80HLfvb0JOM"
commit;
select json_extract(j, '$[0]') from t1 where pkey = 1;
json_extract(j, '$[0]')
"xiLE8tWA5urom7lmHL2uXzvNpMTREqg9W1OdssnymckWhTIzoK"
select json_extract(j, '$[1541]') from t1 where pkey = 1;
json_extract(j, '$[1541]')
"rKHmh668WIwCSTBo64er0OTku9DA80TzKklzps7LA4XaVgMbi0QiOrQG0cR8cu5ucptRfymn2HMVwi4ehUN3MlIKNjRxbWpBJgdyfNkfd6BZmFBRiWT2IlMf"
# Connection con70:
select * from t1;
select @var_end_70 := j from t1;
select @var_70 = @var_end_70;
@var_70 = @var_end_70
1
select json_extract(j, '$[0]') from t1 where pkey = 1;
json_extract(j, '$[0]')
"x2hmzxMYNrvLmuhIMe0jly14ewfcF3wC6dw3ZHbw8VHsPyAkb8"
select json_extract(j, '$[1541]') from t1 where pkey = 1;
json_extract(j, '$[1541]')
"TM6UQiO5Jb6FmArgCQxlK5GZxeV5O6BrSIKqyitHIyV48MkIki44lIbhu6mIDy8dEQSC6LSOJxSQHDg1tk3e1cLti6Av2IZGg1QmKsBcnd24og3hP4KQgfHP"
commit;
select json_extract(j, '$[0]') from t1 where pkey = 1;
json_extract(j, '$[0]')
"xiLE8tWA5urom7lmHL2uXzvNpMTREqg9W1OdssnymckWhTIzoK"
select json_extract(j, '$[1541]') from t1 where pkey = 1;
json_extract(j, '$[1541]')
"rKHmh668WIwCSTBo64er0OTku9DA80TzKklzps7LA4XaVgMbi0QiOrQG0cR8cu5ucptRfymn2HMVwi4ehUN3MlIKNjRxbWpBJgdyfNkfd6BZmFBRiWT2IlMf"
# Connection con71:
select * from t1;
select @var_end_71 := j from t1;
select @var_71 = @var_end_71;
@var_71 = @var_end_71
1
select json_extract(j, '$[0]') from t1 where pkey = 1;
json_extract(j, '$[0]')
"lRIljpzPqQA9GLl4wl6jRAQqCkEtOWG7xYtfOs2CGCLVV4ZQnf"
select json_extract(j, '$[1541]') from t1 where pkey = 1;
json_extract(j, '$[1541]')
"TM6UQiO5Jb6FmArgCQxlK5GZxeV5O6BrSIKqyitHIyV48MkIki44lIbhu6mIDy8dEQSC6LSOJxSQHDg1tk3e1cLti6Av2IZGg1QmKsBcnd24og3hP4KQgfHP"
commit;
select json_extract(j, '$[0]') from t1 where pkey = 1;
json_extract(j, '$[0]')
"xiLE8tWA5urom7lmHL2uXzvNpMTREqg9W1OdssnymckWhTIzoK"
select json_extract(j, '$[1541]') from t1 where pkey = 1;
json_extract(j, '$[1541]')
"rKHmh668WIwCSTBo64er0OTku9DA80TzKklzps7LA4XaVgMbi0QiOrQG0cR8cu5ucptRfymn2HMVwi4ehUN3MlIKNjRxbWpBJgdyfNkfd6BZmFBRiWT2IlMf"
# Connection con72:
select * from t1;
select @var_end_72 := j from t1;
select @var_72 = @var_end_72;
@var_72 = @var_end_72
1
select json_extract(j, '$[0]') from t1 where pkey = 1;
json_extract(j, '$[0]')
"lRIljpzPqQA9GLl4wl6jRAQqCkEtOWG7xYtfOs2CGCLVV4ZQnf"
select json_extract(j, '$[1541]') from t1 where pkey = 1;
json_extract(j, '$[1541]')
"9DnX10GGrek7jffaI3RJEfTZAzcjPPNWc83e8Hsxta4dFkDWlcpzIIXSF9AcWX87dAjmRbhL9mwOU7uDkhB20iSDpcqJ7wQl69VYiCrrwnEQu6eeopemV7zK"
commit;
select json_extract(j, '$[0]') from t1 where pkey = 1;
json_extract(j, '$[0]')
"xiLE8tWA5urom7lmHL2uXzvNpMTREqg9W1OdssnymckWhTIzoK"
select json_extract(j, '$[1541]') from t1 where pkey = 1;
json_extract(j, '$[1541]')
"rKHmh668WIwCSTBo64er0OTku9DA80TzKklzps7LA4XaVgMbi0QiOrQG0cR8cu5ucptRfymn2HMVwi4ehUN3MlIKNjRxbWpBJgdyfNkfd6BZmFBRiWT2IlMf"
# Connection con73:
select * from t1;
select @var_end_73 := j from t1;
select @var_73 = @var_end_73;
@var_73 = @var_end_73
1
select json_extract(j, '$[0]') from t1 where pkey = 1;
json_extract(j, '$[0]')
"hnbpk2Yq91MsDDjAyxYt2CVqz8aSDZkuNMh7ODvXEINST5aS08"
select json_extract(j, '$[1541]') from t1 where pkey = 1;
json_extract(j, '$[1541]')
"9DnX10GGrek7jffaI3RJEfTZAzcjPPNWc83e8Hsxta4dFkDWlcpzIIXSF9AcWX87dAjmRbhL9mwOU7uDkhB20iSDpcqJ7wQl69VYiCrrwnEQu6eeopemV7zK"
commit;
select json_extract(j, '$[0]') from t1 where pkey = 1;
json_extract(j, '$[0]')
"xiLE8tWA5urom7lmHL2uXzvNpMTREqg9W1OdssnymckWhTIzoK"
select json_extract(j, '$[1541]') from t1 where pkey = 1;
json_extract(j, '$[1541]')
"rKHmh668WIwCSTBo64er0OTku9DA80TzKklzps7LA4XaVgMbi0QiOrQG0cR8cu5ucptRfymn2HMVwi4ehUN3MlIKNjRxbWpBJgdyfNkfd6BZmFBRiWT2IlMf"
# Connection con74:
select * from t1;
select @var_end_74 := j from t1;
select @var_74 = @var_end_74;
@var_74 = @var_end_74
1
select json_extract(j, '$[0]') from t1 where pkey = 1;
json_extract(j, '$[0]')
"hnbpk2Yq91MsDDjAyxYt2CVqz8aSDZkuNMh7ODvXEINST5aS08"
select json_extract(j, '$[1541]') from t1 where pkey = 1;
json_extract(j, '$[1541]')
"J2JmsGuSj70T0LpfQBtLh7b4Z397TAEmCXW3lRTUWTwWmjCCv3YcA7eiAopby3N8Ys9IJdmn4gIrQS1JVXvffXNnLBPHCkOjcX1tAlfDSx2qN39sb2VGZr1t"
commit;
select json_extract(j, '$[0]') from t1 where pkey = 1;
json_extract(j, '$[0]')
"xiLE8tWA5urom7lmHL2uXzvNpMTREqg9W1OdssnymckWhTIzoK"
select json_extract(j, '$[1541]') from t1 where pkey = 1;
json_extract(j, '$[1541]')
"rKHmh668WIwCSTBo64er0OTku9DA80TzKklzps7LA4XaVgMbi0QiOrQG0cR8cu5ucptRfymn2HMVwi4ehUN3MlIKNjRxbWpBJgdyfNkfd6BZmFBRiWT2IlMf"
# Connection con75:
select * from t1;
select @var_end_75 := j from t1;
select @var_75 = @var_end_75;
@var_75 = @var_end_75
1
select json_extract(j, '$[0]') from t1 where pkey = 1;
json_extract(j, '$[0]')
"2QAC9Yvl4wdEiIP8DRyaV5S45vKemJXmigzrCscGpDTVVsbiKX"
select json_extract(j, '$[1541]') from t1 where pkey = 1;
json_extract(j, '$[1541]')
"J2JmsGuSj70T0LpfQBtLh7b4Z397TAEmCXW3lRTUWTwWmjCCv3YcA7eiAopby3N8Ys9IJdmn4gIrQS1JVXvffXNnLBPHCkOjcX1tAlfDSx2qN39sb2VGZr1t"
commit;
select json_extract(j, '$[0]') from t1 where pkey = 1;
json_extract(j, '$[0]')
"xiLE8tWA5urom7lmHL2uXzvNpMTREqg9W1OdssnymckWhTIzoK"
select json_extract(j, '$[1541]') from t1 where pkey = 1;
json_extract(j, '$[1541]')
"rKHmh668WIwCSTBo64er0OTku9DA80TzKklzps7LA4XaVgMbi0QiOrQG0cR8cu5ucptRfymn2HMVwi4ehUN3MlIKNjRxbWpBJgdyfNkfd6BZmFBRiWT2IlMf"
# Connection con76:
select * from t1;
select @var_end_76 := j from t1;
select @var_76 = @var_end_76;
@var_76 = @var_end_76
1
select json_extract(j, '$[0]') from t1 where pkey = 1;
json_extract(j, '$[0]')
"2QAC9Yvl4wdEiIP8DRyaV5S45vKemJXmigzrCscGpDTVVsbiKX"
select json_extract(j, '$[1541]') from t1 where pkey = 1;
json_extract(j, '$[1541]')
"Inairfe9JOSpBAV8zh0awnnPGHHpzZMGKwwBbYKtvlg4tBCtqATmyEBCVR2TyMhJJbUsAnj3WP7NYJGPTh9PuJaPicqgyXzF9S8HFpKjFP6niLA90IXub7KJ"
commit;
select json_extract(j, '$[0]') from t1 where pkey = 1;
json_extract(j, '$[0]')
"xiLE8tWA5urom7lmHL2uXzvNpMTREqg9W1OdssnymckWhTIzoK"
select json_extract(j, '$[1541]') from t1 where pkey = 1;
json_extract(j, '$[1541]')
"rKHmh668WIwCSTBo64er0OTku9DA80TzKklzps7LA4XaVgMbi0QiOrQG0cR8cu5ucptRfymn2HMVwi4ehUN3MlIKNjRxbWpBJgdyfNkfd6BZmFBRiWT2IlMf"
# Connection con77:
select * from t1;
select @var_end_77 := j from t1;
select @var_77 = @var_end_77;
@var_77 = @var_end_77
1
select json_extract(j, '$[0]') from t1 where pkey = 1;
json_extract(j, '$[0]')
"jAxfgxvnP12cqKL3jPrRkzYlH3fqAx7r65Xk0QXNRZzHtILafA"
select json_extract(j, '$[1541]') from t1 where pkey = 1;
json_extract(j, '$[1541]')
"Inairfe9JOSpBAV8zh0awnnPGHHpzZMGKwwBbYKtvlg4tBCtqATmyEBCVR2TyMhJJbUsAnj3WP7NYJGPTh9PuJaPicqgyXzF9S8HFpKjFP6niLA90IXub7KJ"
commit;
select json_extract(j, '$[0]') from t1 where pkey = 1;
json_extract(j, '$[0]')
"xiLE8tWA5urom7lmHL2uXzvNpMTREqg9W1OdssnymckWhTIzoK"
select json_extract(j, '$[1541]') from t1 where pkey = 1;
json_extract(j, '$[1541]')
"rKHmh668WIwCSTBo64er0OTku9DA80TzKklzps7LA4XaVgMbi0QiOrQG0cR8cu5ucptRfymn2HMVwi4ehUN3MlIKNjRxbWpBJgdyfNkfd6BZmFBRiWT2IlMf"
# Connection con78:
select * from t1;
select @var_end_78 := j from t1;
select @var_78 = @var_end_78;
@var_78 = @var_end_78
1
select json_extract(j, '$[0]') from t1 where pkey = 1;
json_extract(j, '$[0]')
"jAxfgxvnP12cqKL3jPrRkzYlH3fqAx7r65Xk0QXNRZzHtILafA"
select json_extract(j, '$[1541]') from t1 where pkey = 1;
json_extract(j, '$[1541]')
"1Q7X9PbmFjkLboQ6YOW3lxciCTyV3dd21lXAA6xNqfiRT6VzS12Dwct83rc4TF6U0bd8iaUYDAxgFSdhRfvNFmTIe5M7JQZH1CQjksFx2CbHcEx3rqQ6csMG"
commit;
select json_extract(j, '$[0]') from t1 where pkey = 1;
json_extract(j, '$[0]')
"xiLE8tWA5urom7lmHL2uXzvNpMTREqg9W1OdssnymckWhTIzoK"
select json_extract(j, '$[1541]') from t1 where pkey = 1;
json_extract(j, '$[1541]')
"rKHmh668WIwCSTBo64er0OTku9DA80TzKklzps7LA4XaVgMbi0QiOrQG0cR8cu5ucptRfymn2HMVwi4ehUN3MlIKNjRxbWpBJgdyfNkfd6BZmFBRiWT2IlMf"
# Connection con79:
select * from t1;
select @var_end_79 := j from t1;
select @var_79 = @var_end_79;
@var_79 = @var_end_79
1
select json_extract(j, '$[0]') from t1 where pkey = 1;
json_extract(j, '$[0]')
"xiLE8tWA5urom7lmHL2uXzvNpMTREqg9W1OdssnymckWhTIzoK"
select json_extract(j, '$[1541]') from t1 where pkey = 1;
json_extract(j, '$[1541]')
"1Q7X9PbmFjkLboQ6YOW3lxciCTyV3dd21lXAA6xNqfiRT6VzS12Dwct83rc4TF6U0bd8iaUYDAxgFSdhRfvNFmTIe5M7JQZH1CQjksFx2CbHcEx3rqQ6csMG"
commit;
select json_extract(j, '$[0]') from t1 where pkey = 1;
json_extract(j, '$[0]')
"xiLE8tWA5urom7lmHL2uXzvNpMTREqg9W1OdssnymckWhTIzoK"
select json_extract(j, '$[1541]') from t1 where pkey = 1;
json_extract(j, '$[1541]')
"rKHmh668WIwCSTBo64er0OTku9DA80TzKklzps7LA4XaVgMbi0QiOrQG0cR8cu5ucptRfymn2HMVwi4ehUN3MlIKNjRxbWpBJgdyfNkfd6BZmFBRiWT2IlMf"
# Connection default:
drop table t1;
