CREATE TABLE t1(pkey int not null auto_increment, j json, primary key (pkey)) engine=innodb row_format=dynamic;
SHOW CREATE TABLE t1;
Table	Create Table
t1	CREATE TABLE `t1` (
  `pkey` int(11) NOT NULL AUTO_INCREMENT,
  `j` json DEFAULT NULL,
  PRIMARY KEY (`pkey`)
) ENGINE=InnoDB DEFAULT CHARSET=utf8mb4 COLLATE=utf8mb4_0900_ai_ci ROW_FORMAT=DYNAMIC
INSERT INTO t1(j) values ('["fa37JncCHryDsbzayy4c", "BWDxS22JjzhMaiRrV41m", "tzxlYvKWrO72tK0LK0e1", "zLOZ2nOXpPIhMFSv8kP0", "7U20o0J90xA0GWXIIwo7", "J4ogHFZQxwQ2RQ0DRJKR", "ETPVzxlFrXL8b7mtKLHI", "GhIh5JuWcFwrgJKdE3t5", "bECALy3eKIwYxEF3V7Z8", "KTx0nFe1IX5tjH22F5gX", "Oa5LnIMIQuOiNJj8YL8r", "qDiZSkZfoEDAmGTXXqqv", "kCd5WKE2fMtVXa2zKae6", "opGY4i6bYuUG67LaSXd5", "tUbO4bNPB0TxnkWrSaQy", "UuEa0X9Q5mVwG4JLgeip", "eBlQtFFJpgHJYTrWz0w2", "kQw1UFK8u2yWBjw3yCMl", "qc4M3tt2un4cDzdiEvq8", "vmf7TZAPjUAZ6Cu86nAy", "YDamCCSQ7GX33A8WhGwR", "k40pHuxNf5JEItyS3QrB", "gOChWKCDa6eIAd7RV4mB", "A5NQxJt0jk9N6L5cdFnD", "LSWV3bvYghhol4EgN5e4", "poSt7VVlkJw5jSYm4TKi", "92Ws4iYQoCSbysV6Nyp5", "Fl8wCfiE81uF1O736dRs", "ouSmmxq8tfB7PK3Zzmn5", "lhLm5Qn92F2q9UatPR1G", "4DNRVR0SBlXwQqgTFRdH", "gd5n5ffS4gi9r6YKVZmg", "IIaj8ECLfncKQh5TLkvP", "PcYEg5ZBeJpubNdiZq3C", "beW2JcTeKP4j1ayffXqH", "qdCQ0n8Xb9jDnEF7oij8", "5ls4MqjzLXF9APZ8Cffo", "pP1adEfRuPX0AP2UDmSW", "HhgS6DaIrE4eb5EEJudC", "HACPYCulwMIE1wg57ENy", "QSc1VpFnjqz019PZLHII", "bYWaSAfaM3WnT7oyw2jd", "sibrryODEhTpFzQi73GT", "6kGXr5Ul7DOxwxplwDyA", "uRx8OLoVP2zTmDzeITNN", "ekLYh8KbLIjEihK408aN", "AXrwkoY1HwMtgfSLnmx7", "2gLiLfnKlLhtsWpaKMZZ", "GwTubvFNhAUhppQASDSB", "YA4OetwzDWYTQzNzubMZ", "lqHadfj3sBEOJIkyAevN", "ATpYRAYLlutVj85MnoOf", "yc1HvlF3N8QYaD41OcK7", "VDcELgY8SwlQXmiQVvTt", "4rPe5RdR4xYXB9lUpHdH", "CMgj7O7aHaRJRovWGYvK", "UUrfba7Qpif15LiChpkx", "NCGp0AJGgFYAhPnIxvgn", "dJmgfTqKGbHenWRlgk2K", "xaVeyGuv9YinsTRVwIpC", "t7qedHPH0Pbx04awLSrS", "1YFr1fMvx97oGwQrBp89", "Di5Bmf757yY6UlvTQHOL", "RU9fQZXZNdhYLmj6RqBW", "mhbHRWkrm9BBbIqzqLYD", "zFjK1SQQIav2HWJi22Ym", "9jxkzojp7F06TjRUBptR", "PoUfKlLKnr7uY2eYqLNw", "bO247RWHHNieBAHTwdoh", "Utc3vEbkYyg9KiBS8fjP", "3P1EYJiUwU9ONjRGw00U", "xgbHNmjVRQsUotjMAPo4", "txTEfsUbrT3o9e5UQnxp", "BnIzfzLpO9uF5LTiDvH4", "OKqWywyMhw9sjRsOQBCm", "L61ORS6cONfmhVGdPFx6", "B4xsWpFu0RhJVihu9nWX", "89HndWQ2lL7uQ4mutzmr", "QT9tAqnJcIoiR3W4Zw5K", "GCCeExW5wIwLm5Euu2BU", "KzCj0ioadrsr15VF21Kw", "HEH1KWvCY6es3qb2XNa8", "CSzDVUSVTmSi1jkJFfTl", "k7blvBlSYLajmXwHzNlS", "7DB6utP8WqtGvV0rglHC", "5qtrNq6NBrnI2wPxpm3M", "buaWPYN3KfEPT5EqtKB4", "CzNEtk9jWC377dcUCzWU", "cir5n5uhP5jZ26mwovdJ", "6gOBH0dR09tapkebnWGB", "Zzkc4WWsQ9BWnah2aKUY", "SN7F6lqtF62o6nO8Hu0h", "1CBmkspKBJrbeyqkhfcw", "jekpP9vf1wM36YpqOc8X", "vz8YvxIccsWLVH9sO4XN", "yuO4QCuoo3Ki0SGwNWYx", "P5JsKQkgSG3R8QVYcOKQ", "Rc8R5ONQvuOIxf8H5qvV", "6wwEMQkyo3PFfVeiu09n", "uV3rAB6F1zk6vfII51Gt", "2d6f9kO1iVocyrR80VL1", "U35QiOglPweRai6hTSi9", "vWmtLB1LfKK9OQX6mDsB", "8UagDgNe75n0ZXuujtDM", "EXVcv1ghCYqK1Q0E5NqA", "QbAz94tqw4CAafkVeQBr", "xz9yQAATV0dubltiqlYk", "piuPMet042r111xR97sc", "5TWfFON39unwahMwJDxL", "FmNGlIguQYVV01AFNWIW", "O5Tyknv3yqODcjRO27GQ", "elvcl4r8Y7dwC4supnxn", "dJ0E1Pa3VqT7aMjLOaRu", "h2qr6jlvUgg6xeIy4szZ", "iQgInPb9x14c3sT8ZC14", "si8pKQmOIlvyCZFxwq4t", "p8VrzwxY8yayeioz6YLO", "JHLToaOlOTcEZ65Y2259", "yf7dMtaQRtnjA8Cxibi6", "2IKbON8PNDYMqdxAXVbw", "OOfXWsUERAITSd2ryAEM", "LkgCNdKs6vpUHU1nKTzj", "dIA6tDvpN7BjrptCQD5W", "9szOK0CdS9M5PX9Gk265", "7Fmy5f9TrE0y4zMOxYzP", "gMT3raKZbOeidPhg4oAv", "28t47GQ2mQQQmtUbRmA2", "AmllBQQEEY7EgzGlFglz", "6BOq2sRUeZWmMFXVdxjp", "Tr19oHs1ye04nMvqEKKq", "uoaE28jf3RVXGUe4mV5k", "73muQhkc02Rur18t7pW9", "EzeUUGYGlbyqfkl3STfS", "W4KL6QEBDiKSiywAFTQy", "2Oph8YiY1MyXQGqUg4gs", "l0KRxGbAhz8kNxPTT80V", "Uw0uBrPpt3he315yGe8x", "dHhyC5SgDQ9hK9ZV0wLs", "z2U14azIE8FqNvoX0EBD", "eKszSPSQMnILonKsLKAX", "QNNlICGGQSR3kJ0ChSd3", "GvM2ghs1z0ZNNu6e6MuV", "oKYZbYjI0MLEGiGwN8wK", "8ThUNl8U70zuKXRw3AE3", "XYGlEWhbdbvj4aDSLLuQ", "KrKeOlYPunSRLgAZBp8o", "R1XVZlvs4pIOgd12MZRG", "MsffYpChdIV4H1ZqkTio", "IzBzaC1wjRB4JojpcuXF", "C0JS1qIjJzWcyhZYrYSa", "xbeEQM42GZHQXYqXO9Gg", "6mG2RpaGL0rJcTX2pZ23", "6JSerIBDPRrVC7Xbu5sE", "6jXgC2g0ci1i1TMqkV19", "vtd7y8irEa5IHcwSecQE", "KRxLtH9dn8kgzNnyWTpi", "2u0HUwj8Y7LqZIBQXI3I", "QlyQ9jMdB9LD3JUXDCdl", "JybqEkGk0H0O3zmAg8nr", "H64IPXnchPLyLupYc3Ia", "JIyKFlSwrFn7JqPiNBI4", "ab0vVpR5rjf80bQDMs9C", "7vJQlg66rM8Px8JQwkVn", "U8tSjJf4BnGGiZeTFiZ5", "4hU1pnPjYsU00NShe5lp", "sz3aYh1mPYrRDJQ37pkd", "fFdfc3LH844z48ZcnZMD", "7DcLX3Mcq6FWLq9wtUDz", "ZFydNWDB5aMClyVGzrqq", "w5MHvVDm0OmXek8zGLAJ", "tUUfRztQpkGlnc2h6ET4", "aFbEyjCC2KWwp0ZGxQem", "AtXwTYdZk6dKKCXIvjSw", "3yqqwN4snjewcAs3gVdO", "bGgtRDBKueGwa6mVTpNF", "YzB871BlWm951ozSz8mu", "k1oJ7aoZP9mv6x1CwBvS", "v3VwrSMqb9iJAWcF5OmS", "XYMcTNmPWhpQkLMbnjSM", "q8gyfIBkhyCCUYmyuYLO", "GBoyU9aFq0cg8GclYnVD", "jiOEEAC8hVVvgJtASRQI", "R0wYGYJmKp03VMHhURoB", "xJ6bayk3P8Jp8ENMmg84", "T68wSNcxnQ6khBJH93IY", "BaNHoidYNkdqqllH6NCt", "lGbSRvjaw078aSNO9zwW", "jZKXI3mPQyGBDsbenLDj", "LIpviDHrCDNtngQ3jBS8", "7jHKZtzMCA3VSrOA2f2C", "sN5d3Thne7vkoC4N33jF", "Dlkda8ocnooeBrHDIw0v", "4tfs3jG7lxMwg5aGDMsz", "AedLTsYkpWftNIjRzzWk", "vqfbvFs7Zi4jLh2mXZWM", "59DRPvqPuM7nAmP4zF9Y", "vDFGsI1PrVkufvJ2q9Rj", "TZWcJtgJ8pp425IuLJHC", "p14SvOUlVwSxTzZmqF3z", "2t34wLwHfDRSDTu8pOrL", "IIGlFpW54Z44Q58MR2b4", "D2UQUOWJkMc3esmrfIwh", "q1lG6rbVtCX7D1VfN0y8", "KZ9wPvn5Cjm2iYGnPrGH", "2oODnrsBrqJ9NS5nLsqV", "acVI8m3YbKnb69ot0g4q", "VNzsn5d7xTcX66oCsriR", "9V3Fep9fWDT1ZSrKXVPT", "y2y28mFycxNlTO17E8ki", "LDjsgaBB3ac2ab2iLHev", "D0fgOglamUI5h1yLa7Vd", "h7dIggy0vbt8bYmxCWYy", "0q4hq01O7Wzobd4GH3GC", "c9JDg58sbgrbVvHLvIh0", "mgoNHrdYsrjUz2ff5nVh", "UMGxFVG8lx8XdvtvmURe", "KA8JCnwGYRx0mBx1fDAQ", "8GwkBndxF4ZZDhqNSmdz", "CYzykxxP85nFMjzVUcRk", "e0Jrg8F6ss54R5090yW6", "3HLPzIvTsKDXKVM0dZ5T", "SAYrDWyDUSIYjdviuoCm", "8NHRsePTDUvdfRSqxQ2S", "sKyavrIpgScmqtDgVd8j", "73KkUnZRDbr4vpeqfueL", "NE7D5Jtbw1I12ckWNJwZ", "sndnbFbG9DZWRehXvb8r", "aOrbyZ7Mq1vinWTOl4cs", "I9Phl6EhfKWEiNpfuu1k", "wwQjSt5Byf3EmQvXV8E8", "QlM769m12njyhAf71iIz", "LJB7k5eFBrLbcgigpSfr", "DPnuXQ1Y8HWTbfYJiDWt", "4rTeX9KLc0ApNwksMjOT", "zuuaYTrGeNAgCdKkmc3M", "aDCv7ulUbAva2pAaI1ru", "MzaZasHKTKh3Vrxdli5M", "q0vtp5R65G0PFbynTD8w", "Vny1ctcLZhhQhaHUgiaj", "zb6CC30dG6YmrUlTLNou", "4TIj4ZDiIoPHNVTXYRAn", "XgZM8KpTfdOj7gQ9GdrW", "RGlolCJIeU598eWHwLkb", "x6I2niB1J2VjGGVzSpH4", "JMEPyigs3RRyVj0IPBHj", "BmSR2vRTkiX13lRzT7sV", "WJT21SIQdY7nKXELTdoD", "KLFN5gMWlCzGWRGXtYvU", "61HPYUkz7WDRpQmu47Pp", "JO3nnJIgsEBwDQLlu3j0", "ZuPPKAHOHgBY3DMqWeXO", "qgJ36enzgWzFQOeiYw4n", "aDMdQgSxIzJ7dcAhFvgv", "Rf8p2lXYfbMFpgrFKJCc", "GUjt6sYJnFCDsL2s6aRl", "9lywRnCj6MLKq3BvvkCg", "zPtpiuioS9XbsTYJHi0L", "2LgtMpmFZyuWLnM3f2p7", "BKh3oDK3vKMxd0oyqYDN", "X5ustEuWGjeP4JQqWirP", "0DKbE9Z4flPCqJ3hVxEj", "eq8i7WWdEN0EbKqnRPp7", "8EHzWIe1FsjsgrYnM5Oa", "QOpzhdm60ZD9oT6KlkJz", "b2rFsN3ESRotobqVCdZD", "ClKyEQIx8auhcjxU7ygZ", "NVQB4HeHsES2zm1BAH8G", "p3ySmtutrbRC4pM640Lw", "Cnx9ZyIjDPy3QuTAnL4c", "uTowGA3L9OHJCCRj8jRM", "6PNWJqh69jg4CS0Sd3nk", "Q31aDSJMAkgG73nQrSU0", "BA4Nb3nC4ZwUav4nOM7W", "4nkCqVcfx5e8DiTojF0o", "ouIMqL7ChFil2SxrwYWt", "dA2orVdakdMWWfqMyyYf", "BEODeK2aqXURfUFUzs5i", "URC043K2zqfA42LiMMHC", "tjbYDq3Ah6q9V37Y4RY1", "HE9JGSzaoGkhzLEA9FLq", "JBzmC4KGVtHk5O3Jr1tf", "HdLFwXP5miu3urp6wALP", "1a84z9NqAEVQpqflN2o7", "liAfayjU84t7f1BcBWSL", "kxjZmOK7P6DApLnPJUtP", "ZkWCmfovBEEt9ySvKk1j", "rEteXe3r9uGgclqMQcHa", "qURxQutkcsUR4L5by6S5", "yjlbSZxqBDOzhqw7inpK", "dJmhdrJZwjeuQPVswTj5", "e72LxwQfkFyNXi38XKhT", "3LOUitKeK1hy9jH4fhiN", "velQMmYt6DN9WlbEcwqx", "vXv4ED7tsnHlR0Blmheq", "uzzQiZcLTQIOvBR9MW1D", "JIyiG8T2p5sk3p8lMj6p", "9MC5WdCs9D3QT26jAXjx", "aZhdPoPlXTZeqlhMMsCT", "5GtZGzGOU0L4Z1iwn5gI", "YFwOyciKUtnX7e6NbLl5", "L49u5ppquV8Tk5pifW09", "PngWPlr06a3PeCHi06Yu", "bhNJkBzPhzW6kAa9tR7x", "1AMfLcLLiuFIZbbHmbgT", "aAXJK7SEYYBZiWC18YMq", "Qa8zBiExJsOr2vAK2bYY", "9i7pCHrKpD8DnFAwxOrE", "GF5I8Gb8p7gypll13cJq", "oS2ZhCWcbLqpbv6h9hoy", "oUucEgbFGv34N5e2I8er", "RUg0PkiXRWVEyOqC4RPK", "MTNhYzjo5LfWpKXD4FkU", "jDihZWsdxHwIkJxHGf5L", "0jro1O13bjXKuD0Ujs5f", "71xqIu7YZAtYtjMu7Nwh", "4T1wfzQOrU3zTypmtuIQ", "4AyytKqyfkfhEfcte0FW", "UHTyFGi8A0XCAT83mx2P", "hh5vKhmzh0TCHwAWAsdI", "q8U1bd2Na4lHkqB4Xv1E", "vUOAQWhYMIqDQLEzyELY", "J6n1wy3Rs5dnZ2wyYdWv", "tN6HiIGeWbAnfxobuq0m", "veXSgTQC4v5xGBEwTTa0", "4inifaHXQIJJwplaIAmN", "5qIL1VFTypR0VCiAm0gA", "IxTCmDm5NWQQMijMByp9", "lGAGSqODq4N60pIm22pN", "ZDltuUF5Q2FBGNPjDnu4", "qFAq2Ra2TQP0bAuVc7b2", "AoBQBa7OOzQCFZ2F0cIT", "0fUcqO5QTgTbSc0dD70Z", "5OlIxlXxNpRMVvwJH1ji", "gAK8lKkyPiXU6Gm41I1O", "7QiaJerYeZHKjbQUv8QI", "qvnxBXzCp0ZvPFTiuLHW", "uYqb7E40NUIBQ38Zb5kO", "6JHTYlBQ6Qw0ykb3xf3K", "8MVWNc5yhpLl6cEdLO3R", "oyPlgzodcsxkCRGZ1KWg", "7rSERern2sCpocaVbO8D", "E4wQTAyUSUAaJamiFbVF", "Rg4GGclrzr2DvweO5cqX", "417NZr5mSZ2uD4ATftIe", "kIreFT0K3rp7qxSPmWCF", "3C9GEHht8zXsFNUUqVms", "MczCXQZJulWxvdBAsq30", "pZr4wLXkoHcAraKM0ues", "dAnZmyhemkfbHWdBp8we", "QYmF67c4zGwaOj7AfopR", "XU0oyc0lkuP8QAOXHybE", "EWocFwltkaKF2J4yv2jd", "w7mMF8tW6TiIzUsCOd57", "BOMBhQ9aSrDMwxjB3cf7", "5LP2pGFEtKJ3gfEN4MvU", "D7r74aI6AvDEGbG5rTHi", "oalUGyqIKjmVqdctBuzM", "pAa5lo8cIQL4y4WC2KUK", "4HpssRl4JiQ6ty9ckIF2", "gY4eabrbtJvxalqTCZXW", "Gva9tklb2yciUgK3F9e9", "TX41IsUTSzxiuXplHYLJ", "VxzxdI0rPcysA2sSvMtL", "Kq1COowdKHvpEslpAjea", "McQWfIwYdorveq70c1ew", "GXkSPVIYCu6YXW2AnxiO", "lXJNNOOzQ0tgXd9u6PSJ", "JYpo5syqngEYBVvYtHVH", "FPyk05f7S7OleDYh5WXs", "BjOMEIt5XONnlJVkOArq", "GDZuQ7bUe6Knpj91z06W", "NTJ8mpsAxhyBuW5JbenD", "k70XoAYnAfKX8betOU1K", "A0V2UbL5D6JwEJT0R0oa", "f87lhje6CeQMevO6UiBg", "oUc0o31F3npitvSac4eo", "i2AKwXQQFc414g2sk16n", "mtUfmuFPysDfuMzqrOF6", "yJ5205vi4zTqsxVdrj2o", "bDTTXSKOoXSmqWpobiUg", "hyWXv0AlhAZIM2jrS1GH", "Yg1PCqBmYgSDewlXutIb", "2prMrbDIcRXB8YYIPh4v", "NU9zPsXJjnvldk5ULJkw", "kH5qqd9DKB8ggHf39CMt", "0Fcbyi5JzoDj5IYtvf6E", "oFsSUXVciqVg55H1lKLk", "8YSCp05kdCwRPoutKPV2", "FygJ2xKnFdYOAyYzwdhZ", "ncyCOs6iGZiTYOkaJ3LZ", "ervopTll4RIs1F4P788L", "ionEDXmUY53DxwzkNjUS", "AmKB1MY7TgQBVDNgj7AH", "CCU96UuUDOuL8CU8Y2Dz", "hdAArVoacyrp8KyFmqhx", "CbILnkRJmeJRHRb6xNeX", "MUMSoJfY7MVKxldiV40F", "gHfvgE2bcg9w8TOum4Ss", "QxCMin2Br0PXH4SwGSXs", "7goF8DAsFckfYwzEh0OY", "0l3GnUC3ujw1OkFUvNMA", "x7oT1lijl4FmpH2clCfd", "tbdHKslFD6OADAcCvKvh", "O9TDQTp9dSmW4PmMFVZQ", "bxZm7Bz3Tsir192RcpYD", "HLjJiTfwzFKYCtLI4IJX", "A1MCAMbkBAxTTek98Q35", "fOdpHw5KEOpPPAZZW8Hi", "GE9jttrzHu4uIhiYenqq", "AfFXpm7KvM2Bb9tS0kRI", "cVAtAsPmeFdosqLgdQ0W", "n0fM9Yo7GDPtiYkqQ9d4", "OEqE2Cufas9NspjzLV7c", "iUTO2DFTKqVi2Mu4Wpi6", "hrSae9X0feaL93k9ExaY", "l6EnQ8rwvX0dNSB1cgzF", "LZaSaKbmFCI0GUngddaW", "8a9V3IVdzUsI2SialJLy", "Tdzh8kNjLvFUWNzXdSAa", "v2qxSYVBqqAJS91YrMHD", "IUhoreJT7T30TuxtSQ5G", "FDafKZDBvSMBw3xmgGFl", "jGlA8g4Z47pJKPyewBns", "bA1YBzKrFXaxlL7uz9T4", "GINagKCcTyS58UdJTv9g", "QjdB3l52uW6BnSjTmu3F", "sUIywtFPmO3C6hM9SR9K", "wETjgBCQ5Ddvhwtdp80c", "V4obl8iBYpVU3xDh8N7D", "Yl6GhzrU5s6aut9d1poZ", "fH1gEEOMZVX8EdOvcDQg", "5UGxNOaNDMuqewXq8vDi", "OiqdMCWwPucTPrQkDz5O", "L0Fxwmo4fzk3hae1kBy8", "5YbUNzDYyIxIICFCw3Hb", "21ciaHjKSfQXC10XzD6v", "V3DoDTy9UFkVFMDnbw53", "aWZmVZJUmPOFQb1d20mV", "DU0SpDDQ7JSfp1RKajnK", "8BXXkZAlXvGkPGBCRObW", "f3CU4bncKauRjRyTy6CT", "1SCPgNb5jCcPFmtHLetg", "Cl5vB1N77Zb92nYg89mr", "KMEZ66pRki5xS8sd9DiH", "nHQn4wTA5D2NXGxdKm35", "S82sFsTO4CfrT3cWz3g3", "HgQovNQF7TKYZKQoBuDF", "6q4Xue3thkwwONjJi9Zo", "crM9CmwLg9YkxcIrGJjv", "1fsQ0bjjkGVK8rRIdNdI", "UB0SlGJzY0uZgmzeNhL5", "xqN3hpJJCwZh5Z9ooQnM", "Rgv5StjoY3rTtFXb4qsG", "lRvoy2bmTM6s20xTteFR", "h6uZJP8LE0axPVlNYM8z", "hCrjCmC5OPU6WNdnml90", "ljxAEhVk1bjioYQ0Ka4j", "0YnUtQHg9Qeu9a2MFX6E", "9qvvOLvhvxOvU9PNXf1g", "5gaDEaZR7dfERa9qt3Vp", "0tiU06qXlrDoVl1jLY8Q", "CmdbMmRGnu3mllElr4Ia", "wTPREO9XvHy71bgOL8c7", "0ftmO5XGAoo6HDVUcezX", "uvcvWIHqOrvPWm9trg71", "Uv5m9ZEjBDE59ozd4ERT", "6Mqa8zRydYx8U3sdc4Kn", "HYrOKo2O0Rp4ofduc4qE", "doM7pCiPE0AVW1sqnuEm", "L4q7hT0IWqW9cqER2wqG", "w1jQ0bGmTUYnWMuCqsUM", "h0TJqhlqbZ4VanvZNBLq", "dtdADWM1MoL3ooNcV6S6", "fWbGHUnef8TJz6RCalEx", "ZZ0NMLzpRPw7vVLC08pd", "EIwDMLNx6Zsf9s0TCxId", "MCiFi1Qg9FHLVCYrXumc", "TeFaVG3hBMIWY1jE29sA", "MAVrM2htwTTP6j0bx3I6", "PacwZMAcT3kqDFfXHMOD", "osbubbVYcle0JFwtZ4T2", "7DsISWpisEtg4UYf33Be", "mne60YzZcQcidSy3ymjr", "ydV274h95qnsbRycxvBX", "LnDwGCxEyh3uKXwPbbYe", "RJW2iUefNoBgbOcpaa2W", "F3QZaKw9vToKmKNVnz8A", "lJrLiRAGzAlEE9loUiyN", "Bmiv43Or0X0mop7UGFlG", "QUScdEO5uMT36By9CN0C", "s0yep394HsIhMkHxwf3q", "0Wt4fqDrBE11Cyf01m4I", "eKxy4Eu1sxpsRhu4X8ti", "KuhWsMUu9WAlq6ivKcuA", "Xh0yOv0t3tZNnGrgdKYk", "qgThm9c5lUFGBGEYBCRC", "51XtFMXsg5aXl2EWBobx", "GqBP4QxDaNPgMuZbH6Sv", "90Ss2eOEQz9goK6si16J", "OTzkOWKdamYhmzZpdw14", "tAihSoaBqeSC5RvTvF4V", "zbClajYBfZDZhwE8imJY", "QjjW8ex3r0WqbibBP8M3", "fYaLUoTCbkjzTSTb4Rcv", "R8l0oKBDSVE83oRXbuiC", "cR95rdev2GqRObRCvaNM", "5cS7Qtc1nKBNjJSaw4Vw", "KLLguksqKFANrcUGV5FG", "PRd9i3jc7DYRWr7RbxFt", "APG01jGUmTkBsLIaO2CV", "DiujZzAAuN14kG2lxIDj", "kxucIDDeDN7O6z7fyGoq", "dptO3v70CLjwGcWXnjB0", "5JOBIToFjc5LQwhTsoU4", "7ByOnUvaC4aHNwSeQGt7", "rwSFt9ijwAn3MlP9DIkP", "NIgiD6MbLDiC89RzG7iC", "ITEeCbnPsVpFmTvzaIav", "TG5bNUaebGotj0VvcHJU", "m8hYbaV9q52KK7thbSJB", "i84S6YLipeAZkp6KQbTG", "fWYzbSeBuyMc4O2AwMrl", "0zJlpP3D0WRf00caQFlK", "D7uFVvPSHGBFEUy3r1Es", "WfVUd643LpLWwElQ9AqO", "PzddSaeJbqB5Tfa7le86", "SSaMgLmpTaBqaoR2M3Ly", "tV1N8bStEYxg0X0gqlTJ", "LeAtRbvnfFjWilroKHhW", "qcAq7BVxwwGHbO90y2lb", "HT7xCxlWEQ140Bt7MM4I", "IJYrfhrdjbCz4IuEFeiT", "2jW3vN8HjBY1S6t7lijS", "HvPJDKXSwGuyzQzun8AU", "JiVjmMqX3ZxKTNcgf97b", "P1XNPXHAdReu77dtUROV", "zMnShP6KZDvwCQJZvZjY", "yNQ6V3xxTMSSgDuLd0fA", "CY6MwQwsxdOv1pzUqxPJ", "Hrjv4dGfctpoRw8LK4DF", "iaAhPA9D7YVMNEHPqX5S", "QsEpmKA4NMJ3wUkJcrUh", "Pz3kCK90rCSF5e2pyAuL", "UDMQf6hHvCyI912LLALA", "KlNNNNDKW7d0I0Py46F0", "IEISDJlZT5hno3BCQOWw", "T7xl7MjCQxCjBS9MlutE", "xb0meBy2XSz0ZulfETre", "Q1LZRUvBNpPKON42W043", "Q11yvnd7ESmeR5Bsa63v", "tRDHmGHJGKMhLOfF9IKL", "i4x9A8ziC1d6SoLE4bVL", "vs0EEdTNtmgbqdk0lhiv", "iJ186LNAwsTpiR3w4VHx", "HxY7YG8JyoFe6EnCX8KR", "ymGhDKbInrF4mmBL0Hcy", "4pbA2OKZWezUQF9cXluK", "a7MMrWfsnIop5Px7lHfH", "uemIrtuNemhCs4ZjaCZL", "UM9Yj6fVMImEuWWmQR92", "BoF3qmlOyIiRerzOvctF", "vdTpA0ZaPgaaTpcJZNiY", "fOzIDyg8aXMTApHKnqsC", "XRl0ENHoixMLLJdYFHfn", "m1HxqYFeM6orXZplu7Za", "4tuOAVwNnZBXaQUPwk3I", "qpALNz6F4eq9VkVgFR10", "1CYZc0yWizpYpxrCwyPz", "aF85xbjB2lB1vhZWiX2Q", "XrxKooUjktiK7oO4N5FP", "qPPm4yIkTIByA6Iwskdb", "eJvl5HnSN3qDQDxU9DFc", "WObeSraKcCvGVpzZ6m1T", "npfB2agBotoIHNwhCU1o", "gv2Ai1jomiGXYtjaTNkF", "GWXVtTC5yBsc6umouTbe", "Cp9iisIBF0PTWwyNO8RK", "KJwOBhB3AmhKZr2HhJQv", "HpOokLB8TcSltOA53L8E", "5oWedXvKoJD59artv31M", "dR8XpGctbi5gWZK94DSs", "WfwdFnU8qTTUuZzipbZQ", "Je4oBOvGZN6512hGoBNe", "fq6ZP5HEeocwQgkc2fqb", "1we2xLGlXbNARShoVx0A", "lc4CGooIRerQYWSVphEM", "IcUi4CUZ9Vhu7l6MZsez", "UUP30qWnVl8lNcRPowyx", "RgqWPwsxnVwHzJIx7pka", "YqMvTnIHhED8u3dIxVFk", "yB2vSKqY7b8fRUYsGqAx", "5L4xOhFLAU69d646QveY", "UmDtFmkTauOfDSdb9quI", "L0Ry6T2VMe3oPEgeyQ5Z", "KTEXwp63g0Lzzkx3CyYY", "cZL1o1dkRiJjCWE6JK9z", "ITwHDsJNqruSPFSBG3vh", "mDOwjc20uByCcuSomlBc", "a53xKT8YW4DIFbCwDEw7", "OuI0pimZRyC11DxKg5sA", "76RMhdItsDyE7GCuwzUN", "veNwrKEVP7fVB6rqk8ja", "LgmSuyLrvpEqTZlKtznH", "4SmFZb4Hjlp2RbTMZoDV", "bPJ4z4Mq2954brK8RMN8", "7CBZncvNQ6q1V73SCPJC", "WOG5EYCduZl0muZZWSuu", "Wkt1swS2JjCn7StJz5ur", "egrQYQy3qsxMbpMRloR3", "Xdqc3hu2mouPSlnzAl2y", "exLFmfeWT5XyiNaj3Ump", "HeCjP0iXliWNgpaQUEuv", "JRtznTjqwTdD7quUod2Z", "JWxzLVQnkIi1kb1X2iLy", "By9Im2madmAwG5wbYKMI", "c4KKdJpgzAcA9mQtoAUR", "xcLDhHnDZ7WACoUp5KT4", "S6CbqcVcmx1hZMtEeeRB", "lvLxjolm6EqYI288cbkP", "Yl478xJkbkvLgFIN11A7", "E0dW1lfdKP0sB3xH0G1a", "zuvf7B28BADP9rvAaalv", "ykl7njOlxPLwHEZPOaVZ", "kjytYt16Sn1QXlXKSt5P", "GPKXbrwzRQYC9W3hO5nq", "snENWjfyciLs5dNhVIgw", "iF6pjAU7FFv529QYq5UQ", "lqGrTeYwwEtcRxRB7vGK", "ACNBJnh8qCYc0pTRT1ON", "DFxdCOmIH2aRCwaUhIcY", "SAAQzbrQaDllSiOd6AvL", "BTlNPLr7bRf1cnRZMH0u", "SlftS2WWCPsLsdjGwYNY", "00Xalx95C7zereXJg3nr", "SfCJGtZDQujOuGydD5iP", "Bh22JZJyb6p3kzK0rtDH", "nuffBbIMg0krfmrzJ8xu", "DkwxhGvY87nt1QXC1pXi", "oHXR1NQKVLDi39dlNZHT", "e5NfTsqVhNBTcitb3HtZ", "d6FeDrNbOf42iPhBHXex", "spOSWH3ZZx6A1MoFBCqZ", "psZXGEgXmLSc8r5e68Ef", "3Kp5ecKpo8Md0v8GAmmu", "5EUE3ZsAg4pjPdo1F8r1", "EBcF5iTDUD7YQbmT9ebp", "jPY60L7DRwEg8otDWKOy", "YVWw4GNBvz0cOXiOqnbH", "knxqbo159P1fsWbuky6d", "x4FJZvfPhEhR1cFaRGda", "ddFV7qPrmTVkYk15ehVL", "vCkvozTDD7nqi0Jpqggb", "8BLguKjW1ErvOZqBWJOj", "OCX6AovzUaacjvGdF07F", "CwAbVym1HAieKFkV3eUW", "E46xxLZALgNVdX66Tq8j", "1qNJ45o7jGbxIitF3SOM", "8lrjHwqkmwTlmo5qurwd", "6XZODScGu0a0jQk0MYj8", "UAsEzx5tmzWsW5HkVryP", "pZQYz8XJeGP8QHMPEPG1", "Oltto8dKzZjo67L3DsMr", "6mxW3KuGh8F6t6ziFa0C", "9jzEpKH2AesGQpkR7chp", "lutc1qIGQIQX0Plph3pp", "ff53VoUaOAN74Gk560JU", "Ji0H5j4nktcPZgS2Svcq", "50y7EgDJgUlxCjEITI3B", "AfbhJ1jjwJazHW7UCIns", "mYqzI2FjLIuTvTAFVryP", "8WNQ2UuEkf5WBtTRviAE", "y3huWr7zg3PpamFcE7py", "kuSvluNgaVtZYaT5QY46", "bRvBB8mPDbLxTmrEgEsE", "jlnIMELkmPqOrkX0qJQ2", "sjzLVqZ92SMmB72XMNH6", "k6SZoyaeH0gAheTBS3KT", "TgFeoFA8cPCMTdwHbWuq", "UYy9CSKdTf6uJJW5WeB8", "4MSXzMnYqhMIFLSQlm1C", "P54hMamsFwyHIQmHlZnZ", "E7sSQIqB4rLSwP9G0t8D", "p6S7WEMFm7pyFfQfxGp1", "5ARzaYFYSNjFTBNyNhB7", "p042fUhcjWcmf1mDazl2", "LSHmbckwIu45u87Yao8H", "Ji4yko9KluK6KZttAbpS", "VrXOxewWQ2nhlpdTdmnN", "e5TweMpowfERWlpSNjym", "klTVZ5yArjXUm1QQLGDH", "tRjPBWpYEnKyXmR6rNGg", "4o8qnZE8nPQgr730dtWp", "grnDbCHQXY6bKDP7meFZ", "3fFsmIqO9NDqEz1n9HDh", "pHG7UgEEIRnJ70ArH0DQ", "NREZOEMXVXCInTPF7bUN", "2Fg9GqzVpCvCb8kzM4Vp", "cf7N8UcD56a7KFFY3C3s", "Ow3y4nvOrQDR6KoCoROr", "Vwzp9CNDOQ3kL4iPreoh", "2z66KvH6KdwnZvdh7ysT", "NvDi0u5pWrUWrZd9UsDm", "V9Z22Aj77baUVmATgFGC", "5jiuIJ3kBEUeO1fQCMWH", "w6jRstsW66g9pP35g4pq", "JHUhJ75TUbkQgTpWMf3Q", "ljaZ6deniSdzj5e2DjVf", "JD5xgsT0XUPIEzpIaU3G", "ugFdktevb9auNdp1VI20", "nPGzO6HwYLDSzS5hMjax", "rApCleDGuDEhcVeybuv9", "D8ZAaequMQrDbePMIabD", "onsOIVNrNIyaQXiyAYtW", "zijYN6udgToSFfrXAENX", "UL5utnq3KjXJQErnKjOy", "BDRQsGx0SKVweaoVLeWf", "M3ymHnXZXvVg6w6yA1yc", "KTYy1MRNzx0L0x5FkcmF", "VHvcCzYM1XxLyVHyqiJp", "fJAdGDqzncCIr6s35RO6", "wLPsqgqeO9T1RbefoScb", "4pswvkxy9L33eSwT7k7T", "sbVJA7yzYbacOQWHBSFI", "lGMQjGroyyHqXk9iq6fO", "fFy3eTInvX5eoP4VftHe", "sYSNHa55gkTJyPMcsePl", "9SQvsSOVMf7CCaZRAdWo", "Lz7JORtF3G0ChO6ZrS4B", "8CNIkujuXFitCpAYG2nJ", "ImTzAXWz0Z86jVOTO5Nv", "K3oWsx26zqNFcoDkMjiK", "IqQzKmSirpb9qOdiLfmK", "T7X5wkoGSUaiKyiciAKZ", "ywgoKJVdwHvQPSTJBHZd", "l7L453gnCzKAv0wDHRqD", "hld4B7LMMuz6zJA2KonW", "n5ei5btK0jVfS7jeE40Y", "wyevHmvbbi6Onk5qJy8K", "gez8lhkxjjTgh8ZwsTXR", "BbqxMtnfrwxVYveJaMEJ", "5hxknVegyC79lv67osle", "mg9KblbB8pTBWQuKvYyt", "i31Ux5ZjxKNh1X1aGckM", "RDYwdQEXyAOfBP98TisO", "1D62i7aziKL7Xr39HFgE", "P4tZS0hviXJhlPhRVIQB", "ckI8bKHrZv3xzwUPwBKc", "hcKQz1rUHGfu0w0ZGHOn", "CRi9LCXHMps3RARR9ItR", "WZJUTJ4jYQWisDpDPMTj", "CJkdTB2cSw1yTKTwbVd9", "t7rlKhxi1ORDhCp8Nrip", "lkmE2F8eillbtbLDIGvJ", "eLVJXKPs97ivpS9shGUN", "1FyuoH66XzO9KrSpBriK", "xODmqLcVb6scKoV86ZDd", "WZnrQDeZ5Mr2k5maQP5z", "TvZlk4sqb5T8cEx2SbbV", "ySVgVHFveIu8EUryWjm8", "mFEOSBOukxNiQsNt7cpm", "uhs89j4gTqmF4ycW90Ot", "wlaKbvDiX2UPiMWr6aVX", "RFkTDKzKJLCF4kZffmNC", "nsZVC5KGgon53WYHqVZ9", "qlOuVxZAiuKVmuyxzIDd", "6zi8VEPLjyTXirPDnyMV", "rg0bYyYYEmBJjsRE6oXq", "k0LSslefh0AYe8AD4ijI", "SsZBkyNpkvfVv0vljZOR", "XWzCc9Ngq6xIwUUfTpUD", "k9ge7cNrBkGhEFtrNEXD", "KSVExxtOnNbVUI9csVR3", "FhiTubIHpqU7GyMDvFbg", "bBC5RJfJo4K1j3TeclvS", "ZQXoOr1H5bygk8lBPPUC", "TmDDperSOksx8NlUFlmK", "Kiy4ohDD6fPYRblHFahd", "KZZTwIx91hRLNPNB5aP9", "FmhhNQwb0dEJClk64fG5", "NfPi5mu8LHHa3xFRNB2M", "oEdyyN302J3NyS61Dy7Y", "FP8IMOhhXh1MweIu1Ls2", "cvNZORYbPg9c5FtPba49", "I6TCkl4k5wkhr7EDXnou", "TvXW9QtkyxtG1MSm6WUB", "QEqIL5VqqIlJDIpKgg5e", "dwtdHLPNqtWG5KWQN2HD", "K0WVIJqwxtaZpRC6lZRZ", "SvpVGKtdMApe8J7QbvKY", "ot7cKJi5s8eI3SnJmhv6", "pkiy1nMchfBTYG5qamwQ", "uYhxyUFi98mxqStrGFUx", "sdQQtUHRGBs8hZ5e1IMB", "Q76GZz8pCak5DBT6dkYt", "tO1Zx4DyLZ7lgD2EA83N", "ioSvxv1YeXRVvQ4qSHnn", "puXT6ZhGhlbPX3ISxH0b", "pP6in9ZFQM1FEYjK5QZk", "9A9eCP69g6iVTmEGvnUK", "7VZL1Gg6fDqoLxRXMXe0", "cKW55iK0ToKaHsvI6ZMl", "kAY67zbRWGR6YvCdbUc2", "IwcZmWpt3BeoLCsQ9Tpg", "hEmGAwtjQVmgQMDCq23s", "DggWsYu2zjghyQx6Lonj", "IZOiubsiewapcEMSkESk", "y6PuVM0q8nXQLv8DXzv9", "vUyViIvTXMBTSaNxuNl2", "8HTTCZehYYqR2pwk7qBc", "CM5euSaonLrwcKNnr2UQ", "aLra8mKDcUqootQjM0X7", "KO3ugPfYPAwxTlXZXpm7", "Jav8UKroKMvclxVPMAvl", "IrijbDI825GMf9S9THvm", "drMMorm82ftIVZ26mKEm", "PS63cYA3p6pRvCnh1Xp1", "DiKgFMmzeyl2Rs51QD4E", "JsfC2Qt3yi5BONpdhbaL", "ZMNyEQxce0ovsR8us1vq", "i0z6Loi2NIOuejtq8oRk", "oFdghlYXlSNRSKXm6DoT", "WAN8sEz03QirdLWI52po", "UCFvUkhayT3SePaWdXUe", "vCUZXyrcyfQTrdMKO1uK", "Uwm6JKcus4ZnG1KozAOx", "pnOeQiyojr6ClsG4Dtw3", "vTqCU9yTJMR89nkYWjKF", "YRPJJgLUXFXSjMcDVaho", "v6u4reaNLvbrM08feR8B", "hfcQ1EbWnIIiMAkEnLZ8", "GAyc96FnYLxF1Zd0lEXY", "VnEpyx3jIdpWln6uuJiS", "fffgCIgvWBSzxgptdsct", "TRPFFV79ppZUSE8eWma0", "y2yvgnoKdOD7pbK46RBt", "FkLhwTKSGuRCuP5aCrsn", "F4s4fA7jcIdp1wWxOqOc", "inoaCt9Mi17x50ziA6Sk", "N3ZOx4JLshxZUj9eaIyI", "I6FL6F4EJUzgVY2SaMoT", "3j2WTBA3S7MkBZ3Fo5T6", "ZSm2zpVZBH0C02gTErVe", "wrM7QPMDVnJ2E35DqYkz", "plCpnsHzhmbbbxizL2Ao", "oTq2VtDLRvLEgX2SNJP3", "31ecwLbHLm59Du9ilM4D", "INPwuRMFimGllvNfExvZ", "j0husqdeBfpT2ENugk7O", "UO8DJTsXQn47mj2eadGl", "I5CIKZCyHJMlhSyywpTM", "cWSMFU1n5FWNLiddGpbV", "6xHmODiK2Cedg6zvYyjd", "EFyXwbAAOlfVguF46xO6", "71jn5hjedQFrdEMXnWhC", "FLfwDuyJpLQxM7kRmR3Q", "rJFVVc2I6iSM17IEzEWn", "ZukvzULmwOClfPEA1HR8", "xtSyziAwwgjWaRPawkMq", "9WZovoxv3O10FTwC9675", "nqZLIzvCjF0qjXddLaWO", "wXM9yIM7NTAAHkTXhNhO", "afFKDqvYQRvKyFTuYpzt", "G91WrU1WrjvSM8kZyf6M", "6zg2E9wkzvdD2ejs9jOy", "SHOmP8MLnQhrPNtdXpOU", "izhjePbl8xhYD6KaEew0", "4drRzl3WYPyHOd002Zl8", "UTehZxGlZClcnd3mO6Gu", "VEBss9ssgczB3bqaY6L6", "G7i2ijo4o3yHHA97H00w", "cx5fYvF50YBEfrGLY3PM", "6OeLWlTllThNOm0wgDzg", "mAsPz9lYAAuGWWb2I4o1", "VTNtGNowbnaNwSmvZVRj", "gKzCqZD6bz67STygomcP", "YCkUdVNA0pue9rrxO220", "z87Rb38PoinMtVoU09ez", "wYd3OS1mU3mR9rtitz5h", "fs1YMp0KwfJtBxwZPvKs", "w6J5wAnp7tWljVH3IIOE", "xh78c2i0x2su69z2IlpN", "cJ8JoQN6ilLdQQl3SR3Q", "RtKW0HWI2MeefkySAJYq", "4rRUIDVicY84RQYQg4gi", "QKL45HWDY22csT48eYqH", "6xJWLrw1vciKv1MyGqBo", "sBOkfQqJyhY5erZxgTzc", "5huygGww68kwH8fwYVEX", "Ckaoc7mIajsdQkc60Y26", "ek1wsgqOB2tMnRANYud6", "dWk1EK7Fs7JVpKPf0D2A", "GvW1LeOrZ1yCVgEk0Jzq", "PGLCbisZwujAnFB8uZ0R", "Ywd4apoa7lOUzigaQYAK", "SrUE7fMzCKQlE1popbMw", "KlQJT6std0E3rgHyMcvY", "wJJ9L6x8hI4z3SJWW9N9", "9ZB0GSxc4s8zAQ8VW3bC", "LfBM5SsZbEjknsj3IgdL", "WmKgAQ9gRkslN27SUy24", "CjmzbV1rBeCiOWOYuWDM", "G55e5C4aA4cKnOKMuJE5", "vQlKv8qne37u7CWCNbkX", "fMsRjAldTxiMOSgHaV4E", "WA6bMdmjCUFpp5EYD0Be", "xr0JJfYtAb5elCG7n2px", "W4kJ9zrMx2ysuyABdi3n", "J8S4IgA3gzyA1jU8gLSb", "OQTGOdR2MSndbDgrtqvZ", "ntkmaEuEXMpvmH98uZAE", "1wsa9WS1MNa7EItnUlz2", "7pvr65xye6Dd23EBZgCt", "1lyD3p0Ya0YhnTWrYTpA", "Z0oZ30lagvRfePsgErCm", "pkTcDxTmPGuyHiYIgHrM", "AI1ngsTsjffYP68c2ZMR", "pHN4xtLe8CyJSy46qXzZ", "Ac5ZgD9ikU9XjVaeOvGX", "5FoXDsc3PZaXBd6roDYY", "ff3MAd1ZYH6bWs7hkji7", "IGeRtiGhtoDZUHveuwBR", "CF0i77Orq6y6NcXEKowC", "c7l4MehHbsgl8gTDop5c", "w1hHcEVu0P6bXpftUK83", "DmoJRFWD5Zp1ZWG9jl3j", "B8IgxwXRGeURQIkrYF4d", "mscJMsS3bWlke3Qbzw1E", "aVfymOoIdstNiTh3L94u", "dpfFr3pozq2XJiW36KLh", "AE2rhjs0rwvUkYkbbZNZ", "NQ6g6akAs3p3GrsxZkwQ", "gpsQNazy7NVSlc9pArx3", "sm68by48g0WMpNlCxi83", "5eVoEcbORYRKIVSuRW07", "UXSJuDTptcsxEOlS0NqS", "vGmClC4Dh4IBZkTTvwJp", "W9mkXVCWs1ymHiy0s2BZ", "6UlgEC788OxfYhN3CYZ5", "ZVpoBno4n0drSMVeYdmf", "zjIVQfZbD6gkcVYnGLp3", "LTslnOPKzCzytHUIu1t8", "7Xqj0PVGkKH3l7oZVDrU", "NqRF5vXzuO51vwjtJE73", "WO4GTspz3eRPUseXl9Wd", "XafQUOJnaQo6msMFi9Cl", "ne8FUmmEtHrQrUoLs76S", "XuXHmtXU1jDoLM2o6o0y", "3rOuMBDCIJfoDC5x3aR4", "IdrbxrP1fPzjFObZZnjp", "6OdIYhFaFhcXKT9FKWGy", "uGf7cEe91Ny8kaOIFdqU", "KT0cu7rDd89VMocy0E72", "c58MdWcs9TLSwL2qSs13", "0AXKy7IxMPzyS7K4bwwk", "NFAJaD805923KZNGgdD0", "2AySFGWqBRZYghqHuyFx", "5H0NoLeVypTyySRDgx2r", "ObQ5IEKBCZ8Fr7ddSF8P", "2cN02oEikGY6pwB5ATEK", "3NZsSCVsPcHSCfSCResB", "uQGhMRlWtzouKOkmYDfy", "pwOzZqBzT48NSO3pooJh", "n8b8ULs2YXyMSMLzBVye", "X7zzT0mHo6yaCXigsaiP", "6fjWz2VAXUm2Zk02kmIX", "qG72onieLP1R2kx1nRAI", "twLQeLSP5kwwz1ylofN9", "4PZ67U5stFBmAUCondBs", "L7oK6n3uSR2UoZYt1bmv", "rxh1RsnEVz4q4tBBeC56", "d5YPc4Jef5ZU0EVP6Jbb", "IfQMYZVClbGNemmHq3tU", "8Sy8eSXjj8KzokLKHpX3", "QlQ2YAHMEAqKanTFFyyy", "5GxrzG9G5gHTQhUyslK4", "w9OWwpj9oh7rw2gtIp9M", "URnu6Hsw3A0zHPTDEDM0", "sRpoTVhkJp6nEtfK9XHC", "fF9xcc8ppTniudUM6A4P", "z8ADzpV8KkKy0Ttc61Rt", "SFbLq4huEjIDrSOqGtzY", "eHWclPCpReirrICfMrZa", "arlRK7IY0F6cWdCF2P4R", "1lHs3TXNL6xvwgNGndml", "qsMMTWaWvevwPCmQeJnz", "OisKOFY9qKteADzejZ8f", "D1ZbCM1qfpp1XhJuvr1j", "9uOK7Nyrw6U773iJPk73", "Xw24cMwVDyCNsYfyvdnp", "hHvmId4gLBjq6jti5pBH", "nNeeuHansNdZcWLu7PYT", "ZHHf1AL40WLlrxNlExX6", "K8duezplMNCvdUacevee", "P0OFxlyAjVG1duwHrj1B", "4D7fhfHKZuwwuKBp68zn", "bEoF6kUvTT6YhDDMrTgQ", "LbKFvW2zc0mDEZQIJvDl", "MJH3VSOKt2kEd4RZYUW8", "UJMgqmy9fBs2S93vaRFT", "Uxi507eWbBf3S1jIlfPP", "oIPFPQAzqQRIN7NNE0uq", "9XrZWZrHEEe3U1IsQQrG", "qIYCNtZctRQ0yHZUqOk3", "dM45MKxmkp2b5YnTPK3J", "kTJgkr9ZFrcsBgwX0tJi", "gJJkp4BFNEW5hplPeswu", "jWktAgQAaitG1AypD94a", "Nad2NOQ2FMwwtgp3LGCv", "w39xB8kOFowdOZdkw3mB", "Og7FKvIfBSY7Ti2fon33", "ZyewXIgRJQch6iwQdD6m", "der7Krk8enACjo8H4ogM", "EH1Izwia9oKkRBpl2Zsf", "L2r4ozJrl0DxHCFE8voF", "i809HpsJPkykknmXk6OT", "6ZQLldZuXL7FR7MivE1I", "xy0hlmEUsaxw7MHrxojU", "9qhay3IrII9DG9uzv7Tm", "fRgnnycikLDuBuU7ylwE", "35RHCJE6Ois47WpsSRaD", "ml7vgZ1cKxoL3DcDWpJv", "X9zcgmU8D2LxoSqS0r4K", "pqeq3E3Z3LSaUPAABeHO", "fcJT3Av31xLonzcqEeNH", "zqqTF0cRdtnIV5jWFeZE", "bv1MudC6HZOGNEkdCK2p", "Dp7guqD7SkM1dNNWyXcG", "50WSCE3PY5EjvKQn8bvb", "LFazawVYT5oW6JzGV2f4", "8ul1CBmKkht6uU3UQW3r", "brOf8LweLbgRTRSfbDyL", "urRpJSHjyKZYAxDIG9ub", "la3C2TsbgowZfMMzodgl", "wDJ6AWMOeF0Np1ZpUPQ9", "DLirh2qTfUCZiVdq00Fe", "DDz2EYqgwEn9ZT0EVog9", "HsizMMnMK0yXDxXPTN4P", "crX9LVOoI4xZueWG0JcI", "KYpVTMvxixKKopR7Lnud", "rpAmTg0RzdjH9WndtgYZ", "dqrPgIVz6PavEkfgQg7N", "HpfQLQ1C4XlfOc22vXzz", "uZu7JalhEs4Vhht15vD9", "SzoobroUMnTFMOMdw7KA", "xNdd2We8PpFqo4eOtTqD", "EKSbgmCarVinqLOsr20F", "pG5eIj09AqKP8lymVAMN", "d48TPWMFWKULYZxqGxxP", "mGos1mfWu1rY4z1TTLgz", "g8JEfG3wCyJwE7oFrTmj", "TbHXbHy2cd2GlLVRZWLl", "UefjjUwYvgHOIXvrostO", "VtfECAdmeyV8aBpHdmpY", "Q7xieqXQgRoBKTQXb1HF", "0mMYvBqYvd7Mk22MqamX", "1bgJ24oe63r4qDcjNQII", "4NemPf7DFtkESPVTTI5Z", "LwbB8CtVcBneWQPt5W6I", "NpWoEzHfHMDdGomO0ftd", "ohFK5eD88IQU7uIJrXy9", "tBk70WW0ANbw2pH7RSFa", "kd2pVK8Nr7WiGGpGkJFs", "hopjb4r3U4bDgd2Bx9Ym", "E2UUIHj1bwrIie1KgsLB", "vuMbXOmSVLEhNgAexrdY", "lSqT7slni6wb0ICVfxxA", "G9qbn0DjrqHcH63Owp9c", "t6EsMQN1LJAbQ0DE0Qxp", "FCPWISsCH1p9531SROTl", "hdM8bZKb0FODPnjiGbsV", "chegif884btjDFpon7Ol", "MkymYhSmGIHqyuWgZcmb", "CdJPr8BeEXNYILKo0kaE", "3r41lZfJBQsN3BksIwWW", "Rr4jCNVA55M6vR7e0lx9", "9qXCzH5HBZndRqKbBqkG", "t6NoVSRTDOdKCAXAPaRb", "7DEW3W6EMoSEsp2OITrT", "qSo0aJA0raZwnlRoHX0c", "JSqBGqXYIPz8pl6Q2HOt", "rxociFQxkOZ3qNE6EkcW", "9acwLiKOxiFmf3OLGmJ0", "Aq3zCG3Q0eu7EW1ZCMvA", "4BuiCH1T1IRC9T9JjCjh", "qdm27ncJ7VRCeMsrbtIc", "CjmJCtct6JYuuKv16VID", "0kNf4DUd7mFHV2Ygv8Zz", "P8sJQnIUIagGI1vMFPzK", "9DZfD7J6Ds4ayutNhBrx", "jXB2Z7MoUK6eXfHikaox", "QsXNmOkRXbMG7YGedbS5", "vWjQBy6vWuqvlNIVj0vG", "bFUgljKOKkSDG9bR8hMc", "ZCXKXnoGnhUNwx1igM4y", "6WBNgmmmR7O0JuJph73T", "mYoiVpO9BT7GxIbd2LNT", "SmRkekZJpcmb8YKbOgiX", "9pl55Mg5i4WAoysSiRlW", "2W784PiQ6QyDGhIJ4zPk", "1vsptlFaC06CUDLXb1xh", "RtuhZBzdAOLBHDy9yDj9", "BnJeycBZd6G5y9kXKj8S", "5TdNgZWdmFkv03ZygkYH", "pmMlv5IDoOfurGFVpl6Z", "yqVys4wWnSnaF8L8DbMz", "z1tqG6J5rQdnE8l6Agav", "6OVLUqShRmgQlYE1eW5U", "uiH8o1Dyfnul9P5dEXIf", "Jz44VG49m9dgrtnfu0bZ", "lVIttNU7snkBkmEF3IOp", "P0UGrHtjHSG0wYtpwOuo", "BcyvPA8SQUFpSj3J0u2F", "MIGIp95lVzXecTXzdfR3", "AgqcQtwOnwe8DuQ21UlV", "TI93kf2LKRNU6D5U5zsq", "vWy8ON8OrtrIAyKudKFy", "mcQsoVMtUCjOhgU33dPu", "WGCeFWYqrmmbMDR8gl19", "xjXeP1iSc5K9MWlZ1IPq", "4CPONqX3bWCWFhBejr4L", "wOSGvCpuUDiWN7ukvPlW", "ww09d9oK0sevH4BAGz2k", "AkEXp7FkW0EQuEaYOMqM", "CSFRXRblObUYJi38pIqK", "G4iBHIhdcVxpyDGTcqC0", "RgWjNZrApiS5kBGzRvc4", "RarNn5qNv0NLhr42QtAF", "ZdIKmXHDSsFrS6CDC2a5", "1vQgmSiAMqNtTdDFATRb", "LgQlndwxdU2ePRK9t0HD", "re7KHIYQlx16dRrO2nJg", "HMKenflef2qUgxpwDLMz", "GL3rktGneXTutlWeQIJ4", "K7Yz4LvFeFEsYGkI7y5l", "VWfNIC1gUIimPFlRYehB", "rt3P9niGll0HGfeYpdCH", "wt2J8lleQSpFLtfTgLhQ", "6hfKLHq8u3OouQ82BtgZ", "JUpcNU51nlPtQ4CjL2sE", "5E2zeAzn1eNK8CxTe0SR", "lsICuUvEXlSazUYbfVPg", "9mzFwwgYw7xixDsrgl5D", "VXlU0J6dnTHwDGA7Cqf9", "vapsnfkTQnevJOOJfSwS", "vDP8UXFeLslHSa9DDrhc", "fJVyhtFNJBpEMCKojXT5", "PEMpnT10Lic0z8whzB2J", "MrVg4qVlNyqlCAYzeZ0z", "FaxDitug4wzOlU4nKZZg", "VNPiYvfATd7gE4tuvnax", "hXJT2NGKvpyQBL6jHmri", "NyOb0IUt52qla9CaUSsN", "GroRAs8Pcx70tWZtm3kp", "4YaefmC9D4XRtJq4ByRo", "tZmm3LdpNNeRvD3azFhA", "HCb9TRBfNcRG9B2CWfzt", "0cItpLRmY9xoJYxny8QL", "ipcs0c2WI0OGcgAP0bBY", "i8K0fHndNDy42Yu2BwWR", "uuhUbptbP577BS7ohsR5", "5O95w355xcUqWAK5zEgO", "HmUQEZFvSeyV25Zx6e04", "GVsnfCscOXzdJR4V0HOQ", "vLuwQTrX7rZOKR9xbzY0", "UXdlyfGwwdLqyFmMgbtn", "QQ9jpGgRECRih2Ufiiae", "LvSJ8CgonXZEwhvlvZC9", "mdsTgM7M4h0OaRfgdJSR", "rzdleYWa7jhrKZLytSKw", "7JIfkxJLHlm6iNrNtNvz", "4cqNCBJ3bexgvFJdDcyU", "LjY24PPykKxnwnA6xT8W", "55ByJUZW5WyOFWQJtnFb", "7CO2yY6t0EN3KY2b1Z74", "53QIXrcQcpzi2Okyuqps", "5CwNlwykV3ob6Ctd1T1e", "J0MJM6FHu49xG5IzzGhV", "HT4LgvwhNxJgwfxIjAXe", "EhZSksQi67DObFjHAgwX", "bGBVv6mdGJFSyothgJPn", "Oa9znqEvUBT4PcZKhJvv", "bAMXxFEdWbOu9VuuM6qq", "HHugrSzYjsSK3os014bX", "e0PlTJgpOWefnYKeyHBi", "9d2APs8QxkvZiKKBc010", "WfdHBxu8C3qMgqU5hdTe", "NOD3iXEKWDK0qyG0tA86", "DwQrksuRVL3qjEtPk6iG", "H2G6yW6qeCup6IeoAYGg", "tJWaWO0GUgWjgkpfFtTr", "3Nh9dLynsCTjTyIzMGFo", "wjVcSLFhCiYG3DNgXJUP", "Vv6xrOwDeAzYrTBJoQyy", "7VE8iapFtHcNCjK25EFi", "MDGEgRVSqUOxzb5hBsv2", "9VPKChMIuZ0GkESOgyoU", "SDRPoU6zNzzUVPmh46xy", "exDOAflobZI3khSYBXVW", "UVzzsjhuqetUa4qihbWJ", "9oMtVnQeIvBmQ8mGrRBh", "329b60JnZp6gdRa6C0lU", "twGI20YtPjZTji2pgMbE", "9ful6SrGQckKWzcYz8QP", "qzqZfsNKCyYMbQ5gtwwH", "Zhb3eBcdK008zohch2wr", "ySBatGGkDC1krbnVmN74", "N5CKusxZutQtMaTDqjx1", "tyllXXEKuJMIPZaJRXsJ", "RGClofydMteGpOzNtBfn", "V13uYeBz91JYFTJ49FhT", "6JhwheJYqyMJxNBWzMT9", "NmhaEzeLCJoJdWFI8Wrw", "SBFPWQvUkPd59IgNFIiQ", "cVjFzwV7QM4sVJF2iBUS", "Y7WhNC3bUj16EiJDcpJ2", "9Nsde7dKG7loCHWXTX8v", "G70VpJgR6zREKJrxPUHf", "Z2SlJyIkTPgjWgCKxrj2", "q9G9Q56pXNT6Ovrfr7QK", "U411iEJf52ftBv2c06PV", "SsbqnQVeWtw0xyzdAIHF", "Jw6Sq74oDSKfKvT6Mziq", "qfqmbqPl6gyPd4qRBsFN", "KZ0dVUjpRPfH4T3dHTOO", "7MliPb9YUPtoyuRRO8Ep", "Yr6aLACcbayivkRIJYqn", "xkauczJ06YncNtAi1MJa", "xFHqxi8HEw2Cea4GYNEe", "v1GJtQzsnGTiWkWRQege", "YjoDHsRpGgTBfjSY8QRt", "esZ8c5a0hGeFxTQFLq4b", "UYl7FBgLZ5EEvlMVquVV", "B7j6a7LuxQTPwCX9MBVv", "Eh99TUeJO9pXEYepfxhb", "L80HLVRhgwcudk34CfOY", "mB61hioKdVtzduEwNfd4", "ZEwByyF8dbgQkkPRSDk4", "gd3JVHEtvrvU3rdzpr7R", "SopBYEczRK37y4OTJcKE", "SFhV7KVuBaLcOAnvONun", "ivuezH7IrQVJfCnmUGhe", "q0EDB18ZM2L2vDguUmAK", "CfbrpOcKcJyTJCgSBo0V", "oLYjYEb10jLCPw4EJgWv", "xSOEc2hnofJc0pJY3sX4", "csEznGD6ui1pAO4nQjYF", "OppOe7uizQkbIwa3Dm97", "SBvcXzNxgwA4j0QO5I44", "goexkE0vyA1QJw1qtOlZ", "Iwb2u1QzHU1yGfv0svuq", "3vFKrGAkcuJvqsxirLf8", "pg43Mx3Crv2uqFDfVNP8", "Fg13WylNJOW65Y9PWAbN", "6bFurSaKoxQ3cR58NoWg", "D0kGYtf22EP8nd0c3axr", "WNt6nyEAmipxiZDFRqHT", "4fZqIZSL8PBcl4iW0ugk", "dViJ3tYUkovmTUcj1549", "SDjBFRhFKOyxreEuXlMH", "ZH20jejlhlsAxcJC11SL", "NOGC2V5ZGRpnhrlQVSBB", "B4L8ecLfdl109HBBkGiy", "hXlOOUnswy380MGeybKc", "MJaVYleJ1NHhu13HVq9S", "nCanWqQUQk4m1dGZMssM", "FA38B4PetW6gggRCVrev", "ZhfaKtAgm02z835H8Uw1", "y2feh6oAwT3VAi6SaE8K", "C9JLCPaIrWHqXwSC1HMx", "iPSs5WIfiQzvXHEkeo0V", "LIJqCk2DzO8hlZXq5pWm", "FVhlmvTOjTu2jBqwts7s", "EEZzn6qqvKc9pJuaCLyu", "oquW0lQtbVmojJlUQbLJ", "vxSjFKHPfDHS2Cy2vOtU", "tdIbx45NdOgXK7EZPTw3", "gETgORgJnaleD4FA6JVj", "hAE1FSYcvVfah8G5XxMI", "V7xg9ArDTKxBS9AhajKV", "Cx3t6IwbDGuiLpOVzDiT", "WdcylmgLVyohvsYz8SbL", "iT32IPVHbBi7pK5Y7jta", "hhGbXmafF90vc1xsPSA0", "eq5RBAzGssoXZ485rhk4", "qlzRkxJ9NR71ICQRLPfD", "HTipYrsNYcRMLOl6J5Dh", "ULgkX79sWo3mImZqdRB9", "1aTNyFRIIexkzdVXicND", "RRxjDUXovivuGOHEdiUt", "LReK37pjjDwAetrpNMbG", "2WBIuQXW7zNSR1kS6aBq", "l8yNzoCLAnbDHkTBByfG", "y3gN2Qp9yyxj4v62hGNs", "1y3IhWSqV56R8mo9AbI9", "XFsc8xcqBzgDvhTcDvSg", "1Y57ItGRSWa0jQasLCgX", "9Kk41BhC79t6gwBwqQNG", "wvEeMmUhyAC7UuAT6rfB", "0WHeTSbHqwXnsmRCYvrV", "34aVyky4ZdFYAUCbvlsl", "iPWY9vkgqb9rdjKcSIez", "usX2KkdFTVzBsVh2RRiF", "1r5eYPEyiryahTa1DDFh", "gEqYhYa8xGMy5RbcqpYW", "eU4LyeL9raoVmd4TBca6", "rw5wLeW9T5g6XiRVNmdC", "KRi64mYDM8ID4NAP1eWS", "hCWFtwiGgLS1l85nsdzF", "lHSncaAbFh1wrYBkUu0A", "DR9wZFiSshhcy7PYia9x", "HAt8g3tAvrJ6IS3qhlGY", "SvAO2Zuk73fOBZVsaM0V", "DJbUmcIRNYznT79Tf3Cm", "4r9GOe8w08RBQ1fCdxb1", "VZmwgwOLxa62PFImrOir", "UA2u9g4mdgl7FY1tSPDP", "xJPLWh7N3pCWxCQ4sTrU", "9cbM8aDa0QyvhNGB3LW6", "9ic6v1BlU0FbaoxjP8JN", "ZFIEdXQgswk1dN6WMFFq", "FVPpHKWgSo1z3IEgpcMf", "W7h9Sldm0tcDMz0dJXIl", "LJlOZx3OZN25ShDsSoeQ", "hGb3DbfW8xIRE1ooyrAV", "CCYftjXJYCjFQKHeuwA0", "tQS5PEtL32qFENu66QNe", "a5s0P9cH5lIwBi1Zutux", "vlC785BCTZp3eh31oeJt", "PZnYFo79f26anGgtJr3m", "Qsp4Xr6LVNEuwzS9oaIR", "aM2LciEuXFgy8U0fL6zo", "RDgLB6UxemOE8QZj6lde", "1Ha7jak4fjq6vWS6bw3F", "hRUnq1Wun7YmN6r6hb9M", "LzQGUsK3nNIUmkHammVX", "r1HE88LpjS92PZGtQawD", "vDfgxwGhglCYlTmtb5gJ", "XpLxMcomAjz6wekrZ0XD", "kjlVDWOmZ257rR2D1oyB", "XvFRYzH7yoIiX4BiYXV7", "ZaCOzEZ03XAYTPy1NF6J", "1OzWQAFyhk6GIIcIVBIW", "jS4Aq0BDDFUEdTj2dy0I", "g4WyN8EsJXO2xQCnPLyc", "aSpCvWEYUEo8JK4eSJUm", "qqmlExZdIVEry13tXFQz", "RE7iZBMzUqlIeY2tTbWj", "6ia2jbuGoKFGWKy3UJ3w", "9mFoIHflq9Vus3xbfrqT", "93hdMgfqzgm6SzsjEXU4", "hxxX1s6eju5qynRKT4AQ", "kuUBuNu8sODXK84L0Bzh", "54V1rwJIzRgjMBsGWmOO", "9ZwTh0of9lMFprEfmYvl", "zcSJlLZH5wfETZfBaToh", "CBu209fmfaVcAywvHTAM", "PqZtPE2xgqfszZs0gXkL", "6GyECs8TLInj6McUbcRH", "Q49Qc0QIXAcbOYqaQy1j", "EnSL92pieEx5H5Vt5t9a", "1jCQH2yfyyPAlrVsuIZY", "VWbmb4dexkFxSRNjRJNN", "HmX0b1tVHS2mwbWWg7Ab", "qPWIotzFBMcS68Ti9KBQ", "mBBgnfCRnN0bmXtZOqoZ", "BP0HVTxel72VIBB3rOUc", "lTBV024Osrw3EwJjNEL8", "LLdcXmfMA8wtb7PZ9Rv1", "Gr3UnKB8YWEsqrUNc7hm", "Fdgok3NrSJqj8tBuBL2i", "pHaf620i9hTNK992AXtc", "okJubVonqpTd63JA5JtC", "1KZJRjKbEBB0tVuVyhGm", "WjPakikp0bzzvZIMGavS", "m7SfcK8YzOKV5j5pQocQ", "PcNJ9fdNEZp0gHfGZomZ", "A62En61BueZHEwYLaCio", "lXoPmRdJFPsOTtcEzdQt", "FzARujmUtSGcx4zhVa1j", "zr5QkfejI2aW0lvuSiMJ", "8cv6gun9UmqRetpMYT4p", "UeJUNEOnuk63K170ts7L", "fwmHpbbM3fBXKUzhiLVd", "3ZeNblLSdQoGMYXA89W9", "ofe67donyHO1q2MPlhsP", "7efUCBcKI6R6l5Bqizde", "E2d42zUogKBoyoGAxsTF", "yuKhyVXgU8Ji8wkBwExc", "W6OUuedsU45QwP5uuaZM", "js2pmn0izvJW1fyuIbkk", "fpBaFEU7p1UWtWLeJKMH", "FdnFJl7ZLpJyeUYrh1xU", "2R0uxJYFdsUrUH4l0BKJ", "0dIc6oSnpPHqqFklYGyA", "8S1ch5LgEfzCHHoN6G8t", "dNjTcRD8h9IoaHOHMkxY", "PxkgCX1Gl9APUrq6J1D0", "BVmlnB07vyeKtOz3t0Kf", "8S4cJshauuZ5NLo8WmER", "kskbGjf8hznpRpQih5Jb", "xseKDQRkDfBvXvXlcAtK", "7e7WTVEBaVkVNNoZnFJy", "uSuRMPAyX4GeiMAArOJQ", "u3tFOhoCw58oY0DsPOow", "Q5Y6PiGE5ZexbYCzDz9A", "4IyaICSgYHayK94hrJvw", "qYrR62PH1YR3qOe7Y4n6", "JL2bU6IMNEGEm8dqA279", "bXCPvoURrFXAbZk5d0Rz", "EgDyoqmwru5SPFpI4Kjt", "XG18nlEOmdNyJax5PjzE", "b2e0ITGKlzBJDCR0ydPi", "FkgWLbaiJZuuaYtq198l", "7J4KVTLR5i9KSoqlNORg", "yLZWtQMtXUeengzG9IiC", "ypWQbLAzjbdfvC9maVf8", "zHmkxj151hHzWoO87W5o", "7iS0vbnT7Sb4iMnf5mk5", "T22zoO5tuAh0t90mjnFo", "EpsuBdZEPIHsKIq6gvzZ", "4eZvmZhVLuJXh9Rqny3C", "GK3YateHmbqqGNl2wQVF", "Jmkyv9pg8srMAsvllZ0X", "9oMPB5P5WsJne1lXBYCH", "Q1dZtYIe6G9F2TcDZzG3", "rXoVZZ0k8C1WDc369JiF", "ZqSbJ2ms11tsYhL7HJpN", "WorhRtmaCSnkIFLcH6SG", "7M6f3PnIiadCPTsqMeQW", "6DGNQazfgPvnj1QlQB36", "mfJB8BzSnPwtaBGyjDdP", "bWAKVY5vk7zUmGfsReIE", "1C6ZLKX4W8R5eZP98T2q", "a1KKIzAhbQucay9wGg0m", "oSrQzFZ7ibxGaHYqEgYn", "6SNeOWaeAZPyzEMyTv69", "U1N5HvtVbRHfreKFBssL", "RHIQVeNxYT62SS5jNzDx", "OUaE8sRHlJbAarZ6Tw11", "N52pX5Zt2moREOdKF4cy", "OB8y2f2Vb3Vw7VmeaJXd", "3L2HidbxhBv5M12Mh4qG", "6LBBovpOELzHezWKc5HK", "FANZAPwpSk3W3Ehr9UFN", "pDcUA6onA45PCSyMqsBI", "cDofRTWbxkwnvXF5b1ql", "3vAEM7aCzkScxEFMhmxc", "UsNPNaUyaLidEqraxQkv", "8AV3OkP3ULgyD3NYeqUE", "BCpP1fyy3grBrKED5dHX", "wvW9wrfahAmsKaGLFCII", "q9RhUftXG84D3YKzQyY7", "8IySsCm5O4NCBmsdPl8e", "tDrwj9t97RFDkBeaNQgj", "S1vdonFDYNrPYgJIoDPv", "ce9MplvCBbtbcpEOaRa9", "pRWN6qdu33nffu0Vfvfo", "UXP6McTw333qSaCYOpQR", "qE4W82zmvcaP90UVcxQf", "0RUQzgzNVNmMbrqirpUn", "R2Cb2e4ebSIZum0rQxFv", "I1Fsq3ais2TI4dt5Ivhr", "MzPEjN57IK3aKGS8K0oA", "2HS5vJABDr2ZpPnWmqe4", "BffTt5ZB6OM6fmBY4JhH", "Bioy7ZUuP6wYlZzdfZol", "x8rat19xKoCVWyReXuWu", "0STk0QNfz9QwGFV9Ge4b", "QE4xCUZhO5ZMV06VRR8Q", "ZYLpmqy0S0bsEenO8M5U", "RcqvdvO4MXSt3nipbeq3", "ePus1hG94JbTwSMXNlZh", "I1bLnJBOyzQaOKTQzhX1", "z9VtZrQwczbuyCElUP8Q", "MY0iqR8p9ep6lKzK9NGk", "KrcI2q4WDAuZiuIWMOJT", "08ZlQY5YvJID9uVBjXfu", "hZUNRkrn6BE7HnsiJwGC", "FWPOOvX7SA08hUV9CNuG", "W9NnuETEAhQNDqmajHf9", "SfH77lGJ69acGvNA9pOH", "WnfibPIKgvR6bjCiSQ0Y", "ZY8pTVybKKsp7XXgunyZ", "gQdH7pyZGy7pWFdxibY3", "tPq1uLfp8eOo414Br2i7", "ypuS2VPk4wlyLZxFuc20", "GQnIQrRHr9MpwEHyighm", "aQkv0h9uIBvYaip0XGFO", "QZDMlUJT8yGhMycMgjFw", "v8UTqHTLYgjyFuI0OZUU", "ViBsgmCKTRGOXjpL0IgY", "yPUBJlCfIe8oMHg21qLV", "IbrpKhBJxprwFK5W3FAL", "tI9DZnGZeb4uAvhTcsmY", "ibSvvXRynbIerRsPF6yr", "f2lpvSIWJ24zeWuX3JUo", "tmTiDL7QR3H650tzRAVk", "CXjq3bO4sstjeKQpdXG4", "bV8eUzbv96fMdMAevYjl", "OaT2stqVO4XxXda1cBum", "GX6ttGWmnDWBlzCdq28E", "4fCbImbsxVcD3i5uxZfk", "mBtV858y5EC7rMj78Iz4", "ncFoIIjDpOxbXr6fuCby", "Qn5FAmMG4KIsuWeCoNQe", "jLDGAIt3UU1tG46OrTct", "nvjhROrDlFrTb3hlLbon", "3neHqlfhCIYzBIeagVnP", "jdsKgY3z9qkAbNSR856I", "NfHWxt6bMu05VrNBPR8W", "FseqD6ILCObX3s2yj8Z6", "0Y9VNXekwmEBdszqxHA7", "elcfcecJl9PlfXF22tky", "ey7Fp65mMDtyzTdZ8Dsr", "NGa2np5nhnlLmqabwdLG", "rCEofqLn1DeORFRC2Uzj", "Hi21YaaTEvj35wplkAWl", "LB8lOZxO1v6Id8IChqft", "mMwpGjayr7iAGqveNr0O", "m6ePFwbunEnXZhMnQvmF", "2UPIIJufAu3wzfJCct6N", "5tseaCSy7CB7eaPwrHZz", "Acv9HDLr6RCBK4osFEoK", "QzS4XryP7XOH7IQMVlEZ", "COiURWMgk8087SCeI81P", "fQgmg679pJi1hQV8vpmd", "xnm2DygT5isk6WVmaavP", "tbQazthugTYbEIdQEKtJ", "0m24GXqr5jEyKdYJWDCB", "himt0OJEgDWgxYkB3Y28", "HH6ZucqOq2XViKOgigvO", "tP2oxkz0I08XFC67owTc", "x15fJUMz8FL1eNnZ5mZN", "kfszpy6buaErbJVulptt", "4CsgZfFcQoxARpAGnErf", "m3VNN0F6p6yrIqXpUkRu", "WO2xDAByN2c947XP5kVs", "pTh7IEvmwMeSjePunYtA", "aVJcaq1dZVVOyCTEOOyK", "jamSF9M2hDCFgTsGKrtr", "MMFJWiXs7UCq4wGH3aHi", "oRyUvojDfa42xJLRzqK4", "KUsNR8eSjwBVN7zGtgTW", "HXWCordogxq0SjLrp0HW", "uQ1FXzWOfzvuVR6JHk5x", "fuv5dHuQFCx9cyO8vsWb", "sPTLrae6Ii1vcw1DBvdQ", "5aXgXwmSmI1egVxV3abL", "IcGsWF5i9g6CFeskYeAK", "vCxbfu6iUf1kHFcnVfTc", "KaoZChJkJT2EdznIstyK", "Wz5nDfZiJ2Ida6AmlRU5", "sXJWU7mMyjfViiGvNnbe", "qtFOyPBjodohA6DdBxx7", "gcaNKrGgesKSjapfxyPm", "bBTkFeNQbKWIx6dHvtvY", "jGyRon6jlTVLdw5saSHA", "knQhr3xnwsJg6H7u3Beo", "f77I4CAccPmNCC24DzpA", "q8owNvpQ6TDjYK1cXAD7", "ZzUmAXoNUbVKhJF4C4VH", "Vi0102cVApdjo7TwcFK7", "qpPX9caLe5c7lb9lblFl", "asUMzyJcBdh2Q4XXh7rL", "CRTv2cfdLuOvmrHjnaJy", "B00a5W7mdy5oQYhS8M4T", "EQMyHei4C13M01w3X3nB", "0sxQReqX1uzDLLCaxsfA", "rgUrfQsDRfMRYHrxvgUu", "YT8rnISkA5szjMrOmhZC", "NtdvATq69Kyfm6XZOzHW", "2AWlWL7H2hTNY4IjX8ne", "RlKBqriCozjo9DZeWevW", "LMuuQCbyJOai7utxjbAV", "YrJg4qIaVD6oX0gxBFtS", "bUAjM3e4coX8fpmhd4F8", "FKvmIZkRpdtQ539Q4mUe", "a1lEoXtSc9YrRTej3MBq", "x4G36ORAAvniuYuj5oBf", "vjVMB95CTG2QJGRPcsXm", "nKTgqNNuBWX6D2SO9WYc", "kY33pUQRNyC8Gfo709zC", "fWGtZhFiDoLvMMz9qPbB", "LlKcO6hOGgYvApmjU2Qf", "ojaA5XItvt5GcPq0TXMj", "BvdMiN3CPTpBCPMFve9q", "VE65bx54SPmcKNw2kzC8", "R1JbPdrKF0AiCEnnBqpc", "GbEawAbh7nnYn68AkzUx", "xcg7qTu0IhcYHq6Dyfs5", "TfeEmmOUjqReS5lIZdGp", "KsNbgRne7fkYLMm568Zn", "yyRQ4AgblvQ5nlfSAS6H", "7onS8XVCf2zb1Oz3WecH", "Z0NKj0mtSr9Xdu0mSTy5", "WwhVKgYrI88r8TCpTyit", "npRRkPDAs9FO5utOZPFr", "VLjdnvSEr98dwX4guFqm", "O49Uy0qXO3PtO8V91vOq", "2UTzzXftmUd9YmbWlR29", "UR0qXV0WPMMRooQnJ4g4", "YJD44mYpDawh1uVWQV2n", "pPEdBdQUh4WDMhFQTnDg", "O7LN1rsPMuCAHPnS2Cvj", "GRwc7B0awDHIIceKRWhm", "QuwgJj8Lv12ARwmY5n81", "yNKHywZPSGBq85WRpdki", "cms3gdZlOgnM35bz1ANR", "PWHXcmxPNh5zSw16Zasx", "GdHIitFh1c6Q9Lyl7v8U", "aDS09T7i3xdIatYGmnvl", "Q1CXM8IS1OuZbMalnfRr", "c37AwfQgSLRqKdNejd4k", "1xKbJsK7Vjw5m3FggdM6", "yovGPGu7uxrtu9SB1mGW", "UCbGDovrRHyP3rdR7WY1", "TNtNXJYW6p3azcoBRh2s", "zyG0ptPxPvwqJnDq7kMB", "ZNjWyVhPDkFAgVAWNYTk", "TNbmBmaIWvT3ICaGhHds", "zt2gMDCjldUE03z9pZRM", "UsPl2zziFbaEUdsqo2aX", "f2le5inuIDGk3eT6bToq", "4O5WzvMnyuKbu4Fzm1s2", "C6nFkELMh9CjWFDVBYH7", "SbiNfyKSxCU9JFO3UiN9", "rarLn4pwc633hmOLiild", "vFmCT8Fvqd2gBtzwwotY", "uwbaizvOgg1btllKuyFk", "ZGOk9Oh5Cac5UBfB9YZp", "CbO5M9OE7bzhrLPzj64w", "eez9qeIzAroMQCPlJlzQ", "Nw5EIVDzZGvEuuLkWdhe", "SVyrfMcy7ZNUUShkxsjX", "6dj1V2j2dRe5udwazWW6", "6tZYKEIF61mDeTC8VtA8", "KmCDN6lMdHRh9yFRCVgI", "WRT9ufHOZPWr9g2XnntQ", "3I7AGKbSpHjJgCQbqfzN", "2TECAHhx2aL5rQF7koYX", "6HokTDLHsIetmt5u8mpA", "KAE9aTHIInnM4b6VoQnf", "iRYSIbMOL9XfJlntC29U", "pworWtMKH7xzXVQn6kCR", "uh5DSs5euC7h9vYfmsx3", "yv1VQRGV9Qu37zFZpIEh", "UJObCuEznC0l51ETQSya", "ttb0qoYe4kLX3i8FcNCN", "XD6cCK5dl2BevkcjX8Nb", "sh8tNF7xcJL7URjhkmKV", "oT7hDhRiqmKiRQamfhkF", "05MTU5AEqShevmM6UlpK", "V70vXahBHRQGUnjzqrBg", "JrJCddG5O5PrAOmgwSrE", "rHSM49Jt0UZHLqTxTj2r", "nQhvmRbitSujiM5mTOdR", "qBiA1B7Vt7KeV1ZHRB0I", "bs1JD64gSh8JsqTs0YNt", "fhV9h4Q6DOOpHQ8UUC8x", "sGEi5ha5DxwsdRzITOOh", "mkW18cTdnaYfqkNtPwwc", "tqSUFSkjq8QaruazW3aJ", "b6wQqIJFEGr54IYKkI3Y", "PR8GLiDrko9Lu3jjL3wX", "HmbL49fmRgKq7S4S9IIr", "4RAySufoxcJCOuXQ3BCT", "rWJxwMP5ehwi65eZzKLu", "ue6GXbgaks3cOLZKhwOJ", "cI1iNfFMxYGpDK5iwlIg", "dKGzdnIKigdKyc0KFGgB", "ov0zF6f9pyoRG4QtqiBY", "MmsJMqdb4HmrCnqQrWXg", "SL7gQWXECgmZScqmSTNX", "k8OvtCJkgqO6CUma0HmC", "xYjN8Z9a0V5jdRcWevEI", "jaPt49R2RDDOjwmrUtQS", "OTBzvlTZehrMGEFKOfNp", "qYDaSxPupnNBFWBAIehu", "KWGalUs99Dwzl7XE5v8s", "gT3v0E3GrkA9HRh0tZ72", "l3zUAVgDQp54G7yEJ1UA", "kdHz2yzvW6xH9ulHPSVn", "FYsTfoizpC9XpPWpNTkt", "Zf8gaswxIRlXzbyfPgeC", "tlkgAEUWiENFsWwQOsNg", "H8BGh9t4oVHfFzJNDntv", "0H9sl3I9tdnAkwOR3GWr", "llW0kqOvbFpbUyTF1jMu", "N7273QY5g2wSnRQXFmRq", "0GSUEtkFd470C95DZdIE", "gDeRc4xrpOfpe7Jsz15c", "6AaGJfTqGm2uzgMbjJQY", "h5LJBe9AeCkiMKydxRRD", "DU6AASjrj7PQDihMLqUz", "2EhMWfzR4QeGukQ3A8ut", "FIHQ0ymLmGKoSzAyc7Ph", "Y2xQkLTvTOmhg47g2u2p", "8KbbKkXurvbPxWofqHaJ", "dN0JP6yPyyC6GofYWDTN", "82l3ZZgPqHgUcflzlhOh", "dbnuNTStetGkwzlTYRqN", "gUpG9YFsGeZtDLlaoERQ", "7hA1hvUDKIa1nNHuwXnC", "BK3MfpwR1Np62z6hsYvD", "rTEerVYn0Jx9cyVFlPhm", "kUrnUxSKVLXMnjyeDVPD", "mKNOIse2GJo0ndnFaEa6", "Z5QMpNy0sLDefY1wPfyf", "ykfjORzyfZ2CcRZPoVPg", "rdIW9JQYwOBu9rcXGbTt", "8U5ivc8j8XNz8fTIxuot", "I0mPpOu3xMw3q1llctUk", "PpjXUCnP6cJNa5mNRfQO", "1KRrJAcv44fTtMyLZmld", "M4yu7lFYOfwPzLEGVqCX", "srylCx4lhpM1rLvy4AWS", "nQpkj30DrCkj2hSEcWxJ", "KHIBcD8eLc463tqmwozl", "ziUzPuB1R8IjNas0l0c4", "dhAeayOVkMGj4jgRdrQ2", "xilLGeJ1ev3FcDtB9Get", "csbebH5D9TF691PPdiOH", "eRVEcONle1eEuFsTXvge", "OwiXv8wYqIpSjIfLf24H", "2jWuwONTK45i0oEtw8Rk", "REBAXoUCoYTqFzkCM6de", "AjK8VY1PhS98gIGD4iNt", "FrhUoQe8WGmgx7mSfnrK", "DyQrHf3LNQCcFu54KjCo", "xxUu4EMhzD0AAQ1P54iT", "Tv3in6k7ovvlsNguZ0ZY", "EZiM0jl3mTUDOYvBceGQ", "X9CNWqH3qqb2OHOOz9Pl", "duyzQrB2VPT0ZdN3Te7H", "TiKp0iDzqaiRUeQuVbvz", "1MzYzNbQzifQPzFNgQMU", "12vTgLM9vH6ud6SaR3yO", "mdn9d0WHRqlQsgrW1Dfu", "Smo5qGdFKbb4FODqNj7m", "ZqAPW1vVDYQfIEj8TMLn", "yxpBJ0zgj6SGuafOcYtp", "6HUPUDVxYriUmVf3VeiC", "i8Qaj3yLbp8f7c4ZoYUK", "NCo9hRAA3sMj1mJkpH3Q", "6B3Bl6iXeCr1Of834GD7", "9XqAJ9s8OvWT6YepeNNI", "XEHwsNxwb92kgss00k6O", "dbrj9UXlpu1M8GGybEvC", "Nvx1nn1lY6A9fztmTOXI", "IWfQmvNN7GZSBUUyITio", "XsxCrowJCTbUzEtj8G6F", "Wegh8AdObLC9BAL1yGK9", "htdf6WOEkTRG77vDFXcr", "smy2wH3tXN2FEduK8IWs", "jy7q302HXe6QQ4SLLTCt", "qC62p0NxGto0ptortq6R", "UCptEHCZiOQYaWaNUvJl", "n7lc0ZRtQXIsh7jvMvV4", "JtatQ9Hu4YdrfMSdutUK", "RnA8su2FpVJ7Osym1Df5", "lIxOfP1ZGWrhHzo9rqOf", "JgmhYkUZw9chPX64u7bB", "bQsqQe0HSMwl0iRWRv3N", "2g2PB8S6E3HnU7eumc9C", "w6wxmNRDGTYI7bfIh7Ov", "BfjdlLVVxehtkdoV0EiG", "hFWoqC6XHTRQ6A3rTYMQ", "B4Htf4OeI5uzKPn8Zrdq", "K4HPCIGfrd30fLtIPIwh", "NpefCPnlGOZZToyd7CJw", "nKwQfpj25djSQL5cksLz", "HtWihSLmeciSxcqaQXdV", "BKwbg1COsXN7Otp6J8qy", "jZOe9EEZmp5vAzUo0gCq", "CYxaPkejtVfa21EBFQlz", "EosMlNAj3KaDsXoGISx9", "vchxdt9qJsoVegrP1183", "KiGAE2QUVNdQxIMaBVRS", "NDyztpOtpUw9BCJPFiti", "5U63kSbvx0NIDLF5Bdy0", "6u7H4QeJ8VzCx6DhYocU", "pxk0H05Sb1QhtXwyvYF2", "3FEyJRfpDFJ0B21S24sd", "6GJzlDvgmBinOumhLPWX", "dqXmsYEsd6ThKmg5yclk", "lSV9MFqgfMDGAk20HEsu", "IKZc4Dh2nQkYsGhDVVt8", "q4MymMz3apvs9USEi9EV", "Yz4QFjbiFSr3WB1HY0K6", "oGzvkP7QXMw5LyTYh5Eu", "V3x0FzHnxbtjpqdaGk0l", "4uqNsHvaMASqDQqQN7DI", "g50Wvd49N4sSxippyjNI", "rq82EyTb3grkjrGdUKks", "MdIJJ57HoUafKiiYhB7i", "pxSZogCJ0w9LZPcrUj8H", "EiwWRc36l8ob5F8uvIBu", "EIFmfrd9ZjQnSLHtxKxh", "TjGYyOQugZosr1cWqDeP", "x4APNSGJmB0DuGktcAlG", "iX8ZYj4OuiorkyE8OSP9", "dNMYd4PDDATvhZUDIWbD", "EN2zKF5ihSrJpCpSGEfT", "M6M1fpEwLn7a97XTMa92", "21LrBAHPMuri0Djd2xZO", "igwroRK81SA1TTscd91z", "1sh14Oc6LCS2qOtcnClo", "etp5NfhymgynZdmd2PhL", "ZALPWF0KRj65cwAxZpwM", "Vs74TsfTHNnoV8B1NBJm", "uQrVKzQtoKDKCJMeB07Q", "NsEq1PpMb99TZywtwNkk", "hy2sHPUQPbqkS4aTTPn2", "WuU5tQwplhXTdYJsxnIK", "M62oAaFbx3cUx6XoUUbG", "97hkfyaalqu5wus4U7fP", "8Ft4LRsotS40ZjkEhIoQ", "8gV2YN62TjRbzJfKiW6b", "yAZVtHhYZTyf9UhfplhI", "U6sTNVm51sex1DSsU9R1", "cPgjrLOf63vb8n2VJobI", "fDGgRiYtqxtSLZAAtWpx", "ajYgWZBnLk60wKeN2BEs", "87JRfRcYxPVV82BdZLQu", "3UtzoXKpiXfpewGHNsnJ", "IHoOHy1qHSkIudIj9aWr", "7Bek8v1Vlnm14bQLXRBm", "rt4kVKTevzT088kG1kkm", "XWmb5AuaZ3MRwR9Pja3c", "ZXdfdLwe5gOaAA9GI3qs", "6BH3cQQJ0UwXzZCau8Ey", "maYxjiB1j1tqCArmaH6a", "j07iZKIRQUND5w8mcJnL", "If9Tp0FOGJwzJ4iqMyGk", "TdvWX3G7K3Rdga4UbJsr", "boqsqWhATvvuYqQ4seBA", "hanMBrqk9iZiUNaLsFTL", "AOFhDdl5HuFwV1Ieq8Ox", "qvfJIEeAT7VcUiJhL2kc", "wxZPyr1nyPkoIO7bcjj3", "pFdHvwyHyittdQGcIIPE", "f72yV8X5pG7cTktPfrgd", "XXUByllE18SgDSchY9mO", "QryrasGFhuqDSLMO47c5", "D4jQUM73VsPthNlHFzWx", "sLAKeWiibIloMUCqqKrK", "AGBreu9tudqkyy4aSkI3", "21pMW2CKK2cUImLwgSqY", "4eI0bKb34r56tsSNsdfC", "fIex4ysiQiHUKXVvs4xw", "v21msT9l4pxj5af7YXpw", "D4PXcsRSwOOpOPcGrl1v", "YxddXGk3nYzyaOVAEwcA", "I10eOcvDLu9urkXM0GPn", "mNlMjEVy976P644Tgzg0", "tpujZR3XfRKPo3kVGFRP", "MYmRcquHpaHhOBOvaRTE", "qldenN81cZQx7AMi1Gxo", "oETANr4vHX95Gni18q2j", "PQgVb2BcG8O2KsDhhHcw", "mk20Vk0dY2MxT0Q20bcG", "h0H1qUgYjJST1URWCR7k", "UUgvU4vTeXjLV0LMS1s9", "IKaJn2nxRvitPMorOhK2", "C2Mi0h2RiuYzC9Iz96va", "zdUMxGDLwWM8WiqWNqv5", "iU2vbJskNnIMOkiJztfv", "Pz3vhsQ4iL7RnAKOTA6q", "yPAK7se6lHz9G32vtSzZ", "m4yZCIydR4RPRbhZTJdD", "abMoeOjVpi4bl18xH6bi", "925acn756jIfKcTw1DPq", "tRPcSXakc9Sl9YJlJPpP", "652QiWKjhjXaAuDbPlL1", "snkzJ4lcRY0Xd2vLWD2D", "wXm4Rxfpg0qYmbX3dGg2", "oeZQgSlDfoOZJAdj5HYl", "FOH1xn5Y3jaqN9G1ZzEE", "lbn5jPopgMYviqvgd0Ce", "hnS4ug5UgIiRtUUatIPX", "cwSLmNzNLB12yS6t8ALo", "S1EJVitM1HtbDKwxhtK1", "3J31l8suIBgiDuzgds3c", "7uDIEAFu1Zv4rw4c2uUI", "6B0H5zxiqyKxtWE5eTzf", "1sksnmSpgx8k681B6zsw", "xArog5uKXryYkgOXSqK6", "lSrrZs1frrZn1ObgSV0z", "NyV5eta4huBRN2GwuFZk", "66X8S6mucmrxjM2LDcQt", "WZIrbYlToKDsOiyrpkjP", "VbMEvMX7wvySUGI3m3XY", "MiRkPPZC8JbdsvrlHMsD", "Iodk4vopxJNJzm3OAbaI", "u9vk2kVH6OSMC67Fzt2w", "CPF9AHYKs6ckEVUGFzYJ", "L0gW4lj4elyo8CxIRTaH", "aA1ofT4sQcCkbsEfdvhF", "gg3mq03HUdY2mXoRysIM", "TU42MIhxDNCr1DerBh6d", "Icf49TU5KmPlGUnamUVy", "rfpssTh38nfRPITWmxZ4", "hzpvTcTD4yBub1kTUSVb", "F82dQT9APhE6g129dTMg", "QYa1XIVzkyay6aZW4ifT", "NtZ3vZAW1VCR1kSY3vXl", "r8jviIQmz5DMylOtIYOJ", "1ak2JBaM667wEpru5Hf4", "MsPLblCuJYDJ9wLQ5wmB", "2r7Egx6kElmbc9uDu47C", "dJVkDqAIkuRklZwQU38i", "ouHQ4BeyEjAp2fZFUhXE", "bzxKWti0wqglly9p7llL", "Vw8VZhl1MGGxDDGh6yf1", "pMmYItLNf6j80pdaXMbt", "bppo05U5196oTqMjjf7M", "moUmd6K8Su03hpqisKnr", "Rrgvh0cOgjjQXDABHTHk", "NHl46bkwtVoLKUE1SqO8", "a7W5IhEaAWIVn3XsdImW", "lar6255VuRbUY8XpnmNv", "GfQ1gxtJDgoxEf3Hj6kd", "YL54RctCME7arXcYTVpg", "9dbOHed0jNbHggJ6GBIb", "PQBHvnnOHc3QEemVHNT0", "k4FPiWVyhnZ7BlM7W9Vn", "jWCv9wOQKrO2tbRb7wYp", "i7utqG0NNUA4yKy7HMXb", "Ctd5U3fcxDPfIJX9XVUs", "zcwwxu3CFZnRQOUvP9VN", "Ku2dBXki3Ca0oUwjNyvc", "Xg3v5VqSfJpzDqaMNI2Q", "UaRH5L0QJu2oa3kdYa6B", "st95jjQ50STU3uj6GiWX", "cWMAZ6o5esHWlQaT90Y7", "Q1cTuJZ813fdZzo85aCi", "STEDtme0kC8BCic41AC3", "DpenpQts05YSWlePXGQG", "TWRdE3hDBrGPetARJ1IK", "5qkbbMz7dNN4toh5pMI1", "BXOpQWHjVX1aNmAz876l", "URnLFUO2og1zBNnbt2JP", "ZKxw45tDCxweOkzbCNe1", "2dyD1lnun6HMODHTIAeT", "6Y7UG54TSgSSJQgICTBz", "XSMtdbMwlyNrXUKnZME0", "2gSJ76cJZnG4DaypBIjv", "H6kma2Z8Oo6OSYiZfIqC", "37FEfD3rTmmksUURX4Xv", "qdKIB0qoIg1JlEXRRbGs", "L0bEU5d19AvxnFGwD4lV", "kkmUyJtNs9DE7oQbu1b1", "BWzwjDqwHZPzJ9TFSMaJ", "ToVacvAWujW3DVzwinqx", "NDweMQumkS5EEampTuJN", "dpQqKNk0BYxYjuC5I4s2", "VvEjU1YxtsJXhhL0540E", "cymMqwP6zF8UBLBdKiaD", "atkFZ4Fe8GsiCc40WS6T", "hCvqX7Trp25NtncSrq4x", "4wgGWiG1AKUqWOe4V8vI", "8yd1kDUb3YZ7TDLxvZw4", "tPuOnYSGeLWmI9o2MGdO", "mATFLpBHM7JEUDcHj4XO", "N18fAuhVAJrxRKAl7J0U", "PJgtUIBDMgZhigNqa2Jj", "JAgjToUY6U2VniOHyXSI", "E00ugLiGN0zf8dObQsAW", "MAz7rNMpto85o6xURfjm", "fgRmKnNifVEzeB6VYQIP", "FOU1URUv5Dgit7UBvqtY", "J5YxGcQn3hCG5fHa6jTB", "w9uoFMx8CrgWuCRBpswq", "Z64clLCs5e1zltl0Ej8Q", "apuS1MdoCXcjegLP0WF3", "8F2t8muMV0l3pfVpz7bB", "eEsIsEgsivvqAwjHibbB", "cMEP0hCzoo9R0zhsBNjt", "HchPYRgE0IPccd2cJCa7", "0hYygEpsbWjs8RGhqwvq", "CJTpwTPFfxLeeraJ5P9f", "tsV2Hlj7gcysvRfqs33V", "0M9dCiuH53uztQ19BiGr", "KEiEdN2TQ3zPQ80couru", "vmtmCuvLcCBuOt80E8Td", "CS0aZ0ANu1HnlAZx4THe", "fSZ1Jf1XoV8yv8YU8iq0", "j7nVGLQIofxR5WSO9Sux", "v2vqBRJH99IrE3KUOinA", "OkbTE2qLSkJNkCBvcUBj", "bTaqUsKtZ73vpdM1dCN5", "ueSfodaQ6jAhAiXfZqW8", "xZ3lAPmna9sUlI9aui00", "R8fcpBHO1nUwKXhTuSGU", "Z7xLP6vJmtHE0vop63B7", "of18AjZ49oXivU1IYwcL", "orXmmLZsOkxCPzIZgqbp", "e6VZaXr7RRQDJxx3IWue", "Grodo4ASukFYql7PGxWh", "Owtftqh9NblbSZDFdNhY", "7x6wgCLw7rbTlS9cJole", "PUFp3Q4emmCrhHnLR8FY", "zq1iJ8Kaw3ELXRBasDDc", "xNTeeHx3PCbN3b5KjOse", "R6xzV6XLKkxH8Pukgro3", "4NO5ySNgqFIFJFEmMk8e", "S3taSlJ6b58fSWiPw33k", "IL0ZaELuwRWPVOzv9G2k", "LANme39b6CJMXJv5YFyU", "gSt9qr5057iPF69r9IQE", "Ukaz3U2Zhy2NRtXHiaFo", "fyBu2Kj9aAN2sw1vQ1V7", "0VSPOxe7XutCq24sMo1w", "wNwoJvhjwAoufGJ4Ey9j", "s0wg2yYMkXIguESD7Au3", "KiyyxF09D9s39mj9lFVT", "ll8fxar4ij71S3zNJxWU", "6MYD7FKsTpJEaRrV0iZi", "SehsieDzbhTf3zqAFA0g", "zKuXjl2jSbQsG5iwkvvJ", "cMzdMnmZykFv27TmsVTI", "5tAJzsFhl80LSxzmljJh", "TWcUd5EUZhmebvvYl8FX", "EDsg9pRuWkb0HDSsHgMq", "N7Sw0NUlVhGjv7N4wowT", "XVRogtexX1nu6Dp6aJr3", "z6msD8u9woaTJ1FzsuvP", "tgIxu73UOsYLyIDBQ5JL", "ttmCt0Ajs59ljPidUj8q", "beCYwNjLT2gMwQXnQfWI", "id1R2h5WQDL0pXYjuH4N", "IiiC7FzXuVoc7p39V8ev", "Jzt6URqOhskxZS9gf6DZ", "Zz9gnAoIHSBYP5ftUVF9", "Lz6uRDa6JmdrjmXWvLoC", "l0k83PzXsFhEEl6ezfiG", "PK784dfzwRBiRwoSJo0C", "1fOFOSrN7YcUshdwKGuH", "f5x5zjXHXXRYAnmZFbuL", "9WpzCQwWeolKriPrSw6x", "SXWaKG9Xr2szWgyi6sFj", "gy3YhQN7KT2kyYLGmSlc", "UebzIZhMSu56t6cYWzfp", "QhZMEscyLMan0BmGjScB", "MiFFmslHpO6G6daIWBEp", "XpaVyLlhnNq736Lqy65n", "VB1ZmcpIn35IsenrzYWm", "tNrxTClPJqAmzALlm82X", "B7n2lari8NS1kKwBWfan", "TjZStsEd0EAAJxC3V3ld", "OEc9WXK0AtoecL6VCI8C", "WGMqBWtgZcHwor5KMNLX", "G7BqSFLeYRp2h9qqghUD", "Kl98bETxamSotdfJr0yP", "QlP7uGwaxQoFAxOlApgk", "Z9WSkBlbAhyaSOfLcbvX", "2hnCd9vnwbVVi1vTBg4L", "M1tmPY7z81WAiHKLOD6K", "oZnVZiykN03j1wTOSbNa", "asiI70cWDgo0EcVnITVf", "RWMTQqpsPBTz3BFACpeP", "WTNi3sTLLy1lSLEs91kW", "CDTFNjOXW2w0TKiWABsU", "7rFZATRKSAqfLKui1GFX", "HAWkSEHcQ74VyJ58kUQD", "cHsyZkeazs5G0b0SoF2E", "M7jIOmP9FpMr6CpdwSBv", "KH9KqAkeNkqipY0EKPNZ", "FhPJtCxne8hwNqECyyqM", "hh2WD2iXQ35diSwZerNJ", "y4DJsSVrOMB31DaEDGjd", "KmG0EBar2x8yzLIrlngA", "7rD62lIG02tKm8KzJuqJ", "pwGmHYe3LIBRAOXC8qS8", "qKQaQiZjbN0QJGDZopc8", "7lXF94QFusNiAlJaUsH5", "EGTVWg4JTePbPwoXyEmr", "58ZFtsoNj3QxJuSqYV72", "9WbZQP6OesFjypwsfkDO", "meJ5Wkv4F26OWfvw51Jh", "sYOoLKgz3sLpUdu0No4a", "o9wLmsFrrYWh5uWODCLG", "2h3WKvWfjZFWgBpS14It", "boYeh40uFM8H3BmN4I2m", "pFIVQ7wQ9EJk0pMhuNb9", "jhOmsA7vT9hGOzkm6gCF", "uTyuJKaBh9KQriAhtHcK", "OJYmIIXMyhaq9YjQqJbY", "SvwHb7zSObkntJX9Z2WY", "k4Mrc5HQMsynlt4K03nM", "dV9WmffMh9sPDEGnIVEe", "NAP61UR1VCO6fVcSAGoq", "NeDZsUK8zWlLhAPicoi6", "04CeZn6i1sWOWjxMBIV9", "oGSTQrA1gq7euJIR4O95", "EdUkNP7WfafSq7tEz1Fd", "rKHlcYBgwKm9wEtJbypF", "YThOaabXco8R9QBlyMPs", "e91aNtrxrfCO8tkgRLE1", "8KTHkc0gyNXcXWDuP4pF", "j1bpsLWKfiJn2k4lM2PK", "PwxwT8pqAe3ueehW0Bof", "t6QuqSdBU2TrxOmOWbEh", "DGZruEMsQAVHGv95NmEp", "phhk4T8a2MFDcm3V1PNR", "XtgmmqpAc3zPie9m5HL5", "caJCNKhMh3lEuRygHnos", "qoHXSPJWgebGFuTaC8ut", "Bf6364kMsWEgKVDluVHZ", "9spMlGuxPopYRvaYzIsp", "o6U7ZfsSA71Kxoeg5ZcS", "LRynMYJJqB7dHbkoGcGP", "hFhc2LJ7svXEMT1g0Kzo", "T4RifBWullJS0y32JM7A", "HcOb6NF4fCs8HKouVKoF", "35f23i2L4AVJktsoE7st", "Il1Z5pTY7Gn9LTBN9DiE", "LDV64MuIRlBjWAIZxk52", "0tBJKMgRaMdvZ9zbVsrw", "d0g78we5ej6caFwscaKA", "xx3U636ZtvUWw8b42F8h", "yCJZRDR3ojBjhFDlGHL9", "Dnd7vE9xTHcPRuyt7Owt", "76coJoYZ3rgEeJLZVTUy", "k7NC1K36ix0n3aaMM8tQ", "zZcdqyALReH9jfJkxMrf", "KpQLN0ii6b659igzeoJ5", "TaDADUvApkn7XESuE8cJ", "igOrP3o3r57IgITtmM4Z", "6rgd37VIF6ZxmxmByZDq", "cK6IcXAOtCwx1cY5j4Lx", "8usspd4oAHcmZi3BGDX7", "PT5Q4dVnfoinibgYCiMM", "xw8WeBfsMC0lg3AkgdVM", "SC98nngzV0JQwRwZbbRx", "mPjQSrA7UdTupa3aMjXp", "iqGeIADtkfoW2XwTM4ar", "f1lVbm3vUblCR1qhB4Yv", "hNPhsLAFNk43lnWLaZG4", "8zGY06FA8o3n9TV1mfGA", "OKD76jQgGfkPeyxd2AnB", "woy5HR545JETcPYi6zOM", "c6jE4er6ncFjRCnidski", "By9nNiTTfroFvVTzAJ4v", "vJeKVR19HlpRkzC5fgXK", "XJXTo0QwJUrDmUXHtYOB", "ICa2Bm5oSa6ytdPgdpav", "IQ62udHlAgwSqUS1HVpj", "6vfxW4b9sA28a8AUkRFu", "5AKvemutFjdJcGF8LqGD", "yGJYPT07uE10MJvy3qsI", "XTc8jpE2dSFcjWA8zBFu", "PEsjVlhYZZq52QDmFPot", "s2VbYdhWmuOB6Gsbza9Z", "9xeCMpwZCiQ4itdFXIlJ", "A9TGNLpMvwt5sVFEI9lV", "rCXY59naRYucfLq2eeMa", "aGdQlqe4xOZoa4KdD7Ef", "d6FIR3I3hfbGvCge2Jiz", "hFmFK6sXC6ApAN6ZROd6", "3EKwRzbRIHPxXBCrF2OR", "7ZHHwNrLjSQlgkf5hGXz", "Wwu354uI7GkEpzVkKK33", "mRmRCSWrg1pCvjFyo7Hv", "Oz7ByatGvxHhO46YUdQA", "cFLYwaWignb4kiDiJ7yE", "2EtOIyvmbJuDYFjSoGBU", "1mYmVlSmqPysdpHtnCdO", "VXa1nJRbXc3XNbHqKhcB", "6a1hPIaBSDXvj7uUPM5u", "y8PJhe9zMl8QJA8hQgst", "sPmbVh3s38mzEAJtoSqA", "CzbT9hAXL0ODOBmrspjt", "vTs7d9ySapako9DvqMSC", "KrNi0AZsxGjtkZyLjxlH", "mM1YVETKYvUtkrZkz7ax", "NJo5rkRYhCpRWoz00SKZ", "MoS6dzpb6NWUfKXW4y4k", "9rBffBffbxCxjc2Ncpyi", "CUArmiNoePYnGiRtt4XU", "2jQlMS6yH2eTUpJEVg19", "4XvIFKC6OhbQQzAkREig", "FL7j8Qwd5xk7UdPixZoM", "ENkfMsPl76RMRX3ZvzAy", "us3PWT5T0tnFHWsdOFPV", "LopkJtHFqRBlKF8ogDFe", "63rLXjzvzMRIAE3S7Kfw", "kqf23nqjy5M26DOdvLXs", "hyApABHGWuCElrGoc6WY", "9saE3wpyHMqyI1mTA1je", "wvsfk8RKCxsKnSYrPNpe", "keb2fNTpMCSI5KxpRP9d", "Kzx8STxprkTZO4Z1P3rm", "FJ2Jby62LEefDZld3iSs", "TuRpwyrK1g4Fx6YY2ebN", "sD16mmjpTAhu46jy5aI4", "GMJDRrkTULrKWsQIc885", "GnzIuhGxHX1WtLjKATmc", "mdxIVLb5RhBhU8zMpEJ7", "lLbceKxmmjPWKMnnfMs7", "33oVAosz0B4lUfN80Itk", "zIGJc14HNxOQyDw8zm8x", "vAiQq3WoMPYLfmdHofZ9", "cvaZ6Uh3En09yiXmk4a6", "R6P7q0OcgvmGrKpvmVz0", "Gx9CehyOjYUAcrHTse5W", "ZrmOBcIx5HvLC3YqkUER", "1gbdYr6OVCu21gPBGh6L", "w2f85BznfBCgsnKOcOk7", "Ye8aIXjXEpqApVIsgFdM", "Rp0JbIfDhPJF1RnJyWoA", "KfK9Aa0rqdBFTBW4UBH9", "aaMZzAsxeh5wMN4Uy4Jm", "hU1AeXC6gUFE2bn2jdxM", "K1IeOK7MOQ66t7EVcRbI", "toUtNHt7vpRDqjqE2xZQ", "LfUElhjN6Iex68qUOiZH", "X0ULhIZjD8AZmcnXJVsP", "nWMudBOztvGQvilc1IKE", "PUlB4ZgO4Ynp38jeJ5dC", "0ravXLWYbql0IW9M3pi5", "OWvPee3vie7iThc006Xb", "uIcCmjWoZFtvjmKLPLG7", "xNnQ2PQ2TxbNDBXyv4mU", "HdN0QfJp0ZwxujNu7lwa", "jVyuhTscXc4oGRme65T4", "cN1W4MQ97KioqejX7Z7f", "CBRQcC4gHVkuqjOu5p2A", "7kzxOgSVDZAPkanKmpy1", "Iiv8RK1U73dElcA9GceT", "AnrsLcD7SB8is2pHMqkR", "rNdcxnjDONgW8VOT8baY", "lhGbj5q3taSix5Kur35D", "PkjXF7zLhZtQE81xBry5", "QQnNW6GN7LaU3H0JOzc5", "WWTlcUinKhsk5e5biLwp", "fUIilIzAHcDn6hYg9FTT", "uKBzyHZeaVRFyjwj1trG", "V34ZkaFrphJh1UhxjGbK", "j2XhkTPjNG0qJ4O1ebtS", "IA9JeoEM2pgkqBRYfoH0", "5HoMJCOwmFO4PVM1IYNK", "M14ADUiqIzqLHciYn6UZ", "JqbiMvheU5wq4z0FRi5j", "ft3uWlTHpxq8oRo8NVkp", "Yefddds4Lwm0ppvJYMaN", "JOT5oHB9mtyJYbwBEmEZ", "iyXWlQnJmMe4k77YMJf6", "CdPiEJuS46zm4VGpv26g", "Mki6ppd96IFHudz8wrZ0", "xYlz3zoxzubLcHQR41aB", "HoQBRNILFrKAN3AP2wM2", "pvLRClrGmPP4DnFcBXwO", "MGYkJg9JdTJQMfrYQgmB", "6AFHxSs8yoWK432LjBeK", "cykybaU1EHCIPPaMsSTq", "Ex8I0BbiKF0vBjtkHMkV", "buo0KMMCmn00l8GjHrRc", "4QXE9OyQkgtLbhJv1g5n", "T5lCB1wTqN3tlY5uw1Kf", "iE0JtIEtyHgPMQcVPYwE", "tz7fXAXSBq7t25AtNOmJ", "fRjzrJTGpPUgNZJujrMt", "hRkjXvcuHNEvovufCLt1", "lMh6t10bqLUXkEEH9oAP", "BMKxFCcRYUSHq9Nj8LKy", "emTP1fe8UoVd8pbN2BoY", "fGpTOADUVVTAIwXHcBN4", "ytf6iEUiOIG3X5XvDiPj", "DqrTlOkLX8NV12chF4Qd", "MggrkBkxt8e5yTYjpJ2N", "PPqOQS5fWTIr8wiq8Tnz", "bQ2XtbFjsH4Hhud7Ngmr", "A2gIyP84qt2PH4wBdBsV", "Twk8qLFB2z1C1hSx4Y2s", "R4Hj6CskLkDmgwuWH7gH", "6hT5Ot3RR5Jr7bYBnQv6", "87tm1nGGvwYzd150t8RK", "Bk9GJhR45LBBQ4xRrEhk", "AFkmFnm8vBQ4taKDFlHJ", "4QUUUSvKeb2oqmY3ZI9S", "TaWN8oYLYnecE97gZ0yD", "b1zQlWTJoblGBGbH49cc", "uFF8MKntKl6wm3KWXnpM", "OYaXoBmrINRCceJyy6pH", "rvDcwX6UIvofTOAGXv7p", "IW1sBIo9OdQEWboQ6uuN", "pg0G28WZ3bOL8OBJgzQ3", "cpH6O5XTxPqm6q08wVg0", "64JCQVT5Su85hN95SgYN", "6M9CA7I7cy7j1QtPtNUM", "HaPwxY1NFYkLurV3zlAb", "kFIjdC8XZdtoDGi9ojW1", "FHK88pB5ZJhJYx0B98gg", "jXSxnA6asab7rwDyjM3I", "fiZBgZLngzUPXuKI5Osx", "zU2oOEm7aoOEWvNCTi09", "gSYDKtVPFOKEqL3CXnJ7", "bfJ8bhI4NGB3ijE1aiQq", "4j2u236ZrNeS1yaadrcy", "7n0oUEp3wDr0wtsyxwXm", "ICEH8nrleThjEhXiuMjo", "aapUSfRNaw9q6L7E6wxk", "NfUbKzHEM13ubqO1TpO1", "mXrsry5xs0gFd8qy78AR", "7DLg1iiTV6UFcM6RIBOB", "B4QnCFlILvjS7586loZG", "t4WVQauglIruNIhXXQpq", "KZIPcOVND5b675ZVfTBO", "l3H6JwcoLRefyw4YKXtV", "aVbhYACEbOaNRrRim3W7", "VAkR4o0MJtsuMRbvcm7D", "AhYZX0FH1lOUt6wvuuHB", "n75AZf39RAMZpt6MrLbs", "6xNx3HsxB77yDC6mr9vG", "JFp96tTxE5oI0BF4Q5zb", "B6XOJe88l1N5GACL4dGI", "g4bhDoldskC3rkP8MXE7", "YZAmkK7oyO4cSfJeS2HK", "lUNaCmiYHufpUqZC8h06", "32jTg0781NQmpnM1X2Zo", "wCbO0Aa9pYFsbwMFvRNw", "onidY4c34Bp0OQNMYvVO", "UjE3dYIY0dUmOAOwC0zG", "CmFYCcuiXO6z7L0ktIJr", "tleHu2B628LCuai4Abnf", "ztd6Edo6u5xnrb3jbEnc", "N8oHgXMo69U505BDizJc", "5GOuqRbPfO10XqIBLc0R", "lSUlXfyFcFqfUCXKd8hG", "XjH2XZDs9DHufldAOaQy", "nEcHQ7Z1GHHl0YlX5yNE", "Ac6nNiyjIMf3aFLyNuzb", "9GM9n7eq315Dd9zyrvf7", "HLBpYUnvOmWY0sfnxKe1", "JhCxo9te4ZlLsuAQOvMl", "hqHihuTeE5dYmoTZxKD0", "twLjrU8DPSw5IDlz8EcK", "KDq41HdxcqxTlGDciLn6", "nkB5vw338fMSqAVsS8n4", "xiXiyiIf35lqnwujqvky", "Y6POHuEh01lxjGdgzvL0", "z6rm0jVqeGmAKBYZ5nG6", "oz1WGfCDYXDXb2IbjnPL", "1BVKL4tQr8Ud7U9L7JYf", "qkBPmTyWENpEZLYuPPIG", "XltdD1yKKVx9D6YzXXTm", "sJ0PcWH1vYFRH64U70mS", "TjZgo7eLc57TM5syZAxT", "iCuzJwRQuDqMuP2iVe45", "i9Y4DR1mZyDFB7CS1dsu", "ohGi4IRZvTddaBfnaeY7", "dlMmrWEs94mxl2gqJ5NC", "Wyn6AQui5SogBAS2hgvo", "ifkUgOIxTd7zcu3kKxQP", "NE5ZNVb29Uqs8aKmwcjP", "DoMpiQX0LyOhARGXxpZ6", "IOwQwGAtqtG4hbrNzNNK", "JlzTDFz83WELuBjpPtgG", "kwKPX9kUW7pproH22GA3", "mMMfV5UvwABe4T1acl49", "qrwfgDhgTrhEE3tj6Nc2", "VneXGf7rOCyC3ush8ZLZ", "P2nb5gIB1vBUin2xQ7oo", "Jm1Ler2kOMKnO5OSkfbj", "anEGaEDzLzndjmyOby60", "KQnhUA9EpkvNV9d4Lp3h", "mqIWbGsCEyAXNyEr6L3t", "5yGb6tdRgg6TUOx5cpGp", "lQM8MYxSt0LwxZV3R8S7", "oXYJtVMWIaL41fALB8m4", "6703hU66cXDR4kixD4TU", "fmWePgzaolctrbwW53ch", "an6cXoZlt1DWnjABP9lC", "tO5kx1G22qjadqCBemuV", "l71YqBhDJRNCnSwkSAmU", "0V3bJDmwxeRijRHXcwlt", "N85AZzu17gT5AUhTiRPf", "6pOnGdLqZ4kxCn7jn0is", "gCyqefIM6h2AUOyk1HbY", "LLVV8bFtbxmF7i4mNM8R", "18aWUYGVnp288XdF6s8f", "ostvaxhvJoLIuvoPR3sE", "quMzQxEWqMAeD3XlyFhF", "12XvvKKKNDYD7sAXpO2d", "jAFwBnh70MM1MtuFBDZW", "O7kTxszlHzM09cuINZPL", "ulKGcEUoP3Kn92H6vGpA", "FC8Mo0e9Z3URmoiM0CAQ", "DTBMTSTMgIWvSeHEetNC", "updgbJ1cT90hcB34cUQI", "lvEDXTQALnMFdxuCFvoi", "4mNfyPjYr7qc24oaWCir", "z24azwnErZvuKGZGfGoX", "Ne7OhtwD5e23g4dd1Osq", "wlkG1HWhVKCryJDfB9qG", "nqJRtv4uJuiFfRTfgzKC", "JW1GnEtyNiF8WWZPRbJj", "W0w9RQm7P6HhaIvOWoKr", "UXz14WQT8iCci9j7ZWEw", "cWbBoWZJJrAnPAoReDum", "t5MbC6gjcufCOHNDluW4", "mes9oeYTrQDkVaJfexOG", "s2QGHoR2gv7QaxZMb7nR", "Yz91ZRhBO3PG5pVMbuPI", "oUiMRIg2NUTtTbt02aBQ", "dafhN83z2QHoux8LDpMb", "JnSkOLiQtrpVPUCmcFlc", "g0RYyZsBOEkfzDNMW5mQ", "wbvL376fKpIyohXmENvd", "beGYpcuLhfjcEcvIj1v2", "pD0dsVN7sIiRuw0jYs3E", "XmqmPj26lx8Y97B1cY8V", "oqujlsSJlTXGGN0d52hq", "0qM7vX8X5F0t3vaol18W", "Ufni1lL6o3umrGtml1Hq", "EIhIBI6uHERlsCUrxnxj", "opTd5MNqMfeavJs4Zxyq", "BNa1Z2sVnpCccgDf0bTM", "G7v9PlDyiBnsZNt6PmZC", "ZmmCQ0pQZJlpOgwnP9k8", "KX0rurwJdVTBFGLdEA4n", "TnasRWdqfNwxuunomj5N", "CXYQlr3z25kTsKJHox8T", "K2ODx9zjs345adVLUWKU", "c2ySMHkACqbVsxin7fWx", "iZ0ICTbe0t7cv52FKmPV", "ay0TugGzLlw2KxKUQw6O", "pDylG10ZlO2MK2pCg3Bz", "m8143MWRGbq3oom3nlaZ", "9cvRcieIjnFWtHYwb5Mr", "gCuSyhTmS1LZbEyDwaTd", "Oj9F0gAblWQPgIpexJOP", "Ihwuvt7pTZTpGa3GEDpz", "jDMPVC1TTQql5lf1elo5", "KFtaowo27b0ooMDHWCkx", "abjgKMfy7T1PhsxVmjXt", "IXh6ssOM56Kdf3JzNyvV", "Qvs5noaaX5Rqd9uTzGp2", "N9g0Ax0Yut1KotNahxAD", "2Z1div6gCuiX1OXCMVkG", "PlYBcvlIqtTqTUU9PYpZ", "QW4SuceE5MSS5yefrNxf", "FQWis0pIWdpx9uP1W3EZ", "Ng2Sde7U13AGRewKekcA", "NP7UJWVnXjNsOPK11QT2", "TbHuFBErto2EE7iXcCJ7", "vg0H3II4ik4BJJ6ZVIOM", "7ObJWJo6T7DPnBgoUxqC", "fvMyEQVhiu4nIf6mwtsQ", "04nmDRahORs1KE0YeVEM", "PI8gvESp5JD6L0qYQQGm", "p8o7KoeyHsIf8QL3dlqi", "42oP0eyQ3CDqIzycnca2", "SshaJ2bumRcqTPEU1As2", "M3tc2pEpPmsreXPva0nM", "PQArnMJoWBrqFiSHXe5u", "Qvj3S8w08kKV8VMvpdjM", "naA0GdFnFKfgDOjgWdec", "Nz8VSSQH48brgmrxN6kc", "PQGcmxGJbvvys1SKSqZW", "yBLfxAcIEKudiBEV8Smj", "LfgDh6V7w5btEwYB68TK", "QLw9W8cdaOKu105i4bnz", "eOssIO1MUSfunb1IhdtF", "zD91CFhGoTFQr5G8THUx", "h9sSiriPVbfSpoTz19Dn", "cRDRWRZ0g4vNBloudWJ6", "8wYvj0si75WjWh817izn", "kuBvgznHT5NZ1tSirKRy", "OvfsaothUsVEne7Rbtg4", "y1cxu4ekN5ilyMdY8XGc", "NjoANtZymF0iGce9fIt2", "LZnJvOp3t5dHmRP9Jz53", "C4mTeOaJeTJz24GwT5xM", "9bbv013J06NCA7dnTD67", "eO4fSKZvNWGW5pQ4qTNo", "XizinaTGmXLQvP5OheH5", "9VbELzI9Sew0Kvg6V9KF", "egga3jylMDqVjRh2Py9r", "c5pu0T0UaLjFzNp27lnT", "wdwd3dfSbnHBs54tY4L7", "N2MKQ9NXs8ymkuQlX3B7", "qSGjVKa2Nt9ivT3LaOqQ", "UmCEgazCe8HSbX94qj6D", "aFvWgwpGIegnQr15RzF3", "7UUg1dlrLp2v3wPjsFyB", "rewFTxKtuXw01Qg14PqN", "FtIIni1fvxokaiz3eIwY", "prYrHDqJagepZx5Kd50W", "2mGcVFg7XafLRCAhN0yx", "gdnEYqYBvWfyHvYk8Crg", "nUzCg9t39s1nVmz3aWCW", "0rSHk01sDqWyLVAze43l", "u2XNmWOM0aq1PII9HI1S", "6WQR1aRecSNWSutCPHYP", "pNQEdhLuxLK3rkTqJuUv", "KsQmkHy9XUXMrvZVcsNX", "Dib2Q4tjwLdGD10wGy5n", "Qc8IWhl8X8ejoDlDFcuB", "yVP9WP5nL9Yljg1FLmMt", "t0chDLsSynbuI03pN7ai", "G8RznTF8Fb18bbomxgEt", "RpnknoXAv5qBDH90kO7y", "x66WisIdXUUyHHg23DCz", "I08UHHS0dZyYg24MvKxQ", "mRM3g33jGFiXFr1V6TVk", "1TGhVL1OdymQN9R3CVmQ", "iTvyIwRMOw4NNL4qg3FJ", "z1hM89PIc9hKacGqXhDt", "bHGycIpGL2YK1FeAM3Qy", "A7HjkXZHDm8o4Olegavz", "cRJbgvl1yCx6JEp1kPGx", "9OjDkUqQ4lPeCgGqbzpX", "9ncRzRShohcy3M9oozEr", "icVsGjhqhULqFxHFNiu9", "PX5QrFEfCTWt30jHjO7Q", "tTF8OULlCGvZl00cDEHO", "fmFgmyyTL5sEW7MvZggm", "wZJhYJHjWW7BIKs2HqUc", "tMqQRAL0qzkmZ4R5Lgor", "Du3TEtUThy5aIvyh6Jfu", "JQfqS6vnlhfwbgNoXrHE", "nNm3GlkK2QFJou9Ey21j", "kedJK17psN1ekohyXSHZ", "qWtcO0qK3p4nUh6ogCcZ", "ZdDHRuDwKUW80NkMNYhO", "Oj9sOEe5QGexspEJhPE0", "uk8s5rFQNupjdyb1CE6c", "SiXKVjcB9qB3YHvd683S", "2sBfplf1zjcRS9kvtM62", "AF3iVyLZ5M17FDn4yQ3v", "9fKZn4VgOZgYnhEIdZpi", "wrq92bBy1ErAuBkhEDLa", "kz9XgNnJvb2pSqySR9QQ", "NFYFQGueTDDCCKjqfV8a", "68NWyLyNSMnobL3zcwc3", "9pFK9xAoQGNWOk0K4whW", "ISKrmMoMGQPPDdjMas90", "6WUTEUnIQTngt5VfPJ1f", "kP5x2mIccRajv4C9YxQw", "QDcIG7xgQxL8MO4MBMwn", "lWUgYgn4eB02McKdhGJ7", "BeEV3IrCenxNHS1p8otk", "ytlKT3xAHEFSrTxsjm4L", "Z1iqTjdaWWIUN1mq5iyM", "wCnndkfNVhi4jPtA8Wkc", "114O2rD7Z9SVLFHxxwKS", "e0VLPMVWqE8rDBEF2PLb", "Wl4qyLntG7Ks5pDT9gzz", "s5p5E1JGQcpuNukLDXCT", "cWJiLU9S96S19H5OIMeg", "yUaLMLeXqq1TNI9gnI9w", "OZvXqyv6KYkI0KbMdFtU", "4svP943wKCqiljDZi7d2", "fNJdguzJ8qlCheZqgck0", "nagWHs6zzh0c5JFlDC2J", "2mVhQ2X7fH7Spmy7e24b", "k4DpNSYZcaseMMKlOrs3", "7xTujQzLS4wA89xUZV3B", "4toOF89cxzf2x7xeXw0z", "0u8725bbbcldVX1jfBLa", "Ayd55akaUiYVagacl9CM", "jxzCUzv7AEhIDIMGs4rN", "kPqK5OxoX99E46QW5MdD", "aIUlbq2RuroeEcyH0t5V", "0Ej4LAaOUBc2S4m1uoSm", "dFQrpM8qGDJGQ1Jj9r7d", "1hdTjPSdBuPo9nfx8lnO", "z4cN5t6ElBpkrTDaqfC2", "XZofNUcVDNrCRRXVLdh4", "nXoeyzEocOo7ydmL5OoI", "jfT940ePeLRRqD3oCFdm", "eRuc2gv73jQkMttQtXoV", "rFuhRxUbB7OpWGRXuMex", "34gPvZpp5bKwpDbG85rJ", "AD8fTXCOtqJwtzJoZ9de", "kwYX79nFDfZNsh0KFCi6", "111u1KiYRKAAEihLpTY0", "87OynOI0Zy4a05SzO8Vn", "SfxeLdx86W9CdV8QrPOQ", "NTyLYQIuZnizQdejEZsI", "51UhUb5L0UmLxihT9xOg", "j4f7hHrurjCuifbCGhVE", "BFZ8yEZ5Axlt1O0hepbT", "YlNEQzOeeusp9Qv5cUAm", "QvdPIe6wTfP0RmCpjZUN", "RKAYi3eLWo7wijLyNQuo", "5HmU1xIlUk6v4FRnI56o", "sBiYu4WFSO2Xfm0gjGPB", "0W62jWpzbtmR5UxzWTFy", "rHUU1SBliaui4zklVYl6", "PVWUzTSUvhSkwuFxMOg2", "ybk1YTm3zV7O0dry5JS0", "yskunxp7LUAI3sJbJ3eI", "XlfXNWTSntQlmAdX8QcR", "umjxd2Ww4AFbus6FMYh9", "R7sBFVgLvJno3WjgXGdb", "OsAGiEV4mCBEH3PXY6qR", "NdFQAx7hDkGZaQqIcLKP", "WVdlW0G247TPihqsexXp", "flMF9CVmWnB0Imjmk0on", "5FCnw0eYx9Lavin4uIqO", "5zMLl67U6vH9BTw5SYcP", "ixydflhY4Wu7VHRHNYlR", "S0abRUet3GHlCFOp03L2", "ZGA5VZKq73HX3p6UHjMK", "xd39sPzsTIt0W131aLrf", "O6DPtHsByETwrX5hw2XN", "JQOpRPr1lgh7nsXg7Pp6", "bJ2Sq57k8e8R5UGWr5Wc", "mDkX3HBAe1GFKIf8OmsU", "QytTQ7yIBUuxfcSirdqV", "c7iuNL2j5tDUr4xICvYL", "NSI23iiuJZOwe6o1QrlV", "kwzZ1xpBqNWEqmEtSvll", "U9f6GU7gJs93n9ao6Qxu", "nR6bDJUfEEOgN4mbYtFr", "kPsXYSJcsEUgfbHsukV6", "wtmJvWvRPAG7X8c5ZtfP", "7A3mlJcd15jxzVGs19KO", "KaUrh6vE0ad7kfsTyU6x", "anuXGANFIhccG6RvAK9A", "vkGdN65La9I8xAdBL1Rd", "g3Dw7cpHxwSqhgR4mUOK", "eeRZp2i819jiAucHWSZR", "OzH3fh6PBUhn68KvB33A", "CmsLgTcBtBcFAsHnZNCi", "puUv0or9rsK2fANJdzUU", "95kHx15UMFAB7e68TvHI", "oZITkfkLdFqkKY1FX4ht", "Kr4RW8Xx4nDsMWJ493Qk", "GEUYkWlHaS8sKAKoIrjK", "ewCzQT3aVRKldnILJ3cr", "Wikos2c9tJTWFeTe5UCa", "uUMXHcrYfTQBA8z2AZ91", "sdV6FyiKRuvLOFqerhCW", "9agJifJqDTq56L9LIrfj", "lY48numeawBjXr2DUL2h", "mslsDuBTkpCVNEbB7Nph", "IyQnnQyGj0xWqgM4ZYVJ", "LgmiuOrzjfe1d2oPQlfA", "lagcF0eoW77rnragFPfz", "4IygKl5lWivHIZrVXTJ4", "bOvOGT4TtiSx0PdKAg3g", "OwxfTnA1GS5rq0E4SIYL", "0yIyNuHXYKDvH9YkugjA", "8o0xnE1FUXaTUqRriiNH", "3aAIhi0bOkkXWkUHwTWQ", "z4tTtLIZ3fq4EyMvgLV5", "5FaZx2rtTLHSOBtHUCqV", "rfa5duzIFSNIfxsczhTQ", "2itQtmfLyWro9RrkJo2X", "GNptKfTHMwiPdZnWJTsG", "xj448toPipwwCkqVPHkm", "CQ9pzuLJNBZIsbMyU9OA", "yI7A2vfSCOCOoJDoDX5b", "getZDEVhNrqLAxTCq7c0", "VmNJ5Y5J3AskmjHzxmfI", "eVbmQ5wEAZEfJZwP82iB", "AYtxHAuDvZVX25JS8DgI", "ktv4SrTar9k2hdxwmr7h", "RdETgVuoiY6TR1VuqySg", "5CgkodgYUmFtPRL3uDra", "lx3DwY5kUXQZi4HUhw2A", "iH15gK8aXzAHwCUqiZaB", "4zik10EjwGreVqj9Bphg", "oqxi2RWiy4t13cl5a0mW", "Eb8iRprceXJQNE8Nge5c", "ixdkZNn7LXdX8jFXY5AA", "cRaxfgKJIPu0MVitsT0D", "ybl6Kycq3k0dBYaoEu6W", "I0VeVBWMfUZd6IiOHIFI", "2DuDmSzyN5Td3yFX7ltk", "GSOKj4iyMvGO98ZtbWpw", "aIZdEoAMa36oUS8BUq9o", "kNAtWhk7EZ3oqaP4OaOw", "bTk3vsEOhNCPjNIF40KG", "XL2LvSOH0mEZFyd9prXU", "Dhtu29977RLckOydqMuo", "86NM50TsqyK1fBviI2nP", "R81BUzmILg6SnUmqSFgG", "D0Hs9AYRALobSpkunWD6", "DJYylIoCXSSkQibZq9y1", "TmavbLpMr0T2Kz03ImDn", "CeYcK9BAG99jtkcT5Spu", "SGxkEvmUgzHsdpTvwc6D", "mFudzX62zwxPAs8OlssR", "rAITxlMuNS57gzldWrgT", "lbruTxIEp9eeJw5EfS62", "sB8Y9rCdis5SRwMsrc6g", "liI2cOHHqNIgXOFeFRHx", "HMNiGha7Kel3N44xSLDG", "gVwDtBp8a73rTPXi67pO", "kbQ5fU25nFLTiFfZPUfz", "Zjp16MjASWXC7xHkPHnC", "V6dDMIljlQiK7XLDs2OK", "ZvUeqlPF0APVH2hdJSM2", "s2MyYgBQgXiFQCuGvHVt", "RsPiv4JEWdGMeaIAEUYv", "zGAQQ2gLJAEj2bPvfh99", "INUwwm6AEe5EsEeIGIbY", "SoFTNeO1JW8ctcWnNdyZ", "F1l6FNOUgy06mFX7ru8B", "QHlHrH5Cs1m62VCGtYiX", "WibGv9Ok3WtRleidulpm", "mZsp523yblT5R4MMBi4E", "CyfyaMZU7OFuy5h18kxj", "VQmuU8EeoIszGWvpsUJz", "qWrmcYnkGkRjADddKrH8", "A75Ob0DTUVRL1G7dptL5", "dmpm0QNKIcQQhWoJU0kz", "TBIUQN6FGRIsE5eCUzUm", "bsCIOybtwMqPV8svTw8k", "NPcZSEjwBDgm6q2SpcJl", "w99PF1JjxRRIo1qFDZ9O", "lqArgAHTmbDiiM6yLPfG", "o6Wd5MqIwzghpoWUynvl", "O8R7SX3lwi1lmWMrsC7m", "9nTxbxRZlKI7TiCtDFfA", "vetfADW1NdnWOHTzCsXx", "Dp5eVFXjVArOnk4vvawI", "CkoYzGYB859JsCxORV7u", "fyJQgNMZvIr52de1rCB0", "FKJ5UHTtkYmNU5o8QAhL", "SWPT83SzDdxQvFVNUxHC", "T1Zw6L2UVinwECNKDpIQ", "TFqMSKkwHz8i0ge61hYV", "PLPbYmulbCA2RyPuI7oX", "6vE6bsAcXi5u3UUZGOJq", "aRqzPDtgKgBQbPWCGeml", "MsgOK8vbWCP6dF53Txhn", "bsECIiMYN8Jhyx3J5zsZ", "9HfnWjozeVlFNxPdfl90", "rRgoOj7Sgx1qEfbkMNiy", "sTBDQap3Jy2APgymP3E4", "0DsCsRvCodAe4LrSteTC", "dVL0BHkZLwbJARW0sRBg", "2LK6f9WYozjPT4PcL89e", "4kyCBSD1rOhthzxM7Ttv", "SaIvefYxnhcsQY4Z0Fbr", "bGiJGfdN8UGa4YUiB0ez", "fGp5mrfk7EbiUHziwd54", "7JcCp6s14UykinpUeSEj", "enS94Pr02v28CfI2j81o", "dzYLmLoOm28QqYZuxPty", "Kv6WaMWIUX65WePGxDfj", "Fl83JhwE4pCMiGtHcNZ5", "vf8PHXgEkJwy24zLjvXo", "ikARy1ibPFeIumhBILN2", "cJyeNyx7rVtaD31B3hkS", "wMko9PxPlKPLeO0zKv6B", "Oxlb1kl2PTUJqC7xZ4MK", "Ple17e0RX5bw2KV35E3S", "iXmWhtRHylZLUDMcpM1N", "RaHUvkVyzZQf4C9k6a12", "JaNnmjNb5NwVxDxsyQqv", "xHa2TjmXHlZaJwL5djfj", "6bC1n9ujXieVxCXPtHwA", "2UiJQ3N4m2lqbvsO4k7b", "Sl4OvbnoqjyqDeAciXeS", "ZPH8K7XMrevHO0fJZQ8Q", "84ELjOvPtZpSw6bED6Y4", "iUK4SxMzOSNWWcpD0lau", "IQKFWtRkx0mgS4ks24rQ", "WFw1rjEpUphlF2yjtPTr", "NEVpIDhKIXiomcpbM2Qo", "p6X28VlztDoGRJ6hXl0n", "Iib4LPdfP2TE81GEUzDN", "C0ebJiHoTHbmzBoIaSvx", "UNBcMPoqO1EZzq8JYP5z", "gfleqYuO0qLSDU2ZtqPF", "pbopPx6xK9x1ogdeEX0C", "NLcapc9gQXwG6k3Wf7Ty", "GOx53ahF7iST123rfBX5", "iTJmCKIpRkni8il9ISPO", "8prAru1U3WYjyrW8Covb", "YhHfP2oiTB6b0vjqpiKr", "FsaBi6JsvETRvl6Jlt1C", "45m30VtnEBeR2FakJtcC", "55ezoiIYZHkcMWfK0W7E", "hmdjzDRI43V7776tpMRP", "dCzzgeHg8PsnBTV8gwQi", "yvq52wwqHODuYCsEo9tw", "YjjhDEpr9Ea77QA8K6yb", "S9W0JMD7V612pij0vXs4", "jSBqqJyAPuks1EqKa3R3", "9Q5x9nx4Ip81FHr5YoEx", "gyniCe2kfSnnsrkzef3w", "T9xiOmmwY0sFwdx6Fzov", "PbiGSQF45H0YOvHng1hE", "1ZTvBQzQOnLnO13pRHtX", "Yu3wnKhTJPiKwBD7aCYy", "zrjOtlBI24nYwrUk9ADT", "ZtlV5zdf99b9yKVp5g87", "ktffk8PsIaJpU4KZ1vCB", "2nK15nqBTwGBquqY2DQI", "oj7ImPpnJzyJmGKp390U", "5Fev9UU9gsPUcUmMtZ9A", "Y6UIKm7Ov6q1JUuQxMXd", "Fw5pQpBHOKQuOuAjgH5a", "LvZcOT2JqZu3Tzsto19A", "JZ2iRCR5RWfnPEPlgQ4W", "zyZTvPKhQTpj0rRR3qVV", "KAGkNdV33YZ3W6UQTo7t", "GvaEm0goqBJBJXtgAMjC", "uGFPKhpnVuejpFycDcO3", "nfC4C5jKSSWMhjjzQYnw", "RPdGcbqpDEryt3337kOX", "Currcbr29cwY1apcBfRN", "sILlKMpR6BwH3n6fOxiW", "Xe4XCt9MXYjPp287PvYT", "4Si8FplekR8I6CnG4wcZ", "SLwHO2OlyuC0Mv8aisEQ", "JKiNWTeYNG7qa15w4Sf2", "Mr2hk9HQ1TrKnXiH1KoO", "avE8vI2zkhz4XzjH8yi7", "RZQC66S5QGUy9g74y93g", "p2lM2Sb8RJEqqe3vkT08", "jS6q9Bv5Jwm8xVUxx53O", "NHFBvG4dj5lQVqGe19iK", "6SQ1vuyqy1DJHSSCgXoN", "aXn5N1iNBQhFq8Gl0Cbw", "DoFUEgfsDRFny0qK2YhB", "wMQmUgVTq5P3rdW4J9wW", "aAHWA7oAgVLaslLKPqnF", "tBHlolp5sjbQtqw2xjAb", "EWC4FXPdLAqDL5y7olCg", "Sl6Kb1KXkU8wyI1CnOp7", "WdKqjIxX18CTrIlRJ5y1", "a4yYLxk8LXFpBXfsnbNo", "jZGYs1z97xBf07BL4wRN", "RhCaCsS0Roo8N2gD2gL9", "bWmbbxuftM0J3CtD2KDT", "82bT2Gh4u2BVWx57vzkm", "Li5MszavHnMPnwsqCXs6", "Z4Z31e8weqjzYmKRjuK0", "heNTaEJkl9oJDOMF0T9e", "JqcqdwFKoXLTBgwmuDUg", "NJzahJnhkxK2lusOo5hc", "c23niyXdB2HWLE50XsfI", "nxKZrAvfDcFpcHaJF8uQ", "ABvTP0Ruq6Ac4U9tc2Xp", "dkeF1DWGLQfTZauwYLrM", "P1yRU7L6AsunaW0cjXq2", "vVVV3PPZiGw8GuZk0so8", "kivJDtvwQjzKDSnEsCoY", "RighaEPa6Dipub87V11t", "kyBvRyAHBwpceUJEigno", "tVdl5lqYmsRVqdQHZYWk", "UMK8qbLYH8K9dyughlEU", "bexRFLhouDXOXrVLTqti", "yErZAmGrVSJ66GVLaA8U", "MfqtWLFxB6g7IXfSJvKm", "LbsSsMlQWtusYkk34x0D", "1gJKEykVr2ICe8cUUOuz", "FopoWXrYUpmUW5oi3WDu", "ZT4Dahh23ZzINp4rKtQn", "jAHDF3vGZ688YCJ8ry8u", "X8BuxFkF7A2qIJ3XMwlu", "2t2Y3MgvKpnsvyksCS5J", "a89sPANm48g4zgd10HuJ", "4h9zgtpqKv9u3GnSOACS", "HqWGV7FVP9oTrxRVpGL9", "BU3Ciod6znYEc2U78kcX", "tPyiKPB7eWGnyI0g4bk3", "OIH0Jk7RSiwJ5u2PIBVu", "glhe1hJ6G37fKNdb5j2X", "RyqUqqr62M0g6iI5NbBe", "dHHveuWjdYG2U4UItMPt", "gPZm5rsRR132IIxwCRdo", "xroRuHjnd6eHUD4X2uyR", "tzTCHO6SpkEkZ0BTHtGs", "xsAR5Cz64vXxv19ANEaD", "woxVp7z4yDxv65L9HIFL", "DlG6mOF9cpKYcG3PL0TH", "EQAITVRklf3xQK3AiGHI", "4cqgqr59sYQ4xaMQ4n9p", "QAmqSo084IQ8sEmi6rrw", "OH0JpMht7ohYzTMPHNYK", "fwQVBDDH22BOHBh6VNya", "Bf686TYMq6gT06yBH9QK", "BbiQkOUFlSqu5u3CNZYB", "dCcdGapYhFqspWGZulnd", "DbYHVZTt8z4lBhORFBxx", "RnnEK2nCnYoy9MFfvgY1", "famoF8GTKBOjz9xHBiRy", "HFxQZA5UrbTUAFHNOXqi", "gCRfMMuX4MULZRk9ZnbO", "N5tXKAsgfhMLtnzF7rlC", "BFVleDsD1TcOYTvrdlVG", "SsZMdYZlOKxZZQIDeAPf", "e11AUuz5fVJ8LsUyP3jn", "MeKv5d7hnWKPVLYxFX0u", "0J2J9UIYWzJseelhFqM2", "KgQp1ykETk8S39lDb1j5", "11xdfhIsXesqIIdHGOVi", "8bAAitLKv4Nw5JXi0nYV", "RRLhjzyyLTgT4oblhw3c", "zQW2j1jjoHDDiYuQVsMq", "J0IMot7ToA4naapKcY1O", "oEcWlWuEPG3iGL42C9W0", "Jans8bCi7B7vOjQ7FKLc", "ZOJphLquVMumuie2HqjO", "0qKOXiVm0oNZDgNs1DmU", "XhHRNvRckA0kyI6V0bG1", "NdaaJvRI8Dnds22DxUph", "cqPZ8V494K8Svi0CeRVk", "dGOVGOjDsYtTOG2Vk4co", "NkEIQDV2eynHC9lSXUdO", "0WpNnpsXtUJGEWXcj2fN", "ySdAZMc4qFSqkFDV430y", "XJCjpjMYj1uhRVryrT2f", "hTTRifwniwlEDvv1fHXO", "GP6fsxbhPeM45oTnTNY9", "HHNUDJTsY1EnOKQHG2yd", "gJfj78WaV3hkK5EXMgNs", "fcf3u6K86JjkaMThUxFx", "0whLzuqLYEEDorGgxbn3", "sUnSrE7JCMHCGwXGoMZM", "anZMfo0aNncFINf7ckQo", "4f0KcWaOsAjQvGkY4k9R", "Yleo8Jvk1LW51VQb1yxr", "6gF2xza1jhRFQ53ZNwHO", "ImUHHsqGql7vSKxNJVM0", "BnGbrH8EEOaUA4jRwXhl", "Imgi6b3N4QNFBbp2txE5", "LpZVrGumnbX3LBmRmnmo", "BA4NjrNcoaf8NEdESY0F", "7VJTg3sSodF0lHLU8g5w", "Gk4bxgqPCqfHMwi0xZRj", "Cgjxx2R5jUzxF2ZAgNZs", "BC7V6qW1PxlZdSWYVvdC", "Qa9dcgnI3K8FXGkd4GfR", "BO0mqWKLPxXnYfQ8LBRN", "WXc1lKepZHGkfEVUipp8", "nLvJ0KRJTqgzOG07Zdv8", "s9qYOL26BpEw88D8ScQv", "T6tpLrwuUp0NzotNAtTJ", "ggDpoQvE2L9TQ0IlsDdM", "2dh1RaMZRqq8U3xIRsWU", "EdxeeENWPyqPZWR06lYY", "bOg3QbLrTpLhRHJ5TeZq", "cNFBteAyQiWz4A3UlMKE", "CdudsBgLqDBQaPaS3kQT", "QuRS4UvnqFz0srbl3H4r", "SEF3dpVgZt8xnZQr1Lcr", "YbqQRR9UhEJ9QWA3Mdht", "WnrJMF8NYkD6K1UlSeD7", "qUHG0PJM3yEXm5r8IxUq", "ifu0gOl82yEsST8QsPnt", "O1RA4IGMFkAvP4v3SeAT", "aOL2rSTjrEdFD2PHIgbV", "OjRmnKpDzzgZN0aCS1uJ", "DVZQXwfpaGKzxjji4Yv1", "YaatY8407yJKTqk0lPnJ", "d7Iar1GtYCu4kSvIZzGg", "xX1QOjO79BQkHhJ6gZzE", "jrGRHCjoBxV7VUVrDuyK", "3M3K3MQitNwdCB4SNmGW", "jjdED95P11j4OmNP6l70", "92bJDflaP247jiLxpPMq", "O3smoFAuzHs8JTPU7B2W", "B7bunxpcKBQiDGT1UdtT", "skZADyeI7hnGmO9ZJy9d", "8XKLnnKFODiGxFQ9C3RJ", "kCaUbh3ufAWlhq6SdOiz", "cOFXceeoh67PGftrMum0", "4Gll6qBhEtgoGtMsXygE", "2ldJRWAlQulSAVDELNvZ", "EbMUVgK0eyFhkq09L8uj", "3eCB9NQSkJzztLRO1mMg", "kbNSQLblTUSU6eeF22fk", "LejE09a1vxhdW26wNhfp", "98HFkvUkx7VJmCVmL6nE", "3TsXVySrd5enBv2wrVgo", "c95OKbAdfwsgNkDqgfhJ", "jL4uF7q6cVsCcwbwVjaA", "dQq0A3rohW7QqCI5H99r", "cz3Cvc9QKhav7QuFSj39", "F8X3Ip6XwFOWDQj80qZK", "V7EcW8pyrq54ya6FNCmK", "Q9odZXlZNIssO6SuCFq3", "5t52TBFqM18mAxPjU8Hq", "P9glD7fPKTQQMVQnffd1", "emnnhAU9GlzfseQ5j3U3", "UuTqOrb3UF49zpwgzQnF", "Cnt2PH88JcBnVdcrUDuz", "Qw6Pl23iQrvacod16l9N", "LIAovmfOyXLOTRmCRpur", "eqQEe3FimM55fEsYyXww", "3FJWg5j5sbvXRLl4Mzk6", "JqBw21V0XPvafE6JJnPB", "PKgofQqzPb5iPEfRG8Pn", "XKNAYRUpDtzaDfOq5FpS", "ou9D8ocMu19RMUasw4i7", "xhhAK30OGpo4hxHnjtAd", "tJ3Fmd5ihnpcSUmlXk7o", "XvsCt8zaz9EsRF7DqBtX", "yg9PAt8fbFT88KKzSHaR", "RmIq1P1pasMXYTugK0Lv", "Dn1L7JLXatwzfEpecqTA", "infEEXsWXCRkzQ44jNbJ", "GVJtk6XMxyWdjCqvjiRF", "uszrI1tzOUGc0ZVie04Z", "wYCfk0aShzhZreR7gK42", "nLflsATWBV573GloGJEx", "JvX8ZwEDGIG1dvmW3D2E", "i6KmM3YcMkYff5oC10OF", "IcFuX1QYDQltW5fq8BTS", "v18Y4uj3u7GAjV4EVSmi", "tVbNaFEgOf7KeDqi7Zjz", "ez7LVCZ0eKgVpHrOW52v", "i9DMM12RZjODiWZBi69K", "OpqC7hYbkaUQihk4hkUG", "TsT9M0L25UNRKBdPq90a", "kVyQAiSrSw7tnZ27XLAa", "oV26gdVWnT4Vy2v7iLy8", "I413b1A6LIf9nfFTIix3", "B1W81PFhlBp1Do4oqCtB", "VYIIBXkRDhVOhzWiPlQ8", "vD782BvqLozoKH7Vmrwz", "WPNDNswkbKsWVzfV8YLR", "KKGebN7LC1KiPgumWoW7", "6McbJF7RnSq7l6jKRogb", "pyICeCyA0SG6osh77mWs", "FLxyRgIrSySFxkSZwOiw", "ry0doijtSDlhYid0Mwpo", "sH3n2VLwu3rj1rMnX5g0", "JPfr5JpRDeD5uErwiCqc", "FhJEZf16jf602mp75dWI", "HhL9vC3dMuDbbWnAAmFt", "PLrR5gY8J2QZjkifumGH", "gUqFycO8OdzowqF2XmAo", "mZNWH49BoNQSrFhqr5wF", "gw1dkFfFzn4lKPFbTMnH", "kBjZQPNFUKTBEUmyhPEg", "CGSXff672tOk36JRVfhz", "zA8Bcs7KHLySZQxF43M4", "vioyo5NJk4HhCNspG07X", "J5xrUu6WyQar6OnvRACA", "FRrPpiC3gJYzNWqpQuLM", "IvBPHyIi9UqMuijjOwm4", "DK1aoqPFiiZ1djOuhgbo", "8R827sjToTXzoZacPxp5", "gN6H6SAl8laFAgFGYxjK", "QFKCosnBnaGRxLj1ntlu", "cJ7kzMyYHiqix8sjyfsk", "G6BBRuBFlw7NFE6CY4iq", "mZWhfMOe2GOGNXPmQY1B", "S6XfIdsrhafS799nVWPV", "mlj7I9uifts80PnG2f7j", "EkBLrJ8NnXqXGafZhXFM", "Q7SOWEfWrkG5TPRKgXfT", "3W1J4eqlB45ZBWygkbCZ", "JQfmo47UbkwcGvwIXk3i", "o7H0bDeJmqs6FVs3ZxV9", "iRlwKfFrQGXENnCwyqFl", "f8pubhx9dSILs1FAhU05", "lXJ6KW3JMG21MrtyWq77", "HNQ7MgH1AH6tnQy5uzME", "FOEcD7YiwdpD0GIKuXM4", "nQwaqufit0x6OBiaGGIC", "r5NrLfAFDUI0uCYj4BRv", "BM1YVi8mwOyoTMdnzn0C", "HIAASgtWsKR3fRZA9fw5", "3vtVFVIEIIPYZZi1GbW6", "tx7YOhhVMdbOWStlx9yE", "PNmyuSy81UEsPMPm16HL", "jqjEHaxEjvQ9IA5Bc3Jb", "XYUvsthtzwCgnwu4WsGE", "nfN4pSDQUW1z2VuuOblL", "Wy2JswLMmZaYExa2OnSs", "JRrKxkEJJyfpuf8mZR8M", "1jsDeSD0DdqW5gq0Q3Jj", "zwZtZfd97lT6SLH5lV5y", "8uSBaJByKThJNEAxun4z", "WX3zsK2bn5Zuz15XIFVc", "iDt3P10Jo4IJZLGPeI0R", "NZJLbPsteMUKZLNyNMG9", "OWQyqgNUyOtKvBdWaVOC", "pqUMBrLWBZea54WtltLh", "FFzBQcfy638vtcI3RbZd", "ABBDGh5zYQgmdgx3GazM", "c7GVhYW976kFHvSVaXU6", "yBsbpnd5OaQ0ggTNC0UJ", "4EYJ7ypfWHmSQc1FQcJm", "BhmrNDCXDfqFtOZzMMcq", "bOG21GFPqWB1DvqY815K", "gtZXH6WcQ9Q2Vh4UvJtl", "o4l1zZY6adQGVxmm4IMS", "PnUtUWNNqH8cJrdHRBLz", "nlEGg02kGPDeCfXeCu10", "97cRzFgOP1NAkZQQZQ9q", "nKSxzzbBrcBzinOh143O", "3OWlyu9XKIL6cn3akfjc", "FtZxgxcfzd122Xl0PuVi", "BrolcrLNU5zkyWfcTGGS", "rHStnDrA7NsIEg4oWNB0", "Q8iOeMz7aDXRSzJDAAOI", "XGYjvaYPwhNMo6jSQiYy", "t3PL3iZDrxTOB084YeTU", "Lpr9taaJG6H99eSCL1OC", "wrY6pe8OIascPjjIHJZV", "NqcXS5jl65v1vU7k6F6P", "nzzCgiUw03RNr4uI9c3D", "fxEaPJJVXPsKMrX3YzxY", "3OtsQmAZMCl17xaWHt1m", "Gu4djbeHZbnaxhSORbvn", "lgmseMOtDNfUHj51JjGq", "I4QFjqdAPZvADf0r0MiD", "kLfz5iyMPFChJax2QYAq", "53yJizAiLru3CX3FG1bf", "ElLVJIXkqfYwiWDPTL7n", "CzqPXrelrEO5xjbH16zq", "kVkQzvpTGvETs2qPuU8j", "gXmeELtEQq2ALmYIhOlv", "HxO90EXshdbNALzNhqb7", "edFzNnI291xOxMYxY3pF", "gObpjYCOPnT1Qi1lUHnd", "Gk0D4Y8dZxqDJP21yCPL", "xtMLbL63atfpef2iBBJk", "68xOXyPTAom6h7RHSYK1", "Pxq1cqinz1V67RUfPt6X", "ftdLy3cOZuPysD0S4iE3", "hj7p8ZSXSY36PeRLh3kG", "v7DlLDCNtQQa7WPG5plW", "MoclT3584pPxwahHntce", "J3EOZcecRO8lCkXdlamn", "P9lJjSZULB8cEKylubMK", "zU5BDanyAZmZgVtNxSpG", "dvqqFoZ8PvSMOXYb8JXI", "sHqWmhth7ivibjWqY6yv", "zOILwow47SKxh8RSpK7w", "03dZm9PIDMCBkSWeERgJ", "t1GY7h0xz8rx9UWvctCp", "DM0woXa0yHJpGXNNCMI9", "UA6dcaWERg4d22ZoZ7oV", "M5Iaceyo0ExSM15zZZBz", "GDcGG93nGpJdvZDXD9KB", "OHdiHghqGrpU4PkKYn6p", "bNQWwb18jLJ5bxnqdTgr", "KULOt6hQrnDSAbw4CyCv", "HWyqRmg4FLuZpFvgJa49", "NHZVsWa3SkwjGvahhEku", "ZeRMrM19v5IGLrmBLKEn", "4BXJ45ylHidrK4BAOCJJ", "GbYZQKkmczZe84xC7wvP", "cYEvaP5yaOGoxoNN679g", "4hKClGMrAHGmnUhNrkKR", "8YF3KcROkY4mDMzzaLqk", "b4VOYCkPx2p3Y47sfWGN", "2I9Gc6DDS1x15SNbd5yY", "7nZfqeVVAjsDz1Tc8epY", "fkXkDuLo0JM55tjvYEQi", "wGtvFKXLyKrd5OLGHg4H", "yOK3H3wpGKWCaP7pkf9g", "z0K2PfIgKKvGiFHyHDlX", "XHj7hquPT13R2NTP1k3J", "4wZl9qhQ1SxYkedPTVmw", "XpLZBpwCXzTZv2K4q1Vr", "SQPC50ZYVLS28oZJbVT8", "SwhNw0QmztbRJybMyAsS", "TJSc72tgVNmyHRJEPhyP", "aYqsWQCTa5v2ONcTNV7r", "qtp8I6KioG7MovEJLRmu", "Wfus2WJO1OFsH2yX8GFu", "WKHJGVaZwMRQ1LG1rXPr", "vchAefinvxfPIwgWQG3K", "aVjZoxbgVyVObCZFrF0k", "Ae7Qaowy2yJdT0CHxlvQ", "iQpHcMURbT9l7FCf16e3", "4veVvrlqagHG56XfQ051", "TCkaRuFSzrU1k8XdxIUW", "wjm1nIfDIkClwwJMpWmm", "OGn6NKkIaCoVvbUir9v9", "r7so1BAohua3BOAWgsoF", "4dkzCCh1MaADf2zeB7Ts", "21uBN4h4wTH04zxGBcHV", "CPjpPgTaowRowLzJPeLJ", "7cHCZEQlogG03xnTcG1Q", "BSE7nBQApmRwMi6wuVhg", "BveErRfTihrr95yvEM33", "8VxTB4P4Z4kixPuooaFW", "H6LO9JHNgLQmoMFxOczx", "gide5XQt7gOMkjju30Fh", "JeR50f3OH0JyiwcnR0hZ", "g5tRocJpdWUuAw08Z1Uq", "1nokhOX7PEg3HXS4Altl", "GMfQGdXpe1fenSOSqtZD", "6FHNnhRvRJghfL5txcib", "eNFRpbteVRpbe4wPmOKD", "f0uIKzBHctqEE4d2fUeA", "vTjaYgzK2KVhIPxaM8rw", "zg8DklFPGrY9LFjtvhBx", "1ecH3ZsNfhKeNSq7C3VQ", "v1ZGGH7CyG7xuiEvF6It", "oaX91LHBNkbIlAW1RbBN", "pHKhzZcCds5PRbZQwobJ", "WAZHK3GkcS5RjQ8ixiua", "by00ZXQVJ1npBK4TMKBy", "mHOVfUBcD4Cm2AmZfA4y", "9plI8pjUAvQuAmOnHZPS", "bZCbiwAN4DKD05V8vEa3", "71xFnL22tPSSzc4hWC2a", "NMnOQGWLV7Ma6JqrdqsW", "GIyDv0sRBu2YFnuf4RyX", "WK7abvREkHiyafBVd1uo", "tuL8iFlkejF83MidGAr0", "RYyzD7Uo6NdzHw6xBrho", "bwwcHfFVn5TCbPCoWeca", "1DZJ7fEHXw56q1g5ewaP", "z3caQmMwOwWQA4hHhvYC", "pbIgbzjFtIdsJDQkzmeN", "g9loDS6uMc7BCNpnKZ0D", "rd38qTsnDX9seugrLkjh", "LoqXAgKUFIi4wjCkD3YO", "YfGCXv3sfkX0ZOXj2pBH", "8tJ2dTmoWKA4xPEVKFLx", "0ryXFTEFJPWPHnRuGDgl", "WqnTD2yXHIVF9RmMuybB", "O5afs1X6DDpj1bAFb7kq", "PD6YeqsXpTiDYJqOINSV", "aGEbrPoSUZItmMPPDHw2", "keDGv3cEQ4jyIwZ9JOZn", "vqefA34NK0N2daGYbsk1", "uUzDOXKhtsSmi6Rs9WER", "UbR5AhclXMlRoicCDxr4", "pJqVPILWmZvE9MKJ1w2Y", "Gn05WcFhX7mKOcpmsBGe", "iCrrWB8W5B4Jw2OQdc8A", "huT3WIpPR418Esxk16E6", "FJQBJmawMi53cY56ouTG", "wVOALLtNP7RcQpokaMew", "4hyeF3k4vCIsfe20xtLL", "1lxRaj985m39Tznh0Wjt", "i1lNdmLYdhteSr40YB7e", "xAlP7X673p0jok4PUPx7", "4rmUgqVE1asxkeKpBQwC", "DwtzexO8MLERAyvqmO5l", "yvigX2VgQPsdKlaygy53", "KJSUFNJ1kOmiHVNpVqVu", "GMXa58Ym4bpMsFp7c88K", "Uv1lOOarC6lSQH2VNZHR", "84o1Jd6ujFED8DyUbXJo", "b5E1MFWhom8wquv8V20E", "FCPLQOnzt6nUB0VVFzC1", "lJvaBrghrgt6sJPIfCIY", "I30S3VxGSAHERDmc4SHv", "8Bz0SMH5YZboabGc4EsW", "MAknNUNPwfI4qF3GbKL7", "ruvRVC1ZOu3k2mVPGqoD", "V4HJJKXucs1TmwtF6uoU", "mqCocfBsWx5z1NJKfqEI", "hDjR8ahETTjFJt2vZDo3", "Bt2CEJXsAjApvrG3SvHv", "PyAgsAaPOMQXDSjSmEIu", "wSjrHxujtBeG8nuyvUNJ", "qnq4DYUxmmrgCYXTWRDN", "bpbjaVfW02nqnesyAMwu", "6lbIK8moYxB9kmqLHVpF", "Vc4GEwEOH8JNuugE0Q2Y", "LBf5xTQCwFSPqWf4QsTh", "yk3sch4c749SFmVAEuNA", "7naxHD2h3TN2DQsp5xPC", "1YcFJ7PX1kf9VF4mR6SS", "XpSkDLXIIxSHT2Wm7uH7", "exE8AIubPM2u9UfKpCa5", "70Lb2rLAjdFMaTUklOK8", "jM3qqg9gsjjyi4Zkuusd", "V7z5aRqKo8SXUTLI9Sw2", "Ag0skXcePTGvaDy9fmTT", "utyONHfWkbWuHUm01McP", "psKO4GXj3yCxp8KCPzh9", "aD3sinqhAS4xJMLNdq6g", "mGdcOvmnuTvThwJNk92s", "b7puT9H6zLmmbOMzJ8lC"]');
# Connection con0:
start transaction;
select * from t1;
select @var_0 := j from t1;
# Doing small partial update 
# Connection default:
select json_extract(j, '$[3276]') from t1 where pkey = 1;
json_extract(j, '$[3276]')
"b7puT9H6zLmmbOMzJ8lC"
start transaction;
update t1 set j = json_set(j, '$[3276]',"cefHaycI7eAgjybD7qH4") where pkey = 1;
select json_extract(j, '$[3276]') from t1 where pkey = 1;
json_extract(j, '$[3276]')
"cefHaycI7eAgjybD7qH4"
commit;
# Connection con1:
start transaction;
select * from t1;
select @var_1 := j from t1;
# Doing small partial update 
# Connection default:
select json_extract(j, '$[3276]') from t1 where pkey = 1;
json_extract(j, '$[3276]')
"cefHaycI7eAgjybD7qH4"
start transaction;
update t1 set j = json_set(j, '$[3276]',"C4olQAjhHUtt8W8gUkzZ") where pkey = 1;
select json_extract(j, '$[3276]') from t1 where pkey = 1;
json_extract(j, '$[3276]')
"C4olQAjhHUtt8W8gUkzZ"
commit;
# Connection con2:
start transaction;
select * from t1;
select @var_2 := j from t1;
# Doing small partial update 
# Connection default:
select json_extract(j, '$[3276]') from t1 where pkey = 1;
json_extract(j, '$[3276]')
"C4olQAjhHUtt8W8gUkzZ"
start transaction;
update t1 set j = json_set(j, '$[3276]',"M7G65pJCfaFpc3b0CKiT") where pkey = 1;
select json_extract(j, '$[3276]') from t1 where pkey = 1;
json_extract(j, '$[3276]')
"M7G65pJCfaFpc3b0CKiT"
commit;
# Connection con3:
start transaction;
select * from t1;
select @var_3 := j from t1;
# Doing small partial update 
# Connection default:
select json_extract(j, '$[3276]') from t1 where pkey = 1;
json_extract(j, '$[3276]')
"M7G65pJCfaFpc3b0CKiT"
start transaction;
update t1 set j = json_set(j, '$[3276]',"mZKs6SYYAX8WfMciBvto") where pkey = 1;
select json_extract(j, '$[3276]') from t1 where pkey = 1;
json_extract(j, '$[3276]')
"mZKs6SYYAX8WfMciBvto"
commit;
# Connection con4:
start transaction;
select * from t1;
select @var_4 := j from t1;
# Doing small partial update 
# Connection default:
select json_extract(j, '$[3276]') from t1 where pkey = 1;
json_extract(j, '$[3276]')
"mZKs6SYYAX8WfMciBvto"
start transaction;
update t1 set j = json_set(j, '$[3276]',"U8e4BD5NVnoHM89Qafzi") where pkey = 1;
select json_extract(j, '$[3276]') from t1 where pkey = 1;
json_extract(j, '$[3276]')
"U8e4BD5NVnoHM89Qafzi"
commit;
# Connection con5:
start transaction;
select * from t1;
select @var_5 := j from t1;
# Doing small partial update 
# Connection default:
select json_extract(j, '$[3276]') from t1 where pkey = 1;
json_extract(j, '$[3276]')
"U8e4BD5NVnoHM89Qafzi"
start transaction;
update t1 set j = json_set(j, '$[3276]',"B7FoTrWclPQDX2HhDM2i") where pkey = 1;
select json_extract(j, '$[3276]') from t1 where pkey = 1;
json_extract(j, '$[3276]')
"B7FoTrWclPQDX2HhDM2i"
commit;
# Connection con6:
start transaction;
select * from t1;
select @var_6 := j from t1;
# Doing small partial update 
# Connection default:
select json_extract(j, '$[3276]') from t1 where pkey = 1;
json_extract(j, '$[3276]')
"B7FoTrWclPQDX2HhDM2i"
start transaction;
update t1 set j = json_set(j, '$[3276]',"7rxSz6qYkpGvuTjLLFx4") where pkey = 1;
select json_extract(j, '$[3276]') from t1 where pkey = 1;
json_extract(j, '$[3276]')
"7rxSz6qYkpGvuTjLLFx4"
commit;
# Connection con7:
start transaction;
select * from t1;
select @var_7 := j from t1;
# Doing small partial update 
# Connection default:
select json_extract(j, '$[3276]') from t1 where pkey = 1;
json_extract(j, '$[3276]')
"7rxSz6qYkpGvuTjLLFx4"
start transaction;
update t1 set j = json_set(j, '$[3276]',"dMH8MWparqIwfGMcKDA4") where pkey = 1;
select json_extract(j, '$[3276]') from t1 where pkey = 1;
json_extract(j, '$[3276]')
"dMH8MWparqIwfGMcKDA4"
commit;
# Connection con8:
start transaction;
select * from t1;
select @var_8 := j from t1;
# Doing small partial update 
# Connection default:
select json_extract(j, '$[3276]') from t1 where pkey = 1;
json_extract(j, '$[3276]')
"dMH8MWparqIwfGMcKDA4"
start transaction;
update t1 set j = json_set(j, '$[3276]',"2PxxqgG9wEDXYSfuxTUo") where pkey = 1;
select json_extract(j, '$[3276]') from t1 where pkey = 1;
json_extract(j, '$[3276]')
"2PxxqgG9wEDXYSfuxTUo"
commit;
# Connection con9:
start transaction;
select * from t1;
select @var_9 := j from t1;
# Doing small partial update 
# Connection default:
select json_extract(j, '$[3276]') from t1 where pkey = 1;
json_extract(j, '$[3276]')
"2PxxqgG9wEDXYSfuxTUo"
start transaction;
update t1 set j = json_set(j, '$[3276]',"Jlky17YJKjMK6JFu0W4u") where pkey = 1;
select json_extract(j, '$[3276]') from t1 where pkey = 1;
json_extract(j, '$[3276]')
"Jlky17YJKjMK6JFu0W4u"
commit;
# Connection con10:
start transaction;
select * from t1;
select @var_10 := j from t1;
# Doing small partial update 
# Connection default:
select json_extract(j, '$[3276]') from t1 where pkey = 1;
json_extract(j, '$[3276]')
"Jlky17YJKjMK6JFu0W4u"
start transaction;
update t1 set j = json_set(j, '$[3276]',"iFRGi4AfXdRoO9kNEJgW") where pkey = 1;
select json_extract(j, '$[3276]') from t1 where pkey = 1;
json_extract(j, '$[3276]')
"iFRGi4AfXdRoO9kNEJgW"
commit;
# Connection con11:
start transaction;
select * from t1;
select @var_11 := j from t1;
# Doing small partial update 
# Connection default:
select json_extract(j, '$[3276]') from t1 where pkey = 1;
json_extract(j, '$[3276]')
"iFRGi4AfXdRoO9kNEJgW"
start transaction;
update t1 set j = json_set(j, '$[3276]',"02r4K4yKa2CGIbWyffbD") where pkey = 1;
select json_extract(j, '$[3276]') from t1 where pkey = 1;
json_extract(j, '$[3276]')
"02r4K4yKa2CGIbWyffbD"
commit;
# Connection con12:
start transaction;
select * from t1;
select @var_12 := j from t1;
# Doing small partial update 
# Connection default:
select json_extract(j, '$[3276]') from t1 where pkey = 1;
json_extract(j, '$[3276]')
"02r4K4yKa2CGIbWyffbD"
start transaction;
update t1 set j = json_set(j, '$[3276]',"I2zg9k3O3hu1ij52o3MM") where pkey = 1;
select json_extract(j, '$[3276]') from t1 where pkey = 1;
json_extract(j, '$[3276]')
"I2zg9k3O3hu1ij52o3MM"
commit;
# Connection con13:
start transaction;
select * from t1;
select @var_13 := j from t1;
# Doing small partial update 
# Connection default:
select json_extract(j, '$[3276]') from t1 where pkey = 1;
json_extract(j, '$[3276]')
"I2zg9k3O3hu1ij52o3MM"
start transaction;
update t1 set j = json_set(j, '$[3276]',"6WbM77Kmktx2vxi2hjQi") where pkey = 1;
select json_extract(j, '$[3276]') from t1 where pkey = 1;
json_extract(j, '$[3276]')
"6WbM77Kmktx2vxi2hjQi"
commit;
# Connection con14:
start transaction;
select * from t1;
select @var_14 := j from t1;
# Doing small partial update 
# Connection default:
select json_extract(j, '$[3276]') from t1 where pkey = 1;
json_extract(j, '$[3276]')
"6WbM77Kmktx2vxi2hjQi"
start transaction;
update t1 set j = json_set(j, '$[3276]',"RJj70m9opT9tzkD6pXsa") where pkey = 1;
select json_extract(j, '$[3276]') from t1 where pkey = 1;
json_extract(j, '$[3276]')
"RJj70m9opT9tzkD6pXsa"
commit;
# Connection con15:
start transaction;
select * from t1;
select @var_15 := j from t1;
# Doing small partial update 
# Connection default:
select json_extract(j, '$[3276]') from t1 where pkey = 1;
json_extract(j, '$[3276]')
"RJj70m9opT9tzkD6pXsa"
start transaction;
update t1 set j = json_set(j, '$[3276]',"QqaJlHMQ0k6P1nW2ZfoO") where pkey = 1;
select json_extract(j, '$[3276]') from t1 where pkey = 1;
json_extract(j, '$[3276]')
"QqaJlHMQ0k6P1nW2ZfoO"
commit;
# Connection con16:
start transaction;
select * from t1;
select @var_16 := j from t1;
# Doing small partial update 
# Connection default:
select json_extract(j, '$[3276]') from t1 where pkey = 1;
json_extract(j, '$[3276]')
"QqaJlHMQ0k6P1nW2ZfoO"
start transaction;
update t1 set j = json_set(j, '$[3276]',"6vG5fTBTz21Nqbhbs1zr") where pkey = 1;
select json_extract(j, '$[3276]') from t1 where pkey = 1;
json_extract(j, '$[3276]')
"6vG5fTBTz21Nqbhbs1zr"
commit;
# Connection con17:
start transaction;
select * from t1;
select @var_17 := j from t1;
# Doing small partial update 
# Connection default:
select json_extract(j, '$[3276]') from t1 where pkey = 1;
json_extract(j, '$[3276]')
"6vG5fTBTz21Nqbhbs1zr"
start transaction;
update t1 set j = json_set(j, '$[3276]',"j5ElsjlRMZnTV1Y8TiZS") where pkey = 1;
select json_extract(j, '$[3276]') from t1 where pkey = 1;
json_extract(j, '$[3276]')
"j5ElsjlRMZnTV1Y8TiZS"
commit;
# Connection con18:
start transaction;
select * from t1;
select @var_18 := j from t1;
# Doing small partial update 
# Connection default:
select json_extract(j, '$[3276]') from t1 where pkey = 1;
json_extract(j, '$[3276]')
"j5ElsjlRMZnTV1Y8TiZS"
start transaction;
update t1 set j = json_set(j, '$[3276]',"kapYAU72T6rD94w1nhQ9") where pkey = 1;
select json_extract(j, '$[3276]') from t1 where pkey = 1;
json_extract(j, '$[3276]')
"kapYAU72T6rD94w1nhQ9"
commit;
# Connection con19:
start transaction;
select * from t1;
select @var_19 := j from t1;
# Doing small partial update 
# Connection default:
select json_extract(j, '$[3276]') from t1 where pkey = 1;
json_extract(j, '$[3276]')
"kapYAU72T6rD94w1nhQ9"
start transaction;
update t1 set j = json_set(j, '$[3276]',"GBcjB9serR6Z0t5AOCAr") where pkey = 1;
select json_extract(j, '$[3276]') from t1 where pkey = 1;
json_extract(j, '$[3276]')
"GBcjB9serR6Z0t5AOCAr"
commit;
# Connection con20:
start transaction;
select * from t1;
select @var_20 := j from t1;
# Doing small partial update 
# Connection default:
select json_extract(j, '$[3276]') from t1 where pkey = 1;
json_extract(j, '$[3276]')
"GBcjB9serR6Z0t5AOCAr"
start transaction;
update t1 set j = json_set(j, '$[3276]',"G22P6yOrdm0uvbb6kTkZ") where pkey = 1;
select json_extract(j, '$[3276]') from t1 where pkey = 1;
json_extract(j, '$[3276]')
"G22P6yOrdm0uvbb6kTkZ"
commit;
# Connection con21:
start transaction;
select * from t1;
select @var_21 := j from t1;
# Doing small partial update 
# Connection default:
select json_extract(j, '$[3276]') from t1 where pkey = 1;
json_extract(j, '$[3276]')
"G22P6yOrdm0uvbb6kTkZ"
start transaction;
update t1 set j = json_set(j, '$[3276]',"to6tiB36LDvZDyyHuK8Y") where pkey = 1;
select json_extract(j, '$[3276]') from t1 where pkey = 1;
json_extract(j, '$[3276]')
"to6tiB36LDvZDyyHuK8Y"
commit;
# Connection con22:
start transaction;
select * from t1;
select @var_22 := j from t1;
# Doing small partial update 
# Connection default:
select json_extract(j, '$[3276]') from t1 where pkey = 1;
json_extract(j, '$[3276]')
"to6tiB36LDvZDyyHuK8Y"
start transaction;
update t1 set j = json_set(j, '$[3276]',"67Q1i16QToxMd3DLCGPV") where pkey = 1;
select json_extract(j, '$[3276]') from t1 where pkey = 1;
json_extract(j, '$[3276]')
"67Q1i16QToxMd3DLCGPV"
commit;
# Connection con23:
start transaction;
select * from t1;
select @var_23 := j from t1;
# Doing small partial update 
# Connection default:
select json_extract(j, '$[3276]') from t1 where pkey = 1;
json_extract(j, '$[3276]')
"67Q1i16QToxMd3DLCGPV"
start transaction;
update t1 set j = json_set(j, '$[3276]',"RK4dG0uBK1jO87Nq8TEZ") where pkey = 1;
select json_extract(j, '$[3276]') from t1 where pkey = 1;
json_extract(j, '$[3276]')
"RK4dG0uBK1jO87Nq8TEZ"
commit;
# Connection con24:
start transaction;
select * from t1;
select @var_24 := j from t1;
# Doing small partial update 
# Connection default:
select json_extract(j, '$[3276]') from t1 where pkey = 1;
json_extract(j, '$[3276]')
"RK4dG0uBK1jO87Nq8TEZ"
start transaction;
update t1 set j = json_set(j, '$[3276]',"IBvtC6CMMbrmttPAtJJD") where pkey = 1;
select json_extract(j, '$[3276]') from t1 where pkey = 1;
json_extract(j, '$[3276]')
"IBvtC6CMMbrmttPAtJJD"
commit;
# Connection con25:
start transaction;
select * from t1;
select @var_25 := j from t1;
# Doing small partial update 
# Connection default:
select json_extract(j, '$[3276]') from t1 where pkey = 1;
json_extract(j, '$[3276]')
"IBvtC6CMMbrmttPAtJJD"
start transaction;
update t1 set j = json_set(j, '$[3276]',"K0ZQ7wGDOSnebgXnnj97") where pkey = 1;
select json_extract(j, '$[3276]') from t1 where pkey = 1;
json_extract(j, '$[3276]')
"K0ZQ7wGDOSnebgXnnj97"
commit;
# Connection con26:
start transaction;
select * from t1;
select @var_26 := j from t1;
# Doing small partial update 
# Connection default:
select json_extract(j, '$[3276]') from t1 where pkey = 1;
json_extract(j, '$[3276]')
"K0ZQ7wGDOSnebgXnnj97"
start transaction;
update t1 set j = json_set(j, '$[3276]',"IytBrIJiactuaSLhNZtl") where pkey = 1;
select json_extract(j, '$[3276]') from t1 where pkey = 1;
json_extract(j, '$[3276]')
"IytBrIJiactuaSLhNZtl"
commit;
# Connection con27:
start transaction;
select * from t1;
select @var_27 := j from t1;
# Doing small partial update 
# Connection default:
select json_extract(j, '$[3276]') from t1 where pkey = 1;
json_extract(j, '$[3276]')
"IytBrIJiactuaSLhNZtl"
start transaction;
update t1 set j = json_set(j, '$[3276]',"0gPbKuN5dUDtT62INMzx") where pkey = 1;
select json_extract(j, '$[3276]') from t1 where pkey = 1;
json_extract(j, '$[3276]')
"0gPbKuN5dUDtT62INMzx"
commit;
# Connection con28:
start transaction;
select * from t1;
select @var_28 := j from t1;
# Doing small partial update 
# Connection default:
select json_extract(j, '$[3276]') from t1 where pkey = 1;
json_extract(j, '$[3276]')
"0gPbKuN5dUDtT62INMzx"
start transaction;
update t1 set j = json_set(j, '$[3276]',"wspXJ8Cgg5RgjoF2ic7L") where pkey = 1;
select json_extract(j, '$[3276]') from t1 where pkey = 1;
json_extract(j, '$[3276]')
"wspXJ8Cgg5RgjoF2ic7L"
commit;
# Connection con29:
start transaction;
select * from t1;
select @var_29 := j from t1;
# Doing small partial update 
# Connection default:
select json_extract(j, '$[3276]') from t1 where pkey = 1;
json_extract(j, '$[3276]')
"wspXJ8Cgg5RgjoF2ic7L"
start transaction;
update t1 set j = json_set(j, '$[3276]',"7KCYPEqmYphTgWyzdAdJ") where pkey = 1;
select json_extract(j, '$[3276]') from t1 where pkey = 1;
json_extract(j, '$[3276]')
"7KCYPEqmYphTgWyzdAdJ"
commit;
# Connection con30:
start transaction;
select * from t1;
select @var_30 := j from t1;
# Doing small partial update 
# Connection default:
select json_extract(j, '$[3276]') from t1 where pkey = 1;
json_extract(j, '$[3276]')
"7KCYPEqmYphTgWyzdAdJ"
start transaction;
update t1 set j = json_set(j, '$[3276]',"E4xvsCxYn5ruP3SoHGYq") where pkey = 1;
select json_extract(j, '$[3276]') from t1 where pkey = 1;
json_extract(j, '$[3276]')
"E4xvsCxYn5ruP3SoHGYq"
commit;
# Connection con31:
start transaction;
select * from t1;
select @var_31 := j from t1;
# Doing small partial update 
# Connection default:
select json_extract(j, '$[3276]') from t1 where pkey = 1;
json_extract(j, '$[3276]')
"E4xvsCxYn5ruP3SoHGYq"
start transaction;
update t1 set j = json_set(j, '$[3276]',"4FJkkFhNPKebMbXClUkY") where pkey = 1;
select json_extract(j, '$[3276]') from t1 where pkey = 1;
json_extract(j, '$[3276]')
"4FJkkFhNPKebMbXClUkY"
commit;
# Connection con32:
start transaction;
select * from t1;
select @var_32 := j from t1;
# Doing small partial update 
# Connection default:
select json_extract(j, '$[3276]') from t1 where pkey = 1;
json_extract(j, '$[3276]')
"4FJkkFhNPKebMbXClUkY"
start transaction;
update t1 set j = json_set(j, '$[3276]',"ZbQxcsjt7IhBXytHDYcb") where pkey = 1;
select json_extract(j, '$[3276]') from t1 where pkey = 1;
json_extract(j, '$[3276]')
"ZbQxcsjt7IhBXytHDYcb"
commit;
# Connection con33:
start transaction;
select * from t1;
select @var_33 := j from t1;
# Doing small partial update 
# Connection default:
select json_extract(j, '$[3276]') from t1 where pkey = 1;
json_extract(j, '$[3276]')
"ZbQxcsjt7IhBXytHDYcb"
start transaction;
update t1 set j = json_set(j, '$[3276]',"sGCCphMZC65jfWeHMO8T") where pkey = 1;
select json_extract(j, '$[3276]') from t1 where pkey = 1;
json_extract(j, '$[3276]')
"sGCCphMZC65jfWeHMO8T"
commit;
# Connection con34:
start transaction;
select * from t1;
select @var_34 := j from t1;
# Doing small partial update 
# Connection default:
select json_extract(j, '$[3276]') from t1 where pkey = 1;
json_extract(j, '$[3276]')
"sGCCphMZC65jfWeHMO8T"
start transaction;
update t1 set j = json_set(j, '$[3276]',"gocBkVRw31XtIh35PPeb") where pkey = 1;
select json_extract(j, '$[3276]') from t1 where pkey = 1;
json_extract(j, '$[3276]')
"gocBkVRw31XtIh35PPeb"
commit;
# Connection con35:
start transaction;
select * from t1;
select @var_35 := j from t1;
# Doing small partial update 
# Connection default:
select json_extract(j, '$[3276]') from t1 where pkey = 1;
json_extract(j, '$[3276]')
"gocBkVRw31XtIh35PPeb"
start transaction;
update t1 set j = json_set(j, '$[3276]',"VkI8ExNaLW2zKe828Xy9") where pkey = 1;
select json_extract(j, '$[3276]') from t1 where pkey = 1;
json_extract(j, '$[3276]')
"VkI8ExNaLW2zKe828Xy9"
commit;
# Connection con36:
start transaction;
select * from t1;
select @var_36 := j from t1;
# Doing small partial update 
# Connection default:
select json_extract(j, '$[3276]') from t1 where pkey = 1;
json_extract(j, '$[3276]')
"VkI8ExNaLW2zKe828Xy9"
start transaction;
update t1 set j = json_set(j, '$[3276]',"ZV1pD4uaUZ9xHR6VMT3f") where pkey = 1;
select json_extract(j, '$[3276]') from t1 where pkey = 1;
json_extract(j, '$[3276]')
"ZV1pD4uaUZ9xHR6VMT3f"
commit;
# Connection con37:
start transaction;
select * from t1;
select @var_37 := j from t1;
# Doing small partial update 
# Connection default:
select json_extract(j, '$[3276]') from t1 where pkey = 1;
json_extract(j, '$[3276]')
"ZV1pD4uaUZ9xHR6VMT3f"
start transaction;
update t1 set j = json_set(j, '$[3276]',"x3cFgjIoGGvnkwavzVVT") where pkey = 1;
select json_extract(j, '$[3276]') from t1 where pkey = 1;
json_extract(j, '$[3276]')
"x3cFgjIoGGvnkwavzVVT"
commit;
# Connection con38:
start transaction;
select * from t1;
select @var_38 := j from t1;
# Doing small partial update 
# Connection default:
select json_extract(j, '$[3276]') from t1 where pkey = 1;
json_extract(j, '$[3276]')
"x3cFgjIoGGvnkwavzVVT"
start transaction;
update t1 set j = json_set(j, '$[3276]',"2eOH3UmOwn3rrg7XPNJd") where pkey = 1;
select json_extract(j, '$[3276]') from t1 where pkey = 1;
json_extract(j, '$[3276]')
"2eOH3UmOwn3rrg7XPNJd"
commit;
# Connection con39:
start transaction;
select * from t1;
select @var_39 := j from t1;
# Doing small partial update 
# Connection default:
select json_extract(j, '$[3276]') from t1 where pkey = 1;
json_extract(j, '$[3276]')
"2eOH3UmOwn3rrg7XPNJd"
start transaction;
update t1 set j = json_set(j, '$[3276]',"dEPL9zG8UjZULxlNQVlM") where pkey = 1;
select json_extract(j, '$[3276]') from t1 where pkey = 1;
json_extract(j, '$[3276]')
"dEPL9zG8UjZULxlNQVlM"
commit;
# Connection con40:
start transaction;
select * from t1;
select @var_40 := j from t1;
# Doing small partial update 
# Connection default:
select json_extract(j, '$[3276]') from t1 where pkey = 1;
json_extract(j, '$[3276]')
"dEPL9zG8UjZULxlNQVlM"
start transaction;
update t1 set j = json_set(j, '$[3276]',"JoD8SIdpfwRH8qcFprNI") where pkey = 1;
select json_extract(j, '$[3276]') from t1 where pkey = 1;
json_extract(j, '$[3276]')
"JoD8SIdpfwRH8qcFprNI"
commit;
# Connection con41:
start transaction;
select * from t1;
select @var_41 := j from t1;
# Doing small partial update 
# Connection default:
select json_extract(j, '$[3276]') from t1 where pkey = 1;
json_extract(j, '$[3276]')
"JoD8SIdpfwRH8qcFprNI"
start transaction;
update t1 set j = json_set(j, '$[3276]',"aukwsWJIz4cGqnOH6z4j") where pkey = 1;
select json_extract(j, '$[3276]') from t1 where pkey = 1;
json_extract(j, '$[3276]')
"aukwsWJIz4cGqnOH6z4j"
commit;
# Connection con42:
start transaction;
select * from t1;
select @var_42 := j from t1;
# Doing small partial update 
# Connection default:
select json_extract(j, '$[3276]') from t1 where pkey = 1;
json_extract(j, '$[3276]')
"aukwsWJIz4cGqnOH6z4j"
start transaction;
update t1 set j = json_set(j, '$[3276]',"vV02JdH7UdP2X9yPdFfb") where pkey = 1;
select json_extract(j, '$[3276]') from t1 where pkey = 1;
json_extract(j, '$[3276]')
"vV02JdH7UdP2X9yPdFfb"
commit;
# Connection con43:
start transaction;
select * from t1;
select @var_43 := j from t1;
# Doing small partial update 
# Connection default:
select json_extract(j, '$[3276]') from t1 where pkey = 1;
json_extract(j, '$[3276]')
"vV02JdH7UdP2X9yPdFfb"
start transaction;
update t1 set j = json_set(j, '$[3276]',"HHr63EN9DPq7vr9CSOJu") where pkey = 1;
select json_extract(j, '$[3276]') from t1 where pkey = 1;
json_extract(j, '$[3276]')
"HHr63EN9DPq7vr9CSOJu"
commit;
# Connection con44:
start transaction;
select * from t1;
select @var_44 := j from t1;
# Doing small partial update 
# Connection default:
select json_extract(j, '$[3276]') from t1 where pkey = 1;
json_extract(j, '$[3276]')
"HHr63EN9DPq7vr9CSOJu"
start transaction;
update t1 set j = json_set(j, '$[3276]',"1gwXotuR6a2OpsUs6pzJ") where pkey = 1;
select json_extract(j, '$[3276]') from t1 where pkey = 1;
json_extract(j, '$[3276]')
"1gwXotuR6a2OpsUs6pzJ"
commit;
# Connection con45:
start transaction;
select * from t1;
select @var_45 := j from t1;
# Doing small partial update 
# Connection default:
select json_extract(j, '$[3276]') from t1 where pkey = 1;
json_extract(j, '$[3276]')
"1gwXotuR6a2OpsUs6pzJ"
start transaction;
update t1 set j = json_set(j, '$[3276]',"EqO7fXK7udzvIvQ6mLVt") where pkey = 1;
select json_extract(j, '$[3276]') from t1 where pkey = 1;
json_extract(j, '$[3276]')
"EqO7fXK7udzvIvQ6mLVt"
commit;
# Connection con46:
start transaction;
select * from t1;
select @var_46 := j from t1;
# Doing small partial update 
# Connection default:
select json_extract(j, '$[3276]') from t1 where pkey = 1;
json_extract(j, '$[3276]')
"EqO7fXK7udzvIvQ6mLVt"
start transaction;
update t1 set j = json_set(j, '$[3276]',"tYFiOjbUWYlkOAq3f88Z") where pkey = 1;
select json_extract(j, '$[3276]') from t1 where pkey = 1;
json_extract(j, '$[3276]')
"tYFiOjbUWYlkOAq3f88Z"
commit;
# Connection con47:
start transaction;
select * from t1;
select @var_47 := j from t1;
# Doing small partial update 
# Connection default:
select json_extract(j, '$[3276]') from t1 where pkey = 1;
json_extract(j, '$[3276]')
"tYFiOjbUWYlkOAq3f88Z"
start transaction;
update t1 set j = json_set(j, '$[3276]',"j7T11t7lCde59toXaNz6") where pkey = 1;
select json_extract(j, '$[3276]') from t1 where pkey = 1;
json_extract(j, '$[3276]')
"j7T11t7lCde59toXaNz6"
commit;
# Connection con48:
start transaction;
select * from t1;
select @var_48 := j from t1;
# Doing small partial update 
# Connection default:
select json_extract(j, '$[3276]') from t1 where pkey = 1;
json_extract(j, '$[3276]')
"j7T11t7lCde59toXaNz6"
start transaction;
update t1 set j = json_set(j, '$[3276]',"vkpKsdLYlS7UZYWYSbKc") where pkey = 1;
select json_extract(j, '$[3276]') from t1 where pkey = 1;
json_extract(j, '$[3276]')
"vkpKsdLYlS7UZYWYSbKc"
commit;
# Connection con49:
start transaction;
select * from t1;
select @var_49 := j from t1;
# Doing small partial update 
# Connection default:
select json_extract(j, '$[3276]') from t1 where pkey = 1;
json_extract(j, '$[3276]')
"vkpKsdLYlS7UZYWYSbKc"
start transaction;
update t1 set j = json_set(j, '$[3276]',"EwiLoWsOrrTmaG4StOye") where pkey = 1;
select json_extract(j, '$[3276]') from t1 where pkey = 1;
json_extract(j, '$[3276]')
"EwiLoWsOrrTmaG4StOye"
commit;
# Connection con50:
start transaction;
select * from t1;
select @var_50 := j from t1;
# Doing small partial update 
# Connection default:
select json_extract(j, '$[3276]') from t1 where pkey = 1;
json_extract(j, '$[3276]')
"EwiLoWsOrrTmaG4StOye"
start transaction;
update t1 set j = json_set(j, '$[3276]',"q66Nccw4EEfQANmwrcJi") where pkey = 1;
select json_extract(j, '$[3276]') from t1 where pkey = 1;
json_extract(j, '$[3276]')
"q66Nccw4EEfQANmwrcJi"
commit;
# Connection con51:
start transaction;
select * from t1;
select @var_51 := j from t1;
# Doing small partial update 
# Connection default:
select json_extract(j, '$[3276]') from t1 where pkey = 1;
json_extract(j, '$[3276]')
"q66Nccw4EEfQANmwrcJi"
start transaction;
update t1 set j = json_set(j, '$[3276]',"SmS20VSrtRVjVZ67C0AO") where pkey = 1;
select json_extract(j, '$[3276]') from t1 where pkey = 1;
json_extract(j, '$[3276]')
"SmS20VSrtRVjVZ67C0AO"
commit;
# Connection con52:
start transaction;
select * from t1;
select @var_52 := j from t1;
# Doing small partial update 
# Connection default:
select json_extract(j, '$[3276]') from t1 where pkey = 1;
json_extract(j, '$[3276]')
"SmS20VSrtRVjVZ67C0AO"
start transaction;
update t1 set j = json_set(j, '$[3276]',"CpoLCYH1BahdK9dKe5BV") where pkey = 1;
select json_extract(j, '$[3276]') from t1 where pkey = 1;
json_extract(j, '$[3276]')
"CpoLCYH1BahdK9dKe5BV"
commit;
# Connection con53:
start transaction;
select * from t1;
select @var_53 := j from t1;
# Doing small partial update 
# Connection default:
select json_extract(j, '$[3276]') from t1 where pkey = 1;
json_extract(j, '$[3276]')
"CpoLCYH1BahdK9dKe5BV"
start transaction;
update t1 set j = json_set(j, '$[3276]',"WeEzEJ7OHHkU6WpG54FE") where pkey = 1;
select json_extract(j, '$[3276]') from t1 where pkey = 1;
json_extract(j, '$[3276]')
"WeEzEJ7OHHkU6WpG54FE"
commit;
# Connection con54:
start transaction;
select * from t1;
select @var_54 := j from t1;
# Doing small partial update 
# Connection default:
select json_extract(j, '$[3276]') from t1 where pkey = 1;
json_extract(j, '$[3276]')
"WeEzEJ7OHHkU6WpG54FE"
start transaction;
update t1 set j = json_set(j, '$[3276]',"fwpz5SIiXRD24Q1Gh6cw") where pkey = 1;
select json_extract(j, '$[3276]') from t1 where pkey = 1;
json_extract(j, '$[3276]')
"fwpz5SIiXRD24Q1Gh6cw"
commit;
# Connection con55:
start transaction;
select * from t1;
select @var_55 := j from t1;
# Doing small partial update 
# Connection default:
select json_extract(j, '$[3276]') from t1 where pkey = 1;
json_extract(j, '$[3276]')
"fwpz5SIiXRD24Q1Gh6cw"
start transaction;
update t1 set j = json_set(j, '$[3276]',"NMQRsDfvIu7vqwsuOAau") where pkey = 1;
select json_extract(j, '$[3276]') from t1 where pkey = 1;
json_extract(j, '$[3276]')
"NMQRsDfvIu7vqwsuOAau"
commit;
# Connection con56:
start transaction;
select * from t1;
select @var_56 := j from t1;
# Doing small partial update 
# Connection default:
select json_extract(j, '$[3276]') from t1 where pkey = 1;
json_extract(j, '$[3276]')
"NMQRsDfvIu7vqwsuOAau"
start transaction;
update t1 set j = json_set(j, '$[3276]',"alueBtsq0UlNqBngNSad") where pkey = 1;
select json_extract(j, '$[3276]') from t1 where pkey = 1;
json_extract(j, '$[3276]')
"alueBtsq0UlNqBngNSad"
commit;
# Connection con57:
start transaction;
select * from t1;
select @var_57 := j from t1;
# Doing small partial update 
# Connection default:
select json_extract(j, '$[3276]') from t1 where pkey = 1;
json_extract(j, '$[3276]')
"alueBtsq0UlNqBngNSad"
start transaction;
update t1 set j = json_set(j, '$[3276]',"NhYBeQ50Zfu7RojaibPi") where pkey = 1;
select json_extract(j, '$[3276]') from t1 where pkey = 1;
json_extract(j, '$[3276]')
"NhYBeQ50Zfu7RojaibPi"
commit;
# Connection con58:
start transaction;
select * from t1;
select @var_58 := j from t1;
# Doing small partial update 
# Connection default:
select json_extract(j, '$[3276]') from t1 where pkey = 1;
json_extract(j, '$[3276]')
"NhYBeQ50Zfu7RojaibPi"
start transaction;
update t1 set j = json_set(j, '$[3276]',"5A3tJoXgH7HcnpnREtRn") where pkey = 1;
select json_extract(j, '$[3276]') from t1 where pkey = 1;
json_extract(j, '$[3276]')
"5A3tJoXgH7HcnpnREtRn"
commit;
# Connection con59:
start transaction;
select * from t1;
select @var_59 := j from t1;
# Doing small partial update 
# Connection default:
select json_extract(j, '$[3276]') from t1 where pkey = 1;
json_extract(j, '$[3276]')
"5A3tJoXgH7HcnpnREtRn"
start transaction;
update t1 set j = json_set(j, '$[3276]',"WKuv8bWoCtUF3W8MKd1b") where pkey = 1;
select json_extract(j, '$[3276]') from t1 where pkey = 1;
json_extract(j, '$[3276]')
"WKuv8bWoCtUF3W8MKd1b"
commit;
# Connection con60:
start transaction;
select * from t1;
select @var_60 := j from t1;
# Doing small partial update 
# Connection default:
select json_extract(j, '$[3276]') from t1 where pkey = 1;
json_extract(j, '$[3276]')
"WKuv8bWoCtUF3W8MKd1b"
start transaction;
update t1 set j = json_set(j, '$[3276]',"lIBY6zxKqM5MgxInYmbi") where pkey = 1;
select json_extract(j, '$[3276]') from t1 where pkey = 1;
json_extract(j, '$[3276]')
"lIBY6zxKqM5MgxInYmbi"
commit;
# Connection con61:
start transaction;
select * from t1;
select @var_61 := j from t1;
# Doing small partial update 
# Connection default:
select json_extract(j, '$[3276]') from t1 where pkey = 1;
json_extract(j, '$[3276]')
"lIBY6zxKqM5MgxInYmbi"
start transaction;
update t1 set j = json_set(j, '$[3276]',"f6xia32ug1URIfxOesgU") where pkey = 1;
select json_extract(j, '$[3276]') from t1 where pkey = 1;
json_extract(j, '$[3276]')
"f6xia32ug1URIfxOesgU"
commit;
# Connection con62:
start transaction;
select * from t1;
select @var_62 := j from t1;
# Doing small partial update 
# Connection default:
select json_extract(j, '$[3276]') from t1 where pkey = 1;
json_extract(j, '$[3276]')
"f6xia32ug1URIfxOesgU"
start transaction;
update t1 set j = json_set(j, '$[3276]',"Fjpte7gCtIsWMpCusEoW") where pkey = 1;
select json_extract(j, '$[3276]') from t1 where pkey = 1;
json_extract(j, '$[3276]')
"Fjpte7gCtIsWMpCusEoW"
commit;
# Connection con63:
start transaction;
select * from t1;
select @var_63 := j from t1;
# Doing small partial update 
# Connection default:
select json_extract(j, '$[3276]') from t1 where pkey = 1;
json_extract(j, '$[3276]')
"Fjpte7gCtIsWMpCusEoW"
start transaction;
update t1 set j = json_set(j, '$[3276]',"EIyWwtsamW3zFsstxX3o") where pkey = 1;
select json_extract(j, '$[3276]') from t1 where pkey = 1;
json_extract(j, '$[3276]')
"EIyWwtsamW3zFsstxX3o"
commit;
# Connection con64:
start transaction;
select * from t1;
select @var_64 := j from t1;
# Doing small partial update 
# Connection default:
select json_extract(j, '$[3276]') from t1 where pkey = 1;
json_extract(j, '$[3276]')
"EIyWwtsamW3zFsstxX3o"
start transaction;
update t1 set j = json_set(j, '$[3276]',"ntK7iW1Yip4w60Q2sIac") where pkey = 1;
select json_extract(j, '$[3276]') from t1 where pkey = 1;
json_extract(j, '$[3276]')
"ntK7iW1Yip4w60Q2sIac"
commit;
# Connection con65:
start transaction;
select * from t1;
select @var_65 := j from t1;
# Doing small partial update 
# Connection default:
select json_extract(j, '$[3276]') from t1 where pkey = 1;
json_extract(j, '$[3276]')
"ntK7iW1Yip4w60Q2sIac"
start transaction;
update t1 set j = json_set(j, '$[3276]',"mbbzTRsQytElmYsS2tyj") where pkey = 1;
select json_extract(j, '$[3276]') from t1 where pkey = 1;
json_extract(j, '$[3276]')
"mbbzTRsQytElmYsS2tyj"
commit;
# Connection con66:
start transaction;
select * from t1;
select @var_66 := j from t1;
# Doing small partial update 
# Connection default:
select json_extract(j, '$[3276]') from t1 where pkey = 1;
json_extract(j, '$[3276]')
"mbbzTRsQytElmYsS2tyj"
start transaction;
update t1 set j = json_set(j, '$[3276]',"h3dl14ltKJV7v46OUxnQ") where pkey = 1;
select json_extract(j, '$[3276]') from t1 where pkey = 1;
json_extract(j, '$[3276]')
"h3dl14ltKJV7v46OUxnQ"
commit;
# Connection con67:
start transaction;
select * from t1;
select @var_67 := j from t1;
# Doing small partial update 
# Connection default:
select json_extract(j, '$[3276]') from t1 where pkey = 1;
json_extract(j, '$[3276]')
"h3dl14ltKJV7v46OUxnQ"
start transaction;
update t1 set j = json_set(j, '$[3276]',"o1CZY2zYuyHZzvK0x3sH") where pkey = 1;
select json_extract(j, '$[3276]') from t1 where pkey = 1;
json_extract(j, '$[3276]')
"o1CZY2zYuyHZzvK0x3sH"
commit;
# Connection con68:
start transaction;
select * from t1;
select @var_68 := j from t1;
# Doing small partial update 
# Connection default:
select json_extract(j, '$[3276]') from t1 where pkey = 1;
json_extract(j, '$[3276]')
"o1CZY2zYuyHZzvK0x3sH"
start transaction;
update t1 set j = json_set(j, '$[3276]',"MLMHORgsMRIAQShyVhVN") where pkey = 1;
select json_extract(j, '$[3276]') from t1 where pkey = 1;
json_extract(j, '$[3276]')
"MLMHORgsMRIAQShyVhVN"
commit;
# Connection con69:
start transaction;
select * from t1;
select @var_69 := j from t1;
# Doing small partial update 
# Connection default:
select json_extract(j, '$[3276]') from t1 where pkey = 1;
json_extract(j, '$[3276]')
"MLMHORgsMRIAQShyVhVN"
start transaction;
update t1 set j = json_set(j, '$[3276]',"dmwcfEaaHSsdmCvAdZ0x") where pkey = 1;
select json_extract(j, '$[3276]') from t1 where pkey = 1;
json_extract(j, '$[3276]')
"dmwcfEaaHSsdmCvAdZ0x"
commit;
# Connection con70:
start transaction;
select * from t1;
select @var_70 := j from t1;
# Doing small partial update 
# Connection default:
select json_extract(j, '$[3276]') from t1 where pkey = 1;
json_extract(j, '$[3276]')
"dmwcfEaaHSsdmCvAdZ0x"
start transaction;
update t1 set j = json_set(j, '$[3276]',"yI8OlnLEUqZ7aThEhIow") where pkey = 1;
select json_extract(j, '$[3276]') from t1 where pkey = 1;
json_extract(j, '$[3276]')
"yI8OlnLEUqZ7aThEhIow"
commit;
# Connection con71:
start transaction;
select * from t1;
select @var_71 := j from t1;
# Doing small partial update 
# Connection default:
select json_extract(j, '$[3276]') from t1 where pkey = 1;
json_extract(j, '$[3276]')
"yI8OlnLEUqZ7aThEhIow"
start transaction;
update t1 set j = json_set(j, '$[3276]',"ieZUrScSzcQxtWKeJfqm") where pkey = 1;
select json_extract(j, '$[3276]') from t1 where pkey = 1;
json_extract(j, '$[3276]')
"ieZUrScSzcQxtWKeJfqm"
commit;
# Connection con72:
start transaction;
select * from t1;
select @var_72 := j from t1;
# Doing small partial update 
# Connection default:
select json_extract(j, '$[3276]') from t1 where pkey = 1;
json_extract(j, '$[3276]')
"ieZUrScSzcQxtWKeJfqm"
start transaction;
update t1 set j = json_set(j, '$[3276]',"VNr3qZHVp6RVkyybPa2M") where pkey = 1;
select json_extract(j, '$[3276]') from t1 where pkey = 1;
json_extract(j, '$[3276]')
"VNr3qZHVp6RVkyybPa2M"
commit;
# Connection con73:
start transaction;
select * from t1;
select @var_73 := j from t1;
# Doing small partial update 
# Connection default:
select json_extract(j, '$[3276]') from t1 where pkey = 1;
json_extract(j, '$[3276]')
"VNr3qZHVp6RVkyybPa2M"
start transaction;
update t1 set j = json_set(j, '$[3276]',"BSI4wcgFHUzkrrnfO5AB") where pkey = 1;
select json_extract(j, '$[3276]') from t1 where pkey = 1;
json_extract(j, '$[3276]')
"BSI4wcgFHUzkrrnfO5AB"
commit;
# Connection con74:
start transaction;
select * from t1;
select @var_74 := j from t1;
# Doing small partial update 
# Connection default:
select json_extract(j, '$[3276]') from t1 where pkey = 1;
json_extract(j, '$[3276]')
"BSI4wcgFHUzkrrnfO5AB"
start transaction;
update t1 set j = json_set(j, '$[3276]',"BbgtXeTwDVHOvZSrB64Q") where pkey = 1;
select json_extract(j, '$[3276]') from t1 where pkey = 1;
json_extract(j, '$[3276]')
"BbgtXeTwDVHOvZSrB64Q"
commit;
# Connection con75:
start transaction;
select * from t1;
select @var_75 := j from t1;
# Doing small partial update 
# Connection default:
select json_extract(j, '$[3276]') from t1 where pkey = 1;
json_extract(j, '$[3276]')
"BbgtXeTwDVHOvZSrB64Q"
start transaction;
update t1 set j = json_set(j, '$[3276]',"a4ARvv6H0GS9p81KlUHw") where pkey = 1;
select json_extract(j, '$[3276]') from t1 where pkey = 1;
json_extract(j, '$[3276]')
"a4ARvv6H0GS9p81KlUHw"
commit;
# Connection con76:
start transaction;
select * from t1;
select @var_76 := j from t1;
# Doing small partial update 
# Connection default:
select json_extract(j, '$[3276]') from t1 where pkey = 1;
json_extract(j, '$[3276]')
"a4ARvv6H0GS9p81KlUHw"
start transaction;
update t1 set j = json_set(j, '$[3276]',"zWKs5kjEqncQpmpiftze") where pkey = 1;
select json_extract(j, '$[3276]') from t1 where pkey = 1;
json_extract(j, '$[3276]')
"zWKs5kjEqncQpmpiftze"
commit;
# Connection con77:
start transaction;
select * from t1;
select @var_77 := j from t1;
# Doing small partial update 
# Connection default:
select json_extract(j, '$[3276]') from t1 where pkey = 1;
json_extract(j, '$[3276]')
"zWKs5kjEqncQpmpiftze"
start transaction;
update t1 set j = json_set(j, '$[3276]',"9RlwYmGHGVDD1V54FmI3") where pkey = 1;
select json_extract(j, '$[3276]') from t1 where pkey = 1;
json_extract(j, '$[3276]')
"9RlwYmGHGVDD1V54FmI3"
commit;
# Connection con78:
start transaction;
select * from t1;
select @var_78 := j from t1;
# Doing small partial update 
# Connection default:
select json_extract(j, '$[3276]') from t1 where pkey = 1;
json_extract(j, '$[3276]')
"9RlwYmGHGVDD1V54FmI3"
start transaction;
update t1 set j = json_set(j, '$[3276]',"asRPeG6I95wGVhA1UOIi") where pkey = 1;
select json_extract(j, '$[3276]') from t1 where pkey = 1;
json_extract(j, '$[3276]')
"asRPeG6I95wGVhA1UOIi"
commit;
# Connection con79:
start transaction;
select * from t1;
select @var_79 := j from t1;
# Doing small partial update 
# Connection default:
select json_extract(j, '$[3276]') from t1 where pkey = 1;
json_extract(j, '$[3276]')
"asRPeG6I95wGVhA1UOIi"
start transaction;
update t1 set j = json_set(j, '$[3276]',"sTwryzwBmCCK5dhhrnzy") where pkey = 1;
select json_extract(j, '$[3276]') from t1 where pkey = 1;
json_extract(j, '$[3276]')
"sTwryzwBmCCK5dhhrnzy"
commit;
# Destroying all connections: 
# Connection con0:
select * from t1;
select @var_end_0 := j from t1;
select @var_0 = @var_end_0;
@var_0 = @var_end_0
1
select json_extract(j, '$[3276]') from t1 where pkey = 1;
json_extract(j, '$[3276]')
"b7puT9H6zLmmbOMzJ8lC"
commit;
select json_extract(j, '$[3276]') from t1 where pkey = 1;
json_extract(j, '$[3276]')
"sTwryzwBmCCK5dhhrnzy"
# Connection con1:
select * from t1;
select @var_end_1 := j from t1;
select @var_1 = @var_end_1;
@var_1 = @var_end_1
1
select json_extract(j, '$[3276]') from t1 where pkey = 1;
json_extract(j, '$[3276]')
"cefHaycI7eAgjybD7qH4"
commit;
select json_extract(j, '$[3276]') from t1 where pkey = 1;
json_extract(j, '$[3276]')
"sTwryzwBmCCK5dhhrnzy"
# Connection con2:
select * from t1;
select @var_end_2 := j from t1;
select @var_2 = @var_end_2;
@var_2 = @var_end_2
1
select json_extract(j, '$[3276]') from t1 where pkey = 1;
json_extract(j, '$[3276]')
"C4olQAjhHUtt8W8gUkzZ"
commit;
select json_extract(j, '$[3276]') from t1 where pkey = 1;
json_extract(j, '$[3276]')
"sTwryzwBmCCK5dhhrnzy"
# Connection con3:
select * from t1;
select @var_end_3 := j from t1;
select @var_3 = @var_end_3;
@var_3 = @var_end_3
1
select json_extract(j, '$[3276]') from t1 where pkey = 1;
json_extract(j, '$[3276]')
"M7G65pJCfaFpc3b0CKiT"
commit;
select json_extract(j, '$[3276]') from t1 where pkey = 1;
json_extract(j, '$[3276]')
"sTwryzwBmCCK5dhhrnzy"
# Connection con4:
select * from t1;
select @var_end_4 := j from t1;
select @var_4 = @var_end_4;
@var_4 = @var_end_4
1
select json_extract(j, '$[3276]') from t1 where pkey = 1;
json_extract(j, '$[3276]')
"mZKs6SYYAX8WfMciBvto"
commit;
select json_extract(j, '$[3276]') from t1 where pkey = 1;
json_extract(j, '$[3276]')
"sTwryzwBmCCK5dhhrnzy"
# Connection con5:
select * from t1;
select @var_end_5 := j from t1;
select @var_5 = @var_end_5;
@var_5 = @var_end_5
1
select json_extract(j, '$[3276]') from t1 where pkey = 1;
json_extract(j, '$[3276]')
"U8e4BD5NVnoHM89Qafzi"
commit;
select json_extract(j, '$[3276]') from t1 where pkey = 1;
json_extract(j, '$[3276]')
"sTwryzwBmCCK5dhhrnzy"
# Connection con6:
select * from t1;
select @var_end_6 := j from t1;
select @var_6 = @var_end_6;
@var_6 = @var_end_6
1
select json_extract(j, '$[3276]') from t1 where pkey = 1;
json_extract(j, '$[3276]')
"B7FoTrWclPQDX2HhDM2i"
commit;
select json_extract(j, '$[3276]') from t1 where pkey = 1;
json_extract(j, '$[3276]')
"sTwryzwBmCCK5dhhrnzy"
# Connection con7:
select * from t1;
select @var_end_7 := j from t1;
select @var_7 = @var_end_7;
@var_7 = @var_end_7
1
select json_extract(j, '$[3276]') from t1 where pkey = 1;
json_extract(j, '$[3276]')
"7rxSz6qYkpGvuTjLLFx4"
commit;
select json_extract(j, '$[3276]') from t1 where pkey = 1;
json_extract(j, '$[3276]')
"sTwryzwBmCCK5dhhrnzy"
# Connection con8:
select * from t1;
select @var_end_8 := j from t1;
select @var_8 = @var_end_8;
@var_8 = @var_end_8
1
select json_extract(j, '$[3276]') from t1 where pkey = 1;
json_extract(j, '$[3276]')
"dMH8MWparqIwfGMcKDA4"
commit;
select json_extract(j, '$[3276]') from t1 where pkey = 1;
json_extract(j, '$[3276]')
"sTwryzwBmCCK5dhhrnzy"
# Connection con9:
select * from t1;
select @var_end_9 := j from t1;
select @var_9 = @var_end_9;
@var_9 = @var_end_9
1
select json_extract(j, '$[3276]') from t1 where pkey = 1;
json_extract(j, '$[3276]')
"2PxxqgG9wEDXYSfuxTUo"
commit;
select json_extract(j, '$[3276]') from t1 where pkey = 1;
json_extract(j, '$[3276]')
"sTwryzwBmCCK5dhhrnzy"
# Connection con10:
select * from t1;
select @var_end_10 := j from t1;
select @var_10 = @var_end_10;
@var_10 = @var_end_10
1
select json_extract(j, '$[3276]') from t1 where pkey = 1;
json_extract(j, '$[3276]')
"Jlky17YJKjMK6JFu0W4u"
commit;
select json_extract(j, '$[3276]') from t1 where pkey = 1;
json_extract(j, '$[3276]')
"sTwryzwBmCCK5dhhrnzy"
# Connection con11:
select * from t1;
select @var_end_11 := j from t1;
select @var_11 = @var_end_11;
@var_11 = @var_end_11
1
select json_extract(j, '$[3276]') from t1 where pkey = 1;
json_extract(j, '$[3276]')
"iFRGi4AfXdRoO9kNEJgW"
commit;
select json_extract(j, '$[3276]') from t1 where pkey = 1;
json_extract(j, '$[3276]')
"sTwryzwBmCCK5dhhrnzy"
# Connection con12:
select * from t1;
select @var_end_12 := j from t1;
select @var_12 = @var_end_12;
@var_12 = @var_end_12
1
select json_extract(j, '$[3276]') from t1 where pkey = 1;
json_extract(j, '$[3276]')
"02r4K4yKa2CGIbWyffbD"
commit;
select json_extract(j, '$[3276]') from t1 where pkey = 1;
json_extract(j, '$[3276]')
"sTwryzwBmCCK5dhhrnzy"
# Connection con13:
select * from t1;
select @var_end_13 := j from t1;
select @var_13 = @var_end_13;
@var_13 = @var_end_13
1
select json_extract(j, '$[3276]') from t1 where pkey = 1;
json_extract(j, '$[3276]')
"I2zg9k3O3hu1ij52o3MM"
commit;
select json_extract(j, '$[3276]') from t1 where pkey = 1;
json_extract(j, '$[3276]')
"sTwryzwBmCCK5dhhrnzy"
# Connection con14:
select * from t1;
select @var_end_14 := j from t1;
select @var_14 = @var_end_14;
@var_14 = @var_end_14
1
select json_extract(j, '$[3276]') from t1 where pkey = 1;
json_extract(j, '$[3276]')
"6WbM77Kmktx2vxi2hjQi"
commit;
select json_extract(j, '$[3276]') from t1 where pkey = 1;
json_extract(j, '$[3276]')
"sTwryzwBmCCK5dhhrnzy"
# Connection con15:
select * from t1;
select @var_end_15 := j from t1;
select @var_15 = @var_end_15;
@var_15 = @var_end_15
1
select json_extract(j, '$[3276]') from t1 where pkey = 1;
json_extract(j, '$[3276]')
"RJj70m9opT9tzkD6pXsa"
commit;
select json_extract(j, '$[3276]') from t1 where pkey = 1;
json_extract(j, '$[3276]')
"sTwryzwBmCCK5dhhrnzy"
# Connection con16:
select * from t1;
select @var_end_16 := j from t1;
select @var_16 = @var_end_16;
@var_16 = @var_end_16
1
select json_extract(j, '$[3276]') from t1 where pkey = 1;
json_extract(j, '$[3276]')
"QqaJlHMQ0k6P1nW2ZfoO"
commit;
select json_extract(j, '$[3276]') from t1 where pkey = 1;
json_extract(j, '$[3276]')
"sTwryzwBmCCK5dhhrnzy"
# Connection con17:
select * from t1;
select @var_end_17 := j from t1;
select @var_17 = @var_end_17;
@var_17 = @var_end_17
1
select json_extract(j, '$[3276]') from t1 where pkey = 1;
json_extract(j, '$[3276]')
"6vG5fTBTz21Nqbhbs1zr"
commit;
select json_extract(j, '$[3276]') from t1 where pkey = 1;
json_extract(j, '$[3276]')
"sTwryzwBmCCK5dhhrnzy"
# Connection con18:
select * from t1;
select @var_end_18 := j from t1;
select @var_18 = @var_end_18;
@var_18 = @var_end_18
1
select json_extract(j, '$[3276]') from t1 where pkey = 1;
json_extract(j, '$[3276]')
"j5ElsjlRMZnTV1Y8TiZS"
commit;
select json_extract(j, '$[3276]') from t1 where pkey = 1;
json_extract(j, '$[3276]')
"sTwryzwBmCCK5dhhrnzy"
# Connection con19:
select * from t1;
select @var_end_19 := j from t1;
select @var_19 = @var_end_19;
@var_19 = @var_end_19
1
select json_extract(j, '$[3276]') from t1 where pkey = 1;
json_extract(j, '$[3276]')
"kapYAU72T6rD94w1nhQ9"
commit;
select json_extract(j, '$[3276]') from t1 where pkey = 1;
json_extract(j, '$[3276]')
"sTwryzwBmCCK5dhhrnzy"
# Connection con20:
select * from t1;
select @var_end_20 := j from t1;
select @var_20 = @var_end_20;
@var_20 = @var_end_20
1
select json_extract(j, '$[3276]') from t1 where pkey = 1;
json_extract(j, '$[3276]')
"GBcjB9serR6Z0t5AOCAr"
commit;
select json_extract(j, '$[3276]') from t1 where pkey = 1;
json_extract(j, '$[3276]')
"sTwryzwBmCCK5dhhrnzy"
# Connection con21:
select * from t1;
select @var_end_21 := j from t1;
select @var_21 = @var_end_21;
@var_21 = @var_end_21
1
select json_extract(j, '$[3276]') from t1 where pkey = 1;
json_extract(j, '$[3276]')
"G22P6yOrdm0uvbb6kTkZ"
commit;
select json_extract(j, '$[3276]') from t1 where pkey = 1;
json_extract(j, '$[3276]')
"sTwryzwBmCCK5dhhrnzy"
# Connection con22:
select * from t1;
select @var_end_22 := j from t1;
select @var_22 = @var_end_22;
@var_22 = @var_end_22
1
select json_extract(j, '$[3276]') from t1 where pkey = 1;
json_extract(j, '$[3276]')
"to6tiB36LDvZDyyHuK8Y"
commit;
select json_extract(j, '$[3276]') from t1 where pkey = 1;
json_extract(j, '$[3276]')
"sTwryzwBmCCK5dhhrnzy"
# Connection con23:
select * from t1;
select @var_end_23 := j from t1;
select @var_23 = @var_end_23;
@var_23 = @var_end_23
1
select json_extract(j, '$[3276]') from t1 where pkey = 1;
json_extract(j, '$[3276]')
"67Q1i16QToxMd3DLCGPV"
commit;
select json_extract(j, '$[3276]') from t1 where pkey = 1;
json_extract(j, '$[3276]')
"sTwryzwBmCCK5dhhrnzy"
# Connection con24:
select * from t1;
select @var_end_24 := j from t1;
select @var_24 = @var_end_24;
@var_24 = @var_end_24
1
select json_extract(j, '$[3276]') from t1 where pkey = 1;
json_extract(j, '$[3276]')
"RK4dG0uBK1jO87Nq8TEZ"
commit;
select json_extract(j, '$[3276]') from t1 where pkey = 1;
json_extract(j, '$[3276]')
"sTwryzwBmCCK5dhhrnzy"
# Connection con25:
select * from t1;
select @var_end_25 := j from t1;
select @var_25 = @var_end_25;
@var_25 = @var_end_25
1
select json_extract(j, '$[3276]') from t1 where pkey = 1;
json_extract(j, '$[3276]')
"IBvtC6CMMbrmttPAtJJD"
commit;
select json_extract(j, '$[3276]') from t1 where pkey = 1;
json_extract(j, '$[3276]')
"sTwryzwBmCCK5dhhrnzy"
# Connection con26:
select * from t1;
select @var_end_26 := j from t1;
select @var_26 = @var_end_26;
@var_26 = @var_end_26
1
select json_extract(j, '$[3276]') from t1 where pkey = 1;
json_extract(j, '$[3276]')
"K0ZQ7wGDOSnebgXnnj97"
commit;
select json_extract(j, '$[3276]') from t1 where pkey = 1;
json_extract(j, '$[3276]')
"sTwryzwBmCCK5dhhrnzy"
# Connection con27:
select * from t1;
select @var_end_27 := j from t1;
select @var_27 = @var_end_27;
@var_27 = @var_end_27
1
select json_extract(j, '$[3276]') from t1 where pkey = 1;
json_extract(j, '$[3276]')
"IytBrIJiactuaSLhNZtl"
commit;
select json_extract(j, '$[3276]') from t1 where pkey = 1;
json_extract(j, '$[3276]')
"sTwryzwBmCCK5dhhrnzy"
# Connection con28:
select * from t1;
select @var_end_28 := j from t1;
select @var_28 = @var_end_28;
@var_28 = @var_end_28
1
select json_extract(j, '$[3276]') from t1 where pkey = 1;
json_extract(j, '$[3276]')
"0gPbKuN5dUDtT62INMzx"
commit;
select json_extract(j, '$[3276]') from t1 where pkey = 1;
json_extract(j, '$[3276]')
"sTwryzwBmCCK5dhhrnzy"
# Connection con29:
select * from t1;
select @var_end_29 := j from t1;
select @var_29 = @var_end_29;
@var_29 = @var_end_29
1
select json_extract(j, '$[3276]') from t1 where pkey = 1;
json_extract(j, '$[3276]')
"wspXJ8Cgg5RgjoF2ic7L"
commit;
select json_extract(j, '$[3276]') from t1 where pkey = 1;
json_extract(j, '$[3276]')
"sTwryzwBmCCK5dhhrnzy"
# Connection con30:
select * from t1;
select @var_end_30 := j from t1;
select @var_30 = @var_end_30;
@var_30 = @var_end_30
1
select json_extract(j, '$[3276]') from t1 where pkey = 1;
json_extract(j, '$[3276]')
"7KCYPEqmYphTgWyzdAdJ"
commit;
select json_extract(j, '$[3276]') from t1 where pkey = 1;
json_extract(j, '$[3276]')
"sTwryzwBmCCK5dhhrnzy"
# Connection con31:
select * from t1;
select @var_end_31 := j from t1;
select @var_31 = @var_end_31;
@var_31 = @var_end_31
1
select json_extract(j, '$[3276]') from t1 where pkey = 1;
json_extract(j, '$[3276]')
"E4xvsCxYn5ruP3SoHGYq"
commit;
select json_extract(j, '$[3276]') from t1 where pkey = 1;
json_extract(j, '$[3276]')
"sTwryzwBmCCK5dhhrnzy"
# Connection con32:
select * from t1;
select @var_end_32 := j from t1;
select @var_32 = @var_end_32;
@var_32 = @var_end_32
1
select json_extract(j, '$[3276]') from t1 where pkey = 1;
json_extract(j, '$[3276]')
"4FJkkFhNPKebMbXClUkY"
commit;
select json_extract(j, '$[3276]') from t1 where pkey = 1;
json_extract(j, '$[3276]')
"sTwryzwBmCCK5dhhrnzy"
# Connection con33:
select * from t1;
select @var_end_33 := j from t1;
select @var_33 = @var_end_33;
@var_33 = @var_end_33
1
select json_extract(j, '$[3276]') from t1 where pkey = 1;
json_extract(j, '$[3276]')
"ZbQxcsjt7IhBXytHDYcb"
commit;
select json_extract(j, '$[3276]') from t1 where pkey = 1;
json_extract(j, '$[3276]')
"sTwryzwBmCCK5dhhrnzy"
# Connection con34:
select * from t1;
select @var_end_34 := j from t1;
select @var_34 = @var_end_34;
@var_34 = @var_end_34
1
select json_extract(j, '$[3276]') from t1 where pkey = 1;
json_extract(j, '$[3276]')
"sGCCphMZC65jfWeHMO8T"
commit;
select json_extract(j, '$[3276]') from t1 where pkey = 1;
json_extract(j, '$[3276]')
"sTwryzwBmCCK5dhhrnzy"
# Connection con35:
select * from t1;
select @var_end_35 := j from t1;
select @var_35 = @var_end_35;
@var_35 = @var_end_35
1
select json_extract(j, '$[3276]') from t1 where pkey = 1;
json_extract(j, '$[3276]')
"gocBkVRw31XtIh35PPeb"
commit;
select json_extract(j, '$[3276]') from t1 where pkey = 1;
json_extract(j, '$[3276]')
"sTwryzwBmCCK5dhhrnzy"
# Connection con36:
select * from t1;
select @var_end_36 := j from t1;
select @var_36 = @var_end_36;
@var_36 = @var_end_36
1
select json_extract(j, '$[3276]') from t1 where pkey = 1;
json_extract(j, '$[3276]')
"VkI8ExNaLW2zKe828Xy9"
commit;
select json_extract(j, '$[3276]') from t1 where pkey = 1;
json_extract(j, '$[3276]')
"sTwryzwBmCCK5dhhrnzy"
# Connection con37:
select * from t1;
select @var_end_37 := j from t1;
select @var_37 = @var_end_37;
@var_37 = @var_end_37
1
select json_extract(j, '$[3276]') from t1 where pkey = 1;
json_extract(j, '$[3276]')
"ZV1pD4uaUZ9xHR6VMT3f"
commit;
select json_extract(j, '$[3276]') from t1 where pkey = 1;
json_extract(j, '$[3276]')
"sTwryzwBmCCK5dhhrnzy"
# Connection con38:
select * from t1;
select @var_end_38 := j from t1;
select @var_38 = @var_end_38;
@var_38 = @var_end_38
1
select json_extract(j, '$[3276]') from t1 where pkey = 1;
json_extract(j, '$[3276]')
"x3cFgjIoGGvnkwavzVVT"
commit;
select json_extract(j, '$[3276]') from t1 where pkey = 1;
json_extract(j, '$[3276]')
"sTwryzwBmCCK5dhhrnzy"
# Connection con39:
select * from t1;
select @var_end_39 := j from t1;
select @var_39 = @var_end_39;
@var_39 = @var_end_39
1
select json_extract(j, '$[3276]') from t1 where pkey = 1;
json_extract(j, '$[3276]')
"2eOH3UmOwn3rrg7XPNJd"
commit;
select json_extract(j, '$[3276]') from t1 where pkey = 1;
json_extract(j, '$[3276]')
"sTwryzwBmCCK5dhhrnzy"
# Connection con40:
select * from t1;
select @var_end_40 := j from t1;
select @var_40 = @var_end_40;
@var_40 = @var_end_40
1
select json_extract(j, '$[3276]') from t1 where pkey = 1;
json_extract(j, '$[3276]')
"dEPL9zG8UjZULxlNQVlM"
commit;
select json_extract(j, '$[3276]') from t1 where pkey = 1;
json_extract(j, '$[3276]')
"sTwryzwBmCCK5dhhrnzy"
# Connection con41:
select * from t1;
select @var_end_41 := j from t1;
select @var_41 = @var_end_41;
@var_41 = @var_end_41
1
select json_extract(j, '$[3276]') from t1 where pkey = 1;
json_extract(j, '$[3276]')
"JoD8SIdpfwRH8qcFprNI"
commit;
select json_extract(j, '$[3276]') from t1 where pkey = 1;
json_extract(j, '$[3276]')
"sTwryzwBmCCK5dhhrnzy"
# Connection con42:
select * from t1;
select @var_end_42 := j from t1;
select @var_42 = @var_end_42;
@var_42 = @var_end_42
1
select json_extract(j, '$[3276]') from t1 where pkey = 1;
json_extract(j, '$[3276]')
"aukwsWJIz4cGqnOH6z4j"
commit;
select json_extract(j, '$[3276]') from t1 where pkey = 1;
json_extract(j, '$[3276]')
"sTwryzwBmCCK5dhhrnzy"
# Connection con43:
select * from t1;
select @var_end_43 := j from t1;
select @var_43 = @var_end_43;
@var_43 = @var_end_43
1
select json_extract(j, '$[3276]') from t1 where pkey = 1;
json_extract(j, '$[3276]')
"vV02JdH7UdP2X9yPdFfb"
commit;
select json_extract(j, '$[3276]') from t1 where pkey = 1;
json_extract(j, '$[3276]')
"sTwryzwBmCCK5dhhrnzy"
# Connection con44:
select * from t1;
select @var_end_44 := j from t1;
select @var_44 = @var_end_44;
@var_44 = @var_end_44
1
select json_extract(j, '$[3276]') from t1 where pkey = 1;
json_extract(j, '$[3276]')
"HHr63EN9DPq7vr9CSOJu"
commit;
select json_extract(j, '$[3276]') from t1 where pkey = 1;
json_extract(j, '$[3276]')
"sTwryzwBmCCK5dhhrnzy"
# Connection con45:
select * from t1;
select @var_end_45 := j from t1;
select @var_45 = @var_end_45;
@var_45 = @var_end_45
1
select json_extract(j, '$[3276]') from t1 where pkey = 1;
json_extract(j, '$[3276]')
"1gwXotuR6a2OpsUs6pzJ"
commit;
select json_extract(j, '$[3276]') from t1 where pkey = 1;
json_extract(j, '$[3276]')
"sTwryzwBmCCK5dhhrnzy"
# Connection con46:
select * from t1;
select @var_end_46 := j from t1;
select @var_46 = @var_end_46;
@var_46 = @var_end_46
1
select json_extract(j, '$[3276]') from t1 where pkey = 1;
json_extract(j, '$[3276]')
"EqO7fXK7udzvIvQ6mLVt"
commit;
select json_extract(j, '$[3276]') from t1 where pkey = 1;
json_extract(j, '$[3276]')
"sTwryzwBmCCK5dhhrnzy"
# Connection con47:
select * from t1;
select @var_end_47 := j from t1;
select @var_47 = @var_end_47;
@var_47 = @var_end_47
1
select json_extract(j, '$[3276]') from t1 where pkey = 1;
json_extract(j, '$[3276]')
"tYFiOjbUWYlkOAq3f88Z"
commit;
select json_extract(j, '$[3276]') from t1 where pkey = 1;
json_extract(j, '$[3276]')
"sTwryzwBmCCK5dhhrnzy"
# Connection con48:
select * from t1;
select @var_end_48 := j from t1;
select @var_48 = @var_end_48;
@var_48 = @var_end_48
1
select json_extract(j, '$[3276]') from t1 where pkey = 1;
json_extract(j, '$[3276]')
"j7T11t7lCde59toXaNz6"
commit;
select json_extract(j, '$[3276]') from t1 where pkey = 1;
json_extract(j, '$[3276]')
"sTwryzwBmCCK5dhhrnzy"
# Connection con49:
select * from t1;
select @var_end_49 := j from t1;
select @var_49 = @var_end_49;
@var_49 = @var_end_49
1
select json_extract(j, '$[3276]') from t1 where pkey = 1;
json_extract(j, '$[3276]')
"vkpKsdLYlS7UZYWYSbKc"
commit;
select json_extract(j, '$[3276]') from t1 where pkey = 1;
json_extract(j, '$[3276]')
"sTwryzwBmCCK5dhhrnzy"
# Connection con50:
select * from t1;
select @var_end_50 := j from t1;
select @var_50 = @var_end_50;
@var_50 = @var_end_50
1
select json_extract(j, '$[3276]') from t1 where pkey = 1;
json_extract(j, '$[3276]')
"EwiLoWsOrrTmaG4StOye"
commit;
select json_extract(j, '$[3276]') from t1 where pkey = 1;
json_extract(j, '$[3276]')
"sTwryzwBmCCK5dhhrnzy"
# Connection con51:
select * from t1;
select @var_end_51 := j from t1;
select @var_51 = @var_end_51;
@var_51 = @var_end_51
1
select json_extract(j, '$[3276]') from t1 where pkey = 1;
json_extract(j, '$[3276]')
"q66Nccw4EEfQANmwrcJi"
commit;
select json_extract(j, '$[3276]') from t1 where pkey = 1;
json_extract(j, '$[3276]')
"sTwryzwBmCCK5dhhrnzy"
# Connection con52:
select * from t1;
select @var_end_52 := j from t1;
select @var_52 = @var_end_52;
@var_52 = @var_end_52
1
select json_extract(j, '$[3276]') from t1 where pkey = 1;
json_extract(j, '$[3276]')
"SmS20VSrtRVjVZ67C0AO"
commit;
select json_extract(j, '$[3276]') from t1 where pkey = 1;
json_extract(j, '$[3276]')
"sTwryzwBmCCK5dhhrnzy"
# Connection con53:
select * from t1;
select @var_end_53 := j from t1;
select @var_53 = @var_end_53;
@var_53 = @var_end_53
1
select json_extract(j, '$[3276]') from t1 where pkey = 1;
json_extract(j, '$[3276]')
"CpoLCYH1BahdK9dKe5BV"
commit;
select json_extract(j, '$[3276]') from t1 where pkey = 1;
json_extract(j, '$[3276]')
"sTwryzwBmCCK5dhhrnzy"
# Connection con54:
select * from t1;
select @var_end_54 := j from t1;
select @var_54 = @var_end_54;
@var_54 = @var_end_54
1
select json_extract(j, '$[3276]') from t1 where pkey = 1;
json_extract(j, '$[3276]')
"WeEzEJ7OHHkU6WpG54FE"
commit;
select json_extract(j, '$[3276]') from t1 where pkey = 1;
json_extract(j, '$[3276]')
"sTwryzwBmCCK5dhhrnzy"
# Connection con55:
select * from t1;
select @var_end_55 := j from t1;
select @var_55 = @var_end_55;
@var_55 = @var_end_55
1
select json_extract(j, '$[3276]') from t1 where pkey = 1;
json_extract(j, '$[3276]')
"fwpz5SIiXRD24Q1Gh6cw"
commit;
select json_extract(j, '$[3276]') from t1 where pkey = 1;
json_extract(j, '$[3276]')
"sTwryzwBmCCK5dhhrnzy"
# Connection con56:
select * from t1;
select @var_end_56 := j from t1;
select @var_56 = @var_end_56;
@var_56 = @var_end_56
1
select json_extract(j, '$[3276]') from t1 where pkey = 1;
json_extract(j, '$[3276]')
"NMQRsDfvIu7vqwsuOAau"
commit;
select json_extract(j, '$[3276]') from t1 where pkey = 1;
json_extract(j, '$[3276]')
"sTwryzwBmCCK5dhhrnzy"
# Connection con57:
select * from t1;
select @var_end_57 := j from t1;
select @var_57 = @var_end_57;
@var_57 = @var_end_57
1
select json_extract(j, '$[3276]') from t1 where pkey = 1;
json_extract(j, '$[3276]')
"alueBtsq0UlNqBngNSad"
commit;
select json_extract(j, '$[3276]') from t1 where pkey = 1;
json_extract(j, '$[3276]')
"sTwryzwBmCCK5dhhrnzy"
# Connection con58:
select * from t1;
select @var_end_58 := j from t1;
select @var_58 = @var_end_58;
@var_58 = @var_end_58
1
select json_extract(j, '$[3276]') from t1 where pkey = 1;
json_extract(j, '$[3276]')
"NhYBeQ50Zfu7RojaibPi"
commit;
select json_extract(j, '$[3276]') from t1 where pkey = 1;
json_extract(j, '$[3276]')
"sTwryzwBmCCK5dhhrnzy"
# Connection con59:
select * from t1;
select @var_end_59 := j from t1;
select @var_59 = @var_end_59;
@var_59 = @var_end_59
1
select json_extract(j, '$[3276]') from t1 where pkey = 1;
json_extract(j, '$[3276]')
"5A3tJoXgH7HcnpnREtRn"
commit;
select json_extract(j, '$[3276]') from t1 where pkey = 1;
json_extract(j, '$[3276]')
"sTwryzwBmCCK5dhhrnzy"
# Connection con60:
select * from t1;
select @var_end_60 := j from t1;
select @var_60 = @var_end_60;
@var_60 = @var_end_60
1
select json_extract(j, '$[3276]') from t1 where pkey = 1;
json_extract(j, '$[3276]')
"WKuv8bWoCtUF3W8MKd1b"
commit;
select json_extract(j, '$[3276]') from t1 where pkey = 1;
json_extract(j, '$[3276]')
"sTwryzwBmCCK5dhhrnzy"
# Connection con61:
select * from t1;
select @var_end_61 := j from t1;
select @var_61 = @var_end_61;
@var_61 = @var_end_61
1
select json_extract(j, '$[3276]') from t1 where pkey = 1;
json_extract(j, '$[3276]')
"lIBY6zxKqM5MgxInYmbi"
commit;
select json_extract(j, '$[3276]') from t1 where pkey = 1;
json_extract(j, '$[3276]')
"sTwryzwBmCCK5dhhrnzy"
# Connection con62:
select * from t1;
select @var_end_62 := j from t1;
select @var_62 = @var_end_62;
@var_62 = @var_end_62
1
select json_extract(j, '$[3276]') from t1 where pkey = 1;
json_extract(j, '$[3276]')
"f6xia32ug1URIfxOesgU"
commit;
select json_extract(j, '$[3276]') from t1 where pkey = 1;
json_extract(j, '$[3276]')
"sTwryzwBmCCK5dhhrnzy"
# Connection con63:
select * from t1;
select @var_end_63 := j from t1;
select @var_63 = @var_end_63;
@var_63 = @var_end_63
1
select json_extract(j, '$[3276]') from t1 where pkey = 1;
json_extract(j, '$[3276]')
"Fjpte7gCtIsWMpCusEoW"
commit;
select json_extract(j, '$[3276]') from t1 where pkey = 1;
json_extract(j, '$[3276]')
"sTwryzwBmCCK5dhhrnzy"
# Connection con64:
select * from t1;
select @var_end_64 := j from t1;
select @var_64 = @var_end_64;
@var_64 = @var_end_64
1
select json_extract(j, '$[3276]') from t1 where pkey = 1;
json_extract(j, '$[3276]')
"EIyWwtsamW3zFsstxX3o"
commit;
select json_extract(j, '$[3276]') from t1 where pkey = 1;
json_extract(j, '$[3276]')
"sTwryzwBmCCK5dhhrnzy"
# Connection con65:
select * from t1;
select @var_end_65 := j from t1;
select @var_65 = @var_end_65;
@var_65 = @var_end_65
1
select json_extract(j, '$[3276]') from t1 where pkey = 1;
json_extract(j, '$[3276]')
"ntK7iW1Yip4w60Q2sIac"
commit;
select json_extract(j, '$[3276]') from t1 where pkey = 1;
json_extract(j, '$[3276]')
"sTwryzwBmCCK5dhhrnzy"
# Connection con66:
select * from t1;
select @var_end_66 := j from t1;
select @var_66 = @var_end_66;
@var_66 = @var_end_66
1
select json_extract(j, '$[3276]') from t1 where pkey = 1;
json_extract(j, '$[3276]')
"mbbzTRsQytElmYsS2tyj"
commit;
select json_extract(j, '$[3276]') from t1 where pkey = 1;
json_extract(j, '$[3276]')
"sTwryzwBmCCK5dhhrnzy"
# Connection con67:
select * from t1;
select @var_end_67 := j from t1;
select @var_67 = @var_end_67;
@var_67 = @var_end_67
1
select json_extract(j, '$[3276]') from t1 where pkey = 1;
json_extract(j, '$[3276]')
"h3dl14ltKJV7v46OUxnQ"
commit;
select json_extract(j, '$[3276]') from t1 where pkey = 1;
json_extract(j, '$[3276]')
"sTwryzwBmCCK5dhhrnzy"
# Connection con68:
select * from t1;
select @var_end_68 := j from t1;
select @var_68 = @var_end_68;
@var_68 = @var_end_68
1
select json_extract(j, '$[3276]') from t1 where pkey = 1;
json_extract(j, '$[3276]')
"o1CZY2zYuyHZzvK0x3sH"
commit;
select json_extract(j, '$[3276]') from t1 where pkey = 1;
json_extract(j, '$[3276]')
"sTwryzwBmCCK5dhhrnzy"
# Connection con69:
select * from t1;
select @var_end_69 := j from t1;
select @var_69 = @var_end_69;
@var_69 = @var_end_69
1
select json_extract(j, '$[3276]') from t1 where pkey = 1;
json_extract(j, '$[3276]')
"MLMHORgsMRIAQShyVhVN"
commit;
select json_extract(j, '$[3276]') from t1 where pkey = 1;
json_extract(j, '$[3276]')
"sTwryzwBmCCK5dhhrnzy"
# Connection con70:
select * from t1;
select @var_end_70 := j from t1;
select @var_70 = @var_end_70;
@var_70 = @var_end_70
1
select json_extract(j, '$[3276]') from t1 where pkey = 1;
json_extract(j, '$[3276]')
"dmwcfEaaHSsdmCvAdZ0x"
commit;
select json_extract(j, '$[3276]') from t1 where pkey = 1;
json_extract(j, '$[3276]')
"sTwryzwBmCCK5dhhrnzy"
# Connection con71:
select * from t1;
select @var_end_71 := j from t1;
select @var_71 = @var_end_71;
@var_71 = @var_end_71
1
select json_extract(j, '$[3276]') from t1 where pkey = 1;
json_extract(j, '$[3276]')
"yI8OlnLEUqZ7aThEhIow"
commit;
select json_extract(j, '$[3276]') from t1 where pkey = 1;
json_extract(j, '$[3276]')
"sTwryzwBmCCK5dhhrnzy"
# Connection con72:
select * from t1;
select @var_end_72 := j from t1;
select @var_72 = @var_end_72;
@var_72 = @var_end_72
1
select json_extract(j, '$[3276]') from t1 where pkey = 1;
json_extract(j, '$[3276]')
"ieZUrScSzcQxtWKeJfqm"
commit;
select json_extract(j, '$[3276]') from t1 where pkey = 1;
json_extract(j, '$[3276]')
"sTwryzwBmCCK5dhhrnzy"
# Connection con73:
select * from t1;
select @var_end_73 := j from t1;
select @var_73 = @var_end_73;
@var_73 = @var_end_73
1
select json_extract(j, '$[3276]') from t1 where pkey = 1;
json_extract(j, '$[3276]')
"VNr3qZHVp6RVkyybPa2M"
commit;
select json_extract(j, '$[3276]') from t1 where pkey = 1;
json_extract(j, '$[3276]')
"sTwryzwBmCCK5dhhrnzy"
# Connection con74:
select * from t1;
select @var_end_74 := j from t1;
select @var_74 = @var_end_74;
@var_74 = @var_end_74
1
select json_extract(j, '$[3276]') from t1 where pkey = 1;
json_extract(j, '$[3276]')
"BSI4wcgFHUzkrrnfO5AB"
commit;
select json_extract(j, '$[3276]') from t1 where pkey = 1;
json_extract(j, '$[3276]')
"sTwryzwBmCCK5dhhrnzy"
# Connection con75:
select * from t1;
select @var_end_75 := j from t1;
select @var_75 = @var_end_75;
@var_75 = @var_end_75
1
select json_extract(j, '$[3276]') from t1 where pkey = 1;
json_extract(j, '$[3276]')
"BbgtXeTwDVHOvZSrB64Q"
commit;
select json_extract(j, '$[3276]') from t1 where pkey = 1;
json_extract(j, '$[3276]')
"sTwryzwBmCCK5dhhrnzy"
# Connection con76:
select * from t1;
select @var_end_76 := j from t1;
select @var_76 = @var_end_76;
@var_76 = @var_end_76
1
select json_extract(j, '$[3276]') from t1 where pkey = 1;
json_extract(j, '$[3276]')
"a4ARvv6H0GS9p81KlUHw"
commit;
select json_extract(j, '$[3276]') from t1 where pkey = 1;
json_extract(j, '$[3276]')
"sTwryzwBmCCK5dhhrnzy"
# Connection con77:
select * from t1;
select @var_end_77 := j from t1;
select @var_77 = @var_end_77;
@var_77 = @var_end_77
1
select json_extract(j, '$[3276]') from t1 where pkey = 1;
json_extract(j, '$[3276]')
"zWKs5kjEqncQpmpiftze"
commit;
select json_extract(j, '$[3276]') from t1 where pkey = 1;
json_extract(j, '$[3276]')
"sTwryzwBmCCK5dhhrnzy"
# Connection con78:
select * from t1;
select @var_end_78 := j from t1;
select @var_78 = @var_end_78;
@var_78 = @var_end_78
1
select json_extract(j, '$[3276]') from t1 where pkey = 1;
json_extract(j, '$[3276]')
"9RlwYmGHGVDD1V54FmI3"
commit;
select json_extract(j, '$[3276]') from t1 where pkey = 1;
json_extract(j, '$[3276]')
"sTwryzwBmCCK5dhhrnzy"
# Connection con79:
select * from t1;
select @var_end_79 := j from t1;
select @var_79 = @var_end_79;
@var_79 = @var_end_79
1
select json_extract(j, '$[3276]') from t1 where pkey = 1;
json_extract(j, '$[3276]')
"asRPeG6I95wGVhA1UOIi"
commit;
select json_extract(j, '$[3276]') from t1 where pkey = 1;
json_extract(j, '$[3276]')
"sTwryzwBmCCK5dhhrnzy"
# Connection default:
drop table t1;
