CREATE TABLE t(j1 JSON);
SET DEBUG_SYNC = 'innodb_inplace_alter_table_enter SIGNAL start_dml WAIT_FOR alter_continue';
ALTER TABLE t row_format = compact;;
SET DEBUG_SYNC = 'now WAIT_FOR start_dml';
start transaction;
# Sven
select json_extract(j1, '$[0]') from t;
json_extract(j1, '$[0]')
"Sven"
UPDATE t SET j1 = JSON_SET(j1, '$[0]', 'Knut');
# Knut
select json_extract(j1, '$[0]') from t;
json_extract(j1, '$[0]')
"Knut"
UPDATE t SET j1 = JSON_SET(j1, '$[0]', 'Anna');
# Anna
select json_extract(j1, '$[0]') from t;
json_extract(j1, '$[0]')
"Anna"
rollback;
SET DEBUG_SYNC = 'now SIGNAL alter_continue';
select json_extract(j1, '$[0]') from t;
json_extract(j1, '$[0]')
"Sven"
drop table t;
SET DEBUG_SYNC = reset;
#
# Bug #28510599 THE MYSQL.IBD FILE SIZE IS CONSTANTLY GROWING.
#
CREATE TABLE t1 (f1 INT AUTO_INCREMENT PRIMARY KEY, f2 LONGBLOB)
ENGINE=InnoDB;
SET @fs = (SELECT FILE_SIZE FROM INFORMATION_SCHEMA.INNODB_TABLESPACES
WHERE NAME='test/t1');
SET @fs_limit = (@fs * 16);
# Execute multiple insert-delete operations.
SET @fs = (SELECT FILE_SIZE FROM INFORMATION_SCHEMA.INNODB_TABLESPACES
WHERE NAME='test/t1');
The test/t1.ibd file size is not growing.
DROP TABLE t1;
CREATE TABLE t1 (f1 INT AUTO_INCREMENT PRIMARY KEY, f2 LONGBLOB)
ENGINE=InnoDB;
INSERT INTO t1 (f2) VALUES (repeat('x', 15764));
SET @fs = (SELECT FILE_SIZE FROM INFORMATION_SCHEMA.INNODB_TABLESPACES
WHERE NAME='test/t1');
SET @fs_limit = (@fs * 16);
# Execute multiple update operations.
SET @fs = (SELECT FILE_SIZE FROM INFORMATION_SCHEMA.INNODB_TABLESPACES
WHERE NAME='test/t1');
The test/t1.ibd file size is not growing.
DROP TABLE t1;
