#
# Bug#22844987 - SPIN ROUNDS PER WAIT WILL BE NEGATIVE IN INNODB STATUS IF SPIN WAITS > MAX32INT
#
CREATE TABLE t (col1 INT);
INSERT INTO t VALUES (1), (2), (3);
SELECT * FROM t ORDER BY col1;
col1
1
2
3
UPDATE t SET col1 = 42 WHERE col1 = 2;
SELECT * FROM t ORDER BY col1;
col1
1
3
42
DROP TABLE t;
