CREATE TABLE `t` (
`a` VARCHAR(100),
`b` VARCHAR(100),
`c` VARCHAR(200) GENERATED ALWAYS AS (CONCAT(a,b)) VIRTUAL,
`h` VARCHAR(10) DEFAULT NULL,
`i` int
) ENGINE=InnoDB;
INSERT INTO t VALUES (REPEAT('g', 100), REPEAT('x', 10), DEFAULT, "kk", 1);
INSERT INTO t VALUES (REPEAT('a', 100), REPEAT('b', 100), DEFAULT, "mm", 2);
CREATE INDEX idx ON t(c(100));
SET session debug="+d,ib_alter_add_virtual_fail";
ALTER TABLE t ADD COLUMN x VARCHAR(200) GENERATED ALWAYS AS (a) VIRTUAL,
ALGORITHM = INPLACE;
ERROR 42000: The used storage engine can't index column 'x'
ALTER TABLE t DROP COLUMN c, ALGORITHM = INPLACE;
ERROR 42000: The used storage engine can't index column 'c'
SET session debug="-d,ib_alter_add_virtual_fail";
DROP TABLE t;
CREATE TABLE t (a INT, b INT, c INT GENERATED ALWAYS AS(a+b), h VARCHAR(10));
INSERT INTO t VALUES (11, 3, DEFAULT, 'mm');
INSERT INTO t VALUES (18, 1, DEFAULT, 'mm');
INSERT INTO t VALUES (28, 1, DEFAULT, 'mm');
INSERT INTO t VALUES (null, null, DEFAULT, "mx");
SET DEBUG_SYNC = 'innodb_inplace_alter_table_enter SIGNAL start_create WAIT_FOR go_ahead';
CREATE INDEX idx ON t(c);;
SET DEBUG_SYNC = 'now WAIT_FOR start_create';
update t set a=0 where a = 11;
SET DEBUG_SYNC = 'now SIGNAL go_ahead';
SELECT c FROM t;
c
NULL
3
19
29
SHOW CREATE TABLE t;
Table	Create Table
t	CREATE TABLE `t` (
  `a` int(11) DEFAULT NULL,
  `b` int(11) DEFAULT NULL,
  `c` int(11) GENERATED ALWAYS AS ((`a` + `b`)) VIRTUAL,
  `h` varchar(10) DEFAULT NULL,
  KEY `idx` (`c`)
) ENGINE=InnoDB DEFAULT CHARSET=latin1
SELECT * FROM t;
a	b	c	h
0	3	3	mm
18	1	19	mm
28	1	29	mm
NULL	NULL	NULL	mx
SET DEBUG_SYNC = 'innodb_inplace_alter_table_enter SIGNAL start_create WAIT_FOR go_ahead';
ALTER TABLE t ADD COLUMN x INT;;
SET DEBUG_SYNC = 'now WAIT_FOR start_create';
start transaction;
update t set a=1 where a = 0;
ROLLBACK;
SET DEBUG_SYNC = 'now SIGNAL go_ahead';
SELECT c FROM t;
c
NULL
3
19
29
SET DEBUG_SYNC = 'innodb_inplace_alter_table_enter SIGNAL start_create WAIT_FOR go_ahead';
ALTER TABLE t ADD COLUMN x2 INT;;
SET DEBUG_SYNC = 'now WAIT_FOR start_create';
start transaction;
DELETE FROM t WHERE a = 0;
ROLLBACK;
DELETE FROM t WHERE a = 0;
SET DEBUG_SYNC = 'now SIGNAL go_ahead';
SELECT c FROM t;
c
NULL
19
29
DROP TABLE t;
SET DEBUG_SYNC = 'RESET';
CREATE TABLE t (a INT, b INT, c INT GENERATED ALWAYS AS(a+b), h VARCHAR(10));
INSERT INTO t VALUES (11, 3, DEFAULT, 'mm');
INSERT INTO t VALUES (18, 1, DEFAULT, 'mm');
INSERT INTO t VALUES (28, 1, DEFAULT, 'mm');
INSERT INTO t VALUES (null, null, DEFAULT, 'mm');
CREATE INDEX idx_1 on t(c);
SET SESSION debug="+d,create_index_fail";
ALTER TABLE t ADD COLUMN x INT GENERATED ALWAYS AS(a+b), ADD INDEX idx (x);
ERROR 23000: Duplicate entry '' for key '*UNKNOWN*'
SET SESSION debug="-d,create_index_fail";
affected rows: 0
SHOW CREATE TABLE t;
Table	Create Table
t	CREATE TABLE `t` (
  `a` int(11) DEFAULT NULL,
  `b` int(11) DEFAULT NULL,
  `c` int(11) GENERATED ALWAYS AS ((`a` + `b`)) VIRTUAL,
  `h` varchar(10) DEFAULT NULL,
  KEY `idx_1` (`c`)
) ENGINE=InnoDB DEFAULT CHARSET=latin1
SELECT c FROM t;
c
NULL
14
19
29
DROP TABLE t;
#
# Bug#22018532 ASSERTION WHEN ONLINE REAPPLY REBUILD LOG ON
# MULTIPLE INDEXED VIRTUAL COLUMNS
#
create table t (
a int as (1) virtual,
b int,
c int as (1) virtual,
unique(b),
unique(c),
key(a)
) engine=innodb;
insert ignore into t values();
SET DEBUG_SYNC = 'innodb_inplace_alter_table_enter SIGNAL start_create WAIT_FOR go_ahead';
optimize table t;
SET DEBUG_SYNC = 'now WAIT_FOR start_create';
insert ignore into t values();
Warnings:
Warning	1062	Duplicate entry '1' for key 'c'
SET DEBUG_SYNC = 'now SIGNAL go_ahead';
/* connection default */ optimize table t;
Table	Op	Msg_type	Msg_text
test.t	optimize	note	Table does not support optimize, doing recreate + analyze instead
test.t	optimize	error	Duplicate entry 'NULL' for key 'b'
test.t	optimize	status	Operation failed
Warnings:
Error	1062	Duplicate entry 'NULL' for key 'b'
SELECT c FROM t;
c
1
SHOW CREATE TABLE t;
Table	Create Table
t	CREATE TABLE `t` (
  `a` int(11) GENERATED ALWAYS AS (1) VIRTUAL,
  `b` int(11) DEFAULT NULL,
  `c` int(11) GENERATED ALWAYS AS (1) VIRTUAL,
  UNIQUE KEY `b` (`b`),
  UNIQUE KEY `c` (`c`),
  KEY `a` (`a`)
) ENGINE=InnoDB DEFAULT CHARSET=latin1
SELECT * FROM t;
a	b	c
1	NULL	1
DROP TABLE t;
CREATE TABLE t (a INT, b INT, c INT GENERATED ALWAYS AS(a+b), h VARCHAR(10));
INSERT INTO t VALUES (11, 3, DEFAULT, 'mm');
INSERT INTO t VALUES (18, 1, DEFAULT, 'mm');
INSERT INTO t VALUES (28, 1, DEFAULT, 'mm');
INSERT INTO t VALUES (null, null, DEFAULT, 'mm');
CREATE INDEX idx ON t(c);
SET DEBUG_SYNC = 'innodb_inplace_alter_table_enter SIGNAL start_rebuild WAIT_FOR go_ahead';
optimize table t;
SET DEBUG_SYNC = 'now WAIT_FOR start_rebuild';
INSERT INTO t VALUES (48, 2, DEFAULT, 'xx');
INSERT INTO t VALUES (68, 3, DEFAULT, 'sx');
SET DEBUG_SYNC = 'now SIGNAL go_ahead';
/* connection default */ optimize table t;
Table	Op	Msg_type	Msg_text
test.t	optimize	note	Table does not support optimize, doing recreate + analyze instead
test.t	optimize	status	OK
SELECT c FROM t;
c
NULL
14
19
29
50
71
DROP TABLE t;
#
#  Bug#22140944    WL#8149: ADD TEST FOR THE ROW0LOG.CC FIX THAT
#                  WAS UNRELATED TO Bug#21894654
#
CREATE TABLE t1 ( id INT ,a VARCHAR(20), b VARCHAR(20) ,c VARCHAR(40)
GENERATED ALWAYS AS (CONCAT(a,b)),key(c));
INSERT INTO t1 (id,a,b) VALUES (10,'aditya','hello');
SET DEBUG_SYNC= 'row_merge_after_scan SIGNAL opened WAIT_FOR go_ddl';
ALTER TABLE t1 ADD CONSTRAINT  pk1 PRIMARY KEY (id);
SET DEBUG_SYNC= 'now WAIT_FOR opened';
UPDATE t1 SET a = 'fg', id = 20 WHERE id = 10;
SET DEBUG_SYNC= 'now SIGNAL go_ddl';
SELECT * from t1;
id	a	b	c
20	fg	hello	fghello
DROP TABLE t1;
#
#  Bug#22951879 - ASSERTS RELATED TO ONLINE DDL AND GCOL
#
create table ibstd_14 (a int not null, d int not null, b varchar(198) not null, c char(181), vadcol int as (a+length(d)) stored, vbcol char(2) as (substr(b,2,2)) virtual, vbidxcol char(3) as (substr(b,1,3)) virtual , index(d), index(a), index(vbidxcol), index(a,vbidxcol), index(vbidxcol,d), unique key (b(10), a, d), index(c(99), b(31)), index(b(5), c(10), a) , index(a,d)) engine=InnoDB stats_persistent=1 row_format=dynamic;
SET DEBUG_SYNC = 'innodb_inplace_alter_table_enter SIGNAL start_create WAIT_FOR go_ahead';
alter table ibstd_14  row_format=compressed key_block_size=4,add  key kn3 (d,c,vbcol,b);;
SET DEBUG_SYNC = 'now WAIT_FOR start_create';
insert into ibstd_14 (a,d,b,c, vbidxcol, vbcol) values ('118','6',repeat('oacolaarlruoacuroauurloraarucoooarcooauoolacalllaulrruarrrucruuooclacuoouccarrcoocloccorrrrarourcooalloocooccouruolaorlcaocualolc','1'),repeat('lolrrlalcocroraaulauclaaucolcorcuooaolruaooooluooooouaoorlarucorullalcrrloccououaooaorluorraclrcooouuolocoaolcocaaculruoocucoocoooauuolarcoraraocaoolulolarru','1'),default,default);
insert into ibstd_14 (a,d,b,c, vbidxcol, vbcol) values ('118','6', 'aaaa', 'lll', default, default);
update ibstd_14 set b='11111' where b='aaaa';
SET DEBUG_SYNC = 'now SIGNAL go_ahead';
select * from ibstd_14;
a	d	b	c	vadcol	vbcol	vbidxcol
118	6	oacolaarlruoacuroauurloraarucoooarcooauoolacalllaulrruarrrucruuooclacuoouccarrcoocloccorrrrarourcooalloocooccouruolaorlcaocualolc	lolrrlalcocroraaulauclaaucolcorcuooaolruaooooluooooouaoorlarucorullalcrrloccououaooaorluorraclrcooouuolocoaolcocaaculruoocucoocoooauuolarcoraraocaoolulolarru	119	ac	oac
118	6	11111	lll	119	11	111
select d,c,vbcol,b from  ibstd_14;
d	c	vbcol	b
6	lll	11	11111
6	lolrrlalcocroraaulauclaaucolcorcuooaolruaooooluooooouaoorlarucorullalcrrloccououaooaorluorraclrcooouuolocoaolcocaaculruoocucoocoooauuolarcoraraocaoolulolarru	ac	oacolaarlruoacuroauurloraarucoooarcooauoolacalllaulrruarrrucruuooclacuoouccarrcoocloccorrrrarourcooalloocooccouruolaorlcaocualolc
select vbcol from ibstd_14;
vbcol
11
ac
drop table ibstd_14;
#
# Bug#22018745 CORRUPTION IN ONLINE TABLE REBUILD
# (ROW_FORMAT=REDUNDANT, INDEXED VIRTUAL COLUMN)
#
CREATE TABLE t (
b char(5) PRIMARY KEY,
v char(3) GENERATED ALWAYS AS (substr(b,1,3)) VIRTUAL, KEY(v)
) ENGINE=InnoDB DEFAULT CHARSET=latin1 ROW_FORMAT=REDUNDANT;
SET DEBUG_SYNC='row_log_table_apply1_before SIGNAL prepared WAIT_FOR apply';
OPTIMIZE TABLE t;
SET DEBUG_SYNC='now WAIT_FOR prepared';
INSERT INTO t SET b='fubar';
BEGIN;
DELETE FROM t;
ROLLBACK;
SET DEBUG_SYNC='now SIGNAL apply';
Table	Op	Msg_type	Msg_text
test.t	optimize	note	Table does not support optimize, doing recreate + analyze instead
test.t	optimize	status	OK
CHECK TABLE t;
Table	Op	Msg_type	Msg_text
test.t	check	status	OK
SELECT * FROM t;
b	v
fubar	fub
DROP TABLE t;
#
# Bug#26375771 INNODB: ASSERTION FAILURE: MACH0DATA.IC:308:VAL > 0X7F
#
create table ibstd_07 (a int not null, d int not null, b blob not null, c text, vadcol int as (a+length(d)) stored, vbcol char(2) as (substr(b,2,2)) virtual, vbidxcol char(3) as (substr(b,1,3)) virtual , index(d  desc), index(a  desc), index(vbidxcol  desc), index(vbidxcol  desc,d  asc), unique key (b(101)  desc, a  asc, d ), index(c(255)  desc, b(255)  asc), index(b(5)  desc, c(10)  asc, a ) ) engine=InnoDB default charset=latin1 row_format=redundant;
insert into ibstd_07 values (2, 2, repeat('rocalrulcrcaurcuccoolrouuocacaooaucauualcucuoucucclolcllloocuarcoorlaccarocouuaoorcolloucraoaaooc','281'),repeat('ouolrculuouocououooalcoraooaulouuacrolrocooraoaooooolaccralacalooolalocoaacoorarorcurccarocucla','317'), default, default, default);
SET DEBUG_SYNC = 'innodb_inplace_alter_table_enter SIGNAL start_create WAIT_FOR go_ahead';
alter table ibstd_07  add primary key (b(11)  desc,a  asc, d );;
SET DEBUG_SYNC = 'now WAIT_FOR start_create';
update ibstd_07 set c=repeat('0.366710324443464crllooolarlollorlulololucrluacoorrrluroluroocouauacacruloulcurlraorcrclrolcocrrcoccolourrooclrcocruruauallo','70');
SET DEBUG_SYNC = 'now SIGNAL go_ahead';
SELECT * FROM ibstd_07;
a	d	b	c	vadcol	vbcol	vbidxcol
2	2	rocalrulcrcaurcuccoolrouuocacaooaucauualcucuoucucclolcllloocuarcoorlaccarocouuaoorcolloucraoaaoocrocalrulcrcaurcuccoolrouuocacaooaucauualcucuoucucclolcllloocuarcoorlaccarocouuaoorcolloucraoaaoocrocalrulcrcaurcuccoolrouuocacaooaucauualcucuoucucclolcllloocuarcoorlaccarocouuaoorcolloucraoaaoocrocalrulcrcaurcuccoolrouuocacaooaucauualcucuoucucclolcllloocuarcoorlaccarocouuaoorcolloucraoaaoocrocalrulcrcaurcuccoolrouuocacaooaucauualcucuoucucclolcllloocuarcoorlaccarocouuaoorcolloucraoaaoocrocalrulcrcaurcuccoolrouuocacaooaucauualcucuoucucclolcllloocuarcoorlaccarocouuaoorcolloucraoaaoocrocalrulcrcaurcuccoolrouuocacaooaucauualcucuoucucclolcllloocuarcoorlaccarocouuaoorcolloucraoaaoocrocalrulcrcaurcuccoolrouuocacaooaucauualcucuoucucclolcllloocuarcoorlaccarocouuaoorcolloucraoaaoocrocalrulcrcaurcuccoolrouuocacaooaucauualcucuoucucclolcllloocuarcoorlaccarocouuaoorcolloucraoaaoocrocalrulcrcaurcuccoolrouuocacaooaucauualcucuoucucclolcllloocuarcoorlaccarocouuaoorcolloucraoaaoocrocalrulcrcaurcuccoolrouuocacaooaucauualcucuoucucclolcllloocuarcoorlaccarocouuaoorcolloucraoaaoocrocalrulcrcaurcuccoolrouuocacaooaucauualcucuoucucclolcllloocuarcoorlaccarocouuaoorcolloucraoaaoocrocalrulcrcaurcuccoolrouuocacaooaucauualcucuoucucclolcllloocuarcoorlaccarocouuaoorcolloucraoaaoocrocalrulcrcaurcuccoolrouuocacaooaucauualcucuoucucclolcllloocuarcoorlaccarocouuaoorcolloucraoaaoocrocalrulcrcaurcuccoolrouuocacaooaucauualcucuoucucclolcllloocuarcoorlaccarocouuaoorcolloucraoaaoocrocalrulcrcaurcuccoolrouuocacaooaucauualcucuoucucclolcllloocuarcoorlaccarocouuaoorcolloucraoaaoocrocalrulcrcaurcuccoolrouuocacaooaucauualcucuoucucclolcllloocuarcoorlaccarocouuaoorcolloucraoaaoocrocalrulcrcaurcuccoolrouuocacaooaucauualcucuoucucclolcllloocuarcoorlaccarocouuaoorcolloucraoaaoocrocalrulcrcaurcuccoolrouuocacaooaucauualcucuoucucclolcllloocuarcoorlaccarocouuaoorcolloucraoaaoocrocalrulcrcaurcuccoolrouuocacaooaucauualcucuoucucclolcllloocuarcoorlaccarocouuaoorcolloucraoaaoocrocalrulcrcaurcuccoolrouuocacaooaucauualcucuoucucclolcllloocuarcoorlaccarocouuaoorcolloucraoaaoocrocalrulcrcaurcuccoolrouuocacaooaucauualcucuoucucclolcllloocuarcoorlaccarocouuaoorcolloucraoaaoocrocalrulcrcaurcuccoolrouuocacaooaucauualcucuoucucclolcllloocuarcoorlaccarocouuaoorcolloucraoaaoocrocalrulcrcaurcuccoolrouuocacaooaucauualcucuoucucclolcllloocuarcoorlaccarocouuaoorcolloucraoaaoocrocalrulcrcaurcuccoolrouuocacaooaucauualcucuoucucclolcllloocuarcoorlaccarocouuaoorcolloucraoaaoocrocalrulcrcaurcuccoolrouuocacaooaucauualcucuoucucclolcllloocuarcoorlaccarocouuaoorcolloucraoaaoocrocalrulcrcaurcuccoolrouuocacaooaucauualcucuoucucclolcllloocuarcoorlaccarocouuaoorcolloucraoaaoocrocalrulcrcaurcuccoolrouuocacaooaucauualcucuoucucclolcllloocuarcoorlaccarocouuaoorcolloucraoaaoocrocalrulcrcaurcuccoolrouuocacaooaucauualcucuoucucclolcllloocuarcoorlaccarocouuaoorcolloucraoaaoocrocalrulcrcaurcuccoolrouuocacaooaucauualcucuoucucclolcllloocuarcoorlaccarocouuaoorcolloucraoaaoocrocalrulcrcaurcuccoolrouuocacaooaucauualcucuoucucclolcllloocuarcoorlaccarocouuaoorcolloucraoaaoocrocalrulcrcaurcuccoolrouuocacaooaucauualcucuoucucclolcllloocuarcoorlaccarocouuaoorcolloucraoaaoocrocalrulcrcaurcuccoolrouuocacaooaucauualcucuoucucclolcllloocuarcoorlaccarocouuaoorcolloucraoaaoocrocalrulcrcaurcuccoolrouuocacaooaucauualcucuoucucclolcllloocuarcoorlaccarocouuaoorcolloucraoaaoocrocalrulcrcaurcuccoolrouuocacaooaucauualcucuoucucclolcllloocuarcoorlaccarocouuaoorcolloucraoaaoocrocalrulcrcaurcuccoolrouuocacaooaucauualcucuoucucclolcllloocuarcoorlaccarocouuaoorcolloucraoaaoocrocalrulcrcaurcuccoolrouuocacaooaucauualcucuoucucclolcllloocuarcoorlaccarocouuaoorcolloucraoaaoocrocalrulcrcaurcuccoolrouuocacaooaucauualcucuoucucclolcllloocuarcoorlaccarocouuaoorcolloucraoaaoocrocalrulcrcaurcuccoolrouuocacaooaucauualcucuoucucclolcllloocuarcoorlaccarocouuaoorcolloucraoaaoocrocalrulcrcaurcuccoolrouuocacaooaucauualcucuoucucclolcllloocuarcoorlaccarocouuaoorcolloucraoaaoocrocalrulcrcaurcuccoolrouuocacaooaucauualcucuoucucclolcllloocuarcoorlaccarocouuaoorcolloucraoaaoocrocalrulcrcaurcuccoolrouuocacaooaucauualcucuoucucclolcllloocuarcoorlaccarocouuaoorcolloucraoaaoocrocalrulcrcaurcuccoolrouuocacaooaucauualcucuoucucclolcllloocuarcoorlaccarocouuaoorcolloucraoaaoocrocalrulcrcaurcuccoolrouuocacaooaucauualcucuoucucclolcllloocuarcoorlaccarocouuaoorcolloucraoaaoocrocalrulcrcaurcuccoolrouuocacaooaucauualcucuoucucclolcllloocuarcoorlaccarocouuaoorcolloucraoaaoocrocalrulcrcaurcuccoolrouuocacaooaucauualcucuoucucclolcllloocuarcoorlaccarocouuaoorcolloucraoaaoocrocalrulcrcaurcuccoolrouuocacaooaucauualcucuoucucclolcllloocuarcoorlaccarocouuaoorcolloucraoaaoocrocalrulcrcaurcuccoolrouuocacaooaucauualcucuoucucclolcllloocuarcoorlaccarocouuaoorcolloucraoaaoocrocalrulcrcaurcuccoolrouuocacaooaucauualcucuoucucclolcllloocuarcoorlaccarocouuaoorcolloucraoaaoocrocalrulcrcaurcuccoolrouuocacaooaucauualcucuoucucclolcllloocuarcoorlaccarocouuaoorcolloucraoaaoocrocalrulcrcaurcuccoolrouuocacaooaucauualcucuoucucclolcllloocuarcoorlaccarocouuaoorcolloucraoaaoocrocalrulcrcaurcuccoolrouuocacaooaucauualcucuoucucclolcllloocuarcoorlaccarocouuaoorcolloucraoaaoocrocalrulcrcaurcuccoolrouuocacaooaucauualcucuoucucclolcllloocuarcoorlaccarocouuaoorcolloucraoaaoocrocalrulcrcaurcuccoolrouuocacaooaucauualcucuoucucclolcllloocuarcoorlaccarocouuaoorcolloucraoaaoocrocalrulcrcaurcuccoolrouuocacaooaucauualcucuoucucclolcllloocuarcoorlaccarocouuaoorcolloucraoaaoocrocalrulcrcaurcuccoolrouuocacaooaucauualcucuoucucclolcllloocuarcoorlaccarocouuaoorcolloucraoaaoocrocalrulcrcaurcuccoolrouuocacaooaucauualcucuoucucclolcllloocuarcoorlaccarocouuaoorcolloucraoaaoocrocalrulcrcaurcuccoolrouuocacaooaucauualcucuoucucclolcllloocuarcoorlaccarocouuaoorcolloucraoaaoocrocalrulcrcaurcuccoolrouuocacaooaucauualcucuoucucclolcllloocuarcoorlaccarocouuaoorcolloucraoaaoocrocalrulcrcaurcuccoolrouuocacaooaucauualcucuoucucclolcllloocuarcoorlaccarocouuaoorcolloucraoaaoocrocalrulcrcaurcuccoolrouuocacaooaucauualcucuoucucclolcllloocuarcoorlaccarocouuaoorcolloucraoaaoocrocalrulcrcaurcuccoolrouuocacaooaucauualcucuoucucclolcllloocuarcoorlaccarocouuaoorcolloucraoaaoocrocalrulcrcaurcuccoolrouuocacaooaucauualcucuoucucclolcllloocuarcoorlaccarocouuaoorcolloucraoaaoocrocalrulcrcaurcuccoolrouuocacaooaucauualcucuoucucclolcllloocuarcoorlaccarocouuaoorcolloucraoaaoocrocalrulcrcaurcuccoolrouuocacaooaucauualcucuoucucclolcllloocuarcoorlaccarocouuaoorcolloucraoaaoocrocalrulcrcaurcuccoolrouuocacaooaucauualcucuoucucclolcllloocuarcoorlaccarocouuaoorcolloucraoaaoocrocalrulcrcaurcuccoolrouuocacaooaucauualcucuoucucclolcllloocuarcoorlaccarocouuaoorcolloucraoaaoocrocalrulcrcaurcuccoolrouuocacaooaucauualcucuoucucclolcllloocuarcoorlaccarocouuaoorcolloucraoaaoocrocalrulcrcaurcuccoolrouuocacaooaucauualcucuoucucclolcllloocuarcoorlaccarocouuaoorcolloucraoaaoocrocalrulcrcaurcuccoolrouuocacaooaucauualcucuoucucclolcllloocuarcoorlaccarocouuaoorcolloucraoaaoocrocalrulcrcaurcuccoolrouuocacaooaucauualcucuoucucclolcllloocuarcoorlaccarocouuaoorcolloucraoaaoocrocalrulcrcaurcuccoolrouuocacaooaucauualcucuoucucclolcllloocuarcoorlaccarocouuaoorcolloucraoaaoocrocalrulcrcaurcuccoolrouuocacaooaucauualcucuoucucclolcllloocuarcoorlaccarocouuaoorcolloucraoaaoocrocalrulcrcaurcuccoolrouuocacaooaucauualcucuoucucclolcllloocuarcoorlaccarocouuaoorcolloucraoaaoocrocalrulcrcaurcuccoolrouuocacaooaucauualcucuoucucclolcllloocuarcoorlaccarocouuaoorcolloucraoaaoocrocalrulcrcaurcuccoolrouuocacaooaucauualcucuoucucclolcllloocuarcoorlaccarocouuaoorcolloucraoaaoocrocalrulcrcaurcuccoolrouuocacaooaucauualcucuoucucclolcllloocuarcoorlaccarocouuaoorcolloucraoaaoocrocalrulcrcaurcuccoolrouuocacaooaucauualcucuoucucclolcllloocuarcoorlaccarocouuaoorcolloucraoaaoocrocalrulcrcaurcuccoolrouuocacaooaucauualcucuoucucclolcllloocuarcoorlaccarocouuaoorcolloucraoaaoocrocalrulcrcaurcuccoolrouuocacaooaucauualcucuoucucclolcllloocuarcoorlaccarocouuaoorcolloucraoaaoocrocalrulcrcaurcuccoolrouuocacaooaucauualcucuoucucclolcllloocuarcoorlaccarocouuaoorcolloucraoaaoocrocalrulcrcaurcuccoolrouuocacaooaucauualcucuoucucclolcllloocuarcoorlaccarocouuaoorcolloucraoaaoocrocalrulcrcaurcuccoolrouuocacaooaucauualcucuoucucclolcllloocuarcoorlaccarocouuaoorcolloucraoaaoocrocalrulcrcaurcuccoolrouuocacaooaucauualcucuoucucclolcllloocuarcoorlaccarocouuaoorcolloucraoaaoocrocalrulcrcaurcuccoolrouuocacaooaucauualcucuoucucclolcllloocuarcoorlaccarocouuaoorcolloucraoaaoocrocalrulcrcaurcuccoolrouuocacaooaucauualcucuoucucclolcllloocuarcoorlaccarocouuaoorcolloucraoaaoocrocalrulcrcaurcuccoolrouuocacaooaucauualcucuoucucclolcllloocuarcoorlaccarocouuaoorcolloucraoaaoocrocalrulcrcaurcuccoolrouuocacaooaucauualcucuoucucclolcllloocuarcoorlaccarocouuaoorcolloucraoaaoocrocalrulcrcaurcuccoolrouuocacaooaucauualcucuoucucclolcllloocuarcoorlaccarocouuaoorcolloucraoaaoocrocalrulcrcaurcuccoolrouuocacaooaucauualcucuoucucclolcllloocuarcoorlaccarocouuaoorcolloucraoaaoocrocalrulcrcaurcuccoolrouuocacaooaucauualcucuoucucclolcllloocuarcoorlaccarocouuaoorcolloucraoaaoocrocalrulcrcaurcuccoolrouuocacaooaucauualcucuoucucclolcllloocuarcoorlaccarocouuaoorcolloucraoaaoocrocalrulcrcaurcuccoolrouuocacaooaucauualcucuoucucclolcllloocuarcoorlaccarocouuaoorcolloucraoaaoocrocalrulcrcaurcuccoolrouuocacaooaucauualcucuoucucclolcllloocuarcoorlaccarocouuaoorcolloucraoaaoocrocalrulcrcaurcuccoolrouuocacaooaucauualcucuoucucclolcllloocuarcoorlaccarocouuaoorcolloucraoaaoocrocalrulcrcaurcuccoolrouuocacaooaucauualcucuoucucclolcllloocuarcoorlaccarocouuaoorcolloucraoaaoocrocalrulcrcaurcuccoolrouuocacaooaucauualcucuoucucclolcllloocuarcoorlaccarocouuaoorcolloucraoaaoocrocalrulcrcaurcuccoolrouuocacaooaucauualcucuoucucclolcllloocuarcoorlaccarocouuaoorcolloucraoaaoocrocalrulcrcaurcuccoolrouuocacaooaucauualcucuoucucclolcllloocuarcoorlaccarocouuaoorcolloucraoaaoocrocalrulcrcaurcuccoolrouuocacaooaucauualcucuoucucclolcllloocuarcoorlaccarocouuaoorcolloucraoaaoocrocalrulcrcaurcuccoolrouuocacaooaucauualcucuoucucclolcllloocuarcoorlaccarocouuaoorcolloucraoaaoocrocalrulcrcaurcuccoolrouuocacaooaucauualcucuoucucclolcllloocuarcoorlaccarocouuaoorcolloucraoaaoocrocalrulcrcaurcuccoolrouuocacaooaucauualcucuoucucclolcllloocuarcoorlaccarocouuaoorcolloucraoaaoocrocalrulcrcaurcuccoolrouuocacaooaucauualcucuoucucclolcllloocuarcoorlaccarocouuaoorcolloucraoaaoocrocalrulcrcaurcuccoolrouuocacaooaucauualcucuoucucclolcllloocuarcoorlaccarocouuaoorcolloucraoaaoocrocalrulcrcaurcuccoolrouuocacaooaucauualcucuoucucclolcllloocuarcoorlaccarocouuaoorcolloucraoaaoocrocalrulcrcaurcuccoolrouuocacaooaucauualcucuoucucclolcllloocuarcoorlaccarocouuaoorcolloucraoaaoocrocalrulcrcaurcuccoolrouuocacaooaucauualcucuoucucclolcllloocuarcoorlaccarocouuaoorcolloucraoaaoocrocalrulcrcaurcuccoolrouuocacaooaucauualcucuoucucclolcllloocuarcoorlaccarocouuaoorcolloucraoaaoocrocalrulcrcaurcuccoolrouuocacaooaucauualcucuoucucclolcllloocuarcoorlaccarocouuaoorcolloucraoaaoocrocalrulcrcaurcuccoolrouuocacaooaucauualcucuoucucclolcllloocuarcoorlaccarocouuaoorcolloucraoaaoocrocalrulcrcaurcuccoolrouuocacaooaucauualcucuoucucclolcllloocuarcoorlaccarocouuaoorcolloucraoaaoocrocalrulcrcaurcuccoolrouuocacaooaucauualcucuoucucclolcllloocuarcoorlaccarocouuaoorcolloucraoaaoocrocalrulcrcaurcuccoolrouuocacaooaucauualcucuoucucclolcllloocuarcoorlaccarocouuaoorcolloucraoaaoocrocalrulcrcaurcuccoolrouuocacaooaucauualcucuoucucclolcllloocuarcoorlaccarocouuaoorcolloucraoaaoocrocalrulcrcaurcuccoolrouuocacaooaucauualcucuoucucclolcllloocuarcoorlaccarocouuaoorcolloucraoaaoocrocalrulcrcaurcuccoolrouuocacaooaucauualcucuoucucclolcllloocuarcoorlaccarocouuaoorcolloucraoaaoocrocalrulcrcaurcuccoolrouuocacaooaucauualcucuoucucclolcllloocuarcoorlaccarocouuaoorcolloucraoaaoocrocalrulcrcaurcuccoolrouuocacaooaucauualcucuoucucclolcllloocuarcoorlaccarocouuaoorcolloucraoaaoocrocalrulcrcaurcuccoolrouuocacaooaucauualcucuoucucclolcllloocuarcoorlaccarocouuaoorcolloucraoaaoocrocalrulcrcaurcuccoolrouuocacaooaucauualcucuoucucclolcllloocuarcoorlaccarocouuaoorcolloucraoaaoocrocalrulcrcaurcuccoolrouuocacaooaucauualcucuoucucclolcllloocuarcoorlaccarocouuaoorcolloucraoaaoocrocalrulcrcaurcuccoolrouuocacaooaucauualcucuoucucclolcllloocuarcoorlaccarocouuaoorcolloucraoaaoocrocalrulcrcaurcuccoolrouuocacaooaucauualcucuoucucclolcllloocuarcoorlaccarocouuaoorcolloucraoaaoocrocalrulcrcaurcuccoolrouuocacaooaucauualcucuoucucclolcllloocuarcoorlaccarocouuaoorcolloucraoaaoocrocalrulcrcaurcuccoolrouuocacaooaucauualcucuoucucclolcllloocuarcoorlaccarocouuaoorcolloucraoaaoocrocalrulcrcaurcuccoolrouuocacaooaucauualcucuoucucclolcllloocuarcoorlaccarocouuaoorcolloucraoaaoocrocalrulcrcaurcuccoolrouuocacaooaucauualcucuoucucclolcllloocuarcoorlaccarocouuaoorcolloucraoaaoocrocalrulcrcaurcuccoolrouuocacaooaucauualcucuoucucclolcllloocuarcoorlaccarocouuaoorcolloucraoaaoocrocalrulcrcaurcuccoolrouuocacaooaucauualcucuoucucclolcllloocuarcoorlaccarocouuaoorcolloucraoaaoocrocalrulcrcaurcuccoolrouuocacaooaucauualcucuoucucclolcllloocuarcoorlaccarocouuaoorcolloucraoaaoocrocalrulcrcaurcuccoolrouuocacaooaucauualcucuoucucclolcllloocuarcoorlaccarocouuaoorcolloucraoaaoocrocalrulcrcaurcuccoolrouuocacaooaucauualcucuoucucclolcllloocuarcoorlaccarocouuaoorcolloucraoaaoocrocalrulcrcaurcuccoolrouuocacaooaucauualcucuoucucclolcllloocuarcoorlaccarocouuaoorcolloucraoaaoocrocalrulcrcaurcuccoolrouuocacaooaucauualcucuoucucclolcllloocuarcoorlaccarocouuaoorcolloucraoaaoocrocalrulcrcaurcuccoolrouuocacaooaucauualcucuoucucclolcllloocuarcoorlaccarocouuaoorcolloucraoaaoocrocalrulcrcaurcuccoolrouuocacaooaucauualcucuoucucclolcllloocuarcoorlaccarocouuaoorcolloucraoaaoocrocalrulcrcaurcuccoolrouuocacaooaucauualcucuoucucclolcllloocuarcoorlaccarocouuaoorcolloucraoaaoocrocalrulcrcaurcuccoolrouuocacaooaucauualcucuoucucclolcllloocuarcoorlaccarocouuaoorcolloucraoaaoocrocalrulcrcaurcuccoolrouuocacaooaucauualcucuoucucclolcllloocuarcoorlaccarocouuaoorcolloucraoaaoocrocalrulcrcaurcuccoolrouuocacaooaucauualcucuoucucclolcllloocuarcoorlaccarocouuaoorcolloucraoaaoocrocalrulcrcaurcuccoolrouuocacaooaucauualcucuoucucclolcllloocuarcoorlaccarocouuaoorcolloucraoaaoocrocalrulcrcaurcuccoolrouuocacaooaucauualcucuoucucclolcllloocuarcoorlaccarocouuaoorcolloucraoaaoocrocalrulcrcaurcuccoolrouuocacaooaucauualcucuoucucclolcllloocuarcoorlaccarocouuaoorcolloucraoaaoocrocalrulcrcaurcuccoolrouuocacaooaucauualcucuoucucclolcllloocuarcoorlaccarocouuaoorcolloucraoaaoocrocalrulcrcaurcuccoolrouuocacaooaucauualcucuoucucclolcllloocuarcoorlaccarocouuaoorcolloucraoaaoocrocalrulcrcaurcuccoolrouuocacaooaucauualcucuoucucclolcllloocuarcoorlaccarocouuaoorcolloucraoaaoocrocalrulcrcaurcuccoolrouuocacaooaucauualcucuoucucclolcllloocuarcoorlaccarocouuaoorcolloucraoaaoocrocalrulcrcaurcuccoolrouuocacaooaucauualcucuoucucclolcllloocuarcoorlaccarocouuaoorcolloucraoaaoocrocalrulcrcaurcuccoolrouuocacaooaucauualcucuoucucclolcllloocuarcoorlaccarocouuaoorcolloucraoaaoocrocalrulcrcaurcuccoolrouuocacaooaucauualcucuoucucclolcllloocuarcoorlaccarocouuaoorcolloucraoaaoocrocalrulcrcaurcuccoolrouuocacaooaucauualcucuoucucclolcllloocuarcoorlaccarocouuaoorcolloucraoaaoocrocalrulcrcaurcuccoolrouuocacaooaucauualcucuoucucclolcllloocuarcoorlaccarocouuaoorcolloucraoaaoocrocalrulcrcaurcuccoolrouuocacaooaucauualcucuoucucclolcllloocuarcoorlaccarocouuaoorcolloucraoaaoocrocalrulcrcaurcuccoolrouuocacaooaucauualcucuoucucclolcllloocuarcoorlaccarocouuaoorcolloucraoaaoocrocalrulcrcaurcuccoolrouuocacaooaucauualcucuoucucclolcllloocuarcoorlaccarocouuaoorcolloucraoaaoocrocalrulcrcaurcuccoolrouuocacaooaucauualcucuoucucclolcllloocuarcoorlaccarocouuaoorcolloucraoaaoocrocalrulcrcaurcuccoolrouuocacaooaucauualcucuoucucclolcllloocuarcoorlaccarocouuaoorcolloucraoaaoocrocalrulcrcaurcuccoolrouuocacaooaucauualcucuoucucclolcllloocuarcoorlaccarocouuaoorcolloucraoaaoocrocalrulcrcaurcuccoolrouuocacaooaucauualcucuoucucclolcllloocuarcoorlaccarocouuaoorcolloucraoaaoocrocalrulcrcaurcuccoolrouuocacaooaucauualcucuoucucclolcllloocuarcoorlaccarocouuaoorcolloucraoaaoocrocalrulcrcaurcuccoolrouuocacaooaucauualcucuoucucclolcllloocuarcoorlaccarocouuaoorcolloucraoaaoocrocalrulcrcaurcuccoolrouuocacaooaucauualcucuoucucclolcllloocuarcoorlaccarocouuaoorcolloucraoaaoocrocalrulcrcaurcuccoolrouuocacaooaucauualcucuoucucclolcllloocuarcoorlaccarocouuaoorcolloucraoaaoocrocalrulcrcaurcuccoolrouuocacaooaucauualcucuoucucclolcllloocuarcoorlaccarocouuaoorcolloucraoaaoocrocalrulcrcaurcuccoolrouuocacaooaucauualcucuoucucclolcllloocuarcoorlaccarocouuaoorcolloucraoaaoocrocalrulcrcaurcuccoolrouuocacaooaucauualcucuoucucclolcllloocuarcoorlaccarocouuaoorcolloucraoaaoocrocalrulcrcaurcuccoolrouuocacaooaucauualcucuoucucclolcllloocuarcoorlaccarocouuaoorcolloucraoaaoocrocalrulcrcaurcuccoolrouuocacaooaucauualcucuoucucclolcllloocuarcoorlaccarocouuaoorcolloucraoaaoocrocalrulcrcaurcuccoolrouuocacaooaucauualcucuoucucclolcllloocuarcoorlaccarocouuaoorcolloucraoaaoocrocalrulcrcaurcuccoolrouuocacaooaucauualcucuoucucclolcllloocuarcoorlaccarocouuaoorcolloucraoaaoocrocalrulcrcaurcuccoolrouuocacaooaucauualcucuoucucclolcllloocuarcoorlaccarocouuaoorcolloucraoaaoocrocalrulcrcaurcuccoolrouuocacaooaucauualcucuoucucclolcllloocuarcoorlaccarocouuaoorcolloucraoaaoocrocalrulcrcaurcuccoolrouuocacaooaucauualcucuoucucclolcllloocuarcoorlaccarocouuaoorcolloucraoaaoocrocalrulcrcaurcuccoolrouuocacaooaucauualcucuoucucclolcllloocuarcoorlaccarocouuaoorcolloucraoaaoocrocalrulcrcaurcuccoolrouuocacaooaucauualcucuoucucclolcllloocuarcoorlaccarocouuaoorcolloucraoaaoocrocalrulcrcaurcuccoolrouuocacaooaucauualcucuoucucclolcllloocuarcoorlaccarocouuaoorcolloucraoaaoocrocalrulcrcaurcuccoolrouuocacaooaucauualcucuoucucclolcllloocuarcoorlaccarocouuaoorcolloucraoaaoocrocalrulcrcaurcuccoolrouuocacaooaucauualcucuoucucclolcllloocuarcoorlaccarocouuaoorcolloucraoaaoocrocalrulcrcaurcuccoolrouuocacaooaucauualcucuoucucclolcllloocuarcoorlaccarocouuaoorcolloucraoaaoocrocalrulcrcaurcuccoolrouuocacaooaucauualcucuoucucclolcllloocuarcoorlaccarocouuaoorcolloucraoaaoocrocalrulcrcaurcuccoolrouuocacaooaucauualcucuoucucclolcllloocuarcoorlaccarocouuaoorcolloucraoaaoocrocalrulcrcaurcuccoolrouuocacaooaucauualcucuoucucclolcllloocuarcoorlaccarocouuaoorcolloucraoaaoocrocalrulcrcaurcuccoolrouuocacaooaucauualcucuoucucclolcllloocuarcoorlaccarocouuaoorcolloucraoaaoocrocalrulcrcaurcuccoolrouuocacaooaucauualcucuoucucclolcllloocuarcoorlaccarocouuaoorcolloucraoaaoocrocalrulcrcaurcuccoolrouuocacaooaucauualcucuoucucclolcllloocuarcoorlaccarocouuaoorcolloucraoaaoocrocalrulcrcaurcuccoolrouuocacaooaucauualcucuoucucclolcllloocuarcoorlaccarocouuaoorcolloucraoaaoocrocalrulcrcaurcuccoolrouuocacaooaucauualcucuoucucclolcllloocuarcoorlaccarocouuaoorcolloucraoaaoocrocalrulcrcaurcuccoolrouuocacaooaucauualcucuoucucclolcllloocuarcoorlaccarocouuaoorcolloucraoaaoocrocalrulcrcaurcuccoolrouuocacaooaucauualcucuoucucclolcllloocuarcoorlaccarocouuaoorcolloucraoaaoocrocalrulcrcaurcuccoolrouuocacaooaucauualcucuoucucclolcllloocuarcoorlaccarocouuaoorcolloucraoaaoocrocalrulcrcaurcuccoolrouuocacaooaucauualcucuoucucclolcllloocuarcoorlaccarocouuaoorcolloucraoaaoocrocalrulcrcaurcuccoolrouuocacaooaucauualcucuoucucclolcllloocuarcoorlaccarocouuaoorcolloucraoaaoocrocalrulcrcaurcuccoolrouuocacaooaucauualcucuoucucclolcllloocuarcoorlaccarocouuaoorcolloucraoaaoocrocalrulcrcaurcuccoolrouuocacaooaucauualcucuoucucclolcllloocuarcoorlaccarocouuaoorcolloucraoaaoocrocalrulcrcaurcuccoolrouuocacaooaucauualcucuoucucclolcllloocuarcoorlaccarocouuaoorcolloucraoaaoocrocalrulcrcaurcuccoolrouuocacaooaucauualcucuoucucclolcllloocuarcoorlaccarocouuaoorcolloucraoaaoocrocalrulcrcaurcuccoolrouuocacaooaucauualcucuoucucclolcllloocuarcoorlaccarocouuaoorcolloucraoaaoocrocalrulcrcaurcuccoolrouuocacaooaucauualcucuoucucclolcllloocuarcoorlaccarocouuaoorcolloucraoaaoocrocalrulcrcaurcuccoolrouuocacaooaucauualcucuoucucclolcllloocuarcoorlaccarocouuaoorcolloucraoaaoocrocalrulcrcaurcuccoolrouuocacaooaucauualcucuoucucclolcllloocuarcoorlaccarocouuaoorcolloucraoaaoocrocalrulcrcaurcuccoolrouuocacaooaucauualcucuoucucclolcllloocuarcoorlaccarocouuaoorcolloucraoaaoocrocalrulcrcaurcuccoolrouuocacaooaucauualcucuoucucclolcllloocuarcoorlaccarocouuaoorcolloucraoaaoocrocalrulcrcaurcuccoolrouuocacaooaucauualcucuoucucclolcllloocuarcoorlaccarocouuaoorcolloucraoaaoocrocalrulcrcaurcuccoolrouuocacaooaucauualcucuoucucclolcllloocuarcoorlaccarocouuaoorcolloucraoaaoocrocalrulcrcaurcuccoolrouuocacaooaucauualcucuoucucclolcllloocuarcoorlaccarocouuaoorcolloucraoaaoocrocalrulcrcaurcuccoolrouuocacaooaucauualcucuoucucclolcllloocuarcoorlaccarocouuaoorcolloucraoaaoocrocalrulcrcaurcuccoolrouuocacaooaucauualcucuoucucclolcllloocuarcoorlaccarocouuaoorcolloucraoaaoocrocalrulcrcaurcuccoolrouuocacaooaucauualcucuoucucclolcllloocuarcoorlaccarocouuaoorcolloucraoaaoocrocalrulcrcaurcuccoolrouuocacaooaucauualcucuoucucclolcllloocuarcoorlaccarocouuaoorcolloucraoaaoocrocalrulcrcaurcuccoolrouuocacaooaucauualcucuoucucclolcllloocuarcoorlaccarocouuaoorcolloucraoaaoocrocalrulcrcaurcuccoolrouuocacaooaucauualcucuoucucclolcllloocuarcoorlaccarocouuaoorcolloucraoaaoocrocalrulcrcaurcuccoolrouuocacaooaucauualcucuoucucclolcllloocuarcoorlaccarocouuaoorcolloucraoaaoocrocalrulcrcaurcuccoolrouuocacaooaucauualcucuoucucclolcllloocuarcoorlaccarocouuaoorcolloucraoaaoocrocalrulcrcaurcuccoolrouuocacaooaucauualcucuoucucclolcllloocuarcoorlaccarocouuaoorcolloucraoaaoocrocalrulcrcaurcuccoolrouuocacaooaucauualcucuoucucclolcllloocuarcoorlaccarocouuaoorcolloucraoaaoocrocalrulcrcaurcuccoolrouuocacaooaucauualcucuoucucclolcllloocuarcoorlaccarocouuaoorcolloucraoaaoocrocalrulcrcaurcuccoolrouuocacaooaucauualcucuoucucclolcllloocuarcoorlaccarocouuaoorcolloucraoaaoocrocalrulcrcaurcuccoolrouuocacaooaucauualcucuoucucclolcllloocuarcoorlaccarocouuaoorcolloucraoaaoocrocalrulcrcaurcuccoolrouuocacaooaucauualcucuoucucclolcllloocuarcoorlaccarocouuaoorcolloucraoaaoocrocalrulcrcaurcuccoolrouuocacaooaucauualcucuoucucclolcllloocuarcoorlaccarocouuaoorcolloucraoaaoocrocalrulcrcaurcuccoolrouuocacaooaucauualcucuoucucclolcllloocuarcoorlaccarocouuaoorcolloucraoaaoocrocalrulcrcaurcuccoolrouuocacaooaucauualcucuoucucclolcllloocuarcoorlaccarocouuaoorcolloucraoaaoocrocalrulcrcaurcuccoolrouuocacaooaucauualcucuoucucclolcllloocuarcoorlaccarocouuaoorcolloucraoaaoocrocalrulcrcaurcuccoolrouuocacaooaucauualcucuoucucclolcllloocuarcoorlaccarocouuaoorcolloucraoaaoocrocalrulcrcaurcuccoolrouuocacaooaucauualcucuoucucclolcllloocuarcoorlaccarocouuaoorcolloucraoaaoocrocalrulcrcaurcuccoolrouuocacaooaucauualcucuoucucclolcllloocuarcoorlaccarocouuaoorcolloucraoaaoocrocalrulcrcaurcuccoolrouuocacaooaucauualcucuoucucclolcllloocuarcoorlaccarocouuaoorcolloucraoaaoocrocalrulcrcaurcuccoolrouuocacaooaucauualcucuoucucclolcllloocuarcoorlaccarocouuaoorcolloucraoaaoocrocalrulcrcaurcuccoolrouuocacaooaucauualcucuoucucclolcllloocuarcoorlaccarocouuaoorcolloucraoaaoocrocalrulcrcaurcuccoolrouuocacaooaucauualcucuoucucclolcllloocuarcoorlaccarocouuaoorcolloucraoaaoocrocalrulcrcaurcuccoolrouuocacaooaucauualcucuoucucclolcllloocuarcoorlaccarocouuaoorcolloucraoaaoocrocalrulcrcaurcuccoolrouuocacaooaucauualcucuoucucclolcllloocuarcoorlaccarocouuaoorcolloucraoaaoocrocalrulcrcaurcuccoolrouuocacaooaucauualcucuoucucclolcllloocuarcoorlaccarocouuaoorcolloucraoaaoocrocalrulcrcaurcuccoolrouuocacaooaucauualcucuoucucclolcllloocuarcoorlaccarocouuaoorcolloucraoaaoocrocalrulcrcaurcuccoolrouuocacaooaucauualcucuoucucclolcllloocuarcoorlaccarocouuaoorcolloucraoaaoocrocalrulcrcaurcuccoolrouuocacaooaucauualcucuoucucclolcllloocuarcoorlaccarocouuaoorcolloucraoaaoocrocalrulcrcaurcuccoolrouuocacaooaucauualcucuoucucclolcllloocuarcoorlaccarocouuaoorcolloucraoaaoocrocalrulcrcaurcuccoolrouuocacaooaucauualcucuoucucclolcllloocuarcoorlaccarocouuaoorcolloucraoaaoocrocalrulcrcaurcuccoolrouuocacaooaucauualcucuoucucclolcllloocuarcoorlaccarocouuaoorcolloucraoaaoocrocalrulcrcaurcuccoolrouuocacaooaucauualcucuoucucclolcllloocuarcoorlaccarocouuaoorcolloucraoaaoocrocalrulcrcaurcuccoolrouuocacaooaucauualcucuoucucclolcllloocuarcoorlaccarocouuaoorcolloucraoaaoocrocalrulcrcaurcuccoolrouuocacaooaucauualcucuoucucclolcllloocuarcoorlaccarocouuaoorcolloucraoaaoocrocalrulcrcaurcuccoolrouuocacaooaucauualcucuoucucclolcllloocuarcoorlaccarocouuaoorcolloucraoaaoocrocalrulcrcaurcuccoolrouuocacaooaucauualcucuoucucclolcllloocuarcoorlaccarocouuaoorcolloucraoaaoocrocalrulcrcaurcuccoolrouuocacaooaucauualcucuoucucclolcllloocuarcoorlaccarocouuaoorcolloucraoaaoocrocalrulcrcaurcuccoolrouuocacaooaucauualcucuoucucclolcllloocuarcoorlaccarocouuaoorcolloucraoaaoocrocalrulcrcaurcuccoolrouuocacaooaucauualcucuoucucclolcllloocuarcoorlaccarocouuaoorcolloucraoaaoocrocalrulcrcaurcuccoolrouuocacaooaucauualcucuoucucclolcllloocuarcoorlaccarocouuaoorcolloucraoaaoocrocalrulcrcaurcuccoolrouuocacaooaucauualcucuoucucclolcllloocuarcoorlaccarocouuaoorcolloucraoaaoocrocalrulcrcaurcuccoolrouuocacaooaucauualcucuoucucclolcllloocuarcoorlaccarocouuaoorcolloucraoaaoocrocalrulcrcaurcuccoolrouuocacaooaucauualcucuoucucclolcllloocuarcoorlaccarocouuaoorcolloucraoaaoocrocalrulcrcaurcuccoolrouuocacaooaucauualcucuoucucclolcllloocuarcoorlaccarocouuaoorcolloucraoaaoocrocalrulcrcaurcuccoolrouuocacaooaucauualcucuoucucclolcllloocuarcoorlaccarocouuaoorcolloucraoaaoocrocalrulcrcaurcuccoolrouuocacaooaucauualcucuoucucclolcllloocuarcoorlaccarocouuaoorcolloucraoaaoocrocalrulcrcaurcuccoolrouuocacaooaucauualcucuoucucclolcllloocuarcoorlaccarocouuaoorcolloucraoaaoocrocalrulcrcaurcuccoolrouuocacaooaucauualcucuoucucclolcllloocuarcoorlaccarocouuaoorcolloucraoaaoocrocalrulcrcaurcuccoolrouuocacaooaucauualcucuoucucclolcllloocuarcoorlaccarocouuaoorcolloucraoaaoocrocalrulcrcaurcuccoolrouuocacaooaucauualcucuoucucclolcllloocuarcoorlaccarocouuaoorcolloucraoaaoocrocalrulcrcaurcuccoolrouuocacaooaucauualcucuoucucclolcllloocuarcoorlaccarocouuaoorcolloucraoaaoocrocalrulcrcaurcuccoolrouuocacaooaucauualcucuoucucclolcllloocuarcoorlaccarocouuaoorcolloucraoaaoocrocalrulcrcaurcuccoolrouuocacaooaucauualcucuoucucclolcllloocuarcoorlaccarocouuaoorcolloucraoaaoocrocalrulcrcaurcuccoolrouuocacaooaucauualcucuoucucclolcllloocuarcoorlaccarocouuaoorcolloucraoaaoocrocalrulcrcaurcuccoolrouuocacaooaucauualcucuoucucclolcllloocuarcoorlaccarocouuaoorcolloucraoaaoocrocalrulcrcaurcuccoolrouuocacaooaucauualcucuoucucclolcllloocuarcoorlaccarocouuaoorcolloucraoaaoocrocalrulcrcaurcuccoolrouuocacaooaucauualcucuoucucclolcllloocuarcoorlaccarocouuaoorcolloucraoaaoocrocalrulcrcaurcuccoolrouuocacaooaucauualcucuoucucclolcllloocuarcoorlaccarocouuaoorcolloucraoaaoocrocalrulcrcaurcuccoolrouuocacaooaucauualcucuoucucclolcllloocuarcoorlaccarocouuaoorcolloucraoaaoocrocalrulcrcaurcuccoolrouuocacaooaucauualcucuoucucclolcllloocuarcoorlaccarocouuaoorcolloucraoaaoocrocalrulcrcaurcuccoolrouuocacaooaucauualcucuoucucclolcllloocuarcoorlaccarocouuaoorcolloucraoaaoocrocalrulcrcaurcuccoolrouuocacaooaucauualcucuoucucclolcllloocuarcoorlaccarocouuaoorcolloucraoaaoocrocalrulcrcaurcuccoolrouuocacaooaucauualcucuoucucclolcllloocuarcoorlaccarocouuaoorcolloucraoaaoocrocalrulcrcaurcuccoolrouuocacaooaucauualcucuoucucclolcllloocuarcoorlaccarocouuaoorcolloucraoaaoocrocalrulcrcaurcuccoolrouuocacaooaucauualcucuoucucclolcllloocuarcoorlaccarocouuaoorcolloucraoaaoocrocalrulcrcaurcuccoolrouuocacaooaucauualcucuoucucclolcllloocuarcoorlaccarocouuaoorcolloucraoaaoocrocalrulcrcaurcuccoolrouuocacaooaucauualcucuoucucclolcllloocuarcoorlaccarocouuaoorcolloucraoaaoocrocalrulcrcaurcuccoolrouuocacaooaucauualcucuoucucclolcllloocuarcoorlaccarocouuaoorcolloucraoaaoocrocalrulcrcaurcuccoolrouuocacaooaucauualcucuoucucclolcllloocuarcoorlaccarocouuaoorcolloucraoaaoocrocalrulcrcaurcuccoolrouuocacaooaucauualcucuoucucclolcllloocuarcoorlaccarocouuaoorcolloucraoaaoocrocalrulcrcaurcuccoolrouuocacaooaucauualcucuoucucclolcllloocuarcoorlaccarocouuaoorcolloucraoaaoocrocalrulcrcaurcuccoolrouuocacaooaucauualcucuoucucclolcllloocuarcoorlaccarocouuaoorcolloucraoaaooc	0.366710324443464crllooolarlollorlulololucrluacoorrrluroluroocouauacacruloulcurlraorcrclrolcocrrcoccolourrooclrcocruruauallo0.366710324443464crllooolarlollorlulololucrluacoorrrluroluroocouauacacruloulcurlraorcrclrolcocrrcoccolourrooclrcocruruauallo0.366710324443464crllooolarlollorlulololucrluacoorrrluroluroocouauacacruloulcurlraorcrclrolcocrrcoccolourrooclrcocruruauallo0.366710324443464crllooolarlollorlulololucrluacoorrrluroluroocouauacacruloulcurlraorcrclrolcocrrcoccolourrooclrcocruruauallo0.366710324443464crllooolarlollorlulololucrluacoorrrluroluroocouauacacruloulcurlraorcrclrolcocrrcoccolourrooclrcocruruauallo0.366710324443464crllooolarlollorlulololucrluacoorrrluroluroocouauacacruloulcurlraorcrclrolcocrrcoccolourrooclrcocruruauallo0.366710324443464crllooolarlollorlulololucrluacoorrrluroluroocouauacacruloulcurlraorcrclrolcocrrcoccolourrooclrcocruruauallo0.366710324443464crllooolarlollorlulololucrluacoorrrluroluroocouauacacruloulcurlraorcrclrolcocrrcoccolourrooclrcocruruauallo0.366710324443464crllooolarlollorlulololucrluacoorrrluroluroocouauacacruloulcurlraorcrclrolcocrrcoccolourrooclrcocruruauallo0.366710324443464crllooolarlollorlulololucrluacoorrrluroluroocouauacacruloulcurlraorcrclrolcocrrcoccolourrooclrcocruruauallo0.366710324443464crllooolarlollorlulololucrluacoorrrluroluroocouauacacruloulcurlraorcrclrolcocrrcoccolourrooclrcocruruauallo0.366710324443464crllooolarlollorlulololucrluacoorrrluroluroocouauacacruloulcurlraorcrclrolcocrrcoccolourrooclrcocruruauallo0.366710324443464crllooolarlollorlulololucrluacoorrrluroluroocouauacacruloulcurlraorcrclrolcocrrcoccolourrooclrcocruruauallo0.366710324443464crllooolarlollorlulololucrluacoorrrluroluroocouauacacruloulcurlraorcrclrolcocrrcoccolourrooclrcocruruauallo0.366710324443464crllooolarlollorlulololucrluacoorrrluroluroocouauacacruloulcurlraorcrclrolcocrrcoccolourrooclrcocruruauallo0.366710324443464crllooolarlollorlulololucrluacoorrrluroluroocouauacacruloulcurlraorcrclrolcocrrcoccolourrooclrcocruruauallo0.366710324443464crllooolarlollorlulololucrluacoorrrluroluroocouauacacruloulcurlraorcrclrolcocrrcoccolourrooclrcocruruauallo0.366710324443464crllooolarlollorlulololucrluacoorrrluroluroocouauacacruloulcurlraorcrclrolcocrrcoccolourrooclrcocruruauallo0.366710324443464crllooolarlollorlulololucrluacoorrrluroluroocouauacacruloulcurlraorcrclrolcocrrcoccolourrooclrcocruruauallo0.366710324443464crllooolarlollorlulololucrluacoorrrluroluroocouauacacruloulcurlraorcrclrolcocrrcoccolourrooclrcocruruauallo0.366710324443464crllooolarlollorlulololucrluacoorrrluroluroocouauacacruloulcurlraorcrclrolcocrrcoccolourrooclrcocruruauallo0.366710324443464crllooolarlollorlulololucrluacoorrrluroluroocouauacacruloulcurlraorcrclrolcocrrcoccolourrooclrcocruruauallo0.366710324443464crllooolarlollorlulololucrluacoorrrluroluroocouauacacruloulcurlraorcrclrolcocrrcoccolourrooclrcocruruauallo0.366710324443464crllooolarlollorlulololucrluacoorrrluroluroocouauacacruloulcurlraorcrclrolcocrrcoccolourrooclrcocruruauallo0.366710324443464crllooolarlollorlulololucrluacoorrrluroluroocouauacacruloulcurlraorcrclrolcocrrcoccolourrooclrcocruruauallo0.366710324443464crllooolarlollorlulololucrluacoorrrluroluroocouauacacruloulcurlraorcrclrolcocrrcoccolourrooclrcocruruauallo0.366710324443464crllooolarlollorlulololucrluacoorrrluroluroocouauacacruloulcurlraorcrclrolcocrrcoccolourrooclrcocruruauallo0.366710324443464crllooolarlollorlulololucrluacoorrrluroluroocouauacacruloulcurlraorcrclrolcocrrcoccolourrooclrcocruruauallo0.366710324443464crllooolarlollorlulololucrluacoorrrluroluroocouauacacruloulcurlraorcrclrolcocrrcoccolourrooclrcocruruauallo0.366710324443464crllooolarlollorlulololucrluacoorrrluroluroocouauacacruloulcurlraorcrclrolcocrrcoccolourrooclrcocruruauallo0.366710324443464crllooolarlollorlulololucrluacoorrrluroluroocouauacacruloulcurlraorcrclrolcocrrcoccolourrooclrcocruruauallo0.366710324443464crllooolarlollorlulololucrluacoorrrluroluroocouauacacruloulcurlraorcrclrolcocrrcoccolourrooclrcocruruauallo0.366710324443464crllooolarlollorlulololucrluacoorrrluroluroocouauacacruloulcurlraorcrclrolcocrrcoccolourrooclrcocruruauallo0.366710324443464crllooolarlollorlulololucrluacoorrrluroluroocouauacacruloulcurlraorcrclrolcocrrcoccolourrooclrcocruruauallo0.366710324443464crllooolarlollorlulololucrluacoorrrluroluroocouauacacruloulcurlraorcrclrolcocrrcoccolourrooclrcocruruauallo0.366710324443464crllooolarlollorlulololucrluacoorrrluroluroocouauacacruloulcurlraorcrclrolcocrrcoccolourrooclrcocruruauallo0.366710324443464crllooolarlollorlulololucrluacoorrrluroluroocouauacacruloulcurlraorcrclrolcocrrcoccolourrooclrcocruruauallo0.366710324443464crllooolarlollorlulololucrluacoorrrluroluroocouauacacruloulcurlraorcrclrolcocrrcoccolourrooclrcocruruauallo0.366710324443464crllooolarlollorlulololucrluacoorrrluroluroocouauacacruloulcurlraorcrclrolcocrrcoccolourrooclrcocruruauallo0.366710324443464crllooolarlollorlulololucrluacoorrrluroluroocouauacacruloulcurlraorcrclrolcocrrcoccolourrooclrcocruruauallo0.366710324443464crllooolarlollorlulololucrluacoorrrluroluroocouauacacruloulcurlraorcrclrolcocrrcoccolourrooclrcocruruauallo0.366710324443464crllooolarlollorlulololucrluacoorrrluroluroocouauacacruloulcurlraorcrclrolcocrrcoccolourrooclrcocruruauallo0.366710324443464crllooolarlollorlulololucrluacoorrrluroluroocouauacacruloulcurlraorcrclrolcocrrcoccolourrooclrcocruruauallo0.366710324443464crllooolarlollorlulololucrluacoorrrluroluroocouauacacruloulcurlraorcrclrolcocrrcoccolourrooclrcocruruauallo0.366710324443464crllooolarlollorlulololucrluacoorrrluroluroocouauacacruloulcurlraorcrclrolcocrrcoccolourrooclrcocruruauallo0.366710324443464crllooolarlollorlulololucrluacoorrrluroluroocouauacacruloulcurlraorcrclrolcocrrcoccolourrooclrcocruruauallo0.366710324443464crllooolarlollorlulololucrluacoorrrluroluroocouauacacruloulcurlraorcrclrolcocrrcoccolourrooclrcocruruauallo0.366710324443464crllooolarlollorlulololucrluacoorrrluroluroocouauacacruloulcurlraorcrclrolcocrrcoccolourrooclrcocruruauallo0.366710324443464crllooolarlollorlulololucrluacoorrrluroluroocouauacacruloulcurlraorcrclrolcocrrcoccolourrooclrcocruruauallo0.366710324443464crllooolarlollorlulololucrluacoorrrluroluroocouauacacruloulcurlraorcrclrolcocrrcoccolourrooclrcocruruauallo0.366710324443464crllooolarlollorlulololucrluacoorrrluroluroocouauacacruloulcurlraorcrclrolcocrrcoccolourrooclrcocruruauallo0.366710324443464crllooolarlollorlulololucrluacoorrrluroluroocouauacacruloulcurlraorcrclrolcocrrcoccolourrooclrcocruruauallo0.366710324443464crllooolarlollorlulololucrluacoorrrluroluroocouauacacruloulcurlraorcrclrolcocrrcoccolourrooclrcocruruauallo0.366710324443464crllooolarlollorlulololucrluacoorrrluroluroocouauacacruloulcurlraorcrclrolcocrrcoccolourrooclrcocruruauallo0.366710324443464crllooolarlollorlulololucrluacoorrrluroluroocouauacacruloulcurlraorcrclrolcocrrcoccolourrooclrcocruruauallo0.366710324443464crllooolarlollorlulololucrluacoorrrluroluroocouauacacruloulcurlraorcrclrolcocrrcoccolourrooclrcocruruauallo0.366710324443464crllooolarlollorlulololucrluacoorrrluroluroocouauacacruloulcurlraorcrclrolcocrrcoccolourrooclrcocruruauallo0.366710324443464crllooolarlollorlulololucrluacoorrrluroluroocouauacacruloulcurlraorcrclrolcocrrcoccolourrooclrcocruruauallo0.366710324443464crllooolarlollorlulololucrluacoorrrluroluroocouauacacruloulcurlraorcrclrolcocrrcoccolourrooclrcocruruauallo0.366710324443464crllooolarlollorlulololucrluacoorrrluroluroocouauacacruloulcurlraorcrclrolcocrrcoccolourrooclrcocruruauallo0.366710324443464crllooolarlollorlulololucrluacoorrrluroluroocouauacacruloulcurlraorcrclrolcocrrcoccolourrooclrcocruruauallo0.366710324443464crllooolarlollorlulololucrluacoorrrluroluroocouauacacruloulcurlraorcrclrolcocrrcoccolourrooclrcocruruauallo0.366710324443464crllooolarlollorlulololucrluacoorrrluroluroocouauacacruloulcurlraorcrclrolcocrrcoccolourrooclrcocruruauallo0.366710324443464crllooolarlollorlulololucrluacoorrrluroluroocouauacacruloulcurlraorcrclrolcocrrcoccolourrooclrcocruruauallo0.366710324443464crllooolarlollorlulololucrluacoorrrluroluroocouauacacruloulcurlraorcrclrolcocrrcoccolourrooclrcocruruauallo0.366710324443464crllooolarlollorlulololucrluacoorrrluroluroocouauacacruloulcurlraorcrclrolcocrrcoccolourrooclrcocruruauallo0.366710324443464crllooolarlollorlulololucrluacoorrrluroluroocouauacacruloulcurlraorcrclrolcocrrcoccolourrooclrcocruruauallo0.366710324443464crllooolarlollorlulololucrluacoorrrluroluroocouauacacruloulcurlraorcrclrolcocrrcoccolourrooclrcocruruauallo0.366710324443464crllooolarlollorlulololucrluacoorrrluroluroocouauacacruloulcurlraorcrclrolcocrrcoccolourrooclrcocruruauallo0.366710324443464crllooolarlollorlulololucrluacoorrrluroluroocouauacacruloulcurlraorcrclrolcocrrcoccolourrooclrcocruruauallo	3	oc	roc
DROP TABLE ibstd_07;
SET DEBUG_SYNC = 'RESET';
