include/rpl/init_source_replica.inc
Warnings:
Note	####	Sending passwords in plain text without SSL/TLS is extremely insecure.
Note	####	Storing MySQL user name or password information in the connection metadata repository is not secure and is therefore not recommended. Please consider using the USER and PASSWORD connection options for START REPLICA; see the 'START REPLICA Syntax' in the MySQL Manual for more information.
[connection master]
create table t1
(id varchar(50) NOT NULL,
str varchar(50) NOT NULL,
primary key (`id`,`str`))
engine = ndb default charset=latin1;
insert into t1(id, str) values ("1","one                   ");
select "'one' IS EQUAL 'one  ...'" from dual where "one" = "one      ";
'one' IS EQUAL 'one  ...'
select concat("<<<",str,">>>") from t1 where str = "one" and id="1";
concat("<<<",str,">>>")
<<<one                   >>>
select concat("<<<",str,">>>") from t1 where str = "one";
concat("<<<",str,">>>")
<<<one                   >>>
Check content on replica
select concat("<<<",str,">>>") from t1 where str = "one" and id="1";
concat("<<<",str,">>>")
<<<one                   >>>
select concat("<<<",str,">>>") from t1 where str = "one";
concat("<<<",str,">>>")
<<<one                   >>>
Update content on primary, remove trailing spaces
update t1 set str="one" where id="1";
select concat("<<<",str,">>>") from t1;
concat("<<<",str,">>>")
<<<one>>>
Verify the replica update, no trailing spaces anymore!
select concat("<<<",str,">>>") from t1;
concat("<<<",str,">>>")
<<<one>>>
Double check: Primary update it back to original value
update t1 set str="one                   " where id="1";
select concat("<<<",str,">>>") from t1;
concat("<<<",str,">>>")
<<<one                   >>>
Verify the replica update, see trailing space again
select concat("<<<",str,">>>") from t1;
concat("<<<",str,">>>")
<<<one                   >>>
drop table t1;
##########################################
# bug#34388068 NDB:Update to char data type columns in
#              primay keys are lost on replica.
set global ndb_log_updated_only=0;
set global ndb_log_update_as_write=0;
set global ndb_log_update_minimal=0;


#####################################
show variables like 'ndb_log_update_%';
Variable_name	Value
ndb_log_update_as_write	OFF
ndb_log_update_minimal	OFF
ndb_log_updated_only	OFF
#####################################
############## Varchar ##############
create table t1(str varchar(32) primary key) engine = ndb;
Insert space padded row, then update it to non-padded
insert into t1(str) values ("one        ");
update t1 set str="one";
Verify the replica update, no trailing spaces anymore!
select concat("<<<",str,">>>") from t1;
concat("<<<",str,">>>")
<<<one>>>
drop table t1;
#########################################
############## Longvarchar ##############
create table t1(str varchar(512) primary key) engine = ndb;
Insert space padded row, then update it to non-padded
insert into t1(str) values ("one        ");
update t1 set str="one";
Verify the replica update, no trailing spaces anymore!
select concat("<<<",str,">>>") from t1;
concat("<<<",str,">>>")
<<<one>>>
drop table t1;
#####################################
############ Varbinary ##############
create table t1(str varbinary(32) primary key) engine = ndb;
Insert space padded row, then update it to non-padded
insert into t1(str) values ("one        ");
update t1 set str="one";
Verify the replica update, no trailing spaces anymore!
select concat("<<<",str,">>>") from t1;
concat("<<<",str,">>>")
<<<one>>>
drop table t1;
##########################################################
# Lower and upper case are compared as equal.
# Binary representation are unequal though, and update
# Need to be propogated to replica even when the 'after' images
# are 'compared-equal'.
# Tests inserts 'xyz', then update it to 'XYZ'.
# Check that rows are updated on replica as well.

#####################################
############## Varchar ##############
create table t1(str varchar(32) primary key) engine = ndb;
Insert 'xyz', then update varchar(32) to 'XYZ'
insert into t1(str) values ("xyz");
update t1 set str="XYZ";
Verify the replica updated varchar(32) to 'XYZ' as well
select str from t1;
str
XYZ
drop table t1;
##################################
############## Char ##############
create table t1(str char(32) primary key) engine = ndb;
Insert 'xyz', then update char(32) to 'XYZ'
insert into t1(str) values ("xyz");
update t1 set str="XYZ";
Verify the replica updated char(32) to 'XYZ' as well
select str from t1;
str
XYZ
drop table t1;
##################################
############ Varbinary ###########
create table t1(str varbinary(32) primary key) engine = ndb;
Insert 'xyz', then update varbinary(32) to 'XYZ'
insert into t1(str) values ("xyz");
update t1 set str="XYZ";
Verify the replica updated varbinary(32) to 'XYZ' as well
select str from t1;
str
XYZ
drop table t1;
set global ndb_log_updated_only=1;
set global ndb_log_update_as_write=0;
set global ndb_log_update_minimal=0;


#####################################
show variables like 'ndb_log_update_%';
Variable_name	Value
ndb_log_update_as_write	OFF
ndb_log_update_minimal	OFF
ndb_log_updated_only	ON
#####################################
############## Varchar ##############
create table t1(str varchar(32) primary key) engine = ndb;
Insert space padded row, then update it to non-padded
insert into t1(str) values ("one        ");
update t1 set str="one";
Verify the replica update, no trailing spaces anymore!
select concat("<<<",str,">>>") from t1;
concat("<<<",str,">>>")
<<<one>>>
drop table t1;
#########################################
############## Longvarchar ##############
create table t1(str varchar(512) primary key) engine = ndb;
Insert space padded row, then update it to non-padded
insert into t1(str) values ("one        ");
update t1 set str="one";
Verify the replica update, no trailing spaces anymore!
select concat("<<<",str,">>>") from t1;
concat("<<<",str,">>>")
<<<one>>>
drop table t1;
#####################################
############ Varbinary ##############
create table t1(str varbinary(32) primary key) engine = ndb;
Insert space padded row, then update it to non-padded
insert into t1(str) values ("one        ");
update t1 set str="one";
Verify the replica update, no trailing spaces anymore!
select concat("<<<",str,">>>") from t1;
concat("<<<",str,">>>")
<<<one>>>
drop table t1;
##########################################################
# Lower and upper case are compared as equal.
# Binary representation are unequal though, and update
# Need to be propogated to replica even when the 'after' images
# are 'compared-equal'.
# Tests inserts 'xyz', then update it to 'XYZ'.
# Check that rows are updated on replica as well.

#####################################
############## Varchar ##############
create table t1(str varchar(32) primary key) engine = ndb;
Insert 'xyz', then update varchar(32) to 'XYZ'
insert into t1(str) values ("xyz");
update t1 set str="XYZ";
Verify the replica updated varchar(32) to 'XYZ' as well
select str from t1;
str
XYZ
drop table t1;
##################################
############## Char ##############
create table t1(str char(32) primary key) engine = ndb;
Insert 'xyz', then update char(32) to 'XYZ'
insert into t1(str) values ("xyz");
update t1 set str="XYZ";
Verify the replica updated char(32) to 'XYZ' as well
select str from t1;
str
XYZ
drop table t1;
##################################
############ Varbinary ###########
create table t1(str varbinary(32) primary key) engine = ndb;
Insert 'xyz', then update varbinary(32) to 'XYZ'
insert into t1(str) values ("xyz");
update t1 set str="XYZ";
Verify the replica updated varbinary(32) to 'XYZ' as well
select str from t1;
str
XYZ
drop table t1;
set global ndb_log_updated_only=0;
set global ndb_log_update_as_write=1;
set global ndb_log_update_minimal=0;


#####################################
show variables like 'ndb_log_update_%';
Variable_name	Value
ndb_log_update_as_write	ON
ndb_log_update_minimal	OFF
ndb_log_updated_only	OFF
#####################################
############## Varchar ##############
create table t1(str varchar(32) primary key) engine = ndb;
Insert space padded row, then update it to non-padded
insert into t1(str) values ("one        ");
update t1 set str="one";
Verify the replica update, no trailing spaces anymore!
select concat("<<<",str,">>>") from t1;
concat("<<<",str,">>>")
<<<one>>>
drop table t1;
#########################################
############## Longvarchar ##############
create table t1(str varchar(512) primary key) engine = ndb;
Insert space padded row, then update it to non-padded
insert into t1(str) values ("one        ");
update t1 set str="one";
Verify the replica update, no trailing spaces anymore!
select concat("<<<",str,">>>") from t1;
concat("<<<",str,">>>")
<<<one>>>
drop table t1;
#####################################
############ Varbinary ##############
create table t1(str varbinary(32) primary key) engine = ndb;
Insert space padded row, then update it to non-padded
insert into t1(str) values ("one        ");
update t1 set str="one";
Verify the replica update, no trailing spaces anymore!
select concat("<<<",str,">>>") from t1;
concat("<<<",str,">>>")
<<<one>>>
drop table t1;
##########################################################
# Lower and upper case are compared as equal.
# Binary representation are unequal though, and update
# Need to be propogated to replica even when the 'after' images
# are 'compared-equal'.
# Tests inserts 'xyz', then update it to 'XYZ'.
# Check that rows are updated on replica as well.

#####################################
############## Varchar ##############
create table t1(str varchar(32) primary key) engine = ndb;
Insert 'xyz', then update varchar(32) to 'XYZ'
insert into t1(str) values ("xyz");
update t1 set str="XYZ";
Verify the replica updated varchar(32) to 'XYZ' as well
select str from t1;
str
XYZ
drop table t1;
##################################
############## Char ##############
create table t1(str char(32) primary key) engine = ndb;
Insert 'xyz', then update char(32) to 'XYZ'
insert into t1(str) values ("xyz");
update t1 set str="XYZ";
Verify the replica updated char(32) to 'XYZ' as well
select str from t1;
str
XYZ
drop table t1;
##################################
############ Varbinary ###########
create table t1(str varbinary(32) primary key) engine = ndb;
Insert 'xyz', then update varbinary(32) to 'XYZ'
insert into t1(str) values ("xyz");
update t1 set str="XYZ";
Verify the replica updated varbinary(32) to 'XYZ' as well
select str from t1;
str
XYZ
drop table t1;
set global ndb_log_updated_only=1;
set global ndb_log_update_as_write=1;
set global ndb_log_update_minimal=0;


#####################################
show variables like 'ndb_log_update_%';
Variable_name	Value
ndb_log_update_as_write	ON
ndb_log_update_minimal	OFF
ndb_log_updated_only	ON
#####################################
############## Varchar ##############
create table t1(str varchar(32) primary key) engine = ndb;
Insert space padded row, then update it to non-padded
insert into t1(str) values ("one        ");
update t1 set str="one";
Verify the replica update, no trailing spaces anymore!
select concat("<<<",str,">>>") from t1;
concat("<<<",str,">>>")
<<<one>>>
drop table t1;
#########################################
############## Longvarchar ##############
create table t1(str varchar(512) primary key) engine = ndb;
Insert space padded row, then update it to non-padded
insert into t1(str) values ("one        ");
update t1 set str="one";
Verify the replica update, no trailing spaces anymore!
select concat("<<<",str,">>>") from t1;
concat("<<<",str,">>>")
<<<one>>>
drop table t1;
#####################################
############ Varbinary ##############
create table t1(str varbinary(32) primary key) engine = ndb;
Insert space padded row, then update it to non-padded
insert into t1(str) values ("one        ");
update t1 set str="one";
Verify the replica update, no trailing spaces anymore!
select concat("<<<",str,">>>") from t1;
concat("<<<",str,">>>")
<<<one>>>
drop table t1;
##########################################################
# Lower and upper case are compared as equal.
# Binary representation are unequal though, and update
# Need to be propogated to replica even when the 'after' images
# are 'compared-equal'.
# Tests inserts 'xyz', then update it to 'XYZ'.
# Check that rows are updated on replica as well.

#####################################
############## Varchar ##############
create table t1(str varchar(32) primary key) engine = ndb;
Insert 'xyz', then update varchar(32) to 'XYZ'
insert into t1(str) values ("xyz");
update t1 set str="XYZ";
Verify the replica updated varchar(32) to 'XYZ' as well
select str from t1;
str
XYZ
drop table t1;
##################################
############## Char ##############
create table t1(str char(32) primary key) engine = ndb;
Insert 'xyz', then update char(32) to 'XYZ'
insert into t1(str) values ("xyz");
update t1 set str="XYZ";
Verify the replica updated char(32) to 'XYZ' as well
select str from t1;
str
XYZ
drop table t1;
##################################
############ Varbinary ###########
create table t1(str varbinary(32) primary key) engine = ndb;
Insert 'xyz', then update varbinary(32) to 'XYZ'
insert into t1(str) values ("xyz");
update t1 set str="XYZ";
Verify the replica updated varbinary(32) to 'XYZ' as well
select str from t1;
str
XYZ
drop table t1;
set global ndb_log_updated_only=0;
set global ndb_log_update_as_write=1;
set global ndb_log_update_minimal=1;


#####################################
show variables like 'ndb_log_update_%';
Variable_name	Value
ndb_log_update_as_write	ON
ndb_log_update_minimal	ON
ndb_log_updated_only	OFF
#####################################
############## Varchar ##############
create table t1(str varchar(32) primary key) engine = ndb;
Insert space padded row, then update it to non-padded
insert into t1(str) values ("one        ");
update t1 set str="one";
Verify the replica update, no trailing spaces anymore!
select concat("<<<",str,">>>") from t1;
concat("<<<",str,">>>")
<<<one>>>
drop table t1;
#########################################
############## Longvarchar ##############
create table t1(str varchar(512) primary key) engine = ndb;
Insert space padded row, then update it to non-padded
insert into t1(str) values ("one        ");
update t1 set str="one";
Verify the replica update, no trailing spaces anymore!
select concat("<<<",str,">>>") from t1;
concat("<<<",str,">>>")
<<<one>>>
drop table t1;
#####################################
############ Varbinary ##############
create table t1(str varbinary(32) primary key) engine = ndb;
Insert space padded row, then update it to non-padded
insert into t1(str) values ("one        ");
update t1 set str="one";
Verify the replica update, no trailing spaces anymore!
select concat("<<<",str,">>>") from t1;
concat("<<<",str,">>>")
<<<one>>>
drop table t1;
##########################################################
# Lower and upper case are compared as equal.
# Binary representation are unequal though, and update
# Need to be propogated to replica even when the 'after' images
# are 'compared-equal'.
# Tests inserts 'xyz', then update it to 'XYZ'.
# Check that rows are updated on replica as well.

#####################################
############## Varchar ##############
create table t1(str varchar(32) primary key) engine = ndb;
Insert 'xyz', then update varchar(32) to 'XYZ'
insert into t1(str) values ("xyz");
update t1 set str="XYZ";
Verify the replica updated varchar(32) to 'XYZ' as well
select str from t1;
str
XYZ
drop table t1;
##################################
############## Char ##############
create table t1(str char(32) primary key) engine = ndb;
Insert 'xyz', then update char(32) to 'XYZ'
insert into t1(str) values ("xyz");
update t1 set str="XYZ";
Verify the replica updated char(32) to 'XYZ' as well
select str from t1;
str
XYZ
drop table t1;
##################################
############ Varbinary ###########
create table t1(str varbinary(32) primary key) engine = ndb;
Insert 'xyz', then update varbinary(32) to 'XYZ'
insert into t1(str) values ("xyz");
update t1 set str="XYZ";
Verify the replica updated varbinary(32) to 'XYZ' as well
select str from t1;
str
XYZ
drop table t1;
set global ndb_log_updated_only=1;
set global ndb_log_update_as_write=1;
set global ndb_log_update_minimal=1;


#####################################
show variables like 'ndb_log_update_%';
Variable_name	Value
ndb_log_update_as_write	ON
ndb_log_update_minimal	ON
ndb_log_updated_only	ON
#####################################
############## Varchar ##############
create table t1(str varchar(32) primary key) engine = ndb;
Insert space padded row, then update it to non-padded
insert into t1(str) values ("one        ");
update t1 set str="one";
Verify the replica update, no trailing spaces anymore!
select concat("<<<",str,">>>") from t1;
concat("<<<",str,">>>")
<<<one>>>
drop table t1;
#########################################
############## Longvarchar ##############
create table t1(str varchar(512) primary key) engine = ndb;
Insert space padded row, then update it to non-padded
insert into t1(str) values ("one        ");
update t1 set str="one";
Verify the replica update, no trailing spaces anymore!
select concat("<<<",str,">>>") from t1;
concat("<<<",str,">>>")
<<<one>>>
drop table t1;
#####################################
############ Varbinary ##############
create table t1(str varbinary(32) primary key) engine = ndb;
Insert space padded row, then update it to non-padded
insert into t1(str) values ("one        ");
update t1 set str="one";
Verify the replica update, no trailing spaces anymore!
select concat("<<<",str,">>>") from t1;
concat("<<<",str,">>>")
<<<one>>>
drop table t1;
##########################################################
# Lower and upper case are compared as equal.
# Binary representation are unequal though, and update
# Need to be propogated to replica even when the 'after' images
# are 'compared-equal'.
# Tests inserts 'xyz', then update it to 'XYZ'.
# Check that rows are updated on replica as well.

#####################################
############## Varchar ##############
create table t1(str varchar(32) primary key) engine = ndb;
Insert 'xyz', then update varchar(32) to 'XYZ'
insert into t1(str) values ("xyz");
update t1 set str="XYZ";
Verify the replica updated varchar(32) to 'XYZ' as well
select str from t1;
str
XYZ
drop table t1;
##################################
############## Char ##############
create table t1(str char(32) primary key) engine = ndb;
Insert 'xyz', then update char(32) to 'XYZ'
insert into t1(str) values ("xyz");
update t1 set str="XYZ";
Verify the replica updated char(32) to 'XYZ' as well
select str from t1;
str
XYZ
drop table t1;
##################################
############ Varbinary ###########
create table t1(str varbinary(32) primary key) engine = ndb;
Insert 'xyz', then update varbinary(32) to 'XYZ'
insert into t1(str) values ("xyz");
update t1 set str="XYZ";
Verify the replica updated varbinary(32) to 'XYZ' as well
select str from t1;
str
XYZ
drop table t1;
set global ndb_log_updated_only=0;
set global ndb_log_update_as_write=0;
set global ndb_log_update_minimal=1;


#####################################
show variables like 'ndb_log_update_%';
Variable_name	Value
ndb_log_update_as_write	OFF
ndb_log_update_minimal	ON
ndb_log_updated_only	OFF
#####################################
############## Varchar ##############
create table t1(str varchar(32) primary key) engine = ndb;
Insert space padded row, then update it to non-padded
insert into t1(str) values ("one        ");
update t1 set str="one";
Verify the replica update, no trailing spaces anymore!
select concat("<<<",str,">>>") from t1;
concat("<<<",str,">>>")
<<<one>>>
drop table t1;
#########################################
############## Longvarchar ##############
create table t1(str varchar(512) primary key) engine = ndb;
Insert space padded row, then update it to non-padded
insert into t1(str) values ("one        ");
update t1 set str="one";
Verify the replica update, no trailing spaces anymore!
select concat("<<<",str,">>>") from t1;
concat("<<<",str,">>>")
<<<one>>>
drop table t1;
#####################################
############ Varbinary ##############
create table t1(str varbinary(32) primary key) engine = ndb;
Insert space padded row, then update it to non-padded
insert into t1(str) values ("one        ");
update t1 set str="one";
Verify the replica update, no trailing spaces anymore!
select concat("<<<",str,">>>") from t1;
concat("<<<",str,">>>")
<<<one>>>
drop table t1;
##########################################################
# Lower and upper case are compared as equal.
# Binary representation are unequal though, and update
# Need to be propogated to replica even when the 'after' images
# are 'compared-equal'.
# Tests inserts 'xyz', then update it to 'XYZ'.
# Check that rows are updated on replica as well.

#####################################
############## Varchar ##############
create table t1(str varchar(32) primary key) engine = ndb;
Insert 'xyz', then update varchar(32) to 'XYZ'
insert into t1(str) values ("xyz");
update t1 set str="XYZ";
Verify the replica updated varchar(32) to 'XYZ' as well
select str from t1;
str
XYZ
drop table t1;
##################################
############## Char ##############
create table t1(str char(32) primary key) engine = ndb;
Insert 'xyz', then update char(32) to 'XYZ'
insert into t1(str) values ("xyz");
update t1 set str="XYZ";
Verify the replica updated char(32) to 'XYZ' as well
select str from t1;
str
XYZ
drop table t1;
##################################
############ Varbinary ###########
create table t1(str varbinary(32) primary key) engine = ndb;
Insert 'xyz', then update varbinary(32) to 'XYZ'
insert into t1(str) values ("xyz");
update t1 set str="XYZ";
Verify the replica updated varbinary(32) to 'XYZ' as well
select str from t1;
str
XYZ
drop table t1;
set global ndb_log_updated_only=1;
set global ndb_log_update_as_write=0;
set global ndb_log_update_minimal=1;


#####################################
show variables like 'ndb_log_update_%';
Variable_name	Value
ndb_log_update_as_write	OFF
ndb_log_update_minimal	ON
ndb_log_updated_only	ON
#####################################
############## Varchar ##############
create table t1(str varchar(32) primary key) engine = ndb;
Insert space padded row, then update it to non-padded
insert into t1(str) values ("one        ");
update t1 set str="one";
Verify the replica update, no trailing spaces anymore!
select concat("<<<",str,">>>") from t1;
concat("<<<",str,">>>")
<<<one>>>
drop table t1;
#########################################
############## Longvarchar ##############
create table t1(str varchar(512) primary key) engine = ndb;
Insert space padded row, then update it to non-padded
insert into t1(str) values ("one        ");
update t1 set str="one";
Verify the replica update, no trailing spaces anymore!
select concat("<<<",str,">>>") from t1;
concat("<<<",str,">>>")
<<<one>>>
drop table t1;
#####################################
############ Varbinary ##############
create table t1(str varbinary(32) primary key) engine = ndb;
Insert space padded row, then update it to non-padded
insert into t1(str) values ("one        ");
update t1 set str="one";
Verify the replica update, no trailing spaces anymore!
select concat("<<<",str,">>>") from t1;
concat("<<<",str,">>>")
<<<one>>>
drop table t1;
##########################################################
# Lower and upper case are compared as equal.
# Binary representation are unequal though, and update
# Need to be propogated to replica even when the 'after' images
# are 'compared-equal'.
# Tests inserts 'xyz', then update it to 'XYZ'.
# Check that rows are updated on replica as well.

#####################################
############## Varchar ##############
create table t1(str varchar(32) primary key) engine = ndb;
Insert 'xyz', then update varchar(32) to 'XYZ'
insert into t1(str) values ("xyz");
update t1 set str="XYZ";
Verify the replica updated varchar(32) to 'XYZ' as well
select str from t1;
str
XYZ
drop table t1;
##################################
############## Char ##############
create table t1(str char(32) primary key) engine = ndb;
Insert 'xyz', then update char(32) to 'XYZ'
insert into t1(str) values ("xyz");
update t1 set str="XYZ";
Verify the replica updated char(32) to 'XYZ' as well
select str from t1;
str
XYZ
drop table t1;
##################################
############ Varbinary ###########
create table t1(str varbinary(32) primary key) engine = ndb;
Insert 'xyz', then update varbinary(32) to 'XYZ'
insert into t1(str) values ("xyz");
update t1 set str="XYZ";
Verify the replica updated varbinary(32) to 'XYZ' as well
select str from t1;
str
XYZ
drop table t1;
set global ndb_log_updated_only=default;
set global ndb_log_update_as_write=default;
set global ndb_log_update_minimal=default;
include/rpl/deinit.inc
