include/rpl/init_source_replica.inc
Warnings:
Note	####	Sending passwords in plain text without SSL/TLS is extremely insecure.
Note	####	Storing MySQL user name or password information in the connection metadata repository is not secure and is therefore not recommended. Please consider using the USER and PASSWORD connection options for START REPLICA; see the 'START REPLICA Syntax' in the MySQL Manual for more information.
[connection master]
STOP REPLICA;
CREATE DATABASE ndbsynctest;
USE ndbsynctest;
CREATE DATABASE ndbsynctest;
USE ndbsynctest;
CREATE TABLE t1 (c1 BIT(1) NOT NULL, c2 BIT(1) NOT NULL, c3 CHAR(15), PRIMARY KEY(c3)) ENGINE = NDB ;
INSERT INTO t1 VALUES (1,1,"row1"),(0,1,"row2"),(1,0,"row3"),(0,0,"row4");
CREATE TABLE t2 (c1 CHAR(15), c2 BIT(1) NOT NULL, c3 BIT(1) NOT NULL, PRIMARY KEY(c1)) ENGINE = NDB ;
INSERT INTO t2 VALUES ("ABC",1,1),("BCDEF",0,1),("CD",1,0),("DEFGHIJKL",0,0);
SELECT hex(c1),hex(c2),c3 FROM t1 ORDER BY c3;
hex(c1)	hex(c2)	c3
1	1	row1
0	1	row2
1	0	row3
0	0	row4
SELECT hex(c2),hex(c3),c1 FROM t2 ORDER BY c1;
hex(c2)	hex(c3)	c1
1	1	ABC
0	1	BCDEF
1	0	CD
0	0	DEFGHIJKL
UPDATE t1 SET c2=0 WHERE c3="row2";
SELECT hex(c1),hex(c2),c3 FROM t1 ORDER BY c3;
hex(c1)	hex(c2)	c3
1	1	row1
0	0	row2
1	0	row3
0	0	row4
SHOW TABLES;
Tables_in_ndbsynctest
DROP DATABASE ndbsynctest;
CREATE DATABASE ndbsynctest;
USE ndbsynctest;
SELECT hex(c1),hex(c2),c3 FROM t1 ORDER BY c3;
hex(c1)	hex(c2)	c3
1	1	row1
0	1	row2
1	0	row3
0	0	row4
SELECT hex(c2),hex(c3),c1 FROM t2 ORDER BY c1;
hex(c2)	hex(c3)	c1
1	1	ABC
0	1	BCDEF
1	0	CD
0	0	DEFGHIJKL
SELECT MAX(epoch) FROM mysql.ndb_apply_status into @the_epoch;
SELECT @the_epoch;
@the_epoch
<the_epoch>
@the_pos	@the_file
<the_pos>	master-bin.000001
CHANGE REPLICATION SOURCE TO
SOURCE_LOG_FILE = 'master-bin.000001',
SOURCE_LOG_POS = <the_pos> ;
START REPLICA;
include/rpl/assert_replica_running.inc
SELECT hex(c1),hex(c2),c3 FROM t1 ORDER BY c3;
hex(c1)	hex(c2)	c3
1	1	row1
0	0	row2
1	0	row3
0	0	row4
SELECT hex(c2),hex(c3),c1 FROM t2 ORDER BY c1;
hex(c2)	hex(c3)	c1
1	1	ABC
0	1	BCDEF
1	0	CD
0	0	DEFGHIJKL
DROP DATABASE ndbsynctest;
STOP REPLICA;
reset binary logs and gtids;
select * from mysql.ndb_binlog_index;
Position	File	epoch	inserts	updates	deletes	schemaops	orig_server_id	orig_epoch	gci	next_position	next_file
RESET REPLICA;
select * from mysql.ndb_apply_status;
server_id	epoch	log_name	start_pos	end_pos
include/rpl/deinit.inc
