include/master-slave.inc
[connection master]
####### TEST gcol after blob
CREATE TABLE gcol_after_blob (
i int primary key,
b blob,
k int as (i+2)
) engine=ndb;
insert into gcol_after_blob(i,b) values (1, "ABCD");
select i from gcol_after_blob;
i
1
select b from gcol_after_blob;
b
ABCD
select k from gcol_after_blob;
k
3
select * from gcol_after_blob;
i	b	k
1	ABCD	3
select k,b from gcol_after_blob where i = 1;
k	b
3	ABCD
select b,i from gcol_after_blob where k = 3;
b	i
ABCD	1
select b,i from gcol_after_blob where k = 1;
b	i
update gcol_after_blob set b = "ABCDEFGHIJK" where i = 1;
insert into gcol_after_blob(i,b) values (2, "ABCD");
select b,i from gcol_after_blob where k = 4;
b	i
ABCD	2
update gcol_after_blob set b = "LMNOPQRST" where k = 4;
select b,i from gcol_after_blob where k = 4;
b	i
LMNOPQRST	2
DROP TABLE gcol_after_blob;
####### TEST stored generated blob
CREATE TABLE stored_blob_gcol (
i int primary key,
j varchar(20),
k text as (repeat(j,i)) stored
) engine=ndb;
insert into stored_blob_gcol(i,j) values (1,"c__"), (2,"b__"), (3,"a__");
select i from stored_blob_gcol order by i;
i
1
2
3
select j from stored_blob_gcol order by j;
j
a__
b__
c__
select k from stored_blob_gcol order by i;
k
c__
b__b__
a__a__a__
select * from stored_blob_gcol order by j;
i	j	k
3	a__	a__a__a__
2	b__	b__b__
1	c__	c__
delete from stored_blob_gcol where length(j) = length(k);
select * from stored_blob_gcol where i < 3;
i	j	k
2	b__	b__b__
DROP TABLE  stored_blob_gcol;
####### TEST virtual generated blob
CREATE TABLE virtual_blob_gcol (
i int primary key,
j varchar(20),
k text as (repeat(j,i)) virtual
) engine=ndb;
insert into virtual_blob_gcol(i,j) values (1,"c__"), (2,"b__"), (3,"a__");
select i from virtual_blob_gcol order by i;
i
1
2
3
select j from virtual_blob_gcol order by j;
j
a__
b__
c__
select k from virtual_blob_gcol order by i;
k
c__
b__b__
a__a__a__
select * from virtual_blob_gcol order by j;
i	j	k
3	a__	a__a__a__
2	b__	b__b__
1	c__	c__
delete from virtual_blob_gcol where length(j) = length(k);
select * from virtual_blob_gcol where i < 3;
i	j	k
2	b__	b__b__
DROP TABLE virtual_blob_gcol;
####### TEST virtual generated blob with hidden pk
CREATE TABLE virtual_blob_gcol_hid_pk (
i int,
j varchar(20),
k text as (repeat(j,i)) virtual
) engine=ndb;
insert into virtual_blob_gcol_hid_pk(i,j) values (2,"a__"), (2,"b__"), (2,"c__");
select * from virtual_blob_gcol_hid_pk order by j;
i	j	k
2	a__	a__a__
2	b__	b__b__
2	c__	c__c__
DROP TABLE virtual_blob_gcol_hid_pk;
####### TEST gcol with char(0)
CREATE TABLE gcol_char0 (
i int primary key,
c char(0),
v int as (i % 2),
z varchar(30)
) engine=ndb;
insert into gcol_char0(i,c) values(1, NULL), (2, NULL), (3, ""), (4, "");
select * from gcol_char0 order by i;
i	c	v	z
1	NULL	1	NULL
2	NULL	0	NULL
3		1	NULL
4		0	NULL
select c,v from gcol_char0 where i = 3;
c	v
	1
select * from gcol_char0 where c is null and v = 0;
i	c	v	z
2	NULL	0	NULL
select * from gcol_char0 where c is not null and v = 1;
i	c	v	z
3		1	NULL
update gcol_char0 set z = repeat("ABC_", i);
select * from gcol_char0 order by i;
i	c	v	z
1	NULL	1	ABC_
2	NULL	0	ABC_ABC_
3		1	ABC_ABC_ABC_
4		0	ABC_ABC_ABC_ABC_
DROP TABLE gcol_char0;
### TEST gcol as first column
CREATE TABLE gcol_first(
v int as (i+j),
i int primary key,
j int
) engine=ndb;
insert into gcol_first (i,j) values (1, 1),  (2, null), (3, 3);
select v from gcol_first;
v
2
6
NULL
select * from gcol_first where v is null;
v	i	j
NULL	2	NULL
select i from gcol_first where j is null;
i
2
DROP TABLE gcol_first;
include/rpl_end.inc
