include/master-slave.inc
Warnings:
Note	####	Sending passwords in plain text without SSL/TLS is extremely insecure.
Note	####	Storing MySQL user name or password information in the master info repository is not secure and is therefore not recommended. Please consider using the USER and PASSWORD connection options for START SLAVE; see the 'START SLAVE Syntax' in the MySQL Manual for more information.
[connection master]
use test;
CREATE TABLE t1 (
id int(11) NOT NULL,
value varbinary(4000),  # VARBINARY
PRIMARY KEY (id)
) ENGINE=ndbcluster DEFAULT CHARSET=latin1;
stop slave;
set global slave_type_conversions='ALL_LOSSY,ALL_NON_LOSSY';
start slave;
use test;
drop table t1;
CREATE TABLE t1 (
id int(11) NOT NULL,
value blob,          # BLOB
PRIMARY KEY (id)
) ENGINE=ndbcluster DEFAULT CHARSET=latin1;
insert into t1(id,value) values(3,repeat(0x23,240));
update t1 set value=repeat(0x24,240) where id=3;
update t1 set value=repeat(0x25,250) where id=3;
update t1 set value=repeat(0x30,400) where id=3;
update t1 set value=repeat(0x32,320) where id=3;
update t1 set value=repeat(0x33,330) where id=3;
select id, length(value), value from test.t1 where id=3;
id	length(value)	value
3	330	333333333333333333333333333333333333333333333333333333333333333333333333333333333333333333333333333333333333333333333333333333333333333333333333333333333333333333333333333333333333333333333333333333333333333333333333333333333333333333333333333333333333333333333333333333333333333333333333333333333333333333333333333333333333333333
delete from test.t1 where id=3;
insert into t1(id,value) values(3,repeat('D',2000));
update t1 set value=repeat('P',256);
select id, length(value), value from test.t1 where id=3;
id	length(value)	value
3	256	PPPPPPPPPPPPPPPPPPPPPPPPPPPPPPPPPPPPPPPPPPPPPPPPPPPPPPPPPPPPPPPPPPPPPPPPPPPPPPPPPPPPPPPPPPPPPPPPPPPPPPPPPPPPPPPPPPPPPPPPPPPPPPPPPPPPPPPPPPPPPPPPPPPPPPPPPPPPPPPPPPPPPPPPPPPPPPPPPPPPPPPPPPPPPPPPPPPPPPPPPPPPPPPPPPPPPPPPPPPPPPPPPPPPPPPPPPPPPPPPPPPPPPPPPPPPPPPP
update t1 set value=repeat('S', 2000);
drop table test.t1;
set global slave_type_conversions='';
include/rpl_end.inc
