SET @@session.default_storage_engine = 'MyISAM';
#
# Section 1. Wrong column definition options
#            - NULL
#            - DEFAULT <value>
#            - AUTO_INCREMENT
# NOT NULL
create table t1 (a int, b int generated always as (a+1) virtual not null);
insert into t1(a) values(null);
ERROR 23000: Column 'b' cannot be null
insert into t1(a) values(1);
select * from t1;
a	b
1	2
drop table t1;
create table t1 (a int, b int generated always as (a+1) stored not null);
insert into t1(a) values(null);
ERROR 23000: Column 'b' cannot be null
insert into t1(a) values(1);
select * from t1;
a	b
1	2
drop table t1;
create table t1 (a int);
alter table t1 add column b int generated always as (a+1) virtual not null;
drop table t1;
# NULL  
create table t1 (a int, b int generated always as (a+1) virtual null);
ERROR 42000: You have an error in your SQL syntax; check the manual that corresponds to your MySQL server version for the right syntax to use near 'null)' at line 1
create table t1 (a int);
alter table t1 add column b int generated always as (a+1) virtual null;
ERROR 42000: You have an error in your SQL syntax; check the manual that corresponds to your MySQL server version for the right syntax to use near 'null' at line 1
drop table t1;
# DEFAULT
create table t1 (a int, b int generated always as (a+1) virtual default 0);
ERROR 42000: You have an error in your SQL syntax; check the manual that corresponds to your MySQL server version for the right syntax to use near 'default 0)' at line 1
create table t1 (a int);
alter table t1 add column b int generated always as (a+1) virtual default 0;
ERROR 42000: You have an error in your SQL syntax; check the manual that corresponds to your MySQL server version for the right syntax to use near 'default 0' at line 1
drop table t1;
# AUTO_INCREMENT
create table t1 (a int, b int generated always as (a+1) virtual AUTO_INCREMENT);
ERROR 42000: You have an error in your SQL syntax; check the manual that corresponds to your MySQL server version for the right syntax to use near 'AUTO_INCREMENT)' at line 1
create table t1 (a int);
alter table t1 add column b int generated always as (a+1) virtual AUTO_INCREMENT;
ERROR 42000: You have an error in your SQL syntax; check the manual that corresponds to your MySQL server version for the right syntax to use near 'AUTO_INCREMENT' at line 1
drop table t1;
# [PRIMARY] KEY
create table t1 (a int, b int generated always as (a+1) virtual key);
ERROR HY000: Key/Index cannot be defined on a non-stored generated column.
create table t1 (a int, b int generated always as (a+1) stored key);
insert into t1 (a) values (3),(1),(2);
select * from t1;
a	b
3	4
1	2
2	3
drop table t1;
create table t1 (a int, b int generated always as (a+1) virtual primary key);
ERROR HY000: Key/Index cannot be defined on a non-stored generated column.
create table t1 (a int, b int generated always as (a+1) stored primary key);
insert into t1 (a) values (3),(1),(2);
select * from t1;
a	b
3	4
1	2
2	3
drop table t1;
create table t1 (a int);
alter table t1 add column b int generated always as (a+1) virtual key;
ERROR HY000: Key/Index cannot be defined on a non-stored generated column.
alter table t1 add column b int generated always as (a+1) stored key;
alter table t1 add column c int generated always as (a+2) virtual primary key;
ERROR HY000: Key/Index cannot be defined on a non-stored generated column.
show create table t1;
Table	Create Table
t1	CREATE TABLE `t1` (
  `a` int(11) DEFAULT NULL,
  `b` VIRTUAL int(11) AS (a+1) STORED NOT NULL,
  PRIMARY KEY (`b`)
) ENGINE=MyISAM DEFAULT CHARSET=latin1
alter table t1 add column c int generated always as (a+2) stored primary key;
ERROR 42000: Multiple primary key defined
drop table t1;
# Section 2. Other column definition options
#            - COMMENT
#            - REFERENCES (only syntax testing here)
#            - STORED (only systax testing here)
create table t1 (a int, b int generated always as (a % 2) virtual comment 'my comment');
show create table t1;
Table	Create Table
t1	CREATE TABLE `t1` (
  `a` int(11) DEFAULT NULL,
  `b` VIRTUAL int(11) AS (a % 2) COMMENT 'my comment'
) ENGINE=MyISAM DEFAULT CHARSET=latin1
describe t1;
Field	Type	Null	Key	Default	Extra
a	int(11)	YES		NULL	
b	int(11)	YES		NULL	VIRTUAL
drop table t1;
create table t1 (a int, b int generated always as (a % 2) virtual);
alter table t1 modify b int generated always as (a % 2) virtual comment 'my comment';
show create table t1;
Table	Create Table
t1	CREATE TABLE `t1` (
  `a` int(11) DEFAULT NULL,
  `b` VIRTUAL int(11) AS (a % 2) COMMENT 'my comment'
) ENGINE=MyISAM DEFAULT CHARSET=latin1
describe t1;
Field	Type	Null	Key	Default	Extra
a	int(11)	YES		NULL	
b	int(11)	YES		NULL	VIRTUAL
insert into t1 (a) values (1);
select * from t1;
a	b
1	1
insert into t1 values (2,default);
select a,b from t1;
a	b
1	1
2	0
create table t2 like t1;
show create table t2;
Table	Create Table
t2	CREATE TABLE `t2` (
  `a` int(11) DEFAULT NULL,
  `b` VIRTUAL int(11) AS (a % 2) COMMENT 'my comment'
) ENGINE=MyISAM DEFAULT CHARSET=latin1
describe t2;
Field	Type	Null	Key	Default	Extra
a	int(11)	YES		NULL	
b	int(11)	YES		NULL	VIRTUAL
insert into t2 (a) values (1);
select * from t2;
a	b
1	1
insert into t2 values (2,default);
select a,b from t2;
a	b
1	1
2	0
drop table t2;
drop table t1;
create table t1 (a int, b int generated always as (a % 2) stored);
show create table t1;
Table	Create Table
t1	CREATE TABLE `t1` (
  `a` int(11) DEFAULT NULL,
  `b` VIRTUAL int(11) AS (a % 2) STORED
) ENGINE=MyISAM DEFAULT CHARSET=latin1
describe t1;
Field	Type	Null	Key	Default	Extra
a	int(11)	YES		NULL	
b	int(11)	YES		NULL	VIRTUAL
insert into t1 (a) values (1);
select * from t1;
a	b
1	1
insert into t1 values (2,default);
select a,b from t1;
a	b
1	1
2	0
drop table t1;
create table t2 (a int);
create table t1 (a int, b int generated always as (a % 2) stored references t2(a));
show create table t1;
Table	Create Table
t1	CREATE TABLE `t1` (
  `a` int(11) DEFAULT NULL,
  `b` VIRTUAL int(11) AS (a % 2) STORED
) ENGINE=MyISAM DEFAULT CHARSET=latin1
drop table t1;
create table t1 (a int, b int generated always as (a % 2) virtual);
alter table t1 modify b int generated always as (a % 2) stored references t2(a);
ERROR 42000: You have an error in your SQL syntax; check the manual that corresponds to your MySQL server version for the right syntax to use near 'references t2(a)' at line 1
show create table t1;
Table	Create Table
t1	CREATE TABLE `t1` (
  `a` int(11) DEFAULT NULL,
  `b` VIRTUAL int(11) AS (a % 2)
) ENGINE=MyISAM DEFAULT CHARSET=latin1
drop table t1;
Generated alwasy is optional
create table t1 (a int, b int as (a % 2) virtual);
show create table t1;
Table	Create Table
t1	CREATE TABLE `t1` (
  `a` int(11) DEFAULT NULL,
  `b` VIRTUAL int(11) AS (a % 2)
) ENGINE=MyISAM DEFAULT CHARSET=latin1
describe t1;
Field	Type	Null	Key	Default	Extra
a	int(11)	YES		NULL	
b	int(11)	YES		NULL	VIRTUAL
drop table t1;
create table t1 (a int, b int as (a % 2) stored);
show create table t1;
Table	Create Table
t1	CREATE TABLE `t1` (
  `a` int(11) DEFAULT NULL,
  `b` VIRTUAL int(11) AS (a % 2) STORED
) ENGINE=MyISAM DEFAULT CHARSET=latin1
describe t1;
Field	Type	Null	Key	Default	Extra
a	int(11)	YES		NULL	
b	int(11)	YES		NULL	VIRTUAL
drop table t1;
Default should be non-stored column
create table t1 (a int, b int as (a % 2));
show create table t1;
Table	Create Table
t1	CREATE TABLE `t1` (
  `a` int(11) DEFAULT NULL,
  `b` VIRTUAL int(11) AS (a % 2)
) ENGINE=MyISAM DEFAULT CHARSET=latin1
describe t1;
Field	Type	Null	Key	Default	Extra
a	int(11)	YES		NULL	
b	int(11)	YES		NULL	VIRTUAL
drop table t1;
Expression can be constant 
create table t1 (a int, b int as (5 * 2));
show create table t1;
Table	Create Table
t1	CREATE TABLE `t1` (
  `a` int(11) DEFAULT NULL,
  `b` VIRTUAL int(11) AS (5 * 2)
) ENGINE=MyISAM DEFAULT CHARSET=latin1
describe t1;
Field	Type	Null	Key	Default	Extra
a	int(11)	YES		NULL	
b	int(11)	YES		NULL	VIRTUAL
drop table t1;
Test virtual columns referencing other virtual columns
create table t1 (a int unique, b int generated always as(-a) virtual, c int generated always as (b + 1) virtual);
insert into t1 (a) values (1), (2);
select * from t1;
a	b	c
1	-1	0
2	-2	-1
insert into t1(a) values (1) on duplicate key update a=3;
select * from t1;
a	b	c
3	-3	-2
2	-2	-1
update t1 set a=4 where a=2;
select * from t1;
a	b	c
3	-3	-2
4	-4	-3
drop table t1;
create table t1 (a int, b int generated always as(-b) virtual, c int generated always as (b + 1) virtual);
ERROR HY000: Generated column can refer only to generated columns defined prior it.
create table t1 (a int, b int generated always as(-c) virtual, c int generated always as (b + 1) virtual);
ERROR HY000: Generated column can refer only to generated columns defined prior it.
DROP VIEW  IF EXISTS v1,v2;
DROP TABLE IF EXISTS t1,t2,t3;
DROP PROCEDURE IF EXISTS p1;
DROP FUNCTION IF EXISTS f1;
DROP TRIGGER IF EXISTS trg1;
DROP TRIGGER IF EXISTS trg2;
set sql_warnings = 0;
