drop table if exists t2,t1;
set names utf8;
CREATE TABLE t1 (
id1 INT ,
a1 VARCHAR(200) PRIMARY KEY,
b1 TEXT ,
FULLTEXT KEY (a1,b1)
) CHARACTER SET = utf8 , ENGINE = InnoDB;
CREATE TABLE t2 (
id2 INT UNSIGNED AUTO_INCREMENT NOT NULL PRIMARY KEY,
a2 VARCHAR(200),
b2 TEXT ,
FOREIGN KEY (a2) REFERENCES t1(a1) ON UPDATE CASCADE,
FULLTEXT KEY (b2,a2)
) CHARACTER SET = utf8 ,ENGINE = InnoDB;
INSERT INTO t1 (id1,a1,b1) VALUES
(1,'MySQL Tutorial','DBMS stands for DataBase VÐƷWİ...')  ,
(2,'How To Use MySQL Well','After you went through a ...'),
(3,'Optimizing MySQL','In this tutorial we will show ...');
INSERT INTO t1 (id1,a1,b1) VALUES
(4,'1001 MySQL Tricks','1. Never run mysqld as root. 2. ...'),
(5,'MySQL vs. YourSQL','In the following database comparison ...'),
(6,'MySQL Security','When configured properly, MySQL ...');
INSERT INTO t2 (a2,b2) VALUES
('MySQL Tutorial','DBMS stands for DataBase VÐƷWİ...')  ,
('How To Use MySQL Well','After you went through a ...'),
('Optimizing MySQL','In this tutorial we will show ...');
INSERT INTO t2 (a2,b2) VALUES
('1001 MySQL Tricks','1. Never run mysqld as root. 2. ...'),
('MySQL vs. YourSQL','In the following database comparison ...'),
('MySQL Security','When configured properly, MySQL ...');
INSERT INTO t2 (a2,b2) VALUES
('MySQL Tricks','1. Never run mysqld as root. 2. ...');
ERROR 23000: Cannot add or update a child row: a foreign key constraint fails (`test`.`t2`, CONSTRAINT `t2_ibfk_1` FOREIGN KEY (`a2`) REFERENCES `t1` (`a1`) ON UPDATE CASCADE)
DELETE FROM t1;
ERROR 23000: Cannot delete or update a parent row: a foreign key constraint fails (`test`.`t2`, CONSTRAINT `t2_ibfk_1` FOREIGN KEY (`a2`) REFERENCES `t1` (`a1`) ON UPDATE CASCADE)
SELECT * FROM t1 WHERE MATCH (a1,b1) AGAINST ('tutorial') ;
id1	a1	b1
1	MySQL Tutorial	DBMS stands for DataBase VÐƷWİ...
3	Optimizing MySQL	In this tutorial we will show ...
SELECT * FROM t2 WHERE MATCH (a2,b2) AGAINST ('tutorial') ;
id2	a2	b2
1	MySQL Tutorial	DBMS stands for DataBase VÐƷWİ...
3	Optimizing MySQL	In this tutorial we will show ...
SELECT * FROM t1 WHERE MATCH (a1,b1) AGAINST ('tutorial (+mysql -VÐƷWİ)' IN BOOLEAN MODE) ;
id1	a1	b1
3	Optimizing MySQL	In this tutorial we will show ...
SELECT * FROM t2 WHERE MATCH (a2,b2) AGAINST ('tutorial (+mysql -VÐƷWİ)' IN BOOLEAN MODE) ;
id2	a2	b2
3	Optimizing MySQL	In this tutorial we will show ...
SELECT * FROM t1 WHERE MATCH (a1,b1) AGAINST ('tutorial' WITH QUERY EXPANSION) ;
id1	a1	b1
1	MySQL Tutorial	DBMS stands for DataBase VÐƷWİ...
3	Optimizing MySQL	In this tutorial we will show ...
5	MySQL vs. YourSQL	In the following database comparison ...
6	MySQL Security	When configured properly, MySQL ...
2	How To Use MySQL Well	After you went through a ...
4	1001 MySQL Tricks	1. Never run mysqld as root. 2. ...
SELECT * FROM t2 WHERE MATCH (a2,b2) AGAINST ('tutorial' WITH QUERY EXPANSION) ;
id2	a2	b2
1	MySQL Tutorial	DBMS stands for DataBase VÐƷWİ...
3	Optimizing MySQL	In this tutorial we will show ...
5	MySQL vs. YourSQL	In the following database comparison ...
6	MySQL Security	When configured properly, MySQL ...
2	How To Use MySQL Well	After you went through a ...
4	1001 MySQL Tricks	1. Never run mysqld as root. 2. ...
SELECT * FROM t1 WHERE MATCH (a1,b1) AGAINST ('"dbms database"@16' IN BOOLEAN MODE) ;
id1	a1	b1
1	MySQL Tutorial	DBMS stands for DataBase VÐƷWİ...
SELECT * FROM t2 WHERE MATCH (a2,b2) AGAINST ('"dbms database"@16' IN BOOLEAN MODE) ;
id2	a2	b2
1	MySQL Tutorial	DBMS stands for DataBase VÐƷWİ...
UPDATE t1 SET a1 = "changing column - on update cascade" , b1 = "to check foreign constraint" WHERE
MATCH (a1,b1) AGAINST ('tutorial (+mysql -VÐƷWİ)' IN BOOLEAN MODE) ;
SELECT * FROM t1 WHERE MATCH (a1,b1) AGAINST ('tutorial (+mysql -VÐƷWİ)' IN BOOLEAN MODE) ;
id1	a1	b1
SELECT * FROM t2 WHERE MATCH (a2,b2) AGAINST ('tutorial (+mysql -VÐƷWİ)' IN BOOLEAN MODE) ;
id2	a2	b2
3	changing column - on update cascade	In this tutorial we will show ...
SELECT * FROM t1 WHERE MATCH (a1,b1) AGAINST ('+update +cascade' IN BOOLEAN MODE) ;
id1	a1	b1
3	changing column - on update cascade	to check foreign constraint
SELECT * FROM t2 WHERE MATCH (a2,b2) AGAINST ('+update +cascade' IN BOOLEAN MODE) ;
id2	a2	b2
SELECT * FROM t2 WHERE a2 LIKE '%UPDATE CASCADE%';
id2	a2	b2
3	changing column - on update cascade	In this tutorial we will show ...
DROP TABLE t2 , t1;
CREATE TABLE t1 (
id1 INT ,
a1 VARCHAR(200) PRIMARY KEY,
b1 TEXT character set utf8 ,
FULLTEXT KEY (a1,b1)
) CHARACTER SET = utf8 ,ENGINE = InnoDB;
CREATE TABLE t2 (
id2 INT UNSIGNED AUTO_INCREMENT NOT NULL PRIMARY KEY,
a2 VARCHAR(200),
b2 TEXT character set utf8 ,
FOREIGN KEY (a2) REFERENCES t1(a1) ON DELETE CASCADE,
FULLTEXT KEY (b2,a2)
) CHARACTER SET = utf8 ,ENGINE = InnoDB;
INSERT INTO t1 (id1,a1,b1) VALUES
(1,'MySQL Tutorial','DBMS stands for DataBase VÐƷWİ...')  ,
(2,'How To Use MySQL Well','After you went through a ...'),
(3,'Optimizing MySQL','In this tutorial we will show ...'),
(4,'1001 MySQL Tricks','1. Never run mysqld as root. 2. ...'),
(5,'MySQL vs. YourSQL','In the following database comparison ...'),
(6,'MySQL Security','When configured properly, MySQL ...');
INSERT INTO t2 (a2,b2) VALUES
('MySQL Tutorial','DBMS stands for DataBase VÐƷWİ...')  ,
('How To Use MySQL Well','After you went through a ...'),
('Optimizing MySQL','In this tutorial we will show ...'),
('1001 MySQL Tricks','1. Never run mysqld as root. 2. ...'),
('MySQL vs. YourSQL','In the following database comparison ...'),
('MySQL Security','When configured properly, MySQL ...');
DELETE FROM t1 WHERE MATCH (a1,b1) AGAINST ('tutorial (+mysql -VÐƷWİ)' IN BOOLEAN MODE) ;
SELECT * FROM t1 WHERE MATCH (a1,b1) AGAINST ('tutorial (+mysql -VÐƷWİ)' IN BOOLEAN MODE) ;
id1	a1	b1
SELECT * FROM t2 WHERE MATCH (a2,b2) AGAINST ('tutorial (+mysql -VÐƷWİ)' IN BOOLEAN MODE) ;
id2	a2	b2
SELECT * FROM t1 WHERE a1 LIKE '%tutorial%';
id1	a1	b1
1	MySQL Tutorial	DBMS stands for DataBase VÐƷWİ...
SELECT * FROM t2 WHERE a2 LIKE '%tutorial%';
id2	a2	b2
1	MySQL Tutorial	DBMS stands for DataBase VÐƷWİ...
DROP TABLE t2 , t1;
set global innodb_file_format="Barracuda";
set global innodb_file_per_table=1;
set global innodb_large_prefix=1;
set names utf8;
CREATE TABLE t1 (
id INT UNSIGNED AUTO_INCREMENT NOT NULL PRIMARY KEY,
a VARCHAR(200),
b TEXT
) CHARACTER SET = utf8 , ROW_FORMAT=COMPRESSED KEY_BLOCK_SIZE=8, ENGINE = InnoDB;
INSERT INTO t1 (a,b) VALUES
('MySQL Tutorial','DBMS stands for DataBase VÐƷWİ...')  ,
('How To Use MySQL Well','After you went through a ...'),
('Optimizing MySQL','In this tutorial we will show ...');
ALTER TABLE t1 ADD FULLTEXT INDEX idx (a,b);
SHOW CREATE TABLE t1;
Table	Create Table
t1	CREATE TABLE `t1` (
  `id` int(10) unsigned NOT NULL AUTO_INCREMENT,
  `a` varchar(200) DEFAULT NULL,
  `b` text,
  PRIMARY KEY (`id`),
  FULLTEXT KEY `idx` (`a`,`b`)
) ENGINE=InnoDB AUTO_INCREMENT=4 DEFAULT CHARSET=utf8 ROW_FORMAT=COMPRESSED KEY_BLOCK_SIZE=8
INSERT INTO t1 (a,b) VALUES
('1001 MySQL Tricks','1. Never run mysqld as root. 2. ...'),
('MySQL vs. YourSQL','In the following database comparison ...'),
('MySQL Security','When configured properly, MySQL ...');
SELECT * FROM t1 WHERE MATCH (a,b)
AGAINST ('Tutorial' IN NATURAL LANGUAGE MODE);
id	a	b
1	MySQL Tutorial	DBMS stands for DataBase VÐƷWİ...
3	Optimizing MySQL	In this tutorial we will show ...
select * from t1 where MATCH(a,b) AGAINST("+tutorial +VÐƷWİ" IN BOOLEAN MODE);
id	a	b
1	MySQL Tutorial	DBMS stands for DataBase VÐƷWİ...
select * from t1 where MATCH(a,b) AGAINST("+-VÐƷWİ" IN BOOLEAN MODE);
id	a	b
select * from t1 where MATCH(a,b) AGAINST("+Mysql +(tricks never)" IN BOOLEAN MODE);
id	a	b
4	1001 MySQL Tricks	1. Never run mysqld as root. 2. ...
select * from t1 where MATCH(a,b) AGAINST("+mysql -(tricks never)" IN BOOLEAN MODE);
id	a	b
6	MySQL Security	When configured properly, MySQL ...
1	MySQL Tutorial	DBMS stands for DataBase VÐƷWİ...
2	How To Use MySQL Well	After you went through a ...
3	Optimizing MySQL	In this tutorial we will show ...
5	MySQL vs. YourSQL	In the following database comparison ...
select *, MATCH(a,b) AGAINST("mysql stands" IN BOOLEAN MODE) as x from t1;
id	a	b	x
1	MySQL Tutorial	DBMS stands for DataBase VÐƷWİ...	0.6055193543434143
2	How To Use MySQL Well	After you went through a ...	0.000000001885928302414186
3	Optimizing MySQL	In this tutorial we will show ...	0.000000001885928302414186
4	1001 MySQL Tricks	1. Never run mysqld as root. 2. ...	0.000000001885928302414186
5	MySQL vs. YourSQL	In the following database comparison ...	0.000000001885928302414186
6	MySQL Security	When configured properly, MySQL ...	0.000000003771856604828372
select * from t1 where MATCH a,b AGAINST ("+database* +VÐƷW*" IN BOOLEAN MODE);
id	a	b
1	MySQL Tutorial	DBMS stands for DataBase VÐƷWİ...
select * from t1 where MATCH a,b AGAINST ('"security mysql"' IN BOOLEAN MODE);
id	a	b
select * from t1 where MATCH(a,b) AGAINST ("VÐƷWİ" WITH QUERY EXPANSION);
id	a	b
1	MySQL Tutorial	DBMS stands for DataBase VÐƷWİ...
3	Optimizing MySQL	In this tutorial we will show ...
5	MySQL vs. YourSQL	In the following database comparison ...
6	MySQL Security	When configured properly, MySQL ...
2	How To Use MySQL Well	After you went through a ...
4	1001 MySQL Tricks	1. Never run mysqld as root. 2. ...
ALTER TABLE t1 DROP INDEX idx;
CREATE FULLTEXT INDEX idx on t1 (a,b);
SELECT * FROM t1 WHERE MATCH (a,b)
AGAINST ('Tutorial' IN NATURAL LANGUAGE MODE);
id	a	b
1	MySQL Tutorial	DBMS stands for DataBase VÐƷWİ...
3	Optimizing MySQL	In this tutorial we will show ...
select * from t1 where MATCH(a,b) AGAINST("+tutorial +VÐƷWİ" IN BOOLEAN MODE);
id	a	b
1	MySQL Tutorial	DBMS stands for DataBase VÐƷWİ...
select * from t1 where MATCH(a,b) AGAINST("+dbms" IN BOOLEAN MODE);
id	a	b
1	MySQL Tutorial	DBMS stands for DataBase VÐƷWİ...
select * from t1 where MATCH(a,b) AGAINST("+Mysql +(tricks never)" IN BOOLEAN MODE);
id	a	b
4	1001 MySQL Tricks	1. Never run mysqld as root. 2. ...
select * from t1 where MATCH(a,b) AGAINST("+mysql -(tricks never)" IN BOOLEAN MODE);
id	a	b
6	MySQL Security	When configured properly, MySQL ...
1	MySQL Tutorial	DBMS stands for DataBase VÐƷWİ...
2	How To Use MySQL Well	After you went through a ...
3	Optimizing MySQL	In this tutorial we will show ...
5	MySQL vs. YourSQL	In the following database comparison ...
select *, MATCH(a,b) AGAINST("mysql VÐƷWİ" IN BOOLEAN MODE) as x from t1;
id	a	b	x
1	MySQL Tutorial	DBMS stands for DataBase VÐƷWİ...	0.6055193543434143
2	How To Use MySQL Well	After you went through a ...	0.000000001885928302414186
3	Optimizing MySQL	In this tutorial we will show ...	0.000000001885928302414186
4	1001 MySQL Tricks	1. Never run mysqld as root. 2. ...	0.000000001885928302414186
5	MySQL vs. YourSQL	In the following database comparison ...	0.000000001885928302414186
6	MySQL Security	When configured properly, MySQL ...	0.000000003771856604828372
select * from t1 where MATCH a,b AGAINST ('"security mysql"' IN BOOLEAN MODE);
id	a	b
select * from t1 where MATCH(a,b) AGAINST ("VÐƷWİ" WITH QUERY EXPANSION);
id	a	b
1	MySQL Tutorial	DBMS stands for DataBase VÐƷWİ...
3	Optimizing MySQL	In this tutorial we will show ...
5	MySQL vs. YourSQL	In the following database comparison ...
6	MySQL Security	When configured properly, MySQL ...
2	How To Use MySQL Well	After you went through a ...
4	1001 MySQL Tricks	1. Never run mysqld as root. 2. ...
INSERT INTO t1 (a,b) VALUES ('test query expansion','for database ...');
INSERT INTO t1 (a,b) VALUES
('test proximity search, test, proximity and phrase',
'search, with proximity innodb');
INSERT INTO t1 (a,b) VALUES
('test proximity fts search, test, proximity and phrase',
'search, with proximity innodb');
INSERT INTO t1 (a,b) VALUES
('test more proximity fts search, test, more proximity and phrase',
'search, with proximity innodb');
SELECT * FROM t1
WHERE MATCH (a,b)
AGAINST ('"proximity search"@10' IN BOOLEAN MODE);
id	a	b
8	test proximity search, test, proximity and phrase	search, with proximity innodb
SELECT * FROM t1
WHERE MATCH (a,b)
AGAINST ('"proximity search"@9' IN BOOLEAN MODE);
id	a	b
SELECT * FROM t1
WHERE MATCH (a,b)
AGAINST ('"proximity search"@14' IN BOOLEAN MODE);
id	a	b
8	test proximity search, test, proximity and phrase	search, with proximity innodb
9	test proximity fts search, test, proximity and phrase	search, with proximity innodb
10	test more proximity fts search, test, more proximity and phrase	search, with proximity innodb
SELECT * FROM t1
WHERE MATCH (a,b)
AGAINST ('"test proximity"@5' IN BOOLEAN MODE);
id	a	b
8	test proximity search, test, proximity and phrase	search, with proximity innodb
9	test proximity fts search, test, proximity and phrase	search, with proximity innodb
SELECT * FROM t1
WHERE MATCH (a,b)
AGAINST ('"more test proximity"@10' IN BOOLEAN MODE);
id	a	b
10	test more proximity fts search, test, more proximity and phrase	search, with proximity innodb
SELECT * FROM t1
WHERE MATCH (a,b)
AGAINST ('"more test proximity"@9' IN BOOLEAN MODE);
id	a	b
SELECT * FROM t1
WHERE MATCH (a,b)
AGAINST ('"more fts proximity"@09' IN BOOLEAN MODE);
id	a	b
UPDATE t1 SET a = UPPER(a) , b = UPPER(b) ;
UPDATE t1 SET a = UPPER(a) , b = LOWER(b) ;
select * from t1 where MATCH(a,b) AGAINST("+tutorial +dbms" IN BOOLEAN MODE);
id	a	b
1	MYSQL TUTORIAL	dbms stands for database vðʒwi...
select * from t1 where MATCH(a,b) AGAINST("+VÐƷWİ" IN BOOLEAN MODE);
id	a	b
1	MYSQL TUTORIAL	dbms stands for database vðʒwi...
SELECT * FROM t1 WHERE MATCH (a,b)
AGAINST ('Tutorial' IN NATURAL LANGUAGE MODE);
id	a	b
1	MYSQL TUTORIAL	dbms stands for database vðʒwi...
3	OPTIMIZING MYSQL	in this tutorial we will show ...
DELETE FROM t1 WHERE MATCH (a,b) AGAINST ('Tutorial' IN NATURAL LANGUAGE MODE);
DELETE FROM t1 WHERE MATCH (a,b) AGAINST ('"proximity search"@14' IN BOOLEAN MODE);
SELECT * FROM t1 WHERE MATCH (a,b)
AGAINST ('Tutorial' IN NATURAL LANGUAGE MODE);
id	a	b
SELECT * FROM t1;
id	a	b
2	HOW TO USE MYSQL WELL	after you went through a ...
4	1001 MYSQL TRICKS	1. never run mysqld as root. 2. ...
5	MYSQL VS. YOURSQL	in the following database comparison ...
6	MYSQL SECURITY	when configured properly, mysql ...
7	TEST QUERY EXPANSION	for database ...
DROP TABLE t1;
SET GLOBAL innodb_file_format=Antelope;
SET GLOBAL innodb_file_per_table=0;
SET GLOBAL innodb_file_format_max=Antelope;
SET GLOBAL innodb_large_prefix=0;
set names utf8;
CREATE TABLE t1 (
id INT UNSIGNED AUTO_INCREMENT NOT NULL PRIMARY KEY,
a VARCHAR(200),
b TEXT
) CHARACTER SET = utf8, ENGINE=InnoDB;
INSERT INTO t1 (a,b) VALUES
('Я могу есть стекло', 'оно мне не вредит'),
('Мога да ям стъкло', 'то не ми вреди'),
('Μπορῶ νὰ φάω σπασμένα' ,'γυαλιὰ χωρὶς νὰ πάθω τίποτα'),
('Příliš žluťoučký kůň', 'úpěl ďábelské kódy'),
('Sævör grét', 'áðan því úlpan var ónýt'),
('うゐのおくやま','けふこえて'),
('いろはにほへど　ちりぬる','あさきゆめみじ　ゑひもせず');
INSERT INTO t1 (a,b) VALUES
('MySQL Tutorial','request docteam@oraclehelp.com ...')  ,
('Trial version','query performace @1255 minute on 2.1Hz Memory 2GB...')  ,
('when To Use MySQL Well','for free faq  mail@xyz.com ...');
CREATE FULLTEXT INDEX idx on t1 (a,b);
SELECT * FROM t1 WHERE MATCH(a,b) AGAINST ("вредит χωρὶς");
id	a	b
1	Я могу есть стекло	оно мне не вредит
3	Μπορῶ νὰ φάω σπασμένα	γυαλιὰ χωρὶς νὰ πάθω τίποτα
SELECT * FROM t1 WHERE MATCH(a,b) AGAINST ("оно" WITH QUERY EXPANSION);
id	a	b
1	Я могу есть стекло	оно мне не вредит
2	Мога да ям стъкло	то не ми вреди
SELECT * FROM t1 WHERE MATCH(a,b) AGAINST("вред*" IN BOOLEAN MODE);
id	a	b
1	Я могу есть стекло	оно мне не вредит
2	Мога да ям стъкло	то не ми вреди
SELECT * FROM t1 WHERE MATCH(a,b) AGAINST("+γυαλιὰ +tutorial" IN BOOLEAN MODE);
id	a	b
SELECT * FROM t1 WHERE MATCH(a,b) AGAINST("+tutorial +(Мога τίποτα)" IN BOOLEAN MODE);
id	a	b
SELECT * FROM t1 WHERE MATCH(a,b) AGAINST ("あさきゆめみじ　ゑひもせず");
id	a	b
SELECT * FROM t1 WHERE MATCH(a,b) AGAINST ("ちりぬる" WITH QUERY EXPANSION);
id	a	b
7	いろはにほへど　ちりぬる	あさきゆめみじ　ゑひもせず
SELECT * FROM t1 WHERE MATCH(a,b) AGAINST ("+あさきゆめみじ　+ゑひもせず" IN BOOLEAN MODE);
id	a	b
SELECT * FROM t1 WHERE MATCH(a,b) AGAINST("うゐのおく*" IN BOOLEAN MODE);
id	a	b
6	うゐのおくやま	けふこえて
SELECT * FROM t1 WHERE MATCH(a,b) AGAINST("+Sævör +úlpan" IN BOOLEAN MODE);
id	a	b
5	Sævör grét	áðan því úlpan var ónýt
SELECT * FROM t1
WHERE MATCH (a,b)
AGAINST ('"γυαλιὰ χωρὶς"@21' IN BOOLEAN MODE);
id	a	b
3	Μπορῶ νὰ φάω σπασμένα	γυαλιὰ χωρὶς νὰ πάθω τίποτα
SELECT * FROM t1
WHERE MATCH (a,b)
AGAINST ('"query performace"@06' IN BOOLEAN MODE);
id	a	b
9	Trial version	query performace @1255 minute on 2.1Hz Memory 2GB...
SELECT * FROM t1
WHERE MATCH (a,b)
AGAINST ('"πάθω τίποτα"@18' IN BOOLEAN MODE);
id	a	b
3	Μπορῶ νὰ φάω σπασμένα	γυαλιὰ χωρὶς νὰ πάθω τίποτα
SELECT * FROM t1
WHERE MATCH (a,b)
AGAINST ('"あさきゆめみじ　ゑひもせず"@50' IN BOOLEAN MODE);
id	a	b
SELECT * FROM t1
WHERE MATCH (a,b)
AGAINST ('"あさきゆめみじ　ゑひもせず"@6' IN BOOLEAN MODE);
id	a	b
ALTER TABLE t1 DROP INDEX idx;
CREATE FULLTEXT INDEX idx on t1 (a,b);
SELECT * FROM t1 WHERE MATCH(a,b) AGAINST ("あさきゆめみじ　ゑひもせず");
id	a	b
UPDATE t1 SET a = "Pchnąć w tę łódź jeża" , b = "lub osiem skrzyń fig" WHERE MATCH(a,b) AGAINST ("あさきゆめみじ　ゑひもせず");
UPDATE t1 SET a = "В чащах юга жил-был цитрус? Да", b = "но фальшивый экземпляр! ёъ" WHERE MATCH(a,b) AGAINST ("вред*" IN BOOLEAN MODE);
DELETE FROM t1 WHERE MATCH(a,b) AGAINST("+Sævör +úlpan" IN BOOLEAN MODE);
SELECT * FROM t1 WHERE MATCH(a,b) AGAINST ("あさきゆめみじ　ゑひもせず");
id	a	b
SELECT * FROM t1 WHERE MATCH(a,b) AGAINST ("łódź osiem");
id	a	b
SELECT * FROM t1 WHERE MATCH(a,b) AGAINST("вред*" IN BOOLEAN MODE);
id	a	b
SELECT * FROM t1 WHERE MATCH(a,b) AGAINST("фальшив*" IN BOOLEAN MODE);
id	a	b
1	В чащах юга жил-был цитрус? Да	но фальшивый экземпляр! ёъ
2	В чащах юга жил-был цитрус? Да	но фальшивый экземпляр! ёъ
SELECT * FROM t1 WHERE MATCH(a,b) AGAINST("+Sævör +úlpan" IN BOOLEAN MODE);
id	a	b
SELECT * FROM t1
WHERE MATCH (a,b)
AGAINST ('"łódź jeża"@15' IN BOOLEAN MODE);
id	a	b
SELECT * FROM t1;
id	a	b
1	В чащах юга жил-был цитрус? Да	но фальшивый экземпляр! ёъ
2	В чащах юга жил-был цитрус? Да	но фальшивый экземпляр! ёъ
3	Μπορῶ νὰ φάω σπασμένα	γυαλιὰ χωρὶς νὰ πάθω τίποτα
4	Příliš žluťoučký kůň	úpěl ďábelské kódy
6	うゐのおくやま	けふこえて
7	いろはにほへど　ちりぬる	あさきゆめみじ　ゑひもせず
8	MySQL Tutorial	request docteam@oraclehelp.com ...
9	Trial version	query performace @1255 minute on 2.1Hz Memory 2GB...
10	when To Use MySQL Well	for free faq  mail@xyz.com ...
DROP TABLE t1;
