drop table if exists t1;
CREATE TABLE t1 (
FTS_DOC_ID BIGINT UNSIGNED AUTO_INCREMENT NOT NULL PRIMARY KEY, 
a TEXT,
b TEXT
) ENGINE= <default_engine>;
create unique index FTS_DOC_ID_INDEX on t1(FTS_DOC_ID);
"Loading data using LOAD DATA Command , File <MYSQLTEST_VARDIR>/tmp/fts_input_data.txt"
CREATE FULLTEXT INDEX idx on t1 (a,b);
SELECT COUNT(*) FROM t1;
COUNT(*)
399
SELECT * FROM t1 WHERE MATCH (a,b)
AGAINST ('row35col2word49' IN NATURAL LANGUAGE MODE);
FTS_DOC_ID	a	b
35	row35col1word1 row35col1word2 row35col1word3 row35col1word4 row35col1word5 row35col1word6 row35col1word7 row35col1word8 row35col1word9 row35col1word10 row35col1word11 row35col1word12 row35col1word13 row35col1word14 row35col1word15 row35col1word16 row35col1word17 row35col1word18 row35col1word19 row35col1word20 row35col1word21 row35col1word22 row35col1word23 row35col1word24 row35col1word25 row35col1word26 row35col1word27 row35col1word28 row35col1word29 row35col1word30 row35col1word31 row35col1word32 row35col1word33 row35col1word34 row35col1word35 row35col1word36 row35col1word37 row35col1word38 row35col1word39 row35col1word40 row35col1word41 row35col1word42 row35col1word43 row35col1word44 row35col1word45 row35col1word46 row35col1word47 row35col1word48 row35col1word49 row35col1word50 	row35col2word1 row35col2word2 row35col2word3 row35col2word4 row35col2word5 row35col2word6 row35col2word7 row35col2word8 row35col2word9 row35col2word10 row35col2word11 row35col2word12 row35col2word13 row35col2word14 row35col2word15 row35col2word16 row35col2word17 row35col2word18 row35col2word19 row35col2word20 row35col2word21 row35col2word22 row35col2word23 row35col2word24 row35col2word25 row35col2word26 row35col2word27 row35col2word28 row35col2word29 row35col2word30 row35col2word31 row35col2word32 row35col2word33 row35col2word34 row35col2word35 row35col2word36 row35col2word37 row35col2word38 row35col2word39 row35col2word40 row35col2word41 row35col2word42 row35col2word43 row35col2word44 row35col2word45 row35col2word46 row35col2word47 row35col2word48 row35col2word49 row35col2word50 
select * from t1 where MATCH(a,b) AGAINST("+row5col2word49 +row5col1word49" IN BOOLEAN MODE);
FTS_DOC_ID	a	b
5	row5col1word1 row5col1word2 row5col1word3 row5col1word4 row5col1word5 row5col1word6 row5col1word7 row5col1word8 row5col1word9 row5col1word10 row5col1word11 row5col1word12 row5col1word13 row5col1word14 row5col1word15 row5col1word16 row5col1word17 row5col1word18 row5col1word19 row5col1word20 row5col1word21 row5col1word22 row5col1word23 row5col1word24 row5col1word25 row5col1word26 row5col1word27 row5col1word28 row5col1word29 row5col1word30 row5col1word31 row5col1word32 row5col1word33 row5col1word34 row5col1word35 row5col1word36 row5col1word37 row5col1word38 row5col1word39 row5col1word40 row5col1word41 row5col1word42 row5col1word43 row5col1word44 row5col1word45 row5col1word46 row5col1word47 row5col1word48 row5col1word49 row5col1word50 	row5col2word1 row5col2word2 row5col2word3 row5col2word4 row5col2word5 row5col2word6 row5col2word7 row5col2word8 row5col2word9 row5col2word10 row5col2word11 row5col2word12 row5col2word13 row5col2word14 row5col2word15 row5col2word16 row5col2word17 row5col2word18 row5col2word19 row5col2word20 row5col2word21 row5col2word22 row5col2word23 row5col2word24 row5col2word25 row5col2word26 row5col2word27 row5col2word28 row5col2word29 row5col2word30 row5col2word31 row5col2word32 row5col2word33 row5col2word34 row5col2word35 row5col2word36 row5col2word37 row5col2word38 row5col2word39 row5col2word40 row5col2word41 row5col2word42 row5col2word43 row5col2word44 row5col2word45 row5col2word46 row5col2word47 row5col2word48 row5col2word49 row5col2word50 
select * from t1 where MATCH(a,b) AGAINST("+row5col2word49" IN BOOLEAN MODE);
FTS_DOC_ID	a	b
5	row5col1word1 row5col1word2 row5col1word3 row5col1word4 row5col1word5 row5col1word6 row5col1word7 row5col1word8 row5col1word9 row5col1word10 row5col1word11 row5col1word12 row5col1word13 row5col1word14 row5col1word15 row5col1word16 row5col1word17 row5col1word18 row5col1word19 row5col1word20 row5col1word21 row5col1word22 row5col1word23 row5col1word24 row5col1word25 row5col1word26 row5col1word27 row5col1word28 row5col1word29 row5col1word30 row5col1word31 row5col1word32 row5col1word33 row5col1word34 row5col1word35 row5col1word36 row5col1word37 row5col1word38 row5col1word39 row5col1word40 row5col1word41 row5col1word42 row5col1word43 row5col1word44 row5col1word45 row5col1word46 row5col1word47 row5col1word48 row5col1word49 row5col1word50 	row5col2word1 row5col2word2 row5col2word3 row5col2word4 row5col2word5 row5col2word6 row5col2word7 row5col2word8 row5col2word9 row5col2word10 row5col2word11 row5col2word12 row5col2word13 row5col2word14 row5col2word15 row5col2word16 row5col2word17 row5col2word18 row5col2word19 row5col2word20 row5col2word21 row5col2word22 row5col2word23 row5col2word24 row5col2word25 row5col2word26 row5col2word27 row5col2word28 row5col2word29 row5col2word30 row5col2word31 row5col2word32 row5col2word33 row5col2word34 row5col2word35 row5col2word36 row5col2word37 row5col2word38 row5col2word39 row5col2word40 row5col2word41 row5col2word42 row5col2word43 row5col2word44 row5col2word45 row5col2word46 row5col2word47 row5col2word48 row5col2word49 row5col2word50 
select * from t1 where MATCH(a,b) AGAINST("+row35col2word49 +(row35col1word49 row35col2word40)" IN BOOLEAN MODE);
FTS_DOC_ID	a	b
35	row35col1word1 row35col1word2 row35col1word3 row35col1word4 row35col1word5 row35col1word6 row35col1word7 row35col1word8 row35col1word9 row35col1word10 row35col1word11 row35col1word12 row35col1word13 row35col1word14 row35col1word15 row35col1word16 row35col1word17 row35col1word18 row35col1word19 row35col1word20 row35col1word21 row35col1word22 row35col1word23 row35col1word24 row35col1word25 row35col1word26 row35col1word27 row35col1word28 row35col1word29 row35col1word30 row35col1word31 row35col1word32 row35col1word33 row35col1word34 row35col1word35 row35col1word36 row35col1word37 row35col1word38 row35col1word39 row35col1word40 row35col1word41 row35col1word42 row35col1word43 row35col1word44 row35col1word45 row35col1word46 row35col1word47 row35col1word48 row35col1word49 row35col1word50 	row35col2word1 row35col2word2 row35col2word3 row35col2word4 row35col2word5 row35col2word6 row35col2word7 row35col2word8 row35col2word9 row35col2word10 row35col2word11 row35col2word12 row35col2word13 row35col2word14 row35col2word15 row35col2word16 row35col2word17 row35col2word18 row35col2word19 row35col2word20 row35col2word21 row35col2word22 row35col2word23 row35col2word24 row35col2word25 row35col2word26 row35col2word27 row35col2word28 row35col2word29 row35col2word30 row35col2word31 row35col2word32 row35col2word33 row35col2word34 row35col2word35 row35col2word36 row35col2word37 row35col2word38 row35col2word39 row35col2word40 row35col2word41 row35col2word42 row35col2word43 row35col2word44 row35col2word45 row35col2word46 row35col2word47 row35col2word48 row35col2word49 row35col2word50 
select * from t1 where MATCH(a,b) AGAINST("+row35col2word49 -(row45col2word49)" IN BOOLEAN MODE);
FTS_DOC_ID	a	b
35	row35col1word1 row35col1word2 row35col1word3 row35col1word4 row35col1word5 row35col1word6 row35col1word7 row35col1word8 row35col1word9 row35col1word10 row35col1word11 row35col1word12 row35col1word13 row35col1word14 row35col1word15 row35col1word16 row35col1word17 row35col1word18 row35col1word19 row35col1word20 row35col1word21 row35col1word22 row35col1word23 row35col1word24 row35col1word25 row35col1word26 row35col1word27 row35col1word28 row35col1word29 row35col1word30 row35col1word31 row35col1word32 row35col1word33 row35col1word34 row35col1word35 row35col1word36 row35col1word37 row35col1word38 row35col1word39 row35col1word40 row35col1word41 row35col1word42 row35col1word43 row35col1word44 row35col1word45 row35col1word46 row35col1word47 row35col1word48 row35col1word49 row35col1word50 	row35col2word1 row35col2word2 row35col2word3 row35col2word4 row35col2word5 row35col2word6 row35col2word7 row35col2word8 row35col2word9 row35col2word10 row35col2word11 row35col2word12 row35col2word13 row35col2word14 row35col2word15 row35col2word16 row35col2word17 row35col2word18 row35col2word19 row35col2word20 row35col2word21 row35col2word22 row35col2word23 row35col2word24 row35col2word25 row35col2word26 row35col2word27 row35col2word28 row35col2word29 row35col2word30 row35col2word31 row35col2word32 row35col2word33 row35col2word34 row35col2word35 row35col2word36 row35col2word37 row35col2word38 row35col2word39 row35col2word40 row35col2word41 row35col2word42 row35col2word43 row35col2word44 row35col2word45 row35col2word46 row35col2word47 row35col2word48 row35col2word49 row35col2word50 
select * from t1 where MATCH(a,b) AGAINST("row5col2word49 row5col2word40" IN BOOLEAN MODE);
FTS_DOC_ID	a	b
5	row5col1word1 row5col1word2 row5col1word3 row5col1word4 row5col1word5 row5col1word6 row5col1word7 row5col1word8 row5col1word9 row5col1word10 row5col1word11 row5col1word12 row5col1word13 row5col1word14 row5col1word15 row5col1word16 row5col1word17 row5col1word18 row5col1word19 row5col1word20 row5col1word21 row5col1word22 row5col1word23 row5col1word24 row5col1word25 row5col1word26 row5col1word27 row5col1word28 row5col1word29 row5col1word30 row5col1word31 row5col1word32 row5col1word33 row5col1word34 row5col1word35 row5col1word36 row5col1word37 row5col1word38 row5col1word39 row5col1word40 row5col1word41 row5col1word42 row5col1word43 row5col1word44 row5col1word45 row5col1word46 row5col1word47 row5col1word48 row5col1word49 row5col1word50 	row5col2word1 row5col2word2 row5col2word3 row5col2word4 row5col2word5 row5col2word6 row5col2word7 row5col2word8 row5col2word9 row5col2word10 row5col2word11 row5col2word12 row5col2word13 row5col2word14 row5col2word15 row5col2word16 row5col2word17 row5col2word18 row5col2word19 row5col2word20 row5col2word21 row5col2word22 row5col2word23 row5col2word24 row5col2word25 row5col2word26 row5col2word27 row5col2word28 row5col2word29 row5col2word30 row5col2word31 row5col2word32 row5col2word33 row5col2word34 row5col2word35 row5col2word36 row5col2word37 row5col2word38 row5col2word39 row5col2word40 row5col2word41 row5col2word42 row5col2word43 row5col2word44 row5col2word45 row5col2word46 row5col2word47 row5col2word48 row5col2word49 row5col2word50 
select * from t1 where MATCH a,b AGAINST ("+row5col2word* +row5col1word49*" IN BOOLEAN MODE);
FTS_DOC_ID	a	b
5	row5col1word1 row5col1word2 row5col1word3 row5col1word4 row5col1word5 row5col1word6 row5col1word7 row5col1word8 row5col1word9 row5col1word10 row5col1word11 row5col1word12 row5col1word13 row5col1word14 row5col1word15 row5col1word16 row5col1word17 row5col1word18 row5col1word19 row5col1word20 row5col1word21 row5col1word22 row5col1word23 row5col1word24 row5col1word25 row5col1word26 row5col1word27 row5col1word28 row5col1word29 row5col1word30 row5col1word31 row5col1word32 row5col1word33 row5col1word34 row5col1word35 row5col1word36 row5col1word37 row5col1word38 row5col1word39 row5col1word40 row5col1word41 row5col1word42 row5col1word43 row5col1word44 row5col1word45 row5col1word46 row5col1word47 row5col1word48 row5col1word49 row5col1word50 	row5col2word1 row5col2word2 row5col2word3 row5col2word4 row5col2word5 row5col2word6 row5col2word7 row5col2word8 row5col2word9 row5col2word10 row5col2word11 row5col2word12 row5col2word13 row5col2word14 row5col2word15 row5col2word16 row5col2word17 row5col2word18 row5col2word19 row5col2word20 row5col2word21 row5col2word22 row5col2word23 row5col2word24 row5col2word25 row5col2word26 row5col2word27 row5col2word28 row5col2word29 row5col2word30 row5col2word31 row5col2word32 row5col2word33 row5col2word34 row5col2word35 row5col2word36 row5col2word37 row5col2word38 row5col2word39 row5col2word40 row5col2word41 row5col2word42 row5col2word43 row5col2word44 row5col2word45 row5col2word46 row5col2word47 row5col2word48 row5col2word49 row5col2word50 
select * from t1 where MATCH a,b AGAINST ('"row35col2word49"' IN BOOLEAN MODE);
FTS_DOC_ID	a	b
35	row35col1word1 row35col1word2 row35col1word3 row35col1word4 row35col1word5 row35col1word6 row35col1word7 row35col1word8 row35col1word9 row35col1word10 row35col1word11 row35col1word12 row35col1word13 row35col1word14 row35col1word15 row35col1word16 row35col1word17 row35col1word18 row35col1word19 row35col1word20 row35col1word21 row35col1word22 row35col1word23 row35col1word24 row35col1word25 row35col1word26 row35col1word27 row35col1word28 row35col1word29 row35col1word30 row35col1word31 row35col1word32 row35col1word33 row35col1word34 row35col1word35 row35col1word36 row35col1word37 row35col1word38 row35col1word39 row35col1word40 row35col1word41 row35col1word42 row35col1word43 row35col1word44 row35col1word45 row35col1word46 row35col1word47 row35col1word48 row35col1word49 row35col1word50 	row35col2word1 row35col2word2 row35col2word3 row35col2word4 row35col2word5 row35col2word6 row35col2word7 row35col2word8 row35col2word9 row35col2word10 row35col2word11 row35col2word12 row35col2word13 row35col2word14 row35col2word15 row35col2word16 row35col2word17 row35col2word18 row35col2word19 row35col2word20 row35col2word21 row35col2word22 row35col2word23 row35col2word24 row35col2word25 row35col2word26 row35col2word27 row35col2word28 row35col2word29 row35col2word30 row35col2word31 row35col2word32 row35col2word33 row35col2word34 row35col2word35 row35col2word36 row35col2word37 row35col2word38 row35col2word39 row35col2word40 row35col2word41 row35col2word42 row35col2word43 row35col2word44 row35col2word45 row35col2word46 row35col2word47 row35col2word48 row35col2word49 row35col2word50 
select * from t1 where MATCH a,b AGAINST ('"ROW35col2WORD49"' IN BOOLEAN MODE);
FTS_DOC_ID	a	b
35	row35col1word1 row35col1word2 row35col1word3 row35col1word4 row35col1word5 row35col1word6 row35col1word7 row35col1word8 row35col1word9 row35col1word10 row35col1word11 row35col1word12 row35col1word13 row35col1word14 row35col1word15 row35col1word16 row35col1word17 row35col1word18 row35col1word19 row35col1word20 row35col1word21 row35col1word22 row35col1word23 row35col1word24 row35col1word25 row35col1word26 row35col1word27 row35col1word28 row35col1word29 row35col1word30 row35col1word31 row35col1word32 row35col1word33 row35col1word34 row35col1word35 row35col1word36 row35col1word37 row35col1word38 row35col1word39 row35col1word40 row35col1word41 row35col1word42 row35col1word43 row35col1word44 row35col1word45 row35col1word46 row35col1word47 row35col1word48 row35col1word49 row35col1word50 	row35col2word1 row35col2word2 row35col2word3 row35col2word4 row35col2word5 row35col2word6 row35col2word7 row35col2word8 row35col2word9 row35col2word10 row35col2word11 row35col2word12 row35col2word13 row35col2word14 row35col2word15 row35col2word16 row35col2word17 row35col2word18 row35col2word19 row35col2word20 row35col2word21 row35col2word22 row35col2word23 row35col2word24 row35col2word25 row35col2word26 row35col2word27 row35col2word28 row35col2word29 row35col2word30 row35col2word31 row35col2word32 row35col2word33 row35col2word34 row35col2word35 row35col2word36 row35col2word37 row35col2word38 row35col2word39 row35col2word40 row35col2word41 row35col2word42 row35col2word43 row35col2word44 row35col2word45 row35col2word46 row35col2word47 row35col2word48 row35col2word49 row35col2word50 
select * from t1 where MATCH(a,b) AGAINST ("row5col2word49" WITH QUERY EXPANSION);
FTS_DOC_ID	a	b
5	row5col1word1 row5col1word2 row5col1word3 row5col1word4 row5col1word5 row5col1word6 row5col1word7 row5col1word8 row5col1word9 row5col1word10 row5col1word11 row5col1word12 row5col1word13 row5col1word14 row5col1word15 row5col1word16 row5col1word17 row5col1word18 row5col1word19 row5col1word20 row5col1word21 row5col1word22 row5col1word23 row5col1word24 row5col1word25 row5col1word26 row5col1word27 row5col1word28 row5col1word29 row5col1word30 row5col1word31 row5col1word32 row5col1word33 row5col1word34 row5col1word35 row5col1word36 row5col1word37 row5col1word38 row5col1word39 row5col1word40 row5col1word41 row5col1word42 row5col1word43 row5col1word44 row5col1word45 row5col1word46 row5col1word47 row5col1word48 row5col1word49 row5col1word50 	row5col2word1 row5col2word2 row5col2word3 row5col2word4 row5col2word5 row5col2word6 row5col2word7 row5col2word8 row5col2word9 row5col2word10 row5col2word11 row5col2word12 row5col2word13 row5col2word14 row5col2word15 row5col2word16 row5col2word17 row5col2word18 row5col2word19 row5col2word20 row5col2word21 row5col2word22 row5col2word23 row5col2word24 row5col2word25 row5col2word26 row5col2word27 row5col2word28 row5col2word29 row5col2word30 row5col2word31 row5col2word32 row5col2word33 row5col2word34 row5col2word35 row5col2word36 row5col2word37 row5col2word38 row5col2word39 row5col2word40 row5col2word41 row5col2word42 row5col2word43 row5col2word44 row5col2word45 row5col2word46 row5col2word47 row5col2word48 row5col2word49 row5col2word50 
SELECT * FROM t1
WHERE MATCH (a,b)
AGAINST ('"row5col2word48 row5col2word49"@20' IN BOOLEAN MODE);
FTS_DOC_ID	a	b
5	row5col1word1 row5col1word2 row5col1word3 row5col1word4 row5col1word5 row5col1word6 row5col1word7 row5col1word8 row5col1word9 row5col1word10 row5col1word11 row5col1word12 row5col1word13 row5col1word14 row5col1word15 row5col1word16 row5col1word17 row5col1word18 row5col1word19 row5col1word20 row5col1word21 row5col1word22 row5col1word23 row5col1word24 row5col1word25 row5col1word26 row5col1word27 row5col1word28 row5col1word29 row5col1word30 row5col1word31 row5col1word32 row5col1word33 row5col1word34 row5col1word35 row5col1word36 row5col1word37 row5col1word38 row5col1word39 row5col1word40 row5col1word41 row5col1word42 row5col1word43 row5col1word44 row5col1word45 row5col1word46 row5col1word47 row5col1word48 row5col1word49 row5col1word50 	row5col2word1 row5col2word2 row5col2word3 row5col2word4 row5col2word5 row5col2word6 row5col2word7 row5col2word8 row5col2word9 row5col2word10 row5col2word11 row5col2word12 row5col2word13 row5col2word14 row5col2word15 row5col2word16 row5col2word17 row5col2word18 row5col2word19 row5col2word20 row5col2word21 row5col2word22 row5col2word23 row5col2word24 row5col2word25 row5col2word26 row5col2word27 row5col2word28 row5col2word29 row5col2word30 row5col2word31 row5col2word32 row5col2word33 row5col2word34 row5col2word35 row5col2word36 row5col2word37 row5col2word38 row5col2word39 row5col2word40 row5col2word41 row5col2word42 row5col2word43 row5col2word44 row5col2word45 row5col2word46 row5col2word47 row5col2word48 row5col2word49 row5col2word50 
SELECT * FROM t1
WHERE MATCH (a,b)
AGAINST ('"row5col2word48 row5col2word49"@10' IN BOOLEAN MODE);
FTS_DOC_ID	a	b
UPDATE t1 SET a = "using update" , b = "changing fulltext index record" 
WHERE MATCH(a,b) AGAINST("+row5col2word49 +row5col1word49" IN BOOLEAN MODE);
select a,b from t1 where MATCH(a,b) AGAINST("+row5col2word49 +row5col1word49" IN BOOLEAN MODE);
a	b
select a,b from t1 where MATCH(a,b) AGAINST("changing fulltext" IN BOOLEAN MODE);
a	b
using update	changing fulltext index record
select a,b from t1 where MATCH(a,b) AGAINST("+chang* +fulltext" IN BOOLEAN MODE);
a	b
using update	changing fulltext index record
DELETE FROM t1 WHERE MATCH(a,b) AGAINST("+chang* +fulltext" IN BOOLEAN MODE);
select a,b from t1 where MATCH(a,b) AGAINST("+chang* +fulltext" IN BOOLEAN MODE);
a	b
DROP TABLE t1;
CREATE TABLE t1 (
FTS_DOC_ID BIGINT UNSIGNED AUTO_INCREMENT NOT NULL PRIMARY KEY, 
a TEXT,
b TEXT
) ENGINE= <default_engine>;
create unique index FTS_DOC_ID_INDEX on t1(FTS_DOC_ID);
"Loading data using LOAD DATA Command , File <MYSQLTEST_VARDIR>/tmp/fts_input_data.txt"
CREATE FULLTEXT INDEX idx on t1 (a,b);
SELECT COUNT(*) FROM t1;
COUNT(*)
5000
SELECT a,b from t1 where b like '%row300col2word30%';
a	b
row300col1word1 row300col1word2 row300col1word3 row300col1word4 row300col1word5 row300col1word6 row300col1word7 row300col1word8 row300col1word9 row300col1word10 row300col1word11 row300col1word12 row300col1word13 row300col1word14 row300col1word15 row300col1word16 row300col1word17 row300col1word18 row300col1word19 row300col1word20 row300col1word21 row300col1word22 row300col1word23 row300col1word24 row300col1word25 row300col1word26 row300col1word27 row300col1word28 row300col1word29 row300col1word30 row300col1word31 row300col1word32 row300col1word33 row300col1word34 row300col1word35 row300col1word36 row300col1word37 row300col1word38 row300col1word39 row300col1word40 row300col1word41 row300col1word42 row300col1word43 row300col1word44 row300col1word45 row300col1word46 row300col1word47 row300col1word48 row300col1word49 	row300col2word1 row300col2word2 row300col2word3 row300col2word4 row300col2word5 row300col2word6 row300col2word7 row300col2word8 row300col2word9 row300col2word10 row300col2word11 row300col2word12 row300col2word13 row300col2word14 row300col2word15 row300col2word16 row300col2word17 row300col2word18 row300col2word19 row300col2word20 row300col2word21 row300col2word22 row300col2word23 row300col2word24 row300col2word25 row300col2word26 row300col2word27 row300col2word28 row300col2word29 row300col2word30 row300col2word31 row300col2word32 row300col2word33 row300col2word34 row300col2word35 row300col2word36 row300col2word37 row300col2word38 row300col2word39 row300col2word40 row300col2word41 row300col2word42 row300col2word43 row300col2word44 row300col2word45 row300col2word46 row300col2word47 row300col2word48 row300col2word49 
SELECT * FROM t1 WHERE MATCH (a,b)
AGAINST ('row35col2word49' IN NATURAL LANGUAGE MODE);
FTS_DOC_ID	a	b
35	row35col1word1 row35col1word2 row35col1word3 row35col1word4 row35col1word5 row35col1word6 row35col1word7 row35col1word8 row35col1word9 row35col1word10 row35col1word11 row35col1word12 row35col1word13 row35col1word14 row35col1word15 row35col1word16 row35col1word17 row35col1word18 row35col1word19 row35col1word20 row35col1word21 row35col1word22 row35col1word23 row35col1word24 row35col1word25 row35col1word26 row35col1word27 row35col1word28 row35col1word29 row35col1word30 row35col1word31 row35col1word32 row35col1word33 row35col1word34 row35col1word35 row35col1word36 row35col1word37 row35col1word38 row35col1word39 row35col1word40 row35col1word41 row35col1word42 row35col1word43 row35col1word44 row35col1word45 row35col1word46 row35col1word47 row35col1word48 row35col1word49 	row35col2word1 row35col2word2 row35col2word3 row35col2word4 row35col2word5 row35col2word6 row35col2word7 row35col2word8 row35col2word9 row35col2word10 row35col2word11 row35col2word12 row35col2word13 row35col2word14 row35col2word15 row35col2word16 row35col2word17 row35col2word18 row35col2word19 row35col2word20 row35col2word21 row35col2word22 row35col2word23 row35col2word24 row35col2word25 row35col2word26 row35col2word27 row35col2word28 row35col2word29 row35col2word30 row35col2word31 row35col2word32 row35col2word33 row35col2word34 row35col2word35 row35col2word36 row35col2word37 row35col2word38 row35col2word39 row35col2word40 row35col2word41 row35col2word42 row35col2word43 row35col2word44 row35col2word45 row35col2word46 row35col2word47 row35col2word48 row35col2word49 
select * from t1 where MATCH(a,b) AGAINST("+row5col2word49 +row5col1word49" IN BOOLEAN MODE);
FTS_DOC_ID	a	b
5	row5col1word1 row5col1word2 row5col1word3 row5col1word4 row5col1word5 row5col1word6 row5col1word7 row5col1word8 row5col1word9 row5col1word10 row5col1word11 row5col1word12 row5col1word13 row5col1word14 row5col1word15 row5col1word16 row5col1word17 row5col1word18 row5col1word19 row5col1word20 row5col1word21 row5col1word22 row5col1word23 row5col1word24 row5col1word25 row5col1word26 row5col1word27 row5col1word28 row5col1word29 row5col1word30 row5col1word31 row5col1word32 row5col1word33 row5col1word34 row5col1word35 row5col1word36 row5col1word37 row5col1word38 row5col1word39 row5col1word40 row5col1word41 row5col1word42 row5col1word43 row5col1word44 row5col1word45 row5col1word46 row5col1word47 row5col1word48 row5col1word49 	row5col2word1 row5col2word2 row5col2word3 row5col2word4 row5col2word5 row5col2word6 row5col2word7 row5col2word8 row5col2word9 row5col2word10 row5col2word11 row5col2word12 row5col2word13 row5col2word14 row5col2word15 row5col2word16 row5col2word17 row5col2word18 row5col2word19 row5col2word20 row5col2word21 row5col2word22 row5col2word23 row5col2word24 row5col2word25 row5col2word26 row5col2word27 row5col2word28 row5col2word29 row5col2word30 row5col2word31 row5col2word32 row5col2word33 row5col2word34 row5col2word35 row5col2word36 row5col2word37 row5col2word38 row5col2word39 row5col2word40 row5col2word41 row5col2word42 row5col2word43 row5col2word44 row5col2word45 row5col2word46 row5col2word47 row5col2word48 row5col2word49 
select * from t1 where MATCH(a,b) AGAINST("+row5col2word49" IN BOOLEAN MODE);
FTS_DOC_ID	a	b
5	row5col1word1 row5col1word2 row5col1word3 row5col1word4 row5col1word5 row5col1word6 row5col1word7 row5col1word8 row5col1word9 row5col1word10 row5col1word11 row5col1word12 row5col1word13 row5col1word14 row5col1word15 row5col1word16 row5col1word17 row5col1word18 row5col1word19 row5col1word20 row5col1word21 row5col1word22 row5col1word23 row5col1word24 row5col1word25 row5col1word26 row5col1word27 row5col1word28 row5col1word29 row5col1word30 row5col1word31 row5col1word32 row5col1word33 row5col1word34 row5col1word35 row5col1word36 row5col1word37 row5col1word38 row5col1word39 row5col1word40 row5col1word41 row5col1word42 row5col1word43 row5col1word44 row5col1word45 row5col1word46 row5col1word47 row5col1word48 row5col1word49 	row5col2word1 row5col2word2 row5col2word3 row5col2word4 row5col2word5 row5col2word6 row5col2word7 row5col2word8 row5col2word9 row5col2word10 row5col2word11 row5col2word12 row5col2word13 row5col2word14 row5col2word15 row5col2word16 row5col2word17 row5col2word18 row5col2word19 row5col2word20 row5col2word21 row5col2word22 row5col2word23 row5col2word24 row5col2word25 row5col2word26 row5col2word27 row5col2word28 row5col2word29 row5col2word30 row5col2word31 row5col2word32 row5col2word33 row5col2word34 row5col2word35 row5col2word36 row5col2word37 row5col2word38 row5col2word39 row5col2word40 row5col2word41 row5col2word42 row5col2word43 row5col2word44 row5col2word45 row5col2word46 row5col2word47 row5col2word48 row5col2word49 
select * from t1 where MATCH(a,b) AGAINST("+row35col2word49 +(row35col1word49 row35col2word40)" IN BOOLEAN MODE);
FTS_DOC_ID	a	b
35	row35col1word1 row35col1word2 row35col1word3 row35col1word4 row35col1word5 row35col1word6 row35col1word7 row35col1word8 row35col1word9 row35col1word10 row35col1word11 row35col1word12 row35col1word13 row35col1word14 row35col1word15 row35col1word16 row35col1word17 row35col1word18 row35col1word19 row35col1word20 row35col1word21 row35col1word22 row35col1word23 row35col1word24 row35col1word25 row35col1word26 row35col1word27 row35col1word28 row35col1word29 row35col1word30 row35col1word31 row35col1word32 row35col1word33 row35col1word34 row35col1word35 row35col1word36 row35col1word37 row35col1word38 row35col1word39 row35col1word40 row35col1word41 row35col1word42 row35col1word43 row35col1word44 row35col1word45 row35col1word46 row35col1word47 row35col1word48 row35col1word49 	row35col2word1 row35col2word2 row35col2word3 row35col2word4 row35col2word5 row35col2word6 row35col2word7 row35col2word8 row35col2word9 row35col2word10 row35col2word11 row35col2word12 row35col2word13 row35col2word14 row35col2word15 row35col2word16 row35col2word17 row35col2word18 row35col2word19 row35col2word20 row35col2word21 row35col2word22 row35col2word23 row35col2word24 row35col2word25 row35col2word26 row35col2word27 row35col2word28 row35col2word29 row35col2word30 row35col2word31 row35col2word32 row35col2word33 row35col2word34 row35col2word35 row35col2word36 row35col2word37 row35col2word38 row35col2word39 row35col2word40 row35col2word41 row35col2word42 row35col2word43 row35col2word44 row35col2word45 row35col2word46 row35col2word47 row35col2word48 row35col2word49 
select * from t1 where MATCH(a,b) AGAINST("+row35col2word49 -(row45col2word49)" IN BOOLEAN MODE);
FTS_DOC_ID	a	b
35	row35col1word1 row35col1word2 row35col1word3 row35col1word4 row35col1word5 row35col1word6 row35col1word7 row35col1word8 row35col1word9 row35col1word10 row35col1word11 row35col1word12 row35col1word13 row35col1word14 row35col1word15 row35col1word16 row35col1word17 row35col1word18 row35col1word19 row35col1word20 row35col1word21 row35col1word22 row35col1word23 row35col1word24 row35col1word25 row35col1word26 row35col1word27 row35col1word28 row35col1word29 row35col1word30 row35col1word31 row35col1word32 row35col1word33 row35col1word34 row35col1word35 row35col1word36 row35col1word37 row35col1word38 row35col1word39 row35col1word40 row35col1word41 row35col1word42 row35col1word43 row35col1word44 row35col1word45 row35col1word46 row35col1word47 row35col1word48 row35col1word49 	row35col2word1 row35col2word2 row35col2word3 row35col2word4 row35col2word5 row35col2word6 row35col2word7 row35col2word8 row35col2word9 row35col2word10 row35col2word11 row35col2word12 row35col2word13 row35col2word14 row35col2word15 row35col2word16 row35col2word17 row35col2word18 row35col2word19 row35col2word20 row35col2word21 row35col2word22 row35col2word23 row35col2word24 row35col2word25 row35col2word26 row35col2word27 row35col2word28 row35col2word29 row35col2word30 row35col2word31 row35col2word32 row35col2word33 row35col2word34 row35col2word35 row35col2word36 row35col2word37 row35col2word38 row35col2word39 row35col2word40 row35col2word41 row35col2word42 row35col2word43 row35col2word44 row35col2word45 row35col2word46 row35col2word47 row35col2word48 row35col2word49 
select * from t1 where MATCH(a,b) AGAINST("row5col2word49 row5col2word40" IN BOOLEAN MODE);
FTS_DOC_ID	a	b
5	row5col1word1 row5col1word2 row5col1word3 row5col1word4 row5col1word5 row5col1word6 row5col1word7 row5col1word8 row5col1word9 row5col1word10 row5col1word11 row5col1word12 row5col1word13 row5col1word14 row5col1word15 row5col1word16 row5col1word17 row5col1word18 row5col1word19 row5col1word20 row5col1word21 row5col1word22 row5col1word23 row5col1word24 row5col1word25 row5col1word26 row5col1word27 row5col1word28 row5col1word29 row5col1word30 row5col1word31 row5col1word32 row5col1word33 row5col1word34 row5col1word35 row5col1word36 row5col1word37 row5col1word38 row5col1word39 row5col1word40 row5col1word41 row5col1word42 row5col1word43 row5col1word44 row5col1word45 row5col1word46 row5col1word47 row5col1word48 row5col1word49 	row5col2word1 row5col2word2 row5col2word3 row5col2word4 row5col2word5 row5col2word6 row5col2word7 row5col2word8 row5col2word9 row5col2word10 row5col2word11 row5col2word12 row5col2word13 row5col2word14 row5col2word15 row5col2word16 row5col2word17 row5col2word18 row5col2word19 row5col2word20 row5col2word21 row5col2word22 row5col2word23 row5col2word24 row5col2word25 row5col2word26 row5col2word27 row5col2word28 row5col2word29 row5col2word30 row5col2word31 row5col2word32 row5col2word33 row5col2word34 row5col2word35 row5col2word36 row5col2word37 row5col2word38 row5col2word39 row5col2word40 row5col2word41 row5col2word42 row5col2word43 row5col2word44 row5col2word45 row5col2word46 row5col2word47 row5col2word48 row5col2word49 
select * from t1 where MATCH a,b AGAINST ("+row5col2word* +row5col1word49*" IN BOOLEAN MODE);
FTS_DOC_ID	a	b
5	row5col1word1 row5col1word2 row5col1word3 row5col1word4 row5col1word5 row5col1word6 row5col1word7 row5col1word8 row5col1word9 row5col1word10 row5col1word11 row5col1word12 row5col1word13 row5col1word14 row5col1word15 row5col1word16 row5col1word17 row5col1word18 row5col1word19 row5col1word20 row5col1word21 row5col1word22 row5col1word23 row5col1word24 row5col1word25 row5col1word26 row5col1word27 row5col1word28 row5col1word29 row5col1word30 row5col1word31 row5col1word32 row5col1word33 row5col1word34 row5col1word35 row5col1word36 row5col1word37 row5col1word38 row5col1word39 row5col1word40 row5col1word41 row5col1word42 row5col1word43 row5col1word44 row5col1word45 row5col1word46 row5col1word47 row5col1word48 row5col1word49 	row5col2word1 row5col2word2 row5col2word3 row5col2word4 row5col2word5 row5col2word6 row5col2word7 row5col2word8 row5col2word9 row5col2word10 row5col2word11 row5col2word12 row5col2word13 row5col2word14 row5col2word15 row5col2word16 row5col2word17 row5col2word18 row5col2word19 row5col2word20 row5col2word21 row5col2word22 row5col2word23 row5col2word24 row5col2word25 row5col2word26 row5col2word27 row5col2word28 row5col2word29 row5col2word30 row5col2word31 row5col2word32 row5col2word33 row5col2word34 row5col2word35 row5col2word36 row5col2word37 row5col2word38 row5col2word39 row5col2word40 row5col2word41 row5col2word42 row5col2word43 row5col2word44 row5col2word45 row5col2word46 row5col2word47 row5col2word48 row5col2word49 
select * from t1 where MATCH a,b AGAINST ('"row35col2word49"' IN BOOLEAN MODE);
FTS_DOC_ID	a	b
35	row35col1word1 row35col1word2 row35col1word3 row35col1word4 row35col1word5 row35col1word6 row35col1word7 row35col1word8 row35col1word9 row35col1word10 row35col1word11 row35col1word12 row35col1word13 row35col1word14 row35col1word15 row35col1word16 row35col1word17 row35col1word18 row35col1word19 row35col1word20 row35col1word21 row35col1word22 row35col1word23 row35col1word24 row35col1word25 row35col1word26 row35col1word27 row35col1word28 row35col1word29 row35col1word30 row35col1word31 row35col1word32 row35col1word33 row35col1word34 row35col1word35 row35col1word36 row35col1word37 row35col1word38 row35col1word39 row35col1word40 row35col1word41 row35col1word42 row35col1word43 row35col1word44 row35col1word45 row35col1word46 row35col1word47 row35col1word48 row35col1word49 	row35col2word1 row35col2word2 row35col2word3 row35col2word4 row35col2word5 row35col2word6 row35col2word7 row35col2word8 row35col2word9 row35col2word10 row35col2word11 row35col2word12 row35col2word13 row35col2word14 row35col2word15 row35col2word16 row35col2word17 row35col2word18 row35col2word19 row35col2word20 row35col2word21 row35col2word22 row35col2word23 row35col2word24 row35col2word25 row35col2word26 row35col2word27 row35col2word28 row35col2word29 row35col2word30 row35col2word31 row35col2word32 row35col2word33 row35col2word34 row35col2word35 row35col2word36 row35col2word37 row35col2word38 row35col2word39 row35col2word40 row35col2word41 row35col2word42 row35col2word43 row35col2word44 row35col2word45 row35col2word46 row35col2word47 row35col2word48 row35col2word49 
select * from t1 where MATCH a,b AGAINST ('"ROW35col2WORD49"' IN BOOLEAN MODE);
FTS_DOC_ID	a	b
35	row35col1word1 row35col1word2 row35col1word3 row35col1word4 row35col1word5 row35col1word6 row35col1word7 row35col1word8 row35col1word9 row35col1word10 row35col1word11 row35col1word12 row35col1word13 row35col1word14 row35col1word15 row35col1word16 row35col1word17 row35col1word18 row35col1word19 row35col1word20 row35col1word21 row35col1word22 row35col1word23 row35col1word24 row35col1word25 row35col1word26 row35col1word27 row35col1word28 row35col1word29 row35col1word30 row35col1word31 row35col1word32 row35col1word33 row35col1word34 row35col1word35 row35col1word36 row35col1word37 row35col1word38 row35col1word39 row35col1word40 row35col1word41 row35col1word42 row35col1word43 row35col1word44 row35col1word45 row35col1word46 row35col1word47 row35col1word48 row35col1word49 	row35col2word1 row35col2word2 row35col2word3 row35col2word4 row35col2word5 row35col2word6 row35col2word7 row35col2word8 row35col2word9 row35col2word10 row35col2word11 row35col2word12 row35col2word13 row35col2word14 row35col2word15 row35col2word16 row35col2word17 row35col2word18 row35col2word19 row35col2word20 row35col2word21 row35col2word22 row35col2word23 row35col2word24 row35col2word25 row35col2word26 row35col2word27 row35col2word28 row35col2word29 row35col2word30 row35col2word31 row35col2word32 row35col2word33 row35col2word34 row35col2word35 row35col2word36 row35col2word37 row35col2word38 row35col2word39 row35col2word40 row35col2word41 row35col2word42 row35col2word43 row35col2word44 row35col2word45 row35col2word46 row35col2word47 row35col2word48 row35col2word49 
select * from t1 where MATCH(a,b) AGAINST ("row5col2word49" WITH QUERY EXPANSION);
FTS_DOC_ID	a	b
5	row5col1word1 row5col1word2 row5col1word3 row5col1word4 row5col1word5 row5col1word6 row5col1word7 row5col1word8 row5col1word9 row5col1word10 row5col1word11 row5col1word12 row5col1word13 row5col1word14 row5col1word15 row5col1word16 row5col1word17 row5col1word18 row5col1word19 row5col1word20 row5col1word21 row5col1word22 row5col1word23 row5col1word24 row5col1word25 row5col1word26 row5col1word27 row5col1word28 row5col1word29 row5col1word30 row5col1word31 row5col1word32 row5col1word33 row5col1word34 row5col1word35 row5col1word36 row5col1word37 row5col1word38 row5col1word39 row5col1word40 row5col1word41 row5col1word42 row5col1word43 row5col1word44 row5col1word45 row5col1word46 row5col1word47 row5col1word48 row5col1word49 	row5col2word1 row5col2word2 row5col2word3 row5col2word4 row5col2word5 row5col2word6 row5col2word7 row5col2word8 row5col2word9 row5col2word10 row5col2word11 row5col2word12 row5col2word13 row5col2word14 row5col2word15 row5col2word16 row5col2word17 row5col2word18 row5col2word19 row5col2word20 row5col2word21 row5col2word22 row5col2word23 row5col2word24 row5col2word25 row5col2word26 row5col2word27 row5col2word28 row5col2word29 row5col2word30 row5col2word31 row5col2word32 row5col2word33 row5col2word34 row5col2word35 row5col2word36 row5col2word37 row5col2word38 row5col2word39 row5col2word40 row5col2word41 row5col2word42 row5col2word43 row5col2word44 row5col2word45 row5col2word46 row5col2word47 row5col2word48 row5col2word49 
SELECT * FROM t1
WHERE MATCH (a,b)
AGAINST ('"row5col2word48 row5col2word49"@20' IN BOOLEAN MODE);
FTS_DOC_ID	a	b
5	row5col1word1 row5col1word2 row5col1word3 row5col1word4 row5col1word5 row5col1word6 row5col1word7 row5col1word8 row5col1word9 row5col1word10 row5col1word11 row5col1word12 row5col1word13 row5col1word14 row5col1word15 row5col1word16 row5col1word17 row5col1word18 row5col1word19 row5col1word20 row5col1word21 row5col1word22 row5col1word23 row5col1word24 row5col1word25 row5col1word26 row5col1word27 row5col1word28 row5col1word29 row5col1word30 row5col1word31 row5col1word32 row5col1word33 row5col1word34 row5col1word35 row5col1word36 row5col1word37 row5col1word38 row5col1word39 row5col1word40 row5col1word41 row5col1word42 row5col1word43 row5col1word44 row5col1word45 row5col1word46 row5col1word47 row5col1word48 row5col1word49 	row5col2word1 row5col2word2 row5col2word3 row5col2word4 row5col2word5 row5col2word6 row5col2word7 row5col2word8 row5col2word9 row5col2word10 row5col2word11 row5col2word12 row5col2word13 row5col2word14 row5col2word15 row5col2word16 row5col2word17 row5col2word18 row5col2word19 row5col2word20 row5col2word21 row5col2word22 row5col2word23 row5col2word24 row5col2word25 row5col2word26 row5col2word27 row5col2word28 row5col2word29 row5col2word30 row5col2word31 row5col2word32 row5col2word33 row5col2word34 row5col2word35 row5col2word36 row5col2word37 row5col2word38 row5col2word39 row5col2word40 row5col2word41 row5col2word42 row5col2word43 row5col2word44 row5col2word45 row5col2word46 row5col2word47 row5col2word48 row5col2word49 
SELECT * FROM t1
WHERE MATCH (a,b)
AGAINST ('"row5col2word48 row5col2word49"@10' IN BOOLEAN MODE);
FTS_DOC_ID	a	b
UPDATE t1 SET a = "using update" , b = "changing fulltext index record" 
WHERE MATCH(a,b) AGAINST("+row5col2word49 +row5col1word49" IN BOOLEAN MODE);
select a,b from t1 where MATCH(a,b) AGAINST("+row5col2word49 +row5col1word49" IN BOOLEAN MODE);
a	b
select a,b from t1 where MATCH(a,b) AGAINST("changing fulltext" IN BOOLEAN MODE);
a	b
using update	changing fulltext index record
select a,b from t1 where MATCH(a,b) AGAINST("+chang* +fulltext" IN BOOLEAN MODE);
a	b
using update	changing fulltext index record
DELETE FROM t1 WHERE MATCH(a,b) AGAINST("+chang* +fulltext" IN BOOLEAN MODE);
select a,b from t1 where MATCH(a,b) AGAINST("+chang* +fulltext" IN BOOLEAN MODE);
a	b
ALTER TABLE t1 DROP INDEX idx;
CREATE FULLTEXT INDEX idx on t1 (a,b);
UPDATE t1 SET a = NULL , b = NULL ;
SELECT COUNT(*) FROM t1 WHERE a IS NULL AND b IS NULL;
COUNT(*)
4999
ALTER TABLE t1 DROP INDEX idx;
SELECT COUNT(*) FROM t1 WHERE a IS NULL AND b IS NULL;
COUNT(*)
4999
DROP TABLE t1;
CREATE TABLE t1 (
FTS_DOC_ID BIGINT UNSIGNED AUTO_INCREMENT NOT NULL PRIMARY KEY, 
a TEXT,
b TEXT
) ENGINE= <default_engine>;
create unique index FTS_DOC_ID_INDEX on t1(FTS_DOC_ID);
"Loading data using LOAD DATA Command , File <MYSQLTEST_VARDIR>/tmp/fts_input_data.txt"
CREATE FULLTEXT INDEX idx on t1 (a,b);
SELECT COUNT(*) FROM t1;
COUNT(*)
5000
SELECT count(*) from t1 where b like '%samerowword%';
count(*)
5000
SELECT COUNT(*) FROM t1 WHERE MATCH (a,b)
AGAINST ('samerowword' IN NATURAL LANGUAGE MODE);
COUNT(*)
5000
select count(*) from t1 where MATCH(a,b) AGAINST("+samerowword +samerowword" IN BOOLEAN MODE);
count(*)
5000
select count(*) from t1 where MATCH(a,b) AGAINST("+samerowword" IN BOOLEAN MODE);
count(*)
5000
select count(*) from t1 where MATCH(a,b) AGAINST("+samerowword -(row45col2word49)" IN BOOLEAN MODE);
count(*)
5000
select count(*) from t1 where MATCH a,b AGAINST ("+sameroww" IN BOOLEAN MODE);
count(*)
0
select count(*) from t1 where MATCH(a,b) AGAINST ("samerowword" WITH QUERY EXPANSION);
count(*)
5000
UPDATE t1 SET a = "using update" , b = "changing fulltext index record" 
WHERE MATCH(a,b) AGAINST("+samerowword +samerowword" IN BOOLEAN MODE);
select count(*) from t1 where MATCH(a,b) AGAINST("+samerowword +samerowword" IN BOOLEAN MODE);
count(*)
0
select count(*) from t1 where MATCH(a,b) AGAINST("+samerowword" IN BOOLEAN MODE);
count(*)
0
select count(*) from t1 where MATCH(a,b) AGAINST("changing fulltext" IN BOOLEAN MODE);
count(*)
5000
select count(*) from t1 where MATCH(a,b) AGAINST("+chang* +fulltext" IN BOOLEAN MODE);
count(*)
5000
DELETE FROM t1 WHERE MATCH(a,b) AGAINST("+chang* +fulltext" IN BOOLEAN MODE);
select count(*) from t1 where MATCH(a,b) AGAINST("+chang* +fulltext" IN BOOLEAN MODE);
count(*)
0
ALTER TABLE t1 DROP INDEX idx;
CREATE FULLTEXT INDEX idx on t1 (a,b);
UPDATE t1 SET a = NULL , b = NULL ;
SELECT COUNT(*) FROM t1 WHERE a IS NULL AND b IS NULL;
COUNT(*)
0
ALTER TABLE t1 DROP INDEX idx;
SELECT COUNT(*) FROM t1 WHERE a IS NULL AND b IS NULL;
COUNT(*)
0
DROP TABLE t1;
CREATE TABLE t1 (
FTS_DOC_ID BIGINT UNSIGNED AUTO_INCREMENT NOT NULL PRIMARY KEY, 
a TEXT,
b TEXT
) ENGINE= <default_engine>;
create unique index FTS_DOC_ID_INDEX on t1(FTS_DOC_ID);
"Loading data using LOAD DATA Command , File <MYSQLTEST_VARDIR>/tmp/fts_input_data.txt"
CREATE FULLTEXT INDEX idx on t1 (a,b);
SELECT COUNT(*) FROM t1;
COUNT(*)
5000
SELECT count(*) from t1 where a like '%samerowword%';
count(*)
5000
SELECT COUNT(*) FROM t1 WHERE MATCH (a,b)
AGAINST ('samerowword' IN NATURAL LANGUAGE MODE);
COUNT(*)
5000
select count(*) from t1 where MATCH(a,b) AGAINST("+samerowword +1050" IN BOOLEAN MODE);
count(*)
5000
select count(*) from t1 where MATCH(a,b) AGAINST("+samerowword" IN BOOLEAN MODE);
count(*)
5000
select count(*) from t1 where MATCH(a,b) AGAINST("+samerowword -(1050)" IN BOOLEAN MODE);
count(*)
0
select count(*) from t1 where MATCH a,b AGAINST ("+2001" IN BOOLEAN MODE);
count(*)
0
select count(*) from t1 where MATCH(a,b) AGAINST ("samerowword" WITH QUERY EXPANSION);
count(*)
5000
UPDATE t1 SET a = "using update" , b = "changing fulltext index record" 
WHERE MATCH(a,b) AGAINST("+samerowword +1050" IN BOOLEAN MODE);
select count(*) from t1 where MATCH(a,b) AGAINST("+samerowword +1050" IN BOOLEAN MODE);
count(*)
0
select count(*) from t1 where MATCH(a,b) AGAINST("+samerowword" IN BOOLEAN MODE);
count(*)
0
select count(*) from t1 where MATCH(a,b) AGAINST("changing fulltext" IN BOOLEAN MODE);
count(*)
5000
select count(*) from t1 where MATCH(a,b) AGAINST("+chang* +fulltext" IN BOOLEAN MODE);
count(*)
5000
DELETE FROM t1 WHERE MATCH(a,b) AGAINST("+chang* +fulltext" IN BOOLEAN MODE);
select count(*) from t1 where MATCH(a,b) AGAINST("+chang* +fulltext" IN BOOLEAN MODE);
count(*)
0
ALTER TABLE t1 DROP INDEX idx;
CREATE FULLTEXT INDEX idx on t1 (a,b);
UPDATE t1 SET a = NULL , b = NULL ;
SELECT COUNT(*) FROM t1 WHERE a IS NULL AND b IS NULL;
COUNT(*)
0
ALTER TABLE t1 DROP INDEX idx;
SELECT COUNT(*) FROM t1 WHERE a IS NULL AND b IS NULL;
COUNT(*)
0
DROP TABLE t1;
