#
# Bug #30664660 GCOLS, CRASH AND CORRUPTIONS WITH DELETE IGNORE + JSON
#
SET @@session.timestamp = 1100000000;
CREATE TABLE data_examples (
id INT PRIMARY KEY AUTO_INCREMENT,
type_name TEXT,
value_sql TEXT
);
INSERT INTO data_examples (type_name,value_sql) VALUES
('JSON', '"{}"'),
('JSON', '''["hello beautiful world"]'''),
('JSON', '"-1"'),
('TINYINT', '-1'),
('SMALLINT', '-1'),
('MEDIUMINT', '-1'),
('INT', '2000000000'),
('INT', '-2000000000'),
('INT UNSIGNED', '4000000000'),
('BIGINT', '2000000000000000000'),
('BIGINT', '-2000000000000000000'),
('FLOAT', '-1.23456'),
('FLOAT', '-1e38'),
('FLOAT', '1e38'),
('DOUBLE', '-1.23456789012345'),
('DOUBLE', '1.23456789012345'),
('DOUBLE', '-1e300'),
('DOUBLE', '1e300'),
('DECIMAL(4,2)', '-10.99'),
('DECIMAL(34,4)', '20000000000000000000000000000.0001'),
('DECIMAL(34,4)', '-20000000000000000000000000000.0001'),
('BIT(64)', '0xDEADBEEFC0FEBABE'),
('BIT(4)', '0b1000'),
('YEAR', '2020'),
('DATE', '"2030-04-05"'),
('TIME', '"11:12:13"'),
('DATETIME', '"2030-04-05 11:12:13"'),
('TIMESTAMP', '"2030-04-05 11:12:13"'),
('CHAR(40)', '"2000000000000000000000000000000000000"'),
('BINARY(45)', '"200000000000000000000000000000000000000000"'),
('VARCHAR(50)', '"2000000000000000000000000000000000000000000000000"'),
('CHAR(24)', '"hello beautiful world"'),
('BINARY(12)', '"hello world"'),
('VARCHAR(6)', '"hello"'),
('ENUM("up","down")', '"up"'),
('SET("up","down")', '"up,down"'),
('GEOMETRY', 'ST_GeomFromText("POINT(1 1)")'),
('POINT', 'ST_GeomFromText("POINT(1 1)")'),
('LINESTRING', 'ST_GeomFromText("LINESTRING(0 0,1 1,2 2)")'),
(
'POLYGON',
'ST_GeomFromText("POLYGON((0 0,1 0,1 1,0 1,0 0),(5 5,7 5,7 7,5 7,5 5))")'
  );
CREATE TABLE data_types (
id INT PRIMARY KEY AUTO_INCREMENT,
name TEXT
);
INSERT INTO data_types (name)
SELECT type_name FROM data_examples GROUP BY type_name ORDER BY MIN(id);
#
# Testing virtual column of type JSON
#
# Testing example of type JSON and value "{}"
SHOW CREATE TABLE t;
Table	Create Table
t	CREATE TABLE `t` (
  `a` json NOT NULL,
  `b` json GENERATED ALWAYS AS (`a`) VIRTUAL NOT NULL
) ENGINE=InnoDB DEFAULT CHARSET=utf8mb4 COLLATE=utf8mb4_0900_ai_ci
INSERT IGNORE INTO t (a) VALUES ("{}");
SELECT * FROM t;
a	b
{}	{}
DELETE FROM t;
DELETE IGNORE FROM t;
CHECK TABLE t;
Table	Op	Msg_type	Msg_text
test.t	check	status	OK
DROP TABLE t;
# Testing example of type JSON and value '["hello beautiful world"]'
SHOW CREATE TABLE t;
Table	Create Table
t	CREATE TABLE `t` (
  `a` json NOT NULL,
  `b` json GENERATED ALWAYS AS (`a`) VIRTUAL NOT NULL
) ENGINE=InnoDB DEFAULT CHARSET=utf8mb4 COLLATE=utf8mb4_0900_ai_ci
INSERT IGNORE INTO t (a) VALUES ('["hello beautiful world"]');
SELECT * FROM t;
a	b
["hello beautiful world"]	["hello beautiful world"]
DELETE FROM t;
DELETE IGNORE FROM t;
CHECK TABLE t;
Table	Op	Msg_type	Msg_text
test.t	check	status	OK
DROP TABLE t;
# Testing example of type JSON and value "-1"
SHOW CREATE TABLE t;
Table	Create Table
t	CREATE TABLE `t` (
  `a` json NOT NULL,
  `b` json GENERATED ALWAYS AS (`a`) VIRTUAL NOT NULL
) ENGINE=InnoDB DEFAULT CHARSET=utf8mb4 COLLATE=utf8mb4_0900_ai_ci
INSERT IGNORE INTO t (a) VALUES ("-1");
SELECT * FROM t;
a	b
-1	-1
DELETE FROM t;
DELETE IGNORE FROM t;
CHECK TABLE t;
Table	Op	Msg_type	Msg_text
test.t	check	status	OK
DROP TABLE t;
# Testing example of type TINYINT and value -1
SHOW CREATE TABLE t;
Table	Create Table
t	CREATE TABLE `t` (
  `a` tinyint NOT NULL,
  `b` json GENERATED ALWAYS AS (`a`) VIRTUAL NOT NULL
) ENGINE=InnoDB DEFAULT CHARSET=utf8mb4 COLLATE=utf8mb4_0900_ai_ci
INSERT IGNORE INTO t (a) VALUES (-1);
SELECT * FROM t;
a	b
DELETE FROM t;
DELETE IGNORE FROM t;
CHECK TABLE t;
Table	Op	Msg_type	Msg_text
test.t	check	status	OK
DROP TABLE t;
# Testing example of type SMALLINT and value -1
SHOW CREATE TABLE t;
Table	Create Table
t	CREATE TABLE `t` (
  `a` smallint NOT NULL,
  `b` json GENERATED ALWAYS AS (`a`) VIRTUAL NOT NULL
) ENGINE=InnoDB DEFAULT CHARSET=utf8mb4 COLLATE=utf8mb4_0900_ai_ci
INSERT IGNORE INTO t (a) VALUES (-1);
SELECT * FROM t;
a	b
DELETE FROM t;
DELETE IGNORE FROM t;
CHECK TABLE t;
Table	Op	Msg_type	Msg_text
test.t	check	status	OK
DROP TABLE t;
# Testing example of type MEDIUMINT and value -1
SHOW CREATE TABLE t;
Table	Create Table
t	CREATE TABLE `t` (
  `a` mediumint NOT NULL,
  `b` json GENERATED ALWAYS AS (`a`) VIRTUAL NOT NULL
) ENGINE=InnoDB DEFAULT CHARSET=utf8mb4 COLLATE=utf8mb4_0900_ai_ci
INSERT IGNORE INTO t (a) VALUES (-1);
SELECT * FROM t;
a	b
DELETE FROM t;
DELETE IGNORE FROM t;
CHECK TABLE t;
Table	Op	Msg_type	Msg_text
test.t	check	status	OK
DROP TABLE t;
# Testing example of type INT and value 2000000000
SHOW CREATE TABLE t;
Table	Create Table
t	CREATE TABLE `t` (
  `a` int NOT NULL,
  `b` json GENERATED ALWAYS AS (`a`) VIRTUAL NOT NULL
) ENGINE=InnoDB DEFAULT CHARSET=utf8mb4 COLLATE=utf8mb4_0900_ai_ci
INSERT IGNORE INTO t (a) VALUES (2000000000);
SELECT * FROM t;
a	b
DELETE FROM t;
DELETE IGNORE FROM t;
CHECK TABLE t;
Table	Op	Msg_type	Msg_text
test.t	check	status	OK
DROP TABLE t;
# Testing example of type INT and value -2000000000
SHOW CREATE TABLE t;
Table	Create Table
t	CREATE TABLE `t` (
  `a` int NOT NULL,
  `b` json GENERATED ALWAYS AS (`a`) VIRTUAL NOT NULL
) ENGINE=InnoDB DEFAULT CHARSET=utf8mb4 COLLATE=utf8mb4_0900_ai_ci
INSERT IGNORE INTO t (a) VALUES (-2000000000);
SELECT * FROM t;
a	b
DELETE FROM t;
DELETE IGNORE FROM t;
CHECK TABLE t;
Table	Op	Msg_type	Msg_text
test.t	check	status	OK
DROP TABLE t;
# Testing example of type INT UNSIGNED and value 4000000000
SHOW CREATE TABLE t;
Table	Create Table
t	CREATE TABLE `t` (
  `a` int unsigned NOT NULL,
  `b` json GENERATED ALWAYS AS (`a`) VIRTUAL NOT NULL
) ENGINE=InnoDB DEFAULT CHARSET=utf8mb4 COLLATE=utf8mb4_0900_ai_ci
INSERT IGNORE INTO t (a) VALUES (4000000000);
SELECT * FROM t;
a	b
DELETE FROM t;
DELETE IGNORE FROM t;
CHECK TABLE t;
Table	Op	Msg_type	Msg_text
test.t	check	status	OK
DROP TABLE t;
# Testing example of type BIGINT and value 2000000000000000000
SHOW CREATE TABLE t;
Table	Create Table
t	CREATE TABLE `t` (
  `a` bigint NOT NULL,
  `b` json GENERATED ALWAYS AS (`a`) VIRTUAL NOT NULL
) ENGINE=InnoDB DEFAULT CHARSET=utf8mb4 COLLATE=utf8mb4_0900_ai_ci
INSERT IGNORE INTO t (a) VALUES (2000000000000000000);
SELECT * FROM t;
a	b
DELETE FROM t;
DELETE IGNORE FROM t;
CHECK TABLE t;
Table	Op	Msg_type	Msg_text
test.t	check	status	OK
DROP TABLE t;
# Testing example of type BIGINT and value -2000000000000000000
SHOW CREATE TABLE t;
Table	Create Table
t	CREATE TABLE `t` (
  `a` bigint NOT NULL,
  `b` json GENERATED ALWAYS AS (`a`) VIRTUAL NOT NULL
) ENGINE=InnoDB DEFAULT CHARSET=utf8mb4 COLLATE=utf8mb4_0900_ai_ci
INSERT IGNORE INTO t (a) VALUES (-2000000000000000000);
SELECT * FROM t;
a	b
DELETE FROM t;
DELETE IGNORE FROM t;
CHECK TABLE t;
Table	Op	Msg_type	Msg_text
test.t	check	status	OK
DROP TABLE t;
# Testing example of type FLOAT and value -1.23456
SHOW CREATE TABLE t;
Table	Create Table
t	CREATE TABLE `t` (
  `a` float NOT NULL,
  `b` json GENERATED ALWAYS AS (`a`) VIRTUAL NOT NULL
) ENGINE=InnoDB DEFAULT CHARSET=utf8mb4 COLLATE=utf8mb4_0900_ai_ci
INSERT IGNORE INTO t (a) VALUES (-1.23456);
SELECT * FROM t;
a	b
DELETE FROM t;
DELETE IGNORE FROM t;
CHECK TABLE t;
Table	Op	Msg_type	Msg_text
test.t	check	status	OK
DROP TABLE t;
# Testing example of type FLOAT and value -1e38
SHOW CREATE TABLE t;
Table	Create Table
t	CREATE TABLE `t` (
  `a` float NOT NULL,
  `b` json GENERATED ALWAYS AS (`a`) VIRTUAL NOT NULL
) ENGINE=InnoDB DEFAULT CHARSET=utf8mb4 COLLATE=utf8mb4_0900_ai_ci
INSERT IGNORE INTO t (a) VALUES (-1e38);
SELECT * FROM t;
a	b
DELETE FROM t;
DELETE IGNORE FROM t;
CHECK TABLE t;
Table	Op	Msg_type	Msg_text
test.t	check	status	OK
DROP TABLE t;
# Testing example of type FLOAT and value 1e38
SHOW CREATE TABLE t;
Table	Create Table
t	CREATE TABLE `t` (
  `a` float NOT NULL,
  `b` json GENERATED ALWAYS AS (`a`) VIRTUAL NOT NULL
) ENGINE=InnoDB DEFAULT CHARSET=utf8mb4 COLLATE=utf8mb4_0900_ai_ci
INSERT IGNORE INTO t (a) VALUES (1e38);
SELECT * FROM t;
a	b
DELETE FROM t;
DELETE IGNORE FROM t;
CHECK TABLE t;
Table	Op	Msg_type	Msg_text
test.t	check	status	OK
DROP TABLE t;
# Testing example of type DOUBLE and value -1.23456789012345
SHOW CREATE TABLE t;
Table	Create Table
t	CREATE TABLE `t` (
  `a` double NOT NULL,
  `b` json GENERATED ALWAYS AS (`a`) VIRTUAL NOT NULL
) ENGINE=InnoDB DEFAULT CHARSET=utf8mb4 COLLATE=utf8mb4_0900_ai_ci
INSERT IGNORE INTO t (a) VALUES (-1.23456789012345);
SELECT * FROM t;
a	b
DELETE FROM t;
DELETE IGNORE FROM t;
CHECK TABLE t;
Table	Op	Msg_type	Msg_text
test.t	check	status	OK
DROP TABLE t;
# Testing example of type DOUBLE and value 1.23456789012345
SHOW CREATE TABLE t;
Table	Create Table
t	CREATE TABLE `t` (
  `a` double NOT NULL,
  `b` json GENERATED ALWAYS AS (`a`) VIRTUAL NOT NULL
) ENGINE=InnoDB DEFAULT CHARSET=utf8mb4 COLLATE=utf8mb4_0900_ai_ci
INSERT IGNORE INTO t (a) VALUES (1.23456789012345);
SELECT * FROM t;
a	b
DELETE FROM t;
DELETE IGNORE FROM t;
CHECK TABLE t;
Table	Op	Msg_type	Msg_text
test.t	check	status	OK
DROP TABLE t;
# Testing example of type DOUBLE and value -1e300
SHOW CREATE TABLE t;
Table	Create Table
t	CREATE TABLE `t` (
  `a` double NOT NULL,
  `b` json GENERATED ALWAYS AS (`a`) VIRTUAL NOT NULL
) ENGINE=InnoDB DEFAULT CHARSET=utf8mb4 COLLATE=utf8mb4_0900_ai_ci
INSERT IGNORE INTO t (a) VALUES (-1e300);
SELECT * FROM t;
a	b
DELETE FROM t;
DELETE IGNORE FROM t;
CHECK TABLE t;
Table	Op	Msg_type	Msg_text
test.t	check	status	OK
DROP TABLE t;
# Testing example of type DOUBLE and value 1e300
SHOW CREATE TABLE t;
Table	Create Table
t	CREATE TABLE `t` (
  `a` double NOT NULL,
  `b` json GENERATED ALWAYS AS (`a`) VIRTUAL NOT NULL
) ENGINE=InnoDB DEFAULT CHARSET=utf8mb4 COLLATE=utf8mb4_0900_ai_ci
INSERT IGNORE INTO t (a) VALUES (1e300);
SELECT * FROM t;
a	b
DELETE FROM t;
DELETE IGNORE FROM t;
CHECK TABLE t;
Table	Op	Msg_type	Msg_text
test.t	check	status	OK
DROP TABLE t;
# Testing example of type DECIMAL(4,2) and value -10.99
SHOW CREATE TABLE t;
Table	Create Table
t	CREATE TABLE `t` (
  `a` decimal(4,2) NOT NULL,
  `b` json GENERATED ALWAYS AS (`a`) VIRTUAL NOT NULL
) ENGINE=InnoDB DEFAULT CHARSET=utf8mb4 COLLATE=utf8mb4_0900_ai_ci
INSERT IGNORE INTO t (a) VALUES (-10.99);
SELECT * FROM t;
a	b
DELETE FROM t;
DELETE IGNORE FROM t;
CHECK TABLE t;
Table	Op	Msg_type	Msg_text
test.t	check	status	OK
DROP TABLE t;
# Testing example of type DECIMAL(34,4) and value 20000000000000000000000000000.0001
SHOW CREATE TABLE t;
Table	Create Table
t	CREATE TABLE `t` (
  `a` decimal(34,4) NOT NULL,
  `b` json GENERATED ALWAYS AS (`a`) VIRTUAL NOT NULL
) ENGINE=InnoDB DEFAULT CHARSET=utf8mb4 COLLATE=utf8mb4_0900_ai_ci
INSERT IGNORE INTO t (a) VALUES (20000000000000000000000000000.0001);
SELECT * FROM t;
a	b
DELETE FROM t;
DELETE IGNORE FROM t;
CHECK TABLE t;
Table	Op	Msg_type	Msg_text
test.t	check	status	OK
DROP TABLE t;
# Testing example of type DECIMAL(34,4) and value -20000000000000000000000000000.0001
SHOW CREATE TABLE t;
Table	Create Table
t	CREATE TABLE `t` (
  `a` decimal(34,4) NOT NULL,
  `b` json GENERATED ALWAYS AS (`a`) VIRTUAL NOT NULL
) ENGINE=InnoDB DEFAULT CHARSET=utf8mb4 COLLATE=utf8mb4_0900_ai_ci
INSERT IGNORE INTO t (a) VALUES (-20000000000000000000000000000.0001);
SELECT * FROM t;
a	b
DELETE FROM t;
DELETE IGNORE FROM t;
CHECK TABLE t;
Table	Op	Msg_type	Msg_text
test.t	check	status	OK
DROP TABLE t;
# Testing example of type BIT(64) and value 0xDEADBEEFC0FEBABE
SHOW CREATE TABLE t;
Table	Create Table
t	CREATE TABLE `t` (
  `a` bit(64) NOT NULL,
  `b` json GENERATED ALWAYS AS (`a`) VIRTUAL NOT NULL
) ENGINE=InnoDB DEFAULT CHARSET=utf8mb4 COLLATE=utf8mb4_0900_ai_ci
INSERT IGNORE INTO t (a) VALUES (0xDEADBEEFC0FEBABE);
SELECT * FROM t;
a	b
DELETE FROM t;
DELETE IGNORE FROM t;
CHECK TABLE t;
Table	Op	Msg_type	Msg_text
test.t	check	status	OK
DROP TABLE t;
# Testing example of type BIT(4) and value 0b1000
SHOW CREATE TABLE t;
Table	Create Table
t	CREATE TABLE `t` (
  `a` bit(4) NOT NULL,
  `b` json GENERATED ALWAYS AS (`a`) VIRTUAL NOT NULL
) ENGINE=InnoDB DEFAULT CHARSET=utf8mb4 COLLATE=utf8mb4_0900_ai_ci
INSERT IGNORE INTO t (a) VALUES (0b1000);
SELECT * FROM t;
a	b
DELETE FROM t;
DELETE IGNORE FROM t;
CHECK TABLE t;
Table	Op	Msg_type	Msg_text
test.t	check	status	OK
DROP TABLE t;
# Testing example of type YEAR and value 2020
SHOW CREATE TABLE t;
Table	Create Table
t	CREATE TABLE `t` (
  `a` year NOT NULL,
  `b` json GENERATED ALWAYS AS (`a`) VIRTUAL NOT NULL
) ENGINE=InnoDB DEFAULT CHARSET=utf8mb4 COLLATE=utf8mb4_0900_ai_ci
INSERT IGNORE INTO t (a) VALUES (2020);
SELECT * FROM t;
a	b
DELETE FROM t;
DELETE IGNORE FROM t;
CHECK TABLE t;
Table	Op	Msg_type	Msg_text
test.t	check	status	OK
DROP TABLE t;
# Testing example of type DATE and value "2030-04-05"
SHOW CREATE TABLE t;
Table	Create Table
t	CREATE TABLE `t` (
  `a` date NOT NULL,
  `b` json GENERATED ALWAYS AS (`a`) VIRTUAL NOT NULL
) ENGINE=InnoDB DEFAULT CHARSET=utf8mb4 COLLATE=utf8mb4_0900_ai_ci
INSERT IGNORE INTO t (a) VALUES ("2030-04-05");
SELECT * FROM t;
a	b
DELETE FROM t;
DELETE IGNORE FROM t;
CHECK TABLE t;
Table	Op	Msg_type	Msg_text
test.t	check	status	OK
DROP TABLE t;
# Testing example of type TIME and value "11:12:13"
SHOW CREATE TABLE t;
Table	Create Table
t	CREATE TABLE `t` (
  `a` time NOT NULL,
  `b` json GENERATED ALWAYS AS (`a`) VIRTUAL NOT NULL
) ENGINE=InnoDB DEFAULT CHARSET=utf8mb4 COLLATE=utf8mb4_0900_ai_ci
INSERT IGNORE INTO t (a) VALUES ("11:12:13");
SELECT * FROM t;
a	b
DELETE FROM t;
DELETE IGNORE FROM t;
CHECK TABLE t;
Table	Op	Msg_type	Msg_text
test.t	check	status	OK
DROP TABLE t;
# Testing example of type DATETIME and value "2030-04-05 11:12:13"
SHOW CREATE TABLE t;
Table	Create Table
t	CREATE TABLE `t` (
  `a` datetime NOT NULL,
  `b` json GENERATED ALWAYS AS (`a`) VIRTUAL NOT NULL
) ENGINE=InnoDB DEFAULT CHARSET=utf8mb4 COLLATE=utf8mb4_0900_ai_ci
INSERT IGNORE INTO t (a) VALUES ("2030-04-05 11:12:13");
SELECT * FROM t;
a	b
DELETE FROM t;
DELETE IGNORE FROM t;
CHECK TABLE t;
Table	Op	Msg_type	Msg_text
test.t	check	status	OK
DROP TABLE t;
# Testing example of type TIMESTAMP and value "2030-04-05 11:12:13"
SHOW CREATE TABLE t;
Table	Create Table
t	CREATE TABLE `t` (
  `a` timestamp NOT NULL,
  `b` json GENERATED ALWAYS AS (`a`) VIRTUAL NOT NULL
) ENGINE=InnoDB DEFAULT CHARSET=utf8mb4 COLLATE=utf8mb4_0900_ai_ci
INSERT IGNORE INTO t (a) VALUES ("2030-04-05 11:12:13");
SELECT * FROM t;
a	b
DELETE FROM t;
DELETE IGNORE FROM t;
CHECK TABLE t;
Table	Op	Msg_type	Msg_text
test.t	check	status	OK
DROP TABLE t;
# Testing example of type CHAR(40) and value "2000000000000000000000000000000000000"
SHOW CREATE TABLE t;
Table	Create Table
t	CREATE TABLE `t` (
  `a` char(40) NOT NULL,
  `b` json GENERATED ALWAYS AS (`a`) VIRTUAL NOT NULL
) ENGINE=InnoDB DEFAULT CHARSET=utf8mb4 COLLATE=utf8mb4_0900_ai_ci
INSERT IGNORE INTO t (a) VALUES ("2000000000000000000000000000000000000");
SELECT * FROM t;
a	b
2000000000000000000000000000000000000	1.9999999999999998e36
DELETE FROM t;
DELETE IGNORE FROM t;
CHECK TABLE t;
Table	Op	Msg_type	Msg_text
test.t	check	status	OK
DROP TABLE t;
# Testing example of type BINARY(45) and value "200000000000000000000000000000000000000000"
SHOW CREATE TABLE t;
Table	Create Table
t	CREATE TABLE `t` (
  `a` binary(45) NOT NULL,
  `b` json GENERATED ALWAYS AS (`a`) VIRTUAL NOT NULL
) ENGINE=InnoDB DEFAULT CHARSET=utf8mb4 COLLATE=utf8mb4_0900_ai_ci
INSERT IGNORE INTO t (a) VALUES ("200000000000000000000000000000000000000000");
SELECT * FROM t;
a	b
DELETE FROM t;
DELETE IGNORE FROM t;
CHECK TABLE t;
Table	Op	Msg_type	Msg_text
test.t	check	status	OK
DROP TABLE t;
# Testing example of type VARCHAR(50) and value "2000000000000000000000000000000000000000000000000"
SHOW CREATE TABLE t;
Table	Create Table
t	CREATE TABLE `t` (
  `a` varchar(50) NOT NULL,
  `b` json GENERATED ALWAYS AS (`a`) VIRTUAL NOT NULL
) ENGINE=InnoDB DEFAULT CHARSET=utf8mb4 COLLATE=utf8mb4_0900_ai_ci
INSERT IGNORE INTO t (a) VALUES ("2000000000000000000000000000000000000000000000000");
SELECT * FROM t;
a	b
2000000000000000000000000000000000000000000000000	2e48
DELETE FROM t;
DELETE IGNORE FROM t;
CHECK TABLE t;
Table	Op	Msg_type	Msg_text
test.t	check	status	OK
DROP TABLE t;
# Testing example of type CHAR(24) and value "hello beautiful world"
SHOW CREATE TABLE t;
Table	Create Table
t	CREATE TABLE `t` (
  `a` char(24) NOT NULL,
  `b` json GENERATED ALWAYS AS (`a`) VIRTUAL NOT NULL
) ENGINE=InnoDB DEFAULT CHARSET=utf8mb4 COLLATE=utf8mb4_0900_ai_ci
INSERT IGNORE INTO t (a) VALUES ("hello beautiful world");
SELECT * FROM t;
a	b
DELETE FROM t;
DELETE IGNORE FROM t;
CHECK TABLE t;
Table	Op	Msg_type	Msg_text
test.t	check	status	OK
DROP TABLE t;
# Testing example of type BINARY(12) and value "hello world"
SHOW CREATE TABLE t;
Table	Create Table
t	CREATE TABLE `t` (
  `a` binary(12) NOT NULL,
  `b` json GENERATED ALWAYS AS (`a`) VIRTUAL NOT NULL
) ENGINE=InnoDB DEFAULT CHARSET=utf8mb4 COLLATE=utf8mb4_0900_ai_ci
INSERT IGNORE INTO t (a) VALUES ("hello world");
SELECT * FROM t;
a	b
DELETE FROM t;
DELETE IGNORE FROM t;
CHECK TABLE t;
Table	Op	Msg_type	Msg_text
test.t	check	status	OK
DROP TABLE t;
# Testing example of type VARCHAR(6) and value "hello"
SHOW CREATE TABLE t;
Table	Create Table
t	CREATE TABLE `t` (
  `a` varchar(6) NOT NULL,
  `b` json GENERATED ALWAYS AS (`a`) VIRTUAL NOT NULL
) ENGINE=InnoDB DEFAULT CHARSET=utf8mb4 COLLATE=utf8mb4_0900_ai_ci
INSERT IGNORE INTO t (a) VALUES ("hello");
SELECT * FROM t;
a	b
DELETE FROM t;
DELETE IGNORE FROM t;
CHECK TABLE t;
Table	Op	Msg_type	Msg_text
test.t	check	status	OK
DROP TABLE t;
# Testing example of type ENUM("up","down") and value "up"
SHOW CREATE TABLE t;
Table	Create Table
t	CREATE TABLE `t` (
  `a` enum('up','down') NOT NULL,
  `b` json GENERATED ALWAYS AS (`a`) VIRTUAL NOT NULL
) ENGINE=InnoDB DEFAULT CHARSET=utf8mb4 COLLATE=utf8mb4_0900_ai_ci
INSERT IGNORE INTO t (a) VALUES ("up");
SELECT * FROM t;
a	b
DELETE FROM t;
DELETE IGNORE FROM t;
CHECK TABLE t;
Table	Op	Msg_type	Msg_text
test.t	check	status	OK
DROP TABLE t;
# Testing example of type SET("up","down") and value "up,down"
SHOW CREATE TABLE t;
Table	Create Table
t	CREATE TABLE `t` (
  `a` set('up','down') NOT NULL,
  `b` json GENERATED ALWAYS AS (`a`) VIRTUAL NOT NULL
) ENGINE=InnoDB DEFAULT CHARSET=utf8mb4 COLLATE=utf8mb4_0900_ai_ci
INSERT IGNORE INTO t (a) VALUES ("up,down");
SELECT * FROM t;
a	b
DELETE FROM t;
DELETE IGNORE FROM t;
CHECK TABLE t;
Table	Op	Msg_type	Msg_text
test.t	check	status	OK
DROP TABLE t;
# Testing example of type GEOMETRY and value ST_GeomFromText("POINT(1 1)")
SHOW CREATE TABLE t;
Table	Create Table
t	CREATE TABLE `t` (
  `a` geometry NOT NULL,
  `b` json GENERATED ALWAYS AS (`a`) VIRTUAL NOT NULL
) ENGINE=InnoDB DEFAULT CHARSET=utf8mb4 COLLATE=utf8mb4_0900_ai_ci
INSERT IGNORE INTO t (a) VALUES (ST_GeomFromText("POINT(1 1)"));
SELECT * FROM t;
a	b
DELETE FROM t;
DELETE IGNORE FROM t;
CHECK TABLE t;
Table	Op	Msg_type	Msg_text
test.t	check	status	OK
DROP TABLE t;
# Testing example of type POINT and value ST_GeomFromText("POINT(1 1)")
SHOW CREATE TABLE t;
Table	Create Table
t	CREATE TABLE `t` (
  `a` point NOT NULL,
  `b` json GENERATED ALWAYS AS (`a`) VIRTUAL NOT NULL
) ENGINE=InnoDB DEFAULT CHARSET=utf8mb4 COLLATE=utf8mb4_0900_ai_ci
INSERT IGNORE INTO t (a) VALUES (ST_GeomFromText("POINT(1 1)"));
SELECT * FROM t;
a	b
DELETE FROM t;
DELETE IGNORE FROM t;
CHECK TABLE t;
Table	Op	Msg_type	Msg_text
test.t	check	status	OK
DROP TABLE t;
# Testing example of type LINESTRING and value ST_GeomFromText("LINESTRING(0 0,1 1,2 2)")
SHOW CREATE TABLE t;
Table	Create Table
t	CREATE TABLE `t` (
  `a` linestring NOT NULL,
  `b` json GENERATED ALWAYS AS (`a`) VIRTUAL NOT NULL
) ENGINE=InnoDB DEFAULT CHARSET=utf8mb4 COLLATE=utf8mb4_0900_ai_ci
INSERT IGNORE INTO t (a) VALUES (ST_GeomFromText("LINESTRING(0 0,1 1,2 2)"));
SELECT * FROM t;
a	b
DELETE FROM t;
DELETE IGNORE FROM t;
CHECK TABLE t;
Table	Op	Msg_type	Msg_text
test.t	check	status	OK
DROP TABLE t;
# Testing example of type POLYGON and value ST_GeomFromText("POLYGON((0 0,1 0,1 1,0 1,0 0),(5 5,7 5,7 7,5 7,5 5))")
SHOW CREATE TABLE t;
Table	Create Table
t	CREATE TABLE `t` (
  `a` polygon NOT NULL,
  `b` json GENERATED ALWAYS AS (`a`) VIRTUAL NOT NULL
) ENGINE=InnoDB DEFAULT CHARSET=utf8mb4 COLLATE=utf8mb4_0900_ai_ci
INSERT IGNORE INTO t (a) VALUES (ST_GeomFromText("POLYGON((0 0,1 0,1 1,0 1,0 0),(5 5,7 5,7 7,5 7,5 5))"));
SELECT * FROM t;
a	b
DELETE FROM t;
DELETE IGNORE FROM t;
CHECK TABLE t;
Table	Op	Msg_type	Msg_text
test.t	check	status	OK
DROP TABLE t;
#
# Testing virtual column of type TINYINT
#
# Testing example of type JSON and value "{}"
SHOW CREATE TABLE t;
Table	Create Table
t	CREATE TABLE `t` (
  `a` json NOT NULL,
  `b` tinyint GENERATED ALWAYS AS (`a`) VIRTUAL NOT NULL,
  KEY `on_b` (`b`)
) ENGINE=InnoDB DEFAULT CHARSET=utf8mb4 COLLATE=utf8mb4_0900_ai_ci
INSERT IGNORE INTO t (a) VALUES ("{}");
Warnings:
Warning	3156	Invalid JSON value for CAST to INTEGER from column a at row 1
SELECT * FROM t;
a	b
{}	0
Warnings:
Warning	3156	Invalid JSON value for CAST to INTEGER from column a at row 1
DELETE FROM t;
DELETE IGNORE FROM t;
Warnings:
Warning	3156	Invalid JSON value for CAST to INTEGER from column a at row 1
Warning	3156	Invalid JSON value for CAST to INTEGER from column a at row 1
CHECK TABLE t;
Table	Op	Msg_type	Msg_text
test.t	check	status	OK
DROP TABLE t;
# Testing example of type JSON and value '["hello beautiful world"]'
SHOW CREATE TABLE t;
Table	Create Table
t	CREATE TABLE `t` (
  `a` json NOT NULL,
  `b` tinyint GENERATED ALWAYS AS (`a`) VIRTUAL NOT NULL,
  KEY `on_b` (`b`)
) ENGINE=InnoDB DEFAULT CHARSET=utf8mb4 COLLATE=utf8mb4_0900_ai_ci
INSERT IGNORE INTO t (a) VALUES ('["hello beautiful world"]');
Warnings:
Warning	3156	Invalid JSON value for CAST to INTEGER from column a at row 1
SELECT * FROM t;
a	b
["hello beautiful world"]	0
Warnings:
Warning	3156	Invalid JSON value for CAST to INTEGER from column a at row 1
DELETE FROM t;
DELETE IGNORE FROM t;
Warnings:
Warning	3156	Invalid JSON value for CAST to INTEGER from column a at row 1
Warning	3156	Invalid JSON value for CAST to INTEGER from column a at row 1
CHECK TABLE t;
Table	Op	Msg_type	Msg_text
test.t	check	status	OK
DROP TABLE t;
# Testing example of type JSON and value "-1"
SHOW CREATE TABLE t;
Table	Create Table
t	CREATE TABLE `t` (
  `a` json NOT NULL,
  `b` tinyint GENERATED ALWAYS AS (`a`) VIRTUAL NOT NULL,
  KEY `on_b` (`b`)
) ENGINE=InnoDB DEFAULT CHARSET=utf8mb4 COLLATE=utf8mb4_0900_ai_ci
INSERT IGNORE INTO t (a) VALUES ("-1");
SELECT * FROM t;
a	b
-1	-1
DELETE FROM t;
DELETE IGNORE FROM t;
CHECK TABLE t;
Table	Op	Msg_type	Msg_text
test.t	check	status	OK
DROP TABLE t;
# Testing example of type TINYINT and value -1
SHOW CREATE TABLE t;
Table	Create Table
t	CREATE TABLE `t` (
  `a` tinyint NOT NULL,
  `b` tinyint GENERATED ALWAYS AS (`a`) VIRTUAL NOT NULL,
  KEY `on_b` (`b`)
) ENGINE=InnoDB DEFAULT CHARSET=utf8mb4 COLLATE=utf8mb4_0900_ai_ci
INSERT IGNORE INTO t (a) VALUES (-1);
SELECT * FROM t;
a	b
-1	-1
DELETE FROM t;
DELETE IGNORE FROM t;
CHECK TABLE t;
Table	Op	Msg_type	Msg_text
test.t	check	status	OK
DROP TABLE t;
# Testing example of type SMALLINT and value -1
SHOW CREATE TABLE t;
Table	Create Table
t	CREATE TABLE `t` (
  `a` smallint NOT NULL,
  `b` tinyint GENERATED ALWAYS AS (`a`) VIRTUAL NOT NULL,
  KEY `on_b` (`b`)
) ENGINE=InnoDB DEFAULT CHARSET=utf8mb4 COLLATE=utf8mb4_0900_ai_ci
INSERT IGNORE INTO t (a) VALUES (-1);
SELECT * FROM t;
a	b
-1	-1
DELETE FROM t;
DELETE IGNORE FROM t;
CHECK TABLE t;
Table	Op	Msg_type	Msg_text
test.t	check	status	OK
DROP TABLE t;
# Testing example of type MEDIUMINT and value -1
SHOW CREATE TABLE t;
Table	Create Table
t	CREATE TABLE `t` (
  `a` mediumint NOT NULL,
  `b` tinyint GENERATED ALWAYS AS (`a`) VIRTUAL NOT NULL,
  KEY `on_b` (`b`)
) ENGINE=InnoDB DEFAULT CHARSET=utf8mb4 COLLATE=utf8mb4_0900_ai_ci
INSERT IGNORE INTO t (a) VALUES (-1);
SELECT * FROM t;
a	b
-1	-1
DELETE FROM t;
DELETE IGNORE FROM t;
CHECK TABLE t;
Table	Op	Msg_type	Msg_text
test.t	check	status	OK
DROP TABLE t;
# Testing example of type INT and value 2000000000
SHOW CREATE TABLE t;
Table	Create Table
t	CREATE TABLE `t` (
  `a` int NOT NULL,
  `b` tinyint GENERATED ALWAYS AS (`a`) VIRTUAL NOT NULL,
  KEY `on_b` (`b`)
) ENGINE=InnoDB DEFAULT CHARSET=utf8mb4 COLLATE=utf8mb4_0900_ai_ci
INSERT IGNORE INTO t (a) VALUES (2000000000);
Warnings:
Warning	1264	Out of range value for column 'b' at row 1
SELECT * FROM t;
a	b
2000000000	127
DELETE FROM t;
DELETE IGNORE FROM t;
CHECK TABLE t;
Table	Op	Msg_type	Msg_text
test.t	check	status	OK
DROP TABLE t;
# Testing example of type INT and value -2000000000
SHOW CREATE TABLE t;
Table	Create Table
t	CREATE TABLE `t` (
  `a` int NOT NULL,
  `b` tinyint GENERATED ALWAYS AS (`a`) VIRTUAL NOT NULL,
  KEY `on_b` (`b`)
) ENGINE=InnoDB DEFAULT CHARSET=utf8mb4 COLLATE=utf8mb4_0900_ai_ci
INSERT IGNORE INTO t (a) VALUES (-2000000000);
Warnings:
Warning	1264	Out of range value for column 'b' at row 1
SELECT * FROM t;
a	b
-2000000000	-128
DELETE FROM t;
DELETE IGNORE FROM t;
CHECK TABLE t;
Table	Op	Msg_type	Msg_text
test.t	check	status	OK
DROP TABLE t;
# Testing example of type INT UNSIGNED and value 4000000000
SHOW CREATE TABLE t;
Table	Create Table
t	CREATE TABLE `t` (
  `a` int unsigned NOT NULL,
  `b` tinyint GENERATED ALWAYS AS (`a`) VIRTUAL NOT NULL,
  KEY `on_b` (`b`)
) ENGINE=InnoDB DEFAULT CHARSET=utf8mb4 COLLATE=utf8mb4_0900_ai_ci
INSERT IGNORE INTO t (a) VALUES (4000000000);
Warnings:
Warning	1264	Out of range value for column 'b' at row 1
SELECT * FROM t;
a	b
4000000000	127
DELETE FROM t;
DELETE IGNORE FROM t;
CHECK TABLE t;
Table	Op	Msg_type	Msg_text
test.t	check	status	OK
DROP TABLE t;
# Testing example of type BIGINT and value 2000000000000000000
SHOW CREATE TABLE t;
Table	Create Table
t	CREATE TABLE `t` (
  `a` bigint NOT NULL,
  `b` tinyint GENERATED ALWAYS AS (`a`) VIRTUAL NOT NULL,
  KEY `on_b` (`b`)
) ENGINE=InnoDB DEFAULT CHARSET=utf8mb4 COLLATE=utf8mb4_0900_ai_ci
INSERT IGNORE INTO t (a) VALUES (2000000000000000000);
Warnings:
Warning	1264	Out of range value for column 'b' at row 1
SELECT * FROM t;
a	b
2000000000000000000	127
DELETE FROM t;
DELETE IGNORE FROM t;
CHECK TABLE t;
Table	Op	Msg_type	Msg_text
test.t	check	status	OK
DROP TABLE t;
# Testing example of type BIGINT and value -2000000000000000000
SHOW CREATE TABLE t;
Table	Create Table
t	CREATE TABLE `t` (
  `a` bigint NOT NULL,
  `b` tinyint GENERATED ALWAYS AS (`a`) VIRTUAL NOT NULL,
  KEY `on_b` (`b`)
) ENGINE=InnoDB DEFAULT CHARSET=utf8mb4 COLLATE=utf8mb4_0900_ai_ci
INSERT IGNORE INTO t (a) VALUES (-2000000000000000000);
Warnings:
Warning	1264	Out of range value for column 'b' at row 1
SELECT * FROM t;
a	b
-2000000000000000000	-128
DELETE FROM t;
DELETE IGNORE FROM t;
CHECK TABLE t;
Table	Op	Msg_type	Msg_text
test.t	check	status	OK
DROP TABLE t;
# Testing example of type FLOAT and value -1.23456
SHOW CREATE TABLE t;
Table	Create Table
t	CREATE TABLE `t` (
  `a` float NOT NULL,
  `b` tinyint GENERATED ALWAYS AS (`a`) VIRTUAL NOT NULL,
  KEY `on_b` (`b`)
) ENGINE=InnoDB DEFAULT CHARSET=utf8mb4 COLLATE=utf8mb4_0900_ai_ci
INSERT IGNORE INTO t (a) VALUES (-1.23456);
SELECT * FROM t;
a	b
-1.23456	-1
DELETE FROM t;
DELETE IGNORE FROM t;
CHECK TABLE t;
Table	Op	Msg_type	Msg_text
test.t	check	status	OK
DROP TABLE t;
# Testing example of type FLOAT and value -1e38
SHOW CREATE TABLE t;
Table	Create Table
t	CREATE TABLE `t` (
  `a` float NOT NULL,
  `b` tinyint GENERATED ALWAYS AS (`a`) VIRTUAL NOT NULL,
  KEY `on_b` (`b`)
) ENGINE=InnoDB DEFAULT CHARSET=utf8mb4 COLLATE=utf8mb4_0900_ai_ci
INSERT IGNORE INTO t (a) VALUES (-1e38);
Warnings:
Warning	1264	Out of range value for column 'b' at row 1
SELECT * FROM t;
a	b
-1e38	-128
DELETE FROM t;
DELETE IGNORE FROM t;
CHECK TABLE t;
Table	Op	Msg_type	Msg_text
test.t	check	status	OK
DROP TABLE t;
# Testing example of type FLOAT and value 1e38
SHOW CREATE TABLE t;
Table	Create Table
t	CREATE TABLE `t` (
  `a` float NOT NULL,
  `b` tinyint GENERATED ALWAYS AS (`a`) VIRTUAL NOT NULL,
  KEY `on_b` (`b`)
) ENGINE=InnoDB DEFAULT CHARSET=utf8mb4 COLLATE=utf8mb4_0900_ai_ci
INSERT IGNORE INTO t (a) VALUES (1e38);
Warnings:
Warning	1264	Out of range value for column 'b' at row 1
SELECT * FROM t;
a	b
1e38	127
DELETE FROM t;
DELETE IGNORE FROM t;
CHECK TABLE t;
Table	Op	Msg_type	Msg_text
test.t	check	status	OK
DROP TABLE t;
# Testing example of type DOUBLE and value -1.23456789012345
SHOW CREATE TABLE t;
Table	Create Table
t	CREATE TABLE `t` (
  `a` double NOT NULL,
  `b` tinyint GENERATED ALWAYS AS (`a`) VIRTUAL NOT NULL,
  KEY `on_b` (`b`)
) ENGINE=InnoDB DEFAULT CHARSET=utf8mb4 COLLATE=utf8mb4_0900_ai_ci
INSERT IGNORE INTO t (a) VALUES (-1.23456789012345);
SELECT * FROM t;
a	b
-1.23456789012345	-1
DELETE FROM t;
DELETE IGNORE FROM t;
CHECK TABLE t;
Table	Op	Msg_type	Msg_text
test.t	check	status	OK
DROP TABLE t;
# Testing example of type DOUBLE and value 1.23456789012345
SHOW CREATE TABLE t;
Table	Create Table
t	CREATE TABLE `t` (
  `a` double NOT NULL,
  `b` tinyint GENERATED ALWAYS AS (`a`) VIRTUAL NOT NULL,
  KEY `on_b` (`b`)
) ENGINE=InnoDB DEFAULT CHARSET=utf8mb4 COLLATE=utf8mb4_0900_ai_ci
INSERT IGNORE INTO t (a) VALUES (1.23456789012345);
SELECT * FROM t;
a	b
1.23456789012345	1
DELETE FROM t;
DELETE IGNORE FROM t;
CHECK TABLE t;
Table	Op	Msg_type	Msg_text
test.t	check	status	OK
DROP TABLE t;
# Testing example of type DOUBLE and value -1e300
SHOW CREATE TABLE t;
Table	Create Table
t	CREATE TABLE `t` (
  `a` double NOT NULL,
  `b` tinyint GENERATED ALWAYS AS (`a`) VIRTUAL NOT NULL,
  KEY `on_b` (`b`)
) ENGINE=InnoDB DEFAULT CHARSET=utf8mb4 COLLATE=utf8mb4_0900_ai_ci
INSERT IGNORE INTO t (a) VALUES (-1e300);
Warnings:
Warning	1264	Out of range value for column 'b' at row 1
SELECT * FROM t;
a	b
-1e300	-128
DELETE FROM t;
DELETE IGNORE FROM t;
CHECK TABLE t;
Table	Op	Msg_type	Msg_text
test.t	check	status	OK
DROP TABLE t;
# Testing example of type DOUBLE and value 1e300
SHOW CREATE TABLE t;
Table	Create Table
t	CREATE TABLE `t` (
  `a` double NOT NULL,
  `b` tinyint GENERATED ALWAYS AS (`a`) VIRTUAL NOT NULL,
  KEY `on_b` (`b`)
) ENGINE=InnoDB DEFAULT CHARSET=utf8mb4 COLLATE=utf8mb4_0900_ai_ci
INSERT IGNORE INTO t (a) VALUES (1e300);
Warnings:
Warning	1264	Out of range value for column 'b' at row 1
SELECT * FROM t;
a	b
1e300	127
DELETE FROM t;
DELETE IGNORE FROM t;
CHECK TABLE t;
Table	Op	Msg_type	Msg_text
test.t	check	status	OK
DROP TABLE t;
# Testing example of type DECIMAL(4,2) and value -10.99
SHOW CREATE TABLE t;
Table	Create Table
t	CREATE TABLE `t` (
  `a` decimal(4,2) NOT NULL,
  `b` tinyint GENERATED ALWAYS AS (`a`) VIRTUAL NOT NULL,
  KEY `on_b` (`b`)
) ENGINE=InnoDB DEFAULT CHARSET=utf8mb4 COLLATE=utf8mb4_0900_ai_ci
INSERT IGNORE INTO t (a) VALUES (-10.99);
SELECT * FROM t;
a	b
-10.99	-11
DELETE FROM t;
DELETE IGNORE FROM t;
CHECK TABLE t;
Table	Op	Msg_type	Msg_text
test.t	check	status	OK
DROP TABLE t;
# Testing example of type DECIMAL(34,4) and value 20000000000000000000000000000.0001
SHOW CREATE TABLE t;
Table	Create Table
t	CREATE TABLE `t` (
  `a` decimal(34,4) NOT NULL,
  `b` tinyint GENERATED ALWAYS AS (`a`) VIRTUAL NOT NULL,
  KEY `on_b` (`b`)
) ENGINE=InnoDB DEFAULT CHARSET=utf8mb4 COLLATE=utf8mb4_0900_ai_ci
INSERT IGNORE INTO t (a) VALUES (20000000000000000000000000000.0001);
Warnings:
Warning	1264	Out of range value for column 'b' at row 1
Warning	1264	Out of range value for column 'b' at row 1
SELECT * FROM t;
a	b
20000000000000000000000000000.0001	127
DELETE FROM t;
DELETE IGNORE FROM t;
CHECK TABLE t;
Table	Op	Msg_type	Msg_text
test.t	check	status	OK
DROP TABLE t;
# Testing example of type DECIMAL(34,4) and value -20000000000000000000000000000.0001
SHOW CREATE TABLE t;
Table	Create Table
t	CREATE TABLE `t` (
  `a` decimal(34,4) NOT NULL,
  `b` tinyint GENERATED ALWAYS AS (`a`) VIRTUAL NOT NULL,
  KEY `on_b` (`b`)
) ENGINE=InnoDB DEFAULT CHARSET=utf8mb4 COLLATE=utf8mb4_0900_ai_ci
INSERT IGNORE INTO t (a) VALUES (-20000000000000000000000000000.0001);
Warnings:
Warning	1264	Out of range value for column 'b' at row 1
Warning	1264	Out of range value for column 'b' at row 1
SELECT * FROM t;
a	b
-20000000000000000000000000000.0001	-128
DELETE FROM t;
DELETE IGNORE FROM t;
CHECK TABLE t;
Table	Op	Msg_type	Msg_text
test.t	check	status	OK
DROP TABLE t;
# Testing example of type BIT(64) and value 0xDEADBEEFC0FEBABE
SHOW CREATE TABLE t;
Table	Create Table
t	CREATE TABLE `t` (
  `a` bit(64) NOT NULL,
  `b` tinyint GENERATED ALWAYS AS (`a`) VIRTUAL NOT NULL,
  KEY `on_b` (`b`)
) ENGINE=InnoDB DEFAULT CHARSET=utf8mb4 COLLATE=utf8mb4_0900_ai_ci
INSERT IGNORE INTO t (a) VALUES (0xDEADBEEFC0FEBABE);
Warnings:
Warning	1264	Out of range value for column 'b' at row 1
SELECT * FROM t;
a	b
Þ­¾ïÀþº¾	127
DELETE FROM t;
DELETE IGNORE FROM t;
CHECK TABLE t;
Table	Op	Msg_type	Msg_text
test.t	check	status	OK
DROP TABLE t;
# Testing example of type BIT(4) and value 0b1000
SHOW CREATE TABLE t;
Table	Create Table
t	CREATE TABLE `t` (
  `a` bit(4) NOT NULL,
  `b` tinyint GENERATED ALWAYS AS (`a`) VIRTUAL NOT NULL,
  KEY `on_b` (`b`)
) ENGINE=InnoDB DEFAULT CHARSET=utf8mb4 COLLATE=utf8mb4_0900_ai_ci
INSERT IGNORE INTO t (a) VALUES (0b1000);
SELECT * FROM t;
a	b
	8
DELETE FROM t;
DELETE IGNORE FROM t;
CHECK TABLE t;
Table	Op	Msg_type	Msg_text
test.t	check	status	OK
DROP TABLE t;
# Testing example of type YEAR and value 2020
SHOW CREATE TABLE t;
Table	Create Table
t	CREATE TABLE `t` (
  `a` year NOT NULL,
  `b` tinyint GENERATED ALWAYS AS (`a`) VIRTUAL NOT NULL,
  KEY `on_b` (`b`)
) ENGINE=InnoDB DEFAULT CHARSET=utf8mb4 COLLATE=utf8mb4_0900_ai_ci
INSERT IGNORE INTO t (a) VALUES (2020);
Warnings:
Warning	1264	Out of range value for column 'b' at row 1
SELECT * FROM t;
a	b
2020	127
DELETE FROM t;
DELETE IGNORE FROM t;
CHECK TABLE t;
Table	Op	Msg_type	Msg_text
test.t	check	status	OK
DROP TABLE t;
# Testing example of type DATE and value "2030-04-05"
SHOW CREATE TABLE t;
Table	Create Table
t	CREATE TABLE `t` (
  `a` date NOT NULL,
  `b` tinyint GENERATED ALWAYS AS (`a`) VIRTUAL NOT NULL,
  KEY `on_b` (`b`)
) ENGINE=InnoDB DEFAULT CHARSET=utf8mb4 COLLATE=utf8mb4_0900_ai_ci
INSERT IGNORE INTO t (a) VALUES ("2030-04-05");
Warnings:
Warning	1264	Out of range value for column 'b' at row 1
SELECT * FROM t;
a	b
2030-04-05	127
DELETE FROM t;
DELETE IGNORE FROM t;
CHECK TABLE t;
Table	Op	Msg_type	Msg_text
test.t	check	status	OK
DROP TABLE t;
# Testing example of type TIME and value "11:12:13"
SHOW CREATE TABLE t;
Table	Create Table
t	CREATE TABLE `t` (
  `a` time NOT NULL,
  `b` tinyint GENERATED ALWAYS AS (`a`) VIRTUAL NOT NULL,
  KEY `on_b` (`b`)
) ENGINE=InnoDB DEFAULT CHARSET=utf8mb4 COLLATE=utf8mb4_0900_ai_ci
INSERT IGNORE INTO t (a) VALUES ("11:12:13");
Warnings:
Warning	1264	Out of range value for column 'b' at row 1
SELECT * FROM t;
a	b
11:12:13	127
DELETE FROM t;
DELETE IGNORE FROM t;
CHECK TABLE t;
Table	Op	Msg_type	Msg_text
test.t	check	status	OK
DROP TABLE t;
# Testing example of type DATETIME and value "2030-04-05 11:12:13"
SHOW CREATE TABLE t;
Table	Create Table
t	CREATE TABLE `t` (
  `a` datetime NOT NULL,
  `b` tinyint GENERATED ALWAYS AS (`a`) VIRTUAL NOT NULL,
  KEY `on_b` (`b`)
) ENGINE=InnoDB DEFAULT CHARSET=utf8mb4 COLLATE=utf8mb4_0900_ai_ci
INSERT IGNORE INTO t (a) VALUES ("2030-04-05 11:12:13");
Warnings:
Warning	1264	Out of range value for column 'b' at row 1
SELECT * FROM t;
a	b
2030-04-05 11:12:13	127
DELETE FROM t;
DELETE IGNORE FROM t;
CHECK TABLE t;
Table	Op	Msg_type	Msg_text
test.t	check	status	OK
DROP TABLE t;
# Testing example of type TIMESTAMP and value "2030-04-05 11:12:13"
SHOW CREATE TABLE t;
Table	Create Table
t	CREATE TABLE `t` (
  `a` timestamp NOT NULL,
  `b` tinyint GENERATED ALWAYS AS (`a`) VIRTUAL NOT NULL,
  KEY `on_b` (`b`)
) ENGINE=InnoDB DEFAULT CHARSET=utf8mb4 COLLATE=utf8mb4_0900_ai_ci
INSERT IGNORE INTO t (a) VALUES ("2030-04-05 11:12:13");
Warnings:
Warning	1264	Out of range value for column 'b' at row 1
SELECT * FROM t;
a	b
2030-04-05 11:12:13	127
DELETE FROM t;
DELETE IGNORE FROM t;
CHECK TABLE t;
Table	Op	Msg_type	Msg_text
test.t	check	status	OK
DROP TABLE t;
# Testing example of type CHAR(40) and value "2000000000000000000000000000000000000"
SHOW CREATE TABLE t;
Table	Create Table
t	CREATE TABLE `t` (
  `a` char(40) NOT NULL,
  `b` tinyint GENERATED ALWAYS AS (`a`) VIRTUAL NOT NULL,
  KEY `on_b` (`b`)
) ENGINE=InnoDB DEFAULT CHARSET=utf8mb4 COLLATE=utf8mb4_0900_ai_ci
INSERT IGNORE INTO t (a) VALUES ("2000000000000000000000000000000000000");
Warnings:
Warning	1264	Out of range value for column 'b' at row 1
SELECT * FROM t;
a	b
2000000000000000000000000000000000000	127
DELETE FROM t;
DELETE IGNORE FROM t;
CHECK TABLE t;
Table	Op	Msg_type	Msg_text
test.t	check	status	OK
DROP TABLE t;
# Testing example of type BINARY(45) and value "200000000000000000000000000000000000000000"
SHOW CREATE TABLE t;
Table	Create Table
t	CREATE TABLE `t` (
  `a` binary(45) NOT NULL,
  `b` tinyint GENERATED ALWAYS AS (`a`) VIRTUAL NOT NULL,
  KEY `on_b` (`b`)
) ENGINE=InnoDB DEFAULT CHARSET=utf8mb4 COLLATE=utf8mb4_0900_ai_ci
INSERT IGNORE INTO t (a) VALUES ("200000000000000000000000000000000000000000");
Warnings:
Warning	1264	Out of range value for column 'b' at row 1
SELECT * FROM t;
a	b
200000000000000000000000000000000000000000   	127
DELETE FROM t;
DELETE IGNORE FROM t;
CHECK TABLE t;
Table	Op	Msg_type	Msg_text
test.t	check	status	OK
DROP TABLE t;
# Testing example of type VARCHAR(50) and value "2000000000000000000000000000000000000000000000000"
SHOW CREATE TABLE t;
Table	Create Table
t	CREATE TABLE `t` (
  `a` varchar(50) NOT NULL,
  `b` tinyint GENERATED ALWAYS AS (`a`) VIRTUAL NOT NULL,
  KEY `on_b` (`b`)
) ENGINE=InnoDB DEFAULT CHARSET=utf8mb4 COLLATE=utf8mb4_0900_ai_ci
INSERT IGNORE INTO t (a) VALUES ("2000000000000000000000000000000000000000000000000");
Warnings:
Warning	1264	Out of range value for column 'b' at row 1
SELECT * FROM t;
a	b
2000000000000000000000000000000000000000000000000	127
DELETE FROM t;
DELETE IGNORE FROM t;
CHECK TABLE t;
Table	Op	Msg_type	Msg_text
test.t	check	status	OK
DROP TABLE t;
# Testing example of type CHAR(24) and value "hello beautiful world"
SHOW CREATE TABLE t;
Table	Create Table
t	CREATE TABLE `t` (
  `a` char(24) NOT NULL,
  `b` tinyint GENERATED ALWAYS AS (`a`) VIRTUAL NOT NULL,
  KEY `on_b` (`b`)
) ENGINE=InnoDB DEFAULT CHARSET=utf8mb4 COLLATE=utf8mb4_0900_ai_ci
INSERT IGNORE INTO t (a) VALUES ("hello beautiful world");
Warnings:
Warning	1366	Incorrect integer value: 'hello beautiful world' for column 'b' at row 1
SELECT * FROM t;
a	b
hello beautiful world	0
DELETE FROM t;
DELETE IGNORE FROM t;
CHECK TABLE t;
Table	Op	Msg_type	Msg_text
test.t	check	status	OK
DROP TABLE t;
# Testing example of type BINARY(12) and value "hello world"
SHOW CREATE TABLE t;
Table	Create Table
t	CREATE TABLE `t` (
  `a` binary(12) NOT NULL,
  `b` tinyint GENERATED ALWAYS AS (`a`) VIRTUAL NOT NULL,
  KEY `on_b` (`b`)
) ENGINE=InnoDB DEFAULT CHARSET=utf8mb4 COLLATE=utf8mb4_0900_ai_ci
INSERT IGNORE INTO t (a) VALUES ("hello world");
Warnings:
Warning	1366	Incorrect integer value: 'hello world\x00' for column 'b' at row 1
SELECT * FROM t;
a	b
hello world 	0
DELETE FROM t;
DELETE IGNORE FROM t;
CHECK TABLE t;
Table	Op	Msg_type	Msg_text
test.t	check	status	OK
DROP TABLE t;
# Testing example of type VARCHAR(6) and value "hello"
SHOW CREATE TABLE t;
Table	Create Table
t	CREATE TABLE `t` (
  `a` varchar(6) NOT NULL,
  `b` tinyint GENERATED ALWAYS AS (`a`) VIRTUAL NOT NULL,
  KEY `on_b` (`b`)
) ENGINE=InnoDB DEFAULT CHARSET=utf8mb4 COLLATE=utf8mb4_0900_ai_ci
INSERT IGNORE INTO t (a) VALUES ("hello");
Warnings:
Warning	1366	Incorrect integer value: 'hello' for column 'b' at row 1
SELECT * FROM t;
a	b
hello	0
DELETE FROM t;
DELETE IGNORE FROM t;
CHECK TABLE t;
Table	Op	Msg_type	Msg_text
test.t	check	status	OK
DROP TABLE t;
# Testing example of type ENUM("up","down") and value "up"
SHOW CREATE TABLE t;
Table	Create Table
t	CREATE TABLE `t` (
  `a` enum('up','down') NOT NULL,
  `b` tinyint GENERATED ALWAYS AS (`a`) VIRTUAL NOT NULL,
  KEY `on_b` (`b`)
) ENGINE=InnoDB DEFAULT CHARSET=utf8mb4 COLLATE=utf8mb4_0900_ai_ci
INSERT IGNORE INTO t (a) VALUES ("up");
SELECT * FROM t;
a	b
up	1
DELETE FROM t;
DELETE IGNORE FROM t;
CHECK TABLE t;
Table	Op	Msg_type	Msg_text
test.t	check	status	OK
DROP TABLE t;
# Testing example of type SET("up","down") and value "up,down"
SHOW CREATE TABLE t;
Table	Create Table
t	CREATE TABLE `t` (
  `a` set('up','down') NOT NULL,
  `b` tinyint GENERATED ALWAYS AS (`a`) VIRTUAL NOT NULL,
  KEY `on_b` (`b`)
) ENGINE=InnoDB DEFAULT CHARSET=utf8mb4 COLLATE=utf8mb4_0900_ai_ci
INSERT IGNORE INTO t (a) VALUES ("up,down");
SELECT * FROM t;
a	b
up,down	3
DELETE FROM t;
DELETE IGNORE FROM t;
CHECK TABLE t;
Table	Op	Msg_type	Msg_text
test.t	check	status	OK
DROP TABLE t;
# Testing example of type GEOMETRY and value ST_GeomFromText("POINT(1 1)")
SHOW CREATE TABLE t;
Table	Create Table
t	CREATE TABLE `t` (
  `a` geometry NOT NULL,
  `b` tinyint GENERATED ALWAYS AS (`a`) VIRTUAL NOT NULL,
  KEY `on_b` (`b`)
) ENGINE=InnoDB DEFAULT CHARSET=utf8mb4 COLLATE=utf8mb4_0900_ai_ci
INSERT IGNORE INTO t (a) VALUES (ST_GeomFromText("POINT(1 1)"));
Warnings:
Warning	1366	Incorrect integer value: '\x00\x00\x00\x00\x01\x01\x00\x00\x00\x00\x00\x00\x00\x00\x00\xF0?\x00\x00\x00\x00\x00\x00\xF0?' for column 'b' at row 1
SELECT * FROM t;
a	b
             ð?      ð?	0
DELETE FROM t;
DELETE IGNORE FROM t;
CHECK TABLE t;
Table	Op	Msg_type	Msg_text
test.t	check	status	OK
DROP TABLE t;
# Testing example of type POINT and value ST_GeomFromText("POINT(1 1)")
SHOW CREATE TABLE t;
Table	Create Table
t	CREATE TABLE `t` (
  `a` point NOT NULL,
  `b` tinyint GENERATED ALWAYS AS (`a`) VIRTUAL NOT NULL,
  KEY `on_b` (`b`)
) ENGINE=InnoDB DEFAULT CHARSET=utf8mb4 COLLATE=utf8mb4_0900_ai_ci
INSERT IGNORE INTO t (a) VALUES (ST_GeomFromText("POINT(1 1)"));
Warnings:
Warning	1366	Incorrect integer value: '\x00\x00\x00\x00\x01\x01\x00\x00\x00\x00\x00\x00\x00\x00\x00\xF0?\x00\x00\x00\x00\x00\x00\xF0?' for column 'b' at row 1
SELECT * FROM t;
a	b
             ð?      ð?	0
DELETE FROM t;
DELETE IGNORE FROM t;
CHECK TABLE t;
Table	Op	Msg_type	Msg_text
test.t	check	status	OK
DROP TABLE t;
# Testing example of type LINESTRING and value ST_GeomFromText("LINESTRING(0 0,1 1,2 2)")
SHOW CREATE TABLE t;
Table	Create Table
t	CREATE TABLE `t` (
  `a` linestring NOT NULL,
  `b` tinyint GENERATED ALWAYS AS (`a`) VIRTUAL NOT NULL,
  KEY `on_b` (`b`)
) ENGINE=InnoDB DEFAULT CHARSET=utf8mb4 COLLATE=utf8mb4_0900_ai_ci
INSERT IGNORE INTO t (a) VALUES (ST_GeomFromText("LINESTRING(0 0,1 1,2 2)"));
Warnings:
Warning	1366	Incorrect integer value: '\x00\x00\x00\x00\x01\x02\x00\x00\x00\x03\x00\x00\x00\x00\x00\x00\x00\x00\x00\x00\x00\x00\x00\x00\x00\x00\x00\x00\x00\x00\x00\x00' for column 'b' at row 1
SELECT * FROM t;
a	b
                                ð?      ð?       @       @	0
DELETE FROM t;
DELETE IGNORE FROM t;
CHECK TABLE t;
Table	Op	Msg_type	Msg_text
test.t	check	status	OK
DROP TABLE t;
# Testing example of type POLYGON and value ST_GeomFromText("POLYGON((0 0,1 0,1 1,0 1,0 0),(5 5,7 5,7 7,5 7,5 5))")
SHOW CREATE TABLE t;
Table	Create Table
t	CREATE TABLE `t` (
  `a` polygon NOT NULL,
  `b` tinyint GENERATED ALWAYS AS (`a`) VIRTUAL NOT NULL,
  KEY `on_b` (`b`)
) ENGINE=InnoDB DEFAULT CHARSET=utf8mb4 COLLATE=utf8mb4_0900_ai_ci
INSERT IGNORE INTO t (a) VALUES (ST_GeomFromText("POLYGON((0 0,1 0,1 1,0 1,0 0),(5 5,7 5,7 7,5 7,5 5))"));
Warnings:
Warning	1366	Incorrect integer value: '\x00\x00\x00\x00\x01\x03\x00\x00\x00\x02\x00\x00\x00\x05\x00\x00\x00\x00\x00\x00\x00\x00\x00\x00\x00\x00\x00\x00\x00\x00\x00\x00' for column 'b' at row 1
SELECT * FROM t;
a	b
                                   ð?              ð?      ð?              ð?                         @      @      @      @      @      @      @      @      @      @	0
DELETE FROM t;
DELETE IGNORE FROM t;
CHECK TABLE t;
Table	Op	Msg_type	Msg_text
test.t	check	status	OK
DROP TABLE t;
#
# Testing virtual column of type SMALLINT
#
# Testing example of type JSON and value "{}"
SHOW CREATE TABLE t;
Table	Create Table
t	CREATE TABLE `t` (
  `a` json NOT NULL,
  `b` smallint GENERATED ALWAYS AS (`a`) VIRTUAL NOT NULL,
  KEY `on_b` (`b`)
) ENGINE=InnoDB DEFAULT CHARSET=utf8mb4 COLLATE=utf8mb4_0900_ai_ci
INSERT IGNORE INTO t (a) VALUES ("{}");
Warnings:
Warning	3156	Invalid JSON value for CAST to INTEGER from column a at row 1
SELECT * FROM t;
a	b
{}	0
Warnings:
Warning	3156	Invalid JSON value for CAST to INTEGER from column a at row 1
DELETE FROM t;
DELETE IGNORE FROM t;
Warnings:
Warning	3156	Invalid JSON value for CAST to INTEGER from column a at row 1
Warning	3156	Invalid JSON value for CAST to INTEGER from column a at row 1
CHECK TABLE t;
Table	Op	Msg_type	Msg_text
test.t	check	status	OK
DROP TABLE t;
# Testing example of type JSON and value '["hello beautiful world"]'
SHOW CREATE TABLE t;
Table	Create Table
t	CREATE TABLE `t` (
  `a` json NOT NULL,
  `b` smallint GENERATED ALWAYS AS (`a`) VIRTUAL NOT NULL,
  KEY `on_b` (`b`)
) ENGINE=InnoDB DEFAULT CHARSET=utf8mb4 COLLATE=utf8mb4_0900_ai_ci
INSERT IGNORE INTO t (a) VALUES ('["hello beautiful world"]');
Warnings:
Warning	3156	Invalid JSON value for CAST to INTEGER from column a at row 1
SELECT * FROM t;
a	b
["hello beautiful world"]	0
Warnings:
Warning	3156	Invalid JSON value for CAST to INTEGER from column a at row 1
DELETE FROM t;
DELETE IGNORE FROM t;
Warnings:
Warning	3156	Invalid JSON value for CAST to INTEGER from column a at row 1
Warning	3156	Invalid JSON value for CAST to INTEGER from column a at row 1
CHECK TABLE t;
Table	Op	Msg_type	Msg_text
test.t	check	status	OK
DROP TABLE t;
# Testing example of type JSON and value "-1"
SHOW CREATE TABLE t;
Table	Create Table
t	CREATE TABLE `t` (
  `a` json NOT NULL,
  `b` smallint GENERATED ALWAYS AS (`a`) VIRTUAL NOT NULL,
  KEY `on_b` (`b`)
) ENGINE=InnoDB DEFAULT CHARSET=utf8mb4 COLLATE=utf8mb4_0900_ai_ci
INSERT IGNORE INTO t (a) VALUES ("-1");
SELECT * FROM t;
a	b
-1	-1
DELETE FROM t;
DELETE IGNORE FROM t;
CHECK TABLE t;
Table	Op	Msg_type	Msg_text
test.t	check	status	OK
DROP TABLE t;
# Testing example of type TINYINT and value -1
SHOW CREATE TABLE t;
Table	Create Table
t	CREATE TABLE `t` (
  `a` tinyint NOT NULL,
  `b` smallint GENERATED ALWAYS AS (`a`) VIRTUAL NOT NULL,
  KEY `on_b` (`b`)
) ENGINE=InnoDB DEFAULT CHARSET=utf8mb4 COLLATE=utf8mb4_0900_ai_ci
INSERT IGNORE INTO t (a) VALUES (-1);
SELECT * FROM t;
a	b
-1	-1
DELETE FROM t;
DELETE IGNORE FROM t;
CHECK TABLE t;
Table	Op	Msg_type	Msg_text
test.t	check	status	OK
DROP TABLE t;
# Testing example of type SMALLINT and value -1
SHOW CREATE TABLE t;
Table	Create Table
t	CREATE TABLE `t` (
  `a` smallint NOT NULL,
  `b` smallint GENERATED ALWAYS AS (`a`) VIRTUAL NOT NULL,
  KEY `on_b` (`b`)
) ENGINE=InnoDB DEFAULT CHARSET=utf8mb4 COLLATE=utf8mb4_0900_ai_ci
INSERT IGNORE INTO t (a) VALUES (-1);
SELECT * FROM t;
a	b
-1	-1
DELETE FROM t;
DELETE IGNORE FROM t;
CHECK TABLE t;
Table	Op	Msg_type	Msg_text
test.t	check	status	OK
DROP TABLE t;
# Testing example of type MEDIUMINT and value -1
SHOW CREATE TABLE t;
Table	Create Table
t	CREATE TABLE `t` (
  `a` mediumint NOT NULL,
  `b` smallint GENERATED ALWAYS AS (`a`) VIRTUAL NOT NULL,
  KEY `on_b` (`b`)
) ENGINE=InnoDB DEFAULT CHARSET=utf8mb4 COLLATE=utf8mb4_0900_ai_ci
INSERT IGNORE INTO t (a) VALUES (-1);
SELECT * FROM t;
a	b
-1	-1
DELETE FROM t;
DELETE IGNORE FROM t;
CHECK TABLE t;
Table	Op	Msg_type	Msg_text
test.t	check	status	OK
DROP TABLE t;
# Testing example of type INT and value 2000000000
SHOW CREATE TABLE t;
Table	Create Table
t	CREATE TABLE `t` (
  `a` int NOT NULL,
  `b` smallint GENERATED ALWAYS AS (`a`) VIRTUAL NOT NULL,
  KEY `on_b` (`b`)
) ENGINE=InnoDB DEFAULT CHARSET=utf8mb4 COLLATE=utf8mb4_0900_ai_ci
INSERT IGNORE INTO t (a) VALUES (2000000000);
Warnings:
Warning	1264	Out of range value for column 'b' at row 1
SELECT * FROM t;
a	b
2000000000	32767
DELETE FROM t;
DELETE IGNORE FROM t;
CHECK TABLE t;
Table	Op	Msg_type	Msg_text
test.t	check	status	OK
DROP TABLE t;
# Testing example of type INT and value -2000000000
SHOW CREATE TABLE t;
Table	Create Table
t	CREATE TABLE `t` (
  `a` int NOT NULL,
  `b` smallint GENERATED ALWAYS AS (`a`) VIRTUAL NOT NULL,
  KEY `on_b` (`b`)
) ENGINE=InnoDB DEFAULT CHARSET=utf8mb4 COLLATE=utf8mb4_0900_ai_ci
INSERT IGNORE INTO t (a) VALUES (-2000000000);
Warnings:
Warning	1264	Out of range value for column 'b' at row 1
SELECT * FROM t;
a	b
-2000000000	-32768
DELETE FROM t;
DELETE IGNORE FROM t;
CHECK TABLE t;
Table	Op	Msg_type	Msg_text
test.t	check	status	OK
DROP TABLE t;
# Testing example of type INT UNSIGNED and value 4000000000
SHOW CREATE TABLE t;
Table	Create Table
t	CREATE TABLE `t` (
  `a` int unsigned NOT NULL,
  `b` smallint GENERATED ALWAYS AS (`a`) VIRTUAL NOT NULL,
  KEY `on_b` (`b`)
) ENGINE=InnoDB DEFAULT CHARSET=utf8mb4 COLLATE=utf8mb4_0900_ai_ci
INSERT IGNORE INTO t (a) VALUES (4000000000);
Warnings:
Warning	1264	Out of range value for column 'b' at row 1
SELECT * FROM t;
a	b
4000000000	32767
DELETE FROM t;
DELETE IGNORE FROM t;
CHECK TABLE t;
Table	Op	Msg_type	Msg_text
test.t	check	status	OK
DROP TABLE t;
# Testing example of type BIGINT and value 2000000000000000000
SHOW CREATE TABLE t;
Table	Create Table
t	CREATE TABLE `t` (
  `a` bigint NOT NULL,
  `b` smallint GENERATED ALWAYS AS (`a`) VIRTUAL NOT NULL,
  KEY `on_b` (`b`)
) ENGINE=InnoDB DEFAULT CHARSET=utf8mb4 COLLATE=utf8mb4_0900_ai_ci
INSERT IGNORE INTO t (a) VALUES (2000000000000000000);
Warnings:
Warning	1264	Out of range value for column 'b' at row 1
SELECT * FROM t;
a	b
2000000000000000000	32767
DELETE FROM t;
DELETE IGNORE FROM t;
CHECK TABLE t;
Table	Op	Msg_type	Msg_text
test.t	check	status	OK
DROP TABLE t;
# Testing example of type BIGINT and value -2000000000000000000
SHOW CREATE TABLE t;
Table	Create Table
t	CREATE TABLE `t` (
  `a` bigint NOT NULL,
  `b` smallint GENERATED ALWAYS AS (`a`) VIRTUAL NOT NULL,
  KEY `on_b` (`b`)
) ENGINE=InnoDB DEFAULT CHARSET=utf8mb4 COLLATE=utf8mb4_0900_ai_ci
INSERT IGNORE INTO t (a) VALUES (-2000000000000000000);
Warnings:
Warning	1264	Out of range value for column 'b' at row 1
SELECT * FROM t;
a	b
-2000000000000000000	-32768
DELETE FROM t;
DELETE IGNORE FROM t;
CHECK TABLE t;
Table	Op	Msg_type	Msg_text
test.t	check	status	OK
DROP TABLE t;
# Testing example of type FLOAT and value -1.23456
SHOW CREATE TABLE t;
Table	Create Table
t	CREATE TABLE `t` (
  `a` float NOT NULL,
  `b` smallint GENERATED ALWAYS AS (`a`) VIRTUAL NOT NULL,
  KEY `on_b` (`b`)
) ENGINE=InnoDB DEFAULT CHARSET=utf8mb4 COLLATE=utf8mb4_0900_ai_ci
INSERT IGNORE INTO t (a) VALUES (-1.23456);
SELECT * FROM t;
a	b
-1.23456	-1
DELETE FROM t;
DELETE IGNORE FROM t;
CHECK TABLE t;
Table	Op	Msg_type	Msg_text
test.t	check	status	OK
DROP TABLE t;
# Testing example of type FLOAT and value -1e38
SHOW CREATE TABLE t;
Table	Create Table
t	CREATE TABLE `t` (
  `a` float NOT NULL,
  `b` smallint GENERATED ALWAYS AS (`a`) VIRTUAL NOT NULL,
  KEY `on_b` (`b`)
) ENGINE=InnoDB DEFAULT CHARSET=utf8mb4 COLLATE=utf8mb4_0900_ai_ci
INSERT IGNORE INTO t (a) VALUES (-1e38);
Warnings:
Warning	1264	Out of range value for column 'b' at row 1
SELECT * FROM t;
a	b
-1e38	-32768
DELETE FROM t;
DELETE IGNORE FROM t;
CHECK TABLE t;
Table	Op	Msg_type	Msg_text
test.t	check	status	OK
DROP TABLE t;
# Testing example of type FLOAT and value 1e38
SHOW CREATE TABLE t;
Table	Create Table
t	CREATE TABLE `t` (
  `a` float NOT NULL,
  `b` smallint GENERATED ALWAYS AS (`a`) VIRTUAL NOT NULL,
  KEY `on_b` (`b`)
) ENGINE=InnoDB DEFAULT CHARSET=utf8mb4 COLLATE=utf8mb4_0900_ai_ci
INSERT IGNORE INTO t (a) VALUES (1e38);
Warnings:
Warning	1264	Out of range value for column 'b' at row 1
SELECT * FROM t;
a	b
1e38	32767
DELETE FROM t;
DELETE IGNORE FROM t;
CHECK TABLE t;
Table	Op	Msg_type	Msg_text
test.t	check	status	OK
DROP TABLE t;
# Testing example of type DOUBLE and value -1.23456789012345
SHOW CREATE TABLE t;
Table	Create Table
t	CREATE TABLE `t` (
  `a` double NOT NULL,
  `b` smallint GENERATED ALWAYS AS (`a`) VIRTUAL NOT NULL,
  KEY `on_b` (`b`)
) ENGINE=InnoDB DEFAULT CHARSET=utf8mb4 COLLATE=utf8mb4_0900_ai_ci
INSERT IGNORE INTO t (a) VALUES (-1.23456789012345);
SELECT * FROM t;
a	b
-1.23456789012345	-1
DELETE FROM t;
DELETE IGNORE FROM t;
CHECK TABLE t;
Table	Op	Msg_type	Msg_text
test.t	check	status	OK
DROP TABLE t;
# Testing example of type DOUBLE and value 1.23456789012345
SHOW CREATE TABLE t;
Table	Create Table
t	CREATE TABLE `t` (
  `a` double NOT NULL,
  `b` smallint GENERATED ALWAYS AS (`a`) VIRTUAL NOT NULL,
  KEY `on_b` (`b`)
) ENGINE=InnoDB DEFAULT CHARSET=utf8mb4 COLLATE=utf8mb4_0900_ai_ci
INSERT IGNORE INTO t (a) VALUES (1.23456789012345);
SELECT * FROM t;
a	b
1.23456789012345	1
DELETE FROM t;
DELETE IGNORE FROM t;
CHECK TABLE t;
Table	Op	Msg_type	Msg_text
test.t	check	status	OK
DROP TABLE t;
# Testing example of type DOUBLE and value -1e300
SHOW CREATE TABLE t;
Table	Create Table
t	CREATE TABLE `t` (
  `a` double NOT NULL,
  `b` smallint GENERATED ALWAYS AS (`a`) VIRTUAL NOT NULL,
  KEY `on_b` (`b`)
) ENGINE=InnoDB DEFAULT CHARSET=utf8mb4 COLLATE=utf8mb4_0900_ai_ci
INSERT IGNORE INTO t (a) VALUES (-1e300);
Warnings:
Warning	1264	Out of range value for column 'b' at row 1
SELECT * FROM t;
a	b
-1e300	-32768
DELETE FROM t;
DELETE IGNORE FROM t;
CHECK TABLE t;
Table	Op	Msg_type	Msg_text
test.t	check	status	OK
DROP TABLE t;
# Testing example of type DOUBLE and value 1e300
SHOW CREATE TABLE t;
Table	Create Table
t	CREATE TABLE `t` (
  `a` double NOT NULL,
  `b` smallint GENERATED ALWAYS AS (`a`) VIRTUAL NOT NULL,
  KEY `on_b` (`b`)
) ENGINE=InnoDB DEFAULT CHARSET=utf8mb4 COLLATE=utf8mb4_0900_ai_ci
INSERT IGNORE INTO t (a) VALUES (1e300);
Warnings:
Warning	1264	Out of range value for column 'b' at row 1
SELECT * FROM t;
a	b
1e300	32767
DELETE FROM t;
DELETE IGNORE FROM t;
CHECK TABLE t;
Table	Op	Msg_type	Msg_text
test.t	check	status	OK
DROP TABLE t;
# Testing example of type DECIMAL(4,2) and value -10.99
SHOW CREATE TABLE t;
Table	Create Table
t	CREATE TABLE `t` (
  `a` decimal(4,2) NOT NULL,
  `b` smallint GENERATED ALWAYS AS (`a`) VIRTUAL NOT NULL,
  KEY `on_b` (`b`)
) ENGINE=InnoDB DEFAULT CHARSET=utf8mb4 COLLATE=utf8mb4_0900_ai_ci
INSERT IGNORE INTO t (a) VALUES (-10.99);
SELECT * FROM t;
a	b
-10.99	-11
DELETE FROM t;
DELETE IGNORE FROM t;
CHECK TABLE t;
Table	Op	Msg_type	Msg_text
test.t	check	status	OK
DROP TABLE t;
# Testing example of type DECIMAL(34,4) and value 20000000000000000000000000000.0001
SHOW CREATE TABLE t;
Table	Create Table
t	CREATE TABLE `t` (
  `a` decimal(34,4) NOT NULL,
  `b` smallint GENERATED ALWAYS AS (`a`) VIRTUAL NOT NULL,
  KEY `on_b` (`b`)
) ENGINE=InnoDB DEFAULT CHARSET=utf8mb4 COLLATE=utf8mb4_0900_ai_ci
INSERT IGNORE INTO t (a) VALUES (20000000000000000000000000000.0001);
Warnings:
Warning	1264	Out of range value for column 'b' at row 1
Warning	1264	Out of range value for column 'b' at row 1
SELECT * FROM t;
a	b
20000000000000000000000000000.0001	32767
DELETE FROM t;
DELETE IGNORE FROM t;
CHECK TABLE t;
Table	Op	Msg_type	Msg_text
test.t	check	status	OK
DROP TABLE t;
# Testing example of type DECIMAL(34,4) and value -20000000000000000000000000000.0001
SHOW CREATE TABLE t;
Table	Create Table
t	CREATE TABLE `t` (
  `a` decimal(34,4) NOT NULL,
  `b` smallint GENERATED ALWAYS AS (`a`) VIRTUAL NOT NULL,
  KEY `on_b` (`b`)
) ENGINE=InnoDB DEFAULT CHARSET=utf8mb4 COLLATE=utf8mb4_0900_ai_ci
INSERT IGNORE INTO t (a) VALUES (-20000000000000000000000000000.0001);
Warnings:
Warning	1264	Out of range value for column 'b' at row 1
Warning	1264	Out of range value for column 'b' at row 1
SELECT * FROM t;
a	b
-20000000000000000000000000000.0001	-32768
DELETE FROM t;
DELETE IGNORE FROM t;
CHECK TABLE t;
Table	Op	Msg_type	Msg_text
test.t	check	status	OK
DROP TABLE t;
# Testing example of type BIT(64) and value 0xDEADBEEFC0FEBABE
SHOW CREATE TABLE t;
Table	Create Table
t	CREATE TABLE `t` (
  `a` bit(64) NOT NULL,
  `b` smallint GENERATED ALWAYS AS (`a`) VIRTUAL NOT NULL,
  KEY `on_b` (`b`)
) ENGINE=InnoDB DEFAULT CHARSET=utf8mb4 COLLATE=utf8mb4_0900_ai_ci
INSERT IGNORE INTO t (a) VALUES (0xDEADBEEFC0FEBABE);
Warnings:
Warning	1264	Out of range value for column 'b' at row 1
SELECT * FROM t;
a	b
Þ­¾ïÀþº¾	32767
DELETE FROM t;
DELETE IGNORE FROM t;
CHECK TABLE t;
Table	Op	Msg_type	Msg_text
test.t	check	status	OK
DROP TABLE t;
# Testing example of type BIT(4) and value 0b1000
SHOW CREATE TABLE t;
Table	Create Table
t	CREATE TABLE `t` (
  `a` bit(4) NOT NULL,
  `b` smallint GENERATED ALWAYS AS (`a`) VIRTUAL NOT NULL,
  KEY `on_b` (`b`)
) ENGINE=InnoDB DEFAULT CHARSET=utf8mb4 COLLATE=utf8mb4_0900_ai_ci
INSERT IGNORE INTO t (a) VALUES (0b1000);
SELECT * FROM t;
a	b
	8
DELETE FROM t;
DELETE IGNORE FROM t;
CHECK TABLE t;
Table	Op	Msg_type	Msg_text
test.t	check	status	OK
DROP TABLE t;
# Testing example of type YEAR and value 2020
SHOW CREATE TABLE t;
Table	Create Table
t	CREATE TABLE `t` (
  `a` year NOT NULL,
  `b` smallint GENERATED ALWAYS AS (`a`) VIRTUAL NOT NULL,
  KEY `on_b` (`b`)
) ENGINE=InnoDB DEFAULT CHARSET=utf8mb4 COLLATE=utf8mb4_0900_ai_ci
INSERT IGNORE INTO t (a) VALUES (2020);
SELECT * FROM t;
a	b
2020	2020
DELETE FROM t;
DELETE IGNORE FROM t;
CHECK TABLE t;
Table	Op	Msg_type	Msg_text
test.t	check	status	OK
DROP TABLE t;
# Testing example of type DATE and value "2030-04-05"
SHOW CREATE TABLE t;
Table	Create Table
t	CREATE TABLE `t` (
  `a` date NOT NULL,
  `b` smallint GENERATED ALWAYS AS (`a`) VIRTUAL NOT NULL,
  KEY `on_b` (`b`)
) ENGINE=InnoDB DEFAULT CHARSET=utf8mb4 COLLATE=utf8mb4_0900_ai_ci
INSERT IGNORE INTO t (a) VALUES ("2030-04-05");
Warnings:
Warning	1264	Out of range value for column 'b' at row 1
SELECT * FROM t;
a	b
2030-04-05	32767
DELETE FROM t;
DELETE IGNORE FROM t;
CHECK TABLE t;
Table	Op	Msg_type	Msg_text
test.t	check	status	OK
DROP TABLE t;
# Testing example of type TIME and value "11:12:13"
SHOW CREATE TABLE t;
Table	Create Table
t	CREATE TABLE `t` (
  `a` time NOT NULL,
  `b` smallint GENERATED ALWAYS AS (`a`) VIRTUAL NOT NULL,
  KEY `on_b` (`b`)
) ENGINE=InnoDB DEFAULT CHARSET=utf8mb4 COLLATE=utf8mb4_0900_ai_ci
INSERT IGNORE INTO t (a) VALUES ("11:12:13");
Warnings:
Warning	1264	Out of range value for column 'b' at row 1
SELECT * FROM t;
a	b
11:12:13	32767
DELETE FROM t;
DELETE IGNORE FROM t;
CHECK TABLE t;
Table	Op	Msg_type	Msg_text
test.t	check	status	OK
DROP TABLE t;
# Testing example of type DATETIME and value "2030-04-05 11:12:13"
SHOW CREATE TABLE t;
Table	Create Table
t	CREATE TABLE `t` (
  `a` datetime NOT NULL,
  `b` smallint GENERATED ALWAYS AS (`a`) VIRTUAL NOT NULL,
  KEY `on_b` (`b`)
) ENGINE=InnoDB DEFAULT CHARSET=utf8mb4 COLLATE=utf8mb4_0900_ai_ci
INSERT IGNORE INTO t (a) VALUES ("2030-04-05 11:12:13");
Warnings:
Warning	1264	Out of range value for column 'b' at row 1
SELECT * FROM t;
a	b
2030-04-05 11:12:13	32767
DELETE FROM t;
DELETE IGNORE FROM t;
CHECK TABLE t;
Table	Op	Msg_type	Msg_text
test.t	check	status	OK
DROP TABLE t;
# Testing example of type TIMESTAMP and value "2030-04-05 11:12:13"
SHOW CREATE TABLE t;
Table	Create Table
t	CREATE TABLE `t` (
  `a` timestamp NOT NULL,
  `b` smallint GENERATED ALWAYS AS (`a`) VIRTUAL NOT NULL,
  KEY `on_b` (`b`)
) ENGINE=InnoDB DEFAULT CHARSET=utf8mb4 COLLATE=utf8mb4_0900_ai_ci
INSERT IGNORE INTO t (a) VALUES ("2030-04-05 11:12:13");
Warnings:
Warning	1264	Out of range value for column 'b' at row 1
SELECT * FROM t;
a	b
2030-04-05 11:12:13	32767
DELETE FROM t;
DELETE IGNORE FROM t;
CHECK TABLE t;
Table	Op	Msg_type	Msg_text
test.t	check	status	OK
DROP TABLE t;
# Testing example of type CHAR(40) and value "2000000000000000000000000000000000000"
SHOW CREATE TABLE t;
Table	Create Table
t	CREATE TABLE `t` (
  `a` char(40) NOT NULL,
  `b` smallint GENERATED ALWAYS AS (`a`) VIRTUAL NOT NULL,
  KEY `on_b` (`b`)
) ENGINE=InnoDB DEFAULT CHARSET=utf8mb4 COLLATE=utf8mb4_0900_ai_ci
INSERT IGNORE INTO t (a) VALUES ("2000000000000000000000000000000000000");
Warnings:
Warning	1264	Out of range value for column 'b' at row 1
SELECT * FROM t;
a	b
2000000000000000000000000000000000000	32767
DELETE FROM t;
DELETE IGNORE FROM t;
CHECK TABLE t;
Table	Op	Msg_type	Msg_text
test.t	check	status	OK
DROP TABLE t;
# Testing example of type BINARY(45) and value "200000000000000000000000000000000000000000"
SHOW CREATE TABLE t;
Table	Create Table
t	CREATE TABLE `t` (
  `a` binary(45) NOT NULL,
  `b` smallint GENERATED ALWAYS AS (`a`) VIRTUAL NOT NULL,
  KEY `on_b` (`b`)
) ENGINE=InnoDB DEFAULT CHARSET=utf8mb4 COLLATE=utf8mb4_0900_ai_ci
INSERT IGNORE INTO t (a) VALUES ("200000000000000000000000000000000000000000");
Warnings:
Warning	1264	Out of range value for column 'b' at row 1
SELECT * FROM t;
a	b
200000000000000000000000000000000000000000   	32767
DELETE FROM t;
DELETE IGNORE FROM t;
CHECK TABLE t;
Table	Op	Msg_type	Msg_text
test.t	check	status	OK
DROP TABLE t;
# Testing example of type VARCHAR(50) and value "2000000000000000000000000000000000000000000000000"
SHOW CREATE TABLE t;
Table	Create Table
t	CREATE TABLE `t` (
  `a` varchar(50) NOT NULL,
  `b` smallint GENERATED ALWAYS AS (`a`) VIRTUAL NOT NULL,
  KEY `on_b` (`b`)
) ENGINE=InnoDB DEFAULT CHARSET=utf8mb4 COLLATE=utf8mb4_0900_ai_ci
INSERT IGNORE INTO t (a) VALUES ("2000000000000000000000000000000000000000000000000");
Warnings:
Warning	1264	Out of range value for column 'b' at row 1
SELECT * FROM t;
a	b
2000000000000000000000000000000000000000000000000	32767
DELETE FROM t;
DELETE IGNORE FROM t;
CHECK TABLE t;
Table	Op	Msg_type	Msg_text
test.t	check	status	OK
DROP TABLE t;
# Testing example of type CHAR(24) and value "hello beautiful world"
SHOW CREATE TABLE t;
Table	Create Table
t	CREATE TABLE `t` (
  `a` char(24) NOT NULL,
  `b` smallint GENERATED ALWAYS AS (`a`) VIRTUAL NOT NULL,
  KEY `on_b` (`b`)
) ENGINE=InnoDB DEFAULT CHARSET=utf8mb4 COLLATE=utf8mb4_0900_ai_ci
INSERT IGNORE INTO t (a) VALUES ("hello beautiful world");
Warnings:
Warning	1366	Incorrect integer value: 'hello beautiful world' for column 'b' at row 1
SELECT * FROM t;
a	b
hello beautiful world	0
DELETE FROM t;
DELETE IGNORE FROM t;
CHECK TABLE t;
Table	Op	Msg_type	Msg_text
test.t	check	status	OK
DROP TABLE t;
# Testing example of type BINARY(12) and value "hello world"
SHOW CREATE TABLE t;
Table	Create Table
t	CREATE TABLE `t` (
  `a` binary(12) NOT NULL,
  `b` smallint GENERATED ALWAYS AS (`a`) VIRTUAL NOT NULL,
  KEY `on_b` (`b`)
) ENGINE=InnoDB DEFAULT CHARSET=utf8mb4 COLLATE=utf8mb4_0900_ai_ci
INSERT IGNORE INTO t (a) VALUES ("hello world");
Warnings:
Warning	1366	Incorrect integer value: 'hello world\x00' for column 'b' at row 1
SELECT * FROM t;
a	b
hello world 	0
DELETE FROM t;
DELETE IGNORE FROM t;
CHECK TABLE t;
Table	Op	Msg_type	Msg_text
test.t	check	status	OK
DROP TABLE t;
# Testing example of type VARCHAR(6) and value "hello"
SHOW CREATE TABLE t;
Table	Create Table
t	CREATE TABLE `t` (
  `a` varchar(6) NOT NULL,
  `b` smallint GENERATED ALWAYS AS (`a`) VIRTUAL NOT NULL,
  KEY `on_b` (`b`)
) ENGINE=InnoDB DEFAULT CHARSET=utf8mb4 COLLATE=utf8mb4_0900_ai_ci
INSERT IGNORE INTO t (a) VALUES ("hello");
Warnings:
Warning	1366	Incorrect integer value: 'hello' for column 'b' at row 1
SELECT * FROM t;
a	b
hello	0
DELETE FROM t;
DELETE IGNORE FROM t;
CHECK TABLE t;
Table	Op	Msg_type	Msg_text
test.t	check	status	OK
DROP TABLE t;
# Testing example of type ENUM("up","down") and value "up"
SHOW CREATE TABLE t;
Table	Create Table
t	CREATE TABLE `t` (
  `a` enum('up','down') NOT NULL,
  `b` smallint GENERATED ALWAYS AS (`a`) VIRTUAL NOT NULL,
  KEY `on_b` (`b`)
) ENGINE=InnoDB DEFAULT CHARSET=utf8mb4 COLLATE=utf8mb4_0900_ai_ci
INSERT IGNORE INTO t (a) VALUES ("up");
SELECT * FROM t;
a	b
up	1
DELETE FROM t;
DELETE IGNORE FROM t;
CHECK TABLE t;
Table	Op	Msg_type	Msg_text
test.t	check	status	OK
DROP TABLE t;
# Testing example of type SET("up","down") and value "up,down"
SHOW CREATE TABLE t;
Table	Create Table
t	CREATE TABLE `t` (
  `a` set('up','down') NOT NULL,
  `b` smallint GENERATED ALWAYS AS (`a`) VIRTUAL NOT NULL,
  KEY `on_b` (`b`)
) ENGINE=InnoDB DEFAULT CHARSET=utf8mb4 COLLATE=utf8mb4_0900_ai_ci
INSERT IGNORE INTO t (a) VALUES ("up,down");
SELECT * FROM t;
a	b
up,down	3
DELETE FROM t;
DELETE IGNORE FROM t;
CHECK TABLE t;
Table	Op	Msg_type	Msg_text
test.t	check	status	OK
DROP TABLE t;
# Testing example of type GEOMETRY and value ST_GeomFromText("POINT(1 1)")
SHOW CREATE TABLE t;
Table	Create Table
t	CREATE TABLE `t` (
  `a` geometry NOT NULL,
  `b` smallint GENERATED ALWAYS AS (`a`) VIRTUAL NOT NULL,
  KEY `on_b` (`b`)
) ENGINE=InnoDB DEFAULT CHARSET=utf8mb4 COLLATE=utf8mb4_0900_ai_ci
INSERT IGNORE INTO t (a) VALUES (ST_GeomFromText("POINT(1 1)"));
Warnings:
Warning	1366	Incorrect integer value: '\x00\x00\x00\x00\x01\x01\x00\x00\x00\x00\x00\x00\x00\x00\x00\xF0?\x00\x00\x00\x00\x00\x00\xF0?' for column 'b' at row 1
SELECT * FROM t;
a	b
             ð?      ð?	0
DELETE FROM t;
DELETE IGNORE FROM t;
CHECK TABLE t;
Table	Op	Msg_type	Msg_text
test.t	check	status	OK
DROP TABLE t;
# Testing example of type POINT and value ST_GeomFromText("POINT(1 1)")
SHOW CREATE TABLE t;
Table	Create Table
t	CREATE TABLE `t` (
  `a` point NOT NULL,
  `b` smallint GENERATED ALWAYS AS (`a`) VIRTUAL NOT NULL,
  KEY `on_b` (`b`)
) ENGINE=InnoDB DEFAULT CHARSET=utf8mb4 COLLATE=utf8mb4_0900_ai_ci
INSERT IGNORE INTO t (a) VALUES (ST_GeomFromText("POINT(1 1)"));
Warnings:
Warning	1366	Incorrect integer value: '\x00\x00\x00\x00\x01\x01\x00\x00\x00\x00\x00\x00\x00\x00\x00\xF0?\x00\x00\x00\x00\x00\x00\xF0?' for column 'b' at row 1
SELECT * FROM t;
a	b
             ð?      ð?	0
DELETE FROM t;
DELETE IGNORE FROM t;
CHECK TABLE t;
Table	Op	Msg_type	Msg_text
test.t	check	status	OK
DROP TABLE t;
# Testing example of type LINESTRING and value ST_GeomFromText("LINESTRING(0 0,1 1,2 2)")
SHOW CREATE TABLE t;
Table	Create Table
t	CREATE TABLE `t` (
  `a` linestring NOT NULL,
  `b` smallint GENERATED ALWAYS AS (`a`) VIRTUAL NOT NULL,
  KEY `on_b` (`b`)
) ENGINE=InnoDB DEFAULT CHARSET=utf8mb4 COLLATE=utf8mb4_0900_ai_ci
INSERT IGNORE INTO t (a) VALUES (ST_GeomFromText("LINESTRING(0 0,1 1,2 2)"));
Warnings:
Warning	1366	Incorrect integer value: '\x00\x00\x00\x00\x01\x02\x00\x00\x00\x03\x00\x00\x00\x00\x00\x00\x00\x00\x00\x00\x00\x00\x00\x00\x00\x00\x00\x00\x00\x00\x00\x00' for column 'b' at row 1
SELECT * FROM t;
a	b
                                ð?      ð?       @       @	0
DELETE FROM t;
DELETE IGNORE FROM t;
CHECK TABLE t;
Table	Op	Msg_type	Msg_text
test.t	check	status	OK
DROP TABLE t;
# Testing example of type POLYGON and value ST_GeomFromText("POLYGON((0 0,1 0,1 1,0 1,0 0),(5 5,7 5,7 7,5 7,5 5))")
SHOW CREATE TABLE t;
Table	Create Table
t	CREATE TABLE `t` (
  `a` polygon NOT NULL,
  `b` smallint GENERATED ALWAYS AS (`a`) VIRTUAL NOT NULL,
  KEY `on_b` (`b`)
) ENGINE=InnoDB DEFAULT CHARSET=utf8mb4 COLLATE=utf8mb4_0900_ai_ci
INSERT IGNORE INTO t (a) VALUES (ST_GeomFromText("POLYGON((0 0,1 0,1 1,0 1,0 0),(5 5,7 5,7 7,5 7,5 5))"));
Warnings:
Warning	1366	Incorrect integer value: '\x00\x00\x00\x00\x01\x03\x00\x00\x00\x02\x00\x00\x00\x05\x00\x00\x00\x00\x00\x00\x00\x00\x00\x00\x00\x00\x00\x00\x00\x00\x00\x00' for column 'b' at row 1
SELECT * FROM t;
a	b
                                   ð?              ð?      ð?              ð?                         @      @      @      @      @      @      @      @      @      @	0
DELETE FROM t;
DELETE IGNORE FROM t;
CHECK TABLE t;
Table	Op	Msg_type	Msg_text
test.t	check	status	OK
DROP TABLE t;
#
# Testing virtual column of type MEDIUMINT
#
# Testing example of type JSON and value "{}"
SHOW CREATE TABLE t;
Table	Create Table
t	CREATE TABLE `t` (
  `a` json NOT NULL,
  `b` mediumint GENERATED ALWAYS AS (`a`) VIRTUAL NOT NULL,
  KEY `on_b` (`b`)
) ENGINE=InnoDB DEFAULT CHARSET=utf8mb4 COLLATE=utf8mb4_0900_ai_ci
INSERT IGNORE INTO t (a) VALUES ("{}");
Warnings:
Warning	3156	Invalid JSON value for CAST to INTEGER from column a at row 1
SELECT * FROM t;
a	b
{}	0
Warnings:
Warning	3156	Invalid JSON value for CAST to INTEGER from column a at row 1
DELETE FROM t;
DELETE IGNORE FROM t;
Warnings:
Warning	3156	Invalid JSON value for CAST to INTEGER from column a at row 1
Warning	3156	Invalid JSON value for CAST to INTEGER from column a at row 1
CHECK TABLE t;
Table	Op	Msg_type	Msg_text
test.t	check	status	OK
DROP TABLE t;
# Testing example of type JSON and value '["hello beautiful world"]'
SHOW CREATE TABLE t;
Table	Create Table
t	CREATE TABLE `t` (
  `a` json NOT NULL,
  `b` mediumint GENERATED ALWAYS AS (`a`) VIRTUAL NOT NULL,
  KEY `on_b` (`b`)
) ENGINE=InnoDB DEFAULT CHARSET=utf8mb4 COLLATE=utf8mb4_0900_ai_ci
INSERT IGNORE INTO t (a) VALUES ('["hello beautiful world"]');
Warnings:
Warning	3156	Invalid JSON value for CAST to INTEGER from column a at row 1
SELECT * FROM t;
a	b
["hello beautiful world"]	0
Warnings:
Warning	3156	Invalid JSON value for CAST to INTEGER from column a at row 1
DELETE FROM t;
DELETE IGNORE FROM t;
Warnings:
Warning	3156	Invalid JSON value for CAST to INTEGER from column a at row 1
Warning	3156	Invalid JSON value for CAST to INTEGER from column a at row 1
CHECK TABLE t;
Table	Op	Msg_type	Msg_text
test.t	check	status	OK
DROP TABLE t;
# Testing example of type JSON and value "-1"
SHOW CREATE TABLE t;
Table	Create Table
t	CREATE TABLE `t` (
  `a` json NOT NULL,
  `b` mediumint GENERATED ALWAYS AS (`a`) VIRTUAL NOT NULL,
  KEY `on_b` (`b`)
) ENGINE=InnoDB DEFAULT CHARSET=utf8mb4 COLLATE=utf8mb4_0900_ai_ci
INSERT IGNORE INTO t (a) VALUES ("-1");
SELECT * FROM t;
a	b
-1	-1
DELETE FROM t;
DELETE IGNORE FROM t;
CHECK TABLE t;
Table	Op	Msg_type	Msg_text
test.t	check	status	OK
DROP TABLE t;
# Testing example of type TINYINT and value -1
SHOW CREATE TABLE t;
Table	Create Table
t	CREATE TABLE `t` (
  `a` tinyint NOT NULL,
  `b` mediumint GENERATED ALWAYS AS (`a`) VIRTUAL NOT NULL,
  KEY `on_b` (`b`)
) ENGINE=InnoDB DEFAULT CHARSET=utf8mb4 COLLATE=utf8mb4_0900_ai_ci
INSERT IGNORE INTO t (a) VALUES (-1);
SELECT * FROM t;
a	b
-1	-1
DELETE FROM t;
DELETE IGNORE FROM t;
CHECK TABLE t;
Table	Op	Msg_type	Msg_text
test.t	check	status	OK
DROP TABLE t;
# Testing example of type SMALLINT and value -1
SHOW CREATE TABLE t;
Table	Create Table
t	CREATE TABLE `t` (
  `a` smallint NOT NULL,
  `b` mediumint GENERATED ALWAYS AS (`a`) VIRTUAL NOT NULL,
  KEY `on_b` (`b`)
) ENGINE=InnoDB DEFAULT CHARSET=utf8mb4 COLLATE=utf8mb4_0900_ai_ci
INSERT IGNORE INTO t (a) VALUES (-1);
SELECT * FROM t;
a	b
-1	-1
DELETE FROM t;
DELETE IGNORE FROM t;
CHECK TABLE t;
Table	Op	Msg_type	Msg_text
test.t	check	status	OK
DROP TABLE t;
# Testing example of type MEDIUMINT and value -1
SHOW CREATE TABLE t;
Table	Create Table
t	CREATE TABLE `t` (
  `a` mediumint NOT NULL,
  `b` mediumint GENERATED ALWAYS AS (`a`) VIRTUAL NOT NULL,
  KEY `on_b` (`b`)
) ENGINE=InnoDB DEFAULT CHARSET=utf8mb4 COLLATE=utf8mb4_0900_ai_ci
INSERT IGNORE INTO t (a) VALUES (-1);
SELECT * FROM t;
a	b
-1	-1
DELETE FROM t;
DELETE IGNORE FROM t;
CHECK TABLE t;
Table	Op	Msg_type	Msg_text
test.t	check	status	OK
DROP TABLE t;
# Testing example of type INT and value 2000000000
SHOW CREATE TABLE t;
Table	Create Table
t	CREATE TABLE `t` (
  `a` int NOT NULL,
  `b` mediumint GENERATED ALWAYS AS (`a`) VIRTUAL NOT NULL,
  KEY `on_b` (`b`)
) ENGINE=InnoDB DEFAULT CHARSET=utf8mb4 COLLATE=utf8mb4_0900_ai_ci
INSERT IGNORE INTO t (a) VALUES (2000000000);
Warnings:
Warning	1264	Out of range value for column 'b' at row 1
SELECT * FROM t;
a	b
2000000000	8388607
DELETE FROM t;
DELETE IGNORE FROM t;
CHECK TABLE t;
Table	Op	Msg_type	Msg_text
test.t	check	status	OK
DROP TABLE t;
# Testing example of type INT and value -2000000000
SHOW CREATE TABLE t;
Table	Create Table
t	CREATE TABLE `t` (
  `a` int NOT NULL,
  `b` mediumint GENERATED ALWAYS AS (`a`) VIRTUAL NOT NULL,
  KEY `on_b` (`b`)
) ENGINE=InnoDB DEFAULT CHARSET=utf8mb4 COLLATE=utf8mb4_0900_ai_ci
INSERT IGNORE INTO t (a) VALUES (-2000000000);
Warnings:
Warning	1264	Out of range value for column 'b' at row 1
SELECT * FROM t;
a	b
-2000000000	-8388608
DELETE FROM t;
DELETE IGNORE FROM t;
CHECK TABLE t;
Table	Op	Msg_type	Msg_text
test.t	check	status	OK
DROP TABLE t;
# Testing example of type INT UNSIGNED and value 4000000000
SHOW CREATE TABLE t;
Table	Create Table
t	CREATE TABLE `t` (
  `a` int unsigned NOT NULL,
  `b` mediumint GENERATED ALWAYS AS (`a`) VIRTUAL NOT NULL,
  KEY `on_b` (`b`)
) ENGINE=InnoDB DEFAULT CHARSET=utf8mb4 COLLATE=utf8mb4_0900_ai_ci
INSERT IGNORE INTO t (a) VALUES (4000000000);
Warnings:
Warning	1264	Out of range value for column 'b' at row 1
SELECT * FROM t;
a	b
4000000000	8388607
DELETE FROM t;
DELETE IGNORE FROM t;
CHECK TABLE t;
Table	Op	Msg_type	Msg_text
test.t	check	status	OK
DROP TABLE t;
# Testing example of type BIGINT and value 2000000000000000000
SHOW CREATE TABLE t;
Table	Create Table
t	CREATE TABLE `t` (
  `a` bigint NOT NULL,
  `b` mediumint GENERATED ALWAYS AS (`a`) VIRTUAL NOT NULL,
  KEY `on_b` (`b`)
) ENGINE=InnoDB DEFAULT CHARSET=utf8mb4 COLLATE=utf8mb4_0900_ai_ci
INSERT IGNORE INTO t (a) VALUES (2000000000000000000);
Warnings:
Warning	1264	Out of range value for column 'b' at row 1
SELECT * FROM t;
a	b
2000000000000000000	8388607
DELETE FROM t;
DELETE IGNORE FROM t;
CHECK TABLE t;
Table	Op	Msg_type	Msg_text
test.t	check	status	OK
DROP TABLE t;
# Testing example of type BIGINT and value -2000000000000000000
SHOW CREATE TABLE t;
Table	Create Table
t	CREATE TABLE `t` (
  `a` bigint NOT NULL,
  `b` mediumint GENERATED ALWAYS AS (`a`) VIRTUAL NOT NULL,
  KEY `on_b` (`b`)
) ENGINE=InnoDB DEFAULT CHARSET=utf8mb4 COLLATE=utf8mb4_0900_ai_ci
INSERT IGNORE INTO t (a) VALUES (-2000000000000000000);
Warnings:
Warning	1264	Out of range value for column 'b' at row 1
SELECT * FROM t;
a	b
-2000000000000000000	-8388608
DELETE FROM t;
DELETE IGNORE FROM t;
CHECK TABLE t;
Table	Op	Msg_type	Msg_text
test.t	check	status	OK
DROP TABLE t;
# Testing example of type FLOAT and value -1.23456
SHOW CREATE TABLE t;
Table	Create Table
t	CREATE TABLE `t` (
  `a` float NOT NULL,
  `b` mediumint GENERATED ALWAYS AS (`a`) VIRTUAL NOT NULL,
  KEY `on_b` (`b`)
) ENGINE=InnoDB DEFAULT CHARSET=utf8mb4 COLLATE=utf8mb4_0900_ai_ci
INSERT IGNORE INTO t (a) VALUES (-1.23456);
SELECT * FROM t;
a	b
-1.23456	-1
DELETE FROM t;
DELETE IGNORE FROM t;
CHECK TABLE t;
Table	Op	Msg_type	Msg_text
test.t	check	status	OK
DROP TABLE t;
# Testing example of type FLOAT and value -1e38
SHOW CREATE TABLE t;
Table	Create Table
t	CREATE TABLE `t` (
  `a` float NOT NULL,
  `b` mediumint GENERATED ALWAYS AS (`a`) VIRTUAL NOT NULL,
  KEY `on_b` (`b`)
) ENGINE=InnoDB DEFAULT CHARSET=utf8mb4 COLLATE=utf8mb4_0900_ai_ci
INSERT IGNORE INTO t (a) VALUES (-1e38);
Warnings:
Warning	1264	Out of range value for column 'b' at row 1
SELECT * FROM t;
a	b
-1e38	-8388608
DELETE FROM t;
DELETE IGNORE FROM t;
CHECK TABLE t;
Table	Op	Msg_type	Msg_text
test.t	check	status	OK
DROP TABLE t;
# Testing example of type FLOAT and value 1e38
SHOW CREATE TABLE t;
Table	Create Table
t	CREATE TABLE `t` (
  `a` float NOT NULL,
  `b` mediumint GENERATED ALWAYS AS (`a`) VIRTUAL NOT NULL,
  KEY `on_b` (`b`)
) ENGINE=InnoDB DEFAULT CHARSET=utf8mb4 COLLATE=utf8mb4_0900_ai_ci
INSERT IGNORE INTO t (a) VALUES (1e38);
Warnings:
Warning	1264	Out of range value for column 'b' at row 1
SELECT * FROM t;
a	b
1e38	8388607
DELETE FROM t;
DELETE IGNORE FROM t;
CHECK TABLE t;
Table	Op	Msg_type	Msg_text
test.t	check	status	OK
DROP TABLE t;
# Testing example of type DOUBLE and value -1.23456789012345
SHOW CREATE TABLE t;
Table	Create Table
t	CREATE TABLE `t` (
  `a` double NOT NULL,
  `b` mediumint GENERATED ALWAYS AS (`a`) VIRTUAL NOT NULL,
  KEY `on_b` (`b`)
) ENGINE=InnoDB DEFAULT CHARSET=utf8mb4 COLLATE=utf8mb4_0900_ai_ci
INSERT IGNORE INTO t (a) VALUES (-1.23456789012345);
SELECT * FROM t;
a	b
-1.23456789012345	-1
DELETE FROM t;
DELETE IGNORE FROM t;
CHECK TABLE t;
Table	Op	Msg_type	Msg_text
test.t	check	status	OK
DROP TABLE t;
# Testing example of type DOUBLE and value 1.23456789012345
SHOW CREATE TABLE t;
Table	Create Table
t	CREATE TABLE `t` (
  `a` double NOT NULL,
  `b` mediumint GENERATED ALWAYS AS (`a`) VIRTUAL NOT NULL,
  KEY `on_b` (`b`)
) ENGINE=InnoDB DEFAULT CHARSET=utf8mb4 COLLATE=utf8mb4_0900_ai_ci
INSERT IGNORE INTO t (a) VALUES (1.23456789012345);
SELECT * FROM t;
a	b
1.23456789012345	1
DELETE FROM t;
DELETE IGNORE FROM t;
CHECK TABLE t;
Table	Op	Msg_type	Msg_text
test.t	check	status	OK
DROP TABLE t;
# Testing example of type DOUBLE and value -1e300
SHOW CREATE TABLE t;
Table	Create Table
t	CREATE TABLE `t` (
  `a` double NOT NULL,
  `b` mediumint GENERATED ALWAYS AS (`a`) VIRTUAL NOT NULL,
  KEY `on_b` (`b`)
) ENGINE=InnoDB DEFAULT CHARSET=utf8mb4 COLLATE=utf8mb4_0900_ai_ci
INSERT IGNORE INTO t (a) VALUES (-1e300);
Warnings:
Warning	1264	Out of range value for column 'b' at row 1
SELECT * FROM t;
a	b
-1e300	-8388608
DELETE FROM t;
DELETE IGNORE FROM t;
CHECK TABLE t;
Table	Op	Msg_type	Msg_text
test.t	check	status	OK
DROP TABLE t;
# Testing example of type DOUBLE and value 1e300
SHOW CREATE TABLE t;
Table	Create Table
t	CREATE TABLE `t` (
  `a` double NOT NULL,
  `b` mediumint GENERATED ALWAYS AS (`a`) VIRTUAL NOT NULL,
  KEY `on_b` (`b`)
) ENGINE=InnoDB DEFAULT CHARSET=utf8mb4 COLLATE=utf8mb4_0900_ai_ci
INSERT IGNORE INTO t (a) VALUES (1e300);
Warnings:
Warning	1264	Out of range value for column 'b' at row 1
SELECT * FROM t;
a	b
1e300	8388607
DELETE FROM t;
DELETE IGNORE FROM t;
CHECK TABLE t;
Table	Op	Msg_type	Msg_text
test.t	check	status	OK
DROP TABLE t;
# Testing example of type DECIMAL(4,2) and value -10.99
SHOW CREATE TABLE t;
Table	Create Table
t	CREATE TABLE `t` (
  `a` decimal(4,2) NOT NULL,
  `b` mediumint GENERATED ALWAYS AS (`a`) VIRTUAL NOT NULL,
  KEY `on_b` (`b`)
) ENGINE=InnoDB DEFAULT CHARSET=utf8mb4 COLLATE=utf8mb4_0900_ai_ci
INSERT IGNORE INTO t (a) VALUES (-10.99);
SELECT * FROM t;
a	b
-10.99	-11
DELETE FROM t;
DELETE IGNORE FROM t;
CHECK TABLE t;
Table	Op	Msg_type	Msg_text
test.t	check	status	OK
DROP TABLE t;
# Testing example of type DECIMAL(34,4) and value 20000000000000000000000000000.0001
SHOW CREATE TABLE t;
Table	Create Table
t	CREATE TABLE `t` (
  `a` decimal(34,4) NOT NULL,
  `b` mediumint GENERATED ALWAYS AS (`a`) VIRTUAL NOT NULL,
  KEY `on_b` (`b`)
) ENGINE=InnoDB DEFAULT CHARSET=utf8mb4 COLLATE=utf8mb4_0900_ai_ci
INSERT IGNORE INTO t (a) VALUES (20000000000000000000000000000.0001);
Warnings:
Warning	1264	Out of range value for column 'b' at row 1
Warning	1264	Out of range value for column 'b' at row 1
SELECT * FROM t;
a	b
20000000000000000000000000000.0001	8388607
DELETE FROM t;
DELETE IGNORE FROM t;
CHECK TABLE t;
Table	Op	Msg_type	Msg_text
test.t	check	status	OK
DROP TABLE t;
# Testing example of type DECIMAL(34,4) and value -20000000000000000000000000000.0001
SHOW CREATE TABLE t;
Table	Create Table
t	CREATE TABLE `t` (
  `a` decimal(34,4) NOT NULL,
  `b` mediumint GENERATED ALWAYS AS (`a`) VIRTUAL NOT NULL,
  KEY `on_b` (`b`)
) ENGINE=InnoDB DEFAULT CHARSET=utf8mb4 COLLATE=utf8mb4_0900_ai_ci
INSERT IGNORE INTO t (a) VALUES (-20000000000000000000000000000.0001);
Warnings:
Warning	1264	Out of range value for column 'b' at row 1
Warning	1264	Out of range value for column 'b' at row 1
SELECT * FROM t;
a	b
-20000000000000000000000000000.0001	-8388608
DELETE FROM t;
DELETE IGNORE FROM t;
CHECK TABLE t;
Table	Op	Msg_type	Msg_text
test.t	check	status	OK
DROP TABLE t;
# Testing example of type BIT(64) and value 0xDEADBEEFC0FEBABE
SHOW CREATE TABLE t;
Table	Create Table
t	CREATE TABLE `t` (
  `a` bit(64) NOT NULL,
  `b` mediumint GENERATED ALWAYS AS (`a`) VIRTUAL NOT NULL,
  KEY `on_b` (`b`)
) ENGINE=InnoDB DEFAULT CHARSET=utf8mb4 COLLATE=utf8mb4_0900_ai_ci
INSERT IGNORE INTO t (a) VALUES (0xDEADBEEFC0FEBABE);
Warnings:
Warning	1264	Out of range value for column 'b' at row 1
SELECT * FROM t;
a	b
Þ­¾ïÀþº¾	8388607
DELETE FROM t;
DELETE IGNORE FROM t;
CHECK TABLE t;
Table	Op	Msg_type	Msg_text
test.t	check	status	OK
DROP TABLE t;
# Testing example of type BIT(4) and value 0b1000
SHOW CREATE TABLE t;
Table	Create Table
t	CREATE TABLE `t` (
  `a` bit(4) NOT NULL,
  `b` mediumint GENERATED ALWAYS AS (`a`) VIRTUAL NOT NULL,
  KEY `on_b` (`b`)
) ENGINE=InnoDB DEFAULT CHARSET=utf8mb4 COLLATE=utf8mb4_0900_ai_ci
INSERT IGNORE INTO t (a) VALUES (0b1000);
SELECT * FROM t;
a	b
	8
DELETE FROM t;
DELETE IGNORE FROM t;
CHECK TABLE t;
Table	Op	Msg_type	Msg_text
test.t	check	status	OK
DROP TABLE t;
# Testing example of type YEAR and value 2020
SHOW CREATE TABLE t;
Table	Create Table
t	CREATE TABLE `t` (
  `a` year NOT NULL,
  `b` mediumint GENERATED ALWAYS AS (`a`) VIRTUAL NOT NULL,
  KEY `on_b` (`b`)
) ENGINE=InnoDB DEFAULT CHARSET=utf8mb4 COLLATE=utf8mb4_0900_ai_ci
INSERT IGNORE INTO t (a) VALUES (2020);
SELECT * FROM t;
a	b
2020	2020
DELETE FROM t;
DELETE IGNORE FROM t;
CHECK TABLE t;
Table	Op	Msg_type	Msg_text
test.t	check	status	OK
DROP TABLE t;
# Testing example of type DATE and value "2030-04-05"
SHOW CREATE TABLE t;
Table	Create Table
t	CREATE TABLE `t` (
  `a` date NOT NULL,
  `b` mediumint GENERATED ALWAYS AS (`a`) VIRTUAL NOT NULL,
  KEY `on_b` (`b`)
) ENGINE=InnoDB DEFAULT CHARSET=utf8mb4 COLLATE=utf8mb4_0900_ai_ci
INSERT IGNORE INTO t (a) VALUES ("2030-04-05");
Warnings:
Warning	1264	Out of range value for column 'b' at row 1
SELECT * FROM t;
a	b
2030-04-05	8388607
DELETE FROM t;
DELETE IGNORE FROM t;
CHECK TABLE t;
Table	Op	Msg_type	Msg_text
test.t	check	status	OK
DROP TABLE t;
# Testing example of type TIME and value "11:12:13"
SHOW CREATE TABLE t;
Table	Create Table
t	CREATE TABLE `t` (
  `a` time NOT NULL,
  `b` mediumint GENERATED ALWAYS AS (`a`) VIRTUAL NOT NULL,
  KEY `on_b` (`b`)
) ENGINE=InnoDB DEFAULT CHARSET=utf8mb4 COLLATE=utf8mb4_0900_ai_ci
INSERT IGNORE INTO t (a) VALUES ("11:12:13");
SELECT * FROM t;
a	b
11:12:13	111213
DELETE FROM t;
DELETE IGNORE FROM t;
CHECK TABLE t;
Table	Op	Msg_type	Msg_text
test.t	check	status	OK
DROP TABLE t;
# Testing example of type DATETIME and value "2030-04-05 11:12:13"
SHOW CREATE TABLE t;
Table	Create Table
t	CREATE TABLE `t` (
  `a` datetime NOT NULL,
  `b` mediumint GENERATED ALWAYS AS (`a`) VIRTUAL NOT NULL,
  KEY `on_b` (`b`)
) ENGINE=InnoDB DEFAULT CHARSET=utf8mb4 COLLATE=utf8mb4_0900_ai_ci
INSERT IGNORE INTO t (a) VALUES ("2030-04-05 11:12:13");
Warnings:
Warning	1264	Out of range value for column 'b' at row 1
SELECT * FROM t;
a	b
2030-04-05 11:12:13	8388607
DELETE FROM t;
DELETE IGNORE FROM t;
CHECK TABLE t;
Table	Op	Msg_type	Msg_text
test.t	check	status	OK
DROP TABLE t;
# Testing example of type TIMESTAMP and value "2030-04-05 11:12:13"
SHOW CREATE TABLE t;
Table	Create Table
t	CREATE TABLE `t` (
  `a` timestamp NOT NULL,
  `b` mediumint GENERATED ALWAYS AS (`a`) VIRTUAL NOT NULL,
  KEY `on_b` (`b`)
) ENGINE=InnoDB DEFAULT CHARSET=utf8mb4 COLLATE=utf8mb4_0900_ai_ci
INSERT IGNORE INTO t (a) VALUES ("2030-04-05 11:12:13");
Warnings:
Warning	1264	Out of range value for column 'b' at row 1
SELECT * FROM t;
a	b
2030-04-05 11:12:13	8388607
DELETE FROM t;
DELETE IGNORE FROM t;
CHECK TABLE t;
Table	Op	Msg_type	Msg_text
test.t	check	status	OK
DROP TABLE t;
# Testing example of type CHAR(40) and value "2000000000000000000000000000000000000"
SHOW CREATE TABLE t;
Table	Create Table
t	CREATE TABLE `t` (
  `a` char(40) NOT NULL,
  `b` mediumint GENERATED ALWAYS AS (`a`) VIRTUAL NOT NULL,
  KEY `on_b` (`b`)
) ENGINE=InnoDB DEFAULT CHARSET=utf8mb4 COLLATE=utf8mb4_0900_ai_ci
INSERT IGNORE INTO t (a) VALUES ("2000000000000000000000000000000000000");
Warnings:
Warning	1264	Out of range value for column 'b' at row 1
SELECT * FROM t;
a	b
2000000000000000000000000000000000000	8388607
DELETE FROM t;
DELETE IGNORE FROM t;
CHECK TABLE t;
Table	Op	Msg_type	Msg_text
test.t	check	status	OK
DROP TABLE t;
# Testing example of type BINARY(45) and value "200000000000000000000000000000000000000000"
SHOW CREATE TABLE t;
Table	Create Table
t	CREATE TABLE `t` (
  `a` binary(45) NOT NULL,
  `b` mediumint GENERATED ALWAYS AS (`a`) VIRTUAL NOT NULL,
  KEY `on_b` (`b`)
) ENGINE=InnoDB DEFAULT CHARSET=utf8mb4 COLLATE=utf8mb4_0900_ai_ci
INSERT IGNORE INTO t (a) VALUES ("200000000000000000000000000000000000000000");
Warnings:
Warning	1264	Out of range value for column 'b' at row 1
SELECT * FROM t;
a	b
200000000000000000000000000000000000000000   	8388607
DELETE FROM t;
DELETE IGNORE FROM t;
CHECK TABLE t;
Table	Op	Msg_type	Msg_text
test.t	check	status	OK
DROP TABLE t;
# Testing example of type VARCHAR(50) and value "2000000000000000000000000000000000000000000000000"
SHOW CREATE TABLE t;
Table	Create Table
t	CREATE TABLE `t` (
  `a` varchar(50) NOT NULL,
  `b` mediumint GENERATED ALWAYS AS (`a`) VIRTUAL NOT NULL,
  KEY `on_b` (`b`)
) ENGINE=InnoDB DEFAULT CHARSET=utf8mb4 COLLATE=utf8mb4_0900_ai_ci
INSERT IGNORE INTO t (a) VALUES ("2000000000000000000000000000000000000000000000000");
Warnings:
Warning	1264	Out of range value for column 'b' at row 1
SELECT * FROM t;
a	b
2000000000000000000000000000000000000000000000000	8388607
DELETE FROM t;
DELETE IGNORE FROM t;
CHECK TABLE t;
Table	Op	Msg_type	Msg_text
test.t	check	status	OK
DROP TABLE t;
# Testing example of type CHAR(24) and value "hello beautiful world"
SHOW CREATE TABLE t;
Table	Create Table
t	CREATE TABLE `t` (
  `a` char(24) NOT NULL,
  `b` mediumint GENERATED ALWAYS AS (`a`) VIRTUAL NOT NULL,
  KEY `on_b` (`b`)
) ENGINE=InnoDB DEFAULT CHARSET=utf8mb4 COLLATE=utf8mb4_0900_ai_ci
INSERT IGNORE INTO t (a) VALUES ("hello beautiful world");
Warnings:
Warning	1366	Incorrect integer value: 'hello beautiful world' for column 'b' at row 1
SELECT * FROM t;
a	b
hello beautiful world	0
DELETE FROM t;
DELETE IGNORE FROM t;
CHECK TABLE t;
Table	Op	Msg_type	Msg_text
test.t	check	status	OK
DROP TABLE t;
# Testing example of type BINARY(12) and value "hello world"
SHOW CREATE TABLE t;
Table	Create Table
t	CREATE TABLE `t` (
  `a` binary(12) NOT NULL,
  `b` mediumint GENERATED ALWAYS AS (`a`) VIRTUAL NOT NULL,
  KEY `on_b` (`b`)
) ENGINE=InnoDB DEFAULT CHARSET=utf8mb4 COLLATE=utf8mb4_0900_ai_ci
INSERT IGNORE INTO t (a) VALUES ("hello world");
Warnings:
Warning	1366	Incorrect integer value: 'hello world\x00' for column 'b' at row 1
SELECT * FROM t;
a	b
hello world 	0
DELETE FROM t;
DELETE IGNORE FROM t;
CHECK TABLE t;
Table	Op	Msg_type	Msg_text
test.t	check	status	OK
DROP TABLE t;
# Testing example of type VARCHAR(6) and value "hello"
SHOW CREATE TABLE t;
Table	Create Table
t	CREATE TABLE `t` (
  `a` varchar(6) NOT NULL,
  `b` mediumint GENERATED ALWAYS AS (`a`) VIRTUAL NOT NULL,
  KEY `on_b` (`b`)
) ENGINE=InnoDB DEFAULT CHARSET=utf8mb4 COLLATE=utf8mb4_0900_ai_ci
INSERT IGNORE INTO t (a) VALUES ("hello");
Warnings:
Warning	1366	Incorrect integer value: 'hello' for column 'b' at row 1
SELECT * FROM t;
a	b
hello	0
DELETE FROM t;
DELETE IGNORE FROM t;
CHECK TABLE t;
Table	Op	Msg_type	Msg_text
test.t	check	status	OK
DROP TABLE t;
# Testing example of type ENUM("up","down") and value "up"
SHOW CREATE TABLE t;
Table	Create Table
t	CREATE TABLE `t` (
  `a` enum('up','down') NOT NULL,
  `b` mediumint GENERATED ALWAYS AS (`a`) VIRTUAL NOT NULL,
  KEY `on_b` (`b`)
) ENGINE=InnoDB DEFAULT CHARSET=utf8mb4 COLLATE=utf8mb4_0900_ai_ci
INSERT IGNORE INTO t (a) VALUES ("up");
SELECT * FROM t;
a	b
up	1
DELETE FROM t;
DELETE IGNORE FROM t;
CHECK TABLE t;
Table	Op	Msg_type	Msg_text
test.t	check	status	OK
DROP TABLE t;
# Testing example of type SET("up","down") and value "up,down"
SHOW CREATE TABLE t;
Table	Create Table
t	CREATE TABLE `t` (
  `a` set('up','down') NOT NULL,
  `b` mediumint GENERATED ALWAYS AS (`a`) VIRTUAL NOT NULL,
  KEY `on_b` (`b`)
) ENGINE=InnoDB DEFAULT CHARSET=utf8mb4 COLLATE=utf8mb4_0900_ai_ci
INSERT IGNORE INTO t (a) VALUES ("up,down");
SELECT * FROM t;
a	b
up,down	3
DELETE FROM t;
DELETE IGNORE FROM t;
CHECK TABLE t;
Table	Op	Msg_type	Msg_text
test.t	check	status	OK
DROP TABLE t;
# Testing example of type GEOMETRY and value ST_GeomFromText("POINT(1 1)")
SHOW CREATE TABLE t;
Table	Create Table
t	CREATE TABLE `t` (
  `a` geometry NOT NULL,
  `b` mediumint GENERATED ALWAYS AS (`a`) VIRTUAL NOT NULL,
  KEY `on_b` (`b`)
) ENGINE=InnoDB DEFAULT CHARSET=utf8mb4 COLLATE=utf8mb4_0900_ai_ci
INSERT IGNORE INTO t (a) VALUES (ST_GeomFromText("POINT(1 1)"));
Warnings:
Warning	1366	Incorrect integer value: '\x00\x00\x00\x00\x01\x01\x00\x00\x00\x00\x00\x00\x00\x00\x00\xF0?\x00\x00\x00\x00\x00\x00\xF0?' for column 'b' at row 1
SELECT * FROM t;
a	b
             ð?      ð?	0
DELETE FROM t;
DELETE IGNORE FROM t;
CHECK TABLE t;
Table	Op	Msg_type	Msg_text
test.t	check	status	OK
DROP TABLE t;
# Testing example of type POINT and value ST_GeomFromText("POINT(1 1)")
SHOW CREATE TABLE t;
Table	Create Table
t	CREATE TABLE `t` (
  `a` point NOT NULL,
  `b` mediumint GENERATED ALWAYS AS (`a`) VIRTUAL NOT NULL,
  KEY `on_b` (`b`)
) ENGINE=InnoDB DEFAULT CHARSET=utf8mb4 COLLATE=utf8mb4_0900_ai_ci
INSERT IGNORE INTO t (a) VALUES (ST_GeomFromText("POINT(1 1)"));
Warnings:
Warning	1366	Incorrect integer value: '\x00\x00\x00\x00\x01\x01\x00\x00\x00\x00\x00\x00\x00\x00\x00\xF0?\x00\x00\x00\x00\x00\x00\xF0?' for column 'b' at row 1
SELECT * FROM t;
a	b
             ð?      ð?	0
DELETE FROM t;
DELETE IGNORE FROM t;
CHECK TABLE t;
Table	Op	Msg_type	Msg_text
test.t	check	status	OK
DROP TABLE t;
# Testing example of type LINESTRING and value ST_GeomFromText("LINESTRING(0 0,1 1,2 2)")
SHOW CREATE TABLE t;
Table	Create Table
t	CREATE TABLE `t` (
  `a` linestring NOT NULL,
  `b` mediumint GENERATED ALWAYS AS (`a`) VIRTUAL NOT NULL,
  KEY `on_b` (`b`)
) ENGINE=InnoDB DEFAULT CHARSET=utf8mb4 COLLATE=utf8mb4_0900_ai_ci
INSERT IGNORE INTO t (a) VALUES (ST_GeomFromText("LINESTRING(0 0,1 1,2 2)"));
Warnings:
Warning	1366	Incorrect integer value: '\x00\x00\x00\x00\x01\x02\x00\x00\x00\x03\x00\x00\x00\x00\x00\x00\x00\x00\x00\x00\x00\x00\x00\x00\x00\x00\x00\x00\x00\x00\x00\x00' for column 'b' at row 1
SELECT * FROM t;
a	b
                                ð?      ð?       @       @	0
DELETE FROM t;
DELETE IGNORE FROM t;
CHECK TABLE t;
Table	Op	Msg_type	Msg_text
test.t	check	status	OK
DROP TABLE t;
# Testing example of type POLYGON and value ST_GeomFromText("POLYGON((0 0,1 0,1 1,0 1,0 0),(5 5,7 5,7 7,5 7,5 5))")
SHOW CREATE TABLE t;
Table	Create Table
t	CREATE TABLE `t` (
  `a` polygon NOT NULL,
  `b` mediumint GENERATED ALWAYS AS (`a`) VIRTUAL NOT NULL,
  KEY `on_b` (`b`)
) ENGINE=InnoDB DEFAULT CHARSET=utf8mb4 COLLATE=utf8mb4_0900_ai_ci
INSERT IGNORE INTO t (a) VALUES (ST_GeomFromText("POLYGON((0 0,1 0,1 1,0 1,0 0),(5 5,7 5,7 7,5 7,5 5))"));
Warnings:
Warning	1366	Incorrect integer value: '\x00\x00\x00\x00\x01\x03\x00\x00\x00\x02\x00\x00\x00\x05\x00\x00\x00\x00\x00\x00\x00\x00\x00\x00\x00\x00\x00\x00\x00\x00\x00\x00' for column 'b' at row 1
SELECT * FROM t;
a	b
                                   ð?              ð?      ð?              ð?                         @      @      @      @      @      @      @      @      @      @	0
DELETE FROM t;
DELETE IGNORE FROM t;
CHECK TABLE t;
Table	Op	Msg_type	Msg_text
test.t	check	status	OK
DROP TABLE t;
#
# Testing virtual column of type INT
#
# Testing example of type JSON and value "{}"
SHOW CREATE TABLE t;
Table	Create Table
t	CREATE TABLE `t` (
  `a` json NOT NULL,
  `b` int GENERATED ALWAYS AS (`a`) VIRTUAL NOT NULL,
  KEY `on_b` (`b`)
) ENGINE=InnoDB DEFAULT CHARSET=utf8mb4 COLLATE=utf8mb4_0900_ai_ci
INSERT IGNORE INTO t (a) VALUES ("{}");
Warnings:
Warning	3156	Invalid JSON value for CAST to INTEGER from column a at row 1
SELECT * FROM t;
a	b
{}	0
Warnings:
Warning	3156	Invalid JSON value for CAST to INTEGER from column a at row 1
DELETE FROM t;
DELETE IGNORE FROM t;
Warnings:
Warning	3156	Invalid JSON value for CAST to INTEGER from column a at row 1
Warning	3156	Invalid JSON value for CAST to INTEGER from column a at row 1
CHECK TABLE t;
Table	Op	Msg_type	Msg_text
test.t	check	status	OK
DROP TABLE t;
# Testing example of type JSON and value '["hello beautiful world"]'
SHOW CREATE TABLE t;
Table	Create Table
t	CREATE TABLE `t` (
  `a` json NOT NULL,
  `b` int GENERATED ALWAYS AS (`a`) VIRTUAL NOT NULL,
  KEY `on_b` (`b`)
) ENGINE=InnoDB DEFAULT CHARSET=utf8mb4 COLLATE=utf8mb4_0900_ai_ci
INSERT IGNORE INTO t (a) VALUES ('["hello beautiful world"]');
Warnings:
Warning	3156	Invalid JSON value for CAST to INTEGER from column a at row 1
SELECT * FROM t;
a	b
["hello beautiful world"]	0
Warnings:
Warning	3156	Invalid JSON value for CAST to INTEGER from column a at row 1
DELETE FROM t;
DELETE IGNORE FROM t;
Warnings:
Warning	3156	Invalid JSON value for CAST to INTEGER from column a at row 1
Warning	3156	Invalid JSON value for CAST to INTEGER from column a at row 1
CHECK TABLE t;
Table	Op	Msg_type	Msg_text
test.t	check	status	OK
DROP TABLE t;
# Testing example of type JSON and value "-1"
SHOW CREATE TABLE t;
Table	Create Table
t	CREATE TABLE `t` (
  `a` json NOT NULL,
  `b` int GENERATED ALWAYS AS (`a`) VIRTUAL NOT NULL,
  KEY `on_b` (`b`)
) ENGINE=InnoDB DEFAULT CHARSET=utf8mb4 COLLATE=utf8mb4_0900_ai_ci
INSERT IGNORE INTO t (a) VALUES ("-1");
SELECT * FROM t;
a	b
-1	-1
DELETE FROM t;
DELETE IGNORE FROM t;
CHECK TABLE t;
Table	Op	Msg_type	Msg_text
test.t	check	status	OK
DROP TABLE t;
# Testing example of type TINYINT and value -1
SHOW CREATE TABLE t;
Table	Create Table
t	CREATE TABLE `t` (
  `a` tinyint NOT NULL,
  `b` int GENERATED ALWAYS AS (`a`) VIRTUAL NOT NULL,
  KEY `on_b` (`b`)
) ENGINE=InnoDB DEFAULT CHARSET=utf8mb4 COLLATE=utf8mb4_0900_ai_ci
INSERT IGNORE INTO t (a) VALUES (-1);
SELECT * FROM t;
a	b
-1	-1
DELETE FROM t;
DELETE IGNORE FROM t;
CHECK TABLE t;
Table	Op	Msg_type	Msg_text
test.t	check	status	OK
DROP TABLE t;
# Testing example of type SMALLINT and value -1
SHOW CREATE TABLE t;
Table	Create Table
t	CREATE TABLE `t` (
  `a` smallint NOT NULL,
  `b` int GENERATED ALWAYS AS (`a`) VIRTUAL NOT NULL,
  KEY `on_b` (`b`)
) ENGINE=InnoDB DEFAULT CHARSET=utf8mb4 COLLATE=utf8mb4_0900_ai_ci
INSERT IGNORE INTO t (a) VALUES (-1);
SELECT * FROM t;
a	b
-1	-1
DELETE FROM t;
DELETE IGNORE FROM t;
CHECK TABLE t;
Table	Op	Msg_type	Msg_text
test.t	check	status	OK
DROP TABLE t;
# Testing example of type MEDIUMINT and value -1
SHOW CREATE TABLE t;
Table	Create Table
t	CREATE TABLE `t` (
  `a` mediumint NOT NULL,
  `b` int GENERATED ALWAYS AS (`a`) VIRTUAL NOT NULL,
  KEY `on_b` (`b`)
) ENGINE=InnoDB DEFAULT CHARSET=utf8mb4 COLLATE=utf8mb4_0900_ai_ci
INSERT IGNORE INTO t (a) VALUES (-1);
SELECT * FROM t;
a	b
-1	-1
DELETE FROM t;
DELETE IGNORE FROM t;
CHECK TABLE t;
Table	Op	Msg_type	Msg_text
test.t	check	status	OK
DROP TABLE t;
# Testing example of type INT and value 2000000000
SHOW CREATE TABLE t;
Table	Create Table
t	CREATE TABLE `t` (
  `a` int NOT NULL,
  `b` int GENERATED ALWAYS AS (`a`) VIRTUAL NOT NULL,
  KEY `on_b` (`b`)
) ENGINE=InnoDB DEFAULT CHARSET=utf8mb4 COLLATE=utf8mb4_0900_ai_ci
INSERT IGNORE INTO t (a) VALUES (2000000000);
SELECT * FROM t;
a	b
2000000000	2000000000
DELETE FROM t;
DELETE IGNORE FROM t;
CHECK TABLE t;
Table	Op	Msg_type	Msg_text
test.t	check	status	OK
DROP TABLE t;
# Testing example of type INT and value -2000000000
SHOW CREATE TABLE t;
Table	Create Table
t	CREATE TABLE `t` (
  `a` int NOT NULL,
  `b` int GENERATED ALWAYS AS (`a`) VIRTUAL NOT NULL,
  KEY `on_b` (`b`)
) ENGINE=InnoDB DEFAULT CHARSET=utf8mb4 COLLATE=utf8mb4_0900_ai_ci
INSERT IGNORE INTO t (a) VALUES (-2000000000);
SELECT * FROM t;
a	b
-2000000000	-2000000000
DELETE FROM t;
DELETE IGNORE FROM t;
CHECK TABLE t;
Table	Op	Msg_type	Msg_text
test.t	check	status	OK
DROP TABLE t;
# Testing example of type INT UNSIGNED and value 4000000000
SHOW CREATE TABLE t;
Table	Create Table
t	CREATE TABLE `t` (
  `a` int unsigned NOT NULL,
  `b` int GENERATED ALWAYS AS (`a`) VIRTUAL NOT NULL,
  KEY `on_b` (`b`)
) ENGINE=InnoDB DEFAULT CHARSET=utf8mb4 COLLATE=utf8mb4_0900_ai_ci
INSERT IGNORE INTO t (a) VALUES (4000000000);
Warnings:
Warning	1264	Out of range value for column 'b' at row 1
SELECT * FROM t;
a	b
4000000000	2147483647
DELETE FROM t;
DELETE IGNORE FROM t;
CHECK TABLE t;
Table	Op	Msg_type	Msg_text
test.t	check	status	OK
DROP TABLE t;
# Testing example of type BIGINT and value 2000000000000000000
SHOW CREATE TABLE t;
Table	Create Table
t	CREATE TABLE `t` (
  `a` bigint NOT NULL,
  `b` int GENERATED ALWAYS AS (`a`) VIRTUAL NOT NULL,
  KEY `on_b` (`b`)
) ENGINE=InnoDB DEFAULT CHARSET=utf8mb4 COLLATE=utf8mb4_0900_ai_ci
INSERT IGNORE INTO t (a) VALUES (2000000000000000000);
Warnings:
Warning	1264	Out of range value for column 'b' at row 1
SELECT * FROM t;
a	b
2000000000000000000	2147483647
DELETE FROM t;
DELETE IGNORE FROM t;
CHECK TABLE t;
Table	Op	Msg_type	Msg_text
test.t	check	status	OK
DROP TABLE t;
# Testing example of type BIGINT and value -2000000000000000000
SHOW CREATE TABLE t;
Table	Create Table
t	CREATE TABLE `t` (
  `a` bigint NOT NULL,
  `b` int GENERATED ALWAYS AS (`a`) VIRTUAL NOT NULL,
  KEY `on_b` (`b`)
) ENGINE=InnoDB DEFAULT CHARSET=utf8mb4 COLLATE=utf8mb4_0900_ai_ci
INSERT IGNORE INTO t (a) VALUES (-2000000000000000000);
Warnings:
Warning	1264	Out of range value for column 'b' at row 1
SELECT * FROM t;
a	b
-2000000000000000000	-2147483648
DELETE FROM t;
DELETE IGNORE FROM t;
CHECK TABLE t;
Table	Op	Msg_type	Msg_text
test.t	check	status	OK
DROP TABLE t;
# Testing example of type FLOAT and value -1.23456
SHOW CREATE TABLE t;
Table	Create Table
t	CREATE TABLE `t` (
  `a` float NOT NULL,
  `b` int GENERATED ALWAYS AS (`a`) VIRTUAL NOT NULL,
  KEY `on_b` (`b`)
) ENGINE=InnoDB DEFAULT CHARSET=utf8mb4 COLLATE=utf8mb4_0900_ai_ci
INSERT IGNORE INTO t (a) VALUES (-1.23456);
SELECT * FROM t;
a	b
-1.23456	-1
DELETE FROM t;
DELETE IGNORE FROM t;
CHECK TABLE t;
Table	Op	Msg_type	Msg_text
test.t	check	status	OK
DROP TABLE t;
# Testing example of type FLOAT and value -1e38
SHOW CREATE TABLE t;
Table	Create Table
t	CREATE TABLE `t` (
  `a` float NOT NULL,
  `b` int GENERATED ALWAYS AS (`a`) VIRTUAL NOT NULL,
  KEY `on_b` (`b`)
) ENGINE=InnoDB DEFAULT CHARSET=utf8mb4 COLLATE=utf8mb4_0900_ai_ci
INSERT IGNORE INTO t (a) VALUES (-1e38);
Warnings:
Warning	1264	Out of range value for column 'b' at row 1
SELECT * FROM t;
a	b
-1e38	-2147483648
DELETE FROM t;
DELETE IGNORE FROM t;
CHECK TABLE t;
Table	Op	Msg_type	Msg_text
test.t	check	status	OK
DROP TABLE t;
# Testing example of type FLOAT and value 1e38
SHOW CREATE TABLE t;
Table	Create Table
t	CREATE TABLE `t` (
  `a` float NOT NULL,
  `b` int GENERATED ALWAYS AS (`a`) VIRTUAL NOT NULL,
  KEY `on_b` (`b`)
) ENGINE=InnoDB DEFAULT CHARSET=utf8mb4 COLLATE=utf8mb4_0900_ai_ci
INSERT IGNORE INTO t (a) VALUES (1e38);
Warnings:
Warning	1264	Out of range value for column 'b' at row 1
SELECT * FROM t;
a	b
1e38	2147483647
DELETE FROM t;
DELETE IGNORE FROM t;
CHECK TABLE t;
Table	Op	Msg_type	Msg_text
test.t	check	status	OK
DROP TABLE t;
# Testing example of type DOUBLE and value -1.23456789012345
SHOW CREATE TABLE t;
Table	Create Table
t	CREATE TABLE `t` (
  `a` double NOT NULL,
  `b` int GENERATED ALWAYS AS (`a`) VIRTUAL NOT NULL,
  KEY `on_b` (`b`)
) ENGINE=InnoDB DEFAULT CHARSET=utf8mb4 COLLATE=utf8mb4_0900_ai_ci
INSERT IGNORE INTO t (a) VALUES (-1.23456789012345);
SELECT * FROM t;
a	b
-1.23456789012345	-1
DELETE FROM t;
DELETE IGNORE FROM t;
CHECK TABLE t;
Table	Op	Msg_type	Msg_text
test.t	check	status	OK
DROP TABLE t;
# Testing example of type DOUBLE and value 1.23456789012345
SHOW CREATE TABLE t;
Table	Create Table
t	CREATE TABLE `t` (
  `a` double NOT NULL,
  `b` int GENERATED ALWAYS AS (`a`) VIRTUAL NOT NULL,
  KEY `on_b` (`b`)
) ENGINE=InnoDB DEFAULT CHARSET=utf8mb4 COLLATE=utf8mb4_0900_ai_ci
INSERT IGNORE INTO t (a) VALUES (1.23456789012345);
SELECT * FROM t;
a	b
1.23456789012345	1
DELETE FROM t;
DELETE IGNORE FROM t;
CHECK TABLE t;
Table	Op	Msg_type	Msg_text
test.t	check	status	OK
DROP TABLE t;
# Testing example of type DOUBLE and value -1e300
SHOW CREATE TABLE t;
Table	Create Table
t	CREATE TABLE `t` (
  `a` double NOT NULL,
  `b` int GENERATED ALWAYS AS (`a`) VIRTUAL NOT NULL,
  KEY `on_b` (`b`)
) ENGINE=InnoDB DEFAULT CHARSET=utf8mb4 COLLATE=utf8mb4_0900_ai_ci
INSERT IGNORE INTO t (a) VALUES (-1e300);
Warnings:
Warning	1264	Out of range value for column 'b' at row 1
SELECT * FROM t;
a	b
-1e300	-2147483648
DELETE FROM t;
DELETE IGNORE FROM t;
CHECK TABLE t;
Table	Op	Msg_type	Msg_text
test.t	check	status	OK
DROP TABLE t;
# Testing example of type DOUBLE and value 1e300
SHOW CREATE TABLE t;
Table	Create Table
t	CREATE TABLE `t` (
  `a` double NOT NULL,
  `b` int GENERATED ALWAYS AS (`a`) VIRTUAL NOT NULL,
  KEY `on_b` (`b`)
) ENGINE=InnoDB DEFAULT CHARSET=utf8mb4 COLLATE=utf8mb4_0900_ai_ci
INSERT IGNORE INTO t (a) VALUES (1e300);
Warnings:
Warning	1264	Out of range value for column 'b' at row 1
SELECT * FROM t;
a	b
1e300	2147483647
DELETE FROM t;
DELETE IGNORE FROM t;
CHECK TABLE t;
Table	Op	Msg_type	Msg_text
test.t	check	status	OK
DROP TABLE t;
# Testing example of type DECIMAL(4,2) and value -10.99
SHOW CREATE TABLE t;
Table	Create Table
t	CREATE TABLE `t` (
  `a` decimal(4,2) NOT NULL,
  `b` int GENERATED ALWAYS AS (`a`) VIRTUAL NOT NULL,
  KEY `on_b` (`b`)
) ENGINE=InnoDB DEFAULT CHARSET=utf8mb4 COLLATE=utf8mb4_0900_ai_ci
INSERT IGNORE INTO t (a) VALUES (-10.99);
SELECT * FROM t;
a	b
-10.99	-11
DELETE FROM t;
DELETE IGNORE FROM t;
CHECK TABLE t;
Table	Op	Msg_type	Msg_text
test.t	check	status	OK
DROP TABLE t;
# Testing example of type DECIMAL(34,4) and value 20000000000000000000000000000.0001
SHOW CREATE TABLE t;
Table	Create Table
t	CREATE TABLE `t` (
  `a` decimal(34,4) NOT NULL,
  `b` int GENERATED ALWAYS AS (`a`) VIRTUAL NOT NULL,
  KEY `on_b` (`b`)
) ENGINE=InnoDB DEFAULT CHARSET=utf8mb4 COLLATE=utf8mb4_0900_ai_ci
INSERT IGNORE INTO t (a) VALUES (20000000000000000000000000000.0001);
Warnings:
Warning	1264	Out of range value for column 'b' at row 1
Warning	1264	Out of range value for column 'b' at row 1
SELECT * FROM t;
a	b
20000000000000000000000000000.0001	2147483647
DELETE FROM t;
DELETE IGNORE FROM t;
CHECK TABLE t;
Table	Op	Msg_type	Msg_text
test.t	check	status	OK
DROP TABLE t;
# Testing example of type DECIMAL(34,4) and value -20000000000000000000000000000.0001
SHOW CREATE TABLE t;
Table	Create Table
t	CREATE TABLE `t` (
  `a` decimal(34,4) NOT NULL,
  `b` int GENERATED ALWAYS AS (`a`) VIRTUAL NOT NULL,
  KEY `on_b` (`b`)
) ENGINE=InnoDB DEFAULT CHARSET=utf8mb4 COLLATE=utf8mb4_0900_ai_ci
INSERT IGNORE INTO t (a) VALUES (-20000000000000000000000000000.0001);
Warnings:
Warning	1264	Out of range value for column 'b' at row 1
Warning	1264	Out of range value for column 'b' at row 1
SELECT * FROM t;
a	b
-20000000000000000000000000000.0001	-2147483648
DELETE FROM t;
DELETE IGNORE FROM t;
CHECK TABLE t;
Table	Op	Msg_type	Msg_text
test.t	check	status	OK
DROP TABLE t;
# Testing example of type BIT(64) and value 0xDEADBEEFC0FEBABE
SHOW CREATE TABLE t;
Table	Create Table
t	CREATE TABLE `t` (
  `a` bit(64) NOT NULL,
  `b` int GENERATED ALWAYS AS (`a`) VIRTUAL NOT NULL,
  KEY `on_b` (`b`)
) ENGINE=InnoDB DEFAULT CHARSET=utf8mb4 COLLATE=utf8mb4_0900_ai_ci
INSERT IGNORE INTO t (a) VALUES (0xDEADBEEFC0FEBABE);
Warnings:
Warning	1264	Out of range value for column 'b' at row 1
SELECT * FROM t;
a	b
Þ­¾ïÀþº¾	2147483647
DELETE FROM t;
DELETE IGNORE FROM t;
CHECK TABLE t;
Table	Op	Msg_type	Msg_text
test.t	check	status	OK
DROP TABLE t;
# Testing example of type BIT(4) and value 0b1000
SHOW CREATE TABLE t;
Table	Create Table
t	CREATE TABLE `t` (
  `a` bit(4) NOT NULL,
  `b` int GENERATED ALWAYS AS (`a`) VIRTUAL NOT NULL,
  KEY `on_b` (`b`)
) ENGINE=InnoDB DEFAULT CHARSET=utf8mb4 COLLATE=utf8mb4_0900_ai_ci
INSERT IGNORE INTO t (a) VALUES (0b1000);
SELECT * FROM t;
a	b
	8
DELETE FROM t;
DELETE IGNORE FROM t;
CHECK TABLE t;
Table	Op	Msg_type	Msg_text
test.t	check	status	OK
DROP TABLE t;
# Testing example of type YEAR and value 2020
SHOW CREATE TABLE t;
Table	Create Table
t	CREATE TABLE `t` (
  `a` year NOT NULL,
  `b` int GENERATED ALWAYS AS (`a`) VIRTUAL NOT NULL,
  KEY `on_b` (`b`)
) ENGINE=InnoDB DEFAULT CHARSET=utf8mb4 COLLATE=utf8mb4_0900_ai_ci
INSERT IGNORE INTO t (a) VALUES (2020);
SELECT * FROM t;
a	b
2020	2020
DELETE FROM t;
DELETE IGNORE FROM t;
CHECK TABLE t;
Table	Op	Msg_type	Msg_text
test.t	check	status	OK
DROP TABLE t;
# Testing example of type DATE and value "2030-04-05"
SHOW CREATE TABLE t;
Table	Create Table
t	CREATE TABLE `t` (
  `a` date NOT NULL,
  `b` int GENERATED ALWAYS AS (`a`) VIRTUAL NOT NULL,
  KEY `on_b` (`b`)
) ENGINE=InnoDB DEFAULT CHARSET=utf8mb4 COLLATE=utf8mb4_0900_ai_ci
INSERT IGNORE INTO t (a) VALUES ("2030-04-05");
Warnings:
Warning	1264	Out of range value for column 'b' at row 1
SELECT * FROM t;
a	b
2030-04-05	2147483647
DELETE FROM t;
DELETE IGNORE FROM t;
CHECK TABLE t;
Table	Op	Msg_type	Msg_text
test.t	check	status	OK
DROP TABLE t;
# Testing example of type TIME and value "11:12:13"
SHOW CREATE TABLE t;
Table	Create Table
t	CREATE TABLE `t` (
  `a` time NOT NULL,
  `b` int GENERATED ALWAYS AS (`a`) VIRTUAL NOT NULL,
  KEY `on_b` (`b`)
) ENGINE=InnoDB DEFAULT CHARSET=utf8mb4 COLLATE=utf8mb4_0900_ai_ci
INSERT IGNORE INTO t (a) VALUES ("11:12:13");
SELECT * FROM t;
a	b
11:12:13	111213
DELETE FROM t;
DELETE IGNORE FROM t;
CHECK TABLE t;
Table	Op	Msg_type	Msg_text
test.t	check	status	OK
DROP TABLE t;
# Testing example of type DATETIME and value "2030-04-05 11:12:13"
SHOW CREATE TABLE t;
Table	Create Table
t	CREATE TABLE `t` (
  `a` datetime NOT NULL,
  `b` int GENERATED ALWAYS AS (`a`) VIRTUAL NOT NULL,
  KEY `on_b` (`b`)
) ENGINE=InnoDB DEFAULT CHARSET=utf8mb4 COLLATE=utf8mb4_0900_ai_ci
INSERT IGNORE INTO t (a) VALUES ("2030-04-05 11:12:13");
Warnings:
Warning	1264	Out of range value for column 'b' at row 1
SELECT * FROM t;
a	b
2030-04-05 11:12:13	2147483647
DELETE FROM t;
DELETE IGNORE FROM t;
CHECK TABLE t;
Table	Op	Msg_type	Msg_text
test.t	check	status	OK
DROP TABLE t;
# Testing example of type TIMESTAMP and value "2030-04-05 11:12:13"
SHOW CREATE TABLE t;
Table	Create Table
t	CREATE TABLE `t` (
  `a` timestamp NOT NULL,
  `b` int GENERATED ALWAYS AS (`a`) VIRTUAL NOT NULL,
  KEY `on_b` (`b`)
) ENGINE=InnoDB DEFAULT CHARSET=utf8mb4 COLLATE=utf8mb4_0900_ai_ci
INSERT IGNORE INTO t (a) VALUES ("2030-04-05 11:12:13");
Warnings:
Warning	1264	Out of range value for column 'b' at row 1
SELECT * FROM t;
a	b
2030-04-05 11:12:13	2147483647
DELETE FROM t;
DELETE IGNORE FROM t;
CHECK TABLE t;
Table	Op	Msg_type	Msg_text
test.t	check	status	OK
DROP TABLE t;
# Testing example of type CHAR(40) and value "2000000000000000000000000000000000000"
SHOW CREATE TABLE t;
Table	Create Table
t	CREATE TABLE `t` (
  `a` char(40) NOT NULL,
  `b` int GENERATED ALWAYS AS (`a`) VIRTUAL NOT NULL,
  KEY `on_b` (`b`)
) ENGINE=InnoDB DEFAULT CHARSET=utf8mb4 COLLATE=utf8mb4_0900_ai_ci
INSERT IGNORE INTO t (a) VALUES ("2000000000000000000000000000000000000");
Warnings:
Warning	1264	Out of range value for column 'b' at row 1
SELECT * FROM t;
a	b
2000000000000000000000000000000000000	2147483647
DELETE FROM t;
DELETE IGNORE FROM t;
CHECK TABLE t;
Table	Op	Msg_type	Msg_text
test.t	check	status	OK
DROP TABLE t;
# Testing example of type BINARY(45) and value "200000000000000000000000000000000000000000"
SHOW CREATE TABLE t;
Table	Create Table
t	CREATE TABLE `t` (
  `a` binary(45) NOT NULL,
  `b` int GENERATED ALWAYS AS (`a`) VIRTUAL NOT NULL,
  KEY `on_b` (`b`)
) ENGINE=InnoDB DEFAULT CHARSET=utf8mb4 COLLATE=utf8mb4_0900_ai_ci
INSERT IGNORE INTO t (a) VALUES ("200000000000000000000000000000000000000000");
Warnings:
Warning	1264	Out of range value for column 'b' at row 1
SELECT * FROM t;
a	b
200000000000000000000000000000000000000000   	2147483647
DELETE FROM t;
DELETE IGNORE FROM t;
CHECK TABLE t;
Table	Op	Msg_type	Msg_text
test.t	check	status	OK
DROP TABLE t;
# Testing example of type VARCHAR(50) and value "2000000000000000000000000000000000000000000000000"
SHOW CREATE TABLE t;
Table	Create Table
t	CREATE TABLE `t` (
  `a` varchar(50) NOT NULL,
  `b` int GENERATED ALWAYS AS (`a`) VIRTUAL NOT NULL,
  KEY `on_b` (`b`)
) ENGINE=InnoDB DEFAULT CHARSET=utf8mb4 COLLATE=utf8mb4_0900_ai_ci
INSERT IGNORE INTO t (a) VALUES ("2000000000000000000000000000000000000000000000000");
Warnings:
Warning	1264	Out of range value for column 'b' at row 1
SELECT * FROM t;
a	b
2000000000000000000000000000000000000000000000000	2147483647
DELETE FROM t;
DELETE IGNORE FROM t;
CHECK TABLE t;
Table	Op	Msg_type	Msg_text
test.t	check	status	OK
DROP TABLE t;
# Testing example of type CHAR(24) and value "hello beautiful world"
SHOW CREATE TABLE t;
Table	Create Table
t	CREATE TABLE `t` (
  `a` char(24) NOT NULL,
  `b` int GENERATED ALWAYS AS (`a`) VIRTUAL NOT NULL,
  KEY `on_b` (`b`)
) ENGINE=InnoDB DEFAULT CHARSET=utf8mb4 COLLATE=utf8mb4_0900_ai_ci
INSERT IGNORE INTO t (a) VALUES ("hello beautiful world");
Warnings:
Warning	1366	Incorrect integer value: 'hello beautiful world' for column 'b' at row 1
SELECT * FROM t;
a	b
hello beautiful world	0
DELETE FROM t;
DELETE IGNORE FROM t;
CHECK TABLE t;
Table	Op	Msg_type	Msg_text
test.t	check	status	OK
DROP TABLE t;
# Testing example of type BINARY(12) and value "hello world"
SHOW CREATE TABLE t;
Table	Create Table
t	CREATE TABLE `t` (
  `a` binary(12) NOT NULL,
  `b` int GENERATED ALWAYS AS (`a`) VIRTUAL NOT NULL,
  KEY `on_b` (`b`)
) ENGINE=InnoDB DEFAULT CHARSET=utf8mb4 COLLATE=utf8mb4_0900_ai_ci
INSERT IGNORE INTO t (a) VALUES ("hello world");
Warnings:
Warning	1366	Incorrect integer value: 'hello world\x00' for column 'b' at row 1
SELECT * FROM t;
a	b
hello world 	0
DELETE FROM t;
DELETE IGNORE FROM t;
CHECK TABLE t;
Table	Op	Msg_type	Msg_text
test.t	check	status	OK
DROP TABLE t;
# Testing example of type VARCHAR(6) and value "hello"
SHOW CREATE TABLE t;
Table	Create Table
t	CREATE TABLE `t` (
  `a` varchar(6) NOT NULL,
  `b` int GENERATED ALWAYS AS (`a`) VIRTUAL NOT NULL,
  KEY `on_b` (`b`)
) ENGINE=InnoDB DEFAULT CHARSET=utf8mb4 COLLATE=utf8mb4_0900_ai_ci
INSERT IGNORE INTO t (a) VALUES ("hello");
Warnings:
Warning	1366	Incorrect integer value: 'hello' for column 'b' at row 1
SELECT * FROM t;
a	b
hello	0
DELETE FROM t;
DELETE IGNORE FROM t;
CHECK TABLE t;
Table	Op	Msg_type	Msg_text
test.t	check	status	OK
DROP TABLE t;
# Testing example of type ENUM("up","down") and value "up"
SHOW CREATE TABLE t;
Table	Create Table
t	CREATE TABLE `t` (
  `a` enum('up','down') NOT NULL,
  `b` int GENERATED ALWAYS AS (`a`) VIRTUAL NOT NULL,
  KEY `on_b` (`b`)
) ENGINE=InnoDB DEFAULT CHARSET=utf8mb4 COLLATE=utf8mb4_0900_ai_ci
INSERT IGNORE INTO t (a) VALUES ("up");
SELECT * FROM t;
a	b
up	1
DELETE FROM t;
DELETE IGNORE FROM t;
CHECK TABLE t;
Table	Op	Msg_type	Msg_text
test.t	check	status	OK
DROP TABLE t;
# Testing example of type SET("up","down") and value "up,down"
SHOW CREATE TABLE t;
Table	Create Table
t	CREATE TABLE `t` (
  `a` set('up','down') NOT NULL,
  `b` int GENERATED ALWAYS AS (`a`) VIRTUAL NOT NULL,
  KEY `on_b` (`b`)
) ENGINE=InnoDB DEFAULT CHARSET=utf8mb4 COLLATE=utf8mb4_0900_ai_ci
INSERT IGNORE INTO t (a) VALUES ("up,down");
SELECT * FROM t;
a	b
up,down	3
DELETE FROM t;
DELETE IGNORE FROM t;
CHECK TABLE t;
Table	Op	Msg_type	Msg_text
test.t	check	status	OK
DROP TABLE t;
# Testing example of type GEOMETRY and value ST_GeomFromText("POINT(1 1)")
SHOW CREATE TABLE t;
Table	Create Table
t	CREATE TABLE `t` (
  `a` geometry NOT NULL,
  `b` int GENERATED ALWAYS AS (`a`) VIRTUAL NOT NULL,
  KEY `on_b` (`b`)
) ENGINE=InnoDB DEFAULT CHARSET=utf8mb4 COLLATE=utf8mb4_0900_ai_ci
INSERT IGNORE INTO t (a) VALUES (ST_GeomFromText("POINT(1 1)"));
Warnings:
Warning	1366	Incorrect integer value: '\x00\x00\x00\x00\x01\x01\x00\x00\x00\x00\x00\x00\x00\x00\x00\xF0?\x00\x00\x00\x00\x00\x00\xF0?' for column 'b' at row 1
SELECT * FROM t;
a	b
             ð?      ð?	0
DELETE FROM t;
DELETE IGNORE FROM t;
CHECK TABLE t;
Table	Op	Msg_type	Msg_text
test.t	check	status	OK
DROP TABLE t;
# Testing example of type POINT and value ST_GeomFromText("POINT(1 1)")
SHOW CREATE TABLE t;
Table	Create Table
t	CREATE TABLE `t` (
  `a` point NOT NULL,
  `b` int GENERATED ALWAYS AS (`a`) VIRTUAL NOT NULL,
  KEY `on_b` (`b`)
) ENGINE=InnoDB DEFAULT CHARSET=utf8mb4 COLLATE=utf8mb4_0900_ai_ci
INSERT IGNORE INTO t (a) VALUES (ST_GeomFromText("POINT(1 1)"));
Warnings:
Warning	1366	Incorrect integer value: '\x00\x00\x00\x00\x01\x01\x00\x00\x00\x00\x00\x00\x00\x00\x00\xF0?\x00\x00\x00\x00\x00\x00\xF0?' for column 'b' at row 1
SELECT * FROM t;
a	b
             ð?      ð?	0
DELETE FROM t;
DELETE IGNORE FROM t;
CHECK TABLE t;
Table	Op	Msg_type	Msg_text
test.t	check	status	OK
DROP TABLE t;
# Testing example of type LINESTRING and value ST_GeomFromText("LINESTRING(0 0,1 1,2 2)")
SHOW CREATE TABLE t;
Table	Create Table
t	CREATE TABLE `t` (
  `a` linestring NOT NULL,
  `b` int GENERATED ALWAYS AS (`a`) VIRTUAL NOT NULL,
  KEY `on_b` (`b`)
) ENGINE=InnoDB DEFAULT CHARSET=utf8mb4 COLLATE=utf8mb4_0900_ai_ci
INSERT IGNORE INTO t (a) VALUES (ST_GeomFromText("LINESTRING(0 0,1 1,2 2)"));
Warnings:
Warning	1366	Incorrect integer value: '\x00\x00\x00\x00\x01\x02\x00\x00\x00\x03\x00\x00\x00\x00\x00\x00\x00\x00\x00\x00\x00\x00\x00\x00\x00\x00\x00\x00\x00\x00\x00\x00' for column 'b' at row 1
SELECT * FROM t;
a	b
                                ð?      ð?       @       @	0
DELETE FROM t;
DELETE IGNORE FROM t;
CHECK TABLE t;
Table	Op	Msg_type	Msg_text
test.t	check	status	OK
DROP TABLE t;
# Testing example of type POLYGON and value ST_GeomFromText("POLYGON((0 0,1 0,1 1,0 1,0 0),(5 5,7 5,7 7,5 7,5 5))")
SHOW CREATE TABLE t;
Table	Create Table
t	CREATE TABLE `t` (
  `a` polygon NOT NULL,
  `b` int GENERATED ALWAYS AS (`a`) VIRTUAL NOT NULL,
  KEY `on_b` (`b`)
) ENGINE=InnoDB DEFAULT CHARSET=utf8mb4 COLLATE=utf8mb4_0900_ai_ci
INSERT IGNORE INTO t (a) VALUES (ST_GeomFromText("POLYGON((0 0,1 0,1 1,0 1,0 0),(5 5,7 5,7 7,5 7,5 5))"));
Warnings:
Warning	1366	Incorrect integer value: '\x00\x00\x00\x00\x01\x03\x00\x00\x00\x02\x00\x00\x00\x05\x00\x00\x00\x00\x00\x00\x00\x00\x00\x00\x00\x00\x00\x00\x00\x00\x00\x00' for column 'b' at row 1
SELECT * FROM t;
a	b
                                   ð?              ð?      ð?              ð?                         @      @      @      @      @      @      @      @      @      @	0
DELETE FROM t;
DELETE IGNORE FROM t;
CHECK TABLE t;
Table	Op	Msg_type	Msg_text
test.t	check	status	OK
DROP TABLE t;
#
# Testing virtual column of type INT UNSIGNED
#
# Testing example of type JSON and value "{}"
SHOW CREATE TABLE t;
Table	Create Table
t	CREATE TABLE `t` (
  `a` json NOT NULL,
  `b` int unsigned GENERATED ALWAYS AS (`a`) VIRTUAL NOT NULL,
  KEY `on_b` (`b`)
) ENGINE=InnoDB DEFAULT CHARSET=utf8mb4 COLLATE=utf8mb4_0900_ai_ci
INSERT IGNORE INTO t (a) VALUES ("{}");
Warnings:
Warning	3156	Invalid JSON value for CAST to INTEGER from column a at row 1
SELECT * FROM t;
a	b
{}	0
Warnings:
Warning	3156	Invalid JSON value for CAST to INTEGER from column a at row 1
DELETE FROM t;
DELETE IGNORE FROM t;
Warnings:
Warning	3156	Invalid JSON value for CAST to INTEGER from column a at row 1
Warning	3156	Invalid JSON value for CAST to INTEGER from column a at row 1
CHECK TABLE t;
Table	Op	Msg_type	Msg_text
test.t	check	status	OK
DROP TABLE t;
# Testing example of type JSON and value '["hello beautiful world"]'
SHOW CREATE TABLE t;
Table	Create Table
t	CREATE TABLE `t` (
  `a` json NOT NULL,
  `b` int unsigned GENERATED ALWAYS AS (`a`) VIRTUAL NOT NULL,
  KEY `on_b` (`b`)
) ENGINE=InnoDB DEFAULT CHARSET=utf8mb4 COLLATE=utf8mb4_0900_ai_ci
INSERT IGNORE INTO t (a) VALUES ('["hello beautiful world"]');
Warnings:
Warning	3156	Invalid JSON value for CAST to INTEGER from column a at row 1
SELECT * FROM t;
a	b
["hello beautiful world"]	0
Warnings:
Warning	3156	Invalid JSON value for CAST to INTEGER from column a at row 1
DELETE FROM t;
DELETE IGNORE FROM t;
Warnings:
Warning	3156	Invalid JSON value for CAST to INTEGER from column a at row 1
Warning	3156	Invalid JSON value for CAST to INTEGER from column a at row 1
CHECK TABLE t;
Table	Op	Msg_type	Msg_text
test.t	check	status	OK
DROP TABLE t;
# Testing example of type JSON and value "-1"
SHOW CREATE TABLE t;
Table	Create Table
t	CREATE TABLE `t` (
  `a` json NOT NULL,
  `b` int unsigned GENERATED ALWAYS AS (`a`) VIRTUAL NOT NULL,
  KEY `on_b` (`b`)
) ENGINE=InnoDB DEFAULT CHARSET=utf8mb4 COLLATE=utf8mb4_0900_ai_ci
INSERT IGNORE INTO t (a) VALUES ("-1");
Warnings:
Warning	1264	Out of range value for column 'b' at row 1
SELECT * FROM t;
a	b
-1	0
DELETE FROM t;
DELETE IGNORE FROM t;
CHECK TABLE t;
Table	Op	Msg_type	Msg_text
test.t	check	status	OK
DROP TABLE t;
# Testing example of type TINYINT and value -1
SHOW CREATE TABLE t;
Table	Create Table
t	CREATE TABLE `t` (
  `a` tinyint NOT NULL,
  `b` int unsigned GENERATED ALWAYS AS (`a`) VIRTUAL NOT NULL,
  KEY `on_b` (`b`)
) ENGINE=InnoDB DEFAULT CHARSET=utf8mb4 COLLATE=utf8mb4_0900_ai_ci
INSERT IGNORE INTO t (a) VALUES (-1);
Warnings:
Warning	1264	Out of range value for column 'b' at row 1
SELECT * FROM t;
a	b
-1	0
DELETE FROM t;
DELETE IGNORE FROM t;
CHECK TABLE t;
Table	Op	Msg_type	Msg_text
test.t	check	status	OK
DROP TABLE t;
# Testing example of type SMALLINT and value -1
SHOW CREATE TABLE t;
Table	Create Table
t	CREATE TABLE `t` (
  `a` smallint NOT NULL,
  `b` int unsigned GENERATED ALWAYS AS (`a`) VIRTUAL NOT NULL,
  KEY `on_b` (`b`)
) ENGINE=InnoDB DEFAULT CHARSET=utf8mb4 COLLATE=utf8mb4_0900_ai_ci
INSERT IGNORE INTO t (a) VALUES (-1);
Warnings:
Warning	1264	Out of range value for column 'b' at row 1
SELECT * FROM t;
a	b
-1	0
DELETE FROM t;
DELETE IGNORE FROM t;
CHECK TABLE t;
Table	Op	Msg_type	Msg_text
test.t	check	status	OK
DROP TABLE t;
# Testing example of type MEDIUMINT and value -1
SHOW CREATE TABLE t;
Table	Create Table
t	CREATE TABLE `t` (
  `a` mediumint NOT NULL,
  `b` int unsigned GENERATED ALWAYS AS (`a`) VIRTUAL NOT NULL,
  KEY `on_b` (`b`)
) ENGINE=InnoDB DEFAULT CHARSET=utf8mb4 COLLATE=utf8mb4_0900_ai_ci
INSERT IGNORE INTO t (a) VALUES (-1);
Warnings:
Warning	1264	Out of range value for column 'b' at row 1
SELECT * FROM t;
a	b
-1	0
DELETE FROM t;
DELETE IGNORE FROM t;
CHECK TABLE t;
Table	Op	Msg_type	Msg_text
test.t	check	status	OK
DROP TABLE t;
# Testing example of type INT and value 2000000000
SHOW CREATE TABLE t;
Table	Create Table
t	CREATE TABLE `t` (
  `a` int NOT NULL,
  `b` int unsigned GENERATED ALWAYS AS (`a`) VIRTUAL NOT NULL,
  KEY `on_b` (`b`)
) ENGINE=InnoDB DEFAULT CHARSET=utf8mb4 COLLATE=utf8mb4_0900_ai_ci
INSERT IGNORE INTO t (a) VALUES (2000000000);
SELECT * FROM t;
a	b
2000000000	2000000000
DELETE FROM t;
DELETE IGNORE FROM t;
CHECK TABLE t;
Table	Op	Msg_type	Msg_text
test.t	check	status	OK
DROP TABLE t;
# Testing example of type INT and value -2000000000
SHOW CREATE TABLE t;
Table	Create Table
t	CREATE TABLE `t` (
  `a` int NOT NULL,
  `b` int unsigned GENERATED ALWAYS AS (`a`) VIRTUAL NOT NULL,
  KEY `on_b` (`b`)
) ENGINE=InnoDB DEFAULT CHARSET=utf8mb4 COLLATE=utf8mb4_0900_ai_ci
INSERT IGNORE INTO t (a) VALUES (-2000000000);
Warnings:
Warning	1264	Out of range value for column 'b' at row 1
SELECT * FROM t;
a	b
-2000000000	0
DELETE FROM t;
DELETE IGNORE FROM t;
CHECK TABLE t;
Table	Op	Msg_type	Msg_text
test.t	check	status	OK
DROP TABLE t;
# Testing example of type INT UNSIGNED and value 4000000000
SHOW CREATE TABLE t;
Table	Create Table
t	CREATE TABLE `t` (
  `a` int unsigned NOT NULL,
  `b` int unsigned GENERATED ALWAYS AS (`a`) VIRTUAL NOT NULL,
  KEY `on_b` (`b`)
) ENGINE=InnoDB DEFAULT CHARSET=utf8mb4 COLLATE=utf8mb4_0900_ai_ci
INSERT IGNORE INTO t (a) VALUES (4000000000);
SELECT * FROM t;
a	b
4000000000	4000000000
DELETE FROM t;
DELETE IGNORE FROM t;
CHECK TABLE t;
Table	Op	Msg_type	Msg_text
test.t	check	status	OK
DROP TABLE t;
# Testing example of type BIGINT and value 2000000000000000000
SHOW CREATE TABLE t;
Table	Create Table
t	CREATE TABLE `t` (
  `a` bigint NOT NULL,
  `b` int unsigned GENERATED ALWAYS AS (`a`) VIRTUAL NOT NULL,
  KEY `on_b` (`b`)
) ENGINE=InnoDB DEFAULT CHARSET=utf8mb4 COLLATE=utf8mb4_0900_ai_ci
INSERT IGNORE INTO t (a) VALUES (2000000000000000000);
Warnings:
Warning	1264	Out of range value for column 'b' at row 1
SELECT * FROM t;
a	b
2000000000000000000	4294967295
DELETE FROM t;
DELETE IGNORE FROM t;
CHECK TABLE t;
Table	Op	Msg_type	Msg_text
test.t	check	status	OK
DROP TABLE t;
# Testing example of type BIGINT and value -2000000000000000000
SHOW CREATE TABLE t;
Table	Create Table
t	CREATE TABLE `t` (
  `a` bigint NOT NULL,
  `b` int unsigned GENERATED ALWAYS AS (`a`) VIRTUAL NOT NULL,
  KEY `on_b` (`b`)
) ENGINE=InnoDB DEFAULT CHARSET=utf8mb4 COLLATE=utf8mb4_0900_ai_ci
INSERT IGNORE INTO t (a) VALUES (-2000000000000000000);
Warnings:
Warning	1264	Out of range value for column 'b' at row 1
SELECT * FROM t;
a	b
-2000000000000000000	0
DELETE FROM t;
DELETE IGNORE FROM t;
CHECK TABLE t;
Table	Op	Msg_type	Msg_text
test.t	check	status	OK
DROP TABLE t;
# Testing example of type FLOAT and value -1.23456
SHOW CREATE TABLE t;
Table	Create Table
t	CREATE TABLE `t` (
  `a` float NOT NULL,
  `b` int unsigned GENERATED ALWAYS AS (`a`) VIRTUAL NOT NULL,
  KEY `on_b` (`b`)
) ENGINE=InnoDB DEFAULT CHARSET=utf8mb4 COLLATE=utf8mb4_0900_ai_ci
INSERT IGNORE INTO t (a) VALUES (-1.23456);
Warnings:
Warning	1264	Out of range value for column 'b' at row 1
SELECT * FROM t;
a	b
-1.23456	0
DELETE FROM t;
DELETE IGNORE FROM t;
CHECK TABLE t;
Table	Op	Msg_type	Msg_text
test.t	check	status	OK
DROP TABLE t;
# Testing example of type FLOAT and value -1e38
SHOW CREATE TABLE t;
Table	Create Table
t	CREATE TABLE `t` (
  `a` float NOT NULL,
  `b` int unsigned GENERATED ALWAYS AS (`a`) VIRTUAL NOT NULL,
  KEY `on_b` (`b`)
) ENGINE=InnoDB DEFAULT CHARSET=utf8mb4 COLLATE=utf8mb4_0900_ai_ci
INSERT IGNORE INTO t (a) VALUES (-1e38);
Warnings:
Warning	1264	Out of range value for column 'b' at row 1
SELECT * FROM t;
a	b
-1e38	0
DELETE FROM t;
DELETE IGNORE FROM t;
CHECK TABLE t;
Table	Op	Msg_type	Msg_text
test.t	check	status	OK
DROP TABLE t;
# Testing example of type FLOAT and value 1e38
SHOW CREATE TABLE t;
Table	Create Table
t	CREATE TABLE `t` (
  `a` float NOT NULL,
  `b` int unsigned GENERATED ALWAYS AS (`a`) VIRTUAL NOT NULL,
  KEY `on_b` (`b`)
) ENGINE=InnoDB DEFAULT CHARSET=utf8mb4 COLLATE=utf8mb4_0900_ai_ci
INSERT IGNORE INTO t (a) VALUES (1e38);
Warnings:
Warning	1264	Out of range value for column 'b' at row 1
Warning	1264	Out of range value for column 'b' at row 1
SELECT * FROM t;
a	b
1e38	4294967295
DELETE FROM t;
DELETE IGNORE FROM t;
CHECK TABLE t;
Table	Op	Msg_type	Msg_text
test.t	check	status	OK
DROP TABLE t;
# Testing example of type DOUBLE and value -1.23456789012345
SHOW CREATE TABLE t;
Table	Create Table
t	CREATE TABLE `t` (
  `a` double NOT NULL,
  `b` int unsigned GENERATED ALWAYS AS (`a`) VIRTUAL NOT NULL,
  KEY `on_b` (`b`)
) ENGINE=InnoDB DEFAULT CHARSET=utf8mb4 COLLATE=utf8mb4_0900_ai_ci
INSERT IGNORE INTO t (a) VALUES (-1.23456789012345);
Warnings:
Warning	1264	Out of range value for column 'b' at row 1
SELECT * FROM t;
a	b
-1.23456789012345	0
DELETE FROM t;
DELETE IGNORE FROM t;
CHECK TABLE t;
Table	Op	Msg_type	Msg_text
test.t	check	status	OK
DROP TABLE t;
# Testing example of type DOUBLE and value 1.23456789012345
SHOW CREATE TABLE t;
Table	Create Table
t	CREATE TABLE `t` (
  `a` double NOT NULL,
  `b` int unsigned GENERATED ALWAYS AS (`a`) VIRTUAL NOT NULL,
  KEY `on_b` (`b`)
) ENGINE=InnoDB DEFAULT CHARSET=utf8mb4 COLLATE=utf8mb4_0900_ai_ci
INSERT IGNORE INTO t (a) VALUES (1.23456789012345);
SELECT * FROM t;
a	b
1.23456789012345	1
DELETE FROM t;
DELETE IGNORE FROM t;
CHECK TABLE t;
Table	Op	Msg_type	Msg_text
test.t	check	status	OK
DROP TABLE t;
# Testing example of type DOUBLE and value -1e300
SHOW CREATE TABLE t;
Table	Create Table
t	CREATE TABLE `t` (
  `a` double NOT NULL,
  `b` int unsigned GENERATED ALWAYS AS (`a`) VIRTUAL NOT NULL,
  KEY `on_b` (`b`)
) ENGINE=InnoDB DEFAULT CHARSET=utf8mb4 COLLATE=utf8mb4_0900_ai_ci
INSERT IGNORE INTO t (a) VALUES (-1e300);
Warnings:
Warning	1264	Out of range value for column 'b' at row 1
SELECT * FROM t;
a	b
-1e300	0
DELETE FROM t;
DELETE IGNORE FROM t;
CHECK TABLE t;
Table	Op	Msg_type	Msg_text
test.t	check	status	OK
DROP TABLE t;
# Testing example of type DOUBLE and value 1e300
SHOW CREATE TABLE t;
Table	Create Table
t	CREATE TABLE `t` (
  `a` double NOT NULL,
  `b` int unsigned GENERATED ALWAYS AS (`a`) VIRTUAL NOT NULL,
  KEY `on_b` (`b`)
) ENGINE=InnoDB DEFAULT CHARSET=utf8mb4 COLLATE=utf8mb4_0900_ai_ci
INSERT IGNORE INTO t (a) VALUES (1e300);
Warnings:
Warning	1264	Out of range value for column 'b' at row 1
Warning	1264	Out of range value for column 'b' at row 1
SELECT * FROM t;
a	b
1e300	4294967295
DELETE FROM t;
DELETE IGNORE FROM t;
CHECK TABLE t;
Table	Op	Msg_type	Msg_text
test.t	check	status	OK
DROP TABLE t;
# Testing example of type DECIMAL(4,2) and value -10.99
SHOW CREATE TABLE t;
Table	Create Table
t	CREATE TABLE `t` (
  `a` decimal(4,2) NOT NULL,
  `b` int unsigned GENERATED ALWAYS AS (`a`) VIRTUAL NOT NULL,
  KEY `on_b` (`b`)
) ENGINE=InnoDB DEFAULT CHARSET=utf8mb4 COLLATE=utf8mb4_0900_ai_ci
INSERT IGNORE INTO t (a) VALUES (-10.99);
Warnings:
Warning	1264	Out of range value for column 'b' at row 1
SELECT * FROM t;
a	b
-10.99	0
DELETE FROM t;
DELETE IGNORE FROM t;
CHECK TABLE t;
Table	Op	Msg_type	Msg_text
test.t	check	status	OK
DROP TABLE t;
# Testing example of type DECIMAL(34,4) and value 20000000000000000000000000000.0001
SHOW CREATE TABLE t;
Table	Create Table
t	CREATE TABLE `t` (
  `a` decimal(34,4) NOT NULL,
  `b` int unsigned GENERATED ALWAYS AS (`a`) VIRTUAL NOT NULL,
  KEY `on_b` (`b`)
) ENGINE=InnoDB DEFAULT CHARSET=utf8mb4 COLLATE=utf8mb4_0900_ai_ci
INSERT IGNORE INTO t (a) VALUES (20000000000000000000000000000.0001);
Warnings:
Warning	1264	Out of range value for column 'b' at row 1
Warning	1264	Out of range value for column 'b' at row 1
SELECT * FROM t;
a	b
20000000000000000000000000000.0001	4294967295
DELETE FROM t;
DELETE IGNORE FROM t;
CHECK TABLE t;
Table	Op	Msg_type	Msg_text
test.t	check	status	OK
DROP TABLE t;
# Testing example of type DECIMAL(34,4) and value -20000000000000000000000000000.0001
SHOW CREATE TABLE t;
Table	Create Table
t	CREATE TABLE `t` (
  `a` decimal(34,4) NOT NULL,
  `b` int unsigned GENERATED ALWAYS AS (`a`) VIRTUAL NOT NULL,
  KEY `on_b` (`b`)
) ENGINE=InnoDB DEFAULT CHARSET=utf8mb4 COLLATE=utf8mb4_0900_ai_ci
INSERT IGNORE INTO t (a) VALUES (-20000000000000000000000000000.0001);
Warnings:
Warning	1264	Out of range value for column 'b' at row 1
SELECT * FROM t;
a	b
-20000000000000000000000000000.0001	0
DELETE FROM t;
DELETE IGNORE FROM t;
CHECK TABLE t;
Table	Op	Msg_type	Msg_text
test.t	check	status	OK
DROP TABLE t;
# Testing example of type BIT(64) and value 0xDEADBEEFC0FEBABE
SHOW CREATE TABLE t;
Table	Create Table
t	CREATE TABLE `t` (
  `a` bit(64) NOT NULL,
  `b` int unsigned GENERATED ALWAYS AS (`a`) VIRTUAL NOT NULL,
  KEY `on_b` (`b`)
) ENGINE=InnoDB DEFAULT CHARSET=utf8mb4 COLLATE=utf8mb4_0900_ai_ci
INSERT IGNORE INTO t (a) VALUES (0xDEADBEEFC0FEBABE);
Warnings:
Warning	1264	Out of range value for column 'b' at row 1
SELECT * FROM t;
a	b
Þ­¾ïÀþº¾	4294967295
DELETE FROM t;
DELETE IGNORE FROM t;
CHECK TABLE t;
Table	Op	Msg_type	Msg_text
test.t	check	status	OK
DROP TABLE t;
# Testing example of type BIT(4) and value 0b1000
SHOW CREATE TABLE t;
Table	Create Table
t	CREATE TABLE `t` (
  `a` bit(4) NOT NULL,
  `b` int unsigned GENERATED ALWAYS AS (`a`) VIRTUAL NOT NULL,
  KEY `on_b` (`b`)
) ENGINE=InnoDB DEFAULT CHARSET=utf8mb4 COLLATE=utf8mb4_0900_ai_ci
INSERT IGNORE INTO t (a) VALUES (0b1000);
SELECT * FROM t;
a	b
	8
DELETE FROM t;
DELETE IGNORE FROM t;
CHECK TABLE t;
Table	Op	Msg_type	Msg_text
test.t	check	status	OK
DROP TABLE t;
# Testing example of type YEAR and value 2020
SHOW CREATE TABLE t;
Table	Create Table
t	CREATE TABLE `t` (
  `a` year NOT NULL,
  `b` int unsigned GENERATED ALWAYS AS (`a`) VIRTUAL NOT NULL,
  KEY `on_b` (`b`)
) ENGINE=InnoDB DEFAULT CHARSET=utf8mb4 COLLATE=utf8mb4_0900_ai_ci
INSERT IGNORE INTO t (a) VALUES (2020);
SELECT * FROM t;
a	b
2020	2020
DELETE FROM t;
DELETE IGNORE FROM t;
CHECK TABLE t;
Table	Op	Msg_type	Msg_text
test.t	check	status	OK
DROP TABLE t;
# Testing example of type DATE and value "2030-04-05"
SHOW CREATE TABLE t;
Table	Create Table
t	CREATE TABLE `t` (
  `a` date NOT NULL,
  `b` int unsigned GENERATED ALWAYS AS (`a`) VIRTUAL NOT NULL,
  KEY `on_b` (`b`)
) ENGINE=InnoDB DEFAULT CHARSET=utf8mb4 COLLATE=utf8mb4_0900_ai_ci
INSERT IGNORE INTO t (a) VALUES ("2030-04-05");
Warnings:
Warning	1264	Out of range value for column 'b' at row 1
SELECT * FROM t;
a	b
2030-04-05	4294967295
DELETE FROM t;
DELETE IGNORE FROM t;
CHECK TABLE t;
Table	Op	Msg_type	Msg_text
test.t	check	status	OK
DROP TABLE t;
# Testing example of type TIME and value "11:12:13"
SHOW CREATE TABLE t;
Table	Create Table
t	CREATE TABLE `t` (
  `a` time NOT NULL,
  `b` int unsigned GENERATED ALWAYS AS (`a`) VIRTUAL NOT NULL,
  KEY `on_b` (`b`)
) ENGINE=InnoDB DEFAULT CHARSET=utf8mb4 COLLATE=utf8mb4_0900_ai_ci
INSERT IGNORE INTO t (a) VALUES ("11:12:13");
SELECT * FROM t;
a	b
11:12:13	111213
DELETE FROM t;
DELETE IGNORE FROM t;
CHECK TABLE t;
Table	Op	Msg_type	Msg_text
test.t	check	status	OK
DROP TABLE t;
# Testing example of type DATETIME and value "2030-04-05 11:12:13"
SHOW CREATE TABLE t;
Table	Create Table
t	CREATE TABLE `t` (
  `a` datetime NOT NULL,
  `b` int unsigned GENERATED ALWAYS AS (`a`) VIRTUAL NOT NULL,
  KEY `on_b` (`b`)
) ENGINE=InnoDB DEFAULT CHARSET=utf8mb4 COLLATE=utf8mb4_0900_ai_ci
INSERT IGNORE INTO t (a) VALUES ("2030-04-05 11:12:13");
Warnings:
Warning	1264	Out of range value for column 'b' at row 1
SELECT * FROM t;
a	b
2030-04-05 11:12:13	4294967295
DELETE FROM t;
DELETE IGNORE FROM t;
CHECK TABLE t;
Table	Op	Msg_type	Msg_text
test.t	check	status	OK
DROP TABLE t;
# Testing example of type TIMESTAMP and value "2030-04-05 11:12:13"
SHOW CREATE TABLE t;
Table	Create Table
t	CREATE TABLE `t` (
  `a` timestamp NOT NULL,
  `b` int unsigned GENERATED ALWAYS AS (`a`) VIRTUAL NOT NULL,
  KEY `on_b` (`b`)
) ENGINE=InnoDB DEFAULT CHARSET=utf8mb4 COLLATE=utf8mb4_0900_ai_ci
INSERT IGNORE INTO t (a) VALUES ("2030-04-05 11:12:13");
Warnings:
Warning	1264	Out of range value for column 'b' at row 1
SELECT * FROM t;
a	b
2030-04-05 11:12:13	4294967295
DELETE FROM t;
DELETE IGNORE FROM t;
CHECK TABLE t;
Table	Op	Msg_type	Msg_text
test.t	check	status	OK
DROP TABLE t;
# Testing example of type CHAR(40) and value "2000000000000000000000000000000000000"
SHOW CREATE TABLE t;
Table	Create Table
t	CREATE TABLE `t` (
  `a` char(40) NOT NULL,
  `b` int unsigned GENERATED ALWAYS AS (`a`) VIRTUAL NOT NULL,
  KEY `on_b` (`b`)
) ENGINE=InnoDB DEFAULT CHARSET=utf8mb4 COLLATE=utf8mb4_0900_ai_ci
INSERT IGNORE INTO t (a) VALUES ("2000000000000000000000000000000000000");
Warnings:
Warning	1264	Out of range value for column 'b' at row 1
SELECT * FROM t;
a	b
2000000000000000000000000000000000000	4294967295
DELETE FROM t;
DELETE IGNORE FROM t;
CHECK TABLE t;
Table	Op	Msg_type	Msg_text
test.t	check	status	OK
DROP TABLE t;
# Testing example of type BINARY(45) and value "200000000000000000000000000000000000000000"
SHOW CREATE TABLE t;
Table	Create Table
t	CREATE TABLE `t` (
  `a` binary(45) NOT NULL,
  `b` int unsigned GENERATED ALWAYS AS (`a`) VIRTUAL NOT NULL,
  KEY `on_b` (`b`)
) ENGINE=InnoDB DEFAULT CHARSET=utf8mb4 COLLATE=utf8mb4_0900_ai_ci
INSERT IGNORE INTO t (a) VALUES ("200000000000000000000000000000000000000000");
Warnings:
Warning	1264	Out of range value for column 'b' at row 1
SELECT * FROM t;
a	b
200000000000000000000000000000000000000000   	4294967295
DELETE FROM t;
DELETE IGNORE FROM t;
CHECK TABLE t;
Table	Op	Msg_type	Msg_text
test.t	check	status	OK
DROP TABLE t;
# Testing example of type VARCHAR(50) and value "2000000000000000000000000000000000000000000000000"
SHOW CREATE TABLE t;
Table	Create Table
t	CREATE TABLE `t` (
  `a` varchar(50) NOT NULL,
  `b` int unsigned GENERATED ALWAYS AS (`a`) VIRTUAL NOT NULL,
  KEY `on_b` (`b`)
) ENGINE=InnoDB DEFAULT CHARSET=utf8mb4 COLLATE=utf8mb4_0900_ai_ci
INSERT IGNORE INTO t (a) VALUES ("2000000000000000000000000000000000000000000000000");
Warnings:
Warning	1264	Out of range value for column 'b' at row 1
SELECT * FROM t;
a	b
2000000000000000000000000000000000000000000000000	4294967295
DELETE FROM t;
DELETE IGNORE FROM t;
CHECK TABLE t;
Table	Op	Msg_type	Msg_text
test.t	check	status	OK
DROP TABLE t;
# Testing example of type CHAR(24) and value "hello beautiful world"
SHOW CREATE TABLE t;
Table	Create Table
t	CREATE TABLE `t` (
  `a` char(24) NOT NULL,
  `b` int unsigned GENERATED ALWAYS AS (`a`) VIRTUAL NOT NULL,
  KEY `on_b` (`b`)
) ENGINE=InnoDB DEFAULT CHARSET=utf8mb4 COLLATE=utf8mb4_0900_ai_ci
INSERT IGNORE INTO t (a) VALUES ("hello beautiful world");
Warnings:
Warning	1366	Incorrect integer value: 'hello beautiful world' for column 'b' at row 1
SELECT * FROM t;
a	b
hello beautiful world	0
DELETE FROM t;
DELETE IGNORE FROM t;
CHECK TABLE t;
Table	Op	Msg_type	Msg_text
test.t	check	status	OK
DROP TABLE t;
# Testing example of type BINARY(12) and value "hello world"
SHOW CREATE TABLE t;
Table	Create Table
t	CREATE TABLE `t` (
  `a` binary(12) NOT NULL,
  `b` int unsigned GENERATED ALWAYS AS (`a`) VIRTUAL NOT NULL,
  KEY `on_b` (`b`)
) ENGINE=InnoDB DEFAULT CHARSET=utf8mb4 COLLATE=utf8mb4_0900_ai_ci
INSERT IGNORE INTO t (a) VALUES ("hello world");
Warnings:
Warning	1366	Incorrect integer value: 'hello world\x00' for column 'b' at row 1
SELECT * FROM t;
a	b
hello world 	0
DELETE FROM t;
DELETE IGNORE FROM t;
CHECK TABLE t;
Table	Op	Msg_type	Msg_text
test.t	check	status	OK
DROP TABLE t;
# Testing example of type VARCHAR(6) and value "hello"
SHOW CREATE TABLE t;
Table	Create Table
t	CREATE TABLE `t` (
  `a` varchar(6) NOT NULL,
  `b` int unsigned GENERATED ALWAYS AS (`a`) VIRTUAL NOT NULL,
  KEY `on_b` (`b`)
) ENGINE=InnoDB DEFAULT CHARSET=utf8mb4 COLLATE=utf8mb4_0900_ai_ci
INSERT IGNORE INTO t (a) VALUES ("hello");
Warnings:
Warning	1366	Incorrect integer value: 'hello' for column 'b' at row 1
SELECT * FROM t;
a	b
hello	0
DELETE FROM t;
DELETE IGNORE FROM t;
CHECK TABLE t;
Table	Op	Msg_type	Msg_text
test.t	check	status	OK
DROP TABLE t;
# Testing example of type ENUM("up","down") and value "up"
SHOW CREATE TABLE t;
Table	Create Table
t	CREATE TABLE `t` (
  `a` enum('up','down') NOT NULL,
  `b` int unsigned GENERATED ALWAYS AS (`a`) VIRTUAL NOT NULL,
  KEY `on_b` (`b`)
) ENGINE=InnoDB DEFAULT CHARSET=utf8mb4 COLLATE=utf8mb4_0900_ai_ci
INSERT IGNORE INTO t (a) VALUES ("up");
SELECT * FROM t;
a	b
up	1
DELETE FROM t;
DELETE IGNORE FROM t;
CHECK TABLE t;
Table	Op	Msg_type	Msg_text
test.t	check	status	OK
DROP TABLE t;
# Testing example of type SET("up","down") and value "up,down"
SHOW CREATE TABLE t;
Table	Create Table
t	CREATE TABLE `t` (
  `a` set('up','down') NOT NULL,
  `b` int unsigned GENERATED ALWAYS AS (`a`) VIRTUAL NOT NULL,
  KEY `on_b` (`b`)
) ENGINE=InnoDB DEFAULT CHARSET=utf8mb4 COLLATE=utf8mb4_0900_ai_ci
INSERT IGNORE INTO t (a) VALUES ("up,down");
SELECT * FROM t;
a	b
up,down	3
DELETE FROM t;
DELETE IGNORE FROM t;
CHECK TABLE t;
Table	Op	Msg_type	Msg_text
test.t	check	status	OK
DROP TABLE t;
# Testing example of type GEOMETRY and value ST_GeomFromText("POINT(1 1)")
SHOW CREATE TABLE t;
Table	Create Table
t	CREATE TABLE `t` (
  `a` geometry NOT NULL,
  `b` int unsigned GENERATED ALWAYS AS (`a`) VIRTUAL NOT NULL,
  KEY `on_b` (`b`)
) ENGINE=InnoDB DEFAULT CHARSET=utf8mb4 COLLATE=utf8mb4_0900_ai_ci
INSERT IGNORE INTO t (a) VALUES (ST_GeomFromText("POINT(1 1)"));
Warnings:
Warning	1366	Incorrect integer value: '\x00\x00\x00\x00\x01\x01\x00\x00\x00\x00\x00\x00\x00\x00\x00\xF0?\x00\x00\x00\x00\x00\x00\xF0?' for column 'b' at row 1
SELECT * FROM t;
a	b
             ð?      ð?	0
DELETE FROM t;
DELETE IGNORE FROM t;
CHECK TABLE t;
Table	Op	Msg_type	Msg_text
test.t	check	status	OK
DROP TABLE t;
# Testing example of type POINT and value ST_GeomFromText("POINT(1 1)")
SHOW CREATE TABLE t;
Table	Create Table
t	CREATE TABLE `t` (
  `a` point NOT NULL,
  `b` int unsigned GENERATED ALWAYS AS (`a`) VIRTUAL NOT NULL,
  KEY `on_b` (`b`)
) ENGINE=InnoDB DEFAULT CHARSET=utf8mb4 COLLATE=utf8mb4_0900_ai_ci
INSERT IGNORE INTO t (a) VALUES (ST_GeomFromText("POINT(1 1)"));
Warnings:
Warning	1366	Incorrect integer value: '\x00\x00\x00\x00\x01\x01\x00\x00\x00\x00\x00\x00\x00\x00\x00\xF0?\x00\x00\x00\x00\x00\x00\xF0?' for column 'b' at row 1
SELECT * FROM t;
a	b
             ð?      ð?	0
DELETE FROM t;
DELETE IGNORE FROM t;
CHECK TABLE t;
Table	Op	Msg_type	Msg_text
test.t	check	status	OK
DROP TABLE t;
# Testing example of type LINESTRING and value ST_GeomFromText("LINESTRING(0 0,1 1,2 2)")
SHOW CREATE TABLE t;
Table	Create Table
t	CREATE TABLE `t` (
  `a` linestring NOT NULL,
  `b` int unsigned GENERATED ALWAYS AS (`a`) VIRTUAL NOT NULL,
  KEY `on_b` (`b`)
) ENGINE=InnoDB DEFAULT CHARSET=utf8mb4 COLLATE=utf8mb4_0900_ai_ci
INSERT IGNORE INTO t (a) VALUES (ST_GeomFromText("LINESTRING(0 0,1 1,2 2)"));
Warnings:
Warning	1366	Incorrect integer value: '\x00\x00\x00\x00\x01\x02\x00\x00\x00\x03\x00\x00\x00\x00\x00\x00\x00\x00\x00\x00\x00\x00\x00\x00\x00\x00\x00\x00\x00\x00\x00\x00' for column 'b' at row 1
SELECT * FROM t;
a	b
                                ð?      ð?       @       @	0
DELETE FROM t;
DELETE IGNORE FROM t;
CHECK TABLE t;
Table	Op	Msg_type	Msg_text
test.t	check	status	OK
DROP TABLE t;
# Testing example of type POLYGON and value ST_GeomFromText("POLYGON((0 0,1 0,1 1,0 1,0 0),(5 5,7 5,7 7,5 7,5 5))")
SHOW CREATE TABLE t;
Table	Create Table
t	CREATE TABLE `t` (
  `a` polygon NOT NULL,
  `b` int unsigned GENERATED ALWAYS AS (`a`) VIRTUAL NOT NULL,
  KEY `on_b` (`b`)
) ENGINE=InnoDB DEFAULT CHARSET=utf8mb4 COLLATE=utf8mb4_0900_ai_ci
INSERT IGNORE INTO t (a) VALUES (ST_GeomFromText("POLYGON((0 0,1 0,1 1,0 1,0 0),(5 5,7 5,7 7,5 7,5 5))"));
Warnings:
Warning	1366	Incorrect integer value: '\x00\x00\x00\x00\x01\x03\x00\x00\x00\x02\x00\x00\x00\x05\x00\x00\x00\x00\x00\x00\x00\x00\x00\x00\x00\x00\x00\x00\x00\x00\x00\x00' for column 'b' at row 1
SELECT * FROM t;
a	b
                                   ð?              ð?      ð?              ð?                         @      @      @      @      @      @      @      @      @      @	0
DELETE FROM t;
DELETE IGNORE FROM t;
CHECK TABLE t;
Table	Op	Msg_type	Msg_text
test.t	check	status	OK
DROP TABLE t;
#
# Testing virtual column of type BIGINT
#
# Testing example of type JSON and value "{}"
SHOW CREATE TABLE t;
Table	Create Table
t	CREATE TABLE `t` (
  `a` json NOT NULL,
  `b` bigint GENERATED ALWAYS AS (`a`) VIRTUAL NOT NULL,
  KEY `on_b` (`b`)
) ENGINE=InnoDB DEFAULT CHARSET=utf8mb4 COLLATE=utf8mb4_0900_ai_ci
INSERT IGNORE INTO t (a) VALUES ("{}");
Warnings:
Warning	3156	Invalid JSON value for CAST to INTEGER from column a at row 1
SELECT * FROM t;
a	b
{}	0
Warnings:
Warning	3156	Invalid JSON value for CAST to INTEGER from column a at row 1
DELETE FROM t;
DELETE IGNORE FROM t;
Warnings:
Warning	3156	Invalid JSON value for CAST to INTEGER from column a at row 1
Warning	3156	Invalid JSON value for CAST to INTEGER from column a at row 1
CHECK TABLE t;
Table	Op	Msg_type	Msg_text
test.t	check	status	OK
DROP TABLE t;
# Testing example of type JSON and value '["hello beautiful world"]'
SHOW CREATE TABLE t;
Table	Create Table
t	CREATE TABLE `t` (
  `a` json NOT NULL,
  `b` bigint GENERATED ALWAYS AS (`a`) VIRTUAL NOT NULL,
  KEY `on_b` (`b`)
) ENGINE=InnoDB DEFAULT CHARSET=utf8mb4 COLLATE=utf8mb4_0900_ai_ci
INSERT IGNORE INTO t (a) VALUES ('["hello beautiful world"]');
Warnings:
Warning	3156	Invalid JSON value for CAST to INTEGER from column a at row 1
SELECT * FROM t;
a	b
["hello beautiful world"]	0
Warnings:
Warning	3156	Invalid JSON value for CAST to INTEGER from column a at row 1
DELETE FROM t;
DELETE IGNORE FROM t;
Warnings:
Warning	3156	Invalid JSON value for CAST to INTEGER from column a at row 1
Warning	3156	Invalid JSON value for CAST to INTEGER from column a at row 1
CHECK TABLE t;
Table	Op	Msg_type	Msg_text
test.t	check	status	OK
DROP TABLE t;
# Testing example of type JSON and value "-1"
SHOW CREATE TABLE t;
Table	Create Table
t	CREATE TABLE `t` (
  `a` json NOT NULL,
  `b` bigint GENERATED ALWAYS AS (`a`) VIRTUAL NOT NULL,
  KEY `on_b` (`b`)
) ENGINE=InnoDB DEFAULT CHARSET=utf8mb4 COLLATE=utf8mb4_0900_ai_ci
INSERT IGNORE INTO t (a) VALUES ("-1");
SELECT * FROM t;
a	b
-1	-1
DELETE FROM t;
DELETE IGNORE FROM t;
CHECK TABLE t;
Table	Op	Msg_type	Msg_text
test.t	check	status	OK
DROP TABLE t;
# Testing example of type TINYINT and value -1
SHOW CREATE TABLE t;
Table	Create Table
t	CREATE TABLE `t` (
  `a` tinyint NOT NULL,
  `b` bigint GENERATED ALWAYS AS (`a`) VIRTUAL NOT NULL,
  KEY `on_b` (`b`)
) ENGINE=InnoDB DEFAULT CHARSET=utf8mb4 COLLATE=utf8mb4_0900_ai_ci
INSERT IGNORE INTO t (a) VALUES (-1);
SELECT * FROM t;
a	b
-1	-1
DELETE FROM t;
DELETE IGNORE FROM t;
CHECK TABLE t;
Table	Op	Msg_type	Msg_text
test.t	check	status	OK
DROP TABLE t;
# Testing example of type SMALLINT and value -1
SHOW CREATE TABLE t;
Table	Create Table
t	CREATE TABLE `t` (
  `a` smallint NOT NULL,
  `b` bigint GENERATED ALWAYS AS (`a`) VIRTUAL NOT NULL,
  KEY `on_b` (`b`)
) ENGINE=InnoDB DEFAULT CHARSET=utf8mb4 COLLATE=utf8mb4_0900_ai_ci
INSERT IGNORE INTO t (a) VALUES (-1);
SELECT * FROM t;
a	b
-1	-1
DELETE FROM t;
DELETE IGNORE FROM t;
CHECK TABLE t;
Table	Op	Msg_type	Msg_text
test.t	check	status	OK
DROP TABLE t;
# Testing example of type MEDIUMINT and value -1
SHOW CREATE TABLE t;
Table	Create Table
t	CREATE TABLE `t` (
  `a` mediumint NOT NULL,
  `b` bigint GENERATED ALWAYS AS (`a`) VIRTUAL NOT NULL,
  KEY `on_b` (`b`)
) ENGINE=InnoDB DEFAULT CHARSET=utf8mb4 COLLATE=utf8mb4_0900_ai_ci
INSERT IGNORE INTO t (a) VALUES (-1);
SELECT * FROM t;
a	b
-1	-1
DELETE FROM t;
DELETE IGNORE FROM t;
CHECK TABLE t;
Table	Op	Msg_type	Msg_text
test.t	check	status	OK
DROP TABLE t;
# Testing example of type INT and value 2000000000
SHOW CREATE TABLE t;
Table	Create Table
t	CREATE TABLE `t` (
  `a` int NOT NULL,
  `b` bigint GENERATED ALWAYS AS (`a`) VIRTUAL NOT NULL,
  KEY `on_b` (`b`)
) ENGINE=InnoDB DEFAULT CHARSET=utf8mb4 COLLATE=utf8mb4_0900_ai_ci
INSERT IGNORE INTO t (a) VALUES (2000000000);
SELECT * FROM t;
a	b
2000000000	2000000000
DELETE FROM t;
DELETE IGNORE FROM t;
CHECK TABLE t;
Table	Op	Msg_type	Msg_text
test.t	check	status	OK
DROP TABLE t;
# Testing example of type INT and value -2000000000
SHOW CREATE TABLE t;
Table	Create Table
t	CREATE TABLE `t` (
  `a` int NOT NULL,
  `b` bigint GENERATED ALWAYS AS (`a`) VIRTUAL NOT NULL,
  KEY `on_b` (`b`)
) ENGINE=InnoDB DEFAULT CHARSET=utf8mb4 COLLATE=utf8mb4_0900_ai_ci
INSERT IGNORE INTO t (a) VALUES (-2000000000);
SELECT * FROM t;
a	b
-2000000000	-2000000000
DELETE FROM t;
DELETE IGNORE FROM t;
CHECK TABLE t;
Table	Op	Msg_type	Msg_text
test.t	check	status	OK
DROP TABLE t;
# Testing example of type INT UNSIGNED and value 4000000000
SHOW CREATE TABLE t;
Table	Create Table
t	CREATE TABLE `t` (
  `a` int unsigned NOT NULL,
  `b` bigint GENERATED ALWAYS AS (`a`) VIRTUAL NOT NULL,
  KEY `on_b` (`b`)
) ENGINE=InnoDB DEFAULT CHARSET=utf8mb4 COLLATE=utf8mb4_0900_ai_ci
INSERT IGNORE INTO t (a) VALUES (4000000000);
SELECT * FROM t;
a	b
4000000000	4000000000
DELETE FROM t;
DELETE IGNORE FROM t;
CHECK TABLE t;
Table	Op	Msg_type	Msg_text
test.t	check	status	OK
DROP TABLE t;
# Testing example of type BIGINT and value 2000000000000000000
SHOW CREATE TABLE t;
Table	Create Table
t	CREATE TABLE `t` (
  `a` bigint NOT NULL,
  `b` bigint GENERATED ALWAYS AS (`a`) VIRTUAL NOT NULL,
  KEY `on_b` (`b`)
) ENGINE=InnoDB DEFAULT CHARSET=utf8mb4 COLLATE=utf8mb4_0900_ai_ci
INSERT IGNORE INTO t (a) VALUES (2000000000000000000);
SELECT * FROM t;
a	b
2000000000000000000	2000000000000000000
DELETE FROM t;
DELETE IGNORE FROM t;
CHECK TABLE t;
Table	Op	Msg_type	Msg_text
test.t	check	status	OK
DROP TABLE t;
# Testing example of type BIGINT and value -2000000000000000000
SHOW CREATE TABLE t;
Table	Create Table
t	CREATE TABLE `t` (
  `a` bigint NOT NULL,
  `b` bigint GENERATED ALWAYS AS (`a`) VIRTUAL NOT NULL,
  KEY `on_b` (`b`)
) ENGINE=InnoDB DEFAULT CHARSET=utf8mb4 COLLATE=utf8mb4_0900_ai_ci
INSERT IGNORE INTO t (a) VALUES (-2000000000000000000);
SELECT * FROM t;
a	b
-2000000000000000000	-2000000000000000000
DELETE FROM t;
DELETE IGNORE FROM t;
CHECK TABLE t;
Table	Op	Msg_type	Msg_text
test.t	check	status	OK
DROP TABLE t;
# Testing example of type FLOAT and value -1.23456
SHOW CREATE TABLE t;
Table	Create Table
t	CREATE TABLE `t` (
  `a` float NOT NULL,
  `b` bigint GENERATED ALWAYS AS (`a`) VIRTUAL NOT NULL,
  KEY `on_b` (`b`)
) ENGINE=InnoDB DEFAULT CHARSET=utf8mb4 COLLATE=utf8mb4_0900_ai_ci
INSERT IGNORE INTO t (a) VALUES (-1.23456);
SELECT * FROM t;
a	b
-1.23456	-1
DELETE FROM t;
DELETE IGNORE FROM t;
CHECK TABLE t;
Table	Op	Msg_type	Msg_text
test.t	check	status	OK
DROP TABLE t;
# Testing example of type FLOAT and value -1e38
SHOW CREATE TABLE t;
Table	Create Table
t	CREATE TABLE `t` (
  `a` float NOT NULL,
  `b` bigint GENERATED ALWAYS AS (`a`) VIRTUAL NOT NULL,
  KEY `on_b` (`b`)
) ENGINE=InnoDB DEFAULT CHARSET=utf8mb4 COLLATE=utf8mb4_0900_ai_ci
INSERT IGNORE INTO t (a) VALUES (-1e38);
Warnings:
Warning	1264	Out of range value for column 'b' at row 1
SELECT * FROM t;
a	b
-1e38	-9223372036854775808
DELETE FROM t;
DELETE IGNORE FROM t;
CHECK TABLE t;
Table	Op	Msg_type	Msg_text
test.t	check	status	OK
DROP TABLE t;
# Testing example of type FLOAT and value 1e38
SHOW CREATE TABLE t;
Table	Create Table
t	CREATE TABLE `t` (
  `a` float NOT NULL,
  `b` bigint GENERATED ALWAYS AS (`a`) VIRTUAL NOT NULL,
  KEY `on_b` (`b`)
) ENGINE=InnoDB DEFAULT CHARSET=utf8mb4 COLLATE=utf8mb4_0900_ai_ci
INSERT IGNORE INTO t (a) VALUES (1e38);
Warnings:
Warning	1264	Out of range value for column 'b' at row 1
SELECT * FROM t;
a	b
1e38	9223372036854775807
DELETE FROM t;
DELETE IGNORE FROM t;
CHECK TABLE t;
Table	Op	Msg_type	Msg_text
test.t	check	status	OK
DROP TABLE t;
# Testing example of type DOUBLE and value -1.23456789012345
SHOW CREATE TABLE t;
Table	Create Table
t	CREATE TABLE `t` (
  `a` double NOT NULL,
  `b` bigint GENERATED ALWAYS AS (`a`) VIRTUAL NOT NULL,
  KEY `on_b` (`b`)
) ENGINE=InnoDB DEFAULT CHARSET=utf8mb4 COLLATE=utf8mb4_0900_ai_ci
INSERT IGNORE INTO t (a) VALUES (-1.23456789012345);
SELECT * FROM t;
a	b
-1.23456789012345	-1
DELETE FROM t;
DELETE IGNORE FROM t;
CHECK TABLE t;
Table	Op	Msg_type	Msg_text
test.t	check	status	OK
DROP TABLE t;
# Testing example of type DOUBLE and value 1.23456789012345
SHOW CREATE TABLE t;
Table	Create Table
t	CREATE TABLE `t` (
  `a` double NOT NULL,
  `b` bigint GENERATED ALWAYS AS (`a`) VIRTUAL NOT NULL,
  KEY `on_b` (`b`)
) ENGINE=InnoDB DEFAULT CHARSET=utf8mb4 COLLATE=utf8mb4_0900_ai_ci
INSERT IGNORE INTO t (a) VALUES (1.23456789012345);
SELECT * FROM t;
a	b
1.23456789012345	1
DELETE FROM t;
DELETE IGNORE FROM t;
CHECK TABLE t;
Table	Op	Msg_type	Msg_text
test.t	check	status	OK
DROP TABLE t;
# Testing example of type DOUBLE and value -1e300
SHOW CREATE TABLE t;
Table	Create Table
t	CREATE TABLE `t` (
  `a` double NOT NULL,
  `b` bigint GENERATED ALWAYS AS (`a`) VIRTUAL NOT NULL,
  KEY `on_b` (`b`)
) ENGINE=InnoDB DEFAULT CHARSET=utf8mb4 COLLATE=utf8mb4_0900_ai_ci
INSERT IGNORE INTO t (a) VALUES (-1e300);
Warnings:
Warning	1264	Out of range value for column 'b' at row 1
SELECT * FROM t;
a	b
-1e300	-9223372036854775808
DELETE FROM t;
DELETE IGNORE FROM t;
CHECK TABLE t;
Table	Op	Msg_type	Msg_text
test.t	check	status	OK
DROP TABLE t;
# Testing example of type DOUBLE and value 1e300
SHOW CREATE TABLE t;
Table	Create Table
t	CREATE TABLE `t` (
  `a` double NOT NULL,
  `b` bigint GENERATED ALWAYS AS (`a`) VIRTUAL NOT NULL,
  KEY `on_b` (`b`)
) ENGINE=InnoDB DEFAULT CHARSET=utf8mb4 COLLATE=utf8mb4_0900_ai_ci
INSERT IGNORE INTO t (a) VALUES (1e300);
Warnings:
Warning	1264	Out of range value for column 'b' at row 1
SELECT * FROM t;
a	b
1e300	9223372036854775807
DELETE FROM t;
DELETE IGNORE FROM t;
CHECK TABLE t;
Table	Op	Msg_type	Msg_text
test.t	check	status	OK
DROP TABLE t;
# Testing example of type DECIMAL(4,2) and value -10.99
SHOW CREATE TABLE t;
Table	Create Table
t	CREATE TABLE `t` (
  `a` decimal(4,2) NOT NULL,
  `b` bigint GENERATED ALWAYS AS (`a`) VIRTUAL NOT NULL,
  KEY `on_b` (`b`)
) ENGINE=InnoDB DEFAULT CHARSET=utf8mb4 COLLATE=utf8mb4_0900_ai_ci
INSERT IGNORE INTO t (a) VALUES (-10.99);
SELECT * FROM t;
a	b
-10.99	-11
DELETE FROM t;
DELETE IGNORE FROM t;
CHECK TABLE t;
Table	Op	Msg_type	Msg_text
test.t	check	status	OK
DROP TABLE t;
# Testing example of type DECIMAL(34,4) and value 20000000000000000000000000000.0001
SHOW CREATE TABLE t;
Table	Create Table
t	CREATE TABLE `t` (
  `a` decimal(34,4) NOT NULL,
  `b` bigint GENERATED ALWAYS AS (`a`) VIRTUAL NOT NULL,
  KEY `on_b` (`b`)
) ENGINE=InnoDB DEFAULT CHARSET=utf8mb4 COLLATE=utf8mb4_0900_ai_ci
INSERT IGNORE INTO t (a) VALUES (20000000000000000000000000000.0001);
Warnings:
Warning	1264	Out of range value for column 'b' at row 1
SELECT * FROM t;
a	b
20000000000000000000000000000.0001	9223372036854775807
DELETE FROM t;
DELETE IGNORE FROM t;
CHECK TABLE t;
Table	Op	Msg_type	Msg_text
test.t	check	status	OK
DROP TABLE t;
# Testing example of type DECIMAL(34,4) and value -20000000000000000000000000000.0001
SHOW CREATE TABLE t;
Table	Create Table
t	CREATE TABLE `t` (
  `a` decimal(34,4) NOT NULL,
  `b` bigint GENERATED ALWAYS AS (`a`) VIRTUAL NOT NULL,
  KEY `on_b` (`b`)
) ENGINE=InnoDB DEFAULT CHARSET=utf8mb4 COLLATE=utf8mb4_0900_ai_ci
INSERT IGNORE INTO t (a) VALUES (-20000000000000000000000000000.0001);
Warnings:
Warning	1264	Out of range value for column 'b' at row 1
SELECT * FROM t;
a	b
-20000000000000000000000000000.0001	-9223372036854775808
DELETE FROM t;
DELETE IGNORE FROM t;
CHECK TABLE t;
Table	Op	Msg_type	Msg_text
test.t	check	status	OK
DROP TABLE t;
# Testing example of type BIT(64) and value 0xDEADBEEFC0FEBABE
SHOW CREATE TABLE t;
Table	Create Table
t	CREATE TABLE `t` (
  `a` bit(64) NOT NULL,
  `b` bigint GENERATED ALWAYS AS (`a`) VIRTUAL NOT NULL,
  KEY `on_b` (`b`)
) ENGINE=InnoDB DEFAULT CHARSET=utf8mb4 COLLATE=utf8mb4_0900_ai_ci
INSERT IGNORE INTO t (a) VALUES (0xDEADBEEFC0FEBABE);
Warnings:
Warning	1264	Out of range value for column 'b' at row 1
SELECT * FROM t;
a	b
Þ­¾ïÀþº¾	9223372036854775807
DELETE FROM t;
DELETE IGNORE FROM t;
CHECK TABLE t;
Table	Op	Msg_type	Msg_text
test.t	check	status	OK
DROP TABLE t;
# Testing example of type BIT(4) and value 0b1000
SHOW CREATE TABLE t;
Table	Create Table
t	CREATE TABLE `t` (
  `a` bit(4) NOT NULL,
  `b` bigint GENERATED ALWAYS AS (`a`) VIRTUAL NOT NULL,
  KEY `on_b` (`b`)
) ENGINE=InnoDB DEFAULT CHARSET=utf8mb4 COLLATE=utf8mb4_0900_ai_ci
INSERT IGNORE INTO t (a) VALUES (0b1000);
SELECT * FROM t;
a	b
	8
DELETE FROM t;
DELETE IGNORE FROM t;
CHECK TABLE t;
Table	Op	Msg_type	Msg_text
test.t	check	status	OK
DROP TABLE t;
# Testing example of type YEAR and value 2020
SHOW CREATE TABLE t;
Table	Create Table
t	CREATE TABLE `t` (
  `a` year NOT NULL,
  `b` bigint GENERATED ALWAYS AS (`a`) VIRTUAL NOT NULL,
  KEY `on_b` (`b`)
) ENGINE=InnoDB DEFAULT CHARSET=utf8mb4 COLLATE=utf8mb4_0900_ai_ci
INSERT IGNORE INTO t (a) VALUES (2020);
SELECT * FROM t;
a	b
2020	2020
DELETE FROM t;
DELETE IGNORE FROM t;
CHECK TABLE t;
Table	Op	Msg_type	Msg_text
test.t	check	status	OK
DROP TABLE t;
# Testing example of type DATE and value "2030-04-05"
SHOW CREATE TABLE t;
Table	Create Table
t	CREATE TABLE `t` (
  `a` date NOT NULL,
  `b` bigint GENERATED ALWAYS AS (`a`) VIRTUAL NOT NULL,
  KEY `on_b` (`b`)
) ENGINE=InnoDB DEFAULT CHARSET=utf8mb4 COLLATE=utf8mb4_0900_ai_ci
INSERT IGNORE INTO t (a) VALUES ("2030-04-05");
SELECT * FROM t;
a	b
2030-04-05	20300405000000
DELETE FROM t;
DELETE IGNORE FROM t;
CHECK TABLE t;
Table	Op	Msg_type	Msg_text
test.t	check	status	OK
DROP TABLE t;
# Testing example of type TIME and value "11:12:13"
SHOW CREATE TABLE t;
Table	Create Table
t	CREATE TABLE `t` (
  `a` time NOT NULL,
  `b` bigint GENERATED ALWAYS AS (`a`) VIRTUAL NOT NULL,
  KEY `on_b` (`b`)
) ENGINE=InnoDB DEFAULT CHARSET=utf8mb4 COLLATE=utf8mb4_0900_ai_ci
INSERT IGNORE INTO t (a) VALUES ("11:12:13");
SELECT * FROM t;
a	b
11:12:13	111213
DELETE FROM t;
DELETE IGNORE FROM t;
CHECK TABLE t;
Table	Op	Msg_type	Msg_text
test.t	check	status	OK
DROP TABLE t;
# Testing example of type DATETIME and value "2030-04-05 11:12:13"
SHOW CREATE TABLE t;
Table	Create Table
t	CREATE TABLE `t` (
  `a` datetime NOT NULL,
  `b` bigint GENERATED ALWAYS AS (`a`) VIRTUAL NOT NULL,
  KEY `on_b` (`b`)
) ENGINE=InnoDB DEFAULT CHARSET=utf8mb4 COLLATE=utf8mb4_0900_ai_ci
INSERT IGNORE INTO t (a) VALUES ("2030-04-05 11:12:13");
SELECT * FROM t;
a	b
2030-04-05 11:12:13	20300405111213
DELETE FROM t;
DELETE IGNORE FROM t;
CHECK TABLE t;
Table	Op	Msg_type	Msg_text
test.t	check	status	OK
DROP TABLE t;
# Testing example of type TIMESTAMP and value "2030-04-05 11:12:13"
SHOW CREATE TABLE t;
Table	Create Table
t	CREATE TABLE `t` (
  `a` timestamp NOT NULL,
  `b` bigint GENERATED ALWAYS AS (`a`) VIRTUAL NOT NULL,
  KEY `on_b` (`b`)
) ENGINE=InnoDB DEFAULT CHARSET=utf8mb4 COLLATE=utf8mb4_0900_ai_ci
INSERT IGNORE INTO t (a) VALUES ("2030-04-05 11:12:13");
SELECT * FROM t;
a	b
2030-04-05 11:12:13	20300405111213
DELETE FROM t;
DELETE IGNORE FROM t;
CHECK TABLE t;
Table	Op	Msg_type	Msg_text
test.t	check	status	OK
DROP TABLE t;
# Testing example of type CHAR(40) and value "2000000000000000000000000000000000000"
SHOW CREATE TABLE t;
Table	Create Table
t	CREATE TABLE `t` (
  `a` char(40) NOT NULL,
  `b` bigint GENERATED ALWAYS AS (`a`) VIRTUAL NOT NULL,
  KEY `on_b` (`b`)
) ENGINE=InnoDB DEFAULT CHARSET=utf8mb4 COLLATE=utf8mb4_0900_ai_ci
INSERT IGNORE INTO t (a) VALUES ("2000000000000000000000000000000000000");
Warnings:
Warning	1264	Out of range value for column 'b' at row 1
SELECT * FROM t;
a	b
2000000000000000000000000000000000000	9223372036854775807
DELETE FROM t;
DELETE IGNORE FROM t;
CHECK TABLE t;
Table	Op	Msg_type	Msg_text
test.t	check	status	OK
DROP TABLE t;
# Testing example of type BINARY(45) and value "200000000000000000000000000000000000000000"
SHOW CREATE TABLE t;
Table	Create Table
t	CREATE TABLE `t` (
  `a` binary(45) NOT NULL,
  `b` bigint GENERATED ALWAYS AS (`a`) VIRTUAL NOT NULL,
  KEY `on_b` (`b`)
) ENGINE=InnoDB DEFAULT CHARSET=utf8mb4 COLLATE=utf8mb4_0900_ai_ci
INSERT IGNORE INTO t (a) VALUES ("200000000000000000000000000000000000000000");
Warnings:
Warning	1264	Out of range value for column 'b' at row 1
SELECT * FROM t;
a	b
200000000000000000000000000000000000000000   	9223372036854775807
DELETE FROM t;
DELETE IGNORE FROM t;
CHECK TABLE t;
Table	Op	Msg_type	Msg_text
test.t	check	status	OK
DROP TABLE t;
# Testing example of type VARCHAR(50) and value "2000000000000000000000000000000000000000000000000"
SHOW CREATE TABLE t;
Table	Create Table
t	CREATE TABLE `t` (
  `a` varchar(50) NOT NULL,
  `b` bigint GENERATED ALWAYS AS (`a`) VIRTUAL NOT NULL,
  KEY `on_b` (`b`)
) ENGINE=InnoDB DEFAULT CHARSET=utf8mb4 COLLATE=utf8mb4_0900_ai_ci
INSERT IGNORE INTO t (a) VALUES ("2000000000000000000000000000000000000000000000000");
Warnings:
Warning	1264	Out of range value for column 'b' at row 1
SELECT * FROM t;
a	b
2000000000000000000000000000000000000000000000000	9223372036854775807
DELETE FROM t;
DELETE IGNORE FROM t;
CHECK TABLE t;
Table	Op	Msg_type	Msg_text
test.t	check	status	OK
DROP TABLE t;
# Testing example of type CHAR(24) and value "hello beautiful world"
SHOW CREATE TABLE t;
Table	Create Table
t	CREATE TABLE `t` (
  `a` char(24) NOT NULL,
  `b` bigint GENERATED ALWAYS AS (`a`) VIRTUAL NOT NULL,
  KEY `on_b` (`b`)
) ENGINE=InnoDB DEFAULT CHARSET=utf8mb4 COLLATE=utf8mb4_0900_ai_ci
INSERT IGNORE INTO t (a) VALUES ("hello beautiful world");
Warnings:
Warning	1366	Incorrect integer value: 'hello beautiful world' for column 'b' at row 1
SELECT * FROM t;
a	b
hello beautiful world	0
DELETE FROM t;
DELETE IGNORE FROM t;
CHECK TABLE t;
Table	Op	Msg_type	Msg_text
test.t	check	status	OK
DROP TABLE t;
# Testing example of type BINARY(12) and value "hello world"
SHOW CREATE TABLE t;
Table	Create Table
t	CREATE TABLE `t` (
  `a` binary(12) NOT NULL,
  `b` bigint GENERATED ALWAYS AS (`a`) VIRTUAL NOT NULL,
  KEY `on_b` (`b`)
) ENGINE=InnoDB DEFAULT CHARSET=utf8mb4 COLLATE=utf8mb4_0900_ai_ci
INSERT IGNORE INTO t (a) VALUES ("hello world");
Warnings:
Warning	1366	Incorrect integer value: 'hello world\x00' for column 'b' at row 1
SELECT * FROM t;
a	b
hello world 	0
DELETE FROM t;
DELETE IGNORE FROM t;
CHECK TABLE t;
Table	Op	Msg_type	Msg_text
test.t	check	status	OK
DROP TABLE t;
# Testing example of type VARCHAR(6) and value "hello"
SHOW CREATE TABLE t;
Table	Create Table
t	CREATE TABLE `t` (
  `a` varchar(6) NOT NULL,
  `b` bigint GENERATED ALWAYS AS (`a`) VIRTUAL NOT NULL,
  KEY `on_b` (`b`)
) ENGINE=InnoDB DEFAULT CHARSET=utf8mb4 COLLATE=utf8mb4_0900_ai_ci
INSERT IGNORE INTO t (a) VALUES ("hello");
Warnings:
Warning	1366	Incorrect integer value: 'hello' for column 'b' at row 1
SELECT * FROM t;
a	b
hello	0
DELETE FROM t;
DELETE IGNORE FROM t;
CHECK TABLE t;
Table	Op	Msg_type	Msg_text
test.t	check	status	OK
DROP TABLE t;
# Testing example of type ENUM("up","down") and value "up"
SHOW CREATE TABLE t;
Table	Create Table
t	CREATE TABLE `t` (
  `a` enum('up','down') NOT NULL,
  `b` bigint GENERATED ALWAYS AS (`a`) VIRTUAL NOT NULL,
  KEY `on_b` (`b`)
) ENGINE=InnoDB DEFAULT CHARSET=utf8mb4 COLLATE=utf8mb4_0900_ai_ci
INSERT IGNORE INTO t (a) VALUES ("up");
SELECT * FROM t;
a	b
up	1
DELETE FROM t;
DELETE IGNORE FROM t;
CHECK TABLE t;
Table	Op	Msg_type	Msg_text
test.t	check	status	OK
DROP TABLE t;
# Testing example of type SET("up","down") and value "up,down"
SHOW CREATE TABLE t;
Table	Create Table
t	CREATE TABLE `t` (
  `a` set('up','down') NOT NULL,
  `b` bigint GENERATED ALWAYS AS (`a`) VIRTUAL NOT NULL,
  KEY `on_b` (`b`)
) ENGINE=InnoDB DEFAULT CHARSET=utf8mb4 COLLATE=utf8mb4_0900_ai_ci
INSERT IGNORE INTO t (a) VALUES ("up,down");
SELECT * FROM t;
a	b
up,down	3
DELETE FROM t;
DELETE IGNORE FROM t;
CHECK TABLE t;
Table	Op	Msg_type	Msg_text
test.t	check	status	OK
DROP TABLE t;
# Testing example of type GEOMETRY and value ST_GeomFromText("POINT(1 1)")
SHOW CREATE TABLE t;
Table	Create Table
t	CREATE TABLE `t` (
  `a` geometry NOT NULL,
  `b` bigint GENERATED ALWAYS AS (`a`) VIRTUAL NOT NULL,
  KEY `on_b` (`b`)
) ENGINE=InnoDB DEFAULT CHARSET=utf8mb4 COLLATE=utf8mb4_0900_ai_ci
INSERT IGNORE INTO t (a) VALUES (ST_GeomFromText("POINT(1 1)"));
Warnings:
Warning	1366	Incorrect integer value: '\x00\x00\x00\x00\x01\x01\x00\x00\x00\x00\x00\x00\x00\x00\x00\xF0?\x00\x00\x00\x00\x00\x00\xF0?' for column 'b' at row 1
SELECT * FROM t;
a	b
             ð?      ð?	0
DELETE FROM t;
DELETE IGNORE FROM t;
CHECK TABLE t;
Table	Op	Msg_type	Msg_text
test.t	check	status	OK
DROP TABLE t;
# Testing example of type POINT and value ST_GeomFromText("POINT(1 1)")
SHOW CREATE TABLE t;
Table	Create Table
t	CREATE TABLE `t` (
  `a` point NOT NULL,
  `b` bigint GENERATED ALWAYS AS (`a`) VIRTUAL NOT NULL,
  KEY `on_b` (`b`)
) ENGINE=InnoDB DEFAULT CHARSET=utf8mb4 COLLATE=utf8mb4_0900_ai_ci
INSERT IGNORE INTO t (a) VALUES (ST_GeomFromText("POINT(1 1)"));
Warnings:
Warning	1366	Incorrect integer value: '\x00\x00\x00\x00\x01\x01\x00\x00\x00\x00\x00\x00\x00\x00\x00\xF0?\x00\x00\x00\x00\x00\x00\xF0?' for column 'b' at row 1
SELECT * FROM t;
a	b
             ð?      ð?	0
DELETE FROM t;
DELETE IGNORE FROM t;
CHECK TABLE t;
Table	Op	Msg_type	Msg_text
test.t	check	status	OK
DROP TABLE t;
# Testing example of type LINESTRING and value ST_GeomFromText("LINESTRING(0 0,1 1,2 2)")
SHOW CREATE TABLE t;
Table	Create Table
t	CREATE TABLE `t` (
  `a` linestring NOT NULL,
  `b` bigint GENERATED ALWAYS AS (`a`) VIRTUAL NOT NULL,
  KEY `on_b` (`b`)
) ENGINE=InnoDB DEFAULT CHARSET=utf8mb4 COLLATE=utf8mb4_0900_ai_ci
INSERT IGNORE INTO t (a) VALUES (ST_GeomFromText("LINESTRING(0 0,1 1,2 2)"));
Warnings:
Warning	1366	Incorrect integer value: '\x00\x00\x00\x00\x01\x02\x00\x00\x00\x03\x00\x00\x00\x00\x00\x00\x00\x00\x00\x00\x00\x00\x00\x00\x00\x00\x00\x00\x00\x00\x00\x00' for column 'b' at row 1
SELECT * FROM t;
a	b
                                ð?      ð?       @       @	0
DELETE FROM t;
DELETE IGNORE FROM t;
CHECK TABLE t;
Table	Op	Msg_type	Msg_text
test.t	check	status	OK
DROP TABLE t;
# Testing example of type POLYGON and value ST_GeomFromText("POLYGON((0 0,1 0,1 1,0 1,0 0),(5 5,7 5,7 7,5 7,5 5))")
SHOW CREATE TABLE t;
Table	Create Table
t	CREATE TABLE `t` (
  `a` polygon NOT NULL,
  `b` bigint GENERATED ALWAYS AS (`a`) VIRTUAL NOT NULL,
  KEY `on_b` (`b`)
) ENGINE=InnoDB DEFAULT CHARSET=utf8mb4 COLLATE=utf8mb4_0900_ai_ci
INSERT IGNORE INTO t (a) VALUES (ST_GeomFromText("POLYGON((0 0,1 0,1 1,0 1,0 0),(5 5,7 5,7 7,5 7,5 5))"));
Warnings:
Warning	1366	Incorrect integer value: '\x00\x00\x00\x00\x01\x03\x00\x00\x00\x02\x00\x00\x00\x05\x00\x00\x00\x00\x00\x00\x00\x00\x00\x00\x00\x00\x00\x00\x00\x00\x00\x00' for column 'b' at row 1
SELECT * FROM t;
a	b
                                   ð?              ð?      ð?              ð?                         @      @      @      @      @      @      @      @      @      @	0
DELETE FROM t;
DELETE IGNORE FROM t;
CHECK TABLE t;
Table	Op	Msg_type	Msg_text
test.t	check	status	OK
DROP TABLE t;
#
# Testing virtual column of type FLOAT
#
# Testing example of type JSON and value "{}"
SHOW CREATE TABLE t;
Table	Create Table
t	CREATE TABLE `t` (
  `a` json NOT NULL,
  `b` float GENERATED ALWAYS AS (`a`) VIRTUAL NOT NULL,
  KEY `on_b` (`b`)
) ENGINE=InnoDB DEFAULT CHARSET=utf8mb4 COLLATE=utf8mb4_0900_ai_ci
INSERT IGNORE INTO t (a) VALUES ("{}");
Warnings:
Warning	3156	Invalid JSON value for CAST to DOUBLE from column a at row 1
SELECT * FROM t;
a	b
{}	0
Warnings:
Warning	3156	Invalid JSON value for CAST to DOUBLE from column a at row 1
DELETE FROM t;
DELETE IGNORE FROM t;
Warnings:
Warning	3156	Invalid JSON value for CAST to DOUBLE from column a at row 1
Warning	3156	Invalid JSON value for CAST to DOUBLE from column a at row 1
CHECK TABLE t;
Table	Op	Msg_type	Msg_text
test.t	check	status	OK
DROP TABLE t;
# Testing example of type JSON and value '["hello beautiful world"]'
SHOW CREATE TABLE t;
Table	Create Table
t	CREATE TABLE `t` (
  `a` json NOT NULL,
  `b` float GENERATED ALWAYS AS (`a`) VIRTUAL NOT NULL,
  KEY `on_b` (`b`)
) ENGINE=InnoDB DEFAULT CHARSET=utf8mb4 COLLATE=utf8mb4_0900_ai_ci
INSERT IGNORE INTO t (a) VALUES ('["hello beautiful world"]');
Warnings:
Warning	3156	Invalid JSON value for CAST to DOUBLE from column a at row 1
SELECT * FROM t;
a	b
["hello beautiful world"]	0
Warnings:
Warning	3156	Invalid JSON value for CAST to DOUBLE from column a at row 1
DELETE FROM t;
DELETE IGNORE FROM t;
Warnings:
Warning	3156	Invalid JSON value for CAST to DOUBLE from column a at row 1
Warning	3156	Invalid JSON value for CAST to DOUBLE from column a at row 1
CHECK TABLE t;
Table	Op	Msg_type	Msg_text
test.t	check	status	OK
DROP TABLE t;
# Testing example of type JSON and value "-1"
SHOW CREATE TABLE t;
Table	Create Table
t	CREATE TABLE `t` (
  `a` json NOT NULL,
  `b` float GENERATED ALWAYS AS (`a`) VIRTUAL NOT NULL,
  KEY `on_b` (`b`)
) ENGINE=InnoDB DEFAULT CHARSET=utf8mb4 COLLATE=utf8mb4_0900_ai_ci
INSERT IGNORE INTO t (a) VALUES ("-1");
SELECT * FROM t;
a	b
-1	-1
DELETE FROM t;
DELETE IGNORE FROM t;
CHECK TABLE t;
Table	Op	Msg_type	Msg_text
test.t	check	status	OK
DROP TABLE t;
# Testing example of type TINYINT and value -1
SHOW CREATE TABLE t;
Table	Create Table
t	CREATE TABLE `t` (
  `a` tinyint NOT NULL,
  `b` float GENERATED ALWAYS AS (`a`) VIRTUAL NOT NULL,
  KEY `on_b` (`b`)
) ENGINE=InnoDB DEFAULT CHARSET=utf8mb4 COLLATE=utf8mb4_0900_ai_ci
INSERT IGNORE INTO t (a) VALUES (-1);
SELECT * FROM t;
a	b
-1	-1
DELETE FROM t;
DELETE IGNORE FROM t;
CHECK TABLE t;
Table	Op	Msg_type	Msg_text
test.t	check	status	OK
DROP TABLE t;
# Testing example of type SMALLINT and value -1
SHOW CREATE TABLE t;
Table	Create Table
t	CREATE TABLE `t` (
  `a` smallint NOT NULL,
  `b` float GENERATED ALWAYS AS (`a`) VIRTUAL NOT NULL,
  KEY `on_b` (`b`)
) ENGINE=InnoDB DEFAULT CHARSET=utf8mb4 COLLATE=utf8mb4_0900_ai_ci
INSERT IGNORE INTO t (a) VALUES (-1);
SELECT * FROM t;
a	b
-1	-1
DELETE FROM t;
DELETE IGNORE FROM t;
CHECK TABLE t;
Table	Op	Msg_type	Msg_text
test.t	check	status	OK
DROP TABLE t;
# Testing example of type MEDIUMINT and value -1
SHOW CREATE TABLE t;
Table	Create Table
t	CREATE TABLE `t` (
  `a` mediumint NOT NULL,
  `b` float GENERATED ALWAYS AS (`a`) VIRTUAL NOT NULL,
  KEY `on_b` (`b`)
) ENGINE=InnoDB DEFAULT CHARSET=utf8mb4 COLLATE=utf8mb4_0900_ai_ci
INSERT IGNORE INTO t (a) VALUES (-1);
SELECT * FROM t;
a	b
-1	-1
DELETE FROM t;
DELETE IGNORE FROM t;
CHECK TABLE t;
Table	Op	Msg_type	Msg_text
test.t	check	status	OK
DROP TABLE t;
# Testing example of type INT and value 2000000000
SHOW CREATE TABLE t;
Table	Create Table
t	CREATE TABLE `t` (
  `a` int NOT NULL,
  `b` float GENERATED ALWAYS AS (`a`) VIRTUAL NOT NULL,
  KEY `on_b` (`b`)
) ENGINE=InnoDB DEFAULT CHARSET=utf8mb4 COLLATE=utf8mb4_0900_ai_ci
INSERT IGNORE INTO t (a) VALUES (2000000000);
SELECT * FROM t;
a	b
2000000000	2000000000
DELETE FROM t;
DELETE IGNORE FROM t;
CHECK TABLE t;
Table	Op	Msg_type	Msg_text
test.t	check	status	OK
DROP TABLE t;
# Testing example of type INT and value -2000000000
SHOW CREATE TABLE t;
Table	Create Table
t	CREATE TABLE `t` (
  `a` int NOT NULL,
  `b` float GENERATED ALWAYS AS (`a`) VIRTUAL NOT NULL,
  KEY `on_b` (`b`)
) ENGINE=InnoDB DEFAULT CHARSET=utf8mb4 COLLATE=utf8mb4_0900_ai_ci
INSERT IGNORE INTO t (a) VALUES (-2000000000);
SELECT * FROM t;
a	b
-2000000000	-2000000000
DELETE FROM t;
DELETE IGNORE FROM t;
CHECK TABLE t;
Table	Op	Msg_type	Msg_text
test.t	check	status	OK
DROP TABLE t;
# Testing example of type INT UNSIGNED and value 4000000000
SHOW CREATE TABLE t;
Table	Create Table
t	CREATE TABLE `t` (
  `a` int unsigned NOT NULL,
  `b` float GENERATED ALWAYS AS (`a`) VIRTUAL NOT NULL,
  KEY `on_b` (`b`)
) ENGINE=InnoDB DEFAULT CHARSET=utf8mb4 COLLATE=utf8mb4_0900_ai_ci
INSERT IGNORE INTO t (a) VALUES (4000000000);
SELECT * FROM t;
a	b
4000000000	4000000000
DELETE FROM t;
DELETE IGNORE FROM t;
CHECK TABLE t;
Table	Op	Msg_type	Msg_text
test.t	check	status	OK
DROP TABLE t;
# Testing example of type BIGINT and value 2000000000000000000
SHOW CREATE TABLE t;
Table	Create Table
t	CREATE TABLE `t` (
  `a` bigint NOT NULL,
  `b` float GENERATED ALWAYS AS (`a`) VIRTUAL NOT NULL,
  KEY `on_b` (`b`)
) ENGINE=InnoDB DEFAULT CHARSET=utf8mb4 COLLATE=utf8mb4_0900_ai_ci
INSERT IGNORE INTO t (a) VALUES (2000000000000000000);
SELECT * FROM t;
a	b
2000000000000000000	2e18
DELETE FROM t;
DELETE IGNORE FROM t;
CHECK TABLE t;
Table	Op	Msg_type	Msg_text
test.t	check	status	OK
DROP TABLE t;
# Testing example of type BIGINT and value -2000000000000000000
SHOW CREATE TABLE t;
Table	Create Table
t	CREATE TABLE `t` (
  `a` bigint NOT NULL,
  `b` float GENERATED ALWAYS AS (`a`) VIRTUAL NOT NULL,
  KEY `on_b` (`b`)
) ENGINE=InnoDB DEFAULT CHARSET=utf8mb4 COLLATE=utf8mb4_0900_ai_ci
INSERT IGNORE INTO t (a) VALUES (-2000000000000000000);
SELECT * FROM t;
a	b
-2000000000000000000	-2e18
DELETE FROM t;
DELETE IGNORE FROM t;
CHECK TABLE t;
Table	Op	Msg_type	Msg_text
test.t	check	status	OK
DROP TABLE t;
# Testing example of type FLOAT and value -1.23456
SHOW CREATE TABLE t;
Table	Create Table
t	CREATE TABLE `t` (
  `a` float NOT NULL,
  `b` float GENERATED ALWAYS AS (`a`) VIRTUAL NOT NULL,
  KEY `on_b` (`b`)
) ENGINE=InnoDB DEFAULT CHARSET=utf8mb4 COLLATE=utf8mb4_0900_ai_ci
INSERT IGNORE INTO t (a) VALUES (-1.23456);
SELECT * FROM t;
a	b
-1.23456	-1.23456
DELETE FROM t;
DELETE IGNORE FROM t;
CHECK TABLE t;
Table	Op	Msg_type	Msg_text
test.t	check	status	OK
DROP TABLE t;
# Testing example of type FLOAT and value -1e38
SHOW CREATE TABLE t;
Table	Create Table
t	CREATE TABLE `t` (
  `a` float NOT NULL,
  `b` float GENERATED ALWAYS AS (`a`) VIRTUAL NOT NULL,
  KEY `on_b` (`b`)
) ENGINE=InnoDB DEFAULT CHARSET=utf8mb4 COLLATE=utf8mb4_0900_ai_ci
INSERT IGNORE INTO t (a) VALUES (-1e38);
SELECT * FROM t;
a	b
-1e38	-1e38
DELETE FROM t;
DELETE IGNORE FROM t;
CHECK TABLE t;
Table	Op	Msg_type	Msg_text
test.t	check	status	OK
DROP TABLE t;
# Testing example of type FLOAT and value 1e38
SHOW CREATE TABLE t;
Table	Create Table
t	CREATE TABLE `t` (
  `a` float NOT NULL,
  `b` float GENERATED ALWAYS AS (`a`) VIRTUAL NOT NULL,
  KEY `on_b` (`b`)
) ENGINE=InnoDB DEFAULT CHARSET=utf8mb4 COLLATE=utf8mb4_0900_ai_ci
INSERT IGNORE INTO t (a) VALUES (1e38);
SELECT * FROM t;
a	b
1e38	1e38
DELETE FROM t;
DELETE IGNORE FROM t;
CHECK TABLE t;
Table	Op	Msg_type	Msg_text
test.t	check	status	OK
DROP TABLE t;
# Testing example of type DOUBLE and value -1.23456789012345
SHOW CREATE TABLE t;
Table	Create Table
t	CREATE TABLE `t` (
  `a` double NOT NULL,
  `b` float GENERATED ALWAYS AS (`a`) VIRTUAL NOT NULL,
  KEY `on_b` (`b`)
) ENGINE=InnoDB DEFAULT CHARSET=utf8mb4 COLLATE=utf8mb4_0900_ai_ci
INSERT IGNORE INTO t (a) VALUES (-1.23456789012345);
SELECT * FROM t;
a	b
-1.23456789012345	-1.23457
DELETE FROM t;
DELETE IGNORE FROM t;
CHECK TABLE t;
Table	Op	Msg_type	Msg_text
test.t	check	status	OK
DROP TABLE t;
# Testing example of type DOUBLE and value 1.23456789012345
SHOW CREATE TABLE t;
Table	Create Table
t	CREATE TABLE `t` (
  `a` double NOT NULL,
  `b` float GENERATED ALWAYS AS (`a`) VIRTUAL NOT NULL,
  KEY `on_b` (`b`)
) ENGINE=InnoDB DEFAULT CHARSET=utf8mb4 COLLATE=utf8mb4_0900_ai_ci
INSERT IGNORE INTO t (a) VALUES (1.23456789012345);
SELECT * FROM t;
a	b
1.23456789012345	1.23457
DELETE FROM t;
DELETE IGNORE FROM t;
CHECK TABLE t;
Table	Op	Msg_type	Msg_text
test.t	check	status	OK
DROP TABLE t;
# Testing example of type DOUBLE and value -1e300
SHOW CREATE TABLE t;
Table	Create Table
t	CREATE TABLE `t` (
  `a` double NOT NULL,
  `b` float GENERATED ALWAYS AS (`a`) VIRTUAL NOT NULL,
  KEY `on_b` (`b`)
) ENGINE=InnoDB DEFAULT CHARSET=utf8mb4 COLLATE=utf8mb4_0900_ai_ci
INSERT IGNORE INTO t (a) VALUES (-1e300);
Warnings:
Warning	1264	Out of range value for column 'b' at row 1
SELECT * FROM t;
a	b
-1e300	-3.40282e38
DELETE FROM t;
DELETE IGNORE FROM t;
CHECK TABLE t;
Table	Op	Msg_type	Msg_text
test.t	check	status	OK
DROP TABLE t;
# Testing example of type DOUBLE and value 1e300
SHOW CREATE TABLE t;
Table	Create Table
t	CREATE TABLE `t` (
  `a` double NOT NULL,
  `b` float GENERATED ALWAYS AS (`a`) VIRTUAL NOT NULL,
  KEY `on_b` (`b`)
) ENGINE=InnoDB DEFAULT CHARSET=utf8mb4 COLLATE=utf8mb4_0900_ai_ci
INSERT IGNORE INTO t (a) VALUES (1e300);
Warnings:
Warning	1264	Out of range value for column 'b' at row 1
SELECT * FROM t;
a	b
1e300	3.40282e38
DELETE FROM t;
DELETE IGNORE FROM t;
CHECK TABLE t;
Table	Op	Msg_type	Msg_text
test.t	check	status	OK
DROP TABLE t;
# Testing example of type DECIMAL(4,2) and value -10.99
SHOW CREATE TABLE t;
Table	Create Table
t	CREATE TABLE `t` (
  `a` decimal(4,2) NOT NULL,
  `b` float GENERATED ALWAYS AS (`a`) VIRTUAL NOT NULL,
  KEY `on_b` (`b`)
) ENGINE=InnoDB DEFAULT CHARSET=utf8mb4 COLLATE=utf8mb4_0900_ai_ci
INSERT IGNORE INTO t (a) VALUES (-10.99);
SELECT * FROM t;
a	b
-10.99	-10.99
DELETE FROM t;
DELETE IGNORE FROM t;
CHECK TABLE t;
Table	Op	Msg_type	Msg_text
test.t	check	status	OK
DROP TABLE t;
# Testing example of type DECIMAL(34,4) and value 20000000000000000000000000000.0001
SHOW CREATE TABLE t;
Table	Create Table
t	CREATE TABLE `t` (
  `a` decimal(34,4) NOT NULL,
  `b` float GENERATED ALWAYS AS (`a`) VIRTUAL NOT NULL,
  KEY `on_b` (`b`)
) ENGINE=InnoDB DEFAULT CHARSET=utf8mb4 COLLATE=utf8mb4_0900_ai_ci
INSERT IGNORE INTO t (a) VALUES (20000000000000000000000000000.0001);
SELECT * FROM t;
a	b
20000000000000000000000000000.0001	2e28
DELETE FROM t;
DELETE IGNORE FROM t;
CHECK TABLE t;
Table	Op	Msg_type	Msg_text
test.t	check	status	OK
DROP TABLE t;
# Testing example of type DECIMAL(34,4) and value -20000000000000000000000000000.0001
SHOW CREATE TABLE t;
Table	Create Table
t	CREATE TABLE `t` (
  `a` decimal(34,4) NOT NULL,
  `b` float GENERATED ALWAYS AS (`a`) VIRTUAL NOT NULL,
  KEY `on_b` (`b`)
) ENGINE=InnoDB DEFAULT CHARSET=utf8mb4 COLLATE=utf8mb4_0900_ai_ci
INSERT IGNORE INTO t (a) VALUES (-20000000000000000000000000000.0001);
SELECT * FROM t;
a	b
-20000000000000000000000000000.0001	-2e28
DELETE FROM t;
DELETE IGNORE FROM t;
CHECK TABLE t;
Table	Op	Msg_type	Msg_text
test.t	check	status	OK
DROP TABLE t;
# Testing example of type BIT(64) and value 0xDEADBEEFC0FEBABE
SHOW CREATE TABLE t;
Table	Create Table
t	CREATE TABLE `t` (
  `a` bit(64) NOT NULL,
  `b` float GENERATED ALWAYS AS (`a`) VIRTUAL NOT NULL,
  KEY `on_b` (`b`)
) ENGINE=InnoDB DEFAULT CHARSET=utf8mb4 COLLATE=utf8mb4_0900_ai_ci
INSERT IGNORE INTO t (a) VALUES (0xDEADBEEFC0FEBABE);
SELECT * FROM t;
a	b
Þ­¾ïÀþº¾	1.60457e19
DELETE FROM t;
DELETE IGNORE FROM t;
CHECK TABLE t;
Table	Op	Msg_type	Msg_text
test.t	check	status	OK
DROP TABLE t;
# Testing example of type BIT(4) and value 0b1000
SHOW CREATE TABLE t;
Table	Create Table
t	CREATE TABLE `t` (
  `a` bit(4) NOT NULL,
  `b` float GENERATED ALWAYS AS (`a`) VIRTUAL NOT NULL,
  KEY `on_b` (`b`)
) ENGINE=InnoDB DEFAULT CHARSET=utf8mb4 COLLATE=utf8mb4_0900_ai_ci
INSERT IGNORE INTO t (a) VALUES (0b1000);
SELECT * FROM t;
a	b
	8
DELETE FROM t;
DELETE IGNORE FROM t;
CHECK TABLE t;
Table	Op	Msg_type	Msg_text
test.t	check	status	OK
DROP TABLE t;
# Testing example of type YEAR and value 2020
SHOW CREATE TABLE t;
Table	Create Table
t	CREATE TABLE `t` (
  `a` year NOT NULL,
  `b` float GENERATED ALWAYS AS (`a`) VIRTUAL NOT NULL,
  KEY `on_b` (`b`)
) ENGINE=InnoDB DEFAULT CHARSET=utf8mb4 COLLATE=utf8mb4_0900_ai_ci
INSERT IGNORE INTO t (a) VALUES (2020);
SELECT * FROM t;
a	b
2020	2020
DELETE FROM t;
DELETE IGNORE FROM t;
CHECK TABLE t;
Table	Op	Msg_type	Msg_text
test.t	check	status	OK
DROP TABLE t;
# Testing example of type DATE and value "2030-04-05"
SHOW CREATE TABLE t;
Table	Create Table
t	CREATE TABLE `t` (
  `a` date NOT NULL,
  `b` float GENERATED ALWAYS AS (`a`) VIRTUAL NOT NULL,
  KEY `on_b` (`b`)
) ENGINE=InnoDB DEFAULT CHARSET=utf8mb4 COLLATE=utf8mb4_0900_ai_ci
INSERT IGNORE INTO t (a) VALUES ("2030-04-05");
SELECT * FROM t;
a	b
2030-04-05	20300400
DELETE FROM t;
DELETE IGNORE FROM t;
CHECK TABLE t;
Table	Op	Msg_type	Msg_text
test.t	check	status	OK
DROP TABLE t;
# Testing example of type TIME and value "11:12:13"
SHOW CREATE TABLE t;
Table	Create Table
t	CREATE TABLE `t` (
  `a` time NOT NULL,
  `b` float GENERATED ALWAYS AS (`a`) VIRTUAL NOT NULL,
  KEY `on_b` (`b`)
) ENGINE=InnoDB DEFAULT CHARSET=utf8mb4 COLLATE=utf8mb4_0900_ai_ci
INSERT IGNORE INTO t (a) VALUES ("11:12:13");
SELECT * FROM t;
a	b
11:12:13	111213
DELETE FROM t;
DELETE IGNORE FROM t;
CHECK TABLE t;
Table	Op	Msg_type	Msg_text
test.t	check	status	OK
DROP TABLE t;
# Testing example of type DATETIME and value "2030-04-05 11:12:13"
SHOW CREATE TABLE t;
Table	Create Table
t	CREATE TABLE `t` (
  `a` datetime NOT NULL,
  `b` float GENERATED ALWAYS AS (`a`) VIRTUAL NOT NULL,
  KEY `on_b` (`b`)
) ENGINE=InnoDB DEFAULT CHARSET=utf8mb4 COLLATE=utf8mb4_0900_ai_ci
INSERT IGNORE INTO t (a) VALUES ("2030-04-05 11:12:13");
SELECT * FROM t;
a	b
2030-04-05 11:12:13	20300400000000
DELETE FROM t;
DELETE IGNORE FROM t;
CHECK TABLE t;
Table	Op	Msg_type	Msg_text
test.t	check	status	OK
DROP TABLE t;
# Testing example of type TIMESTAMP and value "2030-04-05 11:12:13"
SHOW CREATE TABLE t;
Table	Create Table
t	CREATE TABLE `t` (
  `a` timestamp NOT NULL,
  `b` float GENERATED ALWAYS AS (`a`) VIRTUAL NOT NULL,
  KEY `on_b` (`b`)
) ENGINE=InnoDB DEFAULT CHARSET=utf8mb4 COLLATE=utf8mb4_0900_ai_ci
INSERT IGNORE INTO t (a) VALUES ("2030-04-05 11:12:13");
SELECT * FROM t;
a	b
2030-04-05 11:12:13	20300400000000
DELETE FROM t;
DELETE IGNORE FROM t;
CHECK TABLE t;
Table	Op	Msg_type	Msg_text
test.t	check	status	OK
DROP TABLE t;
# Testing example of type CHAR(40) and value "2000000000000000000000000000000000000"
SHOW CREATE TABLE t;
Table	Create Table
t	CREATE TABLE `t` (
  `a` char(40) NOT NULL,
  `b` float GENERATED ALWAYS AS (`a`) VIRTUAL NOT NULL,
  KEY `on_b` (`b`)
) ENGINE=InnoDB DEFAULT CHARSET=utf8mb4 COLLATE=utf8mb4_0900_ai_ci
INSERT IGNORE INTO t (a) VALUES ("2000000000000000000000000000000000000");
SELECT * FROM t;
a	b
2000000000000000000000000000000000000	2e36
DELETE FROM t;
DELETE IGNORE FROM t;
CHECK TABLE t;
Table	Op	Msg_type	Msg_text
test.t	check	status	OK
DROP TABLE t;
# Testing example of type BINARY(45) and value "200000000000000000000000000000000000000000"
SHOW CREATE TABLE t;
Table	Create Table
t	CREATE TABLE `t` (
  `a` binary(45) NOT NULL,
  `b` float GENERATED ALWAYS AS (`a`) VIRTUAL NOT NULL,
  KEY `on_b` (`b`)
) ENGINE=InnoDB DEFAULT CHARSET=utf8mb4 COLLATE=utf8mb4_0900_ai_ci
INSERT IGNORE INTO t (a) VALUES ("200000000000000000000000000000000000000000");
Warnings:
Warning	1265	Data truncated for column 'b' at row 1
Warning	1264	Out of range value for column 'b' at row 1
SELECT * FROM t;
a	b
200000000000000000000000000000000000000000   	3.40282e38
DELETE FROM t;
DELETE IGNORE FROM t;
CHECK TABLE t;
Table	Op	Msg_type	Msg_text
test.t	check	status	OK
DROP TABLE t;
# Testing example of type VARCHAR(50) and value "2000000000000000000000000000000000000000000000000"
SHOW CREATE TABLE t;
Table	Create Table
t	CREATE TABLE `t` (
  `a` varchar(50) NOT NULL,
  `b` float GENERATED ALWAYS AS (`a`) VIRTUAL NOT NULL,
  KEY `on_b` (`b`)
) ENGINE=InnoDB DEFAULT CHARSET=utf8mb4 COLLATE=utf8mb4_0900_ai_ci
INSERT IGNORE INTO t (a) VALUES ("2000000000000000000000000000000000000000000000000");
Warnings:
Warning	1264	Out of range value for column 'b' at row 1
SELECT * FROM t;
a	b
2000000000000000000000000000000000000000000000000	3.40282e38
DELETE FROM t;
DELETE IGNORE FROM t;
CHECK TABLE t;
Table	Op	Msg_type	Msg_text
test.t	check	status	OK
DROP TABLE t;
# Testing example of type CHAR(24) and value "hello beautiful world"
SHOW CREATE TABLE t;
Table	Create Table
t	CREATE TABLE `t` (
  `a` char(24) NOT NULL,
  `b` float GENERATED ALWAYS AS (`a`) VIRTUAL NOT NULL,
  KEY `on_b` (`b`)
) ENGINE=InnoDB DEFAULT CHARSET=utf8mb4 COLLATE=utf8mb4_0900_ai_ci
INSERT IGNORE INTO t (a) VALUES ("hello beautiful world");
Warnings:
Warning	1265	Data truncated for column 'b' at row 1
SELECT * FROM t;
a	b
hello beautiful world	0
DELETE FROM t;
DELETE IGNORE FROM t;
CHECK TABLE t;
Table	Op	Msg_type	Msg_text
test.t	check	status	OK
DROP TABLE t;
# Testing example of type BINARY(12) and value "hello world"
SHOW CREATE TABLE t;
Table	Create Table
t	CREATE TABLE `t` (
  `a` binary(12) NOT NULL,
  `b` float GENERATED ALWAYS AS (`a`) VIRTUAL NOT NULL,
  KEY `on_b` (`b`)
) ENGINE=InnoDB DEFAULT CHARSET=utf8mb4 COLLATE=utf8mb4_0900_ai_ci
INSERT IGNORE INTO t (a) VALUES ("hello world");
Warnings:
Warning	1265	Data truncated for column 'b' at row 1
SELECT * FROM t;
a	b
hello world 	0
DELETE FROM t;
DELETE IGNORE FROM t;
CHECK TABLE t;
Table	Op	Msg_type	Msg_text
test.t	check	status	OK
DROP TABLE t;
# Testing example of type VARCHAR(6) and value "hello"
SHOW CREATE TABLE t;
Table	Create Table
t	CREATE TABLE `t` (
  `a` varchar(6) NOT NULL,
  `b` float GENERATED ALWAYS AS (`a`) VIRTUAL NOT NULL,
  KEY `on_b` (`b`)
) ENGINE=InnoDB DEFAULT CHARSET=utf8mb4 COLLATE=utf8mb4_0900_ai_ci
INSERT IGNORE INTO t (a) VALUES ("hello");
Warnings:
Warning	1265	Data truncated for column 'b' at row 1
SELECT * FROM t;
a	b
hello	0
DELETE FROM t;
DELETE IGNORE FROM t;
CHECK TABLE t;
Table	Op	Msg_type	Msg_text
test.t	check	status	OK
DROP TABLE t;
# Testing example of type ENUM("up","down") and value "up"
SHOW CREATE TABLE t;
Table	Create Table
t	CREATE TABLE `t` (
  `a` enum('up','down') NOT NULL,
  `b` float GENERATED ALWAYS AS (`a`) VIRTUAL NOT NULL,
  KEY `on_b` (`b`)
) ENGINE=InnoDB DEFAULT CHARSET=utf8mb4 COLLATE=utf8mb4_0900_ai_ci
INSERT IGNORE INTO t (a) VALUES ("up");
SELECT * FROM t;
a	b
up	1
DELETE FROM t;
DELETE IGNORE FROM t;
CHECK TABLE t;
Table	Op	Msg_type	Msg_text
test.t	check	status	OK
DROP TABLE t;
# Testing example of type SET("up","down") and value "up,down"
SHOW CREATE TABLE t;
Table	Create Table
t	CREATE TABLE `t` (
  `a` set('up','down') NOT NULL,
  `b` float GENERATED ALWAYS AS (`a`) VIRTUAL NOT NULL,
  KEY `on_b` (`b`)
) ENGINE=InnoDB DEFAULT CHARSET=utf8mb4 COLLATE=utf8mb4_0900_ai_ci
INSERT IGNORE INTO t (a) VALUES ("up,down");
SELECT * FROM t;
a	b
up,down	3
DELETE FROM t;
DELETE IGNORE FROM t;
CHECK TABLE t;
Table	Op	Msg_type	Msg_text
test.t	check	status	OK
DROP TABLE t;
# Testing example of type GEOMETRY and value ST_GeomFromText("POINT(1 1)")
SHOW CREATE TABLE t;
Table	Create Table
t	CREATE TABLE `t` (
  `a` geometry NOT NULL,
  `b` float GENERATED ALWAYS AS (`a`) VIRTUAL NOT NULL,
  KEY `on_b` (`b`)
) ENGINE=InnoDB DEFAULT CHARSET=utf8mb4 COLLATE=utf8mb4_0900_ai_ci
INSERT IGNORE INTO t (a) VALUES (ST_GeomFromText("POINT(1 1)"));
Warnings:
Warning	1265	Data truncated for column 'b' at row 1
SELECT * FROM t;
a	b
             ð?      ð?	0
DELETE FROM t;
DELETE IGNORE FROM t;
CHECK TABLE t;
Table	Op	Msg_type	Msg_text
test.t	check	status	OK
DROP TABLE t;
# Testing example of type POINT and value ST_GeomFromText("POINT(1 1)")
SHOW CREATE TABLE t;
Table	Create Table
t	CREATE TABLE `t` (
  `a` point NOT NULL,
  `b` float GENERATED ALWAYS AS (`a`) VIRTUAL NOT NULL,
  KEY `on_b` (`b`)
) ENGINE=InnoDB DEFAULT CHARSET=utf8mb4 COLLATE=utf8mb4_0900_ai_ci
INSERT IGNORE INTO t (a) VALUES (ST_GeomFromText("POINT(1 1)"));
Warnings:
Warning	1265	Data truncated for column 'b' at row 1
SELECT * FROM t;
a	b
             ð?      ð?	0
DELETE FROM t;
DELETE IGNORE FROM t;
CHECK TABLE t;
Table	Op	Msg_type	Msg_text
test.t	check	status	OK
DROP TABLE t;
# Testing example of type LINESTRING and value ST_GeomFromText("LINESTRING(0 0,1 1,2 2)")
SHOW CREATE TABLE t;
Table	Create Table
t	CREATE TABLE `t` (
  `a` linestring NOT NULL,
  `b` float GENERATED ALWAYS AS (`a`) VIRTUAL NOT NULL,
  KEY `on_b` (`b`)
) ENGINE=InnoDB DEFAULT CHARSET=utf8mb4 COLLATE=utf8mb4_0900_ai_ci
INSERT IGNORE INTO t (a) VALUES (ST_GeomFromText("LINESTRING(0 0,1 1,2 2)"));
Warnings:
Warning	1265	Data truncated for column 'b' at row 1
SELECT * FROM t;
a	b
                                ð?      ð?       @       @	0
DELETE FROM t;
DELETE IGNORE FROM t;
CHECK TABLE t;
Table	Op	Msg_type	Msg_text
test.t	check	status	OK
DROP TABLE t;
# Testing example of type POLYGON and value ST_GeomFromText("POLYGON((0 0,1 0,1 1,0 1,0 0),(5 5,7 5,7 7,5 7,5 5))")
SHOW CREATE TABLE t;
Table	Create Table
t	CREATE TABLE `t` (
  `a` polygon NOT NULL,
  `b` float GENERATED ALWAYS AS (`a`) VIRTUAL NOT NULL,
  KEY `on_b` (`b`)
) ENGINE=InnoDB DEFAULT CHARSET=utf8mb4 COLLATE=utf8mb4_0900_ai_ci
INSERT IGNORE INTO t (a) VALUES (ST_GeomFromText("POLYGON((0 0,1 0,1 1,0 1,0 0),(5 5,7 5,7 7,5 7,5 5))"));
Warnings:
Warning	1265	Data truncated for column 'b' at row 1
SELECT * FROM t;
a	b
                                   ð?              ð?      ð?              ð?                         @      @      @      @      @      @      @      @      @      @	0
DELETE FROM t;
DELETE IGNORE FROM t;
CHECK TABLE t;
Table	Op	Msg_type	Msg_text
test.t	check	status	OK
DROP TABLE t;
#
# Testing virtual column of type DOUBLE
#
# Testing example of type JSON and value "{}"
SHOW CREATE TABLE t;
Table	Create Table
t	CREATE TABLE `t` (
  `a` json NOT NULL,
  `b` double GENERATED ALWAYS AS (`a`) VIRTUAL NOT NULL,
  KEY `on_b` (`b`)
) ENGINE=InnoDB DEFAULT CHARSET=utf8mb4 COLLATE=utf8mb4_0900_ai_ci
INSERT IGNORE INTO t (a) VALUES ("{}");
Warnings:
Warning	3156	Invalid JSON value for CAST to DOUBLE from column a at row 1
SELECT * FROM t;
a	b
{}	0
Warnings:
Warning	3156	Invalid JSON value for CAST to DOUBLE from column a at row 1
DELETE FROM t;
DELETE IGNORE FROM t;
Warnings:
Warning	3156	Invalid JSON value for CAST to DOUBLE from column a at row 1
Warning	3156	Invalid JSON value for CAST to DOUBLE from column a at row 1
CHECK TABLE t;
Table	Op	Msg_type	Msg_text
test.t	check	status	OK
DROP TABLE t;
# Testing example of type JSON and value '["hello beautiful world"]'
SHOW CREATE TABLE t;
Table	Create Table
t	CREATE TABLE `t` (
  `a` json NOT NULL,
  `b` double GENERATED ALWAYS AS (`a`) VIRTUAL NOT NULL,
  KEY `on_b` (`b`)
) ENGINE=InnoDB DEFAULT CHARSET=utf8mb4 COLLATE=utf8mb4_0900_ai_ci
INSERT IGNORE INTO t (a) VALUES ('["hello beautiful world"]');
Warnings:
Warning	3156	Invalid JSON value for CAST to DOUBLE from column a at row 1
SELECT * FROM t;
a	b
["hello beautiful world"]	0
Warnings:
Warning	3156	Invalid JSON value for CAST to DOUBLE from column a at row 1
DELETE FROM t;
DELETE IGNORE FROM t;
Warnings:
Warning	3156	Invalid JSON value for CAST to DOUBLE from column a at row 1
Warning	3156	Invalid JSON value for CAST to DOUBLE from column a at row 1
CHECK TABLE t;
Table	Op	Msg_type	Msg_text
test.t	check	status	OK
DROP TABLE t;
# Testing example of type JSON and value "-1"
SHOW CREATE TABLE t;
Table	Create Table
t	CREATE TABLE `t` (
  `a` json NOT NULL,
  `b` double GENERATED ALWAYS AS (`a`) VIRTUAL NOT NULL,
  KEY `on_b` (`b`)
) ENGINE=InnoDB DEFAULT CHARSET=utf8mb4 COLLATE=utf8mb4_0900_ai_ci
INSERT IGNORE INTO t (a) VALUES ("-1");
SELECT * FROM t;
a	b
-1	-1
DELETE FROM t;
DELETE IGNORE FROM t;
CHECK TABLE t;
Table	Op	Msg_type	Msg_text
test.t	check	status	OK
DROP TABLE t;
# Testing example of type TINYINT and value -1
SHOW CREATE TABLE t;
Table	Create Table
t	CREATE TABLE `t` (
  `a` tinyint NOT NULL,
  `b` double GENERATED ALWAYS AS (`a`) VIRTUAL NOT NULL,
  KEY `on_b` (`b`)
) ENGINE=InnoDB DEFAULT CHARSET=utf8mb4 COLLATE=utf8mb4_0900_ai_ci
INSERT IGNORE INTO t (a) VALUES (-1);
SELECT * FROM t;
a	b
-1	-1
DELETE FROM t;
DELETE IGNORE FROM t;
CHECK TABLE t;
Table	Op	Msg_type	Msg_text
test.t	check	status	OK
DROP TABLE t;
# Testing example of type SMALLINT and value -1
SHOW CREATE TABLE t;
Table	Create Table
t	CREATE TABLE `t` (
  `a` smallint NOT NULL,
  `b` double GENERATED ALWAYS AS (`a`) VIRTUAL NOT NULL,
  KEY `on_b` (`b`)
) ENGINE=InnoDB DEFAULT CHARSET=utf8mb4 COLLATE=utf8mb4_0900_ai_ci
INSERT IGNORE INTO t (a) VALUES (-1);
SELECT * FROM t;
a	b
-1	-1
DELETE FROM t;
DELETE IGNORE FROM t;
CHECK TABLE t;
Table	Op	Msg_type	Msg_text
test.t	check	status	OK
DROP TABLE t;
# Testing example of type MEDIUMINT and value -1
SHOW CREATE TABLE t;
Table	Create Table
t	CREATE TABLE `t` (
  `a` mediumint NOT NULL,
  `b` double GENERATED ALWAYS AS (`a`) VIRTUAL NOT NULL,
  KEY `on_b` (`b`)
) ENGINE=InnoDB DEFAULT CHARSET=utf8mb4 COLLATE=utf8mb4_0900_ai_ci
INSERT IGNORE INTO t (a) VALUES (-1);
SELECT * FROM t;
a	b
-1	-1
DELETE FROM t;
DELETE IGNORE FROM t;
CHECK TABLE t;
Table	Op	Msg_type	Msg_text
test.t	check	status	OK
DROP TABLE t;
# Testing example of type INT and value 2000000000
SHOW CREATE TABLE t;
Table	Create Table
t	CREATE TABLE `t` (
  `a` int NOT NULL,
  `b` double GENERATED ALWAYS AS (`a`) VIRTUAL NOT NULL,
  KEY `on_b` (`b`)
) ENGINE=InnoDB DEFAULT CHARSET=utf8mb4 COLLATE=utf8mb4_0900_ai_ci
INSERT IGNORE INTO t (a) VALUES (2000000000);
SELECT * FROM t;
a	b
2000000000	2000000000
DELETE FROM t;
DELETE IGNORE FROM t;
CHECK TABLE t;
Table	Op	Msg_type	Msg_text
test.t	check	status	OK
DROP TABLE t;
# Testing example of type INT and value -2000000000
SHOW CREATE TABLE t;
Table	Create Table
t	CREATE TABLE `t` (
  `a` int NOT NULL,
  `b` double GENERATED ALWAYS AS (`a`) VIRTUAL NOT NULL,
  KEY `on_b` (`b`)
) ENGINE=InnoDB DEFAULT CHARSET=utf8mb4 COLLATE=utf8mb4_0900_ai_ci
INSERT IGNORE INTO t (a) VALUES (-2000000000);
SELECT * FROM t;
a	b
-2000000000	-2000000000
DELETE FROM t;
DELETE IGNORE FROM t;
CHECK TABLE t;
Table	Op	Msg_type	Msg_text
test.t	check	status	OK
DROP TABLE t;
# Testing example of type INT UNSIGNED and value 4000000000
SHOW CREATE TABLE t;
Table	Create Table
t	CREATE TABLE `t` (
  `a` int unsigned NOT NULL,
  `b` double GENERATED ALWAYS AS (`a`) VIRTUAL NOT NULL,
  KEY `on_b` (`b`)
) ENGINE=InnoDB DEFAULT CHARSET=utf8mb4 COLLATE=utf8mb4_0900_ai_ci
INSERT IGNORE INTO t (a) VALUES (4000000000);
SELECT * FROM t;
a	b
4000000000	4000000000
DELETE FROM t;
DELETE IGNORE FROM t;
CHECK TABLE t;
Table	Op	Msg_type	Msg_text
test.t	check	status	OK
DROP TABLE t;
# Testing example of type BIGINT and value 2000000000000000000
SHOW CREATE TABLE t;
Table	Create Table
t	CREATE TABLE `t` (
  `a` bigint NOT NULL,
  `b` double GENERATED ALWAYS AS (`a`) VIRTUAL NOT NULL,
  KEY `on_b` (`b`)
) ENGINE=InnoDB DEFAULT CHARSET=utf8mb4 COLLATE=utf8mb4_0900_ai_ci
INSERT IGNORE INTO t (a) VALUES (2000000000000000000);
SELECT * FROM t;
a	b
2000000000000000000	2e18
DELETE FROM t;
DELETE IGNORE FROM t;
CHECK TABLE t;
Table	Op	Msg_type	Msg_text
test.t	check	status	OK
DROP TABLE t;
# Testing example of type BIGINT and value -2000000000000000000
SHOW CREATE TABLE t;
Table	Create Table
t	CREATE TABLE `t` (
  `a` bigint NOT NULL,
  `b` double GENERATED ALWAYS AS (`a`) VIRTUAL NOT NULL,
  KEY `on_b` (`b`)
) ENGINE=InnoDB DEFAULT CHARSET=utf8mb4 COLLATE=utf8mb4_0900_ai_ci
INSERT IGNORE INTO t (a) VALUES (-2000000000000000000);
SELECT * FROM t;
a	b
-2000000000000000000	-2e18
DELETE FROM t;
DELETE IGNORE FROM t;
CHECK TABLE t;
Table	Op	Msg_type	Msg_text
test.t	check	status	OK
DROP TABLE t;
# Testing example of type FLOAT and value -1.23456
SHOW CREATE TABLE t;
Table	Create Table
t	CREATE TABLE `t` (
  `a` float NOT NULL,
  `b` double GENERATED ALWAYS AS (`a`) VIRTUAL NOT NULL,
  KEY `on_b` (`b`)
) ENGINE=InnoDB DEFAULT CHARSET=utf8mb4 COLLATE=utf8mb4_0900_ai_ci
INSERT IGNORE INTO t (a) VALUES (-1.23456);
SELECT * FROM t;
a	b
-1.23456	-1.2345600128173828
DELETE FROM t;
DELETE IGNORE FROM t;
CHECK TABLE t;
Table	Op	Msg_type	Msg_text
test.t	check	status	OK
DROP TABLE t;
# Testing example of type FLOAT and value -1e38
SHOW CREATE TABLE t;
Table	Create Table
t	CREATE TABLE `t` (
  `a` float NOT NULL,
  `b` double GENERATED ALWAYS AS (`a`) VIRTUAL NOT NULL,
  KEY `on_b` (`b`)
) ENGINE=InnoDB DEFAULT CHARSET=utf8mb4 COLLATE=utf8mb4_0900_ai_ci
INSERT IGNORE INTO t (a) VALUES (-1e38);
SELECT * FROM t;
a	b
-1e38	-9.999999680285692e37
DELETE FROM t;
DELETE IGNORE FROM t;
CHECK TABLE t;
Table	Op	Msg_type	Msg_text
test.t	check	status	OK
DROP TABLE t;
# Testing example of type FLOAT and value 1e38
SHOW CREATE TABLE t;
Table	Create Table
t	CREATE TABLE `t` (
  `a` float NOT NULL,
  `b` double GENERATED ALWAYS AS (`a`) VIRTUAL NOT NULL,
  KEY `on_b` (`b`)
) ENGINE=InnoDB DEFAULT CHARSET=utf8mb4 COLLATE=utf8mb4_0900_ai_ci
INSERT IGNORE INTO t (a) VALUES (1e38);
SELECT * FROM t;
a	b
1e38	9.999999680285692e37
DELETE FROM t;
DELETE IGNORE FROM t;
CHECK TABLE t;
Table	Op	Msg_type	Msg_text
test.t	check	status	OK
DROP TABLE t;
# Testing example of type DOUBLE and value -1.23456789012345
SHOW CREATE TABLE t;
Table	Create Table
t	CREATE TABLE `t` (
  `a` double NOT NULL,
  `b` double GENERATED ALWAYS AS (`a`) VIRTUAL NOT NULL,
  KEY `on_b` (`b`)
) ENGINE=InnoDB DEFAULT CHARSET=utf8mb4 COLLATE=utf8mb4_0900_ai_ci
INSERT IGNORE INTO t (a) VALUES (-1.23456789012345);
SELECT * FROM t;
a	b
-1.23456789012345	-1.23456789012345
DELETE FROM t;
DELETE IGNORE FROM t;
CHECK TABLE t;
Table	Op	Msg_type	Msg_text
test.t	check	status	OK
DROP TABLE t;
# Testing example of type DOUBLE and value 1.23456789012345
SHOW CREATE TABLE t;
Table	Create Table
t	CREATE TABLE `t` (
  `a` double NOT NULL,
  `b` double GENERATED ALWAYS AS (`a`) VIRTUAL NOT NULL,
  KEY `on_b` (`b`)
) ENGINE=InnoDB DEFAULT CHARSET=utf8mb4 COLLATE=utf8mb4_0900_ai_ci
INSERT IGNORE INTO t (a) VALUES (1.23456789012345);
SELECT * FROM t;
a	b
1.23456789012345	1.23456789012345
DELETE FROM t;
DELETE IGNORE FROM t;
CHECK TABLE t;
Table	Op	Msg_type	Msg_text
test.t	check	status	OK
DROP TABLE t;
# Testing example of type DOUBLE and value -1e300
SHOW CREATE TABLE t;
Table	Create Table
t	CREATE TABLE `t` (
  `a` double NOT NULL,
  `b` double GENERATED ALWAYS AS (`a`) VIRTUAL NOT NULL,
  KEY `on_b` (`b`)
) ENGINE=InnoDB DEFAULT CHARSET=utf8mb4 COLLATE=utf8mb4_0900_ai_ci
INSERT IGNORE INTO t (a) VALUES (-1e300);
SELECT * FROM t;
a	b
-1e300	-1e300
DELETE FROM t;
DELETE IGNORE FROM t;
CHECK TABLE t;
Table	Op	Msg_type	Msg_text
test.t	check	status	OK
DROP TABLE t;
# Testing example of type DOUBLE and value 1e300
SHOW CREATE TABLE t;
Table	Create Table
t	CREATE TABLE `t` (
  `a` double NOT NULL,
  `b` double GENERATED ALWAYS AS (`a`) VIRTUAL NOT NULL,
  KEY `on_b` (`b`)
) ENGINE=InnoDB DEFAULT CHARSET=utf8mb4 COLLATE=utf8mb4_0900_ai_ci
INSERT IGNORE INTO t (a) VALUES (1e300);
SELECT * FROM t;
a	b
1e300	1e300
DELETE FROM t;
DELETE IGNORE FROM t;
CHECK TABLE t;
Table	Op	Msg_type	Msg_text
test.t	check	status	OK
DROP TABLE t;
# Testing example of type DECIMAL(4,2) and value -10.99
SHOW CREATE TABLE t;
Table	Create Table
t	CREATE TABLE `t` (
  `a` decimal(4,2) NOT NULL,
  `b` double GENERATED ALWAYS AS (`a`) VIRTUAL NOT NULL,
  KEY `on_b` (`b`)
) ENGINE=InnoDB DEFAULT CHARSET=utf8mb4 COLLATE=utf8mb4_0900_ai_ci
INSERT IGNORE INTO t (a) VALUES (-10.99);
SELECT * FROM t;
a	b
-10.99	-10.99
DELETE FROM t;
DELETE IGNORE FROM t;
CHECK TABLE t;
Table	Op	Msg_type	Msg_text
test.t	check	status	OK
DROP TABLE t;
# Testing example of type DECIMAL(34,4) and value 20000000000000000000000000000.0001
SHOW CREATE TABLE t;
Table	Create Table
t	CREATE TABLE `t` (
  `a` decimal(34,4) NOT NULL,
  `b` double GENERATED ALWAYS AS (`a`) VIRTUAL NOT NULL,
  KEY `on_b` (`b`)
) ENGINE=InnoDB DEFAULT CHARSET=utf8mb4 COLLATE=utf8mb4_0900_ai_ci
INSERT IGNORE INTO t (a) VALUES (20000000000000000000000000000.0001);
SELECT * FROM t;
a	b
20000000000000000000000000000.0001	2e28
DELETE FROM t;
DELETE IGNORE FROM t;
CHECK TABLE t;
Table	Op	Msg_type	Msg_text
test.t	check	status	OK
DROP TABLE t;
# Testing example of type DECIMAL(34,4) and value -20000000000000000000000000000.0001
SHOW CREATE TABLE t;
Table	Create Table
t	CREATE TABLE `t` (
  `a` decimal(34,4) NOT NULL,
  `b` double GENERATED ALWAYS AS (`a`) VIRTUAL NOT NULL,
  KEY `on_b` (`b`)
) ENGINE=InnoDB DEFAULT CHARSET=utf8mb4 COLLATE=utf8mb4_0900_ai_ci
INSERT IGNORE INTO t (a) VALUES (-20000000000000000000000000000.0001);
SELECT * FROM t;
a	b
-20000000000000000000000000000.0001	-2e28
DELETE FROM t;
DELETE IGNORE FROM t;
CHECK TABLE t;
Table	Op	Msg_type	Msg_text
test.t	check	status	OK
DROP TABLE t;
# Testing example of type BIT(64) and value 0xDEADBEEFC0FEBABE
SHOW CREATE TABLE t;
Table	Create Table
t	CREATE TABLE `t` (
  `a` bit(64) NOT NULL,
  `b` double GENERATED ALWAYS AS (`a`) VIRTUAL NOT NULL,
  KEY `on_b` (`b`)
) ENGINE=InnoDB DEFAULT CHARSET=utf8mb4 COLLATE=utf8mb4_0900_ai_ci
INSERT IGNORE INTO t (a) VALUES (0xDEADBEEFC0FEBABE);
SELECT * FROM t;
a	b
Þ­¾ïÀþº¾	1.6045690984335325e19
DELETE FROM t;
DELETE IGNORE FROM t;
CHECK TABLE t;
Table	Op	Msg_type	Msg_text
test.t	check	status	OK
DROP TABLE t;
# Testing example of type BIT(4) and value 0b1000
SHOW CREATE TABLE t;
Table	Create Table
t	CREATE TABLE `t` (
  `a` bit(4) NOT NULL,
  `b` double GENERATED ALWAYS AS (`a`) VIRTUAL NOT NULL,
  KEY `on_b` (`b`)
) ENGINE=InnoDB DEFAULT CHARSET=utf8mb4 COLLATE=utf8mb4_0900_ai_ci
INSERT IGNORE INTO t (a) VALUES (0b1000);
SELECT * FROM t;
a	b
	8
DELETE FROM t;
DELETE IGNORE FROM t;
CHECK TABLE t;
Table	Op	Msg_type	Msg_text
test.t	check	status	OK
DROP TABLE t;
# Testing example of type YEAR and value 2020
SHOW CREATE TABLE t;
Table	Create Table
t	CREATE TABLE `t` (
  `a` year NOT NULL,
  `b` double GENERATED ALWAYS AS (`a`) VIRTUAL NOT NULL,
  KEY `on_b` (`b`)
) ENGINE=InnoDB DEFAULT CHARSET=utf8mb4 COLLATE=utf8mb4_0900_ai_ci
INSERT IGNORE INTO t (a) VALUES (2020);
SELECT * FROM t;
a	b
2020	2020
DELETE FROM t;
DELETE IGNORE FROM t;
CHECK TABLE t;
Table	Op	Msg_type	Msg_text
test.t	check	status	OK
DROP TABLE t;
# Testing example of type DATE and value "2030-04-05"
SHOW CREATE TABLE t;
Table	Create Table
t	CREATE TABLE `t` (
  `a` date NOT NULL,
  `b` double GENERATED ALWAYS AS (`a`) VIRTUAL NOT NULL,
  KEY `on_b` (`b`)
) ENGINE=InnoDB DEFAULT CHARSET=utf8mb4 COLLATE=utf8mb4_0900_ai_ci
INSERT IGNORE INTO t (a) VALUES ("2030-04-05");
SELECT * FROM t;
a	b
2030-04-05	20300405
DELETE FROM t;
DELETE IGNORE FROM t;
CHECK TABLE t;
Table	Op	Msg_type	Msg_text
test.t	check	status	OK
DROP TABLE t;
# Testing example of type TIME and value "11:12:13"
SHOW CREATE TABLE t;
Table	Create Table
t	CREATE TABLE `t` (
  `a` time NOT NULL,
  `b` double GENERATED ALWAYS AS (`a`) VIRTUAL NOT NULL,
  KEY `on_b` (`b`)
) ENGINE=InnoDB DEFAULT CHARSET=utf8mb4 COLLATE=utf8mb4_0900_ai_ci
INSERT IGNORE INTO t (a) VALUES ("11:12:13");
SELECT * FROM t;
a	b
11:12:13	111213
DELETE FROM t;
DELETE IGNORE FROM t;
CHECK TABLE t;
Table	Op	Msg_type	Msg_text
test.t	check	status	OK
DROP TABLE t;
# Testing example of type DATETIME and value "2030-04-05 11:12:13"
SHOW CREATE TABLE t;
Table	Create Table
t	CREATE TABLE `t` (
  `a` datetime NOT NULL,
  `b` double GENERATED ALWAYS AS (`a`) VIRTUAL NOT NULL,
  KEY `on_b` (`b`)
) ENGINE=InnoDB DEFAULT CHARSET=utf8mb4 COLLATE=utf8mb4_0900_ai_ci
INSERT IGNORE INTO t (a) VALUES ("2030-04-05 11:12:13");
SELECT * FROM t;
a	b
2030-04-05 11:12:13	20300405111213
DELETE FROM t;
DELETE IGNORE FROM t;
CHECK TABLE t;
Table	Op	Msg_type	Msg_text
test.t	check	status	OK
DROP TABLE t;
# Testing example of type TIMESTAMP and value "2030-04-05 11:12:13"
SHOW CREATE TABLE t;
Table	Create Table
t	CREATE TABLE `t` (
  `a` timestamp NOT NULL,
  `b` double GENERATED ALWAYS AS (`a`) VIRTUAL NOT NULL,
  KEY `on_b` (`b`)
) ENGINE=InnoDB DEFAULT CHARSET=utf8mb4 COLLATE=utf8mb4_0900_ai_ci
INSERT IGNORE INTO t (a) VALUES ("2030-04-05 11:12:13");
SELECT * FROM t;
a	b
2030-04-05 11:12:13	20300405111213
DELETE FROM t;
DELETE IGNORE FROM t;
CHECK TABLE t;
Table	Op	Msg_type	Msg_text
test.t	check	status	OK
DROP TABLE t;
# Testing example of type CHAR(40) and value "2000000000000000000000000000000000000"
SHOW CREATE TABLE t;
Table	Create Table
t	CREATE TABLE `t` (
  `a` char(40) NOT NULL,
  `b` double GENERATED ALWAYS AS (`a`) VIRTUAL NOT NULL,
  KEY `on_b` (`b`)
) ENGINE=InnoDB DEFAULT CHARSET=utf8mb4 COLLATE=utf8mb4_0900_ai_ci
INSERT IGNORE INTO t (a) VALUES ("2000000000000000000000000000000000000");
SELECT * FROM t;
a	b
2000000000000000000000000000000000000	2e36
DELETE FROM t;
DELETE IGNORE FROM t;
CHECK TABLE t;
Table	Op	Msg_type	Msg_text
test.t	check	status	OK
DROP TABLE t;
# Testing example of type BINARY(45) and value "200000000000000000000000000000000000000000"
SHOW CREATE TABLE t;
Table	Create Table
t	CREATE TABLE `t` (
  `a` binary(45) NOT NULL,
  `b` double GENERATED ALWAYS AS (`a`) VIRTUAL NOT NULL,
  KEY `on_b` (`b`)
) ENGINE=InnoDB DEFAULT CHARSET=utf8mb4 COLLATE=utf8mb4_0900_ai_ci
INSERT IGNORE INTO t (a) VALUES ("200000000000000000000000000000000000000000");
Warnings:
Warning	1265	Data truncated for column 'b' at row 1
SELECT * FROM t;
a	b
200000000000000000000000000000000000000000   	2e41
DELETE FROM t;
DELETE IGNORE FROM t;
CHECK TABLE t;
Table	Op	Msg_type	Msg_text
test.t	check	status	OK
DROP TABLE t;
# Testing example of type VARCHAR(50) and value "2000000000000000000000000000000000000000000000000"
SHOW CREATE TABLE t;
Table	Create Table
t	CREATE TABLE `t` (
  `a` varchar(50) NOT NULL,
  `b` double GENERATED ALWAYS AS (`a`) VIRTUAL NOT NULL,
  KEY `on_b` (`b`)
) ENGINE=InnoDB DEFAULT CHARSET=utf8mb4 COLLATE=utf8mb4_0900_ai_ci
INSERT IGNORE INTO t (a) VALUES ("2000000000000000000000000000000000000000000000000");
SELECT * FROM t;
a	b
2000000000000000000000000000000000000000000000000	2e48
DELETE FROM t;
DELETE IGNORE FROM t;
CHECK TABLE t;
Table	Op	Msg_type	Msg_text
test.t	check	status	OK
DROP TABLE t;
# Testing example of type CHAR(24) and value "hello beautiful world"
SHOW CREATE TABLE t;
Table	Create Table
t	CREATE TABLE `t` (
  `a` char(24) NOT NULL,
  `b` double GENERATED ALWAYS AS (`a`) VIRTUAL NOT NULL,
  KEY `on_b` (`b`)
) ENGINE=InnoDB DEFAULT CHARSET=utf8mb4 COLLATE=utf8mb4_0900_ai_ci
INSERT IGNORE INTO t (a) VALUES ("hello beautiful world");
Warnings:
Warning	1265	Data truncated for column 'b' at row 1
SELECT * FROM t;
a	b
hello beautiful world	0
DELETE FROM t;
DELETE IGNORE FROM t;
CHECK TABLE t;
Table	Op	Msg_type	Msg_text
test.t	check	status	OK
DROP TABLE t;
# Testing example of type BINARY(12) and value "hello world"
SHOW CREATE TABLE t;
Table	Create Table
t	CREATE TABLE `t` (
  `a` binary(12) NOT NULL,
  `b` double GENERATED ALWAYS AS (`a`) VIRTUAL NOT NULL,
  KEY `on_b` (`b`)
) ENGINE=InnoDB DEFAULT CHARSET=utf8mb4 COLLATE=utf8mb4_0900_ai_ci
INSERT IGNORE INTO t (a) VALUES ("hello world");
Warnings:
Warning	1265	Data truncated for column 'b' at row 1
SELECT * FROM t;
a	b
hello world 	0
DELETE FROM t;
DELETE IGNORE FROM t;
CHECK TABLE t;
Table	Op	Msg_type	Msg_text
test.t	check	status	OK
DROP TABLE t;
# Testing example of type VARCHAR(6) and value "hello"
SHOW CREATE TABLE t;
Table	Create Table
t	CREATE TABLE `t` (
  `a` varchar(6) NOT NULL,
  `b` double GENERATED ALWAYS AS (`a`) VIRTUAL NOT NULL,
  KEY `on_b` (`b`)
) ENGINE=InnoDB DEFAULT CHARSET=utf8mb4 COLLATE=utf8mb4_0900_ai_ci
INSERT IGNORE INTO t (a) VALUES ("hello");
Warnings:
Warning	1265	Data truncated for column 'b' at row 1
SELECT * FROM t;
a	b
hello	0
DELETE FROM t;
DELETE IGNORE FROM t;
CHECK TABLE t;
Table	Op	Msg_type	Msg_text
test.t	check	status	OK
DROP TABLE t;
# Testing example of type ENUM("up","down") and value "up"
SHOW CREATE TABLE t;
Table	Create Table
t	CREATE TABLE `t` (
  `a` enum('up','down') NOT NULL,
  `b` double GENERATED ALWAYS AS (`a`) VIRTUAL NOT NULL,
  KEY `on_b` (`b`)
) ENGINE=InnoDB DEFAULT CHARSET=utf8mb4 COLLATE=utf8mb4_0900_ai_ci
INSERT IGNORE INTO t (a) VALUES ("up");
SELECT * FROM t;
a	b
up	1
DELETE FROM t;
DELETE IGNORE FROM t;
CHECK TABLE t;
Table	Op	Msg_type	Msg_text
test.t	check	status	OK
DROP TABLE t;
# Testing example of type SET("up","down") and value "up,down"
SHOW CREATE TABLE t;
Table	Create Table
t	CREATE TABLE `t` (
  `a` set('up','down') NOT NULL,
  `b` double GENERATED ALWAYS AS (`a`) VIRTUAL NOT NULL,
  KEY `on_b` (`b`)
) ENGINE=InnoDB DEFAULT CHARSET=utf8mb4 COLLATE=utf8mb4_0900_ai_ci
INSERT IGNORE INTO t (a) VALUES ("up,down");
SELECT * FROM t;
a	b
up,down	3
DELETE FROM t;
DELETE IGNORE FROM t;
CHECK TABLE t;
Table	Op	Msg_type	Msg_text
test.t	check	status	OK
DROP TABLE t;
# Testing example of type GEOMETRY and value ST_GeomFromText("POINT(1 1)")
SHOW CREATE TABLE t;
Table	Create Table
t	CREATE TABLE `t` (
  `a` geometry NOT NULL,
  `b` double GENERATED ALWAYS AS (`a`) VIRTUAL NOT NULL,
  KEY `on_b` (`b`)
) ENGINE=InnoDB DEFAULT CHARSET=utf8mb4 COLLATE=utf8mb4_0900_ai_ci
INSERT IGNORE INTO t (a) VALUES (ST_GeomFromText("POINT(1 1)"));
Warnings:
Warning	1265	Data truncated for column 'b' at row 1
SELECT * FROM t;
a	b
             ð?      ð?	0
DELETE FROM t;
DELETE IGNORE FROM t;
CHECK TABLE t;
Table	Op	Msg_type	Msg_text
test.t	check	status	OK
DROP TABLE t;
# Testing example of type POINT and value ST_GeomFromText("POINT(1 1)")
SHOW CREATE TABLE t;
Table	Create Table
t	CREATE TABLE `t` (
  `a` point NOT NULL,
  `b` double GENERATED ALWAYS AS (`a`) VIRTUAL NOT NULL,
  KEY `on_b` (`b`)
) ENGINE=InnoDB DEFAULT CHARSET=utf8mb4 COLLATE=utf8mb4_0900_ai_ci
INSERT IGNORE INTO t (a) VALUES (ST_GeomFromText("POINT(1 1)"));
Warnings:
Warning	1265	Data truncated for column 'b' at row 1
SELECT * FROM t;
a	b
             ð?      ð?	0
DELETE FROM t;
DELETE IGNORE FROM t;
CHECK TABLE t;
Table	Op	Msg_type	Msg_text
test.t	check	status	OK
DROP TABLE t;
# Testing example of type LINESTRING and value ST_GeomFromText("LINESTRING(0 0,1 1,2 2)")
SHOW CREATE TABLE t;
Table	Create Table
t	CREATE TABLE `t` (
  `a` linestring NOT NULL,
  `b` double GENERATED ALWAYS AS (`a`) VIRTUAL NOT NULL,
  KEY `on_b` (`b`)
) ENGINE=InnoDB DEFAULT CHARSET=utf8mb4 COLLATE=utf8mb4_0900_ai_ci
INSERT IGNORE INTO t (a) VALUES (ST_GeomFromText("LINESTRING(0 0,1 1,2 2)"));
Warnings:
Warning	1265	Data truncated for column 'b' at row 1
SELECT * FROM t;
a	b
                                ð?      ð?       @       @	0
DELETE FROM t;
DELETE IGNORE FROM t;
CHECK TABLE t;
Table	Op	Msg_type	Msg_text
test.t	check	status	OK
DROP TABLE t;
# Testing example of type POLYGON and value ST_GeomFromText("POLYGON((0 0,1 0,1 1,0 1,0 0),(5 5,7 5,7 7,5 7,5 5))")
SHOW CREATE TABLE t;
Table	Create Table
t	CREATE TABLE `t` (
  `a` polygon NOT NULL,
  `b` double GENERATED ALWAYS AS (`a`) VIRTUAL NOT NULL,
  KEY `on_b` (`b`)
) ENGINE=InnoDB DEFAULT CHARSET=utf8mb4 COLLATE=utf8mb4_0900_ai_ci
INSERT IGNORE INTO t (a) VALUES (ST_GeomFromText("POLYGON((0 0,1 0,1 1,0 1,0 0),(5 5,7 5,7 7,5 7,5 5))"));
Warnings:
Warning	1265	Data truncated for column 'b' at row 1
SELECT * FROM t;
a	b
                                   ð?              ð?      ð?              ð?                         @      @      @      @      @      @      @      @      @      @	0
DELETE FROM t;
DELETE IGNORE FROM t;
CHECK TABLE t;
Table	Op	Msg_type	Msg_text
test.t	check	status	OK
DROP TABLE t;
#
# Testing virtual column of type DECIMAL(4,2)
#
# Testing example of type JSON and value "{}"
SHOW CREATE TABLE t;
Table	Create Table
t	CREATE TABLE `t` (
  `a` json NOT NULL,
  `b` decimal(4,2) GENERATED ALWAYS AS (`a`) VIRTUAL NOT NULL,
  KEY `on_b` (`b`)
) ENGINE=InnoDB DEFAULT CHARSET=utf8mb4 COLLATE=utf8mb4_0900_ai_ci
INSERT IGNORE INTO t (a) VALUES ("{}");
Warnings:
Warning	3156	Invalid JSON value for CAST to DECIMAL from column a at row 1
SELECT * FROM t;
a	b
{}	0.00
Warnings:
Warning	3156	Invalid JSON value for CAST to DECIMAL from column a at row 1
DELETE FROM t;
DELETE IGNORE FROM t;
Warnings:
Warning	3156	Invalid JSON value for CAST to DECIMAL from column a at row 1
Warning	3156	Invalid JSON value for CAST to DECIMAL from column a at row 1
CHECK TABLE t;
Table	Op	Msg_type	Msg_text
test.t	check	status	OK
DROP TABLE t;
# Testing example of type JSON and value '["hello beautiful world"]'
SHOW CREATE TABLE t;
Table	Create Table
t	CREATE TABLE `t` (
  `a` json NOT NULL,
  `b` decimal(4,2) GENERATED ALWAYS AS (`a`) VIRTUAL NOT NULL,
  KEY `on_b` (`b`)
) ENGINE=InnoDB DEFAULT CHARSET=utf8mb4 COLLATE=utf8mb4_0900_ai_ci
INSERT IGNORE INTO t (a) VALUES ('["hello beautiful world"]');
Warnings:
Warning	3156	Invalid JSON value for CAST to DECIMAL from column a at row 1
SELECT * FROM t;
a	b
["hello beautiful world"]	0.00
Warnings:
Warning	3156	Invalid JSON value for CAST to DECIMAL from column a at row 1
DELETE FROM t;
DELETE IGNORE FROM t;
Warnings:
Warning	3156	Invalid JSON value for CAST to DECIMAL from column a at row 1
Warning	3156	Invalid JSON value for CAST to DECIMAL from column a at row 1
CHECK TABLE t;
Table	Op	Msg_type	Msg_text
test.t	check	status	OK
DROP TABLE t;
# Testing example of type JSON and value "-1"
SHOW CREATE TABLE t;
Table	Create Table
t	CREATE TABLE `t` (
  `a` json NOT NULL,
  `b` decimal(4,2) GENERATED ALWAYS AS (`a`) VIRTUAL NOT NULL,
  KEY `on_b` (`b`)
) ENGINE=InnoDB DEFAULT CHARSET=utf8mb4 COLLATE=utf8mb4_0900_ai_ci
INSERT IGNORE INTO t (a) VALUES ("-1");
SELECT * FROM t;
a	b
-1	-1.00
DELETE FROM t;
DELETE IGNORE FROM t;
CHECK TABLE t;
Table	Op	Msg_type	Msg_text
test.t	check	status	OK
DROP TABLE t;
# Testing example of type TINYINT and value -1
SHOW CREATE TABLE t;
Table	Create Table
t	CREATE TABLE `t` (
  `a` tinyint NOT NULL,
  `b` decimal(4,2) GENERATED ALWAYS AS (`a`) VIRTUAL NOT NULL,
  KEY `on_b` (`b`)
) ENGINE=InnoDB DEFAULT CHARSET=utf8mb4 COLLATE=utf8mb4_0900_ai_ci
INSERT IGNORE INTO t (a) VALUES (-1);
SELECT * FROM t;
a	b
-1	-1.00
DELETE FROM t;
DELETE IGNORE FROM t;
CHECK TABLE t;
Table	Op	Msg_type	Msg_text
test.t	check	status	OK
DROP TABLE t;
# Testing example of type SMALLINT and value -1
SHOW CREATE TABLE t;
Table	Create Table
t	CREATE TABLE `t` (
  `a` smallint NOT NULL,
  `b` decimal(4,2) GENERATED ALWAYS AS (`a`) VIRTUAL NOT NULL,
  KEY `on_b` (`b`)
) ENGINE=InnoDB DEFAULT CHARSET=utf8mb4 COLLATE=utf8mb4_0900_ai_ci
INSERT IGNORE INTO t (a) VALUES (-1);
SELECT * FROM t;
a	b
-1	-1.00
DELETE FROM t;
DELETE IGNORE FROM t;
CHECK TABLE t;
Table	Op	Msg_type	Msg_text
test.t	check	status	OK
DROP TABLE t;
# Testing example of type MEDIUMINT and value -1
SHOW CREATE TABLE t;
Table	Create Table
t	CREATE TABLE `t` (
  `a` mediumint NOT NULL,
  `b` decimal(4,2) GENERATED ALWAYS AS (`a`) VIRTUAL NOT NULL,
  KEY `on_b` (`b`)
) ENGINE=InnoDB DEFAULT CHARSET=utf8mb4 COLLATE=utf8mb4_0900_ai_ci
INSERT IGNORE INTO t (a) VALUES (-1);
SELECT * FROM t;
a	b
-1	-1.00
DELETE FROM t;
DELETE IGNORE FROM t;
CHECK TABLE t;
Table	Op	Msg_type	Msg_text
test.t	check	status	OK
DROP TABLE t;
# Testing example of type INT and value 2000000000
SHOW CREATE TABLE t;
Table	Create Table
t	CREATE TABLE `t` (
  `a` int NOT NULL,
  `b` decimal(4,2) GENERATED ALWAYS AS (`a`) VIRTUAL NOT NULL,
  KEY `on_b` (`b`)
) ENGINE=InnoDB DEFAULT CHARSET=utf8mb4 COLLATE=utf8mb4_0900_ai_ci
INSERT IGNORE INTO t (a) VALUES (2000000000);
Warnings:
Warning	1264	Out of range value for column 'b' at row 1
SELECT * FROM t;
a	b
2000000000	99.99
DELETE FROM t;
DELETE IGNORE FROM t;
CHECK TABLE t;
Table	Op	Msg_type	Msg_text
test.t	check	status	OK
DROP TABLE t;
# Testing example of type INT and value -2000000000
SHOW CREATE TABLE t;
Table	Create Table
t	CREATE TABLE `t` (
  `a` int NOT NULL,
  `b` decimal(4,2) GENERATED ALWAYS AS (`a`) VIRTUAL NOT NULL,
  KEY `on_b` (`b`)
) ENGINE=InnoDB DEFAULT CHARSET=utf8mb4 COLLATE=utf8mb4_0900_ai_ci
INSERT IGNORE INTO t (a) VALUES (-2000000000);
Warnings:
Warning	1264	Out of range value for column 'b' at row 1
SELECT * FROM t;
a	b
-2000000000	-99.99
DELETE FROM t;
DELETE IGNORE FROM t;
CHECK TABLE t;
Table	Op	Msg_type	Msg_text
test.t	check	status	OK
DROP TABLE t;
# Testing example of type INT UNSIGNED and value 4000000000
SHOW CREATE TABLE t;
Table	Create Table
t	CREATE TABLE `t` (
  `a` int unsigned NOT NULL,
  `b` decimal(4,2) GENERATED ALWAYS AS (`a`) VIRTUAL NOT NULL,
  KEY `on_b` (`b`)
) ENGINE=InnoDB DEFAULT CHARSET=utf8mb4 COLLATE=utf8mb4_0900_ai_ci
INSERT IGNORE INTO t (a) VALUES (4000000000);
Warnings:
Warning	1264	Out of range value for column 'b' at row 1
SELECT * FROM t;
a	b
4000000000	99.99
DELETE FROM t;
DELETE IGNORE FROM t;
CHECK TABLE t;
Table	Op	Msg_type	Msg_text
test.t	check	status	OK
DROP TABLE t;
# Testing example of type BIGINT and value 2000000000000000000
SHOW CREATE TABLE t;
Table	Create Table
t	CREATE TABLE `t` (
  `a` bigint NOT NULL,
  `b` decimal(4,2) GENERATED ALWAYS AS (`a`) VIRTUAL NOT NULL,
  KEY `on_b` (`b`)
) ENGINE=InnoDB DEFAULT CHARSET=utf8mb4 COLLATE=utf8mb4_0900_ai_ci
INSERT IGNORE INTO t (a) VALUES (2000000000000000000);
Warnings:
Warning	1264	Out of range value for column 'b' at row 1
SELECT * FROM t;
a	b
2000000000000000000	99.99
DELETE FROM t;
DELETE IGNORE FROM t;
CHECK TABLE t;
Table	Op	Msg_type	Msg_text
test.t	check	status	OK
DROP TABLE t;
# Testing example of type BIGINT and value -2000000000000000000
SHOW CREATE TABLE t;
Table	Create Table
t	CREATE TABLE `t` (
  `a` bigint NOT NULL,
  `b` decimal(4,2) GENERATED ALWAYS AS (`a`) VIRTUAL NOT NULL,
  KEY `on_b` (`b`)
) ENGINE=InnoDB DEFAULT CHARSET=utf8mb4 COLLATE=utf8mb4_0900_ai_ci
INSERT IGNORE INTO t (a) VALUES (-2000000000000000000);
Warnings:
Warning	1264	Out of range value for column 'b' at row 1
SELECT * FROM t;
a	b
-2000000000000000000	-99.99
DELETE FROM t;
DELETE IGNORE FROM t;
CHECK TABLE t;
Table	Op	Msg_type	Msg_text
test.t	check	status	OK
DROP TABLE t;
# Testing example of type FLOAT and value -1.23456
SHOW CREATE TABLE t;
Table	Create Table
t	CREATE TABLE `t` (
  `a` float NOT NULL,
  `b` decimal(4,2) GENERATED ALWAYS AS (`a`) VIRTUAL NOT NULL,
  KEY `on_b` (`b`)
) ENGINE=InnoDB DEFAULT CHARSET=utf8mb4 COLLATE=utf8mb4_0900_ai_ci
INSERT IGNORE INTO t (a) VALUES (-1.23456);
Warnings:
Note	1265	Data truncated for column 'b' at row 1
SELECT * FROM t;
a	b
-1.23456	-1.23
DELETE FROM t;
DELETE IGNORE FROM t;
CHECK TABLE t;
Table	Op	Msg_type	Msg_text
test.t	check	status	OK
DROP TABLE t;
# Testing example of type FLOAT and value -1e38
SHOW CREATE TABLE t;
Table	Create Table
t	CREATE TABLE `t` (
  `a` float NOT NULL,
  `b` decimal(4,2) GENERATED ALWAYS AS (`a`) VIRTUAL NOT NULL,
  KEY `on_b` (`b`)
) ENGINE=InnoDB DEFAULT CHARSET=utf8mb4 COLLATE=utf8mb4_0900_ai_ci
INSERT IGNORE INTO t (a) VALUES (-1e38);
Warnings:
Warning	1264	Out of range value for column 'b' at row 1
SELECT * FROM t;
a	b
-1e38	-99.99
DELETE FROM t;
DELETE IGNORE FROM t;
CHECK TABLE t;
Table	Op	Msg_type	Msg_text
test.t	check	status	OK
DROP TABLE t;
# Testing example of type FLOAT and value 1e38
SHOW CREATE TABLE t;
Table	Create Table
t	CREATE TABLE `t` (
  `a` float NOT NULL,
  `b` decimal(4,2) GENERATED ALWAYS AS (`a`) VIRTUAL NOT NULL,
  KEY `on_b` (`b`)
) ENGINE=InnoDB DEFAULT CHARSET=utf8mb4 COLLATE=utf8mb4_0900_ai_ci
INSERT IGNORE INTO t (a) VALUES (1e38);
Warnings:
Warning	1264	Out of range value for column 'b' at row 1
SELECT * FROM t;
a	b
1e38	99.99
DELETE FROM t;
DELETE IGNORE FROM t;
CHECK TABLE t;
Table	Op	Msg_type	Msg_text
test.t	check	status	OK
DROP TABLE t;
# Testing example of type DOUBLE and value -1.23456789012345
SHOW CREATE TABLE t;
Table	Create Table
t	CREATE TABLE `t` (
  `a` double NOT NULL,
  `b` decimal(4,2) GENERATED ALWAYS AS (`a`) VIRTUAL NOT NULL,
  KEY `on_b` (`b`)
) ENGINE=InnoDB DEFAULT CHARSET=utf8mb4 COLLATE=utf8mb4_0900_ai_ci
INSERT IGNORE INTO t (a) VALUES (-1.23456789012345);
Warnings:
Note	1265	Data truncated for column 'b' at row 1
SELECT * FROM t;
a	b
-1.23456789012345	-1.23
DELETE FROM t;
DELETE IGNORE FROM t;
CHECK TABLE t;
Table	Op	Msg_type	Msg_text
test.t	check	status	OK
DROP TABLE t;
# Testing example of type DOUBLE and value 1.23456789012345
SHOW CREATE TABLE t;
Table	Create Table
t	CREATE TABLE `t` (
  `a` double NOT NULL,
  `b` decimal(4,2) GENERATED ALWAYS AS (`a`) VIRTUAL NOT NULL,
  KEY `on_b` (`b`)
) ENGINE=InnoDB DEFAULT CHARSET=utf8mb4 COLLATE=utf8mb4_0900_ai_ci
INSERT IGNORE INTO t (a) VALUES (1.23456789012345);
Warnings:
Note	1265	Data truncated for column 'b' at row 1
SELECT * FROM t;
a	b
1.23456789012345	1.23
DELETE FROM t;
DELETE IGNORE FROM t;
CHECK TABLE t;
Table	Op	Msg_type	Msg_text
test.t	check	status	OK
DROP TABLE t;
# Testing example of type DOUBLE and value -1e300
SHOW CREATE TABLE t;
Table	Create Table
t	CREATE TABLE `t` (
  `a` double NOT NULL,
  `b` decimal(4,2) GENERATED ALWAYS AS (`a`) VIRTUAL NOT NULL,
  KEY `on_b` (`b`)
) ENGINE=InnoDB DEFAULT CHARSET=utf8mb4 COLLATE=utf8mb4_0900_ai_ci
INSERT IGNORE INTO t (a) VALUES (-1e300);
Warnings:
Warning	1264	Out of range value for column 'b' at row 1
SELECT * FROM t;
a	b
-1e300	-99.99
DELETE FROM t;
DELETE IGNORE FROM t;
CHECK TABLE t;
Table	Op	Msg_type	Msg_text
test.t	check	status	OK
DROP TABLE t;
# Testing example of type DOUBLE and value 1e300
SHOW CREATE TABLE t;
Table	Create Table
t	CREATE TABLE `t` (
  `a` double NOT NULL,
  `b` decimal(4,2) GENERATED ALWAYS AS (`a`) VIRTUAL NOT NULL,
  KEY `on_b` (`b`)
) ENGINE=InnoDB DEFAULT CHARSET=utf8mb4 COLLATE=utf8mb4_0900_ai_ci
INSERT IGNORE INTO t (a) VALUES (1e300);
Warnings:
Warning	1264	Out of range value for column 'b' at row 1
SELECT * FROM t;
a	b
1e300	99.99
DELETE FROM t;
DELETE IGNORE FROM t;
CHECK TABLE t;
Table	Op	Msg_type	Msg_text
test.t	check	status	OK
DROP TABLE t;
# Testing example of type DECIMAL(4,2) and value -10.99
SHOW CREATE TABLE t;
Table	Create Table
t	CREATE TABLE `t` (
  `a` decimal(4,2) NOT NULL,
  `b` decimal(4,2) GENERATED ALWAYS AS (`a`) VIRTUAL NOT NULL,
  KEY `on_b` (`b`)
) ENGINE=InnoDB DEFAULT CHARSET=utf8mb4 COLLATE=utf8mb4_0900_ai_ci
INSERT IGNORE INTO t (a) VALUES (-10.99);
SELECT * FROM t;
a	b
-10.99	-10.99
DELETE FROM t;
DELETE IGNORE FROM t;
CHECK TABLE t;
Table	Op	Msg_type	Msg_text
test.t	check	status	OK
DROP TABLE t;
# Testing example of type DECIMAL(34,4) and value 20000000000000000000000000000.0001
SHOW CREATE TABLE t;
Table	Create Table
t	CREATE TABLE `t` (
  `a` decimal(34,4) NOT NULL,
  `b` decimal(4,2) GENERATED ALWAYS AS (`a`) VIRTUAL NOT NULL,
  KEY `on_b` (`b`)
) ENGINE=InnoDB DEFAULT CHARSET=utf8mb4 COLLATE=utf8mb4_0900_ai_ci
INSERT IGNORE INTO t (a) VALUES (20000000000000000000000000000.0001);
Warnings:
Warning	1264	Out of range value for column 'b' at row 1
SELECT * FROM t;
a	b
20000000000000000000000000000.0001	99.99
DELETE FROM t;
DELETE IGNORE FROM t;
CHECK TABLE t;
Table	Op	Msg_type	Msg_text
test.t	check	status	OK
DROP TABLE t;
# Testing example of type DECIMAL(34,4) and value -20000000000000000000000000000.0001
SHOW CREATE TABLE t;
Table	Create Table
t	CREATE TABLE `t` (
  `a` decimal(34,4) NOT NULL,
  `b` decimal(4,2) GENERATED ALWAYS AS (`a`) VIRTUAL NOT NULL,
  KEY `on_b` (`b`)
) ENGINE=InnoDB DEFAULT CHARSET=utf8mb4 COLLATE=utf8mb4_0900_ai_ci
INSERT IGNORE INTO t (a) VALUES (-20000000000000000000000000000.0001);
Warnings:
Warning	1264	Out of range value for column 'b' at row 1
SELECT * FROM t;
a	b
-20000000000000000000000000000.0001	-99.99
DELETE FROM t;
DELETE IGNORE FROM t;
CHECK TABLE t;
Table	Op	Msg_type	Msg_text
test.t	check	status	OK
DROP TABLE t;
# Testing example of type BIT(64) and value 0xDEADBEEFC0FEBABE
SHOW CREATE TABLE t;
Table	Create Table
t	CREATE TABLE `t` (
  `a` bit(64) NOT NULL,
  `b` decimal(4,2) GENERATED ALWAYS AS (`a`) VIRTUAL NOT NULL,
  KEY `on_b` (`b`)
) ENGINE=InnoDB DEFAULT CHARSET=utf8mb4 COLLATE=utf8mb4_0900_ai_ci
INSERT IGNORE INTO t (a) VALUES (0xDEADBEEFC0FEBABE);
Warnings:
Warning	1264	Out of range value for column 'b' at row 1
SELECT * FROM t;
a	b
Þ­¾ïÀþº¾	99.99
DELETE FROM t;
DELETE IGNORE FROM t;
CHECK TABLE t;
Table	Op	Msg_type	Msg_text
test.t	check	status	OK
DROP TABLE t;
# Testing example of type BIT(4) and value 0b1000
SHOW CREATE TABLE t;
Table	Create Table
t	CREATE TABLE `t` (
  `a` bit(4) NOT NULL,
  `b` decimal(4,2) GENERATED ALWAYS AS (`a`) VIRTUAL NOT NULL,
  KEY `on_b` (`b`)
) ENGINE=InnoDB DEFAULT CHARSET=utf8mb4 COLLATE=utf8mb4_0900_ai_ci
INSERT IGNORE INTO t (a) VALUES (0b1000);
SELECT * FROM t;
a	b
	8.00
DELETE FROM t;
DELETE IGNORE FROM t;
CHECK TABLE t;
Table	Op	Msg_type	Msg_text
test.t	check	status	OK
DROP TABLE t;
# Testing example of type YEAR and value 2020
SHOW CREATE TABLE t;
Table	Create Table
t	CREATE TABLE `t` (
  `a` year NOT NULL,
  `b` decimal(4,2) GENERATED ALWAYS AS (`a`) VIRTUAL NOT NULL,
  KEY `on_b` (`b`)
) ENGINE=InnoDB DEFAULT CHARSET=utf8mb4 COLLATE=utf8mb4_0900_ai_ci
INSERT IGNORE INTO t (a) VALUES (2020);
Warnings:
Warning	1264	Out of range value for column 'b' at row 1
SELECT * FROM t;
a	b
2020	99.99
DELETE FROM t;
DELETE IGNORE FROM t;
CHECK TABLE t;
Table	Op	Msg_type	Msg_text
test.t	check	status	OK
DROP TABLE t;
# Testing example of type DATE and value "2030-04-05"
SHOW CREATE TABLE t;
Table	Create Table
t	CREATE TABLE `t` (
  `a` date NOT NULL,
  `b` decimal(4,2) GENERATED ALWAYS AS (`a`) VIRTUAL NOT NULL,
  KEY `on_b` (`b`)
) ENGINE=InnoDB DEFAULT CHARSET=utf8mb4 COLLATE=utf8mb4_0900_ai_ci
INSERT IGNORE INTO t (a) VALUES ("2030-04-05");
Warnings:
Warning	1264	Out of range value for column 'b' at row 1
SELECT * FROM t;
a	b
2030-04-05	99.99
DELETE FROM t;
DELETE IGNORE FROM t;
CHECK TABLE t;
Table	Op	Msg_type	Msg_text
test.t	check	status	OK
DROP TABLE t;
# Testing example of type TIME and value "11:12:13"
SHOW CREATE TABLE t;
Table	Create Table
t	CREATE TABLE `t` (
  `a` time NOT NULL,
  `b` decimal(4,2) GENERATED ALWAYS AS (`a`) VIRTUAL NOT NULL,
  KEY `on_b` (`b`)
) ENGINE=InnoDB DEFAULT CHARSET=utf8mb4 COLLATE=utf8mb4_0900_ai_ci
INSERT IGNORE INTO t (a) VALUES ("11:12:13");
Warnings:
Warning	1264	Out of range value for column 'b' at row 1
SELECT * FROM t;
a	b
11:12:13	99.99
DELETE FROM t;
DELETE IGNORE FROM t;
CHECK TABLE t;
Table	Op	Msg_type	Msg_text
test.t	check	status	OK
DROP TABLE t;
# Testing example of type DATETIME and value "2030-04-05 11:12:13"
SHOW CREATE TABLE t;
Table	Create Table
t	CREATE TABLE `t` (
  `a` datetime NOT NULL,
  `b` decimal(4,2) GENERATED ALWAYS AS (`a`) VIRTUAL NOT NULL,
  KEY `on_b` (`b`)
) ENGINE=InnoDB DEFAULT CHARSET=utf8mb4 COLLATE=utf8mb4_0900_ai_ci
INSERT IGNORE INTO t (a) VALUES ("2030-04-05 11:12:13");
Warnings:
Warning	1264	Out of range value for column 'b' at row 1
SELECT * FROM t;
a	b
2030-04-05 11:12:13	99.99
DELETE FROM t;
DELETE IGNORE FROM t;
CHECK TABLE t;
Table	Op	Msg_type	Msg_text
test.t	check	status	OK
DROP TABLE t;
# Testing example of type TIMESTAMP and value "2030-04-05 11:12:13"
SHOW CREATE TABLE t;
Table	Create Table
t	CREATE TABLE `t` (
  `a` timestamp NOT NULL,
  `b` decimal(4,2) GENERATED ALWAYS AS (`a`) VIRTUAL NOT NULL,
  KEY `on_b` (`b`)
) ENGINE=InnoDB DEFAULT CHARSET=utf8mb4 COLLATE=utf8mb4_0900_ai_ci
INSERT IGNORE INTO t (a) VALUES ("2030-04-05 11:12:13");
Warnings:
Warning	1264	Out of range value for column 'b' at row 1
SELECT * FROM t;
a	b
2030-04-05 11:12:13	99.99
DELETE FROM t;
DELETE IGNORE FROM t;
CHECK TABLE t;
Table	Op	Msg_type	Msg_text
test.t	check	status	OK
DROP TABLE t;
# Testing example of type CHAR(40) and value "2000000000000000000000000000000000000"
SHOW CREATE TABLE t;
Table	Create Table
t	CREATE TABLE `t` (
  `a` char(40) NOT NULL,
  `b` decimal(4,2) GENERATED ALWAYS AS (`a`) VIRTUAL NOT NULL,
  KEY `on_b` (`b`)
) ENGINE=InnoDB DEFAULT CHARSET=utf8mb4 COLLATE=utf8mb4_0900_ai_ci
INSERT IGNORE INTO t (a) VALUES ("2000000000000000000000000000000000000");
Warnings:
Warning	1264	Out of range value for column 'b' at row 1
SELECT * FROM t;
a	b
2000000000000000000000000000000000000	99.99
DELETE FROM t;
DELETE IGNORE FROM t;
CHECK TABLE t;
Table	Op	Msg_type	Msg_text
test.t	check	status	OK
DROP TABLE t;
# Testing example of type BINARY(45) and value "200000000000000000000000000000000000000000"
SHOW CREATE TABLE t;
Table	Create Table
t	CREATE TABLE `t` (
  `a` binary(45) NOT NULL,
  `b` decimal(4,2) GENERATED ALWAYS AS (`a`) VIRTUAL NOT NULL,
  KEY `on_b` (`b`)
) ENGINE=InnoDB DEFAULT CHARSET=utf8mb4 COLLATE=utf8mb4_0900_ai_ci
INSERT IGNORE INTO t (a) VALUES ("200000000000000000000000000000000000000000");
Warnings:
Note	1265	Data truncated for column 'b' at row 1
Warning	1264	Out of range value for column 'b' at row 1
SELECT * FROM t;
a	b
200000000000000000000000000000000000000000   	99.99
Warnings:
Warning	1366	Incorrect decimal value: '200000000000000000000000000000000000000000\x00\x00\x00' for column 'b' at row 1
DELETE FROM t;
DELETE IGNORE FROM t;
CHECK TABLE t;
Table	Op	Msg_type	Msg_text
test.t	check	status	OK
DROP TABLE t;
# Testing example of type VARCHAR(50) and value "2000000000000000000000000000000000000000000000000"
SHOW CREATE TABLE t;
Table	Create Table
t	CREATE TABLE `t` (
  `a` varchar(50) NOT NULL,
  `b` decimal(4,2) GENERATED ALWAYS AS (`a`) VIRTUAL NOT NULL,
  KEY `on_b` (`b`)
) ENGINE=InnoDB DEFAULT CHARSET=utf8mb4 COLLATE=utf8mb4_0900_ai_ci
INSERT IGNORE INTO t (a) VALUES ("2000000000000000000000000000000000000000000000000");
Warnings:
Warning	1264	Out of range value for column 'b' at row 1
SELECT * FROM t;
a	b
2000000000000000000000000000000000000000000000000	99.99
DELETE FROM t;
DELETE IGNORE FROM t;
CHECK TABLE t;
Table	Op	Msg_type	Msg_text
test.t	check	status	OK
DROP TABLE t;
# Testing example of type CHAR(24) and value "hello beautiful world"
SHOW CREATE TABLE t;
Table	Create Table
t	CREATE TABLE `t` (
  `a` char(24) NOT NULL,
  `b` decimal(4,2) GENERATED ALWAYS AS (`a`) VIRTUAL NOT NULL,
  KEY `on_b` (`b`)
) ENGINE=InnoDB DEFAULT CHARSET=utf8mb4 COLLATE=utf8mb4_0900_ai_ci
INSERT IGNORE INTO t (a) VALUES ("hello beautiful world");
Warnings:
Warning	1366	Incorrect decimal value: 'hello beautiful world' for column 'b' at row 1
SELECT * FROM t;
a	b
hello beautiful world	0.00
Warnings:
Warning	1366	Incorrect decimal value: 'hello beautiful world' for column 'b' at row 1
DELETE FROM t;
DELETE IGNORE FROM t;
Warnings:
Warning	1366	Incorrect decimal value: 'hello beautiful world' for column 'b' at row 1
Warning	1366	Incorrect decimal value: 'hello beautiful world' for column 'b' at row 1
CHECK TABLE t;
Table	Op	Msg_type	Msg_text
test.t	check	status	OK
DROP TABLE t;
# Testing example of type BINARY(12) and value "hello world"
SHOW CREATE TABLE t;
Table	Create Table
t	CREATE TABLE `t` (
  `a` binary(12) NOT NULL,
  `b` decimal(4,2) GENERATED ALWAYS AS (`a`) VIRTUAL NOT NULL,
  KEY `on_b` (`b`)
) ENGINE=InnoDB DEFAULT CHARSET=utf8mb4 COLLATE=utf8mb4_0900_ai_ci
INSERT IGNORE INTO t (a) VALUES ("hello world");
Warnings:
Warning	1366	Incorrect decimal value: 'hello world\x00' for column 'b' at row 1
SELECT * FROM t;
a	b
hello world 	0.00
Warnings:
Warning	1366	Incorrect decimal value: 'hello world\x00' for column 'b' at row 1
DELETE FROM t;
DELETE IGNORE FROM t;
Warnings:
Warning	1366	Incorrect decimal value: 'hello world\x00' for column 'b' at row 1
Warning	1366	Incorrect decimal value: 'hello world\x00' for column 'b' at row 1
CHECK TABLE t;
Table	Op	Msg_type	Msg_text
test.t	check	status	OK
DROP TABLE t;
# Testing example of type VARCHAR(6) and value "hello"
SHOW CREATE TABLE t;
Table	Create Table
t	CREATE TABLE `t` (
  `a` varchar(6) NOT NULL,
  `b` decimal(4,2) GENERATED ALWAYS AS (`a`) VIRTUAL NOT NULL,
  KEY `on_b` (`b`)
) ENGINE=InnoDB DEFAULT CHARSET=utf8mb4 COLLATE=utf8mb4_0900_ai_ci
INSERT IGNORE INTO t (a) VALUES ("hello");
Warnings:
Warning	1366	Incorrect decimal value: 'hello' for column 'b' at row 1
SELECT * FROM t;
a	b
hello	0.00
Warnings:
Warning	1366	Incorrect decimal value: 'hello' for column 'b' at row 1
DELETE FROM t;
DELETE IGNORE FROM t;
Warnings:
Warning	1366	Incorrect decimal value: 'hello' for column 'b' at row 1
Warning	1366	Incorrect decimal value: 'hello' for column 'b' at row 1
CHECK TABLE t;
Table	Op	Msg_type	Msg_text
test.t	check	status	OK
DROP TABLE t;
# Testing example of type ENUM("up","down") and value "up"
SHOW CREATE TABLE t;
Table	Create Table
t	CREATE TABLE `t` (
  `a` enum('up','down') NOT NULL,
  `b` decimal(4,2) GENERATED ALWAYS AS (`a`) VIRTUAL NOT NULL,
  KEY `on_b` (`b`)
) ENGINE=InnoDB DEFAULT CHARSET=utf8mb4 COLLATE=utf8mb4_0900_ai_ci
INSERT IGNORE INTO t (a) VALUES ("up");
SELECT * FROM t;
a	b
up	1.00
DELETE FROM t;
DELETE IGNORE FROM t;
CHECK TABLE t;
Table	Op	Msg_type	Msg_text
test.t	check	status	OK
DROP TABLE t;
# Testing example of type SET("up","down") and value "up,down"
SHOW CREATE TABLE t;
Table	Create Table
t	CREATE TABLE `t` (
  `a` set('up','down') NOT NULL,
  `b` decimal(4,2) GENERATED ALWAYS AS (`a`) VIRTUAL NOT NULL,
  KEY `on_b` (`b`)
) ENGINE=InnoDB DEFAULT CHARSET=utf8mb4 COLLATE=utf8mb4_0900_ai_ci
INSERT IGNORE INTO t (a) VALUES ("up,down");
SELECT * FROM t;
a	b
up,down	3.00
DELETE FROM t;
DELETE IGNORE FROM t;
CHECK TABLE t;
Table	Op	Msg_type	Msg_text
test.t	check	status	OK
DROP TABLE t;
# Testing example of type GEOMETRY and value ST_GeomFromText("POINT(1 1)")
SHOW CREATE TABLE t;
Table	Create Table
t	CREATE TABLE `t` (
  `a` geometry NOT NULL,
  `b` decimal(4,2) GENERATED ALWAYS AS (`a`) VIRTUAL NOT NULL,
  KEY `on_b` (`b`)
) ENGINE=InnoDB DEFAULT CHARSET=utf8mb4 COLLATE=utf8mb4_0900_ai_ci
INSERT IGNORE INTO t (a) VALUES (ST_GeomFromText("POINT(1 1)"));
Warnings:
Warning	1366	Incorrect decimal value: '\x00\x00\x00\x00\x01\x01\x00\x00\x00\x00\x00\x00\x00\x00\x00\xF0?\x00\x00\x00\x00\x00\x00\xF0?' for column 'b' at row 1
SELECT * FROM t;
a	b
             ð?      ð?	0.00
Warnings:
Warning	1366	Incorrect decimal value: '\x00\x00\x00\x00\x01\x01\x00\x00\x00\x00\x00\x00\x00\x00\x00\xF0?\x00\x00\x00\x00\x00\x00\xF0?' for column 'b' at row 1
DELETE FROM t;
DELETE IGNORE FROM t;
Warnings:
Warning	1366	Incorrect decimal value: '\x00\x00\x00\x00\x01\x01\x00\x00\x00\x00\x00\x00\x00\x00\x00\xF0?\x00\x00\x00\x00\x00\x00\xF0?' for column 'b' at row 1
Warning	1366	Incorrect decimal value: '\x00\x00\x00\x00\x01\x01\x00\x00\x00\x00\x00\x00\x00\x00\x00\xF0?\x00\x00\x00\x00\x00\x00\xF0?' for column 'b' at row 1
CHECK TABLE t;
Table	Op	Msg_type	Msg_text
test.t	check	status	OK
DROP TABLE t;
# Testing example of type POINT and value ST_GeomFromText("POINT(1 1)")
SHOW CREATE TABLE t;
Table	Create Table
t	CREATE TABLE `t` (
  `a` point NOT NULL,
  `b` decimal(4,2) GENERATED ALWAYS AS (`a`) VIRTUAL NOT NULL,
  KEY `on_b` (`b`)
) ENGINE=InnoDB DEFAULT CHARSET=utf8mb4 COLLATE=utf8mb4_0900_ai_ci
INSERT IGNORE INTO t (a) VALUES (ST_GeomFromText("POINT(1 1)"));
Warnings:
Warning	1366	Incorrect decimal value: '\x00\x00\x00\x00\x01\x01\x00\x00\x00\x00\x00\x00\x00\x00\x00\xF0?\x00\x00\x00\x00\x00\x00\xF0?' for column 'b' at row 1
SELECT * FROM t;
a	b
             ð?      ð?	0.00
Warnings:
Warning	1366	Incorrect decimal value: '\x00\x00\x00\x00\x01\x01\x00\x00\x00\x00\x00\x00\x00\x00\x00\xF0?\x00\x00\x00\x00\x00\x00\xF0?' for column 'b' at row 1
DELETE FROM t;
DELETE IGNORE FROM t;
Warnings:
Warning	1366	Incorrect decimal value: '\x00\x00\x00\x00\x01\x01\x00\x00\x00\x00\x00\x00\x00\x00\x00\xF0?\x00\x00\x00\x00\x00\x00\xF0?' for column 'b' at row 1
Warning	1366	Incorrect decimal value: '\x00\x00\x00\x00\x01\x01\x00\x00\x00\x00\x00\x00\x00\x00\x00\xF0?\x00\x00\x00\x00\x00\x00\xF0?' for column 'b' at row 1
CHECK TABLE t;
Table	Op	Msg_type	Msg_text
test.t	check	status	OK
DROP TABLE t;
# Testing example of type LINESTRING and value ST_GeomFromText("LINESTRING(0 0,1 1,2 2)")
SHOW CREATE TABLE t;
Table	Create Table
t	CREATE TABLE `t` (
  `a` linestring NOT NULL,
  `b` decimal(4,2) GENERATED ALWAYS AS (`a`) VIRTUAL NOT NULL,
  KEY `on_b` (`b`)
) ENGINE=InnoDB DEFAULT CHARSET=utf8mb4 COLLATE=utf8mb4_0900_ai_ci
INSERT IGNORE INTO t (a) VALUES (ST_GeomFromText("LINESTRING(0 0,1 1,2 2)"));
Warnings:
Warning	1366	Incorrect decimal value: '\x00\x00\x00\x00\x01\x02\x00\x00\x00\x03\x00\x00\x00\x00\x00\x00\x00\x00\x00\x00\x00\x00\x00\x00\x00\x00\x00\x00\x00\x00\x00\x00' for column 'b' at row 1
SELECT * FROM t;
a	b
                                ð?      ð?       @       @	0.00
Warnings:
Warning	1366	Incorrect decimal value: '\x00\x00\x00\x00\x01\x02\x00\x00\x00\x03\x00\x00\x00\x00\x00\x00\x00\x00\x00\x00\x00\x00\x00\x00\x00\x00\x00\x00\x00\x00\x00\x00' for column 'b' at row 1
DELETE FROM t;
DELETE IGNORE FROM t;
Warnings:
Warning	1366	Incorrect decimal value: '\x00\x00\x00\x00\x01\x02\x00\x00\x00\x03\x00\x00\x00\x00\x00\x00\x00\x00\x00\x00\x00\x00\x00\x00\x00\x00\x00\x00\x00\x00\x00\x00' for column 'b' at row 1
Warning	1366	Incorrect decimal value: '\x00\x00\x00\x00\x01\x02\x00\x00\x00\x03\x00\x00\x00\x00\x00\x00\x00\x00\x00\x00\x00\x00\x00\x00\x00\x00\x00\x00\x00\x00\x00\x00' for column 'b' at row 1
CHECK TABLE t;
Table	Op	Msg_type	Msg_text
test.t	check	status	OK
DROP TABLE t;
# Testing example of type POLYGON and value ST_GeomFromText("POLYGON((0 0,1 0,1 1,0 1,0 0),(5 5,7 5,7 7,5 7,5 5))")
SHOW CREATE TABLE t;
Table	Create Table
t	CREATE TABLE `t` (
  `a` polygon NOT NULL,
  `b` decimal(4,2) GENERATED ALWAYS AS (`a`) VIRTUAL NOT NULL,
  KEY `on_b` (`b`)
) ENGINE=InnoDB DEFAULT CHARSET=utf8mb4 COLLATE=utf8mb4_0900_ai_ci
INSERT IGNORE INTO t (a) VALUES (ST_GeomFromText("POLYGON((0 0,1 0,1 1,0 1,0 0),(5 5,7 5,7 7,5 7,5 5))"));
Warnings:
Warning	1366	Incorrect decimal value: '\x00\x00\x00\x00\x01\x03\x00\x00\x00\x02\x00\x00\x00\x05\x00\x00\x00\x00\x00\x00\x00\x00\x00\x00\x00\x00\x00\x00\x00\x00\x00\x00' for column 'b' at row 1
SELECT * FROM t;
a	b
                                   ð?              ð?      ð?              ð?                         @      @      @      @      @      @      @      @      @      @	0.00
Warnings:
Warning	1366	Incorrect decimal value: '\x00\x00\x00\x00\x01\x03\x00\x00\x00\x02\x00\x00\x00\x05\x00\x00\x00\x00\x00\x00\x00\x00\x00\x00\x00\x00\x00\x00\x00\x00\x00\x00' for column 'b' at row 1
DELETE FROM t;
DELETE IGNORE FROM t;
Warnings:
Warning	1366	Incorrect decimal value: '\x00\x00\x00\x00\x01\x03\x00\x00\x00\x02\x00\x00\x00\x05\x00\x00\x00\x00\x00\x00\x00\x00\x00\x00\x00\x00\x00\x00\x00\x00\x00\x00' for column 'b' at row 1
Warning	1366	Incorrect decimal value: '\x00\x00\x00\x00\x01\x03\x00\x00\x00\x02\x00\x00\x00\x05\x00\x00\x00\x00\x00\x00\x00\x00\x00\x00\x00\x00\x00\x00\x00\x00\x00\x00' for column 'b' at row 1
CHECK TABLE t;
Table	Op	Msg_type	Msg_text
test.t	check	status	OK
DROP TABLE t;
#
# Testing virtual column of type DECIMAL(34,4)
#
# Testing example of type JSON and value "{}"
SHOW CREATE TABLE t;
Table	Create Table
t	CREATE TABLE `t` (
  `a` json NOT NULL,
  `b` decimal(34,4) GENERATED ALWAYS AS (`a`) VIRTUAL NOT NULL,
  KEY `on_b` (`b`)
) ENGINE=InnoDB DEFAULT CHARSET=utf8mb4 COLLATE=utf8mb4_0900_ai_ci
INSERT IGNORE INTO t (a) VALUES ("{}");
Warnings:
Warning	3156	Invalid JSON value for CAST to DECIMAL from column a at row 1
SELECT * FROM t;
a	b
{}	0.0000
Warnings:
Warning	3156	Invalid JSON value for CAST to DECIMAL from column a at row 1
DELETE FROM t;
DELETE IGNORE FROM t;
Warnings:
Warning	3156	Invalid JSON value for CAST to DECIMAL from column a at row 1
Warning	3156	Invalid JSON value for CAST to DECIMAL from column a at row 1
CHECK TABLE t;
Table	Op	Msg_type	Msg_text
test.t	check	status	OK
DROP TABLE t;
# Testing example of type JSON and value '["hello beautiful world"]'
SHOW CREATE TABLE t;
Table	Create Table
t	CREATE TABLE `t` (
  `a` json NOT NULL,
  `b` decimal(34,4) GENERATED ALWAYS AS (`a`) VIRTUAL NOT NULL,
  KEY `on_b` (`b`)
) ENGINE=InnoDB DEFAULT CHARSET=utf8mb4 COLLATE=utf8mb4_0900_ai_ci
INSERT IGNORE INTO t (a) VALUES ('["hello beautiful world"]');
Warnings:
Warning	3156	Invalid JSON value for CAST to DECIMAL from column a at row 1
SELECT * FROM t;
a	b
["hello beautiful world"]	0.0000
Warnings:
Warning	3156	Invalid JSON value for CAST to DECIMAL from column a at row 1
DELETE FROM t;
DELETE IGNORE FROM t;
Warnings:
Warning	3156	Invalid JSON value for CAST to DECIMAL from column a at row 1
Warning	3156	Invalid JSON value for CAST to DECIMAL from column a at row 1
CHECK TABLE t;
Table	Op	Msg_type	Msg_text
test.t	check	status	OK
DROP TABLE t;
# Testing example of type JSON and value "-1"
SHOW CREATE TABLE t;
Table	Create Table
t	CREATE TABLE `t` (
  `a` json NOT NULL,
  `b` decimal(34,4) GENERATED ALWAYS AS (`a`) VIRTUAL NOT NULL,
  KEY `on_b` (`b`)
) ENGINE=InnoDB DEFAULT CHARSET=utf8mb4 COLLATE=utf8mb4_0900_ai_ci
INSERT IGNORE INTO t (a) VALUES ("-1");
SELECT * FROM t;
a	b
-1	-1.0000
DELETE FROM t;
DELETE IGNORE FROM t;
CHECK TABLE t;
Table	Op	Msg_type	Msg_text
test.t	check	status	OK
DROP TABLE t;
# Testing example of type TINYINT and value -1
SHOW CREATE TABLE t;
Table	Create Table
t	CREATE TABLE `t` (
  `a` tinyint NOT NULL,
  `b` decimal(34,4) GENERATED ALWAYS AS (`a`) VIRTUAL NOT NULL,
  KEY `on_b` (`b`)
) ENGINE=InnoDB DEFAULT CHARSET=utf8mb4 COLLATE=utf8mb4_0900_ai_ci
INSERT IGNORE INTO t (a) VALUES (-1);
SELECT * FROM t;
a	b
-1	-1.0000
DELETE FROM t;
DELETE IGNORE FROM t;
CHECK TABLE t;
Table	Op	Msg_type	Msg_text
test.t	check	status	OK
DROP TABLE t;
# Testing example of type SMALLINT and value -1
SHOW CREATE TABLE t;
Table	Create Table
t	CREATE TABLE `t` (
  `a` smallint NOT NULL,
  `b` decimal(34,4) GENERATED ALWAYS AS (`a`) VIRTUAL NOT NULL,
  KEY `on_b` (`b`)
) ENGINE=InnoDB DEFAULT CHARSET=utf8mb4 COLLATE=utf8mb4_0900_ai_ci
INSERT IGNORE INTO t (a) VALUES (-1);
SELECT * FROM t;
a	b
-1	-1.0000
DELETE FROM t;
DELETE IGNORE FROM t;
CHECK TABLE t;
Table	Op	Msg_type	Msg_text
test.t	check	status	OK
DROP TABLE t;
# Testing example of type MEDIUMINT and value -1
SHOW CREATE TABLE t;
Table	Create Table
t	CREATE TABLE `t` (
  `a` mediumint NOT NULL,
  `b` decimal(34,4) GENERATED ALWAYS AS (`a`) VIRTUAL NOT NULL,
  KEY `on_b` (`b`)
) ENGINE=InnoDB DEFAULT CHARSET=utf8mb4 COLLATE=utf8mb4_0900_ai_ci
INSERT IGNORE INTO t (a) VALUES (-1);
SELECT * FROM t;
a	b
-1	-1.0000
DELETE FROM t;
DELETE IGNORE FROM t;
CHECK TABLE t;
Table	Op	Msg_type	Msg_text
test.t	check	status	OK
DROP TABLE t;
# Testing example of type INT and value 2000000000
SHOW CREATE TABLE t;
Table	Create Table
t	CREATE TABLE `t` (
  `a` int NOT NULL,
  `b` decimal(34,4) GENERATED ALWAYS AS (`a`) VIRTUAL NOT NULL,
  KEY `on_b` (`b`)
) ENGINE=InnoDB DEFAULT CHARSET=utf8mb4 COLLATE=utf8mb4_0900_ai_ci
INSERT IGNORE INTO t (a) VALUES (2000000000);
SELECT * FROM t;
a	b
2000000000	2000000000.0000
DELETE FROM t;
DELETE IGNORE FROM t;
CHECK TABLE t;
Table	Op	Msg_type	Msg_text
test.t	check	status	OK
DROP TABLE t;
# Testing example of type INT and value -2000000000
SHOW CREATE TABLE t;
Table	Create Table
t	CREATE TABLE `t` (
  `a` int NOT NULL,
  `b` decimal(34,4) GENERATED ALWAYS AS (`a`) VIRTUAL NOT NULL,
  KEY `on_b` (`b`)
) ENGINE=InnoDB DEFAULT CHARSET=utf8mb4 COLLATE=utf8mb4_0900_ai_ci
INSERT IGNORE INTO t (a) VALUES (-2000000000);
SELECT * FROM t;
a	b
-2000000000	-2000000000.0000
DELETE FROM t;
DELETE IGNORE FROM t;
CHECK TABLE t;
Table	Op	Msg_type	Msg_text
test.t	check	status	OK
DROP TABLE t;
# Testing example of type INT UNSIGNED and value 4000000000
SHOW CREATE TABLE t;
Table	Create Table
t	CREATE TABLE `t` (
  `a` int unsigned NOT NULL,
  `b` decimal(34,4) GENERATED ALWAYS AS (`a`) VIRTUAL NOT NULL,
  KEY `on_b` (`b`)
) ENGINE=InnoDB DEFAULT CHARSET=utf8mb4 COLLATE=utf8mb4_0900_ai_ci
INSERT IGNORE INTO t (a) VALUES (4000000000);
SELECT * FROM t;
a	b
4000000000	4000000000.0000
DELETE FROM t;
DELETE IGNORE FROM t;
CHECK TABLE t;
Table	Op	Msg_type	Msg_text
test.t	check	status	OK
DROP TABLE t;
# Testing example of type BIGINT and value 2000000000000000000
SHOW CREATE TABLE t;
Table	Create Table
t	CREATE TABLE `t` (
  `a` bigint NOT NULL,
  `b` decimal(34,4) GENERATED ALWAYS AS (`a`) VIRTUAL NOT NULL,
  KEY `on_b` (`b`)
) ENGINE=InnoDB DEFAULT CHARSET=utf8mb4 COLLATE=utf8mb4_0900_ai_ci
INSERT IGNORE INTO t (a) VALUES (2000000000000000000);
SELECT * FROM t;
a	b
2000000000000000000	2000000000000000000.0000
DELETE FROM t;
DELETE IGNORE FROM t;
CHECK TABLE t;
Table	Op	Msg_type	Msg_text
test.t	check	status	OK
DROP TABLE t;
# Testing example of type BIGINT and value -2000000000000000000
SHOW CREATE TABLE t;
Table	Create Table
t	CREATE TABLE `t` (
  `a` bigint NOT NULL,
  `b` decimal(34,4) GENERATED ALWAYS AS (`a`) VIRTUAL NOT NULL,
  KEY `on_b` (`b`)
) ENGINE=InnoDB DEFAULT CHARSET=utf8mb4 COLLATE=utf8mb4_0900_ai_ci
INSERT IGNORE INTO t (a) VALUES (-2000000000000000000);
SELECT * FROM t;
a	b
-2000000000000000000	-2000000000000000000.0000
DELETE FROM t;
DELETE IGNORE FROM t;
CHECK TABLE t;
Table	Op	Msg_type	Msg_text
test.t	check	status	OK
DROP TABLE t;
# Testing example of type FLOAT and value -1.23456
SHOW CREATE TABLE t;
Table	Create Table
t	CREATE TABLE `t` (
  `a` float NOT NULL,
  `b` decimal(34,4) GENERATED ALWAYS AS (`a`) VIRTUAL NOT NULL,
  KEY `on_b` (`b`)
) ENGINE=InnoDB DEFAULT CHARSET=utf8mb4 COLLATE=utf8mb4_0900_ai_ci
INSERT IGNORE INTO t (a) VALUES (-1.23456);
Warnings:
Note	1265	Data truncated for column 'b' at row 1
SELECT * FROM t;
a	b
-1.23456	-1.2346
DELETE FROM t;
DELETE IGNORE FROM t;
CHECK TABLE t;
Table	Op	Msg_type	Msg_text
test.t	check	status	OK
DROP TABLE t;
# Testing example of type FLOAT and value -1e38
SHOW CREATE TABLE t;
Table	Create Table
t	CREATE TABLE `t` (
  `a` float NOT NULL,
  `b` decimal(34,4) GENERATED ALWAYS AS (`a`) VIRTUAL NOT NULL,
  KEY `on_b` (`b`)
) ENGINE=InnoDB DEFAULT CHARSET=utf8mb4 COLLATE=utf8mb4_0900_ai_ci
INSERT IGNORE INTO t (a) VALUES (-1e38);
Warnings:
Warning	1264	Out of range value for column 'b' at row 1
SELECT * FROM t;
a	b
-1e38	-999999999999999999999999999999.9999
DELETE FROM t;
DELETE IGNORE FROM t;
CHECK TABLE t;
Table	Op	Msg_type	Msg_text
test.t	check	status	OK
DROP TABLE t;
# Testing example of type FLOAT and value 1e38
SHOW CREATE TABLE t;
Table	Create Table
t	CREATE TABLE `t` (
  `a` float NOT NULL,
  `b` decimal(34,4) GENERATED ALWAYS AS (`a`) VIRTUAL NOT NULL,
  KEY `on_b` (`b`)
) ENGINE=InnoDB DEFAULT CHARSET=utf8mb4 COLLATE=utf8mb4_0900_ai_ci
INSERT IGNORE INTO t (a) VALUES (1e38);
Warnings:
Warning	1264	Out of range value for column 'b' at row 1
SELECT * FROM t;
a	b
1e38	999999999999999999999999999999.9999
DELETE FROM t;
DELETE IGNORE FROM t;
CHECK TABLE t;
Table	Op	Msg_type	Msg_text
test.t	check	status	OK
DROP TABLE t;
# Testing example of type DOUBLE and value -1.23456789012345
SHOW CREATE TABLE t;
Table	Create Table
t	CREATE TABLE `t` (
  `a` double NOT NULL,
  `b` decimal(34,4) GENERATED ALWAYS AS (`a`) VIRTUAL NOT NULL,
  KEY `on_b` (`b`)
) ENGINE=InnoDB DEFAULT CHARSET=utf8mb4 COLLATE=utf8mb4_0900_ai_ci
INSERT IGNORE INTO t (a) VALUES (-1.23456789012345);
Warnings:
Note	1265	Data truncated for column 'b' at row 1
SELECT * FROM t;
a	b
-1.23456789012345	-1.2346
DELETE FROM t;
DELETE IGNORE FROM t;
CHECK TABLE t;
Table	Op	Msg_type	Msg_text
test.t	check	status	OK
DROP TABLE t;
# Testing example of type DOUBLE and value 1.23456789012345
SHOW CREATE TABLE t;
Table	Create Table
t	CREATE TABLE `t` (
  `a` double NOT NULL,
  `b` decimal(34,4) GENERATED ALWAYS AS (`a`) VIRTUAL NOT NULL,
  KEY `on_b` (`b`)
) ENGINE=InnoDB DEFAULT CHARSET=utf8mb4 COLLATE=utf8mb4_0900_ai_ci
INSERT IGNORE INTO t (a) VALUES (1.23456789012345);
Warnings:
Note	1265	Data truncated for column 'b' at row 1
SELECT * FROM t;
a	b
1.23456789012345	1.2346
DELETE FROM t;
DELETE IGNORE FROM t;
CHECK TABLE t;
Table	Op	Msg_type	Msg_text
test.t	check	status	OK
DROP TABLE t;
# Testing example of type DOUBLE and value -1e300
SHOW CREATE TABLE t;
Table	Create Table
t	CREATE TABLE `t` (
  `a` double NOT NULL,
  `b` decimal(34,4) GENERATED ALWAYS AS (`a`) VIRTUAL NOT NULL,
  KEY `on_b` (`b`)
) ENGINE=InnoDB DEFAULT CHARSET=utf8mb4 COLLATE=utf8mb4_0900_ai_ci
INSERT IGNORE INTO t (a) VALUES (-1e300);
Warnings:
Warning	1264	Out of range value for column 'b' at row 1
SELECT * FROM t;
a	b
-1e300	-999999999999999999999999999999.9999
DELETE FROM t;
DELETE IGNORE FROM t;
CHECK TABLE t;
Table	Op	Msg_type	Msg_text
test.t	check	status	OK
DROP TABLE t;
# Testing example of type DOUBLE and value 1e300
SHOW CREATE TABLE t;
Table	Create Table
t	CREATE TABLE `t` (
  `a` double NOT NULL,
  `b` decimal(34,4) GENERATED ALWAYS AS (`a`) VIRTUAL NOT NULL,
  KEY `on_b` (`b`)
) ENGINE=InnoDB DEFAULT CHARSET=utf8mb4 COLLATE=utf8mb4_0900_ai_ci
INSERT IGNORE INTO t (a) VALUES (1e300);
Warnings:
Warning	1264	Out of range value for column 'b' at row 1
SELECT * FROM t;
a	b
1e300	999999999999999999999999999999.9999
DELETE FROM t;
DELETE IGNORE FROM t;
CHECK TABLE t;
Table	Op	Msg_type	Msg_text
test.t	check	status	OK
DROP TABLE t;
# Testing example of type DECIMAL(4,2) and value -10.99
SHOW CREATE TABLE t;
Table	Create Table
t	CREATE TABLE `t` (
  `a` decimal(4,2) NOT NULL,
  `b` decimal(34,4) GENERATED ALWAYS AS (`a`) VIRTUAL NOT NULL,
  KEY `on_b` (`b`)
) ENGINE=InnoDB DEFAULT CHARSET=utf8mb4 COLLATE=utf8mb4_0900_ai_ci
INSERT IGNORE INTO t (a) VALUES (-10.99);
SELECT * FROM t;
a	b
-10.99	-10.9900
DELETE FROM t;
DELETE IGNORE FROM t;
CHECK TABLE t;
Table	Op	Msg_type	Msg_text
test.t	check	status	OK
DROP TABLE t;
# Testing example of type DECIMAL(34,4) and value 20000000000000000000000000000.0001
SHOW CREATE TABLE t;
Table	Create Table
t	CREATE TABLE `t` (
  `a` decimal(34,4) NOT NULL,
  `b` decimal(34,4) GENERATED ALWAYS AS (`a`) VIRTUAL NOT NULL,
  KEY `on_b` (`b`)
) ENGINE=InnoDB DEFAULT CHARSET=utf8mb4 COLLATE=utf8mb4_0900_ai_ci
INSERT IGNORE INTO t (a) VALUES (20000000000000000000000000000.0001);
SELECT * FROM t;
a	b
20000000000000000000000000000.0001	20000000000000000000000000000.0001
DELETE FROM t;
DELETE IGNORE FROM t;
CHECK TABLE t;
Table	Op	Msg_type	Msg_text
test.t	check	status	OK
DROP TABLE t;
# Testing example of type DECIMAL(34,4) and value -20000000000000000000000000000.0001
SHOW CREATE TABLE t;
Table	Create Table
t	CREATE TABLE `t` (
  `a` decimal(34,4) NOT NULL,
  `b` decimal(34,4) GENERATED ALWAYS AS (`a`) VIRTUAL NOT NULL,
  KEY `on_b` (`b`)
) ENGINE=InnoDB DEFAULT CHARSET=utf8mb4 COLLATE=utf8mb4_0900_ai_ci
INSERT IGNORE INTO t (a) VALUES (-20000000000000000000000000000.0001);
SELECT * FROM t;
a	b
-20000000000000000000000000000.0001	-20000000000000000000000000000.0001
DELETE FROM t;
DELETE IGNORE FROM t;
CHECK TABLE t;
Table	Op	Msg_type	Msg_text
test.t	check	status	OK
DROP TABLE t;
# Testing example of type BIT(64) and value 0xDEADBEEFC0FEBABE
SHOW CREATE TABLE t;
Table	Create Table
t	CREATE TABLE `t` (
  `a` bit(64) NOT NULL,
  `b` decimal(34,4) GENERATED ALWAYS AS (`a`) VIRTUAL NOT NULL,
  KEY `on_b` (`b`)
) ENGINE=InnoDB DEFAULT CHARSET=utf8mb4 COLLATE=utf8mb4_0900_ai_ci
INSERT IGNORE INTO t (a) VALUES (0xDEADBEEFC0FEBABE);
SELECT * FROM t;
a	b
Þ­¾ïÀþº¾	16045690984335325886.0000
DELETE FROM t;
DELETE IGNORE FROM t;
CHECK TABLE t;
Table	Op	Msg_type	Msg_text
test.t	check	status	OK
DROP TABLE t;
# Testing example of type BIT(4) and value 0b1000
SHOW CREATE TABLE t;
Table	Create Table
t	CREATE TABLE `t` (
  `a` bit(4) NOT NULL,
  `b` decimal(34,4) GENERATED ALWAYS AS (`a`) VIRTUAL NOT NULL,
  KEY `on_b` (`b`)
) ENGINE=InnoDB DEFAULT CHARSET=utf8mb4 COLLATE=utf8mb4_0900_ai_ci
INSERT IGNORE INTO t (a) VALUES (0b1000);
SELECT * FROM t;
a	b
	8.0000
DELETE FROM t;
DELETE IGNORE FROM t;
CHECK TABLE t;
Table	Op	Msg_type	Msg_text
test.t	check	status	OK
DROP TABLE t;
# Testing example of type YEAR and value 2020
SHOW CREATE TABLE t;
Table	Create Table
t	CREATE TABLE `t` (
  `a` year NOT NULL,
  `b` decimal(34,4) GENERATED ALWAYS AS (`a`) VIRTUAL NOT NULL,
  KEY `on_b` (`b`)
) ENGINE=InnoDB DEFAULT CHARSET=utf8mb4 COLLATE=utf8mb4_0900_ai_ci
INSERT IGNORE INTO t (a) VALUES (2020);
SELECT * FROM t;
a	b
2020	2020.0000
DELETE FROM t;
DELETE IGNORE FROM t;
CHECK TABLE t;
Table	Op	Msg_type	Msg_text
test.t	check	status	OK
DROP TABLE t;
# Testing example of type DATE and value "2030-04-05"
SHOW CREATE TABLE t;
Table	Create Table
t	CREATE TABLE `t` (
  `a` date NOT NULL,
  `b` decimal(34,4) GENERATED ALWAYS AS (`a`) VIRTUAL NOT NULL,
  KEY `on_b` (`b`)
) ENGINE=InnoDB DEFAULT CHARSET=utf8mb4 COLLATE=utf8mb4_0900_ai_ci
INSERT IGNORE INTO t (a) VALUES ("2030-04-05");
SELECT * FROM t;
a	b
2030-04-05	20300405.0000
DELETE FROM t;
DELETE IGNORE FROM t;
CHECK TABLE t;
Table	Op	Msg_type	Msg_text
test.t	check	status	OK
DROP TABLE t;
# Testing example of type TIME and value "11:12:13"
SHOW CREATE TABLE t;
Table	Create Table
t	CREATE TABLE `t` (
  `a` time NOT NULL,
  `b` decimal(34,4) GENERATED ALWAYS AS (`a`) VIRTUAL NOT NULL,
  KEY `on_b` (`b`)
) ENGINE=InnoDB DEFAULT CHARSET=utf8mb4 COLLATE=utf8mb4_0900_ai_ci
INSERT IGNORE INTO t (a) VALUES ("11:12:13");
SELECT * FROM t;
a	b
11:12:13	111213.0000
DELETE FROM t;
DELETE IGNORE FROM t;
CHECK TABLE t;
Table	Op	Msg_type	Msg_text
test.t	check	status	OK
DROP TABLE t;
# Testing example of type DATETIME and value "2030-04-05 11:12:13"
SHOW CREATE TABLE t;
Table	Create Table
t	CREATE TABLE `t` (
  `a` datetime NOT NULL,
  `b` decimal(34,4) GENERATED ALWAYS AS (`a`) VIRTUAL NOT NULL,
  KEY `on_b` (`b`)
) ENGINE=InnoDB DEFAULT CHARSET=utf8mb4 COLLATE=utf8mb4_0900_ai_ci
INSERT IGNORE INTO t (a) VALUES ("2030-04-05 11:12:13");
SELECT * FROM t;
a	b
2030-04-05 11:12:13	20300405111213.0000
DELETE FROM t;
DELETE IGNORE FROM t;
CHECK TABLE t;
Table	Op	Msg_type	Msg_text
test.t	check	status	OK
DROP TABLE t;
# Testing example of type TIMESTAMP and value "2030-04-05 11:12:13"
SHOW CREATE TABLE t;
Table	Create Table
t	CREATE TABLE `t` (
  `a` timestamp NOT NULL,
  `b` decimal(34,4) GENERATED ALWAYS AS (`a`) VIRTUAL NOT NULL,
  KEY `on_b` (`b`)
) ENGINE=InnoDB DEFAULT CHARSET=utf8mb4 COLLATE=utf8mb4_0900_ai_ci
INSERT IGNORE INTO t (a) VALUES ("2030-04-05 11:12:13");
SELECT * FROM t;
a	b
2030-04-05 11:12:13	20300405111213.0000
DELETE FROM t;
DELETE IGNORE FROM t;
CHECK TABLE t;
Table	Op	Msg_type	Msg_text
test.t	check	status	OK
DROP TABLE t;
# Testing example of type CHAR(40) and value "2000000000000000000000000000000000000"
SHOW CREATE TABLE t;
Table	Create Table
t	CREATE TABLE `t` (
  `a` char(40) NOT NULL,
  `b` decimal(34,4) GENERATED ALWAYS AS (`a`) VIRTUAL NOT NULL,
  KEY `on_b` (`b`)
) ENGINE=InnoDB DEFAULT CHARSET=utf8mb4 COLLATE=utf8mb4_0900_ai_ci
INSERT IGNORE INTO t (a) VALUES ("2000000000000000000000000000000000000");
Warnings:
Warning	1264	Out of range value for column 'b' at row 1
SELECT * FROM t;
a	b
2000000000000000000000000000000000000	999999999999999999999999999999.9999
DELETE FROM t;
DELETE IGNORE FROM t;
CHECK TABLE t;
Table	Op	Msg_type	Msg_text
test.t	check	status	OK
DROP TABLE t;
# Testing example of type BINARY(45) and value "200000000000000000000000000000000000000000"
SHOW CREATE TABLE t;
Table	Create Table
t	CREATE TABLE `t` (
  `a` binary(45) NOT NULL,
  `b` decimal(34,4) GENERATED ALWAYS AS (`a`) VIRTUAL NOT NULL,
  KEY `on_b` (`b`)
) ENGINE=InnoDB DEFAULT CHARSET=utf8mb4 COLLATE=utf8mb4_0900_ai_ci
INSERT IGNORE INTO t (a) VALUES ("200000000000000000000000000000000000000000");
Warnings:
Note	1265	Data truncated for column 'b' at row 1
Warning	1264	Out of range value for column 'b' at row 1
SELECT * FROM t;
a	b
200000000000000000000000000000000000000000   	999999999999999999999999999999.9999
Warnings:
Warning	1366	Incorrect decimal value: '200000000000000000000000000000000000000000\x00\x00\x00' for column 'b' at row 1
DELETE FROM t;
DELETE IGNORE FROM t;
CHECK TABLE t;
Table	Op	Msg_type	Msg_text
test.t	check	status	OK
DROP TABLE t;
# Testing example of type VARCHAR(50) and value "2000000000000000000000000000000000000000000000000"
SHOW CREATE TABLE t;
Table	Create Table
t	CREATE TABLE `t` (
  `a` varchar(50) NOT NULL,
  `b` decimal(34,4) GENERATED ALWAYS AS (`a`) VIRTUAL NOT NULL,
  KEY `on_b` (`b`)
) ENGINE=InnoDB DEFAULT CHARSET=utf8mb4 COLLATE=utf8mb4_0900_ai_ci
INSERT IGNORE INTO t (a) VALUES ("2000000000000000000000000000000000000000000000000");
Warnings:
Warning	1264	Out of range value for column 'b' at row 1
SELECT * FROM t;
a	b
2000000000000000000000000000000000000000000000000	999999999999999999999999999999.9999
DELETE FROM t;
DELETE IGNORE FROM t;
CHECK TABLE t;
Table	Op	Msg_type	Msg_text
test.t	check	status	OK
DROP TABLE t;
# Testing example of type CHAR(24) and value "hello beautiful world"
SHOW CREATE TABLE t;
Table	Create Table
t	CREATE TABLE `t` (
  `a` char(24) NOT NULL,
  `b` decimal(34,4) GENERATED ALWAYS AS (`a`) VIRTUAL NOT NULL,
  KEY `on_b` (`b`)
) ENGINE=InnoDB DEFAULT CHARSET=utf8mb4 COLLATE=utf8mb4_0900_ai_ci
INSERT IGNORE INTO t (a) VALUES ("hello beautiful world");
Warnings:
Warning	1366	Incorrect decimal value: 'hello beautiful world' for column 'b' at row 1
SELECT * FROM t;
a	b
hello beautiful world	0.0000
Warnings:
Warning	1366	Incorrect decimal value: 'hello beautiful world' for column 'b' at row 1
DELETE FROM t;
DELETE IGNORE FROM t;
Warnings:
Warning	1366	Incorrect decimal value: 'hello beautiful world' for column 'b' at row 1
Warning	1366	Incorrect decimal value: 'hello beautiful world' for column 'b' at row 1
CHECK TABLE t;
Table	Op	Msg_type	Msg_text
test.t	check	status	OK
DROP TABLE t;
# Testing example of type BINARY(12) and value "hello world"
SHOW CREATE TABLE t;
Table	Create Table
t	CREATE TABLE `t` (
  `a` binary(12) NOT NULL,
  `b` decimal(34,4) GENERATED ALWAYS AS (`a`) VIRTUAL NOT NULL,
  KEY `on_b` (`b`)
) ENGINE=InnoDB DEFAULT CHARSET=utf8mb4 COLLATE=utf8mb4_0900_ai_ci
INSERT IGNORE INTO t (a) VALUES ("hello world");
Warnings:
Warning	1366	Incorrect decimal value: 'hello world\x00' for column 'b' at row 1
SELECT * FROM t;
a	b
hello world 	0.0000
Warnings:
Warning	1366	Incorrect decimal value: 'hello world\x00' for column 'b' at row 1
DELETE FROM t;
DELETE IGNORE FROM t;
Warnings:
Warning	1366	Incorrect decimal value: 'hello world\x00' for column 'b' at row 1
Warning	1366	Incorrect decimal value: 'hello world\x00' for column 'b' at row 1
CHECK TABLE t;
Table	Op	Msg_type	Msg_text
test.t	check	status	OK
DROP TABLE t;
# Testing example of type VARCHAR(6) and value "hello"
SHOW CREATE TABLE t;
Table	Create Table
t	CREATE TABLE `t` (
  `a` varchar(6) NOT NULL,
  `b` decimal(34,4) GENERATED ALWAYS AS (`a`) VIRTUAL NOT NULL,
  KEY `on_b` (`b`)
) ENGINE=InnoDB DEFAULT CHARSET=utf8mb4 COLLATE=utf8mb4_0900_ai_ci
INSERT IGNORE INTO t (a) VALUES ("hello");
Warnings:
Warning	1366	Incorrect decimal value: 'hello' for column 'b' at row 1
SELECT * FROM t;
a	b
hello	0.0000
Warnings:
Warning	1366	Incorrect decimal value: 'hello' for column 'b' at row 1
DELETE FROM t;
DELETE IGNORE FROM t;
Warnings:
Warning	1366	Incorrect decimal value: 'hello' for column 'b' at row 1
Warning	1366	Incorrect decimal value: 'hello' for column 'b' at row 1
CHECK TABLE t;
Table	Op	Msg_type	Msg_text
test.t	check	status	OK
DROP TABLE t;
# Testing example of type ENUM("up","down") and value "up"
SHOW CREATE TABLE t;
Table	Create Table
t	CREATE TABLE `t` (
  `a` enum('up','down') NOT NULL,
  `b` decimal(34,4) GENERATED ALWAYS AS (`a`) VIRTUAL NOT NULL,
  KEY `on_b` (`b`)
) ENGINE=InnoDB DEFAULT CHARSET=utf8mb4 COLLATE=utf8mb4_0900_ai_ci
INSERT IGNORE INTO t (a) VALUES ("up");
SELECT * FROM t;
a	b
up	1.0000
DELETE FROM t;
DELETE IGNORE FROM t;
CHECK TABLE t;
Table	Op	Msg_type	Msg_text
test.t	check	status	OK
DROP TABLE t;
# Testing example of type SET("up","down") and value "up,down"
SHOW CREATE TABLE t;
Table	Create Table
t	CREATE TABLE `t` (
  `a` set('up','down') NOT NULL,
  `b` decimal(34,4) GENERATED ALWAYS AS (`a`) VIRTUAL NOT NULL,
  KEY `on_b` (`b`)
) ENGINE=InnoDB DEFAULT CHARSET=utf8mb4 COLLATE=utf8mb4_0900_ai_ci
INSERT IGNORE INTO t (a) VALUES ("up,down");
SELECT * FROM t;
a	b
up,down	3.0000
DELETE FROM t;
DELETE IGNORE FROM t;
CHECK TABLE t;
Table	Op	Msg_type	Msg_text
test.t	check	status	OK
DROP TABLE t;
# Testing example of type GEOMETRY and value ST_GeomFromText("POINT(1 1)")
SHOW CREATE TABLE t;
Table	Create Table
t	CREATE TABLE `t` (
  `a` geometry NOT NULL,
  `b` decimal(34,4) GENERATED ALWAYS AS (`a`) VIRTUAL NOT NULL,
  KEY `on_b` (`b`)
) ENGINE=InnoDB DEFAULT CHARSET=utf8mb4 COLLATE=utf8mb4_0900_ai_ci
INSERT IGNORE INTO t (a) VALUES (ST_GeomFromText("POINT(1 1)"));
Warnings:
Warning	1366	Incorrect decimal value: '\x00\x00\x00\x00\x01\x01\x00\x00\x00\x00\x00\x00\x00\x00\x00\xF0?\x00\x00\x00\x00\x00\x00\xF0?' for column 'b' at row 1
SELECT * FROM t;
a	b
             ð?      ð?	0.0000
Warnings:
Warning	1366	Incorrect decimal value: '\x00\x00\x00\x00\x01\x01\x00\x00\x00\x00\x00\x00\x00\x00\x00\xF0?\x00\x00\x00\x00\x00\x00\xF0?' for column 'b' at row 1
DELETE FROM t;
DELETE IGNORE FROM t;
Warnings:
Warning	1366	Incorrect decimal value: '\x00\x00\x00\x00\x01\x01\x00\x00\x00\x00\x00\x00\x00\x00\x00\xF0?\x00\x00\x00\x00\x00\x00\xF0?' for column 'b' at row 1
Warning	1366	Incorrect decimal value: '\x00\x00\x00\x00\x01\x01\x00\x00\x00\x00\x00\x00\x00\x00\x00\xF0?\x00\x00\x00\x00\x00\x00\xF0?' for column 'b' at row 1
CHECK TABLE t;
Table	Op	Msg_type	Msg_text
test.t	check	status	OK
DROP TABLE t;
# Testing example of type POINT and value ST_GeomFromText("POINT(1 1)")
SHOW CREATE TABLE t;
Table	Create Table
t	CREATE TABLE `t` (
  `a` point NOT NULL,
  `b` decimal(34,4) GENERATED ALWAYS AS (`a`) VIRTUAL NOT NULL,
  KEY `on_b` (`b`)
) ENGINE=InnoDB DEFAULT CHARSET=utf8mb4 COLLATE=utf8mb4_0900_ai_ci
INSERT IGNORE INTO t (a) VALUES (ST_GeomFromText("POINT(1 1)"));
Warnings:
Warning	1366	Incorrect decimal value: '\x00\x00\x00\x00\x01\x01\x00\x00\x00\x00\x00\x00\x00\x00\x00\xF0?\x00\x00\x00\x00\x00\x00\xF0?' for column 'b' at row 1
SELECT * FROM t;
a	b
             ð?      ð?	0.0000
Warnings:
Warning	1366	Incorrect decimal value: '\x00\x00\x00\x00\x01\x01\x00\x00\x00\x00\x00\x00\x00\x00\x00\xF0?\x00\x00\x00\x00\x00\x00\xF0?' for column 'b' at row 1
DELETE FROM t;
DELETE IGNORE FROM t;
Warnings:
Warning	1366	Incorrect decimal value: '\x00\x00\x00\x00\x01\x01\x00\x00\x00\x00\x00\x00\x00\x00\x00\xF0?\x00\x00\x00\x00\x00\x00\xF0?' for column 'b' at row 1
Warning	1366	Incorrect decimal value: '\x00\x00\x00\x00\x01\x01\x00\x00\x00\x00\x00\x00\x00\x00\x00\xF0?\x00\x00\x00\x00\x00\x00\xF0?' for column 'b' at row 1
CHECK TABLE t;
Table	Op	Msg_type	Msg_text
test.t	check	status	OK
DROP TABLE t;
# Testing example of type LINESTRING and value ST_GeomFromText("LINESTRING(0 0,1 1,2 2)")
SHOW CREATE TABLE t;
Table	Create Table
t	CREATE TABLE `t` (
  `a` linestring NOT NULL,
  `b` decimal(34,4) GENERATED ALWAYS AS (`a`) VIRTUAL NOT NULL,
  KEY `on_b` (`b`)
) ENGINE=InnoDB DEFAULT CHARSET=utf8mb4 COLLATE=utf8mb4_0900_ai_ci
INSERT IGNORE INTO t (a) VALUES (ST_GeomFromText("LINESTRING(0 0,1 1,2 2)"));
Warnings:
Warning	1366	Incorrect decimal value: '\x00\x00\x00\x00\x01\x02\x00\x00\x00\x03\x00\x00\x00\x00\x00\x00\x00\x00\x00\x00\x00\x00\x00\x00\x00\x00\x00\x00\x00\x00\x00\x00' for column 'b' at row 1
SELECT * FROM t;
a	b
                                ð?      ð?       @       @	0.0000
Warnings:
Warning	1366	Incorrect decimal value: '\x00\x00\x00\x00\x01\x02\x00\x00\x00\x03\x00\x00\x00\x00\x00\x00\x00\x00\x00\x00\x00\x00\x00\x00\x00\x00\x00\x00\x00\x00\x00\x00' for column 'b' at row 1
DELETE FROM t;
DELETE IGNORE FROM t;
Warnings:
Warning	1366	Incorrect decimal value: '\x00\x00\x00\x00\x01\x02\x00\x00\x00\x03\x00\x00\x00\x00\x00\x00\x00\x00\x00\x00\x00\x00\x00\x00\x00\x00\x00\x00\x00\x00\x00\x00' for column 'b' at row 1
Warning	1366	Incorrect decimal value: '\x00\x00\x00\x00\x01\x02\x00\x00\x00\x03\x00\x00\x00\x00\x00\x00\x00\x00\x00\x00\x00\x00\x00\x00\x00\x00\x00\x00\x00\x00\x00\x00' for column 'b' at row 1
CHECK TABLE t;
Table	Op	Msg_type	Msg_text
test.t	check	status	OK
DROP TABLE t;
# Testing example of type POLYGON and value ST_GeomFromText("POLYGON((0 0,1 0,1 1,0 1,0 0),(5 5,7 5,7 7,5 7,5 5))")
SHOW CREATE TABLE t;
Table	Create Table
t	CREATE TABLE `t` (
  `a` polygon NOT NULL,
  `b` decimal(34,4) GENERATED ALWAYS AS (`a`) VIRTUAL NOT NULL,
  KEY `on_b` (`b`)
) ENGINE=InnoDB DEFAULT CHARSET=utf8mb4 COLLATE=utf8mb4_0900_ai_ci
INSERT IGNORE INTO t (a) VALUES (ST_GeomFromText("POLYGON((0 0,1 0,1 1,0 1,0 0),(5 5,7 5,7 7,5 7,5 5))"));
Warnings:
Warning	1366	Incorrect decimal value: '\x00\x00\x00\x00\x01\x03\x00\x00\x00\x02\x00\x00\x00\x05\x00\x00\x00\x00\x00\x00\x00\x00\x00\x00\x00\x00\x00\x00\x00\x00\x00\x00' for column 'b' at row 1
SELECT * FROM t;
a	b
                                   ð?              ð?      ð?              ð?                         @      @      @      @      @      @      @      @      @      @	0.0000
Warnings:
Warning	1366	Incorrect decimal value: '\x00\x00\x00\x00\x01\x03\x00\x00\x00\x02\x00\x00\x00\x05\x00\x00\x00\x00\x00\x00\x00\x00\x00\x00\x00\x00\x00\x00\x00\x00\x00\x00' for column 'b' at row 1
DELETE FROM t;
DELETE IGNORE FROM t;
Warnings:
Warning	1366	Incorrect decimal value: '\x00\x00\x00\x00\x01\x03\x00\x00\x00\x02\x00\x00\x00\x05\x00\x00\x00\x00\x00\x00\x00\x00\x00\x00\x00\x00\x00\x00\x00\x00\x00\x00' for column 'b' at row 1
Warning	1366	Incorrect decimal value: '\x00\x00\x00\x00\x01\x03\x00\x00\x00\x02\x00\x00\x00\x05\x00\x00\x00\x00\x00\x00\x00\x00\x00\x00\x00\x00\x00\x00\x00\x00\x00\x00' for column 'b' at row 1
CHECK TABLE t;
Table	Op	Msg_type	Msg_text
test.t	check	status	OK
DROP TABLE t;
#
# Testing virtual column of type BIT(64)
#
# Testing example of type JSON and value "{}"
SHOW CREATE TABLE t;
Table	Create Table
t	CREATE TABLE `t` (
  `a` json NOT NULL,
  `b` bit(64) GENERATED ALWAYS AS (`a`) VIRTUAL NOT NULL,
  KEY `on_b` (`b`)
) ENGINE=InnoDB DEFAULT CHARSET=utf8mb4 COLLATE=utf8mb4_0900_ai_ci
INSERT IGNORE INTO t (a) VALUES ("{}");
SELECT * FROM t;
a	b
{}	      {}
DELETE FROM t;
DELETE IGNORE FROM t;
CHECK TABLE t;
Table	Op	Msg_type	Msg_text
test.t	check	status	OK
DROP TABLE t;
# Testing example of type JSON and value '["hello beautiful world"]'
SHOW CREATE TABLE t;
Table	Create Table
t	CREATE TABLE `t` (
  `a` json NOT NULL,
  `b` bit(64) GENERATED ALWAYS AS (`a`) VIRTUAL NOT NULL,
  KEY `on_b` (`b`)
) ENGINE=InnoDB DEFAULT CHARSET=utf8mb4 COLLATE=utf8mb4_0900_ai_ci
INSERT IGNORE INTO t (a) VALUES ('["hello beautiful world"]');
Warnings:
Warning	1406	Data too long for column 'b' at row 1
SELECT * FROM t;
a	b
["hello beautiful world"]	ÿÿÿÿÿÿÿÿ
DELETE FROM t;
DELETE IGNORE FROM t;
CHECK TABLE t;
Table	Op	Msg_type	Msg_text
test.t	check	status	OK
DROP TABLE t;
# Testing example of type JSON and value "-1"
SHOW CREATE TABLE t;
Table	Create Table
t	CREATE TABLE `t` (
  `a` json NOT NULL,
  `b` bit(64) GENERATED ALWAYS AS (`a`) VIRTUAL NOT NULL,
  KEY `on_b` (`b`)
) ENGINE=InnoDB DEFAULT CHARSET=utf8mb4 COLLATE=utf8mb4_0900_ai_ci
INSERT IGNORE INTO t (a) VALUES ("-1");
SELECT * FROM t;
a	b
-1	      -1
DELETE FROM t;
DELETE IGNORE FROM t;
CHECK TABLE t;
Table	Op	Msg_type	Msg_text
test.t	check	status	OK
DROP TABLE t;
# Testing example of type TINYINT and value -1
SHOW CREATE TABLE t;
Table	Create Table
t	CREATE TABLE `t` (
  `a` tinyint NOT NULL,
  `b` bit(64) GENERATED ALWAYS AS (`a`) VIRTUAL NOT NULL,
  KEY `on_b` (`b`)
) ENGINE=InnoDB DEFAULT CHARSET=utf8mb4 COLLATE=utf8mb4_0900_ai_ci
INSERT IGNORE INTO t (a) VALUES (-1);
SELECT * FROM t;
a	b
-1	ÿÿÿÿÿÿÿÿ
DELETE FROM t;
DELETE IGNORE FROM t;
CHECK TABLE t;
Table	Op	Msg_type	Msg_text
test.t	check	status	OK
DROP TABLE t;
# Testing example of type SMALLINT and value -1
SHOW CREATE TABLE t;
Table	Create Table
t	CREATE TABLE `t` (
  `a` smallint NOT NULL,
  `b` bit(64) GENERATED ALWAYS AS (`a`) VIRTUAL NOT NULL,
  KEY `on_b` (`b`)
) ENGINE=InnoDB DEFAULT CHARSET=utf8mb4 COLLATE=utf8mb4_0900_ai_ci
INSERT IGNORE INTO t (a) VALUES (-1);
SELECT * FROM t;
a	b
-1	ÿÿÿÿÿÿÿÿ
DELETE FROM t;
DELETE IGNORE FROM t;
CHECK TABLE t;
Table	Op	Msg_type	Msg_text
test.t	check	status	OK
DROP TABLE t;
# Testing example of type MEDIUMINT and value -1
SHOW CREATE TABLE t;
Table	Create Table
t	CREATE TABLE `t` (
  `a` mediumint NOT NULL,
  `b` bit(64) GENERATED ALWAYS AS (`a`) VIRTUAL NOT NULL,
  KEY `on_b` (`b`)
) ENGINE=InnoDB DEFAULT CHARSET=utf8mb4 COLLATE=utf8mb4_0900_ai_ci
INSERT IGNORE INTO t (a) VALUES (-1);
SELECT * FROM t;
a	b
-1	ÿÿÿÿÿÿÿÿ
DELETE FROM t;
DELETE IGNORE FROM t;
CHECK TABLE t;
Table	Op	Msg_type	Msg_text
test.t	check	status	OK
DROP TABLE t;
# Testing example of type INT and value 2000000000
SHOW CREATE TABLE t;
Table	Create Table
t	CREATE TABLE `t` (
  `a` int NOT NULL,
  `b` bit(64) GENERATED ALWAYS AS (`a`) VIRTUAL NOT NULL,
  KEY `on_b` (`b`)
) ENGINE=InnoDB DEFAULT CHARSET=utf8mb4 COLLATE=utf8mb4_0900_ai_ci
INSERT IGNORE INTO t (a) VALUES (2000000000);
SELECT * FROM t;
a	b
2000000000	    w5” 
DELETE FROM t;
DELETE IGNORE FROM t;
CHECK TABLE t;
Table	Op	Msg_type	Msg_text
test.t	check	status	OK
DROP TABLE t;
# Testing example of type INT and value -2000000000
SHOW CREATE TABLE t;
Table	Create Table
t	CREATE TABLE `t` (
  `a` int NOT NULL,
  `b` bit(64) GENERATED ALWAYS AS (`a`) VIRTUAL NOT NULL,
  KEY `on_b` (`b`)
) ENGINE=InnoDB DEFAULT CHARSET=utf8mb4 COLLATE=utf8mb4_0900_ai_ci
INSERT IGNORE INTO t (a) VALUES (-2000000000);
SELECT * FROM t;
a	b
-2000000000	ÿÿÿÿˆÊl 
DELETE FROM t;
DELETE IGNORE FROM t;
CHECK TABLE t;
Table	Op	Msg_type	Msg_text
test.t	check	status	OK
DROP TABLE t;
# Testing example of type INT UNSIGNED and value 4000000000
SHOW CREATE TABLE t;
Table	Create Table
t	CREATE TABLE `t` (
  `a` int unsigned NOT NULL,
  `b` bit(64) GENERATED ALWAYS AS (`a`) VIRTUAL NOT NULL,
  KEY `on_b` (`b`)
) ENGINE=InnoDB DEFAULT CHARSET=utf8mb4 COLLATE=utf8mb4_0900_ai_ci
INSERT IGNORE INTO t (a) VALUES (4000000000);
SELECT * FROM t;
a	b
4000000000	    îk( 
DELETE FROM t;
DELETE IGNORE FROM t;
CHECK TABLE t;
Table	Op	Msg_type	Msg_text
test.t	check	status	OK
DROP TABLE t;
# Testing example of type BIGINT and value 2000000000000000000
SHOW CREATE TABLE t;
Table	Create Table
t	CREATE TABLE `t` (
  `a` bigint NOT NULL,
  `b` bit(64) GENERATED ALWAYS AS (`a`) VIRTUAL NOT NULL,
  KEY `on_b` (`b`)
) ENGINE=InnoDB DEFAULT CHARSET=utf8mb4 COLLATE=utf8mb4_0900_ai_ci
INSERT IGNORE INTO t (a) VALUES (2000000000000000000);
SELECT * FROM t;
a	b
2000000000000000000	ÁmgNÈ  
DELETE FROM t;
DELETE IGNORE FROM t;
CHECK TABLE t;
Table	Op	Msg_type	Msg_text
test.t	check	status	OK
DROP TABLE t;
# Testing example of type BIGINT and value -2000000000000000000
SHOW CREATE TABLE t;
Table	Create Table
t	CREATE TABLE `t` (
  `a` bigint NOT NULL,
  `b` bit(64) GENERATED ALWAYS AS (`a`) VIRTUAL NOT NULL,
  KEY `on_b` (`b`)
) ENGINE=InnoDB DEFAULT CHARSET=utf8mb4 COLLATE=utf8mb4_0900_ai_ci
INSERT IGNORE INTO t (a) VALUES (-2000000000000000000);
SELECT * FROM t;
a	b
-2000000000000000000	ä>’˜±8  
DELETE FROM t;
DELETE IGNORE FROM t;
CHECK TABLE t;
Table	Op	Msg_type	Msg_text
test.t	check	status	OK
DROP TABLE t;
# Testing example of type FLOAT and value -1.23456
SHOW CREATE TABLE t;
Table	Create Table
t	CREATE TABLE `t` (
  `a` float NOT NULL,
  `b` bit(64) GENERATED ALWAYS AS (`a`) VIRTUAL NOT NULL,
  KEY `on_b` (`b`)
) ENGINE=InnoDB DEFAULT CHARSET=utf8mb4 COLLATE=utf8mb4_0900_ai_ci
INSERT IGNORE INTO t (a) VALUES (-1.23456);
SELECT * FROM t;
a	b
-1.23456	ÿÿÿÿÿÿÿÿ
DELETE FROM t;
DELETE IGNORE FROM t;
CHECK TABLE t;
Table	Op	Msg_type	Msg_text
test.t	check	status	OK
DROP TABLE t;
# Testing example of type FLOAT and value -1e38
SHOW CREATE TABLE t;
Table	Create Table
t	CREATE TABLE `t` (
  `a` float NOT NULL,
  `b` bit(64) GENERATED ALWAYS AS (`a`) VIRTUAL NOT NULL,
  KEY `on_b` (`b`)
) ENGINE=InnoDB DEFAULT CHARSET=utf8mb4 COLLATE=utf8mb4_0900_ai_ci
INSERT IGNORE INTO t (a) VALUES (-1e38);
SELECT * FROM t;
a	b
-1e38	€       
DELETE FROM t;
DELETE IGNORE FROM t;
CHECK TABLE t;
Table	Op	Msg_type	Msg_text
test.t	check	status	OK
DROP TABLE t;
# Testing example of type FLOAT and value 1e38
SHOW CREATE TABLE t;
Table	Create Table
t	CREATE TABLE `t` (
  `a` float NOT NULL,
  `b` bit(64) GENERATED ALWAYS AS (`a`) VIRTUAL NOT NULL,
  KEY `on_b` (`b`)
) ENGINE=InnoDB DEFAULT CHARSET=utf8mb4 COLLATE=utf8mb4_0900_ai_ci
INSERT IGNORE INTO t (a) VALUES (1e38);
SELECT * FROM t;
a	b
1e38	ÿÿÿÿÿÿÿ
DELETE FROM t;
DELETE IGNORE FROM t;
CHECK TABLE t;
Table	Op	Msg_type	Msg_text
test.t	check	status	OK
DROP TABLE t;
# Testing example of type DOUBLE and value -1.23456789012345
SHOW CREATE TABLE t;
Table	Create Table
t	CREATE TABLE `t` (
  `a` double NOT NULL,
  `b` bit(64) GENERATED ALWAYS AS (`a`) VIRTUAL NOT NULL,
  KEY `on_b` (`b`)
) ENGINE=InnoDB DEFAULT CHARSET=utf8mb4 COLLATE=utf8mb4_0900_ai_ci
INSERT IGNORE INTO t (a) VALUES (-1.23456789012345);
SELECT * FROM t;
a	b
-1.23456789012345	ÿÿÿÿÿÿÿÿ
DELETE FROM t;
DELETE IGNORE FROM t;
CHECK TABLE t;
Table	Op	Msg_type	Msg_text
test.t	check	status	OK
DROP TABLE t;
# Testing example of type DOUBLE and value 1.23456789012345
SHOW CREATE TABLE t;
Table	Create Table
t	CREATE TABLE `t` (
  `a` double NOT NULL,
  `b` bit(64) GENERATED ALWAYS AS (`a`) VIRTUAL NOT NULL,
  KEY `on_b` (`b`)
) ENGINE=InnoDB DEFAULT CHARSET=utf8mb4 COLLATE=utf8mb4_0900_ai_ci
INSERT IGNORE INTO t (a) VALUES (1.23456789012345);
SELECT * FROM t;
a	b
1.23456789012345	       
DELETE FROM t;
DELETE IGNORE FROM t;
CHECK TABLE t;
Table	Op	Msg_type	Msg_text
test.t	check	status	OK
DROP TABLE t;
# Testing example of type DOUBLE and value -1e300
SHOW CREATE TABLE t;
Table	Create Table
t	CREATE TABLE `t` (
  `a` double NOT NULL,
  `b` bit(64) GENERATED ALWAYS AS (`a`) VIRTUAL NOT NULL,
  KEY `on_b` (`b`)
) ENGINE=InnoDB DEFAULT CHARSET=utf8mb4 COLLATE=utf8mb4_0900_ai_ci
INSERT IGNORE INTO t (a) VALUES (-1e300);
SELECT * FROM t;
a	b
-1e300	€       
DELETE FROM t;
DELETE IGNORE FROM t;
CHECK TABLE t;
Table	Op	Msg_type	Msg_text
test.t	check	status	OK
DROP TABLE t;
# Testing example of type DOUBLE and value 1e300
SHOW CREATE TABLE t;
Table	Create Table
t	CREATE TABLE `t` (
  `a` double NOT NULL,
  `b` bit(64) GENERATED ALWAYS AS (`a`) VIRTUAL NOT NULL,
  KEY `on_b` (`b`)
) ENGINE=InnoDB DEFAULT CHARSET=utf8mb4 COLLATE=utf8mb4_0900_ai_ci
INSERT IGNORE INTO t (a) VALUES (1e300);
SELECT * FROM t;
a	b
1e300	ÿÿÿÿÿÿÿ
DELETE FROM t;
DELETE IGNORE FROM t;
CHECK TABLE t;
Table	Op	Msg_type	Msg_text
test.t	check	status	OK
DROP TABLE t;
# Testing example of type DECIMAL(4,2) and value -10.99
SHOW CREATE TABLE t;
Table	Create Table
t	CREATE TABLE `t` (
  `a` decimal(4,2) NOT NULL,
  `b` bit(64) GENERATED ALWAYS AS (`a`) VIRTUAL NOT NULL,
  KEY `on_b` (`b`)
) ENGINE=InnoDB DEFAULT CHARSET=utf8mb4 COLLATE=utf8mb4_0900_ai_ci
INSERT IGNORE INTO t (a) VALUES (-10.99);
Warnings:
Warning	1264	Out of range value for column 'b' at row 1
SELECT * FROM t;
a	b
-10.99	        
DELETE FROM t;
DELETE IGNORE FROM t;
CHECK TABLE t;
Table	Op	Msg_type	Msg_text
test.t	check	status	OK
DROP TABLE t;
# Testing example of type DECIMAL(34,4) and value 20000000000000000000000000000.0001
SHOW CREATE TABLE t;
Table	Create Table
t	CREATE TABLE `t` (
  `a` decimal(34,4) NOT NULL,
  `b` bit(64) GENERATED ALWAYS AS (`a`) VIRTUAL NOT NULL,
  KEY `on_b` (`b`)
) ENGINE=InnoDB DEFAULT CHARSET=utf8mb4 COLLATE=utf8mb4_0900_ai_ci
INSERT IGNORE INTO t (a) VALUES (20000000000000000000000000000.0001);
Warnings:
Warning	1264	Out of range value for column 'b' at row 1
SELECT * FROM t;
a	b
20000000000000000000000000000.0001	ÿÿÿÿÿÿÿÿ
DELETE FROM t;
DELETE IGNORE FROM t;
CHECK TABLE t;
Table	Op	Msg_type	Msg_text
test.t	check	status	OK
DROP TABLE t;
# Testing example of type DECIMAL(34,4) and value -20000000000000000000000000000.0001
SHOW CREATE TABLE t;
Table	Create Table
t	CREATE TABLE `t` (
  `a` decimal(34,4) NOT NULL,
  `b` bit(64) GENERATED ALWAYS AS (`a`) VIRTUAL NOT NULL,
  KEY `on_b` (`b`)
) ENGINE=InnoDB DEFAULT CHARSET=utf8mb4 COLLATE=utf8mb4_0900_ai_ci
INSERT IGNORE INTO t (a) VALUES (-20000000000000000000000000000.0001);
Warnings:
Warning	1264	Out of range value for column 'b' at row 1
SELECT * FROM t;
a	b
-20000000000000000000000000000.0001	        
DELETE FROM t;
DELETE IGNORE FROM t;
CHECK TABLE t;
Table	Op	Msg_type	Msg_text
test.t	check	status	OK
DROP TABLE t;
# Testing example of type BIT(64) and value 0xDEADBEEFC0FEBABE
SHOW CREATE TABLE t;
Table	Create Table
t	CREATE TABLE `t` (
  `a` bit(64) NOT NULL,
  `b` bit(64) GENERATED ALWAYS AS (`a`) VIRTUAL NOT NULL,
  KEY `on_b` (`b`)
) ENGINE=InnoDB DEFAULT CHARSET=utf8mb4 COLLATE=utf8mb4_0900_ai_ci
INSERT IGNORE INTO t (a) VALUES (0xDEADBEEFC0FEBABE);
SELECT * FROM t;
a	b
Þ­¾ïÀþº¾	Þ­¾ïÀþº¾
DELETE FROM t;
DELETE IGNORE FROM t;
CHECK TABLE t;
Table	Op	Msg_type	Msg_text
test.t	check	status	OK
DROP TABLE t;
# Testing example of type BIT(4) and value 0b1000
SHOW CREATE TABLE t;
Table	Create Table
t	CREATE TABLE `t` (
  `a` bit(4) NOT NULL,
  `b` bit(64) GENERATED ALWAYS AS (`a`) VIRTUAL NOT NULL,
  KEY `on_b` (`b`)
) ENGINE=InnoDB DEFAULT CHARSET=utf8mb4 COLLATE=utf8mb4_0900_ai_ci
INSERT IGNORE INTO t (a) VALUES (0b1000);
SELECT * FROM t;
a	b
	       
DELETE FROM t;
DELETE IGNORE FROM t;
CHECK TABLE t;
Table	Op	Msg_type	Msg_text
test.t	check	status	OK
DROP TABLE t;
# Testing example of type YEAR and value 2020
SHOW CREATE TABLE t;
Table	Create Table
t	CREATE TABLE `t` (
  `a` year NOT NULL,
  `b` bit(64) GENERATED ALWAYS AS (`a`) VIRTUAL NOT NULL,
  KEY `on_b` (`b`)
) ENGINE=InnoDB DEFAULT CHARSET=utf8mb4 COLLATE=utf8mb4_0900_ai_ci
INSERT IGNORE INTO t (a) VALUES (2020);
SELECT * FROM t;
a	b
2020	      ä
DELETE FROM t;
DELETE IGNORE FROM t;
CHECK TABLE t;
Table	Op	Msg_type	Msg_text
test.t	check	status	OK
DROP TABLE t;
# Testing example of type DATE and value "2030-04-05"
SHOW CREATE TABLE t;
Table	Create Table
t	CREATE TABLE `t` (
  `a` date NOT NULL,
  `b` bit(64) GENERATED ALWAYS AS (`a`) VIRTUAL NOT NULL,
  KEY `on_b` (`b`)
) ENGINE=InnoDB DEFAULT CHARSET=utf8mb4 COLLATE=utf8mb4_0900_ai_ci
INSERT IGNORE INTO t (a) VALUES ("2030-04-05");
SELECT * FROM t;
a	b
2030-04-05	  vŽmÇ@
DELETE FROM t;
DELETE IGNORE FROM t;
CHECK TABLE t;
Table	Op	Msg_type	Msg_text
test.t	check	status	OK
DROP TABLE t;
# Testing example of type TIME and value "11:12:13"
SHOW CREATE TABLE t;
Table	Create Table
t	CREATE TABLE `t` (
  `a` time NOT NULL,
  `b` bit(64) GENERATED ALWAYS AS (`a`) VIRTUAL NOT NULL,
  KEY `on_b` (`b`)
) ENGINE=InnoDB DEFAULT CHARSET=utf8mb4 COLLATE=utf8mb4_0900_ai_ci
INSERT IGNORE INTO t (a) VALUES ("11:12:13");
SELECT * FROM t;
a	b
11:12:13	     ²m
DELETE FROM t;
DELETE IGNORE FROM t;
CHECK TABLE t;
Table	Op	Msg_type	Msg_text
test.t	check	status	OK
DROP TABLE t;
# Testing example of type DATETIME and value "2030-04-05 11:12:13"
SHOW CREATE TABLE t;
Table	Create Table
t	CREATE TABLE `t` (
  `a` datetime NOT NULL,
  `b` bit(64) GENERATED ALWAYS AS (`a`) VIRTUAL NOT NULL,
  KEY `on_b` (`b`)
) ENGINE=InnoDB DEFAULT CHARSET=utf8mb4 COLLATE=utf8mb4_0900_ai_ci
INSERT IGNORE INTO t (a) VALUES ("2030-04-05 11:12:13");
SELECT * FROM t;
a	b
2030-04-05 11:12:13	  vŽoy­
DELETE FROM t;
DELETE IGNORE FROM t;
CHECK TABLE t;
Table	Op	Msg_type	Msg_text
test.t	check	status	OK
DROP TABLE t;
# Testing example of type TIMESTAMP and value "2030-04-05 11:12:13"
SHOW CREATE TABLE t;
Table	Create Table
t	CREATE TABLE `t` (
  `a` timestamp NOT NULL,
  `b` bit(64) GENERATED ALWAYS AS (`a`) VIRTUAL NOT NULL,
  KEY `on_b` (`b`)
) ENGINE=InnoDB DEFAULT CHARSET=utf8mb4 COLLATE=utf8mb4_0900_ai_ci
INSERT IGNORE INTO t (a) VALUES ("2030-04-05 11:12:13");
SELECT * FROM t;
a	b
2030-04-05 11:12:13	  vŽoy­
DELETE FROM t;
DELETE IGNORE FROM t;
CHECK TABLE t;
Table	Op	Msg_type	Msg_text
test.t	check	status	OK
DROP TABLE t;
# Testing example of type CHAR(40) and value "2000000000000000000000000000000000000"
SHOW CREATE TABLE t;
Table	Create Table
t	CREATE TABLE `t` (
  `a` char(40) NOT NULL,
  `b` bit(64) GENERATED ALWAYS AS (`a`) VIRTUAL NOT NULL,
  KEY `on_b` (`b`)
) ENGINE=InnoDB DEFAULT CHARSET=utf8mb4 COLLATE=utf8mb4_0900_ai_ci
INSERT IGNORE INTO t (a) VALUES ("2000000000000000000000000000000000000");
Warnings:
Warning	1406	Data too long for column 'b' at row 1
SELECT * FROM t;
a	b
2000000000000000000000000000000000000	ÿÿÿÿÿÿÿÿ
DELETE FROM t;
DELETE IGNORE FROM t;
CHECK TABLE t;
Table	Op	Msg_type	Msg_text
test.t	check	status	OK
DROP TABLE t;
# Testing example of type BINARY(45) and value "200000000000000000000000000000000000000000"
SHOW CREATE TABLE t;
Table	Create Table
t	CREATE TABLE `t` (
  `a` binary(45) NOT NULL,
  `b` bit(64) GENERATED ALWAYS AS (`a`) VIRTUAL NOT NULL,
  KEY `on_b` (`b`)
) ENGINE=InnoDB DEFAULT CHARSET=utf8mb4 COLLATE=utf8mb4_0900_ai_ci
INSERT IGNORE INTO t (a) VALUES ("200000000000000000000000000000000000000000");
Warnings:
Warning	1406	Data too long for column 'b' at row 1
SELECT * FROM t;
a	b
200000000000000000000000000000000000000000   	ÿÿÿÿÿÿÿÿ
DELETE FROM t;
DELETE IGNORE FROM t;
CHECK TABLE t;
Table	Op	Msg_type	Msg_text
test.t	check	status	OK
DROP TABLE t;
# Testing example of type VARCHAR(50) and value "2000000000000000000000000000000000000000000000000"
SHOW CREATE TABLE t;
Table	Create Table
t	CREATE TABLE `t` (
  `a` varchar(50) NOT NULL,
  `b` bit(64) GENERATED ALWAYS AS (`a`) VIRTUAL NOT NULL,
  KEY `on_b` (`b`)
) ENGINE=InnoDB DEFAULT CHARSET=utf8mb4 COLLATE=utf8mb4_0900_ai_ci
INSERT IGNORE INTO t (a) VALUES ("2000000000000000000000000000000000000000000000000");
Warnings:
Warning	1406	Data too long for column 'b' at row 1
SELECT * FROM t;
a	b
2000000000000000000000000000000000000000000000000	ÿÿÿÿÿÿÿÿ
DELETE FROM t;
DELETE IGNORE FROM t;
CHECK TABLE t;
Table	Op	Msg_type	Msg_text
test.t	check	status	OK
DROP TABLE t;
# Testing example of type CHAR(24) and value "hello beautiful world"
SHOW CREATE TABLE t;
Table	Create Table
t	CREATE TABLE `t` (
  `a` char(24) NOT NULL,
  `b` bit(64) GENERATED ALWAYS AS (`a`) VIRTUAL NOT NULL,
  KEY `on_b` (`b`)
) ENGINE=InnoDB DEFAULT CHARSET=utf8mb4 COLLATE=utf8mb4_0900_ai_ci
INSERT IGNORE INTO t (a) VALUES ("hello beautiful world");
Warnings:
Warning	1406	Data too long for column 'b' at row 1
SELECT * FROM t;
a	b
hello beautiful world	ÿÿÿÿÿÿÿÿ
DELETE FROM t;
DELETE IGNORE FROM t;
CHECK TABLE t;
Table	Op	Msg_type	Msg_text
test.t	check	status	OK
DROP TABLE t;
# Testing example of type BINARY(12) and value "hello world"
SHOW CREATE TABLE t;
Table	Create Table
t	CREATE TABLE `t` (
  `a` binary(12) NOT NULL,
  `b` bit(64) GENERATED ALWAYS AS (`a`) VIRTUAL NOT NULL,
  KEY `on_b` (`b`)
) ENGINE=InnoDB DEFAULT CHARSET=utf8mb4 COLLATE=utf8mb4_0900_ai_ci
INSERT IGNORE INTO t (a) VALUES ("hello world");
Warnings:
Warning	1406	Data too long for column 'b' at row 1
SELECT * FROM t;
a	b
hello world 	ÿÿÿÿÿÿÿÿ
DELETE FROM t;
DELETE IGNORE FROM t;
CHECK TABLE t;
Table	Op	Msg_type	Msg_text
test.t	check	status	OK
DROP TABLE t;
# Testing example of type VARCHAR(6) and value "hello"
SHOW CREATE TABLE t;
Table	Create Table
t	CREATE TABLE `t` (
  `a` varchar(6) NOT NULL,
  `b` bit(64) GENERATED ALWAYS AS (`a`) VIRTUAL NOT NULL,
  KEY `on_b` (`b`)
) ENGINE=InnoDB DEFAULT CHARSET=utf8mb4 COLLATE=utf8mb4_0900_ai_ci
INSERT IGNORE INTO t (a) VALUES ("hello");
SELECT * FROM t;
a	b
hello	   hello
DELETE FROM t;
DELETE IGNORE FROM t;
CHECK TABLE t;
Table	Op	Msg_type	Msg_text
test.t	check	status	OK
DROP TABLE t;
# Testing example of type ENUM("up","down") and value "up"
SHOW CREATE TABLE t;
Table	Create Table
t	CREATE TABLE `t` (
  `a` enum('up','down') NOT NULL,
  `b` bit(64) GENERATED ALWAYS AS (`a`) VIRTUAL NOT NULL,
  KEY `on_b` (`b`)
) ENGINE=InnoDB DEFAULT CHARSET=utf8mb4 COLLATE=utf8mb4_0900_ai_ci
INSERT IGNORE INTO t (a) VALUES ("up");
SELECT * FROM t;
a	b
up	       
DELETE FROM t;
DELETE IGNORE FROM t;
CHECK TABLE t;
Table	Op	Msg_type	Msg_text
test.t	check	status	OK
DROP TABLE t;
# Testing example of type SET("up","down") and value "up,down"
SHOW CREATE TABLE t;
Table	Create Table
t	CREATE TABLE `t` (
  `a` set('up','down') NOT NULL,
  `b` bit(64) GENERATED ALWAYS AS (`a`) VIRTUAL NOT NULL,
  KEY `on_b` (`b`)
) ENGINE=InnoDB DEFAULT CHARSET=utf8mb4 COLLATE=utf8mb4_0900_ai_ci
INSERT IGNORE INTO t (a) VALUES ("up,down");
SELECT * FROM t;
a	b
up,down	       
DELETE FROM t;
DELETE IGNORE FROM t;
CHECK TABLE t;
Table	Op	Msg_type	Msg_text
test.t	check	status	OK
DROP TABLE t;
# Testing example of type GEOMETRY and value ST_GeomFromText("POINT(1 1)")
SHOW CREATE TABLE t;
Table	Create Table
t	CREATE TABLE `t` (
  `a` geometry NOT NULL,
  `b` bit(64) GENERATED ALWAYS AS (`a`) VIRTUAL NOT NULL,
  KEY `on_b` (`b`)
) ENGINE=InnoDB DEFAULT CHARSET=utf8mb4 COLLATE=utf8mb4_0900_ai_ci
INSERT IGNORE INTO t (a) VALUES (ST_GeomFromText("POINT(1 1)"));
Warnings:
Warning	1406	Data too long for column 'b' at row 1
SELECT * FROM t;
a	b
             ð?      ð?	ÿÿÿÿÿÿÿÿ
DELETE FROM t;
DELETE IGNORE FROM t;
CHECK TABLE t;
Table	Op	Msg_type	Msg_text
test.t	check	status	OK
DROP TABLE t;
# Testing example of type POINT and value ST_GeomFromText("POINT(1 1)")
SHOW CREATE TABLE t;
Table	Create Table
t	CREATE TABLE `t` (
  `a` point NOT NULL,
  `b` bit(64) GENERATED ALWAYS AS (`a`) VIRTUAL NOT NULL,
  KEY `on_b` (`b`)
) ENGINE=InnoDB DEFAULT CHARSET=utf8mb4 COLLATE=utf8mb4_0900_ai_ci
INSERT IGNORE INTO t (a) VALUES (ST_GeomFromText("POINT(1 1)"));
Warnings:
Warning	1406	Data too long for column 'b' at row 1
SELECT * FROM t;
a	b
             ð?      ð?	ÿÿÿÿÿÿÿÿ
DELETE FROM t;
DELETE IGNORE FROM t;
CHECK TABLE t;
Table	Op	Msg_type	Msg_text
test.t	check	status	OK
DROP TABLE t;
# Testing example of type LINESTRING and value ST_GeomFromText("LINESTRING(0 0,1 1,2 2)")
SHOW CREATE TABLE t;
Table	Create Table
t	CREATE TABLE `t` (
  `a` linestring NOT NULL,
  `b` bit(64) GENERATED ALWAYS AS (`a`) VIRTUAL NOT NULL,
  KEY `on_b` (`b`)
) ENGINE=InnoDB DEFAULT CHARSET=utf8mb4 COLLATE=utf8mb4_0900_ai_ci
INSERT IGNORE INTO t (a) VALUES (ST_GeomFromText("LINESTRING(0 0,1 1,2 2)"));
Warnings:
Warning	1406	Data too long for column 'b' at row 1
SELECT * FROM t;
a	b
                                ð?      ð?       @       @	ÿÿÿÿÿÿÿÿ
DELETE FROM t;
DELETE IGNORE FROM t;
CHECK TABLE t;
Table	Op	Msg_type	Msg_text
test.t	check	status	OK
DROP TABLE t;
# Testing example of type POLYGON and value ST_GeomFromText("POLYGON((0 0,1 0,1 1,0 1,0 0),(5 5,7 5,7 7,5 7,5 5))")
SHOW CREATE TABLE t;
Table	Create Table
t	CREATE TABLE `t` (
  `a` polygon NOT NULL,
  `b` bit(64) GENERATED ALWAYS AS (`a`) VIRTUAL NOT NULL,
  KEY `on_b` (`b`)
) ENGINE=InnoDB DEFAULT CHARSET=utf8mb4 COLLATE=utf8mb4_0900_ai_ci
INSERT IGNORE INTO t (a) VALUES (ST_GeomFromText("POLYGON((0 0,1 0,1 1,0 1,0 0),(5 5,7 5,7 7,5 7,5 5))"));
Warnings:
Warning	1406	Data too long for column 'b' at row 1
SELECT * FROM t;
a	b
                                   ð?              ð?      ð?              ð?                         @      @      @      @      @      @      @      @      @      @	ÿÿÿÿÿÿÿÿ
DELETE FROM t;
DELETE IGNORE FROM t;
CHECK TABLE t;
Table	Op	Msg_type	Msg_text
test.t	check	status	OK
DROP TABLE t;
#
# Testing virtual column of type BIT(4)
#
# Testing example of type JSON and value "{}"
SHOW CREATE TABLE t;
Table	Create Table
t	CREATE TABLE `t` (
  `a` json NOT NULL,
  `b` bit(4) GENERATED ALWAYS AS (`a`) VIRTUAL NOT NULL,
  KEY `on_b` (`b`)
) ENGINE=InnoDB DEFAULT CHARSET=utf8mb4 COLLATE=utf8mb4_0900_ai_ci
INSERT IGNORE INTO t (a) VALUES ("{}");
Warnings:
Warning	1406	Data too long for column 'b' at row 1
SELECT * FROM t;
a	b
{}	
DELETE FROM t;
DELETE IGNORE FROM t;
CHECK TABLE t;
Table	Op	Msg_type	Msg_text
test.t	check	status	OK
DROP TABLE t;
# Testing example of type JSON and value '["hello beautiful world"]'
SHOW CREATE TABLE t;
Table	Create Table
t	CREATE TABLE `t` (
  `a` json NOT NULL,
  `b` bit(4) GENERATED ALWAYS AS (`a`) VIRTUAL NOT NULL,
  KEY `on_b` (`b`)
) ENGINE=InnoDB DEFAULT CHARSET=utf8mb4 COLLATE=utf8mb4_0900_ai_ci
INSERT IGNORE INTO t (a) VALUES ('["hello beautiful world"]');
Warnings:
Warning	1406	Data too long for column 'b' at row 1
SELECT * FROM t;
a	b
["hello beautiful world"]	
DELETE FROM t;
DELETE IGNORE FROM t;
CHECK TABLE t;
Table	Op	Msg_type	Msg_text
test.t	check	status	OK
DROP TABLE t;
# Testing example of type JSON and value "-1"
SHOW CREATE TABLE t;
Table	Create Table
t	CREATE TABLE `t` (
  `a` json NOT NULL,
  `b` bit(4) GENERATED ALWAYS AS (`a`) VIRTUAL NOT NULL,
  KEY `on_b` (`b`)
) ENGINE=InnoDB DEFAULT CHARSET=utf8mb4 COLLATE=utf8mb4_0900_ai_ci
INSERT IGNORE INTO t (a) VALUES ("-1");
Warnings:
Warning	1406	Data too long for column 'b' at row 1
SELECT * FROM t;
a	b
-1	
DELETE FROM t;
DELETE IGNORE FROM t;
CHECK TABLE t;
Table	Op	Msg_type	Msg_text
test.t	check	status	OK
DROP TABLE t;
# Testing example of type TINYINT and value -1
SHOW CREATE TABLE t;
Table	Create Table
t	CREATE TABLE `t` (
  `a` tinyint NOT NULL,
  `b` bit(4) GENERATED ALWAYS AS (`a`) VIRTUAL NOT NULL,
  KEY `on_b` (`b`)
) ENGINE=InnoDB DEFAULT CHARSET=utf8mb4 COLLATE=utf8mb4_0900_ai_ci
INSERT IGNORE INTO t (a) VALUES (-1);
Warnings:
Warning	1406	Data too long for column 'b' at row 1
SELECT * FROM t;
a	b
-1	
DELETE FROM t;
DELETE IGNORE FROM t;
CHECK TABLE t;
Table	Op	Msg_type	Msg_text
test.t	check	status	OK
DROP TABLE t;
# Testing example of type SMALLINT and value -1
SHOW CREATE TABLE t;
Table	Create Table
t	CREATE TABLE `t` (
  `a` smallint NOT NULL,
  `b` bit(4) GENERATED ALWAYS AS (`a`) VIRTUAL NOT NULL,
  KEY `on_b` (`b`)
) ENGINE=InnoDB DEFAULT CHARSET=utf8mb4 COLLATE=utf8mb4_0900_ai_ci
INSERT IGNORE INTO t (a) VALUES (-1);
Warnings:
Warning	1406	Data too long for column 'b' at row 1
SELECT * FROM t;
a	b
-1	
DELETE FROM t;
DELETE IGNORE FROM t;
CHECK TABLE t;
Table	Op	Msg_type	Msg_text
test.t	check	status	OK
DROP TABLE t;
# Testing example of type MEDIUMINT and value -1
SHOW CREATE TABLE t;
Table	Create Table
t	CREATE TABLE `t` (
  `a` mediumint NOT NULL,
  `b` bit(4) GENERATED ALWAYS AS (`a`) VIRTUAL NOT NULL,
  KEY `on_b` (`b`)
) ENGINE=InnoDB DEFAULT CHARSET=utf8mb4 COLLATE=utf8mb4_0900_ai_ci
INSERT IGNORE INTO t (a) VALUES (-1);
Warnings:
Warning	1406	Data too long for column 'b' at row 1
SELECT * FROM t;
a	b
-1	
DELETE FROM t;
DELETE IGNORE FROM t;
CHECK TABLE t;
Table	Op	Msg_type	Msg_text
test.t	check	status	OK
DROP TABLE t;
# Testing example of type INT and value 2000000000
SHOW CREATE TABLE t;
Table	Create Table
t	CREATE TABLE `t` (
  `a` int NOT NULL,
  `b` bit(4) GENERATED ALWAYS AS (`a`) VIRTUAL NOT NULL,
  KEY `on_b` (`b`)
) ENGINE=InnoDB DEFAULT CHARSET=utf8mb4 COLLATE=utf8mb4_0900_ai_ci
INSERT IGNORE INTO t (a) VALUES (2000000000);
Warnings:
Warning	1406	Data too long for column 'b' at row 1
SELECT * FROM t;
a	b
2000000000	
DELETE FROM t;
DELETE IGNORE FROM t;
CHECK TABLE t;
Table	Op	Msg_type	Msg_text
test.t	check	status	OK
DROP TABLE t;
# Testing example of type INT and value -2000000000
SHOW CREATE TABLE t;
Table	Create Table
t	CREATE TABLE `t` (
  `a` int NOT NULL,
  `b` bit(4) GENERATED ALWAYS AS (`a`) VIRTUAL NOT NULL,
  KEY `on_b` (`b`)
) ENGINE=InnoDB DEFAULT CHARSET=utf8mb4 COLLATE=utf8mb4_0900_ai_ci
INSERT IGNORE INTO t (a) VALUES (-2000000000);
Warnings:
Warning	1406	Data too long for column 'b' at row 1
SELECT * FROM t;
a	b
-2000000000	
DELETE FROM t;
DELETE IGNORE FROM t;
CHECK TABLE t;
Table	Op	Msg_type	Msg_text
test.t	check	status	OK
DROP TABLE t;
# Testing example of type INT UNSIGNED and value 4000000000
SHOW CREATE TABLE t;
Table	Create Table
t	CREATE TABLE `t` (
  `a` int unsigned NOT NULL,
  `b` bit(4) GENERATED ALWAYS AS (`a`) VIRTUAL NOT NULL,
  KEY `on_b` (`b`)
) ENGINE=InnoDB DEFAULT CHARSET=utf8mb4 COLLATE=utf8mb4_0900_ai_ci
INSERT IGNORE INTO t (a) VALUES (4000000000);
Warnings:
Warning	1406	Data too long for column 'b' at row 1
SELECT * FROM t;
a	b
4000000000	
DELETE FROM t;
DELETE IGNORE FROM t;
CHECK TABLE t;
Table	Op	Msg_type	Msg_text
test.t	check	status	OK
DROP TABLE t;
# Testing example of type BIGINT and value 2000000000000000000
SHOW CREATE TABLE t;
Table	Create Table
t	CREATE TABLE `t` (
  `a` bigint NOT NULL,
  `b` bit(4) GENERATED ALWAYS AS (`a`) VIRTUAL NOT NULL,
  KEY `on_b` (`b`)
) ENGINE=InnoDB DEFAULT CHARSET=utf8mb4 COLLATE=utf8mb4_0900_ai_ci
INSERT IGNORE INTO t (a) VALUES (2000000000000000000);
Warnings:
Warning	1406	Data too long for column 'b' at row 1
SELECT * FROM t;
a	b
2000000000000000000	
DELETE FROM t;
DELETE IGNORE FROM t;
CHECK TABLE t;
Table	Op	Msg_type	Msg_text
test.t	check	status	OK
DROP TABLE t;
# Testing example of type BIGINT and value -2000000000000000000
SHOW CREATE TABLE t;
Table	Create Table
t	CREATE TABLE `t` (
  `a` bigint NOT NULL,
  `b` bit(4) GENERATED ALWAYS AS (`a`) VIRTUAL NOT NULL,
  KEY `on_b` (`b`)
) ENGINE=InnoDB DEFAULT CHARSET=utf8mb4 COLLATE=utf8mb4_0900_ai_ci
INSERT IGNORE INTO t (a) VALUES (-2000000000000000000);
Warnings:
Warning	1406	Data too long for column 'b' at row 1
SELECT * FROM t;
a	b
-2000000000000000000	
DELETE FROM t;
DELETE IGNORE FROM t;
CHECK TABLE t;
Table	Op	Msg_type	Msg_text
test.t	check	status	OK
DROP TABLE t;
# Testing example of type FLOAT and value -1.23456
SHOW CREATE TABLE t;
Table	Create Table
t	CREATE TABLE `t` (
  `a` float NOT NULL,
  `b` bit(4) GENERATED ALWAYS AS (`a`) VIRTUAL NOT NULL,
  KEY `on_b` (`b`)
) ENGINE=InnoDB DEFAULT CHARSET=utf8mb4 COLLATE=utf8mb4_0900_ai_ci
INSERT IGNORE INTO t (a) VALUES (-1.23456);
Warnings:
Warning	1406	Data too long for column 'b' at row 1
SELECT * FROM t;
a	b
-1.23456	
DELETE FROM t;
DELETE IGNORE FROM t;
CHECK TABLE t;
Table	Op	Msg_type	Msg_text
test.t	check	status	OK
DROP TABLE t;
# Testing example of type FLOAT and value -1e38
SHOW CREATE TABLE t;
Table	Create Table
t	CREATE TABLE `t` (
  `a` float NOT NULL,
  `b` bit(4) GENERATED ALWAYS AS (`a`) VIRTUAL NOT NULL,
  KEY `on_b` (`b`)
) ENGINE=InnoDB DEFAULT CHARSET=utf8mb4 COLLATE=utf8mb4_0900_ai_ci
INSERT IGNORE INTO t (a) VALUES (-1e38);
Warnings:
Warning	1406	Data too long for column 'b' at row 1
SELECT * FROM t;
a	b
-1e38	
DELETE FROM t;
DELETE IGNORE FROM t;
CHECK TABLE t;
Table	Op	Msg_type	Msg_text
test.t	check	status	OK
DROP TABLE t;
# Testing example of type FLOAT and value 1e38
SHOW CREATE TABLE t;
Table	Create Table
t	CREATE TABLE `t` (
  `a` float NOT NULL,
  `b` bit(4) GENERATED ALWAYS AS (`a`) VIRTUAL NOT NULL,
  KEY `on_b` (`b`)
) ENGINE=InnoDB DEFAULT CHARSET=utf8mb4 COLLATE=utf8mb4_0900_ai_ci
INSERT IGNORE INTO t (a) VALUES (1e38);
Warnings:
Warning	1406	Data too long for column 'b' at row 1
SELECT * FROM t;
a	b
1e38	
DELETE FROM t;
DELETE IGNORE FROM t;
CHECK TABLE t;
Table	Op	Msg_type	Msg_text
test.t	check	status	OK
DROP TABLE t;
# Testing example of type DOUBLE and value -1.23456789012345
SHOW CREATE TABLE t;
Table	Create Table
t	CREATE TABLE `t` (
  `a` double NOT NULL,
  `b` bit(4) GENERATED ALWAYS AS (`a`) VIRTUAL NOT NULL,
  KEY `on_b` (`b`)
) ENGINE=InnoDB DEFAULT CHARSET=utf8mb4 COLLATE=utf8mb4_0900_ai_ci
INSERT IGNORE INTO t (a) VALUES (-1.23456789012345);
Warnings:
Warning	1406	Data too long for column 'b' at row 1
SELECT * FROM t;
a	b
-1.23456789012345	
DELETE FROM t;
DELETE IGNORE FROM t;
CHECK TABLE t;
Table	Op	Msg_type	Msg_text
test.t	check	status	OK
DROP TABLE t;
# Testing example of type DOUBLE and value 1.23456789012345
SHOW CREATE TABLE t;
Table	Create Table
t	CREATE TABLE `t` (
  `a` double NOT NULL,
  `b` bit(4) GENERATED ALWAYS AS (`a`) VIRTUAL NOT NULL,
  KEY `on_b` (`b`)
) ENGINE=InnoDB DEFAULT CHARSET=utf8mb4 COLLATE=utf8mb4_0900_ai_ci
INSERT IGNORE INTO t (a) VALUES (1.23456789012345);
SELECT * FROM t;
a	b
1.23456789012345	
DELETE FROM t;
DELETE IGNORE FROM t;
CHECK TABLE t;
Table	Op	Msg_type	Msg_text
test.t	check	status	OK
DROP TABLE t;
# Testing example of type DOUBLE and value -1e300
SHOW CREATE TABLE t;
Table	Create Table
t	CREATE TABLE `t` (
  `a` double NOT NULL,
  `b` bit(4) GENERATED ALWAYS AS (`a`) VIRTUAL NOT NULL,
  KEY `on_b` (`b`)
) ENGINE=InnoDB DEFAULT CHARSET=utf8mb4 COLLATE=utf8mb4_0900_ai_ci
INSERT IGNORE INTO t (a) VALUES (-1e300);
Warnings:
Warning	1406	Data too long for column 'b' at row 1
SELECT * FROM t;
a	b
-1e300	
DELETE FROM t;
DELETE IGNORE FROM t;
CHECK TABLE t;
Table	Op	Msg_type	Msg_text
test.t	check	status	OK
DROP TABLE t;
# Testing example of type DOUBLE and value 1e300
SHOW CREATE TABLE t;
Table	Create Table
t	CREATE TABLE `t` (
  `a` double NOT NULL,
  `b` bit(4) GENERATED ALWAYS AS (`a`) VIRTUAL NOT NULL,
  KEY `on_b` (`b`)
) ENGINE=InnoDB DEFAULT CHARSET=utf8mb4 COLLATE=utf8mb4_0900_ai_ci
INSERT IGNORE INTO t (a) VALUES (1e300);
Warnings:
Warning	1406	Data too long for column 'b' at row 1
SELECT * FROM t;
a	b
1e300	
DELETE FROM t;
DELETE IGNORE FROM t;
CHECK TABLE t;
Table	Op	Msg_type	Msg_text
test.t	check	status	OK
DROP TABLE t;
# Testing example of type DECIMAL(4,2) and value -10.99
SHOW CREATE TABLE t;
Table	Create Table
t	CREATE TABLE `t` (
  `a` decimal(4,2) NOT NULL,
  `b` bit(4) GENERATED ALWAYS AS (`a`) VIRTUAL NOT NULL,
  KEY `on_b` (`b`)
) ENGINE=InnoDB DEFAULT CHARSET=utf8mb4 COLLATE=utf8mb4_0900_ai_ci
INSERT IGNORE INTO t (a) VALUES (-10.99);
Warnings:
Warning	1264	Out of range value for column 'b' at row 1
SELECT * FROM t;
a	b
-10.99	 
DELETE FROM t;
DELETE IGNORE FROM t;
CHECK TABLE t;
Table	Op	Msg_type	Msg_text
test.t	check	status	OK
DROP TABLE t;
# Testing example of type DECIMAL(34,4) and value 20000000000000000000000000000.0001
SHOW CREATE TABLE t;
Table	Create Table
t	CREATE TABLE `t` (
  `a` decimal(34,4) NOT NULL,
  `b` bit(4) GENERATED ALWAYS AS (`a`) VIRTUAL NOT NULL,
  KEY `on_b` (`b`)
) ENGINE=InnoDB DEFAULT CHARSET=utf8mb4 COLLATE=utf8mb4_0900_ai_ci
INSERT IGNORE INTO t (a) VALUES (20000000000000000000000000000.0001);
Warnings:
Warning	1264	Out of range value for column 'b' at row 1
Warning	1406	Data too long for column 'b' at row 1
SELECT * FROM t;
a	b
20000000000000000000000000000.0001	
DELETE FROM t;
DELETE IGNORE FROM t;
CHECK TABLE t;
Table	Op	Msg_type	Msg_text
test.t	check	status	OK
DROP TABLE t;
# Testing example of type DECIMAL(34,4) and value -20000000000000000000000000000.0001
SHOW CREATE TABLE t;
Table	Create Table
t	CREATE TABLE `t` (
  `a` decimal(34,4) NOT NULL,
  `b` bit(4) GENERATED ALWAYS AS (`a`) VIRTUAL NOT NULL,
  KEY `on_b` (`b`)
) ENGINE=InnoDB DEFAULT CHARSET=utf8mb4 COLLATE=utf8mb4_0900_ai_ci
INSERT IGNORE INTO t (a) VALUES (-20000000000000000000000000000.0001);
Warnings:
Warning	1264	Out of range value for column 'b' at row 1
SELECT * FROM t;
a	b
-20000000000000000000000000000.0001	 
DELETE FROM t;
DELETE IGNORE FROM t;
CHECK TABLE t;
Table	Op	Msg_type	Msg_text
test.t	check	status	OK
DROP TABLE t;
# Testing example of type BIT(64) and value 0xDEADBEEFC0FEBABE
SHOW CREATE TABLE t;
Table	Create Table
t	CREATE TABLE `t` (
  `a` bit(64) NOT NULL,
  `b` bit(4) GENERATED ALWAYS AS (`a`) VIRTUAL NOT NULL,
  KEY `on_b` (`b`)
) ENGINE=InnoDB DEFAULT CHARSET=utf8mb4 COLLATE=utf8mb4_0900_ai_ci
INSERT IGNORE INTO t (a) VALUES (0xDEADBEEFC0FEBABE);
Warnings:
Warning	1406	Data too long for column 'b' at row 1
SELECT * FROM t;
a	b
Þ­¾ïÀþº¾	
DELETE FROM t;
DELETE IGNORE FROM t;
CHECK TABLE t;
Table	Op	Msg_type	Msg_text
test.t	check	status	OK
DROP TABLE t;
# Testing example of type BIT(4) and value 0b1000
SHOW CREATE TABLE t;
Table	Create Table
t	CREATE TABLE `t` (
  `a` bit(4) NOT NULL,
  `b` bit(4) GENERATED ALWAYS AS (`a`) VIRTUAL NOT NULL,
  KEY `on_b` (`b`)
) ENGINE=InnoDB DEFAULT CHARSET=utf8mb4 COLLATE=utf8mb4_0900_ai_ci
INSERT IGNORE INTO t (a) VALUES (0b1000);
SELECT * FROM t;
a	b
	
DELETE FROM t;
DELETE IGNORE FROM t;
CHECK TABLE t;
Table	Op	Msg_type	Msg_text
test.t	check	status	OK
DROP TABLE t;
# Testing example of type YEAR and value 2020
SHOW CREATE TABLE t;
Table	Create Table
t	CREATE TABLE `t` (
  `a` year NOT NULL,
  `b` bit(4) GENERATED ALWAYS AS (`a`) VIRTUAL NOT NULL,
  KEY `on_b` (`b`)
) ENGINE=InnoDB DEFAULT CHARSET=utf8mb4 COLLATE=utf8mb4_0900_ai_ci
INSERT IGNORE INTO t (a) VALUES (2020);
Warnings:
Warning	1406	Data too long for column 'b' at row 1
SELECT * FROM t;
a	b
2020	
DELETE FROM t;
DELETE IGNORE FROM t;
CHECK TABLE t;
Table	Op	Msg_type	Msg_text
test.t	check	status	OK
DROP TABLE t;
# Testing example of type DATE and value "2030-04-05"
SHOW CREATE TABLE t;
Table	Create Table
t	CREATE TABLE `t` (
  `a` date NOT NULL,
  `b` bit(4) GENERATED ALWAYS AS (`a`) VIRTUAL NOT NULL,
  KEY `on_b` (`b`)
) ENGINE=InnoDB DEFAULT CHARSET=utf8mb4 COLLATE=utf8mb4_0900_ai_ci
INSERT IGNORE INTO t (a) VALUES ("2030-04-05");
Warnings:
Warning	1406	Data too long for column 'b' at row 1
SELECT * FROM t;
a	b
2030-04-05	
DELETE FROM t;
DELETE IGNORE FROM t;
CHECK TABLE t;
Table	Op	Msg_type	Msg_text
test.t	check	status	OK
DROP TABLE t;
# Testing example of type TIME and value "11:12:13"
SHOW CREATE TABLE t;
Table	Create Table
t	CREATE TABLE `t` (
  `a` time NOT NULL,
  `b` bit(4) GENERATED ALWAYS AS (`a`) VIRTUAL NOT NULL,
  KEY `on_b` (`b`)
) ENGINE=InnoDB DEFAULT CHARSET=utf8mb4 COLLATE=utf8mb4_0900_ai_ci
INSERT IGNORE INTO t (a) VALUES ("11:12:13");
Warnings:
Warning	1406	Data too long for column 'b' at row 1
SELECT * FROM t;
a	b
11:12:13	
DELETE FROM t;
DELETE IGNORE FROM t;
CHECK TABLE t;
Table	Op	Msg_type	Msg_text
test.t	check	status	OK
DROP TABLE t;
# Testing example of type DATETIME and value "2030-04-05 11:12:13"
SHOW CREATE TABLE t;
Table	Create Table
t	CREATE TABLE `t` (
  `a` datetime NOT NULL,
  `b` bit(4) GENERATED ALWAYS AS (`a`) VIRTUAL NOT NULL,
  KEY `on_b` (`b`)
) ENGINE=InnoDB DEFAULT CHARSET=utf8mb4 COLLATE=utf8mb4_0900_ai_ci
INSERT IGNORE INTO t (a) VALUES ("2030-04-05 11:12:13");
Warnings:
Warning	1406	Data too long for column 'b' at row 1
SELECT * FROM t;
a	b
2030-04-05 11:12:13	
DELETE FROM t;
DELETE IGNORE FROM t;
CHECK TABLE t;
Table	Op	Msg_type	Msg_text
test.t	check	status	OK
DROP TABLE t;
# Testing example of type TIMESTAMP and value "2030-04-05 11:12:13"
SHOW CREATE TABLE t;
Table	Create Table
t	CREATE TABLE `t` (
  `a` timestamp NOT NULL,
  `b` bit(4) GENERATED ALWAYS AS (`a`) VIRTUAL NOT NULL,
  KEY `on_b` (`b`)
) ENGINE=InnoDB DEFAULT CHARSET=utf8mb4 COLLATE=utf8mb4_0900_ai_ci
INSERT IGNORE INTO t (a) VALUES ("2030-04-05 11:12:13");
Warnings:
Warning	1406	Data too long for column 'b' at row 1
SELECT * FROM t;
a	b
2030-04-05 11:12:13	
DELETE FROM t;
DELETE IGNORE FROM t;
CHECK TABLE t;
Table	Op	Msg_type	Msg_text
test.t	check	status	OK
DROP TABLE t;
# Testing example of type CHAR(40) and value "2000000000000000000000000000000000000"
SHOW CREATE TABLE t;
Table	Create Table
t	CREATE TABLE `t` (
  `a` char(40) NOT NULL,
  `b` bit(4) GENERATED ALWAYS AS (`a`) VIRTUAL NOT NULL,
  KEY `on_b` (`b`)
) ENGINE=InnoDB DEFAULT CHARSET=utf8mb4 COLLATE=utf8mb4_0900_ai_ci
INSERT IGNORE INTO t (a) VALUES ("2000000000000000000000000000000000000");
Warnings:
Warning	1406	Data too long for column 'b' at row 1
SELECT * FROM t;
a	b
2000000000000000000000000000000000000	
DELETE FROM t;
DELETE IGNORE FROM t;
CHECK TABLE t;
Table	Op	Msg_type	Msg_text
test.t	check	status	OK
DROP TABLE t;
# Testing example of type BINARY(45) and value "200000000000000000000000000000000000000000"
SHOW CREATE TABLE t;
Table	Create Table
t	CREATE TABLE `t` (
  `a` binary(45) NOT NULL,
  `b` bit(4) GENERATED ALWAYS AS (`a`) VIRTUAL NOT NULL,
  KEY `on_b` (`b`)
) ENGINE=InnoDB DEFAULT CHARSET=utf8mb4 COLLATE=utf8mb4_0900_ai_ci
INSERT IGNORE INTO t (a) VALUES ("200000000000000000000000000000000000000000");
Warnings:
Warning	1406	Data too long for column 'b' at row 1
SELECT * FROM t;
a	b
200000000000000000000000000000000000000000   	
DELETE FROM t;
DELETE IGNORE FROM t;
CHECK TABLE t;
Table	Op	Msg_type	Msg_text
test.t	check	status	OK
DROP TABLE t;
# Testing example of type VARCHAR(50) and value "2000000000000000000000000000000000000000000000000"
SHOW CREATE TABLE t;
Table	Create Table
t	CREATE TABLE `t` (
  `a` varchar(50) NOT NULL,
  `b` bit(4) GENERATED ALWAYS AS (`a`) VIRTUAL NOT NULL,
  KEY `on_b` (`b`)
) ENGINE=InnoDB DEFAULT CHARSET=utf8mb4 COLLATE=utf8mb4_0900_ai_ci
INSERT IGNORE INTO t (a) VALUES ("2000000000000000000000000000000000000000000000000");
Warnings:
Warning	1406	Data too long for column 'b' at row 1
SELECT * FROM t;
a	b
2000000000000000000000000000000000000000000000000	
DELETE FROM t;
DELETE IGNORE FROM t;
CHECK TABLE t;
Table	Op	Msg_type	Msg_text
test.t	check	status	OK
DROP TABLE t;
# Testing example of type CHAR(24) and value "hello beautiful world"
SHOW CREATE TABLE t;
Table	Create Table
t	CREATE TABLE `t` (
  `a` char(24) NOT NULL,
  `b` bit(4) GENERATED ALWAYS AS (`a`) VIRTUAL NOT NULL,
  KEY `on_b` (`b`)
) ENGINE=InnoDB DEFAULT CHARSET=utf8mb4 COLLATE=utf8mb4_0900_ai_ci
INSERT IGNORE INTO t (a) VALUES ("hello beautiful world");
Warnings:
Warning	1406	Data too long for column 'b' at row 1
SELECT * FROM t;
a	b
hello beautiful world	
DELETE FROM t;
DELETE IGNORE FROM t;
CHECK TABLE t;
Table	Op	Msg_type	Msg_text
test.t	check	status	OK
DROP TABLE t;
# Testing example of type BINARY(12) and value "hello world"
SHOW CREATE TABLE t;
Table	Create Table
t	CREATE TABLE `t` (
  `a` binary(12) NOT NULL,
  `b` bit(4) GENERATED ALWAYS AS (`a`) VIRTUAL NOT NULL,
  KEY `on_b` (`b`)
) ENGINE=InnoDB DEFAULT CHARSET=utf8mb4 COLLATE=utf8mb4_0900_ai_ci
INSERT IGNORE INTO t (a) VALUES ("hello world");
Warnings:
Warning	1406	Data too long for column 'b' at row 1
SELECT * FROM t;
a	b
hello world 	
DELETE FROM t;
DELETE IGNORE FROM t;
CHECK TABLE t;
Table	Op	Msg_type	Msg_text
test.t	check	status	OK
DROP TABLE t;
# Testing example of type VARCHAR(6) and value "hello"
SHOW CREATE TABLE t;
Table	Create Table
t	CREATE TABLE `t` (
  `a` varchar(6) NOT NULL,
  `b` bit(4) GENERATED ALWAYS AS (`a`) VIRTUAL NOT NULL,
  KEY `on_b` (`b`)
) ENGINE=InnoDB DEFAULT CHARSET=utf8mb4 COLLATE=utf8mb4_0900_ai_ci
INSERT IGNORE INTO t (a) VALUES ("hello");
Warnings:
Warning	1406	Data too long for column 'b' at row 1
SELECT * FROM t;
a	b
hello	
DELETE FROM t;
DELETE IGNORE FROM t;
CHECK TABLE t;
Table	Op	Msg_type	Msg_text
test.t	check	status	OK
DROP TABLE t;
# Testing example of type ENUM("up","down") and value "up"
SHOW CREATE TABLE t;
Table	Create Table
t	CREATE TABLE `t` (
  `a` enum('up','down') NOT NULL,
  `b` bit(4) GENERATED ALWAYS AS (`a`) VIRTUAL NOT NULL,
  KEY `on_b` (`b`)
) ENGINE=InnoDB DEFAULT CHARSET=utf8mb4 COLLATE=utf8mb4_0900_ai_ci
INSERT IGNORE INTO t (a) VALUES ("up");
SELECT * FROM t;
a	b
up	
DELETE FROM t;
DELETE IGNORE FROM t;
CHECK TABLE t;
Table	Op	Msg_type	Msg_text
test.t	check	status	OK
DROP TABLE t;
# Testing example of type SET("up","down") and value "up,down"
SHOW CREATE TABLE t;
Table	Create Table
t	CREATE TABLE `t` (
  `a` set('up','down') NOT NULL,
  `b` bit(4) GENERATED ALWAYS AS (`a`) VIRTUAL NOT NULL,
  KEY `on_b` (`b`)
) ENGINE=InnoDB DEFAULT CHARSET=utf8mb4 COLLATE=utf8mb4_0900_ai_ci
INSERT IGNORE INTO t (a) VALUES ("up,down");
SELECT * FROM t;
a	b
up,down	
DELETE FROM t;
DELETE IGNORE FROM t;
CHECK TABLE t;
Table	Op	Msg_type	Msg_text
test.t	check	status	OK
DROP TABLE t;
# Testing example of type GEOMETRY and value ST_GeomFromText("POINT(1 1)")
SHOW CREATE TABLE t;
Table	Create Table
t	CREATE TABLE `t` (
  `a` geometry NOT NULL,
  `b` bit(4) GENERATED ALWAYS AS (`a`) VIRTUAL NOT NULL,
  KEY `on_b` (`b`)
) ENGINE=InnoDB DEFAULT CHARSET=utf8mb4 COLLATE=utf8mb4_0900_ai_ci
INSERT IGNORE INTO t (a) VALUES (ST_GeomFromText("POINT(1 1)"));
Warnings:
Warning	1406	Data too long for column 'b' at row 1
SELECT * FROM t;
a	b
             ð?      ð?	
DELETE FROM t;
DELETE IGNORE FROM t;
CHECK TABLE t;
Table	Op	Msg_type	Msg_text
test.t	check	status	OK
DROP TABLE t;
# Testing example of type POINT and value ST_GeomFromText("POINT(1 1)")
SHOW CREATE TABLE t;
Table	Create Table
t	CREATE TABLE `t` (
  `a` point NOT NULL,
  `b` bit(4) GENERATED ALWAYS AS (`a`) VIRTUAL NOT NULL,
  KEY `on_b` (`b`)
) ENGINE=InnoDB DEFAULT CHARSET=utf8mb4 COLLATE=utf8mb4_0900_ai_ci
INSERT IGNORE INTO t (a) VALUES (ST_GeomFromText("POINT(1 1)"));
Warnings:
Warning	1406	Data too long for column 'b' at row 1
SELECT * FROM t;
a	b
             ð?      ð?	
DELETE FROM t;
DELETE IGNORE FROM t;
CHECK TABLE t;
Table	Op	Msg_type	Msg_text
test.t	check	status	OK
DROP TABLE t;
# Testing example of type LINESTRING and value ST_GeomFromText("LINESTRING(0 0,1 1,2 2)")
SHOW CREATE TABLE t;
Table	Create Table
t	CREATE TABLE `t` (
  `a` linestring NOT NULL,
  `b` bit(4) GENERATED ALWAYS AS (`a`) VIRTUAL NOT NULL,
  KEY `on_b` (`b`)
) ENGINE=InnoDB DEFAULT CHARSET=utf8mb4 COLLATE=utf8mb4_0900_ai_ci
INSERT IGNORE INTO t (a) VALUES (ST_GeomFromText("LINESTRING(0 0,1 1,2 2)"));
Warnings:
Warning	1406	Data too long for column 'b' at row 1
SELECT * FROM t;
a	b
                                ð?      ð?       @       @	
DELETE FROM t;
DELETE IGNORE FROM t;
CHECK TABLE t;
Table	Op	Msg_type	Msg_text
test.t	check	status	OK
DROP TABLE t;
# Testing example of type POLYGON and value ST_GeomFromText("POLYGON((0 0,1 0,1 1,0 1,0 0),(5 5,7 5,7 7,5 7,5 5))")
SHOW CREATE TABLE t;
Table	Create Table
t	CREATE TABLE `t` (
  `a` polygon NOT NULL,
  `b` bit(4) GENERATED ALWAYS AS (`a`) VIRTUAL NOT NULL,
  KEY `on_b` (`b`)
) ENGINE=InnoDB DEFAULT CHARSET=utf8mb4 COLLATE=utf8mb4_0900_ai_ci
INSERT IGNORE INTO t (a) VALUES (ST_GeomFromText("POLYGON((0 0,1 0,1 1,0 1,0 0),(5 5,7 5,7 7,5 7,5 5))"));
Warnings:
Warning	1406	Data too long for column 'b' at row 1
SELECT * FROM t;
a	b
                                   ð?              ð?      ð?              ð?                         @      @      @      @      @      @      @      @      @      @	
DELETE FROM t;
DELETE IGNORE FROM t;
CHECK TABLE t;
Table	Op	Msg_type	Msg_text
test.t	check	status	OK
DROP TABLE t;
#
# Testing virtual column of type YEAR
#
# Testing example of type JSON and value "{}"
SHOW CREATE TABLE t;
Table	Create Table
t	CREATE TABLE `t` (
  `a` json NOT NULL,
  `b` year GENERATED ALWAYS AS (`a`) VIRTUAL NOT NULL,
  KEY `on_b` (`b`)
) ENGINE=InnoDB DEFAULT CHARSET=utf8mb4 COLLATE=utf8mb4_0900_ai_ci
INSERT IGNORE INTO t (a) VALUES ("{}");
Warnings:
Warning	3156	Invalid JSON value for CAST to INTEGER from column a at row 1
SELECT * FROM t;
a	b
{}	0000
Warnings:
Warning	3156	Invalid JSON value for CAST to INTEGER from column a at row 1
DELETE FROM t;
DELETE IGNORE FROM t;
Warnings:
Warning	3156	Invalid JSON value for CAST to INTEGER from column a at row 1
Warning	3156	Invalid JSON value for CAST to INTEGER from column a at row 1
CHECK TABLE t;
Table	Op	Msg_type	Msg_text
test.t	check	status	OK
DROP TABLE t;
# Testing example of type JSON and value '["hello beautiful world"]'
SHOW CREATE TABLE t;
Table	Create Table
t	CREATE TABLE `t` (
  `a` json NOT NULL,
  `b` year GENERATED ALWAYS AS (`a`) VIRTUAL NOT NULL,
  KEY `on_b` (`b`)
) ENGINE=InnoDB DEFAULT CHARSET=utf8mb4 COLLATE=utf8mb4_0900_ai_ci
INSERT IGNORE INTO t (a) VALUES ('["hello beautiful world"]');
Warnings:
Warning	3156	Invalid JSON value for CAST to INTEGER from column a at row 1
SELECT * FROM t;
a	b
["hello beautiful world"]	0000
Warnings:
Warning	3156	Invalid JSON value for CAST to INTEGER from column a at row 1
DELETE FROM t;
DELETE IGNORE FROM t;
Warnings:
Warning	3156	Invalid JSON value for CAST to INTEGER from column a at row 1
Warning	3156	Invalid JSON value for CAST to INTEGER from column a at row 1
CHECK TABLE t;
Table	Op	Msg_type	Msg_text
test.t	check	status	OK
DROP TABLE t;
# Testing example of type JSON and value "-1"
SHOW CREATE TABLE t;
Table	Create Table
t	CREATE TABLE `t` (
  `a` json NOT NULL,
  `b` year GENERATED ALWAYS AS (`a`) VIRTUAL NOT NULL,
  KEY `on_b` (`b`)
) ENGINE=InnoDB DEFAULT CHARSET=utf8mb4 COLLATE=utf8mb4_0900_ai_ci
INSERT IGNORE INTO t (a) VALUES ("-1");
Warnings:
Warning	1264	Out of range value for column 'b' at row 1
SELECT * FROM t;
a	b
-1	0000
DELETE FROM t;
DELETE IGNORE FROM t;
CHECK TABLE t;
Table	Op	Msg_type	Msg_text
test.t	check	status	OK
DROP TABLE t;
# Testing example of type TINYINT and value -1
SHOW CREATE TABLE t;
Table	Create Table
t	CREATE TABLE `t` (
  `a` tinyint NOT NULL,
  `b` year GENERATED ALWAYS AS (`a`) VIRTUAL NOT NULL,
  KEY `on_b` (`b`)
) ENGINE=InnoDB DEFAULT CHARSET=utf8mb4 COLLATE=utf8mb4_0900_ai_ci
INSERT IGNORE INTO t (a) VALUES (-1);
Warnings:
Warning	1264	Out of range value for column 'b' at row 1
SELECT * FROM t;
a	b
-1	0000
DELETE FROM t;
DELETE IGNORE FROM t;
CHECK TABLE t;
Table	Op	Msg_type	Msg_text
test.t	check	status	OK
DROP TABLE t;
# Testing example of type SMALLINT and value -1
SHOW CREATE TABLE t;
Table	Create Table
t	CREATE TABLE `t` (
  `a` smallint NOT NULL,
  `b` year GENERATED ALWAYS AS (`a`) VIRTUAL NOT NULL,
  KEY `on_b` (`b`)
) ENGINE=InnoDB DEFAULT CHARSET=utf8mb4 COLLATE=utf8mb4_0900_ai_ci
INSERT IGNORE INTO t (a) VALUES (-1);
Warnings:
Warning	1264	Out of range value for column 'b' at row 1
SELECT * FROM t;
a	b
-1	0000
DELETE FROM t;
DELETE IGNORE FROM t;
CHECK TABLE t;
Table	Op	Msg_type	Msg_text
test.t	check	status	OK
DROP TABLE t;
# Testing example of type MEDIUMINT and value -1
SHOW CREATE TABLE t;
Table	Create Table
t	CREATE TABLE `t` (
  `a` mediumint NOT NULL,
  `b` year GENERATED ALWAYS AS (`a`) VIRTUAL NOT NULL,
  KEY `on_b` (`b`)
) ENGINE=InnoDB DEFAULT CHARSET=utf8mb4 COLLATE=utf8mb4_0900_ai_ci
INSERT IGNORE INTO t (a) VALUES (-1);
Warnings:
Warning	1264	Out of range value for column 'b' at row 1
SELECT * FROM t;
a	b
-1	0000
DELETE FROM t;
DELETE IGNORE FROM t;
CHECK TABLE t;
Table	Op	Msg_type	Msg_text
test.t	check	status	OK
DROP TABLE t;
# Testing example of type INT and value 2000000000
SHOW CREATE TABLE t;
Table	Create Table
t	CREATE TABLE `t` (
  `a` int NOT NULL,
  `b` year GENERATED ALWAYS AS (`a`) VIRTUAL NOT NULL,
  KEY `on_b` (`b`)
) ENGINE=InnoDB DEFAULT CHARSET=utf8mb4 COLLATE=utf8mb4_0900_ai_ci
INSERT IGNORE INTO t (a) VALUES (2000000000);
Warnings:
Warning	1264	Out of range value for column 'b' at row 1
SELECT * FROM t;
a	b
2000000000	0000
DELETE FROM t;
DELETE IGNORE FROM t;
CHECK TABLE t;
Table	Op	Msg_type	Msg_text
test.t	check	status	OK
DROP TABLE t;
# Testing example of type INT and value -2000000000
SHOW CREATE TABLE t;
Table	Create Table
t	CREATE TABLE `t` (
  `a` int NOT NULL,
  `b` year GENERATED ALWAYS AS (`a`) VIRTUAL NOT NULL,
  KEY `on_b` (`b`)
) ENGINE=InnoDB DEFAULT CHARSET=utf8mb4 COLLATE=utf8mb4_0900_ai_ci
INSERT IGNORE INTO t (a) VALUES (-2000000000);
Warnings:
Warning	1264	Out of range value for column 'b' at row 1
SELECT * FROM t;
a	b
-2000000000	0000
DELETE FROM t;
DELETE IGNORE FROM t;
CHECK TABLE t;
Table	Op	Msg_type	Msg_text
test.t	check	status	OK
DROP TABLE t;
# Testing example of type INT UNSIGNED and value 4000000000
SHOW CREATE TABLE t;
Table	Create Table
t	CREATE TABLE `t` (
  `a` int unsigned NOT NULL,
  `b` year GENERATED ALWAYS AS (`a`) VIRTUAL NOT NULL,
  KEY `on_b` (`b`)
) ENGINE=InnoDB DEFAULT CHARSET=utf8mb4 COLLATE=utf8mb4_0900_ai_ci
INSERT IGNORE INTO t (a) VALUES (4000000000);
Warnings:
Warning	1264	Out of range value for column 'b' at row 1
SELECT * FROM t;
a	b
4000000000	0000
DELETE FROM t;
DELETE IGNORE FROM t;
CHECK TABLE t;
Table	Op	Msg_type	Msg_text
test.t	check	status	OK
DROP TABLE t;
# Testing example of type BIGINT and value 2000000000000000000
SHOW CREATE TABLE t;
Table	Create Table
t	CREATE TABLE `t` (
  `a` bigint NOT NULL,
  `b` year GENERATED ALWAYS AS (`a`) VIRTUAL NOT NULL,
  KEY `on_b` (`b`)
) ENGINE=InnoDB DEFAULT CHARSET=utf8mb4 COLLATE=utf8mb4_0900_ai_ci
INSERT IGNORE INTO t (a) VALUES (2000000000000000000);
Warnings:
Warning	1264	Out of range value for column 'b' at row 1
SELECT * FROM t;
a	b
2000000000000000000	0000
DELETE FROM t;
DELETE IGNORE FROM t;
CHECK TABLE t;
Table	Op	Msg_type	Msg_text
test.t	check	status	OK
DROP TABLE t;
# Testing example of type BIGINT and value -2000000000000000000
SHOW CREATE TABLE t;
Table	Create Table
t	CREATE TABLE `t` (
  `a` bigint NOT NULL,
  `b` year GENERATED ALWAYS AS (`a`) VIRTUAL NOT NULL,
  KEY `on_b` (`b`)
) ENGINE=InnoDB DEFAULT CHARSET=utf8mb4 COLLATE=utf8mb4_0900_ai_ci
INSERT IGNORE INTO t (a) VALUES (-2000000000000000000);
Warnings:
Warning	1264	Out of range value for column 'b' at row 1
SELECT * FROM t;
a	b
-2000000000000000000	0000
DELETE FROM t;
DELETE IGNORE FROM t;
CHECK TABLE t;
Table	Op	Msg_type	Msg_text
test.t	check	status	OK
DROP TABLE t;
# Testing example of type FLOAT and value -1.23456
SHOW CREATE TABLE t;
Table	Create Table
t	CREATE TABLE `t` (
  `a` float NOT NULL,
  `b` year GENERATED ALWAYS AS (`a`) VIRTUAL NOT NULL,
  KEY `on_b` (`b`)
) ENGINE=InnoDB DEFAULT CHARSET=utf8mb4 COLLATE=utf8mb4_0900_ai_ci
INSERT IGNORE INTO t (a) VALUES (-1.23456);
Warnings:
Warning	1264	Out of range value for column 'b' at row 1
SELECT * FROM t;
a	b
-1.23456	0000
DELETE FROM t;
DELETE IGNORE FROM t;
CHECK TABLE t;
Table	Op	Msg_type	Msg_text
test.t	check	status	OK
DROP TABLE t;
# Testing example of type FLOAT and value -1e38
SHOW CREATE TABLE t;
Table	Create Table
t	CREATE TABLE `t` (
  `a` float NOT NULL,
  `b` year GENERATED ALWAYS AS (`a`) VIRTUAL NOT NULL,
  KEY `on_b` (`b`)
) ENGINE=InnoDB DEFAULT CHARSET=utf8mb4 COLLATE=utf8mb4_0900_ai_ci
INSERT IGNORE INTO t (a) VALUES (-1e38);
Warnings:
Warning	1264	Out of range value for column 'b' at row 1
SELECT * FROM t;
a	b
-1e38	0000
DELETE FROM t;
DELETE IGNORE FROM t;
CHECK TABLE t;
Table	Op	Msg_type	Msg_text
test.t	check	status	OK
DROP TABLE t;
# Testing example of type FLOAT and value 1e38
SHOW CREATE TABLE t;
Table	Create Table
t	CREATE TABLE `t` (
  `a` float NOT NULL,
  `b` year GENERATED ALWAYS AS (`a`) VIRTUAL NOT NULL,
  KEY `on_b` (`b`)
) ENGINE=InnoDB DEFAULT CHARSET=utf8mb4 COLLATE=utf8mb4_0900_ai_ci
INSERT IGNORE INTO t (a) VALUES (1e38);
Warnings:
Warning	1264	Out of range value for column 'b' at row 1
SELECT * FROM t;
a	b
1e38	0000
DELETE FROM t;
DELETE IGNORE FROM t;
CHECK TABLE t;
Table	Op	Msg_type	Msg_text
test.t	check	status	OK
DROP TABLE t;
# Testing example of type DOUBLE and value -1.23456789012345
SHOW CREATE TABLE t;
Table	Create Table
t	CREATE TABLE `t` (
  `a` double NOT NULL,
  `b` year GENERATED ALWAYS AS (`a`) VIRTUAL NOT NULL,
  KEY `on_b` (`b`)
) ENGINE=InnoDB DEFAULT CHARSET=utf8mb4 COLLATE=utf8mb4_0900_ai_ci
INSERT IGNORE INTO t (a) VALUES (-1.23456789012345);
Warnings:
Warning	1264	Out of range value for column 'b' at row 1
SELECT * FROM t;
a	b
-1.23456789012345	0000
DELETE FROM t;
DELETE IGNORE FROM t;
CHECK TABLE t;
Table	Op	Msg_type	Msg_text
test.t	check	status	OK
DROP TABLE t;
# Testing example of type DOUBLE and value 1.23456789012345
SHOW CREATE TABLE t;
Table	Create Table
t	CREATE TABLE `t` (
  `a` double NOT NULL,
  `b` year GENERATED ALWAYS AS (`a`) VIRTUAL NOT NULL,
  KEY `on_b` (`b`)
) ENGINE=InnoDB DEFAULT CHARSET=utf8mb4 COLLATE=utf8mb4_0900_ai_ci
INSERT IGNORE INTO t (a) VALUES (1.23456789012345);
SELECT * FROM t;
a	b
1.23456789012345	2001
DELETE FROM t;
DELETE IGNORE FROM t;
CHECK TABLE t;
Table	Op	Msg_type	Msg_text
test.t	check	status	OK
DROP TABLE t;
# Testing example of type DOUBLE and value -1e300
SHOW CREATE TABLE t;
Table	Create Table
t	CREATE TABLE `t` (
  `a` double NOT NULL,
  `b` year GENERATED ALWAYS AS (`a`) VIRTUAL NOT NULL,
  KEY `on_b` (`b`)
) ENGINE=InnoDB DEFAULT CHARSET=utf8mb4 COLLATE=utf8mb4_0900_ai_ci
INSERT IGNORE INTO t (a) VALUES (-1e300);
Warnings:
Warning	1264	Out of range value for column 'b' at row 1
SELECT * FROM t;
a	b
-1e300	0000
DELETE FROM t;
DELETE IGNORE FROM t;
CHECK TABLE t;
Table	Op	Msg_type	Msg_text
test.t	check	status	OK
DROP TABLE t;
# Testing example of type DOUBLE and value 1e300
SHOW CREATE TABLE t;
Table	Create Table
t	CREATE TABLE `t` (
  `a` double NOT NULL,
  `b` year GENERATED ALWAYS AS (`a`) VIRTUAL NOT NULL,
  KEY `on_b` (`b`)
) ENGINE=InnoDB DEFAULT CHARSET=utf8mb4 COLLATE=utf8mb4_0900_ai_ci
INSERT IGNORE INTO t (a) VALUES (1e300);
Warnings:
Warning	1264	Out of range value for column 'b' at row 1
SELECT * FROM t;
a	b
1e300	0000
DELETE FROM t;
DELETE IGNORE FROM t;
CHECK TABLE t;
Table	Op	Msg_type	Msg_text
test.t	check	status	OK
DROP TABLE t;
# Testing example of type DECIMAL(4,2) and value -10.99
SHOW CREATE TABLE t;
Table	Create Table
t	CREATE TABLE `t` (
  `a` decimal(4,2) NOT NULL,
  `b` year GENERATED ALWAYS AS (`a`) VIRTUAL NOT NULL,
  KEY `on_b` (`b`)
) ENGINE=InnoDB DEFAULT CHARSET=utf8mb4 COLLATE=utf8mb4_0900_ai_ci
INSERT IGNORE INTO t (a) VALUES (-10.99);
Warnings:
Warning	1264	Out of range value for column 'b' at row 1
SELECT * FROM t;
a	b
-10.99	0000
DELETE FROM t;
DELETE IGNORE FROM t;
CHECK TABLE t;
Table	Op	Msg_type	Msg_text
test.t	check	status	OK
DROP TABLE t;
# Testing example of type DECIMAL(34,4) and value 20000000000000000000000000000.0001
SHOW CREATE TABLE t;
Table	Create Table
t	CREATE TABLE `t` (
  `a` decimal(34,4) NOT NULL,
  `b` year GENERATED ALWAYS AS (`a`) VIRTUAL NOT NULL,
  KEY `on_b` (`b`)
) ENGINE=InnoDB DEFAULT CHARSET=utf8mb4 COLLATE=utf8mb4_0900_ai_ci
INSERT IGNORE INTO t (a) VALUES (20000000000000000000000000000.0001);
Warnings:
Warning	1264	Out of range value for column 'b' at row 1
Warning	1264	Out of range value for column 'b' at row 1
SELECT * FROM t;
a	b
20000000000000000000000000000.0001	0000
DELETE FROM t;
DELETE IGNORE FROM t;
CHECK TABLE t;
Table	Op	Msg_type	Msg_text
test.t	check	status	OK
DROP TABLE t;
# Testing example of type DECIMAL(34,4) and value -20000000000000000000000000000.0001
SHOW CREATE TABLE t;
Table	Create Table
t	CREATE TABLE `t` (
  `a` decimal(34,4) NOT NULL,
  `b` year GENERATED ALWAYS AS (`a`) VIRTUAL NOT NULL,
  KEY `on_b` (`b`)
) ENGINE=InnoDB DEFAULT CHARSET=utf8mb4 COLLATE=utf8mb4_0900_ai_ci
INSERT IGNORE INTO t (a) VALUES (-20000000000000000000000000000.0001);
Warnings:
Warning	1264	Out of range value for column 'b' at row 1
SELECT * FROM t;
a	b
-20000000000000000000000000000.0001	0000
DELETE FROM t;
DELETE IGNORE FROM t;
CHECK TABLE t;
Table	Op	Msg_type	Msg_text
test.t	check	status	OK
DROP TABLE t;
# Testing example of type BIT(64) and value 0xDEADBEEFC0FEBABE
SHOW CREATE TABLE t;
Table	Create Table
t	CREATE TABLE `t` (
  `a` bit(64) NOT NULL,
  `b` year GENERATED ALWAYS AS (`a`) VIRTUAL NOT NULL,
  KEY `on_b` (`b`)
) ENGINE=InnoDB DEFAULT CHARSET=utf8mb4 COLLATE=utf8mb4_0900_ai_ci
INSERT IGNORE INTO t (a) VALUES (0xDEADBEEFC0FEBABE);
Warnings:
Warning	1264	Out of range value for column 'b' at row 1
SELECT * FROM t;
a	b
Þ­¾ïÀþº¾	0000
DELETE FROM t;
DELETE IGNORE FROM t;
CHECK TABLE t;
Table	Op	Msg_type	Msg_text
test.t	check	status	OK
DROP TABLE t;
# Testing example of type BIT(4) and value 0b1000
SHOW CREATE TABLE t;
Table	Create Table
t	CREATE TABLE `t` (
  `a` bit(4) NOT NULL,
  `b` year GENERATED ALWAYS AS (`a`) VIRTUAL NOT NULL,
  KEY `on_b` (`b`)
) ENGINE=InnoDB DEFAULT CHARSET=utf8mb4 COLLATE=utf8mb4_0900_ai_ci
INSERT IGNORE INTO t (a) VALUES (0b1000);
SELECT * FROM t;
a	b
	2008
DELETE FROM t;
DELETE IGNORE FROM t;
CHECK TABLE t;
Table	Op	Msg_type	Msg_text
test.t	check	status	OK
DROP TABLE t;
# Testing example of type YEAR and value 2020
SHOW CREATE TABLE t;
Table	Create Table
t	CREATE TABLE `t` (
  `a` year NOT NULL,
  `b` year GENERATED ALWAYS AS (`a`) VIRTUAL NOT NULL,
  KEY `on_b` (`b`)
) ENGINE=InnoDB DEFAULT CHARSET=utf8mb4 COLLATE=utf8mb4_0900_ai_ci
INSERT IGNORE INTO t (a) VALUES (2020);
SELECT * FROM t;
a	b
2020	2020
DELETE FROM t;
DELETE IGNORE FROM t;
CHECK TABLE t;
Table	Op	Msg_type	Msg_text
test.t	check	status	OK
DROP TABLE t;
# Testing example of type DATE and value "2030-04-05"
SHOW CREATE TABLE t;
Table	Create Table
t	CREATE TABLE `t` (
  `a` date NOT NULL,
  `b` year GENERATED ALWAYS AS (`a`) VIRTUAL NOT NULL,
  KEY `on_b` (`b`)
) ENGINE=InnoDB DEFAULT CHARSET=utf8mb4 COLLATE=utf8mb4_0900_ai_ci
INSERT IGNORE INTO t (a) VALUES ("2030-04-05");
Warnings:
Warning	1264	Out of range value for column 'b' at row 1
SELECT * FROM t;
a	b
2030-04-05	0000
DELETE FROM t;
DELETE IGNORE FROM t;
CHECK TABLE t;
Table	Op	Msg_type	Msg_text
test.t	check	status	OK
DROP TABLE t;
# Testing example of type TIME and value "11:12:13"
SHOW CREATE TABLE t;
Table	Create Table
t	CREATE TABLE `t` (
  `a` time NOT NULL,
  `b` year GENERATED ALWAYS AS (`a`) VIRTUAL NOT NULL,
  KEY `on_b` (`b`)
) ENGINE=InnoDB DEFAULT CHARSET=utf8mb4 COLLATE=utf8mb4_0900_ai_ci
INSERT IGNORE INTO t (a) VALUES ("11:12:13");
Warnings:
Warning	1264	Out of range value for column 'b' at row 1
SELECT * FROM t;
a	b
11:12:13	0000
DELETE FROM t;
DELETE IGNORE FROM t;
CHECK TABLE t;
Table	Op	Msg_type	Msg_text
test.t	check	status	OK
DROP TABLE t;
# Testing example of type DATETIME and value "2030-04-05 11:12:13"
SHOW CREATE TABLE t;
Table	Create Table
t	CREATE TABLE `t` (
  `a` datetime NOT NULL,
  `b` year GENERATED ALWAYS AS (`a`) VIRTUAL NOT NULL,
  KEY `on_b` (`b`)
) ENGINE=InnoDB DEFAULT CHARSET=utf8mb4 COLLATE=utf8mb4_0900_ai_ci
INSERT IGNORE INTO t (a) VALUES ("2030-04-05 11:12:13");
Warnings:
Warning	1264	Out of range value for column 'b' at row 1
SELECT * FROM t;
a	b
2030-04-05 11:12:13	0000
DELETE FROM t;
DELETE IGNORE FROM t;
CHECK TABLE t;
Table	Op	Msg_type	Msg_text
test.t	check	status	OK
DROP TABLE t;
# Testing example of type TIMESTAMP and value "2030-04-05 11:12:13"
SHOW CREATE TABLE t;
Table	Create Table
t	CREATE TABLE `t` (
  `a` timestamp NOT NULL,
  `b` year GENERATED ALWAYS AS (`a`) VIRTUAL NOT NULL,
  KEY `on_b` (`b`)
) ENGINE=InnoDB DEFAULT CHARSET=utf8mb4 COLLATE=utf8mb4_0900_ai_ci
INSERT IGNORE INTO t (a) VALUES ("2030-04-05 11:12:13");
Warnings:
Warning	1264	Out of range value for column 'b' at row 1
SELECT * FROM t;
a	b
2030-04-05 11:12:13	0000
DELETE FROM t;
DELETE IGNORE FROM t;
CHECK TABLE t;
Table	Op	Msg_type	Msg_text
test.t	check	status	OK
DROP TABLE t;
# Testing example of type CHAR(40) and value "2000000000000000000000000000000000000"
SHOW CREATE TABLE t;
Table	Create Table
t	CREATE TABLE `t` (
  `a` char(40) NOT NULL,
  `b` year GENERATED ALWAYS AS (`a`) VIRTUAL NOT NULL,
  KEY `on_b` (`b`)
) ENGINE=InnoDB DEFAULT CHARSET=utf8mb4 COLLATE=utf8mb4_0900_ai_ci
INSERT IGNORE INTO t (a) VALUES ("2000000000000000000000000000000000000");
Warnings:
Warning	1264	Out of range value for column 'b' at row 1
SELECT * FROM t;
a	b
2000000000000000000000000000000000000	0000
DELETE FROM t;
DELETE IGNORE FROM t;
CHECK TABLE t;
Table	Op	Msg_type	Msg_text
test.t	check	status	OK
DROP TABLE t;
# Testing example of type BINARY(45) and value "200000000000000000000000000000000000000000"
SHOW CREATE TABLE t;
Table	Create Table
t	CREATE TABLE `t` (
  `a` binary(45) NOT NULL,
  `b` year GENERATED ALWAYS AS (`a`) VIRTUAL NOT NULL,
  KEY `on_b` (`b`)
) ENGINE=InnoDB DEFAULT CHARSET=utf8mb4 COLLATE=utf8mb4_0900_ai_ci
INSERT IGNORE INTO t (a) VALUES ("200000000000000000000000000000000000000000");
Warnings:
Warning	1264	Out of range value for column 'b' at row 1
SELECT * FROM t;
a	b
200000000000000000000000000000000000000000   	0000
DELETE FROM t;
DELETE IGNORE FROM t;
CHECK TABLE t;
Table	Op	Msg_type	Msg_text
test.t	check	status	OK
DROP TABLE t;
# Testing example of type VARCHAR(50) and value "2000000000000000000000000000000000000000000000000"
SHOW CREATE TABLE t;
Table	Create Table
t	CREATE TABLE `t` (
  `a` varchar(50) NOT NULL,
  `b` year GENERATED ALWAYS AS (`a`) VIRTUAL NOT NULL,
  KEY `on_b` (`b`)
) ENGINE=InnoDB DEFAULT CHARSET=utf8mb4 COLLATE=utf8mb4_0900_ai_ci
INSERT IGNORE INTO t (a) VALUES ("2000000000000000000000000000000000000000000000000");
Warnings:
Warning	1264	Out of range value for column 'b' at row 1
SELECT * FROM t;
a	b
2000000000000000000000000000000000000000000000000	0000
DELETE FROM t;
DELETE IGNORE FROM t;
CHECK TABLE t;
Table	Op	Msg_type	Msg_text
test.t	check	status	OK
DROP TABLE t;
# Testing example of type CHAR(24) and value "hello beautiful world"
SHOW CREATE TABLE t;
Table	Create Table
t	CREATE TABLE `t` (
  `a` char(24) NOT NULL,
  `b` year GENERATED ALWAYS AS (`a`) VIRTUAL NOT NULL,
  KEY `on_b` (`b`)
) ENGINE=InnoDB DEFAULT CHARSET=utf8mb4 COLLATE=utf8mb4_0900_ai_ci
INSERT IGNORE INTO t (a) VALUES ("hello beautiful world");
Warnings:
Warning	1366	Incorrect integer value: 'hello beautiful world' for column 'b' at row 1
SELECT * FROM t;
a	b
hello beautiful world	0000
DELETE FROM t;
DELETE IGNORE FROM t;
CHECK TABLE t;
Table	Op	Msg_type	Msg_text
test.t	check	status	OK
DROP TABLE t;
# Testing example of type BINARY(12) and value "hello world"
SHOW CREATE TABLE t;
Table	Create Table
t	CREATE TABLE `t` (
  `a` binary(12) NOT NULL,
  `b` year GENERATED ALWAYS AS (`a`) VIRTUAL NOT NULL,
  KEY `on_b` (`b`)
) ENGINE=InnoDB DEFAULT CHARSET=utf8mb4 COLLATE=utf8mb4_0900_ai_ci
INSERT IGNORE INTO t (a) VALUES ("hello world");
Warnings:
Warning	1366	Incorrect integer value: 'hello world\x00' for column 'b' at row 1
SELECT * FROM t;
a	b
hello world 	0000
DELETE FROM t;
DELETE IGNORE FROM t;
CHECK TABLE t;
Table	Op	Msg_type	Msg_text
test.t	check	status	OK
DROP TABLE t;
# Testing example of type VARCHAR(6) and value "hello"
SHOW CREATE TABLE t;
Table	Create Table
t	CREATE TABLE `t` (
  `a` varchar(6) NOT NULL,
  `b` year GENERATED ALWAYS AS (`a`) VIRTUAL NOT NULL,
  KEY `on_b` (`b`)
) ENGINE=InnoDB DEFAULT CHARSET=utf8mb4 COLLATE=utf8mb4_0900_ai_ci
INSERT IGNORE INTO t (a) VALUES ("hello");
Warnings:
Warning	1366	Incorrect integer value: 'hello' for column 'b' at row 1
SELECT * FROM t;
a	b
hello	0000
DELETE FROM t;
DELETE IGNORE FROM t;
CHECK TABLE t;
Table	Op	Msg_type	Msg_text
test.t	check	status	OK
DROP TABLE t;
# Testing example of type ENUM("up","down") and value "up"
SHOW CREATE TABLE t;
Table	Create Table
t	CREATE TABLE `t` (
  `a` enum('up','down') NOT NULL,
  `b` year GENERATED ALWAYS AS (`a`) VIRTUAL NOT NULL,
  KEY `on_b` (`b`)
) ENGINE=InnoDB DEFAULT CHARSET=utf8mb4 COLLATE=utf8mb4_0900_ai_ci
INSERT IGNORE INTO t (a) VALUES ("up");
SELECT * FROM t;
a	b
up	2001
DELETE FROM t;
DELETE IGNORE FROM t;
CHECK TABLE t;
Table	Op	Msg_type	Msg_text
test.t	check	status	OK
DROP TABLE t;
# Testing example of type SET("up","down") and value "up,down"
SHOW CREATE TABLE t;
Table	Create Table
t	CREATE TABLE `t` (
  `a` set('up','down') NOT NULL,
  `b` year GENERATED ALWAYS AS (`a`) VIRTUAL NOT NULL,
  KEY `on_b` (`b`)
) ENGINE=InnoDB DEFAULT CHARSET=utf8mb4 COLLATE=utf8mb4_0900_ai_ci
INSERT IGNORE INTO t (a) VALUES ("up,down");
SELECT * FROM t;
a	b
up,down	2003
DELETE FROM t;
DELETE IGNORE FROM t;
CHECK TABLE t;
Table	Op	Msg_type	Msg_text
test.t	check	status	OK
DROP TABLE t;
# Testing example of type GEOMETRY and value ST_GeomFromText("POINT(1 1)")
SHOW CREATE TABLE t;
Table	Create Table
t	CREATE TABLE `t` (
  `a` geometry NOT NULL,
  `b` year GENERATED ALWAYS AS (`a`) VIRTUAL NOT NULL,
  KEY `on_b` (`b`)
) ENGINE=InnoDB DEFAULT CHARSET=utf8mb4 COLLATE=utf8mb4_0900_ai_ci
INSERT IGNORE INTO t (a) VALUES (ST_GeomFromText("POINT(1 1)"));
Warnings:
Warning	1366	Incorrect integer value: '\x00\x00\x00\x00\x01\x01\x00\x00\x00\x00\x00\x00\x00\x00\x00\xF0?\x00\x00\x00\x00\x00\x00\xF0?' for column 'b' at row 1
SELECT * FROM t;
a	b
             ð?      ð?	0000
DELETE FROM t;
DELETE IGNORE FROM t;
CHECK TABLE t;
Table	Op	Msg_type	Msg_text
test.t	check	status	OK
DROP TABLE t;
# Testing example of type POINT and value ST_GeomFromText("POINT(1 1)")
SHOW CREATE TABLE t;
Table	Create Table
t	CREATE TABLE `t` (
  `a` point NOT NULL,
  `b` year GENERATED ALWAYS AS (`a`) VIRTUAL NOT NULL,
  KEY `on_b` (`b`)
) ENGINE=InnoDB DEFAULT CHARSET=utf8mb4 COLLATE=utf8mb4_0900_ai_ci
INSERT IGNORE INTO t (a) VALUES (ST_GeomFromText("POINT(1 1)"));
Warnings:
Warning	1366	Incorrect integer value: '\x00\x00\x00\x00\x01\x01\x00\x00\x00\x00\x00\x00\x00\x00\x00\xF0?\x00\x00\x00\x00\x00\x00\xF0?' for column 'b' at row 1
SELECT * FROM t;
a	b
             ð?      ð?	0000
DELETE FROM t;
DELETE IGNORE FROM t;
CHECK TABLE t;
Table	Op	Msg_type	Msg_text
test.t	check	status	OK
DROP TABLE t;
# Testing example of type LINESTRING and value ST_GeomFromText("LINESTRING(0 0,1 1,2 2)")
SHOW CREATE TABLE t;
Table	Create Table
t	CREATE TABLE `t` (
  `a` linestring NOT NULL,
  `b` year GENERATED ALWAYS AS (`a`) VIRTUAL NOT NULL,
  KEY `on_b` (`b`)
) ENGINE=InnoDB DEFAULT CHARSET=utf8mb4 COLLATE=utf8mb4_0900_ai_ci
INSERT IGNORE INTO t (a) VALUES (ST_GeomFromText("LINESTRING(0 0,1 1,2 2)"));
Warnings:
Warning	1366	Incorrect integer value: '\x00\x00\x00\x00\x01\x02\x00\x00\x00\x03\x00\x00\x00\x00\x00\x00\x00\x00\x00\x00\x00\x00\x00\x00\x00\x00\x00\x00\x00\x00\x00\x00' for column 'b' at row 1
SELECT * FROM t;
a	b
                                ð?      ð?       @       @	0000
DELETE FROM t;
DELETE IGNORE FROM t;
CHECK TABLE t;
Table	Op	Msg_type	Msg_text
test.t	check	status	OK
DROP TABLE t;
# Testing example of type POLYGON and value ST_GeomFromText("POLYGON((0 0,1 0,1 1,0 1,0 0),(5 5,7 5,7 7,5 7,5 5))")
SHOW CREATE TABLE t;
Table	Create Table
t	CREATE TABLE `t` (
  `a` polygon NOT NULL,
  `b` year GENERATED ALWAYS AS (`a`) VIRTUAL NOT NULL,
  KEY `on_b` (`b`)
) ENGINE=InnoDB DEFAULT CHARSET=utf8mb4 COLLATE=utf8mb4_0900_ai_ci
INSERT IGNORE INTO t (a) VALUES (ST_GeomFromText("POLYGON((0 0,1 0,1 1,0 1,0 0),(5 5,7 5,7 7,5 7,5 5))"));
Warnings:
Warning	1366	Incorrect integer value: '\x00\x00\x00\x00\x01\x03\x00\x00\x00\x02\x00\x00\x00\x05\x00\x00\x00\x00\x00\x00\x00\x00\x00\x00\x00\x00\x00\x00\x00\x00\x00\x00' for column 'b' at row 1
SELECT * FROM t;
a	b
                                   ð?              ð?      ð?              ð?                         @      @      @      @      @      @      @      @      @      @	0000
DELETE FROM t;
DELETE IGNORE FROM t;
CHECK TABLE t;
Table	Op	Msg_type	Msg_text
test.t	check	status	OK
DROP TABLE t;
#
# Testing virtual column of type DATE
#
# Testing example of type JSON and value "{}"
SHOW CREATE TABLE t;
Table	Create Table
t	CREATE TABLE `t` (
  `a` json NOT NULL,
  `b` date GENERATED ALWAYS AS (`a`) VIRTUAL NOT NULL,
  KEY `on_b` (`b`)
) ENGINE=InnoDB DEFAULT CHARSET=utf8mb4 COLLATE=utf8mb4_0900_ai_ci
INSERT IGNORE INTO t (a) VALUES ("{}");
Warnings:
Warning	3156	Invalid JSON value for CAST to DATE/TIME/DATETIME/TIMESTAMP from column a at row 1
Warning	1264	Out of range value for column 'b' at row 1
SELECT * FROM t;
a	b
{}	0000-00-00
Warnings:
Warning	3156	Invalid JSON value for CAST to DATE/TIME/DATETIME/TIMESTAMP from column a at row 1
Warning	1292	Incorrect date value: '0000-00-00 00:00:00' for column 'b' at row 1
DELETE FROM t;
DELETE IGNORE FROM t;
Warnings:
Warning	3156	Invalid JSON value for CAST to DATE/TIME/DATETIME/TIMESTAMP from column a at row 1
Warning	1292	Incorrect date value: '0000-00-00 00:00:00' for column 'b' at row 1
Warning	3156	Invalid JSON value for CAST to DATE/TIME/DATETIME/TIMESTAMP from column a at row 1
Warning	1292	Incorrect date value: '0000-00-00 00:00:00' for column 'b' at row 1
CHECK TABLE t;
Table	Op	Msg_type	Msg_text
test.t	check	status	OK
DROP TABLE t;
# Testing example of type JSON and value '["hello beautiful world"]'
SHOW CREATE TABLE t;
Table	Create Table
t	CREATE TABLE `t` (
  `a` json NOT NULL,
  `b` date GENERATED ALWAYS AS (`a`) VIRTUAL NOT NULL,
  KEY `on_b` (`b`)
) ENGINE=InnoDB DEFAULT CHARSET=utf8mb4 COLLATE=utf8mb4_0900_ai_ci
INSERT IGNORE INTO t (a) VALUES ('["hello beautiful world"]');
Warnings:
Warning	3156	Invalid JSON value for CAST to DATE/TIME/DATETIME/TIMESTAMP from column a at row 1
Warning	1264	Out of range value for column 'b' at row 1
SELECT * FROM t;
a	b
["hello beautiful world"]	0000-00-00
Warnings:
Warning	3156	Invalid JSON value for CAST to DATE/TIME/DATETIME/TIMESTAMP from column a at row 1
Warning	1292	Incorrect date value: '0000-00-00 00:00:00' for column 'b' at row 1
DELETE FROM t;
DELETE IGNORE FROM t;
Warnings:
Warning	3156	Invalid JSON value for CAST to DATE/TIME/DATETIME/TIMESTAMP from column a at row 1
Warning	1292	Incorrect date value: '0000-00-00 00:00:00' for column 'b' at row 1
Warning	3156	Invalid JSON value for CAST to DATE/TIME/DATETIME/TIMESTAMP from column a at row 1
Warning	1292	Incorrect date value: '0000-00-00 00:00:00' for column 'b' at row 1
CHECK TABLE t;
Table	Op	Msg_type	Msg_text
test.t	check	status	OK
DROP TABLE t;
# Testing example of type JSON and value "-1"
SHOW CREATE TABLE t;
Table	Create Table
t	CREATE TABLE `t` (
  `a` json NOT NULL,
  `b` date GENERATED ALWAYS AS (`a`) VIRTUAL NOT NULL,
  KEY `on_b` (`b`)
) ENGINE=InnoDB DEFAULT CHARSET=utf8mb4 COLLATE=utf8mb4_0900_ai_ci
INSERT IGNORE INTO t (a) VALUES ("-1");
Warnings:
Warning	3156	Invalid JSON value for CAST to DATE/TIME/DATETIME/TIMESTAMP from column a at row 1
Warning	1264	Out of range value for column 'b' at row 1
SELECT * FROM t;
a	b
-1	0000-00-00
Warnings:
Warning	3156	Invalid JSON value for CAST to DATE/TIME/DATETIME/TIMESTAMP from column a at row 1
Warning	1292	Incorrect date value: '0000-00-00 00:00:00' for column 'b' at row 1
DELETE FROM t;
DELETE IGNORE FROM t;
Warnings:
Warning	3156	Invalid JSON value for CAST to DATE/TIME/DATETIME/TIMESTAMP from column a at row 1
Warning	1292	Incorrect date value: '0000-00-00 00:00:00' for column 'b' at row 1
Warning	3156	Invalid JSON value for CAST to DATE/TIME/DATETIME/TIMESTAMP from column a at row 1
Warning	1292	Incorrect date value: '0000-00-00 00:00:00' for column 'b' at row 1
CHECK TABLE t;
Table	Op	Msg_type	Msg_text
test.t	check	status	OK
DROP TABLE t;
# Testing example of type TINYINT and value -1
SHOW CREATE TABLE t;
Table	Create Table
t	CREATE TABLE `t` (
  `a` tinyint NOT NULL,
  `b` date GENERATED ALWAYS AS (`a`) VIRTUAL NOT NULL,
  KEY `on_b` (`b`)
) ENGINE=InnoDB DEFAULT CHARSET=utf8mb4 COLLATE=utf8mb4_0900_ai_ci
INSERT IGNORE INTO t (a) VALUES (-1);
Warnings:
Warning	1264	Out of range value for column 'b' at row 1
SELECT * FROM t;
a	b
-1	0000-00-00
Warnings:
Warning	1292	Incorrect date value: '-1' for column 'b' at row 1
DELETE FROM t;
DELETE IGNORE FROM t;
Warnings:
Warning	1292	Incorrect date value: '-1' for column 'b' at row 1
Warning	1292	Incorrect date value: '-1' for column 'b' at row 1
CHECK TABLE t;
Table	Op	Msg_type	Msg_text
test.t	check	status	OK
DROP TABLE t;
# Testing example of type SMALLINT and value -1
SHOW CREATE TABLE t;
Table	Create Table
t	CREATE TABLE `t` (
  `a` smallint NOT NULL,
  `b` date GENERATED ALWAYS AS (`a`) VIRTUAL NOT NULL,
  KEY `on_b` (`b`)
) ENGINE=InnoDB DEFAULT CHARSET=utf8mb4 COLLATE=utf8mb4_0900_ai_ci
INSERT IGNORE INTO t (a) VALUES (-1);
Warnings:
Warning	1264	Out of range value for column 'b' at row 1
SELECT * FROM t;
a	b
-1	0000-00-00
Warnings:
Warning	1292	Incorrect date value: '-1' for column 'b' at row 1
DELETE FROM t;
DELETE IGNORE FROM t;
Warnings:
Warning	1292	Incorrect date value: '-1' for column 'b' at row 1
Warning	1292	Incorrect date value: '-1' for column 'b' at row 1
CHECK TABLE t;
Table	Op	Msg_type	Msg_text
test.t	check	status	OK
DROP TABLE t;
# Testing example of type MEDIUMINT and value -1
SHOW CREATE TABLE t;
Table	Create Table
t	CREATE TABLE `t` (
  `a` mediumint NOT NULL,
  `b` date GENERATED ALWAYS AS (`a`) VIRTUAL NOT NULL,
  KEY `on_b` (`b`)
) ENGINE=InnoDB DEFAULT CHARSET=utf8mb4 COLLATE=utf8mb4_0900_ai_ci
INSERT IGNORE INTO t (a) VALUES (-1);
Warnings:
Warning	1264	Out of range value for column 'b' at row 1
SELECT * FROM t;
a	b
-1	0000-00-00
Warnings:
Warning	1292	Incorrect date value: '-1' for column 'b' at row 1
DELETE FROM t;
DELETE IGNORE FROM t;
Warnings:
Warning	1292	Incorrect date value: '-1' for column 'b' at row 1
Warning	1292	Incorrect date value: '-1' for column 'b' at row 1
CHECK TABLE t;
Table	Op	Msg_type	Msg_text
test.t	check	status	OK
DROP TABLE t;
# Testing example of type INT and value 2000000000
SHOW CREATE TABLE t;
Table	Create Table
t	CREATE TABLE `t` (
  `a` int NOT NULL,
  `b` date GENERATED ALWAYS AS (`a`) VIRTUAL NOT NULL,
  KEY `on_b` (`b`)
) ENGINE=InnoDB DEFAULT CHARSET=utf8mb4 COLLATE=utf8mb4_0900_ai_ci
INSERT IGNORE INTO t (a) VALUES (2000000000);
Warnings:
Warning	1265	Data truncated for column 'b' at row 1
SELECT * FROM t;
a	b
2000000000	0000-00-00
Warnings:
Warning	1292	Incorrect date value: '2000000000' for column 'b' at row 1
DELETE FROM t;
DELETE IGNORE FROM t;
Warnings:
Warning	1292	Incorrect date value: '2000000000' for column 'b' at row 1
Warning	1292	Incorrect date value: '2000000000' for column 'b' at row 1
CHECK TABLE t;
Table	Op	Msg_type	Msg_text
test.t	check	status	OK
DROP TABLE t;
# Testing example of type INT and value -2000000000
SHOW CREATE TABLE t;
Table	Create Table
t	CREATE TABLE `t` (
  `a` int NOT NULL,
  `b` date GENERATED ALWAYS AS (`a`) VIRTUAL NOT NULL,
  KEY `on_b` (`b`)
) ENGINE=InnoDB DEFAULT CHARSET=utf8mb4 COLLATE=utf8mb4_0900_ai_ci
INSERT IGNORE INTO t (a) VALUES (-2000000000);
Warnings:
Warning	1264	Out of range value for column 'b' at row 1
SELECT * FROM t;
a	b
-2000000000	0000-00-00
Warnings:
Warning	1292	Incorrect date value: '-2000000000' for column 'b' at row 1
DELETE FROM t;
DELETE IGNORE FROM t;
Warnings:
Warning	1292	Incorrect date value: '-2000000000' for column 'b' at row 1
Warning	1292	Incorrect date value: '-2000000000' for column 'b' at row 1
CHECK TABLE t;
Table	Op	Msg_type	Msg_text
test.t	check	status	OK
DROP TABLE t;
# Testing example of type INT UNSIGNED and value 4000000000
SHOW CREATE TABLE t;
Table	Create Table
t	CREATE TABLE `t` (
  `a` int unsigned NOT NULL,
  `b` date GENERATED ALWAYS AS (`a`) VIRTUAL NOT NULL,
  KEY `on_b` (`b`)
) ENGINE=InnoDB DEFAULT CHARSET=utf8mb4 COLLATE=utf8mb4_0900_ai_ci
INSERT IGNORE INTO t (a) VALUES (4000000000);
Warnings:
Warning	1265	Data truncated for column 'b' at row 1
SELECT * FROM t;
a	b
4000000000	0000-00-00
Warnings:
Warning	1292	Incorrect date value: '4000000000' for column 'b' at row 1
DELETE FROM t;
DELETE IGNORE FROM t;
Warnings:
Warning	1292	Incorrect date value: '4000000000' for column 'b' at row 1
Warning	1292	Incorrect date value: '4000000000' for column 'b' at row 1
CHECK TABLE t;
Table	Op	Msg_type	Msg_text
test.t	check	status	OK
DROP TABLE t;
# Testing example of type BIGINT and value 2000000000000000000
SHOW CREATE TABLE t;
Table	Create Table
t	CREATE TABLE `t` (
  `a` bigint NOT NULL,
  `b` date GENERATED ALWAYS AS (`a`) VIRTUAL NOT NULL,
  KEY `on_b` (`b`)
) ENGINE=InnoDB DEFAULT CHARSET=utf8mb4 COLLATE=utf8mb4_0900_ai_ci
INSERT IGNORE INTO t (a) VALUES (2000000000000000000);
Warnings:
Warning	1264	Out of range value for column 'b' at row 1
SELECT * FROM t;
a	b
2000000000000000000	0000-00-00
Warnings:
Warning	1292	Incorrect date value: '2000000000000000000' for column 'b' at row 1
DELETE FROM t;
DELETE IGNORE FROM t;
Warnings:
Warning	1292	Incorrect date value: '2000000000000000000' for column 'b' at row 1
Warning	1292	Incorrect date value: '2000000000000000000' for column 'b' at row 1
CHECK TABLE t;
Table	Op	Msg_type	Msg_text
test.t	check	status	OK
DROP TABLE t;
# Testing example of type BIGINT and value -2000000000000000000
SHOW CREATE TABLE t;
Table	Create Table
t	CREATE TABLE `t` (
  `a` bigint NOT NULL,
  `b` date GENERATED ALWAYS AS (`a`) VIRTUAL NOT NULL,
  KEY `on_b` (`b`)
) ENGINE=InnoDB DEFAULT CHARSET=utf8mb4 COLLATE=utf8mb4_0900_ai_ci
INSERT IGNORE INTO t (a) VALUES (-2000000000000000000);
Warnings:
Warning	1264	Out of range value for column 'b' at row 1
SELECT * FROM t;
a	b
-2000000000000000000	0000-00-00
Warnings:
Warning	1292	Incorrect date value: '-2000000000000000000' for column 'b' at row 1
DELETE FROM t;
DELETE IGNORE FROM t;
Warnings:
Warning	1292	Incorrect date value: '-2000000000000000000' for column 'b' at row 1
Warning	1292	Incorrect date value: '-2000000000000000000' for column 'b' at row 1
CHECK TABLE t;
Table	Op	Msg_type	Msg_text
test.t	check	status	OK
DROP TABLE t;
# Testing example of type FLOAT and value -1.23456
SHOW CREATE TABLE t;
Table	Create Table
t	CREATE TABLE `t` (
  `a` float NOT NULL,
  `b` date GENERATED ALWAYS AS (`a`) VIRTUAL NOT NULL,
  KEY `on_b` (`b`)
) ENGINE=InnoDB DEFAULT CHARSET=utf8mb4 COLLATE=utf8mb4_0900_ai_ci
INSERT IGNORE INTO t (a) VALUES (-1.23456);
Warnings:
Warning	1264	Out of range value for column 'b' at row 1
SELECT * FROM t;
a	b
-1.23456	0000-00-00
Warnings:
Warning	1292	Incorrect date value: '-1.2345600128173828' for column 'b' at row 1
DELETE FROM t;
DELETE IGNORE FROM t;
Warnings:
Warning	1292	Incorrect date value: '-1.2345600128173828' for column 'b' at row 1
Warning	1292	Incorrect date value: '-1.2345600128173828' for column 'b' at row 1
CHECK TABLE t;
Table	Op	Msg_type	Msg_text
test.t	check	status	OK
DROP TABLE t;
# Testing example of type FLOAT and value -1e38
SHOW CREATE TABLE t;
Table	Create Table
t	CREATE TABLE `t` (
  `a` float NOT NULL,
  `b` date GENERATED ALWAYS AS (`a`) VIRTUAL NOT NULL,
  KEY `on_b` (`b`)
) ENGINE=InnoDB DEFAULT CHARSET=utf8mb4 COLLATE=utf8mb4_0900_ai_ci
INSERT IGNORE INTO t (a) VALUES (-1e38);
Warnings:
Warning	1264	Out of range value for column 'b' at row 1
SELECT * FROM t;
a	b
-1e38	0000-00-00
Warnings:
Warning	1292	Incorrect date value: '-9.999999680285692e37' for column 'b' at row 1
DELETE FROM t;
DELETE IGNORE FROM t;
Warnings:
Warning	1292	Incorrect date value: '-9.999999680285692e37' for column 'b' at row 1
Warning	1292	Incorrect date value: '-9.999999680285692e37' for column 'b' at row 1
CHECK TABLE t;
Table	Op	Msg_type	Msg_text
test.t	check	status	OK
DROP TABLE t;
# Testing example of type FLOAT and value 1e38
SHOW CREATE TABLE t;
Table	Create Table
t	CREATE TABLE `t` (
  `a` float NOT NULL,
  `b` date GENERATED ALWAYS AS (`a`) VIRTUAL NOT NULL,
  KEY `on_b` (`b`)
) ENGINE=InnoDB DEFAULT CHARSET=utf8mb4 COLLATE=utf8mb4_0900_ai_ci
INSERT IGNORE INTO t (a) VALUES (1e38);
Warnings:
Warning	1264	Out of range value for column 'b' at row 1
SELECT * FROM t;
a	b
1e38	0000-00-00
Warnings:
Warning	1292	Incorrect date value: '9.999999680285692e37' for column 'b' at row 1
DELETE FROM t;
DELETE IGNORE FROM t;
Warnings:
Warning	1292	Incorrect date value: '9.999999680285692e37' for column 'b' at row 1
Warning	1292	Incorrect date value: '9.999999680285692e37' for column 'b' at row 1
CHECK TABLE t;
Table	Op	Msg_type	Msg_text
test.t	check	status	OK
DROP TABLE t;
# Testing example of type DOUBLE and value -1.23456789012345
SHOW CREATE TABLE t;
Table	Create Table
t	CREATE TABLE `t` (
  `a` double NOT NULL,
  `b` date GENERATED ALWAYS AS (`a`) VIRTUAL NOT NULL,
  KEY `on_b` (`b`)
) ENGINE=InnoDB DEFAULT CHARSET=utf8mb4 COLLATE=utf8mb4_0900_ai_ci
INSERT IGNORE INTO t (a) VALUES (-1.23456789012345);
Warnings:
Warning	1264	Out of range value for column 'b' at row 1
SELECT * FROM t;
a	b
-1.23456789012345	0000-00-00
Warnings:
Warning	1292	Incorrect date value: '-1.23456789012345' for column 'b' at row 1
DELETE FROM t;
DELETE IGNORE FROM t;
Warnings:
Warning	1292	Incorrect date value: '-1.23456789012345' for column 'b' at row 1
Warning	1292	Incorrect date value: '-1.23456789012345' for column 'b' at row 1
CHECK TABLE t;
Table	Op	Msg_type	Msg_text
test.t	check	status	OK
DROP TABLE t;
# Testing example of type DOUBLE and value 1.23456789012345
SHOW CREATE TABLE t;
Table	Create Table
t	CREATE TABLE `t` (
  `a` double NOT NULL,
  `b` date GENERATED ALWAYS AS (`a`) VIRTUAL NOT NULL,
  KEY `on_b` (`b`)
) ENGINE=InnoDB DEFAULT CHARSET=utf8mb4 COLLATE=utf8mb4_0900_ai_ci
INSERT IGNORE INTO t (a) VALUES (1.23456789012345);
Warnings:
Warning	1265	Data truncated for column 'b' at row 1
SELECT * FROM t;
a	b
1.23456789012345	0000-00-00
Warnings:
Warning	1292	Incorrect date value: '1.23456789012345' for column 'b' at row 1
DELETE FROM t;
DELETE IGNORE FROM t;
Warnings:
Warning	1292	Incorrect date value: '1.23456789012345' for column 'b' at row 1
Warning	1292	Incorrect date value: '1.23456789012345' for column 'b' at row 1
CHECK TABLE t;
Table	Op	Msg_type	Msg_text
test.t	check	status	OK
DROP TABLE t;
# Testing example of type DOUBLE and value -1e300
SHOW CREATE TABLE t;
Table	Create Table
t	CREATE TABLE `t` (
  `a` double NOT NULL,
  `b` date GENERATED ALWAYS AS (`a`) VIRTUAL NOT NULL,
  KEY `on_b` (`b`)
) ENGINE=InnoDB DEFAULT CHARSET=utf8mb4 COLLATE=utf8mb4_0900_ai_ci
INSERT IGNORE INTO t (a) VALUES (-1e300);
Warnings:
Warning	1264	Out of range value for column 'b' at row 1
SELECT * FROM t;
a	b
-1e300	0000-00-00
Warnings:
Warning	1292	Incorrect date value: '-1e300' for column 'b' at row 1
DELETE FROM t;
DELETE IGNORE FROM t;
Warnings:
Warning	1292	Incorrect date value: '-1e300' for column 'b' at row 1
Warning	1292	Incorrect date value: '-1e300' for column 'b' at row 1
CHECK TABLE t;
Table	Op	Msg_type	Msg_text
test.t	check	status	OK
DROP TABLE t;
# Testing example of type DOUBLE and value 1e300
SHOW CREATE TABLE t;
Table	Create Table
t	CREATE TABLE `t` (
  `a` double NOT NULL,
  `b` date GENERATED ALWAYS AS (`a`) VIRTUAL NOT NULL,
  KEY `on_b` (`b`)
) ENGINE=InnoDB DEFAULT CHARSET=utf8mb4 COLLATE=utf8mb4_0900_ai_ci
INSERT IGNORE INTO t (a) VALUES (1e300);
Warnings:
Warning	1264	Out of range value for column 'b' at row 1
SELECT * FROM t;
a	b
1e300	0000-00-00
Warnings:
Warning	1292	Incorrect date value: '1e300' for column 'b' at row 1
DELETE FROM t;
DELETE IGNORE FROM t;
Warnings:
Warning	1292	Incorrect date value: '1e300' for column 'b' at row 1
Warning	1292	Incorrect date value: '1e300' for column 'b' at row 1
CHECK TABLE t;
Table	Op	Msg_type	Msg_text
test.t	check	status	OK
DROP TABLE t;
# Testing example of type DECIMAL(4,2) and value -10.99
SHOW CREATE TABLE t;
Table	Create Table
t	CREATE TABLE `t` (
  `a` decimal(4,2) NOT NULL,
  `b` date GENERATED ALWAYS AS (`a`) VIRTUAL NOT NULL,
  KEY `on_b` (`b`)
) ENGINE=InnoDB DEFAULT CHARSET=utf8mb4 COLLATE=utf8mb4_0900_ai_ci
INSERT IGNORE INTO t (a) VALUES (-10.99);
Warnings:
Warning	1264	Out of range value for column 'b' at row 1
SELECT * FROM t;
a	b
-10.99	0000-00-00
Warnings:
Warning	1292	Incorrect date value: '-10.99' for column 'b' at row 1
DELETE FROM t;
DELETE IGNORE FROM t;
Warnings:
Warning	1292	Incorrect date value: '-10.99' for column 'b' at row 1
Warning	1292	Incorrect date value: '-10.99' for column 'b' at row 1
CHECK TABLE t;
Table	Op	Msg_type	Msg_text
test.t	check	status	OK
DROP TABLE t;
# Testing example of type DECIMAL(34,4) and value 20000000000000000000000000000.0001
SHOW CREATE TABLE t;
Table	Create Table
t	CREATE TABLE `t` (
  `a` decimal(34,4) NOT NULL,
  `b` date GENERATED ALWAYS AS (`a`) VIRTUAL NOT NULL,
  KEY `on_b` (`b`)
) ENGINE=InnoDB DEFAULT CHARSET=utf8mb4 COLLATE=utf8mb4_0900_ai_ci
INSERT IGNORE INTO t (a) VALUES (20000000000000000000000000000.0001);
Warnings:
Warning	1264	Out of range value for column 'b' at row 1
SELECT * FROM t;
a	b
20000000000000000000000000000.0001	0000-00-00
Warnings:
Warning	1292	Incorrect date value: '20000000000000000000000000000.0001' for column 'b' at row 1
DELETE FROM t;
DELETE IGNORE FROM t;
Warnings:
Warning	1292	Incorrect date value: '20000000000000000000000000000.0001' for column 'b' at row 1
Warning	1292	Incorrect date value: '20000000000000000000000000000.0001' for column 'b' at row 1
CHECK TABLE t;
Table	Op	Msg_type	Msg_text
test.t	check	status	OK
DROP TABLE t;
# Testing example of type DECIMAL(34,4) and value -20000000000000000000000000000.0001
SHOW CREATE TABLE t;
Table	Create Table
t	CREATE TABLE `t` (
  `a` decimal(34,4) NOT NULL,
  `b` date GENERATED ALWAYS AS (`a`) VIRTUAL NOT NULL,
  KEY `on_b` (`b`)
) ENGINE=InnoDB DEFAULT CHARSET=utf8mb4 COLLATE=utf8mb4_0900_ai_ci
INSERT IGNORE INTO t (a) VALUES (-20000000000000000000000000000.0001);
Warnings:
Warning	1264	Out of range value for column 'b' at row 1
SELECT * FROM t;
a	b
-20000000000000000000000000000.0001	0000-00-00
Warnings:
Warning	1292	Incorrect date value: '-20000000000000000000000000000.0001' for column 'b' at row 1
DELETE FROM t;
DELETE IGNORE FROM t;
Warnings:
Warning	1292	Incorrect date value: '-20000000000000000000000000000.0001' for column 'b' at row 1
Warning	1292	Incorrect date value: '-20000000000000000000000000000.0001' for column 'b' at row 1
CHECK TABLE t;
Table	Op	Msg_type	Msg_text
test.t	check	status	OK
DROP TABLE t;
# Testing example of type BIT(64) and value 0xDEADBEEFC0FEBABE
SHOW CREATE TABLE t;
Table	Create Table
t	CREATE TABLE `t` (
  `a` bit(64) NOT NULL,
  `b` date GENERATED ALWAYS AS (`a`) VIRTUAL NOT NULL,
  KEY `on_b` (`b`)
) ENGINE=InnoDB DEFAULT CHARSET=utf8mb4 COLLATE=utf8mb4_0900_ai_ci
INSERT IGNORE INTO t (a) VALUES (0xDEADBEEFC0FEBABE);
Warnings:
Warning	1264	Out of range value for column 'b' at row 1
SELECT * FROM t;
a	b
Þ­¾ïÀþº¾	0000-00-00
Warnings:
Warning	1292	Incorrect date value: '16045690984335325886' for column 'b' at row 1
DELETE FROM t;
DELETE IGNORE FROM t;
Warnings:
Warning	1292	Incorrect date value: '16045690984335325886' for column 'b' at row 1
Warning	1292	Incorrect date value: '16045690984335325886' for column 'b' at row 1
CHECK TABLE t;
Table	Op	Msg_type	Msg_text
test.t	check	status	OK
DROP TABLE t;
# Testing example of type BIT(4) and value 0b1000
SHOW CREATE TABLE t;
Table	Create Table
t	CREATE TABLE `t` (
  `a` bit(4) NOT NULL,
  `b` date GENERATED ALWAYS AS (`a`) VIRTUAL NOT NULL,
  KEY `on_b` (`b`)
) ENGINE=InnoDB DEFAULT CHARSET=utf8mb4 COLLATE=utf8mb4_0900_ai_ci
INSERT IGNORE INTO t (a) VALUES (0b1000);
Warnings:
Warning	1265	Data truncated for column 'b' at row 1
SELECT * FROM t;
a	b
	0000-00-00
Warnings:
Warning	1292	Incorrect date value: '8' for column 'b' at row 1
DELETE FROM t;
DELETE IGNORE FROM t;
Warnings:
Warning	1292	Incorrect date value: '8' for column 'b' at row 1
Warning	1292	Incorrect date value: '8' for column 'b' at row 1
CHECK TABLE t;
Table	Op	Msg_type	Msg_text
test.t	check	status	OK
DROP TABLE t;
# Testing example of type YEAR and value 2020
SHOW CREATE TABLE t;
Table	Create Table
t	CREATE TABLE `t` (
  `a` year NOT NULL,
  `b` date GENERATED ALWAYS AS (`a`) VIRTUAL NOT NULL,
  KEY `on_b` (`b`)
) ENGINE=InnoDB DEFAULT CHARSET=utf8mb4 COLLATE=utf8mb4_0900_ai_ci
INSERT IGNORE INTO t (a) VALUES (2020);
Warnings:
Warning	1265	Data truncated for column 'b' at row 1
SELECT * FROM t;
a	b
2020	0000-00-00
Warnings:
Warning	1292	Incorrect date value: '2020' for column 'b' at row 1
DELETE FROM t;
DELETE IGNORE FROM t;
Warnings:
Warning	1292	Incorrect date value: '2020' for column 'b' at row 1
Warning	1292	Incorrect date value: '2020' for column 'b' at row 1
CHECK TABLE t;
Table	Op	Msg_type	Msg_text
test.t	check	status	OK
DROP TABLE t;
# Testing example of type DATE and value "2030-04-05"
SHOW CREATE TABLE t;
Table	Create Table
t	CREATE TABLE `t` (
  `a` date NOT NULL,
  `b` date GENERATED ALWAYS AS (`a`) VIRTUAL NOT NULL,
  KEY `on_b` (`b`)
) ENGINE=InnoDB DEFAULT CHARSET=utf8mb4 COLLATE=utf8mb4_0900_ai_ci
INSERT IGNORE INTO t (a) VALUES ("2030-04-05");
SELECT * FROM t;
a	b
2030-04-05	2030-04-05
DELETE FROM t;
DELETE IGNORE FROM t;
CHECK TABLE t;
Table	Op	Msg_type	Msg_text
test.t	check	status	OK
DROP TABLE t;
# Testing example of type TIME and value "11:12:13"
SHOW CREATE TABLE t;
Table	Create Table
t	CREATE TABLE `t` (
  `a` time NOT NULL,
  `b` date GENERATED ALWAYS AS (`a`) VIRTUAL NOT NULL,
  KEY `on_b` (`b`)
) ENGINE=InnoDB DEFAULT CHARSET=utf8mb4 COLLATE=utf8mb4_0900_ai_ci
INSERT IGNORE INTO t (a) VALUES ("11:12:13");
Warnings:
Note	1265	Data truncated for column 'b' at row 1
SELECT * FROM t;
a	b
11:12:13	2004-11-09
Warnings:
Note	1292	Incorrect date value: '11:12:13' for column 'b' at row 1
DELETE FROM t;
Warnings:
Note	1292	Incorrect date value: '11:12:13' for column 'b' at row 1
Note	1292	Incorrect date value: '11:12:13' for column 'b' at row 1
DELETE IGNORE FROM t;
CHECK TABLE t;
Table	Op	Msg_type	Msg_text
test.t	check	status	OK
DROP TABLE t;
# Testing example of type DATETIME and value "2030-04-05 11:12:13"
SHOW CREATE TABLE t;
Table	Create Table
t	CREATE TABLE `t` (
  `a` datetime NOT NULL,
  `b` date GENERATED ALWAYS AS (`a`) VIRTUAL NOT NULL,
  KEY `on_b` (`b`)
) ENGINE=InnoDB DEFAULT CHARSET=utf8mb4 COLLATE=utf8mb4_0900_ai_ci
INSERT IGNORE INTO t (a) VALUES ("2030-04-05 11:12:13");
Warnings:
Note	1265	Data truncated for column 'b' at row 1
SELECT * FROM t;
a	b
2030-04-05 11:12:13	2030-04-05
Warnings:
Note	1292	Incorrect date value: '2030-04-05 11:12:13' for column 'b' at row 1
DELETE FROM t;
Warnings:
Note	1292	Incorrect date value: '2030-04-05 11:12:13' for column 'b' at row 1
Note	1292	Incorrect date value: '2030-04-05 11:12:13' for column 'b' at row 1
DELETE IGNORE FROM t;
CHECK TABLE t;
Table	Op	Msg_type	Msg_text
test.t	check	status	OK
DROP TABLE t;
# Testing example of type TIMESTAMP and value "2030-04-05 11:12:13"
SHOW CREATE TABLE t;
Table	Create Table
t	CREATE TABLE `t` (
  `a` timestamp NOT NULL,
  `b` date GENERATED ALWAYS AS (`a`) VIRTUAL NOT NULL,
  KEY `on_b` (`b`)
) ENGINE=InnoDB DEFAULT CHARSET=utf8mb4 COLLATE=utf8mb4_0900_ai_ci
INSERT IGNORE INTO t (a) VALUES ("2030-04-05 11:12:13");
Warnings:
Note	1265	Data truncated for column 'b' at row 1
SELECT * FROM t;
a	b
2030-04-05 11:12:13	2030-04-05
Warnings:
Note	1292	Incorrect date value: '2030-04-05 11:12:13' for column 'b' at row 1
DELETE FROM t;
Warnings:
Note	1292	Incorrect date value: '2030-04-05 11:12:13' for column 'b' at row 1
Note	1292	Incorrect date value: '2030-04-05 11:12:13' for column 'b' at row 1
DELETE IGNORE FROM t;
CHECK TABLE t;
Table	Op	Msg_type	Msg_text
test.t	check	status	OK
DROP TABLE t;
# Testing example of type CHAR(40) and value "2000000000000000000000000000000000000"
SHOW CREATE TABLE t;
Table	Create Table
t	CREATE TABLE `t` (
  `a` char(40) NOT NULL,
  `b` date GENERATED ALWAYS AS (`a`) VIRTUAL NOT NULL,
  KEY `on_b` (`b`)
) ENGINE=InnoDB DEFAULT CHARSET=utf8mb4 COLLATE=utf8mb4_0900_ai_ci
INSERT IGNORE INTO t (a) VALUES ("2000000000000000000000000000000000000");
Warnings:
Warning	1264	Out of range value for column 'b' at row 1
SELECT * FROM t;
a	b
2000000000000000000000000000000000000	0000-00-00
Warnings:
Warning	1292	Incorrect date value: '2000000000000000000000000000000000000' for column 'b' at row 1
DELETE FROM t;
DELETE IGNORE FROM t;
Warnings:
Warning	1292	Incorrect date value: '2000000000000000000000000000000000000' for column 'b' at row 1
Warning	1292	Incorrect date value: '2000000000000000000000000000000000000' for column 'b' at row 1
CHECK TABLE t;
Table	Op	Msg_type	Msg_text
test.t	check	status	OK
DROP TABLE t;
# Testing example of type BINARY(45) and value "200000000000000000000000000000000000000000"
SHOW CREATE TABLE t;
Table	Create Table
t	CREATE TABLE `t` (
  `a` binary(45) NOT NULL,
  `b` date GENERATED ALWAYS AS (`a`) VIRTUAL NOT NULL,
  KEY `on_b` (`b`)
) ENGINE=InnoDB DEFAULT CHARSET=utf8mb4 COLLATE=utf8mb4_0900_ai_ci
INSERT IGNORE INTO t (a) VALUES ("200000000000000000000000000000000000000000");
Warnings:
Warning	1265	Data truncated for column 'b' at row 1
SELECT * FROM t;
a	b
200000000000000000000000000000000000000000   	0000-00-00
Warnings:
Warning	1292	Incorrect date value: '200000000000000000000000000000000000000000\x00\x00\x00' for column 'b' at row 1
DELETE FROM t;
DELETE IGNORE FROM t;
Warnings:
Warning	1292	Incorrect date value: '200000000000000000000000000000000000000000\x00\x00\x00' for column 'b' at row 1
Warning	1292	Incorrect date value: '200000000000000000000000000000000000000000\x00\x00\x00' for column 'b' at row 1
CHECK TABLE t;
Table	Op	Msg_type	Msg_text
test.t	check	status	OK
DROP TABLE t;
# Testing example of type VARCHAR(50) and value "2000000000000000000000000000000000000000000000000"
SHOW CREATE TABLE t;
Table	Create Table
t	CREATE TABLE `t` (
  `a` varchar(50) NOT NULL,
  `b` date GENERATED ALWAYS AS (`a`) VIRTUAL NOT NULL,
  KEY `on_b` (`b`)
) ENGINE=InnoDB DEFAULT CHARSET=utf8mb4 COLLATE=utf8mb4_0900_ai_ci
INSERT IGNORE INTO t (a) VALUES ("2000000000000000000000000000000000000000000000000");
Warnings:
Warning	1264	Out of range value for column 'b' at row 1
SELECT * FROM t;
a	b
2000000000000000000000000000000000000000000000000	0000-00-00
Warnings:
Warning	1292	Incorrect date value: '2000000000000000000000000000000000000000000000000' for column 'b' at row 1
DELETE FROM t;
DELETE IGNORE FROM t;
Warnings:
Warning	1292	Incorrect date value: '2000000000000000000000000000000000000000000000000' for column 'b' at row 1
Warning	1292	Incorrect date value: '2000000000000000000000000000000000000000000000000' for column 'b' at row 1
CHECK TABLE t;
Table	Op	Msg_type	Msg_text
test.t	check	status	OK
DROP TABLE t;
# Testing example of type CHAR(24) and value "hello beautiful world"
SHOW CREATE TABLE t;
Table	Create Table
t	CREATE TABLE `t` (
  `a` char(24) NOT NULL,
  `b` date GENERATED ALWAYS AS (`a`) VIRTUAL NOT NULL,
  KEY `on_b` (`b`)
) ENGINE=InnoDB DEFAULT CHARSET=utf8mb4 COLLATE=utf8mb4_0900_ai_ci
INSERT IGNORE INTO t (a) VALUES ("hello beautiful world");
Warnings:
Warning	1265	Data truncated for column 'b' at row 1
SELECT * FROM t;
a	b
hello beautiful world	0000-00-00
Warnings:
Warning	1292	Incorrect date value: 'hello beautiful world' for column 'b' at row 1
DELETE FROM t;
DELETE IGNORE FROM t;
Warnings:
Warning	1292	Incorrect date value: 'hello beautiful world' for column 'b' at row 1
Warning	1292	Incorrect date value: 'hello beautiful world' for column 'b' at row 1
CHECK TABLE t;
Table	Op	Msg_type	Msg_text
test.t	check	status	OK
DROP TABLE t;
# Testing example of type BINARY(12) and value "hello world"
SHOW CREATE TABLE t;
Table	Create Table
t	CREATE TABLE `t` (
  `a` binary(12) NOT NULL,
  `b` date GENERATED ALWAYS AS (`a`) VIRTUAL NOT NULL,
  KEY `on_b` (`b`)
) ENGINE=InnoDB DEFAULT CHARSET=utf8mb4 COLLATE=utf8mb4_0900_ai_ci
INSERT IGNORE INTO t (a) VALUES ("hello world");
Warnings:
Warning	1265	Data truncated for column 'b' at row 1
SELECT * FROM t;
a	b
hello world 	0000-00-00
Warnings:
Warning	1292	Incorrect date value: 'hello world\x00' for column 'b' at row 1
DELETE FROM t;
DELETE IGNORE FROM t;
Warnings:
Warning	1292	Incorrect date value: 'hello world\x00' for column 'b' at row 1
Warning	1292	Incorrect date value: 'hello world\x00' for column 'b' at row 1
CHECK TABLE t;
Table	Op	Msg_type	Msg_text
test.t	check	status	OK
DROP TABLE t;
# Testing example of type VARCHAR(6) and value "hello"
SHOW CREATE TABLE t;
Table	Create Table
t	CREATE TABLE `t` (
  `a` varchar(6) NOT NULL,
  `b` date GENERATED ALWAYS AS (`a`) VIRTUAL NOT NULL,
  KEY `on_b` (`b`)
) ENGINE=InnoDB DEFAULT CHARSET=utf8mb4 COLLATE=utf8mb4_0900_ai_ci
INSERT IGNORE INTO t (a) VALUES ("hello");
Warnings:
Warning	1265	Data truncated for column 'b' at row 1
SELECT * FROM t;
a	b
hello	0000-00-00
Warnings:
Warning	1292	Incorrect date value: 'hello' for column 'b' at row 1
DELETE FROM t;
DELETE IGNORE FROM t;
Warnings:
Warning	1292	Incorrect date value: 'hello' for column 'b' at row 1
Warning	1292	Incorrect date value: 'hello' for column 'b' at row 1
CHECK TABLE t;
Table	Op	Msg_type	Msg_text
test.t	check	status	OK
DROP TABLE t;
# Testing example of type ENUM("up","down") and value "up"
SHOW CREATE TABLE t;
Table	Create Table
t	CREATE TABLE `t` (
  `a` enum('up','down') NOT NULL,
  `b` date GENERATED ALWAYS AS (`a`) VIRTUAL NOT NULL,
  KEY `on_b` (`b`)
) ENGINE=InnoDB DEFAULT CHARSET=utf8mb4 COLLATE=utf8mb4_0900_ai_ci
INSERT IGNORE INTO t (a) VALUES ("up");
Warnings:
Warning	1265	Data truncated for column 'b' at row 1
SELECT * FROM t;
a	b
up	0000-00-00
Warnings:
Warning	1292	Incorrect date value: 'up' for column 'b' at row 1
DELETE FROM t;
DELETE IGNORE FROM t;
Warnings:
Warning	1292	Incorrect date value: 'up' for column 'b' at row 1
Warning	1292	Incorrect date value: 'up' for column 'b' at row 1
CHECK TABLE t;
Table	Op	Msg_type	Msg_text
test.t	check	status	OK
DROP TABLE t;
# Testing example of type SET("up","down") and value "up,down"
SHOW CREATE TABLE t;
Table	Create Table
t	CREATE TABLE `t` (
  `a` set('up','down') NOT NULL,
  `b` date GENERATED ALWAYS AS (`a`) VIRTUAL NOT NULL,
  KEY `on_b` (`b`)
) ENGINE=InnoDB DEFAULT CHARSET=utf8mb4 COLLATE=utf8mb4_0900_ai_ci
INSERT IGNORE INTO t (a) VALUES ("up,down");
Warnings:
Warning	1265	Data truncated for column 'b' at row 1
SELECT * FROM t;
a	b
up,down	0000-00-00
Warnings:
Warning	1292	Incorrect date value: 'up,down' for column 'b' at row 1
DELETE FROM t;
DELETE IGNORE FROM t;
Warnings:
Warning	1292	Incorrect date value: 'up,down' for column 'b' at row 1
Warning	1292	Incorrect date value: 'up,down' for column 'b' at row 1
CHECK TABLE t;
Table	Op	Msg_type	Msg_text
test.t	check	status	OK
DROP TABLE t;
# Testing example of type GEOMETRY and value ST_GeomFromText("POINT(1 1)")
SHOW CREATE TABLE t;
Table	Create Table
t	CREATE TABLE `t` (
  `a` geometry NOT NULL,
  `b` date GENERATED ALWAYS AS (`a`) VIRTUAL NOT NULL,
  KEY `on_b` (`b`)
) ENGINE=InnoDB DEFAULT CHARSET=utf8mb4 COLLATE=utf8mb4_0900_ai_ci
INSERT IGNORE INTO t (a) VALUES (ST_GeomFromText("POINT(1 1)"));
Warnings:
Warning	1265	Data truncated for column 'b' at row 1
SELECT * FROM t;
a	b
             ð?      ð?	0000-00-00
Warnings:
Warning	1292	Incorrect date value: '\x00\x00\x00\x00\x01\x01\x00\x00\x00\x00\x00\x00\x00\x00\x00\xF0?\x00\x00\x00\x00\x00\x00\xF0?' for column 'b' at row 1
DELETE FROM t;
DELETE IGNORE FROM t;
Warnings:
Warning	1292	Incorrect date value: '\x00\x00\x00\x00\x01\x01\x00\x00\x00\x00\x00\x00\x00\x00\x00\xF0?\x00\x00\x00\x00\x00\x00\xF0?' for column 'b' at row 1
Warning	1292	Incorrect date value: '\x00\x00\x00\x00\x01\x01\x00\x00\x00\x00\x00\x00\x00\x00\x00\xF0?\x00\x00\x00\x00\x00\x00\xF0?' for column 'b' at row 1
CHECK TABLE t;
Table	Op	Msg_type	Msg_text
test.t	check	status	OK
DROP TABLE t;
# Testing example of type POINT and value ST_GeomFromText("POINT(1 1)")
SHOW CREATE TABLE t;
Table	Create Table
t	CREATE TABLE `t` (
  `a` point NOT NULL,
  `b` date GENERATED ALWAYS AS (`a`) VIRTUAL NOT NULL,
  KEY `on_b` (`b`)
) ENGINE=InnoDB DEFAULT CHARSET=utf8mb4 COLLATE=utf8mb4_0900_ai_ci
INSERT IGNORE INTO t (a) VALUES (ST_GeomFromText("POINT(1 1)"));
Warnings:
Warning	1265	Data truncated for column 'b' at row 1
SELECT * FROM t;
a	b
             ð?      ð?	0000-00-00
Warnings:
Warning	1292	Incorrect date value: '\x00\x00\x00\x00\x01\x01\x00\x00\x00\x00\x00\x00\x00\x00\x00\xF0?\x00\x00\x00\x00\x00\x00\xF0?' for column 'b' at row 1
DELETE FROM t;
DELETE IGNORE FROM t;
Warnings:
Warning	1292	Incorrect date value: '\x00\x00\x00\x00\x01\x01\x00\x00\x00\x00\x00\x00\x00\x00\x00\xF0?\x00\x00\x00\x00\x00\x00\xF0?' for column 'b' at row 1
Warning	1292	Incorrect date value: '\x00\x00\x00\x00\x01\x01\x00\x00\x00\x00\x00\x00\x00\x00\x00\xF0?\x00\x00\x00\x00\x00\x00\xF0?' for column 'b' at row 1
CHECK TABLE t;
Table	Op	Msg_type	Msg_text
test.t	check	status	OK
DROP TABLE t;
# Testing example of type LINESTRING and value ST_GeomFromText("LINESTRING(0 0,1 1,2 2)")
SHOW CREATE TABLE t;
Table	Create Table
t	CREATE TABLE `t` (
  `a` linestring NOT NULL,
  `b` date GENERATED ALWAYS AS (`a`) VIRTUAL NOT NULL,
  KEY `on_b` (`b`)
) ENGINE=InnoDB DEFAULT CHARSET=utf8mb4 COLLATE=utf8mb4_0900_ai_ci
INSERT IGNORE INTO t (a) VALUES (ST_GeomFromText("LINESTRING(0 0,1 1,2 2)"));
Warnings:
Warning	1265	Data truncated for column 'b' at row 1
SELECT * FROM t;
a	b
                                ð?      ð?       @       @	0000-00-00
Warnings:
Warning	1292	Incorrect date value: '\x00\x00\x00\x00\x01\x02\x00\x00\x00\x03\x00\x00\x00\x00\x00\x00\x00\x00\x00\x00\x00\x00\x00\x00\x00\x00\x00\x00\x00\x00\x00\x00' for column 'b' at row 1
DELETE FROM t;
DELETE IGNORE FROM t;
Warnings:
Warning	1292	Incorrect date value: '\x00\x00\x00\x00\x01\x02\x00\x00\x00\x03\x00\x00\x00\x00\x00\x00\x00\x00\x00\x00\x00\x00\x00\x00\x00\x00\x00\x00\x00\x00\x00\x00' for column 'b' at row 1
Warning	1292	Incorrect date value: '\x00\x00\x00\x00\x01\x02\x00\x00\x00\x03\x00\x00\x00\x00\x00\x00\x00\x00\x00\x00\x00\x00\x00\x00\x00\x00\x00\x00\x00\x00\x00\x00' for column 'b' at row 1
CHECK TABLE t;
Table	Op	Msg_type	Msg_text
test.t	check	status	OK
DROP TABLE t;
# Testing example of type POLYGON and value ST_GeomFromText("POLYGON((0 0,1 0,1 1,0 1,0 0),(5 5,7 5,7 7,5 7,5 5))")
SHOW CREATE TABLE t;
Table	Create Table
t	CREATE TABLE `t` (
  `a` polygon NOT NULL,
  `b` date GENERATED ALWAYS AS (`a`) VIRTUAL NOT NULL,
  KEY `on_b` (`b`)
) ENGINE=InnoDB DEFAULT CHARSET=utf8mb4 COLLATE=utf8mb4_0900_ai_ci
INSERT IGNORE INTO t (a) VALUES (ST_GeomFromText("POLYGON((0 0,1 0,1 1,0 1,0 0),(5 5,7 5,7 7,5 7,5 5))"));
Warnings:
Warning	1265	Data truncated for column 'b' at row 1
SELECT * FROM t;
a	b
                                   ð?              ð?      ð?              ð?                         @      @      @      @      @      @      @      @      @      @	0000-00-00
Warnings:
Warning	1292	Incorrect date value: '\x00\x00\x00\x00\x01\x03\x00\x00\x00\x02\x00\x00\x00\x05\x00\x00\x00\x00\x00\x00\x00\x00\x00\x00\x00\x00\x00\x00\x00\x00\x00\x00' for column 'b' at row 1
DELETE FROM t;
DELETE IGNORE FROM t;
Warnings:
Warning	1292	Incorrect date value: '\x00\x00\x00\x00\x01\x03\x00\x00\x00\x02\x00\x00\x00\x05\x00\x00\x00\x00\x00\x00\x00\x00\x00\x00\x00\x00\x00\x00\x00\x00\x00\x00' for column 'b' at row 1
Warning	1292	Incorrect date value: '\x00\x00\x00\x00\x01\x03\x00\x00\x00\x02\x00\x00\x00\x05\x00\x00\x00\x00\x00\x00\x00\x00\x00\x00\x00\x00\x00\x00\x00\x00\x00\x00' for column 'b' at row 1
CHECK TABLE t;
Table	Op	Msg_type	Msg_text
test.t	check	status	OK
DROP TABLE t;
#
# Testing virtual column of type TIME
#
# Testing example of type JSON and value "{}"
SHOW CREATE TABLE t;
Table	Create Table
t	CREATE TABLE `t` (
  `a` json NOT NULL,
  `b` time GENERATED ALWAYS AS (`a`) VIRTUAL NOT NULL,
  KEY `on_b` (`b`)
) ENGINE=InnoDB DEFAULT CHARSET=utf8mb4 COLLATE=utf8mb4_0900_ai_ci
INSERT IGNORE INTO t (a) VALUES ("{}");
Warnings:
Warning	3156	Invalid JSON value for CAST to DATE/TIME/DATETIME/TIMESTAMP from column a at row 1
SELECT * FROM t;
a	b
{}	00:00:00
Warnings:
Warning	3156	Invalid JSON value for CAST to DATE/TIME/DATETIME/TIMESTAMP from column a at row 1
DELETE FROM t;
DELETE IGNORE FROM t;
Warnings:
Warning	3156	Invalid JSON value for CAST to DATE/TIME/DATETIME/TIMESTAMP from column a at row 1
Warning	3156	Invalid JSON value for CAST to DATE/TIME/DATETIME/TIMESTAMP from column a at row 1
CHECK TABLE t;
Table	Op	Msg_type	Msg_text
test.t	check	status	OK
DROP TABLE t;
# Testing example of type JSON and value '["hello beautiful world"]'
SHOW CREATE TABLE t;
Table	Create Table
t	CREATE TABLE `t` (
  `a` json NOT NULL,
  `b` time GENERATED ALWAYS AS (`a`) VIRTUAL NOT NULL,
  KEY `on_b` (`b`)
) ENGINE=InnoDB DEFAULT CHARSET=utf8mb4 COLLATE=utf8mb4_0900_ai_ci
INSERT IGNORE INTO t (a) VALUES ('["hello beautiful world"]');
Warnings:
Warning	3156	Invalid JSON value for CAST to DATE/TIME/DATETIME/TIMESTAMP from column a at row 1
SELECT * FROM t;
a	b
["hello beautiful world"]	00:00:00
Warnings:
Warning	3156	Invalid JSON value for CAST to DATE/TIME/DATETIME/TIMESTAMP from column a at row 1
DELETE FROM t;
DELETE IGNORE FROM t;
Warnings:
Warning	3156	Invalid JSON value for CAST to DATE/TIME/DATETIME/TIMESTAMP from column a at row 1
Warning	3156	Invalid JSON value for CAST to DATE/TIME/DATETIME/TIMESTAMP from column a at row 1
CHECK TABLE t;
Table	Op	Msg_type	Msg_text
test.t	check	status	OK
DROP TABLE t;
# Testing example of type JSON and value "-1"
SHOW CREATE TABLE t;
Table	Create Table
t	CREATE TABLE `t` (
  `a` json NOT NULL,
  `b` time GENERATED ALWAYS AS (`a`) VIRTUAL NOT NULL,
  KEY `on_b` (`b`)
) ENGINE=InnoDB DEFAULT CHARSET=utf8mb4 COLLATE=utf8mb4_0900_ai_ci
INSERT IGNORE INTO t (a) VALUES ("-1");
Warnings:
Warning	3156	Invalid JSON value for CAST to DATE/TIME/DATETIME/TIMESTAMP from column a at row 1
SELECT * FROM t;
a	b
-1	00:00:00
Warnings:
Warning	3156	Invalid JSON value for CAST to DATE/TIME/DATETIME/TIMESTAMP from column a at row 1
DELETE FROM t;
DELETE IGNORE FROM t;
Warnings:
Warning	3156	Invalid JSON value for CAST to DATE/TIME/DATETIME/TIMESTAMP from column a at row 1
Warning	3156	Invalid JSON value for CAST to DATE/TIME/DATETIME/TIMESTAMP from column a at row 1
CHECK TABLE t;
Table	Op	Msg_type	Msg_text
test.t	check	status	OK
DROP TABLE t;
# Testing example of type TINYINT and value -1
SHOW CREATE TABLE t;
Table	Create Table
t	CREATE TABLE `t` (
  `a` tinyint NOT NULL,
  `b` time GENERATED ALWAYS AS (`a`) VIRTUAL NOT NULL,
  KEY `on_b` (`b`)
) ENGINE=InnoDB DEFAULT CHARSET=utf8mb4 COLLATE=utf8mb4_0900_ai_ci
INSERT IGNORE INTO t (a) VALUES (-1);
SELECT * FROM t;
a	b
-1	-00:00:01
DELETE FROM t;
DELETE IGNORE FROM t;
CHECK TABLE t;
Table	Op	Msg_type	Msg_text
test.t	check	status	OK
DROP TABLE t;
# Testing example of type SMALLINT and value -1
SHOW CREATE TABLE t;
Table	Create Table
t	CREATE TABLE `t` (
  `a` smallint NOT NULL,
  `b` time GENERATED ALWAYS AS (`a`) VIRTUAL NOT NULL,
  KEY `on_b` (`b`)
) ENGINE=InnoDB DEFAULT CHARSET=utf8mb4 COLLATE=utf8mb4_0900_ai_ci
INSERT IGNORE INTO t (a) VALUES (-1);
SELECT * FROM t;
a	b
-1	-00:00:01
DELETE FROM t;
DELETE IGNORE FROM t;
CHECK TABLE t;
Table	Op	Msg_type	Msg_text
test.t	check	status	OK
DROP TABLE t;
# Testing example of type MEDIUMINT and value -1
SHOW CREATE TABLE t;
Table	Create Table
t	CREATE TABLE `t` (
  `a` mediumint NOT NULL,
  `b` time GENERATED ALWAYS AS (`a`) VIRTUAL NOT NULL,
  KEY `on_b` (`b`)
) ENGINE=InnoDB DEFAULT CHARSET=utf8mb4 COLLATE=utf8mb4_0900_ai_ci
INSERT IGNORE INTO t (a) VALUES (-1);
SELECT * FROM t;
a	b
-1	-00:00:01
DELETE FROM t;
DELETE IGNORE FROM t;
CHECK TABLE t;
Table	Op	Msg_type	Msg_text
test.t	check	status	OK
DROP TABLE t;
# Testing example of type INT and value 2000000000
SHOW CREATE TABLE t;
Table	Create Table
t	CREATE TABLE `t` (
  `a` int NOT NULL,
  `b` time GENERATED ALWAYS AS (`a`) VIRTUAL NOT NULL,
  KEY `on_b` (`b`)
) ENGINE=InnoDB DEFAULT CHARSET=utf8mb4 COLLATE=utf8mb4_0900_ai_ci
INSERT IGNORE INTO t (a) VALUES (2000000000);
Warnings:
Warning	1264	Out of range value for column 'b' at row 1
SELECT * FROM t;
a	b
2000000000	838:59:59
Warnings:
Warning	1292	Incorrect time value: '2000000000' for column 'b' at row 1
DELETE FROM t;
DELETE IGNORE FROM t;
Warnings:
Warning	1292	Incorrect time value: '2000000000' for column 'b' at row 1
Warning	1292	Incorrect time value: '2000000000' for column 'b' at row 1
CHECK TABLE t;
Table	Op	Msg_type	Msg_text
test.t	check	status	OK
DROP TABLE t;
# Testing example of type INT and value -2000000000
SHOW CREATE TABLE t;
Table	Create Table
t	CREATE TABLE `t` (
  `a` int NOT NULL,
  `b` time GENERATED ALWAYS AS (`a`) VIRTUAL NOT NULL,
  KEY `on_b` (`b`)
) ENGINE=InnoDB DEFAULT CHARSET=utf8mb4 COLLATE=utf8mb4_0900_ai_ci
INSERT IGNORE INTO t (a) VALUES (-2000000000);
Warnings:
Warning	1264	Out of range value for column 'b' at row 1
SELECT * FROM t;
a	b
-2000000000	-838:59:59
Warnings:
Warning	1292	Incorrect time value: '-2000000000' for column 'b' at row 1
DELETE FROM t;
DELETE IGNORE FROM t;
Warnings:
Warning	1292	Incorrect time value: '-2000000000' for column 'b' at row 1
Warning	1292	Incorrect time value: '-2000000000' for column 'b' at row 1
CHECK TABLE t;
Table	Op	Msg_type	Msg_text
test.t	check	status	OK
DROP TABLE t;
# Testing example of type INT UNSIGNED and value 4000000000
SHOW CREATE TABLE t;
Table	Create Table
t	CREATE TABLE `t` (
  `a` int unsigned NOT NULL,
  `b` time GENERATED ALWAYS AS (`a`) VIRTUAL NOT NULL,
  KEY `on_b` (`b`)
) ENGINE=InnoDB DEFAULT CHARSET=utf8mb4 COLLATE=utf8mb4_0900_ai_ci
INSERT IGNORE INTO t (a) VALUES (4000000000);
Warnings:
Warning	1264	Out of range value for column 'b' at row 1
SELECT * FROM t;
a	b
4000000000	838:59:59
Warnings:
Warning	1292	Incorrect time value: '4000000000' for column 'b' at row 1
DELETE FROM t;
DELETE IGNORE FROM t;
Warnings:
Warning	1292	Incorrect time value: '4000000000' for column 'b' at row 1
Warning	1292	Incorrect time value: '4000000000' for column 'b' at row 1
CHECK TABLE t;
Table	Op	Msg_type	Msg_text
test.t	check	status	OK
DROP TABLE t;
# Testing example of type BIGINT and value 2000000000000000000
SHOW CREATE TABLE t;
Table	Create Table
t	CREATE TABLE `t` (
  `a` bigint NOT NULL,
  `b` time GENERATED ALWAYS AS (`a`) VIRTUAL NOT NULL,
  KEY `on_b` (`b`)
) ENGINE=InnoDB DEFAULT CHARSET=utf8mb4 COLLATE=utf8mb4_0900_ai_ci
INSERT IGNORE INTO t (a) VALUES (2000000000000000000);
Warnings:
Warning	1264	Out of range value for column 'b' at row 1
SELECT * FROM t;
a	b
2000000000000000000	838:59:59
Warnings:
Warning	1292	Incorrect time value: '2000000000000000000' for column 'b' at row 1
DELETE FROM t;
DELETE IGNORE FROM t;
Warnings:
Warning	1292	Incorrect time value: '2000000000000000000' for column 'b' at row 1
Warning	1292	Incorrect time value: '2000000000000000000' for column 'b' at row 1
CHECK TABLE t;
Table	Op	Msg_type	Msg_text
test.t	check	status	OK
DROP TABLE t;
# Testing example of type BIGINT and value -2000000000000000000
SHOW CREATE TABLE t;
Table	Create Table
t	CREATE TABLE `t` (
  `a` bigint NOT NULL,
  `b` time GENERATED ALWAYS AS (`a`) VIRTUAL NOT NULL,
  KEY `on_b` (`b`)
) ENGINE=InnoDB DEFAULT CHARSET=utf8mb4 COLLATE=utf8mb4_0900_ai_ci
INSERT IGNORE INTO t (a) VALUES (-2000000000000000000);
Warnings:
Warning	1264	Out of range value for column 'b' at row 1
SELECT * FROM t;
a	b
-2000000000000000000	-838:59:59
Warnings:
Warning	1292	Incorrect time value: '-2000000000000000000' for column 'b' at row 1
DELETE FROM t;
DELETE IGNORE FROM t;
Warnings:
Warning	1292	Incorrect time value: '-2000000000000000000' for column 'b' at row 1
Warning	1292	Incorrect time value: '-2000000000000000000' for column 'b' at row 1
CHECK TABLE t;
Table	Op	Msg_type	Msg_text
test.t	check	status	OK
DROP TABLE t;
# Testing example of type FLOAT and value -1.23456
SHOW CREATE TABLE t;
Table	Create Table
t	CREATE TABLE `t` (
  `a` float NOT NULL,
  `b` time GENERATED ALWAYS AS (`a`) VIRTUAL NOT NULL,
  KEY `on_b` (`b`)
) ENGINE=InnoDB DEFAULT CHARSET=utf8mb4 COLLATE=utf8mb4_0900_ai_ci
INSERT IGNORE INTO t (a) VALUES (-1.23456);
SELECT * FROM t;
a	b
-1.23456	-00:00:01
DELETE FROM t;
DELETE IGNORE FROM t;
CHECK TABLE t;
Table	Op	Msg_type	Msg_text
test.t	check	status	OK
DROP TABLE t;
# Testing example of type FLOAT and value -1e38
SHOW CREATE TABLE t;
Table	Create Table
t	CREATE TABLE `t` (
  `a` float NOT NULL,
  `b` time GENERATED ALWAYS AS (`a`) VIRTUAL NOT NULL,
  KEY `on_b` (`b`)
) ENGINE=InnoDB DEFAULT CHARSET=utf8mb4 COLLATE=utf8mb4_0900_ai_ci
INSERT IGNORE INTO t (a) VALUES (-1e38);
Warnings:
Warning	1264	Out of range value for column 'b' at row 1
SELECT * FROM t;
a	b
-1e38	-838:59:59
Warnings:
Warning	1292	Incorrect time value: '-9.999999680285692e37' for column 'b' at row 1
DELETE FROM t;
DELETE IGNORE FROM t;
Warnings:
Warning	1292	Incorrect time value: '-9.999999680285692e37' for column 'b' at row 1
Warning	1292	Incorrect time value: '-9.999999680285692e37' for column 'b' at row 1
CHECK TABLE t;
Table	Op	Msg_type	Msg_text
test.t	check	status	OK
DROP TABLE t;
# Testing example of type FLOAT and value 1e38
SHOW CREATE TABLE t;
Table	Create Table
t	CREATE TABLE `t` (
  `a` float NOT NULL,
  `b` time GENERATED ALWAYS AS (`a`) VIRTUAL NOT NULL,
  KEY `on_b` (`b`)
) ENGINE=InnoDB DEFAULT CHARSET=utf8mb4 COLLATE=utf8mb4_0900_ai_ci
INSERT IGNORE INTO t (a) VALUES (1e38);
Warnings:
Warning	1264	Out of range value for column 'b' at row 1
SELECT * FROM t;
a	b
1e38	838:59:59
Warnings:
Warning	1292	Incorrect time value: '9.999999680285692e37' for column 'b' at row 1
DELETE FROM t;
DELETE IGNORE FROM t;
Warnings:
Warning	1292	Incorrect time value: '9.999999680285692e37' for column 'b' at row 1
Warning	1292	Incorrect time value: '9.999999680285692e37' for column 'b' at row 1
CHECK TABLE t;
Table	Op	Msg_type	Msg_text
test.t	check	status	OK
DROP TABLE t;
# Testing example of type DOUBLE and value -1.23456789012345
SHOW CREATE TABLE t;
Table	Create Table
t	CREATE TABLE `t` (
  `a` double NOT NULL,
  `b` time GENERATED ALWAYS AS (`a`) VIRTUAL NOT NULL,
  KEY `on_b` (`b`)
) ENGINE=InnoDB DEFAULT CHARSET=utf8mb4 COLLATE=utf8mb4_0900_ai_ci
INSERT IGNORE INTO t (a) VALUES (-1.23456789012345);
SELECT * FROM t;
a	b
-1.23456789012345	-00:00:01
DELETE FROM t;
DELETE IGNORE FROM t;
CHECK TABLE t;
Table	Op	Msg_type	Msg_text
test.t	check	status	OK
DROP TABLE t;
# Testing example of type DOUBLE and value 1.23456789012345
SHOW CREATE TABLE t;
Table	Create Table
t	CREATE TABLE `t` (
  `a` double NOT NULL,
  `b` time GENERATED ALWAYS AS (`a`) VIRTUAL NOT NULL,
  KEY `on_b` (`b`)
) ENGINE=InnoDB DEFAULT CHARSET=utf8mb4 COLLATE=utf8mb4_0900_ai_ci
INSERT IGNORE INTO t (a) VALUES (1.23456789012345);
SELECT * FROM t;
a	b
1.23456789012345	00:00:01
DELETE FROM t;
DELETE IGNORE FROM t;
CHECK TABLE t;
Table	Op	Msg_type	Msg_text
test.t	check	status	OK
DROP TABLE t;
# Testing example of type DOUBLE and value -1e300
SHOW CREATE TABLE t;
Table	Create Table
t	CREATE TABLE `t` (
  `a` double NOT NULL,
  `b` time GENERATED ALWAYS AS (`a`) VIRTUAL NOT NULL,
  KEY `on_b` (`b`)
) ENGINE=InnoDB DEFAULT CHARSET=utf8mb4 COLLATE=utf8mb4_0900_ai_ci
INSERT IGNORE INTO t (a) VALUES (-1e300);
Warnings:
Warning	1264	Out of range value for column 'b' at row 1
SELECT * FROM t;
a	b
-1e300	-838:59:59
Warnings:
Warning	1292	Incorrect time value: '-1e300' for column 'b' at row 1
DELETE FROM t;
DELETE IGNORE FROM t;
Warnings:
Warning	1292	Incorrect time value: '-1e300' for column 'b' at row 1
Warning	1292	Incorrect time value: '-1e300' for column 'b' at row 1
CHECK TABLE t;
Table	Op	Msg_type	Msg_text
test.t	check	status	OK
DROP TABLE t;
# Testing example of type DOUBLE and value 1e300
SHOW CREATE TABLE t;
Table	Create Table
t	CREATE TABLE `t` (
  `a` double NOT NULL,
  `b` time GENERATED ALWAYS AS (`a`) VIRTUAL NOT NULL,
  KEY `on_b` (`b`)
) ENGINE=InnoDB DEFAULT CHARSET=utf8mb4 COLLATE=utf8mb4_0900_ai_ci
INSERT IGNORE INTO t (a) VALUES (1e300);
Warnings:
Warning	1264	Out of range value for column 'b' at row 1
SELECT * FROM t;
a	b
1e300	838:59:59
Warnings:
Warning	1292	Incorrect time value: '1e300' for column 'b' at row 1
DELETE FROM t;
DELETE IGNORE FROM t;
Warnings:
Warning	1292	Incorrect time value: '1e300' for column 'b' at row 1
Warning	1292	Incorrect time value: '1e300' for column 'b' at row 1
CHECK TABLE t;
Table	Op	Msg_type	Msg_text
test.t	check	status	OK
DROP TABLE t;
# Testing example of type DECIMAL(4,2) and value -10.99
SHOW CREATE TABLE t;
Table	Create Table
t	CREATE TABLE `t` (
  `a` decimal(4,2) NOT NULL,
  `b` time GENERATED ALWAYS AS (`a`) VIRTUAL NOT NULL,
  KEY `on_b` (`b`)
) ENGINE=InnoDB DEFAULT CHARSET=utf8mb4 COLLATE=utf8mb4_0900_ai_ci
INSERT IGNORE INTO t (a) VALUES (-10.99);
SELECT * FROM t;
a	b
-10.99	-00:00:11
DELETE FROM t;
DELETE IGNORE FROM t;
CHECK TABLE t;
Table	Op	Msg_type	Msg_text
test.t	check	status	OK
DROP TABLE t;
# Testing example of type DECIMAL(34,4) and value 20000000000000000000000000000.0001
SHOW CREATE TABLE t;
Table	Create Table
t	CREATE TABLE `t` (
  `a` decimal(34,4) NOT NULL,
  `b` time GENERATED ALWAYS AS (`a`) VIRTUAL NOT NULL,
  KEY `on_b` (`b`)
) ENGINE=InnoDB DEFAULT CHARSET=utf8mb4 COLLATE=utf8mb4_0900_ai_ci
INSERT IGNORE INTO t (a) VALUES (20000000000000000000000000000.0001);
Warnings:
Warning	1264	Out of range value for column 'b' at row 1
SELECT * FROM t;
a	b
20000000000000000000000000000.0001	838:59:59
Warnings:
Warning	1292	Incorrect time value: '20000000000000000000000000000.0001' for column 'b' at row 1
DELETE FROM t;
DELETE IGNORE FROM t;
Warnings:
Warning	1292	Incorrect time value: '20000000000000000000000000000.0001' for column 'b' at row 1
Warning	1292	Incorrect time value: '20000000000000000000000000000.0001' for column 'b' at row 1
CHECK TABLE t;
Table	Op	Msg_type	Msg_text
test.t	check	status	OK
DROP TABLE t;
# Testing example of type DECIMAL(34,4) and value -20000000000000000000000000000.0001
SHOW CREATE TABLE t;
Table	Create Table
t	CREATE TABLE `t` (
  `a` decimal(34,4) NOT NULL,
  `b` time GENERATED ALWAYS AS (`a`) VIRTUAL NOT NULL,
  KEY `on_b` (`b`)
) ENGINE=InnoDB DEFAULT CHARSET=utf8mb4 COLLATE=utf8mb4_0900_ai_ci
INSERT IGNORE INTO t (a) VALUES (-20000000000000000000000000000.0001);
Warnings:
Warning	1264	Out of range value for column 'b' at row 1
SELECT * FROM t;
a	b
-20000000000000000000000000000.0001	-838:59:59
Warnings:
Warning	1292	Incorrect time value: '-20000000000000000000000000000.0001' for column 'b' at row 1
DELETE FROM t;
DELETE IGNORE FROM t;
Warnings:
Warning	1292	Incorrect time value: '-20000000000000000000000000000.0001' for column 'b' at row 1
Warning	1292	Incorrect time value: '-20000000000000000000000000000.0001' for column 'b' at row 1
CHECK TABLE t;
Table	Op	Msg_type	Msg_text
test.t	check	status	OK
DROP TABLE t;
# Testing example of type BIT(64) and value 0xDEADBEEFC0FEBABE
SHOW CREATE TABLE t;
Table	Create Table
t	CREATE TABLE `t` (
  `a` bit(64) NOT NULL,
  `b` time GENERATED ALWAYS AS (`a`) VIRTUAL NOT NULL,
  KEY `on_b` (`b`)
) ENGINE=InnoDB DEFAULT CHARSET=utf8mb4 COLLATE=utf8mb4_0900_ai_ci
INSERT IGNORE INTO t (a) VALUES (0xDEADBEEFC0FEBABE);
Warnings:
Warning	1264	Out of range value for column 'b' at row 1
SELECT * FROM t;
a	b
Þ­¾ïÀþº¾	838:59:59
Warnings:
Warning	1292	Incorrect time value: '16045690984335325886' for column 'b' at row 1
DELETE FROM t;
DELETE IGNORE FROM t;
Warnings:
Warning	1292	Incorrect time value: '16045690984335325886' for column 'b' at row 1
Warning	1292	Incorrect time value: '16045690984335325886' for column 'b' at row 1
CHECK TABLE t;
Table	Op	Msg_type	Msg_text
test.t	check	status	OK
DROP TABLE t;
# Testing example of type BIT(4) and value 0b1000
SHOW CREATE TABLE t;
Table	Create Table
t	CREATE TABLE `t` (
  `a` bit(4) NOT NULL,
  `b` time GENERATED ALWAYS AS (`a`) VIRTUAL NOT NULL,
  KEY `on_b` (`b`)
) ENGINE=InnoDB DEFAULT CHARSET=utf8mb4 COLLATE=utf8mb4_0900_ai_ci
INSERT IGNORE INTO t (a) VALUES (0b1000);
SELECT * FROM t;
a	b
	00:00:08
DELETE FROM t;
DELETE IGNORE FROM t;
CHECK TABLE t;
Table	Op	Msg_type	Msg_text
test.t	check	status	OK
DROP TABLE t;
# Testing example of type YEAR and value 2020
SHOW CREATE TABLE t;
Table	Create Table
t	CREATE TABLE `t` (
  `a` year NOT NULL,
  `b` time GENERATED ALWAYS AS (`a`) VIRTUAL NOT NULL,
  KEY `on_b` (`b`)
) ENGINE=InnoDB DEFAULT CHARSET=utf8mb4 COLLATE=utf8mb4_0900_ai_ci
INSERT IGNORE INTO t (a) VALUES (2020);
SELECT * FROM t;
a	b
2020	00:20:20
DELETE FROM t;
DELETE IGNORE FROM t;
CHECK TABLE t;
Table	Op	Msg_type	Msg_text
test.t	check	status	OK
DROP TABLE t;
# Testing example of type DATE and value "2030-04-05"
SHOW CREATE TABLE t;
Table	Create Table
t	CREATE TABLE `t` (
  `a` date NOT NULL,
  `b` time GENERATED ALWAYS AS (`a`) VIRTUAL NOT NULL,
  KEY `on_b` (`b`)
) ENGINE=InnoDB DEFAULT CHARSET=utf8mb4 COLLATE=utf8mb4_0900_ai_ci
INSERT IGNORE INTO t (a) VALUES ("2030-04-05");
SELECT * FROM t;
a	b
2030-04-05	00:00:00
DELETE FROM t;
DELETE IGNORE FROM t;
CHECK TABLE t;
Table	Op	Msg_type	Msg_text
test.t	check	status	OK
DROP TABLE t;
# Testing example of type TIME and value "11:12:13"
SHOW CREATE TABLE t;
Table	Create Table
t	CREATE TABLE `t` (
  `a` time NOT NULL,
  `b` time GENERATED ALWAYS AS (`a`) VIRTUAL NOT NULL,
  KEY `on_b` (`b`)
) ENGINE=InnoDB DEFAULT CHARSET=utf8mb4 COLLATE=utf8mb4_0900_ai_ci
INSERT IGNORE INTO t (a) VALUES ("11:12:13");
SELECT * FROM t;
a	b
11:12:13	11:12:13
DELETE FROM t;
DELETE IGNORE FROM t;
CHECK TABLE t;
Table	Op	Msg_type	Msg_text
test.t	check	status	OK
DROP TABLE t;
# Testing example of type DATETIME and value "2030-04-05 11:12:13"
SHOW CREATE TABLE t;
Table	Create Table
t	CREATE TABLE `t` (
  `a` datetime NOT NULL,
  `b` time GENERATED ALWAYS AS (`a`) VIRTUAL NOT NULL,
  KEY `on_b` (`b`)
) ENGINE=InnoDB DEFAULT CHARSET=utf8mb4 COLLATE=utf8mb4_0900_ai_ci
INSERT IGNORE INTO t (a) VALUES ("2030-04-05 11:12:13");
SELECT * FROM t;
a	b
2030-04-05 11:12:13	11:12:13
DELETE FROM t;
DELETE IGNORE FROM t;
CHECK TABLE t;
Table	Op	Msg_type	Msg_text
test.t	check	status	OK
DROP TABLE t;
# Testing example of type TIMESTAMP and value "2030-04-05 11:12:13"
SHOW CREATE TABLE t;
Table	Create Table
t	CREATE TABLE `t` (
  `a` timestamp NOT NULL,
  `b` time GENERATED ALWAYS AS (`a`) VIRTUAL NOT NULL,
  KEY `on_b` (`b`)
) ENGINE=InnoDB DEFAULT CHARSET=utf8mb4 COLLATE=utf8mb4_0900_ai_ci
INSERT IGNORE INTO t (a) VALUES ("2030-04-05 11:12:13");
SELECT * FROM t;
a	b
2030-04-05 11:12:13	11:12:13
DELETE FROM t;
DELETE IGNORE FROM t;
CHECK TABLE t;
Table	Op	Msg_type	Msg_text
test.t	check	status	OK
DROP TABLE t;
# Testing example of type CHAR(40) and value "2000000000000000000000000000000000000"
SHOW CREATE TABLE t;
Table	Create Table
t	CREATE TABLE `t` (
  `a` char(40) NOT NULL,
  `b` time GENERATED ALWAYS AS (`a`) VIRTUAL NOT NULL,
  KEY `on_b` (`b`)
) ENGINE=InnoDB DEFAULT CHARSET=utf8mb4 COLLATE=utf8mb4_0900_ai_ci
INSERT IGNORE INTO t (a) VALUES ("2000000000000000000000000000000000000");
Warnings:
Warning	1265	Data truncated for column 'b' at row 1
SELECT * FROM t;
a	b
2000000000000000000000000000000000000	00:00:00
Warnings:
Warning	1292	Incorrect time value: '2000000000000000000000000000000000000' for column 'b' at row 1
DELETE FROM t;
DELETE IGNORE FROM t;
Warnings:
Warning	1292	Incorrect time value: '2000000000000000000000000000000000000' for column 'b' at row 1
Warning	1292	Incorrect time value: '2000000000000000000000000000000000000' for column 'b' at row 1
CHECK TABLE t;
Table	Op	Msg_type	Msg_text
test.t	check	status	OK
DROP TABLE t;
# Testing example of type BINARY(45) and value "200000000000000000000000000000000000000000"
SHOW CREATE TABLE t;
Table	Create Table
t	CREATE TABLE `t` (
  `a` binary(45) NOT NULL,
  `b` time GENERATED ALWAYS AS (`a`) VIRTUAL NOT NULL,
  KEY `on_b` (`b`)
) ENGINE=InnoDB DEFAULT CHARSET=utf8mb4 COLLATE=utf8mb4_0900_ai_ci
INSERT IGNORE INTO t (a) VALUES ("200000000000000000000000000000000000000000");
SELECT * FROM t;
a	b
200000000000000000000000000000000000000000   	00:00:00
DELETE FROM t;
DELETE IGNORE FROM t;
CHECK TABLE t;
Table	Op	Msg_type	Msg_text
test.t	check	status	OK
DROP TABLE t;
# Testing example of type VARCHAR(50) and value "2000000000000000000000000000000000000000000000000"
SHOW CREATE TABLE t;
Table	Create Table
t	CREATE TABLE `t` (
  `a` varchar(50) NOT NULL,
  `b` time GENERATED ALWAYS AS (`a`) VIRTUAL NOT NULL,
  KEY `on_b` (`b`)
) ENGINE=InnoDB DEFAULT CHARSET=utf8mb4 COLLATE=utf8mb4_0900_ai_ci
INSERT IGNORE INTO t (a) VALUES ("2000000000000000000000000000000000000000000000000");
Warnings:
Warning	1265	Data truncated for column 'b' at row 1
SELECT * FROM t;
a	b
2000000000000000000000000000000000000000000000000	00:00:00
Warnings:
Warning	1292	Incorrect time value: '2000000000000000000000000000000000000000000000000' for column 'b' at row 1
DELETE FROM t;
DELETE IGNORE FROM t;
Warnings:
Warning	1292	Incorrect time value: '2000000000000000000000000000000000000000000000000' for column 'b' at row 1
Warning	1292	Incorrect time value: '2000000000000000000000000000000000000000000000000' for column 'b' at row 1
CHECK TABLE t;
Table	Op	Msg_type	Msg_text
test.t	check	status	OK
DROP TABLE t;
# Testing example of type CHAR(24) and value "hello beautiful world"
SHOW CREATE TABLE t;
Table	Create Table
t	CREATE TABLE `t` (
  `a` char(24) NOT NULL,
  `b` time GENERATED ALWAYS AS (`a`) VIRTUAL NOT NULL,
  KEY `on_b` (`b`)
) ENGINE=InnoDB DEFAULT CHARSET=utf8mb4 COLLATE=utf8mb4_0900_ai_ci
INSERT IGNORE INTO t (a) VALUES ("hello beautiful world");
Warnings:
Warning	1265	Data truncated for column 'b' at row 1
SELECT * FROM t;
a	b
hello beautiful world	00:00:00
Warnings:
Warning	1292	Incorrect time value: 'hello beautiful world' for column 'b' at row 1
DELETE FROM t;
DELETE IGNORE FROM t;
Warnings:
Warning	1292	Incorrect time value: 'hello beautiful world' for column 'b' at row 1
Warning	1292	Incorrect time value: 'hello beautiful world' for column 'b' at row 1
CHECK TABLE t;
Table	Op	Msg_type	Msg_text
test.t	check	status	OK
DROP TABLE t;
# Testing example of type BINARY(12) and value "hello world"
SHOW CREATE TABLE t;
Table	Create Table
t	CREATE TABLE `t` (
  `a` binary(12) NOT NULL,
  `b` time GENERATED ALWAYS AS (`a`) VIRTUAL NOT NULL,
  KEY `on_b` (`b`)
) ENGINE=InnoDB DEFAULT CHARSET=utf8mb4 COLLATE=utf8mb4_0900_ai_ci
INSERT IGNORE INTO t (a) VALUES ("hello world");
Warnings:
Warning	1265	Data truncated for column 'b' at row 1
SELECT * FROM t;
a	b
hello world 	00:00:00
Warnings:
Warning	1292	Incorrect time value: 'hello world\x00' for column 'b' at row 1
DELETE FROM t;
DELETE IGNORE FROM t;
Warnings:
Warning	1292	Incorrect time value: 'hello world\x00' for column 'b' at row 1
Warning	1292	Incorrect time value: 'hello world\x00' for column 'b' at row 1
CHECK TABLE t;
Table	Op	Msg_type	Msg_text
test.t	check	status	OK
DROP TABLE t;
# Testing example of type VARCHAR(6) and value "hello"
SHOW CREATE TABLE t;
Table	Create Table
t	CREATE TABLE `t` (
  `a` varchar(6) NOT NULL,
  `b` time GENERATED ALWAYS AS (`a`) VIRTUAL NOT NULL,
  KEY `on_b` (`b`)
) ENGINE=InnoDB DEFAULT CHARSET=utf8mb4 COLLATE=utf8mb4_0900_ai_ci
INSERT IGNORE INTO t (a) VALUES ("hello");
Warnings:
Warning	1265	Data truncated for column 'b' at row 1
SELECT * FROM t;
a	b
hello	00:00:00
Warnings:
Warning	1292	Incorrect time value: 'hello' for column 'b' at row 1
DELETE FROM t;
DELETE IGNORE FROM t;
Warnings:
Warning	1292	Incorrect time value: 'hello' for column 'b' at row 1
Warning	1292	Incorrect time value: 'hello' for column 'b' at row 1
CHECK TABLE t;
Table	Op	Msg_type	Msg_text
test.t	check	status	OK
DROP TABLE t;
# Testing example of type ENUM("up","down") and value "up"
SHOW CREATE TABLE t;
Table	Create Table
t	CREATE TABLE `t` (
  `a` enum('up','down') NOT NULL,
  `b` time GENERATED ALWAYS AS (`a`) VIRTUAL NOT NULL,
  KEY `on_b` (`b`)
) ENGINE=InnoDB DEFAULT CHARSET=utf8mb4 COLLATE=utf8mb4_0900_ai_ci
INSERT IGNORE INTO t (a) VALUES ("up");
Warnings:
Warning	1265	Data truncated for column 'b' at row 1
SELECT * FROM t;
a	b
up	00:00:00
Warnings:
Warning	1292	Incorrect time value: 'up' for column 'b' at row 1
DELETE FROM t;
DELETE IGNORE FROM t;
Warnings:
Warning	1292	Incorrect time value: 'up' for column 'b' at row 1
Warning	1292	Incorrect time value: 'up' for column 'b' at row 1
CHECK TABLE t;
Table	Op	Msg_type	Msg_text
test.t	check	status	OK
DROP TABLE t;
# Testing example of type SET("up","down") and value "up,down"
SHOW CREATE TABLE t;
Table	Create Table
t	CREATE TABLE `t` (
  `a` set('up','down') NOT NULL,
  `b` time GENERATED ALWAYS AS (`a`) VIRTUAL NOT NULL,
  KEY `on_b` (`b`)
) ENGINE=InnoDB DEFAULT CHARSET=utf8mb4 COLLATE=utf8mb4_0900_ai_ci
INSERT IGNORE INTO t (a) VALUES ("up,down");
Warnings:
Warning	1265	Data truncated for column 'b' at row 1
SELECT * FROM t;
a	b
up,down	00:00:00
Warnings:
Warning	1292	Incorrect time value: 'up,down' for column 'b' at row 1
DELETE FROM t;
DELETE IGNORE FROM t;
Warnings:
Warning	1292	Incorrect time value: 'up,down' for column 'b' at row 1
Warning	1292	Incorrect time value: 'up,down' for column 'b' at row 1
CHECK TABLE t;
Table	Op	Msg_type	Msg_text
test.t	check	status	OK
DROP TABLE t;
# Testing example of type GEOMETRY and value ST_GeomFromText("POINT(1 1)")
SHOW CREATE TABLE t;
Table	Create Table
t	CREATE TABLE `t` (
  `a` geometry NOT NULL,
  `b` time GENERATED ALWAYS AS (`a`) VIRTUAL NOT NULL,
  KEY `on_b` (`b`)
) ENGINE=InnoDB DEFAULT CHARSET=utf8mb4 COLLATE=utf8mb4_0900_ai_ci
INSERT IGNORE INTO t (a) VALUES (ST_GeomFromText("POINT(1 1)"));
Warnings:
Warning	1265	Data truncated for column 'b' at row 1
SELECT * FROM t;
a	b
             ð?      ð?	00:00:00
Warnings:
Warning	1292	Incorrect time value: '\x00\x00\x00\x00\x01\x01\x00\x00\x00\x00\x00\x00\x00\x00\x00\xF0?\x00\x00\x00\x00\x00\x00\xF0?' for column 'b' at row 1
DELETE FROM t;
DELETE IGNORE FROM t;
Warnings:
Warning	1292	Incorrect time value: '\x00\x00\x00\x00\x01\x01\x00\x00\x00\x00\x00\x00\x00\x00\x00\xF0?\x00\x00\x00\x00\x00\x00\xF0?' for column 'b' at row 1
Warning	1292	Incorrect time value: '\x00\x00\x00\x00\x01\x01\x00\x00\x00\x00\x00\x00\x00\x00\x00\xF0?\x00\x00\x00\x00\x00\x00\xF0?' for column 'b' at row 1
CHECK TABLE t;
Table	Op	Msg_type	Msg_text
test.t	check	status	OK
DROP TABLE t;
# Testing example of type POINT and value ST_GeomFromText("POINT(1 1)")
SHOW CREATE TABLE t;
Table	Create Table
t	CREATE TABLE `t` (
  `a` point NOT NULL,
  `b` time GENERATED ALWAYS AS (`a`) VIRTUAL NOT NULL,
  KEY `on_b` (`b`)
) ENGINE=InnoDB DEFAULT CHARSET=utf8mb4 COLLATE=utf8mb4_0900_ai_ci
INSERT IGNORE INTO t (a) VALUES (ST_GeomFromText("POINT(1 1)"));
Warnings:
Warning	1265	Data truncated for column 'b' at row 1
SELECT * FROM t;
a	b
             ð?      ð?	00:00:00
Warnings:
Warning	1292	Incorrect time value: '\x00\x00\x00\x00\x01\x01\x00\x00\x00\x00\x00\x00\x00\x00\x00\xF0?\x00\x00\x00\x00\x00\x00\xF0?' for column 'b' at row 1
DELETE FROM t;
DELETE IGNORE FROM t;
Warnings:
Warning	1292	Incorrect time value: '\x00\x00\x00\x00\x01\x01\x00\x00\x00\x00\x00\x00\x00\x00\x00\xF0?\x00\x00\x00\x00\x00\x00\xF0?' for column 'b' at row 1
Warning	1292	Incorrect time value: '\x00\x00\x00\x00\x01\x01\x00\x00\x00\x00\x00\x00\x00\x00\x00\xF0?\x00\x00\x00\x00\x00\x00\xF0?' for column 'b' at row 1
CHECK TABLE t;
Table	Op	Msg_type	Msg_text
test.t	check	status	OK
DROP TABLE t;
# Testing example of type LINESTRING and value ST_GeomFromText("LINESTRING(0 0,1 1,2 2)")
SHOW CREATE TABLE t;
Table	Create Table
t	CREATE TABLE `t` (
  `a` linestring NOT NULL,
  `b` time GENERATED ALWAYS AS (`a`) VIRTUAL NOT NULL,
  KEY `on_b` (`b`)
) ENGINE=InnoDB DEFAULT CHARSET=utf8mb4 COLLATE=utf8mb4_0900_ai_ci
INSERT IGNORE INTO t (a) VALUES (ST_GeomFromText("LINESTRING(0 0,1 1,2 2)"));
Warnings:
Warning	1265	Data truncated for column 'b' at row 1
SELECT * FROM t;
a	b
                                ð?      ð?       @       @	00:00:00
Warnings:
Warning	1292	Incorrect time value: '\x00\x00\x00\x00\x01\x02\x00\x00\x00\x03\x00\x00\x00\x00\x00\x00\x00\x00\x00\x00\x00\x00\x00\x00\x00\x00\x00\x00\x00\x00\x00\x00' for column 'b' at row 1
DELETE FROM t;
DELETE IGNORE FROM t;
Warnings:
Warning	1292	Incorrect time value: '\x00\x00\x00\x00\x01\x02\x00\x00\x00\x03\x00\x00\x00\x00\x00\x00\x00\x00\x00\x00\x00\x00\x00\x00\x00\x00\x00\x00\x00\x00\x00\x00' for column 'b' at row 1
Warning	1292	Incorrect time value: '\x00\x00\x00\x00\x01\x02\x00\x00\x00\x03\x00\x00\x00\x00\x00\x00\x00\x00\x00\x00\x00\x00\x00\x00\x00\x00\x00\x00\x00\x00\x00\x00' for column 'b' at row 1
CHECK TABLE t;
Table	Op	Msg_type	Msg_text
test.t	check	status	OK
DROP TABLE t;
# Testing example of type POLYGON and value ST_GeomFromText("POLYGON((0 0,1 0,1 1,0 1,0 0),(5 5,7 5,7 7,5 7,5 5))")
SHOW CREATE TABLE t;
Table	Create Table
t	CREATE TABLE `t` (
  `a` polygon NOT NULL,
  `b` time GENERATED ALWAYS AS (`a`) VIRTUAL NOT NULL,
  KEY `on_b` (`b`)
) ENGINE=InnoDB DEFAULT CHARSET=utf8mb4 COLLATE=utf8mb4_0900_ai_ci
INSERT IGNORE INTO t (a) VALUES (ST_GeomFromText("POLYGON((0 0,1 0,1 1,0 1,0 0),(5 5,7 5,7 7,5 7,5 5))"));
Warnings:
Warning	1265	Data truncated for column 'b' at row 1
SELECT * FROM t;
a	b
                                   ð?              ð?      ð?              ð?                         @      @      @      @      @      @      @      @      @      @	00:00:00
Warnings:
Warning	1292	Incorrect time value: '\x00\x00\x00\x00\x01\x03\x00\x00\x00\x02\x00\x00\x00\x05\x00\x00\x00\x00\x00\x00\x00\x00\x00\x00\x00\x00\x00\x00\x00\x00\x00\x00' for column 'b' at row 1
DELETE FROM t;
DELETE IGNORE FROM t;
Warnings:
Warning	1292	Incorrect time value: '\x00\x00\x00\x00\x01\x03\x00\x00\x00\x02\x00\x00\x00\x05\x00\x00\x00\x00\x00\x00\x00\x00\x00\x00\x00\x00\x00\x00\x00\x00\x00\x00' for column 'b' at row 1
Warning	1292	Incorrect time value: '\x00\x00\x00\x00\x01\x03\x00\x00\x00\x02\x00\x00\x00\x05\x00\x00\x00\x00\x00\x00\x00\x00\x00\x00\x00\x00\x00\x00\x00\x00\x00\x00' for column 'b' at row 1
CHECK TABLE t;
Table	Op	Msg_type	Msg_text
test.t	check	status	OK
DROP TABLE t;
#
# Testing virtual column of type DATETIME
#
# Testing example of type JSON and value "{}"
SHOW CREATE TABLE t;
Table	Create Table
t	CREATE TABLE `t` (
  `a` json NOT NULL,
  `b` datetime GENERATED ALWAYS AS (`a`) VIRTUAL NOT NULL,
  KEY `on_b` (`b`)
) ENGINE=InnoDB DEFAULT CHARSET=utf8mb4 COLLATE=utf8mb4_0900_ai_ci
INSERT IGNORE INTO t (a) VALUES ("{}");
Warnings:
Warning	3156	Invalid JSON value for CAST to DATE/TIME/DATETIME/TIMESTAMP from column a at row 1
Warning	1264	Out of range value for column 'b' at row 1
SELECT * FROM t;
a	b
{}	0000-00-00 00:00:00
Warnings:
Warning	3156	Invalid JSON value for CAST to DATE/TIME/DATETIME/TIMESTAMP from column a at row 1
Warning	1292	Incorrect datetime value: '0000-00-00 00:00:00' for column 'b' at row 1
DELETE FROM t;
DELETE IGNORE FROM t;
Warnings:
Warning	3156	Invalid JSON value for CAST to DATE/TIME/DATETIME/TIMESTAMP from column a at row 1
Warning	1292	Incorrect datetime value: '0000-00-00 00:00:00' for column 'b' at row 1
Warning	3156	Invalid JSON value for CAST to DATE/TIME/DATETIME/TIMESTAMP from column a at row 1
Warning	1292	Incorrect datetime value: '0000-00-00 00:00:00' for column 'b' at row 1
CHECK TABLE t;
Table	Op	Msg_type	Msg_text
test.t	check	status	OK
DROP TABLE t;
# Testing example of type JSON and value '["hello beautiful world"]'
SHOW CREATE TABLE t;
Table	Create Table
t	CREATE TABLE `t` (
  `a` json NOT NULL,
  `b` datetime GENERATED ALWAYS AS (`a`) VIRTUAL NOT NULL,
  KEY `on_b` (`b`)
) ENGINE=InnoDB DEFAULT CHARSET=utf8mb4 COLLATE=utf8mb4_0900_ai_ci
INSERT IGNORE INTO t (a) VALUES ('["hello beautiful world"]');
Warnings:
Warning	3156	Invalid JSON value for CAST to DATE/TIME/DATETIME/TIMESTAMP from column a at row 1
Warning	1264	Out of range value for column 'b' at row 1
SELECT * FROM t;
a	b
["hello beautiful world"]	0000-00-00 00:00:00
Warnings:
Warning	3156	Invalid JSON value for CAST to DATE/TIME/DATETIME/TIMESTAMP from column a at row 1
Warning	1292	Incorrect datetime value: '0000-00-00 00:00:00' for column 'b' at row 1
DELETE FROM t;
DELETE IGNORE FROM t;
Warnings:
Warning	3156	Invalid JSON value for CAST to DATE/TIME/DATETIME/TIMESTAMP from column a at row 1
Warning	1292	Incorrect datetime value: '0000-00-00 00:00:00' for column 'b' at row 1
Warning	3156	Invalid JSON value for CAST to DATE/TIME/DATETIME/TIMESTAMP from column a at row 1
Warning	1292	Incorrect datetime value: '0000-00-00 00:00:00' for column 'b' at row 1
CHECK TABLE t;
Table	Op	Msg_type	Msg_text
test.t	check	status	OK
DROP TABLE t;
# Testing example of type JSON and value "-1"
SHOW CREATE TABLE t;
Table	Create Table
t	CREATE TABLE `t` (
  `a` json NOT NULL,
  `b` datetime GENERATED ALWAYS AS (`a`) VIRTUAL NOT NULL,
  KEY `on_b` (`b`)
) ENGINE=InnoDB DEFAULT CHARSET=utf8mb4 COLLATE=utf8mb4_0900_ai_ci
INSERT IGNORE INTO t (a) VALUES ("-1");
Warnings:
Warning	3156	Invalid JSON value for CAST to DATE/TIME/DATETIME/TIMESTAMP from column a at row 1
Warning	1264	Out of range value for column 'b' at row 1
SELECT * FROM t;
a	b
-1	0000-00-00 00:00:00
Warnings:
Warning	3156	Invalid JSON value for CAST to DATE/TIME/DATETIME/TIMESTAMP from column a at row 1
Warning	1292	Incorrect datetime value: '0000-00-00 00:00:00' for column 'b' at row 1
DELETE FROM t;
DELETE IGNORE FROM t;
Warnings:
Warning	3156	Invalid JSON value for CAST to DATE/TIME/DATETIME/TIMESTAMP from column a at row 1
Warning	1292	Incorrect datetime value: '0000-00-00 00:00:00' for column 'b' at row 1
Warning	3156	Invalid JSON value for CAST to DATE/TIME/DATETIME/TIMESTAMP from column a at row 1
Warning	1292	Incorrect datetime value: '0000-00-00 00:00:00' for column 'b' at row 1
CHECK TABLE t;
Table	Op	Msg_type	Msg_text
test.t	check	status	OK
DROP TABLE t;
# Testing example of type TINYINT and value -1
SHOW CREATE TABLE t;
Table	Create Table
t	CREATE TABLE `t` (
  `a` tinyint NOT NULL,
  `b` datetime GENERATED ALWAYS AS (`a`) VIRTUAL NOT NULL,
  KEY `on_b` (`b`)
) ENGINE=InnoDB DEFAULT CHARSET=utf8mb4 COLLATE=utf8mb4_0900_ai_ci
INSERT IGNORE INTO t (a) VALUES (-1);
Warnings:
Warning	1264	Out of range value for column 'b' at row 1
SELECT * FROM t;
a	b
-1	0000-00-00 00:00:00
Warnings:
Warning	1292	Incorrect datetime value: '-1' for column 'b' at row 1
DELETE FROM t;
DELETE IGNORE FROM t;
Warnings:
Warning	1292	Incorrect datetime value: '-1' for column 'b' at row 1
Warning	1292	Incorrect datetime value: '-1' for column 'b' at row 1
CHECK TABLE t;
Table	Op	Msg_type	Msg_text
test.t	check	status	OK
DROP TABLE t;
# Testing example of type SMALLINT and value -1
SHOW CREATE TABLE t;
Table	Create Table
t	CREATE TABLE `t` (
  `a` smallint NOT NULL,
  `b` datetime GENERATED ALWAYS AS (`a`) VIRTUAL NOT NULL,
  KEY `on_b` (`b`)
) ENGINE=InnoDB DEFAULT CHARSET=utf8mb4 COLLATE=utf8mb4_0900_ai_ci
INSERT IGNORE INTO t (a) VALUES (-1);
Warnings:
Warning	1264	Out of range value for column 'b' at row 1
SELECT * FROM t;
a	b
-1	0000-00-00 00:00:00
Warnings:
Warning	1292	Incorrect datetime value: '-1' for column 'b' at row 1
DELETE FROM t;
DELETE IGNORE FROM t;
Warnings:
Warning	1292	Incorrect datetime value: '-1' for column 'b' at row 1
Warning	1292	Incorrect datetime value: '-1' for column 'b' at row 1
CHECK TABLE t;
Table	Op	Msg_type	Msg_text
test.t	check	status	OK
DROP TABLE t;
# Testing example of type MEDIUMINT and value -1
SHOW CREATE TABLE t;
Table	Create Table
t	CREATE TABLE `t` (
  `a` mediumint NOT NULL,
  `b` datetime GENERATED ALWAYS AS (`a`) VIRTUAL NOT NULL,
  KEY `on_b` (`b`)
) ENGINE=InnoDB DEFAULT CHARSET=utf8mb4 COLLATE=utf8mb4_0900_ai_ci
INSERT IGNORE INTO t (a) VALUES (-1);
Warnings:
Warning	1264	Out of range value for column 'b' at row 1
SELECT * FROM t;
a	b
-1	0000-00-00 00:00:00
Warnings:
Warning	1292	Incorrect datetime value: '-1' for column 'b' at row 1
DELETE FROM t;
DELETE IGNORE FROM t;
Warnings:
Warning	1292	Incorrect datetime value: '-1' for column 'b' at row 1
Warning	1292	Incorrect datetime value: '-1' for column 'b' at row 1
CHECK TABLE t;
Table	Op	Msg_type	Msg_text
test.t	check	status	OK
DROP TABLE t;
# Testing example of type INT and value 2000000000
SHOW CREATE TABLE t;
Table	Create Table
t	CREATE TABLE `t` (
  `a` int NOT NULL,
  `b` datetime GENERATED ALWAYS AS (`a`) VIRTUAL NOT NULL,
  KEY `on_b` (`b`)
) ENGINE=InnoDB DEFAULT CHARSET=utf8mb4 COLLATE=utf8mb4_0900_ai_ci
INSERT IGNORE INTO t (a) VALUES (2000000000);
Warnings:
Warning	1265	Data truncated for column 'b' at row 1
SELECT * FROM t;
a	b
2000000000	0000-00-00 00:00:00
Warnings:
Warning	1292	Incorrect datetime value: '2000000000' for column 'b' at row 1
DELETE FROM t;
DELETE IGNORE FROM t;
Warnings:
Warning	1292	Incorrect datetime value: '2000000000' for column 'b' at row 1
Warning	1292	Incorrect datetime value: '2000000000' for column 'b' at row 1
CHECK TABLE t;
Table	Op	Msg_type	Msg_text
test.t	check	status	OK
DROP TABLE t;
# Testing example of type INT and value -2000000000
SHOW CREATE TABLE t;
Table	Create Table
t	CREATE TABLE `t` (
  `a` int NOT NULL,
  `b` datetime GENERATED ALWAYS AS (`a`) VIRTUAL NOT NULL,
  KEY `on_b` (`b`)
) ENGINE=InnoDB DEFAULT CHARSET=utf8mb4 COLLATE=utf8mb4_0900_ai_ci
INSERT IGNORE INTO t (a) VALUES (-2000000000);
Warnings:
Warning	1264	Out of range value for column 'b' at row 1
SELECT * FROM t;
a	b
-2000000000	0000-00-00 00:00:00
Warnings:
Warning	1292	Incorrect datetime value: '-2000000000' for column 'b' at row 1
DELETE FROM t;
DELETE IGNORE FROM t;
Warnings:
Warning	1292	Incorrect datetime value: '-2000000000' for column 'b' at row 1
Warning	1292	Incorrect datetime value: '-2000000000' for column 'b' at row 1
CHECK TABLE t;
Table	Op	Msg_type	Msg_text
test.t	check	status	OK
DROP TABLE t;
# Testing example of type INT UNSIGNED and value 4000000000
SHOW CREATE TABLE t;
Table	Create Table
t	CREATE TABLE `t` (
  `a` int unsigned NOT NULL,
  `b` datetime GENERATED ALWAYS AS (`a`) VIRTUAL NOT NULL,
  KEY `on_b` (`b`)
) ENGINE=InnoDB DEFAULT CHARSET=utf8mb4 COLLATE=utf8mb4_0900_ai_ci
INSERT IGNORE INTO t (a) VALUES (4000000000);
Warnings:
Warning	1265	Data truncated for column 'b' at row 1
SELECT * FROM t;
a	b
4000000000	0000-00-00 00:00:00
Warnings:
Warning	1292	Incorrect datetime value: '4000000000' for column 'b' at row 1
DELETE FROM t;
DELETE IGNORE FROM t;
Warnings:
Warning	1292	Incorrect datetime value: '4000000000' for column 'b' at row 1
Warning	1292	Incorrect datetime value: '4000000000' for column 'b' at row 1
CHECK TABLE t;
Table	Op	Msg_type	Msg_text
test.t	check	status	OK
DROP TABLE t;
# Testing example of type BIGINT and value 2000000000000000000
SHOW CREATE TABLE t;
Table	Create Table
t	CREATE TABLE `t` (
  `a` bigint NOT NULL,
  `b` datetime GENERATED ALWAYS AS (`a`) VIRTUAL NOT NULL,
  KEY `on_b` (`b`)
) ENGINE=InnoDB DEFAULT CHARSET=utf8mb4 COLLATE=utf8mb4_0900_ai_ci
INSERT IGNORE INTO t (a) VALUES (2000000000000000000);
Warnings:
Warning	1264	Out of range value for column 'b' at row 1
SELECT * FROM t;
a	b
2000000000000000000	0000-00-00 00:00:00
Warnings:
Warning	1292	Incorrect datetime value: '2000000000000000000' for column 'b' at row 1
DELETE FROM t;
DELETE IGNORE FROM t;
Warnings:
Warning	1292	Incorrect datetime value: '2000000000000000000' for column 'b' at row 1
Warning	1292	Incorrect datetime value: '2000000000000000000' for column 'b' at row 1
CHECK TABLE t;
Table	Op	Msg_type	Msg_text
test.t	check	status	OK
DROP TABLE t;
# Testing example of type BIGINT and value -2000000000000000000
SHOW CREATE TABLE t;
Table	Create Table
t	CREATE TABLE `t` (
  `a` bigint NOT NULL,
  `b` datetime GENERATED ALWAYS AS (`a`) VIRTUAL NOT NULL,
  KEY `on_b` (`b`)
) ENGINE=InnoDB DEFAULT CHARSET=utf8mb4 COLLATE=utf8mb4_0900_ai_ci
INSERT IGNORE INTO t (a) VALUES (-2000000000000000000);
Warnings:
Warning	1264	Out of range value for column 'b' at row 1
SELECT * FROM t;
a	b
-2000000000000000000	0000-00-00 00:00:00
Warnings:
Warning	1292	Incorrect datetime value: '-2000000000000000000' for column 'b' at row 1
DELETE FROM t;
DELETE IGNORE FROM t;
Warnings:
Warning	1292	Incorrect datetime value: '-2000000000000000000' for column 'b' at row 1
Warning	1292	Incorrect datetime value: '-2000000000000000000' for column 'b' at row 1
CHECK TABLE t;
Table	Op	Msg_type	Msg_text
test.t	check	status	OK
DROP TABLE t;
# Testing example of type FLOAT and value -1.23456
SHOW CREATE TABLE t;
Table	Create Table
t	CREATE TABLE `t` (
  `a` float NOT NULL,
  `b` datetime GENERATED ALWAYS AS (`a`) VIRTUAL NOT NULL,
  KEY `on_b` (`b`)
) ENGINE=InnoDB DEFAULT CHARSET=utf8mb4 COLLATE=utf8mb4_0900_ai_ci
INSERT IGNORE INTO t (a) VALUES (-1.23456);
Warnings:
Warning	1264	Out of range value for column 'b' at row 1
SELECT * FROM t;
a	b
-1.23456	0000-00-00 00:00:00
Warnings:
Warning	1292	Incorrect datetime value: '-1.2345600128173828' for column 'b' at row 1
DELETE FROM t;
DELETE IGNORE FROM t;
Warnings:
Warning	1292	Incorrect datetime value: '-1.2345600128173828' for column 'b' at row 1
Warning	1292	Incorrect datetime value: '-1.2345600128173828' for column 'b' at row 1
CHECK TABLE t;
Table	Op	Msg_type	Msg_text
test.t	check	status	OK
DROP TABLE t;
# Testing example of type FLOAT and value -1e38
SHOW CREATE TABLE t;
Table	Create Table
t	CREATE TABLE `t` (
  `a` float NOT NULL,
  `b` datetime GENERATED ALWAYS AS (`a`) VIRTUAL NOT NULL,
  KEY `on_b` (`b`)
) ENGINE=InnoDB DEFAULT CHARSET=utf8mb4 COLLATE=utf8mb4_0900_ai_ci
INSERT IGNORE INTO t (a) VALUES (-1e38);
Warnings:
Warning	1264	Out of range value for column 'b' at row 1
SELECT * FROM t;
a	b
-1e38	0000-00-00 00:00:00
Warnings:
Warning	1292	Incorrect datetime value: '-9.999999680285692e37' for column 'b' at row 1
DELETE FROM t;
DELETE IGNORE FROM t;
Warnings:
Warning	1292	Incorrect datetime value: '-9.999999680285692e37' for column 'b' at row 1
Warning	1292	Incorrect datetime value: '-9.999999680285692e37' for column 'b' at row 1
CHECK TABLE t;
Table	Op	Msg_type	Msg_text
test.t	check	status	OK
DROP TABLE t;
# Testing example of type FLOAT and value 1e38
SHOW CREATE TABLE t;
Table	Create Table
t	CREATE TABLE `t` (
  `a` float NOT NULL,
  `b` datetime GENERATED ALWAYS AS (`a`) VIRTUAL NOT NULL,
  KEY `on_b` (`b`)
) ENGINE=InnoDB DEFAULT CHARSET=utf8mb4 COLLATE=utf8mb4_0900_ai_ci
INSERT IGNORE INTO t (a) VALUES (1e38);
Warnings:
Warning	1264	Out of range value for column 'b' at row 1
SELECT * FROM t;
a	b
1e38	0000-00-00 00:00:00
Warnings:
Warning	1292	Incorrect datetime value: '9.999999680285692e37' for column 'b' at row 1
DELETE FROM t;
DELETE IGNORE FROM t;
Warnings:
Warning	1292	Incorrect datetime value: '9.999999680285692e37' for column 'b' at row 1
Warning	1292	Incorrect datetime value: '9.999999680285692e37' for column 'b' at row 1
CHECK TABLE t;
Table	Op	Msg_type	Msg_text
test.t	check	status	OK
DROP TABLE t;
# Testing example of type DOUBLE and value -1.23456789012345
SHOW CREATE TABLE t;
Table	Create Table
t	CREATE TABLE `t` (
  `a` double NOT NULL,
  `b` datetime GENERATED ALWAYS AS (`a`) VIRTUAL NOT NULL,
  KEY `on_b` (`b`)
) ENGINE=InnoDB DEFAULT CHARSET=utf8mb4 COLLATE=utf8mb4_0900_ai_ci
INSERT IGNORE INTO t (a) VALUES (-1.23456789012345);
Warnings:
Warning	1264	Out of range value for column 'b' at row 1
SELECT * FROM t;
a	b
-1.23456789012345	0000-00-00 00:00:00
Warnings:
Warning	1292	Incorrect datetime value: '-1.23456789012345' for column 'b' at row 1
DELETE FROM t;
DELETE IGNORE FROM t;
Warnings:
Warning	1292	Incorrect datetime value: '-1.23456789012345' for column 'b' at row 1
Warning	1292	Incorrect datetime value: '-1.23456789012345' for column 'b' at row 1
CHECK TABLE t;
Table	Op	Msg_type	Msg_text
test.t	check	status	OK
DROP TABLE t;
# Testing example of type DOUBLE and value 1.23456789012345
SHOW CREATE TABLE t;
Table	Create Table
t	CREATE TABLE `t` (
  `a` double NOT NULL,
  `b` datetime GENERATED ALWAYS AS (`a`) VIRTUAL NOT NULL,
  KEY `on_b` (`b`)
) ENGINE=InnoDB DEFAULT CHARSET=utf8mb4 COLLATE=utf8mb4_0900_ai_ci
INSERT IGNORE INTO t (a) VALUES (1.23456789012345);
Warnings:
Warning	1265	Data truncated for column 'b' at row 1
SELECT * FROM t;
a	b
1.23456789012345	0000-00-00 00:00:00
Warnings:
Warning	1292	Incorrect datetime value: '1.23456789012345' for column 'b' at row 1
DELETE FROM t;
DELETE IGNORE FROM t;
Warnings:
Warning	1292	Incorrect datetime value: '1.23456789012345' for column 'b' at row 1
Warning	1292	Incorrect datetime value: '1.23456789012345' for column 'b' at row 1
CHECK TABLE t;
Table	Op	Msg_type	Msg_text
test.t	check	status	OK
DROP TABLE t;
# Testing example of type DOUBLE and value -1e300
SHOW CREATE TABLE t;
Table	Create Table
t	CREATE TABLE `t` (
  `a` double NOT NULL,
  `b` datetime GENERATED ALWAYS AS (`a`) VIRTUAL NOT NULL,
  KEY `on_b` (`b`)
) ENGINE=InnoDB DEFAULT CHARSET=utf8mb4 COLLATE=utf8mb4_0900_ai_ci
INSERT IGNORE INTO t (a) VALUES (-1e300);
Warnings:
Warning	1264	Out of range value for column 'b' at row 1
SELECT * FROM t;
a	b
-1e300	0000-00-00 00:00:00
Warnings:
Warning	1292	Incorrect datetime value: '-1e300' for column 'b' at row 1
DELETE FROM t;
DELETE IGNORE FROM t;
Warnings:
Warning	1292	Incorrect datetime value: '-1e300' for column 'b' at row 1
Warning	1292	Incorrect datetime value: '-1e300' for column 'b' at row 1
CHECK TABLE t;
Table	Op	Msg_type	Msg_text
test.t	check	status	OK
DROP TABLE t;
# Testing example of type DOUBLE and value 1e300
SHOW CREATE TABLE t;
Table	Create Table
t	CREATE TABLE `t` (
  `a` double NOT NULL,
  `b` datetime GENERATED ALWAYS AS (`a`) VIRTUAL NOT NULL,
  KEY `on_b` (`b`)
) ENGINE=InnoDB DEFAULT CHARSET=utf8mb4 COLLATE=utf8mb4_0900_ai_ci
INSERT IGNORE INTO t (a) VALUES (1e300);
Warnings:
Warning	1264	Out of range value for column 'b' at row 1
SELECT * FROM t;
a	b
1e300	0000-00-00 00:00:00
Warnings:
Warning	1292	Incorrect datetime value: '1e300' for column 'b' at row 1
DELETE FROM t;
DELETE IGNORE FROM t;
Warnings:
Warning	1292	Incorrect datetime value: '1e300' for column 'b' at row 1
Warning	1292	Incorrect datetime value: '1e300' for column 'b' at row 1
CHECK TABLE t;
Table	Op	Msg_type	Msg_text
test.t	check	status	OK
DROP TABLE t;
# Testing example of type DECIMAL(4,2) and value -10.99
SHOW CREATE TABLE t;
Table	Create Table
t	CREATE TABLE `t` (
  `a` decimal(4,2) NOT NULL,
  `b` datetime GENERATED ALWAYS AS (`a`) VIRTUAL NOT NULL,
  KEY `on_b` (`b`)
) ENGINE=InnoDB DEFAULT CHARSET=utf8mb4 COLLATE=utf8mb4_0900_ai_ci
INSERT IGNORE INTO t (a) VALUES (-10.99);
Warnings:
Warning	1264	Out of range value for column 'b' at row 1
SELECT * FROM t;
a	b
-10.99	0000-00-00 00:00:00
Warnings:
Warning	1292	Incorrect datetime value: '-10.99' for column 'b' at row 1
DELETE FROM t;
DELETE IGNORE FROM t;
Warnings:
Warning	1292	Incorrect datetime value: '-10.99' for column 'b' at row 1
Warning	1292	Incorrect datetime value: '-10.99' for column 'b' at row 1
CHECK TABLE t;
Table	Op	Msg_type	Msg_text
test.t	check	status	OK
DROP TABLE t;
# Testing example of type DECIMAL(34,4) and value 20000000000000000000000000000.0001
SHOW CREATE TABLE t;
Table	Create Table
t	CREATE TABLE `t` (
  `a` decimal(34,4) NOT NULL,
  `b` datetime GENERATED ALWAYS AS (`a`) VIRTUAL NOT NULL,
  KEY `on_b` (`b`)
) ENGINE=InnoDB DEFAULT CHARSET=utf8mb4 COLLATE=utf8mb4_0900_ai_ci
INSERT IGNORE INTO t (a) VALUES (20000000000000000000000000000.0001);
Warnings:
Warning	1264	Out of range value for column 'b' at row 1
SELECT * FROM t;
a	b
20000000000000000000000000000.0001	0000-00-00 00:00:00
Warnings:
Warning	1292	Incorrect datetime value: '20000000000000000000000000000.0001' for column 'b' at row 1
DELETE FROM t;
DELETE IGNORE FROM t;
Warnings:
Warning	1292	Incorrect datetime value: '20000000000000000000000000000.0001' for column 'b' at row 1
Warning	1292	Incorrect datetime value: '20000000000000000000000000000.0001' for column 'b' at row 1
CHECK TABLE t;
Table	Op	Msg_type	Msg_text
test.t	check	status	OK
DROP TABLE t;
# Testing example of type DECIMAL(34,4) and value -20000000000000000000000000000.0001
SHOW CREATE TABLE t;
Table	Create Table
t	CREATE TABLE `t` (
  `a` decimal(34,4) NOT NULL,
  `b` datetime GENERATED ALWAYS AS (`a`) VIRTUAL NOT NULL,
  KEY `on_b` (`b`)
) ENGINE=InnoDB DEFAULT CHARSET=utf8mb4 COLLATE=utf8mb4_0900_ai_ci
INSERT IGNORE INTO t (a) VALUES (-20000000000000000000000000000.0001);
Warnings:
Warning	1264	Out of range value for column 'b' at row 1
SELECT * FROM t;
a	b
-20000000000000000000000000000.0001	0000-00-00 00:00:00
Warnings:
Warning	1292	Incorrect datetime value: '-20000000000000000000000000000.0001' for column 'b' at row 1
DELETE FROM t;
DELETE IGNORE FROM t;
Warnings:
Warning	1292	Incorrect datetime value: '-20000000000000000000000000000.0001' for column 'b' at row 1
Warning	1292	Incorrect datetime value: '-20000000000000000000000000000.0001' for column 'b' at row 1
CHECK TABLE t;
Table	Op	Msg_type	Msg_text
test.t	check	status	OK
DROP TABLE t;
# Testing example of type BIT(64) and value 0xDEADBEEFC0FEBABE
SHOW CREATE TABLE t;
Table	Create Table
t	CREATE TABLE `t` (
  `a` bit(64) NOT NULL,
  `b` datetime GENERATED ALWAYS AS (`a`) VIRTUAL NOT NULL,
  KEY `on_b` (`b`)
) ENGINE=InnoDB DEFAULT CHARSET=utf8mb4 COLLATE=utf8mb4_0900_ai_ci
INSERT IGNORE INTO t (a) VALUES (0xDEADBEEFC0FEBABE);
Warnings:
Warning	1264	Out of range value for column 'b' at row 1
SELECT * FROM t;
a	b
Þ­¾ïÀþº¾	0000-00-00 00:00:00
Warnings:
Warning	1292	Incorrect datetime value: '16045690984335325886' for column 'b' at row 1
DELETE FROM t;
DELETE IGNORE FROM t;
Warnings:
Warning	1292	Incorrect datetime value: '16045690984335325886' for column 'b' at row 1
Warning	1292	Incorrect datetime value: '16045690984335325886' for column 'b' at row 1
CHECK TABLE t;
Table	Op	Msg_type	Msg_text
test.t	check	status	OK
DROP TABLE t;
# Testing example of type BIT(4) and value 0b1000
SHOW CREATE TABLE t;
Table	Create Table
t	CREATE TABLE `t` (
  `a` bit(4) NOT NULL,
  `b` datetime GENERATED ALWAYS AS (`a`) VIRTUAL NOT NULL,
  KEY `on_b` (`b`)
) ENGINE=InnoDB DEFAULT CHARSET=utf8mb4 COLLATE=utf8mb4_0900_ai_ci
INSERT IGNORE INTO t (a) VALUES (0b1000);
Warnings:
Warning	1265	Data truncated for column 'b' at row 1
SELECT * FROM t;
a	b
	0000-00-00 00:00:00
Warnings:
Warning	1292	Incorrect datetime value: '8' for column 'b' at row 1
DELETE FROM t;
DELETE IGNORE FROM t;
Warnings:
Warning	1292	Incorrect datetime value: '8' for column 'b' at row 1
Warning	1292	Incorrect datetime value: '8' for column 'b' at row 1
CHECK TABLE t;
Table	Op	Msg_type	Msg_text
test.t	check	status	OK
DROP TABLE t;
# Testing example of type YEAR and value 2020
SHOW CREATE TABLE t;
Table	Create Table
t	CREATE TABLE `t` (
  `a` year NOT NULL,
  `b` datetime GENERATED ALWAYS AS (`a`) VIRTUAL NOT NULL,
  KEY `on_b` (`b`)
) ENGINE=InnoDB DEFAULT CHARSET=utf8mb4 COLLATE=utf8mb4_0900_ai_ci
INSERT IGNORE INTO t (a) VALUES (2020);
Warnings:
Warning	1265	Data truncated for column 'b' at row 1
SELECT * FROM t;
a	b
2020	0000-00-00 00:00:00
Warnings:
Warning	1292	Incorrect datetime value: '2020' for column 'b' at row 1
DELETE FROM t;
DELETE IGNORE FROM t;
Warnings:
Warning	1292	Incorrect datetime value: '2020' for column 'b' at row 1
Warning	1292	Incorrect datetime value: '2020' for column 'b' at row 1
CHECK TABLE t;
Table	Op	Msg_type	Msg_text
test.t	check	status	OK
DROP TABLE t;
# Testing example of type DATE and value "2030-04-05"
SHOW CREATE TABLE t;
Table	Create Table
t	CREATE TABLE `t` (
  `a` date NOT NULL,
  `b` datetime GENERATED ALWAYS AS (`a`) VIRTUAL NOT NULL,
  KEY `on_b` (`b`)
) ENGINE=InnoDB DEFAULT CHARSET=utf8mb4 COLLATE=utf8mb4_0900_ai_ci
INSERT IGNORE INTO t (a) VALUES ("2030-04-05");
SELECT * FROM t;
a	b
2030-04-05	2030-04-05 00:00:00
DELETE FROM t;
DELETE IGNORE FROM t;
CHECK TABLE t;
Table	Op	Msg_type	Msg_text
test.t	check	status	OK
DROP TABLE t;
# Testing example of type TIME and value "11:12:13"
SHOW CREATE TABLE t;
Table	Create Table
t	CREATE TABLE `t` (
  `a` time NOT NULL,
  `b` datetime GENERATED ALWAYS AS (`a`) VIRTUAL NOT NULL,
  KEY `on_b` (`b`)
) ENGINE=InnoDB DEFAULT CHARSET=utf8mb4 COLLATE=utf8mb4_0900_ai_ci
INSERT IGNORE INTO t (a) VALUES ("11:12:13");
SELECT * FROM t;
a	b
11:12:13	2004-11-09 11:12:13
DELETE FROM t;
DELETE IGNORE FROM t;
CHECK TABLE t;
Table	Op	Msg_type	Msg_text
test.t	check	status	OK
DROP TABLE t;
# Testing example of type DATETIME and value "2030-04-05 11:12:13"
SHOW CREATE TABLE t;
Table	Create Table
t	CREATE TABLE `t` (
  `a` datetime NOT NULL,
  `b` datetime GENERATED ALWAYS AS (`a`) VIRTUAL NOT NULL,
  KEY `on_b` (`b`)
) ENGINE=InnoDB DEFAULT CHARSET=utf8mb4 COLLATE=utf8mb4_0900_ai_ci
INSERT IGNORE INTO t (a) VALUES ("2030-04-05 11:12:13");
SELECT * FROM t;
a	b
2030-04-05 11:12:13	2030-04-05 11:12:13
DELETE FROM t;
DELETE IGNORE FROM t;
CHECK TABLE t;
Table	Op	Msg_type	Msg_text
test.t	check	status	OK
DROP TABLE t;
# Testing example of type TIMESTAMP and value "2030-04-05 11:12:13"
SHOW CREATE TABLE t;
Table	Create Table
t	CREATE TABLE `t` (
  `a` timestamp NOT NULL,
  `b` datetime GENERATED ALWAYS AS (`a`) VIRTUAL NOT NULL,
  KEY `on_b` (`b`)
) ENGINE=InnoDB DEFAULT CHARSET=utf8mb4 COLLATE=utf8mb4_0900_ai_ci
INSERT IGNORE INTO t (a) VALUES ("2030-04-05 11:12:13");
SELECT * FROM t;
a	b
2030-04-05 11:12:13	2030-04-05 11:12:13
DELETE FROM t;
DELETE IGNORE FROM t;
CHECK TABLE t;
Table	Op	Msg_type	Msg_text
test.t	check	status	OK
DROP TABLE t;
# Testing example of type CHAR(40) and value "2000000000000000000000000000000000000"
SHOW CREATE TABLE t;
Table	Create Table
t	CREATE TABLE `t` (
  `a` char(40) NOT NULL,
  `b` datetime GENERATED ALWAYS AS (`a`) VIRTUAL NOT NULL,
  KEY `on_b` (`b`)
) ENGINE=InnoDB DEFAULT CHARSET=utf8mb4 COLLATE=utf8mb4_0900_ai_ci
INSERT IGNORE INTO t (a) VALUES ("2000000000000000000000000000000000000");
Warnings:
Warning	1264	Out of range value for column 'b' at row 1
SELECT * FROM t;
a	b
2000000000000000000000000000000000000	0000-00-00 00:00:00
Warnings:
Warning	1292	Incorrect datetime value: '2000000000000000000000000000000000000' for column 'b' at row 1
DELETE FROM t;
DELETE IGNORE FROM t;
Warnings:
Warning	1292	Incorrect datetime value: '2000000000000000000000000000000000000' for column 'b' at row 1
Warning	1292	Incorrect datetime value: '2000000000000000000000000000000000000' for column 'b' at row 1
CHECK TABLE t;
Table	Op	Msg_type	Msg_text
test.t	check	status	OK
DROP TABLE t;
# Testing example of type BINARY(45) and value "200000000000000000000000000000000000000000"
SHOW CREATE TABLE t;
Table	Create Table
t	CREATE TABLE `t` (
  `a` binary(45) NOT NULL,
  `b` datetime GENERATED ALWAYS AS (`a`) VIRTUAL NOT NULL,
  KEY `on_b` (`b`)
) ENGINE=InnoDB DEFAULT CHARSET=utf8mb4 COLLATE=utf8mb4_0900_ai_ci
INSERT IGNORE INTO t (a) VALUES ("200000000000000000000000000000000000000000");
Warnings:
Warning	1265	Data truncated for column 'b' at row 1
SELECT * FROM t;
a	b
200000000000000000000000000000000000000000   	0000-00-00 00:00:00
Warnings:
Warning	1292	Incorrect datetime value: '200000000000000000000000000000000000000000\x00\x00\x00' for column 'b' at row 1
DELETE FROM t;
DELETE IGNORE FROM t;
Warnings:
Warning	1292	Incorrect datetime value: '200000000000000000000000000000000000000000\x00\x00\x00' for column 'b' at row 1
Warning	1292	Incorrect datetime value: '200000000000000000000000000000000000000000\x00\x00\x00' for column 'b' at row 1
CHECK TABLE t;
Table	Op	Msg_type	Msg_text
test.t	check	status	OK
DROP TABLE t;
# Testing example of type VARCHAR(50) and value "2000000000000000000000000000000000000000000000000"
SHOW CREATE TABLE t;
Table	Create Table
t	CREATE TABLE `t` (
  `a` varchar(50) NOT NULL,
  `b` datetime GENERATED ALWAYS AS (`a`) VIRTUAL NOT NULL,
  KEY `on_b` (`b`)
) ENGINE=InnoDB DEFAULT CHARSET=utf8mb4 COLLATE=utf8mb4_0900_ai_ci
INSERT IGNORE INTO t (a) VALUES ("2000000000000000000000000000000000000000000000000");
Warnings:
Warning	1264	Out of range value for column 'b' at row 1
SELECT * FROM t;
a	b
2000000000000000000000000000000000000000000000000	0000-00-00 00:00:00
Warnings:
Warning	1292	Incorrect datetime value: '2000000000000000000000000000000000000000000000000' for column 'b' at row 1
DELETE FROM t;
DELETE IGNORE FROM t;
Warnings:
Warning	1292	Incorrect datetime value: '2000000000000000000000000000000000000000000000000' for column 'b' at row 1
Warning	1292	Incorrect datetime value: '2000000000000000000000000000000000000000000000000' for column 'b' at row 1
CHECK TABLE t;
Table	Op	Msg_type	Msg_text
test.t	check	status	OK
DROP TABLE t;
# Testing example of type CHAR(24) and value "hello beautiful world"
SHOW CREATE TABLE t;
Table	Create Table
t	CREATE TABLE `t` (
  `a` char(24) NOT NULL,
  `b` datetime GENERATED ALWAYS AS (`a`) VIRTUAL NOT NULL,
  KEY `on_b` (`b`)
) ENGINE=InnoDB DEFAULT CHARSET=utf8mb4 COLLATE=utf8mb4_0900_ai_ci
INSERT IGNORE INTO t (a) VALUES ("hello beautiful world");
Warnings:
Warning	1265	Data truncated for column 'b' at row 1
SELECT * FROM t;
a	b
hello beautiful world	0000-00-00 00:00:00
Warnings:
Warning	1292	Incorrect datetime value: 'hello beautiful world' for column 'b' at row 1
DELETE FROM t;
DELETE IGNORE FROM t;
Warnings:
Warning	1292	Incorrect datetime value: 'hello beautiful world' for column 'b' at row 1
Warning	1292	Incorrect datetime value: 'hello beautiful world' for column 'b' at row 1
CHECK TABLE t;
Table	Op	Msg_type	Msg_text
test.t	check	status	OK
DROP TABLE t;
# Testing example of type BINARY(12) and value "hello world"
SHOW CREATE TABLE t;
Table	Create Table
t	CREATE TABLE `t` (
  `a` binary(12) NOT NULL,
  `b` datetime GENERATED ALWAYS AS (`a`) VIRTUAL NOT NULL,
  KEY `on_b` (`b`)
) ENGINE=InnoDB DEFAULT CHARSET=utf8mb4 COLLATE=utf8mb4_0900_ai_ci
INSERT IGNORE INTO t (a) VALUES ("hello world");
Warnings:
Warning	1265	Data truncated for column 'b' at row 1
SELECT * FROM t;
a	b
hello world 	0000-00-00 00:00:00
Warnings:
Warning	1292	Incorrect datetime value: 'hello world\x00' for column 'b' at row 1
DELETE FROM t;
DELETE IGNORE FROM t;
Warnings:
Warning	1292	Incorrect datetime value: 'hello world\x00' for column 'b' at row 1
Warning	1292	Incorrect datetime value: 'hello world\x00' for column 'b' at row 1
CHECK TABLE t;
Table	Op	Msg_type	Msg_text
test.t	check	status	OK
DROP TABLE t;
# Testing example of type VARCHAR(6) and value "hello"
SHOW CREATE TABLE t;
Table	Create Table
t	CREATE TABLE `t` (
  `a` varchar(6) NOT NULL,
  `b` datetime GENERATED ALWAYS AS (`a`) VIRTUAL NOT NULL,
  KEY `on_b` (`b`)
) ENGINE=InnoDB DEFAULT CHARSET=utf8mb4 COLLATE=utf8mb4_0900_ai_ci
INSERT IGNORE INTO t (a) VALUES ("hello");
Warnings:
Warning	1265	Data truncated for column 'b' at row 1
SELECT * FROM t;
a	b
hello	0000-00-00 00:00:00
Warnings:
Warning	1292	Incorrect datetime value: 'hello' for column 'b' at row 1
DELETE FROM t;
DELETE IGNORE FROM t;
Warnings:
Warning	1292	Incorrect datetime value: 'hello' for column 'b' at row 1
Warning	1292	Incorrect datetime value: 'hello' for column 'b' at row 1
CHECK TABLE t;
Table	Op	Msg_type	Msg_text
test.t	check	status	OK
DROP TABLE t;
# Testing example of type ENUM("up","down") and value "up"
SHOW CREATE TABLE t;
Table	Create Table
t	CREATE TABLE `t` (
  `a` enum('up','down') NOT NULL,
  `b` datetime GENERATED ALWAYS AS (`a`) VIRTUAL NOT NULL,
  KEY `on_b` (`b`)
) ENGINE=InnoDB DEFAULT CHARSET=utf8mb4 COLLATE=utf8mb4_0900_ai_ci
INSERT IGNORE INTO t (a) VALUES ("up");
Warnings:
Warning	1265	Data truncated for column 'b' at row 1
SELECT * FROM t;
a	b
up	0000-00-00 00:00:00
Warnings:
Warning	1292	Incorrect datetime value: 'up' for column 'b' at row 1
DELETE FROM t;
DELETE IGNORE FROM t;
Warnings:
Warning	1292	Incorrect datetime value: 'up' for column 'b' at row 1
Warning	1292	Incorrect datetime value: 'up' for column 'b' at row 1
CHECK TABLE t;
Table	Op	Msg_type	Msg_text
test.t	check	status	OK
DROP TABLE t;
# Testing example of type SET("up","down") and value "up,down"
SHOW CREATE TABLE t;
Table	Create Table
t	CREATE TABLE `t` (
  `a` set('up','down') NOT NULL,
  `b` datetime GENERATED ALWAYS AS (`a`) VIRTUAL NOT NULL,
  KEY `on_b` (`b`)
) ENGINE=InnoDB DEFAULT CHARSET=utf8mb4 COLLATE=utf8mb4_0900_ai_ci
INSERT IGNORE INTO t (a) VALUES ("up,down");
Warnings:
Warning	1265	Data truncated for column 'b' at row 1
SELECT * FROM t;
a	b
up,down	0000-00-00 00:00:00
Warnings:
Warning	1292	Incorrect datetime value: 'up,down' for column 'b' at row 1
DELETE FROM t;
DELETE IGNORE FROM t;
Warnings:
Warning	1292	Incorrect datetime value: 'up,down' for column 'b' at row 1
Warning	1292	Incorrect datetime value: 'up,down' for column 'b' at row 1
CHECK TABLE t;
Table	Op	Msg_type	Msg_text
test.t	check	status	OK
DROP TABLE t;
# Testing example of type GEOMETRY and value ST_GeomFromText("POINT(1 1)")
SHOW CREATE TABLE t;
Table	Create Table
t	CREATE TABLE `t` (
  `a` geometry NOT NULL,
  `b` datetime GENERATED ALWAYS AS (`a`) VIRTUAL NOT NULL,
  KEY `on_b` (`b`)
) ENGINE=InnoDB DEFAULT CHARSET=utf8mb4 COLLATE=utf8mb4_0900_ai_ci
INSERT IGNORE INTO t (a) VALUES (ST_GeomFromText("POINT(1 1)"));
Warnings:
Warning	1265	Data truncated for column 'b' at row 1
SELECT * FROM t;
a	b
             ð?      ð?	0000-00-00 00:00:00
Warnings:
Warning	1292	Incorrect datetime value: '\x00\x00\x00\x00\x01\x01\x00\x00\x00\x00\x00\x00\x00\x00\x00\xF0?\x00\x00\x00\x00\x00\x00\xF0?' for column 'b' at row 1
DELETE FROM t;
DELETE IGNORE FROM t;
Warnings:
Warning	1292	Incorrect datetime value: '\x00\x00\x00\x00\x01\x01\x00\x00\x00\x00\x00\x00\x00\x00\x00\xF0?\x00\x00\x00\x00\x00\x00\xF0?' for column 'b' at row 1
Warning	1292	Incorrect datetime value: '\x00\x00\x00\x00\x01\x01\x00\x00\x00\x00\x00\x00\x00\x00\x00\xF0?\x00\x00\x00\x00\x00\x00\xF0?' for column 'b' at row 1
CHECK TABLE t;
Table	Op	Msg_type	Msg_text
test.t	check	status	OK
DROP TABLE t;
# Testing example of type POINT and value ST_GeomFromText("POINT(1 1)")
SHOW CREATE TABLE t;
Table	Create Table
t	CREATE TABLE `t` (
  `a` point NOT NULL,
  `b` datetime GENERATED ALWAYS AS (`a`) VIRTUAL NOT NULL,
  KEY `on_b` (`b`)
) ENGINE=InnoDB DEFAULT CHARSET=utf8mb4 COLLATE=utf8mb4_0900_ai_ci
INSERT IGNORE INTO t (a) VALUES (ST_GeomFromText("POINT(1 1)"));
Warnings:
Warning	1265	Data truncated for column 'b' at row 1
SELECT * FROM t;
a	b
             ð?      ð?	0000-00-00 00:00:00
Warnings:
Warning	1292	Incorrect datetime value: '\x00\x00\x00\x00\x01\x01\x00\x00\x00\x00\x00\x00\x00\x00\x00\xF0?\x00\x00\x00\x00\x00\x00\xF0?' for column 'b' at row 1
DELETE FROM t;
DELETE IGNORE FROM t;
Warnings:
Warning	1292	Incorrect datetime value: '\x00\x00\x00\x00\x01\x01\x00\x00\x00\x00\x00\x00\x00\x00\x00\xF0?\x00\x00\x00\x00\x00\x00\xF0?' for column 'b' at row 1
Warning	1292	Incorrect datetime value: '\x00\x00\x00\x00\x01\x01\x00\x00\x00\x00\x00\x00\x00\x00\x00\xF0?\x00\x00\x00\x00\x00\x00\xF0?' for column 'b' at row 1
CHECK TABLE t;
Table	Op	Msg_type	Msg_text
test.t	check	status	OK
DROP TABLE t;
# Testing example of type LINESTRING and value ST_GeomFromText("LINESTRING(0 0,1 1,2 2)")
SHOW CREATE TABLE t;
Table	Create Table
t	CREATE TABLE `t` (
  `a` linestring NOT NULL,
  `b` datetime GENERATED ALWAYS AS (`a`) VIRTUAL NOT NULL,
  KEY `on_b` (`b`)
) ENGINE=InnoDB DEFAULT CHARSET=utf8mb4 COLLATE=utf8mb4_0900_ai_ci
INSERT IGNORE INTO t (a) VALUES (ST_GeomFromText("LINESTRING(0 0,1 1,2 2)"));
Warnings:
Warning	1265	Data truncated for column 'b' at row 1
SELECT * FROM t;
a	b
                                ð?      ð?       @       @	0000-00-00 00:00:00
Warnings:
Warning	1292	Incorrect datetime value: '\x00\x00\x00\x00\x01\x02\x00\x00\x00\x03\x00\x00\x00\x00\x00\x00\x00\x00\x00\x00\x00\x00\x00\x00\x00\x00\x00\x00\x00\x00\x00\x00' for column 'b' at row 1
DELETE FROM t;
DELETE IGNORE FROM t;
Warnings:
Warning	1292	Incorrect datetime value: '\x00\x00\x00\x00\x01\x02\x00\x00\x00\x03\x00\x00\x00\x00\x00\x00\x00\x00\x00\x00\x00\x00\x00\x00\x00\x00\x00\x00\x00\x00\x00\x00' for column 'b' at row 1
Warning	1292	Incorrect datetime value: '\x00\x00\x00\x00\x01\x02\x00\x00\x00\x03\x00\x00\x00\x00\x00\x00\x00\x00\x00\x00\x00\x00\x00\x00\x00\x00\x00\x00\x00\x00\x00\x00' for column 'b' at row 1
CHECK TABLE t;
Table	Op	Msg_type	Msg_text
test.t	check	status	OK
DROP TABLE t;
# Testing example of type POLYGON and value ST_GeomFromText("POLYGON((0 0,1 0,1 1,0 1,0 0),(5 5,7 5,7 7,5 7,5 5))")
SHOW CREATE TABLE t;
Table	Create Table
t	CREATE TABLE `t` (
  `a` polygon NOT NULL,
  `b` datetime GENERATED ALWAYS AS (`a`) VIRTUAL NOT NULL,
  KEY `on_b` (`b`)
) ENGINE=InnoDB DEFAULT CHARSET=utf8mb4 COLLATE=utf8mb4_0900_ai_ci
INSERT IGNORE INTO t (a) VALUES (ST_GeomFromText("POLYGON((0 0,1 0,1 1,0 1,0 0),(5 5,7 5,7 7,5 7,5 5))"));
Warnings:
Warning	1265	Data truncated for column 'b' at row 1
SELECT * FROM t;
a	b
                                   ð?              ð?      ð?              ð?                         @      @      @      @      @      @      @      @      @      @	0000-00-00 00:00:00
Warnings:
Warning	1292	Incorrect datetime value: '\x00\x00\x00\x00\x01\x03\x00\x00\x00\x02\x00\x00\x00\x05\x00\x00\x00\x00\x00\x00\x00\x00\x00\x00\x00\x00\x00\x00\x00\x00\x00\x00' for column 'b' at row 1
DELETE FROM t;
DELETE IGNORE FROM t;
Warnings:
Warning	1292	Incorrect datetime value: '\x00\x00\x00\x00\x01\x03\x00\x00\x00\x02\x00\x00\x00\x05\x00\x00\x00\x00\x00\x00\x00\x00\x00\x00\x00\x00\x00\x00\x00\x00\x00\x00' for column 'b' at row 1
Warning	1292	Incorrect datetime value: '\x00\x00\x00\x00\x01\x03\x00\x00\x00\x02\x00\x00\x00\x05\x00\x00\x00\x00\x00\x00\x00\x00\x00\x00\x00\x00\x00\x00\x00\x00\x00\x00' for column 'b' at row 1
CHECK TABLE t;
Table	Op	Msg_type	Msg_text
test.t	check	status	OK
DROP TABLE t;
#
# Testing virtual column of type TIMESTAMP
#
# Testing example of type JSON and value "{}"
SHOW CREATE TABLE t;
Table	Create Table
t	CREATE TABLE `t` (
  `a` json NOT NULL,
  `b` timestamp GENERATED ALWAYS AS (`a`) VIRTUAL NOT NULL,
  KEY `on_b` (`b`)
) ENGINE=InnoDB DEFAULT CHARSET=utf8mb4 COLLATE=utf8mb4_0900_ai_ci
INSERT IGNORE INTO t (a) VALUES ("{}");
Warnings:
Warning	3156	Invalid JSON value for CAST to DATE/TIME/DATETIME/TIMESTAMP from column a at row 1
Warning	1264	Out of range value for column 'b' at row 1
SELECT * FROM t;
a	b
{}	0000-00-00 00:00:00
Warnings:
Warning	3156	Invalid JSON value for CAST to DATE/TIME/DATETIME/TIMESTAMP from column a at row 1
Warning	1292	Incorrect datetime value: '0000-00-00 00:00:00' for column 'b' at row 1
DELETE FROM t;
DELETE IGNORE FROM t;
Warnings:
Warning	3156	Invalid JSON value for CAST to DATE/TIME/DATETIME/TIMESTAMP from column a at row 1
Warning	1292	Incorrect datetime value: '0000-00-00 00:00:00' for column 'b' at row 1
Warning	3156	Invalid JSON value for CAST to DATE/TIME/DATETIME/TIMESTAMP from column a at row 1
Warning	1292	Incorrect datetime value: '0000-00-00 00:00:00' for column 'b' at row 1
CHECK TABLE t;
Table	Op	Msg_type	Msg_text
test.t	check	status	OK
DROP TABLE t;
# Testing example of type JSON and value '["hello beautiful world"]'
SHOW CREATE TABLE t;
Table	Create Table
t	CREATE TABLE `t` (
  `a` json NOT NULL,
  `b` timestamp GENERATED ALWAYS AS (`a`) VIRTUAL NOT NULL,
  KEY `on_b` (`b`)
) ENGINE=InnoDB DEFAULT CHARSET=utf8mb4 COLLATE=utf8mb4_0900_ai_ci
INSERT IGNORE INTO t (a) VALUES ('["hello beautiful world"]');
Warnings:
Warning	3156	Invalid JSON value for CAST to DATE/TIME/DATETIME/TIMESTAMP from column a at row 1
Warning	1264	Out of range value for column 'b' at row 1
SELECT * FROM t;
a	b
["hello beautiful world"]	0000-00-00 00:00:00
Warnings:
Warning	3156	Invalid JSON value for CAST to DATE/TIME/DATETIME/TIMESTAMP from column a at row 1
Warning	1292	Incorrect datetime value: '0000-00-00 00:00:00' for column 'b' at row 1
DELETE FROM t;
DELETE IGNORE FROM t;
Warnings:
Warning	3156	Invalid JSON value for CAST to DATE/TIME/DATETIME/TIMESTAMP from column a at row 1
Warning	1292	Incorrect datetime value: '0000-00-00 00:00:00' for column 'b' at row 1
Warning	3156	Invalid JSON value for CAST to DATE/TIME/DATETIME/TIMESTAMP from column a at row 1
Warning	1292	Incorrect datetime value: '0000-00-00 00:00:00' for column 'b' at row 1
CHECK TABLE t;
Table	Op	Msg_type	Msg_text
test.t	check	status	OK
DROP TABLE t;
# Testing example of type JSON and value "-1"
SHOW CREATE TABLE t;
Table	Create Table
t	CREATE TABLE `t` (
  `a` json NOT NULL,
  `b` timestamp GENERATED ALWAYS AS (`a`) VIRTUAL NOT NULL,
  KEY `on_b` (`b`)
) ENGINE=InnoDB DEFAULT CHARSET=utf8mb4 COLLATE=utf8mb4_0900_ai_ci
INSERT IGNORE INTO t (a) VALUES ("-1");
Warnings:
Warning	3156	Invalid JSON value for CAST to DATE/TIME/DATETIME/TIMESTAMP from column a at row 1
Warning	1264	Out of range value for column 'b' at row 1
SELECT * FROM t;
a	b
-1	0000-00-00 00:00:00
Warnings:
Warning	3156	Invalid JSON value for CAST to DATE/TIME/DATETIME/TIMESTAMP from column a at row 1
Warning	1292	Incorrect datetime value: '0000-00-00 00:00:00' for column 'b' at row 1
DELETE FROM t;
DELETE IGNORE FROM t;
Warnings:
Warning	3156	Invalid JSON value for CAST to DATE/TIME/DATETIME/TIMESTAMP from column a at row 1
Warning	1292	Incorrect datetime value: '0000-00-00 00:00:00' for column 'b' at row 1
Warning	3156	Invalid JSON value for CAST to DATE/TIME/DATETIME/TIMESTAMP from column a at row 1
Warning	1292	Incorrect datetime value: '0000-00-00 00:00:00' for column 'b' at row 1
CHECK TABLE t;
Table	Op	Msg_type	Msg_text
test.t	check	status	OK
DROP TABLE t;
# Testing example of type TINYINT and value -1
SHOW CREATE TABLE t;
Table	Create Table
t	CREATE TABLE `t` (
  `a` tinyint NOT NULL,
  `b` timestamp GENERATED ALWAYS AS (`a`) VIRTUAL NOT NULL,
  KEY `on_b` (`b`)
) ENGINE=InnoDB DEFAULT CHARSET=utf8mb4 COLLATE=utf8mb4_0900_ai_ci
INSERT IGNORE INTO t (a) VALUES (-1);
Warnings:
Warning	1264	Out of range value for column 'b' at row 1
SELECT * FROM t;
a	b
-1	0000-00-00 00:00:00
Warnings:
Warning	1292	Incorrect datetime value: '-1' for column 'b' at row 1
DELETE FROM t;
DELETE IGNORE FROM t;
Warnings:
Warning	1292	Incorrect datetime value: '-1' for column 'b' at row 1
Warning	1292	Incorrect datetime value: '-1' for column 'b' at row 1
CHECK TABLE t;
Table	Op	Msg_type	Msg_text
test.t	check	status	OK
DROP TABLE t;
# Testing example of type SMALLINT and value -1
SHOW CREATE TABLE t;
Table	Create Table
t	CREATE TABLE `t` (
  `a` smallint NOT NULL,
  `b` timestamp GENERATED ALWAYS AS (`a`) VIRTUAL NOT NULL,
  KEY `on_b` (`b`)
) ENGINE=InnoDB DEFAULT CHARSET=utf8mb4 COLLATE=utf8mb4_0900_ai_ci
INSERT IGNORE INTO t (a) VALUES (-1);
Warnings:
Warning	1264	Out of range value for column 'b' at row 1
SELECT * FROM t;
a	b
-1	0000-00-00 00:00:00
Warnings:
Warning	1292	Incorrect datetime value: '-1' for column 'b' at row 1
DELETE FROM t;
DELETE IGNORE FROM t;
Warnings:
Warning	1292	Incorrect datetime value: '-1' for column 'b' at row 1
Warning	1292	Incorrect datetime value: '-1' for column 'b' at row 1
CHECK TABLE t;
Table	Op	Msg_type	Msg_text
test.t	check	status	OK
DROP TABLE t;
# Testing example of type MEDIUMINT and value -1
SHOW CREATE TABLE t;
Table	Create Table
t	CREATE TABLE `t` (
  `a` mediumint NOT NULL,
  `b` timestamp GENERATED ALWAYS AS (`a`) VIRTUAL NOT NULL,
  KEY `on_b` (`b`)
) ENGINE=InnoDB DEFAULT CHARSET=utf8mb4 COLLATE=utf8mb4_0900_ai_ci
INSERT IGNORE INTO t (a) VALUES (-1);
Warnings:
Warning	1264	Out of range value for column 'b' at row 1
SELECT * FROM t;
a	b
-1	0000-00-00 00:00:00
Warnings:
Warning	1292	Incorrect datetime value: '-1' for column 'b' at row 1
DELETE FROM t;
DELETE IGNORE FROM t;
Warnings:
Warning	1292	Incorrect datetime value: '-1' for column 'b' at row 1
Warning	1292	Incorrect datetime value: '-1' for column 'b' at row 1
CHECK TABLE t;
Table	Op	Msg_type	Msg_text
test.t	check	status	OK
DROP TABLE t;
# Testing example of type INT and value 2000000000
SHOW CREATE TABLE t;
Table	Create Table
t	CREATE TABLE `t` (
  `a` int NOT NULL,
  `b` timestamp GENERATED ALWAYS AS (`a`) VIRTUAL NOT NULL,
  KEY `on_b` (`b`)
) ENGINE=InnoDB DEFAULT CHARSET=utf8mb4 COLLATE=utf8mb4_0900_ai_ci
INSERT IGNORE INTO t (a) VALUES (2000000000);
Warnings:
Warning	1265	Data truncated for column 'b' at row 1
SELECT * FROM t;
a	b
2000000000	0000-00-00 00:00:00
Warnings:
Warning	1292	Incorrect datetime value: '2000000000' for column 'b' at row 1
DELETE FROM t;
DELETE IGNORE FROM t;
Warnings:
Warning	1292	Incorrect datetime value: '2000000000' for column 'b' at row 1
Warning	1292	Incorrect datetime value: '2000000000' for column 'b' at row 1
CHECK TABLE t;
Table	Op	Msg_type	Msg_text
test.t	check	status	OK
DROP TABLE t;
# Testing example of type INT and value -2000000000
SHOW CREATE TABLE t;
Table	Create Table
t	CREATE TABLE `t` (
  `a` int NOT NULL,
  `b` timestamp GENERATED ALWAYS AS (`a`) VIRTUAL NOT NULL,
  KEY `on_b` (`b`)
) ENGINE=InnoDB DEFAULT CHARSET=utf8mb4 COLLATE=utf8mb4_0900_ai_ci
INSERT IGNORE INTO t (a) VALUES (-2000000000);
Warnings:
Warning	1264	Out of range value for column 'b' at row 1
SELECT * FROM t;
a	b
-2000000000	0000-00-00 00:00:00
Warnings:
Warning	1292	Incorrect datetime value: '-2000000000' for column 'b' at row 1
DELETE FROM t;
DELETE IGNORE FROM t;
Warnings:
Warning	1292	Incorrect datetime value: '-2000000000' for column 'b' at row 1
Warning	1292	Incorrect datetime value: '-2000000000' for column 'b' at row 1
CHECK TABLE t;
Table	Op	Msg_type	Msg_text
test.t	check	status	OK
DROP TABLE t;
# Testing example of type INT UNSIGNED and value 4000000000
SHOW CREATE TABLE t;
Table	Create Table
t	CREATE TABLE `t` (
  `a` int unsigned NOT NULL,
  `b` timestamp GENERATED ALWAYS AS (`a`) VIRTUAL NOT NULL,
  KEY `on_b` (`b`)
) ENGINE=InnoDB DEFAULT CHARSET=utf8mb4 COLLATE=utf8mb4_0900_ai_ci
INSERT IGNORE INTO t (a) VALUES (4000000000);
Warnings:
Warning	1265	Data truncated for column 'b' at row 1
SELECT * FROM t;
a	b
4000000000	0000-00-00 00:00:00
Warnings:
Warning	1292	Incorrect datetime value: '4000000000' for column 'b' at row 1
DELETE FROM t;
DELETE IGNORE FROM t;
Warnings:
Warning	1292	Incorrect datetime value: '4000000000' for column 'b' at row 1
Warning	1292	Incorrect datetime value: '4000000000' for column 'b' at row 1
CHECK TABLE t;
Table	Op	Msg_type	Msg_text
test.t	check	status	OK
DROP TABLE t;
# Testing example of type BIGINT and value 2000000000000000000
SHOW CREATE TABLE t;
Table	Create Table
t	CREATE TABLE `t` (
  `a` bigint NOT NULL,
  `b` timestamp GENERATED ALWAYS AS (`a`) VIRTUAL NOT NULL,
  KEY `on_b` (`b`)
) ENGINE=InnoDB DEFAULT CHARSET=utf8mb4 COLLATE=utf8mb4_0900_ai_ci
INSERT IGNORE INTO t (a) VALUES (2000000000000000000);
Warnings:
Warning	1264	Out of range value for column 'b' at row 1
SELECT * FROM t;
a	b
2000000000000000000	0000-00-00 00:00:00
Warnings:
Warning	1292	Incorrect datetime value: '2000000000000000000' for column 'b' at row 1
DELETE FROM t;
DELETE IGNORE FROM t;
Warnings:
Warning	1292	Incorrect datetime value: '2000000000000000000' for column 'b' at row 1
Warning	1292	Incorrect datetime value: '2000000000000000000' for column 'b' at row 1
CHECK TABLE t;
Table	Op	Msg_type	Msg_text
test.t	check	status	OK
DROP TABLE t;
# Testing example of type BIGINT and value -2000000000000000000
SHOW CREATE TABLE t;
Table	Create Table
t	CREATE TABLE `t` (
  `a` bigint NOT NULL,
  `b` timestamp GENERATED ALWAYS AS (`a`) VIRTUAL NOT NULL,
  KEY `on_b` (`b`)
) ENGINE=InnoDB DEFAULT CHARSET=utf8mb4 COLLATE=utf8mb4_0900_ai_ci
INSERT IGNORE INTO t (a) VALUES (-2000000000000000000);
Warnings:
Warning	1264	Out of range value for column 'b' at row 1
SELECT * FROM t;
a	b
-2000000000000000000	0000-00-00 00:00:00
Warnings:
Warning	1292	Incorrect datetime value: '-2000000000000000000' for column 'b' at row 1
DELETE FROM t;
DELETE IGNORE FROM t;
Warnings:
Warning	1292	Incorrect datetime value: '-2000000000000000000' for column 'b' at row 1
Warning	1292	Incorrect datetime value: '-2000000000000000000' for column 'b' at row 1
CHECK TABLE t;
Table	Op	Msg_type	Msg_text
test.t	check	status	OK
DROP TABLE t;
# Testing example of type FLOAT and value -1.23456
SHOW CREATE TABLE t;
Table	Create Table
t	CREATE TABLE `t` (
  `a` float NOT NULL,
  `b` timestamp GENERATED ALWAYS AS (`a`) VIRTUAL NOT NULL,
  KEY `on_b` (`b`)
) ENGINE=InnoDB DEFAULT CHARSET=utf8mb4 COLLATE=utf8mb4_0900_ai_ci
INSERT IGNORE INTO t (a) VALUES (-1.23456);
Warnings:
Warning	1264	Out of range value for column 'b' at row 1
SELECT * FROM t;
a	b
-1.23456	0000-00-00 00:00:00
Warnings:
Warning	1292	Incorrect datetime value: '-1.2345600128173828' for column 'b' at row 1
DELETE FROM t;
DELETE IGNORE FROM t;
Warnings:
Warning	1292	Incorrect datetime value: '-1.2345600128173828' for column 'b' at row 1
Warning	1292	Incorrect datetime value: '-1.2345600128173828' for column 'b' at row 1
CHECK TABLE t;
Table	Op	Msg_type	Msg_text
test.t	check	status	OK
DROP TABLE t;
# Testing example of type FLOAT and value -1e38
SHOW CREATE TABLE t;
Table	Create Table
t	CREATE TABLE `t` (
  `a` float NOT NULL,
  `b` timestamp GENERATED ALWAYS AS (`a`) VIRTUAL NOT NULL,
  KEY `on_b` (`b`)
) ENGINE=InnoDB DEFAULT CHARSET=utf8mb4 COLLATE=utf8mb4_0900_ai_ci
INSERT IGNORE INTO t (a) VALUES (-1e38);
Warnings:
Warning	1264	Out of range value for column 'b' at row 1
SELECT * FROM t;
a	b
-1e38	0000-00-00 00:00:00
Warnings:
Warning	1292	Incorrect datetime value: '-9.999999680285692e37' for column 'b' at row 1
DELETE FROM t;
DELETE IGNORE FROM t;
Warnings:
Warning	1292	Incorrect datetime value: '-9.999999680285692e37' for column 'b' at row 1
Warning	1292	Incorrect datetime value: '-9.999999680285692e37' for column 'b' at row 1
CHECK TABLE t;
Table	Op	Msg_type	Msg_text
test.t	check	status	OK
DROP TABLE t;
# Testing example of type FLOAT and value 1e38
SHOW CREATE TABLE t;
Table	Create Table
t	CREATE TABLE `t` (
  `a` float NOT NULL,
  `b` timestamp GENERATED ALWAYS AS (`a`) VIRTUAL NOT NULL,
  KEY `on_b` (`b`)
) ENGINE=InnoDB DEFAULT CHARSET=utf8mb4 COLLATE=utf8mb4_0900_ai_ci
INSERT IGNORE INTO t (a) VALUES (1e38);
Warnings:
Warning	1264	Out of range value for column 'b' at row 1
SELECT * FROM t;
a	b
1e38	0000-00-00 00:00:00
Warnings:
Warning	1292	Incorrect datetime value: '9.999999680285692e37' for column 'b' at row 1
DELETE FROM t;
DELETE IGNORE FROM t;
Warnings:
Warning	1292	Incorrect datetime value: '9.999999680285692e37' for column 'b' at row 1
Warning	1292	Incorrect datetime value: '9.999999680285692e37' for column 'b' at row 1
CHECK TABLE t;
Table	Op	Msg_type	Msg_text
test.t	check	status	OK
DROP TABLE t;
# Testing example of type DOUBLE and value -1.23456789012345
SHOW CREATE TABLE t;
Table	Create Table
t	CREATE TABLE `t` (
  `a` double NOT NULL,
  `b` timestamp GENERATED ALWAYS AS (`a`) VIRTUAL NOT NULL,
  KEY `on_b` (`b`)
) ENGINE=InnoDB DEFAULT CHARSET=utf8mb4 COLLATE=utf8mb4_0900_ai_ci
INSERT IGNORE INTO t (a) VALUES (-1.23456789012345);
Warnings:
Warning	1264	Out of range value for column 'b' at row 1
SELECT * FROM t;
a	b
-1.23456789012345	0000-00-00 00:00:00
Warnings:
Warning	1292	Incorrect datetime value: '-1.23456789012345' for column 'b' at row 1
DELETE FROM t;
DELETE IGNORE FROM t;
Warnings:
Warning	1292	Incorrect datetime value: '-1.23456789012345' for column 'b' at row 1
Warning	1292	Incorrect datetime value: '-1.23456789012345' for column 'b' at row 1
CHECK TABLE t;
Table	Op	Msg_type	Msg_text
test.t	check	status	OK
DROP TABLE t;
# Testing example of type DOUBLE and value 1.23456789012345
SHOW CREATE TABLE t;
Table	Create Table
t	CREATE TABLE `t` (
  `a` double NOT NULL,
  `b` timestamp GENERATED ALWAYS AS (`a`) VIRTUAL NOT NULL,
  KEY `on_b` (`b`)
) ENGINE=InnoDB DEFAULT CHARSET=utf8mb4 COLLATE=utf8mb4_0900_ai_ci
INSERT IGNORE INTO t (a) VALUES (1.23456789012345);
Warnings:
Warning	1265	Data truncated for column 'b' at row 1
SELECT * FROM t;
a	b
1.23456789012345	0000-00-00 00:00:00
Warnings:
Warning	1292	Incorrect datetime value: '1.23456789012345' for column 'b' at row 1
DELETE FROM t;
DELETE IGNORE FROM t;
Warnings:
Warning	1292	Incorrect datetime value: '1.23456789012345' for column 'b' at row 1
Warning	1292	Incorrect datetime value: '1.23456789012345' for column 'b' at row 1
CHECK TABLE t;
Table	Op	Msg_type	Msg_text
test.t	check	status	OK
DROP TABLE t;
# Testing example of type DOUBLE and value -1e300
SHOW CREATE TABLE t;
Table	Create Table
t	CREATE TABLE `t` (
  `a` double NOT NULL,
  `b` timestamp GENERATED ALWAYS AS (`a`) VIRTUAL NOT NULL,
  KEY `on_b` (`b`)
) ENGINE=InnoDB DEFAULT CHARSET=utf8mb4 COLLATE=utf8mb4_0900_ai_ci
INSERT IGNORE INTO t (a) VALUES (-1e300);
Warnings:
Warning	1264	Out of range value for column 'b' at row 1
SELECT * FROM t;
a	b
-1e300	0000-00-00 00:00:00
Warnings:
Warning	1292	Incorrect datetime value: '-1e300' for column 'b' at row 1
DELETE FROM t;
DELETE IGNORE FROM t;
Warnings:
Warning	1292	Incorrect datetime value: '-1e300' for column 'b' at row 1
Warning	1292	Incorrect datetime value: '-1e300' for column 'b' at row 1
CHECK TABLE t;
Table	Op	Msg_type	Msg_text
test.t	check	status	OK
DROP TABLE t;
# Testing example of type DOUBLE and value 1e300
SHOW CREATE TABLE t;
Table	Create Table
t	CREATE TABLE `t` (
  `a` double NOT NULL,
  `b` timestamp GENERATED ALWAYS AS (`a`) VIRTUAL NOT NULL,
  KEY `on_b` (`b`)
) ENGINE=InnoDB DEFAULT CHARSET=utf8mb4 COLLATE=utf8mb4_0900_ai_ci
INSERT IGNORE INTO t (a) VALUES (1e300);
Warnings:
Warning	1264	Out of range value for column 'b' at row 1
SELECT * FROM t;
a	b
1e300	0000-00-00 00:00:00
Warnings:
Warning	1292	Incorrect datetime value: '1e300' for column 'b' at row 1
DELETE FROM t;
DELETE IGNORE FROM t;
Warnings:
Warning	1292	Incorrect datetime value: '1e300' for column 'b' at row 1
Warning	1292	Incorrect datetime value: '1e300' for column 'b' at row 1
CHECK TABLE t;
Table	Op	Msg_type	Msg_text
test.t	check	status	OK
DROP TABLE t;
# Testing example of type DECIMAL(4,2) and value -10.99
SHOW CREATE TABLE t;
Table	Create Table
t	CREATE TABLE `t` (
  `a` decimal(4,2) NOT NULL,
  `b` timestamp GENERATED ALWAYS AS (`a`) VIRTUAL NOT NULL,
  KEY `on_b` (`b`)
) ENGINE=InnoDB DEFAULT CHARSET=utf8mb4 COLLATE=utf8mb4_0900_ai_ci
INSERT IGNORE INTO t (a) VALUES (-10.99);
Warnings:
Warning	1264	Out of range value for column 'b' at row 1
SELECT * FROM t;
a	b
-10.99	0000-00-00 00:00:00
Warnings:
Warning	1292	Incorrect datetime value: '-10.99' for column 'b' at row 1
DELETE FROM t;
DELETE IGNORE FROM t;
Warnings:
Warning	1292	Incorrect datetime value: '-10.99' for column 'b' at row 1
Warning	1292	Incorrect datetime value: '-10.99' for column 'b' at row 1
CHECK TABLE t;
Table	Op	Msg_type	Msg_text
test.t	check	status	OK
DROP TABLE t;
# Testing example of type DECIMAL(34,4) and value 20000000000000000000000000000.0001
SHOW CREATE TABLE t;
Table	Create Table
t	CREATE TABLE `t` (
  `a` decimal(34,4) NOT NULL,
  `b` timestamp GENERATED ALWAYS AS (`a`) VIRTUAL NOT NULL,
  KEY `on_b` (`b`)
) ENGINE=InnoDB DEFAULT CHARSET=utf8mb4 COLLATE=utf8mb4_0900_ai_ci
INSERT IGNORE INTO t (a) VALUES (20000000000000000000000000000.0001);
Warnings:
Warning	1264	Out of range value for column 'b' at row 1
SELECT * FROM t;
a	b
20000000000000000000000000000.0001	0000-00-00 00:00:00
Warnings:
Warning	1292	Incorrect datetime value: '20000000000000000000000000000.0001' for column 'b' at row 1
DELETE FROM t;
DELETE IGNORE FROM t;
Warnings:
Warning	1292	Incorrect datetime value: '20000000000000000000000000000.0001' for column 'b' at row 1
Warning	1292	Incorrect datetime value: '20000000000000000000000000000.0001' for column 'b' at row 1
CHECK TABLE t;
Table	Op	Msg_type	Msg_text
test.t	check	status	OK
DROP TABLE t;
# Testing example of type DECIMAL(34,4) and value -20000000000000000000000000000.0001
SHOW CREATE TABLE t;
Table	Create Table
t	CREATE TABLE `t` (
  `a` decimal(34,4) NOT NULL,
  `b` timestamp GENERATED ALWAYS AS (`a`) VIRTUAL NOT NULL,
  KEY `on_b` (`b`)
) ENGINE=InnoDB DEFAULT CHARSET=utf8mb4 COLLATE=utf8mb4_0900_ai_ci
INSERT IGNORE INTO t (a) VALUES (-20000000000000000000000000000.0001);
Warnings:
Warning	1264	Out of range value for column 'b' at row 1
SELECT * FROM t;
a	b
-20000000000000000000000000000.0001	0000-00-00 00:00:00
Warnings:
Warning	1292	Incorrect datetime value: '-20000000000000000000000000000.0001' for column 'b' at row 1
DELETE FROM t;
DELETE IGNORE FROM t;
Warnings:
Warning	1292	Incorrect datetime value: '-20000000000000000000000000000.0001' for column 'b' at row 1
Warning	1292	Incorrect datetime value: '-20000000000000000000000000000.0001' for column 'b' at row 1
CHECK TABLE t;
Table	Op	Msg_type	Msg_text
test.t	check	status	OK
DROP TABLE t;
# Testing example of type BIT(64) and value 0xDEADBEEFC0FEBABE
SHOW CREATE TABLE t;
Table	Create Table
t	CREATE TABLE `t` (
  `a` bit(64) NOT NULL,
  `b` timestamp GENERATED ALWAYS AS (`a`) VIRTUAL NOT NULL,
  KEY `on_b` (`b`)
) ENGINE=InnoDB DEFAULT CHARSET=utf8mb4 COLLATE=utf8mb4_0900_ai_ci
INSERT IGNORE INTO t (a) VALUES (0xDEADBEEFC0FEBABE);
Warnings:
Warning	1264	Out of range value for column 'b' at row 1
SELECT * FROM t;
a	b
Þ­¾ïÀþº¾	0000-00-00 00:00:00
Warnings:
Warning	1292	Incorrect datetime value: '16045690984335325886' for column 'b' at row 1
DELETE FROM t;
DELETE IGNORE FROM t;
Warnings:
Warning	1292	Incorrect datetime value: '16045690984335325886' for column 'b' at row 1
Warning	1292	Incorrect datetime value: '16045690984335325886' for column 'b' at row 1
CHECK TABLE t;
Table	Op	Msg_type	Msg_text
test.t	check	status	OK
DROP TABLE t;
# Testing example of type BIT(4) and value 0b1000
SHOW CREATE TABLE t;
Table	Create Table
t	CREATE TABLE `t` (
  `a` bit(4) NOT NULL,
  `b` timestamp GENERATED ALWAYS AS (`a`) VIRTUAL NOT NULL,
  KEY `on_b` (`b`)
) ENGINE=InnoDB DEFAULT CHARSET=utf8mb4 COLLATE=utf8mb4_0900_ai_ci
INSERT IGNORE INTO t (a) VALUES (0b1000);
Warnings:
Warning	1265	Data truncated for column 'b' at row 1
SELECT * FROM t;
a	b
	0000-00-00 00:00:00
Warnings:
Warning	1292	Incorrect datetime value: '8' for column 'b' at row 1
DELETE FROM t;
DELETE IGNORE FROM t;
Warnings:
Warning	1292	Incorrect datetime value: '8' for column 'b' at row 1
Warning	1292	Incorrect datetime value: '8' for column 'b' at row 1
CHECK TABLE t;
Table	Op	Msg_type	Msg_text
test.t	check	status	OK
DROP TABLE t;
# Testing example of type YEAR and value 2020
SHOW CREATE TABLE t;
Table	Create Table
t	CREATE TABLE `t` (
  `a` year NOT NULL,
  `b` timestamp GENERATED ALWAYS AS (`a`) VIRTUAL NOT NULL,
  KEY `on_b` (`b`)
) ENGINE=InnoDB DEFAULT CHARSET=utf8mb4 COLLATE=utf8mb4_0900_ai_ci
INSERT IGNORE INTO t (a) VALUES (2020);
Warnings:
Warning	1265	Data truncated for column 'b' at row 1
SELECT * FROM t;
a	b
2020	0000-00-00 00:00:00
Warnings:
Warning	1292	Incorrect datetime value: '2020' for column 'b' at row 1
DELETE FROM t;
DELETE IGNORE FROM t;
Warnings:
Warning	1292	Incorrect datetime value: '2020' for column 'b' at row 1
Warning	1292	Incorrect datetime value: '2020' for column 'b' at row 1
CHECK TABLE t;
Table	Op	Msg_type	Msg_text
test.t	check	status	OK
DROP TABLE t;
# Testing example of type DATE and value "2030-04-05"
SHOW CREATE TABLE t;
Table	Create Table
t	CREATE TABLE `t` (
  `a` date NOT NULL,
  `b` timestamp GENERATED ALWAYS AS (`a`) VIRTUAL NOT NULL,
  KEY `on_b` (`b`)
) ENGINE=InnoDB DEFAULT CHARSET=utf8mb4 COLLATE=utf8mb4_0900_ai_ci
INSERT IGNORE INTO t (a) VALUES ("2030-04-05");
SELECT * FROM t;
a	b
2030-04-05	2030-04-05 00:00:00
DELETE FROM t;
DELETE IGNORE FROM t;
CHECK TABLE t;
Table	Op	Msg_type	Msg_text
test.t	check	status	OK
DROP TABLE t;
# Testing example of type TIME and value "11:12:13"
SHOW CREATE TABLE t;
Table	Create Table
t	CREATE TABLE `t` (
  `a` time NOT NULL,
  `b` timestamp GENERATED ALWAYS AS (`a`) VIRTUAL NOT NULL,
  KEY `on_b` (`b`)
) ENGINE=InnoDB DEFAULT CHARSET=utf8mb4 COLLATE=utf8mb4_0900_ai_ci
INSERT IGNORE INTO t (a) VALUES ("11:12:13");
SELECT * FROM t;
a	b
11:12:13	2004-11-09 11:12:13
DELETE FROM t;
DELETE IGNORE FROM t;
CHECK TABLE t;
Table	Op	Msg_type	Msg_text
test.t	check	status	OK
DROP TABLE t;
# Testing example of type DATETIME and value "2030-04-05 11:12:13"
SHOW CREATE TABLE t;
Table	Create Table
t	CREATE TABLE `t` (
  `a` datetime NOT NULL,
  `b` timestamp GENERATED ALWAYS AS (`a`) VIRTUAL NOT NULL,
  KEY `on_b` (`b`)
) ENGINE=InnoDB DEFAULT CHARSET=utf8mb4 COLLATE=utf8mb4_0900_ai_ci
INSERT IGNORE INTO t (a) VALUES ("2030-04-05 11:12:13");
SELECT * FROM t;
a	b
2030-04-05 11:12:13	2030-04-05 11:12:13
DELETE FROM t;
DELETE IGNORE FROM t;
CHECK TABLE t;
Table	Op	Msg_type	Msg_text
test.t	check	status	OK
DROP TABLE t;
# Testing example of type TIMESTAMP and value "2030-04-05 11:12:13"
SHOW CREATE TABLE t;
Table	Create Table
t	CREATE TABLE `t` (
  `a` timestamp NOT NULL,
  `b` timestamp GENERATED ALWAYS AS (`a`) VIRTUAL NOT NULL,
  KEY `on_b` (`b`)
) ENGINE=InnoDB DEFAULT CHARSET=utf8mb4 COLLATE=utf8mb4_0900_ai_ci
INSERT IGNORE INTO t (a) VALUES ("2030-04-05 11:12:13");
SELECT * FROM t;
a	b
2030-04-05 11:12:13	2030-04-05 11:12:13
DELETE FROM t;
DELETE IGNORE FROM t;
CHECK TABLE t;
Table	Op	Msg_type	Msg_text
test.t	check	status	OK
DROP TABLE t;
# Testing example of type CHAR(40) and value "2000000000000000000000000000000000000"
SHOW CREATE TABLE t;
Table	Create Table
t	CREATE TABLE `t` (
  `a` char(40) NOT NULL,
  `b` timestamp GENERATED ALWAYS AS (`a`) VIRTUAL NOT NULL,
  KEY `on_b` (`b`)
) ENGINE=InnoDB DEFAULT CHARSET=utf8mb4 COLLATE=utf8mb4_0900_ai_ci
INSERT IGNORE INTO t (a) VALUES ("2000000000000000000000000000000000000");
Warnings:
Warning	1264	Out of range value for column 'b' at row 1
SELECT * FROM t;
a	b
2000000000000000000000000000000000000	0000-00-00 00:00:00
Warnings:
Warning	1292	Incorrect datetime value: '2000000000000000000000000000000000000' for column 'b' at row 1
DELETE FROM t;
DELETE IGNORE FROM t;
Warnings:
Warning	1292	Incorrect datetime value: '2000000000000000000000000000000000000' for column 'b' at row 1
Warning	1292	Incorrect datetime value: '2000000000000000000000000000000000000' for column 'b' at row 1
CHECK TABLE t;
Table	Op	Msg_type	Msg_text
test.t	check	status	OK
DROP TABLE t;
# Testing example of type BINARY(45) and value "200000000000000000000000000000000000000000"
SHOW CREATE TABLE t;
Table	Create Table
t	CREATE TABLE `t` (
  `a` binary(45) NOT NULL,
  `b` timestamp GENERATED ALWAYS AS (`a`) VIRTUAL NOT NULL,
  KEY `on_b` (`b`)
) ENGINE=InnoDB DEFAULT CHARSET=utf8mb4 COLLATE=utf8mb4_0900_ai_ci
INSERT IGNORE INTO t (a) VALUES ("200000000000000000000000000000000000000000");
Warnings:
Warning	1265	Data truncated for column 'b' at row 1
SELECT * FROM t;
a	b
200000000000000000000000000000000000000000   	0000-00-00 00:00:00
Warnings:
Warning	1292	Incorrect datetime value: '200000000000000000000000000000000000000000\x00\x00\x00' for column 'b' at row 1
DELETE FROM t;
DELETE IGNORE FROM t;
Warnings:
Warning	1292	Incorrect datetime value: '200000000000000000000000000000000000000000\x00\x00\x00' for column 'b' at row 1
Warning	1292	Incorrect datetime value: '200000000000000000000000000000000000000000\x00\x00\x00' for column 'b' at row 1
CHECK TABLE t;
Table	Op	Msg_type	Msg_text
test.t	check	status	OK
DROP TABLE t;
# Testing example of type VARCHAR(50) and value "2000000000000000000000000000000000000000000000000"
SHOW CREATE TABLE t;
Table	Create Table
t	CREATE TABLE `t` (
  `a` varchar(50) NOT NULL,
  `b` timestamp GENERATED ALWAYS AS (`a`) VIRTUAL NOT NULL,
  KEY `on_b` (`b`)
) ENGINE=InnoDB DEFAULT CHARSET=utf8mb4 COLLATE=utf8mb4_0900_ai_ci
INSERT IGNORE INTO t (a) VALUES ("2000000000000000000000000000000000000000000000000");
Warnings:
Warning	1264	Out of range value for column 'b' at row 1
SELECT * FROM t;
a	b
2000000000000000000000000000000000000000000000000	0000-00-00 00:00:00
Warnings:
Warning	1292	Incorrect datetime value: '2000000000000000000000000000000000000000000000000' for column 'b' at row 1
DELETE FROM t;
DELETE IGNORE FROM t;
Warnings:
Warning	1292	Incorrect datetime value: '2000000000000000000000000000000000000000000000000' for column 'b' at row 1
Warning	1292	Incorrect datetime value: '2000000000000000000000000000000000000000000000000' for column 'b' at row 1
CHECK TABLE t;
Table	Op	Msg_type	Msg_text
test.t	check	status	OK
DROP TABLE t;
# Testing example of type CHAR(24) and value "hello beautiful world"
SHOW CREATE TABLE t;
Table	Create Table
t	CREATE TABLE `t` (
  `a` char(24) NOT NULL,
  `b` timestamp GENERATED ALWAYS AS (`a`) VIRTUAL NOT NULL,
  KEY `on_b` (`b`)
) ENGINE=InnoDB DEFAULT CHARSET=utf8mb4 COLLATE=utf8mb4_0900_ai_ci
INSERT IGNORE INTO t (a) VALUES ("hello beautiful world");
Warnings:
Warning	1265	Data truncated for column 'b' at row 1
SELECT * FROM t;
a	b
hello beautiful world	0000-00-00 00:00:00
Warnings:
Warning	1292	Incorrect datetime value: 'hello beautiful world' for column 'b' at row 1
DELETE FROM t;
DELETE IGNORE FROM t;
Warnings:
Warning	1292	Incorrect datetime value: 'hello beautiful world' for column 'b' at row 1
Warning	1292	Incorrect datetime value: 'hello beautiful world' for column 'b' at row 1
CHECK TABLE t;
Table	Op	Msg_type	Msg_text
test.t	check	status	OK
DROP TABLE t;
# Testing example of type BINARY(12) and value "hello world"
SHOW CREATE TABLE t;
Table	Create Table
t	CREATE TABLE `t` (
  `a` binary(12) NOT NULL,
  `b` timestamp GENERATED ALWAYS AS (`a`) VIRTUAL NOT NULL,
  KEY `on_b` (`b`)
) ENGINE=InnoDB DEFAULT CHARSET=utf8mb4 COLLATE=utf8mb4_0900_ai_ci
INSERT IGNORE INTO t (a) VALUES ("hello world");
Warnings:
Warning	1265	Data truncated for column 'b' at row 1
SELECT * FROM t;
a	b
hello world 	0000-00-00 00:00:00
Warnings:
Warning	1292	Incorrect datetime value: 'hello world\x00' for column 'b' at row 1
DELETE FROM t;
DELETE IGNORE FROM t;
Warnings:
Warning	1292	Incorrect datetime value: 'hello world\x00' for column 'b' at row 1
Warning	1292	Incorrect datetime value: 'hello world\x00' for column 'b' at row 1
CHECK TABLE t;
Table	Op	Msg_type	Msg_text
test.t	check	status	OK
DROP TABLE t;
# Testing example of type VARCHAR(6) and value "hello"
SHOW CREATE TABLE t;
Table	Create Table
t	CREATE TABLE `t` (
  `a` varchar(6) NOT NULL,
  `b` timestamp GENERATED ALWAYS AS (`a`) VIRTUAL NOT NULL,
  KEY `on_b` (`b`)
) ENGINE=InnoDB DEFAULT CHARSET=utf8mb4 COLLATE=utf8mb4_0900_ai_ci
INSERT IGNORE INTO t (a) VALUES ("hello");
Warnings:
Warning	1265	Data truncated for column 'b' at row 1
SELECT * FROM t;
a	b
hello	0000-00-00 00:00:00
Warnings:
Warning	1292	Incorrect datetime value: 'hello' for column 'b' at row 1
DELETE FROM t;
DELETE IGNORE FROM t;
Warnings:
Warning	1292	Incorrect datetime value: 'hello' for column 'b' at row 1
Warning	1292	Incorrect datetime value: 'hello' for column 'b' at row 1
CHECK TABLE t;
Table	Op	Msg_type	Msg_text
test.t	check	status	OK
DROP TABLE t;
# Testing example of type ENUM("up","down") and value "up"
SHOW CREATE TABLE t;
Table	Create Table
t	CREATE TABLE `t` (
  `a` enum('up','down') NOT NULL,
  `b` timestamp GENERATED ALWAYS AS (`a`) VIRTUAL NOT NULL,
  KEY `on_b` (`b`)
) ENGINE=InnoDB DEFAULT CHARSET=utf8mb4 COLLATE=utf8mb4_0900_ai_ci
INSERT IGNORE INTO t (a) VALUES ("up");
Warnings:
Warning	1265	Data truncated for column 'b' at row 1
SELECT * FROM t;
a	b
up	0000-00-00 00:00:00
Warnings:
Warning	1292	Incorrect datetime value: 'up' for column 'b' at row 1
DELETE FROM t;
DELETE IGNORE FROM t;
Warnings:
Warning	1292	Incorrect datetime value: 'up' for column 'b' at row 1
Warning	1292	Incorrect datetime value: 'up' for column 'b' at row 1
CHECK TABLE t;
Table	Op	Msg_type	Msg_text
test.t	check	status	OK
DROP TABLE t;
# Testing example of type SET("up","down") and value "up,down"
SHOW CREATE TABLE t;
Table	Create Table
t	CREATE TABLE `t` (
  `a` set('up','down') NOT NULL,
  `b` timestamp GENERATED ALWAYS AS (`a`) VIRTUAL NOT NULL,
  KEY `on_b` (`b`)
) ENGINE=InnoDB DEFAULT CHARSET=utf8mb4 COLLATE=utf8mb4_0900_ai_ci
INSERT IGNORE INTO t (a) VALUES ("up,down");
Warnings:
Warning	1265	Data truncated for column 'b' at row 1
SELECT * FROM t;
a	b
up,down	0000-00-00 00:00:00
Warnings:
Warning	1292	Incorrect datetime value: 'up,down' for column 'b' at row 1
DELETE FROM t;
DELETE IGNORE FROM t;
Warnings:
Warning	1292	Incorrect datetime value: 'up,down' for column 'b' at row 1
Warning	1292	Incorrect datetime value: 'up,down' for column 'b' at row 1
CHECK TABLE t;
Table	Op	Msg_type	Msg_text
test.t	check	status	OK
DROP TABLE t;
# Testing example of type GEOMETRY and value ST_GeomFromText("POINT(1 1)")
SHOW CREATE TABLE t;
Table	Create Table
t	CREATE TABLE `t` (
  `a` geometry NOT NULL,
  `b` timestamp GENERATED ALWAYS AS (`a`) VIRTUAL NOT NULL,
  KEY `on_b` (`b`)
) ENGINE=InnoDB DEFAULT CHARSET=utf8mb4 COLLATE=utf8mb4_0900_ai_ci
INSERT IGNORE INTO t (a) VALUES (ST_GeomFromText("POINT(1 1)"));
Warnings:
Warning	1265	Data truncated for column 'b' at row 1
SELECT * FROM t;
a	b
             ð?      ð?	0000-00-00 00:00:00
Warnings:
Warning	1292	Incorrect datetime value: '\x00\x00\x00\x00\x01\x01\x00\x00\x00\x00\x00\x00\x00\x00\x00\xF0?\x00\x00\x00\x00\x00\x00\xF0?' for column 'b' at row 1
DELETE FROM t;
DELETE IGNORE FROM t;
Warnings:
Warning	1292	Incorrect datetime value: '\x00\x00\x00\x00\x01\x01\x00\x00\x00\x00\x00\x00\x00\x00\x00\xF0?\x00\x00\x00\x00\x00\x00\xF0?' for column 'b' at row 1
Warning	1292	Incorrect datetime value: '\x00\x00\x00\x00\x01\x01\x00\x00\x00\x00\x00\x00\x00\x00\x00\xF0?\x00\x00\x00\x00\x00\x00\xF0?' for column 'b' at row 1
CHECK TABLE t;
Table	Op	Msg_type	Msg_text
test.t	check	status	OK
DROP TABLE t;
# Testing example of type POINT and value ST_GeomFromText("POINT(1 1)")
SHOW CREATE TABLE t;
Table	Create Table
t	CREATE TABLE `t` (
  `a` point NOT NULL,
  `b` timestamp GENERATED ALWAYS AS (`a`) VIRTUAL NOT NULL,
  KEY `on_b` (`b`)
) ENGINE=InnoDB DEFAULT CHARSET=utf8mb4 COLLATE=utf8mb4_0900_ai_ci
INSERT IGNORE INTO t (a) VALUES (ST_GeomFromText("POINT(1 1)"));
Warnings:
Warning	1265	Data truncated for column 'b' at row 1
SELECT * FROM t;
a	b
             ð?      ð?	0000-00-00 00:00:00
Warnings:
Warning	1292	Incorrect datetime value: '\x00\x00\x00\x00\x01\x01\x00\x00\x00\x00\x00\x00\x00\x00\x00\xF0?\x00\x00\x00\x00\x00\x00\xF0?' for column 'b' at row 1
DELETE FROM t;
DELETE IGNORE FROM t;
Warnings:
Warning	1292	Incorrect datetime value: '\x00\x00\x00\x00\x01\x01\x00\x00\x00\x00\x00\x00\x00\x00\x00\xF0?\x00\x00\x00\x00\x00\x00\xF0?' for column 'b' at row 1
Warning	1292	Incorrect datetime value: '\x00\x00\x00\x00\x01\x01\x00\x00\x00\x00\x00\x00\x00\x00\x00\xF0?\x00\x00\x00\x00\x00\x00\xF0?' for column 'b' at row 1
CHECK TABLE t;
Table	Op	Msg_type	Msg_text
test.t	check	status	OK
DROP TABLE t;
# Testing example of type LINESTRING and value ST_GeomFromText("LINESTRING(0 0,1 1,2 2)")
SHOW CREATE TABLE t;
Table	Create Table
t	CREATE TABLE `t` (
  `a` linestring NOT NULL,
  `b` timestamp GENERATED ALWAYS AS (`a`) VIRTUAL NOT NULL,
  KEY `on_b` (`b`)
) ENGINE=InnoDB DEFAULT CHARSET=utf8mb4 COLLATE=utf8mb4_0900_ai_ci
INSERT IGNORE INTO t (a) VALUES (ST_GeomFromText("LINESTRING(0 0,1 1,2 2)"));
Warnings:
Warning	1265	Data truncated for column 'b' at row 1
SELECT * FROM t;
a	b
                                ð?      ð?       @       @	0000-00-00 00:00:00
Warnings:
Warning	1292	Incorrect datetime value: '\x00\x00\x00\x00\x01\x02\x00\x00\x00\x03\x00\x00\x00\x00\x00\x00\x00\x00\x00\x00\x00\x00\x00\x00\x00\x00\x00\x00\x00\x00\x00\x00' for column 'b' at row 1
DELETE FROM t;
DELETE IGNORE FROM t;
Warnings:
Warning	1292	Incorrect datetime value: '\x00\x00\x00\x00\x01\x02\x00\x00\x00\x03\x00\x00\x00\x00\x00\x00\x00\x00\x00\x00\x00\x00\x00\x00\x00\x00\x00\x00\x00\x00\x00\x00' for column 'b' at row 1
Warning	1292	Incorrect datetime value: '\x00\x00\x00\x00\x01\x02\x00\x00\x00\x03\x00\x00\x00\x00\x00\x00\x00\x00\x00\x00\x00\x00\x00\x00\x00\x00\x00\x00\x00\x00\x00\x00' for column 'b' at row 1
CHECK TABLE t;
Table	Op	Msg_type	Msg_text
test.t	check	status	OK
DROP TABLE t;
# Testing example of type POLYGON and value ST_GeomFromText("POLYGON((0 0,1 0,1 1,0 1,0 0),(5 5,7 5,7 7,5 7,5 5))")
SHOW CREATE TABLE t;
Table	Create Table
t	CREATE TABLE `t` (
  `a` polygon NOT NULL,
  `b` timestamp GENERATED ALWAYS AS (`a`) VIRTUAL NOT NULL,
  KEY `on_b` (`b`)
) ENGINE=InnoDB DEFAULT CHARSET=utf8mb4 COLLATE=utf8mb4_0900_ai_ci
INSERT IGNORE INTO t (a) VALUES (ST_GeomFromText("POLYGON((0 0,1 0,1 1,0 1,0 0),(5 5,7 5,7 7,5 7,5 5))"));
Warnings:
Warning	1265	Data truncated for column 'b' at row 1
SELECT * FROM t;
a	b
                                   ð?              ð?      ð?              ð?                         @      @      @      @      @      @      @      @      @      @	0000-00-00 00:00:00
Warnings:
Warning	1292	Incorrect datetime value: '\x00\x00\x00\x00\x01\x03\x00\x00\x00\x02\x00\x00\x00\x05\x00\x00\x00\x00\x00\x00\x00\x00\x00\x00\x00\x00\x00\x00\x00\x00\x00\x00' for column 'b' at row 1
DELETE FROM t;
DELETE IGNORE FROM t;
Warnings:
Warning	1292	Incorrect datetime value: '\x00\x00\x00\x00\x01\x03\x00\x00\x00\x02\x00\x00\x00\x05\x00\x00\x00\x00\x00\x00\x00\x00\x00\x00\x00\x00\x00\x00\x00\x00\x00\x00' for column 'b' at row 1
Warning	1292	Incorrect datetime value: '\x00\x00\x00\x00\x01\x03\x00\x00\x00\x02\x00\x00\x00\x05\x00\x00\x00\x00\x00\x00\x00\x00\x00\x00\x00\x00\x00\x00\x00\x00\x00\x00' for column 'b' at row 1
CHECK TABLE t;
Table	Op	Msg_type	Msg_text
test.t	check	status	OK
DROP TABLE t;
#
# Testing virtual column of type CHAR(40)
#
# Testing example of type JSON and value "{}"
SHOW CREATE TABLE t;
Table	Create Table
t	CREATE TABLE `t` (
  `a` json NOT NULL,
  `b` char(40) GENERATED ALWAYS AS (`a`) VIRTUAL NOT NULL,
  KEY `on_b` (`b`),
  KEY `on_b_prefix` (`b`(10))
) ENGINE=InnoDB DEFAULT CHARSET=utf8mb4 COLLATE=utf8mb4_0900_ai_ci
INSERT IGNORE INTO t (a) VALUES ("{}");
SELECT * FROM t;
a	b
{}	{}
DELETE FROM t;
DELETE IGNORE FROM t;
CHECK TABLE t;
Table	Op	Msg_type	Msg_text
test.t	check	status	OK
DROP TABLE t;
# Testing example of type JSON and value '["hello beautiful world"]'
SHOW CREATE TABLE t;
Table	Create Table
t	CREATE TABLE `t` (
  `a` json NOT NULL,
  `b` char(40) GENERATED ALWAYS AS (`a`) VIRTUAL NOT NULL,
  KEY `on_b` (`b`),
  KEY `on_b_prefix` (`b`(10))
) ENGINE=InnoDB DEFAULT CHARSET=utf8mb4 COLLATE=utf8mb4_0900_ai_ci
INSERT IGNORE INTO t (a) VALUES ('["hello beautiful world"]');
SELECT * FROM t;
a	b
["hello beautiful world"]	["hello beautiful world"]
DELETE FROM t;
DELETE IGNORE FROM t;
CHECK TABLE t;
Table	Op	Msg_type	Msg_text
test.t	check	status	OK
DROP TABLE t;
# Testing example of type JSON and value "-1"
SHOW CREATE TABLE t;
Table	Create Table
t	CREATE TABLE `t` (
  `a` json NOT NULL,
  `b` char(40) GENERATED ALWAYS AS (`a`) VIRTUAL NOT NULL,
  KEY `on_b` (`b`),
  KEY `on_b_prefix` (`b`(10))
) ENGINE=InnoDB DEFAULT CHARSET=utf8mb4 COLLATE=utf8mb4_0900_ai_ci
INSERT IGNORE INTO t (a) VALUES ("-1");
SELECT * FROM t;
a	b
-1	-1
DELETE FROM t;
DELETE IGNORE FROM t;
CHECK TABLE t;
Table	Op	Msg_type	Msg_text
test.t	check	status	OK
DROP TABLE t;
# Testing example of type TINYINT and value -1
SHOW CREATE TABLE t;
Table	Create Table
t	CREATE TABLE `t` (
  `a` tinyint NOT NULL,
  `b` char(40) GENERATED ALWAYS AS (`a`) VIRTUAL NOT NULL,
  KEY `on_b` (`b`),
  KEY `on_b_prefix` (`b`(10))
) ENGINE=InnoDB DEFAULT CHARSET=utf8mb4 COLLATE=utf8mb4_0900_ai_ci
INSERT IGNORE INTO t (a) VALUES (-1);
SELECT * FROM t;
a	b
-1	-1
DELETE FROM t;
DELETE IGNORE FROM t;
CHECK TABLE t;
Table	Op	Msg_type	Msg_text
test.t	check	status	OK
DROP TABLE t;
# Testing example of type SMALLINT and value -1
SHOW CREATE TABLE t;
Table	Create Table
t	CREATE TABLE `t` (
  `a` smallint NOT NULL,
  `b` char(40) GENERATED ALWAYS AS (`a`) VIRTUAL NOT NULL,
  KEY `on_b` (`b`),
  KEY `on_b_prefix` (`b`(10))
) ENGINE=InnoDB DEFAULT CHARSET=utf8mb4 COLLATE=utf8mb4_0900_ai_ci
INSERT IGNORE INTO t (a) VALUES (-1);
SELECT * FROM t;
a	b
-1	-1
DELETE FROM t;
DELETE IGNORE FROM t;
CHECK TABLE t;
Table	Op	Msg_type	Msg_text
test.t	check	status	OK
DROP TABLE t;
# Testing example of type MEDIUMINT and value -1
SHOW CREATE TABLE t;
Table	Create Table
t	CREATE TABLE `t` (
  `a` mediumint NOT NULL,
  `b` char(40) GENERATED ALWAYS AS (`a`) VIRTUAL NOT NULL,
  KEY `on_b` (`b`),
  KEY `on_b_prefix` (`b`(10))
) ENGINE=InnoDB DEFAULT CHARSET=utf8mb4 COLLATE=utf8mb4_0900_ai_ci
INSERT IGNORE INTO t (a) VALUES (-1);
SELECT * FROM t;
a	b
-1	-1
DELETE FROM t;
DELETE IGNORE FROM t;
CHECK TABLE t;
Table	Op	Msg_type	Msg_text
test.t	check	status	OK
DROP TABLE t;
# Testing example of type INT and value 2000000000
SHOW CREATE TABLE t;
Table	Create Table
t	CREATE TABLE `t` (
  `a` int NOT NULL,
  `b` char(40) GENERATED ALWAYS AS (`a`) VIRTUAL NOT NULL,
  KEY `on_b` (`b`),
  KEY `on_b_prefix` (`b`(10))
) ENGINE=InnoDB DEFAULT CHARSET=utf8mb4 COLLATE=utf8mb4_0900_ai_ci
INSERT IGNORE INTO t (a) VALUES (2000000000);
SELECT * FROM t;
a	b
2000000000	2000000000
DELETE FROM t;
DELETE IGNORE FROM t;
CHECK TABLE t;
Table	Op	Msg_type	Msg_text
test.t	check	status	OK
DROP TABLE t;
# Testing example of type INT and value -2000000000
SHOW CREATE TABLE t;
Table	Create Table
t	CREATE TABLE `t` (
  `a` int NOT NULL,
  `b` char(40) GENERATED ALWAYS AS (`a`) VIRTUAL NOT NULL,
  KEY `on_b` (`b`),
  KEY `on_b_prefix` (`b`(10))
) ENGINE=InnoDB DEFAULT CHARSET=utf8mb4 COLLATE=utf8mb4_0900_ai_ci
INSERT IGNORE INTO t (a) VALUES (-2000000000);
SELECT * FROM t;
a	b
-2000000000	-2000000000
DELETE FROM t;
DELETE IGNORE FROM t;
CHECK TABLE t;
Table	Op	Msg_type	Msg_text
test.t	check	status	OK
DROP TABLE t;
# Testing example of type INT UNSIGNED and value 4000000000
SHOW CREATE TABLE t;
Table	Create Table
t	CREATE TABLE `t` (
  `a` int unsigned NOT NULL,
  `b` char(40) GENERATED ALWAYS AS (`a`) VIRTUAL NOT NULL,
  KEY `on_b` (`b`),
  KEY `on_b_prefix` (`b`(10))
) ENGINE=InnoDB DEFAULT CHARSET=utf8mb4 COLLATE=utf8mb4_0900_ai_ci
INSERT IGNORE INTO t (a) VALUES (4000000000);
SELECT * FROM t;
a	b
4000000000	4000000000
DELETE FROM t;
DELETE IGNORE FROM t;
CHECK TABLE t;
Table	Op	Msg_type	Msg_text
test.t	check	status	OK
DROP TABLE t;
# Testing example of type BIGINT and value 2000000000000000000
SHOW CREATE TABLE t;
Table	Create Table
t	CREATE TABLE `t` (
  `a` bigint NOT NULL,
  `b` char(40) GENERATED ALWAYS AS (`a`) VIRTUAL NOT NULL,
  KEY `on_b` (`b`),
  KEY `on_b_prefix` (`b`(10))
) ENGINE=InnoDB DEFAULT CHARSET=utf8mb4 COLLATE=utf8mb4_0900_ai_ci
INSERT IGNORE INTO t (a) VALUES (2000000000000000000);
SELECT * FROM t;
a	b
2000000000000000000	2000000000000000000
DELETE FROM t;
DELETE IGNORE FROM t;
CHECK TABLE t;
Table	Op	Msg_type	Msg_text
test.t	check	status	OK
DROP TABLE t;
# Testing example of type BIGINT and value -2000000000000000000
SHOW CREATE TABLE t;
Table	Create Table
t	CREATE TABLE `t` (
  `a` bigint NOT NULL,
  `b` char(40) GENERATED ALWAYS AS (`a`) VIRTUAL NOT NULL,
  KEY `on_b` (`b`),
  KEY `on_b_prefix` (`b`(10))
) ENGINE=InnoDB DEFAULT CHARSET=utf8mb4 COLLATE=utf8mb4_0900_ai_ci
INSERT IGNORE INTO t (a) VALUES (-2000000000000000000);
SELECT * FROM t;
a	b
-2000000000000000000	-2000000000000000000
DELETE FROM t;
DELETE IGNORE FROM t;
CHECK TABLE t;
Table	Op	Msg_type	Msg_text
test.t	check	status	OK
DROP TABLE t;
# Testing example of type FLOAT and value -1.23456
SHOW CREATE TABLE t;
Table	Create Table
t	CREATE TABLE `t` (
  `a` float NOT NULL,
  `b` char(40) GENERATED ALWAYS AS (`a`) VIRTUAL NOT NULL,
  KEY `on_b` (`b`),
  KEY `on_b_prefix` (`b`(10))
) ENGINE=InnoDB DEFAULT CHARSET=utf8mb4 COLLATE=utf8mb4_0900_ai_ci
INSERT IGNORE INTO t (a) VALUES (-1.23456);
SELECT * FROM t;
a	b
-1.23456	-1.2345600128173828
DELETE FROM t;
DELETE IGNORE FROM t;
CHECK TABLE t;
Table	Op	Msg_type	Msg_text
test.t	check	status	OK
DROP TABLE t;
# Testing example of type FLOAT and value -1e38
SHOW CREATE TABLE t;
Table	Create Table
t	CREATE TABLE `t` (
  `a` float NOT NULL,
  `b` char(40) GENERATED ALWAYS AS (`a`) VIRTUAL NOT NULL,
  KEY `on_b` (`b`),
  KEY `on_b_prefix` (`b`(10))
) ENGINE=InnoDB DEFAULT CHARSET=utf8mb4 COLLATE=utf8mb4_0900_ai_ci
INSERT IGNORE INTO t (a) VALUES (-1e38);
SELECT * FROM t;
a	b
-1e38	-9.999999680285692e37
DELETE FROM t;
DELETE IGNORE FROM t;
CHECK TABLE t;
Table	Op	Msg_type	Msg_text
test.t	check	status	OK
DROP TABLE t;
# Testing example of type FLOAT and value 1e38
SHOW CREATE TABLE t;
Table	Create Table
t	CREATE TABLE `t` (
  `a` float NOT NULL,
  `b` char(40) GENERATED ALWAYS AS (`a`) VIRTUAL NOT NULL,
  KEY `on_b` (`b`),
  KEY `on_b_prefix` (`b`(10))
) ENGINE=InnoDB DEFAULT CHARSET=utf8mb4 COLLATE=utf8mb4_0900_ai_ci
INSERT IGNORE INTO t (a) VALUES (1e38);
SELECT * FROM t;
a	b
1e38	9.999999680285692e37
DELETE FROM t;
DELETE IGNORE FROM t;
CHECK TABLE t;
Table	Op	Msg_type	Msg_text
test.t	check	status	OK
DROP TABLE t;
# Testing example of type DOUBLE and value -1.23456789012345
SHOW CREATE TABLE t;
Table	Create Table
t	CREATE TABLE `t` (
  `a` double NOT NULL,
  `b` char(40) GENERATED ALWAYS AS (`a`) VIRTUAL NOT NULL,
  KEY `on_b` (`b`),
  KEY `on_b_prefix` (`b`(10))
) ENGINE=InnoDB DEFAULT CHARSET=utf8mb4 COLLATE=utf8mb4_0900_ai_ci
INSERT IGNORE INTO t (a) VALUES (-1.23456789012345);
SELECT * FROM t;
a	b
-1.23456789012345	-1.23456789012345
DELETE FROM t;
DELETE IGNORE FROM t;
CHECK TABLE t;
Table	Op	Msg_type	Msg_text
test.t	check	status	OK
DROP TABLE t;
# Testing example of type DOUBLE and value 1.23456789012345
SHOW CREATE TABLE t;
Table	Create Table
t	CREATE TABLE `t` (
  `a` double NOT NULL,
  `b` char(40) GENERATED ALWAYS AS (`a`) VIRTUAL NOT NULL,
  KEY `on_b` (`b`),
  KEY `on_b_prefix` (`b`(10))
) ENGINE=InnoDB DEFAULT CHARSET=utf8mb4 COLLATE=utf8mb4_0900_ai_ci
INSERT IGNORE INTO t (a) VALUES (1.23456789012345);
SELECT * FROM t;
a	b
1.23456789012345	1.23456789012345
DELETE FROM t;
DELETE IGNORE FROM t;
CHECK TABLE t;
Table	Op	Msg_type	Msg_text
test.t	check	status	OK
DROP TABLE t;
# Testing example of type DOUBLE and value -1e300
SHOW CREATE TABLE t;
Table	Create Table
t	CREATE TABLE `t` (
  `a` double NOT NULL,
  `b` char(40) GENERATED ALWAYS AS (`a`) VIRTUAL NOT NULL,
  KEY `on_b` (`b`),
  KEY `on_b_prefix` (`b`(10))
) ENGINE=InnoDB DEFAULT CHARSET=utf8mb4 COLLATE=utf8mb4_0900_ai_ci
INSERT IGNORE INTO t (a) VALUES (-1e300);
SELECT * FROM t;
a	b
-1e300	-1e300
DELETE FROM t;
DELETE IGNORE FROM t;
CHECK TABLE t;
Table	Op	Msg_type	Msg_text
test.t	check	status	OK
DROP TABLE t;
# Testing example of type DOUBLE and value 1e300
SHOW CREATE TABLE t;
Table	Create Table
t	CREATE TABLE `t` (
  `a` double NOT NULL,
  `b` char(40) GENERATED ALWAYS AS (`a`) VIRTUAL NOT NULL,
  KEY `on_b` (`b`),
  KEY `on_b_prefix` (`b`(10))
) ENGINE=InnoDB DEFAULT CHARSET=utf8mb4 COLLATE=utf8mb4_0900_ai_ci
INSERT IGNORE INTO t (a) VALUES (1e300);
SELECT * FROM t;
a	b
1e300	1e300
DELETE FROM t;
DELETE IGNORE FROM t;
CHECK TABLE t;
Table	Op	Msg_type	Msg_text
test.t	check	status	OK
DROP TABLE t;
# Testing example of type DECIMAL(4,2) and value -10.99
SHOW CREATE TABLE t;
Table	Create Table
t	CREATE TABLE `t` (
  `a` decimal(4,2) NOT NULL,
  `b` char(40) GENERATED ALWAYS AS (`a`) VIRTUAL NOT NULL,
  KEY `on_b` (`b`),
  KEY `on_b_prefix` (`b`(10))
) ENGINE=InnoDB DEFAULT CHARSET=utf8mb4 COLLATE=utf8mb4_0900_ai_ci
INSERT IGNORE INTO t (a) VALUES (-10.99);
SELECT * FROM t;
a	b
-10.99	-10.99
DELETE FROM t;
DELETE IGNORE FROM t;
CHECK TABLE t;
Table	Op	Msg_type	Msg_text
test.t	check	status	OK
DROP TABLE t;
# Testing example of type DECIMAL(34,4) and value 20000000000000000000000000000.0001
SHOW CREATE TABLE t;
Table	Create Table
t	CREATE TABLE `t` (
  `a` decimal(34,4) NOT NULL,
  `b` char(40) GENERATED ALWAYS AS (`a`) VIRTUAL NOT NULL,
  KEY `on_b` (`b`),
  KEY `on_b_prefix` (`b`(10))
) ENGINE=InnoDB DEFAULT CHARSET=utf8mb4 COLLATE=utf8mb4_0900_ai_ci
INSERT IGNORE INTO t (a) VALUES (20000000000000000000000000000.0001);
SELECT * FROM t;
a	b
20000000000000000000000000000.0001	20000000000000000000000000000.0001
DELETE FROM t;
DELETE IGNORE FROM t;
CHECK TABLE t;
Table	Op	Msg_type	Msg_text
test.t	check	status	OK
DROP TABLE t;
# Testing example of type DECIMAL(34,4) and value -20000000000000000000000000000.0001
SHOW CREATE TABLE t;
Table	Create Table
t	CREATE TABLE `t` (
  `a` decimal(34,4) NOT NULL,
  `b` char(40) GENERATED ALWAYS AS (`a`) VIRTUAL NOT NULL,
  KEY `on_b` (`b`),
  KEY `on_b_prefix` (`b`(10))
) ENGINE=InnoDB DEFAULT CHARSET=utf8mb4 COLLATE=utf8mb4_0900_ai_ci
INSERT IGNORE INTO t (a) VALUES (-20000000000000000000000000000.0001);
SELECT * FROM t;
a	b
-20000000000000000000000000000.0001	-20000000000000000000000000000.0001
DELETE FROM t;
DELETE IGNORE FROM t;
CHECK TABLE t;
Table	Op	Msg_type	Msg_text
test.t	check	status	OK
DROP TABLE t;
# Testing example of type BIT(64) and value 0xDEADBEEFC0FEBABE
SHOW CREATE TABLE t;
Table	Create Table
t	CREATE TABLE `t` (
  `a` bit(64) NOT NULL,
  `b` char(40) GENERATED ALWAYS AS (`a`) VIRTUAL NOT NULL,
  KEY `on_b` (`b`),
  KEY `on_b_prefix` (`b`(10))
) ENGINE=InnoDB DEFAULT CHARSET=utf8mb4 COLLATE=utf8mb4_0900_ai_ci
INSERT IGNORE INTO t (a) VALUES (0xDEADBEEFC0FEBABE);
SELECT * FROM t;
a	b
Þ­¾ïÀþº¾	16045690984335325886
DELETE FROM t;
DELETE IGNORE FROM t;
CHECK TABLE t;
Table	Op	Msg_type	Msg_text
test.t	check	status	OK
DROP TABLE t;
# Testing example of type BIT(4) and value 0b1000
SHOW CREATE TABLE t;
Table	Create Table
t	CREATE TABLE `t` (
  `a` bit(4) NOT NULL,
  `b` char(40) GENERATED ALWAYS AS (`a`) VIRTUAL NOT NULL,
  KEY `on_b` (`b`),
  KEY `on_b_prefix` (`b`(10))
) ENGINE=InnoDB DEFAULT CHARSET=utf8mb4 COLLATE=utf8mb4_0900_ai_ci
INSERT IGNORE INTO t (a) VALUES (0b1000);
SELECT * FROM t;
a	b
	8
DELETE FROM t;
DELETE IGNORE FROM t;
CHECK TABLE t;
Table	Op	Msg_type	Msg_text
test.t	check	status	OK
DROP TABLE t;
# Testing example of type YEAR and value 2020
SHOW CREATE TABLE t;
Table	Create Table
t	CREATE TABLE `t` (
  `a` year NOT NULL,
  `b` char(40) GENERATED ALWAYS AS (`a`) VIRTUAL NOT NULL,
  KEY `on_b` (`b`),
  KEY `on_b_prefix` (`b`(10))
) ENGINE=InnoDB DEFAULT CHARSET=utf8mb4 COLLATE=utf8mb4_0900_ai_ci
INSERT IGNORE INTO t (a) VALUES (2020);
SELECT * FROM t;
a	b
2020	2020
DELETE FROM t;
DELETE IGNORE FROM t;
CHECK TABLE t;
Table	Op	Msg_type	Msg_text
test.t	check	status	OK
DROP TABLE t;
# Testing example of type DATE and value "2030-04-05"
SHOW CREATE TABLE t;
Table	Create Table
t	CREATE TABLE `t` (
  `a` date NOT NULL,
  `b` char(40) GENERATED ALWAYS AS (`a`) VIRTUAL NOT NULL,
  KEY `on_b` (`b`),
  KEY `on_b_prefix` (`b`(10))
) ENGINE=InnoDB DEFAULT CHARSET=utf8mb4 COLLATE=utf8mb4_0900_ai_ci
INSERT IGNORE INTO t (a) VALUES ("2030-04-05");
SELECT * FROM t;
a	b
2030-04-05	2030-04-05
DELETE FROM t;
DELETE IGNORE FROM t;
CHECK TABLE t;
Table	Op	Msg_type	Msg_text
test.t	check	status	OK
DROP TABLE t;
# Testing example of type TIME and value "11:12:13"
SHOW CREATE TABLE t;
Table	Create Table
t	CREATE TABLE `t` (
  `a` time NOT NULL,
  `b` char(40) GENERATED ALWAYS AS (`a`) VIRTUAL NOT NULL,
  KEY `on_b` (`b`),
  KEY `on_b_prefix` (`b`(10))
) ENGINE=InnoDB DEFAULT CHARSET=utf8mb4 COLLATE=utf8mb4_0900_ai_ci
INSERT IGNORE INTO t (a) VALUES ("11:12:13");
SELECT * FROM t;
a	b
11:12:13	11:12:13
DELETE FROM t;
DELETE IGNORE FROM t;
CHECK TABLE t;
Table	Op	Msg_type	Msg_text
test.t	check	status	OK
DROP TABLE t;
# Testing example of type DATETIME and value "2030-04-05 11:12:13"
SHOW CREATE TABLE t;
Table	Create Table
t	CREATE TABLE `t` (
  `a` datetime NOT NULL,
  `b` char(40) GENERATED ALWAYS AS (`a`) VIRTUAL NOT NULL,
  KEY `on_b` (`b`),
  KEY `on_b_prefix` (`b`(10))
) ENGINE=InnoDB DEFAULT CHARSET=utf8mb4 COLLATE=utf8mb4_0900_ai_ci
INSERT IGNORE INTO t (a) VALUES ("2030-04-05 11:12:13");
SELECT * FROM t;
a	b
2030-04-05 11:12:13	2030-04-05 11:12:13
DELETE FROM t;
DELETE IGNORE FROM t;
CHECK TABLE t;
Table	Op	Msg_type	Msg_text
test.t	check	status	OK
DROP TABLE t;
# Testing example of type TIMESTAMP and value "2030-04-05 11:12:13"
SHOW CREATE TABLE t;
Table	Create Table
t	CREATE TABLE `t` (
  `a` timestamp NOT NULL,
  `b` char(40) GENERATED ALWAYS AS (`a`) VIRTUAL NOT NULL,
  KEY `on_b` (`b`),
  KEY `on_b_prefix` (`b`(10))
) ENGINE=InnoDB DEFAULT CHARSET=utf8mb4 COLLATE=utf8mb4_0900_ai_ci
INSERT IGNORE INTO t (a) VALUES ("2030-04-05 11:12:13");
SELECT * FROM t;
a	b
2030-04-05 11:12:13	2030-04-05 11:12:13
DELETE FROM t;
DELETE IGNORE FROM t;
CHECK TABLE t;
Table	Op	Msg_type	Msg_text
test.t	check	status	OK
DROP TABLE t;
# Testing example of type CHAR(40) and value "2000000000000000000000000000000000000"
SHOW CREATE TABLE t;
Table	Create Table
t	CREATE TABLE `t` (
  `a` char(40) NOT NULL,
  `b` char(40) GENERATED ALWAYS AS (`a`) VIRTUAL NOT NULL,
  KEY `on_b` (`b`),
  KEY `on_b_prefix` (`b`(10))
) ENGINE=InnoDB DEFAULT CHARSET=utf8mb4 COLLATE=utf8mb4_0900_ai_ci
INSERT IGNORE INTO t (a) VALUES ("2000000000000000000000000000000000000");
SELECT * FROM t;
a	b
2000000000000000000000000000000000000	2000000000000000000000000000000000000
DELETE FROM t;
DELETE IGNORE FROM t;
CHECK TABLE t;
Table	Op	Msg_type	Msg_text
test.t	check	status	OK
DROP TABLE t;
# Testing example of type BINARY(45) and value "200000000000000000000000000000000000000000"
SHOW CREATE TABLE t;
Table	Create Table
t	CREATE TABLE `t` (
  `a` binary(45) NOT NULL,
  `b` char(40) GENERATED ALWAYS AS (`a`) VIRTUAL NOT NULL,
  KEY `on_b` (`b`),
  KEY `on_b_prefix` (`b`(10))
) ENGINE=InnoDB DEFAULT CHARSET=utf8mb4 COLLATE=utf8mb4_0900_ai_ci
INSERT IGNORE INTO t (a) VALUES ("200000000000000000000000000000000000000000");
Warnings:
Warning	1265	Data truncated for column 'b' at row 1
SELECT * FROM t;
a	b
200000000000000000000000000000000000000000   	2000000000000000000000000000000000000000
DELETE FROM t;
DELETE IGNORE FROM t;
CHECK TABLE t;
Table	Op	Msg_type	Msg_text
test.t	check	status	OK
DROP TABLE t;
# Testing example of type VARCHAR(50) and value "2000000000000000000000000000000000000000000000000"
SHOW CREATE TABLE t;
Table	Create Table
t	CREATE TABLE `t` (
  `a` varchar(50) NOT NULL,
  `b` char(40) GENERATED ALWAYS AS (`a`) VIRTUAL NOT NULL,
  KEY `on_b` (`b`),
  KEY `on_b_prefix` (`b`(10))
) ENGINE=InnoDB DEFAULT CHARSET=utf8mb4 COLLATE=utf8mb4_0900_ai_ci
INSERT IGNORE INTO t (a) VALUES ("2000000000000000000000000000000000000000000000000");
Warnings:
Warning	1265	Data truncated for column 'b' at row 1
SELECT * FROM t;
a	b
2000000000000000000000000000000000000000000000000	2000000000000000000000000000000000000000
DELETE FROM t;
DELETE IGNORE FROM t;
CHECK TABLE t;
Table	Op	Msg_type	Msg_text
test.t	check	status	OK
DROP TABLE t;
# Testing example of type CHAR(24) and value "hello beautiful world"
SHOW CREATE TABLE t;
Table	Create Table
t	CREATE TABLE `t` (
  `a` char(24) NOT NULL,
  `b` char(40) GENERATED ALWAYS AS (`a`) VIRTUAL NOT NULL,
  KEY `on_b` (`b`),
  KEY `on_b_prefix` (`b`(10))
) ENGINE=InnoDB DEFAULT CHARSET=utf8mb4 COLLATE=utf8mb4_0900_ai_ci
INSERT IGNORE INTO t (a) VALUES ("hello beautiful world");
SELECT * FROM t;
a	b
hello beautiful world	hello beautiful world
DELETE FROM t;
DELETE IGNORE FROM t;
CHECK TABLE t;
Table	Op	Msg_type	Msg_text
test.t	check	status	OK
DROP TABLE t;
# Testing example of type BINARY(12) and value "hello world"
SHOW CREATE TABLE t;
Table	Create Table
t	CREATE TABLE `t` (
  `a` binary(12) NOT NULL,
  `b` char(40) GENERATED ALWAYS AS (`a`) VIRTUAL NOT NULL,
  KEY `on_b` (`b`),
  KEY `on_b_prefix` (`b`(10))
) ENGINE=InnoDB DEFAULT CHARSET=utf8mb4 COLLATE=utf8mb4_0900_ai_ci
INSERT IGNORE INTO t (a) VALUES ("hello world");
SELECT * FROM t;
a	b
hello world 	hello world 
DELETE FROM t;
DELETE IGNORE FROM t;
CHECK TABLE t;
Table	Op	Msg_type	Msg_text
test.t	check	status	OK
DROP TABLE t;
# Testing example of type VARCHAR(6) and value "hello"
SHOW CREATE TABLE t;
Table	Create Table
t	CREATE TABLE `t` (
  `a` varchar(6) NOT NULL,
  `b` char(40) GENERATED ALWAYS AS (`a`) VIRTUAL NOT NULL,
  KEY `on_b` (`b`),
  KEY `on_b_prefix` (`b`(10))
) ENGINE=InnoDB DEFAULT CHARSET=utf8mb4 COLLATE=utf8mb4_0900_ai_ci
INSERT IGNORE INTO t (a) VALUES ("hello");
SELECT * FROM t;
a	b
hello	hello
DELETE FROM t;
DELETE IGNORE FROM t;
CHECK TABLE t;
Table	Op	Msg_type	Msg_text
test.t	check	status	OK
DROP TABLE t;
# Testing example of type ENUM("up","down") and value "up"
SHOW CREATE TABLE t;
Table	Create Table
t	CREATE TABLE `t` (
  `a` enum('up','down') NOT NULL,
  `b` char(40) GENERATED ALWAYS AS (`a`) VIRTUAL NOT NULL,
  KEY `on_b` (`b`),
  KEY `on_b_prefix` (`b`(10))
) ENGINE=InnoDB DEFAULT CHARSET=utf8mb4 COLLATE=utf8mb4_0900_ai_ci
INSERT IGNORE INTO t (a) VALUES ("up");
SELECT * FROM t;
a	b
up	up
DELETE FROM t;
DELETE IGNORE FROM t;
CHECK TABLE t;
Table	Op	Msg_type	Msg_text
test.t	check	status	OK
DROP TABLE t;
# Testing example of type SET("up","down") and value "up,down"
SHOW CREATE TABLE t;
Table	Create Table
t	CREATE TABLE `t` (
  `a` set('up','down') NOT NULL,
  `b` char(40) GENERATED ALWAYS AS (`a`) VIRTUAL NOT NULL,
  KEY `on_b` (`b`),
  KEY `on_b_prefix` (`b`(10))
) ENGINE=InnoDB DEFAULT CHARSET=utf8mb4 COLLATE=utf8mb4_0900_ai_ci
INSERT IGNORE INTO t (a) VALUES ("up,down");
SELECT * FROM t;
a	b
up,down	up,down
DELETE FROM t;
DELETE IGNORE FROM t;
CHECK TABLE t;
Table	Op	Msg_type	Msg_text
test.t	check	status	OK
DROP TABLE t;
# Testing example of type GEOMETRY and value ST_GeomFromText("POINT(1 1)")
SHOW CREATE TABLE t;
Table	Create Table
t	CREATE TABLE `t` (
  `a` geometry NOT NULL,
  `b` char(40) GENERATED ALWAYS AS (`a`) VIRTUAL NOT NULL,
  KEY `on_b` (`b`),
  KEY `on_b_prefix` (`b`(10))
) ENGINE=InnoDB DEFAULT CHARSET=utf8mb4 COLLATE=utf8mb4_0900_ai_ci
INSERT IGNORE INTO t (a) VALUES (ST_GeomFromText("POINT(1 1)"));
Warnings:
Warning	1366	Incorrect string value: '\xF0?\x00\x00\x00\x00...' for column 'b' at row 1
SELECT * FROM t;
a	b
             ð?      ð?	             
Warnings:
Warning	1366	Incorrect string value: '\xF0?\x00\x00\x00\x00...' for column 'b' at row 1
DELETE FROM t;
DELETE IGNORE FROM t;
Warnings:
Warning	1366	Incorrect string value: '\xF0?\x00\x00\x00\x00...' for column 'b' at row 1
Warning	1366	Incorrect string value: '\xF0?\x00\x00\x00\x00...' for column 'b' at row 1
CHECK TABLE t;
Table	Op	Msg_type	Msg_text
test.t	check	status	OK
DROP TABLE t;
# Testing example of type POINT and value ST_GeomFromText("POINT(1 1)")
SHOW CREATE TABLE t;
Table	Create Table
t	CREATE TABLE `t` (
  `a` point NOT NULL,
  `b` char(40) GENERATED ALWAYS AS (`a`) VIRTUAL NOT NULL,
  KEY `on_b` (`b`),
  KEY `on_b_prefix` (`b`(10))
) ENGINE=InnoDB DEFAULT CHARSET=utf8mb4 COLLATE=utf8mb4_0900_ai_ci
INSERT IGNORE INTO t (a) VALUES (ST_GeomFromText("POINT(1 1)"));
Warnings:
Warning	1366	Incorrect string value: '\xF0?\x00\x00\x00\x00...' for column 'b' at row 1
SELECT * FROM t;
a	b
             ð?      ð?	             
Warnings:
Warning	1366	Incorrect string value: '\xF0?\x00\x00\x00\x00...' for column 'b' at row 1
DELETE FROM t;
DELETE IGNORE FROM t;
Warnings:
Warning	1366	Incorrect string value: '\xF0?\x00\x00\x00\x00...' for column 'b' at row 1
Warning	1366	Incorrect string value: '\xF0?\x00\x00\x00\x00...' for column 'b' at row 1
CHECK TABLE t;
Table	Op	Msg_type	Msg_text
test.t	check	status	OK
DROP TABLE t;
# Testing example of type LINESTRING and value ST_GeomFromText("LINESTRING(0 0,1 1,2 2)")
SHOW CREATE TABLE t;
Table	Create Table
t	CREATE TABLE `t` (
  `a` linestring NOT NULL,
  `b` char(40) GENERATED ALWAYS AS (`a`) VIRTUAL NOT NULL,
  KEY `on_b` (`b`),
  KEY `on_b_prefix` (`b`(10))
) ENGINE=InnoDB DEFAULT CHARSET=utf8mb4 COLLATE=utf8mb4_0900_ai_ci
INSERT IGNORE INTO t (a) VALUES (ST_GeomFromText("LINESTRING(0 0,1 1,2 2)"));
Warnings:
Warning	1366	Incorrect string value: '\xF0?\x00\x00\x00\x00...' for column 'b' at row 1
SELECT * FROM t;
a	b
                                ð?      ð?       @       @	                                
Warnings:
Warning	1366	Incorrect string value: '\xF0?\x00\x00\x00\x00...' for column 'b' at row 1
DELETE FROM t;
DELETE IGNORE FROM t;
Warnings:
Warning	1366	Incorrect string value: '\xF0?\x00\x00\x00\x00...' for column 'b' at row 1
Warning	1366	Incorrect string value: '\xF0?\x00\x00\x00\x00...' for column 'b' at row 1
CHECK TABLE t;
Table	Op	Msg_type	Msg_text
test.t	check	status	OK
DROP TABLE t;
# Testing example of type POLYGON and value ST_GeomFromText("POLYGON((0 0,1 0,1 1,0 1,0 0),(5 5,7 5,7 7,5 7,5 5))")
SHOW CREATE TABLE t;
Table	Create Table
t	CREATE TABLE `t` (
  `a` polygon NOT NULL,
  `b` char(40) GENERATED ALWAYS AS (`a`) VIRTUAL NOT NULL,
  KEY `on_b` (`b`),
  KEY `on_b_prefix` (`b`(10))
) ENGINE=InnoDB DEFAULT CHARSET=utf8mb4 COLLATE=utf8mb4_0900_ai_ci
INSERT IGNORE INTO t (a) VALUES (ST_GeomFromText("POLYGON((0 0,1 0,1 1,0 1,0 0),(5 5,7 5,7 7,5 7,5 5))"));
Warnings:
Warning	1366	Incorrect string value: '\xF0?\x00\x00\x00\x00...' for column 'b' at row 1
SELECT * FROM t;
a	b
                                   ð?              ð?      ð?              ð?                         @      @      @      @      @      @      @      @      @      @	                                   
Warnings:
Warning	1366	Incorrect string value: '\xF0?\x00\x00\x00\x00...' for column 'b' at row 1
DELETE FROM t;
DELETE IGNORE FROM t;
Warnings:
Warning	1366	Incorrect string value: '\xF0?\x00\x00\x00\x00...' for column 'b' at row 1
Warning	1366	Incorrect string value: '\xF0?\x00\x00\x00\x00...' for column 'b' at row 1
CHECK TABLE t;
Table	Op	Msg_type	Msg_text
test.t	check	status	OK
DROP TABLE t;
#
# Testing virtual column of type BINARY(45)
#
# Testing example of type JSON and value "{}"
SHOW CREATE TABLE t;
Table	Create Table
t	CREATE TABLE `t` (
  `a` json NOT NULL,
  `b` binary(45) GENERATED ALWAYS AS (`a`) VIRTUAL NOT NULL,
  KEY `on_b` (`b`),
  KEY `on_b_prefix` (`b`(10))
) ENGINE=InnoDB DEFAULT CHARSET=utf8mb4 COLLATE=utf8mb4_0900_ai_ci
INSERT IGNORE INTO t (a) VALUES ("{}");
SELECT * FROM t;
a	b
{}	{}                                           
DELETE FROM t;
DELETE IGNORE FROM t;
CHECK TABLE t;
Table	Op	Msg_type	Msg_text
test.t	check	status	OK
DROP TABLE t;
# Testing example of type JSON and value '["hello beautiful world"]'
SHOW CREATE TABLE t;
Table	Create Table
t	CREATE TABLE `t` (
  `a` json NOT NULL,
  `b` binary(45) GENERATED ALWAYS AS (`a`) VIRTUAL NOT NULL,
  KEY `on_b` (`b`),
  KEY `on_b_prefix` (`b`(10))
) ENGINE=InnoDB DEFAULT CHARSET=utf8mb4 COLLATE=utf8mb4_0900_ai_ci
INSERT IGNORE INTO t (a) VALUES ('["hello beautiful world"]');
SELECT * FROM t;
a	b
["hello beautiful world"]	["hello beautiful world"]                    
DELETE FROM t;
DELETE IGNORE FROM t;
CHECK TABLE t;
Table	Op	Msg_type	Msg_text
test.t	check	status	OK
DROP TABLE t;
# Testing example of type JSON and value "-1"
SHOW CREATE TABLE t;
Table	Create Table
t	CREATE TABLE `t` (
  `a` json NOT NULL,
  `b` binary(45) GENERATED ALWAYS AS (`a`) VIRTUAL NOT NULL,
  KEY `on_b` (`b`),
  KEY `on_b_prefix` (`b`(10))
) ENGINE=InnoDB DEFAULT CHARSET=utf8mb4 COLLATE=utf8mb4_0900_ai_ci
INSERT IGNORE INTO t (a) VALUES ("-1");
SELECT * FROM t;
a	b
-1	-1                                           
DELETE FROM t;
DELETE IGNORE FROM t;
CHECK TABLE t;
Table	Op	Msg_type	Msg_text
test.t	check	status	OK
DROP TABLE t;
# Testing example of type TINYINT and value -1
SHOW CREATE TABLE t;
Table	Create Table
t	CREATE TABLE `t` (
  `a` tinyint NOT NULL,
  `b` binary(45) GENERATED ALWAYS AS (`a`) VIRTUAL NOT NULL,
  KEY `on_b` (`b`),
  KEY `on_b_prefix` (`b`(10))
) ENGINE=InnoDB DEFAULT CHARSET=utf8mb4 COLLATE=utf8mb4_0900_ai_ci
INSERT IGNORE INTO t (a) VALUES (-1);
SELECT * FROM t;
a	b
-1	-1                                           
DELETE FROM t;
DELETE IGNORE FROM t;
CHECK TABLE t;
Table	Op	Msg_type	Msg_text
test.t	check	status	OK
DROP TABLE t;
# Testing example of type SMALLINT and value -1
SHOW CREATE TABLE t;
Table	Create Table
t	CREATE TABLE `t` (
  `a` smallint NOT NULL,
  `b` binary(45) GENERATED ALWAYS AS (`a`) VIRTUAL NOT NULL,
  KEY `on_b` (`b`),
  KEY `on_b_prefix` (`b`(10))
) ENGINE=InnoDB DEFAULT CHARSET=utf8mb4 COLLATE=utf8mb4_0900_ai_ci
INSERT IGNORE INTO t (a) VALUES (-1);
SELECT * FROM t;
a	b
-1	-1                                           
DELETE FROM t;
DELETE IGNORE FROM t;
CHECK TABLE t;
Table	Op	Msg_type	Msg_text
test.t	check	status	OK
DROP TABLE t;
# Testing example of type MEDIUMINT and value -1
SHOW CREATE TABLE t;
Table	Create Table
t	CREATE TABLE `t` (
  `a` mediumint NOT NULL,
  `b` binary(45) GENERATED ALWAYS AS (`a`) VIRTUAL NOT NULL,
  KEY `on_b` (`b`),
  KEY `on_b_prefix` (`b`(10))
) ENGINE=InnoDB DEFAULT CHARSET=utf8mb4 COLLATE=utf8mb4_0900_ai_ci
INSERT IGNORE INTO t (a) VALUES (-1);
SELECT * FROM t;
a	b
-1	-1                                           
DELETE FROM t;
DELETE IGNORE FROM t;
CHECK TABLE t;
Table	Op	Msg_type	Msg_text
test.t	check	status	OK
DROP TABLE t;
# Testing example of type INT and value 2000000000
SHOW CREATE TABLE t;
Table	Create Table
t	CREATE TABLE `t` (
  `a` int NOT NULL,
  `b` binary(45) GENERATED ALWAYS AS (`a`) VIRTUAL NOT NULL,
  KEY `on_b` (`b`),
  KEY `on_b_prefix` (`b`(10))
) ENGINE=InnoDB DEFAULT CHARSET=utf8mb4 COLLATE=utf8mb4_0900_ai_ci
INSERT IGNORE INTO t (a) VALUES (2000000000);
SELECT * FROM t;
a	b
2000000000	2000000000                                   
DELETE FROM t;
DELETE IGNORE FROM t;
CHECK TABLE t;
Table	Op	Msg_type	Msg_text
test.t	check	status	OK
DROP TABLE t;
# Testing example of type INT and value -2000000000
SHOW CREATE TABLE t;
Table	Create Table
t	CREATE TABLE `t` (
  `a` int NOT NULL,
  `b` binary(45) GENERATED ALWAYS AS (`a`) VIRTUAL NOT NULL,
  KEY `on_b` (`b`),
  KEY `on_b_prefix` (`b`(10))
) ENGINE=InnoDB DEFAULT CHARSET=utf8mb4 COLLATE=utf8mb4_0900_ai_ci
INSERT IGNORE INTO t (a) VALUES (-2000000000);
SELECT * FROM t;
a	b
-2000000000	-2000000000                                  
DELETE FROM t;
DELETE IGNORE FROM t;
CHECK TABLE t;
Table	Op	Msg_type	Msg_text
test.t	check	status	OK
DROP TABLE t;
# Testing example of type INT UNSIGNED and value 4000000000
SHOW CREATE TABLE t;
Table	Create Table
t	CREATE TABLE `t` (
  `a` int unsigned NOT NULL,
  `b` binary(45) GENERATED ALWAYS AS (`a`) VIRTUAL NOT NULL,
  KEY `on_b` (`b`),
  KEY `on_b_prefix` (`b`(10))
) ENGINE=InnoDB DEFAULT CHARSET=utf8mb4 COLLATE=utf8mb4_0900_ai_ci
INSERT IGNORE INTO t (a) VALUES (4000000000);
SELECT * FROM t;
a	b
4000000000	4000000000                                   
DELETE FROM t;
DELETE IGNORE FROM t;
CHECK TABLE t;
Table	Op	Msg_type	Msg_text
test.t	check	status	OK
DROP TABLE t;
# Testing example of type BIGINT and value 2000000000000000000
SHOW CREATE TABLE t;
Table	Create Table
t	CREATE TABLE `t` (
  `a` bigint NOT NULL,
  `b` binary(45) GENERATED ALWAYS AS (`a`) VIRTUAL NOT NULL,
  KEY `on_b` (`b`),
  KEY `on_b_prefix` (`b`(10))
) ENGINE=InnoDB DEFAULT CHARSET=utf8mb4 COLLATE=utf8mb4_0900_ai_ci
INSERT IGNORE INTO t (a) VALUES (2000000000000000000);
SELECT * FROM t;
a	b
2000000000000000000	2000000000000000000                          
DELETE FROM t;
DELETE IGNORE FROM t;
CHECK TABLE t;
Table	Op	Msg_type	Msg_text
test.t	check	status	OK
DROP TABLE t;
# Testing example of type BIGINT and value -2000000000000000000
SHOW CREATE TABLE t;
Table	Create Table
t	CREATE TABLE `t` (
  `a` bigint NOT NULL,
  `b` binary(45) GENERATED ALWAYS AS (`a`) VIRTUAL NOT NULL,
  KEY `on_b` (`b`),
  KEY `on_b_prefix` (`b`(10))
) ENGINE=InnoDB DEFAULT CHARSET=utf8mb4 COLLATE=utf8mb4_0900_ai_ci
INSERT IGNORE INTO t (a) VALUES (-2000000000000000000);
SELECT * FROM t;
a	b
-2000000000000000000	-2000000000000000000                         
DELETE FROM t;
DELETE IGNORE FROM t;
CHECK TABLE t;
Table	Op	Msg_type	Msg_text
test.t	check	status	OK
DROP TABLE t;
# Testing example of type FLOAT and value -1.23456
SHOW CREATE TABLE t;
Table	Create Table
t	CREATE TABLE `t` (
  `a` float NOT NULL,
  `b` binary(45) GENERATED ALWAYS AS (`a`) VIRTUAL NOT NULL,
  KEY `on_b` (`b`),
  KEY `on_b_prefix` (`b`(10))
) ENGINE=InnoDB DEFAULT CHARSET=utf8mb4 COLLATE=utf8mb4_0900_ai_ci
INSERT IGNORE INTO t (a) VALUES (-1.23456);
SELECT * FROM t;
a	b
-1.23456	-1.2345600128173828                          
DELETE FROM t;
DELETE IGNORE FROM t;
CHECK TABLE t;
Table	Op	Msg_type	Msg_text
test.t	check	status	OK
DROP TABLE t;
# Testing example of type FLOAT and value -1e38
SHOW CREATE TABLE t;
Table	Create Table
t	CREATE TABLE `t` (
  `a` float NOT NULL,
  `b` binary(45) GENERATED ALWAYS AS (`a`) VIRTUAL NOT NULL,
  KEY `on_b` (`b`),
  KEY `on_b_prefix` (`b`(10))
) ENGINE=InnoDB DEFAULT CHARSET=utf8mb4 COLLATE=utf8mb4_0900_ai_ci
INSERT IGNORE INTO t (a) VALUES (-1e38);
SELECT * FROM t;
a	b
-1e38	-9.999999680285692e37                        
DELETE FROM t;
DELETE IGNORE FROM t;
CHECK TABLE t;
Table	Op	Msg_type	Msg_text
test.t	check	status	OK
DROP TABLE t;
# Testing example of type FLOAT and value 1e38
SHOW CREATE TABLE t;
Table	Create Table
t	CREATE TABLE `t` (
  `a` float NOT NULL,
  `b` binary(45) GENERATED ALWAYS AS (`a`) VIRTUAL NOT NULL,
  KEY `on_b` (`b`),
  KEY `on_b_prefix` (`b`(10))
) ENGINE=InnoDB DEFAULT CHARSET=utf8mb4 COLLATE=utf8mb4_0900_ai_ci
INSERT IGNORE INTO t (a) VALUES (1e38);
SELECT * FROM t;
a	b
1e38	9.999999680285692e37                         
DELETE FROM t;
DELETE IGNORE FROM t;
CHECK TABLE t;
Table	Op	Msg_type	Msg_text
test.t	check	status	OK
DROP TABLE t;
# Testing example of type DOUBLE and value -1.23456789012345
SHOW CREATE TABLE t;
Table	Create Table
t	CREATE TABLE `t` (
  `a` double NOT NULL,
  `b` binary(45) GENERATED ALWAYS AS (`a`) VIRTUAL NOT NULL,
  KEY `on_b` (`b`),
  KEY `on_b_prefix` (`b`(10))
) ENGINE=InnoDB DEFAULT CHARSET=utf8mb4 COLLATE=utf8mb4_0900_ai_ci
INSERT IGNORE INTO t (a) VALUES (-1.23456789012345);
SELECT * FROM t;
a	b
-1.23456789012345	-1.23456789012345                            
DELETE FROM t;
DELETE IGNORE FROM t;
CHECK TABLE t;
Table	Op	Msg_type	Msg_text
test.t	check	status	OK
DROP TABLE t;
# Testing example of type DOUBLE and value 1.23456789012345
SHOW CREATE TABLE t;
Table	Create Table
t	CREATE TABLE `t` (
  `a` double NOT NULL,
  `b` binary(45) GENERATED ALWAYS AS (`a`) VIRTUAL NOT NULL,
  KEY `on_b` (`b`),
  KEY `on_b_prefix` (`b`(10))
) ENGINE=InnoDB DEFAULT CHARSET=utf8mb4 COLLATE=utf8mb4_0900_ai_ci
INSERT IGNORE INTO t (a) VALUES (1.23456789012345);
SELECT * FROM t;
a	b
1.23456789012345	1.23456789012345                             
DELETE FROM t;
DELETE IGNORE FROM t;
CHECK TABLE t;
Table	Op	Msg_type	Msg_text
test.t	check	status	OK
DROP TABLE t;
# Testing example of type DOUBLE and value -1e300
SHOW CREATE TABLE t;
Table	Create Table
t	CREATE TABLE `t` (
  `a` double NOT NULL,
  `b` binary(45) GENERATED ALWAYS AS (`a`) VIRTUAL NOT NULL,
  KEY `on_b` (`b`),
  KEY `on_b_prefix` (`b`(10))
) ENGINE=InnoDB DEFAULT CHARSET=utf8mb4 COLLATE=utf8mb4_0900_ai_ci
INSERT IGNORE INTO t (a) VALUES (-1e300);
SELECT * FROM t;
a	b
-1e300	-1e300                                       
DELETE FROM t;
DELETE IGNORE FROM t;
CHECK TABLE t;
Table	Op	Msg_type	Msg_text
test.t	check	status	OK
DROP TABLE t;
# Testing example of type DOUBLE and value 1e300
SHOW CREATE TABLE t;
Table	Create Table
t	CREATE TABLE `t` (
  `a` double NOT NULL,
  `b` binary(45) GENERATED ALWAYS AS (`a`) VIRTUAL NOT NULL,
  KEY `on_b` (`b`),
  KEY `on_b_prefix` (`b`(10))
) ENGINE=InnoDB DEFAULT CHARSET=utf8mb4 COLLATE=utf8mb4_0900_ai_ci
INSERT IGNORE INTO t (a) VALUES (1e300);
SELECT * FROM t;
a	b
1e300	1e300                                        
DELETE FROM t;
DELETE IGNORE FROM t;
CHECK TABLE t;
Table	Op	Msg_type	Msg_text
test.t	check	status	OK
DROP TABLE t;
# Testing example of type DECIMAL(4,2) and value -10.99
SHOW CREATE TABLE t;
Table	Create Table
t	CREATE TABLE `t` (
  `a` decimal(4,2) NOT NULL,
  `b` binary(45) GENERATED ALWAYS AS (`a`) VIRTUAL NOT NULL,
  KEY `on_b` (`b`),
  KEY `on_b_prefix` (`b`(10))
) ENGINE=InnoDB DEFAULT CHARSET=utf8mb4 COLLATE=utf8mb4_0900_ai_ci
INSERT IGNORE INTO t (a) VALUES (-10.99);
SELECT * FROM t;
a	b
-10.99	-10.99                                       
DELETE FROM t;
DELETE IGNORE FROM t;
CHECK TABLE t;
Table	Op	Msg_type	Msg_text
test.t	check	status	OK
DROP TABLE t;
# Testing example of type DECIMAL(34,4) and value 20000000000000000000000000000.0001
SHOW CREATE TABLE t;
Table	Create Table
t	CREATE TABLE `t` (
  `a` decimal(34,4) NOT NULL,
  `b` binary(45) GENERATED ALWAYS AS (`a`) VIRTUAL NOT NULL,
  KEY `on_b` (`b`),
  KEY `on_b_prefix` (`b`(10))
) ENGINE=InnoDB DEFAULT CHARSET=utf8mb4 COLLATE=utf8mb4_0900_ai_ci
INSERT IGNORE INTO t (a) VALUES (20000000000000000000000000000.0001);
SELECT * FROM t;
a	b
20000000000000000000000000000.0001	20000000000000000000000000000.0001           
DELETE FROM t;
DELETE IGNORE FROM t;
CHECK TABLE t;
Table	Op	Msg_type	Msg_text
test.t	check	status	OK
DROP TABLE t;
# Testing example of type DECIMAL(34,4) and value -20000000000000000000000000000.0001
SHOW CREATE TABLE t;
Table	Create Table
t	CREATE TABLE `t` (
  `a` decimal(34,4) NOT NULL,
  `b` binary(45) GENERATED ALWAYS AS (`a`) VIRTUAL NOT NULL,
  KEY `on_b` (`b`),
  KEY `on_b_prefix` (`b`(10))
) ENGINE=InnoDB DEFAULT CHARSET=utf8mb4 COLLATE=utf8mb4_0900_ai_ci
INSERT IGNORE INTO t (a) VALUES (-20000000000000000000000000000.0001);
SELECT * FROM t;
a	b
-20000000000000000000000000000.0001	-20000000000000000000000000000.0001          
DELETE FROM t;
DELETE IGNORE FROM t;
CHECK TABLE t;
Table	Op	Msg_type	Msg_text
test.t	check	status	OK
DROP TABLE t;
# Testing example of type BIT(64) and value 0xDEADBEEFC0FEBABE
SHOW CREATE TABLE t;
Table	Create Table
t	CREATE TABLE `t` (
  `a` bit(64) NOT NULL,
  `b` binary(45) GENERATED ALWAYS AS (`a`) VIRTUAL NOT NULL,
  KEY `on_b` (`b`),
  KEY `on_b_prefix` (`b`(10))
) ENGINE=InnoDB DEFAULT CHARSET=utf8mb4 COLLATE=utf8mb4_0900_ai_ci
INSERT IGNORE INTO t (a) VALUES (0xDEADBEEFC0FEBABE);
SELECT * FROM t;
a	b
Þ­¾ïÀþº¾	16045690984335325886                         
DELETE FROM t;
DELETE IGNORE FROM t;
CHECK TABLE t;
Table	Op	Msg_type	Msg_text
test.t	check	status	OK
DROP TABLE t;
# Testing example of type BIT(4) and value 0b1000
SHOW CREATE TABLE t;
Table	Create Table
t	CREATE TABLE `t` (
  `a` bit(4) NOT NULL,
  `b` binary(45) GENERATED ALWAYS AS (`a`) VIRTUAL NOT NULL,
  KEY `on_b` (`b`),
  KEY `on_b_prefix` (`b`(10))
) ENGINE=InnoDB DEFAULT CHARSET=utf8mb4 COLLATE=utf8mb4_0900_ai_ci
INSERT IGNORE INTO t (a) VALUES (0b1000);
SELECT * FROM t;
a	b
	8                                            
DELETE FROM t;
DELETE IGNORE FROM t;
CHECK TABLE t;
Table	Op	Msg_type	Msg_text
test.t	check	status	OK
DROP TABLE t;
# Testing example of type YEAR and value 2020
SHOW CREATE TABLE t;
Table	Create Table
t	CREATE TABLE `t` (
  `a` year NOT NULL,
  `b` binary(45) GENERATED ALWAYS AS (`a`) VIRTUAL NOT NULL,
  KEY `on_b` (`b`),
  KEY `on_b_prefix` (`b`(10))
) ENGINE=InnoDB DEFAULT CHARSET=utf8mb4 COLLATE=utf8mb4_0900_ai_ci
INSERT IGNORE INTO t (a) VALUES (2020);
SELECT * FROM t;
a	b
2020	2020                                         
DELETE FROM t;
DELETE IGNORE FROM t;
CHECK TABLE t;
Table	Op	Msg_type	Msg_text
test.t	check	status	OK
DROP TABLE t;
# Testing example of type DATE and value "2030-04-05"
SHOW CREATE TABLE t;
Table	Create Table
t	CREATE TABLE `t` (
  `a` date NOT NULL,
  `b` binary(45) GENERATED ALWAYS AS (`a`) VIRTUAL NOT NULL,
  KEY `on_b` (`b`),
  KEY `on_b_prefix` (`b`(10))
) ENGINE=InnoDB DEFAULT CHARSET=utf8mb4 COLLATE=utf8mb4_0900_ai_ci
INSERT IGNORE INTO t (a) VALUES ("2030-04-05");
SELECT * FROM t;
a	b
2030-04-05	2030-04-05                                   
DELETE FROM t;
DELETE IGNORE FROM t;
CHECK TABLE t;
Table	Op	Msg_type	Msg_text
test.t	check	status	OK
DROP TABLE t;
# Testing example of type TIME and value "11:12:13"
SHOW CREATE TABLE t;
Table	Create Table
t	CREATE TABLE `t` (
  `a` time NOT NULL,
  `b` binary(45) GENERATED ALWAYS AS (`a`) VIRTUAL NOT NULL,
  KEY `on_b` (`b`),
  KEY `on_b_prefix` (`b`(10))
) ENGINE=InnoDB DEFAULT CHARSET=utf8mb4 COLLATE=utf8mb4_0900_ai_ci
INSERT IGNORE INTO t (a) VALUES ("11:12:13");
SELECT * FROM t;
a	b
11:12:13	11:12:13                                     
DELETE FROM t;
DELETE IGNORE FROM t;
CHECK TABLE t;
Table	Op	Msg_type	Msg_text
test.t	check	status	OK
DROP TABLE t;
# Testing example of type DATETIME and value "2030-04-05 11:12:13"
SHOW CREATE TABLE t;
Table	Create Table
t	CREATE TABLE `t` (
  `a` datetime NOT NULL,
  `b` binary(45) GENERATED ALWAYS AS (`a`) VIRTUAL NOT NULL,
  KEY `on_b` (`b`),
  KEY `on_b_prefix` (`b`(10))
) ENGINE=InnoDB DEFAULT CHARSET=utf8mb4 COLLATE=utf8mb4_0900_ai_ci
INSERT IGNORE INTO t (a) VALUES ("2030-04-05 11:12:13");
SELECT * FROM t;
a	b
2030-04-05 11:12:13	2030-04-05 11:12:13                          
DELETE FROM t;
DELETE IGNORE FROM t;
CHECK TABLE t;
Table	Op	Msg_type	Msg_text
test.t	check	status	OK
DROP TABLE t;
# Testing example of type TIMESTAMP and value "2030-04-05 11:12:13"
SHOW CREATE TABLE t;
Table	Create Table
t	CREATE TABLE `t` (
  `a` timestamp NOT NULL,
  `b` binary(45) GENERATED ALWAYS AS (`a`) VIRTUAL NOT NULL,
  KEY `on_b` (`b`),
  KEY `on_b_prefix` (`b`(10))
) ENGINE=InnoDB DEFAULT CHARSET=utf8mb4 COLLATE=utf8mb4_0900_ai_ci
INSERT IGNORE INTO t (a) VALUES ("2030-04-05 11:12:13");
SELECT * FROM t;
a	b
2030-04-05 11:12:13	2030-04-05 11:12:13                          
DELETE FROM t;
DELETE IGNORE FROM t;
CHECK TABLE t;
Table	Op	Msg_type	Msg_text
test.t	check	status	OK
DROP TABLE t;
# Testing example of type CHAR(40) and value "2000000000000000000000000000000000000"
SHOW CREATE TABLE t;
Table	Create Table
t	CREATE TABLE `t` (
  `a` char(40) NOT NULL,
  `b` binary(45) GENERATED ALWAYS AS (`a`) VIRTUAL NOT NULL,
  KEY `on_b` (`b`),
  KEY `on_b_prefix` (`b`(10))
) ENGINE=InnoDB DEFAULT CHARSET=utf8mb4 COLLATE=utf8mb4_0900_ai_ci
INSERT IGNORE INTO t (a) VALUES ("2000000000000000000000000000000000000");
SELECT * FROM t;
a	b
2000000000000000000000000000000000000	2000000000000000000000000000000000000        
DELETE FROM t;
DELETE IGNORE FROM t;
CHECK TABLE t;
Table	Op	Msg_type	Msg_text
test.t	check	status	OK
DROP TABLE t;
# Testing example of type BINARY(45) and value "200000000000000000000000000000000000000000"
SHOW CREATE TABLE t;
Table	Create Table
t	CREATE TABLE `t` (
  `a` binary(45) NOT NULL,
  `b` binary(45) GENERATED ALWAYS AS (`a`) VIRTUAL NOT NULL,
  KEY `on_b` (`b`),
  KEY `on_b_prefix` (`b`(10))
) ENGINE=InnoDB DEFAULT CHARSET=utf8mb4 COLLATE=utf8mb4_0900_ai_ci
INSERT IGNORE INTO t (a) VALUES ("200000000000000000000000000000000000000000");
SELECT * FROM t;
a	b
200000000000000000000000000000000000000000   	200000000000000000000000000000000000000000   
DELETE FROM t;
DELETE IGNORE FROM t;
CHECK TABLE t;
Table	Op	Msg_type	Msg_text
test.t	check	status	OK
DROP TABLE t;
# Testing example of type VARCHAR(50) and value "2000000000000000000000000000000000000000000000000"
SHOW CREATE TABLE t;
Table	Create Table
t	CREATE TABLE `t` (
  `a` varchar(50) NOT NULL,
  `b` binary(45) GENERATED ALWAYS AS (`a`) VIRTUAL NOT NULL,
  KEY `on_b` (`b`),
  KEY `on_b_prefix` (`b`(10))
) ENGINE=InnoDB DEFAULT CHARSET=utf8mb4 COLLATE=utf8mb4_0900_ai_ci
INSERT IGNORE INTO t (a) VALUES ("2000000000000000000000000000000000000000000000000");
Warnings:
Warning	1265	Data truncated for column 'b' at row 1
SELECT * FROM t;
a	b
2000000000000000000000000000000000000000000000000	200000000000000000000000000000000000000000000
DELETE FROM t;
DELETE IGNORE FROM t;
CHECK TABLE t;
Table	Op	Msg_type	Msg_text
test.t	check	status	OK
DROP TABLE t;
# Testing example of type CHAR(24) and value "hello beautiful world"
SHOW CREATE TABLE t;
Table	Create Table
t	CREATE TABLE `t` (
  `a` char(24) NOT NULL,
  `b` binary(45) GENERATED ALWAYS AS (`a`) VIRTUAL NOT NULL,
  KEY `on_b` (`b`),
  KEY `on_b_prefix` (`b`(10))
) ENGINE=InnoDB DEFAULT CHARSET=utf8mb4 COLLATE=utf8mb4_0900_ai_ci
INSERT IGNORE INTO t (a) VALUES ("hello beautiful world");
SELECT * FROM t;
a	b
hello beautiful world	hello beautiful world                        
DELETE FROM t;
DELETE IGNORE FROM t;
CHECK TABLE t;
Table	Op	Msg_type	Msg_text
test.t	check	status	OK
DROP TABLE t;
# Testing example of type BINARY(12) and value "hello world"
SHOW CREATE TABLE t;
Table	Create Table
t	CREATE TABLE `t` (
  `a` binary(12) NOT NULL,
  `b` binary(45) GENERATED ALWAYS AS (`a`) VIRTUAL NOT NULL,
  KEY `on_b` (`b`),
  KEY `on_b_prefix` (`b`(10))
) ENGINE=InnoDB DEFAULT CHARSET=utf8mb4 COLLATE=utf8mb4_0900_ai_ci
INSERT IGNORE INTO t (a) VALUES ("hello world");
SELECT * FROM t;
a	b
hello world 	hello world                                  
DELETE FROM t;
DELETE IGNORE FROM t;
CHECK TABLE t;
Table	Op	Msg_type	Msg_text
test.t	check	status	OK
DROP TABLE t;
# Testing example of type VARCHAR(6) and value "hello"
SHOW CREATE TABLE t;
Table	Create Table
t	CREATE TABLE `t` (
  `a` varchar(6) NOT NULL,
  `b` binary(45) GENERATED ALWAYS AS (`a`) VIRTUAL NOT NULL,
  KEY `on_b` (`b`),
  KEY `on_b_prefix` (`b`(10))
) ENGINE=InnoDB DEFAULT CHARSET=utf8mb4 COLLATE=utf8mb4_0900_ai_ci
INSERT IGNORE INTO t (a) VALUES ("hello");
SELECT * FROM t;
a	b
hello	hello                                        
DELETE FROM t;
DELETE IGNORE FROM t;
CHECK TABLE t;
Table	Op	Msg_type	Msg_text
test.t	check	status	OK
DROP TABLE t;
# Testing example of type ENUM("up","down") and value "up"
SHOW CREATE TABLE t;
Table	Create Table
t	CREATE TABLE `t` (
  `a` enum('up','down') NOT NULL,
  `b` binary(45) GENERATED ALWAYS AS (`a`) VIRTUAL NOT NULL,
  KEY `on_b` (`b`),
  KEY `on_b_prefix` (`b`(10))
) ENGINE=InnoDB DEFAULT CHARSET=utf8mb4 COLLATE=utf8mb4_0900_ai_ci
INSERT IGNORE INTO t (a) VALUES ("up");
SELECT * FROM t;
a	b
up	up                                           
DELETE FROM t;
DELETE IGNORE FROM t;
CHECK TABLE t;
Table	Op	Msg_type	Msg_text
test.t	check	status	OK
DROP TABLE t;
# Testing example of type SET("up","down") and value "up,down"
SHOW CREATE TABLE t;
Table	Create Table
t	CREATE TABLE `t` (
  `a` set('up','down') NOT NULL,
  `b` binary(45) GENERATED ALWAYS AS (`a`) VIRTUAL NOT NULL,
  KEY `on_b` (`b`),
  KEY `on_b_prefix` (`b`(10))
) ENGINE=InnoDB DEFAULT CHARSET=utf8mb4 COLLATE=utf8mb4_0900_ai_ci
INSERT IGNORE INTO t (a) VALUES ("up,down");
SELECT * FROM t;
a	b
up,down	up,down                                      
DELETE FROM t;
DELETE IGNORE FROM t;
CHECK TABLE t;
Table	Op	Msg_type	Msg_text
test.t	check	status	OK
DROP TABLE t;
# Testing example of type GEOMETRY and value ST_GeomFromText("POINT(1 1)")
SHOW CREATE TABLE t;
Table	Create Table
t	CREATE TABLE `t` (
  `a` geometry NOT NULL,
  `b` binary(45) GENERATED ALWAYS AS (`a`) VIRTUAL NOT NULL,
  KEY `on_b` (`b`),
  KEY `on_b_prefix` (`b`(10))
) ENGINE=InnoDB DEFAULT CHARSET=utf8mb4 COLLATE=utf8mb4_0900_ai_ci
INSERT IGNORE INTO t (a) VALUES (ST_GeomFromText("POINT(1 1)"));
SELECT * FROM t;
a	b
             ð?      ð?	             ð?      ð?                    
DELETE FROM t;
DELETE IGNORE FROM t;
CHECK TABLE t;
Table	Op	Msg_type	Msg_text
test.t	check	status	OK
DROP TABLE t;
# Testing example of type POINT and value ST_GeomFromText("POINT(1 1)")
SHOW CREATE TABLE t;
Table	Create Table
t	CREATE TABLE `t` (
  `a` point NOT NULL,
  `b` binary(45) GENERATED ALWAYS AS (`a`) VIRTUAL NOT NULL,
  KEY `on_b` (`b`),
  KEY `on_b_prefix` (`b`(10))
) ENGINE=InnoDB DEFAULT CHARSET=utf8mb4 COLLATE=utf8mb4_0900_ai_ci
INSERT IGNORE INTO t (a) VALUES (ST_GeomFromText("POINT(1 1)"));
SELECT * FROM t;
a	b
             ð?      ð?	             ð?      ð?                    
DELETE FROM t;
DELETE IGNORE FROM t;
CHECK TABLE t;
Table	Op	Msg_type	Msg_text
test.t	check	status	OK
DROP TABLE t;
# Testing example of type LINESTRING and value ST_GeomFromText("LINESTRING(0 0,1 1,2 2)")
SHOW CREATE TABLE t;
Table	Create Table
t	CREATE TABLE `t` (
  `a` linestring NOT NULL,
  `b` binary(45) GENERATED ALWAYS AS (`a`) VIRTUAL NOT NULL,
  KEY `on_b` (`b`),
  KEY `on_b_prefix` (`b`(10))
) ENGINE=InnoDB DEFAULT CHARSET=utf8mb4 COLLATE=utf8mb4_0900_ai_ci
INSERT IGNORE INTO t (a) VALUES (ST_GeomFromText("LINESTRING(0 0,1 1,2 2)"));
Warnings:
Warning	1265	Data truncated for column 'b' at row 1
SELECT * FROM t;
a	b
                                ð?      ð?       @       @	                                ð?      ð?
DELETE FROM t;
DELETE IGNORE FROM t;
CHECK TABLE t;
Table	Op	Msg_type	Msg_text
test.t	check	status	OK
DROP TABLE t;
# Testing example of type POLYGON and value ST_GeomFromText("POLYGON((0 0,1 0,1 1,0 1,0 0),(5 5,7 5,7 7,5 7,5 5))")
SHOW CREATE TABLE t;
Table	Create Table
t	CREATE TABLE `t` (
  `a` polygon NOT NULL,
  `b` binary(45) GENERATED ALWAYS AS (`a`) VIRTUAL NOT NULL,
  KEY `on_b` (`b`),
  KEY `on_b_prefix` (`b`(10))
) ENGINE=InnoDB DEFAULT CHARSET=utf8mb4 COLLATE=utf8mb4_0900_ai_ci
INSERT IGNORE INTO t (a) VALUES (ST_GeomFromText("POLYGON((0 0,1 0,1 1,0 1,0 0),(5 5,7 5,7 7,5 7,5 5))"));
Warnings:
Warning	1265	Data truncated for column 'b' at row 1
SELECT * FROM t;
a	b
                                   ð?              ð?      ð?              ð?                         @      @      @      @      @      @      @      @      @      @	                                   ð?    
DELETE FROM t;
DELETE IGNORE FROM t;
CHECK TABLE t;
Table	Op	Msg_type	Msg_text
test.t	check	status	OK
DROP TABLE t;
#
# Testing virtual column of type VARCHAR(50)
#
# Testing example of type JSON and value "{}"
SHOW CREATE TABLE t;
Table	Create Table
t	CREATE TABLE `t` (
  `a` json NOT NULL,
  `b` varchar(50) GENERATED ALWAYS AS (`a`) VIRTUAL NOT NULL,
  KEY `on_b` (`b`),
  KEY `on_b_prefix` (`b`(10))
) ENGINE=InnoDB DEFAULT CHARSET=utf8mb4 COLLATE=utf8mb4_0900_ai_ci
INSERT IGNORE INTO t (a) VALUES ("{}");
SELECT * FROM t;
a	b
{}	{}
DELETE FROM t;
DELETE IGNORE FROM t;
CHECK TABLE t;
Table	Op	Msg_type	Msg_text
test.t	check	status	OK
DROP TABLE t;
# Testing example of type JSON and value '["hello beautiful world"]'
SHOW CREATE TABLE t;
Table	Create Table
t	CREATE TABLE `t` (
  `a` json NOT NULL,
  `b` varchar(50) GENERATED ALWAYS AS (`a`) VIRTUAL NOT NULL,
  KEY `on_b` (`b`),
  KEY `on_b_prefix` (`b`(10))
) ENGINE=InnoDB DEFAULT CHARSET=utf8mb4 COLLATE=utf8mb4_0900_ai_ci
INSERT IGNORE INTO t (a) VALUES ('["hello beautiful world"]');
SELECT * FROM t;
a	b
["hello beautiful world"]	["hello beautiful world"]
DELETE FROM t;
DELETE IGNORE FROM t;
CHECK TABLE t;
Table	Op	Msg_type	Msg_text
test.t	check	status	OK
DROP TABLE t;
# Testing example of type JSON and value "-1"
SHOW CREATE TABLE t;
Table	Create Table
t	CREATE TABLE `t` (
  `a` json NOT NULL,
  `b` varchar(50) GENERATED ALWAYS AS (`a`) VIRTUAL NOT NULL,
  KEY `on_b` (`b`),
  KEY `on_b_prefix` (`b`(10))
) ENGINE=InnoDB DEFAULT CHARSET=utf8mb4 COLLATE=utf8mb4_0900_ai_ci
INSERT IGNORE INTO t (a) VALUES ("-1");
SELECT * FROM t;
a	b
-1	-1
DELETE FROM t;
DELETE IGNORE FROM t;
CHECK TABLE t;
Table	Op	Msg_type	Msg_text
test.t	check	status	OK
DROP TABLE t;
# Testing example of type TINYINT and value -1
SHOW CREATE TABLE t;
Table	Create Table
t	CREATE TABLE `t` (
  `a` tinyint NOT NULL,
  `b` varchar(50) GENERATED ALWAYS AS (`a`) VIRTUAL NOT NULL,
  KEY `on_b` (`b`),
  KEY `on_b_prefix` (`b`(10))
) ENGINE=InnoDB DEFAULT CHARSET=utf8mb4 COLLATE=utf8mb4_0900_ai_ci
INSERT IGNORE INTO t (a) VALUES (-1);
SELECT * FROM t;
a	b
-1	-1
DELETE FROM t;
DELETE IGNORE FROM t;
CHECK TABLE t;
Table	Op	Msg_type	Msg_text
test.t	check	status	OK
DROP TABLE t;
# Testing example of type SMALLINT and value -1
SHOW CREATE TABLE t;
Table	Create Table
t	CREATE TABLE `t` (
  `a` smallint NOT NULL,
  `b` varchar(50) GENERATED ALWAYS AS (`a`) VIRTUAL NOT NULL,
  KEY `on_b` (`b`),
  KEY `on_b_prefix` (`b`(10))
) ENGINE=InnoDB DEFAULT CHARSET=utf8mb4 COLLATE=utf8mb4_0900_ai_ci
INSERT IGNORE INTO t (a) VALUES (-1);
SELECT * FROM t;
a	b
-1	-1
DELETE FROM t;
DELETE IGNORE FROM t;
CHECK TABLE t;
Table	Op	Msg_type	Msg_text
test.t	check	status	OK
DROP TABLE t;
# Testing example of type MEDIUMINT and value -1
SHOW CREATE TABLE t;
Table	Create Table
t	CREATE TABLE `t` (
  `a` mediumint NOT NULL,
  `b` varchar(50) GENERATED ALWAYS AS (`a`) VIRTUAL NOT NULL,
  KEY `on_b` (`b`),
  KEY `on_b_prefix` (`b`(10))
) ENGINE=InnoDB DEFAULT CHARSET=utf8mb4 COLLATE=utf8mb4_0900_ai_ci
INSERT IGNORE INTO t (a) VALUES (-1);
SELECT * FROM t;
a	b
-1	-1
DELETE FROM t;
DELETE IGNORE FROM t;
CHECK TABLE t;
Table	Op	Msg_type	Msg_text
test.t	check	status	OK
DROP TABLE t;
# Testing example of type INT and value 2000000000
SHOW CREATE TABLE t;
Table	Create Table
t	CREATE TABLE `t` (
  `a` int NOT NULL,
  `b` varchar(50) GENERATED ALWAYS AS (`a`) VIRTUAL NOT NULL,
  KEY `on_b` (`b`),
  KEY `on_b_prefix` (`b`(10))
) ENGINE=InnoDB DEFAULT CHARSET=utf8mb4 COLLATE=utf8mb4_0900_ai_ci
INSERT IGNORE INTO t (a) VALUES (2000000000);
SELECT * FROM t;
a	b
2000000000	2000000000
DELETE FROM t;
DELETE IGNORE FROM t;
CHECK TABLE t;
Table	Op	Msg_type	Msg_text
test.t	check	status	OK
DROP TABLE t;
# Testing example of type INT and value -2000000000
SHOW CREATE TABLE t;
Table	Create Table
t	CREATE TABLE `t` (
  `a` int NOT NULL,
  `b` varchar(50) GENERATED ALWAYS AS (`a`) VIRTUAL NOT NULL,
  KEY `on_b` (`b`),
  KEY `on_b_prefix` (`b`(10))
) ENGINE=InnoDB DEFAULT CHARSET=utf8mb4 COLLATE=utf8mb4_0900_ai_ci
INSERT IGNORE INTO t (a) VALUES (-2000000000);
SELECT * FROM t;
a	b
-2000000000	-2000000000
DELETE FROM t;
DELETE IGNORE FROM t;
CHECK TABLE t;
Table	Op	Msg_type	Msg_text
test.t	check	status	OK
DROP TABLE t;
# Testing example of type INT UNSIGNED and value 4000000000
SHOW CREATE TABLE t;
Table	Create Table
t	CREATE TABLE `t` (
  `a` int unsigned NOT NULL,
  `b` varchar(50) GENERATED ALWAYS AS (`a`) VIRTUAL NOT NULL,
  KEY `on_b` (`b`),
  KEY `on_b_prefix` (`b`(10))
) ENGINE=InnoDB DEFAULT CHARSET=utf8mb4 COLLATE=utf8mb4_0900_ai_ci
INSERT IGNORE INTO t (a) VALUES (4000000000);
SELECT * FROM t;
a	b
4000000000	4000000000
DELETE FROM t;
DELETE IGNORE FROM t;
CHECK TABLE t;
Table	Op	Msg_type	Msg_text
test.t	check	status	OK
DROP TABLE t;
# Testing example of type BIGINT and value 2000000000000000000
SHOW CREATE TABLE t;
Table	Create Table
t	CREATE TABLE `t` (
  `a` bigint NOT NULL,
  `b` varchar(50) GENERATED ALWAYS AS (`a`) VIRTUAL NOT NULL,
  KEY `on_b` (`b`),
  KEY `on_b_prefix` (`b`(10))
) ENGINE=InnoDB DEFAULT CHARSET=utf8mb4 COLLATE=utf8mb4_0900_ai_ci
INSERT IGNORE INTO t (a) VALUES (2000000000000000000);
SELECT * FROM t;
a	b
2000000000000000000	2000000000000000000
DELETE FROM t;
DELETE IGNORE FROM t;
CHECK TABLE t;
Table	Op	Msg_type	Msg_text
test.t	check	status	OK
DROP TABLE t;
# Testing example of type BIGINT and value -2000000000000000000
SHOW CREATE TABLE t;
Table	Create Table
t	CREATE TABLE `t` (
  `a` bigint NOT NULL,
  `b` varchar(50) GENERATED ALWAYS AS (`a`) VIRTUAL NOT NULL,
  KEY `on_b` (`b`),
  KEY `on_b_prefix` (`b`(10))
) ENGINE=InnoDB DEFAULT CHARSET=utf8mb4 COLLATE=utf8mb4_0900_ai_ci
INSERT IGNORE INTO t (a) VALUES (-2000000000000000000);
SELECT * FROM t;
a	b
-2000000000000000000	-2000000000000000000
DELETE FROM t;
DELETE IGNORE FROM t;
CHECK TABLE t;
Table	Op	Msg_type	Msg_text
test.t	check	status	OK
DROP TABLE t;
# Testing example of type FLOAT and value -1.23456
SHOW CREATE TABLE t;
Table	Create Table
t	CREATE TABLE `t` (
  `a` float NOT NULL,
  `b` varchar(50) GENERATED ALWAYS AS (`a`) VIRTUAL NOT NULL,
  KEY `on_b` (`b`),
  KEY `on_b_prefix` (`b`(10))
) ENGINE=InnoDB DEFAULT CHARSET=utf8mb4 COLLATE=utf8mb4_0900_ai_ci
INSERT IGNORE INTO t (a) VALUES (-1.23456);
SELECT * FROM t;
a	b
-1.23456	-1.2345600128173828
DELETE FROM t;
DELETE IGNORE FROM t;
CHECK TABLE t;
Table	Op	Msg_type	Msg_text
test.t	check	status	OK
DROP TABLE t;
# Testing example of type FLOAT and value -1e38
SHOW CREATE TABLE t;
Table	Create Table
t	CREATE TABLE `t` (
  `a` float NOT NULL,
  `b` varchar(50) GENERATED ALWAYS AS (`a`) VIRTUAL NOT NULL,
  KEY `on_b` (`b`),
  KEY `on_b_prefix` (`b`(10))
) ENGINE=InnoDB DEFAULT CHARSET=utf8mb4 COLLATE=utf8mb4_0900_ai_ci
INSERT IGNORE INTO t (a) VALUES (-1e38);
SELECT * FROM t;
a	b
-1e38	-9.999999680285692e37
DELETE FROM t;
DELETE IGNORE FROM t;
CHECK TABLE t;
Table	Op	Msg_type	Msg_text
test.t	check	status	OK
DROP TABLE t;
# Testing example of type FLOAT and value 1e38
SHOW CREATE TABLE t;
Table	Create Table
t	CREATE TABLE `t` (
  `a` float NOT NULL,
  `b` varchar(50) GENERATED ALWAYS AS (`a`) VIRTUAL NOT NULL,
  KEY `on_b` (`b`),
  KEY `on_b_prefix` (`b`(10))
) ENGINE=InnoDB DEFAULT CHARSET=utf8mb4 COLLATE=utf8mb4_0900_ai_ci
INSERT IGNORE INTO t (a) VALUES (1e38);
SELECT * FROM t;
a	b
1e38	9.999999680285692e37
DELETE FROM t;
DELETE IGNORE FROM t;
CHECK TABLE t;
Table	Op	Msg_type	Msg_text
test.t	check	status	OK
DROP TABLE t;
# Testing example of type DOUBLE and value -1.23456789012345
SHOW CREATE TABLE t;
Table	Create Table
t	CREATE TABLE `t` (
  `a` double NOT NULL,
  `b` varchar(50) GENERATED ALWAYS AS (`a`) VIRTUAL NOT NULL,
  KEY `on_b` (`b`),
  KEY `on_b_prefix` (`b`(10))
) ENGINE=InnoDB DEFAULT CHARSET=utf8mb4 COLLATE=utf8mb4_0900_ai_ci
INSERT IGNORE INTO t (a) VALUES (-1.23456789012345);
SELECT * FROM t;
a	b
-1.23456789012345	-1.23456789012345
DELETE FROM t;
DELETE IGNORE FROM t;
CHECK TABLE t;
Table	Op	Msg_type	Msg_text
test.t	check	status	OK
DROP TABLE t;
# Testing example of type DOUBLE and value 1.23456789012345
SHOW CREATE TABLE t;
Table	Create Table
t	CREATE TABLE `t` (
  `a` double NOT NULL,
  `b` varchar(50) GENERATED ALWAYS AS (`a`) VIRTUAL NOT NULL,
  KEY `on_b` (`b`),
  KEY `on_b_prefix` (`b`(10))
) ENGINE=InnoDB DEFAULT CHARSET=utf8mb4 COLLATE=utf8mb4_0900_ai_ci
INSERT IGNORE INTO t (a) VALUES (1.23456789012345);
SELECT * FROM t;
a	b
1.23456789012345	1.23456789012345
DELETE FROM t;
DELETE IGNORE FROM t;
CHECK TABLE t;
Table	Op	Msg_type	Msg_text
test.t	check	status	OK
DROP TABLE t;
# Testing example of type DOUBLE and value -1e300
SHOW CREATE TABLE t;
Table	Create Table
t	CREATE TABLE `t` (
  `a` double NOT NULL,
  `b` varchar(50) GENERATED ALWAYS AS (`a`) VIRTUAL NOT NULL,
  KEY `on_b` (`b`),
  KEY `on_b_prefix` (`b`(10))
) ENGINE=InnoDB DEFAULT CHARSET=utf8mb4 COLLATE=utf8mb4_0900_ai_ci
INSERT IGNORE INTO t (a) VALUES (-1e300);
SELECT * FROM t;
a	b
-1e300	-1e300
DELETE FROM t;
DELETE IGNORE FROM t;
CHECK TABLE t;
Table	Op	Msg_type	Msg_text
test.t	check	status	OK
DROP TABLE t;
# Testing example of type DOUBLE and value 1e300
SHOW CREATE TABLE t;
Table	Create Table
t	CREATE TABLE `t` (
  `a` double NOT NULL,
  `b` varchar(50) GENERATED ALWAYS AS (`a`) VIRTUAL NOT NULL,
  KEY `on_b` (`b`),
  KEY `on_b_prefix` (`b`(10))
) ENGINE=InnoDB DEFAULT CHARSET=utf8mb4 COLLATE=utf8mb4_0900_ai_ci
INSERT IGNORE INTO t (a) VALUES (1e300);
SELECT * FROM t;
a	b
1e300	1e300
DELETE FROM t;
DELETE IGNORE FROM t;
CHECK TABLE t;
Table	Op	Msg_type	Msg_text
test.t	check	status	OK
DROP TABLE t;
# Testing example of type DECIMAL(4,2) and value -10.99
SHOW CREATE TABLE t;
Table	Create Table
t	CREATE TABLE `t` (
  `a` decimal(4,2) NOT NULL,
  `b` varchar(50) GENERATED ALWAYS AS (`a`) VIRTUAL NOT NULL,
  KEY `on_b` (`b`),
  KEY `on_b_prefix` (`b`(10))
) ENGINE=InnoDB DEFAULT CHARSET=utf8mb4 COLLATE=utf8mb4_0900_ai_ci
INSERT IGNORE INTO t (a) VALUES (-10.99);
SELECT * FROM t;
a	b
-10.99	-10.99
DELETE FROM t;
DELETE IGNORE FROM t;
CHECK TABLE t;
Table	Op	Msg_type	Msg_text
test.t	check	status	OK
DROP TABLE t;
# Testing example of type DECIMAL(34,4) and value 20000000000000000000000000000.0001
SHOW CREATE TABLE t;
Table	Create Table
t	CREATE TABLE `t` (
  `a` decimal(34,4) NOT NULL,
  `b` varchar(50) GENERATED ALWAYS AS (`a`) VIRTUAL NOT NULL,
  KEY `on_b` (`b`),
  KEY `on_b_prefix` (`b`(10))
) ENGINE=InnoDB DEFAULT CHARSET=utf8mb4 COLLATE=utf8mb4_0900_ai_ci
INSERT IGNORE INTO t (a) VALUES (20000000000000000000000000000.0001);
SELECT * FROM t;
a	b
20000000000000000000000000000.0001	20000000000000000000000000000.0001
DELETE FROM t;
DELETE IGNORE FROM t;
CHECK TABLE t;
Table	Op	Msg_type	Msg_text
test.t	check	status	OK
DROP TABLE t;
# Testing example of type DECIMAL(34,4) and value -20000000000000000000000000000.0001
SHOW CREATE TABLE t;
Table	Create Table
t	CREATE TABLE `t` (
  `a` decimal(34,4) NOT NULL,
  `b` varchar(50) GENERATED ALWAYS AS (`a`) VIRTUAL NOT NULL,
  KEY `on_b` (`b`),
  KEY `on_b_prefix` (`b`(10))
) ENGINE=InnoDB DEFAULT CHARSET=utf8mb4 COLLATE=utf8mb4_0900_ai_ci
INSERT IGNORE INTO t (a) VALUES (-20000000000000000000000000000.0001);
SELECT * FROM t;
a	b
-20000000000000000000000000000.0001	-20000000000000000000000000000.0001
DELETE FROM t;
DELETE IGNORE FROM t;
CHECK TABLE t;
Table	Op	Msg_type	Msg_text
test.t	check	status	OK
DROP TABLE t;
# Testing example of type BIT(64) and value 0xDEADBEEFC0FEBABE
SHOW CREATE TABLE t;
Table	Create Table
t	CREATE TABLE `t` (
  `a` bit(64) NOT NULL,
  `b` varchar(50) GENERATED ALWAYS AS (`a`) VIRTUAL NOT NULL,
  KEY `on_b` (`b`),
  KEY `on_b_prefix` (`b`(10))
) ENGINE=InnoDB DEFAULT CHARSET=utf8mb4 COLLATE=utf8mb4_0900_ai_ci
INSERT IGNORE INTO t (a) VALUES (0xDEADBEEFC0FEBABE);
SELECT * FROM t;
a	b
Þ­¾ïÀþº¾	16045690984335325886
DELETE FROM t;
DELETE IGNORE FROM t;
CHECK TABLE t;
Table	Op	Msg_type	Msg_text
test.t	check	status	OK
DROP TABLE t;
# Testing example of type BIT(4) and value 0b1000
SHOW CREATE TABLE t;
Table	Create Table
t	CREATE TABLE `t` (
  `a` bit(4) NOT NULL,
  `b` varchar(50) GENERATED ALWAYS AS (`a`) VIRTUAL NOT NULL,
  KEY `on_b` (`b`),
  KEY `on_b_prefix` (`b`(10))
) ENGINE=InnoDB DEFAULT CHARSET=utf8mb4 COLLATE=utf8mb4_0900_ai_ci
INSERT IGNORE INTO t (a) VALUES (0b1000);
SELECT * FROM t;
a	b
	8
DELETE FROM t;
DELETE IGNORE FROM t;
CHECK TABLE t;
Table	Op	Msg_type	Msg_text
test.t	check	status	OK
DROP TABLE t;
# Testing example of type YEAR and value 2020
SHOW CREATE TABLE t;
Table	Create Table
t	CREATE TABLE `t` (
  `a` year NOT NULL,
  `b` varchar(50) GENERATED ALWAYS AS (`a`) VIRTUAL NOT NULL,
  KEY `on_b` (`b`),
  KEY `on_b_prefix` (`b`(10))
) ENGINE=InnoDB DEFAULT CHARSET=utf8mb4 COLLATE=utf8mb4_0900_ai_ci
INSERT IGNORE INTO t (a) VALUES (2020);
SELECT * FROM t;
a	b
2020	2020
DELETE FROM t;
DELETE IGNORE FROM t;
CHECK TABLE t;
Table	Op	Msg_type	Msg_text
test.t	check	status	OK
DROP TABLE t;
# Testing example of type DATE and value "2030-04-05"
SHOW CREATE TABLE t;
Table	Create Table
t	CREATE TABLE `t` (
  `a` date NOT NULL,
  `b` varchar(50) GENERATED ALWAYS AS (`a`) VIRTUAL NOT NULL,
  KEY `on_b` (`b`),
  KEY `on_b_prefix` (`b`(10))
) ENGINE=InnoDB DEFAULT CHARSET=utf8mb4 COLLATE=utf8mb4_0900_ai_ci
INSERT IGNORE INTO t (a) VALUES ("2030-04-05");
SELECT * FROM t;
a	b
2030-04-05	2030-04-05
DELETE FROM t;
DELETE IGNORE FROM t;
CHECK TABLE t;
Table	Op	Msg_type	Msg_text
test.t	check	status	OK
DROP TABLE t;
# Testing example of type TIME and value "11:12:13"
SHOW CREATE TABLE t;
Table	Create Table
t	CREATE TABLE `t` (
  `a` time NOT NULL,
  `b` varchar(50) GENERATED ALWAYS AS (`a`) VIRTUAL NOT NULL,
  KEY `on_b` (`b`),
  KEY `on_b_prefix` (`b`(10))
) ENGINE=InnoDB DEFAULT CHARSET=utf8mb4 COLLATE=utf8mb4_0900_ai_ci
INSERT IGNORE INTO t (a) VALUES ("11:12:13");
SELECT * FROM t;
a	b
11:12:13	11:12:13
DELETE FROM t;
DELETE IGNORE FROM t;
CHECK TABLE t;
Table	Op	Msg_type	Msg_text
test.t	check	status	OK
DROP TABLE t;
# Testing example of type DATETIME and value "2030-04-05 11:12:13"
SHOW CREATE TABLE t;
Table	Create Table
t	CREATE TABLE `t` (
  `a` datetime NOT NULL,
  `b` varchar(50) GENERATED ALWAYS AS (`a`) VIRTUAL NOT NULL,
  KEY `on_b` (`b`),
  KEY `on_b_prefix` (`b`(10))
) ENGINE=InnoDB DEFAULT CHARSET=utf8mb4 COLLATE=utf8mb4_0900_ai_ci
INSERT IGNORE INTO t (a) VALUES ("2030-04-05 11:12:13");
SELECT * FROM t;
a	b
2030-04-05 11:12:13	2030-04-05 11:12:13
DELETE FROM t;
DELETE IGNORE FROM t;
CHECK TABLE t;
Table	Op	Msg_type	Msg_text
test.t	check	status	OK
DROP TABLE t;
# Testing example of type TIMESTAMP and value "2030-04-05 11:12:13"
SHOW CREATE TABLE t;
Table	Create Table
t	CREATE TABLE `t` (
  `a` timestamp NOT NULL,
  `b` varchar(50) GENERATED ALWAYS AS (`a`) VIRTUAL NOT NULL,
  KEY `on_b` (`b`),
  KEY `on_b_prefix` (`b`(10))
) ENGINE=InnoDB DEFAULT CHARSET=utf8mb4 COLLATE=utf8mb4_0900_ai_ci
INSERT IGNORE INTO t (a) VALUES ("2030-04-05 11:12:13");
SELECT * FROM t;
a	b
2030-04-05 11:12:13	2030-04-05 11:12:13
DELETE FROM t;
DELETE IGNORE FROM t;
CHECK TABLE t;
Table	Op	Msg_type	Msg_text
test.t	check	status	OK
DROP TABLE t;
# Testing example of type CHAR(40) and value "2000000000000000000000000000000000000"
SHOW CREATE TABLE t;
Table	Create Table
t	CREATE TABLE `t` (
  `a` char(40) NOT NULL,
  `b` varchar(50) GENERATED ALWAYS AS (`a`) VIRTUAL NOT NULL,
  KEY `on_b` (`b`),
  KEY `on_b_prefix` (`b`(10))
) ENGINE=InnoDB DEFAULT CHARSET=utf8mb4 COLLATE=utf8mb4_0900_ai_ci
INSERT IGNORE INTO t (a) VALUES ("2000000000000000000000000000000000000");
SELECT * FROM t;
a	b
2000000000000000000000000000000000000	2000000000000000000000000000000000000
DELETE FROM t;
DELETE IGNORE FROM t;
CHECK TABLE t;
Table	Op	Msg_type	Msg_text
test.t	check	status	OK
DROP TABLE t;
# Testing example of type BINARY(45) and value "200000000000000000000000000000000000000000"
SHOW CREATE TABLE t;
Table	Create Table
t	CREATE TABLE `t` (
  `a` binary(45) NOT NULL,
  `b` varchar(50) GENERATED ALWAYS AS (`a`) VIRTUAL NOT NULL,
  KEY `on_b` (`b`),
  KEY `on_b_prefix` (`b`(10))
) ENGINE=InnoDB DEFAULT CHARSET=utf8mb4 COLLATE=utf8mb4_0900_ai_ci
INSERT IGNORE INTO t (a) VALUES ("200000000000000000000000000000000000000000");
SELECT * FROM t;
a	b
200000000000000000000000000000000000000000   	200000000000000000000000000000000000000000   
DELETE FROM t;
DELETE IGNORE FROM t;
CHECK TABLE t;
Table	Op	Msg_type	Msg_text
test.t	check	status	OK
DROP TABLE t;
# Testing example of type VARCHAR(50) and value "2000000000000000000000000000000000000000000000000"
SHOW CREATE TABLE t;
Table	Create Table
t	CREATE TABLE `t` (
  `a` varchar(50) NOT NULL,
  `b` varchar(50) GENERATED ALWAYS AS (`a`) VIRTUAL NOT NULL,
  KEY `on_b` (`b`),
  KEY `on_b_prefix` (`b`(10))
) ENGINE=InnoDB DEFAULT CHARSET=utf8mb4 COLLATE=utf8mb4_0900_ai_ci
INSERT IGNORE INTO t (a) VALUES ("2000000000000000000000000000000000000000000000000");
SELECT * FROM t;
a	b
2000000000000000000000000000000000000000000000000	2000000000000000000000000000000000000000000000000
DELETE FROM t;
DELETE IGNORE FROM t;
CHECK TABLE t;
Table	Op	Msg_type	Msg_text
test.t	check	status	OK
DROP TABLE t;
# Testing example of type CHAR(24) and value "hello beautiful world"
SHOW CREATE TABLE t;
Table	Create Table
t	CREATE TABLE `t` (
  `a` char(24) NOT NULL,
  `b` varchar(50) GENERATED ALWAYS AS (`a`) VIRTUAL NOT NULL,
  KEY `on_b` (`b`),
  KEY `on_b_prefix` (`b`(10))
) ENGINE=InnoDB DEFAULT CHARSET=utf8mb4 COLLATE=utf8mb4_0900_ai_ci
INSERT IGNORE INTO t (a) VALUES ("hello beautiful world");
SELECT * FROM t;
a	b
hello beautiful world	hello beautiful world
DELETE FROM t;
DELETE IGNORE FROM t;
CHECK TABLE t;
Table	Op	Msg_type	Msg_text
test.t	check	status	OK
DROP TABLE t;
# Testing example of type BINARY(12) and value "hello world"
SHOW CREATE TABLE t;
Table	Create Table
t	CREATE TABLE `t` (
  `a` binary(12) NOT NULL,
  `b` varchar(50) GENERATED ALWAYS AS (`a`) VIRTUAL NOT NULL,
  KEY `on_b` (`b`),
  KEY `on_b_prefix` (`b`(10))
) ENGINE=InnoDB DEFAULT CHARSET=utf8mb4 COLLATE=utf8mb4_0900_ai_ci
INSERT IGNORE INTO t (a) VALUES ("hello world");
SELECT * FROM t;
a	b
hello world 	hello world 
DELETE FROM t;
DELETE IGNORE FROM t;
CHECK TABLE t;
Table	Op	Msg_type	Msg_text
test.t	check	status	OK
DROP TABLE t;
# Testing example of type VARCHAR(6) and value "hello"
SHOW CREATE TABLE t;
Table	Create Table
t	CREATE TABLE `t` (
  `a` varchar(6) NOT NULL,
  `b` varchar(50) GENERATED ALWAYS AS (`a`) VIRTUAL NOT NULL,
  KEY `on_b` (`b`),
  KEY `on_b_prefix` (`b`(10))
) ENGINE=InnoDB DEFAULT CHARSET=utf8mb4 COLLATE=utf8mb4_0900_ai_ci
INSERT IGNORE INTO t (a) VALUES ("hello");
SELECT * FROM t;
a	b
hello	hello
DELETE FROM t;
DELETE IGNORE FROM t;
CHECK TABLE t;
Table	Op	Msg_type	Msg_text
test.t	check	status	OK
DROP TABLE t;
# Testing example of type ENUM("up","down") and value "up"
SHOW CREATE TABLE t;
Table	Create Table
t	CREATE TABLE `t` (
  `a` enum('up','down') NOT NULL,
  `b` varchar(50) GENERATED ALWAYS AS (`a`) VIRTUAL NOT NULL,
  KEY `on_b` (`b`),
  KEY `on_b_prefix` (`b`(10))
) ENGINE=InnoDB DEFAULT CHARSET=utf8mb4 COLLATE=utf8mb4_0900_ai_ci
INSERT IGNORE INTO t (a) VALUES ("up");
SELECT * FROM t;
a	b
up	up
DELETE FROM t;
DELETE IGNORE FROM t;
CHECK TABLE t;
Table	Op	Msg_type	Msg_text
test.t	check	status	OK
DROP TABLE t;
# Testing example of type SET("up","down") and value "up,down"
SHOW CREATE TABLE t;
Table	Create Table
t	CREATE TABLE `t` (
  `a` set('up','down') NOT NULL,
  `b` varchar(50) GENERATED ALWAYS AS (`a`) VIRTUAL NOT NULL,
  KEY `on_b` (`b`),
  KEY `on_b_prefix` (`b`(10))
) ENGINE=InnoDB DEFAULT CHARSET=utf8mb4 COLLATE=utf8mb4_0900_ai_ci
INSERT IGNORE INTO t (a) VALUES ("up,down");
SELECT * FROM t;
a	b
up,down	up,down
DELETE FROM t;
DELETE IGNORE FROM t;
CHECK TABLE t;
Table	Op	Msg_type	Msg_text
test.t	check	status	OK
DROP TABLE t;
# Testing example of type GEOMETRY and value ST_GeomFromText("POINT(1 1)")
SHOW CREATE TABLE t;
Table	Create Table
t	CREATE TABLE `t` (
  `a` geometry NOT NULL,
  `b` varchar(50) GENERATED ALWAYS AS (`a`) VIRTUAL NOT NULL,
  KEY `on_b` (`b`),
  KEY `on_b_prefix` (`b`(10))
) ENGINE=InnoDB DEFAULT CHARSET=utf8mb4 COLLATE=utf8mb4_0900_ai_ci
INSERT IGNORE INTO t (a) VALUES (ST_GeomFromText("POINT(1 1)"));
Warnings:
Warning	1366	Incorrect string value: '\xF0?\x00\x00\x00\x00...' for column 'b' at row 1
SELECT * FROM t;
a	b
             ð?      ð?	             
Warnings:
Warning	1366	Incorrect string value: '\xF0?\x00\x00\x00\x00...' for column 'b' at row 1
DELETE FROM t;
DELETE IGNORE FROM t;
Warnings:
Warning	1366	Incorrect string value: '\xF0?\x00\x00\x00\x00...' for column 'b' at row 1
Warning	1366	Incorrect string value: '\xF0?\x00\x00\x00\x00...' for column 'b' at row 1
CHECK TABLE t;
Table	Op	Msg_type	Msg_text
test.t	check	status	OK
DROP TABLE t;
# Testing example of type POINT and value ST_GeomFromText("POINT(1 1)")
SHOW CREATE TABLE t;
Table	Create Table
t	CREATE TABLE `t` (
  `a` point NOT NULL,
  `b` varchar(50) GENERATED ALWAYS AS (`a`) VIRTUAL NOT NULL,
  KEY `on_b` (`b`),
  KEY `on_b_prefix` (`b`(10))
) ENGINE=InnoDB DEFAULT CHARSET=utf8mb4 COLLATE=utf8mb4_0900_ai_ci
INSERT IGNORE INTO t (a) VALUES (ST_GeomFromText("POINT(1 1)"));
Warnings:
Warning	1366	Incorrect string value: '\xF0?\x00\x00\x00\x00...' for column 'b' at row 1
SELECT * FROM t;
a	b
             ð?      ð?	             
Warnings:
Warning	1366	Incorrect string value: '\xF0?\x00\x00\x00\x00...' for column 'b' at row 1
DELETE FROM t;
DELETE IGNORE FROM t;
Warnings:
Warning	1366	Incorrect string value: '\xF0?\x00\x00\x00\x00...' for column 'b' at row 1
Warning	1366	Incorrect string value: '\xF0?\x00\x00\x00\x00...' for column 'b' at row 1
CHECK TABLE t;
Table	Op	Msg_type	Msg_text
test.t	check	status	OK
DROP TABLE t;
# Testing example of type LINESTRING and value ST_GeomFromText("LINESTRING(0 0,1 1,2 2)")
SHOW CREATE TABLE t;
Table	Create Table
t	CREATE TABLE `t` (
  `a` linestring NOT NULL,
  `b` varchar(50) GENERATED ALWAYS AS (`a`) VIRTUAL NOT NULL,
  KEY `on_b` (`b`),
  KEY `on_b_prefix` (`b`(10))
) ENGINE=InnoDB DEFAULT CHARSET=utf8mb4 COLLATE=utf8mb4_0900_ai_ci
INSERT IGNORE INTO t (a) VALUES (ST_GeomFromText("LINESTRING(0 0,1 1,2 2)"));
Warnings:
Warning	1366	Incorrect string value: '\xF0?\x00\x00\x00\x00...' for column 'b' at row 1
SELECT * FROM t;
a	b
                                ð?      ð?       @       @	                                
Warnings:
Warning	1366	Incorrect string value: '\xF0?\x00\x00\x00\x00...' for column 'b' at row 1
DELETE FROM t;
DELETE IGNORE FROM t;
Warnings:
Warning	1366	Incorrect string value: '\xF0?\x00\x00\x00\x00...' for column 'b' at row 1
Warning	1366	Incorrect string value: '\xF0?\x00\x00\x00\x00...' for column 'b' at row 1
CHECK TABLE t;
Table	Op	Msg_type	Msg_text
test.t	check	status	OK
DROP TABLE t;
# Testing example of type POLYGON and value ST_GeomFromText("POLYGON((0 0,1 0,1 1,0 1,0 0),(5 5,7 5,7 7,5 7,5 5))")
SHOW CREATE TABLE t;
Table	Create Table
t	CREATE TABLE `t` (
  `a` polygon NOT NULL,
  `b` varchar(50) GENERATED ALWAYS AS (`a`) VIRTUAL NOT NULL,
  KEY `on_b` (`b`),
  KEY `on_b_prefix` (`b`(10))
) ENGINE=InnoDB DEFAULT CHARSET=utf8mb4 COLLATE=utf8mb4_0900_ai_ci
INSERT IGNORE INTO t (a) VALUES (ST_GeomFromText("POLYGON((0 0,1 0,1 1,0 1,0 0),(5 5,7 5,7 7,5 7,5 5))"));
Warnings:
Warning	1366	Incorrect string value: '\xF0?\x00\x00\x00\x00...' for column 'b' at row 1
SELECT * FROM t;
a	b
                                   ð?              ð?      ð?              ð?                         @      @      @      @      @      @      @      @      @      @	                                   
Warnings:
Warning	1366	Incorrect string value: '\xF0?\x00\x00\x00\x00...' for column 'b' at row 1
DELETE FROM t;
DELETE IGNORE FROM t;
Warnings:
Warning	1366	Incorrect string value: '\xF0?\x00\x00\x00\x00...' for column 'b' at row 1
Warning	1366	Incorrect string value: '\xF0?\x00\x00\x00\x00...' for column 'b' at row 1
CHECK TABLE t;
Table	Op	Msg_type	Msg_text
test.t	check	status	OK
DROP TABLE t;
#
# Testing virtual column of type CHAR(24)
#
# Testing example of type JSON and value "{}"
SHOW CREATE TABLE t;
Table	Create Table
t	CREATE TABLE `t` (
  `a` json NOT NULL,
  `b` char(24) GENERATED ALWAYS AS (`a`) VIRTUAL NOT NULL,
  KEY `on_b` (`b`),
  KEY `on_b_prefix` (`b`(10))
) ENGINE=InnoDB DEFAULT CHARSET=utf8mb4 COLLATE=utf8mb4_0900_ai_ci
INSERT IGNORE INTO t (a) VALUES ("{}");
SELECT * FROM t;
a	b
{}	{}
DELETE FROM t;
DELETE IGNORE FROM t;
CHECK TABLE t;
Table	Op	Msg_type	Msg_text
test.t	check	status	OK
DROP TABLE t;
# Testing example of type JSON and value '["hello beautiful world"]'
SHOW CREATE TABLE t;
Table	Create Table
t	CREATE TABLE `t` (
  `a` json NOT NULL,
  `b` char(24) GENERATED ALWAYS AS (`a`) VIRTUAL NOT NULL,
  KEY `on_b` (`b`),
  KEY `on_b_prefix` (`b`(10))
) ENGINE=InnoDB DEFAULT CHARSET=utf8mb4 COLLATE=utf8mb4_0900_ai_ci
INSERT IGNORE INTO t (a) VALUES ('["hello beautiful world"]');
Warnings:
Warning	1265	Data truncated for column 'b' at row 1
SELECT * FROM t;
a	b
["hello beautiful world"]	["hello beautiful world"
DELETE FROM t;
DELETE IGNORE FROM t;
CHECK TABLE t;
Table	Op	Msg_type	Msg_text
test.t	check	status	OK
DROP TABLE t;
# Testing example of type JSON and value "-1"
SHOW CREATE TABLE t;
Table	Create Table
t	CREATE TABLE `t` (
  `a` json NOT NULL,
  `b` char(24) GENERATED ALWAYS AS (`a`) VIRTUAL NOT NULL,
  KEY `on_b` (`b`),
  KEY `on_b_prefix` (`b`(10))
) ENGINE=InnoDB DEFAULT CHARSET=utf8mb4 COLLATE=utf8mb4_0900_ai_ci
INSERT IGNORE INTO t (a) VALUES ("-1");
SELECT * FROM t;
a	b
-1	-1
DELETE FROM t;
DELETE IGNORE FROM t;
CHECK TABLE t;
Table	Op	Msg_type	Msg_text
test.t	check	status	OK
DROP TABLE t;
# Testing example of type TINYINT and value -1
SHOW CREATE TABLE t;
Table	Create Table
t	CREATE TABLE `t` (
  `a` tinyint NOT NULL,
  `b` char(24) GENERATED ALWAYS AS (`a`) VIRTUAL NOT NULL,
  KEY `on_b` (`b`),
  KEY `on_b_prefix` (`b`(10))
) ENGINE=InnoDB DEFAULT CHARSET=utf8mb4 COLLATE=utf8mb4_0900_ai_ci
INSERT IGNORE INTO t (a) VALUES (-1);
SELECT * FROM t;
a	b
-1	-1
DELETE FROM t;
DELETE IGNORE FROM t;
CHECK TABLE t;
Table	Op	Msg_type	Msg_text
test.t	check	status	OK
DROP TABLE t;
# Testing example of type SMALLINT and value -1
SHOW CREATE TABLE t;
Table	Create Table
t	CREATE TABLE `t` (
  `a` smallint NOT NULL,
  `b` char(24) GENERATED ALWAYS AS (`a`) VIRTUAL NOT NULL,
  KEY `on_b` (`b`),
  KEY `on_b_prefix` (`b`(10))
) ENGINE=InnoDB DEFAULT CHARSET=utf8mb4 COLLATE=utf8mb4_0900_ai_ci
INSERT IGNORE INTO t (a) VALUES (-1);
SELECT * FROM t;
a	b
-1	-1
DELETE FROM t;
DELETE IGNORE FROM t;
CHECK TABLE t;
Table	Op	Msg_type	Msg_text
test.t	check	status	OK
DROP TABLE t;
# Testing example of type MEDIUMINT and value -1
SHOW CREATE TABLE t;
Table	Create Table
t	CREATE TABLE `t` (
  `a` mediumint NOT NULL,
  `b` char(24) GENERATED ALWAYS AS (`a`) VIRTUAL NOT NULL,
  KEY `on_b` (`b`),
  KEY `on_b_prefix` (`b`(10))
) ENGINE=InnoDB DEFAULT CHARSET=utf8mb4 COLLATE=utf8mb4_0900_ai_ci
INSERT IGNORE INTO t (a) VALUES (-1);
SELECT * FROM t;
a	b
-1	-1
DELETE FROM t;
DELETE IGNORE FROM t;
CHECK TABLE t;
Table	Op	Msg_type	Msg_text
test.t	check	status	OK
DROP TABLE t;
# Testing example of type INT and value 2000000000
SHOW CREATE TABLE t;
Table	Create Table
t	CREATE TABLE `t` (
  `a` int NOT NULL,
  `b` char(24) GENERATED ALWAYS AS (`a`) VIRTUAL NOT NULL,
  KEY `on_b` (`b`),
  KEY `on_b_prefix` (`b`(10))
) ENGINE=InnoDB DEFAULT CHARSET=utf8mb4 COLLATE=utf8mb4_0900_ai_ci
INSERT IGNORE INTO t (a) VALUES (2000000000);
SELECT * FROM t;
a	b
2000000000	2000000000
DELETE FROM t;
DELETE IGNORE FROM t;
CHECK TABLE t;
Table	Op	Msg_type	Msg_text
test.t	check	status	OK
DROP TABLE t;
# Testing example of type INT and value -2000000000
SHOW CREATE TABLE t;
Table	Create Table
t	CREATE TABLE `t` (
  `a` int NOT NULL,
  `b` char(24) GENERATED ALWAYS AS (`a`) VIRTUAL NOT NULL,
  KEY `on_b` (`b`),
  KEY `on_b_prefix` (`b`(10))
) ENGINE=InnoDB DEFAULT CHARSET=utf8mb4 COLLATE=utf8mb4_0900_ai_ci
INSERT IGNORE INTO t (a) VALUES (-2000000000);
SELECT * FROM t;
a	b
-2000000000	-2000000000
DELETE FROM t;
DELETE IGNORE FROM t;
CHECK TABLE t;
Table	Op	Msg_type	Msg_text
test.t	check	status	OK
DROP TABLE t;
# Testing example of type INT UNSIGNED and value 4000000000
SHOW CREATE TABLE t;
Table	Create Table
t	CREATE TABLE `t` (
  `a` int unsigned NOT NULL,
  `b` char(24) GENERATED ALWAYS AS (`a`) VIRTUAL NOT NULL,
  KEY `on_b` (`b`),
  KEY `on_b_prefix` (`b`(10))
) ENGINE=InnoDB DEFAULT CHARSET=utf8mb4 COLLATE=utf8mb4_0900_ai_ci
INSERT IGNORE INTO t (a) VALUES (4000000000);
SELECT * FROM t;
a	b
4000000000	4000000000
DELETE FROM t;
DELETE IGNORE FROM t;
CHECK TABLE t;
Table	Op	Msg_type	Msg_text
test.t	check	status	OK
DROP TABLE t;
# Testing example of type BIGINT and value 2000000000000000000
SHOW CREATE TABLE t;
Table	Create Table
t	CREATE TABLE `t` (
  `a` bigint NOT NULL,
  `b` char(24) GENERATED ALWAYS AS (`a`) VIRTUAL NOT NULL,
  KEY `on_b` (`b`),
  KEY `on_b_prefix` (`b`(10))
) ENGINE=InnoDB DEFAULT CHARSET=utf8mb4 COLLATE=utf8mb4_0900_ai_ci
INSERT IGNORE INTO t (a) VALUES (2000000000000000000);
SELECT * FROM t;
a	b
2000000000000000000	2000000000000000000
DELETE FROM t;
DELETE IGNORE FROM t;
CHECK TABLE t;
Table	Op	Msg_type	Msg_text
test.t	check	status	OK
DROP TABLE t;
# Testing example of type BIGINT and value -2000000000000000000
SHOW CREATE TABLE t;
Table	Create Table
t	CREATE TABLE `t` (
  `a` bigint NOT NULL,
  `b` char(24) GENERATED ALWAYS AS (`a`) VIRTUAL NOT NULL,
  KEY `on_b` (`b`),
  KEY `on_b_prefix` (`b`(10))
) ENGINE=InnoDB DEFAULT CHARSET=utf8mb4 COLLATE=utf8mb4_0900_ai_ci
INSERT IGNORE INTO t (a) VALUES (-2000000000000000000);
SELECT * FROM t;
a	b
-2000000000000000000	-2000000000000000000
DELETE FROM t;
DELETE IGNORE FROM t;
CHECK TABLE t;
Table	Op	Msg_type	Msg_text
test.t	check	status	OK
DROP TABLE t;
# Testing example of type FLOAT and value -1.23456
SHOW CREATE TABLE t;
Table	Create Table
t	CREATE TABLE `t` (
  `a` float NOT NULL,
  `b` char(24) GENERATED ALWAYS AS (`a`) VIRTUAL NOT NULL,
  KEY `on_b` (`b`),
  KEY `on_b_prefix` (`b`(10))
) ENGINE=InnoDB DEFAULT CHARSET=utf8mb4 COLLATE=utf8mb4_0900_ai_ci
INSERT IGNORE INTO t (a) VALUES (-1.23456);
SELECT * FROM t;
a	b
-1.23456	-1.2345600128173828
DELETE FROM t;
DELETE IGNORE FROM t;
CHECK TABLE t;
Table	Op	Msg_type	Msg_text
test.t	check	status	OK
DROP TABLE t;
# Testing example of type FLOAT and value -1e38
SHOW CREATE TABLE t;
Table	Create Table
t	CREATE TABLE `t` (
  `a` float NOT NULL,
  `b` char(24) GENERATED ALWAYS AS (`a`) VIRTUAL NOT NULL,
  KEY `on_b` (`b`),
  KEY `on_b_prefix` (`b`(10))
) ENGINE=InnoDB DEFAULT CHARSET=utf8mb4 COLLATE=utf8mb4_0900_ai_ci
INSERT IGNORE INTO t (a) VALUES (-1e38);
SELECT * FROM t;
a	b
-1e38	-9.999999680285692e37
DELETE FROM t;
DELETE IGNORE FROM t;
CHECK TABLE t;
Table	Op	Msg_type	Msg_text
test.t	check	status	OK
DROP TABLE t;
# Testing example of type FLOAT and value 1e38
SHOW CREATE TABLE t;
Table	Create Table
t	CREATE TABLE `t` (
  `a` float NOT NULL,
  `b` char(24) GENERATED ALWAYS AS (`a`) VIRTUAL NOT NULL,
  KEY `on_b` (`b`),
  KEY `on_b_prefix` (`b`(10))
) ENGINE=InnoDB DEFAULT CHARSET=utf8mb4 COLLATE=utf8mb4_0900_ai_ci
INSERT IGNORE INTO t (a) VALUES (1e38);
SELECT * FROM t;
a	b
1e38	9.999999680285692e37
DELETE FROM t;
DELETE IGNORE FROM t;
CHECK TABLE t;
Table	Op	Msg_type	Msg_text
test.t	check	status	OK
DROP TABLE t;
# Testing example of type DOUBLE and value -1.23456789012345
SHOW CREATE TABLE t;
Table	Create Table
t	CREATE TABLE `t` (
  `a` double NOT NULL,
  `b` char(24) GENERATED ALWAYS AS (`a`) VIRTUAL NOT NULL,
  KEY `on_b` (`b`),
  KEY `on_b_prefix` (`b`(10))
) ENGINE=InnoDB DEFAULT CHARSET=utf8mb4 COLLATE=utf8mb4_0900_ai_ci
INSERT IGNORE INTO t (a) VALUES (-1.23456789012345);
SELECT * FROM t;
a	b
-1.23456789012345	-1.23456789012345
DELETE FROM t;
DELETE IGNORE FROM t;
CHECK TABLE t;
Table	Op	Msg_type	Msg_text
test.t	check	status	OK
DROP TABLE t;
# Testing example of type DOUBLE and value 1.23456789012345
SHOW CREATE TABLE t;
Table	Create Table
t	CREATE TABLE `t` (
  `a` double NOT NULL,
  `b` char(24) GENERATED ALWAYS AS (`a`) VIRTUAL NOT NULL,
  KEY `on_b` (`b`),
  KEY `on_b_prefix` (`b`(10))
) ENGINE=InnoDB DEFAULT CHARSET=utf8mb4 COLLATE=utf8mb4_0900_ai_ci
INSERT IGNORE INTO t (a) VALUES (1.23456789012345);
SELECT * FROM t;
a	b
1.23456789012345	1.23456789012345
DELETE FROM t;
DELETE IGNORE FROM t;
CHECK TABLE t;
Table	Op	Msg_type	Msg_text
test.t	check	status	OK
DROP TABLE t;
# Testing example of type DOUBLE and value -1e300
SHOW CREATE TABLE t;
Table	Create Table
t	CREATE TABLE `t` (
  `a` double NOT NULL,
  `b` char(24) GENERATED ALWAYS AS (`a`) VIRTUAL NOT NULL,
  KEY `on_b` (`b`),
  KEY `on_b_prefix` (`b`(10))
) ENGINE=InnoDB DEFAULT CHARSET=utf8mb4 COLLATE=utf8mb4_0900_ai_ci
INSERT IGNORE INTO t (a) VALUES (-1e300);
SELECT * FROM t;
a	b
-1e300	-1e300
DELETE FROM t;
DELETE IGNORE FROM t;
CHECK TABLE t;
Table	Op	Msg_type	Msg_text
test.t	check	status	OK
DROP TABLE t;
# Testing example of type DOUBLE and value 1e300
SHOW CREATE TABLE t;
Table	Create Table
t	CREATE TABLE `t` (
  `a` double NOT NULL,
  `b` char(24) GENERATED ALWAYS AS (`a`) VIRTUAL NOT NULL,
  KEY `on_b` (`b`),
  KEY `on_b_prefix` (`b`(10))
) ENGINE=InnoDB DEFAULT CHARSET=utf8mb4 COLLATE=utf8mb4_0900_ai_ci
INSERT IGNORE INTO t (a) VALUES (1e300);
SELECT * FROM t;
a	b
1e300	1e300
DELETE FROM t;
DELETE IGNORE FROM t;
CHECK TABLE t;
Table	Op	Msg_type	Msg_text
test.t	check	status	OK
DROP TABLE t;
# Testing example of type DECIMAL(4,2) and value -10.99
SHOW CREATE TABLE t;
Table	Create Table
t	CREATE TABLE `t` (
  `a` decimal(4,2) NOT NULL,
  `b` char(24) GENERATED ALWAYS AS (`a`) VIRTUAL NOT NULL,
  KEY `on_b` (`b`),
  KEY `on_b_prefix` (`b`(10))
) ENGINE=InnoDB DEFAULT CHARSET=utf8mb4 COLLATE=utf8mb4_0900_ai_ci
INSERT IGNORE INTO t (a) VALUES (-10.99);
SELECT * FROM t;
a	b
-10.99	-10.99
DELETE FROM t;
DELETE IGNORE FROM t;
CHECK TABLE t;
Table	Op	Msg_type	Msg_text
test.t	check	status	OK
DROP TABLE t;
# Testing example of type DECIMAL(34,4) and value 20000000000000000000000000000.0001
SHOW CREATE TABLE t;
Table	Create Table
t	CREATE TABLE `t` (
  `a` decimal(34,4) NOT NULL,
  `b` char(24) GENERATED ALWAYS AS (`a`) VIRTUAL NOT NULL,
  KEY `on_b` (`b`),
  KEY `on_b_prefix` (`b`(10))
) ENGINE=InnoDB DEFAULT CHARSET=utf8mb4 COLLATE=utf8mb4_0900_ai_ci
INSERT IGNORE INTO t (a) VALUES (20000000000000000000000000000.0001);
Warnings:
Warning	1265	Data truncated for column 'b' at row 1
SELECT * FROM t;
a	b
20000000000000000000000000000.0001	200000000000000000000000
DELETE FROM t;
DELETE IGNORE FROM t;
CHECK TABLE t;
Table	Op	Msg_type	Msg_text
test.t	check	status	OK
DROP TABLE t;
# Testing example of type DECIMAL(34,4) and value -20000000000000000000000000000.0001
SHOW CREATE TABLE t;
Table	Create Table
t	CREATE TABLE `t` (
  `a` decimal(34,4) NOT NULL,
  `b` char(24) GENERATED ALWAYS AS (`a`) VIRTUAL NOT NULL,
  KEY `on_b` (`b`),
  KEY `on_b_prefix` (`b`(10))
) ENGINE=InnoDB DEFAULT CHARSET=utf8mb4 COLLATE=utf8mb4_0900_ai_ci
INSERT IGNORE INTO t (a) VALUES (-20000000000000000000000000000.0001);
Warnings:
Warning	1265	Data truncated for column 'b' at row 1
SELECT * FROM t;
a	b
-20000000000000000000000000000.0001	-20000000000000000000000
DELETE FROM t;
DELETE IGNORE FROM t;
CHECK TABLE t;
Table	Op	Msg_type	Msg_text
test.t	check	status	OK
DROP TABLE t;
# Testing example of type BIT(64) and value 0xDEADBEEFC0FEBABE
SHOW CREATE TABLE t;
Table	Create Table
t	CREATE TABLE `t` (
  `a` bit(64) NOT NULL,
  `b` char(24) GENERATED ALWAYS AS (`a`) VIRTUAL NOT NULL,
  KEY `on_b` (`b`),
  KEY `on_b_prefix` (`b`(10))
) ENGINE=InnoDB DEFAULT CHARSET=utf8mb4 COLLATE=utf8mb4_0900_ai_ci
INSERT IGNORE INTO t (a) VALUES (0xDEADBEEFC0FEBABE);
SELECT * FROM t;
a	b
Þ­¾ïÀþº¾	16045690984335325886
DELETE FROM t;
DELETE IGNORE FROM t;
CHECK TABLE t;
Table	Op	Msg_type	Msg_text
test.t	check	status	OK
DROP TABLE t;
# Testing example of type BIT(4) and value 0b1000
SHOW CREATE TABLE t;
Table	Create Table
t	CREATE TABLE `t` (
  `a` bit(4) NOT NULL,
  `b` char(24) GENERATED ALWAYS AS (`a`) VIRTUAL NOT NULL,
  KEY `on_b` (`b`),
  KEY `on_b_prefix` (`b`(10))
) ENGINE=InnoDB DEFAULT CHARSET=utf8mb4 COLLATE=utf8mb4_0900_ai_ci
INSERT IGNORE INTO t (a) VALUES (0b1000);
SELECT * FROM t;
a	b
	8
DELETE FROM t;
DELETE IGNORE FROM t;
CHECK TABLE t;
Table	Op	Msg_type	Msg_text
test.t	check	status	OK
DROP TABLE t;
# Testing example of type YEAR and value 2020
SHOW CREATE TABLE t;
Table	Create Table
t	CREATE TABLE `t` (
  `a` year NOT NULL,
  `b` char(24) GENERATED ALWAYS AS (`a`) VIRTUAL NOT NULL,
  KEY `on_b` (`b`),
  KEY `on_b_prefix` (`b`(10))
) ENGINE=InnoDB DEFAULT CHARSET=utf8mb4 COLLATE=utf8mb4_0900_ai_ci
INSERT IGNORE INTO t (a) VALUES (2020);
SELECT * FROM t;
a	b
2020	2020
DELETE FROM t;
DELETE IGNORE FROM t;
CHECK TABLE t;
Table	Op	Msg_type	Msg_text
test.t	check	status	OK
DROP TABLE t;
# Testing example of type DATE and value "2030-04-05"
SHOW CREATE TABLE t;
Table	Create Table
t	CREATE TABLE `t` (
  `a` date NOT NULL,
  `b` char(24) GENERATED ALWAYS AS (`a`) VIRTUAL NOT NULL,
  KEY `on_b` (`b`),
  KEY `on_b_prefix` (`b`(10))
) ENGINE=InnoDB DEFAULT CHARSET=utf8mb4 COLLATE=utf8mb4_0900_ai_ci
INSERT IGNORE INTO t (a) VALUES ("2030-04-05");
SELECT * FROM t;
a	b
2030-04-05	2030-04-05
DELETE FROM t;
DELETE IGNORE FROM t;
CHECK TABLE t;
Table	Op	Msg_type	Msg_text
test.t	check	status	OK
DROP TABLE t;
# Testing example of type TIME and value "11:12:13"
SHOW CREATE TABLE t;
Table	Create Table
t	CREATE TABLE `t` (
  `a` time NOT NULL,
  `b` char(24) GENERATED ALWAYS AS (`a`) VIRTUAL NOT NULL,
  KEY `on_b` (`b`),
  KEY `on_b_prefix` (`b`(10))
) ENGINE=InnoDB DEFAULT CHARSET=utf8mb4 COLLATE=utf8mb4_0900_ai_ci
INSERT IGNORE INTO t (a) VALUES ("11:12:13");
SELECT * FROM t;
a	b
11:12:13	11:12:13
DELETE FROM t;
DELETE IGNORE FROM t;
CHECK TABLE t;
Table	Op	Msg_type	Msg_text
test.t	check	status	OK
DROP TABLE t;
# Testing example of type DATETIME and value "2030-04-05 11:12:13"
SHOW CREATE TABLE t;
Table	Create Table
t	CREATE TABLE `t` (
  `a` datetime NOT NULL,
  `b` char(24) GENERATED ALWAYS AS (`a`) VIRTUAL NOT NULL,
  KEY `on_b` (`b`),
  KEY `on_b_prefix` (`b`(10))
) ENGINE=InnoDB DEFAULT CHARSET=utf8mb4 COLLATE=utf8mb4_0900_ai_ci
INSERT IGNORE INTO t (a) VALUES ("2030-04-05 11:12:13");
SELECT * FROM t;
a	b
2030-04-05 11:12:13	2030-04-05 11:12:13
DELETE FROM t;
DELETE IGNORE FROM t;
CHECK TABLE t;
Table	Op	Msg_type	Msg_text
test.t	check	status	OK
DROP TABLE t;
# Testing example of type TIMESTAMP and value "2030-04-05 11:12:13"
SHOW CREATE TABLE t;
Table	Create Table
t	CREATE TABLE `t` (
  `a` timestamp NOT NULL,
  `b` char(24) GENERATED ALWAYS AS (`a`) VIRTUAL NOT NULL,
  KEY `on_b` (`b`),
  KEY `on_b_prefix` (`b`(10))
) ENGINE=InnoDB DEFAULT CHARSET=utf8mb4 COLLATE=utf8mb4_0900_ai_ci
INSERT IGNORE INTO t (a) VALUES ("2030-04-05 11:12:13");
SELECT * FROM t;
a	b
2030-04-05 11:12:13	2030-04-05 11:12:13
DELETE FROM t;
DELETE IGNORE FROM t;
CHECK TABLE t;
Table	Op	Msg_type	Msg_text
test.t	check	status	OK
DROP TABLE t;
# Testing example of type CHAR(40) and value "2000000000000000000000000000000000000"
SHOW CREATE TABLE t;
Table	Create Table
t	CREATE TABLE `t` (
  `a` char(40) NOT NULL,
  `b` char(24) GENERATED ALWAYS AS (`a`) VIRTUAL NOT NULL,
  KEY `on_b` (`b`),
  KEY `on_b_prefix` (`b`(10))
) ENGINE=InnoDB DEFAULT CHARSET=utf8mb4 COLLATE=utf8mb4_0900_ai_ci
INSERT IGNORE INTO t (a) VALUES ("2000000000000000000000000000000000000");
Warnings:
Warning	1265	Data truncated for column 'b' at row 1
SELECT * FROM t;
a	b
2000000000000000000000000000000000000	200000000000000000000000
DELETE FROM t;
DELETE IGNORE FROM t;
CHECK TABLE t;
Table	Op	Msg_type	Msg_text
test.t	check	status	OK
DROP TABLE t;
# Testing example of type BINARY(45) and value "200000000000000000000000000000000000000000"
SHOW CREATE TABLE t;
Table	Create Table
t	CREATE TABLE `t` (
  `a` binary(45) NOT NULL,
  `b` char(24) GENERATED ALWAYS AS (`a`) VIRTUAL NOT NULL,
  KEY `on_b` (`b`),
  KEY `on_b_prefix` (`b`(10))
) ENGINE=InnoDB DEFAULT CHARSET=utf8mb4 COLLATE=utf8mb4_0900_ai_ci
INSERT IGNORE INTO t (a) VALUES ("200000000000000000000000000000000000000000");
Warnings:
Warning	1265	Data truncated for column 'b' at row 1
SELECT * FROM t;
a	b
200000000000000000000000000000000000000000   	200000000000000000000000
DELETE FROM t;
DELETE IGNORE FROM t;
CHECK TABLE t;
Table	Op	Msg_type	Msg_text
test.t	check	status	OK
DROP TABLE t;
# Testing example of type VARCHAR(50) and value "2000000000000000000000000000000000000000000000000"
SHOW CREATE TABLE t;
Table	Create Table
t	CREATE TABLE `t` (
  `a` varchar(50) NOT NULL,
  `b` char(24) GENERATED ALWAYS AS (`a`) VIRTUAL NOT NULL,
  KEY `on_b` (`b`),
  KEY `on_b_prefix` (`b`(10))
) ENGINE=InnoDB DEFAULT CHARSET=utf8mb4 COLLATE=utf8mb4_0900_ai_ci
INSERT IGNORE INTO t (a) VALUES ("2000000000000000000000000000000000000000000000000");
Warnings:
Warning	1265	Data truncated for column 'b' at row 1
SELECT * FROM t;
a	b
2000000000000000000000000000000000000000000000000	200000000000000000000000
DELETE FROM t;
DELETE IGNORE FROM t;
CHECK TABLE t;
Table	Op	Msg_type	Msg_text
test.t	check	status	OK
DROP TABLE t;
# Testing example of type CHAR(24) and value "hello beautiful world"
SHOW CREATE TABLE t;
Table	Create Table
t	CREATE TABLE `t` (
  `a` char(24) NOT NULL,
  `b` char(24) GENERATED ALWAYS AS (`a`) VIRTUAL NOT NULL,
  KEY `on_b` (`b`),
  KEY `on_b_prefix` (`b`(10))
) ENGINE=InnoDB DEFAULT CHARSET=utf8mb4 COLLATE=utf8mb4_0900_ai_ci
INSERT IGNORE INTO t (a) VALUES ("hello beautiful world");
SELECT * FROM t;
a	b
hello beautiful world	hello beautiful world
DELETE FROM t;
DELETE IGNORE FROM t;
CHECK TABLE t;
Table	Op	Msg_type	Msg_text
test.t	check	status	OK
DROP TABLE t;
# Testing example of type BINARY(12) and value "hello world"
SHOW CREATE TABLE t;
Table	Create Table
t	CREATE TABLE `t` (
  `a` binary(12) NOT NULL,
  `b` char(24) GENERATED ALWAYS AS (`a`) VIRTUAL NOT NULL,
  KEY `on_b` (`b`),
  KEY `on_b_prefix` (`b`(10))
) ENGINE=InnoDB DEFAULT CHARSET=utf8mb4 COLLATE=utf8mb4_0900_ai_ci
INSERT IGNORE INTO t (a) VALUES ("hello world");
SELECT * FROM t;
a	b
hello world 	hello world 
DELETE FROM t;
DELETE IGNORE FROM t;
CHECK TABLE t;
Table	Op	Msg_type	Msg_text
test.t	check	status	OK
DROP TABLE t;
# Testing example of type VARCHAR(6) and value "hello"
SHOW CREATE TABLE t;
Table	Create Table
t	CREATE TABLE `t` (
  `a` varchar(6) NOT NULL,
  `b` char(24) GENERATED ALWAYS AS (`a`) VIRTUAL NOT NULL,
  KEY `on_b` (`b`),
  KEY `on_b_prefix` (`b`(10))
) ENGINE=InnoDB DEFAULT CHARSET=utf8mb4 COLLATE=utf8mb4_0900_ai_ci
INSERT IGNORE INTO t (a) VALUES ("hello");
SELECT * FROM t;
a	b
hello	hello
DELETE FROM t;
DELETE IGNORE FROM t;
CHECK TABLE t;
Table	Op	Msg_type	Msg_text
test.t	check	status	OK
DROP TABLE t;
# Testing example of type ENUM("up","down") and value "up"
SHOW CREATE TABLE t;
Table	Create Table
t	CREATE TABLE `t` (
  `a` enum('up','down') NOT NULL,
  `b` char(24) GENERATED ALWAYS AS (`a`) VIRTUAL NOT NULL,
  KEY `on_b` (`b`),
  KEY `on_b_prefix` (`b`(10))
) ENGINE=InnoDB DEFAULT CHARSET=utf8mb4 COLLATE=utf8mb4_0900_ai_ci
INSERT IGNORE INTO t (a) VALUES ("up");
SELECT * FROM t;
a	b
up	up
DELETE FROM t;
DELETE IGNORE FROM t;
CHECK TABLE t;
Table	Op	Msg_type	Msg_text
test.t	check	status	OK
DROP TABLE t;
# Testing example of type SET("up","down") and value "up,down"
SHOW CREATE TABLE t;
Table	Create Table
t	CREATE TABLE `t` (
  `a` set('up','down') NOT NULL,
  `b` char(24) GENERATED ALWAYS AS (`a`) VIRTUAL NOT NULL,
  KEY `on_b` (`b`),
  KEY `on_b_prefix` (`b`(10))
) ENGINE=InnoDB DEFAULT CHARSET=utf8mb4 COLLATE=utf8mb4_0900_ai_ci
INSERT IGNORE INTO t (a) VALUES ("up,down");
SELECT * FROM t;
a	b
up,down	up,down
DELETE FROM t;
DELETE IGNORE FROM t;
CHECK TABLE t;
Table	Op	Msg_type	Msg_text
test.t	check	status	OK
DROP TABLE t;
# Testing example of type GEOMETRY and value ST_GeomFromText("POINT(1 1)")
SHOW CREATE TABLE t;
Table	Create Table
t	CREATE TABLE `t` (
  `a` geometry NOT NULL,
  `b` char(24) GENERATED ALWAYS AS (`a`) VIRTUAL NOT NULL,
  KEY `on_b` (`b`),
  KEY `on_b_prefix` (`b`(10))
) ENGINE=InnoDB DEFAULT CHARSET=utf8mb4 COLLATE=utf8mb4_0900_ai_ci
INSERT IGNORE INTO t (a) VALUES (ST_GeomFromText("POINT(1 1)"));
Warnings:
Warning	1366	Incorrect string value: '\xF0?\x00\x00\x00\x00...' for column 'b' at row 1
SELECT * FROM t;
a	b
             ð?      ð?	             
Warnings:
Warning	1366	Incorrect string value: '\xF0?\x00\x00\x00\x00...' for column 'b' at row 1
DELETE FROM t;
DELETE IGNORE FROM t;
Warnings:
Warning	1366	Incorrect string value: '\xF0?\x00\x00\x00\x00...' for column 'b' at row 1
Warning	1366	Incorrect string value: '\xF0?\x00\x00\x00\x00...' for column 'b' at row 1
CHECK TABLE t;
Table	Op	Msg_type	Msg_text
test.t	check	status	OK
DROP TABLE t;
# Testing example of type POINT and value ST_GeomFromText("POINT(1 1)")
SHOW CREATE TABLE t;
Table	Create Table
t	CREATE TABLE `t` (
  `a` point NOT NULL,
  `b` char(24) GENERATED ALWAYS AS (`a`) VIRTUAL NOT NULL,
  KEY `on_b` (`b`),
  KEY `on_b_prefix` (`b`(10))
) ENGINE=InnoDB DEFAULT CHARSET=utf8mb4 COLLATE=utf8mb4_0900_ai_ci
INSERT IGNORE INTO t (a) VALUES (ST_GeomFromText("POINT(1 1)"));
Warnings:
Warning	1366	Incorrect string value: '\xF0?\x00\x00\x00\x00...' for column 'b' at row 1
SELECT * FROM t;
a	b
             ð?      ð?	             
Warnings:
Warning	1366	Incorrect string value: '\xF0?\x00\x00\x00\x00...' for column 'b' at row 1
DELETE FROM t;
DELETE IGNORE FROM t;
Warnings:
Warning	1366	Incorrect string value: '\xF0?\x00\x00\x00\x00...' for column 'b' at row 1
Warning	1366	Incorrect string value: '\xF0?\x00\x00\x00\x00...' for column 'b' at row 1
CHECK TABLE t;
Table	Op	Msg_type	Msg_text
test.t	check	status	OK
DROP TABLE t;
# Testing example of type LINESTRING and value ST_GeomFromText("LINESTRING(0 0,1 1,2 2)")
SHOW CREATE TABLE t;
Table	Create Table
t	CREATE TABLE `t` (
  `a` linestring NOT NULL,
  `b` char(24) GENERATED ALWAYS AS (`a`) VIRTUAL NOT NULL,
  KEY `on_b` (`b`),
  KEY `on_b_prefix` (`b`(10))
) ENGINE=InnoDB DEFAULT CHARSET=utf8mb4 COLLATE=utf8mb4_0900_ai_ci
INSERT IGNORE INTO t (a) VALUES (ST_GeomFromText("LINESTRING(0 0,1 1,2 2)"));
Warnings:
Warning	1265	Data truncated for column 'b' at row 1
SELECT * FROM t;
a	b
                                ð?      ð?       @       @	                     
DELETE FROM t;
DELETE IGNORE FROM t;
CHECK TABLE t;
Table	Op	Msg_type	Msg_text
test.t	check	status	OK
DROP TABLE t;
# Testing example of type POLYGON and value ST_GeomFromText("POLYGON((0 0,1 0,1 1,0 1,0 0),(5 5,7 5,7 7,5 7,5 5))")
SHOW CREATE TABLE t;
Table	Create Table
t	CREATE TABLE `t` (
  `a` polygon NOT NULL,
  `b` char(24) GENERATED ALWAYS AS (`a`) VIRTUAL NOT NULL,
  KEY `on_b` (`b`),
  KEY `on_b_prefix` (`b`(10))
) ENGINE=InnoDB DEFAULT CHARSET=utf8mb4 COLLATE=utf8mb4_0900_ai_ci
INSERT IGNORE INTO t (a) VALUES (ST_GeomFromText("POLYGON((0 0,1 0,1 1,0 1,0 0),(5 5,7 5,7 7,5 7,5 5))"));
Warnings:
Warning	1265	Data truncated for column 'b' at row 1
SELECT * FROM t;
a	b
                                   ð?              ð?      ð?              ð?                         @      @      @      @      @      @      @      @      @      @	                    
DELETE FROM t;
DELETE IGNORE FROM t;
CHECK TABLE t;
Table	Op	Msg_type	Msg_text
test.t	check	status	OK
DROP TABLE t;
#
# Testing virtual column of type BINARY(12)
#
# Testing example of type JSON and value "{}"
SHOW CREATE TABLE t;
Table	Create Table
t	CREATE TABLE `t` (
  `a` json NOT NULL,
  `b` binary(12) GENERATED ALWAYS AS (`a`) VIRTUAL NOT NULL,
  KEY `on_b` (`b`),
  KEY `on_b_prefix` (`b`(10))
) ENGINE=InnoDB DEFAULT CHARSET=utf8mb4 COLLATE=utf8mb4_0900_ai_ci
INSERT IGNORE INTO t (a) VALUES ("{}");
SELECT * FROM t;
a	b
{}	{}          
DELETE FROM t;
DELETE IGNORE FROM t;
CHECK TABLE t;
Table	Op	Msg_type	Msg_text
test.t	check	status	OK
DROP TABLE t;
# Testing example of type JSON and value '["hello beautiful world"]'
SHOW CREATE TABLE t;
Table	Create Table
t	CREATE TABLE `t` (
  `a` json NOT NULL,
  `b` binary(12) GENERATED ALWAYS AS (`a`) VIRTUAL NOT NULL,
  KEY `on_b` (`b`),
  KEY `on_b_prefix` (`b`(10))
) ENGINE=InnoDB DEFAULT CHARSET=utf8mb4 COLLATE=utf8mb4_0900_ai_ci
INSERT IGNORE INTO t (a) VALUES ('["hello beautiful world"]');
Warnings:
Warning	1265	Data truncated for column 'b' at row 1
SELECT * FROM t;
a	b
["hello beautiful world"]	["hello beau
DELETE FROM t;
DELETE IGNORE FROM t;
CHECK TABLE t;
Table	Op	Msg_type	Msg_text
test.t	check	status	OK
DROP TABLE t;
# Testing example of type JSON and value "-1"
SHOW CREATE TABLE t;
Table	Create Table
t	CREATE TABLE `t` (
  `a` json NOT NULL,
  `b` binary(12) GENERATED ALWAYS AS (`a`) VIRTUAL NOT NULL,
  KEY `on_b` (`b`),
  KEY `on_b_prefix` (`b`(10))
) ENGINE=InnoDB DEFAULT CHARSET=utf8mb4 COLLATE=utf8mb4_0900_ai_ci
INSERT IGNORE INTO t (a) VALUES ("-1");
SELECT * FROM t;
a	b
-1	-1          
DELETE FROM t;
DELETE IGNORE FROM t;
CHECK TABLE t;
Table	Op	Msg_type	Msg_text
test.t	check	status	OK
DROP TABLE t;
# Testing example of type TINYINT and value -1
SHOW CREATE TABLE t;
Table	Create Table
t	CREATE TABLE `t` (
  `a` tinyint NOT NULL,
  `b` binary(12) GENERATED ALWAYS AS (`a`) VIRTUAL NOT NULL,
  KEY `on_b` (`b`),
  KEY `on_b_prefix` (`b`(10))
) ENGINE=InnoDB DEFAULT CHARSET=utf8mb4 COLLATE=utf8mb4_0900_ai_ci
INSERT IGNORE INTO t (a) VALUES (-1);
SELECT * FROM t;
a	b
-1	-1          
DELETE FROM t;
DELETE IGNORE FROM t;
CHECK TABLE t;
Table	Op	Msg_type	Msg_text
test.t	check	status	OK
DROP TABLE t;
# Testing example of type SMALLINT and value -1
SHOW CREATE TABLE t;
Table	Create Table
t	CREATE TABLE `t` (
  `a` smallint NOT NULL,
  `b` binary(12) GENERATED ALWAYS AS (`a`) VIRTUAL NOT NULL,
  KEY `on_b` (`b`),
  KEY `on_b_prefix` (`b`(10))
) ENGINE=InnoDB DEFAULT CHARSET=utf8mb4 COLLATE=utf8mb4_0900_ai_ci
INSERT IGNORE INTO t (a) VALUES (-1);
SELECT * FROM t;
a	b
-1	-1          
DELETE FROM t;
DELETE IGNORE FROM t;
CHECK TABLE t;
Table	Op	Msg_type	Msg_text
test.t	check	status	OK
DROP TABLE t;
# Testing example of type MEDIUMINT and value -1
SHOW CREATE TABLE t;
Table	Create Table
t	CREATE TABLE `t` (
  `a` mediumint NOT NULL,
  `b` binary(12) GENERATED ALWAYS AS (`a`) VIRTUAL NOT NULL,
  KEY `on_b` (`b`),
  KEY `on_b_prefix` (`b`(10))
) ENGINE=InnoDB DEFAULT CHARSET=utf8mb4 COLLATE=utf8mb4_0900_ai_ci
INSERT IGNORE INTO t (a) VALUES (-1);
SELECT * FROM t;
a	b
-1	-1          
DELETE FROM t;
DELETE IGNORE FROM t;
CHECK TABLE t;
Table	Op	Msg_type	Msg_text
test.t	check	status	OK
DROP TABLE t;
# Testing example of type INT and value 2000000000
SHOW CREATE TABLE t;
Table	Create Table
t	CREATE TABLE `t` (
  `a` int NOT NULL,
  `b` binary(12) GENERATED ALWAYS AS (`a`) VIRTUAL NOT NULL,
  KEY `on_b` (`b`),
  KEY `on_b_prefix` (`b`(10))
) ENGINE=InnoDB DEFAULT CHARSET=utf8mb4 COLLATE=utf8mb4_0900_ai_ci
INSERT IGNORE INTO t (a) VALUES (2000000000);
SELECT * FROM t;
a	b
2000000000	2000000000  
DELETE FROM t;
DELETE IGNORE FROM t;
CHECK TABLE t;
Table	Op	Msg_type	Msg_text
test.t	check	status	OK
DROP TABLE t;
# Testing example of type INT and value -2000000000
SHOW CREATE TABLE t;
Table	Create Table
t	CREATE TABLE `t` (
  `a` int NOT NULL,
  `b` binary(12) GENERATED ALWAYS AS (`a`) VIRTUAL NOT NULL,
  KEY `on_b` (`b`),
  KEY `on_b_prefix` (`b`(10))
) ENGINE=InnoDB DEFAULT CHARSET=utf8mb4 COLLATE=utf8mb4_0900_ai_ci
INSERT IGNORE INTO t (a) VALUES (-2000000000);
SELECT * FROM t;
a	b
-2000000000	-2000000000 
DELETE FROM t;
DELETE IGNORE FROM t;
CHECK TABLE t;
Table	Op	Msg_type	Msg_text
test.t	check	status	OK
DROP TABLE t;
# Testing example of type INT UNSIGNED and value 4000000000
SHOW CREATE TABLE t;
Table	Create Table
t	CREATE TABLE `t` (
  `a` int unsigned NOT NULL,
  `b` binary(12) GENERATED ALWAYS AS (`a`) VIRTUAL NOT NULL,
  KEY `on_b` (`b`),
  KEY `on_b_prefix` (`b`(10))
) ENGINE=InnoDB DEFAULT CHARSET=utf8mb4 COLLATE=utf8mb4_0900_ai_ci
INSERT IGNORE INTO t (a) VALUES (4000000000);
SELECT * FROM t;
a	b
4000000000	4000000000  
DELETE FROM t;
DELETE IGNORE FROM t;
CHECK TABLE t;
Table	Op	Msg_type	Msg_text
test.t	check	status	OK
DROP TABLE t;
# Testing example of type BIGINT and value 2000000000000000000
SHOW CREATE TABLE t;
Table	Create Table
t	CREATE TABLE `t` (
  `a` bigint NOT NULL,
  `b` binary(12) GENERATED ALWAYS AS (`a`) VIRTUAL NOT NULL,
  KEY `on_b` (`b`),
  KEY `on_b_prefix` (`b`(10))
) ENGINE=InnoDB DEFAULT CHARSET=utf8mb4 COLLATE=utf8mb4_0900_ai_ci
INSERT IGNORE INTO t (a) VALUES (2000000000000000000);
Warnings:
Warning	1265	Data truncated for column 'b' at row 1
SELECT * FROM t;
a	b
2000000000000000000	200000000000
DELETE FROM t;
DELETE IGNORE FROM t;
CHECK TABLE t;
Table	Op	Msg_type	Msg_text
test.t	check	status	OK
DROP TABLE t;
# Testing example of type BIGINT and value -2000000000000000000
SHOW CREATE TABLE t;
Table	Create Table
t	CREATE TABLE `t` (
  `a` bigint NOT NULL,
  `b` binary(12) GENERATED ALWAYS AS (`a`) VIRTUAL NOT NULL,
  KEY `on_b` (`b`),
  KEY `on_b_prefix` (`b`(10))
) ENGINE=InnoDB DEFAULT CHARSET=utf8mb4 COLLATE=utf8mb4_0900_ai_ci
INSERT IGNORE INTO t (a) VALUES (-2000000000000000000);
Warnings:
Warning	1265	Data truncated for column 'b' at row 1
SELECT * FROM t;
a	b
-2000000000000000000	-20000000000
DELETE FROM t;
DELETE IGNORE FROM t;
CHECK TABLE t;
Table	Op	Msg_type	Msg_text
test.t	check	status	OK
DROP TABLE t;
# Testing example of type FLOAT and value -1.23456
SHOW CREATE TABLE t;
Table	Create Table
t	CREATE TABLE `t` (
  `a` float NOT NULL,
  `b` binary(12) GENERATED ALWAYS AS (`a`) VIRTUAL NOT NULL,
  KEY `on_b` (`b`),
  KEY `on_b_prefix` (`b`(10))
) ENGINE=InnoDB DEFAULT CHARSET=utf8mb4 COLLATE=utf8mb4_0900_ai_ci
INSERT IGNORE INTO t (a) VALUES (-1.23456);
SELECT * FROM t;
a	b
-1.23456	-1.234560013
DELETE FROM t;
DELETE IGNORE FROM t;
CHECK TABLE t;
Table	Op	Msg_type	Msg_text
test.t	check	status	OK
DROP TABLE t;
# Testing example of type FLOAT and value -1e38
SHOW CREATE TABLE t;
Table	Create Table
t	CREATE TABLE `t` (
  `a` float NOT NULL,
  `b` binary(12) GENERATED ALWAYS AS (`a`) VIRTUAL NOT NULL,
  KEY `on_b` (`b`),
  KEY `on_b_prefix` (`b`(10))
) ENGINE=InnoDB DEFAULT CHARSET=utf8mb4 COLLATE=utf8mb4_0900_ai_ci
INSERT IGNORE INTO t (a) VALUES (-1e38);
SELECT * FROM t;
a	b
-1e38	-1e38       
DELETE FROM t;
DELETE IGNORE FROM t;
CHECK TABLE t;
Table	Op	Msg_type	Msg_text
test.t	check	status	OK
DROP TABLE t;
# Testing example of type FLOAT and value 1e38
SHOW CREATE TABLE t;
Table	Create Table
t	CREATE TABLE `t` (
  `a` float NOT NULL,
  `b` binary(12) GENERATED ALWAYS AS (`a`) VIRTUAL NOT NULL,
  KEY `on_b` (`b`),
  KEY `on_b_prefix` (`b`(10))
) ENGINE=InnoDB DEFAULT CHARSET=utf8mb4 COLLATE=utf8mb4_0900_ai_ci
INSERT IGNORE INTO t (a) VALUES (1e38);
SELECT * FROM t;
a	b
1e38	9.9999997e37
DELETE FROM t;
DELETE IGNORE FROM t;
CHECK TABLE t;
Table	Op	Msg_type	Msg_text
test.t	check	status	OK
DROP TABLE t;
# Testing example of type DOUBLE and value -1.23456789012345
SHOW CREATE TABLE t;
Table	Create Table
t	CREATE TABLE `t` (
  `a` double NOT NULL,
  `b` binary(12) GENERATED ALWAYS AS (`a`) VIRTUAL NOT NULL,
  KEY `on_b` (`b`),
  KEY `on_b_prefix` (`b`(10))
) ENGINE=InnoDB DEFAULT CHARSET=utf8mb4 COLLATE=utf8mb4_0900_ai_ci
INSERT IGNORE INTO t (a) VALUES (-1.23456789012345);
SELECT * FROM t;
a	b
-1.23456789012345	-1.23456789 
DELETE FROM t;
DELETE IGNORE FROM t;
CHECK TABLE t;
Table	Op	Msg_type	Msg_text
test.t	check	status	OK
DROP TABLE t;
# Testing example of type DOUBLE and value 1.23456789012345
SHOW CREATE TABLE t;
Table	Create Table
t	CREATE TABLE `t` (
  `a` double NOT NULL,
  `b` binary(12) GENERATED ALWAYS AS (`a`) VIRTUAL NOT NULL,
  KEY `on_b` (`b`),
  KEY `on_b_prefix` (`b`(10))
) ENGINE=InnoDB DEFAULT CHARSET=utf8mb4 COLLATE=utf8mb4_0900_ai_ci
INSERT IGNORE INTO t (a) VALUES (1.23456789012345);
SELECT * FROM t;
a	b
1.23456789012345	1.2345678901
DELETE FROM t;
DELETE IGNORE FROM t;
CHECK TABLE t;
Table	Op	Msg_type	Msg_text
test.t	check	status	OK
DROP TABLE t;
# Testing example of type DOUBLE and value -1e300
SHOW CREATE TABLE t;
Table	Create Table
t	CREATE TABLE `t` (
  `a` double NOT NULL,
  `b` binary(12) GENERATED ALWAYS AS (`a`) VIRTUAL NOT NULL,
  KEY `on_b` (`b`),
  KEY `on_b_prefix` (`b`(10))
) ENGINE=InnoDB DEFAULT CHARSET=utf8mb4 COLLATE=utf8mb4_0900_ai_ci
INSERT IGNORE INTO t (a) VALUES (-1e300);
SELECT * FROM t;
a	b
-1e300	-1e300      
DELETE FROM t;
DELETE IGNORE FROM t;
CHECK TABLE t;
Table	Op	Msg_type	Msg_text
test.t	check	status	OK
DROP TABLE t;
# Testing example of type DOUBLE and value 1e300
SHOW CREATE TABLE t;
Table	Create Table
t	CREATE TABLE `t` (
  `a` double NOT NULL,
  `b` binary(12) GENERATED ALWAYS AS (`a`) VIRTUAL NOT NULL,
  KEY `on_b` (`b`),
  KEY `on_b_prefix` (`b`(10))
) ENGINE=InnoDB DEFAULT CHARSET=utf8mb4 COLLATE=utf8mb4_0900_ai_ci
INSERT IGNORE INTO t (a) VALUES (1e300);
SELECT * FROM t;
a	b
1e300	1e300       
DELETE FROM t;
DELETE IGNORE FROM t;
CHECK TABLE t;
Table	Op	Msg_type	Msg_text
test.t	check	status	OK
DROP TABLE t;
# Testing example of type DECIMAL(4,2) and value -10.99
SHOW CREATE TABLE t;
Table	Create Table
t	CREATE TABLE `t` (
  `a` decimal(4,2) NOT NULL,
  `b` binary(12) GENERATED ALWAYS AS (`a`) VIRTUAL NOT NULL,
  KEY `on_b` (`b`),
  KEY `on_b_prefix` (`b`(10))
) ENGINE=InnoDB DEFAULT CHARSET=utf8mb4 COLLATE=utf8mb4_0900_ai_ci
INSERT IGNORE INTO t (a) VALUES (-10.99);
SELECT * FROM t;
a	b
-10.99	-10.99      
DELETE FROM t;
DELETE IGNORE FROM t;
CHECK TABLE t;
Table	Op	Msg_type	Msg_text
test.t	check	status	OK
DROP TABLE t;
# Testing example of type DECIMAL(34,4) and value 20000000000000000000000000000.0001
SHOW CREATE TABLE t;
Table	Create Table
t	CREATE TABLE `t` (
  `a` decimal(34,4) NOT NULL,
  `b` binary(12) GENERATED ALWAYS AS (`a`) VIRTUAL NOT NULL,
  KEY `on_b` (`b`),
  KEY `on_b_prefix` (`b`(10))
) ENGINE=InnoDB DEFAULT CHARSET=utf8mb4 COLLATE=utf8mb4_0900_ai_ci
INSERT IGNORE INTO t (a) VALUES (20000000000000000000000000000.0001);
Warnings:
Warning	1265	Data truncated for column 'b' at row 1
SELECT * FROM t;
a	b
20000000000000000000000000000.0001	200000000000
DELETE FROM t;
DELETE IGNORE FROM t;
CHECK TABLE t;
Table	Op	Msg_type	Msg_text
test.t	check	status	OK
DROP TABLE t;
# Testing example of type DECIMAL(34,4) and value -20000000000000000000000000000.0001
SHOW CREATE TABLE t;
Table	Create Table
t	CREATE TABLE `t` (
  `a` decimal(34,4) NOT NULL,
  `b` binary(12) GENERATED ALWAYS AS (`a`) VIRTUAL NOT NULL,
  KEY `on_b` (`b`),
  KEY `on_b_prefix` (`b`(10))
) ENGINE=InnoDB DEFAULT CHARSET=utf8mb4 COLLATE=utf8mb4_0900_ai_ci
INSERT IGNORE INTO t (a) VALUES (-20000000000000000000000000000.0001);
Warnings:
Warning	1265	Data truncated for column 'b' at row 1
SELECT * FROM t;
a	b
-20000000000000000000000000000.0001	-20000000000
DELETE FROM t;
DELETE IGNORE FROM t;
CHECK TABLE t;
Table	Op	Msg_type	Msg_text
test.t	check	status	OK
DROP TABLE t;
# Testing example of type BIT(64) and value 0xDEADBEEFC0FEBABE
SHOW CREATE TABLE t;
Table	Create Table
t	CREATE TABLE `t` (
  `a` bit(64) NOT NULL,
  `b` binary(12) GENERATED ALWAYS AS (`a`) VIRTUAL NOT NULL,
  KEY `on_b` (`b`),
  KEY `on_b_prefix` (`b`(10))
) ENGINE=InnoDB DEFAULT CHARSET=utf8mb4 COLLATE=utf8mb4_0900_ai_ci
INSERT IGNORE INTO t (a) VALUES (0xDEADBEEFC0FEBABE);
Warnings:
Warning	1265	Data truncated for column 'b' at row 1
SELECT * FROM t;
a	b
Þ­¾ïÀþº¾	160456909843
DELETE FROM t;
DELETE IGNORE FROM t;
CHECK TABLE t;
Table	Op	Msg_type	Msg_text
test.t	check	status	OK
DROP TABLE t;
# Testing example of type BIT(4) and value 0b1000
SHOW CREATE TABLE t;
Table	Create Table
t	CREATE TABLE `t` (
  `a` bit(4) NOT NULL,
  `b` binary(12) GENERATED ALWAYS AS (`a`) VIRTUAL NOT NULL,
  KEY `on_b` (`b`),
  KEY `on_b_prefix` (`b`(10))
) ENGINE=InnoDB DEFAULT CHARSET=utf8mb4 COLLATE=utf8mb4_0900_ai_ci
INSERT IGNORE INTO t (a) VALUES (0b1000);
SELECT * FROM t;
a	b
	8           
DELETE FROM t;
DELETE IGNORE FROM t;
CHECK TABLE t;
Table	Op	Msg_type	Msg_text
test.t	check	status	OK
DROP TABLE t;
# Testing example of type YEAR and value 2020
SHOW CREATE TABLE t;
Table	Create Table
t	CREATE TABLE `t` (
  `a` year NOT NULL,
  `b` binary(12) GENERATED ALWAYS AS (`a`) VIRTUAL NOT NULL,
  KEY `on_b` (`b`),
  KEY `on_b_prefix` (`b`(10))
) ENGINE=InnoDB DEFAULT CHARSET=utf8mb4 COLLATE=utf8mb4_0900_ai_ci
INSERT IGNORE INTO t (a) VALUES (2020);
SELECT * FROM t;
a	b
2020	2020        
DELETE FROM t;
DELETE IGNORE FROM t;
CHECK TABLE t;
Table	Op	Msg_type	Msg_text
test.t	check	status	OK
DROP TABLE t;
# Testing example of type DATE and value "2030-04-05"
SHOW CREATE TABLE t;
Table	Create Table
t	CREATE TABLE `t` (
  `a` date NOT NULL,
  `b` binary(12) GENERATED ALWAYS AS (`a`) VIRTUAL NOT NULL,
  KEY `on_b` (`b`),
  KEY `on_b_prefix` (`b`(10))
) ENGINE=InnoDB DEFAULT CHARSET=utf8mb4 COLLATE=utf8mb4_0900_ai_ci
INSERT IGNORE INTO t (a) VALUES ("2030-04-05");
SELECT * FROM t;
a	b
2030-04-05	2030-04-05  
DELETE FROM t;
DELETE IGNORE FROM t;
CHECK TABLE t;
Table	Op	Msg_type	Msg_text
test.t	check	status	OK
DROP TABLE t;
# Testing example of type TIME and value "11:12:13"
SHOW CREATE TABLE t;
Table	Create Table
t	CREATE TABLE `t` (
  `a` time NOT NULL,
  `b` binary(12) GENERATED ALWAYS AS (`a`) VIRTUAL NOT NULL,
  KEY `on_b` (`b`),
  KEY `on_b_prefix` (`b`(10))
) ENGINE=InnoDB DEFAULT CHARSET=utf8mb4 COLLATE=utf8mb4_0900_ai_ci
INSERT IGNORE INTO t (a) VALUES ("11:12:13");
SELECT * FROM t;
a	b
11:12:13	11:12:13    
DELETE FROM t;
DELETE IGNORE FROM t;
CHECK TABLE t;
Table	Op	Msg_type	Msg_text
test.t	check	status	OK
DROP TABLE t;
# Testing example of type DATETIME and value "2030-04-05 11:12:13"
SHOW CREATE TABLE t;
Table	Create Table
t	CREATE TABLE `t` (
  `a` datetime NOT NULL,
  `b` binary(12) GENERATED ALWAYS AS (`a`) VIRTUAL NOT NULL,
  KEY `on_b` (`b`),
  KEY `on_b_prefix` (`b`(10))
) ENGINE=InnoDB DEFAULT CHARSET=utf8mb4 COLLATE=utf8mb4_0900_ai_ci
INSERT IGNORE INTO t (a) VALUES ("2030-04-05 11:12:13");
Warnings:
Warning	1265	Data truncated for column 'b' at row 1
SELECT * FROM t;
a	b
2030-04-05 11:12:13	2030-04-05 1
DELETE FROM t;
DELETE IGNORE FROM t;
CHECK TABLE t;
Table	Op	Msg_type	Msg_text
test.t	check	status	OK
DROP TABLE t;
# Testing example of type TIMESTAMP and value "2030-04-05 11:12:13"
SHOW CREATE TABLE t;
Table	Create Table
t	CREATE TABLE `t` (
  `a` timestamp NOT NULL,
  `b` binary(12) GENERATED ALWAYS AS (`a`) VIRTUAL NOT NULL,
  KEY `on_b` (`b`),
  KEY `on_b_prefix` (`b`(10))
) ENGINE=InnoDB DEFAULT CHARSET=utf8mb4 COLLATE=utf8mb4_0900_ai_ci
INSERT IGNORE INTO t (a) VALUES ("2030-04-05 11:12:13");
Warnings:
Warning	1265	Data truncated for column 'b' at row 1
SELECT * FROM t;
a	b
2030-04-05 11:12:13	2030-04-05 1
DELETE FROM t;
DELETE IGNORE FROM t;
CHECK TABLE t;
Table	Op	Msg_type	Msg_text
test.t	check	status	OK
DROP TABLE t;
# Testing example of type CHAR(40) and value "2000000000000000000000000000000000000"
SHOW CREATE TABLE t;
Table	Create Table
t	CREATE TABLE `t` (
  `a` char(40) NOT NULL,
  `b` binary(12) GENERATED ALWAYS AS (`a`) VIRTUAL NOT NULL,
  KEY `on_b` (`b`),
  KEY `on_b_prefix` (`b`(10))
) ENGINE=InnoDB DEFAULT CHARSET=utf8mb4 COLLATE=utf8mb4_0900_ai_ci
INSERT IGNORE INTO t (a) VALUES ("2000000000000000000000000000000000000");
Warnings:
Warning	1265	Data truncated for column 'b' at row 1
SELECT * FROM t;
a	b
2000000000000000000000000000000000000	200000000000
DELETE FROM t;
DELETE IGNORE FROM t;
CHECK TABLE t;
Table	Op	Msg_type	Msg_text
test.t	check	status	OK
DROP TABLE t;
# Testing example of type BINARY(45) and value "200000000000000000000000000000000000000000"
SHOW CREATE TABLE t;
Table	Create Table
t	CREATE TABLE `t` (
  `a` binary(45) NOT NULL,
  `b` binary(12) GENERATED ALWAYS AS (`a`) VIRTUAL NOT NULL,
  KEY `on_b` (`b`),
  KEY `on_b_prefix` (`b`(10))
) ENGINE=InnoDB DEFAULT CHARSET=utf8mb4 COLLATE=utf8mb4_0900_ai_ci
INSERT IGNORE INTO t (a) VALUES ("200000000000000000000000000000000000000000");
Warnings:
Warning	1265	Data truncated for column 'b' at row 1
SELECT * FROM t;
a	b
200000000000000000000000000000000000000000   	200000000000
DELETE FROM t;
DELETE IGNORE FROM t;
CHECK TABLE t;
Table	Op	Msg_type	Msg_text
test.t	check	status	OK
DROP TABLE t;
# Testing example of type VARCHAR(50) and value "2000000000000000000000000000000000000000000000000"
SHOW CREATE TABLE t;
Table	Create Table
t	CREATE TABLE `t` (
  `a` varchar(50) NOT NULL,
  `b` binary(12) GENERATED ALWAYS AS (`a`) VIRTUAL NOT NULL,
  KEY `on_b` (`b`),
  KEY `on_b_prefix` (`b`(10))
) ENGINE=InnoDB DEFAULT CHARSET=utf8mb4 COLLATE=utf8mb4_0900_ai_ci
INSERT IGNORE INTO t (a) VALUES ("2000000000000000000000000000000000000000000000000");
Warnings:
Warning	1265	Data truncated for column 'b' at row 1
SELECT * FROM t;
a	b
2000000000000000000000000000000000000000000000000	200000000000
DELETE FROM t;
DELETE IGNORE FROM t;
CHECK TABLE t;
Table	Op	Msg_type	Msg_text
test.t	check	status	OK
DROP TABLE t;
# Testing example of type CHAR(24) and value "hello beautiful world"
SHOW CREATE TABLE t;
Table	Create Table
t	CREATE TABLE `t` (
  `a` char(24) NOT NULL,
  `b` binary(12) GENERATED ALWAYS AS (`a`) VIRTUAL NOT NULL,
  KEY `on_b` (`b`),
  KEY `on_b_prefix` (`b`(10))
) ENGINE=InnoDB DEFAULT CHARSET=utf8mb4 COLLATE=utf8mb4_0900_ai_ci
INSERT IGNORE INTO t (a) VALUES ("hello beautiful world");
Warnings:
Warning	1265	Data truncated for column 'b' at row 1
SELECT * FROM t;
a	b
hello beautiful world	hello beauti
DELETE FROM t;
DELETE IGNORE FROM t;
CHECK TABLE t;
Table	Op	Msg_type	Msg_text
test.t	check	status	OK
DROP TABLE t;
# Testing example of type BINARY(12) and value "hello world"
SHOW CREATE TABLE t;
Table	Create Table
t	CREATE TABLE `t` (
  `a` binary(12) NOT NULL,
  `b` binary(12) GENERATED ALWAYS AS (`a`) VIRTUAL NOT NULL,
  KEY `on_b` (`b`),
  KEY `on_b_prefix` (`b`(10))
) ENGINE=InnoDB DEFAULT CHARSET=utf8mb4 COLLATE=utf8mb4_0900_ai_ci
INSERT IGNORE INTO t (a) VALUES ("hello world");
SELECT * FROM t;
a	b
hello world 	hello world 
DELETE FROM t;
DELETE IGNORE FROM t;
CHECK TABLE t;
Table	Op	Msg_type	Msg_text
test.t	check	status	OK
DROP TABLE t;
# Testing example of type VARCHAR(6) and value "hello"
SHOW CREATE TABLE t;
Table	Create Table
t	CREATE TABLE `t` (
  `a` varchar(6) NOT NULL,
  `b` binary(12) GENERATED ALWAYS AS (`a`) VIRTUAL NOT NULL,
  KEY `on_b` (`b`),
  KEY `on_b_prefix` (`b`(10))
) ENGINE=InnoDB DEFAULT CHARSET=utf8mb4 COLLATE=utf8mb4_0900_ai_ci
INSERT IGNORE INTO t (a) VALUES ("hello");
SELECT * FROM t;
a	b
hello	hello       
DELETE FROM t;
DELETE IGNORE FROM t;
CHECK TABLE t;
Table	Op	Msg_type	Msg_text
test.t	check	status	OK
DROP TABLE t;
# Testing example of type ENUM("up","down") and value "up"
SHOW CREATE TABLE t;
Table	Create Table
t	CREATE TABLE `t` (
  `a` enum('up','down') NOT NULL,
  `b` binary(12) GENERATED ALWAYS AS (`a`) VIRTUAL NOT NULL,
  KEY `on_b` (`b`),
  KEY `on_b_prefix` (`b`(10))
) ENGINE=InnoDB DEFAULT CHARSET=utf8mb4 COLLATE=utf8mb4_0900_ai_ci
INSERT IGNORE INTO t (a) VALUES ("up");
SELECT * FROM t;
a	b
up	up          
DELETE FROM t;
DELETE IGNORE FROM t;
CHECK TABLE t;
Table	Op	Msg_type	Msg_text
test.t	check	status	OK
DROP TABLE t;
# Testing example of type SET("up","down") and value "up,down"
SHOW CREATE TABLE t;
Table	Create Table
t	CREATE TABLE `t` (
  `a` set('up','down') NOT NULL,
  `b` binary(12) GENERATED ALWAYS AS (`a`) VIRTUAL NOT NULL,
  KEY `on_b` (`b`),
  KEY `on_b_prefix` (`b`(10))
) ENGINE=InnoDB DEFAULT CHARSET=utf8mb4 COLLATE=utf8mb4_0900_ai_ci
INSERT IGNORE INTO t (a) VALUES ("up,down");
SELECT * FROM t;
a	b
up,down	up,down     
DELETE FROM t;
DELETE IGNORE FROM t;
CHECK TABLE t;
Table	Op	Msg_type	Msg_text
test.t	check	status	OK
DROP TABLE t;
# Testing example of type GEOMETRY and value ST_GeomFromText("POINT(1 1)")
SHOW CREATE TABLE t;
Table	Create Table
t	CREATE TABLE `t` (
  `a` geometry NOT NULL,
  `b` binary(12) GENERATED ALWAYS AS (`a`) VIRTUAL NOT NULL,
  KEY `on_b` (`b`),
  KEY `on_b_prefix` (`b`(10))
) ENGINE=InnoDB DEFAULT CHARSET=utf8mb4 COLLATE=utf8mb4_0900_ai_ci
INSERT IGNORE INTO t (a) VALUES (ST_GeomFromText("POINT(1 1)"));
Warnings:
Warning	1265	Data truncated for column 'b' at row 1
SELECT * FROM t;
a	b
             ð?      ð?	          
DELETE FROM t;
DELETE IGNORE FROM t;
CHECK TABLE t;
Table	Op	Msg_type	Msg_text
test.t	check	status	OK
DROP TABLE t;
# Testing example of type POINT and value ST_GeomFromText("POINT(1 1)")
SHOW CREATE TABLE t;
Table	Create Table
t	CREATE TABLE `t` (
  `a` point NOT NULL,
  `b` binary(12) GENERATED ALWAYS AS (`a`) VIRTUAL NOT NULL,
  KEY `on_b` (`b`),
  KEY `on_b_prefix` (`b`(10))
) ENGINE=InnoDB DEFAULT CHARSET=utf8mb4 COLLATE=utf8mb4_0900_ai_ci
INSERT IGNORE INTO t (a) VALUES (ST_GeomFromText("POINT(1 1)"));
Warnings:
Warning	1265	Data truncated for column 'b' at row 1
SELECT * FROM t;
a	b
             ð?      ð?	          
DELETE FROM t;
DELETE IGNORE FROM t;
CHECK TABLE t;
Table	Op	Msg_type	Msg_text
test.t	check	status	OK
DROP TABLE t;
# Testing example of type LINESTRING and value ST_GeomFromText("LINESTRING(0 0,1 1,2 2)")
SHOW CREATE TABLE t;
Table	Create Table
t	CREATE TABLE `t` (
  `a` linestring NOT NULL,
  `b` binary(12) GENERATED ALWAYS AS (`a`) VIRTUAL NOT NULL,
  KEY `on_b` (`b`),
  KEY `on_b_prefix` (`b`(10))
) ENGINE=InnoDB DEFAULT CHARSET=utf8mb4 COLLATE=utf8mb4_0900_ai_ci
INSERT IGNORE INTO t (a) VALUES (ST_GeomFromText("LINESTRING(0 0,1 1,2 2)"));
Warnings:
Warning	1265	Data truncated for column 'b' at row 1
SELECT * FROM t;
a	b
                                ð?      ð?       @       @	         
DELETE FROM t;
DELETE IGNORE FROM t;
CHECK TABLE t;
Table	Op	Msg_type	Msg_text
test.t	check	status	OK
DROP TABLE t;
# Testing example of type POLYGON and value ST_GeomFromText("POLYGON((0 0,1 0,1 1,0 1,0 0),(5 5,7 5,7 7,5 7,5 5))")
SHOW CREATE TABLE t;
Table	Create Table
t	CREATE TABLE `t` (
  `a` polygon NOT NULL,
  `b` binary(12) GENERATED ALWAYS AS (`a`) VIRTUAL NOT NULL,
  KEY `on_b` (`b`),
  KEY `on_b_prefix` (`b`(10))
) ENGINE=InnoDB DEFAULT CHARSET=utf8mb4 COLLATE=utf8mb4_0900_ai_ci
INSERT IGNORE INTO t (a) VALUES (ST_GeomFromText("POLYGON((0 0,1 0,1 1,0 1,0 0),(5 5,7 5,7 7,5 7,5 5))"));
Warnings:
Warning	1265	Data truncated for column 'b' at row 1
SELECT * FROM t;
a	b
                                   ð?              ð?      ð?              ð?                         @      @      @      @      @      @      @      @      @      @	         
DELETE FROM t;
DELETE IGNORE FROM t;
CHECK TABLE t;
Table	Op	Msg_type	Msg_text
test.t	check	status	OK
DROP TABLE t;
#
# Testing virtual column of type VARCHAR(6)
#
# Testing example of type JSON and value "{}"
SHOW CREATE TABLE t;
Table	Create Table
t	CREATE TABLE `t` (
  `a` json NOT NULL,
  `b` varchar(6) GENERATED ALWAYS AS (`a`) VIRTUAL NOT NULL,
  KEY `on_b` (`b`)
) ENGINE=InnoDB DEFAULT CHARSET=utf8mb4 COLLATE=utf8mb4_0900_ai_ci
INSERT IGNORE INTO t (a) VALUES ("{}");
SELECT * FROM t;
a	b
{}	{}
DELETE FROM t;
DELETE IGNORE FROM t;
CHECK TABLE t;
Table	Op	Msg_type	Msg_text
test.t	check	status	OK
DROP TABLE t;
# Testing example of type JSON and value '["hello beautiful world"]'
SHOW CREATE TABLE t;
Table	Create Table
t	CREATE TABLE `t` (
  `a` json NOT NULL,
  `b` varchar(6) GENERATED ALWAYS AS (`a`) VIRTUAL NOT NULL,
  KEY `on_b` (`b`)
) ENGINE=InnoDB DEFAULT CHARSET=utf8mb4 COLLATE=utf8mb4_0900_ai_ci
INSERT IGNORE INTO t (a) VALUES ('["hello beautiful world"]');
Warnings:
Warning	1265	Data truncated for column 'b' at row 1
SELECT * FROM t;
a	b
["hello beautiful world"]	["hell
DELETE FROM t;
DELETE IGNORE FROM t;
CHECK TABLE t;
Table	Op	Msg_type	Msg_text
test.t	check	status	OK
DROP TABLE t;
# Testing example of type JSON and value "-1"
SHOW CREATE TABLE t;
Table	Create Table
t	CREATE TABLE `t` (
  `a` json NOT NULL,
  `b` varchar(6) GENERATED ALWAYS AS (`a`) VIRTUAL NOT NULL,
  KEY `on_b` (`b`)
) ENGINE=InnoDB DEFAULT CHARSET=utf8mb4 COLLATE=utf8mb4_0900_ai_ci
INSERT IGNORE INTO t (a) VALUES ("-1");
SELECT * FROM t;
a	b
-1	-1
DELETE FROM t;
DELETE IGNORE FROM t;
CHECK TABLE t;
Table	Op	Msg_type	Msg_text
test.t	check	status	OK
DROP TABLE t;
# Testing example of type TINYINT and value -1
SHOW CREATE TABLE t;
Table	Create Table
t	CREATE TABLE `t` (
  `a` tinyint NOT NULL,
  `b` varchar(6) GENERATED ALWAYS AS (`a`) VIRTUAL NOT NULL,
  KEY `on_b` (`b`)
) ENGINE=InnoDB DEFAULT CHARSET=utf8mb4 COLLATE=utf8mb4_0900_ai_ci
INSERT IGNORE INTO t (a) VALUES (-1);
SELECT * FROM t;
a	b
-1	-1
DELETE FROM t;
DELETE IGNORE FROM t;
CHECK TABLE t;
Table	Op	Msg_type	Msg_text
test.t	check	status	OK
DROP TABLE t;
# Testing example of type SMALLINT and value -1
SHOW CREATE TABLE t;
Table	Create Table
t	CREATE TABLE `t` (
  `a` smallint NOT NULL,
  `b` varchar(6) GENERATED ALWAYS AS (`a`) VIRTUAL NOT NULL,
  KEY `on_b` (`b`)
) ENGINE=InnoDB DEFAULT CHARSET=utf8mb4 COLLATE=utf8mb4_0900_ai_ci
INSERT IGNORE INTO t (a) VALUES (-1);
SELECT * FROM t;
a	b
-1	-1
DELETE FROM t;
DELETE IGNORE FROM t;
CHECK TABLE t;
Table	Op	Msg_type	Msg_text
test.t	check	status	OK
DROP TABLE t;
# Testing example of type MEDIUMINT and value -1
SHOW CREATE TABLE t;
Table	Create Table
t	CREATE TABLE `t` (
  `a` mediumint NOT NULL,
  `b` varchar(6) GENERATED ALWAYS AS (`a`) VIRTUAL NOT NULL,
  KEY `on_b` (`b`)
) ENGINE=InnoDB DEFAULT CHARSET=utf8mb4 COLLATE=utf8mb4_0900_ai_ci
INSERT IGNORE INTO t (a) VALUES (-1);
SELECT * FROM t;
a	b
-1	-1
DELETE FROM t;
DELETE IGNORE FROM t;
CHECK TABLE t;
Table	Op	Msg_type	Msg_text
test.t	check	status	OK
DROP TABLE t;
# Testing example of type INT and value 2000000000
SHOW CREATE TABLE t;
Table	Create Table
t	CREATE TABLE `t` (
  `a` int NOT NULL,
  `b` varchar(6) GENERATED ALWAYS AS (`a`) VIRTUAL NOT NULL,
  KEY `on_b` (`b`)
) ENGINE=InnoDB DEFAULT CHARSET=utf8mb4 COLLATE=utf8mb4_0900_ai_ci
INSERT IGNORE INTO t (a) VALUES (2000000000);
Warnings:
Warning	1265	Data truncated for column 'b' at row 1
SELECT * FROM t;
a	b
2000000000	200000
DELETE FROM t;
DELETE IGNORE FROM t;
CHECK TABLE t;
Table	Op	Msg_type	Msg_text
test.t	check	status	OK
DROP TABLE t;
# Testing example of type INT and value -2000000000
SHOW CREATE TABLE t;
Table	Create Table
t	CREATE TABLE `t` (
  `a` int NOT NULL,
  `b` varchar(6) GENERATED ALWAYS AS (`a`) VIRTUAL NOT NULL,
  KEY `on_b` (`b`)
) ENGINE=InnoDB DEFAULT CHARSET=utf8mb4 COLLATE=utf8mb4_0900_ai_ci
INSERT IGNORE INTO t (a) VALUES (-2000000000);
Warnings:
Warning	1265	Data truncated for column 'b' at row 1
SELECT * FROM t;
a	b
-2000000000	-20000
DELETE FROM t;
DELETE IGNORE FROM t;
CHECK TABLE t;
Table	Op	Msg_type	Msg_text
test.t	check	status	OK
DROP TABLE t;
# Testing example of type INT UNSIGNED and value 4000000000
SHOW CREATE TABLE t;
Table	Create Table
t	CREATE TABLE `t` (
  `a` int unsigned NOT NULL,
  `b` varchar(6) GENERATED ALWAYS AS (`a`) VIRTUAL NOT NULL,
  KEY `on_b` (`b`)
) ENGINE=InnoDB DEFAULT CHARSET=utf8mb4 COLLATE=utf8mb4_0900_ai_ci
INSERT IGNORE INTO t (a) VALUES (4000000000);
Warnings:
Warning	1265	Data truncated for column 'b' at row 1
SELECT * FROM t;
a	b
4000000000	400000
DELETE FROM t;
DELETE IGNORE FROM t;
CHECK TABLE t;
Table	Op	Msg_type	Msg_text
test.t	check	status	OK
DROP TABLE t;
# Testing example of type BIGINT and value 2000000000000000000
SHOW CREATE TABLE t;
Table	Create Table
t	CREATE TABLE `t` (
  `a` bigint NOT NULL,
  `b` varchar(6) GENERATED ALWAYS AS (`a`) VIRTUAL NOT NULL,
  KEY `on_b` (`b`)
) ENGINE=InnoDB DEFAULT CHARSET=utf8mb4 COLLATE=utf8mb4_0900_ai_ci
INSERT IGNORE INTO t (a) VALUES (2000000000000000000);
Warnings:
Warning	1265	Data truncated for column 'b' at row 1
SELECT * FROM t;
a	b
2000000000000000000	200000
DELETE FROM t;
DELETE IGNORE FROM t;
CHECK TABLE t;
Table	Op	Msg_type	Msg_text
test.t	check	status	OK
DROP TABLE t;
# Testing example of type BIGINT and value -2000000000000000000
SHOW CREATE TABLE t;
Table	Create Table
t	CREATE TABLE `t` (
  `a` bigint NOT NULL,
  `b` varchar(6) GENERATED ALWAYS AS (`a`) VIRTUAL NOT NULL,
  KEY `on_b` (`b`)
) ENGINE=InnoDB DEFAULT CHARSET=utf8mb4 COLLATE=utf8mb4_0900_ai_ci
INSERT IGNORE INTO t (a) VALUES (-2000000000000000000);
Warnings:
Warning	1265	Data truncated for column 'b' at row 1
SELECT * FROM t;
a	b
-2000000000000000000	-20000
DELETE FROM t;
DELETE IGNORE FROM t;
CHECK TABLE t;
Table	Op	Msg_type	Msg_text
test.t	check	status	OK
DROP TABLE t;
# Testing example of type FLOAT and value -1.23456
SHOW CREATE TABLE t;
Table	Create Table
t	CREATE TABLE `t` (
  `a` float NOT NULL,
  `b` varchar(6) GENERATED ALWAYS AS (`a`) VIRTUAL NOT NULL,
  KEY `on_b` (`b`)
) ENGINE=InnoDB DEFAULT CHARSET=utf8mb4 COLLATE=utf8mb4_0900_ai_ci
INSERT IGNORE INTO t (a) VALUES (-1.23456);
SELECT * FROM t;
a	b
-1.23456	-1.235
DELETE FROM t;
DELETE IGNORE FROM t;
CHECK TABLE t;
Table	Op	Msg_type	Msg_text
test.t	check	status	OK
DROP TABLE t;
# Testing example of type FLOAT and value -1e38
SHOW CREATE TABLE t;
Table	Create Table
t	CREATE TABLE `t` (
  `a` float NOT NULL,
  `b` varchar(6) GENERATED ALWAYS AS (`a`) VIRTUAL NOT NULL,
  KEY `on_b` (`b`)
) ENGINE=InnoDB DEFAULT CHARSET=utf8mb4 COLLATE=utf8mb4_0900_ai_ci
INSERT IGNORE INTO t (a) VALUES (-1e38);
SELECT * FROM t;
a	b
-1e38	-1e38
DELETE FROM t;
DELETE IGNORE FROM t;
CHECK TABLE t;
Table	Op	Msg_type	Msg_text
test.t	check	status	OK
DROP TABLE t;
# Testing example of type FLOAT and value 1e38
SHOW CREATE TABLE t;
Table	Create Table
t	CREATE TABLE `t` (
  `a` float NOT NULL,
  `b` varchar(6) GENERATED ALWAYS AS (`a`) VIRTUAL NOT NULL,
  KEY `on_b` (`b`)
) ENGINE=InnoDB DEFAULT CHARSET=utf8mb4 COLLATE=utf8mb4_0900_ai_ci
INSERT IGNORE INTO t (a) VALUES (1e38);
SELECT * FROM t;
a	b
1e38	1e38
DELETE FROM t;
DELETE IGNORE FROM t;
CHECK TABLE t;
Table	Op	Msg_type	Msg_text
test.t	check	status	OK
DROP TABLE t;
# Testing example of type DOUBLE and value -1.23456789012345
SHOW CREATE TABLE t;
Table	Create Table
t	CREATE TABLE `t` (
  `a` double NOT NULL,
  `b` varchar(6) GENERATED ALWAYS AS (`a`) VIRTUAL NOT NULL,
  KEY `on_b` (`b`)
) ENGINE=InnoDB DEFAULT CHARSET=utf8mb4 COLLATE=utf8mb4_0900_ai_ci
INSERT IGNORE INTO t (a) VALUES (-1.23456789012345);
SELECT * FROM t;
a	b
-1.23456789012345	-1.235
DELETE FROM t;
DELETE IGNORE FROM t;
CHECK TABLE t;
Table	Op	Msg_type	Msg_text
test.t	check	status	OK
DROP TABLE t;
# Testing example of type DOUBLE and value 1.23456789012345
SHOW CREATE TABLE t;
Table	Create Table
t	CREATE TABLE `t` (
  `a` double NOT NULL,
  `b` varchar(6) GENERATED ALWAYS AS (`a`) VIRTUAL NOT NULL,
  KEY `on_b` (`b`)
) ENGINE=InnoDB DEFAULT CHARSET=utf8mb4 COLLATE=utf8mb4_0900_ai_ci
INSERT IGNORE INTO t (a) VALUES (1.23456789012345);
SELECT * FROM t;
a	b
1.23456789012345	1.2346
DELETE FROM t;
DELETE IGNORE FROM t;
CHECK TABLE t;
Table	Op	Msg_type	Msg_text
test.t	check	status	OK
DROP TABLE t;
# Testing example of type DOUBLE and value -1e300
SHOW CREATE TABLE t;
Table	Create Table
t	CREATE TABLE `t` (
  `a` double NOT NULL,
  `b` varchar(6) GENERATED ALWAYS AS (`a`) VIRTUAL NOT NULL,
  KEY `on_b` (`b`)
) ENGINE=InnoDB DEFAULT CHARSET=utf8mb4 COLLATE=utf8mb4_0900_ai_ci
INSERT IGNORE INTO t (a) VALUES (-1e300);
SELECT * FROM t;
a	b
-1e300	-1e300
DELETE FROM t;
DELETE IGNORE FROM t;
CHECK TABLE t;
Table	Op	Msg_type	Msg_text
test.t	check	status	OK
DROP TABLE t;
# Testing example of type DOUBLE and value 1e300
SHOW CREATE TABLE t;
Table	Create Table
t	CREATE TABLE `t` (
  `a` double NOT NULL,
  `b` varchar(6) GENERATED ALWAYS AS (`a`) VIRTUAL NOT NULL,
  KEY `on_b` (`b`)
) ENGINE=InnoDB DEFAULT CHARSET=utf8mb4 COLLATE=utf8mb4_0900_ai_ci
INSERT IGNORE INTO t (a) VALUES (1e300);
SELECT * FROM t;
a	b
1e300	1e300
DELETE FROM t;
DELETE IGNORE FROM t;
CHECK TABLE t;
Table	Op	Msg_type	Msg_text
test.t	check	status	OK
DROP TABLE t;
# Testing example of type DECIMAL(4,2) and value -10.99
SHOW CREATE TABLE t;
Table	Create Table
t	CREATE TABLE `t` (
  `a` decimal(4,2) NOT NULL,
  `b` varchar(6) GENERATED ALWAYS AS (`a`) VIRTUAL NOT NULL,
  KEY `on_b` (`b`)
) ENGINE=InnoDB DEFAULT CHARSET=utf8mb4 COLLATE=utf8mb4_0900_ai_ci
INSERT IGNORE INTO t (a) VALUES (-10.99);
SELECT * FROM t;
a	b
-10.99	-10.99
DELETE FROM t;
DELETE IGNORE FROM t;
CHECK TABLE t;
Table	Op	Msg_type	Msg_text
test.t	check	status	OK
DROP TABLE t;
# Testing example of type DECIMAL(34,4) and value 20000000000000000000000000000.0001
SHOW CREATE TABLE t;
Table	Create Table
t	CREATE TABLE `t` (
  `a` decimal(34,4) NOT NULL,
  `b` varchar(6) GENERATED ALWAYS AS (`a`) VIRTUAL NOT NULL,
  KEY `on_b` (`b`)
) ENGINE=InnoDB DEFAULT CHARSET=utf8mb4 COLLATE=utf8mb4_0900_ai_ci
INSERT IGNORE INTO t (a) VALUES (20000000000000000000000000000.0001);
Warnings:
Warning	1265	Data truncated for column 'b' at row 1
SELECT * FROM t;
a	b
20000000000000000000000000000.0001	200000
DELETE FROM t;
DELETE IGNORE FROM t;
CHECK TABLE t;
Table	Op	Msg_type	Msg_text
test.t	check	status	OK
DROP TABLE t;
# Testing example of type DECIMAL(34,4) and value -20000000000000000000000000000.0001
SHOW CREATE TABLE t;
Table	Create Table
t	CREATE TABLE `t` (
  `a` decimal(34,4) NOT NULL,
  `b` varchar(6) GENERATED ALWAYS AS (`a`) VIRTUAL NOT NULL,
  KEY `on_b` (`b`)
) ENGINE=InnoDB DEFAULT CHARSET=utf8mb4 COLLATE=utf8mb4_0900_ai_ci
INSERT IGNORE INTO t (a) VALUES (-20000000000000000000000000000.0001);
Warnings:
Warning	1265	Data truncated for column 'b' at row 1
SELECT * FROM t;
a	b
-20000000000000000000000000000.0001	-20000
DELETE FROM t;
DELETE IGNORE FROM t;
CHECK TABLE t;
Table	Op	Msg_type	Msg_text
test.t	check	status	OK
DROP TABLE t;
# Testing example of type BIT(64) and value 0xDEADBEEFC0FEBABE
SHOW CREATE TABLE t;
Table	Create Table
t	CREATE TABLE `t` (
  `a` bit(64) NOT NULL,
  `b` varchar(6) GENERATED ALWAYS AS (`a`) VIRTUAL NOT NULL,
  KEY `on_b` (`b`)
) ENGINE=InnoDB DEFAULT CHARSET=utf8mb4 COLLATE=utf8mb4_0900_ai_ci
INSERT IGNORE INTO t (a) VALUES (0xDEADBEEFC0FEBABE);
Warnings:
Warning	1265	Data truncated for column 'b' at row 1
SELECT * FROM t;
a	b
Þ­¾ïÀþº¾	160456
DELETE FROM t;
DELETE IGNORE FROM t;
CHECK TABLE t;
Table	Op	Msg_type	Msg_text
test.t	check	status	OK
DROP TABLE t;
# Testing example of type BIT(4) and value 0b1000
SHOW CREATE TABLE t;
Table	Create Table
t	CREATE TABLE `t` (
  `a` bit(4) NOT NULL,
  `b` varchar(6) GENERATED ALWAYS AS (`a`) VIRTUAL NOT NULL,
  KEY `on_b` (`b`)
) ENGINE=InnoDB DEFAULT CHARSET=utf8mb4 COLLATE=utf8mb4_0900_ai_ci
INSERT IGNORE INTO t (a) VALUES (0b1000);
SELECT * FROM t;
a	b
	8
DELETE FROM t;
DELETE IGNORE FROM t;
CHECK TABLE t;
Table	Op	Msg_type	Msg_text
test.t	check	status	OK
DROP TABLE t;
# Testing example of type YEAR and value 2020
SHOW CREATE TABLE t;
Table	Create Table
t	CREATE TABLE `t` (
  `a` year NOT NULL,
  `b` varchar(6) GENERATED ALWAYS AS (`a`) VIRTUAL NOT NULL,
  KEY `on_b` (`b`)
) ENGINE=InnoDB DEFAULT CHARSET=utf8mb4 COLLATE=utf8mb4_0900_ai_ci
INSERT IGNORE INTO t (a) VALUES (2020);
SELECT * FROM t;
a	b
2020	2020
DELETE FROM t;
DELETE IGNORE FROM t;
CHECK TABLE t;
Table	Op	Msg_type	Msg_text
test.t	check	status	OK
DROP TABLE t;
# Testing example of type DATE and value "2030-04-05"
SHOW CREATE TABLE t;
Table	Create Table
t	CREATE TABLE `t` (
  `a` date NOT NULL,
  `b` varchar(6) GENERATED ALWAYS AS (`a`) VIRTUAL NOT NULL,
  KEY `on_b` (`b`)
) ENGINE=InnoDB DEFAULT CHARSET=utf8mb4 COLLATE=utf8mb4_0900_ai_ci
INSERT IGNORE INTO t (a) VALUES ("2030-04-05");
Warnings:
Warning	1265	Data truncated for column 'b' at row 1
SELECT * FROM t;
a	b
2030-04-05	2030-0
DELETE FROM t;
DELETE IGNORE FROM t;
CHECK TABLE t;
Table	Op	Msg_type	Msg_text
test.t	check	status	OK
DROP TABLE t;
# Testing example of type TIME and value "11:12:13"
SHOW CREATE TABLE t;
Table	Create Table
t	CREATE TABLE `t` (
  `a` time NOT NULL,
  `b` varchar(6) GENERATED ALWAYS AS (`a`) VIRTUAL NOT NULL,
  KEY `on_b` (`b`)
) ENGINE=InnoDB DEFAULT CHARSET=utf8mb4 COLLATE=utf8mb4_0900_ai_ci
INSERT IGNORE INTO t (a) VALUES ("11:12:13");
Warnings:
Warning	1265	Data truncated for column 'b' at row 1
SELECT * FROM t;
a	b
11:12:13	11:12:
DELETE FROM t;
DELETE IGNORE FROM t;
CHECK TABLE t;
Table	Op	Msg_type	Msg_text
test.t	check	status	OK
DROP TABLE t;
# Testing example of type DATETIME and value "2030-04-05 11:12:13"
SHOW CREATE TABLE t;
Table	Create Table
t	CREATE TABLE `t` (
  `a` datetime NOT NULL,
  `b` varchar(6) GENERATED ALWAYS AS (`a`) VIRTUAL NOT NULL,
  KEY `on_b` (`b`)
) ENGINE=InnoDB DEFAULT CHARSET=utf8mb4 COLLATE=utf8mb4_0900_ai_ci
INSERT IGNORE INTO t (a) VALUES ("2030-04-05 11:12:13");
Warnings:
Warning	1265	Data truncated for column 'b' at row 1
SELECT * FROM t;
a	b
2030-04-05 11:12:13	2030-0
DELETE FROM t;
DELETE IGNORE FROM t;
CHECK TABLE t;
Table	Op	Msg_type	Msg_text
test.t	check	status	OK
DROP TABLE t;
# Testing example of type TIMESTAMP and value "2030-04-05 11:12:13"
SHOW CREATE TABLE t;
Table	Create Table
t	CREATE TABLE `t` (
  `a` timestamp NOT NULL,
  `b` varchar(6) GENERATED ALWAYS AS (`a`) VIRTUAL NOT NULL,
  KEY `on_b` (`b`)
) ENGINE=InnoDB DEFAULT CHARSET=utf8mb4 COLLATE=utf8mb4_0900_ai_ci
INSERT IGNORE INTO t (a) VALUES ("2030-04-05 11:12:13");
Warnings:
Warning	1265	Data truncated for column 'b' at row 1
SELECT * FROM t;
a	b
2030-04-05 11:12:13	2030-0
DELETE FROM t;
DELETE IGNORE FROM t;
CHECK TABLE t;
Table	Op	Msg_type	Msg_text
test.t	check	status	OK
DROP TABLE t;
# Testing example of type CHAR(40) and value "2000000000000000000000000000000000000"
SHOW CREATE TABLE t;
Table	Create Table
t	CREATE TABLE `t` (
  `a` char(40) NOT NULL,
  `b` varchar(6) GENERATED ALWAYS AS (`a`) VIRTUAL NOT NULL,
  KEY `on_b` (`b`)
) ENGINE=InnoDB DEFAULT CHARSET=utf8mb4 COLLATE=utf8mb4_0900_ai_ci
INSERT IGNORE INTO t (a) VALUES ("2000000000000000000000000000000000000");
Warnings:
Warning	1265	Data truncated for column 'b' at row 1
SELECT * FROM t;
a	b
2000000000000000000000000000000000000	200000
DELETE FROM t;
DELETE IGNORE FROM t;
CHECK TABLE t;
Table	Op	Msg_type	Msg_text
test.t	check	status	OK
DROP TABLE t;
# Testing example of type BINARY(45) and value "200000000000000000000000000000000000000000"
SHOW CREATE TABLE t;
Table	Create Table
t	CREATE TABLE `t` (
  `a` binary(45) NOT NULL,
  `b` varchar(6) GENERATED ALWAYS AS (`a`) VIRTUAL NOT NULL,
  KEY `on_b` (`b`)
) ENGINE=InnoDB DEFAULT CHARSET=utf8mb4 COLLATE=utf8mb4_0900_ai_ci
INSERT IGNORE INTO t (a) VALUES ("200000000000000000000000000000000000000000");
Warnings:
Warning	1265	Data truncated for column 'b' at row 1
SELECT * FROM t;
a	b
200000000000000000000000000000000000000000   	200000
DELETE FROM t;
DELETE IGNORE FROM t;
CHECK TABLE t;
Table	Op	Msg_type	Msg_text
test.t	check	status	OK
DROP TABLE t;
# Testing example of type VARCHAR(50) and value "2000000000000000000000000000000000000000000000000"
SHOW CREATE TABLE t;
Table	Create Table
t	CREATE TABLE `t` (
  `a` varchar(50) NOT NULL,
  `b` varchar(6) GENERATED ALWAYS AS (`a`) VIRTUAL NOT NULL,
  KEY `on_b` (`b`)
) ENGINE=InnoDB DEFAULT CHARSET=utf8mb4 COLLATE=utf8mb4_0900_ai_ci
INSERT IGNORE INTO t (a) VALUES ("2000000000000000000000000000000000000000000000000");
Warnings:
Warning	1265	Data truncated for column 'b' at row 1
SELECT * FROM t;
a	b
2000000000000000000000000000000000000000000000000	200000
DELETE FROM t;
DELETE IGNORE FROM t;
CHECK TABLE t;
Table	Op	Msg_type	Msg_text
test.t	check	status	OK
DROP TABLE t;
# Testing example of type CHAR(24) and value "hello beautiful world"
SHOW CREATE TABLE t;
Table	Create Table
t	CREATE TABLE `t` (
  `a` char(24) NOT NULL,
  `b` varchar(6) GENERATED ALWAYS AS (`a`) VIRTUAL NOT NULL,
  KEY `on_b` (`b`)
) ENGINE=InnoDB DEFAULT CHARSET=utf8mb4 COLLATE=utf8mb4_0900_ai_ci
INSERT IGNORE INTO t (a) VALUES ("hello beautiful world");
Warnings:
Warning	1265	Data truncated for column 'b' at row 1
SELECT * FROM t;
a	b
hello beautiful world	hello 
DELETE FROM t;
DELETE IGNORE FROM t;
CHECK TABLE t;
Table	Op	Msg_type	Msg_text
test.t	check	status	OK
DROP TABLE t;
# Testing example of type BINARY(12) and value "hello world"
SHOW CREATE TABLE t;
Table	Create Table
t	CREATE TABLE `t` (
  `a` binary(12) NOT NULL,
  `b` varchar(6) GENERATED ALWAYS AS (`a`) VIRTUAL NOT NULL,
  KEY `on_b` (`b`)
) ENGINE=InnoDB DEFAULT CHARSET=utf8mb4 COLLATE=utf8mb4_0900_ai_ci
INSERT IGNORE INTO t (a) VALUES ("hello world");
Warnings:
Warning	1265	Data truncated for column 'b' at row 1
SELECT * FROM t;
a	b
hello world 	hello 
DELETE FROM t;
DELETE IGNORE FROM t;
CHECK TABLE t;
Table	Op	Msg_type	Msg_text
test.t	check	status	OK
DROP TABLE t;
# Testing example of type VARCHAR(6) and value "hello"
SHOW CREATE TABLE t;
Table	Create Table
t	CREATE TABLE `t` (
  `a` varchar(6) NOT NULL,
  `b` varchar(6) GENERATED ALWAYS AS (`a`) VIRTUAL NOT NULL,
  KEY `on_b` (`b`)
) ENGINE=InnoDB DEFAULT CHARSET=utf8mb4 COLLATE=utf8mb4_0900_ai_ci
INSERT IGNORE INTO t (a) VALUES ("hello");
SELECT * FROM t;
a	b
hello	hello
DELETE FROM t;
DELETE IGNORE FROM t;
CHECK TABLE t;
Table	Op	Msg_type	Msg_text
test.t	check	status	OK
DROP TABLE t;
# Testing example of type ENUM("up","down") and value "up"
SHOW CREATE TABLE t;
Table	Create Table
t	CREATE TABLE `t` (
  `a` enum('up','down') NOT NULL,
  `b` varchar(6) GENERATED ALWAYS AS (`a`) VIRTUAL NOT NULL,
  KEY `on_b` (`b`)
) ENGINE=InnoDB DEFAULT CHARSET=utf8mb4 COLLATE=utf8mb4_0900_ai_ci
INSERT IGNORE INTO t (a) VALUES ("up");
SELECT * FROM t;
a	b
up	up
DELETE FROM t;
DELETE IGNORE FROM t;
CHECK TABLE t;
Table	Op	Msg_type	Msg_text
test.t	check	status	OK
DROP TABLE t;
# Testing example of type SET("up","down") and value "up,down"
SHOW CREATE TABLE t;
Table	Create Table
t	CREATE TABLE `t` (
  `a` set('up','down') NOT NULL,
  `b` varchar(6) GENERATED ALWAYS AS (`a`) VIRTUAL NOT NULL,
  KEY `on_b` (`b`)
) ENGINE=InnoDB DEFAULT CHARSET=utf8mb4 COLLATE=utf8mb4_0900_ai_ci
INSERT IGNORE INTO t (a) VALUES ("up,down");
Warnings:
Warning	1265	Data truncated for column 'b' at row 1
SELECT * FROM t;
a	b
up,down	up,dow
DELETE FROM t;
DELETE IGNORE FROM t;
CHECK TABLE t;
Table	Op	Msg_type	Msg_text
test.t	check	status	OK
DROP TABLE t;
# Testing example of type GEOMETRY and value ST_GeomFromText("POINT(1 1)")
SHOW CREATE TABLE t;
Table	Create Table
t	CREATE TABLE `t` (
  `a` geometry NOT NULL,
  `b` varchar(6) GENERATED ALWAYS AS (`a`) VIRTUAL NOT NULL,
  KEY `on_b` (`b`)
) ENGINE=InnoDB DEFAULT CHARSET=utf8mb4 COLLATE=utf8mb4_0900_ai_ci
INSERT IGNORE INTO t (a) VALUES (ST_GeomFromText("POINT(1 1)"));
Warnings:
Warning	1265	Data truncated for column 'b' at row 1
SELECT * FROM t;
a	b
             ð?      ð?	    
DELETE FROM t;
DELETE IGNORE FROM t;
CHECK TABLE t;
Table	Op	Msg_type	Msg_text
test.t	check	status	OK
DROP TABLE t;
# Testing example of type POINT and value ST_GeomFromText("POINT(1 1)")
SHOW CREATE TABLE t;
Table	Create Table
t	CREATE TABLE `t` (
  `a` point NOT NULL,
  `b` varchar(6) GENERATED ALWAYS AS (`a`) VIRTUAL NOT NULL,
  KEY `on_b` (`b`)
) ENGINE=InnoDB DEFAULT CHARSET=utf8mb4 COLLATE=utf8mb4_0900_ai_ci
INSERT IGNORE INTO t (a) VALUES (ST_GeomFromText("POINT(1 1)"));
Warnings:
Warning	1265	Data truncated for column 'b' at row 1
SELECT * FROM t;
a	b
             ð?      ð?	    
DELETE FROM t;
DELETE IGNORE FROM t;
CHECK TABLE t;
Table	Op	Msg_type	Msg_text
test.t	check	status	OK
DROP TABLE t;
# Testing example of type LINESTRING and value ST_GeomFromText("LINESTRING(0 0,1 1,2 2)")
SHOW CREATE TABLE t;
Table	Create Table
t	CREATE TABLE `t` (
  `a` linestring NOT NULL,
  `b` varchar(6) GENERATED ALWAYS AS (`a`) VIRTUAL NOT NULL,
  KEY `on_b` (`b`)
) ENGINE=InnoDB DEFAULT CHARSET=utf8mb4 COLLATE=utf8mb4_0900_ai_ci
INSERT IGNORE INTO t (a) VALUES (ST_GeomFromText("LINESTRING(0 0,1 1,2 2)"));
Warnings:
Warning	1265	Data truncated for column 'b' at row 1
SELECT * FROM t;
a	b
                                ð?      ð?       @       @	    
DELETE FROM t;
DELETE IGNORE FROM t;
CHECK TABLE t;
Table	Op	Msg_type	Msg_text
test.t	check	status	OK
DROP TABLE t;
# Testing example of type POLYGON and value ST_GeomFromText("POLYGON((0 0,1 0,1 1,0 1,0 0),(5 5,7 5,7 7,5 7,5 5))")
SHOW CREATE TABLE t;
Table	Create Table
t	CREATE TABLE `t` (
  `a` polygon NOT NULL,
  `b` varchar(6) GENERATED ALWAYS AS (`a`) VIRTUAL NOT NULL,
  KEY `on_b` (`b`)
) ENGINE=InnoDB DEFAULT CHARSET=utf8mb4 COLLATE=utf8mb4_0900_ai_ci
INSERT IGNORE INTO t (a) VALUES (ST_GeomFromText("POLYGON((0 0,1 0,1 1,0 1,0 0),(5 5,7 5,7 7,5 7,5 5))"));
Warnings:
Warning	1265	Data truncated for column 'b' at row 1
SELECT * FROM t;
a	b
                                   ð?              ð?      ð?              ð?                         @      @      @      @      @      @      @      @      @      @	    
DELETE FROM t;
DELETE IGNORE FROM t;
CHECK TABLE t;
Table	Op	Msg_type	Msg_text
test.t	check	status	OK
DROP TABLE t;
#
# Testing virtual column of type ENUM("up","down")
#
# Testing example of type JSON and value "{}"
SHOW CREATE TABLE t;
Table	Create Table
t	CREATE TABLE `t` (
  `a` json NOT NULL,
  `b` enum('up','down') GENERATED ALWAYS AS (`a`) VIRTUAL NOT NULL,
  KEY `on_b` (`b`)
) ENGINE=InnoDB DEFAULT CHARSET=utf8mb4 COLLATE=utf8mb4_0900_ai_ci
INSERT IGNORE INTO t (a) VALUES ("{}");
Warnings:
Warning	1265	Data truncated for column 'b' at row 1
SELECT * FROM t;
a	b
{}	
DELETE FROM t;
DELETE IGNORE FROM t;
CHECK TABLE t;
Table	Op	Msg_type	Msg_text
test.t	check	status	OK
DROP TABLE t;
# Testing example of type JSON and value '["hello beautiful world"]'
SHOW CREATE TABLE t;
Table	Create Table
t	CREATE TABLE `t` (
  `a` json NOT NULL,
  `b` enum('up','down') GENERATED ALWAYS AS (`a`) VIRTUAL NOT NULL,
  KEY `on_b` (`b`)
) ENGINE=InnoDB DEFAULT CHARSET=utf8mb4 COLLATE=utf8mb4_0900_ai_ci
INSERT IGNORE INTO t (a) VALUES ('["hello beautiful world"]');
Warnings:
Warning	1265	Data truncated for column 'b' at row 1
SELECT * FROM t;
a	b
["hello beautiful world"]	
DELETE FROM t;
DELETE IGNORE FROM t;
CHECK TABLE t;
Table	Op	Msg_type	Msg_text
test.t	check	status	OK
DROP TABLE t;
# Testing example of type JSON and value "-1"
SHOW CREATE TABLE t;
Table	Create Table
t	CREATE TABLE `t` (
  `a` json NOT NULL,
  `b` enum('up','down') GENERATED ALWAYS AS (`a`) VIRTUAL NOT NULL,
  KEY `on_b` (`b`)
) ENGINE=InnoDB DEFAULT CHARSET=utf8mb4 COLLATE=utf8mb4_0900_ai_ci
INSERT IGNORE INTO t (a) VALUES ("-1");
Warnings:
Warning	1265	Data truncated for column 'b' at row 1
SELECT * FROM t;
a	b
-1	
DELETE FROM t;
DELETE IGNORE FROM t;
CHECK TABLE t;
Table	Op	Msg_type	Msg_text
test.t	check	status	OK
DROP TABLE t;
# Testing example of type TINYINT and value -1
SHOW CREATE TABLE t;
Table	Create Table
t	CREATE TABLE `t` (
  `a` tinyint NOT NULL,
  `b` enum('up','down') GENERATED ALWAYS AS (`a`) VIRTUAL NOT NULL,
  KEY `on_b` (`b`)
) ENGINE=InnoDB DEFAULT CHARSET=utf8mb4 COLLATE=utf8mb4_0900_ai_ci
INSERT IGNORE INTO t (a) VALUES (-1);
Warnings:
Warning	1265	Data truncated for column 'b' at row 1
SELECT * FROM t;
a	b
-1	
DELETE FROM t;
DELETE IGNORE FROM t;
CHECK TABLE t;
Table	Op	Msg_type	Msg_text
test.t	check	status	OK
DROP TABLE t;
# Testing example of type SMALLINT and value -1
SHOW CREATE TABLE t;
Table	Create Table
t	CREATE TABLE `t` (
  `a` smallint NOT NULL,
  `b` enum('up','down') GENERATED ALWAYS AS (`a`) VIRTUAL NOT NULL,
  KEY `on_b` (`b`)
) ENGINE=InnoDB DEFAULT CHARSET=utf8mb4 COLLATE=utf8mb4_0900_ai_ci
INSERT IGNORE INTO t (a) VALUES (-1);
Warnings:
Warning	1265	Data truncated for column 'b' at row 1
SELECT * FROM t;
a	b
-1	
DELETE FROM t;
DELETE IGNORE FROM t;
CHECK TABLE t;
Table	Op	Msg_type	Msg_text
test.t	check	status	OK
DROP TABLE t;
# Testing example of type MEDIUMINT and value -1
SHOW CREATE TABLE t;
Table	Create Table
t	CREATE TABLE `t` (
  `a` mediumint NOT NULL,
  `b` enum('up','down') GENERATED ALWAYS AS (`a`) VIRTUAL NOT NULL,
  KEY `on_b` (`b`)
) ENGINE=InnoDB DEFAULT CHARSET=utf8mb4 COLLATE=utf8mb4_0900_ai_ci
INSERT IGNORE INTO t (a) VALUES (-1);
Warnings:
Warning	1265	Data truncated for column 'b' at row 1
SELECT * FROM t;
a	b
-1	
DELETE FROM t;
DELETE IGNORE FROM t;
CHECK TABLE t;
Table	Op	Msg_type	Msg_text
test.t	check	status	OK
DROP TABLE t;
# Testing example of type INT and value 2000000000
SHOW CREATE TABLE t;
Table	Create Table
t	CREATE TABLE `t` (
  `a` int NOT NULL,
  `b` enum('up','down') GENERATED ALWAYS AS (`a`) VIRTUAL NOT NULL,
  KEY `on_b` (`b`)
) ENGINE=InnoDB DEFAULT CHARSET=utf8mb4 COLLATE=utf8mb4_0900_ai_ci
INSERT IGNORE INTO t (a) VALUES (2000000000);
Warnings:
Warning	1265	Data truncated for column 'b' at row 1
SELECT * FROM t;
a	b
2000000000	
DELETE FROM t;
DELETE IGNORE FROM t;
CHECK TABLE t;
Table	Op	Msg_type	Msg_text
test.t	check	status	OK
DROP TABLE t;
# Testing example of type INT and value -2000000000
SHOW CREATE TABLE t;
Table	Create Table
t	CREATE TABLE `t` (
  `a` int NOT NULL,
  `b` enum('up','down') GENERATED ALWAYS AS (`a`) VIRTUAL NOT NULL,
  KEY `on_b` (`b`)
) ENGINE=InnoDB DEFAULT CHARSET=utf8mb4 COLLATE=utf8mb4_0900_ai_ci
INSERT IGNORE INTO t (a) VALUES (-2000000000);
Warnings:
Warning	1265	Data truncated for column 'b' at row 1
SELECT * FROM t;
a	b
-2000000000	
DELETE FROM t;
DELETE IGNORE FROM t;
CHECK TABLE t;
Table	Op	Msg_type	Msg_text
test.t	check	status	OK
DROP TABLE t;
# Testing example of type INT UNSIGNED and value 4000000000
SHOW CREATE TABLE t;
Table	Create Table
t	CREATE TABLE `t` (
  `a` int unsigned NOT NULL,
  `b` enum('up','down') GENERATED ALWAYS AS (`a`) VIRTUAL NOT NULL,
  KEY `on_b` (`b`)
) ENGINE=InnoDB DEFAULT CHARSET=utf8mb4 COLLATE=utf8mb4_0900_ai_ci
INSERT IGNORE INTO t (a) VALUES (4000000000);
Warnings:
Warning	1265	Data truncated for column 'b' at row 1
SELECT * FROM t;
a	b
4000000000	
DELETE FROM t;
DELETE IGNORE FROM t;
CHECK TABLE t;
Table	Op	Msg_type	Msg_text
test.t	check	status	OK
DROP TABLE t;
# Testing example of type BIGINT and value 2000000000000000000
SHOW CREATE TABLE t;
Table	Create Table
t	CREATE TABLE `t` (
  `a` bigint NOT NULL,
  `b` enum('up','down') GENERATED ALWAYS AS (`a`) VIRTUAL NOT NULL,
  KEY `on_b` (`b`)
) ENGINE=InnoDB DEFAULT CHARSET=utf8mb4 COLLATE=utf8mb4_0900_ai_ci
INSERT IGNORE INTO t (a) VALUES (2000000000000000000);
Warnings:
Warning	1265	Data truncated for column 'b' at row 1
SELECT * FROM t;
a	b
2000000000000000000	
DELETE FROM t;
DELETE IGNORE FROM t;
CHECK TABLE t;
Table	Op	Msg_type	Msg_text
test.t	check	status	OK
DROP TABLE t;
# Testing example of type BIGINT and value -2000000000000000000
SHOW CREATE TABLE t;
Table	Create Table
t	CREATE TABLE `t` (
  `a` bigint NOT NULL,
  `b` enum('up','down') GENERATED ALWAYS AS (`a`) VIRTUAL NOT NULL,
  KEY `on_b` (`b`)
) ENGINE=InnoDB DEFAULT CHARSET=utf8mb4 COLLATE=utf8mb4_0900_ai_ci
INSERT IGNORE INTO t (a) VALUES (-2000000000000000000);
Warnings:
Warning	1265	Data truncated for column 'b' at row 1
SELECT * FROM t;
a	b
-2000000000000000000	
DELETE FROM t;
DELETE IGNORE FROM t;
CHECK TABLE t;
Table	Op	Msg_type	Msg_text
test.t	check	status	OK
DROP TABLE t;
# Testing example of type FLOAT and value -1.23456
SHOW CREATE TABLE t;
Table	Create Table
t	CREATE TABLE `t` (
  `a` float NOT NULL,
  `b` enum('up','down') GENERATED ALWAYS AS (`a`) VIRTUAL NOT NULL,
  KEY `on_b` (`b`)
) ENGINE=InnoDB DEFAULT CHARSET=utf8mb4 COLLATE=utf8mb4_0900_ai_ci
INSERT IGNORE INTO t (a) VALUES (-1.23456);
Warnings:
Warning	1265	Data truncated for column 'b' at row 1
SELECT * FROM t;
a	b
-1.23456	
DELETE FROM t;
DELETE IGNORE FROM t;
CHECK TABLE t;
Table	Op	Msg_type	Msg_text
test.t	check	status	OK
DROP TABLE t;
# Testing example of type FLOAT and value -1e38
SHOW CREATE TABLE t;
Table	Create Table
t	CREATE TABLE `t` (
  `a` float NOT NULL,
  `b` enum('up','down') GENERATED ALWAYS AS (`a`) VIRTUAL NOT NULL,
  KEY `on_b` (`b`)
) ENGINE=InnoDB DEFAULT CHARSET=utf8mb4 COLLATE=utf8mb4_0900_ai_ci
INSERT IGNORE INTO t (a) VALUES (-1e38);
Warnings:
Warning	1265	Data truncated for column 'b' at row 1
SELECT * FROM t;
a	b
-1e38	
DELETE FROM t;
DELETE IGNORE FROM t;
CHECK TABLE t;
Table	Op	Msg_type	Msg_text
test.t	check	status	OK
DROP TABLE t;
# Testing example of type FLOAT and value 1e38
SHOW CREATE TABLE t;
Table	Create Table
t	CREATE TABLE `t` (
  `a` float NOT NULL,
  `b` enum('up','down') GENERATED ALWAYS AS (`a`) VIRTUAL NOT NULL,
  KEY `on_b` (`b`)
) ENGINE=InnoDB DEFAULT CHARSET=utf8mb4 COLLATE=utf8mb4_0900_ai_ci
INSERT IGNORE INTO t (a) VALUES (1e38);
Warnings:
Warning	1265	Data truncated for column 'b' at row 1
SELECT * FROM t;
a	b
1e38	
DELETE FROM t;
DELETE IGNORE FROM t;
CHECK TABLE t;
Table	Op	Msg_type	Msg_text
test.t	check	status	OK
DROP TABLE t;
# Testing example of type DOUBLE and value -1.23456789012345
SHOW CREATE TABLE t;
Table	Create Table
t	CREATE TABLE `t` (
  `a` double NOT NULL,
  `b` enum('up','down') GENERATED ALWAYS AS (`a`) VIRTUAL NOT NULL,
  KEY `on_b` (`b`)
) ENGINE=InnoDB DEFAULT CHARSET=utf8mb4 COLLATE=utf8mb4_0900_ai_ci
INSERT IGNORE INTO t (a) VALUES (-1.23456789012345);
Warnings:
Warning	1265	Data truncated for column 'b' at row 1
SELECT * FROM t;
a	b
-1.23456789012345	
DELETE FROM t;
DELETE IGNORE FROM t;
CHECK TABLE t;
Table	Op	Msg_type	Msg_text
test.t	check	status	OK
DROP TABLE t;
# Testing example of type DOUBLE and value 1.23456789012345
SHOW CREATE TABLE t;
Table	Create Table
t	CREATE TABLE `t` (
  `a` double NOT NULL,
  `b` enum('up','down') GENERATED ALWAYS AS (`a`) VIRTUAL NOT NULL,
  KEY `on_b` (`b`)
) ENGINE=InnoDB DEFAULT CHARSET=utf8mb4 COLLATE=utf8mb4_0900_ai_ci
INSERT IGNORE INTO t (a) VALUES (1.23456789012345);
SELECT * FROM t;
a	b
1.23456789012345	up
DELETE FROM t;
DELETE IGNORE FROM t;
CHECK TABLE t;
Table	Op	Msg_type	Msg_text
test.t	check	status	OK
DROP TABLE t;
# Testing example of type DOUBLE and value -1e300
SHOW CREATE TABLE t;
Table	Create Table
t	CREATE TABLE `t` (
  `a` double NOT NULL,
  `b` enum('up','down') GENERATED ALWAYS AS (`a`) VIRTUAL NOT NULL,
  KEY `on_b` (`b`)
) ENGINE=InnoDB DEFAULT CHARSET=utf8mb4 COLLATE=utf8mb4_0900_ai_ci
INSERT IGNORE INTO t (a) VALUES (-1e300);
Warnings:
Warning	1265	Data truncated for column 'b' at row 1
SELECT * FROM t;
a	b
-1e300	
DELETE FROM t;
DELETE IGNORE FROM t;
CHECK TABLE t;
Table	Op	Msg_type	Msg_text
test.t	check	status	OK
DROP TABLE t;
# Testing example of type DOUBLE and value 1e300
SHOW CREATE TABLE t;
Table	Create Table
t	CREATE TABLE `t` (
  `a` double NOT NULL,
  `b` enum('up','down') GENERATED ALWAYS AS (`a`) VIRTUAL NOT NULL,
  KEY `on_b` (`b`)
) ENGINE=InnoDB DEFAULT CHARSET=utf8mb4 COLLATE=utf8mb4_0900_ai_ci
INSERT IGNORE INTO t (a) VALUES (1e300);
Warnings:
Warning	1265	Data truncated for column 'b' at row 1
SELECT * FROM t;
a	b
1e300	
DELETE FROM t;
DELETE IGNORE FROM t;
CHECK TABLE t;
Table	Op	Msg_type	Msg_text
test.t	check	status	OK
DROP TABLE t;
# Testing example of type DECIMAL(4,2) and value -10.99
SHOW CREATE TABLE t;
Table	Create Table
t	CREATE TABLE `t` (
  `a` decimal(4,2) NOT NULL,
  `b` enum('up','down') GENERATED ALWAYS AS (`a`) VIRTUAL NOT NULL,
  KEY `on_b` (`b`)
) ENGINE=InnoDB DEFAULT CHARSET=utf8mb4 COLLATE=utf8mb4_0900_ai_ci
INSERT IGNORE INTO t (a) VALUES (-10.99);
Warnings:
Warning	1265	Data truncated for column 'b' at row 1
SELECT * FROM t;
a	b
-10.99	
DELETE FROM t;
DELETE IGNORE FROM t;
CHECK TABLE t;
Table	Op	Msg_type	Msg_text
test.t	check	status	OK
DROP TABLE t;
# Testing example of type DECIMAL(34,4) and value 20000000000000000000000000000.0001
SHOW CREATE TABLE t;
Table	Create Table
t	CREATE TABLE `t` (
  `a` decimal(34,4) NOT NULL,
  `b` enum('up','down') GENERATED ALWAYS AS (`a`) VIRTUAL NOT NULL,
  KEY `on_b` (`b`)
) ENGINE=InnoDB DEFAULT CHARSET=utf8mb4 COLLATE=utf8mb4_0900_ai_ci
INSERT IGNORE INTO t (a) VALUES (20000000000000000000000000000.0001);
Warnings:
Warning	1265	Data truncated for column 'b' at row 1
SELECT * FROM t;
a	b
20000000000000000000000000000.0001	
DELETE FROM t;
DELETE IGNORE FROM t;
CHECK TABLE t;
Table	Op	Msg_type	Msg_text
test.t	check	status	OK
DROP TABLE t;
# Testing example of type DECIMAL(34,4) and value -20000000000000000000000000000.0001
SHOW CREATE TABLE t;
Table	Create Table
t	CREATE TABLE `t` (
  `a` decimal(34,4) NOT NULL,
  `b` enum('up','down') GENERATED ALWAYS AS (`a`) VIRTUAL NOT NULL,
  KEY `on_b` (`b`)
) ENGINE=InnoDB DEFAULT CHARSET=utf8mb4 COLLATE=utf8mb4_0900_ai_ci
INSERT IGNORE INTO t (a) VALUES (-20000000000000000000000000000.0001);
Warnings:
Warning	1265	Data truncated for column 'b' at row 1
SELECT * FROM t;
a	b
-20000000000000000000000000000.0001	
DELETE FROM t;
DELETE IGNORE FROM t;
CHECK TABLE t;
Table	Op	Msg_type	Msg_text
test.t	check	status	OK
DROP TABLE t;
# Testing example of type BIT(64) and value 0xDEADBEEFC0FEBABE
SHOW CREATE TABLE t;
Table	Create Table
t	CREATE TABLE `t` (
  `a` bit(64) NOT NULL,
  `b` enum('up','down') GENERATED ALWAYS AS (`a`) VIRTUAL NOT NULL,
  KEY `on_b` (`b`)
) ENGINE=InnoDB DEFAULT CHARSET=utf8mb4 COLLATE=utf8mb4_0900_ai_ci
INSERT IGNORE INTO t (a) VALUES (0xDEADBEEFC0FEBABE);
Warnings:
Warning	1265	Data truncated for column 'b' at row 1
SELECT * FROM t;
a	b
Þ­¾ïÀþº¾	
DELETE FROM t;
DELETE IGNORE FROM t;
CHECK TABLE t;
Table	Op	Msg_type	Msg_text
test.t	check	status	OK
DROP TABLE t;
# Testing example of type BIT(4) and value 0b1000
SHOW CREATE TABLE t;
Table	Create Table
t	CREATE TABLE `t` (
  `a` bit(4) NOT NULL,
  `b` enum('up','down') GENERATED ALWAYS AS (`a`) VIRTUAL NOT NULL,
  KEY `on_b` (`b`)
) ENGINE=InnoDB DEFAULT CHARSET=utf8mb4 COLLATE=utf8mb4_0900_ai_ci
INSERT IGNORE INTO t (a) VALUES (0b1000);
Warnings:
Warning	1265	Data truncated for column 'b' at row 1
SELECT * FROM t;
a	b
	
DELETE FROM t;
DELETE IGNORE FROM t;
CHECK TABLE t;
Table	Op	Msg_type	Msg_text
test.t	check	status	OK
DROP TABLE t;
# Testing example of type YEAR and value 2020
SHOW CREATE TABLE t;
Table	Create Table
t	CREATE TABLE `t` (
  `a` year NOT NULL,
  `b` enum('up','down') GENERATED ALWAYS AS (`a`) VIRTUAL NOT NULL,
  KEY `on_b` (`b`)
) ENGINE=InnoDB DEFAULT CHARSET=utf8mb4 COLLATE=utf8mb4_0900_ai_ci
INSERT IGNORE INTO t (a) VALUES (2020);
Warnings:
Warning	1265	Data truncated for column 'b' at row 1
SELECT * FROM t;
a	b
2020	
DELETE FROM t;
DELETE IGNORE FROM t;
CHECK TABLE t;
Table	Op	Msg_type	Msg_text
test.t	check	status	OK
DROP TABLE t;
# Testing example of type DATE and value "2030-04-05"
SHOW CREATE TABLE t;
Table	Create Table
t	CREATE TABLE `t` (
  `a` date NOT NULL,
  `b` enum('up','down') GENERATED ALWAYS AS (`a`) VIRTUAL NOT NULL,
  KEY `on_b` (`b`)
) ENGINE=InnoDB DEFAULT CHARSET=utf8mb4 COLLATE=utf8mb4_0900_ai_ci
INSERT IGNORE INTO t (a) VALUES ("2030-04-05");
Warnings:
Warning	1265	Data truncated for column 'b' at row 1
SELECT * FROM t;
a	b
2030-04-05	
DELETE FROM t;
DELETE IGNORE FROM t;
CHECK TABLE t;
Table	Op	Msg_type	Msg_text
test.t	check	status	OK
DROP TABLE t;
# Testing example of type TIME and value "11:12:13"
SHOW CREATE TABLE t;
Table	Create Table
t	CREATE TABLE `t` (
  `a` time NOT NULL,
  `b` enum('up','down') GENERATED ALWAYS AS (`a`) VIRTUAL NOT NULL,
  KEY `on_b` (`b`)
) ENGINE=InnoDB DEFAULT CHARSET=utf8mb4 COLLATE=utf8mb4_0900_ai_ci
INSERT IGNORE INTO t (a) VALUES ("11:12:13");
Warnings:
Warning	1265	Data truncated for column 'b' at row 1
SELECT * FROM t;
a	b
11:12:13	
DELETE FROM t;
DELETE IGNORE FROM t;
CHECK TABLE t;
Table	Op	Msg_type	Msg_text
test.t	check	status	OK
DROP TABLE t;
# Testing example of type DATETIME and value "2030-04-05 11:12:13"
SHOW CREATE TABLE t;
Table	Create Table
t	CREATE TABLE `t` (
  `a` datetime NOT NULL,
  `b` enum('up','down') GENERATED ALWAYS AS (`a`) VIRTUAL NOT NULL,
  KEY `on_b` (`b`)
) ENGINE=InnoDB DEFAULT CHARSET=utf8mb4 COLLATE=utf8mb4_0900_ai_ci
INSERT IGNORE INTO t (a) VALUES ("2030-04-05 11:12:13");
Warnings:
Warning	1265	Data truncated for column 'b' at row 1
SELECT * FROM t;
a	b
2030-04-05 11:12:13	
DELETE FROM t;
DELETE IGNORE FROM t;
CHECK TABLE t;
Table	Op	Msg_type	Msg_text
test.t	check	status	OK
DROP TABLE t;
# Testing example of type TIMESTAMP and value "2030-04-05 11:12:13"
SHOW CREATE TABLE t;
Table	Create Table
t	CREATE TABLE `t` (
  `a` timestamp NOT NULL,
  `b` enum('up','down') GENERATED ALWAYS AS (`a`) VIRTUAL NOT NULL,
  KEY `on_b` (`b`)
) ENGINE=InnoDB DEFAULT CHARSET=utf8mb4 COLLATE=utf8mb4_0900_ai_ci
INSERT IGNORE INTO t (a) VALUES ("2030-04-05 11:12:13");
Warnings:
Warning	1265	Data truncated for column 'b' at row 1
SELECT * FROM t;
a	b
2030-04-05 11:12:13	
DELETE FROM t;
DELETE IGNORE FROM t;
CHECK TABLE t;
Table	Op	Msg_type	Msg_text
test.t	check	status	OK
DROP TABLE t;
# Testing example of type CHAR(40) and value "2000000000000000000000000000000000000"
SHOW CREATE TABLE t;
Table	Create Table
t	CREATE TABLE `t` (
  `a` char(40) NOT NULL,
  `b` enum('up','down') GENERATED ALWAYS AS (`a`) VIRTUAL NOT NULL,
  KEY `on_b` (`b`)
) ENGINE=InnoDB DEFAULT CHARSET=utf8mb4 COLLATE=utf8mb4_0900_ai_ci
INSERT IGNORE INTO t (a) VALUES ("2000000000000000000000000000000000000");
Warnings:
Warning	1265	Data truncated for column 'b' at row 1
SELECT * FROM t;
a	b
2000000000000000000000000000000000000	
DELETE FROM t;
DELETE IGNORE FROM t;
CHECK TABLE t;
Table	Op	Msg_type	Msg_text
test.t	check	status	OK
DROP TABLE t;
# Testing example of type BINARY(45) and value "200000000000000000000000000000000000000000"
SHOW CREATE TABLE t;
Table	Create Table
t	CREATE TABLE `t` (
  `a` binary(45) NOT NULL,
  `b` enum('up','down') GENERATED ALWAYS AS (`a`) VIRTUAL NOT NULL,
  KEY `on_b` (`b`)
) ENGINE=InnoDB DEFAULT CHARSET=utf8mb4 COLLATE=utf8mb4_0900_ai_ci
INSERT IGNORE INTO t (a) VALUES ("200000000000000000000000000000000000000000");
Warnings:
Warning	1265	Data truncated for column 'b' at row 1
SELECT * FROM t;
a	b
200000000000000000000000000000000000000000   	
DELETE FROM t;
DELETE IGNORE FROM t;
CHECK TABLE t;
Table	Op	Msg_type	Msg_text
test.t	check	status	OK
DROP TABLE t;
# Testing example of type VARCHAR(50) and value "2000000000000000000000000000000000000000000000000"
SHOW CREATE TABLE t;
Table	Create Table
t	CREATE TABLE `t` (
  `a` varchar(50) NOT NULL,
  `b` enum('up','down') GENERATED ALWAYS AS (`a`) VIRTUAL NOT NULL,
  KEY `on_b` (`b`)
) ENGINE=InnoDB DEFAULT CHARSET=utf8mb4 COLLATE=utf8mb4_0900_ai_ci
INSERT IGNORE INTO t (a) VALUES ("2000000000000000000000000000000000000000000000000");
Warnings:
Warning	1265	Data truncated for column 'b' at row 1
SELECT * FROM t;
a	b
2000000000000000000000000000000000000000000000000	
DELETE FROM t;
DELETE IGNORE FROM t;
CHECK TABLE t;
Table	Op	Msg_type	Msg_text
test.t	check	status	OK
DROP TABLE t;
# Testing example of type CHAR(24) and value "hello beautiful world"
SHOW CREATE TABLE t;
Table	Create Table
t	CREATE TABLE `t` (
  `a` char(24) NOT NULL,
  `b` enum('up','down') GENERATED ALWAYS AS (`a`) VIRTUAL NOT NULL,
  KEY `on_b` (`b`)
) ENGINE=InnoDB DEFAULT CHARSET=utf8mb4 COLLATE=utf8mb4_0900_ai_ci
INSERT IGNORE INTO t (a) VALUES ("hello beautiful world");
Warnings:
Warning	1265	Data truncated for column 'b' at row 1
SELECT * FROM t;
a	b
hello beautiful world	
DELETE FROM t;
DELETE IGNORE FROM t;
CHECK TABLE t;
Table	Op	Msg_type	Msg_text
test.t	check	status	OK
DROP TABLE t;
# Testing example of type BINARY(12) and value "hello world"
SHOW CREATE TABLE t;
Table	Create Table
t	CREATE TABLE `t` (
  `a` binary(12) NOT NULL,
  `b` enum('up','down') GENERATED ALWAYS AS (`a`) VIRTUAL NOT NULL,
  KEY `on_b` (`b`)
) ENGINE=InnoDB DEFAULT CHARSET=utf8mb4 COLLATE=utf8mb4_0900_ai_ci
INSERT IGNORE INTO t (a) VALUES ("hello world");
Warnings:
Warning	1265	Data truncated for column 'b' at row 1
SELECT * FROM t;
a	b
hello world 	
DELETE FROM t;
DELETE IGNORE FROM t;
CHECK TABLE t;
Table	Op	Msg_type	Msg_text
test.t	check	status	OK
DROP TABLE t;
# Testing example of type VARCHAR(6) and value "hello"
SHOW CREATE TABLE t;
Table	Create Table
t	CREATE TABLE `t` (
  `a` varchar(6) NOT NULL,
  `b` enum('up','down') GENERATED ALWAYS AS (`a`) VIRTUAL NOT NULL,
  KEY `on_b` (`b`)
) ENGINE=InnoDB DEFAULT CHARSET=utf8mb4 COLLATE=utf8mb4_0900_ai_ci
INSERT IGNORE INTO t (a) VALUES ("hello");
Warnings:
Warning	1265	Data truncated for column 'b' at row 1
SELECT * FROM t;
a	b
hello	
DELETE FROM t;
DELETE IGNORE FROM t;
CHECK TABLE t;
Table	Op	Msg_type	Msg_text
test.t	check	status	OK
DROP TABLE t;
# Testing example of type ENUM("up","down") and value "up"
SHOW CREATE TABLE t;
Table	Create Table
t	CREATE TABLE `t` (
  `a` enum('up','down') NOT NULL,
  `b` enum('up','down') GENERATED ALWAYS AS (`a`) VIRTUAL NOT NULL,
  KEY `on_b` (`b`)
) ENGINE=InnoDB DEFAULT CHARSET=utf8mb4 COLLATE=utf8mb4_0900_ai_ci
INSERT IGNORE INTO t (a) VALUES ("up");
SELECT * FROM t;
a	b
up	up
DELETE FROM t;
DELETE IGNORE FROM t;
CHECK TABLE t;
Table	Op	Msg_type	Msg_text
test.t	check	status	OK
DROP TABLE t;
# Testing example of type SET("up","down") and value "up,down"
SHOW CREATE TABLE t;
Table	Create Table
t	CREATE TABLE `t` (
  `a` set('up','down') NOT NULL,
  `b` enum('up','down') GENERATED ALWAYS AS (`a`) VIRTUAL NOT NULL,
  KEY `on_b` (`b`)
) ENGINE=InnoDB DEFAULT CHARSET=utf8mb4 COLLATE=utf8mb4_0900_ai_ci
INSERT IGNORE INTO t (a) VALUES ("up,down");
Warnings:
Warning	1265	Data truncated for column 'b' at row 1
SELECT * FROM t;
a	b
up,down	
DELETE FROM t;
DELETE IGNORE FROM t;
CHECK TABLE t;
Table	Op	Msg_type	Msg_text
test.t	check	status	OK
DROP TABLE t;
# Testing example of type GEOMETRY and value ST_GeomFromText("POINT(1 1)")
SHOW CREATE TABLE t;
Table	Create Table
t	CREATE TABLE `t` (
  `a` geometry NOT NULL,
  `b` enum('up','down') GENERATED ALWAYS AS (`a`) VIRTUAL NOT NULL,
  KEY `on_b` (`b`)
) ENGINE=InnoDB DEFAULT CHARSET=utf8mb4 COLLATE=utf8mb4_0900_ai_ci
INSERT IGNORE INTO t (a) VALUES (ST_GeomFromText("POINT(1 1)"));
Warnings:
Warning	1265	Data truncated for column 'b' at row 1
SELECT * FROM t;
a	b
             ð?      ð?	
DELETE FROM t;
DELETE IGNORE FROM t;
CHECK TABLE t;
Table	Op	Msg_type	Msg_text
test.t	check	status	OK
DROP TABLE t;
# Testing example of type POINT and value ST_GeomFromText("POINT(1 1)")
SHOW CREATE TABLE t;
Table	Create Table
t	CREATE TABLE `t` (
  `a` point NOT NULL,
  `b` enum('up','down') GENERATED ALWAYS AS (`a`) VIRTUAL NOT NULL,
  KEY `on_b` (`b`)
) ENGINE=InnoDB DEFAULT CHARSET=utf8mb4 COLLATE=utf8mb4_0900_ai_ci
INSERT IGNORE INTO t (a) VALUES (ST_GeomFromText("POINT(1 1)"));
Warnings:
Warning	1265	Data truncated for column 'b' at row 1
SELECT * FROM t;
a	b
             ð?      ð?	
DELETE FROM t;
DELETE IGNORE FROM t;
CHECK TABLE t;
Table	Op	Msg_type	Msg_text
test.t	check	status	OK
DROP TABLE t;
# Testing example of type LINESTRING and value ST_GeomFromText("LINESTRING(0 0,1 1,2 2)")
SHOW CREATE TABLE t;
Table	Create Table
t	CREATE TABLE `t` (
  `a` linestring NOT NULL,
  `b` enum('up','down') GENERATED ALWAYS AS (`a`) VIRTUAL NOT NULL,
  KEY `on_b` (`b`)
) ENGINE=InnoDB DEFAULT CHARSET=utf8mb4 COLLATE=utf8mb4_0900_ai_ci
INSERT IGNORE INTO t (a) VALUES (ST_GeomFromText("LINESTRING(0 0,1 1,2 2)"));
Warnings:
Warning	1265	Data truncated for column 'b' at row 1
SELECT * FROM t;
a	b
                                ð?      ð?       @       @	
DELETE FROM t;
DELETE IGNORE FROM t;
CHECK TABLE t;
Table	Op	Msg_type	Msg_text
test.t	check	status	OK
DROP TABLE t;
# Testing example of type POLYGON and value ST_GeomFromText("POLYGON((0 0,1 0,1 1,0 1,0 0),(5 5,7 5,7 7,5 7,5 5))")
SHOW CREATE TABLE t;
Table	Create Table
t	CREATE TABLE `t` (
  `a` polygon NOT NULL,
  `b` enum('up','down') GENERATED ALWAYS AS (`a`) VIRTUAL NOT NULL,
  KEY `on_b` (`b`)
) ENGINE=InnoDB DEFAULT CHARSET=utf8mb4 COLLATE=utf8mb4_0900_ai_ci
INSERT IGNORE INTO t (a) VALUES (ST_GeomFromText("POLYGON((0 0,1 0,1 1,0 1,0 0),(5 5,7 5,7 7,5 7,5 5))"));
Warnings:
Warning	1265	Data truncated for column 'b' at row 1
SELECT * FROM t;
a	b
                                   ð?              ð?      ð?              ð?                         @      @      @      @      @      @      @      @      @      @	
DELETE FROM t;
DELETE IGNORE FROM t;
CHECK TABLE t;
Table	Op	Msg_type	Msg_text
test.t	check	status	OK
DROP TABLE t;
#
# Testing virtual column of type SET("up","down")
#
# Testing example of type JSON and value "{}"
SHOW CREATE TABLE t;
Table	Create Table
t	CREATE TABLE `t` (
  `a` json NOT NULL,
  `b` set('up','down') GENERATED ALWAYS AS (`a`) VIRTUAL NOT NULL,
  KEY `on_b` (`b`)
) ENGINE=InnoDB DEFAULT CHARSET=utf8mb4 COLLATE=utf8mb4_0900_ai_ci
INSERT IGNORE INTO t (a) VALUES ("{}");
Warnings:
Warning	1265	Data truncated for column 'b' at row 1
SELECT * FROM t;
a	b
{}	
DELETE FROM t;
DELETE IGNORE FROM t;
CHECK TABLE t;
Table	Op	Msg_type	Msg_text
test.t	check	status	OK
DROP TABLE t;
# Testing example of type JSON and value '["hello beautiful world"]'
SHOW CREATE TABLE t;
Table	Create Table
t	CREATE TABLE `t` (
  `a` json NOT NULL,
  `b` set('up','down') GENERATED ALWAYS AS (`a`) VIRTUAL NOT NULL,
  KEY `on_b` (`b`)
) ENGINE=InnoDB DEFAULT CHARSET=utf8mb4 COLLATE=utf8mb4_0900_ai_ci
INSERT IGNORE INTO t (a) VALUES ('["hello beautiful world"]');
Warnings:
Warning	1265	Data truncated for column 'b' at row 1
SELECT * FROM t;
a	b
["hello beautiful world"]	
DELETE FROM t;
DELETE IGNORE FROM t;
CHECK TABLE t;
Table	Op	Msg_type	Msg_text
test.t	check	status	OK
DROP TABLE t;
# Testing example of type JSON and value "-1"
SHOW CREATE TABLE t;
Table	Create Table
t	CREATE TABLE `t` (
  `a` json NOT NULL,
  `b` set('up','down') GENERATED ALWAYS AS (`a`) VIRTUAL NOT NULL,
  KEY `on_b` (`b`)
) ENGINE=InnoDB DEFAULT CHARSET=utf8mb4 COLLATE=utf8mb4_0900_ai_ci
INSERT IGNORE INTO t (a) VALUES ("-1");
Warnings:
Warning	1265	Data truncated for column 'b' at row 1
SELECT * FROM t;
a	b
-1	
DELETE FROM t;
DELETE IGNORE FROM t;
CHECK TABLE t;
Table	Op	Msg_type	Msg_text
test.t	check	status	OK
DROP TABLE t;
# Testing example of type TINYINT and value -1
SHOW CREATE TABLE t;
Table	Create Table
t	CREATE TABLE `t` (
  `a` tinyint NOT NULL,
  `b` set('up','down') GENERATED ALWAYS AS (`a`) VIRTUAL NOT NULL,
  KEY `on_b` (`b`)
) ENGINE=InnoDB DEFAULT CHARSET=utf8mb4 COLLATE=utf8mb4_0900_ai_ci
INSERT IGNORE INTO t (a) VALUES (-1);
Warnings:
Warning	1265	Data truncated for column 'b' at row 1
SELECT * FROM t;
a	b
-1	up,down
DELETE FROM t;
DELETE IGNORE FROM t;
CHECK TABLE t;
Table	Op	Msg_type	Msg_text
test.t	check	status	OK
DROP TABLE t;
# Testing example of type SMALLINT and value -1
SHOW CREATE TABLE t;
Table	Create Table
t	CREATE TABLE `t` (
  `a` smallint NOT NULL,
  `b` set('up','down') GENERATED ALWAYS AS (`a`) VIRTUAL NOT NULL,
  KEY `on_b` (`b`)
) ENGINE=InnoDB DEFAULT CHARSET=utf8mb4 COLLATE=utf8mb4_0900_ai_ci
INSERT IGNORE INTO t (a) VALUES (-1);
Warnings:
Warning	1265	Data truncated for column 'b' at row 1
SELECT * FROM t;
a	b
-1	up,down
DELETE FROM t;
DELETE IGNORE FROM t;
CHECK TABLE t;
Table	Op	Msg_type	Msg_text
test.t	check	status	OK
DROP TABLE t;
# Testing example of type MEDIUMINT and value -1
SHOW CREATE TABLE t;
Table	Create Table
t	CREATE TABLE `t` (
  `a` mediumint NOT NULL,
  `b` set('up','down') GENERATED ALWAYS AS (`a`) VIRTUAL NOT NULL,
  KEY `on_b` (`b`)
) ENGINE=InnoDB DEFAULT CHARSET=utf8mb4 COLLATE=utf8mb4_0900_ai_ci
INSERT IGNORE INTO t (a) VALUES (-1);
Warnings:
Warning	1265	Data truncated for column 'b' at row 1
SELECT * FROM t;
a	b
-1	up,down
DELETE FROM t;
DELETE IGNORE FROM t;
CHECK TABLE t;
Table	Op	Msg_type	Msg_text
test.t	check	status	OK
DROP TABLE t;
# Testing example of type INT and value 2000000000
SHOW CREATE TABLE t;
Table	Create Table
t	CREATE TABLE `t` (
  `a` int NOT NULL,
  `b` set('up','down') GENERATED ALWAYS AS (`a`) VIRTUAL NOT NULL,
  KEY `on_b` (`b`)
) ENGINE=InnoDB DEFAULT CHARSET=utf8mb4 COLLATE=utf8mb4_0900_ai_ci
INSERT IGNORE INTO t (a) VALUES (2000000000);
Warnings:
Warning	1265	Data truncated for column 'b' at row 1
SELECT * FROM t;
a	b
2000000000	
DELETE FROM t;
DELETE IGNORE FROM t;
CHECK TABLE t;
Table	Op	Msg_type	Msg_text
test.t	check	status	OK
DROP TABLE t;
# Testing example of type INT and value -2000000000
SHOW CREATE TABLE t;
Table	Create Table
t	CREATE TABLE `t` (
  `a` int NOT NULL,
  `b` set('up','down') GENERATED ALWAYS AS (`a`) VIRTUAL NOT NULL,
  KEY `on_b` (`b`)
) ENGINE=InnoDB DEFAULT CHARSET=utf8mb4 COLLATE=utf8mb4_0900_ai_ci
INSERT IGNORE INTO t (a) VALUES (-2000000000);
Warnings:
Warning	1265	Data truncated for column 'b' at row 1
SELECT * FROM t;
a	b
-2000000000	
DELETE FROM t;
DELETE IGNORE FROM t;
CHECK TABLE t;
Table	Op	Msg_type	Msg_text
test.t	check	status	OK
DROP TABLE t;
# Testing example of type INT UNSIGNED and value 4000000000
SHOW CREATE TABLE t;
Table	Create Table
t	CREATE TABLE `t` (
  `a` int unsigned NOT NULL,
  `b` set('up','down') GENERATED ALWAYS AS (`a`) VIRTUAL NOT NULL,
  KEY `on_b` (`b`)
) ENGINE=InnoDB DEFAULT CHARSET=utf8mb4 COLLATE=utf8mb4_0900_ai_ci
INSERT IGNORE INTO t (a) VALUES (4000000000);
Warnings:
Warning	1265	Data truncated for column 'b' at row 1
SELECT * FROM t;
a	b
4000000000	
DELETE FROM t;
DELETE IGNORE FROM t;
CHECK TABLE t;
Table	Op	Msg_type	Msg_text
test.t	check	status	OK
DROP TABLE t;
# Testing example of type BIGINT and value 2000000000000000000
SHOW CREATE TABLE t;
Table	Create Table
t	CREATE TABLE `t` (
  `a` bigint NOT NULL,
  `b` set('up','down') GENERATED ALWAYS AS (`a`) VIRTUAL NOT NULL,
  KEY `on_b` (`b`)
) ENGINE=InnoDB DEFAULT CHARSET=utf8mb4 COLLATE=utf8mb4_0900_ai_ci
INSERT IGNORE INTO t (a) VALUES (2000000000000000000);
Warnings:
Warning	1265	Data truncated for column 'b' at row 1
SELECT * FROM t;
a	b
2000000000000000000	
DELETE FROM t;
DELETE IGNORE FROM t;
CHECK TABLE t;
Table	Op	Msg_type	Msg_text
test.t	check	status	OK
DROP TABLE t;
# Testing example of type BIGINT and value -2000000000000000000
SHOW CREATE TABLE t;
Table	Create Table
t	CREATE TABLE `t` (
  `a` bigint NOT NULL,
  `b` set('up','down') GENERATED ALWAYS AS (`a`) VIRTUAL NOT NULL,
  KEY `on_b` (`b`)
) ENGINE=InnoDB DEFAULT CHARSET=utf8mb4 COLLATE=utf8mb4_0900_ai_ci
INSERT IGNORE INTO t (a) VALUES (-2000000000000000000);
Warnings:
Warning	1265	Data truncated for column 'b' at row 1
SELECT * FROM t;
a	b
-2000000000000000000	
DELETE FROM t;
DELETE IGNORE FROM t;
CHECK TABLE t;
Table	Op	Msg_type	Msg_text
test.t	check	status	OK
DROP TABLE t;
# Testing example of type FLOAT and value -1.23456
SHOW CREATE TABLE t;
Table	Create Table
t	CREATE TABLE `t` (
  `a` float NOT NULL,
  `b` set('up','down') GENERATED ALWAYS AS (`a`) VIRTUAL NOT NULL,
  KEY `on_b` (`b`)
) ENGINE=InnoDB DEFAULT CHARSET=utf8mb4 COLLATE=utf8mb4_0900_ai_ci
INSERT IGNORE INTO t (a) VALUES (-1.23456);
Warnings:
Warning	1265	Data truncated for column 'b' at row 1
SELECT * FROM t;
a	b
-1.23456	up,down
DELETE FROM t;
DELETE IGNORE FROM t;
CHECK TABLE t;
Table	Op	Msg_type	Msg_text
test.t	check	status	OK
DROP TABLE t;
# Testing example of type FLOAT and value -1e38
SHOW CREATE TABLE t;
Table	Create Table
t	CREATE TABLE `t` (
  `a` float NOT NULL,
  `b` set('up','down') GENERATED ALWAYS AS (`a`) VIRTUAL NOT NULL,
  KEY `on_b` (`b`)
) ENGINE=InnoDB DEFAULT CHARSET=utf8mb4 COLLATE=utf8mb4_0900_ai_ci
INSERT IGNORE INTO t (a) VALUES (-1e38);
Warnings:
Warning	1265	Data truncated for column 'b' at row 1
SELECT * FROM t;
a	b
-1e38	
DELETE FROM t;
DELETE IGNORE FROM t;
CHECK TABLE t;
Table	Op	Msg_type	Msg_text
test.t	check	status	OK
DROP TABLE t;
# Testing example of type FLOAT and value 1e38
SHOW CREATE TABLE t;
Table	Create Table
t	CREATE TABLE `t` (
  `a` float NOT NULL,
  `b` set('up','down') GENERATED ALWAYS AS (`a`) VIRTUAL NOT NULL,
  KEY `on_b` (`b`)
) ENGINE=InnoDB DEFAULT CHARSET=utf8mb4 COLLATE=utf8mb4_0900_ai_ci
INSERT IGNORE INTO t (a) VALUES (1e38);
Warnings:
Warning	1265	Data truncated for column 'b' at row 1
SELECT * FROM t;
a	b
1e38	up,down
DELETE FROM t;
DELETE IGNORE FROM t;
CHECK TABLE t;
Table	Op	Msg_type	Msg_text
test.t	check	status	OK
DROP TABLE t;
# Testing example of type DOUBLE and value -1.23456789012345
SHOW CREATE TABLE t;
Table	Create Table
t	CREATE TABLE `t` (
  `a` double NOT NULL,
  `b` set('up','down') GENERATED ALWAYS AS (`a`) VIRTUAL NOT NULL,
  KEY `on_b` (`b`)
) ENGINE=InnoDB DEFAULT CHARSET=utf8mb4 COLLATE=utf8mb4_0900_ai_ci
INSERT IGNORE INTO t (a) VALUES (-1.23456789012345);
Warnings:
Warning	1265	Data truncated for column 'b' at row 1
SELECT * FROM t;
a	b
-1.23456789012345	up,down
DELETE FROM t;
DELETE IGNORE FROM t;
CHECK TABLE t;
Table	Op	Msg_type	Msg_text
test.t	check	status	OK
DROP TABLE t;
# Testing example of type DOUBLE and value 1.23456789012345
SHOW CREATE TABLE t;
Table	Create Table
t	CREATE TABLE `t` (
  `a` double NOT NULL,
  `b` set('up','down') GENERATED ALWAYS AS (`a`) VIRTUAL NOT NULL,
  KEY `on_b` (`b`)
) ENGINE=InnoDB DEFAULT CHARSET=utf8mb4 COLLATE=utf8mb4_0900_ai_ci
INSERT IGNORE INTO t (a) VALUES (1.23456789012345);
SELECT * FROM t;
a	b
1.23456789012345	up
DELETE FROM t;
DELETE IGNORE FROM t;
CHECK TABLE t;
Table	Op	Msg_type	Msg_text
test.t	check	status	OK
DROP TABLE t;
# Testing example of type DOUBLE and value -1e300
SHOW CREATE TABLE t;
Table	Create Table
t	CREATE TABLE `t` (
  `a` double NOT NULL,
  `b` set('up','down') GENERATED ALWAYS AS (`a`) VIRTUAL NOT NULL,
  KEY `on_b` (`b`)
) ENGINE=InnoDB DEFAULT CHARSET=utf8mb4 COLLATE=utf8mb4_0900_ai_ci
INSERT IGNORE INTO t (a) VALUES (-1e300);
Warnings:
Warning	1265	Data truncated for column 'b' at row 1
SELECT * FROM t;
a	b
-1e300	
DELETE FROM t;
DELETE IGNORE FROM t;
CHECK TABLE t;
Table	Op	Msg_type	Msg_text
test.t	check	status	OK
DROP TABLE t;
# Testing example of type DOUBLE and value 1e300
SHOW CREATE TABLE t;
Table	Create Table
t	CREATE TABLE `t` (
  `a` double NOT NULL,
  `b` set('up','down') GENERATED ALWAYS AS (`a`) VIRTUAL NOT NULL,
  KEY `on_b` (`b`)
) ENGINE=InnoDB DEFAULT CHARSET=utf8mb4 COLLATE=utf8mb4_0900_ai_ci
INSERT IGNORE INTO t (a) VALUES (1e300);
Warnings:
Warning	1265	Data truncated for column 'b' at row 1
SELECT * FROM t;
a	b
1e300	up,down
DELETE FROM t;
DELETE IGNORE FROM t;
CHECK TABLE t;
Table	Op	Msg_type	Msg_text
test.t	check	status	OK
DROP TABLE t;
# Testing example of type DECIMAL(4,2) and value -10.99
SHOW CREATE TABLE t;
Table	Create Table
t	CREATE TABLE `t` (
  `a` decimal(4,2) NOT NULL,
  `b` set('up','down') GENERATED ALWAYS AS (`a`) VIRTUAL NOT NULL,
  KEY `on_b` (`b`)
) ENGINE=InnoDB DEFAULT CHARSET=utf8mb4 COLLATE=utf8mb4_0900_ai_ci
INSERT IGNORE INTO t (a) VALUES (-10.99);
Warnings:
Warning	1265	Data truncated for column 'b' at row 1
SELECT * FROM t;
a	b
-10.99	down
DELETE FROM t;
DELETE IGNORE FROM t;
CHECK TABLE t;
Table	Op	Msg_type	Msg_text
test.t	check	status	OK
DROP TABLE t;
# Testing example of type DECIMAL(34,4) and value 20000000000000000000000000000.0001
SHOW CREATE TABLE t;
Table	Create Table
t	CREATE TABLE `t` (
  `a` decimal(34,4) NOT NULL,
  `b` set('up','down') GENERATED ALWAYS AS (`a`) VIRTUAL NOT NULL,
  KEY `on_b` (`b`)
) ENGINE=InnoDB DEFAULT CHARSET=utf8mb4 COLLATE=utf8mb4_0900_ai_ci
INSERT IGNORE INTO t (a) VALUES (20000000000000000000000000000.0001);
Warnings:
Warning	1265	Data truncated for column 'b' at row 1
SELECT * FROM t;
a	b
20000000000000000000000000000.0001	up,down
DELETE FROM t;
DELETE IGNORE FROM t;
CHECK TABLE t;
Table	Op	Msg_type	Msg_text
test.t	check	status	OK
DROP TABLE t;
# Testing example of type DECIMAL(34,4) and value -20000000000000000000000000000.0001
SHOW CREATE TABLE t;
Table	Create Table
t	CREATE TABLE `t` (
  `a` decimal(34,4) NOT NULL,
  `b` set('up','down') GENERATED ALWAYS AS (`a`) VIRTUAL NOT NULL,
  KEY `on_b` (`b`)
) ENGINE=InnoDB DEFAULT CHARSET=utf8mb4 COLLATE=utf8mb4_0900_ai_ci
INSERT IGNORE INTO t (a) VALUES (-20000000000000000000000000000.0001);
Warnings:
Warning	1265	Data truncated for column 'b' at row 1
SELECT * FROM t;
a	b
-20000000000000000000000000000.0001	
DELETE FROM t;
DELETE IGNORE FROM t;
CHECK TABLE t;
Table	Op	Msg_type	Msg_text
test.t	check	status	OK
DROP TABLE t;
# Testing example of type BIT(64) and value 0xDEADBEEFC0FEBABE
SHOW CREATE TABLE t;
Table	Create Table
t	CREATE TABLE `t` (
  `a` bit(64) NOT NULL,
  `b` set('up','down') GENERATED ALWAYS AS (`a`) VIRTUAL NOT NULL,
  KEY `on_b` (`b`)
) ENGINE=InnoDB DEFAULT CHARSET=utf8mb4 COLLATE=utf8mb4_0900_ai_ci
INSERT IGNORE INTO t (a) VALUES (0xDEADBEEFC0FEBABE);
Warnings:
Warning	1265	Data truncated for column 'b' at row 1
SELECT * FROM t;
a	b
Þ­¾ïÀþº¾	down
DELETE FROM t;
DELETE IGNORE FROM t;
CHECK TABLE t;
Table	Op	Msg_type	Msg_text
test.t	check	status	OK
DROP TABLE t;
# Testing example of type BIT(4) and value 0b1000
SHOW CREATE TABLE t;
Table	Create Table
t	CREATE TABLE `t` (
  `a` bit(4) NOT NULL,
  `b` set('up','down') GENERATED ALWAYS AS (`a`) VIRTUAL NOT NULL,
  KEY `on_b` (`b`)
) ENGINE=InnoDB DEFAULT CHARSET=utf8mb4 COLLATE=utf8mb4_0900_ai_ci
INSERT IGNORE INTO t (a) VALUES (0b1000);
Warnings:
Warning	1265	Data truncated for column 'b' at row 1
SELECT * FROM t;
a	b
	
DELETE FROM t;
DELETE IGNORE FROM t;
CHECK TABLE t;
Table	Op	Msg_type	Msg_text
test.t	check	status	OK
DROP TABLE t;
# Testing example of type YEAR and value 2020
SHOW CREATE TABLE t;
Table	Create Table
t	CREATE TABLE `t` (
  `a` year NOT NULL,
  `b` set('up','down') GENERATED ALWAYS AS (`a`) VIRTUAL NOT NULL,
  KEY `on_b` (`b`)
) ENGINE=InnoDB DEFAULT CHARSET=utf8mb4 COLLATE=utf8mb4_0900_ai_ci
INSERT IGNORE INTO t (a) VALUES (2020);
Warnings:
Warning	1265	Data truncated for column 'b' at row 1
SELECT * FROM t;
a	b
2020	
DELETE FROM t;
DELETE IGNORE FROM t;
CHECK TABLE t;
Table	Op	Msg_type	Msg_text
test.t	check	status	OK
DROP TABLE t;
# Testing example of type DATE and value "2030-04-05"
SHOW CREATE TABLE t;
Table	Create Table
t	CREATE TABLE `t` (
  `a` date NOT NULL,
  `b` set('up','down') GENERATED ALWAYS AS (`a`) VIRTUAL NOT NULL,
  KEY `on_b` (`b`)
) ENGINE=InnoDB DEFAULT CHARSET=utf8mb4 COLLATE=utf8mb4_0900_ai_ci
INSERT IGNORE INTO t (a) VALUES ("2030-04-05");
Warnings:
Warning	1265	Data truncated for column 'b' at row 1
SELECT * FROM t;
a	b
2030-04-05	
DELETE FROM t;
DELETE IGNORE FROM t;
CHECK TABLE t;
Table	Op	Msg_type	Msg_text
test.t	check	status	OK
DROP TABLE t;
# Testing example of type TIME and value "11:12:13"
SHOW CREATE TABLE t;
Table	Create Table
t	CREATE TABLE `t` (
  `a` time NOT NULL,
  `b` set('up','down') GENERATED ALWAYS AS (`a`) VIRTUAL NOT NULL,
  KEY `on_b` (`b`)
) ENGINE=InnoDB DEFAULT CHARSET=utf8mb4 COLLATE=utf8mb4_0900_ai_ci
INSERT IGNORE INTO t (a) VALUES ("11:12:13");
Warnings:
Warning	1265	Data truncated for column 'b' at row 1
SELECT * FROM t;
a	b
11:12:13	
DELETE FROM t;
DELETE IGNORE FROM t;
CHECK TABLE t;
Table	Op	Msg_type	Msg_text
test.t	check	status	OK
DROP TABLE t;
# Testing example of type DATETIME and value "2030-04-05 11:12:13"
SHOW CREATE TABLE t;
Table	Create Table
t	CREATE TABLE `t` (
  `a` datetime NOT NULL,
  `b` set('up','down') GENERATED ALWAYS AS (`a`) VIRTUAL NOT NULL,
  KEY `on_b` (`b`)
) ENGINE=InnoDB DEFAULT CHARSET=utf8mb4 COLLATE=utf8mb4_0900_ai_ci
INSERT IGNORE INTO t (a) VALUES ("2030-04-05 11:12:13");
Warnings:
Warning	1265	Data truncated for column 'b' at row 1
SELECT * FROM t;
a	b
2030-04-05 11:12:13	
DELETE FROM t;
DELETE IGNORE FROM t;
CHECK TABLE t;
Table	Op	Msg_type	Msg_text
test.t	check	status	OK
DROP TABLE t;
# Testing example of type TIMESTAMP and value "2030-04-05 11:12:13"
SHOW CREATE TABLE t;
Table	Create Table
t	CREATE TABLE `t` (
  `a` timestamp NOT NULL,
  `b` set('up','down') GENERATED ALWAYS AS (`a`) VIRTUAL NOT NULL,
  KEY `on_b` (`b`)
) ENGINE=InnoDB DEFAULT CHARSET=utf8mb4 COLLATE=utf8mb4_0900_ai_ci
INSERT IGNORE INTO t (a) VALUES ("2030-04-05 11:12:13");
Warnings:
Warning	1265	Data truncated for column 'b' at row 1
SELECT * FROM t;
a	b
2030-04-05 11:12:13	
DELETE FROM t;
DELETE IGNORE FROM t;
CHECK TABLE t;
Table	Op	Msg_type	Msg_text
test.t	check	status	OK
DROP TABLE t;
# Testing example of type CHAR(40) and value "2000000000000000000000000000000000000"
SHOW CREATE TABLE t;
Table	Create Table
t	CREATE TABLE `t` (
  `a` char(40) NOT NULL,
  `b` set('up','down') GENERATED ALWAYS AS (`a`) VIRTUAL NOT NULL,
  KEY `on_b` (`b`)
) ENGINE=InnoDB DEFAULT CHARSET=utf8mb4 COLLATE=utf8mb4_0900_ai_ci
INSERT IGNORE INTO t (a) VALUES ("2000000000000000000000000000000000000");
Warnings:
Warning	1265	Data truncated for column 'b' at row 1
SELECT * FROM t;
a	b
2000000000000000000000000000000000000	
DELETE FROM t;
DELETE IGNORE FROM t;
CHECK TABLE t;
Table	Op	Msg_type	Msg_text
test.t	check	status	OK
DROP TABLE t;
# Testing example of type BINARY(45) and value "200000000000000000000000000000000000000000"
SHOW CREATE TABLE t;
Table	Create Table
t	CREATE TABLE `t` (
  `a` binary(45) NOT NULL,
  `b` set('up','down') GENERATED ALWAYS AS (`a`) VIRTUAL NOT NULL,
  KEY `on_b` (`b`)
) ENGINE=InnoDB DEFAULT CHARSET=utf8mb4 COLLATE=utf8mb4_0900_ai_ci
INSERT IGNORE INTO t (a) VALUES ("200000000000000000000000000000000000000000");
Warnings:
Warning	1265	Data truncated for column 'b' at row 1
SELECT * FROM t;
a	b
200000000000000000000000000000000000000000   	
DELETE FROM t;
DELETE IGNORE FROM t;
CHECK TABLE t;
Table	Op	Msg_type	Msg_text
test.t	check	status	OK
DROP TABLE t;
# Testing example of type VARCHAR(50) and value "2000000000000000000000000000000000000000000000000"
SHOW CREATE TABLE t;
Table	Create Table
t	CREATE TABLE `t` (
  `a` varchar(50) NOT NULL,
  `b` set('up','down') GENERATED ALWAYS AS (`a`) VIRTUAL NOT NULL,
  KEY `on_b` (`b`)
) ENGINE=InnoDB DEFAULT CHARSET=utf8mb4 COLLATE=utf8mb4_0900_ai_ci
INSERT IGNORE INTO t (a) VALUES ("2000000000000000000000000000000000000000000000000");
Warnings:
Warning	1265	Data truncated for column 'b' at row 1
SELECT * FROM t;
a	b
2000000000000000000000000000000000000000000000000	
DELETE FROM t;
DELETE IGNORE FROM t;
CHECK TABLE t;
Table	Op	Msg_type	Msg_text
test.t	check	status	OK
DROP TABLE t;
# Testing example of type CHAR(24) and value "hello beautiful world"
SHOW CREATE TABLE t;
Table	Create Table
t	CREATE TABLE `t` (
  `a` char(24) NOT NULL,
  `b` set('up','down') GENERATED ALWAYS AS (`a`) VIRTUAL NOT NULL,
  KEY `on_b` (`b`)
) ENGINE=InnoDB DEFAULT CHARSET=utf8mb4 COLLATE=utf8mb4_0900_ai_ci
INSERT IGNORE INTO t (a) VALUES ("hello beautiful world");
Warnings:
Warning	1265	Data truncated for column 'b' at row 1
SELECT * FROM t;
a	b
hello beautiful world	
DELETE FROM t;
DELETE IGNORE FROM t;
CHECK TABLE t;
Table	Op	Msg_type	Msg_text
test.t	check	status	OK
DROP TABLE t;
# Testing example of type BINARY(12) and value "hello world"
SHOW CREATE TABLE t;
Table	Create Table
t	CREATE TABLE `t` (
  `a` binary(12) NOT NULL,
  `b` set('up','down') GENERATED ALWAYS AS (`a`) VIRTUAL NOT NULL,
  KEY `on_b` (`b`)
) ENGINE=InnoDB DEFAULT CHARSET=utf8mb4 COLLATE=utf8mb4_0900_ai_ci
INSERT IGNORE INTO t (a) VALUES ("hello world");
Warnings:
Warning	1265	Data truncated for column 'b' at row 1
SELECT * FROM t;
a	b
hello world 	
DELETE FROM t;
DELETE IGNORE FROM t;
CHECK TABLE t;
Table	Op	Msg_type	Msg_text
test.t	check	status	OK
DROP TABLE t;
# Testing example of type VARCHAR(6) and value "hello"
SHOW CREATE TABLE t;
Table	Create Table
t	CREATE TABLE `t` (
  `a` varchar(6) NOT NULL,
  `b` set('up','down') GENERATED ALWAYS AS (`a`) VIRTUAL NOT NULL,
  KEY `on_b` (`b`)
) ENGINE=InnoDB DEFAULT CHARSET=utf8mb4 COLLATE=utf8mb4_0900_ai_ci
INSERT IGNORE INTO t (a) VALUES ("hello");
Warnings:
Warning	1265	Data truncated for column 'b' at row 1
SELECT * FROM t;
a	b
hello	
DELETE FROM t;
DELETE IGNORE FROM t;
CHECK TABLE t;
Table	Op	Msg_type	Msg_text
test.t	check	status	OK
DROP TABLE t;
# Testing example of type ENUM("up","down") and value "up"
SHOW CREATE TABLE t;
Table	Create Table
t	CREATE TABLE `t` (
  `a` enum('up','down') NOT NULL,
  `b` set('up','down') GENERATED ALWAYS AS (`a`) VIRTUAL NOT NULL,
  KEY `on_b` (`b`)
) ENGINE=InnoDB DEFAULT CHARSET=utf8mb4 COLLATE=utf8mb4_0900_ai_ci
INSERT IGNORE INTO t (a) VALUES ("up");
SELECT * FROM t;
a	b
up	up
DELETE FROM t;
DELETE IGNORE FROM t;
CHECK TABLE t;
Table	Op	Msg_type	Msg_text
test.t	check	status	OK
DROP TABLE t;
# Testing example of type SET("up","down") and value "up,down"
SHOW CREATE TABLE t;
Table	Create Table
t	CREATE TABLE `t` (
  `a` set('up','down') NOT NULL,
  `b` set('up','down') GENERATED ALWAYS AS (`a`) VIRTUAL NOT NULL,
  KEY `on_b` (`b`)
) ENGINE=InnoDB DEFAULT CHARSET=utf8mb4 COLLATE=utf8mb4_0900_ai_ci
INSERT IGNORE INTO t (a) VALUES ("up,down");
SELECT * FROM t;
a	b
up,down	up,down
DELETE FROM t;
DELETE IGNORE FROM t;
CHECK TABLE t;
Table	Op	Msg_type	Msg_text
test.t	check	status	OK
DROP TABLE t;
# Testing example of type GEOMETRY and value ST_GeomFromText("POINT(1 1)")
SHOW CREATE TABLE t;
Table	Create Table
t	CREATE TABLE `t` (
  `a` geometry NOT NULL,
  `b` set('up','down') GENERATED ALWAYS AS (`a`) VIRTUAL NOT NULL,
  KEY `on_b` (`b`)
) ENGINE=InnoDB DEFAULT CHARSET=utf8mb4 COLLATE=utf8mb4_0900_ai_ci
INSERT IGNORE INTO t (a) VALUES (ST_GeomFromText("POINT(1 1)"));
Warnings:
Warning	1265	Data truncated for column 'b' at row 1
SELECT * FROM t;
a	b
             ð?      ð?	
DELETE FROM t;
DELETE IGNORE FROM t;
CHECK TABLE t;
Table	Op	Msg_type	Msg_text
test.t	check	status	OK
DROP TABLE t;
# Testing example of type POINT and value ST_GeomFromText("POINT(1 1)")
SHOW CREATE TABLE t;
Table	Create Table
t	CREATE TABLE `t` (
  `a` point NOT NULL,
  `b` set('up','down') GENERATED ALWAYS AS (`a`) VIRTUAL NOT NULL,
  KEY `on_b` (`b`)
) ENGINE=InnoDB DEFAULT CHARSET=utf8mb4 COLLATE=utf8mb4_0900_ai_ci
INSERT IGNORE INTO t (a) VALUES (ST_GeomFromText("POINT(1 1)"));
Warnings:
Warning	1265	Data truncated for column 'b' at row 1
SELECT * FROM t;
a	b
             ð?      ð?	
DELETE FROM t;
DELETE IGNORE FROM t;
CHECK TABLE t;
Table	Op	Msg_type	Msg_text
test.t	check	status	OK
DROP TABLE t;
# Testing example of type LINESTRING and value ST_GeomFromText("LINESTRING(0 0,1 1,2 2)")
SHOW CREATE TABLE t;
Table	Create Table
t	CREATE TABLE `t` (
  `a` linestring NOT NULL,
  `b` set('up','down') GENERATED ALWAYS AS (`a`) VIRTUAL NOT NULL,
  KEY `on_b` (`b`)
) ENGINE=InnoDB DEFAULT CHARSET=utf8mb4 COLLATE=utf8mb4_0900_ai_ci
INSERT IGNORE INTO t (a) VALUES (ST_GeomFromText("LINESTRING(0 0,1 1,2 2)"));
Warnings:
Warning	1265	Data truncated for column 'b' at row 1
SELECT * FROM t;
a	b
                                ð?      ð?       @       @	
DELETE FROM t;
DELETE IGNORE FROM t;
CHECK TABLE t;
Table	Op	Msg_type	Msg_text
test.t	check	status	OK
DROP TABLE t;
# Testing example of type POLYGON and value ST_GeomFromText("POLYGON((0 0,1 0,1 1,0 1,0 0),(5 5,7 5,7 7,5 7,5 5))")
SHOW CREATE TABLE t;
Table	Create Table
t	CREATE TABLE `t` (
  `a` polygon NOT NULL,
  `b` set('up','down') GENERATED ALWAYS AS (`a`) VIRTUAL NOT NULL,
  KEY `on_b` (`b`)
) ENGINE=InnoDB DEFAULT CHARSET=utf8mb4 COLLATE=utf8mb4_0900_ai_ci
INSERT IGNORE INTO t (a) VALUES (ST_GeomFromText("POLYGON((0 0,1 0,1 1,0 1,0 0),(5 5,7 5,7 7,5 7,5 5))"));
Warnings:
Warning	1265	Data truncated for column 'b' at row 1
SELECT * FROM t;
a	b
                                   ð?              ð?      ð?              ð?                         @      @      @      @      @      @      @      @      @      @	
DELETE FROM t;
DELETE IGNORE FROM t;
CHECK TABLE t;
Table	Op	Msg_type	Msg_text
test.t	check	status	OK
DROP TABLE t;
#
# Testing virtual column of type GEOMETRY
#
# Testing example of type JSON and value "{}"
SHOW CREATE TABLE t;
Table	Create Table
t	CREATE TABLE `t` (
  `a` json NOT NULL,
  `b` geometry GENERATED ALWAYS AS (`a`) VIRTUAL NOT NULL
) ENGINE=InnoDB DEFAULT CHARSET=utf8mb4 COLLATE=utf8mb4_0900_ai_ci
INSERT IGNORE INTO t (a) VALUES ("{}");
SELECT * FROM t;
a	b
DELETE FROM t;
DELETE IGNORE FROM t;
CHECK TABLE t;
Table	Op	Msg_type	Msg_text
test.t	check	status	OK
DROP TABLE t;
# Testing example of type JSON and value '["hello beautiful world"]'
SHOW CREATE TABLE t;
Table	Create Table
t	CREATE TABLE `t` (
  `a` json NOT NULL,
  `b` geometry GENERATED ALWAYS AS (`a`) VIRTUAL NOT NULL
) ENGINE=InnoDB DEFAULT CHARSET=utf8mb4 COLLATE=utf8mb4_0900_ai_ci
INSERT IGNORE INTO t (a) VALUES ('["hello beautiful world"]');
SELECT * FROM t;
a	b
DELETE FROM t;
DELETE IGNORE FROM t;
CHECK TABLE t;
Table	Op	Msg_type	Msg_text
test.t	check	status	OK
DROP TABLE t;
# Testing example of type JSON and value "-1"
SHOW CREATE TABLE t;
Table	Create Table
t	CREATE TABLE `t` (
  `a` json NOT NULL,
  `b` geometry GENERATED ALWAYS AS (`a`) VIRTUAL NOT NULL
) ENGINE=InnoDB DEFAULT CHARSET=utf8mb4 COLLATE=utf8mb4_0900_ai_ci
INSERT IGNORE INTO t (a) VALUES ("-1");
SELECT * FROM t;
a	b
DELETE FROM t;
DELETE IGNORE FROM t;
CHECK TABLE t;
Table	Op	Msg_type	Msg_text
test.t	check	status	OK
DROP TABLE t;
# Testing example of type TINYINT and value -1
SHOW CREATE TABLE t;
Table	Create Table
t	CREATE TABLE `t` (
  `a` tinyint NOT NULL,
  `b` geometry GENERATED ALWAYS AS (`a`) VIRTUAL NOT NULL
) ENGINE=InnoDB DEFAULT CHARSET=utf8mb4 COLLATE=utf8mb4_0900_ai_ci
INSERT IGNORE INTO t (a) VALUES (-1);
SELECT * FROM t;
a	b
DELETE FROM t;
DELETE IGNORE FROM t;
CHECK TABLE t;
Table	Op	Msg_type	Msg_text
test.t	check	status	OK
DROP TABLE t;
# Testing example of type SMALLINT and value -1
SHOW CREATE TABLE t;
Table	Create Table
t	CREATE TABLE `t` (
  `a` smallint NOT NULL,
  `b` geometry GENERATED ALWAYS AS (`a`) VIRTUAL NOT NULL
) ENGINE=InnoDB DEFAULT CHARSET=utf8mb4 COLLATE=utf8mb4_0900_ai_ci
INSERT IGNORE INTO t (a) VALUES (-1);
SELECT * FROM t;
a	b
DELETE FROM t;
DELETE IGNORE FROM t;
CHECK TABLE t;
Table	Op	Msg_type	Msg_text
test.t	check	status	OK
DROP TABLE t;
# Testing example of type MEDIUMINT and value -1
SHOW CREATE TABLE t;
Table	Create Table
t	CREATE TABLE `t` (
  `a` mediumint NOT NULL,
  `b` geometry GENERATED ALWAYS AS (`a`) VIRTUAL NOT NULL
) ENGINE=InnoDB DEFAULT CHARSET=utf8mb4 COLLATE=utf8mb4_0900_ai_ci
INSERT IGNORE INTO t (a) VALUES (-1);
SELECT * FROM t;
a	b
DELETE FROM t;
DELETE IGNORE FROM t;
CHECK TABLE t;
Table	Op	Msg_type	Msg_text
test.t	check	status	OK
DROP TABLE t;
# Testing example of type INT and value 2000000000
SHOW CREATE TABLE t;
Table	Create Table
t	CREATE TABLE `t` (
  `a` int NOT NULL,
  `b` geometry GENERATED ALWAYS AS (`a`) VIRTUAL NOT NULL
) ENGINE=InnoDB DEFAULT CHARSET=utf8mb4 COLLATE=utf8mb4_0900_ai_ci
INSERT IGNORE INTO t (a) VALUES (2000000000);
SELECT * FROM t;
a	b
DELETE FROM t;
DELETE IGNORE FROM t;
CHECK TABLE t;
Table	Op	Msg_type	Msg_text
test.t	check	status	OK
DROP TABLE t;
# Testing example of type INT and value -2000000000
SHOW CREATE TABLE t;
Table	Create Table
t	CREATE TABLE `t` (
  `a` int NOT NULL,
  `b` geometry GENERATED ALWAYS AS (`a`) VIRTUAL NOT NULL
) ENGINE=InnoDB DEFAULT CHARSET=utf8mb4 COLLATE=utf8mb4_0900_ai_ci
INSERT IGNORE INTO t (a) VALUES (-2000000000);
SELECT * FROM t;
a	b
DELETE FROM t;
DELETE IGNORE FROM t;
CHECK TABLE t;
Table	Op	Msg_type	Msg_text
test.t	check	status	OK
DROP TABLE t;
# Testing example of type INT UNSIGNED and value 4000000000
SHOW CREATE TABLE t;
Table	Create Table
t	CREATE TABLE `t` (
  `a` int unsigned NOT NULL,
  `b` geometry GENERATED ALWAYS AS (`a`) VIRTUAL NOT NULL
) ENGINE=InnoDB DEFAULT CHARSET=utf8mb4 COLLATE=utf8mb4_0900_ai_ci
INSERT IGNORE INTO t (a) VALUES (4000000000);
SELECT * FROM t;
a	b
DELETE FROM t;
DELETE IGNORE FROM t;
CHECK TABLE t;
Table	Op	Msg_type	Msg_text
test.t	check	status	OK
DROP TABLE t;
# Testing example of type BIGINT and value 2000000000000000000
SHOW CREATE TABLE t;
Table	Create Table
t	CREATE TABLE `t` (
  `a` bigint NOT NULL,
  `b` geometry GENERATED ALWAYS AS (`a`) VIRTUAL NOT NULL
) ENGINE=InnoDB DEFAULT CHARSET=utf8mb4 COLLATE=utf8mb4_0900_ai_ci
INSERT IGNORE INTO t (a) VALUES (2000000000000000000);
SELECT * FROM t;
a	b
DELETE FROM t;
DELETE IGNORE FROM t;
CHECK TABLE t;
Table	Op	Msg_type	Msg_text
test.t	check	status	OK
DROP TABLE t;
# Testing example of type BIGINT and value -2000000000000000000
SHOW CREATE TABLE t;
Table	Create Table
t	CREATE TABLE `t` (
  `a` bigint NOT NULL,
  `b` geometry GENERATED ALWAYS AS (`a`) VIRTUAL NOT NULL
) ENGINE=InnoDB DEFAULT CHARSET=utf8mb4 COLLATE=utf8mb4_0900_ai_ci
INSERT IGNORE INTO t (a) VALUES (-2000000000000000000);
SELECT * FROM t;
a	b
DELETE FROM t;
DELETE IGNORE FROM t;
CHECK TABLE t;
Table	Op	Msg_type	Msg_text
test.t	check	status	OK
DROP TABLE t;
# Testing example of type FLOAT and value -1.23456
SHOW CREATE TABLE t;
Table	Create Table
t	CREATE TABLE `t` (
  `a` float NOT NULL,
  `b` geometry GENERATED ALWAYS AS (`a`) VIRTUAL NOT NULL
) ENGINE=InnoDB DEFAULT CHARSET=utf8mb4 COLLATE=utf8mb4_0900_ai_ci
INSERT IGNORE INTO t (a) VALUES (-1.23456);
SELECT * FROM t;
a	b
DELETE FROM t;
DELETE IGNORE FROM t;
CHECK TABLE t;
Table	Op	Msg_type	Msg_text
test.t	check	status	OK
DROP TABLE t;
# Testing example of type FLOAT and value -1e38
SHOW CREATE TABLE t;
Table	Create Table
t	CREATE TABLE `t` (
  `a` float NOT NULL,
  `b` geometry GENERATED ALWAYS AS (`a`) VIRTUAL NOT NULL
) ENGINE=InnoDB DEFAULT CHARSET=utf8mb4 COLLATE=utf8mb4_0900_ai_ci
INSERT IGNORE INTO t (a) VALUES (-1e38);
SELECT * FROM t;
a	b
DELETE FROM t;
DELETE IGNORE FROM t;
CHECK TABLE t;
Table	Op	Msg_type	Msg_text
test.t	check	status	OK
DROP TABLE t;
# Testing example of type FLOAT and value 1e38
SHOW CREATE TABLE t;
Table	Create Table
t	CREATE TABLE `t` (
  `a` float NOT NULL,
  `b` geometry GENERATED ALWAYS AS (`a`) VIRTUAL NOT NULL
) ENGINE=InnoDB DEFAULT CHARSET=utf8mb4 COLLATE=utf8mb4_0900_ai_ci
INSERT IGNORE INTO t (a) VALUES (1e38);
SELECT * FROM t;
a	b
DELETE FROM t;
DELETE IGNORE FROM t;
CHECK TABLE t;
Table	Op	Msg_type	Msg_text
test.t	check	status	OK
DROP TABLE t;
# Testing example of type DOUBLE and value -1.23456789012345
SHOW CREATE TABLE t;
Table	Create Table
t	CREATE TABLE `t` (
  `a` double NOT NULL,
  `b` geometry GENERATED ALWAYS AS (`a`) VIRTUAL NOT NULL
) ENGINE=InnoDB DEFAULT CHARSET=utf8mb4 COLLATE=utf8mb4_0900_ai_ci
INSERT IGNORE INTO t (a) VALUES (-1.23456789012345);
SELECT * FROM t;
a	b
DELETE FROM t;
DELETE IGNORE FROM t;
CHECK TABLE t;
Table	Op	Msg_type	Msg_text
test.t	check	status	OK
DROP TABLE t;
# Testing example of type DOUBLE and value 1.23456789012345
SHOW CREATE TABLE t;
Table	Create Table
t	CREATE TABLE `t` (
  `a` double NOT NULL,
  `b` geometry GENERATED ALWAYS AS (`a`) VIRTUAL NOT NULL
) ENGINE=InnoDB DEFAULT CHARSET=utf8mb4 COLLATE=utf8mb4_0900_ai_ci
INSERT IGNORE INTO t (a) VALUES (1.23456789012345);
SELECT * FROM t;
a	b
DELETE FROM t;
DELETE IGNORE FROM t;
CHECK TABLE t;
Table	Op	Msg_type	Msg_text
test.t	check	status	OK
DROP TABLE t;
# Testing example of type DOUBLE and value -1e300
SHOW CREATE TABLE t;
Table	Create Table
t	CREATE TABLE `t` (
  `a` double NOT NULL,
  `b` geometry GENERATED ALWAYS AS (`a`) VIRTUAL NOT NULL
) ENGINE=InnoDB DEFAULT CHARSET=utf8mb4 COLLATE=utf8mb4_0900_ai_ci
INSERT IGNORE INTO t (a) VALUES (-1e300);
SELECT * FROM t;
a	b
DELETE FROM t;
DELETE IGNORE FROM t;
CHECK TABLE t;
Table	Op	Msg_type	Msg_text
test.t	check	status	OK
DROP TABLE t;
# Testing example of type DOUBLE and value 1e300
SHOW CREATE TABLE t;
Table	Create Table
t	CREATE TABLE `t` (
  `a` double NOT NULL,
  `b` geometry GENERATED ALWAYS AS (`a`) VIRTUAL NOT NULL
) ENGINE=InnoDB DEFAULT CHARSET=utf8mb4 COLLATE=utf8mb4_0900_ai_ci
INSERT IGNORE INTO t (a) VALUES (1e300);
SELECT * FROM t;
a	b
DELETE FROM t;
DELETE IGNORE FROM t;
CHECK TABLE t;
Table	Op	Msg_type	Msg_text
test.t	check	status	OK
DROP TABLE t;
# Testing example of type DECIMAL(4,2) and value -10.99
SHOW CREATE TABLE t;
Table	Create Table
t	CREATE TABLE `t` (
  `a` decimal(4,2) NOT NULL,
  `b` geometry GENERATED ALWAYS AS (`a`) VIRTUAL NOT NULL
) ENGINE=InnoDB DEFAULT CHARSET=utf8mb4 COLLATE=utf8mb4_0900_ai_ci
INSERT IGNORE INTO t (a) VALUES (-10.99);
SELECT * FROM t;
a	b
DELETE FROM t;
DELETE IGNORE FROM t;
CHECK TABLE t;
Table	Op	Msg_type	Msg_text
test.t	check	status	OK
DROP TABLE t;
# Testing example of type DECIMAL(34,4) and value 20000000000000000000000000000.0001
SHOW CREATE TABLE t;
Table	Create Table
t	CREATE TABLE `t` (
  `a` decimal(34,4) NOT NULL,
  `b` geometry GENERATED ALWAYS AS (`a`) VIRTUAL NOT NULL
) ENGINE=InnoDB DEFAULT CHARSET=utf8mb4 COLLATE=utf8mb4_0900_ai_ci
INSERT IGNORE INTO t (a) VALUES (20000000000000000000000000000.0001);
SELECT * FROM t;
a	b
DELETE FROM t;
DELETE IGNORE FROM t;
CHECK TABLE t;
Table	Op	Msg_type	Msg_text
test.t	check	status	OK
DROP TABLE t;
# Testing example of type DECIMAL(34,4) and value -20000000000000000000000000000.0001
SHOW CREATE TABLE t;
Table	Create Table
t	CREATE TABLE `t` (
  `a` decimal(34,4) NOT NULL,
  `b` geometry GENERATED ALWAYS AS (`a`) VIRTUAL NOT NULL
) ENGINE=InnoDB DEFAULT CHARSET=utf8mb4 COLLATE=utf8mb4_0900_ai_ci
INSERT IGNORE INTO t (a) VALUES (-20000000000000000000000000000.0001);
SELECT * FROM t;
a	b
DELETE FROM t;
DELETE IGNORE FROM t;
CHECK TABLE t;
Table	Op	Msg_type	Msg_text
test.t	check	status	OK
DROP TABLE t;
# Testing example of type BIT(64) and value 0xDEADBEEFC0FEBABE
SHOW CREATE TABLE t;
Table	Create Table
t	CREATE TABLE `t` (
  `a` bit(64) NOT NULL,
  `b` geometry GENERATED ALWAYS AS (`a`) VIRTUAL NOT NULL
) ENGINE=InnoDB DEFAULT CHARSET=utf8mb4 COLLATE=utf8mb4_0900_ai_ci
INSERT IGNORE INTO t (a) VALUES (0xDEADBEEFC0FEBABE);
SELECT * FROM t;
a	b
DELETE FROM t;
DELETE IGNORE FROM t;
CHECK TABLE t;
Table	Op	Msg_type	Msg_text
test.t	check	status	OK
DROP TABLE t;
# Testing example of type BIT(4) and value 0b1000
SHOW CREATE TABLE t;
Table	Create Table
t	CREATE TABLE `t` (
  `a` bit(4) NOT NULL,
  `b` geometry GENERATED ALWAYS AS (`a`) VIRTUAL NOT NULL
) ENGINE=InnoDB DEFAULT CHARSET=utf8mb4 COLLATE=utf8mb4_0900_ai_ci
INSERT IGNORE INTO t (a) VALUES (0b1000);
SELECT * FROM t;
a	b
DELETE FROM t;
DELETE IGNORE FROM t;
CHECK TABLE t;
Table	Op	Msg_type	Msg_text
test.t	check	status	OK
DROP TABLE t;
# Testing example of type YEAR and value 2020
SHOW CREATE TABLE t;
Table	Create Table
t	CREATE TABLE `t` (
  `a` year NOT NULL,
  `b` geometry GENERATED ALWAYS AS (`a`) VIRTUAL NOT NULL
) ENGINE=InnoDB DEFAULT CHARSET=utf8mb4 COLLATE=utf8mb4_0900_ai_ci
INSERT IGNORE INTO t (a) VALUES (2020);
SELECT * FROM t;
a	b
DELETE FROM t;
DELETE IGNORE FROM t;
CHECK TABLE t;
Table	Op	Msg_type	Msg_text
test.t	check	status	OK
DROP TABLE t;
# Testing example of type DATE and value "2030-04-05"
SHOW CREATE TABLE t;
Table	Create Table
t	CREATE TABLE `t` (
  `a` date NOT NULL,
  `b` geometry GENERATED ALWAYS AS (`a`) VIRTUAL NOT NULL
) ENGINE=InnoDB DEFAULT CHARSET=utf8mb4 COLLATE=utf8mb4_0900_ai_ci
INSERT IGNORE INTO t (a) VALUES ("2030-04-05");
SELECT * FROM t;
a	b
DELETE FROM t;
DELETE IGNORE FROM t;
CHECK TABLE t;
Table	Op	Msg_type	Msg_text
test.t	check	status	OK
DROP TABLE t;
# Testing example of type TIME and value "11:12:13"
SHOW CREATE TABLE t;
Table	Create Table
t	CREATE TABLE `t` (
  `a` time NOT NULL,
  `b` geometry GENERATED ALWAYS AS (`a`) VIRTUAL NOT NULL
) ENGINE=InnoDB DEFAULT CHARSET=utf8mb4 COLLATE=utf8mb4_0900_ai_ci
INSERT IGNORE INTO t (a) VALUES ("11:12:13");
SELECT * FROM t;
a	b
DELETE FROM t;
DELETE IGNORE FROM t;
CHECK TABLE t;
Table	Op	Msg_type	Msg_text
test.t	check	status	OK
DROP TABLE t;
# Testing example of type DATETIME and value "2030-04-05 11:12:13"
SHOW CREATE TABLE t;
Table	Create Table
t	CREATE TABLE `t` (
  `a` datetime NOT NULL,
  `b` geometry GENERATED ALWAYS AS (`a`) VIRTUAL NOT NULL
) ENGINE=InnoDB DEFAULT CHARSET=utf8mb4 COLLATE=utf8mb4_0900_ai_ci
INSERT IGNORE INTO t (a) VALUES ("2030-04-05 11:12:13");
SELECT * FROM t;
a	b
DELETE FROM t;
DELETE IGNORE FROM t;
CHECK TABLE t;
Table	Op	Msg_type	Msg_text
test.t	check	status	OK
DROP TABLE t;
# Testing example of type TIMESTAMP and value "2030-04-05 11:12:13"
SHOW CREATE TABLE t;
Table	Create Table
t	CREATE TABLE `t` (
  `a` timestamp NOT NULL,
  `b` geometry GENERATED ALWAYS AS (`a`) VIRTUAL NOT NULL
) ENGINE=InnoDB DEFAULT CHARSET=utf8mb4 COLLATE=utf8mb4_0900_ai_ci
INSERT IGNORE INTO t (a) VALUES ("2030-04-05 11:12:13");
SELECT * FROM t;
a	b
DELETE FROM t;
DELETE IGNORE FROM t;
CHECK TABLE t;
Table	Op	Msg_type	Msg_text
test.t	check	status	OK
DROP TABLE t;
# Testing example of type CHAR(40) and value "2000000000000000000000000000000000000"
SHOW CREATE TABLE t;
Table	Create Table
t	CREATE TABLE `t` (
  `a` char(40) NOT NULL,
  `b` geometry GENERATED ALWAYS AS (`a`) VIRTUAL NOT NULL
) ENGINE=InnoDB DEFAULT CHARSET=utf8mb4 COLLATE=utf8mb4_0900_ai_ci
INSERT IGNORE INTO t (a) VALUES ("2000000000000000000000000000000000000");
SELECT * FROM t;
a	b
DELETE FROM t;
DELETE IGNORE FROM t;
CHECK TABLE t;
Table	Op	Msg_type	Msg_text
test.t	check	status	OK
DROP TABLE t;
# Testing example of type BINARY(45) and value "200000000000000000000000000000000000000000"
SHOW CREATE TABLE t;
Table	Create Table
t	CREATE TABLE `t` (
  `a` binary(45) NOT NULL,
  `b` geometry GENERATED ALWAYS AS (`a`) VIRTUAL NOT NULL
) ENGINE=InnoDB DEFAULT CHARSET=utf8mb4 COLLATE=utf8mb4_0900_ai_ci
INSERT IGNORE INTO t (a) VALUES ("200000000000000000000000000000000000000000");
SELECT * FROM t;
a	b
DELETE FROM t;
DELETE IGNORE FROM t;
CHECK TABLE t;
Table	Op	Msg_type	Msg_text
test.t	check	status	OK
DROP TABLE t;
# Testing example of type VARCHAR(50) and value "2000000000000000000000000000000000000000000000000"
SHOW CREATE TABLE t;
Table	Create Table
t	CREATE TABLE `t` (
  `a` varchar(50) NOT NULL,
  `b` geometry GENERATED ALWAYS AS (`a`) VIRTUAL NOT NULL
) ENGINE=InnoDB DEFAULT CHARSET=utf8mb4 COLLATE=utf8mb4_0900_ai_ci
INSERT IGNORE INTO t (a) VALUES ("2000000000000000000000000000000000000000000000000");
SELECT * FROM t;
a	b
DELETE FROM t;
DELETE IGNORE FROM t;
CHECK TABLE t;
Table	Op	Msg_type	Msg_text
test.t	check	status	OK
DROP TABLE t;
# Testing example of type CHAR(24) and value "hello beautiful world"
SHOW CREATE TABLE t;
Table	Create Table
t	CREATE TABLE `t` (
  `a` char(24) NOT NULL,
  `b` geometry GENERATED ALWAYS AS (`a`) VIRTUAL NOT NULL
) ENGINE=InnoDB DEFAULT CHARSET=utf8mb4 COLLATE=utf8mb4_0900_ai_ci
INSERT IGNORE INTO t (a) VALUES ("hello beautiful world");
SELECT * FROM t;
a	b
DELETE FROM t;
DELETE IGNORE FROM t;
CHECK TABLE t;
Table	Op	Msg_type	Msg_text
test.t	check	status	OK
DROP TABLE t;
# Testing example of type BINARY(12) and value "hello world"
SHOW CREATE TABLE t;
Table	Create Table
t	CREATE TABLE `t` (
  `a` binary(12) NOT NULL,
  `b` geometry GENERATED ALWAYS AS (`a`) VIRTUAL NOT NULL
) ENGINE=InnoDB DEFAULT CHARSET=utf8mb4 COLLATE=utf8mb4_0900_ai_ci
INSERT IGNORE INTO t (a) VALUES ("hello world");
SELECT * FROM t;
a	b
DELETE FROM t;
DELETE IGNORE FROM t;
CHECK TABLE t;
Table	Op	Msg_type	Msg_text
test.t	check	status	OK
DROP TABLE t;
# Testing example of type VARCHAR(6) and value "hello"
SHOW CREATE TABLE t;
Table	Create Table
t	CREATE TABLE `t` (
  `a` varchar(6) NOT NULL,
  `b` geometry GENERATED ALWAYS AS (`a`) VIRTUAL NOT NULL
) ENGINE=InnoDB DEFAULT CHARSET=utf8mb4 COLLATE=utf8mb4_0900_ai_ci
INSERT IGNORE INTO t (a) VALUES ("hello");
SELECT * FROM t;
a	b
DELETE FROM t;
DELETE IGNORE FROM t;
CHECK TABLE t;
Table	Op	Msg_type	Msg_text
test.t	check	status	OK
DROP TABLE t;
# Testing example of type ENUM("up","down") and value "up"
SHOW CREATE TABLE t;
Table	Create Table
t	CREATE TABLE `t` (
  `a` enum('up','down') NOT NULL,
  `b` geometry GENERATED ALWAYS AS (`a`) VIRTUAL NOT NULL
) ENGINE=InnoDB DEFAULT CHARSET=utf8mb4 COLLATE=utf8mb4_0900_ai_ci
INSERT IGNORE INTO t (a) VALUES ("up");
SELECT * FROM t;
a	b
DELETE FROM t;
DELETE IGNORE FROM t;
CHECK TABLE t;
Table	Op	Msg_type	Msg_text
test.t	check	status	OK
DROP TABLE t;
# Testing example of type SET("up","down") and value "up,down"
SHOW CREATE TABLE t;
Table	Create Table
t	CREATE TABLE `t` (
  `a` set('up','down') NOT NULL,
  `b` geometry GENERATED ALWAYS AS (`a`) VIRTUAL NOT NULL
) ENGINE=InnoDB DEFAULT CHARSET=utf8mb4 COLLATE=utf8mb4_0900_ai_ci
INSERT IGNORE INTO t (a) VALUES ("up,down");
SELECT * FROM t;
a	b
DELETE FROM t;
DELETE IGNORE FROM t;
CHECK TABLE t;
Table	Op	Msg_type	Msg_text
test.t	check	status	OK
DROP TABLE t;
# Testing example of type GEOMETRY and value ST_GeomFromText("POINT(1 1)")
SHOW CREATE TABLE t;
Table	Create Table
t	CREATE TABLE `t` (
  `a` geometry NOT NULL,
  `b` geometry GENERATED ALWAYS AS (`a`) VIRTUAL NOT NULL
) ENGINE=InnoDB DEFAULT CHARSET=utf8mb4 COLLATE=utf8mb4_0900_ai_ci
INSERT IGNORE INTO t (a) VALUES (ST_GeomFromText("POINT(1 1)"));
SELECT * FROM t;
a	b
             ð?      ð?	             ð?      ð?
DELETE FROM t;
DELETE IGNORE FROM t;
CHECK TABLE t;
Table	Op	Msg_type	Msg_text
test.t	check	status	OK
DROP TABLE t;
# Testing example of type POINT and value ST_GeomFromText("POINT(1 1)")
SHOW CREATE TABLE t;
Table	Create Table
t	CREATE TABLE `t` (
  `a` point NOT NULL,
  `b` geometry GENERATED ALWAYS AS (`a`) VIRTUAL NOT NULL
) ENGINE=InnoDB DEFAULT CHARSET=utf8mb4 COLLATE=utf8mb4_0900_ai_ci
INSERT IGNORE INTO t (a) VALUES (ST_GeomFromText("POINT(1 1)"));
SELECT * FROM t;
a	b
             ð?      ð?	             ð?      ð?
DELETE FROM t;
DELETE IGNORE FROM t;
CHECK TABLE t;
Table	Op	Msg_type	Msg_text
test.t	check	status	OK
DROP TABLE t;
# Testing example of type LINESTRING and value ST_GeomFromText("LINESTRING(0 0,1 1,2 2)")
SHOW CREATE TABLE t;
Table	Create Table
t	CREATE TABLE `t` (
  `a` linestring NOT NULL,
  `b` geometry GENERATED ALWAYS AS (`a`) VIRTUAL NOT NULL
) ENGINE=InnoDB DEFAULT CHARSET=utf8mb4 COLLATE=utf8mb4_0900_ai_ci
INSERT IGNORE INTO t (a) VALUES (ST_GeomFromText("LINESTRING(0 0,1 1,2 2)"));
SELECT * FROM t;
a	b
                                ð?      ð?       @       @	                                ð?      ð?       @       @
DELETE FROM t;
DELETE IGNORE FROM t;
CHECK TABLE t;
Table	Op	Msg_type	Msg_text
test.t	check	status	OK
DROP TABLE t;
# Testing example of type POLYGON and value ST_GeomFromText("POLYGON((0 0,1 0,1 1,0 1,0 0),(5 5,7 5,7 7,5 7,5 5))")
SHOW CREATE TABLE t;
Table	Create Table
t	CREATE TABLE `t` (
  `a` polygon NOT NULL,
  `b` geometry GENERATED ALWAYS AS (`a`) VIRTUAL NOT NULL
) ENGINE=InnoDB DEFAULT CHARSET=utf8mb4 COLLATE=utf8mb4_0900_ai_ci
INSERT IGNORE INTO t (a) VALUES (ST_GeomFromText("POLYGON((0 0,1 0,1 1,0 1,0 0),(5 5,7 5,7 7,5 7,5 5))"));
SELECT * FROM t;
a	b
                                   ð?              ð?      ð?              ð?                         @      @      @      @      @      @      @      @      @      @	                                   ð?              ð?      ð?              ð?                         @      @      @      @      @      @      @      @      @      @
DELETE FROM t;
DELETE IGNORE FROM t;
CHECK TABLE t;
Table	Op	Msg_type	Msg_text
test.t	check	status	OK
DROP TABLE t;
#
# Testing virtual column of type POINT
#
# Testing example of type JSON and value "{}"
SHOW CREATE TABLE t;
Table	Create Table
t	CREATE TABLE `t` (
  `a` json NOT NULL,
  `b` point GENERATED ALWAYS AS (`a`) VIRTUAL NOT NULL
) ENGINE=InnoDB DEFAULT CHARSET=utf8mb4 COLLATE=utf8mb4_0900_ai_ci
INSERT IGNORE INTO t (a) VALUES ("{}");
SELECT * FROM t;
a	b
DELETE FROM t;
DELETE IGNORE FROM t;
CHECK TABLE t;
Table	Op	Msg_type	Msg_text
test.t	check	status	OK
DROP TABLE t;
# Testing example of type JSON and value '["hello beautiful world"]'
SHOW CREATE TABLE t;
Table	Create Table
t	CREATE TABLE `t` (
  `a` json NOT NULL,
  `b` point GENERATED ALWAYS AS (`a`) VIRTUAL NOT NULL
) ENGINE=InnoDB DEFAULT CHARSET=utf8mb4 COLLATE=utf8mb4_0900_ai_ci
INSERT IGNORE INTO t (a) VALUES ('["hello beautiful world"]');
SELECT * FROM t;
a	b
DELETE FROM t;
DELETE IGNORE FROM t;
CHECK TABLE t;
Table	Op	Msg_type	Msg_text
test.t	check	status	OK
DROP TABLE t;
# Testing example of type JSON and value "-1"
SHOW CREATE TABLE t;
Table	Create Table
t	CREATE TABLE `t` (
  `a` json NOT NULL,
  `b` point GENERATED ALWAYS AS (`a`) VIRTUAL NOT NULL
) ENGINE=InnoDB DEFAULT CHARSET=utf8mb4 COLLATE=utf8mb4_0900_ai_ci
INSERT IGNORE INTO t (a) VALUES ("-1");
SELECT * FROM t;
a	b
DELETE FROM t;
DELETE IGNORE FROM t;
CHECK TABLE t;
Table	Op	Msg_type	Msg_text
test.t	check	status	OK
DROP TABLE t;
# Testing example of type TINYINT and value -1
SHOW CREATE TABLE t;
Table	Create Table
t	CREATE TABLE `t` (
  `a` tinyint NOT NULL,
  `b` point GENERATED ALWAYS AS (`a`) VIRTUAL NOT NULL
) ENGINE=InnoDB DEFAULT CHARSET=utf8mb4 COLLATE=utf8mb4_0900_ai_ci
INSERT IGNORE INTO t (a) VALUES (-1);
SELECT * FROM t;
a	b
DELETE FROM t;
DELETE IGNORE FROM t;
CHECK TABLE t;
Table	Op	Msg_type	Msg_text
test.t	check	status	OK
DROP TABLE t;
# Testing example of type SMALLINT and value -1
SHOW CREATE TABLE t;
Table	Create Table
t	CREATE TABLE `t` (
  `a` smallint NOT NULL,
  `b` point GENERATED ALWAYS AS (`a`) VIRTUAL NOT NULL
) ENGINE=InnoDB DEFAULT CHARSET=utf8mb4 COLLATE=utf8mb4_0900_ai_ci
INSERT IGNORE INTO t (a) VALUES (-1);
SELECT * FROM t;
a	b
DELETE FROM t;
DELETE IGNORE FROM t;
CHECK TABLE t;
Table	Op	Msg_type	Msg_text
test.t	check	status	OK
DROP TABLE t;
# Testing example of type MEDIUMINT and value -1
SHOW CREATE TABLE t;
Table	Create Table
t	CREATE TABLE `t` (
  `a` mediumint NOT NULL,
  `b` point GENERATED ALWAYS AS (`a`) VIRTUAL NOT NULL
) ENGINE=InnoDB DEFAULT CHARSET=utf8mb4 COLLATE=utf8mb4_0900_ai_ci
INSERT IGNORE INTO t (a) VALUES (-1);
SELECT * FROM t;
a	b
DELETE FROM t;
DELETE IGNORE FROM t;
CHECK TABLE t;
Table	Op	Msg_type	Msg_text
test.t	check	status	OK
DROP TABLE t;
# Testing example of type INT and value 2000000000
SHOW CREATE TABLE t;
Table	Create Table
t	CREATE TABLE `t` (
  `a` int NOT NULL,
  `b` point GENERATED ALWAYS AS (`a`) VIRTUAL NOT NULL
) ENGINE=InnoDB DEFAULT CHARSET=utf8mb4 COLLATE=utf8mb4_0900_ai_ci
INSERT IGNORE INTO t (a) VALUES (2000000000);
SELECT * FROM t;
a	b
DELETE FROM t;
DELETE IGNORE FROM t;
CHECK TABLE t;
Table	Op	Msg_type	Msg_text
test.t	check	status	OK
DROP TABLE t;
# Testing example of type INT and value -2000000000
SHOW CREATE TABLE t;
Table	Create Table
t	CREATE TABLE `t` (
  `a` int NOT NULL,
  `b` point GENERATED ALWAYS AS (`a`) VIRTUAL NOT NULL
) ENGINE=InnoDB DEFAULT CHARSET=utf8mb4 COLLATE=utf8mb4_0900_ai_ci
INSERT IGNORE INTO t (a) VALUES (-2000000000);
SELECT * FROM t;
a	b
DELETE FROM t;
DELETE IGNORE FROM t;
CHECK TABLE t;
Table	Op	Msg_type	Msg_text
test.t	check	status	OK
DROP TABLE t;
# Testing example of type INT UNSIGNED and value 4000000000
SHOW CREATE TABLE t;
Table	Create Table
t	CREATE TABLE `t` (
  `a` int unsigned NOT NULL,
  `b` point GENERATED ALWAYS AS (`a`) VIRTUAL NOT NULL
) ENGINE=InnoDB DEFAULT CHARSET=utf8mb4 COLLATE=utf8mb4_0900_ai_ci
INSERT IGNORE INTO t (a) VALUES (4000000000);
SELECT * FROM t;
a	b
DELETE FROM t;
DELETE IGNORE FROM t;
CHECK TABLE t;
Table	Op	Msg_type	Msg_text
test.t	check	status	OK
DROP TABLE t;
# Testing example of type BIGINT and value 2000000000000000000
SHOW CREATE TABLE t;
Table	Create Table
t	CREATE TABLE `t` (
  `a` bigint NOT NULL,
  `b` point GENERATED ALWAYS AS (`a`) VIRTUAL NOT NULL
) ENGINE=InnoDB DEFAULT CHARSET=utf8mb4 COLLATE=utf8mb4_0900_ai_ci
INSERT IGNORE INTO t (a) VALUES (2000000000000000000);
SELECT * FROM t;
a	b
DELETE FROM t;
DELETE IGNORE FROM t;
CHECK TABLE t;
Table	Op	Msg_type	Msg_text
test.t	check	status	OK
DROP TABLE t;
# Testing example of type BIGINT and value -2000000000000000000
SHOW CREATE TABLE t;
Table	Create Table
t	CREATE TABLE `t` (
  `a` bigint NOT NULL,
  `b` point GENERATED ALWAYS AS (`a`) VIRTUAL NOT NULL
) ENGINE=InnoDB DEFAULT CHARSET=utf8mb4 COLLATE=utf8mb4_0900_ai_ci
INSERT IGNORE INTO t (a) VALUES (-2000000000000000000);
SELECT * FROM t;
a	b
DELETE FROM t;
DELETE IGNORE FROM t;
CHECK TABLE t;
Table	Op	Msg_type	Msg_text
test.t	check	status	OK
DROP TABLE t;
# Testing example of type FLOAT and value -1.23456
SHOW CREATE TABLE t;
Table	Create Table
t	CREATE TABLE `t` (
  `a` float NOT NULL,
  `b` point GENERATED ALWAYS AS (`a`) VIRTUAL NOT NULL
) ENGINE=InnoDB DEFAULT CHARSET=utf8mb4 COLLATE=utf8mb4_0900_ai_ci
INSERT IGNORE INTO t (a) VALUES (-1.23456);
SELECT * FROM t;
a	b
DELETE FROM t;
DELETE IGNORE FROM t;
CHECK TABLE t;
Table	Op	Msg_type	Msg_text
test.t	check	status	OK
DROP TABLE t;
# Testing example of type FLOAT and value -1e38
SHOW CREATE TABLE t;
Table	Create Table
t	CREATE TABLE `t` (
  `a` float NOT NULL,
  `b` point GENERATED ALWAYS AS (`a`) VIRTUAL NOT NULL
) ENGINE=InnoDB DEFAULT CHARSET=utf8mb4 COLLATE=utf8mb4_0900_ai_ci
INSERT IGNORE INTO t (a) VALUES (-1e38);
SELECT * FROM t;
a	b
DELETE FROM t;
DELETE IGNORE FROM t;
CHECK TABLE t;
Table	Op	Msg_type	Msg_text
test.t	check	status	OK
DROP TABLE t;
# Testing example of type FLOAT and value 1e38
SHOW CREATE TABLE t;
Table	Create Table
t	CREATE TABLE `t` (
  `a` float NOT NULL,
  `b` point GENERATED ALWAYS AS (`a`) VIRTUAL NOT NULL
) ENGINE=InnoDB DEFAULT CHARSET=utf8mb4 COLLATE=utf8mb4_0900_ai_ci
INSERT IGNORE INTO t (a) VALUES (1e38);
SELECT * FROM t;
a	b
DELETE FROM t;
DELETE IGNORE FROM t;
CHECK TABLE t;
Table	Op	Msg_type	Msg_text
test.t	check	status	OK
DROP TABLE t;
# Testing example of type DOUBLE and value -1.23456789012345
SHOW CREATE TABLE t;
Table	Create Table
t	CREATE TABLE `t` (
  `a` double NOT NULL,
  `b` point GENERATED ALWAYS AS (`a`) VIRTUAL NOT NULL
) ENGINE=InnoDB DEFAULT CHARSET=utf8mb4 COLLATE=utf8mb4_0900_ai_ci
INSERT IGNORE INTO t (a) VALUES (-1.23456789012345);
SELECT * FROM t;
a	b
DELETE FROM t;
DELETE IGNORE FROM t;
CHECK TABLE t;
Table	Op	Msg_type	Msg_text
test.t	check	status	OK
DROP TABLE t;
# Testing example of type DOUBLE and value 1.23456789012345
SHOW CREATE TABLE t;
Table	Create Table
t	CREATE TABLE `t` (
  `a` double NOT NULL,
  `b` point GENERATED ALWAYS AS (`a`) VIRTUAL NOT NULL
) ENGINE=InnoDB DEFAULT CHARSET=utf8mb4 COLLATE=utf8mb4_0900_ai_ci
INSERT IGNORE INTO t (a) VALUES (1.23456789012345);
SELECT * FROM t;
a	b
DELETE FROM t;
DELETE IGNORE FROM t;
CHECK TABLE t;
Table	Op	Msg_type	Msg_text
test.t	check	status	OK
DROP TABLE t;
# Testing example of type DOUBLE and value -1e300
SHOW CREATE TABLE t;
Table	Create Table
t	CREATE TABLE `t` (
  `a` double NOT NULL,
  `b` point GENERATED ALWAYS AS (`a`) VIRTUAL NOT NULL
) ENGINE=InnoDB DEFAULT CHARSET=utf8mb4 COLLATE=utf8mb4_0900_ai_ci
INSERT IGNORE INTO t (a) VALUES (-1e300);
SELECT * FROM t;
a	b
DELETE FROM t;
DELETE IGNORE FROM t;
CHECK TABLE t;
Table	Op	Msg_type	Msg_text
test.t	check	status	OK
DROP TABLE t;
# Testing example of type DOUBLE and value 1e300
SHOW CREATE TABLE t;
Table	Create Table
t	CREATE TABLE `t` (
  `a` double NOT NULL,
  `b` point GENERATED ALWAYS AS (`a`) VIRTUAL NOT NULL
) ENGINE=InnoDB DEFAULT CHARSET=utf8mb4 COLLATE=utf8mb4_0900_ai_ci
INSERT IGNORE INTO t (a) VALUES (1e300);
SELECT * FROM t;
a	b
DELETE FROM t;
DELETE IGNORE FROM t;
CHECK TABLE t;
Table	Op	Msg_type	Msg_text
test.t	check	status	OK
DROP TABLE t;
# Testing example of type DECIMAL(4,2) and value -10.99
SHOW CREATE TABLE t;
Table	Create Table
t	CREATE TABLE `t` (
  `a` decimal(4,2) NOT NULL,
  `b` point GENERATED ALWAYS AS (`a`) VIRTUAL NOT NULL
) ENGINE=InnoDB DEFAULT CHARSET=utf8mb4 COLLATE=utf8mb4_0900_ai_ci
INSERT IGNORE INTO t (a) VALUES (-10.99);
SELECT * FROM t;
a	b
DELETE FROM t;
DELETE IGNORE FROM t;
CHECK TABLE t;
Table	Op	Msg_type	Msg_text
test.t	check	status	OK
DROP TABLE t;
# Testing example of type DECIMAL(34,4) and value 20000000000000000000000000000.0001
SHOW CREATE TABLE t;
Table	Create Table
t	CREATE TABLE `t` (
  `a` decimal(34,4) NOT NULL,
  `b` point GENERATED ALWAYS AS (`a`) VIRTUAL NOT NULL
) ENGINE=InnoDB DEFAULT CHARSET=utf8mb4 COLLATE=utf8mb4_0900_ai_ci
INSERT IGNORE INTO t (a) VALUES (20000000000000000000000000000.0001);
SELECT * FROM t;
a	b
DELETE FROM t;
DELETE IGNORE FROM t;
CHECK TABLE t;
Table	Op	Msg_type	Msg_text
test.t	check	status	OK
DROP TABLE t;
# Testing example of type DECIMAL(34,4) and value -20000000000000000000000000000.0001
SHOW CREATE TABLE t;
Table	Create Table
t	CREATE TABLE `t` (
  `a` decimal(34,4) NOT NULL,
  `b` point GENERATED ALWAYS AS (`a`) VIRTUAL NOT NULL
) ENGINE=InnoDB DEFAULT CHARSET=utf8mb4 COLLATE=utf8mb4_0900_ai_ci
INSERT IGNORE INTO t (a) VALUES (-20000000000000000000000000000.0001);
SELECT * FROM t;
a	b
DELETE FROM t;
DELETE IGNORE FROM t;
CHECK TABLE t;
Table	Op	Msg_type	Msg_text
test.t	check	status	OK
DROP TABLE t;
# Testing example of type BIT(64) and value 0xDEADBEEFC0FEBABE
SHOW CREATE TABLE t;
Table	Create Table
t	CREATE TABLE `t` (
  `a` bit(64) NOT NULL,
  `b` point GENERATED ALWAYS AS (`a`) VIRTUAL NOT NULL
) ENGINE=InnoDB DEFAULT CHARSET=utf8mb4 COLLATE=utf8mb4_0900_ai_ci
INSERT IGNORE INTO t (a) VALUES (0xDEADBEEFC0FEBABE);
SELECT * FROM t;
a	b
DELETE FROM t;
DELETE IGNORE FROM t;
CHECK TABLE t;
Table	Op	Msg_type	Msg_text
test.t	check	status	OK
DROP TABLE t;
# Testing example of type BIT(4) and value 0b1000
SHOW CREATE TABLE t;
Table	Create Table
t	CREATE TABLE `t` (
  `a` bit(4) NOT NULL,
  `b` point GENERATED ALWAYS AS (`a`) VIRTUAL NOT NULL
) ENGINE=InnoDB DEFAULT CHARSET=utf8mb4 COLLATE=utf8mb4_0900_ai_ci
INSERT IGNORE INTO t (a) VALUES (0b1000);
SELECT * FROM t;
a	b
DELETE FROM t;
DELETE IGNORE FROM t;
CHECK TABLE t;
Table	Op	Msg_type	Msg_text
test.t	check	status	OK
DROP TABLE t;
# Testing example of type YEAR and value 2020
SHOW CREATE TABLE t;
Table	Create Table
t	CREATE TABLE `t` (
  `a` year NOT NULL,
  `b` point GENERATED ALWAYS AS (`a`) VIRTUAL NOT NULL
) ENGINE=InnoDB DEFAULT CHARSET=utf8mb4 COLLATE=utf8mb4_0900_ai_ci
INSERT IGNORE INTO t (a) VALUES (2020);
SELECT * FROM t;
a	b
DELETE FROM t;
DELETE IGNORE FROM t;
CHECK TABLE t;
Table	Op	Msg_type	Msg_text
test.t	check	status	OK
DROP TABLE t;
# Testing example of type DATE and value "2030-04-05"
SHOW CREATE TABLE t;
Table	Create Table
t	CREATE TABLE `t` (
  `a` date NOT NULL,
  `b` point GENERATED ALWAYS AS (`a`) VIRTUAL NOT NULL
) ENGINE=InnoDB DEFAULT CHARSET=utf8mb4 COLLATE=utf8mb4_0900_ai_ci
INSERT IGNORE INTO t (a) VALUES ("2030-04-05");
SELECT * FROM t;
a	b
DELETE FROM t;
DELETE IGNORE FROM t;
CHECK TABLE t;
Table	Op	Msg_type	Msg_text
test.t	check	status	OK
DROP TABLE t;
# Testing example of type TIME and value "11:12:13"
SHOW CREATE TABLE t;
Table	Create Table
t	CREATE TABLE `t` (
  `a` time NOT NULL,
  `b` point GENERATED ALWAYS AS (`a`) VIRTUAL NOT NULL
) ENGINE=InnoDB DEFAULT CHARSET=utf8mb4 COLLATE=utf8mb4_0900_ai_ci
INSERT IGNORE INTO t (a) VALUES ("11:12:13");
SELECT * FROM t;
a	b
DELETE FROM t;
DELETE IGNORE FROM t;
CHECK TABLE t;
Table	Op	Msg_type	Msg_text
test.t	check	status	OK
DROP TABLE t;
# Testing example of type DATETIME and value "2030-04-05 11:12:13"
SHOW CREATE TABLE t;
Table	Create Table
t	CREATE TABLE `t` (
  `a` datetime NOT NULL,
  `b` point GENERATED ALWAYS AS (`a`) VIRTUAL NOT NULL
) ENGINE=InnoDB DEFAULT CHARSET=utf8mb4 COLLATE=utf8mb4_0900_ai_ci
INSERT IGNORE INTO t (a) VALUES ("2030-04-05 11:12:13");
SELECT * FROM t;
a	b
DELETE FROM t;
DELETE IGNORE FROM t;
CHECK TABLE t;
Table	Op	Msg_type	Msg_text
test.t	check	status	OK
DROP TABLE t;
# Testing example of type TIMESTAMP and value "2030-04-05 11:12:13"
SHOW CREATE TABLE t;
Table	Create Table
t	CREATE TABLE `t` (
  `a` timestamp NOT NULL,
  `b` point GENERATED ALWAYS AS (`a`) VIRTUAL NOT NULL
) ENGINE=InnoDB DEFAULT CHARSET=utf8mb4 COLLATE=utf8mb4_0900_ai_ci
INSERT IGNORE INTO t (a) VALUES ("2030-04-05 11:12:13");
SELECT * FROM t;
a	b
DELETE FROM t;
DELETE IGNORE FROM t;
CHECK TABLE t;
Table	Op	Msg_type	Msg_text
test.t	check	status	OK
DROP TABLE t;
# Testing example of type CHAR(40) and value "2000000000000000000000000000000000000"
SHOW CREATE TABLE t;
Table	Create Table
t	CREATE TABLE `t` (
  `a` char(40) NOT NULL,
  `b` point GENERATED ALWAYS AS (`a`) VIRTUAL NOT NULL
) ENGINE=InnoDB DEFAULT CHARSET=utf8mb4 COLLATE=utf8mb4_0900_ai_ci
INSERT IGNORE INTO t (a) VALUES ("2000000000000000000000000000000000000");
SELECT * FROM t;
a	b
DELETE FROM t;
DELETE IGNORE FROM t;
CHECK TABLE t;
Table	Op	Msg_type	Msg_text
test.t	check	status	OK
DROP TABLE t;
# Testing example of type BINARY(45) and value "200000000000000000000000000000000000000000"
SHOW CREATE TABLE t;
Table	Create Table
t	CREATE TABLE `t` (
  `a` binary(45) NOT NULL,
  `b` point GENERATED ALWAYS AS (`a`) VIRTUAL NOT NULL
) ENGINE=InnoDB DEFAULT CHARSET=utf8mb4 COLLATE=utf8mb4_0900_ai_ci
INSERT IGNORE INTO t (a) VALUES ("200000000000000000000000000000000000000000");
SELECT * FROM t;
a	b
DELETE FROM t;
DELETE IGNORE FROM t;
CHECK TABLE t;
Table	Op	Msg_type	Msg_text
test.t	check	status	OK
DROP TABLE t;
# Testing example of type VARCHAR(50) and value "2000000000000000000000000000000000000000000000000"
SHOW CREATE TABLE t;
Table	Create Table
t	CREATE TABLE `t` (
  `a` varchar(50) NOT NULL,
  `b` point GENERATED ALWAYS AS (`a`) VIRTUAL NOT NULL
) ENGINE=InnoDB DEFAULT CHARSET=utf8mb4 COLLATE=utf8mb4_0900_ai_ci
INSERT IGNORE INTO t (a) VALUES ("2000000000000000000000000000000000000000000000000");
SELECT * FROM t;
a	b
DELETE FROM t;
DELETE IGNORE FROM t;
CHECK TABLE t;
Table	Op	Msg_type	Msg_text
test.t	check	status	OK
DROP TABLE t;
# Testing example of type CHAR(24) and value "hello beautiful world"
SHOW CREATE TABLE t;
Table	Create Table
t	CREATE TABLE `t` (
  `a` char(24) NOT NULL,
  `b` point GENERATED ALWAYS AS (`a`) VIRTUAL NOT NULL
) ENGINE=InnoDB DEFAULT CHARSET=utf8mb4 COLLATE=utf8mb4_0900_ai_ci
INSERT IGNORE INTO t (a) VALUES ("hello beautiful world");
SELECT * FROM t;
a	b
DELETE FROM t;
DELETE IGNORE FROM t;
CHECK TABLE t;
Table	Op	Msg_type	Msg_text
test.t	check	status	OK
DROP TABLE t;
# Testing example of type BINARY(12) and value "hello world"
SHOW CREATE TABLE t;
Table	Create Table
t	CREATE TABLE `t` (
  `a` binary(12) NOT NULL,
  `b` point GENERATED ALWAYS AS (`a`) VIRTUAL NOT NULL
) ENGINE=InnoDB DEFAULT CHARSET=utf8mb4 COLLATE=utf8mb4_0900_ai_ci
INSERT IGNORE INTO t (a) VALUES ("hello world");
SELECT * FROM t;
a	b
DELETE FROM t;
DELETE IGNORE FROM t;
CHECK TABLE t;
Table	Op	Msg_type	Msg_text
test.t	check	status	OK
DROP TABLE t;
# Testing example of type VARCHAR(6) and value "hello"
SHOW CREATE TABLE t;
Table	Create Table
t	CREATE TABLE `t` (
  `a` varchar(6) NOT NULL,
  `b` point GENERATED ALWAYS AS (`a`) VIRTUAL NOT NULL
) ENGINE=InnoDB DEFAULT CHARSET=utf8mb4 COLLATE=utf8mb4_0900_ai_ci
INSERT IGNORE INTO t (a) VALUES ("hello");
SELECT * FROM t;
a	b
DELETE FROM t;
DELETE IGNORE FROM t;
CHECK TABLE t;
Table	Op	Msg_type	Msg_text
test.t	check	status	OK
DROP TABLE t;
# Testing example of type ENUM("up","down") and value "up"
SHOW CREATE TABLE t;
Table	Create Table
t	CREATE TABLE `t` (
  `a` enum('up','down') NOT NULL,
  `b` point GENERATED ALWAYS AS (`a`) VIRTUAL NOT NULL
) ENGINE=InnoDB DEFAULT CHARSET=utf8mb4 COLLATE=utf8mb4_0900_ai_ci
INSERT IGNORE INTO t (a) VALUES ("up");
SELECT * FROM t;
a	b
DELETE FROM t;
DELETE IGNORE FROM t;
CHECK TABLE t;
Table	Op	Msg_type	Msg_text
test.t	check	status	OK
DROP TABLE t;
# Testing example of type SET("up","down") and value "up,down"
SHOW CREATE TABLE t;
Table	Create Table
t	CREATE TABLE `t` (
  `a` set('up','down') NOT NULL,
  `b` point GENERATED ALWAYS AS (`a`) VIRTUAL NOT NULL
) ENGINE=InnoDB DEFAULT CHARSET=utf8mb4 COLLATE=utf8mb4_0900_ai_ci
INSERT IGNORE INTO t (a) VALUES ("up,down");
SELECT * FROM t;
a	b
DELETE FROM t;
DELETE IGNORE FROM t;
CHECK TABLE t;
Table	Op	Msg_type	Msg_text
test.t	check	status	OK
DROP TABLE t;
# Testing example of type GEOMETRY and value ST_GeomFromText("POINT(1 1)")
SHOW CREATE TABLE t;
Table	Create Table
t	CREATE TABLE `t` (
  `a` geometry NOT NULL,
  `b` point GENERATED ALWAYS AS (`a`) VIRTUAL NOT NULL
) ENGINE=InnoDB DEFAULT CHARSET=utf8mb4 COLLATE=utf8mb4_0900_ai_ci
INSERT IGNORE INTO t (a) VALUES (ST_GeomFromText("POINT(1 1)"));
SELECT * FROM t;
a	b
             ð?      ð?	             ð?      ð?
DELETE FROM t;
DELETE IGNORE FROM t;
CHECK TABLE t;
Table	Op	Msg_type	Msg_text
test.t	check	status	OK
DROP TABLE t;
# Testing example of type POINT and value ST_GeomFromText("POINT(1 1)")
SHOW CREATE TABLE t;
Table	Create Table
t	CREATE TABLE `t` (
  `a` point NOT NULL,
  `b` point GENERATED ALWAYS AS (`a`) VIRTUAL NOT NULL
) ENGINE=InnoDB DEFAULT CHARSET=utf8mb4 COLLATE=utf8mb4_0900_ai_ci
INSERT IGNORE INTO t (a) VALUES (ST_GeomFromText("POINT(1 1)"));
SELECT * FROM t;
a	b
             ð?      ð?	             ð?      ð?
DELETE FROM t;
DELETE IGNORE FROM t;
CHECK TABLE t;
Table	Op	Msg_type	Msg_text
test.t	check	status	OK
DROP TABLE t;
# Testing example of type LINESTRING and value ST_GeomFromText("LINESTRING(0 0,1 1,2 2)")
SHOW CREATE TABLE t;
Table	Create Table
t	CREATE TABLE `t` (
  `a` linestring NOT NULL,
  `b` point GENERATED ALWAYS AS (`a`) VIRTUAL NOT NULL
) ENGINE=InnoDB DEFAULT CHARSET=utf8mb4 COLLATE=utf8mb4_0900_ai_ci
INSERT IGNORE INTO t (a) VALUES (ST_GeomFromText("LINESTRING(0 0,1 1,2 2)"));
SELECT * FROM t;
a	b
DELETE FROM t;
DELETE IGNORE FROM t;
CHECK TABLE t;
Table	Op	Msg_type	Msg_text
test.t	check	status	OK
DROP TABLE t;
# Testing example of type POLYGON and value ST_GeomFromText("POLYGON((0 0,1 0,1 1,0 1,0 0),(5 5,7 5,7 7,5 7,5 5))")
SHOW CREATE TABLE t;
Table	Create Table
t	CREATE TABLE `t` (
  `a` polygon NOT NULL,
  `b` point GENERATED ALWAYS AS (`a`) VIRTUAL NOT NULL
) ENGINE=InnoDB DEFAULT CHARSET=utf8mb4 COLLATE=utf8mb4_0900_ai_ci
INSERT IGNORE INTO t (a) VALUES (ST_GeomFromText("POLYGON((0 0,1 0,1 1,0 1,0 0),(5 5,7 5,7 7,5 7,5 5))"));
SELECT * FROM t;
a	b
DELETE FROM t;
DELETE IGNORE FROM t;
CHECK TABLE t;
Table	Op	Msg_type	Msg_text
test.t	check	status	OK
DROP TABLE t;
#
# Testing virtual column of type LINESTRING
#
# Testing example of type JSON and value "{}"
SHOW CREATE TABLE t;
Table	Create Table
t	CREATE TABLE `t` (
  `a` json NOT NULL,
  `b` linestring GENERATED ALWAYS AS (`a`) VIRTUAL NOT NULL
) ENGINE=InnoDB DEFAULT CHARSET=utf8mb4 COLLATE=utf8mb4_0900_ai_ci
INSERT IGNORE INTO t (a) VALUES ("{}");
SELECT * FROM t;
a	b
DELETE FROM t;
DELETE IGNORE FROM t;
CHECK TABLE t;
Table	Op	Msg_type	Msg_text
test.t	check	status	OK
DROP TABLE t;
# Testing example of type JSON and value '["hello beautiful world"]'
SHOW CREATE TABLE t;
Table	Create Table
t	CREATE TABLE `t` (
  `a` json NOT NULL,
  `b` linestring GENERATED ALWAYS AS (`a`) VIRTUAL NOT NULL
) ENGINE=InnoDB DEFAULT CHARSET=utf8mb4 COLLATE=utf8mb4_0900_ai_ci
INSERT IGNORE INTO t (a) VALUES ('["hello beautiful world"]');
SELECT * FROM t;
a	b
DELETE FROM t;
DELETE IGNORE FROM t;
CHECK TABLE t;
Table	Op	Msg_type	Msg_text
test.t	check	status	OK
DROP TABLE t;
# Testing example of type JSON and value "-1"
SHOW CREATE TABLE t;
Table	Create Table
t	CREATE TABLE `t` (
  `a` json NOT NULL,
  `b` linestring GENERATED ALWAYS AS (`a`) VIRTUAL NOT NULL
) ENGINE=InnoDB DEFAULT CHARSET=utf8mb4 COLLATE=utf8mb4_0900_ai_ci
INSERT IGNORE INTO t (a) VALUES ("-1");
SELECT * FROM t;
a	b
DELETE FROM t;
DELETE IGNORE FROM t;
CHECK TABLE t;
Table	Op	Msg_type	Msg_text
test.t	check	status	OK
DROP TABLE t;
# Testing example of type TINYINT and value -1
SHOW CREATE TABLE t;
Table	Create Table
t	CREATE TABLE `t` (
  `a` tinyint NOT NULL,
  `b` linestring GENERATED ALWAYS AS (`a`) VIRTUAL NOT NULL
) ENGINE=InnoDB DEFAULT CHARSET=utf8mb4 COLLATE=utf8mb4_0900_ai_ci
INSERT IGNORE INTO t (a) VALUES (-1);
SELECT * FROM t;
a	b
DELETE FROM t;
DELETE IGNORE FROM t;
CHECK TABLE t;
Table	Op	Msg_type	Msg_text
test.t	check	status	OK
DROP TABLE t;
# Testing example of type SMALLINT and value -1
SHOW CREATE TABLE t;
Table	Create Table
t	CREATE TABLE `t` (
  `a` smallint NOT NULL,
  `b` linestring GENERATED ALWAYS AS (`a`) VIRTUAL NOT NULL
) ENGINE=InnoDB DEFAULT CHARSET=utf8mb4 COLLATE=utf8mb4_0900_ai_ci
INSERT IGNORE INTO t (a) VALUES (-1);
SELECT * FROM t;
a	b
DELETE FROM t;
DELETE IGNORE FROM t;
CHECK TABLE t;
Table	Op	Msg_type	Msg_text
test.t	check	status	OK
DROP TABLE t;
# Testing example of type MEDIUMINT and value -1
SHOW CREATE TABLE t;
Table	Create Table
t	CREATE TABLE `t` (
  `a` mediumint NOT NULL,
  `b` linestring GENERATED ALWAYS AS (`a`) VIRTUAL NOT NULL
) ENGINE=InnoDB DEFAULT CHARSET=utf8mb4 COLLATE=utf8mb4_0900_ai_ci
INSERT IGNORE INTO t (a) VALUES (-1);
SELECT * FROM t;
a	b
DELETE FROM t;
DELETE IGNORE FROM t;
CHECK TABLE t;
Table	Op	Msg_type	Msg_text
test.t	check	status	OK
DROP TABLE t;
# Testing example of type INT and value 2000000000
SHOW CREATE TABLE t;
Table	Create Table
t	CREATE TABLE `t` (
  `a` int NOT NULL,
  `b` linestring GENERATED ALWAYS AS (`a`) VIRTUAL NOT NULL
) ENGINE=InnoDB DEFAULT CHARSET=utf8mb4 COLLATE=utf8mb4_0900_ai_ci
INSERT IGNORE INTO t (a) VALUES (2000000000);
SELECT * FROM t;
a	b
DELETE FROM t;
DELETE IGNORE FROM t;
CHECK TABLE t;
Table	Op	Msg_type	Msg_text
test.t	check	status	OK
DROP TABLE t;
# Testing example of type INT and value -2000000000
SHOW CREATE TABLE t;
Table	Create Table
t	CREATE TABLE `t` (
  `a` int NOT NULL,
  `b` linestring GENERATED ALWAYS AS (`a`) VIRTUAL NOT NULL
) ENGINE=InnoDB DEFAULT CHARSET=utf8mb4 COLLATE=utf8mb4_0900_ai_ci
INSERT IGNORE INTO t (a) VALUES (-2000000000);
SELECT * FROM t;
a	b
DELETE FROM t;
DELETE IGNORE FROM t;
CHECK TABLE t;
Table	Op	Msg_type	Msg_text
test.t	check	status	OK
DROP TABLE t;
# Testing example of type INT UNSIGNED and value 4000000000
SHOW CREATE TABLE t;
Table	Create Table
t	CREATE TABLE `t` (
  `a` int unsigned NOT NULL,
  `b` linestring GENERATED ALWAYS AS (`a`) VIRTUAL NOT NULL
) ENGINE=InnoDB DEFAULT CHARSET=utf8mb4 COLLATE=utf8mb4_0900_ai_ci
INSERT IGNORE INTO t (a) VALUES (4000000000);
SELECT * FROM t;
a	b
DELETE FROM t;
DELETE IGNORE FROM t;
CHECK TABLE t;
Table	Op	Msg_type	Msg_text
test.t	check	status	OK
DROP TABLE t;
# Testing example of type BIGINT and value 2000000000000000000
SHOW CREATE TABLE t;
Table	Create Table
t	CREATE TABLE `t` (
  `a` bigint NOT NULL,
  `b` linestring GENERATED ALWAYS AS (`a`) VIRTUAL NOT NULL
) ENGINE=InnoDB DEFAULT CHARSET=utf8mb4 COLLATE=utf8mb4_0900_ai_ci
INSERT IGNORE INTO t (a) VALUES (2000000000000000000);
SELECT * FROM t;
a	b
DELETE FROM t;
DELETE IGNORE FROM t;
CHECK TABLE t;
Table	Op	Msg_type	Msg_text
test.t	check	status	OK
DROP TABLE t;
# Testing example of type BIGINT and value -2000000000000000000
SHOW CREATE TABLE t;
Table	Create Table
t	CREATE TABLE `t` (
  `a` bigint NOT NULL,
  `b` linestring GENERATED ALWAYS AS (`a`) VIRTUAL NOT NULL
) ENGINE=InnoDB DEFAULT CHARSET=utf8mb4 COLLATE=utf8mb4_0900_ai_ci
INSERT IGNORE INTO t (a) VALUES (-2000000000000000000);
SELECT * FROM t;
a	b
DELETE FROM t;
DELETE IGNORE FROM t;
CHECK TABLE t;
Table	Op	Msg_type	Msg_text
test.t	check	status	OK
DROP TABLE t;
# Testing example of type FLOAT and value -1.23456
SHOW CREATE TABLE t;
Table	Create Table
t	CREATE TABLE `t` (
  `a` float NOT NULL,
  `b` linestring GENERATED ALWAYS AS (`a`) VIRTUAL NOT NULL
) ENGINE=InnoDB DEFAULT CHARSET=utf8mb4 COLLATE=utf8mb4_0900_ai_ci
INSERT IGNORE INTO t (a) VALUES (-1.23456);
SELECT * FROM t;
a	b
DELETE FROM t;
DELETE IGNORE FROM t;
CHECK TABLE t;
Table	Op	Msg_type	Msg_text
test.t	check	status	OK
DROP TABLE t;
# Testing example of type FLOAT and value -1e38
SHOW CREATE TABLE t;
Table	Create Table
t	CREATE TABLE `t` (
  `a` float NOT NULL,
  `b` linestring GENERATED ALWAYS AS (`a`) VIRTUAL NOT NULL
) ENGINE=InnoDB DEFAULT CHARSET=utf8mb4 COLLATE=utf8mb4_0900_ai_ci
INSERT IGNORE INTO t (a) VALUES (-1e38);
SELECT * FROM t;
a	b
DELETE FROM t;
DELETE IGNORE FROM t;
CHECK TABLE t;
Table	Op	Msg_type	Msg_text
test.t	check	status	OK
DROP TABLE t;
# Testing example of type FLOAT and value 1e38
SHOW CREATE TABLE t;
Table	Create Table
t	CREATE TABLE `t` (
  `a` float NOT NULL,
  `b` linestring GENERATED ALWAYS AS (`a`) VIRTUAL NOT NULL
) ENGINE=InnoDB DEFAULT CHARSET=utf8mb4 COLLATE=utf8mb4_0900_ai_ci
INSERT IGNORE INTO t (a) VALUES (1e38);
SELECT * FROM t;
a	b
DELETE FROM t;
DELETE IGNORE FROM t;
CHECK TABLE t;
Table	Op	Msg_type	Msg_text
test.t	check	status	OK
DROP TABLE t;
# Testing example of type DOUBLE and value -1.23456789012345
SHOW CREATE TABLE t;
Table	Create Table
t	CREATE TABLE `t` (
  `a` double NOT NULL,
  `b` linestring GENERATED ALWAYS AS (`a`) VIRTUAL NOT NULL
) ENGINE=InnoDB DEFAULT CHARSET=utf8mb4 COLLATE=utf8mb4_0900_ai_ci
INSERT IGNORE INTO t (a) VALUES (-1.23456789012345);
SELECT * FROM t;
a	b
DELETE FROM t;
DELETE IGNORE FROM t;
CHECK TABLE t;
Table	Op	Msg_type	Msg_text
test.t	check	status	OK
DROP TABLE t;
# Testing example of type DOUBLE and value 1.23456789012345
SHOW CREATE TABLE t;
Table	Create Table
t	CREATE TABLE `t` (
  `a` double NOT NULL,
  `b` linestring GENERATED ALWAYS AS (`a`) VIRTUAL NOT NULL
) ENGINE=InnoDB DEFAULT CHARSET=utf8mb4 COLLATE=utf8mb4_0900_ai_ci
INSERT IGNORE INTO t (a) VALUES (1.23456789012345);
SELECT * FROM t;
a	b
DELETE FROM t;
DELETE IGNORE FROM t;
CHECK TABLE t;
Table	Op	Msg_type	Msg_text
test.t	check	status	OK
DROP TABLE t;
# Testing example of type DOUBLE and value -1e300
SHOW CREATE TABLE t;
Table	Create Table
t	CREATE TABLE `t` (
  `a` double NOT NULL,
  `b` linestring GENERATED ALWAYS AS (`a`) VIRTUAL NOT NULL
) ENGINE=InnoDB DEFAULT CHARSET=utf8mb4 COLLATE=utf8mb4_0900_ai_ci
INSERT IGNORE INTO t (a) VALUES (-1e300);
SELECT * FROM t;
a	b
DELETE FROM t;
DELETE IGNORE FROM t;
CHECK TABLE t;
Table	Op	Msg_type	Msg_text
test.t	check	status	OK
DROP TABLE t;
# Testing example of type DOUBLE and value 1e300
SHOW CREATE TABLE t;
Table	Create Table
t	CREATE TABLE `t` (
  `a` double NOT NULL,
  `b` linestring GENERATED ALWAYS AS (`a`) VIRTUAL NOT NULL
) ENGINE=InnoDB DEFAULT CHARSET=utf8mb4 COLLATE=utf8mb4_0900_ai_ci
INSERT IGNORE INTO t (a) VALUES (1e300);
SELECT * FROM t;
a	b
DELETE FROM t;
DELETE IGNORE FROM t;
CHECK TABLE t;
Table	Op	Msg_type	Msg_text
test.t	check	status	OK
DROP TABLE t;
# Testing example of type DECIMAL(4,2) and value -10.99
SHOW CREATE TABLE t;
Table	Create Table
t	CREATE TABLE `t` (
  `a` decimal(4,2) NOT NULL,
  `b` linestring GENERATED ALWAYS AS (`a`) VIRTUAL NOT NULL
) ENGINE=InnoDB DEFAULT CHARSET=utf8mb4 COLLATE=utf8mb4_0900_ai_ci
INSERT IGNORE INTO t (a) VALUES (-10.99);
SELECT * FROM t;
a	b
DELETE FROM t;
DELETE IGNORE FROM t;
CHECK TABLE t;
Table	Op	Msg_type	Msg_text
test.t	check	status	OK
DROP TABLE t;
# Testing example of type DECIMAL(34,4) and value 20000000000000000000000000000.0001
SHOW CREATE TABLE t;
Table	Create Table
t	CREATE TABLE `t` (
  `a` decimal(34,4) NOT NULL,
  `b` linestring GENERATED ALWAYS AS (`a`) VIRTUAL NOT NULL
) ENGINE=InnoDB DEFAULT CHARSET=utf8mb4 COLLATE=utf8mb4_0900_ai_ci
INSERT IGNORE INTO t (a) VALUES (20000000000000000000000000000.0001);
SELECT * FROM t;
a	b
DELETE FROM t;
DELETE IGNORE FROM t;
CHECK TABLE t;
Table	Op	Msg_type	Msg_text
test.t	check	status	OK
DROP TABLE t;
# Testing example of type DECIMAL(34,4) and value -20000000000000000000000000000.0001
SHOW CREATE TABLE t;
Table	Create Table
t	CREATE TABLE `t` (
  `a` decimal(34,4) NOT NULL,
  `b` linestring GENERATED ALWAYS AS (`a`) VIRTUAL NOT NULL
) ENGINE=InnoDB DEFAULT CHARSET=utf8mb4 COLLATE=utf8mb4_0900_ai_ci
INSERT IGNORE INTO t (a) VALUES (-20000000000000000000000000000.0001);
SELECT * FROM t;
a	b
DELETE FROM t;
DELETE IGNORE FROM t;
CHECK TABLE t;
Table	Op	Msg_type	Msg_text
test.t	check	status	OK
DROP TABLE t;
# Testing example of type BIT(64) and value 0xDEADBEEFC0FEBABE
SHOW CREATE TABLE t;
Table	Create Table
t	CREATE TABLE `t` (
  `a` bit(64) NOT NULL,
  `b` linestring GENERATED ALWAYS AS (`a`) VIRTUAL NOT NULL
) ENGINE=InnoDB DEFAULT CHARSET=utf8mb4 COLLATE=utf8mb4_0900_ai_ci
INSERT IGNORE INTO t (a) VALUES (0xDEADBEEFC0FEBABE);
SELECT * FROM t;
a	b
DELETE FROM t;
DELETE IGNORE FROM t;
CHECK TABLE t;
Table	Op	Msg_type	Msg_text
test.t	check	status	OK
DROP TABLE t;
# Testing example of type BIT(4) and value 0b1000
SHOW CREATE TABLE t;
Table	Create Table
t	CREATE TABLE `t` (
  `a` bit(4) NOT NULL,
  `b` linestring GENERATED ALWAYS AS (`a`) VIRTUAL NOT NULL
) ENGINE=InnoDB DEFAULT CHARSET=utf8mb4 COLLATE=utf8mb4_0900_ai_ci
INSERT IGNORE INTO t (a) VALUES (0b1000);
SELECT * FROM t;
a	b
DELETE FROM t;
DELETE IGNORE FROM t;
CHECK TABLE t;
Table	Op	Msg_type	Msg_text
test.t	check	status	OK
DROP TABLE t;
# Testing example of type YEAR and value 2020
SHOW CREATE TABLE t;
Table	Create Table
t	CREATE TABLE `t` (
  `a` year NOT NULL,
  `b` linestring GENERATED ALWAYS AS (`a`) VIRTUAL NOT NULL
) ENGINE=InnoDB DEFAULT CHARSET=utf8mb4 COLLATE=utf8mb4_0900_ai_ci
INSERT IGNORE INTO t (a) VALUES (2020);
SELECT * FROM t;
a	b
DELETE FROM t;
DELETE IGNORE FROM t;
CHECK TABLE t;
Table	Op	Msg_type	Msg_text
test.t	check	status	OK
DROP TABLE t;
# Testing example of type DATE and value "2030-04-05"
SHOW CREATE TABLE t;
Table	Create Table
t	CREATE TABLE `t` (
  `a` date NOT NULL,
  `b` linestring GENERATED ALWAYS AS (`a`) VIRTUAL NOT NULL
) ENGINE=InnoDB DEFAULT CHARSET=utf8mb4 COLLATE=utf8mb4_0900_ai_ci
INSERT IGNORE INTO t (a) VALUES ("2030-04-05");
SELECT * FROM t;
a	b
DELETE FROM t;
DELETE IGNORE FROM t;
CHECK TABLE t;
Table	Op	Msg_type	Msg_text
test.t	check	status	OK
DROP TABLE t;
# Testing example of type TIME and value "11:12:13"
SHOW CREATE TABLE t;
Table	Create Table
t	CREATE TABLE `t` (
  `a` time NOT NULL,
  `b` linestring GENERATED ALWAYS AS (`a`) VIRTUAL NOT NULL
) ENGINE=InnoDB DEFAULT CHARSET=utf8mb4 COLLATE=utf8mb4_0900_ai_ci
INSERT IGNORE INTO t (a) VALUES ("11:12:13");
SELECT * FROM t;
a	b
DELETE FROM t;
DELETE IGNORE FROM t;
CHECK TABLE t;
Table	Op	Msg_type	Msg_text
test.t	check	status	OK
DROP TABLE t;
# Testing example of type DATETIME and value "2030-04-05 11:12:13"
SHOW CREATE TABLE t;
Table	Create Table
t	CREATE TABLE `t` (
  `a` datetime NOT NULL,
  `b` linestring GENERATED ALWAYS AS (`a`) VIRTUAL NOT NULL
) ENGINE=InnoDB DEFAULT CHARSET=utf8mb4 COLLATE=utf8mb4_0900_ai_ci
INSERT IGNORE INTO t (a) VALUES ("2030-04-05 11:12:13");
SELECT * FROM t;
a	b
DELETE FROM t;
DELETE IGNORE FROM t;
CHECK TABLE t;
Table	Op	Msg_type	Msg_text
test.t	check	status	OK
DROP TABLE t;
# Testing example of type TIMESTAMP and value "2030-04-05 11:12:13"
SHOW CREATE TABLE t;
Table	Create Table
t	CREATE TABLE `t` (
  `a` timestamp NOT NULL,
  `b` linestring GENERATED ALWAYS AS (`a`) VIRTUAL NOT NULL
) ENGINE=InnoDB DEFAULT CHARSET=utf8mb4 COLLATE=utf8mb4_0900_ai_ci
INSERT IGNORE INTO t (a) VALUES ("2030-04-05 11:12:13");
SELECT * FROM t;
a	b
DELETE FROM t;
DELETE IGNORE FROM t;
CHECK TABLE t;
Table	Op	Msg_type	Msg_text
test.t	check	status	OK
DROP TABLE t;
# Testing example of type CHAR(40) and value "2000000000000000000000000000000000000"
SHOW CREATE TABLE t;
Table	Create Table
t	CREATE TABLE `t` (
  `a` char(40) NOT NULL,
  `b` linestring GENERATED ALWAYS AS (`a`) VIRTUAL NOT NULL
) ENGINE=InnoDB DEFAULT CHARSET=utf8mb4 COLLATE=utf8mb4_0900_ai_ci
INSERT IGNORE INTO t (a) VALUES ("2000000000000000000000000000000000000");
SELECT * FROM t;
a	b
DELETE FROM t;
DELETE IGNORE FROM t;
CHECK TABLE t;
Table	Op	Msg_type	Msg_text
test.t	check	status	OK
DROP TABLE t;
# Testing example of type BINARY(45) and value "200000000000000000000000000000000000000000"
SHOW CREATE TABLE t;
Table	Create Table
t	CREATE TABLE `t` (
  `a` binary(45) NOT NULL,
  `b` linestring GENERATED ALWAYS AS (`a`) VIRTUAL NOT NULL
) ENGINE=InnoDB DEFAULT CHARSET=utf8mb4 COLLATE=utf8mb4_0900_ai_ci
INSERT IGNORE INTO t (a) VALUES ("200000000000000000000000000000000000000000");
SELECT * FROM t;
a	b
DELETE FROM t;
DELETE IGNORE FROM t;
CHECK TABLE t;
Table	Op	Msg_type	Msg_text
test.t	check	status	OK
DROP TABLE t;
# Testing example of type VARCHAR(50) and value "2000000000000000000000000000000000000000000000000"
SHOW CREATE TABLE t;
Table	Create Table
t	CREATE TABLE `t` (
  `a` varchar(50) NOT NULL,
  `b` linestring GENERATED ALWAYS AS (`a`) VIRTUAL NOT NULL
) ENGINE=InnoDB DEFAULT CHARSET=utf8mb4 COLLATE=utf8mb4_0900_ai_ci
INSERT IGNORE INTO t (a) VALUES ("2000000000000000000000000000000000000000000000000");
SELECT * FROM t;
a	b
DELETE FROM t;
DELETE IGNORE FROM t;
CHECK TABLE t;
Table	Op	Msg_type	Msg_text
test.t	check	status	OK
DROP TABLE t;
# Testing example of type CHAR(24) and value "hello beautiful world"
SHOW CREATE TABLE t;
Table	Create Table
t	CREATE TABLE `t` (
  `a` char(24) NOT NULL,
  `b` linestring GENERATED ALWAYS AS (`a`) VIRTUAL NOT NULL
) ENGINE=InnoDB DEFAULT CHARSET=utf8mb4 COLLATE=utf8mb4_0900_ai_ci
INSERT IGNORE INTO t (a) VALUES ("hello beautiful world");
SELECT * FROM t;
a	b
DELETE FROM t;
DELETE IGNORE FROM t;
CHECK TABLE t;
Table	Op	Msg_type	Msg_text
test.t	check	status	OK
DROP TABLE t;
# Testing example of type BINARY(12) and value "hello world"
SHOW CREATE TABLE t;
Table	Create Table
t	CREATE TABLE `t` (
  `a` binary(12) NOT NULL,
  `b` linestring GENERATED ALWAYS AS (`a`) VIRTUAL NOT NULL
) ENGINE=InnoDB DEFAULT CHARSET=utf8mb4 COLLATE=utf8mb4_0900_ai_ci
INSERT IGNORE INTO t (a) VALUES ("hello world");
SELECT * FROM t;
a	b
DELETE FROM t;
DELETE IGNORE FROM t;
CHECK TABLE t;
Table	Op	Msg_type	Msg_text
test.t	check	status	OK
DROP TABLE t;
# Testing example of type VARCHAR(6) and value "hello"
SHOW CREATE TABLE t;
Table	Create Table
t	CREATE TABLE `t` (
  `a` varchar(6) NOT NULL,
  `b` linestring GENERATED ALWAYS AS (`a`) VIRTUAL NOT NULL
) ENGINE=InnoDB DEFAULT CHARSET=utf8mb4 COLLATE=utf8mb4_0900_ai_ci
INSERT IGNORE INTO t (a) VALUES ("hello");
SELECT * FROM t;
a	b
DELETE FROM t;
DELETE IGNORE FROM t;
CHECK TABLE t;
Table	Op	Msg_type	Msg_text
test.t	check	status	OK
DROP TABLE t;
# Testing example of type ENUM("up","down") and value "up"
SHOW CREATE TABLE t;
Table	Create Table
t	CREATE TABLE `t` (
  `a` enum('up','down') NOT NULL,
  `b` linestring GENERATED ALWAYS AS (`a`) VIRTUAL NOT NULL
) ENGINE=InnoDB DEFAULT CHARSET=utf8mb4 COLLATE=utf8mb4_0900_ai_ci
INSERT IGNORE INTO t (a) VALUES ("up");
SELECT * FROM t;
a	b
DELETE FROM t;
DELETE IGNORE FROM t;
CHECK TABLE t;
Table	Op	Msg_type	Msg_text
test.t	check	status	OK
DROP TABLE t;
# Testing example of type SET("up","down") and value "up,down"
SHOW CREATE TABLE t;
Table	Create Table
t	CREATE TABLE `t` (
  `a` set('up','down') NOT NULL,
  `b` linestring GENERATED ALWAYS AS (`a`) VIRTUAL NOT NULL
) ENGINE=InnoDB DEFAULT CHARSET=utf8mb4 COLLATE=utf8mb4_0900_ai_ci
INSERT IGNORE INTO t (a) VALUES ("up,down");
SELECT * FROM t;
a	b
DELETE FROM t;
DELETE IGNORE FROM t;
CHECK TABLE t;
Table	Op	Msg_type	Msg_text
test.t	check	status	OK
DROP TABLE t;
# Testing example of type GEOMETRY and value ST_GeomFromText("POINT(1 1)")
SHOW CREATE TABLE t;
Table	Create Table
t	CREATE TABLE `t` (
  `a` geometry NOT NULL,
  `b` linestring GENERATED ALWAYS AS (`a`) VIRTUAL NOT NULL
) ENGINE=InnoDB DEFAULT CHARSET=utf8mb4 COLLATE=utf8mb4_0900_ai_ci
INSERT IGNORE INTO t (a) VALUES (ST_GeomFromText("POINT(1 1)"));
SELECT * FROM t;
a	b
DELETE FROM t;
DELETE IGNORE FROM t;
CHECK TABLE t;
Table	Op	Msg_type	Msg_text
test.t	check	status	OK
DROP TABLE t;
# Testing example of type POINT and value ST_GeomFromText("POINT(1 1)")
SHOW CREATE TABLE t;
Table	Create Table
t	CREATE TABLE `t` (
  `a` point NOT NULL,
  `b` linestring GENERATED ALWAYS AS (`a`) VIRTUAL NOT NULL
) ENGINE=InnoDB DEFAULT CHARSET=utf8mb4 COLLATE=utf8mb4_0900_ai_ci
INSERT IGNORE INTO t (a) VALUES (ST_GeomFromText("POINT(1 1)"));
SELECT * FROM t;
a	b
DELETE FROM t;
DELETE IGNORE FROM t;
CHECK TABLE t;
Table	Op	Msg_type	Msg_text
test.t	check	status	OK
DROP TABLE t;
# Testing example of type LINESTRING and value ST_GeomFromText("LINESTRING(0 0,1 1,2 2)")
SHOW CREATE TABLE t;
Table	Create Table
t	CREATE TABLE `t` (
  `a` linestring NOT NULL,
  `b` linestring GENERATED ALWAYS AS (`a`) VIRTUAL NOT NULL
) ENGINE=InnoDB DEFAULT CHARSET=utf8mb4 COLLATE=utf8mb4_0900_ai_ci
INSERT IGNORE INTO t (a) VALUES (ST_GeomFromText("LINESTRING(0 0,1 1,2 2)"));
SELECT * FROM t;
a	b
                                ð?      ð?       @       @	                                ð?      ð?       @       @
DELETE FROM t;
DELETE IGNORE FROM t;
CHECK TABLE t;
Table	Op	Msg_type	Msg_text
test.t	check	status	OK
DROP TABLE t;
# Testing example of type POLYGON and value ST_GeomFromText("POLYGON((0 0,1 0,1 1,0 1,0 0),(5 5,7 5,7 7,5 7,5 5))")
SHOW CREATE TABLE t;
Table	Create Table
t	CREATE TABLE `t` (
  `a` polygon NOT NULL,
  `b` linestring GENERATED ALWAYS AS (`a`) VIRTUAL NOT NULL
) ENGINE=InnoDB DEFAULT CHARSET=utf8mb4 COLLATE=utf8mb4_0900_ai_ci
INSERT IGNORE INTO t (a) VALUES (ST_GeomFromText("POLYGON((0 0,1 0,1 1,0 1,0 0),(5 5,7 5,7 7,5 7,5 5))"));
SELECT * FROM t;
a	b
DELETE FROM t;
DELETE IGNORE FROM t;
CHECK TABLE t;
Table	Op	Msg_type	Msg_text
test.t	check	status	OK
DROP TABLE t;
#
# Testing virtual column of type POLYGON
#
# Testing example of type JSON and value "{}"
SHOW CREATE TABLE t;
Table	Create Table
t	CREATE TABLE `t` (
  `a` json NOT NULL,
  `b` polygon GENERATED ALWAYS AS (`a`) VIRTUAL NOT NULL
) ENGINE=InnoDB DEFAULT CHARSET=utf8mb4 COLLATE=utf8mb4_0900_ai_ci
INSERT IGNORE INTO t (a) VALUES ("{}");
SELECT * FROM t;
a	b
DELETE FROM t;
DELETE IGNORE FROM t;
CHECK TABLE t;
Table	Op	Msg_type	Msg_text
test.t	check	status	OK
DROP TABLE t;
# Testing example of type JSON and value '["hello beautiful world"]'
SHOW CREATE TABLE t;
Table	Create Table
t	CREATE TABLE `t` (
  `a` json NOT NULL,
  `b` polygon GENERATED ALWAYS AS (`a`) VIRTUAL NOT NULL
) ENGINE=InnoDB DEFAULT CHARSET=utf8mb4 COLLATE=utf8mb4_0900_ai_ci
INSERT IGNORE INTO t (a) VALUES ('["hello beautiful world"]');
SELECT * FROM t;
a	b
DELETE FROM t;
DELETE IGNORE FROM t;
CHECK TABLE t;
Table	Op	Msg_type	Msg_text
test.t	check	status	OK
DROP TABLE t;
# Testing example of type JSON and value "-1"
SHOW CREATE TABLE t;
Table	Create Table
t	CREATE TABLE `t` (
  `a` json NOT NULL,
  `b` polygon GENERATED ALWAYS AS (`a`) VIRTUAL NOT NULL
) ENGINE=InnoDB DEFAULT CHARSET=utf8mb4 COLLATE=utf8mb4_0900_ai_ci
INSERT IGNORE INTO t (a) VALUES ("-1");
SELECT * FROM t;
a	b
DELETE FROM t;
DELETE IGNORE FROM t;
CHECK TABLE t;
Table	Op	Msg_type	Msg_text
test.t	check	status	OK
DROP TABLE t;
# Testing example of type TINYINT and value -1
SHOW CREATE TABLE t;
Table	Create Table
t	CREATE TABLE `t` (
  `a` tinyint NOT NULL,
  `b` polygon GENERATED ALWAYS AS (`a`) VIRTUAL NOT NULL
) ENGINE=InnoDB DEFAULT CHARSET=utf8mb4 COLLATE=utf8mb4_0900_ai_ci
INSERT IGNORE INTO t (a) VALUES (-1);
SELECT * FROM t;
a	b
DELETE FROM t;
DELETE IGNORE FROM t;
CHECK TABLE t;
Table	Op	Msg_type	Msg_text
test.t	check	status	OK
DROP TABLE t;
# Testing example of type SMALLINT and value -1
SHOW CREATE TABLE t;
Table	Create Table
t	CREATE TABLE `t` (
  `a` smallint NOT NULL,
  `b` polygon GENERATED ALWAYS AS (`a`) VIRTUAL NOT NULL
) ENGINE=InnoDB DEFAULT CHARSET=utf8mb4 COLLATE=utf8mb4_0900_ai_ci
INSERT IGNORE INTO t (a) VALUES (-1);
SELECT * FROM t;
a	b
DELETE FROM t;
DELETE IGNORE FROM t;
CHECK TABLE t;
Table	Op	Msg_type	Msg_text
test.t	check	status	OK
DROP TABLE t;
# Testing example of type MEDIUMINT and value -1
SHOW CREATE TABLE t;
Table	Create Table
t	CREATE TABLE `t` (
  `a` mediumint NOT NULL,
  `b` polygon GENERATED ALWAYS AS (`a`) VIRTUAL NOT NULL
) ENGINE=InnoDB DEFAULT CHARSET=utf8mb4 COLLATE=utf8mb4_0900_ai_ci
INSERT IGNORE INTO t (a) VALUES (-1);
SELECT * FROM t;
a	b
DELETE FROM t;
DELETE IGNORE FROM t;
CHECK TABLE t;
Table	Op	Msg_type	Msg_text
test.t	check	status	OK
DROP TABLE t;
# Testing example of type INT and value 2000000000
SHOW CREATE TABLE t;
Table	Create Table
t	CREATE TABLE `t` (
  `a` int NOT NULL,
  `b` polygon GENERATED ALWAYS AS (`a`) VIRTUAL NOT NULL
) ENGINE=InnoDB DEFAULT CHARSET=utf8mb4 COLLATE=utf8mb4_0900_ai_ci
INSERT IGNORE INTO t (a) VALUES (2000000000);
SELECT * FROM t;
a	b
DELETE FROM t;
DELETE IGNORE FROM t;
CHECK TABLE t;
Table	Op	Msg_type	Msg_text
test.t	check	status	OK
DROP TABLE t;
# Testing example of type INT and value -2000000000
SHOW CREATE TABLE t;
Table	Create Table
t	CREATE TABLE `t` (
  `a` int NOT NULL,
  `b` polygon GENERATED ALWAYS AS (`a`) VIRTUAL NOT NULL
) ENGINE=InnoDB DEFAULT CHARSET=utf8mb4 COLLATE=utf8mb4_0900_ai_ci
INSERT IGNORE INTO t (a) VALUES (-2000000000);
SELECT * FROM t;
a	b
DELETE FROM t;
DELETE IGNORE FROM t;
CHECK TABLE t;
Table	Op	Msg_type	Msg_text
test.t	check	status	OK
DROP TABLE t;
# Testing example of type INT UNSIGNED and value 4000000000
SHOW CREATE TABLE t;
Table	Create Table
t	CREATE TABLE `t` (
  `a` int unsigned NOT NULL,
  `b` polygon GENERATED ALWAYS AS (`a`) VIRTUAL NOT NULL
) ENGINE=InnoDB DEFAULT CHARSET=utf8mb4 COLLATE=utf8mb4_0900_ai_ci
INSERT IGNORE INTO t (a) VALUES (4000000000);
SELECT * FROM t;
a	b
DELETE FROM t;
DELETE IGNORE FROM t;
CHECK TABLE t;
Table	Op	Msg_type	Msg_text
test.t	check	status	OK
DROP TABLE t;
# Testing example of type BIGINT and value 2000000000000000000
SHOW CREATE TABLE t;
Table	Create Table
t	CREATE TABLE `t` (
  `a` bigint NOT NULL,
  `b` polygon GENERATED ALWAYS AS (`a`) VIRTUAL NOT NULL
) ENGINE=InnoDB DEFAULT CHARSET=utf8mb4 COLLATE=utf8mb4_0900_ai_ci
INSERT IGNORE INTO t (a) VALUES (2000000000000000000);
SELECT * FROM t;
a	b
DELETE FROM t;
DELETE IGNORE FROM t;
CHECK TABLE t;
Table	Op	Msg_type	Msg_text
test.t	check	status	OK
DROP TABLE t;
# Testing example of type BIGINT and value -2000000000000000000
SHOW CREATE TABLE t;
Table	Create Table
t	CREATE TABLE `t` (
  `a` bigint NOT NULL,
  `b` polygon GENERATED ALWAYS AS (`a`) VIRTUAL NOT NULL
) ENGINE=InnoDB DEFAULT CHARSET=utf8mb4 COLLATE=utf8mb4_0900_ai_ci
INSERT IGNORE INTO t (a) VALUES (-2000000000000000000);
SELECT * FROM t;
a	b
DELETE FROM t;
DELETE IGNORE FROM t;
CHECK TABLE t;
Table	Op	Msg_type	Msg_text
test.t	check	status	OK
DROP TABLE t;
# Testing example of type FLOAT and value -1.23456
SHOW CREATE TABLE t;
Table	Create Table
t	CREATE TABLE `t` (
  `a` float NOT NULL,
  `b` polygon GENERATED ALWAYS AS (`a`) VIRTUAL NOT NULL
) ENGINE=InnoDB DEFAULT CHARSET=utf8mb4 COLLATE=utf8mb4_0900_ai_ci
INSERT IGNORE INTO t (a) VALUES (-1.23456);
SELECT * FROM t;
a	b
DELETE FROM t;
DELETE IGNORE FROM t;
CHECK TABLE t;
Table	Op	Msg_type	Msg_text
test.t	check	status	OK
DROP TABLE t;
# Testing example of type FLOAT and value -1e38
SHOW CREATE TABLE t;
Table	Create Table
t	CREATE TABLE `t` (
  `a` float NOT NULL,
  `b` polygon GENERATED ALWAYS AS (`a`) VIRTUAL NOT NULL
) ENGINE=InnoDB DEFAULT CHARSET=utf8mb4 COLLATE=utf8mb4_0900_ai_ci
INSERT IGNORE INTO t (a) VALUES (-1e38);
SELECT * FROM t;
a	b
DELETE FROM t;
DELETE IGNORE FROM t;
CHECK TABLE t;
Table	Op	Msg_type	Msg_text
test.t	check	status	OK
DROP TABLE t;
# Testing example of type FLOAT and value 1e38
SHOW CREATE TABLE t;
Table	Create Table
t	CREATE TABLE `t` (
  `a` float NOT NULL,
  `b` polygon GENERATED ALWAYS AS (`a`) VIRTUAL NOT NULL
) ENGINE=InnoDB DEFAULT CHARSET=utf8mb4 COLLATE=utf8mb4_0900_ai_ci
INSERT IGNORE INTO t (a) VALUES (1e38);
SELECT * FROM t;
a	b
DELETE FROM t;
DELETE IGNORE FROM t;
CHECK TABLE t;
Table	Op	Msg_type	Msg_text
test.t	check	status	OK
DROP TABLE t;
# Testing example of type DOUBLE and value -1.23456789012345
SHOW CREATE TABLE t;
Table	Create Table
t	CREATE TABLE `t` (
  `a` double NOT NULL,
  `b` polygon GENERATED ALWAYS AS (`a`) VIRTUAL NOT NULL
) ENGINE=InnoDB DEFAULT CHARSET=utf8mb4 COLLATE=utf8mb4_0900_ai_ci
INSERT IGNORE INTO t (a) VALUES (-1.23456789012345);
SELECT * FROM t;
a	b
DELETE FROM t;
DELETE IGNORE FROM t;
CHECK TABLE t;
Table	Op	Msg_type	Msg_text
test.t	check	status	OK
DROP TABLE t;
# Testing example of type DOUBLE and value 1.23456789012345
SHOW CREATE TABLE t;
Table	Create Table
t	CREATE TABLE `t` (
  `a` double NOT NULL,
  `b` polygon GENERATED ALWAYS AS (`a`) VIRTUAL NOT NULL
) ENGINE=InnoDB DEFAULT CHARSET=utf8mb4 COLLATE=utf8mb4_0900_ai_ci
INSERT IGNORE INTO t (a) VALUES (1.23456789012345);
SELECT * FROM t;
a	b
DELETE FROM t;
DELETE IGNORE FROM t;
CHECK TABLE t;
Table	Op	Msg_type	Msg_text
test.t	check	status	OK
DROP TABLE t;
# Testing example of type DOUBLE and value -1e300
SHOW CREATE TABLE t;
Table	Create Table
t	CREATE TABLE `t` (
  `a` double NOT NULL,
  `b` polygon GENERATED ALWAYS AS (`a`) VIRTUAL NOT NULL
) ENGINE=InnoDB DEFAULT CHARSET=utf8mb4 COLLATE=utf8mb4_0900_ai_ci
INSERT IGNORE INTO t (a) VALUES (-1e300);
SELECT * FROM t;
a	b
DELETE FROM t;
DELETE IGNORE FROM t;
CHECK TABLE t;
Table	Op	Msg_type	Msg_text
test.t	check	status	OK
DROP TABLE t;
# Testing example of type DOUBLE and value 1e300
SHOW CREATE TABLE t;
Table	Create Table
t	CREATE TABLE `t` (
  `a` double NOT NULL,
  `b` polygon GENERATED ALWAYS AS (`a`) VIRTUAL NOT NULL
) ENGINE=InnoDB DEFAULT CHARSET=utf8mb4 COLLATE=utf8mb4_0900_ai_ci
INSERT IGNORE INTO t (a) VALUES (1e300);
SELECT * FROM t;
a	b
DELETE FROM t;
DELETE IGNORE FROM t;
CHECK TABLE t;
Table	Op	Msg_type	Msg_text
test.t	check	status	OK
DROP TABLE t;
# Testing example of type DECIMAL(4,2) and value -10.99
SHOW CREATE TABLE t;
Table	Create Table
t	CREATE TABLE `t` (
  `a` decimal(4,2) NOT NULL,
  `b` polygon GENERATED ALWAYS AS (`a`) VIRTUAL NOT NULL
) ENGINE=InnoDB DEFAULT CHARSET=utf8mb4 COLLATE=utf8mb4_0900_ai_ci
INSERT IGNORE INTO t (a) VALUES (-10.99);
SELECT * FROM t;
a	b
DELETE FROM t;
DELETE IGNORE FROM t;
CHECK TABLE t;
Table	Op	Msg_type	Msg_text
test.t	check	status	OK
DROP TABLE t;
# Testing example of type DECIMAL(34,4) and value 20000000000000000000000000000.0001
SHOW CREATE TABLE t;
Table	Create Table
t	CREATE TABLE `t` (
  `a` decimal(34,4) NOT NULL,
  `b` polygon GENERATED ALWAYS AS (`a`) VIRTUAL NOT NULL
) ENGINE=InnoDB DEFAULT CHARSET=utf8mb4 COLLATE=utf8mb4_0900_ai_ci
INSERT IGNORE INTO t (a) VALUES (20000000000000000000000000000.0001);
SELECT * FROM t;
a	b
DELETE FROM t;
DELETE IGNORE FROM t;
CHECK TABLE t;
Table	Op	Msg_type	Msg_text
test.t	check	status	OK
DROP TABLE t;
# Testing example of type DECIMAL(34,4) and value -20000000000000000000000000000.0001
SHOW CREATE TABLE t;
Table	Create Table
t	CREATE TABLE `t` (
  `a` decimal(34,4) NOT NULL,
  `b` polygon GENERATED ALWAYS AS (`a`) VIRTUAL NOT NULL
) ENGINE=InnoDB DEFAULT CHARSET=utf8mb4 COLLATE=utf8mb4_0900_ai_ci
INSERT IGNORE INTO t (a) VALUES (-20000000000000000000000000000.0001);
SELECT * FROM t;
a	b
DELETE FROM t;
DELETE IGNORE FROM t;
CHECK TABLE t;
Table	Op	Msg_type	Msg_text
test.t	check	status	OK
DROP TABLE t;
# Testing example of type BIT(64) and value 0xDEADBEEFC0FEBABE
SHOW CREATE TABLE t;
Table	Create Table
t	CREATE TABLE `t` (
  `a` bit(64) NOT NULL,
  `b` polygon GENERATED ALWAYS AS (`a`) VIRTUAL NOT NULL
) ENGINE=InnoDB DEFAULT CHARSET=utf8mb4 COLLATE=utf8mb4_0900_ai_ci
INSERT IGNORE INTO t (a) VALUES (0xDEADBEEFC0FEBABE);
SELECT * FROM t;
a	b
DELETE FROM t;
DELETE IGNORE FROM t;
CHECK TABLE t;
Table	Op	Msg_type	Msg_text
test.t	check	status	OK
DROP TABLE t;
# Testing example of type BIT(4) and value 0b1000
SHOW CREATE TABLE t;
Table	Create Table
t	CREATE TABLE `t` (
  `a` bit(4) NOT NULL,
  `b` polygon GENERATED ALWAYS AS (`a`) VIRTUAL NOT NULL
) ENGINE=InnoDB DEFAULT CHARSET=utf8mb4 COLLATE=utf8mb4_0900_ai_ci
INSERT IGNORE INTO t (a) VALUES (0b1000);
SELECT * FROM t;
a	b
DELETE FROM t;
DELETE IGNORE FROM t;
CHECK TABLE t;
Table	Op	Msg_type	Msg_text
test.t	check	status	OK
DROP TABLE t;
# Testing example of type YEAR and value 2020
SHOW CREATE TABLE t;
Table	Create Table
t	CREATE TABLE `t` (
  `a` year NOT NULL,
  `b` polygon GENERATED ALWAYS AS (`a`) VIRTUAL NOT NULL
) ENGINE=InnoDB DEFAULT CHARSET=utf8mb4 COLLATE=utf8mb4_0900_ai_ci
INSERT IGNORE INTO t (a) VALUES (2020);
SELECT * FROM t;
a	b
DELETE FROM t;
DELETE IGNORE FROM t;
CHECK TABLE t;
Table	Op	Msg_type	Msg_text
test.t	check	status	OK
DROP TABLE t;
# Testing example of type DATE and value "2030-04-05"
SHOW CREATE TABLE t;
Table	Create Table
t	CREATE TABLE `t` (
  `a` date NOT NULL,
  `b` polygon GENERATED ALWAYS AS (`a`) VIRTUAL NOT NULL
) ENGINE=InnoDB DEFAULT CHARSET=utf8mb4 COLLATE=utf8mb4_0900_ai_ci
INSERT IGNORE INTO t (a) VALUES ("2030-04-05");
SELECT * FROM t;
a	b
DELETE FROM t;
DELETE IGNORE FROM t;
CHECK TABLE t;
Table	Op	Msg_type	Msg_text
test.t	check	status	OK
DROP TABLE t;
# Testing example of type TIME and value "11:12:13"
SHOW CREATE TABLE t;
Table	Create Table
t	CREATE TABLE `t` (
  `a` time NOT NULL,
  `b` polygon GENERATED ALWAYS AS (`a`) VIRTUAL NOT NULL
) ENGINE=InnoDB DEFAULT CHARSET=utf8mb4 COLLATE=utf8mb4_0900_ai_ci
INSERT IGNORE INTO t (a) VALUES ("11:12:13");
SELECT * FROM t;
a	b
DELETE FROM t;
DELETE IGNORE FROM t;
CHECK TABLE t;
Table	Op	Msg_type	Msg_text
test.t	check	status	OK
DROP TABLE t;
# Testing example of type DATETIME and value "2030-04-05 11:12:13"
SHOW CREATE TABLE t;
Table	Create Table
t	CREATE TABLE `t` (
  `a` datetime NOT NULL,
  `b` polygon GENERATED ALWAYS AS (`a`) VIRTUAL NOT NULL
) ENGINE=InnoDB DEFAULT CHARSET=utf8mb4 COLLATE=utf8mb4_0900_ai_ci
INSERT IGNORE INTO t (a) VALUES ("2030-04-05 11:12:13");
SELECT * FROM t;
a	b
DELETE FROM t;
DELETE IGNORE FROM t;
CHECK TABLE t;
Table	Op	Msg_type	Msg_text
test.t	check	status	OK
DROP TABLE t;
# Testing example of type TIMESTAMP and value "2030-04-05 11:12:13"
SHOW CREATE TABLE t;
Table	Create Table
t	CREATE TABLE `t` (
  `a` timestamp NOT NULL,
  `b` polygon GENERATED ALWAYS AS (`a`) VIRTUAL NOT NULL
) ENGINE=InnoDB DEFAULT CHARSET=utf8mb4 COLLATE=utf8mb4_0900_ai_ci
INSERT IGNORE INTO t (a) VALUES ("2030-04-05 11:12:13");
SELECT * FROM t;
a	b
DELETE FROM t;
DELETE IGNORE FROM t;
CHECK TABLE t;
Table	Op	Msg_type	Msg_text
test.t	check	status	OK
DROP TABLE t;
# Testing example of type CHAR(40) and value "2000000000000000000000000000000000000"
SHOW CREATE TABLE t;
Table	Create Table
t	CREATE TABLE `t` (
  `a` char(40) NOT NULL,
  `b` polygon GENERATED ALWAYS AS (`a`) VIRTUAL NOT NULL
) ENGINE=InnoDB DEFAULT CHARSET=utf8mb4 COLLATE=utf8mb4_0900_ai_ci
INSERT IGNORE INTO t (a) VALUES ("2000000000000000000000000000000000000");
SELECT * FROM t;
a	b
DELETE FROM t;
DELETE IGNORE FROM t;
CHECK TABLE t;
Table	Op	Msg_type	Msg_text
test.t	check	status	OK
DROP TABLE t;
# Testing example of type BINARY(45) and value "200000000000000000000000000000000000000000"
SHOW CREATE TABLE t;
Table	Create Table
t	CREATE TABLE `t` (
  `a` binary(45) NOT NULL,
  `b` polygon GENERATED ALWAYS AS (`a`) VIRTUAL NOT NULL
) ENGINE=InnoDB DEFAULT CHARSET=utf8mb4 COLLATE=utf8mb4_0900_ai_ci
INSERT IGNORE INTO t (a) VALUES ("200000000000000000000000000000000000000000");
SELECT * FROM t;
a	b
DELETE FROM t;
DELETE IGNORE FROM t;
CHECK TABLE t;
Table	Op	Msg_type	Msg_text
test.t	check	status	OK
DROP TABLE t;
# Testing example of type VARCHAR(50) and value "2000000000000000000000000000000000000000000000000"
SHOW CREATE TABLE t;
Table	Create Table
t	CREATE TABLE `t` (
  `a` varchar(50) NOT NULL,
  `b` polygon GENERATED ALWAYS AS (`a`) VIRTUAL NOT NULL
) ENGINE=InnoDB DEFAULT CHARSET=utf8mb4 COLLATE=utf8mb4_0900_ai_ci
INSERT IGNORE INTO t (a) VALUES ("2000000000000000000000000000000000000000000000000");
SELECT * FROM t;
a	b
DELETE FROM t;
DELETE IGNORE FROM t;
CHECK TABLE t;
Table	Op	Msg_type	Msg_text
test.t	check	status	OK
DROP TABLE t;
# Testing example of type CHAR(24) and value "hello beautiful world"
SHOW CREATE TABLE t;
Table	Create Table
t	CREATE TABLE `t` (
  `a` char(24) NOT NULL,
  `b` polygon GENERATED ALWAYS AS (`a`) VIRTUAL NOT NULL
) ENGINE=InnoDB DEFAULT CHARSET=utf8mb4 COLLATE=utf8mb4_0900_ai_ci
INSERT IGNORE INTO t (a) VALUES ("hello beautiful world");
SELECT * FROM t;
a	b
DELETE FROM t;
DELETE IGNORE FROM t;
CHECK TABLE t;
Table	Op	Msg_type	Msg_text
test.t	check	status	OK
DROP TABLE t;
# Testing example of type BINARY(12) and value "hello world"
SHOW CREATE TABLE t;
Table	Create Table
t	CREATE TABLE `t` (
  `a` binary(12) NOT NULL,
  `b` polygon GENERATED ALWAYS AS (`a`) VIRTUAL NOT NULL
) ENGINE=InnoDB DEFAULT CHARSET=utf8mb4 COLLATE=utf8mb4_0900_ai_ci
INSERT IGNORE INTO t (a) VALUES ("hello world");
SELECT * FROM t;
a	b
DELETE FROM t;
DELETE IGNORE FROM t;
CHECK TABLE t;
Table	Op	Msg_type	Msg_text
test.t	check	status	OK
DROP TABLE t;
# Testing example of type VARCHAR(6) and value "hello"
SHOW CREATE TABLE t;
Table	Create Table
t	CREATE TABLE `t` (
  `a` varchar(6) NOT NULL,
  `b` polygon GENERATED ALWAYS AS (`a`) VIRTUAL NOT NULL
) ENGINE=InnoDB DEFAULT CHARSET=utf8mb4 COLLATE=utf8mb4_0900_ai_ci
INSERT IGNORE INTO t (a) VALUES ("hello");
SELECT * FROM t;
a	b
DELETE FROM t;
DELETE IGNORE FROM t;
CHECK TABLE t;
Table	Op	Msg_type	Msg_text
test.t	check	status	OK
DROP TABLE t;
# Testing example of type ENUM("up","down") and value "up"
SHOW CREATE TABLE t;
Table	Create Table
t	CREATE TABLE `t` (
  `a` enum('up','down') NOT NULL,
  `b` polygon GENERATED ALWAYS AS (`a`) VIRTUAL NOT NULL
) ENGINE=InnoDB DEFAULT CHARSET=utf8mb4 COLLATE=utf8mb4_0900_ai_ci
INSERT IGNORE INTO t (a) VALUES ("up");
SELECT * FROM t;
a	b
DELETE FROM t;
DELETE IGNORE FROM t;
CHECK TABLE t;
Table	Op	Msg_type	Msg_text
test.t	check	status	OK
DROP TABLE t;
# Testing example of type SET("up","down") and value "up,down"
SHOW CREATE TABLE t;
Table	Create Table
t	CREATE TABLE `t` (
  `a` set('up','down') NOT NULL,
  `b` polygon GENERATED ALWAYS AS (`a`) VIRTUAL NOT NULL
) ENGINE=InnoDB DEFAULT CHARSET=utf8mb4 COLLATE=utf8mb4_0900_ai_ci
INSERT IGNORE INTO t (a) VALUES ("up,down");
SELECT * FROM t;
a	b
DELETE FROM t;
DELETE IGNORE FROM t;
CHECK TABLE t;
Table	Op	Msg_type	Msg_text
test.t	check	status	OK
DROP TABLE t;
# Testing example of type GEOMETRY and value ST_GeomFromText("POINT(1 1)")
SHOW CREATE TABLE t;
Table	Create Table
t	CREATE TABLE `t` (
  `a` geometry NOT NULL,
  `b` polygon GENERATED ALWAYS AS (`a`) VIRTUAL NOT NULL
) ENGINE=InnoDB DEFAULT CHARSET=utf8mb4 COLLATE=utf8mb4_0900_ai_ci
INSERT IGNORE INTO t (a) VALUES (ST_GeomFromText("POINT(1 1)"));
SELECT * FROM t;
a	b
DELETE FROM t;
DELETE IGNORE FROM t;
CHECK TABLE t;
Table	Op	Msg_type	Msg_text
test.t	check	status	OK
DROP TABLE t;
# Testing example of type POINT and value ST_GeomFromText("POINT(1 1)")
SHOW CREATE TABLE t;
Table	Create Table
t	CREATE TABLE `t` (
  `a` point NOT NULL,
  `b` polygon GENERATED ALWAYS AS (`a`) VIRTUAL NOT NULL
) ENGINE=InnoDB DEFAULT CHARSET=utf8mb4 COLLATE=utf8mb4_0900_ai_ci
INSERT IGNORE INTO t (a) VALUES (ST_GeomFromText("POINT(1 1)"));
SELECT * FROM t;
a	b
DELETE FROM t;
DELETE IGNORE FROM t;
CHECK TABLE t;
Table	Op	Msg_type	Msg_text
test.t	check	status	OK
DROP TABLE t;
# Testing example of type LINESTRING and value ST_GeomFromText("LINESTRING(0 0,1 1,2 2)")
SHOW CREATE TABLE t;
Table	Create Table
t	CREATE TABLE `t` (
  `a` linestring NOT NULL,
  `b` polygon GENERATED ALWAYS AS (`a`) VIRTUAL NOT NULL
) ENGINE=InnoDB DEFAULT CHARSET=utf8mb4 COLLATE=utf8mb4_0900_ai_ci
INSERT IGNORE INTO t (a) VALUES (ST_GeomFromText("LINESTRING(0 0,1 1,2 2)"));
SELECT * FROM t;
a	b
DELETE FROM t;
DELETE IGNORE FROM t;
CHECK TABLE t;
Table	Op	Msg_type	Msg_text
test.t	check	status	OK
DROP TABLE t;
# Testing example of type POLYGON and value ST_GeomFromText("POLYGON((0 0,1 0,1 1,0 1,0 0),(5 5,7 5,7 7,5 7,5 5))")
SHOW CREATE TABLE t;
Table	Create Table
t	CREATE TABLE `t` (
  `a` polygon NOT NULL,
  `b` polygon GENERATED ALWAYS AS (`a`) VIRTUAL NOT NULL
) ENGINE=InnoDB DEFAULT CHARSET=utf8mb4 COLLATE=utf8mb4_0900_ai_ci
INSERT IGNORE INTO t (a) VALUES (ST_GeomFromText("POLYGON((0 0,1 0,1 1,0 1,0 0),(5 5,7 5,7 7,5 7,5 5))"));
SELECT * FROM t;
a	b
                                   ð?              ð?      ð?              ð?                         @      @      @      @      @      @      @      @      @      @	                                   ð?              ð?      ð?              ð?                         @      @      @      @      @      @      @      @      @      @
DELETE FROM t;
DELETE IGNORE FROM t;
CHECK TABLE t;
Table	Op	Msg_type	Msg_text
test.t	check	status	OK
DROP TABLE t;
DROP TABLE data_types;
DROP TABLE data_examples;
SET timestamp=DEFAULT;
